Sheet: OneCountryCharts
A1: Dataset from: "Aggregating Governance Indicators" and "Governance Matters" Daniel Kaufmann, Aart Kraay and Pablo Zoido-Lobaton, May 2000
A5: Note: For quick reference, use the commands below. For more detailed usage, please read the "Documentation" sheet first.
A7: If you want to see how a particular country ranks in terms of governance indicatorsâ€¦
A8: Enter the country name in the green box below:
C11: The country you chose is: | F11: =IF(R[-2]C[-2]="","",IF(VLOOKUP(R[-2]C[-2],OneCountryData!R[-6]C[7]:R[176]C[8],2,0)=1,VLOOKUP(VLOOKUP(R[-2]C[-2],OneCountryData!R[-6]C[7]:R[176]C[9],3,0),OneCountryData!R[-6]C[6]:R[176]C[7],2,0),"")) -> 
A13: Note: Sometimes, the official name of the country might be different from its usual name. If this is the case, or if the country does not exist in this database, you will get an error message (NA()) on the green box above, look in the quick reference tool below for the code of the country, and type (do not copy and paste) the code in the blue box below. Caution: do not edit, delete or modify the content of any of the cells other than the green one and the orange one.
C17: The country you chose is: | F17: =IF(R[-2]C[-1]="","",VLOOKUP(R[-2]C[-1],OneCountryData!R[-12]C[6]:R[170]C[7],2,0)) -> 
B19: You can see the results in the next two sheets: "Bar Chart" and "Diamond Chart." Both charts answer the same question: in percentage terms, how many countries rank WORSE than the country you chose on each of the 6 indicators. Thus, a higher number is better, because it means more countries in the world rank worse rather than better than the country of your choice. Remember: these results are only estimates, described by the blue bars in the "Bar Chart" and by the thick black line in the "Diamond Chart." The error associated with these estimates (calculated with 90% confidence) is described by the thin red lines in the "Bar Chart" and by the shaded area in the "Diamond Chart" respectively.
C28: Important:
C29: You can also choose one of the following country groups:
C31: Eastern Europe and Former Soviet Union | F31: EE/FSU
C32: Asia | F32: ASI
C33: Africa | F33: AFR
C34: Latin America | F34: LAC
C35: OECD | F35: OECD
C38: Quick Reference Tool:
B39: Use the left arrow to select the country you are interested in. The code of the country appears under the right hand arrow. Input this code in the orange box above to get the desired charts
E42: Country Name | F42: Country Code
E43: Afghanistan | F43: AFG
E44: Angola | F44: AGO
E45: Albania | F45: ALB
E46: United Arab Emirates | F46: ARE
E47: Argentina | F47: ARG
E48: Armenia | F48: ARM
E49: Australia | F49: AUS
E50: Austria | F50: AUT
E51: Azerbaijan | F51: AZE
E52: Burundi | F52: BDI
E53: Belgium | F53: BEL
E54: Benin | F54: BEN
E55: Burkina Faso | F55: BFA
E56: Bangladesh | F56: BGD
E57: Bulgaria | F57: BGR
E58: Bahrain | F58: BHR
E59: Bahamas, The | F59: BHS
E60: Bosnia and Herzegovina | F60: BIH
E61: Belarus | F61: BLR
E62: Belize | F62: BLZ
E63: Bolivia | F63: BOL
E64: Brazil | F64: BRA
E65: Barbados | F65: BRB
E66: Brunei | F66: BRN
E67: Bhutan | F67: BTN
E68: Botswana | F68: BWA
E69: Central African Republic | F69: CAF
E70: Canada | F70: CAN
E71: Switzerland | F71: CHE
E72: Chile | F72: CHL
E73: China | F73: CHN
E74: Cote d'Ivoire | F74: CIV
E75: Cameroon | F75: CMR
E76: Congo, Rep. | F76: COG
E77: Colombia | F77: COL
E78: Comoros | F78: COM
E79: Cape verde | F79: CPV
E80: Costa Rica | F80: CRI
E81: Cuba | F81: CUB
E82: Cyprus | F82: CYP
E83: Czech Republic | F83: CZE
E84: Germany | F84: DEU
E85: Djibouti | F85: DJI
E86: Denmark | F86: DNK
E87: Dominican Republic | F87: DOM
E88: Algeria | F88: DZA
E89: Ecuador | F89: ECU
E90: Egypt, Arab Rep. | F90: EGY
E91: Eritrea | F91: ERI
E92: Spain | F92: ESP
E93: Estonia | F93: EST
E94: Ethiopia | F94: ETH
E95: Finland | F95: FIN
E96: Fiji | F96: FJI
E97: France | F97: FRA
E98: Gabon | F98: GAB
E99: United Kingdom | F99: GBR
E100: Georgia | F100: GEO
E101: Ghana | F101: GHA
E102: Guinea | F102: GIN
E103: Guadeloupe | F103: GLP
E104: Gambia, The | F104: GMB
E105: Guinea-Bissau | F105: GNB
E106: Equatorial Guinea | F106: GNQ
E107: Greece | F107: GRC
E108: Guatemala | F108: GTM
E109: Guyana | F109: GUY
E110: Hong Kong, China | F110: HKG
E111: Honduras | F111: HND
E112: Croatia | F112: HRV
E113: Haiti | F113: HTI
E114: Hungary | F114: HUN
E115: Indonesia | F115: IDN
E116: India | F116: IND
E117: Ireland | F117: IRL
E118: Iran, Islamic Rep. | F118: IRN
E119: Iraq | F119: IRQ
E120: Iceland | F120: ISL
E121: Israel | F121: ISR
E122: Italy | F122: ITA
E123: Jamaica | F123: JAM
E124: Jordan | F124: JOR
E125: Japan | F125: JPN
E126: Kazakhstan | F126: KAZ
E127: Kenya | F127: KEN
E128: Kyrgyz Republic | F128: KGZ
E129: Cambodia | F129: KHM
E130: Korea, Rep. | F130: KOR
E131: Kuwait | F131: KWT
E132: Lao, PDR | F132: LAO
E133: Lebanon | F133: LBN
E134: Liberia | F134: LBR
E135: Libya | F135: LBY
E136: Sri Lanka | F136: LKA
E137: Lesotho | F137: LSO
E138: Lithuania | F138: LTU
E139: Luxembourg | F139: LUX
E140: Latvia | F140: LVA
E141: Macao, China | F141: MAC
E142: Morocco | F142: MAR
E143: Moldova | F143: MDA
E144: Madagascar | F144: MDG
E145: Maldives | F145: MDV
E146: Mexico | F146: MEX
E147: Macedonia, FYR | F147: MKD
E148: Mali | F148: MLI
E149: Malta | F149: MLT
E150: Myanmar | F150: MMR
E151: Mongolia | F151: MNG
E152: Mozambique | F152: MOZ
E153: Mauritania | F153: MRT
E154: Martinique | F154: MTQ
E155: Mauritius | F155: MUS
E156: Malawi | F156: MWI
E157: Malaysia | F157: MYS
E158: Namibia | F158: NAM
E159: Niger | F159: NER
E160: Nigeria | F160: NGA
E161: Nicaragua | F161: NIC
E162: Netherlands | F162: NLD
E163: Norway | F163: NOR
E164: Nepal | F164: NPL
E165: New Zealand | F165: NZL
E166: Oman | F166: OMN
E167: Pakistan | F167: PAK
E168: Panama | F168: PAN
E169: Peru | F169: PER
E170: Philippines | F170: PHL
E171: Papua New Guinea | F171: PNG
E172: Poland | F172: POL
E173: Puerto Rico | F173: PRI
E174: Korea, Dem. Rep. | F174: PRK
E175: Portugal | F175: PRT
E176: Paraguay | F176: PRY
E177: Qatar | F177: QAT
E178: Reunion | F178: REU
E179: Romania | F179: ROM
E180: Russian Federation | F180: RUS
E181: Rwanda | F181: RWA
E182: Saudi Arabia | F182: SAU
E183: Sudan | F183: SDN
E184: Senegal | F184: SEN
E185: Singapore | F185: SGP
E186: Solomon Islands | F186: SLB
E187: Sierra Leone | F187: SLE
E188: El Salvador | F188: SLV
E189: Somalia | F189: SOM
E190: Sao Tome and Principe and Pr | F190: STP
E191: Suriname | F191: SUR
E192: Slovak Republic | F192: SVK
E193: Slovenia | F193: SVN
E194: Sweden | F194: SWE
E195: Swaziland | F195: SWZ
E196: Syrian Arab Republic | F196: SYR
E197: Chad | F197: TCD
E198: Togo | F198: TGO
E199: Thailand | F199: THA
E200: Tajikistan | F200: TJK
E201: Turkmenistan | F201: TKM
E202: Trinidad and Tobago& Tob* | F202: TTO
E203: Tunisia | F203: TUN
E204: Turkey | F204: TUR
E205: Taiwan, China | F205: TWN
E206: Tanzania | F206: TZA
E207: Uganda | F207: UGA
E208: Ukraine | F208: UKR
E209: Uruguay | F209: URY
E210: United States | F210: USA
E211: Uzbekistan | F211: UZB
E212: Venezuela, RB | F212: VEN
E213: Vietnam | F213: VNM
E214: West Bank and Gaza | F214: WTB
E215: Yemen, Rep. | F215: YEM
E216: Yugoslavia, FR (Serbia/Montenegro) | F216: YUG
E217: South Africa | F217: ZAF
E218: Congo, Dem. Rep. | F218: ZAR
E219: Zambia | F219: ZMB
E220: Zimbabwe | F220: ZWE
E221: Eastern Europe and Formaer Soviet Union | F221: EE/FSU
E222: Asia | F222: ASI
E223: Africa | F223: AFR
E224: Latin America | F224: LAC
E225: OECD | F225: OECD

Sheet: ComparativeCharts
A1: Dataset from: "Aggregating Governance Indicators" and "Governance Matters" Daniel Kaufmann, Aart Kraay and Pablo Zoido-Lobaton, May 2000
A5: Note: For quick reference, use the commands below. For more detailed usage, please read the "Documentation" sheet first.
A7: If you want to see how a group of countries rank comparatively in terms of governance indicatorsâ€¦
A8: Enter a "1" in the red column on the left of the country code for each of the countries you are interested in:
B10: You can see the results in the next 6 sheets: "VA" (Voice and Accountability), "PIV" (Political Instability and Violence"), "GE" (Government Effectiveness), "RB" (Regulatory Burden"), "RL" (Rule of Law) and "GR" (Graft). Each chart presents the estimated value of the indicator for all the countries in the database, with the countries of your choice being highlited. The error associated with these estimates (calculated with 90% confidence) is described by the thin lines that accompany each estimation point.
B19: Country Name | C19: Country Code | D19: Choose Country Here
B20: Afghanistan | C20: AFG | D20: 1
B21: Angola | C21: AGO
B22: Albania | C22: ALB
B23: United Arab Emirates | C23: ARE
B24: Argentina | C24: ARG
B25: Armenia | C25: ARM
B26: Australia | C26: AUS
B27: Austria | C27: AUT
B28: Azerbaijan | C28: AZE
B29: Burundi | C29: BDI
B30: Belgium | C30: BEL
B31: Benin | C31: BEN
B32: Burkina Faso | C32: BFA
B33: Bangladesh | C33: BGD
B34: Bulgaria | C34: BGR
B35: Bahrain | C35: BHR
B36: Bahamas, The | C36: BHS
B37: Bosnia and Herzegovina | C37: BIH
B38: Belarus | C38: BLR
B39: Belize | C39: BLZ
B40: Bolivia | C40: BOL
B41: Brazil | C41: BRA
B42: Barbados | C42: BRB
B43: Brunei | C43: BRN
B44: Bhutan | C44: BTN
B45: Botswana | C45: BWA | D45: 1
B46: Central African Republic | C46: CAF
B47: Canada | C47: CAN
B48: Switzerland | C48: CHE
B49: Chile | C49: CHL | D49: 1
B50: China | C50: CHN
B51: Cote d'Ivoire | C51: CIV
B52: Cameroon | C52: CMR
B53: Congo, Rep. | C53: COG
B54: Colombia | C54: COL
B55: Comoros | C55: COM
B56: Cape verde | C56: CPV
B57: Costa Rica | C57: CRI
B58: Cuba | C58: CUB
B59: Cyprus | C59: CYP
B60: Czech Republic | C60: CZE
B61: Germany | C61: DEU
B62: Djibouti | C62: DJI
B63: Denmark | C63: DNK
B64: Dominican Republic | C64: DOM
B65: Algeria | C65: DZA
B66: Ecuador | C66: ECU
B67: Egypt, Arab Rep. | C67: EGY
B68: Eritrea | C68: ERI
B69: Spain | C69: ESP
B70: Estonia | C70: EST
B71: Ethiopia | C71: ETH
B72: Finland | C72: FIN
B73: Fiji | C73: FJI
B74: France | C74: FRA
B75: Gabon | C75: GAB
B76: United Kingdom | C76: GBR
B77: Georgia | C77: GEO
B78: Ghana | C78: GHA
B79: Guinea | C79: GIN
B80: Guadeloupe | C80: GLP
B81: Gambia, The | C81: GMB
B82: Guinea-Bissau | C82: GNB
B83: Equatorial Guinea | C83: GNQ
B84: Greece | C84: GRC
B85: Guatemala | C85: GTM
B86: Guyana | C86: GUY
B87: Hong Kong, China | C87: HKG
B88: Honduras | C88: HND
B89: Croatia | C89: HRV
B90: Haiti | C90: HTI
B91: Hungary | C91: HUN
B92: Indonesia | C92: IDN | D92: 1
B93: India | C93: IND
B94: Ireland | C94: IRL
B95: Iran, Islamic Rep. | C95: IRN
B96: Iraq | C96: IRQ | D96: 1
B97: Iceland | C97: ISL
B98: Israel | C98: ISR
B99: Italy | C99: ITA
B100: Jamaica | C100: JAM | D100: 1
B101: Jordan | C101: JOR
B102: Japan | C102: JPN
B103: Kazakhstan | C103: KAZ
B104: Kenya | C104: KEN
B105: Kyrgyz Republic | C105: KGZ
B106: Cambodia | C106: KHM
B107: Korea, Rep. | C107: KOR
B108: Kuwait | C108: KWT
B109: Lao, PDR | C109: LAO
B110: Lebanon | C110: LBN
B111: Liberia | C111: LBR
B112: Libya | C112: LBY | D112: 1
B113: Sri Lanka | C113: LKA
B114: Lesotho | C114: LSO
B115: Lithuania | C115: LTU
B116: Luxembourg | C116: LUX
B117: Latvia | C117: LVA
B118: Macao, China | C118: MAC
B119: Morocco | C119: MAR
B120: Moldova | C120: MDA
B121: Madagascar | C121: MDG
B122: Maldives | C122: MDV
B123: Mexico | C123: MEX
B124: Macedonia, FYR | C124: MKD
B125: Mali | C125: MLI
B126: Malta | C126: MLT
B127: Myanmar | C127: MMR
B128: Mongolia | C128: MNG | D128: 1
B129: Mozambique | C129: MOZ
B130: Mauritania | C130: MRT
B131: Martinique | C131: MTQ
B132: Mauritius | C132: MUS
B133: Malawi | C133: MWI
B134: Malaysia | C134: MYS
B135: Namibia | C135: NAM
B136: Niger | C136: NER
B137: Nigeria | C137: NGA
B138: Nicaragua | C138: NIC
B139: Netherlands | C139: NLD | D139: 1
B140: Norway | C140: NOR
B141: Nepal | C141: NPL
B142: New Zealand | C142: NZL
B143: Oman | C143: OMN
B144: Pakistan | C144: PAK
B145: Panama | C145: PAN
B146: Peru | C146: PER
B147: Philippines | C147: PHL
B148: Papua New Guinea | C148: PNG
B149: Poland | C149: POL
B150: Puerto Rico | C150: PRI
B151: Korea, Dem. Rep. | C151: PRK
B152: Portugal | C152: PRT
B153: Paraguay | C153: PRY
B154: Qatar | C154: QAT
B155: Reunion | C155: REU
B156: Romania | C156: ROM
B157: Russian Federation | C157: RUS
B158: Rwanda | C158: RWA
B159: Saudi Arabia | C159: SAU
B160: Sudan | C160: SDN
B161: Senegal | C161: SEN
B162: Singapore | C162: SGP
B163: Solomon Islands | C163: SLB
B164: Sierra Leone | C164: SLE
B165: El Salvador | C165: SLV
B166: Somalia | C166: SOM
B167: Sao Tome and Principe and Pr | C167: STP
B168: Suriname | C168: SUR
B169: Slovak Republic | C169: SVK
B170: Slovenia | C170: SVN | D170: 1
B171: Sweden | C171: SWE
B172: Swaziland | C172: SWZ
B173: Syrian Arab Republic | C173: SYR
B174: Chad | C174: TCD
B175: Togo | C175: TGO
B176: Thailand | C176: THA
B177: Tajikistan | C177: TJK
B178: Turkmenistan | C178: TKM
B179: Trinidad and Tobago& Tob* | C179: TTO
B180: Tunisia | C180: TUN | D180: 1
B181: Turkey | C181: TUR
B182: Taiwan, China | C182: TWN
B183: Tanzania | C183: TZA
B184: Uganda | C184: UGA
B185: Ukraine | C185: UKR
B186: Uruguay | C186: URY
B187: United States | C187: USA
B188: Uzbekistan | C188: UZB
B189: Venezuela, RB | C189: VEN
B190: Vietnam | C190: VNM
B191: West Bank and Gaza | C191: WTB
B192: Yemen, Rep. | C192: YEM
B193: Yugoslavia, FR (Serbia/Montenegro) | C193: YUG
B194: South Africa | C194: ZAF
B195: Congo, Dem. Rep. | C195: ZAR
B196: Zambia | C196: ZMB
B197: Zimbabwe | C197: ZWE

Sheet: Data
D2: Voice and Accountability | G2: Political Instability and Violence | J2: Government Effectiveness | M2: Regulatory Burden | P2: Rule of Law | S2: Graft
D3: Estimate | E3: Standard Error | F3: # Indicators | G3: Estimate | H3: Standard Error | I3: # Indicators | J3: Estimate | K3: Standard Error | L3: # Indicators | M3: Estimate | N3: Standard Error | O3: # Indicators | P3: Estimate | Q3: Standard Error | R3: # Indicators | S3: Estimate | T3: Standard Error | U3: # Indicators
A5: 1 | B5: Afghanistan | C5: AFG | D5: -1.6163871673910992 | E5: 0.36031461549530619 | F5: 1 | G5: .. | H5: .. | I5: .. | J5: .. | K5: .. | L5: .. | M5: .. | N5: .. | O5: .. | P5: .. | Q5: .. | R5: .. | S5: .. | T5: .. | U5: ..
A6: 2 | B6: Angola | C6: AGO | D6: -1.0034270598269508 | E6: 0.25402694431067208 | F6: 3 | G6: -1.7846035962181079 | H6: 0.27905845743699148 | I6: 4 | J6: -1.390338884292103 | K6: 0.23533770853731531 | L6: 5 | M6: -0.70957546122155735 | N6: 0.29177868538636526 | O6: 4 | P6: -1.2250664457942559 | Q6: 0.27274644247184715 | R6: 5 | S6: -0.86303091604875526 | T6: 0.22310568461604569 | U6: 4
A7: 3 | B7: Albania | C7: ALB | D7: -7.7479767490819564E-3 | E7: 0.28728334123682875 | F7: 4 | G7: -1.0004086877827638 | H7: 0.25398901430107884 | I7: 4 | J7: -0.65337260333753588 | K7: 0.29434619800260248 | L7: 4 | M7: -0.69955471858828977 | N7: 0.2628266479146692 | O7: 5 | P7: -0.91777004729796774 | Q7: 0.19625062444278024 | R7: 6 | S7: -0.98509305269304992 | T7: 0.23187454055691353 | U7: 5
A8: 4 | B8: United Arab Emirates | C8: ARE | D8: -0.5446778787510238 | E8: 0.25402694431067208 | F8: 3 | G8: 0.82471151740840931 | H8: 0.29988188904282925 | I8: 3 | J8: 0.13828729996307365 | K8: 0.31908959204123422 | L8: 3 | M8: 0.29621944848933685 | N8: 0.39525422199815724 | O8: 3 | P8: 0.76749841340530323 | Q8: 0.27634968636657775 | R8: 4 | S8: -2.6886737681040048E-2 | T8: 0.26706317040829514 | U8: 3
A9: 5 | B9: Argentina | C9: ARG | D9: 0.4820887285645386 | E9: 0.25402694431067208 | F9: 4 | G9: 0.50683537219617303 | H9: 0.26334453452009404 | I9: 5 | J9: 0.26204437002148684 | K9: 0.24866131188801807 | L9: 6 | M9: 0.66752454892309154 | N9: 0.22904640098569978 | O9: 5 | P9: 0.31894253694853825 | Q9: 0.21813983950894791 | R9: 7 | S9: -0.27454750817661261 | T9: 0.19805508574877892 | U9: 7
A10: 6 | B10: Armenia | C10: ARM | D10: 1.8827951270447892E-2 | E10: 0.28728334123682875 | F10: 4 | G10: -0.45457877288103288 | H10: 0.25398901430107884 | I10: 4 | J10: -0.65466184670493954 | K10: 0.29434619800260248 | L10: 4 | M10: -0.57031754777027643 | N10: 0.2628266479146692 | O10: 5 | P10: -0.14626976465621802 | Q10: 0.19625062444278024 | R10: 6 | S10: -0.80318825754149814 | T10: 0.23187454055691353 | U10: 5
A11: 7 | B11: Australia | C11: AUS | D11: 1.6280489151912487 | E11: 0.25402694431067208 | F11: 4 | G11: 1.1841498643981401 | H11: 0.26334453452009404 | I11: 5 | J11: 1.4586935841992952 | K11: 0.24866131188801807 | L11: 6 | M11: 0.96197014685799465 | N11: 0.22904640098569978 | O11: 5 | P11: 1.5963410719730877 | Q11: 0.21813983950894791 | R11: 7 | S11: 1.6010837569932306 | T11: 0.2062763160225359 | U11: 6
A12: 8 | B12: Austria | C12: AUT | D12: 1.4471660015733396 | E12: 0.25130023322348893 | F12: 5 | G12: 1.3767994469196794 | H12: 0.25228486761247954 | I12: 6 | J12: 1.2187250838209753 | K12: 0.23363653218585126 | L12: 7 | M12: 0.90088083633492544 | N12: 0.22876000329023777 | O12: 6 | P12: 1.8123422751679548 | Q12: 0.20773727561581487 | R12: 8 | S12: 1.4571072810078207 | T12: 0.18909298753709736 | U12: 8
A13: 9 | B13: Azerbaijan | C13: AZE | D13: -0.91916406584670562 | E13: 0.25130023322348893 | F13: 5 | G13: -0.36344458241929206 | H13: 0.2347220744274687 | I13: 5 | J13: -0.83324863482836731 | K13: 0.24259893305862151 | L13: 5 | M13: -0.99736144864975973 | N13: 0.2628266479146692 | O13: 5 | P13: -0.56349409034291309 | Q13: 0.17954824109220222 | R13: 7 | S13: -0.99759969576951679 | T13: 0.18824314571543588 | U13: 6
A14: 10 | B14: Burundi | C14: BDI | D14: -1.2884691166555629 | E14: 0.36031461549530619 | F14: 1 | G14: .. | H14: .. | I14: .. | J14: .. | K14: .. | L14: .. | M14: -0.84581743863525027 | N14: 0.60188084442426626 | O14: 1 | P14: -0.88073658171586089 | Q14: 0.60058386521254259 | R14: 1 | S14: .. | T14: .. | U14: ..
A15: 11 | B15: Belgium | C15: BEL | D15: 1.4364193923806405 | E15: 0.25402694431067208 | F15: 4 | G15: 0.81771470597593032 | H15: 0.26334453452009404 | I15: 5 | J15: 0.88326173224899007 | K15: 0.24866131188801807 | L15: 6 | M15: 0.79383072480465788 | N15: 0.22904640098569978 | O15: 5 | P15: 0.79729522622895899 | Q15: 0.21813983950894791 | R15: 7 | S15: 0.67169323313295415 | T15: 0.19805508574877892 | U15: 7
A16: 12 | B16: Benin | C16: BEN | D16: 0.69461096437718883 | E16: 0.35265752232120906 | F16: 2 | G16: -0.93741018160258371 | H16: 0.66053614439227493 | I16: 1 | J16: -6.6464363883482369E-2 | K16: 0.5637075668724989 | L16: 1 | M16: -8.1537398210084697E-2 | N16: 0.59674094290048185 | O16: 2 | P16: -0.42206349271954474 | Q16: 0.45038851528650714 | R16: 2 | S16: -0.78081476958594132 | T16: 0.53653470441187612 | U16: 1
A17: 13 | B17: Burkina Faso | C17: BFA | D17: -0.21346292357511837 | E17: 0.29137760175532934 | F17: 2 | G17: -0.51662099737905565 | H17: 0.36279173932405639 | I17: 2 | J17: -5.9200859017791298E-2 | K17: 0.31735550250726685 | L17: 3 | M17: -3.782975907589714E-2 | N17: 0.33251863866145182 | O17: 3 | P17: -0.35005012439575683 | Q17: 0.42866208060882488 | R17: 3 | S17: -0.36764475284468895 | T17: 0.35684147672067407 | U17: 2
A18: 14 | B18: Bangladesh | C18: BGD | D18: -1.4932705507372059E-2 | E18: 0.25402694431067208 | F18: 3 | G18: -0.39823441227794426 | H18: 0.29988188904282925 | I18: 3 | J18: -0.56460822499449281 | K18: 0.31908959204123422 | L18: 3 | M18: -0.15523665121689781 | N18: 0.39525422199815724 | O18: 3 | P18: -0.92944369417260075 | Q18: 0.27634968636657775 | R18: 4 | S18: -0.2891094664326917 | T18: 0.26706317040829514 | U18: 3
A19: 15 | B19: Bulgaria | C19: BGR | D19: 0.60306902492821612 | E19: 0.25130023322348893 | F19: 5 | G19: 0.43392867304825039 | H19: 0.2347220744274687 | I19: 5 | J19: -0.8141308759227277 | K19: 0.24259893305862151 | L19: 5 | M19: 0.51648934485113174 | N19: 0.2628266479146692 | O19: 5 | P19: -0.14979869952159189 | Q19: 0.17954824109220222 | R19: 7 | S19: -0.55715205457466677 | T19: 0.18193276470480088 | U19: 7
A20: 16 | B20: Bahrain | C20: BHR | D20: -1.0370635684437435 | E20: 0.25402694431067208 | F20: 3 | G20: -7.6897794470733111E-2 | H20: 0.29988188904282925 | I20: 3 | J20: 0.2354996562606774 | K20: 0.31908959204123422 | L20: 3 | M20: 0.75189178411657842 | N20: 0.39525422199815724 | O20: 3 | P20: 0.66452576903601746 | Q20: 0.27634968636657775 | R20: 4 | S20: -0.21498583790870973 | T20: 0.26706317040829514 | U20: 3
A21: 17 | B21: Bahamas, The | C21: BHS | D21: 1.134292827063726 | E21: 0.29137760175532934 | F21: 2 | G21: 0.37213747659353447 | H21: 0.41252284257447502 | I21: 1 | J21: 0.47372699580501521 | K21: 0.76816878371913544 | L21: 1 | M21: 0.87001033067620104 | N21: 0.51994095831945863 | O21: 2 | P21: 0.56301924319449048 | Q21: 0.44307336250641616 | R21: 2 | S21: 0.49738311886793529 | T21: 0.74867439619943676 | U21: 1
A22: 18 | B22: Bosnia and Herzegovina | C22: BIH | D22: -0.97090637481281916 | E22: 0.36031461549530619 | F22: 2 | G22: -1.1552388845802837 | H22: 0.38521922477416387 | I22: 1 | J22: -1.1084941457157245 | K22: 0.40747715389400124 | L22: 1 | M22: -1.2574078298340885 | N22: 0.30445780587756932 | O22: 2 | P22: -1.1084415791240219 | Q22: 0.2322417228763988 | R22: 3 | S22: -0.35252358266285255 | T22: 0.45502709497665206 | U22: 1
A23: 19 | B23: Belarus | C23: BLR | D23: -0.52066192727355987 | E23: 0.28728334123682875 | F23: 4 | G23: -0.37473847286711021 | H23: 0.25398901430107884 | I23: 4 | J23: -0.65892415792465864 | K23: 0.29434619800260248 | L23: 4 | M23: -1.4655770170580293 | N23: 0.2628266479146692 | O23: 5 | P23: -0.87613754102101138 | Q23: 0.19625062444278024 | R23: 6 | S23: -0.6536239410710486 | T23: 0.22037559601784598 | U23: 6
A24: 20 | B24: Belize | C24: BLZ | D24: 1.2313222096205774 | E24: 0.36031461549530619 | F24: 1 | G24: .. | H24: .. | I24: .. | J24: .. | K24: .. | L24: .. | M24: 0.28825474814933105 | N24: 0.60188084442426626 | O24: 1 | P24: 8.7966341143743798E-2 | Q24: 0.60058386521254259 | R24: 1 | S24: .. | T24: .. | U24: ..
A25: 21 | B25: Bolivia | C25: BOL | D25: 0.3913744486511031 | E25: 0.25130023322348893 | F25: 4 | G25: -0.14264805559353128 | H25: 0.28384561747895509 | I25: 4 | J25: -0.22292354496409245 | K25: 0.25933435987227932 | L25: 5 | M25: 0.87584667039929731 | N25: 0.39378792524103623 | O25: 4 | P25: -0.35450537499875051 | Q25: 0.25605974956246003 | R25: 5 | S25: -0.43787719478603893 | T25: 0.23258218307199124 | U25: 5
A26: 22 | B26: Brazil | C26: BRA | D26: 0.55168050950866032 | E26: 0.25130023322348893 | F26: 5 | G26: -0.32263921138726914 | H26: 0.25228486761247954 | I26: 6 | J26: -0.21993543240760341 | K26: 0.23363653218585126 | L26: 7 | M26: 0.13381615967891852 | N26: 0.22876000329023777 | O26: 6 | P26: -0.22209142972638229 | Q26: 0.20773727561581487 | R26: 8 | S26: 5.761684419170391E-2 | T26: 0.18909298753709736 | U26: 8
A27: 23 | B27: Barbados | C27: BRB | D27: 1.4902048791283327 | E27: 0.36031461549530619 | F27: 1 | G27: .. | H27: .. | I27: .. | J27: .. | K27: .. | L27: .. | M27: 0.61227537127853393 | N27: 0.60188084442426626 | O27: 1 | P27: 0.41086731543027871 | Q27: 0.60058386521254259 | R27: 1 | S27: .. | T27: .. | U27: ..
A28: 24 | B28: Brunei | C28: BRN | D28: -0.91947126614151831 | E28: 0.29137760175532934 | F28: 2 | G28: 1.3179506098994513 | H28: 0.41252284257447502 | I28: 1 | J28: 8.6417987560675636E-3 | K28: 0.76816878371913544 | L28: 1 | M28: -8.4459085940385009E-2 | N28: 0.71821352123625759 | O28: 1 | P28: 1.2515737544191281 | Q28: 0.54869731211835882 | R28: 1 | S28: -1.8665703086703719E-2 | T28: 0.74867439619943676 | U28: 1
A29: 25 | B29: Bhutan | C29: BTN | D29: -1.2539514275949681 | E29: 0.36031461549530619 | F29: 1 | G29: .. | H29: .. | I29: .. | J29: .. | K29: .. | L29: .. | M29: .. | N29: .. | O29: .. | P29: .. | Q29: .. | R29: .. | S29: .. | T29: .. | U29: ..
A30: 26 | B30: Botswana | C30: BWA | D30: 0.77865076250272802 | E30: 0.25402694431067208 | F30: 3 | G30: 0.74282527718283975 | H30: 0.27905845743699148 | I30: 4 | J30: 0.22097782542798705 | K30: 0.25687281318054345 | L30: 4 | M30: 0.5724208720886822 | N30: 0.29177868538636526 | O30: 4 | P30: 0.5015340203419949 | Q30: 0.27274644247184715 | R30: 5 | S30: 0.5351913109620231 | T30: 0.22310568461604569 | U30: 4
A31: 27 | B31: Central African Republic | C31: CAF | D31: -4.5832298047789967E-2 | E31: 0.36031461549530619 | F31: 1 | G31: .. | H31: .. | I31: .. | J31: -0.74711391325149723 | K31: 0.50633476272914779 | L31: 1 | M31: .. | N31: .. | O31: .. | P31: .. | Q31: .. | R31: .. | S31: .. | T31: .. | U31: ..
A32: 28 | B32: Canada | C32: CAN | D32: 1.361941879207283 | E32: 0.25130023322348893 | F32: 5 | G32: 1.0271998563417271 | H32: 0.25228486761247954 | I32: 6 | J32: 1.7173477738489658 | K32: 0.23363653218585126 | L32: 7 | M32: 0.86920427229691599 | N32: 0.22876000329023777 | O32: 6 | P32: 1.5494586944364037 | Q32: 0.20773727561581487 | R32: 8 | S32: 2.0554748566836194 | T32: 0.19620820843666348 | U32: 7
A33: 29 | B33: Switzerland | C33: CHE | D33: 1.6936358930138635 | E33: 0.25130023322348893 | F33: 5 | G33: 1.6904702129713807 | H33: 0.25228486761247954 | I33: 6 | J33: 1.9862523215178465 | K33: 0.23363653218585126 | L33: 7 | M33: 0.87794009701113995 | N33: 0.22876000329023777 | O33: 6 | P33: 1.9958319673120584 | Q33: 0.20773727561581487 | R33: 8 | S33: 2.0717306679793031 | T33: 0.18909298753709736 | U33: 8
A34: 30 | B34: Chile | C34: CHL | D34: 0.6150236619017152 | E34: 0.25402694431067208 | F34: 4 | G34: 0.45127360045586945 | H34: 0.26334453452009404 | I34: 5 | J34: 1.1658806436272082 | K34: 0.24866131188801807 | L34: 6 | M34: 0.89826146698774756 | N34: 0.22904640098569978 | O34: 5 | P34: 1.0857252536352944 | Q34: 0.21813983950894791 | R34: 7 | S34: 1.0292056372793361 | T34: 0.19805508574877892 | U34: 7
A35: 31 | B35: China | C35: CHN | D35: -1.2961319860553651 | E35: 0.25402694431067208 | F35: 5 | G35: 0.48347625661562954 | H35: 0.26334453452009404 | I35: 5 | J35: 1.5589979476754863E-2 | K35: 0.24866131188801807 | L35: 6 | M35: -7.0084539357266551E-2 | N35: 0.22904640098569978 | O35: 5 | P35: -4.0035487589544685E-2 | Q35: 0.21813983950894791 | R35: 7 | S35: -0.28897340813691175 | T35: 0.16383974411547927 | U35: 7
A36: 32 | B36: Cote d'Ivoire | C36: CIV | D36: -0.56905295871602957 | E36: 0.25130023322348893 | F36: 4 | G36: -0.13783353491708533 | H36: 0.26599811359710124 | I36: 5 | J36: -0.18041327707637142 | K36: 0.24040796242376472 | L36: 5 | M36: 0.14775610966350805 | N36: 0.29118732384969281 | O36: 5 | P36: -0.3348269483611106 | Q36: 0.2531854041328267 | R36: 6 | S36: -7.9273098877662054E-2 | T36: 0.21052052859001816 | U36: 5
A37: 33 | B37: Cameroon | C37: CMR | D37: -0.70288316235523962 | E37: 0.25130023322348893 | F37: 4 | G37: -0.72447531480138905 | H37: 0.26599811359710124 | I37: 5 | J37: -0.64472026125784931 | K37: 0.24040796242376472 | L37: 5 | M37: -0.16368273089507202 | N37: 0.29118732384969281 | O37: 5 | P37: -1.0152235831279335 | Q37: 0.2531854041328267 | R37: 6 | S37: -1.1046055305331168 | T37: 0.21052052859001816 | U37: 5
A38: 34 | B38: Congo, Rep. | C38: COG | D38: -0.77349506692813785 | E38: 0.28728334123682875 | F38: 3 | G38: -1.8257714772347606 | H38: 0.37350218211437147 | I38: 2 | J38: -0.58049981388382377 | K38: 0.38512328444152177 | L38: 3 | M38: -0.99136690054546128 | N38: 0.51661669269246691 | O38: 3 | P38: -1.4353881968242335 | Q38: 0.37135850669511394 | R38: 3 | S38: -0.59620407771087591 | T38: 0.48462245571009516 | U38: 2
A39: 35 | B39: Colombia | C39: COL | D39: -0.11998207819521983 | E39: 0.25130023322348893 | F39: 5 | G39: -1.2899383116436087 | H39: 0.25228486761247954 | I39: 6 | J39: -5.6625957250347983E-2 | K39: 0.23363653218585126 | L39: 7 | M39: 0.28954507575052796 | N39: 0.22876000329023777 | O39: 6 | P39: -0.78325620684878594 | Q39: 0.20773727561581487 | R39: 8 | S39: -0.49033295191643583 | T39: 0.18909298753709736 | U39: 8
A40: 36 | B40: Comoros | C40: COM | D40: 6.1172537729394058E-2 | E40: 0.36031461549530619 | F40: 1 | G40: .. | H40: .. | I40: .. | J40: .. | K40: .. | L40: .. | M40: .. | N40: .. | O40: .. | P40: .. | Q40: .. | R40: .. | S40: .. | T40: .. | U40: ..
A41: 37 | B41: Cape verde | C41: CPV | D41: 0.98624661449442297 | E41: 0.36031461549530619 | F41: 1 | G41: .. | H41: .. | I41: .. | J41: .. | K41: .. | L41: .. | M41: -1.0078277521439754 | N41: 0.60188084442426626 | O41: 1 | P41: 8.7966341143743798E-2 | Q41: 0.60058386521254259 | R41: 1 | S41: .. | T41: .. | U41: ..
A42: 38 | B42: Costa Rica | C42: CRI | D42: 1.3452746080099194 | E42: 0.25130023322348893 | F42: 4 | G42: 0.90828717971999962 | H42: 0.26987977601169244 | I42: 5 | J42: 0.55350723544864666 | K42: 0.28905600575826201 | L42: 4 | M42: 0.92701027674402026 | N42: 0.39378792524103623 | O42: 4 | P42: 0.5530297458058413 | Q42: 0.23516630507815592 | R42: 6 | S42: 0.57690863150333915 | T42: 0.20727728516484362 | U42: 6
A43: 39 | B43: Cuba | C43: CUB | D43: -1.460712009420263 | E43: 0.25402694431067208 | F43: 3 | G43: 0.19037893098759523 | H43: 0.29988188904282925 | I43: 3 | J43: -0.49710152180538369 | K43: 0.31908959204123422 | L43: 3 | M43: -0.86557551078601891 | N43: 0.39525422199815724 | O43: 3 | P43: 0.11462847171625115 | Q43: 0.27634968636657775 | R43: 4 | S43: 0.27419829420090391 | T43: 0.26706317040829514 | U43: 3
A44: 40 | B44: Cyprus | C44: CYP | D44: 1.1147992749759257 | E44: 0.25402694431067208 | F44: 3 | G44: 0.38054912287478176 | H44: 0.29988188904282925 | I44: 3 | J44: 1.0406254320867756 | K44: 0.31908959204123422 | L44: 3 | M44: 0.84004063448684252 | N44: 0.39525422199815724 | O44: 3 | P44: 0.92756749502634872 | Q44: 0.27634968636657775 | R44: 4 | S44: 1.8112838012677106 | T44: 0.26706317040829514 | U44: 3
A45: 41 | B45: Czech Republic | C45: CZE | D45: 1.2013737668717452 | E45: 0.25130023322348893 | F45: 6 | G45: 0.80576603869029673 | H45: 0.21591513909296886 | I45: 7 | J45: 0.59464580125044864 | K45: 0.20697929466807191 | L45: 8 | M45: 0.56981387384377991 | N45: 0.19196454475476876 | O45: 7 | P45: 0.54332715485708127 | Q45: 0.16025055709462124 | R45: 10 | S45: 0.38423033977330351 | T45: 0.162862701383401 | U45: 9
A46: 42 | B46: Germany | C46: DEU | D46: 1.4903653145322109 | E46: 0.25130023322348893 | F46: 5 | G46: 1.3173475489092557 | H46: 0.25228486761247954 | I46: 6 | J46: 1.4092090341388133 | K46: 0.23363653218585126 | L46: 7 | M46: 0.8894032538285277 | N46: 0.22876000329023777 | O46: 6 | P46: 1.4834868013088114 | Q46: 0.20773727561581487 | R46: 8 | S46: 1.620293094214327 | T46: 0.18909298753709736 | U46: 8
A47: 43 | B47: Djibouti | C47: DJI | D47: -0.60156709782588746 | E47: 0.36031461549530619 | F47: 1 | G47: .. | H47: .. | I47: .. | J47: .. | K47: .. | L47: .. | M47: -0.52179681550604728 | N47: 0.60188084442426626 | O47: 1 | P47: -0.23493463314279112 | Q47: 0.60058386521254259 | R47: 1 | S47: .. | T47: .. | U47: ..
A48: 44 | B48: Denmark | C48: DNK | D48: 1.6331959693549392 | E48: 0.25402694431067208 | F48: 4 | G48: 1.2864399819188064 | H48: 0.26334453452009404 | I48: 5 | J48: 1.7210518549222174 | K48: 0.24866131188801807 | L48: 6 | M48: 1.0479273128258686 | N48: 0.22904640098569978 | O48: 5 | P48: 1.6912085280949629 | Q48: 0.21813983950894791 | R48: 7 | S48: 2.1290166113845812 | T48: 0.19805508574877892 | U48: 7
A49: 45 | B49: Dominican Republic | C49: DOM | D49: -7.7885861394437914E-2 | E49: 0.25402694431067208 | F49: 3 | G49: 0.12108667608083917 | H49: 0.34248229323012747 | I49: 2 | J49: -0.83254007631262517 | K49: 0.37414236442207388 | L49: 2 | M49: 0.53886013171472114 | N49: 0.51994095831945863 | O49: 2 | P49: 0.37955702490882132 | Q49: 0.3138946252365733 | R49: 3 | S49: -0.77294803049288252 | T49: 0.2961069418304243 | U49: 2
A50: 46 | B50: Algeria | C50: DZA | D50: -1.3097317400549584 | E50: 0.25402694431067208 | F50: 3 | G50: -2.4205173449643516 | H50: 0.29988188904282925 | I50: 3 | J50: -1.0869323757785783 | K50: 0.31908959204123422 | L50: 3 | M50: -1.1726383929584521 | N50: 0.39525422199815724 | O50: 3 | P50: -1.1028608879092785 | Q50: 0.27634968636657775 | R50: 4 | S50: -0.87779362017128582 | T50: 0.26706317040829514 | U50: 3
A51: 47 | B51: Ecuador | C51: ECU | D51: 0.26760409879139069 | E51: 0.25130023322348893 | F51: 4 | G51: -0.4671725980075116 | H51: 0.26358101441282383 | I51: 5 | J51: -0.56196095952597636 | K51: 0.26673890715924847 | L51: 5 | M51: 0.37656617304692719 | N51: 0.39378792524103623 | O51: 4 | P51: -0.72110340972729547 | Q51: 0.23993859603447193 | R51: 6 | S51: -0.8192008188019263 | T51: 0.24140237883261839 | U51: 5
A52: 48 | B52: Egypt, Arab Rep. | C52: EGY | D52: -0.67439273995563587 | E52: 0.25402694431067208 | F52: 3 | G52: -6.6539632198739332E-2 | H52: 0.24890572257575613 | I52: 6 | J52: -0.13795229442171966 | K52: 0.22281555993208196 | L52: 6 | M52: 0.11787819215763888 | N52: 0.23179312871987814 | O52: 5 | P52: 0.12790286079210489 | Q52: 0.23318099104208728 | R52: 7 | S52: -0.26746062220309663 | T52: 0.19785674920281118 | U52: 6
A53: 49 | B53: Eritrea | C53: ERI | D53: -0.59466356063508696 | E53: 0.36031461549530619 | F53: 1 | G53: .. | H53: .. | I53: .. | J53: .. | K53: .. | L53: .. | M53: .. | N53: .. | O53: .. | P53: .. | Q53: .. | R53: .. | S53: .. | T53: .. | U53: ..
A54: 50 | B54: Spain | C54: ESP | D54: 1.3380199772448051 | E54: 0.25130023322348893 | F54: 5 | G54: 0.5802217150586465 | H54: 0.25228486761247954 | I54: 6 | J54: 1.6032703203239362 | K54: 0.23363653218585126 | L54: 7 | M54: 0.86427141020371989 | N54: 0.22876000329023777 | O54: 6 | P54: 1.0321345377942983 | Q54: 0.20773727561581487 | R54: 8 | S54: 1.2142607209685121 | T54: 0.18909298753709736 | U54: 8
A55: 51 | B55: Estonia | C55: EST | D55: 0.78885671575169658 | E55: 0.25130023322348893 | F55: 5 | G55: 0.79136032122221234 | H55: 0.2347220744274687 | I55: 5 | J55: 0.25818303990613278 | K55: 0.24259893305862151 | L55: 5 | M55: 0.74297115654979973 | N55: 0.2628266479146692 | O55: 5 | P55: 0.50700303748831166 | Q55: 0.17954824109220222 | R55: 7 | S55: 0.5930563743475441 | T55: 0.18193276470480088 | U55: 7
A56: 52 | B56: Ethiopia | C56: ETH | D56: -0.49961249473530239 | E56: 0.29137760175532934 | F56: 2 | G56: 0.14137593228340317 | H56: 0.36279173932405639 | I56: 2 | J56: -0.14643871296735336 | K56: 0.31735550250726685 | L56: 3 | M56: -3.3403615763245728E-2 | N56: 0.33251863866145182 | O56: 3 | P56: 0.26910267598098803 | Q56: 0.42866208060882488 | R56: 3 | S56: -0.43558120166795666 | T56: 0.35684147672067407 | U56: 2
A57: 53 | B57: Finland | C57: FIN | D57: 1.6023136412845629 | E57: 0.25402694431067208 | F57: 4 | G57: 1.5143605283955008 | H57: 0.26334453452009404 | I57: 5 | J57: 1.6347579965603423 | K57: 0.24866131188801807 | L57: 6 | M57: 1.1404307299790992 | N57: 0.22904640098569978 | O57: 5 | P57: 1.7363565521720903 | Q57: 0.21813983950894791 | R57: 7 | S57: 2.0845938398089947 | T57: 0.19805508574877892 | U57: 7
A58: 54 | B58: Fiji | C58: FJI | D58: 1.2954451943482074E-2 | E58: 0.35265752232120906 | F58: 2 | G58: 1.2305245947006655E-2 | H58: 0.66053614439227493 | I58: 1 | J58: 0.63494038642923867 | K58: 0.5637075668724989 | L58: 1 | M58: -0.36870348851870793 | N58: 0.59674094290048185 | O58: 2 | P58: -0.49538317664637949 | Q58: 0.45038851528650714 | R58: 2 | S58: 0.8066678309762757 | T58: 0.53653470441187612 | U58: 1
A59: 55 | B59: France | C59: FRA | D59: 1.1502996759101982 | E59: 0.25130023322348893 | F59: 5 | G59: 0.64665034079233064 | H59: 0.25228486761247954 | I59: 6 | J59: 1.2795323804320009 | K59: 0.23363653218585126 | L59: 7 | M59: 0.71345181628339671 | N59: 0.22876000329023777 | O59: 6 | P59: 1.0771409158461223 | Q59: 0.20773727561581487 | R59: 8 | S59: 1.2823942157144548 | T59: 0.19620820843666348 | U59: 7
A60: 56 | B60: Gabon | C60: GAB | D60: -0.31409891298261794 | E60: 0.25402694431067208 | F60: 3 | G60: -0.5613348284275238 | H60: 0.34248229323012747 | I60: 2 | J60: -1.1267529773270337 | K60: 0.37414236442207388 | L60: 2 | M60: 0.35485395272954706 | N60: 0.51994095831945863 | O60: 2 | P60: -0.5252153027716604 | Q60: 0.3138946252365733 | R60: 3 | S60: -1.0151196581536006 | T60: 0.2961069418304243 | U60: 2
A61: 57 | B61: United Kingdom | C61: GBR | D61: 1.4890363990204536 | E61: 0.25130023322348893 | F61: 5 | G61: 0.91972187687454521 | H61: 0.25228486761247954 | I61: 6 | J61: 1.9661212499735987 | K61: 0.23363653218585126 | L61: 7 | M61: 1.2064248676640952 | N61: 0.22876000329023777 | O61: 6 | P61: 1.6886284952825656 | Q61: 0.20773727561581487 | R61: 8 | S61: 1.7065235658238367 | T61: 0.18909298753709736 | U61: 8
A62: 58 | B62: Georgia | C62: GEO | D62: -0.29126764081502704 | E62: 0.35265752232120906 | F62: 3 | G62: -0.76087740089029476 | H62: 0.3067849652941122 | I62: 3 | J62: -0.5120820036059115 | K62: 0.30362504626293219 | L62: 3 | M62: -0.84926699912726855 | N62: 0.27178528950467506 | O62: 4 | P62: -0.49418423293255459 | Q62: 0.20566000620699998 | R62: 5 | S62: -0.7436548624197602 | T62: 0.23692223290035708 | U62: 4
A63: 59 | B63: Ghana | C63: GHA | D63: -0.43466100269349112 | E63: 0.25130023322348893 | F63: 4 | G63: -0.10107161309377614 | H63: 0.26599811359710124 | I63: 5 | J63: -0.2867775568036196 | K63: 0.22248178800615603 | L63: 6 | M63: 0.27836296766957042 | N63: 0.29118732384969281 | O63: 5 | P63: -1.3612351261324439E-2 | Q63: 0.2531854041328267 | R63: 6 | S63: -0.301476970023552 | T63: 0.21052052859001816 | U63: 5
A64: 60 | B64: Guinea | C64: GIN | D64: -0.87291828281514883 | E64: 0.28728334123682875 | F64: 3 | G64: -1.0349242367873859 | H64: 0.37350218211437147 | I64: 2 | J64: -2.9278715568244438E-2 | K64: 0.51020118372025602 | L64: 2 | M64: 0.19699042287553667 | N64: 0.51661669269246691 | O64: 3 | P64: -0.76168084755210386 | Q64: 0.37135850669511394 | R64: 3 | S64: -0.84776582800763911 | T64: 0.48462245571009516 | U64: 2
A65: 61 | B65: Guadeloupe | C65: GLP | D65: .. | E65: .. | F65: .. | G65: .. | H65: .. | I65: .. | J65: .. | K65: .. | L65: .. | M65: .. | N65: .. | O65: .. | P65: .. | Q65: .. | R65: .. | S65: .. | T65: .. | U65: ..
A66: 62 | B66: Gambia, The | C66: GMB | D66: -0.97138928733204122 | E66: 0.29137760175532934 | F66: 2 | G66: 0.56130010053077606 | H66: 0.41252284257447502 | I66: 1 | J66: 0.16367019529192914 | K66: 0.76816878371913544 | L66: 1 | M66: -0.24965074471065185 | N66: 0.51994095831945863 | O66: 2 | P66: 0.27414380659008736 | Q66: 0.44307336250641616 | R66: 2 | S66: -1.8665703086703719E-2 | T66: 0.74867439619943676 | U66: 1
A67: 63 | B67: Guinea-Bissau | C67: GNB | D67: -0.45385701247542942 | E67: 0.28728334123682875 | F67: 3 | G67: -1.2029179185971692 | H67: 0.37350218211437147 | I67: 2 | J67: -0.33427682117057078 | K67: 0.51020118372025602 | L67: 2 | M67: -1.350234237049212 | N67: 0.51661669269246691 | O67: 3 | P67: -1.614713455465183 | Q67: 0.37135850669511394 | R67: 3 | S67: -0.17579347492755806 | T67: 0.48462245571009516 | U67: 2
A68: 64 | B68: Equatorial Guinea | C68: GNQ | D68: -1.3885704183485383 | E68: 0.36031461549530619 | F68: 1 | G68: .. | H68: .. | I68: .. | J68: .. | K68: .. | L68: .. | M68: -1.3318483752731782 | N68: 0.60188084442426626 | O68: 1 | P68: -1.2036375560023957 | Q68: 0.60058386521254259 | R68: 1 | S68: .. | T68: .. | U68: ..
A69: 65 | B69: Greece | C69: GRC | D69: 1.0745356060007569 | E69: 0.25402694431067208 | F69: 4 | G69: 0.20501914420146183 | H69: 0.26334453452009404 | I69: 5 | J69: 0.55969099671606082 | K69: 0.24866131188801807 | L69: 6 | M69: 0.60497152539640353 | N69: 0.22904640098569978 | O69: 5 | P69: 0.49564346474242194 | Q69: 0.21813983950894791 | R69: 7 | S69: 0.82482074326199506 | T69: 0.19805508574877892 | U69: 7
A70: 66 | B70: Guatemala | C70: GTM | D70: -0.56461318713896758 | E70: 0.25402694431067208 | F70: 3 | G70: -0.75093366162234643 | H70: 0.31873333373090551 | I70: 3 | J70: -0.2250182457894111 | K70: 0.37414236442207388 | L70: 2 | M70: 0.44420227222309205 | N70: 0.51994095831945863 | O70: 2 | P70: -1.1056763126901379 | Q70: 0.27756710773103799 | R70: 4 | S70: -0.81944615326046999 | T70: 0.24849503105537538 | U70: 3
A71: 67 | B71: Guyana | C71: GUY | D71: 1.0096128462050005 | E71: 0.29137760175532934 | F71: 2 | G71: -0.19535040429799619 | H71: 0.41252284257447502 | I71: 1 | J71: 8.6417987560675636E-3 | K71: 0.76816878371913544 | L71: 1 | M71: 0.23395301208085831 | N71: 0.51994095831945863 | O71: 2 | P71: -0.13994511790196557 | Q71: 0.44307336250641616 | R71: 2 | S71: -1.8665703086703719E-2 | T71: 0.74867439619943676 | U71: 1
A72: 68 | B72: Hong Kong, China | C72: HKG | D72: -7.3917558864768584E-2 | E72: 0.25130023322348893 | F72: 6 | G72: 0.92151342858835283 | H72: 0.26987977601169244 | I72: 5 | J72: 1.248339680893368 | K72: 0.24819765298730315 | L72: 6 | M72: 1.2071708277427065 | N72: 0.22876000329023777 | O72: 6 | P72: 1.3333912954277634 | Q72: 0.21793746551824869 | R72: 7 | S72: 1.3133359796370441 | T72: 0.15607290306933727 | U72: 8
A73: 69 | B73: Honduras | C73: HND | D73: -5.5306226150604314E-2 | E73: 0.25402694431067208 | F73: 3 | G73: -0.33396283317135994 | H73: 0.31873333373090551 | I73: 3 | J73: -0.40890130969572525 | K73: 0.37414236442207388 | L73: 2 | M73: 8.1499453178648193E-2 | N73: 0.51994095831945863 | O73: 2 | P73: -0.89534600998271829 | Q73: 0.27756710773103799 | R73: 4 | S73: -0.9381470115767242 | T73: 0.24849503105537538 | U73: 3
A74: 70 | B74: Croatia | C74: HRV | D74: -0.32322880123621806 | E74: 0.25402694431067208 | F74: 4 | G74: 0.40595711496507386 | H74: 0.24354998171430456 | I74: 4 | J74: 0.14962430984629702 | K74: 0.25955068050331376 | L74: 4 | M74: 0.2381709682588288 | N74: 0.26326125682519685 | O74: 4 | P74: 0.14595647086658889 | Q74: 0.1861376812882912 | R74: 6 | S74: -0.46405431594523039 | T74: 0.19707922856731536 | U74: 5
A75: 71 | B75: Haiti | C75: HTI | D75: -0.70901368699821721 | E75: 0.29137760175532934 | F75: 2 | G75: -1.7086514230353467 | H75: 0.41252284257447502 | I75: 1 | J75: -1.2315853958549137 | K75: 0.76816878371913544 | L75: 1 | M75: -1.1328194835292764 | N75: 0.51994095831945863 | O75: 2 | P75: -1.495346237708413 | Q75: 0.44307336250641616 | R75: 2 | S75: -0.53471452504134276 | T75: 0.74867439619943676 | U75: 1
A76: 72 | B76: Hungary | C76: HUN | D76: 1.1983193666152308 | E76: 0.25130023322348893 | F76: 6 | G76: 1.2453232292695837 | H76: 0.21591513909296886 | I76: 7 | J76: 0.60645638978787009 | K76: 0.20697929466807191 | L76: 8 | M76: 0.85406900321636359 | N76: 0.19196454475476876 | O76: 7 | P76: 0.70554384796954617 | Q76: 0.16025055709462124 | R76: 10 | S76: 0.61410990830050194 | T76: 0.15872427647504828 | U76: 10
A77: 73 | B77: Indonesia | C77: IDN | D77: -1.1654642025652144 | E77: 0.25402694431067208 | F77: 5 | G77: -1.2886628804905851 | H77: 0.26334453452009404 | I77: 5 | J77: -0.52826279516855079 | K77: 0.24866131188801807 | L77: 6 | M77: 0.12148773107287597 | N77: 0.22904640098569978 | O77: 5 | P77: -0.91832769642976875 | Q77: 0.21813983950894791 | R77: 7 | S77: -0.79885067750763072 | T77: 0.16383974411547927 | U77: 7
A78: 74 | B78: India | C78: IND | D78: 0.49775798944329269 | E78: 0.25130023322348893 | F78: 6 | G78: -3.6608105749208815E-2 | H78: 0.25228486761247954 | I78: 6 | J78: -0.26374686523655405 | K78: 0.23363653218585126 | L78: 7 | M78: -3.997451757928016E-2 | N78: 0.22876000329023777 | O78: 6 | P78: 0.16038927121326294 | Q78: 0.20773727561581487 | R78: 8 | S78: -0.30584065693227519 | T78: 0.15482320791775375 | U78: 9
A79: 75 | B79: Ireland | C79: IRL | D79: 1.5010334127446112 | E79: 0.25130023322348893 | F79: 5 | G79: 1.4262170025785166 | H79: 0.25228486761247954 | I79: 6 | J79: 1.3610967373064446 | K79: 0.23363653218585126 | L79: 7 | M79: 1.1574985980954593 | N79: 0.22876000329023777 | O79: 6 | P79: 1.3949005873785982 | Q79: 0.20773727561581487 | R79: 8 | S79: 1.5672920838952824 | T79: 0.18909298753709736 | U79: 8
A80: 76 | B80: Iran, Islamic Rep. | C80: IRN | D80: -0.55920627536362344 | E80: 0.25402694431067208 | F80: 3 | G80: 0.13455439909372338 | H80: 0.27627136674287806 | I80: 4 | J80: -0.33943571416158524 | K80: 0.28978914382329912 | L80: 4 | M80: -1.2506436241740722 | N80: 0.39525422199815724 | O80: 3 | P80: -0.36424080569065093 | Q80: 0.25638815719447205 | R80: 5 | S80: -0.84794760841417371 | T80: 0.26094287716947417 | U80: 4
A81: 77 | B81: Iraq | C81: IRQ | D81: -1.7528897511521069 | E81: 0.25402694431067208 | F81: 3 | G81: -2.2445203284923299 | H81: 0.29988188904282925 | I81: 3 | J81: -1.8831008918400516 | K81: 0.31908959204123422 | L81: 3 | M81: -3.1421853569799123 | N81: 0.39525422199815724 | O81: 3 | P81: -1.8436719236240982 | Q81: 0.27634968636657775 | R81: 4 | S81: -1.2648927632629274 | T81: 0.26706317040829514 | U81: 3
A82: 78 | B82: Iceland | C82: ISL | D82: 1.4470018668652738 | E82: 0.29137760175532934 | F82: 3 | G82: 1.2522728871049793 | H82: 0.37283022304968616 | I82: 2 | J82: 1.5039194981551749 | K82: 0.40963321357920301 | L82: 3 | M82: 0.61418728402709399 | N82: 0.24723861307061137 | O82: 4 | P82: 1.468929716285384 | Q82: 0.30294285039196189 | R82: 4 | S82: 1.8305518529697775 | T82: 0.30715193897551524 | U82: 3
A83: 79 | B83: Israel | C83: ISR | D83: 1.0833897624089792 | E83: 0.25402694431067208 | F83: 4 | G83: -0.45502349107240048 | H83: 0.28355035712187776 | I83: 4 | J83: 0.68507234663270755 | K83: 0.26644174895434825 | L83: 5 | M83: 0.53316827664408317 | N83: 0.22904640098569978 | O83: 5 | P83: 0.96584431336432763 | Q83: 0.23004193092994482 | R83: 6 | S83: 1.2766880201375663 | T83: 0.20069157159218198 | U83: 6
A84: 80 | B84: Italy | C84: ITA | D84: 1.2869196432195344 | E84: 0.25130023322348893 | F84: 5 | G84: 1.1585265417888226 | H84: 0.25228486761247954 | I84: 6 | J84: 0.77286927248144377 | K84: 0.23363653218585126 | L84: 7 | M84: 0.59136433398140098 | N84: 0.22876000329023777 | O84: 6 | P84: 0.86090146886788788 | Q84: 0.20773727561581487 | R84: 8 | S84: 0.8023283628411797 | T84: 0.18909298753709736 | U84: 8
A85: 81 | B85: Jamaica | C85: JAM | D85: 0.75025592899915827 | E85: 0.25130023322348893 | F85: 4 | G85: -0.34429311692839193 | H85: 0.31915287616104948 | I85: 3 | J85: -0.48420131108456149 | K85: 0.32807669277493695 | L85: 3 | M85: 0.75951487631354742 | N85: 0.51661669269246691 | O85: 3 | P85: -0.72791715843231453 | Q85: 0.28505666681472658 | R85: 4 | S85: -0.11620599480498998 | T85: 0.26842378896013652 | U85: 3
A86: 82 | B86: Jordan | C86: JOR | D86: 0.15335912119855388 | E86: 0.25130023322348893 | F86: 4 | G86: -5.6877174869652235E-2 | H86: 0.26987977601169244 | I86: 5 | J86: 0.62961589666426054 | K86: 0.25933435987227932 | L86: 5 | M86: 0.41655225852466637 | N86: 0.27405060086349636 | O86: 5 | P86: 0.70841650626585273 | Q86: 0.23516630507815592 | R86: 6 | S86: 0.1390418971045756 | T86: 0.21675833080370449 | U86: 5
A87: 83 | B87: Japan | C87: JPN | D87: 1.1631096027408296 | E87: 0.29137760175532934 | F87: 4 | G87: 1.1530756985348389 | H87: 0.29147875964465686 | I87: 4 | J87: 0.83898797011488457 | K87: 0.30537141907376114 | L87: 5 | M87: 0.38886899261987112 | N87: 0.22904640098569978 | O87: 5 | P87: 1.421874528246035 | Q87: 0.25031543677274476 | R87: 6 | S87: 0.72357516585573167 | T87: 0.15962830533624117 | U87: 8
A88: 84 | B88: Kazakhstan | C88: KAZ | D88: -0.71167175278375816 | E88: 0.25130023322348893 | F88: 5 | G88: 0.22141392338600255 | H88: 0.22286975705685766 | I88: 6 | J88: -0.82377799173192168 | K88: 0.2289485826310286 | L88: 6 | M88: -0.40462373340795066 | N88: 0.2628266479146692 | O88: 5 | P88: -0.58966304878786713 | Q88: 0.1737147180010194 | R88: 8 | S88: -0.86866209791181104 | T88: 0.18606231845907847 | U88: 7
A89: 85 | B89: Kenya | C89: KEN | D89: -0.70122076977314185 | E89: 0.25130023322348893 | F89: 4 | G89: -1.097689683613893 | H89: 0.26599811359710124 | I89: 5 | J89: -0.89942719537350491 | K89: 0.22248178800615603 | L89: 6 | M89: -0.13283592721084336 | N89: 0.29118732384969281 | O89: 5 | P89: -1.2200377938324558 | Q89: 0.2531854041328267 | R89: 6 | S89: -0.65138037733086418 | T89: 0.21052052859001816 | U89: 5
A90: 86 | B90: Kyrgyz Republic | C90: KGZ | D90: -0.24768380419947719 | E90: 0.35265752232120906 | F90: 3 | G90: 0.31771393088913641 | H90: 0.3067849652941122 | I90: 3 | J90: -0.57516891650413859 | K90: 0.30362504626293219 | L90: 3 | M90: -0.75821284237391973 | N90: 0.27178528950467506 | O90: 4 | P90: -0.46804644296688391 | Q90: 0.20566000620699998 | R90: 5 | S90: -0.7634330568505423 | T90: 0.23692223290035708 | U90: 4
A91: 87 | B91: Cambodia | C91: KHM | D91: -0.90877453388243046 | E91: 0.36031461549530619 | F91: 1 | G91: .. | H91: .. | I91: .. | J91: .. | K91: .. | L91: .. | M91: -3.576587886811923E-2 | N91: 0.60188084442426626 | O91: 1 | P91: -0.23493463314279112 | Q91: 0.60058386521254259 | R91: 1 | S91: .. | T91: .. | U91: ..
A92: 88 | B92: Korea, Rep. | C92: KOR | D92: 1.0023254816966283 | E92: 0.25130023322348893 | F92: 6 | G92: 0.16434900905249569 | H92: 0.25228486761247954 | I92: 6 | J92: 0.40868248932004408 | K92: 0.23363653218585126 | L92: 7 | M92: 0.21903128552230844 | N92: 0.22876000329023777 | O92: 6 | P92: 0.94255099680658327 | Q92: 0.20773727561581487 | R92: 8 | S92: 0.15918661037952705 | T92: 0.15482320791775375 | U92: 9
A93: 89 | B93: Kuwait | C93: KWT | D93: 2.5700635497022758E-4 | E93: 0.25402694431067208 | F93: 3 | G93: 0.6836311987837812 | H93: 0.29988188904282925 | I93: 3 | J93: -6.3434181322054486E-2 | K93: 0.31908959204123422 | L93: 3 | M93: -9.0885527120957058E-2 | N93: 0.39525422199815724 | O93: 3 | P93: 0.90737285902055631 | Q93: 0.27634968636657775 | R93: 4 | S93: 0.61900344917820371 | T93: 0.26706317040829514 | U93: 3
A94: 90 | B94: Lao, PDR | C94: LAO | D94: -1.050297061826801 | E94: 0.36031461549530619 | F94: 1 | G94: .. | H94: .. | I94: .. | J94: .. | K94: .. | L94: .. | M94: -1.8178793119111063 | N94: 0.60188084442426626 | O94: 1 | P94: -1.2036375560023957 | Q94: 0.60058386521254259 | R94: 1 | S94: .. | T94: .. | U94: ..
A95: 91 | B95: Lebanon | C95: LBN | D95: -0.4042674489710551 | E95: 0.25402694431067208 | F95: 3 | G95: -0.25201222574857557 | H95: 0.29988188904282925 | I95: 3 | J95: 0.17430604177115941 | K95: 0.31908959204123422 | L95: 3 | M95: 0.10225105087865453 | N95: 0.39525422199815724 | O95: 3 | P95: 0.26247348810380766 | Q95: 0.27634968636657775 | R95: 4 | S95: -0.39706828536934941 | T95: 0.26706317040829514 | U95: 3
A96: 92 | B96: Liberia | C96: LBR | D96: -0.88839718686246949 | E96: 0.29137760175532934 | F96: 2 | G96: -0.95200091366667139 | H96: 0.41252284257447502 | I96: 1 | J96: -0.92152859534182774 | K96: 0.76816878371913544 | L96: 1 | M96: -1.2480401716116811 | N96: 0.71821352123625759 | O96: 1 | P96: -1.2886266995915658 | Q96: 0.54869731211835882 | R96: 1 | S96: -1.0507633438996888 | T96: 0.74867439619943676 | U96: 1
A97: 93 | B97: Libya | C97: LBY | D97: -1.3461625814712308 | E97: 0.25402694431067208 | F97: 3 | G97: -1.1747078240324573 | H97: 0.29988188904282925 | I97: 3 | J97: -1.3217169105355902 | K97: 0.31908959204123422 | L97: 3 | M97: -2.3762653673640157 | N97: 0.39525422199815724 | O97: 3 | P97: -1.113356574594857 | Q97: 0.27634968636657775 | R97: 4 | S97: -0.88180472175331326 | T97: 0.26706317040829514 | U97: 3
A98: 94 | B98: Sri Lanka | C98: LKA | D98: -0.15705882000857108 | E98: 0.25402694431067208 | F98: 3 | G98: -1.6275596964998276 | H98: 0.29988188904282925 | I98: 3 | J98: -0.61167805037031042 | K98: 0.31908959204123422 | L98: 3 | M98: 0.61585746664339158 | N98: 0.39525422199815724 | O98: 3 | P98: -0.36125842775522654 | Q98: 0.27634968636657775 | R98: 4 | S98: -0.12394461398139545 | T98: 0.26706317040829514 | U98: 3
A99: 95 | B99: Lesotho | C99: LSO | D99: -0.14593359974076545 | E99: 0.36031461549530619 | F99: 1 | G99: -0.8200376148923666 | H99: 0.6061771357665019 | I99: 1 | J99: -0.46174820270581407 | K99: 0.32907595010589286 | L99: 2 | M99: -5.7904784103815762E-2 | N99: 0.35124420467647216 | O99: 2 | P99: -0.23987111346203671 | Q99: 0.5660803383253904 | R99: 2 | S99: 0.18761140932310325 | T99: 0.37611079170421424 | U99: 1
A100: 96 | B100: Lithuania | C100: LTU | D100: 0.76692980649486797 | E100: 0.25130023322348893 | F100: 5 | G100: 0.34571648933457971 | H100: 0.2347220744274687 | I100: 5 | J100: 0.12684759663060247 | K100: 0.24259893305862151 | L100: 5 | M100: 8.917584760806356E-2 | N100: 0.2628266479146692 | O100: 5 | P100: 0.18015442608155482 | Q100: 0.17954824109220222 | R100: 7 | S100: 3.4129706835573273E-2 | T100: 0.18824314571543588 | U100: 6
A101: 97 | B101: Luxembourg | C101: LUX | D101: 1.4605456989218397 | E101: 0.29137760175532934 | F101: 3 | G101: 1.3977224509488229 | H101: 0.37283022304968616 | I101: 2 | J101: 1.6736556760696357 | K101: 0.40963321357920301 | L101: 3 | M101: 0.94666098361200313 | N101: 0.24723861307061137 | O101: 4 | P101: 1.6210641287802678 | Q101: 0.30294285039196189 | R101: 4 | S101: 1.6712549925591047 | T101: 0.28181534772842609 | U101: 4
A102: 98 | B102: Latvia | C102: LVA | D102: 0.62473646258944571 | E102: 0.25130023322348893 | F102: 5 | G102: 0.45978939521426693 | H102: 0.2347220744274687 | I102: 5 | J102: 6.7637979286703107E-2 | K102: 0.24259893305862151 | L102: 5 | M102: 0.50867099196697774 | N102: 0.2628266479146692 | O102: 5 | P102: 0.15451230530057702 | Q102: 0.17954824109220222 | R102: 7 | S102: -0.26357495475887294 | T102: 0.18193276470480088 | U102: 7
A103: 99 | B103: Macao, China | C103: MAC | D103: .. | E103: .. | F103: .. | G103: .. | H103: .. | I103: .. | J103: .. | K103: .. | L103: .. | M103: .. | N103: .. | O103: .. | P103: .. | Q103: .. | R103: .. | S103: .. | T103: .. | U103: ..
A104: 100 | B104: Morocco | C104: MAR | D104: -0.23955570403641049 | E104: 0.25130023322348893 | F104: 4 | G104: 8.9980502461553508E-2 | H104: 0.26599811359710124 | I104: 5 | J104: 0.26708336483421169 | K104: 0.22248178800615603 | L104: 6 | M104: 0.21598677305163816 | N104: 0.29118732384969281 | O104: 5 | P104: 0.67817086410850513 | Q104: 0.2531854041328267 | R104: 6 | S104: 0.12519025283936355 | T104: 0.21052052859001816 | U104: 5
A105: 101 | B105: Moldova | C105: MDA | D105: 0.16079661934805359 | E105: 0.25130023322348893 | F105: 5 | G105: -0.19594535457997811 | H105: 0.2347220744274687 | I105: 5 | J105: -0.46008276869666237 | K105: 0.24259893305862151 | L105: 5 | M105: -0.28062880406258917 | N105: 0.2628266479146692 | O105: 5 | P105: -1.8974292502005323E-2 | Q105: 0.17954824109220222 | R105: 7 | S105: -0.38674550725057766 | T105: 0.18824314571543588 | U105: 6
A106: 102 | B106: Madagascar | C106: MDG | D106: 0.30925860841074582 | E106: 0.28728334123682875 | F106: 3 | G106: -0.78591593904847179 | H106: 0.37350218211437147 | I106: 2 | J106: -0.29457592783734737 | K106: 0.38512328444152177 | L106: 3 | M106: -0.20891550141843568 | N106: 0.51661669269246691 | O106: 3 | P106: -0.82465534224967663 | Q106: 0.37135850669511394 | R106: 3 | S106: -0.46932295728747098 | T106: 0.48462245571009516 | U106: 2
A107: 103 | B107: Maldives | C107: MDV | D107: -0.90877453388243046 | E107: 0.36031461549530619 | F107: 1 | G107: .. | H107: .. | I107: .. | J107: .. | K107: .. | L107: .. | M107: .. | N107: .. | O107: .. | P107: .. | Q107: .. | R107: .. | S107: .. | T107: .. | U107: ..
A108: 104 | B108: Mexico | C108: MEX | D108: -0.10836600321738513 | E108: 0.25130023322348893 | F108: 5 | G108: -0.35213052426713498 | H108: 0.25228486761247954 | I108: 6 | J108: 0.17886557791426871 | K108: 0.23363653218585126 | L108: 7 | M108: 0.60791731126919424 | N108: 0.22876000329023777 | O108: 6 | P108: -0.47409920217358242 | Q108: 0.20773727561581487 | R108: 8 | S108: -0.27712617465768108 | T108: 0.19620820843666348 | U108: 7
A109: 105 | B109: Macedonia, FYR | C109: MKD | D109: 8.671078565854877E-2 | E109: 0.29161828587045291 | F109: 4 | G109: -0.39950662762489403 | H109: 0.30599419168130026 | I109: 3 | J109: -0.57644704620037512 | K109: 0.27097612053564685 | L109: 3 | M109: -0.31189210410696011 | N109: 0.33194513119796099 | O109: 2 | P109: -0.25634400865698043 | Q109: 0.20420608205612895 | R109: 4 | S109: -0.51713475864818037 | T109: 0.2007212968168238 | U109: 4
A110: 106 | B110: Mali | C110: MLI | D110: 0.41539714589737164 | E110: 0.28728334123682875 | F110: 3 | G110: -0.2871501692828779 | H110: 0.37350218211437147 | I110: 2 | J110: -5.228077000029676E-2 | K110: 0.51020118372025602 | L110: 2 | M110: 0.28967691596475037 | N110: 0.51661669269246691 | O110: 3 | P110: -0.46544972136557783 | Q110: 0.37135850669511394 | R110: 3 | S110: -0.47585005317613249 | T110: 0.48462245571009516 | U110: 2
A111: 107 | B111: Malta | C111: MLT | D111: 1.4131422877396469 | E111: 0.29137760175532934 | F111: 2 | G111: 1.3179506098994513 | H111: 0.41252284257447502 | I111: 1 | J111: 0.62875539234087674 | K111: 0.76816878371913544 | L111: 1 | M111: 0.38640657098306841 | N111: 0.51994095831945863 | O111: 2 | P111: 0.86397382135625411 | Q111: 0.44307336250641616 | R111: 2 | S111: 0.49738311886793529 | T111: 0.74867439619943676 | U111: 1
A112: 108 | B112: Myanmar | C112: MMR | D112: -1.7477426969884162 | E112: 0.25402694431067208 | F112: 3 | G112: -0.96734872406948091 | H112: 0.29988188904282925 | I112: 3 | J112: -1.461346497716959 | K112: 0.31908959204123422 | L112: 3 | M112: -1.0108266200058897 | N112: 0.39525422199815724 | O112: 3 | P112: -0.83880238362896342 | Q112: 0.27634968636657775 | R112: 4 | S112: -1.0957168092296039 | T112: 0.26706317040829514 | U112: 3
A113: 109 | B113: Mongolia | C113: MNG | D113: 0.84257225964418014 | E113: 0.29137760175532934 | F113: 3 | G113: 0.37213747659353447 | H113: 0.41252284257447502 | I113: 1 | J113: 1.7689353649143313E-2 | K113: 0.38583281786348905 | L113: 2 | M113: 0.17084777374437296 | N113: 0.51994095831945863 | O113: 2 | P113: 3.9107465940165363E-2 | Q113: 0.31717363477043808 | R113: 3 | S113: -0.14521853640269905 | T113: 0.42205598059249466 | U113: 2
A114: 110 | B114: Mozambique | C114: MOZ | D114: -0.17211542685613546 | E114: 0.28728334123682875 | F114: 3 | G114: -0.52901825603331909 | H114: 0.33539465361595089 | I114: 3 | J114: -0.33073075366025778 | K114: 0.2877650419084371 | L114: 4 | M114: -0.22740624234031867 | N114: 0.33164416564854249 | O114: 4 | P114: -1.0459735063342839 | Q114: 0.36274962838154251 | R114: 4 | S114: -0.5349201274214308 | T114: 0.31118020705322125 | U114: 3
A115: 111 | B115: Mauritania | C115: MRT | D115: -0.97090637481281916 | E115: 0.36031461549530619 | F115: 1 | G115: .. | H115: .. | I115: .. | J115: .. | K115: .. | L115: .. | M115: -0.84581743863525027 | N115: 0.60188084442426626 | O115: 1 | P115: -0.55783560742932603 | Q115: 0.60058386521254259 | R115: 1 | S115: .. | T115: .. | U115: ..
A116: 112 | B116: Martinique | C116: MTQ | D116: .. | E116: .. | F116: .. | G116: .. | H116: .. | I116: .. | J116: .. | K116: .. | L116: .. | M116: .. | N116: .. | O116: .. | P116: .. | Q116: .. | R116: .. | S116: .. | T116: .. | U116: ..
A117: 113 | B117: Mauritius | C117: MUS | D117: 1.0116573925871677 | E117: 0.29161828587045291 | F117: 3 | G117: 1.1436229113847114 | H117: 0.38741394913259203 | I117: 3 | J117: 0.17217393468457604 | K117: 0.26793304005260682 | L117: 3 | M117: 0.21701620969144944 | N117: 0.35021398990291308 | O117: 3 | P117: 1.2789241517949994 | Q117: 0.31108529724680994 | R117: 4 | S117: 0.33636297665767456 | T117: 0.22843148021933721 | U117: 3
A118: 114 | B118: Malawi | C118: MWI | D118: 6.1683928076431249E-2 | E118: 0.25130023322348893 | F118: 4 | G118: 3.9427810863173589E-2 | H118: 0.2943853035379273 | I118: 4 | J118: -0.62483991921410775 | K118: 0.23887449915105682 | L118: 5 | M118: 8.0826478281831537E-2 | N118: 0.33164416564854249 | O118: 4 | P118: -0.40902349771871638 | Q118: 0.2811069183326606 | R118: 5 | S118: -0.19453285309721363 | T118: 0.22389713439488995 | U118: 4
A119: 115 | B119: Malaysia | C119: MYS | D119: -0.14363650519022855 | E119: 0.25130023322348893 | F119: 6 | G119: 0.5518729953590179 | H119: 0.25228486761247954 | I119: 6 | J119: 0.71409582584017373 | K119: 0.23363653218585126 | L119: 7 | M119: 0.47682824778863003 | N119: 0.22876000329023777 | O119: 6 | P119: 0.83361529960968994 | Q119: 0.20773727561581487 | R119: 8 | S119: 0.63341607558918323 | T119: 0.15865659221332654 | U119: 8
A120: 116 | B120: Namibia | C120: NAM | D120: 0.47323457109054673 | E120: 0.25402694431067208 | F120: 3 | G120: 0.7138648174166381 | H120: 0.31239278829848283 | I120: 3 | J120: 4.4411189859742371E-2 | K120: 0.2550047380374903 | L120: 4 | M120: 0.2667298981356363 | N120: 0.33251863866145182 | O120: 3 | P120: 0.95367963398018363 | Q120: 0.30864385839110769 | R120: 4 | S120: 0.38190891869999632 | T120: 0.23922098082830748 | U120: 3
A121: 117 | B121: Niger | C121: NER | D121: -0.74407418144318294 | E121: 0.29137760175532934 | F121: 2 | G121: -0.7628382851895269 | H121: 0.41252284257447502 | I121: 1 | J121: -1.3866137923907753 | K121: 0.76816878371913544 | L121: 1 | M121: -0.52300524426155071 | N121: 0.51994095831945863 | O121: 2 | P121: -1.143864057160185 | Q121: 0.44307336250641616 | R121: 2 | S121: -1.5668121658543279 | T121: 0.74867439619943676 | U121: 1
A122: 118 | B122: Nigeria | C122: NGA | D122: -1.234344452915525 | E122: 0.25130023322348893 | F122: 4 | G122: -1.0544861637286871 | H122: 0.26599811359710124 | I122: 5 | J122: -1.3207674411490427 | K122: 0.22248178800615603 | L122: 6 | M122: -0.35159944173553426 | N122: 0.29118732384969281 | O122: 5 | P122: -1.0974759141193968 | Q122: 0.2531854041328267 | R122: 6 | S122: -0.95373395869528599 | T122: 0.20180269482655613 | U122: 6
A123: 119 | B123: Nicaragua | C123: NIC | D123: 6.9010128239124752E-2 | E123: 0.25402694431067208 | F123: 3 | G123: -0.32343975269679243 | H123: 0.31873333373090551 | I123: 3 | J123: -0.54716746752991341 | K123: 0.37414236442207388 | L123: 2 | M123: -0.10250672580652591 | N123: 0.51994095831945863 | O123: 2 | P123: -0.72578088856461132 | Q123: 0.27756710773103799 | R123: 4 | S123: -0.83610581602138978 | T123: 0.24849503105537538 | U123: 3
A124: 120 | B124: Netherlands | C124: NLD | D124: 1.6074606954482535 | E124: 0.25402694431067208 | F124: 4 | G124: 1.4788705613589805 | H124: 0.26334453452009404 | I124: 5 | J124: 2.0302413016471581 | K124: 0.24866131188801807 | L124: 6 | M124: 1.1409827572037412 | N124: 0.22904640098569978 | O124: 5 | P124: 1.5839411296446553 | Q124: 0.21813983950894791 | R124: 7 | S124: 2.0264072699306945 | T124: 0.19805508574877892 | U124: 7
A125: 121 | B125: Norway | C125: NOR | D125: 1.653784187553818 | E125: 0.25402694431067208 | F125: 4 | G125: 1.4144283155229094 | H125: 0.26334453452009404 | I125: 5 | J125: 1.6662177044204756 | K125: 0.24866131188801807 | L125: 6 | M125: 0.93212358669214346 | N125: 0.22904640098569978 | O125: 5 | P125: 1.8333934496441047 | Q125: 0.21813983950894791 | R125: 7 | S125: 1.686545690363213 | T125: 0.19805508574877892 | U125: 7
A126: 122 | B126: Nepal | C126: NPL | D126: 4.7365463347793076E-2 | E126: 0.36031461549530619 | F126: 1 | G126: .. | H126: .. | I126: .. | J126: .. | K126: .. | L126: .. | M126: -0.35978650199732215 | N126: 0.60188084442426626 | O126: 1 | P126: -0.55783560742932603 | Q126: 0.60058386521254259 | R126: 1 | S126: .. | T126: .. | U126: ..
A127: 123 | B127: New Zealand | C127: NZL | D127: 1.4570076105795191 | E127: 0.25402694431067208 | F127: 4 | G127: 1.4159394169265673 | H127: 0.28355035712187776 | I127: 4 | J127: 1.5712871973582454 | K127: 0.26644174895434825 | L127: 5 | M127: 1.2049273660644035 | N127: 0.22904640098569978 | O127: 5 | P127: 1.8240022905079323 | Q127: 0.23004193092994482 | R127: 6 | S127: 2.0749421966120853 | T127: 0.20069157159218198 | U127: 6
A128: 124 | B128: Oman | C128: OMN | D128: -0.57013742033398496 | E128: 0.25402694431067208 | F128: 3 | G128: 0.91173894890487783 | H128: 0.29988188904282925 | I128: 3 | J128: 0.89976388517880279 | K128: 0.31908959204123422 | L128: 3 | M128: 0.30496800987664752 | N128: 0.39525422199815724 | O128: 3 | P128: 1.0768737020434547 | Q128: 0.27634968636657775 | R128: 4 | S128: 0.48366268595154477 | T128: 0.26706317040829514 | U128: 3
A129: 125 | B129: Pakistan | C129: PAK | D129: -0.44053240973166652 | E129: 0.25402694431067208 | F129: 3 | G129: -0.65410384511708519 | H129: 0.26334453452009404 | I129: 5 | J129: -0.7444444772159049 | K129: 0.2598634108510659 | L129: 5 | M129: -0.19784478192492747 | N129: 0.27454340772656499 | O129: 4 | P129: -0.76036473709330121 | Q129: 0.23542062698000482 | R129: 6 | S129: -0.7687928296646015 | T129: 0.21583131268342742 | U129: 6
A130: 126 | B130: Panama | C130: PAN | D130: 0.66486409496692467 | E130: 0.25402694431067208 | F130: 3 | G130: 0.14854399580717001 | H130: 0.29988188904282925 | I130: 3 | J130: -0.27657204063011992 | K130: 0.31908959204123422 | L130: 3 | M130: 1.0017098959628787 | N130: 0.39525422199815724 | O130: 3 | P130: -0.39191092345168688 | Q130: 0.27634968636657775 | R130: 4 | S130: -0.45828542046601534 | T130: 0.26706317040829514 | U130: 3
A131: 127 | B131: Peru | C131: PER | D131: -0.68724884449783386 | E131: 0.25130023322348893 | F131: 4 | G131: -0.52896037657762063 | H131: 0.25228486761247954 | I131: 6 | J131: 0.17346460106772363 | K131: 0.24285424490428439 | L131: 6 | M131: 0.66871539911413036 | N131: 0.27405060086349636 | O131: 5 | P131: -0.5216583171247885 | Q131: 0.22249449921545333 | R131: 7 | S131: -0.19952274964841313 | T131: 0.21344740542441654 | U131: 6
A132: 128 | B132: Philippines | C132: PHL | D132: 0.61354355309714326 | E132: 0.25402694431067208 | F132: 5 | G132: 0.27294274491449522 | H132: 0.26334453452009404 | I132: 5 | J132: 0.12646049818518471 | K132: 0.24866131188801807 | L132: 6 | M132: 0.5653442365195519 | N132: 0.22904640098569978 | O132: 5 | P132: -7.7658449611357455E-2 | Q132: 0.21813983950894791 | R132: 7 | S132: -0.22809035295426516 | T132: 0.16383974411547927 | U132: 7
A133: 129 | B133: Papua New Guinea | C133: PNG | D133: 0.1210078594832968 | E133: 0.25402694431067208 | F133: 3 | G133: -0.39766451590283747 | H133: 0.34248229323012747 | I133: 2 | J133: -0.694273918478437 | K133: 0.37414236442207388 | L133: 2 | M133: -0.12874980696358554 | N133: 0.51994095831945863 | O133: 2 | P133: -0.30687778904128504 | Q133: 0.3138946252365733 | R133: 3 | S133: -0.85367190654123626 | T133: 0.2961069418304243 | U133: 2
A134: 130 | B134: Poland | C134: POL | D134: 1.0701435834095394 | E134: 0.25130023322348893 | F134: 6 | G134: 0.83679114026452639 | H134: 0.21591513909296886 | I134: 7 | J134: 0.67402191916468812 | K134: 0.20697929466807191 | L134: 8 | M134: 0.5649498640648235 | N134: 0.19196454475476876 | O134: 7 | P134: 0.5378882317561956 | Q134: 0.16025055709462124 | R134: 10 | S134: 0.49190277558918633 | T134: 0.162862701383401 | U134: 9
A135: 131 | B135: Puerto Rico | C135: PRI | D135: .. | E135: .. | F135: .. | G135: 0.75960603111022051 | H135: 0.52746484204444311 | I135: 1 | J135: 1.2639489175068348 | K135: 0.5214504122426028 | L135: 1 | M135: 0.84487654645051646 | N135: 0.51974023621919629 | O135: 1 | P135: 0.77118129439746197 | Q135: 0.50346808045509683 | R135: 1 | S135: 1.1180428217294143 | T135: 0.52590974871530882 | U135: 1
A136: 132 | B136: Korea, Dem. Rep. | C136: PRK | D136: -1.7886783105733486 | E136: 0.29137760175532934 | F136: 2 | G136: 0.37213747659353447 | H136: 0.41252284257447502 | I136: 1 | J136: -0.30141500175701852 | K136: 0.76816878371913544 | L136: 1 | M136: -1.4008644430820911 | N136: 0.51994095831945863 | O136: 2 | P136: -0.6671683887243075 | Q136: 0.44307336250641616 | R136: 2 | S136: -0.53471452504134276 | T136: 0.74867439619943676 | U136: 1
A137: 133 | B137: Portugal | C137: PRT | D137: 1.4792875486951418 | E137: 0.25130023322348893 | F137: 5 | G137: 1.3850770909438732 | H137: 0.25228486761247954 | I137: 6 | J137: 1.1512038694785007 | K137: 0.23363653218585126 | L137: 7 | M137: 0.889263512052202 | N137: 0.22876000329023777 | O137: 6 | P137: 1.0833252136506515 | Q137: 0.20773727561581487 | R137: 8 | S137: 1.2179071090278533 | T137: 0.18909298753709736 | U137: 8
A138: 134 | B138: Paraguay | C138: PRY | D138: -0.4191469362798339 | E138: 0.25130023322348893 | F138: 4 | G138: -0.57093027742656233 | H138: 0.31915287616104948 | I138: 3 | J138: -1.1001550005409613 | K138: 0.32807669277493695 | L138: 3 | M138: 0.36965153368332943 | N138: 0.51661669269246691 | O138: 3 | P138: -0.69547095796788361 | Q138: 0.28505666681472658 | R138: 4 | S138: -0.95837041801488099 | T138: 0.26842378896013652 | U138: 3
A139: 135 | B139: Qatar | C139: QAT | D139: -0.7754924224585511 | E139: 0.25402694431067208 | F139: 3 | G139: 1.3826613795104528 | H139: 0.29988188904282925 | I139: 3 | J139: 0.47982341312178645 | K139: 0.31908959204123422 | L139: 3 | M139: 0.32658636077538622 | N139: 0.39525422199815724 | O139: 3 | P139: 1.2693962872617988 | Q139: 0.27634968636657775 | R139: 4 | S139: 0.57025621375922031 | T139: 0.26706317040829514 | U139: 3
A140: 136 | B140: Reunion | C140: REU | D140: .. | E140: .. | F140: .. | G140: .. | H140: .. | I140: .. | J140: .. | K140: .. | L140: .. | M140: .. | N140: .. | O140: .. | P140: .. | Q140: .. | R140: .. | S140: .. | T140: .. | U140: ..
A141: 137 | B141: Romania | C141: ROM | D141: 0.40579567735530286 | E141: 0.25402694431067208 | F141: 4 | G141: 2.3685300230949745E-2 | H141: 0.24354998171430456 | I141: 4 | J141: -0.56954870964168658 | K141: 0.25955068050331376 | L141: 4 | M141: 0.1993319812386411 | N141: 0.26326125682519685 | O141: 4 | P141: -8.7639660545584641E-2 | Q141: 0.1861376812882912 | R141: 6 | S141: -0.45704813449752379 | T141: 0.18987227333382842 | U141: 6
A142: 138 | B142: Russian Federation | C142: RUS | D142: -0.3112684380169759 | E142: 0.25130023322348893 | F142: 6 | G142: -0.68595885159469128 | H142: 0.21591513909296886 | I142: 7 | J142: -0.59451526229779705 | K142: 0.20697929466807191 | L142: 8 | M142: -0.30305446213512316 | N142: 0.19196454475476876 | O142: 7 | P142: -0.72236150218120643 | Q142: 0.16025055709462124 | R142: 10 | S142: -0.61641792467909373 | T142: 0.15872427647504828 | U142: 10
A143: 139 | B143: Rwanda | C143: RWA | D143: -1.1745607436875782 | E143: 0.36031461549530619 | F143: 1 | G143: .. | H143: .. | I143: .. | J143: .. | K143: .. | L143: .. | M143: -1.169838061764453 | N143: 0.60188084442426626 | O143: 1 | P143: -1.2036375560023957 | Q143: 0.60058386521254259 | R143: 1 | S143: .. | T143: .. | U143: ..
A144: 140 | B144: Saudi Arabia | C144: SAU | D144: -1.1030625097814815 | E144: 0.25402694431067208 | F144: 3 | G144: 0.23892072789390917 | H144: 0.27627136674287806 | I144: 4 | J144: -0.34876157326587237 | K144: 0.28978914382329912 | L144: 4 | M144: -0.14866746520517207 | N144: 0.39525422199815724 | O144: 3 | P144: 0.49359093898186851 | Q144: 0.25638815719447205 | R144: 5 | S144: -0.57535118438246402 | T144: 0.26094287716947417 | U144: 4
A145: 141 | B145: Sudan | C145: SDN | D145: -1.4980556187374707 | E145: 0.25402694431067208 | F145: 3 | G145: -1.7319929306411948 | H145: 0.34248229323012747 | I145: 2 | J145: -1.6974981983169284 | K145: 0.37414236442207388 | L145: 2 | M145: -0.82791236389541356 | N145: 0.51994095831945863 | O145: 2 | P145: -1.3461298316598331 | Q145: 0.3138946252365733 | R145: 3 | S145: -1.0151196581536006 | T145: 0.2961069418304243 | U145: 2
A146: 142 | B146: Senegal | C146: SEN | D146: -0.29171288415045371 | E146: 0.25130023322348893 | F146: 4 | G146: -0.87125817585656529 | H146: 0.31915287616104948 | I146: 3 | J146: 4.7393144029681138E-2 | K146: 0.28640182983633161 | L146: 4 | M146: -0.33769085919806557 | N146: 0.51661669269246691 | O146: 3 | P146: -9.7340965303572044E-2 | Q146: 0.28505666681472658 | R146: 4 | S146: -0.23549296752031018 | T146: 0.26842378896013652 | U146: 3
A147: 143 | B147: Singapore | C147: SGP | D147: 3.9807268377849564E-2 | E147: 0.25130023322348893 | F147: 6 | G147: 1.3858914628879786 | H147: 0.25228486761247954 | I147: 6 | J147: 2.0821981162760688 | K147: 0.23363653218585126 | L147: 7 | M147: 1.2447775768512315 | N147: 0.22876000329023777 | O147: 6 | P147: 1.9390344925186949 | Q147: 0.20773727561581487 | R147: 8 | S147: 1.9475060127215491 | T147: 0.15865659221332654 | U147: 8
A148: 144 | B148: Solomon Islands | C148: SLB | D148: 1.1726421372855891 | E148: 0.36031461549530619 | F148: 1 | G148: .. | H148: .. | I148: .. | J148: .. | K148: .. | L148: .. | M148: .. | N148: .. | O148: .. | P148: .. | Q148: .. | R148: .. | S148: .. | T148: .. | U148: ..
A149: 145 | B149: Sierra Leone | C149: SLE | D149: -1.6233668341742804 | E149: 0.29137760175532934 | F149: 2 | G149: -1.5194887945582021 | H149: 0.41252284257447502 | I149: 1 | J149: 8.6417987560675636E-3 | K149: 0.76816878371913544 | L149: 1 | M149: -1.5008318425718046 | N149: 0.51994095831945863 | O149: 2 | P149: -0.90551622294224621 | Q149: 0.44307336250641616 | R149: 2 | S149: -1.8665703086703719E-2 | T149: 0.74867439619943676 | U149: 1
A150: 146 | B150: El Salvador | C150: SLV | D150: -0.1001897658586632 | E150: 0.25402694431067208 | F150: 3 | G150: -2.1217878554327052E-2 | H150: 0.31873333373090551 | I150: 3 | J150: -0.26179485874720165 | K150: 0.37414236442207388 | L150: 2 | M150: 1.2327131497206449 | N150: 0.51994095831945863 | O150: 2 | P150: -0.65636467144354793 | Q150: 0.27756710773103799 | R150: 4 | S150: -0.35356553917485356 | T150: 0.22347192384126532 | U150: 4
A151: 147 | B151: Somalia | C151: SOM | D151: -1.6938714902405378 | E151: 0.29137760175532934 | F151: 2 | G151: -1.7086514230353467 | H151: 0.41252284257447502 | I151: 1 | J151: -1.6966705929038615 | K151: 0.76816878371913544 | L151: 1 | M151: -1.7688768021246193 | N151: 0.51994095831945863 | O151: 2 | P151: -1.495346237708413 | Q151: 0.44307336250641616 | R151: 2 | S151: -1.0507633438996888 | T151: 0.74867439619943676 | U151: 1
A152: 148 | B152: Sao Tome and Principe | C152: STP | D152: 0.82056170327565869 | E152: 0.36031461549530619 | F152: 1 | G152: .. | H152: .. | I152: .. | J152: .. | K152: .. | L152: .. | M152: .. | N152: .. | O152: .. | P152: .. | Q152: .. | R152: .. | S152: .. | T152: .. | U152: ..
A153: 149 | B153: Suriname | C153: SUR | D153: 0.28261603125659895 | E153: 0.29137760175532934 | F153: 2 | G153: -0.19535040429799619 | H153: 0.41252284257447502 | I153: 1 | J153: -0.14638660150047547 | K153: 0.76816878371913544 | L153: 1 | M153: -0.5861104854996585 | N153: 0.51994095831945863 | O153: 2 | P153: -0.72977513266813221 | Q153: 0.44307336250641616 | R153: 2 | S153: -1.8665703086703719E-2 | T153: 0.74867439619943676 | U153: 1
A154: 150 | B154: Slovak Republic | C154: SVK | D154: 0.73775615945206374 | E154: 0.25130023322348893 | F154: 5 | G154: 0.65034181624536191 | H154: 0.22663871542597638 | I154: 6 | J154: -3.1754158929577336E-2 | K154: 0.22421487146088617 | L154: 6 | M154: 0.16760463311523752 | N154: 0.21645937618189412 | O154: 6 | P154: 0.13405598739383026 | Q154: 0.17187769714012563 | R154: 8 | S154: 3.0088359764254141E-2 | T154: 0.17405262128716076 | U154: 7
A155: 151 | B155: Slovenia | C155: SVN | D155: 1.0663586389669255 | E155: 0.25402694431067208 | F155: 4 | G155: 1.0930420346257077 | H155: 0.24354998171430456 | I155: 4 | J155: 0.56726681290344172 | K155: 0.25955068050331376 | L155: 4 | M155: 0.53154661421746363 | N155: 0.26326125682519685 | O155: 4 | P155: 0.82548346319800581 | Q155: 0.1861376812882912 | R155: 6 | S155: 1.0228059766063373 | T155: 0.21360526834447727 | U155: 4
A156: 152 | B156: Sweden | C156: SWE | D156: 1.6280489151912487 | E156: 0.25402694431067208 | F156: 4 | G156: 1.41091877442809 | H156: 0.26334453452009404 | I156: 5 | J156: 1.5728030134094835 | K156: 0.24866131188801807 | L156: 6 | M156: 0.85294331420019753 | N156: 0.22904640098569978 | O156: 5 | P156: 1.6230324824694748 | Q156: 0.21813983950894791 | R156: 7 | S156: 2.0853368988304859 | T156: 0.19805508574877892 | U156: 7
A157: 153 | B157: Swaziland | C157: SWZ | D157: -0.77760731483085266 | E157: 0.36031461549530619 | F157: 1 | G157: -1.6942245500284423 | H157: 0.6061771357665019 | I157: 1 | J157: -0.47407399836740294 | K157: 0.32907595010589286 | L157: 2 | M157: 0.29382105881922338 | N157: 0.35124420467647216 | O157: 2 | P157: -6.2168598845925724E-2 | Q157: 0.5660803383253904 | R157: 2 | S157: 7.1867430269489836E-3 | T157: 0.37611079170421424 | U157: 1
A158: 154 | B158: Syrian Arab Republic | C158: SYR | D158: -1.3577709168817529 | E158: 0.25402694431067208 | F158: 3 | G158: 8.3332721723779674E-2 | H158: 0.29988188904282925 | I158: 3 | J158: -1.1808869811959986 | K158: 0.31908959204123422 | L158: 3 | M158: -0.91532426663525046 | N158: 0.39525422199815724 | O158: 3 | P158: -0.29081387838783451 | Q158: 0.27634968636657775 | R158: 4 | S158: -0.78875794703498525 | T158: 0.26706317040829514 | U158: 3
A159: 155 | B159: Chad | C159: TCD | D159: -0.8536909848635158 | E159: 0.35265752232120906 | F159: 2 | G159: -0.73598574163300268 | H159: 0.66053614439227493 | I159: 1 | J159: -0.71436849482699039 | K159: 0.5637075668724989 | L159: 1 | M159: -0.73958284851770884 | N159: 0.59674094290048185 | O159: 2 | P159: -0.82692029870495087 | Q159: 0.45038851528650714 | R159: 2 | S159: -0.58700797207725153 | T159: 0.53653470441187612 | U159: 1
A160: 156 | B160: Togo | C160: TGO | D160: -1.0510911161549397 | E160: 0.28728334123682875 | F160: 3 | G160: -0.90568302204879081 | H160: 0.37350218211437147 | I160: 2 | J160: -0.37425541437259524 | K160: 0.51020118372025602 | L160: 2 | M160: -0.85287683211130538 | N160: 0.51661669269246691 | O160: 3 | P160: -0.7993851653092765 | Q160: 0.37135850669511394 | R160: 3 | S160: -0.2420914810603231 | T160: 0.48462245571009516 | U160: 2
A161: 157 | B161: Thailand | C161: THA | D161: 0.21538950289586084 | E161: 0.25130023322348893 | F161: 6 | G161: 0.2461178006073827 | H161: 0.25228486761247954 | I161: 6 | J161: 9.7676169721577846E-3 | K161: 0.23363653218585126 | L161: 7 | M161: 0.19216792549730768 | N161: 0.22876000329023777 | O161: 6 | P161: 0.41306970156076039 | Q161: 0.20773727561581487 | R161: 8 | S161: -0.16479157704324709 | T161: 0.15865659221332654 | U161: 8
A162: 158 | B162: Tajikistan | C162: TJK | D162: -1.5646106322469115 | E162: 0.36031461549530619 | F162: 2 | G162: -1.8622715048456606 | H162: 0.32733070851464285 | I162: 2 | J162: -1.4225978773593777 | K162: 0.33902373717435624 | L162: 2 | M162: -1.5195519429523292 | N162: 0.27226595507395668 | O162: 3 | P162: -1.3348928309839214 | Q162: 0.21573830615955589 | R162: 4 | S162: -1.3157759412363537 | T162: 0.25531057815316954 | U162: 3
A163: 159 | B163: Turkmenistan | C163: TKM | D163: -1.4507022592789269 | E163: 0.36031461549530619 | F163: 2 | G163: 3.8334542740207107E-3 | H163: 0.32733070851464285 | I163: 2 | J163: -1.2522579311602571 | K163: 0.33902373717435624 | L163: 2 | M163: -1.9311902790637929 | N163: 0.27226595507395668 | O163: 3 | P163: -0.97138643362975419 | Q163: 0.21573830615955589 | R163: 4 | S163: -1.2893334952185298 | T163: 0.25531057815316954 | U163: 3
A164: 160 | B164: Trinidad and Tobago& Tob* | C164: TTO | D164: 0.9532491618712825 | E164: 0.25402694431067208 | F164: 3 | G164: 0.31527158288389395 | H164: 0.34248229323012747 | I164: 2 | J164: 0.5207697459924624 | K164: 0.37414236442207388 | L164: 2 | M164: 0.71755677177399091 | N164: 0.51994095831945863 | O164: 2 | P164: 0.51403673984688758 | Q164: 0.3138946252365733 | R164: 3 | S164: 0.51051523437965984 | T164: 0.2961069418304243 | U164: 2
A165: 161 | B165: Tunisia | C165: TUN | D165: -0.58860849462942777 | E165: 0.25402694431067208 | F165: 3 | G165: 0.66097742012717331 | H165: 0.27905845743699148 | I165: 4 | J165: 0.63287580631365004 | K165: 0.23533770853731531 | L165: 5 | M165: 0.42900570775695634 | N165: 0.29177868538636526 | O165: 4 | P165: 0.64764807873700658 | Q165: 0.27274644247184715 | R165: 5 | S165: 2.0011949898237062E-2 | T165: 0.22310568461604569 | U165: 4
A166: 162 | B166: Turkey | C166: TUR | D166: -0.85927816487445785 | E166: 0.25130023322348893 | F166: 5 | G166: -0.94375682308602271 | H166: 0.25228486761247954 | I166: 6 | J166: -0.41227210497783351 | K166: 0.23363653218585126 | L166: 7 | M166: 0.59491923923956824 | N166: 0.22876000329023777 | O166: 6 | P166: -1.0424009210796652E-2 | Q166: 0.20773727561581487 | R166: 8 | S166: -0.34886993489243479 | T166: 0.18909298753709736 | U166: 8
A167: 163 | B167: Taiwan, China | C167: TWN | D167: 0.7061905373082723 | E167: 0.25402694431067208 | F167: 5 | G167: 0.93853326244357371 | H167: 0.26334453452009404 | I167: 5 | J167: 1.2936641101344104 | K167: 0.24866131188801807 | L167: 6 | M167: 0.82861130204296107 | N167: 0.22904640098569978 | O167: 5 | P167: 0.92814257216132989 | Q167: 0.21813983950894791 | R167: 7 | S167: 0.62569277138588764 | T167: 0.15962830533624117 | U167: 8
A168: 164 | B168: Tanzania | C168: TZA | D168: -0.28345670099894266 | E168: 0.25130023322348893 | F168: 4 | G168: 0.56549267766776601 | H168: 0.26599811359710124 | I168: 5 | J168: -0.48533728473468646 | K168: 0.22248178800615603 | L168: 6 | M168: 0.18264872223997117 | N168: 0.29118732384969281 | O168: 5 | P168: 0.16084266276451878 | Q168: 0.2531854041328267 | R168: 6 | S168: -0.92386727832905491 | T168: 0.21052052859001816 | U168: 5
A169: 165 | B169: Uganda | C169: UGA | D169: -0.51721204720073377 | E169: 0.25130023322348893 | F169: 4 | G169: -0.98039395532938145 | H169: 0.26599811359710124 | I169: 5 | J169: -0.25057898576132931 | K169: 0.22248178800615603 | L169: 6 | M169: 0.18355962363041203 | N169: 0.29118732384969281 | O169: 5 | P169: -1.3319738104621512E-2 | Q169: 0.2531854041328267 | R169: 6 | S169: -0.465943384422014 | T169: 0.21052052859001816 | U169: 5
A170: 166 | B170: Ukraine | C170: UKR | D170: -8.4113812952355729E-3 | E170: 0.25130023322348893 | F170: 5 | G170: -0.24201688707316882 | H170: 0.21591513909296886 | I170: 7 | J170: -0.89290845414072462 | K170: 0.21330665413765773 | L170: 7 | M170: -0.7208292810791278 | N170: 0.21645937618189412 | O170: 6 | P170: -0.70745607973327396 | Q170: 0.16673961587268077 | R170: 9 | S170: -0.89165536807654455 | T170: 0.16744402822473969 | U170: 9
A171: 167 | B171: Uruguay | C171: URY | D171: 0.76979660502873615 | E171: 0.25402694431067208 | F171: 3 | G171: 0.34793648528719973 | H171: 0.29988188904282925 | I171: 3 | J171: 0.61779250728691126 | K171: 0.31908959204123422 | L171: 3 | M171: 0.94877636997424286 | N171: 0.39525422199815724 | O171: 3 | P171: 0.26980590593428905 | Q171: 0.27634968636657775 | R171: 4 | S171: 0.42961512203885627 | T171: 0.24990333019781036 | U171: 4
A172: 168 | B172: United States | C172: USA | D172: 1.5046982710093688 | E172: 0.25130023322348893 | F172: 6 | G172: 1.0959887335273921 | H172: 0.25228486761247954 | I172: 6 | J172: 1.3658510155010322 | K172: 0.23363653218585126 | L172: 7 | M172: 1.135074568694195 | N172: 0.22876000329023777 | O172: 6 | P172: 1.2541184418853002 | Q172: 0.20773727561581487 | R172: 8 | S172: 1.4068375500297514 | T172: 0.19620820843666348 | U172: 7
A173: 169 | B173: Uzbekistan | C173: UZB | D173: -1.3433286807786045 | E173: 0.29161828587045291 | F173: 4 | G173: -0.33294261497898847 | H173: 0.27446907042963703 | I173: 4 | J173: -1.3048257367980496 | K173: 0.24771565952893812 | L173: 4 | M173: -1.3978224420964669 | N173: 0.27178528950467506 | O173: 4 | P173: -0.86959972527619678 | Q173: 0.18666918154371528 | R173: 6 | S173: -0.96325332222762494 | T173: 0.19091402626465273 | U173: 5
A174: 170 | B174: Venezuela, RB | C174: VEN | D174: 0.17908024330487426 | E174: 0.25130023322348893 | F174: 5 | G174: -0.24983547097389192 | H174: 0.25228486761247954 | I174: 6 | J174: -0.84920797665078129 | K174: 0.23363653218585126 | L174: 7 | M174: 8.950740243290678E-2 | N174: 0.22876000329023777 | O174: 6 | P174: -0.66155782738474467 | Q174: 0.20773727561581487 | R174: 8 | S174: -0.72488576250163439 | T174: 0.19620820843666348 | U174: 7
A175: 171 | B175: Vietnam | C175: VNM | D175: -1.4157027443978394 | E175: 0.25402694431067208 | F175: 4 | G175: 0.65329953441364796 | H175: 0.26334453452009404 | I175: 5 | J175: -0.29986293839707967 | K175: 0.2598634108510659 | L175: 5 | M175: -0.45879331168115195 | N175: 0.27454340772656499 | O175: 4 | P175: -0.43651695944185942 | Q175: 0.23542062698000482 | R175: 6 | S175: -0.33190744891853363 | T175: 0.17348306999877741 | U175: 6
A176: 172 | B176: West Bank and Gaza | C176: WTB | D176: -0.13155287654175118 | E176: 0.86447617573589797 | F176: 1 | G176: 0.11116567122826156 | H176: 0.66053614439227493 | I176: 1 | J176: -8.87164917796225E-2 | K176: 0.5637075668724989 | L176: 1 | M176: -0.16182088293069852 | N176: 0.97694373036537951 | O176: 1 | P176: 1.2215946618769973 | Q176: 0.56277765399157664 | R176: 1 | S176: 0.36260323286912799 | T176: 0.53653470441187612 | U176: 1
A177: 173 | B177: Yemen, Rep. | C177: YEM | D177: -0.41468728570103375 | E177: 0.25402694431067208 | F177: 3 | G177: -1.4712301652975357 | H177: 0.34248229323012747 | I177: 2 | J177: -0.62072069256285589 | K177: 0.37414236442207388 | L177: 2 | M177: -0.52300524426155071 | N177: 0.51994095831945863 | O177: 2 | P177: -1.0081657380033668 | Q177: 0.3138946252365733 | R177: 3 | S177: -0.85367190654123626 | T177: 0.2961069418304243 | U177: 2
A178: 174 | B178: Yugoslavia, FR (Serbia/Montenegro) | C178: YUG | D178: -0.91975995994829496 | E178: 0.25402694431067208 | F178: 4 | G178: -1.4194995000846837 | H178: 0.2647727237382736 | I178: 3 | J178: -0.95327109471734817 | K178: 0.28669328014914724 | L178: 3 | M178: -1.5389354421568193 | N178: 0.71821352123625759 | O178: 1 | P178: -0.80648725628816909 | Q178: 0.20351085401942651 | R178: 4 | S178: -0.99452314445012791 | T178: 0.19951165199543741 | U178: 5
A179: 175 | B179: South Africa | C179: ZAF | D179: 0.99127280362861914 | E179: 0.25130023322348893 | F179: 5 | G179: -0.52679181353041893 | H179: 0.23950497539410898 | I179: 7 | J179: -9.8237958811934756E-3 | K179: 0.20561361077201445 | L179: 8 | M179: 0.24361670472254493 | N179: 0.20221972659853155 | O179: 7 | P179: -0.35141835283200906 | Q179: 0.20619359557235087 | R179: 9 | S179: 0.29886445016776991 | T179: 0.17140690602557451 | U179: 9
A180: 176 | B180: Congo, Dem. Rep. | C180: ZAR | D180: -1.5674623978178401 | E180: 0.29137760175532934 | F180: 2 | G180: -2.5863972540508726 | H180: 0.3435921145060854 | I180: 2 | J180: -1.7690530057507605 | K180: 0.4782359576251452 | L180: 2 | M180: -2.3404178684846326 | N180: 0.39525422199815724 | O180: 3 | P180: -2.1525234805433873 | Q180: 0.35269555758631449 | R180: 3 | S180: -1.5559835131437054 | T180: 0.47674996724200341 | U180: 2
A181: 177 | B181: Zambia | C181: ZMB | D181: -4.5586544199757564E-2 | E181: 0.25130023322348893 | F181: 4 | G181: -1.7818510496475459E-3 | H181: 0.26599811359710124 | I181: 5 | J181: -0.39893553910072233 | K181: 0.22248178800615603 | L181: 6 | M181: 0.25185885601012226 | N181: 0.29118732384969281 | O181: 5 | P181: -0.40167775873201533 | Q181: 0.2531854041328267 | R181: 6 | S181: -0.6142791178455218 | T181: 0.21052052859001816 | U181: 5
A182: 178 | B182: Zimbabwe | C182: ZWE | D182: -0.66562744945478791 | E182: 0.25130023322348893 | F182: 4 | G182: -0.54150705210054539 | H182: 0.26987977601169244 | I182: 5 | J182: -1.1291657344883741 | K182: 0.22248178800615603 | L182: 6 | M182: -0.34099621931536372 | N182: 0.23149631694168502 | O182: 6 | P182: -0.14567753799396543 | Q182: 0.23293385107779147 | R182: 7 | S182: -0.31873341014510748 | T182: 0.18460198033193845 | U182: 7

Sheet: OneCountryData
B2: DO NOT EDIT/CHANGE THIS CELL!!! | L2: 1 | O2: 1 | P2: 2 | Q2: 3 | R2: 4 | S2: 5 | T2: 6 | U2: 7 | V2: 8 | W2: 9 | X2: 10 | Y2: 11 | Z2: 12 | AA2: 13 | AB2: 14 | AC2: 15 | AD2: 16 | AE2: 17 | AF2: 18 | AG2: 19
P3: Voice and Accountability | Q3: Political Instability and Violence | R3: Government Effectiveness | S3: Regulatory Burden | T3: Rule of Law | U3: Graft | V3: Voice and Accountability | W3: Political Instability and Violence | X3: Government Effectiveness | Y3: Regulatory Burden | Z3: Rule of Law | AA3: Graft | AB3: Voice and Accountability | AC3: Political Instability and Violence | AD3: Government Effectiveness | AE3: Regulatory Burden | AF3: Rule of Law | AG3: Graft
A4: Country code | B4: =IF(OneCountryCharts!R[13]C[4]="",VLOOKUP(OneCountryCharts!R[7]C[4],OneCountryData!R[1]C[11]:R[183]C[13],3,0),VLOOKUP(OneCountryCharts!R[13]C[4],OneCountryData!R[1]C[11]:R[183]C[13],3,0)) -> NA() | C4: Estimate | D4: Upperbound | E4: Lowerbound | P4: Estimate | Q4: Estimate | R4: Estimate | S4: Estimate | T4: Estimate | U4: Estimate | V4: Upperbound | W4: Upperbound | X4: Upperbound | Y4: Upperbound | Z4: Upperbound | AA4: Upperbound | AB4: Lowerbound | AC4: Lowerbound | AD4: Lowerbound | AE4: Lowerbound | AF4: Lowerbound | AG4: Lowerbound | AJ4: EE/FSU | AK4: ASI | AL4: AFR | AM4: LAC | AN4: OECD
A5: Country | B5: =VLOOKUP(R[-1]C,R5C12:R187C13,2,0) -> NA() | C5: =R5C2 -> NA() | D5: =RC[-1] -> NA() | E5: =RC[-1] -> NA() | F5: Estimate | G5: Upperbound | H5: Lowerbound | I5: 90%CI-low | J5: 90%CI-high | L5: AFG | M5: Afghanistan | N5: 1 | O5: AFG | P5: 2.9069767441860002 | Q5: .. | R5: .. | S5: .. | T5: .. | U5: .. | V5: 19.653179190751445 | W5: .. | X5: .. | Y5: .. | Z5: .. | AA5: .. | AB5: 0 | AC5: .. | AD5: .. | AE5: .. | AF5: .. | AG5: .. | AI5: Afghanistan | AK5: 1
A6: 2 | B6: Voice and Accountability | C6: =IF(RC[3]="..","",RC[3]) -> NA() | D6: =IF(RC[3]="..","",RC[3]) -> NA() | E6: =IF(RC[3]="..","",RC[3]) -> NA() | F6: =VLOOKUP(R4C2,R5C15:R187C33,OneCountryData!RC1,0) -> NA() | G6: =IF(RC[-1]="..","..",VLOOKUP(R4C2,R5C15:R187C33,OneCountryData!RC1+6,0)-RC[-1]) -> NA() | H6: =IF(RC[-2]="..","..",RC[-2]-VLOOKUP(R4C2,R5C15:R187C33,OneCountryData!RC1+12,0)) -> NA() | I6: =MAX(RC[-6]-RC[-4],0) -> NA() | J6: =MIN(RC[-7]+RC[-6],100) -> NA() | L6: AGO | M6: Angola | N6: 1 | O6: AGO | P6: 15.697674418604702 | Q6: 3.2467532467532001 | R6: 3.8709677419354001 | S6: 20.606060606060598 | T6: 5.4545454545454 | U6: 14.935064935064901 | V6: 35.260115606936409 | W6: 10.322580645161295 | X6: 12.820512820512818 | Y6: 35.5421686746988 | Z6: 28.313253012048193 | AA6: 39.354838709677416 | AB6: 4.6242774566473992 | AC6: 1.2903225806451613 | AD6: 0.64102564102564108 | AE6: 8.4337349397590362 | AF6: 1.2048192771084338 | AG6: 1.935483870967742 | AI6: Angola | AL6: 1
A7: 3 | B7: Political Stability | C7: =IF(RC[3]="..","",RC[3]) -> NA() | D7: =IF(RC[3]="..","",RC[3]) -> NA() | E7: =IF(RC[3]="..","",RC[3]) -> NA() | F7: =VLOOKUP(R4C2,R5C15:R187C33,OneCountryData!RC1,0) -> NA() | G7: =IF(RC[-1]="..","..",VLOOKUP(R4C2,R5C15:R187C33,OneCountryData!RC1+6,0)-RC[-1]) -> NA() | H7: =IF(RC[-2]="..","..",RC[-2]-VLOOKUP(R4C2,R5C15:R187C33,OneCountryData!RC1+12,0)) -> NA() | I7: =MAX(RC[-6]-RC[-4],0) -> NA() | J7: =MIN(RC[-7]+RC[-6],100) -> NA() | L7: ALB | M7: Albania | N7: 1 | O7: ALB | P7: 53.488372093023294 | Q7: 14.285714285714299 | R7: 21.935483870967701 | S7: 21.2121212121212 | T7: 15.7575757575758 | U7: 8.4415584415583993 | V7: 67.630057803468205 | W7: 29.677419354838705 | X7: 50.641025641025642 | Y7: 33.132530120481931 | Z7: 32.53012048192771 | AA7: 32.903225806451616 | AB7: 31.213872832369944 | AC7: 7.741935483870968 | AD7: 8.3333333333333339 | AE7: 10.240963855421686 | AF7: 4.8192771084337354 | AG7: 1.2903225806451613 | AI7: Albania | AJ7: 1
A8: 4 | B8: Government Effectiveness | C8: =IF(RC[3]="..","",RC[3]) -> NA() | D8: =IF(RC[3]="..","",RC[3]) -> NA() | E8: =IF(RC[3]="..","",RC[3]) -> NA() | F8: =VLOOKUP(R4C2,R5C15:R187C33,OneCountryData!RC1,0) -> NA() | G8: =IF(RC[-1]="..","..",VLOOKUP(R4C2,R5C15:R187C33,OneCountryData!RC1+6,0)-RC[-1]) -> NA() | H8: =IF(RC[-2]="..","..",RC[-2]-VLOOKUP(R4C2,R5C15:R187C33,OneCountryData!RC1+12,0)) -> NA() | I8: =MAX(RC[-6]-RC[-4],0) -> NA() | J8: =MIN(RC[-7]+RC[-6],100) -> NA() | L8: ARE | M8: United Arab Emirates | N8: 1 | O8: ARE | P8: 33.720930232558096 | Q8: 79.870129870129901 | R8: 63.225806451612897 | S8: 60.606060606060595 | T8: 75.757575757575808 | U8: 57.792207792207797 | V8: 50.867052023121389 | W8: 96.129032258064512 | X8: 81.410256410256409 | Y8: 94.578313253012055 | Z8: 89.156626506024097 | AA8: 72.903225806451616 | AB8: 15.028901734104046 | AC8: 58.70967741935484 | AD8: 32.051282051282051 | AE8: 24.698795180722893 | AF8: 62.048192771084338 | AG8: 30.967741935483872 | AI8: United Arab Emirates | AK8: 1
A9: 5 | B9: Lack of Regulatory Burden | C9: =IF(RC[3]="..","",RC[3]) -> NA() | D9: =IF(RC[3]="..","",RC[3]) -> NA() | E9: =IF(RC[3]="..","",RC[3]) -> NA() | F9: =VLOOKUP(R4C2,R5C15:R187C33,OneCountryData!RC1,0) -> NA() | G9: =IF(RC[-1]="..","..",VLOOKUP(R4C2,R5C15:R187C33,OneCountryData!RC1+6,0)-RC[-1]) -> NA() | H9: =IF(RC[-2]="..","..",RC[-2]-VLOOKUP(R4C2,R5C15:R187C33,OneCountryData!RC1+12,0)) -> NA() | I9: =MAX(RC[-6]-RC[-4],0) -> NA() | J9: =MIN(RC[-7]+RC[-6],100) -> NA() | L9: ARG | M9: Argentina | N9: 1 | O9: ARG | P9: 66.279069767441896 | Q9: 69.480519480519504 | R9: 69.677419354838705 | S9: 77.575757575757592 | T9: 64.848484848484901 | U9: 48.051948051948102 | V9: 76.878612716763001 | W9: 83.870967741935488 | X9: 81.410256410256409 | Y9: 94.578313253012055 | Z9: 75.301204819277103 | AA9: 64.516129032258064 | AB9: 52.02312138728324 | AC9: 48.387096774193552 | AD9: 45.512820512820511 | AE9: 53.614457831325304 | AF9: 50 | AG9: 25.806451612903224 | AI9: Argentina | AM9: 1
A10: 6 | B10: Rule of Law | C10: =IF(RC[3]="..","",RC[3]) -> NA() | D10: =IF(RC[3]="..","",RC[3]) -> NA() | E10: =IF(RC[3]="..","",RC[3]) -> NA() | F10: =VLOOKUP(R4C2,R5C15:R187C33,OneCountryData!RC1,0) -> NA() | G10: =IF(RC[-1]="..","..",VLOOKUP(R4C2,R5C15:R187C33,OneCountryData!RC1+6,0)-RC[-1]) -> NA() | H10: =IF(RC[-2]="..","..",RC[-2]-VLOOKUP(R4C2,R5C15:R187C33,OneCountryData!RC1+12,0)) -> NA() | I10: =MAX(RC[-6]-RC[-4],0) -> NA() | J10: =MIN(RC[-7]+RC[-6],100) -> NA() | L10: ARM | M10: Armenia | N10: 1 | O10: ARM | P10: 55.232558139534902 | Q10: 31.168831168831201 | R10: 21.290322580645199 | S10: 22.424242424242401 | T10: 48.484848484848499 | U10: 20.129870129870099 | V10: 67.630057803468205 | W10: 51.612903225806448 | X10: 50.641025641025642 | Y10: 40.361445783132531 | Z10: 62.048192771084338 | AA10: 43.225806451612904 | AB10: 34.104046242774565 | AC10: 16.129032258064516 | AD10: 8.3333333333333339 | AE10: 12.048192771084338 | AF10: 32.53012048192771 | AG10: 3.225806451612903 | AI10: Armenia | AJ10: 1
A11: 7 | B11: Control of Corruption | C11: =IF(RC[3]="..","",RC[3]) -> NA() | D11: =IF(RC[3]="..","",RC[3]) -> NA() | E11: =IF(RC[3]="..","",RC[3]) -> NA() | F11: =VLOOKUP(R4C2,R5C15:R187C33,OneCountryData!RC1,0) -> NA() | G11: =IF(RC[-1]="..","..",VLOOKUP(R4C2,R5C15:R187C33,OneCountryData!RC1+6,0)-RC[-1]) -> NA() | H11: =IF(RC[-2]="..","..",RC[-2]-VLOOKUP(R4C2,R5C15:R187C33,OneCountryData!RC1+12,0)) -> NA() | I11: =MAX(RC[-6]-RC[-4],0) -> NA() | J11: =MIN(RC[-7]+RC[-6],100) -> NA() | L11: AUS | M11: Australia | N11: 1 | O11: AUS | P11: 97.674418604651208 | Q11: 88.3116883116883 | R11: 91.612903225806491 | S11: 93.3333333333333 | T11: 93.939393939393995 | U11: 90.909090909090892 | V11: 100 | W11: 100 | X11: 97.435897435897431 | Y11: 100 | Z11: 100 | AA11: 95.483870967741936 | AB11: 82.658959537572258 | AC11: 74.838709677419359 | AD11: 83.974358974358978 | AE11: 68.07228915662651 | AF11: 86.144578313253007 | AG11: 85.161290322580641 | AI11: Australia | AN11: 1
L12: AUT | M12: Austria | N12: 1 | O12: AUT | P12: 91.279069767441896 | Q12: 92.857142857142904 | R12: 86.451612903225808 | S12: 90.303030303030297 | T12: 97.575757575757606 | U12: 89.610389610389589 | V12: 100 | W12: 100 | X12: 96.15384615384616 | Y12: 100 | Z12: 100 | AA12: 94.193548387096769 | AB12: 76.878612716763001 | AC12: 80.645161290322577 | AD12: 81.410256410256409 | AE12: 66.867469879518069 | AF12: 90.361445783132524 | AG12: 84.516129032258064 | AI12: Austria | AN12: 1
A13: Country Name | B13: Country Code | L13: AZE | M13: Azerbaijan | N13: 1 | O13: AZE | P13: 19.1860465116279 | Q13: 34.415584415584398 | R13: 15.4838709677419 | S13: 13.3333333333333 | T13: 30.909090909090903 | U13: 7.1428571428570997 | V13: 37.572254335260112 | W13: 52.903225806451616 | X13: 37.820512820512818 | Y13: 24.698795180722897 | Z13: 47.590361445783131 | AA13: 27.096774193548384 | AB13: 6.9364161849710984 | AC13: 19.35483870967742 | AD13: 6.4102564102564106 | AE13: 4.8192771084337354 | AF13: 16.265060240963855 | AG13: 1.2903225806451613 | AI13: Azerbaijan | AJ13: 1
A14: Afghanistan | B14: AFG | L14: BDI | M14: Burundi | N14: 1 | O14: BDI | P14: 10.4651162790698 | Q14: .. | R14: .. | S14: 16.969696969697001 | T14: 17.575757575757599 | U14: .. | V14: 31.213872832369944 | W14: .. | X14: .. | Y14: 62.048192771084338 | Z14: 64.457831325301214 | AA14: .. | AB14: 0 | AC14: .. | AD14: .. | AE14: 1.8072289156626506 | AF14: 0.60240963855421692 | AG14: .. | AI14: Burundi | AL14: 1
A15: Angola | B15: AGO | L15: BEL | M15: Belgium | N15: 1 | O15: BEL | P15: 90.116279069767501 | Q15: 79.220779220779207 | R15: 83.225806451612911 | S15: 81.818181818181799 | T15: 76.969696969696997 | U15: 80.519480519480496 | V15: 100 | W15: 92.258064516129025 | X15: 90.384615384615387 | Y15: 99.397590361445779 | Z15: 86.746987951807228 | AA15: 84.516129032258064 | AB15: 76.300578034682076 | AC15: 60.645161290322584 | AD15: 70.512820512820511 | AE15: 62.048192771084338 | AF15: 65.060240963855421 | AG15: 67.741935483870961 | AI15: Belgium | AN15: 1
A16: Albania | B16: ALB | L16: BEN | M16: Benin | N16: 1 | O16: BEN | P16: 70.930232558139508 | Q16: 17.5324675324675 | R16: 50.9677419354839 | S16: 38.787878787878796 | T16: 37.575757575757599 | U16: 22.0779220779221 | V16: 89.017341040462426 | W16: 63.225806451612904 | X16: 83.974358974358978 | Y16: 94.578313253012055 | Z16: 66.867469879518069 | AA16: 67.096774193548384 | AB16: 54.335260115606935 | AC16: 1.935483870967742 | AD16: 8.9743589743589745 | AE16: 9.0361445783132535 | AF16: 4.8192771084337354 | AG16: 0 | AI16: Benin | AN16: 1
A17: United Arab Emirates | B17: ARE | L17: BFA | M17: Burkina Faso | N17: 1 | O17: BFA | P17: 44.1860465116279 | Q17: 29.220779220779203 | R17: 52.258064516128997 | S17: 41.212121212121197 | T17: 42.424242424242401 | U17: 40.909090909090899 | V17: 63.583815028901732 | W17: 57.41935483870968 | X17: 74.358974358974365 | Y17: 75.903614457831324 | Z17: 66.867469879518069 | AA17: 68.387096774193552 | AB17: 23.121387283236995 | AC17: 10.32258064516129 | AD17: 20.512820512820515 | AE17: 21.686746987951807 | AF17: 8.4337349397590362 | AG17: 4.5161290322580649 | AI17: Burkina Faso | AN17: 1
A18: Argentina | B18: ARG | L18: BGD | M18: Bangladesh | N18: 1 | O18: BGD | P18: 52.325581395348799 | Q18: 32.4675324675325 | R18: 28.387096774193598 | S18: 34.545454545454504 | T18: 14.545454545454501 | U18: 46.103896103896105 | V18: 66.473988439306368 | W18: 56.774193548387096 | X18: 60.897435897435898 | Y18: 77.108433734939752 | Z18: 39.75903614457831 | AA18: 67.096774193548384 | AB18: 35.260115606936417 | AC18: 14.838709677419354 | AD18: 8.3333333333333339 | AE18: 14.457831325301205 | AF18: 3.0120481927710845 | AG18: 20 | AI18: Bangladesh | AK18: 1
A19: Armenia | B19: ARM | L19: BGR | M19: Bulgaria | N19: 1 | O19: BGR | P19: 68.023255813953497 | Q19: 66.883116883116898 | R19: 17.419354838709701 | S19: 68.484848484848499 | T19: 47.878787878787897 | U19: 30.519480519480503 | V19: 82.080924855491332 | W19: 80.645161290322577 | X19: 39.102564102564102 | Y19: 93.975903614457835 | Z19: 62.048192771084338 | AA19: 52.258064516129032 | AB19: 58.959537572254334 | AC19: 47.741935483870968 | AD19: 7.0512820512820511 | AE19: 42.7710843373494 | AF19: 33.734939759036145 | AG19: 12.258064516129032 | AI19: Bulgaria | AJ19: 1
A20: Australia | B20: AUS | L20: BHR | M20: Bahrain | N20: 1 | O20: BHR | P20: 15.116279069767399 | Q20: 45.454545454545496 | R20: 68.387096774193594 | S20: 80.606060606060609 | T20: 73.3333333333333 | U20: 51.948051948051898 | V20: 34.104046242774572 | W20: 69.677419354838705 | X20: 82.692307692307693 | Y20: 100 | Z20: 86.144578313253007 | AA20: 68.387096774193552 | AB20: 4.6242774566473992 | AC20: 24.516129032258064 | AD20: 37.179487179487182 | AE20: 42.7710843373494 | AF20: 57.831325301204821 | AG20: 25.161290322580644 | AI20: Bahrain | AK20: 1
A21: Austria | B21: AUT | L21: BHS | M21: Bahamas, The | N21: 1 | O21: BHS | P21: 83.139534883720899 | Q21: 63.636363636363605 | R21: 71.612903225806505 | S21: 86.6666666666667 | T21: 72.121212121212096 | U21: 73.3766233766234 | V21: 100 | W21: 87.741935483870975 | X21: 98.07692307692308 | Y21: 100 | Z21: 90.963855421686745 | AA21: 95.483870967741936 | AB21: 67.630057803468205 | AC21: 31.612903225806452 | AD21: 12.179487179487179 | AE21: 34.939759036144579 | AF21: 43.975903614457835 | AG21: 9.0322580645161299 | AI21: Bahamas, The | AN21: 1
A22: Azerbaijan | B22: AZE | L22: BIH | M22: Bosnia and Herzegovina | N22: 1 | O22: BIH | P22: 16.860465116279101 | Q22: 11.6883116883117 | R22: 10.322580645161301 | S22: 8.4848484848483992 | T22: 9.696969696969699 | U22: 42.207792207792203 | V22: 42.774566473988436 | W22: 31.612903225806448 | X22: 40.384615384615387 | Y22: 21.686746987951807 | Z22: 30.120481927710841 | AA22: 75.483870967741936 | AB22: 2.3121387283236996 | AC22: 1.935483870967742 | AD22: 0 | AE22: 2.4096385542168677 | AF22: 1.8072289156626506 | AG22: 3.225806451612903 | AI22: Bosnia and Herzegovina | AJ22: 1
A23: Burundi | B23: BDI | L23: BLR | M23: Belarus | N23: 1 | O23: BLR | P23: 34.302325581395401 | Q23: 33.766233766233796 | R23: 20.645161290322601 | S23: 5.4545454545454 | T23: 18.181818181818198 | U23: 25.974025974025999 | V23: 56.069364161849713 | W23: 54.193548387096776 | X23: 50.641025641025642 | Y23: 14.4578313253012 | Z23: 34.939759036144579 | AA23: 51.612903225806448 | AB23: 13.872832369942197 | AC23: 18.70967741935484 | AD23: 7.6923076923076925 | AE23: 1.8072289156626506 | AF23: 5.4216867469879517 | AG23: 4.5161290322580649 | AI23: Belarus | AJ23: 1
A24: Belgium | B24: BEL | L24: BLZ | M24: Belize | N24: 1 | O24: BLZ | P24: 86.6279069767442 | Q24: .. | R24: .. | S24: 58.181818181818201 | T24: 56.363636363636402 | U24: .. | V24: 100 | W24: .. | X24: .. | Y24: 100 | Z24: 87.951807228915669 | AA24: .. | AB24: 67.052023121387279 | AC24: .. | AD24: .. | AE24: 15.060240963855422 | AF24: 12.048192771084338 | AG24: .. | AI24: Belize | AM24: 1
A25: Benin | B25: BEN | L25: BOL | M25: Bolivia | N25: 1 | O25: BOL | P25: 63.953488372093005 | Q25: 43.506493506493499 | R25: 46.451612903225801 | S25: 87.272727272727309 | T25: 41.212121212121197 | U25: 38.3116883116883 | V25: 76.300578034682076 | W25: 66.451612903225808 | X25: 70.512820512820511 | Y25: 100 | Z25: 59.638554216867469 | AA25: 61.935483870967744 | AB25: 48.554913294797686 | AC25: 23.870967741935484 | AD25: 19.23076923076923 | AE25: 45.783132530120483 | AF25: 19.277108433734941 | AG25: 12.258064516129032 | AI25: Bolivia | AM25: 1
A26: Burkina Faso | B26: BFA | L26: BRA | M26: Brazil | N26: 1 | O26: BRA | P26: 67.441860465116292 | Q26: 38.3116883116883 | R26: 47.096774193548399 | S26: 47.272727272727302 | T26: 47.272727272727302 | U26: 64.285714285714306 | V26: 79.76878612716763 | W26: 56.774193548387096 | X26: 68.589743589743591 | Y26: 72.891566265060248 | Z26: 62.048192771084338 | AA26: 70.967741935483872 | AB26: 56.647398843930638 | AC26: 20 | AD26: 20.512820512820515 | AE26: 28.91566265060241 | AF26: 30.120481927710845 | AG26: 44.516129032258064 | AI26: Brazil | AM26: 1
A27: Bangladesh | B27: BGD | L27: BRB | M27: Barbados | N27: 1 | O27: BRB | P27: 94.186046511627893 | Q27: .. | R27: .. | S27: 75.757575757575808 | T27: 66.060606060606091 | U27: .. | V27: 100 | W27: .. | X27: .. | Y27: 100 | Z27: 93.373493975903614 | AA27: .. | AB27: 74.566473988439313 | AC27: .. | AD27: .. | AE27: 22.891566265060241 | AF27: 22.891566265060241 | AG27: .. | AI27: Barbados | AM27: 1
A28: Bulgaria | B28: BGR | L28: BRN | M28: Brunei | N28: 1 | O28: BRN | P28: 18.604651162790699 | Q28: 91.558441558441601 | R28: 56.129032258064505 | S28: 38.181818181818201 | T28: 87.272727272727309 | U28: 58.441558441558406 | V28: 39.306358381502889 | W28: 100 | X28: 92.307692307692307 | Y28: 100 | Z28: 100 | AA28: 89.032258064516128 | AB28: 5.202312138728324 | AC28: 69.677419354838705 | AD28: 2.5641025641025643 | AE28: 5.4216867469879517 | AF28: 61.445783132530117 | AG28: 1.2903225806451613 | AI28: Brunei | AK28: 1
A29: Bahrain | B29: BHR | L29: BTN | M29: Bhutan | N29: 1 | O29: BTN | P29: 11.046511627907 | Q29: .. | R29: .. | S29: .. | T29: .. | U29: .. | V29: 33.526011560693647 | W29: .. | X29: .. | Y29: .. | Z29: .. | AA29: .. | AB29: 0 | AC29: .. | AD29: .. | AE29: .. | AF29: .. | AG29: .. | AI29: Bhutan | AK29: 1
A30: Bahamas, The | B30: BHS | L30: BWA | M30: Botswana | N30: 1 | O30: BWA | P30: 74.418604651162795 | Q30: 76.6233766233766 | R30: 67.741935483871003 | S30: 72.727272727272691 | T30: 68.484848484848499 | U30: 75.324675324675312 | V30: 86.705202312138724 | W30: 90.322580645161295 | X30: 81.410256410256409 | Y30: 96.385542168674704 | Z30: 83.734939759036138 | AA30: 83.225806451612897 | AB30: 62.427745664739888 | AC30: 57.41935483870968 | AD30: 42.948717948717949 | AE30: 42.7710843373494 | AF30: 53.012048192771083 | AG30: 64.516129032258064 | AI30: Botswana | AL30: 1
A31: Bosnia and Herzegovina | B31: BIH | L31: CAF | M31: Central African Republic | N31: 1 | O31: CAF | P31: 51.162790697674396 | Q31: .. | R31: 18.064516129032299 | S31: .. | T31: .. | U31: .. | V31: 69.942196531791907 | W31: .. | X31: 68.589743589743591 | Y31: .. | Z31: .. | AA31: .. | AB31: 24.855491329479769 | AC31: .. | AD31: 1.2820512820512822 | AE31: .. | AF31: .. | AG31: .. | AI31: Central African Republic | AL31: 1
A32: Belarus | B32: BLR | L32: CAN | M32: Canada | N32: 1 | O32: CAN | P32: 88.953488372093005 | Q32: 84.415584415584405 | R32: 96.774193548387103 | S32: 86.060606060606105 | T32: 92.727272727272705 | U32: 96.753246753246799 | V32: 100 | W32: 99.354838709677423 | X32: 100 | Y32: 100 | Z32: 99.397590361445779 | AA32: 100 | AB32: 76.300578034682076 | AC32: 69.677419354838705 | AD32: 87.179487179487182 | AE32: 65.662650602409641 | AF32: 86.144578313253007 | AG32: 91.612903225806448 | AI32: Canada | AN32: 1
A33: Belize | B33: BLZ | L33: CHE | M33: Switzerland | N33: 1 | O33: CHE | P33: 100 | Q33: 100 | R33: 98.709677419354804 | S33: 87.878787878787904 | T33: 100 | U33: 97.402597402597408 | V33: 100 | W33: 100 | X33: 100 | Y33: 100 | Z33: 100 | AA33: 100 | AB33: 85.549132947976872 | AC33: 88.387096774193552 | AD33: 92.307692307692307 | AE33: 66.265060240963862 | AF33: 93.373493975903614 | AG33: 92.903225806451616 | AI33: Switzerland | AN33: 1
A34: Bolivia | B34: BOL | L34: CHL | M34: Chile | N34: 1 | O34: CHL | P34: 69.186046511627893 | Q34: 67.532467532467493 | R34: 85.806451612903203 | S34: 89.696969696969703 | T34: 86.060606060606105 | U34: 84.415584415584405 | V34: 82.080924855491332 | W34: 83.870967741935488 | X34: 94.871794871794876 | Y34: 100 | Z34: 92.168674698795186 | AA34: 89.032258064516128 | AB34: 58.959537572254334 | AC34: 46.451612903225808 | AD34: 80.128205128205124 | AE34: 66.867469879518069 | AF34: 72.891566265060234 | AG34: 80 | AI34: Chile | AM34: 1
A35: Brazil | B35: BRA | L35: CHN | M35: China | N35: 1 | O35: CHN | P35: 9.8837209302324993 | Q35: 68.831168831168796 | R35: 58.709677419354797 | S35: 39.393939393939398 | T35: 52.727272727272698 | U35: 46.753246753246799 | V35: 23.121387283236999 | W35: 83.870967741935488 | X35: 72.435897435897431 | Y35: 63.855421686746986 | Z35: 65.662650602409641 | AA35: 63.225806451612904 | AB35: 0 | AC35: 47.741935483870968 | AD35: 33.974358974358971 | AE35: 24.698795180722893 | AF35: 36.144578313253014 | AG35: 28.387096774193548 | AI35: China | AK35: 1
A36: Barbados | B36: BRB | L36: CIV | M36: Cote d'Ivoire | N36: 1 | O36: CIV | P36: 31.976744186046503 | Q36: 44.1558441558442 | R36: 47.741935483871003 | S36: 47.878787878787897 | T36: 43.030303030303003 | U36: 57.142857142857096 | V36: 49.710982658959537 | W36: 65.806451612903231 | X36: 70.512820512820511 | Y36: 79.518072289156635 | Z36: 61.445783132530117 | AA36: 68.387096774193552 | AB36: 13.872832369942197 | AC36: 24.516129032258064 | AD36: 22.435897435897434 | AE36: 25.301204819277107 | AF36: 19.879518072289155 | AG36: 33.548387096774192 | AI36: Cote d'Ivoire | AL36: 1
A37: Brunei | B37: BRN | L37: CMR | M37: Cameroon | N37: 1 | O37: CMR | P37: 26.744186046511597 | Q37: 23.3766233766234 | R37: 22.580645161290299 | S37: 33.3333333333333 | T37: 12.727272727272702 | U37: 3.2467532467532001 | V37: 44.508670520231213 | W37: 41.29032258064516 | X37: 48.07692307692308 | Y37: 65.060240963855421 | Z37: 33.734939759036138 | AA37: 25.806451612903231 | AB37: 12.138728323699421 | AC37: 10.32258064516129 | AD37: 10.256410256410257 | AE37: 19.879518072289155 | AF37: 1.8072289156626506 | AG37: 1.2903225806451613 | AI37: Cameroon | AL37: 1
A38: Bhutan | B38: BTN | L38: COG | M38: Congo, Rep. | N38: 1 | O38: COG | P38: 24.418604651162802 | Q38: 2.5974025974026 | R38: 25.806451612903196 | S38: 13.939393939393899 | T38: 3.0303030303030001 | U38: 28.571428571428598 | V38: 44.508670520231213 | W38: 12.903225806451616 | X38: 66.666666666666657 | Y38: 42.7710843373494 | Z38: 27.108433734939766 | AA38: 69.032258064516128 | AB38: 9.2485549132947984 | AC38: 0.64516129032258063 | AD38: 5.1282051282051286 | AE38: 1.8072289156626506 | AF38: 0 | AG38: 1.2903225806451613 | AI38: Congo, Rep. | AL38: 1
A39: Botswana | B39: BWA | L39: COL | M39: Colombia | N39: 1 | O39: COL | P39: 47.674418604651194 | Q39: 9.0909090909089993 | R39: 52.903225806451601 | S39: 58.787878787878803 | T39: 22.424242424242401 | U39: 33.766233766233796 | V39: 63.583815028901732 | W39: 20 | X39: 70.512820512820511 | Y39: 79.518072289156635 | Z39: 39.75903614457831 | AA39: 56.12903225806452 | AB39: 29.479768786127167 | AC39: 3.870967741935484 | AD39: 30.76923076923077 | AE39: 34.337349397590359 | AF39: 8.4337349397590362 | AG39: 15.483870967741936 | AI39: Colombia | AM39: 1
A40: Central African Republic | B40: CAF | L40: COM | M40: Comoros | N40: 1 | O40: COM | P40: 56.976744186046503 | Q40: .. | R40: .. | S40: .. | T40: .. | U40: .. | V40: 73.410404624277461 | W40: .. | X40: .. | Y40: .. | Z40: .. | AA40: .. | AB40: 29.479768786127167 | AC40: .. | AD40: .. | AE40: .. | AF40: .. | AG40: .. | AI40: Comoros | AM40: 1
A41: Canada | B41: CAN | L41: CPV | M41: Cape verde | N41: 1 | O41: CPV | P41: 77.325581395348792 | Q41: .. | R41: .. | S41: 12.727272727272702 | T41: 56.363636363636402 | U41: .. | V41: 99.421965317919074 | W41: .. | X41: .. | Y41: 49.397590361445786 | Z41: 87.951807228915669 | AA41: .. | AB41: 62.427745664739888 | AC41: .. | AD41: .. | AE41: 1.8072289156626506 | AF41: 12.048192771084338 | AG41: .. | AI41: Cape verde | AL41: 1
A42: Switzerland | B42: CHE | L42: CRI | M42: Costa Rica | N42: 1 | O42: CRI | P42: 88.3720930232558 | Q42: 81.168831168831204 | R42: 73.548387096774206 | S42: 90.909090909090892 | T42: 71.515151515151501 | U42: 76.6233766233766 | V42: 100 | W42: 98.064516129032256 | X42: 84.615384615384613 | Y42: 100 | Z42: 83.132530120481931 | AA42: 83.225806451612897 | AB42: 76.300578034682076 | AC42: 65.161290322580641 | AD42: 55.128205128205131 | AE42: 48.192771084337352 | AF42: 57.2289156626506 | AG42: 66.451612903225808 | AI42: Costa Rica | AM42: 1
A43: Chile | B43: CHL | L43: CUB | M43: Cuba | N43: 1 | O43: CUB | P43: 5.2325581395347998 | Q43: 57.142857142857096 | R43: 31.612903225806498 | S43: 15.151515151515198 | T43: 57.575757575757599 | U43: 67.532467532467493 | V43: 17.919075144508668 | W43: 77.41935483870968 | X43: 62.820512820512818 | Y43: 37.951807228915662 | Z43: 72.891566265060248 | AA43: 81.290322580645153 | AB43: 0 | AC43: 33.548387096774192 | AD43: 10.256410256410257 | AE43: 3.6144578313253013 | AF43: 37.349397590361448 | AG43: 49.677419354838712 | AI43: Cuba | AM43: 1
A44: China | B44: CHN | L44: CYP | M44: Cyprus | N44: 1 | O44: CYP | P44: 82.558139534883708 | Q44: 65.584415584415595 | R44: 84.516129032258107 | S44: 83.030303030303003 | T44: 80.606060606060609 | U44: 94.155844155844207 | V44: 97.109826589595372 | W44: 83.870967741935488 | X44: 94.871794871794876 | Y44: 100 | Z44: 91.566265060240966 | AA44: 100 | AB44: 69.364161849710982 | AC44: 41.29032258064516 | AD44: 71.15384615384616 | AE44: 42.7710843373494 | AF44: 65.662650602409641 | AG44: 87.741935483870961 | AI44: Cyprus | AN44: 1
A45: Cote d'Ivoire | B45: CIV | L45: CZE | M45: Czech Republic | N45: 1 | O45: CZE | P45: 86.046511627906995 | Q45: 78.571428571428598 | R45: 75.483870967741893 | S45: 72.121212121212096 | T45: 70.909090909090907 | U45: 70.779220779220793 | V45: 100 | W45: 88.387096774193552 | X45: 83.974358974358978 | Y45: 91.566265060240966 | Z45: 78.313253012048193 | AA45: 80.645161290322577 | AB45: 71.676300578034684 | AC45: 65.806451612903231 | AD45: 67.307692307692307 | AE45: 51.204819277108435 | AF45: 62.048192771084338 | AG45: 64.516129032258064 | AI45: Czech Republic | AJ45: 1
A46: Cameroon | B46: CMR | L46: DEU | M46: Germany | N46: 1 | O46: DEU | P46: 94.767441860465098 | Q46: 90.909090909090892 | R46: 90.9677419354839 | S46: 89.090909090909093 | T46: 92.12121212121211 | U46: 91.558441558441601 | V46: 100 | W46: 100 | X46: 97.435897435897431 | Y46: 100 | Z46: 98.795180722891573 | AA46: 95.483870967741936 | AB46: 78.034682080924853 | AC46: 79.354838709677423 | AD46: 83.974358974358978 | AE46: 66.265060240963862 | AF46: 83.734939759036138 | AG46: 86.451612903225808 | AI46: Germany | AN46: 1
A47: Congo, Rep. | B47: COG | L47: DJI | M47: Djibouti | N47: 1 | O47: DJI | P47: 29.6511627906977 | Q47: .. | R47: .. | S47: 24.2424242424242 | T47: 46.060606060606105 | U47: .. | V47: 58.959537572254334 | W47: .. | X47: .. | Y47: 77.108433734939752 | Z47: 81.325301204819283 | AA47: .. | AB47: 9.8265895953757223 | AC47: .. | AD47: .. | AE47: 3.6144578313253013 | AF47: 3.6144578313253013 | AG47: .. | AI47: Djibouti | AK47: 1
A48: Colombia | B48: COL | L48: DNK | M48: Denmark | N48: 1 | O48: DNK | P48: 98.837209302325604 | Q48: 90.259740259740298 | R48: 97.419354838709708 | S48: 94.545454545454504 | T48: 96.363636363636402 | U48: 100 | V48: 100 | W48: 100 | X48: 100 | Y48: 100 | Z48: 100 | AA48: 100 | AB48: 83.236994219653184 | AC48: 77.41935483870968 | AD48: 86.538461538461533 | AE48: 74.096385542168676 | AF48: 87.951807228915669 | AG48: 93.548387096774192 | AI48: Denmark | AN48: 1
A49: Comoros | B49: COM | L49: DOM | M49: Dominican Republic | N49: 1 | O49: DOM | P49: 49.418604651162802 | Q49: 53.896103896103895 | R49: 16.129032258064498 | S49: 70.303030303030297 | T49: 65.454545454545496 | U49: 22.727272727272698 | V49: 65.317919075144516 | W49: 78.064516129032256 | X49: 50 | Y49: 100 | Z49: 83.132530120481931 | AA49: 53.548387096774192 | AB49: 31.213872832369944 | AC49: 26.451612903225808 | AD49: 2.5641025641025643 | AE49: 24.698795180722893 | AF49: 45.783132530120483 | AG49: 1.2903225806451613 | AI49: Dominican Republic | AM49: 1
A50: Cape verde | B50: CPV | L50: DZA | M50: Algeria | N50: 1 | O50: DZA | P50: 9.3023255813952996 | Q50: 0.64935064935060005 | R50: 11.6129032258065 | S50: 10.303030303030299 | T50: 10.909090909090899 | U50: 13.636363636363599 | V50: 23.121387283236999 | W50: 2.5806451612903203 | X50: 34.615384615384613 | Y50: 25.903614457831324 | Z50: 31.325301204819283 | AA50: 41.29032258064516 | AB50: 0 | AC50: 0 | AD50: 1.2820512820512822 | AE50: 1.8072289156626506 | AF50: 1.2048192771084338 | AG50: 1.2903225806451613 | AI50: Algeria | AL50: 1
A51: Costa Rica | B51: CRI | L51: ECU | M51: Ecuador | N51: 1 | O51: ECU | P51: 62.209302325581397 | Q51: 29.870129870129901 | R51: 29.032258064516096 | S51: 63.636363636363605 | T51: 26.6666666666667 | U51: 19.480519480519501 | V51: 72.832369942196536 | W51: 51.612903225806448 | X51: 53.846153846153847 | Y51: 96.385542168674704 | Z51: 45.180722891566262 | AA51: 43.225806451612904 | AB51: 43.930635838150287 | AC51: 14.838709677419354 | AD51: 12.179487179487179 | AE51: 25.903614457831324 | AF51: 8.4337349397590362 | AG51: 1.935483870967742 | AI51: Ecuador | AM51: 1
A52: Cuba | B52: CUB | L52: EGY | M52: Egypt, Arab Rep. | N52: 1 | O52: EGY | P52: 28.488372093023301 | Q52: 46.103896103896105 | R52: 49.677419354838698 | S52: 46.060606060606105 | T52: 58.181818181818201 | U52: 48.701298701298704 | V52: 44.508670520231213 | W52: 66.451612903225808 | X52: 70.512820512820511 | Y52: 72.289156626506028 | Z52: 72.289156626506028 | AA52: 64.516129032258064 | AB52: 12.716763005780347 | AC52: 26.451612903225808 | AD52: 27.564102564102566 | AE52: 28.91566265060241 | AF52: 43.373493975903614 | AG52: 25.806451612903224 | AI52: Egypt, Arab Rep. | AL52: 1
A53: Cyprus | B53: CYP | L53: ERI | M53: Eritrea | N53: 1 | O53: ERI | P53: 30.232558139534898 | Q53: .. | R53: .. | S53: .. | T53: .. | U53: .. | V53: 58.959537572254334 | W53: .. | X53: .. | Y53: .. | Z53: .. | AA53: .. | AB53: 9.8265895953757223 | AC53: .. | AD53: .. | AE53: .. | AF53: .. | AG53: .. | AI53: Eritrea | AL53: 1
A54: Czech Republic | B54: CZE | L54: ESP | M54: Spain | N54: 1 | O54: ESP | P54: 87.79069767441861 | Q54: 72.077922077922096 | R54: 94.193548387096797 | S54: 85.45454545454551 | T54: 83.636363636363598 | U54: 85.714285714285694 | V54: 100 | W54: 84.516129032258064 | X54: 99.358974358974365 | Y54: 100 | Z54: 90.963855421686745 | AA54: 90.322580645161295 | AB54: 76.300578034682076 | AC54: 52.258064516129032 | AD54: 84.615384615384613 | AE54: 65.060240963855421 | AF54: 72.289156626506028 | AG54: 83.225806451612897 | AI54: Spain | AN54: 1
A55: Germany | B55: DEU | L55: EST | M55: Estonia | N55: 1 | O55: EST | P55: 75 | Q55: 77.922077922077904 | R55: 69.0322580645161 | S55: 80 | T55: 69.090909090909108 | U55: 77.272727272727309 | V55: 86.705202312138724 | W55: 89.032258064516128 | X55: 81.410256410256409 | Y55: 100 | Z55: 78.313253012048193 | AA55: 83.225806451612897 | AB55: 63.005780346820806 | AC55: 61.935483870967744 | AD55: 47.435897435897438 | AE55: 54.216867469879517 | AF55: 60.24096385542169 | AG55: 67.096774193548384 | AI55: Estonia | AJ55: 1
A56: Djibouti | B56: DJI | L56: ETH | M56: Ethiopia | N56: 1 | O56: ETH | P56: 35.465116279069804 | Q56: 55.194805194805198 | R56: 48.387096774193601 | S56: 42.424242424242401 | T56: 63.030303030303003 | U56: 38.961038961039002 | V56: 58.381502890173408 | W56: 80.645161290322577 | X56: 71.794871794871796 | Y56: 77.108433734939752 | Z56: 86.144578313253007 | AA56: 67.096774193548384 | AB56: 13.872832369942197 | AC56: 25.806451612903224 | AD56: 17.948717948717949 | AE56: 21.686746987951807 | AF56: 30.722891566265059 | AG56: 3.225806451612903 | AI56: Ethiopia | AL56: 1
A57: Denmark | B57: DNK | L57: FIN | M57: Finland | N57: 1 | O57: FIN | P57: 96.511627906976798 | Q57: 99.350649350649405 | R57: 94.838709677419402 | S57: 95.757575757575793 | T57: 96.969696969696997 | U57: 98.701298701298697 | V57: 100 | W57: 100 | X57: 100 | Y57: 100 | Z57: 100 | AA57: 100 | AB57: 82.080924855491332 | AC57: 83.870967741935488 | AD57: 84.615384615384613 | AE57: 78.313253012048193 | AF57: 89.156626506024097 | AG57: 92.903225806451616 | AI57: Finland | AN57: 1
A58: Dominican Republic | B58: DOM | L58: FJI | M58: Fiji | N58: 1 | O58: FJI | P58: 54.651162790697704 | Q58: 50 | R58: 79.354838709677395 | S58: 26.060606060606101 | T58: 33.939393939393902 | U58: 82.467532467532507 | V58: 71.098265895953759 | W58: 90.322580645161295 | X58: 97.435897435897431 | Y58: 81.92771084337349 | Z58: 65.662650602409641 | AA58: 94.838709677419359 | AB58: 28.323699421965319 | AC58: 10.32258064516129 | AD58: 33.974358974358971 | AE58: 4.2168674698795181 | AF58: 3.6144578313253013 | AG58: 49.677419354838712 | AI58: Fiji | AK58: 1
A59: Algeria | B59: DZA | L59: FRA | M59: France | N59: 1 | O59: FRA | P59: 83.720930232558203 | Q59: 72.727272727272691 | R59: 88.387096774193594 | S59: 78.787878787878796 | T59: 84.848484848484901 | U59: 87.662337662337691 | V59: 98.843930635838149 | W59: 85.806451612903231 | X59: 97.435897435897431 | Y59: 96.98795180722891 | Z59: 92.168674698795186 | AA59: 91.612903225806448 | AB59: 69.942196531791907 | AC59: 56.12903225806452 | AD59: 82.051282051282058 | AE59: 56.626506024096386 | AF59: 73.493975903614455 | AG59: 83.225806451612897 | AI59: France | AN59: 1
A60: Ecuador | B60: ECU | L60: GAB | M60: Gabon | N60: 1 | O60: GAB | P60: 40.116279069767401 | Q60: 25.974025974025999 | R60: 9.6774193548386993 | S60: 62.424242424242408 | T60: 32.727272727272698 | U60: 5.8441558441558001 | V60: 61.271676300578036 | W60: 52.903225806451616 | X60: 37.179487179487182 | Y60: 100 | Z60: 57.2289156626506 | AA60: 39.354838709677416 | AB60: 23.121387283236995 | AC60: 10.32258064516129 | AD60: 0.64102564102564108 | AE60: 21.686746987951807 | AF60: 9.0361445783132535 | AG60: 0 | AI60: Gabon | AL60: 1
A61: Egypt, Arab Rep. | B61: EGY | L61: GBR | M61: United Kingdom | N61: 1 | O61: GBR | P61: 93.604651162790702 | Q61: 82.467532467532507 | R61: 98.064516129032299 | S61: 98.181818181818201 | T61: 95.757575757575793 | U61: 93.506493506493499 | V61: 100 | W61: 96.129032258064512 | X61: 100 | Y61: 100 | Z61: 100 | AA61: 98.064516129032256 | AB61: 78.034682080924853 | AC61: 66.451612903225808 | AD61: 92.307692307692307 | AE61: 80.722891566265062 | AF61: 89.156626506024097 | AG61: 88.387096774193552 | AI61: United Kingdom | AN61: 1
A62: Eritrea | B62: ERI | L62: GEO | M62: Georgia | N62: 1 | O62: GEO | P62: 41.860465116279101 | Q62: 21.428571428571399 | R62: 30.9677419354839 | S62: 16.363636363636399 | T62: 34.545454545454504 | U62: 24.675324675324699 | V62: 64.161849710982665 | W62: 43.225806451612904 | X62: 61.53846153846154 | Y62: 28.915662650602414 | Z62: 50.602409638554214 | AA62: 47.096774193548384 | AB62: 16.184971098265898 | AC62: 9.0322580645161299 | AD62: 10.897435897435898 | AE62: 7.2289156626506026 | AF62: 16.867469879518072 | AG62: 3.225806451612903 | AI62: Georgia | AJ62: 1
A63: Spain | B63: ESP | L63: GHA | M63: Ghana | N63: 1 | O63: GHA | P63: 37.209302325581397 | Q63: 44.805194805194795 | R63: 42.580645161290299 | S63: 57.575757575757599 | T63: 53.939393939393895 | U63: 45.454545454545496 | V63: 56.647398843930638 | W63: 66.451612903225808 | X63: 63.46153846153846 | Y63: 83.734939759036138 | Z63: 66.867469879518069 | AA63: 64.516129032258064 | AB63: 17.919075144508671 | AC63: 25.161290322580644 | AD63: 19.23076923076923 | AE63: 30.120481927710845 | AF63: 33.734939759036145 | AG63: 25.806451612903224 | AI63: Ghana | AL63: 1
A64: Estonia | B64: EST | L64: GIN | M64: Guinea | N64: 1 | O64: GIN | P64: 21.511627906976699 | Q64: 13.636363636363599 | R64: 54.838709677419395 | S64: 51.515151515151501 | T64: 23.030303030303003 | U64: 17.5324675324675 | V64: 41.040462427745666 | W64: 38.70967741935484 | X64: 83.974358974358978 | Y64: 98.795180722891573 | Z64: 53.012048192771083 | AA64: 64.516129032258064 | AB64: 6.3583815028901736 | AC64: 3.870967741935484 | AD64: 12.179487179487179 | AE64: 18.674698795180724 | AF64: 3.0120481927710845 | AG64: 0 | AI64: Guinea | AL64: 1
A65: Ethiopia | B65: ETH | L65: GLP | M65: Guadeloupe | N65: 1 | O65: GLP | P65: .. | Q65: .. | R65: .. | S65: .. | T65: .. | U65: .. | V65: .. | W65: .. | X65: .. | Y65: .. | Z65: .. | AA65: .. | AB65: .. | AC65: .. | AD65: .. | AE65: .. | AF65: .. | AG65: .. | AI65: Guadeloupe | AM65: 1
A66: Finland | B66: FIN | L66: GMB | M66: Gambia, The | N66: 1 | O66: GMB | P66: 16.2790697674419 | Q66: 70.779220779220793 | R66: 64.516129032258092 | S66: 30.909090909090903 | T66: 64.242424242424306 | U66: 58.441558441558406 | V66: 39.306358381502889 | W66: 92.258064516129025 | X66: 95.512820512820511 | Y66: 81.325301204819283 | Z66: 86.144578313253007 | AA66: 89.032258064516128 | AB66: 4.6242774566473992 | AC66: 40.645161290322584 | AD66: 5.1282051282051286 | AE66: 8.4337349397590362 | AF66: 30.120481927710845 | AG66: 1.2903225806451613 | AI66: Gambia, The | AL66: 1
A67: Fiji | B67: FJI | L67: GNB | M67: Guinea-Bissau | N67: 1 | O67: GNB | P67: 36.046511627907002 | Q67: 10.3896103896104 | R67: 39.354838709677395 | S67: 7.2727272727272005 | T67: 1.2121212121211999 | U67: 53.896103896103895 | V67: 58.959537572254334 | W67: 29.677419354838705 | X67: 79.487179487179489 | Y67: 28.915662650602414 | Z67: 17.46987951807229 | AA67: 81.290322580645153 | AB67: 15.606936416184972 | AC67: 1.935483870967742 | AD67: 5.1282051282051286 | AE67: 1.2048192771084338 | AF67: 0 | AG67: 3.225806451612903 | AI67: Guinea-Bissau | AL67: 1
A68: France | B68: FRA | L68: GNQ | M68: Equatorial Guinea | N68: 1 | O68: GNQ | P68: 6.9767441860465 | Q68: .. | R68: .. | S68: 7.8787878787878007 | T68: 6.6666666666666003 | U68: .. | V68: 28.323699421965316 | W68: .. | X68: .. | Y68: 34.939759036144579 | Z68: 53.012048192771083 | AA68: .. | AB68: 0 | AC68: .. | AD68: .. | AE68: 0.60240963855421692 | AF68: 0 | AG68: .. | AI68: Equatorial Guinea | AL68: 1
A69: Gabon | B69: GAB | L69: GRC | M69: Greece | N69: 1 | O69: GRC | P69: 81.395348837209298 | Q69: 57.792207792207797 | R69: 74.193548387096797 | S69: 74.545454545454604 | T69: 67.878787878787904 | U69: 83.116883116883102 | V69: 95.95375722543352 | W69: 76.129032258064512 | X69: 84.615384615384613 | Y69: 94.578313253012055 | Z69: 80.120481927710841 | AA69: 85.161290322580641 | AB69: 67.630057803468205 | AC69: 38.70967741935484 | AD69: 61.53846153846154 | AE69: 48.192771084337352 | AF69: 56.024096385542165 | AG69: 71.612903225806448 | AI69: Greece | AN69: 1
A70: United Kingdom | B70: GBR | L70: GTM | M70: Guatemala | N70: 1 | O70: GTM | P70: 32.558139534883701 | Q70: 22.0779220779221 | R70: 45.806451612903196 | S70: 66.6666666666667 | T70: 10.303030303030299 | U70: 18.831168831168803 | V70: 50.289017341040463 | W70: 44.516129032258064 | X70: 72.435897435897431 | Y70: 100 | Z70: 31.325301204819283 | AA70: 43.225806451612904 | AB70: 13.872832369942197 | AC70: 9.0322580645161299 | AD70: 12.179487179487179 | AE70: 22.289156626506024 | AF70: 1.2048192771084338 | AG70: 1.935483870967742 | AI70: Guatemala | AM70: 1
A71: Georgia | B71: GEO | L71: GUY | M71: Guyana | N71: 1 | O71: GUY | P71: 79.069767441860492 | Q71: 42.207792207792203 | R71: 56.129032258064505 | S71: 54.545454545454497 | T71: 49.696969696969703 | U71: 58.441558441558406 | V71: 95.95375722543352 | W71: 72.258064516129025 | X71: 92.307692307692307 | Y71: 100 | Z71: 75.301204819277103 | AA71: 89.032258064516128 | AB71: 65.317919075144502 | AC71: 14.193548387096774 | AD71: 2.5641025641025643 | AE71: 18.674698795180724 | AF71: 13.253012048192771 | AG71: 1.2903225806451613 | AI71: Guyana | AM71: 1
A72: Ghana | B72: GHA | L72: HKG | M72: Hong Kong, China | N72: 1 | O72: HKG | P72: 50 | Q72: 83.116883116883102 | R72: 87.096774193548399 | S72: 98.787878787878796 | T72: 89.696969696969703 | U72: 88.3116883116883 | V72: 65.317919075144516 | W72: 98.064516129032256 | X72: 97.435897435897431 | Y72: 100 | Z72: 96.98795180722891 | AA72: 90.967741935483872 | AB72: 32.369942196531795 | AC72: 65.806451612903231 | AD72: 81.410256410256409 | AE72: 80.722891566265062 | AF72: 79.518072289156621 | AG72: 83.225806451612897 | AI72: Hong Kong, China | AK72: 1
A73: Guinea | B73: GIN | L73: HND | M73: Honduras | N73: 1 | O73: HND | P73: 50.581395348837198 | Q73: 36.363636363636395 | R73: 36.129032258064498 | S73: 43.636363636363598 | T73: 16.969696969697001 | U73: 11.038961038961 | V73: 65.317919075144516 | W73: 60.645161290322584 | X73: 70.512820512820511 | Y73: 94.578313253012055 | Z73: 42.168674698795179 | AA73: 38.064516129032256 | AB73: 33.52601156069364 | AC73: 16.129032258064516 | AD73: 8.9743589743589745 | AE73: 14.457831325301205 | AF73: 3.0120481927710845 | AG73: 1.2903225806451613 | AI73: Honduras | AM73: 1
A74: Guadeloupe | B74: GLP | L74: HRV | M74: Croatia | N74: 1 | O74: HRV | P74: 39.534883720930196 | Q74: 66.233766233766204 | R74: 63.870967741935502 | S74: 55.151515151515198 | T74: 59.393939393939398 | U74: 36.363636363636395 | V74: 60.693641618497111 | W74: 80.645161290322577 | X74: 79.487179487179489 | Y74: 80.722891566265062 | Z74: 69.277108433734938 | AA74: 57.41935483870968 | AB74: 23.121387283236995 | AC74: 45.806451612903224 | AD74: 37.820512820512818 | AE74: 30.722891566265059 | AF74: 47.590361445783131 | AG74: 16.774193548387096 | AI74: Croatia | AJ74: 1
A75: Gambia, The | B75: GMB | L75: HTI | M75: Haiti | N75: 1 | O75: HTI | P75: 26.162790697674399 | Q75: 4.5454545454544997 | R75: 7.7419354838709005 | S75: 11.515151515151501 | T75: 1.8181818181818001 | U75: 31.818181818181802 | V75: 46.820809248554916 | W75: 18.709677419354833 | X75: 70.512820512820511 | Y75: 36.746987951807228 | Z75: 30.120481927710841 | AA75: 83.225806451612897 | AB75: 10.982658959537572 | AC75: 0.64516129032258063 | AD75: 0 | AE75: 1.8072289156626506 | AF75: 0 | AG75: 0 | AI75: Haiti | AM75: 1
A76: Guinea-Bissau | B76: GNB | L76: HUN | M76: Hungary | N76: 1 | O76: HUN | P76: 85.465116279069804 | Q76: 88.961038961038994 | R76: 76.129032258064498 | S76: 84.848484848484901 | T76: 74.545454545454604 | U76: 77.922077922077904 | V76: 99.421965317919074 | W76: 99.354838709677423 | X76: 83.974358974358978 | Y76: 98.795180722891573 | Z76: 83.132530120481931 | AA76: 83.225806451612897 | AB76: 71.098265895953759 | AC76: 79.354838709677423 | AD76: 67.307692307692307 | AE76: 67.46987951807229 | AF76: 65.662650602409641 | AG76: 68.387096774193552 | AI76: Hungary | AJ76: 1
A77: Equatorial Guinea | B77: GNQ | L77: IDN | M77: Indonesia | N77: 1 | O77: IDN | P77: 12.790697674418599 | Q77: 9.7402597402597006 | R77: 30.322580645161302 | S77: 46.6666666666667 | T77: 15.151515151515198 | U77: 20.7792207792208 | V77: 28.901734104046241 | W77: 20.645161290322577 | X77: 53.846153846153847 | Y77: 72.289156626506028 | Z77: 34.939759036144579 | AA77: 34.193548387096769 | AB77: 2.3121387283236996 | AC77: 3.225806451612903 | AD77: 12.179487179487179 | AE77: 28.91566265060241 | AF77: 4.2168674698795181 | AG77: 3.225806451612903 | AI77: Indonesia | AK77: 1
A78: Greece | B78: GRC | L78: IND | M78: India | N78: 1 | O78: IND | P78: 66.860465116279101 | Q78: 47.402597402597401 | R78: 43.870967741935502 | S78: 40.606060606060602 | T78: 60.606060606060595 | U78: 44.805194805194795 | V78: 77.456647398843927 | W78: 67.741935483870975 | X78: 67.307692307692307 | Y78: 65.060240963855421 | Z78: 72.289156626506028 | AA78: 61.29032258064516 | AB78: 54.335260115606935 | AC78: 27.096774193548388 | AD78: 19.23076923076923 | AE78: 24.698795180722893 | AF78: 45.180722891566262 | AG78: 28.387096774193548 | AI78: India | AK78: 1
A79: Guatemala | B79: GTM | L79: IRL | M79: Ireland | N79: 1 | O79: IRL | P79: 95.348837209302289 | Q79: 98.051948051948102 | R79: 89.677419354838705 | S79: 96.969696969696997 | T79: 90.303030303030297 | U79: 90.259740259740298 | V79: 100 | W79: 100 | X79: 97.435897435897431 | Y79: 100 | Z79: 96.98795180722891 | AA79: 94.838709677419359 | AB79: 78.612716763005778 | AC79: 83.225806451612897 | AD79: 83.974358974358978 | AE79: 78.313253012048193 | AF79: 83.132530120481931 | AG79: 85.161290322580641 | AI79: Ireland | AN79: 1
A80: Guyana | B80: GUY | L80: IRN | M80: Iran, Islamic Rep. | N80: 1 | O80: IRN | P80: 33.139534883720899 | Q80: 54.545454545454497 | R80: 38.709677419354797 | S80: 9.0909090909089993 | T80: 40 | U80: 16.883116883116898 | V80: 50.289017341040463 | W80: 74.838709677419359 | X80: 67.948717948717956 | Y80: 24.698795180722897 | Z80: 59.036144578313255 | AA80: 43.225806451612904 | AB80: 13.872832369942197 | AC80: 31.612903225806452 | AD80: 13.461538461538462 | AE80: 1.8072289156626506 | AF80: 19.277108433734941 | AG80: 1.2903225806451613 | AI80: Iran, Islamic Rep. | AK80: 1
A81: Hong Kong, China | B81: HKG | L81: IRQ | M81: Iraq | N81: 1 | O81: IRQ | P81: 0.58139534883720001 | Q81: 1.2987012987013 | R81: 0 | S81: 0 | T81: 0.60606060606059997 | U81: 2.5974025974026 | V81: 10.982658959537574 | W81: 6.4516129032258078 | X81: 7.0512820512820582 | Y81: 1.2048192771084274 | Z81: 4.819277108433738 | AA81: 25.161290322580641 | AB81: 0 | AC81: 0 | AD81: 0 | AE81: 0 | AF81: 0 | AG81: 0 | AI81: Iraq | AK81: 1
A82: Honduras | B82: HND | L82: ISL | M82: Iceland | N82: 1 | O82: ISL | P82: 90.697674418604706 | Q82: 89.610389610389589 | R82: 92.258064516128997 | S82: 76.363636363636402 | T82: 91.515151515151501 | U82: 94.805194805194802 | V82: 100 | W82: 100 | X82: 100 | Y82: 94.578313253012055 | Z82: 100 | AA82: 100 | AB82: 76.300578034682076 | AC82: 69.677419354838705 | AD82: 80.769230769230774 | AE82: 46.987951807228917 | AF82: 79.518072289156621 | AG82: 86.451612903225808 | AI82: Iceland | AN82: 1
A83: Croatia | B83: HRV | L83: ISR | M83: Israel | N83: 1 | O83: ISR | P83: 81.976744186046503 | Q83: 30.519480519480503 | R83: 80.645161290322591 | S83: 69.696969696969703 | T83: 83.030303030303003 | U83: 87.012987012986997 | V83: 95.95375722543352 | W83: 52.903225806451616 | X83: 85.897435897435898 | Y83: 93.373493975903614 | Z83: 90.361445783132524 | AA83: 91.612903225806448 | AB83: 67.630057803468205 | AC83: 14.193548387096774 | AD83: 64.102564102564102 | AE83: 43.975903614457835 | AF83: 69.879518072289159 | AG83: 83.225806451612897 | AI83: Israel | AN83: 1
A84: Haiti | B84: HTI | L84: ITA | M84: Italy | N84: 1 | O84: ITA | P84: 87.20930232558139 | Q84: 87.662337662337691 | R84: 81.935483870967701 | S84: 73.3333333333333 | T84: 78.787878787878796 | U84: 81.818181818181799 | V84: 100 | W84: 99.354838709677423 | X84: 86.538461538461533 | Y84: 93.975903614457835 | Z84: 87.951807228915669 | AA84: 85.161290322580641 | AB84: 75.144508670520224 | AC84: 74.838709677419359 | AD84: 70.512820512820511 | AE84: 47.590361445783131 | AF84: 66.867469879518069 | AG84: 71.612903225806448 | AI84: Italy | AN84: 1
A85: Hungary | B85: HUN | L85: JAM | M85: Jamaica | N85: 1 | O85: JAM | P85: 72.674418604651208 | Q85: 35.714285714285701 | R85: 32.903225806451601 | S85: 81.212121212121204 | T85: 24.848484848484802 | U85: 56.493506493506494 | V85: 86.705202312138724 | W85: 60.645161290322584 | X85: 64.102564102564102 | Y85: 100 | Z85: 47.590361445783131 | AA85: 70.967741935483872 | AB85: 61.849710982658962 | AC85: 15.483870967741936 | AD85: 9.615384615384615 | AE85: 30.722891566265059 | AF85: 5.4216867469879517 | AG85: 27.096774193548388 | AI85: Jamaica | AM85: 1
A86: Indonesia | B86: IDN | L86: JOR | M86: Jordan | N86: 1 | O86: JOR | P86: 59.883720930232599 | Q86: 46.753246753246799 | R86: 78.064516129032299 | S86: 65.454545454545496 | T86: 75.151515151515198 | U86: 65.584415584415595 | V86: 69.942196531791907 | W86: 68.387096774193552 | X86: 84.615384615384613 | Y86: 92.771084337349393 | Z86: 86.144578313253007 | AA86: 75.483870967741936 | AB86: 39.306358381502889 | AC86: 25.161290322580644 | AD86: 61.53846153846154 | AE86: 36.746987951807228 | AF86: 62.048192771084338 | AG86: 47.096774193548384 | AI86: Jordan | AK86: 1
A87: India | B87: IND | L87: JPN | M87: Japan | N87: 1 | O87: JPN | P87: 84.302325581395394 | Q87: 87.012987012986997 | R87: 82.580645161290306 | S87: 64.848484848484901 | T87: 90.909090909090892 | U87: 81.168831168831204 | V87: 100 | W87: 100 | X87: 91.025641025641022 | Y87: 82.53012048192771 | Z87: 98.795180722891573 | AA87: 84.516129032258064 | AB87: 67.630057803468205 | AC87: 72.258064516129039 | AD87: 68.589743589743591 | AE87: 39.75903614457831 | AF87: 81.325301204819283 | AG87: 70.967741935483872 | AI87: Japan | AK87: 1
A88: Ireland | B88: IRL | L88: KAZ | M88: Kazakhstan | N88: 1 | O88: KAZ | P88: 25.581395348837198 | Q88: 58.441558441558406 | R88: 16.7741935483871 | S88: 25.454545454545503 | T88: 30.303030303030297 | U88: 14.285714285714299 | V88: 43.930635838150287 | W88: 74.193548387096769 | X88: 37.179487179487182 | Y88: 45.783132530120483 | Z88: 45.180722891566262 | AA88: 33.548387096774192 | AB88: 12.138728323699421 | AC88: 41.29032258064516 | AD88: 7.0512820512820511 | AE88: 14.457831325301205 | AF88: 14.457831325301205 | AG88: 3.225806451612903 | AI88: Kazakhstan | AJ88: 1
A89: Iran, Islamic Rep. | B89: IRN | L89: KEN | M89: Kenya | N89: 1 | O89: KEN | P89: 27.325581395348802 | Q89: 12.3376623376623 | R89: 13.548387096774201 | S89: 35.7575757575758 | T89: 6.0606060606060002 | U89: 26.6233766233766 | V89: 44.508670520231213 | W89: 25.161290322580641 | X89: 33.974358974358978 | Y89: 66.265060240963862 | Z89: 25.903614457831324 | AA89: 50.322580645161288 | AB89: 12.138728323699421 | AC89: 7.096774193548387 | AD89: 5.1282051282051286 | AE89: 21.08433734939759 | AF89: 1.2048192771084338 | AG89: 4.5161290322580649 | AI89: Kenya | AL89: 1
A90: Iraq | B90: IRQ | L90: KGZ | M90: Kyrgyz Republic | N90: 1 | O90: KGZ | P90: 43.023255813953497 | Q90: 61.6883116883117 | R90: 27.096774193548402 | S90: 18.7878787878788 | T90: 35.7575757575758 | U90: 24.025974025974001 | V90: 65.317919075144516 | W90: 81.935483870967744 | X90: 59.615384615384613 | Y90: 31.92771084337349 | Z90: 51.807228915662648 | AA90: 45.806451612903224 | AB90: 17.919075144508671 | AC90: 39.354838709677416 | AD90: 8.9743589743589745 | AE90: 8.4337349397590362 | AF90: 18.674698795180724 | AG90: 3.225806451612903 | AI90: Kyrgyz Republic | AJ90: 1
A91: Iceland | B91: ISL | L91: KHM | M91: Cambodia | N91: 1 | O91: KHM | P91: 19.767441860465098 | Q91: .. | R91: .. | S91: 41.818181818181799 | T91: 46.060606060606105 | U91: .. | V91: 44.508670520231213 | W91: .. | X91: .. | Y91: 96.385542168674704 | Z91: 81.325301204819283 | AA91: .. | AB91: 3.4682080924855492 | AC91: .. | AD91: .. | AE91: 10.240963855421686 | AF91: 3.6144578313253013 | AG91: .. | AI91: Cambodia | AK91: 1
A92: Israel | B92: ISR | L92: KOR | M92: Korea, Rep. | N92: 1 | O92: KOR | P92: 78.488372093023301 | Q92: 56.493506493506494 | R92: 70.9677419354839 | S92: 53.939393939393895 | T92: 81.818181818181799 | U92: 66.233766233766204 | V92: 94.797687861271669 | W92: 74.193548387096769 | X92: 82.692307692307693 | Y92: 77.108433734939752 | Z92: 89.759036144578317 | AA92: 71.612903225806448 | AB92: 67.052023121387279 | AC92: 37.41935483870968 | AD92: 53.846153846153847 | AE92: 31.325301204819276 | AF92: 69.879518072289159 | AG92: 55.483870967741936 | AI92: Korea, Rep. | AK92: 1
A93: Italy | B93: ITA | L93: KWT | M93: Kuwait | N93: 1 | O93: KWT | P93: 54.069767441860492 | Q93: 75.324675324675312 | R93: 51.612903225806491 | S93: 37.575757575757599 | T93: 80 | U93: 78.571428571428598 | V93: 67.052023121387293 | W93: 89.677419354838705 | X93: 74.358974358974365 | Y93: 78.313253012048193 | Z93: 90.963855421686745 | AA93: 85.161290322580641 | AB93: 35.838150289017342 | AC93: 52.903225806451616 | AD93: 20.512820512820515 | AE93: 15.060240963855422 | AF93: 65.060240963855421 | AG93: 64.516129032258064 | AI93: Kuwait | AK93: 1
A94: Jamaica | B94: JAM | L94: LAO | M94: Lao, PDR | N94: 1 | O94: LAO | P94: 14.5348837209302 | Q94: .. | R94: .. | S94: 2.4242424242423999 | T94: 6.6666666666666003 | U94: .. | V94: 39.306358381502889 | W94: .. | X94: .. | Y94: 21.686746987951807 | Z94: 53.012048192771083 | AA94: .. | AB94: 0.5780346820809249 | AC94: .. | AD94: .. | AE94: 0.60240963855421692 | AF94: 0 | AG94: .. | AI94: Lao, PDR | AK94: 1
A95: Jordan | B95: JOR | L95: LBN | M95: Lebanon | N95: 1 | O95: LBN | P95: 38.953488372092998 | Q95: 39.610389610389603 | R95: 66.451612903225794 | S95: 45.454545454545496 | T95: 62.424242424242408 | U95: 39.610389610389603 | V95: 58.959537572254334 | W95: 61.935483870967744 | X95: 82.051282051282044 | Y95: 87.349397590361448 | Z95: 77.108433734939752 | AA95: 65.161290322580641 | AB95: 20.809248554913296 | AC95: 19.35483870967742 | AD95: 35.256410256410255 | AE95: 21.686746987951807 | AF95: 44.578313253012048 | AG95: 12.258064516129032 | AI95: Lebanon | AK95: 1
A96: Japan | B96: JPN | L96: LBR | M96: Liberia | N96: 1 | O96: LBR | P96: 20.930232558139501 | Q96: 16.2337662337662 | R96: 12.903225806451598 | S96: 9.696969696969699 | T96: 4.8484848484847998 | U96: 4.5454545454544997 | V96: 39.884393063583815 | W96: 43.225806451612904 | X96: 75 | Y96: 48.192771084337352 | Z96: 47.590361445783131 | AA96: 70.967741935483872 | AB96: 5.7803468208092488 | AC96: 3.870967741935484 | AD96: 0 | AE96: 0.60240963855421692 | AF96: 0 | AG96: 0 | AI96: Liberia | AL96: 1
A97: Kazakhstan | B97: KAZ | L97: LBY | M97: Libya | N97: 1 | O97: LBY | P97: 8.1395348837209003 | Q97: 11.038961038961 | R97: 5.1612903225805997 | S97: 0.60606060606059997 | T97: 9.0909090909089993 | U97: 12.987012987012999 | V97: 23.121387283236999 | W97: 25.161290322580641 | X97: 19.871794871794876 | Y97: 3.6144578313252964 | Z97: 30.722891566265062 | AA97: 41.29032258064516 | AB97: 0 | AC97: 3.870967741935484 | AD97: 0 | AE97: 0 | AF97: 1.2048192771084338 | AG97: 1.2903225806451613 | AI97: Libya | AL97: 1
A98: Kenya | B98: KEN | L98: LKA | M98: Sri Lanka | N98: 1 | O98: LKA | P98: 45.348837209302303 | Q98: 6.4935064935064002 | R98: 24.5161290322581 | S98: 76.969696969696997 | T98: 40.606060606060602 | U98: 55.844155844155793 | V98: 63.583815028901732 | W98: 13.548387096774192 | X98: 58.333333333333336 | Y98: 100 | Z98: 62.048192771084338 | AA98: 70.967741935483872 | AB98: 29.479768786127167 | AC98: 1.935483870967742 | AD98: 7.6923076923076925 | AE98: 34.337349397590359 | AF98: 16.867469879518072 | AG98: 27.096774193548388 | AI98: Sri Lanka | AK98: 1
A99: Kyrgyz Republic | B99: KGZ | L99: LSO | M99: Lesotho | N99: 1 | O99: LSO | P99: 45.930232558139501 | Q99: 19.480519480519501 | R99: 34.193548387096797 | S99: 40 | T99: 45.454545454545496 | U99: 66.883116883116898 | V99: 67.630057803468205 | W99: 63.225806451612904 | X99: 67.307692307692307 | Y99: 77.108433734939752 | Z99: 79.518072289156635 | AA99: 83.225806451612897 | AB99: 23.121387283236995 | AC99: 1.935483870967742 | AD99: 10.897435897435898 | AE99: 19.277108433734941 | AF99: 3.6144578313253013 | AG99: 30.967741935483872 | AI99: Lesotho | AL99: 1
A100: Cambodia | B100: KHM | L100: LTU | M100: Lithuania | N100: 1 | O100: LTU | P100: 73.255813953488399 | Q100: 62.337662337662302 | R100: 62.580645161290306 | S100: 44.2424242424242 | T100: 61.818181818181806 | U100: 63.636363636363605 | V100: 86.705202312138724 | W100: 78.709677419354847 | X100: 75.641025641025635 | Y100: 74.096385542168676 | Z100: 69.879518072289159 | AA100: 70.967741935483872 | AB100: 62.427745664739888 | AC100: 44.516129032258064 | AD100: 38.46153846153846 | AE100: 25.301204819277107 | AF100: 47.590361445783131 | AG100: 43.225806451612904 | AI100: Lithuania | AJ100: 1
A101: Korea, Rep. | B101: KOR | L101: LUX | M101: Luxembourg | N101: 1 | O101: LUX | P101: 92.441860465116292 | Q101: 95.454545454545496 | R101: 96.129032258064498 | S101: 92.12121212121211 | T101: 94.545454545454504 | U101: 92.20779220779221 | V101: 100 | W101: 100 | X101: 100 | Y101: 100 | Z101: 100 | AA101: 100 | AB101: 76.300578034682076 | AC101: 74.838709677419359 | AD101: 82.692307692307693 | AE101: 66.867469879518069 | AF101: 83.132530120481931 | AG101: 85.161290322580641 | AI101: Luxembourg | AN101: 1
A102: Kuwait | B102: KWT | L102: LVA | M102: Latvia | N102: 1 | O102: LVA | P102: 69.767441860465098 | Q102: 68.181818181818201 | R102: 61.290322580645196 | S102: 67.878787878787904 | T102: 60 | U102: 49.350649350649398 | V102: 82.658959537572258 | W102: 82.58064516129032 | X102: 73.07692307692308 | Y102: 93.975903614457835 | Z102: 68.674698795180717 | AA102: 64.516129032258064 | AB102: 59.537572254335259 | AC102: 49.032258064516128 | AD102: 36.53846153846154 | AE102: 42.7710843373494 | AF102: 47.590361445783131 | AG102: 27.096774193548388 | AI102: Latvia | AJ102: 1
A103: Lao, PDR | B103: LAO | L103: MAC | M103: Macao, China | N103: 1 | O103: MAC | P103: .. | Q103: .. | R103: .. | S103: .. | T103: .. | U103: .. | V103: .. | W103: .. | X103: .. | Y103: .. | Z103: .. | AA103: .. | AB103: .. | AC103: .. | AD103: .. | AE103: .. | AF103: .. | AG103: .. | AI103: Macao, China | AK103: 1
A104: Lebanon | B104: LBN | L104: MAR | M104: Morocco | N104: 1 | O104: MAR | P104: 43.604651162790695 | Q104: 52.597402597402599 | R104: 70.32258064516131 | S104: 52.727272727272698 | T104: 73.939393939393909 | U104: 64.935064935064901 | V104: 61.849710982658962 | W104: 72.258064516129025 | X104: 80.769230769230774 | Y104: 81.325301204819283 | Z104: 86.144578313253007 | AA104: 75.483870967741936 | AB104: 25.433526011560694 | AC104: 31.612903225806452 | AD104: 48.07692307692308 | AE104: 27.108433734939759 | AF104: 62.048192771084338 | AG104: 47.096774193548384 | AI104: Morocco | AL104: 1
A105: Liberia | B105: LBR | L105: MDA | M105: Moldova | N105: 1 | O105: MDA | P105: 60.465116279069797 | Q105: 41.558441558441601 | R105: 34.838709677419402 | S105: 30.303030303030297 | T105: 53.3333333333333 | U105: 40.259740259740298 | V105: 69.942196531791907 | W105: 60 | X105: 58.333333333333336 | Y105: 54.819277108433738 | Z105: 65.060240963855421 | AA105: 61.29032258064516 | AB105: 39.306358381502889 | AC105: 24.516129032258064 | AD105: 12.820512820512821 | AE105: 18.674698795180724 | AF105: 39.75903614457831 | AG105: 24.516129032258064 | AI105: Moldova | AJ105: 1
A106: Libya | B106: LBY | L106: MDG | M106: Madagascar | N106: 1 | O106: MDG | P106: 63.372093023255808 | Q106: 20.129870129870099 | R106: 41.935483870967701 | S106: 32.121212121212103 | T106: 20.606060606060598 | U106: 35.064935064935099 | V106: 76.300578034682076 | W106: 47.096774193548384 | X106: 71.15384615384616 | Y106: 81.92771084337349 | Z106: 50.602409638554214 | AA106: 71.612903225806448 | AB106: 42.774566473988436 | AC106: 7.741935483870968 | AD106: 12.179487179487179 | AE106: 10.240963855421686 | AF106: 1.8072289156626506 | AG106: 1.2903225806451613 | AI106: Madagascar | AL106: 1
A107: Sri Lanka | B107: LKA | L107: MDV | M107: Maldives | N107: 1 | O107: MDV | P107: 19.767441860465098 | Q107: .. | R107: .. | S107: .. | T107: .. | U107: .. | V107: 44.508670520231213 | W107: .. | X107: .. | Y107: .. | Z107: .. | AA107: .. | AB107: 3.4682080924855492 | AC107: .. | AD107: .. | AE107: .. | AF107: .. | AG107: .. | AI107: Maldives | AL107: 1
A108: Lesotho | B108: LSO | L108: MEX | M108: Mexico | N108: 1 | O108: MEX | P108: 48.255813953488399 | Q108: 35.064935064935099 | R108: 67.096774193548399 | S108: 75.151515151515198 | T108: 35.151515151515198 | U108: 47.402597402597401 | V108: 63.583815028901732 | W108: 55.483870967741936 | X108: 79.487179487179489 | Y108: 94.578313253012055 | Z108: 51.807228915662648 | AA108: 64.516129032258064 | AB108: 30.057803468208093 | AC108: 19.35483870967742 | AD108: 42.948717948717949 | AE108: 48.192771084337352 | AF108: 17.46987951807229 | AG108: 25.806451612903224 | AI108: Mexico | AM108: 1
A109: Lithuania | B109: LTU | L109: MKD | M109: Macedonia, FYR | N109: 1 | O109: MKD | P109: 58.720930232558203 | Q109: 31.818181818181802 | R109: 26.451612903225801 | S109: 29.090909090909101 | T109: 44.848484848484901 | U109: 33.116883116883102 | V109: 69.942196531791907 | W109: 57.41935483870968 | X109: 53.846153846153847 | Y109: 62.048192771084338 | Z109: 59.036144578313255 | AA109: 56.12903225806452 | AB109: 35.838150289017342 | AC109: 14.838709677419354 | AD109: 10.897435897435898 | AE109: 14.457831325301205 | AF109: 29.518072289156628 | AG109: 12.258064516129032 | AI109: Macedonia, FYR | AJ109: 1
A110: Luxembourg | B110: LUX | L110: MLI | M110: Mali | N110: 1 | O110: MLI | P110: 65.116279069767501 | Q110: 38.961038961039002 | R110: 53.548387096774199 | S110: 59.393939393939398 | T110: 36.363636363636395 | U110: 34.415584415584398 | V110: 76.878612716763001 | W110: 67.096774193548384 | X110: 83.974358974358978 | Y110: 100 | Z110: 62.048192771084338 | AA110: 71.612903225806448 | AB110: 45.664739884393065 | AC110: 14.193548387096774 | AD110: 12.179487179487179 | AE110: 19.879518072289155 | AF110: 8.4337349397590362 | AG110: 1.2903225806451613 | AI110: Mali | AL110: 1
A111: Latvia | B111: LVA | L111: MLT | M111: Malta | N111: 1 | O111: MLT | P111: 89.534883720930196 | Q111: 91.558441558441601 | R111: 77.419354838709694 | S111: 64.242424242424306 | T111: 79.393939393939391 | U111: 73.3766233766234 | V111: 100 | W111: 100 | X111: 100 | Y111: 100 | Z111: 96.385542168674704 | AA111: 95.483870967741936 | AB111: 75.72254335260115 | AC111: 69.677419354838705 | AD111: 14.743589743589743 | AE111: 21.686746987951807 | AF111: 55.421686746987952 | AG111: 9.0322580645161299 | AI111: Malta | AN111: 1
A112: Macao, China | B112: MAC | L112: MMR | M112: Myanmar | N112: 1 | O112: MMR | P112: 1.1627906976744 | Q112: 15.5844155844156 | R112: 2.5806451612902999 | S112: 12.1212121212121 | T112: 19.393939393939398 | U112: 3.8961038961039001 | V112: 11.560693641618499 | W112: 33.548387096774192 | X112: 15.384615384615387 | Y112: 31.325301204819283 | Z112: 43.975903614457835 | AA112: 30.322580645161295 | AB112: 0 | AC112: 7.096774193548387 | AD112: 0 | AE112: 3.0120481927710845 | AF112: 3.6144578313253013 | AG112: 0 | AI112: Myanmar | AK112: 1
A113: Morocco | B113: MAR | L113: MNG | M113: Mongolia | N113: 1 | O113: MNG | P113: 76.162790697674396 | Q113: 63.636363636363605 | R113: 59.354838709677402 | S113: 49.090909090909101 | T113: 55.757575757575793 | U113: 55.194805194805198 | V113: 89.595375722543352 | W113: 87.741935483870975 | X113: 82.051282051282044 | Y113: 96.98795180722891 | Z113: 72.891566265060248 | AA113: 80.645161290322577 | AB113: 62.427745664739888 | AC113: 31.612903225806452 | AD113: 19.23076923076923 | AE113: 16.867469879518072 | AF113: 30.722891566265059 | AG113: 9.0322580645161299 | AI113: Mongolia | AK113: 1
A114: Moldova | B114: MDA | L114: MOZ | M114: Mozambique | N114: 1 | O114: MOZ | P114: 44.767441860465098 | Q114: 27.272727272727298 | R114: 40 | S114: 31.515151515151501 | T114: 12.1212121212121 | U114: 31.168831168831201 | V114: 63.583815028901732 | W114: 54.193548387096776 | X114: 67.948717948717956 | Y114: 65.662650602409641 | Z114: 42.7710843373494 | AA114: 64.516129032258064 | AB114: 25.433526011560694 | AC114: 10.96774193548387 | AD114: 14.102564102564102 | AE114: 15.060240963855422 | AF114: 1.2048192771084338 | AG114: 3.225806451612903 | AI114: Mozambique | AL114: 1
A115: Madagascar | B115: MDG | L115: MRT | M115: Mauritania | N115: 1 | O115: MRT | P115: 16.860465116279101 | Q115: .. | R115: .. | S115: 16.969696969697001 | T115: 31.515151515151501 | U115: .. | V115: 42.774566473988436 | W115: .. | X115: .. | Y115: 62.048192771084338 | Z115: 72.289156626506028 | AA115: .. | AB115: 2.3121387283236996 | AC115: .. | AD115: .. | AE115: 1.8072289156626506 | AF115: 1.2048192771084338 | AG115: .. | AI115: Mauritania | AL115: 1
A116: Maldives | B116: MDV | L116: MTQ | M116: Martinique | N116: 1 | O116: MTQ | P116: .. | Q116: .. | R116: .. | S116: .. | T116: .. | U116: .. | V116: .. | W116: .. | X116: .. | Y116: .. | Z116: .. | AA116: .. | AB116: .. | AC116: .. | AD116: .. | AE116: .. | AF116: .. | AG116: .. | AI116: Martinique | AM116: 1
A117: Mexico | B117: MEX | L117: MUS | M117: Mauritius | N117: 1 | O117: MUS | P117: 79.651162790697711 | Q117: 86.363636363636402 | R117: 65.161290322580697 | S117: 53.3333333333333 | T117: 89.090909090909093 | U117: 68.831168831168796 | V117: 95.95375722543352 | W117: 100 | X117: 80.769230769230774 | Y117: 90.361445783132524 | Z117: 98.795180722891573 | AA117: 81.290322580645153 | AB117: 65.317919075144502 | AC117: 65.806451612903231 | AD117: 37.820512820512818 | AE117: 24.698795180722893 | AF117: 73.493975903614455 | AG117: 56.774193548387096 | AI117: Mauritius | AM117: 1
A118: Macedonia, FYR | B118: MKD | L118: MWI | M118: Malawi | N118: 1 | O118: MWI | P118: 57.558139534883701 | Q118: 51.298701298701296 | R118: 23.2258064516129 | S118: 43.030303030303003 | T118: 38.181818181818201 | U118: 53.246753246753201 | V118: 67.630057803468205 | W118: 72.258064516129025 | X118: 48.07692307692308 | Y118: 79.518072289156635 | Z118: 59.036144578313255 | AA118: 67.096774193548384 | AB118: 37.572254335260112 | AC118: 27.096774193548388 | AD118: 11.538461538461538 | AE118: 22.891566265060241 | AF118: 14.457831325301205 | AG118: 27.096774193548388 | AI118: Malawi | AM118: 1
A119: Mali | B119: MLI | L119: MYS | M119: Malaysia | N119: 1 | O119: MYS | P119: 46.511627906976699 | Q119: 70.129870129870099 | R119: 81.290322580645196 | S119: 67.272727272727295 | T119: 78.181818181818201 | U119: 79.870129870129901 | V119: 63.583815028901732 | W119: 84.516129032258064 | X119: 85.897435897435898 | Y119: 90.361445783132524 | Z119: 86.746987951807228 | AA119: 83.225806451612897 | AB119: 29.479768786127167 | AC119: 51.612903225806448 | AD119: 68.589743589743591 | AE119: 42.7710843373494 | AF119: 66.867469879518069 | AG119: 68.387096774193552 | AI119: Malaysia | AK119: 1
A120: Malta | B120: MLT | L120: NAM | M120: Namibia | N120: 1 | O120: NAM | P120: 65.697674418604706 | Q120: 75.974025974026006 | R120: 60 | S120: 56.969696969697004 | T120: 82.424242424242394 | U120: 70.129870129870099 | V120: 76.878612716763001 | W120: 92.258064516129025 | X120: 73.07692307692308 | Y120: 90.361445783132524 | Z120: 92.771084337349393 | AA120: 83.225806451612897 | AB120: 52.02312138728324 | AC120: 52.903225806451616 | AD120: 35.256410256410255 | AE120: 25.903614457831324 | AF120: 65.060240963855421 | AG120: 56.774193548387096 | AI120: Namibia | AL120: 1
A121: Myanmar | B121: MMR | L121: NER | M121: Niger | N121: 1 | O121: NER | P121: 25 | Q121: 20.7792207792208 | R121: 4.5161290322580001 | S121: 23.030303030303003 | T121: 8.4848484848483992 | U121: 0 | V121: 44.508670520231213 | W121: 51.612903225806448 | X121: 61.53846153846154 | Y121: 67.46987951807229 | Z121: 44.578313253012048 | AA121: 56.774193548387096 | AB121: 9.2485549132947984 | AC121: 7.096774193548387 | AD121: 0 | AE121: 3.6144578313253013 | AF121: 0.60240963855421692 | AG121: 0 | AI121: Niger | AL121: 1
A122: Mongolia | B122: MNG | L122: NGA | M122: Nigeria | N122: 1 | O122: NGA | P122: 11.6279069767442 | Q122: 12.987012987012999 | R122: 5.8064516129031993 | S122: 27.272727272727298 | T122: 11.515151515151501 | U122: 10.3896103896104 | V122: 25.433526011560687 | W122: 27.096774193548384 | X122: 14.743589743589737 | Y122: 54.216867469879517 | Z122: 30.120481927710841 | AA122: 30.322580645161295 | AB122: 1.7341040462427746 | AC122: 7.096774193548387 | AD122: 1.2820512820512822 | AE122: 14.457831325301205 | AF122: 1.8072289156626506 | AG122: 1.2903225806451613 | AI122: Nigeria | AL122: 1
A123: Mozambique | B123: MOZ | L123: NIC | M123: Nicaragua | N123: 1 | O123: NIC | P123: 58.139534883720899 | Q123: 37.662337662337706 | R123: 29.677419354838701 | S123: 36.969696969697004 | T123: 25.454545454545503 | U123: 18.181818181818198 | V123: 67.630057803468205 | W123: 60.645161290322584 | X123: 67.307692307692307 | Y123: 90.361445783132524 | Z123: 47.590361445783131 | AA123: 42.58064516129032 | AB123: 37.572254335260112 | AC123: 16.774193548387096 | AD123: 7.0512820512820511 | AE123: 12.048192771084338 | AF123: 5.4216867469879517 | AG123: 1.2903225806451613 | AI123: Nicaragua | AM123: 1
A124: Mauritania | B124: MRT | L124: NLD | M124: Netherlands | N124: 1 | O124: NLD | P124: 97.093023255814003 | Q124: 98.701298701298697 | R124: 99.354838709677395 | S124: 96.363636363636402 | T124: 93.3333333333333 | U124: 96.103896103896105 | V124: 100 | W124: 100 | X124: 100 | Y124: 100 | Z124: 100 | AA124: 100 | AB124: 82.080924855491332 | AC124: 83.870967741935488 | AD124: 92.307692307692307 | AE124: 78.313253012048193 | AF124: 86.144578313253007 | AG124: 91.612903225806448 | AI124: Netherlands | AN124: 1
A125: Martinique | B125: MTQ | L125: NOR | M125: Norway | N125: 1 | O125: NOR | P125: 99.418604651162795 | Q125: 96.753246753246799 | R125: 95.483870967741908 | S125: 91.515151515151501 | T125: 98.787878787878796 | U125: 92.857142857142904 | V125: 100 | W125: 100 | X125: 100 | Y125: 100 | Z125: 100 | AA125: 97.41935483870968 | AB125: 83.815028901734109 | AC125: 80.645161290322577 | AD125: 85.897435897435898 | AE125: 67.46987951807229 | AF125: 90.361445783132524 | AG125: 87.741935483870961 | AI125: Norway | AN125: 1
A126: Mauritius | B126: MUS | L126: NPL | M126: Nepal | N126: 1 | O126: NPL | P126: 56.395348837209305 | Q126: .. | R126: .. | S126: 26.6666666666667 | T126: 31.515151515151501 | U126: .. | V126: 72.832369942196536 | W126: .. | X126: .. | Y126: 81.92771084337349 | Z126: 72.289156626506028 | AA126: .. | AB126: 29.479768786127167 | AC126: .. | AD126: .. | AE126: 3.6144578313253013 | AF126: 1.2048192771084338 | AG126: .. | AI126: Nepal | AK126: 1
A127: Malawi | B127: MWI | L127: NZL | M127: New Zealand | N127: 1 | O127: NZL | P127: 91.860465116279101 | Q127: 97.402597402597408 | R127: 92.903225806451601 | S127: 97.575757575757606 | T127: 98.181818181818201 | U127: 98.051948051948102 | V127: 100 | W127: 100 | X127: 100 | Y127: 100 | Z127: 100 | AA127: 100 | AB127: 76.878612716763001 | AC127: 80.645161290322577 | AD127: 84.615384615384613 | AE127: 80.722891566265062 | AF127: 89.759036144578317 | AG127: 92.258064516129039 | AI127: New Zealand | AN127: 1
A128: Malaysia | B128: MYS | L128: OMN | M128: Oman | N128: 1 | O128: OMN | P128: 31.395348837209301 | Q128: 81.818181818181799 | R128: 83.870967741935502 | S128: 61.212121212121197 | T128: 84.242424242424192 | U128: 72.077922077922096 | V128: 50.289017341040463 | W128: 98.709677419354833 | X128: 92.307692307692307 | Y128: 94.578313253012055 | Z128: 93.975903614457835 | AA128: 83.225806451612897 | AB128: 13.872832369942197 | AC128: 61.935483870967744 | AD128: 70.512820512820511 | AE128: 24.698795180722893 | AF128: 69.879518072289159 | AG128: 57.41935483870968 | AI128: Oman | AK128: 1
A129: Namibia | B129: NAM | L129: PAK | M129: Pakistan | N129: 1 | O129: PAK | P129: 36.6279069767442 | Q129: 24.675324675324699 | R129: 18.709677419354801 | S129: 32.727272727272698 | T129: 23.636363636363601 | U129: 23.3766233766234 | V129: 56.647398843930638 | W129: 43.87096774193548 | X129: 45.512820512820511 | Y129: 62.048192771084338 | Z129: 43.975903614457835 | AA129: 43.225806451612904 | AB129: 17.919075144508671 | AC129: 11.612903225806452 | AD129: 7.0512820512820511 | AE129: 19.879518072289155 | AF129: 6.024096385542169 | AG129: 3.225806451612903 | AI129: Pakistan | AK129: 1
A130: Niger | B130: NER | L130: PAN | M130: Panama | N130: 1 | O130: PAN | P130: 70.348837209302289 | Q130: 55.844155844155793 | R130: 43.225806451612904 | S130: 93.939393939393995 | T130: 39.393939393939398 | U130: 37.012987012986997 | V130: 83.815028901734109 | W130: 76.129032258064512 | X130: 70.512820512820511 | Y130: 100 | Z130: 59.638554216867469 | AA130: 64.516129032258064 | AB130: 60.693641618497111 | AC130: 31.612903225806452 | AD130: 13.461538461538462 | AE130: 54.216867469879517 | AF130: 14.457831325301205 | AG130: 9.0322580645161299 | AI130: Panama | AM130: 1
A131: Nigeria | B131: NGA | L131: PER | M131: Peru | N131: 1 | O131: PER | P131: 27.906976744186 | Q131: 27.922077922077897 | R131: 65.806451612903203 | S131: 78.181818181818201 | T131: 33.3333333333333 | U131: 52.597402597402599 | V131: 44.508670520231213 | W131: 47.741935483870968 | X131: 79.487179487179489 | Y131: 97.590361445783131 | Z131: 51.204819277108435 | AA131: 67.096774193548384 | AB131: 12.138728323699421 | AC131: 14.193548387096774 | AD131: 40.384615384615387 | AE131: 46.987951807228917 | AF131: 14.457831325301205 | AG131: 27.096774193548388 | AI131: Peru | AM131: 1
A132: Nicaragua | B132: NIC | L132: PHL | M132: Philippines | N132: 1 | O132: PHL | P132: 68.604651162790702 | Q132: 60.389610389610404 | R132: 61.935483870967801 | S132: 71.515151515151501 | T132: 51.515151515151501 | U132: 51.298701298701296 | V132: 82.080924855491332 | W132: 77.41935483870968 | X132: 76.282051282051285 | Y132: 93.975903614457835 | Z132: 65.060240963855421 | AA132: 64.516129032258064 | AB132: 58.959537572254334 | AC132: 40.645161290322584 | AD132: 37.820512820512818 | AE132: 45.783132530120483 | AF132: 33.734939759036145 | AG132: 30.967741935483872 | AI132: Philippines | AK132: 1
A133: Netherlands | B133: NLD | L133: PNG | M133: Papua New Guinea | N133: 1 | O133: PNG | P133: 59.302325581395401 | Q133: 33.116883116883102 | R133: 20 | S133: 36.363636363636395 | T133: 43.636363636363598 | U133: 15.5844155844156 | V133: 69.364161849710982 | W133: 60.645161290322584 | X133: 59.615384615384613 | Y133: 89.156626506024097 | Z133: 64.457831325301214 | AA133: 48.387096774193552 | AB133: 39.306358381502889 | AC133: 12.903225806451612 | AD133: 3.2051282051282053 | AE133: 11.445783132530121 | AF133: 15.060240963855422 | AG133: 1.2903225806451613 | AI133: Papua New Guinea | AK133: 1
A134: Norway | B134: NOR | L134: POL | M134: Poland | N134: 1 | O134: POL | P134: 80.813953488372107 | Q134: 80.519480519480496 | R134: 80 | S134: 70.909090909090907 | T134: 70.303030303030297 | U134: 72.727272727272691 | V134: 95.95375722543352 | W134: 89.677419354838705 | X134: 84.615384615384613 | Y134: 91.566265060240966 | Z134: 78.313253012048193 | AA134: 82.58064516129032 | AB134: 67.630057803468205 | AC134: 66.451612903225808 | AD134: 70.512820512820511 | AE134: 50.602409638554214 | AF134: 62.048192771084338 | AG134: 66.451612903225808 | AI134: Poland | AJ134: 1
A135: Nepal | B135: NPL | L135: PRI | M135: Puerto Rico | N135: 1 | O135: PRI | P135: .. | Q135: 77.272727272727309 | R135: 87.741935483871003 | S135: 83.636363636363598 | T135: 76.363636363636402 | U135: 85.064935064935099 | V135: .. | W135: 100 | X135: 100 | Y135: 100 | Z135: 96.98795180722891 | AA135: 100 | AB135: .. | AC135: 39.354838709677416 | AD135: 68.589743589743591 | AE135: 33.132530120481931 | AF135: 47.590361445783131 | AG135: 64.516129032258064 | AI135: Puerto Rico | AN135: 1
A136: New Zealand | B136: NZL | L136: PRK | M136: Korea, Dem. Rep. | N136: 1 | O136: PRK | P136: 0 | Q136: 63.636363636363605 | R136: 40.645161290322598 | S136: 6.0606060606060002 | T136: 28.484848484848502 | U136: 31.818181818181802 | V136: 12.138728323699425 | W136: 87.741935483870975 | X136: 85.897435897435898 | Y136: 25.903614457831324 | Z136: 62.048192771084338 | AA136: 83.225806451612897 | AB136: 0 | AC136: 31.612903225806452 | AD136: 0.64102564102564108 | AE136: 0.60240963855421692 | AF136: 1.8072289156626506 | AG136: 0 | AI136: Korea, Dem. Rep. | AK136: 1
A137: Oman | B137: OMN | L137: PRT | M137: Portugal | N137: 1 | O137: PRT | P137: 93.023255813953497 | Q137: 94.155844155844207 | R137: 85.161290322580598 | S137: 88.484848484848499 | T137: 85.45454545454551 | U137: 86.363636363636402 | V137: 100 | W137: 100 | X137: 94.230769230769226 | Y137: 100 | Z137: 92.168674698795186 | AA137: 90.322580645161295 | AB137: 77.456647398843927 | AC137: 80.645161290322577 | AD137: 80.769230769230774 | AE137: 66.265060240963862 | AF137: 73.493975903614455 | AG137: 83.225806451612897 | AI137: Portugal | AN137: 1
A138: Pakistan | B138: PAK | L138: PRY | M138: Paraguay | N138: 1 | O138: PRY | P138: 37.790697674418603 | Q138: 25.324675324675301 | R138: 10.9677419354839 | S138: 63.030303030303003 | T138: 27.878787878787897 | U138: 9.7402597402597006 | V138: 58.381502890173408 | W138: 51.612903225806448 | X138: 35.256410256410263 | Y138: 100 | Z138: 50 | AA138: 39.354838709677416 | AB138: 19.653179190751445 | AC138: 10.96774193548387 | AD138: 1.2820512820512822 | AE138: 21.686746987951807 | AF138: 5.4216867469879517 | AG138: 1.2903225806451613 | AI138: Paraguay | AM138: 1
A139: Panama | B139: PAN | L139: QAT | M139: Qatar | N139: 1 | O139: QAT | P139: 23.837209302325597 | Q139: 93.506493506493499 | R139: 72.258064516128997 | S139: 61.818181818181806 | T139: 88.484848484848499 | U139: 75.974025974026006 | V139: 42.774566473988436 | W139: 100 | X139: 84.615384615384613 | Y139: 94.578313253012055 | Z139: 96.98795180722891 | AA139: 84.516129032258064 | AB139: 10.982658959537572 | AC139: 78.064516129032256 | AD139: 49.358974358974358 | AE139: 25.301204819277107 | AF139: 75.301204819277103 | AG139: 63.87096774193548 | AI139: Qatar | AK139: 1
A140: Peru | B140: PER | L140: REU | M140: Reunion | N140: 1 | O140: REU | P140: .. | Q140: .. | R140: .. | S140: .. | T140: .. | U140: .. | V140: .. | W140: .. | X140: .. | Y140: .. | Z140: .. | AA140: .. | AB140: .. | AC140: .. | AD140: .. | AE140: .. | AF140: .. | AG140: .. | AI140: Reunion | AK140: 1
A141: Philippines | B141: PHL | L141: ROM | M141: Romania | N141: 1 | O141: ROM | P141: 64.534883720930196 | Q141: 50.649350649350602 | R141: 27.741935483871 | S141: 52.121212121212103 | T141: 50.909090909090907 | U141: 37.662337662337706 | V141: 76.300578034682076 | W141: 69.032258064516128 | X141: 51.92307692307692 | Y141: 78.915662650602414 | Z141: 64.457831325301214 | AA141: 56.774193548387096 | AB141: 49.132947976878611 | AC141: 31.612903225806452 | AD141: 12.179487179487179 | AE141: 28.91566265060241 | AF141: 36.746987951807228 | AG141: 18.70967741935484 | AI141: Romania | AJ141: 1
A142: Papua New Guinea | B142: PNG | L142: RUS | M142: Russian Federation | N142: 1 | O142: RUS | P142: 40.697674418604699 | Q142: 24.025974025974001 | R142: 25.161290322580598 | S142: 29.696969696969699 | T142: 26.060606060606101 | U142: 27.272727272727298 | V142: 61.271676300578036 | W142: 39.354838709677416 | X142: 47.435897435897438 | Y142: 42.7710843373494 | Z142: 38.554216867469883 | AA142: 45.161290322580648 | AB142: 23.121387283236995 | AC142: 12.258064516129032 | AD142: 12.179487179487179 | AE142: 21.686746987951807 | AF142: 12.650602409638553 | AG142: 11.612903225806452 | AI142: Russian Federation | AJ142: 1
A143: Poland | B143: POL | L143: RWA | M143: Rwanda | N143: 1 | O143: RWA | P143: 12.209302325581401 | Q143: .. | R143: .. | S143: 10.909090909090899 | T143: 6.6666666666666003 | U143: .. | V143: 35.838150289017335 | W143: .. | X143: .. | Y143: 42.7710843373494 | Z143: 53.012048192771083 | AA143: .. | AB143: 0 | AC143: .. | AD143: .. | AE143: 1.2048192771084338 | AF143: 0 | AG143: .. | AI143: Rwanda | AL143: 1
A144: Puerto Rico | B144: PRI | L144: SAU | M144: Saudi Arabia | N144: 1 | O144: SAU | P144: 13.372093023255799 | Q144: 59.090909090909108 | R144: 38.064516129032299 | S144: 35.151515151515198 | T144: 67.272727272727295 | U144: 29.870129870129901 | V144: 29.479768786127167 | W144: 77.41935483870968 | X144: 67.307692307692307 | Y144: 77.108433734939752 | Z144: 83.132530120481931 | AA144: 57.41935483870968 | AB144: 3.4682080924855492 | AC144: 38.70967741935484 | AD144: 13.461538461538462 | AE144: 14.457831325301205 | AF144: 55.421686746987952 | AG144: 4.5161290322580649 | AI144: Saudi Arabia | AK144: 1
A145: Korea, Dem. Rep. | B145: PRK | L145: SDN | M145: Sudan | N145: 1 | O145: SDN | P145: 4.6511627906976001 | Q145: 3.8961038961039001 | R145: 1.2903225806451 | S145: 18.181818181818198 | T145: 3.6363636363636003 | U145: 5.8441558441558001 | V145: 16.184971098265891 | W145: 12.903225806451616 | X145: 12.179487179487182 | Y145: 50.602409638554214 | Z145: 24.096385542168676 | AA145: 39.354838709677416 | AB145: 0 | AC145: 1.2903225806451613 | AD145: 0 | AE145: 2.4096385542168677 | AF145: 0.60240963855421692 | AG145: 0 | AI145: Sudan | AL145: 1
A146: Portugal | B146: PRT | L146: SEN | M146: Senegal | N146: 1 | O146: SEN | P146: 41.279069767441904 | Q146: 18.831168831168803 | R146: 60.645161290322605 | S146: 28.484848484848502 | T146: 50.303030303030305 | U146: 50.649350649350602 | V146: 61.271676300578036 | W146: 40.645161290322584 | X146: 76.282051282051285 | Y146: 78.313253012048193 | Z146: 66.867469879518069 | AA146: 67.741935483870975 | AB146: 23.121387283236995 | AC146: 7.741935483870968 | AD146: 30.76923076923077 | AE146: 7.2289156626506026 | AF146: 30.120481927710845 | AG146: 24.516129032258064 | AI146: Senegal | AL146: 1
A147: Paraguay | B147: PRY | L147: SGP | M147: Singapore | N147: 1 | O147: SGP | P147: 55.813953488372107 | Q147: 94.805194805194802 | R147: 100 | S147: 100 | T147: 99.393939393939405 | U147: 95.454545454545496 | V147: 67.052023121387293 | W147: 100 | X147: 100 | Y147: 100 | Z147: 100 | AA147: 100 | AB147: 36.416184971098268 | AC147: 80.645161290322577 | AD147: 94.230769230769226 | AE147: 81.92771084337349 | AF147: 92.168674698795186 | AG147: 91.612903225806448 | AI147: Singapore | AK147: 1
A148: Qatar | B148: QAT | L148: SLB | M148: Solomon Islands | N148: 1 | O148: SLB | P148: 84.883720930232599 | Q148: .. | R148: .. | S148: .. | T148: .. | U148: .. | V148: 100 | W148: .. | X148: .. | Y148: .. | Z148: .. | AA148: .. | AB148: 65.317919075144502 | AC148: .. | AD148: .. | AE148: .. | AF148: .. | AG148: .. | AI148: Solomon Islands | AK148: 1
A149: Reunion | B149: REU | L149: SLE | M149: Sierra Leone | N149: 1 | O149: SLE | P149: 2.3255813953488 | Q149: 7.1428571428570997 | R149: 56.129032258064505 | S149: 4.8484848484847998 | T149: 16.363636363636399 | U149: 58.441558441558406 | V149: 13.872832369942202 | W149: 23.870967741935488 | X149: 92.307692307692307 | Y149: 24.698795180722897 | Z149: 53.012048192771083 | AA149: 89.032258064516128 | AB149: 0 | AC149: 1.2903225806451613 | AD149: 2.5641025641025643 | AE149: 0.60240963855421692 | AF149: 1.2048192771084338 | AG149: 1.2903225806451613 | AI149: Sierra Leone | AL149: 1
A150: Romania | B150: ROM | L150: SLV | M150: El Salvador | N150: 1 | O150: SLV | P150: 48.837209302325604 | Q150: 48.051948051948102 | R150: 44.5161290322581 | S150: 99.393939393939405 | T150: 29.696969696969699 | U150: 41.558441558441601 | V150: 64.161849710982665 | W150: 72.258064516129025 | X150: 71.15384615384616 | Y150: 100 | Z150: 50 | AA150: 64.516129032258064 | AB150: 30.057803468208093 | AC150: 25.161290322580644 | AD150: 12.179487179487179 | AE150: 52.409638554216869 | AF150: 8.4337349397590362 | AG150: 21.29032258064516 | AI150: El Salvador | AM150: 1
A151: Russian Federation | B151: RUS | L151: SOM | M151: Somalia | N151: 1 | O151: SOM | P151: 1.7441860465116001 | Q151: 4.5454545454544997 | R151: 1.9354838709677 | S151: 3.0303030303030001 | T151: 1.8181818181818001 | U151: 4.5454545454544997 | V151: 13.294797687861276 | W151: 18.709677419354833 | X151: 47.435897435897438 | Y151: 19.277108433734938 | Z151: 30.120481927710841 | AA151: 70.967741935483872 | AB151: 0 | AC151: 0.64516129032258063 | AD151: 0 | AE151: 0.60240963855421692 | AF151: 0 | AG151: 0 | AI151: Somalia | AL151: 1
A152: Rwanda | B152: RWA | L152: STP | M152: Sao Tome and Principe | N152: 1 | O152: STP | P152: 75.581395348837205 | Q152: .. | R152: .. | S152: .. | T152: .. | U152: .. | V152: 95.95375722543352 | W152: .. | X152: .. | Y152: .. | Z152: .. | AA152: .. | AB152: 58.959537572254334 | AC152: .. | AD152: .. | AE152: .. | AF152: .. | AG152: .. | AI152: Sao Tome and Principe | AM152: 1
A153: Saudi Arabia | B153: SAU | L153: SUR | M153: Suriname | N153: 1 | O153: SUR | P153: 62.790697674418603 | Q153: 42.207792207792203 | R153: 49.0322580645161 | S153: 21.818181818181799 | T153: 24.2424242424242 | U153: 58.441558441558406 | V153: 76.300578034682076 | W153: 72.258064516129025 | X153: 89.102564102564102 | Y153: 66.265060240963862 | Z153: 59.036144578313255 | AA153: 89.032258064516128 | AB153: 42.196531791907518 | AC153: 14.193548387096774 | AD153: 2.5641025641025643 | AE153: 3.6144578313253013 | AF153: 1.8072289156626506 | AG153: 1.2903225806451613 | AI153: Suriname | AM153: 1
A154: Sudan | B154: SDN | L154: SVK | M154: Slovak Republic | N154: 1 | O154: SVK | P154: 72.093023255814003 | Q154: 73.3766233766234 | R154: 54.193548387096804 | S154: 48.484848484848499 | T154: 58.787878787878803 | U154: 62.987012987013003 | V154: 86.127167630057798 | W154: 85.161290322580641 | X154: 70.512820512820511 | Y154: 73.493975903614455 | Z154: 66.867469879518069 | AA154: 69.677419354838705 | AB154: 61.849710982658962 | AC154: 58.064516129032256 | AD154: 33.974358974358971 | AE154: 30.722891566265059 | AF154: 47.590361445783131 | AG154: 44.516129032258064 | AI154: Slovak Republic | AJ154: 1
A155: Senegal | B155: SEN | L155: SVN | M155: Slovenia | N155: 1 | O155: SVN | P155: 80.232558139534902 | Q155: 85.064935064935099 | R155: 74.838709677419402 | S155: 69.090909090909108 | T155: 77.575757575757592 | U155: 83.766233766233796 | V155: 95.95375722543352 | W155: 99.354838709677423 | X155: 84.615384615384613 | Y155: 93.975903614457835 | Z155: 86.144578313253007 | AA155: 89.032258064516128 | AB155: 67.630057803468205 | AC155: 72.258064516129039 | AD155: 60.897435897435898 | AE155: 42.7710843373494 | AF155: 66.867469879518069 | AG155: 77.41935483870968 | AI155: Slovenia | AJ155: 1
A156: Singapore | B156: SGP | L156: SWE | M156: Sweden | N156: 1 | O156: SWE | P156: 97.674418604651208 | Q156: 96.103896103896105 | R156: 93.548387096774206 | S156: 84.242424242424192 | T156: 95.151515151515198 | U156: 99.350649350649405 | V156: 100 | W156: 100 | X156: 99.358974358974365 | Y156: 100 | Z156: 100 | AA156: 100 | AB156: 82.658959537572258 | AC156: 80.645161290322577 | AD156: 84.615384615384613 | AE156: 65.060240963855421 | AF156: 86.144578313253007 | AG156: 92.903225806451616 | AI156: Sweden | AN156: 1
A157: Solomon Islands | B157: SLB | L157: SWZ | M157: Swaziland | N157: 1 | O157: SWZ | P157: 23.255813953488399 | Q157: 5.8441558441558001 | R157: 33.548387096774199 | S157: 60 | T157: 52.121212121212103 | U157: 61.6883116883117 | V157: 50.289017341040463 | W157: 29.677419354838705 | X157: 64.743589743589752 | Y157: 93.373493975903614 | Z157: 83.734939759036138 | AA157: 81.290322580645153 | AB157: 5.202312138728324 | AC157: 0 | AD157: 10.256410256410257 | AE157: 25.903614457831324 | AF157: 8.4337349397590362 | AG157: 25.161290322580644 | AI157: Swaziland | AL157: 1
A158: Sierra Leone | B158: SLE | L158: SYR | M158: Syrian Arab Republic | N158: 1 | O158: SYR | P158: 7.5581395348836997 | Q158: 51.948051948051898 | R158: 8.3870967741935001 | S158: 14.545454545454501 | T158: 44.2424242424242 | U158: 21.428571428571399 | V158: 21.965317919075147 | W158: 74.838709677419359 | X158: 29.487179487179489 | Y158: 35.5421686746988 | Z158: 62.048192771084338 | AA158: 49.032258064516128 | AB158: 0 | AC158: 29.677419354838708 | AD158: 0.64102564102564108 | AE158: 3.6144578313253013 | AF158: 19.879518072289155 | AG158: 1.935483870967742 | AI158: Syrian Arab Republic | AK158: 1
A159: El Salvador | B159: SLV | L159: TCD | M159: Chad | N159: 1 | O159: TCD | P159: 22.674418604651201 | Q159: 22.727272727272698 | R159: 19.354838709677399 | S159: 19.393939393939398 | T159: 20 | U159: 29.220779220779203 | V159: 45.086705202312139 | W159: 70.322580645161295 | X159: 70.512820512820511 | Y159: 66.265060240963862 | Z159: 56.024096385542165 | AA159: 71.612903225806448 | AB159: 4.6242774566473992 | AC159: 1.935483870967742 | AD159: 0.64102564102564108 | AE159: 2.4096385542168677 | AF159: 1.2048192771084338 | AG159: 0 | AI159: Chad | AL159: 1
A160: Somalia | B160: SOM | L160: TGO | M160: Togo | N160: 1 | O160: TGO | P160: 13.953488372093 | Q160: 18.181818181818198 | R160: 37.419354838709701 | S160: 15.7575757575758 | T160: 21.818181818181799 | U160: 50 | V160: 35.838150289017335 | W160: 43.225806451612904 | X160: 76.92307692307692 | Y160: 48.192771084337352 | Z160: 51.807228915662648 | AA160: 80.645161290322577 | AB160: 3.4682080924855492 | AC160: 6.4516129032258061 | AD160: 5.1282051282051286 | AE160: 2.4096385542168677 | AF160: 1.8072289156626506 | AG160: 3.225806451612903 | AI160: Togo | AL160: 1
A161: Sao Tome and Principe and Pr | B161: STP | L161: THA | M161: Thailand | N161: 1 | O161: THA | P161: 61.627906976744192 | Q161: 59.740259740259702 | R161: 58.064516129032299 | S161: 50.909090909090907 | T161: 66.6666666666667 | U161: 54.545454545454497 | V161: 71.676300578034684 | W161: 76.129032258064512 | X161: 71.15384615384616 | Y161: 77.108433734939752 | Z161: 77.108433734939752 | AA161: 65.806451612903231 | AB161: 42.774566473988436 | AC161: 40.645161290322584 | AD161: 35.256410256410255 | AE161: 30.722891566265059 | AF161: 55.421686746987952 | AG161: 34.838709677419352 | AI161: Thailand | AK161: 1
A162: Suriname | B162: SUR | L162: TJK | M162: Tajikistan | N162: 1 | O162: TJK | P162: 4.0697674418604004 | Q162: 1.9480519480519001 | R162: 3.2258064516128995 | S162: 4.2424242424241996 | T162: 4.2424242424241996 | U162: 1.2987012987013 | V162: 22.543352601156073 | W162: 10.322580645161295 | X162: 17.948717948717942 | Y162: 14.4578313253012 | Z162: 16.265060240963862 | AA162: 20 | AB162: 0 | AC162: 0.64516129032258063 | AD162: 0 | AE162: 1.8072289156626506 | AF162: 1.2048192771084338 | AG162: 0 | AI162: Tajikistan | AJ162: 1
A163: Slovak Republic | B163: SVK | L163: TKM | M163: Turkmenistan | N163: 1 | O163: TKM | P163: 5.8139534883720003 | Q163: 49.350649350649398 | R163: 7.0967741935483 | S163: 1.8181818181818001 | T163: 13.939393939393899 | U163: 1.9480519480519001 | V163: 24.855491329479776 | W163: 72.258064516129025 | X163: 25.641025641025635 | Y163: 7.228915662650607 | Z163: 32.53012048192771 | AA163: 21.290322580645167 | AB163: 0 | AC163: 25.161290322580644 | AD163: 0 | AE163: 0.60240963855421692 | AF163: 3.6144578313253013 | AG163: 0 | AI163: Turkmenistan | AJ163: 1
A164: Slovenia | B164: SVN | L164: TTO | M164: Trinidad and Tobago& Tob* | N164: 1 | O164: TTO | P164: 76.744186046511601 | Q164: 61.038961038961006 | R164: 72.903225806451601 | S164: 79.393939393939391 | T164: 69.696969696969703 | U164: 74.675324675324688 | V164: 91.329479768786129 | W164: 83.870967741935488 | X164: 87.179487179487182 | Y164: 100 | Z164: 86.144578313253007 | AA164: 84.516129032258064 | AB164: 65.317919075144502 | AC164: 34.838709677419352 | AD164: 47.435897435897438 | AE164: 30.120481927710845 | AF164: 50 | AG164: 57.41935483870968 | AI164: Trinidad and Tobago& Tob* | AM164: 1
A165: Sweden | B165: SWE | L165: TUN | M165: Tunisia | N165: 1 | O165: TUN | P165: 30.813953488372096 | Q165: 74.675324675324688 | R165: 78.70967741935479 | S165: 66.060606060606091 | T165: 72.727272727272691 | U165: 62.337662337662302 | V165: 49.132947976878611 | W165: 88.387096774193552 | X165: 84.615384615384613 | Y165: 93.373493975903614 | Z165: 86.144578313253007 | AA165: 71.612903225806448 | AB165: 13.872832369942197 | AC165: 53.548387096774192 | AD165: 64.743589743589737 | AE165: 35.542168674698793 | AF165: 57.2289156626506 | AG165: 39.354838709677416 | AI165: Tunisia | AL165: 1
A166: Swaziland | B166: SWZ | L166: TUR | M166: Turkey | N166: 1 | O166: TUR | P166: 22.093023255814 | Q166: 16.883116883116898 | R166: 35.4838709677419 | S166: 73.939393939393909 | T166: 55.151515151515198 | U166: 42.857142857142897 | V166: 39.306358381502889 | W166: 31.612903225806448 | X166: 60.256410256410255 | Y166: 93.975903614457835 | Z166: 65.662650602409641 | AA166: 62.58064516129032 | AB166: 8.0924855491329488 | AC166: 8.387096774193548 | AD166: 14.743589743589743 | AE166: 47.590361445783131 | AF166: 37.951807228915662 | AG166: 25.806451612903224 | AI166: Turkey | AN166: 1
A167: Syrian Arab Republic | B167: SYR | L167: TWN | M167: Taiwan, China | N167: 1 | O167: TWN | P167: 71.511627906976798 | Q167: 83.766233766233796 | R167: 89.0322580645161 | S167: 82.424242424242394 | T167: 81.212121212121204 | U167: 79.220779220779207 | V167: 86.127167630057798 | W167: 98.064516129032256 | X167: 97.435897435897431 | Y167: 100 | Z167: 89.759036144578317 | AA167: 83.225806451612897 | AB167: 61.271676300578036 | AC167: 66.451612903225808 | AD167: 82.051282051282058 | AE167: 63.855421686746986 | AF167: 68.07228915662651 | AG167: 68.387096774193552 | AI167: Taiwan, China | AK167: 1
A168: Chad | B168: TCD | L168: TZA | M168: Tanzania | N168: 1 | O168: TZA | P168: 42.441860465116299 | Q168: 71.428571428571402 | R168: 32.258064516128997 | S168: 49.696969696969703 | T168: 61.212121212121197 | U168: 11.6883116883117 | V168: 61.271676300578036 | W168: 84.516129032258064 | X168: 53.846153846153847 | Y168: 80.722891566265062 | Z168: 72.891566265060248 | AA168: 33.548387096774192 | AB168: 23.699421965317921 | AC168: 51.612903225806448 | AD168: 13.461538461538462 | AE168: 25.903614457831324 | AF168: 42.7710843373494 | AG168: 1.2903225806451613 | AI168: Tanzania | AL168: 1
A169: Togo | B169: TGO | L169: UGA | M169: Uganda | N169: 1 | O169: UGA | P169: 34.883720930232599 | Q169: 14.935064935064901 | R169: 45.161290322580598 | S169: 50.303030303030305 | T169: 54.545454545454497 | U169: 35.714285714285701 | V169: 52.02312138728324 | W169: 30.322580645161295 | X169: 67.307692307692307 | Y169: 80.722891566265062 | Z169: 66.867469879518069 | AA169: 57.41935483870968 | AB169: 15.606936416184972 | AC169: 7.741935483870968 | AD169: 20.512820512820515 | AE169: 25.903614457831324 | AF169: 33.734939759036145 | AG169: 13.548387096774194 | AI169: Uganda | AL169: 1
A170: Thailand | B170: THA | L170: UKR | M170: Ukraine | N170: 1 | O170: UKR | P170: 52.906976744186096 | Q170: 40.909090909090899 | R170: 14.193548387096799 | S170: 20 | T170: 27.272727272727298 | U170: 12.3376623376623 | V170: 66.473988439306368 | W170: 56.774193548387096 | X170: 33.333333333333329 | Y170: 30.120481927710841 | Z170: 39.75903614457831 | AA170: 30.322580645161295 | AB170: 35.260115606936417 | AC170: 24.516129032258064 | AD170: 6.4102564102564106 | AE170: 11.445783132530121 | AF170: 12.650602409638553 | AG170: 3.225806451612903 | AI170: Ukraine | AJ170: 1
A171: Tajikistan | B171: TJK | L171: URY | M171: Uruguay | N171: 1 | O171: URY | P171: 73.837209302325604 | Q171: 62.987012987013003 | R171: 76.774193548387103 | S171: 92.727272727272705 | T171: 63.636363636363605 | U171: 71.428571428571402 | V171: 86.705202312138724 | W171: 83.225806451612897 | X171: 86.538461538461533 | Y171: 100 | Z171: 77.108433734939752 | AA171: 83.225806451612897 | AB171: 62.427745664739888 | AC171: 41.29032258064516 | AD171: 55.769230769230766 | AE171: 49.397590361445786 | AF171: 44.578313253012048 | AG171: 57.41935483870968 | AI171: Uruguay | AM171: 1
A172: Turkmenistan | B172: TKM | L172: USA | M172: United States | N172: 1 | O172: USA | P172: 95.930232558139508 | Q172: 85.714285714285694 | R172: 90.322580645161295 | S172: 95.151515151515198 | T172: 87.878787878787904 | U172: 88.961038961038994 | V172: 100 | W172: 99.354838709677423 | X172: 97.435897435897431 | Y172: 100 | Z172: 95.180722891566262 | AA172: 93.548387096774192 | AB172: 79.76878612716763 | AC172: 72.258064516129039 | AD172: 83.974358974358978 | AE172: 78.313253012048193 | AF172: 78.313253012048193 | AG172: 83.225806451612897 | AI172: United States | AN172: 1
A173: Trinidad and Tobago& Tob* | B173: TTO | L173: UZB | M173: Uzbekistan | N173: 1 | O173: UZB | P173: 8.7209302325581 | Q173: 37.012987012986997 | R173: 6.4516129032257989 | S173: 6.6666666666666003 | T173: 18.7878787878788 | U173: 9.0909090909089993 | V173: 24.855491329479776 | W173: 57.41935483870968 | X173: 17.307692307692307 | Y173: 15.662650602409641 | Z173: 33.734939759036138 | AA173: 29.032258064516128 | AB173: 0 | AC173: 19.35483870967742 | AD173: 0.64102564102564108 | AE173: 2.4096385542168677 | AF173: 5.4216867469879517 | AG173: 1.2903225806451613 | AI173: Uzbekistan | AJ173: 1
A174: Tunisia | B174: TUN | L174: VEN | M174: Venezuela, RB | N174: 1 | O174: VEN | P174: 61.046511627906995 | Q174: 40.259740259740298 | R174: 14.8387096774194 | S174: 44.848484848484901 | T174: 29.090909090909101 | U174: 25.324675324675301 | V174: 70.520231213872833 | W174: 59.354838709677416 | X174: 37.179487179487182 | Y174: 69.879518072289159 | Z174: 45.180722891566262 | AA174: 43.225806451612904 | AB174: 40.462427745664741 | AC174: 22.580645161290324 | AD174: 6.4102564102564106 | AE174: 27.108433734939759 | AF174: 12.048192771084338 | AG174: 3.225806451612903 | AI174: Venezuela, RB | AM174: 1
A175: Turkey | B175: TUR | L175: VNM | M175: Vietnam | N175: 1 | O175: VNM | P175: 6.3953488372092995 | Q175: 74.025974025973994 | R175: 41.290322580645203 | S175: 24.848484848484802 | T175: 36.969696969697004 | U175: 43.506493506493499 | V175: 19.653179190751445 | W175: 87.741935483870975 | X175: 67.307692307692307 | Y175: 42.7710843373494 | Z175: 55.421686746987952 | AA175: 61.935483870967744 | AB175: 0 | AC175: 54.838709677419352 | AD175: 17.948717948717949 | AE175: 13.855421686746988 | AF175: 16.867469879518072 | AG175: 25.806451612903224 | AI175: Vietnam | AK175: 1
A176: Taiwan, China | B176: TWN | L176: WTB | M176: West Bank and Gaza | N176: 1 | O176: WTB | P176: 47.093023255813996 | Q176: 53.246753246753201 | R176: 50.322580645161295 | S176: 33.939393939393902 | T176: 86.6666666666667 | U176: 69.480519480519504 | V176: 95.95375722543352 | W176: 95.483870967741936 | X176: 83.974358974358978 | Y176: 100 | Z176: 100 | AA176: 89.032258064516128 | AB176: 0 | AC176: 10.96774193548387 | AD176: 8.3333333333333339 | AE176: 1.8072289156626506 | AF176: 57.831325301204821 | AG176: 25.806451612903224 | AI176: West Bank and Gaza | AK176: 1
A177: Tanzania | B177: TZA | L177: YEM | M177: Yemen, Rep. | N177: 1 | O177: YEM | P177: 38.3720930232558 | Q177: 7.7922077922077007 | R177: 23.870967741935502 | S177: 23.030303030303003 | T177: 13.3333333333333 | U177: 15.5844155844156 | V177: 58.381502890173408 | W177: 20 | X177: 61.53846153846154 | Y177: 67.46987951807229 | Z177: 39.156626506024097 | AA177: 48.387096774193552 | AB177: 19.653179190751445 | AC177: 1.935483870967742 | AD177: 5.1282051282051286 | AE177: 3.6144578313253013 | AF177: 1.2048192771084338 | AG177: 1.2903225806451613 | AI177: Yemen, Rep. | AK177: 1
A178: Uganda | B178: UGA | L178: YUG | M178: Yugoslavia, FR (Serbia/Montenegro) | N178: 1 | O178: YUG | P178: 18.023255813953501 | Q178: 8.4415584415583993 | R178: 12.258064516129 | S178: 3.6363636363636003 | T178: 21.2121212121212 | U178: 7.7922077922077007 | V178: 37.572254335260112 | W178: 18.709677419354833 | X178: 37.179487179487182 | Y178: 36.144578313253014 | Z178: 38.554216867469883 | AA178: 28.387096774193552 | AB178: 6.3583815028901736 | AC178: 1.935483870967742 | AD178: 2.5641025641025643 | AE178: 0.60240963855421692 | AF178: 6.6265060240963853 | AG178: 1.2903225806451613 | AI178: Yugoslavia, FR (Serbia/Montenegro) | AJ178: 1
A179: Ukraine | B179: UKR | L179: ZAF | M179: South Africa | N179: 1 | O179: ZAF | P179: 77.906976744186096 | Q179: 28.571428571428598 | R179: 55.4838709677419 | S179: 55.757575757575793 | T179: 41.818181818181799 | U179: 68.181818181818201 | V179: 93.063583815028906 | W179: 46.451612903225808 | X179: 70.512820512820511 | Y179: 77.108433734939752 | Z179: 56.024096385542165 | AA179: 80 | AB179: 67.052023121387279 | AC179: 14.838709677419354 | AD179: 35.256410256410255 | AE179: 34.939759036144579 | AF179: 24.096385542168676 | AG179: 57.41935483870968 | AI179: South Africa | AL179: 1
A180: Uruguay | B180: URY | L180: ZAR | M180: Congo, Dem. Rep. | N180: 1 | O180: ZAR | P180: 3.4883720930232003 | Q180: 0 | R180: 0.64516129032250003 | S180: 1.2121212121211999 | T180: 0 | U180: 0.64935064935060005 | V180: 16.184971098265891 | W180: 1.9354838709677438 | X180: 16.666666666666671 | Y180: 3.6144578313252964 | Z180: 3.0120481927710898 | AA180: 27.096774193548384 | AB180: 0 | AC180: 0 | AD180: 0 | AE180: 0.60240963855421692 | AF180: 0 | AG180: 0 | AI180: Congo, Dem. Rep. | AL180: 1
A181: United States | B181: USA | L181: ZMB | M181: Zambia | N181: 1 | O181: ZMB | P181: 51.744186046511601 | Q181: 48.701298701298704 | R181: 36.774193548387103 | S181: 56.363636363636402 | T181: 38.787878787878796 | U181: 27.922077922077897 | V181: 65.317919075144516 | W181: 69.677419354838705 | X181: 59.615384615384613 | Y181: 81.92771084337349 | Z181: 57.2289156626506 | AA181: 52.258064516129032 | AB181: 34.104046242774565 | AC181: 29.032258064516128 | AD181: 15.384615384615385 | AE181: 28.91566265060241 | AF181: 16.867469879518072 | AG181: 5.806451612903226 | AI181: Zambia | AL181: 1
A182: Uzbekistan | B182: UZB | L182: ZWE | M182: Zimbabwe | N182: 1 | O182: ZWE | P182: 29.069767441860499 | Q182: 26.6233766233766 | R182: 9.0322580645160997 | S182: 27.878787878787897 | T182: 49.090909090909101 | U182: 44.1558441558442 | V182: 44.508670520231213 | W182: 48.387096774193552 | X182: 20.512820512820511 | Y182: 45.783132530120483 | Z182: 64.457831325301214 | AA182: 63.87096774193548 | AB182: 13.294797687861271 | AC182: 12.903225806451612 | AD182: 2.5641025641025643 | AE182: 18.674698795180724 | AF182: 30.120481927710845 | AG182: 25.806451612903224 | AI182: Zimbabwe | AL182: 1
A183: Venezuela, RB | B183: VEN | L183: EE/FSU | M183: Eastern Europe and Former Soviet Union | N183: 1 | O183: EE/FSU | P183: =SUMIF(R5C36:R182C36,1,R5C:R182C)/SUMIF(R5C36:R182C36,1) -> 49.397071490094746 | Q183: =SUMIF(R5C36:R182C36,1,R5C:R182C)/SUMIF(R5C36:R182C36,1) -> 48.172198172198165 | R183: =SUMIF(R5C36:R182C36,1,R5C:R182C)/SUMIF(R5C36:R182C36,1) -> 35.436081242532865 | S183: =SUMIF(R5C36:R182C36,1,R5C:R182C)/SUMIF(R5C36:R182C36,1) -> 35.9371492704826 | T183: =SUMIF(R5C36:R182C36,1,R5C:R182C)/SUMIF(R5C36:R182C36,1) -> 42.020202020202021 | U183: =SUMIF(R5C36:R182C36,1,R5C:R182C)/SUMIF(R5C36:R182C36,1) -> 35.666185666185655 | V183: =SUMIF(R5C36:R182C36,1,R5C:R182C)/SUMIF(R5C36:R182C36,1) -> 65.746092913722975 | W183: =SUMIF(R5C36:R182C36,1,R5C:R182C)/SUMIF(R5C36:R182C36,1) -> 64.229390681003593 | X183: =SUMIF(R5C36:R182C36,1,R5C:R182C)/SUMIF(R5C36:R182C36,1) -> 55.104463437796767 | Y183: =SUMIF(R5C36:R182C36,1,R5C:R182C)/SUMIF(R5C36:R182C36,1) -> 54.64078536367694 | Z183: =SUMIF(R5C36:R182C36,1,R5C:R182C)/SUMIF(R5C36:R182C36,1) -> 54.953145917001343 | AA183: =SUMIF(R5C36:R182C36,1,R5C:R182C)/SUMIF(R5C36:R182C36,1) -> 53.285543608124243 | AB183: =SUMIF(R5C36:R182C36,1,R5C:R182C)/SUMIF(R5C36:R182C36,1) -> 34.467994005566261 | AC183: =SUMIF(R5C36:R182C36,1,R5C:R182C)/SUMIF(R5C36:R182C36,1) -> 33.309438470728793 | AD183: =SUMIF(R5C36:R182C36,1,R5C:R182C)/SUMIF(R5C36:R182C36,1) -> 21.581196581196583 | AE183: =SUMIF(R5C36:R182C36,1,R5C:R182C)/SUMIF(R5C36:R182C36,1) -> 22.244533690316825 | AF183: =SUMIF(R5C36:R182C36,1,R5C:R182C)/SUMIF(R5C36:R182C36,1) -> 29.629629629629626 | AG183: =SUMIF(R5C36:R182C36,1,R5C:R182C)/SUMIF(R5C36:R182C36,1) -> 21.624850657108716
A184: Vietnam | B184: VNM | L184: ASI | M184: Asia | N184: 1 | O184: ASI | P184: =SUMIF(R5C37:R182C37,1,R5C:R182C)/SUMIF(R5C37:R182C37,1) -> 36.587344510546238 | Q184: =SUMIF(R5C37:R182C37,1,R5C:R182C)/SUMIF(R5C37:R182C37,1) -> 43.415886439142248 | R184: =SUMIF(R5C37:R182C37,1,R5C:R182C)/SUMIF(R5C37:R182C37,1) -> 41.350337584396101 | S184: =SUMIF(R5C37:R182C37,1,R5C:R182C)/SUMIF(R5C37:R182C37,1) -> 38.999295278365054 | T184: =SUMIF(R5C37:R182C37,1,R5C:R182C)/SUMIF(R5C37:R182C37,1) -> 48.231148696264974 | U184: =SUMIF(R5C37:R182C37,1,R5C:R182C)/SUMIF(R5C37:R182C37,1) -> 40.048323769254004 | V184: =SUMIF(R5C37:R182C37,1,R5C:R182C)/SUMIF(R5C37:R182C37,1) -> 52.775910740690961 | W184: =SUMIF(R5C37:R182C37,1,R5C:R182C)/SUMIF(R5C37:R182C37,1) -> 57.584396099024765 | X184: =SUMIF(R5C37:R182C37,1,R5C:R182C)/SUMIF(R5C37:R182C37,1) -> 57.200357781753127 | Y184: =SUMIF(R5C37:R182C37,1,R5C:R182C)/SUMIF(R5C37:R182C37,1) -> 66.391145979265886 | Z184: =SUMIF(R5C37:R182C37,1,R5C:R182C)/SUMIF(R5C37:R182C37,1) -> 63.813393107312976 | AA184: =SUMIF(R5C37:R182C37,1,R5C:R182C)/SUMIF(R5C37:R182C37,1) -> 53.938484621155304 | AB184: =SUMIF(R5C37:R182C37,1,R5C:R182C)/SUMIF(R5C37:R182C37,1) -> 22.247613926603037 | AC184: =SUMIF(R5C37:R182C37,1,R5C:R182C)/SUMIF(R5C37:R182C37,1) -> 28.222055513878473 | AD184: =SUMIF(R5C37:R182C37,1,R5C:R182C)/SUMIF(R5C37:R182C37,1) -> 24.075730471079311 | AE184: =SUMIF(R5C37:R182C37,1,R5C:R182C)/SUMIF(R5C37:R182C37,1) -> 19.851499019333151 | AF184: =SUMIF(R5C37:R182C37,1,R5C:R182C)/SUMIF(R5C37:R182C37,1) -> 32.333987111235651 | AG184: =SUMIF(R5C37:R182C37,1,R5C:R182C)/SUMIF(R5C37:R182C37,1) -> 24.126031507876966
A185: West Bank and Gaza | B185: WTB | L185: AFR | M185: Africa | N185: 1 | O185: AFR | P185: =SUMIF(R5C38:R182C38,1,R5C:R182C)/SUMIF(R5C38:R182C38,1) -> 30.965621840242669 | Q185: =SUMIF(R5C38:R182C38,1,R5C:R182C)/SUMIF(R5C38:R182C38,1) -> 23.291925465838506 | R185: =SUMIF(R5C38:R182C38,1,R5C:R182C)/SUMIF(R5C38:R182C38,1) -> 28.625525946704055 | S185: =SUMIF(R5C38:R182C38,1,R5C:R182C)/SUMIF(R5C38:R182C38,1) -> 30.184453227931488 | T185: =SUMIF(R5C38:R182C38,1,R5C:R182C)/SUMIF(R5C38:R182C38,1) -> 29.433465085638979 | U185: =SUMIF(R5C38:R182C38,1,R5C:R182C)/SUMIF(R5C38:R182C38,1) -> 28.910220214568039 | V185: =SUMIF(R5C38:R182C38,1,R5C:R182C)/SUMIF(R5C38:R182C38,1) -> 49.409399346569472 | W185: =SUMIF(R5C38:R182C38,1,R5C:R182C)/SUMIF(R5C38:R182C38,1) -> 39.733520336605899 | X185: =SUMIF(R5C38:R182C38,1,R5C:R182C)/SUMIF(R5C38:R182C38,1) -> 51.031215161649946 | Y185: =SUMIF(R5C38:R182C38,1,R5C:R182C)/SUMIF(R5C38:R182C38,1) -> 59.101623886851755 | Z185: =SUMIF(R5C38:R182C38,1,R5C:R182C)/SUMIF(R5C38:R182C38,1) -> 52.187008905185969 | AA185: =SUMIF(R5C38:R182C38,1,R5C:R182C)/SUMIF(R5C38:R182C38,1) -> 51.809256661991583 | AB185: =SUMIF(R5C38:R182C38,1,R5C:R182C)/SUMIF(R5C38:R182C38,1) -> 16.235234983664238 | AC185: =SUMIF(R5C38:R182C38,1,R5C:R182C)/SUMIF(R5C38:R182C38,1) -> 12.300140252454417 | AD185: =SUMIF(R5C38:R182C38,1,R5C:R182C)/SUMIF(R5C38:R182C38,1) -> 11.13433667781494 | AE185: =SUMIF(R5C38:R182C38,1,R5C:R182C)/SUMIF(R5C38:R182C38,1) -> 13.20062860136197 | AF185: =SUMIF(R5C38:R182C38,1,R5C:R182C)/SUMIF(R5C38:R182C38,1) -> 13.82922996333159 | AG185: =SUMIF(R5C38:R182C38,1,R5C:R182C)/SUMIF(R5C38:R182C38,1) -> 11.051893408134644
A186: Yemen, Rep. | B186: YEM | L186: LAC | M186: Latin America | N186: 1 | O186: LAC | P186: =SUMIF(R5C39:R182C39,1,R5C:R182C)/SUMIF(R5C39:R182C39,1) -> 56.159156976744185 | Q186: =SUMIF(R5C39:R182C39,1,R5C:R182C)/SUMIF(R5C39:R182C39,1) -> 36.404220779220772 | R186: =SUMIF(R5C39:R182C39,1,R5C:R182C)/SUMIF(R5C39:R182C39,1) -> 37.318548387096776 | S186: =SUMIF(R5C39:R182C39,1,R5C:R182C)/SUMIF(R5C39:R182C39,1) -> 55.435606060606077 | T186: =SUMIF(R5C39:R182C39,1,R5C:R182C)/SUMIF(R5C39:R182C39,1) -> 37.935606060606062 | U186: =SUMIF(R5C39:R182C39,1,R5C:R182C)/SUMIF(R5C39:R182C39,1) -> 37.195616883116877 | V186: =SUMIF(R5C39:R182C39,1,R5C:R182C)/SUMIF(R5C39:R182C39,1) -> 69.364161849710982 | W186: =SUMIF(R5C39:R182C39,1,R5C:R182C)/SUMIF(R5C39:R182C39,1) -> 53.366935483870961 | X186: =SUMIF(R5C39:R182C39,1,R5C:R182C)/SUMIF(R5C39:R182C39,1) -> 57.471955128205124 | Y186: =SUMIF(R5C39:R182C39,1,R5C:R182C)/SUMIF(R5C39:R182C39,1) -> 78.162650602409627 | Z186: =SUMIF(R5C39:R182C39,1,R5C:R182C)/SUMIF(R5C39:R182C39,1) -> 54.894578313253028 | AA186: =SUMIF(R5C39:R182C39,1,R5C:R182C)/SUMIF(R5C39:R182C39,1) -> 53.729838709677409 | AB186: =SUMIF(R5C39:R182C39,1,R5C:R182C)/SUMIF(R5C39:R182C39,1) -> 41.130780346820814 | AC186: =SUMIF(R5C39:R182C39,1,R5C:R182C)/SUMIF(R5C39:R182C39,1) -> 20.685483870967747 | AD186: =SUMIF(R5C39:R182C39,1,R5C:R182C)/SUMIF(R5C39:R182C39,1) -> 18.389423076923077 | AE186: =SUMIF(R5C39:R182C39,1,R5C:R182C)/SUMIF(R5C39:R182C39,1) -> 26.600150602409638 | AF186: =SUMIF(R5C39:R182C39,1,R5C:R182C)/SUMIF(R5C39:R182C39,1) -> 20.293674698795183 | AG186: =SUMIF(R5C39:R182C39,1,R5C:R182C)/SUMIF(R5C39:R182C39,1) -> 19.314516129032263
A187: Yugoslavia, FR (Serbia/Montenegro) | B187: YUG | L187: OECD | M187: OECD | N187: 1 | O187: OECD | P187: =SUMIF(R5C40:R182C40,1,R5C:R182C)/SUMIF(R5C40:R182C40,1) -> 83.992248062015506 | Q187: =SUMIF(R5C40:R182C40,1,R5C:R182C)/SUMIF(R5C40:R182C40,1) -> 78.073593073593102 | R187: =SUMIF(R5C40:R182C40,1,R5C:R182C)/SUMIF(R5C40:R182C40,1) -> 85.075268817204318 | S187: =SUMIF(R5C40:R182C40,1,R5C:R182C)/SUMIF(R5C40:R182C40,1) -> 82.969696969696969 | T187: =SUMIF(R5C40:R182C40,1,R5C:R182C)/SUMIF(R5C40:R182C40,1) -> 83.979797979797979 | U187: =SUMIF(R5C40:R182C40,1,R5C:R182C)/SUMIF(R5C40:R182C40,1) -> 84.502164502164518 | V187: =SUMIF(R5C40:R182C40,1,R5C:R182C)/SUMIF(R5C40:R182C40,1) -> 92.658959537572244 | W187: =SUMIF(R5C40:R182C40,1,R5C:R182C)/SUMIF(R5C40:R182C40,1) -> 90.322580645161295 | X187: =SUMIF(R5C40:R182C40,1,R5C:R182C)/SUMIF(R5C40:R182C40,1) -> 94.508547008547012 | Y187: =SUMIF(R5C40:R182C40,1,R5C:R182C)/SUMIF(R5C40:R182C40,1) -> 97.91164658634537 | Z187: =SUMIF(R5C40:R182C40,1,R5C:R182C)/SUMIF(R5C40:R182C40,1) -> 92.871485943775099 | AA187: =SUMIF(R5C40:R182C40,1,R5C:R182C)/SUMIF(R5C40:R182C40,1) -> 92.55913978494624 | AB187: =SUMIF(R5C40:R182C40,1,R5C:R182C)/SUMIF(R5C40:R182C40,1) -> 69.595375722543352 | AC187: =SUMIF(R5C40:R182C40,1,R5C:R182C)/SUMIF(R5C40:R182C40,1) -> 60.881720430107542 | AD187: =SUMIF(R5C40:R182C40,1,R5C:R182C)/SUMIF(R5C40:R182C40,1) -> 69.871794871794876 | AE187: =SUMIF(R5C40:R182C40,1,R5C:R182C)/SUMIF(R5C40:R182C40,1) -> 57.63052208835343 | AF187: =SUMIF(R5C40:R182C40,1,R5C:R182C)/SUMIF(R5C40:R182C40,1) -> 70.783132530120483 | AG187: =SUMIF(R5C40:R182C40,1,R5C:R182C)/SUMIF(R5C40:R182C40,1) -> 72.150537634408607
A188: South Africa | B188: ZAF
A189: Congo, Dem. Rep. | B189: ZAR
A190: Zambia | B190: ZMB
A191: Zimbabwe | B191: ZWE
A192: Eastern Europe and Former Soviet Union | B192: EE/FSU
A193: Asia | B193: ASI
A194: Africa | B194: AFR
A195: Latin America | B195: LAC
A196: OECD | B196: OECD

Sheet: ComparativeChartsData
O4: 1 | P4: 2 | Q4: 3 | R4: 4 | S4: 5 | T4: 6 | U4: 7 | V4: 8 | W4: 9 | X4: 10 | Y4: 11 | Z4: 12 | AA4: 13 | AB4: 14 | AC4: 15 | AD4: 16 | AE4: 17 | AF4: 18 | AG4: 19 | AH4: 20 | AI4: 21 | AJ4: 22 | AK4: 23 | AL4: 24 | AM4: 25 | AN4: 26 | AO4: 27 | AP4: 28 | AQ4: 29 | AR4: 30 | AS4: 31 | AT4: 32 | AU4: 33 | AV4: 34 | AW4: 35 | AX4: 36 | AY4: 37 | AZ4: 38 | BA4: 39 | BB4: 40 | BC4: 41 | BD4: 42
R5: Voice and Accountability | Y5: Political Instability and Violence | AF5: Government Effectiveness | AM5: Regulatory Burden | AT5: Rule of Law | BA5: Graft
D6: DO NOT EDIT/CHANGE THIS CELLS!!! | R6: Estimate | S6: Standard Error | T6: # Indicators | Y6: Estimate | Z6: Standard Error | AA6: # Indicators | AF6: Estimate | AG6: Standard Error | AH6: # Indicators | AM6: Estimate | AN6: Standard Error | AO6: # Indicators | AT6: Estimate | AU6: Standard Error | AV6: # Indicators | BA6: Estimate | BB6: Standard Error | BC6: # Indicators
Q7: 1 | R7: =R[-2]C -> Voice and Accountability | S7: SE | T7: Band1 | U7: Band2 | V7: Labels | X7: 1 | Y7: =R[-2]C -> Political Instability and Violence | Z7: SE | AA7: Band1 | AB7: Band2 | AC7: Labels | AE7: 1 | AF7: =R[-2]C -> Government Effectiveness | AG7: SE | AH7: Band1 | AI7: Band2 | AJ7: Labels | AL7: 1 | AM7: =R[-2]C -> Regulatory Burden | AN7: SE | AO7: Band1 | AP7: Band2 | AQ7: Labels | AS7: 1 | AT7: =R[-2]C -> Rule of Law | AU7: SE | AV7: Band1 | AW7: Band2 | AX7: Labels | AZ7: 1 | BA7: =R[-2]C -> Graft | BB7: SE | BC7: Band1 | BD7: Band2 | BE7: Labels
B8: Country Name | C8: Country Code | D8: Choose Country Here | O8: 1 | P8: Korea, Dem. Rep. | Q8: PRK | R8: -1.7886783105733486 | S8: 0.29137760175532934 | T8: =1.64*RC[-1] -> 0.47785926687874009 | U8: =IF(EQUAL(VLOOKUP(RC[-4],R9C3:R186C4,2,0),1),RC[-1],NA()) -> NA() | V8: =IF(ISNA(RC[-1])=1,"",RC[-5]) ->  | W8: Congo, Dem. Rep. | X8: ZAR | Y8: -2.5863972540508726 | Z8: 0.3435921145060854 | AA8: =1.64*RC[-1] -> 0.56349106778998004 | AB8: =IF(EQUAL(VLOOKUP(RC[-4],R9C3:R186C4,2,0),1),RC[-1],NA()) -> NA() | AC8: =IF(ISNA(RC[-1])=1,"",RC[-5]) ->  | AD8: Iraq | AE8: IRQ | AF8: -1.8831008918400516 | AG8: 0.31908959204123422 | AH8: =1.64*RC[-1] -> 0.52330693094762404 | AI8: =IF(EQUAL(VLOOKUP(RC[-4],R9C3:R186C4,2,0),1),RC[-1],NA()) -> 0.52330693094762404 | AJ8: =IF(ISNA(RC[-1])=1,"",RC[-5]) -> IRQ | AK8: Iraq | AL8: IRQ | AM8: -3.1421853569799123 | AN8: 0.39525422199815724 | AO8: =1.64*RC[-1] -> 0.64821692407697784 | AP8: =IF(EQUAL(VLOOKUP(RC[-4],R9C3:R186C4,2,0),1),RC[-1],NA()) -> 0.64821692407697784 | AQ8: =IF(ISNA(RC[-1])=1,"",RC[-5]) -> IRQ | AR8: Congo, Dem. Rep. | AS8: ZAR | AT8: -2.1525234805433873 | AU8: 0.35269555758631449 | AV8: =1.64*RC[-1] -> 0.57842071444155574 | AW8: =IF(EQUAL(VLOOKUP(RC[-4],R9C3:R186C4,2,0),1),RC[-1],NA()) -> NA() | AX8: =IF(ISNA(RC[-1])=1,"",RC[-5]) ->  | AY8: Niger | AZ8: NER | BA8: -1.5668121658543279 | BB8: 0.74867439619943676 | BC8: =1.64*RC[-1] -> 1.2278260097670761 | BD8: =IF(EQUAL(VLOOKUP(RC[-4],R9C3:R186C4,2,0),1),RC[-1],NA()) -> NA() | BE8: =IF(ISNA(RC[-1])=1,"",RC[-5]) -> 
B9: Afghanistan | C9: AFG | D9: =IF(EQUAL(ComparativeCharts!R[11]C,""),"",1) -> 1 | O9: 2 | P9: Iraq | Q9: IRQ | R9: -1.7528897511521069 | S9: 0.25402694431067208 | T9: =1.64*RC[-1] -> 0.41660418866950216 | U9: =IF(EQUAL(VLOOKUP(RC[-4],R9C3:R186C4,2,0),1),RC[-1],NA()) -> 0.41660418866950216 | V9: =IF(ISNA(RC[-1])=1,"",RC[-5]) -> IRQ | W9: Algeria | X9: DZA | Y9: -2.4205173449643516 | Z9: 0.29988188904282925 | AA9: =1.64*RC[-1] -> 0.49180629803023995 | AB9: =IF(EQUAL(VLOOKUP(RC[-4],R9C3:R186C4,2,0),1),RC[-1],NA()) -> NA() | AC9: =IF(ISNA(RC[-1])=1,"",RC[-5]) ->  | AD9: Congo, Dem. Rep. | AE9: ZAR | AF9: -1.7690530057507605 | AG9: 0.4782359576251452 | AH9: =1.64*RC[-1] -> 0.78430697050523812 | AI9: =IF(EQUAL(VLOOKUP(RC[-4],R9C3:R186C4,2,0),1),RC[-1],NA()) -> NA() | AJ9: =IF(ISNA(RC[-1])=1,"",RC[-5]) ->  | AK9: Libya | AL9: LBY | AM9: -2.3762653673640157 | AN9: 0.39525422199815724 | AO9: =1.64*RC[-1] -> 0.64821692407697784 | AP9: =IF(EQUAL(VLOOKUP(RC[-4],R9C3:R186C4,2,0),1),RC[-1],NA()) -> 0.64821692407697784 | AQ9: =IF(ISNA(RC[-1])=1,"",RC[-5]) -> LBY | AR9: Iraq | AS9: IRQ | AT9: -1.8436719236240982 | AU9: 0.27634968636657775 | AV9: =1.64*RC[-1] -> 0.45321348564118746 | AW9: =IF(EQUAL(VLOOKUP(RC[-4],R9C3:R186C4,2,0),1),RC[-1],NA()) -> 0.45321348564118746 | AX9: =IF(ISNA(RC[-1])=1,"",RC[-5]) -> IRQ | AY9: Congo, Dem. Rep. | AZ9: ZAR | BA9: -1.5559835131437054 | BB9: 0.47674996724200341 | BC9: =1.64*RC[-1] -> 0.78186994627688555 | BD9: =IF(EQUAL(VLOOKUP(RC[-4],R9C3:R186C4,2,0),1),RC[-1],NA()) -> NA() | BE9: =IF(ISNA(RC[-1])=1,"",RC[-5]) -> 
B10: Angola | C10: AGO | D10: =IF(EQUAL(ComparativeCharts!R[11]C,""),"",1) ->  | O10: 3 | P10: Myanmar | Q10: MMR | R10: -1.7477426969884162 | S10: 0.25402694431067208 | T10: =1.64*RC[-1] -> 0.41660418866950216 | U10: =IF(EQUAL(VLOOKUP(RC[-4],R9C3:R186C4,2,0),1),RC[-1],NA()) -> NA() | V10: =IF(ISNA(RC[-1])=1,"",RC[-5]) ->  | W10: Iraq | X10: IRQ | Y10: -2.2445203284923299 | Z10: 0.29988188904282925 | AA10: =1.64*RC[-1] -> 0.49180629803023995 | AB10: =IF(EQUAL(VLOOKUP(RC[-4],R9C3:R186C4,2,0),1),RC[-1],NA()) -> 0.49180629803023995 | AC10: =IF(ISNA(RC[-1])=1,"",RC[-5]) -> IRQ | AD10: Sudan | AE10: SDN | AF10: -1.6974981983169284 | AG10: 0.37414236442207388 | AH10: =1.64*RC[-1] -> 0.61359347765220118 | AI10: =IF(EQUAL(VLOOKUP(RC[-4],R9C3:R186C4,2,0),1),RC[-1],NA()) -> NA() | AJ10: =IF(ISNA(RC[-1])=1,"",RC[-5]) ->  | AK10: Congo, Dem. Rep. | AL10: ZAR | AM10: -2.3404178684846326 | AN10: 0.39525422199815724 | AO10: =1.64*RC[-1] -> 0.64821692407697784 | AP10: =IF(EQUAL(VLOOKUP(RC[-4],R9C3:R186C4,2,0),1),RC[-1],NA()) -> NA() | AQ10: =IF(ISNA(RC[-1])=1,"",RC[-5]) ->  | AR10: Guinea-Bissau | AS10: GNB | AT10: -1.614713455465183 | AU10: 0.37135850669511394 | AV10: =1.64*RC[-1] -> 0.60902795097998685 | AW10: =IF(EQUAL(VLOOKUP(RC[-4],R9C3:R186C4,2,0),1),RC[-1],NA()) -> NA() | AX10: =IF(ISNA(RC[-1])=1,"",RC[-5]) ->  | AY10: Tajikistan | AZ10: TJK | BA10: -1.3157759412363537 | BB10: 0.25531057815316954 | BC10: =1.64*RC[-1] -> 0.41870934817119804 | BD10: =IF(EQUAL(VLOOKUP(RC[-4],R9C3:R186C4,2,0),1),RC[-1],NA()) -> NA() | BE10: =IF(ISNA(RC[-1])=1,"",RC[-5]) -> 
B11: Albania | C11: ALB | D11: =IF(EQUAL(ComparativeCharts!R[11]C,""),"",1) ->  | O11: 4 | P11: Somalia | Q11: SOM | R11: -1.6938714902405378 | S11: 0.29137760175532934 | T11: =1.64*RC[-1] -> 0.47785926687874009 | U11: =IF(EQUAL(VLOOKUP(RC[-4],R9C3:R186C4,2,0),1),RC[-1],NA()) -> NA() | V11: =IF(ISNA(RC[-1])=1,"",RC[-5]) ->  | W11: Tajikistan | X11: TJK | Y11: -1.8622715048456606 | Z11: 0.32733070851464285 | AA11: =1.64*RC[-1] -> 0.53682236196401423 | AB11: =IF(EQUAL(VLOOKUP(RC[-4],R9C3:R186C4,2,0),1),RC[-1],NA()) -> NA() | AC11: =IF(ISNA(RC[-1])=1,"",RC[-5]) ->  | AD11: Somalia | AE11: SOM | AF11: -1.6966705929038615 | AG11: 0.76816878371913544 | AH11: =1.64*RC[-1] -> 1.259796805299382 | AI11: =IF(EQUAL(VLOOKUP(RC[-4],R9C3:R186C4,2,0),1),RC[-1],NA()) -> NA() | AJ11: =IF(ISNA(RC[-1])=1,"",RC[-5]) ->  | AK11: Turkmenistan | AL11: TKM | AM11: -1.9311902790637929 | AN11: 0.27226595507395668 | AO11: =1.64*RC[-1] -> 0.44651616632128893 | AP11: =IF(EQUAL(VLOOKUP(RC[-4],R9C3:R186C4,2,0),1),RC[-1],NA()) -> NA() | AQ11: =IF(ISNA(RC[-1])=1,"",RC[-5]) ->  | AR11: Haiti | AS11: HTI | AT11: -1.495346237708413 | AU11: 0.44307336250641616 | AV11: =1.64*RC[-1] -> 0.72664031451052247 | AW11: =IF(EQUAL(VLOOKUP(RC[-4],R9C3:R186C4,2,0),1),RC[-1],NA()) -> NA() | AX11: =IF(ISNA(RC[-1])=1,"",RC[-5]) ->  | AY11: Turkmenistan | AZ11: TKM | BA11: -1.2893334952185298 | BB11: 0.25531057815316954 | BC11: =1.64*RC[-1] -> 0.41870934817119804 | BD11: =IF(EQUAL(VLOOKUP(RC[-4],R9C3:R186C4,2,0),1),RC[-1],NA()) -> NA() | BE11: =IF(ISNA(RC[-1])=1,"",RC[-5]) -> 
B12: United Arab Emirates | C12: ARE | D12: =IF(EQUAL(ComparativeCharts!R[11]C,""),"",1) ->  | O12: 5 | P12: Sierra Leone | Q12: SLE | R12: -1.6233668341742804 | S12: 0.29137760175532934 | T12: =1.64*RC[-1] -> 0.47785926687874009 | U12: =IF(EQUAL(VLOOKUP(RC[-4],R9C3:R186C4,2,0),1),RC[-1],NA()) -> NA() | V12: =IF(ISNA(RC[-1])=1,"",RC[-5]) ->  | W12: Congo, Rep. | X12: COG | Y12: -1.8257714772347606 | Z12: 0.37350218211437147 | AA12: =1.64*RC[-1] -> 0.61254357866756914 | AB12: =IF(EQUAL(VLOOKUP(RC[-4],R9C3:R186C4,2,0),1),RC[-1],NA()) -> NA() | AC12: =IF(ISNA(RC[-1])=1,"",RC[-5]) ->  | AD12: Myanmar | AE12: MMR | AF12: -1.461346497716959 | AG12: 0.31908959204123422 | AH12: =1.64*RC[-1] -> 0.52330693094762404 | AI12: =IF(EQUAL(VLOOKUP(RC[-4],R9C3:R186C4,2,0),1),RC[-1],NA()) -> NA() | AJ12: =IF(ISNA(RC[-1])=1,"",RC[-5]) ->  | AK12: Lao, PDR | AL12: LAO | AM12: -1.8178793119111063 | AN12: 0.60188084442426626 | AO12: =1.64*RC[-1] -> 0.98708458485579664 | AP12: =IF(EQUAL(VLOOKUP(RC[-4],R9C3:R186C4,2,0),1),RC[-1],NA()) -> NA() | AQ12: =IF(ISNA(RC[-1])=1,"",RC[-5]) ->  | AR12: Somalia | AS12: SOM | AT12: -1.495346237708413 | AU12: 0.44307336250641616 | AV12: =1.64*RC[-1] -> 0.72664031451052247 | AW12: =IF(EQUAL(VLOOKUP(RC[-4],R9C3:R186C4,2,0),1),RC[-1],NA()) -> NA() | AX12: =IF(ISNA(RC[-1])=1,"",RC[-5]) ->  | AY12: Iraq | AZ12: IRQ | BA12: -1.2648927632629274 | BB12: 0.26706317040829514 | BC12: =1.64*RC[-1] -> 0.43798359946960402 | BD12: =IF(EQUAL(VLOOKUP(RC[-4],R9C3:R186C4,2,0),1),RC[-1],NA()) -> 0.43798359946960402 | BE12: =IF(ISNA(RC[-1])=1,"",RC[-5]) -> IRQ
B13: Argentina | C13: ARG | D13: =IF(EQUAL(ComparativeCharts!R[11]C,""),"",1) ->  | O13: 6 | P13: Afghanistan | Q13: AFG | R13: -1.6163871673910992 | S13: 0.36031461549530619 | T13: =1.64*RC[-1] -> 0.59091596941230207 | U13: =IF(EQUAL(VLOOKUP(RC[-4],R9C3:R186C4,2,0),1),RC[-1],NA()) -> 0.59091596941230207 | V13: =IF(ISNA(RC[-1])=1,"",RC[-5]) -> AFG | W13: Angola | X13: AGO | Y13: -1.7846035962181079 | Z13: 0.27905845743699148 | AA13: =1.64*RC[-1] -> 0.45765587019666598 | AB13: =IF(EQUAL(VLOOKUP(RC[-4],R9C3:R186C4,2,0),1),RC[-1],NA()) -> NA() | AC13: =IF(ISNA(RC[-1])=1,"",RC[-5]) ->  | AD13: Tajikistan | AE13: TJK | AF13: -1.4225978773593777 | AG13: 0.33902373717435624 | AH13: =1.64*RC[-1] -> 0.55599892896594416 | AI13: =IF(EQUAL(VLOOKUP(RC[-4],R9C3:R186C4,2,0),1),RC[-1],NA()) -> NA() | AJ13: =IF(ISNA(RC[-1])=1,"",RC[-5]) ->  | AK13: Somalia | AL13: SOM | AM13: -1.7688768021246193 | AN13: 0.51994095831945863 | AO13: =1.64*RC[-1] -> 0.85270317164391207 | AP13: =IF(EQUAL(VLOOKUP(RC[-4],R9C3:R186C4,2,0),1),RC[-1],NA()) -> NA() | AQ13: =IF(ISNA(RC[-1])=1,"",RC[-5]) ->  | AR13: Congo, Rep. | AS13: COG | AT13: -1.4353881968242335 | AU13: 0.37135850669511394 | AV13: =1.64*RC[-1] -> 0.60902795097998685 | AW13: =IF(EQUAL(VLOOKUP(RC[-4],R9C3:R186C4,2,0),1),RC[-1],NA()) -> NA() | AX13: =IF(ISNA(RC[-1])=1,"",RC[-5]) ->  | AY13: Cameroon | AZ13: CMR | BA13: -1.1046055305331168 | BB13: 0.21052052859001816 | BC13: =1.64*RC[-1] -> 0.34525366688762976 | BD13: =IF(EQUAL(VLOOKUP(RC[-4],R9C3:R186C4,2,0),1),RC[-1],NA()) -> NA() | BE13: =IF(ISNA(RC[-1])=1,"",RC[-5]) -> 
B14: Armenia | C14: ARM | D14: =IF(EQUAL(ComparativeCharts!R[11]C,""),"",1) ->  | O14: 7 | P14: Congo, Dem. Rep. | Q14: ZAR | R14: -1.5674623978178401 | S14: 0.29137760175532934 | T14: =1.64*RC[-1] -> 0.47785926687874009 | U14: =IF(EQUAL(VLOOKUP(RC[-4],R9C3:R186C4,2,0),1),RC[-1],NA()) -> NA() | V14: =IF(ISNA(RC[-1])=1,"",RC[-5]) ->  | W14: Sudan | X14: SDN | Y14: -1.7319929306411948 | Z14: 0.34248229323012747 | AA14: =1.64*RC[-1] -> 0.56167096089740898 | AB14: =IF(EQUAL(VLOOKUP(RC[-4],R9C3:R186C4,2,0),1),RC[-1],NA()) -> NA() | AC14: =IF(ISNA(RC[-1])=1,"",RC[-5]) ->  | AD14: Angola | AE14: AGO | AF14: -1.390338884292103 | AG14: 0.23533770853731531 | AH14: =1.64*RC[-1] -> 0.38595384200119709 | AI14: =IF(EQUAL(VLOOKUP(RC[-4],R9C3:R186C4,2,0),1),RC[-1],NA()) -> NA() | AJ14: =IF(ISNA(RC[-1])=1,"",RC[-5]) ->  | AK14: Yugoslavia, FR (Serbia/Montenegro) | AL14: YUG | AM14: -1.5389354421568193 | AN14: 0.71821352123625759 | AO14: =1.64*RC[-1] -> 1.1778701748274625 | AP14: =IF(EQUAL(VLOOKUP(RC[-4],R9C3:R186C4,2,0),1),RC[-1],NA()) -> NA() | AQ14: =IF(ISNA(RC[-1])=1,"",RC[-5]) ->  | AR14: Sudan | AS14: SDN | AT14: -1.3461298316598331 | AU14: 0.3138946252365733 | AV14: =1.64*RC[-1] -> 0.51478718538798018 | AW14: =IF(EQUAL(VLOOKUP(RC[-4],R9C3:R186C4,2,0),1),RC[-1],NA()) -> NA() | AX14: =IF(ISNA(RC[-1])=1,"",RC[-5]) ->  | AY14: Myanmar | AZ14: MMR | BA14: -1.0957168092296039 | BB14: 0.26706317040829514 | BC14: =1.64*RC[-1] -> 0.43798359946960402 | BD14: =IF(EQUAL(VLOOKUP(RC[-4],R9C3:R186C4,2,0),1),RC[-1],NA()) -> NA() | BE14: =IF(ISNA(RC[-1])=1,"",RC[-5]) -> 
B15: Australia | C15: AUS | D15: =IF(EQUAL(ComparativeCharts!R[11]C,""),"",1) ->  | O15: 8 | P15: Tajikistan | Q15: TJK | R15: -1.5646106322469115 | S15: 0.36031461549530619 | T15: =1.64*RC[-1] -> 0.59091596941230207 | U15: =IF(EQUAL(VLOOKUP(RC[-4],R9C3:R186C4,2,0),1),RC[-1],NA()) -> NA() | V15: =IF(ISNA(RC[-1])=1,"",RC[-5]) ->  | W15: Haiti | X15: HTI | Y15: -1.7086514230353467 | Z15: 0.41252284257447502 | AA15: =1.64*RC[-1] -> 0.67653746182213903 | AB15: =IF(EQUAL(VLOOKUP(RC[-4],R9C3:R186C4,2,0),1),RC[-1],NA()) -> NA() | AC15: =IF(ISNA(RC[-1])=1,"",RC[-5]) ->  | AD15: Niger | AE15: NER | AF15: -1.3866137923907753 | AG15: 0.76816878371913544 | AH15: =1.64*RC[-1] -> 1.259796805299382 | AI15: =IF(EQUAL(VLOOKUP(RC[-4],R9C3:R186C4,2,0),1),RC[-1],NA()) -> NA() | AJ15: =IF(ISNA(RC[-1])=1,"",RC[-5]) ->  | AK15: Tajikistan | AL15: TJK | AM15: -1.5195519429523292 | AN15: 0.27226595507395668 | AO15: =1.64*RC[-1] -> 0.44651616632128893 | AP15: =IF(EQUAL(VLOOKUP(RC[-4],R9C3:R186C4,2,0),1),RC[-1],NA()) -> NA() | AQ15: =IF(ISNA(RC[-1])=1,"",RC[-5]) ->  | AR15: Tajikistan | AS15: TJK | AT15: -1.3348928309839214 | AU15: 0.21573830615955589 | AV15: =1.64*RC[-1] -> 0.35381082210167164 | AW15: =IF(EQUAL(VLOOKUP(RC[-4],R9C3:R186C4,2,0),1),RC[-1],NA()) -> NA() | AX15: =IF(ISNA(RC[-1])=1,"",RC[-5]) ->  | AY15: Liberia | AZ15: LBR | BA15: -1.0507633438996888 | BB15: 0.74867439619943676 | BC15: =1.64*RC[-1] -> 1.2278260097670761 | BD15: =IF(EQUAL(VLOOKUP(RC[-4],R9C3:R186C4,2,0),1),RC[-1],NA()) -> NA() | BE15: =IF(ISNA(RC[-1])=1,"",RC[-5]) -> 
B16: Austria | C16: AUT | D16: =IF(EQUAL(ComparativeCharts!R[11]C,""),"",1) ->  | O16: 9 | P16: Sudan | Q16: SDN | R16: -1.4980556187374707 | S16: 0.25402694431067208 | T16: =1.64*RC[-1] -> 0.41660418866950216 | U16: =IF(EQUAL(VLOOKUP(RC[-4],R9C3:R186C4,2,0),1),RC[-1],NA()) -> NA() | V16: =IF(ISNA(RC[-1])=1,"",RC[-5]) ->  | W16: Somalia | X16: SOM | Y16: -1.7086514230353467 | Z16: 0.41252284257447502 | AA16: =1.64*RC[-1] -> 0.67653746182213903 | AB16: =IF(EQUAL(VLOOKUP(RC[-4],R9C3:R186C4,2,0),1),RC[-1],NA()) -> NA() | AC16: =IF(ISNA(RC[-1])=1,"",RC[-5]) ->  | AD16: Libya | AE16: LBY | AF16: -1.3217169105355902 | AG16: 0.31908959204123422 | AH16: =1.64*RC[-1] -> 0.52330693094762404 | AI16: =IF(EQUAL(VLOOKUP(RC[-4],R9C3:R186C4,2,0),1),RC[-1],NA()) -> 0.52330693094762404 | AJ16: =IF(ISNA(RC[-1])=1,"",RC[-5]) -> LBY | AK16: Sierra Leone | AL16: SLE | AM16: -1.5008318425718046 | AN16: 0.51994095831945863 | AO16: =1.64*RC[-1] -> 0.85270317164391207 | AP16: =IF(EQUAL(VLOOKUP(RC[-4],R9C3:R186C4,2,0),1),RC[-1],NA()) -> NA() | AQ16: =IF(ISNA(RC[-1])=1,"",RC[-5]) ->  | AR16: Liberia | AS16: LBR | AT16: -1.2886266995915658 | AU16: 0.54869731211835882 | AV16: =1.64*RC[-1] -> 0.89986359187410836 | AW16: =IF(EQUAL(VLOOKUP(RC[-4],R9C3:R186C4,2,0),1),RC[-1],NA()) -> NA() | AX16: =IF(ISNA(RC[-1])=1,"",RC[-5]) ->  | AY16: Somalia | AZ16: SOM | BA16: -1.0507633438996888 | BB16: 0.74867439619943676 | BC16: =1.64*RC[-1] -> 1.2278260097670761 | BD16: =IF(EQUAL(VLOOKUP(RC[-4],R9C3:R186C4,2,0),1),RC[-1],NA()) -> NA() | BE16: =IF(ISNA(RC[-1])=1,"",RC[-5]) -> 
B17: Azerbaijan | C17: AZE | D17: =IF(EQUAL(ComparativeCharts!R[11]C,""),"",1) ->  | O17: 10 | P17: Cuba | Q17: CUB | R17: -1.460712009420263 | S17: 0.25402694431067208 | T17: =1.64*RC[-1] -> 0.41660418866950216 | U17: =IF(EQUAL(VLOOKUP(RC[-4],R9C3:R186C4,2,0),1),RC[-1],NA()) -> NA() | V17: =IF(ISNA(RC[-1])=1,"",RC[-5]) ->  | W17: Swaziland | X17: SWZ | Y17: -1.6942245500284423 | Z17: 0.6061771357665019 | AA17: =1.64*RC[-1] -> 0.99413050265706304 | AB17: =IF(EQUAL(VLOOKUP(RC[-4],R9C3:R186C4,2,0),1),RC[-1],NA()) -> NA() | AC17: =IF(ISNA(RC[-1])=1,"",RC[-5]) ->  | AD17: Nigeria | AE17: NGA | AF17: -1.3207674411490427 | AG17: 0.22248178800615603 | AH17: =1.64*RC[-1] -> 0.36487013233009585 | AI17: =IF(EQUAL(VLOOKUP(RC[-4],R9C3:R186C4,2,0),1),RC[-1],NA()) -> NA() | AJ17: =IF(ISNA(RC[-1])=1,"",RC[-5]) ->  | AK17: Belarus | AL17: BLR | AM17: -1.4655770170580293 | AN17: 0.2628266479146692 | AO17: =1.64*RC[-1] -> 0.43103570258005747 | AP17: =IF(EQUAL(VLOOKUP(RC[-4],R9C3:R186C4,2,0),1),RC[-1],NA()) -> NA() | AQ17: =IF(ISNA(RC[-1])=1,"",RC[-5]) ->  | AR17: Angola | AS17: AGO | AT17: -1.2250664457942559 | AU17: 0.27274644247184715 | AV17: =1.64*RC[-1] -> 0.4473041656538293 | AW17: =IF(EQUAL(VLOOKUP(RC[-4],R9C3:R186C4,2,0),1),RC[-1],NA()) -> NA() | AX17: =IF(ISNA(RC[-1])=1,"",RC[-5]) ->  | AY17: Gabon | AZ17: GAB | BA17: -1.0151196581536006 | BB17: 0.2961069418304243 | BC17: =1.64*RC[-1] -> 0.48561538460189579 | BD17: =IF(EQUAL(VLOOKUP(RC[-4],R9C3:R186C4,2,0),1),RC[-1],NA()) -> NA() | BE17: =IF(ISNA(RC[-1])=1,"",RC[-5]) -> 
B18: Burundi | C18: BDI | D18: =IF(EQUAL(ComparativeCharts!R[11]C,""),"",1) ->  | O18: 11 | P18: Turkmenistan | Q18: TKM | R18: -1.4507022592789269 | S18: 0.36031461549530619 | T18: =1.64*RC[-1] -> 0.59091596941230207 | U18: =IF(EQUAL(VLOOKUP(RC[-4],R9C3:R186C4,2,0),1),RC[-1],NA()) -> NA() | V18: =IF(ISNA(RC[-1])=1,"",RC[-5]) ->  | W18: Sri Lanka | X18: LKA | Y18: -1.6275596964998276 | Z18: 0.29988188904282925 | AA18: =1.64*RC[-1] -> 0.49180629803023995 | AB18: =IF(EQUAL(VLOOKUP(RC[-4],R9C3:R186C4,2,0),1),RC[-1],NA()) -> NA() | AC18: =IF(ISNA(RC[-1])=1,"",RC[-5]) ->  | AD18: Uzbekistan | AE18: UZB | AF18: -1.3048257367980496 | AG18: 0.24771565952893812 | AH18: =1.64*RC[-1] -> 0.40625368162745851 | AI18: =IF(EQUAL(VLOOKUP(RC[-4],R9C3:R186C4,2,0),1),RC[-1],NA()) -> NA() | AJ18: =IF(ISNA(RC[-1])=1,"",RC[-5]) ->  | AK18: Korea, Dem. Rep. | AL18: PRK | AM18: -1.4008644430820911 | AN18: 0.51994095831945863 | AO18: =1.64*RC[-1] -> 0.85270317164391207 | AP18: =IF(EQUAL(VLOOKUP(RC[-4],R9C3:R186C4,2,0),1),RC[-1],NA()) -> NA() | AQ18: =IF(ISNA(RC[-1])=1,"",RC[-5]) ->  | AR18: Kenya | AS18: KEN | AT18: -1.2200377938324558 | AU18: 0.2531854041328267 | AV18: =1.64*RC[-1] -> 0.41522406277783575 | AW18: =IF(EQUAL(VLOOKUP(RC[-4],R9C3:R186C4,2,0),1),RC[-1],NA()) -> NA() | AX18: =IF(ISNA(RC[-1])=1,"",RC[-5]) ->  | AY18: Sudan | AZ18: SDN | BA18: -1.0151196581536006 | BB18: 0.2961069418304243 | BC18: =1.64*RC[-1] -> 0.48561538460189579 | BD18: =IF(EQUAL(VLOOKUP(RC[-4],R9C3:R186C4,2,0),1),RC[-1],NA()) -> NA() | BE18: =IF(ISNA(RC[-1])=1,"",RC[-5]) -> 
B19: Belgium | C19: BEL | D19: =IF(EQUAL(ComparativeCharts!R[11]C,""),"",1) ->  | O19: 12 | P19: Vietnam | Q19: VNM | R19: -1.4157027443978394 | S19: 0.25402694431067208 | T19: =1.64*RC[-1] -> 0.41660418866950216 | U19: =IF(EQUAL(VLOOKUP(RC[-4],R9C3:R186C4,2,0),1),RC[-1],NA()) -> NA() | V19: =IF(ISNA(RC[-1])=1,"",RC[-5]) ->  | W19: Sierra Leone | X19: SLE | Y19: -1.5194887945582021 | Z19: 0.41252284257447502 | AA19: =1.64*RC[-1] -> 0.67653746182213903 | AB19: =IF(EQUAL(VLOOKUP(RC[-4],R9C3:R186C4,2,0),1),RC[-1],NA()) -> NA() | AC19: =IF(ISNA(RC[-1])=1,"",RC[-5]) ->  | AD19: Turkmenistan | AE19: TKM | AF19: -1.2522579311602571 | AG19: 0.33902373717435624 | AH19: =1.64*RC[-1] -> 0.55599892896594416 | AI19: =IF(EQUAL(VLOOKUP(RC[-4],R9C3:R186C4,2,0),1),RC[-1],NA()) -> NA() | AJ19: =IF(ISNA(RC[-1])=1,"",RC[-5]) ->  | AK19: Uzbekistan | AL19: UZB | AM19: -1.3978224420964669 | AN19: 0.27178528950467506 | AO19: =1.64*RC[-1] -> 0.44572787478766707 | AP19: =IF(EQUAL(VLOOKUP(RC[-4],R9C3:R186C4,2,0),1),RC[-1],NA()) -> NA() | AQ19: =IF(ISNA(RC[-1])=1,"",RC[-5]) ->  | AR19: Equatorial Guinea | AS19: GNQ | AT19: -1.2036375560023957 | AU19: 0.60058386521254259 | AV19: =1.64*RC[-1] -> 0.98495753894856974 | AW19: =IF(EQUAL(VLOOKUP(RC[-4],R9C3:R186C4,2,0),1),RC[-1],NA()) -> NA() | AX19: =IF(ISNA(RC[-1])=1,"",RC[-5]) ->  | AY19: Azerbaijan | AZ19: AZE | BA19: -0.99759969576951679 | BB19: 0.18824314571543588 | BC19: =1.64*RC[-1] -> 0.3087187589733148 | BD19: =IF(EQUAL(VLOOKUP(RC[-4],R9C3:R186C4,2,0),1),RC[-1],NA()) -> NA() | BE19: =IF(ISNA(RC[-1])=1,"",RC[-5]) -> 
B20: Benin | C20: BEN | D20: =IF(EQUAL(ComparativeCharts!R[11]C,""),"",1) ->  | O20: 13 | P20: Equatorial Guinea | Q20: GNQ | R20: -1.3885704183485383 | S20: 0.36031461549530619 | T20: =1.64*RC[-1] -> 0.59091596941230207 | U20: =IF(EQUAL(VLOOKUP(RC[-4],R9C3:R186C4,2,0),1),RC[-1],NA()) -> NA() | V20: =IF(ISNA(RC[-1])=1,"",RC[-5]) ->  | W20: Yemen, Rep. | X20: YEM | Y20: -1.4712301652975357 | Z20: 0.34248229323012747 | AA20: =1.64*RC[-1] -> 0.56167096089740898 | AB20: =IF(EQUAL(VLOOKUP(RC[-4],R9C3:R186C4,2,0),1),RC[-1],NA()) -> NA() | AC20: =IF(ISNA(RC[-1])=1,"",RC[-5]) ->  | AD20: Haiti | AE20: HTI | AF20: -1.2315853958549137 | AG20: 0.76816878371913544 | AH20: =1.64*RC[-1] -> 1.259796805299382 | AI20: =IF(EQUAL(VLOOKUP(RC[-4],R9C3:R186C4,2,0),1),RC[-1],NA()) -> NA() | AJ20: =IF(ISNA(RC[-1])=1,"",RC[-5]) ->  | AK20: Guinea-Bissau | AL20: GNB | AM20: -1.350234237049212 | AN20: 0.51661669269246691 | AO20: =1.64*RC[-1] -> 0.84725137601564571 | AP20: =IF(EQUAL(VLOOKUP(RC[-4],R9C3:R186C4,2,0),1),RC[-1],NA()) -> NA() | AQ20: =IF(ISNA(RC[-1])=1,"",RC[-5]) ->  | AR20: Lao, PDR | AS20: LAO | AT20: -1.2036375560023957 | AU20: 0.60058386521254259 | AV20: =1.64*RC[-1] -> 0.98495753894856974 | AW20: =IF(EQUAL(VLOOKUP(RC[-4],R9C3:R186C4,2,0),1),RC[-1],NA()) -> NA() | AX20: =IF(ISNA(RC[-1])=1,"",RC[-5]) ->  | AY20: Yugoslavia, FR (Serbia/Montenegro) | AZ20: YUG | BA20: -0.99452314445012791 | BB20: 0.19951165199543741 | BC20: =1.64*RC[-1] -> 0.32719910927251733 | BD20: =IF(EQUAL(VLOOKUP(RC[-4],R9C3:R186C4,2,0),1),RC[-1],NA()) -> NA() | BE20: =IF(ISNA(RC[-1])=1,"",RC[-5]) -> 
B21: Burkina Faso | C21: BFA | D21: =IF(EQUAL(ComparativeCharts!R[11]C,""),"",1) ->  | O21: 14 | P21: Syrian Arab Republic | Q21: SYR | R21: -1.3577709168817529 | S21: 0.25402694431067208 | T21: =1.64*RC[-1] -> 0.41660418866950216 | U21: =IF(EQUAL(VLOOKUP(RC[-4],R9C3:R186C4,2,0),1),RC[-1],NA()) -> NA() | V21: =IF(ISNA(RC[-1])=1,"",RC[-5]) ->  | W21: Yugoslavia, FR (Serbia/Montenegro) | X21: YUG | Y21: -1.4194995000846837 | Z21: 0.2647727237382736 | AA21: =1.64*RC[-1] -> 0.43422726693076868 | AB21: =IF(EQUAL(VLOOKUP(RC[-4],R9C3:R186C4,2,0),1),RC[-1],NA()) -> NA() | AC21: =IF(ISNA(RC[-1])=1,"",RC[-5]) ->  | AD21: Syrian Arab Republic | AE21: SYR | AF21: -1.1808869811959986 | AG21: 0.31908959204123422 | AH21: =1.64*RC[-1] -> 0.52330693094762404 | AI21: =IF(EQUAL(VLOOKUP(RC[-4],R9C3:R186C4,2,0),1),RC[-1],NA()) -> NA() | AJ21: =IF(ISNA(RC[-1])=1,"",RC[-5]) ->  | AK21: Equatorial Guinea | AL21: GNQ | AM21: -1.3318483752731782 | AN21: 0.60188084442426626 | AO21: =1.64*RC[-1] -> 0.98708458485579664 | AP21: =IF(EQUAL(VLOOKUP(RC[-4],R9C3:R186C4,2,0),1),RC[-1],NA()) -> NA() | AQ21: =IF(ISNA(RC[-1])=1,"",RC[-5]) ->  | AR21: Rwanda | AS21: RWA | AT21: -1.2036375560023957 | AU21: 0.60058386521254259 | AV21: =1.64*RC[-1] -> 0.98495753894856974 | AW21: =IF(EQUAL(VLOOKUP(RC[-4],R9C3:R186C4,2,0),1),RC[-1],NA()) -> NA() | AX21: =IF(ISNA(RC[-1])=1,"",RC[-5]) ->  | AY21: Albania | AZ21: ALB | BA21: -0.98509305269304992 | BB21: 0.23187454055691353 | BC21: =1.64*RC[-1] -> 0.38027424651333819 | BD21: =IF(EQUAL(VLOOKUP(RC[-4],R9C3:R186C4,2,0),1),RC[-1],NA()) -> NA() | BE21: =IF(ISNA(RC[-1])=1,"",RC[-5]) -> 
B22: Bangladesh | C22: BGD | D22: =IF(EQUAL(ComparativeCharts!R[11]C,""),"",1) ->  | O22: 15 | P22: Libya | Q22: LBY | R22: -1.3461625814712308 | S22: 0.25402694431067208 | T22: =1.64*RC[-1] -> 0.41660418866950216 | U22: =IF(EQUAL(VLOOKUP(RC[-4],R9C3:R186C4,2,0),1),RC[-1],NA()) -> 0.41660418866950216 | V22: =IF(ISNA(RC[-1])=1,"",RC[-5]) -> LBY | W22: Colombia | X22: COL | Y22: -1.2899383116436087 | Z22: 0.25228486761247954 | AA22: =1.64*RC[-1] -> 0.41374718288446644 | AB22: =IF(EQUAL(VLOOKUP(RC[-4],R9C3:R186C4,2,0),1),RC[-1],NA()) -> NA() | AC22: =IF(ISNA(RC[-1])=1,"",RC[-5]) ->  | AD22: Zimbabwe | AE22: ZWE | AF22: -1.1291657344883741 | AG22: 0.22248178800615603 | AH22: =1.64*RC[-1] -> 0.36487013233009585 | AI22: =IF(EQUAL(VLOOKUP(RC[-4],R9C3:R186C4,2,0),1),RC[-1],NA()) -> NA() | AJ22: =IF(ISNA(RC[-1])=1,"",RC[-5]) ->  | AK22: Bosnia and Herzegovina | AL22: BIH | AM22: -1.2574078298340885 | AN22: 0.30445780587756932 | AO22: =1.64*RC[-1] -> 0.49931080163921365 | AP22: =IF(EQUAL(VLOOKUP(RC[-4],R9C3:R186C4,2,0),1),RC[-1],NA()) -> NA() | AQ22: =IF(ISNA(RC[-1])=1,"",RC[-5]) ->  | AR22: Niger | AS22: NER | AT22: -1.143864057160185 | AU22: 0.44307336250641616 | AV22: =1.64*RC[-1] -> 0.72664031451052247 | AW22: =IF(EQUAL(VLOOKUP(RC[-4],R9C3:R186C4,2,0),1),RC[-1],NA()) -> NA() | AX22: =IF(ISNA(RC[-1])=1,"",RC[-5]) ->  | AY22: Uzbekistan | AZ22: UZB | BA22: -0.96325332222762494 | BB22: 0.19091402626465273 | BC22: =1.64*RC[-1] -> 0.31309900307403044 | BD22: =IF(EQUAL(VLOOKUP(RC[-4],R9C3:R186C4,2,0),1),RC[-1],NA()) -> NA() | BE22: =IF(ISNA(RC[-1])=1,"",RC[-5]) -> 
B23: Bulgaria | C23: BGR | D23: =IF(EQUAL(ComparativeCharts!R[11]C,""),"",1) ->  | O23: 16 | P23: Uzbekistan | Q23: UZB | R23: -1.3433286807786045 | S23: 0.29161828587045291 | T23: =1.64*RC[-1] -> 0.47825398882754272 | U23: =IF(EQUAL(VLOOKUP(RC[-4],R9C3:R186C4,2,0),1),RC[-1],NA()) -> NA() | V23: =IF(ISNA(RC[-1])=1,"",RC[-5]) ->  | W23: Indonesia | X23: IDN | Y23: -1.2886628804905851 | Z23: 0.26334453452009404 | AA23: =1.64*RC[-1] -> 0.43188503661295419 | AB23: =IF(EQUAL(VLOOKUP(RC[-4],R9C3:R186C4,2,0),1),RC[-1],NA()) -> 0.43188503661295419 | AC23: =IF(ISNA(RC[-1])=1,"",RC[-5]) -> IDN | AD23: Gabon | AE23: GAB | AF23: -1.1267529773270337 | AG23: 0.37414236442207388 | AH23: =1.64*RC[-1] -> 0.61359347765220118 | AI23: =IF(EQUAL(VLOOKUP(RC[-4],R9C3:R186C4,2,0),1),RC[-1],NA()) -> NA() | AJ23: =IF(ISNA(RC[-1])=1,"",RC[-5]) ->  | AK23: Iran, Islamic Rep. | AL23: IRN | AM23: -1.2506436241740722 | AN23: 0.39525422199815724 | AO23: =1.64*RC[-1] -> 0.64821692407697784 | AP23: =IF(EQUAL(VLOOKUP(RC[-4],R9C3:R186C4,2,0),1),RC[-1],NA()) -> NA() | AQ23: =IF(ISNA(RC[-1])=1,"",RC[-5]) ->  | AR23: Libya | AS23: LBY | AT23: -1.113356574594857 | AU23: 0.27634968636657775 | AV23: =1.64*RC[-1] -> 0.45321348564118746 | AW23: =IF(EQUAL(VLOOKUP(RC[-4],R9C3:R186C4,2,0),1),RC[-1],NA()) -> 0.45321348564118746 | AX23: =IF(ISNA(RC[-1])=1,"",RC[-5]) -> LBY | AY23: Paraguay | AZ23: PRY | BA23: -0.95837041801488099 | BB23: 0.26842378896013652 | BC23: =1.64*RC[-1] -> 0.44021501389462386 | BD23: =IF(EQUAL(VLOOKUP(RC[-4],R9C3:R186C4,2,0),1),RC[-1],NA()) -> NA() | BE23: =IF(ISNA(RC[-1])=1,"",RC[-5]) -> 
B24: Bahrain | C24: BHR | D24: =IF(EQUAL(ComparativeCharts!R[11]C,""),"",1) ->  | O24: 17 | P24: Algeria | Q24: DZA | R24: -1.3097317400549584 | S24: 0.25402694431067208 | T24: =1.64*RC[-1] -> 0.41660418866950216 | U24: =IF(EQUAL(VLOOKUP(RC[-4],R9C3:R186C4,2,0),1),RC[-1],NA()) -> NA() | V24: =IF(ISNA(RC[-1])=1,"",RC[-5]) ->  | W24: Guinea-Bissau | X24: GNB | Y24: -1.2029179185971692 | Z24: 0.37350218211437147 | AA24: =1.64*RC[-1] -> 0.61254357866756914 | AB24: =IF(EQUAL(VLOOKUP(RC[-4],R9C3:R186C4,2,0),1),RC[-1],NA()) -> NA() | AC24: =IF(ISNA(RC[-1])=1,"",RC[-5]) ->  | AD24: Bosnia and Herzegovina | AE24: BIH | AF24: -1.1084941457157245 | AG24: 0.40747715389400124 | AH24: =1.64*RC[-1] -> 0.66826253238616196 | AI24: =IF(EQUAL(VLOOKUP(RC[-4],R9C3:R186C4,2,0),1),RC[-1],NA()) -> NA() | AJ24: =IF(ISNA(RC[-1])=1,"",RC[-5]) ->  | AK24: Liberia | AL24: LBR | AM24: -1.2480401716116811 | AN24: 0.71821352123625759 | AO24: =1.64*RC[-1] -> 1.1778701748274625 | AP24: =IF(EQUAL(VLOOKUP(RC[-4],R9C3:R186C4,2,0),1),RC[-1],NA()) -> NA() | AQ24: =IF(ISNA(RC[-1])=1,"",RC[-5]) ->  | AR24: Bosnia and Herzegovina | AS24: BIH | AT24: -1.1084415791240219 | AU24: 0.2322417228763988 | AV24: =1.64*RC[-1] -> 0.380876425517294 | AW24: =IF(EQUAL(VLOOKUP(RC[-4],R9C3:R186C4,2,0),1),RC[-1],NA()) -> NA() | AX24: =IF(ISNA(RC[-1])=1,"",RC[-5]) ->  | AY24: Nigeria | AZ24: NGA | BA24: -0.95373395869528599 | BB24: 0.20180269482655613 | BC24: =1.64*RC[-1] -> 0.33095641951555205 | BD24: =IF(EQUAL(VLOOKUP(RC[-4],R9C3:R186C4,2,0),1),RC[-1],NA()) -> NA() | BE24: =IF(ISNA(RC[-1])=1,"",RC[-5]) -> 
B25: Bahamas, The | C25: BHS | D25: =IF(EQUAL(ComparativeCharts!R[11]C,""),"",1) ->  | O25: 18 | P25: China | Q25: CHN | R25: -1.2961319860553651 | S25: 0.25402694431067208 | T25: =1.64*RC[-1] -> 0.41660418866950216 | U25: =IF(EQUAL(VLOOKUP(RC[-4],R9C3:R186C4,2,0),1),RC[-1],NA()) -> NA() | V25: =IF(ISNA(RC[-1])=1,"",RC[-5]) ->  | W25: Libya | X25: LBY | Y25: -1.1747078240324573 | Z25: 0.29988188904282925 | AA25: =1.64*RC[-1] -> 0.49180629803023995 | AB25: =IF(EQUAL(VLOOKUP(RC[-4],R9C3:R186C4,2,0),1),RC[-1],NA()) -> 0.49180629803023995 | AC25: =IF(ISNA(RC[-1])=1,"",RC[-5]) -> LBY | AD25: Paraguay | AE25: PRY | AF25: -1.1001550005409613 | AG25: 0.32807669277493695 | AH25: =1.64*RC[-1] -> 0.53804577615089655 | AI25: =IF(EQUAL(VLOOKUP(RC[-4],R9C3:R186C4,2,0),1),RC[-1],NA()) -> NA() | AJ25: =IF(ISNA(RC[-1])=1,"",RC[-5]) ->  | AK25: Algeria | AL25: DZA | AM25: -1.1726383929584521 | AN25: 0.39525422199815724 | AO25: =1.64*RC[-1] -> 0.64821692407697784 | AP25: =IF(EQUAL(VLOOKUP(RC[-4],R9C3:R186C4,2,0),1),RC[-1],NA()) -> NA() | AQ25: =IF(ISNA(RC[-1])=1,"",RC[-5]) ->  | AR25: Guatemala | AS25: GTM | AT25: -1.1056763126901379 | AU25: 0.27756710773103799 | AV25: =1.64*RC[-1] -> 0.4552100566789023 | AW25: =IF(EQUAL(VLOOKUP(RC[-4],R9C3:R186C4,2,0),1),RC[-1],NA()) -> NA() | AX25: =IF(ISNA(RC[-1])=1,"",RC[-5]) ->  | AY25: Honduras | AZ25: HND | BA25: -0.9381470115767242 | BB25: 0.24849503105537538 | BC25: =1.64*RC[-1] -> 0.40753185093081562 | BD25: =IF(EQUAL(VLOOKUP(RC[-4],R9C3:R186C4,2,0),1),RC[-1],NA()) -> NA() | BE25: =IF(ISNA(RC[-1])=1,"",RC[-5]) -> 
B26: Bosnia and Herzegovina | C26: BIH | D26: =IF(EQUAL(ComparativeCharts!R[11]C,""),"",1) ->  | O26: 19 | P26: Burundi | Q26: BDI | R26: -1.2884691166555629 | S26: 0.36031461549530619 | T26: =1.64*RC[-1] -> 0.59091596941230207 | U26: =IF(EQUAL(VLOOKUP(RC[-4],R9C3:R186C4,2,0),1),RC[-1],NA()) -> NA() | V26: =IF(ISNA(RC[-1])=1,"",RC[-5]) ->  | W26: Bosnia and Herzegovina | X26: BIH | Y26: -1.1552388845802837 | Z26: 0.38521922477416387 | AA26: =1.64*RC[-1] -> 0.6317595286296287 | AB26: =IF(EQUAL(VLOOKUP(RC[-4],R9C3:R186C4,2,0),1),RC[-1],NA()) -> NA() | AC26: =IF(ISNA(RC[-1])=1,"",RC[-5]) ->  | AD26: Algeria | AE26: DZA | AF26: -1.0869323757785783 | AG26: 0.31908959204123422 | AH26: =1.64*RC[-1] -> 0.52330693094762404 | AI26: =IF(EQUAL(VLOOKUP(RC[-4],R9C3:R186C4,2,0),1),RC[-1],NA()) -> NA() | AJ26: =IF(ISNA(RC[-1])=1,"",RC[-5]) ->  | AK26: Rwanda | AL26: RWA | AM26: -1.169838061764453 | AN26: 0.60188084442426626 | AO26: =1.64*RC[-1] -> 0.98708458485579664 | AP26: =IF(EQUAL(VLOOKUP(RC[-4],R9C3:R186C4,2,0),1),RC[-1],NA()) -> NA() | AQ26: =IF(ISNA(RC[-1])=1,"",RC[-5]) ->  | AR26: Algeria | AS26: DZA | AT26: -1.1028608879092785 | AU26: 0.27634968636657775 | AV26: =1.64*RC[-1] -> 0.45321348564118746 | AW26: =IF(EQUAL(VLOOKUP(RC[-4],R9C3:R186C4,2,0),1),RC[-1],NA()) -> NA() | AX26: =IF(ISNA(RC[-1])=1,"",RC[-5]) ->  | AY26: Tanzania | AZ26: TZA | BA26: -0.92386727832905491 | BB26: 0.21052052859001816 | BC26: =1.64*RC[-1] -> 0.34525366688762976 | BD26: =IF(EQUAL(VLOOKUP(RC[-4],R9C3:R186C4,2,0),1),RC[-1],NA()) -> NA() | BE26: =IF(ISNA(RC[-1])=1,"",RC[-5]) -> 
B27: Belarus | C27: BLR | D27: =IF(EQUAL(ComparativeCharts!R[11]C,""),"",1) ->  | O27: 20 | P27: Bhutan | Q27: BTN | R27: -1.2539514275949681 | S27: 0.36031461549530619 | T27: =1.64*RC[-1] -> 0.59091596941230207 | U27: =IF(EQUAL(VLOOKUP(RC[-4],R9C3:R186C4,2,0),1),RC[-1],NA()) -> NA() | V27: =IF(ISNA(RC[-1])=1,"",RC[-5]) ->  | W27: Kenya | X27: KEN | Y27: -1.097689683613893 | Z27: 0.26599811359710124 | AA27: =1.64*RC[-1] -> 0.436236906299246 | AB27: =IF(EQUAL(VLOOKUP(RC[-4],R9C3:R186C4,2,0),1),RC[-1],NA()) -> NA() | AC27: =IF(ISNA(RC[-1])=1,"",RC[-5]) ->  | AD27: Yugoslavia, FR (Serbia/Montenegro) | AE27: YUG | AF27: -0.95327109471734817 | AG27: 0.28669328014914724 | AH27: =1.64*RC[-1] -> 0.47017697944460146 | AI27: =IF(EQUAL(VLOOKUP(RC[-4],R9C3:R186C4,2,0),1),RC[-1],NA()) -> NA() | AJ27: =IF(ISNA(RC[-1])=1,"",RC[-5]) ->  | AK27: Haiti | AL27: HTI | AM27: -1.1328194835292764 | AN27: 0.51994095831945863 | AO27: =1.64*RC[-1] -> 0.85270317164391207 | AP27: =IF(EQUAL(VLOOKUP(RC[-4],R9C3:R186C4,2,0),1),RC[-1],NA()) -> NA() | AQ27: =IF(ISNA(RC[-1])=1,"",RC[-5]) ->  | AR27: Nigeria | AS27: NGA | AT27: -1.0974759141193968 | AU27: 0.2531854041328267 | AV27: =1.64*RC[-1] -> 0.41522406277783575 | AW27: =IF(EQUAL(VLOOKUP(RC[-4],R9C3:R186C4,2,0),1),RC[-1],NA()) -> NA() | AX27: =IF(ISNA(RC[-1])=1,"",RC[-5]) ->  | AY27: Ukraine | AZ27: UKR | BA27: -0.89165536807654455 | BB27: 0.16744402822473969 | BC27: =1.64*RC[-1] -> 0.27460820628857308 | BD27: =IF(EQUAL(VLOOKUP(RC[-4],R9C3:R186C4,2,0),1),RC[-1],NA()) -> NA() | BE27: =IF(ISNA(RC[-1])=1,"",RC[-5]) -> 
B28: Belize | C28: BLZ | D28: =IF(EQUAL(ComparativeCharts!R[11]C,""),"",1) ->  | O28: 21 | P28: Nigeria | Q28: NGA | R28: -1.234344452915525 | S28: 0.25130023322348893 | T28: =1.64*RC[-1] -> 0.41213238248652184 | U28: =IF(EQUAL(VLOOKUP(RC[-4],R9C3:R186C4,2,0),1),RC[-1],NA()) -> NA() | V28: =IF(ISNA(RC[-1])=1,"",RC[-5]) ->  | W28: Nigeria | X28: NGA | Y28: -1.0544861637286871 | Z28: 0.26599811359710124 | AA28: =1.64*RC[-1] -> 0.436236906299246 | AB28: =IF(EQUAL(VLOOKUP(RC[-4],R9C3:R186C4,2,0),1),RC[-1],NA()) -> NA() | AC28: =IF(ISNA(RC[-1])=1,"",RC[-5]) ->  | AD28: Liberia | AE28: LBR | AF28: -0.92152859534182774 | AG28: 0.76816878371913544 | AH28: =1.64*RC[-1] -> 1.259796805299382 | AI28: =IF(EQUAL(VLOOKUP(RC[-4],R9C3:R186C4,2,0),1),RC[-1],NA()) -> NA() | AJ28: =IF(ISNA(RC[-1])=1,"",RC[-5]) ->  | AK28: Myanmar | AL28: MMR | AM28: -1.0108266200058897 | AN28: 0.39525422199815724 | AO28: =1.64*RC[-1] -> 0.64821692407697784 | AP28: =IF(EQUAL(VLOOKUP(RC[-4],R9C3:R186C4,2,0),1),RC[-1],NA()) -> NA() | AQ28: =IF(ISNA(RC[-1])=1,"",RC[-5]) ->  | AR28: Mozambique | AS28: MOZ | AT28: -1.0459735063342839 | AU28: 0.36274962838154251 | AV28: =1.64*RC[-1] -> 0.59490939054572967 | AW28: =IF(EQUAL(VLOOKUP(RC[-4],R9C3:R186C4,2,0),1),RC[-1],NA()) -> NA() | AX28: =IF(ISNA(RC[-1])=1,"",RC[-5]) ->  | AY28: Libya | AZ28: LBY | BA28: -0.88180472175331326 | BB28: 0.26706317040829514 | BC28: =1.64*RC[-1] -> 0.43798359946960402 | BD28: =IF(EQUAL(VLOOKUP(RC[-4],R9C3:R186C4,2,0),1),RC[-1],NA()) -> 0.43798359946960402 | BE28: =IF(ISNA(RC[-1])=1,"",RC[-5]) -> LBY
B29: Bolivia | C29: BOL | D29: =IF(EQUAL(ComparativeCharts!R[11]C,""),"",1) ->  | O29: 22 | P29: Rwanda | Q29: RWA | R29: -1.1745607436875782 | S29: 0.36031461549530619 | T29: =1.64*RC[-1] -> 0.59091596941230207 | U29: =IF(EQUAL(VLOOKUP(RC[-4],R9C3:R186C4,2,0),1),RC[-1],NA()) -> NA() | V29: =IF(ISNA(RC[-1])=1,"",RC[-5]) ->  | W29: Guinea | X29: GIN | Y29: -1.0349242367873859 | Z29: 0.37350218211437147 | AA29: =1.64*RC[-1] -> 0.61254357866756914 | AB29: =IF(EQUAL(VLOOKUP(RC[-4],R9C3:R186C4,2,0),1),RC[-1],NA()) -> NA() | AC29: =IF(ISNA(RC[-1])=1,"",RC[-5]) ->  | AD29: Kenya | AE29: KEN | AF29: -0.89942719537350491 | AG29: 0.22248178800615603 | AH29: =1.64*RC[-1] -> 0.36487013233009585 | AI29: =IF(EQUAL(VLOOKUP(RC[-4],R9C3:R186C4,2,0),1),RC[-1],NA()) -> NA() | AJ29: =IF(ISNA(RC[-1])=1,"",RC[-5]) ->  | AK29: Cape verde | AL29: CPV | AM29: -1.0078277521439754 | AN29: 0.60188084442426626 | AO29: =1.64*RC[-1] -> 0.98708458485579664 | AP29: =IF(EQUAL(VLOOKUP(RC[-4],R9C3:R186C4,2,0),1),RC[-1],NA()) -> NA() | AQ29: =IF(ISNA(RC[-1])=1,"",RC[-5]) ->  | AR29: Cameroon | AS29: CMR | AT29: -1.0152235831279335 | AU29: 0.2531854041328267 | AV29: =1.64*RC[-1] -> 0.41522406277783575 | AW29: =IF(EQUAL(VLOOKUP(RC[-4],R9C3:R186C4,2,0),1),RC[-1],NA()) -> NA() | AX29: =IF(ISNA(RC[-1])=1,"",RC[-5]) ->  | AY29: Algeria | AZ29: DZA | BA29: -0.87779362017128582 | BB29: 0.26706317040829514 | BC29: =1.64*RC[-1] -> 0.43798359946960402 | BD29: =IF(EQUAL(VLOOKUP(RC[-4],R9C3:R186C4,2,0),1),RC[-1],NA()) -> NA() | BE29: =IF(ISNA(RC[-1])=1,"",RC[-5]) -> 
B30: Brazil | C30: BRA | D30: =IF(EQUAL(ComparativeCharts!R[11]C,""),"",1) ->  | O30: 23 | P30: Indonesia | Q30: IDN | R30: -1.1654642025652144 | S30: 0.25402694431067208 | T30: =1.64*RC[-1] -> 0.41660418866950216 | U30: =IF(EQUAL(VLOOKUP(RC[-4],R9C3:R186C4,2,0),1),RC[-1],NA()) -> 0.41660418866950216 | V30: =IF(ISNA(RC[-1])=1,"",RC[-5]) -> IDN | W30: Albania | X30: ALB | Y30: -1.0004086877827638 | Z30: 0.25398901430107884 | AA30: =1.64*RC[-1] -> 0.41654198345376925 | AB30: =IF(EQUAL(VLOOKUP(RC[-4],R9C3:R186C4,2,0),1),RC[-1],NA()) -> NA() | AC30: =IF(ISNA(RC[-1])=1,"",RC[-5]) ->  | AD30: Ukraine | AE30: UKR | AF30: -0.89290845414072462 | AG30: 0.21330665413765773 | AH30: =1.64*RC[-1] -> 0.34982291278575867 | AI30: =IF(EQUAL(VLOOKUP(RC[-4],R9C3:R186C4,2,0),1),RC[-1],NA()) -> NA() | AJ30: =IF(ISNA(RC[-1])=1,"",RC[-5]) ->  | AK30: Azerbaijan | AL30: AZE | AM30: -0.99736144864975973 | AN30: 0.2628266479146692 | AO30: =1.64*RC[-1] -> 0.43103570258005747 | AP30: =IF(EQUAL(VLOOKUP(RC[-4],R9C3:R186C4,2,0),1),RC[-1],NA()) -> NA() | AQ30: =IF(ISNA(RC[-1])=1,"",RC[-5]) ->  | AR30: Yemen, Rep. | AS30: YEM | AT30: -1.0081657380033668 | AU30: 0.3138946252365733 | AV30: =1.64*RC[-1] -> 0.51478718538798018 | AW30: =IF(EQUAL(VLOOKUP(RC[-4],R9C3:R186C4,2,0),1),RC[-1],NA()) -> NA() | AX30: =IF(ISNA(RC[-1])=1,"",RC[-5]) ->  | AY30: Kazakhstan | AZ30: KAZ | BA30: -0.86866209791181104 | BB30: 0.18606231845907847 | BC30: =1.64*RC[-1] -> 0.30514220227288869 | BD30: =IF(EQUAL(VLOOKUP(RC[-4],R9C3:R186C4,2,0),1),RC[-1],NA()) -> NA() | BE30: =IF(ISNA(RC[-1])=1,"",RC[-5]) -> 
B31: Barbados | C31: BRB | D31: =IF(EQUAL(ComparativeCharts!R[11]C,""),"",1) ->  | O31: 24 | P31: Saudi Arabia | Q31: SAU | R31: -1.1030625097814815 | S31: 0.25402694431067208 | T31: =1.64*RC[-1] -> 0.41660418866950216 | U31: =IF(EQUAL(VLOOKUP(RC[-4],R9C3:R186C4,2,0),1),RC[-1],NA()) -> NA() | V31: =IF(ISNA(RC[-1])=1,"",RC[-5]) ->  | W31: Uganda | X31: UGA | Y31: -0.98039395532938145 | Z31: 0.26599811359710124 | AA31: =1.64*RC[-1] -> 0.436236906299246 | AB31: =IF(EQUAL(VLOOKUP(RC[-4],R9C3:R186C4,2,0),1),RC[-1],NA()) -> NA() | AC31: =IF(ISNA(RC[-1])=1,"",RC[-5]) ->  | AD31: Venezuela, RB | AE31: VEN | AF31: -0.84920797665078129 | AG31: 0.23363653218585126 | AH31: =1.64*RC[-1] -> 0.38316391278479606 | AI31: =IF(EQUAL(VLOOKUP(RC[-4],R9C3:R186C4,2,0),1),RC[-1],NA()) -> NA() | AJ31: =IF(ISNA(RC[-1])=1,"",RC[-5]) ->  | AK31: Congo, Rep. | AL31: COG | AM31: -0.99136690054546128 | AN31: 0.51661669269246691 | AO31: =1.64*RC[-1] -> 0.84725137601564571 | AP31: =IF(EQUAL(VLOOKUP(RC[-4],R9C3:R186C4,2,0),1),RC[-1],NA()) -> NA() | AQ31: =IF(ISNA(RC[-1])=1,"",RC[-5]) ->  | AR31: Turkmenistan | AS31: TKM | AT31: -0.97138643362975419 | AU31: 0.21573830615955589 | AV31: =1.64*RC[-1] -> 0.35381082210167164 | AW31: =IF(EQUAL(VLOOKUP(RC[-4],R9C3:R186C4,2,0),1),RC[-1],NA()) -> NA() | AX31: =IF(ISNA(RC[-1])=1,"",RC[-5]) ->  | AY31: Angola | AZ31: AGO | BA31: -0.86303091604875526 | BB31: 0.22310568461604569 | BC31: =1.64*RC[-1] -> 0.36589332277031489 | BD31: =IF(EQUAL(VLOOKUP(RC[-4],R9C3:R186C4,2,0),1),RC[-1],NA()) -> NA() | BE31: =IF(ISNA(RC[-1])=1,"",RC[-5]) -> 
B32: Brunei | C32: BRN | D32: =IF(EQUAL(ComparativeCharts!R[11]C,""),"",1) ->  | O32: 25 | P32: Togo | Q32: TGO | R32: -1.0510911161549397 | S32: 0.28728334123682875 | T32: =1.64*RC[-1] -> 0.47114467962839912 | U32: =IF(EQUAL(VLOOKUP(RC[-4],R9C3:R186C4,2,0),1),RC[-1],NA()) -> NA() | V32: =IF(ISNA(RC[-1])=1,"",RC[-5]) ->  | W32: Myanmar | X32: MMR | Y32: -0.96734872406948091 | Z32: 0.29988188904282925 | AA32: =1.64*RC[-1] -> 0.49180629803023995 | AB32: =IF(EQUAL(VLOOKUP(RC[-4],R9C3:R186C4,2,0),1),RC[-1],NA()) -> NA() | AC32: =IF(ISNA(RC[-1])=1,"",RC[-5]) ->  | AD32: Azerbaijan | AE32: AZE | AF32: -0.83324863482836731 | AG32: 0.24259893305862151 | AH32: =1.64*RC[-1] -> 0.39786225021613925 | AI32: =IF(EQUAL(VLOOKUP(RC[-4],R9C3:R186C4,2,0),1),RC[-1],NA()) -> NA() | AJ32: =IF(ISNA(RC[-1])=1,"",RC[-5]) ->  | AK32: Syrian Arab Republic | AL32: SYR | AM32: -0.91532426663525046 | AN32: 0.39525422199815724 | AO32: =1.64*RC[-1] -> 0.64821692407697784 | AP32: =IF(EQUAL(VLOOKUP(RC[-4],R9C3:R186C4,2,0),1),RC[-1],NA()) -> NA() | AQ32: =IF(ISNA(RC[-1])=1,"",RC[-5]) ->  | AR32: Bangladesh | AS32: BGD | AT32: -0.92944369417260075 | AU32: 0.27634968636657775 | AV32: =1.64*RC[-1] -> 0.45321348564118746 | AW32: =IF(EQUAL(VLOOKUP(RC[-4],R9C3:R186C4,2,0),1),RC[-1],NA()) -> NA() | AX32: =IF(ISNA(RC[-1])=1,"",RC[-5]) ->  | AY32: Papua New Guinea | AZ32: PNG | BA32: -0.85367190654123626 | BB32: 0.2961069418304243 | BC32: =1.64*RC[-1] -> 0.48561538460189579 | BD32: =IF(EQUAL(VLOOKUP(RC[-4],R9C3:R186C4,2,0),1),RC[-1],NA()) -> NA() | BE32: =IF(ISNA(RC[-1])=1,"",RC[-5]) -> 
B33: Bhutan | C33: BTN | D33: =IF(EQUAL(ComparativeCharts!R[11]C,""),"",1) ->  | O33: 26 | P33: Lao, PDR | Q33: LAO | R33: -1.050297061826801 | S33: 0.36031461549530619 | T33: =1.64*RC[-1] -> 0.59091596941230207 | U33: =IF(EQUAL(VLOOKUP(RC[-4],R9C3:R186C4,2,0),1),RC[-1],NA()) -> NA() | V33: =IF(ISNA(RC[-1])=1,"",RC[-5]) ->  | W33: Liberia | X33: LBR | Y33: -0.95200091366667139 | Z33: 0.41252284257447502 | AA33: =1.64*RC[-1] -> 0.67653746182213903 | AB33: =IF(EQUAL(VLOOKUP(RC[-4],R9C3:R186C4,2,0),1),RC[-1],NA()) -> NA() | AC33: =IF(ISNA(RC[-1])=1,"",RC[-5]) ->  | AD33: Dominican Republic | AE33: DOM | AF33: -0.83254007631262517 | AG33: 0.37414236442207388 | AH33: =1.64*RC[-1] -> 0.61359347765220118 | AI33: =IF(EQUAL(VLOOKUP(RC[-4],R9C3:R186C4,2,0),1),RC[-1],NA()) -> NA() | AJ33: =IF(ISNA(RC[-1])=1,"",RC[-5]) ->  | AK33: Cuba | AL33: CUB | AM33: -0.86557551078601891 | AN33: 0.39525422199815724 | AO33: =1.64*RC[-1] -> 0.64821692407697784 | AP33: =IF(EQUAL(VLOOKUP(RC[-4],R9C3:R186C4,2,0),1),RC[-1],NA()) -> NA() | AQ33: =IF(ISNA(RC[-1])=1,"",RC[-5]) ->  | AR33: Indonesia | AS33: IDN | AT33: -0.91832769642976875 | AU33: 0.21813983950894791 | AV33: =1.64*RC[-1] -> 0.35774933679467458 | AW33: =IF(EQUAL(VLOOKUP(RC[-4],R9C3:R186C4,2,0),1),RC[-1],NA()) -> 0.35774933679467458 | AX33: =IF(ISNA(RC[-1])=1,"",RC[-5]) -> IDN | AY33: Yemen, Rep. | AZ33: YEM | BA33: -0.85367190654123626 | BB33: 0.2961069418304243 | BC33: =1.64*RC[-1] -> 0.48561538460189579 | BD33: =IF(EQUAL(VLOOKUP(RC[-4],R9C3:R186C4,2,0),1),RC[-1],NA()) -> NA() | BE33: =IF(ISNA(RC[-1])=1,"",RC[-5]) -> 
B34: Botswana | C34: BWA | D34: =IF(EQUAL(ComparativeCharts!R[11]C,""),"",1) -> 1 | O34: 27 | P34: Bahrain | Q34: BHR | R34: -1.0370635684437435 | S34: 0.25402694431067208 | T34: =1.64*RC[-1] -> 0.41660418866950216 | U34: =IF(EQUAL(VLOOKUP(RC[-4],R9C3:R186C4,2,0),1),RC[-1],NA()) -> NA() | V34: =IF(ISNA(RC[-1])=1,"",RC[-5]) ->  | W34: Turkey | X34: TUR | Y34: -0.94375682308602271 | Z34: 0.25228486761247954 | AA34: =1.64*RC[-1] -> 0.41374718288446644 | AB34: =IF(EQUAL(VLOOKUP(RC[-4],R9C3:R186C4,2,0),1),RC[-1],NA()) -> NA() | AC34: =IF(ISNA(RC[-1])=1,"",RC[-5]) ->  | AD34: Kazakhstan | AE34: KAZ | AF34: -0.82377799173192168 | AG34: 0.2289485826310286 | AH34: =1.64*RC[-1] -> 0.37547567551488686 | AI34: =IF(EQUAL(VLOOKUP(RC[-4],R9C3:R186C4,2,0),1),RC[-1],NA()) -> NA() | AJ34: =IF(ISNA(RC[-1])=1,"",RC[-5]) ->  | AK34: Togo | AL34: TGO | AM34: -0.85287683211130538 | AN34: 0.51661669269246691 | AO34: =1.64*RC[-1] -> 0.84725137601564571 | AP34: =IF(EQUAL(VLOOKUP(RC[-4],R9C3:R186C4,2,0),1),RC[-1],NA()) -> NA() | AQ34: =IF(ISNA(RC[-1])=1,"",RC[-5]) ->  | AR34: Albania | AS34: ALB | AT34: -0.91777004729796774 | AU34: 0.19625062444278024 | AV34: =1.64*RC[-1] -> 0.32185102408615957 | AW34: =IF(EQUAL(VLOOKUP(RC[-4],R9C3:R186C4,2,0),1),RC[-1],NA()) -> NA() | AX34: =IF(ISNA(RC[-1])=1,"",RC[-5]) ->  | AY34: Iran, Islamic Rep. | AZ34: IRN | BA34: -0.84794760841417371 | BB34: 0.26094287716947417 | BC34: =1.64*RC[-1] -> 0.42794631855793763 | BD34: =IF(EQUAL(VLOOKUP(RC[-4],R9C3:R186C4,2,0),1),RC[-1],NA()) -> NA() | BE34: =IF(ISNA(RC[-1])=1,"",RC[-5]) -> 
B35: Central African Republic | C35: CAF | D35: =IF(EQUAL(ComparativeCharts!R[11]C,""),"",1) ->  | O35: 28 | P35: Angola | Q35: AGO | R35: -1.0034270598269508 | S35: 0.25402694431067208 | T35: =1.64*RC[-1] -> 0.41660418866950216 | U35: =IF(EQUAL(VLOOKUP(RC[-4],R9C3:R186C4,2,0),1),RC[-1],NA()) -> NA() | V35: =IF(ISNA(RC[-1])=1,"",RC[-5]) ->  | W35: Benin | X35: BEN | Y35: -0.93741018160258371 | Z35: 0.66053614439227493 | AA35: =1.64*RC[-1] -> 1.0832792768033308 | AB35: =IF(EQUAL(VLOOKUP(RC[-4],R9C3:R186C4,2,0),1),RC[-1],NA()) -> NA() | AC35: =IF(ISNA(RC[-1])=1,"",RC[-5]) ->  | AD35: Bulgaria | AE35: BGR | AF35: -0.8141308759227277 | AG35: 0.24259893305862151 | AH35: =1.64*RC[-1] -> 0.39786225021613925 | AI35: =IF(EQUAL(VLOOKUP(RC[-4],R9C3:R186C4,2,0),1),RC[-1],NA()) -> NA() | AJ35: =IF(ISNA(RC[-1])=1,"",RC[-5]) ->  | AK35: Georgia | AL35: GEO | AM35: -0.84926699912726855 | AN35: 0.27178528950467506 | AO35: =1.64*RC[-1] -> 0.44572787478766707 | AP35: =IF(EQUAL(VLOOKUP(RC[-4],R9C3:R186C4,2,0),1),RC[-1],NA()) -> NA() | AQ35: =IF(ISNA(RC[-1])=1,"",RC[-5]) ->  | AR35: Sierra Leone | AS35: SLE | AT35: -0.90551622294224621 | AU35: 0.44307336250641616 | AV35: =1.64*RC[-1] -> 0.72664031451052247 | AW35: =IF(EQUAL(VLOOKUP(RC[-4],R9C3:R186C4,2,0),1),RC[-1],NA()) -> NA() | AX35: =IF(ISNA(RC[-1])=1,"",RC[-5]) ->  | AY35: Guinea | AZ35: GIN | BA35: -0.84776582800763911 | BB35: 0.48462245571009516 | BC35: =1.64*RC[-1] -> 0.79478082736455602 | BD35: =IF(EQUAL(VLOOKUP(RC[-4],R9C3:R186C4,2,0),1),RC[-1],NA()) -> NA() | BE35: =IF(ISNA(RC[-1])=1,"",RC[-5]) -> 
B36: Canada | C36: CAN | D36: =IF(EQUAL(ComparativeCharts!R[11]C,""),"",1) ->  | O36: 29 | P36: Gambia, The | Q36: GMB | R36: -0.97138928733204122 | S36: 0.29137760175532934 | T36: =1.64*RC[-1] -> 0.47785926687874009 | U36: =IF(EQUAL(VLOOKUP(RC[-4],R9C3:R186C4,2,0),1),RC[-1],NA()) -> NA() | V36: =IF(ISNA(RC[-1])=1,"",RC[-5]) ->  | W36: Togo | X36: TGO | Y36: -0.90568302204879081 | Z36: 0.37350218211437147 | AA36: =1.64*RC[-1] -> 0.61254357866756914 | AB36: =IF(EQUAL(VLOOKUP(RC[-4],R9C3:R186C4,2,0),1),RC[-1],NA()) -> NA() | AC36: =IF(ISNA(RC[-1])=1,"",RC[-5]) ->  | AD36: Central African Republic | AE36: CAF | AF36: -0.74711391325149723 | AG36: 0.50633476272914779 | AH36: =1.64*RC[-1] -> 0.8303890108758023 | AI36: =IF(EQUAL(VLOOKUP(RC[-4],R9C3:R186C4,2,0),1),RC[-1],NA()) -> NA() | AJ36: =IF(ISNA(RC[-1])=1,"",RC[-5]) ->  | AK36: Burundi | AL36: BDI | AM36: -0.84581743863525027 | AN36: 0.60188084442426626 | AO36: =1.64*RC[-1] -> 0.98708458485579664 | AP36: =IF(EQUAL(VLOOKUP(RC[-4],R9C3:R186C4,2,0),1),RC[-1],NA()) -> NA() | AQ36: =IF(ISNA(RC[-1])=1,"",RC[-5]) ->  | AR36: Honduras | AS36: HND | AT36: -0.89534600998271829 | AU36: 0.27756710773103799 | AV36: =1.64*RC[-1] -> 0.4552100566789023 | AW36: =IF(EQUAL(VLOOKUP(RC[-4],R9C3:R186C4,2,0),1),RC[-1],NA()) -> NA() | AX36: =IF(ISNA(RC[-1])=1,"",RC[-5]) ->  | AY36: Nicaragua | AZ36: NIC | BA36: -0.83610581602138978 | BB36: 0.24849503105537538 | BC36: =1.64*RC[-1] -> 0.40753185093081562 | BD36: =IF(EQUAL(VLOOKUP(RC[-4],R9C3:R186C4,2,0),1),RC[-1],NA()) -> NA() | BE36: =IF(ISNA(RC[-1])=1,"",RC[-5]) -> 
B37: Switzerland | C37: CHE | D37: =IF(EQUAL(ComparativeCharts!R[11]C,""),"",1) ->  | O37: 30 | P37: Bosnia and Herzegovina | Q37: BIH | R37: -0.97090637481281916 | S37: 0.36031461549530619 | T37: =1.64*RC[-1] -> 0.59091596941230207 | U37: =IF(EQUAL(VLOOKUP(RC[-4],R9C3:R186C4,2,0),1),RC[-1],NA()) -> NA() | V37: =IF(ISNA(RC[-1])=1,"",RC[-5]) ->  | W37: Senegal | X37: SEN | Y37: -0.87125817585656529 | Z37: 0.31915287616104948 | AA37: =1.64*RC[-1] -> 0.52341071690412111 | AB37: =IF(EQUAL(VLOOKUP(RC[-4],R9C3:R186C4,2,0),1),RC[-1],NA()) -> NA() | AC37: =IF(ISNA(RC[-1])=1,"",RC[-5]) ->  | AD37: Pakistan | AE37: PAK | AF37: -0.7444444772159049 | AG37: 0.2598634108510659 | AH37: =1.64*RC[-1] -> 0.42617599379574805 | AI37: =IF(EQUAL(VLOOKUP(RC[-4],R9C3:R186C4,2,0),1),RC[-1],NA()) -> NA() | AJ37: =IF(ISNA(RC[-1])=1,"",RC[-5]) ->  | AK37: Mauritania | AL37: MRT | AM37: -0.84581743863525027 | AN37: 0.60188084442426626 | AO37: =1.64*RC[-1] -> 0.98708458485579664 | AP37: =IF(EQUAL(VLOOKUP(RC[-4],R9C3:R186C4,2,0),1),RC[-1],NA()) -> NA() | AQ37: =IF(ISNA(RC[-1])=1,"",RC[-5]) ->  | AR37: Burundi | AS37: BDI | AT37: -0.88073658171586089 | AU37: 0.60058386521254259 | AV37: =1.64*RC[-1] -> 0.98495753894856974 | AW37: =IF(EQUAL(VLOOKUP(RC[-4],R9C3:R186C4,2,0),1),RC[-1],NA()) -> NA() | AX37: =IF(ISNA(RC[-1])=1,"",RC[-5]) ->  | AY37: Guatemala | AZ37: GTM | BA37: -0.81944615326046999 | BB37: 0.24849503105537538 | BC37: =1.64*RC[-1] -> 0.40753185093081562 | BD37: =IF(EQUAL(VLOOKUP(RC[-4],R9C3:R186C4,2,0),1),RC[-1],NA()) -> NA() | BE37: =IF(ISNA(RC[-1])=1,"",RC[-5]) -> 
B38: Chile | C38: CHL | D38: =IF(EQUAL(ComparativeCharts!R[11]C,""),"",1) -> 1 | O38: 31 | P38: Mauritania | Q38: MRT | R38: -0.97090637481281916 | S38: 0.36031461549530619 | T38: =1.64*RC[-1] -> 0.59091596941230207 | U38: =IF(EQUAL(VLOOKUP(RC[-4],R9C3:R186C4,2,0),1),RC[-1],NA()) -> NA() | V38: =IF(ISNA(RC[-1])=1,"",RC[-5]) ->  | W38: Lesotho | X38: LSO | Y38: -0.8200376148923666 | Z38: 0.6061771357665019 | AA38: =1.64*RC[-1] -> 0.99413050265706304 | AB38: =IF(EQUAL(VLOOKUP(RC[-4],R9C3:R186C4,2,0),1),RC[-1],NA()) -> NA() | AC38: =IF(ISNA(RC[-1])=1,"",RC[-5]) ->  | AD38: Chad | AE38: TCD | AF38: -0.71436849482699039 | AG38: 0.5637075668724989 | AH38: =1.64*RC[-1] -> 0.92448040967089817 | AI38: =IF(EQUAL(VLOOKUP(RC[-4],R9C3:R186C4,2,0),1),RC[-1],NA()) -> NA() | AJ38: =IF(ISNA(RC[-1])=1,"",RC[-5]) ->  | AK38: Sudan | AL38: SDN | AM38: -0.82791236389541356 | AN38: 0.51994095831945863 | AO38: =1.64*RC[-1] -> 0.85270317164391207 | AP38: =IF(EQUAL(VLOOKUP(RC[-4],R9C3:R186C4,2,0),1),RC[-1],NA()) -> NA() | AQ38: =IF(ISNA(RC[-1])=1,"",RC[-5]) ->  | AR38: Belarus | AS38: BLR | AT38: -0.87613754102101138 | AU38: 0.19625062444278024 | AV38: =1.64*RC[-1] -> 0.32185102408615957 | AW38: =IF(EQUAL(VLOOKUP(RC[-4],R9C3:R186C4,2,0),1),RC[-1],NA()) -> NA() | AX38: =IF(ISNA(RC[-1])=1,"",RC[-5]) ->  | AY38: Ecuador | AZ38: ECU | BA38: -0.8192008188019263 | BB38: 0.24140237883261839 | BC38: =1.64*RC[-1] -> 0.39589990128549413 | BD38: =IF(EQUAL(VLOOKUP(RC[-4],R9C3:R186C4,2,0),1),RC[-1],NA()) -> NA() | BE38: =IF(ISNA(RC[-1])=1,"",RC[-5]) -> 
B39: China | C39: CHN | D39: =IF(EQUAL(ComparativeCharts!R[11]C,""),"",1) ->  | O39: 32 | P39: Yugoslavia, FR (Serbia/Montenegro) | Q39: YUG | R39: -0.91975995994829496 | S39: 0.25402694431067208 | T39: =1.64*RC[-1] -> 0.41660418866950216 | U39: =IF(EQUAL(VLOOKUP(RC[-4],R9C3:R186C4,2,0),1),RC[-1],NA()) -> NA() | V39: =IF(ISNA(RC[-1])=1,"",RC[-5]) ->  | W39: Madagascar | X39: MDG | Y39: -0.78591593904847179 | Z39: 0.37350218211437147 | AA39: =1.64*RC[-1] -> 0.61254357866756914 | AB39: =IF(EQUAL(VLOOKUP(RC[-4],R9C3:R186C4,2,0),1),RC[-1],NA()) -> NA() | AC39: =IF(ISNA(RC[-1])=1,"",RC[-5]) ->  | AD39: Papua New Guinea | AE39: PNG | AF39: -0.694273918478437 | AG39: 0.37414236442207388 | AH39: =1.64*RC[-1] -> 0.61359347765220118 | AI39: =IF(EQUAL(VLOOKUP(RC[-4],R9C3:R186C4,2,0),1),RC[-1],NA()) -> NA() | AJ39: =IF(ISNA(RC[-1])=1,"",RC[-5]) ->  | AK39: Kyrgyz Republic | AL39: KGZ | AM39: -0.75821284237391973 | AN39: 0.27178528950467506 | AO39: =1.64*RC[-1] -> 0.44572787478766707 | AP39: =IF(EQUAL(VLOOKUP(RC[-4],R9C3:R186C4,2,0),1),RC[-1],NA()) -> NA() | AQ39: =IF(ISNA(RC[-1])=1,"",RC[-5]) ->  | AR39: Uzbekistan | AS39: UZB | AT39: -0.86959972527619678 | AU39: 0.18666918154371528 | AV39: =1.64*RC[-1] -> 0.30613745773169304 | AW39: =IF(EQUAL(VLOOKUP(RC[-4],R9C3:R186C4,2,0),1),RC[-1],NA()) -> NA() | AX39: =IF(ISNA(RC[-1])=1,"",RC[-5]) ->  | AY39: Armenia | AZ39: ARM | BA39: -0.80318825754149814 | BB39: 0.23187454055691353 | BC39: =1.64*RC[-1] -> 0.38027424651333819 | BD39: =IF(EQUAL(VLOOKUP(RC[-4],R9C3:R186C4,2,0),1),RC[-1],NA()) -> NA() | BE39: =IF(ISNA(RC[-1])=1,"",RC[-5]) -> 
B40: Cote d'Ivoire | C40: CIV | D40: =IF(EQUAL(ComparativeCharts!R[11]C,""),"",1) ->  | O40: 33 | P40: Brunei | Q40: BRN | R40: -0.91947126614151831 | S40: 0.29137760175532934 | T40: =1.64*RC[-1] -> 0.47785926687874009 | U40: =IF(EQUAL(VLOOKUP(RC[-4],R9C3:R186C4,2,0),1),RC[-1],NA()) -> NA() | V40: =IF(ISNA(RC[-1])=1,"",RC[-5]) ->  | W40: Niger | X40: NER | Y40: -0.7628382851895269 | Z40: 0.41252284257447502 | AA40: =1.64*RC[-1] -> 0.67653746182213903 | AB40: =IF(EQUAL(VLOOKUP(RC[-4],R9C3:R186C4,2,0),1),RC[-1],NA()) -> NA() | AC40: =IF(ISNA(RC[-1])=1,"",RC[-5]) ->  | AD40: Belarus | AE40: BLR | AF40: -0.65892415792465864 | AG40: 0.29434619800260248 | AH40: =1.64*RC[-1] -> 0.48272776472426804 | AI40: =IF(EQUAL(VLOOKUP(RC[-4],R9C3:R186C4,2,0),1),RC[-1],NA()) -> NA() | AJ40: =IF(ISNA(RC[-1])=1,"",RC[-5]) ->  | AK40: Chad | AL40: TCD | AM40: -0.73958284851770884 | AN40: 0.59674094290048185 | AO40: =1.64*RC[-1] -> 0.97865514635679018 | AP40: =IF(EQUAL(VLOOKUP(RC[-4],R9C3:R186C4,2,0),1),RC[-1],NA()) -> NA() | AQ40: =IF(ISNA(RC[-1])=1,"",RC[-5]) ->  | AR40: Myanmar | AS40: MMR | AT40: -0.83880238362896342 | AU40: 0.27634968636657775 | AV40: =1.64*RC[-1] -> 0.45321348564118746 | AW40: =IF(EQUAL(VLOOKUP(RC[-4],R9C3:R186C4,2,0),1),RC[-1],NA()) -> NA() | AX40: =IF(ISNA(RC[-1])=1,"",RC[-5]) ->  | AY40: Indonesia | AZ40: IDN | BA40: -0.79885067750763072 | BB40: 0.16383974411547927 | BC40: =1.64*RC[-1] -> 0.268697180349386 | BD40: =IF(EQUAL(VLOOKUP(RC[-4],R9C3:R186C4,2,0),1),RC[-1],NA()) -> 0.268697180349386 | BE40: =IF(ISNA(RC[-1])=1,"",RC[-5]) -> IDN
B41: Cameroon | C41: CMR | D41: =IF(EQUAL(ComparativeCharts!R[11]C,""),"",1) ->  | O41: 34 | P41: Azerbaijan | Q41: AZE | R41: -0.91916406584670562 | S41: 0.25130023322348893 | T41: =1.64*RC[-1] -> 0.41213238248652184 | U41: =IF(EQUAL(VLOOKUP(RC[-4],R9C3:R186C4,2,0),1),RC[-1],NA()) -> NA() | V41: =IF(ISNA(RC[-1])=1,"",RC[-5]) ->  | W41: Georgia | X41: GEO | Y41: -0.76087740089029476 | Z41: 0.3067849652941122 | AA41: =1.64*RC[-1] -> 0.50312734308234397 | AB41: =IF(EQUAL(VLOOKUP(RC[-4],R9C3:R186C4,2,0),1),RC[-1],NA()) -> NA() | AC41: =IF(ISNA(RC[-1])=1,"",RC[-5]) ->  | AD41: Armenia | AE41: ARM | AF41: -0.65466184670493954 | AG41: 0.29434619800260248 | AH41: =1.64*RC[-1] -> 0.48272776472426804 | AI41: =IF(EQUAL(VLOOKUP(RC[-4],R9C3:R186C4,2,0),1),RC[-1],NA()) -> NA() | AJ41: =IF(ISNA(RC[-1])=1,"",RC[-5]) ->  | AK41: Ukraine | AL41: UKR | AM41: -0.7208292810791278 | AN41: 0.21645937618189412 | AO41: =1.64*RC[-1] -> 0.35499337693830635 | AP41: =IF(EQUAL(VLOOKUP(RC[-4],R9C3:R186C4,2,0),1),RC[-1],NA()) -> NA() | AQ41: =IF(ISNA(RC[-1])=1,"",RC[-5]) ->  | AR41: Chad | AS41: TCD | AT41: -0.82692029870495087 | AU41: 0.45038851528650714 | AV41: =1.64*RC[-1] -> 0.73863716506987165 | AW41: =IF(EQUAL(VLOOKUP(RC[-4],R9C3:R186C4,2,0),1),RC[-1],NA()) -> NA() | AX41: =IF(ISNA(RC[-1])=1,"",RC[-5]) ->  | AY41: Syrian Arab Republic | AZ41: SYR | BA41: -0.78875794703498525 | BB41: 0.26706317040829514 | BC41: =1.64*RC[-1] -> 0.43798359946960402 | BD41: =IF(EQUAL(VLOOKUP(RC[-4],R9C3:R186C4,2,0),1),RC[-1],NA()) -> NA() | BE41: =IF(ISNA(RC[-1])=1,"",RC[-5]) -> 
B42: Congo, Rep. | C42: COG | D42: =IF(EQUAL(ComparativeCharts!R[11]C,""),"",1) ->  | O42: 35 | P42: Cambodia | Q42: KHM | R42: -0.90877453388243046 | S42: 0.36031461549530619 | T42: =1.64*RC[-1] -> 0.59091596941230207 | U42: =IF(EQUAL(VLOOKUP(RC[-4],R9C3:R186C4,2,0),1),RC[-1],NA()) -> NA() | V42: =IF(ISNA(RC[-1])=1,"",RC[-5]) ->  | W42: Guatemala | X42: GTM | Y42: -0.75093366162234643 | Z42: 0.31873333373090551 | AA42: =1.64*RC[-1] -> 0.522722667318685 | AB42: =IF(EQUAL(VLOOKUP(RC[-4],R9C3:R186C4,2,0),1),RC[-1],NA()) -> NA() | AC42: =IF(ISNA(RC[-1])=1,"",RC[-5]) ->  | AD42: Albania | AE42: ALB | AF42: -0.65337260333753588 | AG42: 0.29434619800260248 | AH42: =1.64*RC[-1] -> 0.48272776472426804 | AI42: =IF(EQUAL(VLOOKUP(RC[-4],R9C3:R186C4,2,0),1),RC[-1],NA()) -> NA() | AJ42: =IF(ISNA(RC[-1])=1,"",RC[-5]) ->  | AK42: Angola | AL42: AGO | AM42: -0.70957546122155735 | AN42: 0.29177868538636526 | AO42: =1.64*RC[-1] -> 0.47851704403363898 | AP42: =IF(EQUAL(VLOOKUP(RC[-4],R9C3:R186C4,2,0),1),RC[-1],NA()) -> NA() | AQ42: =IF(ISNA(RC[-1])=1,"",RC[-5]) ->  | AR42: Madagascar | AS42: MDG | AT42: -0.82465534224967663 | AU42: 0.37135850669511394 | AV42: =1.64*RC[-1] -> 0.60902795097998685 | AW42: =IF(EQUAL(VLOOKUP(RC[-4],R9C3:R186C4,2,0),1),RC[-1],NA()) -> NA() | AX42: =IF(ISNA(RC[-1])=1,"",RC[-5]) ->  | AY42: Benin | AZ42: BEN | BA42: -0.78081476958594132 | BB42: 0.53653470441187612 | BC42: =1.64*RC[-1] -> 0.87991691523547677 | BD42: =IF(EQUAL(VLOOKUP(RC[-4],R9C3:R186C4,2,0),1),RC[-1],NA()) -> NA() | BE42: =IF(ISNA(RC[-1])=1,"",RC[-5]) -> 
B43: Colombia | C43: COL | D43: =IF(EQUAL(ComparativeCharts!R[11]C,""),"",1) ->  | O43: 36 | P43: Maldives | Q43: MDV | R43: -0.90877453388243046 | S43: 0.36031461549530619 | T43: =1.64*RC[-1] -> 0.59091596941230207 | U43: =IF(EQUAL(VLOOKUP(RC[-4],R9C3:R186C4,2,0),1),RC[-1],NA()) -> NA() | V43: =IF(ISNA(RC[-1])=1,"",RC[-5]) ->  | W43: Chad | X43: TCD | Y43: -0.73598574163300268 | Z43: 0.66053614439227493 | AA43: =1.64*RC[-1] -> 1.0832792768033308 | AB43: =IF(EQUAL(VLOOKUP(RC[-4],R9C3:R186C4,2,0),1),RC[-1],NA()) -> NA() | AC43: =IF(ISNA(RC[-1])=1,"",RC[-5]) ->  | AD43: Cameroon | AE43: CMR | AF43: -0.64472026125784931 | AG43: 0.24040796242376472 | AH43: =1.64*RC[-1] -> 0.39426905837497411 | AI43: =IF(EQUAL(VLOOKUP(RC[-4],R9C3:R186C4,2,0),1),RC[-1],NA()) -> NA() | AJ43: =IF(ISNA(RC[-1])=1,"",RC[-5]) ->  | AK43: Albania | AL43: ALB | AM43: -0.69955471858828977 | AN43: 0.2628266479146692 | AO43: =1.64*RC[-1] -> 0.43103570258005747 | AP43: =IF(EQUAL(VLOOKUP(RC[-4],R9C3:R186C4,2,0),1),RC[-1],NA()) -> NA() | AQ43: =IF(ISNA(RC[-1])=1,"",RC[-5]) ->  | AR43: Yugoslavia, FR (Serbia/Montenegro) | AS43: YUG | AT43: -0.80648725628816909 | AU43: 0.20351085401942651 | AV43: =1.64*RC[-1] -> 0.33375780059185944 | AW43: =IF(EQUAL(VLOOKUP(RC[-4],R9C3:R186C4,2,0),1),RC[-1],NA()) -> NA() | AX43: =IF(ISNA(RC[-1])=1,"",RC[-5]) ->  | AY43: Dominican Republic | AZ43: DOM | BA43: -0.77294803049288252 | BB43: 0.2961069418304243 | BC43: =1.64*RC[-1] -> 0.48561538460189579 | BD43: =IF(EQUAL(VLOOKUP(RC[-4],R9C3:R186C4,2,0),1),RC[-1],NA()) -> NA() | BE43: =IF(ISNA(RC[-1])=1,"",RC[-5]) -> 
B44: Comoros | C44: COM | D44: =IF(EQUAL(ComparativeCharts!R[11]C,""),"",1) ->  | O44: 37 | P44: Liberia | Q44: LBR | R44: -0.88839718686246949 | S44: 0.29137760175532934 | T44: =1.64*RC[-1] -> 0.47785926687874009 | U44: =IF(EQUAL(VLOOKUP(RC[-4],R9C3:R186C4,2,0),1),RC[-1],NA()) -> NA() | V44: =IF(ISNA(RC[-1])=1,"",RC[-5]) ->  | W44: Cameroon | X44: CMR | Y44: -0.72447531480138905 | Z44: 0.26599811359710124 | AA44: =1.64*RC[-1] -> 0.436236906299246 | AB44: =IF(EQUAL(VLOOKUP(RC[-4],R9C3:R186C4,2,0),1),RC[-1],NA()) -> NA() | AC44: =IF(ISNA(RC[-1])=1,"",RC[-5]) ->  | AD44: Malawi | AE44: MWI | AF44: -0.62483991921410775 | AG44: 0.23887449915105682 | AH44: =1.64*RC[-1] -> 0.39175417860773315 | AI44: =IF(EQUAL(VLOOKUP(RC[-4],R9C3:R186C4,2,0),1),RC[-1],NA()) -> NA() | AJ44: =IF(ISNA(RC[-1])=1,"",RC[-5]) ->  | AK44: Suriname | AL44: SUR | AM44: -0.5861104854996585 | AN44: 0.51994095831945863 | AO44: =1.64*RC[-1] -> 0.85270317164391207 | AP44: =IF(EQUAL(VLOOKUP(RC[-4],R9C3:R186C4,2,0),1),RC[-1],NA()) -> NA() | AQ44: =IF(ISNA(RC[-1])=1,"",RC[-5]) ->  | AR44: Togo | AS44: TGO | AT44: -0.7993851653092765 | AU44: 0.37135850669511394 | AV44: =1.64*RC[-1] -> 0.60902795097998685 | AW44: =IF(EQUAL(VLOOKUP(RC[-4],R9C3:R186C4,2,0),1),RC[-1],NA()) -> NA() | AX44: =IF(ISNA(RC[-1])=1,"",RC[-5]) ->  | AY44: Pakistan | AZ44: PAK | BA44: -0.7687928296646015 | BB44: 0.21583131268342742 | BC44: =1.64*RC[-1] -> 0.35396335280082097 | BD44: =IF(EQUAL(VLOOKUP(RC[-4],R9C3:R186C4,2,0),1),RC[-1],NA()) -> NA() | BE44: =IF(ISNA(RC[-1])=1,"",RC[-5]) -> 
B45: Cape verde | C45: CPV | D45: =IF(EQUAL(ComparativeCharts!R[11]C,""),"",1) ->  | O45: 38 | P45: Guinea | Q45: GIN | R45: -0.87291828281514883 | S45: 0.28728334123682875 | T45: =1.64*RC[-1] -> 0.47114467962839912 | U45: =IF(EQUAL(VLOOKUP(RC[-4],R9C3:R186C4,2,0),1),RC[-1],NA()) -> NA() | V45: =IF(ISNA(RC[-1])=1,"",RC[-5]) ->  | W45: Russian Federation | X45: RUS | Y45: -0.68595885159469128 | Z45: 0.21591513909296886 | AA45: =1.64*RC[-1] -> 0.3541008281124689 | AB45: =IF(EQUAL(VLOOKUP(RC[-4],R9C3:R186C4,2,0),1),RC[-1],NA()) -> NA() | AC45: =IF(ISNA(RC[-1])=1,"",RC[-5]) ->  | AD45: Yemen, Rep. | AE45: YEM | AF45: -0.62072069256285589 | AG45: 0.37414236442207388 | AH45: =1.64*RC[-1] -> 0.61359347765220118 | AI45: =IF(EQUAL(VLOOKUP(RC[-4],R9C3:R186C4,2,0),1),RC[-1],NA()) -> NA() | AJ45: =IF(ISNA(RC[-1])=1,"",RC[-5]) ->  | AK45: Armenia | AL45: ARM | AM45: -0.57031754777027643 | AN45: 0.2628266479146692 | AO45: =1.64*RC[-1] -> 0.43103570258005747 | AP45: =IF(EQUAL(VLOOKUP(RC[-4],R9C3:R186C4,2,0),1),RC[-1],NA()) -> NA() | AQ45: =IF(ISNA(RC[-1])=1,"",RC[-5]) ->  | AR45: Colombia | AS45: COL | AT45: -0.78325620684878594 | AU45: 0.20773727561581487 | AV45: =1.64*RC[-1] -> 0.34068913200993639 | AW45: =IF(EQUAL(VLOOKUP(RC[-4],R9C3:R186C4,2,0),1),RC[-1],NA()) -> NA() | AX45: =IF(ISNA(RC[-1])=1,"",RC[-5]) ->  | AY45: Kyrgyz Republic | AZ45: KGZ | BA45: -0.7634330568505423 | BB45: 0.23692223290035708 | BC45: =1.64*RC[-1] -> 0.3885524619565856 | BD45: =IF(EQUAL(VLOOKUP(RC[-4],R9C3:R186C4,2,0),1),RC[-1],NA()) -> NA() | BE45: =IF(ISNA(RC[-1])=1,"",RC[-5]) -> 
B46: Costa Rica | C46: CRI | D46: =IF(EQUAL(ComparativeCharts!R[11]C,""),"",1) ->  | O46: 39 | P46: Turkey | Q46: TUR | R46: -0.85927816487445785 | S46: 0.25130023322348893 | T46: =1.64*RC[-1] -> 0.41213238248652184 | U46: =IF(EQUAL(VLOOKUP(RC[-4],R9C3:R186C4,2,0),1),RC[-1],NA()) -> NA() | V46: =IF(ISNA(RC[-1])=1,"",RC[-5]) ->  | W46: Pakistan | X46: PAK | Y46: -0.65410384511708519 | Z46: 0.26334453452009404 | AA46: =1.64*RC[-1] -> 0.43188503661295419 | AB46: =IF(EQUAL(VLOOKUP(RC[-4],R9C3:R186C4,2,0),1),RC[-1],NA()) -> NA() | AC46: =IF(ISNA(RC[-1])=1,"",RC[-5]) ->  | AD46: Sri Lanka | AE46: LKA | AF46: -0.61167805037031042 | AG46: 0.31908959204123422 | AH46: =1.64*RC[-1] -> 0.52330693094762404 | AI46: =IF(EQUAL(VLOOKUP(RC[-4],R9C3:R186C4,2,0),1),RC[-1],NA()) -> NA() | AJ46: =IF(ISNA(RC[-1])=1,"",RC[-5]) ->  | AK46: Niger | AL46: NER | AM46: -0.52300524426155071 | AN46: 0.51994095831945863 | AO46: =1.64*RC[-1] -> 0.85270317164391207 | AP46: =IF(EQUAL(VLOOKUP(RC[-4],R9C3:R186C4,2,0),1),RC[-1],NA()) -> NA() | AQ46: =IF(ISNA(RC[-1])=1,"",RC[-5]) ->  | AR46: Guinea | AS46: GIN | AT46: -0.76168084755210386 | AU46: 0.37135850669511394 | AV46: =1.64*RC[-1] -> 0.60902795097998685 | AW46: =IF(EQUAL(VLOOKUP(RC[-4],R9C3:R186C4,2,0),1),RC[-1],NA()) -> NA() | AX46: =IF(ISNA(RC[-1])=1,"",RC[-5]) ->  | AY46: Georgia | AZ46: GEO | BA46: -0.7436548624197602 | BB46: 0.23692223290035708 | BC46: =1.64*RC[-1] -> 0.3885524619565856 | BD46: =IF(EQUAL(VLOOKUP(RC[-4],R9C3:R186C4,2,0),1),RC[-1],NA()) -> NA() | BE46: =IF(ISNA(RC[-1])=1,"",RC[-5]) -> 
B47: Cuba | C47: CUB | D47: =IF(EQUAL(ComparativeCharts!R[11]C,""),"",1) ->  | O47: 40 | P47: Chad | Q47: TCD | R47: -0.8536909848635158 | S47: 0.35265752232120906 | T47: =1.64*RC[-1] -> 0.57835833660678282 | U47: =IF(EQUAL(VLOOKUP(RC[-4],R9C3:R186C4,2,0),1),RC[-1],NA()) -> NA() | V47: =IF(ISNA(RC[-1])=1,"",RC[-5]) ->  | W47: Paraguay | X47: PRY | Y47: -0.57093027742656233 | Z47: 0.31915287616104948 | AA47: =1.64*RC[-1] -> 0.52341071690412111 | AB47: =IF(EQUAL(VLOOKUP(RC[-4],R9C3:R186C4,2,0),1),RC[-1],NA()) -> NA() | AC47: =IF(ISNA(RC[-1])=1,"",RC[-5]) ->  | AD47: Russian Federation | AE47: RUS | AF47: -0.59451526229779705 | AG47: 0.20697929466807191 | AH47: =1.64*RC[-1] -> 0.33944604325563793 | AI47: =IF(EQUAL(VLOOKUP(RC[-4],R9C3:R186C4,2,0),1),RC[-1],NA()) -> NA() | AJ47: =IF(ISNA(RC[-1])=1,"",RC[-5]) ->  | AK47: Yemen, Rep. | AL47: YEM | AM47: -0.52300524426155071 | AN47: 0.51994095831945863 | AO47: =1.64*RC[-1] -> 0.85270317164391207 | AP47: =IF(EQUAL(VLOOKUP(RC[-4],R9C3:R186C4,2,0),1),RC[-1],NA()) -> NA() | AQ47: =IF(ISNA(RC[-1])=1,"",RC[-5]) ->  | AR47: Pakistan | AS47: PAK | AT47: -0.76036473709330121 | AU47: 0.23542062698000482 | AV47: =1.64*RC[-1] -> 0.38608982824720789 | AW47: =IF(EQUAL(VLOOKUP(RC[-4],R9C3:R186C4,2,0),1),RC[-1],NA()) -> NA() | AX47: =IF(ISNA(RC[-1])=1,"",RC[-5]) ->  | AY47: Venezuela, RB | AZ47: VEN | BA47: -0.72488576250163439 | BB47: 0.19620820843666348 | BC47: =1.64*RC[-1] -> 0.3217814618361281 | BD47: =IF(EQUAL(VLOOKUP(RC[-4],R9C3:R186C4,2,0),1),RC[-1],NA()) -> NA() | BE47: =IF(ISNA(RC[-1])=1,"",RC[-5]) -> 
B48: Cyprus | C48: CYP | D48: =IF(EQUAL(ComparativeCharts!R[11]C,""),"",1) ->  | O48: 41 | P48: Swaziland | Q48: SWZ | R48: -0.77760731483085266 | S48: 0.36031461549530619 | T48: =1.64*RC[-1] -> 0.59091596941230207 | U48: =IF(EQUAL(VLOOKUP(RC[-4],R9C3:R186C4,2,0),1),RC[-1],NA()) -> NA() | V48: =IF(ISNA(RC[-1])=1,"",RC[-5]) ->  | W48: Gabon | X48: GAB | Y48: -0.5613348284275238 | Z48: 0.34248229323012747 | AA48: =1.64*RC[-1] -> 0.56167096089740898 | AB48: =IF(EQUAL(VLOOKUP(RC[-4],R9C3:R186C4,2,0),1),RC[-1],NA()) -> NA() | AC48: =IF(ISNA(RC[-1])=1,"",RC[-5]) ->  | AD48: Congo, Rep. | AE48: COG | AF48: -0.58049981388382377 | AG48: 0.38512328444152177 | AH48: =1.64*RC[-1] -> 0.63160218648409572 | AI48: =IF(EQUAL(VLOOKUP(RC[-4],R9C3:R186C4,2,0),1),RC[-1],NA()) -> NA() | AJ48: =IF(ISNA(RC[-1])=1,"",RC[-5]) ->  | AK48: Djibouti | AL48: DJI | AM48: -0.52179681550604728 | AN48: 0.60188084442426626 | AO48: =1.64*RC[-1] -> 0.98708458485579664 | AP48: =IF(EQUAL(VLOOKUP(RC[-4],R9C3:R186C4,2,0),1),RC[-1],NA()) -> NA() | AQ48: =IF(ISNA(RC[-1])=1,"",RC[-5]) ->  | AR48: Suriname | AS48: SUR | AT48: -0.72977513266813221 | AU48: 0.44307336250641616 | AV48: =1.64*RC[-1] -> 0.72664031451052247 | AW48: =IF(EQUAL(VLOOKUP(RC[-4],R9C3:R186C4,2,0),1),RC[-1],NA()) -> NA() | AX48: =IF(ISNA(RC[-1])=1,"",RC[-5]) ->  | AY48: Belarus | AZ48: BLR | BA48: -0.6536239410710486 | BB48: 0.22037559601784598 | BC48: =1.64*RC[-1] -> 0.3614159774692674 | BD48: =IF(EQUAL(VLOOKUP(RC[-4],R9C3:R186C4,2,0),1),RC[-1],NA()) -> NA() | BE48: =IF(ISNA(RC[-1])=1,"",RC[-5]) -> 
B49: Czech Republic | C49: CZE | D49: =IF(EQUAL(ComparativeCharts!R[11]C,""),"",1) ->  | O49: 42 | P49: Qatar | Q49: QAT | R49: -0.7754924224585511 | S49: 0.25402694431067208 | T49: =1.64*RC[-1] -> 0.41660418866950216 | U49: =IF(EQUAL(VLOOKUP(RC[-4],R9C3:R186C4,2,0),1),RC[-1],NA()) -> NA() | V49: =IF(ISNA(RC[-1])=1,"",RC[-5]) ->  | W49: Zimbabwe | X49: ZWE | Y49: -0.54150705210054539 | Z49: 0.26987977601169244 | AA49: =1.64*RC[-1] -> 0.44260283265917555 | AB49: =IF(EQUAL(VLOOKUP(RC[-4],R9C3:R186C4,2,0),1),RC[-1],NA()) -> NA() | AC49: =IF(ISNA(RC[-1])=1,"",RC[-5]) ->  | AD49: Macedonia, FYR | AE49: MKD | AF49: -0.57644704620037512 | AG49: 0.27097612053564685 | AH49: =1.64*RC[-1] -> 0.44440083767846078 | AI49: =IF(EQUAL(VLOOKUP(RC[-4],R9C3:R186C4,2,0),1),RC[-1],NA()) -> NA() | AJ49: =IF(ISNA(RC[-1])=1,"",RC[-5]) ->  | AK49: Vietnam | AL49: VNM | AM49: -0.45879331168115195 | AN49: 0.27454340772656499 | AO49: =1.64*RC[-1] -> 0.45025118867156655 | AP49: =IF(EQUAL(VLOOKUP(RC[-4],R9C3:R186C4,2,0),1),RC[-1],NA()) -> NA() | AQ49: =IF(ISNA(RC[-1])=1,"",RC[-5]) ->  | AR49: Jamaica | AS49: JAM | AT49: -0.72791715843231453 | AU49: 0.28505666681472658 | AV49: =1.64*RC[-1] -> 0.46749293357615157 | AW49: =IF(EQUAL(VLOOKUP(RC[-4],R9C3:R186C4,2,0),1),RC[-1],NA()) -> 0.46749293357615157 | AX49: =IF(ISNA(RC[-1])=1,"",RC[-5]) -> JAM | AY49: Kenya | AZ49: KEN | BA49: -0.65138037733086418 | BB49: 0.21052052859001816 | BC49: =1.64*RC[-1] -> 0.34525366688762976 | BD49: =IF(EQUAL(VLOOKUP(RC[-4],R9C3:R186C4,2,0),1),RC[-1],NA()) -> NA() | BE49: =IF(ISNA(RC[-1])=1,"",RC[-5]) -> 
B50: Germany | C50: DEU | D50: =IF(EQUAL(ComparativeCharts!R[11]C,""),"",1) ->  | O50: 43 | P50: Congo, Rep. | Q50: COG | R50: -0.77349506692813785 | S50: 0.28728334123682875 | T50: =1.64*RC[-1] -> 0.47114467962839912 | U50: =IF(EQUAL(VLOOKUP(RC[-4],R9C3:R186C4,2,0),1),RC[-1],NA()) -> NA() | V50: =IF(ISNA(RC[-1])=1,"",RC[-5]) ->  | W50: Mozambique | X50: MOZ | Y50: -0.52901825603331909 | Z50: 0.33539465361595089 | AA50: =1.64*RC[-1] -> 0.55004723193015947 | AB50: =IF(EQUAL(VLOOKUP(RC[-4],R9C3:R186C4,2,0),1),RC[-1],NA()) -> NA() | AC50: =IF(ISNA(RC[-1])=1,"",RC[-5]) ->  | AD50: Kyrgyz Republic | AE50: KGZ | AF50: -0.57516891650413859 | AG50: 0.30362504626293219 | AH50: =1.64*RC[-1] -> 0.49794507587120873 | AI50: =IF(EQUAL(VLOOKUP(RC[-4],R9C3:R186C4,2,0),1),RC[-1],NA()) -> NA() | AJ50: =IF(ISNA(RC[-1])=1,"",RC[-5]) ->  | AK50: Kazakhstan | AL50: KAZ | AM50: -0.40462373340795066 | AN50: 0.2628266479146692 | AO50: =1.64*RC[-1] -> 0.43103570258005747 | AP50: =IF(EQUAL(VLOOKUP(RC[-4],R9C3:R186C4,2,0),1),RC[-1],NA()) -> NA() | AQ50: =IF(ISNA(RC[-1])=1,"",RC[-5]) ->  | AR50: Nicaragua | AS50: NIC | AT50: -0.72578088856461132 | AU50: 0.27756710773103799 | AV50: =1.64*RC[-1] -> 0.4552100566789023 | AW50: =IF(EQUAL(VLOOKUP(RC[-4],R9C3:R186C4,2,0),1),RC[-1],NA()) -> NA() | AX50: =IF(ISNA(RC[-1])=1,"",RC[-5]) ->  | AY50: Russian Federation | AZ50: RUS | BA50: -0.61641792467909373 | BB50: 0.15872427647504828 | BC50: =1.64*RC[-1] -> 0.26030781341907916 | BD50: =IF(EQUAL(VLOOKUP(RC[-4],R9C3:R186C4,2,0),1),RC[-1],NA()) -> NA() | BE50: =IF(ISNA(RC[-1])=1,"",RC[-5]) -> 
B51: Djibouti | C51: DJI | D51: =IF(EQUAL(ComparativeCharts!R[11]C,""),"",1) ->  | O51: 44 | P51: Niger | Q51: NER | R51: -0.74407418144318294 | S51: 0.29137760175532934 | T51: =1.64*RC[-1] -> 0.47785926687874009 | U51: =IF(EQUAL(VLOOKUP(RC[-4],R9C3:R186C4,2,0),1),RC[-1],NA()) -> NA() | V51: =IF(ISNA(RC[-1])=1,"",RC[-5]) ->  | W51: Peru | X51: PER | Y51: -0.52896037657762063 | Z51: 0.25228486761247954 | AA51: =1.64*RC[-1] -> 0.41374718288446644 | AB51: =IF(EQUAL(VLOOKUP(RC[-4],R9C3:R186C4,2,0),1),RC[-1],NA()) -> NA() | AC51: =IF(ISNA(RC[-1])=1,"",RC[-5]) ->  | AD51: Romania | AE51: ROM | AF51: -0.56954870964168658 | AG51: 0.25955068050331376 | AH51: =1.64*RC[-1] -> 0.42566311602543455 | AI51: =IF(EQUAL(VLOOKUP(RC[-4],R9C3:R186C4,2,0),1),RC[-1],NA()) -> NA() | AJ51: =IF(ISNA(RC[-1])=1,"",RC[-5]) ->  | AK51: Fiji | AL51: FJI | AM51: -0.36870348851870793 | AN51: 0.59674094290048185 | AO51: =1.64*RC[-1] -> 0.97865514635679018 | AP51: =IF(EQUAL(VLOOKUP(RC[-4],R9C3:R186C4,2,0),1),RC[-1],NA()) -> NA() | AQ51: =IF(ISNA(RC[-1])=1,"",RC[-5]) ->  | AR51: Russian Federation | AS51: RUS | AT51: -0.72236150218120643 | AU51: 0.16025055709462124 | AV51: =1.64*RC[-1] -> 0.26281091363517883 | AW51: =IF(EQUAL(VLOOKUP(RC[-4],R9C3:R186C4,2,0),1),RC[-1],NA()) -> NA() | AX51: =IF(ISNA(RC[-1])=1,"",RC[-5]) ->  | AY51: Zambia | AZ51: ZMB | BA51: -0.6142791178455218 | BB51: 0.21052052859001816 | BC51: =1.64*RC[-1] -> 0.34525366688762976 | BD51: =IF(EQUAL(VLOOKUP(RC[-4],R9C3:R186C4,2,0),1),RC[-1],NA()) -> NA() | BE51: =IF(ISNA(RC[-1])=1,"",RC[-5]) -> 
B52: Denmark | C52: DNK | D52: =IF(EQUAL(ComparativeCharts!R[11]C,""),"",1) ->  | O52: 45 | P52: Kazakhstan | Q52: KAZ | R52: -0.71167175278375816 | S52: 0.25130023322348893 | T52: =1.64*RC[-1] -> 0.41213238248652184 | U52: =IF(EQUAL(VLOOKUP(RC[-4],R9C3:R186C4,2,0),1),RC[-1],NA()) -> NA() | V52: =IF(ISNA(RC[-1])=1,"",RC[-5]) ->  | W52: South Africa | X52: ZAF | Y52: -0.52679181353041893 | Z52: 0.23950497539410898 | AA52: =1.64*RC[-1] -> 0.39278815964633867 | AB52: =IF(EQUAL(VLOOKUP(RC[-4],R9C3:R186C4,2,0),1),RC[-1],NA()) -> NA() | AC52: =IF(ISNA(RC[-1])=1,"",RC[-5]) ->  | AD52: Bangladesh | AE52: BGD | AF52: -0.56460822499449281 | AG52: 0.31908959204123422 | AH52: =1.64*RC[-1] -> 0.52330693094762404 | AI52: =IF(EQUAL(VLOOKUP(RC[-4],R9C3:R186C4,2,0),1),RC[-1],NA()) -> NA() | AJ52: =IF(ISNA(RC[-1])=1,"",RC[-5]) ->  | AK52: Nepal | AL52: NPL | AM52: -0.35978650199732215 | AN52: 0.60188084442426626 | AO52: =1.64*RC[-1] -> 0.98708458485579664 | AP52: =IF(EQUAL(VLOOKUP(RC[-4],R9C3:R186C4,2,0),1),RC[-1],NA()) -> NA() | AQ52: =IF(ISNA(RC[-1])=1,"",RC[-5]) ->  | AR52: Ecuador | AS52: ECU | AT52: -0.72110340972729547 | AU52: 0.23993859603447193 | AV52: =1.64*RC[-1] -> 0.39349929749653395 | AW52: =IF(EQUAL(VLOOKUP(RC[-4],R9C3:R186C4,2,0),1),RC[-1],NA()) -> NA() | AX52: =IF(ISNA(RC[-1])=1,"",RC[-5]) ->  | AY52: Congo, Rep. | AZ52: COG | BA52: -0.59620407771087591 | BB52: 0.48462245571009516 | BC52: =1.64*RC[-1] -> 0.79478082736455602 | BD52: =IF(EQUAL(VLOOKUP(RC[-4],R9C3:R186C4,2,0),1),RC[-1],NA()) -> NA() | BE52: =IF(ISNA(RC[-1])=1,"",RC[-5]) -> 
B53: Dominican Republic | C53: DOM | D53: =IF(EQUAL(ComparativeCharts!R[11]C,""),"",1) ->  | O53: 46 | P53: Haiti | Q53: HTI | R53: -0.70901368699821721 | S53: 0.29137760175532934 | T53: =1.64*RC[-1] -> 0.47785926687874009 | U53: =IF(EQUAL(VLOOKUP(RC[-4],R9C3:R186C4,2,0),1),RC[-1],NA()) -> NA() | V53: =IF(ISNA(RC[-1])=1,"",RC[-5]) ->  | W53: Burkina Faso | X53: BFA | Y53: -0.51662099737905565 | Z53: 0.36279173932405639 | AA53: =1.64*RC[-1] -> 0.59497845249145243 | AB53: =IF(EQUAL(VLOOKUP(RC[-4],R9C3:R186C4,2,0),1),RC[-1],NA()) -> NA() | AC53: =IF(ISNA(RC[-1])=1,"",RC[-5]) ->  | AD53: Ecuador | AE53: ECU | AF53: -0.56196095952597636 | AG53: 0.26673890715924847 | AH53: =1.64*RC[-1] -> 0.43745180774116749 | AI53: =IF(EQUAL(VLOOKUP(RC[-4],R9C3:R186C4,2,0),1),RC[-1],NA()) -> NA() | AJ53: =IF(ISNA(RC[-1])=1,"",RC[-5]) ->  | AK53: Nigeria | AL53: NGA | AM53: -0.35159944173553426 | AN53: 0.29118732384969281 | AO53: =1.64*RC[-1] -> 0.47754721111349618 | AP53: =IF(EQUAL(VLOOKUP(RC[-4],R9C3:R186C4,2,0),1),RC[-1],NA()) -> NA() | AQ53: =IF(ISNA(RC[-1])=1,"",RC[-5]) ->  | AR53: Ukraine | AS53: UKR | AT53: -0.70745607973327396 | AU53: 0.16673961587268077 | AV53: =1.64*RC[-1] -> 0.27345297003119645 | AW53: =IF(EQUAL(VLOOKUP(RC[-4],R9C3:R186C4,2,0),1),RC[-1],NA()) -> NA() | AX53: =IF(ISNA(RC[-1])=1,"",RC[-5]) ->  | AY53: Chad | AZ53: TCD | BA53: -0.58700797207725153 | BB53: 0.53653470441187612 | BC53: =1.64*RC[-1] -> 0.87991691523547677 | BD53: =IF(EQUAL(VLOOKUP(RC[-4],R9C3:R186C4,2,0),1),RC[-1],NA()) -> NA() | BE53: =IF(ISNA(RC[-1])=1,"",RC[-5]) -> 
B54: Algeria | C54: DZA | D54: =IF(EQUAL(ComparativeCharts!R[11]C,""),"",1) ->  | O54: 47 | P54: Cameroon | Q54: CMR | R54: -0.70288316235523962 | S54: 0.25130023322348893 | T54: =1.64*RC[-1] -> 0.41213238248652184 | U54: =IF(EQUAL(VLOOKUP(RC[-4],R9C3:R186C4,2,0),1),RC[-1],NA()) -> NA() | V54: =IF(ISNA(RC[-1])=1,"",RC[-5]) ->  | W54: Ecuador | X54: ECU | Y54: -0.4671725980075116 | Z54: 0.26358101441282383 | AA54: =1.64*RC[-1] -> 0.43227286363703105 | AB54: =IF(EQUAL(VLOOKUP(RC[-4],R9C3:R186C4,2,0),1),RC[-1],NA()) -> NA() | AC54: =IF(ISNA(RC[-1])=1,"",RC[-5]) ->  | AD54: Nicaragua | AE54: NIC | AF54: -0.54716746752991341 | AG54: 0.37414236442207388 | AH54: =1.64*RC[-1] -> 0.61359347765220118 | AI54: =IF(EQUAL(VLOOKUP(RC[-4],R9C3:R186C4,2,0),1),RC[-1],NA()) -> NA() | AJ54: =IF(ISNA(RC[-1])=1,"",RC[-5]) ->  | AK54: Zimbabwe | AL54: ZWE | AM54: -0.34099621931536372 | AN54: 0.23149631694168502 | AO54: =1.64*RC[-1] -> 0.37965395978436339 | AP54: =IF(EQUAL(VLOOKUP(RC[-4],R9C3:R186C4,2,0),1),RC[-1],NA()) -> NA() | AQ54: =IF(ISNA(RC[-1])=1,"",RC[-5]) ->  | AR54: Paraguay | AS54: PRY | AT54: -0.69547095796788361 | AU54: 0.28505666681472658 | AV54: =1.64*RC[-1] -> 0.46749293357615157 | AW54: =IF(EQUAL(VLOOKUP(RC[-4],R9C3:R186C4,2,0),1),RC[-1],NA()) -> NA() | AX54: =IF(ISNA(RC[-1])=1,"",RC[-5]) ->  | AY54: Saudi Arabia | AZ54: SAU | BA54: -0.57535118438246402 | BB54: 0.26094287716947417 | BC54: =1.64*RC[-1] -> 0.42794631855793763 | BD54: =IF(EQUAL(VLOOKUP(RC[-4],R9C3:R186C4,2,0),1),RC[-1],NA()) -> NA() | BE54: =IF(ISNA(RC[-1])=1,"",RC[-5]) -> 
B55: Ecuador | C55: ECU | D55: =IF(EQUAL(ComparativeCharts!R[11]C,""),"",1) ->  | O55: 48 | P55: Kenya | Q55: KEN | R55: -0.70122076977314185 | S55: 0.25130023322348893 | T55: =1.64*RC[-1] -> 0.41213238248652184 | U55: =IF(EQUAL(VLOOKUP(RC[-4],R9C3:R186C4,2,0),1),RC[-1],NA()) -> NA() | V55: =IF(ISNA(RC[-1])=1,"",RC[-5]) ->  | W55: Israel | X55: ISR | Y55: -0.45502349107240048 | Z55: 0.28355035712187776 | AA55: =1.64*RC[-1] -> 0.46502258567987947 | AB55: =IF(EQUAL(VLOOKUP(RC[-4],R9C3:R186C4,2,0),1),RC[-1],NA()) -> NA() | AC55: =IF(ISNA(RC[-1])=1,"",RC[-5]) ->  | AD55: Indonesia | AE55: IDN | AF55: -0.52826279516855079 | AG55: 0.24866131188801807 | AH55: =1.64*RC[-1] -> 0.40780455149634959 | AI55: =IF(EQUAL(VLOOKUP(RC[-4],R9C3:R186C4,2,0),1),RC[-1],NA()) -> 0.40780455149634959 | AJ55: =IF(ISNA(RC[-1])=1,"",RC[-5]) -> IDN | AK55: Senegal | AL55: SEN | AM55: -0.33769085919806557 | AN55: 0.51661669269246691 | AO55: =1.64*RC[-1] -> 0.84725137601564571 | AP55: =IF(EQUAL(VLOOKUP(RC[-4],R9C3:R186C4,2,0),1),RC[-1],NA()) -> NA() | AQ55: =IF(ISNA(RC[-1])=1,"",RC[-5]) ->  | AR55: Korea, Dem. Rep. | AS55: PRK | AT55: -0.6671683887243075 | AU55: 0.44307336250641616 | AV55: =1.64*RC[-1] -> 0.72664031451052247 | AW55: =IF(EQUAL(VLOOKUP(RC[-4],R9C3:R186C4,2,0),1),RC[-1],NA()) -> NA() | AX55: =IF(ISNA(RC[-1])=1,"",RC[-5]) ->  | AY55: Bulgaria | AZ55: BGR | BA55: -0.55715205457466677 | BB55: 0.18193276470480088 | BC55: =1.64*RC[-1] -> 0.29836973411587342 | BD55: =IF(EQUAL(VLOOKUP(RC[-4],R9C3:R186C4,2,0),1),RC[-1],NA()) -> NA() | BE55: =IF(ISNA(RC[-1])=1,"",RC[-5]) -> 
B56: Egypt, Arab Rep. | C56: EGY | D56: =IF(EQUAL(ComparativeCharts!R[11]C,""),"",1) ->  | O56: 49 | P56: Peru | Q56: PER | R56: -0.68724884449783386 | S56: 0.25130023322348893 | T56: =1.64*RC[-1] -> 0.41213238248652184 | U56: =IF(EQUAL(VLOOKUP(RC[-4],R9C3:R186C4,2,0),1),RC[-1],NA()) -> NA() | V56: =IF(ISNA(RC[-1])=1,"",RC[-5]) ->  | W56: Armenia | X56: ARM | Y56: -0.45457877288103288 | Z56: 0.25398901430107884 | AA56: =1.64*RC[-1] -> 0.41654198345376925 | AB56: =IF(EQUAL(VLOOKUP(RC[-4],R9C3:R186C4,2,0),1),RC[-1],NA()) -> NA() | AC56: =IF(ISNA(RC[-1])=1,"",RC[-5]) ->  | AD56: Georgia | AE56: GEO | AF56: -0.5120820036059115 | AG56: 0.30362504626293219 | AH56: =1.64*RC[-1] -> 0.49794507587120873 | AI56: =IF(EQUAL(VLOOKUP(RC[-4],R9C3:R186C4,2,0),1),RC[-1],NA()) -> NA() | AJ56: =IF(ISNA(RC[-1])=1,"",RC[-5]) ->  | AK56: Macedonia, FYR | AL56: MKD | AM56: -0.31189210410696011 | AN56: 0.33194513119796099 | AO56: =1.64*RC[-1] -> 0.54439001516465602 | AP56: =IF(EQUAL(VLOOKUP(RC[-4],R9C3:R186C4,2,0),1),RC[-1],NA()) -> NA() | AQ56: =IF(ISNA(RC[-1])=1,"",RC[-5]) ->  | AR56: Venezuela, RB | AS56: VEN | AT56: -0.66155782738474467 | AU56: 0.20773727561581487 | AV56: =1.64*RC[-1] -> 0.34068913200993639 | AW56: =IF(EQUAL(VLOOKUP(RC[-4],R9C3:R186C4,2,0),1),RC[-1],NA()) -> NA() | AX56: =IF(ISNA(RC[-1])=1,"",RC[-5]) ->  | AY56: Mozambique | AZ56: MOZ | BA56: -0.5349201274214308 | BB56: 0.31118020705322125 | BC56: =1.64*RC[-1] -> 0.51033553956728284 | BD56: =IF(EQUAL(VLOOKUP(RC[-4],R9C3:R186C4,2,0),1),RC[-1],NA()) -> NA() | BE56: =IF(ISNA(RC[-1])=1,"",RC[-5]) -> 
B57: Eritrea | C57: ERI | D57: =IF(EQUAL(ComparativeCharts!R[11]C,""),"",1) ->  | O57: 50 | P57: Egypt, Arab Rep. | Q57: EGY | R57: -0.67439273995563587 | S57: 0.25402694431067208 | T57: =1.64*RC[-1] -> 0.41660418866950216 | U57: =IF(EQUAL(VLOOKUP(RC[-4],R9C3:R186C4,2,0),1),RC[-1],NA()) -> NA() | V57: =IF(ISNA(RC[-1])=1,"",RC[-5]) ->  | W57: Macedonia, FYR | X57: MKD | Y57: -0.39950662762489403 | Z57: 0.30599419168130026 | AA57: =1.64*RC[-1] -> 0.50183047435733241 | AB57: =IF(EQUAL(VLOOKUP(RC[-4],R9C3:R186C4,2,0),1),RC[-1],NA()) -> NA() | AC57: =IF(ISNA(RC[-1])=1,"",RC[-5]) ->  | AD57: Cuba | AE57: CUB | AF57: -0.49710152180538369 | AG57: 0.31908959204123422 | AH57: =1.64*RC[-1] -> 0.52330693094762404 | AI57: =IF(EQUAL(VLOOKUP(RC[-4],R9C3:R186C4,2,0),1),RC[-1],NA()) -> NA() | AJ57: =IF(ISNA(RC[-1])=1,"",RC[-5]) ->  | AK57: Russian Federation | AL57: RUS | AM57: -0.30305446213512316 | AN57: 0.19196454475476876 | AO57: =1.64*RC[-1] -> 0.31482185339782076 | AP57: =IF(EQUAL(VLOOKUP(RC[-4],R9C3:R186C4,2,0),1),RC[-1],NA()) -> NA() | AQ57: =IF(ISNA(RC[-1])=1,"",RC[-5]) ->  | AR57: El Salvador | AS57: SLV | AT57: -0.65636467144354793 | AU57: 0.27756710773103799 | AV57: =1.64*RC[-1] -> 0.4552100566789023 | AW57: =IF(EQUAL(VLOOKUP(RC[-4],R9C3:R186C4,2,0),1),RC[-1],NA()) -> NA() | AX57: =IF(ISNA(RC[-1])=1,"",RC[-5]) ->  | AY57: Haiti | AZ57: HTI | BA57: -0.53471452504134276 | BB57: 0.74867439619943676 | BC57: =1.64*RC[-1] -> 1.2278260097670761 | BD57: =IF(EQUAL(VLOOKUP(RC[-4],R9C3:R186C4,2,0),1),RC[-1],NA()) -> NA() | BE57: =IF(ISNA(RC[-1])=1,"",RC[-5]) -> 
B58: Spain | C58: ESP | D58: =IF(EQUAL(ComparativeCharts!R[11]C,""),"",1) ->  | O58: 51 | P58: Zimbabwe | Q58: ZWE | R58: -0.66562744945478791 | S58: 0.25130023322348893 | T58: =1.64*RC[-1] -> 0.41213238248652184 | U58: =IF(EQUAL(VLOOKUP(RC[-4],R9C3:R186C4,2,0),1),RC[-1],NA()) -> NA() | V58: =IF(ISNA(RC[-1])=1,"",RC[-5]) ->  | W58: Bangladesh | X58: BGD | Y58: -0.39823441227794426 | Z58: 0.29988188904282925 | AA58: =1.64*RC[-1] -> 0.49180629803023995 | AB58: =IF(EQUAL(VLOOKUP(RC[-4],R9C3:R186C4,2,0),1),RC[-1],NA()) -> NA() | AC58: =IF(ISNA(RC[-1])=1,"",RC[-5]) ->  | AD58: Tanzania | AE58: TZA | AF58: -0.48533728473468646 | AG58: 0.22248178800615603 | AH58: =1.64*RC[-1] -> 0.36487013233009585 | AI58: =IF(EQUAL(VLOOKUP(RC[-4],R9C3:R186C4,2,0),1),RC[-1],NA()) -> NA() | AJ58: =IF(ISNA(RC[-1])=1,"",RC[-5]) ->  | AK58: Moldova | AL58: MDA | AM58: -0.28062880406258917 | AN58: 0.2628266479146692 | AO58: =1.64*RC[-1] -> 0.43103570258005747 | AP58: =IF(EQUAL(VLOOKUP(RC[-4],R9C3:R186C4,2,0),1),RC[-1],NA()) -> NA() | AQ58: =IF(ISNA(RC[-1])=1,"",RC[-5]) ->  | AR58: Kazakhstan | AS58: KAZ | AT58: -0.58966304878786713 | AU58: 0.1737147180010194 | AV58: =1.64*RC[-1] -> 0.28489213752167181 | AW58: =IF(EQUAL(VLOOKUP(RC[-4],R9C3:R186C4,2,0),1),RC[-1],NA()) -> NA() | AX58: =IF(ISNA(RC[-1])=1,"",RC[-5]) ->  | AY58: Korea, Dem. Rep. | AZ58: PRK | BA58: -0.53471452504134276 | BB58: 0.74867439619943676 | BC58: =1.64*RC[-1] -> 1.2278260097670761 | BD58: =IF(EQUAL(VLOOKUP(RC[-4],R9C3:R186C4,2,0),1),RC[-1],NA()) -> NA() | BE58: =IF(ISNA(RC[-1])=1,"",RC[-5]) -> 
B59: Estonia | C59: EST | D59: =IF(EQUAL(ComparativeCharts!R[11]C,""),"",1) ->  | O59: 52 | P59: Djibouti | Q59: DJI | R59: -0.60156709782588746 | S59: 0.36031461549530619 | T59: =1.64*RC[-1] -> 0.59091596941230207 | U59: =IF(EQUAL(VLOOKUP(RC[-4],R9C3:R186C4,2,0),1),RC[-1],NA()) -> NA() | V59: =IF(ISNA(RC[-1])=1,"",RC[-5]) ->  | W59: Papua New Guinea | X59: PNG | Y59: -0.39766451590283747 | Z59: 0.34248229323012747 | AA59: =1.64*RC[-1] -> 0.56167096089740898 | AB59: =IF(EQUAL(VLOOKUP(RC[-4],R9C3:R186C4,2,0),1),RC[-1],NA()) -> NA() | AC59: =IF(ISNA(RC[-1])=1,"",RC[-5]) ->  | AD59: Jamaica | AE59: JAM | AF59: -0.48420131108456149 | AG59: 0.32807669277493695 | AH59: =1.64*RC[-1] -> 0.53804577615089655 | AI59: =IF(EQUAL(VLOOKUP(RC[-4],R9C3:R186C4,2,0),1),RC[-1],NA()) -> 0.53804577615089655 | AJ59: =IF(ISNA(RC[-1])=1,"",RC[-5]) -> JAM | AK59: Gambia, The | AL59: GMB | AM59: -0.24965074471065185 | AN59: 0.51994095831945863 | AO59: =1.64*RC[-1] -> 0.85270317164391207 | AP59: =IF(EQUAL(VLOOKUP(RC[-4],R9C3:R186C4,2,0),1),RC[-1],NA()) -> NA() | AQ59: =IF(ISNA(RC[-1])=1,"",RC[-5]) ->  | AR59: Azerbaijan | AS59: AZE | AT59: -0.56349409034291309 | AU59: 0.17954824109220222 | AV59: =1.64*RC[-1] -> 0.29445911539121161 | AW59: =IF(EQUAL(VLOOKUP(RC[-4],R9C3:R186C4,2,0),1),RC[-1],NA()) -> NA() | AX59: =IF(ISNA(RC[-1])=1,"",RC[-5]) ->  | AY59: Macedonia, FYR | AZ59: MKD | BA59: -0.51713475864818037 | BB59: 0.2007212968168238 | BC59: =1.64*RC[-1] -> 0.32918292677959099 | BD59: =IF(EQUAL(VLOOKUP(RC[-4],R9C3:R186C4,2,0),1),RC[-1],NA()) -> NA() | BE59: =IF(ISNA(RC[-1])=1,"",RC[-5]) -> 
B60: Ethiopia | C60: ETH | D60: =IF(EQUAL(ComparativeCharts!R[11]C,""),"",1) ->  | O60: 53 | P60: Eritrea | Q60: ERI | R60: -0.59466356063508696 | S60: 0.36031461549530619 | T60: =1.64*RC[-1] -> 0.59091596941230207 | U60: =IF(EQUAL(VLOOKUP(RC[-4],R9C3:R186C4,2,0),1),RC[-1],NA()) -> NA() | V60: =IF(ISNA(RC[-1])=1,"",RC[-5]) ->  | W60: Belarus | X60: BLR | Y60: -0.37473847286711021 | Z60: 0.25398901430107884 | AA60: =1.64*RC[-1] -> 0.41654198345376925 | AB60: =IF(EQUAL(VLOOKUP(RC[-4],R9C3:R186C4,2,0),1),RC[-1],NA()) -> NA() | AC60: =IF(ISNA(RC[-1])=1,"",RC[-5]) ->  | AD60: Swaziland | AE60: SWZ | AF60: -0.47407399836740294 | AG60: 0.32907595010589286 | AH60: =1.64*RC[-1] -> 0.53968455817366423 | AI60: =IF(EQUAL(VLOOKUP(RC[-4],R9C3:R186C4,2,0),1),RC[-1],NA()) -> NA() | AJ60: =IF(ISNA(RC[-1])=1,"",RC[-5]) ->  | AK60: Mozambique | AL60: MOZ | AM60: -0.22740624234031867 | AN60: 0.33164416564854249 | AO60: =1.64*RC[-1] -> 0.54389643166360968 | AP60: =IF(EQUAL(VLOOKUP(RC[-4],R9C3:R186C4,2,0),1),RC[-1],NA()) -> NA() | AQ60: =IF(ISNA(RC[-1])=1,"",RC[-5]) ->  | AR60: Mauritania | AS60: MRT | AT60: -0.55783560742932603 | AU60: 0.60058386521254259 | AV60: =1.64*RC[-1] -> 0.98495753894856974 | AW60: =IF(EQUAL(VLOOKUP(RC[-4],R9C3:R186C4,2,0),1),RC[-1],NA()) -> NA() | AX60: =IF(ISNA(RC[-1])=1,"",RC[-5]) ->  | AY60: Colombia | AZ60: COL | BA60: -0.49033295191643583 | BB60: 0.18909298753709736 | BC60: =1.64*RC[-1] -> 0.31011249956083964 | BD60: =IF(EQUAL(VLOOKUP(RC[-4],R9C3:R186C4,2,0),1),RC[-1],NA()) -> NA() | BE60: =IF(ISNA(RC[-1])=1,"",RC[-5]) -> 
B61: Finland | C61: FIN | D61: =IF(EQUAL(ComparativeCharts!R[11]C,""),"",1) ->  | O61: 54 | P61: Tunisia | Q61: TUN | R61: -0.58860849462942777 | S61: 0.25402694431067208 | T61: =1.64*RC[-1] -> 0.41660418866950216 | U61: =IF(EQUAL(VLOOKUP(RC[-4],R9C3:R186C4,2,0),1),RC[-1],NA()) -> 0.41660418866950216 | V61: =IF(ISNA(RC[-1])=1,"",RC[-5]) -> TUN | W61: Azerbaijan | X61: AZE | Y61: -0.36344458241929206 | Z61: 0.2347220744274687 | AA61: =1.64*RC[-1] -> 0.38494420206104862 | AB61: =IF(EQUAL(VLOOKUP(RC[-4],R9C3:R186C4,2,0),1),RC[-1],NA()) -> NA() | AC61: =IF(ISNA(RC[-1])=1,"",RC[-5]) ->  | AD61: Lesotho | AE61: LSO | AF61: -0.46174820270581407 | AG61: 0.32907595010589286 | AH61: =1.64*RC[-1] -> 0.53968455817366423 | AI61: =IF(EQUAL(VLOOKUP(RC[-4],R9C3:R186C4,2,0),1),RC[-1],NA()) -> NA() | AJ61: =IF(ISNA(RC[-1])=1,"",RC[-5]) ->  | AK61: Madagascar | AL61: MDG | AM61: -0.20891550141843568 | AN61: 0.51661669269246691 | AO61: =1.64*RC[-1] -> 0.84725137601564571 | AP61: =IF(EQUAL(VLOOKUP(RC[-4],R9C3:R186C4,2,0),1),RC[-1],NA()) -> NA() | AQ61: =IF(ISNA(RC[-1])=1,"",RC[-5]) ->  | AR61: Nepal | AS61: NPL | AT61: -0.55783560742932603 | AU61: 0.60058386521254259 | AV61: =1.64*RC[-1] -> 0.98495753894856974 | AW61: =IF(EQUAL(VLOOKUP(RC[-4],R9C3:R186C4,2,0),1),RC[-1],NA()) -> NA() | AX61: =IF(ISNA(RC[-1])=1,"",RC[-5]) ->  | AY61: Mali | AZ61: MLI | BA61: -0.47585005317613249 | BB61: 0.48462245571009516 | BC61: =1.64*RC[-1] -> 0.79478082736455602 | BD61: =IF(EQUAL(VLOOKUP(RC[-4],R9C3:R186C4,2,0),1),RC[-1],NA()) -> NA() | BE61: =IF(ISNA(RC[-1])=1,"",RC[-5]) -> 
B62: Fiji | C62: FJI | D62: =IF(EQUAL(ComparativeCharts!R[11]C,""),"",1) ->  | O62: 55 | P62: Oman | Q62: OMN | R62: -0.57013742033398496 | S62: 0.25402694431067208 | T62: =1.64*RC[-1] -> 0.41660418866950216 | U62: =IF(EQUAL(VLOOKUP(RC[-4],R9C3:R186C4,2,0),1),RC[-1],NA()) -> NA() | V62: =IF(ISNA(RC[-1])=1,"",RC[-5]) ->  | W62: Mexico | X62: MEX | Y62: -0.35213052426713498 | Z62: 0.25228486761247954 | AA62: =1.64*RC[-1] -> 0.41374718288446644 | AB62: =IF(EQUAL(VLOOKUP(RC[-4],R9C3:R186C4,2,0),1),RC[-1],NA()) -> NA() | AC62: =IF(ISNA(RC[-1])=1,"",RC[-5]) ->  | AD62: Moldova | AE62: MDA | AF62: -0.46008276869666237 | AG62: 0.24259893305862151 | AH62: =1.64*RC[-1] -> 0.39786225021613925 | AI62: =IF(EQUAL(VLOOKUP(RC[-4],R9C3:R186C4,2,0),1),RC[-1],NA()) -> NA() | AJ62: =IF(ISNA(RC[-1])=1,"",RC[-5]) ->  | AK62: Pakistan | AL62: PAK | AM62: -0.19784478192492747 | AN62: 0.27454340772656499 | AO62: =1.64*RC[-1] -> 0.45025118867156655 | AP62: =IF(EQUAL(VLOOKUP(RC[-4],R9C3:R186C4,2,0),1),RC[-1],NA()) -> NA() | AQ62: =IF(ISNA(RC[-1])=1,"",RC[-5]) ->  | AR62: Gabon | AS62: GAB | AT62: -0.5252153027716604 | AU62: 0.3138946252365733 | AV62: =1.64*RC[-1] -> 0.51478718538798018 | AW62: =IF(EQUAL(VLOOKUP(RC[-4],R9C3:R186C4,2,0),1),RC[-1],NA()) -> NA() | AX62: =IF(ISNA(RC[-1])=1,"",RC[-5]) ->  | AY62: Madagascar | AZ62: MDG | BA62: -0.46932295728747098 | BB62: 0.48462245571009516 | BC62: =1.64*RC[-1] -> 0.79478082736455602 | BD62: =IF(EQUAL(VLOOKUP(RC[-4],R9C3:R186C4,2,0),1),RC[-1],NA()) -> NA() | BE62: =IF(ISNA(RC[-1])=1,"",RC[-5]) -> 
B63: France | C63: FRA | D63: =IF(EQUAL(ComparativeCharts!R[11]C,""),"",1) ->  | O63: 56 | P63: Cote d'Ivoire | Q63: CIV | R63: -0.56905295871602957 | S63: 0.25130023322348893 | T63: =1.64*RC[-1] -> 0.41213238248652184 | U63: =IF(EQUAL(VLOOKUP(RC[-4],R9C3:R186C4,2,0),1),RC[-1],NA()) -> NA() | V63: =IF(ISNA(RC[-1])=1,"",RC[-5]) ->  | W63: Jamaica | X63: JAM | Y63: -0.34429311692839193 | Z63: 0.31915287616104948 | AA63: =1.64*RC[-1] -> 0.52341071690412111 | AB63: =IF(EQUAL(VLOOKUP(RC[-4],R9C3:R186C4,2,0),1),RC[-1],NA()) -> 0.52341071690412111 | AC63: =IF(ISNA(RC[-1])=1,"",RC[-5]) -> JAM | AD63: Turkey | AE63: TUR | AF63: -0.41227210497783351 | AG63: 0.23363653218585126 | AH63: =1.64*RC[-1] -> 0.38316391278479606 | AI63: =IF(EQUAL(VLOOKUP(RC[-4],R9C3:R186C4,2,0),1),RC[-1],NA()) -> NA() | AJ63: =IF(ISNA(RC[-1])=1,"",RC[-5]) ->  | AK63: Cameroon | AL63: CMR | AM63: -0.16368273089507202 | AN63: 0.29118732384969281 | AO63: =1.64*RC[-1] -> 0.47754721111349618 | AP63: =IF(EQUAL(VLOOKUP(RC[-4],R9C3:R186C4,2,0),1),RC[-1],NA()) -> NA() | AQ63: =IF(ISNA(RC[-1])=1,"",RC[-5]) ->  | AR63: Peru | AS63: PER | AT63: -0.5216583171247885 | AU63: 0.22249449921545333 | AV63: =1.64*RC[-1] -> 0.36489097871334347 | AW63: =IF(EQUAL(VLOOKUP(RC[-4],R9C3:R186C4,2,0),1),RC[-1],NA()) -> NA() | AX63: =IF(ISNA(RC[-1])=1,"",RC[-5]) ->  | AY63: Uganda | AZ63: UGA | BA63: -0.465943384422014 | BB63: 0.21052052859001816 | BC63: =1.64*RC[-1] -> 0.34525366688762976 | BD63: =IF(EQUAL(VLOOKUP(RC[-4],R9C3:R186C4,2,0),1),RC[-1],NA()) -> NA() | BE63: =IF(ISNA(RC[-1])=1,"",RC[-5]) -> 
B64: Gabon | C64: GAB | D64: =IF(EQUAL(ComparativeCharts!R[11]C,""),"",1) ->  | O64: 57 | P64: Guatemala | Q64: GTM | R64: -0.56461318713896758 | S64: 0.25402694431067208 | T64: =1.64*RC[-1] -> 0.41660418866950216 | U64: =IF(EQUAL(VLOOKUP(RC[-4],R9C3:R186C4,2,0),1),RC[-1],NA()) -> NA() | V64: =IF(ISNA(RC[-1])=1,"",RC[-5]) ->  | W64: Honduras | X64: HND | Y64: -0.33396283317135994 | Z64: 0.31873333373090551 | AA64: =1.64*RC[-1] -> 0.522722667318685 | AB64: =IF(EQUAL(VLOOKUP(RC[-4],R9C3:R186C4,2,0),1),RC[-1],NA()) -> NA() | AC64: =IF(ISNA(RC[-1])=1,"",RC[-5]) ->  | AD64: Honduras | AE64: HND | AF64: -0.40890130969572525 | AG64: 0.37414236442207388 | AH64: =1.64*RC[-1] -> 0.61359347765220118 | AI64: =IF(EQUAL(VLOOKUP(RC[-4],R9C3:R186C4,2,0),1),RC[-1],NA()) -> NA() | AJ64: =IF(ISNA(RC[-1])=1,"",RC[-5]) ->  | AK64: West Bank and Gaza | AL64: WTB | AM64: -0.16182088293069852 | AN64: 0.97694373036537951 | AO64: =1.64*RC[-1] -> 1.6021877177992223 | AP64: =IF(EQUAL(VLOOKUP(RC[-4],R9C3:R186C4,2,0),1),RC[-1],NA()) -> NA() | AQ64: =IF(ISNA(RC[-1])=1,"",RC[-5]) ->  | AR64: Fiji | AS64: FJI | AT64: -0.49538317664637949 | AU64: 0.45038851528650714 | AV64: =1.64*RC[-1] -> 0.73863716506987165 | AW64: =IF(EQUAL(VLOOKUP(RC[-4],R9C3:R186C4,2,0),1),RC[-1],NA()) -> NA() | AX64: =IF(ISNA(RC[-1])=1,"",RC[-5]) ->  | AY64: Croatia | AZ64: HRV | BA64: -0.46405431594523039 | BB64: 0.19707922856731536 | BC64: =1.64*RC[-1] -> 0.32320993485039717 | BD64: =IF(EQUAL(VLOOKUP(RC[-4],R9C3:R186C4,2,0),1),RC[-1],NA()) -> NA() | BE64: =IF(ISNA(RC[-1])=1,"",RC[-5]) -> 
B65: United Kingdom | C65: GBR | D65: =IF(EQUAL(ComparativeCharts!R[11]C,""),"",1) ->  | O65: 58 | P65: Iran, Islamic Rep. | Q65: IRN | R65: -0.55920627536362344 | S65: 0.25402694431067208 | T65: =1.64*RC[-1] -> 0.41660418866950216 | U65: =IF(EQUAL(VLOOKUP(RC[-4],R9C3:R186C4,2,0),1),RC[-1],NA()) -> NA() | V65: =IF(ISNA(RC[-1])=1,"",RC[-5]) ->  | W65: Uzbekistan | X65: UZB | Y65: -0.33294261497898847 | Z65: 0.27446907042963703 | AA65: =1.64*RC[-1] -> 0.45012927550460469 | AB65: =IF(EQUAL(VLOOKUP(RC[-4],R9C3:R186C4,2,0),1),RC[-1],NA()) -> NA() | AC65: =IF(ISNA(RC[-1])=1,"",RC[-5]) ->  | AD65: Zambia | AE65: ZMB | AF65: -0.39893553910072233 | AG65: 0.22248178800615603 | AH65: =1.64*RC[-1] -> 0.36487013233009585 | AI65: =IF(EQUAL(VLOOKUP(RC[-4],R9C3:R186C4,2,0),1),RC[-1],NA()) -> NA() | AJ65: =IF(ISNA(RC[-1])=1,"",RC[-5]) ->  | AK65: Bangladesh | AL65: BGD | AM65: -0.15523665121689781 | AN65: 0.39525422199815724 | AO65: =1.64*RC[-1] -> 0.64821692407697784 | AP65: =IF(EQUAL(VLOOKUP(RC[-4],R9C3:R186C4,2,0),1),RC[-1],NA()) -> NA() | AQ65: =IF(ISNA(RC[-1])=1,"",RC[-5]) ->  | AR65: Georgia | AS65: GEO | AT65: -0.49418423293255459 | AU65: 0.20566000620699998 | AV65: =1.64*RC[-1] -> 0.33728241017947996 | AW65: =IF(EQUAL(VLOOKUP(RC[-4],R9C3:R186C4,2,0),1),RC[-1],NA()) -> NA() | AX65: =IF(ISNA(RC[-1])=1,"",RC[-5]) ->  | AY65: Panama | AZ65: PAN | BA65: -0.45828542046601534 | BB65: 0.26706317040829514 | BC65: =1.64*RC[-1] -> 0.43798359946960402 | BD65: =IF(EQUAL(VLOOKUP(RC[-4],R9C3:R186C4,2,0),1),RC[-1],NA()) -> NA() | BE65: =IF(ISNA(RC[-1])=1,"",RC[-5]) -> 
B66: Georgia | C66: GEO | D66: =IF(EQUAL(ComparativeCharts!R[11]C,""),"",1) ->  | O66: 59 | P66: United Arab Emirates | Q66: ARE | R66: -0.5446778787510238 | S66: 0.25402694431067208 | T66: =1.64*RC[-1] -> 0.41660418866950216 | U66: =IF(EQUAL(VLOOKUP(RC[-4],R9C3:R186C4,2,0),1),RC[-1],NA()) -> NA() | V66: =IF(ISNA(RC[-1])=1,"",RC[-5]) ->  | W66: Nicaragua | X66: NIC | Y66: -0.32343975269679243 | Z66: 0.31873333373090551 | AA66: =1.64*RC[-1] -> 0.522722667318685 | AB66: =IF(EQUAL(VLOOKUP(RC[-4],R9C3:R186C4,2,0),1),RC[-1],NA()) -> NA() | AC66: =IF(ISNA(RC[-1])=1,"",RC[-5]) ->  | AD66: Togo | AE66: TGO | AF66: -0.37425541437259524 | AG66: 0.51020118372025602 | AH66: =1.64*RC[-1] -> 0.8367299413012198 | AI66: =IF(EQUAL(VLOOKUP(RC[-4],R9C3:R186C4,2,0),1),RC[-1],NA()) -> NA() | AJ66: =IF(ISNA(RC[-1])=1,"",RC[-5]) ->  | AK66: Saudi Arabia | AL66: SAU | AM66: -0.14866746520517207 | AN66: 0.39525422199815724 | AO66: =1.64*RC[-1] -> 0.64821692407697784 | AP66: =IF(EQUAL(VLOOKUP(RC[-4],R9C3:R186C4,2,0),1),RC[-1],NA()) -> NA() | AQ66: =IF(ISNA(RC[-1])=1,"",RC[-5]) ->  | AR66: Mexico | AS66: MEX | AT66: -0.47409920217358242 | AU66: 0.20773727561581487 | AV66: =1.64*RC[-1] -> 0.34068913200993639 | AW66: =IF(EQUAL(VLOOKUP(RC[-4],R9C3:R186C4,2,0),1),RC[-1],NA()) -> NA() | AX66: =IF(ISNA(RC[-1])=1,"",RC[-5]) ->  | AY66: Romania | AZ66: ROM | BA66: -0.45704813449752379 | BB66: 0.18987227333382842 | BC66: =1.64*RC[-1] -> 0.31139052826747859 | BD66: =IF(EQUAL(VLOOKUP(RC[-4],R9C3:R186C4,2,0),1),RC[-1],NA()) -> NA() | BE66: =IF(ISNA(RC[-1])=1,"",RC[-5]) -> 
B67: Ghana | C67: GHA | D67: =IF(EQUAL(ComparativeCharts!R[11]C,""),"",1) ->  | O67: 60 | P67: Belarus | Q67: BLR | R67: -0.52066192727355987 | S67: 0.28728334123682875 | T67: =1.64*RC[-1] -> 0.47114467962839912 | U67: =IF(EQUAL(VLOOKUP(RC[-4],R9C3:R186C4,2,0),1),RC[-1],NA()) -> NA() | V67: =IF(ISNA(RC[-1])=1,"",RC[-5]) ->  | W67: Brazil | X67: BRA | Y67: -0.32263921138726914 | Z67: 0.25228486761247954 | AA67: =1.64*RC[-1] -> 0.41374718288446644 | AB67: =IF(EQUAL(VLOOKUP(RC[-4],R9C3:R186C4,2,0),1),RC[-1],NA()) -> NA() | AC67: =IF(ISNA(RC[-1])=1,"",RC[-5]) ->  | AD67: Saudi Arabia | AE67: SAU | AF67: -0.34876157326587237 | AG67: 0.28978914382329912 | AH67: =1.64*RC[-1] -> 0.47525419587021051 | AI67: =IF(EQUAL(VLOOKUP(RC[-4],R9C3:R186C4,2,0),1),RC[-1],NA()) -> NA() | AJ67: =IF(ISNA(RC[-1])=1,"",RC[-5]) ->  | AK67: Kenya | AL67: KEN | AM67: -0.13283592721084336 | AN67: 0.29118732384969281 | AO67: =1.64*RC[-1] -> 0.47754721111349618 | AP67: =IF(EQUAL(VLOOKUP(RC[-4],R9C3:R186C4,2,0),1),RC[-1],NA()) -> NA() | AQ67: =IF(ISNA(RC[-1])=1,"",RC[-5]) ->  | AR67: Kyrgyz Republic | AS67: KGZ | AT67: -0.46804644296688391 | AU67: 0.20566000620699998 | AV67: =1.64*RC[-1] -> 0.33728241017947996 | AW67: =IF(EQUAL(VLOOKUP(RC[-4],R9C3:R186C4,2,0),1),RC[-1],NA()) -> NA() | AX67: =IF(ISNA(RC[-1])=1,"",RC[-5]) ->  | AY67: Bolivia | AZ67: BOL | BA67: -0.43787719478603893 | BB67: 0.23258218307199124 | BC67: =1.64*RC[-1] -> 0.3814347802380656 | BD67: =IF(EQUAL(VLOOKUP(RC[-4],R9C3:R186C4,2,0),1),RC[-1],NA()) -> NA() | BE67: =IF(ISNA(RC[-1])=1,"",RC[-5]) -> 
B68: Guinea | C68: GIN | D68: =IF(EQUAL(ComparativeCharts!R[11]C,""),"",1) ->  | O68: 61 | P68: Uganda | Q68: UGA | R68: -0.51721204720073377 | S68: 0.25130023322348893 | T68: =1.64*RC[-1] -> 0.41213238248652184 | U68: =IF(EQUAL(VLOOKUP(RC[-4],R9C3:R186C4,2,0),1),RC[-1],NA()) -> NA() | V68: =IF(ISNA(RC[-1])=1,"",RC[-5]) ->  | W68: Mali | X68: MLI | Y68: -0.2871501692828779 | Z68: 0.37350218211437147 | AA68: =1.64*RC[-1] -> 0.61254357866756914 | AB68: =IF(EQUAL(VLOOKUP(RC[-4],R9C3:R186C4,2,0),1),RC[-1],NA()) -> NA() | AC68: =IF(ISNA(RC[-1])=1,"",RC[-5]) ->  | AD68: Iran, Islamic Rep. | AE68: IRN | AF68: -0.33943571416158524 | AG68: 0.28978914382329912 | AH68: =1.64*RC[-1] -> 0.47525419587021051 | AI68: =IF(EQUAL(VLOOKUP(RC[-4],R9C3:R186C4,2,0),1),RC[-1],NA()) -> NA() | AJ68: =IF(ISNA(RC[-1])=1,"",RC[-5]) ->  | AK68: Papua New Guinea | AL68: PNG | AM68: -0.12874980696358554 | AN68: 0.51994095831945863 | AO68: =1.64*RC[-1] -> 0.85270317164391207 | AP68: =IF(EQUAL(VLOOKUP(RC[-4],R9C3:R186C4,2,0),1),RC[-1],NA()) -> NA() | AQ68: =IF(ISNA(RC[-1])=1,"",RC[-5]) ->  | AR68: Mali | AS68: MLI | AT68: -0.46544972136557783 | AU68: 0.37135850669511394 | AV68: =1.64*RC[-1] -> 0.60902795097998685 | AW68: =IF(EQUAL(VLOOKUP(RC[-4],R9C3:R186C4,2,0),1),RC[-1],NA()) -> NA() | AX68: =IF(ISNA(RC[-1])=1,"",RC[-5]) ->  | AY68: Ethiopia | AZ68: ETH | BA68: -0.43558120166795666 | BB68: 0.35684147672067407 | BC68: =1.64*RC[-1] -> 0.58522002182190547 | BD68: =IF(EQUAL(VLOOKUP(RC[-4],R9C3:R186C4,2,0),1),RC[-1],NA()) -> NA() | BE68: =IF(ISNA(RC[-1])=1,"",RC[-5]) -> 
B69: Guadeloupe | C69: GLP | D69: =IF(EQUAL(ComparativeCharts!R[11]C,""),"",1) ->  | O69: 62 | P69: Ethiopia | Q69: ETH | R69: -0.49961249473530239 | S69: 0.29137760175532934 | T69: =1.64*RC[-1] -> 0.47785926687874009 | U69: =IF(EQUAL(VLOOKUP(RC[-4],R9C3:R186C4,2,0),1),RC[-1],NA()) -> NA() | V69: =IF(ISNA(RC[-1])=1,"",RC[-5]) ->  | W69: Lebanon | X69: LBN | Y69: -0.25201222574857557 | Z69: 0.29988188904282925 | AA69: =1.64*RC[-1] -> 0.49180629803023995 | AB69: =IF(EQUAL(VLOOKUP(RC[-4],R9C3:R186C4,2,0),1),RC[-1],NA()) -> NA() | AC69: =IF(ISNA(RC[-1])=1,"",RC[-5]) ->  | AD69: Guinea-Bissau | AE69: GNB | AF69: -0.33427682117057078 | AG69: 0.51020118372025602 | AH69: =1.64*RC[-1] -> 0.8367299413012198 | AI69: =IF(EQUAL(VLOOKUP(RC[-4],R9C3:R186C4,2,0),1),RC[-1],NA()) -> NA() | AJ69: =IF(ISNA(RC[-1])=1,"",RC[-5]) ->  | AK69: Nicaragua | AL69: NIC | AM69: -0.10250672580652591 | AN69: 0.51994095831945863 | AO69: =1.64*RC[-1] -> 0.85270317164391207 | AP69: =IF(EQUAL(VLOOKUP(RC[-4],R9C3:R186C4,2,0),1),RC[-1],NA()) -> NA() | AQ69: =IF(ISNA(RC[-1])=1,"",RC[-5]) ->  | AR69: Vietnam | AS69: VNM | AT69: -0.43651695944185942 | AU69: 0.23542062698000482 | AV69: =1.64*RC[-1] -> 0.38608982824720789 | AW69: =IF(EQUAL(VLOOKUP(RC[-4],R9C3:R186C4,2,0),1),RC[-1],NA()) -> NA() | AX69: =IF(ISNA(RC[-1])=1,"",RC[-5]) ->  | AY69: Lebanon | AZ69: LBN | BA69: -0.39706828536934941 | BB69: 0.26706317040829514 | BC69: =1.64*RC[-1] -> 0.43798359946960402 | BD69: =IF(EQUAL(VLOOKUP(RC[-4],R9C3:R186C4,2,0),1),RC[-1],NA()) -> NA() | BE69: =IF(ISNA(RC[-1])=1,"",RC[-5]) -> 
B70: Gambia, The | C70: GMB | D70: =IF(EQUAL(ComparativeCharts!R[11]C,""),"",1) ->  | O70: 63 | P70: Guinea-Bissau | Q70: GNB | R70: -0.45385701247542942 | S70: 0.28728334123682875 | T70: =1.64*RC[-1] -> 0.47114467962839912 | U70: =IF(EQUAL(VLOOKUP(RC[-4],R9C3:R186C4,2,0),1),RC[-1],NA()) -> NA() | V70: =IF(ISNA(RC[-1])=1,"",RC[-5]) ->  | W70: Venezuela, RB | X70: VEN | Y70: -0.24983547097389192 | Z70: 0.25228486761247954 | AA70: =1.64*RC[-1] -> 0.41374718288446644 | AB70: =IF(EQUAL(VLOOKUP(RC[-4],R9C3:R186C4,2,0),1),RC[-1],NA()) -> NA() | AC70: =IF(ISNA(RC[-1])=1,"",RC[-5]) ->  | AD70: Mozambique | AE70: MOZ | AF70: -0.33073075366025778 | AG70: 0.2877650419084371 | AH70: =1.64*RC[-1] -> 0.4719346687298368 | AI70: =IF(EQUAL(VLOOKUP(RC[-4],R9C3:R186C4,2,0),1),RC[-1],NA()) -> NA() | AJ70: =IF(ISNA(RC[-1])=1,"",RC[-5]) ->  | AK70: Kuwait | AL70: KWT | AM70: -9.0885527120957058E-2 | AN70: 0.39525422199815724 | AO70: =1.64*RC[-1] -> 0.64821692407697784 | AP70: =IF(EQUAL(VLOOKUP(RC[-4],R9C3:R186C4,2,0),1),RC[-1],NA()) -> NA() | AQ70: =IF(ISNA(RC[-1])=1,"",RC[-5]) ->  | AR70: Benin | AS70: BEN | AT70: -0.42206349271954474 | AU70: 0.45038851528650714 | AV70: =1.64*RC[-1] -> 0.73863716506987165 | AW70: =IF(EQUAL(VLOOKUP(RC[-4],R9C3:R186C4,2,0),1),RC[-1],NA()) -> NA() | AX70: =IF(ISNA(RC[-1])=1,"",RC[-5]) ->  | AY70: Moldova | AZ70: MDA | BA70: -0.38674550725057766 | BB70: 0.18824314571543588 | BC70: =1.64*RC[-1] -> 0.3087187589733148 | BD70: =IF(EQUAL(VLOOKUP(RC[-4],R9C3:R186C4,2,0),1),RC[-1],NA()) -> NA() | BE70: =IF(ISNA(RC[-1])=1,"",RC[-5]) -> 
B71: Guinea-Bissau | C71: GNB | D71: =IF(EQUAL(ComparativeCharts!R[11]C,""),"",1) ->  | O71: 64 | P71: Pakistan | Q71: PAK | R71: -0.44053240973166652 | S71: 0.25402694431067208 | T71: =1.64*RC[-1] -> 0.41660418866950216 | U71: =IF(EQUAL(VLOOKUP(RC[-4],R9C3:R186C4,2,0),1),RC[-1],NA()) -> NA() | V71: =IF(ISNA(RC[-1])=1,"",RC[-5]) ->  | W71: Ukraine | X71: UKR | Y71: -0.24201688707316882 | Z71: 0.21591513909296886 | AA71: =1.64*RC[-1] -> 0.3541008281124689 | AB71: =IF(EQUAL(VLOOKUP(RC[-4],R9C3:R186C4,2,0),1),RC[-1],NA()) -> NA() | AC71: =IF(ISNA(RC[-1])=1,"",RC[-5]) ->  | AD71: Korea, Dem. Rep. | AE71: PRK | AF71: -0.30141500175701852 | AG71: 0.76816878371913544 | AH71: =1.64*RC[-1] -> 1.259796805299382 | AI71: =IF(EQUAL(VLOOKUP(RC[-4],R9C3:R186C4,2,0),1),RC[-1],NA()) -> NA() | AJ71: =IF(ISNA(RC[-1])=1,"",RC[-5]) ->  | AK71: Brunei | AL71: BRN | AM71: -8.4459085940385009E-2 | AN71: 0.71821352123625759 | AO71: =1.64*RC[-1] -> 1.1778701748274625 | AP71: =IF(EQUAL(VLOOKUP(RC[-4],R9C3:R186C4,2,0),1),RC[-1],NA()) -> NA() | AQ71: =IF(ISNA(RC[-1])=1,"",RC[-5]) ->  | AR71: Malawi | AS71: MWI | AT71: -0.40902349771871638 | AU71: 0.2811069183326606 | AV71: =1.64*RC[-1] -> 0.46101534606556338 | AW71: =IF(EQUAL(VLOOKUP(RC[-4],R9C3:R186C4,2,0),1),RC[-1],NA()) -> NA() | AX71: =IF(ISNA(RC[-1])=1,"",RC[-5]) ->  | AY71: Burkina Faso | AZ71: BFA | BA71: -0.36764475284468895 | BB71: 0.35684147672067407 | BC71: =1.64*RC[-1] -> 0.58522002182190547 | BD71: =IF(EQUAL(VLOOKUP(RC[-4],R9C3:R186C4,2,0),1),RC[-1],NA()) -> NA() | BE71: =IF(ISNA(RC[-1])=1,"",RC[-5]) -> 
B72: Equatorial Guinea | C72: GNQ | D72: =IF(EQUAL(ComparativeCharts!R[11]C,""),"",1) ->  | O72: 65 | P72: Ghana | Q72: GHA | R72: -0.43466100269349112 | S72: 0.25130023322348893 | T72: =1.64*RC[-1] -> 0.41213238248652184 | U72: =IF(EQUAL(VLOOKUP(RC[-4],R9C3:R186C4,2,0),1),RC[-1],NA()) -> NA() | V72: =IF(ISNA(RC[-1])=1,"",RC[-5]) ->  | W72: Moldova | X72: MDA | Y72: -0.19594535457997811 | Z72: 0.2347220744274687 | AA72: =1.64*RC[-1] -> 0.38494420206104862 | AB72: =IF(EQUAL(VLOOKUP(RC[-4],R9C3:R186C4,2,0),1),RC[-1],NA()) -> NA() | AC72: =IF(ISNA(RC[-1])=1,"",RC[-5]) ->  | AD72: Vietnam | AE72: VNM | AF72: -0.29986293839707967 | AG72: 0.2598634108510659 | AH72: =1.64*RC[-1] -> 0.42617599379574805 | AI72: =IF(EQUAL(VLOOKUP(RC[-4],R9C3:R186C4,2,0),1),RC[-1],NA()) -> NA() | AJ72: =IF(ISNA(RC[-1])=1,"",RC[-5]) ->  | AK72: Benin | AL72: BEN | AM72: -8.1537398210084697E-2 | AN72: 0.59674094290048185 | AO72: =1.64*RC[-1] -> 0.97865514635679018 | AP72: =IF(EQUAL(VLOOKUP(RC[-4],R9C3:R186C4,2,0),1),RC[-1],NA()) -> NA() | AQ72: =IF(ISNA(RC[-1])=1,"",RC[-5]) ->  | AR72: Zambia | AS72: ZMB | AT72: -0.40167775873201533 | AU72: 0.2531854041328267 | AV72: =1.64*RC[-1] -> 0.41522406277783575 | AW72: =IF(EQUAL(VLOOKUP(RC[-4],R9C3:R186C4,2,0),1),RC[-1],NA()) -> NA() | AX72: =IF(ISNA(RC[-1])=1,"",RC[-5]) ->  | AY72: El Salvador | AZ72: SLV | BA72: -0.35356553917485356 | BB72: 0.22347192384126532 | BC72: =1.64*RC[-1] -> 0.36649395509967508 | BD72: =IF(EQUAL(VLOOKUP(RC[-4],R9C3:R186C4,2,0),1),RC[-1],NA()) -> NA() | BE72: =IF(ISNA(RC[-1])=1,"",RC[-5]) -> 
B73: Greece | C73: GRC | D73: =IF(EQUAL(ComparativeCharts!R[11]C,""),"",1) ->  | O73: 66 | P73: Paraguay | Q73: PRY | R73: -0.4191469362798339 | S73: 0.25130023322348893 | T73: =1.64*RC[-1] -> 0.41213238248652184 | U73: =IF(EQUAL(VLOOKUP(RC[-4],R9C3:R186C4,2,0),1),RC[-1],NA()) -> NA() | V73: =IF(ISNA(RC[-1])=1,"",RC[-5]) ->  | W73: Guyana | X73: GUY | Y73: -0.19535040429799619 | Z73: 0.41252284257447502 | AA73: =1.64*RC[-1] -> 0.67653746182213903 | AB73: =IF(EQUAL(VLOOKUP(RC[-4],R9C3:R186C4,2,0),1),RC[-1],NA()) -> NA() | AC73: =IF(ISNA(RC[-1])=1,"",RC[-5]) ->  | AD73: Madagascar | AE73: MDG | AF73: -0.29457592783734737 | AG73: 0.38512328444152177 | AH73: =1.64*RC[-1] -> 0.63160218648409572 | AI73: =IF(EQUAL(VLOOKUP(RC[-4],R9C3:R186C4,2,0),1),RC[-1],NA()) -> NA() | AJ73: =IF(ISNA(RC[-1])=1,"",RC[-5]) ->  | AK73: China | AL73: CHN | AM73: -7.0084539357266551E-2 | AN73: 0.22904640098569978 | AO73: =1.64*RC[-1] -> 0.37563609761654765 | AP73: =IF(EQUAL(VLOOKUP(RC[-4],R9C3:R186C4,2,0),1),RC[-1],NA()) -> NA() | AQ73: =IF(ISNA(RC[-1])=1,"",RC[-5]) ->  | AR73: Panama | AS73: PAN | AT73: -0.39191092345168688 | AU73: 0.27634968636657775 | AV73: =1.64*RC[-1] -> 0.45321348564118746 | AW73: =IF(EQUAL(VLOOKUP(RC[-4],R9C3:R186C4,2,0),1),RC[-1],NA()) -> NA() | AX73: =IF(ISNA(RC[-1])=1,"",RC[-5]) ->  | AY73: Bosnia and Herzegovina | AZ73: BIH | BA73: -0.35252358266285255 | BB73: 0.45502709497665206 | BC73: =1.64*RC[-1] -> 0.74624443576170929 | BD73: =IF(EQUAL(VLOOKUP(RC[-4],R9C3:R186C4,2,0),1),RC[-1],NA()) -> NA() | BE73: =IF(ISNA(RC[-1])=1,"",RC[-5]) -> 
B74: Guatemala | C74: GTM | D74: =IF(EQUAL(ComparativeCharts!R[11]C,""),"",1) ->  | O74: 67 | P74: Yemen, Rep. | Q74: YEM | R74: -0.41468728570103375 | S74: 0.25402694431067208 | T74: =1.64*RC[-1] -> 0.41660418866950216 | U74: =IF(EQUAL(VLOOKUP(RC[-4],R9C3:R186C4,2,0),1),RC[-1],NA()) -> NA() | V74: =IF(ISNA(RC[-1])=1,"",RC[-5]) ->  | W74: Suriname | X74: SUR | Y74: -0.19535040429799619 | Z74: 0.41252284257447502 | AA74: =1.64*RC[-1] -> 0.67653746182213903 | AB74: =IF(EQUAL(VLOOKUP(RC[-4],R9C3:R186C4,2,0),1),RC[-1],NA()) -> NA() | AC74: =IF(ISNA(RC[-1])=1,"",RC[-5]) ->  | AD74: Ghana | AE74: GHA | AF74: -0.2867775568036196 | AG74: 0.22248178800615603 | AH74: =1.64*RC[-1] -> 0.36487013233009585 | AI74: =IF(EQUAL(VLOOKUP(RC[-4],R9C3:R186C4,2,0),1),RC[-1],NA()) -> NA() | AJ74: =IF(ISNA(RC[-1])=1,"",RC[-5]) ->  | AK74: Lesotho | AL74: LSO | AM74: -5.7904784103815762E-2 | AN74: 0.35124420467647216 | AO74: =1.64*RC[-1] -> 0.57604049566941429 | AP74: =IF(EQUAL(VLOOKUP(RC[-4],R9C3:R186C4,2,0),1),RC[-1],NA()) -> NA() | AQ74: =IF(ISNA(RC[-1])=1,"",RC[-5]) ->  | AR74: Iran, Islamic Rep. | AS74: IRN | AT74: -0.36424080569065093 | AU74: 0.25638815719447205 | AV74: =1.64*RC[-1] -> 0.42047657779893416 | AW74: =IF(EQUAL(VLOOKUP(RC[-4],R9C3:R186C4,2,0),1),RC[-1],NA()) -> NA() | AX74: =IF(ISNA(RC[-1])=1,"",RC[-5]) ->  | AY74: Turkey | AZ74: TUR | BA74: -0.34886993489243479 | BB74: 0.18909298753709736 | BC74: =1.64*RC[-1] -> 0.31011249956083964 | BD74: =IF(EQUAL(VLOOKUP(RC[-4],R9C3:R186C4,2,0),1),RC[-1],NA()) -> NA() | BE74: =IF(ISNA(RC[-1])=1,"",RC[-5]) -> 
B75: Guyana | C75: GUY | D75: =IF(EQUAL(ComparativeCharts!R[11]C,""),"",1) ->  | O75: 68 | P75: Lebanon | Q75: LBN | R75: -0.4042674489710551 | S75: 0.25402694431067208 | T75: =1.64*RC[-1] -> 0.41660418866950216 | U75: =IF(EQUAL(VLOOKUP(RC[-4],R9C3:R186C4,2,0),1),RC[-1],NA()) -> NA() | V75: =IF(ISNA(RC[-1])=1,"",RC[-5]) ->  | W75: Bolivia | X75: BOL | Y75: -0.14264805559353128 | Z75: 0.28384561747895509 | AA75: =1.64*RC[-1] -> 0.46550681266548632 | AB75: =IF(EQUAL(VLOOKUP(RC[-4],R9C3:R186C4,2,0),1),RC[-1],NA()) -> NA() | AC75: =IF(ISNA(RC[-1])=1,"",RC[-5]) ->  | AD75: Panama | AE75: PAN | AF75: -0.27657204063011992 | AG75: 0.31908959204123422 | AH75: =1.64*RC[-1] -> 0.52330693094762404 | AI75: =IF(EQUAL(VLOOKUP(RC[-4],R9C3:R186C4,2,0),1),RC[-1],NA()) -> NA() | AJ75: =IF(ISNA(RC[-1])=1,"",RC[-5]) ->  | AK75: India | AL75: IND | AM75: -3.997451757928016E-2 | AN75: 0.22876000329023777 | AO75: =1.64*RC[-1] -> 0.37516640539598994 | AP75: =IF(EQUAL(VLOOKUP(RC[-4],R9C3:R186C4,2,0),1),RC[-1],NA()) -> NA() | AQ75: =IF(ISNA(RC[-1])=1,"",RC[-5]) ->  | AR75: Sri Lanka | AS75: LKA | AT75: -0.36125842775522654 | AU75: 0.27634968636657775 | AV75: =1.64*RC[-1] -> 0.45321348564118746 | AW75: =IF(EQUAL(VLOOKUP(RC[-4],R9C3:R186C4,2,0),1),RC[-1],NA()) -> NA() | AX75: =IF(ISNA(RC[-1])=1,"",RC[-5]) ->  | AY75: Vietnam | AZ75: VNM | BA75: -0.33190744891853363 | BB75: 0.17348306999877741 | BC75: =1.64*RC[-1] -> 0.28451223479799492 | BD75: =IF(EQUAL(VLOOKUP(RC[-4],R9C3:R186C4,2,0),1),RC[-1],NA()) -> NA() | BE75: =IF(ISNA(RC[-1])=1,"",RC[-5]) -> 
B76: Hong Kong, China | C76: HKG | D76: =IF(EQUAL(ComparativeCharts!R[11]C,""),"",1) ->  | O76: 69 | P76: Croatia | Q76: HRV | R76: -0.32322880123621806 | S76: 0.25402694431067208 | T76: =1.64*RC[-1] -> 0.41660418866950216 | U76: =IF(EQUAL(VLOOKUP(RC[-4],R9C3:R186C4,2,0),1),RC[-1],NA()) -> NA() | V76: =IF(ISNA(RC[-1])=1,"",RC[-5]) ->  | W76: Cote d'Ivoire | X76: CIV | Y76: -0.13783353491708533 | Z76: 0.26599811359710124 | AA76: =1.64*RC[-1] -> 0.436236906299246 | AB76: =IF(EQUAL(VLOOKUP(RC[-4],R9C3:R186C4,2,0),1),RC[-1],NA()) -> NA() | AC76: =IF(ISNA(RC[-1])=1,"",RC[-5]) ->  | AD76: India | AE76: IND | AF76: -0.26374686523655405 | AG76: 0.23363653218585126 | AH76: =1.64*RC[-1] -> 0.38316391278479606 | AI76: =IF(EQUAL(VLOOKUP(RC[-4],R9C3:R186C4,2,0),1),RC[-1],NA()) -> NA() | AJ76: =IF(ISNA(RC[-1])=1,"",RC[-5]) ->  | AK76: Burkina Faso | AL76: BFA | AM76: -3.782975907589714E-2 | AN76: 0.33251863866145182 | AO76: =1.64*RC[-1] -> 0.54533056740478092 | AP76: =IF(EQUAL(VLOOKUP(RC[-4],R9C3:R186C4,2,0),1),RC[-1],NA()) -> NA() | AQ76: =IF(ISNA(RC[-1])=1,"",RC[-5]) ->  | AR76: Bolivia | AS76: BOL | AT76: -0.35450537499875051 | AU76: 0.25605974956246003 | AV76: =1.64*RC[-1] -> 0.41993798928243442 | AW76: =IF(EQUAL(VLOOKUP(RC[-4],R9C3:R186C4,2,0),1),RC[-1],NA()) -> NA() | AX76: =IF(ISNA(RC[-1])=1,"",RC[-5]) ->  | AY76: Zimbabwe | AZ76: ZWE | BA76: -0.31873341014510748 | BB76: 0.18460198033193845 | BC76: =1.64*RC[-1] -> 0.30274724774437906 | BD76: =IF(EQUAL(VLOOKUP(RC[-4],R9C3:R186C4,2,0),1),RC[-1],NA()) -> NA() | BE76: =IF(ISNA(RC[-1])=1,"",RC[-5]) -> 
B77: Honduras | C77: HND | D77: =IF(EQUAL(ComparativeCharts!R[11]C,""),"",1) ->  | O77: 70 | P77: Gabon | Q77: GAB | R77: -0.31409891298261794 | S77: 0.25402694431067208 | T77: =1.64*RC[-1] -> 0.41660418866950216 | U77: =IF(EQUAL(VLOOKUP(RC[-4],R9C3:R186C4,2,0),1),RC[-1],NA()) -> NA() | V77: =IF(ISNA(RC[-1])=1,"",RC[-5]) ->  | W77: Ghana | X77: GHA | Y77: -0.10107161309377614 | Z77: 0.26599811359710124 | AA77: =1.64*RC[-1] -> 0.436236906299246 | AB77: =IF(EQUAL(VLOOKUP(RC[-4],R9C3:R186C4,2,0),1),RC[-1],NA()) -> NA() | AC77: =IF(ISNA(RC[-1])=1,"",RC[-5]) ->  | AD77: El Salvador | AE77: SLV | AF77: -0.26179485874720165 | AG77: 0.37414236442207388 | AH77: =1.64*RC[-1] -> 0.61359347765220118 | AI77: =IF(EQUAL(VLOOKUP(RC[-4],R9C3:R186C4,2,0),1),RC[-1],NA()) -> NA() | AJ77: =IF(ISNA(RC[-1])=1,"",RC[-5]) ->  | AK77: Cambodia | AL77: KHM | AM77: -3.576587886811923E-2 | AN77: 0.60188084442426626 | AO77: =1.64*RC[-1] -> 0.98708458485579664 | AP77: =IF(EQUAL(VLOOKUP(RC[-4],R9C3:R186C4,2,0),1),RC[-1],NA()) -> NA() | AQ77: =IF(ISNA(RC[-1])=1,"",RC[-5]) ->  | AR77: South Africa | AS77: ZAF | AT77: -0.35141835283200906 | AU77: 0.20619359557235087 | AV77: =1.64*RC[-1] -> 0.33815749673865542 | AW77: =IF(EQUAL(VLOOKUP(RC[-4],R9C3:R186C4,2,0),1),RC[-1],NA()) -> NA() | AX77: =IF(ISNA(RC[-1])=1,"",RC[-5]) ->  | AY77: India | AZ77: IND | BA77: -0.30584065693227519 | BB77: 0.15482320791775375 | BC77: =1.64*RC[-1] -> 0.25391006098511615 | BD77: =IF(EQUAL(VLOOKUP(RC[-4],R9C3:R186C4,2,0),1),RC[-1],NA()) -> NA() | BE77: =IF(ISNA(RC[-1])=1,"",RC[-5]) -> 
B78: Croatia | C78: HRV | D78: =IF(EQUAL(ComparativeCharts!R[11]C,""),"",1) ->  | O78: 71 | P78: Russian Federation | Q78: RUS | R78: -0.3112684380169759 | S78: 0.25130023322348893 | T78: =1.64*RC[-1] -> 0.41213238248652184 | U78: =IF(EQUAL(VLOOKUP(RC[-4],R9C3:R186C4,2,0),1),RC[-1],NA()) -> NA() | V78: =IF(ISNA(RC[-1])=1,"",RC[-5]) ->  | W78: Bahrain | X78: BHR | Y78: -7.6897794470733111E-2 | Z78: 0.29988188904282925 | AA78: =1.64*RC[-1] -> 0.49180629803023995 | AB78: =IF(EQUAL(VLOOKUP(RC[-4],R9C3:R186C4,2,0),1),RC[-1],NA()) -> NA() | AC78: =IF(ISNA(RC[-1])=1,"",RC[-5]) ->  | AD78: Uganda | AE78: UGA | AF78: -0.25057898576132931 | AG78: 0.22248178800615603 | AH78: =1.64*RC[-1] -> 0.36487013233009585 | AI78: =IF(EQUAL(VLOOKUP(RC[-4],R9C3:R186C4,2,0),1),RC[-1],NA()) -> NA() | AJ78: =IF(ISNA(RC[-1])=1,"",RC[-5]) ->  | AK78: Ethiopia | AL78: ETH | AM78: -3.3403615763245728E-2 | AN78: 0.33251863866145182 | AO78: =1.64*RC[-1] -> 0.54533056740478092 | AP78: =IF(EQUAL(VLOOKUP(RC[-4],R9C3:R186C4,2,0),1),RC[-1],NA()) -> NA() | AQ78: =IF(ISNA(RC[-1])=1,"",RC[-5]) ->  | AR78: Burkina Faso | AS78: BFA | AT78: -0.35005012439575683 | AU78: 0.42866208060882488 | AV78: =1.64*RC[-1] -> 0.7030058121984728 | AW78: =IF(EQUAL(VLOOKUP(RC[-4],R9C3:R186C4,2,0),1),RC[-1],NA()) -> NA() | AX78: =IF(ISNA(RC[-1])=1,"",RC[-5]) ->  | AY78: Ghana | AZ78: GHA | BA78: -0.301476970023552 | BB78: 0.21052052859001816 | BC78: =1.64*RC[-1] -> 0.34525366688762976 | BD78: =IF(EQUAL(VLOOKUP(RC[-4],R9C3:R186C4,2,0),1),RC[-1],NA()) -> NA() | BE78: =IF(ISNA(RC[-1])=1,"",RC[-5]) -> 
B79: Haiti | C79: HTI | D79: =IF(EQUAL(ComparativeCharts!R[11]C,""),"",1) ->  | O79: 72 | P79: Senegal | Q79: SEN | R79: -0.29171288415045371 | S79: 0.25130023322348893 | T79: =1.64*RC[-1] -> 0.41213238248652184 | U79: =IF(EQUAL(VLOOKUP(RC[-4],R9C3:R186C4,2,0),1),RC[-1],NA()) -> NA() | V79: =IF(ISNA(RC[-1])=1,"",RC[-5]) ->  | W79: Egypt, Arab Rep. | X79: EGY | Y79: -6.6539632198739332E-2 | Z79: 0.24890572257575613 | AA79: =1.64*RC[-1] -> 0.40820538502424003 | AB79: =IF(EQUAL(VLOOKUP(RC[-4],R9C3:R186C4,2,0),1),RC[-1],NA()) -> NA() | AC79: =IF(ISNA(RC[-1])=1,"",RC[-5]) ->  | AD79: Guatemala | AE79: GTM | AF79: -0.2250182457894111 | AG79: 0.37414236442207388 | AH79: =1.64*RC[-1] -> 0.61359347765220118 | AI79: =IF(EQUAL(VLOOKUP(RC[-4],R9C3:R186C4,2,0),1),RC[-1],NA()) -> NA() | AJ79: =IF(ISNA(RC[-1])=1,"",RC[-5]) ->  | AK79: Malawi | AL79: MWI | AM79: 8.0826478281831537E-2 | AN79: 0.33164416564854249 | AO79: =1.64*RC[-1] -> 0.54389643166360968 | AP79: =IF(EQUAL(VLOOKUP(RC[-4],R9C3:R186C4,2,0),1),RC[-1],NA()) -> NA() | AQ79: =IF(ISNA(RC[-1])=1,"",RC[-5]) ->  | AR79: Cote d'Ivoire | AS79: CIV | AT79: -0.3348269483611106 | AU79: 0.2531854041328267 | AV79: =1.64*RC[-1] -> 0.41522406277783575 | AW79: =IF(EQUAL(VLOOKUP(RC[-4],R9C3:R186C4,2,0),1),RC[-1],NA()) -> NA() | AX79: =IF(ISNA(RC[-1])=1,"",RC[-5]) ->  | AY79: Bangladesh | AZ79: BGD | BA79: -0.2891094664326917 | BB79: 0.26706317040829514 | BC79: =1.64*RC[-1] -> 0.43798359946960402 | BD79: =IF(EQUAL(VLOOKUP(RC[-4],R9C3:R186C4,2,0),1),RC[-1],NA()) -> NA() | BE79: =IF(ISNA(RC[-1])=1,"",RC[-5]) -> 
B80: Hungary | C80: HUN | D80: =IF(EQUAL(ComparativeCharts!R[11]C,""),"",1) ->  | O80: 73 | P80: Georgia | Q80: GEO | R80: -0.29126764081502704 | S80: 0.35265752232120906 | T80: =1.64*RC[-1] -> 0.57835833660678282 | U80: =IF(EQUAL(VLOOKUP(RC[-4],R9C3:R186C4,2,0),1),RC[-1],NA()) -> NA() | V80: =IF(ISNA(RC[-1])=1,"",RC[-5]) ->  | W80: Jordan | X80: JOR | Y80: -5.6877174869652235E-2 | Z80: 0.26987977601169244 | AA80: =1.64*RC[-1] -> 0.44260283265917555 | AB80: =IF(EQUAL(VLOOKUP(RC[-4],R9C3:R186C4,2,0),1),RC[-1],NA()) -> NA() | AC80: =IF(ISNA(RC[-1])=1,"",RC[-5]) ->  | AD80: Bolivia | AE80: BOL | AF80: -0.22292354496409245 | AG80: 0.25933435987227932 | AH80: =1.64*RC[-1] -> 0.42530835019053803 | AI80: =IF(EQUAL(VLOOKUP(RC[-4],R9C3:R186C4,2,0),1),RC[-1],NA()) -> NA() | AJ80: =IF(ISNA(RC[-1])=1,"",RC[-5]) ->  | AK80: Honduras | AL80: HND | AM80: 8.1499453178648193E-2 | AN80: 0.51994095831945863 | AO80: =1.64*RC[-1] -> 0.85270317164391207 | AP80: =IF(EQUAL(VLOOKUP(RC[-4],R9C3:R186C4,2,0),1),RC[-1],NA()) -> NA() | AQ80: =IF(ISNA(RC[-1])=1,"",RC[-5]) ->  | AR80: Papua New Guinea | AS80: PNG | AT80: -0.30687778904128504 | AU80: 0.3138946252365733 | AV80: =1.64*RC[-1] -> 0.51478718538798018 | AW80: =IF(EQUAL(VLOOKUP(RC[-4],R9C3:R186C4,2,0),1),RC[-1],NA()) -> NA() | AX80: =IF(ISNA(RC[-1])=1,"",RC[-5]) ->  | AY80: China | AZ80: CHN | BA80: -0.28897340813691175 | BB80: 0.16383974411547927 | BC80: =1.64*RC[-1] -> 0.268697180349386 | BD80: =IF(EQUAL(VLOOKUP(RC[-4],R9C3:R186C4,2,0),1),RC[-1],NA()) -> NA() | BE80: =IF(ISNA(RC[-1])=1,"",RC[-5]) -> 
B81: Indonesia | C81: IDN | D81: =IF(EQUAL(ComparativeCharts!R[11]C,""),"",1) -> 1 | O81: 74 | P81: Tanzania | Q81: TZA | R81: -0.28345670099894266 | S81: 0.25130023322348893 | T81: =1.64*RC[-1] -> 0.41213238248652184 | U81: =IF(EQUAL(VLOOKUP(RC[-4],R9C3:R186C4,2,0),1),RC[-1],NA()) -> NA() | V81: =IF(ISNA(RC[-1])=1,"",RC[-5]) ->  | W81: India | X81: IND | Y81: -3.6608105749208815E-2 | Z81: 0.25228486761247954 | AA81: =1.64*RC[-1] -> 0.41374718288446644 | AB81: =IF(EQUAL(VLOOKUP(RC[-4],R9C3:R186C4,2,0),1),RC[-1],NA()) -> NA() | AC81: =IF(ISNA(RC[-1])=1,"",RC[-5]) ->  | AD81: Brazil | AE81: BRA | AF81: -0.21993543240760341 | AG81: 0.23363653218585126 | AH81: =1.64*RC[-1] -> 0.38316391278479606 | AI81: =IF(EQUAL(VLOOKUP(RC[-4],R9C3:R186C4,2,0),1),RC[-1],NA()) -> NA() | AJ81: =IF(ISNA(RC[-1])=1,"",RC[-5]) ->  | AK81: Lithuania | AL81: LTU | AM81: 8.917584760806356E-2 | AN81: 0.2628266479146692 | AO81: =1.64*RC[-1] -> 0.43103570258005747 | AP81: =IF(EQUAL(VLOOKUP(RC[-4],R9C3:R186C4,2,0),1),RC[-1],NA()) -> NA() | AQ81: =IF(ISNA(RC[-1])=1,"",RC[-5]) ->  | AR81: Syrian Arab Republic | AS81: SYR | AT81: -0.29081387838783451 | AU81: 0.27634968636657775 | AV81: =1.64*RC[-1] -> 0.45321348564118746 | AW81: =IF(EQUAL(VLOOKUP(RC[-4],R9C3:R186C4,2,0),1),RC[-1],NA()) -> NA() | AX81: =IF(ISNA(RC[-1])=1,"",RC[-5]) ->  | AY81: Mexico | AZ81: MEX | BA81: -0.27712617465768108 | BB81: 0.19620820843666348 | BC81: =1.64*RC[-1] -> 0.3217814618361281 | BD81: =IF(EQUAL(VLOOKUP(RC[-4],R9C3:R186C4,2,0),1),RC[-1],NA()) -> NA() | BE81: =IF(ISNA(RC[-1])=1,"",RC[-5]) -> 
B82: India | C82: IND | D82: =IF(EQUAL(ComparativeCharts!R[11]C,""),"",1) ->  | O82: 75 | P82: Kyrgyz Republic | Q82: KGZ | R82: -0.24768380419947719 | S82: 0.35265752232120906 | T82: =1.64*RC[-1] -> 0.57835833660678282 | U82: =IF(EQUAL(VLOOKUP(RC[-4],R9C3:R186C4,2,0),1),RC[-1],NA()) -> NA() | V82: =IF(ISNA(RC[-1])=1,"",RC[-5]) ->  | W82: El Salvador | X82: SLV | Y82: -2.1217878554327052E-2 | Z82: 0.31873333373090551 | AA82: =1.64*RC[-1] -> 0.522722667318685 | AB82: =IF(EQUAL(VLOOKUP(RC[-4],R9C3:R186C4,2,0),1),RC[-1],NA()) -> NA() | AC82: =IF(ISNA(RC[-1])=1,"",RC[-5]) ->  | AD82: Cote d'Ivoire | AE82: CIV | AF82: -0.18041327707637142 | AG82: 0.24040796242376472 | AH82: =1.64*RC[-1] -> 0.39426905837497411 | AI82: =IF(EQUAL(VLOOKUP(RC[-4],R9C3:R186C4,2,0),1),RC[-1],NA()) -> NA() | AJ82: =IF(ISNA(RC[-1])=1,"",RC[-5]) ->  | AK82: Venezuela, RB | AL82: VEN | AM82: 8.950740243290678E-2 | AN82: 0.22876000329023777 | AO82: =1.64*RC[-1] -> 0.37516640539598994 | AP82: =IF(EQUAL(VLOOKUP(RC[-4],R9C3:R186C4,2,0),1),RC[-1],NA()) -> NA() | AQ82: =IF(ISNA(RC[-1])=1,"",RC[-5]) ->  | AR82: Macedonia, FYR | AS82: MKD | AT82: -0.25634400865698043 | AU82: 0.20420608205612895 | AV82: =1.64*RC[-1] -> 0.33489797457205145 | AW82: =IF(EQUAL(VLOOKUP(RC[-4],R9C3:R186C4,2,0),1),RC[-1],NA()) -> NA() | AX82: =IF(ISNA(RC[-1])=1,"",RC[-5]) ->  | AY82: Argentina | AZ82: ARG | BA82: -0.27454750817661261 | BB82: 0.19805508574877892 | BC82: =1.64*RC[-1] -> 0.32481034062799741 | BD82: =IF(EQUAL(VLOOKUP(RC[-4],R9C3:R186C4,2,0),1),RC[-1],NA()) -> NA() | BE82: =IF(ISNA(RC[-1])=1,"",RC[-5]) -> 
B83: Ireland | C83: IRL | D83: =IF(EQUAL(ComparativeCharts!R[11]C,""),"",1) ->  | O83: 76 | P83: Morocco | Q83: MAR | R83: -0.23955570403641049 | S83: 0.25130023322348893 | T83: =1.64*RC[-1] -> 0.41213238248652184 | U83: =IF(EQUAL(VLOOKUP(RC[-4],R9C3:R186C4,2,0),1),RC[-1],NA()) -> NA() | V83: =IF(ISNA(RC[-1])=1,"",RC[-5]) ->  | W83: Zambia | X83: ZMB | Y83: -1.7818510496475459E-3 | Z83: 0.26599811359710124 | AA83: =1.64*RC[-1] -> 0.436236906299246 | AB83: =IF(EQUAL(VLOOKUP(RC[-4],R9C3:R186C4,2,0),1),RC[-1],NA()) -> NA() | AC83: =IF(ISNA(RC[-1])=1,"",RC[-5]) ->  | AD83: Ethiopia | AE83: ETH | AF83: -0.14643871296735336 | AG83: 0.31735550250726685 | AH83: =1.64*RC[-1] -> 0.52046302411191758 | AI83: =IF(EQUAL(VLOOKUP(RC[-4],R9C3:R186C4,2,0),1),RC[-1],NA()) -> NA() | AJ83: =IF(ISNA(RC[-1])=1,"",RC[-5]) ->  | AK83: Lebanon | AL83: LBN | AM83: 0.10225105087865453 | AN83: 0.39525422199815724 | AO83: =1.64*RC[-1] -> 0.64821692407697784 | AP83: =IF(EQUAL(VLOOKUP(RC[-4],R9C3:R186C4,2,0),1),RC[-1],NA()) -> NA() | AQ83: =IF(ISNA(RC[-1])=1,"",RC[-5]) ->  | AR83: Lesotho | AS83: LSO | AT83: -0.23987111346203671 | AU83: 0.5660803383253904 | AV83: =1.64*RC[-1] -> 0.92837175485364021 | AW83: =IF(EQUAL(VLOOKUP(RC[-4],R9C3:R186C4,2,0),1),RC[-1],NA()) -> NA() | AX83: =IF(ISNA(RC[-1])=1,"",RC[-5]) ->  | AY83: Egypt, Arab Rep. | AZ83: EGY | BA83: -0.26746062220309663 | BB83: 0.19785674920281118 | BC83: =1.64*RC[-1] -> 0.32448506869261035 | BD83: =IF(EQUAL(VLOOKUP(RC[-4],R9C3:R186C4,2,0),1),RC[-1],NA()) -> NA() | BE83: =IF(ISNA(RC[-1])=1,"",RC[-5]) -> 
B84: Iran, Islamic Rep. | C84: IRN | D84: =IF(EQUAL(ComparativeCharts!R[11]C,""),"",1) ->  | O84: 77 | P84: Burkina Faso | Q84: BFA | R84: -0.21346292357511837 | S84: 0.29137760175532934 | T84: =1.64*RC[-1] -> 0.47785926687874009 | U84: =IF(EQUAL(VLOOKUP(RC[-4],R9C3:R186C4,2,0),1),RC[-1],NA()) -> NA() | V84: =IF(ISNA(RC[-1])=1,"",RC[-5]) ->  | W84: Turkmenistan | X84: TKM | Y84: 3.8334542740207107E-3 | Z84: 0.32733070851464285 | AA84: =1.64*RC[-1] -> 0.53682236196401423 | AB84: =IF(EQUAL(VLOOKUP(RC[-4],R9C3:R186C4,2,0),1),RC[-1],NA()) -> NA() | AC84: =IF(ISNA(RC[-1])=1,"",RC[-5]) ->  | AD84: Suriname | AE84: SUR | AF84: -0.14638660150047547 | AG84: 0.76816878371913544 | AH84: =1.64*RC[-1] -> 1.259796805299382 | AI84: =IF(EQUAL(VLOOKUP(RC[-4],R9C3:R186C4,2,0),1),RC[-1],NA()) -> NA() | AJ84: =IF(ISNA(RC[-1])=1,"",RC[-5]) ->  | AK84: Egypt, Arab Rep. | AL84: EGY | AM84: 0.11787819215763888 | AN84: 0.23179312871987814 | AO84: =1.64*RC[-1] -> 0.38014073110060015 | AP84: =IF(EQUAL(VLOOKUP(RC[-4],R9C3:R186C4,2,0),1),RC[-1],NA()) -> NA() | AQ84: =IF(ISNA(RC[-1])=1,"",RC[-5]) ->  | AR84: Djibouti | AS84: DJI | AT84: -0.23493463314279112 | AU84: 0.60058386521254259 | AV84: =1.64*RC[-1] -> 0.98495753894856974 | AW84: =IF(EQUAL(VLOOKUP(RC[-4],R9C3:R186C4,2,0),1),RC[-1],NA()) -> NA() | AX84: =IF(ISNA(RC[-1])=1,"",RC[-5]) ->  | AY84: Latvia | AZ84: LVA | BA84: -0.26357495475887294 | BB84: 0.18193276470480088 | BC84: =1.64*RC[-1] -> 0.29836973411587342 | BD84: =IF(EQUAL(VLOOKUP(RC[-4],R9C3:R186C4,2,0),1),RC[-1],NA()) -> NA() | BE84: =IF(ISNA(RC[-1])=1,"",RC[-5]) -> 
B85: Iraq | C85: IRQ | D85: =IF(EQUAL(ComparativeCharts!R[11]C,""),"",1) -> 1 | O85: 78 | P85: Mozambique | Q85: MOZ | R85: -0.17211542685613546 | S85: 0.28728334123682875 | T85: =1.64*RC[-1] -> 0.47114467962839912 | U85: =IF(EQUAL(VLOOKUP(RC[-4],R9C3:R186C4,2,0),1),RC[-1],NA()) -> NA() | V85: =IF(ISNA(RC[-1])=1,"",RC[-5]) ->  | W85: Fiji | X85: FJI | Y85: 1.2305245947006655E-2 | Z85: 0.66053614439227493 | AA85: =1.64*RC[-1] -> 1.0832792768033308 | AB85: =IF(EQUAL(VLOOKUP(RC[-4],R9C3:R186C4,2,0),1),RC[-1],NA()) -> NA() | AC85: =IF(ISNA(RC[-1])=1,"",RC[-5]) ->  | AD85: Egypt, Arab Rep. | AE85: EGY | AF85: -0.13795229442171966 | AG85: 0.22281555993208196 | AH85: =1.64*RC[-1] -> 0.36541751828861441 | AI85: =IF(EQUAL(VLOOKUP(RC[-4],R9C3:R186C4,2,0),1),RC[-1],NA()) -> NA() | AJ85: =IF(ISNA(RC[-1])=1,"",RC[-5]) ->  | AK85: Indonesia | AL85: IDN | AM85: 0.12148773107287597 | AN85: 0.22904640098569978 | AO85: =1.64*RC[-1] -> 0.37563609761654765 | AP85: =IF(EQUAL(VLOOKUP(RC[-4],R9C3:R186C4,2,0),1),RC[-1],NA()) -> 0.37563609761654765 | AQ85: =IF(ISNA(RC[-1])=1,"",RC[-5]) -> IDN | AR85: Cambodia | AS85: KHM | AT85: -0.23493463314279112 | AU85: 0.60058386521254259 | AV85: =1.64*RC[-1] -> 0.98495753894856974 | AW85: =IF(EQUAL(VLOOKUP(RC[-4],R9C3:R186C4,2,0),1),RC[-1],NA()) -> NA() | AX85: =IF(ISNA(RC[-1])=1,"",RC[-5]) ->  | AY85: Togo | AZ85: TGO | BA85: -0.2420914810603231 | BB85: 0.48462245571009516 | BC85: =1.64*RC[-1] -> 0.79478082736455602 | BD85: =IF(EQUAL(VLOOKUP(RC[-4],R9C3:R186C4,2,0),1),RC[-1],NA()) -> NA() | BE85: =IF(ISNA(RC[-1])=1,"",RC[-5]) -> 
B86: Iceland | C86: ISL | D86: =IF(EQUAL(ComparativeCharts!R[11]C,""),"",1) ->  | O86: 79 | P86: Sri Lanka | Q86: LKA | R86: -0.15705882000857108 | S86: 0.25402694431067208 | T86: =1.64*RC[-1] -> 0.41660418866950216 | U86: =IF(EQUAL(VLOOKUP(RC[-4],R9C3:R186C4,2,0),1),RC[-1],NA()) -> NA() | V86: =IF(ISNA(RC[-1])=1,"",RC[-5]) ->  | W86: Romania | X86: ROM | Y86: 2.3685300230949745E-2 | Z86: 0.24354998171430456 | AA86: =1.64*RC[-1] -> 0.39942197001145946 | AB86: =IF(EQUAL(VLOOKUP(RC[-4],R9C3:R186C4,2,0),1),RC[-1],NA()) -> NA() | AC86: =IF(ISNA(RC[-1])=1,"",RC[-5]) ->  | AD86: West Bank and Gaza | AE86: WTB | AF86: -8.87164917796225E-2 | AG86: 0.5637075668724989 | AH86: =1.64*RC[-1] -> 0.92448040967089817 | AI86: =IF(EQUAL(VLOOKUP(RC[-4],R9C3:R186C4,2,0),1),RC[-1],NA()) -> NA() | AJ86: =IF(ISNA(RC[-1])=1,"",RC[-5]) ->  | AK86: Brazil | AL86: BRA | AM86: 0.13381615967891852 | AN86: 0.22876000329023777 | AO86: =1.64*RC[-1] -> 0.37516640539598994 | AP86: =IF(EQUAL(VLOOKUP(RC[-4],R9C3:R186C4,2,0),1),RC[-1],NA()) -> NA() | AQ86: =IF(ISNA(RC[-1])=1,"",RC[-5]) ->  | AR86: Brazil | AS86: BRA | AT86: -0.22209142972638229 | AU86: 0.20773727561581487 | AV86: =1.64*RC[-1] -> 0.34068913200993639 | AW86: =IF(EQUAL(VLOOKUP(RC[-4],R9C3:R186C4,2,0),1),RC[-1],NA()) -> NA() | AX86: =IF(ISNA(RC[-1])=1,"",RC[-5]) ->  | AY86: Senegal | AZ86: SEN | BA86: -0.23549296752031018 | BB86: 0.26842378896013652 | BC86: =1.64*RC[-1] -> 0.44021501389462386 | BD86: =IF(EQUAL(VLOOKUP(RC[-4],R9C3:R186C4,2,0),1),RC[-1],NA()) -> NA() | BE86: =IF(ISNA(RC[-1])=1,"",RC[-5]) -> 
B87: Israel | C87: ISR | D87: =IF(EQUAL(ComparativeCharts!R[11]C,""),"",1) ->  | O87: 80 | P87: Lesotho | Q87: LSO | R87: -0.14593359974076545 | S87: 0.36031461549530619 | T87: =1.64*RC[-1] -> 0.59091596941230207 | U87: =IF(EQUAL(VLOOKUP(RC[-4],R9C3:R186C4,2,0),1),RC[-1],NA()) -> NA() | V87: =IF(ISNA(RC[-1])=1,"",RC[-5]) ->  | W87: Malawi | X87: MWI | Y87: 3.9427810863173589E-2 | Z87: 0.2943853035379273 | AA87: =1.64*RC[-1] -> 0.48279189780220072 | AB87: =IF(EQUAL(VLOOKUP(RC[-4],R9C3:R186C4,2,0),1),RC[-1],NA()) -> NA() | AC87: =IF(ISNA(RC[-1])=1,"",RC[-5]) ->  | AD87: Benin | AE87: BEN | AF87: -6.6464363883482369E-2 | AG87: 0.5637075668724989 | AH87: =1.64*RC[-1] -> 0.92448040967089817 | AI87: =IF(EQUAL(VLOOKUP(RC[-4],R9C3:R186C4,2,0),1),RC[-1],NA()) -> NA() | AJ87: =IF(ISNA(RC[-1])=1,"",RC[-5]) ->  | AK87: Cote d'Ivoire | AL87: CIV | AM87: 0.14775610966350805 | AN87: 0.29118732384969281 | AO87: =1.64*RC[-1] -> 0.47754721111349618 | AP87: =IF(EQUAL(VLOOKUP(RC[-4],R9C3:R186C4,2,0),1),RC[-1],NA()) -> NA() | AQ87: =IF(ISNA(RC[-1])=1,"",RC[-5]) ->  | AR87: Bulgaria | AS87: BGR | AT87: -0.14979869952159189 | AU87: 0.17954824109220222 | AV87: =1.64*RC[-1] -> 0.29445911539121161 | AW87: =IF(EQUAL(VLOOKUP(RC[-4],R9C3:R186C4,2,0),1),RC[-1],NA()) -> NA() | AX87: =IF(ISNA(RC[-1])=1,"",RC[-5]) ->  | AY87: Philippines | AZ87: PHL | BA87: -0.22809035295426516 | BB87: 0.16383974411547927 | BC87: =1.64*RC[-1] -> 0.268697180349386 | BD87: =IF(EQUAL(VLOOKUP(RC[-4],R9C3:R186C4,2,0),1),RC[-1],NA()) -> NA() | BE87: =IF(ISNA(RC[-1])=1,"",RC[-5]) -> 
B88: Italy | C88: ITA | D88: =IF(EQUAL(ComparativeCharts!R[11]C,""),"",1) ->  | O88: 81 | P88: Malaysia | Q88: MYS | R88: -0.14363650519022855 | S88: 0.25130023322348893 | T88: =1.64*RC[-1] -> 0.41213238248652184 | U88: =IF(EQUAL(VLOOKUP(RC[-4],R9C3:R186C4,2,0),1),RC[-1],NA()) -> NA() | V88: =IF(ISNA(RC[-1])=1,"",RC[-5]) ->  | W88: Syrian Arab Republic | X88: SYR | Y88: 8.3332721723779674E-2 | Z88: 0.29988188904282925 | AA88: =1.64*RC[-1] -> 0.49180629803023995 | AB88: =IF(EQUAL(VLOOKUP(RC[-4],R9C3:R186C4,2,0),1),RC[-1],NA()) -> NA() | AC88: =IF(ISNA(RC[-1])=1,"",RC[-5]) ->  | AD88: Kuwait | AE88: KWT | AF88: -6.3434181322054486E-2 | AG88: 0.31908959204123422 | AH88: =1.64*RC[-1] -> 0.52330693094762404 | AI88: =IF(EQUAL(VLOOKUP(RC[-4],R9C3:R186C4,2,0),1),RC[-1],NA()) -> NA() | AJ88: =IF(ISNA(RC[-1])=1,"",RC[-5]) ->  | AK88: Slovak Republic | AL88: SVK | AM88: 0.16760463311523752 | AN88: 0.21645937618189412 | AO88: =1.64*RC[-1] -> 0.35499337693830635 | AP88: =IF(EQUAL(VLOOKUP(RC[-4],R9C3:R186C4,2,0),1),RC[-1],NA()) -> NA() | AQ88: =IF(ISNA(RC[-1])=1,"",RC[-5]) ->  | AR88: Armenia | AS88: ARM | AT88: -0.14626976465621802 | AU88: 0.19625062444278024 | AV88: =1.64*RC[-1] -> 0.32185102408615957 | AW88: =IF(EQUAL(VLOOKUP(RC[-4],R9C3:R186C4,2,0),1),RC[-1],NA()) -> NA() | AX88: =IF(ISNA(RC[-1])=1,"",RC[-5]) ->  | AY88: Bahrain | AZ88: BHR | BA88: -0.21498583790870973 | BB88: 0.26706317040829514 | BC88: =1.64*RC[-1] -> 0.43798359946960402 | BD88: =IF(EQUAL(VLOOKUP(RC[-4],R9C3:R186C4,2,0),1),RC[-1],NA()) -> NA() | BE88: =IF(ISNA(RC[-1])=1,"",RC[-5]) -> 
B89: Jamaica | C89: JAM | D89: =IF(EQUAL(ComparativeCharts!R[11]C,""),"",1) -> 1 | O89: 82 | P89: West Bank and Gaza | Q89: WTB | R89: -0.13155287654175118 | S89: 0.86447617573589797 | T89: =1.64*RC[-1] -> 1.4177409282068725 | U89: =IF(EQUAL(VLOOKUP(RC[-4],R9C3:R186C4,2,0),1),RC[-1],NA()) -> NA() | V89: =IF(ISNA(RC[-1])=1,"",RC[-5]) ->  | W89: Morocco | X89: MAR | Y89: 8.9980502461553508E-2 | Z89: 0.26599811359710124 | AA89: =1.64*RC[-1] -> 0.436236906299246 | AB89: =IF(EQUAL(VLOOKUP(RC[-4],R9C3:R186C4,2,0),1),RC[-1],NA()) -> NA() | AC89: =IF(ISNA(RC[-1])=1,"",RC[-5]) ->  | AD89: Burkina Faso | AE89: BFA | AF89: -5.9200859017791298E-2 | AG89: 0.31735550250726685 | AH89: =1.64*RC[-1] -> 0.52046302411191758 | AI89: =IF(EQUAL(VLOOKUP(RC[-4],R9C3:R186C4,2,0),1),RC[-1],NA()) -> NA() | AJ89: =IF(ISNA(RC[-1])=1,"",RC[-5]) ->  | AK89: Mongolia | AL89: MNG | AM89: 0.17084777374437296 | AN89: 0.51994095831945863 | AO89: =1.64*RC[-1] -> 0.85270317164391207 | AP89: =IF(EQUAL(VLOOKUP(RC[-4],R9C3:R186C4,2,0),1),RC[-1],NA()) -> 0.85270317164391207 | AQ89: =IF(ISNA(RC[-1])=1,"",RC[-5]) -> MNG | AR89: Zimbabwe | AS89: ZWE | AT89: -0.14567753799396543 | AU89: 0.23293385107779147 | AV89: =1.64*RC[-1] -> 0.38201151576757797 | AW89: =IF(EQUAL(VLOOKUP(RC[-4],R9C3:R186C4,2,0),1),RC[-1],NA()) -> NA() | AX89: =IF(ISNA(RC[-1])=1,"",RC[-5]) ->  | AY89: Peru | AZ89: PER | BA89: -0.19952274964841313 | BB89: 0.21344740542441654 | BC89: =1.64*RC[-1] -> 0.35005374489604307 | BD89: =IF(EQUAL(VLOOKUP(RC[-4],R9C3:R186C4,2,0),1),RC[-1],NA()) -> NA() | BE89: =IF(ISNA(RC[-1])=1,"",RC[-5]) -> 
B90: Jordan | C90: JOR | D90: =IF(EQUAL(ComparativeCharts!R[11]C,""),"",1) ->  | O90: 83 | P90: Colombia | Q90: COL | R90: -0.11998207819521983 | S90: 0.25130023322348893 | T90: =1.64*RC[-1] -> 0.41213238248652184 | U90: =IF(EQUAL(VLOOKUP(RC[-4],R9C3:R186C4,2,0),1),RC[-1],NA()) -> NA() | V90: =IF(ISNA(RC[-1])=1,"",RC[-5]) ->  | W90: West Bank and Gaza | X90: WTB | Y90: 0.11116567122826156 | Z90: 0.66053614439227493 | AA90: =1.64*RC[-1] -> 1.0832792768033308 | AB90: =IF(EQUAL(VLOOKUP(RC[-4],R9C3:R186C4,2,0),1),RC[-1],NA()) -> NA() | AC90: =IF(ISNA(RC[-1])=1,"",RC[-5]) ->  | AD90: Colombia | AE90: COL | AF90: -5.6625957250347983E-2 | AG90: 0.23363653218585126 | AH90: =1.64*RC[-1] -> 0.38316391278479606 | AI90: =IF(EQUAL(VLOOKUP(RC[-4],R9C3:R186C4,2,0),1),RC[-1],NA()) -> NA() | AJ90: =IF(ISNA(RC[-1])=1,"",RC[-5]) ->  | AK90: Tanzania | AL90: TZA | AM90: 0.18264872223997117 | AN90: 0.29118732384969281 | AO90: =1.64*RC[-1] -> 0.47754721111349618 | AP90: =IF(EQUAL(VLOOKUP(RC[-4],R9C3:R186C4,2,0),1),RC[-1],NA()) -> NA() | AQ90: =IF(ISNA(RC[-1])=1,"",RC[-5]) ->  | AR90: Guyana | AS90: GUY | AT90: -0.13994511790196557 | AU90: 0.44307336250641616 | AV90: =1.64*RC[-1] -> 0.72664031451052247 | AW90: =IF(EQUAL(VLOOKUP(RC[-4],R9C3:R186C4,2,0),1),RC[-1],NA()) -> NA() | AX90: =IF(ISNA(RC[-1])=1,"",RC[-5]) ->  | AY90: Malawi | AZ90: MWI | BA90: -0.19453285309721363 | BB90: 0.22389713439488995 | BC90: =1.64*RC[-1] -> 0.36719130040761949 | BD90: =IF(EQUAL(VLOOKUP(RC[-4],R9C3:R186C4,2,0),1),RC[-1],NA()) -> NA() | BE90: =IF(ISNA(RC[-1])=1,"",RC[-5]) -> 
B91: Japan | C91: JPN | D91: =IF(EQUAL(ComparativeCharts!R[11]C,""),"",1) ->  | O91: 84 | P91: Mexico | Q91: MEX | R91: -0.10836600321738513 | S91: 0.25130023322348893 | T91: =1.64*RC[-1] -> 0.41213238248652184 | U91: =IF(EQUAL(VLOOKUP(RC[-4],R9C3:R186C4,2,0),1),RC[-1],NA()) -> NA() | V91: =IF(ISNA(RC[-1])=1,"",RC[-5]) ->  | W91: Dominican Republic | X91: DOM | Y91: 0.12108667608083917 | Z91: 0.34248229323012747 | AA91: =1.64*RC[-1] -> 0.56167096089740898 | AB91: =IF(EQUAL(VLOOKUP(RC[-4],R9C3:R186C4,2,0),1),RC[-1],NA()) -> NA() | AC91: =IF(ISNA(RC[-1])=1,"",RC[-5]) ->  | AD91: Mali | AE91: MLI | AF91: -5.228077000029676E-2 | AG91: 0.51020118372025602 | AH91: =1.64*RC[-1] -> 0.8367299413012198 | AI91: =IF(EQUAL(VLOOKUP(RC[-4],R9C3:R186C4,2,0),1),RC[-1],NA()) -> NA() | AJ91: =IF(ISNA(RC[-1])=1,"",RC[-5]) ->  | AK91: Uganda | AL91: UGA | AM91: 0.18355962363041203 | AN91: 0.29118732384969281 | AO91: =1.64*RC[-1] -> 0.47754721111349618 | AP91: =IF(EQUAL(VLOOKUP(RC[-4],R9C3:R186C4,2,0),1),RC[-1],NA()) -> NA() | AQ91: =IF(ISNA(RC[-1])=1,"",RC[-5]) ->  | AR91: Senegal | AS91: SEN | AT91: -9.7340965303572044E-2 | AU91: 0.28505666681472658 | AV91: =1.64*RC[-1] -> 0.46749293357615157 | AW91: =IF(EQUAL(VLOOKUP(RC[-4],R9C3:R186C4,2,0),1),RC[-1],NA()) -> NA() | AX91: =IF(ISNA(RC[-1])=1,"",RC[-5]) ->  | AY91: Guinea-Bissau | AZ91: GNB | BA91: -0.17579347492755806 | BB91: 0.48462245571009516 | BC91: =1.64*RC[-1] -> 0.79478082736455602 | BD91: =IF(EQUAL(VLOOKUP(RC[-4],R9C3:R186C4,2,0),1),RC[-1],NA()) -> NA() | BE91: =IF(ISNA(RC[-1])=1,"",RC[-5]) -> 
B92: Kazakhstan | C92: KAZ | D92: =IF(EQUAL(ComparativeCharts!R[11]C,""),"",1) ->  | O92: 85 | P92: El Salvador | Q92: SLV | R92: -0.1001897658586632 | S92: 0.25402694431067208 | T92: =1.64*RC[-1] -> 0.41660418866950216 | U92: =IF(EQUAL(VLOOKUP(RC[-4],R9C3:R186C4,2,0),1),RC[-1],NA()) -> NA() | V92: =IF(ISNA(RC[-1])=1,"",RC[-5]) ->  | W92: Iran, Islamic Rep. | X92: IRN | Y92: 0.13455439909372338 | Z92: 0.27627136674287806 | AA92: =1.64*RC[-1] -> 0.45308504145831996 | AB92: =IF(EQUAL(VLOOKUP(RC[-4],R9C3:R186C4,2,0),1),RC[-1],NA()) -> NA() | AC92: =IF(ISNA(RC[-1])=1,"",RC[-5]) ->  | AD92: Slovak Republic | AE92: SVK | AF92: -3.1754158929577336E-2 | AG92: 0.22421487146088617 | AH92: =1.64*RC[-1] -> 0.36771238919585331 | AI92: =IF(EQUAL(VLOOKUP(RC[-4],R9C3:R186C4,2,0),1),RC[-1],NA()) -> NA() | AJ92: =IF(ISNA(RC[-1])=1,"",RC[-5]) ->  | AK92: Thailand | AL92: THA | AM92: 0.19216792549730768 | AN92: 0.22876000329023777 | AO92: =1.64*RC[-1] -> 0.37516640539598994 | AP92: =IF(EQUAL(VLOOKUP(RC[-4],R9C3:R186C4,2,0),1),RC[-1],NA()) -> NA() | AQ92: =IF(ISNA(RC[-1])=1,"",RC[-5]) ->  | AR92: Romania | AS92: ROM | AT92: -8.7639660545584641E-2 | AU92: 0.1861376812882912 | AV92: =1.64*RC[-1] -> 0.30526579731279752 | AW92: =IF(EQUAL(VLOOKUP(RC[-4],R9C3:R186C4,2,0),1),RC[-1],NA()) -> NA() | AX92: =IF(ISNA(RC[-1])=1,"",RC[-5]) ->  | AY92: Thailand | AZ92: THA | BA92: -0.16479157704324709 | BB92: 0.15865659221332654 | BC92: =1.64*RC[-1] -> 0.2601968112298555 | BD92: =IF(EQUAL(VLOOKUP(RC[-4],R9C3:R186C4,2,0),1),RC[-1],NA()) -> NA() | BE92: =IF(ISNA(RC[-1])=1,"",RC[-5]) -> 
B93: Kenya | C93: KEN | D93: =IF(EQUAL(ComparativeCharts!R[11]C,""),"",1) ->  | O93: 86 | P93: Dominican Republic | Q93: DOM | R93: -7.7885861394437914E-2 | S93: 0.25402694431067208 | T93: =1.64*RC[-1] -> 0.41660418866950216 | U93: =IF(EQUAL(VLOOKUP(RC[-4],R9C3:R186C4,2,0),1),RC[-1],NA()) -> NA() | V93: =IF(ISNA(RC[-1])=1,"",RC[-5]) ->  | W93: Ethiopia | X93: ETH | Y93: 0.14137593228340317 | Z93: 0.36279173932405639 | AA93: =1.64*RC[-1] -> 0.59497845249145243 | AB93: =IF(EQUAL(VLOOKUP(RC[-4],R9C3:R186C4,2,0),1),RC[-1],NA()) -> NA() | AC93: =IF(ISNA(RC[-1])=1,"",RC[-5]) ->  | AD93: Guinea | AE93: GIN | AF93: -2.9278715568244438E-2 | AG93: 0.51020118372025602 | AH93: =1.64*RC[-1] -> 0.8367299413012198 | AI93: =IF(EQUAL(VLOOKUP(RC[-4],R9C3:R186C4,2,0),1),RC[-1],NA()) -> NA() | AJ93: =IF(ISNA(RC[-1])=1,"",RC[-5]) ->  | AK93: Guinea | AL93: GIN | AM93: 0.19699042287553667 | AN93: 0.51661669269246691 | AO93: =1.64*RC[-1] -> 0.84725137601564571 | AP93: =IF(EQUAL(VLOOKUP(RC[-4],R9C3:R186C4,2,0),1),RC[-1],NA()) -> NA() | AQ93: =IF(ISNA(RC[-1])=1,"",RC[-5]) ->  | AR93: Philippines | AS93: PHL | AT93: -7.7658449611357455E-2 | AU93: 0.21813983950894791 | AV93: =1.64*RC[-1] -> 0.35774933679467458 | AW93: =IF(EQUAL(VLOOKUP(RC[-4],R9C3:R186C4,2,0),1),RC[-1],NA()) -> NA() | AX93: =IF(ISNA(RC[-1])=1,"",RC[-5]) ->  | AY93: Mongolia | AZ93: MNG | BA93: -0.14521853640269905 | BB93: 0.42205598059249466 | BC93: =1.64*RC[-1] -> 0.69217180817169122 | BD93: =IF(EQUAL(VLOOKUP(RC[-4],R9C3:R186C4,2,0),1),RC[-1],NA()) -> 0.69217180817169122 | BE93: =IF(ISNA(RC[-1])=1,"",RC[-5]) -> MNG
B94: Kyrgyz Republic | C94: KGZ | D94: =IF(EQUAL(ComparativeCharts!R[11]C,""),"",1) ->  | O94: 87 | P94: Hong Kong, China | Q94: HKG | R94: -7.3917558864768584E-2 | S94: 0.25130023322348893 | T94: =1.64*RC[-1] -> 0.41213238248652184 | U94: =IF(EQUAL(VLOOKUP(RC[-4],R9C3:R186C4,2,0),1),RC[-1],NA()) -> NA() | V94: =IF(ISNA(RC[-1])=1,"",RC[-5]) ->  | W94: Panama | X94: PAN | Y94: 0.14854399580717001 | Z94: 0.29988188904282925 | AA94: =1.64*RC[-1] -> 0.49180629803023995 | AB94: =IF(EQUAL(VLOOKUP(RC[-4],R9C3:R186C4,2,0),1),RC[-1],NA()) -> NA() | AC94: =IF(ISNA(RC[-1])=1,"",RC[-5]) ->  | AD94: South Africa | AE94: ZAF | AF94: -9.8237958811934756E-3 | AG94: 0.20561361077201445 | AH94: =1.64*RC[-1] -> 0.3372063216661037 | AI94: =IF(EQUAL(VLOOKUP(RC[-4],R9C3:R186C4,2,0),1),RC[-1],NA()) -> NA() | AJ94: =IF(ISNA(RC[-1])=1,"",RC[-5]) ->  | AK94: Romania | AL94: ROM | AM94: 0.1993319812386411 | AN94: 0.26326125682519685 | AO94: =1.64*RC[-1] -> 0.43174846119332283 | AP94: =IF(EQUAL(VLOOKUP(RC[-4],R9C3:R186C4,2,0),1),RC[-1],NA()) -> NA() | AQ94: =IF(ISNA(RC[-1])=1,"",RC[-5]) ->  | AR94: Swaziland | AS94: SWZ | AT94: -6.2168598845925724E-2 | AU94: 0.5660803383253904 | AV94: =1.64*RC[-1] -> 0.92837175485364021 | AW94: =IF(EQUAL(VLOOKUP(RC[-4],R9C3:R186C4,2,0),1),RC[-1],NA()) -> NA() | AX94: =IF(ISNA(RC[-1])=1,"",RC[-5]) ->  | AY94: Sri Lanka | AZ94: LKA | BA94: -0.12394461398139545 | BB94: 0.26706317040829514 | BC94: =1.64*RC[-1] -> 0.43798359946960402 | BD94: =IF(EQUAL(VLOOKUP(RC[-4],R9C3:R186C4,2,0),1),RC[-1],NA()) -> NA() | BE94: =IF(ISNA(RC[-1])=1,"",RC[-5]) -> 
B95: Cambodia | C95: KHM | D95: =IF(EQUAL(ComparativeCharts!R[11]C,""),"",1) ->  | O95: 88 | P95: Honduras | Q95: HND | R95: -5.5306226150604314E-2 | S95: 0.25402694431067208 | T95: =1.64*RC[-1] -> 0.41660418866950216 | U95: =IF(EQUAL(VLOOKUP(RC[-4],R9C3:R186C4,2,0),1),RC[-1],NA()) -> NA() | V95: =IF(ISNA(RC[-1])=1,"",RC[-5]) ->  | W95: Korea, Rep. | X95: KOR | Y95: 0.16434900905249569 | Z95: 0.25228486761247954 | AA95: =1.64*RC[-1] -> 0.41374718288446644 | AB95: =IF(EQUAL(VLOOKUP(RC[-4],R9C3:R186C4,2,0),1),RC[-1],NA()) -> NA() | AC95: =IF(ISNA(RC[-1])=1,"",RC[-5]) ->  | AD95: Brunei | AE95: BRN | AF95: 8.6417987560675636E-3 | AG95: 0.76816878371913544 | AH95: =1.64*RC[-1] -> 1.259796805299382 | AI95: =IF(EQUAL(VLOOKUP(RC[-4],R9C3:R186C4,2,0),1),RC[-1],NA()) -> NA() | AJ95: =IF(ISNA(RC[-1])=1,"",RC[-5]) ->  | AK95: Morocco | AL95: MAR | AM95: 0.21598677305163816 | AN95: 0.29118732384969281 | AO95: =1.64*RC[-1] -> 0.47754721111349618 | AP95: =IF(EQUAL(VLOOKUP(RC[-4],R9C3:R186C4,2,0),1),RC[-1],NA()) -> NA() | AQ95: =IF(ISNA(RC[-1])=1,"",RC[-5]) ->  | AR95: China | AS95: CHN | AT95: -4.0035487589544685E-2 | AU95: 0.21813983950894791 | AV95: =1.64*RC[-1] -> 0.35774933679467458 | AW95: =IF(EQUAL(VLOOKUP(RC[-4],R9C3:R186C4,2,0),1),RC[-1],NA()) -> NA() | AX95: =IF(ISNA(RC[-1])=1,"",RC[-5]) ->  | AY95: Jamaica | AZ95: JAM | BA95: -0.11620599480498998 | BB95: 0.26842378896013652 | BC95: =1.64*RC[-1] -> 0.44021501389462386 | BD95: =IF(EQUAL(VLOOKUP(RC[-4],R9C3:R186C4,2,0),1),RC[-1],NA()) -> 0.44021501389462386 | BE95: =IF(ISNA(RC[-1])=1,"",RC[-5]) -> JAM
B96: Korea, Rep. | C96: KOR | D96: =IF(EQUAL(ComparativeCharts!R[11]C,""),"",1) ->  | O96: 89 | P96: Central African Republic | Q96: CAF | R96: -4.5832298047789967E-2 | S96: 0.36031461549530619 | T96: =1.64*RC[-1] -> 0.59091596941230207 | U96: =IF(EQUAL(VLOOKUP(RC[-4],R9C3:R186C4,2,0),1),RC[-1],NA()) -> NA() | V96: =IF(ISNA(RC[-1])=1,"",RC[-5]) ->  | W96: Cuba | X96: CUB | Y96: 0.19037893098759523 | Z96: 0.29988188904282925 | AA96: =1.64*RC[-1] -> 0.49180629803023995 | AB96: =IF(EQUAL(VLOOKUP(RC[-4],R9C3:R186C4,2,0),1),RC[-1],NA()) -> NA() | AC96: =IF(ISNA(RC[-1])=1,"",RC[-5]) ->  | AD96: Guyana | AE96: GUY | AF96: 8.6417987560675636E-3 | AG96: 0.76816878371913544 | AH96: =1.64*RC[-1] -> 1.259796805299382 | AI96: =IF(EQUAL(VLOOKUP(RC[-4],R9C3:R186C4,2,0),1),RC[-1],NA()) -> NA() | AJ96: =IF(ISNA(RC[-1])=1,"",RC[-5]) ->  | AK96: Mauritius | AL96: MUS | AM96: 0.21701620969144944 | AN96: 0.35021398990291308 | AO96: =1.64*RC[-1] -> 0.57435094344077742 | AP96: =IF(EQUAL(VLOOKUP(RC[-4],R9C3:R186C4,2,0),1),RC[-1],NA()) -> NA() | AQ96: =IF(ISNA(RC[-1])=1,"",RC[-5]) ->  | AR96: Moldova | AS96: MDA | AT96: -1.8974292502005323E-2 | AU96: 0.17954824109220222 | AV96: =1.64*RC[-1] -> 0.29445911539121161 | AW96: =IF(EQUAL(VLOOKUP(RC[-4],R9C3:R186C4,2,0),1),RC[-1],NA()) -> NA() | AX96: =IF(ISNA(RC[-1])=1,"",RC[-5]) ->  | AY96: Cote d'Ivoire | AZ96: CIV | BA96: -7.9273098877662054E-2 | BB96: 0.21052052859001816 | BC96: =1.64*RC[-1] -> 0.34525366688762976 | BD96: =IF(EQUAL(VLOOKUP(RC[-4],R9C3:R186C4,2,0),1),RC[-1],NA()) -> NA() | BE96: =IF(ISNA(RC[-1])=1,"",RC[-5]) -> 
B97: Kuwait | C97: KWT | D97: =IF(EQUAL(ComparativeCharts!R[11]C,""),"",1) ->  | O97: 90 | P97: Zambia | Q97: ZMB | R97: -4.5586544199757564E-2 | S97: 0.25130023322348893 | T97: =1.64*RC[-1] -> 0.41213238248652184 | U97: =IF(EQUAL(VLOOKUP(RC[-4],R9C3:R186C4,2,0),1),RC[-1],NA()) -> NA() | V97: =IF(ISNA(RC[-1])=1,"",RC[-5]) ->  | W97: Greece | X97: GRC | Y97: 0.20501914420146183 | Z97: 0.26334453452009404 | AA97: =1.64*RC[-1] -> 0.43188503661295419 | AB97: =IF(EQUAL(VLOOKUP(RC[-4],R9C3:R186C4,2,0),1),RC[-1],NA()) -> NA() | AC97: =IF(ISNA(RC[-1])=1,"",RC[-5]) ->  | AD97: Sierra Leone | AE97: SLE | AF97: 8.6417987560675636E-3 | AG97: 0.76816878371913544 | AH97: =1.64*RC[-1] -> 1.259796805299382 | AI97: =IF(EQUAL(VLOOKUP(RC[-4],R9C3:R186C4,2,0),1),RC[-1],NA()) -> NA() | AJ97: =IF(ISNA(RC[-1])=1,"",RC[-5]) ->  | AK97: Korea, Rep. | AL97: KOR | AM97: 0.21903128552230844 | AN97: 0.22876000329023777 | AO97: =1.64*RC[-1] -> 0.37516640539598994 | AP97: =IF(EQUAL(VLOOKUP(RC[-4],R9C3:R186C4,2,0),1),RC[-1],NA()) -> NA() | AQ97: =IF(ISNA(RC[-1])=1,"",RC[-5]) ->  | AR97: Ghana | AS97: GHA | AT97: -1.3612351261324439E-2 | AU97: 0.2531854041328267 | AV97: =1.64*RC[-1] -> 0.41522406277783575 | AW97: =IF(EQUAL(VLOOKUP(RC[-4],R9C3:R186C4,2,0),1),RC[-1],NA()) -> NA() | AX97: =IF(ISNA(RC[-1])=1,"",RC[-5]) ->  | AY97: United Arab Emirates | AZ97: ARE | BA97: -2.6886737681040048E-2 | BB97: 0.26706317040829514 | BC97: =1.64*RC[-1] -> 0.43798359946960402 | BD97: =IF(EQUAL(VLOOKUP(RC[-4],R9C3:R186C4,2,0),1),RC[-1],NA()) -> NA() | BE97: =IF(ISNA(RC[-1])=1,"",RC[-5]) -> 
B98: Lao, PDR | C98: LAO | D98: =IF(EQUAL(ComparativeCharts!R[11]C,""),"",1) ->  | O98: 91 | P98: Bangladesh | Q98: BGD | R98: -1.4932705507372059E-2 | S98: 0.25402694431067208 | T98: =1.64*RC[-1] -> 0.41660418866950216 | U98: =IF(EQUAL(VLOOKUP(RC[-4],R9C3:R186C4,2,0),1),RC[-1],NA()) -> NA() | V98: =IF(ISNA(RC[-1])=1,"",RC[-5]) ->  | W98: Kazakhstan | X98: KAZ | Y98: 0.22141392338600255 | Z98: 0.22286975705685766 | AA98: =1.64*RC[-1] -> 0.36550640157324654 | AB98: =IF(EQUAL(VLOOKUP(RC[-4],R9C3:R186C4,2,0),1),RC[-1],NA()) -> NA() | AC98: =IF(ISNA(RC[-1])=1,"",RC[-5]) ->  | AD98: Thailand | AE98: THA | AF98: 9.7676169721577846E-3 | AG98: 0.23363653218585126 | AH98: =1.64*RC[-1] -> 0.38316391278479606 | AI98: =IF(EQUAL(VLOOKUP(RC[-4],R9C3:R186C4,2,0),1),RC[-1],NA()) -> NA() | AJ98: =IF(ISNA(RC[-1])=1,"",RC[-5]) ->  | AK98: Guyana | AL98: GUY | AM98: 0.23395301208085831 | AN98: 0.51994095831945863 | AO98: =1.64*RC[-1] -> 0.85270317164391207 | AP98: =IF(EQUAL(VLOOKUP(RC[-4],R9C3:R186C4,2,0),1),RC[-1],NA()) -> NA() | AQ98: =IF(ISNA(RC[-1])=1,"",RC[-5]) ->  | AR98: Uganda | AS98: UGA | AT98: -1.3319738104621512E-2 | AU98: 0.2531854041328267 | AV98: =1.64*RC[-1] -> 0.41522406277783575 | AW98: =IF(EQUAL(VLOOKUP(RC[-4],R9C3:R186C4,2,0),1),RC[-1],NA()) -> NA() | AX98: =IF(ISNA(RC[-1])=1,"",RC[-5]) ->  | AY98: Brunei | AZ98: BRN | BA98: -1.8665703086703719E-2 | BB98: 0.74867439619943676 | BC98: =1.64*RC[-1] -> 1.2278260097670761 | BD98: =IF(EQUAL(VLOOKUP(RC[-4],R9C3:R186C4,2,0),1),RC[-1],NA()) -> NA() | BE98: =IF(ISNA(RC[-1])=1,"",RC[-5]) -> 
B99: Lebanon | C99: LBN | D99: =IF(EQUAL(ComparativeCharts!R[11]C,""),"",1) ->  | O99: 92 | P99: Ukraine | Q99: UKR | R99: -8.4113812952355729E-3 | S99: 0.25130023322348893 | T99: =1.64*RC[-1] -> 0.41213238248652184 | U99: =IF(EQUAL(VLOOKUP(RC[-4],R9C3:R186C4,2,0),1),RC[-1],NA()) -> NA() | V99: =IF(ISNA(RC[-1])=1,"",RC[-5]) ->  | W99: Saudi Arabia | X99: SAU | Y99: 0.23892072789390917 | Z99: 0.27627136674287806 | AA99: =1.64*RC[-1] -> 0.45308504145831996 | AB99: =IF(EQUAL(VLOOKUP(RC[-4],R9C3:R186C4,2,0),1),RC[-1],NA()) -> NA() | AC99: =IF(ISNA(RC[-1])=1,"",RC[-5]) ->  | AD99: China | AE99: CHN | AF99: 1.5589979476754863E-2 | AG99: 0.24866131188801807 | AH99: =1.64*RC[-1] -> 0.40780455149634959 | AI99: =IF(EQUAL(VLOOKUP(RC[-4],R9C3:R186C4,2,0),1),RC[-1],NA()) -> NA() | AJ99: =IF(ISNA(RC[-1])=1,"",RC[-5]) ->  | AK99: Croatia | AL99: HRV | AM99: 0.2381709682588288 | AN99: 0.26326125682519685 | AO99: =1.64*RC[-1] -> 0.43174846119332283 | AP99: =IF(EQUAL(VLOOKUP(RC[-4],R9C3:R186C4,2,0),1),RC[-1],NA()) -> NA() | AQ99: =IF(ISNA(RC[-1])=1,"",RC[-5]) ->  | AR99: Turkey | AS99: TUR | AT99: -1.0424009210796652E-2 | AU99: 0.20773727561581487 | AV99: =1.64*RC[-1] -> 0.34068913200993639 | AW99: =IF(EQUAL(VLOOKUP(RC[-4],R9C3:R186C4,2,0),1),RC[-1],NA()) -> NA() | AX99: =IF(ISNA(RC[-1])=1,"",RC[-5]) ->  | AY99: Gambia, The | AZ99: GMB | BA99: -1.8665703086703719E-2 | BB99: 0.74867439619943676 | BC99: =1.64*RC[-1] -> 1.2278260097670761 | BD99: =IF(EQUAL(VLOOKUP(RC[-4],R9C3:R186C4,2,0),1),RC[-1],NA()) -> NA() | BE99: =IF(ISNA(RC[-1])=1,"",RC[-5]) -> 
B100: Liberia | C100: LBR | D100: =IF(EQUAL(ComparativeCharts!R[11]C,""),"",1) ->  | O100: 93 | P100: Albania | Q100: ALB | R100: -7.7479767490819564E-3 | S100: 0.28728334123682875 | T100: =1.64*RC[-1] -> 0.47114467962839912 | U100: =IF(EQUAL(VLOOKUP(RC[-4],R9C3:R186C4,2,0),1),RC[-1],NA()) -> NA() | V100: =IF(ISNA(RC[-1])=1,"",RC[-5]) ->  | W100: Thailand | X100: THA | Y100: 0.2461178006073827 | Z100: 0.25228486761247954 | AA100: =1.64*RC[-1] -> 0.41374718288446644 | AB100: =IF(EQUAL(VLOOKUP(RC[-4],R9C3:R186C4,2,0),1),RC[-1],NA()) -> NA() | AC100: =IF(ISNA(RC[-1])=1,"",RC[-5]) ->  | AD100: Mongolia | AE100: MNG | AF100: 1.7689353649143313E-2 | AG100: 0.38583281786348905 | AH100: =1.64*RC[-1] -> 0.63276582129612202 | AI100: =IF(EQUAL(VLOOKUP(RC[-4],R9C3:R186C4,2,0),1),RC[-1],NA()) -> 0.63276582129612202 | AJ100: =IF(ISNA(RC[-1])=1,"",RC[-5]) -> MNG | AK100: South Africa | AL100: ZAF | AM100: 0.24361670472254493 | AN100: 0.20221972659853155 | AO100: =1.64*RC[-1] -> 0.33164035162159172 | AP100: =IF(EQUAL(VLOOKUP(RC[-4],R9C3:R186C4,2,0),1),RC[-1],NA()) -> NA() | AQ100: =IF(ISNA(RC[-1])=1,"",RC[-5]) ->  | AR100: Mongolia | AS100: MNG | AT100: 3.9107465940165363E-2 | AU100: 0.31717363477043808 | AV100: =1.64*RC[-1] -> 0.52016476102351838 | AW100: =IF(EQUAL(VLOOKUP(RC[-4],R9C3:R186C4,2,0),1),RC[-1],NA()) -> 0.52016476102351838 | AX100: =IF(ISNA(RC[-1])=1,"",RC[-5]) -> MNG | AY100: Guyana | AZ100: GUY | BA100: -1.8665703086703719E-2 | BB100: 0.74867439619943676 | BC100: =1.64*RC[-1] -> 1.2278260097670761 | BD100: =IF(EQUAL(VLOOKUP(RC[-4],R9C3:R186C4,2,0),1),RC[-1],NA()) -> NA() | BE100: =IF(ISNA(RC[-1])=1,"",RC[-5]) -> 
B101: Libya | C101: LBY | D101: =IF(EQUAL(ComparativeCharts!R[11]C,""),"",1) -> 1 | O101: 94 | P101: Kuwait | Q101: KWT | R101: 2.5700635497022758E-4 | S101: 0.25402694431067208 | T101: =1.64*RC[-1] -> 0.41660418866950216 | U101: =IF(EQUAL(VLOOKUP(RC[-4],R9C3:R186C4,2,0),1),RC[-1],NA()) -> NA() | V101: =IF(ISNA(RC[-1])=1,"",RC[-5]) ->  | W101: Philippines | X101: PHL | Y101: 0.27294274491449522 | Z101: 0.26334453452009404 | AA101: =1.64*RC[-1] -> 0.43188503661295419 | AB101: =IF(EQUAL(VLOOKUP(RC[-4],R9C3:R186C4,2,0),1),RC[-1],NA()) -> NA() | AC101: =IF(ISNA(RC[-1])=1,"",RC[-5]) ->  | AD101: Namibia | AE101: NAM | AF101: 4.4411189859742371E-2 | AG101: 0.2550047380374903 | AH101: =1.64*RC[-1] -> 0.41820777038148405 | AI101: =IF(EQUAL(VLOOKUP(RC[-4],R9C3:R186C4,2,0),1),RC[-1],NA()) -> NA() | AJ101: =IF(ISNA(RC[-1])=1,"",RC[-5]) ->  | AK101: Zambia | AL101: ZMB | AM101: 0.25185885601012226 | AN101: 0.29118732384969281 | AO101: =1.64*RC[-1] -> 0.47754721111349618 | AP101: =IF(EQUAL(VLOOKUP(RC[-4],R9C3:R186C4,2,0),1),RC[-1],NA()) -> NA() | AQ101: =IF(ISNA(RC[-1])=1,"",RC[-5]) ->  | AR101: Belize | AS101: BLZ | AT101: 8.7966341143743798E-2 | AU101: 0.60058386521254259 | AV101: =1.64*RC[-1] -> 0.98495753894856974 | AW101: =IF(EQUAL(VLOOKUP(RC[-4],R9C3:R186C4,2,0),1),RC[-1],NA()) -> NA() | AX101: =IF(ISNA(RC[-1])=1,"",RC[-5]) ->  | AY101: Sierra Leone | AZ101: SLE | BA101: -1.8665703086703719E-2 | BB101: 0.74867439619943676 | BC101: =1.64*RC[-1] -> 1.2278260097670761 | BD101: =IF(EQUAL(VLOOKUP(RC[-4],R9C3:R186C4,2,0),1),RC[-1],NA()) -> NA() | BE101: =IF(ISNA(RC[-1])=1,"",RC[-5]) -> 
B102: Sri Lanka | C102: LKA | D102: =IF(EQUAL(ComparativeCharts!R[11]C,""),"",1) ->  | O102: 95 | P102: Fiji | Q102: FJI | R102: 1.2954451943482074E-2 | S102: 0.35265752232120906 | T102: =1.64*RC[-1] -> 0.57835833660678282 | U102: =IF(EQUAL(VLOOKUP(RC[-4],R9C3:R186C4,2,0),1),RC[-1],NA()) -> NA() | V102: =IF(ISNA(RC[-1])=1,"",RC[-5]) ->  | W102: Trinidad and Tobago& Tob* | X102: TTO | Y102: 0.31527158288389395 | Z102: 0.34248229323012747 | AA102: =1.64*RC[-1] -> 0.56167096089740898 | AB102: =IF(EQUAL(VLOOKUP(RC[-4],R9C3:R186C4,2,0),1),RC[-1],NA()) -> NA() | AC102: =IF(ISNA(RC[-1])=1,"",RC[-5]) ->  | AD102: Senegal | AE102: SEN | AF102: 4.7393144029681138E-2 | AG102: 0.28640182983633161 | AH102: =1.64*RC[-1] -> 0.46969900093158379 | AI102: =IF(EQUAL(VLOOKUP(RC[-4],R9C3:R186C4,2,0),1),RC[-1],NA()) -> NA() | AJ102: =IF(ISNA(RC[-1])=1,"",RC[-5]) ->  | AK102: Namibia | AL102: NAM | AM102: 0.2667298981356363 | AN102: 0.33251863866145182 | AO102: =1.64*RC[-1] -> 0.54533056740478092 | AP102: =IF(EQUAL(VLOOKUP(RC[-4],R9C3:R186C4,2,0),1),RC[-1],NA()) -> NA() | AQ102: =IF(ISNA(RC[-1])=1,"",RC[-5]) ->  | AR102: Cape verde | AS102: CPV | AT102: 8.7966341143743798E-2 | AU102: 0.60058386521254259 | AV102: =1.64*RC[-1] -> 0.98495753894856974 | AW102: =IF(EQUAL(VLOOKUP(RC[-4],R9C3:R186C4,2,0),1),RC[-1],NA()) -> NA() | AX102: =IF(ISNA(RC[-1])=1,"",RC[-5]) ->  | AY102: Suriname | AZ102: SUR | BA102: -1.8665703086703719E-2 | BB102: 0.74867439619943676 | BC102: =1.64*RC[-1] -> 1.2278260097670761 | BD102: =IF(EQUAL(VLOOKUP(RC[-4],R9C3:R186C4,2,0),1),RC[-1],NA()) -> NA() | BE102: =IF(ISNA(RC[-1])=1,"",RC[-5]) -> 
B103: Lesotho | C103: LSO | D103: =IF(EQUAL(ComparativeCharts!R[11]C,""),"",1) ->  | O103: 96 | P103: Armenia | Q103: ARM | R103: 1.8827951270447892E-2 | S103: 0.28728334123682875 | T103: =1.64*RC[-1] -> 0.47114467962839912 | U103: =IF(EQUAL(VLOOKUP(RC[-4],R9C3:R186C4,2,0),1),RC[-1],NA()) -> NA() | V103: =IF(ISNA(RC[-1])=1,"",RC[-5]) ->  | W103: Kyrgyz Republic | X103: KGZ | Y103: 0.31771393088913641 | Z103: 0.3067849652941122 | AA103: =1.64*RC[-1] -> 0.50312734308234397 | AB103: =IF(EQUAL(VLOOKUP(RC[-4],R9C3:R186C4,2,0),1),RC[-1],NA()) -> NA() | AC103: =IF(ISNA(RC[-1])=1,"",RC[-5]) ->  | AD103: Latvia | AE103: LVA | AF103: 6.7637979286703107E-2 | AG103: 0.24259893305862151 | AH103: =1.64*RC[-1] -> 0.39786225021613925 | AI103: =IF(EQUAL(VLOOKUP(RC[-4],R9C3:R186C4,2,0),1),RC[-1],NA()) -> NA() | AJ103: =IF(ISNA(RC[-1])=1,"",RC[-5]) ->  | AK103: Ghana | AL103: GHA | AM103: 0.27836296766957042 | AN103: 0.29118732384969281 | AO103: =1.64*RC[-1] -> 0.47754721111349618 | AP103: =IF(EQUAL(VLOOKUP(RC[-4],R9C3:R186C4,2,0),1),RC[-1],NA()) -> NA() | AQ103: =IF(ISNA(RC[-1])=1,"",RC[-5]) ->  | AR103: Cuba | AS103: CUB | AT103: 0.11462847171625115 | AU103: 0.27634968636657775 | AV103: =1.64*RC[-1] -> 0.45321348564118746 | AW103: =IF(EQUAL(VLOOKUP(RC[-4],R9C3:R186C4,2,0),1),RC[-1],NA()) -> NA() | AX103: =IF(ISNA(RC[-1])=1,"",RC[-5]) ->  | AY103: Swaziland | AZ103: SWZ | BA103: 7.1867430269489836E-3 | BB103: 0.37611079170421424 | BC103: =1.64*RC[-1] -> 0.6168216983949113 | BD103: =IF(EQUAL(VLOOKUP(RC[-4],R9C3:R186C4,2,0),1),RC[-1],NA()) -> NA() | BE103: =IF(ISNA(RC[-1])=1,"",RC[-5]) -> 
B104: Lithuania | C104: LTU | D104: =IF(EQUAL(ComparativeCharts!R[11]C,""),"",1) ->  | O104: 97 | P104: Singapore | Q104: SGP | R104: 3.9807268377849564E-2 | S104: 0.25130023322348893 | T104: =1.64*RC[-1] -> 0.41213238248652184 | U104: =IF(EQUAL(VLOOKUP(RC[-4],R9C3:R186C4,2,0),1),RC[-1],NA()) -> NA() | V104: =IF(ISNA(RC[-1])=1,"",RC[-5]) ->  | W104: Lithuania | X104: LTU | Y104: 0.34571648933457971 | Z104: 0.2347220744274687 | AA104: =1.64*RC[-1] -> 0.38494420206104862 | AB104: =IF(EQUAL(VLOOKUP(RC[-4],R9C3:R186C4,2,0),1),RC[-1],NA()) -> NA() | AC104: =IF(ISNA(RC[-1])=1,"",RC[-5]) ->  | AD104: Philippines | AE104: PHL | AF104: 0.12646049818518471 | AG104: 0.24866131188801807 | AH104: =1.64*RC[-1] -> 0.40780455149634959 | AI104: =IF(EQUAL(VLOOKUP(RC[-4],R9C3:R186C4,2,0),1),RC[-1],NA()) -> NA() | AJ104: =IF(ISNA(RC[-1])=1,"",RC[-5]) ->  | AK104: Belize | AL104: BLZ | AM104: 0.28825474814933105 | AN104: 0.60188084442426626 | AO104: =1.64*RC[-1] -> 0.98708458485579664 | AP104: =IF(EQUAL(VLOOKUP(RC[-4],R9C3:R186C4,2,0),1),RC[-1],NA()) -> NA() | AQ104: =IF(ISNA(RC[-1])=1,"",RC[-5]) ->  | AR104: Egypt, Arab Rep. | AS104: EGY | AT104: 0.12790286079210489 | AU104: 0.23318099104208728 | AV104: =1.64*RC[-1] -> 0.3824168253090231 | AW104: =IF(EQUAL(VLOOKUP(RC[-4],R9C3:R186C4,2,0),1),RC[-1],NA()) -> NA() | AX104: =IF(ISNA(RC[-1])=1,"",RC[-5]) ->  | AY104: Tunisia | AZ104: TUN | BA104: 2.0011949898237062E-2 | BB104: 0.22310568461604569 | BC104: =1.64*RC[-1] -> 0.36589332277031489 | BD104: =IF(EQUAL(VLOOKUP(RC[-4],R9C3:R186C4,2,0),1),RC[-1],NA()) -> 0.36589332277031489 | BE104: =IF(ISNA(RC[-1])=1,"",RC[-5]) -> TUN
B105: Luxembourg | C105: LUX | D105: =IF(EQUAL(ComparativeCharts!R[11]C,""),"",1) ->  | O105: 98 | P105: Nepal | Q105: NPL | R105: 4.7365463347793076E-2 | S105: 0.36031461549530619 | T105: =1.64*RC[-1] -> 0.59091596941230207 | U105: =IF(EQUAL(VLOOKUP(RC[-4],R9C3:R186C4,2,0),1),RC[-1],NA()) -> NA() | V105: =IF(ISNA(RC[-1])=1,"",RC[-5]) ->  | W105: Uruguay | X105: URY | Y105: 0.34793648528719973 | Z105: 0.29988188904282925 | AA105: =1.64*RC[-1] -> 0.49180629803023995 | AB105: =IF(EQUAL(VLOOKUP(RC[-4],R9C3:R186C4,2,0),1),RC[-1],NA()) -> NA() | AC105: =IF(ISNA(RC[-1])=1,"",RC[-5]) ->  | AD105: Lithuania | AE105: LTU | AF105: 0.12684759663060247 | AG105: 0.24259893305862151 | AH105: =1.64*RC[-1] -> 0.39786225021613925 | AI105: =IF(EQUAL(VLOOKUP(RC[-4],R9C3:R186C4,2,0),1),RC[-1],NA()) -> NA() | AJ105: =IF(ISNA(RC[-1])=1,"",RC[-5]) ->  | AK105: Colombia | AL105: COL | AM105: 0.28954507575052796 | AN105: 0.22876000329023777 | AO105: =1.64*RC[-1] -> 0.37516640539598994 | AP105: =IF(EQUAL(VLOOKUP(RC[-4],R9C3:R186C4,2,0),1),RC[-1],NA()) -> NA() | AQ105: =IF(ISNA(RC[-1])=1,"",RC[-5]) ->  | AR105: Slovak Republic | AS105: SVK | AT105: 0.13405598739383026 | AU105: 0.17187769714012563 | AV105: =1.64*RC[-1] -> 0.28187942330980603 | AW105: =IF(EQUAL(VLOOKUP(RC[-4],R9C3:R186C4,2,0),1),RC[-1],NA()) -> NA() | AX105: =IF(ISNA(RC[-1])=1,"",RC[-5]) ->  | AY105: Slovak Republic | AZ105: SVK | BA105: 3.0088359764254141E-2 | BB105: 0.17405262128716076 | BC105: =1.64*RC[-1] -> 0.28544629891094364 | BD105: =IF(EQUAL(VLOOKUP(RC[-4],R9C3:R186C4,2,0),1),RC[-1],NA()) -> NA() | BE105: =IF(ISNA(RC[-1])=1,"",RC[-5]) -> 
B106: Latvia | C106: LVA | D106: =IF(EQUAL(ComparativeCharts!R[11]C,""),"",1) ->  | O106: 99 | P106: Comoros | Q106: COM | R106: 6.1172537729394058E-2 | S106: 0.36031461549530619 | T106: =1.64*RC[-1] -> 0.59091596941230207 | U106: =IF(EQUAL(VLOOKUP(RC[-4],R9C3:R186C4,2,0),1),RC[-1],NA()) -> NA() | V106: =IF(ISNA(RC[-1])=1,"",RC[-5]) ->  | W106: Bahamas, The | X106: BHS | Y106: 0.37213747659353447 | Z106: 0.41252284257447502 | AA106: =1.64*RC[-1] -> 0.67653746182213903 | AB106: =IF(EQUAL(VLOOKUP(RC[-4],R9C3:R186C4,2,0),1),RC[-1],NA()) -> NA() | AC106: =IF(ISNA(RC[-1])=1,"",RC[-5]) ->  | AD106: United Arab Emirates | AE106: ARE | AF106: 0.13828729996307365 | AG106: 0.31908959204123422 | AH106: =1.64*RC[-1] -> 0.52330693094762404 | AI106: =IF(EQUAL(VLOOKUP(RC[-4],R9C3:R186C4,2,0),1),RC[-1],NA()) -> NA() | AJ106: =IF(ISNA(RC[-1])=1,"",RC[-5]) ->  | AK106: Mali | AL106: MLI | AM106: 0.28967691596475037 | AN106: 0.51661669269246691 | AO106: =1.64*RC[-1] -> 0.84725137601564571 | AP106: =IF(EQUAL(VLOOKUP(RC[-4],R9C3:R186C4,2,0),1),RC[-1],NA()) -> NA() | AQ106: =IF(ISNA(RC[-1])=1,"",RC[-5]) ->  | AR106: Croatia | AS106: HRV | AT106: 0.14595647086658889 | AU106: 0.1861376812882912 | AV106: =1.64*RC[-1] -> 0.30526579731279752 | AW106: =IF(EQUAL(VLOOKUP(RC[-4],R9C3:R186C4,2,0),1),RC[-1],NA()) -> NA() | AX106: =IF(ISNA(RC[-1])=1,"",RC[-5]) ->  | AY106: Lithuania | AZ106: LTU | BA106: 3.4129706835573273E-2 | BB106: 0.18824314571543588 | BC106: =1.64*RC[-1] -> 0.3087187589733148 | BD106: =IF(EQUAL(VLOOKUP(RC[-4],R9C3:R186C4,2,0),1),RC[-1],NA()) -> NA() | BE106: =IF(ISNA(RC[-1])=1,"",RC[-5]) -> 
B107: Macao, China | C107: MAC | D107: =IF(EQUAL(ComparativeCharts!R[11]C,""),"",1) ->  | O107: 100 | P107: Malawi | Q107: MWI | R107: 6.1683928076431249E-2 | S107: 0.25130023322348893 | T107: =1.64*RC[-1] -> 0.41213238248652184 | U107: =IF(EQUAL(VLOOKUP(RC[-4],R9C3:R186C4,2,0),1),RC[-1],NA()) -> NA() | V107: =IF(ISNA(RC[-1])=1,"",RC[-5]) ->  | W107: Mongolia | X107: MNG | Y107: 0.37213747659353447 | Z107: 0.41252284257447502 | AA107: =1.64*RC[-1] -> 0.67653746182213903 | AB107: =IF(EQUAL(VLOOKUP(RC[-4],R9C3:R186C4,2,0),1),RC[-1],NA()) -> 0.67653746182213903 | AC107: =IF(ISNA(RC[-1])=1,"",RC[-5]) -> MNG | AD107: Croatia | AE107: HRV | AF107: 0.14962430984629702 | AG107: 0.25955068050331376 | AH107: =1.64*RC[-1] -> 0.42566311602543455 | AI107: =IF(EQUAL(VLOOKUP(RC[-4],R9C3:R186C4,2,0),1),RC[-1],NA()) -> NA() | AJ107: =IF(ISNA(RC[-1])=1,"",RC[-5]) ->  | AK107: Swaziland | AL107: SWZ | AM107: 0.29382105881922338 | AN107: 0.35124420467647216 | AO107: =1.64*RC[-1] -> 0.57604049566941429 | AP107: =IF(EQUAL(VLOOKUP(RC[-4],R9C3:R186C4,2,0),1),RC[-1],NA()) -> NA() | AQ107: =IF(ISNA(RC[-1])=1,"",RC[-5]) ->  | AR107: Latvia | AS107: LVA | AT107: 0.15451230530057702 | AU107: 0.17954824109220222 | AV107: =1.64*RC[-1] -> 0.29445911539121161 | AW107: =IF(EQUAL(VLOOKUP(RC[-4],R9C3:R186C4,2,0),1),RC[-1],NA()) -> NA() | AX107: =IF(ISNA(RC[-1])=1,"",RC[-5]) ->  | AY107: Brazil | AZ107: BRA | BA107: 5.761684419170391E-2 | BB107: 0.18909298753709736 | BC107: =1.64*RC[-1] -> 0.31011249956083964 | BD107: =IF(EQUAL(VLOOKUP(RC[-4],R9C3:R186C4,2,0),1),RC[-1],NA()) -> NA() | BE107: =IF(ISNA(RC[-1])=1,"",RC[-5]) -> 
B108: Morocco | C108: MAR | D108: =IF(EQUAL(ComparativeCharts!R[11]C,""),"",1) ->  | O108: 101 | P108: Nicaragua | Q108: NIC | R108: 6.9010128239124752E-2 | S108: 0.25402694431067208 | T108: =1.64*RC[-1] -> 0.41660418866950216 | U108: =IF(EQUAL(VLOOKUP(RC[-4],R9C3:R186C4,2,0),1),RC[-1],NA()) -> NA() | V108: =IF(ISNA(RC[-1])=1,"",RC[-5]) ->  | W108: Korea, Dem. Rep. | X108: PRK | Y108: 0.37213747659353447 | Z108: 0.41252284257447502 | AA108: =1.64*RC[-1] -> 0.67653746182213903 | AB108: =IF(EQUAL(VLOOKUP(RC[-4],R9C3:R186C4,2,0),1),RC[-1],NA()) -> NA() | AC108: =IF(ISNA(RC[-1])=1,"",RC[-5]) ->  | AD108: Gambia, The | AE108: GMB | AF108: 0.16367019529192914 | AG108: 0.76816878371913544 | AH108: =1.64*RC[-1] -> 1.259796805299382 | AI108: =IF(EQUAL(VLOOKUP(RC[-4],R9C3:R186C4,2,0),1),RC[-1],NA()) -> NA() | AJ108: =IF(ISNA(RC[-1])=1,"",RC[-5]) ->  | AK108: United Arab Emirates | AL108: ARE | AM108: 0.29621944848933685 | AN108: 0.39525422199815724 | AO108: =1.64*RC[-1] -> 0.64821692407697784 | AP108: =IF(EQUAL(VLOOKUP(RC[-4],R9C3:R186C4,2,0),1),RC[-1],NA()) -> NA() | AQ108: =IF(ISNA(RC[-1])=1,"",RC[-5]) ->  | AR108: India | AS108: IND | AT108: 0.16038927121326294 | AU108: 0.20773727561581487 | AV108: =1.64*RC[-1] -> 0.34068913200993639 | AW108: =IF(EQUAL(VLOOKUP(RC[-4],R9C3:R186C4,2,0),1),RC[-1],NA()) -> NA() | AX108: =IF(ISNA(RC[-1])=1,"",RC[-5]) ->  | AY108: Morocco | AZ108: MAR | BA108: 0.12519025283936355 | BB108: 0.21052052859001816 | BC108: =1.64*RC[-1] -> 0.34525366688762976 | BD108: =IF(EQUAL(VLOOKUP(RC[-4],R9C3:R186C4,2,0),1),RC[-1],NA()) -> NA() | BE108: =IF(ISNA(RC[-1])=1,"",RC[-5]) -> 
B109: Moldova | C109: MDA | D109: =IF(EQUAL(ComparativeCharts!R[11]C,""),"",1) ->  | O109: 102 | P109: Macedonia, FYR | Q109: MKD | R109: 8.671078565854877E-2 | S109: 0.29161828587045291 | T109: =1.64*RC[-1] -> 0.47825398882754272 | U109: =IF(EQUAL(VLOOKUP(RC[-4],R9C3:R186C4,2,0),1),RC[-1],NA()) -> NA() | V109: =IF(ISNA(RC[-1])=1,"",RC[-5]) ->  | W109: Cyprus | X109: CYP | Y109: 0.38054912287478176 | Z109: 0.29988188904282925 | AA109: =1.64*RC[-1] -> 0.49180629803023995 | AB109: =IF(EQUAL(VLOOKUP(RC[-4],R9C3:R186C4,2,0),1),RC[-1],NA()) -> NA() | AC109: =IF(ISNA(RC[-1])=1,"",RC[-5]) ->  | AD109: Mauritius | AE109: MUS | AF109: 0.17217393468457604 | AG109: 0.26793304005260682 | AH109: =1.64*RC[-1] -> 0.43941018568627516 | AI109: =IF(EQUAL(VLOOKUP(RC[-4],R9C3:R186C4,2,0),1),RC[-1],NA()) -> NA() | AJ109: =IF(ISNA(RC[-1])=1,"",RC[-5]) ->  | AK109: Oman | AL109: OMN | AM109: 0.30496800987664752 | AN109: 0.39525422199815724 | AO109: =1.64*RC[-1] -> 0.64821692407697784 | AP109: =IF(EQUAL(VLOOKUP(RC[-4],R9C3:R186C4,2,0),1),RC[-1],NA()) -> NA() | AQ109: =IF(ISNA(RC[-1])=1,"",RC[-5]) ->  | AR109: Tanzania | AS109: TZA | AT109: 0.16084266276451878 | AU109: 0.2531854041328267 | AV109: =1.64*RC[-1] -> 0.41522406277783575 | AW109: =IF(EQUAL(VLOOKUP(RC[-4],R9C3:R186C4,2,0),1),RC[-1],NA()) -> NA() | AX109: =IF(ISNA(RC[-1])=1,"",RC[-5]) ->  | AY109: Jordan | AZ109: JOR | BA109: 0.1390418971045756 | BB109: 0.21675833080370449 | BC109: =1.64*RC[-1] -> 0.35548366251807534 | BD109: =IF(EQUAL(VLOOKUP(RC[-4],R9C3:R186C4,2,0),1),RC[-1],NA()) -> NA() | BE109: =IF(ISNA(RC[-1])=1,"",RC[-5]) -> 
B110: Madagascar | C110: MDG | D110: =IF(EQUAL(ComparativeCharts!R[11]C,""),"",1) ->  | O110: 103 | P110: Papua New Guinea | Q110: PNG | R110: 0.1210078594832968 | S110: 0.25402694431067208 | T110: =1.64*RC[-1] -> 0.41660418866950216 | U110: =IF(EQUAL(VLOOKUP(RC[-4],R9C3:R186C4,2,0),1),RC[-1],NA()) -> NA() | V110: =IF(ISNA(RC[-1])=1,"",RC[-5]) ->  | W110: Croatia | X110: HRV | Y110: 0.40595711496507386 | Z110: 0.24354998171430456 | AA110: =1.64*RC[-1] -> 0.39942197001145946 | AB110: =IF(EQUAL(VLOOKUP(RC[-4],R9C3:R186C4,2,0),1),RC[-1],NA()) -> NA() | AC110: =IF(ISNA(RC[-1])=1,"",RC[-5]) ->  | AD110: Peru | AE110: PER | AF110: 0.17346460106772363 | AG110: 0.24285424490428439 | AH110: =1.64*RC[-1] -> 0.3982809616430264 | AI110: =IF(EQUAL(VLOOKUP(RC[-4],R9C3:R186C4,2,0),1),RC[-1],NA()) -> NA() | AJ110: =IF(ISNA(RC[-1])=1,"",RC[-5]) ->  | AK110: Qatar | AL110: QAT | AM110: 0.32658636077538622 | AN110: 0.39525422199815724 | AO110: =1.64*RC[-1] -> 0.64821692407697784 | AP110: =IF(EQUAL(VLOOKUP(RC[-4],R9C3:R186C4,2,0),1),RC[-1],NA()) -> NA() | AQ110: =IF(ISNA(RC[-1])=1,"",RC[-5]) ->  | AR110: Lithuania | AS110: LTU | AT110: 0.18015442608155482 | AU110: 0.17954824109220222 | AV110: =1.64*RC[-1] -> 0.29445911539121161 | AW110: =IF(EQUAL(VLOOKUP(RC[-4],R9C3:R186C4,2,0),1),RC[-1],NA()) -> NA() | AX110: =IF(ISNA(RC[-1])=1,"",RC[-5]) ->  | AY110: Korea, Rep. | AZ110: KOR | BA110: 0.15918661037952705 | BB110: 0.15482320791775375 | BC110: =1.64*RC[-1] -> 0.25391006098511615 | BD110: =IF(EQUAL(VLOOKUP(RC[-4],R9C3:R186C4,2,0),1),RC[-1],NA()) -> NA() | BE110: =IF(ISNA(RC[-1])=1,"",RC[-5]) -> 
B111: Maldives | C111: MDV | D111: =IF(EQUAL(ComparativeCharts!R[11]C,""),"",1) ->  | O111: 104 | P111: Jordan | Q111: JOR | R111: 0.15335912119855388 | S111: 0.25130023322348893 | T111: =1.64*RC[-1] -> 0.41213238248652184 | U111: =IF(EQUAL(VLOOKUP(RC[-4],R9C3:R186C4,2,0),1),RC[-1],NA()) -> NA() | V111: =IF(ISNA(RC[-1])=1,"",RC[-5]) ->  | W111: Bulgaria | X111: BGR | Y111: 0.43392867304825039 | Z111: 0.2347220744274687 | AA111: =1.64*RC[-1] -> 0.38494420206104862 | AB111: =IF(EQUAL(VLOOKUP(RC[-4],R9C3:R186C4,2,0),1),RC[-1],NA()) -> NA() | AC111: =IF(ISNA(RC[-1])=1,"",RC[-5]) ->  | AD111: Lebanon | AE111: LBN | AF111: 0.17430604177115941 | AG111: 0.31908959204123422 | AH111: =1.64*RC[-1] -> 0.52330693094762404 | AI111: =IF(EQUAL(VLOOKUP(RC[-4],R9C3:R186C4,2,0),1),RC[-1],NA()) -> NA() | AJ111: =IF(ISNA(RC[-1])=1,"",RC[-5]) ->  | AK111: Gabon | AL111: GAB | AM111: 0.35485395272954706 | AN111: 0.51994095831945863 | AO111: =1.64*RC[-1] -> 0.85270317164391207 | AP111: =IF(EQUAL(VLOOKUP(RC[-4],R9C3:R186C4,2,0),1),RC[-1],NA()) -> NA() | AQ111: =IF(ISNA(RC[-1])=1,"",RC[-5]) ->  | AR111: Lebanon | AS111: LBN | AT111: 0.26247348810380766 | AU111: 0.27634968636657775 | AV111: =1.64*RC[-1] -> 0.45321348564118746 | AW111: =IF(EQUAL(VLOOKUP(RC[-4],R9C3:R186C4,2,0),1),RC[-1],NA()) -> NA() | AX111: =IF(ISNA(RC[-1])=1,"",RC[-5]) ->  | AY111: Lesotho | AZ111: LSO | BA111: 0.18761140932310325 | BB111: 0.37611079170421424 | BC111: =1.64*RC[-1] -> 0.6168216983949113 | BD111: =IF(EQUAL(VLOOKUP(RC[-4],R9C3:R186C4,2,0),1),RC[-1],NA()) -> NA() | BE111: =IF(ISNA(RC[-1])=1,"",RC[-5]) -> 
B112: Mexico | C112: MEX | D112: =IF(EQUAL(ComparativeCharts!R[11]C,""),"",1) ->  | O112: 105 | P112: Moldova | Q112: MDA | R112: 0.16079661934805359 | S112: 0.25130023322348893 | T112: =1.64*RC[-1] -> 0.41213238248652184 | U112: =IF(EQUAL(VLOOKUP(RC[-4],R9C3:R186C4,2,0),1),RC[-1],NA()) -> NA() | V112: =IF(ISNA(RC[-1])=1,"",RC[-5]) ->  | W112: Chile | X112: CHL | Y112: 0.45127360045586945 | Z112: 0.26334453452009404 | AA112: =1.64*RC[-1] -> 0.43188503661295419 | AB112: =IF(EQUAL(VLOOKUP(RC[-4],R9C3:R186C4,2,0),1),RC[-1],NA()) -> 0.43188503661295419 | AC112: =IF(ISNA(RC[-1])=1,"",RC[-5]) -> CHL | AD112: Mexico | AE112: MEX | AF112: 0.17886557791426871 | AG112: 0.23363653218585126 | AH112: =1.64*RC[-1] -> 0.38316391278479606 | AI112: =IF(EQUAL(VLOOKUP(RC[-4],R9C3:R186C4,2,0),1),RC[-1],NA()) -> NA() | AJ112: =IF(ISNA(RC[-1])=1,"",RC[-5]) ->  | AK112: Paraguay | AL112: PRY | AM112: 0.36965153368332943 | AN112: 0.51661669269246691 | AO112: =1.64*RC[-1] -> 0.84725137601564571 | AP112: =IF(EQUAL(VLOOKUP(RC[-4],R9C3:R186C4,2,0),1),RC[-1],NA()) -> NA() | AQ112: =IF(ISNA(RC[-1])=1,"",RC[-5]) ->  | AR112: Ethiopia | AS112: ETH | AT112: 0.26910267598098803 | AU112: 0.42866208060882488 | AV112: =1.64*RC[-1] -> 0.7030058121984728 | AW112: =IF(EQUAL(VLOOKUP(RC[-4],R9C3:R186C4,2,0),1),RC[-1],NA()) -> NA() | AX112: =IF(ISNA(RC[-1])=1,"",RC[-5]) ->  | AY112: Cuba | AZ112: CUB | BA112: 0.27419829420090391 | BB112: 0.26706317040829514 | BC112: =1.64*RC[-1] -> 0.43798359946960402 | BD112: =IF(EQUAL(VLOOKUP(RC[-4],R9C3:R186C4,2,0),1),RC[-1],NA()) -> NA() | BE112: =IF(ISNA(RC[-1])=1,"",RC[-5]) -> 
B113: Macedonia, FYR | C113: MKD | D113: =IF(EQUAL(ComparativeCharts!R[11]C,""),"",1) ->  | O113: 106 | P113: Venezuela, RB | Q113: VEN | R113: 0.17908024330487426 | S113: 0.25130023322348893 | T113: =1.64*RC[-1] -> 0.41213238248652184 | U113: =IF(EQUAL(VLOOKUP(RC[-4],R9C3:R186C4,2,0),1),RC[-1],NA()) -> NA() | V113: =IF(ISNA(RC[-1])=1,"",RC[-5]) ->  | W113: Latvia | X113: LVA | Y113: 0.45978939521426693 | Z113: 0.2347220744274687 | AA113: =1.64*RC[-1] -> 0.38494420206104862 | AB113: =IF(EQUAL(VLOOKUP(RC[-4],R9C3:R186C4,2,0),1),RC[-1],NA()) -> NA() | AC113: =IF(ISNA(RC[-1])=1,"",RC[-5]) ->  | AD113: Botswana | AE113: BWA | AF113: 0.22097782542798705 | AG113: 0.25687281318054345 | AH113: =1.64*RC[-1] -> 0.42127141361609122 | AI113: =IF(EQUAL(VLOOKUP(RC[-4],R9C3:R186C4,2,0),1),RC[-1],NA()) -> 0.42127141361609122 | AJ113: =IF(ISNA(RC[-1])=1,"",RC[-5]) -> BWA | AK113: Ecuador | AL113: ECU | AM113: 0.37656617304692719 | AN113: 0.39378792524103623 | AO113: =1.64*RC[-1] -> 0.64581219739529938 | AP113: =IF(EQUAL(VLOOKUP(RC[-4],R9C3:R186C4,2,0),1),RC[-1],NA()) -> NA() | AQ113: =IF(ISNA(RC[-1])=1,"",RC[-5]) ->  | AR113: Uruguay | AS113: URY | AT113: 0.26980590593428905 | AU113: 0.27634968636657775 | AV113: =1.64*RC[-1] -> 0.45321348564118746 | AW113: =IF(EQUAL(VLOOKUP(RC[-4],R9C3:R186C4,2,0),1),RC[-1],NA()) -> NA() | AX113: =IF(ISNA(RC[-1])=1,"",RC[-5]) ->  | AY113: South Africa | AZ113: ZAF | BA113: 0.29886445016776991 | BB113: 0.17140690602557451 | BC113: =1.64*RC[-1] -> 0.2811073258819422 | BD113: =IF(EQUAL(VLOOKUP(RC[-4],R9C3:R186C4,2,0),1),RC[-1],NA()) -> NA() | BE113: =IF(ISNA(RC[-1])=1,"",RC[-5]) -> 
B114: Mali | C114: MLI | D114: =IF(EQUAL(ComparativeCharts!R[11]C,""),"",1) ->  | O114: 107 | P114: Thailand | Q114: THA | R114: 0.21538950289586084 | S114: 0.25130023322348893 | T114: =1.64*RC[-1] -> 0.41213238248652184 | U114: =IF(EQUAL(VLOOKUP(RC[-4],R9C3:R186C4,2,0),1),RC[-1],NA()) -> NA() | V114: =IF(ISNA(RC[-1])=1,"",RC[-5]) ->  | W114: China | X114: CHN | Y114: 0.48347625661562954 | Z114: 0.26334453452009404 | AA114: =1.64*RC[-1] -> 0.43188503661295419 | AB114: =IF(EQUAL(VLOOKUP(RC[-4],R9C3:R186C4,2,0),1),RC[-1],NA()) -> NA() | AC114: =IF(ISNA(RC[-1])=1,"",RC[-5]) ->  | AD114: Bahrain | AE114: BHR | AF114: 0.2354996562606774 | AG114: 0.31908959204123422 | AH114: =1.64*RC[-1] -> 0.52330693094762404 | AI114: =IF(EQUAL(VLOOKUP(RC[-4],R9C3:R186C4,2,0),1),RC[-1],NA()) -> NA() | AJ114: =IF(ISNA(RC[-1])=1,"",RC[-5]) ->  | AK114: Malta | AL114: MLT | AM114: 0.38640657098306841 | AN114: 0.51994095831945863 | AO114: =1.64*RC[-1] -> 0.85270317164391207 | AP114: =IF(EQUAL(VLOOKUP(RC[-4],R9C3:R186C4,2,0),1),RC[-1],NA()) -> NA() | AQ114: =IF(ISNA(RC[-1])=1,"",RC[-5]) ->  | AR114: Gambia, The | AS114: GMB | AT114: 0.27414380659008736 | AU114: 0.44307336250641616 | AV114: =1.64*RC[-1] -> 0.72664031451052247 | AW114: =IF(EQUAL(VLOOKUP(RC[-4],R9C3:R186C4,2,0),1),RC[-1],NA()) -> NA() | AX114: =IF(ISNA(RC[-1])=1,"",RC[-5]) ->  | AY114: Mauritius | AZ114: MUS | BA114: 0.33636297665767456 | BB114: 0.22843148021933721 | BC114: =1.64*RC[-1] -> 0.37462762755971302 | BD114: =IF(EQUAL(VLOOKUP(RC[-4],R9C3:R186C4,2,0),1),RC[-1],NA()) -> NA() | BE114: =IF(ISNA(RC[-1])=1,"",RC[-5]) -> 
B115: Malta | C115: MLT | D115: =IF(EQUAL(ComparativeCharts!R[11]C,""),"",1) ->  | O115: 108 | P115: Ecuador | Q115: ECU | R115: 0.26760409879139069 | S115: 0.25130023322348893 | T115: =1.64*RC[-1] -> 0.41213238248652184 | U115: =IF(EQUAL(VLOOKUP(RC[-4],R9C3:R186C4,2,0),1),RC[-1],NA()) -> NA() | V115: =IF(ISNA(RC[-1])=1,"",RC[-5]) ->  | W115: Argentina | X115: ARG | Y115: 0.50683537219617303 | Z115: 0.26334453452009404 | AA115: =1.64*RC[-1] -> 0.43188503661295419 | AB115: =IF(EQUAL(VLOOKUP(RC[-4],R9C3:R186C4,2,0),1),RC[-1],NA()) -> NA() | AC115: =IF(ISNA(RC[-1])=1,"",RC[-5]) ->  | AD115: Estonia | AE115: EST | AF115: 0.25818303990613278 | AG115: 0.24259893305862151 | AH115: =1.64*RC[-1] -> 0.39786225021613925 | AI115: =IF(EQUAL(VLOOKUP(RC[-4],R9C3:R186C4,2,0),1),RC[-1],NA()) -> NA() | AJ115: =IF(ISNA(RC[-1])=1,"",RC[-5]) ->  | AK115: Japan | AL115: JPN | AM115: 0.38886899261987112 | AN115: 0.22904640098569978 | AO115: =1.64*RC[-1] -> 0.37563609761654765 | AP115: =IF(EQUAL(VLOOKUP(RC[-4],R9C3:R186C4,2,0),1),RC[-1],NA()) -> NA() | AQ115: =IF(ISNA(RC[-1])=1,"",RC[-5]) ->  | AR115: Argentina | AS115: ARG | AT115: 0.31894253694853825 | AU115: 0.21813983950894791 | AV115: =1.64*RC[-1] -> 0.35774933679467458 | AW115: =IF(EQUAL(VLOOKUP(RC[-4],R9C3:R186C4,2,0),1),RC[-1],NA()) -> NA() | AX115: =IF(ISNA(RC[-1])=1,"",RC[-5]) ->  | AY115: West Bank and Gaza | AZ115: WTB | BA115: 0.36260323286912799 | BB115: 0.53653470441187612 | BC115: =1.64*RC[-1] -> 0.87991691523547677 | BD115: =IF(EQUAL(VLOOKUP(RC[-4],R9C3:R186C4,2,0),1),RC[-1],NA()) -> NA() | BE115: =IF(ISNA(RC[-1])=1,"",RC[-5]) -> 
B116: Myanmar | C116: MMR | D116: =IF(EQUAL(ComparativeCharts!R[11]C,""),"",1) ->  | O116: 109 | P116: Suriname | Q116: SUR | R116: 0.28261603125659895 | S116: 0.29137760175532934 | T116: =1.64*RC[-1] -> 0.47785926687874009 | U116: =IF(EQUAL(VLOOKUP(RC[-4],R9C3:R186C4,2,0),1),RC[-1],NA()) -> NA() | V116: =IF(ISNA(RC[-1])=1,"",RC[-5]) ->  | W116: Malaysia | X116: MYS | Y116: 0.5518729953590179 | Z116: 0.25228486761247954 | AA116: =1.64*RC[-1] -> 0.41374718288446644 | AB116: =IF(EQUAL(VLOOKUP(RC[-4],R9C3:R186C4,2,0),1),RC[-1],NA()) -> NA() | AC116: =IF(ISNA(RC[-1])=1,"",RC[-5]) ->  | AD116: Argentina | AE116: ARG | AF116: 0.26204437002148684 | AG116: 0.24866131188801807 | AH116: =1.64*RC[-1] -> 0.40780455149634959 | AI116: =IF(EQUAL(VLOOKUP(RC[-4],R9C3:R186C4,2,0),1),RC[-1],NA()) -> NA() | AJ116: =IF(ISNA(RC[-1])=1,"",RC[-5]) ->  | AK116: Jordan | AL116: JOR | AM116: 0.41655225852466637 | AN116: 0.27405060086349636 | AO116: =1.64*RC[-1] -> 0.44944298541613403 | AP116: =IF(EQUAL(VLOOKUP(RC[-4],R9C3:R186C4,2,0),1),RC[-1],NA()) -> NA() | AQ116: =IF(ISNA(RC[-1])=1,"",RC[-5]) ->  | AR116: Dominican Republic | AS116: DOM | AT116: 0.37955702490882132 | AU116: 0.3138946252365733 | AV116: =1.64*RC[-1] -> 0.51478718538798018 | AW116: =IF(EQUAL(VLOOKUP(RC[-4],R9C3:R186C4,2,0),1),RC[-1],NA()) -> NA() | AX116: =IF(ISNA(RC[-1])=1,"",RC[-5]) ->  | AY116: Namibia | AZ116: NAM | BA116: 0.38190891869999632 | BB116: 0.23922098082830748 | BC116: =1.64*RC[-1] -> 0.39232240855842426 | BD116: =IF(EQUAL(VLOOKUP(RC[-4],R9C3:R186C4,2,0),1),RC[-1],NA()) -> NA() | BE116: =IF(ISNA(RC[-1])=1,"",RC[-5]) -> 
B117: Mongolia | C117: MNG | D117: =IF(EQUAL(ComparativeCharts!R[11]C,""),"",1) -> 1 | O117: 110 | P117: Madagascar | Q117: MDG | R117: 0.30925860841074582 | S117: 0.28728334123682875 | T117: =1.64*RC[-1] -> 0.47114467962839912 | U117: =IF(EQUAL(VLOOKUP(RC[-4],R9C3:R186C4,2,0),1),RC[-1],NA()) -> NA() | V117: =IF(ISNA(RC[-1])=1,"",RC[-5]) ->  | W117: Gambia, The | X117: GMB | Y117: 0.56130010053077606 | Z117: 0.41252284257447502 | AA117: =1.64*RC[-1] -> 0.67653746182213903 | AB117: =IF(EQUAL(VLOOKUP(RC[-4],R9C3:R186C4,2,0),1),RC[-1],NA()) -> NA() | AC117: =IF(ISNA(RC[-1])=1,"",RC[-5]) ->  | AD117: Morocco | AE117: MAR | AF117: 0.26708336483421169 | AG117: 0.22248178800615603 | AH117: =1.64*RC[-1] -> 0.36487013233009585 | AI117: =IF(EQUAL(VLOOKUP(RC[-4],R9C3:R186C4,2,0),1),RC[-1],NA()) -> NA() | AJ117: =IF(ISNA(RC[-1])=1,"",RC[-5]) ->  | AK117: Tunisia | AL117: TUN | AM117: 0.42900570775695634 | AN117: 0.29177868538636526 | AO117: =1.64*RC[-1] -> 0.47851704403363898 | AP117: =IF(EQUAL(VLOOKUP(RC[-4],R9C3:R186C4,2,0),1),RC[-1],NA()) -> 0.47851704403363898 | AQ117: =IF(ISNA(RC[-1])=1,"",RC[-5]) -> TUN | AR117: Barbados | AS117: BRB | AT117: 0.41086731543027871 | AU117: 0.60058386521254259 | AV117: =1.64*RC[-1] -> 0.98495753894856974 | AW117: =IF(EQUAL(VLOOKUP(RC[-4],R9C3:R186C4,2,0),1),RC[-1],NA()) -> NA() | AX117: =IF(ISNA(RC[-1])=1,"",RC[-5]) ->  | AY117: Czech Republic | AZ117: CZE | BA117: 0.38423033977330351 | BB117: 0.162862701383401 | BC117: =1.64*RC[-1] -> 0.26709483026877762 | BD117: =IF(EQUAL(VLOOKUP(RC[-4],R9C3:R186C4,2,0),1),RC[-1],NA()) -> NA() | BE117: =IF(ISNA(RC[-1])=1,"",RC[-5]) -> 
B118: Mozambique | C118: MOZ | D118: =IF(EQUAL(ComparativeCharts!R[11]C,""),"",1) ->  | O118: 111 | P118: Bolivia | Q118: BOL | R118: 0.3913744486511031 | S118: 0.25130023322348893 | T118: =1.64*RC[-1] -> 0.41213238248652184 | U118: =IF(EQUAL(VLOOKUP(RC[-4],R9C3:R186C4,2,0),1),RC[-1],NA()) -> NA() | V118: =IF(ISNA(RC[-1])=1,"",RC[-5]) ->  | W118: Tanzania | X118: TZA | Y118: 0.56549267766776601 | Z118: 0.26599811359710124 | AA118: =1.64*RC[-1] -> 0.436236906299246 | AB118: =IF(EQUAL(VLOOKUP(RC[-4],R9C3:R186C4,2,0),1),RC[-1],NA()) -> NA() | AC118: =IF(ISNA(RC[-1])=1,"",RC[-5]) ->  | AD118: Korea, Rep. | AE118: KOR | AF118: 0.40868248932004408 | AG118: 0.23363653218585126 | AH118: =1.64*RC[-1] -> 0.38316391278479606 | AI118: =IF(EQUAL(VLOOKUP(RC[-4],R9C3:R186C4,2,0),1),RC[-1],NA()) -> NA() | AJ118: =IF(ISNA(RC[-1])=1,"",RC[-5]) ->  | AK118: Guatemala | AL118: GTM | AM118: 0.44420227222309205 | AN118: 0.51994095831945863 | AO118: =1.64*RC[-1] -> 0.85270317164391207 | AP118: =IF(EQUAL(VLOOKUP(RC[-4],R9C3:R186C4,2,0),1),RC[-1],NA()) -> NA() | AQ118: =IF(ISNA(RC[-1])=1,"",RC[-5]) ->  | AR118: Thailand | AS118: THA | AT118: 0.41306970156076039 | AU118: 0.20773727561581487 | AV118: =1.64*RC[-1] -> 0.34068913200993639 | AW118: =IF(EQUAL(VLOOKUP(RC[-4],R9C3:R186C4,2,0),1),RC[-1],NA()) -> NA() | AX118: =IF(ISNA(RC[-1])=1,"",RC[-5]) ->  | AY118: Uruguay | AZ118: URY | BA118: 0.42961512203885627 | BB118: 0.24990333019781036 | BC118: =1.64*RC[-1] -> 0.40984146152440898 | BD118: =IF(EQUAL(VLOOKUP(RC[-4],R9C3:R186C4,2,0),1),RC[-1],NA()) -> NA() | BE118: =IF(ISNA(RC[-1])=1,"",RC[-5]) -> 
B119: Mauritania | C119: MRT | D119: =IF(EQUAL(ComparativeCharts!R[11]C,""),"",1) ->  | O119: 112 | P119: Romania | Q119: ROM | R119: 0.40579567735530286 | S119: 0.25402694431067208 | T119: =1.64*RC[-1] -> 0.41660418866950216 | U119: =IF(EQUAL(VLOOKUP(RC[-4],R9C3:R186C4,2,0),1),RC[-1],NA()) -> NA() | V119: =IF(ISNA(RC[-1])=1,"",RC[-5]) ->  | W119: Spain | X119: ESP | Y119: 0.5802217150586465 | Z119: 0.25228486761247954 | AA119: =1.64*RC[-1] -> 0.41374718288446644 | AB119: =IF(EQUAL(VLOOKUP(RC[-4],R9C3:R186C4,2,0),1),RC[-1],NA()) -> NA() | AC119: =IF(ISNA(RC[-1])=1,"",RC[-5]) ->  | AD119: Bahamas, The | AE119: BHS | AF119: 0.47372699580501521 | AG119: 0.76816878371913544 | AH119: =1.64*RC[-1] -> 1.259796805299382 | AI119: =IF(EQUAL(VLOOKUP(RC[-4],R9C3:R186C4,2,0),1),RC[-1],NA()) -> NA() | AJ119: =IF(ISNA(RC[-1])=1,"",RC[-5]) ->  | AK119: Malaysia | AL119: MYS | AM119: 0.47682824778863003 | AN119: 0.22876000329023777 | AO119: =1.64*RC[-1] -> 0.37516640539598994 | AP119: =IF(EQUAL(VLOOKUP(RC[-4],R9C3:R186C4,2,0),1),RC[-1],NA()) -> NA() | AQ119: =IF(ISNA(RC[-1])=1,"",RC[-5]) ->  | AR119: Saudi Arabia | AS119: SAU | AT119: 0.49359093898186851 | AU119: 0.25638815719447205 | AV119: =1.64*RC[-1] -> 0.42047657779893416 | AW119: =IF(EQUAL(VLOOKUP(RC[-4],R9C3:R186C4,2,0),1),RC[-1],NA()) -> NA() | AX119: =IF(ISNA(RC[-1])=1,"",RC[-5]) ->  | AY119: Oman | AZ119: OMN | BA119: 0.48366268595154477 | BB119: 0.26706317040829514 | BC119: =1.64*RC[-1] -> 0.43798359946960402 | BD119: =IF(EQUAL(VLOOKUP(RC[-4],R9C3:R186C4,2,0),1),RC[-1],NA()) -> NA() | BE119: =IF(ISNA(RC[-1])=1,"",RC[-5]) -> 
B120: Martinique | C120: MTQ | D120: =IF(EQUAL(ComparativeCharts!R[11]C,""),"",1) ->  | O120: 113 | P120: Mali | Q120: MLI | R120: 0.41539714589737164 | S120: 0.28728334123682875 | T120: =1.64*RC[-1] -> 0.47114467962839912 | U120: =IF(EQUAL(VLOOKUP(RC[-4],R9C3:R186C4,2,0),1),RC[-1],NA()) -> NA() | V120: =IF(ISNA(RC[-1])=1,"",RC[-5]) ->  | W120: France | X120: FRA | Y120: 0.64665034079233064 | Z120: 0.25228486761247954 | AA120: =1.64*RC[-1] -> 0.41374718288446644 | AB120: =IF(EQUAL(VLOOKUP(RC[-4],R9C3:R186C4,2,0),1),RC[-1],NA()) -> NA() | AC120: =IF(ISNA(RC[-1])=1,"",RC[-5]) ->  | AD120: Qatar | AE120: QAT | AF120: 0.47982341312178645 | AG120: 0.31908959204123422 | AH120: =1.64*RC[-1] -> 0.52330693094762404 | AI120: =IF(EQUAL(VLOOKUP(RC[-4],R9C3:R186C4,2,0),1),RC[-1],NA()) -> NA() | AJ120: =IF(ISNA(RC[-1])=1,"",RC[-5]) ->  | AK120: Latvia | AL120: LVA | AM120: 0.50867099196697774 | AN120: 0.2628266479146692 | AO120: =1.64*RC[-1] -> 0.43103570258005747 | AP120: =IF(EQUAL(VLOOKUP(RC[-4],R9C3:R186C4,2,0),1),RC[-1],NA()) -> NA() | AQ120: =IF(ISNA(RC[-1])=1,"",RC[-5]) ->  | AR120: Greece | AS120: GRC | AT120: 0.49564346474242194 | AU120: 0.21813983950894791 | AV120: =1.64*RC[-1] -> 0.35774933679467458 | AW120: =IF(EQUAL(VLOOKUP(RC[-4],R9C3:R186C4,2,0),1),RC[-1],NA()) -> NA() | AX120: =IF(ISNA(RC[-1])=1,"",RC[-5]) ->  | AY120: Poland | AZ120: POL | BA120: 0.49190277558918633 | BB120: 0.162862701383401 | BC120: =1.64*RC[-1] -> 0.26709483026877762 | BD120: =IF(EQUAL(VLOOKUP(RC[-4],R9C3:R186C4,2,0),1),RC[-1],NA()) -> NA() | BE120: =IF(ISNA(RC[-1])=1,"",RC[-5]) -> 
B121: Mauritius | C121: MUS | D121: =IF(EQUAL(ComparativeCharts!R[11]C,""),"",1) ->  | O121: 114 | P121: Namibia | Q121: NAM | R121: 0.47323457109054673 | S121: 0.25402694431067208 | T121: =1.64*RC[-1] -> 0.41660418866950216 | U121: =IF(EQUAL(VLOOKUP(RC[-4],R9C3:R186C4,2,0),1),RC[-1],NA()) -> NA() | V121: =IF(ISNA(RC[-1])=1,"",RC[-5]) ->  | W121: Slovak Republic | X121: SVK | Y121: 0.65034181624536191 | Z121: 0.22663871542597638 | AA121: =1.64*RC[-1] -> 0.37168749329860123 | AB121: =IF(EQUAL(VLOOKUP(RC[-4],R9C3:R186C4,2,0),1),RC[-1],NA()) -> NA() | AC121: =IF(ISNA(RC[-1])=1,"",RC[-5]) ->  | AD121: Trinidad and Tobago& Tob* | AE121: TTO | AF121: 0.5207697459924624 | AG121: 0.37414236442207388 | AH121: =1.64*RC[-1] -> 0.61359347765220118 | AI121: =IF(EQUAL(VLOOKUP(RC[-4],R9C3:R186C4,2,0),1),RC[-1],NA()) -> NA() | AJ121: =IF(ISNA(RC[-1])=1,"",RC[-5]) ->  | AK121: Bulgaria | AL121: BGR | AM121: 0.51648934485113174 | AN121: 0.2628266479146692 | AO121: =1.64*RC[-1] -> 0.43103570258005747 | AP121: =IF(EQUAL(VLOOKUP(RC[-4],R9C3:R186C4,2,0),1),RC[-1],NA()) -> NA() | AQ121: =IF(ISNA(RC[-1])=1,"",RC[-5]) ->  | AR121: Botswana | AS121: BWA | AT121: 0.5015340203419949 | AU121: 0.27274644247184715 | AV121: =1.64*RC[-1] -> 0.4473041656538293 | AW121: =IF(EQUAL(VLOOKUP(RC[-4],R9C3:R186C4,2,0),1),RC[-1],NA()) -> 0.4473041656538293 | AX121: =IF(ISNA(RC[-1])=1,"",RC[-5]) -> BWA | AY121: Bahamas, The | AZ121: BHS | BA121: 0.49738311886793529 | BB121: 0.74867439619943676 | BC121: =1.64*RC[-1] -> 1.2278260097670761 | BD121: =IF(EQUAL(VLOOKUP(RC[-4],R9C3:R186C4,2,0),1),RC[-1],NA()) -> NA() | BE121: =IF(ISNA(RC[-1])=1,"",RC[-5]) -> 
B122: Malawi | C122: MWI | D122: =IF(EQUAL(ComparativeCharts!R[11]C,""),"",1) ->  | O122: 115 | P122: Argentina | Q122: ARG | R122: 0.4820887285645386 | S122: 0.25402694431067208 | T122: =1.64*RC[-1] -> 0.41660418866950216 | U122: =IF(EQUAL(VLOOKUP(RC[-4],R9C3:R186C4,2,0),1),RC[-1],NA()) -> NA() | V122: =IF(ISNA(RC[-1])=1,"",RC[-5]) ->  | W122: Vietnam | X122: VNM | Y122: 0.65329953441364796 | Z122: 0.26334453452009404 | AA122: =1.64*RC[-1] -> 0.43188503661295419 | AB122: =IF(EQUAL(VLOOKUP(RC[-4],R9C3:R186C4,2,0),1),RC[-1],NA()) -> NA() | AC122: =IF(ISNA(RC[-1])=1,"",RC[-5]) ->  | AD122: Costa Rica | AE122: CRI | AF122: 0.55350723544864666 | AG122: 0.28905600575826201 | AH122: =1.64*RC[-1] -> 0.47405184944354967 | AI122: =IF(EQUAL(VLOOKUP(RC[-4],R9C3:R186C4,2,0),1),RC[-1],NA()) -> NA() | AJ122: =IF(ISNA(RC[-1])=1,"",RC[-5]) ->  | AK122: Slovenia | AL122: SVN | AM122: 0.53154661421746363 | AN122: 0.26326125682519685 | AO122: =1.64*RC[-1] -> 0.43174846119332283 | AP122: =IF(EQUAL(VLOOKUP(RC[-4],R9C3:R186C4,2,0),1),RC[-1],NA()) -> 0.43174846119332283 | AQ122: =IF(ISNA(RC[-1])=1,"",RC[-5]) -> SVN | AR122: Estonia | AS122: EST | AT122: 0.50700303748831166 | AU122: 0.17954824109220222 | AV122: =1.64*RC[-1] -> 0.29445911539121161 | AW122: =IF(EQUAL(VLOOKUP(RC[-4],R9C3:R186C4,2,0),1),RC[-1],NA()) -> NA() | AX122: =IF(ISNA(RC[-1])=1,"",RC[-5]) ->  | AY122: Malta | AZ122: MLT | BA122: 0.49738311886793529 | BB122: 0.74867439619943676 | BC122: =1.64*RC[-1] -> 1.2278260097670761 | BD122: =IF(EQUAL(VLOOKUP(RC[-4],R9C3:R186C4,2,0),1),RC[-1],NA()) -> NA() | BE122: =IF(ISNA(RC[-1])=1,"",RC[-5]) -> 
B123: Malaysia | C123: MYS | D123: =IF(EQUAL(ComparativeCharts!R[11]C,""),"",1) ->  | O123: 116 | P123: India | Q123: IND | R123: 0.49775798944329269 | S123: 0.25130023322348893 | T123: =1.64*RC[-1] -> 0.41213238248652184 | U123: =IF(EQUAL(VLOOKUP(RC[-4],R9C3:R186C4,2,0),1),RC[-1],NA()) -> NA() | V123: =IF(ISNA(RC[-1])=1,"",RC[-5]) ->  | W123: Tunisia | X123: TUN | Y123: 0.66097742012717331 | Z123: 0.27905845743699148 | AA123: =1.64*RC[-1] -> 0.45765587019666598 | AB123: =IF(EQUAL(VLOOKUP(RC[-4],R9C3:R186C4,2,0),1),RC[-1],NA()) -> 0.45765587019666598 | AC123: =IF(ISNA(RC[-1])=1,"",RC[-5]) -> TUN | AD123: Greece | AE123: GRC | AF123: 0.55969099671606082 | AG123: 0.24866131188801807 | AH123: =1.64*RC[-1] -> 0.40780455149634959 | AI123: =IF(EQUAL(VLOOKUP(RC[-4],R9C3:R186C4,2,0),1),RC[-1],NA()) -> NA() | AJ123: =IF(ISNA(RC[-1])=1,"",RC[-5]) ->  | AK123: Israel | AL123: ISR | AM123: 0.53316827664408317 | AN123: 0.22904640098569978 | AO123: =1.64*RC[-1] -> 0.37563609761654765 | AP123: =IF(EQUAL(VLOOKUP(RC[-4],R9C3:R186C4,2,0),1),RC[-1],NA()) -> NA() | AQ123: =IF(ISNA(RC[-1])=1,"",RC[-5]) ->  | AR123: Trinidad and Tobago& Tob* | AS123: TTO | AT123: 0.51403673984688758 | AU123: 0.3138946252365733 | AV123: =1.64*RC[-1] -> 0.51478718538798018 | AW123: =IF(EQUAL(VLOOKUP(RC[-4],R9C3:R186C4,2,0),1),RC[-1],NA()) -> NA() | AX123: =IF(ISNA(RC[-1])=1,"",RC[-5]) ->  | AY123: Trinidad and Tobago& Tob* | AZ123: TTO | BA123: 0.51051523437965984 | BB123: 0.2961069418304243 | BC123: =1.64*RC[-1] -> 0.48561538460189579 | BD123: =IF(EQUAL(VLOOKUP(RC[-4],R9C3:R186C4,2,0),1),RC[-1],NA()) -> NA() | BE123: =IF(ISNA(RC[-1])=1,"",RC[-5]) -> 
B124: Namibia | C124: NAM | D124: =IF(EQUAL(ComparativeCharts!R[11]C,""),"",1) ->  | O124: 117 | P124: Brazil | Q124: BRA | R124: 0.55168050950866032 | S124: 0.25130023322348893 | T124: =1.64*RC[-1] -> 0.41213238248652184 | U124: =IF(EQUAL(VLOOKUP(RC[-4],R9C3:R186C4,2,0),1),RC[-1],NA()) -> NA() | V124: =IF(ISNA(RC[-1])=1,"",RC[-5]) ->  | W124: Kuwait | X124: KWT | Y124: 0.6836311987837812 | Z124: 0.29988188904282925 | AA124: =1.64*RC[-1] -> 0.49180629803023995 | AB124: =IF(EQUAL(VLOOKUP(RC[-4],R9C3:R186C4,2,0),1),RC[-1],NA()) -> NA() | AC124: =IF(ISNA(RC[-1])=1,"",RC[-5]) ->  | AD124: Slovenia | AE124: SVN | AF124: 0.56726681290344172 | AG124: 0.25955068050331376 | AH124: =1.64*RC[-1] -> 0.42566311602543455 | AI124: =IF(EQUAL(VLOOKUP(RC[-4],R9C3:R186C4,2,0),1),RC[-1],NA()) -> 0.42566311602543455 | AJ124: =IF(ISNA(RC[-1])=1,"",RC[-5]) -> SVN | AK124: Dominican Republic | AL124: DOM | AM124: 0.53886013171472114 | AN124: 0.51994095831945863 | AO124: =1.64*RC[-1] -> 0.85270317164391207 | AP124: =IF(EQUAL(VLOOKUP(RC[-4],R9C3:R186C4,2,0),1),RC[-1],NA()) -> NA() | AQ124: =IF(ISNA(RC[-1])=1,"",RC[-5]) ->  | AR124: Poland | AS124: POL | AT124: 0.5378882317561956 | AU124: 0.16025055709462124 | AV124: =1.64*RC[-1] -> 0.26281091363517883 | AW124: =IF(EQUAL(VLOOKUP(RC[-4],R9C3:R186C4,2,0),1),RC[-1],NA()) -> NA() | AX124: =IF(ISNA(RC[-1])=1,"",RC[-5]) ->  | AY124: Botswana | AZ124: BWA | BA124: 0.5351913109620231 | BB124: 0.22310568461604569 | BC124: =1.64*RC[-1] -> 0.36589332277031489 | BD124: =IF(EQUAL(VLOOKUP(RC[-4],R9C3:R186C4,2,0),1),RC[-1],NA()) -> 0.36589332277031489 | BE124: =IF(ISNA(RC[-1])=1,"",RC[-5]) -> BWA
B125: Niger | C125: NER | D125: =IF(EQUAL(ComparativeCharts!R[11]C,""),"",1) ->  | O125: 118 | P125: Bulgaria | Q125: BGR | R125: 0.60306902492821612 | S125: 0.25130023322348893 | T125: =1.64*RC[-1] -> 0.41213238248652184 | U125: =IF(EQUAL(VLOOKUP(RC[-4],R9C3:R186C4,2,0),1),RC[-1],NA()) -> NA() | V125: =IF(ISNA(RC[-1])=1,"",RC[-5]) ->  | W125: Namibia | X125: NAM | Y125: 0.7138648174166381 | Z125: 0.31239278829848283 | AA125: =1.64*RC[-1] -> 0.51232417280951181 | AB125: =IF(EQUAL(VLOOKUP(RC[-4],R9C3:R186C4,2,0),1),RC[-1],NA()) -> NA() | AC125: =IF(ISNA(RC[-1])=1,"",RC[-5]) ->  | AD125: Czech Republic | AE125: CZE | AF125: 0.59464580125044864 | AG125: 0.20697929466807191 | AH125: =1.64*RC[-1] -> 0.33944604325563793 | AI125: =IF(EQUAL(VLOOKUP(RC[-4],R9C3:R186C4,2,0),1),RC[-1],NA()) -> NA() | AJ125: =IF(ISNA(RC[-1])=1,"",RC[-5]) ->  | AK125: Poland | AL125: POL | AM125: 0.5649498640648235 | AN125: 0.19196454475476876 | AO125: =1.64*RC[-1] -> 0.31482185339782076 | AP125: =IF(EQUAL(VLOOKUP(RC[-4],R9C3:R186C4,2,0),1),RC[-1],NA()) -> NA() | AQ125: =IF(ISNA(RC[-1])=1,"",RC[-5]) ->  | AR125: Czech Republic | AS125: CZE | AT125: 0.54332715485708127 | AU125: 0.16025055709462124 | AV125: =1.64*RC[-1] -> 0.26281091363517883 | AW125: =IF(EQUAL(VLOOKUP(RC[-4],R9C3:R186C4,2,0),1),RC[-1],NA()) -> NA() | AX125: =IF(ISNA(RC[-1])=1,"",RC[-5]) ->  | AY125: Qatar | AZ125: QAT | BA125: 0.57025621375922031 | BB125: 0.26706317040829514 | BC125: =1.64*RC[-1] -> 0.43798359946960402 | BD125: =IF(EQUAL(VLOOKUP(RC[-4],R9C3:R186C4,2,0),1),RC[-1],NA()) -> NA() | BE125: =IF(ISNA(RC[-1])=1,"",RC[-5]) -> 
B126: Nigeria | C126: NGA | D126: =IF(EQUAL(ComparativeCharts!R[11]C,""),"",1) ->  | O126: 119 | P126: Philippines | Q126: PHL | R126: 0.61354355309714326 | S126: 0.25402694431067208 | T126: =1.64*RC[-1] -> 0.41660418866950216 | U126: =IF(EQUAL(VLOOKUP(RC[-4],R9C3:R186C4,2,0),1),RC[-1],NA()) -> NA() | V126: =IF(ISNA(RC[-1])=1,"",RC[-5]) ->  | W126: Botswana | X126: BWA | Y126: 0.74282527718283975 | Z126: 0.27905845743699148 | AA126: =1.64*RC[-1] -> 0.45765587019666598 | AB126: =IF(EQUAL(VLOOKUP(RC[-4],R9C3:R186C4,2,0),1),RC[-1],NA()) -> 0.45765587019666598 | AC126: =IF(ISNA(RC[-1])=1,"",RC[-5]) -> BWA | AD126: Hungary | AE126: HUN | AF126: 0.60645638978787009 | AG126: 0.20697929466807191 | AH126: =1.64*RC[-1] -> 0.33944604325563793 | AI126: =IF(EQUAL(VLOOKUP(RC[-4],R9C3:R186C4,2,0),1),RC[-1],NA()) -> NA() | AJ126: =IF(ISNA(RC[-1])=1,"",RC[-5]) ->  | AK126: Philippines | AL126: PHL | AM126: 0.5653442365195519 | AN126: 0.22904640098569978 | AO126: =1.64*RC[-1] -> 0.37563609761654765 | AP126: =IF(EQUAL(VLOOKUP(RC[-4],R9C3:R186C4,2,0),1),RC[-1],NA()) -> NA() | AQ126: =IF(ISNA(RC[-1])=1,"",RC[-5]) ->  | AR126: Costa Rica | AS126: CRI | AT126: 0.5530297458058413 | AU126: 0.23516630507815592 | AV126: =1.64*RC[-1] -> 0.38567274032817567 | AW126: =IF(EQUAL(VLOOKUP(RC[-4],R9C3:R186C4,2,0),1),RC[-1],NA()) -> NA() | AX126: =IF(ISNA(RC[-1])=1,"",RC[-5]) ->  | AY126: Costa Rica | AZ126: CRI | BA126: 0.57690863150333915 | BB126: 0.20727728516484362 | BC126: =1.64*RC[-1] -> 0.33993474767034348 | BD126: =IF(EQUAL(VLOOKUP(RC[-4],R9C3:R186C4,2,0),1),RC[-1],NA()) -> NA() | BE126: =IF(ISNA(RC[-1])=1,"",RC[-5]) -> 
B127: Nicaragua | C127: NIC | D127: =IF(EQUAL(ComparativeCharts!R[11]C,""),"",1) ->  | O127: 120 | P127: Chile | Q127: CHL | R127: 0.6150236619017152 | S127: 0.25402694431067208 | T127: =1.64*RC[-1] -> 0.41660418866950216 | U127: =IF(EQUAL(VLOOKUP(RC[-4],R9C3:R186C4,2,0),1),RC[-1],NA()) -> 0.41660418866950216 | V127: =IF(ISNA(RC[-1])=1,"",RC[-5]) -> CHL | W127: Puerto Rico | X127: PRI | Y127: 0.75960603111022051 | Z127: 0.52746484204444311 | AA127: =1.64*RC[-1] -> 0.86504234095288668 | AB127: =IF(EQUAL(VLOOKUP(RC[-4],R9C3:R186C4,2,0),1),RC[-1],NA()) -> NA() | AC127: =IF(ISNA(RC[-1])=1,"",RC[-5]) ->  | AD127: Uruguay | AE127: URY | AF127: 0.61779250728691126 | AG127: 0.31908959204123422 | AH127: =1.64*RC[-1] -> 0.52330693094762404 | AI127: =IF(EQUAL(VLOOKUP(RC[-4],R9C3:R186C4,2,0),1),RC[-1],NA()) -> NA() | AJ127: =IF(ISNA(RC[-1])=1,"",RC[-5]) ->  | AK127: Czech Republic | AL127: CZE | AM127: 0.56981387384377991 | AN127: 0.19196454475476876 | AO127: =1.64*RC[-1] -> 0.31482185339782076 | AP127: =IF(EQUAL(VLOOKUP(RC[-4],R9C3:R186C4,2,0),1),RC[-1],NA()) -> NA() | AQ127: =IF(ISNA(RC[-1])=1,"",RC[-5]) ->  | AR127: Bahamas, The | AS127: BHS | AT127: 0.56301924319449048 | AU127: 0.44307336250641616 | AV127: =1.64*RC[-1] -> 0.72664031451052247 | AW127: =IF(EQUAL(VLOOKUP(RC[-4],R9C3:R186C4,2,0),1),RC[-1],NA()) -> NA() | AX127: =IF(ISNA(RC[-1])=1,"",RC[-5]) ->  | AY127: Estonia | AZ127: EST | BA127: 0.5930563743475441 | BB127: 0.18193276470480088 | BC127: =1.64*RC[-1] -> 0.29836973411587342 | BD127: =IF(EQUAL(VLOOKUP(RC[-4],R9C3:R186C4,2,0),1),RC[-1],NA()) -> NA() | BE127: =IF(ISNA(RC[-1])=1,"",RC[-5]) -> 
B128: Netherlands | C128: NLD | D128: =IF(EQUAL(ComparativeCharts!R[11]C,""),"",1) -> 1 | O128: 121 | P128: Latvia | Q128: LVA | R128: 0.62473646258944571 | S128: 0.25130023322348893 | T128: =1.64*RC[-1] -> 0.41213238248652184 | U128: =IF(EQUAL(VLOOKUP(RC[-4],R9C3:R186C4,2,0),1),RC[-1],NA()) -> NA() | V128: =IF(ISNA(RC[-1])=1,"",RC[-5]) ->  | W128: Estonia | X128: EST | Y128: 0.79136032122221234 | Z128: 0.2347220744274687 | AA128: =1.64*RC[-1] -> 0.38494420206104862 | AB128: =IF(EQUAL(VLOOKUP(RC[-4],R9C3:R186C4,2,0),1),RC[-1],NA()) -> NA() | AC128: =IF(ISNA(RC[-1])=1,"",RC[-5]) ->  | AD128: Malta | AE128: MLT | AF128: 0.62875539234087674 | AG128: 0.76816878371913544 | AH128: =1.64*RC[-1] -> 1.259796805299382 | AI128: =IF(EQUAL(VLOOKUP(RC[-4],R9C3:R186C4,2,0),1),RC[-1],NA()) -> NA() | AJ128: =IF(ISNA(RC[-1])=1,"",RC[-5]) ->  | AK128: Botswana | AL128: BWA | AM128: 0.5724208720886822 | AN128: 0.29177868538636526 | AO128: =1.64*RC[-1] -> 0.47851704403363898 | AP128: =IF(EQUAL(VLOOKUP(RC[-4],R9C3:R186C4,2,0),1),RC[-1],NA()) -> 0.47851704403363898 | AQ128: =IF(ISNA(RC[-1])=1,"",RC[-5]) -> BWA | AR128: Tunisia | AS128: TUN | AT128: 0.64764807873700658 | AU128: 0.27274644247184715 | AV128: =1.64*RC[-1] -> 0.4473041656538293 | AW128: =IF(EQUAL(VLOOKUP(RC[-4],R9C3:R186C4,2,0),1),RC[-1],NA()) -> 0.4473041656538293 | AX128: =IF(ISNA(RC[-1])=1,"",RC[-5]) -> TUN | AY128: Hungary | AZ128: HUN | BA128: 0.61410990830050194 | BB128: 0.15872427647504828 | BC128: =1.64*RC[-1] -> 0.26030781341907916 | BD128: =IF(EQUAL(VLOOKUP(RC[-4],R9C3:R186C4,2,0),1),RC[-1],NA()) -> NA() | BE128: =IF(ISNA(RC[-1])=1,"",RC[-5]) -> 
B129: Norway | C129: NOR | D129: =IF(EQUAL(ComparativeCharts!R[11]C,""),"",1) ->  | O129: 122 | P129: Panama | Q129: PAN | R129: 0.66486409496692467 | S129: 0.25402694431067208 | T129: =1.64*RC[-1] -> 0.41660418866950216 | U129: =IF(EQUAL(VLOOKUP(RC[-4],R9C3:R186C4,2,0),1),RC[-1],NA()) -> NA() | V129: =IF(ISNA(RC[-1])=1,"",RC[-5]) ->  | W129: Czech Republic | X129: CZE | Y129: 0.80576603869029673 | Z129: 0.21591513909296886 | AA129: =1.64*RC[-1] -> 0.3541008281124689 | AB129: =IF(EQUAL(VLOOKUP(RC[-4],R9C3:R186C4,2,0),1),RC[-1],NA()) -> NA() | AC129: =IF(ISNA(RC[-1])=1,"",RC[-5]) ->  | AD129: Jordan | AE129: JOR | AF129: 0.62961589666426054 | AG129: 0.25933435987227932 | AH129: =1.64*RC[-1] -> 0.42530835019053803 | AI129: =IF(EQUAL(VLOOKUP(RC[-4],R9C3:R186C4,2,0),1),RC[-1],NA()) -> NA() | AJ129: =IF(ISNA(RC[-1])=1,"",RC[-5]) ->  | AK129: Italy | AL129: ITA | AM129: 0.59136433398140098 | AN129: 0.22876000329023777 | AO129: =1.64*RC[-1] -> 0.37516640539598994 | AP129: =IF(EQUAL(VLOOKUP(RC[-4],R9C3:R186C4,2,0),1),RC[-1],NA()) -> NA() | AQ129: =IF(ISNA(RC[-1])=1,"",RC[-5]) ->  | AR129: Bahrain | AS129: BHR | AT129: 0.66452576903601746 | AU129: 0.27634968636657775 | AV129: =1.64*RC[-1] -> 0.45321348564118746 | AW129: =IF(EQUAL(VLOOKUP(RC[-4],R9C3:R186C4,2,0),1),RC[-1],NA()) -> NA() | AX129: =IF(ISNA(RC[-1])=1,"",RC[-5]) ->  | AY129: Kuwait | AZ129: KWT | BA129: 0.61900344917820371 | BB129: 0.26706317040829514 | BC129: =1.64*RC[-1] -> 0.43798359946960402 | BD129: =IF(EQUAL(VLOOKUP(RC[-4],R9C3:R186C4,2,0),1),RC[-1],NA()) -> NA() | BE129: =IF(ISNA(RC[-1])=1,"",RC[-5]) -> 
B130: Nepal | C130: NPL | D130: =IF(EQUAL(ComparativeCharts!R[11]C,""),"",1) ->  | O130: 123 | P130: Benin | Q130: BEN | R130: 0.69461096437718883 | S130: 0.35265752232120906 | T130: =1.64*RC[-1] -> 0.57835833660678282 | U130: =IF(EQUAL(VLOOKUP(RC[-4],R9C3:R186C4,2,0),1),RC[-1],NA()) -> NA() | V130: =IF(ISNA(RC[-1])=1,"",RC[-5]) ->  | W130: Belgium | X130: BEL | Y130: 0.81771470597593032 | Z130: 0.26334453452009404 | AA130: =1.64*RC[-1] -> 0.43188503661295419 | AB130: =IF(EQUAL(VLOOKUP(RC[-4],R9C3:R186C4,2,0),1),RC[-1],NA()) -> NA() | AC130: =IF(ISNA(RC[-1])=1,"",RC[-5]) ->  | AD130: Tunisia | AE130: TUN | AF130: 0.63287580631365004 | AG130: 0.23533770853731531 | AH130: =1.64*RC[-1] -> 0.38595384200119709 | AI130: =IF(EQUAL(VLOOKUP(RC[-4],R9C3:R186C4,2,0),1),RC[-1],NA()) -> 0.38595384200119709 | AJ130: =IF(ISNA(RC[-1])=1,"",RC[-5]) -> TUN | AK130: Turkey | AL130: TUR | AM130: 0.59491923923956824 | AN130: 0.22876000329023777 | AO130: =1.64*RC[-1] -> 0.37516640539598994 | AP130: =IF(EQUAL(VLOOKUP(RC[-4],R9C3:R186C4,2,0),1),RC[-1],NA()) -> NA() | AQ130: =IF(ISNA(RC[-1])=1,"",RC[-5]) ->  | AR130: Morocco | AS130: MAR | AT130: 0.67817086410850513 | AU130: 0.2531854041328267 | AV130: =1.64*RC[-1] -> 0.41522406277783575 | AW130: =IF(EQUAL(VLOOKUP(RC[-4],R9C3:R186C4,2,0),1),RC[-1],NA()) -> NA() | AX130: =IF(ISNA(RC[-1])=1,"",RC[-5]) ->  | AY130: Taiwan, China | AZ130: TWN | BA130: 0.62569277138588764 | BB130: 0.15962830533624117 | BC130: =1.64*RC[-1] -> 0.26179042075143549 | BD130: =IF(EQUAL(VLOOKUP(RC[-4],R9C3:R186C4,2,0),1),RC[-1],NA()) -> NA() | BE130: =IF(ISNA(RC[-1])=1,"",RC[-5]) -> 
B131: New Zealand | C131: NZL | D131: =IF(EQUAL(ComparativeCharts!R[11]C,""),"",1) ->  | O131: 124 | P131: Taiwan, China | Q131: TWN | R131: 0.7061905373082723 | S131: 0.25402694431067208 | T131: =1.64*RC[-1] -> 0.41660418866950216 | U131: =IF(EQUAL(VLOOKUP(RC[-4],R9C3:R186C4,2,0),1),RC[-1],NA()) -> NA() | V131: =IF(ISNA(RC[-1])=1,"",RC[-5]) ->  | W131: United Arab Emirates | X131: ARE | Y131: 0.82471151740840931 | Z131: 0.29988188904282925 | AA131: =1.64*RC[-1] -> 0.49180629803023995 | AB131: =IF(EQUAL(VLOOKUP(RC[-4],R9C3:R186C4,2,0),1),RC[-1],NA()) -> NA() | AC131: =IF(ISNA(RC[-1])=1,"",RC[-5]) ->  | AD131: Fiji | AE131: FJI | AF131: 0.63494038642923867 | AG131: 0.5637075668724989 | AH131: =1.64*RC[-1] -> 0.92448040967089817 | AI131: =IF(EQUAL(VLOOKUP(RC[-4],R9C3:R186C4,2,0),1),RC[-1],NA()) -> NA() | AJ131: =IF(ISNA(RC[-1])=1,"",RC[-5]) ->  | AK131: Greece | AL131: GRC | AM131: 0.60497152539640353 | AN131: 0.22904640098569978 | AO131: =1.64*RC[-1] -> 0.37563609761654765 | AP131: =IF(EQUAL(VLOOKUP(RC[-4],R9C3:R186C4,2,0),1),RC[-1],NA()) -> NA() | AQ131: =IF(ISNA(RC[-1])=1,"",RC[-5]) ->  | AR131: Hungary | AS131: HUN | AT131: 0.70554384796954617 | AU131: 0.16025055709462124 | AV131: =1.64*RC[-1] -> 0.26281091363517883 | AW131: =IF(EQUAL(VLOOKUP(RC[-4],R9C3:R186C4,2,0),1),RC[-1],NA()) -> NA() | AX131: =IF(ISNA(RC[-1])=1,"",RC[-5]) ->  | AY131: Malaysia | AZ131: MYS | BA131: 0.63341607558918323 | BB131: 0.15865659221332654 | BC131: =1.64*RC[-1] -> 0.2601968112298555 | BD131: =IF(EQUAL(VLOOKUP(RC[-4],R9C3:R186C4,2,0),1),RC[-1],NA()) -> NA() | BE131: =IF(ISNA(RC[-1])=1,"",RC[-5]) -> 
B132: Oman | C132: OMN | D132: =IF(EQUAL(ComparativeCharts!R[11]C,""),"",1) ->  | O132: 125 | P132: Slovak Republic | Q132: SVK | R132: 0.73775615945206374 | S132: 0.25130023322348893 | T132: =1.64*RC[-1] -> 0.41213238248652184 | U132: =IF(EQUAL(VLOOKUP(RC[-4],R9C3:R186C4,2,0),1),RC[-1],NA()) -> NA() | V132: =IF(ISNA(RC[-1])=1,"",RC[-5]) ->  | W132: Poland | X132: POL | Y132: 0.83679114026452639 | Z132: 0.21591513909296886 | AA132: =1.64*RC[-1] -> 0.3541008281124689 | AB132: =IF(EQUAL(VLOOKUP(RC[-4],R9C3:R186C4,2,0),1),RC[-1],NA()) -> NA() | AC132: =IF(ISNA(RC[-1])=1,"",RC[-5]) ->  | AD132: Poland | AE132: POL | AF132: 0.67402191916468812 | AG132: 0.20697929466807191 | AH132: =1.64*RC[-1] -> 0.33944604325563793 | AI132: =IF(EQUAL(VLOOKUP(RC[-4],R9C3:R186C4,2,0),1),RC[-1],NA()) -> NA() | AJ132: =IF(ISNA(RC[-1])=1,"",RC[-5]) ->  | AK132: Mexico | AL132: MEX | AM132: 0.60791731126919424 | AN132: 0.22876000329023777 | AO132: =1.64*RC[-1] -> 0.37516640539598994 | AP132: =IF(EQUAL(VLOOKUP(RC[-4],R9C3:R186C4,2,0),1),RC[-1],NA()) -> NA() | AQ132: =IF(ISNA(RC[-1])=1,"",RC[-5]) ->  | AR132: Jordan | AS132: JOR | AT132: 0.70841650626585273 | AU132: 0.23516630507815592 | AV132: =1.64*RC[-1] -> 0.38567274032817567 | AW132: =IF(EQUAL(VLOOKUP(RC[-4],R9C3:R186C4,2,0),1),RC[-1],NA()) -> NA() | AX132: =IF(ISNA(RC[-1])=1,"",RC[-5]) ->  | AY132: Belgium | AZ132: BEL | BA132: 0.67169323313295415 | BB132: 0.19805508574877892 | BC132: =1.64*RC[-1] -> 0.32481034062799741 | BD132: =IF(EQUAL(VLOOKUP(RC[-4],R9C3:R186C4,2,0),1),RC[-1],NA()) -> NA() | BE132: =IF(ISNA(RC[-1])=1,"",RC[-5]) -> 
B133: Pakistan | C133: PAK | D133: =IF(EQUAL(ComparativeCharts!R[11]C,""),"",1) ->  | O133: 126 | P133: Jamaica | Q133: JAM | R133: 0.75025592899915827 | S133: 0.25130023322348893 | T133: =1.64*RC[-1] -> 0.41213238248652184 | U133: =IF(EQUAL(VLOOKUP(RC[-4],R9C3:R186C4,2,0),1),RC[-1],NA()) -> 0.41213238248652184 | V133: =IF(ISNA(RC[-1])=1,"",RC[-5]) -> JAM | W133: Costa Rica | X133: CRI | Y133: 0.90828717971999962 | Z133: 0.26987977601169244 | AA133: =1.64*RC[-1] -> 0.44260283265917555 | AB133: =IF(EQUAL(VLOOKUP(RC[-4],R9C3:R186C4,2,0),1),RC[-1],NA()) -> NA() | AC133: =IF(ISNA(RC[-1])=1,"",RC[-5]) ->  | AD133: Israel | AE133: ISR | AF133: 0.68507234663270755 | AG133: 0.26644174895434825 | AH133: =1.64*RC[-1] -> 0.43696446828513108 | AI133: =IF(EQUAL(VLOOKUP(RC[-4],R9C3:R186C4,2,0),1),RC[-1],NA()) -> NA() | AJ133: =IF(ISNA(RC[-1])=1,"",RC[-5]) ->  | AK133: Barbados | AL133: BRB | AM133: 0.61227537127853393 | AN133: 0.60188084442426626 | AO133: =1.64*RC[-1] -> 0.98708458485579664 | AP133: =IF(EQUAL(VLOOKUP(RC[-4],R9C3:R186C4,2,0),1),RC[-1],NA()) -> NA() | AQ133: =IF(ISNA(RC[-1])=1,"",RC[-5]) ->  | AR133: United Arab Emirates | AS133: ARE | AT133: 0.76749841340530323 | AU133: 0.27634968636657775 | AV133: =1.64*RC[-1] -> 0.45321348564118746 | AW133: =IF(EQUAL(VLOOKUP(RC[-4],R9C3:R186C4,2,0),1),RC[-1],NA()) -> NA() | AX133: =IF(ISNA(RC[-1])=1,"",RC[-5]) ->  | AY133: Japan | AZ133: JPN | BA133: 0.72357516585573167 | BB133: 0.15962830533624117 | BC133: =1.64*RC[-1] -> 0.26179042075143549 | BD133: =IF(EQUAL(VLOOKUP(RC[-4],R9C3:R186C4,2,0),1),RC[-1],NA()) -> NA() | BE133: =IF(ISNA(RC[-1])=1,"",RC[-5]) -> 
B134: Panama | C134: PAN | D134: =IF(EQUAL(ComparativeCharts!R[11]C,""),"",1) ->  | O134: 127 | P134: Lithuania | Q134: LTU | R134: 0.76692980649486797 | S134: 0.25130023322348893 | T134: =1.64*RC[-1] -> 0.41213238248652184 | U134: =IF(EQUAL(VLOOKUP(RC[-4],R9C3:R186C4,2,0),1),RC[-1],NA()) -> NA() | V134: =IF(ISNA(RC[-1])=1,"",RC[-5]) ->  | W134: Oman | X134: OMN | Y134: 0.91173894890487783 | Z134: 0.29988188904282925 | AA134: =1.64*RC[-1] -> 0.49180629803023995 | AB134: =IF(EQUAL(VLOOKUP(RC[-4],R9C3:R186C4,2,0),1),RC[-1],NA()) -> NA() | AC134: =IF(ISNA(RC[-1])=1,"",RC[-5]) ->  | AD134: Malaysia | AE134: MYS | AF134: 0.71409582584017373 | AG134: 0.23363653218585126 | AH134: =1.64*RC[-1] -> 0.38316391278479606 | AI134: =IF(EQUAL(VLOOKUP(RC[-4],R9C3:R186C4,2,0),1),RC[-1],NA()) -> NA() | AJ134: =IF(ISNA(RC[-1])=1,"",RC[-5]) ->  | AK134: Iceland | AL134: ISL | AM134: 0.61418728402709399 | AN134: 0.24723861307061137 | AO134: =1.64*RC[-1] -> 0.40547132543580261 | AP134: =IF(EQUAL(VLOOKUP(RC[-4],R9C3:R186C4,2,0),1),RC[-1],NA()) -> NA() | AQ134: =IF(ISNA(RC[-1])=1,"",RC[-5]) ->  | AR134: Puerto Rico | AS134: PRI | AT134: 0.77118129439746197 | AU134: 0.50346808045509683 | AV134: =1.64*RC[-1] -> 0.82568765194635874 | AW134: =IF(EQUAL(VLOOKUP(RC[-4],R9C3:R186C4,2,0),1),RC[-1],NA()) -> NA() | AX134: =IF(ISNA(RC[-1])=1,"",RC[-5]) ->  | AY134: Italy | AZ134: ITA | BA134: 0.8023283628411797 | BB134: 0.18909298753709736 | BC134: =1.64*RC[-1] -> 0.31011249956083964 | BD134: =IF(EQUAL(VLOOKUP(RC[-4],R9C3:R186C4,2,0),1),RC[-1],NA()) -> NA() | BE134: =IF(ISNA(RC[-1])=1,"",RC[-5]) -> 
B135: Peru | C135: PER | D135: =IF(EQUAL(ComparativeCharts!R[11]C,""),"",1) ->  | O135: 128 | P135: Uruguay | Q135: URY | R135: 0.76979660502873615 | S135: 0.25402694431067208 | T135: =1.64*RC[-1] -> 0.41660418866950216 | U135: =IF(EQUAL(VLOOKUP(RC[-4],R9C3:R186C4,2,0),1),RC[-1],NA()) -> NA() | V135: =IF(ISNA(RC[-1])=1,"",RC[-5]) ->  | W135: United Kingdom | X135: GBR | Y135: 0.91972187687454521 | Z135: 0.25228486761247954 | AA135: =1.64*RC[-1] -> 0.41374718288446644 | AB135: =IF(EQUAL(VLOOKUP(RC[-4],R9C3:R186C4,2,0),1),RC[-1],NA()) -> NA() | AC135: =IF(ISNA(RC[-1])=1,"",RC[-5]) ->  | AD135: Italy | AE135: ITA | AF135: 0.77286927248144377 | AG135: 0.23363653218585126 | AH135: =1.64*RC[-1] -> 0.38316391278479606 | AI135: =IF(EQUAL(VLOOKUP(RC[-4],R9C3:R186C4,2,0),1),RC[-1],NA()) -> NA() | AJ135: =IF(ISNA(RC[-1])=1,"",RC[-5]) ->  | AK135: Sri Lanka | AL135: LKA | AM135: 0.61585746664339158 | AN135: 0.39525422199815724 | AO135: =1.64*RC[-1] -> 0.64821692407697784 | AP135: =IF(EQUAL(VLOOKUP(RC[-4],R9C3:R186C4,2,0),1),RC[-1],NA()) -> NA() | AQ135: =IF(ISNA(RC[-1])=1,"",RC[-5]) ->  | AR135: Belgium | AS135: BEL | AT135: 0.79729522622895899 | AU135: 0.21813983950894791 | AV135: =1.64*RC[-1] -> 0.35774933679467458 | AW135: =IF(EQUAL(VLOOKUP(RC[-4],R9C3:R186C4,2,0),1),RC[-1],NA()) -> NA() | AX135: =IF(ISNA(RC[-1])=1,"",RC[-5]) ->  | AY135: Fiji | AZ135: FJI | BA135: 0.8066678309762757 | BB135: 0.53653470441187612 | BC135: =1.64*RC[-1] -> 0.87991691523547677 | BD135: =IF(EQUAL(VLOOKUP(RC[-4],R9C3:R186C4,2,0),1),RC[-1],NA()) -> NA() | BE135: =IF(ISNA(RC[-1])=1,"",RC[-5]) -> 
B136: Philippines | C136: PHL | D136: =IF(EQUAL(ComparativeCharts!R[11]C,""),"",1) ->  | O136: 129 | P136: Botswana | Q136: BWA | R136: 0.77865076250272802 | S136: 0.25402694431067208 | T136: =1.64*RC[-1] -> 0.41660418866950216 | U136: =IF(EQUAL(VLOOKUP(RC[-4],R9C3:R186C4,2,0),1),RC[-1],NA()) -> 0.41660418866950216 | V136: =IF(ISNA(RC[-1])=1,"",RC[-5]) -> BWA | W136: Hong Kong, China | X136: HKG | Y136: 0.92151342858835283 | Z136: 0.26987977601169244 | AA136: =1.64*RC[-1] -> 0.44260283265917555 | AB136: =IF(EQUAL(VLOOKUP(RC[-4],R9C3:R186C4,2,0),1),RC[-1],NA()) -> NA() | AC136: =IF(ISNA(RC[-1])=1,"",RC[-5]) ->  | AD136: Japan | AE136: JPN | AF136: 0.83898797011488457 | AG136: 0.30537141907376114 | AH136: =1.64*RC[-1] -> 0.50080912728096827 | AI136: =IF(EQUAL(VLOOKUP(RC[-4],R9C3:R186C4,2,0),1),RC[-1],NA()) -> NA() | AJ136: =IF(ISNA(RC[-1])=1,"",RC[-5]) ->  | AK136: Argentina | AL136: ARG | AM136: 0.66752454892309154 | AN136: 0.22904640098569978 | AO136: =1.64*RC[-1] -> 0.37563609761654765 | AP136: =IF(EQUAL(VLOOKUP(RC[-4],R9C3:R186C4,2,0),1),RC[-1],NA()) -> NA() | AQ136: =IF(ISNA(RC[-1])=1,"",RC[-5]) ->  | AR136: Slovenia | AS136: SVN | AT136: 0.82548346319800581 | AU136: 0.1861376812882912 | AV136: =1.64*RC[-1] -> 0.30526579731279752 | AW136: =IF(EQUAL(VLOOKUP(RC[-4],R9C3:R186C4,2,0),1),RC[-1],NA()) -> 0.30526579731279752 | AX136: =IF(ISNA(RC[-1])=1,"",RC[-5]) -> SVN | AY136: Greece | AZ136: GRC | BA136: 0.82482074326199506 | BB136: 0.19805508574877892 | BC136: =1.64*RC[-1] -> 0.32481034062799741 | BD136: =IF(EQUAL(VLOOKUP(RC[-4],R9C3:R186C4,2,0),1),RC[-1],NA()) -> NA() | BE136: =IF(ISNA(RC[-1])=1,"",RC[-5]) -> 
B137: Papua New Guinea | C137: PNG | D137: =IF(EQUAL(ComparativeCharts!R[11]C,""),"",1) ->  | O137: 130 | P137: Estonia | Q137: EST | R137: 0.78885671575169658 | S137: 0.25130023322348893 | T137: =1.64*RC[-1] -> 0.41213238248652184 | U137: =IF(EQUAL(VLOOKUP(RC[-4],R9C3:R186C4,2,0),1),RC[-1],NA()) -> NA() | V137: =IF(ISNA(RC[-1])=1,"",RC[-5]) ->  | W137: Taiwan, China | X137: TWN | Y137: 0.93853326244357371 | Z137: 0.26334453452009404 | AA137: =1.64*RC[-1] -> 0.43188503661295419 | AB137: =IF(EQUAL(VLOOKUP(RC[-4],R9C3:R186C4,2,0),1),RC[-1],NA()) -> NA() | AC137: =IF(ISNA(RC[-1])=1,"",RC[-5]) ->  | AD137: Belgium | AE137: BEL | AF137: 0.88326173224899007 | AG137: 0.24866131188801807 | AH137: =1.64*RC[-1] -> 0.40780455149634959 | AI137: =IF(EQUAL(VLOOKUP(RC[-4],R9C3:R186C4,2,0),1),RC[-1],NA()) -> NA() | AJ137: =IF(ISNA(RC[-1])=1,"",RC[-5]) ->  | AK137: Peru | AL137: PER | AM137: 0.66871539911413036 | AN137: 0.27405060086349636 | AO137: =1.64*RC[-1] -> 0.44944298541613403 | AP137: =IF(EQUAL(VLOOKUP(RC[-4],R9C3:R186C4,2,0),1),RC[-1],NA()) -> NA() | AQ137: =IF(ISNA(RC[-1])=1,"",RC[-5]) ->  | AR137: Malaysia | AS137: MYS | AT137: 0.83361529960968994 | AU137: 0.20773727561581487 | AV137: =1.64*RC[-1] -> 0.34068913200993639 | AW137: =IF(EQUAL(VLOOKUP(RC[-4],R9C3:R186C4,2,0),1),RC[-1],NA()) -> NA() | AX137: =IF(ISNA(RC[-1])=1,"",RC[-5]) ->  | AY137: Slovenia | AZ137: SVN | BA137: 1.0228059766063373 | BB137: 0.21360526834447727 | BC137: =1.64*RC[-1] -> 0.35031264008494267 | BD137: =IF(EQUAL(VLOOKUP(RC[-4],R9C3:R186C4,2,0),1),RC[-1],NA()) -> 0.35031264008494267 | BE137: =IF(ISNA(RC[-1])=1,"",RC[-5]) -> SVN
B138: Poland | C138: POL | D138: =IF(EQUAL(ComparativeCharts!R[11]C,""),"",1) ->  | O138: 131 | P138: Sao Tome and Principe | Q138: STP | R138: 0.82056170327565869 | S138: 0.36031461549530619 | T138: =1.64*RC[-1] -> 0.59091596941230207 | U138: =IF(EQUAL(VLOOKUP(RC[-4],R9C3:R186C4,2,0),1),RC[-1],NA()) -> NA() | V138: =IF(ISNA(RC[-1])=1,"",RC[-5]) ->  | W138: Canada | X138: CAN | Y138: 1.0271998563417271 | Z138: 0.25228486761247954 | AA138: =1.64*RC[-1] -> 0.41374718288446644 | AB138: =IF(EQUAL(VLOOKUP(RC[-4],R9C3:R186C4,2,0),1),RC[-1],NA()) -> NA() | AC138: =IF(ISNA(RC[-1])=1,"",RC[-5]) ->  | AD138: Oman | AE138: OMN | AF138: 0.89976388517880279 | AG138: 0.31908959204123422 | AH138: =1.64*RC[-1] -> 0.52330693094762404 | AI138: =IF(EQUAL(VLOOKUP(RC[-4],R9C3:R186C4,2,0),1),RC[-1],NA()) -> NA() | AJ138: =IF(ISNA(RC[-1])=1,"",RC[-5]) ->  | AK138: France | AL138: FRA | AM138: 0.71345181628339671 | AN138: 0.22876000329023777 | AO138: =1.64*RC[-1] -> 0.37516640539598994 | AP138: =IF(EQUAL(VLOOKUP(RC[-4],R9C3:R186C4,2,0),1),RC[-1],NA()) -> NA() | AQ138: =IF(ISNA(RC[-1])=1,"",RC[-5]) ->  | AR138: Italy | AS138: ITA | AT138: 0.86090146886788788 | AU138: 0.20773727561581487 | AV138: =1.64*RC[-1] -> 0.34068913200993639 | AW138: =IF(EQUAL(VLOOKUP(RC[-4],R9C3:R186C4,2,0),1),RC[-1],NA()) -> NA() | AX138: =IF(ISNA(RC[-1])=1,"",RC[-5]) ->  | AY138: Chile | AZ138: CHL | BA138: 1.0292056372793361 | BB138: 0.19805508574877892 | BC138: =1.64*RC[-1] -> 0.32481034062799741 | BD138: =IF(EQUAL(VLOOKUP(RC[-4],R9C3:R186C4,2,0),1),RC[-1],NA()) -> 0.32481034062799741 | BE138: =IF(ISNA(RC[-1])=1,"",RC[-5]) -> CHL
B139: Puerto Rico | C139: PRI | D139: =IF(EQUAL(ComparativeCharts!R[11]C,""),"",1) ->  | O139: 132 | P139: Mongolia | Q139: MNG | R139: 0.84257225964418014 | S139: 0.29137760175532934 | T139: =1.64*RC[-1] -> 0.47785926687874009 | U139: =IF(EQUAL(VLOOKUP(RC[-4],R9C3:R186C4,2,0),1),RC[-1],NA()) -> 0.47785926687874009 | V139: =IF(ISNA(RC[-1])=1,"",RC[-5]) -> MNG | W139: Slovenia | X139: SVN | Y139: 1.0930420346257077 | Z139: 0.24354998171430456 | AA139: =1.64*RC[-1] -> 0.39942197001145946 | AB139: =IF(EQUAL(VLOOKUP(RC[-4],R9C3:R186C4,2,0),1),RC[-1],NA()) -> 0.39942197001145946 | AC139: =IF(ISNA(RC[-1])=1,"",RC[-5]) -> SVN | AD139: Cyprus | AE139: CYP | AF139: 1.0406254320867756 | AG139: 0.31908959204123422 | AH139: =1.64*RC[-1] -> 0.52330693094762404 | AI139: =IF(EQUAL(VLOOKUP(RC[-4],R9C3:R186C4,2,0),1),RC[-1],NA()) -> NA() | AJ139: =IF(ISNA(RC[-1])=1,"",RC[-5]) ->  | AK139: Trinidad and Tobago& Tob* | AL139: TTO | AM139: 0.71755677177399091 | AN139: 0.51994095831945863 | AO139: =1.64*RC[-1] -> 0.85270317164391207 | AP139: =IF(EQUAL(VLOOKUP(RC[-4],R9C3:R186C4,2,0),1),RC[-1],NA()) -> NA() | AQ139: =IF(ISNA(RC[-1])=1,"",RC[-5]) ->  | AR139: Malta | AS139: MLT | AT139: 0.86397382135625411 | AU139: 0.44307336250641616 | AV139: =1.64*RC[-1] -> 0.72664031451052247 | AW139: =IF(EQUAL(VLOOKUP(RC[-4],R9C3:R186C4,2,0),1),RC[-1],NA()) -> NA() | AX139: =IF(ISNA(RC[-1])=1,"",RC[-5]) ->  | AY139: Puerto Rico | AZ139: PRI | BA139: 1.1180428217294143 | BB139: 0.52590974871530882 | BC139: =1.64*RC[-1] -> 0.86249198789310644 | BD139: =IF(EQUAL(VLOOKUP(RC[-4],R9C3:R186C4,2,0),1),RC[-1],NA()) -> NA() | BE139: =IF(ISNA(RC[-1])=1,"",RC[-5]) -> 
B140: Korea, Dem. Rep. | C140: PRK | D140: =IF(EQUAL(ComparativeCharts!R[11]C,""),"",1) ->  | O140: 133 | P140: Trinidad and Tobago& Tob* | Q140: TTO | R140: 0.9532491618712825 | S140: 0.25402694431067208 | T140: =1.64*RC[-1] -> 0.41660418866950216 | U140: =IF(EQUAL(VLOOKUP(RC[-4],R9C3:R186C4,2,0),1),RC[-1],NA()) -> NA() | V140: =IF(ISNA(RC[-1])=1,"",RC[-5]) ->  | W140: United States | X140: USA | Y140: 1.0959887335273921 | Z140: 0.25228486761247954 | AA140: =1.64*RC[-1] -> 0.41374718288446644 | AB140: =IF(EQUAL(VLOOKUP(RC[-4],R9C3:R186C4,2,0),1),RC[-1],NA()) -> NA() | AC140: =IF(ISNA(RC[-1])=1,"",RC[-5]) ->  | AD140: Portugal | AE140: PRT | AF140: 1.1512038694785007 | AG140: 0.23363653218585126 | AH140: =1.64*RC[-1] -> 0.38316391278479606 | AI140: =IF(EQUAL(VLOOKUP(RC[-4],R9C3:R186C4,2,0),1),RC[-1],NA()) -> NA() | AJ140: =IF(ISNA(RC[-1])=1,"",RC[-5]) ->  | AK140: Estonia | AL140: EST | AM140: 0.74297115654979973 | AN140: 0.2628266479146692 | AO140: =1.64*RC[-1] -> 0.43103570258005747 | AP140: =IF(EQUAL(VLOOKUP(RC[-4],R9C3:R186C4,2,0),1),RC[-1],NA()) -> NA() | AQ140: =IF(ISNA(RC[-1])=1,"",RC[-5]) ->  | AR140: Kuwait | AS140: KWT | AT140: 0.90737285902055631 | AU140: 0.27634968636657775 | AV140: =1.64*RC[-1] -> 0.45321348564118746 | AW140: =IF(EQUAL(VLOOKUP(RC[-4],R9C3:R186C4,2,0),1),RC[-1],NA()) -> NA() | AX140: =IF(ISNA(RC[-1])=1,"",RC[-5]) ->  | AY140: Spain | AZ140: ESP | BA140: 1.2142607209685121 | BB140: 0.18909298753709736 | BC140: =1.64*RC[-1] -> 0.31011249956083964 | BD140: =IF(EQUAL(VLOOKUP(RC[-4],R9C3:R186C4,2,0),1),RC[-1],NA()) -> NA() | BE140: =IF(ISNA(RC[-1])=1,"",RC[-5]) -> 
B141: Portugal | C141: PRT | D141: =IF(EQUAL(ComparativeCharts!R[11]C,""),"",1) ->  | O141: 134 | P141: Cape verde | Q141: CPV | R141: 0.98624661449442297 | S141: 0.36031461549530619 | T141: =1.64*RC[-1] -> 0.59091596941230207 | U141: =IF(EQUAL(VLOOKUP(RC[-4],R9C3:R186C4,2,0),1),RC[-1],NA()) -> NA() | V141: =IF(ISNA(RC[-1])=1,"",RC[-5]) ->  | W141: Mauritius | X141: MUS | Y141: 1.1436229113847114 | Z141: 0.38741394913259203 | AA141: =1.64*RC[-1] -> 0.63535887657745094 | AB141: =IF(EQUAL(VLOOKUP(RC[-4],R9C3:R186C4,2,0),1),RC[-1],NA()) -> NA() | AC141: =IF(ISNA(RC[-1])=1,"",RC[-5]) ->  | AD141: Chile | AE141: CHL | AF141: 1.1658806436272082 | AG141: 0.24866131188801807 | AH141: =1.64*RC[-1] -> 0.40780455149634959 | AI141: =IF(EQUAL(VLOOKUP(RC[-4],R9C3:R186C4,2,0),1),RC[-1],NA()) -> 0.40780455149634959 | AJ141: =IF(ISNA(RC[-1])=1,"",RC[-5]) -> CHL | AK141: Bahrain | AL141: BHR | AM141: 0.75189178411657842 | AN141: 0.39525422199815724 | AO141: =1.64*RC[-1] -> 0.64821692407697784 | AP141: =IF(EQUAL(VLOOKUP(RC[-4],R9C3:R186C4,2,0),1),RC[-1],NA()) -> NA() | AQ141: =IF(ISNA(RC[-1])=1,"",RC[-5]) ->  | AR141: Cyprus | AS141: CYP | AT141: 0.92756749502634872 | AU141: 0.27634968636657775 | AV141: =1.64*RC[-1] -> 0.45321348564118746 | AW141: =IF(EQUAL(VLOOKUP(RC[-4],R9C3:R186C4,2,0),1),RC[-1],NA()) -> NA() | AX141: =IF(ISNA(RC[-1])=1,"",RC[-5]) ->  | AY141: Portugal | AZ141: PRT | BA141: 1.2179071090278533 | BB141: 0.18909298753709736 | BC141: =1.64*RC[-1] -> 0.31011249956083964 | BD141: =IF(EQUAL(VLOOKUP(RC[-4],R9C3:R186C4,2,0),1),RC[-1],NA()) -> NA() | BE141: =IF(ISNA(RC[-1])=1,"",RC[-5]) -> 
B142: Paraguay | C142: PRY | D142: =IF(EQUAL(ComparativeCharts!R[11]C,""),"",1) ->  | O142: 135 | P142: South Africa | Q142: ZAF | R142: 0.99127280362861914 | S142: 0.25130023322348893 | T142: =1.64*RC[-1] -> 0.41213238248652184 | U142: =IF(EQUAL(VLOOKUP(RC[-4],R9C3:R186C4,2,0),1),RC[-1],NA()) -> NA() | V142: =IF(ISNA(RC[-1])=1,"",RC[-5]) ->  | W142: Japan | X142: JPN | Y142: 1.1530756985348389 | Z142: 0.29147875964465686 | AA142: =1.64*RC[-1] -> 0.4780251658172372 | AB142: =IF(EQUAL(VLOOKUP(RC[-4],R9C3:R186C4,2,0),1),RC[-1],NA()) -> NA() | AC142: =IF(ISNA(RC[-1])=1,"",RC[-5]) ->  | AD142: Austria | AE142: AUT | AF142: 1.2187250838209753 | AG142: 0.23363653218585126 | AH142: =1.64*RC[-1] -> 0.38316391278479606 | AI142: =IF(EQUAL(VLOOKUP(RC[-4],R9C3:R186C4,2,0),1),RC[-1],NA()) -> NA() | AJ142: =IF(ISNA(RC[-1])=1,"",RC[-5]) ->  | AK142: Jamaica | AL142: JAM | AM142: 0.75951487631354742 | AN142: 0.51661669269246691 | AO142: =1.64*RC[-1] -> 0.84725137601564571 | AP142: =IF(EQUAL(VLOOKUP(RC[-4],R9C3:R186C4,2,0),1),RC[-1],NA()) -> 0.84725137601564571 | AQ142: =IF(ISNA(RC[-1])=1,"",RC[-5]) -> JAM | AR142: Taiwan, China | AS142: TWN | AT142: 0.92814257216132989 | AU142: 0.21813983950894791 | AV142: =1.64*RC[-1] -> 0.35774933679467458 | AW142: =IF(EQUAL(VLOOKUP(RC[-4],R9C3:R186C4,2,0),1),RC[-1],NA()) -> NA() | AX142: =IF(ISNA(RC[-1])=1,"",RC[-5]) ->  | AY142: Israel | AZ142: ISR | BA142: 1.2766880201375663 | BB142: 0.20069157159218198 | BC142: =1.64*RC[-1] -> 0.32913417741117845 | BD142: =IF(EQUAL(VLOOKUP(RC[-4],R9C3:R186C4,2,0),1),RC[-1],NA()) -> NA() | BE142: =IF(ISNA(RC[-1])=1,"",RC[-5]) -> 
B143: Qatar | C143: QAT | D143: =IF(EQUAL(ComparativeCharts!R[11]C,""),"",1) ->  | O143: 136 | P143: Korea, Rep. | Q143: KOR | R143: 1.0023254816966283 | S143: 0.25130023322348893 | T143: =1.64*RC[-1] -> 0.41213238248652184 | U143: =IF(EQUAL(VLOOKUP(RC[-4],R9C3:R186C4,2,0),1),RC[-1],NA()) -> NA() | V143: =IF(ISNA(RC[-1])=1,"",RC[-5]) ->  | W143: Italy | X143: ITA | Y143: 1.1585265417888226 | Z143: 0.25228486761247954 | AA143: =1.64*RC[-1] -> 0.41374718288446644 | AB143: =IF(EQUAL(VLOOKUP(RC[-4],R9C3:R186C4,2,0),1),RC[-1],NA()) -> NA() | AC143: =IF(ISNA(RC[-1])=1,"",RC[-5]) ->  | AD143: Hong Kong, China | AE143: HKG | AF143: 1.248339680893368 | AG143: 0.24819765298730315 | AH143: =1.64*RC[-1] -> 0.40704415089917712 | AI143: =IF(EQUAL(VLOOKUP(RC[-4],R9C3:R186C4,2,0),1),RC[-1],NA()) -> NA() | AJ143: =IF(ISNA(RC[-1])=1,"",RC[-5]) ->  | AK143: Belgium | AL143: BEL | AM143: 0.79383072480465788 | AN143: 0.22904640098569978 | AO143: =1.64*RC[-1] -> 0.37563609761654765 | AP143: =IF(EQUAL(VLOOKUP(RC[-4],R9C3:R186C4,2,0),1),RC[-1],NA()) -> NA() | AQ143: =IF(ISNA(RC[-1])=1,"",RC[-5]) ->  | AR143: Korea, Rep. | AS143: KOR | AT143: 0.94255099680658327 | AU143: 0.20773727561581487 | AV143: =1.64*RC[-1] -> 0.34068913200993639 | AW143: =IF(EQUAL(VLOOKUP(RC[-4],R9C3:R186C4,2,0),1),RC[-1],NA()) -> NA() | AX143: =IF(ISNA(RC[-1])=1,"",RC[-5]) ->  | AY143: France | AZ143: FRA | BA143: 1.2823942157144548 | BB143: 0.19620820843666348 | BC143: =1.64*RC[-1] -> 0.3217814618361281 | BD143: =IF(EQUAL(VLOOKUP(RC[-4],R9C3:R186C4,2,0),1),RC[-1],NA()) -> NA() | BE143: =IF(ISNA(RC[-1])=1,"",RC[-5]) -> 
B144: Reunion | C144: REU | D144: =IF(EQUAL(ComparativeCharts!R[11]C,""),"",1) ->  | O144: 137 | P144: Guyana | Q144: GUY | R144: 1.0096128462050005 | S144: 0.29137760175532934 | T144: =1.64*RC[-1] -> 0.47785926687874009 | U144: =IF(EQUAL(VLOOKUP(RC[-4],R9C3:R186C4,2,0),1),RC[-1],NA()) -> NA() | V144: =IF(ISNA(RC[-1])=1,"",RC[-5]) ->  | W144: Australia | X144: AUS | Y144: 1.1841498643981401 | Z144: 0.26334453452009404 | AA144: =1.64*RC[-1] -> 0.43188503661295419 | AB144: =IF(EQUAL(VLOOKUP(RC[-4],R9C3:R186C4,2,0),1),RC[-1],NA()) -> NA() | AC144: =IF(ISNA(RC[-1])=1,"",RC[-5]) ->  | AD144: Puerto Rico | AE144: PRI | AF144: 1.2639489175068348 | AG144: 0.5214504122426028 | AH144: =1.64*RC[-1] -> 0.85517867607786857 | AI144: =IF(EQUAL(VLOOKUP(RC[-4],R9C3:R186C4,2,0),1),RC[-1],NA()) -> NA() | AJ144: =IF(ISNA(RC[-1])=1,"",RC[-5]) ->  | AK144: Taiwan, China | AL144: TWN | AM144: 0.82861130204296107 | AN144: 0.22904640098569978 | AO144: =1.64*RC[-1] -> 0.37563609761654765 | AP144: =IF(EQUAL(VLOOKUP(RC[-4],R9C3:R186C4,2,0),1),RC[-1],NA()) -> NA() | AQ144: =IF(ISNA(RC[-1])=1,"",RC[-5]) ->  | AR144: Namibia | AS144: NAM | AT144: 0.95367963398018363 | AU144: 0.30864385839110769 | AV144: =1.64*RC[-1] -> 0.50617592776141662 | AW144: =IF(EQUAL(VLOOKUP(RC[-4],R9C3:R186C4,2,0),1),RC[-1],NA()) -> NA() | AX144: =IF(ISNA(RC[-1])=1,"",RC[-5]) ->  | AY144: Hong Kong, China | AZ144: HKG | BA144: 1.3133359796370441 | BB144: 0.15607290306933727 | BC144: =1.64*RC[-1] -> 0.25595956103371309 | BD144: =IF(EQUAL(VLOOKUP(RC[-4],R9C3:R186C4,2,0),1),RC[-1],NA()) -> NA() | BE144: =IF(ISNA(RC[-1])=1,"",RC[-5]) -> 
B145: Romania | C145: ROM | D145: =IF(EQUAL(ComparativeCharts!R[11]C,""),"",1) ->  | O145: 138 | P145: Mauritius | Q145: MUS | R145: 1.0116573925871677 | S145: 0.29161828587045291 | T145: =1.64*RC[-1] -> 0.47825398882754272 | U145: =IF(EQUAL(VLOOKUP(RC[-4],R9C3:R186C4,2,0),1),RC[-1],NA()) -> NA() | V145: =IF(ISNA(RC[-1])=1,"",RC[-5]) ->  | W145: Hungary | X145: HUN | Y145: 1.2453232292695837 | Z145: 0.21591513909296886 | AA145: =1.64*RC[-1] -> 0.3541008281124689 | AB145: =IF(EQUAL(VLOOKUP(RC[-4],R9C3:R186C4,2,0),1),RC[-1],NA()) -> NA() | AC145: =IF(ISNA(RC[-1])=1,"",RC[-5]) ->  | AD145: France | AE145: FRA | AF145: 1.2795323804320009 | AG145: 0.23363653218585126 | AH145: =1.64*RC[-1] -> 0.38316391278479606 | AI145: =IF(EQUAL(VLOOKUP(RC[-4],R9C3:R186C4,2,0),1),RC[-1],NA()) -> NA() | AJ145: =IF(ISNA(RC[-1])=1,"",RC[-5]) ->  | AK145: Cyprus | AL145: CYP | AM145: 0.84004063448684252 | AN145: 0.39525422199815724 | AO145: =1.64*RC[-1] -> 0.64821692407697784 | AP145: =IF(EQUAL(VLOOKUP(RC[-4],R9C3:R186C4,2,0),1),RC[-1],NA()) -> NA() | AQ145: =IF(ISNA(RC[-1])=1,"",RC[-5]) ->  | AR145: Israel | AS145: ISR | AT145: 0.96584431336432763 | AU145: 0.23004193092994482 | AV145: =1.64*RC[-1] -> 0.37726876672510951 | AW145: =IF(EQUAL(VLOOKUP(RC[-4],R9C3:R186C4,2,0),1),RC[-1],NA()) -> NA() | AX145: =IF(ISNA(RC[-1])=1,"",RC[-5]) ->  | AY145: United States | AZ145: USA | BA145: 1.4068375500297514 | BB145: 0.19620820843666348 | BC145: =1.64*RC[-1] -> 0.3217814618361281 | BD145: =IF(EQUAL(VLOOKUP(RC[-4],R9C3:R186C4,2,0),1),RC[-1],NA()) -> NA() | BE145: =IF(ISNA(RC[-1])=1,"",RC[-5]) -> 
B146: Russian Federation | C146: RUS | D146: =IF(EQUAL(ComparativeCharts!R[11]C,""),"",1) ->  | O146: 139 | P146: Slovenia | Q146: SVN | R146: 1.0663586389669255 | S146: 0.25402694431067208 | T146: =1.64*RC[-1] -> 0.41660418866950216 | U146: =IF(EQUAL(VLOOKUP(RC[-4],R9C3:R186C4,2,0),1),RC[-1],NA()) -> 0.41660418866950216 | V146: =IF(ISNA(RC[-1])=1,"",RC[-5]) -> SVN | W146: Iceland | X146: ISL | Y146: 1.2522728871049793 | Z146: 0.37283022304968616 | AA146: =1.64*RC[-1] -> 0.61144156580148523 | AB146: =IF(EQUAL(VLOOKUP(RC[-4],R9C3:R186C4,2,0),1),RC[-1],NA()) -> NA() | AC146: =IF(ISNA(RC[-1])=1,"",RC[-5]) ->  | AD146: Taiwan, China | AE146: TWN | AF146: 1.2936641101344104 | AG146: 0.24866131188801807 | AH146: =1.64*RC[-1] -> 0.40780455149634959 | AI146: =IF(EQUAL(VLOOKUP(RC[-4],R9C3:R186C4,2,0),1),RC[-1],NA()) -> NA() | AJ146: =IF(ISNA(RC[-1])=1,"",RC[-5]) ->  | AK146: Puerto Rico | AL146: PRI | AM146: 0.84487654645051646 | AN146: 0.51974023621919629 | AO146: =1.64*RC[-1] -> 0.85237398739948189 | AP146: =IF(EQUAL(VLOOKUP(RC[-4],R9C3:R186C4,2,0),1),RC[-1],NA()) -> NA() | AQ146: =IF(ISNA(RC[-1])=1,"",RC[-5]) ->  | AR146: Spain | AS146: ESP | AT146: 1.0321345377942983 | AU146: 0.20773727561581487 | AV146: =1.64*RC[-1] -> 0.34068913200993639 | AW146: =IF(EQUAL(VLOOKUP(RC[-4],R9C3:R186C4,2,0),1),RC[-1],NA()) -> NA() | AX146: =IF(ISNA(RC[-1])=1,"",RC[-5]) ->  | AY146: Austria | AZ146: AUT | BA146: 1.4571072810078207 | BB146: 0.18909298753709736 | BC146: =1.64*RC[-1] -> 0.31011249956083964 | BD146: =IF(EQUAL(VLOOKUP(RC[-4],R9C3:R186C4,2,0),1),RC[-1],NA()) -> NA() | BE146: =IF(ISNA(RC[-1])=1,"",RC[-5]) -> 
B147: Rwanda | C147: RWA | D147: =IF(EQUAL(ComparativeCharts!R[11]C,""),"",1) ->  | O147: 140 | P147: Poland | Q147: POL | R147: 1.0701435834095394 | S147: 0.25130023322348893 | T147: =1.64*RC[-1] -> 0.41213238248652184 | U147: =IF(EQUAL(VLOOKUP(RC[-4],R9C3:R186C4,2,0),1),RC[-1],NA()) -> NA() | V147: =IF(ISNA(RC[-1])=1,"",RC[-5]) ->  | W147: Denmark | X147: DNK | Y147: 1.2864399819188064 | Z147: 0.26334453452009404 | AA147: =1.64*RC[-1] -> 0.43188503661295419 | AB147: =IF(EQUAL(VLOOKUP(RC[-4],R9C3:R186C4,2,0),1),RC[-1],NA()) -> NA() | AC147: =IF(ISNA(RC[-1])=1,"",RC[-5]) ->  | AD147: Ireland | AE147: IRL | AF147: 1.3610967373064446 | AG147: 0.23363653218585126 | AH147: =1.64*RC[-1] -> 0.38316391278479606 | AI147: =IF(EQUAL(VLOOKUP(RC[-4],R9C3:R186C4,2,0),1),RC[-1],NA()) -> NA() | AJ147: =IF(ISNA(RC[-1])=1,"",RC[-5]) ->  | AK147: Sweden | AL147: SWE | AM147: 0.85294331420019753 | AN147: 0.22904640098569978 | AO147: =1.64*RC[-1] -> 0.37563609761654765 | AP147: =IF(EQUAL(VLOOKUP(RC[-4],R9C3:R186C4,2,0),1),RC[-1],NA()) -> NA() | AQ147: =IF(ISNA(RC[-1])=1,"",RC[-5]) ->  | AR147: Oman | AS147: OMN | AT147: 1.0768737020434547 | AU147: 0.27634968636657775 | AV147: =1.64*RC[-1] -> 0.45321348564118746 | AW147: =IF(EQUAL(VLOOKUP(RC[-4],R9C3:R186C4,2,0),1),RC[-1],NA()) -> NA() | AX147: =IF(ISNA(RC[-1])=1,"",RC[-5]) ->  | AY147: Ireland | AZ147: IRL | BA147: 1.5672920838952824 | BB147: 0.18909298753709736 | BC147: =1.64*RC[-1] -> 0.31011249956083964 | BD147: =IF(EQUAL(VLOOKUP(RC[-4],R9C3:R186C4,2,0),1),RC[-1],NA()) -> NA() | BE147: =IF(ISNA(RC[-1])=1,"",RC[-5]) -> 
B148: Saudi Arabia | C148: SAU | D148: =IF(EQUAL(ComparativeCharts!R[11]C,""),"",1) ->  | O148: 141 | P148: Greece | Q148: GRC | R148: 1.0745356060007569 | S148: 0.25402694431067208 | T148: =1.64*RC[-1] -> 0.41660418866950216 | U148: =IF(EQUAL(VLOOKUP(RC[-4],R9C3:R186C4,2,0),1),RC[-1],NA()) -> NA() | V148: =IF(ISNA(RC[-1])=1,"",RC[-5]) ->  | W148: Germany | X148: DEU | Y148: 1.3173475489092557 | Z148: 0.25228486761247954 | AA148: =1.64*RC[-1] -> 0.41374718288446644 | AB148: =IF(EQUAL(VLOOKUP(RC[-4],R9C3:R186C4,2,0),1),RC[-1],NA()) -> NA() | AC148: =IF(ISNA(RC[-1])=1,"",RC[-5]) ->  | AD148: United States | AE148: USA | AF148: 1.3658510155010322 | AG148: 0.23363653218585126 | AH148: =1.64*RC[-1] -> 0.38316391278479606 | AI148: =IF(EQUAL(VLOOKUP(RC[-4],R9C3:R186C4,2,0),1),RC[-1],NA()) -> NA() | AJ148: =IF(ISNA(RC[-1])=1,"",RC[-5]) ->  | AK148: Hungary | AL148: HUN | AM148: 0.85406900321636359 | AN148: 0.19196454475476876 | AO148: =1.64*RC[-1] -> 0.31482185339782076 | AP148: =IF(EQUAL(VLOOKUP(RC[-4],R9C3:R186C4,2,0),1),RC[-1],NA()) -> NA() | AQ148: =IF(ISNA(RC[-1])=1,"",RC[-5]) ->  | AR148: France | AS148: FRA | AT148: 1.0771409158461223 | AU148: 0.20773727561581487 | AV148: =1.64*RC[-1] -> 0.34068913200993639 | AW148: =IF(EQUAL(VLOOKUP(RC[-4],R9C3:R186C4,2,0),1),RC[-1],NA()) -> NA() | AX148: =IF(ISNA(RC[-1])=1,"",RC[-5]) ->  | AY148: Australia | AZ148: AUS | BA148: 1.6010837569932306 | BB148: 0.2062763160225359 | BC148: =1.64*RC[-1] -> 0.33829315827695888 | BD148: =IF(EQUAL(VLOOKUP(RC[-4],R9C3:R186C4,2,0),1),RC[-1],NA()) -> NA() | BE148: =IF(ISNA(RC[-1])=1,"",RC[-5]) -> 
B149: Sudan | C149: SDN | D149: =IF(EQUAL(ComparativeCharts!R[11]C,""),"",1) ->  | O149: 142 | P149: Israel | Q149: ISR | R149: 1.0833897624089792 | S149: 0.25402694431067208 | T149: =1.64*RC[-1] -> 0.41660418866950216 | U149: =IF(EQUAL(VLOOKUP(RC[-4],R9C3:R186C4,2,0),1),RC[-1],NA()) -> NA() | V149: =IF(ISNA(RC[-1])=1,"",RC[-5]) ->  | W149: Brunei | X149: BRN | Y149: 1.3179506098994513 | Z149: 0.41252284257447502 | AA149: =1.64*RC[-1] -> 0.67653746182213903 | AB149: =IF(EQUAL(VLOOKUP(RC[-4],R9C3:R186C4,2,0),1),RC[-1],NA()) -> NA() | AC149: =IF(ISNA(RC[-1])=1,"",RC[-5]) ->  | AD149: Germany | AE149: DEU | AF149: 1.4092090341388133 | AG149: 0.23363653218585126 | AH149: =1.64*RC[-1] -> 0.38316391278479606 | AI149: =IF(EQUAL(VLOOKUP(RC[-4],R9C3:R186C4,2,0),1),RC[-1],NA()) -> NA() | AJ149: =IF(ISNA(RC[-1])=1,"",RC[-5]) ->  | AK149: Spain | AL149: ESP | AM149: 0.86427141020371989 | AN149: 0.22876000329023777 | AO149: =1.64*RC[-1] -> 0.37516640539598994 | AP149: =IF(EQUAL(VLOOKUP(RC[-4],R9C3:R186C4,2,0),1),RC[-1],NA()) -> NA() | AQ149: =IF(ISNA(RC[-1])=1,"",RC[-5]) ->  | AR149: Portugal | AS149: PRT | AT149: 1.0833252136506515 | AU149: 0.20773727561581487 | AV149: =1.64*RC[-1] -> 0.34068913200993639 | AW149: =IF(EQUAL(VLOOKUP(RC[-4],R9C3:R186C4,2,0),1),RC[-1],NA()) -> NA() | AX149: =IF(ISNA(RC[-1])=1,"",RC[-5]) ->  | AY149: Germany | AZ149: DEU | BA149: 1.620293094214327 | BB149: 0.18909298753709736 | BC149: =1.64*RC[-1] -> 0.31011249956083964 | BD149: =IF(EQUAL(VLOOKUP(RC[-4],R9C3:R186C4,2,0),1),RC[-1],NA()) -> NA() | BE149: =IF(ISNA(RC[-1])=1,"",RC[-5]) -> 
B150: Senegal | C150: SEN | D150: =IF(EQUAL(ComparativeCharts!R[11]C,""),"",1) ->  | O150: 143 | P150: Cyprus | Q150: CYP | R150: 1.1147992749759257 | S150: 0.25402694431067208 | T150: =1.64*RC[-1] -> 0.41660418866950216 | U150: =IF(EQUAL(VLOOKUP(RC[-4],R9C3:R186C4,2,0),1),RC[-1],NA()) -> NA() | V150: =IF(ISNA(RC[-1])=1,"",RC[-5]) ->  | W150: Malta | X150: MLT | Y150: 1.3179506098994513 | Z150: 0.41252284257447502 | AA150: =1.64*RC[-1] -> 0.67653746182213903 | AB150: =IF(EQUAL(VLOOKUP(RC[-4],R9C3:R186C4,2,0),1),RC[-1],NA()) -> NA() | AC150: =IF(ISNA(RC[-1])=1,"",RC[-5]) ->  | AD150: Australia | AE150: AUS | AF150: 1.4586935841992952 | AG150: 0.24866131188801807 | AH150: =1.64*RC[-1] -> 0.40780455149634959 | AI150: =IF(EQUAL(VLOOKUP(RC[-4],R9C3:R186C4,2,0),1),RC[-1],NA()) -> NA() | AJ150: =IF(ISNA(RC[-1])=1,"",RC[-5]) ->  | AK150: Canada | AL150: CAN | AM150: 0.86920427229691599 | AN150: 0.22876000329023777 | AO150: =1.64*RC[-1] -> 0.37516640539598994 | AP150: =IF(EQUAL(VLOOKUP(RC[-4],R9C3:R186C4,2,0),1),RC[-1],NA()) -> NA() | AQ150: =IF(ISNA(RC[-1])=1,"",RC[-5]) ->  | AR150: Chile | AS150: CHL | AT150: 1.0857252536352944 | AU150: 0.21813983950894791 | AV150: =1.64*RC[-1] -> 0.35774933679467458 | AW150: =IF(EQUAL(VLOOKUP(RC[-4],R9C3:R186C4,2,0),1),RC[-1],NA()) -> 0.35774933679467458 | AX150: =IF(ISNA(RC[-1])=1,"",RC[-5]) -> CHL | AY150: Luxembourg | AZ150: LUX | BA150: 1.6712549925591047 | BB150: 0.28181534772842609 | BC150: =1.64*RC[-1] -> 0.46217717027461874 | BD150: =IF(EQUAL(VLOOKUP(RC[-4],R9C3:R186C4,2,0),1),RC[-1],NA()) -> NA() | BE150: =IF(ISNA(RC[-1])=1,"",RC[-5]) -> 
B151: Singapore | C151: SGP | D151: =IF(EQUAL(ComparativeCharts!R[11]C,""),"",1) ->  | O151: 144 | P151: Bahamas, The | Q151: BHS | R151: 1.134292827063726 | S151: 0.29137760175532934 | T151: =1.64*RC[-1] -> 0.47785926687874009 | U151: =IF(EQUAL(VLOOKUP(RC[-4],R9C3:R186C4,2,0),1),RC[-1],NA()) -> NA() | V151: =IF(ISNA(RC[-1])=1,"",RC[-5]) ->  | W151: Austria | X151: AUT | Y151: 1.3767994469196794 | Z151: 0.25228486761247954 | AA151: =1.64*RC[-1] -> 0.41374718288446644 | AB151: =IF(EQUAL(VLOOKUP(RC[-4],R9C3:R186C4,2,0),1),RC[-1],NA()) -> NA() | AC151: =IF(ISNA(RC[-1])=1,"",RC[-5]) ->  | AD151: Iceland | AE151: ISL | AF151: 1.5039194981551749 | AG151: 0.40963321357920301 | AH151: =1.64*RC[-1] -> 0.67179847026989292 | AI151: =IF(EQUAL(VLOOKUP(RC[-4],R9C3:R186C4,2,0),1),RC[-1],NA()) -> NA() | AJ151: =IF(ISNA(RC[-1])=1,"",RC[-5]) ->  | AK151: Bahamas, The | AL151: BHS | AM151: 0.87001033067620104 | AN151: 0.51994095831945863 | AO151: =1.64*RC[-1] -> 0.85270317164391207 | AP151: =IF(EQUAL(VLOOKUP(RC[-4],R9C3:R186C4,2,0),1),RC[-1],NA()) -> NA() | AQ151: =IF(ISNA(RC[-1])=1,"",RC[-5]) ->  | AR151: West Bank and Gaza | AS151: WTB | AT151: 1.2215946618769973 | AU151: 0.56277765399157664 | AV151: =1.64*RC[-1] -> 0.92295535254618566 | AW151: =IF(EQUAL(VLOOKUP(RC[-4],R9C3:R186C4,2,0),1),RC[-1],NA()) -> NA() | AX151: =IF(ISNA(RC[-1])=1,"",RC[-5]) ->  | AY151: Norway | AZ151: NOR | BA151: 1.686545690363213 | BB151: 0.19805508574877892 | BC151: =1.64*RC[-1] -> 0.32481034062799741 | BD151: =IF(EQUAL(VLOOKUP(RC[-4],R9C3:R186C4,2,0),1),RC[-1],NA()) -> NA() | BE151: =IF(ISNA(RC[-1])=1,"",RC[-5]) -> 
B152: Solomon Islands | C152: SLB | D152: =IF(EQUAL(ComparativeCharts!R[11]C,""),"",1) ->  | O152: 145 | P152: France | Q152: FRA | R152: 1.1502996759101982 | S152: 0.25130023322348893 | T152: =1.64*RC[-1] -> 0.41213238248652184 | U152: =IF(EQUAL(VLOOKUP(RC[-4],R9C3:R186C4,2,0),1),RC[-1],NA()) -> NA() | V152: =IF(ISNA(RC[-1])=1,"",RC[-5]) ->  | W152: Qatar | X152: QAT | Y152: 1.3826613795104528 | Z152: 0.29988188904282925 | AA152: =1.64*RC[-1] -> 0.49180629803023995 | AB152: =IF(EQUAL(VLOOKUP(RC[-4],R9C3:R186C4,2,0),1),RC[-1],NA()) -> NA() | AC152: =IF(ISNA(RC[-1])=1,"",RC[-5]) ->  | AD152: New Zealand | AE152: NZL | AF152: 1.5712871973582454 | AG152: 0.26644174895434825 | AH152: =1.64*RC[-1] -> 0.43696446828513108 | AI152: =IF(EQUAL(VLOOKUP(RC[-4],R9C3:R186C4,2,0),1),RC[-1],NA()) -> NA() | AJ152: =IF(ISNA(RC[-1])=1,"",RC[-5]) ->  | AK152: Bolivia | AL152: BOL | AM152: 0.87584667039929731 | AN152: 0.39378792524103623 | AO152: =1.64*RC[-1] -> 0.64581219739529938 | AP152: =IF(EQUAL(VLOOKUP(RC[-4],R9C3:R186C4,2,0),1),RC[-1],NA()) -> NA() | AQ152: =IF(ISNA(RC[-1])=1,"",RC[-5]) ->  | AR152: Brunei | AS152: BRN | AT152: 1.2515737544191281 | AU152: 0.54869731211835882 | AV152: =1.64*RC[-1] -> 0.89986359187410836 | AW152: =IF(EQUAL(VLOOKUP(RC[-4],R9C3:R186C4,2,0),1),RC[-1],NA()) -> NA() | AX152: =IF(ISNA(RC[-1])=1,"",RC[-5]) ->  | AY152: United Kingdom | AZ152: GBR | BA152: 1.7065235658238367 | BB152: 0.18909298753709736 | BC152: =1.64*RC[-1] -> 0.31011249956083964 | BD152: =IF(EQUAL(VLOOKUP(RC[-4],R9C3:R186C4,2,0),1),RC[-1],NA()) -> NA() | BE152: =IF(ISNA(RC[-1])=1,"",RC[-5]) -> 
B153: Sierra Leone | C153: SLE | D153: =IF(EQUAL(ComparativeCharts!R[11]C,""),"",1) ->  | O153: 146 | P153: Japan | Q153: JPN | R153: 1.1631096027408296 | S153: 0.29137760175532934 | T153: =1.64*RC[-1] -> 0.47785926687874009 | U153: =IF(EQUAL(VLOOKUP(RC[-4],R9C3:R186C4,2,0),1),RC[-1],NA()) -> NA() | V153: =IF(ISNA(RC[-1])=1,"",RC[-5]) ->  | W153: Portugal | X153: PRT | Y153: 1.3850770909438732 | Z153: 0.25228486761247954 | AA153: =1.64*RC[-1] -> 0.41374718288446644 | AB153: =IF(EQUAL(VLOOKUP(RC[-4],R9C3:R186C4,2,0),1),RC[-1],NA()) -> NA() | AC153: =IF(ISNA(RC[-1])=1,"",RC[-5]) ->  | AD153: Sweden | AE153: SWE | AF153: 1.5728030134094835 | AG153: 0.24866131188801807 | AH153: =1.64*RC[-1] -> 0.40780455149634959 | AI153: =IF(EQUAL(VLOOKUP(RC[-4],R9C3:R186C4,2,0),1),RC[-1],NA()) -> NA() | AJ153: =IF(ISNA(RC[-1])=1,"",RC[-5]) ->  | AK153: Switzerland | AL153: CHE | AM153: 0.87794009701113995 | AN153: 0.22876000329023777 | AO153: =1.64*RC[-1] -> 0.37516640539598994 | AP153: =IF(EQUAL(VLOOKUP(RC[-4],R9C3:R186C4,2,0),1),RC[-1],NA()) -> NA() | AQ153: =IF(ISNA(RC[-1])=1,"",RC[-5]) ->  | AR153: United States | AS153: USA | AT153: 1.2541184418853002 | AU153: 0.20773727561581487 | AV153: =1.64*RC[-1] -> 0.34068913200993639 | AW153: =IF(EQUAL(VLOOKUP(RC[-4],R9C3:R186C4,2,0),1),RC[-1],NA()) -> NA() | AX153: =IF(ISNA(RC[-1])=1,"",RC[-5]) ->  | AY153: Cyprus | AZ153: CYP | BA153: 1.8112838012677106 | BB153: 0.26706317040829514 | BC153: =1.64*RC[-1] -> 0.43798359946960402 | BD153: =IF(EQUAL(VLOOKUP(RC[-4],R9C3:R186C4,2,0),1),RC[-1],NA()) -> NA() | BE153: =IF(ISNA(RC[-1])=1,"",RC[-5]) -> 
B154: El Salvador | C154: SLV | D154: =IF(EQUAL(ComparativeCharts!R[11]C,""),"",1) ->  | O154: 147 | P154: Solomon Islands | Q154: SLB | R154: 1.1726421372855891 | S154: 0.36031461549530619 | T154: =1.64*RC[-1] -> 0.59091596941230207 | U154: =IF(EQUAL(VLOOKUP(RC[-4],R9C3:R186C4,2,0),1),RC[-1],NA()) -> NA() | V154: =IF(ISNA(RC[-1])=1,"",RC[-5]) ->  | W154: Singapore | X154: SGP | Y154: 1.3858914628879786 | Z154: 0.25228486761247954 | AA154: =1.64*RC[-1] -> 0.41374718288446644 | AB154: =IF(EQUAL(VLOOKUP(RC[-4],R9C3:R186C4,2,0),1),RC[-1],NA()) -> NA() | AC154: =IF(ISNA(RC[-1])=1,"",RC[-5]) ->  | AD154: Spain | AE154: ESP | AF154: 1.6032703203239362 | AG154: 0.23363653218585126 | AH154: =1.64*RC[-1] -> 0.38316391278479606 | AI154: =IF(EQUAL(VLOOKUP(RC[-4],R9C3:R186C4,2,0),1),RC[-1],NA()) -> NA() | AJ154: =IF(ISNA(RC[-1])=1,"",RC[-5]) ->  | AK154: Portugal | AL154: PRT | AM154: 0.889263512052202 | AN154: 0.22876000329023777 | AO154: =1.64*RC[-1] -> 0.37516640539598994 | AP154: =IF(EQUAL(VLOOKUP(RC[-4],R9C3:R186C4,2,0),1),RC[-1],NA()) -> NA() | AQ154: =IF(ISNA(RC[-1])=1,"",RC[-5]) ->  | AR154: Qatar | AS154: QAT | AT154: 1.2693962872617988 | AU154: 0.27634968636657775 | AV154: =1.64*RC[-1] -> 0.45321348564118746 | AW154: =IF(EQUAL(VLOOKUP(RC[-4],R9C3:R186C4,2,0),1),RC[-1],NA()) -> NA() | AX154: =IF(ISNA(RC[-1])=1,"",RC[-5]) ->  | AY154: Iceland | AZ154: ISL | BA154: 1.8305518529697775 | BB154: 0.30715193897551524 | BC154: =1.64*RC[-1] -> 0.503729179919845 | BD154: =IF(EQUAL(VLOOKUP(RC[-4],R9C3:R186C4,2,0),1),RC[-1],NA()) -> NA() | BE154: =IF(ISNA(RC[-1])=1,"",RC[-5]) -> 
B155: Somalia | C155: SOM | D155: =IF(EQUAL(ComparativeCharts!R[11]C,""),"",1) ->  | O155: 148 | P155: Hungary | Q155: HUN | R155: 1.1983193666152308 | S155: 0.25130023322348893 | T155: =1.64*RC[-1] -> 0.41213238248652184 | U155: =IF(EQUAL(VLOOKUP(RC[-4],R9C3:R186C4,2,0),1),RC[-1],NA()) -> NA() | V155: =IF(ISNA(RC[-1])=1,"",RC[-5]) ->  | W155: Luxembourg | X155: LUX | Y155: 1.3977224509488229 | Z155: 0.37283022304968616 | AA155: =1.64*RC[-1] -> 0.61144156580148523 | AB155: =IF(EQUAL(VLOOKUP(RC[-4],R9C3:R186C4,2,0),1),RC[-1],NA()) -> NA() | AC155: =IF(ISNA(RC[-1])=1,"",RC[-5]) ->  | AD155: Finland | AE155: FIN | AF155: 1.6347579965603423 | AG155: 0.24866131188801807 | AH155: =1.64*RC[-1] -> 0.40780455149634959 | AI155: =IF(EQUAL(VLOOKUP(RC[-4],R9C3:R186C4,2,0),1),RC[-1],NA()) -> NA() | AJ155: =IF(ISNA(RC[-1])=1,"",RC[-5]) ->  | AK155: Germany | AL155: DEU | AM155: 0.8894032538285277 | AN155: 0.22876000329023777 | AO155: =1.64*RC[-1] -> 0.37516640539598994 | AP155: =IF(EQUAL(VLOOKUP(RC[-4],R9C3:R186C4,2,0),1),RC[-1],NA()) -> NA() | AQ155: =IF(ISNA(RC[-1])=1,"",RC[-5]) ->  | AR155: Mauritius | AS155: MUS | AT155: 1.2789241517949994 | AU155: 0.31108529724680994 | AV155: =1.64*RC[-1] -> 0.51017988748476828 | AW155: =IF(EQUAL(VLOOKUP(RC[-4],R9C3:R186C4,2,0),1),RC[-1],NA()) -> NA() | AX155: =IF(ISNA(RC[-1])=1,"",RC[-5]) ->  | AY155: Singapore | AZ155: SGP | BA155: 1.9475060127215491 | BB155: 0.15865659221332654 | BC155: =1.64*RC[-1] -> 0.2601968112298555 | BD155: =IF(EQUAL(VLOOKUP(RC[-4],R9C3:R186C4,2,0),1),RC[-1],NA()) -> NA() | BE155: =IF(ISNA(RC[-1])=1,"",RC[-5]) -> 
B156: Sao Tome and Principe and Pr | C156: STP | D156: =IF(EQUAL(ComparativeCharts!R[11]C,""),"",1) ->  | O156: 149 | P156: Czech Republic | Q156: CZE | R156: 1.2013737668717452 | S156: 0.25130023322348893 | T156: =1.64*RC[-1] -> 0.41213238248652184 | U156: =IF(EQUAL(VLOOKUP(RC[-4],R9C3:R186C4,2,0),1),RC[-1],NA()) -> NA() | V156: =IF(ISNA(RC[-1])=1,"",RC[-5]) ->  | W156: Sweden | X156: SWE | Y156: 1.41091877442809 | Z156: 0.26334453452009404 | AA156: =1.64*RC[-1] -> 0.43188503661295419 | AB156: =IF(EQUAL(VLOOKUP(RC[-4],R9C3:R186C4,2,0),1),RC[-1],NA()) -> NA() | AC156: =IF(ISNA(RC[-1])=1,"",RC[-5]) ->  | AD156: Norway | AE156: NOR | AF156: 1.6662177044204756 | AG156: 0.24866131188801807 | AH156: =1.64*RC[-1] -> 0.40780455149634959 | AI156: =IF(EQUAL(VLOOKUP(RC[-4],R9C3:R186C4,2,0),1),RC[-1],NA()) -> NA() | AJ156: =IF(ISNA(RC[-1])=1,"",RC[-5]) ->  | AK156: Chile | AL156: CHL | AM156: 0.89826146698774756 | AN156: 0.22904640098569978 | AO156: =1.64*RC[-1] -> 0.37563609761654765 | AP156: =IF(EQUAL(VLOOKUP(RC[-4],R9C3:R186C4,2,0),1),RC[-1],NA()) -> 0.37563609761654765 | AQ156: =IF(ISNA(RC[-1])=1,"",RC[-5]) -> CHL | AR156: Hong Kong, China | AS156: HKG | AT156: 1.3333912954277634 | AU156: 0.21793746551824869 | AV156: =1.64*RC[-1] -> 0.35741744344992782 | AW156: =IF(EQUAL(VLOOKUP(RC[-4],R9C3:R186C4,2,0),1),RC[-1],NA()) -> NA() | AX156: =IF(ISNA(RC[-1])=1,"",RC[-5]) ->  | AY156: Netherlands | AZ156: NLD | BA156: 2.0264072699306945 | BB156: 0.19805508574877892 | BC156: =1.64*RC[-1] -> 0.32481034062799741 | BD156: =IF(EQUAL(VLOOKUP(RC[-4],R9C3:R186C4,2,0),1),RC[-1],NA()) -> 0.32481034062799741 | BE156: =IF(ISNA(RC[-1])=1,"",RC[-5]) -> NLD
B157: Suriname | C157: SUR | D157: =IF(EQUAL(ComparativeCharts!R[11]C,""),"",1) ->  | O157: 150 | P157: Belize | Q157: BLZ | R157: 1.2313222096205774 | S157: 0.36031461549530619 | T157: =1.64*RC[-1] -> 0.59091596941230207 | U157: =IF(EQUAL(VLOOKUP(RC[-4],R9C3:R186C4,2,0),1),RC[-1],NA()) -> NA() | V157: =IF(ISNA(RC[-1])=1,"",RC[-5]) ->  | W157: Norway | X157: NOR | Y157: 1.4144283155229094 | Z157: 0.26334453452009404 | AA157: =1.64*RC[-1] -> 0.43188503661295419 | AB157: =IF(EQUAL(VLOOKUP(RC[-4],R9C3:R186C4,2,0),1),RC[-1],NA()) -> NA() | AC157: =IF(ISNA(RC[-1])=1,"",RC[-5]) ->  | AD157: Luxembourg | AE157: LUX | AF157: 1.6736556760696357 | AG157: 0.40963321357920301 | AH157: =1.64*RC[-1] -> 0.67179847026989292 | AI157: =IF(EQUAL(VLOOKUP(RC[-4],R9C3:R186C4,2,0),1),RC[-1],NA()) -> NA() | AJ157: =IF(ISNA(RC[-1])=1,"",RC[-5]) ->  | AK157: Austria | AL157: AUT | AM157: 0.90088083633492544 | AN157: 0.22876000329023777 | AO157: =1.64*RC[-1] -> 0.37516640539598994 | AP157: =IF(EQUAL(VLOOKUP(RC[-4],R9C3:R186C4,2,0),1),RC[-1],NA()) -> NA() | AQ157: =IF(ISNA(RC[-1])=1,"",RC[-5]) ->  | AR157: Ireland | AS157: IRL | AT157: 1.3949005873785982 | AU157: 0.20773727561581487 | AV157: =1.64*RC[-1] -> 0.34068913200993639 | AW157: =IF(EQUAL(VLOOKUP(RC[-4],R9C3:R186C4,2,0),1),RC[-1],NA()) -> NA() | AX157: =IF(ISNA(RC[-1])=1,"",RC[-5]) ->  | AY157: Canada | AZ157: CAN | BA157: 2.0554748566836194 | BB157: 0.19620820843666348 | BC157: =1.64*RC[-1] -> 0.3217814618361281 | BD157: =IF(EQUAL(VLOOKUP(RC[-4],R9C3:R186C4,2,0),1),RC[-1],NA()) -> NA() | BE157: =IF(ISNA(RC[-1])=1,"",RC[-5]) -> 
B158: Slovak Republic | C158: SVK | D158: =IF(EQUAL(ComparativeCharts!R[11]C,""),"",1) ->  | O158: 151 | P158: Italy | Q158: ITA | R158: 1.2869196432195344 | S158: 0.25130023322348893 | T158: =1.64*RC[-1] -> 0.41213238248652184 | U158: =IF(EQUAL(VLOOKUP(RC[-4],R9C3:R186C4,2,0),1),RC[-1],NA()) -> NA() | V158: =IF(ISNA(RC[-1])=1,"",RC[-5]) ->  | W158: New Zealand | X158: NZL | Y158: 1.4159394169265673 | Z158: 0.28355035712187776 | AA158: =1.64*RC[-1] -> 0.46502258567987947 | AB158: =IF(EQUAL(VLOOKUP(RC[-4],R9C3:R186C4,2,0),1),RC[-1],NA()) -> NA() | AC158: =IF(ISNA(RC[-1])=1,"",RC[-5]) ->  | AD158: Canada | AE158: CAN | AF158: 1.7173477738489658 | AG158: 0.23363653218585126 | AH158: =1.64*RC[-1] -> 0.38316391278479606 | AI158: =IF(EQUAL(VLOOKUP(RC[-4],R9C3:R186C4,2,0),1),RC[-1],NA()) -> NA() | AJ158: =IF(ISNA(RC[-1])=1,"",RC[-5]) ->  | AK158: Costa Rica | AL158: CRI | AM158: 0.92701027674402026 | AN158: 0.39378792524103623 | AO158: =1.64*RC[-1] -> 0.64581219739529938 | AP158: =IF(EQUAL(VLOOKUP(RC[-4],R9C3:R186C4,2,0),1),RC[-1],NA()) -> NA() | AQ158: =IF(ISNA(RC[-1])=1,"",RC[-5]) ->  | AR158: Japan | AS158: JPN | AT158: 1.421874528246035 | AU158: 0.25031543677274476 | AV158: =1.64*RC[-1] -> 0.41051731630730137 | AW158: =IF(EQUAL(VLOOKUP(RC[-4],R9C3:R186C4,2,0),1),RC[-1],NA()) -> NA() | AX158: =IF(ISNA(RC[-1])=1,"",RC[-5]) ->  | AY158: Switzerland | AZ158: CHE | BA158: 2.0717306679793031 | BB158: 0.18909298753709736 | BC158: =1.64*RC[-1] -> 0.31011249956083964 | BD158: =IF(EQUAL(VLOOKUP(RC[-4],R9C3:R186C4,2,0),1),RC[-1],NA()) -> NA() | BE158: =IF(ISNA(RC[-1])=1,"",RC[-5]) -> 
B159: Slovenia | C159: SVN | D159: =IF(EQUAL(ComparativeCharts!R[11]C,""),"",1) -> 1 | O159: 152 | P159: Spain | Q159: ESP | R159: 1.3380199772448051 | S159: 0.25130023322348893 | T159: =1.64*RC[-1] -> 0.41213238248652184 | U159: =IF(EQUAL(VLOOKUP(RC[-4],R9C3:R186C4,2,0),1),RC[-1],NA()) -> NA() | V159: =IF(ISNA(RC[-1])=1,"",RC[-5]) ->  | W159: Ireland | X159: IRL | Y159: 1.4262170025785166 | Z159: 0.25228486761247954 | AA159: =1.64*RC[-1] -> 0.41374718288446644 | AB159: =IF(EQUAL(VLOOKUP(RC[-4],R9C3:R186C4,2,0),1),RC[-1],NA()) -> NA() | AC159: =IF(ISNA(RC[-1])=1,"",RC[-5]) ->  | AD159: Denmark | AE159: DNK | AF159: 1.7210518549222174 | AG159: 0.24866131188801807 | AH159: =1.64*RC[-1] -> 0.40780455149634959 | AI159: =IF(EQUAL(VLOOKUP(RC[-4],R9C3:R186C4,2,0),1),RC[-1],NA()) -> NA() | AJ159: =IF(ISNA(RC[-1])=1,"",RC[-5]) ->  | AK159: Norway | AL159: NOR | AM159: 0.93212358669214346 | AN159: 0.22904640098569978 | AO159: =1.64*RC[-1] -> 0.37563609761654765 | AP159: =IF(EQUAL(VLOOKUP(RC[-4],R9C3:R186C4,2,0),1),RC[-1],NA()) -> NA() | AQ159: =IF(ISNA(RC[-1])=1,"",RC[-5]) ->  | AR159: Iceland | AS159: ISL | AT159: 1.468929716285384 | AU159: 0.30294285039196189 | AV159: =1.64*RC[-1] -> 0.49682627464281748 | AW159: =IF(EQUAL(VLOOKUP(RC[-4],R9C3:R186C4,2,0),1),RC[-1],NA()) -> NA() | AX159: =IF(ISNA(RC[-1])=1,"",RC[-5]) ->  | AY159: New Zealand | AZ159: NZL | BA159: 2.0749421966120853 | BB159: 0.20069157159218198 | BC159: =1.64*RC[-1] -> 0.32913417741117845 | BD159: =IF(EQUAL(VLOOKUP(RC[-4],R9C3:R186C4,2,0),1),RC[-1],NA()) -> NA() | BE159: =IF(ISNA(RC[-1])=1,"",RC[-5]) -> 
B160: Sweden | C160: SWE | D160: =IF(EQUAL(ComparativeCharts!R[11]C,""),"",1) ->  | O160: 153 | P160: Costa Rica | Q160: CRI | R160: 1.3452746080099194 | S160: 0.25130023322348893 | T160: =1.64*RC[-1] -> 0.41213238248652184 | U160: =IF(EQUAL(VLOOKUP(RC[-4],R9C3:R186C4,2,0),1),RC[-1],NA()) -> NA() | V160: =IF(ISNA(RC[-1])=1,"",RC[-5]) ->  | W160: Netherlands | X160: NLD | Y160: 1.4788705613589805 | Z160: 0.26334453452009404 | AA160: =1.64*RC[-1] -> 0.43188503661295419 | AB160: =IF(EQUAL(VLOOKUP(RC[-4],R9C3:R186C4,2,0),1),RC[-1],NA()) -> 0.43188503661295419 | AC160: =IF(ISNA(RC[-1])=1,"",RC[-5]) -> NLD | AD160: United Kingdom | AE160: GBR | AF160: 1.9661212499735987 | AG160: 0.23363653218585126 | AH160: =1.64*RC[-1] -> 0.38316391278479606 | AI160: =IF(EQUAL(VLOOKUP(RC[-4],R9C3:R186C4,2,0),1),RC[-1],NA()) -> NA() | AJ160: =IF(ISNA(RC[-1])=1,"",RC[-5]) ->  | AK160: Luxembourg | AL160: LUX | AM160: 0.94666098361200313 | AN160: 0.24723861307061137 | AO160: =1.64*RC[-1] -> 0.40547132543580261 | AP160: =IF(EQUAL(VLOOKUP(RC[-4],R9C3:R186C4,2,0),1),RC[-1],NA()) -> NA() | AQ160: =IF(ISNA(RC[-1])=1,"",RC[-5]) ->  | AR160: Germany | AS160: DEU | AT160: 1.4834868013088114 | AU160: 0.20773727561581487 | AV160: =1.64*RC[-1] -> 0.34068913200993639 | AW160: =IF(EQUAL(VLOOKUP(RC[-4],R9C3:R186C4,2,0),1),RC[-1],NA()) -> NA() | AX160: =IF(ISNA(RC[-1])=1,"",RC[-5]) ->  | AY160: Finland | AZ160: FIN | BA160: 2.0845938398089947 | BB160: 0.19805508574877892 | BC160: =1.64*RC[-1] -> 0.32481034062799741 | BD160: =IF(EQUAL(VLOOKUP(RC[-4],R9C3:R186C4,2,0),1),RC[-1],NA()) -> NA() | BE160: =IF(ISNA(RC[-1])=1,"",RC[-5]) -> 
B161: Swaziland | C161: SWZ | D161: =IF(EQUAL(ComparativeCharts!R[11]C,""),"",1) ->  | O161: 154 | P161: Canada | Q161: CAN | R161: 1.361941879207283 | S161: 0.25130023322348893 | T161: =1.64*RC[-1] -> 0.41213238248652184 | U161: =IF(EQUAL(VLOOKUP(RC[-4],R9C3:R186C4,2,0),1),RC[-1],NA()) -> NA() | V161: =IF(ISNA(RC[-1])=1,"",RC[-5]) ->  | W161: Finland | X161: FIN | Y161: 1.5143605283955008 | Z161: 0.26334453452009404 | AA161: =1.64*RC[-1] -> 0.43188503661295419 | AB161: =IF(EQUAL(VLOOKUP(RC[-4],R9C3:R186C4,2,0),1),RC[-1],NA()) -> NA() | AC161: =IF(ISNA(RC[-1])=1,"",RC[-5]) ->  | AD161: Switzerland | AE161: CHE | AF161: 1.9862523215178465 | AG161: 0.23363653218585126 | AH161: =1.64*RC[-1] -> 0.38316391278479606 | AI161: =IF(EQUAL(VLOOKUP(RC[-4],R9C3:R186C4,2,0),1),RC[-1],NA()) -> NA() | AJ161: =IF(ISNA(RC[-1])=1,"",RC[-5]) ->  | AK161: Uruguay | AL161: URY | AM161: 0.94877636997424286 | AN161: 0.39525422199815724 | AO161: =1.64*RC[-1] -> 0.64821692407697784 | AP161: =IF(EQUAL(VLOOKUP(RC[-4],R9C3:R186C4,2,0),1),RC[-1],NA()) -> NA() | AQ161: =IF(ISNA(RC[-1])=1,"",RC[-5]) ->  | AR161: Canada | AS161: CAN | AT161: 1.5494586944364037 | AU161: 0.20773727561581487 | AV161: =1.64*RC[-1] -> 0.34068913200993639 | AW161: =IF(EQUAL(VLOOKUP(RC[-4],R9C3:R186C4,2,0),1),RC[-1],NA()) -> NA() | AX161: =IF(ISNA(RC[-1])=1,"",RC[-5]) ->  | AY161: Sweden | AZ161: SWE | BA161: 2.0853368988304859 | BB161: 0.19805508574877892 | BC161: =1.64*RC[-1] -> 0.32481034062799741 | BD161: =IF(EQUAL(VLOOKUP(RC[-4],R9C3:R186C4,2,0),1),RC[-1],NA()) -> NA() | BE161: =IF(ISNA(RC[-1])=1,"",RC[-5]) -> 
B162: Syrian Arab Republic | C162: SYR | D162: =IF(EQUAL(ComparativeCharts!R[11]C,""),"",1) ->  | O162: 155 | P162: Malta | Q162: MLT | R162: 1.4131422877396469 | S162: 0.29137760175532934 | T162: =1.64*RC[-1] -> 0.47785926687874009 | U162: =IF(EQUAL(VLOOKUP(RC[-4],R9C3:R186C4,2,0),1),RC[-1],NA()) -> NA() | V162: =IF(ISNA(RC[-1])=1,"",RC[-5]) ->  | W162: Switzerland | X162: CHE | Y162: 1.6904702129713807 | Z162: 0.25228486761247954 | AA162: =1.64*RC[-1] -> 0.41374718288446644 | AB162: =IF(EQUAL(VLOOKUP(RC[-4],R9C3:R186C4,2,0),1),RC[-1],NA()) -> NA() | AC162: =IF(ISNA(RC[-1])=1,"",RC[-5]) ->  | AD162: Netherlands | AE162: NLD | AF162: 2.0302413016471581 | AG162: 0.24866131188801807 | AH162: =1.64*RC[-1] -> 0.40780455149634959 | AI162: =IF(EQUAL(VLOOKUP(RC[-4],R9C3:R186C4,2,0),1),RC[-1],NA()) -> 0.40780455149634959 | AJ162: =IF(ISNA(RC[-1])=1,"",RC[-5]) -> NLD | AK162: Australia | AL162: AUS | AM162: 0.96197014685799465 | AN162: 0.22904640098569978 | AO162: =1.64*RC[-1] -> 0.37563609761654765 | AP162: =IF(EQUAL(VLOOKUP(RC[-4],R9C3:R186C4,2,0),1),RC[-1],NA()) -> NA() | AQ162: =IF(ISNA(RC[-1])=1,"",RC[-5]) ->  | AR162: Netherlands | AS162: NLD | AT162: 1.5839411296446553 | AU162: 0.21813983950894791 | AV162: =1.64*RC[-1] -> 0.35774933679467458 | AW162: =IF(EQUAL(VLOOKUP(RC[-4],R9C3:R186C4,2,0),1),RC[-1],NA()) -> 0.35774933679467458 | AX162: =IF(ISNA(RC[-1])=1,"",RC[-5]) -> NLD | AY162: Denmark | AZ162: DNK | BA162: 2.1290166113845812 | BB162: 0.19805508574877892 | BC162: =1.64*RC[-1] -> 0.32481034062799741 | BD162: =IF(EQUAL(VLOOKUP(RC[-4],R9C3:R186C4,2,0),1),RC[-1],NA()) -> NA() | BE162: =IF(ISNA(RC[-1])=1,"",RC[-5]) -> 
B163: Chad | C163: TCD | D163: =IF(EQUAL(ComparativeCharts!R[11]C,""),"",1) ->  | O163: 156 | P163: Belgium | Q163: BEL | R163: 1.4364193923806405 | S163: 0.25402694431067208 | T163: =1.64*RC[-1] -> 0.41660418866950216 | U163: =IF(EQUAL(VLOOKUP(RC[-4],R9C3:R186C4,2,0),1),RC[-1],NA()) -> NA() | V163: =IF(ISNA(RC[-1])=1,"",RC[-5]) ->  | W163: Afghanistan | X163: AFG | Y163: .. | Z163: .. | AA163: =1.64*RC[-1] -> #VALUE! | AB163: =IF(EQUAL(VLOOKUP(RC[-4],R9C3:R186C4,2,0),1),RC[-1],NA()) -> #VALUE! | AC163: =IF(ISNA(RC[-1])=1,"",RC[-5]) -> AFG | AD163: Singapore | AE163: SGP | AF163: 2.0821981162760688 | AG163: 0.23363653218585126 | AH163: =1.64*RC[-1] -> 0.38316391278479606 | AI163: =IF(EQUAL(VLOOKUP(RC[-4],R9C3:R186C4,2,0),1),RC[-1],NA()) -> NA() | AJ163: =IF(ISNA(RC[-1])=1,"",RC[-5]) ->  | AK163: Panama | AL163: PAN | AM163: 1.0017098959628787 | AN163: 0.39525422199815724 | AO163: =1.64*RC[-1] -> 0.64821692407697784 | AP163: =IF(EQUAL(VLOOKUP(RC[-4],R9C3:R186C4,2,0),1),RC[-1],NA()) -> NA() | AQ163: =IF(ISNA(RC[-1])=1,"",RC[-5]) ->  | AR163: Australia | AS163: AUS | AT163: 1.5963410719730877 | AU163: 0.21813983950894791 | AV163: =1.64*RC[-1] -> 0.35774933679467458 | AW163: =IF(EQUAL(VLOOKUP(RC[-4],R9C3:R186C4,2,0),1),RC[-1],NA()) -> NA() | AX163: =IF(ISNA(RC[-1])=1,"",RC[-5]) ->  | AY163: Afghanistan | AZ163: AFG | BA163: .. | BB163: .. | BC163: =1.64*RC[-1] -> #VALUE! | BD163: =IF(EQUAL(VLOOKUP(RC[-4],R9C3:R186C4,2,0),1),RC[-1],NA()) -> #VALUE! | BE163: =IF(ISNA(RC[-1])=1,"",RC[-5]) -> AFG
B164: Togo | C164: TGO | D164: =IF(EQUAL(ComparativeCharts!R[11]C,""),"",1) ->  | O164: 157 | P164: Iceland | Q164: ISL | R164: 1.4470018668652738 | S164: 0.29137760175532934 | T164: =1.64*RC[-1] -> 0.47785926687874009 | U164: =IF(EQUAL(VLOOKUP(RC[-4],R9C3:R186C4,2,0),1),RC[-1],NA()) -> NA() | V164: =IF(ISNA(RC[-1])=1,"",RC[-5]) ->  | W164: Burundi | X164: BDI | Y164: .. | Z164: .. | AA164: =1.64*RC[-1] -> #VALUE! | AB164: =IF(EQUAL(VLOOKUP(RC[-4],R9C3:R186C4,2,0),1),RC[-1],NA()) -> NA() | AC164: =IF(ISNA(RC[-1])=1,"",RC[-5]) ->  | AD164: Afghanistan | AE164: AFG | AF164: .. | AG164: .. | AH164: =1.64*RC[-1] -> #VALUE! | AI164: =IF(EQUAL(VLOOKUP(RC[-4],R9C3:R186C4,2,0),1),RC[-1],NA()) -> #VALUE! | AJ164: =IF(ISNA(RC[-1])=1,"",RC[-5]) -> AFG | AK164: Denmark | AL164: DNK | AM164: 1.0479273128258686 | AN164: 0.22904640098569978 | AO164: =1.64*RC[-1] -> 0.37563609761654765 | AP164: =IF(EQUAL(VLOOKUP(RC[-4],R9C3:R186C4,2,0),1),RC[-1],NA()) -> NA() | AQ164: =IF(ISNA(RC[-1])=1,"",RC[-5]) ->  | AR164: Luxembourg | AS164: LUX | AT164: 1.6210641287802678 | AU164: 0.30294285039196189 | AV164: =1.64*RC[-1] -> 0.49682627464281748 | AW164: =IF(EQUAL(VLOOKUP(RC[-4],R9C3:R186C4,2,0),1),RC[-1],NA()) -> NA() | AX164: =IF(ISNA(RC[-1])=1,"",RC[-5]) ->  | AY164: Burundi | AZ164: BDI | BA164: .. | BB164: .. | BC164: =1.64*RC[-1] -> #VALUE! | BD164: =IF(EQUAL(VLOOKUP(RC[-4],R9C3:R186C4,2,0),1),RC[-1],NA()) -> NA() | BE164: =IF(ISNA(RC[-1])=1,"",RC[-5]) -> 
B165: Thailand | C165: THA | D165: =IF(EQUAL(ComparativeCharts!R[11]C,""),"",1) ->  | O165: 158 | P165: Austria | Q165: AUT | R165: 1.4471660015733396 | S165: 0.25130023322348893 | T165: =1.64*RC[-1] -> 0.41213238248652184 | U165: =IF(EQUAL(VLOOKUP(RC[-4],R9C3:R186C4,2,0),1),RC[-1],NA()) -> NA() | V165: =IF(ISNA(RC[-1])=1,"",RC[-5]) ->  | W165: Belize | X165: BLZ | Y165: .. | Z165: .. | AA165: =1.64*RC[-1] -> #VALUE! | AB165: =IF(EQUAL(VLOOKUP(RC[-4],R9C3:R186C4,2,0),1),RC[-1],NA()) -> NA() | AC165: =IF(ISNA(RC[-1])=1,"",RC[-5]) ->  | AD165: Burundi | AE165: BDI | AF165: .. | AG165: .. | AH165: =1.64*RC[-1] -> #VALUE! | AI165: =IF(EQUAL(VLOOKUP(RC[-4],R9C3:R186C4,2,0),1),RC[-1],NA()) -> NA() | AJ165: =IF(ISNA(RC[-1])=1,"",RC[-5]) ->  | AK165: United States | AL165: USA | AM165: 1.135074568694195 | AN165: 0.22876000329023777 | AO165: =1.64*RC[-1] -> 0.37516640539598994 | AP165: =IF(EQUAL(VLOOKUP(RC[-4],R9C3:R186C4,2,0),1),RC[-1],NA()) -> NA() | AQ165: =IF(ISNA(RC[-1])=1,"",RC[-5]) ->  | AR165: Sweden | AS165: SWE | AT165: 1.6230324824694748 | AU165: 0.21813983950894791 | AV165: =1.64*RC[-1] -> 0.35774933679467458 | AW165: =IF(EQUAL(VLOOKUP(RC[-4],R9C3:R186C4,2,0),1),RC[-1],NA()) -> NA() | AX165: =IF(ISNA(RC[-1])=1,"",RC[-5]) ->  | AY165: Belize | AZ165: BLZ | BA165: .. | BB165: .. | BC165: =1.64*RC[-1] -> #VALUE! | BD165: =IF(EQUAL(VLOOKUP(RC[-4],R9C3:R186C4,2,0),1),RC[-1],NA()) -> NA() | BE165: =IF(ISNA(RC[-1])=1,"",RC[-5]) -> 
B166: Tajikistan | C166: TJK | D166: =IF(EQUAL(ComparativeCharts!R[11]C,""),"",1) ->  | O166: 159 | P166: New Zealand | Q166: NZL | R166: 1.4570076105795191 | S166: 0.25402694431067208 | T166: =1.64*RC[-1] -> 0.41660418866950216 | U166: =IF(EQUAL(VLOOKUP(RC[-4],R9C3:R186C4,2,0),1),RC[-1],NA()) -> NA() | V166: =IF(ISNA(RC[-1])=1,"",RC[-5]) ->  | W166: Barbados | X166: BRB | Y166: .. | Z166: .. | AA166: =1.64*RC[-1] -> #VALUE! | AB166: =IF(EQUAL(VLOOKUP(RC[-4],R9C3:R186C4,2,0),1),RC[-1],NA()) -> NA() | AC166: =IF(ISNA(RC[-1])=1,"",RC[-5]) ->  | AD166: Belize | AE166: BLZ | AF166: .. | AG166: .. | AH166: =1.64*RC[-1] -> #VALUE! | AI166: =IF(EQUAL(VLOOKUP(RC[-4],R9C3:R186C4,2,0),1),RC[-1],NA()) -> NA() | AJ166: =IF(ISNA(RC[-1])=1,"",RC[-5]) ->  | AK166: Finland | AL166: FIN | AM166: 1.1404307299790992 | AN166: 0.22904640098569978 | AO166: =1.64*RC[-1] -> 0.37563609761654765 | AP166: =IF(EQUAL(VLOOKUP(RC[-4],R9C3:R186C4,2,0),1),RC[-1],NA()) -> NA() | AQ166: =IF(ISNA(RC[-1])=1,"",RC[-5]) ->  | AR166: United Kingdom | AS166: GBR | AT166: 1.6886284952825656 | AU166: 0.20773727561581487 | AV166: =1.64*RC[-1] -> 0.34068913200993639 | AW166: =IF(EQUAL(VLOOKUP(RC[-4],R9C3:R186C4,2,0),1),RC[-1],NA()) -> NA() | AX166: =IF(ISNA(RC[-1])=1,"",RC[-5]) ->  | AY166: Barbados | AZ166: BRB | BA166: .. | BB166: .. | BC166: =1.64*RC[-1] -> #VALUE! | BD166: =IF(EQUAL(VLOOKUP(RC[-4],R9C3:R186C4,2,0),1),RC[-1],NA()) -> NA() | BE166: =IF(ISNA(RC[-1])=1,"",RC[-5]) -> 
B167: Turkmenistan | C167: TKM | D167: =IF(EQUAL(ComparativeCharts!R[11]C,""),"",1) ->  | O167: 160 | P167: Luxembourg | Q167: LUX | R167: 1.4605456989218397 | S167: 0.29137760175532934 | T167: =1.64*RC[-1] -> 0.47785926687874009 | U167: =IF(EQUAL(VLOOKUP(RC[-4],R9C3:R186C4,2,0),1),RC[-1],NA()) -> NA() | V167: =IF(ISNA(RC[-1])=1,"",RC[-5]) ->  | W167: Bhutan | X167: BTN | Y167: .. | Z167: .. | AA167: =1.64*RC[-1] -> #VALUE! | AB167: =IF(EQUAL(VLOOKUP(RC[-4],R9C3:R186C4,2,0),1),RC[-1],NA()) -> NA() | AC167: =IF(ISNA(RC[-1])=1,"",RC[-5]) ->  | AD167: Barbados | AE167: BRB | AF167: .. | AG167: .. | AH167: =1.64*RC[-1] -> #VALUE! | AI167: =IF(EQUAL(VLOOKUP(RC[-4],R9C3:R186C4,2,0),1),RC[-1],NA()) -> NA() | AJ167: =IF(ISNA(RC[-1])=1,"",RC[-5]) ->  | AK167: Netherlands | AL167: NLD | AM167: 1.1409827572037412 | AN167: 0.22904640098569978 | AO167: =1.64*RC[-1] -> 0.37563609761654765 | AP167: =IF(EQUAL(VLOOKUP(RC[-4],R9C3:R186C4,2,0),1),RC[-1],NA()) -> 0.37563609761654765 | AQ167: =IF(ISNA(RC[-1])=1,"",RC[-5]) -> NLD | AR167: Denmark | AS167: DNK | AT167: 1.6912085280949629 | AU167: 0.21813983950894791 | AV167: =1.64*RC[-1] -> 0.35774933679467458 | AW167: =IF(EQUAL(VLOOKUP(RC[-4],R9C3:R186C4,2,0),1),RC[-1],NA()) -> NA() | AX167: =IF(ISNA(RC[-1])=1,"",RC[-5]) ->  | AY167: Bhutan | AZ167: BTN | BA167: .. | BB167: .. | BC167: =1.64*RC[-1] -> #VALUE! | BD167: =IF(EQUAL(VLOOKUP(RC[-4],R9C3:R186C4,2,0),1),RC[-1],NA()) -> NA() | BE167: =IF(ISNA(RC[-1])=1,"",RC[-5]) -> 
B168: Trinidad and Tobago& Tob* | C168: TTO | D168: =IF(EQUAL(ComparativeCharts!R[11]C,""),"",1) ->  | O168: 161 | P168: Portugal | Q168: PRT | R168: 1.4792875486951418 | S168: 0.25130023322348893 | T168: =1.64*RC[-1] -> 0.41213238248652184 | U168: =IF(EQUAL(VLOOKUP(RC[-4],R9C3:R186C4,2,0),1),RC[-1],NA()) -> NA() | V168: =IF(ISNA(RC[-1])=1,"",RC[-5]) ->  | W168: Central African Republic | X168: CAF | Y168: .. | Z168: .. | AA168: =1.64*RC[-1] -> #VALUE! | AB168: =IF(EQUAL(VLOOKUP(RC[-4],R9C3:R186C4,2,0),1),RC[-1],NA()) -> NA() | AC168: =IF(ISNA(RC[-1])=1,"",RC[-5]) ->  | AD168: Bhutan | AE168: BTN | AF168: .. | AG168: .. | AH168: =1.64*RC[-1] -> #VALUE! | AI168: =IF(EQUAL(VLOOKUP(RC[-4],R9C3:R186C4,2,0),1),RC[-1],NA()) -> NA() | AJ168: =IF(ISNA(RC[-1])=1,"",RC[-5]) ->  | AK168: Ireland | AL168: IRL | AM168: 1.1574985980954593 | AN168: 0.22876000329023777 | AO168: =1.64*RC[-1] -> 0.37516640539598994 | AP168: =IF(EQUAL(VLOOKUP(RC[-4],R9C3:R186C4,2,0),1),RC[-1],NA()) -> NA() | AQ168: =IF(ISNA(RC[-1])=1,"",RC[-5]) ->  | AR168: Finland | AS168: FIN | AT168: 1.7363565521720903 | AU168: 0.21813983950894791 | AV168: =1.64*RC[-1] -> 0.35774933679467458 | AW168: =IF(EQUAL(VLOOKUP(RC[-4],R9C3:R186C4,2,0),1),RC[-1],NA()) -> NA() | AX168: =IF(ISNA(RC[-1])=1,"",RC[-5]) ->  | AY168: Central African Republic | AZ168: CAF | BA168: .. | BB168: .. | BC168: =1.64*RC[-1] -> #VALUE! | BD168: =IF(EQUAL(VLOOKUP(RC[-4],R9C3:R186C4,2,0),1),RC[-1],NA()) -> NA() | BE168: =IF(ISNA(RC[-1])=1,"",RC[-5]) -> 
B169: Tunisia | C169: TUN | D169: =IF(EQUAL(ComparativeCharts!R[11]C,""),"",1) -> 1 | O169: 162 | P169: United Kingdom | Q169: GBR | R169: 1.4890363990204536 | S169: 0.25130023322348893 | T169: =1.64*RC[-1] -> 0.41213238248652184 | U169: =IF(EQUAL(VLOOKUP(RC[-4],R9C3:R186C4,2,0),1),RC[-1],NA()) -> NA() | V169: =IF(ISNA(RC[-1])=1,"",RC[-5]) ->  | W169: Comoros | X169: COM | Y169: .. | Z169: .. | AA169: =1.64*RC[-1] -> #VALUE! | AB169: =IF(EQUAL(VLOOKUP(RC[-4],R9C3:R186C4,2,0),1),RC[-1],NA()) -> NA() | AC169: =IF(ISNA(RC[-1])=1,"",RC[-5]) ->  | AD169: Comoros | AE169: COM | AF169: .. | AG169: .. | AH169: =1.64*RC[-1] -> #VALUE! | AI169: =IF(EQUAL(VLOOKUP(RC[-4],R9C3:R186C4,2,0),1),RC[-1],NA()) -> NA() | AJ169: =IF(ISNA(RC[-1])=1,"",RC[-5]) ->  | AK169: New Zealand | AL169: NZL | AM169: 1.2049273660644035 | AN169: 0.22904640098569978 | AO169: =1.64*RC[-1] -> 0.37563609761654765 | AP169: =IF(EQUAL(VLOOKUP(RC[-4],R9C3:R186C4,2,0),1),RC[-1],NA()) -> NA() | AQ169: =IF(ISNA(RC[-1])=1,"",RC[-5]) ->  | AR169: Austria | AS169: AUT | AT169: 1.8123422751679548 | AU169: 0.20773727561581487 | AV169: =1.64*RC[-1] -> 0.34068913200993639 | AW169: =IF(EQUAL(VLOOKUP(RC[-4],R9C3:R186C4,2,0),1),RC[-1],NA()) -> NA() | AX169: =IF(ISNA(RC[-1])=1,"",RC[-5]) ->  | AY169: Comoros | AZ169: COM | BA169: .. | BB169: .. | BC169: =1.64*RC[-1] -> #VALUE! | BD169: =IF(EQUAL(VLOOKUP(RC[-4],R9C3:R186C4,2,0),1),RC[-1],NA()) -> NA() | BE169: =IF(ISNA(RC[-1])=1,"",RC[-5]) -> 
B170: Turkey | C170: TUR | D170: =IF(EQUAL(ComparativeCharts!R[11]C,""),"",1) ->  | O170: 163 | P170: Barbados | Q170: BRB | R170: 1.4902048791283327 | S170: 0.36031461549530619 | T170: =1.64*RC[-1] -> 0.59091596941230207 | U170: =IF(EQUAL(VLOOKUP(RC[-4],R9C3:R186C4,2,0),1),RC[-1],NA()) -> NA() | V170: =IF(ISNA(RC[-1])=1,"",RC[-5]) ->  | W170: Cape verde | X170: CPV | Y170: .. | Z170: .. | AA170: =1.64*RC[-1] -> #VALUE! | AB170: =IF(EQUAL(VLOOKUP(RC[-4],R9C3:R186C4,2,0),1),RC[-1],NA()) -> NA() | AC170: =IF(ISNA(RC[-1])=1,"",RC[-5]) ->  | AD170: Cape verde | AE170: CPV | AF170: .. | AG170: .. | AH170: =1.64*RC[-1] -> #VALUE! | AI170: =IF(EQUAL(VLOOKUP(RC[-4],R9C3:R186C4,2,0),1),RC[-1],NA()) -> NA() | AJ170: =IF(ISNA(RC[-1])=1,"",RC[-5]) ->  | AK170: United Kingdom | AL170: GBR | AM170: 1.2064248676640952 | AN170: 0.22876000329023777 | AO170: =1.64*RC[-1] -> 0.37516640539598994 | AP170: =IF(EQUAL(VLOOKUP(RC[-4],R9C3:R186C4,2,0),1),RC[-1],NA()) -> NA() | AQ170: =IF(ISNA(RC[-1])=1,"",RC[-5]) ->  | AR170: New Zealand | AS170: NZL | AT170: 1.8240022905079323 | AU170: 0.23004193092994482 | AV170: =1.64*RC[-1] -> 0.37726876672510951 | AW170: =IF(EQUAL(VLOOKUP(RC[-4],R9C3:R186C4,2,0),1),RC[-1],NA()) -> NA() | AX170: =IF(ISNA(RC[-1])=1,"",RC[-5]) ->  | AY170: Cape verde | AZ170: CPV | BA170: .. | BB170: .. | BC170: =1.64*RC[-1] -> #VALUE! | BD170: =IF(EQUAL(VLOOKUP(RC[-4],R9C3:R186C4,2,0),1),RC[-1],NA()) -> NA() | BE170: =IF(ISNA(RC[-1])=1,"",RC[-5]) -> 
B171: Taiwan, China | C171: TWN | D171: =IF(EQUAL(ComparativeCharts!R[11]C,""),"",1) ->  | O171: 164 | P171: Germany | Q171: DEU | R171: 1.4903653145322109 | S171: 0.25130023322348893 | T171: =1.64*RC[-1] -> 0.41213238248652184 | U171: =IF(EQUAL(VLOOKUP(RC[-4],R9C3:R186C4,2,0),1),RC[-1],NA()) -> NA() | V171: =IF(ISNA(RC[-1])=1,"",RC[-5]) ->  | W171: Djibouti | X171: DJI | Y171: .. | Z171: .. | AA171: =1.64*RC[-1] -> #VALUE! | AB171: =IF(EQUAL(VLOOKUP(RC[-4],R9C3:R186C4,2,0),1),RC[-1],NA()) -> NA() | AC171: =IF(ISNA(RC[-1])=1,"",RC[-5]) ->  | AD171: Djibouti | AE171: DJI | AF171: .. | AG171: .. | AH171: =1.64*RC[-1] -> #VALUE! | AI171: =IF(EQUAL(VLOOKUP(RC[-4],R9C3:R186C4,2,0),1),RC[-1],NA()) -> NA() | AJ171: =IF(ISNA(RC[-1])=1,"",RC[-5]) ->  | AK171: Hong Kong, China | AL171: HKG | AM171: 1.2071708277427065 | AN171: 0.22876000329023777 | AO171: =1.64*RC[-1] -> 0.37516640539598994 | AP171: =IF(EQUAL(VLOOKUP(RC[-4],R9C3:R186C4,2,0),1),RC[-1],NA()) -> NA() | AQ171: =IF(ISNA(RC[-1])=1,"",RC[-5]) ->  | AR171: Norway | AS171: NOR | AT171: 1.8333934496441047 | AU171: 0.21813983950894791 | AV171: =1.64*RC[-1] -> 0.35774933679467458 | AW171: =IF(EQUAL(VLOOKUP(RC[-4],R9C3:R186C4,2,0),1),RC[-1],NA()) -> NA() | AX171: =IF(ISNA(RC[-1])=1,"",RC[-5]) ->  | AY171: Djibouti | AZ171: DJI | BA171: .. | BB171: .. | BC171: =1.64*RC[-1] -> #VALUE! | BD171: =IF(EQUAL(VLOOKUP(RC[-4],R9C3:R186C4,2,0),1),RC[-1],NA()) -> NA() | BE171: =IF(ISNA(RC[-1])=1,"",RC[-5]) -> 
B172: Tanzania | C172: TZA | D172: =IF(EQUAL(ComparativeCharts!R[11]C,""),"",1) ->  | O172: 165 | P172: Ireland | Q172: IRL | R172: 1.5010334127446112 | S172: 0.25130023322348893 | T172: =1.64*RC[-1] -> 0.41213238248652184 | U172: =IF(EQUAL(VLOOKUP(RC[-4],R9C3:R186C4,2,0),1),RC[-1],NA()) -> NA() | V172: =IF(ISNA(RC[-1])=1,"",RC[-5]) ->  | W172: Eritrea | X172: ERI | Y172: .. | Z172: .. | AA172: =1.64*RC[-1] -> #VALUE! | AB172: =IF(EQUAL(VLOOKUP(RC[-4],R9C3:R186C4,2,0),1),RC[-1],NA()) -> NA() | AC172: =IF(ISNA(RC[-1])=1,"",RC[-5]) ->  | AD172: Eritrea | AE172: ERI | AF172: .. | AG172: .. | AH172: =1.64*RC[-1] -> #VALUE! | AI172: =IF(EQUAL(VLOOKUP(RC[-4],R9C3:R186C4,2,0),1),RC[-1],NA()) -> NA() | AJ172: =IF(ISNA(RC[-1])=1,"",RC[-5]) ->  | AK172: El Salvador | AL172: SLV | AM172: 1.2327131497206449 | AN172: 0.51994095831945863 | AO172: =1.64*RC[-1] -> 0.85270317164391207 | AP172: =IF(EQUAL(VLOOKUP(RC[-4],R9C3:R186C4,2,0),1),RC[-1],NA()) -> NA() | AQ172: =IF(ISNA(RC[-1])=1,"",RC[-5]) ->  | AR172: Singapore | AS172: SGP | AT172: 1.9390344925186949 | AU172: 0.20773727561581487 | AV172: =1.64*RC[-1] -> 0.34068913200993639 | AW172: =IF(EQUAL(VLOOKUP(RC[-4],R9C3:R186C4,2,0),1),RC[-1],NA()) -> NA() | AX172: =IF(ISNA(RC[-1])=1,"",RC[-5]) ->  | AY172: Eritrea | AZ172: ERI | BA172: .. | BB172: .. | BC172: =1.64*RC[-1] -> #VALUE! | BD172: =IF(EQUAL(VLOOKUP(RC[-4],R9C3:R186C4,2,0),1),RC[-1],NA()) -> NA() | BE172: =IF(ISNA(RC[-1])=1,"",RC[-5]) -> 
B173: Uganda | C173: UGA | D173: =IF(EQUAL(ComparativeCharts!R[11]C,""),"",1) ->  | O173: 166 | P173: United States | Q173: USA | R173: 1.5046982710093688 | S173: 0.25130023322348893 | T173: =1.64*RC[-1] -> 0.41213238248652184 | U173: =IF(EQUAL(VLOOKUP(RC[-4],R9C3:R186C4,2,0),1),RC[-1],NA()) -> NA() | V173: =IF(ISNA(RC[-1])=1,"",RC[-5]) ->  | W173: Guadeloupe | X173: GLP | Y173: .. | Z173: .. | AA173: =1.64*RC[-1] -> #VALUE! | AB173: =IF(EQUAL(VLOOKUP(RC[-4],R9C3:R186C4,2,0),1),RC[-1],NA()) -> NA() | AC173: =IF(ISNA(RC[-1])=1,"",RC[-5]) ->  | AD173: Guadeloupe | AE173: GLP | AF173: .. | AG173: .. | AH173: =1.64*RC[-1] -> #VALUE! | AI173: =IF(EQUAL(VLOOKUP(RC[-4],R9C3:R186C4,2,0),1),RC[-1],NA()) -> NA() | AJ173: =IF(ISNA(RC[-1])=1,"",RC[-5]) ->  | AK173: Singapore | AL173: SGP | AM173: 1.2447775768512315 | AN173: 0.22876000329023777 | AO173: =1.64*RC[-1] -> 0.37516640539598994 | AP173: =IF(EQUAL(VLOOKUP(RC[-4],R9C3:R186C4,2,0),1),RC[-1],NA()) -> NA() | AQ173: =IF(ISNA(RC[-1])=1,"",RC[-5]) ->  | AR173: Switzerland | AS173: CHE | AT173: 1.9958319673120584 | AU173: 0.20773727561581487 | AV173: =1.64*RC[-1] -> 0.34068913200993639 | AW173: =IF(EQUAL(VLOOKUP(RC[-4],R9C3:R186C4,2,0),1),RC[-1],NA()) -> NA() | AX173: =IF(ISNA(RC[-1])=1,"",RC[-5]) ->  | AY173: Guadeloupe | AZ173: GLP | BA173: .. | BB173: .. | BC173: =1.64*RC[-1] -> #VALUE! | BD173: =IF(EQUAL(VLOOKUP(RC[-4],R9C3:R186C4,2,0),1),RC[-1],NA()) -> NA() | BE173: =IF(ISNA(RC[-1])=1,"",RC[-5]) -> 
B174: Ukraine | C174: UKR | D174: =IF(EQUAL(ComparativeCharts!R[11]C,""),"",1) ->  | O174: 167 | P174: Finland | Q174: FIN | R174: 1.6023136412845629 | S174: 0.25402694431067208 | T174: =1.64*RC[-1] -> 0.41660418866950216 | U174: =IF(EQUAL(VLOOKUP(RC[-4],R9C3:R186C4,2,0),1),RC[-1],NA()) -> NA() | V174: =IF(ISNA(RC[-1])=1,"",RC[-5]) ->  | W174: Equatorial Guinea | X174: GNQ | Y174: .. | Z174: .. | AA174: =1.64*RC[-1] -> #VALUE! | AB174: =IF(EQUAL(VLOOKUP(RC[-4],R9C3:R186C4,2,0),1),RC[-1],NA()) -> NA() | AC174: =IF(ISNA(RC[-1])=1,"",RC[-5]) ->  | AD174: Equatorial Guinea | AE174: GNQ | AF174: .. | AG174: .. | AH174: =1.64*RC[-1] -> #VALUE! | AI174: =IF(EQUAL(VLOOKUP(RC[-4],R9C3:R186C4,2,0),1),RC[-1],NA()) -> NA() | AJ174: =IF(ISNA(RC[-1])=1,"",RC[-5]) ->  | AK174: Afghanistan | AL174: AFG | AM174: .. | AN174: .. | AO174: =1.64*RC[-1] -> #VALUE! | AP174: =IF(EQUAL(VLOOKUP(RC[-4],R9C3:R186C4,2,0),1),RC[-1],NA()) -> #VALUE! | AQ174: =IF(ISNA(RC[-1])=1,"",RC[-5]) -> AFG | AR174: Afghanistan | AS174: AFG | AT174: .. | AU174: .. | AV174: =1.64*RC[-1] -> #VALUE! | AW174: =IF(EQUAL(VLOOKUP(RC[-4],R9C3:R186C4,2,0),1),RC[-1],NA()) -> #VALUE! | AX174: =IF(ISNA(RC[-1])=1,"",RC[-5]) -> AFG | AY174: Equatorial Guinea | AZ174: GNQ | BA174: .. | BB174: .. | BC174: =1.64*RC[-1] -> #VALUE! | BD174: =IF(EQUAL(VLOOKUP(RC[-4],R9C3:R186C4,2,0),1),RC[-1],NA()) -> NA() | BE174: =IF(ISNA(RC[-1])=1,"",RC[-5]) -> 
B175: Uruguay | C175: URY | D175: =IF(EQUAL(ComparativeCharts!R[11]C,""),"",1) ->  | O175: 168 | P175: Netherlands | Q175: NLD | R175: 1.6074606954482535 | S175: 0.25402694431067208 | T175: =1.64*RC[-1] -> 0.41660418866950216 | U175: =IF(EQUAL(VLOOKUP(RC[-4],R9C3:R186C4,2,0),1),RC[-1],NA()) -> 0.41660418866950216 | V175: =IF(ISNA(RC[-1])=1,"",RC[-5]) -> NLD | W175: Cambodia | X175: KHM | Y175: .. | Z175: .. | AA175: =1.64*RC[-1] -> #VALUE! | AB175: =IF(EQUAL(VLOOKUP(RC[-4],R9C3:R186C4,2,0),1),RC[-1],NA()) -> NA() | AC175: =IF(ISNA(RC[-1])=1,"",RC[-5]) ->  | AD175: Cambodia | AE175: KHM | AF175: .. | AG175: .. | AH175: =1.64*RC[-1] -> #VALUE! | AI175: =IF(EQUAL(VLOOKUP(RC[-4],R9C3:R186C4,2,0),1),RC[-1],NA()) -> NA() | AJ175: =IF(ISNA(RC[-1])=1,"",RC[-5]) ->  | AK175: Bhutan | AL175: BTN | AM175: .. | AN175: .. | AO175: =1.64*RC[-1] -> #VALUE! | AP175: =IF(EQUAL(VLOOKUP(RC[-4],R9C3:R186C4,2,0),1),RC[-1],NA()) -> NA() | AQ175: =IF(ISNA(RC[-1])=1,"",RC[-5]) ->  | AR175: Bhutan | AS175: BTN | AT175: .. | AU175: .. | AV175: =1.64*RC[-1] -> #VALUE! | AW175: =IF(EQUAL(VLOOKUP(RC[-4],R9C3:R186C4,2,0),1),RC[-1],NA()) -> NA() | AX175: =IF(ISNA(RC[-1])=1,"",RC[-5]) ->  | AY175: Cambodia | AZ175: KHM | BA175: .. | BB175: .. | BC175: =1.64*RC[-1] -> #VALUE! | BD175: =IF(EQUAL(VLOOKUP(RC[-4],R9C3:R186C4,2,0),1),RC[-1],NA()) -> NA() | BE175: =IF(ISNA(RC[-1])=1,"",RC[-5]) -> 
B176: United States | C176: USA | D176: =IF(EQUAL(ComparativeCharts!R[11]C,""),"",1) ->  | O176: 169 | P176: Australia | Q176: AUS | R176: 1.6280489151912487 | S176: 0.25402694431067208 | T176: =1.64*RC[-1] -> 0.41660418866950216 | U176: =IF(EQUAL(VLOOKUP(RC[-4],R9C3:R186C4,2,0),1),RC[-1],NA()) -> NA() | V176: =IF(ISNA(RC[-1])=1,"",RC[-5]) ->  | W176: Lao, PDR | X176: LAO | Y176: .. | Z176: .. | AA176: =1.64*RC[-1] -> #VALUE! | AB176: =IF(EQUAL(VLOOKUP(RC[-4],R9C3:R186C4,2,0),1),RC[-1],NA()) -> NA() | AC176: =IF(ISNA(RC[-1])=1,"",RC[-5]) ->  | AD176: Lao, PDR | AE176: LAO | AF176: .. | AG176: .. | AH176: =1.64*RC[-1] -> #VALUE! | AI176: =IF(EQUAL(VLOOKUP(RC[-4],R9C3:R186C4,2,0),1),RC[-1],NA()) -> NA() | AJ176: =IF(ISNA(RC[-1])=1,"",RC[-5]) ->  | AK176: Central African Republic | AL176: CAF | AM176: .. | AN176: .. | AO176: =1.64*RC[-1] -> #VALUE! | AP176: =IF(EQUAL(VLOOKUP(RC[-4],R9C3:R186C4,2,0),1),RC[-1],NA()) -> NA() | AQ176: =IF(ISNA(RC[-1])=1,"",RC[-5]) ->  | AR176: Central African Republic | AS176: CAF | AT176: .. | AU176: .. | AV176: =1.64*RC[-1] -> #VALUE! | AW176: =IF(EQUAL(VLOOKUP(RC[-4],R9C3:R186C4,2,0),1),RC[-1],NA()) -> NA() | AX176: =IF(ISNA(RC[-1])=1,"",RC[-5]) ->  | AY176: Lao, PDR | AZ176: LAO | BA176: .. | BB176: .. | BC176: =1.64*RC[-1] -> #VALUE! | BD176: =IF(EQUAL(VLOOKUP(RC[-4],R9C3:R186C4,2,0),1),RC[-1],NA()) -> NA() | BE176: =IF(ISNA(RC[-1])=1,"",RC[-5]) -> 
B177: Uzbekistan | C177: UZB | D177: =IF(EQUAL(ComparativeCharts!R[11]C,""),"",1) ->  | O177: 170 | P177: Sweden | Q177: SWE | R177: 1.6280489151912487 | S177: 0.25402694431067208 | T177: =1.64*RC[-1] -> 0.41660418866950216 | U177: =IF(EQUAL(VLOOKUP(RC[-4],R9C3:R186C4,2,0),1),RC[-1],NA()) -> NA() | V177: =IF(ISNA(RC[-1])=1,"",RC[-5]) ->  | W177: Macao, China | X177: MAC | Y177: .. | Z177: .. | AA177: =1.64*RC[-1] -> #VALUE! | AB177: =IF(EQUAL(VLOOKUP(RC[-4],R9C3:R186C4,2,0),1),RC[-1],NA()) -> NA() | AC177: =IF(ISNA(RC[-1])=1,"",RC[-5]) ->  | AD177: Macao, China | AE177: MAC | AF177: .. | AG177: .. | AH177: =1.64*RC[-1] -> #VALUE! | AI177: =IF(EQUAL(VLOOKUP(RC[-4],R9C3:R186C4,2,0),1),RC[-1],NA()) -> NA() | AJ177: =IF(ISNA(RC[-1])=1,"",RC[-5]) ->  | AK177: Comoros | AL177: COM | AM177: .. | AN177: .. | AO177: =1.64*RC[-1] -> #VALUE! | AP177: =IF(EQUAL(VLOOKUP(RC[-4],R9C3:R186C4,2,0),1),RC[-1],NA()) -> NA() | AQ177: =IF(ISNA(RC[-1])=1,"",RC[-5]) ->  | AR177: Comoros | AS177: COM | AT177: .. | AU177: .. | AV177: =1.64*RC[-1] -> #VALUE! | AW177: =IF(EQUAL(VLOOKUP(RC[-4],R9C3:R186C4,2,0),1),RC[-1],NA()) -> NA() | AX177: =IF(ISNA(RC[-1])=1,"",RC[-5]) ->  | AY177: Macao, China | AZ177: MAC | BA177: .. | BB177: .. | BC177: =1.64*RC[-1] -> #VALUE! | BD177: =IF(EQUAL(VLOOKUP(RC[-4],R9C3:R186C4,2,0),1),RC[-1],NA()) -> NA() | BE177: =IF(ISNA(RC[-1])=1,"",RC[-5]) -> 
B178: Venezuela, RB | C178: VEN | D178: =IF(EQUAL(ComparativeCharts!R[11]C,""),"",1) ->  | O178: 171 | P178: Denmark | Q178: DNK | R178: 1.6331959693549392 | S178: 0.25402694431067208 | T178: =1.64*RC[-1] -> 0.41660418866950216 | U178: =IF(EQUAL(VLOOKUP(RC[-4],R9C3:R186C4,2,0),1),RC[-1],NA()) -> NA() | V178: =IF(ISNA(RC[-1])=1,"",RC[-5]) ->  | W178: Maldives | X178: MDV | Y178: .. | Z178: .. | AA178: =1.64*RC[-1] -> #VALUE! | AB178: =IF(EQUAL(VLOOKUP(RC[-4],R9C3:R186C4,2,0),1),RC[-1],NA()) -> NA() | AC178: =IF(ISNA(RC[-1])=1,"",RC[-5]) ->  | AD178: Maldives | AE178: MDV | AF178: .. | AG178: .. | AH178: =1.64*RC[-1] -> #VALUE! | AI178: =IF(EQUAL(VLOOKUP(RC[-4],R9C3:R186C4,2,0),1),RC[-1],NA()) -> NA() | AJ178: =IF(ISNA(RC[-1])=1,"",RC[-5]) ->  | AK178: Eritrea | AL178: ERI | AM178: .. | AN178: .. | AO178: =1.64*RC[-1] -> #VALUE! | AP178: =IF(EQUAL(VLOOKUP(RC[-4],R9C3:R186C4,2,0),1),RC[-1],NA()) -> NA() | AQ178: =IF(ISNA(RC[-1])=1,"",RC[-5]) ->  | AR178: Eritrea | AS178: ERI | AT178: .. | AU178: .. | AV178: =1.64*RC[-1] -> #VALUE! | AW178: =IF(EQUAL(VLOOKUP(RC[-4],R9C3:R186C4,2,0),1),RC[-1],NA()) -> NA() | AX178: =IF(ISNA(RC[-1])=1,"",RC[-5]) ->  | AY178: Maldives | AZ178: MDV | BA178: .. | BB178: .. | BC178: =1.64*RC[-1] -> #VALUE! | BD178: =IF(EQUAL(VLOOKUP(RC[-4],R9C3:R186C4,2,0),1),RC[-1],NA()) -> NA() | BE178: =IF(ISNA(RC[-1])=1,"",RC[-5]) -> 
B179: Vietnam | C179: VNM | D179: =IF(EQUAL(ComparativeCharts!R[11]C,""),"",1) ->  | O179: 172 | P179: Norway | Q179: NOR | R179: 1.653784187553818 | S179: 0.25402694431067208 | T179: =1.64*RC[-1] -> 0.41660418866950216 | U179: =IF(EQUAL(VLOOKUP(RC[-4],R9C3:R186C4,2,0),1),RC[-1],NA()) -> NA() | V179: =IF(ISNA(RC[-1])=1,"",RC[-5]) ->  | W179: Mauritania | X179: MRT | Y179: .. | Z179: .. | AA179: =1.64*RC[-1] -> #VALUE! | AB179: =IF(EQUAL(VLOOKUP(RC[-4],R9C3:R186C4,2,0),1),RC[-1],NA()) -> NA() | AC179: =IF(ISNA(RC[-1])=1,"",RC[-5]) ->  | AD179: Mauritania | AE179: MRT | AF179: .. | AG179: .. | AH179: =1.64*RC[-1] -> #VALUE! | AI179: =IF(EQUAL(VLOOKUP(RC[-4],R9C3:R186C4,2,0),1),RC[-1],NA()) -> NA() | AJ179: =IF(ISNA(RC[-1])=1,"",RC[-5]) ->  | AK179: Guadeloupe | AL179: GLP | AM179: .. | AN179: .. | AO179: =1.64*RC[-1] -> #VALUE! | AP179: =IF(EQUAL(VLOOKUP(RC[-4],R9C3:R186C4,2,0),1),RC[-1],NA()) -> NA() | AQ179: =IF(ISNA(RC[-1])=1,"",RC[-5]) ->  | AR179: Guadeloupe | AS179: GLP | AT179: .. | AU179: .. | AV179: =1.64*RC[-1] -> #VALUE! | AW179: =IF(EQUAL(VLOOKUP(RC[-4],R9C3:R186C4,2,0),1),RC[-1],NA()) -> NA() | AX179: =IF(ISNA(RC[-1])=1,"",RC[-5]) ->  | AY179: Mauritania | AZ179: MRT | BA179: .. | BB179: .. | BC179: =1.64*RC[-1] -> #VALUE! | BD179: =IF(EQUAL(VLOOKUP(RC[-4],R9C3:R186C4,2,0),1),RC[-1],NA()) -> NA() | BE179: =IF(ISNA(RC[-1])=1,"",RC[-5]) -> 
B180: West Bank and Gaza | C180: WTB | D180: =IF(EQUAL(ComparativeCharts!R[11]C,""),"",1) ->  | O180: 173 | P180: Switzerland | Q180: CHE | R180: 1.6936358930138635 | S180: 0.25130023322348893 | T180: =1.64*RC[-1] -> 0.41213238248652184 | U180: =IF(EQUAL(VLOOKUP(RC[-4],R9C3:R186C4,2,0),1),RC[-1],NA()) -> NA() | V180: =IF(ISNA(RC[-1])=1,"",RC[-5]) ->  | W180: Martinique | X180: MTQ | Y180: .. | Z180: .. | AA180: =1.64*RC[-1] -> #VALUE! | AB180: =IF(EQUAL(VLOOKUP(RC[-4],R9C3:R186C4,2,0),1),RC[-1],NA()) -> NA() | AC180: =IF(ISNA(RC[-1])=1,"",RC[-5]) ->  | AD180: Martinique | AE180: MTQ | AF180: .. | AG180: .. | AH180: =1.64*RC[-1] -> #VALUE! | AI180: =IF(EQUAL(VLOOKUP(RC[-4],R9C3:R186C4,2,0),1),RC[-1],NA()) -> NA() | AJ180: =IF(ISNA(RC[-1])=1,"",RC[-5]) ->  | AK180: Macao, China | AL180: MAC | AM180: .. | AN180: .. | AO180: =1.64*RC[-1] -> #VALUE! | AP180: =IF(EQUAL(VLOOKUP(RC[-4],R9C3:R186C4,2,0),1),RC[-1],NA()) -> NA() | AQ180: =IF(ISNA(RC[-1])=1,"",RC[-5]) ->  | AR180: Macao, China | AS180: MAC | AT180: .. | AU180: .. | AV180: =1.64*RC[-1] -> #VALUE! | AW180: =IF(EQUAL(VLOOKUP(RC[-4],R9C3:R186C4,2,0),1),RC[-1],NA()) -> NA() | AX180: =IF(ISNA(RC[-1])=1,"",RC[-5]) ->  | AY180: Martinique | AZ180: MTQ | BA180: .. | BB180: .. | BC180: =1.64*RC[-1] -> #VALUE! | BD180: =IF(EQUAL(VLOOKUP(RC[-4],R9C3:R186C4,2,0),1),RC[-1],NA()) -> NA() | BE180: =IF(ISNA(RC[-1])=1,"",RC[-5]) -> 
B181: Yemen, Rep. | C181: YEM | D181: =IF(EQUAL(ComparativeCharts!R[11]C,""),"",1) ->  | O181: 174 | P181: Guadeloupe | Q181: GLP | R181: .. | S181: .. | T181: =1.64*RC[-1] -> #VALUE! | U181: =IF(EQUAL(VLOOKUP(RC[-4],R9C3:R186C4,2,0),1),RC[-1],NA()) -> NA() | V181: =IF(ISNA(RC[-1])=1,"",RC[-5]) ->  | W181: Nepal | X181: NPL | Y181: .. | Z181: .. | AA181: =1.64*RC[-1] -> #VALUE! | AB181: =IF(EQUAL(VLOOKUP(RC[-4],R9C3:R186C4,2,0),1),RC[-1],NA()) -> NA() | AC181: =IF(ISNA(RC[-1])=1,"",RC[-5]) ->  | AD181: Nepal | AE181: NPL | AF181: .. | AG181: .. | AH181: =1.64*RC[-1] -> #VALUE! | AI181: =IF(EQUAL(VLOOKUP(RC[-4],R9C3:R186C4,2,0),1),RC[-1],NA()) -> NA() | AJ181: =IF(ISNA(RC[-1])=1,"",RC[-5]) ->  | AK181: Maldives | AL181: MDV | AM181: .. | AN181: .. | AO181: =1.64*RC[-1] -> #VALUE! | AP181: =IF(EQUAL(VLOOKUP(RC[-4],R9C3:R186C4,2,0),1),RC[-1],NA()) -> NA() | AQ181: =IF(ISNA(RC[-1])=1,"",RC[-5]) ->  | AR181: Maldives | AS181: MDV | AT181: .. | AU181: .. | AV181: =1.64*RC[-1] -> #VALUE! | AW181: =IF(EQUAL(VLOOKUP(RC[-4],R9C3:R186C4,2,0),1),RC[-1],NA()) -> NA() | AX181: =IF(ISNA(RC[-1])=1,"",RC[-5]) ->  | AY181: Nepal | AZ181: NPL | BA181: .. | BB181: .. | BC181: =1.64*RC[-1] -> #VALUE! | BD181: =IF(EQUAL(VLOOKUP(RC[-4],R9C3:R186C4,2,0),1),RC[-1],NA()) -> NA() | BE181: =IF(ISNA(RC[-1])=1,"",RC[-5]) -> 
B182: Yugoslavia, FR (Serbia/Montenegro) | C182: YUG | D182: =IF(EQUAL(ComparativeCharts!R[11]C,""),"",1) ->  | O182: 175 | P182: Macao, China | Q182: MAC | R182: .. | S182: .. | T182: =1.64*RC[-1] -> #VALUE! | U182: =IF(EQUAL(VLOOKUP(RC[-4],R9C3:R186C4,2,0),1),RC[-1],NA()) -> NA() | V182: =IF(ISNA(RC[-1])=1,"",RC[-5]) ->  | W182: Reunion | X182: REU | Y182: .. | Z182: .. | AA182: =1.64*RC[-1] -> #VALUE! | AB182: =IF(EQUAL(VLOOKUP(RC[-4],R9C3:R186C4,2,0),1),RC[-1],NA()) -> NA() | AC182: =IF(ISNA(RC[-1])=1,"",RC[-5]) ->  | AD182: Reunion | AE182: REU | AF182: .. | AG182: .. | AH182: =1.64*RC[-1] -> #VALUE! | AI182: =IF(EQUAL(VLOOKUP(RC[-4],R9C3:R186C4,2,0),1),RC[-1],NA()) -> NA() | AJ182: =IF(ISNA(RC[-1])=1,"",RC[-5]) ->  | AK182: Martinique | AL182: MTQ | AM182: .. | AN182: .. | AO182: =1.64*RC[-1] -> #VALUE! | AP182: =IF(EQUAL(VLOOKUP(RC[-4],R9C3:R186C4,2,0),1),RC[-1],NA()) -> NA() | AQ182: =IF(ISNA(RC[-1])=1,"",RC[-5]) ->  | AR182: Martinique | AS182: MTQ | AT182: .. | AU182: .. | AV182: =1.64*RC[-1] -> #VALUE! | AW182: =IF(EQUAL(VLOOKUP(RC[-4],R9C3:R186C4,2,0),1),RC[-1],NA()) -> NA() | AX182: =IF(ISNA(RC[-1])=1,"",RC[-5]) ->  | AY182: Reunion | AZ182: REU | BA182: .. | BB182: .. | BC182: =1.64*RC[-1] -> #VALUE! | BD182: =IF(EQUAL(VLOOKUP(RC[-4],R9C3:R186C4,2,0),1),RC[-1],NA()) -> NA() | BE182: =IF(ISNA(RC[-1])=1,"",RC[-5]) -> 
B183: South Africa | C183: ZAF | D183: =IF(EQUAL(ComparativeCharts!R[11]C,""),"",1) ->  | O183: 176 | P183: Martinique | Q183: MTQ | R183: .. | S183: .. | T183: =1.64*RC[-1] -> #VALUE! | U183: =IF(EQUAL(VLOOKUP(RC[-4],R9C3:R186C4,2,0),1),RC[-1],NA()) -> NA() | V183: =IF(ISNA(RC[-1])=1,"",RC[-5]) ->  | W183: Rwanda | X183: RWA | Y183: .. | Z183: .. | AA183: =1.64*RC[-1] -> #VALUE! | AB183: =IF(EQUAL(VLOOKUP(RC[-4],R9C3:R186C4,2,0),1),RC[-1],NA()) -> NA() | AC183: =IF(ISNA(RC[-1])=1,"",RC[-5]) ->  | AD183: Rwanda | AE183: RWA | AF183: .. | AG183: .. | AH183: =1.64*RC[-1] -> #VALUE! | AI183: =IF(EQUAL(VLOOKUP(RC[-4],R9C3:R186C4,2,0),1),RC[-1],NA()) -> NA() | AJ183: =IF(ISNA(RC[-1])=1,"",RC[-5]) ->  | AK183: Reunion | AL183: REU | AM183: .. | AN183: .. | AO183: =1.64*RC[-1] -> #VALUE! | AP183: =IF(EQUAL(VLOOKUP(RC[-4],R9C3:R186C4,2,0),1),RC[-1],NA()) -> NA() | AQ183: =IF(ISNA(RC[-1])=1,"",RC[-5]) ->  | AR183: Reunion | AS183: REU | AT183: .. | AU183: .. | AV183: =1.64*RC[-1] -> #VALUE! | AW183: =IF(EQUAL(VLOOKUP(RC[-4],R9C3:R186C4,2,0),1),RC[-1],NA()) -> NA() | AX183: =IF(ISNA(RC[-1])=1,"",RC[-5]) ->  | AY183: Rwanda | AZ183: RWA | BA183: .. | BB183: .. | BC183: =1.64*RC[-1] -> #VALUE! | BD183: =IF(EQUAL(VLOOKUP(RC[-4],R9C3:R186C4,2,0),1),RC[-1],NA()) -> NA() | BE183: =IF(ISNA(RC[-1])=1,"",RC[-5]) -> 
B184: Congo, Dem. Rep. | C184: ZAR | D184: =IF(EQUAL(ComparativeCharts!R[11]C,""),"",1) ->  | O184: 177 | P184: Puerto Rico | Q184: PRI | R184: .. | S184: .. | T184: =1.64*RC[-1] -> #VALUE! | U184: =IF(EQUAL(VLOOKUP(RC[-4],R9C3:R186C4,2,0),1),RC[-1],NA()) -> NA() | V184: =IF(ISNA(RC[-1])=1,"",RC[-5]) ->  | W184: Solomon Islands | X184: SLB | Y184: .. | Z184: .. | AA184: =1.64*RC[-1] -> #VALUE! | AB184: =IF(EQUAL(VLOOKUP(RC[-4],R9C3:R186C4,2,0),1),RC[-1],NA()) -> NA() | AC184: =IF(ISNA(RC[-1])=1,"",RC[-5]) ->  | AD184: Solomon Islands | AE184: SLB | AF184: .. | AG184: .. | AH184: =1.64*RC[-1] -> #VALUE! | AI184: =IF(EQUAL(VLOOKUP(RC[-4],R9C3:R186C4,2,0),1),RC[-1],NA()) -> NA() | AJ184: =IF(ISNA(RC[-1])=1,"",RC[-5]) ->  | AK184: Solomon Islands | AL184: SLB | AM184: .. | AN184: .. | AO184: =1.64*RC[-1] -> #VALUE! | AP184: =IF(EQUAL(VLOOKUP(RC[-4],R9C3:R186C4,2,0),1),RC[-1],NA()) -> NA() | AQ184: =IF(ISNA(RC[-1])=1,"",RC[-5]) ->  | AR184: Solomon Islands | AS184: SLB | AT184: .. | AU184: .. | AV184: =1.64*RC[-1] -> #VALUE! | AW184: =IF(EQUAL(VLOOKUP(RC[-4],R9C3:R186C4,2,0),1),RC[-1],NA()) -> NA() | AX184: =IF(ISNA(RC[-1])=1,"",RC[-5]) ->  | AY184: Solomon Islands | AZ184: SLB | BA184: .. | BB184: .. | BC184: =1.64*RC[-1] -> #VALUE! | BD184: =IF(EQUAL(VLOOKUP(RC[-4],R9C3:R186C4,2,0),1),RC[-1],NA()) -> NA() | BE184: =IF(ISNA(RC[-1])=1,"",RC[-5]) -> 
B185: Zambia | C185: ZMB | D185: =IF(EQUAL(ComparativeCharts!R[11]C,""),"",1) ->  | O185: 178 | P185: Reunion | Q185: REU | R185: .. | S185: .. | T185: =1.64*RC[-1] -> #VALUE! | U185: =IF(EQUAL(VLOOKUP(RC[-4],R9C3:R186C4,2,0),1),RC[-1],NA()) -> NA() | V185: =IF(ISNA(RC[-1])=1,"",RC[-5]) ->  | W185: Sao Tome and Principe and Pr | X185: STP | Y185: .. | Z185: .. | AA185: =1.64*RC[-1] -> #VALUE! | AB185: =IF(EQUAL(VLOOKUP(RC[-4],R9C3:R186C4,2,0),1),RC[-1],NA()) -> NA() | AC185: =IF(ISNA(RC[-1])=1,"",RC[-5]) ->  | AD185: Sao Tome and Principe and Pr | AE185: STP | AF185: .. | AG185: .. | AH185: =1.64*RC[-1] -> #VALUE! | AI185: =IF(EQUAL(VLOOKUP(RC[-4],R9C3:R186C4,2,0),1),RC[-1],NA()) -> NA() | AJ185: =IF(ISNA(RC[-1])=1,"",RC[-5]) ->  | AK185: Sao Tome and Principe and Pr | AL185: STP | AM185: .. | AN185: .. | AO185: =1.64*RC[-1] -> #VALUE! | AP185: =IF(EQUAL(VLOOKUP(RC[-4],R9C3:R186C4,2,0),1),RC[-1],NA()) -> NA() | AQ185: =IF(ISNA(RC[-1])=1,"",RC[-5]) ->  | AR185: Sao Tome and Principe and Pr | AS185: STP | AT185: .. | AU185: .. | AV185: =1.64*RC[-1] -> #VALUE! | AW185: =IF(EQUAL(VLOOKUP(RC[-4],R9C3:R186C4,2,0),1),RC[-1],NA()) -> NA() | AX185: =IF(ISNA(RC[-1])=1,"",RC[-5]) ->  | AY185: Sao Tome and Principe and Pr | AZ185: STP | BA185: .. | BB185: .. | BC185: =1.64*RC[-1] -> #VALUE! | BD185: =IF(EQUAL(VLOOKUP(RC[-4],R9C3:R186C4,2,0),1),RC[-1],NA()) -> NA() | BE185: =IF(ISNA(RC[-1])=1,"",RC[-5]) -> 
B186: Zimbabwe | C186: ZWE | D186: =IF(EQUAL(ComparativeCharts!R[11]C,""),"",1) -> 

Sheet: @SDF
A1: =DEFINE("VLOOKUP_PICKER", RC[+1], RC[+2], RC[+3], RC[+4]) -> FUN VLOOKUP_PICKER AT #0 | B1: =IF(EQUAL(RC[+1], RC[+2]), RC[+3], "VLOOKUP_MARKER") -> #EMPTY!
A2: =DEFINE("VLOOKUP_REPLACER", RC[+1], RC[+2], RC[+3]) -> FUN VLOOKUP_REPLACER AT #1 | B2: =IF(EQUAL(RC[+1], "VLOOKUP_MARKER"), RC[+2], RC[+1]) -> #EMPTY!
A3: =DEFINE("VLOOKUP", RC[+1], RC[+2], RC[+3], RC[+4], RC[+5]) -> FUN VLOOKUP AT #2 | B3: =IF(EQUAL(RC[+5], "VLOOKUP_MARKER"), NA(), RC[+5]) -> #EMPTY! | G3: =REDUCE(CLOSURE("VLOOKUP_REPLACER"), "VLOOKUP_MARKER", ROWMAP(CLOSURE("VLOOKUP_PICKER", RC[-4], NA(), NA()), HCAT(SLICE(RC[-3], 1, 1, ROWS(RC[-3]), 1), SLICE(RC[-3], 1, RC[-2], ROWS(RC[-3]), RC[-2])))) -> #EMPTY!