Sheet: OneCountryCharts
A1: ''''''''Dataset from: "Aggregating Governance Indicators" and "Governance Matters" Daniel Kaufmann, Aart Kraay and Pablo Zoido-Lobaton, May 2000
A5: 'Note: For quick reference, use the commands below. For more detailed usage, please read the "Documentation" sheet first.
A7: 'If you want to see how a particular country ranks in terms of governance indicators&
A8: 'Enter the country name in the green box below:
D9: 'Denmark
C11: 'The country you chose is: | F11: =IF(EQUAL(R[-2]C[-2], ""), "", IF(EQUAL(VLOOKUP(R[-2]C[-2], OneCountryData!R[-6]C[+7]:R[+176]C[+8], 2), 1), VLOOKUP(VLOOKUP(R[-2]C[-2], OneCountryData!R[-6]C[+7]:R[+176]C[+9], 3), OneCountryData!R[-6]C[+6]:R[+176]C[+7], 2), "")) -> Denmark
E15: '
C17: 'The country you chose is: | F17: =IF(EQUAL(R[-2]C[-1], ""), "", VLOOKUP(R[-2]C[-1], OneCountryData!R[-12]C[+6]:R[+170]C[+7], 2)) -> 
B19: 'You can see the results in the next two sheets: "Bar Chart" and "Diamond Chart." Both charts answer the same question: in percentage terms, how many countries rank WORSE than the country you chose on each of the 6 indicators. Thus, a higher number is better, because it means more countries in the world rank worse rather than better than the country of your choice. Remember: these results are only estimates, described by the blue bars in the "Bar Chart" and by the thick black line in the "Diamond Chart." The error associated with these estimates (calculated with 90% confidence) is described by the thin red lines in the "Bar Chart" and by the shaded area in the "Diamond Chart" respectively.
C28: 'Important:
C29: 'You can also choose one of the following country groups:
C31: 'Eastern Europe and Former Soviet Union | D31: 'EE/FSU
C32: 'Asia | D32: 'ASI
C33: 'Africa | D33: 'AFR
C34: 'Latin America | D34: 'LAC
C35: 'OECD | D35: 'OECD
C38: 'Quick Reference Tool:
B39: 'Use the left arrow to select the country you are interested in. The code of the country appears under the right hand arrow. Input this code in the orange box above to get the desired charts
E42: 'Country Name | F42: 'Country Code
E43: 'Afghanistan | F43: 'AFG
E44: 'Angola | F44: 'AGO
E45: 'Albania | F45: 'ALB
E46: 'United Arab Emirates | F46: 'ARE
E47: 'Argentina | F47: 'ARG
E48: 'Armenia | F48: 'ARM
E49: 'Australia | F49: 'AUS
E50: 'Austria | F50: 'AUT
E51: 'Azerbaijan | F51: 'AZE
E52: 'Burundi | F52: 'BDI
E53: 'Belgium | F53: 'BEL
E54: 'Benin | F54: 'BEN
E55: 'Burkina Faso | F55: 'BFA
E56: 'Bangladesh | F56: 'BGD
E57: 'Bulgaria | F57: 'BGR
E58: 'Bahrain | F58: 'BHR
E59: 'Bahamas, The | F59: 'BHS
E60: 'Bosnia and Herzegovina | F60: 'BIH
E61: 'Belarus | F61: 'BLR
E62: 'Belize | F62: 'BLZ
E63: 'Bolivia | F63: 'BOL
E64: 'Brazil | F64: 'BRA
E65: 'Barbados | F65: 'BRB
E66: 'Brunei | F66: 'BRN
E67: 'Bhutan | F67: 'BTN
E68: 'Botswana | F68: 'BWA
E69: 'Central African Republic | F69: 'CAF
E70: 'Canada | F70: 'CAN
E71: 'Switzerland | F71: 'CHE
E72: 'Chile | F72: 'CHL
E73: 'China | F73: 'CHN
E74: 'Cote d'Ivoire | F74: 'CIV
E75: 'Cameroon | F75: 'CMR
E76: 'Congo, Rep. | F76: 'COG
E77: 'Colombia | F77: 'COL
E78: 'Comoros | F78: 'COM
E79: 'Cape verde | F79: 'CPV
E80: 'Costa Rica | F80: 'CRI
E81: 'Cuba | F81: 'CUB
E82: 'Cyprus | F82: 'CYP
E83: 'Czech Republic | F83: 'CZE
E84: 'Germany | F84: 'DEU
E85: 'Djibouti | F85: 'DJI
E86: 'Denmark | F86: 'DNK
E87: 'Dominican Republic | F87: 'DOM
E88: 'Algeria | F88: 'DZA
E89: 'Ecuador | F89: 'ECU
E90: 'Egypt, Arab Rep. | F90: 'EGY
E91: 'Eritrea | F91: 'ERI
E92: 'Spain | F92: 'ESP
E93: 'Estonia | F93: 'EST
E94: 'Ethiopia | F94: 'ETH
E95: 'Finland | F95: 'FIN
E96: 'Fiji | F96: 'FJI
E97: 'France | F97: 'FRA
E98: 'Gabon | F98: 'GAB
E99: 'United Kingdom | F99: 'GBR
E100: 'Georgia | F100: 'GEO
E101: 'Ghana | F101: 'GHA
E102: 'Guinea | F102: 'GIN
E103: 'Guadeloupe | F103: 'GLP
E104: 'Gambia, The | F104: 'GMB
E105: 'Guinea-Bissau | F105: 'GNB
E106: 'Equatorial Guinea | F106: 'GNQ
E107: 'Greece | F107: 'GRC
E108: 'Guatemala | F108: 'GTM
E109: 'Guyana | F109: 'GUY
E110: 'Hong Kong, China | F110: 'HKG
E111: 'Honduras | F111: 'HND
E112: 'Croatia | F112: 'HRV
E113: 'Haiti | F113: 'HTI
E114: 'Hungary | F114: 'HUN
E115: 'Indonesia | F115: 'IDN
E116: 'India | F116: 'IND
E117: 'Ireland | F117: 'IRL
E118: 'Iran, Islamic Rep. | F118: 'IRN
E119: 'Iraq | F119: 'IRQ
E120: 'Iceland | F120: 'ISL
E121: 'Israel | F121: 'ISR
E122: 'Italy | F122: 'ITA
E123: 'Jamaica | F123: 'JAM
E124: 'Jordan | F124: 'JOR
E125: 'Japan | F125: 'JPN
E126: 'Kazakhstan | F126: 'KAZ
E127: 'Kenya | F127: 'KEN
E128: 'Kyrgyz Republic | F128: 'KGZ
E129: 'Cambodia | F129: 'KHM
E130: 'Korea, Rep. | F130: 'KOR
E131: 'Kuwait | F131: 'KWT
E132: 'Lao, PDR | F132: 'LAO
E133: 'Lebanon | F133: 'LBN
E134: 'Liberia | F134: 'LBR
E135: 'Libya | F135: 'LBY
E136: 'Sri Lanka | F136: 'LKA
E137: 'Lesotho | F137: 'LSO
E138: 'Lithuania | F138: 'LTU
E139: 'Luxembourg | F139: 'LUX
E140: 'Latvia | F140: 'LVA
E141: 'Macao, China | F141: 'MAC
E142: 'Morocco | F142: 'MAR
E143: 'Moldova | F143: 'MDA
E144: 'Madagascar | F144: 'MDG
E145: 'Maldives | F145: 'MDV
E146: 'Mexico | F146: 'MEX
E147: 'Macedonia, FYR | F147: 'MKD
E148: 'Mali | F148: 'MLI
E149: 'Malta | F149: 'MLT
E150: 'Myanmar | F150: 'MMR
E151: 'Mongolia | F151: 'MNG
E152: 'Mozambique | F152: 'MOZ
E153: 'Mauritania | F153: 'MRT
E154: 'Martinique | F154: 'MTQ
E155: 'Mauritius | F155: 'MUS
E156: 'Malawi | F156: 'MWI
E157: 'Malaysia | F157: 'MYS
E158: 'Namibia | F158: 'NAM
E159: 'Niger | F159: 'NER
E160: 'Nigeria | F160: 'NGA
E161: 'Nicaragua | F161: 'NIC
E162: 'Netherlands | F162: 'NLD
E163: 'Norway | F163: 'NOR
E164: 'Nepal | F164: 'NPL
E165: 'New Zealand | F165: 'NZL
E166: 'Oman | F166: 'OMN
E167: 'Pakistan | F167: 'PAK
E168: 'Panama | F168: 'PAN
E169: 'Peru | F169: 'PER
E170: 'Philippines | F170: 'PHL
E171: 'Papua New Guinea | F171: 'PNG
E172: 'Poland | F172: 'POL
E173: 'Puerto Rico | F173: 'PRI
E174: 'Korea, Dem. Rep. | F174: 'PRK
E175: 'Portugal | F175: 'PRT
E176: 'Paraguay | F176: 'PRY
E177: 'Qatar | F177: 'QAT
E178: 'Reunion | F178: 'REU
E179: 'Romania | F179: 'ROM
E180: 'Russian Federation | F180: 'RUS
E181: 'Rwanda | F181: 'RWA
E182: 'Saudi Arabia | F182: 'SAU
E183: 'Sudan | F183: 'SDN
E184: 'Senegal | F184: 'SEN
E185: 'Singapore | F185: 'SGP
E186: 'Solomon Islands | F186: 'SLB
E187: 'Sierra Leone | F187: 'SLE
E188: 'El Salvador | F188: 'SLV
E189: 'Somalia | F189: 'SOM
E190: 'Sao Tome and Principe and Pr | F190: 'STP
E191: 'Suriname | F191: 'SUR
E192: 'Slovak Republic | F192: 'SVK
E193: 'Slovenia | F193: 'SVN
E194: 'Sweden | F194: 'SWE
E195: 'Swaziland | F195: 'SWZ
E196: 'Syrian Arab Republic | F196: 'SYR
E197: 'Chad | F197: 'TCD
E198: 'Togo | F198: 'TGO
E199: 'Thailand | F199: 'THA
E200: 'Tajikistan | F200: 'TJK
E201: 'Turkmenistan | F201: 'TKM
E202: 'Trinidad and Tobago& Tob* | F202: 'TTO
E203: 'Tunisia | F203: 'TUN
E204: 'Turkey | F204: 'TUR
E205: 'Taiwan, China | F205: 'TWN
E206: 'Tanzania | F206: 'TZA
E207: 'Uganda | F207: 'UGA
E208: 'Ukraine | F208: 'UKR
E209: 'Uruguay | F209: 'URY
E210: 'United States | F210: 'USA
E211: 'Uzbekistan | F211: 'UZB
E212: 'Venezuela, RB | F212: 'VEN
E213: 'Vietnam | F213: 'VNM
E214: 'West Bank and Gaza | F214: 'WTB
E215: 'Yemen, Rep. | F215: 'YEM
E216: 'Yugoslavia, FR (Serbia/Montenegro) | F216: 'YUG
E217: 'South Africa | F217: 'ZAF
E218: 'Congo, Dem. Rep. | F218: 'ZAR
E219: 'Zambia | F219: 'ZMB
E220: 'Zimbabwe | F220: 'ZWE
E221: 'Eastern Europe and Formaer Soviet Union | F221: 'EE/FSU
E222: 'Asia | F222: 'ASI
E223: 'Africa | F223: 'AFR
E224: 'Latin America | F224: 'LAC
E225: 'OECD | F225: 'OECD

Sheet: ComparativeCharts
A1: ''''''''Dataset from: "Aggregating Governance Indicators" and "Governance Matters" Daniel Kaufmann, Aart Kraay and Pablo Zoido-Lobaton, May 2000
A5: 'Note: For quick reference, use the commands below. For more detailed usage, please read the "Documentation" sheet first.
A7: 'If you want to see how a group of countries rank comparatively in terms of governance indicators&
A8: 'Enter a "1" in the red column on the left of the country code for each of the countries you are interested in:
B10: 'You can see the results in the next 6 sheets: "VA" (Voice and Accountability), "PIV" (Political Instability and Violence"), "GE" (Government Effectiveness), "RB" (Regulatory Burden"), "RL" (Rule of Law) and "GR" (Graft). Each chart presents the estimated value of the indicator for all the countries in the database, with the countries of your choice being highlited. The error associated with these estimates (calculated with 90% confidence) is described by the thin lines that accompany each estimation point.
B19: 'Country Name | C19: 'Country Code | D19: 'Choose Country Here
B20: 'Afghanistan | C20: 'AFG | D20: 1
B21: 'Angola | C21: 'AGO | D21: '
B22: 'Albania | C22: 'ALB | D22: '
B23: 'United Arab Emirates | C23: 'ARE | D23: '
B24: 'Argentina | C24: 'ARG | D24: '
B25: 'Armenia | C25: 'ARM | D25: '
B26: 'Australia | C26: 'AUS | D26: '
B27: 'Austria | C27: 'AUT | D27: '
B28: 'Azerbaijan | C28: 'AZE | D28: '
B29: 'Burundi | C29: 'BDI | D29: '
B30: 'Belgium | C30: 'BEL | D30: '
B31: 'Benin | C31: 'BEN | D31: '
B32: 'Burkina Faso | C32: 'BFA | D32: '
B33: 'Bangladesh | C33: 'BGD | D33: '
B34: 'Bulgaria | C34: 'BGR | D34: '
B35: 'Bahrain | C35: 'BHR | D35: '
B36: 'Bahamas, The | C36: 'BHS | D36: '
B37: 'Bosnia and Herzegovina | C37: 'BIH | D37: '
B38: 'Belarus | C38: 'BLR | D38: '
B39: 'Belize | C39: 'BLZ | D39: '
B40: 'Bolivia | C40: 'BOL | D40: '
B41: 'Brazil | C41: 'BRA | D41: '
B42: 'Barbados | C42: 'BRB | D42: '
B43: 'Brunei | C43: 'BRN | D43: '
B44: 'Bhutan | C44: 'BTN | D44: '
B45: 'Botswana | C45: 'BWA | D45: 1
B46: 'Central African Republic | C46: 'CAF | D46: '
B47: 'Canada | C47: 'CAN | D47: '
B48: 'Switzerland | C48: 'CHE | D48: '
B49: 'Chile | C49: 'CHL | D49: 1
B50: 'China | C50: 'CHN | D50: '
B51: 'Cote d'Ivoire | C51: 'CIV | D51: '
B52: 'Cameroon | C52: 'CMR | D52: '
B53: 'Congo, Rep. | C53: 'COG | D53: '
B54: 'Colombia | C54: 'COL | D54: '
B55: 'Comoros | C55: 'COM | D55: '
B56: 'Cape verde | C56: 'CPV | D56: '
B57: 'Costa Rica | C57: 'CRI | D57: '
B58: 'Cuba | C58: 'CUB | D58: '
B59: 'Cyprus | C59: 'CYP | D59: '
B60: 'Czech Republic | C60: 'CZE | D60: '
B61: 'Germany | C61: 'DEU | D61: '
B62: 'Djibouti | C62: 'DJI | D62: '
B63: 'Denmark | C63: 'DNK | D63: '
B64: 'Dominican Republic | C64: 'DOM | D64: '
B65: 'Algeria | C65: 'DZA | D65: '
B66: 'Ecuador | C66: 'ECU | D66: '
B67: 'Egypt, Arab Rep. | C67: 'EGY | D67: '
B68: 'Eritrea | C68: 'ERI | D68: '
B69: 'Spain | C69: 'ESP | D69: '
B70: 'Estonia | C70: 'EST | D70: '
B71: 'Ethiopia | C71: 'ETH | D71: '
B72: 'Finland | C72: 'FIN | D72: '
B73: 'Fiji | C73: 'FJI | D73: '
B74: 'France | C74: 'FRA | D74: '
B75: 'Gabon | C75: 'GAB | D75: '
B76: 'United Kingdom | C76: 'GBR | D76: '
B77: 'Georgia | C77: 'GEO | D77: '
B78: 'Ghana | C78: 'GHA | D78: '
B79: 'Guinea | C79: 'GIN | D79: '
B80: 'Guadeloupe | C80: 'GLP | D80: '
B81: 'Gambia, The | C81: 'GMB | D81: '
B82: 'Guinea-Bissau | C82: 'GNB | D82: '
B83: 'Equatorial Guinea | C83: 'GNQ | D83: '
B84: 'Greece | C84: 'GRC | D84: '
B85: 'Guatemala | C85: 'GTM | D85: '
B86: 'Guyana | C86: 'GUY | D86: '
B87: 'Hong Kong, China | C87: 'HKG | D87: '
B88: 'Honduras | C88: 'HND | D88: '
B89: 'Croatia | C89: 'HRV | D89: '
B90: 'Haiti | C90: 'HTI | D90: '
B91: 'Hungary | C91: 'HUN | D91: '
B92: 'Indonesia | C92: 'IDN | D92: 1
B93: 'India | C93: 'IND | D93: '
B94: 'Ireland | C94: 'IRL | D94: '
B95: 'Iran, Islamic Rep. | C95: 'IRN | D95: '
B96: 'Iraq | C96: 'IRQ | D96: 1
B97: 'Iceland | C97: 'ISL | D97: '
B98: 'Israel | C98: 'ISR | D98: '
B99: 'Italy | C99: 'ITA | D99: '
B100: 'Jamaica | C100: 'JAM | D100: 1
B101: 'Jordan | C101: 'JOR | D101: '
B102: 'Japan | C102: 'JPN | D102: '
B103: 'Kazakhstan | C103: 'KAZ | D103: '
B104: 'Kenya | C104: 'KEN | D104: '
B105: 'Kyrgyz Republic | C105: 'KGZ | D105: '
B106: 'Cambodia | C106: 'KHM | D106: '
B107: 'Korea, Rep. | C107: 'KOR | D107: '
B108: 'Kuwait | C108: 'KWT | D108: '
B109: 'Lao, PDR | C109: 'LAO | D109: '
B110: 'Lebanon | C110: 'LBN | D110: '
B111: 'Liberia | C111: 'LBR | D111: '
B112: 'Libya | C112: 'LBY | D112: 1
B113: 'Sri Lanka | C113: 'LKA | D113: '
B114: 'Lesotho | C114: 'LSO | D114: '
B115: 'Lithuania | C115: 'LTU | D115: '
B116: 'Luxembourg | C116: 'LUX | D116: '
B117: 'Latvia | C117: 'LVA | D117: '
B118: 'Macao, China | C118: 'MAC | D118: '
B119: 'Morocco | C119: 'MAR | D119: '
B120: 'Moldova | C120: 'MDA | D120: '
B121: 'Madagascar | C121: 'MDG | D121: '
B122: 'Maldives | C122: 'MDV | D122: '
B123: 'Mexico | C123: 'MEX | D123: '
B124: 'Macedonia, FYR | C124: 'MKD | D124: '
B125: 'Mali | C125: 'MLI | D125: '
B126: 'Malta | C126: 'MLT | D126: '
B127: 'Myanmar | C127: 'MMR | D127: '
B128: 'Mongolia | C128: 'MNG | D128: 1
B129: 'Mozambique | C129: 'MOZ | D129: '
B130: 'Mauritania | C130: 'MRT | D130: '
B131: 'Martinique | C131: 'MTQ | D131: '
B132: 'Mauritius | C132: 'MUS | D132: '
B133: 'Malawi | C133: 'MWI | D133: '
B134: 'Malaysia | C134: 'MYS | D134: '
B135: 'Namibia | C135: 'NAM | D135: '
B136: 'Niger | C136: 'NER | D136: '
B137: 'Nigeria | C137: 'NGA | D137: '
B138: 'Nicaragua | C138: 'NIC | D138: '
B139: 'Netherlands | C139: 'NLD | D139: 1
B140: 'Norway | C140: 'NOR | D140: '
B141: 'Nepal | C141: 'NPL | D141: '
B142: 'New Zealand | C142: 'NZL | D142: '
B143: 'Oman | C143: 'OMN | D143: '
B144: 'Pakistan | C144: 'PAK | D144: '
B145: 'Panama | C145: 'PAN | D145: '
B146: 'Peru | C146: 'PER | D146: '
B147: 'Philippines | C147: 'PHL | D147: '
B148: 'Papua New Guinea | C148: 'PNG | D148: '
B149: 'Poland | C149: 'POL | D149: '
B150: 'Puerto Rico | C150: 'PRI | D150: '
B151: 'Korea, Dem. Rep. | C151: 'PRK | D151: '
B152: 'Portugal | C152: 'PRT | D152: '
B153: 'Paraguay | C153: 'PRY | D153: '
B154: 'Qatar | C154: 'QAT | D154: '
B155: 'Reunion | C155: 'REU | D155: '
B156: 'Romania | C156: 'ROM | D156: '
B157: 'Russian Federation | C157: 'RUS | D157: '
B158: 'Rwanda | C158: 'RWA | D158: '
B159: 'Saudi Arabia | C159: 'SAU | D159: '
B160: 'Sudan | C160: 'SDN | D160: '
B161: 'Senegal | C161: 'SEN | D161: '
B162: 'Singapore | C162: 'SGP | D162: '
B163: 'Solomon Islands | C163: 'SLB | D163: '
B164: 'Sierra Leone | C164: 'SLE | D164: '
B165: 'El Salvador | C165: 'SLV | D165: '
B166: 'Somalia | C166: 'SOM | D166: '
B167: 'Sao Tome and Principe and Pr | C167: 'STP | D167: '
B168: 'Suriname | C168: 'SUR | D168: '
B169: 'Slovak Republic | C169: 'SVK | D169: '
B170: 'Slovenia | C170: 'SVN | D170: 1
B171: 'Sweden | C171: 'SWE | D171: '
B172: 'Swaziland | C172: 'SWZ | D172: '
B173: 'Syrian Arab Republic | C173: 'SYR | D173: '
B174: 'Chad | C174: 'TCD | D174: '
B175: 'Togo | C175: 'TGO | D175: '
B176: 'Thailand | C176: 'THA | D176: '
B177: 'Tajikistan | C177: 'TJK | D177: '
B178: 'Turkmenistan | C178: 'TKM | D178: '
B179: 'Trinidad and Tobago& Tob* | C179: 'TTO | D179: '
B180: 'Tunisia | C180: 'TUN | D180: 1
B181: 'Turkey | C181: 'TUR | D181: '
B182: 'Taiwan, China | C182: 'TWN | D182: '
B183: 'Tanzania | C183: 'TZA | D183: '
B184: 'Uganda | C184: 'UGA | D184: '
B185: 'Ukraine | C185: 'UKR | D185: '
B186: 'Uruguay | C186: 'URY | D186: '
B187: 'United States | C187: 'USA | D187: '
B188: 'Uzbekistan | C188: 'UZB | D188: '
B189: 'Venezuela, RB | C189: 'VEN | D189: '
B190: 'Vietnam | C190: 'VNM | D190: '
B191: 'West Bank and Gaza | C191: 'WTB | D191: '
B192: 'Yemen, Rep. | C192: 'YEM | D192: '
B193: 'Yugoslavia, FR (Serbia/Montenegro) | C193: 'YUG | D193: '
B194: 'South Africa | C194: 'ZAF | D194: '
B195: 'Congo, Dem. Rep. | C195: 'ZAR | D195: '
B196: 'Zambia | C196: 'ZMB | D196: '
B197: 'Zimbabwe | C197: 'ZWE | D197: '

Sheet: Data
D2: 'Voice and Accountability | G2: 'Political Instability and Violence | J2: 'Government Effectiveness | M2: 'Regulatory Burden | P2: 'Rule of Law | S2: 'Graft
D3: 'Estimate | E3: 'Standard Error | F3: '# Indicators | G3: 'Estimate | H3: 'Standard Error | I3: '# Indicators | J3: 'Estimate | K3: 'Standard Error | L3: '# Indicators | M3: 'Estimate | N3: 'Standard Error | O3: '# Indicators | P3: 'Estimate | Q3: 'Standard Error | R3: '# Indicators | S3: 'Estimate | T3: 'Standard Error | U3: '# Indicators
A5: 1 | B5: 'Afghanistan | C5: 'AFG | D5: -1.6163871673911 | E5: 0.360314615495306 | F5: 1 | G5: 0 | H5: 0 | I5: 0 | J5: 0 | K5: 0 | L5: 0 | M5: 0 | N5: 0 | O5: 0 | P5: 0 | Q5: 0 | R5: 0 | S5: 0 | T5: 0 | U5: 0
A6: 2 | B6: 'Angola | C6: 'AGO | D6: -1.00342705982695 | E6: 0.254026944310672 | F6: 3 | G6: -1.78460359621811 | H6: 0.279058457436991 | I6: 4 | J6: -1.3903388842921 | K6: 0.235337708537315 | L6: 5 | M6: -0.709575461221557 | N6: 0.291778685386365 | O6: 4 | P6: -1.22506644579426 | Q6: 0.272746442471847 | R6: 5 | S6: -0.863030916048755 | T6: 0.223105684616046 | U6: 4
A7: 3 | B7: 'Albania | C7: 'ALB | D7: -0.00774797674908196 | E7: 0.287283341236829 | F7: 4 | G7: -1.00040868778276 | H7: 0.253989014301079 | I7: 4 | J7: -0.653372603337536 | K7: 0.294346198002602 | L7: 4 | M7: -0.69955471858829 | N7: 0.262826647914669 | O7: 5 | P7: -0.917770047297968 | Q7: 0.19625062444278 | R7: 6 | S7: -0.98509305269305 | T7: 0.231874540556914 | U7: 5
A8: 4 | B8: 'United Arab Emirates | C8: 'ARE | D8: -0.544677878751024 | E8: 0.254026944310672 | F8: 3 | G8: 0.824711517408409 | H8: 0.299881889042829 | I8: 3 | J8: 0.138287299963074 | K8: 0.319089592041234 | L8: 3 | M8: 0.296219448489337 | N8: 0.395254221998157 | O8: 3 | P8: 0.767498413405303 | Q8: 0.276349686366578 | R8: 4 | S8: -0.02688673768104 | T8: 0.267063170408295 | U8: 3
A9: 5 | B9: 'Argentina | C9: 'ARG | D9: 0.482088728564539 | E9: 0.254026944310672 | F9: 4 | G9: 0.506835372196173 | H9: 0.263344534520094 | I9: 5 | J9: 0.262044370021487 | K9: 0.248661311888018 | L9: 6 | M9: 0.667524548923092 | N9: 0.2290464009857 | O9: 5 | P9: 0.318942536948538 | Q9: 0.218139839508948 | R9: 7 | S9: -0.274547508176613 | T9: 0.198055085748779 | U9: 7
A10: 6 | B10: 'Armenia | C10: 'ARM | D10: 0.0188279512704479 | E10: 0.287283341236829 | F10: 4 | G10: -0.454578772881033 | H10: 0.253989014301079 | I10: 4 | J10: -0.65466184670494 | K10: 0.294346198002602 | L10: 4 | M10: -0.570317547770276 | N10: 0.262826647914669 | O10: 5 | P10: -0.146269764656218 | Q10: 0.19625062444278 | R10: 6 | S10: -0.803188257541498 | T10: 0.231874540556914 | U10: 5
A11: 7 | B11: 'Australia | C11: 'AUS | D11: 1.62804891519125 | E11: 0.254026944310672 | F11: 4 | G11: 1.18414986439814 | H11: 0.263344534520094 | I11: 5 | J11: 1.4586935841993 | K11: 0.248661311888018 | L11: 6 | M11: 0.961970146857995 | N11: 0.2290464009857 | O11: 5 | P11: 1.59634107197309 | Q11: 0.218139839508948 | R11: 7 | S11: 1.60108375699323 | T11: 0.206276316022536 | U11: 6
A12: 8 | B12: 'Austria | C12: 'AUT | D12: 1.44716600157334 | E12: 0.251300233223489 | F12: 5 | G12: 1.37679944691968 | H12: 0.25228486761248 | I12: 6 | J12: 1.21872508382098 | K12: 0.233636532185851 | L12: 7 | M12: 0.900880836334925 | N12: 0.228760003290238 | O12: 6 | P12: 1.81234227516795 | Q12: 0.207737275615815 | R12: 8 | S12: 1.45710728100782 | T12: 0.189092987537097 | U12: 8
A13: 9 | B13: 'Azerbaijan | C13: 'AZE | D13: -0.919164065846706 | E13: 0.251300233223489 | F13: 5 | G13: -0.363444582419292 | H13: 0.234722074427469 | I13: 5 | J13: -0.833248634828367 | K13: 0.242598933058622 | L13: 5 | M13: -0.99736144864976 | N13: 0.262826647914669 | O13: 5 | P13: -0.563494090342913 | Q13: 0.179548241092202 | R13: 7 | S13: -0.997599695769517 | T13: 0.188243145715436 | U13: 6
A14: 10 | B14: 'Burundi | C14: 'BDI | D14: -1.28846911665556 | E14: 0.360314615495306 | F14: 1 | G14: 0 | H14: 0 | I14: 0 | J14: 0 | K14: 0 | L14: 0 | M14: -0.84581743863525 | N14: 0.601880844424266 | O14: 1 | P14: -0.880736581715861 | Q14: 0.600583865212543 | R14: 1 | S14: 0 | T14: 0 | U14: 0
A15: 11 | B15: 'Belgium | C15: 'BEL | D15: 1.43641939238064 | E15: 0.254026944310672 | F15: 4 | G15: 0.81771470597593 | H15: 0.263344534520094 | I15: 5 | J15: 0.88326173224899 | K15: 0.248661311888018 | L15: 6 | M15: 0.793830724804658 | N15: 0.2290464009857 | O15: 5 | P15: 0.797295226228959 | Q15: 0.218139839508948 | R15: 7 | S15: 0.671693233132954 | T15: 0.198055085748779 | U15: 7
A16: 12 | B16: 'Benin | C16: 'BEN | D16: 0.694610964377189 | E16: 0.352657522321209 | F16: 2 | G16: -0.937410181602584 | H16: 0.660536144392275 | I16: 1 | J16: -0.0664643638834824 | K16: 0.563707566872499 | L16: 1 | M16: -0.0815373982100847 | N16: 0.596740942900482 | O16: 2 | P16: -0.422063492719545 | Q16: 0.450388515286507 | R16: 2 | S16: -0.780814769585941 | T16: 0.536534704411876 | U16: 1
A17: 13 | B17: 'Burkina Faso | C17: 'BFA | D17: -0.213462923575118 | E17: 0.291377601755329 | F17: 2 | G17: -0.516620997379056 | H17: 0.362791739324056 | I17: 2 | J17: -0.0592008590177913 | K17: 0.317355502507267 | L17: 3 | M17: -0.0378297590758971 | N17: 0.332518638661452 | O17: 3 | P17: -0.350050124395757 | Q17: 0.428662080608825 | R17: 3 | S17: -0.367644752844689 | T17: 0.356841476720674 | U17: 2
A18: 14 | B18: 'Bangladesh | C18: 'BGD | D18: -0.0149327055073721 | E18: 0.254026944310672 | F18: 3 | G18: -0.398234412277944 | H18: 0.299881889042829 | I18: 3 | J18: -0.564608224994493 | K18: 0.319089592041234 | L18: 3 | M18: -0.155236651216898 | N18: 0.395254221998157 | O18: 3 | P18: -0.929443694172601 | Q18: 0.276349686366578 | R18: 4 | S18: -0.289109466432692 | T18: 0.267063170408295 | U18: 3
A19: 15 | B19: 'Bulgaria | C19: 'BGR | D19: 0.603069024928216 | E19: 0.251300233223489 | F19: 5 | G19: 0.43392867304825 | H19: 0.234722074427469 | I19: 5 | J19: -0.814130875922728 | K19: 0.242598933058622 | L19: 5 | M19: 0.516489344851132 | N19: 0.262826647914669 | O19: 5 | P19: -0.149798699521592 | Q19: 0.179548241092202 | R19: 7 | S19: -0.557152054574667 | T19: 0.181932764704801 | U19: 7
A20: 16 | B20: 'Bahrain | C20: 'BHR | D20: -1.03706356844374 | E20: 0.254026944310672 | F20: 3 | G20: -0.0768977944707331 | H20: 0.299881889042829 | I20: 3 | J20: 0.235499656260677 | K20: 0.319089592041234 | L20: 3 | M20: 0.751891784116578 | N20: 0.395254221998157 | O20: 3 | P20: 0.664525769036017 | Q20: 0.276349686366578 | R20: 4 | S20: -0.21498583790871 | T20: 0.267063170408295 | U20: 3
A21: 17 | B21: 'Bahamas, The | C21: 'BHS | D21: 1.13429282706373 | E21: 0.291377601755329 | F21: 2 | G21: 0.372137476593534 | H21: 0.412522842574475 | I21: 1 | J21: 0.473726995805015 | K21: 0.768168783719135 | L21: 1 | M21: 0.870010330676201 | N21: 0.519940958319459 | O21: 2 | P21: 0.56301924319449 | Q21: 0.443073362506416 | R21: 2 | S21: 0.497383118867935 | T21: 0.748674396199437 | U21: 1
A22: 18 | B22: 'Bosnia and Herzegovina | C22: 'BIH | D22: -0.970906374812819 | E22: 0.360314615495306 | F22: 2 | G22: -1.15523888458028 | H22: 0.385219224774164 | I22: 1 | J22: -1.10849414571572 | K22: 0.407477153894001 | L22: 1 | M22: -1.25740782983409 | N22: 0.304457805877569 | O22: 2 | P22: -1.10844157912402 | Q22: 0.232241722876399 | R22: 3 | S22: -0.352523582662853 | T22: 0.455027094976652 | U22: 1
A23: 19 | B23: 'Belarus | C23: 'BLR | D23: -0.52066192727356 | E23: 0.287283341236829 | F23: 4 | G23: -0.37473847286711 | H23: 0.253989014301079 | I23: 4 | J23: -0.658924157924659 | K23: 0.294346198002602 | L23: 4 | M23: -1.46557701705803 | N23: 0.262826647914669 | O23: 5 | P23: -0.876137541021011 | Q23: 0.19625062444278 | R23: 6 | S23: -0.653623941071049 | T23: 0.220375596017846 | U23: 6
A24: 20 | B24: 'Belize | C24: 'BLZ | D24: 1.23132220962058 | E24: 0.360314615495306 | F24: 1 | G24: 0 | H24: 0 | I24: 0 | J24: 0 | K24: 0 | L24: 0 | M24: 0.288254748149331 | N24: 0.601880844424266 | O24: 1 | P24: 0.0879663411437438 | Q24: 0.600583865212543 | R24: 1 | S24: 0 | T24: 0 | U24: 0
A25: 21 | B25: 'Bolivia | C25: 'BOL | D25: 0.391374448651103 | E25: 0.251300233223489 | F25: 4 | G25: -0.142648055593531 | H25: 0.283845617478955 | I25: 4 | J25: -0.222923544964092 | K25: 0.259334359872279 | L25: 5 | M25: 0.875846670399297 | N25: 0.393787925241036 | O25: 4 | P25: -0.354505374998751 | Q25: 0.25605974956246 | R25: 5 | S25: -0.437877194786039 | T25: 0.232582183071991 | U25: 5
A26: 22 | B26: 'Brazil | C26: 'BRA | D26: 0.55168050950866 | E26: 0.251300233223489 | F26: 5 | G26: -0.322639211387269 | H26: 0.25228486761248 | I26: 6 | J26: -0.219935432407603 | K26: 0.233636532185851 | L26: 7 | M26: 0.133816159678919 | N26: 0.228760003290238 | O26: 6 | P26: -0.222091429726382 | Q26: 0.207737275615815 | R26: 8 | S26: 0.0576168441917039 | T26: 0.189092987537097 | U26: 8
A27: 23 | B27: 'Barbados | C27: 'BRB | D27: 1.49020487912833 | E27: 0.360314615495306 | F27: 1 | G27: 0 | H27: 0 | I27: 0 | J27: 0 | K27: 0 | L27: 0 | M27: 0.612275371278534 | N27: 0.601880844424266 | O27: 1 | P27: 0.410867315430279 | Q27: 0.600583865212543 | R27: 1 | S27: 0 | T27: 0 | U27: 0
A28: 24 | B28: 'Brunei | C28: 'BRN | D28: -0.919471266141518 | E28: 0.291377601755329 | F28: 2 | G28: 1.31795060989945 | H28: 0.412522842574475 | I28: 1 | J28: 0.00864179875606756 | K28: 0.768168783719135 | L28: 1 | M28: -0.084459085940385 | N28: 0.718213521236258 | O28: 1 | P28: 1.25157375441913 | Q28: 0.548697312118359 | R28: 1 | S28: -0.0186657030867037 | T28: 0.748674396199437 | U28: 1
A29: 25 | B29: 'Bhutan | C29: 'BTN | D29: -1.25395142759497 | E29: 0.360314615495306 | F29: 1 | G29: 0 | H29: 0 | I29: 0 | J29: 0 | K29: 0 | L29: 0 | M29: 0 | N29: 0 | O29: 0 | P29: 0 | Q29: 0 | R29: 0 | S29: 0 | T29: 0 | U29: 0
A30: 26 | B30: 'Botswana | C30: 'BWA | D30: 0.778650762502728 | E30: 0.254026944310672 | F30: 3 | G30: 0.74282527718284 | H30: 0.279058457436991 | I30: 4 | J30: 0.220977825427987 | K30: 0.256872813180543 | L30: 4 | M30: 0.572420872088682 | N30: 0.291778685386365 | O30: 4 | P30: 0.501534020341995 | Q30: 0.272746442471847 | R30: 5 | S30: 0.535191310962023 | T30: 0.223105684616046 | U30: 4
A31: 27 | B31: 'Central African Republic | C31: 'CAF | D31: -0.04583229804779 | E31: 0.360314615495306 | F31: 1 | G31: 0 | H31: 0 | I31: 0 | J31: -0.747113913251497 | K31: 0.506334762729148 | L31: 1 | M31: 0 | N31: 0 | O31: 0 | P31: 0 | Q31: 0 | R31: 0 | S31: 0 | T31: 0 | U31: 0
A32: 28 | B32: 'Canada | C32: 'CAN | D32: 1.36194187920728 | E32: 0.251300233223489 | F32: 5 | G32: 1.02719985634173 | H32: 0.25228486761248 | I32: 6 | J32: 1.71734777384897 | K32: 0.233636532185851 | L32: 7 | M32: 0.869204272296916 | N32: 0.228760003290238 | O32: 6 | P32: 1.5494586944364 | Q32: 0.207737275615815 | R32: 8 | S32: 2.05547485668362 | T32: 0.196208208436663 | U32: 7
A33: 29 | B33: 'Switzerland | C33: 'CHE | D33: 1.69363589301386 | E33: 0.251300233223489 | F33: 5 | G33: 1.69047021297138 | H33: 0.25228486761248 | I33: 6 | J33: 1.98625232151785 | K33: 0.233636532185851 | L33: 7 | M33: 0.87794009701114 | N33: 0.228760003290238 | O33: 6 | P33: 1.99583196731206 | Q33: 0.207737275615815 | R33: 8 | S33: 2.0717306679793 | T33: 0.189092987537097 | U33: 8
A34: 30 | B34: 'Chile | C34: 'CHL | D34: 0.615023661901715 | E34: 0.254026944310672 | F34: 4 | G34: 0.451273600455869 | H34: 0.263344534520094 | I34: 5 | J34: 1.16588064362721 | K34: 0.248661311888018 | L34: 6 | M34: 0.898261466987748 | N34: 0.2290464009857 | O34: 5 | P34: 1.08572525363529 | Q34: 0.218139839508948 | R34: 7 | S34: 1.02920563727934 | T34: 0.198055085748779 | U34: 7
A35: 31 | B35: 'China | C35: 'CHN | D35: -1.29613198605537 | E35: 0.254026944310672 | F35: 5 | G35: 0.48347625661563 | H35: 0.263344534520094 | I35: 5 | J35: 0.0155899794767549 | K35: 0.248661311888018 | L35: 6 | M35: -0.0700845393572666 | N35: 0.2290464009857 | O35: 5 | P35: -0.0400354875895447 | Q35: 0.218139839508948 | R35: 7 | S35: -0.288973408136912 | T35: 0.163839744115479 | U35: 7
A36: 32 | B36: 'Cote d'Ivoire | C36: 'CIV | D36: -0.56905295871603 | E36: 0.251300233223489 | F36: 4 | G36: -0.137833534917085 | H36: 0.265998113597101 | I36: 5 | J36: -0.180413277076371 | K36: 0.240407962423765 | L36: 5 | M36: 0.147756109663508 | N36: 0.291187323849693 | O36: 5 | P36: -0.334826948361111 | Q36: 0.253185404132827 | R36: 6 | S36: -0.0792730988776621 | T36: 0.210520528590018 | U36: 5
A37: 33 | B37: 'Cameroon | C37: 'CMR | D37: -0.70288316235524 | E37: 0.251300233223489 | F37: 4 | G37: -0.724475314801389 | H37: 0.265998113597101 | I37: 5 | J37: -0.644720261257849 | K37: 0.240407962423765 | L37: 5 | M37: -0.163682730895072 | N37: 0.291187323849693 | O37: 5 | P37: -1.01522358312793 | Q37: 0.253185404132827 | R37: 6 | S37: -1.10460553053312 | T37: 0.210520528590018 | U37: 5
A38: 34 | B38: 'Congo, Rep. | C38: 'COG | D38: -0.773495066928138 | E38: 0.287283341236829 | F38: 3 | G38: -1.82577147723476 | H38: 0.373502182114371 | I38: 2 | J38: -0.580499813883824 | K38: 0.385123284441522 | L38: 3 | M38: -0.991366900545461 | N38: 0.516616692692467 | O38: 3 | P38: -1.43538819682423 | Q38: 0.371358506695114 | R38: 3 | S38: -0.596204077710876 | T38: 0.484622455710095 | U38: 2
A39: 35 | B39: 'Colombia | C39: 'COL | D39: -0.11998207819522 | E39: 0.251300233223489 | F39: 5 | G39: -1.28993831164361 | H39: 0.25228486761248 | I39: 6 | J39: -0.056625957250348 | K39: 0.233636532185851 | L39: 7 | M39: 0.289545075750528 | N39: 0.228760003290238 | O39: 6 | P39: -0.783256206848786 | Q39: 0.207737275615815 | R39: 8 | S39: -0.490332951916436 | T39: 0.189092987537097 | U39: 8
A40: 36 | B40: 'Comoros | C40: 'COM | D40: 0.0611725377293941 | E40: 0.360314615495306 | F40: 1 | G40: 0 | H40: 0 | I40: 0 | J40: 0 | K40: 0 | L40: 0 | M40: 0 | N40: 0 | O40: 0 | P40: 0 | Q40: 0 | R40: 0 | S40: 0 | T40: 0 | U40: 0
A41: 37 | B41: 'Cape verde | C41: 'CPV | D41: 0.986246614494423 | E41: 0.360314615495306 | F41: 1 | G41: 0 | H41: 0 | I41: 0 | J41: 0 | K41: 0 | L41: 0 | M41: -1.00782775214398 | N41: 0.601880844424266 | O41: 1 | P41: 0.0879663411437438 | Q41: 0.600583865212543 | R41: 1 | S41: 0 | T41: 0 | U41: 0
A42: 38 | B42: 'Costa Rica | C42: 'CRI | D42: 1.34527460800992 | E42: 0.251300233223489 | F42: 4 | G42: 0.90828717972 | H42: 0.269879776011692 | I42: 5 | J42: 0.553507235448647 | K42: 0.289056005758262 | L42: 4 | M42: 0.92701027674402 | N42: 0.393787925241036 | O42: 4 | P42: 0.553029745805841 | Q42: 0.235166305078156 | R42: 6 | S42: 0.576908631503339 | T42: 0.207277285164844 | U42: 6
A43: 39 | B43: 'Cuba | C43: 'CUB | D43: -1.46071200942026 | E43: 0.254026944310672 | F43: 3 | G43: 0.190378930987595 | H43: 0.299881889042829 | I43: 3 | J43: -0.497101521805384 | K43: 0.319089592041234 | L43: 3 | M43: -0.865575510786019 | N43: 0.395254221998157 | O43: 3 | P43: 0.114628471716251 | Q43: 0.276349686366578 | R43: 4 | S43: 0.274198294200904 | T43: 0.267063170408295 | U43: 3
A44: 40 | B44: 'Cyprus | C44: 'CYP | D44: 1.11479927497593 | E44: 0.254026944310672 | F44: 3 | G44: 0.380549122874782 | H44: 0.299881889042829 | I44: 3 | J44: 1.04062543208678 | K44: 0.319089592041234 | L44: 3 | M44: 0.840040634486843 | N44: 0.395254221998157 | O44: 3 | P44: 0.927567495026349 | Q44: 0.276349686366578 | R44: 4 | S44: 1.81128380126771 | T44: 0.267063170408295 | U44: 3
A45: 41 | B45: 'Czech Republic | C45: 'CZE | D45: 1.20137376687175 | E45: 0.251300233223489 | F45: 6 | G45: 0.805766038690297 | H45: 0.215915139092969 | I45: 7 | J45: 0.594645801250449 | K45: 0.206979294668072 | L45: 8 | M45: 0.56981387384378 | N45: 0.191964544754769 | O45: 7 | P45: 0.543327154857081 | Q45: 0.160250557094621 | R45: 10 | S45: 0.384230339773304 | T45: 0.162862701383401 | U45: 9
A46: 42 | B46: 'Germany | C46: 'DEU | D46: 1.49036531453221 | E46: 0.251300233223489 | F46: 5 | G46: 1.31734754890926 | H46: 0.25228486761248 | I46: 6 | J46: 1.40920903413881 | K46: 0.233636532185851 | L46: 7 | M46: 0.889403253828528 | N46: 0.228760003290238 | O46: 6 | P46: 1.48348680130881 | Q46: 0.207737275615815 | R46: 8 | S46: 1.62029309421433 | T46: 0.189092987537097 | U46: 8
A47: 43 | B47: 'Djibouti | C47: 'DJI | D47: -0.601567097825887 | E47: 0.360314615495306 | F47: 1 | G47: 0 | H47: 0 | I47: 0 | J47: 0 | K47: 0 | L47: 0 | M47: -0.521796815506047 | N47: 0.601880844424266 | O47: 1 | P47: -0.234934633142791 | Q47: 0.600583865212543 | R47: 1 | S47: 0 | T47: 0 | U47: 0
A48: 44 | B48: 'Denmark | C48: 'DNK | D48: 1.63319596935494 | E48: 0.254026944310672 | F48: 4 | G48: 1.28643998191881 | H48: 0.263344534520094 | I48: 5 | J48: 1.72105185492222 | K48: 0.248661311888018 | L48: 6 | M48: 1.04792731282587 | N48: 0.2290464009857 | O48: 5 | P48: 1.69120852809496 | Q48: 0.218139839508948 | R48: 7 | S48: 2.12901661138458 | T48: 0.198055085748779 | U48: 7
A49: 45 | B49: 'Dominican Republic | C49: 'DOM | D49: -0.0778858613944379 | E49: 0.254026944310672 | F49: 3 | G49: 0.121086676080839 | H49: 0.342482293230127 | I49: 2 | J49: -0.832540076312625 | K49: 0.374142364422074 | L49: 2 | M49: 0.538860131714721 | N49: 0.519940958319459 | O49: 2 | P49: 0.379557024908821 | Q49: 0.313894625236573 | R49: 3 | S49: -0.772948030492883 | T49: 0.296106941830424 | U49: 2
A50: 46 | B50: 'Algeria | C50: 'DZA | D50: -1.30973174005496 | E50: 0.254026944310672 | F50: 3 | G50: -2.42051734496435 | H50: 0.299881889042829 | I50: 3 | J50: -1.08693237577858 | K50: 0.319089592041234 | L50: 3 | M50: -1.17263839295845 | N50: 0.395254221998157 | O50: 3 | P50: -1.10286088790928 | Q50: 0.276349686366578 | R50: 4 | S50: -0.877793620171286 | T50: 0.267063170408295 | U50: 3
A51: 47 | B51: 'Ecuador | C51: 'ECU | D51: 0.267604098791391 | E51: 0.251300233223489 | F51: 4 | G51: -0.467172598007512 | H51: 0.263581014412824 | I51: 5 | J51: -0.561960959525976 | K51: 0.266738907159248 | L51: 5 | M51: 0.376566173046927 | N51: 0.393787925241036 | O51: 4 | P51: -0.721103409727295 | Q51: 0.239938596034472 | R51: 6 | S51: -0.819200818801926 | T51: 0.241402378832618 | U51: 5
A52: 48 | B52: 'Egypt, Arab Rep. | C52: 'EGY | D52: -0.674392739955636 | E52: 0.254026944310672 | F52: 3 | G52: -0.0665396321987393 | H52: 0.248905722575756 | I52: 6 | J52: -0.13795229442172 | K52: 0.222815559932082 | L52: 6 | M52: 0.117878192157639 | N52: 0.231793128719878 | O52: 5 | P52: 0.127902860792105 | Q52: 0.233180991042087 | R52: 7 | S52: -0.267460622203097 | T52: 0.197856749202811 | U52: 6
A53: 49 | B53: 'Eritrea | C53: 'ERI | D53: -0.594663560635087 | E53: 0.360314615495306 | F53: 1 | G53: 0 | H53: 0 | I53: 0 | J53: 0 | K53: 0 | L53: 0 | M53: 0 | N53: 0 | O53: 0 | P53: 0 | Q53: 0 | R53: 0 | S53: 0 | T53: 0 | U53: 0
A54: 50 | B54: 'Spain | C54: 'ESP | D54: 1.33801997724481 | E54: 0.251300233223489 | F54: 5 | G54: 0.580221715058647 | H54: 0.25228486761248 | I54: 6 | J54: 1.60327032032394 | K54: 0.233636532185851 | L54: 7 | M54: 0.86427141020372 | N54: 0.228760003290238 | O54: 6 | P54: 1.0321345377943 | Q54: 0.207737275615815 | R54: 8 | S54: 1.21426072096851 | T54: 0.189092987537097 | U54: 8
A55: 51 | B55: 'Estonia | C55: 'EST | D55: 0.788856715751697 | E55: 0.251300233223489 | F55: 5 | G55: 0.791360321222212 | H55: 0.234722074427469 | I55: 5 | J55: 0.258183039906133 | K55: 0.242598933058622 | L55: 5 | M55: 0.7429711565498 | N55: 0.262826647914669 | O55: 5 | P55: 0.507003037488312 | Q55: 0.179548241092202 | R55: 7 | S55: 0.593056374347544 | T55: 0.181932764704801 | U55: 7
A56: 52 | B56: 'Ethiopia | C56: 'ETH | D56: -0.499612494735302 | E56: 0.291377601755329 | F56: 2 | G56: 0.141375932283403 | H56: 0.362791739324056 | I56: 2 | J56: -0.146438712967353 | K56: 0.317355502507267 | L56: 3 | M56: -0.0334036157632457 | N56: 0.332518638661452 | O56: 3 | P56: 0.269102675980988 | Q56: 0.428662080608825 | R56: 3 | S56: -0.435581201667957 | T56: 0.356841476720674 | U56: 2
A57: 53 | B57: 'Finland | C57: 'FIN | D57: 1.60231364128456 | E57: 0.254026944310672 | F57: 4 | G57: 1.5143605283955 | H57: 0.263344534520094 | I57: 5 | J57: 1.63475799656034 | K57: 0.248661311888018 | L57: 6 | M57: 1.1404307299791 | N57: 0.2290464009857 | O57: 5 | P57: 1.73635655217209 | Q57: 0.218139839508948 | R57: 7 | S57: 2.08459383980899 | T57: 0.198055085748779 | U57: 7
A58: 54 | B58: 'Fiji | C58: 'FJI | D58: 0.0129544519434821 | E58: 0.352657522321209 | F58: 2 | G58: 0.0123052459470067 | H58: 0.660536144392275 | I58: 1 | J58: 0.634940386429239 | K58: 0.563707566872499 | L58: 1 | M58: -0.368703488518708 | N58: 0.596740942900482 | O58: 2 | P58: -0.495383176646379 | Q58: 0.450388515286507 | R58: 2 | S58: 0.806667830976276 | T58: 0.536534704411876 | U58: 1
A59: 55 | B59: 'France | C59: 'FRA | D59: 1.1502996759102 | E59: 0.251300233223489 | F59: 5 | G59: 0.646650340792331 | H59: 0.25228486761248 | I59: 6 | J59: 1.279532380432 | K59: 0.233636532185851 | L59: 7 | M59: 0.713451816283397 | N59: 0.228760003290238 | O59: 6 | P59: 1.07714091584612 | Q59: 0.207737275615815 | R59: 8 | S59: 1.28239421571445 | T59: 0.196208208436663 | U59: 7
A60: 56 | B60: 'Gabon | C60: 'GAB | D60: -0.314098912982618 | E60: 0.254026944310672 | F60: 3 | G60: -0.561334828427524 | H60: 0.342482293230127 | I60: 2 | J60: -1.12675297732703 | K60: 0.374142364422074 | L60: 2 | M60: 0.354853952729547 | N60: 0.519940958319459 | O60: 2 | P60: -0.52521530277166 | Q60: 0.313894625236573 | R60: 3 | S60: -1.0151196581536 | T60: 0.296106941830424 | U60: 2
A61: 57 | B61: 'United Kingdom | C61: 'GBR | D61: 1.48903639902045 | E61: 0.251300233223489 | F61: 5 | G61: 0.919721876874545 | H61: 0.25228486761248 | I61: 6 | J61: 1.9661212499736 | K61: 0.233636532185851 | L61: 7 | M61: 1.2064248676641 | N61: 0.228760003290238 | O61: 6 | P61: 1.68862849528257 | Q61: 0.207737275615815 | R61: 8 | S61: 1.70652356582384 | T61: 0.189092987537097 | U61: 8
A62: 58 | B62: 'Georgia | C62: 'GEO | D62: -0.291267640815027 | E62: 0.352657522321209 | F62: 3 | G62: -0.760877400890295 | H62: 0.306784965294112 | I62: 3 | J62: -0.512082003605912 | K62: 0.303625046262932 | L62: 3 | M62: -0.849266999127269 | N62: 0.271785289504675 | O62: 4 | P62: -0.494184232932555 | Q62: 0.205660006207 | R62: 5 | S62: -0.74365486241976 | T62: 0.236922232900357 | U62: 4
A63: 59 | B63: 'Ghana | C63: 'GHA | D63: -0.434661002693491 | E63: 0.251300233223489 | F63: 4 | G63: -0.101071613093776 | H63: 0.265998113597101 | I63: 5 | J63: -0.28677755680362 | K63: 0.222481788006156 | L63: 6 | M63: 0.27836296766957 | N63: 0.291187323849693 | O63: 5 | P63: -0.0136123512613244 | Q63: 0.253185404132827 | R63: 6 | S63: -0.301476970023552 | T63: 0.210520528590018 | U63: 5
A64: 60 | B64: 'Guinea | C64: 'GIN | D64: -0.872918282815149 | E64: 0.287283341236829 | F64: 3 | G64: -1.03492423678739 | H64: 0.373502182114371 | I64: 2 | J64: -0.0292787155682444 | K64: 0.510201183720256 | L64: 2 | M64: 0.196990422875537 | N64: 0.516616692692467 | O64: 3 | P64: -0.761680847552104 | Q64: 0.371358506695114 | R64: 3 | S64: -0.847765828007639 | T64: 0.484622455710095 | U64: 2
A65: 61 | B65: 'Guadeloupe | C65: 'GLP | D65: 0 | E65: 0 | F65: 0 | G65: 0 | H65: 0 | I65: 0 | J65: 0 | K65: 0 | L65: 0 | M65: 0 | N65: 0 | O65: 0 | P65: 0 | Q65: 0 | R65: 0 | S65: 0 | T65: 0 | U65: 0
A66: 62 | B66: 'Gambia, The | C66: 'GMB | D66: -0.971389287332041 | E66: 0.291377601755329 | F66: 2 | G66: 0.561300100530776 | H66: 0.412522842574475 | I66: 1 | J66: 0.163670195291929 | K66: 0.768168783719135 | L66: 1 | M66: -0.249650744710652 | N66: 0.519940958319459 | O66: 2 | P66: 0.274143806590087 | Q66: 0.443073362506416 | R66: 2 | S66: -0.0186657030867037 | T66: 0.748674396199437 | U66: 1
A67: 63 | B67: 'Guinea-Bissau | C67: 'GNB | D67: -0.453857012475429 | E67: 0.287283341236829 | F67: 3 | G67: -1.20291791859717 | H67: 0.373502182114371 | I67: 2 | J67: -0.334276821170571 | K67: 0.510201183720256 | L67: 2 | M67: -1.35023423704921 | N67: 0.516616692692467 | O67: 3 | P67: -1.61471345546518 | Q67: 0.371358506695114 | R67: 3 | S67: -0.175793474927558 | T67: 0.484622455710095 | U67: 2
A68: 64 | B68: 'Equatorial Guinea | C68: 'GNQ | D68: -1.38857041834854 | E68: 0.360314615495306 | F68: 1 | G68: 0 | H68: 0 | I68: 0 | J68: 0 | K68: 0 | L68: 0 | M68: -1.33184837527318 | N68: 0.601880844424266 | O68: 1 | P68: -1.2036375560024 | Q68: 0.600583865212543 | R68: 1 | S68: 0 | T68: 0 | U68: 0
A69: 65 | B69: 'Greece | C69: 'GRC | D69: 1.07453560600076 | E69: 0.254026944310672 | F69: 4 | G69: 0.205019144201462 | H69: 0.263344534520094 | I69: 5 | J69: 0.559690996716061 | K69: 0.248661311888018 | L69: 6 | M69: 0.604971525396404 | N69: 0.2290464009857 | O69: 5 | P69: 0.495643464742422 | Q69: 0.218139839508948 | R69: 7 | S69: 0.824820743261995 | T69: 0.198055085748779 | U69: 7
A70: 66 | B70: 'Guatemala | C70: 'GTM | D70: -0.564613187138968 | E70: 0.254026944310672 | F70: 3 | G70: -0.750933661622346 | H70: 0.318733333730906 | I70: 3 | J70: -0.225018245789411 | K70: 0.374142364422074 | L70: 2 | M70: 0.444202272223092 | N70: 0.519940958319459 | O70: 2 | P70: -1.10567631269014 | Q70: 0.277567107731038 | R70: 4 | S70: -0.81944615326047 | T70: 0.248495031055375 | U70: 3
A71: 67 | B71: 'Guyana | C71: 'GUY | D71: 1.009612846205 | E71: 0.291377601755329 | F71: 2 | G71: -0.195350404297996 | H71: 0.412522842574475 | I71: 1 | J71: 0.00864179875606756 | K71: 0.768168783719135 | L71: 1 | M71: 0.233953012080858 | N71: 0.519940958319459 | O71: 2 | P71: -0.139945117901966 | Q71: 0.443073362506416 | R71: 2 | S71: -0.0186657030867037 | T71: 0.748674396199437 | U71: 1
A72: 68 | B72: 'Hong Kong, China | C72: 'HKG | D72: -0.0739175588647686 | E72: 0.251300233223489 | F72: 6 | G72: 0.921513428588353 | H72: 0.269879776011692 | I72: 5 | J72: 1.24833968089337 | K72: 0.248197652987303 | L72: 6 | M72: 1.20717082774271 | N72: 0.228760003290238 | O72: 6 | P72: 1.33339129542776 | Q72: 0.217937465518249 | R72: 7 | S72: 1.31333597963704 | T72: 0.156072903069337 | U72: 8
A73: 69 | B73: 'Honduras | C73: 'HND | D73: -0.0553062261506043 | E73: 0.254026944310672 | F73: 3 | G73: -0.33396283317136 | H73: 0.318733333730906 | I73: 3 | J73: -0.408901309695725 | K73: 0.374142364422074 | L73: 2 | M73: 0.0814994531786482 | N73: 0.519940958319459 | O73: 2 | P73: -0.895346009982718 | Q73: 0.277567107731038 | R73: 4 | S73: -0.938147011576724 | T73: 0.248495031055375 | U73: 3
A74: 70 | B74: 'Croatia | C74: 'HRV | D74: -0.323228801236218 | E74: 0.254026944310672 | F74: 4 | G74: 0.405957114965074 | H74: 0.243549981714305 | I74: 4 | J74: 0.149624309846297 | K74: 0.259550680503314 | L74: 4 | M74: 0.238170968258829 | N74: 0.263261256825197 | O74: 4 | P74: 0.145956470866589 | Q74: 0.186137681288291 | R74: 6 | S74: -0.46405431594523 | T74: 0.197079228567315 | U74: 5
A75: 71 | B75: 'Haiti | C75: 'HTI | D75: -0.709013686998217 | E75: 0.291377601755329 | F75: 2 | G75: -1.70865142303535 | H75: 0.412522842574475 | I75: 1 | J75: -1.23158539585491 | K75: 0.768168783719135 | L75: 1 | M75: -1.13281948352928 | N75: 0.519940958319459 | O75: 2 | P75: -1.49534623770841 | Q75: 0.443073362506416 | R75: 2 | S75: -0.534714525041343 | T75: 0.748674396199437 | U75: 1
A76: 72 | B76: 'Hungary | C76: 'HUN | D76: 1.19831936661523 | E76: 0.251300233223489 | F76: 6 | G76: 1.24532322926958 | H76: 0.215915139092969 | I76: 7 | J76: 0.60645638978787 | K76: 0.206979294668072 | L76: 8 | M76: 0.854069003216364 | N76: 0.191964544754769 | O76: 7 | P76: 0.705543847969546 | Q76: 0.160250557094621 | R76: 10 | S76: 0.614109908300502 | T76: 0.158724276475048 | U76: 10
A77: 73 | B77: 'Indonesia | C77: 'IDN | D77: -1.16546420256521 | E77: 0.254026944310672 | F77: 5 | G77: -1.28866288049059 | H77: 0.263344534520094 | I77: 5 | J77: -0.528262795168551 | K77: 0.248661311888018 | L77: 6 | M77: 0.121487731072876 | N77: 0.2290464009857 | O77: 5 | P77: -0.918327696429769 | Q77: 0.218139839508948 | R77: 7 | S77: -0.798850677507631 | T77: 0.163839744115479 | U77: 7
A78: 74 | B78: 'India | C78: 'IND | D78: 0.497757989443293 | E78: 0.251300233223489 | F78: 6 | G78: -0.0366081057492088 | H78: 0.25228486761248 | I78: 6 | J78: -0.263746865236554 | K78: 0.233636532185851 | L78: 7 | M78: -0.0399745175792802 | N78: 0.228760003290238 | O78: 6 | P78: 0.160389271213263 | Q78: 0.207737275615815 | R78: 8 | S78: -0.305840656932275 | T78: 0.154823207917754 | U78: 9
A79: 75 | B79: 'Ireland | C79: 'IRL | D79: 1.50103341274461 | E79: 0.251300233223489 | F79: 5 | G79: 1.42621700257852 | H79: 0.25228486761248 | I79: 6 | J79: 1.36109673730644 | K79: 0.233636532185851 | L79: 7 | M79: 1.15749859809546 | N79: 0.228760003290238 | O79: 6 | P79: 1.3949005873786 | Q79: 0.207737275615815 | R79: 8 | S79: 1.56729208389528 | T79: 0.189092987537097 | U79: 8
A80: 76 | B80: 'Iran, Islamic Rep. | C80: 'IRN | D80: -0.559206275363623 | E80: 0.254026944310672 | F80: 3 | G80: 0.134554399093723 | H80: 0.276271366742878 | I80: 4 | J80: -0.339435714161585 | K80: 0.289789143823299 | L80: 4 | M80: -1.25064362417407 | N80: 0.395254221998157 | O80: 3 | P80: -0.364240805690651 | Q80: 0.256388157194472 | R80: 5 | S80: -0.847947608414174 | T80: 0.260942877169474 | U80: 4
A81: 77 | B81: 'Iraq | C81: 'IRQ | D81: -1.75288975115211 | E81: 0.254026944310672 | F81: 3 | G81: -2.24452032849233 | H81: 0.299881889042829 | I81: 3 | J81: -1.88310089184005 | K81: 0.319089592041234 | L81: 3 | M81: -3.14218535697991 | N81: 0.395254221998157 | O81: 3 | P81: -1.8436719236241 | Q81: 0.276349686366578 | R81: 4 | S81: -1.26489276326293 | T81: 0.267063170408295 | U81: 3
A82: 78 | B82: 'Iceland | C82: 'ISL | D82: 1.44700186686527 | E82: 0.291377601755329 | F82: 3 | G82: 1.25227288710498 | H82: 0.372830223049686 | I82: 2 | J82: 1.50391949815517 | K82: 0.409633213579203 | L82: 3 | M82: 0.614187284027094 | N82: 0.247238613070611 | O82: 4 | P82: 1.46892971628538 | Q82: 0.302942850391962 | R82: 4 | S82: 1.83055185296978 | T82: 0.307151938975515 | U82: 3
A83: 79 | B83: 'Israel | C83: 'ISR | D83: 1.08338976240898 | E83: 0.254026944310672 | F83: 4 | G83: -0.4550234910724 | H83: 0.283550357121878 | I83: 4 | J83: 0.685072346632708 | K83: 0.266441748954348 | L83: 5 | M83: 0.533168276644083 | N83: 0.2290464009857 | O83: 5 | P83: 0.965844313364328 | Q83: 0.230041930929945 | R83: 6 | S83: 1.27668802013757 | T83: 0.200691571592182 | U83: 6
A84: 80 | B84: 'Italy | C84: 'ITA | D84: 1.28691964321953 | E84: 0.251300233223489 | F84: 5 | G84: 1.15852654178882 | H84: 0.25228486761248 | I84: 6 | J84: 0.772869272481444 | K84: 0.233636532185851 | L84: 7 | M84: 0.591364333981401 | N84: 0.228760003290238 | O84: 6 | P84: 0.860901468867888 | Q84: 0.207737275615815 | R84: 8 | S84: 0.80232836284118 | T84: 0.189092987537097 | U84: 8
A85: 81 | B85: 'Jamaica | C85: 'JAM | D85: 0.750255928999158 | E85: 0.251300233223489 | F85: 4 | G85: -0.344293116928392 | H85: 0.319152876161049 | I85: 3 | J85: -0.484201311084561 | K85: 0.328076692774937 | L85: 3 | M85: 0.759514876313547 | N85: 0.516616692692467 | O85: 3 | P85: -0.727917158432315 | Q85: 0.285056666814727 | R85: 4 | S85: -0.11620599480499 | T85: 0.268423788960137 | U85: 3
A86: 82 | B86: 'Jordan | C86: 'JOR | D86: 0.153359121198554 | E86: 0.251300233223489 | F86: 4 | G86: -0.0568771748696522 | H86: 0.269879776011692 | I86: 5 | J86: 0.629615896664261 | K86: 0.259334359872279 | L86: 5 | M86: 0.416552258524666 | N86: 0.274050600863496 | O86: 5 | P86: 0.708416506265853 | Q86: 0.235166305078156 | R86: 6 | S86: 0.139041897104576 | T86: 0.216758330803704 | U86: 5
A87: 83 | B87: 'Japan | C87: 'JPN | D87: 1.16310960274083 | E87: 0.291377601755329 | F87: 4 | G87: 1.15307569853484 | H87: 0.291478759644657 | I87: 4 | J87: 0.838987970114885 | K87: 0.305371419073761 | L87: 5 | M87: 0.388868992619871 | N87: 0.2290464009857 | O87: 5 | P87: 1.42187452824604 | Q87: 0.250315436772745 | R87: 6 | S87: 0.723575165855732 | T87: 0.159628305336241 | U87: 8
A88: 84 | B88: 'Kazakhstan | C88: 'KAZ | D88: -0.711671752783758 | E88: 0.251300233223489 | F88: 5 | G88: 0.221413923386003 | H88: 0.222869757056858 | I88: 6 | J88: -0.823777991731922 | K88: 0.228948582631029 | L88: 6 | M88: -0.404623733407951 | N88: 0.262826647914669 | O88: 5 | P88: -0.589663048787867 | Q88: 0.173714718001019 | R88: 8 | S88: -0.868662097911811 | T88: 0.186062318459078 | U88: 7
A89: 85 | B89: 'Kenya | C89: 'KEN | D89: -0.701220769773142 | E89: 0.251300233223489 | F89: 4 | G89: -1.09768968361389 | H89: 0.265998113597101 | I89: 5 | J89: -0.899427195373505 | K89: 0.222481788006156 | L89: 6 | M89: -0.132835927210843 | N89: 0.291187323849693 | O89: 5 | P89: -1.22003779383246 | Q89: 0.253185404132827 | R89: 6 | S89: -0.651380377330864 | T89: 0.210520528590018 | U89: 5
A90: 86 | B90: 'Kyrgyz Republic | C90: 'KGZ | D90: -0.247683804199477 | E90: 0.352657522321209 | F90: 3 | G90: 0.317713930889136 | H90: 0.306784965294112 | I90: 3 | J90: -0.575168916504139 | K90: 0.303625046262932 | L90: 3 | M90: -0.75821284237392 | N90: 0.271785289504675 | O90: 4 | P90: -0.468046442966884 | Q90: 0.205660006207 | R90: 5 | S90: -0.763433056850542 | T90: 0.236922232900357 | U90: 4
A91: 87 | B91: 'Cambodia | C91: 'KHM | D91: -0.90877453388243 | E91: 0.360314615495306 | F91: 1 | G91: 0 | H91: 0 | I91: 0 | J91: 0 | K91: 0 | L91: 0 | M91: -0.0357658788681192 | N91: 0.601880844424266 | O91: 1 | P91: -0.234934633142791 | Q91: 0.600583865212543 | R91: 1 | S91: 0 | T91: 0 | U91: 0
A92: 88 | B92: 'Korea, Rep. | C92: 'KOR | D92: 1.00232548169663 | E92: 0.251300233223489 | F92: 6 | G92: 0.164349009052496 | H92: 0.25228486761248 | I92: 6 | J92: 0.408682489320044 | K92: 0.233636532185851 | L92: 7 | M92: 0.219031285522308 | N92: 0.228760003290238 | O92: 6 | P92: 0.942550996806583 | Q92: 0.207737275615815 | R92: 8 | S92: 0.159186610379527 | T92: 0.154823207917754 | U92: 9
A93: 89 | B93: 'Kuwait | C93: 'KWT | D93: 0.000257006354970228 | E93: 0.254026944310672 | F93: 3 | G93: 0.683631198783781 | H93: 0.299881889042829 | I93: 3 | J93: -0.0634341813220545 | K93: 0.319089592041234 | L93: 3 | M93: -0.0908855271209571 | N93: 0.395254221998157 | O93: 3 | P93: 0.907372859020556 | Q93: 0.276349686366578 | R93: 4 | S93: 0.619003449178204 | T93: 0.267063170408295 | U93: 3
A94: 90 | B94: 'Lao, PDR | C94: 'LAO | D94: -1.0502970618268 | E94: 0.360314615495306 | F94: 1 | G94: 0 | H94: 0 | I94: 0 | J94: 0 | K94: 0 | L94: 0 | M94: -1.81787931191111 | N94: 0.601880844424266 | O94: 1 | P94: -1.2036375560024 | Q94: 0.600583865212543 | R94: 1 | S94: 0 | T94: 0 | U94: 0
A95: 91 | B95: 'Lebanon | C95: 'LBN | D95: -0.404267448971055 | E95: 0.254026944310672 | F95: 3 | G95: -0.252012225748576 | H95: 0.299881889042829 | I95: 3 | J95: 0.174306041771159 | K95: 0.319089592041234 | L95: 3 | M95: 0.102251050878655 | N95: 0.395254221998157 | O95: 3 | P95: 0.262473488103808 | Q95: 0.276349686366578 | R95: 4 | S95: -0.397068285369349 | T95: 0.267063170408295 | U95: 3
A96: 92 | B96: 'Liberia | C96: 'LBR | D96: -0.888397186862469 | E96: 0.291377601755329 | F96: 2 | G96: -0.952000913666671 | H96: 0.412522842574475 | I96: 1 | J96: -0.921528595341828 | K96: 0.768168783719135 | L96: 1 | M96: -1.24804017161168 | N96: 0.718213521236258 | O96: 1 | P96: -1.28862669959157 | Q96: 0.548697312118359 | R96: 1 | S96: -1.05076334389969 | T96: 0.748674396199437 | U96: 1
A97: 93 | B97: 'Libya | C97: 'LBY | D97: -1.34616258147123 | E97: 0.254026944310672 | F97: 3 | G97: -1.17470782403246 | H97: 0.299881889042829 | I97: 3 | J97: -1.32171691053559 | K97: 0.319089592041234 | L97: 3 | M97: -2.37626536736402 | N97: 0.395254221998157 | O97: 3 | P97: -1.11335657459486 | Q97: 0.276349686366578 | R97: 4 | S97: -0.881804721753313 | T97: 0.267063170408295 | U97: 3
A98: 94 | B98: 'Sri Lanka | C98: 'LKA | D98: -0.157058820008571 | E98: 0.254026944310672 | F98: 3 | G98: -1.62755969649983 | H98: 0.299881889042829 | I98: 3 | J98: -0.61167805037031 | K98: 0.319089592041234 | L98: 3 | M98: 0.615857466643392 | N98: 0.395254221998157 | O98: 3 | P98: -0.361258427755227 | Q98: 0.276349686366578 | R98: 4 | S98: -0.123944613981395 | T98: 0.267063170408295 | U98: 3
A99: 95 | B99: 'Lesotho | C99: 'LSO | D99: -0.145933599740765 | E99: 0.360314615495306 | F99: 1 | G99: -0.820037614892367 | H99: 0.606177135766502 | I99: 1 | J99: -0.461748202705814 | K99: 0.329075950105893 | L99: 2 | M99: -0.0579047841038158 | N99: 0.351244204676472 | O99: 2 | P99: -0.239871113462037 | Q99: 0.56608033832539 | R99: 2 | S99: 0.187611409323103 | T99: 0.376110791704214 | U99: 1
A100: 96 | B100: 'Lithuania | C100: 'LTU | D100: 0.766929806494868 | E100: 0.251300233223489 | F100: 5 | G100: 0.34571648933458 | H100: 0.234722074427469 | I100: 5 | J100: 0.126847596630602 | K100: 0.242598933058622 | L100: 5 | M100: 0.0891758476080636 | N100: 0.262826647914669 | O100: 5 | P100: 0.180154426081555 | Q100: 0.179548241092202 | R100: 7 | S100: 0.0341297068355733 | T100: 0.188243145715436 | U100: 6
A101: 97 | B101: 'Luxembourg | C101: 'LUX | D101: 1.46054569892184 | E101: 0.291377601755329 | F101: 3 | G101: 1.39772245094882 | H101: 0.372830223049686 | I101: 2 | J101: 1.67365567606964 | K101: 0.409633213579203 | L101: 3 | M101: 0.946660983612003 | N101: 0.247238613070611 | O101: 4 | P101: 1.62106412878027 | Q101: 0.302942850391962 | R101: 4 | S101: 1.6712549925591 | T101: 0.281815347728426 | U101: 4
A102: 98 | B102: 'Latvia | C102: 'LVA | D102: 0.624736462589446 | E102: 0.251300233223489 | F102: 5 | G102: 0.459789395214267 | H102: 0.234722074427469 | I102: 5 | J102: 0.0676379792867031 | K102: 0.242598933058622 | L102: 5 | M102: 0.508670991966978 | N102: 0.262826647914669 | O102: 5 | P102: 0.154512305300577 | Q102: 0.179548241092202 | R102: 7 | S102: -0.263574954758873 | T102: 0.181932764704801 | U102: 7
A103: 99 | B103: 'Macao, China | C103: 'MAC | D103: 0 | E103: 0 | F103: 0 | G103: 0 | H103: 0 | I103: 0 | J103: 0 | K103: 0 | L103: 0 | M103: 0 | N103: 0 | O103: 0 | P103: 0 | Q103: 0 | R103: 0 | S103: 0 | T103: 0 | U103: 0
A104: 100 | B104: 'Morocco | C104: 'MAR | D104: -0.23955570403641 | E104: 0.251300233223489 | F104: 4 | G104: 0.0899805024615535 | H104: 0.265998113597101 | I104: 5 | J104: 0.267083364834212 | K104: 0.222481788006156 | L104: 6 | M104: 0.215986773051638 | N104: 0.291187323849693 | O104: 5 | P104: 0.678170864108505 | Q104: 0.253185404132827 | R104: 6 | S104: 0.125190252839364 | T104: 0.210520528590018 | U104: 5
A105: 101 | B105: 'Moldova | C105: 'MDA | D105: 0.160796619348054 | E105: 0.251300233223489 | F105: 5 | G105: -0.195945354579978 | H105: 0.234722074427469 | I105: 5 | J105: -0.460082768696662 | K105: 0.242598933058622 | L105: 5 | M105: -0.280628804062589 | N105: 0.262826647914669 | O105: 5 | P105: -0.0189742925020053 | Q105: 0.179548241092202 | R105: 7 | S105: -0.386745507250578 | T105: 0.188243145715436 | U105: 6
A106: 102 | B106: 'Madagascar | C106: 'MDG | D106: 0.309258608410746 | E106: 0.287283341236829 | F106: 3 | G106: -0.785915939048472 | H106: 0.373502182114371 | I106: 2 | J106: -0.294575927837347 | K106: 0.385123284441522 | L106: 3 | M106: -0.208915501418436 | N106: 0.516616692692467 | O106: 3 | P106: -0.824655342249677 | Q106: 0.371358506695114 | R106: 3 | S106: -0.469322957287471 | T106: 0.484622455710095 | U106: 2
A107: 103 | B107: 'Maldives | C107: 'MDV | D107: -0.90877453388243 | E107: 0.360314615495306 | F107: 1 | G107: 0 | H107: 0 | I107: 0 | J107: 0 | K107: 0 | L107: 0 | M107: 0 | N107: 0 | O107: 0 | P107: 0 | Q107: 0 | R107: 0 | S107: 0 | T107: 0 | U107: 0
A108: 104 | B108: 'Mexico | C108: 'MEX | D108: -0.108366003217385 | E108: 0.251300233223489 | F108: 5 | G108: -0.352130524267135 | H108: 0.25228486761248 | I108: 6 | J108: 0.178865577914269 | K108: 0.233636532185851 | L108: 7 | M108: 0.607917311269194 | N108: 0.228760003290238 | O108: 6 | P108: -0.474099202173582 | Q108: 0.207737275615815 | R108: 8 | S108: -0.277126174657681 | T108: 0.196208208436663 | U108: 7
A109: 105 | B109: 'Macedonia, FYR | C109: 'MKD | D109: 0.0867107856585488 | E109: 0.291618285870453 | F109: 4 | G109: -0.399506627624894 | H109: 0.3059941916813 | I109: 3 | J109: -0.576447046200375 | K109: 0.270976120535647 | L109: 3 | M109: -0.31189210410696 | N109: 0.331945131197961 | O109: 2 | P109: -0.25634400865698 | Q109: 0.204206082056129 | R109: 4 | S109: -0.51713475864818 | T109: 0.200721296816824 | U109: 4
A110: 106 | B110: 'Mali | C110: 'MLI | D110: 0.415397145897372 | E110: 0.287283341236829 | F110: 3 | G110: -0.287150169282878 | H110: 0.373502182114371 | I110: 2 | J110: -0.0522807700002968 | K110: 0.510201183720256 | L110: 2 | M110: 0.28967691596475 | N110: 0.516616692692467 | O110: 3 | P110: -0.465449721365578 | Q110: 0.371358506695114 | R110: 3 | S110: -0.475850053176132 | T110: 0.484622455710095 | U110: 2
A111: 107 | B111: 'Malta | C111: 'MLT | D111: 1.41314228773965 | E111: 0.291377601755329 | F111: 2 | G111: 1.31795060989945 | H111: 0.412522842574475 | I111: 1 | J111: 0.628755392340877 | K111: 0.768168783719135 | L111: 1 | M111: 0.386406570983068 | N111: 0.519940958319459 | O111: 2 | P111: 0.863973821356254 | Q111: 0.443073362506416 | R111: 2 | S111: 0.497383118867935 | T111: 0.748674396199437 | U111: 1
A112: 108 | B112: 'Myanmar | C112: 'MMR | D112: -1.74774269698842 | E112: 0.254026944310672 | F112: 3 | G112: -0.967348724069481 | H112: 0.299881889042829 | I112: 3 | J112: -1.46134649771696 | K112: 0.319089592041234 | L112: 3 | M112: -1.01082662000589 | N112: 0.395254221998157 | O112: 3 | P112: -0.838802383628963 | Q112: 0.276349686366578 | R112: 4 | S112: -1.0957168092296 | T112: 0.267063170408295 | U112: 3
A113: 109 | B113: 'Mongolia | C113: 'MNG | D113: 0.84257225964418 | E113: 0.291377601755329 | F113: 3 | G113: 0.372137476593534 | H113: 0.412522842574475 | I113: 1 | J113: 0.0176893536491433 | K113: 0.385832817863489 | L113: 2 | M113: 0.170847773744373 | N113: 0.519940958319459 | O113: 2 | P113: 0.0391074659401654 | Q113: 0.317173634770438 | R113: 3 | S113: -0.145218536402699 | T113: 0.422055980592495 | U113: 2
A114: 110 | B114: 'Mozambique | C114: 'MOZ | D114: -0.172115426856135 | E114: 0.287283341236829 | F114: 3 | G114: -0.529018256033319 | H114: 0.335394653615951 | I114: 3 | J114: -0.330730753660258 | K114: 0.287765041908437 | L114: 4 | M114: -0.227406242340319 | N114: 0.331644165648542 | O114: 4 | P114: -1.04597350633428 | Q114: 0.362749628381543 | R114: 4 | S114: -0.534920127421431 | T114: 0.311180207053221 | U114: 3
A115: 111 | B115: 'Mauritania | C115: 'MRT | D115: -0.970906374812819 | E115: 0.360314615495306 | F115: 1 | G115: 0 | H115: 0 | I115: 0 | J115: 0 | K115: 0 | L115: 0 | M115: -0.84581743863525 | N115: 0.601880844424266 | O115: 1 | P115: -0.557835607429326 | Q115: 0.600583865212543 | R115: 1 | S115: 0 | T115: 0 | U115: 0
A116: 112 | B116: 'Martinique | C116: 'MTQ | D116: 0 | E116: 0 | F116: 0 | G116: 0 | H116: 0 | I116: 0 | J116: 0 | K116: 0 | L116: 0 | M116: 0 | N116: 0 | O116: 0 | P116: 0 | Q116: 0 | R116: 0 | S116: 0 | T116: 0 | U116: 0
A117: 113 | B117: 'Mauritius | C117: 'MUS | D117: 1.01165739258717 | E117: 0.291618285870453 | F117: 3 | G117: 1.14362291138471 | H117: 0.387413949132592 | I117: 3 | J117: 0.172173934684576 | K117: 0.267933040052607 | L117: 3 | M117: 0.217016209691449 | N117: 0.350213989902913 | O117: 3 | P117: 1.278924151795 | Q117: 0.31108529724681 | R117: 4 | S117: 0.336362976657675 | T117: 0.228431480219337 | U117: 3
A118: 114 | B118: 'Malawi | C118: 'MWI | D118: 0.0616839280764312 | E118: 0.251300233223489 | F118: 4 | G118: 0.0394278108631736 | H118: 0.294385303537927 | I118: 4 | J118: -0.624839919214108 | K118: 0.238874499151057 | L118: 5 | M118: 0.0808264782818315 | N118: 0.331644165648542 | O118: 4 | P118: -0.409023497718716 | Q118: 0.281106918332661 | R118: 5 | S118: -0.194532853097214 | T118: 0.22389713439489 | U118: 4
A119: 115 | B119: 'Malaysia | C119: 'MYS | D119: -0.143636505190229 | E119: 0.251300233223489 | F119: 6 | G119: 0.551872995359018 | H119: 0.25228486761248 | I119: 6 | J119: 0.714095825840174 | K119: 0.233636532185851 | L119: 7 | M119: 0.47682824778863 | N119: 0.228760003290238 | O119: 6 | P119: 0.83361529960969 | Q119: 0.207737275615815 | R119: 8 | S119: 0.633416075589183 | T119: 0.158656592213327 | U119: 8
A120: 116 | B120: 'Namibia | C120: 'NAM | D120: 0.473234571090547 | E120: 0.254026944310672 | F120: 3 | G120: 0.713864817416638 | H120: 0.312392788298483 | I120: 3 | J120: 0.0444111898597424 | K120: 0.25500473803749 | L120: 4 | M120: 0.266729898135636 | N120: 0.332518638661452 | O120: 3 | P120: 0.953679633980184 | Q120: 0.308643858391108 | R120: 4 | S120: 0.381908918699996 | T120: 0.239220980828307 | U120: 3
A121: 117 | B121: 'Niger | C121: 'NER | D121: -0.744074181443183 | E121: 0.291377601755329 | F121: 2 | G121: -0.762838285189527 | H121: 0.412522842574475 | I121: 1 | J121: -1.38661379239078 | K121: 0.768168783719135 | L121: 1 | M121: -0.523005244261551 | N121: 0.519940958319459 | O121: 2 | P121: -1.14386405716019 | Q121: 0.443073362506416 | R121: 2 | S121: -1.56681216585433 | T121: 0.748674396199437 | U121: 1
A122: 118 | B122: 'Nigeria | C122: 'NGA | D122: -1.23434445291552 | E122: 0.251300233223489 | F122: 4 | G122: -1.05448616372869 | H122: 0.265998113597101 | I122: 5 | J122: -1.32076744114904 | K122: 0.222481788006156 | L122: 6 | M122: -0.351599441735534 | N122: 0.291187323849693 | O122: 5 | P122: -1.0974759141194 | Q122: 0.253185404132827 | R122: 6 | S122: -0.953733958695286 | T122: 0.201802694826556 | U122: 6
A123: 119 | B123: 'Nicaragua | C123: 'NIC | D123: 0.0690101282391248 | E123: 0.254026944310672 | F123: 3 | G123: -0.323439752696792 | H123: 0.318733333730906 | I123: 3 | J123: -0.547167467529913 | K123: 0.374142364422074 | L123: 2 | M123: -0.102506725806526 | N123: 0.519940958319459 | O123: 2 | P123: -0.725780888564611 | Q123: 0.277567107731038 | R123: 4 | S123: -0.83610581602139 | T123: 0.248495031055375 | U123: 3
A124: 120 | B124: 'Netherlands | C124: 'NLD | D124: 1.60746069544825 | E124: 0.254026944310672 | F124: 4 | G124: 1.47887056135898 | H124: 0.263344534520094 | I124: 5 | J124: 2.03024130164716 | K124: 0.248661311888018 | L124: 6 | M124: 1.14098275720374 | N124: 0.2290464009857 | O124: 5 | P124: 1.58394112964466 | Q124: 0.218139839508948 | R124: 7 | S124: 2.02640726993069 | T124: 0.198055085748779 | U124: 7
A125: 121 | B125: 'Norway | C125: 'NOR | D125: 1.65378418755382 | E125: 0.254026944310672 | F125: 4 | G125: 1.41442831552291 | H125: 0.263344534520094 | I125: 5 | J125: 1.66621770442048 | K125: 0.248661311888018 | L125: 6 | M125: 0.932123586692143 | N125: 0.2290464009857 | O125: 5 | P125: 1.8333934496441 | Q125: 0.218139839508948 | R125: 7 | S125: 1.68654569036321 | T125: 0.198055085748779 | U125: 7
A126: 122 | B126: 'Nepal | C126: 'NPL | D126: 0.0473654633477931 | E126: 0.360314615495306 | F126: 1 | G126: 0 | H126: 0 | I126: 0 | J126: 0 | K126: 0 | L126: 0 | M126: -0.359786501997322 | N126: 0.601880844424266 | O126: 1 | P126: -0.557835607429326 | Q126: 0.600583865212543 | R126: 1 | S126: 0 | T126: 0 | U126: 0
A127: 123 | B127: 'New Zealand | C127: 'NZL | D127: 1.45700761057952 | E127: 0.254026944310672 | F127: 4 | G127: 1.41593941692657 | H127: 0.283550357121878 | I127: 4 | J127: 1.57128719735825 | K127: 0.266441748954348 | L127: 5 | M127: 1.2049273660644 | N127: 0.2290464009857 | O127: 5 | P127: 1.82400229050793 | Q127: 0.230041930929945 | R127: 6 | S127: 2.07494219661209 | T127: 0.200691571592182 | U127: 6
A128: 124 | B128: 'Oman | C128: 'OMN | D128: -0.570137420333985 | E128: 0.254026944310672 | F128: 3 | G128: 0.911738948904878 | H128: 0.299881889042829 | I128: 3 | J128: 0.899763885178803 | K128: 0.319089592041234 | L128: 3 | M128: 0.304968009876648 | N128: 0.395254221998157 | O128: 3 | P128: 1.07687370204345 | Q128: 0.276349686366578 | R128: 4 | S128: 0.483662685951545 | T128: 0.267063170408295 | U128: 3
A129: 125 | B129: 'Pakistan | C129: 'PAK | D129: -0.440532409731667 | E129: 0.254026944310672 | F129: 3 | G129: -0.654103845117085 | H129: 0.263344534520094 | I129: 5 | J129: -0.744444477215905 | K129: 0.259863410851066 | L129: 5 | M129: -0.197844781924927 | N129: 0.274543407726565 | O129: 4 | P129: -0.760364737093301 | Q129: 0.235420626980005 | R129: 6 | S129: -0.768792829664602 | T129: 0.215831312683427 | U129: 6
A130: 126 | B130: 'Panama | C130: 'PAN | D130: 0.664864094966925 | E130: 0.254026944310672 | F130: 3 | G130: 0.14854399580717 | H130: 0.299881889042829 | I130: 3 | J130: -0.27657204063012 | K130: 0.319089592041234 | L130: 3 | M130: 1.00170989596288 | N130: 0.395254221998157 | O130: 3 | P130: -0.391910923451687 | Q130: 0.276349686366578 | R130: 4 | S130: -0.458285420466015 | T130: 0.267063170408295 | U130: 3
A131: 127 | B131: 'Peru | C131: 'PER | D131: -0.687248844497834 | E131: 0.251300233223489 | F131: 4 | G131: -0.528960376577621 | H131: 0.25228486761248 | I131: 6 | J131: 0.173464601067724 | K131: 0.242854244904284 | L131: 6 | M131: 0.66871539911413 | N131: 0.274050600863496 | O131: 5 | P131: -0.521658317124789 | Q131: 0.222494499215453 | R131: 7 | S131: -0.199522749648413 | T131: 0.213447405424417 | U131: 6
A132: 128 | B132: 'Philippines | C132: 'PHL | D132: 0.613543553097143 | E132: 0.254026944310672 | F132: 5 | G132: 0.272942744914495 | H132: 0.263344534520094 | I132: 5 | J132: 0.126460498185185 | K132: 0.248661311888018 | L132: 6 | M132: 0.565344236519552 | N132: 0.2290464009857 | O132: 5 | P132: -0.0776584496113575 | Q132: 0.218139839508948 | R132: 7 | S132: -0.228090352954265 | T132: 0.163839744115479 | U132: 7
A133: 129 | B133: 'Papua New Guinea | C133: 'PNG | D133: 0.121007859483297 | E133: 0.254026944310672 | F133: 3 | G133: -0.397664515902837 | H133: 0.342482293230127 | I133: 2 | J133: -0.694273918478437 | K133: 0.374142364422074 | L133: 2 | M133: -0.128749806963586 | N133: 0.519940958319459 | O133: 2 | P133: -0.306877789041285 | Q133: 0.313894625236573 | R133: 3 | S133: -0.853671906541236 | T133: 0.296106941830424 | U133: 2
A134: 130 | B134: 'Poland | C134: 'POL | D134: 1.07014358340954 | E134: 0.251300233223489 | F134: 6 | G134: 0.836791140264526 | H134: 0.215915139092969 | I134: 7 | J134: 0.674021919164688 | K134: 0.206979294668072 | L134: 8 | M134: 0.564949864064824 | N134: 0.191964544754769 | O134: 7 | P134: 0.537888231756196 | Q134: 0.160250557094621 | R134: 10 | S134: 0.491902775589186 | T134: 0.162862701383401 | U134: 9
A135: 131 | B135: 'Puerto Rico | C135: 'PRI | D135: 0 | E135: 0 | F135: 0 | G135: 0.759606031110221 | H135: 0.527464842044443 | I135: 1 | J135: 1.26394891750683 | K135: 0.521450412242603 | L135: 1 | M135: 0.844876546450516 | N135: 0.519740236219196 | O135: 1 | P135: 0.771181294397462 | Q135: 0.503468080455097 | R135: 1 | S135: 1.11804282172941 | T135: 0.525909748715309 | U135: 1
A136: 132 | B136: 'Korea, Dem. Rep. | C136: 'PRK | D136: -1.78867831057335 | E136: 0.291377601755329 | F136: 2 | G136: 0.372137476593534 | H136: 0.412522842574475 | I136: 1 | J136: -0.301415001757019 | K136: 0.768168783719135 | L136: 1 | M136: -1.40086444308209 | N136: 0.519940958319459 | O136: 2 | P136: -0.667168388724308 | Q136: 0.443073362506416 | R136: 2 | S136: -0.534714525041343 | T136: 0.748674396199437 | U136: 1
A137: 133 | B137: 'Portugal | C137: 'PRT | D137: 1.47928754869514 | E137: 0.251300233223489 | F137: 5 | G137: 1.38507709094387 | H137: 0.25228486761248 | I137: 6 | J137: 1.1512038694785 | K137: 0.233636532185851 | L137: 7 | M137: 0.889263512052202 | N137: 0.228760003290238 | O137: 6 | P137: 1.08332521365065 | Q137: 0.207737275615815 | R137: 8 | S137: 1.21790710902785 | T137: 0.189092987537097 | U137: 8
A138: 134 | B138: 'Paraguay | C138: 'PRY | D138: -0.419146936279834 | E138: 0.251300233223489 | F138: 4 | G138: -0.570930277426562 | H138: 0.319152876161049 | I138: 3 | J138: -1.10015500054096 | K138: 0.328076692774937 | L138: 3 | M138: 0.369651533683329 | N138: 0.516616692692467 | O138: 3 | P138: -0.695470957967884 | Q138: 0.285056666814727 | R138: 4 | S138: -0.958370418014881 | T138: 0.268423788960137 | U138: 3
A139: 135 | B139: 'Qatar | C139: 'QAT | D139: -0.775492422458551 | E139: 0.254026944310672 | F139: 3 | G139: 1.38266137951045 | H139: 0.299881889042829 | I139: 3 | J139: 0.479823413121786 | K139: 0.319089592041234 | L139: 3 | M139: 0.326586360775386 | N139: 0.395254221998157 | O139: 3 | P139: 1.2693962872618 | Q139: 0.276349686366578 | R139: 4 | S139: 0.57025621375922 | T139: 0.267063170408295 | U139: 3
A140: 136 | B140: 'Reunion | C140: 'REU | D140: 0 | E140: 0 | F140: 0 | G140: 0 | H140: 0 | I140: 0 | J140: 0 | K140: 0 | L140: 0 | M140: 0 | N140: 0 | O140: 0 | P140: 0 | Q140: 0 | R140: 0 | S140: 0 | T140: 0 | U140: 0
A141: 137 | B141: 'Romania | C141: 'ROM | D141: 0.405795677355303 | E141: 0.254026944310672 | F141: 4 | G141: 0.0236853002309497 | H141: 0.243549981714305 | I141: 4 | J141: -0.569548709641687 | K141: 0.259550680503314 | L141: 4 | M141: 0.199331981238641 | N141: 0.263261256825197 | O141: 4 | P141: -0.0876396605455846 | Q141: 0.186137681288291 | R141: 6 | S141: -0.457048134497524 | T141: 0.189872273333828 | U141: 6
A142: 138 | B142: 'Russian Federation | C142: 'RUS | D142: -0.311268438016976 | E142: 0.251300233223489 | F142: 6 | G142: -0.685958851594691 | H142: 0.215915139092969 | I142: 7 | J142: -0.594515262297797 | K142: 0.206979294668072 | L142: 8 | M142: -0.303054462135123 | N142: 0.191964544754769 | O142: 7 | P142: -0.722361502181206 | Q142: 0.160250557094621 | R142: 10 | S142: -0.616417924679094 | T142: 0.158724276475048 | U142: 10
A143: 139 | B143: 'Rwanda | C143: 'RWA | D143: -1.17456074368758 | E143: 0.360314615495306 | F143: 1 | G143: 0 | H143: 0 | I143: 0 | J143: 0 | K143: 0 | L143: 0 | M143: -1.16983806176445 | N143: 0.601880844424266 | O143: 1 | P143: -1.2036375560024 | Q143: 0.600583865212543 | R143: 1 | S143: 0 | T143: 0 | U143: 0
A144: 140 | B144: 'Saudi Arabia | C144: 'SAU | D144: -1.10306250978148 | E144: 0.254026944310672 | F144: 3 | G144: 0.238920727893909 | H144: 0.276271366742878 | I144: 4 | J144: -0.348761573265872 | K144: 0.289789143823299 | L144: 4 | M144: -0.148667465205172 | N144: 0.395254221998157 | O144: 3 | P144: 0.493590938981869 | Q144: 0.256388157194472 | R144: 5 | S144: -0.575351184382464 | T144: 0.260942877169474 | U144: 4
A145: 141 | B145: 'Sudan | C145: 'SDN | D145: -1.49805561873747 | E145: 0.254026944310672 | F145: 3 | G145: -1.73199293064119 | H145: 0.342482293230127 | I145: 2 | J145: -1.69749819831693 | K145: 0.374142364422074 | L145: 2 | M145: -0.827912363895414 | N145: 0.519940958319459 | O145: 2 | P145: -1.34612983165983 | Q145: 0.313894625236573 | R145: 3 | S145: -1.0151196581536 | T145: 0.296106941830424 | U145: 2
A146: 142 | B146: 'Senegal | C146: 'SEN | D146: -0.291712884150454 | E146: 0.251300233223489 | F146: 4 | G146: -0.871258175856565 | H146: 0.319152876161049 | I146: 3 | J146: 0.0473931440296811 | K146: 0.286401829836332 | L146: 4 | M146: -0.337690859198066 | N146: 0.516616692692467 | O146: 3 | P146: -0.097340965303572 | Q146: 0.285056666814727 | R146: 4 | S146: -0.23549296752031 | T146: 0.268423788960137 | U146: 3
A147: 143 | B147: 'Singapore | C147: 'SGP | D147: 0.0398072683778496 | E147: 0.251300233223489 | F147: 6 | G147: 1.38589146288798 | H147: 0.25228486761248 | I147: 6 | J147: 2.08219811627607 | K147: 0.233636532185851 | L147: 7 | M147: 1.24477757685123 | N147: 0.228760003290238 | O147: 6 | P147: 1.93903449251869 | Q147: 0.207737275615815 | R147: 8 | S147: 1.94750601272155 | T147: 0.158656592213327 | U147: 8
A148: 144 | B148: 'Solomon Islands | C148: 'SLB | D148: 1.17264213728559 | E148: 0.360314615495306 | F148: 1 | G148: 0 | H148: 0 | I148: 0 | J148: 0 | K148: 0 | L148: 0 | M148: 0 | N148: 0 | O148: 0 | P148: 0 | Q148: 0 | R148: 0 | S148: 0 | T148: 0 | U148: 0
A149: 145 | B149: 'Sierra Leone | C149: 'SLE | D149: -1.62336683417428 | E149: 0.291377601755329 | F149: 2 | G149: -1.5194887945582 | H149: 0.412522842574475 | I149: 1 | J149: 0.00864179875606756 | K149: 0.768168783719135 | L149: 1 | M149: -1.5008318425718 | N149: 0.519940958319459 | O149: 2 | P149: -0.905516222942246 | Q149: 0.443073362506416 | R149: 2 | S149: -0.0186657030867037 | T149: 0.748674396199437 | U149: 1
A150: 146 | B150: 'El Salvador | C150: 'SLV | D150: -0.100189765858663 | E150: 0.254026944310672 | F150: 3 | G150: -0.0212178785543271 | H150: 0.318733333730906 | I150: 3 | J150: -0.261794858747202 | K150: 0.374142364422074 | L150: 2 | M150: 1.23271314972064 | N150: 0.519940958319459 | O150: 2 | P150: -0.656364671443548 | Q150: 0.277567107731038 | R150: 4 | S150: -0.353565539174854 | T150: 0.223471923841265 | U150: 4
A151: 147 | B151: 'Somalia | C151: 'SOM | D151: -1.69387149024054 | E151: 0.291377601755329 | F151: 2 | G151: -1.70865142303535 | H151: 0.412522842574475 | I151: 1 | J151: -1.69667059290386 | K151: 0.768168783719135 | L151: 1 | M151: -1.76887680212462 | N151: 0.519940958319459 | O151: 2 | P151: -1.49534623770841 | Q151: 0.443073362506416 | R151: 2 | S151: -1.05076334389969 | T151: 0.748674396199437 | U151: 1
A152: 148 | B152: 'Sao Tome and Principe | C152: 'STP | D152: 0.820561703275659 | E152: 0.360314615495306 | F152: 1 | G152: 0 | H152: 0 | I152: 0 | J152: 0 | K152: 0 | L152: 0 | M152: 0 | N152: 0 | O152: 0 | P152: 0 | Q152: 0 | R152: 0 | S152: 0 | T152: 0 | U152: 0
A153: 149 | B153: 'Suriname | C153: 'SUR | D153: 0.282616031256599 | E153: 0.291377601755329 | F153: 2 | G153: -0.195350404297996 | H153: 0.412522842574475 | I153: 1 | J153: -0.146386601500475 | K153: 0.768168783719135 | L153: 1 | M153: -0.586110485499659 | N153: 0.519940958319459 | O153: 2 | P153: -0.729775132668132 | Q153: 0.443073362506416 | R153: 2 | S153: -0.0186657030867037 | T153: 0.748674396199437 | U153: 1
A154: 150 | B154: 'Slovak Republic | C154: 'SVK | D154: 0.737756159452064 | E154: 0.251300233223489 | F154: 5 | G154: 0.650341816245362 | H154: 0.226638715425976 | I154: 6 | J154: -0.0317541589295773 | K154: 0.224214871460886 | L154: 6 | M154: 0.167604633115238 | N154: 0.216459376181894 | O154: 6 | P154: 0.13405598739383 | Q154: 0.171877697140126 | R154: 8 | S154: 0.0300883597642541 | T154: 0.174052621287161 | U154: 7
A155: 151 | B155: 'Slovenia | C155: 'SVN | D155: 1.06635863896693 | E155: 0.254026944310672 | F155: 4 | G155: 1.09304203462571 | H155: 0.243549981714305 | I155: 4 | J155: 0.567266812903442 | K155: 0.259550680503314 | L155: 4 | M155: 0.531546614217464 | N155: 0.263261256825197 | O155: 4 | P155: 0.825483463198006 | Q155: 0.186137681288291 | R155: 6 | S155: 1.02280597660634 | T155: 0.213605268344477 | U155: 4
A156: 152 | B156: 'Sweden | C156: 'SWE | D156: 1.62804891519125 | E156: 0.254026944310672 | F156: 4 | G156: 1.41091877442809 | H156: 0.263344534520094 | I156: 5 | J156: 1.57280301340948 | K156: 0.248661311888018 | L156: 6 | M156: 0.852943314200198 | N156: 0.2290464009857 | O156: 5 | P156: 1.62303248246947 | Q156: 0.218139839508948 | R156: 7 | S156: 2.08533689883049 | T156: 0.198055085748779 | U156: 7
A157: 153 | B157: 'Swaziland | C157: 'SWZ | D157: -0.777607314830853 | E157: 0.360314615495306 | F157: 1 | G157: -1.69422455002844 | H157: 0.606177135766502 | I157: 1 | J157: -0.474073998367403 | K157: 0.329075950105893 | L157: 2 | M157: 0.293821058819223 | N157: 0.351244204676472 | O157: 2 | P157: -0.0621685988459257 | Q157: 0.56608033832539 | R157: 2 | S157: 0.00718674302694898 | T157: 0.376110791704214 | U157: 1
A158: 154 | B158: 'Syrian Arab Republic | C158: 'SYR | D158: -1.35777091688175 | E158: 0.254026944310672 | F158: 3 | G158: 0.0833327217237797 | H158: 0.299881889042829 | I158: 3 | J158: -1.180886981196 | K158: 0.319089592041234 | L158: 3 | M158: -0.91532426663525 | N158: 0.395254221998157 | O158: 3 | P158: -0.290813878387835 | Q158: 0.276349686366578 | R158: 4 | S158: -0.788757947034985 | T158: 0.267063170408295 | U158: 3
A159: 155 | B159: 'Chad | C159: 'TCD | D159: -0.853690984863516 | E159: 0.352657522321209 | F159: 2 | G159: -0.735985741633003 | H159: 0.660536144392275 | I159: 1 | J159: -0.71436849482699 | K159: 0.563707566872499 | L159: 1 | M159: -0.739582848517709 | N159: 0.596740942900482 | O159: 2 | P159: -0.826920298704951 | Q159: 0.450388515286507 | R159: 2 | S159: -0.587007972077252 | T159: 0.536534704411876 | U159: 1
A160: 156 | B160: 'Togo | C160: 'TGO | D160: -1.05109111615494 | E160: 0.287283341236829 | F160: 3 | G160: -0.905683022048791 | H160: 0.373502182114371 | I160: 2 | J160: -0.374255414372595 | K160: 0.510201183720256 | L160: 2 | M160: -0.852876832111305 | N160: 0.516616692692467 | O160: 3 | P160: -0.799385165309277 | Q160: 0.371358506695114 | R160: 3 | S160: -0.242091481060323 | T160: 0.484622455710095 | U160: 2
A161: 157 | B161: 'Thailand | C161: 'THA | D161: 0.215389502895861 | E161: 0.251300233223489 | F161: 6 | G161: 0.246117800607383 | H161: 0.25228486761248 | I161: 6 | J161: 0.00976761697215778 | K161: 0.233636532185851 | L161: 7 | M161: 0.192167925497308 | N161: 0.228760003290238 | O161: 6 | P161: 0.41306970156076 | Q161: 0.207737275615815 | R161: 8 | S161: -0.164791577043247 | T161: 0.158656592213327 | U161: 8
A162: 158 | B162: 'Tajikistan | C162: 'TJK | D162: -1.56461063224691 | E162: 0.360314615495306 | F162: 2 | G162: -1.86227150484566 | H162: 0.327330708514643 | I162: 2 | J162: -1.42259787735938 | K162: 0.339023737174356 | L162: 2 | M162: -1.51955194295233 | N162: 0.272265955073957 | O162: 3 | P162: -1.33489283098392 | Q162: 0.215738306159556 | R162: 4 | S162: -1.31577594123635 | T162: 0.25531057815317 | U162: 3
A163: 159 | B163: 'Turkmenistan | C163: 'TKM | D163: -1.45070225927893 | E163: 0.360314615495306 | F163: 2 | G163: 0.00383345427402071 | H163: 0.327330708514643 | I163: 2 | J163: -1.25225793116026 | K163: 0.339023737174356 | L163: 2 | M163: -1.93119027906379 | N163: 0.272265955073957 | O163: 3 | P163: -0.971386433629754 | Q163: 0.215738306159556 | R163: 4 | S163: -1.28933349521853 | T163: 0.25531057815317 | U163: 3
A164: 160 | B164: 'Trinidad and Tobago& Tob* | C164: 'TTO | D164: 0.953249161871283 | E164: 0.254026944310672 | F164: 3 | G164: 0.315271582883894 | H164: 0.342482293230127 | I164: 2 | J164: 0.520769745992462 | K164: 0.374142364422074 | L164: 2 | M164: 0.717556771773991 | N164: 0.519940958319459 | O164: 2 | P164: 0.514036739846888 | Q164: 0.313894625236573 | R164: 3 | S164: 0.51051523437966 | T164: 0.296106941830424 | U164: 2
A165: 161 | B165: 'Tunisia | C165: 'TUN | D165: -0.588608494629428 | E165: 0.254026944310672 | F165: 3 | G165: 0.660977420127173 | H165: 0.279058457436991 | I165: 4 | J165: 0.63287580631365 | K165: 0.235337708537315 | L165: 5 | M165: 0.429005707756956 | N165: 0.291778685386365 | O165: 4 | P165: 0.647648078737007 | Q165: 0.272746442471847 | R165: 5 | S165: 0.0200119498982371 | T165: 0.223105684616046 | U165: 4
A166: 162 | B166: 'Turkey | C166: 'TUR | D166: -0.859278164874458 | E166: 0.251300233223489 | F166: 5 | G166: -0.943756823086023 | H166: 0.25228486761248 | I166: 6 | J166: -0.412272104977834 | K166: 0.233636532185851 | L166: 7 | M166: 0.594919239239568 | N166: 0.228760003290238 | O166: 6 | P166: -0.0104240092107967 | Q166: 0.207737275615815 | R166: 8 | S166: -0.348869934892435 | T166: 0.189092987537097 | U166: 8
A167: 163 | B167: 'Taiwan, China | C167: 'TWN | D167: 0.706190537308272 | E167: 0.254026944310672 | F167: 5 | G167: 0.938533262443574 | H167: 0.263344534520094 | I167: 5 | J167: 1.29366411013441 | K167: 0.248661311888018 | L167: 6 | M167: 0.828611302042961 | N167: 0.2290464009857 | O167: 5 | P167: 0.92814257216133 | Q167: 0.218139839508948 | R167: 7 | S167: 0.625692771385888 | T167: 0.159628305336241 | U167: 8
A168: 164 | B168: 'Tanzania | C168: 'TZA | D168: -0.283456700998943 | E168: 0.251300233223489 | F168: 4 | G168: 0.565492677667766 | H168: 0.265998113597101 | I168: 5 | J168: -0.485337284734686 | K168: 0.222481788006156 | L168: 6 | M168: 0.182648722239971 | N168: 0.291187323849693 | O168: 5 | P168: 0.160842662764519 | Q168: 0.253185404132827 | R168: 6 | S168: -0.923867278329055 | T168: 0.210520528590018 | U168: 5
A169: 165 | B169: 'Uganda | C169: 'UGA | D169: -0.517212047200734 | E169: 0.251300233223489 | F169: 4 | G169: -0.980393955329381 | H169: 0.265998113597101 | I169: 5 | J169: -0.250578985761329 | K169: 0.222481788006156 | L169: 6 | M169: 0.183559623630412 | N169: 0.291187323849693 | O169: 5 | P169: -0.0133197381046215 | Q169: 0.253185404132827 | R169: 6 | S169: -0.465943384422014 | T169: 0.210520528590018 | U169: 5
A170: 166 | B170: 'Ukraine | C170: 'UKR | D170: -0.00841138129523557 | E170: 0.251300233223489 | F170: 5 | G170: -0.242016887073169 | H170: 0.215915139092969 | I170: 7 | J170: -0.892908454140725 | K170: 0.213306654137658 | L170: 7 | M170: -0.720829281079128 | N170: 0.216459376181894 | O170: 6 | P170: -0.707456079733274 | Q170: 0.166739615872681 | R170: 9 | S170: -0.891655368076545 | T170: 0.16744402822474 | U170: 9
A171: 167 | B171: 'Uruguay | C171: 'URY | D171: 0.769796605028736 | E171: 0.254026944310672 | F171: 3 | G171: 0.3479364852872 | H171: 0.299881889042829 | I171: 3 | J171: 0.617792507286911 | K171: 0.319089592041234 | L171: 3 | M171: 0.948776369974243 | N171: 0.395254221998157 | O171: 3 | P171: 0.269805905934289 | Q171: 0.276349686366578 | R171: 4 | S171: 0.429615122038856 | T171: 0.24990333019781 | U171: 4
A172: 168 | B172: 'United States | C172: 'USA | D172: 1.50469827100937 | E172: 0.251300233223489 | F172: 6 | G172: 1.09598873352739 | H172: 0.25228486761248 | I172: 6 | J172: 1.36585101550103 | K172: 0.233636532185851 | L172: 7 | M172: 1.13507456869419 | N172: 0.228760003290238 | O172: 6 | P172: 1.2541184418853 | Q172: 0.207737275615815 | R172: 8 | S172: 1.40683755002975 | T172: 0.196208208436663 | U172: 7
A173: 169 | B173: 'Uzbekistan | C173: 'UZB | D173: -1.3433286807786 | E173: 0.291618285870453 | F173: 4 | G173: -0.332942614978988 | H173: 0.274469070429637 | I173: 4 | J173: -1.30482573679805 | K173: 0.247715659528938 | L173: 4 | M173: -1.39782244209647 | N173: 0.271785289504675 | O173: 4 | P173: -0.869599725276197 | Q173: 0.186669181543715 | R173: 6 | S173: -0.963253322227625 | T173: 0.190914026264653 | U173: 5
A174: 170 | B174: 'Venezuela, RB | C174: 'VEN | D174: 0.179080243304874 | E174: 0.251300233223489 | F174: 5 | G174: -0.249835470973892 | H174: 0.25228486761248 | I174: 6 | J174: -0.849207976650781 | K174: 0.233636532185851 | L174: 7 | M174: 0.0895074024329068 | N174: 0.228760003290238 | O174: 6 | P174: -0.661557827384745 | Q174: 0.207737275615815 | R174: 8 | S174: -0.724885762501634 | T174: 0.196208208436663 | U174: 7
A175: 171 | B175: 'Vietnam | C175: 'VNM | D175: -1.41570274439784 | E175: 0.254026944310672 | F175: 4 | G175: 0.653299534413648 | H175: 0.263344534520094 | I175: 5 | J175: -0.29986293839708 | K175: 0.259863410851066 | L175: 5 | M175: -0.458793311681152 | N175: 0.274543407726565 | O175: 4 | P175: -0.436516959441859 | Q175: 0.235420626980005 | R175: 6 | S175: -0.331907448918534 | T175: 0.173483069998777 | U175: 6
A176: 172 | B176: 'West Bank and Gaza | C176: 'WTB | D176: -0.131552876541751 | E176: 0.864476175735898 | F176: 1 | G176: 0.111165671228262 | H176: 0.660536144392275 | I176: 1 | J176: -0.0887164917796225 | K176: 0.563707566872499 | L176: 1 | M176: -0.161820882930699 | N176: 0.97694373036538 | O176: 1 | P176: 1.221594661877 | Q176: 0.562777653991577 | R176: 1 | S176: 0.362603232869128 | T176: 0.536534704411876 | U176: 1
A177: 173 | B177: 'Yemen, Rep. | C177: 'YEM | D177: -0.414687285701034 | E177: 0.254026944310672 | F177: 3 | G177: -1.47123016529754 | H177: 0.342482293230127 | I177: 2 | J177: -0.620720692562856 | K177: 0.374142364422074 | L177: 2 | M177: -0.523005244261551 | N177: 0.519940958319459 | O177: 2 | P177: -1.00816573800337 | Q177: 0.313894625236573 | R177: 3 | S177: -0.853671906541236 | T177: 0.296106941830424 | U177: 2
A178: 174 | B178: 'Yugoslavia, FR (Serbia/Montenegro) | C178: 'YUG | D178: -0.919759959948295 | E178: 0.254026944310672 | F178: 4 | G178: -1.41949950008468 | H178: 0.264772723738274 | I178: 3 | J178: -0.953271094717348 | K178: 0.286693280149147 | L178: 3 | M178: -1.53893544215682 | N178: 0.718213521236258 | O178: 1 | P178: -0.806487256288169 | Q178: 0.203510854019427 | R178: 4 | S178: -0.994523144450128 | T178: 0.199511651995437 | U178: 5
A179: 175 | B179: 'South Africa | C179: 'ZAF | D179: 0.991272803628619 | E179: 0.251300233223489 | F179: 5 | G179: -0.526791813530419 | H179: 0.239504975394109 | I179: 7 | J179: -0.00982379588119348 | K179: 0.205613610772014 | L179: 8 | M179: 0.243616704722545 | N179: 0.202219726598532 | O179: 7 | P179: -0.351418352832009 | Q179: 0.206193595572351 | R179: 9 | S179: 0.29886445016777 | T179: 0.171406906025575 | U179: 9
A180: 176 | B180: 'Congo, Dem. Rep. | C180: 'ZAR | D180: -1.56746239781784 | E180: 0.291377601755329 | F180: 2 | G180: -2.58639725405087 | H180: 0.343592114506085 | I180: 2 | J180: -1.76905300575076 | K180: 0.478235957625145 | L180: 2 | M180: -2.34041786848463 | N180: 0.395254221998157 | O180: 3 | P180: -2.15252348054339 | Q180: 0.352695557586314 | R180: 3 | S180: -1.55598351314371 | T180: 0.476749967242003 | U180: 2
A181: 177 | B181: 'Zambia | C181: 'ZMB | D181: -0.0455865441997576 | E181: 0.251300233223489 | F181: 4 | G181: -0.00178185104964755 | H181: 0.265998113597101 | I181: 5 | J181: -0.398935539100722 | K181: 0.222481788006156 | L181: 6 | M181: 0.251858856010122 | N181: 0.291187323849693 | O181: 5 | P181: -0.401677758732015 | Q181: 0.253185404132827 | R181: 6 | S181: -0.614279117845522 | T181: 0.210520528590018 | U181: 5
A182: 178 | B182: 'Zimbabwe | C182: 'ZWE | D182: -0.665627449454788 | E182: 0.251300233223489 | F182: 4 | G182: -0.541507052100545 | H182: 0.269879776011692 | I182: 5 | J182: -1.12916573448837 | K182: 0.222481788006156 | L182: 6 | M182: -0.340996219315364 | N182: 0.231496316941685 | O182: 6 | P182: -0.145677537993965 | Q182: 0.232933851077791 | R182: 7 | S182: -0.318733410145107 | T182: 0.184601980331938 | U182: 7

Sheet: OneCountryData
B2: 'DO NOT EDIT/CHANGE THIS CELL!!! | L2: 1 | O2: 1 | P2: 2 | Q2: 3 | R2: 4 | S2: 5 | T2: 6 | U2: 7 | V2: 8 | W2: 9 | X2: 10 | Y2: 11 | Z2: 12 | AA2: 13 | AB2: 14 | AC2: 15 | AD2: 16 | AE2: 17 | AF2: 18 | AG2: 19
P3: 'Voice and Accountability | Q3: 'Political Instability and Violence | R3: 'Government Effectiveness | S3: 'Regulatory Burden | T3: 'Rule of Law | U3: 'Graft | V3: 'Voice and Accountability | W3: 'Political Instability and Violence | X3: 'Government Effectiveness | Y3: 'Regulatory Burden | Z3: 'Rule of Law | AA3: 'Graft | AB3: 'Voice and Accountability | AC3: 'Political Instability and Violence | AD3: 'Government Effectiveness | AE3: 'Regulatory Burden | AF3: 'Rule of Law | AG3: 'Graft
A4: 'Country code | B4: =IF(EQUAL(OneCountryCharts!R[+13]C[+4], ""), VLOOKUP(OneCountryCharts!R[+7]C[+4], OneCountryData!R[+1]C[+11]:R[+183]C[+13], 3), VLOOKUP(OneCountryCharts!R[+13]C[+4], OneCountryData!R[+1]C[+11]:R[+183]C[+13], 3)) -> #NA | C4: 'Estimate | D4: 'Upperbound | E4: 'Lowerbound | P4: 'Estimate | Q4: 'Estimate | R4: 'Estimate | S4: 'Estimate | T4: 'Estimate | U4: 'Estimate | V4: 'Upperbound | W4: 'Upperbound | X4: 'Upperbound | Y4: 'Upperbound | Z4: 'Upperbound | AA4: 'Upperbound | AB4: 'Lowerbound | AC4: 'Lowerbound | AD4: 'Lowerbound | AE4: 'Lowerbound | AF4: 'Lowerbound | AG4: 'Lowerbound | AJ4: 'EE/FSU | AK4: 'ASI | AL4: 'AFR | AM4: 'LAC | AN4: 'OECD
A5: 'Country | B5: =VLOOKUP(R[-1]C, R5C12:R187C13, 2) -> #NA | C5: =R5C2 -> #NA | D5: =RC[-1] -> #NA | E5: =RC[-1] -> #NA | F5: 'Estimate | G5: 'Upperbound | H5: 'Lowerbound | I5: '90%CI-low | J5: '90%CI-high | L5: 'AFG | M5: 'Afghanistan | N5: 1 | O5: 'AFG | P5: 2.906976744186 | Q5: 0 | R5: 0 | S5: 0 | T5: 0 | U5: 0 | V5: 19.6531791907514 | W5: 0 | X5: 0 | Y5: 0 | Z5: 0 | AA5: 0 | AB5: 0 | AC5: 0 | AD5: 0 | AE5: 0 | AF5: 0 | AG5: 0 | AI5: 'Afghanistan | AJ5: 0 | AK5: 1 | AL5: 0 | AM5: 0 | AN5: 0
A6: 2 | B6: 'Voice and Accountability | C6: =IF(EQUAL(RC[+3], ".."), "", RC[+3]) -> #NA | D6: =IF(EQUAL(RC[+3], ".."), "", RC[+3]) -> #NA | E6: =IF(EQUAL(RC[+3], ".."), "", RC[+3]) -> #NA | F6: =VLOOKUP(R4C2, R5C15:R187C33, OneCountryData!RC1) -> #NA | G6: =IF(EQUAL(RC[-1], ".."), "..", VLOOKUP(R4C2, R5C15:R187C33, OneCountryData!RC1+6)-RC[-1]) -> #NA | H6: =IF(EQUAL(RC[-2], ".."), "..", RC[-2]-VLOOKUP(R4C2, R5C15:R187C33, OneCountryData!RC1+12)) -> #NA | I6: =MAX(RC[-6]-RC[-4], 0) -> #NA | J6: =MIN(RC[-7]+RC[-6], 100) -> #NA | L6: 'AGO | M6: 'Angola | N6: 1 | O6: 'AGO | P6: 15.6976744186047 | Q6: 3.2467532467532 | R6: 3.8709677419354 | S6: 20.6060606060606 | T6: 5.4545454545454 | U6: 14.9350649350649 | V6: 35.2601156069364 | W6: 10.3225806451613 | X6: 12.8205128205128 | Y6: 35.5421686746988 | Z6: 28.3132530120482 | AA6: 39.3548387096774 | AB6: 4.6242774566474 | AC6: 1.29032258064516 | AD6: 0.641025641025641 | AE6: 8.43373493975904 | AF6: 1.20481927710843 | AG6: 1.93548387096774 | AI6: 'Angola | AJ6: 0 | AK6: 0 | AL6: 1 | AM6: 0 | AN6: 0
A7: 3 | B7: 'Political Stability | C7: =IF(EQUAL(RC[+3], ".."), "", RC[+3]) -> #NA | D7: =IF(EQUAL(RC[+3], ".."), "", RC[+3]) -> #NA | E7: =IF(EQUAL(RC[+3], ".."), "", RC[+3]) -> #NA | F7: =VLOOKUP(R4C2, R5C15:R187C33, OneCountryData!RC1) -> #NA | G7: =IF(EQUAL(RC[-1], ".."), "..", VLOOKUP(R4C2, R5C15:R187C33, OneCountryData!RC1+6)-RC[-1]) -> #NA | H7: =IF(EQUAL(RC[-2], ".."), "..", RC[-2]-VLOOKUP(R4C2, R5C15:R187C33, OneCountryData!RC1+12)) -> #NA | I7: =MAX(RC[-6]-RC[-4], 0) -> #NA | J7: =MIN(RC[-7]+RC[-6], 100) -> #NA | L7: 'ALB | M7: 'Albania | N7: 1 | O7: 'ALB | P7: 53.4883720930233 | Q7: 14.2857142857143 | R7: 21.9354838709677 | S7: 21.2121212121212 | T7: 15.7575757575758 | U7: 8.4415584415584 | V7: 67.6300578034682 | W7: 29.6774193548387 | X7: 50.6410256410256 | Y7: 33.1325301204819 | Z7: 32.5301204819277 | AA7: 32.9032258064516 | AB7: 31.2138728323699 | AC7: 7.74193548387097 | AD7: 8.33333333333333 | AE7: 10.2409638554217 | AF7: 4.81927710843374 | AG7: 1.29032258064516 | AI7: 'Albania | AJ7: 1 | AK7: 0 | AL7: 0 | AM7: 0 | AN7: 0
A8: 4 | B8: 'Government Effectiveness | C8: =IF(EQUAL(RC[+3], ".."), "", RC[+3]) -> #NA | D8: =IF(EQUAL(RC[+3], ".."), "", RC[+3]) -> #NA | E8: =IF(EQUAL(RC[+3], ".."), "", RC[+3]) -> #NA | F8: =VLOOKUP(R4C2, R5C15:R187C33, OneCountryData!RC1) -> #NA | G8: =IF(EQUAL(RC[-1], ".."), "..", VLOOKUP(R4C2, R5C15:R187C33, OneCountryData!RC1+6)-RC[-1]) -> #NA | H8: =IF(EQUAL(RC[-2], ".."), "..", RC[-2]-VLOOKUP(R4C2, R5C15:R187C33, OneCountryData!RC1+12)) -> #NA | I8: =MAX(RC[-6]-RC[-4], 0) -> #NA | J8: =MIN(RC[-7]+RC[-6], 100) -> #NA | L8: 'ARE | M8: 'United Arab Emirates | N8: 1 | O8: 'ARE | P8: 33.7209302325581 | Q8: 79.8701298701299 | R8: 63.2258064516129 | S8: 60.6060606060606 | T8: 75.7575757575758 | U8: 57.7922077922078 | V8: 50.8670520231214 | W8: 96.1290322580645 | X8: 81.4102564102564 | Y8: 94.5783132530121 | Z8: 89.1566265060241 | AA8: 72.9032258064516 | AB8: 15.028901734104 | AC8: 58.7096774193548 | AD8: 32.0512820512821 | AE8: 24.6987951807229 | AF8: 62.0481927710843 | AG8: 30.9677419354839 | AI8: 'United Arab Emirates | AJ8: 0 | AK8: 1 | AL8: 0 | AM8: 0 | AN8: 0
A9: 5 | B9: 'Lack of Regulatory Burden | C9: =IF(EQUAL(RC[+3], ".."), "", RC[+3]) -> #NA | D9: =IF(EQUAL(RC[+3], ".."), "", RC[+3]) -> #NA | E9: =IF(EQUAL(RC[+3], ".."), "", RC[+3]) -> #NA | F9: =VLOOKUP(R4C2, R5C15:R187C33, OneCountryData!RC1) -> #NA | G9: =IF(EQUAL(RC[-1], ".."), "..", VLOOKUP(R4C2, R5C15:R187C33, OneCountryData!RC1+6)-RC[-1]) -> #NA | H9: =IF(EQUAL(RC[-2], ".."), "..", RC[-2]-VLOOKUP(R4C2, R5C15:R187C33, OneCountryData!RC1+12)) -> #NA | I9: =MAX(RC[-6]-RC[-4], 0) -> #NA | J9: =MIN(RC[-7]+RC[-6], 100) -> #NA | L9: 'ARG | M9: 'Argentina | N9: 1 | O9: 'ARG | P9: 66.2790697674419 | Q9: 69.4805194805195 | R9: 69.6774193548387 | S9: 77.5757575757576 | T9: 64.8484848484849 | U9: 48.0519480519481 | V9: 76.878612716763 | W9: 83.8709677419355 | X9: 81.4102564102564 | Y9: 94.5783132530121 | Z9: 75.3012048192771 | AA9: 64.5161290322581 | AB9: 52.0231213872832 | AC9: 48.3870967741936 | AD9: 45.5128205128205 | AE9: 53.6144578313253 | AF9: 50 | AG9: 25.8064516129032 | AI9: 'Argentina | AJ9: 0 | AK9: 0 | AL9: 0 | AM9: 1 | AN9: 0
A10: 6 | B10: 'Rule of Law | C10: =IF(EQUAL(RC[+3], ".."), "", RC[+3]) -> #NA | D10: =IF(EQUAL(RC[+3], ".."), "", RC[+3]) -> #NA | E10: =IF(EQUAL(RC[+3], ".."), "", RC[+3]) -> #NA | F10: =VLOOKUP(R4C2, R5C15:R187C33, OneCountryData!RC1) -> #NA | G10: =IF(EQUAL(RC[-1], ".."), "..", VLOOKUP(R4C2, R5C15:R187C33, OneCountryData!RC1+6)-RC[-1]) -> #NA | H10: =IF(EQUAL(RC[-2], ".."), "..", RC[-2]-VLOOKUP(R4C2, R5C15:R187C33, OneCountryData!RC1+12)) -> #NA | I10: =MAX(RC[-6]-RC[-4], 0) -> #NA | J10: =MIN(RC[-7]+RC[-6], 100) -> #NA | L10: 'ARM | M10: 'Armenia | N10: 1 | O10: 'ARM | P10: 55.2325581395349 | Q10: 31.1688311688312 | R10: 21.2903225806452 | S10: 22.4242424242424 | T10: 48.4848484848485 | U10: 20.1298701298701 | V10: 67.6300578034682 | W10: 51.6129032258064 | X10: 50.6410256410256 | Y10: 40.3614457831325 | Z10: 62.0481927710843 | AA10: 43.2258064516129 | AB10: 34.1040462427746 | AC10: 16.1290322580645 | AD10: 8.33333333333333 | AE10: 12.0481927710843 | AF10: 32.5301204819277 | AG10: 3.2258064516129 | AI10: 'Armenia | AJ10: 1 | AK10: 0 | AL10: 0 | AM10: 0 | AN10: 0
A11: 7 | B11: 'Control of Corruption | C11: =IF(EQUAL(RC[+3], ".."), "", RC[+3]) -> #NA | D11: =IF(EQUAL(RC[+3], ".."), "", RC[+3]) -> #NA | E11: =IF(EQUAL(RC[+3], ".."), "", RC[+3]) -> #NA | F11: =VLOOKUP(R4C2, R5C15:R187C33, OneCountryData!RC1) -> #NA | G11: =IF(EQUAL(RC[-1], ".."), "..", VLOOKUP(R4C2, R5C15:R187C33, OneCountryData!RC1+6)-RC[-1]) -> #NA | H11: =IF(EQUAL(RC[-2], ".."), "..", RC[-2]-VLOOKUP(R4C2, R5C15:R187C33, OneCountryData!RC1+12)) -> #NA | I11: =MAX(RC[-6]-RC[-4], 0) -> #NA | J11: =MIN(RC[-7]+RC[-6], 100) -> #NA | L11: 'AUS | M11: 'Australia | N11: 1 | O11: 'AUS | P11: 97.6744186046512 | Q11: 88.3116883116883 | R11: 91.6129032258065 | S11: 93.3333333333333 | T11: 93.939393939394 | U11: 90.9090909090909 | V11: 100 | W11: 100 | X11: 97.4358974358974 | Y11: 100 | Z11: 100 | AA11: 95.4838709677419 | AB11: 82.6589595375723 | AC11: 74.8387096774194 | AD11: 83.974358974359 | AE11: 68.0722891566265 | AF11: 86.144578313253 | AG11: 85.1612903225806 | AI11: 'Australia | AJ11: 0 | AK11: 0 | AL11: 0 | AM11: 0 | AN11: 1
L12: 'AUT | M12: 'Austria | N12: 1 | O12: 'AUT | P12: 91.2790697674419 | Q12: 92.8571428571429 | R12: 86.4516129032258 | S12: 90.3030303030303 | T12: 97.5757575757576 | U12: 89.6103896103896 | V12: 100 | W12: 100 | X12: 96.1538461538462 | Y12: 100 | Z12: 100 | AA12: 94.1935483870968 | AB12: 76.878612716763 | AC12: 80.6451612903226 | AD12: 81.4102564102564 | AE12: 66.8674698795181 | AF12: 90.3614457831325 | AG12: 84.5161290322581 | AI12: 'Austria | AJ12: 0 | AK12: 0 | AL12: 0 | AM12: 0 | AN12: 1
A13: 'Country Name | B13: 'Country Code | L13: 'AZE | M13: 'Azerbaijan | N13: 1 | O13: 'AZE | P13: 19.1860465116279 | Q13: 34.4155844155844 | R13: 15.4838709677419 | S13: 13.3333333333333 | T13: 30.9090909090909 | U13: 7.1428571428571 | V13: 37.5722543352601 | W13: 52.9032258064516 | X13: 37.8205128205128 | Y13: 24.6987951807229 | Z13: 47.5903614457831 | AA13: 27.0967741935484 | AB13: 6.9364161849711 | AC13: 19.3548387096774 | AD13: 6.41025641025641 | AE13: 4.81927710843374 | AF13: 16.2650602409639 | AG13: 1.29032258064516 | AI13: 'Azerbaijan | AJ13: 1 | AK13: 0 | AL13: 0 | AM13: 0 | AN13: 0
A14: 'Afghanistan | B14: 'AFG | L14: 'BDI | M14: 'Burundi | N14: 1 | O14: 'BDI | P14: 10.4651162790698 | Q14: 0 | R14: 0 | S14: 16.969696969697 | T14: 17.5757575757576 | U14: 0 | V14: 31.2138728323699 | W14: 0 | X14: 0 | Y14: 62.0481927710843 | Z14: 64.4578313253012 | AA14: 0 | AB14: 0 | AC14: 0 | AD14: 0 | AE14: 1.80722891566265 | AF14: 0.602409638554217 | AG14: 0 | AI14: 'Burundi | AJ14: 0 | AK14: 0 | AL14: 1 | AM14: 0 | AN14: 0
A15: 'Angola | B15: 'AGO | L15: 'BEL | M15: 'Belgium | N15: 1 | O15: 'BEL | P15: 90.1162790697675 | Q15: 79.2207792207792 | R15: 83.2258064516129 | S15: 81.8181818181818 | T15: 76.969696969697 | U15: 80.5194805194805 | V15: 100 | W15: 92.258064516129 | X15: 90.3846153846154 | Y15: 99.3975903614458 | Z15: 86.7469879518072 | AA15: 84.5161290322581 | AB15: 76.3005780346821 | AC15: 60.6451612903226 | AD15: 70.5128205128205 | AE15: 62.0481927710843 | AF15: 65.0602409638554 | AG15: 67.741935483871 | AI15: 'Belgium | AJ15: 0 | AK15: 0 | AL15: 0 | AM15: 0 | AN15: 1
A16: 'Albania | B16: 'ALB | L16: 'BEN | M16: 'Benin | N16: 1 | O16: 'BEN | P16: 70.9302325581395 | Q16: 17.5324675324675 | R16: 50.9677419354839 | S16: 38.7878787878788 | T16: 37.5757575757576 | U16: 22.0779220779221 | V16: 89.0173410404624 | W16: 63.2258064516129 | X16: 83.974358974359 | Y16: 94.5783132530121 | Z16: 66.8674698795181 | AA16: 67.0967741935484 | AB16: 54.3352601156069 | AC16: 1.93548387096774 | AD16: 8.97435897435897 | AE16: 9.03614457831325 | AF16: 4.81927710843374 | AG16: 0 | AI16: 'Benin | AJ16: 0 | AK16: 0 | AL16: 0 | AM16: 0 | AN16: 1
A17: 'United Arab Emirates | B17: 'ARE | L17: 'BFA | M17: 'Burkina Faso | N17: 1 | O17: 'BFA | P17: 44.1860465116279 | Q17: 29.2207792207792 | R17: 52.258064516129 | S17: 41.2121212121212 | T17: 42.4242424242424 | U17: 40.9090909090909 | V17: 63.5838150289017 | W17: 57.4193548387097 | X17: 74.3589743589744 | Y17: 75.9036144578313 | Z17: 66.8674698795181 | AA17: 68.3870967741936 | AB17: 23.121387283237 | AC17: 10.3225806451613 | AD17: 20.5128205128205 | AE17: 21.6867469879518 | AF17: 8.43373493975904 | AG17: 4.51612903225806 | AI17: 'Burkina Faso | AJ17: 0 | AK17: 0 | AL17: 0 | AM17: 0 | AN17: 1
A18: 'Argentina | B18: 'ARG | L18: 'BGD | M18: 'Bangladesh | N18: 1 | O18: 'BGD | P18: 52.3255813953488 | Q18: 32.4675324675325 | R18: 28.3870967741936 | S18: 34.5454545454545 | T18: 14.5454545454545 | U18: 46.1038961038961 | V18: 66.4739884393064 | W18: 56.7741935483871 | X18: 60.8974358974359 | Y18: 77.1084337349398 | Z18: 39.7590361445783 | AA18: 67.0967741935484 | AB18: 35.2601156069364 | AC18: 14.8387096774194 | AD18: 8.33333333333333 | AE18: 14.4578313253012 | AF18: 3.01204819277108 | AG18: 20 | AI18: 'Bangladesh | AJ18: 0 | AK18: 1 | AL18: 0 | AM18: 0 | AN18: 0
A19: 'Armenia | B19: 'ARM | L19: 'BGR | M19: 'Bulgaria | N19: 1 | O19: 'BGR | P19: 68.0232558139535 | Q19: 66.8831168831169 | R19: 17.4193548387097 | S19: 68.4848484848485 | T19: 47.8787878787879 | U19: 30.5194805194805 | V19: 82.0809248554913 | W19: 80.6451612903226 | X19: 39.1025641025641 | Y19: 93.9759036144578 | Z19: 62.0481927710843 | AA19: 52.258064516129 | AB19: 58.9595375722543 | AC19: 47.741935483871 | AD19: 7.05128205128205 | AE19: 42.7710843373494 | AF19: 33.7349397590361 | AG19: 12.258064516129 | AI19: 'Bulgaria | AJ19: 1 | AK19: 0 | AL19: 0 | AM19: 0 | AN19: 0
A20: 'Australia | B20: 'AUS | L20: 'BHR | M20: 'Bahrain | N20: 1 | O20: 'BHR | P20: 15.1162790697674 | Q20: 45.4545454545455 | R20: 68.3870967741936 | S20: 80.6060606060606 | T20: 73.3333333333333 | U20: 51.9480519480519 | V20: 34.1040462427746 | W20: 69.6774193548387 | X20: 82.6923076923077 | Y20: 100 | Z20: 86.144578313253 | AA20: 68.3870967741936 | AB20: 4.6242774566474 | AC20: 24.5161290322581 | AD20: 37.1794871794872 | AE20: 42.7710843373494 | AF20: 57.8313253012048 | AG20: 25.1612903225806 | AI20: 'Bahrain | AJ20: 0 | AK20: 1 | AL20: 0 | AM20: 0 | AN20: 0
A21: 'Austria | B21: 'AUT | L21: 'BHS | M21: 'Bahamas, The | N21: 1 | O21: 'BHS | P21: 83.1395348837209 | Q21: 63.6363636363636 | R21: 71.6129032258065 | S21: 86.6666666666667 | T21: 72.1212121212121 | U21: 73.3766233766234 | V21: 100 | W21: 87.741935483871 | X21: 98.0769230769231 | Y21: 100 | Z21: 90.9638554216867 | AA21: 95.4838709677419 | AB21: 67.6300578034682 | AC21: 31.6129032258065 | AD21: 12.1794871794872 | AE21: 34.9397590361446 | AF21: 43.9759036144578 | AG21: 9.03225806451613 | AI21: 'Bahamas, The | AJ21: 0 | AK21: 0 | AL21: 0 | AM21: 0 | AN21: 1
A22: 'Azerbaijan | B22: 'AZE | L22: 'BIH | M22: 'Bosnia and Herzegovina | N22: 1 | O22: 'BIH | P22: 16.8604651162791 | Q22: 11.6883116883117 | R22: 10.3225806451613 | S22: 8.4848484848484 | T22: 9.6969696969697 | U22: 42.2077922077922 | V22: 42.7745664739884 | W22: 31.6129032258064 | X22: 40.3846153846154 | Y22: 21.6867469879518 | Z22: 30.1204819277108 | AA22: 75.4838709677419 | AB22: 2.3121387283237 | AC22: 1.93548387096774 | AD22: 0 | AE22: 2.40963855421687 | AF22: 1.80722891566265 | AG22: 3.2258064516129 | AI22: 'Bosnia and Herzegovina | AJ22: 1 | AK22: 0 | AL22: 0 | AM22: 0 | AN22: 0
A23: 'Burundi | B23: 'BDI | L23: 'BLR | M23: 'Belarus | N23: 1 | O23: 'BLR | P23: 34.3023255813954 | Q23: 33.7662337662338 | R23: 20.6451612903226 | S23: 5.4545454545454 | T23: 18.1818181818182 | U23: 25.974025974026 | V23: 56.0693641618497 | W23: 54.1935483870968 | X23: 50.6410256410256 | Y23: 14.4578313253012 | Z23: 34.9397590361446 | AA23: 51.6129032258064 | AB23: 13.8728323699422 | AC23: 18.7096774193548 | AD23: 7.69230769230769 | AE23: 1.80722891566265 | AF23: 5.42168674698795 | AG23: 4.51612903225806 | AI23: 'Belarus | AJ23: 1 | AK23: 0 | AL23: 0 | AM23: 0 | AN23: 0
A24: 'Belgium | B24: 'BEL | L24: 'BLZ | M24: 'Belize | N24: 1 | O24: 'BLZ | P24: 86.6279069767442 | Q24: 0 | R24: 0 | S24: 58.1818181818182 | T24: 56.3636363636364 | U24: 0 | V24: 100 | W24: 0 | X24: 0 | Y24: 100 | Z24: 87.9518072289157 | AA24: 0 | AB24: 67.0520231213873 | AC24: 0 | AD24: 0 | AE24: 15.0602409638554 | AF24: 12.0481927710843 | AG24: 0 | AI24: 'Belize | AJ24: 0 | AK24: 0 | AL24: 0 | AM24: 1 | AN24: 0
A25: 'Benin | B25: 'BEN | L25: 'BOL | M25: 'Bolivia | N25: 1 | O25: 'BOL | P25: 63.953488372093 | Q25: 43.5064935064935 | R25: 46.4516129032258 | S25: 87.2727272727273 | T25: 41.2121212121212 | U25: 38.3116883116883 | V25: 76.3005780346821 | W25: 66.4516129032258 | X25: 70.5128205128205 | Y25: 100 | Z25: 59.6385542168675 | AA25: 61.9354838709677 | AB25: 48.5549132947977 | AC25: 23.8709677419355 | AD25: 19.2307692307692 | AE25: 45.7831325301205 | AF25: 19.2771084337349 | AG25: 12.258064516129 | AI25: 'Bolivia | AJ25: 0 | AK25: 0 | AL25: 0 | AM25: 1 | AN25: 0
A26: 'Burkina Faso | B26: 'BFA | L26: 'BRA | M26: 'Brazil | N26: 1 | O26: 'BRA | P26: 67.4418604651163 | Q26: 38.3116883116883 | R26: 47.0967741935484 | S26: 47.2727272727273 | T26: 47.2727272727273 | U26: 64.2857142857143 | V26: 79.7687861271676 | W26: 56.7741935483871 | X26: 68.5897435897436 | Y26: 72.8915662650602 | Z26: 62.0481927710843 | AA26: 70.9677419354839 | AB26: 56.6473988439306 | AC26: 20 | AD26: 20.5128205128205 | AE26: 28.9156626506024 | AF26: 30.1204819277108 | AG26: 44.5161290322581 | AI26: 'Brazil | AJ26: 0 | AK26: 0 | AL26: 0 | AM26: 1 | AN26: 0
A27: 'Bangladesh | B27: 'BGD | L27: 'BRB | M27: 'Barbados | N27: 1 | O27: 'BRB | P27: 94.1860465116279 | Q27: 0 | R27: 0 | S27: 75.7575757575758 | T27: 66.0606060606061 | U27: 0 | V27: 100 | W27: 0 | X27: 0 | Y27: 100 | Z27: 93.3734939759036 | AA27: 0 | AB27: 74.5664739884393 | AC27: 0 | AD27: 0 | AE27: 22.8915662650602 | AF27: 22.8915662650602 | AG27: 0 | AI27: 'Barbados | AJ27: 0 | AK27: 0 | AL27: 0 | AM27: 1 | AN27: 0
A28: 'Bulgaria | B28: 'BGR | L28: 'BRN | M28: 'Brunei | N28: 1 | O28: 'BRN | P28: 18.6046511627907 | Q28: 91.5584415584416 | R28: 56.1290322580645 | S28: 38.1818181818182 | T28: 87.2727272727273 | U28: 58.4415584415584 | V28: 39.3063583815029 | W28: 100 | X28: 92.3076923076923 | Y28: 100 | Z28: 100 | AA28: 89.0322580645161 | AB28: 5.20231213872832 | AC28: 69.6774193548387 | AD28: 2.56410256410256 | AE28: 5.42168674698795 | AF28: 61.4457831325301 | AG28: 1.29032258064516 | AI28: 'Brunei | AJ28: 0 | AK28: 1 | AL28: 0 | AM28: 0 | AN28: 0
A29: 'Bahrain | B29: 'BHR | L29: 'BTN | M29: 'Bhutan | N29: 1 | O29: 'BTN | P29: 11.046511627907 | Q29: 0 | R29: 0 | S29: 0 | T29: 0 | U29: 0 | V29: 33.5260115606936 | W29: 0 | X29: 0 | Y29: 0 | Z29: 0 | AA29: 0 | AB29: 0 | AC29: 0 | AD29: 0 | AE29: 0 | AF29: 0 | AG29: 0 | AI29: 'Bhutan | AJ29: 0 | AK29: 1 | AL29: 0 | AM29: 0 | AN29: 0
A30: 'Bahamas, The | B30: 'BHS | L30: 'BWA | M30: 'Botswana | N30: 1 | O30: 'BWA | P30: 74.4186046511628 | Q30: 76.6233766233766 | R30: 67.741935483871 | S30: 72.7272727272727 | T30: 68.4848484848485 | U30: 75.3246753246753 | V30: 86.7052023121387 | W30: 90.3225806451613 | X30: 81.4102564102564 | Y30: 96.3855421686747 | Z30: 83.7349397590361 | AA30: 83.2258064516129 | AB30: 62.4277456647399 | AC30: 57.4193548387097 | AD30: 42.9487179487179 | AE30: 42.7710843373494 | AF30: 53.0120481927711 | AG30: 64.5161290322581 | AI30: 'Botswana | AJ30: 0 | AK30: 0 | AL30: 1 | AM30: 0 | AN30: 0
A31: 'Bosnia and Herzegovina | B31: 'BIH | L31: 'CAF | M31: 'Central African Republic | N31: 1 | O31: 'CAF | P31: 51.1627906976744 | Q31: 0 | R31: 18.0645161290323 | S31: 0 | T31: 0 | U31: 0 | V31: 69.9421965317919 | W31: 0 | X31: 68.5897435897436 | Y31: 0 | Z31: 0 | AA31: 0 | AB31: 24.8554913294798 | AC31: 0 | AD31: 1.28205128205128 | AE31: 0 | AF31: 0 | AG31: 0 | AI31: 'Central African Republic | AJ31: 0 | AK31: 0 | AL31: 1 | AM31: 0 | AN31: 0
A32: 'Belarus | B32: 'BLR | L32: 'CAN | M32: 'Canada | N32: 1 | O32: 'CAN | P32: 88.953488372093 | Q32: 84.4155844155844 | R32: 96.7741935483871 | S32: 86.0606060606061 | T32: 92.7272727272727 | U32: 96.7532467532468 | V32: 100 | W32: 99.3548387096774 | X32: 100 | Y32: 100 | Z32: 99.3975903614458 | AA32: 100 | AB32: 76.3005780346821 | AC32: 69.6774193548387 | AD32: 87.1794871794872 | AE32: 65.6626506024096 | AF32: 86.144578313253 | AG32: 91.6129032258064 | AI32: 'Canada | AJ32: 0 | AK32: 0 | AL32: 0 | AM32: 0 | AN32: 1
A33: 'Belize | B33: 'BLZ | L33: 'CHE | M33: 'Switzerland | N33: 1 | O33: 'CHE | P33: 100 | Q33: 100 | R33: 98.7096774193548 | S33: 87.8787878787879 | T33: 100 | U33: 97.4025974025974 | V33: 100 | W33: 100 | X33: 100 | Y33: 100 | Z33: 100 | AA33: 100 | AB33: 85.5491329479769 | AC33: 88.3870967741936 | AD33: 92.3076923076923 | AE33: 66.2650602409639 | AF33: 93.3734939759036 | AG33: 92.9032258064516 | AI33: 'Switzerland | AJ33: 0 | AK33: 0 | AL33: 0 | AM33: 0 | AN33: 1
A34: 'Bolivia | B34: 'BOL | L34: 'CHL | M34: 'Chile | N34: 1 | O34: 'CHL | P34: 69.1860465116279 | Q34: 67.5324675324675 | R34: 85.8064516129032 | S34: 89.6969696969697 | T34: 86.0606060606061 | U34: 84.4155844155844 | V34: 82.0809248554913 | W34: 83.8709677419355 | X34: 94.8717948717949 | Y34: 100 | Z34: 92.1686746987952 | AA34: 89.0322580645161 | AB34: 58.9595375722543 | AC34: 46.4516129032258 | AD34: 80.1282051282051 | AE34: 66.8674698795181 | AF34: 72.8915662650602 | AG34: 80 | AI34: 'Chile | AJ34: 0 | AK34: 0 | AL34: 0 | AM34: 1 | AN34: 0
A35: 'Brazil | B35: 'BRA | L35: 'CHN | M35: 'China | N35: 1 | O35: 'CHN | P35: 9.8837209302325 | Q35: 68.8311688311688 | R35: 58.7096774193548 | S35: 39.3939393939394 | T35: 52.7272727272727 | U35: 46.7532467532468 | V35: 23.121387283237 | W35: 83.8709677419355 | X35: 72.4358974358974 | Y35: 63.855421686747 | Z35: 65.6626506024096 | AA35: 63.2258064516129 | AB35: 0 | AC35: 47.741935483871 | AD35: 33.974358974359 | AE35: 24.6987951807229 | AF35: 36.144578313253 | AG35: 28.3870967741935 | AI35: 'China | AJ35: 0 | AK35: 1 | AL35: 0 | AM35: 0 | AN35: 0
A36: 'Barbados | B36: 'BRB | L36: 'CIV | M36: 'Cote d'Ivoire | N36: 1 | O36: 'CIV | P36: 31.9767441860465 | Q36: 44.1558441558442 | R36: 47.741935483871 | S36: 47.8787878787879 | T36: 43.030303030303 | U36: 57.1428571428571 | V36: 49.7109826589595 | W36: 65.8064516129032 | X36: 70.5128205128205 | Y36: 79.5180722891566 | Z36: 61.4457831325301 | AA36: 68.3870967741936 | AB36: 13.8728323699422 | AC36: 24.5161290322581 | AD36: 22.4358974358974 | AE36: 25.3012048192771 | AF36: 19.8795180722892 | AG36: 33.5483870967742 | AI36: 'Cote d'Ivoire | AJ36: 0 | AK36: 0 | AL36: 1 | AM36: 0 | AN36: 0
A37: 'Brunei | B37: 'BRN | L37: 'CMR | M37: 'Cameroon | N37: 1 | O37: 'CMR | P37: 26.7441860465116 | Q37: 23.3766233766234 | R37: 22.5806451612903 | S37: 33.3333333333333 | T37: 12.7272727272727 | U37: 3.2467532467532 | V37: 44.5086705202312 | W37: 41.2903225806452 | X37: 48.0769230769231 | Y37: 65.0602409638554 | Z37: 33.7349397590361 | AA37: 25.8064516129032 | AB37: 12.1387283236994 | AC37: 10.3225806451613 | AD37: 10.2564102564103 | AE37: 19.8795180722892 | AF37: 1.80722891566265 | AG37: 1.29032258064516 | AI37: 'Cameroon | AJ37: 0 | AK37: 0 | AL37: 1 | AM37: 0 | AN37: 0
A38: 'Bhutan | B38: 'BTN | L38: 'COG | M38: 'Congo, Rep. | N38: 1 | O38: 'COG | P38: 24.4186046511628 | Q38: 2.5974025974026 | R38: 25.8064516129032 | S38: 13.9393939393939 | T38: 3.030303030303 | U38: 28.5714285714286 | V38: 44.5086705202312 | W38: 12.9032258064516 | X38: 66.6666666666667 | Y38: 42.7710843373494 | Z38: 27.1084337349398 | AA38: 69.0322580645161 | AB38: 9.2485549132948 | AC38: 0.645161290322581 | AD38: 5.12820512820513 | AE38: 1.80722891566265 | AF38: 0 | AG38: 1.29032258064516 | AI38: 'Congo, Rep. | AJ38: 0 | AK38: 0 | AL38: 1 | AM38: 0 | AN38: 0
A39: 'Botswana | B39: 'BWA | L39: 'COL | M39: 'Colombia | N39: 1 | O39: 'COL | P39: 47.6744186046512 | Q39: 9.090909090909 | R39: 52.9032258064516 | S39: 58.7878787878788 | T39: 22.4242424242424 | U39: 33.7662337662338 | V39: 63.5838150289017 | W39: 20 | X39: 70.5128205128205 | Y39: 79.5180722891566 | Z39: 39.7590361445783 | AA39: 56.1290322580645 | AB39: 29.4797687861272 | AC39: 3.87096774193548 | AD39: 30.7692307692308 | AE39: 34.3373493975904 | AF39: 8.43373493975904 | AG39: 15.4838709677419 | AI39: 'Colombia | AJ39: 0 | AK39: 0 | AL39: 0 | AM39: 1 | AN39: 0
A40: 'Central African Republic | B40: 'CAF | L40: 'COM | M40: 'Comoros | N40: 1 | O40: 'COM | P40: 56.9767441860465 | Q40: 0 | R40: 0 | S40: 0 | T40: 0 | U40: 0 | V40: 73.4104046242775 | W40: 0 | X40: 0 | Y40: 0 | Z40: 0 | AA40: 0 | AB40: 29.4797687861272 | AC40: 0 | AD40: 0 | AE40: 0 | AF40: 0 | AG40: 0 | AI40: 'Comoros | AJ40: 0 | AK40: 0 | AL40: 0 | AM40: 1 | AN40: 0
A41: 'Canada | B41: 'CAN | L41: 'CPV | M41: 'Cape verde | N41: 1 | O41: 'CPV | P41: 77.3255813953488 | Q41: 0 | R41: 0 | S41: 12.7272727272727 | T41: 56.3636363636364 | U41: 0 | V41: 99.4219653179191 | W41: 0 | X41: 0 | Y41: 49.3975903614458 | Z41: 87.9518072289157 | AA41: 0 | AB41: 62.4277456647399 | AC41: 0 | AD41: 0 | AE41: 1.80722891566265 | AF41: 12.0481927710843 | AG41: 0 | AI41: 'Cape verde | AJ41: 0 | AK41: 0 | AL41: 1 | AM41: 0 | AN41: 0
A42: 'Switzerland | B42: 'CHE | L42: 'CRI | M42: 'Costa Rica | N42: 1 | O42: 'CRI | P42: 88.3720930232558 | Q42: 81.1688311688312 | R42: 73.5483870967742 | S42: 90.9090909090909 | T42: 71.5151515151515 | U42: 76.6233766233766 | V42: 100 | W42: 98.0645161290323 | X42: 84.6153846153846 | Y42: 100 | Z42: 83.1325301204819 | AA42: 83.2258064516129 | AB42: 76.3005780346821 | AC42: 65.1612903225806 | AD42: 55.1282051282051 | AE42: 48.1927710843374 | AF42: 57.2289156626506 | AG42: 66.4516129032258 | AI42: 'Costa Rica | AJ42: 0 | AK42: 0 | AL42: 0 | AM42: 1 | AN42: 0
A43: 'Chile | B43: 'CHL | L43: 'CUB | M43: 'Cuba | N43: 1 | O43: 'CUB | P43: 5.2325581395348 | Q43: 57.1428571428571 | R43: 31.6129032258065 | S43: 15.1515151515152 | T43: 57.5757575757576 | U43: 67.5324675324675 | V43: 17.9190751445087 | W43: 77.4193548387097 | X43: 62.8205128205128 | Y43: 37.9518072289157 | Z43: 72.8915662650602 | AA43: 81.2903225806452 | AB43: 0 | AC43: 33.5483870967742 | AD43: 10.2564102564103 | AE43: 3.6144578313253 | AF43: 37.3493975903614 | AG43: 49.6774193548387 | AI43: 'Cuba | AJ43: 0 | AK43: 0 | AL43: 0 | AM43: 1 | AN43: 0
A44: 'China | B44: 'CHN | L44: 'CYP | M44: 'Cyprus | N44: 1 | O44: 'CYP | P44: 82.5581395348837 | Q44: 65.5844155844156 | R44: 84.5161290322581 | S44: 83.030303030303 | T44: 80.6060606060606 | U44: 94.1558441558442 | V44: 97.1098265895954 | W44: 83.8709677419355 | X44: 94.8717948717949 | Y44: 100 | Z44: 91.566265060241 | AA44: 100 | AB44: 69.364161849711 | AC44: 41.2903225806452 | AD44: 71.1538461538462 | AE44: 42.7710843373494 | AF44: 65.6626506024096 | AG44: 87.741935483871 | AI44: 'Cyprus | AJ44: 0 | AK44: 0 | AL44: 0 | AM44: 0 | AN44: 1
A45: 'Cote d'Ivoire | B45: 'CIV | L45: 'CZE | M45: 'Czech Republic | N45: 1 | O45: 'CZE | P45: 86.046511627907 | Q45: 78.5714285714286 | R45: 75.4838709677419 | S45: 72.1212121212121 | T45: 70.9090909090909 | U45: 70.7792207792208 | V45: 100 | W45: 88.3870967741936 | X45: 83.974358974359 | Y45: 91.566265060241 | Z45: 78.3132530120482 | AA45: 80.6451612903226 | AB45: 71.6763005780347 | AC45: 65.8064516129032 | AD45: 67.3076923076923 | AE45: 51.2048192771084 | AF45: 62.0481927710843 | AG45: 64.5161290322581 | AI45: 'Czech Republic | AJ45: 1 | AK45: 0 | AL45: 0 | AM45: 0 | AN45: 0
A46: 'Cameroon | B46: 'CMR | L46: 'DEU | M46: 'Germany | N46: 1 | O46: 'DEU | P46: 94.7674418604651 | Q46: 90.9090909090909 | R46: 90.9677419354839 | S46: 89.0909090909091 | T46: 92.1212121212121 | U46: 91.5584415584416 | V46: 100 | W46: 100 | X46: 97.4358974358974 | Y46: 100 | Z46: 98.7951807228916 | AA46: 95.4838709677419 | AB46: 78.0346820809249 | AC46: 79.3548387096774 | AD46: 83.974358974359 | AE46: 66.2650602409639 | AF46: 83.7349397590361 | AG46: 86.4516129032258 | AI46: 'Germany | AJ46: 0 | AK46: 0 | AL46: 0 | AM46: 0 | AN46: 1
A47: 'Congo, Rep. | B47: 'COG | L47: 'DJI | M47: 'Djibouti | N47: 1 | O47: 'DJI | P47: 29.6511627906977 | Q47: 0 | R47: 0 | S47: 24.2424242424242 | T47: 46.0606060606061 | U47: 0 | V47: 58.9595375722543 | W47: 0 | X47: 0 | Y47: 77.1084337349398 | Z47: 81.3253012048193 | AA47: 0 | AB47: 9.82658959537572 | AC47: 0 | AD47: 0 | AE47: 3.6144578313253 | AF47: 3.6144578313253 | AG47: 0 | AI47: 'Djibouti | AJ47: 0 | AK47: 1 | AL47: 0 | AM47: 0 | AN47: 0
A48: 'Colombia | B48: 'COL | L48: 'DNK | M48: 'Denmark | N48: 1 | O48: 'DNK | P48: 98.8372093023256 | Q48: 90.2597402597403 | R48: 97.4193548387097 | S48: 94.5454545454545 | T48: 96.3636363636364 | U48: 100 | V48: 100 | W48: 100 | X48: 100 | Y48: 100 | Z48: 100 | AA48: 100 | AB48: 83.2369942196532 | AC48: 77.4193548387097 | AD48: 86.5384615384615 | AE48: 74.0963855421687 | AF48: 87.9518072289157 | AG48: 93.5483870967742 | AI48: 'Denmark | AJ48: 0 | AK48: 0 | AL48: 0 | AM48: 0 | AN48: 1
A49: 'Comoros | B49: 'COM | L49: 'DOM | M49: 'Dominican Republic | N49: 1 | O49: 'DOM | P49: 49.4186046511628 | Q49: 53.8961038961039 | R49: 16.1290322580645 | S49: 70.3030303030303 | T49: 65.4545454545455 | U49: 22.7272727272727 | V49: 65.3179190751445 | W49: 78.0645161290323 | X49: 50 | Y49: 100 | Z49: 83.1325301204819 | AA49: 53.5483870967742 | AB49: 31.2138728323699 | AC49: 26.4516129032258 | AD49: 2.56410256410256 | AE49: 24.6987951807229 | AF49: 45.7831325301205 | AG49: 1.29032258064516 | AI49: 'Dominican Republic | AJ49: 0 | AK49: 0 | AL49: 0 | AM49: 1 | AN49: 0
A50: 'Cape verde | B50: 'CPV | L50: 'DZA | M50: 'Algeria | N50: 1 | O50: 'DZA | P50: 9.3023255813953 | Q50: 0.6493506493506 | R50: 11.6129032258065 | S50: 10.3030303030303 | T50: 10.9090909090909 | U50: 13.6363636363636 | V50: 23.121387283237 | W50: 2.58064516129032 | X50: 34.6153846153846 | Y50: 25.9036144578313 | Z50: 31.3253012048193 | AA50: 41.2903225806452 | AB50: 0 | AC50: 0 | AD50: 1.28205128205128 | AE50: 1.80722891566265 | AF50: 1.20481927710843 | AG50: 1.29032258064516 | AI50: 'Algeria | AJ50: 0 | AK50: 0 | AL50: 1 | AM50: 0 | AN50: 0
A51: 'Costa Rica | B51: 'CRI | L51: 'ECU | M51: 'Ecuador | N51: 1 | O51: 'ECU | P51: 62.2093023255814 | Q51: 29.8701298701299 | R51: 29.0322580645161 | S51: 63.6363636363636 | T51: 26.6666666666667 | U51: 19.4805194805195 | V51: 72.8323699421965 | W51: 51.6129032258064 | X51: 53.8461538461538 | Y51: 96.3855421686747 | Z51: 45.1807228915663 | AA51: 43.2258064516129 | AB51: 43.9306358381503 | AC51: 14.8387096774194 | AD51: 12.1794871794872 | AE51: 25.9036144578313 | AF51: 8.43373493975904 | AG51: 1.93548387096774 | AI51: 'Ecuador | AJ51: 0 | AK51: 0 | AL51: 0 | AM51: 1 | AN51: 0
A52: 'Cuba | B52: 'CUB | L52: 'EGY | M52: 'Egypt, Arab Rep. | N52: 1 | O52: 'EGY | P52: 28.4883720930233 | Q52: 46.1038961038961 | R52: 49.6774193548387 | S52: 46.0606060606061 | T52: 58.1818181818182 | U52: 48.7012987012987 | V52: 44.5086705202312 | W52: 66.4516129032258 | X52: 70.5128205128205 | Y52: 72.289156626506 | Z52: 72.289156626506 | AA52: 64.5161290322581 | AB52: 12.7167630057803 | AC52: 26.4516129032258 | AD52: 27.5641025641026 | AE52: 28.9156626506024 | AF52: 43.3734939759036 | AG52: 25.8064516129032 | AI52: 'Egypt, Arab Rep. | AJ52: 0 | AK52: 0 | AL52: 1 | AM52: 0 | AN52: 0
A53: 'Cyprus | B53: 'CYP | L53: 'ERI | M53: 'Eritrea | N53: 1 | O53: 'ERI | P53: 30.2325581395349 | Q53: 0 | R53: 0 | S53: 0 | T53: 0 | U53: 0 | V53: 58.9595375722543 | W53: 0 | X53: 0 | Y53: 0 | Z53: 0 | AA53: 0 | AB53: 9.82658959537572 | AC53: 0 | AD53: 0 | AE53: 0 | AF53: 0 | AG53: 0 | AI53: 'Eritrea | AJ53: 0 | AK53: 0 | AL53: 1 | AM53: 0 | AN53: 0
A54: 'Czech Republic | B54: 'CZE | L54: 'ESP | M54: 'Spain | N54: 1 | O54: 'ESP | P54: 87.7906976744186 | Q54: 72.0779220779221 | R54: 94.1935483870968 | S54: 85.4545454545455 | T54: 83.6363636363636 | U54: 85.7142857142857 | V54: 100 | W54: 84.5161290322581 | X54: 99.3589743589744 | Y54: 100 | Z54: 90.9638554216867 | AA54: 90.3225806451613 | AB54: 76.3005780346821 | AC54: 52.258064516129 | AD54: 84.6153846153846 | AE54: 65.0602409638554 | AF54: 72.289156626506 | AG54: 83.2258064516129 | AI54: 'Spain | AJ54: 0 | AK54: 0 | AL54: 0 | AM54: 0 | AN54: 1
A55: 'Germany | B55: 'DEU | L55: 'EST | M55: 'Estonia | N55: 1 | O55: 'EST | P55: 75 | Q55: 77.9220779220779 | R55: 69.0322580645161 | S55: 80 | T55: 69.0909090909091 | U55: 77.2727272727273 | V55: 86.7052023121387 | W55: 89.0322580645161 | X55: 81.4102564102564 | Y55: 100 | Z55: 78.3132530120482 | AA55: 83.2258064516129 | AB55: 63.0057803468208 | AC55: 61.9354838709677 | AD55: 47.4358974358974 | AE55: 54.2168674698795 | AF55: 60.2409638554217 | AG55: 67.0967741935484 | AI55: 'Estonia | AJ55: 1 | AK55: 0 | AL55: 0 | AM55: 0 | AN55: 0
A56: 'Djibouti | B56: 'DJI | L56: 'ETH | M56: 'Ethiopia | N56: 1 | O56: 'ETH | P56: 35.4651162790698 | Q56: 55.1948051948052 | R56: 48.3870967741936 | S56: 42.4242424242424 | T56: 63.030303030303 | U56: 38.961038961039 | V56: 58.3815028901734 | W56: 80.6451612903226 | X56: 71.7948717948718 | Y56: 77.1084337349398 | Z56: 86.144578313253 | AA56: 67.0967741935484 | AB56: 13.8728323699422 | AC56: 25.8064516129032 | AD56: 17.9487179487179 | AE56: 21.6867469879518 | AF56: 30.7228915662651 | AG56: 3.2258064516129 | AI56: 'Ethiopia | AJ56: 0 | AK56: 0 | AL56: 1 | AM56: 0 | AN56: 0
A57: 'Denmark | B57: 'DNK | L57: 'FIN | M57: 'Finland | N57: 1 | O57: 'FIN | P57: 96.5116279069768 | Q57: 99.3506493506494 | R57: 94.8387096774194 | S57: 95.7575757575758 | T57: 96.969696969697 | U57: 98.7012987012987 | V57: 100 | W57: 100 | X57: 100 | Y57: 100 | Z57: 100 | AA57: 100 | AB57: 82.0809248554913 | AC57: 83.8709677419355 | AD57: 84.6153846153846 | AE57: 78.3132530120482 | AF57: 89.1566265060241 | AG57: 92.9032258064516 | AI57: 'Finland | AJ57: 0 | AK57: 0 | AL57: 0 | AM57: 0 | AN57: 1
A58: 'Dominican Republic | B58: 'DOM | L58: 'FJI | M58: 'Fiji | N58: 1 | O58: 'FJI | P58: 54.6511627906977 | Q58: 50 | R58: 79.3548387096774 | S58: 26.0606060606061 | T58: 33.9393939393939 | U58: 82.4675324675325 | V58: 71.0982658959538 | W58: 90.3225806451613 | X58: 97.4358974358974 | Y58: 81.9277108433735 | Z58: 65.6626506024096 | AA58: 94.8387096774194 | AB58: 28.3236994219653 | AC58: 10.3225806451613 | AD58: 33.974358974359 | AE58: 4.21686746987952 | AF58: 3.6144578313253 | AG58: 49.6774193548387 | AI58: 'Fiji | AJ58: 0 | AK58: 1 | AL58: 0 | AM58: 0 | AN58: 0
A59: 'Algeria | B59: 'DZA | L59: 'FRA | M59: 'France | N59: 1 | O59: 'FRA | P59: 83.7209302325582 | Q59: 72.7272727272727 | R59: 88.3870967741936 | S59: 78.7878787878788 | T59: 84.8484848484849 | U59: 87.6623376623377 | V59: 98.8439306358381 | W59: 85.8064516129032 | X59: 97.4358974358974 | Y59: 96.9879518072289 | Z59: 92.1686746987952 | AA59: 91.6129032258064 | AB59: 69.9421965317919 | AC59: 56.1290322580645 | AD59: 82.0512820512821 | AE59: 56.6265060240964 | AF59: 73.4939759036145 | AG59: 83.2258064516129 | AI59: 'France | AJ59: 0 | AK59: 0 | AL59: 0 | AM59: 0 | AN59: 1
A60: 'Ecuador | B60: 'ECU | L60: 'GAB | M60: 'Gabon | N60: 1 | O60: 'GAB | P60: 40.1162790697674 | Q60: 25.974025974026 | R60: 9.6774193548387 | S60: 62.4242424242424 | T60: 32.7272727272727 | U60: 5.8441558441558 | V60: 61.271676300578 | W60: 52.9032258064516 | X60: 37.1794871794872 | Y60: 100 | Z60: 57.2289156626506 | AA60: 39.3548387096774 | AB60: 23.121387283237 | AC60: 10.3225806451613 | AD60: 0.641025641025641 | AE60: 21.6867469879518 | AF60: 9.03614457831325 | AG60: 0 | AI60: 'Gabon | AJ60: 0 | AK60: 0 | AL60: 1 | AM60: 0 | AN60: 0
A61: 'Egypt, Arab Rep. | B61: 'EGY | L61: 'GBR | M61: 'United Kingdom | N61: 1 | O61: 'GBR | P61: 93.6046511627907 | Q61: 82.4675324675325 | R61: 98.0645161290323 | S61: 98.1818181818182 | T61: 95.7575757575758 | U61: 93.5064935064935 | V61: 100 | W61: 96.1290322580645 | X61: 100 | Y61: 100 | Z61: 100 | AA61: 98.0645161290323 | AB61: 78.0346820809249 | AC61: 66.4516129032258 | AD61: 92.3076923076923 | AE61: 80.7228915662651 | AF61: 89.1566265060241 | AG61: 88.3870967741936 | AI61: 'United Kingdom | AJ61: 0 | AK61: 0 | AL61: 0 | AM61: 0 | AN61: 1
A62: 'Eritrea | B62: 'ERI | L62: 'GEO | M62: 'Georgia | N62: 1 | O62: 'GEO | P62: 41.8604651162791 | Q62: 21.4285714285714 | R62: 30.9677419354839 | S62: 16.3636363636364 | T62: 34.5454545454545 | U62: 24.6753246753247 | V62: 64.1618497109827 | W62: 43.2258064516129 | X62: 61.5384615384615 | Y62: 28.9156626506024 | Z62: 50.6024096385542 | AA62: 47.0967741935484 | AB62: 16.1849710982659 | AC62: 9.03225806451613 | AD62: 10.8974358974359 | AE62: 7.2289156626506 | AF62: 16.8674698795181 | AG62: 3.2258064516129 | AI62: 'Georgia | AJ62: 1 | AK62: 0 | AL62: 0 | AM62: 0 | AN62: 0
A63: 'Spain | B63: 'ESP | L63: 'GHA | M63: 'Ghana | N63: 1 | O63: 'GHA | P63: 37.2093023255814 | Q63: 44.8051948051948 | R63: 42.5806451612903 | S63: 57.5757575757576 | T63: 53.9393939393939 | U63: 45.4545454545455 | V63: 56.6473988439306 | W63: 66.4516129032258 | X63: 63.4615384615385 | Y63: 83.7349397590361 | Z63: 66.8674698795181 | AA63: 64.5161290322581 | AB63: 17.9190751445087 | AC63: 25.1612903225806 | AD63: 19.2307692307692 | AE63: 30.1204819277108 | AF63: 33.7349397590361 | AG63: 25.8064516129032 | AI63: 'Ghana | AJ63: 0 | AK63: 0 | AL63: 1 | AM63: 0 | AN63: 0
A64: 'Estonia | B64: 'EST | L64: 'GIN | M64: 'Guinea | N64: 1 | O64: 'GIN | P64: 21.5116279069767 | Q64: 13.6363636363636 | R64: 54.8387096774194 | S64: 51.5151515151515 | T64: 23.030303030303 | U64: 17.5324675324675 | V64: 41.0404624277457 | W64: 38.7096774193548 | X64: 83.974358974359 | Y64: 98.7951807228916 | Z64: 53.0120481927711 | AA64: 64.5161290322581 | AB64: 6.35838150289017 | AC64: 3.87096774193548 | AD64: 12.1794871794872 | AE64: 18.6746987951807 | AF64: 3.01204819277108 | AG64: 0 | AI64: 'Guinea | AJ64: 0 | AK64: 0 | AL64: 1 | AM64: 0 | AN64: 0
A65: 'Ethiopia | B65: 'ETH | L65: 'GLP | M65: 'Guadeloupe | N65: 1 | O65: 'GLP | P65: 0 | Q65: 0 | R65: 0 | S65: 0 | T65: 0 | U65: 0 | V65: 0 | W65: 0 | X65: 0 | Y65: 0 | Z65: 0 | AA65: 0 | AB65: 0 | AC65: 0 | AD65: 0 | AE65: 0 | AF65: 0 | AG65: 0 | AI65: 'Guadeloupe | AJ65: 0 | AK65: 0 | AL65: 0 | AM65: 1 | AN65: 0
A66: 'Finland | B66: 'FIN | L66: 'GMB | M66: 'Gambia, The | N66: 1 | O66: 'GMB | P66: 16.2790697674419 | Q66: 70.7792207792208 | R66: 64.5161290322581 | S66: 30.9090909090909 | T66: 64.2424242424243 | U66: 58.4415584415584 | V66: 39.3063583815029 | W66: 92.258064516129 | X66: 95.5128205128205 | Y66: 81.3253012048193 | Z66: 86.144578313253 | AA66: 89.0322580645161 | AB66: 4.6242774566474 | AC66: 40.6451612903226 | AD66: 5.12820512820513 | AE66: 8.43373493975904 | AF66: 30.1204819277108 | AG66: 1.29032258064516 | AI66: 'Gambia, The | AJ66: 0 | AK66: 0 | AL66: 1 | AM66: 0 | AN66: 0
A67: 'Fiji | B67: 'FJI | L67: 'GNB | M67: 'Guinea-Bissau | N67: 1 | O67: 'GNB | P67: 36.046511627907 | Q67: 10.3896103896104 | R67: 39.3548387096774 | S67: 7.2727272727272 | T67: 1.2121212121212 | U67: 53.8961038961039 | V67: 58.9595375722543 | W67: 29.6774193548387 | X67: 79.4871794871795 | Y67: 28.9156626506024 | Z67: 17.4698795180723 | AA67: 81.2903225806452 | AB67: 15.606936416185 | AC67: 1.93548387096774 | AD67: 5.12820512820513 | AE67: 1.20481927710843 | AF67: 0 | AG67: 3.2258064516129 | AI67: 'Guinea-Bissau | AJ67: 0 | AK67: 0 | AL67: 1 | AM67: 0 | AN67: 0
A68: 'France | B68: 'FRA | L68: 'GNQ | M68: 'Equatorial Guinea | N68: 1 | O68: 'GNQ | P68: 6.9767441860465 | Q68: 0 | R68: 0 | S68: 7.8787878787878 | T68: 6.6666666666666 | U68: 0 | V68: 28.3236994219653 | W68: 0 | X68: 0 | Y68: 34.9397590361446 | Z68: 53.0120481927711 | AA68: 0 | AB68: 0 | AC68: 0 | AD68: 0 | AE68: 0.602409638554217 | AF68: 0 | AG68: 0 | AI68: 'Equatorial Guinea | AJ68: 0 | AK68: 0 | AL68: 1 | AM68: 0 | AN68: 0
A69: 'Gabon | B69: 'GAB | L69: 'GRC | M69: 'Greece | N69: 1 | O69: 'GRC | P69: 81.3953488372093 | Q69: 57.7922077922078 | R69: 74.1935483870968 | S69: 74.5454545454546 | T69: 67.8787878787879 | U69: 83.1168831168831 | V69: 95.9537572254335 | W69: 76.1290322580645 | X69: 84.6153846153846 | Y69: 94.5783132530121 | Z69: 80.1204819277108 | AA69: 85.1612903225806 | AB69: 67.6300578034682 | AC69: 38.7096774193548 | AD69: 61.5384615384615 | AE69: 48.1927710843374 | AF69: 56.0240963855422 | AG69: 71.6129032258064 | AI69: 'Greece | AJ69: 0 | AK69: 0 | AL69: 0 | AM69: 0 | AN69: 1
A70: 'United Kingdom | B70: 'GBR | L70: 'GTM | M70: 'Guatemala | N70: 1 | O70: 'GTM | P70: 32.5581395348837 | Q70: 22.0779220779221 | R70: 45.8064516129032 | S70: 66.6666666666667 | T70: 10.3030303030303 | U70: 18.8311688311688 | V70: 50.2890173410405 | W70: 44.5161290322581 | X70: 72.4358974358974 | Y70: 100 | Z70: 31.3253012048193 | AA70: 43.2258064516129 | AB70: 13.8728323699422 | AC70: 9.03225806451613 | AD70: 12.1794871794872 | AE70: 22.289156626506 | AF70: 1.20481927710843 | AG70: 1.93548387096774 | AI70: 'Guatemala | AJ70: 0 | AK70: 0 | AL70: 0 | AM70: 1 | AN70: 0
A71: 'Georgia | B71: 'GEO | L71: 'GUY | M71: 'Guyana | N71: 1 | O71: 'GUY | P71: 79.0697674418605 | Q71: 42.2077922077922 | R71: 56.1290322580645 | S71: 54.5454545454545 | T71: 49.6969696969697 | U71: 58.4415584415584 | V71: 95.9537572254335 | W71: 72.258064516129 | X71: 92.3076923076923 | Y71: 100 | Z71: 75.3012048192771 | AA71: 89.0322580645161 | AB71: 65.3179190751445 | AC71: 14.1935483870968 | AD71: 2.56410256410256 | AE71: 18.6746987951807 | AF71: 13.2530120481928 | AG71: 1.29032258064516 | AI71: 'Guyana | AJ71: 0 | AK71: 0 | AL71: 0 | AM71: 1 | AN71: 0
A72: 'Ghana | B72: 'GHA | L72: 'HKG | M72: 'Hong Kong, China | N72: 1 | O72: 'HKG | P72: 50 | Q72: 83.1168831168831 | R72: 87.0967741935484 | S72: 98.7878787878788 | T72: 89.6969696969697 | U72: 88.3116883116883 | V72: 65.3179190751445 | W72: 98.0645161290323 | X72: 97.4358974358974 | Y72: 100 | Z72: 96.9879518072289 | AA72: 90.9677419354839 | AB72: 32.3699421965318 | AC72: 65.8064516129032 | AD72: 81.4102564102564 | AE72: 80.7228915662651 | AF72: 79.5180722891566 | AG72: 83.2258064516129 | AI72: 'Hong Kong, China | AJ72: 0 | AK72: 1 | AL72: 0 | AM72: 0 | AN72: 0
A73: 'Guinea | B73: 'GIN | L73: 'HND | M73: 'Honduras | N73: 1 | O73: 'HND | P73: 50.5813953488372 | Q73: 36.3636363636364 | R73: 36.1290322580645 | S73: 43.6363636363636 | T73: 16.969696969697 | U73: 11.038961038961 | V73: 65.3179190751445 | W73: 60.6451612903226 | X73: 70.5128205128205 | Y73: 94.5783132530121 | Z73: 42.1686746987952 | AA73: 38.0645161290323 | AB73: 33.5260115606936 | AC73: 16.1290322580645 | AD73: 8.97435897435897 | AE73: 14.4578313253012 | AF73: 3.01204819277108 | AG73: 1.29032258064516 | AI73: 'Honduras | AJ73: 0 | AK73: 0 | AL73: 0 | AM73: 1 | AN73: 0
A74: 'Guadeloupe | B74: 'GLP | L74: 'HRV | M74: 'Croatia | N74: 1 | O74: 'HRV | P74: 39.5348837209302 | Q74: 66.2337662337662 | R74: 63.8709677419355 | S74: 55.1515151515152 | T74: 59.3939393939394 | U74: 36.3636363636364 | V74: 60.6936416184971 | W74: 80.6451612903226 | X74: 79.4871794871795 | Y74: 80.7228915662651 | Z74: 69.2771084337349 | AA74: 57.4193548387097 | AB74: 23.121387283237 | AC74: 45.8064516129032 | AD74: 37.8205128205128 | AE74: 30.7228915662651 | AF74: 47.5903614457831 | AG74: 16.7741935483871 | AI74: 'Croatia | AJ74: 1 | AK74: 0 | AL74: 0 | AM74: 0 | AN74: 0
A75: 'Gambia, The | B75: 'GMB | L75: 'HTI | M75: 'Haiti | N75: 1 | O75: 'HTI | P75: 26.1627906976744 | Q75: 4.5454545454545 | R75: 7.7419354838709 | S75: 11.5151515151515 | T75: 1.8181818181818 | U75: 31.8181818181818 | V75: 46.8208092485549 | W75: 18.7096774193548 | X75: 70.5128205128205 | Y75: 36.7469879518072 | Z75: 30.1204819277108 | AA75: 83.2258064516129 | AB75: 10.9826589595376 | AC75: 0.645161290322581 | AD75: 0 | AE75: 1.80722891566265 | AF75: 0 | AG75: 0 | AI75: 'Haiti | AJ75: 0 | AK75: 0 | AL75: 0 | AM75: 1 | AN75: 0
A76: 'Guinea-Bissau | B76: 'GNB | L76: 'HUN | M76: 'Hungary | N76: 1 | O76: 'HUN | P76: 85.4651162790698 | Q76: 88.961038961039 | R76: 76.1290322580645 | S76: 84.8484848484849 | T76: 74.5454545454546 | U76: 77.9220779220779 | V76: 99.4219653179191 | W76: 99.3548387096774 | X76: 83.974358974359 | Y76: 98.7951807228916 | Z76: 83.1325301204819 | AA76: 83.2258064516129 | AB76: 71.0982658959538 | AC76: 79.3548387096774 | AD76: 67.3076923076923 | AE76: 67.4698795180723 | AF76: 65.6626506024096 | AG76: 68.3870967741936 | AI76: 'Hungary | AJ76: 1 | AK76: 0 | AL76: 0 | AM76: 0 | AN76: 0
A77: 'Equatorial Guinea | B77: 'GNQ | L77: 'IDN | M77: 'Indonesia | N77: 1 | O77: 'IDN | P77: 12.7906976744186 | Q77: 9.7402597402597 | R77: 30.3225806451613 | S77: 46.6666666666667 | T77: 15.1515151515152 | U77: 20.7792207792208 | V77: 28.9017341040462 | W77: 20.6451612903226 | X77: 53.8461538461538 | Y77: 72.289156626506 | Z77: 34.9397590361446 | AA77: 34.1935483870968 | AB77: 2.3121387283237 | AC77: 3.2258064516129 | AD77: 12.1794871794872 | AE77: 28.9156626506024 | AF77: 4.21686746987952 | AG77: 3.2258064516129 | AI77: 'Indonesia | AJ77: 0 | AK77: 1 | AL77: 0 | AM77: 0 | AN77: 0
A78: 'Greece | B78: 'GRC | L78: 'IND | M78: 'India | N78: 1 | O78: 'IND | P78: 66.8604651162791 | Q78: 47.4025974025974 | R78: 43.8709677419355 | S78: 40.6060606060606 | T78: 60.6060606060606 | U78: 44.8051948051948 | V78: 77.4566473988439 | W78: 67.741935483871 | X78: 67.3076923076923 | Y78: 65.0602409638554 | Z78: 72.289156626506 | AA78: 61.2903225806452 | AB78: 54.3352601156069 | AC78: 27.0967741935484 | AD78: 19.2307692307692 | AE78: 24.6987951807229 | AF78: 45.1807228915663 | AG78: 28.3870967741935 | AI78: 'India | AJ78: 0 | AK78: 1 | AL78: 0 | AM78: 0 | AN78: 0
A79: 'Guatemala | B79: 'GTM | L79: 'IRL | M79: 'Ireland | N79: 1 | O79: 'IRL | P79: 95.3488372093023 | Q79: 98.0519480519481 | R79: 89.6774193548387 | S79: 96.969696969697 | T79: 90.3030303030303 | U79: 90.2597402597403 | V79: 100 | W79: 100 | X79: 97.4358974358974 | Y79: 100 | Z79: 96.9879518072289 | AA79: 94.8387096774194 | AB79: 78.6127167630058 | AC79: 83.2258064516129 | AD79: 83.974358974359 | AE79: 78.3132530120482 | AF79: 83.1325301204819 | AG79: 85.1612903225806 | AI79: 'Ireland | AJ79: 0 | AK79: 0 | AL79: 0 | AM79: 0 | AN79: 1
A80: 'Guyana | B80: 'GUY | L80: 'IRN | M80: 'Iran, Islamic Rep. | N80: 1 | O80: 'IRN | P80: 33.1395348837209 | Q80: 54.5454545454545 | R80: 38.7096774193548 | S80: 9.090909090909 | T80: 40 | U80: 16.8831168831169 | V80: 50.2890173410405 | W80: 74.8387096774194 | X80: 67.948717948718 | Y80: 24.6987951807229 | Z80: 59.0361445783133 | AA80: 43.2258064516129 | AB80: 13.8728323699422 | AC80: 31.6129032258065 | AD80: 13.4615384615385 | AE80: 1.80722891566265 | AF80: 19.2771084337349 | AG80: 1.29032258064516 | AI80: 'Iran, Islamic Rep. | AJ80: 0 | AK80: 1 | AL80: 0 | AM80: 0 | AN80: 0
A81: 'Hong Kong, China | B81: 'HKG | L81: 'IRQ | M81: 'Iraq | N81: 1 | O81: 'IRQ | P81: 0.5813953488372 | Q81: 1.2987012987013 | R81: 0 | S81: 0 | T81: 0.6060606060606 | U81: 2.5974025974026 | V81: 10.9826589595376 | W81: 6.45161290322581 | X81: 7.05128205128206 | Y81: 1.20481927710843 | Z81: 4.81927710843374 | AA81: 25.1612903225806 | AB81: 0 | AC81: 0 | AD81: 0 | AE81: 0 | AF81: 0 | AG81: 0 | AI81: 'Iraq | AJ81: 0 | AK81: 1 | AL81: 0 | AM81: 0 | AN81: 0
A82: 'Honduras | B82: 'HND | L82: 'ISL | M82: 'Iceland | N82: 1 | O82: 'ISL | P82: 90.6976744186047 | Q82: 89.6103896103896 | R82: 92.258064516129 | S82: 76.3636363636364 | T82: 91.5151515151515 | U82: 94.8051948051948 | V82: 100 | W82: 100 | X82: 100 | Y82: 94.5783132530121 | Z82: 100 | AA82: 100 | AB82: 76.3005780346821 | AC82: 69.6774193548387 | AD82: 80.7692307692308 | AE82: 46.9879518072289 | AF82: 79.5180722891566 | AG82: 86.4516129032258 | AI82: 'Iceland | AJ82: 0 | AK82: 0 | AL82: 0 | AM82: 0 | AN82: 1
A83: 'Croatia | B83: 'HRV | L83: 'ISR | M83: 'Israel | N83: 1 | O83: 'ISR | P83: 81.9767441860465 | Q83: 30.5194805194805 | R83: 80.6451612903226 | S83: 69.6969696969697 | T83: 83.030303030303 | U83: 87.012987012987 | V83: 95.9537572254335 | W83: 52.9032258064516 | X83: 85.8974358974359 | Y83: 93.3734939759036 | Z83: 90.3614457831325 | AA83: 91.6129032258064 | AB83: 67.6300578034682 | AC83: 14.1935483870968 | AD83: 64.1025641025641 | AE83: 43.9759036144578 | AF83: 69.8795180722892 | AG83: 83.2258064516129 | AI83: 'Israel | AJ83: 0 | AK83: 0 | AL83: 0 | AM83: 0 | AN83: 1
A84: 'Haiti | B84: 'HTI | L84: 'ITA | M84: 'Italy | N84: 1 | O84: 'ITA | P84: 87.2093023255814 | Q84: 87.6623376623377 | R84: 81.9354838709677 | S84: 73.3333333333333 | T84: 78.7878787878788 | U84: 81.8181818181818 | V84: 100 | W84: 99.3548387096774 | X84: 86.5384615384615 | Y84: 93.9759036144578 | Z84: 87.9518072289157 | AA84: 85.1612903225806 | AB84: 75.1445086705202 | AC84: 74.8387096774194 | AD84: 70.5128205128205 | AE84: 47.5903614457831 | AF84: 66.8674698795181 | AG84: 71.6129032258064 | AI84: 'Italy | AJ84: 0 | AK84: 0 | AL84: 0 | AM84: 0 | AN84: 1
A85: 'Hungary | B85: 'HUN | L85: 'JAM | M85: 'Jamaica | N85: 1 | O85: 'JAM | P85: 72.6744186046512 | Q85: 35.7142857142857 | R85: 32.9032258064516 | S85: 81.2121212121212 | T85: 24.8484848484848 | U85: 56.4935064935065 | V85: 86.7052023121387 | W85: 60.6451612903226 | X85: 64.1025641025641 | Y85: 100 | Z85: 47.5903614457831 | AA85: 70.9677419354839 | AB85: 61.849710982659 | AC85: 15.4838709677419 | AD85: 9.61538461538462 | AE85: 30.7228915662651 | AF85: 5.42168674698795 | AG85: 27.0967741935484 | AI85: 'Jamaica | AJ85: 0 | AK85: 0 | AL85: 0 | AM85: 1 | AN85: 0
A86: 'Indonesia | B86: 'IDN | L86: 'JOR | M86: 'Jordan | N86: 1 | O86: 'JOR | P86: 59.8837209302326 | Q86: 46.7532467532468 | R86: 78.0645161290323 | S86: 65.4545454545455 | T86: 75.1515151515152 | U86: 65.5844155844156 | V86: 69.9421965317919 | W86: 68.3870967741936 | X86: 84.6153846153846 | Y86: 92.7710843373494 | Z86: 86.144578313253 | AA86: 75.4838709677419 | AB86: 39.3063583815029 | AC86: 25.1612903225806 | AD86: 61.5384615384615 | AE86: 36.7469879518072 | AF86: 62.0481927710843 | AG86: 47.0967741935484 | AI86: 'Jordan | AJ86: 0 | AK86: 1 | AL86: 0 | AM86: 0 | AN86: 0
A87: 'India | B87: 'IND | L87: 'JPN | M87: 'Japan | N87: 1 | O87: 'JPN | P87: 84.3023255813954 | Q87: 87.012987012987 | R87: 82.5806451612903 | S87: 64.8484848484849 | T87: 90.9090909090909 | U87: 81.1688311688312 | V87: 100 | W87: 100 | X87: 91.025641025641 | Y87: 82.5301204819277 | Z87: 98.7951807228916 | AA87: 84.5161290322581 | AB87: 67.6300578034682 | AC87: 72.258064516129 | AD87: 68.5897435897436 | AE87: 39.7590361445783 | AF87: 81.3253012048193 | AG87: 70.9677419354839 | AI87: 'Japan | AJ87: 0 | AK87: 1 | AL87: 0 | AM87: 0 | AN87: 0
A88: 'Ireland | B88: 'IRL | L88: 'KAZ | M88: 'Kazakhstan | N88: 1 | O88: 'KAZ | P88: 25.5813953488372 | Q88: 58.4415584415584 | R88: 16.7741935483871 | S88: 25.4545454545455 | T88: 30.3030303030303 | U88: 14.2857142857143 | V88: 43.9306358381503 | W88: 74.1935483870968 | X88: 37.1794871794872 | Y88: 45.7831325301205 | Z88: 45.1807228915663 | AA88: 33.5483870967742 | AB88: 12.1387283236994 | AC88: 41.2903225806452 | AD88: 7.05128205128205 | AE88: 14.4578313253012 | AF88: 14.4578313253012 | AG88: 3.2258064516129 | AI88: 'Kazakhstan | AJ88: 1 | AK88: 0 | AL88: 0 | AM88: 0 | AN88: 0
A89: 'Iran, Islamic Rep. | B89: 'IRN | L89: 'KEN | M89: 'Kenya | N89: 1 | O89: 'KEN | P89: 27.3255813953488 | Q89: 12.3376623376623 | R89: 13.5483870967742 | S89: 35.7575757575758 | T89: 6.060606060606 | U89: 26.6233766233766 | V89: 44.5086705202312 | W89: 25.1612903225806 | X89: 33.974358974359 | Y89: 66.2650602409639 | Z89: 25.9036144578313 | AA89: 50.3225806451613 | AB89: 12.1387283236994 | AC89: 7.09677419354839 | AD89: 5.12820512820513 | AE89: 21.0843373493976 | AF89: 1.20481927710843 | AG89: 4.51612903225806 | AI89: 'Kenya | AJ89: 0 | AK89: 0 | AL89: 1 | AM89: 0 | AN89: 0
A90: 'Iraq | B90: 'IRQ | L90: 'KGZ | M90: 'Kyrgyz Republic | N90: 1 | O90: 'KGZ | P90: 43.0232558139535 | Q90: 61.6883116883117 | R90: 27.0967741935484 | S90: 18.7878787878788 | T90: 35.7575757575758 | U90: 24.025974025974 | V90: 65.3179190751445 | W90: 81.9354838709677 | X90: 59.6153846153846 | Y90: 31.9277108433735 | Z90: 51.8072289156626 | AA90: 45.8064516129032 | AB90: 17.9190751445087 | AC90: 39.3548387096774 | AD90: 8.97435897435897 | AE90: 8.43373493975904 | AF90: 18.6746987951807 | AG90: 3.2258064516129 | AI90: 'Kyrgyz Republic | AJ90: 1 | AK90: 0 | AL90: 0 | AM90: 0 | AN90: 0
A91: 'Iceland | B91: 'ISL | L91: 'KHM | M91: 'Cambodia | N91: 1 | O91: 'KHM | P91: 19.7674418604651 | Q91: 0 | R91: 0 | S91: 41.8181818181818 | T91: 46.0606060606061 | U91: 0 | V91: 44.5086705202312 | W91: 0 | X91: 0 | Y91: 96.3855421686747 | Z91: 81.3253012048193 | AA91: 0 | AB91: 3.46820809248555 | AC91: 0 | AD91: 0 | AE91: 10.2409638554217 | AF91: 3.6144578313253 | AG91: 0 | AI91: 'Cambodia | AJ91: 0 | AK91: 1 | AL91: 0 | AM91: 0 | AN91: 0
A92: 'Israel | B92: 'ISR | L92: 'KOR | M92: 'Korea, Rep. | N92: 1 | O92: 'KOR | P92: 78.4883720930233 | Q92: 56.4935064935065 | R92: 70.9677419354839 | S92: 53.9393939393939 | T92: 81.8181818181818 | U92: 66.2337662337662 | V92: 94.7976878612717 | W92: 74.1935483870968 | X92: 82.6923076923077 | Y92: 77.1084337349398 | Z92: 89.7590361445783 | AA92: 71.6129032258064 | AB92: 67.0520231213873 | AC92: 37.4193548387097 | AD92: 53.8461538461538 | AE92: 31.3253012048193 | AF92: 69.8795180722892 | AG92: 55.4838709677419 | AI92: 'Korea, Rep. | AJ92: 0 | AK92: 1 | AL92: 0 | AM92: 0 | AN92: 0
A93: 'Italy | B93: 'ITA | L93: 'KWT | M93: 'Kuwait | N93: 1 | O93: 'KWT | P93: 54.0697674418605 | Q93: 75.3246753246753 | R93: 51.6129032258065 | S93: 37.5757575757576 | T93: 80 | U93: 78.5714285714286 | V93: 67.0520231213873 | W93: 89.6774193548387 | X93: 74.3589743589744 | Y93: 78.3132530120482 | Z93: 90.9638554216867 | AA93: 85.1612903225806 | AB93: 35.8381502890173 | AC93: 52.9032258064516 | AD93: 20.5128205128205 | AE93: 15.0602409638554 | AF93: 65.0602409638554 | AG93: 64.5161290322581 | AI93: 'Kuwait | AJ93: 0 | AK93: 1 | AL93: 0 | AM93: 0 | AN93: 0
A94: 'Jamaica | B94: 'JAM | L94: 'LAO | M94: 'Lao, PDR | N94: 1 | O94: 'LAO | P94: 14.5348837209302 | Q94: 0 | R94: 0 | S94: 2.4242424242424 | T94: 6.6666666666666 | U94: 0 | V94: 39.3063583815029 | W94: 0 | X94: 0 | Y94: 21.6867469879518 | Z94: 53.0120481927711 | AA94: 0 | AB94: 0.578034682080925 | AC94: 0 | AD94: 0 | AE94: 0.602409638554217 | AF94: 0 | AG94: 0 | AI94: 'Lao, PDR | AJ94: 0 | AK94: 1 | AL94: 0 | AM94: 0 | AN94: 0
A95: 'Jordan | B95: 'JOR | L95: 'LBN | M95: 'Lebanon | N95: 1 | O95: 'LBN | P95: 38.953488372093 | Q95: 39.6103896103896 | R95: 66.4516129032258 | S95: 45.4545454545455 | T95: 62.4242424242424 | U95: 39.6103896103896 | V95: 58.9595375722543 | W95: 61.9354838709677 | X95: 82.051282051282 | Y95: 87.3493975903614 | Z95: 77.1084337349398 | AA95: 65.1612903225806 | AB95: 20.8092485549133 | AC95: 19.3548387096774 | AD95: 35.2564102564103 | AE95: 21.6867469879518 | AF95: 44.578313253012 | AG95: 12.258064516129 | AI95: 'Lebanon | AJ95: 0 | AK95: 1 | AL95: 0 | AM95: 0 | AN95: 0
A96: 'Japan | B96: 'JPN | L96: 'LBR | M96: 'Liberia | N96: 1 | O96: 'LBR | P96: 20.9302325581395 | Q96: 16.2337662337662 | R96: 12.9032258064516 | S96: 9.6969696969697 | T96: 4.8484848484848 | U96: 4.5454545454545 | V96: 39.8843930635838 | W96: 43.2258064516129 | X96: 75 | Y96: 48.1927710843374 | Z96: 47.5903614457831 | AA96: 70.9677419354839 | AB96: 5.78034682080925 | AC96: 3.87096774193548 | AD96: 0 | AE96: 0.602409638554217 | AF96: 0 | AG96: 0 | AI96: 'Liberia | AJ96: 0 | AK96: 0 | AL96: 1 | AM96: 0 | AN96: 0
A97: 'Kazakhstan | B97: 'KAZ | L97: 'LBY | M97: 'Libya | N97: 1 | O97: 'LBY | P97: 8.1395348837209 | Q97: 11.038961038961 | R97: 5.1612903225806 | S97: 0.6060606060606 | T97: 9.090909090909 | U97: 12.987012987013 | V97: 23.121387283237 | W97: 25.1612903225806 | X97: 19.8717948717949 | Y97: 3.6144578313253 | Z97: 30.7228915662651 | AA97: 41.2903225806452 | AB97: 0 | AC97: 3.87096774193548 | AD97: 0 | AE97: 0 | AF97: 1.20481927710843 | AG97: 1.29032258064516 | AI97: 'Libya | AJ97: 0 | AK97: 0 | AL97: 1 | AM97: 0 | AN97: 0
A98: 'Kenya | B98: 'KEN | L98: 'LKA | M98: 'Sri Lanka | N98: 1 | O98: 'LKA | P98: 45.3488372093023 | Q98: 6.4935064935064 | R98: 24.5161290322581 | S98: 76.969696969697 | T98: 40.6060606060606 | U98: 55.8441558441558 | V98: 63.5838150289017 | W98: 13.5483870967742 | X98: 58.3333333333333 | Y98: 100 | Z98: 62.0481927710843 | AA98: 70.9677419354839 | AB98: 29.4797687861272 | AC98: 1.93548387096774 | AD98: 7.69230769230769 | AE98: 34.3373493975904 | AF98: 16.8674698795181 | AG98: 27.0967741935484 | AI98: 'Sri Lanka | AJ98: 0 | AK98: 1 | AL98: 0 | AM98: 0 | AN98: 0
A99: 'Kyrgyz Republic | B99: 'KGZ | L99: 'LSO | M99: 'Lesotho | N99: 1 | O99: 'LSO | P99: 45.9302325581395 | Q99: 19.4805194805195 | R99: 34.1935483870968 | S99: 40 | T99: 45.4545454545455 | U99: 66.8831168831169 | V99: 67.6300578034682 | W99: 63.2258064516129 | X99: 67.3076923076923 | Y99: 77.1084337349398 | Z99: 79.5180722891566 | AA99: 83.2258064516129 | AB99: 23.121387283237 | AC99: 1.93548387096774 | AD99: 10.8974358974359 | AE99: 19.2771084337349 | AF99: 3.6144578313253 | AG99: 30.9677419354839 | AI99: 'Lesotho | AJ99: 0 | AK99: 0 | AL99: 1 | AM99: 0 | AN99: 0
A100: 'Cambodia | B100: 'KHM | L100: 'LTU | M100: 'Lithuania | N100: 1 | O100: 'LTU | P100: 73.2558139534884 | Q100: 62.3376623376623 | R100: 62.5806451612903 | S100: 44.2424242424242 | T100: 61.8181818181818 | U100: 63.6363636363636 | V100: 86.7052023121387 | W100: 78.7096774193548 | X100: 75.6410256410256 | Y100: 74.0963855421687 | Z100: 69.8795180722892 | AA100: 70.9677419354839 | AB100: 62.4277456647399 | AC100: 44.5161290322581 | AD100: 38.4615384615385 | AE100: 25.3012048192771 | AF100: 47.5903614457831 | AG100: 43.2258064516129 | AI100: 'Lithuania | AJ100: 1 | AK100: 0 | AL100: 0 | AM100: 0 | AN100: 0
A101: 'Korea, Rep. | B101: 'KOR | L101: 'LUX | M101: 'Luxembourg | N101: 1 | O101: 'LUX | P101: 92.4418604651163 | Q101: 95.4545454545455 | R101: 96.1290322580645 | S101: 92.1212121212121 | T101: 94.5454545454545 | U101: 92.2077922077922 | V101: 100 | W101: 100 | X101: 100 | Y101: 100 | Z101: 100 | AA101: 100 | AB101: 76.3005780346821 | AC101: 74.8387096774194 | AD101: 82.6923076923077 | AE101: 66.8674698795181 | AF101: 83.1325301204819 | AG101: 85.1612903225806 | AI101: 'Luxembourg | AJ101: 0 | AK101: 0 | AL101: 0 | AM101: 0 | AN101: 1
A102: 'Kuwait | B102: 'KWT | L102: 'LVA | M102: 'Latvia | N102: 1 | O102: 'LVA | P102: 69.7674418604651 | Q102: 68.1818181818182 | R102: 61.2903225806452 | S102: 67.8787878787879 | T102: 60 | U102: 49.3506493506494 | V102: 82.6589595375723 | W102: 82.5806451612903 | X102: 73.0769230769231 | Y102: 93.9759036144578 | Z102: 68.6746987951807 | AA102: 64.5161290322581 | AB102: 59.5375722543353 | AC102: 49.0322580645161 | AD102: 36.5384615384615 | AE102: 42.7710843373494 | AF102: 47.5903614457831 | AG102: 27.0967741935484 | AI102: 'Latvia | AJ102: 1 | AK102: 0 | AL102: 0 | AM102: 0 | AN102: 0
A103: 'Lao, PDR | B103: 'LAO | L103: 'MAC | M103: 'Macao, China | N103: 1 | O103: 'MAC | P103: 0 | Q103: 0 | R103: 0 | S103: 0 | T103: 0 | U103: 0 | V103: 0 | W103: 0 | X103: 0 | Y103: 0 | Z103: 0 | AA103: 0 | AB103: 0 | AC103: 0 | AD103: 0 | AE103: 0 | AF103: 0 | AG103: 0 | AI103: 'Macao, China | AJ103: 0 | AK103: 1 | AL103: 0 | AM103: 0 | AN103: 0
A104: 'Lebanon | B104: 'LBN | L104: 'MAR | M104: 'Morocco | N104: 1 | O104: 'MAR | P104: 43.6046511627907 | Q104: 52.5974025974026 | R104: 70.3225806451613 | S104: 52.7272727272727 | T104: 73.9393939393939 | U104: 64.9350649350649 | V104: 61.849710982659 | W104: 72.258064516129 | X104: 80.7692307692308 | Y104: 81.3253012048193 | Z104: 86.144578313253 | AA104: 75.4838709677419 | AB104: 25.4335260115607 | AC104: 31.6129032258065 | AD104: 48.0769230769231 | AE104: 27.1084337349398 | AF104: 62.0481927710843 | AG104: 47.0967741935484 | AI104: 'Morocco | AJ104: 0 | AK104: 0 | AL104: 1 | AM104: 0 | AN104: 0
A105: 'Liberia | B105: 'LBR | L105: 'MDA | M105: 'Moldova | N105: 1 | O105: 'MDA | P105: 60.4651162790698 | Q105: 41.5584415584416 | R105: 34.8387096774194 | S105: 30.3030303030303 | T105: 53.3333333333333 | U105: 40.2597402597403 | V105: 69.9421965317919 | W105: 60 | X105: 58.3333333333333 | Y105: 54.8192771084337 | Z105: 65.0602409638554 | AA105: 61.2903225806452 | AB105: 39.3063583815029 | AC105: 24.5161290322581 | AD105: 12.8205128205128 | AE105: 18.6746987951807 | AF105: 39.7590361445783 | AG105: 24.5161290322581 | AI105: 'Moldova | AJ105: 1 | AK105: 0 | AL105: 0 | AM105: 0 | AN105: 0
A106: 'Libya | B106: 'LBY | L106: 'MDG | M106: 'Madagascar | N106: 1 | O106: 'MDG | P106: 63.3720930232558 | Q106: 20.1298701298701 | R106: 41.9354838709677 | S106: 32.1212121212121 | T106: 20.6060606060606 | U106: 35.0649350649351 | V106: 76.3005780346821 | W106: 47.0967741935484 | X106: 71.1538461538462 | Y106: 81.9277108433735 | Z106: 50.6024096385542 | AA106: 71.6129032258064 | AB106: 42.7745664739884 | AC106: 7.74193548387097 | AD106: 12.1794871794872 | AE106: 10.2409638554217 | AF106: 1.80722891566265 | AG106: 1.29032258064516 | AI106: 'Madagascar | AJ106: 0 | AK106: 0 | AL106: 1 | AM106: 0 | AN106: 0
A107: 'Sri Lanka | B107: 'LKA | L107: 'MDV | M107: 'Maldives | N107: 1 | O107: 'MDV | P107: 19.7674418604651 | Q107: 0 | R107: 0 | S107: 0 | T107: 0 | U107: 0 | V107: 44.5086705202312 | W107: 0 | X107: 0 | Y107: 0 | Z107: 0 | AA107: 0 | AB107: 3.46820809248555 | AC107: 0 | AD107: 0 | AE107: 0 | AF107: 0 | AG107: 0 | AI107: 'Maldives | AJ107: 0 | AK107: 0 | AL107: 1 | AM107: 0 | AN107: 0
A108: 'Lesotho | B108: 'LSO | L108: 'MEX | M108: 'Mexico | N108: 1 | O108: 'MEX | P108: 48.2558139534884 | Q108: 35.0649350649351 | R108: 67.0967741935484 | S108: 75.1515151515152 | T108: 35.1515151515152 | U108: 47.4025974025974 | V108: 63.5838150289017 | W108: 55.4838709677419 | X108: 79.4871794871795 | Y108: 94.5783132530121 | Z108: 51.8072289156626 | AA108: 64.5161290322581 | AB108: 30.0578034682081 | AC108: 19.3548387096774 | AD108: 42.9487179487179 | AE108: 48.1927710843374 | AF108: 17.4698795180723 | AG108: 25.8064516129032 | AI108: 'Mexico | AJ108: 0 | AK108: 0 | AL108: 0 | AM108: 1 | AN108: 0
A109: 'Lithuania | B109: 'LTU | L109: 'MKD | M109: 'Macedonia, FYR | N109: 1 | O109: 'MKD | P109: 58.7209302325582 | Q109: 31.8181818181818 | R109: 26.4516129032258 | S109: 29.0909090909091 | T109: 44.8484848484849 | U109: 33.1168831168831 | V109: 69.9421965317919 | W109: 57.4193548387097 | X109: 53.8461538461538 | Y109: 62.0481927710843 | Z109: 59.0361445783133 | AA109: 56.1290322580645 | AB109: 35.8381502890173 | AC109: 14.8387096774194 | AD109: 10.8974358974359 | AE109: 14.4578313253012 | AF109: 29.5180722891566 | AG109: 12.258064516129 | AI109: 'Macedonia, FYR | AJ109: 1 | AK109: 0 | AL109: 0 | AM109: 0 | AN109: 0
A110: 'Luxembourg | B110: 'LUX | L110: 'MLI | M110: 'Mali | N110: 1 | O110: 'MLI | P110: 65.1162790697675 | Q110: 38.961038961039 | R110: 53.5483870967742 | S110: 59.3939393939394 | T110: 36.3636363636364 | U110: 34.4155844155844 | V110: 76.878612716763 | W110: 67.0967741935484 | X110: 83.974358974359 | Y110: 100 | Z110: 62.0481927710843 | AA110: 71.6129032258064 | AB110: 45.6647398843931 | AC110: 14.1935483870968 | AD110: 12.1794871794872 | AE110: 19.8795180722892 | AF110: 8.43373493975904 | AG110: 1.29032258064516 | AI110: 'Mali | AJ110: 0 | AK110: 0 | AL110: 1 | AM110: 0 | AN110: 0
A111: 'Latvia | B111: 'LVA | L111: 'MLT | M111: 'Malta | N111: 1 | O111: 'MLT | P111: 89.5348837209302 | Q111: 91.5584415584416 | R111: 77.4193548387097 | S111: 64.2424242424243 | T111: 79.3939393939394 | U111: 73.3766233766234 | V111: 100 | W111: 100 | X111: 100 | Y111: 100 | Z111: 96.3855421686747 | AA111: 95.4838709677419 | AB111: 75.7225433526012 | AC111: 69.6774193548387 | AD111: 14.7435897435897 | AE111: 21.6867469879518 | AF111: 55.421686746988 | AG111: 9.03225806451613 | AI111: 'Malta | AJ111: 0 | AK111: 0 | AL111: 0 | AM111: 0 | AN111: 1
A112: 'Macao, China | B112: 'MAC | L112: 'MMR | M112: 'Myanmar | N112: 1 | O112: 'MMR | P112: 1.1627906976744 | Q112: 15.5844155844156 | R112: 2.5806451612903 | S112: 12.1212121212121 | T112: 19.3939393939394 | U112: 3.8961038961039 | V112: 11.5606936416185 | W112: 33.5483870967742 | X112: 15.3846153846154 | Y112: 31.3253012048193 | Z112: 43.9759036144578 | AA112: 30.3225806451613 | AB112: 0 | AC112: 7.09677419354839 | AD112: 0 | AE112: 3.01204819277108 | AF112: 3.6144578313253 | AG112: 0 | AI112: 'Myanmar | AJ112: 0 | AK112: 1 | AL112: 0 | AM112: 0 | AN112: 0
A113: 'Morocco | B113: 'MAR | L113: 'MNG | M113: 'Mongolia | N113: 1 | O113: 'MNG | P113: 76.1627906976744 | Q113: 63.6363636363636 | R113: 59.3548387096774 | S113: 49.0909090909091 | T113: 55.7575757575758 | U113: 55.1948051948052 | V113: 89.5953757225434 | W113: 87.741935483871 | X113: 82.051282051282 | Y113: 96.9879518072289 | Z113: 72.8915662650602 | AA113: 80.6451612903226 | AB113: 62.4277456647399 | AC113: 31.6129032258065 | AD113: 19.2307692307692 | AE113: 16.8674698795181 | AF113: 30.7228915662651 | AG113: 9.03225806451613 | AI113: 'Mongolia | AJ113: 0 | AK113: 1 | AL113: 0 | AM113: 0 | AN113: 0
A114: 'Moldova | B114: 'MDA | L114: 'MOZ | M114: 'Mozambique | N114: 1 | O114: 'MOZ | P114: 44.7674418604651 | Q114: 27.2727272727273 | R114: 40 | S114: 31.5151515151515 | T114: 12.1212121212121 | U114: 31.1688311688312 | V114: 63.5838150289017 | W114: 54.1935483870968 | X114: 67.948717948718 | Y114: 65.6626506024096 | Z114: 42.7710843373494 | AA114: 64.5161290322581 | AB114: 25.4335260115607 | AC114: 10.9677419354839 | AD114: 14.1025641025641 | AE114: 15.0602409638554 | AF114: 1.20481927710843 | AG114: 3.2258064516129 | AI114: 'Mozambique | AJ114: 0 | AK114: 0 | AL114: 1 | AM114: 0 | AN114: 0
A115: 'Madagascar | B115: 'MDG | L115: 'MRT | M115: 'Mauritania | N115: 1 | O115: 'MRT | P115: 16.8604651162791 | Q115: 0 | R115: 0 | S115: 16.969696969697 | T115: 31.5151515151515 | U115: 0 | V115: 42.7745664739884 | W115: 0 | X115: 0 | Y115: 62.0481927710843 | Z115: 72.289156626506 | AA115: 0 | AB115: 2.3121387283237 | AC115: 0 | AD115: 0 | AE115: 1.80722891566265 | AF115: 1.20481927710843 | AG115: 0 | AI115: 'Mauritania | AJ115: 0 | AK115: 0 | AL115: 1 | AM115: 0 | AN115: 0
A116: 'Maldives | B116: 'MDV | L116: 'MTQ | M116: 'Martinique | N116: 1 | O116: 'MTQ | P116: 0 | Q116: 0 | R116: 0 | S116: 0 | T116: 0 | U116: 0 | V116: 0 | W116: 0 | X116: 0 | Y116: 0 | Z116: 0 | AA116: 0 | AB116: 0 | AC116: 0 | AD116: 0 | AE116: 0 | AF116: 0 | AG116: 0 | AI116: 'Martinique | AJ116: 0 | AK116: 0 | AL116: 0 | AM116: 1 | AN116: 0
A117: 'Mexico | B117: 'MEX | L117: 'MUS | M117: 'Mauritius | N117: 1 | O117: 'MUS | P117: 79.6511627906977 | Q117: 86.3636363636364 | R117: 65.1612903225807 | S117: 53.3333333333333 | T117: 89.0909090909091 | U117: 68.8311688311688 | V117: 95.9537572254335 | W117: 100 | X117: 80.7692307692308 | Y117: 90.3614457831325 | Z117: 98.7951807228916 | AA117: 81.2903225806452 | AB117: 65.3179190751445 | AC117: 65.8064516129032 | AD117: 37.8205128205128 | AE117: 24.6987951807229 | AF117: 73.4939759036145 | AG117: 56.7741935483871 | AI117: 'Mauritius | AJ117: 0 | AK117: 0 | AL117: 0 | AM117: 1 | AN117: 0
A118: 'Macedonia, FYR | B118: 'MKD | L118: 'MWI | M118: 'Malawi | N118: 1 | O118: 'MWI | P118: 57.5581395348837 | Q118: 51.2987012987013 | R118: 23.2258064516129 | S118: 43.030303030303 | T118: 38.1818181818182 | U118: 53.2467532467532 | V118: 67.6300578034682 | W118: 72.258064516129 | X118: 48.0769230769231 | Y118: 79.5180722891566 | Z118: 59.0361445783133 | AA118: 67.0967741935484 | AB118: 37.5722543352601 | AC118: 27.0967741935484 | AD118: 11.5384615384615 | AE118: 22.8915662650602 | AF118: 14.4578313253012 | AG118: 27.0967741935484 | AI118: 'Malawi | AJ118: 0 | AK118: 0 | AL118: 0 | AM118: 1 | AN118: 0
A119: 'Mali | B119: 'MLI | L119: 'MYS | M119: 'Malaysia | N119: 1 | O119: 'MYS | P119: 46.5116279069767 | Q119: 70.1298701298701 | R119: 81.2903225806452 | S119: 67.2727272727273 | T119: 78.1818181818182 | U119: 79.8701298701299 | V119: 63.5838150289017 | W119: 84.5161290322581 | X119: 85.8974358974359 | Y119: 90.3614457831325 | Z119: 86.7469879518072 | AA119: 83.2258064516129 | AB119: 29.4797687861272 | AC119: 51.6129032258064 | AD119: 68.5897435897436 | AE119: 42.7710843373494 | AF119: 66.8674698795181 | AG119: 68.3870967741936 | AI119: 'Malaysia | AJ119: 0 | AK119: 1 | AL119: 0 | AM119: 0 | AN119: 0
A120: 'Malta | B120: 'MLT | L120: 'NAM | M120: 'Namibia | N120: 1 | O120: 'NAM | P120: 65.6976744186047 | Q120: 75.974025974026 | R120: 60 | S120: 56.969696969697 | T120: 82.4242424242424 | U120: 70.1298701298701 | V120: 76.878612716763 | W120: 92.258064516129 | X120: 73.0769230769231 | Y120: 90.3614457831325 | Z120: 92.7710843373494 | AA120: 83.2258064516129 | AB120: 52.0231213872832 | AC120: 52.9032258064516 | AD120: 35.2564102564103 | AE120: 25.9036144578313 | AF120: 65.0602409638554 | AG120: 56.7741935483871 | AI120: 'Namibia | AJ120: 0 | AK120: 0 | AL120: 1 | AM120: 0 | AN120: 0
A121: 'Myanmar | B121: 'MMR | L121: 'NER | M121: 'Niger | N121: 1 | O121: 'NER | P121: 25 | Q121: 20.7792207792208 | R121: 4.516129032258 | S121: 23.030303030303 | T121: 8.4848484848484 | U121: 0 | V121: 44.5086705202312 | W121: 51.6129032258064 | X121: 61.5384615384615 | Y121: 67.4698795180723 | Z121: 44.578313253012 | AA121: 56.7741935483871 | AB121: 9.2485549132948 | AC121: 7.09677419354839 | AD121: 0 | AE121: 3.6144578313253 | AF121: 0.602409638554217 | AG121: 0 | AI121: 'Niger | AJ121: 0 | AK121: 0 | AL121: 1 | AM121: 0 | AN121: 0
A122: 'Mongolia | B122: 'MNG | L122: 'NGA | M122: 'Nigeria | N122: 1 | O122: 'NGA | P122: 11.6279069767442 | Q122: 12.987012987013 | R122: 5.8064516129032 | S122: 27.2727272727273 | T122: 11.5151515151515 | U122: 10.3896103896104 | V122: 25.4335260115607 | W122: 27.0967741935484 | X122: 14.7435897435897 | Y122: 54.2168674698795 | Z122: 30.1204819277108 | AA122: 30.3225806451613 | AB122: 1.73410404624277 | AC122: 7.09677419354839 | AD122: 1.28205128205128 | AE122: 14.4578313253012 | AF122: 1.80722891566265 | AG122: 1.29032258064516 | AI122: 'Nigeria | AJ122: 0 | AK122: 0 | AL122: 1 | AM122: 0 | AN122: 0
A123: 'Mozambique | B123: 'MOZ | L123: 'NIC | M123: 'Nicaragua | N123: 1 | O123: 'NIC | P123: 58.1395348837209 | Q123: 37.6623376623377 | R123: 29.6774193548387 | S123: 36.969696969697 | T123: 25.4545454545455 | U123: 18.1818181818182 | V123: 67.6300578034682 | W123: 60.6451612903226 | X123: 67.3076923076923 | Y123: 90.3614457831325 | Z123: 47.5903614457831 | AA123: 42.5806451612903 | AB123: 37.5722543352601 | AC123: 16.7741935483871 | AD123: 7.05128205128205 | AE123: 12.0481927710843 | AF123: 5.42168674698795 | AG123: 1.29032258064516 | AI123: 'Nicaragua | AJ123: 0 | AK123: 0 | AL123: 0 | AM123: 1 | AN123: 0
A124: 'Mauritania | B124: 'MRT | L124: 'NLD | M124: 'Netherlands | N124: 1 | O124: 'NLD | P124: 97.093023255814 | Q124: 98.7012987012987 | R124: 99.3548387096774 | S124: 96.3636363636364 | T124: 93.3333333333333 | U124: 96.1038961038961 | V124: 100 | W124: 100 | X124: 100 | Y124: 100 | Z124: 100 | AA124: 100 | AB124: 82.0809248554913 | AC124: 83.8709677419355 | AD124: 92.3076923076923 | AE124: 78.3132530120482 | AF124: 86.144578313253 | AG124: 91.6129032258064 | AI124: 'Netherlands | AJ124: 0 | AK124: 0 | AL124: 0 | AM124: 0 | AN124: 1
A125: 'Martinique | B125: 'MTQ | L125: 'NOR | M125: 'Norway | N125: 1 | O125: 'NOR | P125: 99.4186046511628 | Q125: 96.7532467532468 | R125: 95.4838709677419 | S125: 91.5151515151515 | T125: 98.7878787878788 | U125: 92.8571428571429 | V125: 100 | W125: 100 | X125: 100 | Y125: 100 | Z125: 100 | AA125: 97.4193548387097 | AB125: 83.8150289017341 | AC125: 80.6451612903226 | AD125: 85.8974358974359 | AE125: 67.4698795180723 | AF125: 90.3614457831325 | AG125: 87.741935483871 | AI125: 'Norway | AJ125: 0 | AK125: 0 | AL125: 0 | AM125: 0 | AN125: 1
A126: 'Mauritius | B126: 'MUS | L126: 'NPL | M126: 'Nepal | N126: 1 | O126: 'NPL | P126: 56.3953488372093 | Q126: 0 | R126: 0 | S126: 26.6666666666667 | T126: 31.5151515151515 | U126: 0 | V126: 72.8323699421965 | W126: 0 | X126: 0 | Y126: 81.9277108433735 | Z126: 72.289156626506 | AA126: 0 | AB126: 29.4797687861272 | AC126: 0 | AD126: 0 | AE126: 3.6144578313253 | AF126: 1.20481927710843 | AG126: 0 | AI126: 'Nepal | AJ126: 0 | AK126: 1 | AL126: 0 | AM126: 0 | AN126: 0
A127: 'Malawi | B127: 'MWI | L127: 'NZL | M127: 'New Zealand | N127: 1 | O127: 'NZL | P127: 91.8604651162791 | Q127: 97.4025974025974 | R127: 92.9032258064516 | S127: 97.5757575757576 | T127: 98.1818181818182 | U127: 98.0519480519481 | V127: 100 | W127: 100 | X127: 100 | Y127: 100 | Z127: 100 | AA127: 100 | AB127: 76.878612716763 | AC127: 80.6451612903226 | AD127: 84.6153846153846 | AE127: 80.7228915662651 | AF127: 89.7590361445783 | AG127: 92.258064516129 | AI127: 'New Zealand | AJ127: 0 | AK127: 0 | AL127: 0 | AM127: 0 | AN127: 1
A128: 'Malaysia | B128: 'MYS | L128: 'OMN | M128: 'Oman | N128: 1 | O128: 'OMN | P128: 31.3953488372093 | Q128: 81.8181818181818 | R128: 83.8709677419355 | S128: 61.2121212121212 | T128: 84.2424242424242 | U128: 72.0779220779221 | V128: 50.2890173410405 | W128: 98.7096774193548 | X128: 92.3076923076923 | Y128: 94.5783132530121 | Z128: 93.9759036144578 | AA128: 83.2258064516129 | AB128: 13.8728323699422 | AC128: 61.9354838709677 | AD128: 70.5128205128205 | AE128: 24.6987951807229 | AF128: 69.8795180722892 | AG128: 57.4193548387097 | AI128: 'Oman | AJ128: 0 | AK128: 1 | AL128: 0 | AM128: 0 | AN128: 0
A129: 'Namibia | B129: 'NAM | L129: 'PAK | M129: 'Pakistan | N129: 1 | O129: 'PAK | P129: 36.6279069767442 | Q129: 24.6753246753247 | R129: 18.7096774193548 | S129: 32.7272727272727 | T129: 23.6363636363636 | U129: 23.3766233766234 | V129: 56.6473988439306 | W129: 43.8709677419355 | X129: 45.5128205128205 | Y129: 62.0481927710843 | Z129: 43.9759036144578 | AA129: 43.2258064516129 | AB129: 17.9190751445087 | AC129: 11.6129032258065 | AD129: 7.05128205128205 | AE129: 19.8795180722892 | AF129: 6.02409638554217 | AG129: 3.2258064516129 | AI129: 'Pakistan | AJ129: 0 | AK129: 1 | AL129: 0 | AM129: 0 | AN129: 0
A130: 'Niger | B130: 'NER | L130: 'PAN | M130: 'Panama | N130: 1 | O130: 'PAN | P130: 70.3488372093023 | Q130: 55.8441558441558 | R130: 43.2258064516129 | S130: 93.939393939394 | T130: 39.3939393939394 | U130: 37.012987012987 | V130: 83.8150289017341 | W130: 76.1290322580645 | X130: 70.5128205128205 | Y130: 100 | Z130: 59.6385542168675 | AA130: 64.5161290322581 | AB130: 60.6936416184971 | AC130: 31.6129032258065 | AD130: 13.4615384615385 | AE130: 54.2168674698795 | AF130: 14.4578313253012 | AG130: 9.03225806451613 | AI130: 'Panama | AJ130: 0 | AK130: 0 | AL130: 0 | AM130: 1 | AN130: 0
A131: 'Nigeria | B131: 'NGA | L131: 'PER | M131: 'Peru | N131: 1 | O131: 'PER | P131: 27.906976744186 | Q131: 27.9220779220779 | R131: 65.8064516129032 | S131: 78.1818181818182 | T131: 33.3333333333333 | U131: 52.5974025974026 | V131: 44.5086705202312 | W131: 47.741935483871 | X131: 79.4871794871795 | Y131: 97.5903614457831 | Z131: 51.2048192771084 | AA131: 67.0967741935484 | AB131: 12.1387283236994 | AC131: 14.1935483870968 | AD131: 40.3846153846154 | AE131: 46.9879518072289 | AF131: 14.4578313253012 | AG131: 27.0967741935484 | AI131: 'Peru | AJ131: 0 | AK131: 0 | AL131: 0 | AM131: 1 | AN131: 0
A132: 'Nicaragua | B132: 'NIC | L132: 'PHL | M132: 'Philippines | N132: 1 | O132: 'PHL | P132: 68.6046511627907 | Q132: 60.3896103896104 | R132: 61.9354838709678 | S132: 71.5151515151515 | T132: 51.5151515151515 | U132: 51.2987012987013 | V132: 82.0809248554913 | W132: 77.4193548387097 | X132: 76.2820512820513 | Y132: 93.9759036144578 | Z132: 65.0602409638554 | AA132: 64.5161290322581 | AB132: 58.9595375722543 | AC132: 40.6451612903226 | AD132: 37.8205128205128 | AE132: 45.7831325301205 | AF132: 33.7349397590361 | AG132: 30.9677419354839 | AI132: 'Philippines | AJ132: 0 | AK132: 1 | AL132: 0 | AM132: 0 | AN132: 0
A133: 'Netherlands | B133: 'NLD | L133: 'PNG | M133: 'Papua New Guinea | N133: 1 | O133: 'PNG | P133: 59.3023255813954 | Q133: 33.1168831168831 | R133: 20 | S133: 36.3636363636364 | T133: 43.6363636363636 | U133: 15.5844155844156 | V133: 69.364161849711 | W133: 60.6451612903226 | X133: 59.6153846153846 | Y133: 89.1566265060241 | Z133: 64.4578313253012 | AA133: 48.3870967741936 | AB133: 39.3063583815029 | AC133: 12.9032258064516 | AD133: 3.20512820512821 | AE133: 11.4457831325301 | AF133: 15.0602409638554 | AG133: 1.29032258064516 | AI133: 'Papua New Guinea | AJ133: 0 | AK133: 1 | AL133: 0 | AM133: 0 | AN133: 0
A134: 'Norway | B134: 'NOR | L134: 'POL | M134: 'Poland | N134: 1 | O134: 'POL | P134: 80.8139534883721 | Q134: 80.5194805194805 | R134: 80 | S134: 70.9090909090909 | T134: 70.3030303030303 | U134: 72.7272727272727 | V134: 95.9537572254335 | W134: 89.6774193548387 | X134: 84.6153846153846 | Y134: 91.566265060241 | Z134: 78.3132530120482 | AA134: 82.5806451612903 | AB134: 67.6300578034682 | AC134: 66.4516129032258 | AD134: 70.5128205128205 | AE134: 50.6024096385542 | AF134: 62.0481927710843 | AG134: 66.4516129032258 | AI134: 'Poland | AJ134: 1 | AK134: 0 | AL134: 0 | AM134: 0 | AN134: 0
A135: 'Nepal | B135: 'NPL | L135: 'PRI | M135: 'Puerto Rico | N135: 1 | O135: 'PRI | P135: 0 | Q135: 77.2727272727273 | R135: 87.741935483871 | S135: 83.6363636363636 | T135: 76.3636363636364 | U135: 85.0649350649351 | V135: 0 | W135: 100 | X135: 100 | Y135: 100 | Z135: 96.9879518072289 | AA135: 100 | AB135: 0 | AC135: 39.3548387096774 | AD135: 68.5897435897436 | AE135: 33.1325301204819 | AF135: 47.5903614457831 | AG135: 64.5161290322581 | AI135: 'Puerto Rico | AJ135: 0 | AK135: 0 | AL135: 0 | AM135: 0 | AN135: 1
A136: 'New Zealand | B136: 'NZL | L136: 'PRK | M136: 'Korea, Dem. Rep. | N136: 1 | O136: 'PRK | P136: 0 | Q136: 63.6363636363636 | R136: 40.6451612903226 | S136: 6.060606060606 | T136: 28.4848484848485 | U136: 31.8181818181818 | V136: 12.1387283236994 | W136: 87.741935483871 | X136: 85.8974358974359 | Y136: 25.9036144578313 | Z136: 62.0481927710843 | AA136: 83.2258064516129 | AB136: 0 | AC136: 31.6129032258065 | AD136: 0.641025641025641 | AE136: 0.602409638554217 | AF136: 1.80722891566265 | AG136: 0 | AI136: 'Korea, Dem. Rep. | AJ136: 0 | AK136: 1 | AL136: 0 | AM136: 0 | AN136: 0
A137: 'Oman | B137: 'OMN | L137: 'PRT | M137: 'Portugal | N137: 1 | O137: 'PRT | P137: 93.0232558139535 | Q137: 94.1558441558442 | R137: 85.1612903225806 | S137: 88.4848484848485 | T137: 85.4545454545455 | U137: 86.3636363636364 | V137: 100 | W137: 100 | X137: 94.2307692307692 | Y137: 100 | Z137: 92.1686746987952 | AA137: 90.3225806451613 | AB137: 77.4566473988439 | AC137: 80.6451612903226 | AD137: 80.7692307692308 | AE137: 66.2650602409639 | AF137: 73.4939759036145 | AG137: 83.2258064516129 | AI137: 'Portugal | AJ137: 0 | AK137: 0 | AL137: 0 | AM137: 0 | AN137: 1
A138: 'Pakistan | B138: 'PAK | L138: 'PRY | M138: 'Paraguay | N138: 1 | O138: 'PRY | P138: 37.7906976744186 | Q138: 25.3246753246753 | R138: 10.9677419354839 | S138: 63.030303030303 | T138: 27.8787878787879 | U138: 9.7402597402597 | V138: 58.3815028901734 | W138: 51.6129032258064 | X138: 35.2564102564103 | Y138: 100 | Z138: 50 | AA138: 39.3548387096774 | AB138: 19.6531791907514 | AC138: 10.9677419354839 | AD138: 1.28205128205128 | AE138: 21.6867469879518 | AF138: 5.42168674698795 | AG138: 1.29032258064516 | AI138: 'Paraguay | AJ138: 0 | AK138: 0 | AL138: 0 | AM138: 1 | AN138: 0
A139: 'Panama | B139: 'PAN | L139: 'QAT | M139: 'Qatar | N139: 1 | O139: 'QAT | P139: 23.8372093023256 | Q139: 93.5064935064935 | R139: 72.258064516129 | S139: 61.8181818181818 | T139: 88.4848484848485 | U139: 75.974025974026 | V139: 42.7745664739884 | W139: 100 | X139: 84.6153846153846 | Y139: 94.5783132530121 | Z139: 96.9879518072289 | AA139: 84.5161290322581 | AB139: 10.9826589595376 | AC139: 78.0645161290323 | AD139: 49.3589743589744 | AE139: 25.3012048192771 | AF139: 75.3012048192771 | AG139: 63.8709677419355 | AI139: 'Qatar | AJ139: 0 | AK139: 1 | AL139: 0 | AM139: 0 | AN139: 0
A140: 'Peru | B140: 'PER | L140: 'REU | M140: 'Reunion | N140: 1 | O140: 'REU | P140: 0 | Q140: 0 | R140: 0 | S140: 0 | T140: 0 | U140: 0 | V140: 0 | W140: 0 | X140: 0 | Y140: 0 | Z140: 0 | AA140: 0 | AB140: 0 | AC140: 0 | AD140: 0 | AE140: 0 | AF140: 0 | AG140: 0 | AI140: 'Reunion | AJ140: 0 | AK140: 1 | AL140: 0 | AM140: 0 | AN140: 0
A141: 'Philippines | B141: 'PHL | L141: 'ROM | M141: 'Romania | N141: 1 | O141: 'ROM | P141: 64.5348837209302 | Q141: 50.6493506493506 | R141: 27.741935483871 | S141: 52.1212121212121 | T141: 50.9090909090909 | U141: 37.6623376623377 | V141: 76.3005780346821 | W141: 69.0322580645161 | X141: 51.9230769230769 | Y141: 78.9156626506024 | Z141: 64.4578313253012 | AA141: 56.7741935483871 | AB141: 49.1329479768786 | AC141: 31.6129032258065 | AD141: 12.1794871794872 | AE141: 28.9156626506024 | AF141: 36.7469879518072 | AG141: 18.7096774193548 | AI141: 'Romania | AJ141: 1 | AK141: 0 | AL141: 0 | AM141: 0 | AN141: 0
A142: 'Papua New Guinea | B142: 'PNG | L142: 'RUS | M142: 'Russian Federation | N142: 1 | O142: 'RUS | P142: 40.6976744186047 | Q142: 24.025974025974 | R142: 25.1612903225806 | S142: 29.6969696969697 | T142: 26.0606060606061 | U142: 27.2727272727273 | V142: 61.271676300578 | W142: 39.3548387096774 | X142: 47.4358974358974 | Y142: 42.7710843373494 | Z142: 38.5542168674699 | AA142: 45.1612903225806 | AB142: 23.121387283237 | AC142: 12.258064516129 | AD142: 12.1794871794872 | AE142: 21.6867469879518 | AF142: 12.6506024096386 | AG142: 11.6129032258065 | AI142: 'Russian Federation | AJ142: 1 | AK142: 0 | AL142: 0 | AM142: 0 | AN142: 0
A143: 'Poland | B143: 'POL | L143: 'RWA | M143: 'Rwanda | N143: 1 | O143: 'RWA | P143: 12.2093023255814 | Q143: 0 | R143: 0 | S143: 10.9090909090909 | T143: 6.6666666666666 | U143: 0 | V143: 35.8381502890173 | W143: 0 | X143: 0 | Y143: 42.7710843373494 | Z143: 53.0120481927711 | AA143: 0 | AB143: 0 | AC143: 0 | AD143: 0 | AE143: 1.20481927710843 | AF143: 0 | AG143: 0 | AI143: 'Rwanda | AJ143: 0 | AK143: 0 | AL143: 1 | AM143: 0 | AN143: 0
A144: 'Puerto Rico | B144: 'PRI | L144: 'SAU | M144: 'Saudi Arabia | N144: 1 | O144: 'SAU | P144: 13.3720930232558 | Q144: 59.0909090909091 | R144: 38.0645161290323 | S144: 35.1515151515152 | T144: 67.2727272727273 | U144: 29.8701298701299 | V144: 29.4797687861272 | W144: 77.4193548387097 | X144: 67.3076923076923 | Y144: 77.1084337349398 | Z144: 83.1325301204819 | AA144: 57.4193548387097 | AB144: 3.46820809248555 | AC144: 38.7096774193548 | AD144: 13.4615384615385 | AE144: 14.4578313253012 | AF144: 55.421686746988 | AG144: 4.51612903225806 | AI144: 'Saudi Arabia | AJ144: 0 | AK144: 1 | AL144: 0 | AM144: 0 | AN144: 0
A145: 'Korea, Dem. Rep. | B145: 'PRK | L145: 'SDN | M145: 'Sudan | N145: 1 | O145: 'SDN | P145: 4.6511627906976 | Q145: 3.8961038961039 | R145: 1.2903225806451 | S145: 18.1818181818182 | T145: 3.6363636363636 | U145: 5.8441558441558 | V145: 16.1849710982659 | W145: 12.9032258064516 | X145: 12.1794871794872 | Y145: 50.6024096385542 | Z145: 24.0963855421687 | AA145: 39.3548387096774 | AB145: 0 | AC145: 1.29032258064516 | AD145: 0 | AE145: 2.40963855421687 | AF145: 0.602409638554217 | AG145: 0 | AI145: 'Sudan | AJ145: 0 | AK145: 0 | AL145: 1 | AM145: 0 | AN145: 0
A146: 'Portugal | B146: 'PRT | L146: 'SEN | M146: 'Senegal | N146: 1 | O146: 'SEN | P146: 41.2790697674419 | Q146: 18.8311688311688 | R146: 60.6451612903226 | S146: 28.4848484848485 | T146: 50.3030303030303 | U146: 50.6493506493506 | V146: 61.271676300578 | W146: 40.6451612903226 | X146: 76.2820512820513 | Y146: 78.3132530120482 | Z146: 66.8674698795181 | AA146: 67.741935483871 | AB146: 23.121387283237 | AC146: 7.74193548387097 | AD146: 30.7692307692308 | AE146: 7.2289156626506 | AF146: 30.1204819277108 | AG146: 24.5161290322581 | AI146: 'Senegal | AJ146: 0 | AK146: 0 | AL146: 1 | AM146: 0 | AN146: 0
A147: 'Paraguay | B147: 'PRY | L147: 'SGP | M147: 'Singapore | N147: 1 | O147: 'SGP | P147: 55.8139534883721 | Q147: 94.8051948051948 | R147: 100 | S147: 100 | T147: 99.3939393939394 | U147: 95.4545454545455 | V147: 67.0520231213873 | W147: 100 | X147: 100 | Y147: 100 | Z147: 100 | AA147: 100 | AB147: 36.4161849710983 | AC147: 80.6451612903226 | AD147: 94.2307692307692 | AE147: 81.9277108433735 | AF147: 92.1686746987952 | AG147: 91.6129032258064 | AI147: 'Singapore | AJ147: 0 | AK147: 1 | AL147: 0 | AM147: 0 | AN147: 0
A148: 'Qatar | B148: 'QAT | L148: 'SLB | M148: 'Solomon Islands | N148: 1 | O148: 'SLB | P148: 84.8837209302326 | Q148: 0 | R148: 0 | S148: 0 | T148: 0 | U148: 0 | V148: 100 | W148: 0 | X148: 0 | Y148: 0 | Z148: 0 | AA148: 0 | AB148: 65.3179190751445 | AC148: 0 | AD148: 0 | AE148: 0 | AF148: 0 | AG148: 0 | AI148: 'Solomon Islands | AJ148: 0 | AK148: 1 | AL148: 0 | AM148: 0 | AN148: 0
A149: 'Reunion | B149: 'REU | L149: 'SLE | M149: 'Sierra Leone | N149: 1 | O149: 'SLE | P149: 2.3255813953488 | Q149: 7.1428571428571 | R149: 56.1290322580645 | S149: 4.8484848484848 | T149: 16.3636363636364 | U149: 58.4415584415584 | V149: 13.8728323699422 | W149: 23.8709677419355 | X149: 92.3076923076923 | Y149: 24.6987951807229 | Z149: 53.0120481927711 | AA149: 89.0322580645161 | AB149: 0 | AC149: 1.29032258064516 | AD149: 2.56410256410256 | AE149: 0.602409638554217 | AF149: 1.20481927710843 | AG149: 1.29032258064516 | AI149: 'Sierra Leone | AJ149: 0 | AK149: 0 | AL149: 1 | AM149: 0 | AN149: 0
A150: 'Romania | B150: 'ROM | L150: 'SLV | M150: 'El Salvador | N150: 1 | O150: 'SLV | P150: 48.8372093023256 | Q150: 48.0519480519481 | R150: 44.5161290322581 | S150: 99.3939393939394 | T150: 29.6969696969697 | U150: 41.5584415584416 | V150: 64.1618497109827 | W150: 72.258064516129 | X150: 71.1538461538462 | Y150: 100 | Z150: 50 | AA150: 64.5161290322581 | AB150: 30.0578034682081 | AC150: 25.1612903225806 | AD150: 12.1794871794872 | AE150: 52.4096385542169 | AF150: 8.43373493975904 | AG150: 21.2903225806452 | AI150: 'El Salvador | AJ150: 0 | AK150: 0 | AL150: 0 | AM150: 1 | AN150: 0
A151: 'Russian Federation | B151: 'RUS | L151: 'SOM | M151: 'Somalia | N151: 1 | O151: 'SOM | P151: 1.7441860465116 | Q151: 4.5454545454545 | R151: 1.9354838709677 | S151: 3.030303030303 | T151: 1.8181818181818 | U151: 4.5454545454545 | V151: 13.2947976878613 | W151: 18.7096774193548 | X151: 47.4358974358974 | Y151: 19.2771084337349 | Z151: 30.1204819277108 | AA151: 70.9677419354839 | AB151: 0 | AC151: 0.645161290322581 | AD151: 0 | AE151: 0.602409638554217 | AF151: 0 | AG151: 0 | AI151: 'Somalia | AJ151: 0 | AK151: 0 | AL151: 1 | AM151: 0 | AN151: 0
A152: 'Rwanda | B152: 'RWA | L152: 'STP | M152: 'Sao Tome and Principe | N152: 1 | O152: 'STP | P152: 75.5813953488372 | Q152: 0 | R152: 0 | S152: 0 | T152: 0 | U152: 0 | V152: 95.9537572254335 | W152: 0 | X152: 0 | Y152: 0 | Z152: 0 | AA152: 0 | AB152: 58.9595375722543 | AC152: 0 | AD152: 0 | AE152: 0 | AF152: 0 | AG152: 0 | AI152: 'Sao Tome and Principe | AJ152: 0 | AK152: 0 | AL152: 0 | AM152: 1 | AN152: 0
A153: 'Saudi Arabia | B153: 'SAU | L153: 'SUR | M153: 'Suriname | N153: 1 | O153: 'SUR | P153: 62.7906976744186 | Q153: 42.2077922077922 | R153: 49.0322580645161 | S153: 21.8181818181818 | T153: 24.2424242424242 | U153: 58.4415584415584 | V153: 76.3005780346821 | W153: 72.258064516129 | X153: 89.1025641025641 | Y153: 66.2650602409639 | Z153: 59.0361445783133 | AA153: 89.0322580645161 | AB153: 42.1965317919075 | AC153: 14.1935483870968 | AD153: 2.56410256410256 | AE153: 3.6144578313253 | AF153: 1.80722891566265 | AG153: 1.29032258064516 | AI153: 'Suriname | AJ153: 0 | AK153: 0 | AL153: 0 | AM153: 1 | AN153: 0
A154: 'Sudan | B154: 'SDN | L154: 'SVK | M154: 'Slovak Republic | N154: 1 | O154: 'SVK | P154: 72.093023255814 | Q154: 73.3766233766234 | R154: 54.1935483870968 | S154: 48.4848484848485 | T154: 58.7878787878788 | U154: 62.987012987013 | V154: 86.1271676300578 | W154: 85.1612903225806 | X154: 70.5128205128205 | Y154: 73.4939759036145 | Z154: 66.8674698795181 | AA154: 69.6774193548387 | AB154: 61.849710982659 | AC154: 58.0645161290323 | AD154: 33.974358974359 | AE154: 30.7228915662651 | AF154: 47.5903614457831 | AG154: 44.5161290322581 | AI154: 'Slovak Republic | AJ154: 1 | AK154: 0 | AL154: 0 | AM154: 0 | AN154: 0
A155: 'Senegal | B155: 'SEN | L155: 'SVN | M155: 'Slovenia | N155: 1 | O155: 'SVN | P155: 80.2325581395349 | Q155: 85.0649350649351 | R155: 74.8387096774194 | S155: 69.0909090909091 | T155: 77.5757575757576 | U155: 83.7662337662338 | V155: 95.9537572254335 | W155: 99.3548387096774 | X155: 84.6153846153846 | Y155: 93.9759036144578 | Z155: 86.144578313253 | AA155: 89.0322580645161 | AB155: 67.6300578034682 | AC155: 72.258064516129 | AD155: 60.8974358974359 | AE155: 42.7710843373494 | AF155: 66.8674698795181 | AG155: 77.4193548387097 | AI155: 'Slovenia | AJ155: 1 | AK155: 0 | AL155: 0 | AM155: 0 | AN155: 0
A156: 'Singapore | B156: 'SGP | L156: 'SWE | M156: 'Sweden | N156: 1 | O156: 'SWE | P156: 97.6744186046512 | Q156: 96.1038961038961 | R156: 93.5483870967742 | S156: 84.2424242424242 | T156: 95.1515151515152 | U156: 99.3506493506494 | V156: 100 | W156: 100 | X156: 99.3589743589744 | Y156: 100 | Z156: 100 | AA156: 100 | AB156: 82.6589595375723 | AC156: 80.6451612903226 | AD156: 84.6153846153846 | AE156: 65.0602409638554 | AF156: 86.144578313253 | AG156: 92.9032258064516 | AI156: 'Sweden | AJ156: 0 | AK156: 0 | AL156: 0 | AM156: 0 | AN156: 1
A157: 'Solomon Islands | B157: 'SLB | L157: 'SWZ | M157: 'Swaziland | N157: 1 | O157: 'SWZ | P157: 23.2558139534884 | Q157: 5.8441558441558 | R157: 33.5483870967742 | S157: 60 | T157: 52.1212121212121 | U157: 61.6883116883117 | V157: 50.2890173410405 | W157: 29.6774193548387 | X157: 64.7435897435898 | Y157: 93.3734939759036 | Z157: 83.7349397590361 | AA157: 81.2903225806452 | AB157: 5.20231213872832 | AC157: 0 | AD157: 10.2564102564103 | AE157: 25.9036144578313 | AF157: 8.43373493975904 | AG157: 25.1612903225806 | AI157: 'Swaziland | AJ157: 0 | AK157: 0 | AL157: 1 | AM157: 0 | AN157: 0
A158: 'Sierra Leone | B158: 'SLE | L158: 'SYR | M158: 'Syrian Arab Republic | N158: 1 | O158: 'SYR | P158: 7.5581395348837 | Q158: 51.9480519480519 | R158: 8.3870967741935 | S158: 14.5454545454545 | T158: 44.2424242424242 | U158: 21.4285714285714 | V158: 21.9653179190751 | W158: 74.8387096774194 | X158: 29.4871794871795 | Y158: 35.5421686746988 | Z158: 62.0481927710843 | AA158: 49.0322580645161 | AB158: 0 | AC158: 29.6774193548387 | AD158: 0.641025641025641 | AE158: 3.6144578313253 | AF158: 19.8795180722892 | AG158: 1.93548387096774 | AI158: 'Syrian Arab Republic | AJ158: 0 | AK158: 1 | AL158: 0 | AM158: 0 | AN158: 0
A159: 'El Salvador | B159: 'SLV | L159: 'TCD | M159: 'Chad | N159: 1 | O159: 'TCD | P159: 22.6744186046512 | Q159: 22.7272727272727 | R159: 19.3548387096774 | S159: 19.3939393939394 | T159: 20 | U159: 29.2207792207792 | V159: 45.0867052023121 | W159: 70.3225806451613 | X159: 70.5128205128205 | Y159: 66.2650602409639 | Z159: 56.0240963855422 | AA159: 71.6129032258064 | AB159: 4.6242774566474 | AC159: 1.93548387096774 | AD159: 0.641025641025641 | AE159: 2.40963855421687 | AF159: 1.20481927710843 | AG159: 0 | AI159: 'Chad | AJ159: 0 | AK159: 0 | AL159: 1 | AM159: 0 | AN159: 0
A160: 'Somalia | B160: 'SOM | L160: 'TGO | M160: 'Togo | N160: 1 | O160: 'TGO | P160: 13.953488372093 | Q160: 18.1818181818182 | R160: 37.4193548387097 | S160: 15.7575757575758 | T160: 21.8181818181818 | U160: 50 | V160: 35.8381502890173 | W160: 43.2258064516129 | X160: 76.9230769230769 | Y160: 48.1927710843374 | Z160: 51.8072289156626 | AA160: 80.6451612903226 | AB160: 3.46820809248555 | AC160: 6.45161290322581 | AD160: 5.12820512820513 | AE160: 2.40963855421687 | AF160: 1.80722891566265 | AG160: 3.2258064516129 | AI160: 'Togo | AJ160: 0 | AK160: 0 | AL160: 1 | AM160: 0 | AN160: 0
A161: 'Sao Tome and Principe and Pr | B161: 'STP | L161: 'THA | M161: 'Thailand | N161: 1 | O161: 'THA | P161: 61.6279069767442 | Q161: 59.7402597402597 | R161: 58.0645161290323 | S161: 50.9090909090909 | T161: 66.6666666666667 | U161: 54.5454545454545 | V161: 71.6763005780347 | W161: 76.1290322580645 | X161: 71.1538461538462 | Y161: 77.1084337349398 | Z161: 77.1084337349398 | AA161: 65.8064516129032 | AB161: 42.7745664739884 | AC161: 40.6451612903226 | AD161: 35.2564102564103 | AE161: 30.7228915662651 | AF161: 55.421686746988 | AG161: 34.8387096774194 | AI161: 'Thailand | AJ161: 0 | AK161: 1 | AL161: 0 | AM161: 0 | AN161: 0
A162: 'Suriname | B162: 'SUR | L162: 'TJK | M162: 'Tajikistan | N162: 1 | O162: 'TJK | P162: 4.0697674418604 | Q162: 1.9480519480519 | R162: 3.2258064516129 | S162: 4.2424242424242 | T162: 4.2424242424242 | U162: 1.2987012987013 | V162: 22.5433526011561 | W162: 10.3225806451613 | X162: 17.9487179487179 | Y162: 14.4578313253012 | Z162: 16.2650602409639 | AA162: 20 | AB162: 0 | AC162: 0.645161290322581 | AD162: 0 | AE162: 1.80722891566265 | AF162: 1.20481927710843 | AG162: 0 | AI162: 'Tajikistan | AJ162: 1 | AK162: 0 | AL162: 0 | AM162: 0 | AN162: 0
A163: 'Slovak Republic | B163: 'SVK | L163: 'TKM | M163: 'Turkmenistan | N163: 1 | O163: 'TKM | P163: 5.813953488372 | Q163: 49.3506493506494 | R163: 7.0967741935483 | S163: 1.8181818181818 | T163: 13.9393939393939 | U163: 1.9480519480519 | V163: 24.8554913294798 | W163: 72.258064516129 | X163: 25.6410256410256 | Y163: 7.22891566265061 | Z163: 32.5301204819277 | AA163: 21.2903225806452 | AB163: 0 | AC163: 25.1612903225806 | AD163: 0 | AE163: 0.602409638554217 | AF163: 3.6144578313253 | AG163: 0 | AI163: 'Turkmenistan | AJ163: 1 | AK163: 0 | AL163: 0 | AM163: 0 | AN163: 0
A164: 'Slovenia | B164: 'SVN | L164: 'TTO | M164: 'Trinidad and Tobago& Tob* | N164: 1 | O164: 'TTO | P164: 76.7441860465116 | Q164: 61.038961038961 | R164: 72.9032258064516 | S164: 79.3939393939394 | T164: 69.6969696969697 | U164: 74.6753246753247 | V164: 91.3294797687861 | W164: 83.8709677419355 | X164: 87.1794871794872 | Y164: 100 | Z164: 86.144578313253 | AA164: 84.5161290322581 | AB164: 65.3179190751445 | AC164: 34.8387096774194 | AD164: 47.4358974358974 | AE164: 30.1204819277108 | AF164: 50 | AG164: 57.4193548387097 | AI164: 'Trinidad and Tobago& Tob* | AJ164: 0 | AK164: 0 | AL164: 0 | AM164: 1 | AN164: 0
A165: 'Sweden | B165: 'SWE | L165: 'TUN | M165: 'Tunisia | N165: 1 | O165: 'TUN | P165: 30.8139534883721 | Q165: 74.6753246753247 | R165: 78.7096774193548 | S165: 66.0606060606061 | T165: 72.7272727272727 | U165: 62.3376623376623 | V165: 49.1329479768786 | W165: 88.3870967741936 | X165: 84.6153846153846 | Y165: 93.3734939759036 | Z165: 86.144578313253 | AA165: 71.6129032258064 | AB165: 13.8728323699422 | AC165: 53.5483870967742 | AD165: 64.7435897435897 | AE165: 35.5421686746988 | AF165: 57.2289156626506 | AG165: 39.3548387096774 | AI165: 'Tunisia | AJ165: 0 | AK165: 0 | AL165: 1 | AM165: 0 | AN165: 0
A166: 'Swaziland | B166: 'SWZ | L166: 'TUR | M166: 'Turkey | N166: 1 | O166: 'TUR | P166: 22.093023255814 | Q166: 16.8831168831169 | R166: 35.4838709677419 | S166: 73.9393939393939 | T166: 55.1515151515152 | U166: 42.8571428571429 | V166: 39.3063583815029 | W166: 31.6129032258064 | X166: 60.2564102564103 | Y166: 93.9759036144578 | Z166: 65.6626506024096 | AA166: 62.5806451612903 | AB166: 8.09248554913295 | AC166: 8.38709677419355 | AD166: 14.7435897435897 | AE166: 47.5903614457831 | AF166: 37.9518072289157 | AG166: 25.8064516129032 | AI166: 'Turkey | AJ166: 0 | AK166: 0 | AL166: 0 | AM166: 0 | AN166: 1
A167: 'Syrian Arab Republic | B167: 'SYR | L167: 'TWN | M167: 'Taiwan, China | N167: 1 | O167: 'TWN | P167: 71.5116279069768 | Q167: 83.7662337662338 | R167: 89.0322580645161 | S167: 82.4242424242424 | T167: 81.2121212121212 | U167: 79.2207792207792 | V167: 86.1271676300578 | W167: 98.0645161290323 | X167: 97.4358974358974 | Y167: 100 | Z167: 89.7590361445783 | AA167: 83.2258064516129 | AB167: 61.271676300578 | AC167: 66.4516129032258 | AD167: 82.0512820512821 | AE167: 63.855421686747 | AF167: 68.0722891566265 | AG167: 68.3870967741936 | AI167: 'Taiwan, China | AJ167: 0 | AK167: 1 | AL167: 0 | AM167: 0 | AN167: 0
A168: 'Chad | B168: 'TCD | L168: 'TZA | M168: 'Tanzania | N168: 1 | O168: 'TZA | P168: 42.4418604651163 | Q168: 71.4285714285714 | R168: 32.258064516129 | S168: 49.6969696969697 | T168: 61.2121212121212 | U168: 11.6883116883117 | V168: 61.271676300578 | W168: 84.5161290322581 | X168: 53.8461538461538 | Y168: 80.7228915662651 | Z168: 72.8915662650602 | AA168: 33.5483870967742 | AB168: 23.6994219653179 | AC168: 51.6129032258064 | AD168: 13.4615384615385 | AE168: 25.9036144578313 | AF168: 42.7710843373494 | AG168: 1.29032258064516 | AI168: 'Tanzania | AJ168: 0 | AK168: 0 | AL168: 1 | AM168: 0 | AN168: 0
A169: 'Togo | B169: 'TGO | L169: 'UGA | M169: 'Uganda | N169: 1 | O169: 'UGA | P169: 34.8837209302326 | Q169: 14.9350649350649 | R169: 45.1612903225806 | S169: 50.3030303030303 | T169: 54.5454545454545 | U169: 35.7142857142857 | V169: 52.0231213872832 | W169: 30.3225806451613 | X169: 67.3076923076923 | Y169: 80.7228915662651 | Z169: 66.8674698795181 | AA169: 57.4193548387097 | AB169: 15.606936416185 | AC169: 7.74193548387097 | AD169: 20.5128205128205 | AE169: 25.9036144578313 | AF169: 33.7349397590361 | AG169: 13.5483870967742 | AI169: 'Uganda | AJ169: 0 | AK169: 0 | AL169: 1 | AM169: 0 | AN169: 0
A170: 'Thailand | B170: 'THA | L170: 'UKR | M170: 'Ukraine | N170: 1 | O170: 'UKR | P170: 52.9069767441861 | Q170: 40.9090909090909 | R170: 14.1935483870968 | S170: 20 | T170: 27.2727272727273 | U170: 12.3376623376623 | V170: 66.4739884393064 | W170: 56.7741935483871 | X170: 33.3333333333333 | Y170: 30.1204819277108 | Z170: 39.7590361445783 | AA170: 30.3225806451613 | AB170: 35.2601156069364 | AC170: 24.5161290322581 | AD170: 6.41025641025641 | AE170: 11.4457831325301 | AF170: 12.6506024096386 | AG170: 3.2258064516129 | AI170: 'Ukraine | AJ170: 1 | AK170: 0 | AL170: 0 | AM170: 0 | AN170: 0
A171: 'Tajikistan | B171: 'TJK | L171: 'URY | M171: 'Uruguay | N171: 1 | O171: 'URY | P171: 73.8372093023256 | Q171: 62.987012987013 | R171: 76.7741935483871 | S171: 92.7272727272727 | T171: 63.6363636363636 | U171: 71.4285714285714 | V171: 86.7052023121387 | W171: 83.2258064516129 | X171: 86.5384615384615 | Y171: 100 | Z171: 77.1084337349398 | AA171: 83.2258064516129 | AB171: 62.4277456647399 | AC171: 41.2903225806452 | AD171: 55.7692307692308 | AE171: 49.3975903614458 | AF171: 44.578313253012 | AG171: 57.4193548387097 | AI171: 'Uruguay | AJ171: 0 | AK171: 0 | AL171: 0 | AM171: 1 | AN171: 0
A172: 'Turkmenistan | B172: 'TKM | L172: 'USA | M172: 'United States | N172: 1 | O172: 'USA | P172: 95.9302325581395 | Q172: 85.7142857142857 | R172: 90.3225806451613 | S172: 95.1515151515152 | T172: 87.8787878787879 | U172: 88.961038961039 | V172: 100 | W172: 99.3548387096774 | X172: 97.4358974358974 | Y172: 100 | Z172: 95.1807228915663 | AA172: 93.5483870967742 | AB172: 79.7687861271676 | AC172: 72.258064516129 | AD172: 83.974358974359 | AE172: 78.3132530120482 | AF172: 78.3132530120482 | AG172: 83.2258064516129 | AI172: 'United States | AJ172: 0 | AK172: 0 | AL172: 0 | AM172: 0 | AN172: 1
A173: 'Trinidad and Tobago& Tob* | B173: 'TTO | L173: 'UZB | M173: 'Uzbekistan | N173: 1 | O173: 'UZB | P173: 8.7209302325581 | Q173: 37.012987012987 | R173: 6.4516129032258 | S173: 6.6666666666666 | T173: 18.7878787878788 | U173: 9.090909090909 | V173: 24.8554913294798 | W173: 57.4193548387097 | X173: 17.3076923076923 | Y173: 15.6626506024096 | Z173: 33.7349397590361 | AA173: 29.0322580645161 | AB173: 0 | AC173: 19.3548387096774 | AD173: 0.641025641025641 | AE173: 2.40963855421687 | AF173: 5.42168674698795 | AG173: 1.29032258064516 | AI173: 'Uzbekistan | AJ173: 1 | AK173: 0 | AL173: 0 | AM173: 0 | AN173: 0
A174: 'Tunisia | B174: 'TUN | L174: 'VEN | M174: 'Venezuela, RB | N174: 1 | O174: 'VEN | P174: 61.046511627907 | Q174: 40.2597402597403 | R174: 14.8387096774194 | S174: 44.8484848484849 | T174: 29.0909090909091 | U174: 25.3246753246753 | V174: 70.5202312138728 | W174: 59.3548387096774 | X174: 37.1794871794872 | Y174: 69.8795180722892 | Z174: 45.1807228915663 | AA174: 43.2258064516129 | AB174: 40.4624277456647 | AC174: 22.5806451612903 | AD174: 6.41025641025641 | AE174: 27.1084337349398 | AF174: 12.0481927710843 | AG174: 3.2258064516129 | AI174: 'Venezuela, RB | AJ174: 0 | AK174: 0 | AL174: 0 | AM174: 1 | AN174: 0
A175: 'Turkey | B175: 'TUR | L175: 'VNM | M175: 'Vietnam | N175: 1 | O175: 'VNM | P175: 6.3953488372093 | Q175: 74.025974025974 | R175: 41.2903225806452 | S175: 24.8484848484848 | T175: 36.969696969697 | U175: 43.5064935064935 | V175: 19.6531791907514 | W175: 87.741935483871 | X175: 67.3076923076923 | Y175: 42.7710843373494 | Z175: 55.421686746988 | AA175: 61.9354838709677 | AB175: 0 | AC175: 54.8387096774194 | AD175: 17.9487179487179 | AE175: 13.855421686747 | AF175: 16.8674698795181 | AG175: 25.8064516129032 | AI175: 'Vietnam | AJ175: 0 | AK175: 1 | AL175: 0 | AM175: 0 | AN175: 0
A176: 'Taiwan, China | B176: 'TWN | L176: 'WTB | M176: 'West Bank and Gaza | N176: 1 | O176: 'WTB | P176: 47.093023255814 | Q176: 53.2467532467532 | R176: 50.3225806451613 | S176: 33.9393939393939 | T176: 86.6666666666667 | U176: 69.4805194805195 | V176: 95.9537572254335 | W176: 95.4838709677419 | X176: 83.974358974359 | Y176: 100 | Z176: 100 | AA176: 89.0322580645161 | AB176: 0 | AC176: 10.9677419354839 | AD176: 8.33333333333333 | AE176: 1.80722891566265 | AF176: 57.8313253012048 | AG176: 25.8064516129032 | AI176: 'West Bank and Gaza | AJ176: 0 | AK176: 1 | AL176: 0 | AM176: 0 | AN176: 0
A177: 'Tanzania | B177: 'TZA | L177: 'YEM | M177: 'Yemen, Rep. | N177: 1 | O177: 'YEM | P177: 38.3720930232558 | Q177: 7.7922077922077 | R177: 23.8709677419355 | S177: 23.030303030303 | T177: 13.3333333333333 | U177: 15.5844155844156 | V177: 58.3815028901734 | W177: 20 | X177: 61.5384615384615 | Y177: 67.4698795180723 | Z177: 39.1566265060241 | AA177: 48.3870967741936 | AB177: 19.6531791907514 | AC177: 1.93548387096774 | AD177: 5.12820512820513 | AE177: 3.6144578313253 | AF177: 1.20481927710843 | AG177: 1.29032258064516 | AI177: 'Yemen, Rep. | AJ177: 0 | AK177: 1 | AL177: 0 | AM177: 0 | AN177: 0
A178: 'Uganda | B178: 'UGA | L178: 'YUG | M178: 'Yugoslavia, FR (Serbia/Montenegro) | N178: 1 | O178: 'YUG | P178: 18.0232558139535 | Q178: 8.4415584415584 | R178: 12.258064516129 | S178: 3.6363636363636 | T178: 21.2121212121212 | U178: 7.7922077922077 | V178: 37.5722543352601 | W178: 18.7096774193548 | X178: 37.1794871794872 | Y178: 36.144578313253 | Z178: 38.5542168674699 | AA178: 28.3870967741936 | AB178: 6.35838150289017 | AC178: 1.93548387096774 | AD178: 2.56410256410256 | AE178: 0.602409638554217 | AF178: 6.62650602409639 | AG178: 1.29032258064516 | AI178: 'Yugoslavia, FR (Serbia/Montenegro) | AJ178: 1 | AK178: 0 | AL178: 0 | AM178: 0 | AN178: 0
A179: 'Ukraine | B179: 'UKR | L179: 'ZAF | M179: 'South Africa | N179: 1 | O179: 'ZAF | P179: 77.9069767441861 | Q179: 28.5714285714286 | R179: 55.4838709677419 | S179: 55.7575757575758 | T179: 41.8181818181818 | U179: 68.1818181818182 | V179: 93.0635838150289 | W179: 46.4516129032258 | X179: 70.5128205128205 | Y179: 77.1084337349398 | Z179: 56.0240963855422 | AA179: 80 | AB179: 67.0520231213873 | AC179: 14.8387096774194 | AD179: 35.2564102564103 | AE179: 34.9397590361446 | AF179: 24.0963855421687 | AG179: 57.4193548387097 | AI179: 'South Africa | AJ179: 0 | AK179: 0 | AL179: 1 | AM179: 0 | AN179: 0
A180: 'Uruguay | B180: 'URY | L180: 'ZAR | M180: 'Congo, Dem. Rep. | N180: 1 | O180: 'ZAR | P180: 3.4883720930232 | Q180: 0 | R180: 0.6451612903225 | S180: 1.2121212121212 | T180: 0 | U180: 0.6493506493506 | V180: 16.1849710982659 | W180: 1.93548387096774 | X180: 16.6666666666667 | Y180: 3.6144578313253 | Z180: 3.01204819277109 | AA180: 27.0967741935484 | AB180: 0 | AC180: 0 | AD180: 0 | AE180: 0.602409638554217 | AF180: 0 | AG180: 0 | AI180: 'Congo, Dem. Rep. | AJ180: 0 | AK180: 0 | AL180: 1 | AM180: 0 | AN180: 0
A181: 'United States | B181: 'USA | L181: 'ZMB | M181: 'Zambia | N181: 1 | O181: 'ZMB | P181: 51.7441860465116 | Q181: 48.7012987012987 | R181: 36.7741935483871 | S181: 56.3636363636364 | T181: 38.7878787878788 | U181: 27.9220779220779 | V181: 65.3179190751445 | W181: 69.6774193548387 | X181: 59.6153846153846 | Y181: 81.9277108433735 | Z181: 57.2289156626506 | AA181: 52.258064516129 | AB181: 34.1040462427746 | AC181: 29.0322580645161 | AD181: 15.3846153846154 | AE181: 28.9156626506024 | AF181: 16.8674698795181 | AG181: 5.80645161290323 | AI181: 'Zambia | AJ181: 0 | AK181: 0 | AL181: 1 | AM181: 0 | AN181: 0
A182: 'Uzbekistan | B182: 'UZB | L182: 'ZWE | M182: 'Zimbabwe | N182: 1 | O182: 'ZWE | P182: 29.0697674418605 | Q182: 26.6233766233766 | R182: 9.0322580645161 | S182: 27.8787878787879 | T182: 49.0909090909091 | U182: 44.1558441558442 | V182: 44.5086705202312 | W182: 48.3870967741936 | X182: 20.5128205128205 | Y182: 45.7831325301205 | Z182: 64.4578313253012 | AA182: 63.8709677419355 | AB182: 13.2947976878613 | AC182: 12.9032258064516 | AD182: 2.56410256410256 | AE182: 18.6746987951807 | AF182: 30.1204819277108 | AG182: 25.8064516129032 | AI182: 'Zimbabwe | AJ182: 0 | AK182: 0 | AL182: 1 | AM182: 0 | AN182: 0
A183: 'Venezuela, RB | B183: 'VEN | L183: 'EE/FSU | M183: 'Eastern Europe and Former Soviet Union | N183: 1 | O183: 'EE/FSU | P183: =SUMIF2(CLOSURE("EQUAL", 1, NA()), R5C36:R182C36, R5C:R182C)/SUMIF(CLOSURE("EQUAL", 1, NA()), R5C36:R182C36) -> #ERR: ArgCount | Q183: =SUMIF2(CLOSURE("EQUAL", 1, NA()), R5C36:R182C36, R5C:R182C)/SUMIF(CLOSURE("EQUAL", 1, NA()), R5C36:R182C36) -> #ERR: ArgCount | R183: =SUMIF2(CLOSURE("EQUAL", 1, NA()), R5C36:R182C36, R5C:R182C)/SUMIF(CLOSURE("EQUAL", 1, NA()), R5C36:R182C36) -> #ERR: ArgCount | S183: =SUMIF2(CLOSURE("EQUAL", 1, NA()), R5C36:R182C36, R5C:R182C)/SUMIF(CLOSURE("EQUAL", 1, NA()), R5C36:R182C36) -> #ERR: ArgCount | T183: =SUMIF2(CLOSURE("EQUAL", 1, NA()), R5C36:R182C36, R5C:R182C)/SUMIF(CLOSURE("EQUAL", 1, NA()), R5C36:R182C36) -> #ERR: ArgCount | U183: =SUMIF2(CLOSURE("EQUAL", 1, NA()), R5C36:R182C36, R5C:R182C)/SUMIF(CLOSURE("EQUAL", 1, NA()), R5C36:R182C36) -> #ERR: ArgCount | V183: =SUMIF2(CLOSURE("EQUAL", 1, NA()), R5C36:R182C36, R5C:R182C)/SUMIF(CLOSURE("EQUAL", 1, NA()), R5C36:R182C36) -> #ERR: ArgCount | W183: =SUMIF2(CLOSURE("EQUAL", 1, NA()), R5C36:R182C36, R5C:R182C)/SUMIF(CLOSURE("EQUAL", 1, NA()), R5C36:R182C36) -> #ERR: ArgCount | X183: =SUMIF2(CLOSURE("EQUAL", 1, NA()), R5C36:R182C36, R5C:R182C)/SUMIF(CLOSURE("EQUAL", 1, NA()), R5C36:R182C36) -> #ERR: ArgCount | Y183: =SUMIF2(CLOSURE("EQUAL", 1, NA()), R5C36:R182C36, R5C:R182C)/SUMIF(CLOSURE("EQUAL", 1, NA()), R5C36:R182C36) -> #ERR: ArgCount | Z183: =SUMIF2(CLOSURE("EQUAL", 1, NA()), R5C36:R182C36, R5C:R182C)/SUMIF(CLOSURE("EQUAL", 1, NA()), R5C36:R182C36) -> #ERR: ArgCount | AA183: =SUMIF2(CLOSURE("EQUAL", 1, NA()), R5C36:R182C36, R5C:R182C)/SUMIF(CLOSURE("EQUAL", 1, NA()), R5C36:R182C36) -> #ERR: ArgCount | AB183: =SUMIF2(CLOSURE("EQUAL", 1, NA()), R5C36:R182C36, R5C:R182C)/SUMIF(CLOSURE("EQUAL", 1, NA()), R5C36:R182C36) -> #ERR: ArgCount | AC183: =SUMIF2(CLOSURE("EQUAL", 1, NA()), R5C36:R182C36, R5C:R182C)/SUMIF(CLOSURE("EQUAL", 1, NA()), R5C36:R182C36) -> #ERR: ArgCount | AD183: =SUMIF2(CLOSURE("EQUAL", 1, NA()), R5C36:R182C36, R5C:R182C)/SUMIF(CLOSURE("EQUAL", 1, NA()), R5C36:R182C36) -> #ERR: ArgCount | AE183: =SUMIF2(CLOSURE("EQUAL", 1, NA()), R5C36:R182C36, R5C:R182C)/SUMIF(CLOSURE("EQUAL", 1, NA()), R5C36:R182C36) -> #ERR: ArgCount | AF183: =SUMIF2(CLOSURE("EQUAL", 1, NA()), R5C36:R182C36, R5C:R182C)/SUMIF(CLOSURE("EQUAL", 1, NA()), R5C36:R182C36) -> #ERR: ArgCount | AG183: =SUMIF2(CLOSURE("EQUAL", 1, NA()), R5C36:R182C36, R5C:R182C)/SUMIF(CLOSURE("EQUAL", 1, NA()), R5C36:R182C36) -> #ERR: ArgCount
A184: 'Vietnam | B184: 'VNM | L184: 'ASI | M184: 'Asia | N184: 1 | O184: 'ASI | P184: =SUMIF2(CLOSURE("EQUAL", 1, NA()), R5C37:R182C37, R5C:R182C)/SUMIF(CLOSURE("EQUAL", 1, NA()), R5C37:R182C37) -> #ERR: ArgCount | Q184: =SUMIF2(CLOSURE("EQUAL", 1, NA()), R5C37:R182C37, R5C:R182C)/SUMIF(CLOSURE("EQUAL", 1, NA()), R5C37:R182C37) -> #ERR: ArgCount | R184: =SUMIF2(CLOSURE("EQUAL", 1, NA()), R5C37:R182C37, R5C:R182C)/SUMIF(CLOSURE("EQUAL", 1, NA()), R5C37:R182C37) -> #ERR: ArgCount | S184: =SUMIF2(CLOSURE("EQUAL", 1, NA()), R5C37:R182C37, R5C:R182C)/SUMIF(CLOSURE("EQUAL", 1, NA()), R5C37:R182C37) -> #ERR: ArgCount | T184: =SUMIF2(CLOSURE("EQUAL", 1, NA()), R5C37:R182C37, R5C:R182C)/SUMIF(CLOSURE("EQUAL", 1, NA()), R5C37:R182C37) -> #ERR: ArgCount | U184: =SUMIF2(CLOSURE("EQUAL", 1, NA()), R5C37:R182C37, R5C:R182C)/SUMIF(CLOSURE("EQUAL", 1, NA()), R5C37:R182C37) -> #ERR: ArgCount | V184: =SUMIF2(CLOSURE("EQUAL", 1, NA()), R5C37:R182C37, R5C:R182C)/SUMIF(CLOSURE("EQUAL", 1, NA()), R5C37:R182C37) -> #ERR: ArgCount | W184: =SUMIF2(CLOSURE("EQUAL", 1, NA()), R5C37:R182C37, R5C:R182C)/SUMIF(CLOSURE("EQUAL", 1, NA()), R5C37:R182C37) -> #ERR: ArgCount | X184: =SUMIF2(CLOSURE("EQUAL", 1, NA()), R5C37:R182C37, R5C:R182C)/SUMIF(CLOSURE("EQUAL", 1, NA()), R5C37:R182C37) -> #ERR: ArgCount | Y184: =SUMIF2(CLOSURE("EQUAL", 1, NA()), R5C37:R182C37, R5C:R182C)/SUMIF(CLOSURE("EQUAL", 1, NA()), R5C37:R182C37) -> #ERR: ArgCount | Z184: =SUMIF2(CLOSURE("EQUAL", 1, NA()), R5C37:R182C37, R5C:R182C)/SUMIF(CLOSURE("EQUAL", 1, NA()), R5C37:R182C37) -> #ERR: ArgCount | AA184: =SUMIF2(CLOSURE("EQUAL", 1, NA()), R5C37:R182C37, R5C:R182C)/SUMIF(CLOSURE("EQUAL", 1, NA()), R5C37:R182C37) -> #ERR: ArgCount | AB184: =SUMIF2(CLOSURE("EQUAL", 1, NA()), R5C37:R182C37, R5C:R182C)/SUMIF(CLOSURE("EQUAL", 1, NA()), R5C37:R182C37) -> #ERR: ArgCount | AC184: =SUMIF2(CLOSURE("EQUAL", 1, NA()), R5C37:R182C37, R5C:R182C)/SUMIF(CLOSURE("EQUAL", 1, NA()), R5C37:R182C37) -> #ERR: ArgCount | AD184: =SUMIF2(CLOSURE("EQUAL", 1, NA()), R5C37:R182C37, R5C:R182C)/SUMIF(CLOSURE("EQUAL", 1, NA()), R5C37:R182C37) -> #ERR: ArgCount | AE184: =SUMIF2(CLOSURE("EQUAL", 1, NA()), R5C37:R182C37, R5C:R182C)/SUMIF(CLOSURE("EQUAL", 1, NA()), R5C37:R182C37) -> #ERR: ArgCount | AF184: =SUMIF2(CLOSURE("EQUAL", 1, NA()), R5C37:R182C37, R5C:R182C)/SUMIF(CLOSURE("EQUAL", 1, NA()), R5C37:R182C37) -> #ERR: ArgCount | AG184: =SUMIF2(CLOSURE("EQUAL", 1, NA()), R5C37:R182C37, R5C:R182C)/SUMIF(CLOSURE("EQUAL", 1, NA()), R5C37:R182C37) -> #ERR: ArgCount
A185: 'West Bank and Gaza | B185: 'WTB | L185: 'AFR | M185: 'Africa | N185: 1 | O185: 'AFR | P185: =SUMIF2(CLOSURE("EQUAL", 1, NA()), R5C38:R182C38, R5C:R182C)/SUMIF(CLOSURE("EQUAL", 1, NA()), R5C38:R182C38) -> #ERR: ArgCount | Q185: =SUMIF2(CLOSURE("EQUAL", 1, NA()), R5C38:R182C38, R5C:R182C)/SUMIF(CLOSURE("EQUAL", 1, NA()), R5C38:R182C38) -> #ERR: ArgCount | R185: =SUMIF2(CLOSURE("EQUAL", 1, NA()), R5C38:R182C38, R5C:R182C)/SUMIF(CLOSURE("EQUAL", 1, NA()), R5C38:R182C38) -> #ERR: ArgCount | S185: =SUMIF2(CLOSURE("EQUAL", 1, NA()), R5C38:R182C38, R5C:R182C)/SUMIF(CLOSURE("EQUAL", 1, NA()), R5C38:R182C38) -> #ERR: ArgCount | T185: =SUMIF2(CLOSURE("EQUAL", 1, NA()), R5C38:R182C38, R5C:R182C)/SUMIF(CLOSURE("EQUAL", 1, NA()), R5C38:R182C38) -> #ERR: ArgCount | U185: =SUMIF2(CLOSURE("EQUAL", 1, NA()), R5C38:R182C38, R5C:R182C)/SUMIF(CLOSURE("EQUAL", 1, NA()), R5C38:R182C38) -> #ERR: ArgCount | V185: =SUMIF2(CLOSURE("EQUAL", 1, NA()), R5C38:R182C38, R5C:R182C)/SUMIF(CLOSURE("EQUAL", 1, NA()), R5C38:R182C38) -> #ERR: ArgCount | W185: =SUMIF2(CLOSURE("EQUAL", 1, NA()), R5C38:R182C38, R5C:R182C)/SUMIF(CLOSURE("EQUAL", 1, NA()), R5C38:R182C38) -> #ERR: ArgCount | X185: =SUMIF2(CLOSURE("EQUAL", 1, NA()), R5C38:R182C38, R5C:R182C)/SUMIF(CLOSURE("EQUAL", 1, NA()), R5C38:R182C38) -> #ERR: ArgCount | Y185: =SUMIF2(CLOSURE("EQUAL", 1, NA()), R5C38:R182C38, R5C:R182C)/SUMIF(CLOSURE("EQUAL", 1, NA()), R5C38:R182C38) -> #ERR: ArgCount | Z185: =SUMIF2(CLOSURE("EQUAL", 1, NA()), R5C38:R182C38, R5C:R182C)/SUMIF(CLOSURE("EQUAL", 1, NA()), R5C38:R182C38) -> #ERR: ArgCount | AA185: =SUMIF2(CLOSURE("EQUAL", 1, NA()), R5C38:R182C38, R5C:R182C)/SUMIF(CLOSURE("EQUAL", 1, NA()), R5C38:R182C38) -> #ERR: ArgCount | AB185: =SUMIF2(CLOSURE("EQUAL", 1, NA()), R5C38:R182C38, R5C:R182C)/SUMIF(CLOSURE("EQUAL", 1, NA()), R5C38:R182C38) -> #ERR: ArgCount | AC185: =SUMIF2(CLOSURE("EQUAL", 1, NA()), R5C38:R182C38, R5C:R182C)/SUMIF(CLOSURE("EQUAL", 1, NA()), R5C38:R182C38) -> #ERR: ArgCount | AD185: =SUMIF2(CLOSURE("EQUAL", 1, NA()), R5C38:R182C38, R5C:R182C)/SUMIF(CLOSURE("EQUAL", 1, NA()), R5C38:R182C38) -> #ERR: ArgCount | AE185: =SUMIF2(CLOSURE("EQUAL", 1, NA()), R5C38:R182C38, R5C:R182C)/SUMIF(CLOSURE("EQUAL", 1, NA()), R5C38:R182C38) -> #ERR: ArgCount | AF185: =SUMIF2(CLOSURE("EQUAL", 1, NA()), R5C38:R182C38, R5C:R182C)/SUMIF(CLOSURE("EQUAL", 1, NA()), R5C38:R182C38) -> #ERR: ArgCount | AG185: =SUMIF2(CLOSURE("EQUAL", 1, NA()), R5C38:R182C38, R5C:R182C)/SUMIF(CLOSURE("EQUAL", 1, NA()), R5C38:R182C38) -> #ERR: ArgCount
A186: 'Yemen, Rep. | B186: 'YEM | L186: 'LAC | M186: 'Latin America | N186: 1 | O186: 'LAC | P186: =SUMIF2(CLOSURE("EQUAL", 1, NA()), R5C39:R182C39, R5C:R182C)/SUMIF(CLOSURE("EQUAL", 1, NA()), R5C39:R182C39) -> #ERR: ArgCount | Q186: =SUMIF2(CLOSURE("EQUAL", 1, NA()), R5C39:R182C39, R5C:R182C)/SUMIF(CLOSURE("EQUAL", 1, NA()), R5C39:R182C39) -> #ERR: ArgCount | R186: =SUMIF2(CLOSURE("EQUAL", 1, NA()), R5C39:R182C39, R5C:R182C)/SUMIF(CLOSURE("EQUAL", 1, NA()), R5C39:R182C39) -> #ERR: ArgCount | S186: =SUMIF2(CLOSURE("EQUAL", 1, NA()), R5C39:R182C39, R5C:R182C)/SUMIF(CLOSURE("EQUAL", 1, NA()), R5C39:R182C39) -> #ERR: ArgCount | T186: =SUMIF2(CLOSURE("EQUAL", 1, NA()), R5C39:R182C39, R5C:R182C)/SUMIF(CLOSURE("EQUAL", 1, NA()), R5C39:R182C39) -> #ERR: ArgCount | U186: =SUMIF2(CLOSURE("EQUAL", 1, NA()), R5C39:R182C39, R5C:R182C)/SUMIF(CLOSURE("EQUAL", 1, NA()), R5C39:R182C39) -> #ERR: ArgCount | V186: =SUMIF2(CLOSURE("EQUAL", 1, NA()), R5C39:R182C39, R5C:R182C)/SUMIF(CLOSURE("EQUAL", 1, NA()), R5C39:R182C39) -> #ERR: ArgCount | W186: =SUMIF2(CLOSURE("EQUAL", 1, NA()), R5C39:R182C39, R5C:R182C)/SUMIF(CLOSURE("EQUAL", 1, NA()), R5C39:R182C39) -> #ERR: ArgCount | X186: =SUMIF2(CLOSURE("EQUAL", 1, NA()), R5C39:R182C39, R5C:R182C)/SUMIF(CLOSURE("EQUAL", 1, NA()), R5C39:R182C39) -> #ERR: ArgCount | Y186: =SUMIF2(CLOSURE("EQUAL", 1, NA()), R5C39:R182C39, R5C:R182C)/SUMIF(CLOSURE("EQUAL", 1, NA()), R5C39:R182C39) -> #ERR: ArgCount | Z186: =SUMIF2(CLOSURE("EQUAL", 1, NA()), R5C39:R182C39, R5C:R182C)/SUMIF(CLOSURE("EQUAL", 1, NA()), R5C39:R182C39) -> #ERR: ArgCount | AA186: =SUMIF2(CLOSURE("EQUAL", 1, NA()), R5C39:R182C39, R5C:R182C)/SUMIF(CLOSURE("EQUAL", 1, NA()), R5C39:R182C39) -> #ERR: ArgCount | AB186: =SUMIF2(CLOSURE("EQUAL", 1, NA()), R5C39:R182C39, R5C:R182C)/SUMIF(CLOSURE("EQUAL", 1, NA()), R5C39:R182C39) -> #ERR: ArgCount | AC186: =SUMIF2(CLOSURE("EQUAL", 1, NA()), R5C39:R182C39, R5C:R182C)/SUMIF(CLOSURE("EQUAL", 1, NA()), R5C39:R182C39) -> #ERR: ArgCount | AD186: =SUMIF2(CLOSURE("EQUAL", 1, NA()), R5C39:R182C39, R5C:R182C)/SUMIF(CLOSURE("EQUAL", 1, NA()), R5C39:R182C39) -> #ERR: ArgCount | AE186: =SUMIF2(CLOSURE("EQUAL", 1, NA()), R5C39:R182C39, R5C:R182C)/SUMIF(CLOSURE("EQUAL", 1, NA()), R5C39:R182C39) -> #ERR: ArgCount | AF186: =SUMIF2(CLOSURE("EQUAL", 1, NA()), R5C39:R182C39, R5C:R182C)/SUMIF(CLOSURE("EQUAL", 1, NA()), R5C39:R182C39) -> #ERR: ArgCount | AG186: =SUMIF2(CLOSURE("EQUAL", 1, NA()), R5C39:R182C39, R5C:R182C)/SUMIF(CLOSURE("EQUAL", 1, NA()), R5C39:R182C39) -> #ERR: ArgCount
A187: 'Yugoslavia, FR (Serbia/Montenegro) | B187: 'YUG | L187: 'OECD | M187: 'OECD | N187: 1 | O187: 'OECD | P187: =SUMIF2(CLOSURE("EQUAL", 1, NA()), R5C40:R182C40, R5C:R182C)/SUMIF(CLOSURE("EQUAL", 1, NA()), R5C40:R182C40) -> #ERR: ArgCount | Q187: =SUMIF2(CLOSURE("EQUAL", 1, NA()), R5C40:R182C40, R5C:R182C)/SUMIF(CLOSURE("EQUAL", 1, NA()), R5C40:R182C40) -> #ERR: ArgCount | R187: =SUMIF2(CLOSURE("EQUAL", 1, NA()), R5C40:R182C40, R5C:R182C)/SUMIF(CLOSURE("EQUAL", 1, NA()), R5C40:R182C40) -> #ERR: ArgCount | S187: =SUMIF2(CLOSURE("EQUAL", 1, NA()), R5C40:R182C40, R5C:R182C)/SUMIF(CLOSURE("EQUAL", 1, NA()), R5C40:R182C40) -> #ERR: ArgCount | T187: =SUMIF2(CLOSURE("EQUAL", 1, NA()), R5C40:R182C40, R5C:R182C)/SUMIF(CLOSURE("EQUAL", 1, NA()), R5C40:R182C40) -> #ERR: ArgCount | U187: =SUMIF2(CLOSURE("EQUAL", 1, NA()), R5C40:R182C40, R5C:R182C)/SUMIF(CLOSURE("EQUAL", 1, NA()), R5C40:R182C40) -> #ERR: ArgCount | V187: =SUMIF2(CLOSURE("EQUAL", 1, NA()), R5C40:R182C40, R5C:R182C)/SUMIF(CLOSURE("EQUAL", 1, NA()), R5C40:R182C40) -> #ERR: ArgCount | W187: =SUMIF2(CLOSURE("EQUAL", 1, NA()), R5C40:R182C40, R5C:R182C)/SUMIF(CLOSURE("EQUAL", 1, NA()), R5C40:R182C40) -> #ERR: ArgCount | X187: =SUMIF2(CLOSURE("EQUAL", 1, NA()), R5C40:R182C40, R5C:R182C)/SUMIF(CLOSURE("EQUAL", 1, NA()), R5C40:R182C40) -> #ERR: ArgCount | Y187: =SUMIF2(CLOSURE("EQUAL", 1, NA()), R5C40:R182C40, R5C:R182C)/SUMIF(CLOSURE("EQUAL", 1, NA()), R5C40:R182C40) -> #ERR: ArgCount | Z187: =SUMIF2(CLOSURE("EQUAL", 1, NA()), R5C40:R182C40, R5C:R182C)/SUMIF(CLOSURE("EQUAL", 1, NA()), R5C40:R182C40) -> #ERR: ArgCount | AA187: =SUMIF2(CLOSURE("EQUAL", 1, NA()), R5C40:R182C40, R5C:R182C)/SUMIF(CLOSURE("EQUAL", 1, NA()), R5C40:R182C40) -> #ERR: ArgCount | AB187: =SUMIF2(CLOSURE("EQUAL", 1, NA()), R5C40:R182C40, R5C:R182C)/SUMIF(CLOSURE("EQUAL", 1, NA()), R5C40:R182C40) -> #ERR: ArgCount | AC187: =SUMIF2(CLOSURE("EQUAL", 1, NA()), R5C40:R182C40, R5C:R182C)/SUMIF(CLOSURE("EQUAL", 1, NA()), R5C40:R182C40) -> #ERR: ArgCount | AD187: =SUMIF2(CLOSURE("EQUAL", 1, NA()), R5C40:R182C40, R5C:R182C)/SUMIF(CLOSURE("EQUAL", 1, NA()), R5C40:R182C40) -> #ERR: ArgCount | AE187: =SUMIF2(CLOSURE("EQUAL", 1, NA()), R5C40:R182C40, R5C:R182C)/SUMIF(CLOSURE("EQUAL", 1, NA()), R5C40:R182C40) -> #ERR: ArgCount | AF187: =SUMIF2(CLOSURE("EQUAL", 1, NA()), R5C40:R182C40, R5C:R182C)/SUMIF(CLOSURE("EQUAL", 1, NA()), R5C40:R182C40) -> #ERR: ArgCount | AG187: =SUMIF2(CLOSURE("EQUAL", 1, NA()), R5C40:R182C40, R5C:R182C)/SUMIF(CLOSURE("EQUAL", 1, NA()), R5C40:R182C40) -> #ERR: ArgCount
A188: 'South Africa | B188: 'ZAF
A189: 'Congo, Dem. Rep. | B189: 'ZAR
A190: 'Zambia | B190: 'ZMB
A191: 'Zimbabwe | B191: 'ZWE
A192: 'Eastern Europe and Former Soviet Union | B192: 'EE/FSU
A193: 'Asia | B193: 'ASI
A194: 'Africa | B194: 'AFR
A195: 'Latin America | B195: 'LAC
A196: 'OECD | B196: 'OECD

Sheet: ComparativeChartsData
O4: 1 | P4: 2 | Q4: 3 | R4: 4 | S4: 5 | T4: 6 | U4: 7 | V4: 8 | W4: 9 | X4: 10 | Y4: 11 | Z4: 12 | AA4: 13 | AB4: 14 | AC4: 15 | AD4: 16 | AE4: 17 | AF4: 18 | AG4: 19 | AH4: 20 | AI4: 21 | AJ4: 22 | AK4: 23 | AL4: 24 | AM4: 25 | AN4: 26 | AO4: 27 | AP4: 28 | AQ4: 29 | AR4: 30 | AS4: 31 | AT4: 32 | AU4: 33 | AV4: 34 | AW4: 35 | AX4: 36 | AY4: 37 | AZ4: 38 | BA4: 39 | BB4: 40 | BC4: 41 | BD4: 42
R5: 'Voice and Accountability | Y5: 'Political Instability and Violence | AF5: 'Government Effectiveness | AM5: 'Regulatory Burden | AT5: 'Rule of Law | BA5: 'Graft
D6: 'DO NOT EDIT/CHANGE THIS CELLS!!! | R6: 'Estimate | S6: 'Standard Error | T6: '# Indicators | Y6: 'Estimate | Z6: 'Standard Error | AA6: '# Indicators | AF6: 'Estimate | AG6: 'Standard Error | AH6: '# Indicators | AM6: 'Estimate | AN6: 'Standard Error | AO6: '# Indicators | AT6: 'Estimate | AU6: 'Standard Error | AV6: '# Indicators | BA6: 'Estimate | BB6: 'Standard Error | BC6: '# Indicators
Q7: 1 | R7: =R[-2]C -> Voice and Accountability | S7: 'SE | T7: 'Band1 | U7: 'Band2 | V7: 'Labels | X7: 1 | Y7: =R[-2]C -> Political Instability and Violence | Z7: 'SE | AA7: 'Band1 | AB7: 'Band2 | AC7: 'Labels | AE7: 1 | AF7: =R[-2]C -> Government Effectiveness | AG7: 'SE | AH7: 'Band1 | AI7: 'Band2 | AJ7: 'Labels | AL7: 1 | AM7: =R[-2]C -> Regulatory Burden | AN7: 'SE | AO7: 'Band1 | AP7: 'Band2 | AQ7: 'Labels | AS7: 1 | AT7: =R[-2]C -> Rule of Law | AU7: 'SE | AV7: 'Band1 | AW7: 'Band2 | AX7: 'Labels | AZ7: 1 | BA7: =R[-2]C -> Graft | BB7: 'SE | BC7: 'Band1 | BD7: 'Band2 | BE7: 'Labels
B8: 'Country Name | C8: 'Country Code | D8: 'Choose Country Here | O8: 1 | P8: 'Korea, Dem. Rep. | Q8: 'PRK | R8: -1.78867831057335 | S8: 0.291377601755329 | T8: =1.64*RC[-1] -> 0.47785926687874 | U8: =IF(EQUAL(VLOOKUP(RC[-4], R9C3:R186C4, 2, 0), 1), RC[-1], NA()) -> #ERR: ArgCount | V8: =IF(ISERROR(RC[-1])=1, "", RC[-5]) ->  | W8: 'Congo, Dem. Rep. | X8: 'ZAR | Y8: -2.58639725405087 | Z8: 0.343592114506085 | AA8: =1.64*RC[-1] -> 0.563491067789979 | AB8: =IF(EQUAL(VLOOKUP(RC[-4], R9C3:R186C4, 2, 0), 1), RC[-1], NA()) -> #ERR: ArgCount | AC8: =IF(ISERROR(RC[-1])=1, "", RC[-5]) ->  | AD8: 'Iraq | AE8: 'IRQ | AF8: -1.88310089184005 | AG8: 0.319089592041234 | AH8: =1.64*RC[-1] -> 0.523306930947624 | AI8: =IF(EQUAL(VLOOKUP(RC[-4], R9C3:R186C4, 2, 0), 1), RC[-1], NA()) -> #ERR: ArgCount | AJ8: =IF(ISERROR(RC[-1])=1, "", RC[-5]) ->  | AK8: 'Iraq | AL8: 'IRQ | AM8: -3.14218535697991 | AN8: 0.395254221998157 | AO8: =1.64*RC[-1] -> 0.648216924076978 | AP8: =IF(EQUAL(VLOOKUP(RC[-4], R9C3:R186C4, 2, 0), 1), RC[-1], NA()) -> #ERR: ArgCount | AQ8: =IF(ISERROR(RC[-1])=1, "", RC[-5]) ->  | AR8: 'Congo, Dem. Rep. | AS8: 'ZAR | AT8: -2.15252348054339 | AU8: 0.352695557586314 | AV8: =1.64*RC[-1] -> 0.578420714441555 | AW8: =IF(EQUAL(VLOOKUP(RC[-4], R9C3:R186C4, 2, 0), 1), RC[-1], NA()) -> #ERR: ArgCount | AX8: =IF(ISERROR(RC[-1])=1, "", RC[-5]) ->  | AY8: 'Niger | AZ8: 'NER | BA8: -1.56681216585433 | BB8: 0.748674396199437 | BC8: =1.64*RC[-1] -> 1.22782600976708 | BD8: =IF(EQUAL(VLOOKUP(RC[-4], R9C3:R186C4, 2, 0), 1), RC[-1], NA()) -> #ERR: ArgCount | BE8: =IF(ISERROR(RC[-1])=1, "", RC[-5]) -> 
B9: 'Afghanistan | C9: 'AFG | D9: =IF(EQUAL(ComparativeCharts!R[+11]C, ""), "", 1) -> 1 | E9: =IF(EQUAL(ComparativeCharts!R[+11]C, ""), "", 1) -> #EMPTY! | O9: 2 | P9: 'Iraq | Q9: 'IRQ | R9: -1.75288975115211 | S9: 0.254026944310672 | T9: =1.64*RC[-1] -> 0.416604188669502 | U9: =IF(EQUAL(VLOOKUP(RC[-4], R9C3:R186C4, 2, 0), 1), RC[-1], NA()) -> #ERR: ArgCount | V9: =IF(ISERROR(RC[-1])=1, "", RC[-5]) ->  | W9: 'Algeria | X9: 'DZA | Y9: -2.42051734496435 | Z9: 0.299881889042829 | AA9: =1.64*RC[-1] -> 0.49180629803024 | AB9: =IF(EQUAL(VLOOKUP(RC[-4], R9C3:R186C4, 2, 0), 1), RC[-1], NA()) -> #ERR: ArgCount | AC9: =IF(ISERROR(RC[-1])=1, "", RC[-5]) ->  | AD9: 'Congo, Dem. Rep. | AE9: 'ZAR | AF9: -1.76905300575076 | AG9: 0.478235957625145 | AH9: =1.64*RC[-1] -> 0.784306970505238 | AI9: =IF(EQUAL(VLOOKUP(RC[-4], R9C3:R186C4, 2, 0), 1), RC[-1], NA()) -> #ERR: ArgCount | AJ9: =IF(ISERROR(RC[-1])=1, "", RC[-5]) ->  | AK9: 'Libya | AL9: 'LBY | AM9: -2.37626536736402 | AN9: 0.395254221998157 | AO9: =1.64*RC[-1] -> 0.648216924076978 | AP9: =IF(EQUAL(VLOOKUP(RC[-4], R9C3:R186C4, 2, 0), 1), RC[-1], NA()) -> #ERR: ArgCount | AQ9: =IF(ISERROR(RC[-1])=1, "", RC[-5]) ->  | AR9: 'Iraq | AS9: 'IRQ | AT9: -1.8436719236241 | AU9: 0.276349686366578 | AV9: =1.64*RC[-1] -> 0.453213485641188 | AW9: =IF(EQUAL(VLOOKUP(RC[-4], R9C3:R186C4, 2, 0), 1), RC[-1], NA()) -> #ERR: ArgCount | AX9: =IF(ISERROR(RC[-1])=1, "", RC[-5]) ->  | AY9: 'Congo, Dem. Rep. | AZ9: 'ZAR | BA9: -1.55598351314371 | BB9: 0.476749967242003 | BC9: =1.64*RC[-1] -> 0.781869946276885 | BD9: =IF(EQUAL(VLOOKUP(RC[-4], R9C3:R186C4, 2, 0), 1), RC[-1], NA()) -> #ERR: ArgCount | BE9: =IF(ISERROR(RC[-1])=1, "", RC[-5]) -> 
B10: 'Angola | C10: 'AGO | D10: =IF(EQUAL(ComparativeCharts!R[+11]C, ""), "", 1) ->  | E10: =IF(EQUAL(ComparativeCharts!R[+11]C, ""), "", 1) -> #EMPTY! | O10: 3 | P10: 'Myanmar | Q10: 'MMR | R10: -1.74774269698842 | S10: 0.254026944310672 | T10: =1.64*RC[-1] -> 0.416604188669502 | U10: =IF(EQUAL(VLOOKUP(RC[-4], R9C3:R186C4, 2, 0), 1), RC[-1], NA()) -> #ERR: ArgCount | V10: =IF(ISERROR(RC[-1])=1, "", RC[-5]) ->  | W10: 'Iraq | X10: 'IRQ | Y10: -2.24452032849233 | Z10: 0.299881889042829 | AA10: =1.64*RC[-1] -> 0.49180629803024 | AB10: =IF(EQUAL(VLOOKUP(RC[-4], R9C3:R186C4, 2, 0), 1), RC[-1], NA()) -> #ERR: ArgCount | AC10: =IF(ISERROR(RC[-1])=1, "", RC[-5]) ->  | AD10: 'Sudan | AE10: 'SDN | AF10: -1.69749819831693 | AG10: 0.374142364422074 | AH10: =1.64*RC[-1] -> 0.613593477652201 | AI10: =IF(EQUAL(VLOOKUP(RC[-4], R9C3:R186C4, 2, 0), 1), RC[-1], NA()) -> #ERR: ArgCount | AJ10: =IF(ISERROR(RC[-1])=1, "", RC[-5]) ->  | AK10: 'Congo, Dem. Rep. | AL10: 'ZAR | AM10: -2.34041786848463 | AN10: 0.395254221998157 | AO10: =1.64*RC[-1] -> 0.648216924076978 | AP10: =IF(EQUAL(VLOOKUP(RC[-4], R9C3:R186C4, 2, 0), 1), RC[-1], NA()) -> #ERR: ArgCount | AQ10: =IF(ISERROR(RC[-1])=1, "", RC[-5]) ->  | AR10: 'Guinea-Bissau | AS10: 'GNB | AT10: -1.61471345546518 | AU10: 0.371358506695114 | AV10: =1.64*RC[-1] -> 0.609027950979987 | AW10: =IF(EQUAL(VLOOKUP(RC[-4], R9C3:R186C4, 2, 0), 1), RC[-1], NA()) -> #ERR: ArgCount | AX10: =IF(ISERROR(RC[-1])=1, "", RC[-5]) ->  | AY10: 'Tajikistan | AZ10: 'TJK | BA10: -1.31577594123635 | BB10: 0.25531057815317 | BC10: =1.64*RC[-1] -> 0.418709348171199 | BD10: =IF(EQUAL(VLOOKUP(RC[-4], R9C3:R186C4, 2, 0), 1), RC[-1], NA()) -> #ERR: ArgCount | BE10: =IF(ISERROR(RC[-1])=1, "", RC[-5]) -> 
B11: 'Albania | C11: 'ALB | D11: =IF(EQUAL(ComparativeCharts!R[+11]C, ""), "", 1) ->  | E11: =IF(EQUAL(ComparativeCharts!R[+11]C, ""), "", 1) -> #EMPTY! | O11: 4 | P11: 'Somalia | Q11: 'SOM | R11: -1.69387149024054 | S11: 0.291377601755329 | T11: =1.64*RC[-1] -> 0.47785926687874 | U11: =IF(EQUAL(VLOOKUP(RC[-4], R9C3:R186C4, 2, 0), 1), RC[-1], NA()) -> #ERR: ArgCount | V11: =IF(ISERROR(RC[-1])=1, "", RC[-5]) ->  | W11: 'Tajikistan | X11: 'TJK | Y11: -1.86227150484566 | Z11: 0.327330708514643 | AA11: =1.64*RC[-1] -> 0.536822361964015 | AB11: =IF(EQUAL(VLOOKUP(RC[-4], R9C3:R186C4, 2, 0), 1), RC[-1], NA()) -> #ERR: ArgCount | AC11: =IF(ISERROR(RC[-1])=1, "", RC[-5]) ->  | AD11: 'Somalia | AE11: 'SOM | AF11: -1.69667059290386 | AG11: 0.768168783719135 | AH11: =1.64*RC[-1] -> 1.25979680529938 | AI11: =IF(EQUAL(VLOOKUP(RC[-4], R9C3:R186C4, 2, 0), 1), RC[-1], NA()) -> #ERR: ArgCount | AJ11: =IF(ISERROR(RC[-1])=1, "", RC[-5]) ->  | AK11: 'Turkmenistan | AL11: 'TKM | AM11: -1.93119027906379 | AN11: 0.272265955073957 | AO11: =1.64*RC[-1] -> 0.446516166321289 | AP11: =IF(EQUAL(VLOOKUP(RC[-4], R9C3:R186C4, 2, 0), 1), RC[-1], NA()) -> #ERR: ArgCount | AQ11: =IF(ISERROR(RC[-1])=1, "", RC[-5]) ->  | AR11: 'Haiti | AS11: 'HTI | AT11: -1.49534623770841 | AU11: 0.443073362506416 | AV11: =1.64*RC[-1] -> 0.726640314510522 | AW11: =IF(EQUAL(VLOOKUP(RC[-4], R9C3:R186C4, 2, 0), 1), RC[-1], NA()) -> #ERR: ArgCount | AX11: =IF(ISERROR(RC[-1])=1, "", RC[-5]) ->  | AY11: 'Turkmenistan | AZ11: 'TKM | BA11: -1.28933349521853 | BB11: 0.25531057815317 | BC11: =1.64*RC[-1] -> 0.418709348171199 | BD11: =IF(EQUAL(VLOOKUP(RC[-4], R9C3:R186C4, 2, 0), 1), RC[-1], NA()) -> #ERR: ArgCount | BE11: =IF(ISERROR(RC[-1])=1, "", RC[-5]) -> 
B12: 'United Arab Emirates | C12: 'ARE | D12: =IF(EQUAL(ComparativeCharts!R[+11]C, ""), "", 1) ->  | E12: =IF(EQUAL(ComparativeCharts!R[+11]C, ""), "", 1) -> #EMPTY! | O12: 5 | P12: 'Sierra Leone | Q12: 'SLE | R12: -1.62336683417428 | S12: 0.291377601755329 | T12: =1.64*RC[-1] -> 0.47785926687874 | U12: =IF(EQUAL(VLOOKUP(RC[-4], R9C3:R186C4, 2, 0), 1), RC[-1], NA()) -> #ERR: ArgCount | V12: =IF(ISERROR(RC[-1])=1, "", RC[-5]) ->  | W12: 'Congo, Rep. | X12: 'COG | Y12: -1.82577147723476 | Z12: 0.373502182114371 | AA12: =1.64*RC[-1] -> 0.612543578667568 | AB12: =IF(EQUAL(VLOOKUP(RC[-4], R9C3:R186C4, 2, 0), 1), RC[-1], NA()) -> #ERR: ArgCount | AC12: =IF(ISERROR(RC[-1])=1, "", RC[-5]) ->  | AD12: 'Myanmar | AE12: 'MMR | AF12: -1.46134649771696 | AG12: 0.319089592041234 | AH12: =1.64*RC[-1] -> 0.523306930947624 | AI12: =IF(EQUAL(VLOOKUP(RC[-4], R9C3:R186C4, 2, 0), 1), RC[-1], NA()) -> #ERR: ArgCount | AJ12: =IF(ISERROR(RC[-1])=1, "", RC[-5]) ->  | AK12: 'Lao, PDR | AL12: 'LAO | AM12: -1.81787931191111 | AN12: 0.601880844424266 | AO12: =1.64*RC[-1] -> 0.987084584855796 | AP12: =IF(EQUAL(VLOOKUP(RC[-4], R9C3:R186C4, 2, 0), 1), RC[-1], NA()) -> #ERR: ArgCount | AQ12: =IF(ISERROR(RC[-1])=1, "", RC[-5]) ->  | AR12: 'Somalia | AS12: 'SOM | AT12: -1.49534623770841 | AU12: 0.443073362506416 | AV12: =1.64*RC[-1] -> 0.726640314510522 | AW12: =IF(EQUAL(VLOOKUP(RC[-4], R9C3:R186C4, 2, 0), 1), RC[-1], NA()) -> #ERR: ArgCount | AX12: =IF(ISERROR(RC[-1])=1, "", RC[-5]) ->  | AY12: 'Iraq | AZ12: 'IRQ | BA12: -1.26489276326293 | BB12: 0.267063170408295 | BC12: =1.64*RC[-1] -> 0.437983599469604 | BD12: =IF(EQUAL(VLOOKUP(RC[-4], R9C3:R186C4, 2, 0), 1), RC[-1], NA()) -> #ERR: ArgCount | BE12: =IF(ISERROR(RC[-1])=1, "", RC[-5]) -> 
B13: 'Argentina | C13: 'ARG | D13: =IF(EQUAL(ComparativeCharts!R[+11]C, ""), "", 1) ->  | E13: =IF(EQUAL(ComparativeCharts!R[+11]C, ""), "", 1) -> #EMPTY! | O13: 6 | P13: 'Afghanistan | Q13: 'AFG | R13: -1.6163871673911 | S13: 0.360314615495306 | T13: =1.64*RC[-1] -> 0.590915969412302 | U13: =IF(EQUAL(VLOOKUP(RC[-4], R9C3:R186C4, 2, 0), 1), RC[-1], NA()) -> #ERR: ArgCount | V13: =IF(ISERROR(RC[-1])=1, "", RC[-5]) ->  | W13: 'Angola | X13: 'AGO | Y13: -1.78460359621811 | Z13: 0.279058457436991 | AA13: =1.64*RC[-1] -> 0.457655870196665 | AB13: =IF(EQUAL(VLOOKUP(RC[-4], R9C3:R186C4, 2, 0), 1), RC[-1], NA()) -> #ERR: ArgCount | AC13: =IF(ISERROR(RC[-1])=1, "", RC[-5]) ->  | AD13: 'Tajikistan | AE13: 'TJK | AF13: -1.42259787735938 | AG13: 0.339023737174356 | AH13: =1.64*RC[-1] -> 0.555998928965944 | AI13: =IF(EQUAL(VLOOKUP(RC[-4], R9C3:R186C4, 2, 0), 1), RC[-1], NA()) -> #ERR: ArgCount | AJ13: =IF(ISERROR(RC[-1])=1, "", RC[-5]) ->  | AK13: 'Somalia | AL13: 'SOM | AM13: -1.76887680212462 | AN13: 0.519940958319459 | AO13: =1.64*RC[-1] -> 0.852703171643913 | AP13: =IF(EQUAL(VLOOKUP(RC[-4], R9C3:R186C4, 2, 0), 1), RC[-1], NA()) -> #ERR: ArgCount | AQ13: =IF(ISERROR(RC[-1])=1, "", RC[-5]) ->  | AR13: 'Congo, Rep. | AS13: 'COG | AT13: -1.43538819682423 | AU13: 0.371358506695114 | AV13: =1.64*RC[-1] -> 0.609027950979987 | AW13: =IF(EQUAL(VLOOKUP(RC[-4], R9C3:R186C4, 2, 0), 1), RC[-1], NA()) -> #ERR: ArgCount | AX13: =IF(ISERROR(RC[-1])=1, "", RC[-5]) ->  | AY13: 'Cameroon | AZ13: 'CMR | BA13: -1.10460553053312 | BB13: 0.210520528590018 | BC13: =1.64*RC[-1] -> 0.345253666887629 | BD13: =IF(EQUAL(VLOOKUP(RC[-4], R9C3:R186C4, 2, 0), 1), RC[-1], NA()) -> #ERR: ArgCount | BE13: =IF(ISERROR(RC[-1])=1, "", RC[-5]) -> 
B14: 'Armenia | C14: 'ARM | D14: =IF(EQUAL(ComparativeCharts!R[+11]C, ""), "", 1) ->  | E14: =IF(EQUAL(ComparativeCharts!R[+11]C, ""), "", 1) -> #EMPTY! | O14: 7 | P14: 'Congo, Dem. Rep. | Q14: 'ZAR | R14: -1.56746239781784 | S14: 0.291377601755329 | T14: =1.64*RC[-1] -> 0.47785926687874 | U14: =IF(EQUAL(VLOOKUP(RC[-4], R9C3:R186C4, 2, 0), 1), RC[-1], NA()) -> #ERR: ArgCount | V14: =IF(ISERROR(RC[-1])=1, "", RC[-5]) ->  | W14: 'Sudan | X14: 'SDN | Y14: -1.73199293064119 | Z14: 0.342482293230127 | AA14: =1.64*RC[-1] -> 0.561670960897408 | AB14: =IF(EQUAL(VLOOKUP(RC[-4], R9C3:R186C4, 2, 0), 1), RC[-1], NA()) -> #ERR: ArgCount | AC14: =IF(ISERROR(RC[-1])=1, "", RC[-5]) ->  | AD14: 'Angola | AE14: 'AGO | AF14: -1.3903388842921 | AG14: 0.235337708537315 | AH14: =1.64*RC[-1] -> 0.385953842001197 | AI14: =IF(EQUAL(VLOOKUP(RC[-4], R9C3:R186C4, 2, 0), 1), RC[-1], NA()) -> #ERR: ArgCount | AJ14: =IF(ISERROR(RC[-1])=1, "", RC[-5]) ->  | AK14: 'Yugoslavia, FR (Serbia/Montenegro) | AL14: 'YUG | AM14: -1.53893544215682 | AN14: 0.718213521236258 | AO14: =1.64*RC[-1] -> 1.17787017482746 | AP14: =IF(EQUAL(VLOOKUP(RC[-4], R9C3:R186C4, 2, 0), 1), RC[-1], NA()) -> #ERR: ArgCount | AQ14: =IF(ISERROR(RC[-1])=1, "", RC[-5]) ->  | AR14: 'Sudan | AS14: 'SDN | AT14: -1.34612983165983 | AU14: 0.313894625236573 | AV14: =1.64*RC[-1] -> 0.51478718538798 | AW14: =IF(EQUAL(VLOOKUP(RC[-4], R9C3:R186C4, 2, 0), 1), RC[-1], NA()) -> #ERR: ArgCount | AX14: =IF(ISERROR(RC[-1])=1, "", RC[-5]) ->  | AY14: 'Myanmar | AZ14: 'MMR | BA14: -1.0957168092296 | BB14: 0.267063170408295 | BC14: =1.64*RC[-1] -> 0.437983599469604 | BD14: =IF(EQUAL(VLOOKUP(RC[-4], R9C3:R186C4, 2, 0), 1), RC[-1], NA()) -> #ERR: ArgCount | BE14: =IF(ISERROR(RC[-1])=1, "", RC[-5]) -> 
B15: 'Australia | C15: 'AUS | D15: =IF(EQUAL(ComparativeCharts!R[+11]C, ""), "", 1) ->  | E15: =IF(EQUAL(ComparativeCharts!R[+11]C, ""), "", 1) -> #EMPTY! | O15: 8 | P15: 'Tajikistan | Q15: 'TJK | R15: -1.56461063224691 | S15: 0.360314615495306 | T15: =1.64*RC[-1] -> 0.590915969412302 | U15: =IF(EQUAL(VLOOKUP(RC[-4], R9C3:R186C4, 2, 0), 1), RC[-1], NA()) -> #ERR: ArgCount | V15: =IF(ISERROR(RC[-1])=1, "", RC[-5]) ->  | W15: 'Haiti | X15: 'HTI | Y15: -1.70865142303535 | Z15: 0.412522842574475 | AA15: =1.64*RC[-1] -> 0.676537461822139 | AB15: =IF(EQUAL(VLOOKUP(RC[-4], R9C3:R186C4, 2, 0), 1), RC[-1], NA()) -> #ERR: ArgCount | AC15: =IF(ISERROR(RC[-1])=1, "", RC[-5]) ->  | AD15: 'Niger | AE15: 'NER | AF15: -1.38661379239078 | AG15: 0.768168783719135 | AH15: =1.64*RC[-1] -> 1.25979680529938 | AI15: =IF(EQUAL(VLOOKUP(RC[-4], R9C3:R186C4, 2, 0), 1), RC[-1], NA()) -> #ERR: ArgCount | AJ15: =IF(ISERROR(RC[-1])=1, "", RC[-5]) ->  | AK15: 'Tajikistan | AL15: 'TJK | AM15: -1.51955194295233 | AN15: 0.272265955073957 | AO15: =1.64*RC[-1] -> 0.446516166321289 | AP15: =IF(EQUAL(VLOOKUP(RC[-4], R9C3:R186C4, 2, 0), 1), RC[-1], NA()) -> #ERR: ArgCount | AQ15: =IF(ISERROR(RC[-1])=1, "", RC[-5]) ->  | AR15: 'Tajikistan | AS15: 'TJK | AT15: -1.33489283098392 | AU15: 0.215738306159556 | AV15: =1.64*RC[-1] -> 0.353810822101672 | AW15: =IF(EQUAL(VLOOKUP(RC[-4], R9C3:R186C4, 2, 0), 1), RC[-1], NA()) -> #ERR: ArgCount | AX15: =IF(ISERROR(RC[-1])=1, "", RC[-5]) ->  | AY15: 'Liberia | AZ15: 'LBR | BA15: -1.05076334389969 | BB15: 0.748674396199437 | BC15: =1.64*RC[-1] -> 1.22782600976708 | BD15: =IF(EQUAL(VLOOKUP(RC[-4], R9C3:R186C4, 2, 0), 1), RC[-1], NA()) -> #ERR: ArgCount | BE15: =IF(ISERROR(RC[-1])=1, "", RC[-5]) -> 
B16: 'Austria | C16: 'AUT | D16: =IF(EQUAL(ComparativeCharts!R[+11]C, ""), "", 1) ->  | E16: =IF(EQUAL(ComparativeCharts!R[+11]C, ""), "", 1) -> #EMPTY! | O16: 9 | P16: 'Sudan | Q16: 'SDN | R16: -1.49805561873747 | S16: 0.254026944310672 | T16: =1.64*RC[-1] -> 0.416604188669502 | U16: =IF(EQUAL(VLOOKUP(RC[-4], R9C3:R186C4, 2, 0), 1), RC[-1], NA()) -> #ERR: ArgCount | V16: =IF(ISERROR(RC[-1])=1, "", RC[-5]) ->  | W16: 'Somalia | X16: 'SOM | Y16: -1.70865142303535 | Z16: 0.412522842574475 | AA16: =1.64*RC[-1] -> 0.676537461822139 | AB16: =IF(EQUAL(VLOOKUP(RC[-4], R9C3:R186C4, 2, 0), 1), RC[-1], NA()) -> #ERR: ArgCount | AC16: =IF(ISERROR(RC[-1])=1, "", RC[-5]) ->  | AD16: 'Libya | AE16: 'LBY | AF16: -1.32171691053559 | AG16: 0.319089592041234 | AH16: =1.64*RC[-1] -> 0.523306930947624 | AI16: =IF(EQUAL(VLOOKUP(RC[-4], R9C3:R186C4, 2, 0), 1), RC[-1], NA()) -> #ERR: ArgCount | AJ16: =IF(ISERROR(RC[-1])=1, "", RC[-5]) ->  | AK16: 'Sierra Leone | AL16: 'SLE | AM16: -1.5008318425718 | AN16: 0.519940958319459 | AO16: =1.64*RC[-1] -> 0.852703171643913 | AP16: =IF(EQUAL(VLOOKUP(RC[-4], R9C3:R186C4, 2, 0), 1), RC[-1], NA()) -> #ERR: ArgCount | AQ16: =IF(ISERROR(RC[-1])=1, "", RC[-5]) ->  | AR16: 'Liberia | AS16: 'LBR | AT16: -1.28862669959157 | AU16: 0.548697312118359 | AV16: =1.64*RC[-1] -> 0.899863591874109 | AW16: =IF(EQUAL(VLOOKUP(RC[-4], R9C3:R186C4, 2, 0), 1), RC[-1], NA()) -> #ERR: ArgCount | AX16: =IF(ISERROR(RC[-1])=1, "", RC[-5]) ->  | AY16: 'Somalia | AZ16: 'SOM | BA16: -1.05076334389969 | BB16: 0.748674396199437 | BC16: =1.64*RC[-1] -> 1.22782600976708 | BD16: =IF(EQUAL(VLOOKUP(RC[-4], R9C3:R186C4, 2, 0), 1), RC[-1], NA()) -> #ERR: ArgCount | BE16: =IF(ISERROR(RC[-1])=1, "", RC[-5]) -> 
B17: 'Azerbaijan | C17: 'AZE | D17: =IF(EQUAL(ComparativeCharts!R[+11]C, ""), "", 1) ->  | E17: =IF(EQUAL(ComparativeCharts!R[+11]C, ""), "", 1) -> #EMPTY! | O17: 10 | P17: 'Cuba | Q17: 'CUB | R17: -1.46071200942026 | S17: 0.254026944310672 | T17: =1.64*RC[-1] -> 0.416604188669502 | U17: =IF(EQUAL(VLOOKUP(RC[-4], R9C3:R186C4, 2, 0), 1), RC[-1], NA()) -> #ERR: ArgCount | V17: =IF(ISERROR(RC[-1])=1, "", RC[-5]) ->  | W17: 'Swaziland | X17: 'SWZ | Y17: -1.69422455002844 | Z17: 0.606177135766502 | AA17: =1.64*RC[-1] -> 0.994130502657063 | AB17: =IF(EQUAL(VLOOKUP(RC[-4], R9C3:R186C4, 2, 0), 1), RC[-1], NA()) -> #ERR: ArgCount | AC17: =IF(ISERROR(RC[-1])=1, "", RC[-5]) ->  | AD17: 'Nigeria | AE17: 'NGA | AF17: -1.32076744114904 | AG17: 0.222481788006156 | AH17: =1.64*RC[-1] -> 0.364870132330096 | AI17: =IF(EQUAL(VLOOKUP(RC[-4], R9C3:R186C4, 2, 0), 1), RC[-1], NA()) -> #ERR: ArgCount | AJ17: =IF(ISERROR(RC[-1])=1, "", RC[-5]) ->  | AK17: 'Belarus | AL17: 'BLR | AM17: -1.46557701705803 | AN17: 0.262826647914669 | AO17: =1.64*RC[-1] -> 0.431035702580057 | AP17: =IF(EQUAL(VLOOKUP(RC[-4], R9C3:R186C4, 2, 0), 1), RC[-1], NA()) -> #ERR: ArgCount | AQ17: =IF(ISERROR(RC[-1])=1, "", RC[-5]) ->  | AR17: 'Angola | AS17: 'AGO | AT17: -1.22506644579426 | AU17: 0.272746442471847 | AV17: =1.64*RC[-1] -> 0.447304165653829 | AW17: =IF(EQUAL(VLOOKUP(RC[-4], R9C3:R186C4, 2, 0), 1), RC[-1], NA()) -> #ERR: ArgCount | AX17: =IF(ISERROR(RC[-1])=1, "", RC[-5]) ->  | AY17: 'Gabon | AZ17: 'GAB | BA17: -1.0151196581536 | BB17: 0.296106941830424 | BC17: =1.64*RC[-1] -> 0.485615384601895 | BD17: =IF(EQUAL(VLOOKUP(RC[-4], R9C3:R186C4, 2, 0), 1), RC[-1], NA()) -> #ERR: ArgCount | BE17: =IF(ISERROR(RC[-1])=1, "", RC[-5]) -> 
B18: 'Burundi | C18: 'BDI | D18: =IF(EQUAL(ComparativeCharts!R[+11]C, ""), "", 1) ->  | E18: =IF(EQUAL(ComparativeCharts!R[+11]C, ""), "", 1) -> #EMPTY! | O18: 11 | P18: 'Turkmenistan | Q18: 'TKM | R18: -1.45070225927893 | S18: 0.360314615495306 | T18: =1.64*RC[-1] -> 0.590915969412302 | U18: =IF(EQUAL(VLOOKUP(RC[-4], R9C3:R186C4, 2, 0), 1), RC[-1], NA()) -> #ERR: ArgCount | V18: =IF(ISERROR(RC[-1])=1, "", RC[-5]) ->  | W18: 'Sri Lanka | X18: 'LKA | Y18: -1.62755969649983 | Z18: 0.299881889042829 | AA18: =1.64*RC[-1] -> 0.49180629803024 | AB18: =IF(EQUAL(VLOOKUP(RC[-4], R9C3:R186C4, 2, 0), 1), RC[-1], NA()) -> #ERR: ArgCount | AC18: =IF(ISERROR(RC[-1])=1, "", RC[-5]) ->  | AD18: 'Uzbekistan | AE18: 'UZB | AF18: -1.30482573679805 | AG18: 0.247715659528938 | AH18: =1.64*RC[-1] -> 0.406253681627458 | AI18: =IF(EQUAL(VLOOKUP(RC[-4], R9C3:R186C4, 2, 0), 1), RC[-1], NA()) -> #ERR: ArgCount | AJ18: =IF(ISERROR(RC[-1])=1, "", RC[-5]) ->  | AK18: 'Korea, Dem. Rep. | AL18: 'PRK | AM18: -1.40086444308209 | AN18: 0.519940958319459 | AO18: =1.64*RC[-1] -> 0.852703171643913 | AP18: =IF(EQUAL(VLOOKUP(RC[-4], R9C3:R186C4, 2, 0), 1), RC[-1], NA()) -> #ERR: ArgCount | AQ18: =IF(ISERROR(RC[-1])=1, "", RC[-5]) ->  | AR18: 'Kenya | AS18: 'KEN | AT18: -1.22003779383246 | AU18: 0.253185404132827 | AV18: =1.64*RC[-1] -> 0.415224062777836 | AW18: =IF(EQUAL(VLOOKUP(RC[-4], R9C3:R186C4, 2, 0), 1), RC[-1], NA()) -> #ERR: ArgCount | AX18: =IF(ISERROR(RC[-1])=1, "", RC[-5]) ->  | AY18: 'Sudan | AZ18: 'SDN | BA18: -1.0151196581536 | BB18: 0.296106941830424 | BC18: =1.64*RC[-1] -> 0.485615384601895 | BD18: =IF(EQUAL(VLOOKUP(RC[-4], R9C3:R186C4, 2, 0), 1), RC[-1], NA()) -> #ERR: ArgCount | BE18: =IF(ISERROR(RC[-1])=1, "", RC[-5]) -> 
B19: 'Belgium | C19: 'BEL | D19: =IF(EQUAL(ComparativeCharts!R[+11]C, ""), "", 1) ->  | E19: =IF(EQUAL(ComparativeCharts!R[+11]C, ""), "", 1) -> #EMPTY! | O19: 12 | P19: 'Vietnam | Q19: 'VNM | R19: -1.41570274439784 | S19: 0.254026944310672 | T19: =1.64*RC[-1] -> 0.416604188669502 | U19: =IF(EQUAL(VLOOKUP(RC[-4], R9C3:R186C4, 2, 0), 1), RC[-1], NA()) -> #ERR: ArgCount | V19: =IF(ISERROR(RC[-1])=1, "", RC[-5]) ->  | W19: 'Sierra Leone | X19: 'SLE | Y19: -1.5194887945582 | Z19: 0.412522842574475 | AA19: =1.64*RC[-1] -> 0.676537461822139 | AB19: =IF(EQUAL(VLOOKUP(RC[-4], R9C3:R186C4, 2, 0), 1), RC[-1], NA()) -> #ERR: ArgCount | AC19: =IF(ISERROR(RC[-1])=1, "", RC[-5]) ->  | AD19: 'Turkmenistan | AE19: 'TKM | AF19: -1.25225793116026 | AG19: 0.339023737174356 | AH19: =1.64*RC[-1] -> 0.555998928965944 | AI19: =IF(EQUAL(VLOOKUP(RC[-4], R9C3:R186C4, 2, 0), 1), RC[-1], NA()) -> #ERR: ArgCount | AJ19: =IF(ISERROR(RC[-1])=1, "", RC[-5]) ->  | AK19: 'Uzbekistan | AL19: 'UZB | AM19: -1.39782244209647 | AN19: 0.271785289504675 | AO19: =1.64*RC[-1] -> 0.445727874787667 | AP19: =IF(EQUAL(VLOOKUP(RC[-4], R9C3:R186C4, 2, 0), 1), RC[-1], NA()) -> #ERR: ArgCount | AQ19: =IF(ISERROR(RC[-1])=1, "", RC[-5]) ->  | AR19: 'Equatorial Guinea | AS19: 'GNQ | AT19: -1.2036375560024 | AU19: 0.600583865212543 | AV19: =1.64*RC[-1] -> 0.984957538948571 | AW19: =IF(EQUAL(VLOOKUP(RC[-4], R9C3:R186C4, 2, 0), 1), RC[-1], NA()) -> #ERR: ArgCount | AX19: =IF(ISERROR(RC[-1])=1, "", RC[-5]) ->  | AY19: 'Azerbaijan | AZ19: 'AZE | BA19: -0.997599695769517 | BB19: 0.188243145715436 | BC19: =1.64*RC[-1] -> 0.308718758973315 | BD19: =IF(EQUAL(VLOOKUP(RC[-4], R9C3:R186C4, 2, 0), 1), RC[-1], NA()) -> #ERR: ArgCount | BE19: =IF(ISERROR(RC[-1])=1, "", RC[-5]) -> 
B20: 'Benin | C20: 'BEN | D20: =IF(EQUAL(ComparativeCharts!R[+11]C, ""), "", 1) ->  | E20: =IF(EQUAL(ComparativeCharts!R[+11]C, ""), "", 1) -> #EMPTY! | O20: 13 | P20: 'Equatorial Guinea | Q20: 'GNQ | R20: -1.38857041834854 | S20: 0.360314615495306 | T20: =1.64*RC[-1] -> 0.590915969412302 | U20: =IF(EQUAL(VLOOKUP(RC[-4], R9C3:R186C4, 2, 0), 1), RC[-1], NA()) -> #ERR: ArgCount | V20: =IF(ISERROR(RC[-1])=1, "", RC[-5]) ->  | W20: 'Yemen, Rep. | X20: 'YEM | Y20: -1.47123016529754 | Z20: 0.342482293230127 | AA20: =1.64*RC[-1] -> 0.561670960897408 | AB20: =IF(EQUAL(VLOOKUP(RC[-4], R9C3:R186C4, 2, 0), 1), RC[-1], NA()) -> #ERR: ArgCount | AC20: =IF(ISERROR(RC[-1])=1, "", RC[-5]) ->  | AD20: 'Haiti | AE20: 'HTI | AF20: -1.23158539585491 | AG20: 0.768168783719135 | AH20: =1.64*RC[-1] -> 1.25979680529938 | AI20: =IF(EQUAL(VLOOKUP(RC[-4], R9C3:R186C4, 2, 0), 1), RC[-1], NA()) -> #ERR: ArgCount | AJ20: =IF(ISERROR(RC[-1])=1, "", RC[-5]) ->  | AK20: 'Guinea-Bissau | AL20: 'GNB | AM20: -1.35023423704921 | AN20: 0.516616692692467 | AO20: =1.64*RC[-1] -> 0.847251376015646 | AP20: =IF(EQUAL(VLOOKUP(RC[-4], R9C3:R186C4, 2, 0), 1), RC[-1], NA()) -> #ERR: ArgCount | AQ20: =IF(ISERROR(RC[-1])=1, "", RC[-5]) ->  | AR20: 'Lao, PDR | AS20: 'LAO | AT20: -1.2036375560024 | AU20: 0.600583865212543 | AV20: =1.64*RC[-1] -> 0.984957538948571 | AW20: =IF(EQUAL(VLOOKUP(RC[-4], R9C3:R186C4, 2, 0), 1), RC[-1], NA()) -> #ERR: ArgCount | AX20: =IF(ISERROR(RC[-1])=1, "", RC[-5]) ->  | AY20: 'Yugoslavia, FR (Serbia/Montenegro) | AZ20: 'YUG | BA20: -0.994523144450128 | BB20: 0.199511651995437 | BC20: =1.64*RC[-1] -> 0.327199109272517 | BD20: =IF(EQUAL(VLOOKUP(RC[-4], R9C3:R186C4, 2, 0), 1), RC[-1], NA()) -> #ERR: ArgCount | BE20: =IF(ISERROR(RC[-1])=1, "", RC[-5]) -> 
B21: 'Burkina Faso | C21: 'BFA | D21: =IF(EQUAL(ComparativeCharts!R[+11]C, ""), "", 1) ->  | E21: =IF(EQUAL(ComparativeCharts!R[+11]C, ""), "", 1) -> #EMPTY! | O21: 14 | P21: 'Syrian Arab Republic | Q21: 'SYR | R21: -1.35777091688175 | S21: 0.254026944310672 | T21: =1.64*RC[-1] -> 0.416604188669502 | U21: =IF(EQUAL(VLOOKUP(RC[-4], R9C3:R186C4, 2, 0), 1), RC[-1], NA()) -> #ERR: ArgCount | V21: =IF(ISERROR(RC[-1])=1, "", RC[-5]) ->  | W21: 'Yugoslavia, FR (Serbia/Montenegro) | X21: 'YUG | Y21: -1.41949950008468 | Z21: 0.264772723738274 | AA21: =1.64*RC[-1] -> 0.434227266930769 | AB21: =IF(EQUAL(VLOOKUP(RC[-4], R9C3:R186C4, 2, 0), 1), RC[-1], NA()) -> #ERR: ArgCount | AC21: =IF(ISERROR(RC[-1])=1, "", RC[-5]) ->  | AD21: 'Syrian Arab Republic | AE21: 'SYR | AF21: -1.180886981196 | AG21: 0.319089592041234 | AH21: =1.64*RC[-1] -> 0.523306930947624 | AI21: =IF(EQUAL(VLOOKUP(RC[-4], R9C3:R186C4, 2, 0), 1), RC[-1], NA()) -> #ERR: ArgCount | AJ21: =IF(ISERROR(RC[-1])=1, "", RC[-5]) ->  | AK21: 'Equatorial Guinea | AL21: 'GNQ | AM21: -1.33184837527318 | AN21: 0.601880844424266 | AO21: =1.64*RC[-1] -> 0.987084584855796 | AP21: =IF(EQUAL(VLOOKUP(RC[-4], R9C3:R186C4, 2, 0), 1), RC[-1], NA()) -> #ERR: ArgCount | AQ21: =IF(ISERROR(RC[-1])=1, "", RC[-5]) ->  | AR21: 'Rwanda | AS21: 'RWA | AT21: -1.2036375560024 | AU21: 0.600583865212543 | AV21: =1.64*RC[-1] -> 0.984957538948571 | AW21: =IF(EQUAL(VLOOKUP(RC[-4], R9C3:R186C4, 2, 0), 1), RC[-1], NA()) -> #ERR: ArgCount | AX21: =IF(ISERROR(RC[-1])=1, "", RC[-5]) ->  | AY21: 'Albania | AZ21: 'ALB | BA21: -0.98509305269305 | BB21: 0.231874540556914 | BC21: =1.64*RC[-1] -> 0.380274246513339 | BD21: =IF(EQUAL(VLOOKUP(RC[-4], R9C3:R186C4, 2, 0), 1), RC[-1], NA()) -> #ERR: ArgCount | BE21: =IF(ISERROR(RC[-1])=1, "", RC[-5]) -> 
B22: 'Bangladesh | C22: 'BGD | D22: =IF(EQUAL(ComparativeCharts!R[+11]C, ""), "", 1) ->  | E22: =IF(EQUAL(ComparativeCharts!R[+11]C, ""), "", 1) -> #EMPTY! | O22: 15 | P22: 'Libya | Q22: 'LBY | R22: -1.34616258147123 | S22: 0.254026944310672 | T22: =1.64*RC[-1] -> 0.416604188669502 | U22: =IF(EQUAL(VLOOKUP(RC[-4], R9C3:R186C4, 2, 0), 1), RC[-1], NA()) -> #ERR: ArgCount | V22: =IF(ISERROR(RC[-1])=1, "", RC[-5]) ->  | W22: 'Colombia | X22: 'COL | Y22: -1.28993831164361 | Z22: 0.25228486761248 | AA22: =1.64*RC[-1] -> 0.413747182884467 | AB22: =IF(EQUAL(VLOOKUP(RC[-4], R9C3:R186C4, 2, 0), 1), RC[-1], NA()) -> #ERR: ArgCount | AC22: =IF(ISERROR(RC[-1])=1, "", RC[-5]) ->  | AD22: 'Zimbabwe | AE22: 'ZWE | AF22: -1.12916573448837 | AG22: 0.222481788006156 | AH22: =1.64*RC[-1] -> 0.364870132330096 | AI22: =IF(EQUAL(VLOOKUP(RC[-4], R9C3:R186C4, 2, 0), 1), RC[-1], NA()) -> #ERR: ArgCount | AJ22: =IF(ISERROR(RC[-1])=1, "", RC[-5]) ->  | AK22: 'Bosnia and Herzegovina | AL22: 'BIH | AM22: -1.25740782983409 | AN22: 0.304457805877569 | AO22: =1.64*RC[-1] -> 0.499310801639213 | AP22: =IF(EQUAL(VLOOKUP(RC[-4], R9C3:R186C4, 2, 0), 1), RC[-1], NA()) -> #ERR: ArgCount | AQ22: =IF(ISERROR(RC[-1])=1, "", RC[-5]) ->  | AR22: 'Niger | AS22: 'NER | AT22: -1.14386405716019 | AU22: 0.443073362506416 | AV22: =1.64*RC[-1] -> 0.726640314510522 | AW22: =IF(EQUAL(VLOOKUP(RC[-4], R9C3:R186C4, 2, 0), 1), RC[-1], NA()) -> #ERR: ArgCount | AX22: =IF(ISERROR(RC[-1])=1, "", RC[-5]) ->  | AY22: 'Uzbekistan | AZ22: 'UZB | BA22: -0.963253322227625 | BB22: 0.190914026264653 | BC22: =1.64*RC[-1] -> 0.313099003074031 | BD22: =IF(EQUAL(VLOOKUP(RC[-4], R9C3:R186C4, 2, 0), 1), RC[-1], NA()) -> #ERR: ArgCount | BE22: =IF(ISERROR(RC[-1])=1, "", RC[-5]) -> 
B23: 'Bulgaria | C23: 'BGR | D23: =IF(EQUAL(ComparativeCharts!R[+11]C, ""), "", 1) ->  | E23: =IF(EQUAL(ComparativeCharts!R[+11]C, ""), "", 1) -> #EMPTY! | O23: 16 | P23: 'Uzbekistan | Q23: 'UZB | R23: -1.3433286807786 | S23: 0.291618285870453 | T23: =1.64*RC[-1] -> 0.478253988827543 | U23: =IF(EQUAL(VLOOKUP(RC[-4], R9C3:R186C4, 2, 0), 1), RC[-1], NA()) -> #ERR: ArgCount | V23: =IF(ISERROR(RC[-1])=1, "", RC[-5]) ->  | W23: 'Indonesia | X23: 'IDN | Y23: -1.28866288049059 | Z23: 0.263344534520094 | AA23: =1.64*RC[-1] -> 0.431885036612954 | AB23: =IF(EQUAL(VLOOKUP(RC[-4], R9C3:R186C4, 2, 0), 1), RC[-1], NA()) -> #ERR: ArgCount | AC23: =IF(ISERROR(RC[-1])=1, "", RC[-5]) ->  | AD23: 'Gabon | AE23: 'GAB | AF23: -1.12675297732703 | AG23: 0.374142364422074 | AH23: =1.64*RC[-1] -> 0.613593477652201 | AI23: =IF(EQUAL(VLOOKUP(RC[-4], R9C3:R186C4, 2, 0), 1), RC[-1], NA()) -> #ERR: ArgCount | AJ23: =IF(ISERROR(RC[-1])=1, "", RC[-5]) ->  | AK23: 'Iran, Islamic Rep. | AL23: 'IRN | AM23: -1.25064362417407 | AN23: 0.395254221998157 | AO23: =1.64*RC[-1] -> 0.648216924076978 | AP23: =IF(EQUAL(VLOOKUP(RC[-4], R9C3:R186C4, 2, 0), 1), RC[-1], NA()) -> #ERR: ArgCount | AQ23: =IF(ISERROR(RC[-1])=1, "", RC[-5]) ->  | AR23: 'Libya | AS23: 'LBY | AT23: -1.11335657459486 | AU23: 0.276349686366578 | AV23: =1.64*RC[-1] -> 0.453213485641188 | AW23: =IF(EQUAL(VLOOKUP(RC[-4], R9C3:R186C4, 2, 0), 1), RC[-1], NA()) -> #ERR: ArgCount | AX23: =IF(ISERROR(RC[-1])=1, "", RC[-5]) ->  | AY23: 'Paraguay | AZ23: 'PRY | BA23: -0.958370418014881 | BB23: 0.268423788960137 | BC23: =1.64*RC[-1] -> 0.440215013894625 | BD23: =IF(EQUAL(VLOOKUP(RC[-4], R9C3:R186C4, 2, 0), 1), RC[-1], NA()) -> #ERR: ArgCount | BE23: =IF(ISERROR(RC[-1])=1, "", RC[-5]) -> 
B24: 'Bahrain | C24: 'BHR | D24: =IF(EQUAL(ComparativeCharts!R[+11]C, ""), "", 1) ->  | E24: =IF(EQUAL(ComparativeCharts!R[+11]C, ""), "", 1) -> #EMPTY! | O24: 17 | P24: 'Algeria | Q24: 'DZA | R24: -1.30973174005496 | S24: 0.254026944310672 | T24: =1.64*RC[-1] -> 0.416604188669502 | U24: =IF(EQUAL(VLOOKUP(RC[-4], R9C3:R186C4, 2, 0), 1), RC[-1], NA()) -> #ERR: ArgCount | V24: =IF(ISERROR(RC[-1])=1, "", RC[-5]) ->  | W24: 'Guinea-Bissau | X24: 'GNB | Y24: -1.20291791859717 | Z24: 0.373502182114371 | AA24: =1.64*RC[-1] -> 0.612543578667568 | AB24: =IF(EQUAL(VLOOKUP(RC[-4], R9C3:R186C4, 2, 0), 1), RC[-1], NA()) -> #ERR: ArgCount | AC24: =IF(ISERROR(RC[-1])=1, "", RC[-5]) ->  | AD24: 'Bosnia and Herzegovina | AE24: 'BIH | AF24: -1.10849414571572 | AG24: 0.407477153894001 | AH24: =1.64*RC[-1] -> 0.668262532386162 | AI24: =IF(EQUAL(VLOOKUP(RC[-4], R9C3:R186C4, 2, 0), 1), RC[-1], NA()) -> #ERR: ArgCount | AJ24: =IF(ISERROR(RC[-1])=1, "", RC[-5]) ->  | AK24: 'Liberia | AL24: 'LBR | AM24: -1.24804017161168 | AN24: 0.718213521236258 | AO24: =1.64*RC[-1] -> 1.17787017482746 | AP24: =IF(EQUAL(VLOOKUP(RC[-4], R9C3:R186C4, 2, 0), 1), RC[-1], NA()) -> #ERR: ArgCount | AQ24: =IF(ISERROR(RC[-1])=1, "", RC[-5]) ->  | AR24: 'Bosnia and Herzegovina | AS24: 'BIH | AT24: -1.10844157912402 | AU24: 0.232241722876399 | AV24: =1.64*RC[-1] -> 0.380876425517294 | AW24: =IF(EQUAL(VLOOKUP(RC[-4], R9C3:R186C4, 2, 0), 1), RC[-1], NA()) -> #ERR: ArgCount | AX24: =IF(ISERROR(RC[-1])=1, "", RC[-5]) ->  | AY24: 'Nigeria | AZ24: 'NGA | BA24: -0.953733958695286 | BB24: 0.201802694826556 | BC24: =1.64*RC[-1] -> 0.330956419515552 | BD24: =IF(EQUAL(VLOOKUP(RC[-4], R9C3:R186C4, 2, 0), 1), RC[-1], NA()) -> #ERR: ArgCount | BE24: =IF(ISERROR(RC[-1])=1, "", RC[-5]) -> 
B25: 'Bahamas, The | C25: 'BHS | D25: =IF(EQUAL(ComparativeCharts!R[+11]C, ""), "", 1) ->  | E25: =IF(EQUAL(ComparativeCharts!R[+11]C, ""), "", 1) -> #EMPTY! | O25: 18 | P25: 'China | Q25: 'CHN | R25: -1.29613198605537 | S25: 0.254026944310672 | T25: =1.64*RC[-1] -> 0.416604188669502 | U25: =IF(EQUAL(VLOOKUP(RC[-4], R9C3:R186C4, 2, 0), 1), RC[-1], NA()) -> #ERR: ArgCount | V25: =IF(ISERROR(RC[-1])=1, "", RC[-5]) ->  | W25: 'Libya | X25: 'LBY | Y25: -1.17470782403246 | Z25: 0.299881889042829 | AA25: =1.64*RC[-1] -> 0.49180629803024 | AB25: =IF(EQUAL(VLOOKUP(RC[-4], R9C3:R186C4, 2, 0), 1), RC[-1], NA()) -> #ERR: ArgCount | AC25: =IF(ISERROR(RC[-1])=1, "", RC[-5]) ->  | AD25: 'Paraguay | AE25: 'PRY | AF25: -1.10015500054096 | AG25: 0.328076692774937 | AH25: =1.64*RC[-1] -> 0.538045776150897 | AI25: =IF(EQUAL(VLOOKUP(RC[-4], R9C3:R186C4, 2, 0), 1), RC[-1], NA()) -> #ERR: ArgCount | AJ25: =IF(ISERROR(RC[-1])=1, "", RC[-5]) ->  | AK25: 'Algeria | AL25: 'DZA | AM25: -1.17263839295845 | AN25: 0.395254221998157 | AO25: =1.64*RC[-1] -> 0.648216924076978 | AP25: =IF(EQUAL(VLOOKUP(RC[-4], R9C3:R186C4, 2, 0), 1), RC[-1], NA()) -> #ERR: ArgCount | AQ25: =IF(ISERROR(RC[-1])=1, "", RC[-5]) ->  | AR25: 'Guatemala | AS25: 'GTM | AT25: -1.10567631269014 | AU25: 0.277567107731038 | AV25: =1.64*RC[-1] -> 0.455210056678902 | AW25: =IF(EQUAL(VLOOKUP(RC[-4], R9C3:R186C4, 2, 0), 1), RC[-1], NA()) -> #ERR: ArgCount | AX25: =IF(ISERROR(RC[-1])=1, "", RC[-5]) ->  | AY25: 'Honduras | AZ25: 'HND | BA25: -0.938147011576724 | BB25: 0.248495031055375 | BC25: =1.64*RC[-1] -> 0.407531850930815 | BD25: =IF(EQUAL(VLOOKUP(RC[-4], R9C3:R186C4, 2, 0), 1), RC[-1], NA()) -> #ERR: ArgCount | BE25: =IF(ISERROR(RC[-1])=1, "", RC[-5]) -> 
B26: 'Bosnia and Herzegovina | C26: 'BIH | D26: =IF(EQUAL(ComparativeCharts!R[+11]C, ""), "", 1) ->  | E26: =IF(EQUAL(ComparativeCharts!R[+11]C, ""), "", 1) -> #EMPTY! | O26: 19 | P26: 'Burundi | Q26: 'BDI | R26: -1.28846911665556 | S26: 0.360314615495306 | T26: =1.64*RC[-1] -> 0.590915969412302 | U26: =IF(EQUAL(VLOOKUP(RC[-4], R9C3:R186C4, 2, 0), 1), RC[-1], NA()) -> #ERR: ArgCount | V26: =IF(ISERROR(RC[-1])=1, "", RC[-5]) ->  | W26: 'Bosnia and Herzegovina | X26: 'BIH | Y26: -1.15523888458028 | Z26: 0.385219224774164 | AA26: =1.64*RC[-1] -> 0.631759528629629 | AB26: =IF(EQUAL(VLOOKUP(RC[-4], R9C3:R186C4, 2, 0), 1), RC[-1], NA()) -> #ERR: ArgCount | AC26: =IF(ISERROR(RC[-1])=1, "", RC[-5]) ->  | AD26: 'Algeria | AE26: 'DZA | AF26: -1.08693237577858 | AG26: 0.319089592041234 | AH26: =1.64*RC[-1] -> 0.523306930947624 | AI26: =IF(EQUAL(VLOOKUP(RC[-4], R9C3:R186C4, 2, 0), 1), RC[-1], NA()) -> #ERR: ArgCount | AJ26: =IF(ISERROR(RC[-1])=1, "", RC[-5]) ->  | AK26: 'Rwanda | AL26: 'RWA | AM26: -1.16983806176445 | AN26: 0.601880844424266 | AO26: =1.64*RC[-1] -> 0.987084584855796 | AP26: =IF(EQUAL(VLOOKUP(RC[-4], R9C3:R186C4, 2, 0), 1), RC[-1], NA()) -> #ERR: ArgCount | AQ26: =IF(ISERROR(RC[-1])=1, "", RC[-5]) ->  | AR26: 'Algeria | AS26: 'DZA | AT26: -1.10286088790928 | AU26: 0.276349686366578 | AV26: =1.64*RC[-1] -> 0.453213485641188 | AW26: =IF(EQUAL(VLOOKUP(RC[-4], R9C3:R186C4, 2, 0), 1), RC[-1], NA()) -> #ERR: ArgCount | AX26: =IF(ISERROR(RC[-1])=1, "", RC[-5]) ->  | AY26: 'Tanzania | AZ26: 'TZA | BA26: -0.923867278329055 | BB26: 0.210520528590018 | BC26: =1.64*RC[-1] -> 0.345253666887629 | BD26: =IF(EQUAL(VLOOKUP(RC[-4], R9C3:R186C4, 2, 0), 1), RC[-1], NA()) -> #ERR: ArgCount | BE26: =IF(ISERROR(RC[-1])=1, "", RC[-5]) -> 
B27: 'Belarus | C27: 'BLR | D27: =IF(EQUAL(ComparativeCharts!R[+11]C, ""), "", 1) ->  | E27: =IF(EQUAL(ComparativeCharts!R[+11]C, ""), "", 1) -> #EMPTY! | O27: 20 | P27: 'Bhutan | Q27: 'BTN | R27: -1.25395142759497 | S27: 0.360314615495306 | T27: =1.64*RC[-1] -> 0.590915969412302 | U27: =IF(EQUAL(VLOOKUP(RC[-4], R9C3:R186C4, 2, 0), 1), RC[-1], NA()) -> #ERR: ArgCount | V27: =IF(ISERROR(RC[-1])=1, "", RC[-5]) ->  | W27: 'Kenya | X27: 'KEN | Y27: -1.09768968361389 | Z27: 0.265998113597101 | AA27: =1.64*RC[-1] -> 0.436236906299246 | AB27: =IF(EQUAL(VLOOKUP(RC[-4], R9C3:R186C4, 2, 0), 1), RC[-1], NA()) -> #ERR: ArgCount | AC27: =IF(ISERROR(RC[-1])=1, "", RC[-5]) ->  | AD27: 'Yugoslavia, FR (Serbia/Montenegro) | AE27: 'YUG | AF27: -0.953271094717348 | AG27: 0.286693280149147 | AH27: =1.64*RC[-1] -> 0.470176979444601 | AI27: =IF(EQUAL(VLOOKUP(RC[-4], R9C3:R186C4, 2, 0), 1), RC[-1], NA()) -> #ERR: ArgCount | AJ27: =IF(ISERROR(RC[-1])=1, "", RC[-5]) ->  | AK27: 'Haiti | AL27: 'HTI | AM27: -1.13281948352928 | AN27: 0.519940958319459 | AO27: =1.64*RC[-1] -> 0.852703171643913 | AP27: =IF(EQUAL(VLOOKUP(RC[-4], R9C3:R186C4, 2, 0), 1), RC[-1], NA()) -> #ERR: ArgCount | AQ27: =IF(ISERROR(RC[-1])=1, "", RC[-5]) ->  | AR27: 'Nigeria | AS27: 'NGA | AT27: -1.0974759141194 | AU27: 0.253185404132827 | AV27: =1.64*RC[-1] -> 0.415224062777836 | AW27: =IF(EQUAL(VLOOKUP(RC[-4], R9C3:R186C4, 2, 0), 1), RC[-1], NA()) -> #ERR: ArgCount | AX27: =IF(ISERROR(RC[-1])=1, "", RC[-5]) ->  | AY27: 'Ukraine | AZ27: 'UKR | BA27: -0.891655368076545 | BB27: 0.16744402822474 | BC27: =1.64*RC[-1] -> 0.274608206288574 | BD27: =IF(EQUAL(VLOOKUP(RC[-4], R9C3:R186C4, 2, 0), 1), RC[-1], NA()) -> #ERR: ArgCount | BE27: =IF(ISERROR(RC[-1])=1, "", RC[-5]) -> 
B28: 'Belize | C28: 'BLZ | D28: =IF(EQUAL(ComparativeCharts!R[+11]C, ""), "", 1) ->  | E28: =IF(EQUAL(ComparativeCharts!R[+11]C, ""), "", 1) -> #EMPTY! | O28: 21 | P28: 'Nigeria | Q28: 'NGA | R28: -1.23434445291552 | S28: 0.251300233223489 | T28: =1.64*RC[-1] -> 0.412132382486522 | U28: =IF(EQUAL(VLOOKUP(RC[-4], R9C3:R186C4, 2, 0), 1), RC[-1], NA()) -> #ERR: ArgCount | V28: =IF(ISERROR(RC[-1])=1, "", RC[-5]) ->  | W28: 'Nigeria | X28: 'NGA | Y28: -1.05448616372869 | Z28: 0.265998113597101 | AA28: =1.64*RC[-1] -> 0.436236906299246 | AB28: =IF(EQUAL(VLOOKUP(RC[-4], R9C3:R186C4, 2, 0), 1), RC[-1], NA()) -> #ERR: ArgCount | AC28: =IF(ISERROR(RC[-1])=1, "", RC[-5]) ->  | AD28: 'Liberia | AE28: 'LBR | AF28: -0.921528595341828 | AG28: 0.768168783719135 | AH28: =1.64*RC[-1] -> 1.25979680529938 | AI28: =IF(EQUAL(VLOOKUP(RC[-4], R9C3:R186C4, 2, 0), 1), RC[-1], NA()) -> #ERR: ArgCount | AJ28: =IF(ISERROR(RC[-1])=1, "", RC[-5]) ->  | AK28: 'Myanmar | AL28: 'MMR | AM28: -1.01082662000589 | AN28: 0.395254221998157 | AO28: =1.64*RC[-1] -> 0.648216924076978 | AP28: =IF(EQUAL(VLOOKUP(RC[-4], R9C3:R186C4, 2, 0), 1), RC[-1], NA()) -> #ERR: ArgCount | AQ28: =IF(ISERROR(RC[-1])=1, "", RC[-5]) ->  | AR28: 'Mozambique | AS28: 'MOZ | AT28: -1.04597350633428 | AU28: 0.362749628381543 | AV28: =1.64*RC[-1] -> 0.594909390545731 | AW28: =IF(EQUAL(VLOOKUP(RC[-4], R9C3:R186C4, 2, 0), 1), RC[-1], NA()) -> #ERR: ArgCount | AX28: =IF(ISERROR(RC[-1])=1, "", RC[-5]) ->  | AY28: 'Libya | AZ28: 'LBY | BA28: -0.881804721753313 | BB28: 0.267063170408295 | BC28: =1.64*RC[-1] -> 0.437983599469604 | BD28: =IF(EQUAL(VLOOKUP(RC[-4], R9C3:R186C4, 2, 0), 1), RC[-1], NA()) -> #ERR: ArgCount | BE28: =IF(ISERROR(RC[-1])=1, "", RC[-5]) -> 
B29: 'Bolivia | C29: 'BOL | D29: =IF(EQUAL(ComparativeCharts!R[+11]C, ""), "", 1) ->  | E29: =IF(EQUAL(ComparativeCharts!R[+11]C, ""), "", 1) -> #EMPTY! | O29: 22 | P29: 'Rwanda | Q29: 'RWA | R29: -1.17456074368758 | S29: 0.360314615495306 | T29: =1.64*RC[-1] -> 0.590915969412302 | U29: =IF(EQUAL(VLOOKUP(RC[-4], R9C3:R186C4, 2, 0), 1), RC[-1], NA()) -> #ERR: ArgCount | V29: =IF(ISERROR(RC[-1])=1, "", RC[-5]) ->  | W29: 'Guinea | X29: 'GIN | Y29: -1.03492423678739 | Z29: 0.373502182114371 | AA29: =1.64*RC[-1] -> 0.612543578667568 | AB29: =IF(EQUAL(VLOOKUP(RC[-4], R9C3:R186C4, 2, 0), 1), RC[-1], NA()) -> #ERR: ArgCount | AC29: =IF(ISERROR(RC[-1])=1, "", RC[-5]) ->  | AD29: 'Kenya | AE29: 'KEN | AF29: -0.899427195373505 | AG29: 0.222481788006156 | AH29: =1.64*RC[-1] -> 0.364870132330096 | AI29: =IF(EQUAL(VLOOKUP(RC[-4], R9C3:R186C4, 2, 0), 1), RC[-1], NA()) -> #ERR: ArgCount | AJ29: =IF(ISERROR(RC[-1])=1, "", RC[-5]) ->  | AK29: 'Cape verde | AL29: 'CPV | AM29: -1.00782775214398 | AN29: 0.601880844424266 | AO29: =1.64*RC[-1] -> 0.987084584855796 | AP29: =IF(EQUAL(VLOOKUP(RC[-4], R9C3:R186C4, 2, 0), 1), RC[-1], NA()) -> #ERR: ArgCount | AQ29: =IF(ISERROR(RC[-1])=1, "", RC[-5]) ->  | AR29: 'Cameroon | AS29: 'CMR | AT29: -1.01522358312793 | AU29: 0.253185404132827 | AV29: =1.64*RC[-1] -> 0.415224062777836 | AW29: =IF(EQUAL(VLOOKUP(RC[-4], R9C3:R186C4, 2, 0), 1), RC[-1], NA()) -> #ERR: ArgCount | AX29: =IF(ISERROR(RC[-1])=1, "", RC[-5]) ->  | AY29: 'Algeria | AZ29: 'DZA | BA29: -0.877793620171286 | BB29: 0.267063170408295 | BC29: =1.64*RC[-1] -> 0.437983599469604 | BD29: =IF(EQUAL(VLOOKUP(RC[-4], R9C3:R186C4, 2, 0), 1), RC[-1], NA()) -> #ERR: ArgCount | BE29: =IF(ISERROR(RC[-1])=1, "", RC[-5]) -> 
B30: 'Brazil | C30: 'BRA | D30: =IF(EQUAL(ComparativeCharts!R[+11]C, ""), "", 1) ->  | E30: =IF(EQUAL(ComparativeCharts!R[+11]C, ""), "", 1) -> #EMPTY! | O30: 23 | P30: 'Indonesia | Q30: 'IDN | R30: -1.16546420256521 | S30: 0.254026944310672 | T30: =1.64*RC[-1] -> 0.416604188669502 | U30: =IF(EQUAL(VLOOKUP(RC[-4], R9C3:R186C4, 2, 0), 1), RC[-1], NA()) -> #ERR: ArgCount | V30: =IF(ISERROR(RC[-1])=1, "", RC[-5]) ->  | W30: 'Albania | X30: 'ALB | Y30: -1.00040868778276 | Z30: 0.253989014301079 | AA30: =1.64*RC[-1] -> 0.41654198345377 | AB30: =IF(EQUAL(VLOOKUP(RC[-4], R9C3:R186C4, 2, 0), 1), RC[-1], NA()) -> #ERR: ArgCount | AC30: =IF(ISERROR(RC[-1])=1, "", RC[-5]) ->  | AD30: 'Ukraine | AE30: 'UKR | AF30: -0.892908454140725 | AG30: 0.213306654137658 | AH30: =1.64*RC[-1] -> 0.349822912785759 | AI30: =IF(EQUAL(VLOOKUP(RC[-4], R9C3:R186C4, 2, 0), 1), RC[-1], NA()) -> #ERR: ArgCount | AJ30: =IF(ISERROR(RC[-1])=1, "", RC[-5]) ->  | AK30: 'Azerbaijan | AL30: 'AZE | AM30: -0.99736144864976 | AN30: 0.262826647914669 | AO30: =1.64*RC[-1] -> 0.431035702580057 | AP30: =IF(EQUAL(VLOOKUP(RC[-4], R9C3:R186C4, 2, 0), 1), RC[-1], NA()) -> #ERR: ArgCount | AQ30: =IF(ISERROR(RC[-1])=1, "", RC[-5]) ->  | AR30: 'Yemen, Rep. | AS30: 'YEM | AT30: -1.00816573800337 | AU30: 0.313894625236573 | AV30: =1.64*RC[-1] -> 0.51478718538798 | AW30: =IF(EQUAL(VLOOKUP(RC[-4], R9C3:R186C4, 2, 0), 1), RC[-1], NA()) -> #ERR: ArgCount | AX30: =IF(ISERROR(RC[-1])=1, "", RC[-5]) ->  | AY30: 'Kazakhstan | AZ30: 'KAZ | BA30: -0.868662097911811 | BB30: 0.186062318459078 | BC30: =1.64*RC[-1] -> 0.305142202272888 | BD30: =IF(EQUAL(VLOOKUP(RC[-4], R9C3:R186C4, 2, 0), 1), RC[-1], NA()) -> #ERR: ArgCount | BE30: =IF(ISERROR(RC[-1])=1, "", RC[-5]) -> 
B31: 'Barbados | C31: 'BRB | D31: =IF(EQUAL(ComparativeCharts!R[+11]C, ""), "", 1) ->  | E31: =IF(EQUAL(ComparativeCharts!R[+11]C, ""), "", 1) -> #EMPTY! | O31: 24 | P31: 'Saudi Arabia | Q31: 'SAU | R31: -1.10306250978148 | S31: 0.254026944310672 | T31: =1.64*RC[-1] -> 0.416604188669502 | U31: =IF(EQUAL(VLOOKUP(RC[-4], R9C3:R186C4, 2, 0), 1), RC[-1], NA()) -> #ERR: ArgCount | V31: =IF(ISERROR(RC[-1])=1, "", RC[-5]) ->  | W31: 'Uganda | X31: 'UGA | Y31: -0.980393955329381 | Z31: 0.265998113597101 | AA31: =1.64*RC[-1] -> 0.436236906299246 | AB31: =IF(EQUAL(VLOOKUP(RC[-4], R9C3:R186C4, 2, 0), 1), RC[-1], NA()) -> #ERR: ArgCount | AC31: =IF(ISERROR(RC[-1])=1, "", RC[-5]) ->  | AD31: 'Venezuela, RB | AE31: 'VEN | AF31: -0.849207976650781 | AG31: 0.233636532185851 | AH31: =1.64*RC[-1] -> 0.383163912784796 | AI31: =IF(EQUAL(VLOOKUP(RC[-4], R9C3:R186C4, 2, 0), 1), RC[-1], NA()) -> #ERR: ArgCount | AJ31: =IF(ISERROR(RC[-1])=1, "", RC[-5]) ->  | AK31: 'Congo, Rep. | AL31: 'COG | AM31: -0.991366900545461 | AN31: 0.516616692692467 | AO31: =1.64*RC[-1] -> 0.847251376015646 | AP31: =IF(EQUAL(VLOOKUP(RC[-4], R9C3:R186C4, 2, 0), 1), RC[-1], NA()) -> #ERR: ArgCount | AQ31: =IF(ISERROR(RC[-1])=1, "", RC[-5]) ->  | AR31: 'Turkmenistan | AS31: 'TKM | AT31: -0.971386433629754 | AU31: 0.215738306159556 | AV31: =1.64*RC[-1] -> 0.353810822101672 | AW31: =IF(EQUAL(VLOOKUP(RC[-4], R9C3:R186C4, 2, 0), 1), RC[-1], NA()) -> #ERR: ArgCount | AX31: =IF(ISERROR(RC[-1])=1, "", RC[-5]) ->  | AY31: 'Angola | AZ31: 'AGO | BA31: -0.863030916048755 | BB31: 0.223105684616046 | BC31: =1.64*RC[-1] -> 0.365893322770315 | BD31: =IF(EQUAL(VLOOKUP(RC[-4], R9C3:R186C4, 2, 0), 1), RC[-1], NA()) -> #ERR: ArgCount | BE31: =IF(ISERROR(RC[-1])=1, "", RC[-5]) -> 
B32: 'Brunei | C32: 'BRN | D32: =IF(EQUAL(ComparativeCharts!R[+11]C, ""), "", 1) ->  | E32: =IF(EQUAL(ComparativeCharts!R[+11]C, ""), "", 1) -> #EMPTY! | O32: 25 | P32: 'Togo | Q32: 'TGO | R32: -1.05109111615494 | S32: 0.287283341236829 | T32: =1.64*RC[-1] -> 0.4711446796284 | U32: =IF(EQUAL(VLOOKUP(RC[-4], R9C3:R186C4, 2, 0), 1), RC[-1], NA()) -> #ERR: ArgCount | V32: =IF(ISERROR(RC[-1])=1, "", RC[-5]) ->  | W32: 'Myanmar | X32: 'MMR | Y32: -0.967348724069481 | Z32: 0.299881889042829 | AA32: =1.64*RC[-1] -> 0.49180629803024 | AB32: =IF(EQUAL(VLOOKUP(RC[-4], R9C3:R186C4, 2, 0), 1), RC[-1], NA()) -> #ERR: ArgCount | AC32: =IF(ISERROR(RC[-1])=1, "", RC[-5]) ->  | AD32: 'Azerbaijan | AE32: 'AZE | AF32: -0.833248634828367 | AG32: 0.242598933058622 | AH32: =1.64*RC[-1] -> 0.39786225021614 | AI32: =IF(EQUAL(VLOOKUP(RC[-4], R9C3:R186C4, 2, 0), 1), RC[-1], NA()) -> #ERR: ArgCount | AJ32: =IF(ISERROR(RC[-1])=1, "", RC[-5]) ->  | AK32: 'Syrian Arab Republic | AL32: 'SYR | AM32: -0.91532426663525 | AN32: 0.395254221998157 | AO32: =1.64*RC[-1] -> 0.648216924076978 | AP32: =IF(EQUAL(VLOOKUP(RC[-4], R9C3:R186C4, 2, 0), 1), RC[-1], NA()) -> #ERR: ArgCount | AQ32: =IF(ISERROR(RC[-1])=1, "", RC[-5]) ->  | AR32: 'Bangladesh | AS32: 'BGD | AT32: -0.929443694172601 | AU32: 0.276349686366578 | AV32: =1.64*RC[-1] -> 0.453213485641188 | AW32: =IF(EQUAL(VLOOKUP(RC[-4], R9C3:R186C4, 2, 0), 1), RC[-1], NA()) -> #ERR: ArgCount | AX32: =IF(ISERROR(RC[-1])=1, "", RC[-5]) ->  | AY32: 'Papua New Guinea | AZ32: 'PNG | BA32: -0.853671906541236 | BB32: 0.296106941830424 | BC32: =1.64*RC[-1] -> 0.485615384601895 | BD32: =IF(EQUAL(VLOOKUP(RC[-4], R9C3:R186C4, 2, 0), 1), RC[-1], NA()) -> #ERR: ArgCount | BE32: =IF(ISERROR(RC[-1])=1, "", RC[-5]) -> 
B33: 'Bhutan | C33: 'BTN | D33: =IF(EQUAL(ComparativeCharts!R[+11]C, ""), "", 1) ->  | E33: =IF(EQUAL(ComparativeCharts!R[+11]C, ""), "", 1) -> #EMPTY! | O33: 26 | P33: 'Lao, PDR | Q33: 'LAO | R33: -1.0502970618268 | S33: 0.360314615495306 | T33: =1.64*RC[-1] -> 0.590915969412302 | U33: =IF(EQUAL(VLOOKUP(RC[-4], R9C3:R186C4, 2, 0), 1), RC[-1], NA()) -> #ERR: ArgCount | V33: =IF(ISERROR(RC[-1])=1, "", RC[-5]) ->  | W33: 'Liberia | X33: 'LBR | Y33: -0.952000913666671 | Z33: 0.412522842574475 | AA33: =1.64*RC[-1] -> 0.676537461822139 | AB33: =IF(EQUAL(VLOOKUP(RC[-4], R9C3:R186C4, 2, 0), 1), RC[-1], NA()) -> #ERR: ArgCount | AC33: =IF(ISERROR(RC[-1])=1, "", RC[-5]) ->  | AD33: 'Dominican Republic | AE33: 'DOM | AF33: -0.832540076312625 | AG33: 0.374142364422074 | AH33: =1.64*RC[-1] -> 0.613593477652201 | AI33: =IF(EQUAL(VLOOKUP(RC[-4], R9C3:R186C4, 2, 0), 1), RC[-1], NA()) -> #ERR: ArgCount | AJ33: =IF(ISERROR(RC[-1])=1, "", RC[-5]) ->  | AK33: 'Cuba | AL33: 'CUB | AM33: -0.865575510786019 | AN33: 0.395254221998157 | AO33: =1.64*RC[-1] -> 0.648216924076978 | AP33: =IF(EQUAL(VLOOKUP(RC[-4], R9C3:R186C4, 2, 0), 1), RC[-1], NA()) -> #ERR: ArgCount | AQ33: =IF(ISERROR(RC[-1])=1, "", RC[-5]) ->  | AR33: 'Indonesia | AS33: 'IDN | AT33: -0.918327696429769 | AU33: 0.218139839508948 | AV33: =1.64*RC[-1] -> 0.357749336794675 | AW33: =IF(EQUAL(VLOOKUP(RC[-4], R9C3:R186C4, 2, 0), 1), RC[-1], NA()) -> #ERR: ArgCount | AX33: =IF(ISERROR(RC[-1])=1, "", RC[-5]) ->  | AY33: 'Yemen, Rep. | AZ33: 'YEM | BA33: -0.853671906541236 | BB33: 0.296106941830424 | BC33: =1.64*RC[-1] -> 0.485615384601895 | BD33: =IF(EQUAL(VLOOKUP(RC[-4], R9C3:R186C4, 2, 0), 1), RC[-1], NA()) -> #ERR: ArgCount | BE33: =IF(ISERROR(RC[-1])=1, "", RC[-5]) -> 
B34: 'Botswana | C34: 'BWA | D34: =IF(EQUAL(ComparativeCharts!R[+11]C, ""), "", 1) -> 1 | E34: =IF(EQUAL(ComparativeCharts!R[+11]C, ""), "", 1) -> #EMPTY! | O34: 27 | P34: 'Bahrain | Q34: 'BHR | R34: -1.03706356844374 | S34: 0.254026944310672 | T34: =1.64*RC[-1] -> 0.416604188669502 | U34: =IF(EQUAL(VLOOKUP(RC[-4], R9C3:R186C4, 2, 0), 1), RC[-1], NA()) -> #ERR: ArgCount | V34: =IF(ISERROR(RC[-1])=1, "", RC[-5]) ->  | W34: 'Turkey | X34: 'TUR | Y34: -0.943756823086023 | Z34: 0.25228486761248 | AA34: =1.64*RC[-1] -> 0.413747182884467 | AB34: =IF(EQUAL(VLOOKUP(RC[-4], R9C3:R186C4, 2, 0), 1), RC[-1], NA()) -> #ERR: ArgCount | AC34: =IF(ISERROR(RC[-1])=1, "", RC[-5]) ->  | AD34: 'Kazakhstan | AE34: 'KAZ | AF34: -0.823777991731922 | AG34: 0.228948582631029 | AH34: =1.64*RC[-1] -> 0.375475675514888 | AI34: =IF(EQUAL(VLOOKUP(RC[-4], R9C3:R186C4, 2, 0), 1), RC[-1], NA()) -> #ERR: ArgCount | AJ34: =IF(ISERROR(RC[-1])=1, "", RC[-5]) ->  | AK34: 'Togo | AL34: 'TGO | AM34: -0.852876832111305 | AN34: 0.516616692692467 | AO34: =1.64*RC[-1] -> 0.847251376015646 | AP34: =IF(EQUAL(VLOOKUP(RC[-4], R9C3:R186C4, 2, 0), 1), RC[-1], NA()) -> #ERR: ArgCount | AQ34: =IF(ISERROR(RC[-1])=1, "", RC[-5]) ->  | AR34: 'Albania | AS34: 'ALB | AT34: -0.917770047297968 | AU34: 0.19625062444278 | AV34: =1.64*RC[-1] -> 0.321851024086159 | AW34: =IF(EQUAL(VLOOKUP(RC[-4], R9C3:R186C4, 2, 0), 1), RC[-1], NA()) -> #ERR: ArgCount | AX34: =IF(ISERROR(RC[-1])=1, "", RC[-5]) ->  | AY34: 'Iran, Islamic Rep. | AZ34: 'IRN | BA34: -0.847947608414174 | BB34: 0.260942877169474 | BC34: =1.64*RC[-1] -> 0.427946318557937 | BD34: =IF(EQUAL(VLOOKUP(RC[-4], R9C3:R186C4, 2, 0), 1), RC[-1], NA()) -> #ERR: ArgCount | BE34: =IF(ISERROR(RC[-1])=1, "", RC[-5]) -> 
B35: 'Central African Republic | C35: 'CAF | D35: =IF(EQUAL(ComparativeCharts!R[+11]C, ""), "", 1) ->  | E35: =IF(EQUAL(ComparativeCharts!R[+11]C, ""), "", 1) -> #EMPTY! | O35: 28 | P35: 'Angola | Q35: 'AGO | R35: -1.00342705982695 | S35: 0.254026944310672 | T35: =1.64*RC[-1] -> 0.416604188669502 | U35: =IF(EQUAL(VLOOKUP(RC[-4], R9C3:R186C4, 2, 0), 1), RC[-1], NA()) -> #ERR: ArgCount | V35: =IF(ISERROR(RC[-1])=1, "", RC[-5]) ->  | W35: 'Benin | X35: 'BEN | Y35: -0.937410181602584 | Z35: 0.660536144392275 | AA35: =1.64*RC[-1] -> 1.08327927680333 | AB35: =IF(EQUAL(VLOOKUP(RC[-4], R9C3:R186C4, 2, 0), 1), RC[-1], NA()) -> #ERR: ArgCount | AC35: =IF(ISERROR(RC[-1])=1, "", RC[-5]) ->  | AD35: 'Bulgaria | AE35: 'BGR | AF35: -0.814130875922728 | AG35: 0.242598933058622 | AH35: =1.64*RC[-1] -> 0.39786225021614 | AI35: =IF(EQUAL(VLOOKUP(RC[-4], R9C3:R186C4, 2, 0), 1), RC[-1], NA()) -> #ERR: ArgCount | AJ35: =IF(ISERROR(RC[-1])=1, "", RC[-5]) ->  | AK35: 'Georgia | AL35: 'GEO | AM35: -0.849266999127269 | AN35: 0.271785289504675 | AO35: =1.64*RC[-1] -> 0.445727874787667 | AP35: =IF(EQUAL(VLOOKUP(RC[-4], R9C3:R186C4, 2, 0), 1), RC[-1], NA()) -> #ERR: ArgCount | AQ35: =IF(ISERROR(RC[-1])=1, "", RC[-5]) ->  | AR35: 'Sierra Leone | AS35: 'SLE | AT35: -0.905516222942246 | AU35: 0.443073362506416 | AV35: =1.64*RC[-1] -> 0.726640314510522 | AW35: =IF(EQUAL(VLOOKUP(RC[-4], R9C3:R186C4, 2, 0), 1), RC[-1], NA()) -> #ERR: ArgCount | AX35: =IF(ISERROR(RC[-1])=1, "", RC[-5]) ->  | AY35: 'Guinea | AZ35: 'GIN | BA35: -0.847765828007639 | BB35: 0.484622455710095 | BC35: =1.64*RC[-1] -> 0.794780827364556 | BD35: =IF(EQUAL(VLOOKUP(RC[-4], R9C3:R186C4, 2, 0), 1), RC[-1], NA()) -> #ERR: ArgCount | BE35: =IF(ISERROR(RC[-1])=1, "", RC[-5]) -> 
B36: 'Canada | C36: 'CAN | D36: =IF(EQUAL(ComparativeCharts!R[+11]C, ""), "", 1) ->  | E36: =IF(EQUAL(ComparativeCharts!R[+11]C, ""), "", 1) -> #EMPTY! | O36: 29 | P36: 'Gambia, The | Q36: 'GMB | R36: -0.971389287332041 | S36: 0.291377601755329 | T36: =1.64*RC[-1] -> 0.47785926687874 | U36: =IF(EQUAL(VLOOKUP(RC[-4], R9C3:R186C4, 2, 0), 1), RC[-1], NA()) -> #ERR: ArgCount | V36: =IF(ISERROR(RC[-1])=1, "", RC[-5]) ->  | W36: 'Togo | X36: 'TGO | Y36: -0.905683022048791 | Z36: 0.373502182114371 | AA36: =1.64*RC[-1] -> 0.612543578667568 | AB36: =IF(EQUAL(VLOOKUP(RC[-4], R9C3:R186C4, 2, 0), 1), RC[-1], NA()) -> #ERR: ArgCount | AC36: =IF(ISERROR(RC[-1])=1, "", RC[-5]) ->  | AD36: 'Central African Republic | AE36: 'CAF | AF36: -0.747113913251497 | AG36: 0.506334762729148 | AH36: =1.64*RC[-1] -> 0.830389010875803 | AI36: =IF(EQUAL(VLOOKUP(RC[-4], R9C3:R186C4, 2, 0), 1), RC[-1], NA()) -> #ERR: ArgCount | AJ36: =IF(ISERROR(RC[-1])=1, "", RC[-5]) ->  | AK36: 'Burundi | AL36: 'BDI | AM36: -0.84581743863525 | AN36: 0.601880844424266 | AO36: =1.64*RC[-1] -> 0.987084584855796 | AP36: =IF(EQUAL(VLOOKUP(RC[-4], R9C3:R186C4, 2, 0), 1), RC[-1], NA()) -> #ERR: ArgCount | AQ36: =IF(ISERROR(RC[-1])=1, "", RC[-5]) ->  | AR36: 'Honduras | AS36: 'HND | AT36: -0.895346009982718 | AU36: 0.277567107731038 | AV36: =1.64*RC[-1] -> 0.455210056678902 | AW36: =IF(EQUAL(VLOOKUP(RC[-4], R9C3:R186C4, 2, 0), 1), RC[-1], NA()) -> #ERR: ArgCount | AX36: =IF(ISERROR(RC[-1])=1, "", RC[-5]) ->  | AY36: 'Nicaragua | AZ36: 'NIC | BA36: -0.83610581602139 | BB36: 0.248495031055375 | BC36: =1.64*RC[-1] -> 0.407531850930815 | BD36: =IF(EQUAL(VLOOKUP(RC[-4], R9C3:R186C4, 2, 0), 1), RC[-1], NA()) -> #ERR: ArgCount | BE36: =IF(ISERROR(RC[-1])=1, "", RC[-5]) -> 
B37: 'Switzerland | C37: 'CHE | D37: =IF(EQUAL(ComparativeCharts!R[+11]C, ""), "", 1) ->  | E37: =IF(EQUAL(ComparativeCharts!R[+11]C, ""), "", 1) -> #EMPTY! | O37: 30 | P37: 'Bosnia and Herzegovina | Q37: 'BIH | R37: -0.970906374812819 | S37: 0.360314615495306 | T37: =1.64*RC[-1] -> 0.590915969412302 | U37: =IF(EQUAL(VLOOKUP(RC[-4], R9C3:R186C4, 2, 0), 1), RC[-1], NA()) -> #ERR: ArgCount | V37: =IF(ISERROR(RC[-1])=1, "", RC[-5]) ->  | W37: 'Senegal | X37: 'SEN | Y37: -0.871258175856565 | Z37: 0.319152876161049 | AA37: =1.64*RC[-1] -> 0.52341071690412 | AB37: =IF(EQUAL(VLOOKUP(RC[-4], R9C3:R186C4, 2, 0), 1), RC[-1], NA()) -> #ERR: ArgCount | AC37: =IF(ISERROR(RC[-1])=1, "", RC[-5]) ->  | AD37: 'Pakistan | AE37: 'PAK | AF37: -0.744444477215905 | AG37: 0.259863410851066 | AH37: =1.64*RC[-1] -> 0.426175993795748 | AI37: =IF(EQUAL(VLOOKUP(RC[-4], R9C3:R186C4, 2, 0), 1), RC[-1], NA()) -> #ERR: ArgCount | AJ37: =IF(ISERROR(RC[-1])=1, "", RC[-5]) ->  | AK37: 'Mauritania | AL37: 'MRT | AM37: -0.84581743863525 | AN37: 0.601880844424266 | AO37: =1.64*RC[-1] -> 0.987084584855796 | AP37: =IF(EQUAL(VLOOKUP(RC[-4], R9C3:R186C4, 2, 0), 1), RC[-1], NA()) -> #ERR: ArgCount | AQ37: =IF(ISERROR(RC[-1])=1, "", RC[-5]) ->  | AR37: 'Burundi | AS37: 'BDI | AT37: -0.880736581715861 | AU37: 0.600583865212543 | AV37: =1.64*RC[-1] -> 0.984957538948571 | AW37: =IF(EQUAL(VLOOKUP(RC[-4], R9C3:R186C4, 2, 0), 1), RC[-1], NA()) -> #ERR: ArgCount | AX37: =IF(ISERROR(RC[-1])=1, "", RC[-5]) ->  | AY37: 'Guatemala | AZ37: 'GTM | BA37: -0.81944615326047 | BB37: 0.248495031055375 | BC37: =1.64*RC[-1] -> 0.407531850930815 | BD37: =IF(EQUAL(VLOOKUP(RC[-4], R9C3:R186C4, 2, 0), 1), RC[-1], NA()) -> #ERR: ArgCount | BE37: =IF(ISERROR(RC[-1])=1, "", RC[-5]) -> 
B38: 'Chile | C38: 'CHL | D38: =IF(EQUAL(ComparativeCharts!R[+11]C, ""), "", 1) -> 1 | E38: =IF(EQUAL(ComparativeCharts!R[+11]C, ""), "", 1) -> #EMPTY! | O38: 31 | P38: 'Mauritania | Q38: 'MRT | R38: -0.970906374812819 | S38: 0.360314615495306 | T38: =1.64*RC[-1] -> 0.590915969412302 | U38: =IF(EQUAL(VLOOKUP(RC[-4], R9C3:R186C4, 2, 0), 1), RC[-1], NA()) -> #ERR: ArgCount | V38: =IF(ISERROR(RC[-1])=1, "", RC[-5]) ->  | W38: 'Lesotho | X38: 'LSO | Y38: -0.820037614892367 | Z38: 0.606177135766502 | AA38: =1.64*RC[-1] -> 0.994130502657063 | AB38: =IF(EQUAL(VLOOKUP(RC[-4], R9C3:R186C4, 2, 0), 1), RC[-1], NA()) -> #ERR: ArgCount | AC38: =IF(ISERROR(RC[-1])=1, "", RC[-5]) ->  | AD38: 'Chad | AE38: 'TCD | AF38: -0.71436849482699 | AG38: 0.563707566872499 | AH38: =1.64*RC[-1] -> 0.924480409670898 | AI38: =IF(EQUAL(VLOOKUP(RC[-4], R9C3:R186C4, 2, 0), 1), RC[-1], NA()) -> #ERR: ArgCount | AJ38: =IF(ISERROR(RC[-1])=1, "", RC[-5]) ->  | AK38: 'Sudan | AL38: 'SDN | AM38: -0.827912363895414 | AN38: 0.519940958319459 | AO38: =1.64*RC[-1] -> 0.852703171643913 | AP38: =IF(EQUAL(VLOOKUP(RC[-4], R9C3:R186C4, 2, 0), 1), RC[-1], NA()) -> #ERR: ArgCount | AQ38: =IF(ISERROR(RC[-1])=1, "", RC[-5]) ->  | AR38: 'Belarus | AS38: 'BLR | AT38: -0.876137541021011 | AU38: 0.19625062444278 | AV38: =1.64*RC[-1] -> 0.321851024086159 | AW38: =IF(EQUAL(VLOOKUP(RC[-4], R9C3:R186C4, 2, 0), 1), RC[-1], NA()) -> #ERR: ArgCount | AX38: =IF(ISERROR(RC[-1])=1, "", RC[-5]) ->  | AY38: 'Ecuador | AZ38: 'ECU | BA38: -0.819200818801926 | BB38: 0.241402378832618 | BC38: =1.64*RC[-1] -> 0.395899901285494 | BD38: =IF(EQUAL(VLOOKUP(RC[-4], R9C3:R186C4, 2, 0), 1), RC[-1], NA()) -> #ERR: ArgCount | BE38: =IF(ISERROR(RC[-1])=1, "", RC[-5]) -> 
B39: 'China | C39: 'CHN | D39: =IF(EQUAL(ComparativeCharts!R[+11]C, ""), "", 1) ->  | E39: =IF(EQUAL(ComparativeCharts!R[+11]C, ""), "", 1) -> #EMPTY! | O39: 32 | P39: 'Yugoslavia, FR (Serbia/Montenegro) | Q39: 'YUG | R39: -0.919759959948295 | S39: 0.254026944310672 | T39: =1.64*RC[-1] -> 0.416604188669502 | U39: =IF(EQUAL(VLOOKUP(RC[-4], R9C3:R186C4, 2, 0), 1), RC[-1], NA()) -> #ERR: ArgCount | V39: =IF(ISERROR(RC[-1])=1, "", RC[-5]) ->  | W39: 'Madagascar | X39: 'MDG | Y39: -0.785915939048472 | Z39: 0.373502182114371 | AA39: =1.64*RC[-1] -> 0.612543578667568 | AB39: =IF(EQUAL(VLOOKUP(RC[-4], R9C3:R186C4, 2, 0), 1), RC[-1], NA()) -> #ERR: ArgCount | AC39: =IF(ISERROR(RC[-1])=1, "", RC[-5]) ->  | AD39: 'Papua New Guinea | AE39: 'PNG | AF39: -0.694273918478437 | AG39: 0.374142364422074 | AH39: =1.64*RC[-1] -> 0.613593477652201 | AI39: =IF(EQUAL(VLOOKUP(RC[-4], R9C3:R186C4, 2, 0), 1), RC[-1], NA()) -> #ERR: ArgCount | AJ39: =IF(ISERROR(RC[-1])=1, "", RC[-5]) ->  | AK39: 'Kyrgyz Republic | AL39: 'KGZ | AM39: -0.75821284237392 | AN39: 0.271785289504675 | AO39: =1.64*RC[-1] -> 0.445727874787667 | AP39: =IF(EQUAL(VLOOKUP(RC[-4], R9C3:R186C4, 2, 0), 1), RC[-1], NA()) -> #ERR: ArgCount | AQ39: =IF(ISERROR(RC[-1])=1, "", RC[-5]) ->  | AR39: 'Uzbekistan | AS39: 'UZB | AT39: -0.869599725276197 | AU39: 0.186669181543715 | AV39: =1.64*RC[-1] -> 0.306137457731693 | AW39: =IF(EQUAL(VLOOKUP(RC[-4], R9C3:R186C4, 2, 0), 1), RC[-1], NA()) -> #ERR: ArgCount | AX39: =IF(ISERROR(RC[-1])=1, "", RC[-5]) ->  | AY39: 'Armenia | AZ39: 'ARM | BA39: -0.803188257541498 | BB39: 0.231874540556914 | BC39: =1.64*RC[-1] -> 0.380274246513339 | BD39: =IF(EQUAL(VLOOKUP(RC[-4], R9C3:R186C4, 2, 0), 1), RC[-1], NA()) -> #ERR: ArgCount | BE39: =IF(ISERROR(RC[-1])=1, "", RC[-5]) -> 
B40: 'Cote d'Ivoire | C40: 'CIV | D40: =IF(EQUAL(ComparativeCharts!R[+11]C, ""), "", 1) ->  | E40: =IF(EQUAL(ComparativeCharts!R[+11]C, ""), "", 1) -> #EMPTY! | O40: 33 | P40: 'Brunei | Q40: 'BRN | R40: -0.919471266141518 | S40: 0.291377601755329 | T40: =1.64*RC[-1] -> 0.47785926687874 | U40: =IF(EQUAL(VLOOKUP(RC[-4], R9C3:R186C4, 2, 0), 1), RC[-1], NA()) -> #ERR: ArgCount | V40: =IF(ISERROR(RC[-1])=1, "", RC[-5]) ->  | W40: 'Niger | X40: 'NER | Y40: -0.762838285189527 | Z40: 0.412522842574475 | AA40: =1.64*RC[-1] -> 0.676537461822139 | AB40: =IF(EQUAL(VLOOKUP(RC[-4], R9C3:R186C4, 2, 0), 1), RC[-1], NA()) -> #ERR: ArgCount | AC40: =IF(ISERROR(RC[-1])=1, "", RC[-5]) ->  | AD40: 'Belarus | AE40: 'BLR | AF40: -0.658924157924659 | AG40: 0.294346198002602 | AH40: =1.64*RC[-1] -> 0.482727764724267 | AI40: =IF(EQUAL(VLOOKUP(RC[-4], R9C3:R186C4, 2, 0), 1), RC[-1], NA()) -> #ERR: ArgCount | AJ40: =IF(ISERROR(RC[-1])=1, "", RC[-5]) ->  | AK40: 'Chad | AL40: 'TCD | AM40: -0.739582848517709 | AN40: 0.596740942900482 | AO40: =1.64*RC[-1] -> 0.97865514635679 | AP40: =IF(EQUAL(VLOOKUP(RC[-4], R9C3:R186C4, 2, 0), 1), RC[-1], NA()) -> #ERR: ArgCount | AQ40: =IF(ISERROR(RC[-1])=1, "", RC[-5]) ->  | AR40: 'Myanmar | AS40: 'MMR | AT40: -0.838802383628963 | AU40: 0.276349686366578 | AV40: =1.64*RC[-1] -> 0.453213485641188 | AW40: =IF(EQUAL(VLOOKUP(RC[-4], R9C3:R186C4, 2, 0), 1), RC[-1], NA()) -> #ERR: ArgCount | AX40: =IF(ISERROR(RC[-1])=1, "", RC[-5]) ->  | AY40: 'Indonesia | AZ40: 'IDN | BA40: -0.798850677507631 | BB40: 0.163839744115479 | BC40: =1.64*RC[-1] -> 0.268697180349386 | BD40: =IF(EQUAL(VLOOKUP(RC[-4], R9C3:R186C4, 2, 0), 1), RC[-1], NA()) -> #ERR: ArgCount | BE40: =IF(ISERROR(RC[-1])=1, "", RC[-5]) -> 
B41: 'Cameroon | C41: 'CMR | D41: =IF(EQUAL(ComparativeCharts!R[+11]C, ""), "", 1) ->  | E41: =IF(EQUAL(ComparativeCharts!R[+11]C, ""), "", 1) -> #EMPTY! | O41: 34 | P41: 'Azerbaijan | Q41: 'AZE | R41: -0.919164065846706 | S41: 0.251300233223489 | T41: =1.64*RC[-1] -> 0.412132382486522 | U41: =IF(EQUAL(VLOOKUP(RC[-4], R9C3:R186C4, 2, 0), 1), RC[-1], NA()) -> #ERR: ArgCount | V41: =IF(ISERROR(RC[-1])=1, "", RC[-5]) ->  | W41: 'Georgia | X41: 'GEO | Y41: -0.760877400890295 | Z41: 0.306784965294112 | AA41: =1.64*RC[-1] -> 0.503127343082344 | AB41: =IF(EQUAL(VLOOKUP(RC[-4], R9C3:R186C4, 2, 0), 1), RC[-1], NA()) -> #ERR: ArgCount | AC41: =IF(ISERROR(RC[-1])=1, "", RC[-5]) ->  | AD41: 'Armenia | AE41: 'ARM | AF41: -0.65466184670494 | AG41: 0.294346198002602 | AH41: =1.64*RC[-1] -> 0.482727764724267 | AI41: =IF(EQUAL(VLOOKUP(RC[-4], R9C3:R186C4, 2, 0), 1), RC[-1], NA()) -> #ERR: ArgCount | AJ41: =IF(ISERROR(RC[-1])=1, "", RC[-5]) ->  | AK41: 'Ukraine | AL41: 'UKR | AM41: -0.720829281079128 | AN41: 0.216459376181894 | AO41: =1.64*RC[-1] -> 0.354993376938306 | AP41: =IF(EQUAL(VLOOKUP(RC[-4], R9C3:R186C4, 2, 0), 1), RC[-1], NA()) -> #ERR: ArgCount | AQ41: =IF(ISERROR(RC[-1])=1, "", RC[-5]) ->  | AR41: 'Chad | AS41: 'TCD | AT41: -0.826920298704951 | AU41: 0.450388515286507 | AV41: =1.64*RC[-1] -> 0.738637165069871 | AW41: =IF(EQUAL(VLOOKUP(RC[-4], R9C3:R186C4, 2, 0), 1), RC[-1], NA()) -> #ERR: ArgCount | AX41: =IF(ISERROR(RC[-1])=1, "", RC[-5]) ->  | AY41: 'Syrian Arab Republic | AZ41: 'SYR | BA41: -0.788757947034985 | BB41: 0.267063170408295 | BC41: =1.64*RC[-1] -> 0.437983599469604 | BD41: =IF(EQUAL(VLOOKUP(RC[-4], R9C3:R186C4, 2, 0), 1), RC[-1], NA()) -> #ERR: ArgCount | BE41: =IF(ISERROR(RC[-1])=1, "", RC[-5]) -> 
B42: 'Congo, Rep. | C42: 'COG | D42: =IF(EQUAL(ComparativeCharts!R[+11]C, ""), "", 1) ->  | E42: =IF(EQUAL(ComparativeCharts!R[+11]C, ""), "", 1) -> #EMPTY! | O42: 35 | P42: 'Cambodia | Q42: 'KHM | R42: -0.90877453388243 | S42: 0.360314615495306 | T42: =1.64*RC[-1] -> 0.590915969412302 | U42: =IF(EQUAL(VLOOKUP(RC[-4], R9C3:R186C4, 2, 0), 1), RC[-1], NA()) -> #ERR: ArgCount | V42: =IF(ISERROR(RC[-1])=1, "", RC[-5]) ->  | W42: 'Guatemala | X42: 'GTM | Y42: -0.750933661622346 | Z42: 0.318733333730906 | AA42: =1.64*RC[-1] -> 0.522722667318686 | AB42: =IF(EQUAL(VLOOKUP(RC[-4], R9C3:R186C4, 2, 0), 1), RC[-1], NA()) -> #ERR: ArgCount | AC42: =IF(ISERROR(RC[-1])=1, "", RC[-5]) ->  | AD42: 'Albania | AE42: 'ALB | AF42: -0.653372603337536 | AG42: 0.294346198002602 | AH42: =1.64*RC[-1] -> 0.482727764724267 | AI42: =IF(EQUAL(VLOOKUP(RC[-4], R9C3:R186C4, 2, 0), 1), RC[-1], NA()) -> #ERR: ArgCount | AJ42: =IF(ISERROR(RC[-1])=1, "", RC[-5]) ->  | AK42: 'Angola | AL42: 'AGO | AM42: -0.709575461221557 | AN42: 0.291778685386365 | AO42: =1.64*RC[-1] -> 0.478517044033639 | AP42: =IF(EQUAL(VLOOKUP(RC[-4], R9C3:R186C4, 2, 0), 1), RC[-1], NA()) -> #ERR: ArgCount | AQ42: =IF(ISERROR(RC[-1])=1, "", RC[-5]) ->  | AR42: 'Madagascar | AS42: 'MDG | AT42: -0.824655342249677 | AU42: 0.371358506695114 | AV42: =1.64*RC[-1] -> 0.609027950979987 | AW42: =IF(EQUAL(VLOOKUP(RC[-4], R9C3:R186C4, 2, 0), 1), RC[-1], NA()) -> #ERR: ArgCount | AX42: =IF(ISERROR(RC[-1])=1, "", RC[-5]) ->  | AY42: 'Benin | AZ42: 'BEN | BA42: -0.780814769585941 | BB42: 0.536534704411876 | BC42: =1.64*RC[-1] -> 0.879916915235477 | BD42: =IF(EQUAL(VLOOKUP(RC[-4], R9C3:R186C4, 2, 0), 1), RC[-1], NA()) -> #ERR: ArgCount | BE42: =IF(ISERROR(RC[-1])=1, "", RC[-5]) -> 
B43: 'Colombia | C43: 'COL | D43: =IF(EQUAL(ComparativeCharts!R[+11]C, ""), "", 1) ->  | E43: =IF(EQUAL(ComparativeCharts!R[+11]C, ""), "", 1) -> #EMPTY! | O43: 36 | P43: 'Maldives | Q43: 'MDV | R43: -0.90877453388243 | S43: 0.360314615495306 | T43: =1.64*RC[-1] -> 0.590915969412302 | U43: =IF(EQUAL(VLOOKUP(RC[-4], R9C3:R186C4, 2, 0), 1), RC[-1], NA()) -> #ERR: ArgCount | V43: =IF(ISERROR(RC[-1])=1, "", RC[-5]) ->  | W43: 'Chad | X43: 'TCD | Y43: -0.735985741633003 | Z43: 0.660536144392275 | AA43: =1.64*RC[-1] -> 1.08327927680333 | AB43: =IF(EQUAL(VLOOKUP(RC[-4], R9C3:R186C4, 2, 0), 1), RC[-1], NA()) -> #ERR: ArgCount | AC43: =IF(ISERROR(RC[-1])=1, "", RC[-5]) ->  | AD43: 'Cameroon | AE43: 'CMR | AF43: -0.644720261257849 | AG43: 0.240407962423765 | AH43: =1.64*RC[-1] -> 0.394269058374975 | AI43: =IF(EQUAL(VLOOKUP(RC[-4], R9C3:R186C4, 2, 0), 1), RC[-1], NA()) -> #ERR: ArgCount | AJ43: =IF(ISERROR(RC[-1])=1, "", RC[-5]) ->  | AK43: 'Albania | AL43: 'ALB | AM43: -0.69955471858829 | AN43: 0.262826647914669 | AO43: =1.64*RC[-1] -> 0.431035702580057 | AP43: =IF(EQUAL(VLOOKUP(RC[-4], R9C3:R186C4, 2, 0), 1), RC[-1], NA()) -> #ERR: ArgCount | AQ43: =IF(ISERROR(RC[-1])=1, "", RC[-5]) ->  | AR43: 'Yugoslavia, FR (Serbia/Montenegro) | AS43: 'YUG | AT43: -0.806487256288169 | AU43: 0.203510854019427 | AV43: =1.64*RC[-1] -> 0.33375780059186 | AW43: =IF(EQUAL(VLOOKUP(RC[-4], R9C3:R186C4, 2, 0), 1), RC[-1], NA()) -> #ERR: ArgCount | AX43: =IF(ISERROR(RC[-1])=1, "", RC[-5]) ->  | AY43: 'Dominican Republic | AZ43: 'DOM | BA43: -0.772948030492883 | BB43: 0.296106941830424 | BC43: =1.64*RC[-1] -> 0.485615384601895 | BD43: =IF(EQUAL(VLOOKUP(RC[-4], R9C3:R186C4, 2, 0), 1), RC[-1], NA()) -> #ERR: ArgCount | BE43: =IF(ISERROR(RC[-1])=1, "", RC[-5]) -> 
B44: 'Comoros | C44: 'COM | D44: =IF(EQUAL(ComparativeCharts!R[+11]C, ""), "", 1) ->  | E44: =IF(EQUAL(ComparativeCharts!R[+11]C, ""), "", 1) -> #EMPTY! | O44: 37 | P44: 'Liberia | Q44: 'LBR | R44: -0.888397186862469 | S44: 0.291377601755329 | T44: =1.64*RC[-1] -> 0.47785926687874 | U44: =IF(EQUAL(VLOOKUP(RC[-4], R9C3:R186C4, 2, 0), 1), RC[-1], NA()) -> #ERR: ArgCount | V44: =IF(ISERROR(RC[-1])=1, "", RC[-5]) ->  | W44: 'Cameroon | X44: 'CMR | Y44: -0.724475314801389 | Z44: 0.265998113597101 | AA44: =1.64*RC[-1] -> 0.436236906299246 | AB44: =IF(EQUAL(VLOOKUP(RC[-4], R9C3:R186C4, 2, 0), 1), RC[-1], NA()) -> #ERR: ArgCount | AC44: =IF(ISERROR(RC[-1])=1, "", RC[-5]) ->  | AD44: 'Malawi | AE44: 'MWI | AF44: -0.624839919214108 | AG44: 0.238874499151057 | AH44: =1.64*RC[-1] -> 0.391754178607733 | AI44: =IF(EQUAL(VLOOKUP(RC[-4], R9C3:R186C4, 2, 0), 1), RC[-1], NA()) -> #ERR: ArgCount | AJ44: =IF(ISERROR(RC[-1])=1, "", RC[-5]) ->  | AK44: 'Suriname | AL44: 'SUR | AM44: -0.586110485499659 | AN44: 0.519940958319459 | AO44: =1.64*RC[-1] -> 0.852703171643913 | AP44: =IF(EQUAL(VLOOKUP(RC[-4], R9C3:R186C4, 2, 0), 1), RC[-1], NA()) -> #ERR: ArgCount | AQ44: =IF(ISERROR(RC[-1])=1, "", RC[-5]) ->  | AR44: 'Togo | AS44: 'TGO | AT44: -0.799385165309277 | AU44: 0.371358506695114 | AV44: =1.64*RC[-1] -> 0.609027950979987 | AW44: =IF(EQUAL(VLOOKUP(RC[-4], R9C3:R186C4, 2, 0), 1), RC[-1], NA()) -> #ERR: ArgCount | AX44: =IF(ISERROR(RC[-1])=1, "", RC[-5]) ->  | AY44: 'Pakistan | AZ44: 'PAK | BA44: -0.768792829664602 | BB44: 0.215831312683427 | BC44: =1.64*RC[-1] -> 0.35396335280082 | BD44: =IF(EQUAL(VLOOKUP(RC[-4], R9C3:R186C4, 2, 0), 1), RC[-1], NA()) -> #ERR: ArgCount | BE44: =IF(ISERROR(RC[-1])=1, "", RC[-5]) -> 
B45: 'Cape verde | C45: 'CPV | D45: =IF(EQUAL(ComparativeCharts!R[+11]C, ""), "", 1) ->  | E45: =IF(EQUAL(ComparativeCharts!R[+11]C, ""), "", 1) -> #EMPTY! | O45: 38 | P45: 'Guinea | Q45: 'GIN | R45: -0.872918282815149 | S45: 0.287283341236829 | T45: =1.64*RC[-1] -> 0.4711446796284 | U45: =IF(EQUAL(VLOOKUP(RC[-4], R9C3:R186C4, 2, 0), 1), RC[-1], NA()) -> #ERR: ArgCount | V45: =IF(ISERROR(RC[-1])=1, "", RC[-5]) ->  | W45: 'Russian Federation | X45: 'RUS | Y45: -0.685958851594691 | Z45: 0.215915139092969 | AA45: =1.64*RC[-1] -> 0.354100828112469 | AB45: =IF(EQUAL(VLOOKUP(RC[-4], R9C3:R186C4, 2, 0), 1), RC[-1], NA()) -> #ERR: ArgCount | AC45: =IF(ISERROR(RC[-1])=1, "", RC[-5]) ->  | AD45: 'Yemen, Rep. | AE45: 'YEM | AF45: -0.620720692562856 | AG45: 0.374142364422074 | AH45: =1.64*RC[-1] -> 0.613593477652201 | AI45: =IF(EQUAL(VLOOKUP(RC[-4], R9C3:R186C4, 2, 0), 1), RC[-1], NA()) -> #ERR: ArgCount | AJ45: =IF(ISERROR(RC[-1])=1, "", RC[-5]) ->  | AK45: 'Armenia | AL45: 'ARM | AM45: -0.570317547770276 | AN45: 0.262826647914669 | AO45: =1.64*RC[-1] -> 0.431035702580057 | AP45: =IF(EQUAL(VLOOKUP(RC[-4], R9C3:R186C4, 2, 0), 1), RC[-1], NA()) -> #ERR: ArgCount | AQ45: =IF(ISERROR(RC[-1])=1, "", RC[-5]) ->  | AR45: 'Colombia | AS45: 'COL | AT45: -0.783256206848786 | AU45: 0.207737275615815 | AV45: =1.64*RC[-1] -> 0.340689132009937 | AW45: =IF(EQUAL(VLOOKUP(RC[-4], R9C3:R186C4, 2, 0), 1), RC[-1], NA()) -> #ERR: ArgCount | AX45: =IF(ISERROR(RC[-1])=1, "", RC[-5]) ->  | AY45: 'Kyrgyz Republic | AZ45: 'KGZ | BA45: -0.763433056850542 | BB45: 0.236922232900357 | BC45: =1.64*RC[-1] -> 0.388552461956585 | BD45: =IF(EQUAL(VLOOKUP(RC[-4], R9C3:R186C4, 2, 0), 1), RC[-1], NA()) -> #ERR: ArgCount | BE45: =IF(ISERROR(RC[-1])=1, "", RC[-5]) -> 
B46: 'Costa Rica | C46: 'CRI | D46: =IF(EQUAL(ComparativeCharts!R[+11]C, ""), "", 1) ->  | E46: =IF(EQUAL(ComparativeCharts!R[+11]C, ""), "", 1) -> #EMPTY! | O46: 39 | P46: 'Turkey | Q46: 'TUR | R46: -0.859278164874458 | S46: 0.251300233223489 | T46: =1.64*RC[-1] -> 0.412132382486522 | U46: =IF(EQUAL(VLOOKUP(RC[-4], R9C3:R186C4, 2, 0), 1), RC[-1], NA()) -> #ERR: ArgCount | V46: =IF(ISERROR(RC[-1])=1, "", RC[-5]) ->  | W46: 'Pakistan | X46: 'PAK | Y46: -0.654103845117085 | Z46: 0.263344534520094 | AA46: =1.64*RC[-1] -> 0.431885036612954 | AB46: =IF(EQUAL(VLOOKUP(RC[-4], R9C3:R186C4, 2, 0), 1), RC[-1], NA()) -> #ERR: ArgCount | AC46: =IF(ISERROR(RC[-1])=1, "", RC[-5]) ->  | AD46: 'Sri Lanka | AE46: 'LKA | AF46: -0.61167805037031 | AG46: 0.319089592041234 | AH46: =1.64*RC[-1] -> 0.523306930947624 | AI46: =IF(EQUAL(VLOOKUP(RC[-4], R9C3:R186C4, 2, 0), 1), RC[-1], NA()) -> #ERR: ArgCount | AJ46: =IF(ISERROR(RC[-1])=1, "", RC[-5]) ->  | AK46: 'Niger | AL46: 'NER | AM46: -0.523005244261551 | AN46: 0.519940958319459 | AO46: =1.64*RC[-1] -> 0.852703171643913 | AP46: =IF(EQUAL(VLOOKUP(RC[-4], R9C3:R186C4, 2, 0), 1), RC[-1], NA()) -> #ERR: ArgCount | AQ46: =IF(ISERROR(RC[-1])=1, "", RC[-5]) ->  | AR46: 'Guinea | AS46: 'GIN | AT46: -0.761680847552104 | AU46: 0.371358506695114 | AV46: =1.64*RC[-1] -> 0.609027950979987 | AW46: =IF(EQUAL(VLOOKUP(RC[-4], R9C3:R186C4, 2, 0), 1), RC[-1], NA()) -> #ERR: ArgCount | AX46: =IF(ISERROR(RC[-1])=1, "", RC[-5]) ->  | AY46: 'Georgia | AZ46: 'GEO | BA46: -0.74365486241976 | BB46: 0.236922232900357 | BC46: =1.64*RC[-1] -> 0.388552461956585 | BD46: =IF(EQUAL(VLOOKUP(RC[-4], R9C3:R186C4, 2, 0), 1), RC[-1], NA()) -> #ERR: ArgCount | BE46: =IF(ISERROR(RC[-1])=1, "", RC[-5]) -> 
B47: 'Cuba | C47: 'CUB | D47: =IF(EQUAL(ComparativeCharts!R[+11]C, ""), "", 1) ->  | E47: =IF(EQUAL(ComparativeCharts!R[+11]C, ""), "", 1) -> #EMPTY! | O47: 40 | P47: 'Chad | Q47: 'TCD | R47: -0.853690984863516 | S47: 0.352657522321209 | T47: =1.64*RC[-1] -> 0.578358336606783 | U47: =IF(EQUAL(VLOOKUP(RC[-4], R9C3:R186C4, 2, 0), 1), RC[-1], NA()) -> #ERR: ArgCount | V47: =IF(ISERROR(RC[-1])=1, "", RC[-5]) ->  | W47: 'Paraguay | X47: 'PRY | Y47: -0.570930277426562 | Z47: 0.319152876161049 | AA47: =1.64*RC[-1] -> 0.52341071690412 | AB47: =IF(EQUAL(VLOOKUP(RC[-4], R9C3:R186C4, 2, 0), 1), RC[-1], NA()) -> #ERR: ArgCount | AC47: =IF(ISERROR(RC[-1])=1, "", RC[-5]) ->  | AD47: 'Russian Federation | AE47: 'RUS | AF47: -0.594515262297797 | AG47: 0.206979294668072 | AH47: =1.64*RC[-1] -> 0.339446043255638 | AI47: =IF(EQUAL(VLOOKUP(RC[-4], R9C3:R186C4, 2, 0), 1), RC[-1], NA()) -> #ERR: ArgCount | AJ47: =IF(ISERROR(RC[-1])=1, "", RC[-5]) ->  | AK47: 'Yemen, Rep. | AL47: 'YEM | AM47: -0.523005244261551 | AN47: 0.519940958319459 | AO47: =1.64*RC[-1] -> 0.852703171643913 | AP47: =IF(EQUAL(VLOOKUP(RC[-4], R9C3:R186C4, 2, 0), 1), RC[-1], NA()) -> #ERR: ArgCount | AQ47: =IF(ISERROR(RC[-1])=1, "", RC[-5]) ->  | AR47: 'Pakistan | AS47: 'PAK | AT47: -0.760364737093301 | AU47: 0.235420626980005 | AV47: =1.64*RC[-1] -> 0.386089828247208 | AW47: =IF(EQUAL(VLOOKUP(RC[-4], R9C3:R186C4, 2, 0), 1), RC[-1], NA()) -> #ERR: ArgCount | AX47: =IF(ISERROR(RC[-1])=1, "", RC[-5]) ->  | AY47: 'Venezuela, RB | AZ47: 'VEN | BA47: -0.724885762501634 | BB47: 0.196208208436663 | BC47: =1.64*RC[-1] -> 0.321781461836127 | BD47: =IF(EQUAL(VLOOKUP(RC[-4], R9C3:R186C4, 2, 0), 1), RC[-1], NA()) -> #ERR: ArgCount | BE47: =IF(ISERROR(RC[-1])=1, "", RC[-5]) -> 
B48: 'Cyprus | C48: 'CYP | D48: =IF(EQUAL(ComparativeCharts!R[+11]C, ""), "", 1) ->  | E48: =IF(EQUAL(ComparativeCharts!R[+11]C, ""), "", 1) -> #EMPTY! | O48: 41 | P48: 'Swaziland | Q48: 'SWZ | R48: -0.777607314830853 | S48: 0.360314615495306 | T48: =1.64*RC[-1] -> 0.590915969412302 | U48: =IF(EQUAL(VLOOKUP(RC[-4], R9C3:R186C4, 2, 0), 1), RC[-1], NA()) -> #ERR: ArgCount | V48: =IF(ISERROR(RC[-1])=1, "", RC[-5]) ->  | W48: 'Gabon | X48: 'GAB | Y48: -0.561334828427524 | Z48: 0.342482293230127 | AA48: =1.64*RC[-1] -> 0.561670960897408 | AB48: =IF(EQUAL(VLOOKUP(RC[-4], R9C3:R186C4, 2, 0), 1), RC[-1], NA()) -> #ERR: ArgCount | AC48: =IF(ISERROR(RC[-1])=1, "", RC[-5]) ->  | AD48: 'Congo, Rep. | AE48: 'COG | AF48: -0.580499813883824 | AG48: 0.385123284441522 | AH48: =1.64*RC[-1] -> 0.631602186484096 | AI48: =IF(EQUAL(VLOOKUP(RC[-4], R9C3:R186C4, 2, 0), 1), RC[-1], NA()) -> #ERR: ArgCount | AJ48: =IF(ISERROR(RC[-1])=1, "", RC[-5]) ->  | AK48: 'Djibouti | AL48: 'DJI | AM48: -0.521796815506047 | AN48: 0.601880844424266 | AO48: =1.64*RC[-1] -> 0.987084584855796 | AP48: =IF(EQUAL(VLOOKUP(RC[-4], R9C3:R186C4, 2, 0), 1), RC[-1], NA()) -> #ERR: ArgCount | AQ48: =IF(ISERROR(RC[-1])=1, "", RC[-5]) ->  | AR48: 'Suriname | AS48: 'SUR | AT48: -0.729775132668132 | AU48: 0.443073362506416 | AV48: =1.64*RC[-1] -> 0.726640314510522 | AW48: =IF(EQUAL(VLOOKUP(RC[-4], R9C3:R186C4, 2, 0), 1), RC[-1], NA()) -> #ERR: ArgCount | AX48: =IF(ISERROR(RC[-1])=1, "", RC[-5]) ->  | AY48: 'Belarus | AZ48: 'BLR | BA48: -0.653623941071049 | BB48: 0.220375596017846 | BC48: =1.64*RC[-1] -> 0.361415977469267 | BD48: =IF(EQUAL(VLOOKUP(RC[-4], R9C3:R186C4, 2, 0), 1), RC[-1], NA()) -> #ERR: ArgCount | BE48: =IF(ISERROR(RC[-1])=1, "", RC[-5]) -> 
B49: 'Czech Republic | C49: 'CZE | D49: =IF(EQUAL(ComparativeCharts!R[+11]C, ""), "", 1) ->  | E49: =IF(EQUAL(ComparativeCharts!R[+11]C, ""), "", 1) -> #EMPTY! | O49: 42 | P49: 'Qatar | Q49: 'QAT | R49: -0.775492422458551 | S49: 0.254026944310672 | T49: =1.64*RC[-1] -> 0.416604188669502 | U49: =IF(EQUAL(VLOOKUP(RC[-4], R9C3:R186C4, 2, 0), 1), RC[-1], NA()) -> #ERR: ArgCount | V49: =IF(ISERROR(RC[-1])=1, "", RC[-5]) ->  | W49: 'Zimbabwe | X49: 'ZWE | Y49: -0.541507052100545 | Z49: 0.269879776011692 | AA49: =1.64*RC[-1] -> 0.442602832659175 | AB49: =IF(EQUAL(VLOOKUP(RC[-4], R9C3:R186C4, 2, 0), 1), RC[-1], NA()) -> #ERR: ArgCount | AC49: =IF(ISERROR(RC[-1])=1, "", RC[-5]) ->  | AD49: 'Macedonia, FYR | AE49: 'MKD | AF49: -0.576447046200375 | AG49: 0.270976120535647 | AH49: =1.64*RC[-1] -> 0.444400837678461 | AI49: =IF(EQUAL(VLOOKUP(RC[-4], R9C3:R186C4, 2, 0), 1), RC[-1], NA()) -> #ERR: ArgCount | AJ49: =IF(ISERROR(RC[-1])=1, "", RC[-5]) ->  | AK49: 'Vietnam | AL49: 'VNM | AM49: -0.458793311681152 | AN49: 0.274543407726565 | AO49: =1.64*RC[-1] -> 0.450251188671567 | AP49: =IF(EQUAL(VLOOKUP(RC[-4], R9C3:R186C4, 2, 0), 1), RC[-1], NA()) -> #ERR: ArgCount | AQ49: =IF(ISERROR(RC[-1])=1, "", RC[-5]) ->  | AR49: 'Jamaica | AS49: 'JAM | AT49: -0.727917158432315 | AU49: 0.285056666814727 | AV49: =1.64*RC[-1] -> 0.467492933576152 | AW49: =IF(EQUAL(VLOOKUP(RC[-4], R9C3:R186C4, 2, 0), 1), RC[-1], NA()) -> #ERR: ArgCount | AX49: =IF(ISERROR(RC[-1])=1, "", RC[-5]) ->  | AY49: 'Kenya | AZ49: 'KEN | BA49: -0.651380377330864 | BB49: 0.210520528590018 | BC49: =1.64*RC[-1] -> 0.345253666887629 | BD49: =IF(EQUAL(VLOOKUP(RC[-4], R9C3:R186C4, 2, 0), 1), RC[-1], NA()) -> #ERR: ArgCount | BE49: =IF(ISERROR(RC[-1])=1, "", RC[-5]) -> 
B50: 'Germany | C50: 'DEU | D50: =IF(EQUAL(ComparativeCharts!R[+11]C, ""), "", 1) ->  | E50: =IF(EQUAL(ComparativeCharts!R[+11]C, ""), "", 1) -> #EMPTY! | O50: 43 | P50: 'Congo, Rep. | Q50: 'COG | R50: -0.773495066928138 | S50: 0.287283341236829 | T50: =1.64*RC[-1] -> 0.4711446796284 | U50: =IF(EQUAL(VLOOKUP(RC[-4], R9C3:R186C4, 2, 0), 1), RC[-1], NA()) -> #ERR: ArgCount | V50: =IF(ISERROR(RC[-1])=1, "", RC[-5]) ->  | W50: 'Mozambique | X50: 'MOZ | Y50: -0.529018256033319 | Z50: 0.335394653615951 | AA50: =1.64*RC[-1] -> 0.55004723193016 | AB50: =IF(EQUAL(VLOOKUP(RC[-4], R9C3:R186C4, 2, 0), 1), RC[-1], NA()) -> #ERR: ArgCount | AC50: =IF(ISERROR(RC[-1])=1, "", RC[-5]) ->  | AD50: 'Kyrgyz Republic | AE50: 'KGZ | AF50: -0.575168916504139 | AG50: 0.303625046262932 | AH50: =1.64*RC[-1] -> 0.497945075871209 | AI50: =IF(EQUAL(VLOOKUP(RC[-4], R9C3:R186C4, 2, 0), 1), RC[-1], NA()) -> #ERR: ArgCount | AJ50: =IF(ISERROR(RC[-1])=1, "", RC[-5]) ->  | AK50: 'Kazakhstan | AL50: 'KAZ | AM50: -0.404623733407951 | AN50: 0.262826647914669 | AO50: =1.64*RC[-1] -> 0.431035702580057 | AP50: =IF(EQUAL(VLOOKUP(RC[-4], R9C3:R186C4, 2, 0), 1), RC[-1], NA()) -> #ERR: ArgCount | AQ50: =IF(ISERROR(RC[-1])=1, "", RC[-5]) ->  | AR50: 'Nicaragua | AS50: 'NIC | AT50: -0.725780888564611 | AU50: 0.277567107731038 | AV50: =1.64*RC[-1] -> 0.455210056678902 | AW50: =IF(EQUAL(VLOOKUP(RC[-4], R9C3:R186C4, 2, 0), 1), RC[-1], NA()) -> #ERR: ArgCount | AX50: =IF(ISERROR(RC[-1])=1, "", RC[-5]) ->  | AY50: 'Russian Federation | AZ50: 'RUS | BA50: -0.616417924679094 | BB50: 0.158724276475048 | BC50: =1.64*RC[-1] -> 0.260307813419079 | BD50: =IF(EQUAL(VLOOKUP(RC[-4], R9C3:R186C4, 2, 0), 1), RC[-1], NA()) -> #ERR: ArgCount | BE50: =IF(ISERROR(RC[-1])=1, "", RC[-5]) -> 
B51: 'Djibouti | C51: 'DJI | D51: =IF(EQUAL(ComparativeCharts!R[+11]C, ""), "", 1) ->  | E51: =IF(EQUAL(ComparativeCharts!R[+11]C, ""), "", 1) -> #EMPTY! | O51: 44 | P51: 'Niger | Q51: 'NER | R51: -0.744074181443183 | S51: 0.291377601755329 | T51: =1.64*RC[-1] -> 0.47785926687874 | U51: =IF(EQUAL(VLOOKUP(RC[-4], R9C3:R186C4, 2, 0), 1), RC[-1], NA()) -> #ERR: ArgCount | V51: =IF(ISERROR(RC[-1])=1, "", RC[-5]) ->  | W51: 'Peru | X51: 'PER | Y51: -0.528960376577621 | Z51: 0.25228486761248 | AA51: =1.64*RC[-1] -> 0.413747182884467 | AB51: =IF(EQUAL(VLOOKUP(RC[-4], R9C3:R186C4, 2, 0), 1), RC[-1], NA()) -> #ERR: ArgCount | AC51: =IF(ISERROR(RC[-1])=1, "", RC[-5]) ->  | AD51: 'Romania | AE51: 'ROM | AF51: -0.569548709641687 | AG51: 0.259550680503314 | AH51: =1.64*RC[-1] -> 0.425663116025435 | AI51: =IF(EQUAL(VLOOKUP(RC[-4], R9C3:R186C4, 2, 0), 1), RC[-1], NA()) -> #ERR: ArgCount | AJ51: =IF(ISERROR(RC[-1])=1, "", RC[-5]) ->  | AK51: 'Fiji | AL51: 'FJI | AM51: -0.368703488518708 | AN51: 0.596740942900482 | AO51: =1.64*RC[-1] -> 0.97865514635679 | AP51: =IF(EQUAL(VLOOKUP(RC[-4], R9C3:R186C4, 2, 0), 1), RC[-1], NA()) -> #ERR: ArgCount | AQ51: =IF(ISERROR(RC[-1])=1, "", RC[-5]) ->  | AR51: 'Russian Federation | AS51: 'RUS | AT51: -0.722361502181206 | AU51: 0.160250557094621 | AV51: =1.64*RC[-1] -> 0.262810913635178 | AW51: =IF(EQUAL(VLOOKUP(RC[-4], R9C3:R186C4, 2, 0), 1), RC[-1], NA()) -> #ERR: ArgCount | AX51: =IF(ISERROR(RC[-1])=1, "", RC[-5]) ->  | AY51: 'Zambia | AZ51: 'ZMB | BA51: -0.614279117845522 | BB51: 0.210520528590018 | BC51: =1.64*RC[-1] -> 0.345253666887629 | BD51: =IF(EQUAL(VLOOKUP(RC[-4], R9C3:R186C4, 2, 0), 1), RC[-1], NA()) -> #ERR: ArgCount | BE51: =IF(ISERROR(RC[-1])=1, "", RC[-5]) -> 
B52: 'Denmark | C52: 'DNK | D52: =IF(EQUAL(ComparativeCharts!R[+11]C, ""), "", 1) ->  | E52: =IF(EQUAL(ComparativeCharts!R[+11]C, ""), "", 1) -> #EMPTY! | O52: 45 | P52: 'Kazakhstan | Q52: 'KAZ | R52: -0.711671752783758 | S52: 0.251300233223489 | T52: =1.64*RC[-1] -> 0.412132382486522 | U52: =IF(EQUAL(VLOOKUP(RC[-4], R9C3:R186C4, 2, 0), 1), RC[-1], NA()) -> #ERR: ArgCount | V52: =IF(ISERROR(RC[-1])=1, "", RC[-5]) ->  | W52: 'South Africa | X52: 'ZAF | Y52: -0.526791813530419 | Z52: 0.239504975394109 | AA52: =1.64*RC[-1] -> 0.392788159646339 | AB52: =IF(EQUAL(VLOOKUP(RC[-4], R9C3:R186C4, 2, 0), 1), RC[-1], NA()) -> #ERR: ArgCount | AC52: =IF(ISERROR(RC[-1])=1, "", RC[-5]) ->  | AD52: 'Bangladesh | AE52: 'BGD | AF52: -0.564608224994493 | AG52: 0.319089592041234 | AH52: =1.64*RC[-1] -> 0.523306930947624 | AI52: =IF(EQUAL(VLOOKUP(RC[-4], R9C3:R186C4, 2, 0), 1), RC[-1], NA()) -> #ERR: ArgCount | AJ52: =IF(ISERROR(RC[-1])=1, "", RC[-5]) ->  | AK52: 'Nepal | AL52: 'NPL | AM52: -0.359786501997322 | AN52: 0.601880844424266 | AO52: =1.64*RC[-1] -> 0.987084584855796 | AP52: =IF(EQUAL(VLOOKUP(RC[-4], R9C3:R186C4, 2, 0), 1), RC[-1], NA()) -> #ERR: ArgCount | AQ52: =IF(ISERROR(RC[-1])=1, "", RC[-5]) ->  | AR52: 'Ecuador | AS52: 'ECU | AT52: -0.721103409727295 | AU52: 0.239938596034472 | AV52: =1.64*RC[-1] -> 0.393499297496534 | AW52: =IF(EQUAL(VLOOKUP(RC[-4], R9C3:R186C4, 2, 0), 1), RC[-1], NA()) -> #ERR: ArgCount | AX52: =IF(ISERROR(RC[-1])=1, "", RC[-5]) ->  | AY52: 'Congo, Rep. | AZ52: 'COG | BA52: -0.596204077710876 | BB52: 0.484622455710095 | BC52: =1.64*RC[-1] -> 0.794780827364556 | BD52: =IF(EQUAL(VLOOKUP(RC[-4], R9C3:R186C4, 2, 0), 1), RC[-1], NA()) -> #ERR: ArgCount | BE52: =IF(ISERROR(RC[-1])=1, "", RC[-5]) -> 
B53: 'Dominican Republic | C53: 'DOM | D53: =IF(EQUAL(ComparativeCharts!R[+11]C, ""), "", 1) ->  | E53: =IF(EQUAL(ComparativeCharts!R[+11]C, ""), "", 1) -> #EMPTY! | O53: 46 | P53: 'Haiti | Q53: 'HTI | R53: -0.709013686998217 | S53: 0.291377601755329 | T53: =1.64*RC[-1] -> 0.47785926687874 | U53: =IF(EQUAL(VLOOKUP(RC[-4], R9C3:R186C4, 2, 0), 1), RC[-1], NA()) -> #ERR: ArgCount | V53: =IF(ISERROR(RC[-1])=1, "", RC[-5]) ->  | W53: 'Burkina Faso | X53: 'BFA | Y53: -0.516620997379056 | Z53: 0.362791739324056 | AA53: =1.64*RC[-1] -> 0.594978452491452 | AB53: =IF(EQUAL(VLOOKUP(RC[-4], R9C3:R186C4, 2, 0), 1), RC[-1], NA()) -> #ERR: ArgCount | AC53: =IF(ISERROR(RC[-1])=1, "", RC[-5]) ->  | AD53: 'Ecuador | AE53: 'ECU | AF53: -0.561960959525976 | AG53: 0.266738907159248 | AH53: =1.64*RC[-1] -> 0.437451807741167 | AI53: =IF(EQUAL(VLOOKUP(RC[-4], R9C3:R186C4, 2, 0), 1), RC[-1], NA()) -> #ERR: ArgCount | AJ53: =IF(ISERROR(RC[-1])=1, "", RC[-5]) ->  | AK53: 'Nigeria | AL53: 'NGA | AM53: -0.351599441735534 | AN53: 0.291187323849693 | AO53: =1.64*RC[-1] -> 0.477547211113496 | AP53: =IF(EQUAL(VLOOKUP(RC[-4], R9C3:R186C4, 2, 0), 1), RC[-1], NA()) -> #ERR: ArgCount | AQ53: =IF(ISERROR(RC[-1])=1, "", RC[-5]) ->  | AR53: 'Ukraine | AS53: 'UKR | AT53: -0.707456079733274 | AU53: 0.166739615872681 | AV53: =1.64*RC[-1] -> 0.273452970031197 | AW53: =IF(EQUAL(VLOOKUP(RC[-4], R9C3:R186C4, 2, 0), 1), RC[-1], NA()) -> #ERR: ArgCount | AX53: =IF(ISERROR(RC[-1])=1, "", RC[-5]) ->  | AY53: 'Chad | AZ53: 'TCD | BA53: -0.587007972077252 | BB53: 0.536534704411876 | BC53: =1.64*RC[-1] -> 0.879916915235477 | BD53: =IF(EQUAL(VLOOKUP(RC[-4], R9C3:R186C4, 2, 0), 1), RC[-1], NA()) -> #ERR: ArgCount | BE53: =IF(ISERROR(RC[-1])=1, "", RC[-5]) -> 
B54: 'Algeria | C54: 'DZA | D54: =IF(EQUAL(ComparativeCharts!R[+11]C, ""), "", 1) ->  | E54: =IF(EQUAL(ComparativeCharts!R[+11]C, ""), "", 1) -> #EMPTY! | O54: 47 | P54: 'Cameroon | Q54: 'CMR | R54: -0.70288316235524 | S54: 0.251300233223489 | T54: =1.64*RC[-1] -> 0.412132382486522 | U54: =IF(EQUAL(VLOOKUP(RC[-4], R9C3:R186C4, 2, 0), 1), RC[-1], NA()) -> #ERR: ArgCount | V54: =IF(ISERROR(RC[-1])=1, "", RC[-5]) ->  | W54: 'Ecuador | X54: 'ECU | Y54: -0.467172598007512 | Z54: 0.263581014412824 | AA54: =1.64*RC[-1] -> 0.432272863637031 | AB54: =IF(EQUAL(VLOOKUP(RC[-4], R9C3:R186C4, 2, 0), 1), RC[-1], NA()) -> #ERR: ArgCount | AC54: =IF(ISERROR(RC[-1])=1, "", RC[-5]) ->  | AD54: 'Nicaragua | AE54: 'NIC | AF54: -0.547167467529913 | AG54: 0.374142364422074 | AH54: =1.64*RC[-1] -> 0.613593477652201 | AI54: =IF(EQUAL(VLOOKUP(RC[-4], R9C3:R186C4, 2, 0), 1), RC[-1], NA()) -> #ERR: ArgCount | AJ54: =IF(ISERROR(RC[-1])=1, "", RC[-5]) ->  | AK54: 'Zimbabwe | AL54: 'ZWE | AM54: -0.340996219315364 | AN54: 0.231496316941685 | AO54: =1.64*RC[-1] -> 0.379653959784363 | AP54: =IF(EQUAL(VLOOKUP(RC[-4], R9C3:R186C4, 2, 0), 1), RC[-1], NA()) -> #ERR: ArgCount | AQ54: =IF(ISERROR(RC[-1])=1, "", RC[-5]) ->  | AR54: 'Paraguay | AS54: 'PRY | AT54: -0.695470957967884 | AU54: 0.285056666814727 | AV54: =1.64*RC[-1] -> 0.467492933576152 | AW54: =IF(EQUAL(VLOOKUP(RC[-4], R9C3:R186C4, 2, 0), 1), RC[-1], NA()) -> #ERR: ArgCount | AX54: =IF(ISERROR(RC[-1])=1, "", RC[-5]) ->  | AY54: 'Saudi Arabia | AZ54: 'SAU | BA54: -0.575351184382464 | BB54: 0.260942877169474 | BC54: =1.64*RC[-1] -> 0.427946318557937 | BD54: =IF(EQUAL(VLOOKUP(RC[-4], R9C3:R186C4, 2, 0), 1), RC[-1], NA()) -> #ERR: ArgCount | BE54: =IF(ISERROR(RC[-1])=1, "", RC[-5]) -> 
B55: 'Ecuador | C55: 'ECU | D55: =IF(EQUAL(ComparativeCharts!R[+11]C, ""), "", 1) ->  | E55: =IF(EQUAL(ComparativeCharts!R[+11]C, ""), "", 1) -> #EMPTY! | O55: 48 | P55: 'Kenya | Q55: 'KEN | R55: -0.701220769773142 | S55: 0.251300233223489 | T55: =1.64*RC[-1] -> 0.412132382486522 | U55: =IF(EQUAL(VLOOKUP(RC[-4], R9C3:R186C4, 2, 0), 1), RC[-1], NA()) -> #ERR: ArgCount | V55: =IF(ISERROR(RC[-1])=1, "", RC[-5]) ->  | W55: 'Israel | X55: 'ISR | Y55: -0.4550234910724 | Z55: 0.283550357121878 | AA55: =1.64*RC[-1] -> 0.46502258567988 | AB55: =IF(EQUAL(VLOOKUP(RC[-4], R9C3:R186C4, 2, 0), 1), RC[-1], NA()) -> #ERR: ArgCount | AC55: =IF(ISERROR(RC[-1])=1, "", RC[-5]) ->  | AD55: 'Indonesia | AE55: 'IDN | AF55: -0.528262795168551 | AG55: 0.248661311888018 | AH55: =1.64*RC[-1] -> 0.407804551496349 | AI55: =IF(EQUAL(VLOOKUP(RC[-4], R9C3:R186C4, 2, 0), 1), RC[-1], NA()) -> #ERR: ArgCount | AJ55: =IF(ISERROR(RC[-1])=1, "", RC[-5]) ->  | AK55: 'Senegal | AL55: 'SEN | AM55: -0.337690859198066 | AN55: 0.516616692692467 | AO55: =1.64*RC[-1] -> 0.847251376015646 | AP55: =IF(EQUAL(VLOOKUP(RC[-4], R9C3:R186C4, 2, 0), 1), RC[-1], NA()) -> #ERR: ArgCount | AQ55: =IF(ISERROR(RC[-1])=1, "", RC[-5]) ->  | AR55: 'Korea, Dem. Rep. | AS55: 'PRK | AT55: -0.667168388724308 | AU55: 0.443073362506416 | AV55: =1.64*RC[-1] -> 0.726640314510522 | AW55: =IF(EQUAL(VLOOKUP(RC[-4], R9C3:R186C4, 2, 0), 1), RC[-1], NA()) -> #ERR: ArgCount | AX55: =IF(ISERROR(RC[-1])=1, "", RC[-5]) ->  | AY55: 'Bulgaria | AZ55: 'BGR | BA55: -0.557152054574667 | BB55: 0.181932764704801 | BC55: =1.64*RC[-1] -> 0.298369734115874 | BD55: =IF(EQUAL(VLOOKUP(RC[-4], R9C3:R186C4, 2, 0), 1), RC[-1], NA()) -> #ERR: ArgCount | BE55: =IF(ISERROR(RC[-1])=1, "", RC[-5]) -> 
B56: 'Egypt, Arab Rep. | C56: 'EGY | D56: =IF(EQUAL(ComparativeCharts!R[+11]C, ""), "", 1) ->  | E56: =IF(EQUAL(ComparativeCharts!R[+11]C, ""), "", 1) -> #EMPTY! | O56: 49 | P56: 'Peru | Q56: 'PER | R56: -0.687248844497834 | S56: 0.251300233223489 | T56: =1.64*RC[-1] -> 0.412132382486522 | U56: =IF(EQUAL(VLOOKUP(RC[-4], R9C3:R186C4, 2, 0), 1), RC[-1], NA()) -> #ERR: ArgCount | V56: =IF(ISERROR(RC[-1])=1, "", RC[-5]) ->  | W56: 'Armenia | X56: 'ARM | Y56: -0.454578772881033 | Z56: 0.253989014301079 | AA56: =1.64*RC[-1] -> 0.41654198345377 | AB56: =IF(EQUAL(VLOOKUP(RC[-4], R9C3:R186C4, 2, 0), 1), RC[-1], NA()) -> #ERR: ArgCount | AC56: =IF(ISERROR(RC[-1])=1, "", RC[-5]) ->  | AD56: 'Georgia | AE56: 'GEO | AF56: -0.512082003605912 | AG56: 0.303625046262932 | AH56: =1.64*RC[-1] -> 0.497945075871209 | AI56: =IF(EQUAL(VLOOKUP(RC[-4], R9C3:R186C4, 2, 0), 1), RC[-1], NA()) -> #ERR: ArgCount | AJ56: =IF(ISERROR(RC[-1])=1, "", RC[-5]) ->  | AK56: 'Macedonia, FYR | AL56: 'MKD | AM56: -0.31189210410696 | AN56: 0.331945131197961 | AO56: =1.64*RC[-1] -> 0.544390015164656 | AP56: =IF(EQUAL(VLOOKUP(RC[-4], R9C3:R186C4, 2, 0), 1), RC[-1], NA()) -> #ERR: ArgCount | AQ56: =IF(ISERROR(RC[-1])=1, "", RC[-5]) ->  | AR56: 'Venezuela, RB | AS56: 'VEN | AT56: -0.661557827384745 | AU56: 0.207737275615815 | AV56: =1.64*RC[-1] -> 0.340689132009937 | AW56: =IF(EQUAL(VLOOKUP(RC[-4], R9C3:R186C4, 2, 0), 1), RC[-1], NA()) -> #ERR: ArgCount | AX56: =IF(ISERROR(RC[-1])=1, "", RC[-5]) ->  | AY56: 'Mozambique | AZ56: 'MOZ | BA56: -0.534920127421431 | BB56: 0.311180207053221 | BC56: =1.64*RC[-1] -> 0.510335539567283 | BD56: =IF(EQUAL(VLOOKUP(RC[-4], R9C3:R186C4, 2, 0), 1), RC[-1], NA()) -> #ERR: ArgCount | BE56: =IF(ISERROR(RC[-1])=1, "", RC[-5]) -> 
B57: 'Eritrea | C57: 'ERI | D57: =IF(EQUAL(ComparativeCharts!R[+11]C, ""), "", 1) ->  | E57: =IF(EQUAL(ComparativeCharts!R[+11]C, ""), "", 1) -> #EMPTY! | O57: 50 | P57: 'Egypt, Arab Rep. | Q57: 'EGY | R57: -0.674392739955636 | S57: 0.254026944310672 | T57: =1.64*RC[-1] -> 0.416604188669502 | U57: =IF(EQUAL(VLOOKUP(RC[-4], R9C3:R186C4, 2, 0), 1), RC[-1], NA()) -> #ERR: ArgCount | V57: =IF(ISERROR(RC[-1])=1, "", RC[-5]) ->  | W57: 'Macedonia, FYR | X57: 'MKD | Y57: -0.399506627624894 | Z57: 0.3059941916813 | AA57: =1.64*RC[-1] -> 0.501830474357332 | AB57: =IF(EQUAL(VLOOKUP(RC[-4], R9C3:R186C4, 2, 0), 1), RC[-1], NA()) -> #ERR: ArgCount | AC57: =IF(ISERROR(RC[-1])=1, "", RC[-5]) ->  | AD57: 'Cuba | AE57: 'CUB | AF57: -0.497101521805384 | AG57: 0.319089592041234 | AH57: =1.64*RC[-1] -> 0.523306930947624 | AI57: =IF(EQUAL(VLOOKUP(RC[-4], R9C3:R186C4, 2, 0), 1), RC[-1], NA()) -> #ERR: ArgCount | AJ57: =IF(ISERROR(RC[-1])=1, "", RC[-5]) ->  | AK57: 'Russian Federation | AL57: 'RUS | AM57: -0.303054462135123 | AN57: 0.191964544754769 | AO57: =1.64*RC[-1] -> 0.314821853397821 | AP57: =IF(EQUAL(VLOOKUP(RC[-4], R9C3:R186C4, 2, 0), 1), RC[-1], NA()) -> #ERR: ArgCount | AQ57: =IF(ISERROR(RC[-1])=1, "", RC[-5]) ->  | AR57: 'El Salvador | AS57: 'SLV | AT57: -0.656364671443548 | AU57: 0.277567107731038 | AV57: =1.64*RC[-1] -> 0.455210056678902 | AW57: =IF(EQUAL(VLOOKUP(RC[-4], R9C3:R186C4, 2, 0), 1), RC[-1], NA()) -> #ERR: ArgCount | AX57: =IF(ISERROR(RC[-1])=1, "", RC[-5]) ->  | AY57: 'Haiti | AZ57: 'HTI | BA57: -0.534714525041343 | BB57: 0.748674396199437 | BC57: =1.64*RC[-1] -> 1.22782600976708 | BD57: =IF(EQUAL(VLOOKUP(RC[-4], R9C3:R186C4, 2, 0), 1), RC[-1], NA()) -> #ERR: ArgCount | BE57: =IF(ISERROR(RC[-1])=1, "", RC[-5]) -> 
B58: 'Spain | C58: 'ESP | D58: =IF(EQUAL(ComparativeCharts!R[+11]C, ""), "", 1) ->  | E58: =IF(EQUAL(ComparativeCharts!R[+11]C, ""), "", 1) -> #EMPTY! | O58: 51 | P58: 'Zimbabwe | Q58: 'ZWE | R58: -0.665627449454788 | S58: 0.251300233223489 | T58: =1.64*RC[-1] -> 0.412132382486522 | U58: =IF(EQUAL(VLOOKUP(RC[-4], R9C3:R186C4, 2, 0), 1), RC[-1], NA()) -> #ERR: ArgCount | V58: =IF(ISERROR(RC[-1])=1, "", RC[-5]) ->  | W58: 'Bangladesh | X58: 'BGD | Y58: -0.398234412277944 | Z58: 0.299881889042829 | AA58: =1.64*RC[-1] -> 0.49180629803024 | AB58: =IF(EQUAL(VLOOKUP(RC[-4], R9C3:R186C4, 2, 0), 1), RC[-1], NA()) -> #ERR: ArgCount | AC58: =IF(ISERROR(RC[-1])=1, "", RC[-5]) ->  | AD58: 'Tanzania | AE58: 'TZA | AF58: -0.485337284734686 | AG58: 0.222481788006156 | AH58: =1.64*RC[-1] -> 0.364870132330096 | AI58: =IF(EQUAL(VLOOKUP(RC[-4], R9C3:R186C4, 2, 0), 1), RC[-1], NA()) -> #ERR: ArgCount | AJ58: =IF(ISERROR(RC[-1])=1, "", RC[-5]) ->  | AK58: 'Moldova | AL58: 'MDA | AM58: -0.280628804062589 | AN58: 0.262826647914669 | AO58: =1.64*RC[-1] -> 0.431035702580057 | AP58: =IF(EQUAL(VLOOKUP(RC[-4], R9C3:R186C4, 2, 0), 1), RC[-1], NA()) -> #ERR: ArgCount | AQ58: =IF(ISERROR(RC[-1])=1, "", RC[-5]) ->  | AR58: 'Kazakhstan | AS58: 'KAZ | AT58: -0.589663048787867 | AU58: 0.173714718001019 | AV58: =1.64*RC[-1] -> 0.284892137521671 | AW58: =IF(EQUAL(VLOOKUP(RC[-4], R9C3:R186C4, 2, 0), 1), RC[-1], NA()) -> #ERR: ArgCount | AX58: =IF(ISERROR(RC[-1])=1, "", RC[-5]) ->  | AY58: 'Korea, Dem. Rep. | AZ58: 'PRK | BA58: -0.534714525041343 | BB58: 0.748674396199437 | BC58: =1.64*RC[-1] -> 1.22782600976708 | BD58: =IF(EQUAL(VLOOKUP(RC[-4], R9C3:R186C4, 2, 0), 1), RC[-1], NA()) -> #ERR: ArgCount | BE58: =IF(ISERROR(RC[-1])=1, "", RC[-5]) -> 
B59: 'Estonia | C59: 'EST | D59: =IF(EQUAL(ComparativeCharts!R[+11]C, ""), "", 1) ->  | E59: =IF(EQUAL(ComparativeCharts!R[+11]C, ""), "", 1) -> #EMPTY! | O59: 52 | P59: 'Djibouti | Q59: 'DJI | R59: -0.601567097825887 | S59: 0.360314615495306 | T59: =1.64*RC[-1] -> 0.590915969412302 | U59: =IF(EQUAL(VLOOKUP(RC[-4], R9C3:R186C4, 2, 0), 1), RC[-1], NA()) -> #ERR: ArgCount | V59: =IF(ISERROR(RC[-1])=1, "", RC[-5]) ->  | W59: 'Papua New Guinea | X59: 'PNG | Y59: -0.397664515902837 | Z59: 0.342482293230127 | AA59: =1.64*RC[-1] -> 0.561670960897408 | AB59: =IF(EQUAL(VLOOKUP(RC[-4], R9C3:R186C4, 2, 0), 1), RC[-1], NA()) -> #ERR: ArgCount | AC59: =IF(ISERROR(RC[-1])=1, "", RC[-5]) ->  | AD59: 'Jamaica | AE59: 'JAM | AF59: -0.484201311084561 | AG59: 0.328076692774937 | AH59: =1.64*RC[-1] -> 0.538045776150897 | AI59: =IF(EQUAL(VLOOKUP(RC[-4], R9C3:R186C4, 2, 0), 1), RC[-1], NA()) -> #ERR: ArgCount | AJ59: =IF(ISERROR(RC[-1])=1, "", RC[-5]) ->  | AK59: 'Gambia, The | AL59: 'GMB | AM59: -0.249650744710652 | AN59: 0.519940958319459 | AO59: =1.64*RC[-1] -> 0.852703171643913 | AP59: =IF(EQUAL(VLOOKUP(RC[-4], R9C3:R186C4, 2, 0), 1), RC[-1], NA()) -> #ERR: ArgCount | AQ59: =IF(ISERROR(RC[-1])=1, "", RC[-5]) ->  | AR59: 'Azerbaijan | AS59: 'AZE | AT59: -0.563494090342913 | AU59: 0.179548241092202 | AV59: =1.64*RC[-1] -> 0.294459115391211 | AW59: =IF(EQUAL(VLOOKUP(RC[-4], R9C3:R186C4, 2, 0), 1), RC[-1], NA()) -> #ERR: ArgCount | AX59: =IF(ISERROR(RC[-1])=1, "", RC[-5]) ->  | AY59: 'Macedonia, FYR | AZ59: 'MKD | BA59: -0.51713475864818 | BB59: 0.200721296816824 | BC59: =1.64*RC[-1] -> 0.329182926779591 | BD59: =IF(EQUAL(VLOOKUP(RC[-4], R9C3:R186C4, 2, 0), 1), RC[-1], NA()) -> #ERR: ArgCount | BE59: =IF(ISERROR(RC[-1])=1, "", RC[-5]) -> 
B60: 'Ethiopia | C60: 'ETH | D60: =IF(EQUAL(ComparativeCharts!R[+11]C, ""), "", 1) ->  | E60: =IF(EQUAL(ComparativeCharts!R[+11]C, ""), "", 1) -> #EMPTY! | O60: 53 | P60: 'Eritrea | Q60: 'ERI | R60: -0.594663560635087 | S60: 0.360314615495306 | T60: =1.64*RC[-1] -> 0.590915969412302 | U60: =IF(EQUAL(VLOOKUP(RC[-4], R9C3:R186C4, 2, 0), 1), RC[-1], NA()) -> #ERR: ArgCount | V60: =IF(ISERROR(RC[-1])=1, "", RC[-5]) ->  | W60: 'Belarus | X60: 'BLR | Y60: -0.37473847286711 | Z60: 0.253989014301079 | AA60: =1.64*RC[-1] -> 0.41654198345377 | AB60: =IF(EQUAL(VLOOKUP(RC[-4], R9C3:R186C4, 2, 0), 1), RC[-1], NA()) -> #ERR: ArgCount | AC60: =IF(ISERROR(RC[-1])=1, "", RC[-5]) ->  | AD60: 'Swaziland | AE60: 'SWZ | AF60: -0.474073998367403 | AG60: 0.329075950105893 | AH60: =1.64*RC[-1] -> 0.539684558173665 | AI60: =IF(EQUAL(VLOOKUP(RC[-4], R9C3:R186C4, 2, 0), 1), RC[-1], NA()) -> #ERR: ArgCount | AJ60: =IF(ISERROR(RC[-1])=1, "", RC[-5]) ->  | AK60: 'Mozambique | AL60: 'MOZ | AM60: -0.227406242340319 | AN60: 0.331644165648542 | AO60: =1.64*RC[-1] -> 0.543896431663609 | AP60: =IF(EQUAL(VLOOKUP(RC[-4], R9C3:R186C4, 2, 0), 1), RC[-1], NA()) -> #ERR: ArgCount | AQ60: =IF(ISERROR(RC[-1])=1, "", RC[-5]) ->  | AR60: 'Mauritania | AS60: 'MRT | AT60: -0.557835607429326 | AU60: 0.600583865212543 | AV60: =1.64*RC[-1] -> 0.984957538948571 | AW60: =IF(EQUAL(VLOOKUP(RC[-4], R9C3:R186C4, 2, 0), 1), RC[-1], NA()) -> #ERR: ArgCount | AX60: =IF(ISERROR(RC[-1])=1, "", RC[-5]) ->  | AY60: 'Colombia | AZ60: 'COL | BA60: -0.490332951916436 | BB60: 0.189092987537097 | BC60: =1.64*RC[-1] -> 0.310112499560839 | BD60: =IF(EQUAL(VLOOKUP(RC[-4], R9C3:R186C4, 2, 0), 1), RC[-1], NA()) -> #ERR: ArgCount | BE60: =IF(ISERROR(RC[-1])=1, "", RC[-5]) -> 
B61: 'Finland | C61: 'FIN | D61: =IF(EQUAL(ComparativeCharts!R[+11]C, ""), "", 1) ->  | E61: =IF(EQUAL(ComparativeCharts!R[+11]C, ""), "", 1) -> #EMPTY! | O61: 54 | P61: 'Tunisia | Q61: 'TUN | R61: -0.588608494629428 | S61: 0.254026944310672 | T61: =1.64*RC[-1] -> 0.416604188669502 | U61: =IF(EQUAL(VLOOKUP(RC[-4], R9C3:R186C4, 2, 0), 1), RC[-1], NA()) -> #ERR: ArgCount | V61: =IF(ISERROR(RC[-1])=1, "", RC[-5]) ->  | W61: 'Azerbaijan | X61: 'AZE | Y61: -0.363444582419292 | Z61: 0.234722074427469 | AA61: =1.64*RC[-1] -> 0.384944202061049 | AB61: =IF(EQUAL(VLOOKUP(RC[-4], R9C3:R186C4, 2, 0), 1), RC[-1], NA()) -> #ERR: ArgCount | AC61: =IF(ISERROR(RC[-1])=1, "", RC[-5]) ->  | AD61: 'Lesotho | AE61: 'LSO | AF61: -0.461748202705814 | AG61: 0.329075950105893 | AH61: =1.64*RC[-1] -> 0.539684558173665 | AI61: =IF(EQUAL(VLOOKUP(RC[-4], R9C3:R186C4, 2, 0), 1), RC[-1], NA()) -> #ERR: ArgCount | AJ61: =IF(ISERROR(RC[-1])=1, "", RC[-5]) ->  | AK61: 'Madagascar | AL61: 'MDG | AM61: -0.208915501418436 | AN61: 0.516616692692467 | AO61: =1.64*RC[-1] -> 0.847251376015646 | AP61: =IF(EQUAL(VLOOKUP(RC[-4], R9C3:R186C4, 2, 0), 1), RC[-1], NA()) -> #ERR: ArgCount | AQ61: =IF(ISERROR(RC[-1])=1, "", RC[-5]) ->  | AR61: 'Nepal | AS61: 'NPL | AT61: -0.557835607429326 | AU61: 0.600583865212543 | AV61: =1.64*RC[-1] -> 0.984957538948571 | AW61: =IF(EQUAL(VLOOKUP(RC[-4], R9C3:R186C4, 2, 0), 1), RC[-1], NA()) -> #ERR: ArgCount | AX61: =IF(ISERROR(RC[-1])=1, "", RC[-5]) ->  | AY61: 'Mali | AZ61: 'MLI | BA61: -0.475850053176132 | BB61: 0.484622455710095 | BC61: =1.64*RC[-1] -> 0.794780827364556 | BD61: =IF(EQUAL(VLOOKUP(RC[-4], R9C3:R186C4, 2, 0), 1), RC[-1], NA()) -> #ERR: ArgCount | BE61: =IF(ISERROR(RC[-1])=1, "", RC[-5]) -> 
B62: 'Fiji | C62: 'FJI | D62: =IF(EQUAL(ComparativeCharts!R[+11]C, ""), "", 1) ->  | E62: =IF(EQUAL(ComparativeCharts!R[+11]C, ""), "", 1) -> #EMPTY! | O62: 55 | P62: 'Oman | Q62: 'OMN | R62: -0.570137420333985 | S62: 0.254026944310672 | T62: =1.64*RC[-1] -> 0.416604188669502 | U62: =IF(EQUAL(VLOOKUP(RC[-4], R9C3:R186C4, 2, 0), 1), RC[-1], NA()) -> #ERR: ArgCount | V62: =IF(ISERROR(RC[-1])=1, "", RC[-5]) ->  | W62: 'Mexico | X62: 'MEX | Y62: -0.352130524267135 | Z62: 0.25228486761248 | AA62: =1.64*RC[-1] -> 0.413747182884467 | AB62: =IF(EQUAL(VLOOKUP(RC[-4], R9C3:R186C4, 2, 0), 1), RC[-1], NA()) -> #ERR: ArgCount | AC62: =IF(ISERROR(RC[-1])=1, "", RC[-5]) ->  | AD62: 'Moldova | AE62: 'MDA | AF62: -0.460082768696662 | AG62: 0.242598933058622 | AH62: =1.64*RC[-1] -> 0.39786225021614 | AI62: =IF(EQUAL(VLOOKUP(RC[-4], R9C3:R186C4, 2, 0), 1), RC[-1], NA()) -> #ERR: ArgCount | AJ62: =IF(ISERROR(RC[-1])=1, "", RC[-5]) ->  | AK62: 'Pakistan | AL62: 'PAK | AM62: -0.197844781924927 | AN62: 0.274543407726565 | AO62: =1.64*RC[-1] -> 0.450251188671567 | AP62: =IF(EQUAL(VLOOKUP(RC[-4], R9C3:R186C4, 2, 0), 1), RC[-1], NA()) -> #ERR: ArgCount | AQ62: =IF(ISERROR(RC[-1])=1, "", RC[-5]) ->  | AR62: 'Gabon | AS62: 'GAB | AT62: -0.52521530277166 | AU62: 0.313894625236573 | AV62: =1.64*RC[-1] -> 0.51478718538798 | AW62: =IF(EQUAL(VLOOKUP(RC[-4], R9C3:R186C4, 2, 0), 1), RC[-1], NA()) -> #ERR: ArgCount | AX62: =IF(ISERROR(RC[-1])=1, "", RC[-5]) ->  | AY62: 'Madagascar | AZ62: 'MDG | BA62: -0.469322957287471 | BB62: 0.484622455710095 | BC62: =1.64*RC[-1] -> 0.794780827364556 | BD62: =IF(EQUAL(VLOOKUP(RC[-4], R9C3:R186C4, 2, 0), 1), RC[-1], NA()) -> #ERR: ArgCount | BE62: =IF(ISERROR(RC[-1])=1, "", RC[-5]) -> 
B63: 'France | C63: 'FRA | D63: =IF(EQUAL(ComparativeCharts!R[+11]C, ""), "", 1) ->  | E63: =IF(EQUAL(ComparativeCharts!R[+11]C, ""), "", 1) -> #EMPTY! | O63: 56 | P63: 'Cote d'Ivoire | Q63: 'CIV | R63: -0.56905295871603 | S63: 0.251300233223489 | T63: =1.64*RC[-1] -> 0.412132382486522 | U63: =IF(EQUAL(VLOOKUP(RC[-4], R9C3:R186C4, 2, 0), 1), RC[-1], NA()) -> #ERR: ArgCount | V63: =IF(ISERROR(RC[-1])=1, "", RC[-5]) ->  | W63: 'Jamaica | X63: 'JAM | Y63: -0.344293116928392 | Z63: 0.319152876161049 | AA63: =1.64*RC[-1] -> 0.52341071690412 | AB63: =IF(EQUAL(VLOOKUP(RC[-4], R9C3:R186C4, 2, 0), 1), RC[-1], NA()) -> #ERR: ArgCount | AC63: =IF(ISERROR(RC[-1])=1, "", RC[-5]) ->  | AD63: 'Turkey | AE63: 'TUR | AF63: -0.412272104977834 | AG63: 0.233636532185851 | AH63: =1.64*RC[-1] -> 0.383163912784796 | AI63: =IF(EQUAL(VLOOKUP(RC[-4], R9C3:R186C4, 2, 0), 1), RC[-1], NA()) -> #ERR: ArgCount | AJ63: =IF(ISERROR(RC[-1])=1, "", RC[-5]) ->  | AK63: 'Cameroon | AL63: 'CMR | AM63: -0.163682730895072 | AN63: 0.291187323849693 | AO63: =1.64*RC[-1] -> 0.477547211113496 | AP63: =IF(EQUAL(VLOOKUP(RC[-4], R9C3:R186C4, 2, 0), 1), RC[-1], NA()) -> #ERR: ArgCount | AQ63: =IF(ISERROR(RC[-1])=1, "", RC[-5]) ->  | AR63: 'Peru | AS63: 'PER | AT63: -0.521658317124789 | AU63: 0.222494499215453 | AV63: =1.64*RC[-1] -> 0.364890978713343 | AW63: =IF(EQUAL(VLOOKUP(RC[-4], R9C3:R186C4, 2, 0), 1), RC[-1], NA()) -> #ERR: ArgCount | AX63: =IF(ISERROR(RC[-1])=1, "", RC[-5]) ->  | AY63: 'Uganda | AZ63: 'UGA | BA63: -0.465943384422014 | BB63: 0.210520528590018 | BC63: =1.64*RC[-1] -> 0.345253666887629 | BD63: =IF(EQUAL(VLOOKUP(RC[-4], R9C3:R186C4, 2, 0), 1), RC[-1], NA()) -> #ERR: ArgCount | BE63: =IF(ISERROR(RC[-1])=1, "", RC[-5]) -> 
B64: 'Gabon | C64: 'GAB | D64: =IF(EQUAL(ComparativeCharts!R[+11]C, ""), "", 1) ->  | E64: =IF(EQUAL(ComparativeCharts!R[+11]C, ""), "", 1) -> #EMPTY! | O64: 57 | P64: 'Guatemala | Q64: 'GTM | R64: -0.564613187138968 | S64: 0.254026944310672 | T64: =1.64*RC[-1] -> 0.416604188669502 | U64: =IF(EQUAL(VLOOKUP(RC[-4], R9C3:R186C4, 2, 0), 1), RC[-1], NA()) -> #ERR: ArgCount | V64: =IF(ISERROR(RC[-1])=1, "", RC[-5]) ->  | W64: 'Honduras | X64: 'HND | Y64: -0.33396283317136 | Z64: 0.318733333730906 | AA64: =1.64*RC[-1] -> 0.522722667318686 | AB64: =IF(EQUAL(VLOOKUP(RC[-4], R9C3:R186C4, 2, 0), 1), RC[-1], NA()) -> #ERR: ArgCount | AC64: =IF(ISERROR(RC[-1])=1, "", RC[-5]) ->  | AD64: 'Honduras | AE64: 'HND | AF64: -0.408901309695725 | AG64: 0.374142364422074 | AH64: =1.64*RC[-1] -> 0.613593477652201 | AI64: =IF(EQUAL(VLOOKUP(RC[-4], R9C3:R186C4, 2, 0), 1), RC[-1], NA()) -> #ERR: ArgCount | AJ64: =IF(ISERROR(RC[-1])=1, "", RC[-5]) ->  | AK64: 'West Bank and Gaza | AL64: 'WTB | AM64: -0.161820882930699 | AN64: 0.97694373036538 | AO64: =1.64*RC[-1] -> 1.60218771779922 | AP64: =IF(EQUAL(VLOOKUP(RC[-4], R9C3:R186C4, 2, 0), 1), RC[-1], NA()) -> #ERR: ArgCount | AQ64: =IF(ISERROR(RC[-1])=1, "", RC[-5]) ->  | AR64: 'Fiji | AS64: 'FJI | AT64: -0.495383176646379 | AU64: 0.450388515286507 | AV64: =1.64*RC[-1] -> 0.738637165069871 | AW64: =IF(EQUAL(VLOOKUP(RC[-4], R9C3:R186C4, 2, 0), 1), RC[-1], NA()) -> #ERR: ArgCount | AX64: =IF(ISERROR(RC[-1])=1, "", RC[-5]) ->  | AY64: 'Croatia | AZ64: 'HRV | BA64: -0.46405431594523 | BB64: 0.197079228567315 | BC64: =1.64*RC[-1] -> 0.323209934850397 | BD64: =IF(EQUAL(VLOOKUP(RC[-4], R9C3:R186C4, 2, 0), 1), RC[-1], NA()) -> #ERR: ArgCount | BE64: =IF(ISERROR(RC[-1])=1, "", RC[-5]) -> 
B65: 'United Kingdom | C65: 'GBR | D65: =IF(EQUAL(ComparativeCharts!R[+11]C, ""), "", 1) ->  | E65: =IF(EQUAL(ComparativeCharts!R[+11]C, ""), "", 1) -> #EMPTY! | O65: 58 | P65: 'Iran, Islamic Rep. | Q65: 'IRN | R65: -0.559206275363623 | S65: 0.254026944310672 | T65: =1.64*RC[-1] -> 0.416604188669502 | U65: =IF(EQUAL(VLOOKUP(RC[-4], R9C3:R186C4, 2, 0), 1), RC[-1], NA()) -> #ERR: ArgCount | V65: =IF(ISERROR(RC[-1])=1, "", RC[-5]) ->  | W65: 'Uzbekistan | X65: 'UZB | Y65: -0.332942614978988 | Z65: 0.274469070429637 | AA65: =1.64*RC[-1] -> 0.450129275504605 | AB65: =IF(EQUAL(VLOOKUP(RC[-4], R9C3:R186C4, 2, 0), 1), RC[-1], NA()) -> #ERR: ArgCount | AC65: =IF(ISERROR(RC[-1])=1, "", RC[-5]) ->  | AD65: 'Zambia | AE65: 'ZMB | AF65: -0.398935539100722 | AG65: 0.222481788006156 | AH65: =1.64*RC[-1] -> 0.364870132330096 | AI65: =IF(EQUAL(VLOOKUP(RC[-4], R9C3:R186C4, 2, 0), 1), RC[-1], NA()) -> #ERR: ArgCount | AJ65: =IF(ISERROR(RC[-1])=1, "", RC[-5]) ->  | AK65: 'Bangladesh | AL65: 'BGD | AM65: -0.155236651216898 | AN65: 0.395254221998157 | AO65: =1.64*RC[-1] -> 0.648216924076978 | AP65: =IF(EQUAL(VLOOKUP(RC[-4], R9C3:R186C4, 2, 0), 1), RC[-1], NA()) -> #ERR: ArgCount | AQ65: =IF(ISERROR(RC[-1])=1, "", RC[-5]) ->  | AR65: 'Georgia | AS65: 'GEO | AT65: -0.494184232932555 | AU65: 0.205660006207 | AV65: =1.64*RC[-1] -> 0.33728241017948 | AW65: =IF(EQUAL(VLOOKUP(RC[-4], R9C3:R186C4, 2, 0), 1), RC[-1], NA()) -> #ERR: ArgCount | AX65: =IF(ISERROR(RC[-1])=1, "", RC[-5]) ->  | AY65: 'Panama | AZ65: 'PAN | BA65: -0.458285420466015 | BB65: 0.267063170408295 | BC65: =1.64*RC[-1] -> 0.437983599469604 | BD65: =IF(EQUAL(VLOOKUP(RC[-4], R9C3:R186C4, 2, 0), 1), RC[-1], NA()) -> #ERR: ArgCount | BE65: =IF(ISERROR(RC[-1])=1, "", RC[-5]) -> 
B66: 'Georgia | C66: 'GEO | D66: =IF(EQUAL(ComparativeCharts!R[+11]C, ""), "", 1) ->  | E66: =IF(EQUAL(ComparativeCharts!R[+11]C, ""), "", 1) -> #EMPTY! | O66: 59 | P66: 'United Arab Emirates | Q66: 'ARE | R66: -0.544677878751024 | S66: 0.254026944310672 | T66: =1.64*RC[-1] -> 0.416604188669502 | U66: =IF(EQUAL(VLOOKUP(RC[-4], R9C3:R186C4, 2, 0), 1), RC[-1], NA()) -> #ERR: ArgCount | V66: =IF(ISERROR(RC[-1])=1, "", RC[-5]) ->  | W66: 'Nicaragua | X66: 'NIC | Y66: -0.323439752696792 | Z66: 0.318733333730906 | AA66: =1.64*RC[-1] -> 0.522722667318686 | AB66: =IF(EQUAL(VLOOKUP(RC[-4], R9C3:R186C4, 2, 0), 1), RC[-1], NA()) -> #ERR: ArgCount | AC66: =IF(ISERROR(RC[-1])=1, "", RC[-5]) ->  | AD66: 'Togo | AE66: 'TGO | AF66: -0.374255414372595 | AG66: 0.510201183720256 | AH66: =1.64*RC[-1] -> 0.83672994130122 | AI66: =IF(EQUAL(VLOOKUP(RC[-4], R9C3:R186C4, 2, 0), 1), RC[-1], NA()) -> #ERR: ArgCount | AJ66: =IF(ISERROR(RC[-1])=1, "", RC[-5]) ->  | AK66: 'Saudi Arabia | AL66: 'SAU | AM66: -0.148667465205172 | AN66: 0.395254221998157 | AO66: =1.64*RC[-1] -> 0.648216924076978 | AP66: =IF(EQUAL(VLOOKUP(RC[-4], R9C3:R186C4, 2, 0), 1), RC[-1], NA()) -> #ERR: ArgCount | AQ66: =IF(ISERROR(RC[-1])=1, "", RC[-5]) ->  | AR66: 'Mexico | AS66: 'MEX | AT66: -0.474099202173582 | AU66: 0.207737275615815 | AV66: =1.64*RC[-1] -> 0.340689132009937 | AW66: =IF(EQUAL(VLOOKUP(RC[-4], R9C3:R186C4, 2, 0), 1), RC[-1], NA()) -> #ERR: ArgCount | AX66: =IF(ISERROR(RC[-1])=1, "", RC[-5]) ->  | AY66: 'Romania | AZ66: 'ROM | BA66: -0.457048134497524 | BB66: 0.189872273333828 | BC66: =1.64*RC[-1] -> 0.311390528267478 | BD66: =IF(EQUAL(VLOOKUP(RC[-4], R9C3:R186C4, 2, 0), 1), RC[-1], NA()) -> #ERR: ArgCount | BE66: =IF(ISERROR(RC[-1])=1, "", RC[-5]) -> 
B67: 'Ghana | C67: 'GHA | D67: =IF(EQUAL(ComparativeCharts!R[+11]C, ""), "", 1) ->  | E67: =IF(EQUAL(ComparativeCharts!R[+11]C, ""), "", 1) -> #EMPTY! | O67: 60 | P67: 'Belarus | Q67: 'BLR | R67: -0.52066192727356 | S67: 0.287283341236829 | T67: =1.64*RC[-1] -> 0.4711446796284 | U67: =IF(EQUAL(VLOOKUP(RC[-4], R9C3:R186C4, 2, 0), 1), RC[-1], NA()) -> #ERR: ArgCount | V67: =IF(ISERROR(RC[-1])=1, "", RC[-5]) ->  | W67: 'Brazil | X67: 'BRA | Y67: -0.322639211387269 | Z67: 0.25228486761248 | AA67: =1.64*RC[-1] -> 0.413747182884467 | AB67: =IF(EQUAL(VLOOKUP(RC[-4], R9C3:R186C4, 2, 0), 1), RC[-1], NA()) -> #ERR: ArgCount | AC67: =IF(ISERROR(RC[-1])=1, "", RC[-5]) ->  | AD67: 'Saudi Arabia | AE67: 'SAU | AF67: -0.348761573265872 | AG67: 0.289789143823299 | AH67: =1.64*RC[-1] -> 0.47525419587021 | AI67: =IF(EQUAL(VLOOKUP(RC[-4], R9C3:R186C4, 2, 0), 1), RC[-1], NA()) -> #ERR: ArgCount | AJ67: =IF(ISERROR(RC[-1])=1, "", RC[-5]) ->  | AK67: 'Kenya | AL67: 'KEN | AM67: -0.132835927210843 | AN67: 0.291187323849693 | AO67: =1.64*RC[-1] -> 0.477547211113496 | AP67: =IF(EQUAL(VLOOKUP(RC[-4], R9C3:R186C4, 2, 0), 1), RC[-1], NA()) -> #ERR: ArgCount | AQ67: =IF(ISERROR(RC[-1])=1, "", RC[-5]) ->  | AR67: 'Kyrgyz Republic | AS67: 'KGZ | AT67: -0.468046442966884 | AU67: 0.205660006207 | AV67: =1.64*RC[-1] -> 0.33728241017948 | AW67: =IF(EQUAL(VLOOKUP(RC[-4], R9C3:R186C4, 2, 0), 1), RC[-1], NA()) -> #ERR: ArgCount | AX67: =IF(ISERROR(RC[-1])=1, "", RC[-5]) ->  | AY67: 'Bolivia | AZ67: 'BOL | BA67: -0.437877194786039 | BB67: 0.232582183071991 | BC67: =1.64*RC[-1] -> 0.381434780238065 | BD67: =IF(EQUAL(VLOOKUP(RC[-4], R9C3:R186C4, 2, 0), 1), RC[-1], NA()) -> #ERR: ArgCount | BE67: =IF(ISERROR(RC[-1])=1, "", RC[-5]) -> 
B68: 'Guinea | C68: 'GIN | D68: =IF(EQUAL(ComparativeCharts!R[+11]C, ""), "", 1) ->  | E68: =IF(EQUAL(ComparativeCharts!R[+11]C, ""), "", 1) -> #EMPTY! | O68: 61 | P68: 'Uganda | Q68: 'UGA | R68: -0.517212047200734 | S68: 0.251300233223489 | T68: =1.64*RC[-1] -> 0.412132382486522 | U68: =IF(EQUAL(VLOOKUP(RC[-4], R9C3:R186C4, 2, 0), 1), RC[-1], NA()) -> #ERR: ArgCount | V68: =IF(ISERROR(RC[-1])=1, "", RC[-5]) ->  | W68: 'Mali | X68: 'MLI | Y68: -0.287150169282878 | Z68: 0.373502182114371 | AA68: =1.64*RC[-1] -> 0.612543578667568 | AB68: =IF(EQUAL(VLOOKUP(RC[-4], R9C3:R186C4, 2, 0), 1), RC[-1], NA()) -> #ERR: ArgCount | AC68: =IF(ISERROR(RC[-1])=1, "", RC[-5]) ->  | AD68: 'Iran, Islamic Rep. | AE68: 'IRN | AF68: -0.339435714161585 | AG68: 0.289789143823299 | AH68: =1.64*RC[-1] -> 0.47525419587021 | AI68: =IF(EQUAL(VLOOKUP(RC[-4], R9C3:R186C4, 2, 0), 1), RC[-1], NA()) -> #ERR: ArgCount | AJ68: =IF(ISERROR(RC[-1])=1, "", RC[-5]) ->  | AK68: 'Papua New Guinea | AL68: 'PNG | AM68: -0.128749806963586 | AN68: 0.519940958319459 | AO68: =1.64*RC[-1] -> 0.852703171643913 | AP68: =IF(EQUAL(VLOOKUP(RC[-4], R9C3:R186C4, 2, 0), 1), RC[-1], NA()) -> #ERR: ArgCount | AQ68: =IF(ISERROR(RC[-1])=1, "", RC[-5]) ->  | AR68: 'Mali | AS68: 'MLI | AT68: -0.465449721365578 | AU68: 0.371358506695114 | AV68: =1.64*RC[-1] -> 0.609027950979987 | AW68: =IF(EQUAL(VLOOKUP(RC[-4], R9C3:R186C4, 2, 0), 1), RC[-1], NA()) -> #ERR: ArgCount | AX68: =IF(ISERROR(RC[-1])=1, "", RC[-5]) ->  | AY68: 'Ethiopia | AZ68: 'ETH | BA68: -0.435581201667957 | BB68: 0.356841476720674 | BC68: =1.64*RC[-1] -> 0.585220021821905 | BD68: =IF(EQUAL(VLOOKUP(RC[-4], R9C3:R186C4, 2, 0), 1), RC[-1], NA()) -> #ERR: ArgCount | BE68: =IF(ISERROR(RC[-1])=1, "", RC[-5]) -> 
B69: 'Guadeloupe | C69: 'GLP | D69: =IF(EQUAL(ComparativeCharts!R[+11]C, ""), "", 1) ->  | E69: =IF(EQUAL(ComparativeCharts!R[+11]C, ""), "", 1) -> #EMPTY! | O69: 62 | P69: 'Ethiopia | Q69: 'ETH | R69: -0.499612494735302 | S69: 0.291377601755329 | T69: =1.64*RC[-1] -> 0.47785926687874 | U69: =IF(EQUAL(VLOOKUP(RC[-4], R9C3:R186C4, 2, 0), 1), RC[-1], NA()) -> #ERR: ArgCount | V69: =IF(ISERROR(RC[-1])=1, "", RC[-5]) ->  | W69: 'Lebanon | X69: 'LBN | Y69: -0.252012225748576 | Z69: 0.299881889042829 | AA69: =1.64*RC[-1] -> 0.49180629803024 | AB69: =IF(EQUAL(VLOOKUP(RC[-4], R9C3:R186C4, 2, 0), 1), RC[-1], NA()) -> #ERR: ArgCount | AC69: =IF(ISERROR(RC[-1])=1, "", RC[-5]) ->  | AD69: 'Guinea-Bissau | AE69: 'GNB | AF69: -0.334276821170571 | AG69: 0.510201183720256 | AH69: =1.64*RC[-1] -> 0.83672994130122 | AI69: =IF(EQUAL(VLOOKUP(RC[-4], R9C3:R186C4, 2, 0), 1), RC[-1], NA()) -> #ERR: ArgCount | AJ69: =IF(ISERROR(RC[-1])=1, "", RC[-5]) ->  | AK69: 'Nicaragua | AL69: 'NIC | AM69: -0.102506725806526 | AN69: 0.519940958319459 | AO69: =1.64*RC[-1] -> 0.852703171643913 | AP69: =IF(EQUAL(VLOOKUP(RC[-4], R9C3:R186C4, 2, 0), 1), RC[-1], NA()) -> #ERR: ArgCount | AQ69: =IF(ISERROR(RC[-1])=1, "", RC[-5]) ->  | AR69: 'Vietnam | AS69: 'VNM | AT69: -0.436516959441859 | AU69: 0.235420626980005 | AV69: =1.64*RC[-1] -> 0.386089828247208 | AW69: =IF(EQUAL(VLOOKUP(RC[-4], R9C3:R186C4, 2, 0), 1), RC[-1], NA()) -> #ERR: ArgCount | AX69: =IF(ISERROR(RC[-1])=1, "", RC[-5]) ->  | AY69: 'Lebanon | AZ69: 'LBN | BA69: -0.397068285369349 | BB69: 0.267063170408295 | BC69: =1.64*RC[-1] -> 0.437983599469604 | BD69: =IF(EQUAL(VLOOKUP(RC[-4], R9C3:R186C4, 2, 0), 1), RC[-1], NA()) -> #ERR: ArgCount | BE69: =IF(ISERROR(RC[-1])=1, "", RC[-5]) -> 
B70: 'Gambia, The | C70: 'GMB | D70: =IF(EQUAL(ComparativeCharts!R[+11]C, ""), "", 1) ->  | E70: =IF(EQUAL(ComparativeCharts!R[+11]C, ""), "", 1) -> #EMPTY! | O70: 63 | P70: 'Guinea-Bissau | Q70: 'GNB | R70: -0.453857012475429 | S70: 0.287283341236829 | T70: =1.64*RC[-1] -> 0.4711446796284 | U70: =IF(EQUAL(VLOOKUP(RC[-4], R9C3:R186C4, 2, 0), 1), RC[-1], NA()) -> #ERR: ArgCount | V70: =IF(ISERROR(RC[-1])=1, "", RC[-5]) ->  | W70: 'Venezuela, RB | X70: 'VEN | Y70: -0.249835470973892 | Z70: 0.25228486761248 | AA70: =1.64*RC[-1] -> 0.413747182884467 | AB70: =IF(EQUAL(VLOOKUP(RC[-4], R9C3:R186C4, 2, 0), 1), RC[-1], NA()) -> #ERR: ArgCount | AC70: =IF(ISERROR(RC[-1])=1, "", RC[-5]) ->  | AD70: 'Mozambique | AE70: 'MOZ | AF70: -0.330730753660258 | AG70: 0.287765041908437 | AH70: =1.64*RC[-1] -> 0.471934668729837 | AI70: =IF(EQUAL(VLOOKUP(RC[-4], R9C3:R186C4, 2, 0), 1), RC[-1], NA()) -> #ERR: ArgCount | AJ70: =IF(ISERROR(RC[-1])=1, "", RC[-5]) ->  | AK70: 'Kuwait | AL70: 'KWT | AM70: -0.0908855271209571 | AN70: 0.395254221998157 | AO70: =1.64*RC[-1] -> 0.648216924076978 | AP70: =IF(EQUAL(VLOOKUP(RC[-4], R9C3:R186C4, 2, 0), 1), RC[-1], NA()) -> #ERR: ArgCount | AQ70: =IF(ISERROR(RC[-1])=1, "", RC[-5]) ->  | AR70: 'Benin | AS70: 'BEN | AT70: -0.422063492719545 | AU70: 0.450388515286507 | AV70: =1.64*RC[-1] -> 0.738637165069871 | AW70: =IF(EQUAL(VLOOKUP(RC[-4], R9C3:R186C4, 2, 0), 1), RC[-1], NA()) -> #ERR: ArgCount | AX70: =IF(ISERROR(RC[-1])=1, "", RC[-5]) ->  | AY70: 'Moldova | AZ70: 'MDA | BA70: -0.386745507250578 | BB70: 0.188243145715436 | BC70: =1.64*RC[-1] -> 0.308718758973315 | BD70: =IF(EQUAL(VLOOKUP(RC[-4], R9C3:R186C4, 2, 0), 1), RC[-1], NA()) -> #ERR: ArgCount | BE70: =IF(ISERROR(RC[-1])=1, "", RC[-5]) -> 
B71: 'Guinea-Bissau | C71: 'GNB | D71: =IF(EQUAL(ComparativeCharts!R[+11]C, ""), "", 1) ->  | E71: =IF(EQUAL(ComparativeCharts!R[+11]C, ""), "", 1) -> #EMPTY! | O71: 64 | P71: 'Pakistan | Q71: 'PAK | R71: -0.440532409731667 | S71: 0.254026944310672 | T71: =1.64*RC[-1] -> 0.416604188669502 | U71: =IF(EQUAL(VLOOKUP(RC[-4], R9C3:R186C4, 2, 0), 1), RC[-1], NA()) -> #ERR: ArgCount | V71: =IF(ISERROR(RC[-1])=1, "", RC[-5]) ->  | W71: 'Ukraine | X71: 'UKR | Y71: -0.242016887073169 | Z71: 0.215915139092969 | AA71: =1.64*RC[-1] -> 0.354100828112469 | AB71: =IF(EQUAL(VLOOKUP(RC[-4], R9C3:R186C4, 2, 0), 1), RC[-1], NA()) -> #ERR: ArgCount | AC71: =IF(ISERROR(RC[-1])=1, "", RC[-5]) ->  | AD71: 'Korea, Dem. Rep. | AE71: 'PRK | AF71: -0.301415001757019 | AG71: 0.768168783719135 | AH71: =1.64*RC[-1] -> 1.25979680529938 | AI71: =IF(EQUAL(VLOOKUP(RC[-4], R9C3:R186C4, 2, 0), 1), RC[-1], NA()) -> #ERR: ArgCount | AJ71: =IF(ISERROR(RC[-1])=1, "", RC[-5]) ->  | AK71: 'Brunei | AL71: 'BRN | AM71: -0.084459085940385 | AN71: 0.718213521236258 | AO71: =1.64*RC[-1] -> 1.17787017482746 | AP71: =IF(EQUAL(VLOOKUP(RC[-4], R9C3:R186C4, 2, 0), 1), RC[-1], NA()) -> #ERR: ArgCount | AQ71: =IF(ISERROR(RC[-1])=1, "", RC[-5]) ->  | AR71: 'Malawi | AS71: 'MWI | AT71: -0.409023497718716 | AU71: 0.281106918332661 | AV71: =1.64*RC[-1] -> 0.461015346065564 | AW71: =IF(EQUAL(VLOOKUP(RC[-4], R9C3:R186C4, 2, 0), 1), RC[-1], NA()) -> #ERR: ArgCount | AX71: =IF(ISERROR(RC[-1])=1, "", RC[-5]) ->  | AY71: 'Burkina Faso | AZ71: 'BFA | BA71: -0.367644752844689 | BB71: 0.356841476720674 | BC71: =1.64*RC[-1] -> 0.585220021821905 | BD71: =IF(EQUAL(VLOOKUP(RC[-4], R9C3:R186C4, 2, 0), 1), RC[-1], NA()) -> #ERR: ArgCount | BE71: =IF(ISERROR(RC[-1])=1, "", RC[-5]) -> 
B72: 'Equatorial Guinea | C72: 'GNQ | D72: =IF(EQUAL(ComparativeCharts!R[+11]C, ""), "", 1) ->  | E72: =IF(EQUAL(ComparativeCharts!R[+11]C, ""), "", 1) -> #EMPTY! | O72: 65 | P72: 'Ghana | Q72: 'GHA | R72: -0.434661002693491 | S72: 0.251300233223489 | T72: =1.64*RC[-1] -> 0.412132382486522 | U72: =IF(EQUAL(VLOOKUP(RC[-4], R9C3:R186C4, 2, 0), 1), RC[-1], NA()) -> #ERR: ArgCount | V72: =IF(ISERROR(RC[-1])=1, "", RC[-5]) ->  | W72: 'Moldova | X72: 'MDA | Y72: -0.195945354579978 | Z72: 0.234722074427469 | AA72: =1.64*RC[-1] -> 0.384944202061049 | AB72: =IF(EQUAL(VLOOKUP(RC[-4], R9C3:R186C4, 2, 0), 1), RC[-1], NA()) -> #ERR: ArgCount | AC72: =IF(ISERROR(RC[-1])=1, "", RC[-5]) ->  | AD72: 'Vietnam | AE72: 'VNM | AF72: -0.29986293839708 | AG72: 0.259863410851066 | AH72: =1.64*RC[-1] -> 0.426175993795748 | AI72: =IF(EQUAL(VLOOKUP(RC[-4], R9C3:R186C4, 2, 0), 1), RC[-1], NA()) -> #ERR: ArgCount | AJ72: =IF(ISERROR(RC[-1])=1, "", RC[-5]) ->  | AK72: 'Benin | AL72: 'BEN | AM72: -0.0815373982100847 | AN72: 0.596740942900482 | AO72: =1.64*RC[-1] -> 0.97865514635679 | AP72: =IF(EQUAL(VLOOKUP(RC[-4], R9C3:R186C4, 2, 0), 1), RC[-1], NA()) -> #ERR: ArgCount | AQ72: =IF(ISERROR(RC[-1])=1, "", RC[-5]) ->  | AR72: 'Zambia | AS72: 'ZMB | AT72: -0.401677758732015 | AU72: 0.253185404132827 | AV72: =1.64*RC[-1] -> 0.415224062777836 | AW72: =IF(EQUAL(VLOOKUP(RC[-4], R9C3:R186C4, 2, 0), 1), RC[-1], NA()) -> #ERR: ArgCount | AX72: =IF(ISERROR(RC[-1])=1, "", RC[-5]) ->  | AY72: 'El Salvador | AZ72: 'SLV | BA72: -0.353565539174854 | BB72: 0.223471923841265 | BC72: =1.64*RC[-1] -> 0.366493955099675 | BD72: =IF(EQUAL(VLOOKUP(RC[-4], R9C3:R186C4, 2, 0), 1), RC[-1], NA()) -> #ERR: ArgCount | BE72: =IF(ISERROR(RC[-1])=1, "", RC[-5]) -> 
B73: 'Greece | C73: 'GRC | D73: =IF(EQUAL(ComparativeCharts!R[+11]C, ""), "", 1) ->  | E73: =IF(EQUAL(ComparativeCharts!R[+11]C, ""), "", 1) -> #EMPTY! | O73: 66 | P73: 'Paraguay | Q73: 'PRY | R73: -0.419146936279834 | S73: 0.251300233223489 | T73: =1.64*RC[-1] -> 0.412132382486522 | U73: =IF(EQUAL(VLOOKUP(RC[-4], R9C3:R186C4, 2, 0), 1), RC[-1], NA()) -> #ERR: ArgCount | V73: =IF(ISERROR(RC[-1])=1, "", RC[-5]) ->  | W73: 'Guyana | X73: 'GUY | Y73: -0.195350404297996 | Z73: 0.412522842574475 | AA73: =1.64*RC[-1] -> 0.676537461822139 | AB73: =IF(EQUAL(VLOOKUP(RC[-4], R9C3:R186C4, 2, 0), 1), RC[-1], NA()) -> #ERR: ArgCount | AC73: =IF(ISERROR(RC[-1])=1, "", RC[-5]) ->  | AD73: 'Madagascar | AE73: 'MDG | AF73: -0.294575927837347 | AG73: 0.385123284441522 | AH73: =1.64*RC[-1] -> 0.631602186484096 | AI73: =IF(EQUAL(VLOOKUP(RC[-4], R9C3:R186C4, 2, 0), 1), RC[-1], NA()) -> #ERR: ArgCount | AJ73: =IF(ISERROR(RC[-1])=1, "", RC[-5]) ->  | AK73: 'China | AL73: 'CHN | AM73: -0.0700845393572666 | AN73: 0.2290464009857 | AO73: =1.64*RC[-1] -> 0.375636097616548 | AP73: =IF(EQUAL(VLOOKUP(RC[-4], R9C3:R186C4, 2, 0), 1), RC[-1], NA()) -> #ERR: ArgCount | AQ73: =IF(ISERROR(RC[-1])=1, "", RC[-5]) ->  | AR73: 'Panama | AS73: 'PAN | AT73: -0.391910923451687 | AU73: 0.276349686366578 | AV73: =1.64*RC[-1] -> 0.453213485641188 | AW73: =IF(EQUAL(VLOOKUP(RC[-4], R9C3:R186C4, 2, 0), 1), RC[-1], NA()) -> #ERR: ArgCount | AX73: =IF(ISERROR(RC[-1])=1, "", RC[-5]) ->  | AY73: 'Bosnia and Herzegovina | AZ73: 'BIH | BA73: -0.352523582662853 | BB73: 0.455027094976652 | BC73: =1.64*RC[-1] -> 0.746244435761709 | BD73: =IF(EQUAL(VLOOKUP(RC[-4], R9C3:R186C4, 2, 0), 1), RC[-1], NA()) -> #ERR: ArgCount | BE73: =IF(ISERROR(RC[-1])=1, "", RC[-5]) -> 
B74: 'Guatemala | C74: 'GTM | D74: =IF(EQUAL(ComparativeCharts!R[+11]C, ""), "", 1) ->  | E74: =IF(EQUAL(ComparativeCharts!R[+11]C, ""), "", 1) -> #EMPTY! | O74: 67 | P74: 'Yemen, Rep. | Q74: 'YEM | R74: -0.414687285701034 | S74: 0.254026944310672 | T74: =1.64*RC[-1] -> 0.416604188669502 | U74: =IF(EQUAL(VLOOKUP(RC[-4], R9C3:R186C4, 2, 0), 1), RC[-1], NA()) -> #ERR: ArgCount | V74: =IF(ISERROR(RC[-1])=1, "", RC[-5]) ->  | W74: 'Suriname | X74: 'SUR | Y74: -0.195350404297996 | Z74: 0.412522842574475 | AA74: =1.64*RC[-1] -> 0.676537461822139 | AB74: =IF(EQUAL(VLOOKUP(RC[-4], R9C3:R186C4, 2, 0), 1), RC[-1], NA()) -> #ERR: ArgCount | AC74: =IF(ISERROR(RC[-1])=1, "", RC[-5]) ->  | AD74: 'Ghana | AE74: 'GHA | AF74: -0.28677755680362 | AG74: 0.222481788006156 | AH74: =1.64*RC[-1] -> 0.364870132330096 | AI74: =IF(EQUAL(VLOOKUP(RC[-4], R9C3:R186C4, 2, 0), 1), RC[-1], NA()) -> #ERR: ArgCount | AJ74: =IF(ISERROR(RC[-1])=1, "", RC[-5]) ->  | AK74: 'Lesotho | AL74: 'LSO | AM74: -0.0579047841038158 | AN74: 0.351244204676472 | AO74: =1.64*RC[-1] -> 0.576040495669414 | AP74: =IF(EQUAL(VLOOKUP(RC[-4], R9C3:R186C4, 2, 0), 1), RC[-1], NA()) -> #ERR: ArgCount | AQ74: =IF(ISERROR(RC[-1])=1, "", RC[-5]) ->  | AR74: 'Iran, Islamic Rep. | AS74: 'IRN | AT74: -0.364240805690651 | AU74: 0.256388157194472 | AV74: =1.64*RC[-1] -> 0.420476577798934 | AW74: =IF(EQUAL(VLOOKUP(RC[-4], R9C3:R186C4, 2, 0), 1), RC[-1], NA()) -> #ERR: ArgCount | AX74: =IF(ISERROR(RC[-1])=1, "", RC[-5]) ->  | AY74: 'Turkey | AZ74: 'TUR | BA74: -0.348869934892435 | BB74: 0.189092987537097 | BC74: =1.64*RC[-1] -> 0.310112499560839 | BD74: =IF(EQUAL(VLOOKUP(RC[-4], R9C3:R186C4, 2, 0), 1), RC[-1], NA()) -> #ERR: ArgCount | BE74: =IF(ISERROR(RC[-1])=1, "", RC[-5]) -> 
B75: 'Guyana | C75: 'GUY | D75: =IF(EQUAL(ComparativeCharts!R[+11]C, ""), "", 1) ->  | E75: =IF(EQUAL(ComparativeCharts!R[+11]C, ""), "", 1) -> #EMPTY! | O75: 68 | P75: 'Lebanon | Q75: 'LBN | R75: -0.404267448971055 | S75: 0.254026944310672 | T75: =1.64*RC[-1] -> 0.416604188669502 | U75: =IF(EQUAL(VLOOKUP(RC[-4], R9C3:R186C4, 2, 0), 1), RC[-1], NA()) -> #ERR: ArgCount | V75: =IF(ISERROR(RC[-1])=1, "", RC[-5]) ->  | W75: 'Bolivia | X75: 'BOL | Y75: -0.142648055593531 | Z75: 0.283845617478955 | AA75: =1.64*RC[-1] -> 0.465506812665486 | AB75: =IF(EQUAL(VLOOKUP(RC[-4], R9C3:R186C4, 2, 0), 1), RC[-1], NA()) -> #ERR: ArgCount | AC75: =IF(ISERROR(RC[-1])=1, "", RC[-5]) ->  | AD75: 'Panama | AE75: 'PAN | AF75: -0.27657204063012 | AG75: 0.319089592041234 | AH75: =1.64*RC[-1] -> 0.523306930947624 | AI75: =IF(EQUAL(VLOOKUP(RC[-4], R9C3:R186C4, 2, 0), 1), RC[-1], NA()) -> #ERR: ArgCount | AJ75: =IF(ISERROR(RC[-1])=1, "", RC[-5]) ->  | AK75: 'India | AL75: 'IND | AM75: -0.0399745175792802 | AN75: 0.228760003290238 | AO75: =1.64*RC[-1] -> 0.37516640539599 | AP75: =IF(EQUAL(VLOOKUP(RC[-4], R9C3:R186C4, 2, 0), 1), RC[-1], NA()) -> #ERR: ArgCount | AQ75: =IF(ISERROR(RC[-1])=1, "", RC[-5]) ->  | AR75: 'Sri Lanka | AS75: 'LKA | AT75: -0.361258427755227 | AU75: 0.276349686366578 | AV75: =1.64*RC[-1] -> 0.453213485641188 | AW75: =IF(EQUAL(VLOOKUP(RC[-4], R9C3:R186C4, 2, 0), 1), RC[-1], NA()) -> #ERR: ArgCount | AX75: =IF(ISERROR(RC[-1])=1, "", RC[-5]) ->  | AY75: 'Vietnam | AZ75: 'VNM | BA75: -0.331907448918534 | BB75: 0.173483069998777 | BC75: =1.64*RC[-1] -> 0.284512234797994 | BD75: =IF(EQUAL(VLOOKUP(RC[-4], R9C3:R186C4, 2, 0), 1), RC[-1], NA()) -> #ERR: ArgCount | BE75: =IF(ISERROR(RC[-1])=1, "", RC[-5]) -> 
B76: 'Hong Kong, China | C76: 'HKG | D76: =IF(EQUAL(ComparativeCharts!R[+11]C, ""), "", 1) ->  | E76: =IF(EQUAL(ComparativeCharts!R[+11]C, ""), "", 1) -> #EMPTY! | O76: 69 | P76: 'Croatia | Q76: 'HRV | R76: -0.323228801236218 | S76: 0.254026944310672 | T76: =1.64*RC[-1] -> 0.416604188669502 | U76: =IF(EQUAL(VLOOKUP(RC[-4], R9C3:R186C4, 2, 0), 1), RC[-1], NA()) -> #ERR: ArgCount | V76: =IF(ISERROR(RC[-1])=1, "", RC[-5]) ->  | W76: 'Cote d'Ivoire | X76: 'CIV | Y76: -0.137833534917085 | Z76: 0.265998113597101 | AA76: =1.64*RC[-1] -> 0.436236906299246 | AB76: =IF(EQUAL(VLOOKUP(RC[-4], R9C3:R186C4, 2, 0), 1), RC[-1], NA()) -> #ERR: ArgCount | AC76: =IF(ISERROR(RC[-1])=1, "", RC[-5]) ->  | AD76: 'India | AE76: 'IND | AF76: -0.263746865236554 | AG76: 0.233636532185851 | AH76: =1.64*RC[-1] -> 0.383163912784796 | AI76: =IF(EQUAL(VLOOKUP(RC[-4], R9C3:R186C4, 2, 0), 1), RC[-1], NA()) -> #ERR: ArgCount | AJ76: =IF(ISERROR(RC[-1])=1, "", RC[-5]) ->  | AK76: 'Burkina Faso | AL76: 'BFA | AM76: -0.0378297590758971 | AN76: 0.332518638661452 | AO76: =1.64*RC[-1] -> 0.545330567404781 | AP76: =IF(EQUAL(VLOOKUP(RC[-4], R9C3:R186C4, 2, 0), 1), RC[-1], NA()) -> #ERR: ArgCount | AQ76: =IF(ISERROR(RC[-1])=1, "", RC[-5]) ->  | AR76: 'Bolivia | AS76: 'BOL | AT76: -0.354505374998751 | AU76: 0.25605974956246 | AV76: =1.64*RC[-1] -> 0.419937989282434 | AW76: =IF(EQUAL(VLOOKUP(RC[-4], R9C3:R186C4, 2, 0), 1), RC[-1], NA()) -> #ERR: ArgCount | AX76: =IF(ISERROR(RC[-1])=1, "", RC[-5]) ->  | AY76: 'Zimbabwe | AZ76: 'ZWE | BA76: -0.318733410145107 | BB76: 0.184601980331938 | BC76: =1.64*RC[-1] -> 0.302747247744378 | BD76: =IF(EQUAL(VLOOKUP(RC[-4], R9C3:R186C4, 2, 0), 1), RC[-1], NA()) -> #ERR: ArgCount | BE76: =IF(ISERROR(RC[-1])=1, "", RC[-5]) -> 
B77: 'Honduras | C77: 'HND | D77: =IF(EQUAL(ComparativeCharts!R[+11]C, ""), "", 1) ->  | E77: =IF(EQUAL(ComparativeCharts!R[+11]C, ""), "", 1) -> #EMPTY! | O77: 70 | P77: 'Gabon | Q77: 'GAB | R77: -0.314098912982618 | S77: 0.254026944310672 | T77: =1.64*RC[-1] -> 0.416604188669502 | U77: =IF(EQUAL(VLOOKUP(RC[-4], R9C3:R186C4, 2, 0), 1), RC[-1], NA()) -> #ERR: ArgCount | V77: =IF(ISERROR(RC[-1])=1, "", RC[-5]) ->  | W77: 'Ghana | X77: 'GHA | Y77: -0.101071613093776 | Z77: 0.265998113597101 | AA77: =1.64*RC[-1] -> 0.436236906299246 | AB77: =IF(EQUAL(VLOOKUP(RC[-4], R9C3:R186C4, 2, 0), 1), RC[-1], NA()) -> #ERR: ArgCount | AC77: =IF(ISERROR(RC[-1])=1, "", RC[-5]) ->  | AD77: 'El Salvador | AE77: 'SLV | AF77: -0.261794858747202 | AG77: 0.374142364422074 | AH77: =1.64*RC[-1] -> 0.613593477652201 | AI77: =IF(EQUAL(VLOOKUP(RC[-4], R9C3:R186C4, 2, 0), 1), RC[-1], NA()) -> #ERR: ArgCount | AJ77: =IF(ISERROR(RC[-1])=1, "", RC[-5]) ->  | AK77: 'Cambodia | AL77: 'KHM | AM77: -0.0357658788681192 | AN77: 0.601880844424266 | AO77: =1.64*RC[-1] -> 0.987084584855796 | AP77: =IF(EQUAL(VLOOKUP(RC[-4], R9C3:R186C4, 2, 0), 1), RC[-1], NA()) -> #ERR: ArgCount | AQ77: =IF(ISERROR(RC[-1])=1, "", RC[-5]) ->  | AR77: 'South Africa | AS77: 'ZAF | AT77: -0.351418352832009 | AU77: 0.206193595572351 | AV77: =1.64*RC[-1] -> 0.338157496738656 | AW77: =IF(EQUAL(VLOOKUP(RC[-4], R9C3:R186C4, 2, 0), 1), RC[-1], NA()) -> #ERR: ArgCount | AX77: =IF(ISERROR(RC[-1])=1, "", RC[-5]) ->  | AY77: 'India | AZ77: 'IND | BA77: -0.305840656932275 | BB77: 0.154823207917754 | BC77: =1.64*RC[-1] -> 0.253910060985117 | BD77: =IF(EQUAL(VLOOKUP(RC[-4], R9C3:R186C4, 2, 0), 1), RC[-1], NA()) -> #ERR: ArgCount | BE77: =IF(ISERROR(RC[-1])=1, "", RC[-5]) -> 
B78: 'Croatia | C78: 'HRV | D78: =IF(EQUAL(ComparativeCharts!R[+11]C, ""), "", 1) ->  | E78: =IF(EQUAL(ComparativeCharts!R[+11]C, ""), "", 1) -> #EMPTY! | O78: 71 | P78: 'Russian Federation | Q78: 'RUS | R78: -0.311268438016976 | S78: 0.251300233223489 | T78: =1.64*RC[-1] -> 0.412132382486522 | U78: =IF(EQUAL(VLOOKUP(RC[-4], R9C3:R186C4, 2, 0), 1), RC[-1], NA()) -> #ERR: ArgCount | V78: =IF(ISERROR(RC[-1])=1, "", RC[-5]) ->  | W78: 'Bahrain | X78: 'BHR | Y78: -0.0768977944707331 | Z78: 0.299881889042829 | AA78: =1.64*RC[-1] -> 0.49180629803024 | AB78: =IF(EQUAL(VLOOKUP(RC[-4], R9C3:R186C4, 2, 0), 1), RC[-1], NA()) -> #ERR: ArgCount | AC78: =IF(ISERROR(RC[-1])=1, "", RC[-5]) ->  | AD78: 'Uganda | AE78: 'UGA | AF78: -0.250578985761329 | AG78: 0.222481788006156 | AH78: =1.64*RC[-1] -> 0.364870132330096 | AI78: =IF(EQUAL(VLOOKUP(RC[-4], R9C3:R186C4, 2, 0), 1), RC[-1], NA()) -> #ERR: ArgCount | AJ78: =IF(ISERROR(RC[-1])=1, "", RC[-5]) ->  | AK78: 'Ethiopia | AL78: 'ETH | AM78: -0.0334036157632457 | AN78: 0.332518638661452 | AO78: =1.64*RC[-1] -> 0.545330567404781 | AP78: =IF(EQUAL(VLOOKUP(RC[-4], R9C3:R186C4, 2, 0), 1), RC[-1], NA()) -> #ERR: ArgCount | AQ78: =IF(ISERROR(RC[-1])=1, "", RC[-5]) ->  | AR78: 'Burkina Faso | AS78: 'BFA | AT78: -0.350050124395757 | AU78: 0.428662080608825 | AV78: =1.64*RC[-1] -> 0.703005812198473 | AW78: =IF(EQUAL(VLOOKUP(RC[-4], R9C3:R186C4, 2, 0), 1), RC[-1], NA()) -> #ERR: ArgCount | AX78: =IF(ISERROR(RC[-1])=1, "", RC[-5]) ->  | AY78: 'Ghana | AZ78: 'GHA | BA78: -0.301476970023552 | BB78: 0.210520528590018 | BC78: =1.64*RC[-1] -> 0.345253666887629 | BD78: =IF(EQUAL(VLOOKUP(RC[-4], R9C3:R186C4, 2, 0), 1), RC[-1], NA()) -> #ERR: ArgCount | BE78: =IF(ISERROR(RC[-1])=1, "", RC[-5]) -> 
B79: 'Haiti | C79: 'HTI | D79: =IF(EQUAL(ComparativeCharts!R[+11]C, ""), "", 1) ->  | E79: =IF(EQUAL(ComparativeCharts!R[+11]C, ""), "", 1) -> #EMPTY! | O79: 72 | P79: 'Senegal | Q79: 'SEN | R79: -0.291712884150454 | S79: 0.251300233223489 | T79: =1.64*RC[-1] -> 0.412132382486522 | U79: =IF(EQUAL(VLOOKUP(RC[-4], R9C3:R186C4, 2, 0), 1), RC[-1], NA()) -> #ERR: ArgCount | V79: =IF(ISERROR(RC[-1])=1, "", RC[-5]) ->  | W79: 'Egypt, Arab Rep. | X79: 'EGY | Y79: -0.0665396321987393 | Z79: 0.248905722575756 | AA79: =1.64*RC[-1] -> 0.40820538502424 | AB79: =IF(EQUAL(VLOOKUP(RC[-4], R9C3:R186C4, 2, 0), 1), RC[-1], NA()) -> #ERR: ArgCount | AC79: =IF(ISERROR(RC[-1])=1, "", RC[-5]) ->  | AD79: 'Guatemala | AE79: 'GTM | AF79: -0.225018245789411 | AG79: 0.374142364422074 | AH79: =1.64*RC[-1] -> 0.613593477652201 | AI79: =IF(EQUAL(VLOOKUP(RC[-4], R9C3:R186C4, 2, 0), 1), RC[-1], NA()) -> #ERR: ArgCount | AJ79: =IF(ISERROR(RC[-1])=1, "", RC[-5]) ->  | AK79: 'Malawi | AL79: 'MWI | AM79: 0.0808264782818315 | AN79: 0.331644165648542 | AO79: =1.64*RC[-1] -> 0.543896431663609 | AP79: =IF(EQUAL(VLOOKUP(RC[-4], R9C3:R186C4, 2, 0), 1), RC[-1], NA()) -> #ERR: ArgCount | AQ79: =IF(ISERROR(RC[-1])=1, "", RC[-5]) ->  | AR79: 'Cote d'Ivoire | AS79: 'CIV | AT79: -0.334826948361111 | AU79: 0.253185404132827 | AV79: =1.64*RC[-1] -> 0.415224062777836 | AW79: =IF(EQUAL(VLOOKUP(RC[-4], R9C3:R186C4, 2, 0), 1), RC[-1], NA()) -> #ERR: ArgCount | AX79: =IF(ISERROR(RC[-1])=1, "", RC[-5]) ->  | AY79: 'Bangladesh | AZ79: 'BGD | BA79: -0.289109466432692 | BB79: 0.267063170408295 | BC79: =1.64*RC[-1] -> 0.437983599469604 | BD79: =IF(EQUAL(VLOOKUP(RC[-4], R9C3:R186C4, 2, 0), 1), RC[-1], NA()) -> #ERR: ArgCount | BE79: =IF(ISERROR(RC[-1])=1, "", RC[-5]) -> 
B80: 'Hungary | C80: 'HUN | D80: =IF(EQUAL(ComparativeCharts!R[+11]C, ""), "", 1) ->  | E80: =IF(EQUAL(ComparativeCharts!R[+11]C, ""), "", 1) -> #EMPTY! | O80: 73 | P80: 'Georgia | Q80: 'GEO | R80: -0.291267640815027 | S80: 0.352657522321209 | T80: =1.64*RC[-1] -> 0.578358336606783 | U80: =IF(EQUAL(VLOOKUP(RC[-4], R9C3:R186C4, 2, 0), 1), RC[-1], NA()) -> #ERR: ArgCount | V80: =IF(ISERROR(RC[-1])=1, "", RC[-5]) ->  | W80: 'Jordan | X80: 'JOR | Y80: -0.0568771748696522 | Z80: 0.269879776011692 | AA80: =1.64*RC[-1] -> 0.442602832659175 | AB80: =IF(EQUAL(VLOOKUP(RC[-4], R9C3:R186C4, 2, 0), 1), RC[-1], NA()) -> #ERR: ArgCount | AC80: =IF(ISERROR(RC[-1])=1, "", RC[-5]) ->  | AD80: 'Bolivia | AE80: 'BOL | AF80: -0.222923544964092 | AG80: 0.259334359872279 | AH80: =1.64*RC[-1] -> 0.425308350190538 | AI80: =IF(EQUAL(VLOOKUP(RC[-4], R9C3:R186C4, 2, 0), 1), RC[-1], NA()) -> #ERR: ArgCount | AJ80: =IF(ISERROR(RC[-1])=1, "", RC[-5]) ->  | AK80: 'Honduras | AL80: 'HND | AM80: 0.0814994531786482 | AN80: 0.519940958319459 | AO80: =1.64*RC[-1] -> 0.852703171643913 | AP80: =IF(EQUAL(VLOOKUP(RC[-4], R9C3:R186C4, 2, 0), 1), RC[-1], NA()) -> #ERR: ArgCount | AQ80: =IF(ISERROR(RC[-1])=1, "", RC[-5]) ->  | AR80: 'Papua New Guinea | AS80: 'PNG | AT80: -0.306877789041285 | AU80: 0.313894625236573 | AV80: =1.64*RC[-1] -> 0.51478718538798 | AW80: =IF(EQUAL(VLOOKUP(RC[-4], R9C3:R186C4, 2, 0), 1), RC[-1], NA()) -> #ERR: ArgCount | AX80: =IF(ISERROR(RC[-1])=1, "", RC[-5]) ->  | AY80: 'China | AZ80: 'CHN | BA80: -0.288973408136912 | BB80: 0.163839744115479 | BC80: =1.64*RC[-1] -> 0.268697180349386 | BD80: =IF(EQUAL(VLOOKUP(RC[-4], R9C3:R186C4, 2, 0), 1), RC[-1], NA()) -> #ERR: ArgCount | BE80: =IF(ISERROR(RC[-1])=1, "", RC[-5]) -> 
B81: 'Indonesia | C81: 'IDN | D81: =IF(EQUAL(ComparativeCharts!R[+11]C, ""), "", 1) -> 1 | E81: =IF(EQUAL(ComparativeCharts!R[+11]C, ""), "", 1) -> #EMPTY! | O81: 74 | P81: 'Tanzania | Q81: 'TZA | R81: -0.283456700998943 | S81: 0.251300233223489 | T81: =1.64*RC[-1] -> 0.412132382486522 | U81: =IF(EQUAL(VLOOKUP(RC[-4], R9C3:R186C4, 2, 0), 1), RC[-1], NA()) -> #ERR: ArgCount | V81: =IF(ISERROR(RC[-1])=1, "", RC[-5]) ->  | W81: 'India | X81: 'IND | Y81: -0.0366081057492088 | Z81: 0.25228486761248 | AA81: =1.64*RC[-1] -> 0.413747182884467 | AB81: =IF(EQUAL(VLOOKUP(RC[-4], R9C3:R186C4, 2, 0), 1), RC[-1], NA()) -> #ERR: ArgCount | AC81: =IF(ISERROR(RC[-1])=1, "", RC[-5]) ->  | AD81: 'Brazil | AE81: 'BRA | AF81: -0.219935432407603 | AG81: 0.233636532185851 | AH81: =1.64*RC[-1] -> 0.383163912784796 | AI81: =IF(EQUAL(VLOOKUP(RC[-4], R9C3:R186C4, 2, 0), 1), RC[-1], NA()) -> #ERR: ArgCount | AJ81: =IF(ISERROR(RC[-1])=1, "", RC[-5]) ->  | AK81: 'Lithuania | AL81: 'LTU | AM81: 0.0891758476080636 | AN81: 0.262826647914669 | AO81: =1.64*RC[-1] -> 0.431035702580057 | AP81: =IF(EQUAL(VLOOKUP(RC[-4], R9C3:R186C4, 2, 0), 1), RC[-1], NA()) -> #ERR: ArgCount | AQ81: =IF(ISERROR(RC[-1])=1, "", RC[-5]) ->  | AR81: 'Syrian Arab Republic | AS81: 'SYR | AT81: -0.290813878387835 | AU81: 0.276349686366578 | AV81: =1.64*RC[-1] -> 0.453213485641188 | AW81: =IF(EQUAL(VLOOKUP(RC[-4], R9C3:R186C4, 2, 0), 1), RC[-1], NA()) -> #ERR: ArgCount | AX81: =IF(ISERROR(RC[-1])=1, "", RC[-5]) ->  | AY81: 'Mexico | AZ81: 'MEX | BA81: -0.277126174657681 | BB81: 0.196208208436663 | BC81: =1.64*RC[-1] -> 0.321781461836127 | BD81: =IF(EQUAL(VLOOKUP(RC[-4], R9C3:R186C4, 2, 0), 1), RC[-1], NA()) -> #ERR: ArgCount | BE81: =IF(ISERROR(RC[-1])=1, "", RC[-5]) -> 
B82: 'India | C82: 'IND | D82: =IF(EQUAL(ComparativeCharts!R[+11]C, ""), "", 1) ->  | E82: =IF(EQUAL(ComparativeCharts!R[+11]C, ""), "", 1) -> #EMPTY! | O82: 75 | P82: 'Kyrgyz Republic | Q82: 'KGZ | R82: -0.247683804199477 | S82: 0.352657522321209 | T82: =1.64*RC[-1] -> 0.578358336606783 | U82: =IF(EQUAL(VLOOKUP(RC[-4], R9C3:R186C4, 2, 0), 1), RC[-1], NA()) -> #ERR: ArgCount | V82: =IF(ISERROR(RC[-1])=1, "", RC[-5]) ->  | W82: 'El Salvador | X82: 'SLV | Y82: -0.0212178785543271 | Z82: 0.318733333730906 | AA82: =1.64*RC[-1] -> 0.522722667318686 | AB82: =IF(EQUAL(VLOOKUP(RC[-4], R9C3:R186C4, 2, 0), 1), RC[-1], NA()) -> #ERR: ArgCount | AC82: =IF(ISERROR(RC[-1])=1, "", RC[-5]) ->  | AD82: 'Cote d'Ivoire | AE82: 'CIV | AF82: -0.180413277076371 | AG82: 0.240407962423765 | AH82: =1.64*RC[-1] -> 0.394269058374975 | AI82: =IF(EQUAL(VLOOKUP(RC[-4], R9C3:R186C4, 2, 0), 1), RC[-1], NA()) -> #ERR: ArgCount | AJ82: =IF(ISERROR(RC[-1])=1, "", RC[-5]) ->  | AK82: 'Venezuela, RB | AL82: 'VEN | AM82: 0.0895074024329068 | AN82: 0.228760003290238 | AO82: =1.64*RC[-1] -> 0.37516640539599 | AP82: =IF(EQUAL(VLOOKUP(RC[-4], R9C3:R186C4, 2, 0), 1), RC[-1], NA()) -> #ERR: ArgCount | AQ82: =IF(ISERROR(RC[-1])=1, "", RC[-5]) ->  | AR82: 'Macedonia, FYR | AS82: 'MKD | AT82: -0.25634400865698 | AU82: 0.204206082056129 | AV82: =1.64*RC[-1] -> 0.334897974572052 | AW82: =IF(EQUAL(VLOOKUP(RC[-4], R9C3:R186C4, 2, 0), 1), RC[-1], NA()) -> #ERR: ArgCount | AX82: =IF(ISERROR(RC[-1])=1, "", RC[-5]) ->  | AY82: 'Argentina | AZ82: 'ARG | BA82: -0.274547508176613 | BB82: 0.198055085748779 | BC82: =1.64*RC[-1] -> 0.324810340627998 | BD82: =IF(EQUAL(VLOOKUP(RC[-4], R9C3:R186C4, 2, 0), 1), RC[-1], NA()) -> #ERR: ArgCount | BE82: =IF(ISERROR(RC[-1])=1, "", RC[-5]) -> 
B83: 'Ireland | C83: 'IRL | D83: =IF(EQUAL(ComparativeCharts!R[+11]C, ""), "", 1) ->  | E83: =IF(EQUAL(ComparativeCharts!R[+11]C, ""), "", 1) -> #EMPTY! | O83: 76 | P83: 'Morocco | Q83: 'MAR | R83: -0.23955570403641 | S83: 0.251300233223489 | T83: =1.64*RC[-1] -> 0.412132382486522 | U83: =IF(EQUAL(VLOOKUP(RC[-4], R9C3:R186C4, 2, 0), 1), RC[-1], NA()) -> #ERR: ArgCount | V83: =IF(ISERROR(RC[-1])=1, "", RC[-5]) ->  | W83: 'Zambia | X83: 'ZMB | Y83: -0.00178185104964755 | Z83: 0.265998113597101 | AA83: =1.64*RC[-1] -> 0.436236906299246 | AB83: =IF(EQUAL(VLOOKUP(RC[-4], R9C3:R186C4, 2, 0), 1), RC[-1], NA()) -> #ERR: ArgCount | AC83: =IF(ISERROR(RC[-1])=1, "", RC[-5]) ->  | AD83: 'Ethiopia | AE83: 'ETH | AF83: -0.146438712967353 | AG83: 0.317355502507267 | AH83: =1.64*RC[-1] -> 0.520463024111918 | AI83: =IF(EQUAL(VLOOKUP(RC[-4], R9C3:R186C4, 2, 0), 1), RC[-1], NA()) -> #ERR: ArgCount | AJ83: =IF(ISERROR(RC[-1])=1, "", RC[-5]) ->  | AK83: 'Lebanon | AL83: 'LBN | AM83: 0.102251050878655 | AN83: 0.395254221998157 | AO83: =1.64*RC[-1] -> 0.648216924076978 | AP83: =IF(EQUAL(VLOOKUP(RC[-4], R9C3:R186C4, 2, 0), 1), RC[-1], NA()) -> #ERR: ArgCount | AQ83: =IF(ISERROR(RC[-1])=1, "", RC[-5]) ->  | AR83: 'Lesotho | AS83: 'LSO | AT83: -0.239871113462037 | AU83: 0.56608033832539 | AV83: =1.64*RC[-1] -> 0.928371754853639 | AW83: =IF(EQUAL(VLOOKUP(RC[-4], R9C3:R186C4, 2, 0), 1), RC[-1], NA()) -> #ERR: ArgCount | AX83: =IF(ISERROR(RC[-1])=1, "", RC[-5]) ->  | AY83: 'Egypt, Arab Rep. | AZ83: 'EGY | BA83: -0.267460622203097 | BB83: 0.197856749202811 | BC83: =1.64*RC[-1] -> 0.32448506869261 | BD83: =IF(EQUAL(VLOOKUP(RC[-4], R9C3:R186C4, 2, 0), 1), RC[-1], NA()) -> #ERR: ArgCount | BE83: =IF(ISERROR(RC[-1])=1, "", RC[-5]) -> 
B84: 'Iran, Islamic Rep. | C84: 'IRN | D84: =IF(EQUAL(ComparativeCharts!R[+11]C, ""), "", 1) ->  | E84: =IF(EQUAL(ComparativeCharts!R[+11]C, ""), "", 1) -> #EMPTY! | O84: 77 | P84: 'Burkina Faso | Q84: 'BFA | R84: -0.213462923575118 | S84: 0.291377601755329 | T84: =1.64*RC[-1] -> 0.47785926687874 | U84: =IF(EQUAL(VLOOKUP(RC[-4], R9C3:R186C4, 2, 0), 1), RC[-1], NA()) -> #ERR: ArgCount | V84: =IF(ISERROR(RC[-1])=1, "", RC[-5]) ->  | W84: 'Turkmenistan | X84: 'TKM | Y84: 0.00383345427402071 | Z84: 0.327330708514643 | AA84: =1.64*RC[-1] -> 0.536822361964015 | AB84: =IF(EQUAL(VLOOKUP(RC[-4], R9C3:R186C4, 2, 0), 1), RC[-1], NA()) -> #ERR: ArgCount | AC84: =IF(ISERROR(RC[-1])=1, "", RC[-5]) ->  | AD84: 'Suriname | AE84: 'SUR | AF84: -0.146386601500475 | AG84: 0.768168783719135 | AH84: =1.64*RC[-1] -> 1.25979680529938 | AI84: =IF(EQUAL(VLOOKUP(RC[-4], R9C3:R186C4, 2, 0), 1), RC[-1], NA()) -> #ERR: ArgCount | AJ84: =IF(ISERROR(RC[-1])=1, "", RC[-5]) ->  | AK84: 'Egypt, Arab Rep. | AL84: 'EGY | AM84: 0.117878192157639 | AN84: 0.231793128719878 | AO84: =1.64*RC[-1] -> 0.3801407311006 | AP84: =IF(EQUAL(VLOOKUP(RC[-4], R9C3:R186C4, 2, 0), 1), RC[-1], NA()) -> #ERR: ArgCount | AQ84: =IF(ISERROR(RC[-1])=1, "", RC[-5]) ->  | AR84: 'Djibouti | AS84: 'DJI | AT84: -0.234934633142791 | AU84: 0.600583865212543 | AV84: =1.64*RC[-1] -> 0.984957538948571 | AW84: =IF(EQUAL(VLOOKUP(RC[-4], R9C3:R186C4, 2, 0), 1), RC[-1], NA()) -> #ERR: ArgCount | AX84: =IF(ISERROR(RC[-1])=1, "", RC[-5]) ->  | AY84: 'Latvia | AZ84: 'LVA | BA84: -0.263574954758873 | BB84: 0.181932764704801 | BC84: =1.64*RC[-1] -> 0.298369734115874 | BD84: =IF(EQUAL(VLOOKUP(RC[-4], R9C3:R186C4, 2, 0), 1), RC[-1], NA()) -> #ERR: ArgCount | BE84: =IF(ISERROR(RC[-1])=1, "", RC[-5]) -> 
B85: 'Iraq | C85: 'IRQ | D85: =IF(EQUAL(ComparativeCharts!R[+11]C, ""), "", 1) -> 1 | E85: =IF(EQUAL(ComparativeCharts!R[+11]C, ""), "", 1) -> #EMPTY! | O85: 78 | P85: 'Mozambique | Q85: 'MOZ | R85: -0.172115426856135 | S85: 0.287283341236829 | T85: =1.64*RC[-1] -> 0.4711446796284 | U85: =IF(EQUAL(VLOOKUP(RC[-4], R9C3:R186C4, 2, 0), 1), RC[-1], NA()) -> #ERR: ArgCount | V85: =IF(ISERROR(RC[-1])=1, "", RC[-5]) ->  | W85: 'Fiji | X85: 'FJI | Y85: 0.0123052459470067 | Z85: 0.660536144392275 | AA85: =1.64*RC[-1] -> 1.08327927680333 | AB85: =IF(EQUAL(VLOOKUP(RC[-4], R9C3:R186C4, 2, 0), 1), RC[-1], NA()) -> #ERR: ArgCount | AC85: =IF(ISERROR(RC[-1])=1, "", RC[-5]) ->  | AD85: 'Egypt, Arab Rep. | AE85: 'EGY | AF85: -0.13795229442172 | AG85: 0.222815559932082 | AH85: =1.64*RC[-1] -> 0.365417518288614 | AI85: =IF(EQUAL(VLOOKUP(RC[-4], R9C3:R186C4, 2, 0), 1), RC[-1], NA()) -> #ERR: ArgCount | AJ85: =IF(ISERROR(RC[-1])=1, "", RC[-5]) ->  | AK85: 'Indonesia | AL85: 'IDN | AM85: 0.121487731072876 | AN85: 0.2290464009857 | AO85: =1.64*RC[-1] -> 0.375636097616548 | AP85: =IF(EQUAL(VLOOKUP(RC[-4], R9C3:R186C4, 2, 0), 1), RC[-1], NA()) -> #ERR: ArgCount | AQ85: =IF(ISERROR(RC[-1])=1, "", RC[-5]) ->  | AR85: 'Cambodia | AS85: 'KHM | AT85: -0.234934633142791 | AU85: 0.600583865212543 | AV85: =1.64*RC[-1] -> 0.984957538948571 | AW85: =IF(EQUAL(VLOOKUP(RC[-4], R9C3:R186C4, 2, 0), 1), RC[-1], NA()) -> #ERR: ArgCount | AX85: =IF(ISERROR(RC[-1])=1, "", RC[-5]) ->  | AY85: 'Togo | AZ85: 'TGO | BA85: -0.242091481060323 | BB85: 0.484622455710095 | BC85: =1.64*RC[-1] -> 0.794780827364556 | BD85: =IF(EQUAL(VLOOKUP(RC[-4], R9C3:R186C4, 2, 0), 1), RC[-1], NA()) -> #ERR: ArgCount | BE85: =IF(ISERROR(RC[-1])=1, "", RC[-5]) -> 
B86: 'Iceland | C86: 'ISL | D86: =IF(EQUAL(ComparativeCharts!R[+11]C, ""), "", 1) ->  | E86: =IF(EQUAL(ComparativeCharts!R[+11]C, ""), "", 1) -> #EMPTY! | O86: 79 | P86: 'Sri Lanka | Q86: 'LKA | R86: -0.157058820008571 | S86: 0.254026944310672 | T86: =1.64*RC[-1] -> 0.416604188669502 | U86: =IF(EQUAL(VLOOKUP(RC[-4], R9C3:R186C4, 2, 0), 1), RC[-1], NA()) -> #ERR: ArgCount | V86: =IF(ISERROR(RC[-1])=1, "", RC[-5]) ->  | W86: 'Romania | X86: 'ROM | Y86: 0.0236853002309497 | Z86: 0.243549981714305 | AA86: =1.64*RC[-1] -> 0.39942197001146 | AB86: =IF(EQUAL(VLOOKUP(RC[-4], R9C3:R186C4, 2, 0), 1), RC[-1], NA()) -> #ERR: ArgCount | AC86: =IF(ISERROR(RC[-1])=1, "", RC[-5]) ->  | AD86: 'West Bank and Gaza | AE86: 'WTB | AF86: -0.0887164917796225 | AG86: 0.563707566872499 | AH86: =1.64*RC[-1] -> 0.924480409670898 | AI86: =IF(EQUAL(VLOOKUP(RC[-4], R9C3:R186C4, 2, 0), 1), RC[-1], NA()) -> #ERR: ArgCount | AJ86: =IF(ISERROR(RC[-1])=1, "", RC[-5]) ->  | AK86: 'Brazil | AL86: 'BRA | AM86: 0.133816159678919 | AN86: 0.228760003290238 | AO86: =1.64*RC[-1] -> 0.37516640539599 | AP86: =IF(EQUAL(VLOOKUP(RC[-4], R9C3:R186C4, 2, 0), 1), RC[-1], NA()) -> #ERR: ArgCount | AQ86: =IF(ISERROR(RC[-1])=1, "", RC[-5]) ->  | AR86: 'Brazil | AS86: 'BRA | AT86: -0.222091429726382 | AU86: 0.207737275615815 | AV86: =1.64*RC[-1] -> 0.340689132009937 | AW86: =IF(EQUAL(VLOOKUP(RC[-4], R9C3:R186C4, 2, 0), 1), RC[-1], NA()) -> #ERR: ArgCount | AX86: =IF(ISERROR(RC[-1])=1, "", RC[-5]) ->  | AY86: 'Senegal | AZ86: 'SEN | BA86: -0.23549296752031 | BB86: 0.268423788960137 | BC86: =1.64*RC[-1] -> 0.440215013894625 | BD86: =IF(EQUAL(VLOOKUP(RC[-4], R9C3:R186C4, 2, 0), 1), RC[-1], NA()) -> #ERR: ArgCount | BE86: =IF(ISERROR(RC[-1])=1, "", RC[-5]) -> 
B87: 'Israel | C87: 'ISR | D87: =IF(EQUAL(ComparativeCharts!R[+11]C, ""), "", 1) ->  | E87: =IF(EQUAL(ComparativeCharts!R[+11]C, ""), "", 1) -> #EMPTY! | O87: 80 | P87: 'Lesotho | Q87: 'LSO | R87: -0.145933599740765 | S87: 0.360314615495306 | T87: =1.64*RC[-1] -> 0.590915969412302 | U87: =IF(EQUAL(VLOOKUP(RC[-4], R9C3:R186C4, 2, 0), 1), RC[-1], NA()) -> #ERR: ArgCount | V87: =IF(ISERROR(RC[-1])=1, "", RC[-5]) ->  | W87: 'Malawi | X87: 'MWI | Y87: 0.0394278108631736 | Z87: 0.294385303537927 | AA87: =1.64*RC[-1] -> 0.4827918978022 | AB87: =IF(EQUAL(VLOOKUP(RC[-4], R9C3:R186C4, 2, 0), 1), RC[-1], NA()) -> #ERR: ArgCount | AC87: =IF(ISERROR(RC[-1])=1, "", RC[-5]) ->  | AD87: 'Benin | AE87: 'BEN | AF87: -0.0664643638834824 | AG87: 0.563707566872499 | AH87: =1.64*RC[-1] -> 0.924480409670898 | AI87: =IF(EQUAL(VLOOKUP(RC[-4], R9C3:R186C4, 2, 0), 1), RC[-1], NA()) -> #ERR: ArgCount | AJ87: =IF(ISERROR(RC[-1])=1, "", RC[-5]) ->  | AK87: 'Cote d'Ivoire | AL87: 'CIV | AM87: 0.147756109663508 | AN87: 0.291187323849693 | AO87: =1.64*RC[-1] -> 0.477547211113496 | AP87: =IF(EQUAL(VLOOKUP(RC[-4], R9C3:R186C4, 2, 0), 1), RC[-1], NA()) -> #ERR: ArgCount | AQ87: =IF(ISERROR(RC[-1])=1, "", RC[-5]) ->  | AR87: 'Bulgaria | AS87: 'BGR | AT87: -0.149798699521592 | AU87: 0.179548241092202 | AV87: =1.64*RC[-1] -> 0.294459115391211 | AW87: =IF(EQUAL(VLOOKUP(RC[-4], R9C3:R186C4, 2, 0), 1), RC[-1], NA()) -> #ERR: ArgCount | AX87: =IF(ISERROR(RC[-1])=1, "", RC[-5]) ->  | AY87: 'Philippines | AZ87: 'PHL | BA87: -0.228090352954265 | BB87: 0.163839744115479 | BC87: =1.64*RC[-1] -> 0.268697180349386 | BD87: =IF(EQUAL(VLOOKUP(RC[-4], R9C3:R186C4, 2, 0), 1), RC[-1], NA()) -> #ERR: ArgCount | BE87: =IF(ISERROR(RC[-1])=1, "", RC[-5]) -> 
B88: 'Italy | C88: 'ITA | D88: =IF(EQUAL(ComparativeCharts!R[+11]C, ""), "", 1) ->  | E88: =IF(EQUAL(ComparativeCharts!R[+11]C, ""), "", 1) -> #EMPTY! | O88: 81 | P88: 'Malaysia | Q88: 'MYS | R88: -0.143636505190229 | S88: 0.251300233223489 | T88: =1.64*RC[-1] -> 0.412132382486522 | U88: =IF(EQUAL(VLOOKUP(RC[-4], R9C3:R186C4, 2, 0), 1), RC[-1], NA()) -> #ERR: ArgCount | V88: =IF(ISERROR(RC[-1])=1, "", RC[-5]) ->  | W88: 'Syrian Arab Republic | X88: 'SYR | Y88: 0.0833327217237797 | Z88: 0.299881889042829 | AA88: =1.64*RC[-1] -> 0.49180629803024 | AB88: =IF(EQUAL(VLOOKUP(RC[-4], R9C3:R186C4, 2, 0), 1), RC[-1], NA()) -> #ERR: ArgCount | AC88: =IF(ISERROR(RC[-1])=1, "", RC[-5]) ->  | AD88: 'Kuwait | AE88: 'KWT | AF88: -0.0634341813220545 | AG88: 0.319089592041234 | AH88: =1.64*RC[-1] -> 0.523306930947624 | AI88: =IF(EQUAL(VLOOKUP(RC[-4], R9C3:R186C4, 2, 0), 1), RC[-1], NA()) -> #ERR: ArgCount | AJ88: =IF(ISERROR(RC[-1])=1, "", RC[-5]) ->  | AK88: 'Slovak Republic | AL88: 'SVK | AM88: 0.167604633115238 | AN88: 0.216459376181894 | AO88: =1.64*RC[-1] -> 0.354993376938306 | AP88: =IF(EQUAL(VLOOKUP(RC[-4], R9C3:R186C4, 2, 0), 1), RC[-1], NA()) -> #ERR: ArgCount | AQ88: =IF(ISERROR(RC[-1])=1, "", RC[-5]) ->  | AR88: 'Armenia | AS88: 'ARM | AT88: -0.146269764656218 | AU88: 0.19625062444278 | AV88: =1.64*RC[-1] -> 0.321851024086159 | AW88: =IF(EQUAL(VLOOKUP(RC[-4], R9C3:R186C4, 2, 0), 1), RC[-1], NA()) -> #ERR: ArgCount | AX88: =IF(ISERROR(RC[-1])=1, "", RC[-5]) ->  | AY88: 'Bahrain | AZ88: 'BHR | BA88: -0.21498583790871 | BB88: 0.267063170408295 | BC88: =1.64*RC[-1] -> 0.437983599469604 | BD88: =IF(EQUAL(VLOOKUP(RC[-4], R9C3:R186C4, 2, 0), 1), RC[-1], NA()) -> #ERR: ArgCount | BE88: =IF(ISERROR(RC[-1])=1, "", RC[-5]) -> 
B89: 'Jamaica | C89: 'JAM | D89: =IF(EQUAL(ComparativeCharts!R[+11]C, ""), "", 1) -> 1 | E89: =IF(EQUAL(ComparativeCharts!R[+11]C, ""), "", 1) -> #EMPTY! | O89: 82 | P89: 'West Bank and Gaza | Q89: 'WTB | R89: -0.131552876541751 | S89: 0.864476175735898 | T89: =1.64*RC[-1] -> 1.41774092820687 | U89: =IF(EQUAL(VLOOKUP(RC[-4], R9C3:R186C4, 2, 0), 1), RC[-1], NA()) -> #ERR: ArgCount | V89: =IF(ISERROR(RC[-1])=1, "", RC[-5]) ->  | W89: 'Morocco | X89: 'MAR | Y89: 0.0899805024615535 | Z89: 0.265998113597101 | AA89: =1.64*RC[-1] -> 0.436236906299246 | AB89: =IF(EQUAL(VLOOKUP(RC[-4], R9C3:R186C4, 2, 0), 1), RC[-1], NA()) -> #ERR: ArgCount | AC89: =IF(ISERROR(RC[-1])=1, "", RC[-5]) ->  | AD89: 'Burkina Faso | AE89: 'BFA | AF89: -0.0592008590177913 | AG89: 0.317355502507267 | AH89: =1.64*RC[-1] -> 0.520463024111918 | AI89: =IF(EQUAL(VLOOKUP(RC[-4], R9C3:R186C4, 2, 0), 1), RC[-1], NA()) -> #ERR: ArgCount | AJ89: =IF(ISERROR(RC[-1])=1, "", RC[-5]) ->  | AK89: 'Mongolia | AL89: 'MNG | AM89: 0.170847773744373 | AN89: 0.519940958319459 | AO89: =1.64*RC[-1] -> 0.852703171643913 | AP89: =IF(EQUAL(VLOOKUP(RC[-4], R9C3:R186C4, 2, 0), 1), RC[-1], NA()) -> #ERR: ArgCount | AQ89: =IF(ISERROR(RC[-1])=1, "", RC[-5]) ->  | AR89: 'Zimbabwe | AS89: 'ZWE | AT89: -0.145677537993965 | AU89: 0.232933851077791 | AV89: =1.64*RC[-1] -> 0.382011515767577 | AW89: =IF(EQUAL(VLOOKUP(RC[-4], R9C3:R186C4, 2, 0), 1), RC[-1], NA()) -> #ERR: ArgCount | AX89: =IF(ISERROR(RC[-1])=1, "", RC[-5]) ->  | AY89: 'Peru | AZ89: 'PER | BA89: -0.199522749648413 | BB89: 0.213447405424417 | BC89: =1.64*RC[-1] -> 0.350053744896044 | BD89: =IF(EQUAL(VLOOKUP(RC[-4], R9C3:R186C4, 2, 0), 1), RC[-1], NA()) -> #ERR: ArgCount | BE89: =IF(ISERROR(RC[-1])=1, "", RC[-5]) -> 
B90: 'Jordan | C90: 'JOR | D90: =IF(EQUAL(ComparativeCharts!R[+11]C, ""), "", 1) ->  | E90: =IF(EQUAL(ComparativeCharts!R[+11]C, ""), "", 1) -> #EMPTY! | O90: 83 | P90: 'Colombia | Q90: 'COL | R90: -0.11998207819522 | S90: 0.251300233223489 | T90: =1.64*RC[-1] -> 0.412132382486522 | U90: =IF(EQUAL(VLOOKUP(RC[-4], R9C3:R186C4, 2, 0), 1), RC[-1], NA()) -> #ERR: ArgCount | V90: =IF(ISERROR(RC[-1])=1, "", RC[-5]) ->  | W90: 'West Bank and Gaza | X90: 'WTB | Y90: 0.111165671228262 | Z90: 0.660536144392275 | AA90: =1.64*RC[-1] -> 1.08327927680333 | AB90: =IF(EQUAL(VLOOKUP(RC[-4], R9C3:R186C4, 2, 0), 1), RC[-1], NA()) -> #ERR: ArgCount | AC90: =IF(ISERROR(RC[-1])=1, "", RC[-5]) ->  | AD90: 'Colombia | AE90: 'COL | AF90: -0.056625957250348 | AG90: 0.233636532185851 | AH90: =1.64*RC[-1] -> 0.383163912784796 | AI90: =IF(EQUAL(VLOOKUP(RC[-4], R9C3:R186C4, 2, 0), 1), RC[-1], NA()) -> #ERR: ArgCount | AJ90: =IF(ISERROR(RC[-1])=1, "", RC[-5]) ->  | AK90: 'Tanzania | AL90: 'TZA | AM90: 0.182648722239971 | AN90: 0.291187323849693 | AO90: =1.64*RC[-1] -> 0.477547211113496 | AP90: =IF(EQUAL(VLOOKUP(RC[-4], R9C3:R186C4, 2, 0), 1), RC[-1], NA()) -> #ERR: ArgCount | AQ90: =IF(ISERROR(RC[-1])=1, "", RC[-5]) ->  | AR90: 'Guyana | AS90: 'GUY | AT90: -0.139945117901966 | AU90: 0.443073362506416 | AV90: =1.64*RC[-1] -> 0.726640314510522 | AW90: =IF(EQUAL(VLOOKUP(RC[-4], R9C3:R186C4, 2, 0), 1), RC[-1], NA()) -> #ERR: ArgCount | AX90: =IF(ISERROR(RC[-1])=1, "", RC[-5]) ->  | AY90: 'Malawi | AZ90: 'MWI | BA90: -0.194532853097214 | BB90: 0.22389713439489 | BC90: =1.64*RC[-1] -> 0.36719130040762 | BD90: =IF(EQUAL(VLOOKUP(RC[-4], R9C3:R186C4, 2, 0), 1), RC[-1], NA()) -> #ERR: ArgCount | BE90: =IF(ISERROR(RC[-1])=1, "", RC[-5]) -> 
B91: 'Japan | C91: 'JPN | D91: =IF(EQUAL(ComparativeCharts!R[+11]C, ""), "", 1) ->  | E91: =IF(EQUAL(ComparativeCharts!R[+11]C, ""), "", 1) -> #EMPTY! | O91: 84 | P91: 'Mexico | Q91: 'MEX | R91: -0.108366003217385 | S91: 0.251300233223489 | T91: =1.64*RC[-1] -> 0.412132382486522 | U91: =IF(EQUAL(VLOOKUP(RC[-4], R9C3:R186C4, 2, 0), 1), RC[-1], NA()) -> #ERR: ArgCount | V91: =IF(ISERROR(RC[-1])=1, "", RC[-5]) ->  | W91: 'Dominican Republic | X91: 'DOM | Y91: 0.121086676080839 | Z91: 0.342482293230127 | AA91: =1.64*RC[-1] -> 0.561670960897408 | AB91: =IF(EQUAL(VLOOKUP(RC[-4], R9C3:R186C4, 2, 0), 1), RC[-1], NA()) -> #ERR: ArgCount | AC91: =IF(ISERROR(RC[-1])=1, "", RC[-5]) ->  | AD91: 'Mali | AE91: 'MLI | AF91: -0.0522807700002968 | AG91: 0.510201183720256 | AH91: =1.64*RC[-1] -> 0.83672994130122 | AI91: =IF(EQUAL(VLOOKUP(RC[-4], R9C3:R186C4, 2, 0), 1), RC[-1], NA()) -> #ERR: ArgCount | AJ91: =IF(ISERROR(RC[-1])=1, "", RC[-5]) ->  | AK91: 'Uganda | AL91: 'UGA | AM91: 0.183559623630412 | AN91: 0.291187323849693 | AO91: =1.64*RC[-1] -> 0.477547211113496 | AP91: =IF(EQUAL(VLOOKUP(RC[-4], R9C3:R186C4, 2, 0), 1), RC[-1], NA()) -> #ERR: ArgCount | AQ91: =IF(ISERROR(RC[-1])=1, "", RC[-5]) ->  | AR91: 'Senegal | AS91: 'SEN | AT91: -0.097340965303572 | AU91: 0.285056666814727 | AV91: =1.64*RC[-1] -> 0.467492933576152 | AW91: =IF(EQUAL(VLOOKUP(RC[-4], R9C3:R186C4, 2, 0), 1), RC[-1], NA()) -> #ERR: ArgCount | AX91: =IF(ISERROR(RC[-1])=1, "", RC[-5]) ->  | AY91: 'Guinea-Bissau | AZ91: 'GNB | BA91: -0.175793474927558 | BB91: 0.484622455710095 | BC91: =1.64*RC[-1] -> 0.794780827364556 | BD91: =IF(EQUAL(VLOOKUP(RC[-4], R9C3:R186C4, 2, 0), 1), RC[-1], NA()) -> #ERR: ArgCount | BE91: =IF(ISERROR(RC[-1])=1, "", RC[-5]) -> 
B92: 'Kazakhstan | C92: 'KAZ | D92: =IF(EQUAL(ComparativeCharts!R[+11]C, ""), "", 1) ->  | E92: =IF(EQUAL(ComparativeCharts!R[+11]C, ""), "", 1) -> #EMPTY! | O92: 85 | P92: 'El Salvador | Q92: 'SLV | R92: -0.100189765858663 | S92: 0.254026944310672 | T92: =1.64*RC[-1] -> 0.416604188669502 | U92: =IF(EQUAL(VLOOKUP(RC[-4], R9C3:R186C4, 2, 0), 1), RC[-1], NA()) -> #ERR: ArgCount | V92: =IF(ISERROR(RC[-1])=1, "", RC[-5]) ->  | W92: 'Iran, Islamic Rep. | X92: 'IRN | Y92: 0.134554399093723 | Z92: 0.276271366742878 | AA92: =1.64*RC[-1] -> 0.45308504145832 | AB92: =IF(EQUAL(VLOOKUP(RC[-4], R9C3:R186C4, 2, 0), 1), RC[-1], NA()) -> #ERR: ArgCount | AC92: =IF(ISERROR(RC[-1])=1, "", RC[-5]) ->  | AD92: 'Slovak Republic | AE92: 'SVK | AF92: -0.0317541589295773 | AG92: 0.224214871460886 | AH92: =1.64*RC[-1] -> 0.367712389195853 | AI92: =IF(EQUAL(VLOOKUP(RC[-4], R9C3:R186C4, 2, 0), 1), RC[-1], NA()) -> #ERR: ArgCount | AJ92: =IF(ISERROR(RC[-1])=1, "", RC[-5]) ->  | AK92: 'Thailand | AL92: 'THA | AM92: 0.192167925497308 | AN92: 0.228760003290238 | AO92: =1.64*RC[-1] -> 0.37516640539599 | AP92: =IF(EQUAL(VLOOKUP(RC[-4], R9C3:R186C4, 2, 0), 1), RC[-1], NA()) -> #ERR: ArgCount | AQ92: =IF(ISERROR(RC[-1])=1, "", RC[-5]) ->  | AR92: 'Romania | AS92: 'ROM | AT92: -0.0876396605455846 | AU92: 0.186137681288291 | AV92: =1.64*RC[-1] -> 0.305265797312797 | AW92: =IF(EQUAL(VLOOKUP(RC[-4], R9C3:R186C4, 2, 0), 1), RC[-1], NA()) -> #ERR: ArgCount | AX92: =IF(ISERROR(RC[-1])=1, "", RC[-5]) ->  | AY92: 'Thailand | AZ92: 'THA | BA92: -0.164791577043247 | BB92: 0.158656592213327 | BC92: =1.64*RC[-1] -> 0.260196811229856 | BD92: =IF(EQUAL(VLOOKUP(RC[-4], R9C3:R186C4, 2, 0), 1), RC[-1], NA()) -> #ERR: ArgCount | BE92: =IF(ISERROR(RC[-1])=1, "", RC[-5]) -> 
B93: 'Kenya | C93: 'KEN | D93: =IF(EQUAL(ComparativeCharts!R[+11]C, ""), "", 1) ->  | E93: =IF(EQUAL(ComparativeCharts!R[+11]C, ""), "", 1) -> #EMPTY! | O93: 86 | P93: 'Dominican Republic | Q93: 'DOM | R93: -0.0778858613944379 | S93: 0.254026944310672 | T93: =1.64*RC[-1] -> 0.416604188669502 | U93: =IF(EQUAL(VLOOKUP(RC[-4], R9C3:R186C4, 2, 0), 1), RC[-1], NA()) -> #ERR: ArgCount | V93: =IF(ISERROR(RC[-1])=1, "", RC[-5]) ->  | W93: 'Ethiopia | X93: 'ETH | Y93: 0.141375932283403 | Z93: 0.362791739324056 | AA93: =1.64*RC[-1] -> 0.594978452491452 | AB93: =IF(EQUAL(VLOOKUP(RC[-4], R9C3:R186C4, 2, 0), 1), RC[-1], NA()) -> #ERR: ArgCount | AC93: =IF(ISERROR(RC[-1])=1, "", RC[-5]) ->  | AD93: 'Guinea | AE93: 'GIN | AF93: -0.0292787155682444 | AG93: 0.510201183720256 | AH93: =1.64*RC[-1] -> 0.83672994130122 | AI93: =IF(EQUAL(VLOOKUP(RC[-4], R9C3:R186C4, 2, 0), 1), RC[-1], NA()) -> #ERR: ArgCount | AJ93: =IF(ISERROR(RC[-1])=1, "", RC[-5]) ->  | AK93: 'Guinea | AL93: 'GIN | AM93: 0.196990422875537 | AN93: 0.516616692692467 | AO93: =1.64*RC[-1] -> 0.847251376015646 | AP93: =IF(EQUAL(VLOOKUP(RC[-4], R9C3:R186C4, 2, 0), 1), RC[-1], NA()) -> #ERR: ArgCount | AQ93: =IF(ISERROR(RC[-1])=1, "", RC[-5]) ->  | AR93: 'Philippines | AS93: 'PHL | AT93: -0.0776584496113575 | AU93: 0.218139839508948 | AV93: =1.64*RC[-1] -> 0.357749336794675 | AW93: =IF(EQUAL(VLOOKUP(RC[-4], R9C3:R186C4, 2, 0), 1), RC[-1], NA()) -> #ERR: ArgCount | AX93: =IF(ISERROR(RC[-1])=1, "", RC[-5]) ->  | AY93: 'Mongolia | AZ93: 'MNG | BA93: -0.145218536402699 | BB93: 0.422055980592495 | BC93: =1.64*RC[-1] -> 0.692171808171692 | BD93: =IF(EQUAL(VLOOKUP(RC[-4], R9C3:R186C4, 2, 0), 1), RC[-1], NA()) -> #ERR: ArgCount | BE93: =IF(ISERROR(RC[-1])=1, "", RC[-5]) -> 
B94: 'Kyrgyz Republic | C94: 'KGZ | D94: =IF(EQUAL(ComparativeCharts!R[+11]C, ""), "", 1) ->  | E94: =IF(EQUAL(ComparativeCharts!R[+11]C, ""), "", 1) -> #EMPTY! | O94: 87 | P94: 'Hong Kong, China | Q94: 'HKG | R94: -0.0739175588647686 | S94: 0.251300233223489 | T94: =1.64*RC[-1] -> 0.412132382486522 | U94: =IF(EQUAL(VLOOKUP(RC[-4], R9C3:R186C4, 2, 0), 1), RC[-1], NA()) -> #ERR: ArgCount | V94: =IF(ISERROR(RC[-1])=1, "", RC[-5]) ->  | W94: 'Panama | X94: 'PAN | Y94: 0.14854399580717 | Z94: 0.299881889042829 | AA94: =1.64*RC[-1] -> 0.49180629803024 | AB94: =IF(EQUAL(VLOOKUP(RC[-4], R9C3:R186C4, 2, 0), 1), RC[-1], NA()) -> #ERR: ArgCount | AC94: =IF(ISERROR(RC[-1])=1, "", RC[-5]) ->  | AD94: 'South Africa | AE94: 'ZAF | AF94: -0.00982379588119348 | AG94: 0.205613610772014 | AH94: =1.64*RC[-1] -> 0.337206321666103 | AI94: =IF(EQUAL(VLOOKUP(RC[-4], R9C3:R186C4, 2, 0), 1), RC[-1], NA()) -> #ERR: ArgCount | AJ94: =IF(ISERROR(RC[-1])=1, "", RC[-5]) ->  | AK94: 'Romania | AL94: 'ROM | AM94: 0.199331981238641 | AN94: 0.263261256825197 | AO94: =1.64*RC[-1] -> 0.431748461193323 | AP94: =IF(EQUAL(VLOOKUP(RC[-4], R9C3:R186C4, 2, 0), 1), RC[-1], NA()) -> #ERR: ArgCount | AQ94: =IF(ISERROR(RC[-1])=1, "", RC[-5]) ->  | AR94: 'Swaziland | AS94: 'SWZ | AT94: -0.0621685988459257 | AU94: 0.56608033832539 | AV94: =1.64*RC[-1] -> 0.928371754853639 | AW94: =IF(EQUAL(VLOOKUP(RC[-4], R9C3:R186C4, 2, 0), 1), RC[-1], NA()) -> #ERR: ArgCount | AX94: =IF(ISERROR(RC[-1])=1, "", RC[-5]) ->  | AY94: 'Sri Lanka | AZ94: 'LKA | BA94: -0.123944613981395 | BB94: 0.267063170408295 | BC94: =1.64*RC[-1] -> 0.437983599469604 | BD94: =IF(EQUAL(VLOOKUP(RC[-4], R9C3:R186C4, 2, 0), 1), RC[-1], NA()) -> #ERR: ArgCount | BE94: =IF(ISERROR(RC[-1])=1, "", RC[-5]) -> 
B95: 'Cambodia | C95: 'KHM | D95: =IF(EQUAL(ComparativeCharts!R[+11]C, ""), "", 1) ->  | E95: =IF(EQUAL(ComparativeCharts!R[+11]C, ""), "", 1) -> #EMPTY! | O95: 88 | P95: 'Honduras | Q95: 'HND | R95: -0.0553062261506043 | S95: 0.254026944310672 | T95: =1.64*RC[-1] -> 0.416604188669502 | U95: =IF(EQUAL(VLOOKUP(RC[-4], R9C3:R186C4, 2, 0), 1), RC[-1], NA()) -> #ERR: ArgCount | V95: =IF(ISERROR(RC[-1])=1, "", RC[-5]) ->  | W95: 'Korea, Rep. | X95: 'KOR | Y95: 0.164349009052496 | Z95: 0.25228486761248 | AA95: =1.64*RC[-1] -> 0.413747182884467 | AB95: =IF(EQUAL(VLOOKUP(RC[-4], R9C3:R186C4, 2, 0), 1), RC[-1], NA()) -> #ERR: ArgCount | AC95: =IF(ISERROR(RC[-1])=1, "", RC[-5]) ->  | AD95: 'Brunei | AE95: 'BRN | AF95: 0.00864179875606756 | AG95: 0.768168783719135 | AH95: =1.64*RC[-1] -> 1.25979680529938 | AI95: =IF(EQUAL(VLOOKUP(RC[-4], R9C3:R186C4, 2, 0), 1), RC[-1], NA()) -> #ERR: ArgCount | AJ95: =IF(ISERROR(RC[-1])=1, "", RC[-5]) ->  | AK95: 'Morocco | AL95: 'MAR | AM95: 0.215986773051638 | AN95: 0.291187323849693 | AO95: =1.64*RC[-1] -> 0.477547211113496 | AP95: =IF(EQUAL(VLOOKUP(RC[-4], R9C3:R186C4, 2, 0), 1), RC[-1], NA()) -> #ERR: ArgCount | AQ95: =IF(ISERROR(RC[-1])=1, "", RC[-5]) ->  | AR95: 'China | AS95: 'CHN | AT95: -0.0400354875895447 | AU95: 0.218139839508948 | AV95: =1.64*RC[-1] -> 0.357749336794675 | AW95: =IF(EQUAL(VLOOKUP(RC[-4], R9C3:R186C4, 2, 0), 1), RC[-1], NA()) -> #ERR: ArgCount | AX95: =IF(ISERROR(RC[-1])=1, "", RC[-5]) ->  | AY95: 'Jamaica | AZ95: 'JAM | BA95: -0.11620599480499 | BB95: 0.268423788960137 | BC95: =1.64*RC[-1] -> 0.440215013894625 | BD95: =IF(EQUAL(VLOOKUP(RC[-4], R9C3:R186C4, 2, 0), 1), RC[-1], NA()) -> #ERR: ArgCount | BE95: =IF(ISERROR(RC[-1])=1, "", RC[-5]) -> 
B96: 'Korea, Rep. | C96: 'KOR | D96: =IF(EQUAL(ComparativeCharts!R[+11]C, ""), "", 1) ->  | E96: =IF(EQUAL(ComparativeCharts!R[+11]C, ""), "", 1) -> #EMPTY! | O96: 89 | P96: 'Central African Republic | Q96: 'CAF | R96: -0.04583229804779 | S96: 0.360314615495306 | T96: =1.64*RC[-1] -> 0.590915969412302 | U96: =IF(EQUAL(VLOOKUP(RC[-4], R9C3:R186C4, 2, 0), 1), RC[-1], NA()) -> #ERR: ArgCount | V96: =IF(ISERROR(RC[-1])=1, "", RC[-5]) ->  | W96: 'Cuba | X96: 'CUB | Y96: 0.190378930987595 | Z96: 0.299881889042829 | AA96: =1.64*RC[-1] -> 0.49180629803024 | AB96: =IF(EQUAL(VLOOKUP(RC[-4], R9C3:R186C4, 2, 0), 1), RC[-1], NA()) -> #ERR: ArgCount | AC96: =IF(ISERROR(RC[-1])=1, "", RC[-5]) ->  | AD96: 'Guyana | AE96: 'GUY | AF96: 0.00864179875606756 | AG96: 0.768168783719135 | AH96: =1.64*RC[-1] -> 1.25979680529938 | AI96: =IF(EQUAL(VLOOKUP(RC[-4], R9C3:R186C4, 2, 0), 1), RC[-1], NA()) -> #ERR: ArgCount | AJ96: =IF(ISERROR(RC[-1])=1, "", RC[-5]) ->  | AK96: 'Mauritius | AL96: 'MUS | AM96: 0.217016209691449 | AN96: 0.350213989902913 | AO96: =1.64*RC[-1] -> 0.574350943440777 | AP96: =IF(EQUAL(VLOOKUP(RC[-4], R9C3:R186C4, 2, 0), 1), RC[-1], NA()) -> #ERR: ArgCount | AQ96: =IF(ISERROR(RC[-1])=1, "", RC[-5]) ->  | AR96: 'Moldova | AS96: 'MDA | AT96: -0.0189742925020053 | AU96: 0.179548241092202 | AV96: =1.64*RC[-1] -> 0.294459115391211 | AW96: =IF(EQUAL(VLOOKUP(RC[-4], R9C3:R186C4, 2, 0), 1), RC[-1], NA()) -> #ERR: ArgCount | AX96: =IF(ISERROR(RC[-1])=1, "", RC[-5]) ->  | AY96: 'Cote d'Ivoire | AZ96: 'CIV | BA96: -0.0792730988776621 | BB96: 0.210520528590018 | BC96: =1.64*RC[-1] -> 0.345253666887629 | BD96: =IF(EQUAL(VLOOKUP(RC[-4], R9C3:R186C4, 2, 0), 1), RC[-1], NA()) -> #ERR: ArgCount | BE96: =IF(ISERROR(RC[-1])=1, "", RC[-5]) -> 
B97: 'Kuwait | C97: 'KWT | D97: =IF(EQUAL(ComparativeCharts!R[+11]C, ""), "", 1) ->  | E97: =IF(EQUAL(ComparativeCharts!R[+11]C, ""), "", 1) -> #EMPTY! | O97: 90 | P97: 'Zambia | Q97: 'ZMB | R97: -0.0455865441997576 | S97: 0.251300233223489 | T97: =1.64*RC[-1] -> 0.412132382486522 | U97: =IF(EQUAL(VLOOKUP(RC[-4], R9C3:R186C4, 2, 0), 1), RC[-1], NA()) -> #ERR: ArgCount | V97: =IF(ISERROR(RC[-1])=1, "", RC[-5]) ->  | W97: 'Greece | X97: 'GRC | Y97: 0.205019144201462 | Z97: 0.263344534520094 | AA97: =1.64*RC[-1] -> 0.431885036612954 | AB97: =IF(EQUAL(VLOOKUP(RC[-4], R9C3:R186C4, 2, 0), 1), RC[-1], NA()) -> #ERR: ArgCount | AC97: =IF(ISERROR(RC[-1])=1, "", RC[-5]) ->  | AD97: 'Sierra Leone | AE97: 'SLE | AF97: 0.00864179875606756 | AG97: 0.768168783719135 | AH97: =1.64*RC[-1] -> 1.25979680529938 | AI97: =IF(EQUAL(VLOOKUP(RC[-4], R9C3:R186C4, 2, 0), 1), RC[-1], NA()) -> #ERR: ArgCount | AJ97: =IF(ISERROR(RC[-1])=1, "", RC[-5]) ->  | AK97: 'Korea, Rep. | AL97: 'KOR | AM97: 0.219031285522308 | AN97: 0.228760003290238 | AO97: =1.64*RC[-1] -> 0.37516640539599 | AP97: =IF(EQUAL(VLOOKUP(RC[-4], R9C3:R186C4, 2, 0), 1), RC[-1], NA()) -> #ERR: ArgCount | AQ97: =IF(ISERROR(RC[-1])=1, "", RC[-5]) ->  | AR97: 'Ghana | AS97: 'GHA | AT97: -0.0136123512613244 | AU97: 0.253185404132827 | AV97: =1.64*RC[-1] -> 0.415224062777836 | AW97: =IF(EQUAL(VLOOKUP(RC[-4], R9C3:R186C4, 2, 0), 1), RC[-1], NA()) -> #ERR: ArgCount | AX97: =IF(ISERROR(RC[-1])=1, "", RC[-5]) ->  | AY97: 'United Arab Emirates | AZ97: 'ARE | BA97: -0.02688673768104 | BB97: 0.267063170408295 | BC97: =1.64*RC[-1] -> 0.437983599469604 | BD97: =IF(EQUAL(VLOOKUP(RC[-4], R9C3:R186C4, 2, 0), 1), RC[-1], NA()) -> #ERR: ArgCount | BE97: =IF(ISERROR(RC[-1])=1, "", RC[-5]) -> 
B98: 'Lao, PDR | C98: 'LAO | D98: =IF(EQUAL(ComparativeCharts!R[+11]C, ""), "", 1) ->  | E98: =IF(EQUAL(ComparativeCharts!R[+11]C, ""), "", 1) -> #EMPTY! | O98: 91 | P98: 'Bangladesh | Q98: 'BGD | R98: -0.0149327055073721 | S98: 0.254026944310672 | T98: =1.64*RC[-1] -> 0.416604188669502 | U98: =IF(EQUAL(VLOOKUP(RC[-4], R9C3:R186C4, 2, 0), 1), RC[-1], NA()) -> #ERR: ArgCount | V98: =IF(ISERROR(RC[-1])=1, "", RC[-5]) ->  | W98: 'Kazakhstan | X98: 'KAZ | Y98: 0.221413923386003 | Z98: 0.222869757056858 | AA98: =1.64*RC[-1] -> 0.365506401573247 | AB98: =IF(EQUAL(VLOOKUP(RC[-4], R9C3:R186C4, 2, 0), 1), RC[-1], NA()) -> #ERR: ArgCount | AC98: =IF(ISERROR(RC[-1])=1, "", RC[-5]) ->  | AD98: 'Thailand | AE98: 'THA | AF98: 0.00976761697215778 | AG98: 0.233636532185851 | AH98: =1.64*RC[-1] -> 0.383163912784796 | AI98: =IF(EQUAL(VLOOKUP(RC[-4], R9C3:R186C4, 2, 0), 1), RC[-1], NA()) -> #ERR: ArgCount | AJ98: =IF(ISERROR(RC[-1])=1, "", RC[-5]) ->  | AK98: 'Guyana | AL98: 'GUY | AM98: 0.233953012080858 | AN98: 0.519940958319459 | AO98: =1.64*RC[-1] -> 0.852703171643913 | AP98: =IF(EQUAL(VLOOKUP(RC[-4], R9C3:R186C4, 2, 0), 1), RC[-1], NA()) -> #ERR: ArgCount | AQ98: =IF(ISERROR(RC[-1])=1, "", RC[-5]) ->  | AR98: 'Uganda | AS98: 'UGA | AT98: -0.0133197381046215 | AU98: 0.253185404132827 | AV98: =1.64*RC[-1] -> 0.415224062777836 | AW98: =IF(EQUAL(VLOOKUP(RC[-4], R9C3:R186C4, 2, 0), 1), RC[-1], NA()) -> #ERR: ArgCount | AX98: =IF(ISERROR(RC[-1])=1, "", RC[-5]) ->  | AY98: 'Brunei | AZ98: 'BRN | BA98: -0.0186657030867037 | BB98: 0.748674396199437 | BC98: =1.64*RC[-1] -> 1.22782600976708 | BD98: =IF(EQUAL(VLOOKUP(RC[-4], R9C3:R186C4, 2, 0), 1), RC[-1], NA()) -> #ERR: ArgCount | BE98: =IF(ISERROR(RC[-1])=1, "", RC[-5]) -> 
B99: 'Lebanon | C99: 'LBN | D99: =IF(EQUAL(ComparativeCharts!R[+11]C, ""), "", 1) ->  | E99: =IF(EQUAL(ComparativeCharts!R[+11]C, ""), "", 1) -> #EMPTY! | O99: 92 | P99: 'Ukraine | Q99: 'UKR | R99: -0.00841138129523557 | S99: 0.251300233223489 | T99: =1.64*RC[-1] -> 0.412132382486522 | U99: =IF(EQUAL(VLOOKUP(RC[-4], R9C3:R186C4, 2, 0), 1), RC[-1], NA()) -> #ERR: ArgCount | V99: =IF(ISERROR(RC[-1])=1, "", RC[-5]) ->  | W99: 'Saudi Arabia | X99: 'SAU | Y99: 0.238920727893909 | Z99: 0.276271366742878 | AA99: =1.64*RC[-1] -> 0.45308504145832 | AB99: =IF(EQUAL(VLOOKUP(RC[-4], R9C3:R186C4, 2, 0), 1), RC[-1], NA()) -> #ERR: ArgCount | AC99: =IF(ISERROR(RC[-1])=1, "", RC[-5]) ->  | AD99: 'China | AE99: 'CHN | AF99: 0.0155899794767549 | AG99: 0.248661311888018 | AH99: =1.64*RC[-1] -> 0.407804551496349 | AI99: =IF(EQUAL(VLOOKUP(RC[-4], R9C3:R186C4, 2, 0), 1), RC[-1], NA()) -> #ERR: ArgCount | AJ99: =IF(ISERROR(RC[-1])=1, "", RC[-5]) ->  | AK99: 'Croatia | AL99: 'HRV | AM99: 0.238170968258829 | AN99: 0.263261256825197 | AO99: =1.64*RC[-1] -> 0.431748461193323 | AP99: =IF(EQUAL(VLOOKUP(RC[-4], R9C3:R186C4, 2, 0), 1), RC[-1], NA()) -> #ERR: ArgCount | AQ99: =IF(ISERROR(RC[-1])=1, "", RC[-5]) ->  | AR99: 'Turkey | AS99: 'TUR | AT99: -0.0104240092107967 | AU99: 0.207737275615815 | AV99: =1.64*RC[-1] -> 0.340689132009937 | AW99: =IF(EQUAL(VLOOKUP(RC[-4], R9C3:R186C4, 2, 0), 1), RC[-1], NA()) -> #ERR: ArgCount | AX99: =IF(ISERROR(RC[-1])=1, "", RC[-5]) ->  | AY99: 'Gambia, The | AZ99: 'GMB | BA99: -0.0186657030867037 | BB99: 0.748674396199437 | BC99: =1.64*RC[-1] -> 1.22782600976708 | BD99: =IF(EQUAL(VLOOKUP(RC[-4], R9C3:R186C4, 2, 0), 1), RC[-1], NA()) -> #ERR: ArgCount | BE99: =IF(ISERROR(RC[-1])=1, "", RC[-5]) -> 
B100: 'Liberia | C100: 'LBR | D100: =IF(EQUAL(ComparativeCharts!R[+11]C, ""), "", 1) ->  | E100: =IF(EQUAL(ComparativeCharts!R[+11]C, ""), "", 1) -> #EMPTY! | O100: 93 | P100: 'Albania | Q100: 'ALB | R100: -0.00774797674908196 | S100: 0.287283341236829 | T100: =1.64*RC[-1] -> 0.4711446796284 | U100: =IF(EQUAL(VLOOKUP(RC[-4], R9C3:R186C4, 2, 0), 1), RC[-1], NA()) -> #ERR: ArgCount | V100: =IF(ISERROR(RC[-1])=1, "", RC[-5]) ->  | W100: 'Thailand | X100: 'THA | Y100: 0.246117800607383 | Z100: 0.25228486761248 | AA100: =1.64*RC[-1] -> 0.413747182884467 | AB100: =IF(EQUAL(VLOOKUP(RC[-4], R9C3:R186C4, 2, 0), 1), RC[-1], NA()) -> #ERR: ArgCount | AC100: =IF(ISERROR(RC[-1])=1, "", RC[-5]) ->  | AD100: 'Mongolia | AE100: 'MNG | AF100: 0.0176893536491433 | AG100: 0.385832817863489 | AH100: =1.64*RC[-1] -> 0.632765821296122 | AI100: =IF(EQUAL(VLOOKUP(RC[-4], R9C3:R186C4, 2, 0), 1), RC[-1], NA()) -> #ERR: ArgCount | AJ100: =IF(ISERROR(RC[-1])=1, "", RC[-5]) ->  | AK100: 'South Africa | AL100: 'ZAF | AM100: 0.243616704722545 | AN100: 0.202219726598532 | AO100: =1.64*RC[-1] -> 0.331640351621592 | AP100: =IF(EQUAL(VLOOKUP(RC[-4], R9C3:R186C4, 2, 0), 1), RC[-1], NA()) -> #ERR: ArgCount | AQ100: =IF(ISERROR(RC[-1])=1, "", RC[-5]) ->  | AR100: 'Mongolia | AS100: 'MNG | AT100: 0.0391074659401654 | AU100: 0.317173634770438 | AV100: =1.64*RC[-1] -> 0.520164761023518 | AW100: =IF(EQUAL(VLOOKUP(RC[-4], R9C3:R186C4, 2, 0), 1), RC[-1], NA()) -> #ERR: ArgCount | AX100: =IF(ISERROR(RC[-1])=1, "", RC[-5]) ->  | AY100: 'Guyana | AZ100: 'GUY | BA100: -0.0186657030867037 | BB100: 0.748674396199437 | BC100: =1.64*RC[-1] -> 1.22782600976708 | BD100: =IF(EQUAL(VLOOKUP(RC[-4], R9C3:R186C4, 2, 0), 1), RC[-1], NA()) -> #ERR: ArgCount | BE100: =IF(ISERROR(RC[-1])=1, "", RC[-5]) -> 
B101: 'Libya | C101: 'LBY | D101: =IF(EQUAL(ComparativeCharts!R[+11]C, ""), "", 1) -> 1 | E101: =IF(EQUAL(ComparativeCharts!R[+11]C, ""), "", 1) -> #EMPTY! | O101: 94 | P101: 'Kuwait | Q101: 'KWT | R101: 0.000257006354970228 | S101: 0.254026944310672 | T101: =1.64*RC[-1] -> 0.416604188669502 | U101: =IF(EQUAL(VLOOKUP(RC[-4], R9C3:R186C4, 2, 0), 1), RC[-1], NA()) -> #ERR: ArgCount | V101: =IF(ISERROR(RC[-1])=1, "", RC[-5]) ->  | W101: 'Philippines | X101: 'PHL | Y101: 0.272942744914495 | Z101: 0.263344534520094 | AA101: =1.64*RC[-1] -> 0.431885036612954 | AB101: =IF(EQUAL(VLOOKUP(RC[-4], R9C3:R186C4, 2, 0), 1), RC[-1], NA()) -> #ERR: ArgCount | AC101: =IF(ISERROR(RC[-1])=1, "", RC[-5]) ->  | AD101: 'Namibia | AE101: 'NAM | AF101: 0.0444111898597424 | AG101: 0.25500473803749 | AH101: =1.64*RC[-1] -> 0.418207770381484 | AI101: =IF(EQUAL(VLOOKUP(RC[-4], R9C3:R186C4, 2, 0), 1), RC[-1], NA()) -> #ERR: ArgCount | AJ101: =IF(ISERROR(RC[-1])=1, "", RC[-5]) ->  | AK101: 'Zambia | AL101: 'ZMB | AM101: 0.251858856010122 | AN101: 0.291187323849693 | AO101: =1.64*RC[-1] -> 0.477547211113496 | AP101: =IF(EQUAL(VLOOKUP(RC[-4], R9C3:R186C4, 2, 0), 1), RC[-1], NA()) -> #ERR: ArgCount | AQ101: =IF(ISERROR(RC[-1])=1, "", RC[-5]) ->  | AR101: 'Belize | AS101: 'BLZ | AT101: 0.0879663411437438 | AU101: 0.600583865212543 | AV101: =1.64*RC[-1] -> 0.984957538948571 | AW101: =IF(EQUAL(VLOOKUP(RC[-4], R9C3:R186C4, 2, 0), 1), RC[-1], NA()) -> #ERR: ArgCount | AX101: =IF(ISERROR(RC[-1])=1, "", RC[-5]) ->  | AY101: 'Sierra Leone | AZ101: 'SLE | BA101: -0.0186657030867037 | BB101: 0.748674396199437 | BC101: =1.64*RC[-1] -> 1.22782600976708 | BD101: =IF(EQUAL(VLOOKUP(RC[-4], R9C3:R186C4, 2, 0), 1), RC[-1], NA()) -> #ERR: ArgCount | BE101: =IF(ISERROR(RC[-1])=1, "", RC[-5]) -> 
B102: 'Sri Lanka | C102: 'LKA | D102: =IF(EQUAL(ComparativeCharts!R[+11]C, ""), "", 1) ->  | E102: =IF(EQUAL(ComparativeCharts!R[+11]C, ""), "", 1) -> #EMPTY! | O102: 95 | P102: 'Fiji | Q102: 'FJI | R102: 0.0129544519434821 | S102: 0.352657522321209 | T102: =1.64*RC[-1] -> 0.578358336606783 | U102: =IF(EQUAL(VLOOKUP(RC[-4], R9C3:R186C4, 2, 0), 1), RC[-1], NA()) -> #ERR: ArgCount | V102: =IF(ISERROR(RC[-1])=1, "", RC[-5]) ->  | W102: 'Trinidad and Tobago& Tob* | X102: 'TTO | Y102: 0.315271582883894 | Z102: 0.342482293230127 | AA102: =1.64*RC[-1] -> 0.561670960897408 | AB102: =IF(EQUAL(VLOOKUP(RC[-4], R9C3:R186C4, 2, 0), 1), RC[-1], NA()) -> #ERR: ArgCount | AC102: =IF(ISERROR(RC[-1])=1, "", RC[-5]) ->  | AD102: 'Senegal | AE102: 'SEN | AF102: 0.0473931440296811 | AG102: 0.286401829836332 | AH102: =1.64*RC[-1] -> 0.469699000931584 | AI102: =IF(EQUAL(VLOOKUP(RC[-4], R9C3:R186C4, 2, 0), 1), RC[-1], NA()) -> #ERR: ArgCount | AJ102: =IF(ISERROR(RC[-1])=1, "", RC[-5]) ->  | AK102: 'Namibia | AL102: 'NAM | AM102: 0.266729898135636 | AN102: 0.332518638661452 | AO102: =1.64*RC[-1] -> 0.545330567404781 | AP102: =IF(EQUAL(VLOOKUP(RC[-4], R9C3:R186C4, 2, 0), 1), RC[-1], NA()) -> #ERR: ArgCount | AQ102: =IF(ISERROR(RC[-1])=1, "", RC[-5]) ->  | AR102: 'Cape verde | AS102: 'CPV | AT102: 0.0879663411437438 | AU102: 0.600583865212543 | AV102: =1.64*RC[-1] -> 0.984957538948571 | AW102: =IF(EQUAL(VLOOKUP(RC[-4], R9C3:R186C4, 2, 0), 1), RC[-1], NA()) -> #ERR: ArgCount | AX102: =IF(ISERROR(RC[-1])=1, "", RC[-5]) ->  | AY102: 'Suriname | AZ102: 'SUR | BA102: -0.0186657030867037 | BB102: 0.748674396199437 | BC102: =1.64*RC[-1] -> 1.22782600976708 | BD102: =IF(EQUAL(VLOOKUP(RC[-4], R9C3:R186C4, 2, 0), 1), RC[-1], NA()) -> #ERR: ArgCount | BE102: =IF(ISERROR(RC[-1])=1, "", RC[-5]) -> 
B103: 'Lesotho | C103: 'LSO | D103: =IF(EQUAL(ComparativeCharts!R[+11]C, ""), "", 1) ->  | E103: =IF(EQUAL(ComparativeCharts!R[+11]C, ""), "", 1) -> #EMPTY! | O103: 96 | P103: 'Armenia | Q103: 'ARM | R103: 0.0188279512704479 | S103: 0.287283341236829 | T103: =1.64*RC[-1] -> 0.4711446796284 | U103: =IF(EQUAL(VLOOKUP(RC[-4], R9C3:R186C4, 2, 0), 1), RC[-1], NA()) -> #ERR: ArgCount | V103: =IF(ISERROR(RC[-1])=1, "", RC[-5]) ->  | W103: 'Kyrgyz Republic | X103: 'KGZ | Y103: 0.317713930889136 | Z103: 0.306784965294112 | AA103: =1.64*RC[-1] -> 0.503127343082344 | AB103: =IF(EQUAL(VLOOKUP(RC[-4], R9C3:R186C4, 2, 0), 1), RC[-1], NA()) -> #ERR: ArgCount | AC103: =IF(ISERROR(RC[-1])=1, "", RC[-5]) ->  | AD103: 'Latvia | AE103: 'LVA | AF103: 0.0676379792867031 | AG103: 0.242598933058622 | AH103: =1.64*RC[-1] -> 0.39786225021614 | AI103: =IF(EQUAL(VLOOKUP(RC[-4], R9C3:R186C4, 2, 0), 1), RC[-1], NA()) -> #ERR: ArgCount | AJ103: =IF(ISERROR(RC[-1])=1, "", RC[-5]) ->  | AK103: 'Ghana | AL103: 'GHA | AM103: 0.27836296766957 | AN103: 0.291187323849693 | AO103: =1.64*RC[-1] -> 0.477547211113496 | AP103: =IF(EQUAL(VLOOKUP(RC[-4], R9C3:R186C4, 2, 0), 1), RC[-1], NA()) -> #ERR: ArgCount | AQ103: =IF(ISERROR(RC[-1])=1, "", RC[-5]) ->  | AR103: 'Cuba | AS103: 'CUB | AT103: 0.114628471716251 | AU103: 0.276349686366578 | AV103: =1.64*RC[-1] -> 0.453213485641188 | AW103: =IF(EQUAL(VLOOKUP(RC[-4], R9C3:R186C4, 2, 0), 1), RC[-1], NA()) -> #ERR: ArgCount | AX103: =IF(ISERROR(RC[-1])=1, "", RC[-5]) ->  | AY103: 'Swaziland | AZ103: 'SWZ | BA103: 0.00718674302694898 | BB103: 0.376110791704214 | BC103: =1.64*RC[-1] -> 0.616821698394911 | BD103: =IF(EQUAL(VLOOKUP(RC[-4], R9C3:R186C4, 2, 0), 1), RC[-1], NA()) -> #ERR: ArgCount | BE103: =IF(ISERROR(RC[-1])=1, "", RC[-5]) -> 
B104: 'Lithuania | C104: 'LTU | D104: =IF(EQUAL(ComparativeCharts!R[+11]C, ""), "", 1) ->  | E104: =IF(EQUAL(ComparativeCharts!R[+11]C, ""), "", 1) -> #EMPTY! | O104: 97 | P104: 'Singapore | Q104: 'SGP | R104: 0.0398072683778496 | S104: 0.251300233223489 | T104: =1.64*RC[-1] -> 0.412132382486522 | U104: =IF(EQUAL(VLOOKUP(RC[-4], R9C3:R186C4, 2, 0), 1), RC[-1], NA()) -> #ERR: ArgCount | V104: =IF(ISERROR(RC[-1])=1, "", RC[-5]) ->  | W104: 'Lithuania | X104: 'LTU | Y104: 0.34571648933458 | Z104: 0.234722074427469 | AA104: =1.64*RC[-1] -> 0.384944202061049 | AB104: =IF(EQUAL(VLOOKUP(RC[-4], R9C3:R186C4, 2, 0), 1), RC[-1], NA()) -> #ERR: ArgCount | AC104: =IF(ISERROR(RC[-1])=1, "", RC[-5]) ->  | AD104: 'Philippines | AE104: 'PHL | AF104: 0.126460498185185 | AG104: 0.248661311888018 | AH104: =1.64*RC[-1] -> 0.407804551496349 | AI104: =IF(EQUAL(VLOOKUP(RC[-4], R9C3:R186C4, 2, 0), 1), RC[-1], NA()) -> #ERR: ArgCount | AJ104: =IF(ISERROR(RC[-1])=1, "", RC[-5]) ->  | AK104: 'Belize | AL104: 'BLZ | AM104: 0.288254748149331 | AN104: 0.601880844424266 | AO104: =1.64*RC[-1] -> 0.987084584855796 | AP104: =IF(EQUAL(VLOOKUP(RC[-4], R9C3:R186C4, 2, 0), 1), RC[-1], NA()) -> #ERR: ArgCount | AQ104: =IF(ISERROR(RC[-1])=1, "", RC[-5]) ->  | AR104: 'Egypt, Arab Rep. | AS104: 'EGY | AT104: 0.127902860792105 | AU104: 0.233180991042087 | AV104: =1.64*RC[-1] -> 0.382416825309023 | AW104: =IF(EQUAL(VLOOKUP(RC[-4], R9C3:R186C4, 2, 0), 1), RC[-1], NA()) -> #ERR: ArgCount | AX104: =IF(ISERROR(RC[-1])=1, "", RC[-5]) ->  | AY104: 'Tunisia | AZ104: 'TUN | BA104: 0.0200119498982371 | BB104: 0.223105684616046 | BC104: =1.64*RC[-1] -> 0.365893322770315 | BD104: =IF(EQUAL(VLOOKUP(RC[-4], R9C3:R186C4, 2, 0), 1), RC[-1], NA()) -> #ERR: ArgCount | BE104: =IF(ISERROR(RC[-1])=1, "", RC[-5]) -> 
B105: 'Luxembourg | C105: 'LUX | D105: =IF(EQUAL(ComparativeCharts!R[+11]C, ""), "", 1) ->  | E105: =IF(EQUAL(ComparativeCharts!R[+11]C, ""), "", 1) -> #EMPTY! | O105: 98 | P105: 'Nepal | Q105: 'NPL | R105: 0.0473654633477931 | S105: 0.360314615495306 | T105: =1.64*RC[-1] -> 0.590915969412302 | U105: =IF(EQUAL(VLOOKUP(RC[-4], R9C3:R186C4, 2, 0), 1), RC[-1], NA()) -> #ERR: ArgCount | V105: =IF(ISERROR(RC[-1])=1, "", RC[-5]) ->  | W105: 'Uruguay | X105: 'URY | Y105: 0.3479364852872 | Z105: 0.299881889042829 | AA105: =1.64*RC[-1] -> 0.49180629803024 | AB105: =IF(EQUAL(VLOOKUP(RC[-4], R9C3:R186C4, 2, 0), 1), RC[-1], NA()) -> #ERR: ArgCount | AC105: =IF(ISERROR(RC[-1])=1, "", RC[-5]) ->  | AD105: 'Lithuania | AE105: 'LTU | AF105: 0.126847596630602 | AG105: 0.242598933058622 | AH105: =1.64*RC[-1] -> 0.39786225021614 | AI105: =IF(EQUAL(VLOOKUP(RC[-4], R9C3:R186C4, 2, 0), 1), RC[-1], NA()) -> #ERR: ArgCount | AJ105: =IF(ISERROR(RC[-1])=1, "", RC[-5]) ->  | AK105: 'Colombia | AL105: 'COL | AM105: 0.289545075750528 | AN105: 0.228760003290238 | AO105: =1.64*RC[-1] -> 0.37516640539599 | AP105: =IF(EQUAL(VLOOKUP(RC[-4], R9C3:R186C4, 2, 0), 1), RC[-1], NA()) -> #ERR: ArgCount | AQ105: =IF(ISERROR(RC[-1])=1, "", RC[-5]) ->  | AR105: 'Slovak Republic | AS105: 'SVK | AT105: 0.13405598739383 | AU105: 0.171877697140126 | AV105: =1.64*RC[-1] -> 0.281879423309807 | AW105: =IF(EQUAL(VLOOKUP(RC[-4], R9C3:R186C4, 2, 0), 1), RC[-1], NA()) -> #ERR: ArgCount | AX105: =IF(ISERROR(RC[-1])=1, "", RC[-5]) ->  | AY105: 'Slovak Republic | AZ105: 'SVK | BA105: 0.0300883597642541 | BB105: 0.174052621287161 | BC105: =1.64*RC[-1] -> 0.285446298910944 | BD105: =IF(EQUAL(VLOOKUP(RC[-4], R9C3:R186C4, 2, 0), 1), RC[-1], NA()) -> #ERR: ArgCount | BE105: =IF(ISERROR(RC[-1])=1, "", RC[-5]) -> 
B106: 'Latvia | C106: 'LVA | D106: =IF(EQUAL(ComparativeCharts!R[+11]C, ""), "", 1) ->  | E106: =IF(EQUAL(ComparativeCharts!R[+11]C, ""), "", 1) -> #EMPTY! | O106: 99 | P106: 'Comoros | Q106: 'COM | R106: 0.0611725377293941 | S106: 0.360314615495306 | T106: =1.64*RC[-1] -> 0.590915969412302 | U106: =IF(EQUAL(VLOOKUP(RC[-4], R9C3:R186C4, 2, 0), 1), RC[-1], NA()) -> #ERR: ArgCount | V106: =IF(ISERROR(RC[-1])=1, "", RC[-5]) ->  | W106: 'Bahamas, The | X106: 'BHS | Y106: 0.372137476593534 | Z106: 0.412522842574475 | AA106: =1.64*RC[-1] -> 0.676537461822139 | AB106: =IF(EQUAL(VLOOKUP(RC[-4], R9C3:R186C4, 2, 0), 1), RC[-1], NA()) -> #ERR: ArgCount | AC106: =IF(ISERROR(RC[-1])=1, "", RC[-5]) ->  | AD106: 'United Arab Emirates | AE106: 'ARE | AF106: 0.138287299963074 | AG106: 0.319089592041234 | AH106: =1.64*RC[-1] -> 0.523306930947624 | AI106: =IF(EQUAL(VLOOKUP(RC[-4], R9C3:R186C4, 2, 0), 1), RC[-1], NA()) -> #ERR: ArgCount | AJ106: =IF(ISERROR(RC[-1])=1, "", RC[-5]) ->  | AK106: 'Mali | AL106: 'MLI | AM106: 0.28967691596475 | AN106: 0.516616692692467 | AO106: =1.64*RC[-1] -> 0.847251376015646 | AP106: =IF(EQUAL(VLOOKUP(RC[-4], R9C3:R186C4, 2, 0), 1), RC[-1], NA()) -> #ERR: ArgCount | AQ106: =IF(ISERROR(RC[-1])=1, "", RC[-5]) ->  | AR106: 'Croatia | AS106: 'HRV | AT106: 0.145956470866589 | AU106: 0.186137681288291 | AV106: =1.64*RC[-1] -> 0.305265797312797 | AW106: =IF(EQUAL(VLOOKUP(RC[-4], R9C3:R186C4, 2, 0), 1), RC[-1], NA()) -> #ERR: ArgCount | AX106: =IF(ISERROR(RC[-1])=1, "", RC[-5]) ->  | AY106: 'Lithuania | AZ106: 'LTU | BA106: 0.0341297068355733 | BB106: 0.188243145715436 | BC106: =1.64*RC[-1] -> 0.308718758973315 | BD106: =IF(EQUAL(VLOOKUP(RC[-4], R9C3:R186C4, 2, 0), 1), RC[-1], NA()) -> #ERR: ArgCount | BE106: =IF(ISERROR(RC[-1])=1, "", RC[-5]) -> 
B107: 'Macao, China | C107: 'MAC | D107: =IF(EQUAL(ComparativeCharts!R[+11]C, ""), "", 1) ->  | E107: =IF(EQUAL(ComparativeCharts!R[+11]C, ""), "", 1) -> #EMPTY! | O107: 100 | P107: 'Malawi | Q107: 'MWI | R107: 0.0616839280764312 | S107: 0.251300233223489 | T107: =1.64*RC[-1] -> 0.412132382486522 | U107: =IF(EQUAL(VLOOKUP(RC[-4], R9C3:R186C4, 2, 0), 1), RC[-1], NA()) -> #ERR: ArgCount | V107: =IF(ISERROR(RC[-1])=1, "", RC[-5]) ->  | W107: 'Mongolia | X107: 'MNG | Y107: 0.372137476593534 | Z107: 0.412522842574475 | AA107: =1.64*RC[-1] -> 0.676537461822139 | AB107: =IF(EQUAL(VLOOKUP(RC[-4], R9C3:R186C4, 2, 0), 1), RC[-1], NA()) -> #ERR: ArgCount | AC107: =IF(ISERROR(RC[-1])=1, "", RC[-5]) ->  | AD107: 'Croatia | AE107: 'HRV | AF107: 0.149624309846297 | AG107: 0.259550680503314 | AH107: =1.64*RC[-1] -> 0.425663116025435 | AI107: =IF(EQUAL(VLOOKUP(RC[-4], R9C3:R186C4, 2, 0), 1), RC[-1], NA()) -> #ERR: ArgCount | AJ107: =IF(ISERROR(RC[-1])=1, "", RC[-5]) ->  | AK107: 'Swaziland | AL107: 'SWZ | AM107: 0.293821058819223 | AN107: 0.351244204676472 | AO107: =1.64*RC[-1] -> 0.576040495669414 | AP107: =IF(EQUAL(VLOOKUP(RC[-4], R9C3:R186C4, 2, 0), 1), RC[-1], NA()) -> #ERR: ArgCount | AQ107: =IF(ISERROR(RC[-1])=1, "", RC[-5]) ->  | AR107: 'Latvia | AS107: 'LVA | AT107: 0.154512305300577 | AU107: 0.179548241092202 | AV107: =1.64*RC[-1] -> 0.294459115391211 | AW107: =IF(EQUAL(VLOOKUP(RC[-4], R9C3:R186C4, 2, 0), 1), RC[-1], NA()) -> #ERR: ArgCount | AX107: =IF(ISERROR(RC[-1])=1, "", RC[-5]) ->  | AY107: 'Brazil | AZ107: 'BRA | BA107: 0.0576168441917039 | BB107: 0.189092987537097 | BC107: =1.64*RC[-1] -> 0.310112499560839 | BD107: =IF(EQUAL(VLOOKUP(RC[-4], R9C3:R186C4, 2, 0), 1), RC[-1], NA()) -> #ERR: ArgCount | BE107: =IF(ISERROR(RC[-1])=1, "", RC[-5]) -> 
B108: 'Morocco | C108: 'MAR | D108: =IF(EQUAL(ComparativeCharts!R[+11]C, ""), "", 1) ->  | E108: =IF(EQUAL(ComparativeCharts!R[+11]C, ""), "", 1) -> #EMPTY! | O108: 101 | P108: 'Nicaragua | Q108: 'NIC | R108: 0.0690101282391248 | S108: 0.254026944310672 | T108: =1.64*RC[-1] -> 0.416604188669502 | U108: =IF(EQUAL(VLOOKUP(RC[-4], R9C3:R186C4, 2, 0), 1), RC[-1], NA()) -> #ERR: ArgCount | V108: =IF(ISERROR(RC[-1])=1, "", RC[-5]) ->  | W108: 'Korea, Dem. Rep. | X108: 'PRK | Y108: 0.372137476593534 | Z108: 0.412522842574475 | AA108: =1.64*RC[-1] -> 0.676537461822139 | AB108: =IF(EQUAL(VLOOKUP(RC[-4], R9C3:R186C4, 2, 0), 1), RC[-1], NA()) -> #ERR: ArgCount | AC108: =IF(ISERROR(RC[-1])=1, "", RC[-5]) ->  | AD108: 'Gambia, The | AE108: 'GMB | AF108: 0.163670195291929 | AG108: 0.768168783719135 | AH108: =1.64*RC[-1] -> 1.25979680529938 | AI108: =IF(EQUAL(VLOOKUP(RC[-4], R9C3:R186C4, 2, 0), 1), RC[-1], NA()) -> #ERR: ArgCount | AJ108: =IF(ISERROR(RC[-1])=1, "", RC[-5]) ->  | AK108: 'United Arab Emirates | AL108: 'ARE | AM108: 0.296219448489337 | AN108: 0.395254221998157 | AO108: =1.64*RC[-1] -> 0.648216924076978 | AP108: =IF(EQUAL(VLOOKUP(RC[-4], R9C3:R186C4, 2, 0), 1), RC[-1], NA()) -> #ERR: ArgCount | AQ108: =IF(ISERROR(RC[-1])=1, "", RC[-5]) ->  | AR108: 'India | AS108: 'IND | AT108: 0.160389271213263 | AU108: 0.207737275615815 | AV108: =1.64*RC[-1] -> 0.340689132009937 | AW108: =IF(EQUAL(VLOOKUP(RC[-4], R9C3:R186C4, 2, 0), 1), RC[-1], NA()) -> #ERR: ArgCount | AX108: =IF(ISERROR(RC[-1])=1, "", RC[-5]) ->  | AY108: 'Morocco | AZ108: 'MAR | BA108: 0.125190252839364 | BB108: 0.210520528590018 | BC108: =1.64*RC[-1] -> 0.345253666887629 | BD108: =IF(EQUAL(VLOOKUP(RC[-4], R9C3:R186C4, 2, 0), 1), RC[-1], NA()) -> #ERR: ArgCount | BE108: =IF(ISERROR(RC[-1])=1, "", RC[-5]) -> 
B109: 'Moldova | C109: 'MDA | D109: =IF(EQUAL(ComparativeCharts!R[+11]C, ""), "", 1) ->  | E109: =IF(EQUAL(ComparativeCharts!R[+11]C, ""), "", 1) -> #EMPTY! | O109: 102 | P109: 'Macedonia, FYR | Q109: 'MKD | R109: 0.0867107856585488 | S109: 0.291618285870453 | T109: =1.64*RC[-1] -> 0.478253988827543 | U109: =IF(EQUAL(VLOOKUP(RC[-4], R9C3:R186C4, 2, 0), 1), RC[-1], NA()) -> #ERR: ArgCount | V109: =IF(ISERROR(RC[-1])=1, "", RC[-5]) ->  | W109: 'Cyprus | X109: 'CYP | Y109: 0.380549122874782 | Z109: 0.299881889042829 | AA109: =1.64*RC[-1] -> 0.49180629803024 | AB109: =IF(EQUAL(VLOOKUP(RC[-4], R9C3:R186C4, 2, 0), 1), RC[-1], NA()) -> #ERR: ArgCount | AC109: =IF(ISERROR(RC[-1])=1, "", RC[-5]) ->  | AD109: 'Mauritius | AE109: 'MUS | AF109: 0.172173934684576 | AG109: 0.267933040052607 | AH109: =1.64*RC[-1] -> 0.439410185686275 | AI109: =IF(EQUAL(VLOOKUP(RC[-4], R9C3:R186C4, 2, 0), 1), RC[-1], NA()) -> #ERR: ArgCount | AJ109: =IF(ISERROR(RC[-1])=1, "", RC[-5]) ->  | AK109: 'Oman | AL109: 'OMN | AM109: 0.304968009876648 | AN109: 0.395254221998157 | AO109: =1.64*RC[-1] -> 0.648216924076978 | AP109: =IF(EQUAL(VLOOKUP(RC[-4], R9C3:R186C4, 2, 0), 1), RC[-1], NA()) -> #ERR: ArgCount | AQ109: =IF(ISERROR(RC[-1])=1, "", RC[-5]) ->  | AR109: 'Tanzania | AS109: 'TZA | AT109: 0.160842662764519 | AU109: 0.253185404132827 | AV109: =1.64*RC[-1] -> 0.415224062777836 | AW109: =IF(EQUAL(VLOOKUP(RC[-4], R9C3:R186C4, 2, 0), 1), RC[-1], NA()) -> #ERR: ArgCount | AX109: =IF(ISERROR(RC[-1])=1, "", RC[-5]) ->  | AY109: 'Jordan | AZ109: 'JOR | BA109: 0.139041897104576 | BB109: 0.216758330803704 | BC109: =1.64*RC[-1] -> 0.355483662518075 | BD109: =IF(EQUAL(VLOOKUP(RC[-4], R9C3:R186C4, 2, 0), 1), RC[-1], NA()) -> #ERR: ArgCount | BE109: =IF(ISERROR(RC[-1])=1, "", RC[-5]) -> 
B110: 'Madagascar | C110: 'MDG | D110: =IF(EQUAL(ComparativeCharts!R[+11]C, ""), "", 1) ->  | E110: =IF(EQUAL(ComparativeCharts!R[+11]C, ""), "", 1) -> #EMPTY! | O110: 103 | P110: 'Papua New Guinea | Q110: 'PNG | R110: 0.121007859483297 | S110: 0.254026944310672 | T110: =1.64*RC[-1] -> 0.416604188669502 | U110: =IF(EQUAL(VLOOKUP(RC[-4], R9C3:R186C4, 2, 0), 1), RC[-1], NA()) -> #ERR: ArgCount | V110: =IF(ISERROR(RC[-1])=1, "", RC[-5]) ->  | W110: 'Croatia | X110: 'HRV | Y110: 0.405957114965074 | Z110: 0.243549981714305 | AA110: =1.64*RC[-1] -> 0.39942197001146 | AB110: =IF(EQUAL(VLOOKUP(RC[-4], R9C3:R186C4, 2, 0), 1), RC[-1], NA()) -> #ERR: ArgCount | AC110: =IF(ISERROR(RC[-1])=1, "", RC[-5]) ->  | AD110: 'Peru | AE110: 'PER | AF110: 0.173464601067724 | AG110: 0.242854244904284 | AH110: =1.64*RC[-1] -> 0.398280961643026 | AI110: =IF(EQUAL(VLOOKUP(RC[-4], R9C3:R186C4, 2, 0), 1), RC[-1], NA()) -> #ERR: ArgCount | AJ110: =IF(ISERROR(RC[-1])=1, "", RC[-5]) ->  | AK110: 'Qatar | AL110: 'QAT | AM110: 0.326586360775386 | AN110: 0.395254221998157 | AO110: =1.64*RC[-1] -> 0.648216924076978 | AP110: =IF(EQUAL(VLOOKUP(RC[-4], R9C3:R186C4, 2, 0), 1), RC[-1], NA()) -> #ERR: ArgCount | AQ110: =IF(ISERROR(RC[-1])=1, "", RC[-5]) ->  | AR110: 'Lithuania | AS110: 'LTU | AT110: 0.180154426081555 | AU110: 0.179548241092202 | AV110: =1.64*RC[-1] -> 0.294459115391211 | AW110: =IF(EQUAL(VLOOKUP(RC[-4], R9C3:R186C4, 2, 0), 1), RC[-1], NA()) -> #ERR: ArgCount | AX110: =IF(ISERROR(RC[-1])=1, "", RC[-5]) ->  | AY110: 'Korea, Rep. | AZ110: 'KOR | BA110: 0.159186610379527 | BB110: 0.154823207917754 | BC110: =1.64*RC[-1] -> 0.253910060985117 | BD110: =IF(EQUAL(VLOOKUP(RC[-4], R9C3:R186C4, 2, 0), 1), RC[-1], NA()) -> #ERR: ArgCount | BE110: =IF(ISERROR(RC[-1])=1, "", RC[-5]) -> 
B111: 'Maldives | C111: 'MDV | D111: =IF(EQUAL(ComparativeCharts!R[+11]C, ""), "", 1) ->  | E111: =IF(EQUAL(ComparativeCharts!R[+11]C, ""), "", 1) -> #EMPTY! | O111: 104 | P111: 'Jordan | Q111: 'JOR | R111: 0.153359121198554 | S111: 0.251300233223489 | T111: =1.64*RC[-1] -> 0.412132382486522 | U111: =IF(EQUAL(VLOOKUP(RC[-4], R9C3:R186C4, 2, 0), 1), RC[-1], NA()) -> #ERR: ArgCount | V111: =IF(ISERROR(RC[-1])=1, "", RC[-5]) ->  | W111: 'Bulgaria | X111: 'BGR | Y111: 0.43392867304825 | Z111: 0.234722074427469 | AA111: =1.64*RC[-1] -> 0.384944202061049 | AB111: =IF(EQUAL(VLOOKUP(RC[-4], R9C3:R186C4, 2, 0), 1), RC[-1], NA()) -> #ERR: ArgCount | AC111: =IF(ISERROR(RC[-1])=1, "", RC[-5]) ->  | AD111: 'Lebanon | AE111: 'LBN | AF111: 0.174306041771159 | AG111: 0.319089592041234 | AH111: =1.64*RC[-1] -> 0.523306930947624 | AI111: =IF(EQUAL(VLOOKUP(RC[-4], R9C3:R186C4, 2, 0), 1), RC[-1], NA()) -> #ERR: ArgCount | AJ111: =IF(ISERROR(RC[-1])=1, "", RC[-5]) ->  | AK111: 'Gabon | AL111: 'GAB | AM111: 0.354853952729547 | AN111: 0.519940958319459 | AO111: =1.64*RC[-1] -> 0.852703171643913 | AP111: =IF(EQUAL(VLOOKUP(RC[-4], R9C3:R186C4, 2, 0), 1), RC[-1], NA()) -> #ERR: ArgCount | AQ111: =IF(ISERROR(RC[-1])=1, "", RC[-5]) ->  | AR111: 'Lebanon | AS111: 'LBN | AT111: 0.262473488103808 | AU111: 0.276349686366578 | AV111: =1.64*RC[-1] -> 0.453213485641188 | AW111: =IF(EQUAL(VLOOKUP(RC[-4], R9C3:R186C4, 2, 0), 1), RC[-1], NA()) -> #ERR: ArgCount | AX111: =IF(ISERROR(RC[-1])=1, "", RC[-5]) ->  | AY111: 'Lesotho | AZ111: 'LSO | BA111: 0.187611409323103 | BB111: 0.376110791704214 | BC111: =1.64*RC[-1] -> 0.616821698394911 | BD111: =IF(EQUAL(VLOOKUP(RC[-4], R9C3:R186C4, 2, 0), 1), RC[-1], NA()) -> #ERR: ArgCount | BE111: =IF(ISERROR(RC[-1])=1, "", RC[-5]) -> 
B112: 'Mexico | C112: 'MEX | D112: =IF(EQUAL(ComparativeCharts!R[+11]C, ""), "", 1) ->  | E112: =IF(EQUAL(ComparativeCharts!R[+11]C, ""), "", 1) -> #EMPTY! | O112: 105 | P112: 'Moldova | Q112: 'MDA | R112: 0.160796619348054 | S112: 0.251300233223489 | T112: =1.64*RC[-1] -> 0.412132382486522 | U112: =IF(EQUAL(VLOOKUP(RC[-4], R9C3:R186C4, 2, 0), 1), RC[-1], NA()) -> #ERR: ArgCount | V112: =IF(ISERROR(RC[-1])=1, "", RC[-5]) ->  | W112: 'Chile | X112: 'CHL | Y112: 0.451273600455869 | Z112: 0.263344534520094 | AA112: =1.64*RC[-1] -> 0.431885036612954 | AB112: =IF(EQUAL(VLOOKUP(RC[-4], R9C3:R186C4, 2, 0), 1), RC[-1], NA()) -> #ERR: ArgCount | AC112: =IF(ISERROR(RC[-1])=1, "", RC[-5]) ->  | AD112: 'Mexico | AE112: 'MEX | AF112: 0.178865577914269 | AG112: 0.233636532185851 | AH112: =1.64*RC[-1] -> 0.383163912784796 | AI112: =IF(EQUAL(VLOOKUP(RC[-4], R9C3:R186C4, 2, 0), 1), RC[-1], NA()) -> #ERR: ArgCount | AJ112: =IF(ISERROR(RC[-1])=1, "", RC[-5]) ->  | AK112: 'Paraguay | AL112: 'PRY | AM112: 0.369651533683329 | AN112: 0.516616692692467 | AO112: =1.64*RC[-1] -> 0.847251376015646 | AP112: =IF(EQUAL(VLOOKUP(RC[-4], R9C3:R186C4, 2, 0), 1), RC[-1], NA()) -> #ERR: ArgCount | AQ112: =IF(ISERROR(RC[-1])=1, "", RC[-5]) ->  | AR112: 'Ethiopia | AS112: 'ETH | AT112: 0.269102675980988 | AU112: 0.428662080608825 | AV112: =1.64*RC[-1] -> 0.703005812198473 | AW112: =IF(EQUAL(VLOOKUP(RC[-4], R9C3:R186C4, 2, 0), 1), RC[-1], NA()) -> #ERR: ArgCount | AX112: =IF(ISERROR(RC[-1])=1, "", RC[-5]) ->  | AY112: 'Cuba | AZ112: 'CUB | BA112: 0.274198294200904 | BB112: 0.267063170408295 | BC112: =1.64*RC[-1] -> 0.437983599469604 | BD112: =IF(EQUAL(VLOOKUP(RC[-4], R9C3:R186C4, 2, 0), 1), RC[-1], NA()) -> #ERR: ArgCount | BE112: =IF(ISERROR(RC[-1])=1, "", RC[-5]) -> 
B113: 'Macedonia, FYR | C113: 'MKD | D113: =IF(EQUAL(ComparativeCharts!R[+11]C, ""), "", 1) ->  | E113: =IF(EQUAL(ComparativeCharts!R[+11]C, ""), "", 1) -> #EMPTY! | O113: 106 | P113: 'Venezuela, RB | Q113: 'VEN | R113: 0.179080243304874 | S113: 0.251300233223489 | T113: =1.64*RC[-1] -> 0.412132382486522 | U113: =IF(EQUAL(VLOOKUP(RC[-4], R9C3:R186C4, 2, 0), 1), RC[-1], NA()) -> #ERR: ArgCount | V113: =IF(ISERROR(RC[-1])=1, "", RC[-5]) ->  | W113: 'Latvia | X113: 'LVA | Y113: 0.459789395214267 | Z113: 0.234722074427469 | AA113: =1.64*RC[-1] -> 0.384944202061049 | AB113: =IF(EQUAL(VLOOKUP(RC[-4], R9C3:R186C4, 2, 0), 1), RC[-1], NA()) -> #ERR: ArgCount | AC113: =IF(ISERROR(RC[-1])=1, "", RC[-5]) ->  | AD113: 'Botswana | AE113: 'BWA | AF113: 0.220977825427987 | AG113: 0.256872813180543 | AH113: =1.64*RC[-1] -> 0.421271413616091 | AI113: =IF(EQUAL(VLOOKUP(RC[-4], R9C3:R186C4, 2, 0), 1), RC[-1], NA()) -> #ERR: ArgCount | AJ113: =IF(ISERROR(RC[-1])=1, "", RC[-5]) ->  | AK113: 'Ecuador | AL113: 'ECU | AM113: 0.376566173046927 | AN113: 0.393787925241036 | AO113: =1.64*RC[-1] -> 0.645812197395299 | AP113: =IF(EQUAL(VLOOKUP(RC[-4], R9C3:R186C4, 2, 0), 1), RC[-1], NA()) -> #ERR: ArgCount | AQ113: =IF(ISERROR(RC[-1])=1, "", RC[-5]) ->  | AR113: 'Uruguay | AS113: 'URY | AT113: 0.269805905934289 | AU113: 0.276349686366578 | AV113: =1.64*RC[-1] -> 0.453213485641188 | AW113: =IF(EQUAL(VLOOKUP(RC[-4], R9C3:R186C4, 2, 0), 1), RC[-1], NA()) -> #ERR: ArgCount | AX113: =IF(ISERROR(RC[-1])=1, "", RC[-5]) ->  | AY113: 'South Africa | AZ113: 'ZAF | BA113: 0.29886445016777 | BB113: 0.171406906025575 | BC113: =1.64*RC[-1] -> 0.281107325881943 | BD113: =IF(EQUAL(VLOOKUP(RC[-4], R9C3:R186C4, 2, 0), 1), RC[-1], NA()) -> #ERR: ArgCount | BE113: =IF(ISERROR(RC[-1])=1, "", RC[-5]) -> 
B114: 'Mali | C114: 'MLI | D114: =IF(EQUAL(ComparativeCharts!R[+11]C, ""), "", 1) ->  | E114: =IF(EQUAL(ComparativeCharts!R[+11]C, ""), "", 1) -> #EMPTY! | O114: 107 | P114: 'Thailand | Q114: 'THA | R114: 0.215389502895861 | S114: 0.251300233223489 | T114: =1.64*RC[-1] -> 0.412132382486522 | U114: =IF(EQUAL(VLOOKUP(RC[-4], R9C3:R186C4, 2, 0), 1), RC[-1], NA()) -> #ERR: ArgCount | V114: =IF(ISERROR(RC[-1])=1, "", RC[-5]) ->  | W114: 'China | X114: 'CHN | Y114: 0.48347625661563 | Z114: 0.263344534520094 | AA114: =1.64*RC[-1] -> 0.431885036612954 | AB114: =IF(EQUAL(VLOOKUP(RC[-4], R9C3:R186C4, 2, 0), 1), RC[-1], NA()) -> #ERR: ArgCount | AC114: =IF(ISERROR(RC[-1])=1, "", RC[-5]) ->  | AD114: 'Bahrain | AE114: 'BHR | AF114: 0.235499656260677 | AG114: 0.319089592041234 | AH114: =1.64*RC[-1] -> 0.523306930947624 | AI114: =IF(EQUAL(VLOOKUP(RC[-4], R9C3:R186C4, 2, 0), 1), RC[-1], NA()) -> #ERR: ArgCount | AJ114: =IF(ISERROR(RC[-1])=1, "", RC[-5]) ->  | AK114: 'Malta | AL114: 'MLT | AM114: 0.386406570983068 | AN114: 0.519940958319459 | AO114: =1.64*RC[-1] -> 0.852703171643913 | AP114: =IF(EQUAL(VLOOKUP(RC[-4], R9C3:R186C4, 2, 0), 1), RC[-1], NA()) -> #ERR: ArgCount | AQ114: =IF(ISERROR(RC[-1])=1, "", RC[-5]) ->  | AR114: 'Gambia, The | AS114: 'GMB | AT114: 0.274143806590087 | AU114: 0.443073362506416 | AV114: =1.64*RC[-1] -> 0.726640314510522 | AW114: =IF(EQUAL(VLOOKUP(RC[-4], R9C3:R186C4, 2, 0), 1), RC[-1], NA()) -> #ERR: ArgCount | AX114: =IF(ISERROR(RC[-1])=1, "", RC[-5]) ->  | AY114: 'Mauritius | AZ114: 'MUS | BA114: 0.336362976657675 | BB114: 0.228431480219337 | BC114: =1.64*RC[-1] -> 0.374627627559713 | BD114: =IF(EQUAL(VLOOKUP(RC[-4], R9C3:R186C4, 2, 0), 1), RC[-1], NA()) -> #ERR: ArgCount | BE114: =IF(ISERROR(RC[-1])=1, "", RC[-5]) -> 
B115: 'Malta | C115: 'MLT | D115: =IF(EQUAL(ComparativeCharts!R[+11]C, ""), "", 1) ->  | E115: =IF(EQUAL(ComparativeCharts!R[+11]C, ""), "", 1) -> #EMPTY! | O115: 108 | P115: 'Ecuador | Q115: 'ECU | R115: 0.267604098791391 | S115: 0.251300233223489 | T115: =1.64*RC[-1] -> 0.412132382486522 | U115: =IF(EQUAL(VLOOKUP(RC[-4], R9C3:R186C4, 2, 0), 1), RC[-1], NA()) -> #ERR: ArgCount | V115: =IF(ISERROR(RC[-1])=1, "", RC[-5]) ->  | W115: 'Argentina | X115: 'ARG | Y115: 0.506835372196173 | Z115: 0.263344534520094 | AA115: =1.64*RC[-1] -> 0.431885036612954 | AB115: =IF(EQUAL(VLOOKUP(RC[-4], R9C3:R186C4, 2, 0), 1), RC[-1], NA()) -> #ERR: ArgCount | AC115: =IF(ISERROR(RC[-1])=1, "", RC[-5]) ->  | AD115: 'Estonia | AE115: 'EST | AF115: 0.258183039906133 | AG115: 0.242598933058622 | AH115: =1.64*RC[-1] -> 0.39786225021614 | AI115: =IF(EQUAL(VLOOKUP(RC[-4], R9C3:R186C4, 2, 0), 1), RC[-1], NA()) -> #ERR: ArgCount | AJ115: =IF(ISERROR(RC[-1])=1, "", RC[-5]) ->  | AK115: 'Japan | AL115: 'JPN | AM115: 0.388868992619871 | AN115: 0.2290464009857 | AO115: =1.64*RC[-1] -> 0.375636097616548 | AP115: =IF(EQUAL(VLOOKUP(RC[-4], R9C3:R186C4, 2, 0), 1), RC[-1], NA()) -> #ERR: ArgCount | AQ115: =IF(ISERROR(RC[-1])=1, "", RC[-5]) ->  | AR115: 'Argentina | AS115: 'ARG | AT115: 0.318942536948538 | AU115: 0.218139839508948 | AV115: =1.64*RC[-1] -> 0.357749336794675 | AW115: =IF(EQUAL(VLOOKUP(RC[-4], R9C3:R186C4, 2, 0), 1), RC[-1], NA()) -> #ERR: ArgCount | AX115: =IF(ISERROR(RC[-1])=1, "", RC[-5]) ->  | AY115: 'West Bank and Gaza | AZ115: 'WTB | BA115: 0.362603232869128 | BB115: 0.536534704411876 | BC115: =1.64*RC[-1] -> 0.879916915235477 | BD115: =IF(EQUAL(VLOOKUP(RC[-4], R9C3:R186C4, 2, 0), 1), RC[-1], NA()) -> #ERR: ArgCount | BE115: =IF(ISERROR(RC[-1])=1, "", RC[-5]) -> 
B116: 'Myanmar | C116: 'MMR | D116: =IF(EQUAL(ComparativeCharts!R[+11]C, ""), "", 1) ->  | E116: =IF(EQUAL(ComparativeCharts!R[+11]C, ""), "", 1) -> #EMPTY! | O116: 109 | P116: 'Suriname | Q116: 'SUR | R116: 0.282616031256599 | S116: 0.291377601755329 | T116: =1.64*RC[-1] -> 0.47785926687874 | U116: =IF(EQUAL(VLOOKUP(RC[-4], R9C3:R186C4, 2, 0), 1), RC[-1], NA()) -> #ERR: ArgCount | V116: =IF(ISERROR(RC[-1])=1, "", RC[-5]) ->  | W116: 'Malaysia | X116: 'MYS | Y116: 0.551872995359018 | Z116: 0.25228486761248 | AA116: =1.64*RC[-1] -> 0.413747182884467 | AB116: =IF(EQUAL(VLOOKUP(RC[-4], R9C3:R186C4, 2, 0), 1), RC[-1], NA()) -> #ERR: ArgCount | AC116: =IF(ISERROR(RC[-1])=1, "", RC[-5]) ->  | AD116: 'Argentina | AE116: 'ARG | AF116: 0.262044370021487 | AG116: 0.248661311888018 | AH116: =1.64*RC[-1] -> 0.407804551496349 | AI116: =IF(EQUAL(VLOOKUP(RC[-4], R9C3:R186C4, 2, 0), 1), RC[-1], NA()) -> #ERR: ArgCount | AJ116: =IF(ISERROR(RC[-1])=1, "", RC[-5]) ->  | AK116: 'Jordan | AL116: 'JOR | AM116: 0.416552258524666 | AN116: 0.274050600863496 | AO116: =1.64*RC[-1] -> 0.449442985416133 | AP116: =IF(EQUAL(VLOOKUP(RC[-4], R9C3:R186C4, 2, 0), 1), RC[-1], NA()) -> #ERR: ArgCount | AQ116: =IF(ISERROR(RC[-1])=1, "", RC[-5]) ->  | AR116: 'Dominican Republic | AS116: 'DOM | AT116: 0.379557024908821 | AU116: 0.313894625236573 | AV116: =1.64*RC[-1] -> 0.51478718538798 | AW116: =IF(EQUAL(VLOOKUP(RC[-4], R9C3:R186C4, 2, 0), 1), RC[-1], NA()) -> #ERR: ArgCount | AX116: =IF(ISERROR(RC[-1])=1, "", RC[-5]) ->  | AY116: 'Namibia | AZ116: 'NAM | BA116: 0.381908918699996 | BB116: 0.239220980828307 | BC116: =1.64*RC[-1] -> 0.392322408558423 | BD116: =IF(EQUAL(VLOOKUP(RC[-4], R9C3:R186C4, 2, 0), 1), RC[-1], NA()) -> #ERR: ArgCount | BE116: =IF(ISERROR(RC[-1])=1, "", RC[-5]) -> 
B117: 'Mongolia | C117: 'MNG | D117: =IF(EQUAL(ComparativeCharts!R[+11]C, ""), "", 1) -> 1 | E117: =IF(EQUAL(ComparativeCharts!R[+11]C, ""), "", 1) -> #EMPTY! | O117: 110 | P117: 'Madagascar | Q117: 'MDG | R117: 0.309258608410746 | S117: 0.287283341236829 | T117: =1.64*RC[-1] -> 0.4711446796284 | U117: =IF(EQUAL(VLOOKUP(RC[-4], R9C3:R186C4, 2, 0), 1), RC[-1], NA()) -> #ERR: ArgCount | V117: =IF(ISERROR(RC[-1])=1, "", RC[-5]) ->  | W117: 'Gambia, The | X117: 'GMB | Y117: 0.561300100530776 | Z117: 0.412522842574475 | AA117: =1.64*RC[-1] -> 0.676537461822139 | AB117: =IF(EQUAL(VLOOKUP(RC[-4], R9C3:R186C4, 2, 0), 1), RC[-1], NA()) -> #ERR: ArgCount | AC117: =IF(ISERROR(RC[-1])=1, "", RC[-5]) ->  | AD117: 'Morocco | AE117: 'MAR | AF117: 0.267083364834212 | AG117: 0.222481788006156 | AH117: =1.64*RC[-1] -> 0.364870132330096 | AI117: =IF(EQUAL(VLOOKUP(RC[-4], R9C3:R186C4, 2, 0), 1), RC[-1], NA()) -> #ERR: ArgCount | AJ117: =IF(ISERROR(RC[-1])=1, "", RC[-5]) ->  | AK117: 'Tunisia | AL117: 'TUN | AM117: 0.429005707756956 | AN117: 0.291778685386365 | AO117: =1.64*RC[-1] -> 0.478517044033639 | AP117: =IF(EQUAL(VLOOKUP(RC[-4], R9C3:R186C4, 2, 0), 1), RC[-1], NA()) -> #ERR: ArgCount | AQ117: =IF(ISERROR(RC[-1])=1, "", RC[-5]) ->  | AR117: 'Barbados | AS117: 'BRB | AT117: 0.410867315430279 | AU117: 0.600583865212543 | AV117: =1.64*RC[-1] -> 0.984957538948571 | AW117: =IF(EQUAL(VLOOKUP(RC[-4], R9C3:R186C4, 2, 0), 1), RC[-1], NA()) -> #ERR: ArgCount | AX117: =IF(ISERROR(RC[-1])=1, "", RC[-5]) ->  | AY117: 'Czech Republic | AZ117: 'CZE | BA117: 0.384230339773304 | BB117: 0.162862701383401 | BC117: =1.64*RC[-1] -> 0.267094830268778 | BD117: =IF(EQUAL(VLOOKUP(RC[-4], R9C3:R186C4, 2, 0), 1), RC[-1], NA()) -> #ERR: ArgCount | BE117: =IF(ISERROR(RC[-1])=1, "", RC[-5]) -> 
B118: 'Mozambique | C118: 'MOZ | D118: =IF(EQUAL(ComparativeCharts!R[+11]C, ""), "", 1) ->  | E118: =IF(EQUAL(ComparativeCharts!R[+11]C, ""), "", 1) -> #EMPTY! | O118: 111 | P118: 'Bolivia | Q118: 'BOL | R118: 0.391374448651103 | S118: 0.251300233223489 | T118: =1.64*RC[-1] -> 0.412132382486522 | U118: =IF(EQUAL(VLOOKUP(RC[-4], R9C3:R186C4, 2, 0), 1), RC[-1], NA()) -> #ERR: ArgCount | V118: =IF(ISERROR(RC[-1])=1, "", RC[-5]) ->  | W118: 'Tanzania | X118: 'TZA | Y118: 0.565492677667766 | Z118: 0.265998113597101 | AA118: =1.64*RC[-1] -> 0.436236906299246 | AB118: =IF(EQUAL(VLOOKUP(RC[-4], R9C3:R186C4, 2, 0), 1), RC[-1], NA()) -> #ERR: ArgCount | AC118: =IF(ISERROR(RC[-1])=1, "", RC[-5]) ->  | AD118: 'Korea, Rep. | AE118: 'KOR | AF118: 0.408682489320044 | AG118: 0.233636532185851 | AH118: =1.64*RC[-1] -> 0.383163912784796 | AI118: =IF(EQUAL(VLOOKUP(RC[-4], R9C3:R186C4, 2, 0), 1), RC[-1], NA()) -> #ERR: ArgCount | AJ118: =IF(ISERROR(RC[-1])=1, "", RC[-5]) ->  | AK118: 'Guatemala | AL118: 'GTM | AM118: 0.444202272223092 | AN118: 0.519940958319459 | AO118: =1.64*RC[-1] -> 0.852703171643913 | AP118: =IF(EQUAL(VLOOKUP(RC[-4], R9C3:R186C4, 2, 0), 1), RC[-1], NA()) -> #ERR: ArgCount | AQ118: =IF(ISERROR(RC[-1])=1, "", RC[-5]) ->  | AR118: 'Thailand | AS118: 'THA | AT118: 0.41306970156076 | AU118: 0.207737275615815 | AV118: =1.64*RC[-1] -> 0.340689132009937 | AW118: =IF(EQUAL(VLOOKUP(RC[-4], R9C3:R186C4, 2, 0), 1), RC[-1], NA()) -> #ERR: ArgCount | AX118: =IF(ISERROR(RC[-1])=1, "", RC[-5]) ->  | AY118: 'Uruguay | AZ118: 'URY | BA118: 0.429615122038856 | BB118: 0.24990333019781 | BC118: =1.64*RC[-1] -> 0.409841461524408 | BD118: =IF(EQUAL(VLOOKUP(RC[-4], R9C3:R186C4, 2, 0), 1), RC[-1], NA()) -> #ERR: ArgCount | BE118: =IF(ISERROR(RC[-1])=1, "", RC[-5]) -> 
B119: 'Mauritania | C119: 'MRT | D119: =IF(EQUAL(ComparativeCharts!R[+11]C, ""), "", 1) ->  | E119: =IF(EQUAL(ComparativeCharts!R[+11]C, ""), "", 1) -> #EMPTY! | O119: 112 | P119: 'Romania | Q119: 'ROM | R119: 0.405795677355303 | S119: 0.254026944310672 | T119: =1.64*RC[-1] -> 0.416604188669502 | U119: =IF(EQUAL(VLOOKUP(RC[-4], R9C3:R186C4, 2, 0), 1), RC[-1], NA()) -> #ERR: ArgCount | V119: =IF(ISERROR(RC[-1])=1, "", RC[-5]) ->  | W119: 'Spain | X119: 'ESP | Y119: 0.580221715058647 | Z119: 0.25228486761248 | AA119: =1.64*RC[-1] -> 0.413747182884467 | AB119: =IF(EQUAL(VLOOKUP(RC[-4], R9C3:R186C4, 2, 0), 1), RC[-1], NA()) -> #ERR: ArgCount | AC119: =IF(ISERROR(RC[-1])=1, "", RC[-5]) ->  | AD119: 'Bahamas, The | AE119: 'BHS | AF119: 0.473726995805015 | AG119: 0.768168783719135 | AH119: =1.64*RC[-1] -> 1.25979680529938 | AI119: =IF(EQUAL(VLOOKUP(RC[-4], R9C3:R186C4, 2, 0), 1), RC[-1], NA()) -> #ERR: ArgCount | AJ119: =IF(ISERROR(RC[-1])=1, "", RC[-5]) ->  | AK119: 'Malaysia | AL119: 'MYS | AM119: 0.47682824778863 | AN119: 0.228760003290238 | AO119: =1.64*RC[-1] -> 0.37516640539599 | AP119: =IF(EQUAL(VLOOKUP(RC[-4], R9C3:R186C4, 2, 0), 1), RC[-1], NA()) -> #ERR: ArgCount | AQ119: =IF(ISERROR(RC[-1])=1, "", RC[-5]) ->  | AR119: 'Saudi Arabia | AS119: 'SAU | AT119: 0.493590938981869 | AU119: 0.256388157194472 | AV119: =1.64*RC[-1] -> 0.420476577798934 | AW119: =IF(EQUAL(VLOOKUP(RC[-4], R9C3:R186C4, 2, 0), 1), RC[-1], NA()) -> #ERR: ArgCount | AX119: =IF(ISERROR(RC[-1])=1, "", RC[-5]) ->  | AY119: 'Oman | AZ119: 'OMN | BA119: 0.483662685951545 | BB119: 0.267063170408295 | BC119: =1.64*RC[-1] -> 0.437983599469604 | BD119: =IF(EQUAL(VLOOKUP(RC[-4], R9C3:R186C4, 2, 0), 1), RC[-1], NA()) -> #ERR: ArgCount | BE119: =IF(ISERROR(RC[-1])=1, "", RC[-5]) -> 
B120: 'Martinique | C120: 'MTQ | D120: =IF(EQUAL(ComparativeCharts!R[+11]C, ""), "", 1) ->  | E120: =IF(EQUAL(ComparativeCharts!R[+11]C, ""), "", 1) -> #EMPTY! | O120: 113 | P120: 'Mali | Q120: 'MLI | R120: 0.415397145897372 | S120: 0.287283341236829 | T120: =1.64*RC[-1] -> 0.4711446796284 | U120: =IF(EQUAL(VLOOKUP(RC[-4], R9C3:R186C4, 2, 0), 1), RC[-1], NA()) -> #ERR: ArgCount | V120: =IF(ISERROR(RC[-1])=1, "", RC[-5]) ->  | W120: 'France | X120: 'FRA | Y120: 0.646650340792331 | Z120: 0.25228486761248 | AA120: =1.64*RC[-1] -> 0.413747182884467 | AB120: =IF(EQUAL(VLOOKUP(RC[-4], R9C3:R186C4, 2, 0), 1), RC[-1], NA()) -> #ERR: ArgCount | AC120: =IF(ISERROR(RC[-1])=1, "", RC[-5]) ->  | AD120: 'Qatar | AE120: 'QAT | AF120: 0.479823413121786 | AG120: 0.319089592041234 | AH120: =1.64*RC[-1] -> 0.523306930947624 | AI120: =IF(EQUAL(VLOOKUP(RC[-4], R9C3:R186C4, 2, 0), 1), RC[-1], NA()) -> #ERR: ArgCount | AJ120: =IF(ISERROR(RC[-1])=1, "", RC[-5]) ->  | AK120: 'Latvia | AL120: 'LVA | AM120: 0.508670991966978 | AN120: 0.262826647914669 | AO120: =1.64*RC[-1] -> 0.431035702580057 | AP120: =IF(EQUAL(VLOOKUP(RC[-4], R9C3:R186C4, 2, 0), 1), RC[-1], NA()) -> #ERR: ArgCount | AQ120: =IF(ISERROR(RC[-1])=1, "", RC[-5]) ->  | AR120: 'Greece | AS120: 'GRC | AT120: 0.495643464742422 | AU120: 0.218139839508948 | AV120: =1.64*RC[-1] -> 0.357749336794675 | AW120: =IF(EQUAL(VLOOKUP(RC[-4], R9C3:R186C4, 2, 0), 1), RC[-1], NA()) -> #ERR: ArgCount | AX120: =IF(ISERROR(RC[-1])=1, "", RC[-5]) ->  | AY120: 'Poland | AZ120: 'POL | BA120: 0.491902775589186 | BB120: 0.162862701383401 | BC120: =1.64*RC[-1] -> 0.267094830268778 | BD120: =IF(EQUAL(VLOOKUP(RC[-4], R9C3:R186C4, 2, 0), 1), RC[-1], NA()) -> #ERR: ArgCount | BE120: =IF(ISERROR(RC[-1])=1, "", RC[-5]) -> 
B121: 'Mauritius | C121: 'MUS | D121: =IF(EQUAL(ComparativeCharts!R[+11]C, ""), "", 1) ->  | E121: =IF(EQUAL(ComparativeCharts!R[+11]C, ""), "", 1) -> #EMPTY! | O121: 114 | P121: 'Namibia | Q121: 'NAM | R121: 0.473234571090547 | S121: 0.254026944310672 | T121: =1.64*RC[-1] -> 0.416604188669502 | U121: =IF(EQUAL(VLOOKUP(RC[-4], R9C3:R186C4, 2, 0), 1), RC[-1], NA()) -> #ERR: ArgCount | V121: =IF(ISERROR(RC[-1])=1, "", RC[-5]) ->  | W121: 'Slovak Republic | X121: 'SVK | Y121: 0.650341816245362 | Z121: 0.226638715425976 | AA121: =1.64*RC[-1] -> 0.371687493298601 | AB121: =IF(EQUAL(VLOOKUP(RC[-4], R9C3:R186C4, 2, 0), 1), RC[-1], NA()) -> #ERR: ArgCount | AC121: =IF(ISERROR(RC[-1])=1, "", RC[-5]) ->  | AD121: 'Trinidad and Tobago& Tob* | AE121: 'TTO | AF121: 0.520769745992462 | AG121: 0.374142364422074 | AH121: =1.64*RC[-1] -> 0.613593477652201 | AI121: =IF(EQUAL(VLOOKUP(RC[-4], R9C3:R186C4, 2, 0), 1), RC[-1], NA()) -> #ERR: ArgCount | AJ121: =IF(ISERROR(RC[-1])=1, "", RC[-5]) ->  | AK121: 'Bulgaria | AL121: 'BGR | AM121: 0.516489344851132 | AN121: 0.262826647914669 | AO121: =1.64*RC[-1] -> 0.431035702580057 | AP121: =IF(EQUAL(VLOOKUP(RC[-4], R9C3:R186C4, 2, 0), 1), RC[-1], NA()) -> #ERR: ArgCount | AQ121: =IF(ISERROR(RC[-1])=1, "", RC[-5]) ->  | AR121: 'Botswana | AS121: 'BWA | AT121: 0.501534020341995 | AU121: 0.272746442471847 | AV121: =1.64*RC[-1] -> 0.447304165653829 | AW121: =IF(EQUAL(VLOOKUP(RC[-4], R9C3:R186C4, 2, 0), 1), RC[-1], NA()) -> #ERR: ArgCount | AX121: =IF(ISERROR(RC[-1])=1, "", RC[-5]) ->  | AY121: 'Bahamas, The | AZ121: 'BHS | BA121: 0.497383118867935 | BB121: 0.748674396199437 | BC121: =1.64*RC[-1] -> 1.22782600976708 | BD121: =IF(EQUAL(VLOOKUP(RC[-4], R9C3:R186C4, 2, 0), 1), RC[-1], NA()) -> #ERR: ArgCount | BE121: =IF(ISERROR(RC[-1])=1, "", RC[-5]) -> 
B122: 'Malawi | C122: 'MWI | D122: =IF(EQUAL(ComparativeCharts!R[+11]C, ""), "", 1) ->  | E122: =IF(EQUAL(ComparativeCharts!R[+11]C, ""), "", 1) -> #EMPTY! | O122: 115 | P122: 'Argentina | Q122: 'ARG | R122: 0.482088728564539 | S122: 0.254026944310672 | T122: =1.64*RC[-1] -> 0.416604188669502 | U122: =IF(EQUAL(VLOOKUP(RC[-4], R9C3:R186C4, 2, 0), 1), RC[-1], NA()) -> #ERR: ArgCount | V122: =IF(ISERROR(RC[-1])=1, "", RC[-5]) ->  | W122: 'Vietnam | X122: 'VNM | Y122: 0.653299534413648 | Z122: 0.263344534520094 | AA122: =1.64*RC[-1] -> 0.431885036612954 | AB122: =IF(EQUAL(VLOOKUP(RC[-4], R9C3:R186C4, 2, 0), 1), RC[-1], NA()) -> #ERR: ArgCount | AC122: =IF(ISERROR(RC[-1])=1, "", RC[-5]) ->  | AD122: 'Costa Rica | AE122: 'CRI | AF122: 0.553507235448647 | AG122: 0.289056005758262 | AH122: =1.64*RC[-1] -> 0.47405184944355 | AI122: =IF(EQUAL(VLOOKUP(RC[-4], R9C3:R186C4, 2, 0), 1), RC[-1], NA()) -> #ERR: ArgCount | AJ122: =IF(ISERROR(RC[-1])=1, "", RC[-5]) ->  | AK122: 'Slovenia | AL122: 'SVN | AM122: 0.531546614217464 | AN122: 0.263261256825197 | AO122: =1.64*RC[-1] -> 0.431748461193323 | AP122: =IF(EQUAL(VLOOKUP(RC[-4], R9C3:R186C4, 2, 0), 1), RC[-1], NA()) -> #ERR: ArgCount | AQ122: =IF(ISERROR(RC[-1])=1, "", RC[-5]) ->  | AR122: 'Estonia | AS122: 'EST | AT122: 0.507003037488312 | AU122: 0.179548241092202 | AV122: =1.64*RC[-1] -> 0.294459115391211 | AW122: =IF(EQUAL(VLOOKUP(RC[-4], R9C3:R186C4, 2, 0), 1), RC[-1], NA()) -> #ERR: ArgCount | AX122: =IF(ISERROR(RC[-1])=1, "", RC[-5]) ->  | AY122: 'Malta | AZ122: 'MLT | BA122: 0.497383118867935 | BB122: 0.748674396199437 | BC122: =1.64*RC[-1] -> 1.22782600976708 | BD122: =IF(EQUAL(VLOOKUP(RC[-4], R9C3:R186C4, 2, 0), 1), RC[-1], NA()) -> #ERR: ArgCount | BE122: =IF(ISERROR(RC[-1])=1, "", RC[-5]) -> 
B123: 'Malaysia | C123: 'MYS | D123: =IF(EQUAL(ComparativeCharts!R[+11]C, ""), "", 1) ->  | E123: =IF(EQUAL(ComparativeCharts!R[+11]C, ""), "", 1) -> #EMPTY! | O123: 116 | P123: 'India | Q123: 'IND | R123: 0.497757989443293 | S123: 0.251300233223489 | T123: =1.64*RC[-1] -> 0.412132382486522 | U123: =IF(EQUAL(VLOOKUP(RC[-4], R9C3:R186C4, 2, 0), 1), RC[-1], NA()) -> #ERR: ArgCount | V123: =IF(ISERROR(RC[-1])=1, "", RC[-5]) ->  | W123: 'Tunisia | X123: 'TUN | Y123: 0.660977420127173 | Z123: 0.279058457436991 | AA123: =1.64*RC[-1] -> 0.457655870196665 | AB123: =IF(EQUAL(VLOOKUP(RC[-4], R9C3:R186C4, 2, 0), 1), RC[-1], NA()) -> #ERR: ArgCount | AC123: =IF(ISERROR(RC[-1])=1, "", RC[-5]) ->  | AD123: 'Greece | AE123: 'GRC | AF123: 0.559690996716061 | AG123: 0.248661311888018 | AH123: =1.64*RC[-1] -> 0.407804551496349 | AI123: =IF(EQUAL(VLOOKUP(RC[-4], R9C3:R186C4, 2, 0), 1), RC[-1], NA()) -> #ERR: ArgCount | AJ123: =IF(ISERROR(RC[-1])=1, "", RC[-5]) ->  | AK123: 'Israel | AL123: 'ISR | AM123: 0.533168276644083 | AN123: 0.2290464009857 | AO123: =1.64*RC[-1] -> 0.375636097616548 | AP123: =IF(EQUAL(VLOOKUP(RC[-4], R9C3:R186C4, 2, 0), 1), RC[-1], NA()) -> #ERR: ArgCount | AQ123: =IF(ISERROR(RC[-1])=1, "", RC[-5]) ->  | AR123: 'Trinidad and Tobago& Tob* | AS123: 'TTO | AT123: 0.514036739846888 | AU123: 0.313894625236573 | AV123: =1.64*RC[-1] -> 0.51478718538798 | AW123: =IF(EQUAL(VLOOKUP(RC[-4], R9C3:R186C4, 2, 0), 1), RC[-1], NA()) -> #ERR: ArgCount | AX123: =IF(ISERROR(RC[-1])=1, "", RC[-5]) ->  | AY123: 'Trinidad and Tobago& Tob* | AZ123: 'TTO | BA123: 0.51051523437966 | BB123: 0.296106941830424 | BC123: =1.64*RC[-1] -> 0.485615384601895 | BD123: =IF(EQUAL(VLOOKUP(RC[-4], R9C3:R186C4, 2, 0), 1), RC[-1], NA()) -> #ERR: ArgCount | BE123: =IF(ISERROR(RC[-1])=1, "", RC[-5]) -> 
B124: 'Namibia | C124: 'NAM | D124: =IF(EQUAL(ComparativeCharts!R[+11]C, ""), "", 1) ->  | E124: =IF(EQUAL(ComparativeCharts!R[+11]C, ""), "", 1) -> #EMPTY! | O124: 117 | P124: 'Brazil | Q124: 'BRA | R124: 0.55168050950866 | S124: 0.251300233223489 | T124: =1.64*RC[-1] -> 0.412132382486522 | U124: =IF(EQUAL(VLOOKUP(RC[-4], R9C3:R186C4, 2, 0), 1), RC[-1], NA()) -> #ERR: ArgCount | V124: =IF(ISERROR(RC[-1])=1, "", RC[-5]) ->  | W124: 'Kuwait | X124: 'KWT | Y124: 0.683631198783781 | Z124: 0.299881889042829 | AA124: =1.64*RC[-1] -> 0.49180629803024 | AB124: =IF(EQUAL(VLOOKUP(RC[-4], R9C3:R186C4, 2, 0), 1), RC[-1], NA()) -> #ERR: ArgCount | AC124: =IF(ISERROR(RC[-1])=1, "", RC[-5]) ->  | AD124: 'Slovenia | AE124: 'SVN | AF124: 0.567266812903442 | AG124: 0.259550680503314 | AH124: =1.64*RC[-1] -> 0.425663116025435 | AI124: =IF(EQUAL(VLOOKUP(RC[-4], R9C3:R186C4, 2, 0), 1), RC[-1], NA()) -> #ERR: ArgCount | AJ124: =IF(ISERROR(RC[-1])=1, "", RC[-5]) ->  | AK124: 'Dominican Republic | AL124: 'DOM | AM124: 0.538860131714721 | AN124: 0.519940958319459 | AO124: =1.64*RC[-1] -> 0.852703171643913 | AP124: =IF(EQUAL(VLOOKUP(RC[-4], R9C3:R186C4, 2, 0), 1), RC[-1], NA()) -> #ERR: ArgCount | AQ124: =IF(ISERROR(RC[-1])=1, "", RC[-5]) ->  | AR124: 'Poland | AS124: 'POL | AT124: 0.537888231756196 | AU124: 0.160250557094621 | AV124: =1.64*RC[-1] -> 0.262810913635178 | AW124: =IF(EQUAL(VLOOKUP(RC[-4], R9C3:R186C4, 2, 0), 1), RC[-1], NA()) -> #ERR: ArgCount | AX124: =IF(ISERROR(RC[-1])=1, "", RC[-5]) ->  | AY124: 'Botswana | AZ124: 'BWA | BA124: 0.535191310962023 | BB124: 0.223105684616046 | BC124: =1.64*RC[-1] -> 0.365893322770315 | BD124: =IF(EQUAL(VLOOKUP(RC[-4], R9C3:R186C4, 2, 0), 1), RC[-1], NA()) -> #ERR: ArgCount | BE124: =IF(ISERROR(RC[-1])=1, "", RC[-5]) -> 
B125: 'Niger | C125: 'NER | D125: =IF(EQUAL(ComparativeCharts!R[+11]C, ""), "", 1) ->  | E125: =IF(EQUAL(ComparativeCharts!R[+11]C, ""), "", 1) -> #EMPTY! | O125: 118 | P125: 'Bulgaria | Q125: 'BGR | R125: 0.603069024928216 | S125: 0.251300233223489 | T125: =1.64*RC[-1] -> 0.412132382486522 | U125: =IF(EQUAL(VLOOKUP(RC[-4], R9C3:R186C4, 2, 0), 1), RC[-1], NA()) -> #ERR: ArgCount | V125: =IF(ISERROR(RC[-1])=1, "", RC[-5]) ->  | W125: 'Namibia | X125: 'NAM | Y125: 0.713864817416638 | Z125: 0.312392788298483 | AA125: =1.64*RC[-1] -> 0.512324172809512 | AB125: =IF(EQUAL(VLOOKUP(RC[-4], R9C3:R186C4, 2, 0), 1), RC[-1], NA()) -> #ERR: ArgCount | AC125: =IF(ISERROR(RC[-1])=1, "", RC[-5]) ->  | AD125: 'Czech Republic | AE125: 'CZE | AF125: 0.594645801250449 | AG125: 0.206979294668072 | AH125: =1.64*RC[-1] -> 0.339446043255638 | AI125: =IF(EQUAL(VLOOKUP(RC[-4], R9C3:R186C4, 2, 0), 1), RC[-1], NA()) -> #ERR: ArgCount | AJ125: =IF(ISERROR(RC[-1])=1, "", RC[-5]) ->  | AK125: 'Poland | AL125: 'POL | AM125: 0.564949864064824 | AN125: 0.191964544754769 | AO125: =1.64*RC[-1] -> 0.314821853397821 | AP125: =IF(EQUAL(VLOOKUP(RC[-4], R9C3:R186C4, 2, 0), 1), RC[-1], NA()) -> #ERR: ArgCount | AQ125: =IF(ISERROR(RC[-1])=1, "", RC[-5]) ->  | AR125: 'Czech Republic | AS125: 'CZE | AT125: 0.543327154857081 | AU125: 0.160250557094621 | AV125: =1.64*RC[-1] -> 0.262810913635178 | AW125: =IF(EQUAL(VLOOKUP(RC[-4], R9C3:R186C4, 2, 0), 1), RC[-1], NA()) -> #ERR: ArgCount | AX125: =IF(ISERROR(RC[-1])=1, "", RC[-5]) ->  | AY125: 'Qatar | AZ125: 'QAT | BA125: 0.57025621375922 | BB125: 0.267063170408295 | BC125: =1.64*RC[-1] -> 0.437983599469604 | BD125: =IF(EQUAL(VLOOKUP(RC[-4], R9C3:R186C4, 2, 0), 1), RC[-1], NA()) -> #ERR: ArgCount | BE125: =IF(ISERROR(RC[-1])=1, "", RC[-5]) -> 
B126: 'Nigeria | C126: 'NGA | D126: =IF(EQUAL(ComparativeCharts!R[+11]C, ""), "", 1) ->  | E126: =IF(EQUAL(ComparativeCharts!R[+11]C, ""), "", 1) -> #EMPTY! | O126: 119 | P126: 'Philippines | Q126: 'PHL | R126: 0.613543553097143 | S126: 0.254026944310672 | T126: =1.64*RC[-1] -> 0.416604188669502 | U126: =IF(EQUAL(VLOOKUP(RC[-4], R9C3:R186C4, 2, 0), 1), RC[-1], NA()) -> #ERR: ArgCount | V126: =IF(ISERROR(RC[-1])=1, "", RC[-5]) ->  | W126: 'Botswana | X126: 'BWA | Y126: 0.74282527718284 | Z126: 0.279058457436991 | AA126: =1.64*RC[-1] -> 0.457655870196665 | AB126: =IF(EQUAL(VLOOKUP(RC[-4], R9C3:R186C4, 2, 0), 1), RC[-1], NA()) -> #ERR: ArgCount | AC126: =IF(ISERROR(RC[-1])=1, "", RC[-5]) ->  | AD126: 'Hungary | AE126: 'HUN | AF126: 0.60645638978787 | AG126: 0.206979294668072 | AH126: =1.64*RC[-1] -> 0.339446043255638 | AI126: =IF(EQUAL(VLOOKUP(RC[-4], R9C3:R186C4, 2, 0), 1), RC[-1], NA()) -> #ERR: ArgCount | AJ126: =IF(ISERROR(RC[-1])=1, "", RC[-5]) ->  | AK126: 'Philippines | AL126: 'PHL | AM126: 0.565344236519552 | AN126: 0.2290464009857 | AO126: =1.64*RC[-1] -> 0.375636097616548 | AP126: =IF(EQUAL(VLOOKUP(RC[-4], R9C3:R186C4, 2, 0), 1), RC[-1], NA()) -> #ERR: ArgCount | AQ126: =IF(ISERROR(RC[-1])=1, "", RC[-5]) ->  | AR126: 'Costa Rica | AS126: 'CRI | AT126: 0.553029745805841 | AU126: 0.235166305078156 | AV126: =1.64*RC[-1] -> 0.385672740328176 | AW126: =IF(EQUAL(VLOOKUP(RC[-4], R9C3:R186C4, 2, 0), 1), RC[-1], NA()) -> #ERR: ArgCount | AX126: =IF(ISERROR(RC[-1])=1, "", RC[-5]) ->  | AY126: 'Costa Rica | AZ126: 'CRI | BA126: 0.576908631503339 | BB126: 0.207277285164844 | BC126: =1.64*RC[-1] -> 0.339934747670344 | BD126: =IF(EQUAL(VLOOKUP(RC[-4], R9C3:R186C4, 2, 0), 1), RC[-1], NA()) -> #ERR: ArgCount | BE126: =IF(ISERROR(RC[-1])=1, "", RC[-5]) -> 
B127: 'Nicaragua | C127: 'NIC | D127: =IF(EQUAL(ComparativeCharts!R[+11]C, ""), "", 1) ->  | E127: =IF(EQUAL(ComparativeCharts!R[+11]C, ""), "", 1) -> #EMPTY! | O127: 120 | P127: 'Chile | Q127: 'CHL | R127: 0.615023661901715 | S127: 0.254026944310672 | T127: =1.64*RC[-1] -> 0.416604188669502 | U127: =IF(EQUAL(VLOOKUP(RC[-4], R9C3:R186C4, 2, 0), 1), RC[-1], NA()) -> #ERR: ArgCount | V127: =IF(ISERROR(RC[-1])=1, "", RC[-5]) ->  | W127: 'Puerto Rico | X127: 'PRI | Y127: 0.759606031110221 | Z127: 0.527464842044443 | AA127: =1.64*RC[-1] -> 0.865042340952886 | AB127: =IF(EQUAL(VLOOKUP(RC[-4], R9C3:R186C4, 2, 0), 1), RC[-1], NA()) -> #ERR: ArgCount | AC127: =IF(ISERROR(RC[-1])=1, "", RC[-5]) ->  | AD127: 'Uruguay | AE127: 'URY | AF127: 0.617792507286911 | AG127: 0.319089592041234 | AH127: =1.64*RC[-1] -> 0.523306930947624 | AI127: =IF(EQUAL(VLOOKUP(RC[-4], R9C3:R186C4, 2, 0), 1), RC[-1], NA()) -> #ERR: ArgCount | AJ127: =IF(ISERROR(RC[-1])=1, "", RC[-5]) ->  | AK127: 'Czech Republic | AL127: 'CZE | AM127: 0.56981387384378 | AN127: 0.191964544754769 | AO127: =1.64*RC[-1] -> 0.314821853397821 | AP127: =IF(EQUAL(VLOOKUP(RC[-4], R9C3:R186C4, 2, 0), 1), RC[-1], NA()) -> #ERR: ArgCount | AQ127: =IF(ISERROR(RC[-1])=1, "", RC[-5]) ->  | AR127: 'Bahamas, The | AS127: 'BHS | AT127: 0.56301924319449 | AU127: 0.443073362506416 | AV127: =1.64*RC[-1] -> 0.726640314510522 | AW127: =IF(EQUAL(VLOOKUP(RC[-4], R9C3:R186C4, 2, 0), 1), RC[-1], NA()) -> #ERR: ArgCount | AX127: =IF(ISERROR(RC[-1])=1, "", RC[-5]) ->  | AY127: 'Estonia | AZ127: 'EST | BA127: 0.593056374347544 | BB127: 0.181932764704801 | BC127: =1.64*RC[-1] -> 0.298369734115874 | BD127: =IF(EQUAL(VLOOKUP(RC[-4], R9C3:R186C4, 2, 0), 1), RC[-1], NA()) -> #ERR: ArgCount | BE127: =IF(ISERROR(RC[-1])=1, "", RC[-5]) -> 
B128: 'Netherlands | C128: 'NLD | D128: =IF(EQUAL(ComparativeCharts!R[+11]C, ""), "", 1) -> 1 | E128: =IF(EQUAL(ComparativeCharts!R[+11]C, ""), "", 1) -> #EMPTY! | O128: 121 | P128: 'Latvia | Q128: 'LVA | R128: 0.624736462589446 | S128: 0.251300233223489 | T128: =1.64*RC[-1] -> 0.412132382486522 | U128: =IF(EQUAL(VLOOKUP(RC[-4], R9C3:R186C4, 2, 0), 1), RC[-1], NA()) -> #ERR: ArgCount | V128: =IF(ISERROR(RC[-1])=1, "", RC[-5]) ->  | W128: 'Estonia | X128: 'EST | Y128: 0.791360321222212 | Z128: 0.234722074427469 | AA128: =1.64*RC[-1] -> 0.384944202061049 | AB128: =IF(EQUAL(VLOOKUP(RC[-4], R9C3:R186C4, 2, 0), 1), RC[-1], NA()) -> #ERR: ArgCount | AC128: =IF(ISERROR(RC[-1])=1, "", RC[-5]) ->  | AD128: 'Malta | AE128: 'MLT | AF128: 0.628755392340877 | AG128: 0.768168783719135 | AH128: =1.64*RC[-1] -> 1.25979680529938 | AI128: =IF(EQUAL(VLOOKUP(RC[-4], R9C3:R186C4, 2, 0), 1), RC[-1], NA()) -> #ERR: ArgCount | AJ128: =IF(ISERROR(RC[-1])=1, "", RC[-5]) ->  | AK128: 'Botswana | AL128: 'BWA | AM128: 0.572420872088682 | AN128: 0.291778685386365 | AO128: =1.64*RC[-1] -> 0.478517044033639 | AP128: =IF(EQUAL(VLOOKUP(RC[-4], R9C3:R186C4, 2, 0), 1), RC[-1], NA()) -> #ERR: ArgCount | AQ128: =IF(ISERROR(RC[-1])=1, "", RC[-5]) ->  | AR128: 'Tunisia | AS128: 'TUN | AT128: 0.647648078737007 | AU128: 0.272746442471847 | AV128: =1.64*RC[-1] -> 0.447304165653829 | AW128: =IF(EQUAL(VLOOKUP(RC[-4], R9C3:R186C4, 2, 0), 1), RC[-1], NA()) -> #ERR: ArgCount | AX128: =IF(ISERROR(RC[-1])=1, "", RC[-5]) ->  | AY128: 'Hungary | AZ128: 'HUN | BA128: 0.614109908300502 | BB128: 0.158724276475048 | BC128: =1.64*RC[-1] -> 0.260307813419079 | BD128: =IF(EQUAL(VLOOKUP(RC[-4], R9C3:R186C4, 2, 0), 1), RC[-1], NA()) -> #ERR: ArgCount | BE128: =IF(ISERROR(RC[-1])=1, "", RC[-5]) -> 
B129: 'Norway | C129: 'NOR | D129: =IF(EQUAL(ComparativeCharts!R[+11]C, ""), "", 1) ->  | E129: =IF(EQUAL(ComparativeCharts!R[+11]C, ""), "", 1) -> #EMPTY! | O129: 122 | P129: 'Panama | Q129: 'PAN | R129: 0.664864094966925 | S129: 0.254026944310672 | T129: =1.64*RC[-1] -> 0.416604188669502 | U129: =IF(EQUAL(VLOOKUP(RC[-4], R9C3:R186C4, 2, 0), 1), RC[-1], NA()) -> #ERR: ArgCount | V129: =IF(ISERROR(RC[-1])=1, "", RC[-5]) ->  | W129: 'Czech Republic | X129: 'CZE | Y129: 0.805766038690297 | Z129: 0.215915139092969 | AA129: =1.64*RC[-1] -> 0.354100828112469 | AB129: =IF(EQUAL(VLOOKUP(RC[-4], R9C3:R186C4, 2, 0), 1), RC[-1], NA()) -> #ERR: ArgCount | AC129: =IF(ISERROR(RC[-1])=1, "", RC[-5]) ->  | AD129: 'Jordan | AE129: 'JOR | AF129: 0.629615896664261 | AG129: 0.259334359872279 | AH129: =1.64*RC[-1] -> 0.425308350190538 | AI129: =IF(EQUAL(VLOOKUP(RC[-4], R9C3:R186C4, 2, 0), 1), RC[-1], NA()) -> #ERR: ArgCount | AJ129: =IF(ISERROR(RC[-1])=1, "", RC[-5]) ->  | AK129: 'Italy | AL129: 'ITA | AM129: 0.591364333981401 | AN129: 0.228760003290238 | AO129: =1.64*RC[-1] -> 0.37516640539599 | AP129: =IF(EQUAL(VLOOKUP(RC[-4], R9C3:R186C4, 2, 0), 1), RC[-1], NA()) -> #ERR: ArgCount | AQ129: =IF(ISERROR(RC[-1])=1, "", RC[-5]) ->  | AR129: 'Bahrain | AS129: 'BHR | AT129: 0.664525769036017 | AU129: 0.276349686366578 | AV129: =1.64*RC[-1] -> 0.453213485641188 | AW129: =IF(EQUAL(VLOOKUP(RC[-4], R9C3:R186C4, 2, 0), 1), RC[-1], NA()) -> #ERR: ArgCount | AX129: =IF(ISERROR(RC[-1])=1, "", RC[-5]) ->  | AY129: 'Kuwait | AZ129: 'KWT | BA129: 0.619003449178204 | BB129: 0.267063170408295 | BC129: =1.64*RC[-1] -> 0.437983599469604 | BD129: =IF(EQUAL(VLOOKUP(RC[-4], R9C3:R186C4, 2, 0), 1), RC[-1], NA()) -> #ERR: ArgCount | BE129: =IF(ISERROR(RC[-1])=1, "", RC[-5]) -> 
B130: 'Nepal | C130: 'NPL | D130: =IF(EQUAL(ComparativeCharts!R[+11]C, ""), "", 1) ->  | E130: =IF(EQUAL(ComparativeCharts!R[+11]C, ""), "", 1) -> #EMPTY! | O130: 123 | P130: 'Benin | Q130: 'BEN | R130: 0.694610964377189 | S130: 0.352657522321209 | T130: =1.64*RC[-1] -> 0.578358336606783 | U130: =IF(EQUAL(VLOOKUP(RC[-4], R9C3:R186C4, 2, 0), 1), RC[-1], NA()) -> #ERR: ArgCount | V130: =IF(ISERROR(RC[-1])=1, "", RC[-5]) ->  | W130: 'Belgium | X130: 'BEL | Y130: 0.81771470597593 | Z130: 0.263344534520094 | AA130: =1.64*RC[-1] -> 0.431885036612954 | AB130: =IF(EQUAL(VLOOKUP(RC[-4], R9C3:R186C4, 2, 0), 1), RC[-1], NA()) -> #ERR: ArgCount | AC130: =IF(ISERROR(RC[-1])=1, "", RC[-5]) ->  | AD130: 'Tunisia | AE130: 'TUN | AF130: 0.63287580631365 | AG130: 0.235337708537315 | AH130: =1.64*RC[-1] -> 0.385953842001197 | AI130: =IF(EQUAL(VLOOKUP(RC[-4], R9C3:R186C4, 2, 0), 1), RC[-1], NA()) -> #ERR: ArgCount | AJ130: =IF(ISERROR(RC[-1])=1, "", RC[-5]) ->  | AK130: 'Turkey | AL130: 'TUR | AM130: 0.594919239239568 | AN130: 0.228760003290238 | AO130: =1.64*RC[-1] -> 0.37516640539599 | AP130: =IF(EQUAL(VLOOKUP(RC[-4], R9C3:R186C4, 2, 0), 1), RC[-1], NA()) -> #ERR: ArgCount | AQ130: =IF(ISERROR(RC[-1])=1, "", RC[-5]) ->  | AR130: 'Morocco | AS130: 'MAR | AT130: 0.678170864108505 | AU130: 0.253185404132827 | AV130: =1.64*RC[-1] -> 0.415224062777836 | AW130: =IF(EQUAL(VLOOKUP(RC[-4], R9C3:R186C4, 2, 0), 1), RC[-1], NA()) -> #ERR: ArgCount | AX130: =IF(ISERROR(RC[-1])=1, "", RC[-5]) ->  | AY130: 'Taiwan, China | AZ130: 'TWN | BA130: 0.625692771385888 | BB130: 0.159628305336241 | BC130: =1.64*RC[-1] -> 0.261790420751435 | BD130: =IF(EQUAL(VLOOKUP(RC[-4], R9C3:R186C4, 2, 0), 1), RC[-1], NA()) -> #ERR: ArgCount | BE130: =IF(ISERROR(RC[-1])=1, "", RC[-5]) -> 
B131: 'New Zealand | C131: 'NZL | D131: =IF(EQUAL(ComparativeCharts!R[+11]C, ""), "", 1) ->  | E131: =IF(EQUAL(ComparativeCharts!R[+11]C, ""), "", 1) -> #EMPTY! | O131: 124 | P131: 'Taiwan, China | Q131: 'TWN | R131: 0.706190537308272 | S131: 0.254026944310672 | T131: =1.64*RC[-1] -> 0.416604188669502 | U131: =IF(EQUAL(VLOOKUP(RC[-4], R9C3:R186C4, 2, 0), 1), RC[-1], NA()) -> #ERR: ArgCount | V131: =IF(ISERROR(RC[-1])=1, "", RC[-5]) ->  | W131: 'United Arab Emirates | X131: 'ARE | Y131: 0.824711517408409 | Z131: 0.299881889042829 | AA131: =1.64*RC[-1] -> 0.49180629803024 | AB131: =IF(EQUAL(VLOOKUP(RC[-4], R9C3:R186C4, 2, 0), 1), RC[-1], NA()) -> #ERR: ArgCount | AC131: =IF(ISERROR(RC[-1])=1, "", RC[-5]) ->  | AD131: 'Fiji | AE131: 'FJI | AF131: 0.634940386429239 | AG131: 0.563707566872499 | AH131: =1.64*RC[-1] -> 0.924480409670898 | AI131: =IF(EQUAL(VLOOKUP(RC[-4], R9C3:R186C4, 2, 0), 1), RC[-1], NA()) -> #ERR: ArgCount | AJ131: =IF(ISERROR(RC[-1])=1, "", RC[-5]) ->  | AK131: 'Greece | AL131: 'GRC | AM131: 0.604971525396404 | AN131: 0.2290464009857 | AO131: =1.64*RC[-1] -> 0.375636097616548 | AP131: =IF(EQUAL(VLOOKUP(RC[-4], R9C3:R186C4, 2, 0), 1), RC[-1], NA()) -> #ERR: ArgCount | AQ131: =IF(ISERROR(RC[-1])=1, "", RC[-5]) ->  | AR131: 'Hungary | AS131: 'HUN | AT131: 0.705543847969546 | AU131: 0.160250557094621 | AV131: =1.64*RC[-1] -> 0.262810913635178 | AW131: =IF(EQUAL(VLOOKUP(RC[-4], R9C3:R186C4, 2, 0), 1), RC[-1], NA()) -> #ERR: ArgCount | AX131: =IF(ISERROR(RC[-1])=1, "", RC[-5]) ->  | AY131: 'Malaysia | AZ131: 'MYS | BA131: 0.633416075589183 | BB131: 0.158656592213327 | BC131: =1.64*RC[-1] -> 0.260196811229856 | BD131: =IF(EQUAL(VLOOKUP(RC[-4], R9C3:R186C4, 2, 0), 1), RC[-1], NA()) -> #ERR: ArgCount | BE131: =IF(ISERROR(RC[-1])=1, "", RC[-5]) -> 
B132: 'Oman | C132: 'OMN | D132: =IF(EQUAL(ComparativeCharts!R[+11]C, ""), "", 1) ->  | E132: =IF(EQUAL(ComparativeCharts!R[+11]C, ""), "", 1) -> #EMPTY! | O132: 125 | P132: 'Slovak Republic | Q132: 'SVK | R132: 0.737756159452064 | S132: 0.251300233223489 | T132: =1.64*RC[-1] -> 0.412132382486522 | U132: =IF(EQUAL(VLOOKUP(RC[-4], R9C3:R186C4, 2, 0), 1), RC[-1], NA()) -> #ERR: ArgCount | V132: =IF(ISERROR(RC[-1])=1, "", RC[-5]) ->  | W132: 'Poland | X132: 'POL | Y132: 0.836791140264526 | Z132: 0.215915139092969 | AA132: =1.64*RC[-1] -> 0.354100828112469 | AB132: =IF(EQUAL(VLOOKUP(RC[-4], R9C3:R186C4, 2, 0), 1), RC[-1], NA()) -> #ERR: ArgCount | AC132: =IF(ISERROR(RC[-1])=1, "", RC[-5]) ->  | AD132: 'Poland | AE132: 'POL | AF132: 0.674021919164688 | AG132: 0.206979294668072 | AH132: =1.64*RC[-1] -> 0.339446043255638 | AI132: =IF(EQUAL(VLOOKUP(RC[-4], R9C3:R186C4, 2, 0), 1), RC[-1], NA()) -> #ERR: ArgCount | AJ132: =IF(ISERROR(RC[-1])=1, "", RC[-5]) ->  | AK132: 'Mexico | AL132: 'MEX | AM132: 0.607917311269194 | AN132: 0.228760003290238 | AO132: =1.64*RC[-1] -> 0.37516640539599 | AP132: =IF(EQUAL(VLOOKUP(RC[-4], R9C3:R186C4, 2, 0), 1), RC[-1], NA()) -> #ERR: ArgCount | AQ132: =IF(ISERROR(RC[-1])=1, "", RC[-5]) ->  | AR132: 'Jordan | AS132: 'JOR | AT132: 0.708416506265853 | AU132: 0.235166305078156 | AV132: =1.64*RC[-1] -> 0.385672740328176 | AW132: =IF(EQUAL(VLOOKUP(RC[-4], R9C3:R186C4, 2, 0), 1), RC[-1], NA()) -> #ERR: ArgCount | AX132: =IF(ISERROR(RC[-1])=1, "", RC[-5]) ->  | AY132: 'Belgium | AZ132: 'BEL | BA132: 0.671693233132954 | BB132: 0.198055085748779 | BC132: =1.64*RC[-1] -> 0.324810340627998 | BD132: =IF(EQUAL(VLOOKUP(RC[-4], R9C3:R186C4, 2, 0), 1), RC[-1], NA()) -> #ERR: ArgCount | BE132: =IF(ISERROR(RC[-1])=1, "", RC[-5]) -> 
B133: 'Pakistan | C133: 'PAK | D133: =IF(EQUAL(ComparativeCharts!R[+11]C, ""), "", 1) ->  | E133: =IF(EQUAL(ComparativeCharts!R[+11]C, ""), "", 1) -> #EMPTY! | O133: 126 | P133: 'Jamaica | Q133: 'JAM | R133: 0.750255928999158 | S133: 0.251300233223489 | T133: =1.64*RC[-1] -> 0.412132382486522 | U133: =IF(EQUAL(VLOOKUP(RC[-4], R9C3:R186C4, 2, 0), 1), RC[-1], NA()) -> #ERR: ArgCount | V133: =IF(ISERROR(RC[-1])=1, "", RC[-5]) ->  | W133: 'Costa Rica | X133: 'CRI | Y133: 0.90828717972 | Z133: 0.269879776011692 | AA133: =1.64*RC[-1] -> 0.442602832659175 | AB133: =IF(EQUAL(VLOOKUP(RC[-4], R9C3:R186C4, 2, 0), 1), RC[-1], NA()) -> #ERR: ArgCount | AC133: =IF(ISERROR(RC[-1])=1, "", RC[-5]) ->  | AD133: 'Israel | AE133: 'ISR | AF133: 0.685072346632708 | AG133: 0.266441748954348 | AH133: =1.64*RC[-1] -> 0.436964468285131 | AI133: =IF(EQUAL(VLOOKUP(RC[-4], R9C3:R186C4, 2, 0), 1), RC[-1], NA()) -> #ERR: ArgCount | AJ133: =IF(ISERROR(RC[-1])=1, "", RC[-5]) ->  | AK133: 'Barbados | AL133: 'BRB | AM133: 0.612275371278534 | AN133: 0.601880844424266 | AO133: =1.64*RC[-1] -> 0.987084584855796 | AP133: =IF(EQUAL(VLOOKUP(RC[-4], R9C3:R186C4, 2, 0), 1), RC[-1], NA()) -> #ERR: ArgCount | AQ133: =IF(ISERROR(RC[-1])=1, "", RC[-5]) ->  | AR133: 'United Arab Emirates | AS133: 'ARE | AT133: 0.767498413405303 | AU133: 0.276349686366578 | AV133: =1.64*RC[-1] -> 0.453213485641188 | AW133: =IF(EQUAL(VLOOKUP(RC[-4], R9C3:R186C4, 2, 0), 1), RC[-1], NA()) -> #ERR: ArgCount | AX133: =IF(ISERROR(RC[-1])=1, "", RC[-5]) ->  | AY133: 'Japan | AZ133: 'JPN | BA133: 0.723575165855732 | BB133: 0.159628305336241 | BC133: =1.64*RC[-1] -> 0.261790420751435 | BD133: =IF(EQUAL(VLOOKUP(RC[-4], R9C3:R186C4, 2, 0), 1), RC[-1], NA()) -> #ERR: ArgCount | BE133: =IF(ISERROR(RC[-1])=1, "", RC[-5]) -> 
B134: 'Panama | C134: 'PAN | D134: =IF(EQUAL(ComparativeCharts!R[+11]C, ""), "", 1) ->  | E134: =IF(EQUAL(ComparativeCharts!R[+11]C, ""), "", 1) -> #EMPTY! | O134: 127 | P134: 'Lithuania | Q134: 'LTU | R134: 0.766929806494868 | S134: 0.251300233223489 | T134: =1.64*RC[-1] -> 0.412132382486522 | U134: =IF(EQUAL(VLOOKUP(RC[-4], R9C3:R186C4, 2, 0), 1), RC[-1], NA()) -> #ERR: ArgCount | V134: =IF(ISERROR(RC[-1])=1, "", RC[-5]) ->  | W134: 'Oman | X134: 'OMN | Y134: 0.911738948904878 | Z134: 0.299881889042829 | AA134: =1.64*RC[-1] -> 0.49180629803024 | AB134: =IF(EQUAL(VLOOKUP(RC[-4], R9C3:R186C4, 2, 0), 1), RC[-1], NA()) -> #ERR: ArgCount | AC134: =IF(ISERROR(RC[-1])=1, "", RC[-5]) ->  | AD134: 'Malaysia | AE134: 'MYS | AF134: 0.714095825840174 | AG134: 0.233636532185851 | AH134: =1.64*RC[-1] -> 0.383163912784796 | AI134: =IF(EQUAL(VLOOKUP(RC[-4], R9C3:R186C4, 2, 0), 1), RC[-1], NA()) -> #ERR: ArgCount | AJ134: =IF(ISERROR(RC[-1])=1, "", RC[-5]) ->  | AK134: 'Iceland | AL134: 'ISL | AM134: 0.614187284027094 | AN134: 0.247238613070611 | AO134: =1.64*RC[-1] -> 0.405471325435802 | AP134: =IF(EQUAL(VLOOKUP(RC[-4], R9C3:R186C4, 2, 0), 1), RC[-1], NA()) -> #ERR: ArgCount | AQ134: =IF(ISERROR(RC[-1])=1, "", RC[-5]) ->  | AR134: 'Puerto Rico | AS134: 'PRI | AT134: 0.771181294397462 | AU134: 0.503468080455097 | AV134: =1.64*RC[-1] -> 0.825687651946359 | AW134: =IF(EQUAL(VLOOKUP(RC[-4], R9C3:R186C4, 2, 0), 1), RC[-1], NA()) -> #ERR: ArgCount | AX134: =IF(ISERROR(RC[-1])=1, "", RC[-5]) ->  | AY134: 'Italy | AZ134: 'ITA | BA134: 0.80232836284118 | BB134: 0.189092987537097 | BC134: =1.64*RC[-1] -> 0.310112499560839 | BD134: =IF(EQUAL(VLOOKUP(RC[-4], R9C3:R186C4, 2, 0), 1), RC[-1], NA()) -> #ERR: ArgCount | BE134: =IF(ISERROR(RC[-1])=1, "", RC[-5]) -> 
B135: 'Peru | C135: 'PER | D135: =IF(EQUAL(ComparativeCharts!R[+11]C, ""), "", 1) ->  | E135: =IF(EQUAL(ComparativeCharts!R[+11]C, ""), "", 1) -> #EMPTY! | O135: 128 | P135: 'Uruguay | Q135: 'URY | R135: 0.769796605028736 | S135: 0.254026944310672 | T135: =1.64*RC[-1] -> 0.416604188669502 | U135: =IF(EQUAL(VLOOKUP(RC[-4], R9C3:R186C4, 2, 0), 1), RC[-1], NA()) -> #ERR: ArgCount | V135: =IF(ISERROR(RC[-1])=1, "", RC[-5]) ->  | W135: 'United Kingdom | X135: 'GBR | Y135: 0.919721876874545 | Z135: 0.25228486761248 | AA135: =1.64*RC[-1] -> 0.413747182884467 | AB135: =IF(EQUAL(VLOOKUP(RC[-4], R9C3:R186C4, 2, 0), 1), RC[-1], NA()) -> #ERR: ArgCount | AC135: =IF(ISERROR(RC[-1])=1, "", RC[-5]) ->  | AD135: 'Italy | AE135: 'ITA | AF135: 0.772869272481444 | AG135: 0.233636532185851 | AH135: =1.64*RC[-1] -> 0.383163912784796 | AI135: =IF(EQUAL(VLOOKUP(RC[-4], R9C3:R186C4, 2, 0), 1), RC[-1], NA()) -> #ERR: ArgCount | AJ135: =IF(ISERROR(RC[-1])=1, "", RC[-5]) ->  | AK135: 'Sri Lanka | AL135: 'LKA | AM135: 0.615857466643392 | AN135: 0.395254221998157 | AO135: =1.64*RC[-1] -> 0.648216924076978 | AP135: =IF(EQUAL(VLOOKUP(RC[-4], R9C3:R186C4, 2, 0), 1), RC[-1], NA()) -> #ERR: ArgCount | AQ135: =IF(ISERROR(RC[-1])=1, "", RC[-5]) ->  | AR135: 'Belgium | AS135: 'BEL | AT135: 0.797295226228959 | AU135: 0.218139839508948 | AV135: =1.64*RC[-1] -> 0.357749336794675 | AW135: =IF(EQUAL(VLOOKUP(RC[-4], R9C3:R186C4, 2, 0), 1), RC[-1], NA()) -> #ERR: ArgCount | AX135: =IF(ISERROR(RC[-1])=1, "", RC[-5]) ->  | AY135: 'Fiji | AZ135: 'FJI | BA135: 0.806667830976276 | BB135: 0.536534704411876 | BC135: =1.64*RC[-1] -> 0.879916915235477 | BD135: =IF(EQUAL(VLOOKUP(RC[-4], R9C3:R186C4, 2, 0), 1), RC[-1], NA()) -> #ERR: ArgCount | BE135: =IF(ISERROR(RC[-1])=1, "", RC[-5]) -> 
B136: 'Philippines | C136: 'PHL | D136: =IF(EQUAL(ComparativeCharts!R[+11]C, ""), "", 1) ->  | E136: =IF(EQUAL(ComparativeCharts!R[+11]C, ""), "", 1) -> #EMPTY! | O136: 129 | P136: 'Botswana | Q136: 'BWA | R136: 0.778650762502728 | S136: 0.254026944310672 | T136: =1.64*RC[-1] -> 0.416604188669502 | U136: =IF(EQUAL(VLOOKUP(RC[-4], R9C3:R186C4, 2, 0), 1), RC[-1], NA()) -> #ERR: ArgCount | V136: =IF(ISERROR(RC[-1])=1, "", RC[-5]) ->  | W136: 'Hong Kong, China | X136: 'HKG | Y136: 0.921513428588353 | Z136: 0.269879776011692 | AA136: =1.64*RC[-1] -> 0.442602832659175 | AB136: =IF(EQUAL(VLOOKUP(RC[-4], R9C3:R186C4, 2, 0), 1), RC[-1], NA()) -> #ERR: ArgCount | AC136: =IF(ISERROR(RC[-1])=1, "", RC[-5]) ->  | AD136: 'Japan | AE136: 'JPN | AF136: 0.838987970114885 | AG136: 0.305371419073761 | AH136: =1.64*RC[-1] -> 0.500809127280968 | AI136: =IF(EQUAL(VLOOKUP(RC[-4], R9C3:R186C4, 2, 0), 1), RC[-1], NA()) -> #ERR: ArgCount | AJ136: =IF(ISERROR(RC[-1])=1, "", RC[-5]) ->  | AK136: 'Argentina | AL136: 'ARG | AM136: 0.667524548923092 | AN136: 0.2290464009857 | AO136: =1.64*RC[-1] -> 0.375636097616548 | AP136: =IF(EQUAL(VLOOKUP(RC[-4], R9C3:R186C4, 2, 0), 1), RC[-1], NA()) -> #ERR: ArgCount | AQ136: =IF(ISERROR(RC[-1])=1, "", RC[-5]) ->  | AR136: 'Slovenia | AS136: 'SVN | AT136: 0.825483463198006 | AU136: 0.186137681288291 | AV136: =1.64*RC[-1] -> 0.305265797312797 | AW136: =IF(EQUAL(VLOOKUP(RC[-4], R9C3:R186C4, 2, 0), 1), RC[-1], NA()) -> #ERR: ArgCount | AX136: =IF(ISERROR(RC[-1])=1, "", RC[-5]) ->  | AY136: 'Greece | AZ136: 'GRC | BA136: 0.824820743261995 | BB136: 0.198055085748779 | BC136: =1.64*RC[-1] -> 0.324810340627998 | BD136: =IF(EQUAL(VLOOKUP(RC[-4], R9C3:R186C4, 2, 0), 1), RC[-1], NA()) -> #ERR: ArgCount | BE136: =IF(ISERROR(RC[-1])=1, "", RC[-5]) -> 
B137: 'Papua New Guinea | C137: 'PNG | D137: =IF(EQUAL(ComparativeCharts!R[+11]C, ""), "", 1) ->  | E137: =IF(EQUAL(ComparativeCharts!R[+11]C, ""), "", 1) -> #EMPTY! | O137: 130 | P137: 'Estonia | Q137: 'EST | R137: 0.788856715751697 | S137: 0.251300233223489 | T137: =1.64*RC[-1] -> 0.412132382486522 | U137: =IF(EQUAL(VLOOKUP(RC[-4], R9C3:R186C4, 2, 0), 1), RC[-1], NA()) -> #ERR: ArgCount | V137: =IF(ISERROR(RC[-1])=1, "", RC[-5]) ->  | W137: 'Taiwan, China | X137: 'TWN | Y137: 0.938533262443574 | Z137: 0.263344534520094 | AA137: =1.64*RC[-1] -> 0.431885036612954 | AB137: =IF(EQUAL(VLOOKUP(RC[-4], R9C3:R186C4, 2, 0), 1), RC[-1], NA()) -> #ERR: ArgCount | AC137: =IF(ISERROR(RC[-1])=1, "", RC[-5]) ->  | AD137: 'Belgium | AE137: 'BEL | AF137: 0.88326173224899 | AG137: 0.248661311888018 | AH137: =1.64*RC[-1] -> 0.407804551496349 | AI137: =IF(EQUAL(VLOOKUP(RC[-4], R9C3:R186C4, 2, 0), 1), RC[-1], NA()) -> #ERR: ArgCount | AJ137: =IF(ISERROR(RC[-1])=1, "", RC[-5]) ->  | AK137: 'Peru | AL137: 'PER | AM137: 0.66871539911413 | AN137: 0.274050600863496 | AO137: =1.64*RC[-1] -> 0.449442985416133 | AP137: =IF(EQUAL(VLOOKUP(RC[-4], R9C3:R186C4, 2, 0), 1), RC[-1], NA()) -> #ERR: ArgCount | AQ137: =IF(ISERROR(RC[-1])=1, "", RC[-5]) ->  | AR137: 'Malaysia | AS137: 'MYS | AT137: 0.83361529960969 | AU137: 0.207737275615815 | AV137: =1.64*RC[-1] -> 0.340689132009937 | AW137: =IF(EQUAL(VLOOKUP(RC[-4], R9C3:R186C4, 2, 0), 1), RC[-1], NA()) -> #ERR: ArgCount | AX137: =IF(ISERROR(RC[-1])=1, "", RC[-5]) ->  | AY137: 'Slovenia | AZ137: 'SVN | BA137: 1.02280597660634 | BB137: 0.213605268344477 | BC137: =1.64*RC[-1] -> 0.350312640084942 | BD137: =IF(EQUAL(VLOOKUP(RC[-4], R9C3:R186C4, 2, 0), 1), RC[-1], NA()) -> #ERR: ArgCount | BE137: =IF(ISERROR(RC[-1])=1, "", RC[-5]) -> 
B138: 'Poland | C138: 'POL | D138: =IF(EQUAL(ComparativeCharts!R[+11]C, ""), "", 1) ->  | E138: =IF(EQUAL(ComparativeCharts!R[+11]C, ""), "", 1) -> #EMPTY! | O138: 131 | P138: 'Sao Tome and Principe | Q138: 'STP | R138: 0.820561703275659 | S138: 0.360314615495306 | T138: =1.64*RC[-1] -> 0.590915969412302 | U138: =IF(EQUAL(VLOOKUP(RC[-4], R9C3:R186C4, 2, 0), 1), RC[-1], NA()) -> #ERR: ArgCount | V138: =IF(ISERROR(RC[-1])=1, "", RC[-5]) ->  | W138: 'Canada | X138: 'CAN | Y138: 1.02719985634173 | Z138: 0.25228486761248 | AA138: =1.64*RC[-1] -> 0.413747182884467 | AB138: =IF(EQUAL(VLOOKUP(RC[-4], R9C3:R186C4, 2, 0), 1), RC[-1], NA()) -> #ERR: ArgCount | AC138: =IF(ISERROR(RC[-1])=1, "", RC[-5]) ->  | AD138: 'Oman | AE138: 'OMN | AF138: 0.899763885178803 | AG138: 0.319089592041234 | AH138: =1.64*RC[-1] -> 0.523306930947624 | AI138: =IF(EQUAL(VLOOKUP(RC[-4], R9C3:R186C4, 2, 0), 1), RC[-1], NA()) -> #ERR: ArgCount | AJ138: =IF(ISERROR(RC[-1])=1, "", RC[-5]) ->  | AK138: 'France | AL138: 'FRA | AM138: 0.713451816283397 | AN138: 0.228760003290238 | AO138: =1.64*RC[-1] -> 0.37516640539599 | AP138: =IF(EQUAL(VLOOKUP(RC[-4], R9C3:R186C4, 2, 0), 1), RC[-1], NA()) -> #ERR: ArgCount | AQ138: =IF(ISERROR(RC[-1])=1, "", RC[-5]) ->  | AR138: 'Italy | AS138: 'ITA | AT138: 0.860901468867888 | AU138: 0.207737275615815 | AV138: =1.64*RC[-1] -> 0.340689132009937 | AW138: =IF(EQUAL(VLOOKUP(RC[-4], R9C3:R186C4, 2, 0), 1), RC[-1], NA()) -> #ERR: ArgCount | AX138: =IF(ISERROR(RC[-1])=1, "", RC[-5]) ->  | AY138: 'Chile | AZ138: 'CHL | BA138: 1.02920563727934 | BB138: 0.198055085748779 | BC138: =1.64*RC[-1] -> 0.324810340627998 | BD138: =IF(EQUAL(VLOOKUP(RC[-4], R9C3:R186C4, 2, 0), 1), RC[-1], NA()) -> #ERR: ArgCount | BE138: =IF(ISERROR(RC[-1])=1, "", RC[-5]) -> 
B139: 'Puerto Rico | C139: 'PRI | D139: =IF(EQUAL(ComparativeCharts!R[+11]C, ""), "", 1) ->  | E139: =IF(EQUAL(ComparativeCharts!R[+11]C, ""), "", 1) -> #EMPTY! | O139: 132 | P139: 'Mongolia | Q139: 'MNG | R139: 0.84257225964418 | S139: 0.291377601755329 | T139: =1.64*RC[-1] -> 0.47785926687874 | U139: =IF(EQUAL(VLOOKUP(RC[-4], R9C3:R186C4, 2, 0), 1), RC[-1], NA()) -> #ERR: ArgCount | V139: =IF(ISERROR(RC[-1])=1, "", RC[-5]) ->  | W139: 'Slovenia | X139: 'SVN | Y139: 1.09304203462571 | Z139: 0.243549981714305 | AA139: =1.64*RC[-1] -> 0.39942197001146 | AB139: =IF(EQUAL(VLOOKUP(RC[-4], R9C3:R186C4, 2, 0), 1), RC[-1], NA()) -> #ERR: ArgCount | AC139: =IF(ISERROR(RC[-1])=1, "", RC[-5]) ->  | AD139: 'Cyprus | AE139: 'CYP | AF139: 1.04062543208678 | AG139: 0.319089592041234 | AH139: =1.64*RC[-1] -> 0.523306930947624 | AI139: =IF(EQUAL(VLOOKUP(RC[-4], R9C3:R186C4, 2, 0), 1), RC[-1], NA()) -> #ERR: ArgCount | AJ139: =IF(ISERROR(RC[-1])=1, "", RC[-5]) ->  | AK139: 'Trinidad and Tobago& Tob* | AL139: 'TTO | AM139: 0.717556771773991 | AN139: 0.519940958319459 | AO139: =1.64*RC[-1] -> 0.852703171643913 | AP139: =IF(EQUAL(VLOOKUP(RC[-4], R9C3:R186C4, 2, 0), 1), RC[-1], NA()) -> #ERR: ArgCount | AQ139: =IF(ISERROR(RC[-1])=1, "", RC[-5]) ->  | AR139: 'Malta | AS139: 'MLT | AT139: 0.863973821356254 | AU139: 0.443073362506416 | AV139: =1.64*RC[-1] -> 0.726640314510522 | AW139: =IF(EQUAL(VLOOKUP(RC[-4], R9C3:R186C4, 2, 0), 1), RC[-1], NA()) -> #ERR: ArgCount | AX139: =IF(ISERROR(RC[-1])=1, "", RC[-5]) ->  | AY139: 'Puerto Rico | AZ139: 'PRI | BA139: 1.11804282172941 | BB139: 0.525909748715309 | BC139: =1.64*RC[-1] -> 0.862491987893107 | BD139: =IF(EQUAL(VLOOKUP(RC[-4], R9C3:R186C4, 2, 0), 1), RC[-1], NA()) -> #ERR: ArgCount | BE139: =IF(ISERROR(RC[-1])=1, "", RC[-5]) -> 
B140: 'Korea, Dem. Rep. | C140: 'PRK | D140: =IF(EQUAL(ComparativeCharts!R[+11]C, ""), "", 1) ->  | E140: =IF(EQUAL(ComparativeCharts!R[+11]C, ""), "", 1) -> #EMPTY! | O140: 133 | P140: 'Trinidad and Tobago& Tob* | Q140: 'TTO | R140: 0.953249161871283 | S140: 0.254026944310672 | T140: =1.64*RC[-1] -> 0.416604188669502 | U140: =IF(EQUAL(VLOOKUP(RC[-4], R9C3:R186C4, 2, 0), 1), RC[-1], NA()) -> #ERR: ArgCount | V140: =IF(ISERROR(RC[-1])=1, "", RC[-5]) ->  | W140: 'United States | X140: 'USA | Y140: 1.09598873352739 | Z140: 0.25228486761248 | AA140: =1.64*RC[-1] -> 0.413747182884467 | AB140: =IF(EQUAL(VLOOKUP(RC[-4], R9C3:R186C4, 2, 0), 1), RC[-1], NA()) -> #ERR: ArgCount | AC140: =IF(ISERROR(RC[-1])=1, "", RC[-5]) ->  | AD140: 'Portugal | AE140: 'PRT | AF140: 1.1512038694785 | AG140: 0.233636532185851 | AH140: =1.64*RC[-1] -> 0.383163912784796 | AI140: =IF(EQUAL(VLOOKUP(RC[-4], R9C3:R186C4, 2, 0), 1), RC[-1], NA()) -> #ERR: ArgCount | AJ140: =IF(ISERROR(RC[-1])=1, "", RC[-5]) ->  | AK140: 'Estonia | AL140: 'EST | AM140: 0.7429711565498 | AN140: 0.262826647914669 | AO140: =1.64*RC[-1] -> 0.431035702580057 | AP140: =IF(EQUAL(VLOOKUP(RC[-4], R9C3:R186C4, 2, 0), 1), RC[-1], NA()) -> #ERR: ArgCount | AQ140: =IF(ISERROR(RC[-1])=1, "", RC[-5]) ->  | AR140: 'Kuwait | AS140: 'KWT | AT140: 0.907372859020556 | AU140: 0.276349686366578 | AV140: =1.64*RC[-1] -> 0.453213485641188 | AW140: =IF(EQUAL(VLOOKUP(RC[-4], R9C3:R186C4, 2, 0), 1), RC[-1], NA()) -> #ERR: ArgCount | AX140: =IF(ISERROR(RC[-1])=1, "", RC[-5]) ->  | AY140: 'Spain | AZ140: 'ESP | BA140: 1.21426072096851 | BB140: 0.189092987537097 | BC140: =1.64*RC[-1] -> 0.310112499560839 | BD140: =IF(EQUAL(VLOOKUP(RC[-4], R9C3:R186C4, 2, 0), 1), RC[-1], NA()) -> #ERR: ArgCount | BE140: =IF(ISERROR(RC[-1])=1, "", RC[-5]) -> 
B141: 'Portugal | C141: 'PRT | D141: =IF(EQUAL(ComparativeCharts!R[+11]C, ""), "", 1) ->  | E141: =IF(EQUAL(ComparativeCharts!R[+11]C, ""), "", 1) -> #EMPTY! | O141: 134 | P141: 'Cape verde | Q141: 'CPV | R141: 0.986246614494423 | S141: 0.360314615495306 | T141: =1.64*RC[-1] -> 0.590915969412302 | U141: =IF(EQUAL(VLOOKUP(RC[-4], R9C3:R186C4, 2, 0), 1), RC[-1], NA()) -> #ERR: ArgCount | V141: =IF(ISERROR(RC[-1])=1, "", RC[-5]) ->  | W141: 'Mauritius | X141: 'MUS | Y141: 1.14362291138471 | Z141: 0.387413949132592 | AA141: =1.64*RC[-1] -> 0.635358876577451 | AB141: =IF(EQUAL(VLOOKUP(RC[-4], R9C3:R186C4, 2, 0), 1), RC[-1], NA()) -> #ERR: ArgCount | AC141: =IF(ISERROR(RC[-1])=1, "", RC[-5]) ->  | AD141: 'Chile | AE141: 'CHL | AF141: 1.16588064362721 | AG141: 0.248661311888018 | AH141: =1.64*RC[-1] -> 0.407804551496349 | AI141: =IF(EQUAL(VLOOKUP(RC[-4], R9C3:R186C4, 2, 0), 1), RC[-1], NA()) -> #ERR: ArgCount | AJ141: =IF(ISERROR(RC[-1])=1, "", RC[-5]) ->  | AK141: 'Bahrain | AL141: 'BHR | AM141: 0.751891784116578 | AN141: 0.395254221998157 | AO141: =1.64*RC[-1] -> 0.648216924076978 | AP141: =IF(EQUAL(VLOOKUP(RC[-4], R9C3:R186C4, 2, 0), 1), RC[-1], NA()) -> #ERR: ArgCount | AQ141: =IF(ISERROR(RC[-1])=1, "", RC[-5]) ->  | AR141: 'Cyprus | AS141: 'CYP | AT141: 0.927567495026349 | AU141: 0.276349686366578 | AV141: =1.64*RC[-1] -> 0.453213485641188 | AW141: =IF(EQUAL(VLOOKUP(RC[-4], R9C3:R186C4, 2, 0), 1), RC[-1], NA()) -> #ERR: ArgCount | AX141: =IF(ISERROR(RC[-1])=1, "", RC[-5]) ->  | AY141: 'Portugal | AZ141: 'PRT | BA141: 1.21790710902785 | BB141: 0.189092987537097 | BC141: =1.64*RC[-1] -> 0.310112499560839 | BD141: =IF(EQUAL(VLOOKUP(RC[-4], R9C3:R186C4, 2, 0), 1), RC[-1], NA()) -> #ERR: ArgCount | BE141: =IF(ISERROR(RC[-1])=1, "", RC[-5]) -> 
B142: 'Paraguay | C142: 'PRY | D142: =IF(EQUAL(ComparativeCharts!R[+11]C, ""), "", 1) ->  | E142: =IF(EQUAL(ComparativeCharts!R[+11]C, ""), "", 1) -> #EMPTY! | O142: 135 | P142: 'South Africa | Q142: 'ZAF | R142: 0.991272803628619 | S142: 0.251300233223489 | T142: =1.64*RC[-1] -> 0.412132382486522 | U142: =IF(EQUAL(VLOOKUP(RC[-4], R9C3:R186C4, 2, 0), 1), RC[-1], NA()) -> #ERR: ArgCount | V142: =IF(ISERROR(RC[-1])=1, "", RC[-5]) ->  | W142: 'Japan | X142: 'JPN | Y142: 1.15307569853484 | Z142: 0.291478759644657 | AA142: =1.64*RC[-1] -> 0.478025165817237 | AB142: =IF(EQUAL(VLOOKUP(RC[-4], R9C3:R186C4, 2, 0), 1), RC[-1], NA()) -> #ERR: ArgCount | AC142: =IF(ISERROR(RC[-1])=1, "", RC[-5]) ->  | AD142: 'Austria | AE142: 'AUT | AF142: 1.21872508382098 | AG142: 0.233636532185851 | AH142: =1.64*RC[-1] -> 0.383163912784796 | AI142: =IF(EQUAL(VLOOKUP(RC[-4], R9C3:R186C4, 2, 0), 1), RC[-1], NA()) -> #ERR: ArgCount | AJ142: =IF(ISERROR(RC[-1])=1, "", RC[-5]) ->  | AK142: 'Jamaica | AL142: 'JAM | AM142: 0.759514876313547 | AN142: 0.516616692692467 | AO142: =1.64*RC[-1] -> 0.847251376015646 | AP142: =IF(EQUAL(VLOOKUP(RC[-4], R9C3:R186C4, 2, 0), 1), RC[-1], NA()) -> #ERR: ArgCount | AQ142: =IF(ISERROR(RC[-1])=1, "", RC[-5]) ->  | AR142: 'Taiwan, China | AS142: 'TWN | AT142: 0.92814257216133 | AU142: 0.218139839508948 | AV142: =1.64*RC[-1] -> 0.357749336794675 | AW142: =IF(EQUAL(VLOOKUP(RC[-4], R9C3:R186C4, 2, 0), 1), RC[-1], NA()) -> #ERR: ArgCount | AX142: =IF(ISERROR(RC[-1])=1, "", RC[-5]) ->  | AY142: 'Israel | AZ142: 'ISR | BA142: 1.27668802013757 | BB142: 0.200691571592182 | BC142: =1.64*RC[-1] -> 0.329134177411178 | BD142: =IF(EQUAL(VLOOKUP(RC[-4], R9C3:R186C4, 2, 0), 1), RC[-1], NA()) -> #ERR: ArgCount | BE142: =IF(ISERROR(RC[-1])=1, "", RC[-5]) -> 
B143: 'Qatar | C143: 'QAT | D143: =IF(EQUAL(ComparativeCharts!R[+11]C, ""), "", 1) ->  | E143: =IF(EQUAL(ComparativeCharts!R[+11]C, ""), "", 1) -> #EMPTY! | O143: 136 | P143: 'Korea, Rep. | Q143: 'KOR | R143: 1.00232548169663 | S143: 0.251300233223489 | T143: =1.64*RC[-1] -> 0.412132382486522 | U143: =IF(EQUAL(VLOOKUP(RC[-4], R9C3:R186C4, 2, 0), 1), RC[-1], NA()) -> #ERR: ArgCount | V143: =IF(ISERROR(RC[-1])=1, "", RC[-5]) ->  | W143: 'Italy | X143: 'ITA | Y143: 1.15852654178882 | Z143: 0.25228486761248 | AA143: =1.64*RC[-1] -> 0.413747182884467 | AB143: =IF(EQUAL(VLOOKUP(RC[-4], R9C3:R186C4, 2, 0), 1), RC[-1], NA()) -> #ERR: ArgCount | AC143: =IF(ISERROR(RC[-1])=1, "", RC[-5]) ->  | AD143: 'Hong Kong, China | AE143: 'HKG | AF143: 1.24833968089337 | AG143: 0.248197652987303 | AH143: =1.64*RC[-1] -> 0.407044150899177 | AI143: =IF(EQUAL(VLOOKUP(RC[-4], R9C3:R186C4, 2, 0), 1), RC[-1], NA()) -> #ERR: ArgCount | AJ143: =IF(ISERROR(RC[-1])=1, "", RC[-5]) ->  | AK143: 'Belgium | AL143: 'BEL | AM143: 0.793830724804658 | AN143: 0.2290464009857 | AO143: =1.64*RC[-1] -> 0.375636097616548 | AP143: =IF(EQUAL(VLOOKUP(RC[-4], R9C3:R186C4, 2, 0), 1), RC[-1], NA()) -> #ERR: ArgCount | AQ143: =IF(ISERROR(RC[-1])=1, "", RC[-5]) ->  | AR143: 'Korea, Rep. | AS143: 'KOR | AT143: 0.942550996806583 | AU143: 0.207737275615815 | AV143: =1.64*RC[-1] -> 0.340689132009937 | AW143: =IF(EQUAL(VLOOKUP(RC[-4], R9C3:R186C4, 2, 0), 1), RC[-1], NA()) -> #ERR: ArgCount | AX143: =IF(ISERROR(RC[-1])=1, "", RC[-5]) ->  | AY143: 'France | AZ143: 'FRA | BA143: 1.28239421571445 | BB143: 0.196208208436663 | BC143: =1.64*RC[-1] -> 0.321781461836127 | BD143: =IF(EQUAL(VLOOKUP(RC[-4], R9C3:R186C4, 2, 0), 1), RC[-1], NA()) -> #ERR: ArgCount | BE143: =IF(ISERROR(RC[-1])=1, "", RC[-5]) -> 
B144: 'Reunion | C144: 'REU | D144: =IF(EQUAL(ComparativeCharts!R[+11]C, ""), "", 1) ->  | E144: =IF(EQUAL(ComparativeCharts!R[+11]C, ""), "", 1) -> #EMPTY! | O144: 137 | P144: 'Guyana | Q144: 'GUY | R144: 1.009612846205 | S144: 0.291377601755329 | T144: =1.64*RC[-1] -> 0.47785926687874 | U144: =IF(EQUAL(VLOOKUP(RC[-4], R9C3:R186C4, 2, 0), 1), RC[-1], NA()) -> #ERR: ArgCount | V144: =IF(ISERROR(RC[-1])=1, "", RC[-5]) ->  | W144: 'Australia | X144: 'AUS | Y144: 1.18414986439814 | Z144: 0.263344534520094 | AA144: =1.64*RC[-1] -> 0.431885036612954 | AB144: =IF(EQUAL(VLOOKUP(RC[-4], R9C3:R186C4, 2, 0), 1), RC[-1], NA()) -> #ERR: ArgCount | AC144: =IF(ISERROR(RC[-1])=1, "", RC[-5]) ->  | AD144: 'Puerto Rico | AE144: 'PRI | AF144: 1.26394891750683 | AG144: 0.521450412242603 | AH144: =1.64*RC[-1] -> 0.855178676077869 | AI144: =IF(EQUAL(VLOOKUP(RC[-4], R9C3:R186C4, 2, 0), 1), RC[-1], NA()) -> #ERR: ArgCount | AJ144: =IF(ISERROR(RC[-1])=1, "", RC[-5]) ->  | AK144: 'Taiwan, China | AL144: 'TWN | AM144: 0.828611302042961 | AN144: 0.2290464009857 | AO144: =1.64*RC[-1] -> 0.375636097616548 | AP144: =IF(EQUAL(VLOOKUP(RC[-4], R9C3:R186C4, 2, 0), 1), RC[-1], NA()) -> #ERR: ArgCount | AQ144: =IF(ISERROR(RC[-1])=1, "", RC[-5]) ->  | AR144: 'Namibia | AS144: 'NAM | AT144: 0.953679633980184 | AU144: 0.308643858391108 | AV144: =1.64*RC[-1] -> 0.506175927761417 | AW144: =IF(EQUAL(VLOOKUP(RC[-4], R9C3:R186C4, 2, 0), 1), RC[-1], NA()) -> #ERR: ArgCount | AX144: =IF(ISERROR(RC[-1])=1, "", RC[-5]) ->  | AY144: 'Hong Kong, China | AZ144: 'HKG | BA144: 1.31333597963704 | BB144: 0.156072903069337 | BC144: =1.64*RC[-1] -> 0.255959561033713 | BD144: =IF(EQUAL(VLOOKUP(RC[-4], R9C3:R186C4, 2, 0), 1), RC[-1], NA()) -> #ERR: ArgCount | BE144: =IF(ISERROR(RC[-1])=1, "", RC[-5]) -> 
B145: 'Romania | C145: 'ROM | D145: =IF(EQUAL(ComparativeCharts!R[+11]C, ""), "", 1) ->  | E145: =IF(EQUAL(ComparativeCharts!R[+11]C, ""), "", 1) -> #EMPTY! | O145: 138 | P145: 'Mauritius | Q145: 'MUS | R145: 1.01165739258717 | S145: 0.291618285870453 | T145: =1.64*RC[-1] -> 0.478253988827543 | U145: =IF(EQUAL(VLOOKUP(RC[-4], R9C3:R186C4, 2, 0), 1), RC[-1], NA()) -> #ERR: ArgCount | V145: =IF(ISERROR(RC[-1])=1, "", RC[-5]) ->  | W145: 'Hungary | X145: 'HUN | Y145: 1.24532322926958 | Z145: 0.215915139092969 | AA145: =1.64*RC[-1] -> 0.354100828112469 | AB145: =IF(EQUAL(VLOOKUP(RC[-4], R9C3:R186C4, 2, 0), 1), RC[-1], NA()) -> #ERR: ArgCount | AC145: =IF(ISERROR(RC[-1])=1, "", RC[-5]) ->  | AD145: 'France | AE145: 'FRA | AF145: 1.279532380432 | AG145: 0.233636532185851 | AH145: =1.64*RC[-1] -> 0.383163912784796 | AI145: =IF(EQUAL(VLOOKUP(RC[-4], R9C3:R186C4, 2, 0), 1), RC[-1], NA()) -> #ERR: ArgCount | AJ145: =IF(ISERROR(RC[-1])=1, "", RC[-5]) ->  | AK145: 'Cyprus | AL145: 'CYP | AM145: 0.840040634486843 | AN145: 0.395254221998157 | AO145: =1.64*RC[-1] -> 0.648216924076978 | AP145: =IF(EQUAL(VLOOKUP(RC[-4], R9C3:R186C4, 2, 0), 1), RC[-1], NA()) -> #ERR: ArgCount | AQ145: =IF(ISERROR(RC[-1])=1, "", RC[-5]) ->  | AR145: 'Israel | AS145: 'ISR | AT145: 0.965844313364328 | AU145: 0.230041930929945 | AV145: =1.64*RC[-1] -> 0.37726876672511 | AW145: =IF(EQUAL(VLOOKUP(RC[-4], R9C3:R186C4, 2, 0), 1), RC[-1], NA()) -> #ERR: ArgCount | AX145: =IF(ISERROR(RC[-1])=1, "", RC[-5]) ->  | AY145: 'United States | AZ145: 'USA | BA145: 1.40683755002975 | BB145: 0.196208208436663 | BC145: =1.64*RC[-1] -> 0.321781461836127 | BD145: =IF(EQUAL(VLOOKUP(RC[-4], R9C3:R186C4, 2, 0), 1), RC[-1], NA()) -> #ERR: ArgCount | BE145: =IF(ISERROR(RC[-1])=1, "", RC[-5]) -> 
B146: 'Russian Federation | C146: 'RUS | D146: =IF(EQUAL(ComparativeCharts!R[+11]C, ""), "", 1) ->  | E146: =IF(EQUAL(ComparativeCharts!R[+11]C, ""), "", 1) -> #EMPTY! | O146: 139 | P146: 'Slovenia | Q146: 'SVN | R146: 1.06635863896693 | S146: 0.254026944310672 | T146: =1.64*RC[-1] -> 0.416604188669502 | U146: =IF(EQUAL(VLOOKUP(RC[-4], R9C3:R186C4, 2, 0), 1), RC[-1], NA()) -> #ERR: ArgCount | V146: =IF(ISERROR(RC[-1])=1, "", RC[-5]) ->  | W146: 'Iceland | X146: 'ISL | Y146: 1.25227288710498 | Z146: 0.372830223049686 | AA146: =1.64*RC[-1] -> 0.611441565801485 | AB146: =IF(EQUAL(VLOOKUP(RC[-4], R9C3:R186C4, 2, 0), 1), RC[-1], NA()) -> #ERR: ArgCount | AC146: =IF(ISERROR(RC[-1])=1, "", RC[-5]) ->  | AD146: 'Taiwan, China | AE146: 'TWN | AF146: 1.29366411013441 | AG146: 0.248661311888018 | AH146: =1.64*RC[-1] -> 0.407804551496349 | AI146: =IF(EQUAL(VLOOKUP(RC[-4], R9C3:R186C4, 2, 0), 1), RC[-1], NA()) -> #ERR: ArgCount | AJ146: =IF(ISERROR(RC[-1])=1, "", RC[-5]) ->  | AK146: 'Puerto Rico | AL146: 'PRI | AM146: 0.844876546450516 | AN146: 0.519740236219196 | AO146: =1.64*RC[-1] -> 0.852373987399481 | AP146: =IF(EQUAL(VLOOKUP(RC[-4], R9C3:R186C4, 2, 0), 1), RC[-1], NA()) -> #ERR: ArgCount | AQ146: =IF(ISERROR(RC[-1])=1, "", RC[-5]) ->  | AR146: 'Spain | AS146: 'ESP | AT146: 1.0321345377943 | AU146: 0.207737275615815 | AV146: =1.64*RC[-1] -> 0.340689132009937 | AW146: =IF(EQUAL(VLOOKUP(RC[-4], R9C3:R186C4, 2, 0), 1), RC[-1], NA()) -> #ERR: ArgCount | AX146: =IF(ISERROR(RC[-1])=1, "", RC[-5]) ->  | AY146: 'Austria | AZ146: 'AUT | BA146: 1.45710728100782 | BB146: 0.189092987537097 | BC146: =1.64*RC[-1] -> 0.310112499560839 | BD146: =IF(EQUAL(VLOOKUP(RC[-4], R9C3:R186C4, 2, 0), 1), RC[-1], NA()) -> #ERR: ArgCount | BE146: =IF(ISERROR(RC[-1])=1, "", RC[-5]) -> 
B147: 'Rwanda | C147: 'RWA | D147: =IF(EQUAL(ComparativeCharts!R[+11]C, ""), "", 1) ->  | E147: =IF(EQUAL(ComparativeCharts!R[+11]C, ""), "", 1) -> #EMPTY! | O147: 140 | P147: 'Poland | Q147: 'POL | R147: 1.07014358340954 | S147: 0.251300233223489 | T147: =1.64*RC[-1] -> 0.412132382486522 | U147: =IF(EQUAL(VLOOKUP(RC[-4], R9C3:R186C4, 2, 0), 1), RC[-1], NA()) -> #ERR: ArgCount | V147: =IF(ISERROR(RC[-1])=1, "", RC[-5]) ->  | W147: 'Denmark | X147: 'DNK | Y147: 1.28643998191881 | Z147: 0.263344534520094 | AA147: =1.64*RC[-1] -> 0.431885036612954 | AB147: =IF(EQUAL(VLOOKUP(RC[-4], R9C3:R186C4, 2, 0), 1), RC[-1], NA()) -> #ERR: ArgCount | AC147: =IF(ISERROR(RC[-1])=1, "", RC[-5]) ->  | AD147: 'Ireland | AE147: 'IRL | AF147: 1.36109673730644 | AG147: 0.233636532185851 | AH147: =1.64*RC[-1] -> 0.383163912784796 | AI147: =IF(EQUAL(VLOOKUP(RC[-4], R9C3:R186C4, 2, 0), 1), RC[-1], NA()) -> #ERR: ArgCount | AJ147: =IF(ISERROR(RC[-1])=1, "", RC[-5]) ->  | AK147: 'Sweden | AL147: 'SWE | AM147: 0.852943314200198 | AN147: 0.2290464009857 | AO147: =1.64*RC[-1] -> 0.375636097616548 | AP147: =IF(EQUAL(VLOOKUP(RC[-4], R9C3:R186C4, 2, 0), 1), RC[-1], NA()) -> #ERR: ArgCount | AQ147: =IF(ISERROR(RC[-1])=1, "", RC[-5]) ->  | AR147: 'Oman | AS147: 'OMN | AT147: 1.07687370204345 | AU147: 0.276349686366578 | AV147: =1.64*RC[-1] -> 0.453213485641188 | AW147: =IF(EQUAL(VLOOKUP(RC[-4], R9C3:R186C4, 2, 0), 1), RC[-1], NA()) -> #ERR: ArgCount | AX147: =IF(ISERROR(RC[-1])=1, "", RC[-5]) ->  | AY147: 'Ireland | AZ147: 'IRL | BA147: 1.56729208389528 | BB147: 0.189092987537097 | BC147: =1.64*RC[-1] -> 0.310112499560839 | BD147: =IF(EQUAL(VLOOKUP(RC[-4], R9C3:R186C4, 2, 0), 1), RC[-1], NA()) -> #ERR: ArgCount | BE147: =IF(ISERROR(RC[-1])=1, "", RC[-5]) -> 
B148: 'Saudi Arabia | C148: 'SAU | D148: =IF(EQUAL(ComparativeCharts!R[+11]C, ""), "", 1) ->  | E148: =IF(EQUAL(ComparativeCharts!R[+11]C, ""), "", 1) -> #EMPTY! | O148: 141 | P148: 'Greece | Q148: 'GRC | R148: 1.07453560600076 | S148: 0.254026944310672 | T148: =1.64*RC[-1] -> 0.416604188669502 | U148: =IF(EQUAL(VLOOKUP(RC[-4], R9C3:R186C4, 2, 0), 1), RC[-1], NA()) -> #ERR: ArgCount | V148: =IF(ISERROR(RC[-1])=1, "", RC[-5]) ->  | W148: 'Germany | X148: 'DEU | Y148: 1.31734754890926 | Z148: 0.25228486761248 | AA148: =1.64*RC[-1] -> 0.413747182884467 | AB148: =IF(EQUAL(VLOOKUP(RC[-4], R9C3:R186C4, 2, 0), 1), RC[-1], NA()) -> #ERR: ArgCount | AC148: =IF(ISERROR(RC[-1])=1, "", RC[-5]) ->  | AD148: 'United States | AE148: 'USA | AF148: 1.36585101550103 | AG148: 0.233636532185851 | AH148: =1.64*RC[-1] -> 0.383163912784796 | AI148: =IF(EQUAL(VLOOKUP(RC[-4], R9C3:R186C4, 2, 0), 1), RC[-1], NA()) -> #ERR: ArgCount | AJ148: =IF(ISERROR(RC[-1])=1, "", RC[-5]) ->  | AK148: 'Hungary | AL148: 'HUN | AM148: 0.854069003216364 | AN148: 0.191964544754769 | AO148: =1.64*RC[-1] -> 0.314821853397821 | AP148: =IF(EQUAL(VLOOKUP(RC[-4], R9C3:R186C4, 2, 0), 1), RC[-1], NA()) -> #ERR: ArgCount | AQ148: =IF(ISERROR(RC[-1])=1, "", RC[-5]) ->  | AR148: 'France | AS148: 'FRA | AT148: 1.07714091584612 | AU148: 0.207737275615815 | AV148: =1.64*RC[-1] -> 0.340689132009937 | AW148: =IF(EQUAL(VLOOKUP(RC[-4], R9C3:R186C4, 2, 0), 1), RC[-1], NA()) -> #ERR: ArgCount | AX148: =IF(ISERROR(RC[-1])=1, "", RC[-5]) ->  | AY148: 'Australia | AZ148: 'AUS | BA148: 1.60108375699323 | BB148: 0.206276316022536 | BC148: =1.64*RC[-1] -> 0.338293158276959 | BD148: =IF(EQUAL(VLOOKUP(RC[-4], R9C3:R186C4, 2, 0), 1), RC[-1], NA()) -> #ERR: ArgCount | BE148: =IF(ISERROR(RC[-1])=1, "", RC[-5]) -> 
B149: 'Sudan | C149: 'SDN | D149: =IF(EQUAL(ComparativeCharts!R[+11]C, ""), "", 1) ->  | E149: =IF(EQUAL(ComparativeCharts!R[+11]C, ""), "", 1) -> #EMPTY! | O149: 142 | P149: 'Israel | Q149: 'ISR | R149: 1.08338976240898 | S149: 0.254026944310672 | T149: =1.64*RC[-1] -> 0.416604188669502 | U149: =IF(EQUAL(VLOOKUP(RC[-4], R9C3:R186C4, 2, 0), 1), RC[-1], NA()) -> #ERR: ArgCount | V149: =IF(ISERROR(RC[-1])=1, "", RC[-5]) ->  | W149: 'Brunei | X149: 'BRN | Y149: 1.31795060989945 | Z149: 0.412522842574475 | AA149: =1.64*RC[-1] -> 0.676537461822139 | AB149: =IF(EQUAL(VLOOKUP(RC[-4], R9C3:R186C4, 2, 0), 1), RC[-1], NA()) -> #ERR: ArgCount | AC149: =IF(ISERROR(RC[-1])=1, "", RC[-5]) ->  | AD149: 'Germany | AE149: 'DEU | AF149: 1.40920903413881 | AG149: 0.233636532185851 | AH149: =1.64*RC[-1] -> 0.383163912784796 | AI149: =IF(EQUAL(VLOOKUP(RC[-4], R9C3:R186C4, 2, 0), 1), RC[-1], NA()) -> #ERR: ArgCount | AJ149: =IF(ISERROR(RC[-1])=1, "", RC[-5]) ->  | AK149: 'Spain | AL149: 'ESP | AM149: 0.86427141020372 | AN149: 0.228760003290238 | AO149: =1.64*RC[-1] -> 0.37516640539599 | AP149: =IF(EQUAL(VLOOKUP(RC[-4], R9C3:R186C4, 2, 0), 1), RC[-1], NA()) -> #ERR: ArgCount | AQ149: =IF(ISERROR(RC[-1])=1, "", RC[-5]) ->  | AR149: 'Portugal | AS149: 'PRT | AT149: 1.08332521365065 | AU149: 0.207737275615815 | AV149: =1.64*RC[-1] -> 0.340689132009937 | AW149: =IF(EQUAL(VLOOKUP(RC[-4], R9C3:R186C4, 2, 0), 1), RC[-1], NA()) -> #ERR: ArgCount | AX149: =IF(ISERROR(RC[-1])=1, "", RC[-5]) ->  | AY149: 'Germany | AZ149: 'DEU | BA149: 1.62029309421433 | BB149: 0.189092987537097 | BC149: =1.64*RC[-1] -> 0.310112499560839 | BD149: =IF(EQUAL(VLOOKUP(RC[-4], R9C3:R186C4, 2, 0), 1), RC[-1], NA()) -> #ERR: ArgCount | BE149: =IF(ISERROR(RC[-1])=1, "", RC[-5]) -> 
B150: 'Senegal | C150: 'SEN | D150: =IF(EQUAL(ComparativeCharts!R[+11]C, ""), "", 1) ->  | E150: =IF(EQUAL(ComparativeCharts!R[+11]C, ""), "", 1) -> #EMPTY! | O150: 143 | P150: 'Cyprus | Q150: 'CYP | R150: 1.11479927497593 | S150: 0.254026944310672 | T150: =1.64*RC[-1] -> 0.416604188669502 | U150: =IF(EQUAL(VLOOKUP(RC[-4], R9C3:R186C4, 2, 0), 1), RC[-1], NA()) -> #ERR: ArgCount | V150: =IF(ISERROR(RC[-1])=1, "", RC[-5]) ->  | W150: 'Malta | X150: 'MLT | Y150: 1.31795060989945 | Z150: 0.412522842574475 | AA150: =1.64*RC[-1] -> 0.676537461822139 | AB150: =IF(EQUAL(VLOOKUP(RC[-4], R9C3:R186C4, 2, 0), 1), RC[-1], NA()) -> #ERR: ArgCount | AC150: =IF(ISERROR(RC[-1])=1, "", RC[-5]) ->  | AD150: 'Australia | AE150: 'AUS | AF150: 1.4586935841993 | AG150: 0.248661311888018 | AH150: =1.64*RC[-1] -> 0.407804551496349 | AI150: =IF(EQUAL(VLOOKUP(RC[-4], R9C3:R186C4, 2, 0), 1), RC[-1], NA()) -> #ERR: ArgCount | AJ150: =IF(ISERROR(RC[-1])=1, "", RC[-5]) ->  | AK150: 'Canada | AL150: 'CAN | AM150: 0.869204272296916 | AN150: 0.228760003290238 | AO150: =1.64*RC[-1] -> 0.37516640539599 | AP150: =IF(EQUAL(VLOOKUP(RC[-4], R9C3:R186C4, 2, 0), 1), RC[-1], NA()) -> #ERR: ArgCount | AQ150: =IF(ISERROR(RC[-1])=1, "", RC[-5]) ->  | AR150: 'Chile | AS150: 'CHL | AT150: 1.08572525363529 | AU150: 0.218139839508948 | AV150: =1.64*RC[-1] -> 0.357749336794675 | AW150: =IF(EQUAL(VLOOKUP(RC[-4], R9C3:R186C4, 2, 0), 1), RC[-1], NA()) -> #ERR: ArgCount | AX150: =IF(ISERROR(RC[-1])=1, "", RC[-5]) ->  | AY150: 'Luxembourg | AZ150: 'LUX | BA150: 1.6712549925591 | BB150: 0.281815347728426 | BC150: =1.64*RC[-1] -> 0.462177170274619 | BD150: =IF(EQUAL(VLOOKUP(RC[-4], R9C3:R186C4, 2, 0), 1), RC[-1], NA()) -> #ERR: ArgCount | BE150: =IF(ISERROR(RC[-1])=1, "", RC[-5]) -> 
B151: 'Singapore | C151: 'SGP | D151: =IF(EQUAL(ComparativeCharts!R[+11]C, ""), "", 1) ->  | E151: =IF(EQUAL(ComparativeCharts!R[+11]C, ""), "", 1) -> #EMPTY! | O151: 144 | P151: 'Bahamas, The | Q151: 'BHS | R151: 1.13429282706373 | S151: 0.291377601755329 | T151: =1.64*RC[-1] -> 0.47785926687874 | U151: =IF(EQUAL(VLOOKUP(RC[-4], R9C3:R186C4, 2, 0), 1), RC[-1], NA()) -> #ERR: ArgCount | V151: =IF(ISERROR(RC[-1])=1, "", RC[-5]) ->  | W151: 'Austria | X151: 'AUT | Y151: 1.37679944691968 | Z151: 0.25228486761248 | AA151: =1.64*RC[-1] -> 0.413747182884467 | AB151: =IF(EQUAL(VLOOKUP(RC[-4], R9C3:R186C4, 2, 0), 1), RC[-1], NA()) -> #ERR: ArgCount | AC151: =IF(ISERROR(RC[-1])=1, "", RC[-5]) ->  | AD151: 'Iceland | AE151: 'ISL | AF151: 1.50391949815517 | AG151: 0.409633213579203 | AH151: =1.64*RC[-1] -> 0.671798470269893 | AI151: =IF(EQUAL(VLOOKUP(RC[-4], R9C3:R186C4, 2, 0), 1), RC[-1], NA()) -> #ERR: ArgCount | AJ151: =IF(ISERROR(RC[-1])=1, "", RC[-5]) ->  | AK151: 'Bahamas, The | AL151: 'BHS | AM151: 0.870010330676201 | AN151: 0.519940958319459 | AO151: =1.64*RC[-1] -> 0.852703171643913 | AP151: =IF(EQUAL(VLOOKUP(RC[-4], R9C3:R186C4, 2, 0), 1), RC[-1], NA()) -> #ERR: ArgCount | AQ151: =IF(ISERROR(RC[-1])=1, "", RC[-5]) ->  | AR151: 'West Bank and Gaza | AS151: 'WTB | AT151: 1.221594661877 | AU151: 0.562777653991577 | AV151: =1.64*RC[-1] -> 0.922955352546186 | AW151: =IF(EQUAL(VLOOKUP(RC[-4], R9C3:R186C4, 2, 0), 1), RC[-1], NA()) -> #ERR: ArgCount | AX151: =IF(ISERROR(RC[-1])=1, "", RC[-5]) ->  | AY151: 'Norway | AZ151: 'NOR | BA151: 1.68654569036321 | BB151: 0.198055085748779 | BC151: =1.64*RC[-1] -> 0.324810340627998 | BD151: =IF(EQUAL(VLOOKUP(RC[-4], R9C3:R186C4, 2, 0), 1), RC[-1], NA()) -> #ERR: ArgCount | BE151: =IF(ISERROR(RC[-1])=1, "", RC[-5]) -> 
B152: 'Solomon Islands | C152: 'SLB | D152: =IF(EQUAL(ComparativeCharts!R[+11]C, ""), "", 1) ->  | E152: =IF(EQUAL(ComparativeCharts!R[+11]C, ""), "", 1) -> #EMPTY! | O152: 145 | P152: 'France | Q152: 'FRA | R152: 1.1502996759102 | S152: 0.251300233223489 | T152: =1.64*RC[-1] -> 0.412132382486522 | U152: =IF(EQUAL(VLOOKUP(RC[-4], R9C3:R186C4, 2, 0), 1), RC[-1], NA()) -> #ERR: ArgCount | V152: =IF(ISERROR(RC[-1])=1, "", RC[-5]) ->  | W152: 'Qatar | X152: 'QAT | Y152: 1.38266137951045 | Z152: 0.299881889042829 | AA152: =1.64*RC[-1] -> 0.49180629803024 | AB152: =IF(EQUAL(VLOOKUP(RC[-4], R9C3:R186C4, 2, 0), 1), RC[-1], NA()) -> #ERR: ArgCount | AC152: =IF(ISERROR(RC[-1])=1, "", RC[-5]) ->  | AD152: 'New Zealand | AE152: 'NZL | AF152: 1.57128719735825 | AG152: 0.266441748954348 | AH152: =1.64*RC[-1] -> 0.436964468285131 | AI152: =IF(EQUAL(VLOOKUP(RC[-4], R9C3:R186C4, 2, 0), 1), RC[-1], NA()) -> #ERR: ArgCount | AJ152: =IF(ISERROR(RC[-1])=1, "", RC[-5]) ->  | AK152: 'Bolivia | AL152: 'BOL | AM152: 0.875846670399297 | AN152: 0.393787925241036 | AO152: =1.64*RC[-1] -> 0.645812197395299 | AP152: =IF(EQUAL(VLOOKUP(RC[-4], R9C3:R186C4, 2, 0), 1), RC[-1], NA()) -> #ERR: ArgCount | AQ152: =IF(ISERROR(RC[-1])=1, "", RC[-5]) ->  | AR152: 'Brunei | AS152: 'BRN | AT152: 1.25157375441913 | AU152: 0.548697312118359 | AV152: =1.64*RC[-1] -> 0.899863591874109 | AW152: =IF(EQUAL(VLOOKUP(RC[-4], R9C3:R186C4, 2, 0), 1), RC[-1], NA()) -> #ERR: ArgCount | AX152: =IF(ISERROR(RC[-1])=1, "", RC[-5]) ->  | AY152: 'United Kingdom | AZ152: 'GBR | BA152: 1.70652356582384 | BB152: 0.189092987537097 | BC152: =1.64*RC[-1] -> 0.310112499560839 | BD152: =IF(EQUAL(VLOOKUP(RC[-4], R9C3:R186C4, 2, 0), 1), RC[-1], NA()) -> #ERR: ArgCount | BE152: =IF(ISERROR(RC[-1])=1, "", RC[-5]) -> 
B153: 'Sierra Leone | C153: 'SLE | D153: =IF(EQUAL(ComparativeCharts!R[+11]C, ""), "", 1) ->  | E153: =IF(EQUAL(ComparativeCharts!R[+11]C, ""), "", 1) -> #EMPTY! | O153: 146 | P153: 'Japan | Q153: 'JPN | R153: 1.16310960274083 | S153: 0.291377601755329 | T153: =1.64*RC[-1] -> 0.47785926687874 | U153: =IF(EQUAL(VLOOKUP(RC[-4], R9C3:R186C4, 2, 0), 1), RC[-1], NA()) -> #ERR: ArgCount | V153: =IF(ISERROR(RC[-1])=1, "", RC[-5]) ->  | W153: 'Portugal | X153: 'PRT | Y153: 1.38507709094387 | Z153: 0.25228486761248 | AA153: =1.64*RC[-1] -> 0.413747182884467 | AB153: =IF(EQUAL(VLOOKUP(RC[-4], R9C3:R186C4, 2, 0), 1), RC[-1], NA()) -> #ERR: ArgCount | AC153: =IF(ISERROR(RC[-1])=1, "", RC[-5]) ->  | AD153: 'Sweden | AE153: 'SWE | AF153: 1.57280301340948 | AG153: 0.248661311888018 | AH153: =1.64*RC[-1] -> 0.407804551496349 | AI153: =IF(EQUAL(VLOOKUP(RC[-4], R9C3:R186C4, 2, 0), 1), RC[-1], NA()) -> #ERR: ArgCount | AJ153: =IF(ISERROR(RC[-1])=1, "", RC[-5]) ->  | AK153: 'Switzerland | AL153: 'CHE | AM153: 0.87794009701114 | AN153: 0.228760003290238 | AO153: =1.64*RC[-1] -> 0.37516640539599 | AP153: =IF(EQUAL(VLOOKUP(RC[-4], R9C3:R186C4, 2, 0), 1), RC[-1], NA()) -> #ERR: ArgCount | AQ153: =IF(ISERROR(RC[-1])=1, "", RC[-5]) ->  | AR153: 'United States | AS153: 'USA | AT153: 1.2541184418853 | AU153: 0.207737275615815 | AV153: =1.64*RC[-1] -> 0.340689132009937 | AW153: =IF(EQUAL(VLOOKUP(RC[-4], R9C3:R186C4, 2, 0), 1), RC[-1], NA()) -> #ERR: ArgCount | AX153: =IF(ISERROR(RC[-1])=1, "", RC[-5]) ->  | AY153: 'Cyprus | AZ153: 'CYP | BA153: 1.81128380126771 | BB153: 0.267063170408295 | BC153: =1.64*RC[-1] -> 0.437983599469604 | BD153: =IF(EQUAL(VLOOKUP(RC[-4], R9C3:R186C4, 2, 0), 1), RC[-1], NA()) -> #ERR: ArgCount | BE153: =IF(ISERROR(RC[-1])=1, "", RC[-5]) -> 
B154: 'El Salvador | C154: 'SLV | D154: =IF(EQUAL(ComparativeCharts!R[+11]C, ""), "", 1) ->  | E154: =IF(EQUAL(ComparativeCharts!R[+11]C, ""), "", 1) -> #EMPTY! | O154: 147 | P154: 'Solomon Islands | Q154: 'SLB | R154: 1.17264213728559 | S154: 0.360314615495306 | T154: =1.64*RC[-1] -> 0.590915969412302 | U154: =IF(EQUAL(VLOOKUP(RC[-4], R9C3:R186C4, 2, 0), 1), RC[-1], NA()) -> #ERR: ArgCount | V154: =IF(ISERROR(RC[-1])=1, "", RC[-5]) ->  | W154: 'Singapore | X154: 'SGP | Y154: 1.38589146288798 | Z154: 0.25228486761248 | AA154: =1.64*RC[-1] -> 0.413747182884467 | AB154: =IF(EQUAL(VLOOKUP(RC[-4], R9C3:R186C4, 2, 0), 1), RC[-1], NA()) -> #ERR: ArgCount | AC154: =IF(ISERROR(RC[-1])=1, "", RC[-5]) ->  | AD154: 'Spain | AE154: 'ESP | AF154: 1.60327032032394 | AG154: 0.233636532185851 | AH154: =1.64*RC[-1] -> 0.383163912784796 | AI154: =IF(EQUAL(VLOOKUP(RC[-4], R9C3:R186C4, 2, 0), 1), RC[-1], NA()) -> #ERR: ArgCount | AJ154: =IF(ISERROR(RC[-1])=1, "", RC[-5]) ->  | AK154: 'Portugal | AL154: 'PRT | AM154: 0.889263512052202 | AN154: 0.228760003290238 | AO154: =1.64*RC[-1] -> 0.37516640539599 | AP154: =IF(EQUAL(VLOOKUP(RC[-4], R9C3:R186C4, 2, 0), 1), RC[-1], NA()) -> #ERR: ArgCount | AQ154: =IF(ISERROR(RC[-1])=1, "", RC[-5]) ->  | AR154: 'Qatar | AS154: 'QAT | AT154: 1.2693962872618 | AU154: 0.276349686366578 | AV154: =1.64*RC[-1] -> 0.453213485641188 | AW154: =IF(EQUAL(VLOOKUP(RC[-4], R9C3:R186C4, 2, 0), 1), RC[-1], NA()) -> #ERR: ArgCount | AX154: =IF(ISERROR(RC[-1])=1, "", RC[-5]) ->  | AY154: 'Iceland | AZ154: 'ISL | BA154: 1.83055185296978 | BB154: 0.307151938975515 | BC154: =1.64*RC[-1] -> 0.503729179919845 | BD154: =IF(EQUAL(VLOOKUP(RC[-4], R9C3:R186C4, 2, 0), 1), RC[-1], NA()) -> #ERR: ArgCount | BE154: =IF(ISERROR(RC[-1])=1, "", RC[-5]) -> 
B155: 'Somalia | C155: 'SOM | D155: =IF(EQUAL(ComparativeCharts!R[+11]C, ""), "", 1) ->  | E155: =IF(EQUAL(ComparativeCharts!R[+11]C, ""), "", 1) -> #EMPTY! | O155: 148 | P155: 'Hungary | Q155: 'HUN | R155: 1.19831936661523 | S155: 0.251300233223489 | T155: =1.64*RC[-1] -> 0.412132382486522 | U155: =IF(EQUAL(VLOOKUP(RC[-4], R9C3:R186C4, 2, 0), 1), RC[-1], NA()) -> #ERR: ArgCount | V155: =IF(ISERROR(RC[-1])=1, "", RC[-5]) ->  | W155: 'Luxembourg | X155: 'LUX | Y155: 1.39772245094882 | Z155: 0.372830223049686 | AA155: =1.64*RC[-1] -> 0.611441565801485 | AB155: =IF(EQUAL(VLOOKUP(RC[-4], R9C3:R186C4, 2, 0), 1), RC[-1], NA()) -> #ERR: ArgCount | AC155: =IF(ISERROR(RC[-1])=1, "", RC[-5]) ->  | AD155: 'Finland | AE155: 'FIN | AF155: 1.63475799656034 | AG155: 0.248661311888018 | AH155: =1.64*RC[-1] -> 0.407804551496349 | AI155: =IF(EQUAL(VLOOKUP(RC[-4], R9C3:R186C4, 2, 0), 1), RC[-1], NA()) -> #ERR: ArgCount | AJ155: =IF(ISERROR(RC[-1])=1, "", RC[-5]) ->  | AK155: 'Germany | AL155: 'DEU | AM155: 0.889403253828528 | AN155: 0.228760003290238 | AO155: =1.64*RC[-1] -> 0.37516640539599 | AP155: =IF(EQUAL(VLOOKUP(RC[-4], R9C3:R186C4, 2, 0), 1), RC[-1], NA()) -> #ERR: ArgCount | AQ155: =IF(ISERROR(RC[-1])=1, "", RC[-5]) ->  | AR155: 'Mauritius | AS155: 'MUS | AT155: 1.278924151795 | AU155: 0.31108529724681 | AV155: =1.64*RC[-1] -> 0.510179887484768 | AW155: =IF(EQUAL(VLOOKUP(RC[-4], R9C3:R186C4, 2, 0), 1), RC[-1], NA()) -> #ERR: ArgCount | AX155: =IF(ISERROR(RC[-1])=1, "", RC[-5]) ->  | AY155: 'Singapore | AZ155: 'SGP | BA155: 1.94750601272155 | BB155: 0.158656592213327 | BC155: =1.64*RC[-1] -> 0.260196811229856 | BD155: =IF(EQUAL(VLOOKUP(RC[-4], R9C3:R186C4, 2, 0), 1), RC[-1], NA()) -> #ERR: ArgCount | BE155: =IF(ISERROR(RC[-1])=1, "", RC[-5]) -> 
B156: 'Sao Tome and Principe and Pr | C156: 'STP | D156: =IF(EQUAL(ComparativeCharts!R[+11]C, ""), "", 1) ->  | E156: =IF(EQUAL(ComparativeCharts!R[+11]C, ""), "", 1) -> #EMPTY! | O156: 149 | P156: 'Czech Republic | Q156: 'CZE | R156: 1.20137376687175 | S156: 0.251300233223489 | T156: =1.64*RC[-1] -> 0.412132382486522 | U156: =IF(EQUAL(VLOOKUP(RC[-4], R9C3:R186C4, 2, 0), 1), RC[-1], NA()) -> #ERR: ArgCount | V156: =IF(ISERROR(RC[-1])=1, "", RC[-5]) ->  | W156: 'Sweden | X156: 'SWE | Y156: 1.41091877442809 | Z156: 0.263344534520094 | AA156: =1.64*RC[-1] -> 0.431885036612954 | AB156: =IF(EQUAL(VLOOKUP(RC[-4], R9C3:R186C4, 2, 0), 1), RC[-1], NA()) -> #ERR: ArgCount | AC156: =IF(ISERROR(RC[-1])=1, "", RC[-5]) ->  | AD156: 'Norway | AE156: 'NOR | AF156: 1.66621770442048 | AG156: 0.248661311888018 | AH156: =1.64*RC[-1] -> 0.407804551496349 | AI156: =IF(EQUAL(VLOOKUP(RC[-4], R9C3:R186C4, 2, 0), 1), RC[-1], NA()) -> #ERR: ArgCount | AJ156: =IF(ISERROR(RC[-1])=1, "", RC[-5]) ->  | AK156: 'Chile | AL156: 'CHL | AM156: 0.898261466987748 | AN156: 0.2290464009857 | AO156: =1.64*RC[-1] -> 0.375636097616548 | AP156: =IF(EQUAL(VLOOKUP(RC[-4], R9C3:R186C4, 2, 0), 1), RC[-1], NA()) -> #ERR: ArgCount | AQ156: =IF(ISERROR(RC[-1])=1, "", RC[-5]) ->  | AR156: 'Hong Kong, China | AS156: 'HKG | AT156: 1.33339129542776 | AU156: 0.217937465518249 | AV156: =1.64*RC[-1] -> 0.357417443449928 | AW156: =IF(EQUAL(VLOOKUP(RC[-4], R9C3:R186C4, 2, 0), 1), RC[-1], NA()) -> #ERR: ArgCount | AX156: =IF(ISERROR(RC[-1])=1, "", RC[-5]) ->  | AY156: 'Netherlands | AZ156: 'NLD | BA156: 2.02640726993069 | BB156: 0.198055085748779 | BC156: =1.64*RC[-1] -> 0.324810340627998 | BD156: =IF(EQUAL(VLOOKUP(RC[-4], R9C3:R186C4, 2, 0), 1), RC[-1], NA()) -> #ERR: ArgCount | BE156: =IF(ISERROR(RC[-1])=1, "", RC[-5]) -> 
B157: 'Suriname | C157: 'SUR | D157: =IF(EQUAL(ComparativeCharts!R[+11]C, ""), "", 1) ->  | E157: =IF(EQUAL(ComparativeCharts!R[+11]C, ""), "", 1) -> #EMPTY! | O157: 150 | P157: 'Belize | Q157: 'BLZ | R157: 1.23132220962058 | S157: 0.360314615495306 | T157: =1.64*RC[-1] -> 0.590915969412302 | U157: =IF(EQUAL(VLOOKUP(RC[-4], R9C3:R186C4, 2, 0), 1), RC[-1], NA()) -> #ERR: ArgCount | V157: =IF(ISERROR(RC[-1])=1, "", RC[-5]) ->  | W157: 'Norway | X157: 'NOR | Y157: 1.41442831552291 | Z157: 0.263344534520094 | AA157: =1.64*RC[-1] -> 0.431885036612954 | AB157: =IF(EQUAL(VLOOKUP(RC[-4], R9C3:R186C4, 2, 0), 1), RC[-1], NA()) -> #ERR: ArgCount | AC157: =IF(ISERROR(RC[-1])=1, "", RC[-5]) ->  | AD157: 'Luxembourg | AE157: 'LUX | AF157: 1.67365567606964 | AG157: 0.409633213579203 | AH157: =1.64*RC[-1] -> 0.671798470269893 | AI157: =IF(EQUAL(VLOOKUP(RC[-4], R9C3:R186C4, 2, 0), 1), RC[-1], NA()) -> #ERR: ArgCount | AJ157: =IF(ISERROR(RC[-1])=1, "", RC[-5]) ->  | AK157: 'Austria | AL157: 'AUT | AM157: 0.900880836334925 | AN157: 0.228760003290238 | AO157: =1.64*RC[-1] -> 0.37516640539599 | AP157: =IF(EQUAL(VLOOKUP(RC[-4], R9C3:R186C4, 2, 0), 1), RC[-1], NA()) -> #ERR: ArgCount | AQ157: =IF(ISERROR(RC[-1])=1, "", RC[-5]) ->  | AR157: 'Ireland | AS157: 'IRL | AT157: 1.3949005873786 | AU157: 0.207737275615815 | AV157: =1.64*RC[-1] -> 0.340689132009937 | AW157: =IF(EQUAL(VLOOKUP(RC[-4], R9C3:R186C4, 2, 0), 1), RC[-1], NA()) -> #ERR: ArgCount | AX157: =IF(ISERROR(RC[-1])=1, "", RC[-5]) ->  | AY157: 'Canada | AZ157: 'CAN | BA157: 2.05547485668362 | BB157: 0.196208208436663 | BC157: =1.64*RC[-1] -> 0.321781461836127 | BD157: =IF(EQUAL(VLOOKUP(RC[-4], R9C3:R186C4, 2, 0), 1), RC[-1], NA()) -> #ERR: ArgCount | BE157: =IF(ISERROR(RC[-1])=1, "", RC[-5]) -> 
B158: 'Slovak Republic | C158: 'SVK | D158: =IF(EQUAL(ComparativeCharts!R[+11]C, ""), "", 1) ->  | E158: =IF(EQUAL(ComparativeCharts!R[+11]C, ""), "", 1) -> #EMPTY! | O158: 151 | P158: 'Italy | Q158: 'ITA | R158: 1.28691964321953 | S158: 0.251300233223489 | T158: =1.64*RC[-1] -> 0.412132382486522 | U158: =IF(EQUAL(VLOOKUP(RC[-4], R9C3:R186C4, 2, 0), 1), RC[-1], NA()) -> #ERR: ArgCount | V158: =IF(ISERROR(RC[-1])=1, "", RC[-5]) ->  | W158: 'New Zealand | X158: 'NZL | Y158: 1.41593941692657 | Z158: 0.283550357121878 | AA158: =1.64*RC[-1] -> 0.46502258567988 | AB158: =IF(EQUAL(VLOOKUP(RC[-4], R9C3:R186C4, 2, 0), 1), RC[-1], NA()) -> #ERR: ArgCount | AC158: =IF(ISERROR(RC[-1])=1, "", RC[-5]) ->  | AD158: 'Canada | AE158: 'CAN | AF158: 1.71734777384897 | AG158: 0.233636532185851 | AH158: =1.64*RC[-1] -> 0.383163912784796 | AI158: =IF(EQUAL(VLOOKUP(RC[-4], R9C3:R186C4, 2, 0), 1), RC[-1], NA()) -> #ERR: ArgCount | AJ158: =IF(ISERROR(RC[-1])=1, "", RC[-5]) ->  | AK158: 'Costa Rica | AL158: 'CRI | AM158: 0.92701027674402 | AN158: 0.393787925241036 | AO158: =1.64*RC[-1] -> 0.645812197395299 | AP158: =IF(EQUAL(VLOOKUP(RC[-4], R9C3:R186C4, 2, 0), 1), RC[-1], NA()) -> #ERR: ArgCount | AQ158: =IF(ISERROR(RC[-1])=1, "", RC[-5]) ->  | AR158: 'Japan | AS158: 'JPN | AT158: 1.42187452824604 | AU158: 0.250315436772745 | AV158: =1.64*RC[-1] -> 0.410517316307302 | AW158: =IF(EQUAL(VLOOKUP(RC[-4], R9C3:R186C4, 2, 0), 1), RC[-1], NA()) -> #ERR: ArgCount | AX158: =IF(ISERROR(RC[-1])=1, "", RC[-5]) ->  | AY158: 'Switzerland | AZ158: 'CHE | BA158: 2.0717306679793 | BB158: 0.189092987537097 | BC158: =1.64*RC[-1] -> 0.310112499560839 | BD158: =IF(EQUAL(VLOOKUP(RC[-4], R9C3:R186C4, 2, 0), 1), RC[-1], NA()) -> #ERR: ArgCount | BE158: =IF(ISERROR(RC[-1])=1, "", RC[-5]) -> 
B159: 'Slovenia | C159: 'SVN | D159: =IF(EQUAL(ComparativeCharts!R[+11]C, ""), "", 1) -> 1 | E159: =IF(EQUAL(ComparativeCharts!R[+11]C, ""), "", 1) -> #EMPTY! | O159: 152 | P159: 'Spain | Q159: 'ESP | R159: 1.33801997724481 | S159: 0.251300233223489 | T159: =1.64*RC[-1] -> 0.412132382486522 | U159: =IF(EQUAL(VLOOKUP(RC[-4], R9C3:R186C4, 2, 0), 1), RC[-1], NA()) -> #ERR: ArgCount | V159: =IF(ISERROR(RC[-1])=1, "", RC[-5]) ->  | W159: 'Ireland | X159: 'IRL | Y159: 1.42621700257852 | Z159: 0.25228486761248 | AA159: =1.64*RC[-1] -> 0.413747182884467 | AB159: =IF(EQUAL(VLOOKUP(RC[-4], R9C3:R186C4, 2, 0), 1), RC[-1], NA()) -> #ERR: ArgCount | AC159: =IF(ISERROR(RC[-1])=1, "", RC[-5]) ->  | AD159: 'Denmark | AE159: 'DNK | AF159: 1.72105185492222 | AG159: 0.248661311888018 | AH159: =1.64*RC[-1] -> 0.407804551496349 | AI159: =IF(EQUAL(VLOOKUP(RC[-4], R9C3:R186C4, 2, 0), 1), RC[-1], NA()) -> #ERR: ArgCount | AJ159: =IF(ISERROR(RC[-1])=1, "", RC[-5]) ->  | AK159: 'Norway | AL159: 'NOR | AM159: 0.932123586692143 | AN159: 0.2290464009857 | AO159: =1.64*RC[-1] -> 0.375636097616548 | AP159: =IF(EQUAL(VLOOKUP(RC[-4], R9C3:R186C4, 2, 0), 1), RC[-1], NA()) -> #ERR: ArgCount | AQ159: =IF(ISERROR(RC[-1])=1, "", RC[-5]) ->  | AR159: 'Iceland | AS159: 'ISL | AT159: 1.46892971628538 | AU159: 0.302942850391962 | AV159: =1.64*RC[-1] -> 0.496826274642818 | AW159: =IF(EQUAL(VLOOKUP(RC[-4], R9C3:R186C4, 2, 0), 1), RC[-1], NA()) -> #ERR: ArgCount | AX159: =IF(ISERROR(RC[-1])=1, "", RC[-5]) ->  | AY159: 'New Zealand | AZ159: 'NZL | BA159: 2.07494219661209 | BB159: 0.200691571592182 | BC159: =1.64*RC[-1] -> 0.329134177411178 | BD159: =IF(EQUAL(VLOOKUP(RC[-4], R9C3:R186C4, 2, 0), 1), RC[-1], NA()) -> #ERR: ArgCount | BE159: =IF(ISERROR(RC[-1])=1, "", RC[-5]) -> 
B160: 'Sweden | C160: 'SWE | D160: =IF(EQUAL(ComparativeCharts!R[+11]C, ""), "", 1) ->  | E160: =IF(EQUAL(ComparativeCharts!R[+11]C, ""), "", 1) -> #EMPTY! | O160: 153 | P160: 'Costa Rica | Q160: 'CRI | R160: 1.34527460800992 | S160: 0.251300233223489 | T160: =1.64*RC[-1] -> 0.412132382486522 | U160: =IF(EQUAL(VLOOKUP(RC[-4], R9C3:R186C4, 2, 0), 1), RC[-1], NA()) -> #ERR: ArgCount | V160: =IF(ISERROR(RC[-1])=1, "", RC[-5]) ->  | W160: 'Netherlands | X160: 'NLD | Y160: 1.47887056135898 | Z160: 0.263344534520094 | AA160: =1.64*RC[-1] -> 0.431885036612954 | AB160: =IF(EQUAL(VLOOKUP(RC[-4], R9C3:R186C4, 2, 0), 1), RC[-1], NA()) -> #ERR: ArgCount | AC160: =IF(ISERROR(RC[-1])=1, "", RC[-5]) ->  | AD160: 'United Kingdom | AE160: 'GBR | AF160: 1.9661212499736 | AG160: 0.233636532185851 | AH160: =1.64*RC[-1] -> 0.383163912784796 | AI160: =IF(EQUAL(VLOOKUP(RC[-4], R9C3:R186C4, 2, 0), 1), RC[-1], NA()) -> #ERR: ArgCount | AJ160: =IF(ISERROR(RC[-1])=1, "", RC[-5]) ->  | AK160: 'Luxembourg | AL160: 'LUX | AM160: 0.946660983612003 | AN160: 0.247238613070611 | AO160: =1.64*RC[-1] -> 0.405471325435802 | AP160: =IF(EQUAL(VLOOKUP(RC[-4], R9C3:R186C4, 2, 0), 1), RC[-1], NA()) -> #ERR: ArgCount | AQ160: =IF(ISERROR(RC[-1])=1, "", RC[-5]) ->  | AR160: 'Germany | AS160: 'DEU | AT160: 1.48348680130881 | AU160: 0.207737275615815 | AV160: =1.64*RC[-1] -> 0.340689132009937 | AW160: =IF(EQUAL(VLOOKUP(RC[-4], R9C3:R186C4, 2, 0), 1), RC[-1], NA()) -> #ERR: ArgCount | AX160: =IF(ISERROR(RC[-1])=1, "", RC[-5]) ->  | AY160: 'Finland | AZ160: 'FIN | BA160: 2.08459383980899 | BB160: 0.198055085748779 | BC160: =1.64*RC[-1] -> 0.324810340627998 | BD160: =IF(EQUAL(VLOOKUP(RC[-4], R9C3:R186C4, 2, 0), 1), RC[-1], NA()) -> #ERR: ArgCount | BE160: =IF(ISERROR(RC[-1])=1, "", RC[-5]) -> 
B161: 'Swaziland | C161: 'SWZ | D161: =IF(EQUAL(ComparativeCharts!R[+11]C, ""), "", 1) ->  | E161: =IF(EQUAL(ComparativeCharts!R[+11]C, ""), "", 1) -> #EMPTY! | O161: 154 | P161: 'Canada | Q161: 'CAN | R161: 1.36194187920728 | S161: 0.251300233223489 | T161: =1.64*RC[-1] -> 0.412132382486522 | U161: =IF(EQUAL(VLOOKUP(RC[-4], R9C3:R186C4, 2, 0), 1), RC[-1], NA()) -> #ERR: ArgCount | V161: =IF(ISERROR(RC[-1])=1, "", RC[-5]) ->  | W161: 'Finland | X161: 'FIN | Y161: 1.5143605283955 | Z161: 0.263344534520094 | AA161: =1.64*RC[-1] -> 0.431885036612954 | AB161: =IF(EQUAL(VLOOKUP(RC[-4], R9C3:R186C4, 2, 0), 1), RC[-1], NA()) -> #ERR: ArgCount | AC161: =IF(ISERROR(RC[-1])=1, "", RC[-5]) ->  | AD161: 'Switzerland | AE161: 'CHE | AF161: 1.98625232151785 | AG161: 0.233636532185851 | AH161: =1.64*RC[-1] -> 0.383163912784796 | AI161: =IF(EQUAL(VLOOKUP(RC[-4], R9C3:R186C4, 2, 0), 1), RC[-1], NA()) -> #ERR: ArgCount | AJ161: =IF(ISERROR(RC[-1])=1, "", RC[-5]) ->  | AK161: 'Uruguay | AL161: 'URY | AM161: 0.948776369974243 | AN161: 0.395254221998157 | AO161: =1.64*RC[-1] -> 0.648216924076978 | AP161: =IF(EQUAL(VLOOKUP(RC[-4], R9C3:R186C4, 2, 0), 1), RC[-1], NA()) -> #ERR: ArgCount | AQ161: =IF(ISERROR(RC[-1])=1, "", RC[-5]) ->  | AR161: 'Canada | AS161: 'CAN | AT161: 1.5494586944364 | AU161: 0.207737275615815 | AV161: =1.64*RC[-1] -> 0.340689132009937 | AW161: =IF(EQUAL(VLOOKUP(RC[-4], R9C3:R186C4, 2, 0), 1), RC[-1], NA()) -> #ERR: ArgCount | AX161: =IF(ISERROR(RC[-1])=1, "", RC[-5]) ->  | AY161: 'Sweden | AZ161: 'SWE | BA161: 2.08533689883049 | BB161: 0.198055085748779 | BC161: =1.64*RC[-1] -> 0.324810340627998 | BD161: =IF(EQUAL(VLOOKUP(RC[-4], R9C3:R186C4, 2, 0), 1), RC[-1], NA()) -> #ERR: ArgCount | BE161: =IF(ISERROR(RC[-1])=1, "", RC[-5]) -> 
B162: 'Syrian Arab Republic | C162: 'SYR | D162: =IF(EQUAL(ComparativeCharts!R[+11]C, ""), "", 1) ->  | E162: =IF(EQUAL(ComparativeCharts!R[+11]C, ""), "", 1) -> #EMPTY! | O162: 155 | P162: 'Malta | Q162: 'MLT | R162: 1.41314228773965 | S162: 0.291377601755329 | T162: =1.64*RC[-1] -> 0.47785926687874 | U162: =IF(EQUAL(VLOOKUP(RC[-4], R9C3:R186C4, 2, 0), 1), RC[-1], NA()) -> #ERR: ArgCount | V162: =IF(ISERROR(RC[-1])=1, "", RC[-5]) ->  | W162: 'Switzerland | X162: 'CHE | Y162: 1.69047021297138 | Z162: 0.25228486761248 | AA162: =1.64*RC[-1] -> 0.413747182884467 | AB162: =IF(EQUAL(VLOOKUP(RC[-4], R9C3:R186C4, 2, 0), 1), RC[-1], NA()) -> #ERR: ArgCount | AC162: =IF(ISERROR(RC[-1])=1, "", RC[-5]) ->  | AD162: 'Netherlands | AE162: 'NLD | AF162: 2.03024130164716 | AG162: 0.248661311888018 | AH162: =1.64*RC[-1] -> 0.407804551496349 | AI162: =IF(EQUAL(VLOOKUP(RC[-4], R9C3:R186C4, 2, 0), 1), RC[-1], NA()) -> #ERR: ArgCount | AJ162: =IF(ISERROR(RC[-1])=1, "", RC[-5]) ->  | AK162: 'Australia | AL162: 'AUS | AM162: 0.961970146857995 | AN162: 0.2290464009857 | AO162: =1.64*RC[-1] -> 0.375636097616548 | AP162: =IF(EQUAL(VLOOKUP(RC[-4], R9C3:R186C4, 2, 0), 1), RC[-1], NA()) -> #ERR: ArgCount | AQ162: =IF(ISERROR(RC[-1])=1, "", RC[-5]) ->  | AR162: 'Netherlands | AS162: 'NLD | AT162: 1.58394112964466 | AU162: 0.218139839508948 | AV162: =1.64*RC[-1] -> 0.357749336794675 | AW162: =IF(EQUAL(VLOOKUP(RC[-4], R9C3:R186C4, 2, 0), 1), RC[-1], NA()) -> #ERR: ArgCount | AX162: =IF(ISERROR(RC[-1])=1, "", RC[-5]) ->  | AY162: 'Denmark | AZ162: 'DNK | BA162: 2.12901661138458 | BB162: 0.198055085748779 | BC162: =1.64*RC[-1] -> 0.324810340627998 | BD162: =IF(EQUAL(VLOOKUP(RC[-4], R9C3:R186C4, 2, 0), 1), RC[-1], NA()) -> #ERR: ArgCount | BE162: =IF(ISERROR(RC[-1])=1, "", RC[-5]) -> 
B163: 'Chad | C163: 'TCD | D163: =IF(EQUAL(ComparativeCharts!R[+11]C, ""), "", 1) ->  | E163: =IF(EQUAL(ComparativeCharts!R[+11]C, ""), "", 1) -> #EMPTY! | O163: 156 | P163: 'Belgium | Q163: 'BEL | R163: 1.43641939238064 | S163: 0.254026944310672 | T163: =1.64*RC[-1] -> 0.416604188669502 | U163: =IF(EQUAL(VLOOKUP(RC[-4], R9C3:R186C4, 2, 0), 1), RC[-1], NA()) -> #ERR: ArgCount | V163: =IF(ISERROR(RC[-1])=1, "", RC[-5]) ->  | W163: 'Afghanistan | X163: 'AFG | Y163: 0 | Z163: 0 | AA163: =1.64*RC[-1] -> 0 | AB163: =IF(EQUAL(VLOOKUP(RC[-4], R9C3:R186C4, 2, 0), 1), RC[-1], NA()) -> #ERR: ArgCount | AC163: =IF(ISERROR(RC[-1])=1, "", RC[-5]) ->  | AD163: 'Singapore | AE163: 'SGP | AF163: 2.08219811627607 | AG163: 0.233636532185851 | AH163: =1.64*RC[-1] -> 0.383163912784796 | AI163: =IF(EQUAL(VLOOKUP(RC[-4], R9C3:R186C4, 2, 0), 1), RC[-1], NA()) -> #ERR: ArgCount | AJ163: =IF(ISERROR(RC[-1])=1, "", RC[-5]) ->  | AK163: 'Panama | AL163: 'PAN | AM163: 1.00170989596288 | AN163: 0.395254221998157 | AO163: =1.64*RC[-1] -> 0.648216924076978 | AP163: =IF(EQUAL(VLOOKUP(RC[-4], R9C3:R186C4, 2, 0), 1), RC[-1], NA()) -> #ERR: ArgCount | AQ163: =IF(ISERROR(RC[-1])=1, "", RC[-5]) ->  | AR163: 'Australia | AS163: 'AUS | AT163: 1.59634107197309 | AU163: 0.218139839508948 | AV163: =1.64*RC[-1] -> 0.357749336794675 | AW163: =IF(EQUAL(VLOOKUP(RC[-4], R9C3:R186C4, 2, 0), 1), RC[-1], NA()) -> #ERR: ArgCount | AX163: =IF(ISERROR(RC[-1])=1, "", RC[-5]) ->  | AY163: 'Afghanistan | AZ163: 'AFG | BA163: 0 | BB163: 0 | BC163: =1.64*RC[-1] -> 0 | BD163: =IF(EQUAL(VLOOKUP(RC[-4], R9C3:R186C4, 2, 0), 1), RC[-1], NA()) -> #ERR: ArgCount | BE163: =IF(ISERROR(RC[-1])=1, "", RC[-5]) -> 
B164: 'Togo | C164: 'TGO | D164: =IF(EQUAL(ComparativeCharts!R[+11]C, ""), "", 1) ->  | E164: =IF(EQUAL(ComparativeCharts!R[+11]C, ""), "", 1) -> #EMPTY! | O164: 157 | P164: 'Iceland | Q164: 'ISL | R164: 1.44700186686527 | S164: 0.291377601755329 | T164: =1.64*RC[-1] -> 0.47785926687874 | U164: =IF(EQUAL(VLOOKUP(RC[-4], R9C3:R186C4, 2, 0), 1), RC[-1], NA()) -> #ERR: ArgCount | V164: =IF(ISERROR(RC[-1])=1, "", RC[-5]) ->  | W164: 'Burundi | X164: 'BDI | Y164: 0 | Z164: 0 | AA164: =1.64*RC[-1] -> 0 | AB164: =IF(EQUAL(VLOOKUP(RC[-4], R9C3:R186C4, 2, 0), 1), RC[-1], NA()) -> #ERR: ArgCount | AC164: =IF(ISERROR(RC[-1])=1, "", RC[-5]) ->  | AD164: 'Afghanistan | AE164: 'AFG | AF164: 0 | AG164: 0 | AH164: =1.64*RC[-1] -> 0 | AI164: =IF(EQUAL(VLOOKUP(RC[-4], R9C3:R186C4, 2, 0), 1), RC[-1], NA()) -> #ERR: ArgCount | AJ164: =IF(ISERROR(RC[-1])=1, "", RC[-5]) ->  | AK164: 'Denmark | AL164: 'DNK | AM164: 1.04792731282587 | AN164: 0.2290464009857 | AO164: =1.64*RC[-1] -> 0.375636097616548 | AP164: =IF(EQUAL(VLOOKUP(RC[-4], R9C3:R186C4, 2, 0), 1), RC[-1], NA()) -> #ERR: ArgCount | AQ164: =IF(ISERROR(RC[-1])=1, "", RC[-5]) ->  | AR164: 'Luxembourg | AS164: 'LUX | AT164: 1.62106412878027 | AU164: 0.302942850391962 | AV164: =1.64*RC[-1] -> 0.496826274642818 | AW164: =IF(EQUAL(VLOOKUP(RC[-4], R9C3:R186C4, 2, 0), 1), RC[-1], NA()) -> #ERR: ArgCount | AX164: =IF(ISERROR(RC[-1])=1, "", RC[-5]) ->  | AY164: 'Burundi | AZ164: 'BDI | BA164: 0 | BB164: 0 | BC164: =1.64*RC[-1] -> 0 | BD164: =IF(EQUAL(VLOOKUP(RC[-4], R9C3:R186C4, 2, 0), 1), RC[-1], NA()) -> #ERR: ArgCount | BE164: =IF(ISERROR(RC[-1])=1, "", RC[-5]) -> 
B165: 'Thailand | C165: 'THA | D165: =IF(EQUAL(ComparativeCharts!R[+11]C, ""), "", 1) ->  | E165: =IF(EQUAL(ComparativeCharts!R[+11]C, ""), "", 1) -> #EMPTY! | O165: 158 | P165: 'Austria | Q165: 'AUT | R165: 1.44716600157334 | S165: 0.251300233223489 | T165: =1.64*RC[-1] -> 0.412132382486522 | U165: =IF(EQUAL(VLOOKUP(RC[-4], R9C3:R186C4, 2, 0), 1), RC[-1], NA()) -> #ERR: ArgCount | V165: =IF(ISERROR(RC[-1])=1, "", RC[-5]) ->  | W165: 'Belize | X165: 'BLZ | Y165: 0 | Z165: 0 | AA165: =1.64*RC[-1] -> 0 | AB165: =IF(EQUAL(VLOOKUP(RC[-4], R9C3:R186C4, 2, 0), 1), RC[-1], NA()) -> #ERR: ArgCount | AC165: =IF(ISERROR(RC[-1])=1, "", RC[-5]) ->  | AD165: 'Burundi | AE165: 'BDI | AF165: 0 | AG165: 0 | AH165: =1.64*RC[-1] -> 0 | AI165: =IF(EQUAL(VLOOKUP(RC[-4], R9C3:R186C4, 2, 0), 1), RC[-1], NA()) -> #ERR: ArgCount | AJ165: =IF(ISERROR(RC[-1])=1, "", RC[-5]) ->  | AK165: 'United States | AL165: 'USA | AM165: 1.13507456869419 | AN165: 0.228760003290238 | AO165: =1.64*RC[-1] -> 0.37516640539599 | AP165: =IF(EQUAL(VLOOKUP(RC[-4], R9C3:R186C4, 2, 0), 1), RC[-1], NA()) -> #ERR: ArgCount | AQ165: =IF(ISERROR(RC[-1])=1, "", RC[-5]) ->  | AR165: 'Sweden | AS165: 'SWE | AT165: 1.62303248246947 | AU165: 0.218139839508948 | AV165: =1.64*RC[-1] -> 0.357749336794675 | AW165: =IF(EQUAL(VLOOKUP(RC[-4], R9C3:R186C4, 2, 0), 1), RC[-1], NA()) -> #ERR: ArgCount | AX165: =IF(ISERROR(RC[-1])=1, "", RC[-5]) ->  | AY165: 'Belize | AZ165: 'BLZ | BA165: 0 | BB165: 0 | BC165: =1.64*RC[-1] -> 0 | BD165: =IF(EQUAL(VLOOKUP(RC[-4], R9C3:R186C4, 2, 0), 1), RC[-1], NA()) -> #ERR: ArgCount | BE165: =IF(ISERROR(RC[-1])=1, "", RC[-5]) -> 
B166: 'Tajikistan | C166: 'TJK | D166: =IF(EQUAL(ComparativeCharts!R[+11]C, ""), "", 1) ->  | E166: =IF(EQUAL(ComparativeCharts!R[+11]C, ""), "", 1) -> #EMPTY! | O166: 159 | P166: 'New Zealand | Q166: 'NZL | R166: 1.45700761057952 | S166: 0.254026944310672 | T166: =1.64*RC[-1] -> 0.416604188669502 | U166: =IF(EQUAL(VLOOKUP(RC[-4], R9C3:R186C4, 2, 0), 1), RC[-1], NA()) -> #ERR: ArgCount | V166: =IF(ISERROR(RC[-1])=1, "", RC[-5]) ->  | W166: 'Barbados | X166: 'BRB | Y166: 0 | Z166: 0 | AA166: =1.64*RC[-1] -> 0 | AB166: =IF(EQUAL(VLOOKUP(RC[-4], R9C3:R186C4, 2, 0), 1), RC[-1], NA()) -> #ERR: ArgCount | AC166: =IF(ISERROR(RC[-1])=1, "", RC[-5]) ->  | AD166: 'Belize | AE166: 'BLZ | AF166: 0 | AG166: 0 | AH166: =1.64*RC[-1] -> 0 | AI166: =IF(EQUAL(VLOOKUP(RC[-4], R9C3:R186C4, 2, 0), 1), RC[-1], NA()) -> #ERR: ArgCount | AJ166: =IF(ISERROR(RC[-1])=1, "", RC[-5]) ->  | AK166: 'Finland | AL166: 'FIN | AM166: 1.1404307299791 | AN166: 0.2290464009857 | AO166: =1.64*RC[-1] -> 0.375636097616548 | AP166: =IF(EQUAL(VLOOKUP(RC[-4], R9C3:R186C4, 2, 0), 1), RC[-1], NA()) -> #ERR: ArgCount | AQ166: =IF(ISERROR(RC[-1])=1, "", RC[-5]) ->  | AR166: 'United Kingdom | AS166: 'GBR | AT166: 1.68862849528257 | AU166: 0.207737275615815 | AV166: =1.64*RC[-1] -> 0.340689132009937 | AW166: =IF(EQUAL(VLOOKUP(RC[-4], R9C3:R186C4, 2, 0), 1), RC[-1], NA()) -> #ERR: ArgCount | AX166: =IF(ISERROR(RC[-1])=1, "", RC[-5]) ->  | AY166: 'Barbados | AZ166: 'BRB | BA166: 0 | BB166: 0 | BC166: =1.64*RC[-1] -> 0 | BD166: =IF(EQUAL(VLOOKUP(RC[-4], R9C3:R186C4, 2, 0), 1), RC[-1], NA()) -> #ERR: ArgCount | BE166: =IF(ISERROR(RC[-1])=1, "", RC[-5]) -> 
B167: 'Turkmenistan | C167: 'TKM | D167: =IF(EQUAL(ComparativeCharts!R[+11]C, ""), "", 1) ->  | E167: =IF(EQUAL(ComparativeCharts!R[+11]C, ""), "", 1) -> #EMPTY! | O167: 160 | P167: 'Luxembourg | Q167: 'LUX | R167: 1.46054569892184 | S167: 0.291377601755329 | T167: =1.64*RC[-1] -> 0.47785926687874 | U167: =IF(EQUAL(VLOOKUP(RC[-4], R9C3:R186C4, 2, 0), 1), RC[-1], NA()) -> #ERR: ArgCount | V167: =IF(ISERROR(RC[-1])=1, "", RC[-5]) ->  | W167: 'Bhutan | X167: 'BTN | Y167: 0 | Z167: 0 | AA167: =1.64*RC[-1] -> 0 | AB167: =IF(EQUAL(VLOOKUP(RC[-4], R9C3:R186C4, 2, 0), 1), RC[-1], NA()) -> #ERR: ArgCount | AC167: =IF(ISERROR(RC[-1])=1, "", RC[-5]) ->  | AD167: 'Barbados | AE167: 'BRB | AF167: 0 | AG167: 0 | AH167: =1.64*RC[-1] -> 0 | AI167: =IF(EQUAL(VLOOKUP(RC[-4], R9C3:R186C4, 2, 0), 1), RC[-1], NA()) -> #ERR: ArgCount | AJ167: =IF(ISERROR(RC[-1])=1, "", RC[-5]) ->  | AK167: 'Netherlands | AL167: 'NLD | AM167: 1.14098275720374 | AN167: 0.2290464009857 | AO167: =1.64*RC[-1] -> 0.375636097616548 | AP167: =IF(EQUAL(VLOOKUP(RC[-4], R9C3:R186C4, 2, 0), 1), RC[-1], NA()) -> #ERR: ArgCount | AQ167: =IF(ISERROR(RC[-1])=1, "", RC[-5]) ->  | AR167: 'Denmark | AS167: 'DNK | AT167: 1.69120852809496 | AU167: 0.218139839508948 | AV167: =1.64*RC[-1] -> 0.357749336794675 | AW167: =IF(EQUAL(VLOOKUP(RC[-4], R9C3:R186C4, 2, 0), 1), RC[-1], NA()) -> #ERR: ArgCount | AX167: =IF(ISERROR(RC[-1])=1, "", RC[-5]) ->  | AY167: 'Bhutan | AZ167: 'BTN | BA167: 0 | BB167: 0 | BC167: =1.64*RC[-1] -> 0 | BD167: =IF(EQUAL(VLOOKUP(RC[-4], R9C3:R186C4, 2, 0), 1), RC[-1], NA()) -> #ERR: ArgCount | BE167: =IF(ISERROR(RC[-1])=1, "", RC[-5]) -> 
B168: 'Trinidad and Tobago& Tob* | C168: 'TTO | D168: =IF(EQUAL(ComparativeCharts!R[+11]C, ""), "", 1) ->  | E168: =IF(EQUAL(ComparativeCharts!R[+11]C, ""), "", 1) -> #EMPTY! | O168: 161 | P168: 'Portugal | Q168: 'PRT | R168: 1.47928754869514 | S168: 0.251300233223489 | T168: =1.64*RC[-1] -> 0.412132382486522 | U168: =IF(EQUAL(VLOOKUP(RC[-4], R9C3:R186C4, 2, 0), 1), RC[-1], NA()) -> #ERR: ArgCount | V168: =IF(ISERROR(RC[-1])=1, "", RC[-5]) ->  | W168: 'Central African Republic | X168: 'CAF | Y168: 0 | Z168: 0 | AA168: =1.64*RC[-1] -> 0 | AB168: =IF(EQUAL(VLOOKUP(RC[-4], R9C3:R186C4, 2, 0), 1), RC[-1], NA()) -> #ERR: ArgCount | AC168: =IF(ISERROR(RC[-1])=1, "", RC[-5]) ->  | AD168: 'Bhutan | AE168: 'BTN | AF168: 0 | AG168: 0 | AH168: =1.64*RC[-1] -> 0 | AI168: =IF(EQUAL(VLOOKUP(RC[-4], R9C3:R186C4, 2, 0), 1), RC[-1], NA()) -> #ERR: ArgCount | AJ168: =IF(ISERROR(RC[-1])=1, "", RC[-5]) ->  | AK168: 'Ireland | AL168: 'IRL | AM168: 1.15749859809546 | AN168: 0.228760003290238 | AO168: =1.64*RC[-1] -> 0.37516640539599 | AP168: =IF(EQUAL(VLOOKUP(RC[-4], R9C3:R186C4, 2, 0), 1), RC[-1], NA()) -> #ERR: ArgCount | AQ168: =IF(ISERROR(RC[-1])=1, "", RC[-5]) ->  | AR168: 'Finland | AS168: 'FIN | AT168: 1.73635655217209 | AU168: 0.218139839508948 | AV168: =1.64*RC[-1] -> 0.357749336794675 | AW168: =IF(EQUAL(VLOOKUP(RC[-4], R9C3:R186C4, 2, 0), 1), RC[-1], NA()) -> #ERR: ArgCount | AX168: =IF(ISERROR(RC[-1])=1, "", RC[-5]) ->  | AY168: 'Central African Republic | AZ168: 'CAF | BA168: 0 | BB168: 0 | BC168: =1.64*RC[-1] -> 0 | BD168: =IF(EQUAL(VLOOKUP(RC[-4], R9C3:R186C4, 2, 0), 1), RC[-1], NA()) -> #ERR: ArgCount | BE168: =IF(ISERROR(RC[-1])=1, "", RC[-5]) -> 
B169: 'Tunisia | C169: 'TUN | D169: =IF(EQUAL(ComparativeCharts!R[+11]C, ""), "", 1) -> 1 | E169: =IF(EQUAL(ComparativeCharts!R[+11]C, ""), "", 1) -> #EMPTY! | O169: 162 | P169: 'United Kingdom | Q169: 'GBR | R169: 1.48903639902045 | S169: 0.251300233223489 | T169: =1.64*RC[-1] -> 0.412132382486522 | U169: =IF(EQUAL(VLOOKUP(RC[-4], R9C3:R186C4, 2, 0), 1), RC[-1], NA()) -> #ERR: ArgCount | V169: =IF(ISERROR(RC[-1])=1, "", RC[-5]) ->  | W169: 'Comoros | X169: 'COM | Y169: 0 | Z169: 0 | AA169: =1.64*RC[-1] -> 0 | AB169: =IF(EQUAL(VLOOKUP(RC[-4], R9C3:R186C4, 2, 0), 1), RC[-1], NA()) -> #ERR: ArgCount | AC169: =IF(ISERROR(RC[-1])=1, "", RC[-5]) ->  | AD169: 'Comoros | AE169: 'COM | AF169: 0 | AG169: 0 | AH169: =1.64*RC[-1] -> 0 | AI169: =IF(EQUAL(VLOOKUP(RC[-4], R9C3:R186C4, 2, 0), 1), RC[-1], NA()) -> #ERR: ArgCount | AJ169: =IF(ISERROR(RC[-1])=1, "", RC[-5]) ->  | AK169: 'New Zealand | AL169: 'NZL | AM169: 1.2049273660644 | AN169: 0.2290464009857 | AO169: =1.64*RC[-1] -> 0.375636097616548 | AP169: =IF(EQUAL(VLOOKUP(RC[-4], R9C3:R186C4, 2, 0), 1), RC[-1], NA()) -> #ERR: ArgCount | AQ169: =IF(ISERROR(RC[-1])=1, "", RC[-5]) ->  | AR169: 'Austria | AS169: 'AUT | AT169: 1.81234227516795 | AU169: 0.207737275615815 | AV169: =1.64*RC[-1] -> 0.340689132009937 | AW169: =IF(EQUAL(VLOOKUP(RC[-4], R9C3:R186C4, 2, 0), 1), RC[-1], NA()) -> #ERR: ArgCount | AX169: =IF(ISERROR(RC[-1])=1, "", RC[-5]) ->  | AY169: 'Comoros | AZ169: 'COM | BA169: 0 | BB169: 0 | BC169: =1.64*RC[-1] -> 0 | BD169: =IF(EQUAL(VLOOKUP(RC[-4], R9C3:R186C4, 2, 0), 1), RC[-1], NA()) -> #ERR: ArgCount | BE169: =IF(ISERROR(RC[-1])=1, "", RC[-5]) -> 
B170: 'Turkey | C170: 'TUR | D170: =IF(EQUAL(ComparativeCharts!R[+11]C, ""), "", 1) ->  | E170: =IF(EQUAL(ComparativeCharts!R[+11]C, ""), "", 1) -> #EMPTY! | O170: 163 | P170: 'Barbados | Q170: 'BRB | R170: 1.49020487912833 | S170: 0.360314615495306 | T170: =1.64*RC[-1] -> 0.590915969412302 | U170: =IF(EQUAL(VLOOKUP(RC[-4], R9C3:R186C4, 2, 0), 1), RC[-1], NA()) -> #ERR: ArgCount | V170: =IF(ISERROR(RC[-1])=1, "", RC[-5]) ->  | W170: 'Cape verde | X170: 'CPV | Y170: 0 | Z170: 0 | AA170: =1.64*RC[-1] -> 0 | AB170: =IF(EQUAL(VLOOKUP(RC[-4], R9C3:R186C4, 2, 0), 1), RC[-1], NA()) -> #ERR: ArgCount | AC170: =IF(ISERROR(RC[-1])=1, "", RC[-5]) ->  | AD170: 'Cape verde | AE170: 'CPV | AF170: 0 | AG170: 0 | AH170: =1.64*RC[-1] -> 0 | AI170: =IF(EQUAL(VLOOKUP(RC[-4], R9C3:R186C4, 2, 0), 1), RC[-1], NA()) -> #ERR: ArgCount | AJ170: =IF(ISERROR(RC[-1])=1, "", RC[-5]) ->  | AK170: 'United Kingdom | AL170: 'GBR | AM170: 1.2064248676641 | AN170: 0.228760003290238 | AO170: =1.64*RC[-1] -> 0.37516640539599 | AP170: =IF(EQUAL(VLOOKUP(RC[-4], R9C3:R186C4, 2, 0), 1), RC[-1], NA()) -> #ERR: ArgCount | AQ170: =IF(ISERROR(RC[-1])=1, "", RC[-5]) ->  | AR170: 'New Zealand | AS170: 'NZL | AT170: 1.82400229050793 | AU170: 0.230041930929945 | AV170: =1.64*RC[-1] -> 0.37726876672511 | AW170: =IF(EQUAL(VLOOKUP(RC[-4], R9C3:R186C4, 2, 0), 1), RC[-1], NA()) -> #ERR: ArgCount | AX170: =IF(ISERROR(RC[-1])=1, "", RC[-5]) ->  | AY170: 'Cape verde | AZ170: 'CPV | BA170: 0 | BB170: 0 | BC170: =1.64*RC[-1] -> 0 | BD170: =IF(EQUAL(VLOOKUP(RC[-4], R9C3:R186C4, 2, 0), 1), RC[-1], NA()) -> #ERR: ArgCount | BE170: =IF(ISERROR(RC[-1])=1, "", RC[-5]) -> 
B171: 'Taiwan, China | C171: 'TWN | D171: =IF(EQUAL(ComparativeCharts!R[+11]C, ""), "", 1) ->  | E171: =IF(EQUAL(ComparativeCharts!R[+11]C, ""), "", 1) -> #EMPTY! | O171: 164 | P171: 'Germany | Q171: 'DEU | R171: 1.49036531453221 | S171: 0.251300233223489 | T171: =1.64*RC[-1] -> 0.412132382486522 | U171: =IF(EQUAL(VLOOKUP(RC[-4], R9C3:R186C4, 2, 0), 1), RC[-1], NA()) -> #ERR: ArgCount | V171: =IF(ISERROR(RC[-1])=1, "", RC[-5]) ->  | W171: 'Djibouti | X171: 'DJI | Y171: 0 | Z171: 0 | AA171: =1.64*RC[-1] -> 0 | AB171: =IF(EQUAL(VLOOKUP(RC[-4], R9C3:R186C4, 2, 0), 1), RC[-1], NA()) -> #ERR: ArgCount | AC171: =IF(ISERROR(RC[-1])=1, "", RC[-5]) ->  | AD171: 'Djibouti | AE171: 'DJI | AF171: 0 | AG171: 0 | AH171: =1.64*RC[-1] -> 0 | AI171: =IF(EQUAL(VLOOKUP(RC[-4], R9C3:R186C4, 2, 0), 1), RC[-1], NA()) -> #ERR: ArgCount | AJ171: =IF(ISERROR(RC[-1])=1, "", RC[-5]) ->  | AK171: 'Hong Kong, China | AL171: 'HKG | AM171: 1.20717082774271 | AN171: 0.228760003290238 | AO171: =1.64*RC[-1] -> 0.37516640539599 | AP171: =IF(EQUAL(VLOOKUP(RC[-4], R9C3:R186C4, 2, 0), 1), RC[-1], NA()) -> #ERR: ArgCount | AQ171: =IF(ISERROR(RC[-1])=1, "", RC[-5]) ->  | AR171: 'Norway | AS171: 'NOR | AT171: 1.8333934496441 | AU171: 0.218139839508948 | AV171: =1.64*RC[-1] -> 0.357749336794675 | AW171: =IF(EQUAL(VLOOKUP(RC[-4], R9C3:R186C4, 2, 0), 1), RC[-1], NA()) -> #ERR: ArgCount | AX171: =IF(ISERROR(RC[-1])=1, "", RC[-5]) ->  | AY171: 'Djibouti | AZ171: 'DJI | BA171: 0 | BB171: 0 | BC171: =1.64*RC[-1] -> 0 | BD171: =IF(EQUAL(VLOOKUP(RC[-4], R9C3:R186C4, 2, 0), 1), RC[-1], NA()) -> #ERR: ArgCount | BE171: =IF(ISERROR(RC[-1])=1, "", RC[-5]) -> 
B172: 'Tanzania | C172: 'TZA | D172: =IF(EQUAL(ComparativeCharts!R[+11]C, ""), "", 1) ->  | E172: =IF(EQUAL(ComparativeCharts!R[+11]C, ""), "", 1) -> #EMPTY! | O172: 165 | P172: 'Ireland | Q172: 'IRL | R172: 1.50103341274461 | S172: 0.251300233223489 | T172: =1.64*RC[-1] -> 0.412132382486522 | U172: =IF(EQUAL(VLOOKUP(RC[-4], R9C3:R186C4, 2, 0), 1), RC[-1], NA()) -> #ERR: ArgCount | V172: =IF(ISERROR(RC[-1])=1, "", RC[-5]) ->  | W172: 'Eritrea | X172: 'ERI | Y172: 0 | Z172: 0 | AA172: =1.64*RC[-1] -> 0 | AB172: =IF(EQUAL(VLOOKUP(RC[-4], R9C3:R186C4, 2, 0), 1), RC[-1], NA()) -> #ERR: ArgCount | AC172: =IF(ISERROR(RC[-1])=1, "", RC[-5]) ->  | AD172: 'Eritrea | AE172: 'ERI | AF172: 0 | AG172: 0 | AH172: =1.64*RC[-1] -> 0 | AI172: =IF(EQUAL(VLOOKUP(RC[-4], R9C3:R186C4, 2, 0), 1), RC[-1], NA()) -> #ERR: ArgCount | AJ172: =IF(ISERROR(RC[-1])=1, "", RC[-5]) ->  | AK172: 'El Salvador | AL172: 'SLV | AM172: 1.23271314972064 | AN172: 0.519940958319459 | AO172: =1.64*RC[-1] -> 0.852703171643913 | AP172: =IF(EQUAL(VLOOKUP(RC[-4], R9C3:R186C4, 2, 0), 1), RC[-1], NA()) -> #ERR: ArgCount | AQ172: =IF(ISERROR(RC[-1])=1, "", RC[-5]) ->  | AR172: 'Singapore | AS172: 'SGP | AT172: 1.93903449251869 | AU172: 0.207737275615815 | AV172: =1.64*RC[-1] -> 0.340689132009937 | AW172: =IF(EQUAL(VLOOKUP(RC[-4], R9C3:R186C4, 2, 0), 1), RC[-1], NA()) -> #ERR: ArgCount | AX172: =IF(ISERROR(RC[-1])=1, "", RC[-5]) ->  | AY172: 'Eritrea | AZ172: 'ERI | BA172: 0 | BB172: 0 | BC172: =1.64*RC[-1] -> 0 | BD172: =IF(EQUAL(VLOOKUP(RC[-4], R9C3:R186C4, 2, 0), 1), RC[-1], NA()) -> #ERR: ArgCount | BE172: =IF(ISERROR(RC[-1])=1, "", RC[-5]) -> 
B173: 'Uganda | C173: 'UGA | D173: =IF(EQUAL(ComparativeCharts!R[+11]C, ""), "", 1) ->  | E173: =IF(EQUAL(ComparativeCharts!R[+11]C, ""), "", 1) -> #EMPTY! | O173: 166 | P173: 'United States | Q173: 'USA | R173: 1.50469827100937 | S173: 0.251300233223489 | T173: =1.64*RC[-1] -> 0.412132382486522 | U173: =IF(EQUAL(VLOOKUP(RC[-4], R9C3:R186C4, 2, 0), 1), RC[-1], NA()) -> #ERR: ArgCount | V173: =IF(ISERROR(RC[-1])=1, "", RC[-5]) ->  | W173: 'Guadeloupe | X173: 'GLP | Y173: 0 | Z173: 0 | AA173: =1.64*RC[-1] -> 0 | AB173: =IF(EQUAL(VLOOKUP(RC[-4], R9C3:R186C4, 2, 0), 1), RC[-1], NA()) -> #ERR: ArgCount | AC173: =IF(ISERROR(RC[-1])=1, "", RC[-5]) ->  | AD173: 'Guadeloupe | AE173: 'GLP | AF173: 0 | AG173: 0 | AH173: =1.64*RC[-1] -> 0 | AI173: =IF(EQUAL(VLOOKUP(RC[-4], R9C3:R186C4, 2, 0), 1), RC[-1], NA()) -> #ERR: ArgCount | AJ173: =IF(ISERROR(RC[-1])=1, "", RC[-5]) ->  | AK173: 'Singapore | AL173: 'SGP | AM173: 1.24477757685123 | AN173: 0.228760003290238 | AO173: =1.64*RC[-1] -> 0.37516640539599 | AP173: =IF(EQUAL(VLOOKUP(RC[-4], R9C3:R186C4, 2, 0), 1), RC[-1], NA()) -> #ERR: ArgCount | AQ173: =IF(ISERROR(RC[-1])=1, "", RC[-5]) ->  | AR173: 'Switzerland | AS173: 'CHE | AT173: 1.99583196731206 | AU173: 0.207737275615815 | AV173: =1.64*RC[-1] -> 0.340689132009937 | AW173: =IF(EQUAL(VLOOKUP(RC[-4], R9C3:R186C4, 2, 0), 1), RC[-1], NA()) -> #ERR: ArgCount | AX173: =IF(ISERROR(RC[-1])=1, "", RC[-5]) ->  | AY173: 'Guadeloupe | AZ173: 'GLP | BA173: 0 | BB173: 0 | BC173: =1.64*RC[-1] -> 0 | BD173: =IF(EQUAL(VLOOKUP(RC[-4], R9C3:R186C4, 2, 0), 1), RC[-1], NA()) -> #ERR: ArgCount | BE173: =IF(ISERROR(RC[-1])=1, "", RC[-5]) -> 
B174: 'Ukraine | C174: 'UKR | D174: =IF(EQUAL(ComparativeCharts!R[+11]C, ""), "", 1) ->  | E174: =IF(EQUAL(ComparativeCharts!R[+11]C, ""), "", 1) -> #EMPTY! | O174: 167 | P174: 'Finland | Q174: 'FIN | R174: 1.60231364128456 | S174: 0.254026944310672 | T174: =1.64*RC[-1] -> 0.416604188669502 | U174: =IF(EQUAL(VLOOKUP(RC[-4], R9C3:R186C4, 2, 0), 1), RC[-1], NA()) -> #ERR: ArgCount | V174: =IF(ISERROR(RC[-1])=1, "", RC[-5]) ->  | W174: 'Equatorial Guinea | X174: 'GNQ | Y174: 0 | Z174: 0 | AA174: =1.64*RC[-1] -> 0 | AB174: =IF(EQUAL(VLOOKUP(RC[-4], R9C3:R186C4, 2, 0), 1), RC[-1], NA()) -> #ERR: ArgCount | AC174: =IF(ISERROR(RC[-1])=1, "", RC[-5]) ->  | AD174: 'Equatorial Guinea | AE174: 'GNQ | AF174: 0 | AG174: 0 | AH174: =1.64*RC[-1] -> 0 | AI174: =IF(EQUAL(VLOOKUP(RC[-4], R9C3:R186C4, 2, 0), 1), RC[-1], NA()) -> #ERR: ArgCount | AJ174: =IF(ISERROR(RC[-1])=1, "", RC[-5]) ->  | AK174: 'Afghanistan | AL174: 'AFG | AM174: 0 | AN174: 0 | AO174: =1.64*RC[-1] -> 0 | AP174: =IF(EQUAL(VLOOKUP(RC[-4], R9C3:R186C4, 2, 0), 1), RC[-1], NA()) -> #ERR: ArgCount | AQ174: =IF(ISERROR(RC[-1])=1, "", RC[-5]) ->  | AR174: 'Afghanistan | AS174: 'AFG | AT174: 0 | AU174: 0 | AV174: =1.64*RC[-1] -> 0 | AW174: =IF(EQUAL(VLOOKUP(RC[-4], R9C3:R186C4, 2, 0), 1), RC[-1], NA()) -> #ERR: ArgCount | AX174: =IF(ISERROR(RC[-1])=1, "", RC[-5]) ->  | AY174: 'Equatorial Guinea | AZ174: 'GNQ | BA174: 0 | BB174: 0 | BC174: =1.64*RC[-1] -> 0 | BD174: =IF(EQUAL(VLOOKUP(RC[-4], R9C3:R186C4, 2, 0), 1), RC[-1], NA()) -> #ERR: ArgCount | BE174: =IF(ISERROR(RC[-1])=1, "", RC[-5]) -> 
B175: 'Uruguay | C175: 'URY | D175: =IF(EQUAL(ComparativeCharts!R[+11]C, ""), "", 1) ->  | E175: =IF(EQUAL(ComparativeCharts!R[+11]C, ""), "", 1) -> #EMPTY! | O175: 168 | P175: 'Netherlands | Q175: 'NLD | R175: 1.60746069544825 | S175: 0.254026944310672 | T175: =1.64*RC[-1] -> 0.416604188669502 | U175: =IF(EQUAL(VLOOKUP(RC[-4], R9C3:R186C4, 2, 0), 1), RC[-1], NA()) -> #ERR: ArgCount | V175: =IF(ISERROR(RC[-1])=1, "", RC[-5]) ->  | W175: 'Cambodia | X175: 'KHM | Y175: 0 | Z175: 0 | AA175: =1.64*RC[-1] -> 0 | AB175: =IF(EQUAL(VLOOKUP(RC[-4], R9C3:R186C4, 2, 0), 1), RC[-1], NA()) -> #ERR: ArgCount | AC175: =IF(ISERROR(RC[-1])=1, "", RC[-5]) ->  | AD175: 'Cambodia | AE175: 'KHM | AF175: 0 | AG175: 0 | AH175: =1.64*RC[-1] -> 0 | AI175: =IF(EQUAL(VLOOKUP(RC[-4], R9C3:R186C4, 2, 0), 1), RC[-1], NA()) -> #ERR: ArgCount | AJ175: =IF(ISERROR(RC[-1])=1, "", RC[-5]) ->  | AK175: 'Bhutan | AL175: 'BTN | AM175: 0 | AN175: 0 | AO175: =1.64*RC[-1] -> 0 | AP175: =IF(EQUAL(VLOOKUP(RC[-4], R9C3:R186C4, 2, 0), 1), RC[-1], NA()) -> #ERR: ArgCount | AQ175: =IF(ISERROR(RC[-1])=1, "", RC[-5]) ->  | AR175: 'Bhutan | AS175: 'BTN | AT175: 0 | AU175: 0 | AV175: =1.64*RC[-1] -> 0 | AW175: =IF(EQUAL(VLOOKUP(RC[-4], R9C3:R186C4, 2, 0), 1), RC[-1], NA()) -> #ERR: ArgCount | AX175: =IF(ISERROR(RC[-1])=1, "", RC[-5]) ->  | AY175: 'Cambodia | AZ175: 'KHM | BA175: 0 | BB175: 0 | BC175: =1.64*RC[-1] -> 0 | BD175: =IF(EQUAL(VLOOKUP(RC[-4], R9C3:R186C4, 2, 0), 1), RC[-1], NA()) -> #ERR: ArgCount | BE175: =IF(ISERROR(RC[-1])=1, "", RC[-5]) -> 
B176: 'United States | C176: 'USA | D176: =IF(EQUAL(ComparativeCharts!R[+11]C, ""), "", 1) ->  | E176: =IF(EQUAL(ComparativeCharts!R[+11]C, ""), "", 1) -> #EMPTY! | O176: 169 | P176: 'Australia | Q176: 'AUS | R176: 1.62804891519125 | S176: 0.254026944310672 | T176: =1.64*RC[-1] -> 0.416604188669502 | U176: =IF(EQUAL(VLOOKUP(RC[-4], R9C3:R186C4, 2, 0), 1), RC[-1], NA()) -> #ERR: ArgCount | V176: =IF(ISERROR(RC[-1])=1, "", RC[-5]) ->  | W176: 'Lao, PDR | X176: 'LAO | Y176: 0 | Z176: 0 | AA176: =1.64*RC[-1] -> 0 | AB176: =IF(EQUAL(VLOOKUP(RC[-4], R9C3:R186C4, 2, 0), 1), RC[-1], NA()) -> #ERR: ArgCount | AC176: =IF(ISERROR(RC[-1])=1, "", RC[-5]) ->  | AD176: 'Lao, PDR | AE176: 'LAO | AF176: 0 | AG176: 0 | AH176: =1.64*RC[-1] -> 0 | AI176: =IF(EQUAL(VLOOKUP(RC[-4], R9C3:R186C4, 2, 0), 1), RC[-1], NA()) -> #ERR: ArgCount | AJ176: =IF(ISERROR(RC[-1])=1, "", RC[-5]) ->  | AK176: 'Central African Republic | AL176: 'CAF | AM176: 0 | AN176: 0 | AO176: =1.64*RC[-1] -> 0 | AP176: =IF(EQUAL(VLOOKUP(RC[-4], R9C3:R186C4, 2, 0), 1), RC[-1], NA()) -> #ERR: ArgCount | AQ176: =IF(ISERROR(RC[-1])=1, "", RC[-5]) ->  | AR176: 'Central African Republic | AS176: 'CAF | AT176: 0 | AU176: 0 | AV176: =1.64*RC[-1] -> 0 | AW176: =IF(EQUAL(VLOOKUP(RC[-4], R9C3:R186C4, 2, 0), 1), RC[-1], NA()) -> #ERR: ArgCount | AX176: =IF(ISERROR(RC[-1])=1, "", RC[-5]) ->  | AY176: 'Lao, PDR | AZ176: 'LAO | BA176: 0 | BB176: 0 | BC176: =1.64*RC[-1] -> 0 | BD176: =IF(EQUAL(VLOOKUP(RC[-4], R9C3:R186C4, 2, 0), 1), RC[-1], NA()) -> #ERR: ArgCount | BE176: =IF(ISERROR(RC[-1])=1, "", RC[-5]) -> 
B177: 'Uzbekistan | C177: 'UZB | D177: =IF(EQUAL(ComparativeCharts!R[+11]C, ""), "", 1) ->  | E177: =IF(EQUAL(ComparativeCharts!R[+11]C, ""), "", 1) -> #EMPTY! | O177: 170 | P177: 'Sweden | Q177: 'SWE | R177: 1.62804891519125 | S177: 0.254026944310672 | T177: =1.64*RC[-1] -> 0.416604188669502 | U177: =IF(EQUAL(VLOOKUP(RC[-4], R9C3:R186C4, 2, 0), 1), RC[-1], NA()) -> #ERR: ArgCount | V177: =IF(ISERROR(RC[-1])=1, "", RC[-5]) ->  | W177: 'Macao, China | X177: 'MAC | Y177: 0 | Z177: 0 | AA177: =1.64*RC[-1] -> 0 | AB177: =IF(EQUAL(VLOOKUP(RC[-4], R9C3:R186C4, 2, 0), 1), RC[-1], NA()) -> #ERR: ArgCount | AC177: =IF(ISERROR(RC[-1])=1, "", RC[-5]) ->  | AD177: 'Macao, China | AE177: 'MAC | AF177: 0 | AG177: 0 | AH177: =1.64*RC[-1] -> 0 | AI177: =IF(EQUAL(VLOOKUP(RC[-4], R9C3:R186C4, 2, 0), 1), RC[-1], NA()) -> #ERR: ArgCount | AJ177: =IF(ISERROR(RC[-1])=1, "", RC[-5]) ->  | AK177: 'Comoros | AL177: 'COM | AM177: 0 | AN177: 0 | AO177: =1.64*RC[-1] -> 0 | AP177: =IF(EQUAL(VLOOKUP(RC[-4], R9C3:R186C4, 2, 0), 1), RC[-1], NA()) -> #ERR: ArgCount | AQ177: =IF(ISERROR(RC[-1])=1, "", RC[-5]) ->  | AR177: 'Comoros | AS177: 'COM | AT177: 0 | AU177: 0 | AV177: =1.64*RC[-1] -> 0 | AW177: =IF(EQUAL(VLOOKUP(RC[-4], R9C3:R186C4, 2, 0), 1), RC[-1], NA()) -> #ERR: ArgCount | AX177: =IF(ISERROR(RC[-1])=1, "", RC[-5]) ->  | AY177: 'Macao, China | AZ177: 'MAC | BA177: 0 | BB177: 0 | BC177: =1.64*RC[-1] -> 0 | BD177: =IF(EQUAL(VLOOKUP(RC[-4], R9C3:R186C4, 2, 0), 1), RC[-1], NA()) -> #ERR: ArgCount | BE177: =IF(ISERROR(RC[-1])=1, "", RC[-5]) -> 
B178: 'Venezuela, RB | C178: 'VEN | D178: =IF(EQUAL(ComparativeCharts!R[+11]C, ""), "", 1) ->  | E178: =IF(EQUAL(ComparativeCharts!R[+11]C, ""), "", 1) -> #EMPTY! | O178: 171 | P178: 'Denmark | Q178: 'DNK | R178: 1.63319596935494 | S178: 0.254026944310672 | T178: =1.64*RC[-1] -> 0.416604188669502 | U178: =IF(EQUAL(VLOOKUP(RC[-4], R9C3:R186C4, 2, 0), 1), RC[-1], NA()) -> #ERR: ArgCount | V178: =IF(ISERROR(RC[-1])=1, "", RC[-5]) ->  | W178: 'Maldives | X178: 'MDV | Y178: 0 | Z178: 0 | AA178: =1.64*RC[-1] -> 0 | AB178: =IF(EQUAL(VLOOKUP(RC[-4], R9C3:R186C4, 2, 0), 1), RC[-1], NA()) -> #ERR: ArgCount | AC178: =IF(ISERROR(RC[-1])=1, "", RC[-5]) ->  | AD178: 'Maldives | AE178: 'MDV | AF178: 0 | AG178: 0 | AH178: =1.64*RC[-1] -> 0 | AI178: =IF(EQUAL(VLOOKUP(RC[-4], R9C3:R186C4, 2, 0), 1), RC[-1], NA()) -> #ERR: ArgCount | AJ178: =IF(ISERROR(RC[-1])=1, "", RC[-5]) ->  | AK178: 'Eritrea | AL178: 'ERI | AM178: 0 | AN178: 0 | AO178: =1.64*RC[-1] -> 0 | AP178: =IF(EQUAL(VLOOKUP(RC[-4], R9C3:R186C4, 2, 0), 1), RC[-1], NA()) -> #ERR: ArgCount | AQ178: =IF(ISERROR(RC[-1])=1, "", RC[-5]) ->  | AR178: 'Eritrea | AS178: 'ERI | AT178: 0 | AU178: 0 | AV178: =1.64*RC[-1] -> 0 | AW178: =IF(EQUAL(VLOOKUP(RC[-4], R9C3:R186C4, 2, 0), 1), RC[-1], NA()) -> #ERR: ArgCount | AX178: =IF(ISERROR(RC[-1])=1, "", RC[-5]) ->  | AY178: 'Maldives | AZ178: 'MDV | BA178: 0 | BB178: 0 | BC178: =1.64*RC[-1] -> 0 | BD178: =IF(EQUAL(VLOOKUP(RC[-4], R9C3:R186C4, 2, 0), 1), RC[-1], NA()) -> #ERR: ArgCount | BE178: =IF(ISERROR(RC[-1])=1, "", RC[-5]) -> 
B179: 'Vietnam | C179: 'VNM | D179: =IF(EQUAL(ComparativeCharts!R[+11]C, ""), "", 1) ->  | E179: =IF(EQUAL(ComparativeCharts!R[+11]C, ""), "", 1) -> #EMPTY! | O179: 172 | P179: 'Norway | Q179: 'NOR | R179: 1.65378418755382 | S179: 0.254026944310672 | T179: =1.64*RC[-1] -> 0.416604188669502 | U179: =IF(EQUAL(VLOOKUP(RC[-4], R9C3:R186C4, 2, 0), 1), RC[-1], NA()) -> #ERR: ArgCount | V179: =IF(ISERROR(RC[-1])=1, "", RC[-5]) ->  | W179: 'Mauritania | X179: 'MRT | Y179: 0 | Z179: 0 | AA179: =1.64*RC[-1] -> 0 | AB179: =IF(EQUAL(VLOOKUP(RC[-4], R9C3:R186C4, 2, 0), 1), RC[-1], NA()) -> #ERR: ArgCount | AC179: =IF(ISERROR(RC[-1])=1, "", RC[-5]) ->  | AD179: 'Mauritania | AE179: 'MRT | AF179: 0 | AG179: 0 | AH179: =1.64*RC[-1] -> 0 | AI179: =IF(EQUAL(VLOOKUP(RC[-4], R9C3:R186C4, 2, 0), 1), RC[-1], NA()) -> #ERR: ArgCount | AJ179: =IF(ISERROR(RC[-1])=1, "", RC[-5]) ->  | AK179: 'Guadeloupe | AL179: 'GLP | AM179: 0 | AN179: 0 | AO179: =1.64*RC[-1] -> 0 | AP179: =IF(EQUAL(VLOOKUP(RC[-4], R9C3:R186C4, 2, 0), 1), RC[-1], NA()) -> #ERR: ArgCount | AQ179: =IF(ISERROR(RC[-1])=1, "", RC[-5]) ->  | AR179: 'Guadeloupe | AS179: 'GLP | AT179: 0 | AU179: 0 | AV179: =1.64*RC[-1] -> 0 | AW179: =IF(EQUAL(VLOOKUP(RC[-4], R9C3:R186C4, 2, 0), 1), RC[-1], NA()) -> #ERR: ArgCount | AX179: =IF(ISERROR(RC[-1])=1, "", RC[-5]) ->  | AY179: 'Mauritania | AZ179: 'MRT | BA179: 0 | BB179: 0 | BC179: =1.64*RC[-1] -> 0 | BD179: =IF(EQUAL(VLOOKUP(RC[-4], R9C3:R186C4, 2, 0), 1), RC[-1], NA()) -> #ERR: ArgCount | BE179: =IF(ISERROR(RC[-1])=1, "", RC[-5]) -> 
B180: 'West Bank and Gaza | C180: 'WTB | D180: =IF(EQUAL(ComparativeCharts!R[+11]C, ""), "", 1) ->  | E180: =IF(EQUAL(ComparativeCharts!R[+11]C, ""), "", 1) -> #EMPTY! | O180: 173 | P180: 'Switzerland | Q180: 'CHE | R180: 1.69363589301386 | S180: 0.251300233223489 | T180: =1.64*RC[-1] -> 0.412132382486522 | U180: =IF(EQUAL(VLOOKUP(RC[-4], R9C3:R186C4, 2, 0), 1), RC[-1], NA()) -> #ERR: ArgCount | V180: =IF(ISERROR(RC[-1])=1, "", RC[-5]) ->  | W180: 'Martinique | X180: 'MTQ | Y180: 0 | Z180: 0 | AA180: =1.64*RC[-1] -> 0 | AB180: =IF(EQUAL(VLOOKUP(RC[-4], R9C3:R186C4, 2, 0), 1), RC[-1], NA()) -> #ERR: ArgCount | AC180: =IF(ISERROR(RC[-1])=1, "", RC[-5]) ->  | AD180: 'Martinique | AE180: 'MTQ | AF180: 0 | AG180: 0 | AH180: =1.64*RC[-1] -> 0 | AI180: =IF(EQUAL(VLOOKUP(RC[-4], R9C3:R186C4, 2, 0), 1), RC[-1], NA()) -> #ERR: ArgCount | AJ180: =IF(ISERROR(RC[-1])=1, "", RC[-5]) ->  | AK180: 'Macao, China | AL180: 'MAC | AM180: 0 | AN180: 0 | AO180: =1.64*RC[-1] -> 0 | AP180: =IF(EQUAL(VLOOKUP(RC[-4], R9C3:R186C4, 2, 0), 1), RC[-1], NA()) -> #ERR: ArgCount | AQ180: =IF(ISERROR(RC[-1])=1, "", RC[-5]) ->  | AR180: 'Macao, China | AS180: 'MAC | AT180: 0 | AU180: 0 | AV180: =1.64*RC[-1] -> 0 | AW180: =IF(EQUAL(VLOOKUP(RC[-4], R9C3:R186C4, 2, 0), 1), RC[-1], NA()) -> #ERR: ArgCount | AX180: =IF(ISERROR(RC[-1])=1, "", RC[-5]) ->  | AY180: 'Martinique | AZ180: 'MTQ | BA180: 0 | BB180: 0 | BC180: =1.64*RC[-1] -> 0 | BD180: =IF(EQUAL(VLOOKUP(RC[-4], R9C3:R186C4, 2, 0), 1), RC[-1], NA()) -> #ERR: ArgCount | BE180: =IF(ISERROR(RC[-1])=1, "", RC[-5]) -> 
B181: 'Yemen, Rep. | C181: 'YEM | D181: =IF(EQUAL(ComparativeCharts!R[+11]C, ""), "", 1) ->  | E181: =IF(EQUAL(ComparativeCharts!R[+11]C, ""), "", 1) -> #EMPTY! | O181: 174 | P181: 'Guadeloupe | Q181: 'GLP | R181: 0 | S181: 0 | T181: =1.64*RC[-1] -> 0 | U181: =IF(EQUAL(VLOOKUP(RC[-4], R9C3:R186C4, 2, 0), 1), RC[-1], NA()) -> #ERR: ArgCount | V181: =IF(ISERROR(RC[-1])=1, "", RC[-5]) ->  | W181: 'Nepal | X181: 'NPL | Y181: 0 | Z181: 0 | AA181: =1.64*RC[-1] -> 0 | AB181: =IF(EQUAL(VLOOKUP(RC[-4], R9C3:R186C4, 2, 0), 1), RC[-1], NA()) -> #ERR: ArgCount | AC181: =IF(ISERROR(RC[-1])=1, "", RC[-5]) ->  | AD181: 'Nepal | AE181: 'NPL | AF181: 0 | AG181: 0 | AH181: =1.64*RC[-1] -> 0 | AI181: =IF(EQUAL(VLOOKUP(RC[-4], R9C3:R186C4, 2, 0), 1), RC[-1], NA()) -> #ERR: ArgCount | AJ181: =IF(ISERROR(RC[-1])=1, "", RC[-5]) ->  | AK181: 'Maldives | AL181: 'MDV | AM181: 0 | AN181: 0 | AO181: =1.64*RC[-1] -> 0 | AP181: =IF(EQUAL(VLOOKUP(RC[-4], R9C3:R186C4, 2, 0), 1), RC[-1], NA()) -> #ERR: ArgCount | AQ181: =IF(ISERROR(RC[-1])=1, "", RC[-5]) ->  | AR181: 'Maldives | AS181: 'MDV | AT181: 0 | AU181: 0 | AV181: =1.64*RC[-1] -> 0 | AW181: =IF(EQUAL(VLOOKUP(RC[-4], R9C3:R186C4, 2, 0), 1), RC[-1], NA()) -> #ERR: ArgCount | AX181: =IF(ISERROR(RC[-1])=1, "", RC[-5]) ->  | AY181: 'Nepal | AZ181: 'NPL | BA181: 0 | BB181: 0 | BC181: =1.64*RC[-1] -> 0 | BD181: =IF(EQUAL(VLOOKUP(RC[-4], R9C3:R186C4, 2, 0), 1), RC[-1], NA()) -> #ERR: ArgCount | BE181: =IF(ISERROR(RC[-1])=1, "", RC[-5]) -> 
B182: 'Yugoslavia, FR (Serbia/Montenegro) | C182: 'YUG | D182: =IF(EQUAL(ComparativeCharts!R[+11]C, ""), "", 1) ->  | E182: =IF(EQUAL(ComparativeCharts!R[+11]C, ""), "", 1) -> #EMPTY! | O182: 175 | P182: 'Macao, China | Q182: 'MAC | R182: 0 | S182: 0 | T182: =1.64*RC[-1] -> 0 | U182: =IF(EQUAL(VLOOKUP(RC[-4], R9C3:R186C4, 2, 0), 1), RC[-1], NA()) -> #ERR: ArgCount | V182: =IF(ISERROR(RC[-1])=1, "", RC[-5]) ->  | W182: 'Reunion | X182: 'REU | Y182: 0 | Z182: 0 | AA182: =1.64*RC[-1] -> 0 | AB182: =IF(EQUAL(VLOOKUP(RC[-4], R9C3:R186C4, 2, 0), 1), RC[-1], NA()) -> #ERR: ArgCount | AC182: =IF(ISERROR(RC[-1])=1, "", RC[-5]) ->  | AD182: 'Reunion | AE182: 'REU | AF182: 0 | AG182: 0 | AH182: =1.64*RC[-1] -> 0 | AI182: =IF(EQUAL(VLOOKUP(RC[-4], R9C3:R186C4, 2, 0), 1), RC[-1], NA()) -> #ERR: ArgCount | AJ182: =IF(ISERROR(RC[-1])=1, "", RC[-5]) ->  | AK182: 'Martinique | AL182: 'MTQ | AM182: 0 | AN182: 0 | AO182: =1.64*RC[-1] -> 0 | AP182: =IF(EQUAL(VLOOKUP(RC[-4], R9C3:R186C4, 2, 0), 1), RC[-1], NA()) -> #ERR: ArgCount | AQ182: =IF(ISERROR(RC[-1])=1, "", RC[-5]) ->  | AR182: 'Martinique | AS182: 'MTQ | AT182: 0 | AU182: 0 | AV182: =1.64*RC[-1] -> 0 | AW182: =IF(EQUAL(VLOOKUP(RC[-4], R9C3:R186C4, 2, 0), 1), RC[-1], NA()) -> #ERR: ArgCount | AX182: =IF(ISERROR(RC[-1])=1, "", RC[-5]) ->  | AY182: 'Reunion | AZ182: 'REU | BA182: 0 | BB182: 0 | BC182: =1.64*RC[-1] -> 0 | BD182: =IF(EQUAL(VLOOKUP(RC[-4], R9C3:R186C4, 2, 0), 1), RC[-1], NA()) -> #ERR: ArgCount | BE182: =IF(ISERROR(RC[-1])=1, "", RC[-5]) -> 
B183: 'South Africa | C183: 'ZAF | D183: =IF(EQUAL(ComparativeCharts!R[+11]C, ""), "", 1) ->  | E183: =IF(EQUAL(ComparativeCharts!R[+11]C, ""), "", 1) -> #EMPTY! | O183: 176 | P183: 'Martinique | Q183: 'MTQ | R183: 0 | S183: 0 | T183: =1.64*RC[-1] -> 0 | U183: =IF(EQUAL(VLOOKUP(RC[-4], R9C3:R186C4, 2, 0), 1), RC[-1], NA()) -> #ERR: ArgCount | V183: =IF(ISERROR(RC[-1])=1, "", RC[-5]) ->  | W183: 'Rwanda | X183: 'RWA | Y183: 0 | Z183: 0 | AA183: =1.64*RC[-1] -> 0 | AB183: =IF(EQUAL(VLOOKUP(RC[-4], R9C3:R186C4, 2, 0), 1), RC[-1], NA()) -> #ERR: ArgCount | AC183: =IF(ISERROR(RC[-1])=1, "", RC[-5]) ->  | AD183: 'Rwanda | AE183: 'RWA | AF183: 0 | AG183: 0 | AH183: =1.64*RC[-1] -> 0 | AI183: =IF(EQUAL(VLOOKUP(RC[-4], R9C3:R186C4, 2, 0), 1), RC[-1], NA()) -> #ERR: ArgCount | AJ183: =IF(ISERROR(RC[-1])=1, "", RC[-5]) ->  | AK183: 'Reunion | AL183: 'REU | AM183: 0 | AN183: 0 | AO183: =1.64*RC[-1] -> 0 | AP183: =IF(EQUAL(VLOOKUP(RC[-4], R9C3:R186C4, 2, 0), 1), RC[-1], NA()) -> #ERR: ArgCount | AQ183: =IF(ISERROR(RC[-1])=1, "", RC[-5]) ->  | AR183: 'Reunion | AS183: 'REU | AT183: 0 | AU183: 0 | AV183: =1.64*RC[-1] -> 0 | AW183: =IF(EQUAL(VLOOKUP(RC[-4], R9C3:R186C4, 2, 0), 1), RC[-1], NA()) -> #ERR: ArgCount | AX183: =IF(ISERROR(RC[-1])=1, "", RC[-5]) ->  | AY183: 'Rwanda | AZ183: 'RWA | BA183: 0 | BB183: 0 | BC183: =1.64*RC[-1] -> 0 | BD183: =IF(EQUAL(VLOOKUP(RC[-4], R9C3:R186C4, 2, 0), 1), RC[-1], NA()) -> #ERR: ArgCount | BE183: =IF(ISERROR(RC[-1])=1, "", RC[-5]) -> 
B184: 'Congo, Dem. Rep. | C184: 'ZAR | D184: =IF(EQUAL(ComparativeCharts!R[+11]C, ""), "", 1) ->  | E184: =IF(EQUAL(ComparativeCharts!R[+11]C, ""), "", 1) -> #EMPTY! | O184: 177 | P184: 'Puerto Rico | Q184: 'PRI | R184: 0 | S184: 0 | T184: =1.64*RC[-1] -> 0 | U184: =IF(EQUAL(VLOOKUP(RC[-4], R9C3:R186C4, 2, 0), 1), RC[-1], NA()) -> #ERR: ArgCount | V184: =IF(ISERROR(RC[-1])=1, "", RC[-5]) ->  | W184: 'Solomon Islands | X184: 'SLB | Y184: 0 | Z184: 0 | AA184: =1.64*RC[-1] -> 0 | AB184: =IF(EQUAL(VLOOKUP(RC[-4], R9C3:R186C4, 2, 0), 1), RC[-1], NA()) -> #ERR: ArgCount | AC184: =IF(ISERROR(RC[-1])=1, "", RC[-5]) ->  | AD184: 'Solomon Islands | AE184: 'SLB | AF184: 0 | AG184: 0 | AH184: =1.64*RC[-1] -> 0 | AI184: =IF(EQUAL(VLOOKUP(RC[-4], R9C3:R186C4, 2, 0), 1), RC[-1], NA()) -> #ERR: ArgCount | AJ184: =IF(ISERROR(RC[-1])=1, "", RC[-5]) ->  | AK184: 'Solomon Islands | AL184: 'SLB | AM184: 0 | AN184: 0 | AO184: =1.64*RC[-1] -> 0 | AP184: =IF(EQUAL(VLOOKUP(RC[-4], R9C3:R186C4, 2, 0), 1), RC[-1], NA()) -> #ERR: ArgCount | AQ184: =IF(ISERROR(RC[-1])=1, "", RC[-5]) ->  | AR184: 'Solomon Islands | AS184: 'SLB | AT184: 0 | AU184: 0 | AV184: =1.64*RC[-1] -> 0 | AW184: =IF(EQUAL(VLOOKUP(RC[-4], R9C3:R186C4, 2, 0), 1), RC[-1], NA()) -> #ERR: ArgCount | AX184: =IF(ISERROR(RC[-1])=1, "", RC[-5]) ->  | AY184: 'Solomon Islands | AZ184: 'SLB | BA184: 0 | BB184: 0 | BC184: =1.64*RC[-1] -> 0 | BD184: =IF(EQUAL(VLOOKUP(RC[-4], R9C3:R186C4, 2, 0), 1), RC[-1], NA()) -> #ERR: ArgCount | BE184: =IF(ISERROR(RC[-1])=1, "", RC[-5]) -> 
B185: 'Zambia | C185: 'ZMB | D185: =IF(EQUAL(ComparativeCharts!R[+11]C, ""), "", 1) ->  | E185: =IF(EQUAL(ComparativeCharts!R[+11]C, ""), "", 1) -> #EMPTY! | O185: 178 | P185: 'Reunion | Q185: 'REU | R185: 0 | S185: 0 | T185: =1.64*RC[-1] -> 0 | U185: =IF(EQUAL(VLOOKUP(RC[-4], R9C3:R186C4, 2, 0), 1), RC[-1], NA()) -> #ERR: ArgCount | V185: =IF(ISERROR(RC[-1])=1, "", RC[-5]) ->  | W185: 'Sao Tome and Principe and Pr | X185: 'STP | Y185: 0 | Z185: 0 | AA185: =1.64*RC[-1] -> 0 | AB185: =IF(EQUAL(VLOOKUP(RC[-4], R9C3:R186C4, 2, 0), 1), RC[-1], NA()) -> #ERR: ArgCount | AC185: =IF(ISERROR(RC[-1])=1, "", RC[-5]) ->  | AD185: 'Sao Tome and Principe and Pr | AE185: 'STP | AF185: 0 | AG185: 0 | AH185: =1.64*RC[-1] -> 0 | AI185: =IF(EQUAL(VLOOKUP(RC[-4], R9C3:R186C4, 2, 0), 1), RC[-1], NA()) -> #ERR: ArgCount | AJ185: =IF(ISERROR(RC[-1])=1, "", RC[-5]) ->  | AK185: 'Sao Tome and Principe and Pr | AL185: 'STP | AM185: 0 | AN185: 0 | AO185: =1.64*RC[-1] -> 0 | AP185: =IF(EQUAL(VLOOKUP(RC[-4], R9C3:R186C4, 2, 0), 1), RC[-1], NA()) -> #ERR: ArgCount | AQ185: =IF(ISERROR(RC[-1])=1, "", RC[-5]) ->  | AR185: 'Sao Tome and Principe and Pr | AS185: 'STP | AT185: 0 | AU185: 0 | AV185: =1.64*RC[-1] -> 0 | AW185: =IF(EQUAL(VLOOKUP(RC[-4], R9C3:R186C4, 2, 0), 1), RC[-1], NA()) -> #ERR: ArgCount | AX185: =IF(ISERROR(RC[-1])=1, "", RC[-5]) ->  | AY185: 'Sao Tome and Principe and Pr | AZ185: 'STP | BA185: 0 | BB185: 0 | BC185: =1.64*RC[-1] -> 0 | BD185: =IF(EQUAL(VLOOKUP(RC[-4], R9C3:R186C4, 2, 0), 1), RC[-1], NA()) -> #ERR: ArgCount | BE185: =IF(ISERROR(RC[-1])=1, "", RC[-5]) -> 
B186: 'Zimbabwe | C186: 'ZWE | D186: =IF(EQUAL(ComparativeCharts!R[+11]C, ""), "", 1) ->  | E186: =IF(EQUAL(ComparativeCharts!R[+11]C, ""), "", 1) -> #EMPTY!

Sheet: @SDF
A1: =DEFINE("SUMIF2_HELPER", RC[+1], RC[+2], RC[+3], RC[+4]) -> FUN SUMIF2_HELPER AT #1 | B1: =IF(APPLY(RC[+1], RC[+2]), RC[+3], 0) -> #EMPTY!
A2: =DEFINE("SUMIF2", RC[+1], RC[+2], RC[+3]) -> FUN SUMIF2 AT #2 | B2: =SUM(ROWMAP(CLOSURE("SUMIF2_HELPER", RC[+1], NA(), NA()), RC[+2])) -> #EMPTY!

Sheet: @Lookup
A1: 'Excel-style lookup functions implemented as sheet-defined functions
A3: =DEFINE("matchrowaux", R[+6]C[+1], R[+1]C[+1], R[+2]C[+1], R[+3]C[+1], R[+4]C[+1]) -> FUN MATCHROWAUX AT #4 | B3: 'MATCHROWAUX(x, arr, a, b)
A4: 'x =
A5: 'arr =
A6: 'a =
A7: 'b =
A8: 'm = | B8: =CEILING((R[-2]C+R[-1]C)/2, 1) -> #EMPTY!
A9: 'result = | B9: =IF(R[-3]C>R[-2]C, NA(), IF(EQUAL(INDEX(R[-4]C, R[-3]C, 1), R[-5]C), R[-3]C, MATCHROWAUX(R[-5]C, R[-4]C, R[-3]C+1, R[-2]C))) -> #EMPTY!
A11: =DEFINE("vlookup", R[+4]C[+1], R[+1]C[+1], R[+2]C[+1], R[+3]C[+1]) -> FUN VLOOKUP AT #7 | B11: 'VLOOKUP(x, arr, r)
A12: 'x =
A13: 'arr =
A14: 'c =
A15: 'result = | B15: =INDEX(R[-2]C, MATCHROWAUX(R[-3]C, R[-2]C, 1, ROWS(R[-2]C)), R[-1]C) -> #EMPTY!