Sheet: 2001
A1: 'Name | B1: 'Type | C1: 'Code | D1: 'Population '000s | E1: 'Libraries - Total Administrative Units | F1: 'Libraries - Service Points | G1: 'Collections - Books & Bound Periodicals | H1: 'Collections - Current Periodicals - Titles | I1: 'Collections - Current Periodicals - Subscriptions | J1: 'Collections - Manuscripts | K1: 'Collections - Microforms | L1: 'Collections - Audio-visual Materials | M1: 'Collections - CD-ROMs | N1: 'Additions - Books & Bound Periodicals | O1: 'Additions - Audio-visual Materials | P1: 'Facilities & Services - Percentage Stock on Open Access | Q1: 'Facilities & Services - Percentage Catalogue Records Automated | R1: 'Facilities & Services - Number of Workstations for users | S1: 'Facilities & Services - Number connected to the internet | T1: 'Use & Users - Registered Users | U1: 'Use & Users - Consultations | V1: 'Use & Users - Number of Visits | W1: 'Use & Users - Potential Total Population Served | X1: 'Library Staff FTE - Trained Librarians | Y1: 'Library Staff FTE - Other Library Staff | Z1: 'Library Staff FTE - Total Staff | AA1: 'Recurrent Expenditure (Euros) - Staff | AB1: 'Recurrent Expenditure (Euros) - Acquisition of Stock | AC1: 'Recurrent Expenditure (Euros) - Electronic Information | AD1: 'Recurrent Expenditure (Euros) - Automation | AE1: 'Recurrent Expenditure (Euros) - Premises and Related Costs | AF1: 'Recurrent Expenditure (Euros) - New Buildings / Refurbishment | AG1: 'Recurrent Expenditure (Euros) - Other Expenditure | AH1: 'Recurrent Expenditure (Euros) - TOTAL EXPENDITURE | AI1: 'Income - Public Funding | AJ1: 'Income - Fees & Charges | AK1: 'Income - Other Income | AL1: 'Income - TOTAL INCOME | AM1: 'Capital Expenditure - New Buildings / Refurbishment | AN1: 'Capital Expenditure - Acquisition of Stock | AO1: 'Capital Expenditure - Automation | AP1: 'Capital Expenditure - Other Capital Expenditure | AQ1: 'Capital Expenditure - TOTAL CAPITAL PAYMENTS | AR1: 'Additions | AS1: 'Loans per visit | AT1: 'Cost per pop | AU1: 'Users per 1000 pop | AV1: 'visits per 1000 pop | AW1: 'Bookstock per 1000 pop | AX1: 'Total stock per 1000 pop | AY1: 'AV materials per 1000 pop
A2: 'Bulgaria | B2: 'CEE | C2: 'C1 | D2: =RC[+19]/1000 -> 289 | E2: 84 | F2: 84 | G2: 8501798 | H2: 8198 | K2: 23792 | L2: 84101 | N2: 101846 | O2: 3634 | T2: 200848 | U2: 5002065 | V2: 2813081 | W2: 289000 | X2: 496 | Y2: 312 | Z2: 808 | AA2: 951033 | AB2: 1319389 | AC2: 0 | AD2: 0 | AE2: 0 | AF2: 0 | AG2: 89817 | AH2: 2360239 | AI2: 1386130 | AJ2: 141230 | AK2: 832879 | AL2: 2360239 | AR2: =RC[-30]+RC[-29] -> 105480 | AS2: =RC[-24]/RC[-23] -> 1.77814467482451 | AT2: =RC[-12]/RC[-23] -> 8.1669169550173 | AU2: =RC[-27]/RC[-43] -> 694.975778546713 | AV2: =RC[-26]/RC[-44] -> 9733.84429065744 | AW2: =RC[-42]/RC[-45] -> 29417.9861591696 | AX2: =SUM(RC[-43]:RC[-37])/RC[-46] -> #EMPTY! | AY2: =RC[-39]/RC[-47] -> 291.006920415225
A3: 'Czech Republic | B3: 'CEE | C3: 'C2 | D3: =RC[+19]/1000 -> 192 | E3: 80 | F3: 1081 | G3: 10704109 | H3: 21703 | J3: 43062 | K3: 13753 | L3: 38158 | N3: 266549 | O3: 2556 | T3: 276163 | U3: 2178474 | V3: 4255805 | W3: 192000 | X3: 395 | Y3: 372 | Z3: 767 | AB3: 4761705 | AR3: =RC[-30]+RC[-29] -> 269105 | AS3: =RC[-24]/RC[-23] -> 0.511882945764667 | AT3: =RC[-12]/RC[-23] -> #EMPTY! | AU3: =RC[-27]/RC[-43] -> 1438.34895833333 | AV3: =RC[-26]/RC[-44] -> 22165.6510416667 | AW3: =RC[-42]/RC[-45] -> 55750.5677083333 | AX3: =SUM(RC[-43]:RC[-37])/RC[-46] -> #EMPTY! | AY3: =RC[-39]/RC[-47] -> 198.739583333333
A4: 'Estonia | B4: 'CEE | C4: 'C3 | D4: =RC[+19]/1000 -> 48 | E4: 23 | F4: 37 | G4: 7399469 | H4: 11565 | I4: 20099 | J4: 72773 | K4: 28166 | L4: 38818 | M4: 3712 | N4: 110337 | O4: 2304 | P4: 5 | Q4: 20 | R4: 271 | S4: 261 | T4: 84571 | U4: 1905991 | V4: 1550796 | W4: 48000 | X4: 527 | Y4: 51 | Z4: 578 | AA4: 2398155 | AB4: 1379407 | AC4: 302797 | AD4: 114234 | AE4: 236763 | AF4: 0 | AG4: 375264 | AH4: 4806620 | AI4: 4806620 | AJ4: 0 | AK4: 0 | AL4: 4806620 | AM4: 0 | AN4: 0 | AO4: 15664 | AP4: 80035 | AQ4: 95699 | AR4: =RC[-30]+RC[-29] -> 112641 | AS4: =RC[-24]/RC[-23] -> 1.22904044116699 | AT4: =RC[-12]/RC[-23] -> 100.137916666667 | AU4: =RC[-27]/RC[-43] -> 1761.89583333333 | AV4: =RC[-26]/RC[-44] -> 32308.25 | AW4: =RC[-42]/RC[-45] -> 154155.604166667 | AX4: =SUM(RC[-43]:RC[-37])/RC[-46] -> 157804.208333333 | AY4: =RC[-39]/RC[-47] -> 808.708333333333
A5: 'Hungary | B5: 'CEE | C5: 'C4 | D5: =RC[+19]/1000 -> 214 | E5: 141 | F5: 401 | G5: 16366142 | H5: 26078 | J5: 796077 | K5: 5418049 | L5: 117905 | M5: 22354 | N5: 374994 | O5: 6380 | T5: 284873 | U5: 4014677 | V5: 3788043 | W5: 214000 | X5: 1016 | Y5: 385 | Z5: 1401 | AA5: 4490076 | AB5: 8336805 | AC5: 40116 | AD5: 217899 | AE5: 132781 | AF5: 593518 | AG5: 632260 | AH5: 14443455 | AI5: 13565728 | AJ5: 517464 | AK5: 360263 | AL5: 14443455 | AR5: =RC[-30]+RC[-29] -> 381374 | AS5: =RC[-24]/RC[-23] -> 1.05982878230263 | AT5: =RC[-12]/RC[-23] -> 67.4927803738318 | AU5: =RC[-27]/RC[-43] -> 1331.18224299065 | AV5: =RC[-26]/RC[-44] -> 17701.1355140187 | AW5: =RC[-42]/RC[-45] -> 76477.2990654206 | AX5: =SUM(RC[-43]:RC[-37])/RC[-46] -> #EMPTY! | AY5: =RC[-39]/RC[-47] -> 550.957943925234
A6: 'Latvia | B6: 'CEE | C6: 'C5 | D6: =RC[+19]/1000 -> 61 | E6: 31 | F6: 31 | G6: 5631479 | J6: 25362 | L6: 4085 | N6: 134553 | T6: 94467 | U6: 4209082 | V6: 1976819 | W6: 61000 | X6: 378 | Y6: 27 | Z6: 405 | AA6: 1106524 | AB6: 1023219 | AC6: 0 | AD6: 0 | AE6: 0 | AF6: 0 | AG6: 252124 | AH6: 2381867 | AI6: 1283798 | AJ6: 0 | AK6: 954612 | AL6: 2238410 | AM6: 506776 | AN6: 0 | AO6: 25899 | AP6: 6083 | AQ6: 538758 | AR6: =RC[-30]+RC[-29] -> #EMPTY! | AS6: =RC[-24]/RC[-23] -> 2.12921972117832 | AT6: =RC[-12]/RC[-23] -> 39.047 | AU6: =RC[-27]/RC[-43] -> 1548.6393442623 | AV6: =RC[-26]/RC[-44] -> 32406.868852459 | AW6: =RC[-42]/RC[-45] -> 92319.3278688525 | AX6: =SUM(RC[-43]:RC[-37])/RC[-46] -> #EMPTY! | AY6: =RC[-39]/RC[-47] -> 66.9672131147541
A7: 'Lithuania | B7: 'CEE | C7: 'C6 | D7: =RC[+19]/1000 -> 97 | E7: 15 | F7: 106 | G7: 10977183 | H7: 4000 | I7: 5000 | J7: 248300 | K7: 26764 | L7: 37250 | M7: 3625 | N7: 174036 | O7: 852 | P7: 4 | Q7: 3 | R7: 298 | S7: 298 | T7: 118445 | U7: 8134682 | V7: 4520707 | W7: 97000 | X7: 594 | Y7: 92 | Z7: 686 | AA7: 1856644 | AB7: 787172 | AC7: 0 | AD7: 94213 | AE7: 0 | AF7: 0 | AG7: 344466 | AH7: 3082495 | AI7: 2440386 | AJ7: 324443 | AK7: 293871 | AL7: 3058700 | AR7: =RC[-30]+RC[-29] -> 174888 | AS7: =RC[-24]/RC[-23] -> 1.79942694804153 | AT7: =RC[-12]/RC[-23] -> 31.7782989690722 | AU7: =RC[-27]/RC[-43] -> 1221.0824742268 | AV7: =RC[-26]/RC[-44] -> 46605.2268041237 | AW7: =RC[-42]/RC[-45] -> 113166.835051546 | AX7: =SUM(RC[-43]:RC[-37])/RC[-46] -> 116516.721649485 | AY7: =RC[-39]/RC[-47] -> 384.020618556701
A8: 'Poland | B8: 'CEE | C8: 'C7 | D8: =RC[+19]/1000 -> 796 | E8: 0 | F8: 0 | G8: 0 | H8: 0 | I8: 0 | J8: 0 | K8: 0 | L8: 0 | M8: 0 | N8: 0 | O8: 0 | P8: 0 | Q8: 0 | R8: 0 | S8: 0 | T8: 0 | U8: 0 | V8: 0 | W8: 796000 | X8: 0 | Y8: 0 | Z8: 0 | AA8: 0 | AB8: 0 | AC8: 0 | AD8: 0 | AE8: 0 | AF8: 0 | AG8: 0 | AH8: 0 | AI8: 0 | AJ8: 0 | AK8: 0 | AL8: 0 | AM8: 0 | AN8: 0 | AO8: 0 | AP8: 0 | AQ8: 0 | AR8: =RC[-30]+RC[-29] -> 0 | AS8: =RC[-24]/RC[-23] -> #NUM! | AT8: =RC[-12]/RC[-23] -> 0 | AU8: =RC[-27]/RC[-43] -> 0 | AV8: =RC[-26]/RC[-44] -> 0 | AW8: =RC[-42]/RC[-45] -> 0 | AX8: =SUM(RC[-43]:RC[-37])/RC[-46] -> 0 | AY8: =RC[-39]/RC[-47] -> 0
A9: 'Romania | B9: 'CEE | C9: 'C8 | D9: =RC[+19]/1000 -> 438 | E9: 0 | F9: 0 | G9: 0 | H9: 0 | I9: 0 | J9: 0 | K9: 0 | L9: 0 | M9: 0 | N9: 0 | O9: 0 | P9: 0 | Q9: 0 | R9: 0 | S9: 0 | T9: 0 | U9: 0 | V9: 0 | W9: 438000 | X9: 0 | Y9: 0 | Z9: 0 | AA9: 0 | AB9: 0 | AC9: 0 | AD9: 0 | AE9: 0 | AF9: 0 | AG9: 0 | AH9: 0 | AI9: 0 | AJ9: 0 | AK9: 0 | AL9: 0 | AM9: 0 | AN9: 0 | AO9: 0 | AP9: 0 | AQ9: 0 | AR9: =RC[-30]+RC[-29] -> 0 | AS9: =RC[-24]/RC[-23] -> #NUM! | AT9: =RC[-12]/RC[-23] -> 0 | AU9: =RC[-27]/RC[-43] -> 0 | AV9: =RC[-26]/RC[-44] -> 0 | AW9: =RC[-42]/RC[-45] -> 0 | AX9: =SUM(RC[-43]:RC[-37])/RC[-46] -> 0 | AY9: =RC[-39]/RC[-47] -> 0
A10: 'Slovak Rep | B10: 'CEE | C10: 'C9 | D10: =RC[+19]/1000 -> 112 | E10: 35 | F10: 568 | G10: 4670126 | H10: 7534 | I10: 9231 | J10: 0 | K10: 0 | L10: 0 | M10: 1130 | N10: 98198 | O10: 568 | P10: 0 | Q10: 0 | R10: 1094 | S10: 896 | T10: 142344 | U10: 2706702 | V10: 1045163 | W10: 112000 | X10: 254 | Y10: 244 | Z10: 498 | AA10: 1189740 | AB10: 960166 | AC10: 0 | AD10: 0 | AE10: 89466 | AF10: 0 | AG10: 385251 | AH10: 2624623 | AI10: 2496700 | AJ10: 34423 | AK10: 0 | AL10: 2531123 | AM10: 227232 | AN10: 0 | AO10: 140400 | AP10: 0 | AQ10: 367632 | AR10: =RC[-30]+RC[-29] -> 98766 | AS10: =RC[-24]/RC[-23] -> 2.58974150443519 | AT10: =RC[-12]/RC[-23] -> 23.4341339285714 | AU10: =RC[-27]/RC[-43] -> 1270.92857142857 | AV10: =RC[-26]/RC[-44] -> 9331.8125 | AW10: =RC[-42]/RC[-45] -> 41697.5535714286 | AX10: =SUM(RC[-43]:RC[-37])/RC[-46] -> 41857.3303571429 | AY10: =RC[-39]/RC[-47] -> 0
A11: 'Slovenia | B11: 'CEE | C11: 'C10 | D11: =RC[+19]/1000 -> 55 | E11: 54 | F11: 79 | G11: 4151409 | H11: 14489 | I11: 16234 | J11: 0 | K11: 0 | L11: 0 | M11: 0 | N11: 118375 | O11: 12372 | P11: 0 | Q11: 44 | R11: 314 | S11: 299 | T11: 135425 | U11: 3263696 | V11: 1512745 | W11: 55000 | X11: 263 | Y11: 93 | Z11: 356 | AA11: 1005555 | AB11: 4009447 | AC11: 14203 | AD11: 77143 | AE11: 47009 | AF11: 210125 | AG11: 3811444 | AH11: 9174926 | AI11: 5917186 | AJ11: 172832 | AK11: 3084908 | AL11: 9174926 | AM11: 0 | AN11: 0 | AO11: 0 | AP11: 0 | AQ11: 0 | AR11: =RC[-30]+RC[-29] -> 130747 | AS11: =RC[-24]/RC[-23] -> 2.15746606334842 | AT11: =RC[-12]/RC[-23] -> 166.816836363636 | AU11: =RC[-27]/RC[-43] -> 2462.27272727273 | AV11: =RC[-26]/RC[-44] -> 27504.4545454545 | AW11: =RC[-42]/RC[-45] -> 75480.1636363636 | AX11: =SUM(RC[-43]:RC[-37])/RC[-46] -> 76038.7636363636 | AY11: =RC[-39]/RC[-47] -> 0
A12: 'Austria | B12: 'EU | C12: 'C11 | D12: =RC[+19]/1000 -> 269 | E12: 0 | F12: 0 | G12: 0 | H12: 0 | I12: 0 | J12: 0 | K12: 0 | L12: 0 | M12: 0 | N12: 0 | O12: 0 | P12: 0 | Q12: 0 | R12: 0 | S12: 0 | T12: 0 | U12: 0 | V12: 0 | W12: 269000 | X12: 0 | Y12: 0 | Z12: 0 | AA12: 0 | AB12: 0 | AC12: 0 | AD12: 0 | AE12: 0 | AF12: 0 | AG12: 0 | AH12: 0 | AI12: 0 | AJ12: 0 | AK12: 0 | AL12: 0 | AM12: 0 | AN12: 0 | AO12: 0 | AP12: 0 | AQ12: 0 | AR12: =RC[-30]+RC[-29] -> 0 | AS12: =RC[-24]/RC[-23] -> #NUM! | AT12: =RC[-12]/RC[-23] -> 0 | AU12: =RC[-27]/RC[-43] -> 0 | AV12: =RC[-26]/RC[-44] -> 0 | AW12: =RC[-42]/RC[-45] -> 0 | AX12: =SUM(RC[-43]:RC[-37])/RC[-46] -> 0 | AY12: =RC[-39]/RC[-47] -> 0
A13: 'België Nederlandstalige Universiteiten | B13: 'België Nederlandstalige Universiteiten | C13: 'C12a | D13: 58.777 | E13: 41 | F13: 317 | G13: 9925746 | H13: 42654 | I13: 14074 | J13: 115 | K13: 1000 | L13: 9068 | M13: 2028 | N13: 179054 | O13: 210 | P13: 48 | Q13: 60 | R13: 354 | S13: 0 | T13: 106123 | U13: 666128 | V13: 1071148 | W13: 58777 | X13: 116 | Y13: 191 | Z13: 307 | AA13: 8375210 | AB13: 5472894 | AC13: 1948575 | AD13: 375538 | AE13: 112271 | AF13: 13758 | AG13: 361682 | AH13: 16659928 | AI13: 5971614 | AJ13: 98259 | AK13: 98414 | AL13: 6108793 | AM13: 0 | AN13: 0 | AO13: 88939 | AP13: 0 | AQ13: 88939 | AR13: 179264 | AS13: =RC[-24]/RC[-23] -> 0.621882316916056 | AT13: =RC[-12]/RC[-23] -> 283.442979396703 | AU13: =RC[-27]/RC[-43] -> 1805.51916566004 | AV13: =RC[-26]/RC[-44] -> 18223.9311295235 | AW13: =RC[-42]/RC[-45] -> 168871.259166 | AX13: =SUM(RC[-43]:RC[-37])/RC[-46] -> 170044.149922589 | AY13: =RC[-39]/RC[-47] -> 154.278033924835
A14: 'Belgique universités francophones | B14: 'Belgique universités francophones | C14: 'C12b | D14: 74.458 | E14: 0 | F14: 0 | G14: 9057965 | H14: 29979 | I14: 20837 | J14: 1135 | K14: 279897 | L14: 11873 | M14: 1193 | N14: 128821 | O14: 1511 | P14: 46 | Q14: 56 | R14: 423 | S14: 0 | T14: 63788 | U14: 460619 | V14: 3062634 | W14: 74458 | X14: 124 | Y14: 179 | Z14: 301 | AA14: 7062183 | AB14: 7195308 | AC14: 771134 | AD14: 279846 | AE14: 772490 | AF14: 0 | AG14: 346279 | AH14: 16427240 | AI14: 6715288 | AJ14: 394456 | AK14: 439313 | AL14: 7207068 | AM14: 0 | AN14: 68369 | AO14: 48691 | AP14: 0 | AQ14: 117060 | AR14: 130332 | AS14: =RC[-24]/RC[-23] -> 0.150399623330767 | AT14: =RC[-12]/RC[-23] -> 220.624244540546 | AU14: =RC[-27]/RC[-43] -> 856.697735636198 | AV14: =RC[-26]/RC[-44] -> 41132.3699266701 | AW14: =RC[-42]/RC[-45] -> 121652.00515727 | AX14: =SUM(RC[-43]:RC[-37])/RC[-46] -> 126284.334792769 | AY14: =RC[-39]/RC[-47] -> 159.459023879234
A15: 'Belgium | B15: 'EU | C15: 'C12 | D15: =RC[+19]/1000 -> 133.235 | E15: 72 | F15: 47 | G15: 18983711 | H15: 72633 | I15: 34911 | J15: 1250 | K15: 280897 | L15: 20941 | M15: 3221 | N15: 307875 | O15: 1721 | P15: 46 | Q15: 56 | R15: 777 | S15: 0 | T15: 169911 | U15: 1126747 | V15: 4133782 | W15: 133235 | X15: 240 | Y15: 369 | Z15: 609 | AA15: 15437393 | AB15: 12668202 | AC15: 2719709 | AD15: 655384 | AE15: 884761 | AF15: 13758 | AG15: 707961 | AH15: 33087168 | AI15: 26002762 | AJ15: 492716 | AK15: 537726 | AL15: 27033204 | AM15: 68369 | AN15: 137630 | AO15: 0 | AP15: 0 | AQ15: 205999 | AR15: =RC[-30]+RC[-29] -> 309596 | AS15: =RC[-24]/RC[-23] -> 0.272570493557715 | AT15: =RC[-12]/RC[-23] -> 248.336908469997 | AU15: =RC[-27]/RC[-43] -> 1275.27301384771 | AV15: =RC[-26]/RC[-44] -> 31026.2468570571 | AW15: =RC[-42]/RC[-45] -> 142482.913648816 | AX15: =SUM(RC[-43]:RC[-37])/RC[-46] -> 145589.101962697 | AY15: =RC[-39]/RC[-47] -> 157.173415393853
A16: 'Denmark | B16: 'EU | C16: 'C13 | D16: =RC[+19]/1000 -> 180 | E16: 19 | F16: 40 | G16: 10698685 | H16: 74100 | I16: 94344 | J16: 95140 | K16: 1220634 | L16: 883224 | M16: 36856 | N16: 255661 | O16: 28595 | P16: 20 | Q16: 0 | R16: 932 | S16: 0 | T16: 0 | U16: 5085626 | V16: 0 | W16: 180000 | X16: 427 | Y16: 472 | Z16: 899 | AA16: 38129876 | AB16: 19659084 | AC16: 0 | AD16: 0 | AE16: 0 | AF16: 550806 | AG16: 10882096 | AH16: 69221863 | AI16: 69221863 | AJ16: 0 | AK16: 0 | AL16: 69221863 | AM16: 2680041 | AN16: 0 | AO16: 0 | AP16: 0 | AQ16: 2680041 | AR16: =RC[-30]+RC[-29] -> 284256 | AS16: =RC[-24]/RC[-23] -> #NUM! | AT16: =RC[-12]/RC[-23] -> 384.565905555556 | AU16: =RC[-27]/RC[-43] -> 0 | AV16: =RC[-26]/RC[-44] -> 0 | AW16: =RC[-42]/RC[-45] -> 59437.1388888889 | AX16: =SUM(RC[-43]:RC[-37])/RC[-46] -> 72794.35 | AY16: =RC[-39]/RC[-47] -> 4906.8
A17: 'Eire | B17: 'EU | C17: 'C15 | D17: =RC[+19]/1000 -> 137 | E17: 0 | F17: 0 | G17: 0 | H17: 0 | I17: 0 | J17: 0 | K17: 0 | L17: 0 | M17: 0 | N17: 0 | O17: 0 | P17: 0 | Q17: 0 | R17: 0 | S17: 0 | T17: 0 | U17: 0 | V17: 0 | W17: 137000 | X17: 0 | Y17: 0 | Z17: 0 | AA17: 0 | AB17: 0 | AC17: 0 | AD17: 0 | AE17: 0 | AF17: 0 | AG17: 0 | AH17: 0 | AI17: 0 | AJ17: 0 | AK17: 0 | AL17: 0 | AM17: 0 | AN17: 0 | AO17: 0 | AP17: 0 | AQ17: 0 | AR17: =RC[-30]+RC[-29] -> 0 | AS17: =RC[-24]/RC[-23] -> #NUM! | AT17: =RC[-12]/RC[-23] -> 0 | AU17: =RC[-27]/RC[-43] -> 0 | AV17: =RC[-26]/RC[-44] -> 0 | AW17: =RC[-42]/RC[-45] -> 0 | AX17: =SUM(RC[-43]:RC[-37])/RC[-46] -> 0 | AY17: =RC[-39]/RC[-47] -> 0
A18: 'Finland | B18: 'EU | C18: 'C16 | D18: =RC[+19]/1000 -> 224 | E18: 48 | F18: 457 | G18: 15572434 | H18: 161100 | I18: 382625 | J18: 262463 | K18: 1251223 | L18: 325048 | M18: 0 | N18: 610881 | O18: 15112 | P18: 45 | Q18: 0 | R18: 0 | S18: 0 | T18: 0 | U18: 13617288 | V18: 16882610 | W18: 224000 | X18: 1310 | Y18: 138 | Z18: 1448 | AA18: 36907466 | AB18: 22543220 | AC18: 0 | AD18: 0 | AE18: 0 | AF18: 3528953 | AG18: 10987011 | AH18: 76666650 | AI18: 62922332 | AJ18: 4788563 | AK18: 5513940 | AL18: 73224835 | AM18: 0 | AN18: 0 | AO18: 0 | AP18: 0 | AQ18: 0 | AR18: =RC[-30]+RC[-29] -> 625993 | AS18: =RC[-24]/RC[-23] -> 0.80658665929024 | AT18: =RC[-12]/RC[-23] -> 342.261830357143 | AU18: =RC[-27]/RC[-43] -> 0 | AV18: =RC[-26]/RC[-44] -> 75368.7946428571 | AW18: =RC[-42]/RC[-45] -> 69519.7946428571 | AX18: =SUM(RC[-43]:RC[-37])/RC[-46] -> 80155.7723214286 | AY18: =RC[-39]/RC[-47] -> 1451.10714285714
A19: 'France | B19: 'EU | C19: 'C17 | D19: =RC[+19]/1000 -> 2278 | E19: 95 | F19: 396 | G19: 25684360 | H19: 152995 | I19: 0 | J19: 0 | K19: 1384057 | L19: 97296 | M19: 44108 | N19: 1008519 | O19: 0 | P19: 35 | Q19: 0 | R19: 0 | S19: 0 | T19: 0 | U19: 0 | V19: 0 | W19: 2278000 | X19: 1812 | Y19: 2552 | Z19: 4364 | AA19: 167287948 | AB19: 60509187 | AC19: 5924182 | AD19: 0 | AE19: 0 | AF19: 0 | AG19: 68159578 | AH19: 301880895 | AI19: 285222928 | AJ19: 8495252 | AK19: 8162715 | AL19: 301880895 | AM19: 0 | AN19: 0 | AO19: 0 | AP19: 0 | AQ19: 0 | AR19: =RC[-30]+RC[-29] -> 1008519 | AS19: =RC[-24]/RC[-23] -> #NUM! | AT19: =RC[-12]/RC[-23] -> 132.520147058824 | AU19: =RC[-27]/RC[-43] -> 0 | AV19: =RC[-26]/RC[-44] -> 0 | AW19: =RC[-42]/RC[-45] -> 11274.9604916594 | AX19: =SUM(RC[-43]:RC[-37])/RC[-46] -> 12011.7717295874 | AY19: =RC[-39]/RC[-47] -> 42.7111501316945
A20: 'Greece | B20: 'EU | C20: 'C18 | D20: =RC[+19]/1000 -> 347 | E20: 82 | F20: 180 | G20: 5683287 | H20: 0 | I20: 36200 | J20: 29790 | K20: 25338 | L20: 22796 | M20: 18726 | N20: 296750 | O20: 1439 | P20: 95 | Q20: 49 | R20: 0 | S20: 0 | T20: 402192 | U20: 1415696 | V20: 0 | W20: 347000 | X20: 728 | Y20: 395 | Z20: 1123 | AA20: 4055275 | AB20: 14572579 | AC20: 696828 | AD20: 126795 | AE20: 0 | AF20: 948625 | AG20: 3944656 | AH20: 24344758 | AI20: 13660012 | AJ20: 10500572 | AK20: 184174 | AL20: 24344758 | AM20: 0 | AN20: 0 | AO20: 0 | AP20: 0 | AQ20: 0 | AR20: =RC[-30]+RC[-29] -> 298189 | AS20: =RC[-24]/RC[-23] -> #NUM! | AT20: =RC[-12]/RC[-23] -> 70.1578040345821 | AU20: =RC[-27]/RC[-43] -> 1159.05475504323 | AV20: =RC[-26]/RC[-44] -> 0 | AW20: =RC[-42]/RC[-45] -> 16378.34870317 | AX20: =SUM(RC[-43]:RC[-37])/RC[-46] -> 16761.2017291066 | AY20: =RC[-39]/RC[-47] -> 65.6945244956772
A21: 'Iceland | B21: 'EFTA | C21: 'C19 | D21: =RC[+19]/1000 -> 8 | E21: 0 | F21: 0 | G21: 0 | H21: 0 | I21: 0 | J21: 0 | K21: 0 | L21: 0 | M21: 0 | N21: 0 | O21: 0 | P21: 0 | Q21: 0 | R21: 0 | S21: 0 | T21: 0 | U21: 0 | V21: 0 | W21: 8000 | X21: 0 | Y21: 0 | Z21: 0 | AA21: 0 | AB21: 0 | AC21: 0 | AD21: 0 | AE21: 0 | AF21: 0 | AG21: 0 | AH21: 0 | AI21: 0 | AJ21: 0 | AK21: 0 | AL21: 0 | AM21: 0 | AN21: 0 | AO21: 0 | AP21: 0 | AQ21: 0 | AR21: =RC[-30]+RC[-29] -> 0 | AS21: =RC[-24]/RC[-23] -> #NUM! | AT21: =RC[-12]/RC[-23] -> 0 | AU21: =RC[-27]/RC[-43] -> 0 | AV21: =RC[-26]/RC[-44] -> 0 | AW21: =RC[-42]/RC[-45] -> 0 | AX21: =SUM(RC[-43]:RC[-37])/RC[-46] -> 0 | AY21: =RC[-39]/RC[-47] -> 0
A22: 'Italy | B22: 'EU | C22: 'C20 | D22: =RC[+19]/1000 -> 1852 | E22: 0 | F22: 0 | G22: 0 | H22: 0 | I22: 0 | J22: 0 | K22: 0 | L22: 0 | M22: 0 | N22: 0 | O22: 0 | P22: 0 | Q22: 0 | R22: 0 | S22: 0 | T22: 0 | U22: 0 | V22: 0 | W22: 1852000 | X22: 0 | Y22: 0 | Z22: 0 | AA22: 0 | AB22: 0 | AC22: 0 | AD22: 0 | AE22: 0 | AF22: 0 | AG22: 0 | AH22: 0 | AI22: 0 | AJ22: 0 | AK22: 0 | AL22: 0 | AM22: 0 | AN22: 0 | AO22: 0 | AP22: 0 | AQ22: 0 | AR22: =RC[-30]+RC[-29] -> 0 | AS22: =RC[-24]/RC[-23] -> #NUM! | AT22: =RC[-12]/RC[-23] -> 0 | AU22: =RC[-27]/RC[-43] -> 0 | AV22: =RC[-26]/RC[-44] -> 0 | AW22: =RC[-42]/RC[-45] -> 0 | AX22: =SUM(RC[-43]:RC[-37])/RC[-46] -> 0 | AY22: =RC[-39]/RC[-47] -> 0
A23: 'Liechtenstein | B23: 'EFTA | C23: 'C21 | D23: =RC[+19]/1000 -> 1 | E23: 0 | F23: 0 | G23: 0 | H23: 0 | I23: 0 | J23: 0 | K23: 0 | L23: 0 | M23: 0 | N23: 0 | O23: 0 | P23: 0 | Q23: 0 | R23: 0 | S23: 0 | T23: 0 | U23: 0 | V23: 0 | W23: 1000 | X23: 0 | Y23: 0 | Z23: 0 | AA23: 0 | AB23: 0 | AC23: 0 | AD23: 0 | AE23: 0 | AF23: 0 | AG23: 0 | AH23: 0 | AI23: 0 | AJ23: 0 | AK23: 0 | AL23: 0 | AM23: 0 | AN23: 0 | AO23: 0 | AP23: 0 | AQ23: 0 | AR23: =RC[-30]+RC[-29] -> 0 | AS23: =RC[-24]/RC[-23] -> #NUM! | AT23: =RC[-12]/RC[-23] -> 0 | AU23: =RC[-27]/RC[-43] -> 0 | AV23: =RC[-26]/RC[-44] -> 0 | AW23: =RC[-42]/RC[-45] -> 0 | AX23: =SUM(RC[-43]:RC[-37])/RC[-46] -> 0 | AY23: =RC[-39]/RC[-47] -> 0
A24: 'Luxembourg | B24: 'EU | C24: 'C22 | D24: =RC[+19]/1000 -> 2.999 | E24: 6 | F24: 6 | G24: 469000 | H24: 1650 | I24: 770 | J24: 10 | K24: 5 | L24: 3200 | M24: 184 | N24: 3800 | O24: 120 | P24: 83 | Q24: 41 | R24: 38 | S24: 30 | T24: 13837 | U24: 0 | V24: 0 | W24: 2999 | X24: 5 | Y24: 5 | Z24: 9 | AA24: 303856 | AB24: 233335 | AC24: 17967 | AD24: 151 | AE24: 1425 | AF24: 8928 | AG24: 67651 | AH24: 633313 | AI24: 563959 | AJ24: 0 | AK24: 69354 | AL24: 633313 | AM24: 0 | AN24: 0 | AO24: 0 | AP24: 0 | AQ24: 0 | AR24: =RC[-30]+RC[-29] -> 3920 | AS24: =RC[-24]/RC[-23] -> #NUM! | AT24: =RC[-12]/RC[-23] -> 211.174724908303 | AU24: =RC[-27]/RC[-43] -> 4613.87129043014 | AV24: =RC[-26]/RC[-44] -> 0 | AW24: =RC[-42]/RC[-45] -> 156385.461820607 | AX24: =SUM(RC[-43]:RC[-37])/RC[-46] -> 158325.775258419 | AY24: =RC[-39]/RC[-47] -> 1067.02234078026
A25: 'Netherlands | B25: 'EU | C25: 'C23 | D25: =RC[+19]/1000 -> 540 | E25: 23 | F25: 138 | G25: 25084875 | H25: 152742 | I25: 161182 | J25: 0 | K25: 5797711 | L25: 0 | M25: 0 | N25: 0 | O25: 0 | P25: 0 | Q25: 0 | R25: 0 | S25: 0 | T25: 0 | U25: 4162863 | V25: 0 | W25: 540000 | X25: 868 | Y25: 1002 | Z25: 1870 | AA25: 0 | AB25: 0 | AC25: 0 | AD25: 0 | AE25: 0 | AF25: 0 | AG25: 0 | AH25: 0 | AI25: 0 | AJ25: 0 | AK25: 0 | AL25: 0 | AM25: 0 | AN25: 0 | AO25: 0 | AP25: 0 | AQ25: 0 | AR25: =RC[-30]+RC[-29] -> 0 | AS25: =RC[-24]/RC[-23] -> #NUM! | AT25: =RC[-12]/RC[-23] -> 0 | AU25: =RC[-27]/RC[-43] -> 0 | AV25: =RC[-26]/RC[-44] -> 0 | AW25: =RC[-42]/RC[-45] -> 46453.4722222222 | AX25: =SUM(RC[-43]:RC[-37])/RC[-46] -> 57771.3148148148 | AY25: =RC[-39]/RC[-47] -> 0
A26: 'Norway | B26: 'EFTA | C26: 'C24 | D26: =RC[+19]/1000 -> 194 | E26: 85 | F26: 186 | G26: 12847148 | H26: 86079 | I26: 0 | J26: 49356 | K26: 442477 | L26: 115851 | M26: 0 | N26: 291236 | O26: 5151 | P26: 21 | Q26: 0 | R26: 1140 | S26: 424 | T26: 0 | U26: 2688468 | V26: 5376936 | W26: 194000 | X26: 619 | Y26: 346 | Z26: 964 | AA26: 38591900 | AB26: 21176919 | AC26: 0 | AD26: 0 | AE26: 0 | AF26: 0 | AG26: 17201698 | AH26: 76970517 | AI26: 62407529 | AJ26: 8521543 | AK26: 0 | AL26: 70929072 | AM26: 0 | AN26: 0 | AO26: 0 | AP26: 0 | AQ26: 0 | AR26: =RC[-30]+RC[-29] -> 296387 | AS26: =RC[-24]/RC[-23] -> 0.5 | AT26: =RC[-12]/RC[-23] -> 396.755242268041 | AU26: =RC[-27]/RC[-43] -> 0 | AV26: =RC[-26]/RC[-44] -> 27716.1649484536 | AW26: =RC[-42]/RC[-45] -> 66222.412371134 | AX26: =SUM(RC[-43]:RC[-37])/RC[-46] -> 69798.5103092784 | AY26: =RC[-39]/RC[-47] -> 597.170103092784
A27: 'Portugal | B27: 'EU | C27: 'C25 | D27: =RC[+19]/1000 -> 325 | E27: 230 | F27: 230 | G27: 8616219 | H27: 0 | I27: 0 | J27: 14149 | K27: 47946 | L27: 144852 | M27: 0 | N27: 333379 | O27: 9748 | P27: 0 | Q27: 0 | R27: 484 | S27: 146 | T27: 1106067 | U27: 1615393 | V27: 0 | W27: 325000 | X27: 829 | Y27: 470 | Z27: 1215 | AA27: 7048520 | AB27: 10692942 | AC27: 0 | AD27: 0 | AE27: 0 | AF27: 0 | AG27: 1519291 | AH27: 19260753 | AI27: 17669449 | AJ27: 525356 | AK27: 1065948 | AL27: 19260753 | AM27: 12126 | AN27: 0 | AO27: 0 | AP27: 457209 | AQ27: 469335 | AR27: =RC[-30]+RC[-29] -> 343127 | AS27: =RC[-24]/RC[-23] -> #NUM! | AT27: =RC[-12]/RC[-23] -> 59.2638553846154 | AU27: =RC[-27]/RC[-43] -> 3403.28307692308 | AV27: =RC[-26]/RC[-44] -> 0 | AW27: =RC[-42]/RC[-45] -> 26511.4430769231 | AX27: =SUM(RC[-43]:RC[-37])/RC[-46] -> 27148.2030769231 | AY27: =RC[-39]/RC[-47] -> 445.698461538462
A28: 'Spain | B28: 'EU | C28: 'C26 | D28: =RC[+19]/1000 -> 1680 | E28: 610 | F28: 1007 | G28: 29482682 | H28: 234938 | I28: 0 | J28: 41839 | K28: 1635186 | L28: 1038741 | M28: 71863 | N28: 1371270 | O28: 77635 | P28: 0 | Q28: 0 | R28: 0 | S28: 0 | T28: 3805781 | U28: 14251982 | V28: 51875328 | W28: 1680000 | X28: 5874 | Y28: 1556 | Z28: 7430 | AA28: 122788945 | AB28: 79317863 | AC28: 0 | AD28: 0 | AE28: 0 | AF28: 0 | AG28: 10218365 | AH28: 212325173 | AI28: 181396888 | AJ28: 9628756 | AK28: 21299529 | AL28: 212325173 | AM28: 0 | AN28: 0 | AO28: 0 | AP28: 0 | AQ28: 0 | AR28: =RC[-30]+RC[-29] -> 1448905 | AS28: =RC[-24]/RC[-23] -> 0.274735265288347 | AT28: =RC[-12]/RC[-23] -> 126.384031547619 | AU28: =RC[-27]/RC[-43] -> 2265.34583333333 | AV28: =RC[-26]/RC[-44] -> 30878.1714285714 | AW28: =RC[-42]/RC[-45] -> 17549.2154761905 | AX28: =SUM(RC[-43]:RC[-37])/RC[-46] -> 19348.3625 | AY28: =RC[-39]/RC[-47] -> 618.298214285714
A29: 'Sweden | B29: 'EU | C29: 'C27 | D29: =RC[+19]/1000 -> 292 | E29: 37 | F29: 155 | G29: 23323000 | H29: 254183 | I29: 0 | J29: 69985 | K29: 2710924 | L29: 45375 | M29: 9291 | N29: 342000 | O29: 1045 | P29: 0 | Q29: 0 | R29: 2510 | S29: 0 | T29: 497999 | U29: 6899208 | V29: 0 | W29: 292000 | X29: 1111 | Y29: 622 | Z29: 1733 | AA29: 66313682 | AB29: 31054748 | AC29: 0 | AD29: 0 | AE29: 0 | AF29: 0 | AG29: 20561175 | AH29: 117929605 | AI29: 103233087 | AJ29: 2479925 | AK29: 12216593 | AL29: 117929605 | AM29: 0 | AN29: 0 | AO29: 0 | AP29: 0 | AQ29: 0 | AR29: =RC[-30]+RC[-29] -> 343045 | AS29: =RC[-24]/RC[-23] -> #NUM! | AT29: =RC[-12]/RC[-23] -> 403.868510273973 | AU29: =RC[-27]/RC[-43] -> 1705.47602739726 | AV29: =RC[-26]/RC[-44] -> 0 | AW29: =RC[-42]/RC[-45] -> 79873.2876712329 | AX29: =SUM(RC[-43]:RC[-37])/RC[-46] -> 90454.6506849315 | AY29: =RC[-39]/RC[-47] -> 155.393835616438
A30: 'Switzerland | B30: 'EFTA | C30: 'C28 | D30: =RC[+19]/1000 -> 162 | E30: 0 | F30: 0 | G30: 0 | H30: 0 | I30: 0 | J30: 0 | K30: 0 | L30: 0 | M30: 0 | N30: 0 | O30: 0 | P30: 0 | Q30: 0 | R30: 0 | S30: 0 | T30: 0 | U30: 0 | V30: 0 | W30: 162000 | X30: 0 | Y30: 0 | Z30: 0 | AA30: 0 | AB30: 0 | AC30: 0 | AD30: 0 | AE30: 0 | AF30: 0 | AG30: 0 | AH30: 0 | AI30: 0 | AJ30: 0 | AK30: 0 | AL30: 0 | AM30: 0 | AN30: 0 | AO30: 0 | AP30: 0 | AQ30: 0 | AR30: =RC[-30]+RC[-29] -> 0 | AS30: =RC[-24]/RC[-23] -> #NUM! | AT30: =RC[-12]/RC[-23] -> 0 | AU30: =RC[-27]/RC[-43] -> 0 | AV30: =RC[-26]/RC[-44] -> 0 | AW30: =RC[-42]/RC[-45] -> 0 | AX30: =SUM(RC[-43]:RC[-37])/RC[-46] -> 0 | AY30: =RC[-39]/RC[-47] -> 0
A31: 'UK | B31: 'EU | C31: 'C29 | D31: =RC[+19]/1000 -> 1910 | E31: 166 | F31: 790 | G31: 104563000 | H31: 839000 | I31: 0 | J31: 107000 | K31: 10641000 | L31: 2405000 | M31: 0 | N31: 2831000 | O31: 157000 | P31: 0 | Q31: 0 | R31: 35670 | S31: 35670 | T31: 2449000 | U31: 79300000 | V31: 119300000 | W31: 1910000 | X31: 3629 | Y31: 6191 | Z31: 9820 | AA31: 349430033 | AB31: 221228019 | AC31: 24467620 | AD31: 264739 | AE31: 2493264 | AF31: 0 | AG31: 91189805 | AH31: 689073480 | AI31: 482267515 | AJ31: 32964520 | AK31: 108013536 | AL31: 623245571 | AM31: 0 | AN31: 0 | AO31: 0 | AP31: 0 | AQ31: 0 | AR31: =RC[-30]+RC[-29] -> 2988000 | AS31: =RC[-24]/RC[-23] -> 0.664710813076278 | AT31: =RC[-12]/RC[-23] -> 360.771455497382 | AU31: =RC[-27]/RC[-43] -> 1282.19895287958 | AV31: =RC[-26]/RC[-44] -> 62460.7329842932 | AW31: =RC[-42]/RC[-45] -> 54745.0261780105 | AX31: =SUM(RC[-43]:RC[-37])/RC[-46] -> 62070.6806282723 | AY31: =RC[-39]/RC[-47] -> 1259.16230366492
A32: 'Germany | B32: 'EU | C32: 'C31 | D32: =RC[+19]/1000 -> 2415 | E32: 241 | F32: 845 | G32: 154369463 | H32: 0 | I32: 519536 | J32: 178925 | K32: 49986069 | L32: 1722099 | M32: 0 | N32: 3232266 | O32: 61183 | P32: 0 | Q32: 0 | R32: 0 | S32: 0 | T32: 2228181 | U32: 57583739 | V32: 0 | W32: 2415000 | X32: 5231 | Y32: 3638 | Z32: 8869 | AA32: 240640929 | AB32: 200462916 | AC32: 18827653 | AD32: 0 | AE32: 4629073 | AF32: 0 | AG32: 26773402 | AH32: 491333973 | AI32: 454813141 | AJ32: 11287646 | AK32: 25233186 | AL32: 491333973 | AM32: 15760576 | AN32: 0 | AO32: 0 | AP32: 13353451 | AQ32: 29114027 | AR32: =RC[-30]+RC[-29] -> 3293449 | AS32: =RC[-24]/RC[-23] -> #NUM! | AT32: =RC[-12]/RC[-23] -> 203.450920496894 | AU32: =RC[-27]/RC[-43] -> 922.642236024845 | AV32: =RC[-26]/RC[-44] -> 0 | AW32: =RC[-42]/RC[-45] -> 63921.1026915114 | AX32: =SUM(RC[-43]:RC[-37])/RC[-46] -> 85621.5701863354 | AY32: =RC[-39]/RC[-47] -> 713.084472049689
A33: 'USA | B33: 'World - A | C33: 'C50 | D33: =RC[+19]/1000 -> 16072.976 | E33: 3575 | F33: 0 | G33: 878906177 | H33: 0 | I33: 7543703 | J33: 0 | K33: 1062082077 | L33: 94285669 | M33: 3473225 | N33: 24550615 | O33: 3249220 | P33: 0 | Q33: 0 | R33: 0 | S33: 28803 | T33: 0 | U33: 220701765 | V33: 16541520 | W33: 16072976 | X33: 30041 | Y33: 66668 | Z33: 96709 | AA33: 2534637034 | AB33: 1800363164 | AC33: 0 | AD33: 0 | AE33: 0 | AF33: 0 | AG33: 694734341 | AH33: 5029734539 | AI33: 4388151679 | AJ33: 204458423 | AK33: 437124437 | AL33: 5029734539 | AM33: 0 | AN33: 0 | AO33: 0 | AP33: 0 | AQ33: 0 | AR33: =RC[-30]+RC[-29] -> 27799835 | AS33: =RC[-24]/RC[-23] -> 13.3422904908376 | AT33: =RC[-12]/RC[-23] -> 312.931129804462 | AU33: =RC[-27]/RC[-43] -> 0 | AV33: =RC[-26]/RC[-44] -> 1029.151042097 | AW33: =RC[-42]/RC[-45] -> 54682.2304096018 | AX33: =SUM(RC[-43]:RC[-37])/RC[-46] -> 127312.505848326 | AY33: =RC[-39]/RC[-47] -> 5866.09903480227
A34: 'Turkey | B34: 'World - B | C34: 'C42 | D34: =RC[+19]/1000 -> 1019.781 | E34: 0 | F34: 0 | G34: 0 | H34: 0 | I34: 0 | J34: 0 | K34: 0 | L34: 0 | M34: 0 | N34: 0 | O34: 0 | P34: 0 | Q34: 0 | R34: 0 | S34: 0 | T34: 0 | U34: 0 | V34: 0 | W34: 1019781 | X34: 0 | Y34: 0 | Z34: 0 | AA34: 0 | AB34: 0 | AC34: 0 | AD34: 0 | AE34: 0 | AF34: 0 | AG34: 0 | AH34: 0 | AI34: 0 | AJ34: 0 | AK34: 0 | AL34: 0 | AM34: 0 | AN34: 0 | AO34: 0 | AP34: 0 | AQ34: 0 | AR34: =RC[-30]+RC[-29] -> 0 | AS34: =RC[-24]/RC[-23] -> #NUM! | AT34: =RC[-12]/RC[-23] -> 0 | AU34: =RC[-27]/RC[-43] -> 0 | AV34: =RC[-26]/RC[-44] -> 0 | AW34: =RC[-42]/RC[-45] -> 0 | AX34: =SUM(RC[-43]:RC[-37])/RC[-46] -> 0 | AY34: =RC[-39]/RC[-47] -> 0
A35: 'Australia | B35: 'World - A | C35: 'C70 | D35: =RC[+19]/1000 -> 1063.775 | E35: 0 | F35: 0 | G35: 0 | H35: 0 | I35: 0 | J35: 0 | K35: 0 | L35: 0 | M35: 0 | N35: 0 | O35: 0 | P35: 0 | Q35: 0 | R35: 0 | S35: 0 | T35: 0 | U35: 0 | V35: 0 | W35: 1063775 | X35: 0 | Y35: 0 | Z35: 0 | AA35: 0 | AB35: 0 | AC35: 0 | AD35: 0 | AE35: 0 | AF35: 0 | AG35: 0 | AH35: 0 | AI35: 0 | AJ35: 0 | AK35: 0 | AL35: 0 | AM35: 0 | AN35: 0 | AO35: 0 | AP35: 0 | AQ35: 0 | AR35: =RC[-30]+RC[-29] -> 0 | AS35: =RC[-24]/RC[-23] -> #NUM! | AT35: =RC[-12]/RC[-23] -> 0 | AU35: =RC[-27]/RC[-43] -> 0 | AV35: =RC[-26]/RC[-44] -> 0 | AW35: =RC[-42]/RC[-45] -> 0 | AX35: =SUM(RC[-43]:RC[-37])/RC[-46] -> 0 | AY35: =RC[-39]/RC[-47] -> 0
A36: 'Japan | B36: 'World - A | C36: 'C41 | D36: =RC[+19]/1000 -> 3782.313 | E36: 1064 | F36: 1651 | G36: 280726000 | H36: 0 | I36: 0 | J36: 0 | K36: 0 | L36: 0 | M36: 0 | N36: 7637000 | O36: 0 | P36: 0 | Q36: 0 | R36: 0 | S36: 0 | T36: 0 | U36: 28374000 | V36: 0 | W36: 3782313 | X36: 7508 | Y36: 6902 | Z36: 14410 | AA36: 217143840 | AB36: 685720182 | AC36: 2303953 | AD36: 85529 | AE36: 805492 | AF36: 1661955 | AG36: 28519971 | AH36: 936240922 | AI36: 835799770 | AJ36: 35882362 | AK36: 64558790 | AL36: 936240922 | AM36: 0 | AN36: 0 | AO36: 0 | AP36: 0 | AQ36: 0 | AR36: =RC[-30]+RC[-29] -> 7637000 | AS36: =RC[-24]/RC[-23] -> #NUM! | AT36: =RC[-12]/RC[-23] -> 247.531318005675 | AU36: =RC[-27]/RC[-43] -> 0 | AV36: =RC[-26]/RC[-44] -> 0 | AW36: =RC[-42]/RC[-45] -> 74220.7215531872 | AX36: =SUM(RC[-43]:RC[-37])/RC[-46] -> 74220.7215531872 | AY36: =RC[-39]/RC[-47] -> 0
A37: 'Korea | B37: 'World - A | C37: 'C40 | D37: =RC[+19]/1000 -> 2413.145 | E37: 0 | F37: 0 | G37: 0 | H37: 0 | I37: 0 | J37: 0 | K37: 0 | L37: 0 | M37: 0 | N37: 0 | O37: 0 | P37: 0 | Q37: 0 | R37: 0 | S37: 0 | T37: 0 | U37: 0 | V37: 0 | W37: 2413145 | X37: 0 | Y37: 0 | Z37: 0 | AA37: 0 | AB37: 0 | AC37: 0 | AD37: 0 | AE37: 0 | AF37: 0 | AG37: 0 | AH37: 0 | AI37: 0 | AJ37: 0 | AK37: 0 | AL37: 0 | AM37: 0 | AN37: 0 | AO37: 0 | AP37: 0 | AQ37: 0 | AR37: =RC[-30]+RC[-29] -> 0 | AS37: =RC[-24]/RC[-23] -> #NUM! | AT37: =RC[-12]/RC[-23] -> 0 | AU37: =RC[-27]/RC[-43] -> 0 | AV37: =RC[-26]/RC[-44] -> 0 | AW37: =RC[-42]/RC[-45] -> 0 | AX37: =SUM(RC[-43]:RC[-37])/RC[-46] -> 0 | AY37: =RC[-39]/RC[-47] -> 0
A38: 'Canada | B38: 'World - A | C38: 'C51 | D38: =RC[+19]/1000 -> 2030.395 | E38: 2739 | F38: 910 | G38: 75032608 | H38: 0 | I38: 150814 | J38: 0 | K38: 0 | L38: 0 | M38: 0 | N38: 0 | O38: 0 | P38: 0 | Q38: 0 | R38: 0 | S38: 0 | T38: 0 | U38: 0 | V38: 241138449 | W38: 2030395 | X38: 3130 | Y38: 6616 | Z38: 13349 | AA38: 402701509 | AB38: 87045658 | AC38: 0 | AD38: 0 | AE38: 0 | AF38: 0 | AG38: 130705857 | AH38: 620453024 | AI38: 573016599 | AJ38: 14160664 | AK38: 33275761 | AL38: 620453024 | AM38: 25852154 | AN38: 38825 | AO38: 1941548 | AP38: 309008 | AQ38: 28141535 | AR38: =RC[-30]+RC[-29] -> 0 | AS38: =RC[-24]/RC[-23] -> 0 | AT38: =RC[-12]/RC[-23] -> 305.582423124564 | AU38: =RC[-27]/RC[-43] -> 0 | AV38: =RC[-26]/RC[-44] -> 118764.30399011 | AW38: =RC[-42]/RC[-45] -> 36954.6851720971 | AX38: =SUM(RC[-43]:RC[-37])/RC[-46] -> 37028.9633297954 | AY38: =RC[-39]/RC[-47] -> 0
A39: 'New Zealand | B39: 'World - A | C39: 'C71 | D39: =RC[+19]/1000 -> 169.557 | E39: 0 | F39: 0 | G39: 0 | H39: 0 | I39: 0 | J39: 0 | K39: 0 | L39: 0 | M39: 0 | N39: 0 | O39: 0 | P39: 0 | Q39: 0 | R39: 0 | S39: 0 | T39: 0 | U39: 0 | V39: 0 | W39: 169557 | X39: 0 | Y39: 0 | Z39: 0 | AA39: 0 | AB39: 0 | AC39: 0 | AD39: 0 | AE39: 0 | AF39: 0 | AG39: 0 | AH39: 0 | AI39: 0 | AJ39: 0 | AK39: 0 | AL39: 0 | AM39: 0 | AN39: 0 | AO39: 0 | AP39: 0 | AQ39: 0 | AR39: =RC[-30]+RC[-29] -> 0 | AS39: =RC[-24]/RC[-23] -> #NUM! | AT39: =RC[-12]/RC[-23] -> 0 | AU39: =RC[-27]/RC[-43] -> 0 | AV39: =RC[-26]/RC[-44] -> 0 | AW39: =RC[-42]/RC[-45] -> 0 | AX39: =SUM(RC[-43]:RC[-37])/RC[-46] -> 0 | AY39: =RC[-39]/RC[-47] -> 0
A40: 'Mexico | B40: 'World - B | C40: 'C72 | D40: =RC[+19]/1000 -> 1492.176 | E40: 0 | F40: 0 | G40: 0 | H40: 0 | I40: 0 | J40: 0 | K40: 0 | L40: 0 | M40: 0 | N40: 0 | O40: 0 | P40: 0 | Q40: 0 | R40: 0 | S40: 0 | T40: 0 | U40: 0 | V40: 0 | W40: 1492176 | X40: 0 | Y40: 0 | Z40: 0 | AA40: 0 | AB40: 0 | AC40: 0 | AD40: 0 | AE40: 0 | AF40: 0 | AG40: 0 | AH40: 0 | AI40: 0 | AJ40: 0 | AK40: 0 | AL40: 0 | AM40: 0 | AN40: 0 | AO40: 0 | AP40: 0 | AQ40: 0 | AR40: =RC[-30]+RC[-29] -> 0 | AS40: =RC[-24]/RC[-23] -> #NUM! | AT40: =RC[-12]/RC[-23] -> 0 | AU40: =RC[-27]/RC[-43] -> 0 | AV40: =RC[-26]/RC[-44] -> 0 | AW40: =RC[-42]/RC[-45] -> 0 | AX40: =SUM(RC[-43]:RC[-37])/RC[-46] -> 0 | AY40: =RC[-39]/RC[-47] -> 0
A41: 'CEE - Total | B41: 'Totals | D41: =RC[+19]/1000 -> 2302 | E41: 934 | F41: 3615 | G41: 131734074 | H41: 1142831 | I41: 1168450 | J41: 1960226 | K41: 8711868 | L41: 852840 | M41: 88631 | N41: 4228576 | O41: 57769 | P41: 7 | Q41: 26 | R41: 6829 | S41: 3511 | T41: 2553436 | U41: 55149153 | V41: 37603812 | W41: 2302000 | X41: 11489 | Y41: 4214 | Z41: 15703 | AA41: 33263888 | AB41: 47382991 | AC41: 565690 | AD41: 1636390 | AE41: 1196376 | AF41: 3889473 | AG41: 13733644 | AH41: 101668452 | AI41: 79791420 | AJ41: 2661068 | AK41: 18955212 | AL41: 101407700 | AM41: 14119252 | AN41: 0 | AO41: 866018 | AP41: 246785 | AQ41: 15232055 | AR41: =RC[-30]+RC[-29] -> 4286345 | AS41: =RC[-24]/RC[-23] -> 1.46658410588799 | AT41: =RC[-12]/RC[-23] -> 44.1652701998262 | AU41: =RC[-27]/RC[-43] -> 1109.22502172024 | AV41: =RC[-26]/RC[-44] -> 16335.2788879235 | AW41: =RC[-42]/RC[-45] -> 57225.922675934 | AX41: =SUM(RC[-43]:RC[-37])/RC[-46] -> 63274.9435273675 | AY41: =RC[-39]/RC[-47] -> 370.477845351868
A42: 'EU - Total | B42: 'Totals | D42: =RC[+19]/1000 -> 12585.234 | E42: 3208 | F42: 6424 | G42: 487754400 | H42: 2911598 | I42: 3865860 | J42: 1766522 | K42: 78693509 | L42: 9969449 | M42: 423705 | N42: 14813673 | O42: 660572 | P42: 38 | Q42: 48 | R42: 154269 | S42: 80462 | T42: 14382525 | U42: 210580745 | V42: 403657987 | W42: 12585234 | X42: 24539 | Y42: 20301 | Z42: 47560 | AA42: 1354514691 | AB42: 864718452 | AC42: 67486035 | AD42: 1353979 | AE42: 9296599 | AF42: 29096808 | AG42: 318420990 | AH42: 2644887555 | AI42: 2231179957 | AJ42: 106286030 | AK42: 235802452 | AL42: 2573268439 | AM42: 82712061 | AN42: 1136892 | AO42: 3768217 | AP42: 25911026 | AQ42: 113528196 | AR42: =RC[-30]+RC[-29] -> 15474245 | AS42: =RC[-24]/RC[-23] -> 0.52168110574262 | AT42: =RC[-12]/RC[-23] -> 210.157995870399 | AU42: =RC[-27]/RC[-43] -> 1142.80950199257 | AV42: =RC[-26]/RC[-44] -> 32073.9357726682 | AW42: =RC[-42]/RC[-45] -> 38756.0851073568 | AX42: =SUM(RC[-43]:RC[-37])/RC[-46] -> 46513.6399529798 | AY42: =RC[-39]/RC[-47] -> 792.154440672299
A43: 'EFTA - Total | B43: 'Totals | D43: =RC[+19]/1000 -> 365 | E43: 243 | F43: 546 | G43: 31208347 | H43: 219470 | I43: 292848 | J43: 109166 | K43: 1270604 | L43: 319773 | M43: 23761 | N43: 848616 | O43: 17118 | P43: 22 | Q43: 31 | R43: 3105 | S43: 1159 | T43: 332547 | U43: 7957560 | V43: 11540072 | W43: 365000 | X43: 1569 | Y43: 884 | Z43: 2452 | AA43: 70333312 | AB43: 37558616 | AC43: 0 | AD43: 0 | AE43: 0 | AF43: 0 | AG43: 27051215 | AH43: 134943143 | AI43: 117633762 | AJ43: 11267938 | AK43: -2 | AL43: 128901698 | AM43: 3931886 | AN43: 61209 | AO43: 230814 | AP43: 741183 | AQ43: 4965092 | AR43: =RC[-30]+RC[-29] -> 865734 | AS43: =RC[-24]/RC[-23] -> 0.689558955957987 | AT43: =RC[-12]/RC[-23] -> 369.70724109589 | AU43: =RC[-27]/RC[-43] -> 911.087671232877 | AV43: =RC[-26]/RC[-44] -> 31616.6356164384 | AW43: =RC[-42]/RC[-45] -> 85502.3205479452 | AX43: =SUM(RC[-43]:RC[-37])/RC[-46] -> 91627.3123287671 | AY43: =RC[-39]/RC[-47] -> 876.090410958904
A44: 'World A - Total | B44: 'Totals | D44: =RC[+19]/1000 -> 25532.161 | E44: 8272 | F44: 14308 | G44: 1449728909 | H44: 9563506 | I44: 11934892 | J44: 8727610 | K44: 1374967028 | L44: 122512732 | M44: 4522442 | N44: 41732246 | O44: 4281006 | P44: 36 | Q44: 54 | R44: 151587 | S44: 53281 | T44: 14000859 | U44: 308064410 | V44: 356095263 | W44: 25532161 | X44: 47154 | Y44: 87500 | Z44: 138257 | AA44: 3544120087 | AB44: 3250815148 | AC44: 4374510 | AD44: 162394 | AE44: 1529386 | AF44: 3155550 | AG44: 932900246 | AH44: 7737057321 | AI44: 6800824975 | AJ44: 301274447 | AK44: 634957899 | AL44: 7737057321 | AM44: 258632557 | AN44: 3662525 | AO44: 15606518 | AP44: 44189468 | AQ44: 322091068 | AR44: =RC[-30]+RC[-29] -> 46013252 | AS44: =RC[-24]/RC[-23] -> 0.865117967042432 | AT44: =RC[-12]/RC[-23] -> 303.031824098242 | AU44: =RC[-27]/RC[-43] -> 548.36169175026 | AV44: =RC[-26]/RC[-44] -> 13946.9300307169 | AW44: =RC[-42]/RC[-45] -> 56780.5016191148 | AX44: =SUM(RC[-43]:RC[-37])/RC[-46] -> 116792.194714736 | AY44: =RC[-39]/RC[-47] -> 4798.36908438733
A45: 'World B - Total | B45: 'Totals | D45: =RC[+19]/1000 -> 2511.957 | E45: 404 | F45: 495 | G45: 39127601 | H45: 254526 | I45: 343668 | J45: 232280 | K45: 27338657 | L45: 2504638 | M45: 93433 | N45: 1186903 | O45: 95485 | P45: 22 | Q45: 30 | R45: 49718 | S45: 17743 | T45: 4591924 | U45: 93952846 | V45: 84887696 | W45: 2511957 | X45: 1498 | Y45: 2242 | Z45: 3740 | AA45: 6618301 | AB45: 9331753 | AC45: 68112 | AD45: 369971 | AE45: 225448 | AF45: 1007737 | AG45: 2903375 | AH45: 20524697 | AI45: 15654749 | AJ45: 480700 | AK45: 4389248 | AL45: 20524697 | AM45: 3123861 | AN45: 0 | AO45: 159645 | AP45: 37498 | AQ45: 3321004 | AR45: =RC[-30]+RC[-29] -> 1282388 | AS45: =RC[-24]/RC[-23] -> 1.1067899168803 | AT45: =RC[-12]/RC[-23] -> 8.17079950015068 | AU45: =RC[-27]/RC[-43] -> 1828.02651478509 | AV45: =RC[-26]/RC[-44] -> 33793.4510821642 | AW45: =RC[-42]/RC[-45] -> 15576.5409200874 | AX45: =SUM(RC[-43]:RC[-37])/RC[-46] -> 27824.840552605 | AY45: =RC[-39]/RC[-47] -> 997.086335474692
A46: 'EU Accession Countries - Totals | B46: 'Totals | D46: =RC[+19]/1000 -> 1616.63 | E46: 667 | F46: 2835 | G46: 93938357 | H46: 859989 | I46: 884554 | J46: 1531096 | K46: 7862199 | L46: 532106 | M46: 74514 | N46: 3141060 | O46: 42180 | P46: 7 | Q46: 26 | R46: 5462 | S46: 3000 | T46: 1898554 | U46: 38312786 | V46: 27326879 | W46: 1616630 | X46: 8467 | Y46: 2946 | Z46: 11413 | AA46: 28300167 | AB46: 38915339 | AC46: 512335 | AD46: 1281841 | AE46: 978957 | AF46: 2934421 | AG46: 11121444 | AH46: 84044504 | AI46: 67073361 | AJ46: 2421845 | AK46: 14288546 | AL46: 83783752 | AM46: 11011200 | AN46: 2101 | AO46: 708194 | AP46: 241384 | AQ46: 11962879 | AR46: =RC[-30]+RC[-29] -> 3183240 | AS46: =RC[-24]/RC[-23] -> 1.40201835709083 | AT46: =RC[-12]/RC[-23] -> 51.9874702312836 | AU46: =RC[-27]/RC[-43] -> 1174.38993461707 | AV46: =RC[-26]/RC[-44] -> 16903.6075045001 | AW46: =RC[-42]/RC[-45] -> 58107.5181086581 | AX46: =SUM(RC[-43]:RC[-37])/RC[-46] -> 65372.2960726944 | AY46: =RC[-39]/RC[-47] -> 329.145197107563

Sheet: 2000
A1: 'Name | B1: 'Type | C1: 'Code | D1: 'Population '000s | E1: 'Libraries - Total Administrative Units | F1: 'Libraries - Service Points | G1: 'Collections - Books & Bound Periodicals | H1: 'Collections - Current Periodicals - Titles | I1: 'Collections - Current Periodicals - Subscriptions | J1: 'Collections - Manuscripts | K1: 'Collections - Microforms | L1: 'Collections - Audio-visual Materials | M1: 'Collections - CD-ROMs | N1: 'Additions - Books & Bound Periodicals | O1: 'Additions - Audio-visual Materials | P1: 'Facilities & Services - Percentage Stock on Open Access | Q1: 'Facilities & Services - Percentage Catalogue Records Automated | R1: 'Facilities & Services - Number of Workstations for users | S1: 'Facilities & Services - Number connected to the internet | T1: 'Use & Users - Registered Users | U1: 'Use & Users - Loans | V1: 'Use & Users - Number of Visits | W1: 'Use & Users - Potential Total Population Served | X1: 'Library Staff FTE - Trained Librarians | Y1: 'Library Staff FTE - Other Library Staff | Z1: 'Library Staff FTE - Total Staff | AA1: 'Recurrent Expenditure (Euros) - Staff | AB1: 'Recurrent Expenditure (Euros) - Acquisition of Stock | AC1: 'Recurrent Expenditure (Euros) - Electronic Information | AD1: 'Recurrent Expenditure (Euros) - Automation | AE1: 'Recurrent Expenditure (Euros) - Premises and Related Costs | AF1: 'Recurrent Expenditure (Euros) - New Buildings / Refurbishment | AG1: 'Recurrent Expenditure (Euros) - Other Expenditure | AH1: 'Recurrent Expenditure (Euros) - TOTAL EXPENDITURE | AI1: 'Income - Public Funding | AJ1: 'Income - Fees & Charges | AK1: 'Income - Other Income | AL1: 'Income - TOTAL INCOME | AM1: 'Capital Expenditure - New Buildings / Refurbishment | AN1: 'Capital Expenditure - Acquisition of Stock | AO1: 'Capital Expenditure - Automation | AP1: 'Capital Expenditure - Other Capital Expenditure | AQ1: 'Capital Expenditure - TOTAL CAPITAL PAYMENTS | AR1: 'Additions | AS1: 'Loans per visit | AT1: 'Cost per pop | AU1: 'Users per 1000 pop | AV1: 'visits per 1000 pop | AW1: 'Bookstock per 1000 pop | AX1: 'Total stock per 1000 pop | AY1: 'AV materials per 1000 pop
A2: 'Bulgaria | B2: 'CEE | C2: 'C1 | D2: =RC[+19]/1000 -> 289 | E2: 84 | F2: 84 | G2: 8501798 | H2: 8198 | I2: 0 | J2: 0 | K2: 23792 | L2: 84101 | M2: 0 | N2: 101846 | O2: 3634 | P2: 0 | Q2: 0 | R2: 0 | S2: 0 | T2: 200848 | U2: 5002065 | V2: 2813081 | W2: 289000 | X2: 496 | Y2: 312 | Z2: 808 | AA2: 915682 | AB2: 1270346 | AC2: 0 | AD2: 0 | AE2: 0 | AF2: 0 | AG2: 86478 | AH2: 2272506 | AI2: 1440682 | AJ2: 146788 | AK2: 865658 | AL2: 2453128 | AM2: 0 | AN2: 0 | AO2: 0 | AP2: 0 | AQ2: 0 | AR2: =RC[-30]+RC[-29] -> 105480 | AS2: =RC[-24]/RC[-23] -> 1.77814467482451 | AT2: =RC[-12]/RC[-23] -> 7.86334256055363 | AU2: =RC[-27]/RC[-43] -> 694.975778546713 | AV2: =RC[-26]/RC[-44] -> 9733.84429065744 | AW2: =RC[-42]/RC[-45] -> 29417.9861591696 | AX2: =SUM(RC[-43]:RC[-37])/RC[-46] -> 29819.6851211073 | AY2: =RC[-39]/RC[-47] -> 291.006920415225
A3: 'Czech Republic | B3: 'CEE | C3: 'C2 | D3: =RC[+19]/1000 -> 192 | E3: 75 | F3: 1186 | G3: 10618145 | H3: 21511 | I3: 0 | J3: 43062 | K3: 13753 | L3: 38158 | M3: 0 | N3: 230445 | O3: 2556 | P3: 0 | Q3: 0 | R3: 0 | S3: 0 | T3: 265265 | U3: 2507780 | V3: 4255805 | W3: 192000 | X3: 406 | Y3: 387 | Z3: 793 | AA3: 0 | AB3: 3583782 | AC3: 0 | AD3: 0 | AE3: 0 | AF3: 0 | AG3: 0 | AH3: 0 | AI3: 0 | AJ3: 0 | AK3: 0 | AL3: 0 | AM3: 0 | AN3: 0 | AO3: 0 | AP3: 0 | AQ3: 0 | AR3: =RC[-30]+RC[-29] -> 233001 | AS3: =RC[-24]/RC[-23] -> 0.589261021122913 | AT3: =RC[-12]/RC[-23] -> 0 | AU3: =RC[-27]/RC[-43] -> 1381.58854166667 | AV3: =RC[-26]/RC[-44] -> 22165.6510416667 | AW3: =RC[-42]/RC[-45] -> 55302.8385416667 | AX3: =SUM(RC[-43]:RC[-37])/RC[-46] -> 55909.5260416667 | AY3: =RC[-39]/RC[-47] -> 198.739583333333
A4: 'Estonia | B4: 'CEE | C4: 'C3 | D4: =RC[+19]/1000 -> 48 | E4: 20 | F4: 37 | G4: 7384025 | H4: 12527 | I4: 23467 | J4: 71068 | K4: 29088 | L4: 36998 | M4: 3570 | N4: 110480 | O4: 4134 | P4: 5 | Q4: 15 | R4: 196 | S4: 190 | T4: 73823 | U4: 1978566 | V4: 1761645 | W4: 48000 | X4: 522 | Y4: 98 | Z4: 620 | AA4: 2322593 | AB4: 1441470 | AC4: 297336 | AD4: 103588 | AE4: 186120 | AF4: 0 | AG4: 438451 | AH4: 4789558 | AI4: 3335112 | AJ4: 0 | AK4: 1995303 | AL4: 5330415 | AM4: 505799 | AN4: 0 | AO4: 25849 | AP4: 6071 | AQ4: 537719 | AR4: =RC[-30]+RC[-29] -> 114614 | AS4: =RC[-24]/RC[-23] -> 1.12313547848744 | AT4: =RC[-12]/RC[-23] -> 99.7824583333333 | AU4: =RC[-27]/RC[-43] -> 1537.97916666667 | AV4: =RC[-26]/RC[-44] -> 36700.9375 | AW4: =RC[-42]/RC[-45] -> 153833.854166667 | AX4: =SUM(RC[-43]:RC[-37])/RC[-46] -> 157515.479166667 | AY4: =RC[-39]/RC[-47] -> 770.791666666667
A5: 'Hungary | B5: 'CEE | C5: 'C4 | D5: =RC[+19]/1000 -> 214 | E5: 141 | F5: 401 | G5: 16366142 | H5: 26078 | I5: 0 | J5: 796077 | K5: 5418049 | L5: 117905 | M5: 22354 | N5: 374994 | O5: 6380 | P5: 0 | Q5: 0 | R5: 0 | S5: 0 | T5: 284873 | U5: 4014677 | V5: 3788043 | W5: 214000 | X5: 1016 | Y5: 385 | Z5: 1401 | AA5: 3976037 | AB5: 7382380 | AC5: 35523 | AD5: 192953 | AE5: 117580 | AF5: 525570 | AG5: 559877 | AH5: 12789920 | AI5: 11030528 | AJ5: 420759 | AK5: 292935 | AL5: 11744223 | AM5: 0 | AN5: 0 | AO5: 0 | AP5: 0 | AQ5: 0 | AR5: =RC[-30]+RC[-29] -> 381374 | AS5: =RC[-24]/RC[-23] -> 1.05982878230263 | AT5: =RC[-12]/RC[-23] -> 59.7659813084112 | AU5: =RC[-27]/RC[-43] -> 1331.18224299065 | AV5: =RC[-26]/RC[-44] -> 17701.1355140187 | AW5: =RC[-42]/RC[-45] -> 76477.2990654206 | AX5: =SUM(RC[-43]:RC[-37])/RC[-46] -> 106292.546728972 | AY5: =RC[-39]/RC[-47] -> 550.957943925234
A6: 'Latvia | B6: 'CEE | C6: 'C5 | D6: =RC[+19]/1000 -> 61 | E6: 28 | F6: 28 | G6: 5467590 | H6: 0 | I6: 0 | J6: 25362 | K6: 0 | L6: 1590 | M6: 0 | N6: 134553 | O6: 0 | P6: 0 | Q6: 0 | R6: 0 | S6: 0 | T6: 88495 | U6: 4209082 | V6: 1547742 | W6: 61000 | X6: 362 | Y6: 22 | Z6: 384 | AA6: 933321 | AB6: 639562 | AC6: 0 | AD6: 0 | AE6: 0 | AF6: 0 | AG6: 245185 | AH6: 1818068 | AI6: 1112621 | AJ6: 32498 | AK6: 580061 | AL6: 1725180 | AM6: 491342 | AN6: 0 | AO6: 25110 | AP6: 5897 | AQ6: 522350 | AR6: =RC[-30]+RC[-29] -> 134553 | AS6: =RC[-24]/RC[-23] -> 2.71949846938314 | AT6: =RC[-12]/RC[-23] -> 29.8043934426229 | AU6: =RC[-27]/RC[-43] -> 1450.73770491803 | AV6: =RC[-26]/RC[-44] -> 25372.8196721311 | AW6: =RC[-42]/RC[-45] -> 89632.6229508197 | AX6: =SUM(RC[-43]:RC[-37])/RC[-46] -> 90074.4590163934 | AY6: =RC[-39]/RC[-47] -> 26.0655737704918
A7: 'Lithuania | B7: 'CEE | C7: 'C6 | D7: =RC[+19]/1000 -> 97 | E7: 15 | F7: 106 | G7: 12319023 | H7: 4208 | I7: 4000 | J7: 249193 | K7: 28264 | L7: 3640 | M7: 2720 | N7: 155423 | O7: 32784 | P7: 4 | Q7: 3 | R7: 263 | S7: 263 | T7: 107259 | U7: 7194060 | V7: 4179376 | W7: 97000 | X7: 558 | Y7: 97 | Z7: 655 | AA7: 1644192 | AB7: 479185 | AC7: 0 | AD7: 156133 | AE7: 0 | AF7: 0 | AG7: 462325 | AH7: 2741835 | AI7: 2019659 | AJ7: 98125 | AK7: 624048 | AL7: 2741832 | AM7: 0 | AN7: 0 | AO7: 0 | AP7: 0 | AQ7: 0 | AR7: =RC[-30]+RC[-29] -> 188207 | AS7: =RC[-24]/RC[-23] -> 1.7213239488383 | AT7: =RC[-12]/RC[-23] -> 28.2663402061856 | AU7: =RC[-27]/RC[-43] -> 1105.76288659794 | AV7: =RC[-26]/RC[-44] -> 43086.3505154639 | AW7: =RC[-42]/RC[-45] -> 127000.237113402 | AX7: =SUM(RC[-43]:RC[-37])/RC[-46] -> 130010.804123711 | AY7: =RC[-39]/RC[-47] -> 37.5257731958763
A8: 'Poland | B8: 'CEE | C8: 'C7 | D8: =RC[+19]/1000 -> 796 | E8: 0 | F8: 0 | G8: 0 | H8: 0 | I8: 0 | J8: 0 | K8: 0 | L8: 0 | M8: 0 | N8: 0 | O8: 0 | P8: 0 | Q8: 0 | R8: 0 | S8: 0 | T8: 0 | U8: 0 | V8: 0 | W8: 796000 | X8: 0 | Y8: 0 | Z8: 0 | AA8: 0 | AB8: 0 | AC8: 0 | AD8: 0 | AE8: 0 | AF8: 0 | AG8: 0 | AH8: 0 | AI8: 0 | AJ8: 0 | AK8: 0 | AL8: 0 | AM8: 0 | AN8: 0 | AO8: 0 | AP8: 0 | AQ8: 0 | AR8: =RC[-30]+RC[-29] -> 0 | AS8: =RC[-24]/RC[-23] -> #NUM! | AT8: =RC[-12]/RC[-23] -> 0 | AU8: =RC[-27]/RC[-43] -> 0 | AV8: =RC[-26]/RC[-44] -> 0 | AW8: =RC[-42]/RC[-45] -> 0 | AX8: =SUM(RC[-43]:RC[-37])/RC[-46] -> 0 | AY8: =RC[-39]/RC[-47] -> 0
A9: 'Romania | B9: 'CEE | C9: 'C8 | D9: =RC[+19]/1000 -> 438 | E9: 0 | F9: 0 | G9: 0 | H9: 0 | I9: 0 | J9: 0 | K9: 0 | L9: 0 | M9: 0 | N9: 0 | O9: 0 | P9: 0 | Q9: 0 | R9: 0 | S9: 0 | T9: 0 | U9: 0 | V9: 0 | W9: 438000 | X9: 0 | Y9: 0 | Z9: 0 | AA9: 0 | AB9: 0 | AC9: 0 | AD9: 0 | AE9: 0 | AF9: 0 | AG9: 0 | AH9: 0 | AI9: 0 | AJ9: 0 | AK9: 0 | AL9: 0 | AM9: 0 | AN9: 0 | AO9: 0 | AP9: 0 | AQ9: 0 | AR9: =RC[-30]+RC[-29] -> 0 | AS9: =RC[-24]/RC[-23] -> #NUM! | AT9: =RC[-12]/RC[-23] -> 0 | AU9: =RC[-27]/RC[-43] -> 0 | AV9: =RC[-26]/RC[-44] -> 0 | AW9: =RC[-42]/RC[-45] -> 0 | AX9: =SUM(RC[-43]:RC[-37])/RC[-46] -> 0 | AY9: =RC[-39]/RC[-47] -> 0
A10: 'Slovak Rep | B10: 'CEE | C10: 'C9 | D10: =RC[+19]/1000 -> 112 | E10: 34 | F10: 569 | G10: 4663015 | H10: 7561 | I10: 9455 | J10: 0 | K10: 0 | L10: 0 | M10: 1017 | N10: 88241 | O10: 439 | P10: 0 | Q10: 0 | R10: 261 | S10: 80 | T10: 145708 | U10: 2594041 | V10: 847070 | W10: 112000 | X10: 262 | Y10: 228 | Z10: 490 | AA10: 1069535 | AB10: 829960 | AC10: 72718 | AD10: 140600 | AE10: 54571 | AF10: 1075864 | AG10: 106293 | AH10: 3349541 | AI10: 2902983 | AJ10: 27554 | AK10: 321355 | AL10: 3251893 | AM10: 220415 | AN10: 0 | AO10: 136188 | AP10: 0 | AQ10: 356603 | AR10: =RC[-30]+RC[-29] -> 88680 | AS10: =RC[-24]/RC[-23] -> 3.06236910762983 | AT10: =RC[-12]/RC[-23] -> 29.9066160714286 | AU10: =RC[-27]/RC[-43] -> 1300.96428571429 | AV10: =RC[-26]/RC[-44] -> 7563.125 | AW10: =RC[-42]/RC[-45] -> 41634.0625 | AX10: =SUM(RC[-43]:RC[-37])/RC[-46] -> 41795.0714285714 | AY10: =RC[-39]/RC[-47] -> 0
A11: 'Slovenia | B11: 'CEE | C11: 'C10 | D11: =RC[+19]/1000 -> 55 | E11: 53 | F11: 79 | G11: 4080556 | H11: 16504 | I11: 13802 | J11: 0 | K11: 0 | L11: 0 | M11: 0 | N11: 127715 | O11: 12372 | P11: 0 | Q11: 44 | R11: 262 | S11: 249 | T11: 124456 | U11: 2949667 | V11: 1533531 | W11: 55000 | X11: 268 | Y11: 97 | Z11: 365 | AA11: 912040 | AB11: 4200165 | AC11: 12882 | AD11: 69969 | AE11: 42637 | AF11: 190584 | AG11: 3456985 | AH11: 8885262 | AI11: 5730373 | AJ11: 167375 | AK11: 2987513 | AL11: 8885262 | AM11: 0 | AN11: 0 | AO11: 0 | AP11: 0 | AQ11: 0 | AR11: =RC[-30]+RC[-29] -> 140087 | AS11: =RC[-24]/RC[-23] -> 1.9234479120409 | AT11: =RC[-12]/RC[-23] -> 161.550218181818 | AU11: =RC[-27]/RC[-43] -> 2262.83636363636 | AV11: =RC[-26]/RC[-44] -> 27882.3818181818 | AW11: =RC[-42]/RC[-45] -> 74191.9272727273 | AX11: =SUM(RC[-43]:RC[-37])/RC[-46] -> 74742.9454545455 | AY11: =RC[-39]/RC[-47] -> 0
A12: 'Austria | B12: 'EU | C12: 'C11 | D12: =RC[+19]/1000 -> 269 | E12: 0 | F12: 0 | G12: 0 | H12: 0 | I12: 0 | J12: 0 | K12: 0 | L12: 0 | M12: 0 | N12: 0 | O12: 0 | P12: 0 | Q12: 0 | R12: 0 | S12: 0 | T12: 0 | U12: 0 | V12: 0 | W12: 269000 | X12: 0 | Y12: 0 | Z12: 0 | AA12: 0 | AB12: 0 | AC12: 0 | AD12: 0 | AE12: 0 | AF12: 0 | AG12: 0 | AH12: 0 | AI12: 0 | AJ12: 0 | AK12: 0 | AL12: 0 | AM12: 0 | AN12: 0 | AO12: 0 | AP12: 0 | AQ12: 0 | AR12: =RC[-30]+RC[-29] -> 0 | AS12: =RC[-24]/RC[-23] -> #NUM! | AT12: =RC[-12]/RC[-23] -> 0 | AU12: =RC[-27]/RC[-43] -> 0 | AV12: =RC[-26]/RC[-44] -> 0 | AW12: =RC[-42]/RC[-45] -> 0 | AX12: =SUM(RC[-43]:RC[-37])/RC[-46] -> 0 | AY12: =RC[-39]/RC[-47] -> 0
A13: 'België Nederlandstalige Universiteiten | B13: 'België Nederlandstalige Universiteiten | C13: 'C12a | D13: 94 | E13: 41 | F13: 317 | G13: 9811675 | H13: 40200 | I13: 10953 | J13: 110 | K13: 2672 | L13: 7793 | M13: 1340 | N13: 187374 | O13: 353 | P13: 46 | Q13: 60 | R13: 311 | S13: 0 | T13: 75145 | U13: 674914 | V13: 720027 | W13: 94000 | X13: 113 | Y13: 197 | Z13: 305 | AA13: 7996380 | AB13: 5161661 | AC13: 606533 | AD13: 368990 | AE13: 82920 | AF13: 0 | AG13: 366734 | AH13: 14583218 | AI13: 4550869 | AJ13: 82920 | AK13: 40332 | AL13: 4674121 | AM13: 0 | AN13: 0 | AO13: 65444 | AP13: 6867 | AQ13: 72311 | AR13: 187727 | AS13: =RC[-24]/RC[-23] -> 0.937345405102864 | AT13: =RC[-12]/RC[-23] -> 155.140617021277 | AU13: =RC[-27]/RC[-43] -> 799.414893617021 | AV13: =RC[-26]/RC[-44] -> 7659.86170212766 | AW13: =RC[-42]/RC[-45] -> 104379.521276596 | AX13: =SUM(RC[-43]:RC[-37])/RC[-46] -> 105050.457446809 | AY13: =RC[-39]/RC[-47] -> 82.9042553191489
A14: 'Belgique universités francophones | B14: 'Belgique universités francophones | C14: 'C12b | D14: 60 | E14: 0 | F14: 0 | G14: 8948663 | H14: 17836 | I14: 17852 | J14: 600 | K14: 279683 | L14: 6462 | M14: 903 | N14: 126961 | O14: 1676 | P14: 44 | Q14: 54 | R14: 376 | S14: 0 | T14: 50333 | U14: 453954 | V14: 3104312 | W14: 60000 | X14: 122 | Y14: 184 | Z14: 305 | AA14: 7661861 | AB14: 7003969 | AC14: 602631 | AD14: 387143 | AE14: 749875 | AF14: 0 | AG14: 362068 | AH14: 16767548 | AI14: 6514595 | AJ14: 263176 | AK14: 261511 | AL14: 6688966 | AM14: 0 | AN14: 26196 | AO14: 53352 | AP14: 0 | AQ14: 43802 | AR14: 128637 | AS14: =RC[-24]/RC[-23] -> 0.146233368295455 | AT14: =RC[-12]/RC[-23] -> 279.459133333333 | AU14: =RC[-27]/RC[-43] -> 838.883333333333 | AV14: =RC[-26]/RC[-44] -> 51738.5333333333 | AW14: =RC[-42]/RC[-45] -> 149144.383333333 | AX14: =SUM(RC[-43]:RC[-37])/RC[-46] -> 154533.316666667 | AY14: =RC[-39]/RC[-47] -> 107.7
A15: 'Belgium | B15: 'EU | C15: 'C12 | D15: =RC[+19]/1000 -> 154.798 | E15: 72 | F15: 44 | G15: 18760338 | H15: 58036 | I15: 28805 | J15: 710 | K15: 282355 | L15: 14255 | M15: 2243 | N15: 314335 | O15: 2029 | P15: 45 | Q15: 55 | R15: 687 | S15: 0 | T15: 125478 | U15: 1128868 | V15: 3824339 | W15: 154798 | X15: 235 | Y15: 381 | Z15: 616 | AA15: 15686241 | AB15: 12165630 | AC15: 1209164 | AD15: 756134 | AE15: 832796 | AF15: 0 | AG15: 728801 | AH15: 31378766 | AI15: 20180280 | AJ15: 323786 | AK15: 272096 | AL15: 20776162 | AM15: 0 | AN15: 111359 | AO15: 6867 | AP15: 101809 | AQ15: 220035 | AR15: =RC[-30]+RC[-29] -> 316364 | AS15: =RC[-24]/RC[-23] -> 0.295179899062295 | AT15: =RC[-12]/RC[-23] -> 202.707825682502 | AU15: =RC[-27]/RC[-43] -> 810.591868111991 | AV15: =RC[-26]/RC[-44] -> 24705.3514903293 | AW15: =RC[-42]/RC[-45] -> 121192.379746508 | AX15: =SUM(RC[-43]:RC[-37])/RC[-46] -> 123688.561867724 | AY15: =RC[-39]/RC[-47] -> 92.0877530717451
A16: 'Denmark | B16: 'EU | C16: 'C13 | D16: =RC[+19]/1000 -> 180 | E16: 19 | F16: 43 | G16: 10548697 | H16: 0 | I16: 95313 | J16: 91740 | K16: 1203105 | L16: 857726 | M16: 30834 | N16: 248933 | O16: 20955 | P16: 0 | Q16: 0 | R16: 848 | S16: 0 | T16: 0 | U16: 4846988 | V16: 0 | W16: 180000 | X16: 398 | Y16: 432 | Z16: 830 | AA16: 38104345 | AB16: 16651008 | AC16: 595731 | AD16: 32925 | AE16: 310085 | AF16: 0 | AG16: 10979155 | AH16: 66673249 | AI16: 61903726 | AJ16: 1806241 | AK16: 2963283 | AL16: 66673249 | AM16: 2229685 | AN16: 0 | AO16: 0 | AP16: 0 | AQ16: 2229685 | AR16: =RC[-30]+RC[-29] -> 269888 | AS16: =RC[-24]/RC[-23] -> #NUM! | AT16: =RC[-12]/RC[-23] -> 370.406938888889 | AU16: =RC[-27]/RC[-43] -> 0 | AV16: =RC[-26]/RC[-44] -> 0 | AW16: =RC[-42]/RC[-45] -> 58603.8722222222 | AX16: =SUM(RC[-43]:RC[-37])/RC[-46] -> 71263.4166666667 | AY16: =RC[-39]/RC[-47] -> 4765.14444444444
A17: 'Eire | B17: 'EU | C17: 'C15 | D17: =RC[+19]/1000 -> 137 | E17: 0 | F17: 0 | G17: 0 | H17: 0 | I17: 0 | J17: 0 | K17: 0 | L17: 0 | M17: 0 | N17: 0 | O17: 0 | P17: 0 | Q17: 0 | R17: 0 | S17: 0 | T17: 0 | U17: 0 | V17: 0 | W17: 137000 | X17: 0 | Y17: 0 | Z17: 0 | AA17: 0 | AB17: 0 | AC17: 0 | AD17: 0 | AE17: 0 | AF17: 0 | AG17: 0 | AH17: 0 | AI17: 0 | AJ17: 0 | AK17: 0 | AL17: 0 | AM17: 0 | AN17: 0 | AO17: 0 | AP17: 0 | AQ17: 0 | AR17: =RC[-30]+RC[-29] -> 0 | AS17: =RC[-24]/RC[-23] -> #NUM! | AT17: =RC[-12]/RC[-23] -> 0 | AU17: =RC[-27]/RC[-43] -> 0 | AV17: =RC[-26]/RC[-44] -> 0 | AW17: =RC[-42]/RC[-45] -> 0 | AX17: =SUM(RC[-43]:RC[-37])/RC[-46] -> 0 | AY17: =RC[-39]/RC[-47] -> 0
A18: 'Finland | B18: 'EU | C18: 'C16 | D18: =RC[+19]/1000 -> 224 | E18: 47 | F18: 457 | G18: 15437808 | H18: 237807 | I18: 273707 | J18: 265120 | K18: 1274515 | L18: 306772 | M18: 0 | N18: 620732 | O18: 18049 | P18: 45 | Q18: 0 | R18: 0 | S18: 0 | T18: 0 | U18: 13070949 | V18: 16070244 | W18: 224000 | X18: 1260 | Y18: 137 | Z18: 1397 | AA18: 35800663 | AB18: 21903460 | AC18: 0 | AD18: 0 | AE18: 0 | AF18: 19252956 | AG18: 10771852 | AH18: 87728930 | AI18: 57682476 | AJ18: 4033957 | AK18: 6954000 | AL18: 68670434 | AM18: 0 | AN18: 0 | AO18: 0 | AP18: 0 | AQ18: 0 | AR18: =RC[-30]+RC[-29] -> 638781 | AS18: =RC[-24]/RC[-23] -> 0.813363443641553 | AT18: =RC[-12]/RC[-23] -> 391.647008928571 | AU18: =RC[-27]/RC[-43] -> 0 | AV18: =RC[-26]/RC[-44] -> 71742.1607142857 | AW18: =RC[-42]/RC[-45] -> 68918.7857142857 | AX18: =SUM(RC[-43]:RC[-37])/RC[-46] -> 79445.21875 | AY18: =RC[-39]/RC[-47] -> 1369.51785714286
A19: 'France | B19: 'EU | C19: 'C17 | D19: =RC[+19]/1000 -> 2278 | E19: 95 | F19: 396 | G19: 25684360 | H19: 152995 | I19: 0 | J19: 0 | K19: 1384057 | L19: 97296 | M19: 44108 | N19: 1008519 | O19: 0 | P19: 35 | Q19: 0 | R19: 0 | S19: 0 | T19: 0 | U19: 0 | V19: 0 | W19: 2278000 | X19: 1812 | Y19: 2552 | Z19: 4364 | AA19: 159036673 | AB19: 57524645 | AC19: 5631979 | AD19: 0 | AE19: 0 | AF19: 0 | AG19: 64797689 | AH19: 286990986 | AI19: 273570384 | AJ19: 8148186 | AK19: 7829233 | AL19: 289547804 | AM19: 0 | AN19: 0 | AO19: 0 | AP19: 0 | AQ19: 0 | AR19: =RC[-30]+RC[-29] -> 1008519 | AS19: =RC[-24]/RC[-23] -> #NUM! | AT19: =RC[-12]/RC[-23] -> 125.983751536435 | AU19: =RC[-27]/RC[-43] -> 0 | AV19: =RC[-26]/RC[-44] -> 0 | AW19: =RC[-42]/RC[-45] -> 11274.9604916594 | AX19: =SUM(RC[-43]:RC[-37])/RC[-46] -> 12011.7717295874 | AY19: =RC[-39]/RC[-47] -> 42.7111501316945
A20: 'Greece | B20: 'EU | C20: 'C18 | D20: =RC[+19]/1000 -> 347 | E20: 82 | F20: 172 | G20: 5683287 | H20: 0 | I20: 36200 | J20: 29790 | K20: 25338 | L20: 22796 | M20: 14045 | N20: 296750 | O20: 1439 | P20: 36 | Q20: 49 | R20: 0 | S20: 0 | T20: 402192 | U20: 1415696 | V20: 0 | W20: 347000 | X20: 728 | Y20: 395 | Z20: 1123 | AA20: 3852511 | AB20: 13843950 | AC20: 661987 | AD20: 120455 | AE20: 0 | AF20: 901194 | AG20: 3747423 | AH20: 23127520 | AI20: 12977011 | AJ20: 9975543 | AK20: 174966 | AL20: 23127520 | AM20: 0 | AN20: 0 | AO20: 0 | AP20: 0 | AQ20: 0 | AR20: =RC[-30]+RC[-29] -> 298189 | AS20: =RC[-24]/RC[-23] -> #NUM! | AT20: =RC[-12]/RC[-23] -> 66.6499135446686 | AU20: =RC[-27]/RC[-43] -> 1159.05475504323 | AV20: =RC[-26]/RC[-44] -> 0 | AW20: =RC[-42]/RC[-45] -> 16378.34870317 | AX20: =SUM(RC[-43]:RC[-37])/RC[-46] -> 16747.711815562 | AY20: =RC[-39]/RC[-47] -> 65.6945244956772
A21: 'Iceland | B21: 'EFTA | C21: 'C19 | D21: =RC[+19]/1000 -> 8 | E21: 0 | F21: 0 | G21: 0 | H21: 0 | I21: 0 | J21: 0 | K21: 0 | L21: 0 | M21: 0 | N21: 0 | O21: 0 | P21: 0 | Q21: 0 | R21: 0 | S21: 0 | T21: 0 | U21: 0 | V21: 0 | W21: 8000 | X21: 0 | Y21: 0 | Z21: 0 | AA21: 0 | AB21: 0 | AC21: 0 | AD21: 0 | AE21: 0 | AF21: 0 | AG21: 0 | AH21: 0 | AI21: 0 | AJ21: 0 | AK21: 0 | AL21: 0 | AM21: 0 | AN21: 0 | AO21: 0 | AP21: 0 | AQ21: 0 | AR21: =RC[-30]+RC[-29] -> 0 | AS21: =RC[-24]/RC[-23] -> #NUM! | AT21: =RC[-12]/RC[-23] -> 0 | AU21: =RC[-27]/RC[-43] -> 0 | AV21: =RC[-26]/RC[-44] -> 0 | AW21: =RC[-42]/RC[-45] -> 0 | AX21: =SUM(RC[-43]:RC[-37])/RC[-46] -> 0 | AY21: =RC[-39]/RC[-47] -> 0
A22: 'Italy | B22: 'EU | C22: 'C20 | D22: =RC[+19]/1000 -> 1852 | E22: 0 | F22: 0 | G22: 0 | H22: 0 | I22: 0 | J22: 0 | K22: 0 | L22: 0 | M22: 0 | N22: 0 | O22: 0 | P22: 0 | Q22: 0 | R22: 0 | S22: 0 | T22: 0 | U22: 0 | V22: 0 | W22: 1852000 | X22: 0 | Y22: 0 | Z22: 0 | AA22: 0 | AB22: 0 | AC22: 0 | AD22: 0 | AE22: 0 | AF22: 0 | AG22: 0 | AH22: 0 | AI22: 0 | AJ22: 0 | AK22: 0 | AL22: 0 | AM22: 0 | AN22: 0 | AO22: 0 | AP22: 0 | AQ22: 0 | AR22: =RC[-30]+RC[-29] -> 0 | AS22: =RC[-24]/RC[-23] -> #NUM! | AT22: =RC[-12]/RC[-23] -> 0 | AU22: =RC[-27]/RC[-43] -> 0 | AV22: =RC[-26]/RC[-44] -> 0 | AW22: =RC[-42]/RC[-45] -> 0 | AX22: =SUM(RC[-43]:RC[-37])/RC[-46] -> 0 | AY22: =RC[-39]/RC[-47] -> 0
A23: 'Liechtenstein | B23: 'EFTA | C23: 'C21 | D23: =RC[+19]/1000 -> 1 | E23: 0 | F23: 0 | G23: 0 | H23: 0 | I23: 0 | J23: 0 | K23: 0 | L23: 0 | M23: 0 | N23: 0 | O23: 0 | P23: 0 | Q23: 0 | R23: 0 | S23: 0 | T23: 0 | U23: 0 | V23: 0 | W23: 1000 | X23: 0 | Y23: 0 | Z23: 0 | AA23: 0 | AB23: 0 | AC23: 0 | AD23: 0 | AE23: 0 | AF23: 0 | AG23: 0 | AH23: 0 | AI23: 0 | AJ23: 0 | AK23: 0 | AL23: 0 | AM23: 0 | AN23: 0 | AO23: 0 | AP23: 0 | AQ23: 0 | AR23: =RC[-30]+RC[-29] -> 0 | AS23: =RC[-24]/RC[-23] -> #NUM! | AT23: =RC[-12]/RC[-23] -> 0 | AU23: =RC[-27]/RC[-43] -> 0 | AV23: =RC[-26]/RC[-44] -> 0 | AW23: =RC[-42]/RC[-45] -> 0 | AX23: =SUM(RC[-43]:RC[-37])/RC[-46] -> 0 | AY23: =RC[-39]/RC[-47] -> 0
A24: 'Luxembourg | B24: 'EU | C24: 'C22 | D24: =RC[+19]/1000 -> 2.999 | E24: 7 | F24: 5 | G24: 395010 | H24: 1650 | I24: 807 | J24: 10 | K24: 5 | L24: 2415 | M24: 135 | N24: 3800 | O24: 120 | P24: 81 | Q24: 45 | R24: 33 | S24: 27 | T24: 13837 | U24: 0 | V24: 0 | W24: 2999 | X24: 5 | Y24: 5 | Z24: 9 | AA24: 283225 | AB24: 217492 | AC24: 16747 | AD24: 141 | AE24: 1328 | AF24: 8322 | AG24: 63057 | AH24: 590312 | AI24: 259634 | AJ24: 0 | AK24: 31929 | AL24: 291563 | AM24: 0 | AN24: 0 | AO24: 0 | AP24: 0 | AQ24: 0 | AR24: =RC[-30]+RC[-29] -> 3920 | AS24: =RC[-24]/RC[-23] -> #NUM! | AT24: =RC[-12]/RC[-23] -> 196.836278759587 | AU24: =RC[-27]/RC[-43] -> 4613.87129043014 | AV24: =RC[-26]/RC[-44] -> 0 | AW24: =RC[-42]/RC[-45] -> 131713.904634878 | AX24: =SUM(RC[-43]:RC[-37])/RC[-46] -> 133388.46282094 | AY24: =RC[-39]/RC[-47] -> 805.268422807603
A25: 'Netherlands | B25: 'EU | C25: 'C23 | D25: =RC[+19]/1000 -> 540 | E25: 23 | F25: 138 | G25: 25084875 | H25: 152742 | I25: 161182 | J25: 0 | K25: 5797711 | L25: 0 | M25: 0 | N25: 0 | O25: 0 | P25: 0 | Q25: 0 | R25: 0 | S25: 0 | T25: 0 | U25: 4162863 | V25: 0 | W25: 540000 | X25: 868 | Y25: 1002 | Z25: 1870 | AA25: 0 | AB25: 0 | AC25: 0 | AD25: 0 | AE25: 0 | AF25: 0 | AG25: 0 | AH25: 0 | AI25: 0 | AJ25: 0 | AK25: 0 | AL25: 0 | AM25: 0 | AN25: 0 | AO25: 0 | AP25: 0 | AQ25: 0 | AR25: =RC[-30]+RC[-29] -> 0 | AS25: =RC[-24]/RC[-23] -> #NUM! | AT25: =RC[-12]/RC[-23] -> 0 | AU25: =RC[-27]/RC[-43] -> 0 | AV25: =RC[-26]/RC[-44] -> 0 | AW25: =RC[-42]/RC[-45] -> 46453.4722222222 | AX25: =SUM(RC[-43]:RC[-37])/RC[-46] -> 57771.3148148148 | AY25: =RC[-39]/RC[-47] -> 0
A26: 'Norway | B26: 'EFTA | C26: 'C24 | D26: =RC[+19]/1000 -> 194 | E26: 85 | F26: 189 | G26: 12563166 | H26: 77324 | I26: 0 | J26: 48499 | K26: 456921 | L26: 108283 | M26: 0 | N26: 314668 | O26: 5108 | P26: 22 | Q26: 0 | R26: 1026 | S26: 424 | T26: 0 | U26: 2720777 | V26: 4583208 | W26: 194000 | X26: 610 | Y26: 330 | Z26: 940 | AA26: 34745459 | AB26: 17932081 | AC26: 0 | AD26: 0 | AE26: 0 | AF26: 0 | AG26: 10781692 | AH26: 63459232 | AI26: 60452914 | AJ26: 3006318 | AK26: 0 | AL26: 63459232 | AM26: 0 | AN26: 0 | AO26: 0 | AP26: 0 | AQ26: 0 | AR26: =RC[-30]+RC[-29] -> 319776 | AS26: =RC[-24]/RC[-23] -> 0.593640306091279 | AT26: =RC[-12]/RC[-23] -> 327.109443298969 | AU26: =RC[-27]/RC[-43] -> 0 | AV26: =RC[-26]/RC[-44] -> 23624.7835051546 | AW26: =RC[-42]/RC[-45] -> 64758.587628866 | AX26: =SUM(RC[-43]:RC[-37])/RC[-46] -> 68320.5824742268 | AY26: =RC[-39]/RC[-47] -> 558.159793814433
A27: 'Portugal | B27: 'EU | C27: 'C25 | D27: =RC[+19]/1000 -> 325 | E27: 230 | F27: 230 | G27: 8616219 | H27: 0 | I27: 0 | J27: 14149 | K27: 47946 | L27: 144852 | M27: 0 | N27: 333379 | O27: 9748 | P27: 0 | Q27: 0 | R27: 484 | S27: 146 | T27: 1106067 | U27: 1615393 | V27: 0 | W27: 325000 | X27: 829 | Y27: 470 | Z27: 1215 | AA27: 6585510 | AB27: 9990534 | AC27: 0 | AD27: 0 | AE27: 0 | AF27: 0 | AG27: 1419490 | AH27: 17995534 | AI27: 17034202 | AJ27: 506469 | AK27: 1027625 | AL27: 18568296 | AM27: 10888 | AN27: 0 | AO27: 0 | AP27: 410531 | AQ27: 421418 | AR27: =RC[-30]+RC[-29] -> 343127 | AS27: =RC[-24]/RC[-23] -> #NUM! | AT27: =RC[-12]/RC[-23] -> 55.3708738461538 | AU27: =RC[-27]/RC[-43] -> 3403.28307692308 | AV27: =RC[-26]/RC[-44] -> 0 | AW27: =RC[-42]/RC[-45] -> 26511.4430769231 | AX27: =SUM(RC[-43]:RC[-37])/RC[-46] -> 27148.2030769231 | AY27: =RC[-39]/RC[-47] -> 445.698461538462
A28: 'Spain | B28: 'EU | C28: 'C26 | D28: =RC[+19]/1000 -> 1680 | E28: 610 | F28: 1007 | G28: 29482682 | H28: 234938 | I28: 0 | J28: 41839 | K28: 1635186 | L28: 1038741 | M28: 71863 | N28: 1371270 | O28: 77635 | P28: 0 | Q28: 0 | R28: 0 | S28: 0 | T28: 3805781 | U28: 14251982 | V28: 51875328 | W28: 1680000 | X28: 5874 | Y28: 1556 | Z28: 7430 | AA28: 114982902 | AB28: 74275401 | AC28: 0 | AD28: 0 | AE28: 0 | AF28: 0 | AG28: 9568754 | AH28: 198827057 | AI28: 169864971 | AJ28: 9016629 | AK28: 19945457 | AL28: 198827057 | AM28: 0 | AN28: 0 | AO28: 0 | AP28: 0 | AQ28: 0 | AR28: =RC[-30]+RC[-29] -> 1448905 | AS28: =RC[-24]/RC[-23] -> 0.274735265288347 | AT28: =RC[-12]/RC[-23] -> 118.349438690476 | AU28: =RC[-27]/RC[-43] -> 2265.34583333333 | AV28: =RC[-26]/RC[-44] -> 30878.1714285714 | AW28: =RC[-42]/RC[-45] -> 17549.2154761905 | AX28: =SUM(RC[-43]:RC[-37])/RC[-46] -> 19348.3625 | AY28: =RC[-39]/RC[-47] -> 618.298214285714
A29: 'Sweden | B29: 'EU | C29: 'C27 | D29: =RC[+19]/1000 -> 292 | E29: 37 | F29: 155 | G29: 23323000 | H29: 254183 | I29: 0 | J29: 69985 | K29: 2710924 | L29: 45375 | M29: 7743 | N29: 342000 | O29: 871 | P29: 0 | Q29: 0 | R29: 2092 | S29: 0 | T29: 497999 | U29: 5332904 | V29: 0 | W29: 292000 | X29: 1038 | Y29: 578 | Z29: 1616 | AA29: 62997998 | AB29: 29502011 | AC29: 0 | AD29: 0 | AE29: 0 | AF29: 0 | AG29: 19533116 | AH29: 112033125 | AI29: 98071433 | AJ29: 2355929 | AK29: 11605763 | AL29: 112033125 | AM29: 0 | AN29: 0 | AO29: 0 | AP29: 0 | AQ29: 0 | AR29: =RC[-30]+RC[-29] -> 342871 | AS29: =RC[-24]/RC[-23] -> #NUM! | AT29: =RC[-12]/RC[-23] -> 383.675085616438 | AU29: =RC[-27]/RC[-43] -> 1705.47602739726 | AV29: =RC[-26]/RC[-44] -> 0 | AW29: =RC[-42]/RC[-45] -> 79873.2876712329 | AX29: =SUM(RC[-43]:RC[-37])/RC[-46] -> 90449.3493150685 | AY29: =RC[-39]/RC[-47] -> 155.393835616438
A30: 'Switzerland | B30: 'EFTA | C30: 'C28 | D30: =RC[+19]/1000 -> 162 | E30: 0 | F30: 0 | G30: 0 | H30: 0 | I30: 0 | J30: 0 | K30: 0 | L30: 0 | M30: 0 | N30: 0 | O30: 0 | P30: 0 | Q30: 0 | R30: 0 | S30: 0 | T30: 0 | U30: 0 | V30: 0 | W30: 162000 | X30: 0 | Y30: 0 | Z30: 0 | AA30: 0 | AB30: 0 | AC30: 0 | AD30: 0 | AE30: 0 | AF30: 0 | AG30: 0 | AH30: 0 | AI30: 0 | AJ30: 0 | AK30: 0 | AL30: 0 | AM30: 0 | AN30: 0 | AO30: 0 | AP30: 0 | AQ30: 0 | AR30: =RC[-30]+RC[-29] -> 0 | AS30: =RC[-24]/RC[-23] -> #NUM! | AT30: =RC[-12]/RC[-23] -> 0 | AU30: =RC[-27]/RC[-43] -> 0 | AV30: =RC[-26]/RC[-44] -> 0 | AW30: =RC[-42]/RC[-45] -> 0 | AX30: =SUM(RC[-43]:RC[-37])/RC[-46] -> 0 | AY30: =RC[-39]/RC[-47] -> 0
A31: 'UK | B31: 'EU | C31: 'C29 | D31: =RC[+19]/1000 -> 1910 | E31: 169 | F31: 780 | G31: 100136000 | H31: 664000 | I31: 0 | J31: 92000 | K31: 10641000 | L31: 2405000 | M31: 0 | N31: 2831000 | O31: 157000 | P31: 0 | Q31: 0 | R31: 34720 | S31: 34720 | T31: 2449000 | U31: 78600000 | V31: 120400000 | W31: 1910000 | X31: 3666 | Y31: 5964 | Z31: 9630 | AA31: 344292699 | AB31: 209729465 | AC31: 24358297 | AD31: 263556 | AE31: 2482124 | AF31: 0 | AG31: 98965124 | AH31: 680091265 | AI31: 470536180 | AJ31: 32038787 | AK31: 103168188 | AL31: 605743155 | AM31: 0 | AN31: 0 | AO31: 0 | AP31: 0 | AQ31: 0 | AR31: =RC[-30]+RC[-29] -> 2988000 | AS31: =RC[-24]/RC[-23] -> 0.652823920265781 | AT31: =RC[-12]/RC[-23] -> 356.06872513089 | AU31: =RC[-27]/RC[-43] -> 1282.19895287958 | AV31: =RC[-26]/RC[-44] -> 63036.6492146597 | AW31: =RC[-42]/RC[-45] -> 52427.2251308901 | AX31: =SUM(RC[-43]:RC[-37])/RC[-46] -> 59653.4031413613 | AY31: =RC[-39]/RC[-47] -> 1259.16230366492
A32: 'Germany | B32: 'EU | C32: 'C31 | D32: =RC[+19]/1000 -> 2415 | E32: 237 | F32: 820 | G32: 143911373 | H32: 0 | I32: 459800 | J32: 175023 | K32: 44230143 | L32: 1619872 | M32: 0 | N32: 3191283 | O32: 75607 | P32: 0 | Q32: 0 | R32: 0 | S32: 0 | T32: 2030448 | U32: 54699051 | V32: 0 | W32: 2415000 | X32: 5252 | Y32: 3621 | Z32: 8873 | AA32: 238823496 | AB32: 174616372 | AC32: 11044241 | AD32: 0 | AE32: 4223480 | AF32: 0 | AG32: 22113445 | AH32: 450821034 | AI32: 417311527 | AJ32: 10356923 | AK32: 23152584 | AL32: 450821034 | AM32: 7505785 | AN32: 0 | AO32: 0 | AP32: 10919092 | AQ32: 18424877 | AR32: =RC[-30]+RC[-29] -> 3266890 | AS32: =RC[-24]/RC[-23] -> #NUM! | AT32: =RC[-12]/RC[-23] -> 186.675376397516 | AU32: =RC[-27]/RC[-43] -> 840.765217391304 | AV32: =RC[-26]/RC[-44] -> 0 | AW32: =RC[-42]/RC[-45] -> 59590.6306418219 | AX32: =SUM(RC[-43]:RC[-37])/RC[-46] -> 78839.0107660456 | AY32: =RC[-39]/RC[-47] -> 670.754451345756
A33: 'USA | B33: 'World - A | C33: 'C50 | D33: =RC[+19]/1000 -> 16072.976 | E33: 3575 | F33: 0 | G33: 878906177 | H33: 0 | I33: 7543703 | J33: 0 | K33: 1062082077 | L33: 94285669 | M33: 3473225 | N33: 24550615 | O33: 3249220 | P33: 0 | Q33: 0 | R33: 0 | S33: 28803 | T33: 0 | U33: 220701765 | V33: 16541520 | W33: 16072976 | X33: 30041 | Y33: 66668 | Z33: 96709 | AA33: 2369165242 | AB33: 1682827866 | AC33: 0 | AD33: 0 | AE33: 0 | AF33: 0 | AG33: 649379155 | AH33: 4701372263 | AI33: 4095522241 | AJ33: 190823855 | AK33: 407974222 | AL33: 4694320338 | AM33: 0 | AN33: 0 | AO33: 0 | AP33: 0 | AQ33: 0 | AR33: =RC[-30]+RC[-29] -> 27799835 | AS33: =RC[-24]/RC[-23] -> 13.3422904908376 | AT33: =RC[-12]/RC[-23] -> 292.501666337335 | AU33: =RC[-27]/RC[-43] -> 0 | AV33: =RC[-26]/RC[-44] -> 1029.151042097 | AW33: =RC[-42]/RC[-45] -> 54682.2304096018 | AX33: =SUM(RC[-43]:RC[-37])/RC[-46] -> 127312.505848326 | AY33: =RC[-39]/RC[-47] -> 5866.09903480227
A34: 'Turkey | B34: 'World - B | C34: 'C42 | D34: =RC[+19]/1000 -> 1019.781 | E34: 0 | F34: 0 | G34: 0 | H34: 0 | I34: 0 | J34: 0 | K34: 0 | L34: 0 | M34: 0 | N34: 0 | O34: 0 | P34: 0 | Q34: 0 | R34: 0 | S34: 0 | T34: 0 | U34: 0 | V34: 0 | W34: 1019781 | X34: 0 | Y34: 0 | Z34: 0 | AA34: 0 | AB34: 0 | AC34: 0 | AD34: 0 | AE34: 0 | AF34: 0 | AG34: 0 | AH34: 0 | AI34: 0 | AJ34: 0 | AK34: 0 | AL34: 0 | AM34: 0 | AN34: 0 | AO34: 0 | AP34: 0 | AQ34: 0 | AR34: =RC[-30]+RC[-29] -> 0 | AS34: =RC[-24]/RC[-23] -> #NUM! | AT34: =RC[-12]/RC[-23] -> 0 | AU34: =RC[-27]/RC[-43] -> 0 | AV34: =RC[-26]/RC[-44] -> 0 | AW34: =RC[-42]/RC[-45] -> 0 | AX34: =SUM(RC[-43]:RC[-37])/RC[-46] -> 0 | AY34: =RC[-39]/RC[-47] -> 0
A35: 'Australia | B35: 'World - A | C35: 'C70 | D35: =RC[+19]/1000 -> 1063.775 | E35: 0 | F35: 0 | G35: 0 | H35: 0 | I35: 0 | J35: 0 | K35: 0 | L35: 0 | M35: 0 | N35: 0 | O35: 0 | P35: 0 | Q35: 0 | R35: 0 | S35: 0 | T35: 0 | U35: 0 | V35: 0 | W35: 1063775 | X35: 0 | Y35: 0 | Z35: 0 | AA35: 0 | AB35: 0 | AC35: 0 | AD35: 0 | AE35: 0 | AF35: 0 | AG35: 0 | AH35: 0 | AI35: 0 | AJ35: 0 | AK35: 0 | AL35: 0 | AM35: 0 | AN35: 0 | AO35: 0 | AP35: 0 | AQ35: 0 | AR35: =RC[-30]+RC[-29] -> 0 | AS35: =RC[-24]/RC[-23] -> #NUM! | AT35: =RC[-12]/RC[-23] -> 0 | AU35: =RC[-27]/RC[-43] -> 0 | AV35: =RC[-26]/RC[-44] -> 0 | AW35: =RC[-42]/RC[-45] -> 0 | AX35: =SUM(RC[-43]:RC[-37])/RC[-46] -> 0 | AY35: =RC[-39]/RC[-47] -> 0
A36: 'Japan | B36: 'World - A | C36: 'C41 | D36: =RC[+19]/1000 -> 3782.313 | E36: 1069 | F36: 1645 | G36: 273022000 | H36: 0 | I36: 0 | J36: 0 | K36: 0 | L36: 0 | M36: 0 | N36: 8009000 | O36: 0 | P36: 0 | Q36: 0 | R36: 0 | S36: 0 | T36: 0 | U36: 28599000 | V36: 0 | W36: 3782313 | X36: 7508 | Y36: 7116 | Z36: 14624 | AA36: 269734282 | AB36: 773529232 | AC36: 2861951 | AD36: 106243 | AE36: 1000575 | AF36: 2064467 | AG36: 35427273 | AH36: 1084724023 | AI36: 968353409 | AJ36: 41573124 | AK36: 74797490 | AL36: 1084724023 | AM36: 0 | AN36: 0 | AO36: 0 | AP36: 0 | AQ36: 0 | AR36: =RC[-30]+RC[-29] -> 8009000 | AS36: =RC[-24]/RC[-23] -> #NUM! | AT36: =RC[-12]/RC[-23] -> 286.788539975407 | AU36: =RC[-27]/RC[-43] -> 0 | AV36: =RC[-26]/RC[-44] -> 0 | AW36: =RC[-42]/RC[-45] -> 72183.8726726212 | AX36: =SUM(RC[-43]:RC[-37])/RC[-46] -> 72183.8726726212 | AY36: =RC[-39]/RC[-47] -> 0
A37: 'Korea | B37: 'World - A | C37: 'C40 | D37: =RC[+19]/1000 -> 2413.145 | E37: 0 | F37: 0 | G37: 0 | H37: 0 | I37: 0 | J37: 0 | K37: 0 | L37: 0 | M37: 0 | N37: 0 | O37: 0 | P37: 0 | Q37: 0 | R37: 0 | S37: 0 | T37: 0 | U37: 0 | V37: 0 | W37: 2413145 | X37: 0 | Y37: 0 | Z37: 0 | AA37: 0 | AB37: 0 | AC37: 0 | AD37: 0 | AE37: 0 | AF37: 0 | AG37: 0 | AH37: 0 | AI37: 0 | AJ37: 0 | AK37: 0 | AL37: 0 | AM37: 0 | AN37: 0 | AO37: 0 | AP37: 0 | AQ37: 0 | AR37: =RC[-30]+RC[-29] -> 0 | AS37: =RC[-24]/RC[-23] -> #NUM! | AT37: =RC[-12]/RC[-23] -> 0 | AU37: =RC[-27]/RC[-43] -> 0 | AV37: =RC[-26]/RC[-44] -> 0 | AW37: =RC[-42]/RC[-45] -> 0 | AX37: =SUM(RC[-43]:RC[-37])/RC[-46] -> 0 | AY37: =RC[-39]/RC[-47] -> 0
A38: 'Canada | B38: 'World - A | C38: 'C51 | D38: =RC[+19]/1000 -> 2030.395 | E38: 2739 | F38: 910 | G38: 75032608 | H38: 0 | I38: 150814 | J38: 0 | K38: 0 | L38: 0 | M38: 0 | N38: 0 | O38: 0 | P38: 0 | Q38: 0 | R38: 0 | S38: 0 | T38: 0 | U38: 0 | V38: 241138449 | W38: 2030395 | X38: 3130 | Y38: 6616 | Z38: 13349 | AA38: 368924881 | AB38: 79744695 | AC38: 0 | AD38: 0 | AE38: 0 | AF38: 0 | AG38: 119742890 | AH38: 568412466 | AI38: 524954776 | AJ38: 12972937 | AK38: 30484753 | AL38: 568412466 | AM38: 24797063 | AN38: 37240 | AO38: 1862309 | AP38: 296397 | AQ38: 26993009 | AR38: =RC[-30]+RC[-29] -> 0 | AS38: =RC[-24]/RC[-23] -> 0 | AT38: =RC[-12]/RC[-23] -> 279.951667532672 | AU38: =RC[-27]/RC[-43] -> 0 | AV38: =RC[-26]/RC[-44] -> 118764.30399011 | AW38: =RC[-42]/RC[-45] -> 36954.6851720971 | AX38: =SUM(RC[-43]:RC[-37])/RC[-46] -> 37028.9633297954 | AY38: =RC[-39]/RC[-47] -> 0
A39: 'New Zealand | B39: 'World - A | C39: 'C71 | D39: =RC[+19]/1000 -> 169.557 | E39: 0 | F39: 0 | G39: 0 | H39: 0 | I39: 0 | J39: 0 | K39: 0 | L39: 0 | M39: 0 | N39: 0 | O39: 0 | P39: 0 | Q39: 0 | R39: 0 | S39: 0 | T39: 0 | U39: 0 | V39: 0 | W39: 169557 | X39: 0 | Y39: 0 | Z39: 0 | AA39: 0 | AB39: 0 | AC39: 0 | AD39: 0 | AE39: 0 | AF39: 0 | AG39: 0 | AH39: 0 | AI39: 0 | AJ39: 0 | AK39: 0 | AL39: 0 | AM39: 0 | AN39: 0 | AO39: 0 | AP39: 0 | AQ39: 0 | AR39: =RC[-30]+RC[-29] -> 0 | AS39: =RC[-24]/RC[-23] -> #NUM! | AT39: =RC[-12]/RC[-23] -> 0 | AU39: =RC[-27]/RC[-43] -> 0 | AV39: =RC[-26]/RC[-44] -> 0 | AW39: =RC[-42]/RC[-45] -> 0 | AX39: =SUM(RC[-43]:RC[-37])/RC[-46] -> 0 | AY39: =RC[-39]/RC[-47] -> 0
A40: 'Mexico | B40: 'World - B | C40: 'C72 | D40: =RC[+19]/1000 -> 1492.176 | E40: 0 | F40: 0 | G40: 0 | H40: 0 | I40: 0 | J40: 0 | K40: 0 | L40: 0 | M40: 0 | N40: 0 | O40: 0 | P40: 0 | Q40: 0 | R40: 0 | S40: 0 | T40: 0 | U40: 0 | V40: 0 | W40: 1492176 | X40: 0 | Y40: 0 | Z40: 0 | AA40: 0 | AB40: 0 | AC40: 0 | AD40: 0 | AE40: 0 | AF40: 0 | AG40: 0 | AH40: 0 | AI40: 0 | AJ40: 0 | AK40: 0 | AL40: 0 | AM40: 0 | AN40: 0 | AO40: 0 | AP40: 0 | AQ40: 0 | AR40: =RC[-30]+RC[-29] -> 0 | AS40: =RC[-24]/RC[-23] -> #NUM! | AT40: =RC[-12]/RC[-23] -> 0 | AU40: =RC[-27]/RC[-43] -> 0 | AV40: =RC[-26]/RC[-44] -> 0 | AW40: =RC[-42]/RC[-45] -> 0 | AX40: =SUM(RC[-43]:RC[-37])/RC[-46] -> 0 | AY40: =RC[-39]/RC[-47] -> 0
A41: 'CEE - Total | B41: 'Totals | D41: =RC[+19]/1000 -> 2302 | E41: 921 | F41: 3718 | G41: 132732653 | H41: 1145851 | I41: 1168610 | J41: 1959414 | K41: 8714290 | L41: 814915 | M41: 87471 | N41: 4173385 | O41: 91402 | P41: 7 | Q41: 25 | R41: 5834 | S41: 2539 | T41: 2507027 | U41: 54183722 | V41: 36866946 | W41: 2302000 | X41: 11456 | Y41: 4264 | Z41: 15720 | AA41: 30931712 | AB41: 43202822 | AC41: 615631 | AD41: 1734214 | AE41: 1053527 | AF41: 4709161 | AG41: 13760127 | AH41: 96007192 | AI41: 72507375 | AJ41: 2272901 | AK41: 20265779 | AL41: 95046065 | AM41: 14195148 | AN41: 0 | AO41: 850369 | AP41: 167740 | AQ41: 15213260 | AR41: =RC[-30]+RC[-29] -> 4264787 | AS41: =RC[-24]/RC[-23] -> 1.46971007579527 | AT41: =RC[-12]/RC[-23] -> 41.7059913119027 | AU41: =RC[-27]/RC[-43] -> 1089.06472632493 | AV41: =RC[-26]/RC[-44] -> 16015.180712424 | AW41: =RC[-42]/RC[-45] -> 57659.7102519548 | AX41: =SUM(RC[-43]:RC[-37])/RC[-46] -> 63693.8331885317 | AY41: =RC[-39]/RC[-47] -> 354.003040834057
A42: 'EU - Total | B42: 'Totals | D42: =RC[+19]/1000 -> 12606.797 | E42: 3208 | F42: 6380 | G42: 472421959 | H42: 2717982 | I42: 3801024 | J42: 1743680 | K42: 72921512 | L42: 9834253 | M42: 403338 | N42: 14772422 | O42: 667490 | P42: 570 | Q42: 797 | R42: 152722 | S42: 79121 | T42: 14140359 | U42: 205193236 | V42: 404448544 | W42: 12606797 | X42: 24490 | Y42: 19985 | Z42: 44390 | AA42: 1307779703 | AB42: 794221645 | AC42: 57367844 | AD42: 1459793 | AE42: 9052575 | AF42: 26028702 | AG42: 310371177 | AH42: 2506281437 | AI42: 2080162445 | AJ42: 101137418 | AK42: 222993859 | AL42: 2404293725 | AM42: 67383686 | AN42: 1008600 | AO42: 3390366 | AP42: 22296403 | AQ42: 94079054 | AR42: =RC[-30]+RC[-29] -> 15439912 | AS42: =RC[-24]/RC[-23] -> 0.507340770646958 | AT42: =RC[-12]/RC[-23] -> 198.803981455401 | AU42: =RC[-27]/RC[-43] -> 1121.64564877185 | AV42: =RC[-26]/RC[-44] -> 32081.7844532596 | AW42: =RC[-42]/RC[-45] -> 37473.5913491746 | AX42: =SUM(RC[-43]:RC[-37])/RC[-46] -> 44725.3769534006 | AY42: =RC[-39]/RC[-47] -> 780.075462466795
A43: 'EFTA - Total | B43: 'Totals | D43: =RC[+19]/1000 -> 365 | E43: 243 | F43: 549 | G43: 30924365 | H43: 210715 | I43: 279662 | J43: 108309 | K43: 1285048 | L43: 312205 | M43: 23211 | N43: 872048 | O43: 17075 | P43: 22 | Q43: 30 | R43: 2991 | S43: 1159 | T43: 332547 | U43: 7989869 | V43: 10746344 | W43: 365000 | X43: 1560 | Y43: 868 | Z43: 2428 | AA43: 64431009 | AB43: 33252750 | AC43: 0 | AD43: 0 | AE43: 0 | AF43: 0 | AG43: 19993268 | AH43: 117677025 | AI43: 112102195 | AJ43: 5574832 | AK43: 0 | AL43: 117677025 | AM43: 3530457 | AN43: 54960 | AO43: 207249 | AP43: 665511 | AQ43: 4458177 | AR43: =RC[-30]+RC[-29] -> 889123 | AS43: =RC[-24]/RC[-23] -> 0.743496485874638 | AT43: =RC[-12]/RC[-23] -> 322.402808219178 | AU43: =RC[-27]/RC[-43] -> 911.087671232877 | AV43: =RC[-26]/RC[-44] -> 29442.0383561644 | AW43: =RC[-42]/RC[-45] -> 84724.2876712329 | AX43: =SUM(RC[-43]:RC[-37])/RC[-46] -> 90804.1506849315 | AY43: =RC[-39]/RC[-47] -> 855.356164383562
A44: 'World A - Total | B44: 'Totals | D44: =RC[+19]/1000 -> 25532.161 | E44: 8277 | F44: 14302 | G44: 1442024909 | H44: 9563506 | I44: 11934892 | J44: 8727610 | K44: 1374967028 | L44: 122512732 | M44: 4522442 | N44: 42104246 | O44: 4281006 | P44: 36 | Q44: 54 | R44: 151587 | S44: 53281 | T44: 14000859 | U44: 308289410 | V44: 356095263 | W44: 25532161 | X44: 47154 | Y44: 87714 | Z44: 138471 | AA44: 3368504691 | AB44: 3159813067 | AC44: 4759983 | AD44: 176703 | AE44: 1664152 | AF44: 3433611 | AG44: 877873504 | AH44: 7416225709 | AI44: 6513727492 | AJ44: 288463914 | AK44: 605389809 | AL44: 7407581239 | AM44: 233811586 | AN44: 3290975 | AO44: 14132145 | AP44: 39696849 | AQ44: 290931555 | AR44: =RC[-30]+RC[-29] -> 46385252 | AS44: =RC[-24]/RC[-23] -> 0.865749820434988 | AT44: =RC[-12]/RC[-23] -> 290.466040418592 | AU44: =RC[-27]/RC[-43] -> 548.36169175026 | AV44: =RC[-26]/RC[-44] -> 13946.9300307169 | AW44: =RC[-42]/RC[-45] -> 56478.7645276089 | AX44: =SUM(RC[-43]:RC[-37])/RC[-46] -> 116490.457623231 | AY44: =RC[-39]/RC[-47] -> 4798.36908438733
A45: 'World B - Total | B45: 'Totals | D45: =RC[+19]/1000 -> 2511.957 | E45: 404 | F45: 495 | G45: 39127601 | H45: 254526 | I45: 343668 | J45: 232280 | K45: 27338657 | L45: 2504638 | M45: 93433 | N45: 1186903 | O45: 95485 | P45: 22 | Q45: 30 | R45: 49718 | S45: 17743 | T45: 4591924 | U45: 93952846 | V45: 84887696 | W45: 2511957 | X45: 1498 | Y45: 2242 | Z45: 3740 | AA45: 5961000 | AB45: 8404965 | AC45: 61348 | AD45: 333227 | AE45: 203058 | AF45: 907653 | AG45: 2615022 | AH45: 18486274 | AI45: 13977573 | AJ45: 429200 | AK45: 3919005 | AL45: 18325778 | AM45: 2804929 | AN45: 0 | AO45: 143346 | AP45: 33669 | AQ45: 2981944 | AR45: =RC[-30]+RC[-29] -> 1282388 | AS45: =RC[-24]/RC[-23] -> 1.1067899168803 | AT45: =RC[-12]/RC[-23] -> 7.3593114850294 | AU45: =RC[-27]/RC[-43] -> 1828.02651478509 | AV45: =RC[-26]/RC[-44] -> 33793.4510821642 | AW45: =RC[-42]/RC[-45] -> 15576.5409200874 | AX45: =SUM(RC[-43]:RC[-37])/RC[-46] -> 27824.840552605 | AY45: =RC[-39]/RC[-47] -> 997.086335474692
A46: 'EU Accession Countries - Totals | B46: 'Totals | D46: =RC[+19]/1000 -> 1616.781 | E46: 654 | F46: 2938 | G46: 94939747 | H46: 863034 | I46: 884767 | J46: 1530290 | K46: 7864730 | L46: 494258 | M46: 73277 | N46: 3085998 | O46: 75819 | P46: 7 | Q46: 25 | R46: 4468 | S46: 2028 | T46: 1852486 | U46: 37348465 | V46: 26594292 | W46: 1616781 | X46: 8435 | Y46: 2996 | Z46: 11431 | AA46: 26359480 | AB46: 35378159 | AC46: 566828 | AD46: 1407401 | AE46: 853073 | AF46: 3829161 | AG46: 11353938 | AH46: 79748040 | AI46: 60810581 | AJ46: 2047968 | AK46: 15906170 | AL46: 78764727 | AM46: 11172512 | AN46: 1893 | AO46: 696811 | AP46: 160209 | AQ46: 12031428 | AR46: =RC[-30]+RC[-29] -> 3161817 | AS46: =RC[-24]/RC[-23] -> 1.40437899230406 | AT46: =RC[-12]/RC[-23] -> 49.3251961768477 | AU46: =RC[-27]/RC[-43] -> 1145.78659694789 | AV46: =RC[-26]/RC[-44] -> 16448.9142314265 | AW46: =RC[-42]/RC[-45] -> 58721.4638222493 | AX46: =SUM(RC[-43]:RC[-37])/RC[-46] -> 65964.4707601091 | AY46: =RC[-39]/RC[-47] -> 305.704977977846

Sheet: 1999
A1: 'Name | B1: 'Type | C1: 'Code | D1: 'Population '000s | E1: 'Libraries - Total Administrative Units | F1: 'Libraries - Service Points | G1: 'Collections - Books & Bound Periodicals | H1: 'Collections - Current Periodicals - Titles | I1: 'Collections - Current Periodicals - Subscriptions | J1: 'Collections - Manuscripts | K1: 'Collections - Microforms | L1: 'Collections - Audio-visual Materials | M1: 'Collections - CD-ROMs | N1: 'Additions - Books & Bound Periodicals | O1: 'Additions - Audio-visual Materials | P1: 'Facilities & Services - Percentage Stock on Open Access | Q1: 'Facilities & Services - Percentage Catalogue Records Automated | R1: 'Facilities & Services - Number of Workstations for users | S1: 'Facilities & Services - Number connected to the internet | T1: 'Use & Users - Registered Users | U1: 'Use & Users - Consultations | V1: 'Use & Users - Number of Visits | W1: 'Use & Users - Potential Total Population Served | X1: 'Library Staff FTE - Trained Librarians | Y1: 'Library Staff FTE - Other Library Staff | Z1: 'Library Staff FTE - Total Staff | AA1: 'Recurrent Expenditure (Euros) - Staff | AB1: 'Recurrent Expenditure (Euros) - Acquisition of Stock | AC1: 'Recurrent Expenditure (Euros) - Electronic Information | AD1: 'Recurrent Expenditure (Euros) - Automation | AE1: 'Recurrent Expenditure (Euros) - Premises and Related Costs | AF1: 'Recurrent Expenditure (Euros) - New Buildings / Refurbishment | AG1: 'Recurrent Expenditure (Euros) - Other Expenditure | AH1: 'Recurrent Expenditure (Euros) - TOTAL EXPENDITURE | AI1: 'Income - Public Funding | AJ1: 'Income - Fees & Charges | AK1: 'Income - Other Income | AL1: 'Income - TOTAL INCOME | AM1: 'Capital Expenditure - New Buildings / Refurbishment | AN1: 'Capital Expenditure - Acquisition of Stock | AO1: 'Capital Expenditure - Automation | AP1: 'Capital Expenditure - Other Capital Expenditure | AQ1: 'Capital Expenditure - TOTAL CAPITAL PAYMENTS | AR1: 'Additions | AS1: 'Loans per visit | AT1: 'Cost per pop | AU1: 'Users per 1000 pop | AV1: 'visits per 1000 pop | AW1: 'Bookstock per 1000 pop | AX1: 'Total stock per 1000 pop | AY1: 'AV materials per 1000 pop
A2: 'Bulgaria | B2: 'CEE | C2: 'C1 | D2: =RC[+19]/1000 -> 289 | E2: 90 | F2: 90 | G2: 8451195 | H2: 8632 | K2: 23913 | L2: 80488 | N2: 161926 | O2: 1599 | T2: 207639 | U2: 5304114 | V2: 2916446 | W2: 289000 | X2: 495 | Y2: 371 | Z2: 866 | AA2: 944064 | AB2: 1357884 | AC2: 0 | AD2: 0 | AE2: 0 | AF2: 0 | AG2: 167145 | AH2: 2469093 | AI2: 1751400 | AJ2: 213616 | AK2: 523579 | AL2: 2488595 | AR2: =RC[-30]+RC[-29] -> 163525 | AS2: =RC[-24]/RC[-23] -> 1.81869096839098 | AT2: =RC[-12]/RC[-23] -> 8.54357439446367 | AU2: =RC[-27]/RC[-43] -> 718.474048442907 | AV2: =RC[-26]/RC[-44] -> 10091.508650519 | AW2: =RC[-42]/RC[-45] -> 29242.8892733564 | AX2: =SUM(RC[-43]:RC[-37])/RC[-46] -> #EMPTY! | AY2: =RC[-39]/RC[-47] -> 278.505190311419
A3: 'Czech Republic | B3: 'CEE | C3: 'C2 | D3: =RC[+19]/1000 -> 192 | E3: 76 | F3: 1163 | G3: 10096576 | H3: 21423 | J3: 40947 | K3: 13753 | L3: 36842 | N3: 206714 | O3: 2468 | T3: 231560 | U3: 2140444 | V3: 4109027 | W3: 192000 | X3: 379 | Y3: 358 | Z3: 737 | AB3: 3475691 | AR3: =RC[-30]+RC[-29] -> 209182 | AS3: =RC[-24]/RC[-23] -> 0.520912615078947 | AT3: =RC[-12]/RC[-23] -> #EMPTY! | AU3: =RC[-27]/RC[-43] -> 1206.04166666667 | AV3: =RC[-26]/RC[-44] -> 21401.1822916667 | AW3: =RC[-42]/RC[-45] -> 52586.3333333333 | AX3: =SUM(RC[-43]:RC[-37])/RC[-46] -> #EMPTY! | AY3: =RC[-39]/RC[-47] -> 191.885416666667
A4: 'Estonia | B4: 'CEE | C4: 'C3 | D4: =RC[+19]/1000 -> 48 | E4: 19 | F4: 36 | G4: 7392179 | H4: 11621 | I4: 18514 | J4: 68736 | K4: 29204 | L4: 32888 | M4: 3296 | N4: 104181 | O4: 2704 | P4: 4 | Q4: 10 | R4: 103 | S4: 81 | T4: 75122 | U4: 1998782 | V4: 1823352 | W4: 48000 | X4: 524 | Y4: 114 | Z4: 638 | AA4: 2211295 | AB4: 1675271 | AC4: 323860 | AD4: 91954 | AE4: 479378 | AF4: 0 | AG4: 59038 | AH4: 4840795 | AI4: 5215571 | AJ4: 0 | AK4: 322314 | AL4: 5537885 | AM4: 690916 | AN4: 0 | AO4: 0 | AP4: 127867 | AQ4: 818783 | AR4: =RC[-30]+RC[-29] -> 106885 | AS4: =RC[-24]/RC[-23] -> 1.09621290897205 | AT4: =RC[-12]/RC[-23] -> 100.849895833333 | AU4: =RC[-27]/RC[-43] -> 1565.04166666667 | AV4: =RC[-26]/RC[-44] -> 37986.5 | AW4: =RC[-42]/RC[-45] -> 154003.729166667 | AX4: =SUM(RC[-43]:RC[-37])/RC[-46] -> 157425.791666667 | AY4: =RC[-39]/RC[-47] -> 685.166666666667
A5: 'Hungary | B5: 'CEE | C5: 'C4 | D5: =RC[+19]/1000 -> 214 | E5: 96 | F5: 273 | G5: 14307557 | H5: 24539 | J5: 695944 | K5: 3688597 | L5: 123091 | M5: 4196 | N5: 327826 | O5: 6661 | T5: 284010 | U5: 4597282 | V5: 3758974 | W5: 214000 | X5: 702 | Y5: 336 | Z5: 1038 | AA5: 2519201 | AB5: 5894215 | AC5: 31697 | AD5: 168949 | AE5: 231864 | AF5: 468953 | AG5: 375832 | AH5: 9690711 | AI5: 8357649 | AJ5: 318802 | AK5: 221952 | AL5: 8898404 | AR5: =RC[-30]+RC[-29] -> 334487 | AS5: =RC[-24]/RC[-23] -> 1.22301510997416 | AT5: =RC[-12]/RC[-23] -> 45.2836962616822 | AU5: =RC[-27]/RC[-43] -> 1327.14953271028 | AV5: =RC[-26]/RC[-44] -> 17565.2990654206 | AW5: =RC[-42]/RC[-45] -> 66857.7429906542 | AX5: =SUM(RC[-43]:RC[-37])/RC[-46] -> #EMPTY! | AY5: =RC[-39]/RC[-47] -> 575.191588785047
A6: 'Latvia | B6: 'CEE | C6: 'C5 | D6: =RC[+19]/1000 -> 61 | E6: 26 | F6: 26 | G6: 4745097 | J6: 21773 | L6: 1872 | N6: 128323 | T6: 73197 | U6: 3268260 | V6: 1309129 | W6: 61000 | X6: 341 | Y6: 21 | Z6: 362 | AA6: 670779 | AB6: 443119 | AC6: 0 | AD6: 0 | AE6: 0 | AF6: 0 | AG6: 157641 | AH6: 1271539 | AI6: 1103919 | AJ6: 32605 | AK6: 135015 | AL6: 1271539 | AM6: 671168 | AN6: 0 | AO6: 0 | AP6: 124212 | AQ6: 795380 | AR6: =RC[-30]+RC[-29] -> #EMPTY! | AS6: =RC[-24]/RC[-23] -> 2.49651485835239 | AT6: =RC[-12]/RC[-23] -> 20.8449016393443 | AU6: =RC[-27]/RC[-43] -> 1199.95081967213 | AV6: =RC[-26]/RC[-44] -> 21461.131147541 | AW6: =RC[-42]/RC[-45] -> 77788.4754098361 | AX6: =SUM(RC[-43]:RC[-37])/RC[-46] -> #EMPTY! | AY6: =RC[-39]/RC[-47] -> 30.6885245901639
A7: 'Lithuania | B7: 'CEE | C7: 'C6 | D7: =RC[+19]/1000 -> 97 | E7: 15 | F7: 106 | G7: 12290866 | H7: 5204 | I7: 5243 | J7: 245500 | K7: 27000 | L7: 3617 | M7: 2085 | N7: 181398 | O7: 590 | P7: 4 | Q7: 5 | R7: 249 | S7: 249 | T7: 97636 | U7: 7225817 | V7: 3174874 | W7: 97000 | X7: 585 | Y7: 89 | Z7: 674 | AA7: 1462972 | AB7: 295648 | AC7: 0 | AD7: 0 | AE7: 0 | AF7: 0 | AG7: 374065 | AH7: 2132685 | AI7: 1874136 | AJ7: 44290 | AK7: 208505 | AL7: 2126931 | AR7: =RC[-30]+RC[-29] -> 181988 | AS7: =RC[-24]/RC[-23] -> 2.27593819471261 | AT7: =RC[-12]/RC[-23] -> 21.9864432989691 | AU7: =RC[-27]/RC[-43] -> 1006.55670103093 | AV7: =RC[-26]/RC[-44] -> 32730.6597938144 | AW7: =RC[-42]/RC[-45] -> 126709.958762887 | AX7: =SUM(RC[-43]:RC[-37])/RC[-46] -> 129685.721649485 | AY7: =RC[-39]/RC[-47] -> 37.2886597938144
A8: 'Poland | B8: 'CEE | C8: 'C7 | D8: =RC[+19]/1000 -> 796 | E8: 0 | F8: 0 | G8: 0 | H8: 0 | I8: 0 | J8: 0 | K8: 0 | L8: 0 | M8: 0 | N8: 0 | O8: 0 | P8: 0 | Q8: 0 | R8: 0 | S8: 0 | T8: 0 | U8: 0 | V8: 0 | W8: 796000 | X8: 0 | Y8: 0 | Z8: 0 | AA8: 0 | AB8: 0 | AC8: 0 | AD8: 0 | AE8: 0 | AF8: 0 | AG8: 0 | AH8: 0 | AI8: 0 | AJ8: 0 | AK8: 0 | AL8: 0 | AM8: 0 | AN8: 0 | AO8: 0 | AP8: 0 | AQ8: 0 | AR8: =RC[-30]+RC[-29] -> 0 | AS8: =RC[-24]/RC[-23] -> #NUM! | AT8: =RC[-12]/RC[-23] -> 0 | AU8: =RC[-27]/RC[-43] -> 0 | AV8: =RC[-26]/RC[-44] -> 0 | AW8: =RC[-42]/RC[-45] -> 0 | AX8: =SUM(RC[-43]:RC[-37])/RC[-46] -> 0 | AY8: =RC[-39]/RC[-47] -> 0
A9: 'Romania | B9: 'CEE | C9: 'C8 | D9: =RC[+19]/1000 -> 438 | E9: 0 | F9: 0 | G9: 0 | H9: 0 | I9: 0 | J9: 0 | K9: 0 | L9: 0 | M9: 0 | N9: 0 | O9: 0 | P9: 0 | Q9: 0 | R9: 0 | S9: 0 | T9: 0 | U9: 0 | V9: 0 | W9: 438000 | X9: 0 | Y9: 0 | Z9: 0 | AA9: 0 | AB9: 0 | AC9: 0 | AD9: 0 | AE9: 0 | AF9: 0 | AG9: 0 | AH9: 0 | AI9: 0 | AJ9: 0 | AK9: 0 | AL9: 0 | AM9: 0 | AN9: 0 | AO9: 0 | AP9: 0 | AQ9: 0 | AR9: =RC[-30]+RC[-29] -> 0 | AS9: =RC[-24]/RC[-23] -> #NUM! | AT9: =RC[-12]/RC[-23] -> 0 | AU9: =RC[-27]/RC[-43] -> 0 | AV9: =RC[-26]/RC[-44] -> 0 | AW9: =RC[-42]/RC[-45] -> 0 | AX9: =SUM(RC[-43]:RC[-37])/RC[-46] -> 0 | AY9: =RC[-39]/RC[-47] -> 0
A10: 'Slovak Rep | B10: 'CEE | C10: 'C9 | D10: =RC[+19]/1000 -> 112 | E10: 44 | F10: 571 | G10: 3894219 | H10: 6659 | I10: 8832 | J10: 0 | K10: 0 | L10: 0 | M10: 915 | N10: 80408 | O10: 395 | P10: 0 | Q10: 0 | R10: 226 | S10: 69 | T10: 131577 | U10: 2413614 | V10: 733756 | W10: 112000 | X10: 396 | Y10: 68 | Z10: 464 | AA10: 866104 | AB10: 668220 | AC10: 73024 | AD10: 141192 | AE10: 54801 | AF10: 1080397 | AG10: 106741 | AH10: 2990479 | AI10: 2588412 | AJ10: 28353 | AK10: 286533 | AL10: 2903299 | AM10: 213803 | AN10: 0 | AO10: 132102 | AP10: 0 | AQ10: 345905 | AR10: =RC[-30]+RC[-29] -> 80803 | AS10: =RC[-24]/RC[-23] -> 3.28939592998217 | AT10: =RC[-12]/RC[-23] -> 26.7007053571429 | AU10: =RC[-27]/RC[-43] -> 1174.79464285714 | AV10: =RC[-26]/RC[-44] -> 6551.39285714286 | AW10: =RC[-42]/RC[-45] -> 34769.8125 | AX10: =SUM(RC[-43]:RC[-37])/RC[-46] -> 34916.2946428571 | AY10: =RC[-39]/RC[-47] -> 0
A11: 'Slovenia | B11: 'CEE | C11: 'C10 | D11: =RC[+19]/1000 -> 55 | E11: 54 | F11: 54 | G11: 3486062 | H11: 14459 | I11: 12092 | J11: 0 | K11: 0 | L11: 0 | M11: 0 | N11: 113965 | O11: 13712 | P11: 0 | Q11: 44 | R11: 218 | S11: 208 | T11: 126886 | U11: 3253613 | V11: 1698891 | W11: 55000 | X11: 256 | Y11: 106 | Z11: 362 | AA11: 764138 | AB11: 4685441 | AC11: 12463 | AD11: 66428 | AE11: 91165 | AF11: 184385 | AG11: 3316458 | AH11: 9120478 | AI11: 7918176 | AJ11: 233869 | AK11: 968432 | AL11: 9120478 | AM11: 0 | AN11: 0 | AO11: 0 | AP11: 0 | AQ11: 0 | AR11: =RC[-30]+RC[-29] -> 127677 | AS11: =RC[-24]/RC[-23] -> 1.91513934678564 | AT11: =RC[-12]/RC[-23] -> 165.826872727273 | AU11: =RC[-27]/RC[-43] -> 2307.01818181818 | AV11: =RC[-26]/RC[-44] -> 30888.9272727273 | AW11: =RC[-42]/RC[-45] -> 63382.9454545455 | AX11: =SUM(RC[-43]:RC[-37])/RC[-46] -> 63865.6909090909 | AY11: =RC[-39]/RC[-47] -> 0
A12: 'Austria | B12: 'EU | C12: 'C11 | D12: =RC[+19]/1000 -> 269 | E12: 0 | F12: 0 | G12: 0 | H12: 0 | I12: 0 | J12: 0 | K12: 0 | L12: 0 | M12: 0 | N12: 0 | O12: 0 | P12: 0 | Q12: 0 | R12: 0 | S12: 0 | T12: 0 | U12: 0 | V12: 0 | W12: 269000 | X12: 0 | Y12: 0 | Z12: 0 | AA12: 0 | AB12: 0 | AC12: 0 | AD12: 0 | AE12: 0 | AF12: 0 | AG12: 0 | AH12: 0 | AI12: 0 | AJ12: 0 | AK12: 0 | AL12: 0 | AM12: 0 | AN12: 0 | AO12: 0 | AP12: 0 | AQ12: 0 | AR12: =RC[-30]+RC[-29] -> 0 | AS12: =RC[-24]/RC[-23] -> #NUM! | AT12: =RC[-12]/RC[-23] -> 0 | AU12: =RC[-27]/RC[-43] -> 0 | AV12: =RC[-26]/RC[-44] -> 0 | AW12: =RC[-42]/RC[-45] -> 0 | AX12: =SUM(RC[-43]:RC[-37])/RC[-46] -> 0 | AY12: =RC[-39]/RC[-47] -> 0
A13: 'België Nederlandstalige Universiteiten | B13: 'België Nederlandstalige Universiteiten | C13: 'C12a | D13: =RC[+19]/1000 -> 0 | E13: 0 | F13: 0 | G13: 0 | H13: 0 | I13: 0 | J13: 0 | K13: 0 | L13: 0 | M13: 0 | N13: 0 | O13: 0 | P13: 0 | Q13: 0 | R13: 0 | S13: 0 | T13: 0 | U13: 0 | V13: 0 | W13: 0 | X13: 0 | Y13: 0 | Z13: 0 | AA13: 0 | AB13: 0 | AC13: 0 | AD13: 0 | AE13: 0 | AF13: 0 | AG13: 0 | AH13: 0 | AI13: 0 | AJ13: 0 | AK13: 0 | AL13: 0 | AM13: 0 | AN13: 0 | AO13: 0 | AP13: 0 | AQ13: 0 | AR13: 0 | AS13: =RC[-24]/RC[-23] -> #NUM! | AT13: =RC[-12]/RC[-23] -> #NUM! | AU13: =RC[-27]/RC[-43] -> #NUM! | AV13: =RC[-26]/RC[-44] -> #NUM! | AW13: =RC[-42]/RC[-45] -> #NUM! | AX13: =SUM(RC[-43]:RC[-37])/RC[-46] -> #NUM! | AY13: =RC[-39]/RC[-47] -> #NUM!
A14: 'Belgique universités francophones | B14: 'Belgique universités francophones | C14: 'C12b | D14: =RC[+19]/1000 -> 0 | E14: 0 | F14: 0 | G14: 0 | H14: 0 | I14: 0 | J14: 0 | K14: 0 | L14: 0 | M14: 0 | N14: 0 | O14: 0 | P14: 0 | Q14: 0 | R14: 0 | S14: 0 | T14: 0 | U14: 0 | V14: 0 | W14: 0 | X14: 0 | Y14: 0 | Z14: 0 | AA14: 0 | AB14: 0 | AC14: 0 | AD14: 0 | AE14: 0 | AF14: 0 | AG14: 0 | AH14: 0 | AI14: 0 | AJ14: 0 | AK14: 0 | AL14: 0 | AM14: 0 | AN14: 0 | AO14: 0 | AP14: 0 | AQ14: 0 | AR14: 0 | AS14: =RC[-24]/RC[-23] -> #NUM! | AT14: =RC[-12]/RC[-23] -> #NUM! | AU14: =RC[-27]/RC[-43] -> #NUM! | AV14: =RC[-26]/RC[-44] -> #NUM! | AW14: =RC[-42]/RC[-45] -> #NUM! | AX14: =SUM(RC[-43]:RC[-37])/RC[-46] -> #NUM! | AY14: =RC[-39]/RC[-47] -> #NUM!
A15: 'Belgium | B15: 'EU | C15: 'C12 | D15: =RC[+19]/1000 -> 163 | E15: 72 | F15: 40 | G15: 14483585 | H15: 53955 | I15: 23379 | J15: 8400 | K15: 273755 | L15: 12383 | M15: 1616 | N15: 371939 | O15: 849 | P15: 42 | Q15: 54 | R15: 628 | S15: 0 | T15: 187168 | U15: 967585 | V15: 4410532 | W15: 163000 | X15: 203 | Y15: 345 | Z15: 548 | AA15: 6734760 | AB15: 5372958 | AC15: 994934 | AD15: 565360 | AE15: 805626 | AF15: 0 | AG15: 464313 | AH15: 14937952 | AI15: 9302488 | AJ15: 58289 | AK15: 350114 | AL15: 9710891 | AM15: 0 | AN15: 34879 | AO15: 131529 | AP15: 11831 | AQ15: 178239 | AR15: =RC[-30]+RC[-29] -> 372788 | AS15: =RC[-24]/RC[-23] -> 0.219380564521468 | AT15: =RC[-12]/RC[-23] -> 91.6438773006135 | AU15: =RC[-27]/RC[-43] -> 1148.26993865031 | AV15: =RC[-26]/RC[-44] -> 27058.4785276074 | AW15: =RC[-42]/RC[-45] -> 88856.3496932515 | AX15: =SUM(RC[-43]:RC[-37])/RC[-46] -> 91147.6871165644 | AY15: =RC[-39]/RC[-47] -> 75.9693251533742
A16: 'Denmark | B16: 'EU | C16: 'C13 | D16: =RC[+19]/1000 -> 180 | E16: 19 | F16: 41 | G16: 9494806 | H16: 0 | I16: 95229 | J16: 84455 | K16: 1182593 | L16: 873270 | M16: 22708 | N16: 236147 | O16: 26039 | P16: 0 | Q16: 0 | R16: 845 | S16: 0 | T16: 0 | U16: 4617998 | V16: 0 | W16: 180000 | X16: 392 | Y16: 431 | Z16: 823 | AA16: 36569403 | AB16: 17082078 | AC16: 652812 | AD16: 34272 | AE16: 322765 | AF16: 0 | AG16: 11428122 | AH16: 66089451 | AI16: 60943568 | AJ16: 1948770 | AK16: 3197113 | AL16: 66089451 | AM16: 3354185 | AN16: 0 | AO16: 0 | AP16: 0 | AQ16: 3354185 | AR16: =RC[-30]+RC[-29] -> 262186 | AS16: =RC[-24]/RC[-23] -> #NUM! | AT16: =RC[-12]/RC[-23] -> 367.163616666667 | AU16: =RC[-27]/RC[-43] -> 0 | AV16: =RC[-26]/RC[-44] -> 0 | AW16: =RC[-42]/RC[-45] -> 52748.9222222222 | AX16: =SUM(RC[-43]:RC[-37])/RC[-46] -> 65294.7833333333 | AY16: =RC[-39]/RC[-47] -> 4851.5
A17: 'Eire | B17: 'EU | C17: 'C15 | D17: =RC[+19]/1000 -> 137 | E17: 0 | F17: 0 | G17: 0 | H17: 0 | I17: 0 | J17: 0 | K17: 0 | L17: 0 | M17: 0 | N17: 0 | O17: 0 | P17: 0 | Q17: 0 | R17: 0 | S17: 0 | T17: 0 | U17: 0 | V17: 0 | W17: 137000 | X17: 0 | Y17: 0 | Z17: 0 | AA17: 0 | AB17: 0 | AC17: 0 | AD17: 0 | AE17: 0 | AF17: 0 | AG17: 0 | AH17: 0 | AI17: 0 | AJ17: 0 | AK17: 0 | AL17: 0 | AM17: 0 | AN17: 0 | AO17: 0 | AP17: 0 | AQ17: 0 | AR17: =RC[-30]+RC[-29] -> 0 | AS17: =RC[-24]/RC[-23] -> #NUM! | AT17: =RC[-12]/RC[-23] -> 0 | AU17: =RC[-27]/RC[-43] -> 0 | AV17: =RC[-26]/RC[-44] -> 0 | AW17: =RC[-42]/RC[-45] -> 0 | AX17: =SUM(RC[-43]:RC[-37])/RC[-46] -> 0 | AY17: =RC[-39]/RC[-47] -> 0
A18: 'Finland | B18: 'EU | C18: 'C16 | D18: =RC[+19]/1000 -> 224 | E18: 38 | F18: 398 | G18: 14902315 | H18: 143624 | I18: 233525 | J18: 229973 | K18: 1263072 | L18: 285095 | M18: 0 | N18: 577131 | O18: 10654 | P18: 45 | Q18: 0 | R18: 0 | S18: 0 | T18: 0 | U18: 10397428 | V18: 12820317 | W18: 224000 | X18: 1165 | Y18: 142 | Z18: 1307 | AA18: 31900079 | AB18: 18078830 | AC18: 0 | AD18: 0 | AE18: 0 | AF18: 1113881 | AG18: 8121853 | AH18: 59214643 | AI18: 47882857 | AJ18: 5773971 | AK18: 4276603 | AL18: 57933431 | AM18: 0 | AN18: 0 | AO18: 0 | AP18: 0 | AQ18: 0 | AR18: =RC[-30]+RC[-29] -> 587785 | AS18: =RC[-24]/RC[-23] -> 0.811011771393796 | AT18: =RC[-12]/RC[-23] -> 264.351084821429 | AU18: =RC[-27]/RC[-43] -> 0 | AV18: =RC[-26]/RC[-44] -> 57233.5580357143 | AW18: =RC[-42]/RC[-45] -> 66528.1919642857 | AX18: =SUM(RC[-43]:RC[-37])/RC[-46] -> 76150.0178571429 | AY18: =RC[-39]/RC[-47] -> 1272.74553571429
A19: 'France | B19: 'EU | C19: 'C17 | D19: =RC[+19]/1000 -> 2278 | E19: 96 | F19: 396 | G19: 25684360 | H19: 152995 | I19: 233525 | J19: 0 | K19: 1384057 | L19: 97296 | M19: 44108 | N19: 1008519 | O19: 0 | P19: 35 | Q19: 0 | R19: 0 | S19: 0 | T19: 0 | U19: 0 | V19: 0 | W19: 2278000 | X19: 1812 | Y19: 2552 | Z19: 4364 | AA19: 146286290 | AB19: 52912745 | AC19: 5180449 | AD19: 0 | AE19: 0 | AF19: 0 | AG19: 59602689 | AH19: 263982173 | AI19: 251637535 | AJ19: 7494925 | AK19: 7201543 | AL19: 266334004 | AM19: 0 | AN19: 0 | AO19: 0 | AP19: 0 | AQ19: 0 | AR19: =RC[-30]+RC[-29] -> 1008519 | AS19: =RC[-24]/RC[-23] -> #NUM! | AT19: =RC[-12]/RC[-23] -> 115.883306848112 | AU19: =RC[-27]/RC[-43] -> 0 | AV19: =RC[-26]/RC[-44] -> 0 | AW19: =RC[-42]/RC[-45] -> 11274.9604916594 | AX19: =SUM(RC[-43]:RC[-37])/RC[-46] -> 12114.2848990342 | AY19: =RC[-39]/RC[-47] -> 42.7111501316945
A20: 'Greece | B20: 'EU | C20: 'C18 | D20: =RC[+19]/1000 -> 347 | E20: 82 | F20: 174 | G20: 5683287 | H20: 0 | I20: 36200 | J20: 29790 | K20: 25338 | L20: 22796 | M20: 10534 | N20: 296750 | O20: 1439 | P20: 36 | Q20: 49 | R20: 0 | S20: 0 | T20: 402192 | U20: 1415696 | V20: 0 | W20: 347000 | X20: 728 | Y20: 395 | Z20: 1123 | AA20: 3659885 | AB20: 13151753 | AC20: 628888 | AD20: 114432 | AE20: 0 | AF20: 856134 | AG20: 3560052 | AH20: 21971144 | AI20: 12328160 | AJ20: 9476766 | AK20: 166218 | AL20: 21971144 | AM20: 0 | AN20: 0 | AO20: 0 | AP20: 0 | AQ20: 0 | AR20: =RC[-30]+RC[-29] -> 298189 | AS20: =RC[-24]/RC[-23] -> #NUM! | AT20: =RC[-12]/RC[-23] -> 63.3174178674352 | AU20: =RC[-27]/RC[-43] -> 1159.05475504323 | AV20: =RC[-26]/RC[-44] -> 0 | AW20: =RC[-42]/RC[-45] -> 16378.34870317 | AX20: =SUM(RC[-43]:RC[-37])/RC[-46] -> 16737.5936599424 | AY20: =RC[-39]/RC[-47] -> 65.6945244956772
A21: 'Iceland | B21: 'EFTA | C21: 'C19 | D21: =RC[+19]/1000 -> 8 | E21: 0 | F21: 0 | G21: 0 | H21: 0 | I21: 0 | J21: 0 | K21: 0 | L21: 0 | M21: 0 | N21: 0 | O21: 0 | P21: 0 | Q21: 0 | R21: 0 | S21: 0 | T21: 0 | U21: 0 | V21: 0 | W21: 8000 | X21: 0 | Y21: 0 | Z21: 0 | AA21: 0 | AB21: 0 | AC21: 0 | AD21: 0 | AE21: 0 | AF21: 0 | AG21: 0 | AH21: 0 | AI21: 0 | AJ21: 0 | AK21: 0 | AL21: 0 | AM21: 0 | AN21: 0 | AO21: 0 | AP21: 0 | AQ21: 0 | AR21: =RC[-30]+RC[-29] -> 0 | AS21: =RC[-24]/RC[-23] -> #NUM! | AT21: =RC[-12]/RC[-23] -> 0 | AU21: =RC[-27]/RC[-43] -> 0 | AV21: =RC[-26]/RC[-44] -> 0 | AW21: =RC[-42]/RC[-45] -> 0 | AX21: =SUM(RC[-43]:RC[-37])/RC[-46] -> 0 | AY21: =RC[-39]/RC[-47] -> 0
A22: 'Italy | B22: 'EU | C22: 'C20 | D22: =RC[+19]/1000 -> 1852 | E22: 0 | F22: 0 | G22: 0 | H22: 0 | I22: 0 | J22: 0 | K22: 0 | L22: 0 | M22: 0 | N22: 0 | O22: 0 | P22: 0 | Q22: 0 | R22: 0 | S22: 0 | T22: 0 | U22: 0 | V22: 0 | W22: 1852000 | X22: 0 | Y22: 0 | Z22: 0 | AA22: 0 | AB22: 0 | AC22: 0 | AD22: 0 | AE22: 0 | AF22: 0 | AG22: 0 | AH22: 0 | AI22: 0 | AJ22: 0 | AK22: 0 | AL22: 0 | AM22: 0 | AN22: 0 | AO22: 0 | AP22: 0 | AQ22: 0 | AR22: =RC[-30]+RC[-29] -> 0 | AS22: =RC[-24]/RC[-23] -> #NUM! | AT22: =RC[-12]/RC[-23] -> 0 | AU22: =RC[-27]/RC[-43] -> 0 | AV22: =RC[-26]/RC[-44] -> 0 | AW22: =RC[-42]/RC[-45] -> 0 | AX22: =SUM(RC[-43]:RC[-37])/RC[-46] -> 0 | AY22: =RC[-39]/RC[-47] -> 0
A23: 'Liechtenstein | B23: 'EFTA | C23: 'C21 | D23: =RC[+19]/1000 -> 1 | E23: 0 | F23: 0 | G23: 0 | H23: 0 | I23: 0 | J23: 0 | K23: 0 | L23: 0 | M23: 0 | N23: 0 | O23: 0 | P23: 0 | Q23: 0 | R23: 0 | S23: 0 | T23: 0 | U23: 0 | V23: 0 | W23: 1000 | X23: 0 | Y23: 0 | Z23: 0 | AA23: 0 | AB23: 0 | AC23: 0 | AD23: 0 | AE23: 0 | AF23: 0 | AG23: 0 | AH23: 0 | AI23: 0 | AJ23: 0 | AK23: 0 | AL23: 0 | AM23: 0 | AN23: 0 | AO23: 0 | AP23: 0 | AQ23: 0 | AR23: =RC[-30]+RC[-29] -> 0 | AS23: =RC[-24]/RC[-23] -> #NUM! | AT23: =RC[-12]/RC[-23] -> 0 | AU23: =RC[-27]/RC[-43] -> 0 | AV23: =RC[-26]/RC[-44] -> 0 | AW23: =RC[-42]/RC[-45] -> 0 | AX23: =SUM(RC[-43]:RC[-37])/RC[-46] -> 0 | AY23: =RC[-39]/RC[-47] -> 0
A24: 'Luxembourg | B24: 'EU | C24: 'C22 | D24: =RC[+19]/1000 -> 2.999 | E24: 7 | F24: 5 | G24: 321020 | H24: 1650 | I24: 844 | J24: 10 | K24: 5 | L24: 1631 | M24: 86 | N24: 3800 | O24: 120 | P24: 78 | Q24: 49 | R24: 28 | S24: 23 | T24: 13837 | U24: 0 | V24: 0 | W24: 2999 | X24: 5 | Y24: 5 | Z24: 9 | AA24: 257427 | AB24: 205448 | AC24: 13389 | AD24: 164 | AE24: 1546 | AF24: 487 | AG24: 69331 | AH24: 547792 | AI24: 240933 | AJ24: 0 | AK24: 29629 | AL24: 270562 | AM24: 0 | AN24: 0 | AO24: 0 | AP24: 0 | AQ24: 0 | AR24: =RC[-30]+RC[-29] -> 3920 | AS24: =RC[-24]/RC[-23] -> #NUM! | AT24: =RC[-12]/RC[-23] -> 182.658219406469 | AU24: =RC[-27]/RC[-43] -> 4613.87129043014 | AV24: =RC[-26]/RC[-44] -> 0 | AW24: =RC[-42]/RC[-45] -> 107042.34744915 | AX24: =SUM(RC[-43]:RC[-37])/RC[-46] -> 108451.483827943 | AY24: =RC[-39]/RC[-47] -> 543.847949316439
A25: 'Netherlands | B25: 'EU | C25: 'C23 | D25: =RC[+19]/1000 -> 540 | E25: 23 | F25: 139 | G25: 24825096 | H25: 148011 | I25: 151734 | J25: 0 | K25: 5704333 | L25: 0 | M25: 0 | N25: 0 | O25: 0 | P25: 0 | Q25: 0 | R25: 0 | S25: 0 | T25: 0 | U25: 4082889 | V25: 0 | W25: 540000 | X25: 868 | Y25: 1002 | Z25: 1870 | AA25: 0 | AB25: 0 | AC25: 0 | AD25: 0 | AE25: 0 | AF25: 0 | AG25: 0 | AH25: 0 | AI25: 0 | AJ25: 0 | AK25: 0 | AL25: 0 | AM25: 0 | AN25: 0 | AO25: 0 | AP25: 0 | AQ25: 0 | AR25: =RC[-30]+RC[-29] -> 0 | AS25: =RC[-24]/RC[-23] -> #NUM! | AT25: =RC[-12]/RC[-23] -> 0 | AU25: =RC[-27]/RC[-43] -> 0 | AV25: =RC[-26]/RC[-44] -> 0 | AW25: =RC[-42]/RC[-45] -> 45972.4 | AX25: =SUM(RC[-43]:RC[-37])/RC[-46] -> 57091.062962963 | AY25: =RC[-39]/RC[-47] -> 0
A26: 'Norway | B26: 'EFTA | C26: 'C24 | D26: =RC[+19]/1000 -> 194 | E26: 79 | F26: 217 | G26: 12147560 | H26: 76728 | I26: 0 | J26: 46115 | K26: 481751 | L26: 103062 | M26: 0 | N26: 323651 | O26: 5250 | P26: 22 | Q26: 0 | R26: 923 | S26: 412 | T26: 0 | U26: 2683402 | V26: 4573762 | W26: 194000 | X26: 608 | Y26: 330 | Z26: 933 | AA26: 29983798 | AB26: 16678103 | AC26: 0 | AD26: 0 | AE26: 0 | AF26: 0 | AG26: 6624018 | AH26: 53285919 | AI26: 51297594 | AJ26: 1988325 | AK26: 0 | AL26: 53285919 | AM26: 0 | AN26: 0 | AO26: 0 | AP26: 0 | AQ26: 0 | AR26: =RC[-30]+RC[-29] -> 328901 | AS26: =RC[-24]/RC[-23] -> 0.586694716515639 | AT26: =RC[-12]/RC[-23] -> 274.66968556701 | AU26: =RC[-27]/RC[-43] -> 0 | AV26: =RC[-26]/RC[-44] -> 23576.0927835052 | AW26: =RC[-42]/RC[-45] -> 62616.2886597938 | AX26: =SUM(RC[-43]:RC[-37])/RC[-46] -> 66264 | AY26: =RC[-39]/RC[-47] -> 531.247422680412
A27: 'Portugal | B27: 'EU | C27: 'C25 | D27: =RC[+19]/1000 -> 325 | E27: 232 | F27: 232 | G27: 8526990 | H27: 0 | I27: 0 | J27: 14029 | K27: 47174 | L27: 150733 | M27: 0 | N27: 336724 | O27: 9457 | P27: 0 | Q27: 0 | R27: 469 | S27: 148 | T27: 1025402 | U27: 1584359 | V27: 0 | W27: 325000 | X27: 760 | Y27: 442 | Z27: 1160 | AA27: 6057533 | AB27: 9189567 | AC27: 0 | AD27: 0 | AE27: 0 | AF27: 0 | AG27: 1305686 | AH27: 16552785 | AI27: 15668525 | AJ27: 465864 | AK27: 945238 | AL27: 17079627 | AM27: 10888 | AN27: 0 | AO27: 0 | AP27: 410531 | AQ27: 421418 | AR27: =RC[-30]+RC[-29] -> 346181 | AS27: =RC[-24]/RC[-23] -> #NUM! | AT27: =RC[-12]/RC[-23] -> 50.9316461538462 | AU27: =RC[-27]/RC[-43] -> 3155.08307692308 | AV27: =RC[-26]/RC[-44] -> 0 | AW27: =RC[-42]/RC[-45] -> 26236.8923076923 | AX27: =SUM(RC[-43]:RC[-37])/RC[-46] -> 26889.0030769231 | AY27: =RC[-39]/RC[-47] -> 463.793846153846
A28: 'Spain | B28: 'EU | C28: 'C26 | D28: =RC[+19]/1000 -> 1680 | E28: 625 | F28: 1063 | G28: 27023341 | H28: 317690 | I28: 0 | J28: 43420 | K28: 1462593 | L28: 826371 | M28: 66432 | N28: 1299635 | O28: 61818 | P28: 0 | Q28: 0 | R28: 0 | S28: 0 | T28: 2977391 | U28: 14034491 | V28: 47166561 | W28: 1680000 | X28: 4487 | Y28: 1528 | Z28: 6015 | AA28: 98823361 | AB28: 62079372 | AC28: 0 | AD28: 0 | AE28: 0 | AF28: 0 | AG28: 9772710 | AH28: 170675442 | AI28: 149643265 | AJ28: 7196828 | AK28: 13835349 | AL28: 170675442 | AM28: 0 | AN28: 0 | AO28: 0 | AP28: 0 | AQ28: 0 | AR28: =RC[-30]+RC[-29] -> 1361453 | AS28: =RC[-24]/RC[-23] -> 0.297551712536345 | AT28: =RC[-12]/RC[-23] -> 101.592525 | AU28: =RC[-27]/RC[-43] -> 1772.25654761905 | AV28: =RC[-26]/RC[-44] -> 28075.3339285714 | AW28: =RC[-42]/RC[-45] -> 16085.3220238095 | AX28: =SUM(RC[-43]:RC[-37])/RC[-46] -> 17702.2898809524 | AY28: =RC[-39]/RC[-47] -> 491.8875
A29: 'Sweden | B29: 'EU | C29: 'C27 | D29: =RC[+19]/1000 -> 292 | E29: 37 | F29: 155 | G29: 23323000 | H29: 254183 | I29: 0 | J29: 69985 | K29: 2710924 | L29: 45375 | M29: 6453 | N29: 342000 | O29: 726 | P29: 0 | Q29: 0 | R29: 1743 | S29: 0 | T29: 497999 | U29: 5313555 | V29: 0 | W29: 292000 | X29: 1070 | Y29: 596 | Z29: 1666 | AA29: 57521486 | AB29: 26937356 | AC29: 0 | AD29: 0 | AE29: 0 | AF29: 0 | AG29: 17835073 | AH29: 102293915 | AI29: 89545934 | AJ29: 2151125 | AK29: 10596856 | AL29: 102293915 | AM29: 0 | AN29: 0 | AO29: 0 | AP29: 0 | AQ29: 0 | AR29: =RC[-30]+RC[-29] -> 342726 | AS29: =RC[-24]/RC[-23] -> #NUM! | AT29: =RC[-12]/RC[-23] -> 350.321626712329 | AU29: =RC[-27]/RC[-43] -> 1705.47602739726 | AV29: =RC[-26]/RC[-44] -> 0 | AW29: =RC[-42]/RC[-45] -> 79873.2876712329 | AX29: =SUM(RC[-43]:RC[-37])/RC[-46] -> 90444.9315068493 | AY29: =RC[-39]/RC[-47] -> 155.393835616438
A30: 'Switzerland | B30: 'EFTA | C30: 'C28 | D30: =RC[+19]/1000 -> 162 | E30: 0 | F30: 0 | G30: 0 | H30: 0 | I30: 0 | J30: 0 | K30: 0 | L30: 0 | M30: 0 | N30: 0 | O30: 0 | P30: 0 | Q30: 0 | R30: 0 | S30: 0 | T30: 0 | U30: 0 | V30: 0 | W30: 162000 | X30: 0 | Y30: 0 | Z30: 0 | AA30: 0 | AB30: 0 | AC30: 0 | AD30: 0 | AE30: 0 | AF30: 0 | AG30: 0 | AH30: 0 | AI30: 0 | AJ30: 0 | AK30: 0 | AL30: 0 | AM30: 0 | AN30: 0 | AO30: 0 | AP30: 0 | AQ30: 0 | AR30: =RC[-30]+RC[-29] -> 0 | AS30: =RC[-24]/RC[-23] -> #NUM! | AT30: =RC[-12]/RC[-23] -> 0 | AU30: =RC[-27]/RC[-43] -> 0 | AV30: =RC[-26]/RC[-44] -> 0 | AW30: =RC[-42]/RC[-45] -> 0 | AX30: =SUM(RC[-43]:RC[-37])/RC[-46] -> 0 | AY30: =RC[-39]/RC[-47] -> 0
A31: 'UK | B31: 'EU | C31: 'C29 | D31: =RC[+19]/1000 -> 1910 | E31: 169 | F31: 750 | G31: 102172000 | H31: 596000 | I31: 0 | J31: 123000 | K31: 10533000 | L31: 3077000 | M31: 0 | N31: 2874000 | O31: 163000 | P31: 0 | Q31: 0 | R31: 32010 | S31: 32010 | T31: 2481000 | U31: 77900000 | V31: 120600000 | W31: 1910000 | X31: 3619 | Y31: 5791 | Z31: 9410 | AA31: 299092399 | AB31: 180900149 | AC31: 19517056 | AD31: 295701 | AE31: 2784858 | AF31: 0 | AG31: 89105813 | AH31: 591695976 | AI31: 409132638 | AJ31: 25834575 | AK31: 103053651 | AL31: 538020864 | AM31: 0 | AN31: 0 | AO31: 0 | AP31: 0 | AQ31: 0 | AR31: =RC[-30]+RC[-29] -> 3037000 | AS31: =RC[-24]/RC[-23] -> 0.645936981757877 | AT31: =RC[-12]/RC[-23] -> 309.788469109948 | AU31: =RC[-27]/RC[-43] -> 1298.95287958115 | AV31: =RC[-26]/RC[-44] -> 63141.3612565445 | AW31: =RC[-42]/RC[-45] -> 53493.1937172775 | AX31: =SUM(RC[-43]:RC[-37])/RC[-46] -> 60995.2879581152 | AY31: =RC[-39]/RC[-47] -> 1610.99476439791
A32: 'Germany | B32: 'EU | C32: 'C31 | D32: =RC[+19]/1000 -> 2415 | E32: 242 | F32: 952 | G32: 145781090 | H32: 0 | I32: 456321 | J32: 163272 | K32: 43292567 | L32: 1591678 | M32: 0 | N32: 3487821 | O32: 73511 | P32: 0 | Q32: 0 | R32: 0 | S32: 0 | T32: 2036028 | U32: 55396873 | V32: 0 | W32: 2415000 | X32: 5501 | Y32: 3483 | Z32: 8984 | AA32: 254168203 | AB32: 181944259 | AC32: 7445788 | AD32: 0 | AE32: 5841944 | AF32: 0 | AG32: 19384343 | AH32: 468784537 | AI32: 433939804 | AJ32: 10769607 | AK32: 24075126 | AL32: 468784537 | AM32: 4203335 | AN32: 0 | AO32: 0 | AP32: 13469577 | AQ32: 17672912 | AR32: =RC[-30]+RC[-29] -> 3561332 | AS32: =RC[-24]/RC[-23] -> #NUM! | AT32: =RC[-12]/RC[-23] -> 194.113679917184 | AU32: =RC[-27]/RC[-43] -> 843.075776397515 | AV32: =RC[-26]/RC[-44] -> 0 | AW32: =RC[-42]/RC[-45] -> 60364.8405797101 | AX32: =SUM(RC[-43]:RC[-37])/RC[-46] -> 79207.0095238095 | AY32: =RC[-39]/RC[-47] -> 659.079917184265
A33: 'USA | B33: 'World - A | C33: 'C50 | D33: =RC[+19]/1000 -> 16072.976 | E33: 3533 | F33: 0 | G33: 909998739 | H33: 0 | I33: 7810572 | J33: 0 | K33: 1099654748 | L33: 93295688 | M33: 3596095 | N33: 25419128 | O33: 3215104 | P33: 0 | Q33: 0 | R33: 0 | S33: 13099 | T33: 0 | U33: 218384439 | V33: 16367837 | W33: 16072976 | X33: 31104 | Y33: 69026 | Z33: 100130 | AA33: 2170451277 | AB33: 1541680515 | AC33: 0 | AD33: 0 | AE33: 0 | AF33: 0 | AG33: 594912415 | AH33: 4307044208 | AI33: 3983549604 | AJ33: 171020826 | AK33: 307697064 | AL33: 4462267509 | AM33: 0 | AN33: 0 | AO33: 0 | AP33: 0 | AQ33: 0 | AR33: =RC[-30]+RC[-29] -> 28634232 | AS33: =RC[-24]/RC[-23] -> 13.3422906765262 | AT33: =RC[-12]/RC[-23] -> 267.96806067526 | AU33: =RC[-27]/RC[-43] -> 0 | AV33: =RC[-26]/RC[-44] -> 1018.34514031502 | AW33: =RC[-42]/RC[-45] -> 56616.6924532209 | AX33: =SUM(RC[-43]:RC[-37])/RC[-46] -> 131547.253103594 | AY33: =RC[-39]/RC[-47] -> 5804.50614746143
A34: 'Turkey | B34: 'World - B | C34: 'C42 | D34: =RC[+19]/1000 -> 1019.781 | E34: 0 | F34: 0 | G34: 0 | H34: 0 | I34: 0 | J34: 0 | K34: 0 | L34: 0 | M34: 0 | N34: 0 | O34: 0 | P34: 0 | Q34: 0 | R34: 0 | S34: 0 | T34: 0 | U34: 0 | V34: 0 | W34: 1019781 | X34: 0 | Y34: 0 | Z34: 0 | AA34: 0 | AB34: 0 | AC34: 0 | AD34: 0 | AE34: 0 | AF34: 0 | AG34: 0 | AH34: 0 | AI34: 0 | AJ34: 0 | AK34: 0 | AL34: 0 | AM34: 0 | AN34: 0 | AO34: 0 | AP34: 0 | AQ34: 0 | AR34: =RC[-30]+RC[-29] -> 0 | AS34: =RC[-24]/RC[-23] -> #NUM! | AT34: =RC[-12]/RC[-23] -> 0 | AU34: =RC[-27]/RC[-43] -> 0 | AV34: =RC[-26]/RC[-44] -> 0 | AW34: =RC[-42]/RC[-45] -> 0 | AX34: =SUM(RC[-43]:RC[-37])/RC[-46] -> 0 | AY34: =RC[-39]/RC[-47] -> 0
A35: 'Australia | B35: 'World - A | C35: 'C70 | D35: =RC[+19]/1000 -> 1063.775 | E35: 0 | F35: 0 | G35: 0 | H35: 0 | I35: 0 | J35: 0 | K35: 0 | L35: 0 | M35: 0 | N35: 0 | O35: 0 | P35: 0 | Q35: 0 | R35: 0 | S35: 0 | T35: 0 | U35: 0 | V35: 0 | W35: 1063775 | X35: 0 | Y35: 0 | Z35: 0 | AA35: 0 | AB35: 0 | AC35: 0 | AD35: 0 | AE35: 0 | AF35: 0 | AG35: 0 | AH35: 0 | AI35: 0 | AJ35: 0 | AK35: 0 | AL35: 0 | AM35: 0 | AN35: 0 | AO35: 0 | AP35: 0 | AQ35: 0 | AR35: =RC[-30]+RC[-29] -> 0 | AS35: =RC[-24]/RC[-23] -> #NUM! | AT35: =RC[-12]/RC[-23] -> 0 | AU35: =RC[-27]/RC[-43] -> 0 | AV35: =RC[-26]/RC[-44] -> 0 | AW35: =RC[-42]/RC[-45] -> 0 | AX35: =SUM(RC[-43]:RC[-37])/RC[-46] -> 0 | AY35: =RC[-39]/RC[-47] -> 0
A36: 'Japan | B36: 'World - A | C36: 'C41 | D36: =RC[+19]/1000 -> 3782.313 | E36: 1064 | F36: 1640 | G36: 266939000 | H36: 0 | I36: 0 | J36: 0 | K36: 0 | L36: 0 | M36: 0 | N36: 8108000 | O36: 0 | P36: 0 | Q36: 0 | R36: 0 | S36: 0 | T36: 0 | U36: 28629000 | V36: 0 | W36: 3782313 | X36: 7528 | Y36: 7219 | Z36: 14747 | AA36: 256865797 | AB36: 710178277 | AC36: 2725413 | AD36: 101174 | AE36: 952840 | AF36: 1965975 | AG36: 33737110 | AH36: 1006526585 | AI36: 930928123 | AJ36: 39966390 | AK36: 71906686 | AL36: 1042801202 | AM36: 0 | AN36: 0 | AO36: 0 | AP36: 0 | AQ36: 0 | AR36: =RC[-30]+RC[-29] -> 8108000 | AS36: =RC[-24]/RC[-23] -> #NUM! | AT36: =RC[-12]/RC[-23] -> 266.114037891629 | AU36: =RC[-27]/RC[-43] -> 0 | AV36: =RC[-26]/RC[-44] -> 0 | AW36: =RC[-42]/RC[-45] -> 70575.5975245835 | AX36: =SUM(RC[-43]:RC[-37])/RC[-46] -> 70575.5975245835 | AY36: =RC[-39]/RC[-47] -> 0
A37: 'Korea | B37: 'World - A | C37: 'C40 | D37: =RC[+19]/1000 -> 2413.145 | E37: 0 | F37: 0 | G37: 0 | H37: 0 | I37: 0 | J37: 0 | K37: 0 | L37: 0 | M37: 0 | N37: 0 | O37: 0 | P37: 0 | Q37: 0 | R37: 0 | S37: 0 | T37: 0 | U37: 0 | V37: 0 | W37: 2413145 | X37: 0 | Y37: 0 | Z37: 0 | AA37: 0 | AB37: 0 | AC37: 0 | AD37: 0 | AE37: 0 | AF37: 0 | AG37: 0 | AH37: 0 | AI37: 0 | AJ37: 0 | AK37: 0 | AL37: 0 | AM37: 0 | AN37: 0 | AO37: 0 | AP37: 0 | AQ37: 0 | AR37: =RC[-30]+RC[-29] -> 0 | AS37: =RC[-24]/RC[-23] -> #NUM! | AT37: =RC[-12]/RC[-23] -> 0 | AU37: =RC[-27]/RC[-43] -> 0 | AV37: =RC[-26]/RC[-44] -> 0 | AW37: =RC[-42]/RC[-45] -> 0 | AX37: =SUM(RC[-43]:RC[-37])/RC[-46] -> 0 | AY37: =RC[-39]/RC[-47] -> 0
A38: 'Canada | B38: 'World - A | C38: 'C51 | D38: =RC[+19]/1000 -> 2030.395 | E38: 2739 | F38: 910 | G38: 75032608 | H38: 0 | I38: 150814 | J38: 0 | K38: 0 | L38: 0 | M38: 0 | N38: 0 | O38: 0 | P38: 0 | Q38: 0 | R38: 0 | S38: 0 | T38: 0 | U38: 0 | V38: 241138449 | W38: 2030395 | X38: 3130 | Y38: 6616 | Z38: 13349 | AA38: 337981271 | AB38: 73056101 | AC38: 0 | AD38: 0 | AE38: 0 | AF38: 0 | AG38: 109699443 | AH38: 520736815 | AI38: 480924143 | AJ38: 11884831 | AK38: 27927841 | AL38: 520736815 | AM38: 23785033 | AN38: 35720 | AO38: 1786304 | AP38: 284300 | AQ38: 25891357 | AR38: =RC[-30]+RC[-29] -> 0 | AS38: =RC[-24]/RC[-23] -> 0 | AT38: =RC[-12]/RC[-23] -> 256.47069412602 | AU38: =RC[-27]/RC[-43] -> 0 | AV38: =RC[-26]/RC[-44] -> 118764.30399011 | AW38: =RC[-42]/RC[-45] -> 36954.6851720971 | AX38: =SUM(RC[-43]:RC[-37])/RC[-46] -> 37028.9633297954 | AY38: =RC[-39]/RC[-47] -> 0
A39: 'New Zealand | B39: 'World - A | C39: 'C71 | D39: =RC[+19]/1000 -> 169.557 | E39: 0 | F39: 0 | G39: 0 | H39: 0 | I39: 0 | J39: 0 | K39: 0 | L39: 0 | M39: 0 | N39: 0 | O39: 0 | P39: 0 | Q39: 0 | R39: 0 | S39: 0 | T39: 0 | U39: 0 | V39: 0 | W39: 169557 | X39: 0 | Y39: 0 | Z39: 0 | AA39: 0 | AB39: 0 | AC39: 0 | AD39: 0 | AE39: 0 | AF39: 0 | AG39: 0 | AH39: 0 | AI39: 0 | AJ39: 0 | AK39: 0 | AL39: 0 | AM39: 0 | AN39: 0 | AO39: 0 | AP39: 0 | AQ39: 0 | AR39: =RC[-30]+RC[-29] -> 0 | AS39: =RC[-24]/RC[-23] -> #NUM! | AT39: =RC[-12]/RC[-23] -> 0 | AU39: =RC[-27]/RC[-43] -> 0 | AV39: =RC[-26]/RC[-44] -> 0 | AW39: =RC[-42]/RC[-45] -> 0 | AX39: =SUM(RC[-43]:RC[-37])/RC[-46] -> 0 | AY39: =RC[-39]/RC[-47] -> 0
A40: 'Mexico | B40: 'World - B | C40: 'C72 | D40: =RC[+19]/1000 -> 1482.371 | E40: 0 | F40: 0 | G40: 0 | H40: 0 | I40: 0 | J40: 0 | K40: 0 | L40: 0 | M40: 0 | N40: 0 | O40: 0 | P40: 0 | Q40: 0 | R40: 0 | S40: 0 | T40: 0 | U40: 0 | V40: 0 | W40: 1482371 | X40: 0 | Y40: 0 | Z40: 0 | AA40: 0 | AB40: 0 | AC40: 0 | AD40: 0 | AE40: 0 | AF40: 0 | AG40: 0 | AH40: 0 | AI40: 0 | AJ40: 0 | AK40: 0 | AL40: 0 | AM40: 0 | AN40: 0 | AO40: 0 | AP40: 0 | AQ40: 0 | AR40: =RC[-30]+RC[-29] -> 0 | AS40: =RC[-24]/RC[-23] -> #NUM! | AT40: =RC[-12]/RC[-23] -> 0 | AU40: =RC[-27]/RC[-43] -> 0 | AV40: =RC[-26]/RC[-44] -> 0 | AW40: =RC[-42]/RC[-45] -> 0 | AX40: =SUM(RC[-43]:RC[-37])/RC[-46] -> 0 | AY40: =RC[-39]/RC[-47] -> 0
A41: 'CEE - Total | B41: 'Totals | D41: =RC[+19]/1000 -> 2302 | E41: 889 | F41: 3558 | G41: 128550475 | H41: 1150028 | I41: 1169472 | J41: 1840904 | K41: 7028976 | L41: 800525 | M41: 67953 | N41: 4178770 | O41: 57326 | P41: 7 | Q41: 24 | R41: 5653 | S41: 2368 | T41: 2445998 | U41: 53981585 | V41: 35697764 | W41: 2302000 | X41: 11309 | Y41: 4123 | Z41: 15432 | AA41: 24454752 | AB41: 40482501 | AC41: 631802 | AD41: 1485296 | AE41: 2252617 | AF41: 4556003 | AG41: 11976923 | AH41: 85839890 | AI41: 75281051 | AJ41: 2283116 | AK41: 6992567 | AL41: 84556741 | AM41: 18161879 | AN41: 0 | AO41: 132102 | AP41: 3321626 | AQ41: 21615607 | AR41: =RC[-30]+RC[-29] -> 4236096 | AS41: =RC[-24]/RC[-23] -> 1.51218392838274 | AT41: =RC[-12]/RC[-23] -> 37.2892658557776 | AU41: =RC[-27]/RC[-43] -> 1062.55343179844 | AV41: =RC[-26]/RC[-44] -> 15507.2823631625 | AW41: =RC[-42]/RC[-45] -> 55842.95178106 | AX41: =SUM(RC[-43]:RC[-37])/RC[-46] -> 61080.9439617724 | AY41: =RC[-39]/RC[-47] -> 347.751954821894
A42: 'EU - Total | B42: 'Totals | D42: =RC[+19]/1000 -> 12614.999 | E42: 3236 | F42: 6442 | G42: 466859698 | H42: 2597026 | I42: 3592687 | J42: 1721767 | K42: 71541221 | L42: 10216118 | M42: 374900 | N42: 14993494 | O42: 645386 | P42: 565 | Q42: 800 | R42: 147466 | S42: 75105 | T42: 13212864 | U42: 201253002 | V42: 394561498 | W42: 12614999 | X42: 23102 | Y42: 19567 | Z42: 42626 | AA42: 1198984746 | AB42: 729016025 | AC42: 45642981 | AD42: 1296512 | AE42: 11079473 | AF42: 2309895 | AG42: 290625447 | AH42: 2278955075 | AI42: 1945458232 | AJ42: 89793634 | AK42: 204968777 | AL42: 2240220645 | AM42: 63829927 | AN42: 618027 | AO42: 2330594 | AP42: 20953504 | AQ42: 87732051 | AR42: =RC[-30]+RC[-29] -> 15638880 | AS42: =RC[-24]/RC[-23] -> 0.510067512973605 | AT42: =RC[-12]/RC[-23] -> 180.654399972604 | AU42: =RC[-27]/RC[-43] -> 1047.39318647588 | AV42: =RC[-26]/RC[-44] -> 31277.172356494 | AW42: =RC[-42]/RC[-45] -> 37008.3024184148 | AX42: =SUM(RC[-43]:RC[-37])/RC[-46] -> 44146.1324729396 | AY42: =RC[-39]/RC[-47] -> 809.838986114862
A43: 'EFTA - Total | B43: 'Totals | D43: =RC[+19]/1000 -> 365 | E43: 237 | F43: 575 | G43: 30406655 | H43: 209379 | I43: 274629 | J43: 105592 | K43: 1305273 | L43: 306782 | M43: 23253 | N43: 877931 | O43: 17205 | P43: 22 | Q43: 29 | R43: 2886 | S43: 1146 | T43: 328798 | U43: 7947289 | V43: 10730809 | W43: 365000 | X43: 1553 | Y43: 865 | Z43: 2413 | AA43: 56412816 | AB43: 31378906 | AC43: 0 | AD43: 0 | AE43: 0 | AF43: 0 | AG43: 12462713 | AH43: 100254435 | AI43: 96513515 | AJ43: 3740921 | AK43: 0 | AL43: 100254435 | AM43: 3258172 | AN43: 33771 | AO43: 127351 | AP43: 408943 | AQ43: 3828237 | AR43: =RC[-30]+RC[-29] -> 895136 | AS43: =RC[-24]/RC[-23] -> 0.740604832310406 | AT43: =RC[-12]/RC[-23] -> 274.669684931507 | AU43: =RC[-27]/RC[-43] -> 900.816438356164 | AV43: =RC[-26]/RC[-44] -> 29399.4767123288 | AW43: =RC[-42]/RC[-45] -> 83305.904109589 | AX43: =SUM(RC[-43]:RC[-37])/RC[-46] -> 89401.5424657534 | AY43: =RC[-39]/RC[-47] -> 840.498630136986
A44: 'World A - Total | B44: 'Totals | D44: =RC[+19]/1000 -> 25532.161 | E44: 8232 | F44: 14664 | G44: 1467437321 | H44: 9525832 | I44: 12085893 | J44: 8931152 | K44: 1419450734 | L44: 121345564 | M44: 4661148 | N44: 43188675 | O44: 4240600 | P44: 36 | Q44: 54 | R44: 150448 | S44: 35505 | T44: 13991240 | U44: 305549846 | V44: 355659287 | W44: 25532161 | X44: 48256 | Y44: 90223 | Z44: 142082 | AA44: 3095726536 | AB44: 2896312322 | AC44: 4464248 | AD44: 165724 | AE44: 1560759 | AF44: 3220282 | AG44: 805523081 | AH44: 6806972952 | AI44: 6295012011 | AJ44: 261493900 | AK44: 477019216 | AL44: 7033525149 | AM44: 235444298 | AN44: 2229566 | AO44: 10059325 | AP44: 26850335 | AQ44: 274583524 | AR44: =RC[-30]+RC[-29] -> 47429275 | AS44: =RC[-24]/RC[-23] -> 0.859108301592023 | AT44: =RC[-12]/RC[-23] -> 266.603870780856 | AU44: =RC[-27]/RC[-43] -> 547.984951215058 | AV44: =RC[-26]/RC[-44] -> 13929.8544686445 | AW44: =RC[-42]/RC[-45] -> 57474.0744036511 | AX44: =SUM(RC[-43]:RC[-37])/RC[-46] -> 119200.158733137 | AY44: =RC[-39]/RC[-47] -> 4752.65544502872
A45: 'World B - Total | B45: 'Totals | D45: =RC[+19]/1000 -> 2502.152 | E45: 397 | F45: 501 | G45: 39556590 | H45: 250460 | I45: 338180 | J45: 234826 | K45: 27962358 | L45: 2470429 | M45: 94457 | N45: 1199917 | O45: 94180 | P45: 22 | Q45: 29 | R45: 49038 | S45: 17499 | T45: 4560375 | U45: 92669567 | V45: 83728235 | W45: 2502152 | X45: 1514 | Y45: 2267 | Z45: 3781 | AA45: 4556539 | AB45: 7709846 | AC45: 57884 | AD45: 308531 | AE45: 423425 | AF45: 856393 | AG45: 2251538 | AH45: 16164154 | AI45: 14039863 | AJ45: 426461 | AK45: 1307024 | AL45: 15773350 | AM45: 3514963 | AN45: 0 | AO45: 0 | AP45: 650510 | AQ45: 4165473 | AR45: =RC[-30]+RC[-29] -> 1294097 | AS45: =RC[-24]/RC[-23] -> 1.10678992576399 | AT45: =RC[-12]/RC[-23] -> 6.46010074527846 | AU45: =RC[-27]/RC[-43] -> 1822.58112217004 | AV45: =RC[-26]/RC[-44] -> 33462.4894890478 | AW45: =RC[-42]/RC[-45] -> 15809.0275890513 | AX45: =SUM(RC[-43]:RC[-37])/RC[-46] -> 28338.5261966499 | AY45: =RC[-39]/RC[-47] -> 987.321713469046
A46: 'EU Accession Countries - Totals | B46: 'Totals | D46: =RC[+19]/1000 -> 1617.234 | E46: 618 | F46: 2766 | G46: 90478910 | H46: 865888 | I46: 882769 | J46: 1409326 | K46: 6168199 | L46: 479031 | M46: 53414 | N46: 3020548 | O46: 43455 | P46: 7 | Q46: 24 | R46: 4263 | S46: 1846 | T46: 1767295 | U46: 36797270 | V46: 25217334 | W46: 1617234 | X46: 8239 | Y46: 2786 | Z46: 11025 | AA46: 20847446 | AB46: 32836386 | AC46: 584503 | AD46: 1175046 | AE46: 1824013 | AF46: 3704509 | AG46: 9793559 | AH46: 70765460 | AI46: 62499873 | AJ46: 1944817 | AK46: 5413697 | AL46: 69858393 | AM46: 14163304 | AN46: 1179 | AO46: 136548 | AP46: 2582176 | AQ46: 16883207 | AR46: =RC[-30]+RC[-29] -> 3064003 | AS46: =RC[-24]/RC[-23] -> 1.45920540212538 | AT46: =RC[-12]/RC[-23] -> 43.7570939023048 | AU46: =RC[-27]/RC[-43] -> 1092.78867498457 | AV46: =RC[-26]/RC[-44] -> 15592.878952582 | AW46: =RC[-42]/RC[-45] -> 55946.7028271728 | AX46: =SUM(RC[-43]:RC[-37])/RC[-46] -> 62042.6833717322 | AY46: =RC[-39]/RC[-47] -> 296.203888862094

Sheet: 1998
A1: 'Name | B1: 'Type | C1: 'Code | D1: 'Population '000s | E1: 'Libraries - Total Administrative Units | F1: 'Libraries - Service Points | G1: 'Collections - Books & Bound Periodicals | H1: 'Collections - Current Periodicals - Titles | I1: 'Collections - Current Periodicals - Subscriptions | J1: 'Collections - Manuscripts | K1: 'Collections - Microforms | L1: 'Collections - Audio-visual Materials | M1: 'Collections - CD-ROMs | N1: 'Additions - Books & Bound Periodicals | O1: 'Additions - Audio-visual Materials | P1: 'Facilities & Services - Percentage Stock on Open Access | Q1: 'Facilities & Services - Percentage Catalogue Records Automated | R1: 'Facilities & Services - Number of Workstations for users | S1: 'Facilities & Services - Number connected to the internet | T1: 'Use & Users - Registered Users | U1: 'Use & Users - Consultations | V1: 'Use & Users - Number of Visits | W1: 'Use & Users - Potential Total Population Served | X1: 'Library Staff FTE - Trained Librarians | Y1: 'Library Staff FTE - Other Library Staff | Z1: 'Library Staff FTE - Total Staff | AA1: 'Recurrent Expenditure (Euros) - Staff | AB1: 'Recurrent Expenditure (Euros) - Acquisition of Stock | AC1: 'Recurrent Expenditure (Euros) - Electronic Information | AD1: 'Recurrent Expenditure (Euros) - Automation | AE1: 'Recurrent Expenditure (Euros) - Premises and Related Costs | AF1: 'Recurrent Expenditure (Euros) - New Buildings / Refurbishment | AG1: 'Recurrent Expenditure (Euros) - Other Expenditure | AH1: 'Recurrent Expenditure (Euros) - TOTAL EXPENDITURE | AI1: 'Income - Public Funding | AJ1: 'Income - Fees & Charges | AK1: 'Income - Other Income | AL1: 'Income - TOTAL INCOME | AM1: 'Capital Expenditure - New Buildings / Refurbishment | AN1: 'Capital Expenditure - Acquisition of Stock | AO1: 'Capital Expenditure - Automation | AP1: 'Capital Expenditure - Other Capital Expenditure | AQ1: 'Capital Expenditure - TOTAL CAPITAL PAYMENTS | AR1: 'Additions | AS1: 'Loans per visit | AT1: 'Cost per pop | AU1: 'Users per 1000 pop | AV1: 'visits per 1000 pop | AW1: 'Bookstock per 1000 pop | AX1: 'Total stock per 1000 pop | AY1: 'AV materials per 1000 pop
A2: 'Bulgaria | B2: 'CEE | C2: 'C1 | D2: =RC[+19]/1000 -> 289 | E2: 93 | F2: 93 | G2: 8374850 | H2: 8836 | I2: 0 | J2: 0 | K2: 22548 | L2: 79414 | M2: 0 | N2: 94287 | O2: 27935 | P2: 0 | Q2: 0 | R2: 0 | S2: 0 | T2: 204905 | U2: 5015109 | V2: 2855611 | W2: 289000 | X2: 489 | Y2: 406 | Z2: 895 | AA2: 611331 | AB2: 763465 | AC2: 0 | AD2: 0 | AE2: 0 | AF2: 0 | AG2: 77417 | AH2: 1452213 | AI2: 1088345 | AJ2: 88903 | AK2: 300128 | AL2: 1477376 | AM2: 0 | AN2: 0 | AO2: 0 | AP2: 0 | AQ2: 0 | AR2: =RC[-30]+RC[-29] -> 122222 | AS2: =RC[-24]/RC[-23] -> 1.75622975258185 | AT2: =RC[-12]/RC[-23] -> 5.02495847750865 | AU2: =RC[-27]/RC[-43] -> 709.01384083045 | AV2: =RC[-26]/RC[-44] -> 9881.00692041522 | AW2: =RC[-42]/RC[-45] -> 28978.7197231834 | AX2: =SUM(RC[-43]:RC[-37])/RC[-46] -> 29362.1038062284 | AY2: =RC[-39]/RC[-47] -> 274.78892733564
A3: 'Czech Republic | B3: 'CEE | C3: 'C2 | D3: =RC[+19]/1000 -> 192 | E3: 64 | F3: 781 | G3: 10890110 | H3: 21937 | I3: 0 | J3: 44165 | K3: 13753 | L3: 31404 | M3: 0 | N3: 246113 | O3: 2104 | P3: 0 | Q3: 0 | R3: 0 | S3: 0 | T3: 224724 | U3: 2034158 | V3: 3502540 | W3: 192000 | X3: 319 | Y3: 289 | Z3: 608 | AA3: 0 | AB3: 3252830 | AC3: 0 | AD3: 0 | AE3: 0 | AF3: 0 | AG3: 0 | AH3: 0 | AI3: 0 | AJ3: 0 | AK3: 0 | AL3: 0 | AM3: 0 | AN3: 0 | AO3: 0 | AP3: 0 | AQ3: 0 | AR3: =RC[-30]+RC[-29] -> 248217 | AS3: =RC[-24]/RC[-23] -> 0.580766529432926 | AT3: =RC[-12]/RC[-23] -> 0 | AU3: =RC[-27]/RC[-43] -> 1170.4375 | AV3: =RC[-26]/RC[-44] -> 18242.3958333333 | AW3: =RC[-42]/RC[-45] -> 56719.3229166667 | AX3: =SUM(RC[-43]:RC[-37])/RC[-46] -> 57298.796875 | AY3: =RC[-39]/RC[-47] -> 163.5625
A4: 'Estonia | B4: 'CEE | C4: 'C3 | D4: =RC[+19]/1000 -> 48 | E4: 20 | F4: 38 | G4: 7574555 | H4: 11177 | I4: 21036 | J4: 68195 | K4: 176082 | L4: 30028 | M4: 2478 | N4: 113041 | O4: 1833 | P4: 4 | Q4: 5 | R4: 100 | S4: 80 | T4: 73625 | U4: 2125956 | V4: 1719207 | W4: 48000 | X4: 505 | Y4: 108 | Z4: 613 | AA4: 1841732 | AB4: 1481963 | AC4: 267699 | AD4: 0 | AE4: 305786 | AF4: 0 | AG4: 341095 | AH4: 4238275 | AI4: 4314084 | AJ4: 0 | AK4: 326644 | AL4: 4640728 | AM4: 251828 | AN4: 0 | AO4: 0 | AP4: 143422 | AQ4: 395250 | AR4: =RC[-30]+RC[-29] -> 114874 | AS4: =RC[-24]/RC[-23] -> 1.23659105622534 | AT4: =RC[-12]/RC[-23] -> 88.2973958333333 | AU4: =RC[-27]/RC[-43] -> 1533.85416666667 | AV4: =RC[-26]/RC[-44] -> 35816.8125 | AW4: =RC[-42]/RC[-45] -> 157803.229166667 | AX4: =SUM(RC[-43]:RC[-37])/RC[-46] -> 164240.645833333 | AY4: =RC[-39]/RC[-47] -> 625.583333333333
A5: 'Hungary | B5: 'CEE | C5: 'C4 | D5: =RC[+19]/1000 -> 214 | E5: 34 | F5: 35 | G5: 10015000 | H5: 23000 | I5: 0 | J5: 158000 | K5: 472897 | L5: 18293 | M5: 538 | N5: 394632 | O5: 5267 | P5: 0 | Q5: 0 | R5: 0 | S5: 0 | T5: 175228 | U5: 1788000 | V5: 3785722 | W5: 214000 | X5: 592 | Y5: 368 | Z5: 960 | AA5: 1944988 | AB5: 4428822 | AC5: 26931 | AD5: 101632 | AE5: 144939 | AF5: 398442 | AG5: 413298 | AH5: 7459052 | AI5: 6432979 | AJ5: 245386 | AK5: 170839 | AL5: 6849204 | AM5: 0 | AN5: 0 | AO5: 0 | AP5: 0 | AQ5: 0 | AR5: =RC[-30]+RC[-29] -> 399899 | AS5: =RC[-24]/RC[-23] -> 0.472300924367928 | AT5: =RC[-12]/RC[-23] -> 34.8553831775701 | AU5: =RC[-27]/RC[-43] -> 818.822429906542 | AV5: =RC[-26]/RC[-44] -> 17690.2897196262 | AW5: =RC[-42]/RC[-45] -> 46799.0654205608 | AX5: =SUM(RC[-43]:RC[-37])/RC[-46] -> 49942.6542056075 | AY5: =RC[-39]/RC[-47] -> 85.481308411215
A6: 'Latvia | B6: 'CEE | C6: 'C5 | D6: =RC[+19]/1000 -> 61 | E6: 16 | F6: 16 | G6: 6100000 | H6: 0 | I6: 0 | J6: 21773 | K6: 0 | L6: 1685 | M6: 0 | N6: 79000 | O6: 0 | P6: 0 | Q6: 0 | R6: 0 | S6: 0 | T6: 52000 | U6: 3050000 | V6: 1220000 | W6: 61000 | X6: 130 | Y6: 200 | Z6: 330 | AA6: 450596 | AB6: 281430 | AC6: 0 | AD6: 0 | AE6: 0 | AF6: 0 | AG6: 206075 | AH6: 938101 | AI6: 805911 | AJ6: 13441 | AK6: 118749 | AL6: 938101 | AM6: 244630 | AN6: 0 | AO6: 0 | AP6: 139323 | AQ6: 383953 | AR6: =RC[-30]+RC[-29] -> 79000 | AS6: =RC[-24]/RC[-23] -> 2.5 | AT6: =RC[-12]/RC[-23] -> 15.3787049180328 | AU6: =RC[-27]/RC[-43] -> 852.459016393443 | AV6: =RC[-26]/RC[-44] -> 20000 | AW6: =RC[-42]/RC[-45] -> 100000 | AX6: =SUM(RC[-43]:RC[-37])/RC[-46] -> 100384.557377049 | AY6: =RC[-39]/RC[-47] -> 27.6229508196721
A7: 'Lithuania | B7: 'CEE | C7: 'C6 | D7: =RC[+19]/1000 -> 97 | E7: 15 | F7: 106 | G7: 12042758 | H7: 4454 | I7: 4500 | J7: 241338 | K7: 26694 | L7: 3027 | M7: 1600 | N7: 219660 | O7: 639 | P7: 4 | Q7: 4 | R7: 145 | S7: 145 | T7: 90457 | U7: 6813352 | V7: 3467868 | W7: 97000 | X7: 572 | Y7: 93 | Z7: 665 | AA7: 1196195 | AB7: 441626 | AC7: 0 | AD7: 0 | AE7: 0 | AF7: 0 | AG7: 411637 | AH7: 2049458 | AI7: 1617182 | AJ7: 27586 | AK7: 396188 | AL7: 2040956 | AM7: 0 | AN7: 0 | AO7: 0 | AP7: 0 | AQ7: 0 | AR7: =RC[-30]+RC[-29] -> 220299 | AS7: =RC[-24]/RC[-23] -> 1.96470915271285 | AT7: =RC[-12]/RC[-23] -> 21.1284329896907 | AU7: =RC[-27]/RC[-43] -> 932.546391752577 | AV7: =RC[-26]/RC[-44] -> 35751.2164948454 | AW7: =RC[-42]/RC[-45] -> 124152.144329897 | AX7: =SUM(RC[-43]:RC[-37])/RC[-46] -> 127055.371134021 | AY7: =RC[-39]/RC[-47] -> 31.2061855670103
A8: 'Poland | B8: 'CEE | C8: 'C7 | D8: =RC[+19]/1000 -> 796 | E8: 0 | F8: 0 | G8: 0 | H8: 0 | I8: 0 | J8: 0 | K8: 0 | L8: 0 | M8: 0 | N8: 0 | O8: 0 | P8: 0 | Q8: 0 | R8: 0 | S8: 0 | T8: 0 | U8: 0 | V8: 0 | W8: 796000 | X8: 0 | Y8: 0 | Z8: 0 | AA8: 0 | AB8: 0 | AC8: 0 | AD8: 0 | AE8: 0 | AF8: 0 | AG8: 0 | AH8: 0 | AI8: 0 | AJ8: 0 | AK8: 0 | AL8: 0 | AM8: 0 | AN8: 0 | AO8: 0 | AP8: 0 | AQ8: 0 | AR8: =RC[-30]+RC[-29] -> 0 | AS8: =RC[-24]/RC[-23] -> #NUM! | AT8: =RC[-12]/RC[-23] -> 0 | AU8: =RC[-27]/RC[-43] -> 0 | AV8: =RC[-26]/RC[-44] -> 0 | AW8: =RC[-42]/RC[-45] -> 0 | AX8: =SUM(RC[-43]:RC[-37])/RC[-46] -> 0 | AY8: =RC[-39]/RC[-47] -> 0
A9: 'Romania | B9: 'CEE | C9: 'C8 | D9: =RC[+19]/1000 -> 438 | E9: 0 | F9: 0 | G9: 0 | H9: 0 | I9: 0 | J9: 0 | K9: 0 | L9: 0 | M9: 0 | N9: 0 | O9: 0 | P9: 0 | Q9: 0 | R9: 0 | S9: 0 | T9: 0 | U9: 0 | V9: 0 | W9: 438000 | X9: 0 | Y9: 0 | Z9: 0 | AA9: 0 | AB9: 0 | AC9: 0 | AD9: 0 | AE9: 0 | AF9: 0 | AG9: 0 | AH9: 0 | AI9: 0 | AJ9: 0 | AK9: 0 | AL9: 0 | AM9: 0 | AN9: 0 | AO9: 0 | AP9: 0 | AQ9: 0 | AR9: =RC[-30]+RC[-29] -> 0 | AS9: =RC[-24]/RC[-23] -> #NUM! | AT9: =RC[-12]/RC[-23] -> 0 | AU9: =RC[-27]/RC[-43] -> 0 | AV9: =RC[-26]/RC[-44] -> 0 | AW9: =RC[-42]/RC[-45] -> 0 | AX9: =SUM(RC[-43]:RC[-37])/RC[-46] -> 0 | AY9: =RC[-39]/RC[-47] -> 0
A10: 'Slovak Rep | B10: 'CEE | C10: 'C9 | D10: =RC[+19]/1000 -> 112 | E10: 42 | F10: 569 | G10: 4613211 | H10: 8646 | I10: 10864 | J10: 0 | K10: 0 | L10: 0 | M10: 824 | N10: 94955 | O10: 356 | P10: 0 | Q10: 0 | R10: 191 | S10: 58 | T10: 143811 | U10: 2497920 | V10: 620442 | W10: 112000 | X10: 425 | Y10: 68 | Z10: 493 | AA10: 768209 | AB10: 1008318 | AC10: 66024 | AD10: 127657 | AE10: 49548 | AF10: 976828 | AG10: 96509 | AH10: 3093093 | AI10: 2680016 | AJ10: 26232 | AK10: 296673 | AL10: 3002922 | AM10: 207389 | AN10: 0 | AO10: 128139 | AP10: 0 | AQ10: 335528 | AR10: =RC[-30]+RC[-29] -> 95311 | AS10: =RC[-24]/RC[-23] -> 4.02603305385516 | AT10: =RC[-12]/RC[-23] -> 27.6169017857143 | AU10: =RC[-27]/RC[-43] -> 1284.02678571429 | AV10: =RC[-26]/RC[-44] -> 5539.66071428571 | AW10: =RC[-42]/RC[-45] -> 41189.3839285714 | AX10: =SUM(RC[-43]:RC[-37])/RC[-46] -> 41370.9375 | AY10: =RC[-39]/RC[-47] -> 0
A11: 'Slovenia | B11: 'CEE | C11: 'C10 | D11: =RC[+19]/1000 -> 55 | E11: 71 | F11: 71 | G11: 3286162 | H11: 14439 | I11: 12075 | J11: 0 | K11: 0 | L11: 0 | M11: 0 | N11: 109504 | O11: 13687 | P11: 0 | Q11: 44 | R11: 182 | S11: 173 | T11: 119970 | U11: 3565229 | V11: 1851256 | W11: 55000 | X11: 256 | Y11: 116 | Z11: 372 | AA11: 653166 | AB11: 3844481 | AC11: 11062 | AD11: 41748 | AE11: 59537 | AF11: 163668 | AG11: 4922947 | AH11: 9696609 | AI11: 8330237 | AJ11: 138936 | AK11: 1227435 | AL11: 9696609 | AM11: 0 | AN11: 0 | AO11: 0 | AP11: 0 | AQ11: 0 | AR11: =RC[-30]+RC[-29] -> 123191 | AS11: =RC[-24]/RC[-23] -> 1.92584331934643 | AT11: =RC[-12]/RC[-23] -> 176.301981818182 | AU11: =RC[-27]/RC[-43] -> 2181.27272727273 | AV11: =RC[-26]/RC[-44] -> 33659.2 | AW11: =RC[-42]/RC[-45] -> 59748.4 | AX11: =SUM(RC[-43]:RC[-37])/RC[-46] -> 60230.4727272727 | AY11: =RC[-39]/RC[-47] -> 0
A12: 'Austria | B12: 'EU | C12: 'C11 | D12: =RC[+19]/1000 -> 269 | E12: 0 | F12: 0 | G12: 0 | H12: 0 | I12: 0 | J12: 0 | K12: 0 | L12: 0 | M12: 0 | N12: 0 | O12: 0 | P12: 0 | Q12: 0 | R12: 0 | S12: 0 | T12: 0 | U12: 0 | V12: 0 | W12: 269000 | X12: 0 | Y12: 0 | Z12: 0 | AA12: 0 | AB12: 0 | AC12: 0 | AD12: 0 | AE12: 0 | AF12: 0 | AG12: 0 | AH12: 0 | AI12: 0 | AJ12: 0 | AK12: 0 | AL12: 0 | AM12: 0 | AN12: 0 | AO12: 0 | AP12: 0 | AQ12: 0 | AR12: =RC[-30]+RC[-29] -> 0 | AS12: =RC[-24]/RC[-23] -> #NUM! | AT12: =RC[-12]/RC[-23] -> 0 | AU12: =RC[-27]/RC[-43] -> 0 | AV12: =RC[-26]/RC[-44] -> 0 | AW12: =RC[-42]/RC[-45] -> 0 | AX12: =SUM(RC[-43]:RC[-37])/RC[-46] -> 0 | AY12: =RC[-39]/RC[-47] -> 0
A13: 'België Nederlandstalige Universiteiten | B13: 'België Nederlandstalige Universiteiten | C13: 'C12a | D13: 0 | E13: 0 | F13: 0 | G13: 0 | H13: 0 | I13: 0 | J13: 0 | K13: 0 | L13: 0 | M13: 0 | N13: 0 | O13: 0 | P13: 0 | Q13: 0 | R13: 0 | S13: 0 | T13: 0 | U13: 0 | V13: 0 | W13: 0 | X13: 0 | Y13: 0 | Z13: 0 | AA13: 0 | AB13: 0 | AC13: 0 | AD13: 0 | AE13: 0 | AF13: 0 | AG13: 0 | AH13: 0 | AI13: 0 | AJ13: 0 | AK13: 0 | AL13: 0 | AM13: 0 | AN13: 0 | AO13: 0 | AP13: 0 | AQ13: 0 | AR13: 0 | AS13: =RC[-24]/RC[-23] -> #NUM! | AT13: =RC[-12]/RC[-23] -> #NUM! | AU13: =RC[-27]/RC[-43] -> #NUM! | AV13: =RC[-26]/RC[-44] -> #NUM! | AW13: =RC[-42]/RC[-45] -> #NUM! | AX13: =SUM(RC[-43]:RC[-37])/RC[-46] -> #NUM! | AY13: =RC[-39]/RC[-47] -> #NUM!
A14: 'Belgique universités francophones | B14: 'Belgique universités francophones | C14: 'C12b | D14: 0 | E14: 0 | F14: 0 | G14: 0 | H14: 0 | I14: 0 | J14: 0 | K14: 0 | L14: 0 | M14: 0 | N14: 0 | O14: 0 | P14: 0 | Q14: 0 | R14: 0 | S14: 0 | T14: 0 | U14: 0 | V14: 0 | W14: 0 | X14: 0 | Y14: 0 | Z14: 0 | AA14: 0 | AB14: 0 | AC14: 0 | AD14: 0 | AE14: 0 | AF14: 0 | AG14: 0 | AH14: 0 | AI14: 0 | AJ14: 0 | AK14: 0 | AL14: 0 | AM14: 0 | AN14: 0 | AO14: 0 | AP14: 0 | AQ14: 0 | AR14: 0 | AS14: =RC[-24]/RC[-23] -> #NUM! | AT14: =RC[-12]/RC[-23] -> #NUM! | AU14: =RC[-27]/RC[-43] -> #NUM! | AV14: =RC[-26]/RC[-44] -> #NUM! | AW14: =RC[-42]/RC[-45] -> #NUM! | AX14: =SUM(RC[-43]:RC[-37])/RC[-46] -> #NUM! | AY14: =RC[-39]/RC[-47] -> #NUM!
A15: 'Belgium | B15: 'EU | C15: 'C12 | D15: =RC[+19]/1000 -> 172 | E15: 72 | F15: 62 | G15: 12629071 | H15: 47699 | I15: 24624 | J15: 12410 | K15: 289603 | L15: 10335 | M15: 963 | N15: 411116 | O15: 105 | P15: 42 | Q15: 54 | R15: 640 | S15: 0 | T15: 105958 | U15: 743570 | V15: 5743293 | W15: 172000 | X15: 209 | Y15: 365 | Z15: 574 | AA15: 7488757 | AB15: 6125761 | AC15: 297397 | AD15: 549787 | AE15: 794959 | AF15: 0 | AG15: 252880 | AH15: 15509540 | AI15: 6307458 | AJ15: 48169 | AK15: 391161 | AL15: 6746787 | AM15: 12 | AN15: 5441 | AO15: 272091 | AP15: 7 | AQ15: 277551 | AR15: =RC[-30]+RC[-29] -> 411221 | AS15: =RC[-24]/RC[-23] -> 0.129467537177713 | AT15: =RC[-12]/RC[-23] -> 90.1717441860465 | AU15: =RC[-27]/RC[-43] -> 616.03488372093 | AV15: =RC[-26]/RC[-44] -> 33391.238372093 | AW15: =RC[-42]/RC[-45] -> 73424.8313953488 | AX15: =SUM(RC[-43]:RC[-37])/RC[-46] -> 75666.8895348837 | AY15: =RC[-39]/RC[-47] -> 60.0872093023256
A16: 'Denmark | B16: 'EU | C16: 'C13 | D16: =RC[+19]/1000 -> 180 | E16: 20 | F16: 42 | G16: 9185601 | H16: 0 | I16: 85661 | J16: 78466 | K16: 1158546 | L16: 858562 | M16: 15764 | N16: 241760 | O16: 30374 | P16: 0 | Q16: 0 | R16: 842 | S16: 0 | T16: 0 | U16: 4493802 | V16: 0 | W16: 180000 | X16: 379 | Y16: 438 | Z16: 817 | AA16: 34062299 | AB16: 13831318 | AC16: 614444 | AD16: 26713 | AE16: 251577 | AF16: 0 | AG16: 8907554 | AH16: 57693905 | AI16: 53799968 | AJ16: 1474652 | AK16: 2419285 | AL16: 57693905 | AM16: 2814516 | AN16: 0 | AO16: 0 | AP16: 0 | AQ16: 2814516 | AR16: =RC[-30]+RC[-29] -> 272134 | AS16: =RC[-24]/RC[-23] -> #NUM! | AT16: =RC[-12]/RC[-23] -> 320.521694444444 | AU16: =RC[-27]/RC[-43] -> 0 | AV16: =RC[-26]/RC[-44] -> 0 | AW16: =RC[-42]/RC[-45] -> 51031.1166666667 | AX16: =SUM(RC[-43]:RC[-37])/RC[-46] -> 63236.6666666667 | AY16: =RC[-39]/RC[-47] -> 4769.78888888889
A17: 'Eire | B17: 'EU | C17: 'C15 | D17: =RC[+19]/1000 -> 137 | E17: 0 | F17: 0 | G17: 0 | H17: 0 | I17: 0 | J17: 0 | K17: 0 | L17: 0 | M17: 0 | N17: 0 | O17: 0 | P17: 0 | Q17: 0 | R17: 0 | S17: 0 | T17: 0 | U17: 0 | V17: 0 | W17: 137000 | X17: 0 | Y17: 0 | Z17: 0 | AA17: 0 | AB17: 0 | AC17: 0 | AD17: 0 | AE17: 0 | AF17: 0 | AG17: 0 | AH17: 0 | AI17: 0 | AJ17: 0 | AK17: 0 | AL17: 0 | AM17: 0 | AN17: 0 | AO17: 0 | AP17: 0 | AQ17: 0 | AR17: =RC[-30]+RC[-29] -> 0 | AS17: =RC[-24]/RC[-23] -> #NUM! | AT17: =RC[-12]/RC[-23] -> 0 | AU17: =RC[-27]/RC[-43] -> 0 | AV17: =RC[-26]/RC[-44] -> 0 | AW17: =RC[-42]/RC[-45] -> 0 | AX17: =SUM(RC[-43]:RC[-37])/RC[-46] -> 0 | AY17: =RC[-39]/RC[-47] -> 0
A18: 'Finland | B18: 'EU | C18: 'C16 | D18: =RC[+19]/1000 -> 224 | E18: 19 | F18: 299 | G18: 13866678 | H18: 142861 | I18: 130709 | J18: 197526 | K18: 1263719 | L18: 235334 | M18: 0 | N18: 435603 | O18: 9260 | P18: 45 | Q18: 0 | R18: 0 | S18: 0 | T18: 0 | U18: 7930527 | V18: 8826708 | W18: 224000 | X18: 976 | Y18: 128 | Z18: 1104 | AA18: 26399655 | AB18: 14258865 | AC18: 0 | AD18: 0 | AE18: 0 | AF18: 475352 | AG18: 8581666 | AH18: 49240185 | AI18: 37422576 | AJ18: 4680443 | AK18: 4087531 | AL18: 46190551 | AM18: 0 | AN18: 0 | AO18: 0 | AP18: 0 | AQ18: 0 | AR18: =RC[-30]+RC[-29] -> 444863 | AS18: =RC[-24]/RC[-23] -> 0.898469395385006 | AT18: =RC[-12]/RC[-23] -> 219.822254464286 | AU18: =RC[-27]/RC[-43] -> 0 | AV18: =RC[-26]/RC[-44] -> 39404.9464285714 | AW18: =RC[-42]/RC[-45] -> 61904.8125 | AX18: =SUM(RC[-43]:RC[-37])/RC[-46] -> 70700.1205357143 | AY18: =RC[-39]/RC[-47] -> 1050.59821428571
A19: 'France | B19: 'EU | C19: 'C17 | D19: =RC[+19]/1000 -> 2278 | E19: 95 | F19: 391 | G19: 25311234 | H19: 158224 | I19: 0 | J19: 0 | K19: 1732918 | L19: 61762 | M19: 35591 | N19: 1151306 | O19: 0 | P19: 32 | Q19: 0 | R19: 0 | S19: 0 | T19: 0 | U19: 0 | V19: 0 | W19: 2278000 | X19: 1774 | Y19: 2288 | Z19: 4062 | AA19: 135449600 | AB19: 53065050 | AC19: 5076786 | AD19: 0 | AE19: 0 | AF19: 0 | AG19: 58891333 | AH19: 252482769 | AI19: 240056836 | AJ19: 8150662 | AK19: 5113227 | AL19: 253320725 | AM19: 0 | AN19: 0 | AO19: 0 | AP19: 0 | AQ19: 0 | AR19: =RC[-30]+RC[-29] -> 1151306 | AS19: =RC[-24]/RC[-23] -> #NUM! | AT19: =RC[-12]/RC[-23] -> 110.835280509219 | AU19: =RC[-27]/RC[-43] -> 0 | AV19: =RC[-26]/RC[-44] -> 0 | AW19: =RC[-42]/RC[-45] -> 11111.1650570676 | AX19: =SUM(RC[-43]:RC[-37])/RC[-46] -> 11984.0776997366 | AY19: =RC[-39]/RC[-47] -> 27.1123792800702
A20: 'Greece | B20: 'EU | C20: 'C18 | D20: =RC[+19]/1000 -> 347 | E20: 83 | F20: 170 | G20: 5683287 | H20: 0 | I20: 36200 | J20: 29790 | K20: 25338 | L20: 22796 | M20: 7901 | N20: 296750 | O20: 1439 | P20: 36 | Q20: 49 | R20: 0 | S20: 0 | T20: 402192 | U20: 1415696 | V20: 0 | W20: 347000 | X20: 728 | Y20: 395 | Z20: 1123 | AA20: 3476891 | AB20: 12494165 | AC20: 597444 | AD20: 108710 | AE20: 0 | AF20: 813327 | AG20: 3382050 | AH20: 20872587 | AI20: 11711752 | AJ20: 9002928 | AK20: 157907 | AL20: 20872587 | AM20: 0 | AN20: 0 | AO20: 0 | AP20: 0 | AQ20: 0 | AR20: =RC[-30]+RC[-29] -> 298189 | AS20: =RC[-24]/RC[-23] -> #NUM! | AT20: =RC[-12]/RC[-23] -> 60.1515475504323 | AU20: =RC[-27]/RC[-43] -> 1159.05475504323 | AV20: =RC[-26]/RC[-44] -> 0 | AW20: =RC[-42]/RC[-45] -> 16378.34870317 | AX20: =SUM(RC[-43]:RC[-37])/RC[-46] -> 16730.0057636888 | AY20: =RC[-39]/RC[-47] -> 65.6945244956772
A21: 'Iceland | B21: 'EFTA | C21: 'C19 | D21: =RC[+19]/1000 -> 8 | E21: 0 | F21: 0 | G21: 0 | H21: 0 | I21: 0 | J21: 0 | K21: 0 | L21: 0 | M21: 0 | N21: 0 | O21: 0 | P21: 0 | Q21: 0 | R21: 0 | S21: 0 | T21: 0 | U21: 0 | V21: 0 | W21: 8000 | X21: 0 | Y21: 0 | Z21: 0 | AA21: 0 | AB21: 0 | AC21: 0 | AD21: 0 | AE21: 0 | AF21: 0 | AG21: 0 | AH21: 0 | AI21: 0 | AJ21: 0 | AK21: 0 | AL21: 0 | AM21: 0 | AN21: 0 | AO21: 0 | AP21: 0 | AQ21: 0 | AR21: =RC[-30]+RC[-29] -> 0 | AS21: =RC[-24]/RC[-23] -> #NUM! | AT21: =RC[-12]/RC[-23] -> 0 | AU21: =RC[-27]/RC[-43] -> 0 | AV21: =RC[-26]/RC[-44] -> 0 | AW21: =RC[-42]/RC[-45] -> 0 | AX21: =SUM(RC[-43]:RC[-37])/RC[-46] -> 0 | AY21: =RC[-39]/RC[-47] -> 0
A22: 'Italy | B22: 'EU | C22: 'C20 | D22: =RC[+19]/1000 -> 1852 | E22: 0 | F22: 0 | G22: 0 | H22: 0 | I22: 0 | J22: 0 | K22: 0 | L22: 0 | M22: 0 | N22: 0 | O22: 0 | P22: 0 | Q22: 0 | R22: 0 | S22: 0 | T22: 0 | U22: 0 | V22: 0 | W22: 1852000 | X22: 0 | Y22: 0 | Z22: 0 | AA22: 0 | AB22: 0 | AC22: 0 | AD22: 0 | AE22: 0 | AF22: 0 | AG22: 0 | AH22: 0 | AI22: 0 | AJ22: 0 | AK22: 0 | AL22: 0 | AM22: 0 | AN22: 0 | AO22: 0 | AP22: 0 | AQ22: 0 | AR22: =RC[-30]+RC[-29] -> 0 | AS22: =RC[-24]/RC[-23] -> #NUM! | AT22: =RC[-12]/RC[-23] -> 0 | AU22: =RC[-27]/RC[-43] -> 0 | AV22: =RC[-26]/RC[-44] -> 0 | AW22: =RC[-42]/RC[-45] -> 0 | AX22: =SUM(RC[-43]:RC[-37])/RC[-46] -> 0 | AY22: =RC[-39]/RC[-47] -> 0
A23: 'Liechtenstein | B23: 'EFTA | C23: 'C21 | D23: =RC[+19]/1000 -> 1 | E23: 0 | F23: 0 | G23: 0 | H23: 0 | I23: 0 | J23: 0 | K23: 0 | L23: 0 | M23: 0 | N23: 0 | O23: 0 | P23: 0 | Q23: 0 | R23: 0 | S23: 0 | T23: 0 | U23: 0 | V23: 0 | W23: 1000 | X23: 0 | Y23: 0 | Z23: 0 | AA23: 0 | AB23: 0 | AC23: 0 | AD23: 0 | AE23: 0 | AF23: 0 | AG23: 0 | AH23: 0 | AI23: 0 | AJ23: 0 | AK23: 0 | AL23: 0 | AM23: 0 | AN23: 0 | AO23: 0 | AP23: 0 | AQ23: 0 | AR23: =RC[-30]+RC[-29] -> 0 | AS23: =RC[-24]/RC[-23] -> #NUM! | AT23: =RC[-12]/RC[-23] -> 0 | AU23: =RC[-27]/RC[-43] -> 0 | AV23: =RC[-26]/RC[-44] -> 0 | AW23: =RC[-42]/RC[-45] -> 0 | AX23: =SUM(RC[-43]:RC[-37])/RC[-46] -> 0 | AY23: =RC[-39]/RC[-47] -> 0
A24: 'Luxembourg | B24: 'EU | C24: 'C22 | D24: =RC[+19]/1000 -> 2.999 | E24: 7 | F24: 5 | G24: 247030 | H24: 1650 | I24: 881 | J24: 10 | K24: 5 | L24: 847 | M24: 37 | N24: 3800 | O24: 120 | P24: 75 | Q24: 53 | R24: 23 | S24: 19 | T24: 13837 | U24: 0 | V24: 0 | W24: 2999 | X24: 5 | Y24: 5 | Z24: 9 | AA24: 243611 | AB24: 204945 | AC24: 8343 | AD24: 155 | AE24: 1463 | AF24: 0 | AG24: 67620 | AH24: 526137 | AI24: 231409 | AJ24: 0 | AK24: 28458 | AL24: 259867 | AM24: 0 | AN24: 0 | AO24: 0 | AP24: 0 | AQ24: 0 | AR24: =RC[-30]+RC[-29] -> 3920 | AS24: =RC[-24]/RC[-23] -> #NUM! | AT24: =RC[-12]/RC[-23] -> 175.43747915972 | AU24: =RC[-27]/RC[-43] -> 4613.87129043014 | AV24: =RC[-26]/RC[-44] -> 0 | AW24: =RC[-42]/RC[-45] -> 82370.7902634211 | AX24: =SUM(RC[-43]:RC[-37])/RC[-46] -> 83514.504834945 | AY24: =RC[-39]/RC[-47] -> 282.427475825275
A25: 'Netherlands | B25: 'EU | C25: 'C23 | D25: =RC[+19]/1000 -> 540 | E25: 23 | F25: 142 | G25: 24283551 | H25: 149482 | I25: 147524 | J25: 0 | K25: 5593165 | L25: 0 | M25: 0 | N25: 0 | O25: 0 | P25: 0 | Q25: 0 | R25: 0 | S25: 0 | T25: 0 | U25: 4018097 | V25: 0 | W25: 540000 | X25: 868 | Y25: 1002 | Z25: 1870 | AA25: 0 | AB25: 0 | AC25: 0 | AD25: 0 | AE25: 0 | AF25: 0 | AG25: 0 | AH25: 0 | AI25: 0 | AJ25: 0 | AK25: 0 | AL25: 0 | AM25: 0 | AN25: 0 | AO25: 0 | AP25: 0 | AQ25: 0 | AR25: =RC[-30]+RC[-29] -> 0 | AS25: =RC[-24]/RC[-23] -> #NUM! | AT25: =RC[-12]/RC[-23] -> 0 | AU25: =RC[-27]/RC[-43] -> 0 | AV25: =RC[-26]/RC[-44] -> 0 | AW25: =RC[-42]/RC[-45] -> 44969.5388888889 | AX25: =SUM(RC[-43]:RC[-37])/RC[-46] -> 55877.262962963 | AY25: =RC[-39]/RC[-47] -> 0
A26: 'Norway | B26: 'EFTA | C26: 'C24 | D26: =RC[+19]/1000 -> 194 | E26: 95 | F26: 216 | G26: 11151907 | H26: 80160 | I26: 0 | J26: 36327 | K26: 502973 | L26: 118064 | M26: 0 | N26: 338531 | O26: 5668 | P26: 22 | Q26: 0 | R26: 831 | S26: 402 | T26: 0 | U26: 2629439 | V26: 4186342 | W26: 194000 | X26: 578 | Y26: 325 | Z26: 909 | AA26: 26376025 | AB26: 16467888 | AC26: 0 | AD26: 0 | AE26: 0 | AF26: 0 | AG26: 5224862 | AH26: 48068775 | AI26: 46463506 | AJ26: 1605269 | AK26: 0 | AL26: 48068775 | AM26: 0 | AN26: 0 | AO26: 0 | AP26: 0 | AQ26: 0 | AR26: =RC[-30]+RC[-29] -> 344199 | AS26: =RC[-24]/RC[-23] -> 0.62809942427064 | AT26: =RC[-12]/RC[-23] -> 247.777190721649 | AU26: =RC[-27]/RC[-43] -> 0 | AV26: =RC[-26]/RC[-44] -> 21579.0824742268 | AW26: =RC[-42]/RC[-45] -> 57484.0567010309 | AX26: =SUM(RC[-43]:RC[-37])/RC[-46] -> 61285.7268041237 | AY26: =RC[-39]/RC[-47] -> 608.577319587629
A27: 'Portugal | B27: 'EU | C27: 'C25 | D27: =RC[+19]/1000 -> 325 | E27: 231 | F27: 231 | G27: 8340979 | H27: 0 | I27: 0 | J27: 14045 | K27: 46255 | L27: 129625 | M27: 0 | N27: 339130 | O27: 8749 | P27: 0 | Q27: 0 | R27: 450 | S27: 150 | T27: 924426 | U27: 1559217 | V27: 0 | W27: 325000 | X27: 691 | Y27: 414 | Z27: 1105 | AA27: 5788612 | AB27: 8781601 | AC27: 0 | AD27: 0 | AE27: 0 | AF27: 0 | AG27: 1247721 | AH27: 15817933 | AI27: 14972929 | AJ27: 445182 | AK27: 903275 | AL27: 16321386 | AM27: 10888 | AN27: 0 | AO27: 0 | AP27: 410531 | AQ27: 421418 | AR27: =RC[-30]+RC[-29] -> 347879 | AS27: =RC[-24]/RC[-23] -> #NUM! | AT27: =RC[-12]/RC[-23] -> 48.6705630769231 | AU27: =RC[-27]/RC[-43] -> 2844.38769230769 | AV27: =RC[-26]/RC[-44] -> 0 | AW27: =RC[-42]/RC[-45] -> 25664.5507692308 | AX27: =SUM(RC[-43]:RC[-37])/RC[-46] -> 26248.9353846154 | AY27: =RC[-39]/RC[-47] -> 398.846153846154
A28: 'Spain | B28: 'EU | C28: 'C26 | D28: =RC[+19]/1000 -> 1680 | E28: 640 | F28: 1118 | G28: 24564000 | H28: 409926 | I28: 0 | J28: 45000 | K28: 1290000 | L28: 614000 | M28: 61000 | N28: 1228000 | O28: 46000 | P28: 0 | Q28: 0 | R28: 0 | S28: 0 | T28: 2149000 | U28: 13817000 | V28: 42458551 | W28: 1680000 | X28: 3100 | Y28: 1500 | Z28: 4600 | AA28: 82663819 | AB28: 49883342 | AC28: 0 | AD28: 0 | AE28: 0 | AF28: 0 | AG28: 9976665 | AH28: 142523826 | AI28: 122192757 | AJ28: 5690223 | AK28: 14640846 | AL28: 142523826 | AM28: 0 | AN28: 0 | AO28: 0 | AP28: 0 | AQ28: 0 | AR28: =RC[-30]+RC[-29] -> 1274000 | AS28: =RC[-24]/RC[-23] -> 0.325423258085279 | AT28: =RC[-12]/RC[-23] -> 84.8356107142857 | AU28: =RC[-27]/RC[-43] -> 1279.16666666667 | AV28: =RC[-26]/RC[-44] -> 25272.9470238095 | AW28: =RC[-42]/RC[-45] -> 14621.4285714286 | AX28: =SUM(RC[-43]:RC[-37])/RC[-46] -> 16061.8607142857 | AY28: =RC[-39]/RC[-47] -> 365.47619047619
A29: 'Sweden | B29: 'EU | C29: 'C27 | D29: =RC[+19]/1000 -> 292 | E29: 37 | F29: 155 | G29: 23323000 | H29: 254183 | I29: 0 | J29: 69985 | K29: 2710924 | L29: 45375 | M29: 5378 | N29: 342000 | O29: 605 | P29: 0 | Q29: 0 | R29: 1453 | S29: 0 | T29: 497999 | U29: 5305107 | V29: 0 | W29: 292000 | X29: 1006 | Y29: 561 | Z29: 1567 | AA29: 54300975 | AB29: 25429188 | AC29: 0 | AD29: 0 | AE29: 0 | AF29: 0 | AG29: 16836524 | AH29: 96566687 | AI29: 84532439 | AJ29: 2030688 | AK29: 10003560 | AL29: 96566687 | AM29: 0 | AN29: 0 | AO29: 0 | AP29: 0 | AQ29: 0 | AR29: =RC[-30]+RC[-29] -> 342605 | AS29: =RC[-24]/RC[-23] -> #NUM! | AT29: =RC[-12]/RC[-23] -> 330.707832191781 | AU29: =RC[-27]/RC[-43] -> 1705.47602739726 | AV29: =RC[-26]/RC[-44] -> 0 | AW29: =RC[-42]/RC[-45] -> 79873.2876712329 | AX29: =SUM(RC[-43]:RC[-37])/RC[-46] -> 90441.25 | AY29: =RC[-39]/RC[-47] -> 155.393835616438
A30: 'Switzerland | B30: 'EFTA | C30: 'C28 | D30: =RC[+19]/1000 -> 162 | E30: 0 | F30: 0 | G30: 0 | H30: 0 | I30: 0 | J30: 0 | K30: 0 | L30: 0 | M30: 0 | N30: 0 | O30: 0 | P30: 0 | Q30: 0 | R30: 0 | S30: 0 | T30: 0 | U30: 0 | V30: 0 | W30: 162000 | X30: 0 | Y30: 0 | Z30: 0 | AA30: 0 | AB30: 0 | AC30: 0 | AD30: 0 | AE30: 0 | AF30: 0 | AG30: 0 | AH30: 0 | AI30: 0 | AJ30: 0 | AK30: 0 | AL30: 0 | AM30: 0 | AN30: 0 | AO30: 0 | AP30: 0 | AQ30: 0 | AR30: =RC[-30]+RC[-29] -> 0 | AS30: =RC[-24]/RC[-23] -> #NUM! | AT30: =RC[-12]/RC[-23] -> 0 | AU30: =RC[-27]/RC[-43] -> 0 | AV30: =RC[-26]/RC[-44] -> 0 | AW30: =RC[-42]/RC[-45] -> 0 | AX30: =SUM(RC[-43]:RC[-37])/RC[-46] -> 0 | AY30: =RC[-39]/RC[-47] -> 0
A31: 'UK | B31: 'EU | C31: 'C29 | D31: =RC[+19]/1000 -> 1910 | E31: 174 | F31: 770 | G31: 98869000 | H31: 565000 | I31: 0 | J31: 189000 | K31: 9894000 | L31: 2094000 | M31: 0 | N31: 2760000 | O31: 138000 | P31: 0 | Q31: 0 | R31: 28240 | S31: 28240 | T31: 2342000 | U31: 7580000 | V31: 119300000 | W31: 1910000 | X31: 3560 | Y31: 5700 | Z31: 9230 | AA31: 276392080 | AB31: 170649317 | AC31: 16395830 | AD31: 291658 | AE31: 2746781 | AF31: 0 | AG31: 89507623 | AH31: 555983289 | AI31: 398179276 | AJ31: 23115337 | AK31: 110692248 | AL31: 531986861 | AM31: 0 | AN31: 0 | AO31: 0 | AP31: 0 | AQ31: 0 | AR31: =RC[-30]+RC[-29] -> 2898000 | AS31: =RC[-24]/RC[-23] -> 0.0635373009220453 | AT31: =RC[-12]/RC[-23] -> 291.090727225131 | AU31: =RC[-27]/RC[-43] -> 1226.1780104712 | AV31: =RC[-26]/RC[-44] -> 62460.7329842932 | AW31: =RC[-42]/RC[-45] -> 51763.8743455497 | AX31: =SUM(RC[-43]:RC[-37])/RC[-46] -> 58435.0785340314 | AY31: =RC[-39]/RC[-47] -> 1096.33507853403
A32: 'Germany | B32: 'EU | C32: 'C31 | D32: =RC[+19]/1000 -> 2415 | E32: 255 | F32: 1112 | G32: 145623450 | H32: 0 | I32: 462018 | J32: 153625 | K32: 42668446 | L32: 1540274 | M32: 0 | N32: 3717589 | O32: 69841 | P32: 0 | Q32: 0 | R32: 0 | S32: 0 | T32: 2096272 | U32: 58313089 | V32: 0 | W32: 2415000 | X32: 5503 | Y32: 3763 | Z32: 9266 | AA32: 240319141 | AB32: 198427180 | AC32: 0 | AD32: 0 | AE32: 0 | AF32: 0 | AG32: 27439102 | AH32: 466185423 | AI32: 431533882 | AJ32: 10709896 | AK32: 23941645 | AL32: 466185423 | AM32: 12576305 | AN32: 24219 | AO32: 1211113 | AP32: 1827360 | AQ32: 15638992 | AR32: =RC[-30]+RC[-29] -> 3787430 | AS32: =RC[-24]/RC[-23] -> #NUM! | AT32: =RC[-12]/RC[-23] -> 193.037442236025 | AU32: =RC[-27]/RC[-43] -> 868.021532091097 | AV32: =RC[-26]/RC[-44] -> 0 | AW32: =RC[-42]/RC[-45] -> 60299.5652173913 | AX32: =SUM(RC[-43]:RC[-37])/RC[-46] -> 78860.3780538302 | AY32: =RC[-39]/RC[-47] -> 637.794616977226
A33: 'USA | B33: 'World - A | C33: 'C50 | D33: =RC[+19]/1000 -> 16072.976 | E33: 3658 | F33: 0 | G33: 878906177 | H33: 0 | I33: 7543703 | J33: 0 | K33: 1062082077 | L33: 92305707 | M33: 3473225 | N33: 24550615 | O33: 3180988 | P33: 0 | Q33: 0 | R33: 0 | S33: 3460 | T33: 0 | U33: 216067113 | V33: 16194154 | W33: 16072976 | X33: 30041 | Y33: 66668 | Z33: 96709 | AA33: 2064402020 | AB33: 1466353289 | AC33: 0 | AD33: 0 | AE33: 0 | AF33: 0 | AG33: 565844718 | AH33: 4096600028 | AI33: 3486785028 | AJ33: 147121248 | AK33: 325957862 | AL33: 3959864145 | AM33: 0 | AN33: 0 | AO33: 0 | AP33: 0 | AQ33: 0 | AR33: =RC[-30]+RC[-29] -> 27731603 | AS33: =RC[-24]/RC[-23] -> 13.3422908661978 | AT33: =RC[-12]/RC[-23] -> 254.875016798383 | AU33: =RC[-27]/RC[-43] -> 0 | AV33: =RC[-26]/RC[-44] -> 1007.53923853305 | AW33: =RC[-42]/RC[-45] -> 54682.2304096018 | AX33: =SUM(RC[-43]:RC[-37])/RC[-46] -> 127189.320073644 | AY33: =RC[-39]/RC[-47] -> 5742.91326012059
A34: 'Turkey | B34: 'World - B | C34: 'C42 | D34: =RC[+19]/1000 -> 1019.781 | E34: 0 | F34: 0 | G34: 0 | H34: 0 | I34: 0 | J34: 0 | K34: 0 | L34: 0 | M34: 0 | N34: 0 | O34: 0 | P34: 0 | Q34: 0 | R34: 0 | S34: 0 | T34: 0 | U34: 0 | V34: 0 | W34: 1019781 | X34: 0 | Y34: 0 | Z34: 0 | AA34: 0 | AB34: 0 | AC34: 0 | AD34: 0 | AE34: 0 | AF34: 0 | AG34: 0 | AH34: 0 | AI34: 0 | AJ34: 0 | AK34: 0 | AL34: 0 | AM34: 0 | AN34: 0 | AO34: 0 | AP34: 0 | AQ34: 0 | AR34: =RC[-30]+RC[-29] -> 0 | AS34: =RC[-24]/RC[-23] -> #NUM! | AT34: =RC[-12]/RC[-23] -> 0 | AU34: =RC[-27]/RC[-43] -> 0 | AV34: =RC[-26]/RC[-44] -> 0 | AW34: =RC[-42]/RC[-45] -> 0 | AX34: =SUM(RC[-43]:RC[-37])/RC[-46] -> 0 | AY34: =RC[-39]/RC[-47] -> 0
A35: 'Australia | B35: 'World - A | C35: 'C70 | D35: =RC[+19]/1000 -> 1063.775 | E35: 0 | F35: 0 | G35: 0 | H35: 0 | I35: 0 | J35: 0 | K35: 0 | L35: 0 | M35: 0 | N35: 0 | O35: 0 | P35: 0 | Q35: 0 | R35: 0 | S35: 0 | T35: 0 | U35: 0 | V35: 0 | W35: 1063775 | X35: 0 | Y35: 0 | Z35: 0 | AA35: 0 | AB35: 0 | AC35: 0 | AD35: 0 | AE35: 0 | AF35: 0 | AG35: 0 | AH35: 0 | AI35: 0 | AJ35: 0 | AK35: 0 | AL35: 0 | AM35: 0 | AN35: 0 | AO35: 0 | AP35: 0 | AQ35: 0 | AR35: =RC[-30]+RC[-29] -> 0 | AS35: =RC[-24]/RC[-23] -> #NUM! | AT35: =RC[-12]/RC[-23] -> 0 | AU35: =RC[-27]/RC[-43] -> 0 | AV35: =RC[-26]/RC[-44] -> 0 | AW35: =RC[-42]/RC[-45] -> 0 | AX35: =SUM(RC[-43]:RC[-37])/RC[-46] -> 0 | AY35: =RC[-39]/RC[-47] -> 0
A36: 'Japan | B36: 'World - A | C36: 'C41 | D36: =RC[+19]/1000 -> 3782.313 | E36: 1060 | F36: 1638 | G36: 262323000 | H36: 0 | I36: 0 | J36: 0 | K36: 0 | L36: 0 | M36: 0 | N36: 7596000 | O36: 0 | P36: 0 | Q36: 0 | R36: 0 | S36: 0 | T36: 0 | U36: 28082000 | V36: 0 | W36: 3782313 | X36: 7685 | Y36: 7386 | Z36: 15071 | AA36: 171066412 | AB36: 558096989 | AC36: 1815059 | AD36: 67380 | AE36: 634568 | AF36: 1309292 | AG36: 22468099 | AH36: 755457798 | AI36: 643001250 | AJ36: 27130765 | AK36: 60110191 | AL36: 730242207 | AM36: 0 | AN36: 0 | AO36: 0 | AP36: 0 | AQ36: 0 | AR36: =RC[-30]+RC[-29] -> 7596000 | AS36: =RC[-24]/RC[-23] -> #NUM! | AT36: =RC[-12]/RC[-23] -> 199.734341922522 | AU36: =RC[-27]/RC[-43] -> 0 | AV36: =RC[-26]/RC[-44] -> 0 | AW36: =RC[-42]/RC[-45] -> 69355.1802825414 | AX36: =SUM(RC[-43]:RC[-37])/RC[-46] -> 69355.1802825414 | AY36: =RC[-39]/RC[-47] -> 0
A37: 'Korea | B37: 'World - A | C37: 'C40 | D37: =RC[+19]/1000 -> 2413.145 | E37: 0 | F37: 0 | G37: 0 | H37: 0 | I37: 0 | J37: 0 | K37: 0 | L37: 0 | M37: 0 | N37: 0 | O37: 0 | P37: 0 | Q37: 0 | R37: 0 | S37: 0 | T37: 0 | U37: 0 | V37: 0 | W37: 2413145 | X37: 0 | Y37: 0 | Z37: 0 | AA37: 0 | AB37: 0 | AC37: 0 | AD37: 0 | AE37: 0 | AF37: 0 | AG37: 0 | AH37: 0 | AI37: 0 | AJ37: 0 | AK37: 0 | AL37: 0 | AM37: 0 | AN37: 0 | AO37: 0 | AP37: 0 | AQ37: 0 | AR37: =RC[-30]+RC[-29] -> 0 | AS37: =RC[-24]/RC[-23] -> #NUM! | AT37: =RC[-12]/RC[-23] -> 0 | AU37: =RC[-27]/RC[-43] -> 0 | AV37: =RC[-26]/RC[-44] -> 0 | AW37: =RC[-42]/RC[-45] -> 0 | AX37: =SUM(RC[-43]:RC[-37])/RC[-46] -> 0 | AY37: =RC[-39]/RC[-47] -> 0
A38: 'Canada | B38: 'World - A | C38: 'C51 | D38: =RC[+19]/1000 -> 2030.395 | E38: 2739 | F38: 910 | G38: 75032608 | H38: 0 | I38: 150814 | J38: 0 | K38: 0 | L38: 0 | M38: 0 | N38: 0 | O38: 0 | P38: 0 | Q38: 0 | R38: 0 | S38: 0 | T38: 0 | U38: 0 | V38: 241138449 | W38: 2030395 | X38: 3130 | Y38: 6616 | Z38: 13349 | AA38: 293843525 | AB38: 63515538 | AC38: 0 | AD38: 0 | AE38: 0 | AF38: 0 | AG38: 95373542 | AH38: 452732605 | AI38: 418119161 | AJ38: 10332764 | AK38: 24280680 | AL38: 452732605 | AM38: 22814306 | AN38: 34262 | AO38: 1713400 | AP38: 272698 | AQ38: 24834666 | AR38: =RC[-30]+RC[-29] -> 0 | AS38: =RC[-24]/RC[-23] -> 0 | AT38: =RC[-12]/RC[-23] -> 222.977600417653 | AU38: =RC[-27]/RC[-43] -> 0 | AV38: =RC[-26]/RC[-44] -> 118764.30399011 | AW38: =RC[-42]/RC[-45] -> 36954.6851720971 | AX38: =SUM(RC[-43]:RC[-37])/RC[-46] -> 37028.9633297954 | AY38: =RC[-39]/RC[-47] -> 0
A39: 'New Zealand | B39: 'World - A | C39: 'C71 | D39: =RC[+19]/1000 -> 169.557 | E39: 0 | F39: 0 | G39: 0 | H39: 0 | I39: 0 | J39: 0 | K39: 0 | L39: 0 | M39: 0 | N39: 0 | O39: 0 | P39: 0 | Q39: 0 | R39: 0 | S39: 0 | T39: 0 | U39: 0 | V39: 0 | W39: 169557 | X39: 0 | Y39: 0 | Z39: 0 | AA39: 0 | AB39: 0 | AC39: 0 | AD39: 0 | AE39: 0 | AF39: 0 | AG39: 0 | AH39: 0 | AI39: 0 | AJ39: 0 | AK39: 0 | AL39: 0 | AM39: 0 | AN39: 0 | AO39: 0 | AP39: 0 | AQ39: 0 | AR39: =RC[-30]+RC[-29] -> 0 | AS39: =RC[-24]/RC[-23] -> #NUM! | AT39: =RC[-12]/RC[-23] -> 0 | AU39: =RC[-27]/RC[-43] -> 0 | AV39: =RC[-26]/RC[-44] -> 0 | AW39: =RC[-42]/RC[-45] -> 0 | AX39: =SUM(RC[-43]:RC[-37])/RC[-46] -> 0 | AY39: =RC[-39]/RC[-47] -> 0
A40: 'Mexico | B40: 'World - B | C40: 'C72 | D40: =RC[+19]/1000 -> 1472.065 | E40: 0 | F40: 0 | G40: 0 | H40: 0 | I40: 0 | J40: 0 | K40: 0 | L40: 0 | M40: 0 | N40: 0 | O40: 0 | P40: 0 | Q40: 0 | R40: 0 | S40: 0 | T40: 0 | U40: 0 | V40: 0 | W40: 1472065 | X40: 0 | Y40: 0 | Z40: 0 | AA40: 0 | AB40: 0 | AC40: 0 | AD40: 0 | AE40: 0 | AF40: 0 | AG40: 0 | AH40: 0 | AI40: 0 | AJ40: 0 | AK40: 0 | AL40: 0 | AM40: 0 | AN40: 0 | AO40: 0 | AP40: 0 | AQ40: 0 | AR40: =RC[-30]+RC[-29] -> 0 | AS40: =RC[-24]/RC[-23] -> #NUM! | AT40: =RC[-12]/RC[-23] -> 0 | AU40: =RC[-27]/RC[-43] -> 0 | AV40: =RC[-26]/RC[-44] -> 0 | AW40: =RC[-42]/RC[-45] -> 0 | AX40: =SUM(RC[-43]:RC[-37])/RC[-46] -> 0 | AY40: =RC[-39]/RC[-47] -> 0
A41: 'CEE - Total | B41: 'Totals | D41: =RC[+19]/1000 -> 2302 | E41: 828 | F41: 2941 | G41: 126491439 | H41: 1147291 | I41: 1169350 | J41: 1307734 | K41: 3884077 | L41: 675738 | M41: 52668 | N41: 4215307 | O41: 81117 | P41: 7 | Q41: 25 | R41: 5415 | S41: 2197 | T41: 2305369 | U41: 50718857 | V41: 35230950 | W41: 2302000 | X41: 10893 | Y41: 4299 | Z41: 15192 | AA41: 19782295 | AB41: 33193035 | AC41: 541041 | AD41: 910041 | AE41: 1471099 | AF41: 4044104 | AG41: 16805028 | AH41: 76746642 | AI41: 67115517 | AJ41: 1435466 | AK41: 7560985 | AL41: 76111974 | AM41: 7197019 | AN41: 0 | AO41: 128139 | AP41: 3980765 | AQ41: 11305923 | AR41: =RC[-30]+RC[-29] -> 4296424 | AS41: =RC[-24]/RC[-23] -> 1.43961082514096 | AT41: =RC[-12]/RC[-23] -> 33.3391146828845 | AU41: =RC[-27]/RC[-43] -> 1001.46350999131 | AV41: =RC[-26]/RC[-44] -> 15304.4960903562 | AW41: =RC[-42]/RC[-45] -> 54948.4965247611 | AX41: =SUM(RC[-43]:RC[-37])/RC[-46] -> 58526.6277150304 | AY41: =RC[-39]/RC[-47] -> 293.543874891399
A42: 'EU - Total | B42: 'Totals | D42: =RC[+19]/1000 -> 12623.999 | E42: 3222 | F42: 6610 | G42: 456896271 | H42: 2607349 | I42: 3456628 | J42: 1748911 | K42: 70347326 | L42: 8798156 | M42: 335900 | N42: 15109695 | O42: 595970 | P42: 559 | Q42: 804 | R42: 140990 | S42: 69870 | T42: 11978897 | U42: 129609159 | V42: 383335811 | W42: 12623999 | X42: 21306 | Y42: 19432 | Z42: 40707 | AA42: 1106072823 | AB42: 710451516 | AC42: 30415479 | AD42: 1252244 | AE42: 5051921 | AF42: 813327 | AG42: 293436566 | AH42: 2147493871 | AI42: 1772893425 | AJ42: 78624680 | AK42: 206567694 | AL42: 2058085799 | AM42: 56962882 | AN42: 109757 | AO42: 5488470 | AP42: 8311033 | AQ42: 70872136 | AR42: =RC[-30]+RC[-29] -> 15705665 | AS42: =RC[-24]/RC[-23] -> 0.338108664207216 | AT42: =RC[-12]/RC[-23] -> 170.112012128645 | AU42: =RC[-27]/RC[-43] -> 948.898760210612 | AV42: =RC[-26]/RC[-44] -> 30365.6401588752 | AW42: =RC[-42]/RC[-45] -> 36192.6732567073 | AX42: =SUM(RC[-43]:RC[-37])/RC[-46] -> 43107.6191466745 | AY42: =RC[-39]/RC[-47] -> 696.938901848772
A43: 'EFTA - Total | B43: 'Totals | D43: =RC[+19]/1000 -> 365 | E43: 252 | F43: 576 | G43: 29513106 | H43: 213551 | I43: 276097 | J43: 96137 | K43: 1331100 | L43: 312453 | M43: 24523 | N43: 895911 | O43: 17075 | P43: 22 | Q43: 31 | R43: 2704 | S43: 1103 | T43: 316308 | U43: 7652215 | V43: 10061366 | W43: 365000 | X43: 1528 | Y43: 863 | Z43: 2397 | AA43: 49824055 | AB43: 31107681 | AC43: 0 | AD43: 0 | AE43: 0 | AF43: 0 | AG43: 9869713 | AH43: 90801448 | AI43: 87769111 | AJ43: 3032337 | AK43: 0 | AL43: 90801448 | AM43: 2530295 | AN43: 4873 | AO43: 243671 | AP43: 367655 | AQ43: 3146494 | AR43: =RC[-30]+RC[-29] -> 912986 | AS43: =RC[-24]/RC[-23] -> 0.760554282589462 | AT43: =RC[-12]/RC[-23] -> 248.771090410959 | AU43: =RC[-27]/RC[-43] -> 866.597260273973 | AV43: =RC[-26]/RC[-44] -> 27565.3863013699 | AW43: =RC[-42]/RC[-45] -> 80857.8246575342 | AX43: =SUM(RC[-43]:RC[-37])/RC[-46] -> 87032.7863013699 | AY43: =RC[-39]/RC[-47] -> 856.035616438356
A44: 'World A - Total | B44: 'Totals | D44: =RC[+19]/1000 -> 25532.161 | E44: 8355 | F44: 14286 | G44: 1427438544 | H44: 9220092 | I44: 11730676 | J44: 8671109 | K44: 1377409700 | L44: 120253013 | M44: 4519118 | N44: 41334841 | O44: 4203040 | P44: 36 | Q44: 54 | R44: 149591 | S44: 24671 | T44: 13791141 | U44: 301923876 | V44: 355705795 | W44: 25532161 | X44: 47400 | Y44: 88055 | Z44: 139058 | AA44: 2796861970 | AB44: 2556554102 | AC44: 2973081 | AD44: 110369 | AE44: 1039427 | AF44: 2144630 | AG44: 741440296 | AH44: 6101123874 | AI44: 5225697634 | AJ44: 213183509 | AK44: 473711314 | AL44: 5912592465 | AM44: 174273615 | AN44: 325937 | AO44: 16299110 | AP44: 22279951 | AQ44: 213178613 | AR44: =RC[-30]+RC[-29] -> 45537881 | AS44: =RC[-24]/RC[-23] -> 0.848802241189239 | AT44: =RC[-12]/RC[-23] -> 238.958381705332 | AU44: =RC[-27]/RC[-43] -> 540.147815925178 | AV44: =RC[-26]/RC[-44] -> 13931.6760144196 | AW44: =RC[-42]/RC[-45] -> 55907.4707385716 | AX44: =SUM(RC[-43]:RC[-37])/RC[-46] -> 115902.537666122 | AY44: =RC[-39]/RC[-47] -> 4709.86427666659
A45: 'World B - Total | B45: 'Totals | D45: =RC[+19]/1000 -> 2491.846 | E45: 403 | F45: 481 | G45: 38041917 | H45: 240131 | I45: 324232 | J45: 225834 | K45: 27097172 | L45: 2437096 | M45: 90840 | N45: 1153970 | O45: 92910 | P45: 22 | Q45: 31 | R45: 48377 | S45: 17263 | T45: 4459895 | U45: 91419176 | V45: 82598490 | W45: 2491846 | X45: 1456 | Y45: 2180 | Z45: 3636 | AA45: 3523362 | AB45: 5848165 | AC45: 48439 | AD45: 182804 | AE45: 260699 | AF45: 716675 | AG45: 2956919 | AH45: 13537068 | AI45: 11831365 | AJ45: 253039 | AK45: 1335713 | AL45: 13420117 | AM45: 1287103 | AN45: 0 | AO45: 0 | AP45: 733036 | AQ45: 2020139 | AR45: =RC[-30]+RC[-29] -> 1246880 | AS45: =RC[-24]/RC[-23] -> 1.10678991831449 | AT45: =RC[-12]/RC[-23] -> 5.43254599200753 | AU45: =RC[-27]/RC[-43] -> 1789.79559732022 | AV45: =RC[-26]/RC[-44] -> 33147.5099183497 | AW45: =RC[-42]/RC[-45] -> 15266.56021279 | AX45: =SUM(RC[-43]:RC[-37])/RC[-46] -> 27472.493083441 | AY45: =RC[-39]/RC[-47] -> 978.028337224692
A46: 'EU Accession Countries - Totals | B46: 'Totals | D46: =RC[+19]/1000 -> 1617.714 | E46: 552 | F46: 2155 | G46: 88748523 | H46: 867001 | I46: 884621 | J46: 880305 | K46: 3030140 | L46: 350307 | M46: 38038 | N46: 3133775 | O46: 40573 | P46: 7 | Q46: 25 | R46: 4000 | S46: 1663 | T46: 1611350 | U46: 33776742 | V46: 24705800 | W46: 1617714 | X46: 7830 | Y46: 2936 | Z46: 10766 | AA46: 17057547 | AB46: 27442888 | AC46: 499882 | AD46: 715743 | AE46: 1191194 | AF46: 3289406 | AG46: 13818127 | AH46: 64014787 | AI46: 56020373 | AJ46: 1349036 | AK46: 6111107 | AL46: 63480522 | AM46: 5756136 | AN46: 159 | AO46: 136087 | AP46: 3132479 | AQ46: 9024861 | AR46: =RC[-30]+RC[-29] -> 3174348 | AS46: =RC[-24]/RC[-23] -> 1.36715840005181 | AT46: =RC[-12]/RC[-23] -> 39.5711398924655 | AU46: =RC[-27]/RC[-43] -> 996.066053702941 | AV46: =RC[-26]/RC[-44] -> 15272.0443786726 | AW46: =RC[-42]/RC[-45] -> 54860.453083796 | AX46: =SUM(RC[-43]:RC[-37])/RC[-46] -> 58600.5530025703 | AY46: =RC[-39]/RC[-47] -> 216.544457178463

Sheet: 1997
A1: 'Name | B1: 'Type | C1: 'Code | D1: 'Population '000s | E1: 'Libraries - Total Administrative Units | F1: 'Libraries - Service Points | G1: 'Collections - Books & Bound Periodicals | H1: 'Collections - Current Periodicals - Titles | I1: 'Collections - Current Periodicals - Subscriptions | J1: 'Collections - Manuscripts | K1: 'Collections - Microforms | L1: 'Collections - Audio-visual Materials | M1: 'Collections - CD-ROMs | N1: 'Additions - Books & Bound Periodicals | O1: 'Additions - Audio-visual Materials | P1: 'Facilities & Services - Percentage Stock on Open Access | Q1: 'Facilities & Services - Percentage Catalogue Records Automated | R1: 'Facilities & Services - Number of Workstations for users | S1: 'Facilities & Services - Number connected to the internet | T1: 'Use & Users - Registered Users | U1: 'Use & Users - Consultations | V1: 'Use & Users - Number of Visits | W1: 'Use & Users - Potential Total Population Served | X1: 'Library Staff FTE - Trained Librarians | Y1: 'Library Staff FTE - Other Library Staff | Z1: 'Library Staff FTE - Total Staff | AA1: 'Recurrent Expenditure (Euros) - Staff | AB1: 'Recurrent Expenditure (Euros) - Acquisition of Stock | AC1: 'Recurrent Expenditure (Euros) - Electronic Information | AD1: 'Recurrent Expenditure (Euros) - Automation | AE1: 'Recurrent Expenditure (Euros) - Premises and Related Costs | AF1: 'Recurrent Expenditure (Euros) - New Buildings / Refurbishment | AG1: 'Recurrent Expenditure (Euros) - Other Expenditure | AH1: 'Recurrent Expenditure (Euros) - TOTAL EXPENDITURE | AI1: 'Income - Public Funding | AJ1: 'Income - Fees & Charges | AK1: 'Income - Other Income | AL1: 'Income - TOTAL INCOME | AM1: 'Capital Expenditure - New Buildings / Refurbishment | AN1: 'Capital Expenditure - Acquisition of Stock | AO1: 'Capital Expenditure - Automation | AP1: 'Capital Expenditure - Other Capital Expenditure | AQ1: 'Capital Expenditure - TOTAL CAPITAL PAYMENTS | AR1: 'Additions | AS1: 'Loans per visit | AT1: 'Cost per pop | AU1: 'Users per 1000 pop | AV1: 'visits per 1000 pop | AW1: 'Bookstock per 1000 pop | AX1: 'Total stock per 1000 pop | AY1: 'AV materials per 1000 pop
A2: 'Bulgaria | B2: 'CEE | C2: 'C1 | D2: =RC[+19]/1000 -> 289 | E2: 92 | F2: 92 | G2: 8269272 | H2: 10078 | I2: 0 | J2: 0 | K2: 15715 | L2: 43546 | M2: 0 | N2: 103396 | O2: 495 | P2: 0 | Q2: 0 | R2: 0 | S2: 0 | T2: 191258 | U2: 5282430 | V2: 2607227 | W2: 289000 | X2: 498 | Y2: 397 | Z2: 895 | AA2: 469825 | AB2: 288543 | AC2: 0 | AD2: 0 | AE2: 0 | AF2: 0 | AG2: 232453 | AH2: 990821 | AI2: 600365 | AJ2: 347262 | AK2: 140132 | AL2: 1087759 | AM2: 0 | AN2: 0 | AO2: 0 | AP2: 0 | AQ2: 0 | AR2: =RC[-30]+RC[-29] -> 103891 | AS2: =RC[-24]/RC[-23] -> 2.02607214484968 | AT2: =RC[-12]/RC[-23] -> 3.42844636678201 | AU2: =RC[-27]/RC[-43] -> 661.792387543253 | AV2: =RC[-26]/RC[-44] -> 9021.54671280277 | AW2: =RC[-42]/RC[-45] -> 28613.3979238754 | AX2: =SUM(RC[-43]:RC[-37])/RC[-46] -> 28853.3252595156 | AY2: =RC[-39]/RC[-47] -> 150.678200692042
A3: 'Czech Republic | B3: 'CEE | C3: 'C2 | D3: =RC[+19]/1000 -> 192 | E3: 65 | F3: 800 | G3: 10414000 | H3: 21000 | I3: 0 | J3: 33000 | K3: 17000 | L3: 41000 | M3: 0 | N3: 215000 | O3: 2000 | P3: 0 | Q3: 0 | R3: 0 | S3: 0 | T3: 234000 | U3: 2119000 | V3: 3330748 | W3: 192000 | X3: 330 | Y3: 280 | Z3: 610 | AA3: 0 | AB3: 2523069 | AC3: 0 | AD3: 0 | AE3: 0 | AF3: 0 | AG3: 0 | AH3: 0 | AI3: 0 | AJ3: 0 | AK3: 0 | AL3: 0 | AM3: 0 | AN3: 0 | AO3: 0 | AP3: 0 | AQ3: 0 | AR3: =RC[-30]+RC[-29] -> 217000 | AS3: =RC[-24]/RC[-23] -> 0.636193431625569 | AT3: =RC[-12]/RC[-23] -> 0 | AU3: =RC[-27]/RC[-43] -> 1218.75 | AV3: =RC[-26]/RC[-44] -> 17347.6458333333 | AW3: =RC[-42]/RC[-45] -> 54239.5833333333 | AX3: =SUM(RC[-43]:RC[-37])/RC[-46] -> 54822.9166666667 | AY3: =RC[-39]/RC[-47] -> 213.541666666667
A4: 'Estonia | B4: 'CEE | C4: 'C3 | D4: =RC[+19]/1000 -> 48 | E4: 17 | F4: 34 | G4: 7539047 | H4: 12548 | I4: 20050 | J4: 67381 | K4: 373416 | L4: 27465 | M4: 1881 | N4: 110097 | O4: 2281 | P4: 5 | Q4: 5 | R4: 100 | S4: 80 | T4: 75289 | U4: 2316291 | V4: 1653611 | W4: 48000 | X4: 537 | Y4: 112 | Z4: 649 | AA4: 1551612 | AB4: 1494468 | AC4: 251406 | AD4: 0 | AE4: 300842 | AF4: 0 | AG4: 191475 | AH4: 3789804 | AI4: 4178516 | AJ4: 0 | AK4: 167015 | AL4: 4345531 | AM4: 327294 | AN4: 0 | AO4: 0 | AP4: 208797 | AQ4: 536090 | AR4: =RC[-30]+RC[-29] -> 112378 | AS4: =RC[-24]/RC[-23] -> 1.40074721322004 | AT4: =RC[-12]/RC[-23] -> 78.95425 | AU4: =RC[-27]/RC[-43] -> 1568.52083333333 | AV4: =RC[-26]/RC[-44] -> 34450.2291666667 | AW4: =RC[-42]/RC[-45] -> 157063.479166667 | AX4: =SUM(RC[-43]:RC[-37])/RC[-46] -> 167537.25 | AY4: =RC[-39]/RC[-47] -> 572.1875
A5: 'Hungary | B5: 'CEE | C5: 'C4 | D5: =RC[+19]/1000 -> 214 | E5: 34 | F5: 35 | G5: 10015000 | H5: 23000 | I5: 0 | J5: 158000 | K5: 472897 | L5: 18293 | M5: 520 | N5: 377709 | O5: 6076 | P5: 0 | Q5: 0 | R5: 0 | S5: 0 | T5: 175228 | U5: 1788000 | V5: 3785722 | W5: 214000 | X5: 592 | Y5: 368 | Z5: 960 | AA5: 1508810 | AB5: 3552710 | AC5: 24643 | AD5: 89054 | AE5: 140526 | AF5: 364590 | AG5: 374225 | AH5: 6054558 | AI5: 5221689 | AJ5: 199181 | AK5: 138671 | AL5: 5559541 | AM5: 0 | AN5: 0 | AO5: 0 | AP5: 0 | AQ5: 0 | AR5: =RC[-30]+RC[-29] -> 383785 | AS5: =RC[-24]/RC[-23] -> 0.472300924367928 | AT5: =RC[-12]/RC[-23] -> 28.2923271028037 | AU5: =RC[-27]/RC[-43] -> 818.822429906542 | AV5: =RC[-26]/RC[-44] -> 17690.2897196262 | AW5: =RC[-42]/RC[-45] -> 46799.0654205608 | AX5: =SUM(RC[-43]:RC[-37])/RC[-46] -> 49942.5700934579 | AY5: =RC[-39]/RC[-47] -> 85.481308411215
A6: 'Latvia | B6: 'CEE | C6: 'C5 | D6: =RC[+19]/1000 -> 61 | E6: 16 | F6: 16 | G6: 5919515 | H6: 0 | I6: 0 | J6: 21773 | K6: 0 | L6: 1517 | M6: 0 | N6: 76773 | O6: 0 | P6: 0 | Q6: 0 | R6: 0 | S6: 0 | T6: 51618 | U6: 3002512 | V6: 1118979 | W6: 61000 | X6: 134 | Y6: 193 | Z6: 327 | AA6: 472674 | AB6: 266164 | AC6: 0 | AD6: 0 | AE6: 0 | AF6: 0 | AG6: 164388 | AH6: 903226 | AI6: 778636 | AJ6: 48160 | AK6: 76430 | AL6: 903226 | AM6: 317940 | AN6: 0 | AO6: 0 | AP6: 202829 | AQ6: 520768 | AR6: =RC[-30]+RC[-29] -> 76773 | AS6: =RC[-24]/RC[-23] -> 2.68326036502919 | AT6: =RC[-12]/RC[-23] -> 14.8069836065574 | AU6: =RC[-27]/RC[-43] -> 846.196721311475 | AV6: =RC[-26]/RC[-44] -> 18343.9180327869 | AW6: =RC[-42]/RC[-45] -> 97041.2295081967 | AX6: =SUM(RC[-43]:RC[-37])/RC[-46] -> 97423.0327868852 | AY6: =RC[-39]/RC[-47] -> 24.8688524590164
A7: 'Lithuania | B7: 'CEE | C7: 'C6 | D7: =RC[+19]/1000 -> 97 | E7: 15 | F7: 83 | G7: 12035215 | H7: 3751 | I7: 3800 | J7: 235571 | K7: 25422 | L7: 2388 | M7: 1456 | N7: 153930 | O7: 128 | P7: 4 | Q7: 3 | R7: 134 | S7: 134 | T7: 85914 | U7: 5774470 | V7: 2965782 | W7: 97000 | X7: 552 | Y7: 90 | Z7: 642 | AA7: 725846 | AB7: 453640 | AC7: 0 | AD7: 0 | AE7: 0 | AF7: 0 | AG7: 22027 | AH7: 1201513 | AI7: 967621 | AJ7: 35919 | AK7: 194903 | AL7: 1198443 | AM7: 0 | AN7: 0 | AO7: 0 | AP7: 0 | AQ7: 0 | AR7: =RC[-30]+RC[-29] -> 154058 | AS7: =RC[-24]/RC[-23] -> 1.94703117086826 | AT7: =RC[-12]/RC[-23] -> 12.3867319587629 | AU7: =RC[-27]/RC[-43] -> 885.711340206186 | AV7: =RC[-26]/RC[-44] -> 30575.0721649485 | AW7: =RC[-42]/RC[-45] -> 124074.381443299 | AX7: =SUM(RC[-43]:RC[-37])/RC[-46] -> 126882.505154639 | AY7: =RC[-39]/RC[-47] -> 24.6185567010309
A8: 'Poland | B8: 'CEE | C8: 'C7 | D8: =RC[+19]/1000 -> 796 | E8: 0 | F8: 0 | G8: 0 | H8: 0 | I8: 0 | J8: 0 | K8: 0 | L8: 0 | M8: 0 | N8: 0 | O8: 0 | P8: 0 | Q8: 0 | R8: 0 | S8: 0 | T8: 0 | U8: 0 | V8: 0 | W8: 796000 | X8: 0 | Y8: 0 | Z8: 0 | AA8: 0 | AB8: 0 | AC8: 0 | AD8: 0 | AE8: 0 | AF8: 0 | AG8: 0 | AH8: 0 | AI8: 0 | AJ8: 0 | AK8: 0 | AL8: 0 | AM8: 0 | AN8: 0 | AO8: 0 | AP8: 0 | AQ8: 0 | AR8: =RC[-30]+RC[-29] -> 0 | AS8: =RC[-24]/RC[-23] -> #NUM! | AT8: =RC[-12]/RC[-23] -> 0 | AU8: =RC[-27]/RC[-43] -> 0 | AV8: =RC[-26]/RC[-44] -> 0 | AW8: =RC[-42]/RC[-45] -> 0 | AX8: =SUM(RC[-43]:RC[-37])/RC[-46] -> 0 | AY8: =RC[-39]/RC[-47] -> 0
A9: 'Romania | B9: 'CEE | C9: 'C8 | D9: =RC[+19]/1000 -> 438 | E9: 0 | F9: 0 | G9: 0 | H9: 0 | I9: 0 | J9: 0 | K9: 0 | L9: 0 | M9: 0 | N9: 0 | O9: 0 | P9: 0 | Q9: 0 | R9: 0 | S9: 0 | T9: 0 | U9: 0 | V9: 0 | W9: 438000 | X9: 0 | Y9: 0 | Z9: 0 | AA9: 0 | AB9: 0 | AC9: 0 | AD9: 0 | AE9: 0 | AF9: 0 | AG9: 0 | AH9: 0 | AI9: 0 | AJ9: 0 | AK9: 0 | AL9: 0 | AM9: 0 | AN9: 0 | AO9: 0 | AP9: 0 | AQ9: 0 | AR9: =RC[-30]+RC[-29] -> 0 | AS9: =RC[-24]/RC[-23] -> #NUM! | AT9: =RC[-12]/RC[-23] -> 0 | AU9: =RC[-27]/RC[-43] -> 0 | AV9: =RC[-26]/RC[-44] -> 0 | AW9: =RC[-42]/RC[-45] -> 0 | AX9: =SUM(RC[-43]:RC[-37])/RC[-46] -> 0 | AY9: =RC[-39]/RC[-47] -> 0
A10: 'Slovak Rep | B10: 'CEE | C10: 'C9 | D10: =RC[+19]/1000 -> 112 | E10: 41 | F10: 524 | G10: 4646428 | H10: 8464 | I10: 13008 | J10: 0 | K10: 0 | L10: 0 | M10: 742 | N10: 90558 | O10: 320 | P10: 0 | Q10: 0 | R10: 191 | S10: 58 | T10: 132731 | U10: 2502927 | V10: 620442 | W10: 112000 | X10: 515 | Y10: 42 | Z10: 557 | AA10: 673295 | AB10: 836165 | AC10: 60750 | AD10: 117460 | AE10: 45590 | AF10: 898804 | AG10: 88800 | AH10: 2720864 | AI10: 2355463 | AJ10: 25335 | AK10: 260746 | AL10: 2641544 | AM10: 201167 | AN10: 0 | AO10: 124295 | AP10: 0 | AQ10: 325462 | AR10: =RC[-30]+RC[-29] -> 90878 | AS10: =RC[-24]/RC[-23] -> 4.03410310713975 | AT10: =RC[-12]/RC[-23] -> 24.2934285714286 | AU10: =RC[-27]/RC[-43] -> 1185.09821428571 | AV10: =RC[-26]/RC[-44] -> 5539.66071428571 | AW10: =RC[-42]/RC[-45] -> 41485.9642857143 | AX10: =SUM(RC[-43]:RC[-37])/RC[-46] -> 41684.3035714286 | AY10: =RC[-39]/RC[-47] -> 0
A11: 'Slovenia | B11: 'CEE | C11: 'C10 | D11: =RC[+19]/1000 -> 55 | E11: 68 | F11: 68 | G11: 3147517 | H11: 14920 | I11: 12075 | J11: 0 | K11: 0 | L11: 0 | M11: 0 | N11: 97769 | O11: 18949 | P11: 0 | Q11: 44 | R11: 152 | S11: 144 | T11: 126464 | U11: 3123226 | V11: 1623843 | W11: 55000 | X11: 293 | Y11: 51 | Z11: 344 | AA11: 467641 | AB11: 4012420 | AC11: 10162 | AD11: 36725 | AE11: 57952 | AF11: 150354 | AG11: 5384933 | AH11: 10120187 | AI11: 9811711 | AJ11: 606872 | AK11: 963111 | AL11: 11381695 | AM11: 0 | AN11: 0 | AO11: 0 | AP11: 0 | AQ11: 0 | AR11: =RC[-30]+RC[-29] -> 116718 | AS11: =RC[-24]/RC[-23] -> 1.92335465928664 | AT11: =RC[-12]/RC[-23] -> 184.0034 | AU11: =RC[-27]/RC[-43] -> 2299.34545454545 | AV11: =RC[-26]/RC[-44] -> 29524.4181818182 | AW11: =RC[-42]/RC[-45] -> 57227.5818181818 | AX11: =SUM(RC[-43]:RC[-37])/RC[-46] -> 57718.4 | AY11: =RC[-39]/RC[-47] -> 0
A12: 'Austria | B12: 'EU | C12: 'C11 | D12: =RC[+19]/1000 -> 268 | E12: 0 | F12: 0 | G12: 0 | H12: 0 | I12: 0 | J12: 0 | K12: 0 | L12: 0 | M12: 0 | N12: 0 | O12: 0 | P12: 0 | Q12: 0 | R12: 0 | S12: 0 | T12: 0 | U12: 0 | V12: 0 | W12: 268000 | X12: 0 | Y12: 0 | Z12: 0 | AA12: 0 | AB12: 0 | AC12: 0 | AD12: 0 | AE12: 0 | AF12: 0 | AG12: 0 | AH12: 0 | AI12: 0 | AJ12: 0 | AK12: 0 | AL12: 0 | AM12: 0 | AN12: 0 | AO12: 0 | AP12: 0 | AQ12: 0 | AR12: =RC[-30]+RC[-29] -> 0 | AS12: =RC[-24]/RC[-23] -> #NUM! | AT12: =RC[-12]/RC[-23] -> 0 | AU12: =RC[-27]/RC[-43] -> 0 | AV12: =RC[-26]/RC[-44] -> 0 | AW12: =RC[-42]/RC[-45] -> 0 | AX12: =SUM(RC[-43]:RC[-37])/RC[-46] -> 0 | AY12: =RC[-39]/RC[-47] -> 0
A13: 'België Nederlandstalige Universiteiten | B13: 'België Nederlandstalige Universiteiten | C13: 'C12a | D13: 0 | E13: 0 | F13: 0 | G13: 0 | H13: 0 | I13: 0 | J13: 0 | K13: 0 | L13: 0 | M13: 0 | N13: 0 | O13: 0 | P13: 0 | Q13: 0 | R13: 0 | S13: 0 | T13: 0 | U13: 0 | V13: 0 | W13: 0 | X13: 0 | Y13: 0 | Z13: 0 | AA13: 0 | AB13: 0 | AC13: 0 | AD13: 0 | AE13: 0 | AF13: 0 | AG13: 0 | AH13: 0 | AI13: 0 | AJ13: 0 | AK13: 0 | AL13: 0 | AM13: 0 | AN13: 0 | AO13: 0 | AP13: 0 | AQ13: 0 | AR13: 0 | AS13: =RC[-24]/RC[-23] -> #NUM! | AT13: =RC[-12]/RC[-23] -> #NUM! | AU13: =RC[-27]/RC[-43] -> #NUM! | AV13: =RC[-26]/RC[-44] -> #NUM! | AW13: =RC[-42]/RC[-45] -> #NUM! | AX13: =SUM(RC[-43]:RC[-37])/RC[-46] -> #NUM! | AY13: =RC[-39]/RC[-47] -> #NUM!
A14: 'Belgique universités francophones | B14: 'Belgique universités francophones | C14: 'C12b | D14: 0 | E14: 0 | F14: 0 | G14: 0 | H14: 0 | I14: 0 | J14: 0 | K14: 0 | L14: 0 | M14: 0 | N14: 0 | O14: 0 | P14: 0 | Q14: 0 | R14: 0 | S14: 0 | T14: 0 | U14: 0 | V14: 0 | W14: 0 | X14: 0 | Y14: 0 | Z14: 0 | AA14: 0 | AB14: 0 | AC14: 0 | AD14: 0 | AE14: 0 | AF14: 0 | AG14: 0 | AH14: 0 | AI14: 0 | AJ14: 0 | AK14: 0 | AL14: 0 | AM14: 0 | AN14: 0 | AO14: 0 | AP14: 0 | AQ14: 0 | AR14: 0 | AS14: =RC[-24]/RC[-23] -> #NUM! | AT14: =RC[-12]/RC[-23] -> #NUM! | AU14: =RC[-27]/RC[-43] -> #NUM! | AV14: =RC[-26]/RC[-44] -> #NUM! | AW14: =RC[-42]/RC[-45] -> #NUM! | AX14: =SUM(RC[-43]:RC[-37])/RC[-46] -> #NUM! | AY14: =RC[-39]/RC[-47] -> #NUM!
A15: 'Belgium | B15: 'EU | C15: 'C12 | D15: =RC[+19]/1000 -> 172 | E15: 16 | F15: 61 | G15: 18301000 | H15: 67000 | I15: 34588 | J15: 20000 | K15: 311000 | L15: 11000 | M15: 860 | N15: 393000 | O15: 699 | P15: 42 | Q15: 54 | R15: 640 | S15: 0 | T15: 139000 | U15: 743570 | V15: 5743293 | W15: 172000 | X15: 206 | Y15: 359 | Z15: 565 | AA15: 6118202 | AB15: 5004654 | AC15: 242969 | AD15: 449168 | AE15: 649470 | AF15: 0 | AG15: 206599 | AH15: 12671060 | AI15: 5153098 | AJ15: 39353 | AK15: 319573 | AL15: 5512023 | AM15: 12 | AN15: 5441 | AO15: 272091 | AP15: 7 | AQ15: 277551 | AR15: =RC[-30]+RC[-29] -> 393699 | AS15: =RC[-24]/RC[-23] -> 0.129467537177713 | AT15: =RC[-12]/RC[-23] -> 73.6689534883721 | AU15: =RC[-27]/RC[-43] -> 808.139534883721 | AV15: =RC[-26]/RC[-44] -> 33391.238372093 | AW15: =RC[-42]/RC[-45] -> 106401.162790698 | AX15: =SUM(RC[-43]:RC[-37])/RC[-46] -> 108985.162790698 | AY15: =RC[-39]/RC[-47] -> 63.953488372093
A16: 'Denmark | B16: 'EU | C16: 'C13 | D16: =RC[+19]/1000 -> 180 | E16: 20 | F16: 45 | G16: 9364000 | H16: 0 | I16: 81412 | J16: 74000 | K16: 1116466 | L16: 827289 | M16: 6947 | N16: 233649 | O16: 18303 | P16: 0 | Q16: 0 | R16: 842 | S16: 0 | T16: 0 | U16: 4065248 | V16: 0 | W16: 180000 | X16: 363 | Y16: 407 | Z16: 770 | AA16: 32290632 | AB16: 14644737 | AC16: 670866 | AD16: 23072 | AE16: 217292 | AF16: 0 | AG16: 7693641 | AH16: 55540241 | AI16: 53749701 | AJ16: 969947 | AK16: 1591276 | AL16: 56310925 | AM16: 2566435 | AN16: 0 | AO16: 0 | AP16: 0 | AQ16: 2566435 | AR16: =RC[-30]+RC[-29] -> 251952 | AS16: =RC[-24]/RC[-23] -> #NUM! | AT16: =RC[-12]/RC[-23] -> 308.556894444444 | AU16: =RC[-27]/RC[-43] -> 0 | AV16: =RC[-26]/RC[-44] -> 0 | AW16: =RC[-42]/RC[-45] -> 52022.2222222222 | AX16: =SUM(RC[-43]:RC[-37])/RC[-46] -> 63722.8555555556 | AY16: =RC[-39]/RC[-47] -> 4596.05
A17: 'Eire | B17: 'EU | C17: 'C15 | D17: =RC[+19]/1000 -> 137 | E17: 0 | F17: 0 | G17: 0 | H17: 0 | I17: 0 | J17: 0 | K17: 0 | L17: 0 | M17: 0 | N17: 0 | O17: 0 | P17: 0 | Q17: 0 | R17: 0 | S17: 0 | T17: 0 | U17: 0 | V17: 0 | W17: 137000 | X17: 0 | Y17: 0 | Z17: 0 | AA17: 0 | AB17: 0 | AC17: 0 | AD17: 0 | AE17: 0 | AF17: 0 | AG17: 0 | AH17: 0 | AI17: 0 | AJ17: 0 | AK17: 0 | AL17: 0 | AM17: 0 | AN17: 0 | AO17: 0 | AP17: 0 | AQ17: 0 | AR17: =RC[-30]+RC[-29] -> 0 | AS17: =RC[-24]/RC[-23] -> #NUM! | AT17: =RC[-12]/RC[-23] -> 0 | AU17: =RC[-27]/RC[-43] -> 0 | AV17: =RC[-26]/RC[-44] -> 0 | AW17: =RC[-42]/RC[-45] -> 0 | AX17: =SUM(RC[-43]:RC[-37])/RC[-46] -> 0 | AY17: =RC[-39]/RC[-47] -> 0
A18: 'Finland | B18: 'EU | C18: 'C16 | D18: =RC[+19]/1000 -> 224 | E18: 19 | F18: 304 | G18: 13833439 | H18: 110566 | I18: 128399 | J18: 196975 | K18: 1249403 | L18: 226588 | M18: 0 | N18: 443029 | O18: 10567 | P18: 45 | Q18: 0 | R18: 0 | S18: 0 | T18: 0 | U18: 7137194 | V18: 8958827 | W18: 224000 | X18: 927 | Y18: 136 | Z18: 1063 | AA18: 25168281 | AB18: 15057273 | AC18: 0 | AD18: 0 | AE18: 0 | AF18: 507326 | AG18: 6675719 | AH18: 47408598 | AI18: 37506298 | AJ18: 4680443 | AK18: 4087531 | AL18: 46190551 | AM18: 0 | AN18: 0 | AO18: 0 | AP18: 0 | AQ18: 0 | AR18: =RC[-30]+RC[-29] -> 453596 | AS18: =RC[-24]/RC[-23] -> 0.796666126045296 | AT18: =RC[-12]/RC[-23] -> 211.645526785714 | AU18: =RC[-27]/RC[-43] -> 0 | AV18: =RC[-26]/RC[-44] -> 39994.7633928571 | AW18: =RC[-42]/RC[-45] -> 61756.4241071429 | AX18: =SUM(RC[-43]:RC[-37])/RC[-46] -> 70291.8303571429 | AY18: =RC[-39]/RC[-47] -> 1011.55357142857
A19: 'France | B19: 'EU | C19: 'C17 | D19: =RC[+19]/1000 -> 2266 | E19: 95 | F19: 333 | G19: 24289889 | H19: 148148 | I19: 0 | J19: 0 | K19: 2817834 | L19: 71668 | M19: 29988 | N19: 1040621 | O19: 0 | P19: 36 | Q19: 0 | R19: 0 | S19: 0 | T19: 0 | U19: 0 | V19: 0 | W19: 2266000 | X19: 1620 | Y19: 2264 | Z19: 3884 | AA19: 126698303 | AB19: 57043738 | AC19: 0 | AD19: 0 | AE19: 0 | AF19: 0 | AG19: 51622195 | AH19: 235364236 | AI19: 221473448 | AJ19: 7538024 | AK19: 7826327 | AL19: 236837798 | AM19: 0 | AN19: 0 | AO19: 0 | AP19: 0 | AQ19: 0 | AR19: =RC[-30]+RC[-29] -> 1040621 | AS19: =RC[-24]/RC[-23] -> #NUM! | AT19: =RC[-12]/RC[-23] -> 103.867712268314 | AU19: =RC[-27]/RC[-43] -> 0 | AV19: =RC[-26]/RC[-44] -> 0 | AW19: =RC[-42]/RC[-45] -> 10719.2802294793 | AX19: =SUM(RC[-43]:RC[-37])/RC[-46] -> 12073.0481023831 | AY19: =RC[-39]/RC[-47] -> 31.6275375110327
A20: 'Greece | B20: 'EU | C20: 'C18 | D20: =RC[+19]/1000 -> 346 | E20: 81 | F20: 167 | G20: 5683287 | H20: 0 | I20: 36200 | J20: 29790 | K20: 25338 | L20: 22796 | M20: 5926 | N20: 296750 | O20: 1439 | P20: 36 | Q20: 49 | R20: 0 | S20: 0 | T20: 402192 | U20: 1415696 | V20: 0 | W20: 346000 | X20: 728 | Y20: 395 | Z20: 1123 | AA20: 3303046 | AB20: 11869457 | AC20: 567572 | AD20: 103275 | AE20: 0 | AF20: 772661 | AG20: 3212947 | AH20: 19828958 | AI20: 11126164 | AJ20: 8552782 | AK20: 150012 | AL20: 19828958 | AM20: 0 | AN20: 0 | AO20: 0 | AP20: 0 | AQ20: 0 | AR20: =RC[-30]+RC[-29] -> 298189 | AS20: =RC[-24]/RC[-23] -> #NUM! | AT20: =RC[-12]/RC[-23] -> 57.3091271676301 | AU20: =RC[-27]/RC[-43] -> 1162.40462427746 | AV20: =RC[-26]/RC[-44] -> 0 | AW20: =RC[-42]/RC[-45] -> 16425.6849710983 | AX20: =SUM(RC[-43]:RC[-37])/RC[-46] -> 16772.6502890173 | AY20: =RC[-39]/RC[-47] -> 65.8843930635838
A21: 'Iceland | B21: 'EFTA | C21: 'C19 | D21: =RC[+19]/1000 -> 8 | E21: 0 | F21: 0 | G21: 0 | H21: 0 | I21: 0 | J21: 0 | K21: 0 | L21: 0 | M21: 0 | N21: 0 | O21: 0 | P21: 0 | Q21: 0 | R21: 0 | S21: 0 | T21: 0 | U21: 0 | V21: 0 | W21: 8000 | X21: 0 | Y21: 0 | Z21: 0 | AA21: 0 | AB21: 0 | AC21: 0 | AD21: 0 | AE21: 0 | AF21: 0 | AG21: 0 | AH21: 0 | AI21: 0 | AJ21: 0 | AK21: 0 | AL21: 0 | AM21: 0 | AN21: 0 | AO21: 0 | AP21: 0 | AQ21: 0 | AR21: =RC[-30]+RC[-29] -> 0 | AS21: =RC[-24]/RC[-23] -> #NUM! | AT21: =RC[-12]/RC[-23] -> 0 | AU21: =RC[-27]/RC[-43] -> 0 | AV21: =RC[-26]/RC[-44] -> 0 | AW21: =RC[-42]/RC[-45] -> 0 | AX21: =SUM(RC[-43]:RC[-37])/RC[-46] -> 0 | AY21: =RC[-39]/RC[-47] -> 0
A22: 'Italy | B22: 'EU | C22: 'C20 | D22: =RC[+19]/1000 -> 1852 | E22: 0 | F22: 0 | G22: 0 | H22: 0 | I22: 0 | J22: 0 | K22: 0 | L22: 0 | M22: 0 | N22: 0 | O22: 0 | P22: 0 | Q22: 0 | R22: 0 | S22: 0 | T22: 0 | U22: 0 | V22: 0 | W22: 1852000 | X22: 0 | Y22: 0 | Z22: 0 | AA22: 0 | AB22: 0 | AC22: 0 | AD22: 0 | AE22: 0 | AF22: 0 | AG22: 0 | AH22: 0 | AI22: 0 | AJ22: 0 | AK22: 0 | AL22: 0 | AM22: 0 | AN22: 0 | AO22: 0 | AP22: 0 | AQ22: 0 | AR22: =RC[-30]+RC[-29] -> 0 | AS22: =RC[-24]/RC[-23] -> #NUM! | AT22: =RC[-12]/RC[-23] -> 0 | AU22: =RC[-27]/RC[-43] -> 0 | AV22: =RC[-26]/RC[-44] -> 0 | AW22: =RC[-42]/RC[-45] -> 0 | AX22: =SUM(RC[-43]:RC[-37])/RC[-46] -> 0 | AY22: =RC[-39]/RC[-47] -> 0
A23: 'Liechtenstein | B23: 'EFTA | C23: 'C21 | D23: =RC[+19]/1000 -> 1 | E23: 0 | F23: 0 | G23: 0 | H23: 0 | I23: 0 | J23: 0 | K23: 0 | L23: 0 | M23: 0 | N23: 0 | O23: 0 | P23: 0 | Q23: 0 | R23: 0 | S23: 0 | T23: 0 | U23: 0 | V23: 0 | W23: 1000 | X23: 0 | Y23: 0 | Z23: 0 | AA23: 0 | AB23: 0 | AC23: 0 | AD23: 0 | AE23: 0 | AF23: 0 | AG23: 0 | AH23: 0 | AI23: 0 | AJ23: 0 | AK23: 0 | AL23: 0 | AM23: 0 | AN23: 0 | AO23: 0 | AP23: 0 | AQ23: 0 | AR23: =RC[-30]+RC[-29] -> 0 | AS23: =RC[-24]/RC[-23] -> #NUM! | AT23: =RC[-12]/RC[-23] -> 0 | AU23: =RC[-27]/RC[-43] -> 0 | AV23: =RC[-26]/RC[-44] -> 0 | AW23: =RC[-42]/RC[-45] -> 0 | AX23: =SUM(RC[-43]:RC[-37])/RC[-46] -> 0 | AY23: =RC[-39]/RC[-47] -> 0
A24: 'Luxembourg | B24: 'EU | C24: 'C22 | D24: =RC[+19]/1000 -> 2.979 | E24: 7 | F24: 5 | G24: 247030 | H24: 1650 | I24: 881 | J24: 10 | K24: 5 | L24: 847 | M24: 37 | N24: 3800 | O24: 120 | P24: 75 | Q24: 53 | R24: 18 | S24: 14 | T24: 13837 | U24: 0 | V24: 0 | W24: 2979 | X24: 4 | Y24: 4 | Z24: 8 | AA24: 183601 | AB24: 187723 | AC24: 4486 | AD24: 91 | AE24: 3128 | AF24: 202 | AG24: 43750 | AH24: 422981 | AI24: 216242 | AJ24: 0 | AK24: 13322 | AL24: 229564 | AM24: 0 | AN24: 0 | AO24: 0 | AP24: 0 | AQ24: 0 | AR24: =RC[-30]+RC[-29] -> 3920 | AS24: =RC[-24]/RC[-23] -> #NUM! | AT24: =RC[-12]/RC[-23] -> 141.98757972474 | AU24: =RC[-27]/RC[-43] -> 4644.84726418261 | AV24: =RC[-26]/RC[-44] -> 0 | AW24: =RC[-42]/RC[-45] -> 82923.7999328634 | AX24: =SUM(RC[-43]:RC[-37])/RC[-46] -> 84075.1930177912 | AY24: =RC[-39]/RC[-47] -> 284.323598522994
A25: 'Netherlands | B25: 'EU | C25: 'C23 | D25: =RC[+19]/1000 -> 540 | E25: 23 | F25: 140 | G25: 24043000 | H25: 147200 | I25: 148300 | J25: 0 | K25: 4675000 | L25: 0 | M25: 0 | N25: 0 | O25: 0 | P25: 0 | Q25: 0 | R25: 0 | S25: 0 | T25: 0 | U25: 3926000 | V25: 0 | W25: 540000 | X25: 904 | Y25: 943 | Z25: 1847 | AA25: 0 | AB25: 0 | AC25: 0 | AD25: 0 | AE25: 0 | AF25: 0 | AG25: 0 | AH25: 0 | AI25: 0 | AJ25: 0 | AK25: 0 | AL25: 0 | AM25: 0 | AN25: 0 | AO25: 0 | AP25: 0 | AQ25: 0 | AR25: =RC[-30]+RC[-29] -> 0 | AS25: =RC[-24]/RC[-23] -> #NUM! | AT25: =RC[-12]/RC[-23] -> 0 | AU25: =RC[-27]/RC[-43] -> 0 | AV25: =RC[-26]/RC[-44] -> 0 | AW25: =RC[-42]/RC[-45] -> 44524.0740740741 | AX25: =SUM(RC[-43]:RC[-37])/RC[-46] -> 53728.7037037037 | AY25: =RC[-39]/RC[-47] -> 0
A26: 'Norway | B26: 'EFTA | C26: 'C24 | D26: =RC[+19]/1000 -> 193 | E26: 95 | F26: 215 | G26: 10725257 | H26: 86934 | I26: 0 | J26: 35289 | K26: 480471 | L26: 114723 | M26: 0 | N26: 335158 | O26: 12540 | P26: 22 | Q26: 0 | R26: 748 | S26: 330 | T26: 0 | U26: 2609463 | V26: 4836784 | W26: 193000 | X26: 582 | Y26: 331 | Z26: 885 | AA26: 25891021 | AB26: 17028512 | AC26: 0 | AD26: 0 | AE26: 0 | AF26: 0 | AG26: 6314312 | AH26: 49233845 | AI26: 47505864 | AJ26: 1727981 | AK26: 0 | AL26: 49233845 | AM26: 0 | AN26: 0 | AO26: 0 | AP26: 0 | AQ26: 0 | AR26: =RC[-30]+RC[-29] -> 347698 | AS26: =RC[-24]/RC[-23] -> 0.539503728097017 | AT26: =RC[-12]/RC[-23] -> 255.097642487047 | AU26: =RC[-27]/RC[-43] -> 0 | AV26: =RC[-26]/RC[-44] -> 25061.0569948187 | AW26: =RC[-42]/RC[-45] -> 55571.2797927461 | AX26: =SUM(RC[-43]:RC[-37])/RC[-46] -> 59288.4663212435 | AY26: =RC[-39]/RC[-47] -> 594.419689119171
A27: 'Portugal | B27: 'EU | C27: 'C25 | D27: =RC[+19]/1000 -> 325 | E27: 225 | F27: 225 | G27: 8127193 | H27: 0 | I27: 0 | J27: 14398 | K27: 43002 | L27: 187780 | M27: 0 | N27: 487992 | O27: 10019 | P27: 0 | Q27: 0 | R27: 414 | S27: 143 | T27: 841500 | U27: 1244504 | V27: 0 | W27: 325000 | X27: 591 | Y27: 437 | Z27: 1028 | AA27: 4835741 | AB27: 8093822 | AC27: 0 | AD27: 0 | AE27: 0 | AF27: 0 | AG27: 1197629 | AH27: 14127192 | AI27: 13599479 | AJ27: 548530 | AK27: 606741 | AL27: 14754750 | AM27: 0 | AN27: 0 | AO27: 0 | AP27: 553022 | AQ27: 553022 | AR27: =RC[-30]+RC[-29] -> 498011 | AS27: =RC[-24]/RC[-23] -> #NUM! | AT27: =RC[-12]/RC[-23] -> 43.4682830769231 | AU27: =RC[-27]/RC[-43] -> 2589.23076923077 | AV27: =RC[-26]/RC[-44] -> 0 | AW27: =RC[-42]/RC[-45] -> 25006.7476923077 | AX27: =SUM(RC[-43]:RC[-37])/RC[-46] -> 25761.1476923077 | AY27: =RC[-39]/RC[-47] -> 577.784615384615
A28: 'Spain | B28: 'EU | C28: 'C26 | D28: =RC[+19]/1000 -> 1680 | E28: 640 | F28: 1118 | G28: 24564000 | H28: 400441 | I28: 0 | J28: 45000 | K28: 1290000 | L28: 614000 | M28: 61000 | N28: 1228000 | O28: 46000 | P28: 0 | Q28: 0 | R28: 0 | S28: 0 | T28: 2149000 | U28: 13817000 | V28: 42457793 | W28: 1680000 | X28: 3100 | Y28: 1500 | Z28: 4600 | AA28: 82663819 | AB28: 49883342 | AC28: 0 | AD28: 0 | AE28: 0 | AF28: 0 | AG28: 9976665 | AH28: 142523826 | AI28: 122194236 | AJ28: 5024139 | AK28: 15305451 | AL28: 142523826 | AM28: 0 | AN28: 0 | AO28: 0 | AP28: 0 | AQ28: 0 | AR28: =RC[-30]+RC[-29] -> 1274000 | AS28: =RC[-24]/RC[-23] -> 0.325429067874536 | AT28: =RC[-12]/RC[-23] -> 84.8356107142857 | AU28: =RC[-27]/RC[-43] -> 1279.16666666667 | AV28: =RC[-26]/RC[-44] -> 25272.4958333333 | AW28: =RC[-42]/RC[-45] -> 14621.4285714286 | AX28: =SUM(RC[-43]:RC[-37])/RC[-46] -> 16056.2148809524 | AY28: =RC[-39]/RC[-47] -> 365.47619047619
A29: 'Sweden | B29: 'EU | C29: 'C27 | D29: =RC[+19]/1000 -> 292 | E29: 37 | F29: 155 | G29: 23323000 | H29: 254183 | I29: 0 | J29: 69985 | K29: 2710924 | L29: 45375 | M29: 4482 | N29: 342000 | O29: 504 | P29: 0 | Q29: 0 | R29: 1211 | S29: 0 | T29: 497999 | U29: 5270509 | V29: 0 | W29: 292000 | X29: 939 | Y29: 529 | Z29: 1468 | AA29: 46338666 | AB29: 21700433 | AC29: 0 | AD29: 0 | AE29: 0 | AF29: 0 | AG29: 14367736 | AH29: 82406835 | AI29: 72137204 | AJ29: 1732922 | AK29: 8536709 | AL29: 82406835 | AM29: 0 | AN29: 0 | AO29: 0 | AP29: 0 | AQ29: 0 | AR29: =RC[-30]+RC[-29] -> 342504 | AS29: =RC[-24]/RC[-23] -> #NUM! | AT29: =RC[-12]/RC[-23] -> 282.215188356164 | AU29: =RC[-27]/RC[-43] -> 1705.47602739726 | AV29: =RC[-26]/RC[-44] -> 0 | AW29: =RC[-42]/RC[-45] -> 79873.2876712329 | AX29: =SUM(RC[-43]:RC[-37])/RC[-46] -> 90438.1815068493 | AY29: =RC[-39]/RC[-47] -> 155.393835616438
A30: 'Switzerland | B30: 'EFTA | C30: 'C28 | D30: =RC[+19]/1000 -> 162 | E30: 0 | F30: 0 | G30: 0 | H30: 0 | I30: 0 | J30: 0 | K30: 0 | L30: 0 | M30: 0 | N30: 0 | O30: 0 | P30: 0 | Q30: 0 | R30: 0 | S30: 0 | T30: 0 | U30: 0 | V30: 0 | W30: 162000 | X30: 0 | Y30: 0 | Z30: 0 | AA30: 0 | AB30: 0 | AC30: 0 | AD30: 0 | AE30: 0 | AF30: 0 | AG30: 0 | AH30: 0 | AI30: 0 | AJ30: 0 | AK30: 0 | AL30: 0 | AM30: 0 | AN30: 0 | AO30: 0 | AP30: 0 | AQ30: 0 | AR30: =RC[-30]+RC[-29] -> 0 | AS30: =RC[-24]/RC[-23] -> #NUM! | AT30: =RC[-12]/RC[-23] -> 0 | AU30: =RC[-27]/RC[-43] -> 0 | AV30: =RC[-26]/RC[-44] -> 0 | AW30: =RC[-42]/RC[-45] -> 0 | AX30: =SUM(RC[-43]:RC[-37])/RC[-46] -> 0 | AY30: =RC[-39]/RC[-47] -> 0
A31: 'UK | B31: 'EU | C31: 'C29 | D31: =RC[+19]/1000 -> 1910 | E31: 177 | F31: 760 | G31: 90526000 | H31: 556000 | I31: 0 | J31: 90000 | K31: 8471000 | L31: 6230000 | M31: 0 | N31: 2648000 | O31: 136866 | P31: 0 | Q31: 0 | R31: 22980 | S31: 22980 | T31: 2321000 | U31: 72500000 | V31: 113900000 | W31: 1910000 | X31: 3435 | Y31: 5455 | Z31: 8890 | AA31: 257041704 | AB31: 160948081 | AC31: 13184056 | AD31: 256178 | AE31: 2412629 | AF31: 0 | AG31: 81595658 | AH31: 515438305 | AI31: 365705018 | AJ31: 12701000 | AK31: 78043750 | AL31: 456449768 | AM31: 0 | AN31: 0 | AO31: 0 | AP31: 0 | AQ31: 0 | AR31: =RC[-30]+RC[-29] -> 2784866 | AS31: =RC[-24]/RC[-23] -> 0.636523266022827 | AT31: =RC[-12]/RC[-23] -> 269.862986910995 | AU31: =RC[-27]/RC[-43] -> 1215.1832460733 | AV31: =RC[-26]/RC[-44] -> 59633.5078534031 | AW31: =RC[-42]/RC[-45] -> 47395.8115183246 | AX31: =SUM(RC[-43]:RC[-37])/RC[-46] -> 55430.890052356 | AY31: =RC[-39]/RC[-47] -> 3261.78010471204
A32: 'Germany | B32: 'EU | C32: 'C31 | D32: =RC[+19]/1000 -> 2415 | E32: 255 | F32: 1166 | G32: 143123027 | H32: 0 | I32: 475875 | J32: 155266 | K32: 31393465 | L32: 1538792 | M32: 0 | N32: 3747592 | O32: 53427 | P32: 0 | Q32: 0 | R32: 0 | S32: 0 | T32: 2101009 | U32: 57764752 | V32: 0 | W32: 2415000 | X32: 5586 | Y32: 3662 | Z32: 9248 | AA32: 237878656 | AB32: 191301030 | AC32: 0 | AD32: 0 | AE32: 0 | AF32: 0 | AG32: 26968221 | AH32: 456147907 | AI32: 422242454 | AJ32: 10479299 | AK32: 23426154 | AL32: 456147907 | AM32: 11915831 | AN32: 25262 | AO32: 1263299 | AP32: 2567674 | AQ32: 15772067 | AR32: =RC[-30]+RC[-29] -> 3801019 | AS32: =RC[-24]/RC[-23] -> #NUM! | AT32: =RC[-12]/RC[-23] -> 188.881120910973 | AU32: =RC[-27]/RC[-43] -> 869.983022774327 | AV32: =RC[-26]/RC[-44] -> 0 | AW32: =RC[-42]/RC[-45] -> 59264.1933747412 | AX32: =SUM(RC[-43]:RC[-37])/RC[-46] -> 73162.0807453416 | AY32: =RC[-39]/RC[-47] -> 637.180952380952
A33: 'USA | B33: 'World - A | C33: 'C50 | D33: =RC[+19]/1000 -> 16072.976 | E33: 3533 | F33: 0 | G33: 842811692 | H33: 0 | I33: 6626232 | J33: 0 | K33: 621642543 | L33: 52713984 | M33: 2227866 | N33: 20426862 | O33: 1969547 | P33: 0 | Q33: 0 | R33: 0 | S33: 3108 | T33: 0 | U33: 223400252 | V33: 16324851 | W33: 16072976 | X33: 28655 | Y33: 67490 | Z33: 96145 | AA33: 1754054448 | AB33: 1224375073 | AC33: 0 | AD33: 0 | AE33: 0 | AF33: 0 | AG33: 534686830 | AH33: 3513116351 | AI33: 2885525787 | AJ33: 112764838 | AK33: 273853302 | AL33: 3272143927 | AM33: 0 | AN33: 0 | AO33: 0 | AP33: 0 | AQ33: 0 | AR33: =RC[-30]+RC[-29] -> 22396409 | AS33: =RC[-24]/RC[-23] -> 13.6846732628678 | AT33: =RC[-12]/RC[-23] -> 218.572861117941 | AU33: =RC[-27]/RC[-43] -> 0 | AV33: =RC[-26]/RC[-44] -> 1015.67071337629 | AW33: =RC[-42]/RC[-45] -> 52436.5675653345 | AX33: =SUM(RC[-43]:RC[-37])/RC[-46] -> 94943.3581559507 | AY33: =RC[-39]/RC[-47] -> 3279.66544590124
A34: 'Turkey | B34: 'World - B | C34: 'C42 | D34: =RC[+19]/1000 -> 1019.781 | E34: 0 | F34: 0 | G34: 0 | H34: 0 | I34: 0 | J34: 0 | K34: 0 | L34: 0 | M34: 0 | N34: 0 | O34: 0 | P34: 0 | Q34: 0 | R34: 0 | S34: 0 | T34: 0 | U34: 0 | V34: 0 | W34: 1019781 | X34: 0 | Y34: 0 | Z34: 0 | AA34: 0 | AB34: 0 | AC34: 0 | AD34: 0 | AE34: 0 | AF34: 0 | AG34: 0 | AH34: 0 | AI34: 0 | AJ34: 0 | AK34: 0 | AL34: 0 | AM34: 0 | AN34: 0 | AO34: 0 | AP34: 0 | AQ34: 0 | AR34: =RC[-30]+RC[-29] -> 0 | AS34: =RC[-24]/RC[-23] -> #NUM! | AT34: =RC[-12]/RC[-23] -> 0 | AU34: =RC[-27]/RC[-43] -> 0 | AV34: =RC[-26]/RC[-44] -> 0 | AW34: =RC[-42]/RC[-45] -> 0 | AX34: =SUM(RC[-43]:RC[-37])/RC[-46] -> 0 | AY34: =RC[-39]/RC[-47] -> 0
A35: 'Australia | B35: 'World - A | C35: 'C70 | D35: =RC[+19]/1000 -> 1063.775 | E35: 0 | F35: 0 | G35: 0 | H35: 0 | I35: 0 | J35: 0 | K35: 0 | L35: 0 | M35: 0 | N35: 0 | O35: 0 | P35: 0 | Q35: 0 | R35: 0 | S35: 0 | T35: 0 | U35: 0 | V35: 0 | W35: 1063775 | X35: 0 | Y35: 0 | Z35: 0 | AA35: 0 | AB35: 0 | AC35: 0 | AD35: 0 | AE35: 0 | AF35: 0 | AG35: 0 | AH35: 0 | AI35: 0 | AJ35: 0 | AK35: 0 | AL35: 0 | AM35: 0 | AN35: 0 | AO35: 0 | AP35: 0 | AQ35: 0 | AR35: =RC[-30]+RC[-29] -> 0 | AS35: =RC[-24]/RC[-23] -> #NUM! | AT35: =RC[-12]/RC[-23] -> 0 | AU35: =RC[-27]/RC[-43] -> 0 | AV35: =RC[-26]/RC[-44] -> 0 | AW35: =RC[-42]/RC[-45] -> 0 | AX35: =SUM(RC[-43]:RC[-37])/RC[-46] -> 0 | AY35: =RC[-39]/RC[-47] -> 0
A36: 'Japan | B36: 'World - A | C36: 'C41 | D36: =RC[+19]/1000 -> 3782.313 | E36: 1055 | F36: 1638 | G36: 255312000 | H36: 0 | I36: 0 | J36: 0 | K36: 0 | L36: 0 | M36: 0 | N36: 8105000 | O36: 0 | P36: 0 | Q36: 0 | R36: 0 | S36: 0 | T36: 0 | U36: 27495000 | V36: 0 | W36: 3782313 | X36: 7775 | Y36: 7330 | Z36: 15105 | AA36: 394563885 | AB36: 575846079 | AC36: 4186425 | AD36: 155411 | AE36: 1463629 | AF36: 3019875 | AG36: 51822567 | AH36: 1031057871 | AI36: 846867504 | AJ36: 33095139 | AK36: 80372688 | AL36: 960335330 | AM36: 0 | AN36: 0 | AO36: 0 | AP36: 0 | AQ36: 0 | AR36: =RC[-30]+RC[-29] -> 8105000 | AS36: =RC[-24]/RC[-23] -> #NUM! | AT36: =RC[-12]/RC[-23] -> 272.599827407198 | AU36: =RC[-27]/RC[-43] -> 0 | AV36: =RC[-26]/RC[-44] -> 0 | AW36: =RC[-42]/RC[-45] -> 67501.5526213722 | AX36: =SUM(RC[-43]:RC[-37])/RC[-46] -> 67501.5526213722 | AY36: =RC[-39]/RC[-47] -> 0
A37: 'Korea | B37: 'World - A | C37: 'C40 | D37: =RC[+19]/1000 -> 2413.145 | E37: 0 | F37: 0 | G37: 0 | H37: 0 | I37: 0 | J37: 0 | K37: 0 | L37: 0 | M37: 0 | N37: 0 | O37: 0 | P37: 0 | Q37: 0 | R37: 0 | S37: 0 | T37: 0 | U37: 0 | V37: 0 | W37: 2413145 | X37: 0 | Y37: 0 | Z37: 0 | AA37: 0 | AB37: 0 | AC37: 0 | AD37: 0 | AE37: 0 | AF37: 0 | AG37: 0 | AH37: 0 | AI37: 0 | AJ37: 0 | AK37: 0 | AL37: 0 | AM37: 0 | AN37: 0 | AO37: 0 | AP37: 0 | AQ37: 0 | AR37: =RC[-30]+RC[-29] -> 0 | AS37: =RC[-24]/RC[-23] -> #NUM! | AT37: =RC[-12]/RC[-23] -> 0 | AU37: =RC[-27]/RC[-43] -> 0 | AV37: =RC[-26]/RC[-44] -> 0 | AW37: =RC[-42]/RC[-45] -> 0 | AX37: =SUM(RC[-43]:RC[-37])/RC[-46] -> 0 | AY37: =RC[-39]/RC[-47] -> 0
A38: 'Canada | B38: 'World - A | C38: 'C51 | D38: =RC[+19]/1000 -> 2030.395 | E38: 2739 | F38: 910 | G38: 75032608 | H38: 0 | I38: 150814 | J38: 0 | K38: 0 | L38: 0 | M38: 0 | N38: 0 | O38: 0 | P38: 0 | Q38: 0 | R38: 0 | S38: 0 | T38: 0 | U38: 0 | V38: 241138449 | W38: 2030395 | X38: 3130 | Y38: 6616 | Z38: 13349 | AA38: 313061342 | AB38: 67699552 | AC38: 0 | AD38: 0 | AE38: 0 | AF38: 0 | AG38: 101581118 | AH38: 482342012 | AI38: 445464796 | AJ38: 11008543 | AK38: 25868673 | AL38: 482342012 | AM38: 21883197 | AN38: 32864 | AO38: 1643472 | AP38: 261568 | AQ38: 23821101 | AR38: =RC[-30]+RC[-29] -> 0 | AS38: =RC[-24]/RC[-23] -> 0 | AT38: =RC[-12]/RC[-23] -> 237.560677602141 | AU38: =RC[-27]/RC[-43] -> 0 | AV38: =RC[-26]/RC[-44] -> 118764.30399011 | AW38: =RC[-42]/RC[-45] -> 36954.6851720971 | AX38: =SUM(RC[-43]:RC[-37])/RC[-46] -> 37028.9633297954 | AY38: =RC[-39]/RC[-47] -> 0
A39: 'New Zealand | B39: 'World - A | C39: 'C71 | D39: =RC[+19]/1000 -> 169.557 | E39: 0 | F39: 0 | G39: 0 | H39: 0 | I39: 0 | J39: 0 | K39: 0 | L39: 0 | M39: 0 | N39: 0 | O39: 0 | P39: 0 | Q39: 0 | R39: 0 | S39: 0 | T39: 0 | U39: 0 | V39: 0 | W39: 169557 | X39: 0 | Y39: 0 | Z39: 0 | AA39: 0 | AB39: 0 | AC39: 0 | AD39: 0 | AE39: 0 | AF39: 0 | AG39: 0 | AH39: 0 | AI39: 0 | AJ39: 0 | AK39: 0 | AL39: 0 | AM39: 0 | AN39: 0 | AO39: 0 | AP39: 0 | AQ39: 0 | AR39: =RC[-30]+RC[-29] -> 0 | AS39: =RC[-24]/RC[-23] -> #NUM! | AT39: =RC[-12]/RC[-23] -> 0 | AU39: =RC[-27]/RC[-43] -> 0 | AV39: =RC[-26]/RC[-44] -> 0 | AW39: =RC[-42]/RC[-45] -> 0 | AX39: =SUM(RC[-43]:RC[-37])/RC[-46] -> 0 | AY39: =RC[-39]/RC[-47] -> 0
A40: 'Mexico | B40: 'World - B | C40: 'C72 | D40: =RC[+19]/1000 -> 1454.825 | E40: 0 | F40: 0 | G40: 0 | H40: 0 | I40: 0 | J40: 0 | K40: 0 | L40: 0 | M40: 0 | N40: 0 | O40: 0 | P40: 0 | Q40: 0 | R40: 0 | S40: 0 | T40: 0 | U40: 0 | V40: 0 | W40: 1454825 | X40: 0 | Y40: 0 | Z40: 0 | AA40: 0 | AB40: 0 | AC40: 0 | AD40: 0 | AE40: 0 | AF40: 0 | AG40: 0 | AH40: 0 | AI40: 0 | AJ40: 0 | AK40: 0 | AL40: 0 | AM40: 0 | AN40: 0 | AO40: 0 | AP40: 0 | AQ40: 0 | AR40: =RC[-30]+RC[-29] -> 0 | AS40: =RC[-24]/RC[-23] -> #NUM! | AT40: =RC[-12]/RC[-23] -> 0 | AU40: =RC[-27]/RC[-43] -> 0 | AV40: =RC[-26]/RC[-44] -> 0 | AW40: =RC[-42]/RC[-45] -> 0 | AX40: =SUM(RC[-43]:RC[-37])/RC[-46] -> 0 | AY40: =RC[-39]/RC[-47] -> 0
A41: 'CEE - Total | B41: 'Totals | D41: =RC[+19]/1000 -> 2302 | E41: 819 | F41: 2866 | G41: 125322044 | H41: 1148665 | I41: 1169809 | J41: 1280275 | K41: 4155692 | L41: 643013 | M41: 50640 | N41: 4045561 | O41: 61834 | P41: 7 | Q41: 25 | R41: 5360 | S41: 2152 | T41: 2292157 | U41: 49335492 | V41: 33487510 | W41: 2302000 | X41: 11089 | Y41: 4148 | Z41: 15237 | AA41: 15520339 | AB41: 28964183 | AC41: 502512 | AD41: 805366 | AE41: 1431944 | AF41: 3715124 | AG41: 17335157 | AH41: 68274624 | AI41: 62791488 | AJ41: 3271297 | AK41: 5198554 | AL41: 71261341 | AM41: 9571890 | AN41: 0 | AO41: 124295 | AP41: 5978017 | AQ41: 15674195 | AR41: =RC[-30]+RC[-29] -> 4107395 | AS41: =RC[-24]/RC[-23] -> 1.47325053430369 | AT41: =RC[-12]/RC[-23] -> 29.6588288444831 | AU41: =RC[-27]/RC[-43] -> 995.724152910513 | AV41: =RC[-26]/RC[-44] -> 14547.1372719374 | AW41: =RC[-42]/RC[-45] -> 54440.5056472633 | AX41: =SUM(RC[-43]:RC[-37])/RC[-46] -> 58110.3987836664 | AY41: =RC[-39]/RC[-47] -> 279.327975673328
A42: 'EU - Total | B42: 'Totals | D42: =RC[+19]/1000 -> 12609.979 | E42: 3174 | F42: 6515 | G42: 450853255 | H42: 2582166 | I42: 3456232 | J42: 1607764 | K42: 57387957 | L42: 12824112 | M42: 267608 | N42: 15034063 | O42: 545847 | P42: 562 | Q42: 804 | R42: 114559 | S42: 56806 | T42: 11864485 | U42: 193208923 | V42: 379773799 | W42: 12609979 | X42: 20898 | Y42: 18746 | Z42: 39644 | AA42: 1029967919 | AB42: 674081036 | AC42: 18171259 | AD42: 1038368 | AE42: 11557200 | AF42: 1434909 | AG42: 255895187 | AH42: 1992145874 | AI42: 1625272334 | AJ42: 61085647 | AK42: 168093649 | AL42: 1854451627 | AM42: 45663094 | AN42: 96810 | AO42: 4841133 | AP42: 9839681 | AQ42: 60440719 | AR42: =RC[-30]+RC[-29] -> 15579910 | AS42: =RC[-24]/RC[-23] -> 0.508747374117823 | AT42: =RC[-12]/RC[-23] -> 157.981696400922 | AU42: =RC[-27]/RC[-43] -> 940.880631125555 | AV42: =RC[-26]/RC[-44] -> 30116.9255714066 | AW42: =RC[-42]/RC[-45] -> 35753.688011693 | AX42: =SUM(RC[-43]:RC[-37])/RC[-46] -> 41949.2446418824 | AY42: =RC[-39]/RC[-47] -> 1016.98123367216
A43: 'EFTA - Total | B43: 'Totals | D43: =RC[+19]/1000 -> 364 | E43: 253 | F43: 576 | G43: 28419766 | H43: 231095 | I43: 303073 | J43: 93508 | K43: 1273152 | L43: 303993 | M43: 20134 | N43: 888100 | O43: 23228 | P43: 22 | Q43: 31 | R43: 2285 | S43: 906 | T43: 311962 | U43: 7573982 | V43: 10689400 | W43: 364000 | X43: 1543 | Y43: 834 | Z43: 2349 | AA43: 47804842 | AB43: 31441222 | AC43: 0 | AD43: 0 | AE43: 0 | AF43: 0 | AG43: 11658663 | AH43: 90904726 | AI43: 87714205 | AJ43: 3190521 | AK43: 0 | AL43: 90904726 | AM43: 2377785 | AN43: 5042 | AO43: 252090 | AP43: 512373 | AQ43: 3147290 | AR43: =RC[-30]+RC[-29] -> 911328 | AS43: =RC[-24]/RC[-23] -> 0.708550713791232 | AT43: =RC[-12]/RC[-23] -> 249.738258241758 | AU43: =RC[-27]/RC[-43] -> 857.038461538462 | AV43: =RC[-26]/RC[-44] -> 29366.4835164835 | AW43: =RC[-42]/RC[-45] -> 78076.2802197802 | AX43: =SUM(RC[-43]:RC[-37])/RC[-46] -> 84188.793956044 | AY43: =RC[-39]/RC[-47] -> 835.145604395604
A44: 'World A - Total | B44: 'Totals | D44: =RC[+19]/1000 -> 25532.161 | E44: 8216 | F44: 14108 | G44: 1378509392 | H44: 8914828 | I44: 10523412 | J44: 7978434 | K44: 811120585 | L44: 70142766 | M44: 2914426 | N44: 37429613 | O44: 2643704 | P44: 36 | Q44: 54 | R44: 121521 | S44: 20454 | T44: 13643146 | U44: 309198810 | V44: 355546138 | W44: 25532161 | X44: 46127 | Y44: 88762 | Z44: 138492 | AA44: 2848008824 | AB44: 2329265267 | AC44: 6857397 | AD44: 254564 | AE44: 2397436 | AF44: 4946579 | AG44: 762181983 | AH44: 5953912049 | AI44: 4939581944 | AJ44: 186636290 | AK44: 452386721 | AL44: 5578604952 | AM44: 158494448 | AN44: 322485 | AO44: 16126798 | AP44: 29699153 | AQ44: 204642884 | AR44: =RC[-30]+RC[-29] -> 40073317 | AS44: =RC[-24]/RC[-23] -> 0.869644687295127 | AT44: =RC[-12]/RC[-23] -> 233.192640803103 | AU44: =RC[-27]/RC[-43] -> 534.351400964454 | AV44: =RC[-26]/RC[-44] -> 13925.422842195 | AW44: =RC[-42]/RC[-45] -> 53991.0974241467 | AX44: =SUM(RC[-43]:RC[-37])/RC[-46] -> 89694.8692670393 | AY44: =RC[-39]/RC[-47] -> 2747.23185397429
A45: 'World B - Total | B45: 'Totals | D45: =RC[+19]/1000 -> 2474.606 | E45: 379 | F45: 459 | G45: 35788554 | H45: 226703 | I45: 291229 | J45: 202891 | K45: 15859148 | L45: 1541690 | M45: 57921 | N45: 1036658 | O45: 60922 | P45: 22 | Q45: 31 | R45: 39197 | S45: 13987 | T45: 4400751 | U45: 90501370 | V45: 81769239 | W45: 2474606 | X45: 1388 | Y45: 2077 | Z45: 3465 | AA45: 2605073 | AB45: 4846581 | AC45: 41988 | AD45: 151740 | AE45: 239445 | AF45: 621228 | AG45: 2936077 | AH45: 11442131 | AI45: 10530423 | AJ45: 544045 | AK45: 882344 | AL45: 11956814 | AM45: 1643915 | AN45: 0 | AO45: 0 | AP45: 1048728 | AQ45: 2692643 | AR45: =RC[-30]+RC[-29] -> 1097580 | AS45: =RC[-24]/RC[-23] -> 1.10678992622152 | AT45: =RC[-12]/RC[-23] -> 4.62381930699271 | AU45: =RC[-27]/RC[-43] -> 1778.36431334928 | AV45: =RC[-26]/RC[-44] -> 33043.3365958056 | AW45: =RC[-42]/RC[-45] -> 14462.3241033118 | AX45: =SUM(RC[-43]:RC[-37])/RC[-46] -> 21808.7792561725 | AY45: =RC[-39]/RC[-47] -> 623.00422774373
A46: 'EU Accession Countries - Totals | B46: 'Totals | D46: =RC[+19]/1000 -> 1613.853 | E46: 545 | F46: 2096 | G46: 87876842 | H46: 865898 | I46: 883685 | J46: 862415 | K46: 3233799 | L46: 356898 | M46: 36354 | N46: 2998120 | O46: 46566 | P46: 7 | Q46: 25 | R46: 3866 | S46: 1589 | T46: 1605727 | U46: 32495905 | V46: 23544336 | W46: 1613853 | X46: 7975 | Y46: 2827 | Z46: 10802 | AA46: 13586911 | AB46: 24315182 | AC46: 464114 | AD46: 634413 | AE46: 1159489 | AF46: 3021020 | AG46: 13999611 | AH46: 57180740 | AI46: 52628341 | AJ46: 2537598 | AK46: 4318939 | AL46: 59484880 | AM46: 7622666 | AN46: 150 | AO46: 131810 | AP46: 4713713 | AQ46: 12468332 | AR46: =RC[-30]+RC[-29] -> 3044686 | AS46: =RC[-24]/RC[-23] -> 1.38020052890852 | AT46: =RC[-12]/RC[-23] -> 35.4311947866379 | AU46: =RC[-27]/RC[-43] -> 994.964845001372 | AV46: =RC[-26]/RC[-44] -> 14588.8975018171 | AW46: =RC[-42]/RC[-45] -> 54451.577683965 | AX46: =SUM(RC[-43]:RC[-37])/RC[-46] -> 58317.5115701368 | AY46: =RC[-39]/RC[-47] -> 221.146535651017

Sheet: 2001Grossed
A1: 'Name | B1: 'Type | C1: 'Code | D1: 'Staff & Students '000s | E1: 'Libraries - Total Administrative Units | F1: 'Libraries - Service Points | G1: 'Collections - Books & Bound Periodicals | H1: 'Collections - Current Periodicals - Titles | I1: 'Collections - Current Periodicals - Subscriptions | J1: 'Collections - Manuscripts | K1: 'Collections - Microforms | L1: 'Collections - Audio-visual Materials | M1: 'Collections - CD-ROMs | N1: 'Additions - Books & Bound Periodicals | O1: 'Additions - Audio-visual Materials | P1: 'Facilities & Services - Percentage Stock on Open Access | Q1: 'Facilities & Services - Percentage Catalogue Records Automated | R1: 'Facilities & Services - Number of Workstations for users | S1: 'Facilities & Services - Number connected to the internet | T1: 'Use & Users - Registered Users | U1: 'Use & Users - Consultations | V1: 'Use & Users - Number of Visits | W1: 'Use & Users - Staff & Students | X1: 'Library Staff FTE - Trained Librarians | Y1: 'Library Staff FTE - Other Library Staff | Z1: 'Library Staff FTE - Total Staff | AA1: 'Recurrent Expenditure (Euros) - Staff | AB1: 'Recurrent Expenditure (Euros) - Acquisition of Stock | AC1: 'Recurrent Expenditure (Euros) - Electronic Information | AD1: 'Recurrent Expenditure (Euros) - Automation | AE1: 'Recurrent Expenditure (Euros) - Premises and Related Costs | AF1: 'Recurrent Expenditure (Euros) - New Buildings / Refurbishment | AG1: 'Recurrent Expenditure (Euros) - Other Expenditure | AH1: 'Recurrent Expenditure (Euros) - TOTAL EXPENDITURE | AI1: 'Income - Public Funding | AJ1: 'Income - Fees & Charges | AK1: 'Income - Other Income | AL1: 'Income - TOTAL INCOME | AM1: 'Capital Expenditure - New Buildings / Refurbishment | AN1: 'Capital Expenditure - Acquisition of Stock | AO1: 'Capital Expenditure - Automation | AP1: 'Capital Expenditure - Other Capital Expenditure | AQ1: 'Capital Expenditure - TOTAL CAPITAL PAYMENTS | AR1: 'Additions | AS1: 'Loans per visit | AT1: 'Cost per pop | AU1: 'Users per 1000 pop | AV1: 'visits per 1000 pop | AW1: 'Bookstock per 1000 pop | AX1: 'Total stock per 1000 pop | AY1: 'AV materials per 1000 pop
A2: 'Bulgaria | B2: 'CEE | C2: 'C1 | D2: =RC[+19]/1000 -> 289 | E2: 84 | F2: 84 | G2: 8501798 | H2: 8198 | I2: 12444 | J2: 107543 | K2: 23792 | L2: 84101 | M2: 1358 | N2: 101846 | O2: 3634 | P2: 7 | Q2: 24 | R2: 398 | S2: 199 | T2: 200848 | U2: 5002065 | V2: 2813081 | W2: 289000 | X2: 496 | Y2: 312 | Z2: 808 | AA2: 951033 | AB2: 1319389 | AC2: 0 | AD2: 0 | AE2: 0 | AF2: 0 | AG2: 89817 | AH2: 2360239 | AI2: 1386130 | AJ2: 141230 | AK2: 832879 | AL2: 2360239 | AM2: 387269 | AN2: 0 | AO2: 19792 | AP2: 4648 | AQ2: 411709 | AR2: =RC[-30]+RC[-29] -> 105480 | AS2: =RC[-24]/RC[-23] -> 1.77814467482451 | AT2: =RC[-12]/RC[-23] -> 8.1669169550173 | AU2: =RC[-27]/RC[-43] -> 694.975778546713 | AV2: =RC[-26]/RC[-44] -> 9733.84429065744 | AW2: =RC[-42]/RC[-45] -> 29417.9861591696 | AX2: =SUM(RC[-43]:RC[-37])/RC[-46] -> 30239.5640138408 | AY2: =RC[-39]/RC[-47] -> 291.006920415225
A3: 'Czech Republic | B3: 'CEE | C3: 'C2 | D3: =RC[+19]/1000 -> 192 | E3: 80 | F3: 1081 | G3: 10704109 | H3: 21703 | I3: 18612 | J3: 43062 | K3: 13753 | L3: 38158 | M3: 30757 | N3: 266549 | O3: 2556 | P3: 7 | Q3: 24 | R3: 645 | S3: 232 | T3: 276163 | U3: 2178474 | V3: 4255805 | W3: 192000 | X3: 395 | Y3: 372 | Z3: 767 | AA3: 2673385 | AB3: 4761705 | AC3: 27514 | AD3: 149445 | AE3: 91067 | AF3: 407063 | AG3: 125270 | AH3: 8235449 | AI3: 6281402 | AJ3: 192879 | AK3: 1761168 | AL3: 8235449 | AM3: 1254459 | AN3: 0 | AO3: 64109 | AP3: 15058 | AQ3: 1333626 | AR3: =RC[-30]+RC[-29] -> 269105 | AS3: =RC[-24]/RC[-23] -> 0.511882945764667 | AT3: =RC[-12]/RC[-23] -> 42.8929635416667 | AU3: =RC[-27]/RC[-43] -> 1438.34895833333 | AV3: =RC[-26]/RC[-44] -> 22165.6510416667 | AW3: =RC[-42]/RC[-45] -> 55750.5677083333 | AX3: =SUM(RC[-43]:RC[-37])/RC[-46] -> 56615.3854166667 | AY3: =RC[-39]/RC[-47] -> 198.739583333333
A4: 'Estonia | B4: 'CEE | C4: 'C3 | D4: =RC[+19]/1000 -> 48 | E4: 23 | F4: 37 | G4: 7399469 | H4: 11565 | I4: 20099 | J4: 72773 | K4: 28166 | L4: 38818 | M4: 3712 | N4: 110337 | O4: 2304 | P4: 5 | Q4: 20 | R4: 271 | S4: 261 | T4: 84571 | U4: 1905991 | V4: 1550796 | W4: 48000 | X4: 527 | Y4: 51 | Z4: 578 | AA4: 2398155 | AB4: 1379407 | AC4: 302797 | AD4: 114234 | AE4: 236763 | AF4: 0 | AG4: 375264 | AH4: 4806620 | AI4: 4806620 | AJ4: 0 | AK4: 0 | AL4: 4806620 | AM4: 0 | AN4: 0 | AO4: 15664 | AP4: 80035 | AQ4: 95699 | AR4: =RC[-30]+RC[-29] -> 112641 | AS4: =RC[-24]/RC[-23] -> 1.22904044116699 | AT4: =RC[-12]/RC[-23] -> 100.137916666667 | AU4: =RC[-27]/RC[-43] -> 1761.89583333333 | AV4: =RC[-26]/RC[-44] -> 32308.25 | AW4: =RC[-42]/RC[-45] -> 154155.604166667 | AX4: =SUM(RC[-43]:RC[-37])/RC[-46] -> 157804.208333333 | AY4: =RC[-39]/RC[-47] -> 808.708333333333
A5: 'Hungary | B5: 'CEE | C5: 'C4 | D5: =RC[+19]/1000 -> 214 | E5: 141 | F5: 401 | G5: 16366142 | H5: 26078 | I5: 32892 | J5: 796077 | K5: 5418049 | L5: 117905 | M5: 22354 | N5: 374994 | O5: 6380 | P5: 7 | Q5: 24 | R5: 506 | S5: 181 | T5: 284873 | U5: 4014677 | V5: 3788043 | W5: 214000 | X5: 1016 | Y5: 385 | Z5: 1401 | AA5: 4490076 | AB5: 8336805 | AC5: 40116 | AD5: 217899 | AE5: 132781 | AF5: 593518 | AG5: 632260 | AH5: 14443455 | AI5: 13565728 | AJ5: 517464 | AK5: 360263 | AL5: 14443455 | AM5: 1854027 | AN5: 0 | AO5: 94751 | AP5: 22253 | AQ5: 1971031 | AR5: =RC[-30]+RC[-29] -> 381374 | AS5: =RC[-24]/RC[-23] -> 1.05982878230263 | AT5: =RC[-12]/RC[-23] -> 67.4927803738318 | AU5: =RC[-27]/RC[-43] -> 1331.18224299065 | AV5: =RC[-26]/RC[-44] -> 17701.1355140187 | AW5: =RC[-42]/RC[-45] -> 76477.2990654206 | AX5: =SUM(RC[-43]:RC[-37])/RC[-46] -> 106446.247663551 | AY5: =RC[-39]/RC[-47] -> 550.957943925234
A6: 'Latvia | B6: 'CEE | C6: 'C5 | D6: =RC[+19]/1000 -> 61 | E6: 31 | F6: 31 | G6: 5631479 | H6: 5848 | I6: 5937 | J6: 25362 | K6: 139070 | L6: 4085 | M6: 487 | N6: 134553 | O6: 1179 | P6: 7 | Q6: 24 | R6: 113 | S6: 38 | T6: 94467 | U6: 4209082 | V6: 1976819 | W6: 61000 | X6: 378 | Y6: 27 | Z6: 405 | AA6: 1106524 | AB6: 1023219 | AC6: 0 | AD6: 0 | AE6: 0 | AF6: 0 | AG6: 252124 | AH6: 2381867 | AI6: 1283798 | AJ6: 0 | AK6: 954612 | AL6: 2238410 | AM6: 506776 | AN6: 0 | AO6: 25899 | AP6: 6083 | AQ6: 538758 | AR6: =RC[-30]+RC[-29] -> 135732 | AS6: =RC[-24]/RC[-23] -> 2.12921972117832 | AT6: =RC[-12]/RC[-23] -> 39.047 | AU6: =RC[-27]/RC[-43] -> 1548.6393442623 | AV6: =RC[-26]/RC[-44] -> 32406.868852459 | AW6: =RC[-42]/RC[-45] -> 92319.3278688525 | AX6: =SUM(RC[-43]:RC[-37])/RC[-46] -> 95283.0819672131 | AY6: =RC[-39]/RC[-47] -> 66.9672131147541
A7: 'Lithuania | B7: 'CEE | C7: 'C6 | D7: =RC[+19]/1000 -> 97 | E7: 15 | F7: 106 | G7: 10977183 | H7: 4000 | I7: 5000 | J7: 248300 | K7: 26764 | L7: 37250 | M7: 3625 | N7: 174036 | O7: 852 | P7: 4 | Q7: 3 | R7: 298 | S7: 298 | T7: 118445 | U7: 8134682 | V7: 4520707 | W7: 97000 | X7: 594 | Y7: 92 | Z7: 686 | AA7: 1856644 | AB7: 787172 | AC7: 0 | AD7: 94213 | AE7: 0 | AF7: 0 | AG7: 344466 | AH7: 3082495 | AI7: 2440386 | AJ7: 324443 | AK7: 293871 | AL7: 3058700 | AM7: 440651 | AN7: 0 | AO7: 22520 | AP7: 5289 | AQ7: 468460 | AR7: =RC[-30]+RC[-29] -> 174888 | AS7: =RC[-24]/RC[-23] -> 1.79942694804153 | AT7: =RC[-12]/RC[-23] -> 31.7782989690722 | AU7: =RC[-27]/RC[-43] -> 1221.0824742268 | AV7: =RC[-26]/RC[-44] -> 46605.2268041237 | AW7: =RC[-42]/RC[-45] -> 113166.835051546 | AX7: =SUM(RC[-43]:RC[-37])/RC[-46] -> 116516.721649485 | AY7: =RC[-39]/RC[-47] -> 384.020618556701
A8: 'Poland | B8: 'CEE | C8: 'C7 | D8: =RC[+19]/1000 -> 796 | E8: 272 | F8: 507 | G8: 33263503 | H8: 761757 | I8: 761988 | J8: 272749 | K8: 1656530 | L8: 162765 | M8: 9223 | N8: 1828594 | O8: 14397 | P8: 13 | Q8: 45 | R8: 1881 | S8: 671 | T8: 668208 | U8: 11593575 | V8: 7497180 | W8: 796000 | X8: 4910 | Y8: 1639 | Z8: 6549 | AA8: 11210209 | AB8: 15806310 | AC8: 115372 | AD8: 626663 | AE8: 381871 | AF8: 1706924 | AG8: 4917790 | AH8: 34765139 | AI8: 26516321 | AJ8: 814219 | AK8: 7434599 | AL8: 34765139 | AM8: 5190222 | AN8: 0 | AO8: 265247 | AP8: 62300 | AQ8: 5517769 | AR8: =RC[-30]+RC[-29] -> 1842991 | AS8: =RC[-24]/RC[-23] -> 1.54639144318264 | AT8: =RC[-12]/RC[-23] -> 43.6747977386935 | AU8: =RC[-27]/RC[-43] -> 839.457286432161 | AV8: =RC[-26]/RC[-44] -> 9418.56783919598 | AW8: =RC[-42]/RC[-45] -> 41788.3203517588 | AX8: =SUM(RC[-43]:RC[-37])/RC[-46] -> 46342.3555276382 | AY8: =RC[-39]/RC[-47] -> 204.47864321608
A9: 'Romania | B9: 'CEE | C9: 'C8 | D9: =RC[+19]/1000 -> 438 | E9: 199 | F9: 721 | G9: 30068856 | H9: 281659 | I9: 286013 | J9: 323105 | K9: 856117 | L9: 257986 | M9: 14591 | N9: 1021094 | O9: 13527 | P9: 7 | Q9: 24 | R9: 1309 | S9: 436 | T9: 548092 | U9: 12140209 | V9: 8643473 | W9: 438000 | X9: 2656 | Y9: 999 | Z9: 3655 | AA9: 6382567 | AB9: 8999371 | AC9: 65688 | AD9: 356793 | AE9: 217419 | AF9: 971843 | AG9: 2799958 | AH9: 19793639 | AI9: 15097149 | AJ9: 463578 | AK9: 4232912 | AL9: 19793639 | AM9: 2855926 | AN9: 0 | AO9: 145952 | AP9: 34281 | AQ9: 3036159 | AR9: =RC[-30]+RC[-29] -> 1034621 | AS9: =RC[-24]/RC[-23] -> 1.40455219794173 | AT9: =RC[-12]/RC[-23] -> 45.1909566210046 | AU9: =RC[-27]/RC[-43] -> 1251.35159817352 | AV9: =RC[-26]/RC[-44] -> 19733.9566210046 | AW9: =RC[-42]/RC[-45] -> 68650.3561643836 | AX9: =SUM(RC[-43]:RC[-37])/RC[-46] -> 73261.0205479452 | AY9: =RC[-39]/RC[-47] -> 589.009132420091
A10: 'Slovak Rep | B10: 'CEE | C10: 'C9 | D10: =RC[+19]/1000 -> 112 | E10: 35 | F10: 568 | G10: 4670126 | H10: 7534 | I10: 9231 | J10: 67849 | K10: 137847 | L10: 73725 | M10: 1130 | N10: 98198 | O10: 568 | P10: 7 | Q10: 24 | R10: 1094 | S10: 896 | T10: 142344 | U10: 2706702 | V10: 1045163 | W10: 112000 | X10: 254 | Y10: 244 | Z10: 498 | AA10: 1189740 | AB10: 960166 | AC10: 0 | AD10: 0 | AE10: 89466 | AF10: 0 | AG10: 385251 | AH10: 2624623 | AI10: 2496700 | AJ10: 34423 | AK10: 0 | AL10: 2531123 | AM10: 227232 | AN10: 0 | AO10: 140400 | AP10: 0 | AQ10: 367632 | AR10: =RC[-30]+RC[-29] -> 98766 | AS10: =RC[-24]/RC[-23] -> 2.58974150443519 | AT10: =RC[-12]/RC[-23] -> 23.4341339285714 | AU10: =RC[-27]/RC[-43] -> 1270.92857142857 | AV10: =RC[-26]/RC[-44] -> 9331.8125 | AW10: =RC[-42]/RC[-45] -> 41697.5535714286 | AX10: =SUM(RC[-43]:RC[-37])/RC[-46] -> 44352.1607142857 | AY10: =RC[-39]/RC[-47] -> 658.258928571429
A11: 'Slovenia | B11: 'CEE | C11: 'C10 | D11: =RC[+19]/1000 -> 55 | E11: 54 | F11: 79 | G11: 4151409 | H11: 14489 | I11: 16234 | J11: 3406 | K11: 411780 | L11: 38047 | M11: 1394 | N11: 118375 | O11: 12372 | P11: 7 | Q11: 44 | R11: 314 | S11: 299 | T11: 135425 | U11: 3263696 | V11: 1512745 | W11: 55000 | X11: 263 | Y11: 93 | Z11: 356 | AA11: 1005555 | AB11: 4009447 | AC11: 14203 | AD11: 77143 | AE11: 47009 | AF11: 210125 | AG11: 3811444 | AH11: 9174926 | AI11: 5917186 | AJ11: 172832 | AK11: 3084908 | AL11: 9174926 | AM11: 1402690 | AN11: 0 | AO11: 71684 | AP11: 16838 | AQ11: 1491212 | AR11: =RC[-30]+RC[-29] -> 130747 | AS11: =RC[-24]/RC[-23] -> 2.15746606334842 | AT11: =RC[-12]/RC[-23] -> 166.816836363636 | AU11: =RC[-27]/RC[-43] -> 2462.27272727273 | AV11: =RC[-26]/RC[-44] -> 27504.4545454545 | AW11: =RC[-42]/RC[-45] -> 75480.1636363636 | AX11: =SUM(RC[-43]:RC[-37])/RC[-46] -> 84304.7090909091 | AY11: =RC[-39]/RC[-47] -> 691.763636363636
A12: 'Austria | B12: 'EU | C12: 'C11 | D12: =RC[+19]/1000 -> 269 | E12: 20 | F12: 39 | G12: 17573390 | H12: 13954 | I12: 61565 | J12: 46584 | K12: 1452195 | L12: 279258 | M12: 1802 | N12: 456661 | O12: 15371 | P12: 36 | Q12: 54 | R12: 2985 | S12: 1023 | T12: 233649 | U12: 3650183 | V12: 5513310 | W12: 269000 | X12: 552 | Y12: 389 | Z12: 941 | AA12: 29650270 | AB12: 17934796 | AC12: 1429166 | AD12: 29573 | AE12: 124115 | AF12: 605343 | AG12: 6984315 | AH12: 56757578 | AI12: 49684386 | AJ12: 2332970 | AK12: 4740222 | AL12: 56757578 | AM12: 1793944 | AN12: 27926 | AO12: 105311 | AP12: 338168 | AQ12: 2265349 | AR12: =RC[-30]+RC[-29] -> 472032 | AS12: =RC[-24]/RC[-23] -> 0.662067433175352 | AT12: =RC[-12]/RC[-23] -> 210.994713754647 | AU12: =RC[-27]/RC[-43] -> 868.583643122677 | AV12: =RC[-26]/RC[-44] -> 20495.5762081784 | AW12: =RC[-42]/RC[-45] -> 65328.5873605948 | AX12: =SUM(RC[-43]:RC[-37])/RC[-46] -> 72225.8289962825 | AY12: =RC[-39]/RC[-47] -> 1038.13382899628
A13: 'België Nederlandstalige Universiteiten | B13: 'België Nederlandstalige Universiteiten | C13: 'C12a | D13: 58.777 | E13: 41 | F13: 317 | G13: 9925746 | H13: 42654 | I13: 14074 | J13: 115 | K13: 1000 | L13: 9068 | M13: 2028 | N13: 179054 | O13: 210 | P13: 48 | Q13: 60 | R13: 354 | S13: 0 | T13: 106123 | U13: 666128 | V13: 1071148 | W13: 58777 | X13: 116 | Y13: 191 | Z13: 307 | AA13: 8375210 | AB13: 5472894 | AC13: 1948575 | AD13: 375538 | AE13: 112271 | AF13: 13758 | AG13: 361682 | AH13: 16659928 | AI13: 5971614 | AJ13: 98259 | AK13: 98414 | AL13: 6108793 | AM13: 0 | AN13: 0 | AO13: 88939 | AP13: 0 | AQ13: 88939 | AR13: 179264 | AS13: =RC[-24]/RC[-23] -> 0.621882316916056 | AT13: =RC[-12]/RC[-23] -> 283.442979396703 | AU13: =RC[-27]/RC[-43] -> 1805.51916566004 | AV13: =RC[-26]/RC[-44] -> 18223.9311295235 | AW13: =RC[-42]/RC[-45] -> 168871.259166 | AX13: =SUM(RC[-43]:RC[-37])/RC[-46] -> 170044.149922589 | AY13: =RC[-39]/RC[-47] -> 154.278033924835
A14: 'Belgique universités francophones | B14: 'Belgique universités francophones | C14: 'C12b | D14: 74.458 | E14: 0 | F14: 0 | G14: 9057965 | H14: 29979 | I14: 20837 | J14: 1135 | K14: 279897 | L14: 11873 | M14: 1193 | N14: 128821 | O14: 1511 | P14: 46 | Q14: 56 | R14: 423 | S14: 0 | T14: 63788 | U14: 460619 | V14: 3062634 | W14: 74458 | X14: 124 | Y14: 179 | Z14: 301 | AA14: 7062183 | AB14: 7195308 | AC14: 771134 | AD14: 279846 | AE14: 772490 | AF14: 0 | AG14: 346279 | AH14: 16427240 | AI14: 6715288 | AJ14: 394456 | AK14: 439313 | AL14: 7207068 | AM14: 0 | AN14: 68369 | AO14: 48691 | AP14: 0 | AQ14: 117060 | AR14: 130332 | AS14: =RC[-24]/RC[-23] -> 0.150399623330767 | AT14: =RC[-12]/RC[-23] -> 220.624244540546 | AU14: =RC[-27]/RC[-43] -> 856.697735636198 | AV14: =RC[-26]/RC[-44] -> 41132.3699266701 | AW14: =RC[-42]/RC[-45] -> 121652.00515727 | AX14: =SUM(RC[-43]:RC[-37])/RC[-46] -> 126284.334792769 | AY14: =RC[-39]/RC[-47] -> 159.459023879234
A15: 'Belgium | B15: 'EU | C15: 'C12 | D15: =RC[+19]/1000 -> 133.235 | E15: 72 | F15: 47 | G15: 18983711 | H15: 72633 | I15: 34911 | J15: 1250 | K15: 280897 | L15: 20941 | M15: 3221 | N15: 307875 | O15: 1721 | P15: 46 | Q15: 56 | R15: 777 | S15: 215 | T15: 169911 | U15: 1126747 | V15: 4133782 | W15: 133235 | X15: 240 | Y15: 369 | Z15: 609 | AA15: 15437393 | AB15: 12668202 | AC15: 2719709 | AD15: 655384 | AE15: 884761 | AF15: 13758 | AG15: 707961 | AH15: 33087168 | AI15: 26002762 | AJ15: 492716 | AK15: 537726 | AL15: 27033204 | AM15: 68369 | AN15: 137630 | AO15: 0 | AP15: 0 | AQ15: 205999 | AR15: =RC[-30]+RC[-29] -> 309596 | AS15: =RC[-24]/RC[-23] -> 0.272570493557715 | AT15: =RC[-12]/RC[-23] -> 248.336908469997 | AU15: =RC[-27]/RC[-43] -> 1275.27301384771 | AV15: =RC[-26]/RC[-44] -> 31026.2468570571 | AW15: =RC[-42]/RC[-45] -> 142482.913648816 | AX15: =SUM(RC[-43]:RC[-37])/RC[-46] -> 145589.101962697 | AY15: =RC[-39]/RC[-47] -> 157.173415393853
A16: 'Denmark | B16: 'EU | C16: 'C13 | D16: =RC[+19]/1000 -> 180 | E16: 19 | F16: 40 | G16: 10698685 | H16: 74100 | I16: 94344 | J16: 95140 | K16: 1220634 | L16: 883224 | M16: 36856 | N16: 255661 | O16: 28595 | P16: 20 | Q16: 54 | R16: 932 | S16: 296 | T16: 156651 | U16: 5085626 | V16: 5110253 | W16: 180000 | X16: 427 | Y16: 472 | Z16: 899 | AA16: 38129876 | AB16: 19659084 | AC16: 0 | AD16: 0 | AE16: 0 | AF16: 550806 | AG16: 10882096 | AH16: 69221863 | AI16: 69221863 | AJ16: 0 | AK16: 0 | AL16: 69221863 | AM16: 2680041 | AN16: 0 | AO16: 0 | AP16: 0 | AQ16: 2680041 | AR16: =RC[-30]+RC[-29] -> 284256 | AS16: =RC[-24]/RC[-23] -> 0.995180864822153 | AT16: =RC[-12]/RC[-23] -> 384.565905555556 | AU16: =RC[-27]/RC[-43] -> 870.283333333333 | AV16: =RC[-26]/RC[-44] -> 28390.2944444444 | AW16: =RC[-42]/RC[-45] -> 59437.1388888889 | AX16: =SUM(RC[-43]:RC[-37])/RC[-46] -> 72794.35 | AY16: =RC[-39]/RC[-47] -> 4906.8
A17: 'Eire | B17: 'EU | C17: 'C15 | D17: =RC[+19]/1000 -> 137 | E17: 46 | F17: 74 | G17: 8504000 | H17: 61000 | I17: 85214 | J17: 23745 | K17: 740212 | L17: 196016 | M17: 3600 | N17: 261000 | O17: 8375 | P17: 36 | Q17: 54 | R17: 1627 | S17: 542 | T17: 118894 | U17: 3265858 | V17: 4152796 | W17: 137000 | X17: 250 | Y17: 500 | Z17: 750 | AA17: 15063180 | AB17: 9111386 | AC17: 726057 | AD17: 15024 | AE17: 63053 | AF17: 307531 | AG17: 3548231 | AH17: 28834462 | AI17: 25241078 | AJ17: 1185214 | AK17: 2408170 | AL17: 28834462 | AM17: 913644 | AN17: 14223 | AO17: 53634 | AP17: 172227 | AQ17: 1153728 | AR17: =RC[-30]+RC[-29] -> 269375 | AS17: =RC[-24]/RC[-23] -> 0.786423893685122 | AT17: =RC[-12]/RC[-23] -> 210.470525547445 | AU17: =RC[-27]/RC[-43] -> 867.839416058394 | AV17: =RC[-26]/RC[-44] -> 30312.3795620438 | AW17: =RC[-42]/RC[-45] -> 62072.9927007299 | AX17: =SUM(RC[-43]:RC[-37])/RC[-46] -> 70173.6277372263 | AY17: =RC[-39]/RC[-47] -> 1430.77372262774
A18: 'Finland | B18: 'EU | C18: 'C16 | D18: =RC[+19]/1000 -> 224 | E18: 48 | F18: 457 | G18: 15572434 | H18: 237807 | I18: 382625 | J18: 262463 | K18: 1251223 | L18: 325048 | M18: 32569 | N18: 610881 | O18: 15112 | P18: 45 | Q18: 54 | R18: 3396 | S18: 2426 | T18: 265729 | U18: 13617288 | V18: 16882610 | W18: 224000 | X18: 1310 | Y18: 138 | Z18: 1448 | AA18: 39607466 | AB18: 22543220 | AC18: 0 | AD18: 0 | AE18: 0 | AF18: 3528953 | AG18: 10987011 | AH18: 76666650 | AI18: 62922332 | AJ18: 5513940 | AK18: 4788563 | AL18: 73224835 | AM18: 2333094 | AN18: 36319 | AO18: 136960 | AP18: 439802 | AQ18: 2946175 | AR18: =RC[-30]+RC[-29] -> 625993 | AS18: =RC[-24]/RC[-23] -> 0.80658665929024 | AT18: =RC[-12]/RC[-23] -> 342.261830357143 | AU18: =RC[-27]/RC[-43] -> 1186.29017857143 | AV18: =RC[-26]/RC[-44] -> 75368.7946428571 | AW18: =RC[-42]/RC[-45] -> 69519.7946428571 | AX18: =SUM(RC[-43]:RC[-37])/RC[-46] -> 80643.6116071429 | AY18: =RC[-39]/RC[-47] -> 1451.10714285714
A19: 'France | B19: 'EU | C19: 'C17 | D19: =RC[+19]/1000 -> 2278 | E19: 95 | F19: 396 | G19: 25684360 | H19: 152995 | I19: 214826 | J19: 359579 | K19: 1384057 | L19: 97296 | M19: 44108 | N19: 1008519 | O19: 125955 | P19: 35 | Q19: 54 | R19: 24456 | S19: 9010 | T19: 1344536 | U19: 13048777 | V19: 52900392 | W19: 2278000 | X19: 1812 | Y19: 2552 | Z19: 4364 | AA19: 167287948 | AB19: 60509187 | AC19: 5924182 | AD19: 0 | AE19: 0 | AF19: 0 | AG19: 68159578 | AH19: 301880895 | AI19: 285222928 | AJ19: 8495252 | AK19: 8162715 | AL19: 301880895 | AM19: 9837452 | AN19: 153140 | AO19: 577490 | AP19: 1854417 | AQ19: 12422499 | AR19: =RC[-30]+RC[-29] -> 1134474 | AS19: =RC[-24]/RC[-23] -> 0.246666924509747 | AT19: =RC[-12]/RC[-23] -> 132.520147058824 | AU19: =RC[-27]/RC[-43] -> 590.226514486392 | AV19: =RC[-26]/RC[-44] -> 23222.2967515364 | AW19: =RC[-42]/RC[-45] -> 11274.9604916594 | AX19: =SUM(RC[-43]:RC[-37])/RC[-46] -> 12263.9249341528 | AY19: =RC[-39]/RC[-47] -> 42.7111501316945
A20: 'Greece | B20: 'EU | C20: 'C18 | D20: =RC[+19]/1000 -> 347 | E20: 82 | F20: 180 | G20: 5683287 | H20: 61430 | I20: 36200 | J20: 29790 | K20: 25338 | L20: 22796 | M20: 18726 | N20: 296750 | O20: 1439 | P20: 95 | Q20: 49 | R20: 1660 | S20: 553 | T20: 402192 | U20: 1415696 | V20: 4235852 | W20: 347000 | X20: 728 | Y20: 395 | Z20: 1123 | AA20: 4055275 | AB20: 14572579 | AC20: 696828 | AD20: 126795 | AE20: 0 | AF20: 948625 | AG20: 3944656 | AH20: 24344758 | AI20: 13660012 | AJ20: 10500572 | AK20: 184174 | AL20: 24344758 | AM20: 867962 | AN20: 13511 | AO20: 50952 | AP20: 163616 | AQ20: 1096041 | AR20: =RC[-30]+RC[-29] -> 298189 | AS20: =RC[-24]/RC[-23] -> 0.334217531679577 | AT20: =RC[-12]/RC[-23] -> 70.1578040345821 | AU20: =RC[-27]/RC[-43] -> 1159.05475504323 | AV20: =RC[-26]/RC[-44] -> 12207.0662824207 | AW20: =RC[-42]/RC[-45] -> 16378.34870317 | AX20: =SUM(RC[-43]:RC[-37])/RC[-46] -> 16938.2334293948 | AY20: =RC[-39]/RC[-47] -> 65.6945244956772
A21: 'Iceland | B21: 'EFTA | C21: 'C19 | D21: =RC[+19]/1000 -> 8 | E21: 6 | F21: 13 | G21: 671662 | H21: 4969 | I21: 6079 | J21: 2187 | K21: 30293 | L21: 7207 | M21: 573 | N21: 20390 | O21: 422 | P21: 22 | Q21: 30 | R21: 70 | S21: 25 | T21: 7324 | U21: 186235 | V21: 217837 | W21: 8000 | X21: 35 | Y21: 19 | Z21: 54 | AA21: 1484979 | AB21: 766395 | AC21: 0 | AD21: 0 | AE21: 0 | AF21: 0 | AG21: 460796 | AH21: 2712170 | AI21: 2583684 | AJ21: 128486 | AK21: 0 | AL21: 2712170 | AM21: 86178 | AN21: 1342 | AO21: 5058 | AP21: 16245 | AQ21: 108823 | AR21: =RC[-30]+RC[-29] -> 20812 | AS21: =RC[-24]/RC[-23] -> 0.854928226150746 | AT21: =RC[-12]/RC[-23] -> 339.02125 | AU21: =RC[-27]/RC[-43] -> 915.5 | AV21: =RC[-26]/RC[-44] -> 27229.625 | AW21: =RC[-42]/RC[-45] -> 83957.75 | AX21: =SUM(RC[-43]:RC[-37])/RC[-46] -> 90371.25 | AY21: =RC[-39]/RC[-47] -> 900.875
A22: 'Italy | B22: 'EU | C22: 'C20 | D22: =RC[+19]/1000 -> 1852 | E22: 1514 | F22: 2020 | G22: 39280920 | H22: 243411 | I22: 316853 | J22: 430260 | K22: 1496820 | L22: 2141553 | M22: 37371 | N22: 2805780 | O22: 117879 | P22: 36 | Q22: 54 | R22: 22888 | S22: 8023 | T22: 1035944 | U22: 5648382 | V22: 19316000 | W22: 1852000 | X22: 1723 | Y22: 2004 | Z22: 6532 | AA22: 203627804 | AB22: 123169979 | AC22: 9815021 | AD22: 203095 | AE22: 852375 | AF22: 4157287 | AG22: 47965860 | AH22: 389791421 | AI22: 341215177 | AJ22: 16022031 | AK22: 32554213 | AL22: 389791421 | AM22: 12350868 | AN22: 192267 | AO22: 725036 | AP22: 2328210 | AQ22: 15596381 | AR22: =RC[-30]+RC[-29] -> 2923659 | AS22: =RC[-24]/RC[-23] -> 0.292419859184096 | AT22: =RC[-12]/RC[-23] -> 210.470529697624 | AU22: =RC[-27]/RC[-43] -> 559.365010799136 | AV22: =RC[-26]/RC[-44] -> 10429.8056155508 | AW22: =RC[-42]/RC[-45] -> 21210 | AX22: =SUM(RC[-43]:RC[-37])/RC[-46] -> 23729.5831533477 | AY22: =RC[-39]/RC[-47] -> 1156.34611231102
A23: 'Liechtenstein | B23: 'EFTA | C23: 'C21 | D23: =RC[+19]/1000 -> 1 | E23: 1 | F23: 2 | G23: 76657 | H23: 765 | I23: 935 | J23: 249 | K23: 3458 | L23: 870 | M23: 88 | N23: 2327 | O23: 52 | P23: 22 | Q23: 30 | R23: 7 | S23: 2 | T23: 883 | U23: 22447 | V23: 26257 | W23: 1000 | X23: 3 | Y23: 2 | Z23: 5 | AA23: 185623 | AB23: 95800 | AC23: 0 | AD23: 0 | AE23: 0 | AF23: 0 | AG23: 57598 | AH23: 339021 | AI23: 322961 | AJ23: 16061 | AK23: -1 | AL23: 339021 | AM23: 10772 | AN23: 168 | AO23: 633 | AP23: 2030 | AQ23: 13603 | AR23: =RC[-30]+RC[-29] -> 2379 | AS23: =RC[-24]/RC[-23] -> 0.854895837300529 | AT23: =RC[-12]/RC[-23] -> 339.021 | AU23: =RC[-27]/RC[-43] -> 883 | AV23: =RC[-26]/RC[-44] -> 26257 | AW23: =RC[-42]/RC[-45] -> 76657 | AX23: =SUM(RC[-43]:RC[-37])/RC[-46] -> 83022 | AY23: =RC[-39]/RC[-47] -> 870
A24: 'Luxembourg | B24: 'EU | C24: 'C22 | D24: =RC[+19]/1000 -> 2.999 | E24: 6 | F24: 6 | G24: 469000 | H24: 1650 | I24: 770 | J24: 10 | K24: 5 | L24: 3200 | M24: 184 | N24: 3800 | O24: 120 | P24: 83 | Q24: 41 | R24: 38 | S24: 30 | T24: 13837 | U24: 248939 | V24: 481389 | W24: 2999 | X24: 5 | Y24: 5 | Z24: 9 | AA24: 303856 | AB24: 233335 | AC24: 17967 | AD24: 151 | AE24: 1425 | AF24: 8928 | AG24: 67651 | AH24: 633313 | AI24: 563959 | AJ24: 0 | AK24: 69354 | AL24: 633313 | AM24: 9906 | AN24: 154 | AO24: 581 | AP24: 1868 | AQ24: 12509 | AR24: =RC[-30]+RC[-29] -> 3920 | AS24: =RC[-24]/RC[-23] -> 0.517126481909641 | AT24: =RC[-12]/RC[-23] -> 211.174724908303 | AU24: =RC[-27]/RC[-43] -> 4613.87129043014 | AV24: =RC[-26]/RC[-44] -> 160516.505501834 | AW24: =RC[-42]/RC[-45] -> 156385.461820607 | AX24: =SUM(RC[-43]:RC[-37])/RC[-46] -> 158325.775258419 | AY24: =RC[-39]/RC[-47] -> 1067.02234078026
A25: 'Netherlands | B25: 'EU | C25: 'C23 | D25: =RC[+19]/1000 -> 540 | E25: 23 | F25: 138 | G25: 25084875 | H25: 152742 | I25: 161182 | J25: 103146 | K25: 5797711 | L25: 662326 | M25: 7736 | N25: 686980 | O25: 36457 | P25: 36 | Q25: 54 | R25: 7079 | S25: 2655 | T25: 554154 | U25: 4162863 | V25: 18077577 | W25: 540000 | X25: 868 | Y25: 1002 | Z25: 1870 | AA25: 59373118 | AB25: 35913493 | AC25: 2861832 | AD25: 59218 | AE25: 248533 | AF25: 1212168 | AG25: 13985724 | AH25: 113654086 | AI25: 99490386 | AJ25: 4671651 | AK25: 9492049 | AL25: 113654086 | AM25: 3601224 | AN25: 56061 | AO25: 211403 | AP25: 678852 | AQ25: 4547540 | AR25: =RC[-30]+RC[-29] -> 723437 | AS25: =RC[-24]/RC[-23] -> 0.230277708124269 | AT25: =RC[-12]/RC[-23] -> 210.47052962963 | AU25: =RC[-27]/RC[-43] -> 1026.21111111111 | AV25: =RC[-26]/RC[-44] -> 33476.9944444444 | AW25: =RC[-42]/RC[-45] -> 46453.4722222222 | AX25: =SUM(RC[-43]:RC[-37])/RC[-46] -> 59203.1814814815 | AY25: =RC[-39]/RC[-47] -> 1226.52962962963
A26: 'Norway | B26: 'EFTA | C26: 'C24 | D26: =RC[+19]/1000 -> 194 | E26: 85 | F26: 186 | G26: 12847148 | H26: 86079 | I26: 129643 | J26: 49356 | K26: 442477 | L26: 115851 | M26: 8422 | N26: 291236 | O26: 5151 | P26: 21 | Q26: 32 | R26: 1140 | S26: 424 | T26: 125315 | U26: 2688468 | V26: 5376936 | W26: 194000 | X26: 619 | Y26: 346 | Z26: 964 | AA26: 38591900 | AB26: 21176919 | AC26: 0 | AD26: 0 | AE26: 0 | AF26: 0 | AG26: 17201698 | AH26: 76970517 | AI26: 62407529 | AJ26: 8521543 | AK26: 0 | AL26: 70929072 | AM26: 2089824 | AN26: 32532 | AO26: 122679 | AP26: 393946 | AQ26: 2638981 | AR26: =RC[-30]+RC[-29] -> 296387 | AS26: =RC[-24]/RC[-23] -> 0.5 | AT26: =RC[-12]/RC[-23] -> 396.755242268041 | AU26: =RC[-27]/RC[-43] -> 645.953608247423 | AV26: =RC[-26]/RC[-44] -> 27716.1649484536 | AW26: =RC[-42]/RC[-45] -> 66222.412371134 | AX26: =SUM(RC[-43]:RC[-37])/RC[-46] -> 70510.1855670103 | AY26: =RC[-39]/RC[-47] -> 597.170103092784
A27: 'Portugal | B27: 'EU | C27: 'C25 | D27: =RC[+19]/1000 -> 325 | E27: 230 | F27: 230 | G27: 8616219 | H27: 99940 | I27: 154155 | J27: 14149 | K27: 47946 | L27: 144852 | M27: 12895 | N27: 333379 | O27: 9748 | P27: 36 | Q27: 54 | R27: 484 | S27: 146 | T27: 1106067 | U27: 1615393 | V27: 10534730 | W27: 325000 | X27: 829 | Y27: 470 | Z27: 1215 | AA27: 7048520 | AB27: 10692942 | AC27: 0 | AD27: 0 | AE27: 0 | AF27: 0 | AG27: 1519291 | AH27: 19260753 | AI27: 17669449 | AJ27: 525356 | AK27: 1065948 | AL27: 19260753 | AM27: 12126 | AN27: 0 | AO27: 0 | AP27: 457209 | AQ27: 469335 | AR27: =RC[-30]+RC[-29] -> 343127 | AS27: =RC[-24]/RC[-23] -> 0.153339762860557 | AT27: =RC[-12]/RC[-23] -> 59.2638553846154 | AU27: =RC[-27]/RC[-43] -> 3403.28307692308 | AV27: =RC[-26]/RC[-44] -> 32414.5538461538 | AW27: =RC[-42]/RC[-45] -> 26511.4430769231 | AX27: =SUM(RC[-43]:RC[-37])/RC[-46] -> 27969.7107692308 | AY27: =RC[-39]/RC[-47] -> 445.698461538462
A28: 'Spain | B28: 'EU | C28: 'C26 | D28: =RC[+19]/1000 -> 1680 | E28: 610 | F28: 1007 | G28: 29482682 | H28: 234938 | I28: 632303 | J28: 41839 | K28: 1635186 | L28: 1038741 | M28: 71863 | N28: 1371270 | O28: 77635 | P28: 36 | Q28: 54 | R28: 17051 | S28: 6282 | T28: 3805781 | U28: 14251982 | V28: 51875328 | W28: 1680000 | X28: 5874 | Y28: 1556 | Z28: 7430 | AA28: 122788945 | AB28: 79317863 | AC28: 0 | AD28: 0 | AE28: 0 | AF28: 0 | AG28: 10218365 | AH28: 212325173 | AI28: 181396888 | AJ28: 9628756 | AK28: 21299529 | AL28: 212325173 | AM28: 6755195 | AN28: 105158 | AO28: 396552 | AP28: 1273393 | AQ28: 8530298 | AR28: =RC[-30]+RC[-29] -> 1448905 | AS28: =RC[-24]/RC[-23] -> 0.274735265288347 | AT28: =RC[-12]/RC[-23] -> 126.384031547619 | AU28: =RC[-27]/RC[-43] -> 2265.34583333333 | AV28: =RC[-26]/RC[-44] -> 30878.1714285714 | AW28: =RC[-42]/RC[-45] -> 17549.2154761905 | AX28: =SUM(RC[-43]:RC[-37])/RC[-46] -> 19724.7333333333 | AY28: =RC[-39]/RC[-47] -> 618.298214285714
A29: 'Sweden | B29: 'EU | C29: 'C27 | D29: =RC[+19]/1000 -> 292 | E29: 37 | F29: 155 | G29: 23323000 | H29: 254183 | I29: 213316 | J29: 69985 | K29: 2710924 | L29: 45375 | M29: 9291 | N29: 342000 | O29: 1045 | P29: 22 | Q29: 54 | R29: 2510 | S29: 2328 | T29: 497999 | U29: 6899208 | V29: 8408494 | W29: 292000 | X29: 1111 | Y29: 622 | Z29: 1733 | AA29: 66313682 | AB29: 31054748 | AC29: 0 | AD29: 0 | AE29: 0 | AF29: 0 | AG29: 20561175 | AH29: 117929605 | AI29: 103233087 | AJ29: 2479925 | AK29: 12216593 | AL29: 117929605 | AM29: 1947329 | AN29: 30314 | AO29: 114315 | AP29: 367082 | AQ29: 2459040 | AR29: =RC[-30]+RC[-29] -> 343045 | AS29: =RC[-24]/RC[-23] -> 0.820504599277825 | AT29: =RC[-12]/RC[-23] -> 403.868510273973 | AU29: =RC[-27]/RC[-43] -> 1705.47602739726 | AV29: =RC[-26]/RC[-44] -> 28796.2123287671 | AW29: =RC[-42]/RC[-45] -> 79873.2876712329 | AX29: =SUM(RC[-43]:RC[-37])/RC[-46] -> 91185.1849315069 | AY29: =RC[-39]/RC[-47] -> 155.393835616438
A30: 'Switzerland | B30: 'EFTA | C30: 'C28 | D30: =RC[+19]/1000 -> 162 | E30: 151 | F30: 345 | G30: 17612880 | H30: 127657 | I30: 156191 | J30: 57374 | K30: 794376 | L30: 195845 | M30: 14678 | N30: 534663 | O30: 11493 | P30: 22 | Q30: 30 | R30: 1888 | S30: 708 | T30: 199025 | U30: 5060410 | V30: 5919042 | W30: 162000 | X30: 912 | Y30: 517 | Z30: 1429 | AA30: 30070810 | AB30: 15519502 | AC30: 0 | AD30: 0 | AE30: 0 | AF30: 0 | AG30: 9331123 | AH30: 54921435 | AI30: 52319588 | AJ30: 2601848 | AK30: -1 | AL30: 54921435 | AM30: 1745112 | AN30: 27167 | AO30: 102444 | AP30: 328962 | AQ30: 2203685 | AR30: =RC[-30]+RC[-29] -> 546156 | AS30: =RC[-24]/RC[-23] -> 0.854937336143248 | AT30: =RC[-12]/RC[-23] -> 339.021203703704 | AU30: =RC[-27]/RC[-43] -> 1228.54938271605 | AV30: =RC[-26]/RC[-44] -> 36537.2962962963 | AW30: =RC[-42]/RC[-45] -> 108721.481481481 | AX30: =SUM(RC[-43]:RC[-37])/RC[-46] -> 117030.87037037 | AY30: =RC[-39]/RC[-47] -> 1208.91975308642
A31: 'UK | B31: 'EU | C31: 'C29 | D31: =RC[+19]/1000 -> 1910 | E31: 166 | F31: 790 | G31: 104563000 | H31: 839000 | I31: 1073993 | J31: 107000 | K31: 10641000 | L31: 2405000 | M31: 72935 | N31: 2831000 | O31: 157000 | P31: 36 | Q31: 54 | R31: 35670 | S31: 35670 | T31: 2449000 | U31: 79300000 | V31: 119300000 | W31: 1910000 | X31: 3629 | Y31: 6191 | Z31: 9820 | AA31: 349430033 | AB31: 221228019 | AC31: 24467620 | AD31: 264739 | AE31: 2493264 | AF31: 0 | AG31: 91189805 | AH31: 689073480 | AI31: 482267515 | AJ31: 32964520 | AK31: 108013536 | AL31: 623245571 | AM31: 23780331 | AN31: 370189 | AO31: 1395983 | AP31: 4482731 | AQ31: 30029234 | AR31: =RC[-30]+RC[-29] -> 2988000 | AS31: =RC[-24]/RC[-23] -> 0.664710813076278 | AT31: =RC[-12]/RC[-23] -> 360.771455497382 | AU31: =RC[-27]/RC[-43] -> 1282.19895287958 | AV31: =RC[-26]/RC[-44] -> 62460.7329842932 | AW31: =RC[-42]/RC[-45] -> 54745.0261780105 | AX31: =SUM(RC[-43]:RC[-37])/RC[-46] -> 62671.1664921466 | AY31: =RC[-39]/RC[-47] -> 1259.16230366492
A32: 'Germany | B32: 'EU | C32: 'C31 | D32: =RC[+19]/1000 -> 2415 | E32: 241 | F32: 845 | G32: 154369463 | H32: 411815 | I32: 519536 | J32: 178925 | K32: 49986069 | L32: 1722099 | M32: 70548 | N32: 3232266 | O32: 61183 | P32: 36 | Q32: 54 | R32: 32716 | S32: 11263 | T32: 2228181 | U32: 57583739 | V32: 83547840 | W32: 2415000 | X32: 5231 | Y32: 3638 | Z32: 8869 | AA32: 240640929 | AB32: 200462916 | AC32: 18827653 | AD32: 0 | AE32: 4629073 | AF32: 0 | AG32: 26773402 | AH32: 491333973 | AI32: 454813141 | AJ32: 11287646 | AK32: 25233186 | AL32: 491333973 | AM32: 15760576 | AN32: 0 | AO32: 0 | AP32: 13353451 | AQ32: 29114027 | AR32: =RC[-30]+RC[-29] -> 3293449 | AS32: =RC[-24]/RC[-23] -> 0.689230732954915 | AT32: =RC[-12]/RC[-23] -> 203.450920496894 | AU32: =RC[-27]/RC[-43] -> 922.642236024845 | AV32: =RC[-26]/RC[-44] -> 34595.3788819876 | AW32: =RC[-42]/RC[-45] -> 63921.1026915114 | AX32: =SUM(RC[-43]:RC[-37])/RC[-46] -> 85821.3064182195 | AY32: =RC[-39]/RC[-47] -> 713.084472049689
A33: 'USA | B33: 'World - A | C33: 'C50 | D33: =RC[+19]/1000 -> 16072.976 | E33: 3575 | F33: 10148 | G33: 878906177 | H33: 5717285 | I33: 7543703 | J33: 5217566 | K33: 1062082077 | L33: 94285669 | M33: 3473225 | N33: 24550615 | O33: 3249220 | P33: 36 | Q33: 54 | R33: 82736 | S33: 28803 | T33: 7641610 | U33: 220701765 | V33: 16541520 | W33: 16072976 | X33: 30041 | Y33: 66668 | Z33: 96709 | AA33: 2534637034 | AB33: 1800363164 | AC33: 0 | AD33: 0 | AE33: 0 | AF33: 0 | AG33: 694734341 | AH33: 5029734539 | AI33: 4388151679 | AJ33: 204458423 | AK33: 437124437 | AL33: 5029734539 | AM33: 159490587 | AN33: 2482795 | AO33: 9362619 | AP33: 30064902 | AQ33: 201400903 | AR33: =RC[-30]+RC[-29] -> 27799835 | AS33: =RC[-24]/RC[-23] -> 13.3422904908376 | AT33: =RC[-12]/RC[-23] -> 312.931129804462 | AU33: =RC[-27]/RC[-43] -> 475.432178832346 | AV33: =RC[-26]/RC[-44] -> 1029.151042097 | AW33: =RC[-42]/RC[-45] -> 54682.2304096018 | AX33: =SUM(RC[-43]:RC[-37])/RC[-46] -> 127992.831072478 | AY33: =RC[-39]/RC[-47] -> 5866.09903480227
A34: 'Turkey | B34: 'World - B | C34: 'C42 | D34: =RC[+19]/1000 -> 1019.781 | E34: 164 | F34: 201 | G34: 15884663 | H34: 103330 | I34: 139519 | J34: 94299 | K34: 11098696 | L34: 1016810 | M34: 37931 | N34: 481848 | O34: 38764 | P34: 22 | Q34: 30 | R34: 20184 | S34: 7203 | T34: 1864187 | U34: 38142111 | V34: 34461925 | W34: 1019781 | X34: 608 | Y34: 910 | Z34: 1518 | AA34: 2938235 | AB34: 4142888 | AC34: 30239 | AD34: 164251 | AE34: 100089 | AF34: 447391 | AG34: 1288970 | AH34: 9112063 | AI34: 6950020 | AJ34: 213410 | AK34: 1948633 | AL34: 9112063 | AM34: 1386857 | AN34: 0 | AO34: 70875 | AP34: 16648 | AQ34: 1474380 | AR34: =RC[-30]+RC[-29] -> 520612 | AS34: =RC[-24]/RC[-23] -> 1.10678991379617 | AT34: =RC[-12]/RC[-23] -> 8.93531356242173 | AU34: =RC[-27]/RC[-43] -> 1828.02680183294 | AV34: =RC[-26]/RC[-44] -> 33793.4566343166 | AW34: =RC[-42]/RC[-45] -> 15576.5433951015 | AX34: =SUM(RC[-43]:RC[-37])/RC[-46] -> 27824.8447460778 | AY34: =RC[-39]/RC[-47] -> 997.086629384152
A35: 'Australia | B35: 'World - A | C35: 'C70 | D35: =RC[+19]/1000 -> 1063.775 | E35: 181 | F35: 444 | G35: 35088509 | H35: 228251 | I35: 308190 | J35: 208301 | K35: 24516522 | L35: 2271047 | M35: 83788 | N35: 1064381 | O35: 86580 | P35: 36 | Q35: 54 | R35: 5795 | S35: 2068 | T35: 535213 | U35: 10950706 | V35: 9894114 | W35: 1063775 | X35: 1343 | Y35: 2012 | Z35: 3355 | AA35: 167752600 | AB35: 119155366 | AC35: 0 | AD35: 0 | AE35: 0 | AF35: 0 | AG35: 45980347 | AH35: 332888313 | AI35: 290425747 | AJ35: 13531891 | AK35: 28930675 | AL35: 332888313 | AM35: 10555736 | AN35: 164322 | AO35: 619656 | AP35: 1989818 | AQ35: 13329532 | AR35: =RC[-30]+RC[-29] -> 1150961 | AS35: =RC[-24]/RC[-23] -> 1.10678995612947 | AT35: =RC[-12]/RC[-23] -> 312.931130173204 | AU35: =RC[-27]/RC[-43] -> 503.126130995746 | AV35: =RC[-26]/RC[-44] -> 9300.94615872717 | AW35: =RC[-42]/RC[-45] -> 32984.8971822049 | AX35: =SUM(RC[-43]:RC[-37])/RC[-46] -> 58945.3672064111 | AY35: =RC[-39]/RC[-47] -> 2134.89412704754
A36: 'Japan | B36: 'World - A | C36: 'C41 | D36: =RC[+19]/1000 -> 3782.313 | E36: 1064 | F36: 1651 | G36: 280726000 | H36: 1742791 | I36: 2353161 | J36: 1590463 | K36: 90887827 | L36: 8278609 | M36: 310617 | N36: 7637000 | O36: 315608 | P36: 36 | Q36: 54 | R36: 31557 | S36: 11262 | T36: 2914715 | U36: 28374000 | V36: 53882295 | W36: 3782313 | X36: 7508 | Y36: 6902 | Z36: 14410 | AA36: 217143840 | AB36: 685720182 | AC36: 2303953 | AD36: 85529 | AE36: 805492 | AF36: 1661955 | AG36: 28519971 | AH36: 936240922 | AI36: 835799770 | AJ36: 35882362 | AK36: 64558790 | AL36: 936240922 | AM36: 37271852 | AN36: 580212 | AO36: 2187979 | AP36: 7025961 | AQ36: 47066004 | AR36: =RC[-30]+RC[-29] -> 7952608 | AS36: =RC[-24]/RC[-23] -> 0.526592269315923 | AT36: =RC[-12]/RC[-23] -> 247.531318005675 | AU36: =RC[-27]/RC[-43] -> 770.61708007772 | AV36: =RC[-26]/RC[-44] -> 14245.8582883014 | AW36: =RC[-42]/RC[-45] -> 74220.7215531872 | AX36: =SUM(RC[-43]:RC[-37])/RC[-46] -> 102024.731427568 | AY36: =RC[-39]/RC[-47] -> 2188.76888295601
A37: 'Korea | B37: 'World - A | C37: 'C40 | D37: =RC[+19]/1000 -> 2413.145 | E37: 676 | F37: 1050 | G37: 170932232 | H37: 1111914 | I37: 1501335 | J37: 1014728 | K37: 57987138 | L37: 5281817 | M37: 198176 | N37: 5191892 | O37: 201360 | P37: 36 | Q37: 54 | R37: 20134 | S37: 7185 | T37: 1859611 | U37: 18299262 | V37: 34377322 | W37: 2413145 | X37: 4821 | Y37: 4622 | Z37: 9443 | AA37: 195146717 | AB37: 539538391 | AC37: 2070557 | AD37: 76865 | AE37: 723894 | AF37: 1493595 | AG37: 25630840 | AH37: 764680859 | AI37: 667139701 | AJ37: 31084234 | AK37: 66456924 | AL37: 764680859 | AM37: 23779731 | AN37: 370180 | AO37: 1395948 | AP37: 4482617 | AQ37: 30028476 | AR37: =RC[-30]+RC[-29] -> 5393252 | AS37: =RC[-24]/RC[-23] -> 0.532306210472125 | AT37: =RC[-12]/RC[-23] -> 316.881438537676 | AU37: =RC[-27]/RC[-43] -> 770.617182141977 | AV37: =RC[-26]/RC[-44] -> 14245.8584129839 | AW37: =RC[-42]/RC[-45] -> 70833.8007040605 | AX37: =SUM(RC[-43]:RC[-37])/RC[-46] -> 98637.8108236347 | AY37: =RC[-39]/RC[-47] -> 2188.76901305143
A38: 'Canada | B38: 'World - A | C38: 'C51 | D38: =RC[+19]/1000 -> 2030.395 | E38: 2739 | F38: 910 | G38: 75032608 | H38: 704438 | I38: 150814 | J38: 642867 | K38: 128742278 | L38: 11440224 | M38: 421442 | N38: 3034914 | O38: 395232 | P38: 36 | Q38: 54 | R38: 10489 | S38: 3658 | T38: 968806 | U38: 27446627 | V38: 241138449 | W38: 2030395 | X38: 3130 | Y38: 6616 | Z38: 13349 | AA38: 402701509 | AB38: 87045658 | AC38: 0 | AD38: 0 | AE38: 0 | AF38: 0 | AG38: 130705857 | AH38: 620453024 | AI38: 573016599 | AJ38: 14160664 | AK38: 33275761 | AL38: 620453024 | AM38: 25852154 | AN38: 38825 | AO38: 1941548 | AP38: 309008 | AQ38: 28141535 | AR38: =RC[-30]+RC[-29] -> 3430146 | AS38: =RC[-24]/RC[-23] -> 0.113821031502114 | AT38: =RC[-12]/RC[-23] -> 305.582423124564 | AU38: =RC[-27]/RC[-43] -> 477.151490227271 | AV38: =RC[-26]/RC[-44] -> 118764.30399011 | AW38: =RC[-42]/RC[-45] -> 36954.6851720971 | AX38: =SUM(RC[-43]:RC[-37])/RC[-46] -> 106942.083190709 | AY38: =RC[-39]/RC[-47] -> 5634.48196040672
A39: 'New Zealand | B39: 'World - A | C39: 'C71 | D39: =RC[+19]/1000 -> 169.557 | E39: 37 | F39: 105 | G39: 9043383 | H39: 58827 | I39: 77689 | J39: 53685 | K39: 10751186 | L39: 955366 | M39: 35194 | N39: 253444 | O39: 33006 | P39: 36 | Q39: 54 | R39: 876 | S39: 305 | T39: 80904 | U39: 2292050 | V39: 261563 | W39: 169557 | X39: 311 | Y39: 680 | Z39: 991 | AA39: 26738387 | AB39: 18992387 | AC39: 0 | AD39: 0 | AE39: 0 | AF39: 0 | AG39: 7328890 | AH39: 53059664 | AI39: 46291479 | AJ39: 2156873 | AK39: 4611312 | AL39: 53059664 | AM39: 1682497 | AN39: 26191 | AO39: 98768 | AP39: 317162 | AQ39: 2124618 | AR39: =RC[-30]+RC[-29] -> 286450 | AS39: =RC[-24]/RC[-23] -> 8.76289842217745 | AT39: =RC[-12]/RC[-23] -> 312.931132303591 | AU39: =RC[-27]/RC[-43] -> 477.149277234204 | AV39: =RC[-26]/RC[-44] -> 1542.62578365977 | AW39: =RC[-42]/RC[-45] -> 53335.3562518799 | AX39: =SUM(RC[-43]:RC[-37])/RC[-46] -> 123706.659117583 | AY39: =RC[-39]/RC[-47] -> 5634.48279929463
A40: 'Mexico | B40: 'World - B | C40: 'C72 | D40: =RC[+19]/1000 -> 1492.176 | E40: 240 | F40: 294 | G40: 23242938 | H40: 151196 | I40: 204149 | J40: 137981 | K40: 16239961 | L40: 1487828 | M40: 55502 | N40: 705055 | O40: 56721 | P40: 22 | Q40: 30 | R40: 29534 | S40: 10540 | T40: 2727737 | U40: 55810735 | V40: 50425771 | W40: 1492176 | X40: 890 | Y40: 1332 | Z40: 2222 | AA40: 3680066 | AB40: 5188865 | AC40: 37873 | AD40: 205720 | AE40: 125359 | AF40: 560346 | AG40: 1614405 | AH40: 11412634 | AI40: 8704729 | AJ40: 267290 | AK40: 2440615 | AL40: 11412634 | AM40: 1737004 | AN40: 0 | AO40: 88770 | AP40: 20850 | AQ40: 1846624 | AR40: =RC[-30]+RC[-29] -> 761776 | AS40: =RC[-24]/RC[-23] -> 1.10678991898805 | AT40: =RC[-12]/RC[-23] -> 7.64831628440613 | AU40: =RC[-27]/RC[-43] -> 1828.02631861121 | AV40: =RC[-26]/RC[-44] -> 33793.4472877194 | AW40: =RC[-42]/RC[-45] -> 15576.5392286165 | AX40: =SUM(RC[-43]:RC[-37])/RC[-46] -> 27824.8376867072 | AY40: =RC[-39]/RC[-47] -> 997.086134611467
A41: 'CEE - Total | B41: 'Totals | D41: =RC[+19]/1000 -> 2302 | E41: 934 | F41: 3615 | G41: 131734074 | H41: 1142831 | I41: 1168450 | J41: 1960226 | K41: 8711868 | L41: 852840 | M41: 88631 | N41: 4228576 | O41: 57769 | P41: 7 | Q41: 26 | R41: 6829 | S41: 3511 | T41: 2553436 | U41: 55149153 | V41: 37603812 | W41: 2302000 | X41: 11489 | Y41: 4214 | Z41: 15703 | AA41: 33263888 | AB41: 47382991 | AC41: 565690 | AD41: 1636390 | AE41: 1196376 | AF41: 3889473 | AG41: 13733644 | AH41: 101668452 | AI41: 79791420 | AJ41: 2661068 | AK41: 18955212 | AL41: 101407700 | AM41: 14119252 | AN41: 0 | AO41: 866018 | AP41: 246785 | AQ41: 15232055 | AR41: =RC[-30]+RC[-29] -> 4286345 | AS41: =RC[-24]/RC[-23] -> 1.46658410588799 | AT41: =RC[-12]/RC[-23] -> 44.1652701998262 | AU41: =RC[-27]/RC[-43] -> 1109.22502172024 | AV41: =RC[-26]/RC[-44] -> 16335.2788879235 | AW41: =RC[-42]/RC[-45] -> 57225.922675934 | AX41: =SUM(RC[-43]:RC[-37])/RC[-46] -> 63274.9435273675 | AY41: =RC[-39]/RC[-47] -> 370.477845351868
A42: 'EU - Total | B42: 'Totals | D42: =RC[+19]/1000 -> 12585.234 | E42: 3208 | F42: 6424 | G42: 487754400 | H42: 2911598 | I42: 3865860 | J42: 1766522 | K42: 78693509 | L42: 9969449 | M42: 423705 | N42: 14813673 | O42: 660572 | P42: 38 | Q42: 48 | R42: 154269 | S42: 80462 | T42: 14382525 | U42: 210580745 | V42: 403657987 | W42: 12585234 | X42: 24539 | Y42: 20301 | Z42: 47560 | AA42: 1354514691 | AB42: 864718452 | AC42: 67486035 | AD42: 1353979 | AE42: 9296599 | AF42: 29096808 | AG42: 318420990 | AH42: 2644887555 | AI42: 2231179957 | AJ42: 106286030 | AK42: 235802452 | AL42: 2573268439 | AM42: 82712061 | AN42: 1136892 | AO42: 3768217 | AP42: 25911026 | AQ42: 113528196 | AR42: =RC[-30]+RC[-29] -> 15474245 | AS42: =RC[-24]/RC[-23] -> 0.52168110574262 | AT42: =RC[-12]/RC[-23] -> 210.157995870399 | AU42: =RC[-27]/RC[-43] -> 1142.80950199257 | AV42: =RC[-26]/RC[-44] -> 32073.9357726682 | AW42: =RC[-42]/RC[-45] -> 38756.0851073568 | AX42: =SUM(RC[-43]:RC[-37])/RC[-46] -> 46513.6399529798 | AY42: =RC[-39]/RC[-47] -> 792.154440672299
A43: 'EFTA - Total | B43: 'Totals | D43: =RC[+19]/1000 -> 365 | E43: 243 | F43: 546 | G43: 31208347 | H43: 219470 | I43: 292848 | J43: 109166 | K43: 1270604 | L43: 319773 | M43: 23761 | N43: 848616 | O43: 17118 | P43: 22 | Q43: 31 | R43: 3105 | S43: 1159 | T43: 332547 | U43: 7957560 | V43: 11540072 | W43: 365000 | X43: 1569 | Y43: 884 | Z43: 2452 | AA43: 70333312 | AB43: 37558616 | AC43: 0 | AD43: 0 | AE43: 0 | AF43: 0 | AG43: 27051215 | AH43: 134943143 | AI43: 117633762 | AJ43: 11267938 | AK43: -2 | AL43: 128901698 | AM43: 3931886 | AN43: 61209 | AO43: 230814 | AP43: 741183 | AQ43: 4965092 | AR43: =RC[-30]+RC[-29] -> 865734 | AS43: =RC[-24]/RC[-23] -> 0.689558955957987 | AT43: =RC[-12]/RC[-23] -> 369.70724109589 | AU43: =RC[-27]/RC[-43] -> 911.087671232877 | AV43: =RC[-26]/RC[-44] -> 31616.6356164384 | AW43: =RC[-42]/RC[-45] -> 85502.3205479452 | AX43: =SUM(RC[-43]:RC[-37])/RC[-46] -> 91627.3123287671 | AY43: =RC[-39]/RC[-47] -> 876.090410958904
A44: 'World A - Total | B44: 'Totals | D44: =RC[+19]/1000 -> 25532.161 | E44: 8272 | F44: 14308 | G44: 1449728909 | H44: 9563506 | I44: 11934892 | J44: 8727610 | K44: 1374967028 | L44: 122512732 | M44: 4522442 | N44: 41732246 | O44: 4281006 | P44: 36 | Q44: 54 | R44: 151587 | S44: 53281 | T44: 14000859 | U44: 308064410 | V44: 356095263 | W44: 25532161 | X44: 47154 | Y44: 87500 | Z44: 138257 | AA44: 3544120087 | AB44: 3250815148 | AC44: 4374510 | AD44: 162394 | AE44: 1529386 | AF44: 3155550 | AG44: 932900246 | AH44: 7737057321 | AI44: 6800824975 | AJ44: 301274447 | AK44: 634957899 | AL44: 7737057321 | AM44: 258632557 | AN44: 3662525 | AO44: 15606518 | AP44: 44189468 | AQ44: 322091068 | AR44: =RC[-30]+RC[-29] -> 46013252 | AS44: =RC[-24]/RC[-23] -> 0.865117967042432 | AT44: =RC[-12]/RC[-23] -> 303.031824098242 | AU44: =RC[-27]/RC[-43] -> 548.36169175026 | AV44: =RC[-26]/RC[-44] -> 13946.9300307169 | AW44: =RC[-42]/RC[-45] -> 56780.5016191148 | AX44: =SUM(RC[-43]:RC[-37])/RC[-46] -> 116792.194714736 | AY44: =RC[-39]/RC[-47] -> 4798.36908438733
A45: 'World B - Total | B45: 'Totals | D45: =RC[+19]/1000 -> 2511.957 | E45: 404 | F45: 495 | G45: 39127601 | H45: 254526 | I45: 343668 | J45: 232280 | K45: 27338657 | L45: 2504638 | M45: 93433 | N45: 1186903 | O45: 95485 | P45: 22 | Q45: 30 | R45: 49718 | S45: 17743 | T45: 4591924 | U45: 93952846 | V45: 84887696 | W45: 2511957 | X45: 1498 | Y45: 2242 | Z45: 3740 | AA45: 6618301 | AB45: 9331753 | AC45: 68112 | AD45: 369971 | AE45: 225448 | AF45: 1007737 | AG45: 2903375 | AH45: 20524697 | AI45: 15654749 | AJ45: 480700 | AK45: 4389248 | AL45: 20524697 | AM45: 3123861 | AN45: 0 | AO45: 159645 | AP45: 37498 | AQ45: 3321004 | AR45: =RC[-30]+RC[-29] -> 1282388 | AS45: =RC[-24]/RC[-23] -> 1.1067899168803 | AT45: =RC[-12]/RC[-23] -> 8.17079950015068 | AU45: =RC[-27]/RC[-43] -> 1828.02651478509 | AV45: =RC[-26]/RC[-44] -> 33793.4510821642 | AW45: =RC[-42]/RC[-45] -> 15576.5409200874 | AX45: =SUM(RC[-43]:RC[-37])/RC[-46] -> 27824.840552605 | AY45: =RC[-39]/RC[-47] -> 997.086335474692
A46: 'EU Accession Countries - Totals | B46: 'Totals | D46: =RC[+19]/1000 -> 1616.63 | E46: 667 | F46: 2835 | G46: 93938357 | H46: 859989 | I46: 884554 | J46: 1531096 | K46: 7862199 | L46: 532106 | M46: 74514 | N46: 3141060 | O46: 42180 | P46: 7 | Q46: 26 | R46: 5462 | S46: 3000 | T46: 1898554 | U46: 38312786 | V46: 27326879 | W46: 1616630 | X46: 8467 | Y46: 2946 | Z46: 11413 | AA46: 28300167 | AB46: 38915339 | AC46: 512335 | AD46: 1281841 | AE46: 978957 | AF46: 2934421 | AG46: 11121444 | AH46: 84044504 | AI46: 67073361 | AJ46: 2421845 | AK46: 14288546 | AL46: 83783752 | AM46: 11011200 | AN46: 2101 | AO46: 708194 | AP46: 241384 | AQ46: 11962879 | AR46: =RC[-30]+RC[-29] -> 3183240 | AS46: =RC[-24]/RC[-23] -> 1.40201835709083 | AT46: =RC[-12]/RC[-23] -> 51.9874702312836 | AU46: =RC[-27]/RC[-43] -> 1174.38993461707 | AV46: =RC[-26]/RC[-44] -> 16903.6075045001 | AW46: =RC[-42]/RC[-45] -> 58107.5181086581 | AX46: =SUM(RC[-43]:RC[-37])/RC[-46] -> 65372.2960726944 | AY46: =RC[-39]/RC[-47] -> 329.145197107563
A47: ' | B47: '
A48: ' | B48: '
A49: ' | B49: '
A50: ' | B50: '
A51: ' | B51: ' | P51: =INDEX(2001Grossed!R[-50]C[-15]:R[-5]C[+35], 16, 26) -> 899

Sheet: Gross
A1: 'Name | B1: 'Type | C1: 'Code | D1: 'Population '000s | E1: 'Libraries - Total Administrative Units | F1: 'Libraries - Service Points | G1: 'Collections - Books & Bound Periodicals | H1: 'Collections - Current Periodicals - Titles | I1: 'Collections - Current Periodicals - Subscriptions | J1: 'Collections - Manuscripts | K1: 'Collections - Microforms | L1: 'Collections - Audio-visual Materials | M1: 'Collections - CD-ROMs | N1: 'Additions - Books & Bound Periodicals | O1: 'Additions - Audio-visual Materials | P1: 'Facilities & Services - Percentage Stock on Open Access | Q1: 'Facilities & Services - Percentage Catalogue Records Automated | R1: 'Facilities & Services - Number of Workstations for users | S1: 'Facilities & Services - Number connected to the internet | T1: 'Use & Users - Registered Users | U1: 'Use & Users - Consultations | V1: 'Use & Users - Number of Visits | W1: 'Use & Users - Potential Total Population Served | X1: 'Library Staff FTE - Trained Librarians | Y1: 'Library Staff FTE - Other Library Staff | Z1: 'Library Staff FTE - Total Staff | AA1: 'Recurrent Expenditure (Euros) - Staff | AB1: 'Recurrent Expenditure (Euros) - Acquisition of Stock | AC1: 'Recurrent Expenditure (Euros) - Electronic Information | AD1: 'Recurrent Expenditure (Euros) - Automation | AE1: 'Recurrent Expenditure (Euros) - Premises and Related Costs | AF1: 'Recurrent Expenditure (Euros) - New Buildings / Refurbishment | AG1: 'Recurrent Expenditure (Euros) - Other Expenditure | AH1: 'Recurrent Expenditure (Euros) - TOTAL EXPENDITURE | AI1: 'Income - Public Funding | AJ1: 'Income - Fees & Charges | AK1: 'Income - Other Income | AL1: 'Income - TOTAL INCOME | AM1: 'Capital Expenditure - New Buildings / Refurbishment | AN1: 'Capital Expenditure - Acquisition of Stock | AO1: 'Capital Expenditure - Automation | AP1: 'Capital Expenditure - Other Capital Expenditure | AQ1: 'Capital Expenditure - TOTAL CAPITAL PAYMENTS | AR1: 'Additions | AS1: 'Loans per visit | AT1: 'Cost per pop | AU1: 'Users per 1000 pop | AV1: 'visits per 1000 pop | AW1: 'Bookstock per 1000 pop | AX1: 'Total stock per 1000 pop | AY1: 'AV materials per 1000 pop
A2: 'Bulgaria | B2: 'CEE | C2: 'C1 | D2: 0 | E2: 1 | F2: 1 | G2: 1 | H2: 1 | I2: 2 | J2: 2 | K2: 1 | L2: 1 | M2: 2 | N2: 1 | O2: 1 | P2: 2 | Q2: 2 | R2: 2 | S2: 2 | T2: 1 | U2: 1 | V2: 1 | W2: 0 | X2: 1 | Y2: 1 | Z2: 1 | AA2: 1 | AB2: 1 | AC2: 1 | AD2: 1 | AE2: 1 | AF2: 1 | AG2: 1 | AH2: 1 | AI2: 1 | AJ2: 1 | AK2: 1 | AL2: 1 | AM2: 2 | AN2: 2 | AO2: 2 | AP2: 2 | AQ2: 2 | AR2: =MAX(RC[-30], RC[-29]) -> 1 | AS2: =MAX(RC[-24], RC[-23]) -> 1 | AT2: =MAX(RC[-12], RC[-23]) -> 1 | AU2: =MAX(RC[-27], RC[-43]) -> 1 | AV2: =MAX(RC[-26], RC[-44]) -> 1 | AW2: =MAX(RC[-42], RC[-45]) -> 1 | AX2: =MAX(RC[-43]:RC[-37]) -> 2 | AY2: =RC[-39] -> 1
A3: 'Czech Republic | B3: 'CEE | C3: 'C2 | D3: 0 | E3: 0 | F3: 0 | G3: 0 | H3: 0 | I3: 2 | J3: 1 | K3: 1 | L3: 1 | M3: 2 | N3: 0 | O3: 1 | P3: 2 | Q3: 2 | R3: 2 | S3: 2 | T3: 0 | U3: 0 | V3: 1 | W3: 0 | X3: 0 | Y3: 0 | Z3: 0 | AA3: 2 | AB3: 0 | AC3: 2 | AD3: 2 | AE3: 2 | AF3: 2 | AG3: 2 | AH3: 2 | AI3: 2 | AJ3: 2 | AK3: 2 | AL3: 2 | AM3: 2 | AN3: 2 | AO3: 2 | AP3: 2 | AQ3: 2 | AR3: =MAX(RC[-30], RC[-29]) -> 1 | AS3: =MAX(RC[-24], RC[-23]) -> 1 | AT3: =MAX(RC[-12], RC[-23]) -> 2 | AU3: =MAX(RC[-27], RC[-43]) -> 0 | AV3: =MAX(RC[-26], RC[-44]) -> 1 | AW3: =MAX(RC[-42], RC[-45]) -> 0 | AX3: =MAX(RC[-43]:RC[-37]) -> 2 | AY3: =RC[-39] -> 1
A4: 'Estonia | B4: 'CEE | C4: 'C3 | D4: 0 | E4: 0 | F4: 0 | G4: 0 | H4: 0 | I4: 0 | J4: 0 | K4: 0 | L4: 0 | M4: 0 | N4: 0 | O4: 0 | P4: 0 | Q4: 0 | R4: 0 | S4: 0 | T4: 0 | U4: 0 | V4: 0 | W4: 0 | X4: 0 | Y4: 0 | Z4: 0 | AA4: 0 | AB4: 0 | AC4: 0 | AD4: 0 | AE4: 0 | AF4: 0 | AG4: 0 | AH4: 0 | AI4: 0 | AJ4: 0 | AK4: 0 | AL4: 0 | AM4: 0 | AN4: 0 | AO4: 0 | AP4: 0 | AQ4: 1 | AR4: =MAX(RC[-30], RC[-29]) -> 0 | AS4: =MAX(RC[-24], RC[-23]) -> 0 | AT4: =MAX(RC[-12], RC[-23]) -> 0 | AU4: =MAX(RC[-27], RC[-43]) -> 0 | AV4: =MAX(RC[-26], RC[-44]) -> 0 | AW4: =MAX(RC[-42], RC[-45]) -> 0 | AX4: =MAX(RC[-43]:RC[-37]) -> 0 | AY4: =RC[-39] -> 0
A5: 'Hungary | B5: 'CEE | C5: 'C4 | D5: 0 | E5: 1 | F5: 1 | G5: 1 | H5: 1 | I5: 2 | J5: 1 | K5: 1 | L5: 1 | M5: 1 | N5: 1 | O5: 1 | P5: 2 | Q5: 2 | R5: 2 | S5: 2 | T5: 1 | U5: 1 | V5: 1 | W5: 0 | X5: 1 | Y5: 1 | Z5: 1 | AA5: 1 | AB5: 1 | AC5: 1 | AD5: 1 | AE5: 1 | AF5: 1 | AG5: 1 | AH5: 1 | AI5: 1 | AJ5: 1 | AK5: 1 | AL5: 1 | AM5: 2 | AN5: 2 | AO5: 2 | AP5: 2 | AQ5: 2 | AR5: =MAX(RC[-30], RC[-29]) -> 1 | AS5: =MAX(RC[-24], RC[-23]) -> 1 | AT5: =MAX(RC[-12], RC[-23]) -> 1 | AU5: =MAX(RC[-27], RC[-43]) -> 1 | AV5: =MAX(RC[-26], RC[-44]) -> 1 | AW5: =MAX(RC[-42], RC[-45]) -> 1 | AX5: =MAX(RC[-43]:RC[-37]) -> 2 | AY5: =RC[-39] -> 1
A6: 'Latvia | B6: 'CEE | C6: 'C5 | D6: 0 | E6: 0 | F6: 0 | G6: 0 | H6: 2 | I6: 2 | J6: 0 | K6: 2 | L6: 0 | M6: 2 | N6: 1 | O6: 2 | P6: 2 | Q6: 2 | R6: 2 | S6: 2 | T6: 0 | U6: 1 | V6: 0 | W6: 0 | X6: 0 | Y6: 0 | Z6: 0 | AA6: 0 | AB6: 0 | AC6: 0 | AD6: 0 | AE6: 0 | AF6: 0 | AG6: 0 | AH6: 0 | AI6: 0 | AJ6: 0 | AK6: 0 | AL6: 0 | AM6: 1 | AN6: 1 | AO6: 1 | AP6: 1 | AQ6: 1 | AR6: =MAX(RC[-30], RC[-29]) -> 2 | AS6: =MAX(RC[-24], RC[-23]) -> 1 | AT6: =MAX(RC[-12], RC[-23]) -> 0 | AU6: =MAX(RC[-27], RC[-43]) -> 0 | AV6: =MAX(RC[-26], RC[-44]) -> 0 | AW6: =MAX(RC[-42], RC[-45]) -> 0 | AX6: =MAX(RC[-43]:RC[-37]) -> 2 | AY6: =RC[-39] -> 0
A7: 'Lithuania | B7: 'CEE | C7: 'C6 | D7: 0 | E7: 0 | F7: 0 | G7: 0 | H7: 0 | I7: 0 | J7: 0 | K7: 0 | L7: 0 | M7: 0 | N7: 0 | O7: 0 | P7: 0 | Q7: 0 | R7: 0 | S7: 0 | T7: 0 | U7: 0 | V7: 0 | W7: 0 | X7: 0 | Y7: 0 | Z7: 0 | AA7: 0 | AB7: 0 | AC7: 0 | AD7: 0 | AE7: 0 | AF7: 0 | AG7: 0 | AH7: 0 | AI7: 0 | AJ7: 0 | AK7: 0 | AL7: 0 | AM7: 2 | AN7: 2 | AO7: 2 | AP7: 2 | AQ7: 2 | AR7: =MAX(RC[-30], RC[-29]) -> 0 | AS7: =MAX(RC[-24], RC[-23]) -> 0 | AT7: =MAX(RC[-12], RC[-23]) -> 0 | AU7: =MAX(RC[-27], RC[-43]) -> 0 | AV7: =MAX(RC[-26], RC[-44]) -> 0 | AW7: =MAX(RC[-42], RC[-45]) -> 0 | AX7: =MAX(RC[-43]:RC[-37]) -> 0 | AY7: =RC[-39] -> 0
A8: 'Poland | B8: 'CEE | C8: 'C7 | D8: 0 | E8: 2 | F8: 2 | G8: 2 | H8: 2 | I8: 2 | J8: 2 | K8: 2 | L8: 2 | M8: 2 | N8: 2 | O8: 2 | P8: 2 | Q8: 2 | R8: 2 | S8: 2 | T8: 2 | U8: 2 | V8: 2 | W8: 0 | X8: 2 | Y8: 2 | Z8: 2 | AA8: 2 | AB8: 2 | AC8: 2 | AD8: 2 | AE8: 2 | AF8: 2 | AG8: 2 | AH8: 2 | AI8: 2 | AJ8: 2 | AK8: 2 | AL8: 2 | AM8: 2 | AN8: 2 | AO8: 2 | AP8: 2 | AQ8: 2 | AR8: =MAX(RC[-30], RC[-29]) -> 2 | AS8: =MAX(RC[-24], RC[-23]) -> 2 | AT8: =MAX(RC[-12], RC[-23]) -> 2 | AU8: =MAX(RC[-27], RC[-43]) -> 2 | AV8: =MAX(RC[-26], RC[-44]) -> 2 | AW8: =MAX(RC[-42], RC[-45]) -> 2 | AX8: =MAX(RC[-43]:RC[-37]) -> 2 | AY8: =RC[-39] -> 2
A9: 'Romania | B9: 'CEE | C9: 'C8 | D9: 0 | E9: 2 | F9: 2 | G9: 2 | H9: 2 | I9: 2 | J9: 2 | K9: 2 | L9: 2 | M9: 2 | N9: 2 | O9: 2 | P9: 2 | Q9: 2 | R9: 2 | S9: 2 | T9: 2 | U9: 2 | V9: 2 | W9: 0 | X9: 2 | Y9: 2 | Z9: 2 | AA9: 2 | AB9: 2 | AC9: 2 | AD9: 2 | AE9: 2 | AF9: 2 | AG9: 2 | AH9: 2 | AI9: 2 | AJ9: 2 | AK9: 2 | AL9: 2 | AM9: 2 | AN9: 2 | AO9: 2 | AP9: 2 | AQ9: 2 | AR9: =MAX(RC[-30], RC[-29]) -> 2 | AS9: =MAX(RC[-24], RC[-23]) -> 2 | AT9: =MAX(RC[-12], RC[-23]) -> 2 | AU9: =MAX(RC[-27], RC[-43]) -> 2 | AV9: =MAX(RC[-26], RC[-44]) -> 2 | AW9: =MAX(RC[-42], RC[-45]) -> 2 | AX9: =MAX(RC[-43]:RC[-37]) -> 2 | AY9: =RC[-39] -> 2
A10: 'Slovak Rep | B10: 'CEE | C10: 'C9 | D10: 0 | E10: 0 | F10: 0 | G10: 0 | H10: 0 | I10: 0 | J10: 2 | K10: 2 | L10: 2 | M10: 0 | N10: 0 | O10: 0 | P10: 2 | Q10: 2 | R10: 0 | S10: 0 | T10: 0 | U10: 0 | V10: 0 | W10: 0 | X10: 0 | Y10: 0 | Z10: 0 | AA10: 0 | AB10: 0 | AC10: 0 | AD10: 0 | AE10: 0 | AF10: 0 | AG10: 0 | AH10: 0 | AI10: 0 | AJ10: 0 | AK10: 0 | AL10: 0 | AM10: 0 | AN10: 0 | AO10: 0 | AP10: 0 | AQ10: 0 | AR10: =MAX(RC[-30], RC[-29]) -> 0 | AS10: =MAX(RC[-24], RC[-23]) -> 0 | AT10: =MAX(RC[-12], RC[-23]) -> 0 | AU10: =MAX(RC[-27], RC[-43]) -> 0 | AV10: =MAX(RC[-26], RC[-44]) -> 0 | AW10: =MAX(RC[-42], RC[-45]) -> 0 | AX10: =MAX(RC[-43]:RC[-37]) -> 2 | AY10: =RC[-39] -> 2
A11: 'Slovenia | B11: 'CEE | C11: 'C10 | D11: 0 | E11: 0 | F11: 0 | G11: 0 | H11: 0 | I11: 0 | J11: 2 | K11: 2 | L11: 2 | M11: 2 | N11: 0 | O11: 1 | P11: 2 | Q11: 1 | R11: 0 | S11: 0 | T11: 0 | U11: 0 | V11: 0 | W11: 0 | X11: 0 | Y11: 0 | Z11: 0 | AA11: 1 | AB11: 0 | AC11: 1 | AD11: 1 | AE11: 1 | AF11: 1 | AG11: 1 | AH11: 0 | AI11: 1 | AJ11: 1 | AK11: 1 | AL11: 0 | AM11: 2 | AN11: 2 | AO11: 2 | AP11: 2 | AQ11: 2 | AR11: =MAX(RC[-30], RC[-29]) -> 1 | AS11: =MAX(RC[-24], RC[-23]) -> 0 | AT11: =MAX(RC[-12], RC[-23]) -> 0 | AU11: =MAX(RC[-27], RC[-43]) -> 0 | AV11: =MAX(RC[-26], RC[-44]) -> 0 | AW11: =MAX(RC[-42], RC[-45]) -> 0 | AX11: =MAX(RC[-43]:RC[-37]) -> 2 | AY11: =RC[-39] -> 2
A12: 'Austria | B12: 'EU | C12: 'C11 | D12: 0 | E12: 2 | F12: 2 | G12: 2 | H12: 2 | I12: 2 | J12: 2 | K12: 2 | L12: 2 | M12: 2 | N12: 2 | O12: 2 | P12: 2 | Q12: 2 | R12: 2 | S12: 2 | T12: 2 | U12: 2 | V12: 2 | W12: 0 | X12: 2 | Y12: 2 | Z12: 2 | AA12: 2 | AB12: 2 | AC12: 2 | AD12: 2 | AE12: 2 | AF12: 2 | AG12: 2 | AH12: 2 | AI12: 2 | AJ12: 2 | AK12: 2 | AL12: 2 | AM12: 2 | AN12: 2 | AO12: 2 | AP12: 2 | AQ12: 2 | AR12: =MAX(RC[-30], RC[-29]) -> 2 | AS12: =MAX(RC[-24], RC[-23]) -> 2 | AT12: =MAX(RC[-12], RC[-23]) -> 2 | AU12: =MAX(RC[-27], RC[-43]) -> 2 | AV12: =MAX(RC[-26], RC[-44]) -> 2 | AW12: =MAX(RC[-42], RC[-45]) -> 2 | AX12: =MAX(RC[-43]:RC[-37]) -> 2 | AY12: =RC[-39] -> 2
A13: 'België Vlaamse Gemeenschap | B13: 'België Vlaamse Gemeenschap | D13: 0 | E13: 0 | F13: 0 | G13: 0 | H13: 0 | I13: 0 | J13: 0 | K13: 0 | L13: 0 | M13: 0 | N13: 0 | O13: 0 | P13: 0 | Q13: 0 | R13: 0 | S13: 0 | T13: 0 | U13: 0 | V13: 0 | W13: 0 | X13: 0 | Y13: 0 | Z13: 0 | AA13: 0 | AB13: 0 | AC13: 0 | AD13: 0 | AE13: 0 | AF13: 0 | AG13: 0 | AH13: 0 | AI13: 0 | AJ13: 0 | AK13: 0 | AL13: 0 | AM13: 0 | AN13: 0 | AO13: 0 | AP13: 0 | AQ13: 0 | AR13: 0 | AS13: =MAX(RC[-24], RC[-23]) -> 0 | AT13: =MAX(RC[-12], RC[-23]) -> 0 | AU13: =MAX(RC[-27], RC[-43]) -> 0 | AV13: =MAX(RC[-26], RC[-44]) -> 0 | AW13: =MAX(RC[-42], RC[-45]) -> 0 | AX13: =MAX(RC[-43]:RC[-37]) -> 0 | AY13: =RC[-39] -> 0
A14: 'Belgique universités francophones | B14: 'Belgique universités francophones | D14: 0 | E14: 0 | F14: 0 | G14: 0 | H14: 0 | I14: 0 | J14: 0 | K14: 0 | L14: 0 | M14: 0 | N14: 0 | O14: 0 | P14: 0 | Q14: 0 | R14: 0 | S14: 0 | T14: 0 | U14: 0 | V14: 0 | W14: 0 | X14: 0 | Y14: 0 | Z14: 0 | AA14: 0 | AB14: 0 | AC14: 0 | AD14: 0 | AE14: 0 | AF14: 0 | AG14: 0 | AH14: 0 | AI14: 0 | AJ14: 0 | AK14: 0 | AL14: 0 | AM14: 0 | AN14: 0 | AO14: 0 | AP14: 0 | AQ14: 0 | AR14: 0 | AS14: =MAX(RC[-24], RC[-23]) -> 0 | AT14: =MAX(RC[-12], RC[-23]) -> 0 | AU14: =MAX(RC[-27], RC[-43]) -> 0 | AV14: =MAX(RC[-26], RC[-44]) -> 0 | AW14: =MAX(RC[-42], RC[-45]) -> 0 | AX14: =MAX(RC[-43]:RC[-37]) -> 0 | AY14: =RC[-39] -> 0
A15: 'Belgium | B15: 'EU | C15: 'C12 | D15: 0 | E15: 1 | F15: 0 | G15: 0 | H15: 0 | I15: 0 | J15: 0 | K15: 0 | L15: 0 | M15: 0 | N15: 0 | O15: 0 | P15: 0 | Q15: 0 | R15: 0 | S15: 2 | T15: 0 | U15: 0 | V15: 0 | W15: 0 | X15: 0 | Y15: 0 | Z15: 0 | AA15: 0 | AB15: 0 | AC15: 0 | AD15: 0 | AE15: 0 | AF15: 0 | AG15: 0 | AH15: 0 | AI15: 0 | AJ15: 0 | AK15: 0 | AL15: 0 | AM15: 0 | AN15: 0 | AO15: 0 | AP15: 0 | AQ15: 0 | AR15: =MAX(RC[-30], RC[-29]) -> 0 | AS15: =MAX(RC[-24], RC[-23]) -> 0 | AT15: =MAX(RC[-12], RC[-23]) -> 0 | AU15: =MAX(RC[-27], RC[-43]) -> 0 | AV15: =MAX(RC[-26], RC[-44]) -> 0 | AW15: =MAX(RC[-42], RC[-45]) -> 0 | AX15: =MAX(RC[-43]:RC[-37]) -> 0 | AY15: =RC[-39] -> 0
A16: 'Denmark | B16: 'EU | C16: 'C13 | D16: 0 | E16: 0 | F16: 0 | G16: 0 | H16: 0 | I16: 0 | J16: 0 | K16: 0 | L16: 0 | M16: 0 | N16: 0 | O16: 0 | P16: 0 | Q16: 2 | R16: 0 | S16: 2 | T16: 2 | U16: 0 | V16: 2 | W16: 0 | X16: 0 | Y16: 0 | Z16: 0 | AA16: 0 | AB16: 0 | AC16: 1 | AD16: 1 | AE16: 1 | AF16: 0 | AG16: 0 | AH16: 0 | AI16: 0 | AJ16: 1 | AK16: 1 | AL16: 0 | AM16: 1 | AN16: 1 | AO16: 1 | AP16: 1 | AQ16: 0 | AR16: =MAX(RC[-30], RC[-29]) -> 0 | AS16: =MAX(RC[-24], RC[-23]) -> 2 | AT16: =MAX(RC[-12], RC[-23]) -> 0 | AU16: =MAX(RC[-27], RC[-43]) -> 2 | AV16: =MAX(RC[-26], RC[-44]) -> 2 | AW16: =MAX(RC[-42], RC[-45]) -> 0 | AX16: =MAX(RC[-43]:RC[-37]) -> 0 | AY16: =RC[-39] -> 0
A17: 'Eire | B17: 'EU | C17: 'C15 | D17: 0 | E17: 2 | F17: 2 | G17: 2 | H17: 2 | I17: 2 | J17: 2 | K17: 2 | L17: 2 | M17: 2 | N17: 2 | O17: 2 | P17: 2 | Q17: 2 | R17: 2 | S17: 2 | T17: 2 | U17: 2 | V17: 2 | W17: 0 | X17: 2 | Y17: 2 | Z17: 2 | AA17: 2 | AB17: 2 | AC17: 2 | AD17: 2 | AE17: 2 | AF17: 2 | AG17: 2 | AH17: 2 | AI17: 2 | AJ17: 2 | AK17: 2 | AL17: 2 | AM17: 2 | AN17: 2 | AO17: 2 | AP17: 2 | AQ17: 2 | AR17: =MAX(RC[-30], RC[-29]) -> 2 | AS17: =MAX(RC[-24], RC[-23]) -> 2 | AT17: =MAX(RC[-12], RC[-23]) -> 2 | AU17: =MAX(RC[-27], RC[-43]) -> 2 | AV17: =MAX(RC[-26], RC[-44]) -> 2 | AW17: =MAX(RC[-42], RC[-45]) -> 2 | AX17: =MAX(RC[-43]:RC[-37]) -> 2 | AY17: =RC[-39] -> 2
A18: 'Finland | B18: 'EU | C18: 'C16 | D18: 0 | E18: 0 | F18: 1 | G18: 0 | H18: 0 | I18: 0 | J18: 0 | K18: 0 | L18: 0 | M18: 2 | N18: 0 | O18: 0 | P18: 1 | Q18: 2 | R18: 2 | S18: 2 | T18: 2 | U18: 0 | V18: 0 | W18: 0 | X18: 0 | Y18: 0 | Z18: 0 | AA18: 0 | AB18: 0 | AC18: 1 | AD18: 1 | AE18: 1 | AF18: 0 | AG18: 0 | AH18: 0 | AI18: 0 | AJ18: 0 | AK18: 0 | AL18: 0 | AM18: 2 | AN18: 2 | AO18: 2 | AP18: 2 | AQ18: 2 | AR18: =MAX(RC[-30], RC[-29]) -> 0 | AS18: =MAX(RC[-24], RC[-23]) -> 0 | AT18: =MAX(RC[-12], RC[-23]) -> 0 | AU18: =MAX(RC[-27], RC[-43]) -> 2 | AV18: =MAX(RC[-26], RC[-44]) -> 0 | AW18: =MAX(RC[-42], RC[-45]) -> 0 | AX18: =MAX(RC[-43]:RC[-37]) -> 2 | AY18: =RC[-39] -> 0
A19: 'France | B19: 'EU | C19: 'C17 | D19: 0 | E19: 1 | F19: 1 | G19: 1 | H19: 1 | I19: 2 | J19: 2 | K19: 1 | L19: 1 | M19: 1 | N19: 1 | O19: 2 | P19: 1 | Q19: 2 | R19: 2 | S19: 2 | T19: 2 | U19: 2 | V19: 2 | W19: 0 | X19: 1 | Y19: 1 | Z19: 1 | AA19: 1 | AB19: 1 | AC19: 1 | AD19: 1 | AE19: 1 | AF19: 1 | AG19: 1 | AH19: 1 | AI19: 1 | AJ19: 1 | AK19: 1 | AL19: 1 | AM19: 2 | AN19: 2 | AO19: 2 | AP19: 2 | AQ19: 2 | AR19: =MAX(RC[-30], RC[-29]) -> 2 | AS19: =MAX(RC[-24], RC[-23]) -> 2 | AT19: =MAX(RC[-12], RC[-23]) -> 1 | AU19: =MAX(RC[-27], RC[-43]) -> 2 | AV19: =MAX(RC[-26], RC[-44]) -> 2 | AW19: =MAX(RC[-42], RC[-45]) -> 1 | AX19: =MAX(RC[-43]:RC[-37]) -> 2 | AY19: =RC[-39] -> 1
A20: 'Greece | B20: 'EU | C20: 'C18 | D20: 0 | E20: 1 | F20: 0 | G20: 0 | H20: 2 | I20: 0 | J20: 0 | K20: 0 | L20: 0 | M20: 0 | N20: 0 | O20: 0 | P20: 0 | Q20: 0 | R20: 2 | S20: 2 | T20: 0 | U20: 0 | V20: 2 | W20: 0 | X20: 0 | Y20: 0 | Z20: 0 | AA20: 1 | AB20: 0 | AC20: 0 | AD20: 0 | AE20: 0 | AF20: 0 | AG20: 0 | AH20: 0 | AI20: 0 | AJ20: 0 | AK20: 0 | AL20: 0 | AM20: 2 | AN20: 2 | AO20: 2 | AP20: 2 | AQ20: 2 | AR20: =MAX(RC[-30], RC[-29]) -> 0 | AS20: =MAX(RC[-24], RC[-23]) -> 2 | AT20: =MAX(RC[-12], RC[-23]) -> 0 | AU20: =MAX(RC[-27], RC[-43]) -> 0 | AV20: =MAX(RC[-26], RC[-44]) -> 2 | AW20: =MAX(RC[-42], RC[-45]) -> 0 | AX20: =MAX(RC[-43]:RC[-37]) -> 2 | AY20: =RC[-39] -> 0
A21: 'Iceland | B21: 'EFTA | C21: 'C19 | D21: 0 | E21: 2 | F21: 2 | G21: 2 | H21: 2 | I21: 2 | J21: 2 | K21: 2 | L21: 2 | M21: 2 | N21: 2 | O21: 2 | P21: 2 | Q21: 2 | R21: 2 | S21: 2 | T21: 2 | U21: 2 | V21: 2 | W21: 0 | X21: 2 | Y21: 2 | Z21: 2 | AA21: 2 | AB21: 2 | AC21: 2 | AD21: 2 | AE21: 2 | AF21: 2 | AG21: 2 | AH21: 2 | AI21: 2 | AJ21: 2 | AK21: 2 | AL21: 2 | AM21: 2 | AN21: 2 | AO21: 2 | AP21: 2 | AQ21: 2 | AR21: =MAX(RC[-30], RC[-29]) -> 2 | AS21: =MAX(RC[-24], RC[-23]) -> 2 | AT21: =MAX(RC[-12], RC[-23]) -> 2 | AU21: =MAX(RC[-27], RC[-43]) -> 2 | AV21: =MAX(RC[-26], RC[-44]) -> 2 | AW21: =MAX(RC[-42], RC[-45]) -> 2 | AX21: =MAX(RC[-43]:RC[-37]) -> 2 | AY21: =RC[-39] -> 2
A22: 'Italy | B22: 'EU | C22: 'C20 | D22: 0 | E22: 2 | F22: 2 | G22: 2 | H22: 2 | I22: 2 | J22: 2 | K22: 2 | L22: 2 | M22: 2 | N22: 2 | O22: 2 | P22: 2 | Q22: 2 | R22: 2 | S22: 2 | T22: 2 | U22: 2 | V22: 2 | W22: 0 | X22: 2 | Y22: 2 | Z22: 2 | AA22: 2 | AB22: 2 | AC22: 2 | AD22: 2 | AE22: 2 | AF22: 2 | AG22: 2 | AH22: 2 | AI22: 2 | AJ22: 2 | AK22: 2 | AL22: 2 | AM22: 2 | AN22: 2 | AO22: 2 | AP22: 2 | AQ22: 2 | AR22: =MAX(RC[-30], RC[-29]) -> 2 | AS22: =MAX(RC[-24], RC[-23]) -> 2 | AT22: =MAX(RC[-12], RC[-23]) -> 2 | AU22: =MAX(RC[-27], RC[-43]) -> 2 | AV22: =MAX(RC[-26], RC[-44]) -> 2 | AW22: =MAX(RC[-42], RC[-45]) -> 2 | AX22: =MAX(RC[-43]:RC[-37]) -> 2 | AY22: =RC[-39] -> 2
A23: 'Liechtenstein | B23: 'EFTA | C23: 'C21 | D23: 0 | E23: 2 | F23: 2 | G23: 2 | H23: 2 | I23: 2 | J23: 2 | K23: 2 | L23: 2 | M23: 2 | N23: 2 | O23: 2 | P23: 2 | Q23: 2 | R23: 2 | S23: 2 | T23: 2 | U23: 2 | V23: 2 | W23: 0 | X23: 2 | Y23: 2 | Z23: 2 | AA23: 2 | AB23: 2 | AC23: 2 | AD23: 2 | AE23: 2 | AF23: 2 | AG23: 2 | AH23: 2 | AI23: 2 | AJ23: 2 | AK23: 2 | AL23: 2 | AM23: 2 | AN23: 2 | AO23: 2 | AP23: 2 | AQ23: 2 | AR23: =MAX(RC[-30], RC[-29]) -> 2 | AS23: =MAX(RC[-24], RC[-23]) -> 2 | AT23: =MAX(RC[-12], RC[-23]) -> 2 | AU23: =MAX(RC[-27], RC[-43]) -> 2 | AV23: =MAX(RC[-26], RC[-44]) -> 2 | AW23: =MAX(RC[-42], RC[-45]) -> 2 | AX23: =MAX(RC[-43]:RC[-37]) -> 2 | AY23: =RC[-39] -> 2
A24: 'Luxembourg | B24: 'EU | C24: 'C22 | D24: 0 | E24: 0 | F24: 0 | G24: 0 | H24: 0 | I24: 0 | J24: 1 | K24: 1 | L24: 0 | M24: 0 | N24: 0 | O24: 0 | P24: 0 | Q24: 0 | R24: 0 | S24: 0 | T24: 1 | U24: 2 | V24: 2 | W24: 0 | X24: 1 | Y24: 1 | Z24: 1 | AA24: 1 | AB24: 1 | AC24: 1 | AD24: 1 | AE24: 1 | AF24: 1 | AG24: 1 | AH24: 1 | AI24: 1 | AJ24: 1 | AK24: 1 | AL24: 1 | AM24: 2 | AN24: 2 | AO24: 2 | AP24: 2 | AQ24: 2 | AR24: =MAX(RC[-30], RC[-29]) -> 0 | AS24: =MAX(RC[-24], RC[-23]) -> 2 | AT24: =MAX(RC[-12], RC[-23]) -> 1 | AU24: =MAX(RC[-27], RC[-43]) -> 1 | AV24: =MAX(RC[-26], RC[-44]) -> 2 | AW24: =MAX(RC[-42], RC[-45]) -> 0 | AX24: =MAX(RC[-43]:RC[-37]) -> 1 | AY24: =RC[-39] -> 0
A25: 'Netherlands | B25: 'EU | C25: 'C23 | D25: 0 | E25: 1 | F25: 1 | G25: 1 | H25: 1 | I25: 1 | J25: 2 | K25: 1 | L25: 2 | M25: 2 | N25: 2 | O25: 2 | P25: 2 | Q25: 2 | R25: 2 | S25: 2 | T25: 2 | U25: 1 | V25: 2 | W25: 0 | X25: 1 | Y25: 1 | Z25: 1 | AA25: 2 | AB25: 2 | AC25: 2 | AD25: 2 | AE25: 2 | AF25: 2 | AG25: 2 | AH25: 2 | AI25: 2 | AJ25: 2 | AK25: 2 | AL25: 2 | AM25: 2 | AN25: 2 | AO25: 2 | AP25: 2 | AQ25: 2 | AR25: =MAX(RC[-30], RC[-29]) -> 2 | AS25: =MAX(RC[-24], RC[-23]) -> 2 | AT25: =MAX(RC[-12], RC[-23]) -> 2 | AU25: =MAX(RC[-27], RC[-43]) -> 2 | AV25: =MAX(RC[-26], RC[-44]) -> 2 | AW25: =MAX(RC[-42], RC[-45]) -> 1 | AX25: =MAX(RC[-43]:RC[-37]) -> 2 | AY25: =RC[-39] -> 2
A26: 'Norway | B26: 'EFTA | C26: 'C24 | D26: 0 | E26: 0 | F26: 0 | G26: 0 | H26: 0 | I26: 2 | J26: 0 | K26: 0 | L26: 0 | M26: 2 | N26: 0 | O26: 0 | P26: 0 | Q26: 2 | R26: 0 | S26: 1 | T26: 2 | U26: 0 | V26: 0 | W26: 0 | X26: 0 | Y26: 0 | Z26: 0 | AA26: 0 | AB26: 0 | AC26: 0 | AD26: 0 | AE26: 0 | AF26: 0 | AG26: 0 | AH26: 0 | AI26: 0 | AJ26: 0 | AK26: 0 | AL26: 0 | AM26: 2 | AN26: 2 | AO26: 2 | AP26: 2 | AQ26: 2 | AR26: =MAX(RC[-30], RC[-29]) -> 0 | AS26: =MAX(RC[-24], RC[-23]) -> 0 | AT26: =MAX(RC[-12], RC[-23]) -> 0 | AU26: =MAX(RC[-27], RC[-43]) -> 2 | AV26: =MAX(RC[-26], RC[-44]) -> 0 | AW26: =MAX(RC[-42], RC[-45]) -> 0 | AX26: =MAX(RC[-43]:RC[-37]) -> 2 | AY26: =RC[-39] -> 0
A27: 'Portugal | B27: 'EU | C27: 'C25 | D27: 0 | E27: 1 | F27: 1 | G27: 1 | H27: 2 | I27: 2 | J27: 1 | K27: 1 | L27: 1 | M27: 2 | N27: 1 | O27: 1 | P27: 2 | Q27: 2 | R27: 1 | S27: 1 | T27: 1 | U27: 1 | V27: 2 | W27: 0 | X27: 1 | Y27: 1 | Z27: 1 | AA27: 1 | AB27: 1 | AC27: 1 | AD27: 1 | AE27: 1 | AF27: 1 | AG27: 1 | AH27: 1 | AI27: 1 | AJ27: 1 | AK27: 1 | AL27: 1 | AM27: 1 | AN27: 1 | AO27: 1 | AP27: 1 | AQ27: 1 | AR27: =MAX(RC[-30], RC[-29]) -> 1 | AS27: =MAX(RC[-24], RC[-23]) -> 2 | AT27: =MAX(RC[-12], RC[-23]) -> 1 | AU27: =MAX(RC[-27], RC[-43]) -> 1 | AV27: =MAX(RC[-26], RC[-44]) -> 2 | AW27: =MAX(RC[-42], RC[-45]) -> 1 | AX27: =MAX(RC[-43]:RC[-37]) -> 2 | AY27: =RC[-39] -> 1
A28: 'Spain | B28: 'EU | C28: 'C26 | D28: 0 | E28: 1 | F28: 1 | G28: 1 | H28: 1 | I28: 2 | J28: 1 | K28: 1 | L28: 1 | M28: 1 | N28: 1 | O28: 1 | P28: 2 | Q28: 2 | R28: 2 | S28: 2 | T28: 1 | U28: 1 | V28: 1 | W28: 0 | X28: 1 | Y28: 1 | Z28: 1 | AA28: 1 | AB28: 1 | AC28: 1 | AD28: 1 | AE28: 1 | AF28: 1 | AG28: 1 | AH28: 1 | AI28: 1 | AJ28: 1 | AK28: 1 | AL28: 1 | AM28: 2 | AN28: 2 | AO28: 2 | AP28: 2 | AQ28: 2 | AR28: =MAX(RC[-30], RC[-29]) -> 1 | AS28: =MAX(RC[-24], RC[-23]) -> 1 | AT28: =MAX(RC[-12], RC[-23]) -> 1 | AU28: =MAX(RC[-27], RC[-43]) -> 1 | AV28: =MAX(RC[-26], RC[-44]) -> 1 | AW28: =MAX(RC[-42], RC[-45]) -> 1 | AX28: =MAX(RC[-43]:RC[-37]) -> 2 | AY28: =RC[-39] -> 1
A29: 'Sweden | B29: 'EU | C29: 'C27 | D29: 0 | E29: 0 | F29: 0 | G29: 0 | H29: 0 | I29: 2 | J29: 0 | K29: 0 | L29: 0 | M29: 0 | N29: 0 | O29: 0 | P29: 2 | Q29: 2 | R29: 0 | S29: 2 | T29: 0 | U29: 0 | V29: 2 | W29: 0 | X29: 0 | Y29: 0 | Z29: 0 | AA29: 0 | AB29: 0 | AC29: 0 | AD29: 0 | AE29: 0 | AF29: 0 | AG29: 0 | AH29: 0 | AI29: 1 | AJ29: 1 | AK29: 1 | AL29: 0 | AM29: 2 | AN29: 2 | AO29: 2 | AP29: 2 | AQ29: 2 | AR29: =MAX(RC[-30], RC[-29]) -> 0 | AS29: =MAX(RC[-24], RC[-23]) -> 2 | AT29: =MAX(RC[-12], RC[-23]) -> 0 | AU29: =MAX(RC[-27], RC[-43]) -> 0 | AV29: =MAX(RC[-26], RC[-44]) -> 2 | AW29: =MAX(RC[-42], RC[-45]) -> 0 | AX29: =MAX(RC[-43]:RC[-37]) -> 2 | AY29: =RC[-39] -> 0
A30: 'Switzerland | B30: 'EFTA | C30: 'C28 | D30: 0 | E30: 2 | F30: 2 | G30: 2 | H30: 2 | I30: 2 | J30: 2 | K30: 2 | L30: 2 | M30: 2 | N30: 2 | O30: 2 | P30: 2 | Q30: 2 | R30: 2 | S30: 2 | T30: 2 | U30: 2 | V30: 2 | W30: 0 | X30: 2 | Y30: 2 | Z30: 2 | AA30: 2 | AB30: 2 | AC30: 2 | AD30: 2 | AE30: 2 | AF30: 2 | AG30: 2 | AH30: 2 | AI30: 2 | AJ30: 2 | AK30: 2 | AL30: 2 | AM30: 2 | AN30: 2 | AO30: 2 | AP30: 2 | AQ30: 2 | AR30: =MAX(RC[-30], RC[-29]) -> 2 | AS30: =MAX(RC[-24], RC[-23]) -> 2 | AT30: =MAX(RC[-12], RC[-23]) -> 2 | AU30: =MAX(RC[-27], RC[-43]) -> 2 | AV30: =MAX(RC[-26], RC[-44]) -> 2 | AW30: =MAX(RC[-42], RC[-45]) -> 2 | AX30: =MAX(RC[-43]:RC[-37]) -> 2 | AY30: =RC[-39] -> 2
A31: 'UK | B31: 'EU | C31: 'C29 | D31: 0 | E31: 0 | F31: 0 | G31: 0 | H31: 0 | I31: 2 | J31: 0 | K31: 1 | L31: 1 | M31: 2 | N31: 1 | O31: 1 | P31: 2 | Q31: 2 | R31: 0 | S31: 0 | T31: 1 | U31: 0 | V31: 0 | W31: 0 | X31: 0 | Y31: 0 | Z31: 0 | AA31: 0 | AB31: 0 | AC31: 0 | AD31: 0 | AE31: 0 | AF31: 0 | AG31: 0 | AH31: 0 | AI31: 0 | AJ31: 0 | AK31: 0 | AL31: 0 | AM31: 2 | AN31: 2 | AO31: 2 | AP31: 2 | AQ31: 2 | AR31: =MAX(RC[-30], RC[-29]) -> 1 | AS31: =MAX(RC[-24], RC[-23]) -> 0 | AT31: =MAX(RC[-12], RC[-23]) -> 0 | AU31: =MAX(RC[-27], RC[-43]) -> 1 | AV31: =MAX(RC[-26], RC[-44]) -> 0 | AW31: =MAX(RC[-42], RC[-45]) -> 0 | AX31: =MAX(RC[-43]:RC[-37]) -> 2 | AY31: =RC[-39] -> 1
A32: 'Germany | B32: 'EU | C32: 'C31 | D32: 0 | E32: 0 | F32: 0 | G32: 0 | H32: 2 | I32: 0 | J32: 0 | K32: 0 | L32: 0 | M32: 2 | N32: 0 | O32: 0 | P32: 2 | Q32: 2 | R32: 2 | S32: 2 | T32: 0 | U32: 0 | V32: 2 | W32: 0 | X32: 0 | Y32: 0 | Z32: 0 | AA32: 0 | AB32: 0 | AC32: 0 | AD32: 0 | AE32: 0 | AF32: 0 | AG32: 0 | AH32: 0 | AI32: 1 | AJ32: 1 | AK32: 1 | AL32: 0 | AM32: 0 | AN32: 0 | AO32: 0 | AP32: 0 | AQ32: 1 | AR32: =MAX(RC[-30], RC[-29]) -> 0 | AS32: =MAX(RC[-24], RC[-23]) -> 2 | AT32: =MAX(RC[-12], RC[-23]) -> 0 | AU32: =MAX(RC[-27], RC[-43]) -> 0 | AV32: =MAX(RC[-26], RC[-44]) -> 2 | AW32: =MAX(RC[-42], RC[-45]) -> 0 | AX32: =MAX(RC[-43]:RC[-37]) -> 2 | AY32: =RC[-39] -> 0
A33: 'USA | B33: 'World - A | C33: 'C50 | D33: 0 | E33: 1 | F33: 2 | G33: 1 | H33: 2 | I33: 1 | J33: 2 | K33: 1 | L33: 1 | M33: 1 | N33: 1 | O33: 1 | P33: 2 | Q33: 2 | R33: 2 | S33: 1 | T33: 2 | U33: 1 | V33: 1 | W33: 0 | X33: 1 | Y33: 1 | Z33: 1 | AA33: 1 | AB33: 1 | AC33: 1 | AD33: 1 | AE33: 1 | AF33: 1 | AG33: 1 | AH33: 1 | AI33: 1 | AJ33: 1 | AK33: 1 | AL33: 1 | AM33: 2 | AN33: 2 | AO33: 2 | AP33: 2 | AQ33: 2 | AR33: =MAX(RC[-30], RC[-29]) -> 1 | AS33: =MAX(RC[-24], RC[-23]) -> 1 | AT33: =MAX(RC[-12], RC[-23]) -> 1 | AU33: =MAX(RC[-27], RC[-43]) -> 2 | AV33: =MAX(RC[-26], RC[-44]) -> 1 | AW33: =MAX(RC[-42], RC[-45]) -> 1 | AX33: =MAX(RC[-43]:RC[-37]) -> 2 | AY33: =RC[-39] -> 1
A34: 'Turkey | B34: 'World - B | C34: 'C42 | D34: 0 | E34: 2 | F34: 2 | G34: 2 | H34: 2 | I34: 2 | J34: 2 | K34: 2 | L34: 2 | M34: 2 | N34: 2 | O34: 2 | P34: 2 | Q34: 2 | R34: 2 | S34: 2 | T34: 2 | U34: 2 | V34: 2 | W34: 0 | X34: 2 | Y34: 2 | Z34: 2 | AA34: 2 | AB34: 2 | AC34: 2 | AD34: 2 | AE34: 2 | AF34: 2 | AG34: 2 | AH34: 2 | AI34: 2 | AJ34: 2 | AK34: 2 | AL34: 2 | AM34: 2 | AN34: 2 | AO34: 2 | AP34: 2 | AQ34: 2 | AR34: =MAX(RC[-30], RC[-29]) -> 2 | AS34: =MAX(RC[-24], RC[-23]) -> 2 | AT34: =MAX(RC[-12], RC[-23]) -> 2 | AU34: =MAX(RC[-27], RC[-43]) -> 2 | AV34: =MAX(RC[-26], RC[-44]) -> 2 | AW34: =MAX(RC[-42], RC[-45]) -> 2 | AX34: =MAX(RC[-43]:RC[-37]) -> 2 | AY34: =RC[-39] -> 2
A35: 'Australia | B35: 'World - A | C35: 'C70 | D35: 0 | E35: 2 | F35: 2 | G35: 2 | H35: 2 | I35: 2 | J35: 2 | K35: 2 | L35: 2 | M35: 2 | N35: 2 | O35: 2 | P35: 2 | Q35: 2 | R35: 2 | S35: 2 | T35: 2 | U35: 2 | V35: 2 | W35: 0 | X35: 2 | Y35: 2 | Z35: 2 | AA35: 2 | AB35: 2 | AC35: 2 | AD35: 2 | AE35: 2 | AF35: 2 | AG35: 2 | AH35: 2 | AI35: 2 | AJ35: 2 | AK35: 2 | AL35: 2 | AM35: 2 | AN35: 2 | AO35: 2 | AP35: 2 | AQ35: 2 | AR35: =MAX(RC[-30], RC[-29]) -> 2 | AS35: =MAX(RC[-24], RC[-23]) -> 2 | AT35: =MAX(RC[-12], RC[-23]) -> 2 | AU35: =MAX(RC[-27], RC[-43]) -> 2 | AV35: =MAX(RC[-26], RC[-44]) -> 2 | AW35: =MAX(RC[-42], RC[-45]) -> 2 | AX35: =MAX(RC[-43]:RC[-37]) -> 2 | AY35: =RC[-39] -> 2
A36: 'Japan | B36: 'World - A | C36: 'C41 | D36: 0 | E36: 0 | F36: 0 | G36: 0 | H36: 2 | I36: 2 | J36: 2 | K36: 2 | L36: 2 | M36: 2 | N36: 0 | O36: 2 | P36: 2 | Q36: 2 | R36: 2 | S36: 2 | T36: 2 | U36: 0 | V36: 2 | W36: 0 | X36: 0 | Y36: 0 | Z36: 0 | AA36: 1 | AB36: 0 | AC36: 1 | AD36: 1 | AE36: 1 | AF36: 1 | AG36: 1 | AH36: 0 | AI36: 1 | AJ36: 1 | AK36: 1 | AL36: 1 | AM36: 2 | AN36: 2 | AO36: 2 | AP36: 2 | AQ36: 2 | AR36: =MAX(RC[-30], RC[-29]) -> 2 | AS36: =MAX(RC[-24], RC[-23]) -> 2 | AT36: =MAX(RC[-12], RC[-23]) -> 0 | AU36: =MAX(RC[-27], RC[-43]) -> 2 | AV36: =MAX(RC[-26], RC[-44]) -> 2 | AW36: =MAX(RC[-42], RC[-45]) -> 0 | AX36: =MAX(RC[-43]:RC[-37]) -> 2 | AY36: =RC[-39] -> 2
A37: 'Korea | B37: 'World - A | C37: 'C40 | D37: 0 | E37: 2 | F37: 2 | G37: 2 | H37: 2 | I37: 2 | J37: 2 | K37: 2 | L37: 2 | M37: 2 | N37: 2 | O37: 2 | P37: 2 | Q37: 2 | R37: 2 | S37: 2 | T37: 2 | U37: 2 | V37: 2 | W37: 0 | X37: 2 | Y37: 2 | Z37: 2 | AA37: 2 | AB37: 2 | AC37: 2 | AD37: 2 | AE37: 2 | AF37: 2 | AG37: 2 | AH37: 2 | AI37: 2 | AJ37: 2 | AK37: 2 | AL37: 2 | AM37: 2 | AN37: 2 | AO37: 2 | AP37: 2 | AQ37: 2 | AR37: =MAX(RC[-30], RC[-29]) -> 2 | AS37: =MAX(RC[-24], RC[-23]) -> 2 | AT37: =MAX(RC[-12], RC[-23]) -> 2 | AU37: =MAX(RC[-27], RC[-43]) -> 2 | AV37: =MAX(RC[-26], RC[-44]) -> 2 | AW37: =MAX(RC[-42], RC[-45]) -> 2 | AX37: =MAX(RC[-43]:RC[-37]) -> 2 | AY37: =RC[-39] -> 2
A38: 'Canada | B38: 'World - A | C38: 'C51 | D38: 0 | E38: 1 | F38: 1 | G38: 1 | H38: 2 | I38: 1 | J38: 2 | K38: 2 | L38: 2 | M38: 2 | N38: 2 | O38: 2 | P38: 2 | Q38: 2 | R38: 2 | S38: 2 | T38: 2 | U38: 2 | V38: 1 | W38: 0 | X38: 1 | Y38: 1 | Z38: 1 | AA38: 1 | AB38: 1 | AC38: 1 | AD38: 1 | AE38: 1 | AF38: 1 | AG38: 1 | AH38: 1 | AI38: 1 | AJ38: 1 | AK38: 1 | AL38: 1 | AM38: 1 | AN38: 1 | AO38: 1 | AP38: 1 | AQ38: 1 | AR38: =MAX(RC[-30], RC[-29]) -> 2 | AS38: =MAX(RC[-24], RC[-23]) -> 2 | AT38: =MAX(RC[-12], RC[-23]) -> 1 | AU38: =MAX(RC[-27], RC[-43]) -> 2 | AV38: =MAX(RC[-26], RC[-44]) -> 1 | AW38: =MAX(RC[-42], RC[-45]) -> 1 | AX38: =MAX(RC[-43]:RC[-37]) -> 2 | AY38: =RC[-39] -> 2
A39: 'New Zealand | B39: 'World - A | C39: 'C71 | D39: 0 | E39: 2 | F39: 2 | G39: 2 | H39: 2 | I39: 2 | J39: 2 | K39: 2 | L39: 2 | M39: 2 | N39: 2 | O39: 2 | P39: 2 | Q39: 2 | R39: 2 | S39: 2 | T39: 2 | U39: 2 | V39: 2 | W39: 0 | X39: 2 | Y39: 2 | Z39: 2 | AA39: 2 | AB39: 2 | AC39: 2 | AD39: 2 | AE39: 2 | AF39: 2 | AG39: 2 | AH39: 2 | AI39: 2 | AJ39: 2 | AK39: 2 | AL39: 2 | AM39: 2 | AN39: 2 | AO39: 2 | AP39: 2 | AQ39: 2 | AR39: =MAX(RC[-30], RC[-29]) -> 2 | AS39: =MAX(RC[-24], RC[-23]) -> 2 | AT39: =MAX(RC[-12], RC[-23]) -> 2 | AU39: =MAX(RC[-27], RC[-43]) -> 2 | AV39: =MAX(RC[-26], RC[-44]) -> 2 | AW39: =MAX(RC[-42], RC[-45]) -> 2 | AX39: =MAX(RC[-43]:RC[-37]) -> 2 | AY39: =RC[-39] -> 2
A40: 'Mexico | B40: 'World - B | C40: 'C72 | D40: 0 | E40: 2 | F40: 2 | G40: 2 | H40: 2 | I40: 2 | J40: 2 | K40: 2 | L40: 2 | M40: 2 | N40: 2 | O40: 2 | P40: 2 | Q40: 2 | R40: 2 | S40: 2 | T40: 2 | U40: 2 | V40: 2 | W40: 0 | X40: 2 | Y40: 2 | Z40: 2 | AA40: 2 | AB40: 2 | AC40: 2 | AD40: 2 | AE40: 2 | AF40: 2 | AG40: 2 | AH40: 2 | AI40: 2 | AJ40: 2 | AK40: 2 | AL40: 2 | AM40: 2 | AN40: 2 | AO40: 2 | AP40: 2 | AQ40: 2 | AR40: =MAX(RC[-30], RC[-29]) -> 2 | AS40: =MAX(RC[-24], RC[-23]) -> 2 | AT40: =MAX(RC[-12], RC[-23]) -> 2 | AU40: =MAX(RC[-27], RC[-43]) -> 2 | AV40: =MAX(RC[-26], RC[-44]) -> 2 | AW40: =MAX(RC[-42], RC[-45]) -> 2 | AX40: =MAX(RC[-43]:RC[-37]) -> 2 | AY40: =RC[-39] -> 2
A41: 'CEE - Total | B41: 'Totals | D41: 0 | E41: 0 | F41: 0 | G41: 0 | H41: 0 | I41: 0 | J41: 0 | K41: 0 | L41: 0 | M41: 0 | N41: 0 | O41: 0 | P41: 0 | Q41: 0 | R41: 0 | S41: 0 | T41: 0 | U41: 0 | V41: 0 | W41: 0 | X41: 0 | Y41: 0 | Z41: 0 | AA41: 0 | AB41: 0 | AC41: 0 | AD41: 0 | AE41: 0 | AF41: 0 | AG41: 0 | AH41: 0 | AI41: 0 | AJ41: 0 | AK41: 0 | AL41: 0 | AM41: 0 | AN41: 0 | AO41: 0 | AP41: 0 | AQ41: 0 | AR41: 0 | AS41: =MAX(RC[-24], RC[-23]) -> 0 | AT41: =MAX(RC[-12], RC[-23]) -> 0 | AU41: =MAX(RC[-27], RC[-43]) -> 0 | AV41: =MAX(RC[-26], RC[-44]) -> 0 | AW41: =MAX(RC[-42], RC[-45]) -> 0 | AX41: =MAX(RC[-43]:RC[-37]) -> 0 | AY41: =RC[-39] -> 0
A42: 'EU - Total | B42: 'Totals | D42: 0 | E42: 0 | F42: 0 | G42: 0 | H42: 0 | I42: 0 | J42: 0 | K42: 0 | L42: 0 | M42: 0 | N42: 0 | O42: 0 | P42: 0 | Q42: 0 | R42: 0 | S42: 0 | T42: 0 | U42: 0 | V42: 0 | W42: 0 | X42: 0 | Y42: 0 | Z42: 0 | AA42: 0 | AB42: 0 | AC42: 0 | AD42: 0 | AE42: 0 | AF42: 0 | AG42: 0 | AH42: 0 | AI42: 0 | AJ42: 0 | AK42: 0 | AL42: 0 | AM42: 0 | AN42: 0 | AO42: 0 | AP42: 0 | AQ42: 0 | AR42: 0 | AS42: =MAX(RC[-24], RC[-23]) -> 0 | AT42: =MAX(RC[-12], RC[-23]) -> 0 | AU42: =MAX(RC[-27], RC[-43]) -> 0 | AV42: =MAX(RC[-26], RC[-44]) -> 0 | AW42: =MAX(RC[-42], RC[-45]) -> 0 | AX42: =MAX(RC[-43]:RC[-37]) -> 0 | AY42: =RC[-39] -> 0
A43: 'EFTA - Total | B43: 'Totals | D43: 0 | E43: 0 | F43: 0 | G43: 0 | H43: 0 | I43: 0 | J43: 0 | K43: 0 | L43: 0 | M43: 0 | N43: 0 | O43: 0 | P43: 0 | Q43: 0 | R43: 0 | S43: 0 | T43: 0 | U43: 0 | V43: 0 | W43: 0 | X43: 0 | Y43: 0 | Z43: 0 | AA43: 0 | AB43: 0 | AC43: 0 | AD43: 0 | AE43: 0 | AF43: 0 | AG43: 0 | AH43: 0 | AI43: 0 | AJ43: 0 | AK43: 0 | AL43: 0 | AM43: 0 | AN43: 0 | AO43: 0 | AP43: 0 | AQ43: 0 | AR43: 0 | AS43: =MAX(RC[-24], RC[-23]) -> 0 | AT43: =MAX(RC[-12], RC[-23]) -> 0 | AU43: =MAX(RC[-27], RC[-43]) -> 0 | AV43: =MAX(RC[-26], RC[-44]) -> 0 | AW43: =MAX(RC[-42], RC[-45]) -> 0 | AX43: =MAX(RC[-43]:RC[-37]) -> 0 | AY43: =RC[-39] -> 0
A44: 'World A - Total | B44: 'Totals | D44: 0 | E44: 0 | F44: 0 | G44: 0 | H44: 0 | I44: 0 | J44: 0 | K44: 0 | L44: 0 | M44: 0 | N44: 0 | O44: 0 | P44: 0 | Q44: 0 | R44: 0 | S44: 0 | T44: 0 | U44: 0 | V44: 0 | W44: 0 | X44: 0 | Y44: 0 | Z44: 0 | AA44: 0 | AB44: 0 | AC44: 0 | AD44: 0 | AE44: 0 | AF44: 0 | AG44: 0 | AH44: 0 | AI44: 0 | AJ44: 0 | AK44: 0 | AL44: 0 | AM44: 0 | AN44: 0 | AO44: 0 | AP44: 0 | AQ44: 0 | AR44: 0 | AS44: =MAX(RC[-24], RC[-23]) -> 0 | AT44: =MAX(RC[-12], RC[-23]) -> 0 | AU44: =MAX(RC[-27], RC[-43]) -> 0 | AV44: =MAX(RC[-26], RC[-44]) -> 0 | AW44: =MAX(RC[-42], RC[-45]) -> 0 | AX44: =MAX(RC[-43]:RC[-37]) -> 0 | AY44: =RC[-39] -> 0
A45: 'World B - Total | B45: 'Totals | D45: 0 | E45: 0 | F45: 0 | G45: 0 | H45: 0 | I45: 0 | J45: 0 | K45: 0 | L45: 0 | M45: 0 | N45: 0 | O45: 0 | P45: 0 | Q45: 0 | R45: 0 | S45: 0 | T45: 0 | U45: 0 | V45: 0 | W45: 0 | X45: 0 | Y45: 0 | Z45: 0 | AA45: 0 | AB45: 0 | AC45: 0 | AD45: 0 | AE45: 0 | AF45: 0 | AG45: 0 | AH45: 0 | AI45: 0 | AJ45: 0 | AK45: 0 | AL45: 0 | AM45: 0 | AN45: 0 | AO45: 0 | AP45: 0 | AQ45: 0 | AR45: 0 | AS45: =MAX(RC[-24], RC[-23]) -> 0 | AT45: =MAX(RC[-12], RC[-23]) -> 0 | AU45: =MAX(RC[-27], RC[-43]) -> 0 | AV45: =MAX(RC[-26], RC[-44]) -> 0 | AW45: =MAX(RC[-42], RC[-45]) -> 0 | AX45: =MAX(RC[-43]:RC[-37]) -> 0 | AY45: =RC[-39] -> 0
E46: 0 | F46: 0 | G46: 0 | H46: 0 | I46: 0 | J46: 0 | K46: 0 | L46: 0 | M46: 0 | N46: 0 | O46: 0 | P46: 0 | Q46: 0 | R46: 0 | S46: 0 | T46: 0 | U46: 0 | V46: 0 | W46: 0 | X46: 0 | Y46: 0 | Z46: 0 | AA46: 0 | AB46: 0 | AC46: 0 | AD46: 0 | AE46: 0 | AF46: 0 | AG46: 0 | AH46: 0 | AI46: 0 | AJ46: 0 | AK46: 0 | AL46: 0 | AM46: 0 | AN46: 0 | AO46: 0 | AP46: 0 | AQ46: 0
E47: 0 | F47: 0 | G47: 0 | H47: 0 | I47: 1 | J47: 1 | K47: 0 | L47: 0 | M47: 1 | N47: 0 | O47: 0 | P47: 1 | Q47: 1 | R47: 1 | S47: 2 | T47: 0 | U47: 0 | V47: 0 | W47: 1 | X47: 0 | Y47: 1 | Z47: 1 | AA47: 0 | AB47: 0 | AC47: 0 | AD47: 0 | AE47: 0 | AF47: 0 | AG47: 0 | AH47: 0 | AI47: 0 | AJ47: 0 | AK47: 0 | AL47: 0 | AM47: 2 | AN47: 2 | AO47: 2 | AP47: 2 | AQ47: 2
E48: 0 | F48: 0 | G48: 0 | H48: 0 | I48: 1 | J48: 1 | K48: 1 | L48: 1 | M48: 1 | N48: 0 | O48: 1 | P48: 1 | Q48: 1 | R48: 1 | S48: 2 | T48: 0 | U48: 0 | V48: 1 | W48: 1 | X48: 0 | Y48: 0 | Z48: 0 | AA48: 2 | AB48: 0 | AC48: 2 | AD48: 2 | AE48: 2 | AF48: 2 | AG48: 2 | AH48: 2 | AI48: 2 | AJ48: 2 | AK48: 2 | AL48: 2 | AM48: 2 | AN48: 2 | AO48: 2 | AP48: 2 | AQ48: 2
E49: 0 | F49: 0 | G49: 0 | H49: 0 | I49: 0 | J49: 0 | K49: 0 | L49: 0 | M49: 0 | N49: 0 | O49: 0 | P49: 0 | Q49: 0 | R49: 0 | S49: 0 | T49: 0 | U49: 0 | V49: 0 | W49: 1 | X49: 0 | Y49: 0 | Z49: 0 | AA49: 0 | AB49: 0 | AC49: 0 | AD49: 0 | AE49: 0 | AF49: 0 | AG49: 0 | AH49: 0 | AI49: 0 | AJ49: 0 | AK49: 0 | AL49: 0 | AM49: 0 | AN49: 0 | AO49: 0 | AP49: 0 | AQ49: 0
E50: 0 | F50: 0 | G50: 0 | H50: 0 | I50: 1 | J50: 1 | K50: 1 | L50: 0 | M50: 0 | N50: 1 | O50: 1 | P50: 1 | Q50: 1 | R50: 1 | S50: 2 | T50: 0 | U50: 0 | V50: 0 | W50: 1 | X50: 0 | Y50: 0 | Z50: 0 | AA50: 0 | AB50: 0 | AC50: 1 | AD50: 1 | AE50: 1 | AF50: 1 | AG50: 1 | AH50: 1 | AI50: 0 | AJ50: 0 | AK50: 0 | AL50: 0 | AM50: 2 | AN50: 2 | AO50: 2 | AP50: 2 | AQ50: 2
E51: 0 | F51: 0 | G51: 0 | H51: 1 | I51: 1 | J51: 1 | K51: 1 | L51: 1 | M51: 1 | N51: 0 | O51: 1 | P51: 1 | Q51: 1 | R51: 1 | S51: 2 | T51: 0 | U51: 0 | V51: 1 | W51: 1 | X51: 0 | Y51: 0 | Z51: 0 | AA51: 0 | AB51: 0 | AC51: 0 | AD51: 0 | AE51: 0 | AF51: 0 | AG51: 1 | AH51: 1 | AI51: 1 | AJ51: 1 | AK51: 1 | AL51: 1 | AM51: 1 | AN51: 1 | AO51: 1 | AP51: 1 | AQ51: 1
E52: 0 | F52: 0 | G52: 0 | H52: 0 | I52: 0 | J52: 0 | K52: 0 | L52: 0 | M52: 0 | N52: 0 | O52: 0 | P52: 0 | Q52: 0 | R52: 1 | S52: 2 | T52: 0 | U52: 0 | V52: 0 | W52: 1 | X52: 0 | Y52: 0 | Z52: 0 | AA52: 0 | AB52: 0 | AC52: 0 | AD52: 0 | AE52: 0 | AF52: 0 | AG52: 0 | AH52: 0 | AI52: 0 | AJ52: 0 | AK52: 0 | AL52: 0 | AM52: 2 | AN52: 2 | AO52: 2 | AP52: 2 | AQ52: 2
E53: 1 | F53: 1 | G53: 1 | H53: 1 | I53: 1 | J53: 1 | K53: 1 | L53: 1 | M53: 1 | N53: 1 | O53: 1 | P53: 1 | Q53: 1 | R53: 1 | S53: 2 | T53: 1 | U53: 1 | V53: 1 | W53: 1 | X53: 1 | Y53: 1 | Z53: 1 | AA53: 1 | AB53: 1 | AC53: 1 | AD53: 1 | AE53: 1 | AF53: 1 | AG53: 1 | AH53: 1 | AI53: 1 | AJ53: 1 | AK53: 1 | AL53: 1 | AM53: 1 | AN53: 1 | AO53: 1 | AP53: 1 | AQ53: 1
E54: 2 | F54: 2 | G54: 2 | H54: 2 | I54: 2 | J54: 2 | K54: 2 | L54: 2 | M54: 2 | N54: 2 | O54: 2 | P54: 2 | Q54: 2 | R54: 2 | S54: 2 | T54: 2 | U54: 2 | V54: 2 | W54: 2 | X54: 2 | Y54: 2 | Z54: 2 | AA54: 2 | AB54: 2 | AC54: 2 | AD54: 2 | AE54: 2 | AF54: 2 | AG54: 2 | AH54: 2 | AI54: 2 | AJ54: 2 | AK54: 2 | AL54: 2 | AM54: 2 | AN54: 2 | AO54: 2 | AP54: 2 | AQ54: 2
E55: 0 | F55: 0 | G55: 0 | H55: 0 | I55: 0 | J55: 1 | K55: 1 | L55: 1 | M55: 1 | N55: 0 | O55: 0 | P55: 1 | Q55: 1 | R55: 0 | S55: 2 | T55: 0 | U55: 0 | V55: 0 | W55: 1 | X55: 0 | Y55: 0 | Z55: 0 | AA55: 0 | AB55: 0 | AC55: 0 | AD55: 0 | AE55: 0 | AF55: 0 | AG55: 0 | AH55: 0 | AI55: 0 | AJ55: 0 | AK55: 0 | AL55: 0 | AM55: 2 | AN55: 2 | AO55: 2 | AP55: 2 | AQ55: 2
E56: 0 | F56: 0 | G56: 0 | H56: 0 | I56: 1 | J56: 1 | K56: 1 | L56: 1 | M56: 1 | N56: 0 | O56: 0 | P56: 1 | Q56: 1 | R56: 1 | S56: 2 | T56: 0 | U56: 0 | V56: 0 | W56: 1 | X56: 0 | Y56: 0 | Z56: 0 | AA56: 1 | AB56: 0 | AC56: 1 | AD56: 1 | AE56: 1 | AF56: 1 | AG56: 1 | AH56: 1 | AI56: 1 | AJ56: 1 | AK56: 1 | AL56: 0 | AM56: 2 | AN56: 2 | AO56: 2 | AP56: 2 | AQ56: 2
E57: 1 | F57: 1 | G57: 1 | H57: 1 | I57: 1 | J57: 1 | K57: 1 | L57: 1 | M57: 1 | N57: 1 | O57: 1 | P57: 1 | Q57: 1 | R57: 1 | S57: 2 | T57: 1 | U57: 1 | V57: 1 | W57: 1 | X57: 1 | Y57: 1 | Z57: 1 | AA57: 2 | AB57: 2 | AC57: 2 | AD57: 2 | AE57: 2 | AF57: 2 | AG57: 2 | AH57: 2 | AI57: 2 | AJ57: 2 | AK57: 2 | AL57: 2 | AM57: 2 | AN57: 2 | AO57: 2 | AP57: 2 | AQ57: 2
E58: 1 | F58: 1 | G58: 1 | H58: 1 | I58: 1 | J58: 1 | K58: 1 | L58: 1 | M58: 1 | N58: 1 | O58: 1 | P58: 1 | Q58: 1 | R58: 1 | S58: 2 | T58: 1 | U58: 1 | V58: 1 | W58: 1 | X58: 1 | Y58: 1 | Z58: 1 | AA58: 1 | AB58: 1 | AC58: 1 | AD58: 1 | AE58: 1 | AF58: 1 | AG58: 1 | AH58: 1 | AI58: 1 | AJ58: 1 | AK58: 1 | AL58: 1 | AM58: 1 | AN58: 1 | AO58: 1 | AP58: 1 | AQ58: 1
E59: 0 | F59: 0 | G59: 0 | H59: 1 | I59: 0 | J59: 0 | K59: 0 | L59: 0 | M59: 0 | N59: 0 | O59: 0 | P59: 1 | Q59: 1 | R59: 0 | S59: 2 | T59: 1 | U59: 0 | V59: 1 | W59: 1 | X59: 0 | Y59: 0 | Z59: 0 | AA59: 0 | AB59: 0 | AC59: 0 | AD59: 0 | AE59: 0 | AF59: 0 | AG59: 0 | AH59: 0 | AI59: 0 | AJ59: 0 | AK59: 0 | AL59: 0 | AM59: 0 | AN59: 0 | AO59: 0 | AP59: 0 | AQ59: 0
E60: 1 | F60: 1 | G60: 1 | H60: 1 | I60: 1 | J60: 1 | K60: 1 | L60: 1 | M60: 1 | N60: 1 | O60: 1 | P60: 1 | Q60: 1 | R60: 1 | S60: 2 | T60: 1 | U60: 1 | V60: 1 | W60: 1 | X60: 1 | Y60: 1 | Z60: 1 | AA60: 1 | AB60: 1 | AC60: 1 | AD60: 1 | AE60: 1 | AF60: 1 | AG60: 1 | AH60: 1 | AI60: 1 | AJ60: 1 | AK60: 1 | AL60: 1 | AM60: 2 | AN60: 2 | AO60: 2 | AP60: 2 | AQ60: 2
E61: 0 | F61: 0 | G61: 0 | H61: 0 | I61: 1 | J61: 0 | K61: 0 | L61: 0 | M61: 1 | N61: 0 | O61: 0 | P61: 1 | Q61: 1 | R61: 1 | S61: 2 | T61: 1 | U61: 0 | V61: 0 | W61: 1 | X61: 0 | Y61: 0 | Z61: 0 | AA61: 0 | AB61: 0 | AC61: 0 | AD61: 0 | AE61: 0 | AF61: 0 | AG61: 0 | AH61: 0 | AI61: 0 | AJ61: 0 | AK61: 0 | AL61: 0 | AM61: 2 | AN61: 2 | AO61: 2 | AP61: 2 | AQ61: 2
E62: 1 | F62: 1 | G62: 1 | H62: 1 | I62: 1 | J62: 1 | K62: 1 | L62: 1 | M62: 1 | N62: 1 | O62: 1 | P62: 1 | Q62: 1 | R62: 1 | S62: 2 | T62: 1 | U62: 1 | V62: 1 | W62: 1 | X62: 1 | Y62: 1 | Z62: 1 | AA62: 1 | AB62: 1 | AC62: 1 | AD62: 1 | AE62: 1 | AF62: 1 | AG62: 1 | AH62: 1 | AI62: 1 | AJ62: 1 | AK62: 1 | AL62: 1 | AM62: 2 | AN62: 2 | AO62: 2 | AP62: 2 | AQ62: 2
E63: 2 | F63: 2 | G63: 2 | H63: 2 | I63: 2 | J63: 2 | K63: 2 | L63: 2 | M63: 2 | N63: 2 | O63: 2 | P63: 2 | Q63: 2 | R63: 2 | S63: 2 | T63: 2 | U63: 2 | V63: 2 | W63: 2 | X63: 2 | Y63: 2 | Z63: 2 | AA63: 2 | AB63: 0 | AC63: 0 | AD63: 0 | AE63: 0 | AF63: 2 | AG63: 2 | AH63: 1 | AI63: 1 | AJ63: 1 | AK63: 1 | AL63: 1 | AM63: 2 | AN63: 2 | AO63: 2 | AP63: 2 | AQ63: 2
E64: 2 | F64: 2 | G64: 2 | H64: 2 | I64: 2 | J64: 2 | K64: 2 | L64: 2 | M64: 2 | N64: 2 | O64: 2 | P64: 2 | Q64: 2 | R64: 2 | S64: 2 | T64: 2 | U64: 2 | V64: 2 | W64: 2 | X64: 2 | Y64: 2 | Z64: 2 | AA64: 2 | AB64: 2 | AC64: 2 | AD64: 2 | AE64: 2 | AF64: 2 | AG64: 2 | AH64: 2 | AI64: 2 | AJ64: 2 | AK64: 2 | AL64: 2 | AM64: 2 | AN64: 2 | AO64: 2 | AP64: 2 | AQ64: 2
E65: 1 | F65: 1 | G65: 1 | H65: 1 | I65: 1 | J65: 1 | K65: 1 | L65: 1 | M65: 1 | N65: 1 | O65: 1 | P65: 1 | Q65: 1 | R65: 1 | S65: 2 | T65: 1 | U65: 1 | V65: 1 | W65: 1 | X65: 1 | Y65: 1 | Z65: 1 | AA65: 2 | AB65: 2 | AC65: 2 | AD65: 2 | AE65: 2 | AF65: 2 | AG65: 2 | AH65: 2 | AI65: 2 | AJ65: 2 | AK65: 2 | AL65: 2 | AM65: 2 | AN65: 2 | AO65: 2 | AP65: 2 | AQ65: 2
E66: 2 | F66: 2 | G66: 2 | H66: 2 | I66: 2 | J66: 2 | K66: 2 | L66: 2 | M66: 2 | N66: 2 | O66: 2 | P66: 2 | Q66: 2 | R66: 2 | S66: 2 | T66: 2 | U66: 2 | V66: 2 | W66: 2 | X66: 2 | Y66: 2 | Z66: 2 | AA66: 2 | AB66: 2 | AC66: 2 | AD66: 2 | AE66: 2 | AF66: 2 | AG66: 2 | AH66: 2 | AI66: 2 | AJ66: 2 | AK66: 2 | AL66: 2 | AM66: 2 | AN66: 2 | AO66: 2 | AP66: 2 | AQ66: 2
E67: 1 | F67: 1 | G67: 1 | H67: 1 | I67: 1 | J67: 1 | K67: 1 | L67: 1 | M67: 1 | N67: 1 | O67: 1 | P67: 1 | Q67: 1 | R67: 1 | S67: 2 | T67: 1 | U67: 1 | V67: 1 | W67: 1 | X67: 1 | Y67: 1 | Z67: 1 | AA67: 2 | AB67: 1 | AC67: 2 | AD67: 2 | AE67: 2 | AF67: 2 | AG67: 2 | AH67: 2 | AI67: 1 | AJ67: 1 | AK67: 1 | AL67: 1 | AM67: 2 | AN67: 2 | AO67: 2 | AP67: 2 | AQ67: 2
E68: 1 | F68: 1 | G68: 1 | H68: 1 | I68: 1 | J68: 1 | K68: 1 | L68: 1 | M68: 1 | N68: 1 | O68: 1 | P68: 1 | Q68: 1 | R68: 1 | S68: 2 | T68: 1 | U68: 1 | V68: 1 | W68: 1 | X68: 1 | Y68: 1 | Z68: 1 | AA68: 2 | AB68: 2 | AC68: 2 | AD68: 2 | AE68: 2 | AF68: 2 | AG68: 2 | AH68: 2 | AI68: 2 | AJ68: 2 | AK68: 2 | AL68: 2 | AM68: 2 | AN68: 2 | AO68: 2 | AP68: 2 | AQ68: 2
E69: 0 | F69: 0 | G69: 0 | H69: 0 | I69: 1 | J69: 0 | K69: 0 | L69: 0 | M69: 1 | N69: 0 | O69: 1 | P69: 1 | Q69: 1 | R69: 1 | S69: 2 | T69: 1 | U69: 0 | V69: 1 | W69: 1 | X69: 0 | Y69: 0 | Z69: 0 | AA69: 0 | AB69: 0 | AC69: 0 | AD69: 0 | AE69: 0 | AF69: 0 | AG69: 0 | AH69: 0 | AI69: 0 | AJ69: 0 | AK69: 0 | AL69: 0 | AM69: 2 | AN69: 2 | AO69: 2 | AP69: 2 | AQ69: 2
E70: 1 | F70: 1 | G70: 1 | H70: 1 | I70: 1 | J70: 1 | K70: 1 | L70: 1 | M70: 1 | N70: 1 | O70: 1 | P70: 1 | Q70: 1 | R70: 1 | S70: 2 | T70: 1 | U70: 1 | V70: 1 | W70: 1 | X70: 1 | Y70: 1 | Z70: 1 | AA70: 1 | AB70: 1 | AC70: 1 | AD70: 1 | AE70: 1 | AF70: 1 | AG70: 1 | AH70: 1 | AI70: 1 | AJ70: 1 | AK70: 1 | AL70: 1 | AM70: 1 | AN70: 1 | AO70: 1 | AP70: 1 | AQ70: 1
E71: 0 | F71: 0 | G71: 0 | H71: 0 | I71: 1 | J71: 0 | K71: 0 | L71: 0 | M71: 0 | N71: 0 | O71: 0 | P71: 1 | Q71: 1 | R71: 1 | S71: 2 | T71: 0 | U71: 0 | V71: 0 | W71: 1 | X71: 0 | Y71: 0 | Z71: 0 | AA71: 0 | AB71: 0 | AC71: 0 | AD71: 0 | AE71: 0 | AF71: 0 | AG71: 0 | AH71: 0 | AI71: 1 | AJ71: 1 | AK71: 1 | AL71: 0 | AM71: 2 | AN71: 2 | AO71: 2 | AP71: 2 | AQ71: 2
E72: 1 | F72: 1 | G72: 1 | H72: 1 | I72: 1 | J72: 1 | K72: 1 | L72: 1 | M72: 1 | N72: 1 | O72: 1 | P72: 1 | Q72: 1 | R72: 1 | S72: 2 | T72: 1 | U72: 1 | V72: 1 | W72: 1 | X72: 1 | Y72: 1 | Z72: 1 | AA72: 1 | AB72: 1 | AC72: 1 | AD72: 1 | AE72: 1 | AF72: 1 | AG72: 1 | AH72: 1 | AI72: 1 | AJ72: 1 | AK72: 1 | AL72: 1 | AM72: 2 | AN72: 2 | AO72: 2 | AP72: 2 | AQ72: 2
E73: 2 | F73: 2 | G73: 2 | H73: 2 | I73: 2 | J73: 2 | K73: 2 | L73: 2 | M73: 2 | N73: 2 | O73: 2 | P73: 2 | Q73: 2 | R73: 2 | S73: 2 | T73: 2 | U73: 2 | V73: 2 | W73: 2 | X73: 2 | Y73: 2 | Z73: 2 | AA73: 2 | AB73: 2 | AC73: 2 | AD73: 2 | AE73: 2 | AF73: 2 | AG73: 2 | AH73: 2 | AI73: 2 | AJ73: 2 | AK73: 2 | AL73: 2 | AM73: 2 | AN73: 2 | AO73: 2 | AP73: 2 | AQ73: 2
E74: 0 | F74: 0 | G74: 0 | H74: 0 | I74: 1 | J74: 0 | K74: 0 | L74: 0 | M74: 1 | N74: 0 | O74: 0 | P74: 1 | Q74: 1 | R74: 0 | S74: 2 | T74: 0 | U74: 0 | V74: 0 | W74: 1 | X74: 0 | Y74: 0 | Z74: 0 | AA74: 0 | AB74: 0 | AC74: 0 | AD74: 0 | AE74: 0 | AF74: 0 | AG74: 0 | AH74: 0 | AI74: 0 | AJ74: 0 | AK74: 0 | AL74: 0 | AM74: 2 | AN74: 2 | AO74: 2 | AP74: 2 | AQ74: 2
E75: 0 | F75: 0 | G75: 0 | H75: 1 | I75: 0 | J75: 0 | K75: 0 | L75: 0 | M75: 0 | N75: 0 | O75: 0 | P75: 1 | Q75: 1 | R75: 1 | S75: 2 | T75: 0 | U75: 0 | V75: 1 | W75: 1 | X75: 1 | Y75: 1 | Z75: 0 | AA75: 0 | AB75: 0 | AC75: 0 | AD75: 0 | AE75: 0 | AF75: 0 | AG75: 0 | AH75: 0 | AI75: 1 | AJ75: 1 | AK75: 1 | AL75: 1 | AM75: 1 | AN75: 1 | AO75: 1 | AP75: 1 | AQ75: 0
E76: 1 | F76: 1 | G76: 1 | H76: 1 | I76: 1 | J76: 1 | K76: 1 | L76: 1 | M76: 1 | N76: 1 | O76: 1 | P76: 1 | Q76: 1 | R76: 1 | S76: 1 | T76: 1 | U76: 1 | V76: 1 | W76: 1 | X76: 1 | Y76: 1 | Z76: 1 | AA76: 1 | AB76: 1 | AC76: 1 | AD76: 1 | AE76: 1 | AF76: 1 | AG76: 1 | AH76: 1 | AI76: 1 | AJ76: 1 | AK76: 1 | AL76: 1 | AM76: 2 | AN76: 2 | AO76: 2 | AP76: 2 | AQ76: 2
E77: 2 | F77: 2 | G77: 2 | H77: 2 | I77: 2 | J77: 2 | K77: 2 | L77: 2 | M77: 2 | N77: 2 | O77: 2 | P77: 2 | Q77: 2 | R77: 2 | S77: 2 | T77: 2 | U77: 2 | V77: 2 | W77: 2 | X77: 2 | Y77: 2 | Z77: 2 | AA77: 2 | AB77: 2 | AC77: 2 | AD77: 2 | AE77: 2 | AF77: 2 | AG77: 2 | AH77: 2 | AI77: 2 | AJ77: 2 | AK77: 2 | AL77: 2 | AM77: 2 | AN77: 2 | AO77: 2 | AP77: 2 | AQ77: 2
E78: 2 | F78: 2 | G78: 2 | H78: 2 | I78: 2 | J78: 2 | K78: 2 | L78: 2 | M78: 2 | N78: 2 | O78: 2 | P78: 2 | Q78: 2 | R78: 2 | S78: 2 | T78: 2 | U78: 2 | V78: 2 | W78: 2 | X78: 2 | Y78: 2 | Z78: 2 | AA78: 2 | AB78: 2 | AC78: 2 | AD78: 2 | AE78: 2 | AF78: 2 | AG78: 2 | AH78: 2 | AI78: 2 | AJ78: 2 | AK78: 2 | AL78: 2 | AM78: 2 | AN78: 2 | AO78: 2 | AP78: 2 | AQ78: 2
E79: 1 | F79: 1 | G79: 1 | H79: 1 | I79: 1 | J79: 1 | K79: 1 | L79: 1 | M79: 1 | N79: 1 | O79: 1 | P79: 1 | Q79: 1 | R79: 1 | S79: 1 | T79: 1 | U79: 1 | V79: 1 | W79: 1 | X79: 1 | Y79: 1 | Z79: 1 | AA79: 1 | AB79: 1 | AC79: 1 | AD79: 1 | AE79: 1 | AF79: 1 | AG79: 1 | AH79: 1 | AI79: 1 | AJ79: 1 | AK79: 1 | AL79: 1 | AM79: 2 | AN79: 2 | AO79: 2 | AP79: 2 | AQ79: 2
E80: 2 | F80: 2 | G80: 2 | H80: 2 | I80: 2 | J80: 2 | K80: 2 | L80: 2 | M80: 2 | N80: 2 | O80: 2 | P80: 2 | Q80: 2 | R80: 2 | S80: 2 | T80: 2 | U80: 2 | V80: 2 | W80: 2 | X80: 2 | Y80: 2 | Z80: 2 | AA80: 2 | AB80: 2 | AC80: 2 | AD80: 2 | AE80: 2 | AF80: 2 | AG80: 2 | AH80: 2 | AI80: 2 | AJ80: 2 | AK80: 2 | AL80: 2 | AM80: 2 | AN80: 2 | AO80: 2 | AP80: 2 | AQ80: 2
E81: 2 | F81: 2 | G81: 2 | H81: 2 | I81: 2 | J81: 2 | K81: 2 | L81: 2 | M81: 2 | N81: 2 | O81: 2 | P81: 2 | Q81: 2 | R81: 2 | S81: 2 | T81: 2 | U81: 2 | V81: 2 | W81: 2 | X81: 2 | Y81: 2 | Z81: 2 | AA81: 2 | AB81: 2 | AC81: 2 | AD81: 2 | AE81: 2 | AF81: 2 | AG81: 2 | AH81: 2 | AI81: 2 | AJ81: 2 | AK81: 2 | AL81: 2 | AM81: 2 | AN81: 2 | AO81: 2 | AP81: 2 | AQ81: 2
E82: 2 | F82: 2 | G82: 2 | H82: 2 | I82: 2 | J82: 2 | K82: 2 | L82: 2 | M82: 2 | N82: 2 | O82: 2 | P82: 2 | Q82: 2 | R82: 2 | S82: 2 | T82: 2 | U82: 2 | V82: 2 | W82: 2 | X82: 2 | Y82: 2 | Z82: 2 | AA82: 2 | AB82: 2 | AC82: 2 | AD82: 2 | AE82: 2 | AF82: 2 | AG82: 2 | AH82: 2 | AI82: 2 | AJ82: 2 | AK82: 2 | AL82: 2 | AM82: 2 | AN82: 2 | AO82: 2 | AP82: 2 | AQ82: 2
E83: 2 | F83: 2 | G83: 2 | H83: 2 | I83: 2 | J83: 2 | K83: 2 | L83: 2 | M83: 2 | N83: 2 | O83: 2 | P83: 2 | Q83: 2 | R83: 2 | S83: 2 | T83: 2 | U83: 2 | V83: 2 | W83: 2 | X83: 2 | Y83: 2 | Z83: 2 | AA83: 2 | AB83: 2 | AC83: 2 | AD83: 2 | AE83: 2 | AF83: 2 | AG83: 2 | AH83: 2 | AI83: 2 | AJ83: 2 | AK83: 2 | AL83: 2 | AM83: 2 | AN83: 2 | AO83: 2 | AP83: 2 | AQ83: 2
E84: 0 | F84: 0 | G84: 0 | H84: 0 | I84: 0 | J84: 0 | K84: 0 | L84: 0 | M84: 0 | N84: 0 | O84: 0 | P84: 0 | Q84: 0 | R84: 0 | S84: 0 | T84: 0 | U84: 0 | V84: 0 | W84: 0 | X84: 0 | Y84: 0 | Z84: 0 | AA84: 0 | AB84: 0 | AC84: 0 | AD84: 0 | AE84: 0 | AF84: 0 | AG84: 0 | AH84: 0 | AI84: 0 | AJ84: 0 | AK84: 0 | AL84: 0 | AM84: 0 | AN84: 0 | AO84: 0 | AP84: 0 | AQ84: 0
E85: 0 | F85: 0 | G85: 0 | H85: 0 | I85: 0 | J85: 0 | K85: 0 | L85: 0 | M85: 0 | N85: 0 | O85: 0 | P85: 0 | Q85: 0 | R85: 0 | S85: 0 | T85: 0 | U85: 0 | V85: 0 | W85: 0 | X85: 0 | Y85: 0 | Z85: 0 | AA85: 0 | AB85: 0 | AC85: 0 | AD85: 0 | AE85: 0 | AF85: 0 | AG85: 0 | AH85: 0 | AI85: 0 | AJ85: 0 | AK85: 0 | AL85: 0 | AM85: 0 | AN85: 0 | AO85: 0 | AP85: 0 | AQ85: 0
E86: 0 | F86: 0 | G86: 0 | H86: 0 | I86: 0 | J86: 0 | K86: 0 | L86: 0 | M86: 0 | N86: 0 | O86: 0 | P86: 0 | Q86: 0 | R86: 0 | S86: 0 | T86: 0 | U86: 0 | V86: 0 | W86: 0 | X86: 0 | Y86: 0 | Z86: 0 | AA86: 0 | AB86: 0 | AC86: 0 | AD86: 0 | AE86: 0 | AF86: 0 | AG86: 0 | AH86: 0 | AI86: 0 | AJ86: 0 | AK86: 0 | AL86: 0 | AM86: 0 | AN86: 0 | AO86: 0 | AP86: 0 | AQ86: 0
E87: 0 | F87: 0 | G87: 0 | H87: 0 | I87: 0 | J87: 0 | K87: 0 | L87: 0 | M87: 0 | N87: 0 | O87: 0 | P87: 0 | Q87: 0 | R87: 0 | S87: 0 | T87: 0 | U87: 0 | V87: 0 | W87: 0 | X87: 0 | Y87: 0 | Z87: 0 | AA87: 0 | AB87: 0 | AC87: 0 | AD87: 0 | AE87: 0 | AF87: 0 | AG87: 0 | AH87: 0 | AI87: 0 | AJ87: 0 | AK87: 0 | AL87: 0 | AM87: 0 | AN87: 0 | AO87: 0 | AP87: 0 | AQ87: 0
E88: 0 | F88: 0 | G88: 0 | H88: 0 | I88: 0 | J88: 0 | K88: 0 | L88: 0 | M88: 0 | N88: 0 | O88: 0 | P88: 0 | Q88: 0 | R88: 0 | S88: 0 | T88: 0 | U88: 0 | V88: 0 | W88: 0 | X88: 0 | Y88: 0 | Z88: 0 | AA88: 0 | AB88: 0 | AC88: 0 | AD88: 0 | AE88: 0 | AF88: 0 | AG88: 0 | AH88: 0 | AI88: 0 | AJ88: 0 | AK88: 0 | AL88: 0 | AM88: 0 | AN88: 0 | AO88: 0 | AP88: 0 | AQ88: 0
E89: 0 | F89: 0 | G89: 0 | H89: 0 | I89: 0 | J89: 0 | K89: 0 | L89: 0 | M89: 0 | N89: 0 | O89: 0 | P89: 0 | Q89: 0 | R89: 0 | S89: 0 | T89: 0 | U89: 0 | V89: 0 | W89: 0 | X89: 0 | Y89: 0 | Z89: 0 | AA89: 0 | AB89: 0 | AC89: 0 | AD89: 0 | AE89: 0 | AF89: 0 | AG89: 0 | AH89: 0 | AI89: 0 | AJ89: 0 | AK89: 0 | AL89: 0 | AM89: 0 | AN89: 0 | AO89: 0 | AP89: 0 | AQ89: 0
A90: 'Bulgaria | B90: 'CEE | C90: 'C1 | E90: =R[-88]C-R[-43]C -> 1 | F90: =R[-88]C-R[-43]C -> 1 | G90: =R[-88]C-R[-43]C -> 1 | H90: =R[-88]C-R[-43]C -> 1 | I90: =R[-88]C-R[-43]C -> 1 | J90: =R[-88]C-R[-43]C -> 1 | K90: =R[-88]C-R[-43]C -> 1 | L90: =R[-88]C-R[-43]C -> 1 | M90: =R[-88]C-R[-43]C -> 1 | N90: =R[-88]C-R[-43]C -> 1 | O90: =R[-88]C-R[-43]C -> 1 | P90: =R[-88]C-R[-43]C -> 1 | Q90: =R[-88]C-R[-43]C -> 1 | R90: =R[-88]C-R[-43]C -> 1 | S90: =R[-88]C-R[-43]C -> 0 | T90: =R[-88]C-R[-43]C -> 1 | U90: =R[-88]C-R[-43]C -> 1 | V90: =R[-88]C-R[-43]C -> 1 | W90: =R[-88]C-R[-43]C -> -1 | X90: =R[-88]C-R[-43]C -> 1 | Y90: =R[-88]C-R[-43]C -> 0 | Z90: =R[-88]C-R[-43]C -> 0 | AA90: =R[-88]C-R[-43]C -> 1 | AB90: =R[-88]C-R[-43]C -> 1 | AC90: =R[-88]C-R[-43]C -> 1 | AD90: =R[-88]C-R[-43]C -> 1 | AE90: =R[-88]C-R[-43]C -> 1 | AF90: =R[-88]C-R[-43]C -> 1 | AG90: =R[-88]C-R[-43]C -> 1 | AH90: =R[-88]C-R[-43]C -> 1 | AI90: =R[-88]C-R[-43]C -> 1 | AJ90: =R[-88]C-R[-43]C -> 1 | AK90: =R[-88]C-R[-43]C -> 1 | AL90: =R[-88]C-R[-43]C -> 1 | AM90: =R[-88]C-R[-43]C -> 0 | AN90: =R[-88]C-R[-43]C -> 0 | AO90: =R[-88]C-R[-43]C -> 0 | AP90: =R[-88]C-R[-43]C -> 0 | AQ90: =R[-88]C-R[-43]C -> 0
A91: 'Czech Republic | B91: 'CEE | C91: 'C2 | E91: =R[-88]C-R[-43]C -> 0 | F91: =R[-88]C-R[-43]C -> 0 | G91: =R[-88]C-R[-43]C -> 0 | H91: =R[-88]C-R[-43]C -> 0 | I91: =R[-88]C-R[-43]C -> 1 | J91: =R[-88]C-R[-43]C -> 0 | K91: =R[-88]C-R[-43]C -> 0 | L91: =R[-88]C-R[-43]C -> 0 | M91: =R[-88]C-R[-43]C -> 1 | N91: =R[-88]C-R[-43]C -> 0 | O91: =R[-88]C-R[-43]C -> 0 | P91: =R[-88]C-R[-43]C -> 1 | Q91: =R[-88]C-R[-43]C -> 1 | R91: =R[-88]C-R[-43]C -> 1 | S91: =R[-88]C-R[-43]C -> 0 | T91: =R[-88]C-R[-43]C -> 0 | U91: =R[-88]C-R[-43]C -> 0 | V91: =R[-88]C-R[-43]C -> 0 | W91: =R[-88]C-R[-43]C -> -1 | X91: =R[-88]C-R[-43]C -> 0 | Y91: =R[-88]C-R[-43]C -> 0 | Z91: =R[-88]C-R[-43]C -> 0 | AA91: =R[-88]C-R[-43]C -> 0 | AB91: =R[-88]C-R[-43]C -> 0 | AC91: =R[-88]C-R[-43]C -> 0 | AD91: =R[-88]C-R[-43]C -> 0 | AE91: =R[-88]C-R[-43]C -> 0 | AF91: =R[-88]C-R[-43]C -> 0 | AG91: =R[-88]C-R[-43]C -> 0 | AH91: =R[-88]C-R[-43]C -> 0 | AI91: =R[-88]C-R[-43]C -> 0 | AJ91: =R[-88]C-R[-43]C -> 0 | AK91: =R[-88]C-R[-43]C -> 0 | AL91: =R[-88]C-R[-43]C -> 0 | AM91: =R[-88]C-R[-43]C -> 0 | AN91: =R[-88]C-R[-43]C -> 0 | AO91: =R[-88]C-R[-43]C -> 0 | AP91: =R[-88]C-R[-43]C -> 0 | AQ91: =R[-88]C-R[-43]C -> 0
A92: 'Estonia | B92: 'CEE | C92: 'C3 | E92: =R[-88]C-R[-43]C -> 0 | F92: =R[-88]C-R[-43]C -> 0 | G92: =R[-88]C-R[-43]C -> 0 | H92: =R[-88]C-R[-43]C -> 0 | I92: =R[-88]C-R[-43]C -> 0 | J92: =R[-88]C-R[-43]C -> 0 | K92: =R[-88]C-R[-43]C -> 0 | L92: =R[-88]C-R[-43]C -> 0 | M92: =R[-88]C-R[-43]C -> 0 | N92: =R[-88]C-R[-43]C -> 0 | O92: =R[-88]C-R[-43]C -> 0 | P92: =R[-88]C-R[-43]C -> 0 | Q92: =R[-88]C-R[-43]C -> 0 | R92: =R[-88]C-R[-43]C -> 0 | S92: =R[-88]C-R[-43]C -> 0 | T92: =R[-88]C-R[-43]C -> 0 | U92: =R[-88]C-R[-43]C -> 0 | V92: =R[-88]C-R[-43]C -> 0 | W92: =R[-88]C-R[-43]C -> -1 | X92: =R[-88]C-R[-43]C -> 0 | Y92: =R[-88]C-R[-43]C -> 0 | Z92: =R[-88]C-R[-43]C -> 0 | AA92: =R[-88]C-R[-43]C -> 0 | AB92: =R[-88]C-R[-43]C -> 0 | AC92: =R[-88]C-R[-43]C -> 0 | AD92: =R[-88]C-R[-43]C -> 0 | AE92: =R[-88]C-R[-43]C -> 0 | AF92: =R[-88]C-R[-43]C -> 0 | AG92: =R[-88]C-R[-43]C -> 0 | AH92: =R[-88]C-R[-43]C -> 0 | AI92: =R[-88]C-R[-43]C -> 0 | AJ92: =R[-88]C-R[-43]C -> 0 | AK92: =R[-88]C-R[-43]C -> 0 | AL92: =R[-88]C-R[-43]C -> 0 | AM92: =R[-88]C-R[-43]C -> 0 | AN92: =R[-88]C-R[-43]C -> 0 | AO92: =R[-88]C-R[-43]C -> 0 | AP92: =R[-88]C-R[-43]C -> 0 | AQ92: =R[-88]C-R[-43]C -> 1
A93: 'Hungary | B93: 'CEE | C93: 'C4 | E93: =R[-88]C-R[-43]C -> 1 | F93: =R[-88]C-R[-43]C -> 1 | G93: =R[-88]C-R[-43]C -> 1 | H93: =R[-88]C-R[-43]C -> 1 | I93: =R[-88]C-R[-43]C -> 1 | J93: =R[-88]C-R[-43]C -> 0 | K93: =R[-88]C-R[-43]C -> 0 | L93: =R[-88]C-R[-43]C -> 1 | M93: =R[-88]C-R[-43]C -> 1 | N93: =R[-88]C-R[-43]C -> 0 | O93: =R[-88]C-R[-43]C -> 0 | P93: =R[-88]C-R[-43]C -> 1 | Q93: =R[-88]C-R[-43]C -> 1 | R93: =R[-88]C-R[-43]C -> 1 | S93: =R[-88]C-R[-43]C -> 0 | T93: =R[-88]C-R[-43]C -> 1 | U93: =R[-88]C-R[-43]C -> 1 | V93: =R[-88]C-R[-43]C -> 1 | W93: =R[-88]C-R[-43]C -> -1 | X93: =R[-88]C-R[-43]C -> 1 | Y93: =R[-88]C-R[-43]C -> 1 | Z93: =R[-88]C-R[-43]C -> 1 | AA93: =R[-88]C-R[-43]C -> 1 | AB93: =R[-88]C-R[-43]C -> 1 | AC93: =R[-88]C-R[-43]C -> 0 | AD93: =R[-88]C-R[-43]C -> 0 | AE93: =R[-88]C-R[-43]C -> 0 | AF93: =R[-88]C-R[-43]C -> 0 | AG93: =R[-88]C-R[-43]C -> 0 | AH93: =R[-88]C-R[-43]C -> 0 | AI93: =R[-88]C-R[-43]C -> 1 | AJ93: =R[-88]C-R[-43]C -> 1 | AK93: =R[-88]C-R[-43]C -> 1 | AL93: =R[-88]C-R[-43]C -> 1 | AM93: =R[-88]C-R[-43]C -> 0 | AN93: =R[-88]C-R[-43]C -> 0 | AO93: =R[-88]C-R[-43]C -> 0 | AP93: =R[-88]C-R[-43]C -> 0 | AQ93: =R[-88]C-R[-43]C -> 0
A94: 'Latvia | B94: 'CEE | C94: 'C5 | E94: =R[-88]C-R[-43]C -> 0 | F94: =R[-88]C-R[-43]C -> 0 | G94: =R[-88]C-R[-43]C -> 0 | H94: =R[-88]C-R[-43]C -> 1 | I94: =R[-88]C-R[-43]C -> 1 | J94: =R[-88]C-R[-43]C -> -1 | K94: =R[-88]C-R[-43]C -> 1 | L94: =R[-88]C-R[-43]C -> -1 | M94: =R[-88]C-R[-43]C -> 1 | N94: =R[-88]C-R[-43]C -> 1 | O94: =R[-88]C-R[-43]C -> 1 | P94: =R[-88]C-R[-43]C -> 1 | Q94: =R[-88]C-R[-43]C -> 1 | R94: =R[-88]C-R[-43]C -> 1 | S94: =R[-88]C-R[-43]C -> 0 | T94: =R[-88]C-R[-43]C -> 0 | U94: =R[-88]C-R[-43]C -> 1 | V94: =R[-88]C-R[-43]C -> -1 | W94: =R[-88]C-R[-43]C -> -1 | X94: =R[-88]C-R[-43]C -> 0 | Y94: =R[-88]C-R[-43]C -> 0 | Z94: =R[-88]C-R[-43]C -> 0 | AA94: =R[-88]C-R[-43]C -> 0 | AB94: =R[-88]C-R[-43]C -> 0 | AC94: =R[-88]C-R[-43]C -> 0 | AD94: =R[-88]C-R[-43]C -> 0 | AE94: =R[-88]C-R[-43]C -> 0 | AF94: =R[-88]C-R[-43]C -> 0 | AG94: =R[-88]C-R[-43]C -> -1 | AH94: =R[-88]C-R[-43]C -> -1 | AI94: =R[-88]C-R[-43]C -> -1 | AJ94: =R[-88]C-R[-43]C -> -1 | AK94: =R[-88]C-R[-43]C -> -1 | AL94: =R[-88]C-R[-43]C -> -1 | AM94: =R[-88]C-R[-43]C -> 0 | AN94: =R[-88]C-R[-43]C -> 0 | AO94: =R[-88]C-R[-43]C -> 0 | AP94: =R[-88]C-R[-43]C -> 0 | AQ94: =R[-88]C-R[-43]C -> 0
A95: 'Lithuania | B95: 'CEE | C95: 'C6 | E95: =R[-88]C-R[-43]C -> 0 | F95: =R[-88]C-R[-43]C -> 0 | G95: =R[-88]C-R[-43]C -> 0 | H95: =R[-88]C-R[-43]C -> 0 | I95: =R[-88]C-R[-43]C -> 0 | J95: =R[-88]C-R[-43]C -> 0 | K95: =R[-88]C-R[-43]C -> 0 | L95: =R[-88]C-R[-43]C -> 0 | M95: =R[-88]C-R[-43]C -> 0 | N95: =R[-88]C-R[-43]C -> 0 | O95: =R[-88]C-R[-43]C -> 0 | P95: =R[-88]C-R[-43]C -> 0 | Q95: =R[-88]C-R[-43]C -> 0 | R95: =R[-88]C-R[-43]C -> -1 | S95: =R[-88]C-R[-43]C -> -2 | T95: =R[-88]C-R[-43]C -> 0 | U95: =R[-88]C-R[-43]C -> 0 | V95: =R[-88]C-R[-43]C -> 0 | W95: =R[-88]C-R[-43]C -> -1 | X95: =R[-88]C-R[-43]C -> 0 | Y95: =R[-88]C-R[-43]C -> 0 | Z95: =R[-88]C-R[-43]C -> 0 | AA95: =R[-88]C-R[-43]C -> 0 | AB95: =R[-88]C-R[-43]C -> 0 | AC95: =R[-88]C-R[-43]C -> 0 | AD95: =R[-88]C-R[-43]C -> 0 | AE95: =R[-88]C-R[-43]C -> 0 | AF95: =R[-88]C-R[-43]C -> 0 | AG95: =R[-88]C-R[-43]C -> 0 | AH95: =R[-88]C-R[-43]C -> 0 | AI95: =R[-88]C-R[-43]C -> 0 | AJ95: =R[-88]C-R[-43]C -> 0 | AK95: =R[-88]C-R[-43]C -> 0 | AL95: =R[-88]C-R[-43]C -> 0 | AM95: =R[-88]C-R[-43]C -> 0 | AN95: =R[-88]C-R[-43]C -> 0 | AO95: =R[-88]C-R[-43]C -> 0 | AP95: =R[-88]C-R[-43]C -> 0 | AQ95: =R[-88]C-R[-43]C -> 0
A96: 'Poland | B96: 'CEE | C96: 'C7 | E96: =R[-88]C-R[-43]C -> 1 | F96: =R[-88]C-R[-43]C -> 1 | G96: =R[-88]C-R[-43]C -> 1 | H96: =R[-88]C-R[-43]C -> 1 | I96: =R[-88]C-R[-43]C -> 1 | J96: =R[-88]C-R[-43]C -> 1 | K96: =R[-88]C-R[-43]C -> 1 | L96: =R[-88]C-R[-43]C -> 1 | M96: =R[-88]C-R[-43]C -> 1 | N96: =R[-88]C-R[-43]C -> 1 | O96: =R[-88]C-R[-43]C -> 1 | P96: =R[-88]C-R[-43]C -> 1 | Q96: =R[-88]C-R[-43]C -> 1 | R96: =R[-88]C-R[-43]C -> 1 | S96: =R[-88]C-R[-43]C -> 0 | T96: =R[-88]C-R[-43]C -> 1 | U96: =R[-88]C-R[-43]C -> 1 | V96: =R[-88]C-R[-43]C -> 1 | W96: =R[-88]C-R[-43]C -> -1 | X96: =R[-88]C-R[-43]C -> 1 | Y96: =R[-88]C-R[-43]C -> 1 | Z96: =R[-88]C-R[-43]C -> 1 | AA96: =R[-88]C-R[-43]C -> 1 | AB96: =R[-88]C-R[-43]C -> 1 | AC96: =R[-88]C-R[-43]C -> 1 | AD96: =R[-88]C-R[-43]C -> 1 | AE96: =R[-88]C-R[-43]C -> 1 | AF96: =R[-88]C-R[-43]C -> 1 | AG96: =R[-88]C-R[-43]C -> 1 | AH96: =R[-88]C-R[-43]C -> 1 | AI96: =R[-88]C-R[-43]C -> 1 | AJ96: =R[-88]C-R[-43]C -> 1 | AK96: =R[-88]C-R[-43]C -> 1 | AL96: =R[-88]C-R[-43]C -> 1 | AM96: =R[-88]C-R[-43]C -> 1 | AN96: =R[-88]C-R[-43]C -> 1 | AO96: =R[-88]C-R[-43]C -> 1 | AP96: =R[-88]C-R[-43]C -> 1 | AQ96: =R[-88]C-R[-43]C -> 1
A97: 'Romania | B97: 'CEE | C97: 'C8 | E97: =R[-88]C-R[-43]C -> 0 | F97: =R[-88]C-R[-43]C -> 0 | G97: =R[-88]C-R[-43]C -> 0 | H97: =R[-88]C-R[-43]C -> 0 | I97: =R[-88]C-R[-43]C -> 0 | J97: =R[-88]C-R[-43]C -> 0 | K97: =R[-88]C-R[-43]C -> 0 | L97: =R[-88]C-R[-43]C -> 0 | M97: =R[-88]C-R[-43]C -> 0 | N97: =R[-88]C-R[-43]C -> 0 | O97: =R[-88]C-R[-43]C -> 0 | P97: =R[-88]C-R[-43]C -> 0 | Q97: =R[-88]C-R[-43]C -> 0 | R97: =R[-88]C-R[-43]C -> 0 | S97: =R[-88]C-R[-43]C -> 0 | T97: =R[-88]C-R[-43]C -> 0 | U97: =R[-88]C-R[-43]C -> 0 | V97: =R[-88]C-R[-43]C -> 0 | W97: =R[-88]C-R[-43]C -> -2 | X97: =R[-88]C-R[-43]C -> 0 | Y97: =R[-88]C-R[-43]C -> 0 | Z97: =R[-88]C-R[-43]C -> 0 | AA97: =R[-88]C-R[-43]C -> 0 | AB97: =R[-88]C-R[-43]C -> 0 | AC97: =R[-88]C-R[-43]C -> 0 | AD97: =R[-88]C-R[-43]C -> 0 | AE97: =R[-88]C-R[-43]C -> 0 | AF97: =R[-88]C-R[-43]C -> 0 | AG97: =R[-88]C-R[-43]C -> 0 | AH97: =R[-88]C-R[-43]C -> 0 | AI97: =R[-88]C-R[-43]C -> 0 | AJ97: =R[-88]C-R[-43]C -> 0 | AK97: =R[-88]C-R[-43]C -> 0 | AL97: =R[-88]C-R[-43]C -> 0 | AM97: =R[-88]C-R[-43]C -> 0 | AN97: =R[-88]C-R[-43]C -> 0 | AO97: =R[-88]C-R[-43]C -> 0 | AP97: =R[-88]C-R[-43]C -> 0 | AQ97: =R[-88]C-R[-43]C -> 0
A98: 'Slovak Rep | B98: 'CEE | C98: 'C9 | E98: =R[-88]C-R[-43]C -> 0 | F98: =R[-88]C-R[-43]C -> 0 | G98: =R[-88]C-R[-43]C -> 0 | H98: =R[-88]C-R[-43]C -> 0 | I98: =R[-88]C-R[-43]C -> 0 | J98: =R[-88]C-R[-43]C -> 1 | K98: =R[-88]C-R[-43]C -> 1 | L98: =R[-88]C-R[-43]C -> 1 | M98: =R[-88]C-R[-43]C -> -1 | N98: =R[-88]C-R[-43]C -> 0 | O98: =R[-88]C-R[-43]C -> 0 | P98: =R[-88]C-R[-43]C -> 1 | Q98: =R[-88]C-R[-43]C -> 1 | R98: =R[-88]C-R[-43]C -> 0 | S98: =R[-88]C-R[-43]C -> -2 | T98: =R[-88]C-R[-43]C -> 0 | U98: =R[-88]C-R[-43]C -> 0 | V98: =R[-88]C-R[-43]C -> 0 | W98: =R[-88]C-R[-43]C -> -1 | X98: =R[-88]C-R[-43]C -> 0 | Y98: =R[-88]C-R[-43]C -> 0 | Z98: =R[-88]C-R[-43]C -> 0 | AA98: =R[-88]C-R[-43]C -> 0 | AB98: =R[-88]C-R[-43]C -> 0 | AC98: =R[-88]C-R[-43]C -> 0 | AD98: =R[-88]C-R[-43]C -> 0 | AE98: =R[-88]C-R[-43]C -> 0 | AF98: =R[-88]C-R[-43]C -> 0 | AG98: =R[-88]C-R[-43]C -> 0 | AH98: =R[-88]C-R[-43]C -> 0 | AI98: =R[-88]C-R[-43]C -> 0 | AJ98: =R[-88]C-R[-43]C -> 0 | AK98: =R[-88]C-R[-43]C -> 0 | AL98: =R[-88]C-R[-43]C -> 0 | AM98: =R[-88]C-R[-43]C -> -2 | AN98: =R[-88]C-R[-43]C -> -2 | AO98: =R[-88]C-R[-43]C -> -2 | AP98: =R[-88]C-R[-43]C -> -2 | AQ98: =R[-88]C-R[-43]C -> -2
A99: 'Slovenia | B99: 'CEE | C99: 'C10 | E99: =R[-88]C-R[-43]C -> 0 | F99: =R[-88]C-R[-43]C -> 0 | G99: =R[-88]C-R[-43]C -> 0 | H99: =R[-88]C-R[-43]C -> 0 | I99: =R[-88]C-R[-43]C -> -1 | J99: =R[-88]C-R[-43]C -> 1 | K99: =R[-88]C-R[-43]C -> 1 | L99: =R[-88]C-R[-43]C -> 1 | M99: =R[-88]C-R[-43]C -> 1 | N99: =R[-88]C-R[-43]C -> 0 | O99: =R[-88]C-R[-43]C -> 1 | P99: =R[-88]C-R[-43]C -> 1 | Q99: =R[-88]C-R[-43]C -> 0 | R99: =R[-88]C-R[-43]C -> -1 | S99: =R[-88]C-R[-43]C -> -2 | T99: =R[-88]C-R[-43]C -> 0 | U99: =R[-88]C-R[-43]C -> 0 | V99: =R[-88]C-R[-43]C -> 0 | W99: =R[-88]C-R[-43]C -> -1 | X99: =R[-88]C-R[-43]C -> 0 | Y99: =R[-88]C-R[-43]C -> 0 | Z99: =R[-88]C-R[-43]C -> 0 | AA99: =R[-88]C-R[-43]C -> 0 | AB99: =R[-88]C-R[-43]C -> 0 | AC99: =R[-88]C-R[-43]C -> 0 | AD99: =R[-88]C-R[-43]C -> 0 | AE99: =R[-88]C-R[-43]C -> 0 | AF99: =R[-88]C-R[-43]C -> 0 | AG99: =R[-88]C-R[-43]C -> 0 | AH99: =R[-88]C-R[-43]C -> -1 | AI99: =R[-88]C-R[-43]C -> 0 | AJ99: =R[-88]C-R[-43]C -> 0 | AK99: =R[-88]C-R[-43]C -> 0 | AL99: =R[-88]C-R[-43]C -> 0 | AM99: =R[-88]C-R[-43]C -> 0 | AN99: =R[-88]C-R[-43]C -> 0 | AO99: =R[-88]C-R[-43]C -> 0 | AP99: =R[-88]C-R[-43]C -> 0 | AQ99: =R[-88]C-R[-43]C -> 0
A100: 'Austria | B100: 'EU | C100: 'C11 | E100: =R[-88]C-R[-43]C -> 1 | F100: =R[-88]C-R[-43]C -> 1 | G100: =R[-88]C-R[-43]C -> 1 | H100: =R[-88]C-R[-43]C -> 1 | I100: =R[-88]C-R[-43]C -> 1 | J100: =R[-88]C-R[-43]C -> 1 | K100: =R[-88]C-R[-43]C -> 1 | L100: =R[-88]C-R[-43]C -> 1 | M100: =R[-88]C-R[-43]C -> 1 | N100: =R[-88]C-R[-43]C -> 1 | O100: =R[-88]C-R[-43]C -> 1 | P100: =R[-88]C-R[-43]C -> 1 | Q100: =R[-88]C-R[-43]C -> 1 | R100: =R[-88]C-R[-43]C -> 1 | S100: =R[-88]C-R[-43]C -> 0 | T100: =R[-88]C-R[-43]C -> 1 | U100: =R[-88]C-R[-43]C -> 1 | V100: =R[-88]C-R[-43]C -> 1 | W100: =R[-88]C-R[-43]C -> -1 | X100: =R[-88]C-R[-43]C -> 1 | Y100: =R[-88]C-R[-43]C -> 1 | Z100: =R[-88]C-R[-43]C -> 1 | AA100: =R[-88]C-R[-43]C -> 0 | AB100: =R[-88]C-R[-43]C -> 0 | AC100: =R[-88]C-R[-43]C -> 0 | AD100: =R[-88]C-R[-43]C -> 0 | AE100: =R[-88]C-R[-43]C -> 0 | AF100: =R[-88]C-R[-43]C -> 0 | AG100: =R[-88]C-R[-43]C -> 0 | AH100: =R[-88]C-R[-43]C -> 0 | AI100: =R[-88]C-R[-43]C -> 0 | AJ100: =R[-88]C-R[-43]C -> 0 | AK100: =R[-88]C-R[-43]C -> 0 | AL100: =R[-88]C-R[-43]C -> 0 | AM100: =R[-88]C-R[-43]C -> 0 | AN100: =R[-88]C-R[-43]C -> 0 | AO100: =R[-88]C-R[-43]C -> 0 | AP100: =R[-88]C-R[-43]C -> 0 | AQ100: =R[-88]C-R[-43]C -> 0
A101: 'Belgium | B101: 'EU | C101: 'C12 | E101: =R[-86]C-R[-43]C -> 0 | F101: =R[-86]C-R[-43]C -> -1 | G101: =R[-86]C-R[-43]C -> -1 | H101: =R[-86]C-R[-43]C -> -1 | I101: =R[-86]C-R[-43]C -> -1 | J101: =R[-86]C-R[-43]C -> -1 | K101: =R[-86]C-R[-43]C -> -1 | L101: =R[-86]C-R[-43]C -> -1 | M101: =R[-86]C-R[-43]C -> -1 | N101: =R[-86]C-R[-43]C -> -1 | O101: =R[-86]C-R[-43]C -> -1 | P101: =R[-86]C-R[-43]C -> -1 | Q101: =R[-86]C-R[-43]C -> -1 | R101: =R[-86]C-R[-43]C -> -1 | S101: =R[-86]C-R[-43]C -> 0 | T101: =R[-86]C-R[-43]C -> -1 | U101: =R[-86]C-R[-43]C -> -1 | V101: =R[-86]C-R[-43]C -> -1 | W101: =R[-86]C-R[-43]C -> -1 | X101: =R[-86]C-R[-43]C -> -1 | Y101: =R[-86]C-R[-43]C -> -1 | Z101: =R[-86]C-R[-43]C -> -1 | AA101: =R[-86]C-R[-43]C -> -1 | AB101: =R[-86]C-R[-43]C -> -1 | AC101: =R[-86]C-R[-43]C -> -1 | AD101: =R[-86]C-R[-43]C -> -1 | AE101: =R[-86]C-R[-43]C -> -1 | AF101: =R[-86]C-R[-43]C -> -1 | AG101: =R[-86]C-R[-43]C -> -1 | AH101: =R[-86]C-R[-43]C -> -1 | AI101: =R[-86]C-R[-43]C -> -1 | AJ101: =R[-86]C-R[-43]C -> -1 | AK101: =R[-86]C-R[-43]C -> -1 | AL101: =R[-86]C-R[-43]C -> -1 | AM101: =R[-86]C-R[-43]C -> -1 | AN101: =R[-86]C-R[-43]C -> -1 | AO101: =R[-86]C-R[-43]C -> -1 | AP101: =R[-86]C-R[-43]C -> -1 | AQ101: =R[-86]C-R[-43]C -> -1
A102: 'Denmark | B102: 'EU | C102: 'C13 | E102: =R[-86]C-R[-43]C -> 0 | F102: =R[-86]C-R[-43]C -> 0 | G102: =R[-86]C-R[-43]C -> 0 | H102: =R[-86]C-R[-43]C -> -1 | I102: =R[-86]C-R[-43]C -> 0 | J102: =R[-86]C-R[-43]C -> 0 | K102: =R[-86]C-R[-43]C -> 0 | L102: =R[-86]C-R[-43]C -> 0 | M102: =R[-86]C-R[-43]C -> 0 | N102: =R[-86]C-R[-43]C -> 0 | O102: =R[-86]C-R[-43]C -> 0 | P102: =R[-86]C-R[-43]C -> -1 | Q102: =R[-86]C-R[-43]C -> 1 | R102: =R[-86]C-R[-43]C -> 0 | S102: =R[-86]C-R[-43]C -> 0 | T102: =R[-86]C-R[-43]C -> 1 | U102: =R[-86]C-R[-43]C -> 0 | V102: =R[-86]C-R[-43]C -> 1 | W102: =R[-86]C-R[-43]C -> -1 | X102: =R[-86]C-R[-43]C -> 0 | Y102: =R[-86]C-R[-43]C -> 0 | Z102: =R[-86]C-R[-43]C -> 0 | AA102: =R[-86]C-R[-43]C -> 0 | AB102: =R[-86]C-R[-43]C -> 0 | AC102: =R[-86]C-R[-43]C -> 1 | AD102: =R[-86]C-R[-43]C -> 1 | AE102: =R[-86]C-R[-43]C -> 1 | AF102: =R[-86]C-R[-43]C -> 0 | AG102: =R[-86]C-R[-43]C -> 0 | AH102: =R[-86]C-R[-43]C -> 0 | AI102: =R[-86]C-R[-43]C -> 0 | AJ102: =R[-86]C-R[-43]C -> 1 | AK102: =R[-86]C-R[-43]C -> 1 | AL102: =R[-86]C-R[-43]C -> 0 | AM102: =R[-86]C-R[-43]C -> 1 | AN102: =R[-86]C-R[-43]C -> 1 | AO102: =R[-86]C-R[-43]C -> 1 | AP102: =R[-86]C-R[-43]C -> 1 | AQ102: =R[-86]C-R[-43]C -> 0
A103: 'Eire | B103: 'EU | C103: 'C15 | E103: =R[-86]C-R[-43]C -> 1 | F103: =R[-86]C-R[-43]C -> 1 | G103: =R[-86]C-R[-43]C -> 1 | H103: =R[-86]C-R[-43]C -> 1 | I103: =R[-86]C-R[-43]C -> 1 | J103: =R[-86]C-R[-43]C -> 1 | K103: =R[-86]C-R[-43]C -> 1 | L103: =R[-86]C-R[-43]C -> 1 | M103: =R[-86]C-R[-43]C -> 1 | N103: =R[-86]C-R[-43]C -> 1 | O103: =R[-86]C-R[-43]C -> 1 | P103: =R[-86]C-R[-43]C -> 1 | Q103: =R[-86]C-R[-43]C -> 1 | R103: =R[-86]C-R[-43]C -> 1 | S103: =R[-86]C-R[-43]C -> 0 | T103: =R[-86]C-R[-43]C -> 1 | U103: =R[-86]C-R[-43]C -> 1 | V103: =R[-86]C-R[-43]C -> 1 | W103: =R[-86]C-R[-43]C -> -1 | X103: =R[-86]C-R[-43]C -> 1 | Y103: =R[-86]C-R[-43]C -> 1 | Z103: =R[-86]C-R[-43]C -> 1 | AA103: =R[-86]C-R[-43]C -> 1 | AB103: =R[-86]C-R[-43]C -> 1 | AC103: =R[-86]C-R[-43]C -> 1 | AD103: =R[-86]C-R[-43]C -> 1 | AE103: =R[-86]C-R[-43]C -> 1 | AF103: =R[-86]C-R[-43]C -> 1 | AG103: =R[-86]C-R[-43]C -> 1 | AH103: =R[-86]C-R[-43]C -> 1 | AI103: =R[-86]C-R[-43]C -> 1 | AJ103: =R[-86]C-R[-43]C -> 1 | AK103: =R[-86]C-R[-43]C -> 1 | AL103: =R[-86]C-R[-43]C -> 1 | AM103: =R[-86]C-R[-43]C -> 0 | AN103: =R[-86]C-R[-43]C -> 0 | AO103: =R[-86]C-R[-43]C -> 0 | AP103: =R[-86]C-R[-43]C -> 0 | AQ103: =R[-86]C-R[-43]C -> 0
A104: 'Finland | B104: 'EU | C104: 'C16 | E104: =R[-86]C-R[-43]C -> 0 | F104: =R[-86]C-R[-43]C -> 1 | G104: =R[-86]C-R[-43]C -> 0 | H104: =R[-86]C-R[-43]C -> 0 | I104: =R[-86]C-R[-43]C -> -1 | J104: =R[-86]C-R[-43]C -> 0 | K104: =R[-86]C-R[-43]C -> 0 | L104: =R[-86]C-R[-43]C -> 0 | M104: =R[-86]C-R[-43]C -> 1 | N104: =R[-86]C-R[-43]C -> 0 | O104: =R[-86]C-R[-43]C -> 0 | P104: =R[-86]C-R[-43]C -> 0 | Q104: =R[-86]C-R[-43]C -> 1 | R104: =R[-86]C-R[-43]C -> 1 | S104: =R[-86]C-R[-43]C -> 0 | T104: =R[-86]C-R[-43]C -> 1 | U104: =R[-86]C-R[-43]C -> 0 | V104: =R[-86]C-R[-43]C -> 0 | W104: =R[-86]C-R[-43]C -> -1 | X104: =R[-86]C-R[-43]C -> 0 | Y104: =R[-86]C-R[-43]C -> 0 | Z104: =R[-86]C-R[-43]C -> 0 | AA104: =R[-86]C-R[-43]C -> 0 | AB104: =R[-86]C-R[-43]C -> 0 | AC104: =R[-86]C-R[-43]C -> 1 | AD104: =R[-86]C-R[-43]C -> 1 | AE104: =R[-86]C-R[-43]C -> 1 | AF104: =R[-86]C-R[-43]C -> 0 | AG104: =R[-86]C-R[-43]C -> 0 | AH104: =R[-86]C-R[-43]C -> 0 | AI104: =R[-86]C-R[-43]C -> 0 | AJ104: =R[-86]C-R[-43]C -> 0 | AK104: =R[-86]C-R[-43]C -> 0 | AL104: =R[-86]C-R[-43]C -> 0 | AM104: =R[-86]C-R[-43]C -> 0 | AN104: =R[-86]C-R[-43]C -> 0 | AO104: =R[-86]C-R[-43]C -> 0 | AP104: =R[-86]C-R[-43]C -> 0 | AQ104: =R[-86]C-R[-43]C -> 0
A105: 'France | B105: 'EU | C105: 'C17 | E105: =R[-86]C-R[-43]C -> 0 | F105: =R[-86]C-R[-43]C -> 0 | G105: =R[-86]C-R[-43]C -> 0 | H105: =R[-86]C-R[-43]C -> 0 | I105: =R[-86]C-R[-43]C -> 1 | J105: =R[-86]C-R[-43]C -> 1 | K105: =R[-86]C-R[-43]C -> 0 | L105: =R[-86]C-R[-43]C -> 0 | M105: =R[-86]C-R[-43]C -> 0 | N105: =R[-86]C-R[-43]C -> 0 | O105: =R[-86]C-R[-43]C -> 1 | P105: =R[-86]C-R[-43]C -> 0 | Q105: =R[-86]C-R[-43]C -> 1 | R105: =R[-86]C-R[-43]C -> 1 | S105: =R[-86]C-R[-43]C -> 0 | T105: =R[-86]C-R[-43]C -> 1 | U105: =R[-86]C-R[-43]C -> 1 | V105: =R[-86]C-R[-43]C -> 1 | W105: =R[-86]C-R[-43]C -> -1 | X105: =R[-86]C-R[-43]C -> 0 | Y105: =R[-86]C-R[-43]C -> 0 | Z105: =R[-86]C-R[-43]C -> 0 | AA105: =R[-86]C-R[-43]C -> 0 | AB105: =R[-86]C-R[-43]C -> 0 | AC105: =R[-86]C-R[-43]C -> 0 | AD105: =R[-86]C-R[-43]C -> 0 | AE105: =R[-86]C-R[-43]C -> 0 | AF105: =R[-86]C-R[-43]C -> 0 | AG105: =R[-86]C-R[-43]C -> 0 | AH105: =R[-86]C-R[-43]C -> 0 | AI105: =R[-86]C-R[-43]C -> 0 | AJ105: =R[-86]C-R[-43]C -> 0 | AK105: =R[-86]C-R[-43]C -> 0 | AL105: =R[-86]C-R[-43]C -> 0 | AM105: =R[-86]C-R[-43]C -> 0 | AN105: =R[-86]C-R[-43]C -> 0 | AO105: =R[-86]C-R[-43]C -> 0 | AP105: =R[-86]C-R[-43]C -> 0 | AQ105: =R[-86]C-R[-43]C -> 0
A106: 'Greece | B106: 'EU | C106: 'C18 | E106: =R[-86]C-R[-43]C -> -1 | F106: =R[-86]C-R[-43]C -> -2 | G106: =R[-86]C-R[-43]C -> -2 | H106: =R[-86]C-R[-43]C -> 0 | I106: =R[-86]C-R[-43]C -> -2 | J106: =R[-86]C-R[-43]C -> -2 | K106: =R[-86]C-R[-43]C -> -2 | L106: =R[-86]C-R[-43]C -> -2 | M106: =R[-86]C-R[-43]C -> -2 | N106: =R[-86]C-R[-43]C -> -2 | O106: =R[-86]C-R[-43]C -> -2 | P106: =R[-86]C-R[-43]C -> -2 | Q106: =R[-86]C-R[-43]C -> -2 | R106: =R[-86]C-R[-43]C -> 0 | S106: =R[-86]C-R[-43]C -> 0 | T106: =R[-86]C-R[-43]C -> -2 | U106: =R[-86]C-R[-43]C -> -2 | V106: =R[-86]C-R[-43]C -> 0 | W106: =R[-86]C-R[-43]C -> -2 | X106: =R[-86]C-R[-43]C -> -2 | Y106: =R[-86]C-R[-43]C -> -2 | Z106: =R[-86]C-R[-43]C -> -2 | AA106: =R[-86]C-R[-43]C -> -1 | AB106: =R[-86]C-R[-43]C -> 0 | AC106: =R[-86]C-R[-43]C -> 0 | AD106: =R[-86]C-R[-43]C -> 0 | AE106: =R[-86]C-R[-43]C -> 0 | AF106: =R[-86]C-R[-43]C -> -2 | AG106: =R[-86]C-R[-43]C -> -2 | AH106: =R[-86]C-R[-43]C -> -1 | AI106: =R[-86]C-R[-43]C -> -1 | AJ106: =R[-86]C-R[-43]C -> -1 | AK106: =R[-86]C-R[-43]C -> -1 | AL106: =R[-86]C-R[-43]C -> -1 | AM106: =R[-86]C-R[-43]C -> 0 | AN106: =R[-86]C-R[-43]C -> 0 | AO106: =R[-86]C-R[-43]C -> 0 | AP106: =R[-86]C-R[-43]C -> 0 | AQ106: =R[-86]C-R[-43]C -> 0
A107: 'Iceland | B107: 'EFTA | C107: 'C19 | E107: =R[-86]C-R[-43]C -> 0 | F107: =R[-86]C-R[-43]C -> 0 | G107: =R[-86]C-R[-43]C -> 0 | H107: =R[-86]C-R[-43]C -> 0 | I107: =R[-86]C-R[-43]C -> 0 | J107: =R[-86]C-R[-43]C -> 0 | K107: =R[-86]C-R[-43]C -> 0 | L107: =R[-86]C-R[-43]C -> 0 | M107: =R[-86]C-R[-43]C -> 0 | N107: =R[-86]C-R[-43]C -> 0 | O107: =R[-86]C-R[-43]C -> 0 | P107: =R[-86]C-R[-43]C -> 0 | Q107: =R[-86]C-R[-43]C -> 0 | R107: =R[-86]C-R[-43]C -> 0 | S107: =R[-86]C-R[-43]C -> 0 | T107: =R[-86]C-R[-43]C -> 0 | U107: =R[-86]C-R[-43]C -> 0 | V107: =R[-86]C-R[-43]C -> 0 | W107: =R[-86]C-R[-43]C -> -2 | X107: =R[-86]C-R[-43]C -> 0 | Y107: =R[-86]C-R[-43]C -> 0 | Z107: =R[-86]C-R[-43]C -> 0 | AA107: =R[-86]C-R[-43]C -> 0 | AB107: =R[-86]C-R[-43]C -> 0 | AC107: =R[-86]C-R[-43]C -> 0 | AD107: =R[-86]C-R[-43]C -> 0 | AE107: =R[-86]C-R[-43]C -> 0 | AF107: =R[-86]C-R[-43]C -> 0 | AG107: =R[-86]C-R[-43]C -> 0 | AH107: =R[-86]C-R[-43]C -> 0 | AI107: =R[-86]C-R[-43]C -> 0 | AJ107: =R[-86]C-R[-43]C -> 0 | AK107: =R[-86]C-R[-43]C -> 0 | AL107: =R[-86]C-R[-43]C -> 0 | AM107: =R[-86]C-R[-43]C -> 0 | AN107: =R[-86]C-R[-43]C -> 0 | AO107: =R[-86]C-R[-43]C -> 0 | AP107: =R[-86]C-R[-43]C -> 0 | AQ107: =R[-86]C-R[-43]C -> 0
A108: 'Italy | B108: 'EU | C108: 'C20 | E108: =R[-86]C-R[-43]C -> 1 | F108: =R[-86]C-R[-43]C -> 1 | G108: =R[-86]C-R[-43]C -> 1 | H108: =R[-86]C-R[-43]C -> 1 | I108: =R[-86]C-R[-43]C -> 1 | J108: =R[-86]C-R[-43]C -> 1 | K108: =R[-86]C-R[-43]C -> 1 | L108: =R[-86]C-R[-43]C -> 1 | M108: =R[-86]C-R[-43]C -> 1 | N108: =R[-86]C-R[-43]C -> 1 | O108: =R[-86]C-R[-43]C -> 1 | P108: =R[-86]C-R[-43]C -> 1 | Q108: =R[-86]C-R[-43]C -> 1 | R108: =R[-86]C-R[-43]C -> 1 | S108: =R[-86]C-R[-43]C -> 0 | T108: =R[-86]C-R[-43]C -> 1 | U108: =R[-86]C-R[-43]C -> 1 | V108: =R[-86]C-R[-43]C -> 1 | W108: =R[-86]C-R[-43]C -> -1 | X108: =R[-86]C-R[-43]C -> 1 | Y108: =R[-86]C-R[-43]C -> 1 | Z108: =R[-86]C-R[-43]C -> 1 | AA108: =R[-86]C-R[-43]C -> 0 | AB108: =R[-86]C-R[-43]C -> 0 | AC108: =R[-86]C-R[-43]C -> 0 | AD108: =R[-86]C-R[-43]C -> 0 | AE108: =R[-86]C-R[-43]C -> 0 | AF108: =R[-86]C-R[-43]C -> 0 | AG108: =R[-86]C-R[-43]C -> 0 | AH108: =R[-86]C-R[-43]C -> 0 | AI108: =R[-86]C-R[-43]C -> 0 | AJ108: =R[-86]C-R[-43]C -> 0 | AK108: =R[-86]C-R[-43]C -> 0 | AL108: =R[-86]C-R[-43]C -> 0 | AM108: =R[-86]C-R[-43]C -> 0 | AN108: =R[-86]C-R[-43]C -> 0 | AO108: =R[-86]C-R[-43]C -> 0 | AP108: =R[-86]C-R[-43]C -> 0 | AQ108: =R[-86]C-R[-43]C -> 0
A109: 'Liechtenstein | B109: 'EFTA | C109: 'C21 | E109: =R[-86]C-R[-43]C -> 0 | F109: =R[-86]C-R[-43]C -> 0 | G109: =R[-86]C-R[-43]C -> 0 | H109: =R[-86]C-R[-43]C -> 0 | I109: =R[-86]C-R[-43]C -> 0 | J109: =R[-86]C-R[-43]C -> 0 | K109: =R[-86]C-R[-43]C -> 0 | L109: =R[-86]C-R[-43]C -> 0 | M109: =R[-86]C-R[-43]C -> 0 | N109: =R[-86]C-R[-43]C -> 0 | O109: =R[-86]C-R[-43]C -> 0 | P109: =R[-86]C-R[-43]C -> 0 | Q109: =R[-86]C-R[-43]C -> 0 | R109: =R[-86]C-R[-43]C -> 0 | S109: =R[-86]C-R[-43]C -> 0 | T109: =R[-86]C-R[-43]C -> 0 | U109: =R[-86]C-R[-43]C -> 0 | V109: =R[-86]C-R[-43]C -> 0 | W109: =R[-86]C-R[-43]C -> -2 | X109: =R[-86]C-R[-43]C -> 0 | Y109: =R[-86]C-R[-43]C -> 0 | Z109: =R[-86]C-R[-43]C -> 0 | AA109: =R[-86]C-R[-43]C -> 0 | AB109: =R[-86]C-R[-43]C -> 0 | AC109: =R[-86]C-R[-43]C -> 0 | AD109: =R[-86]C-R[-43]C -> 0 | AE109: =R[-86]C-R[-43]C -> 0 | AF109: =R[-86]C-R[-43]C -> 0 | AG109: =R[-86]C-R[-43]C -> 0 | AH109: =R[-86]C-R[-43]C -> 0 | AI109: =R[-86]C-R[-43]C -> 0 | AJ109: =R[-86]C-R[-43]C -> 0 | AK109: =R[-86]C-R[-43]C -> 0 | AL109: =R[-86]C-R[-43]C -> 0 | AM109: =R[-86]C-R[-43]C -> 0 | AN109: =R[-86]C-R[-43]C -> 0 | AO109: =R[-86]C-R[-43]C -> 0 | AP109: =R[-86]C-R[-43]C -> 0 | AQ109: =R[-86]C-R[-43]C -> 0
A110: 'Luxembourg | B110: 'EU | C110: 'C22 | E110: =R[-86]C-R[-43]C -> -1 | F110: =R[-86]C-R[-43]C -> -1 | G110: =R[-86]C-R[-43]C -> -1 | H110: =R[-86]C-R[-43]C -> -1 | I110: =R[-86]C-R[-43]C -> -1 | J110: =R[-86]C-R[-43]C -> 0 | K110: =R[-86]C-R[-43]C -> 0 | L110: =R[-86]C-R[-43]C -> -1 | M110: =R[-86]C-R[-43]C -> -1 | N110: =R[-86]C-R[-43]C -> -1 | O110: =R[-86]C-R[-43]C -> -1 | P110: =R[-86]C-R[-43]C -> -1 | Q110: =R[-86]C-R[-43]C -> -1 | R110: =R[-86]C-R[-43]C -> -1 | S110: =R[-86]C-R[-43]C -> -2 | T110: =R[-86]C-R[-43]C -> 0 | U110: =R[-86]C-R[-43]C -> 1 | V110: =R[-86]C-R[-43]C -> 1 | W110: =R[-86]C-R[-43]C -> -1 | X110: =R[-86]C-R[-43]C -> 0 | Y110: =R[-86]C-R[-43]C -> 0 | Z110: =R[-86]C-R[-43]C -> 0 | AA110: =R[-86]C-R[-43]C -> -1 | AB110: =R[-86]C-R[-43]C -> 0 | AC110: =R[-86]C-R[-43]C -> -1 | AD110: =R[-86]C-R[-43]C -> -1 | AE110: =R[-86]C-R[-43]C -> -1 | AF110: =R[-86]C-R[-43]C -> -1 | AG110: =R[-86]C-R[-43]C -> -1 | AH110: =R[-86]C-R[-43]C -> -1 | AI110: =R[-86]C-R[-43]C -> 0 | AJ110: =R[-86]C-R[-43]C -> 0 | AK110: =R[-86]C-R[-43]C -> 0 | AL110: =R[-86]C-R[-43]C -> 0 | AM110: =R[-86]C-R[-43]C -> 0 | AN110: =R[-86]C-R[-43]C -> 0 | AO110: =R[-86]C-R[-43]C -> 0 | AP110: =R[-86]C-R[-43]C -> 0 | AQ110: =R[-86]C-R[-43]C -> 0
A111: 'Netherlands | B111: 'EU | C111: 'C23 | E111: =R[-86]C-R[-43]C -> 0 | F111: =R[-86]C-R[-43]C -> 0 | G111: =R[-86]C-R[-43]C -> 0 | H111: =R[-86]C-R[-43]C -> 0 | I111: =R[-86]C-R[-43]C -> 0 | J111: =R[-86]C-R[-43]C -> 1 | K111: =R[-86]C-R[-43]C -> 0 | L111: =R[-86]C-R[-43]C -> 1 | M111: =R[-86]C-R[-43]C -> 1 | N111: =R[-86]C-R[-43]C -> 1 | O111: =R[-86]C-R[-43]C -> 1 | P111: =R[-86]C-R[-43]C -> 1 | Q111: =R[-86]C-R[-43]C -> 1 | R111: =R[-86]C-R[-43]C -> 1 | S111: =R[-86]C-R[-43]C -> 0 | T111: =R[-86]C-R[-43]C -> 1 | U111: =R[-86]C-R[-43]C -> 0 | V111: =R[-86]C-R[-43]C -> 1 | W111: =R[-86]C-R[-43]C -> -1 | X111: =R[-86]C-R[-43]C -> 0 | Y111: =R[-86]C-R[-43]C -> 0 | Z111: =R[-86]C-R[-43]C -> 0 | AA111: =R[-86]C-R[-43]C -> 0 | AB111: =R[-86]C-R[-43]C -> 0 | AC111: =R[-86]C-R[-43]C -> 0 | AD111: =R[-86]C-R[-43]C -> 0 | AE111: =R[-86]C-R[-43]C -> 0 | AF111: =R[-86]C-R[-43]C -> 0 | AG111: =R[-86]C-R[-43]C -> 0 | AH111: =R[-86]C-R[-43]C -> 0 | AI111: =R[-86]C-R[-43]C -> 0 | AJ111: =R[-86]C-R[-43]C -> 0 | AK111: =R[-86]C-R[-43]C -> 0 | AL111: =R[-86]C-R[-43]C -> 0 | AM111: =R[-86]C-R[-43]C -> 0 | AN111: =R[-86]C-R[-43]C -> 0 | AO111: =R[-86]C-R[-43]C -> 0 | AP111: =R[-86]C-R[-43]C -> 0 | AQ111: =R[-86]C-R[-43]C -> 0
A112: 'Norway | B112: 'EFTA | C112: 'C24 | E112: =R[-86]C-R[-43]C -> 0 | F112: =R[-86]C-R[-43]C -> 0 | G112: =R[-86]C-R[-43]C -> 0 | H112: =R[-86]C-R[-43]C -> 0 | I112: =R[-86]C-R[-43]C -> 1 | J112: =R[-86]C-R[-43]C -> 0 | K112: =R[-86]C-R[-43]C -> 0 | L112: =R[-86]C-R[-43]C -> 0 | M112: =R[-86]C-R[-43]C -> 1 | N112: =R[-86]C-R[-43]C -> 0 | O112: =R[-86]C-R[-43]C -> -1 | P112: =R[-86]C-R[-43]C -> -1 | Q112: =R[-86]C-R[-43]C -> 1 | R112: =R[-86]C-R[-43]C -> -1 | S112: =R[-86]C-R[-43]C -> -1 | T112: =R[-86]C-R[-43]C -> 1 | U112: =R[-86]C-R[-43]C -> 0 | V112: =R[-86]C-R[-43]C -> -1 | W112: =R[-86]C-R[-43]C -> -1 | X112: =R[-86]C-R[-43]C -> 0 | Y112: =R[-86]C-R[-43]C -> 0 | Z112: =R[-86]C-R[-43]C -> 0 | AA112: =R[-86]C-R[-43]C -> 0 | AB112: =R[-86]C-R[-43]C -> 0 | AC112: =R[-86]C-R[-43]C -> 0 | AD112: =R[-86]C-R[-43]C -> 0 | AE112: =R[-86]C-R[-43]C -> 0 | AF112: =R[-86]C-R[-43]C -> 0 | AG112: =R[-86]C-R[-43]C -> 0 | AH112: =R[-86]C-R[-43]C -> 0 | AI112: =R[-86]C-R[-43]C -> 0 | AJ112: =R[-86]C-R[-43]C -> 0 | AK112: =R[-86]C-R[-43]C -> 0 | AL112: =R[-86]C-R[-43]C -> 0 | AM112: =R[-86]C-R[-43]C -> 0 | AN112: =R[-86]C-R[-43]C -> 0 | AO112: =R[-86]C-R[-43]C -> 0 | AP112: =R[-86]C-R[-43]C -> 0 | AQ112: =R[-86]C-R[-43]C -> 0
A113: 'Portugal | B113: 'EU | C113: 'C25 | E113: =R[-86]C-R[-43]C -> 0 | F113: =R[-86]C-R[-43]C -> 0 | G113: =R[-86]C-R[-43]C -> 0 | H113: =R[-86]C-R[-43]C -> 1 | I113: =R[-86]C-R[-43]C -> 1 | J113: =R[-86]C-R[-43]C -> 0 | K113: =R[-86]C-R[-43]C -> 0 | L113: =R[-86]C-R[-43]C -> 0 | M113: =R[-86]C-R[-43]C -> 1 | N113: =R[-86]C-R[-43]C -> 0 | O113: =R[-86]C-R[-43]C -> 0 | P113: =R[-86]C-R[-43]C -> 1 | Q113: =R[-86]C-R[-43]C -> 1 | R113: =R[-86]C-R[-43]C -> 0 | S113: =R[-86]C-R[-43]C -> -1 | T113: =R[-86]C-R[-43]C -> 0 | U113: =R[-86]C-R[-43]C -> 0 | V113: =R[-86]C-R[-43]C -> 1 | W113: =R[-86]C-R[-43]C -> -1 | X113: =R[-86]C-R[-43]C -> 0 | Y113: =R[-86]C-R[-43]C -> 0 | Z113: =R[-86]C-R[-43]C -> 0 | AA113: =R[-86]C-R[-43]C -> 0 | AB113: =R[-86]C-R[-43]C -> 0 | AC113: =R[-86]C-R[-43]C -> 0 | AD113: =R[-86]C-R[-43]C -> 0 | AE113: =R[-86]C-R[-43]C -> 0 | AF113: =R[-86]C-R[-43]C -> 0 | AG113: =R[-86]C-R[-43]C -> 0 | AH113: =R[-86]C-R[-43]C -> 0 | AI113: =R[-86]C-R[-43]C -> 0 | AJ113: =R[-86]C-R[-43]C -> 0 | AK113: =R[-86]C-R[-43]C -> 0 | AL113: =R[-86]C-R[-43]C -> 0 | AM113: =R[-86]C-R[-43]C -> 0 | AN113: =R[-86]C-R[-43]C -> 0 | AO113: =R[-86]C-R[-43]C -> 0 | AP113: =R[-86]C-R[-43]C -> 0 | AQ113: =R[-86]C-R[-43]C -> 0
A114: 'Spain | B114: 'EU | C114: 'C26 | E114: =R[-86]C-R[-43]C -> 1 | F114: =R[-86]C-R[-43]C -> 1 | G114: =R[-86]C-R[-43]C -> 1 | H114: =R[-86]C-R[-43]C -> 1 | I114: =R[-86]C-R[-43]C -> 1 | J114: =R[-86]C-R[-43]C -> 1 | K114: =R[-86]C-R[-43]C -> 1 | L114: =R[-86]C-R[-43]C -> 1 | M114: =R[-86]C-R[-43]C -> 1 | N114: =R[-86]C-R[-43]C -> 1 | O114: =R[-86]C-R[-43]C -> 1 | P114: =R[-86]C-R[-43]C -> 1 | Q114: =R[-86]C-R[-43]C -> 1 | R114: =R[-86]C-R[-43]C -> 1 | S114: =R[-86]C-R[-43]C -> 0 | T114: =R[-86]C-R[-43]C -> 1 | U114: =R[-86]C-R[-43]C -> 1 | V114: =R[-86]C-R[-43]C -> 1 | W114: =R[-86]C-R[-43]C -> -1 | X114: =R[-86]C-R[-43]C -> 1 | Y114: =R[-86]C-R[-43]C -> 1 | Z114: =R[-86]C-R[-43]C -> 1 | AA114: =R[-86]C-R[-43]C -> 1 | AB114: =R[-86]C-R[-43]C -> 1 | AC114: =R[-86]C-R[-43]C -> 1 | AD114: =R[-86]C-R[-43]C -> 1 | AE114: =R[-86]C-R[-43]C -> 1 | AF114: =R[-86]C-R[-43]C -> 1 | AG114: =R[-86]C-R[-43]C -> 1 | AH114: =R[-86]C-R[-43]C -> 1 | AI114: =R[-86]C-R[-43]C -> 0 | AJ114: =R[-86]C-R[-43]C -> 0 | AK114: =R[-86]C-R[-43]C -> 0 | AL114: =R[-86]C-R[-43]C -> 1 | AM114: =R[-86]C-R[-43]C -> 0 | AN114: =R[-86]C-R[-43]C -> 0 | AO114: =R[-86]C-R[-43]C -> 0 | AP114: =R[-86]C-R[-43]C -> 0 | AQ114: =R[-86]C-R[-43]C -> 0
A115: 'Sweden | B115: 'EU | C115: 'C27 | E115: =R[-86]C-R[-43]C -> -1 | F115: =R[-86]C-R[-43]C -> -1 | G115: =R[-86]C-R[-43]C -> -1 | H115: =R[-86]C-R[-43]C -> -1 | I115: =R[-86]C-R[-43]C -> 1 | J115: =R[-86]C-R[-43]C -> -1 | K115: =R[-86]C-R[-43]C -> -1 | L115: =R[-86]C-R[-43]C -> -1 | M115: =R[-86]C-R[-43]C -> -1 | N115: =R[-86]C-R[-43]C -> -1 | O115: =R[-86]C-R[-43]C -> -1 | P115: =R[-86]C-R[-43]C -> 1 | Q115: =R[-86]C-R[-43]C -> 1 | R115: =R[-86]C-R[-43]C -> -1 | S115: =R[-86]C-R[-43]C -> 0 | T115: =R[-86]C-R[-43]C -> -1 | U115: =R[-86]C-R[-43]C -> -1 | V115: =R[-86]C-R[-43]C -> 1 | W115: =R[-86]C-R[-43]C -> -1 | X115: =R[-86]C-R[-43]C -> -1 | Y115: =R[-86]C-R[-43]C -> -1 | Z115: =R[-86]C-R[-43]C -> -1 | AA115: =R[-86]C-R[-43]C -> -1 | AB115: =R[-86]C-R[-43]C -> -1 | AC115: =R[-86]C-R[-43]C -> -1 | AD115: =R[-86]C-R[-43]C -> -1 | AE115: =R[-86]C-R[-43]C -> -1 | AF115: =R[-86]C-R[-43]C -> -1 | AG115: =R[-86]C-R[-43]C -> -1 | AH115: =R[-86]C-R[-43]C -> -1 | AI115: =R[-86]C-R[-43]C -> 0 | AJ115: =R[-86]C-R[-43]C -> 0 | AK115: =R[-86]C-R[-43]C -> 0 | AL115: =R[-86]C-R[-43]C -> -1 | AM115: =R[-86]C-R[-43]C -> 0 | AN115: =R[-86]C-R[-43]C -> 0 | AO115: =R[-86]C-R[-43]C -> 0 | AP115: =R[-86]C-R[-43]C -> 0 | AQ115: =R[-86]C-R[-43]C -> 0
A116: 'Switzerland | B116: 'EFTA | C116: 'C28 | E116: =R[-86]C-R[-43]C -> 0 | F116: =R[-86]C-R[-43]C -> 0 | G116: =R[-86]C-R[-43]C -> 0 | H116: =R[-86]C-R[-43]C -> 0 | I116: =R[-86]C-R[-43]C -> 0 | J116: =R[-86]C-R[-43]C -> 0 | K116: =R[-86]C-R[-43]C -> 0 | L116: =R[-86]C-R[-43]C -> 0 | M116: =R[-86]C-R[-43]C -> 0 | N116: =R[-86]C-R[-43]C -> 0 | O116: =R[-86]C-R[-43]C -> 0 | P116: =R[-86]C-R[-43]C -> 0 | Q116: =R[-86]C-R[-43]C -> 0 | R116: =R[-86]C-R[-43]C -> 0 | S116: =R[-86]C-R[-43]C -> 0 | T116: =R[-86]C-R[-43]C -> 0 | U116: =R[-86]C-R[-43]C -> 0 | V116: =R[-86]C-R[-43]C -> 0 | W116: =R[-86]C-R[-43]C -> -2 | X116: =R[-86]C-R[-43]C -> 0 | Y116: =R[-86]C-R[-43]C -> 0 | Z116: =R[-86]C-R[-43]C -> 0 | AA116: =R[-86]C-R[-43]C -> 0 | AB116: =R[-86]C-R[-43]C -> 0 | AC116: =R[-86]C-R[-43]C -> 0 | AD116: =R[-86]C-R[-43]C -> 0 | AE116: =R[-86]C-R[-43]C -> 0 | AF116: =R[-86]C-R[-43]C -> 0 | AG116: =R[-86]C-R[-43]C -> 0 | AH116: =R[-86]C-R[-43]C -> 0 | AI116: =R[-86]C-R[-43]C -> 0 | AJ116: =R[-86]C-R[-43]C -> 0 | AK116: =R[-86]C-R[-43]C -> 0 | AL116: =R[-86]C-R[-43]C -> 0 | AM116: =R[-86]C-R[-43]C -> 0 | AN116: =R[-86]C-R[-43]C -> 0 | AO116: =R[-86]C-R[-43]C -> 0 | AP116: =R[-86]C-R[-43]C -> 0 | AQ116: =R[-86]C-R[-43]C -> 0
A117: 'UK | B117: 'EU | C117: 'C29 | E117: =R[-86]C-R[-43]C -> 0 | F117: =R[-86]C-R[-43]C -> 0 | G117: =R[-86]C-R[-43]C -> 0 | H117: =R[-86]C-R[-43]C -> 0 | I117: =R[-86]C-R[-43]C -> 1 | J117: =R[-86]C-R[-43]C -> 0 | K117: =R[-86]C-R[-43]C -> 1 | L117: =R[-86]C-R[-43]C -> 1 | M117: =R[-86]C-R[-43]C -> 1 | N117: =R[-86]C-R[-43]C -> 1 | O117: =R[-86]C-R[-43]C -> 1 | P117: =R[-86]C-R[-43]C -> 1 | Q117: =R[-86]C-R[-43]C -> 1 | R117: =R[-86]C-R[-43]C -> 0 | S117: =R[-86]C-R[-43]C -> -2 | T117: =R[-86]C-R[-43]C -> 1 | U117: =R[-86]C-R[-43]C -> 0 | V117: =R[-86]C-R[-43]C -> 0 | W117: =R[-86]C-R[-43]C -> -1 | X117: =R[-86]C-R[-43]C -> 0 | Y117: =R[-86]C-R[-43]C -> 0 | Z117: =R[-86]C-R[-43]C -> 0 | AA117: =R[-86]C-R[-43]C -> 0 | AB117: =R[-86]C-R[-43]C -> 0 | AC117: =R[-86]C-R[-43]C -> 0 | AD117: =R[-86]C-R[-43]C -> 0 | AE117: =R[-86]C-R[-43]C -> 0 | AF117: =R[-86]C-R[-43]C -> 0 | AG117: =R[-86]C-R[-43]C -> 0 | AH117: =R[-86]C-R[-43]C -> 0 | AI117: =R[-86]C-R[-43]C -> 0 | AJ117: =R[-86]C-R[-43]C -> 0 | AK117: =R[-86]C-R[-43]C -> 0 | AL117: =R[-86]C-R[-43]C -> 0 | AM117: =R[-86]C-R[-43]C -> 0 | AN117: =R[-86]C-R[-43]C -> 0 | AO117: =R[-86]C-R[-43]C -> 0 | AP117: =R[-86]C-R[-43]C -> 0 | AQ117: =R[-86]C-R[-43]C -> 0
A118: 'Germany | B118: 'EU | C118: 'C31 | E118: =R[-86]C-R[-43]C -> 0 | F118: =R[-86]C-R[-43]C -> 0 | G118: =R[-86]C-R[-43]C -> 0 | H118: =R[-86]C-R[-43]C -> 1 | I118: =R[-86]C-R[-43]C -> 0 | J118: =R[-86]C-R[-43]C -> 0 | K118: =R[-86]C-R[-43]C -> 0 | L118: =R[-86]C-R[-43]C -> 0 | M118: =R[-86]C-R[-43]C -> 2 | N118: =R[-86]C-R[-43]C -> 0 | O118: =R[-86]C-R[-43]C -> 0 | P118: =R[-86]C-R[-43]C -> 1 | Q118: =R[-86]C-R[-43]C -> 1 | R118: =R[-86]C-R[-43]C -> 1 | S118: =R[-86]C-R[-43]C -> 0 | T118: =R[-86]C-R[-43]C -> 0 | U118: =R[-86]C-R[-43]C -> 0 | V118: =R[-86]C-R[-43]C -> 1 | W118: =R[-86]C-R[-43]C -> -1 | X118: =R[-86]C-R[-43]C -> -1 | Y118: =R[-86]C-R[-43]C -> -1 | Z118: =R[-86]C-R[-43]C -> 0 | AA118: =R[-86]C-R[-43]C -> 0 | AB118: =R[-86]C-R[-43]C -> 0 | AC118: =R[-86]C-R[-43]C -> 0 | AD118: =R[-86]C-R[-43]C -> 0 | AE118: =R[-86]C-R[-43]C -> 0 | AF118: =R[-86]C-R[-43]C -> 0 | AG118: =R[-86]C-R[-43]C -> 0 | AH118: =R[-86]C-R[-43]C -> 0 | AI118: =R[-86]C-R[-43]C -> 0 | AJ118: =R[-86]C-R[-43]C -> 0 | AK118: =R[-86]C-R[-43]C -> 0 | AL118: =R[-86]C-R[-43]C -> -1 | AM118: =R[-86]C-R[-43]C -> -1 | AN118: =R[-86]C-R[-43]C -> -1 | AO118: =R[-86]C-R[-43]C -> -1 | AP118: =R[-86]C-R[-43]C -> -1 | AQ118: =R[-86]C-R[-43]C -> 1
A119: 'USA | B119: 'World - A | C119: 'C50 | E119: =R[-86]C-R[-43]C -> 0 | F119: =R[-86]C-R[-43]C -> 1 | G119: =R[-86]C-R[-43]C -> 0 | H119: =R[-86]C-R[-43]C -> 1 | I119: =R[-86]C-R[-43]C -> 0 | J119: =R[-86]C-R[-43]C -> 1 | K119: =R[-86]C-R[-43]C -> 0 | L119: =R[-86]C-R[-43]C -> 0 | M119: =R[-86]C-R[-43]C -> 0 | N119: =R[-86]C-R[-43]C -> 0 | O119: =R[-86]C-R[-43]C -> 0 | P119: =R[-86]C-R[-43]C -> 1 | Q119: =R[-86]C-R[-43]C -> 1 | R119: =R[-86]C-R[-43]C -> 1 | S119: =R[-86]C-R[-43]C -> 0 | T119: =R[-86]C-R[-43]C -> 1 | U119: =R[-86]C-R[-43]C -> 0 | V119: =R[-86]C-R[-43]C -> 0 | W119: =R[-86]C-R[-43]C -> -1 | X119: =R[-86]C-R[-43]C -> 0 | Y119: =R[-86]C-R[-43]C -> 0 | Z119: =R[-86]C-R[-43]C -> 0 | AA119: =R[-86]C-R[-43]C -> 0 | AB119: =R[-86]C-R[-43]C -> 0 | AC119: =R[-86]C-R[-43]C -> 0 | AD119: =R[-86]C-R[-43]C -> 0 | AE119: =R[-86]C-R[-43]C -> 0 | AF119: =R[-86]C-R[-43]C -> 0 | AG119: =R[-86]C-R[-43]C -> 0 | AH119: =R[-86]C-R[-43]C -> 0 | AI119: =R[-86]C-R[-43]C -> 0 | AJ119: =R[-86]C-R[-43]C -> 0 | AK119: =R[-86]C-R[-43]C -> 0 | AL119: =R[-86]C-R[-43]C -> 0 | AM119: =R[-86]C-R[-43]C -> 0 | AN119: =R[-86]C-R[-43]C -> 0 | AO119: =R[-86]C-R[-43]C -> 0 | AP119: =R[-86]C-R[-43]C -> 0 | AQ119: =R[-86]C-R[-43]C -> 0
A120: 'Turkey | B120: 'World - B | C120: 'C42 | E120: =R[-86]C-R[-43]C -> 0 | F120: =R[-86]C-R[-43]C -> 0 | G120: =R[-86]C-R[-43]C -> 0 | H120: =R[-86]C-R[-43]C -> 0 | I120: =R[-86]C-R[-43]C -> 0 | J120: =R[-86]C-R[-43]C -> 0 | K120: =R[-86]C-R[-43]C -> 0 | L120: =R[-86]C-R[-43]C -> 0 | M120: =R[-86]C-R[-43]C -> 0 | N120: =R[-86]C-R[-43]C -> 0 | O120: =R[-86]C-R[-43]C -> 0 | P120: =R[-86]C-R[-43]C -> 0 | Q120: =R[-86]C-R[-43]C -> 0 | R120: =R[-86]C-R[-43]C -> 0 | S120: =R[-86]C-R[-43]C -> 0 | T120: =R[-86]C-R[-43]C -> 0 | U120: =R[-86]C-R[-43]C -> 0 | V120: =R[-86]C-R[-43]C -> 0 | W120: =R[-86]C-R[-43]C -> -2 | X120: =R[-86]C-R[-43]C -> 0 | Y120: =R[-86]C-R[-43]C -> 0 | Z120: =R[-86]C-R[-43]C -> 0 | AA120: =R[-86]C-R[-43]C -> 0 | AB120: =R[-86]C-R[-43]C -> 0 | AC120: =R[-86]C-R[-43]C -> 0 | AD120: =R[-86]C-R[-43]C -> 0 | AE120: =R[-86]C-R[-43]C -> 0 | AF120: =R[-86]C-R[-43]C -> 0 | AG120: =R[-86]C-R[-43]C -> 0 | AH120: =R[-86]C-R[-43]C -> 0 | AI120: =R[-86]C-R[-43]C -> 0 | AJ120: =R[-86]C-R[-43]C -> 0 | AK120: =R[-86]C-R[-43]C -> 0 | AL120: =R[-86]C-R[-43]C -> 0 | AM120: =R[-86]C-R[-43]C -> 0 | AN120: =R[-86]C-R[-43]C -> 0 | AO120: =R[-86]C-R[-43]C -> 0 | AP120: =R[-86]C-R[-43]C -> 0 | AQ120: =R[-86]C-R[-43]C -> 0
A121: 'Australia | B121: 'World - A | C121: 'C70 | E121: =R[-86]C-R[-43]C -> 0 | F121: =R[-86]C-R[-43]C -> 0 | G121: =R[-86]C-R[-43]C -> 0 | H121: =R[-86]C-R[-43]C -> 0 | I121: =R[-86]C-R[-43]C -> 0 | J121: =R[-86]C-R[-43]C -> 0 | K121: =R[-86]C-R[-43]C -> 0 | L121: =R[-86]C-R[-43]C -> 0 | M121: =R[-86]C-R[-43]C -> 0 | N121: =R[-86]C-R[-43]C -> 0 | O121: =R[-86]C-R[-43]C -> 0 | P121: =R[-86]C-R[-43]C -> 0 | Q121: =R[-86]C-R[-43]C -> 0 | R121: =R[-86]C-R[-43]C -> 0 | S121: =R[-86]C-R[-43]C -> 0 | T121: =R[-86]C-R[-43]C -> 0 | U121: =R[-86]C-R[-43]C -> 0 | V121: =R[-86]C-R[-43]C -> 0 | W121: =R[-86]C-R[-43]C -> -2 | X121: =R[-86]C-R[-43]C -> 0 | Y121: =R[-86]C-R[-43]C -> 0 | Z121: =R[-86]C-R[-43]C -> 0 | AA121: =R[-86]C-R[-43]C -> 0 | AB121: =R[-86]C-R[-43]C -> 0 | AC121: =R[-86]C-R[-43]C -> 0 | AD121: =R[-86]C-R[-43]C -> 0 | AE121: =R[-86]C-R[-43]C -> 0 | AF121: =R[-86]C-R[-43]C -> 0 | AG121: =R[-86]C-R[-43]C -> 0 | AH121: =R[-86]C-R[-43]C -> 0 | AI121: =R[-86]C-R[-43]C -> 0 | AJ121: =R[-86]C-R[-43]C -> 0 | AK121: =R[-86]C-R[-43]C -> 0 | AL121: =R[-86]C-R[-43]C -> 0 | AM121: =R[-86]C-R[-43]C -> 0 | AN121: =R[-86]C-R[-43]C -> 0 | AO121: =R[-86]C-R[-43]C -> 0 | AP121: =R[-86]C-R[-43]C -> 0 | AQ121: =R[-86]C-R[-43]C -> 0
A122: 'Japan | B122: 'World - A | C122: 'C41 | E122: =R[-86]C-R[-43]C -> -1 | F122: =R[-86]C-R[-43]C -> -1 | G122: =R[-86]C-R[-43]C -> -1 | H122: =R[-86]C-R[-43]C -> 1 | I122: =R[-86]C-R[-43]C -> 1 | J122: =R[-86]C-R[-43]C -> 1 | K122: =R[-86]C-R[-43]C -> 1 | L122: =R[-86]C-R[-43]C -> 1 | M122: =R[-86]C-R[-43]C -> 1 | N122: =R[-86]C-R[-43]C -> -1 | O122: =R[-86]C-R[-43]C -> 1 | P122: =R[-86]C-R[-43]C -> 1 | Q122: =R[-86]C-R[-43]C -> 1 | R122: =R[-86]C-R[-43]C -> 1 | S122: =R[-86]C-R[-43]C -> 1 | T122: =R[-86]C-R[-43]C -> 1 | U122: =R[-86]C-R[-43]C -> -1 | V122: =R[-86]C-R[-43]C -> 1 | W122: =R[-86]C-R[-43]C -> -1 | X122: =R[-86]C-R[-43]C -> -1 | Y122: =R[-86]C-R[-43]C -> -1 | Z122: =R[-86]C-R[-43]C -> -1 | AA122: =R[-86]C-R[-43]C -> 0 | AB122: =R[-86]C-R[-43]C -> -1 | AC122: =R[-86]C-R[-43]C -> 0 | AD122: =R[-86]C-R[-43]C -> 0 | AE122: =R[-86]C-R[-43]C -> 0 | AF122: =R[-86]C-R[-43]C -> 0 | AG122: =R[-86]C-R[-43]C -> 0 | AH122: =R[-86]C-R[-43]C -> -1 | AI122: =R[-86]C-R[-43]C -> 0 | AJ122: =R[-86]C-R[-43]C -> 0 | AK122: =R[-86]C-R[-43]C -> 0 | AL122: =R[-86]C-R[-43]C -> 0 | AM122: =R[-86]C-R[-43]C -> 0 | AN122: =R[-86]C-R[-43]C -> 0 | AO122: =R[-86]C-R[-43]C -> 0 | AP122: =R[-86]C-R[-43]C -> 0 | AQ122: =R[-86]C-R[-43]C -> 0
A123: 'Korea | B123: 'World - A | C123: 'C40 | E123: =R[-86]C-R[-43]C -> 0 | F123: =R[-86]C-R[-43]C -> 0 | G123: =R[-86]C-R[-43]C -> 0 | H123: =R[-86]C-R[-43]C -> 0 | I123: =R[-86]C-R[-43]C -> 0 | J123: =R[-86]C-R[-43]C -> 0 | K123: =R[-86]C-R[-43]C -> 0 | L123: =R[-86]C-R[-43]C -> 0 | M123: =R[-86]C-R[-43]C -> 0 | N123: =R[-86]C-R[-43]C -> 0 | O123: =R[-86]C-R[-43]C -> 0 | P123: =R[-86]C-R[-43]C -> 0 | Q123: =R[-86]C-R[-43]C -> 0 | R123: =R[-86]C-R[-43]C -> 0 | S123: =R[-86]C-R[-43]C -> 0 | T123: =R[-86]C-R[-43]C -> 0 | U123: =R[-86]C-R[-43]C -> 0 | V123: =R[-86]C-R[-43]C -> 0 | W123: =R[-86]C-R[-43]C -> -2 | X123: =R[-86]C-R[-43]C -> 0 | Y123: =R[-86]C-R[-43]C -> 0 | Z123: =R[-86]C-R[-43]C -> 0 | AA123: =R[-86]C-R[-43]C -> 0 | AB123: =R[-86]C-R[-43]C -> 0 | AC123: =R[-86]C-R[-43]C -> 0 | AD123: =R[-86]C-R[-43]C -> 0 | AE123: =R[-86]C-R[-43]C -> 0 | AF123: =R[-86]C-R[-43]C -> 0 | AG123: =R[-86]C-R[-43]C -> 0 | AH123: =R[-86]C-R[-43]C -> 0 | AI123: =R[-86]C-R[-43]C -> 0 | AJ123: =R[-86]C-R[-43]C -> 0 | AK123: =R[-86]C-R[-43]C -> 0 | AL123: =R[-86]C-R[-43]C -> 0 | AM123: =R[-86]C-R[-43]C -> 0 | AN123: =R[-86]C-R[-43]C -> 0 | AO123: =R[-86]C-R[-43]C -> 0 | AP123: =R[-86]C-R[-43]C -> 0 | AQ123: =R[-86]C-R[-43]C -> 0
A124: 'Canada | B124: 'World - A | C124: 'C51 | E124: =R[-86]C-R[-43]C -> -1 | F124: =R[-86]C-R[-43]C -> -1 | G124: =R[-86]C-R[-43]C -> -1 | H124: =R[-86]C-R[-43]C -> 0 | I124: =R[-86]C-R[-43]C -> -1 | J124: =R[-86]C-R[-43]C -> 0 | K124: =R[-86]C-R[-43]C -> 0 | L124: =R[-86]C-R[-43]C -> 0 | M124: =R[-86]C-R[-43]C -> 0 | N124: =R[-86]C-R[-43]C -> 0 | O124: =R[-86]C-R[-43]C -> 0 | P124: =R[-86]C-R[-43]C -> 0 | Q124: =R[-86]C-R[-43]C -> 0 | R124: =R[-86]C-R[-43]C -> 0 | S124: =R[-86]C-R[-43]C -> 0 | T124: =R[-86]C-R[-43]C -> 0 | U124: =R[-86]C-R[-43]C -> 0 | V124: =R[-86]C-R[-43]C -> -1 | W124: =R[-86]C-R[-43]C -> -2 | X124: =R[-86]C-R[-43]C -> -1 | Y124: =R[-86]C-R[-43]C -> -1 | Z124: =R[-86]C-R[-43]C -> -1 | AA124: =R[-86]C-R[-43]C -> -1 | AB124: =R[-86]C-R[-43]C -> -1 | AC124: =R[-86]C-R[-43]C -> -1 | AD124: =R[-86]C-R[-43]C -> -1 | AE124: =R[-86]C-R[-43]C -> -1 | AF124: =R[-86]C-R[-43]C -> -1 | AG124: =R[-86]C-R[-43]C -> -1 | AH124: =R[-86]C-R[-43]C -> -1 | AI124: =R[-86]C-R[-43]C -> -1 | AJ124: =R[-86]C-R[-43]C -> -1 | AK124: =R[-86]C-R[-43]C -> -1 | AL124: =R[-86]C-R[-43]C -> -1 | AM124: =R[-86]C-R[-43]C -> -1 | AN124: =R[-86]C-R[-43]C -> -1 | AO124: =R[-86]C-R[-43]C -> -1 | AP124: =R[-86]C-R[-43]C -> -1 | AQ124: =R[-86]C-R[-43]C -> -1
A125: 'New Zealand | B125: 'World - A | C125: 'C71 | E125: =R[-86]C-R[-43]C -> 0 | F125: =R[-86]C-R[-43]C -> 0 | G125: =R[-86]C-R[-43]C -> 0 | H125: =R[-86]C-R[-43]C -> 0 | I125: =R[-86]C-R[-43]C -> 0 | J125: =R[-86]C-R[-43]C -> 0 | K125: =R[-86]C-R[-43]C -> 0 | L125: =R[-86]C-R[-43]C -> 0 | M125: =R[-86]C-R[-43]C -> 0 | N125: =R[-86]C-R[-43]C -> 0 | O125: =R[-86]C-R[-43]C -> 0 | P125: =R[-86]C-R[-43]C -> 0 | Q125: =R[-86]C-R[-43]C -> 0 | R125: =R[-86]C-R[-43]C -> 0 | S125: =R[-86]C-R[-43]C -> 0 | T125: =R[-86]C-R[-43]C -> 0 | U125: =R[-86]C-R[-43]C -> 0 | V125: =R[-86]C-R[-43]C -> 0 | W125: =R[-86]C-R[-43]C -> -2 | X125: =R[-86]C-R[-43]C -> 0 | Y125: =R[-86]C-R[-43]C -> 0 | Z125: =R[-86]C-R[-43]C -> 0 | AA125: =R[-86]C-R[-43]C -> 0 | AB125: =R[-86]C-R[-43]C -> 0 | AC125: =R[-86]C-R[-43]C -> 0 | AD125: =R[-86]C-R[-43]C -> 0 | AE125: =R[-86]C-R[-43]C -> 0 | AF125: =R[-86]C-R[-43]C -> 0 | AG125: =R[-86]C-R[-43]C -> 0 | AH125: =R[-86]C-R[-43]C -> 0 | AI125: =R[-86]C-R[-43]C -> 0 | AJ125: =R[-86]C-R[-43]C -> 0 | AK125: =R[-86]C-R[-43]C -> 0 | AL125: =R[-86]C-R[-43]C -> 0 | AM125: =R[-86]C-R[-43]C -> 0 | AN125: =R[-86]C-R[-43]C -> 0 | AO125: =R[-86]C-R[-43]C -> 0 | AP125: =R[-86]C-R[-43]C -> 0 | AQ125: =R[-86]C-R[-43]C -> 0
A126: 'Mexico | B126: 'World - B | C126: 'C72 | E126: =R[-86]C-R[-43]C -> 0 | F126: =R[-86]C-R[-43]C -> 0 | G126: =R[-86]C-R[-43]C -> 0 | H126: =R[-86]C-R[-43]C -> 0 | I126: =R[-86]C-R[-43]C -> 0 | J126: =R[-86]C-R[-43]C -> 0 | K126: =R[-86]C-R[-43]C -> 0 | L126: =R[-86]C-R[-43]C -> 0 | M126: =R[-86]C-R[-43]C -> 0 | N126: =R[-86]C-R[-43]C -> 0 | O126: =R[-86]C-R[-43]C -> 0 | P126: =R[-86]C-R[-43]C -> 0 | Q126: =R[-86]C-R[-43]C -> 0 | R126: =R[-86]C-R[-43]C -> 0 | S126: =R[-86]C-R[-43]C -> 0 | T126: =R[-86]C-R[-43]C -> 0 | U126: =R[-86]C-R[-43]C -> 0 | V126: =R[-86]C-R[-43]C -> 0 | W126: =R[-86]C-R[-43]C -> -2 | X126: =R[-86]C-R[-43]C -> 0 | Y126: =R[-86]C-R[-43]C -> 0 | Z126: =R[-86]C-R[-43]C -> 0 | AA126: =R[-86]C-R[-43]C -> 0 | AB126: =R[-86]C-R[-43]C -> 0 | AC126: =R[-86]C-R[-43]C -> 0 | AD126: =R[-86]C-R[-43]C -> 0 | AE126: =R[-86]C-R[-43]C -> 0 | AF126: =R[-86]C-R[-43]C -> 0 | AG126: =R[-86]C-R[-43]C -> 0 | AH126: =R[-86]C-R[-43]C -> 0 | AI126: =R[-86]C-R[-43]C -> 0 | AJ126: =R[-86]C-R[-43]C -> 0 | AK126: =R[-86]C-R[-43]C -> 0 | AL126: =R[-86]C-R[-43]C -> 0 | AM126: =R[-86]C-R[-43]C -> 0 | AN126: =R[-86]C-R[-43]C -> 0 | AO126: =R[-86]C-R[-43]C -> 0 | AP126: =R[-86]C-R[-43]C -> 0 | AQ126: =R[-86]C-R[-43]C -> 0
A127: 'CEE - Total | B127: 'Totals | E127: =R[-86]C-R[-43]C -> 0 | F127: =R[-86]C-R[-43]C -> 0 | G127: =R[-86]C-R[-43]C -> 0 | H127: =R[-86]C-R[-43]C -> 0 | I127: =R[-86]C-R[-43]C -> 0 | J127: =R[-86]C-R[-43]C -> 0 | K127: =R[-86]C-R[-43]C -> 0 | L127: =R[-86]C-R[-43]C -> 0 | M127: =R[-86]C-R[-43]C -> 0 | N127: =R[-86]C-R[-43]C -> 0 | O127: =R[-86]C-R[-43]C -> 0 | P127: =R[-86]C-R[-43]C -> 0 | Q127: =R[-86]C-R[-43]C -> 0 | R127: =R[-86]C-R[-43]C -> 0 | S127: =R[-86]C-R[-43]C -> 0 | T127: =R[-86]C-R[-43]C -> 0 | U127: =R[-86]C-R[-43]C -> 0 | V127: =R[-86]C-R[-43]C -> 0 | W127: =R[-86]C-R[-43]C -> 0 | X127: =R[-86]C-R[-43]C -> 0 | Y127: =R[-86]C-R[-43]C -> 0 | Z127: =R[-86]C-R[-43]C -> 0 | AA127: =R[-86]C-R[-43]C -> 0 | AB127: =R[-86]C-R[-43]C -> 0 | AC127: =R[-86]C-R[-43]C -> 0 | AD127: =R[-86]C-R[-43]C -> 0 | AE127: =R[-86]C-R[-43]C -> 0 | AF127: =R[-86]C-R[-43]C -> 0 | AG127: =R[-86]C-R[-43]C -> 0 | AH127: =R[-86]C-R[-43]C -> 0 | AI127: =R[-86]C-R[-43]C -> 0 | AJ127: =R[-86]C-R[-43]C -> 0 | AK127: =R[-86]C-R[-43]C -> 0 | AL127: =R[-86]C-R[-43]C -> 0 | AM127: =R[-86]C-R[-43]C -> 0 | AN127: =R[-86]C-R[-43]C -> 0 | AO127: =R[-86]C-R[-43]C -> 0 | AP127: =R[-86]C-R[-43]C -> 0 | AQ127: =R[-86]C-R[-43]C -> 0
A128: 'EU - Total | B128: 'Totals | E128: =R[-86]C-R[-43]C -> 0 | F128: =R[-86]C-R[-43]C -> 0 | G128: =R[-86]C-R[-43]C -> 0 | H128: =R[-86]C-R[-43]C -> 0 | I128: =R[-86]C-R[-43]C -> 0 | J128: =R[-86]C-R[-43]C -> 0 | K128: =R[-86]C-R[-43]C -> 0 | L128: =R[-86]C-R[-43]C -> 0 | M128: =R[-86]C-R[-43]C -> 0 | N128: =R[-86]C-R[-43]C -> 0 | O128: =R[-86]C-R[-43]C -> 0 | P128: =R[-86]C-R[-43]C -> 0 | Q128: =R[-86]C-R[-43]C -> 0 | R128: =R[-86]C-R[-43]C -> 0 | S128: =R[-86]C-R[-43]C -> 0 | T128: =R[-86]C-R[-43]C -> 0 | U128: =R[-86]C-R[-43]C -> 0 | V128: =R[-86]C-R[-43]C -> 0 | W128: =R[-86]C-R[-43]C -> 0 | X128: =R[-86]C-R[-43]C -> 0 | Y128: =R[-86]C-R[-43]C -> 0 | Z128: =R[-86]C-R[-43]C -> 0 | AA128: =R[-86]C-R[-43]C -> 0 | AB128: =R[-86]C-R[-43]C -> 0 | AC128: =R[-86]C-R[-43]C -> 0 | AD128: =R[-86]C-R[-43]C -> 0 | AE128: =R[-86]C-R[-43]C -> 0 | AF128: =R[-86]C-R[-43]C -> 0 | AG128: =R[-86]C-R[-43]C -> 0 | AH128: =R[-86]C-R[-43]C -> 0 | AI128: =R[-86]C-R[-43]C -> 0 | AJ128: =R[-86]C-R[-43]C -> 0 | AK128: =R[-86]C-R[-43]C -> 0 | AL128: =R[-86]C-R[-43]C -> 0 | AM128: =R[-86]C-R[-43]C -> 0 | AN128: =R[-86]C-R[-43]C -> 0 | AO128: =R[-86]C-R[-43]C -> 0 | AP128: =R[-86]C-R[-43]C -> 0 | AQ128: =R[-86]C-R[-43]C -> 0
A129: 'EFTA - Total | B129: 'Totals | E129: =R[-86]C-R[-43]C -> 0 | F129: =R[-86]C-R[-43]C -> 0 | G129: =R[-86]C-R[-43]C -> 0 | H129: =R[-86]C-R[-43]C -> 0 | I129: =R[-86]C-R[-43]C -> 0 | J129: =R[-86]C-R[-43]C -> 0 | K129: =R[-86]C-R[-43]C -> 0 | L129: =R[-86]C-R[-43]C -> 0 | M129: =R[-86]C-R[-43]C -> 0 | N129: =R[-86]C-R[-43]C -> 0 | O129: =R[-86]C-R[-43]C -> 0 | P129: =R[-86]C-R[-43]C -> 0 | Q129: =R[-86]C-R[-43]C -> 0 | R129: =R[-86]C-R[-43]C -> 0 | S129: =R[-86]C-R[-43]C -> 0 | T129: =R[-86]C-R[-43]C -> 0 | U129: =R[-86]C-R[-43]C -> 0 | V129: =R[-86]C-R[-43]C -> 0 | W129: =R[-86]C-R[-43]C -> 0 | X129: =R[-86]C-R[-43]C -> 0 | Y129: =R[-86]C-R[-43]C -> 0 | Z129: =R[-86]C-R[-43]C -> 0 | AA129: =R[-86]C-R[-43]C -> 0 | AB129: =R[-86]C-R[-43]C -> 0 | AC129: =R[-86]C-R[-43]C -> 0 | AD129: =R[-86]C-R[-43]C -> 0 | AE129: =R[-86]C-R[-43]C -> 0 | AF129: =R[-86]C-R[-43]C -> 0 | AG129: =R[-86]C-R[-43]C -> 0 | AH129: =R[-86]C-R[-43]C -> 0 | AI129: =R[-86]C-R[-43]C -> 0 | AJ129: =R[-86]C-R[-43]C -> 0 | AK129: =R[-86]C-R[-43]C -> 0 | AL129: =R[-86]C-R[-43]C -> 0 | AM129: =R[-86]C-R[-43]C -> 0 | AN129: =R[-86]C-R[-43]C -> 0 | AO129: =R[-86]C-R[-43]C -> 0 | AP129: =R[-86]C-R[-43]C -> 0 | AQ129: =R[-86]C-R[-43]C -> 0
A130: 'World A - Total | B130: 'Totals | E130: =R[-86]C-R[-43]C -> 0 | F130: =R[-86]C-R[-43]C -> 0 | G130: =R[-86]C-R[-43]C -> 0 | H130: =R[-86]C-R[-43]C -> 0 | I130: =R[-86]C-R[-43]C -> 0 | J130: =R[-86]C-R[-43]C -> 0 | K130: =R[-86]C-R[-43]C -> 0 | L130: =R[-86]C-R[-43]C -> 0 | M130: =R[-86]C-R[-43]C -> 0 | N130: =R[-86]C-R[-43]C -> 0 | O130: =R[-86]C-R[-43]C -> 0 | P130: =R[-86]C-R[-43]C -> 0 | Q130: =R[-86]C-R[-43]C -> 0 | R130: =R[-86]C-R[-43]C -> 0 | S130: =R[-86]C-R[-43]C -> 0 | T130: =R[-86]C-R[-43]C -> 0 | U130: =R[-86]C-R[-43]C -> 0 | V130: =R[-86]C-R[-43]C -> 0 | W130: =R[-86]C-R[-43]C -> 0 | X130: =R[-86]C-R[-43]C -> 0 | Y130: =R[-86]C-R[-43]C -> 0 | Z130: =R[-86]C-R[-43]C -> 0 | AA130: =R[-86]C-R[-43]C -> 0 | AB130: =R[-86]C-R[-43]C -> 0 | AC130: =R[-86]C-R[-43]C -> 0 | AD130: =R[-86]C-R[-43]C -> 0 | AE130: =R[-86]C-R[-43]C -> 0 | AF130: =R[-86]C-R[-43]C -> 0 | AG130: =R[-86]C-R[-43]C -> 0 | AH130: =R[-86]C-R[-43]C -> 0 | AI130: =R[-86]C-R[-43]C -> 0 | AJ130: =R[-86]C-R[-43]C -> 0 | AK130: =R[-86]C-R[-43]C -> 0 | AL130: =R[-86]C-R[-43]C -> 0 | AM130: =R[-86]C-R[-43]C -> 0 | AN130: =R[-86]C-R[-43]C -> 0 | AO130: =R[-86]C-R[-43]C -> 0 | AP130: =R[-86]C-R[-43]C -> 0 | AQ130: =R[-86]C-R[-43]C -> 0
A131: 'World B - Total | B131: 'Totals | E131: =R[-86]C-R[-43]C -> 0 | F131: =R[-86]C-R[-43]C -> 0 | G131: =R[-86]C-R[-43]C -> 0 | H131: =R[-86]C-R[-43]C -> 0 | I131: =R[-86]C-R[-43]C -> 0 | J131: =R[-86]C-R[-43]C -> 0 | K131: =R[-86]C-R[-43]C -> 0 | L131: =R[-86]C-R[-43]C -> 0 | M131: =R[-86]C-R[-43]C -> 0 | N131: =R[-86]C-R[-43]C -> 0 | O131: =R[-86]C-R[-43]C -> 0 | P131: =R[-86]C-R[-43]C -> 0 | Q131: =R[-86]C-R[-43]C -> 0 | R131: =R[-86]C-R[-43]C -> 0 | S131: =R[-86]C-R[-43]C -> 0 | T131: =R[-86]C-R[-43]C -> 0 | U131: =R[-86]C-R[-43]C -> 0 | V131: =R[-86]C-R[-43]C -> 0 | W131: =R[-86]C-R[-43]C -> 0 | X131: =R[-86]C-R[-43]C -> 0 | Y131: =R[-86]C-R[-43]C -> 0 | Z131: =R[-86]C-R[-43]C -> 0 | AA131: =R[-86]C-R[-43]C -> 0 | AB131: =R[-86]C-R[-43]C -> 0 | AC131: =R[-86]C-R[-43]C -> 0 | AD131: =R[-86]C-R[-43]C -> 0 | AE131: =R[-86]C-R[-43]C -> 0 | AF131: =R[-86]C-R[-43]C -> 0 | AG131: =R[-86]C-R[-43]C -> 0 | AH131: =R[-86]C-R[-43]C -> 0 | AI131: =R[-86]C-R[-43]C -> 0 | AJ131: =R[-86]C-R[-43]C -> 0 | AK131: =R[-86]C-R[-43]C -> 0 | AL131: =R[-86]C-R[-43]C -> 0 | AM131: =R[-86]C-R[-43]C -> 0 | AN131: =R[-86]C-R[-43]C -> 0 | AO131: =R[-86]C-R[-43]C -> 0 | AP131: =R[-86]C-R[-43]C -> 0 | AQ131: =R[-86]C-R[-43]C -> 0
E132: =R[-86]C-R[-43]C -> 0 | F132: =R[-86]C-R[-43]C -> 0 | G132: =R[-86]C-R[-43]C -> 0 | H132: =R[-86]C-R[-43]C -> 0 | I132: =R[-86]C-R[-43]C -> 0 | J132: =R[-86]C-R[-43]C -> 0 | K132: =R[-86]C-R[-43]C -> 0 | L132: =R[-86]C-R[-43]C -> 0 | M132: =R[-86]C-R[-43]C -> 0 | N132: =R[-86]C-R[-43]C -> 0 | O132: =R[-86]C-R[-43]C -> 0 | P132: =R[-86]C-R[-43]C -> 0 | Q132: =R[-86]C-R[-43]C -> 0 | R132: =R[-86]C-R[-43]C -> 0 | S132: =R[-86]C-R[-43]C -> 0 | T132: =R[-86]C-R[-43]C -> 0 | U132: =R[-86]C-R[-43]C -> 0 | V132: =R[-86]C-R[-43]C -> 0 | W132: =R[-86]C-R[-43]C -> 0 | X132: =R[-86]C-R[-43]C -> 0 | Y132: =R[-86]C-R[-43]C -> 0 | Z132: =R[-86]C-R[-43]C -> 0 | AA132: =R[-86]C-R[-43]C -> 0 | AB132: =R[-86]C-R[-43]C -> 0 | AC132: =R[-86]C-R[-43]C -> 0 | AD132: =R[-86]C-R[-43]C -> 0 | AE132: =R[-86]C-R[-43]C -> 0 | AF132: =R[-86]C-R[-43]C -> 0 | AG132: =R[-86]C-R[-43]C -> 0 | AH132: =R[-86]C-R[-43]C -> 0 | AI132: =R[-86]C-R[-43]C -> 0 | AJ132: =R[-86]C-R[-43]C -> 0 | AK132: =R[-86]C-R[-43]C -> 0 | AL132: =R[-86]C-R[-43]C -> 0 | AM132: =R[-86]C-R[-43]C -> 0 | AN132: =R[-86]C-R[-43]C -> 0 | AO132: =R[-86]C-R[-43]C -> 0 | AP132: =R[-86]C-R[-43]C -> 0 | AQ132: =R[-86]C-R[-43]C -> 0
E133: =R[-86]C-R[-43]C -> -1 | F133: =R[-86]C-R[-43]C -> -1 | G133: =R[-86]C-R[-43]C -> -1 | H133: =R[-86]C-R[-43]C -> -1 | I133: =R[-86]C-R[-43]C -> 0 | J133: =R[-86]C-R[-43]C -> 0 | K133: =R[-86]C-R[-43]C -> -1 | L133: =R[-86]C-R[-43]C -> -1 | M133: =R[-86]C-R[-43]C -> 0 | N133: =R[-86]C-R[-43]C -> -1 | O133: =R[-86]C-R[-43]C -> -1 | P133: =R[-86]C-R[-43]C -> 0 | Q133: =R[-86]C-R[-43]C -> 0 | R133: =R[-86]C-R[-43]C -> 0 | S133: =R[-86]C-R[-43]C -> 2 | T133: =R[-86]C-R[-43]C -> -1 | U133: =R[-86]C-R[-43]C -> -1 | V133: =R[-86]C-R[-43]C -> -1 | W133: =R[-86]C-R[-43]C -> 2 | X133: =R[-86]C-R[-43]C -> -1 | Y133: =R[-86]C-R[-43]C -> 1 | Z133: =R[-86]C-R[-43]C -> 1 | AA133: =R[-86]C-R[-43]C -> -1 | AB133: =R[-86]C-R[-43]C -> -1 | AC133: =R[-86]C-R[-43]C -> -1 | AD133: =R[-86]C-R[-43]C -> -1 | AE133: =R[-86]C-R[-43]C -> -1 | AF133: =R[-86]C-R[-43]C -> -1 | AG133: =R[-86]C-R[-43]C -> -1 | AH133: =R[-86]C-R[-43]C -> -1 | AI133: =R[-86]C-R[-43]C -> -1 | AJ133: =R[-86]C-R[-43]C -> -1 | AK133: =R[-86]C-R[-43]C -> -1 | AL133: =R[-86]C-R[-43]C -> -1 | AM133: =R[-86]C-R[-43]C -> 2 | AN133: =R[-86]C-R[-43]C -> 2 | AO133: =R[-86]C-R[-43]C -> 2 | AP133: =R[-86]C-R[-43]C -> 2 | AQ133: =R[-86]C-R[-43]C -> 2
E134: =R[-86]C-R[-43]C -> 0 | F134: =R[-86]C-R[-43]C -> 0 | G134: =R[-86]C-R[-43]C -> 0 | H134: =R[-86]C-R[-43]C -> 0 | I134: =R[-86]C-R[-43]C -> 0 | J134: =R[-86]C-R[-43]C -> 1 | K134: =R[-86]C-R[-43]C -> 1 | L134: =R[-86]C-R[-43]C -> 1 | M134: =R[-86]C-R[-43]C -> 0 | N134: =R[-86]C-R[-43]C -> 0 | O134: =R[-86]C-R[-43]C -> 1 | P134: =R[-86]C-R[-43]C -> 0 | Q134: =R[-86]C-R[-43]C -> 0 | R134: =R[-86]C-R[-43]C -> 0 | S134: =R[-86]C-R[-43]C -> 2 | T134: =R[-86]C-R[-43]C -> 0 | U134: =R[-86]C-R[-43]C -> 0 | V134: =R[-86]C-R[-43]C -> 1 | W134: =R[-86]C-R[-43]C -> 2 | X134: =R[-86]C-R[-43]C -> 0 | Y134: =R[-86]C-R[-43]C -> 0 | Z134: =R[-86]C-R[-43]C -> 0 | AA134: =R[-86]C-R[-43]C -> 2 | AB134: =R[-86]C-R[-43]C -> 0 | AC134: =R[-86]C-R[-43]C -> 2 | AD134: =R[-86]C-R[-43]C -> 2 | AE134: =R[-86]C-R[-43]C -> 2 | AF134: =R[-86]C-R[-43]C -> 2 | AG134: =R[-86]C-R[-43]C -> 2 | AH134: =R[-86]C-R[-43]C -> 2 | AI134: =R[-86]C-R[-43]C -> 2 | AJ134: =R[-86]C-R[-43]C -> 2 | AK134: =R[-86]C-R[-43]C -> 2 | AL134: =R[-86]C-R[-43]C -> 2 | AM134: =R[-86]C-R[-43]C -> 2 | AN134: =R[-86]C-R[-43]C -> 2 | AO134: =R[-86]C-R[-43]C -> 2 | AP134: =R[-86]C-R[-43]C -> 2 | AQ134: =R[-86]C-R[-43]C -> 2
E135: =R[-86]C-R[-43]C -> 0 | F135: =R[-86]C-R[-43]C -> 0 | G135: =R[-86]C-R[-43]C -> 0 | H135: =R[-86]C-R[-43]C -> 0 | I135: =R[-86]C-R[-43]C -> 0 | J135: =R[-86]C-R[-43]C -> 0 | K135: =R[-86]C-R[-43]C -> 0 | L135: =R[-86]C-R[-43]C -> 0 | M135: =R[-86]C-R[-43]C -> 0 | N135: =R[-86]C-R[-43]C -> 0 | O135: =R[-86]C-R[-43]C -> 0 | P135: =R[-86]C-R[-43]C -> 0 | Q135: =R[-86]C-R[-43]C -> 0 | R135: =R[-86]C-R[-43]C -> 0 | S135: =R[-86]C-R[-43]C -> 0 | T135: =R[-86]C-R[-43]C -> 0 | U135: =R[-86]C-R[-43]C -> 0 | V135: =R[-86]C-R[-43]C -> 0 | W135: =R[-86]C-R[-43]C -> 2 | X135: =R[-86]C-R[-43]C -> 0 | Y135: =R[-86]C-R[-43]C -> 0 | Z135: =R[-86]C-R[-43]C -> 0 | AA135: =R[-86]C-R[-43]C -> 0 | AB135: =R[-86]C-R[-43]C -> 0 | AC135: =R[-86]C-R[-43]C -> 0 | AD135: =R[-86]C-R[-43]C -> 0 | AE135: =R[-86]C-R[-43]C -> 0 | AF135: =R[-86]C-R[-43]C -> 0 | AG135: =R[-86]C-R[-43]C -> 0 | AH135: =R[-86]C-R[-43]C -> 0 | AI135: =R[-86]C-R[-43]C -> 0 | AJ135: =R[-86]C-R[-43]C -> 0 | AK135: =R[-86]C-R[-43]C -> 0 | AL135: =R[-86]C-R[-43]C -> 0 | AM135: =R[-86]C-R[-43]C -> 0 | AN135: =R[-86]C-R[-43]C -> 0 | AO135: =R[-86]C-R[-43]C -> 0 | AP135: =R[-86]C-R[-43]C -> 0 | AQ135: =R[-86]C-R[-43]C -> -1
E136: =R[-86]C-R[-43]C -> -1 | F136: =R[-86]C-R[-43]C -> -1 | G136: =R[-86]C-R[-43]C -> -1 | H136: =R[-86]C-R[-43]C -> -1 | I136: =R[-86]C-R[-43]C -> 0 | J136: =R[-86]C-R[-43]C -> 1 | K136: =R[-86]C-R[-43]C -> 1 | L136: =R[-86]C-R[-43]C -> -1 | M136: =R[-86]C-R[-43]C -> -1 | N136: =R[-86]C-R[-43]C -> 1 | O136: =R[-86]C-R[-43]C -> 1 | P136: =R[-86]C-R[-43]C -> 0 | Q136: =R[-86]C-R[-43]C -> 0 | R136: =R[-86]C-R[-43]C -> 0 | S136: =R[-86]C-R[-43]C -> 2 | T136: =R[-86]C-R[-43]C -> -1 | U136: =R[-86]C-R[-43]C -> -1 | V136: =R[-86]C-R[-43]C -> -1 | W136: =R[-86]C-R[-43]C -> 2 | X136: =R[-86]C-R[-43]C -> -1 | Y136: =R[-86]C-R[-43]C -> -1 | Z136: =R[-86]C-R[-43]C -> -1 | AA136: =R[-86]C-R[-43]C -> -1 | AB136: =R[-86]C-R[-43]C -> -1 | AC136: =R[-86]C-R[-43]C -> 1 | AD136: =R[-86]C-R[-43]C -> 1 | AE136: =R[-86]C-R[-43]C -> 1 | AF136: =R[-86]C-R[-43]C -> 1 | AG136: =R[-86]C-R[-43]C -> 1 | AH136: =R[-86]C-R[-43]C -> 1 | AI136: =R[-86]C-R[-43]C -> -1 | AJ136: =R[-86]C-R[-43]C -> -1 | AK136: =R[-86]C-R[-43]C -> -1 | AL136: =R[-86]C-R[-43]C -> -1 | AM136: =R[-86]C-R[-43]C -> 2 | AN136: =R[-86]C-R[-43]C -> 2 | AO136: =R[-86]C-R[-43]C -> 2 | AP136: =R[-86]C-R[-43]C -> 2 | AQ136: =R[-86]C-R[-43]C -> 2
E137: =R[-86]C-R[-43]C -> 0 | F137: =R[-86]C-R[-43]C -> 0 | G137: =R[-86]C-R[-43]C -> 0 | H137: =R[-86]C-R[-43]C -> 0 | I137: =R[-86]C-R[-43]C -> 0 | J137: =R[-86]C-R[-43]C -> 2 | K137: =R[-86]C-R[-43]C -> 0 | L137: =R[-86]C-R[-43]C -> 2 | M137: =R[-86]C-R[-43]C -> 0 | N137: =R[-86]C-R[-43]C -> -1 | O137: =R[-86]C-R[-43]C -> 0 | P137: =R[-86]C-R[-43]C -> 0 | Q137: =R[-86]C-R[-43]C -> 0 | R137: =R[-86]C-R[-43]C -> 0 | S137: =R[-86]C-R[-43]C -> 2 | T137: =R[-86]C-R[-43]C -> 0 | U137: =R[-86]C-R[-43]C -> -1 | V137: =R[-86]C-R[-43]C -> 2 | W137: =R[-86]C-R[-43]C -> 2 | X137: =R[-86]C-R[-43]C -> 0 | Y137: =R[-86]C-R[-43]C -> 0 | Z137: =R[-86]C-R[-43]C -> 0 | AA137: =R[-86]C-R[-43]C -> 0 | AB137: =R[-86]C-R[-43]C -> 0 | AC137: =R[-86]C-R[-43]C -> 0 | AD137: =R[-86]C-R[-43]C -> 0 | AE137: =R[-86]C-R[-43]C -> 0 | AF137: =R[-86]C-R[-43]C -> 0 | AG137: =R[-86]C-R[-43]C -> 2 | AH137: =R[-86]C-R[-43]C -> 2 | AI137: =R[-86]C-R[-43]C -> 2 | AJ137: =R[-86]C-R[-43]C -> 2 | AK137: =R[-86]C-R[-43]C -> 2 | AL137: =R[-86]C-R[-43]C -> 2 | AM137: =R[-86]C-R[-43]C -> 1 | AN137: =R[-86]C-R[-43]C -> 1 | AO137: =R[-86]C-R[-43]C -> 1 | AP137: =R[-86]C-R[-43]C -> 1 | AQ137: =R[-86]C-R[-43]C -> 1
E138: =R[-86]C-R[-43]C -> 0 | F138: =R[-86]C-R[-43]C -> 0 | G138: =R[-86]C-R[-43]C -> 0 | H138: =R[-86]C-R[-43]C -> 0 | I138: =R[-86]C-R[-43]C -> 0 | J138: =R[-86]C-R[-43]C -> 0 | K138: =R[-86]C-R[-43]C -> 0 | L138: =R[-86]C-R[-43]C -> 0 | M138: =R[-86]C-R[-43]C -> 0 | N138: =R[-86]C-R[-43]C -> 0 | O138: =R[-86]C-R[-43]C -> 0 | P138: =R[-86]C-R[-43]C -> 0 | Q138: =R[-86]C-R[-43]C -> 0 | R138: =R[-86]C-R[-43]C -> 2 | S138: =R[-86]C-R[-43]C -> 4 | T138: =R[-86]C-R[-43]C -> 0 | U138: =R[-86]C-R[-43]C -> 0 | V138: =R[-86]C-R[-43]C -> 0 | W138: =R[-86]C-R[-43]C -> 2 | X138: =R[-86]C-R[-43]C -> 0 | Y138: =R[-86]C-R[-43]C -> 0 | Z138: =R[-86]C-R[-43]C -> 0 | AA138: =R[-86]C-R[-43]C -> 0 | AB138: =R[-86]C-R[-43]C -> 0 | AC138: =R[-86]C-R[-43]C -> 0 | AD138: =R[-86]C-R[-43]C -> 0 | AE138: =R[-86]C-R[-43]C -> 0 | AF138: =R[-86]C-R[-43]C -> 0 | AG138: =R[-86]C-R[-43]C -> 0 | AH138: =R[-86]C-R[-43]C -> 0 | AI138: =R[-86]C-R[-43]C -> 0 | AJ138: =R[-86]C-R[-43]C -> 0 | AK138: =R[-86]C-R[-43]C -> 0 | AL138: =R[-86]C-R[-43]C -> 0 | AM138: =R[-86]C-R[-43]C -> 2 | AN138: =R[-86]C-R[-43]C -> 2 | AO138: =R[-86]C-R[-43]C -> 2 | AP138: =R[-86]C-R[-43]C -> 2 | AQ138: =R[-86]C-R[-43]C -> 2
E139: =R[-86]C-R[-43]C -> 0 | F139: =R[-86]C-R[-43]C -> 0 | G139: =R[-86]C-R[-43]C -> 0 | H139: =R[-86]C-R[-43]C -> 0 | I139: =R[-86]C-R[-43]C -> 0 | J139: =R[-86]C-R[-43]C -> 0 | K139: =R[-86]C-R[-43]C -> 0 | L139: =R[-86]C-R[-43]C -> 0 | M139: =R[-86]C-R[-43]C -> 0 | N139: =R[-86]C-R[-43]C -> 0 | O139: =R[-86]C-R[-43]C -> 0 | P139: =R[-86]C-R[-43]C -> 0 | Q139: =R[-86]C-R[-43]C -> 0 | R139: =R[-86]C-R[-43]C -> 0 | S139: =R[-86]C-R[-43]C -> 2 | T139: =R[-86]C-R[-43]C -> 0 | U139: =R[-86]C-R[-43]C -> 0 | V139: =R[-86]C-R[-43]C -> 0 | W139: =R[-86]C-R[-43]C -> 2 | X139: =R[-86]C-R[-43]C -> 0 | Y139: =R[-86]C-R[-43]C -> 0 | Z139: =R[-86]C-R[-43]C -> 0 | AA139: =R[-86]C-R[-43]C -> 0 | AB139: =R[-86]C-R[-43]C -> 0 | AC139: =R[-86]C-R[-43]C -> 0 | AD139: =R[-86]C-R[-43]C -> 0 | AE139: =R[-86]C-R[-43]C -> 0 | AF139: =R[-86]C-R[-43]C -> 0 | AG139: =R[-86]C-R[-43]C -> 0 | AH139: =R[-86]C-R[-43]C -> 0 | AI139: =R[-86]C-R[-43]C -> 0 | AJ139: =R[-86]C-R[-43]C -> 0 | AK139: =R[-86]C-R[-43]C -> 0 | AL139: =R[-86]C-R[-43]C -> 0 | AM139: =R[-86]C-R[-43]C -> 0 | AN139: =R[-86]C-R[-43]C -> 0 | AO139: =R[-86]C-R[-43]C -> 0 | AP139: =R[-86]C-R[-43]C -> 0 | AQ139: =R[-86]C-R[-43]C -> 0
E140: =R[-86]C-R[-43]C -> 2 | F140: =R[-86]C-R[-43]C -> 2 | G140: =R[-86]C-R[-43]C -> 2 | H140: =R[-86]C-R[-43]C -> 2 | I140: =R[-86]C-R[-43]C -> 2 | J140: =R[-86]C-R[-43]C -> 2 | K140: =R[-86]C-R[-43]C -> 2 | L140: =R[-86]C-R[-43]C -> 2 | M140: =R[-86]C-R[-43]C -> 2 | N140: =R[-86]C-R[-43]C -> 2 | O140: =R[-86]C-R[-43]C -> 2 | P140: =R[-86]C-R[-43]C -> 2 | Q140: =R[-86]C-R[-43]C -> 2 | R140: =R[-86]C-R[-43]C -> 2 | S140: =R[-86]C-R[-43]C -> 2 | T140: =R[-86]C-R[-43]C -> 2 | U140: =R[-86]C-R[-43]C -> 2 | V140: =R[-86]C-R[-43]C -> 2 | W140: =R[-86]C-R[-43]C -> 4 | X140: =R[-86]C-R[-43]C -> 2 | Y140: =R[-86]C-R[-43]C -> 2 | Z140: =R[-86]C-R[-43]C -> 2 | AA140: =R[-86]C-R[-43]C -> 2 | AB140: =R[-86]C-R[-43]C -> 2 | AC140: =R[-86]C-R[-43]C -> 2 | AD140: =R[-86]C-R[-43]C -> 2 | AE140: =R[-86]C-R[-43]C -> 2 | AF140: =R[-86]C-R[-43]C -> 2 | AG140: =R[-86]C-R[-43]C -> 2 | AH140: =R[-86]C-R[-43]C -> 2 | AI140: =R[-86]C-R[-43]C -> 2 | AJ140: =R[-86]C-R[-43]C -> 2 | AK140: =R[-86]C-R[-43]C -> 2 | AL140: =R[-86]C-R[-43]C -> 2 | AM140: =R[-86]C-R[-43]C -> 2 | AN140: =R[-86]C-R[-43]C -> 2 | AO140: =R[-86]C-R[-43]C -> 2 | AP140: =R[-86]C-R[-43]C -> 2 | AQ140: =R[-86]C-R[-43]C -> 2
E141: =R[-86]C-R[-43]C -> 0 | F141: =R[-86]C-R[-43]C -> 0 | G141: =R[-86]C-R[-43]C -> 0 | H141: =R[-86]C-R[-43]C -> 0 | I141: =R[-86]C-R[-43]C -> 0 | J141: =R[-86]C-R[-43]C -> 0 | K141: =R[-86]C-R[-43]C -> 0 | L141: =R[-86]C-R[-43]C -> 0 | M141: =R[-86]C-R[-43]C -> 2 | N141: =R[-86]C-R[-43]C -> 0 | O141: =R[-86]C-R[-43]C -> 0 | P141: =R[-86]C-R[-43]C -> 0 | Q141: =R[-86]C-R[-43]C -> 0 | R141: =R[-86]C-R[-43]C -> 0 | S141: =R[-86]C-R[-43]C -> 4 | T141: =R[-86]C-R[-43]C -> 0 | U141: =R[-86]C-R[-43]C -> 0 | V141: =R[-86]C-R[-43]C -> 0 | W141: =R[-86]C-R[-43]C -> 2 | X141: =R[-86]C-R[-43]C -> 0 | Y141: =R[-86]C-R[-43]C -> 0 | Z141: =R[-86]C-R[-43]C -> 0 | AA141: =R[-86]C-R[-43]C -> 0 | AB141: =R[-86]C-R[-43]C -> 0 | AC141: =R[-86]C-R[-43]C -> 0 | AD141: =R[-86]C-R[-43]C -> 0 | AE141: =R[-86]C-R[-43]C -> 0 | AF141: =R[-86]C-R[-43]C -> 0 | AG141: =R[-86]C-R[-43]C -> 0 | AH141: =R[-86]C-R[-43]C -> 0 | AI141: =R[-86]C-R[-43]C -> 0 | AJ141: =R[-86]C-R[-43]C -> 0 | AK141: =R[-86]C-R[-43]C -> 0 | AL141: =R[-86]C-R[-43]C -> 0 | AM141: =R[-86]C-R[-43]C -> 4 | AN141: =R[-86]C-R[-43]C -> 4 | AO141: =R[-86]C-R[-43]C -> 4 | AP141: =R[-86]C-R[-43]C -> 4 | AQ141: =R[-86]C-R[-43]C -> 4
E142: =R[-86]C-R[-43]C -> 0 | F142: =R[-86]C-R[-43]C -> 0 | G142: =R[-86]C-R[-43]C -> 0 | H142: =R[-86]C-R[-43]C -> 0 | I142: =R[-86]C-R[-43]C -> 2 | J142: =R[-86]C-R[-43]C -> 0 | K142: =R[-86]C-R[-43]C -> 0 | L142: =R[-86]C-R[-43]C -> 0 | M142: =R[-86]C-R[-43]C -> 0 | N142: =R[-86]C-R[-43]C -> 0 | O142: =R[-86]C-R[-43]C -> -1 | P142: =R[-86]C-R[-43]C -> 0 | Q142: =R[-86]C-R[-43]C -> 1 | R142: =R[-86]C-R[-43]C -> 2 | S142: =R[-86]C-R[-43]C -> 4 | T142: =R[-86]C-R[-43]C -> 0 | U142: =R[-86]C-R[-43]C -> 0 | V142: =R[-86]C-R[-43]C -> 0 | W142: =R[-86]C-R[-43]C -> 2 | X142: =R[-86]C-R[-43]C -> 0 | Y142: =R[-86]C-R[-43]C -> 0 | Z142: =R[-86]C-R[-43]C -> 0 | AA142: =R[-86]C-R[-43]C -> 1 | AB142: =R[-86]C-R[-43]C -> 0 | AC142: =R[-86]C-R[-43]C -> 1 | AD142: =R[-86]C-R[-43]C -> 1 | AE142: =R[-86]C-R[-43]C -> 1 | AF142: =R[-86]C-R[-43]C -> 1 | AG142: =R[-86]C-R[-43]C -> 1 | AH142: =R[-86]C-R[-43]C -> 2 | AI142: =R[-86]C-R[-43]C -> 1 | AJ142: =R[-86]C-R[-43]C -> 1 | AK142: =R[-86]C-R[-43]C -> 1 | AL142: =R[-86]C-R[-43]C -> 0 | AM142: =R[-86]C-R[-43]C -> 2 | AN142: =R[-86]C-R[-43]C -> 2 | AO142: =R[-86]C-R[-43]C -> 2 | AP142: =R[-86]C-R[-43]C -> 2 | AQ142: =R[-86]C-R[-43]C -> 2
E143: =R[-86]C-R[-43]C -> 0 | F143: =R[-86]C-R[-43]C -> 0 | G143: =R[-86]C-R[-43]C -> 0 | H143: =R[-86]C-R[-43]C -> 0 | I143: =R[-86]C-R[-43]C -> 0 | J143: =R[-86]C-R[-43]C -> 0 | K143: =R[-86]C-R[-43]C -> 0 | L143: =R[-86]C-R[-43]C -> 0 | M143: =R[-86]C-R[-43]C -> 0 | N143: =R[-86]C-R[-43]C -> 0 | O143: =R[-86]C-R[-43]C -> 0 | P143: =R[-86]C-R[-43]C -> 0 | Q143: =R[-86]C-R[-43]C -> 0 | R143: =R[-86]C-R[-43]C -> 0 | S143: =R[-86]C-R[-43]C -> 2 | T143: =R[-86]C-R[-43]C -> 0 | U143: =R[-86]C-R[-43]C -> 0 | V143: =R[-86]C-R[-43]C -> 0 | W143: =R[-86]C-R[-43]C -> 2 | X143: =R[-86]C-R[-43]C -> 0 | Y143: =R[-86]C-R[-43]C -> 0 | Z143: =R[-86]C-R[-43]C -> 0 | AA143: =R[-86]C-R[-43]C -> 2 | AB143: =R[-86]C-R[-43]C -> 2 | AC143: =R[-86]C-R[-43]C -> 2 | AD143: =R[-86]C-R[-43]C -> 2 | AE143: =R[-86]C-R[-43]C -> 2 | AF143: =R[-86]C-R[-43]C -> 2 | AG143: =R[-86]C-R[-43]C -> 2 | AH143: =R[-86]C-R[-43]C -> 2 | AI143: =R[-86]C-R[-43]C -> 2 | AJ143: =R[-86]C-R[-43]C -> 2 | AK143: =R[-86]C-R[-43]C -> 2 | AL143: =R[-86]C-R[-43]C -> 2 | AM143: =R[-86]C-R[-43]C -> 2 | AN143: =R[-86]C-R[-43]C -> 2 | AO143: =R[-86]C-R[-43]C -> 2 | AP143: =R[-86]C-R[-43]C -> 2 | AQ143: =R[-86]C-R[-43]C -> 2
E144: =R[-86]C-R[-43]C -> 1 | F144: =R[-86]C-R[-43]C -> 2 | G144: =R[-86]C-R[-43]C -> 2 | H144: =R[-86]C-R[-43]C -> 2 | I144: =R[-86]C-R[-43]C -> 2 | J144: =R[-86]C-R[-43]C -> 2 | K144: =R[-86]C-R[-43]C -> 2 | L144: =R[-86]C-R[-43]C -> 2 | M144: =R[-86]C-R[-43]C -> 2 | N144: =R[-86]C-R[-43]C -> 2 | O144: =R[-86]C-R[-43]C -> 2 | P144: =R[-86]C-R[-43]C -> 2 | Q144: =R[-86]C-R[-43]C -> 2 | R144: =R[-86]C-R[-43]C -> 2 | S144: =R[-86]C-R[-43]C -> 2 | T144: =R[-86]C-R[-43]C -> 2 | U144: =R[-86]C-R[-43]C -> 2 | V144: =R[-86]C-R[-43]C -> 2 | W144: =R[-86]C-R[-43]C -> 2 | X144: =R[-86]C-R[-43]C -> 2 | Y144: =R[-86]C-R[-43]C -> 2 | Z144: =R[-86]C-R[-43]C -> 2 | AA144: =R[-86]C-R[-43]C -> 2 | AB144: =R[-86]C-R[-43]C -> 2 | AC144: =R[-86]C-R[-43]C -> 2 | AD144: =R[-86]C-R[-43]C -> 2 | AE144: =R[-86]C-R[-43]C -> 2 | AF144: =R[-86]C-R[-43]C -> 2 | AG144: =R[-86]C-R[-43]C -> 2 | AH144: =R[-86]C-R[-43]C -> 2 | AI144: =R[-86]C-R[-43]C -> 2 | AJ144: =R[-86]C-R[-43]C -> 2 | AK144: =R[-86]C-R[-43]C -> 2 | AL144: =R[-86]C-R[-43]C -> 2 | AM144: =R[-86]C-R[-43]C -> 2 | AN144: =R[-86]C-R[-43]C -> 2 | AO144: =R[-86]C-R[-43]C -> 2 | AP144: =R[-86]C-R[-43]C -> 2 | AQ144: =R[-86]C-R[-43]C -> 2
E145: =R[-86]C-R[-43]C -> 0 | F145: =R[-86]C-R[-43]C -> 0 | G145: =R[-86]C-R[-43]C -> 0 | H145: =R[-86]C-R[-43]C -> 2 | I145: =R[-86]C-R[-43]C -> 0 | J145: =R[-86]C-R[-43]C -> 0 | K145: =R[-86]C-R[-43]C -> 0 | L145: =R[-86]C-R[-43]C -> 0 | M145: =R[-86]C-R[-43]C -> 0 | N145: =R[-86]C-R[-43]C -> 0 | O145: =R[-86]C-R[-43]C -> 0 | P145: =R[-86]C-R[-43]C -> 2 | Q145: =R[-86]C-R[-43]C -> 0 | R145: =R[-86]C-R[-43]C -> 0 | S145: =R[-86]C-R[-43]C -> 2 | T145: =R[-86]C-R[-43]C -> 0 | U145: =R[-86]C-R[-43]C -> 0 | V145: =R[-86]C-R[-43]C -> 0 | W145: =R[-86]C-R[-43]C -> 2 | X145: =R[-86]C-R[-43]C -> 0 | Y145: =R[-86]C-R[-43]C -> 0 | Z145: =R[-86]C-R[-43]C -> 0 | AA145: =R[-86]C-R[-43]C -> 0 | AB145: =R[-86]C-R[-43]C -> 0 | AC145: =R[-86]C-R[-43]C -> -1 | AD145: =R[-86]C-R[-43]C -> -1 | AE145: =R[-86]C-R[-43]C -> -1 | AF145: =R[-86]C-R[-43]C -> 0 | AG145: =R[-86]C-R[-43]C -> 0 | AH145: =R[-86]C-R[-43]C -> 0 | AI145: =R[-86]C-R[-43]C -> 0 | AJ145: =R[-86]C-R[-43]C -> -1 | AK145: =R[-86]C-R[-43]C -> -1 | AL145: =R[-86]C-R[-43]C -> 0 | AM145: =R[-86]C-R[-43]C -> -1 | AN145: =R[-86]C-R[-43]C -> -1 | AO145: =R[-86]C-R[-43]C -> -1 | AP145: =R[-86]C-R[-43]C -> -1 | AQ145: =R[-86]C-R[-43]C -> 0
E146: =R[-86]C-R[-43]C -> 0 | F146: =R[-86]C-R[-43]C -> 0 | G146: =R[-86]C-R[-43]C -> 0 | H146: =R[-86]C-R[-43]C -> 0 | I146: =R[-86]C-R[-43]C -> 0 | J146: =R[-86]C-R[-43]C -> 0 | K146: =R[-86]C-R[-43]C -> 0 | L146: =R[-86]C-R[-43]C -> 0 | M146: =R[-86]C-R[-43]C -> 0 | N146: =R[-86]C-R[-43]C -> 0 | O146: =R[-86]C-R[-43]C -> 0 | P146: =R[-86]C-R[-43]C -> 0 | Q146: =R[-86]C-R[-43]C -> 0 | R146: =R[-86]C-R[-43]C -> 0 | S146: =R[-86]C-R[-43]C -> 2 | T146: =R[-86]C-R[-43]C -> 0 | U146: =R[-86]C-R[-43]C -> 0 | V146: =R[-86]C-R[-43]C -> 0 | W146: =R[-86]C-R[-43]C -> 2 | X146: =R[-86]C-R[-43]C -> 0 | Y146: =R[-86]C-R[-43]C -> 0 | Z146: =R[-86]C-R[-43]C -> 0 | AA146: =R[-86]C-R[-43]C -> 0 | AB146: =R[-86]C-R[-43]C -> 0 | AC146: =R[-86]C-R[-43]C -> 0 | AD146: =R[-86]C-R[-43]C -> 0 | AE146: =R[-86]C-R[-43]C -> 0 | AF146: =R[-86]C-R[-43]C -> 0 | AG146: =R[-86]C-R[-43]C -> 0 | AH146: =R[-86]C-R[-43]C -> 0 | AI146: =R[-86]C-R[-43]C -> 0 | AJ146: =R[-86]C-R[-43]C -> 0 | AK146: =R[-86]C-R[-43]C -> 0 | AL146: =R[-86]C-R[-43]C -> 0 | AM146: =R[-86]C-R[-43]C -> 2 | AN146: =R[-86]C-R[-43]C -> 2 | AO146: =R[-86]C-R[-43]C -> 2 | AP146: =R[-86]C-R[-43]C -> 2 | AQ146: =R[-86]C-R[-43]C -> 2
E147: =R[-86]C-R[-43]C -> 0 | F147: =R[-86]C-R[-43]C -> -1 | G147: =R[-86]C-R[-43]C -> 0 | H147: =R[-86]C-R[-43]C -> 0 | I147: =R[-86]C-R[-43]C -> 2 | J147: =R[-86]C-R[-43]C -> 0 | K147: =R[-86]C-R[-43]C -> 0 | L147: =R[-86]C-R[-43]C -> 0 | M147: =R[-86]C-R[-43]C -> 0 | N147: =R[-86]C-R[-43]C -> 0 | O147: =R[-86]C-R[-43]C -> 0 | P147: =R[-86]C-R[-43]C -> 1 | Q147: =R[-86]C-R[-43]C -> 0 | R147: =R[-86]C-R[-43]C -> 0 | S147: =R[-86]C-R[-43]C -> 2 | T147: =R[-86]C-R[-43]C -> 0 | U147: =R[-86]C-R[-43]C -> 0 | V147: =R[-86]C-R[-43]C -> 0 | W147: =R[-86]C-R[-43]C -> 2 | X147: =R[-86]C-R[-43]C -> 0 | Y147: =R[-86]C-R[-43]C -> 0 | Z147: =R[-86]C-R[-43]C -> 0 | AA147: =R[-86]C-R[-43]C -> 0 | AB147: =R[-86]C-R[-43]C -> 0 | AC147: =R[-86]C-R[-43]C -> -1 | AD147: =R[-86]C-R[-43]C -> -1 | AE147: =R[-86]C-R[-43]C -> -1 | AF147: =R[-86]C-R[-43]C -> 0 | AG147: =R[-86]C-R[-43]C -> 0 | AH147: =R[-86]C-R[-43]C -> 0 | AI147: =R[-86]C-R[-43]C -> 0 | AJ147: =R[-86]C-R[-43]C -> 0 | AK147: =R[-86]C-R[-43]C -> 0 | AL147: =R[-86]C-R[-43]C -> 0 | AM147: =R[-86]C-R[-43]C -> 2 | AN147: =R[-86]C-R[-43]C -> 2 | AO147: =R[-86]C-R[-43]C -> 2 | AP147: =R[-86]C-R[-43]C -> 2 | AQ147: =R[-86]C-R[-43]C -> 2
E148: =R[-86]C-R[-43]C -> 1 | F148: =R[-86]C-R[-43]C -> 1 | G148: =R[-86]C-R[-43]C -> 1 | H148: =R[-86]C-R[-43]C -> 1 | I148: =R[-86]C-R[-43]C -> 0 | J148: =R[-86]C-R[-43]C -> 0 | K148: =R[-86]C-R[-43]C -> 1 | L148: =R[-86]C-R[-43]C -> 1 | M148: =R[-86]C-R[-43]C -> 1 | N148: =R[-86]C-R[-43]C -> 1 | O148: =R[-86]C-R[-43]C -> 0 | P148: =R[-86]C-R[-43]C -> 1 | Q148: =R[-86]C-R[-43]C -> 0 | R148: =R[-86]C-R[-43]C -> 0 | S148: =R[-86]C-R[-43]C -> 2 | T148: =R[-86]C-R[-43]C -> 0 | U148: =R[-86]C-R[-43]C -> 0 | V148: =R[-86]C-R[-43]C -> 0 | W148: =R[-86]C-R[-43]C -> 2 | X148: =R[-86]C-R[-43]C -> 1 | Y148: =R[-86]C-R[-43]C -> 1 | Z148: =R[-86]C-R[-43]C -> 1 | AA148: =R[-86]C-R[-43]C -> 1 | AB148: =R[-86]C-R[-43]C -> 1 | AC148: =R[-86]C-R[-43]C -> 1 | AD148: =R[-86]C-R[-43]C -> 1 | AE148: =R[-86]C-R[-43]C -> 1 | AF148: =R[-86]C-R[-43]C -> 1 | AG148: =R[-86]C-R[-43]C -> 1 | AH148: =R[-86]C-R[-43]C -> 1 | AI148: =R[-86]C-R[-43]C -> 1 | AJ148: =R[-86]C-R[-43]C -> 1 | AK148: =R[-86]C-R[-43]C -> 1 | AL148: =R[-86]C-R[-43]C -> 1 | AM148: =R[-86]C-R[-43]C -> 2 | AN148: =R[-86]C-R[-43]C -> 2 | AO148: =R[-86]C-R[-43]C -> 2 | AP148: =R[-86]C-R[-43]C -> 2 | AQ148: =R[-86]C-R[-43]C -> 2
E149: =R[-86]C-R[-43]C -> 3 | F149: =R[-86]C-R[-43]C -> 4 | G149: =R[-86]C-R[-43]C -> 4 | H149: =R[-86]C-R[-43]C -> 2 | I149: =R[-86]C-R[-43]C -> 4 | J149: =R[-86]C-R[-43]C -> 4 | K149: =R[-86]C-R[-43]C -> 4 | L149: =R[-86]C-R[-43]C -> 4 | M149: =R[-86]C-R[-43]C -> 4 | N149: =R[-86]C-R[-43]C -> 4 | O149: =R[-86]C-R[-43]C -> 4 | P149: =R[-86]C-R[-43]C -> 4 | Q149: =R[-86]C-R[-43]C -> 4 | R149: =R[-86]C-R[-43]C -> 2 | S149: =R[-86]C-R[-43]C -> 2 | T149: =R[-86]C-R[-43]C -> 4 | U149: =R[-86]C-R[-43]C -> 4 | V149: =R[-86]C-R[-43]C -> 2 | W149: =R[-86]C-R[-43]C -> 4 | X149: =R[-86]C-R[-43]C -> 4 | Y149: =R[-86]C-R[-43]C -> 4 | Z149: =R[-86]C-R[-43]C -> 4 | AA149: =R[-86]C-R[-43]C -> 3 | AB149: =R[-86]C-R[-43]C -> 0 | AC149: =R[-86]C-R[-43]C -> 0 | AD149: =R[-86]C-R[-43]C -> 0 | AE149: =R[-86]C-R[-43]C -> 0 | AF149: =R[-86]C-R[-43]C -> 4 | AG149: =R[-86]C-R[-43]C -> 4 | AH149: =R[-86]C-R[-43]C -> 2 | AI149: =R[-86]C-R[-43]C -> 2 | AJ149: =R[-86]C-R[-43]C -> 2 | AK149: =R[-86]C-R[-43]C -> 2 | AL149: =R[-86]C-R[-43]C -> 2 | AM149: =R[-86]C-R[-43]C -> 2 | AN149: =R[-86]C-R[-43]C -> 2 | AO149: =R[-86]C-R[-43]C -> 2 | AP149: =R[-86]C-R[-43]C -> 2 | AQ149: =R[-86]C-R[-43]C -> 2
E150: =R[-86]C-R[-43]C -> 2 | F150: =R[-86]C-R[-43]C -> 2 | G150: =R[-86]C-R[-43]C -> 2 | H150: =R[-86]C-R[-43]C -> 2 | I150: =R[-86]C-R[-43]C -> 2 | J150: =R[-86]C-R[-43]C -> 2 | K150: =R[-86]C-R[-43]C -> 2 | L150: =R[-86]C-R[-43]C -> 2 | M150: =R[-86]C-R[-43]C -> 2 | N150: =R[-86]C-R[-43]C -> 2 | O150: =R[-86]C-R[-43]C -> 2 | P150: =R[-86]C-R[-43]C -> 2 | Q150: =R[-86]C-R[-43]C -> 2 | R150: =R[-86]C-R[-43]C -> 2 | S150: =R[-86]C-R[-43]C -> 2 | T150: =R[-86]C-R[-43]C -> 2 | U150: =R[-86]C-R[-43]C -> 2 | V150: =R[-86]C-R[-43]C -> 2 | W150: =R[-86]C-R[-43]C -> 4 | X150: =R[-86]C-R[-43]C -> 2 | Y150: =R[-86]C-R[-43]C -> 2 | Z150: =R[-86]C-R[-43]C -> 2 | AA150: =R[-86]C-R[-43]C -> 2 | AB150: =R[-86]C-R[-43]C -> 2 | AC150: =R[-86]C-R[-43]C -> 2 | AD150: =R[-86]C-R[-43]C -> 2 | AE150: =R[-86]C-R[-43]C -> 2 | AF150: =R[-86]C-R[-43]C -> 2 | AG150: =R[-86]C-R[-43]C -> 2 | AH150: =R[-86]C-R[-43]C -> 2 | AI150: =R[-86]C-R[-43]C -> 2 | AJ150: =R[-86]C-R[-43]C -> 2 | AK150: =R[-86]C-R[-43]C -> 2 | AL150: =R[-86]C-R[-43]C -> 2 | AM150: =R[-86]C-R[-43]C -> 2 | AN150: =R[-86]C-R[-43]C -> 2 | AO150: =R[-86]C-R[-43]C -> 2 | AP150: =R[-86]C-R[-43]C -> 2 | AQ150: =R[-86]C-R[-43]C -> 2
E151: =R[-86]C-R[-43]C -> 0 | F151: =R[-86]C-R[-43]C -> 0 | G151: =R[-86]C-R[-43]C -> 0 | H151: =R[-86]C-R[-43]C -> 0 | I151: =R[-86]C-R[-43]C -> 0 | J151: =R[-86]C-R[-43]C -> 0 | K151: =R[-86]C-R[-43]C -> 0 | L151: =R[-86]C-R[-43]C -> 0 | M151: =R[-86]C-R[-43]C -> 0 | N151: =R[-86]C-R[-43]C -> 0 | O151: =R[-86]C-R[-43]C -> 0 | P151: =R[-86]C-R[-43]C -> 0 | Q151: =R[-86]C-R[-43]C -> 0 | R151: =R[-86]C-R[-43]C -> 0 | S151: =R[-86]C-R[-43]C -> 2 | T151: =R[-86]C-R[-43]C -> 0 | U151: =R[-86]C-R[-43]C -> 0 | V151: =R[-86]C-R[-43]C -> 0 | W151: =R[-86]C-R[-43]C -> 2 | X151: =R[-86]C-R[-43]C -> 0 | Y151: =R[-86]C-R[-43]C -> 0 | Z151: =R[-86]C-R[-43]C -> 0 | AA151: =R[-86]C-R[-43]C -> 2 | AB151: =R[-86]C-R[-43]C -> 2 | AC151: =R[-86]C-R[-43]C -> 2 | AD151: =R[-86]C-R[-43]C -> 2 | AE151: =R[-86]C-R[-43]C -> 2 | AF151: =R[-86]C-R[-43]C -> 2 | AG151: =R[-86]C-R[-43]C -> 2 | AH151: =R[-86]C-R[-43]C -> 2 | AI151: =R[-86]C-R[-43]C -> 2 | AJ151: =R[-86]C-R[-43]C -> 2 | AK151: =R[-86]C-R[-43]C -> 2 | AL151: =R[-86]C-R[-43]C -> 2 | AM151: =R[-86]C-R[-43]C -> 2 | AN151: =R[-86]C-R[-43]C -> 2 | AO151: =R[-86]C-R[-43]C -> 2 | AP151: =R[-86]C-R[-43]C -> 2 | AQ151: =R[-86]C-R[-43]C -> 2
E152: =R[-86]C-R[-43]C -> 2 | F152: =R[-86]C-R[-43]C -> 2 | G152: =R[-86]C-R[-43]C -> 2 | H152: =R[-86]C-R[-43]C -> 2 | I152: =R[-86]C-R[-43]C -> 2 | J152: =R[-86]C-R[-43]C -> 2 | K152: =R[-86]C-R[-43]C -> 2 | L152: =R[-86]C-R[-43]C -> 2 | M152: =R[-86]C-R[-43]C -> 2 | N152: =R[-86]C-R[-43]C -> 2 | O152: =R[-86]C-R[-43]C -> 2 | P152: =R[-86]C-R[-43]C -> 2 | Q152: =R[-86]C-R[-43]C -> 2 | R152: =R[-86]C-R[-43]C -> 2 | S152: =R[-86]C-R[-43]C -> 2 | T152: =R[-86]C-R[-43]C -> 2 | U152: =R[-86]C-R[-43]C -> 2 | V152: =R[-86]C-R[-43]C -> 2 | W152: =R[-86]C-R[-43]C -> 4 | X152: =R[-86]C-R[-43]C -> 2 | Y152: =R[-86]C-R[-43]C -> 2 | Z152: =R[-86]C-R[-43]C -> 2 | AA152: =R[-86]C-R[-43]C -> 2 | AB152: =R[-86]C-R[-43]C -> 2 | AC152: =R[-86]C-R[-43]C -> 2 | AD152: =R[-86]C-R[-43]C -> 2 | AE152: =R[-86]C-R[-43]C -> 2 | AF152: =R[-86]C-R[-43]C -> 2 | AG152: =R[-86]C-R[-43]C -> 2 | AH152: =R[-86]C-R[-43]C -> 2 | AI152: =R[-86]C-R[-43]C -> 2 | AJ152: =R[-86]C-R[-43]C -> 2 | AK152: =R[-86]C-R[-43]C -> 2 | AL152: =R[-86]C-R[-43]C -> 2 | AM152: =R[-86]C-R[-43]C -> 2 | AN152: =R[-86]C-R[-43]C -> 2 | AO152: =R[-86]C-R[-43]C -> 2 | AP152: =R[-86]C-R[-43]C -> 2 | AQ152: =R[-86]C-R[-43]C -> 2
E153: =R[-86]C-R[-43]C -> 2 | F153: =R[-86]C-R[-43]C -> 2 | G153: =R[-86]C-R[-43]C -> 2 | H153: =R[-86]C-R[-43]C -> 2 | I153: =R[-86]C-R[-43]C -> 2 | J153: =R[-86]C-R[-43]C -> 1 | K153: =R[-86]C-R[-43]C -> 1 | L153: =R[-86]C-R[-43]C -> 2 | M153: =R[-86]C-R[-43]C -> 2 | N153: =R[-86]C-R[-43]C -> 2 | O153: =R[-86]C-R[-43]C -> 2 | P153: =R[-86]C-R[-43]C -> 2 | Q153: =R[-86]C-R[-43]C -> 2 | R153: =R[-86]C-R[-43]C -> 2 | S153: =R[-86]C-R[-43]C -> 4 | T153: =R[-86]C-R[-43]C -> 1 | U153: =R[-86]C-R[-43]C -> 0 | V153: =R[-86]C-R[-43]C -> 0 | W153: =R[-86]C-R[-43]C -> 2 | X153: =R[-86]C-R[-43]C -> 1 | Y153: =R[-86]C-R[-43]C -> 1 | Z153: =R[-86]C-R[-43]C -> 1 | AA153: =R[-86]C-R[-43]C -> 3 | AB153: =R[-86]C-R[-43]C -> 1 | AC153: =R[-86]C-R[-43]C -> 3 | AD153: =R[-86]C-R[-43]C -> 3 | AE153: =R[-86]C-R[-43]C -> 3 | AF153: =R[-86]C-R[-43]C -> 3 | AG153: =R[-86]C-R[-43]C -> 3 | AH153: =R[-86]C-R[-43]C -> 3 | AI153: =R[-86]C-R[-43]C -> 1 | AJ153: =R[-86]C-R[-43]C -> 1 | AK153: =R[-86]C-R[-43]C -> 1 | AL153: =R[-86]C-R[-43]C -> 1 | AM153: =R[-86]C-R[-43]C -> 2 | AN153: =R[-86]C-R[-43]C -> 2 | AO153: =R[-86]C-R[-43]C -> 2 | AP153: =R[-86]C-R[-43]C -> 2 | AQ153: =R[-86]C-R[-43]C -> 2
E154: =R[-86]C-R[-43]C -> 1 | F154: =R[-86]C-R[-43]C -> 1 | G154: =R[-86]C-R[-43]C -> 1 | H154: =R[-86]C-R[-43]C -> 1 | I154: =R[-86]C-R[-43]C -> 1 | J154: =R[-86]C-R[-43]C -> 0 | K154: =R[-86]C-R[-43]C -> 1 | L154: =R[-86]C-R[-43]C -> 0 | M154: =R[-86]C-R[-43]C -> 0 | N154: =R[-86]C-R[-43]C -> 0 | O154: =R[-86]C-R[-43]C -> 0 | P154: =R[-86]C-R[-43]C -> 0 | Q154: =R[-86]C-R[-43]C -> 0 | R154: =R[-86]C-R[-43]C -> 0 | S154: =R[-86]C-R[-43]C -> 2 | T154: =R[-86]C-R[-43]C -> 0 | U154: =R[-86]C-R[-43]C -> 1 | V154: =R[-86]C-R[-43]C -> 0 | W154: =R[-86]C-R[-43]C -> 2 | X154: =R[-86]C-R[-43]C -> 1 | Y154: =R[-86]C-R[-43]C -> 1 | Z154: =R[-86]C-R[-43]C -> 1 | AA154: =R[-86]C-R[-43]C -> 2 | AB154: =R[-86]C-R[-43]C -> 2 | AC154: =R[-86]C-R[-43]C -> 2 | AD154: =R[-86]C-R[-43]C -> 2 | AE154: =R[-86]C-R[-43]C -> 2 | AF154: =R[-86]C-R[-43]C -> 2 | AG154: =R[-86]C-R[-43]C -> 2 | AH154: =R[-86]C-R[-43]C -> 2 | AI154: =R[-86]C-R[-43]C -> 2 | AJ154: =R[-86]C-R[-43]C -> 2 | AK154: =R[-86]C-R[-43]C -> 2 | AL154: =R[-86]C-R[-43]C -> 2 | AM154: =R[-86]C-R[-43]C -> 2 | AN154: =R[-86]C-R[-43]C -> 2 | AO154: =R[-86]C-R[-43]C -> 2 | AP154: =R[-86]C-R[-43]C -> 2 | AQ154: =R[-86]C-R[-43]C -> 2
E155: =R[-86]C-R[-43]C -> 0 | F155: =R[-86]C-R[-43]C -> 0 | G155: =R[-86]C-R[-43]C -> 0 | H155: =R[-86]C-R[-43]C -> 0 | I155: =R[-86]C-R[-43]C -> 0 | J155: =R[-86]C-R[-43]C -> 0 | K155: =R[-86]C-R[-43]C -> 0 | L155: =R[-86]C-R[-43]C -> 0 | M155: =R[-86]C-R[-43]C -> 0 | N155: =R[-86]C-R[-43]C -> 0 | O155: =R[-86]C-R[-43]C -> 2 | P155: =R[-86]C-R[-43]C -> 2 | Q155: =R[-86]C-R[-43]C -> 0 | R155: =R[-86]C-R[-43]C -> 2 | S155: =R[-86]C-R[-43]C -> 3 | T155: =R[-86]C-R[-43]C -> 0 | U155: =R[-86]C-R[-43]C -> 0 | V155: =R[-86]C-R[-43]C -> 2 | W155: =R[-86]C-R[-43]C -> 2 | X155: =R[-86]C-R[-43]C -> 0 | Y155: =R[-86]C-R[-43]C -> 0 | Z155: =R[-86]C-R[-43]C -> 0 | AA155: =R[-86]C-R[-43]C -> 0 | AB155: =R[-86]C-R[-43]C -> 0 | AC155: =R[-86]C-R[-43]C -> 0 | AD155: =R[-86]C-R[-43]C -> 0 | AE155: =R[-86]C-R[-43]C -> 0 | AF155: =R[-86]C-R[-43]C -> 0 | AG155: =R[-86]C-R[-43]C -> 0 | AH155: =R[-86]C-R[-43]C -> 0 | AI155: =R[-86]C-R[-43]C -> 0 | AJ155: =R[-86]C-R[-43]C -> 0 | AK155: =R[-86]C-R[-43]C -> 0 | AL155: =R[-86]C-R[-43]C -> 0 | AM155: =R[-86]C-R[-43]C -> 2 | AN155: =R[-86]C-R[-43]C -> 2 | AO155: =R[-86]C-R[-43]C -> 2 | AP155: =R[-86]C-R[-43]C -> 2 | AQ155: =R[-86]C-R[-43]C -> 2
E156: =R[-86]C-R[-43]C -> 1 | F156: =R[-86]C-R[-43]C -> 1 | G156: =R[-86]C-R[-43]C -> 1 | H156: =R[-86]C-R[-43]C -> 0 | I156: =R[-86]C-R[-43]C -> 0 | J156: =R[-86]C-R[-43]C -> 1 | K156: =R[-86]C-R[-43]C -> 1 | L156: =R[-86]C-R[-43]C -> 1 | M156: =R[-86]C-R[-43]C -> 0 | N156: =R[-86]C-R[-43]C -> 1 | O156: =R[-86]C-R[-43]C -> 1 | P156: =R[-86]C-R[-43]C -> 0 | Q156: =R[-86]C-R[-43]C -> 0 | R156: =R[-86]C-R[-43]C -> 1 | S156: =R[-86]C-R[-43]C -> 3 | T156: =R[-86]C-R[-43]C -> 1 | U156: =R[-86]C-R[-43]C -> 1 | V156: =R[-86]C-R[-43]C -> 0 | W156: =R[-86]C-R[-43]C -> 2 | X156: =R[-86]C-R[-43]C -> 1 | Y156: =R[-86]C-R[-43]C -> 1 | Z156: =R[-86]C-R[-43]C -> 1 | AA156: =R[-86]C-R[-43]C -> 1 | AB156: =R[-86]C-R[-43]C -> 1 | AC156: =R[-86]C-R[-43]C -> 1 | AD156: =R[-86]C-R[-43]C -> 1 | AE156: =R[-86]C-R[-43]C -> 1 | AF156: =R[-86]C-R[-43]C -> 1 | AG156: =R[-86]C-R[-43]C -> 1 | AH156: =R[-86]C-R[-43]C -> 1 | AI156: =R[-86]C-R[-43]C -> 1 | AJ156: =R[-86]C-R[-43]C -> 1 | AK156: =R[-86]C-R[-43]C -> 1 | AL156: =R[-86]C-R[-43]C -> 1 | AM156: =R[-86]C-R[-43]C -> 1 | AN156: =R[-86]C-R[-43]C -> 1 | AO156: =R[-86]C-R[-43]C -> 1 | AP156: =R[-86]C-R[-43]C -> 1 | AQ156: =R[-86]C-R[-43]C -> 1
E157: =R[-86]C-R[-43]C -> -1 | F157: =R[-86]C-R[-43]C -> -1 | G157: =R[-86]C-R[-43]C -> -1 | H157: =R[-86]C-R[-43]C -> -1 | I157: =R[-86]C-R[-43]C -> 0 | J157: =R[-86]C-R[-43]C -> -1 | K157: =R[-86]C-R[-43]C -> -1 | L157: =R[-86]C-R[-43]C -> -1 | M157: =R[-86]C-R[-43]C -> -1 | N157: =R[-86]C-R[-43]C -> -1 | O157: =R[-86]C-R[-43]C -> -1 | P157: =R[-86]C-R[-43]C -> 0 | Q157: =R[-86]C-R[-43]C -> 0 | R157: =R[-86]C-R[-43]C -> 0 | S157: =R[-86]C-R[-43]C -> 2 | T157: =R[-86]C-R[-43]C -> -1 | U157: =R[-86]C-R[-43]C -> -1 | V157: =R[-86]C-R[-43]C -> -1 | W157: =R[-86]C-R[-43]C -> 2 | X157: =R[-86]C-R[-43]C -> -1 | Y157: =R[-86]C-R[-43]C -> -1 | Z157: =R[-86]C-R[-43]C -> -1 | AA157: =R[-86]C-R[-43]C -> -1 | AB157: =R[-86]C-R[-43]C -> -1 | AC157: =R[-86]C-R[-43]C -> -1 | AD157: =R[-86]C-R[-43]C -> -1 | AE157: =R[-86]C-R[-43]C -> -1 | AF157: =R[-86]C-R[-43]C -> -1 | AG157: =R[-86]C-R[-43]C -> -1 | AH157: =R[-86]C-R[-43]C -> -1 | AI157: =R[-86]C-R[-43]C -> 1 | AJ157: =R[-86]C-R[-43]C -> 1 | AK157: =R[-86]C-R[-43]C -> 1 | AL157: =R[-86]C-R[-43]C -> -1 | AM157: =R[-86]C-R[-43]C -> 2 | AN157: =R[-86]C-R[-43]C -> 2 | AO157: =R[-86]C-R[-43]C -> 2 | AP157: =R[-86]C-R[-43]C -> 2 | AQ157: =R[-86]C-R[-43]C -> 2
E158: =R[-86]C-R[-43]C -> 2 | F158: =R[-86]C-R[-43]C -> 2 | G158: =R[-86]C-R[-43]C -> 2 | H158: =R[-86]C-R[-43]C -> 2 | I158: =R[-86]C-R[-43]C -> 0 | J158: =R[-86]C-R[-43]C -> 2 | K158: =R[-86]C-R[-43]C -> 2 | L158: =R[-86]C-R[-43]C -> 2 | M158: =R[-86]C-R[-43]C -> 2 | N158: =R[-86]C-R[-43]C -> 2 | O158: =R[-86]C-R[-43]C -> 2 | P158: =R[-86]C-R[-43]C -> 0 | Q158: =R[-86]C-R[-43]C -> 0 | R158: =R[-86]C-R[-43]C -> 2 | S158: =R[-86]C-R[-43]C -> 2 | T158: =R[-86]C-R[-43]C -> 2 | U158: =R[-86]C-R[-43]C -> 2 | V158: =R[-86]C-R[-43]C -> 0 | W158: =R[-86]C-R[-43]C -> 2 | X158: =R[-86]C-R[-43]C -> 2 | Y158: =R[-86]C-R[-43]C -> 2 | Z158: =R[-86]C-R[-43]C -> 2 | AA158: =R[-86]C-R[-43]C -> 2 | AB158: =R[-86]C-R[-43]C -> 2 | AC158: =R[-86]C-R[-43]C -> 2 | AD158: =R[-86]C-R[-43]C -> 2 | AE158: =R[-86]C-R[-43]C -> 2 | AF158: =R[-86]C-R[-43]C -> 2 | AG158: =R[-86]C-R[-43]C -> 2 | AH158: =R[-86]C-R[-43]C -> 2 | AI158: =R[-86]C-R[-43]C -> 1 | AJ158: =R[-86]C-R[-43]C -> 1 | AK158: =R[-86]C-R[-43]C -> 1 | AL158: =R[-86]C-R[-43]C -> 2 | AM158: =R[-86]C-R[-43]C -> 2 | AN158: =R[-86]C-R[-43]C -> 2 | AO158: =R[-86]C-R[-43]C -> 2 | AP158: =R[-86]C-R[-43]C -> 2 | AQ158: =R[-86]C-R[-43]C -> 2

Sheet: Ranking
A1: 'Rank | B1: 'Country | C1: =Selection!RC[+1] -> Recurrent Expenditure (Euros) - Staff / Library Staff FTE - Total Staff | D1: 'Data
A2: 1 | B2: =IF(ISERROR(Selection!RC[+2]), "", IF(ISERROR(Selection!RC[+2]), "", Selection!RC[+4])) -> Denmark | C2: =IF(ISERROR(Selection!RC[+1]), "", IF(ISERROR(Selection!RC[+1]), "", Selection!RC[+1])) -> 42413.6551724138 | D2: =IF(EQUAL(RC[-1], ""), "", IF(EQUAL(Menus!R10C11, "2001Grossed"), VLOOKUP(MAX(Selection!RC[+9]:RC[+10]), R2C14:R4C15, 2), "")) -> Returned Data for year 2001 | E2: 'To Change the number of | N2: 0 | O2: 'Returned Data for year 2001
A3: =1+R[-1]C -> 2 | B3: =IF(ISERROR(Selection!RC[+2]), "", IF(ISERROR(Selection!RC[+2]), "", Selection!RC[+4])) -> Norway | C3: =IF(ISERROR(Selection!RC[+1]), "", IF(ISERROR(Selection!RC[+1]), "", Selection!RC[+1])) -> 40033.0912863071 | D3: =IF(EQUAL(RC[-1], ""), "", IF(EQUAL(Menus!R10C11, "2001Grossed"), VLOOKUP(MAX(Selection!RC[+9]:RC[+10]), R2C14:R4C15, 2), "")) -> Returned Data for year 2001 | E3: 'Decimal Places shown, | N3: 1 | O3: 'Apportioned or estimated from previous years returns
A4: =1+R[-1]C -> 3 | B4: =IF(ISERROR(Selection!RC[+2]), "", IF(ISERROR(Selection!RC[+2]), "", Selection!RC[+4])) -> France | C4: =IF(ISERROR(Selection!RC[+1]), "", IF(ISERROR(Selection!RC[+1]), "", Selection!RC[+1])) -> 38333.6269477544 | D4: =IF(EQUAL(RC[-1], ""), "", IF(EQUAL(Menus!R10C11, "2001Grossed"), VLOOKUP(MAX(Selection!RC[+9]:RC[+10]), R2C14:R4C15, 2), "")) -> Apportioned or estimated from previous years returns | E4: 'select column C and | N4: 2 | O4: 'Grossed on regional averages
A5: =1+R[-1]C -> 4 | B5: =IF(ISERROR(Selection!RC[+2]), "", IF(ISERROR(Selection!RC[+2]), "", Selection!RC[+4])) -> Sweden | C5: =IF(ISERROR(Selection!RC[+1]), "", IF(ISERROR(Selection!RC[+1]), "", Selection!RC[+1])) -> 38265.2521638777 | D5: =IF(EQUAL(RC[-1], ""), "", IF(EQUAL(Menus!R10C11, "2001Grossed"), VLOOKUP(MAX(Selection!RC[+9]:RC[+10]), R2C14:R4C15, 2), "")) -> Returned Data for year 2001 | E5: 'change cell format
A6: =1+R[-1]C -> 5 | B6: =IF(ISERROR(Selection!RC[+2]), "", IF(ISERROR(Selection!RC[+2]), "", Selection!RC[+4])) -> Liechtenstein | C6: =IF(ISERROR(Selection!RC[+1]), "", IF(ISERROR(Selection!RC[+1]), "", Selection!RC[+1])) -> 37124.6 | D6: =IF(EQUAL(RC[-1], ""), "", IF(EQUAL(Menus!R10C11, "2001Grossed"), VLOOKUP(MAX(Selection!RC[+9]:RC[+10]), R2C14:R4C15, 2), "")) -> Grossed on regional averages
A7: =1+R[-1]C -> 6 | B7: =IF(ISERROR(Selection!RC[+2]), "", IF(ISERROR(Selection!RC[+2]), "", Selection!RC[+4])) -> UK | C7: =IF(ISERROR(Selection!RC[+1]), "", IF(ISERROR(Selection!RC[+1]), "", Selection!RC[+1])) -> 35583.5064154786 | D7: =IF(EQUAL(RC[-1], ""), "", IF(EQUAL(Menus!R10C11, "2001Grossed"), VLOOKUP(MAX(Selection!RC[+9]:RC[+10]), R2C14:R4C15, 2), "")) -> Returned Data for year 2001
A8: =1+R[-1]C -> 7 | B8: =IF(ISERROR(Selection!RC[+2]), "", IF(ISERROR(Selection!RC[+2]), "", Selection!RC[+4])) -> Luxembourg | C8: =IF(ISERROR(Selection!RC[+1]), "", IF(ISERROR(Selection!RC[+1]), "", Selection!RC[+1])) -> 33761.7777777778 | D8: =IF(EQUAL(RC[-1], ""), "", IF(EQUAL(Menus!R10C11, "2001Grossed"), VLOOKUP(MAX(Selection!RC[+9]:RC[+10]), R2C14:R4C15, 2), "")) -> Apportioned or estimated from previous years returns
A9: =1+R[-1]C -> 8 | B9: =IF(ISERROR(Selection!RC[+2]), "", IF(ISERROR(Selection!RC[+2]), "", Selection!RC[+4])) -> Netherlands | C9: =IF(ISERROR(Selection!RC[+1]), "", IF(ISERROR(Selection!RC[+1]), "", Selection!RC[+1])) -> 31750.3304812834 | D9: =IF(EQUAL(RC[-1], ""), "", IF(EQUAL(Menus!R10C11, "2001Grossed"), VLOOKUP(MAX(Selection!RC[+9]:RC[+10]), R2C14:R4C15, 2), "")) -> Grossed on regional averages
A10: =1+R[-1]C -> 9 | B10: =IF(ISERROR(Selection!RC[+2]), "", IF(ISERROR(Selection!RC[+2]), "", Selection!RC[+4])) -> Austria | C10: =IF(ISERROR(Selection!RC[+1]), "", IF(ISERROR(Selection!RC[+1]), "", Selection!RC[+1])) -> 31509.3198724761 | D10: =IF(EQUAL(RC[-1], ""), "", IF(EQUAL(Menus!R10C11, "2001Grossed"), VLOOKUP(MAX(Selection!RC[+9]:RC[+10]), R2C14:R4C15, 2), "")) -> Grossed on regional averages
A11: =1+R[-1]C -> 10 | B11: =IF(ISERROR(Selection!RC[+2]), "", IF(ISERROR(Selection!RC[+2]), "", Selection!RC[+4])) -> Italy | C11: =IF(ISERROR(Selection!RC[+1]), "", IF(ISERROR(Selection!RC[+1]), "", Selection!RC[+1])) -> 31173.8830373546 | D11: =IF(EQUAL(RC[-1], ""), "", IF(EQUAL(Menus!R10C11, "2001Grossed"), VLOOKUP(MAX(Selection!RC[+9]:RC[+10]), R2C14:R4C15, 2), "")) -> Grossed on regional averages
A12: =1+R[-1]C -> 11 | B12: =IF(ISERROR(Selection!RC[+2]), "", IF(ISERROR(Selection!RC[+2]), "", Selection!RC[+4])) -> Iceland | C12: =IF(ISERROR(Selection!RC[+1]), "", IF(ISERROR(Selection!RC[+1]), "", Selection!RC[+1])) -> 27499.6111111111 | D12: =IF(EQUAL(RC[-1], ""), "", IF(EQUAL(Menus!R10C11, "2001Grossed"), VLOOKUP(MAX(Selection!RC[+9]:RC[+10]), R2C14:R4C15, 2), "")) -> Grossed on regional averages
A13: =1+R[-1]C -> 12 | B13: =IF(ISERROR(Selection!RC[+2]), "", IF(ISERROR(Selection!RC[+2]), "", Selection!RC[+4])) -> Finland | C13: =IF(ISERROR(Selection!RC[+1]), "", IF(ISERROR(Selection!RC[+1]), "", Selection!RC[+1])) -> 27353.2223756906 | D13: =IF(EQUAL(RC[-1], ""), "", IF(EQUAL(Menus!R10C11, "2001Grossed"), VLOOKUP(MAX(Selection!RC[+9]:RC[+10]), R2C14:R4C15, 2), "")) -> Returned Data for year 2001
A14: =1+R[-1]C -> 13 | B14: =IF(ISERROR(Selection!RC[+2]), "", IF(ISERROR(Selection!RC[+2]), "", Selection!RC[+4])) -> België Nederlandstalige Universiteiten | C14: =IF(ISERROR(Selection!RC[+1]), "", IF(ISERROR(Selection!RC[+1]), "", Selection!RC[+1])) -> 27280.8143322476 | D14: =IF(EQUAL(RC[-1], ""), "", IF(EQUAL(Menus!R10C11, "2001Grossed"), VLOOKUP(MAX(Selection!RC[+9]:RC[+10]), R2C14:R4C15, 2), "")) -> Returned Data for year 2001
A15: =1+R[-1]C -> 14 | B15: =IF(ISERROR(Selection!RC[+2]), "", IF(ISERROR(Selection!RC[+2]), "", Selection!RC[+4])) -> Germany | C15: =IF(ISERROR(Selection!RC[+1]), "", IF(ISERROR(Selection!RC[+1]), "", Selection!RC[+1])) -> 27132.8141842372 | D15: =IF(EQUAL(RC[-1], ""), "", IF(EQUAL(Menus!R10C11, "2001Grossed"), VLOOKUP(MAX(Selection!RC[+9]:RC[+10]), R2C14:R4C15, 2), "")) -> Returned Data for year 2001
A16: =1+R[-1]C -> 15 | B16: =IF(ISERROR(Selection!RC[+2]), "", IF(ISERROR(Selection!RC[+2]), "", Selection!RC[+4])) -> Belgium | C16: =IF(ISERROR(Selection!RC[+1]), "", IF(ISERROR(Selection!RC[+1]), "", Selection!RC[+1])) -> 25348.7569786535 | D16: =IF(EQUAL(RC[-1], ""), "", IF(EQUAL(Menus!R10C11, "2001Grossed"), VLOOKUP(MAX(Selection!RC[+9]:RC[+10]), R2C14:R4C15, 2), "")) -> Returned Data for year 2001
A17: =1+R[-1]C -> 16 | B17: =IF(ISERROR(Selection!RC[+2]), "", IF(ISERROR(Selection!RC[+2]), "", Selection!RC[+4])) -> Belgique universités francophones | C17: =IF(ISERROR(Selection!RC[+1]), "", IF(ISERROR(Selection!RC[+1]), "", Selection!RC[+1])) -> 23462.4019933555 | D17: =IF(EQUAL(RC[-1], ""), "", IF(EQUAL(Menus!R10C11, "2001Grossed"), VLOOKUP(MAX(Selection!RC[+9]:RC[+10]), R2C14:R4C15, 2), "")) -> Returned Data for year 2001
A18: =1+R[-1]C -> 17 | B18: =IF(ISERROR(Selection!RC[+2]), "", IF(ISERROR(Selection!RC[+2]), "", Selection!RC[+4])) -> Switzerland | C18: =IF(ISERROR(Selection!RC[+1]), "", IF(ISERROR(Selection!RC[+1]), "", Selection!RC[+1])) -> 21043.2540237929 | D18: =IF(EQUAL(RC[-1], ""), "", IF(EQUAL(Menus!R10C11, "2001Grossed"), VLOOKUP(MAX(Selection!RC[+9]:RC[+10]), R2C14:R4C15, 2), "")) -> Grossed on regional averages
A19: =1+R[-1]C -> 18 | B19: =IF(ISERROR(Selection!RC[+2]), "", IF(ISERROR(Selection!RC[+2]), "", Selection!RC[+4])) -> Eire | C19: =IF(ISERROR(Selection!RC[+1]), "", IF(ISERROR(Selection!RC[+1]), "", Selection!RC[+1])) -> 20084.24 | D19: =IF(EQUAL(RC[-1], ""), "", IF(EQUAL(Menus!R10C11, "2001Grossed"), VLOOKUP(MAX(Selection!RC[+9]:RC[+10]), R2C14:R4C15, 2), "")) -> Grossed on regional averages
A20: =1+R[-1]C -> 19 | B20: =IF(ISERROR(Selection!RC[+2]), "", IF(ISERROR(Selection!RC[+2]), "", Selection!RC[+4])) -> Spain | C20: =IF(ISERROR(Selection!RC[+1]), "", IF(ISERROR(Selection!RC[+1]), "", Selection!RC[+1])) -> 16526.102960969 | D20: =IF(EQUAL(RC[-1], ""), "", IF(EQUAL(Menus!R10C11, "2001Grossed"), VLOOKUP(MAX(Selection!RC[+9]:RC[+10]), R2C14:R4C15, 2), "")) -> Apportioned or estimated from previous years returns
A21: =1+R[-1]C -> 20 | B21: =IF(ISERROR(Selection!RC[+2]), "", IF(ISERROR(Selection!RC[+2]), "", Selection!RC[+4])) -> Portugal | C21: =IF(ISERROR(Selection!RC[+1]), "", IF(ISERROR(Selection!RC[+1]), "", Selection!RC[+1])) -> 5801.25102880658 | D21: =IF(EQUAL(RC[-1], ""), "", IF(EQUAL(Menus!R10C11, "2001Grossed"), VLOOKUP(MAX(Selection!RC[+9]:RC[+10]), R2C14:R4C15, 2), "")) -> Apportioned or estimated from previous years returns
A22: =1+R[-1]C -> 21 | B22: =IF(ISERROR(Selection!RC[+2]), "", IF(ISERROR(Selection!RC[+2]), "", Selection!RC[+4])) -> Greece | C22: =IF(ISERROR(Selection!RC[+1]), "", IF(ISERROR(Selection!RC[+1]), "", Selection!RC[+1])) -> 3611.10863757792 | D22: =IF(EQUAL(RC[-1], ""), "", IF(EQUAL(Menus!R10C11, "2001Grossed"), VLOOKUP(MAX(Selection!RC[+9]:RC[+10]), R2C14:R4C15, 2), "")) -> Apportioned or estimated from previous years returns
A23: =1+R[-1]C -> 22 | B23: =IF(ISERROR(Selection!RC[+2]), "", IF(ISERROR(Selection!RC[+2]), "", Selection!RC[+4])) ->  | C23: =IF(ISERROR(Selection!RC[+1]), "", IF(ISERROR(Selection!RC[+1]), "", Selection!RC[+1])) ->  | D23: =IF(EQUAL(RC[-1], ""), "", IF(EQUAL(Menus!R10C11, "2001Grossed"), VLOOKUP(MAX(Selection!RC[+9]:RC[+10]), R2C14:R4C15, 2), "")) -> 
A24: =1+R[-1]C -> 23 | B24: =IF(ISERROR(Selection!RC[+2]), "", IF(ISERROR(Selection!RC[+2]), "", Selection!RC[+4])) ->  | C24: =IF(ISERROR(Selection!RC[+1]), "", IF(ISERROR(Selection!RC[+1]), "", Selection!RC[+1])) ->  | D24: =IF(EQUAL(RC[-1], ""), "", IF(EQUAL(Menus!R10C11, "2001Grossed"), VLOOKUP(MAX(Selection!RC[+9]:RC[+10]), R2C14:R4C15, 2), "")) -> 
A25: =1+R[-1]C -> 24 | B25: =IF(ISERROR(Selection!RC[+2]), "", IF(ISERROR(Selection!RC[+2]), "", Selection!RC[+4])) ->  | C25: =IF(ISERROR(Selection!RC[+1]), "", IF(ISERROR(Selection!RC[+1]), "", Selection!RC[+1])) ->  | D25: =IF(EQUAL(RC[-1], ""), "", IF(EQUAL(Menus!R10C11, "2001Grossed"), VLOOKUP(MAX(Selection!RC[+9]:RC[+10]), R2C14:R4C15, 2), "")) -> 
A26: =1+R[-1]C -> 25 | B26: =IF(ISERROR(Selection!RC[+2]), "", IF(ISERROR(Selection!RC[+2]), "", Selection!RC[+4])) ->  | C26: =IF(ISERROR(Selection!RC[+1]), "", IF(ISERROR(Selection!RC[+1]), "", Selection!RC[+1])) ->  | D26: =IF(EQUAL(RC[-1], ""), "", IF(EQUAL(Menus!R10C11, "2001Grossed"), VLOOKUP(MAX(Selection!RC[+9]:RC[+10]), R2C14:R4C15, 2), "")) -> 
A27: =1+R[-1]C -> 26 | B27: =IF(ISERROR(Selection!RC[+2]), "", IF(ISERROR(Selection!RC[+2]), "", Selection!RC[+4])) ->  | C27: =IF(ISERROR(Selection!RC[+1]), "", IF(ISERROR(Selection!RC[+1]), "", Selection!RC[+1])) ->  | D27: =IF(EQUAL(RC[-1], ""), "", IF(EQUAL(Menus!R10C11, "2001Grossed"), VLOOKUP(MAX(Selection!RC[+9]:RC[+10]), R2C14:R4C15, 2), "")) -> 
A28: =1+R[-1]C -> 27 | B28: =IF(ISERROR(Selection!RC[+2]), "", IF(ISERROR(Selection!RC[+2]), "", Selection!RC[+4])) ->  | C28: =IF(ISERROR(Selection!RC[+1]), "", IF(ISERROR(Selection!RC[+1]), "", Selection!RC[+1])) ->  | D28: =IF(EQUAL(RC[-1], ""), "", IF(EQUAL(Menus!R10C11, "2001Grossed"), VLOOKUP(MAX(Selection!RC[+9]:RC[+10]), R2C14:R4C15, 2), "")) -> 
A29: =1+R[-1]C -> 28 | B29: =IF(ISERROR(Selection!RC[+2]), "", IF(ISERROR(Selection!RC[+2]), "", Selection!RC[+4])) ->  | C29: =IF(ISERROR(Selection!RC[+1]), "", IF(ISERROR(Selection!RC[+1]), "", Selection!RC[+1])) ->  | D29: =IF(EQUAL(RC[-1], ""), "", IF(EQUAL(Menus!R10C11, "2001Grossed"), VLOOKUP(MAX(Selection!RC[+9]:RC[+10]), R2C14:R4C15, 2), "")) -> 
A30: =1+R[-1]C -> 29 | B30: =IF(ISERROR(Selection!RC[+2]), "", IF(ISERROR(Selection!RC[+2]), "", Selection!RC[+4])) ->  | C30: =IF(ISERROR(Selection!RC[+1]), "", IF(ISERROR(Selection!RC[+1]), "", Selection!RC[+1])) ->  | D30: =IF(EQUAL(RC[-1], ""), "", IF(EQUAL(Menus!R10C11, "2001Grossed"), VLOOKUP(MAX(Selection!RC[+9]:RC[+10]), R2C14:R4C15, 2), "")) -> 
A31: =1+R[-1]C -> 30 | B31: =IF(ISERROR(Selection!RC[+2]), "", IF(ISERROR(Selection!RC[+2]), "", Selection!RC[+4])) ->  | C31: =IF(ISERROR(Selection!RC[+1]), "", IF(ISERROR(Selection!RC[+1]), "", Selection!RC[+1])) ->  | D31: =IF(EQUAL(RC[-1], ""), "", IF(EQUAL(Menus!R10C11, "2001Grossed"), VLOOKUP(MAX(Selection!RC[+9]:RC[+10]), R2C14:R4C15, 2), "")) -> 
A32: =1+R[-1]C -> 31 | B32: =IF(ISERROR(Selection!RC[+2]), "", IF(ISERROR(Selection!RC[+2]), "", Selection!RC[+4])) ->  | C32: =IF(ISERROR(Selection!RC[+1]), "", IF(ISERROR(Selection!RC[+1]), "", Selection!RC[+1])) ->  | D32: =IF(EQUAL(RC[-1], ""), "", IF(EQUAL(Menus!R10C11, "2001Grossed"), VLOOKUP(MAX(Selection!RC[+9]:RC[+10]), R2C14:R4C15, 2), "")) -> 
A33: =1+R[-1]C -> 32 | B33: =IF(ISERROR(Selection!RC[+2]), "", IF(ISERROR(Selection!RC[+2]), "", Selection!RC[+4])) ->  | C33: =IF(ISERROR(Selection!RC[+1]), "", IF(ISERROR(Selection!RC[+1]), "", Selection!RC[+1])) ->  | D33: =IF(EQUAL(RC[-1], ""), "", IF(EQUAL(Menus!R10C11, "2001Grossed"), VLOOKUP(MAX(Selection!RC[+9]:RC[+10]), R2C14:R4C15, 2), "")) -> 
A34: =1+R[-1]C -> 33 | B34: =IF(ISERROR(Selection!RC[+2]), "", IF(ISERROR(Selection!RC[+2]), "", Selection!RC[+4])) ->  | C34: =IF(ISERROR(Selection!RC[+1]), "", IF(ISERROR(Selection!RC[+1]), "", Selection!RC[+1])) ->  | D34: =IF(EQUAL(RC[-1], ""), "", IF(EQUAL(Menus!R10C11, "2001Grossed"), VLOOKUP(MAX(Selection!RC[+9]:RC[+10]), R2C14:R4C15, 2), "")) -> 
A35: =1+R[-1]C -> 34 | B35: =IF(ISERROR(Selection!RC[+2]), "", IF(ISERROR(Selection!RC[+2]), "", Selection!RC[+4])) ->  | C35: =IF(ISERROR(Selection!RC[+1]), "", IF(ISERROR(Selection!RC[+1]), "", Selection!RC[+1])) ->  | D35: =IF(EQUAL(RC[-1], ""), "", IF(EQUAL(Menus!R10C11, "2001Grossed"), VLOOKUP(MAX(Selection!RC[+9]:RC[+10]), R2C14:R4C15, 2), "")) -> 
A36: =1+R[-1]C -> 35 | B36: =IF(ISERROR(Selection!RC[+2]), "", IF(ISERROR(Selection!RC[+2]), "", Selection!RC[+4])) ->  | C36: =IF(ISERROR(Selection!RC[+1]), "", IF(ISERROR(Selection!RC[+1]), "", Selection!RC[+1])) ->  | D36: =IF(EQUAL(RC[-1], ""), "", IF(EQUAL(Menus!R10C11, "2001Grossed"), VLOOKUP(MAX(Selection!RC[+9]:RC[+10]), R2C14:R4C15, 2), "")) -> 
A37: =1+R[-1]C -> 36 | B37: =IF(ISERROR(Selection!RC[+2]), "", IF(ISERROR(Selection!RC[+2]), "", Selection!RC[+4])) ->  | C37: =IF(ISERROR(Selection!RC[+1]), "", IF(ISERROR(Selection!RC[+1]), "", Selection!RC[+1])) ->  | D37: =IF(EQUAL(RC[-1], ""), "", IF(EQUAL(Menus!R10C11, "2001Grossed"), VLOOKUP(MAX(Selection!RC[+9]:RC[+10]), R2C14:R4C15, 2), "")) -> 
A38: =1+R[-1]C -> 37 | B38: =IF(ISERROR(Selection!RC[+2]), "", IF(ISERROR(Selection!RC[+2]), "", Selection!RC[+4])) ->  | C38: =IF(ISERROR(Selection!RC[+1]), "", IF(ISERROR(Selection!RC[+1]), "", Selection!RC[+1])) ->  | D38: =IF(EQUAL(RC[-1], ""), "", IF(EQUAL(Menus!R10C11, "2001Grossed"), VLOOKUP(MAX(Selection!RC[+9]:RC[+10]), R2C14:R4C15, 2), "")) -> 
A39: =1+R[-1]C -> 38 | B39: =IF(ISERROR(Selection!RC[+2]), "", IF(ISERROR(Selection!RC[+2]), "", Selection!RC[+4])) ->  | C39: =IF(ISERROR(Selection!RC[+1]), "", IF(ISERROR(Selection!RC[+1]), "", Selection!RC[+1])) ->  | D39: =IF(EQUAL(RC[-1], ""), "", IF(EQUAL(Menus!R10C11, "2001Grossed"), VLOOKUP(MAX(Selection!RC[+9]:RC[+10]), R2C14:R4C15, 2), "")) -> 
A40: =1+R[-1]C -> 39 | B40: =IF(ISERROR(Selection!RC[+2]), "", IF(ISERROR(Selection!RC[+2]), "", Selection!RC[+4])) ->  | C40: =IF(ISERROR(Selection!RC[+1]), "", IF(ISERROR(Selection!RC[+1]), "", Selection!RC[+1])) ->  | D40: =IF(EQUAL(RC[-1], ""), "", IF(EQUAL(Menus!R10C11, "2001Grossed"), VLOOKUP(MAX(Selection!RC[+9]:RC[+10]), R2C14:R4C15, 2), "")) -> 
A41: =1+R[-1]C -> 40 | B41: =IF(ISERROR(Selection!RC[+2]), "", IF(ISERROR(Selection!RC[+2]), "", Selection!RC[+4])) ->  | C41: =IF(ISERROR(Selection!RC[+1]), "", IF(ISERROR(Selection!RC[+1]), "", Selection!RC[+1])) ->  | D41: =IF(EQUAL(RC[-1], ""), "", IF(EQUAL(Menus!R10C11, "2001Grossed"), VLOOKUP(MAX(Selection!RC[+9]:RC[+10]), R2C14:R4C15, 2), "")) -> 
A42: =1+R[-1]C -> 41 | B42: =IF(ISERROR(Selection!RC[+2]), "", IF(ISERROR(Selection!RC[+2]), "", Selection!RC[+4])) ->  | C42: =IF(ISERROR(Selection!RC[+1]), "", IF(ISERROR(Selection!RC[+1]), "", Selection!RC[+1])) ->  | D42: =IF(EQUAL(RC[-1], ""), "", IF(EQUAL(Menus!R10C11, "2001Grossed"), VLOOKUP(MAX(Selection!RC[+9]:RC[+10]), R2C14:R4C15, 2), "")) -> 
A43: =1+R[-1]C -> 42 | B43: =IF(ISERROR(Selection!RC[+2]), "", IF(ISERROR(Selection!RC[+2]), "", Selection!RC[+4])) ->  | C43: =IF(ISERROR(Selection!RC[+1]), "", IF(ISERROR(Selection!RC[+1]), "", Selection!RC[+1])) ->  | D43: =IF(EQUAL(RC[-1], ""), "", IF(EQUAL(Menus!R10C11, "2001Grossed"), VLOOKUP(MAX(Selection!RC[+9]:RC[+10]), R2C14:R4C15, 2), "")) -> 
A44: =1+R[-1]C -> 43 | B44: =IF(ISERROR(Selection!RC[+2]), "", IF(ISERROR(Selection!RC[+2]), "", Selection!RC[+4])) ->  | C44: =IF(ISERROR(Selection!RC[+1]), "", IF(ISERROR(Selection!RC[+1]), "", Selection!RC[+1])) ->  | D44: =IF(EQUAL(RC[-1], ""), "", IF(EQUAL(Menus!R10C11, "2001Grossed"), VLOOKUP(MAX(Selection!RC[+9]:RC[+10]), R2C14:R4C15, 2), "")) -> 
A45: =1+R[-1]C -> 44 | B45: =IF(ISERROR(Selection!RC[+2]), "", IF(ISERROR(Selection!RC[+2]), "", Selection!RC[+4])) ->  | C45: =IF(ISERROR(Selection!RC[+1]), "", IF(ISERROR(Selection!RC[+1]), "", Selection!RC[+1])) ->  | D45: =IF(EQUAL(RC[-1], ""), "", IF(EQUAL(Menus!R10C11, "2001Grossed"), VLOOKUP(MAX(Selection!RC[+9]:RC[+10]), R2C14:R4C15, 2), "")) -> 
A46: =1+R[-1]C -> 45 | B46: =IF(ISERROR(Selection!RC[+2]), "", IF(ISERROR(Selection!RC[+2]), "", Selection!RC[+4])) ->  | C46: =IF(ISERROR(Selection!RC[+1]), "", IF(ISERROR(Selection!RC[+1]), "", Selection!RC[+1])) ->  | D46: =IF(EQUAL(RC[-1], ""), "", IF(EQUAL(Menus!R10C11, "2001Grossed"), VLOOKUP(MAX(Selection!RC[+9]:RC[+10]), R2C14:R4C15, 2), "")) -> 
A47: =1+R[-1]C -> 46 | B47: =IF(ISERROR(Selection!RC[+2]), "", IF(ISERROR(Selection!RC[+2]), "", Selection!RC[+4])) ->  | C47: =IF(ISERROR(Selection!RC[+1]), "", IF(ISERROR(Selection!RC[+1]), "", Selection!RC[+1])) ->  | D47: =IF(EQUAL(RC[-1], ""), "", IF(EQUAL(Menus!R10C11, "2001Grossed"), VLOOKUP(MAX(Selection!RC[+9]:RC[+10]), R2C14:R4C15, 2), "")) -> 
A48: =1+R[-1]C -> 47 | B48: =IF(ISERROR(Selection!RC[+2]), "", IF(ISERROR(Selection!RC[+2]), "", Selection!RC[+4])) ->  | C48: =IF(ISERROR(Selection!RC[+1]), "", IF(ISERROR(Selection!RC[+1]), "", Selection!RC[+1])) ->  | D48: =IF(EQUAL(RC[-1], ""), "", IF(EQUAL(Menus!R10C11, "2001Grossed"), VLOOKUP(MAX(Selection!RC[+9]:RC[+10]), R2C14:R4C15, 2), "")) -> 
A49: =1+R[-1]C -> 48 | B49: =IF(ISERROR(Selection!RC[+2]), "", IF(ISERROR(Selection!RC[+2]), "", Selection!RC[+4])) ->  | C49: =IF(ISERROR(Selection!RC[+1]), "", IF(ISERROR(Selection!RC[+1]), "", Selection!RC[+1])) ->  | D49: =IF(EQUAL(RC[-1], ""), "", IF(EQUAL(Menus!R10C11, "2001Grossed"), VLOOKUP(MAX(Selection!RC[+9]:RC[+10]), R2C14:R4C15, 2), "")) -> 
A50: =1+R[-1]C -> 49 | B50: =IF(ISERROR(Selection!RC[+2]), "", IF(ISERROR(Selection!RC[+2]), "", Selection!RC[+4])) ->  | C50: =IF(ISERROR(Selection!RC[+1]), "", IF(ISERROR(Selection!RC[+1]), "", Selection!RC[+1])) ->  | D50: =IF(EQUAL(RC[-1], ""), "", IF(EQUAL(Menus!R10C11, "2001Grossed"), VLOOKUP(MAX(Selection!RC[+9]:RC[+10]), R2C14:R4C15, 2), "")) -> 
A51: =1+R[-1]C -> 50 | B51: =IF(ISERROR(Selection!RC[+2]), "", IF(ISERROR(Selection!RC[+2]), "", Selection!RC[+4])) ->  | C51: =IF(ISERROR(Selection!RC[+1]), "", IF(ISERROR(Selection!RC[+1]), "", Selection!RC[+1])) ->  | D51: =IF(EQUAL(RC[-1], ""), "", IF(EQUAL(Menus!R10C11, "2001Grossed"), VLOOKUP(MAX(Selection!RC[+9]:RC[+10]), R2C14:R4C15, 2), "")) -> 
A52: =1+R[-1]C -> 51 | B52: =IF(ISERROR(Selection!RC[+2]), "", IF(ISERROR(Selection!RC[+2]), "", Selection!RC[+4])) ->  | C52: =IF(ISERROR(Selection!RC[+1]), "", IF(ISERROR(Selection!RC[+1]), "", Selection!RC[+1])) ->  | D52: =IF(EQUAL(RC[-1], ""), "", IF(EQUAL(Menus!R10C11, "2001Grossed"), VLOOKUP(MAX(Selection!RC[+9]:RC[+10]), R2C14:R4C15, 2), "")) -> 
A53: =1+R[-1]C -> 52 | B53: =IF(ISERROR(Selection!RC[+2]), "", IF(ISERROR(Selection!RC[+2]), "", Selection!RC[+4])) ->  | C53: =IF(ISERROR(Selection!RC[+1]), "", IF(ISERROR(Selection!RC[+1]), "", Selection!RC[+1])) ->  | D53: =IF(EQUAL(RC[-1], ""), "", IF(EQUAL(Menus!R10C11, "2001Grossed"), VLOOKUP(MAX(Selection!RC[+9]:RC[+10]), R2C14:R4C15, 2), "")) -> 
A54: =1+R[-1]C -> 53 | B54: =IF(ISERROR(Selection!RC[+2]), "", IF(ISERROR(Selection!RC[+2]), "", Selection!RC[+4])) ->  | C54: =IF(ISERROR(Selection!RC[+1]), "", IF(ISERROR(Selection!RC[+1]), "", Selection!RC[+1])) ->  | D54: =IF(EQUAL(RC[-1], ""), "", IF(EQUAL(Menus!R10C11, "2001Grossed"), VLOOKUP(MAX(Selection!RC[+9]:RC[+10]), R2C14:R4C15, 2), "")) -> 
A55: =1+R[-1]C -> 54 | B55: =IF(ISERROR(Selection!RC[+2]), "", IF(ISERROR(Selection!RC[+2]), "", Selection!RC[+4])) ->  | C55: =IF(ISERROR(Selection!RC[+1]), "", IF(ISERROR(Selection!RC[+1]), "", Selection!RC[+1])) ->  | D55: =IF(EQUAL(RC[-1], ""), "", IF(EQUAL(Menus!R10C11, "2001Grossed"), VLOOKUP(MAX(Selection!RC[+9]:RC[+10]), R2C14:R4C15, 2), "")) -> 
A56: =1+R[-1]C -> 55 | B56: =IF(ISERROR(Selection!RC[+2]), "", IF(ISERROR(Selection!RC[+2]), "", Selection!RC[+4])) ->  | C56: =IF(ISERROR(Selection!RC[+1]), "", IF(ISERROR(Selection!RC[+1]), "", Selection!RC[+1])) ->  | D56: =IF(EQUAL(RC[-1], ""), "", IF(EQUAL(Menus!R10C11, "2001Grossed"), VLOOKUP(MAX(Selection!RC[+9]:RC[+10]), R2C14:R4C15, 2), "")) -> 
A57: =1+R[-1]C -> 56 | B57: =IF(ISERROR(Selection!RC[+2]), "", IF(ISERROR(Selection!RC[+2]), "", Selection!RC[+4])) ->  | C57: =IF(ISERROR(Selection!RC[+1]), "", IF(ISERROR(Selection!RC[+1]), "", Selection!RC[+1])) ->  | D57: =IF(EQUAL(RC[-1], ""), "", IF(EQUAL(Menus!R10C11, "2001Grossed"), VLOOKUP(MAX(Selection!RC[+9]:RC[+10]), R2C14:R4C15, 2), "")) -> 
A58: =1+R[-1]C -> 57 | B58: =IF(ISERROR(Selection!RC[+2]), "", IF(ISERROR(Selection!RC[+2]), "", Selection!RC[+4])) ->  | C58: =IF(ISERROR(Selection!RC[+1]), "", IF(ISERROR(Selection!RC[+1]), "", Selection!RC[+1])) ->  | D58: =IF(EQUAL(RC[-1], ""), "", IF(EQUAL(Menus!R10C11, "2001Grossed"), VLOOKUP(MAX(Selection!RC[+9]:RC[+10]), R2C14:R4C15, 2), "")) -> 
A59: =1+R[-1]C -> 58 | B59: =IF(ISERROR(Selection!RC[+2]), "", IF(ISERROR(Selection!RC[+2]), "", Selection!RC[+4])) ->  | C59: =IF(ISERROR(Selection!RC[+1]), "", IF(ISERROR(Selection!RC[+1]), "", Selection!RC[+1])) ->  | D59: =IF(EQUAL(RC[-1], ""), "", IF(EQUAL(Menus!R10C11, "2001Grossed"), VLOOKUP(MAX(Selection!RC[+9]:RC[+10]), R2C14:R4C15, 2), "")) -> 
A60: =1+R[-1]C -> 59 | B60: =IF(ISERROR(Selection!RC[+2]), "", IF(ISERROR(Selection!RC[+2]), "", Selection!RC[+4])) ->  | C60: =IF(ISERROR(Selection!RC[+1]), "", IF(ISERROR(Selection!RC[+1]), "", Selection!RC[+1])) ->  | D60: =IF(EQUAL(RC[-1], ""), "", IF(EQUAL(Menus!R10C11, "2001Grossed"), VLOOKUP(MAX(Selection!RC[+9]:RC[+10]), R2C14:R4C15, 2), "")) -> 
A61: =1+R[-1]C -> 60 | B61: =IF(ISERROR(Selection!RC[+2]), "", IF(ISERROR(Selection!RC[+2]), "", Selection!RC[+4])) ->  | C61: =IF(ISERROR(Selection!RC[+1]), "", IF(ISERROR(Selection!RC[+1]), "", Selection!RC[+1])) ->  | D61: =IF(EQUAL(RC[-1], ""), "", IF(EQUAL(Menus!R10C11, "2001Grossed"), VLOOKUP(MAX(Selection!RC[+9]:RC[+10]), R2C14:R4C15, 2), "")) -> 
A62: =1+R[-1]C -> 61 | B62: =IF(ISERROR(Selection!RC[+2]), "", IF(ISERROR(Selection!RC[+2]), "", Selection!RC[+4])) ->  | C62: =IF(ISERROR(Selection!RC[+1]), "", IF(ISERROR(Selection!RC[+1]), "", Selection!RC[+1])) ->  | D62: =IF(EQUAL(RC[-1], ""), "", IF(EQUAL(Menus!R10C11, "2001Grossed"), VLOOKUP(MAX(Selection!RC[+9]:RC[+10]), R2C14:R4C15, 2), "")) -> 
A63: =1+R[-1]C -> 62 | B63: =IF(ISERROR(Selection!RC[+2]), "", IF(ISERROR(Selection!RC[+2]), "", Selection!RC[+4])) ->  | C63: =IF(ISERROR(Selection!RC[+1]), "", IF(ISERROR(Selection!RC[+1]), "", Selection!RC[+1])) ->  | D63: =IF(EQUAL(RC[-1], ""), "", IF(EQUAL(Menus!R10C11, "2001Grossed"), VLOOKUP(MAX(Selection!RC[+9]:RC[+10]), R2C14:R4C15, 2), "")) -> 
A64: =1+R[-1]C -> 63 | B64: =IF(ISERROR(Selection!RC[+2]), "", IF(ISERROR(Selection!RC[+2]), "", Selection!RC[+4])) ->  | C64: =IF(ISERROR(Selection!RC[+1]), "", IF(ISERROR(Selection!RC[+1]), "", Selection!RC[+1])) ->  | D64: =IF(EQUAL(RC[-1], ""), "", IF(EQUAL(Menus!R10C11, "2001Grossed"), VLOOKUP(MAX(Selection!RC[+9]:RC[+10]), R2C14:R4C15, 2), "")) -> 
A65: =1+R[-1]C -> 64 | B65: =IF(ISERROR(Selection!RC[+2]), "", IF(ISERROR(Selection!RC[+2]), "", Selection!RC[+4])) ->  | C65: =IF(ISERROR(Selection!RC[+1]), "", IF(ISERROR(Selection!RC[+1]), "", Selection!RC[+1])) ->  | D65: =IF(EQUAL(RC[-1], ""), "", IF(EQUAL(Menus!R10C11, "2001Grossed"), VLOOKUP(MAX(Selection!RC[+9]:RC[+10]), R2C14:R4C15, 2), "")) -> 
A66: =1+R[-1]C -> 65 | B66: =IF(ISERROR(Selection!RC[+2]), "", IF(ISERROR(Selection!RC[+2]), "", Selection!RC[+4])) ->  | C66: =IF(ISERROR(Selection!RC[+1]), "", IF(ISERROR(Selection!RC[+1]), "", Selection!RC[+1])) ->  | D66: =IF(EQUAL(RC[-1], ""), "", IF(EQUAL(Menus!R10C11, "2001Grossed"), VLOOKUP(MAX(Selection!RC[+9]:RC[+10]), R2C14:R4C15, 2), "")) -> 
A67: =1+R[-1]C -> 66 | B67: =IF(ISERROR(Selection!RC[+2]), "", IF(ISERROR(Selection!RC[+2]), "", Selection!RC[+4])) ->  | C67: =IF(ISERROR(Selection!RC[+1]), "", IF(ISERROR(Selection!RC[+1]), "", Selection!RC[+1])) ->  | D67: =IF(EQUAL(RC[-1], ""), "", IF(EQUAL(Menus!R10C11, "2001Grossed"), VLOOKUP(MAX(Selection!RC[+9]:RC[+10]), R2C14:R4C15, 2), "")) -> 
A68: =1+R[-1]C -> 67 | B68: =IF(ISERROR(Selection!RC[+2]), "", IF(ISERROR(Selection!RC[+2]), "", Selection!RC[+4])) ->  | C68: =IF(ISERROR(Selection!RC[+1]), "", IF(ISERROR(Selection!RC[+1]), "", Selection!RC[+1])) ->  | D68: =IF(EQUAL(RC[-1], ""), "", IF(EQUAL(Menus!R10C11, "2001Grossed"), VLOOKUP(MAX(Selection!RC[+9]:RC[+10]), R2C14:R4C15, 2), "")) -> 
A69: =1+R[-1]C -> 68 | B69: =IF(ISERROR(Selection!RC[+2]), "", IF(ISERROR(Selection!RC[+2]), "", Selection!RC[+4])) ->  | C69: =IF(ISERROR(Selection!RC[+1]), "", IF(ISERROR(Selection!RC[+1]), "", Selection!RC[+1])) ->  | D69: =IF(EQUAL(RC[-1], ""), "", IF(EQUAL(Menus!R10C11, "2001Grossed"), VLOOKUP(MAX(Selection!RC[+9]:RC[+10]), R2C14:R4C15, 2), "")) -> 
A70: =1+R[-1]C -> 69 | B70: =IF(ISERROR(Selection!RC[+2]), "", IF(ISERROR(Selection!RC[+2]), "", Selection!RC[+4])) ->  | C70: =IF(ISERROR(Selection!RC[+1]), "", IF(ISERROR(Selection!RC[+1]), "", Selection!RC[+1])) ->  | D70: =IF(EQUAL(RC[-1], ""), "", IF(EQUAL(Menus!R10C11, "2001Grossed"), VLOOKUP(MAX(Selection!RC[+9]:RC[+10]), R2C14:R4C15, 2), "")) -> 
A71: =1+R[-1]C -> 70 | B71: =IF(ISERROR(Selection!RC[+2]), "", IF(ISERROR(Selection!RC[+2]), "", Selection!RC[+4])) ->  | C71: =IF(ISERROR(Selection!RC[+1]), "", IF(ISERROR(Selection!RC[+1]), "", Selection!RC[+1])) ->  | D71: =IF(EQUAL(RC[-1], ""), "", IF(EQUAL(Menus!R10C11, "2001Grossed"), VLOOKUP(MAX(Selection!RC[+9]:RC[+10]), R2C14:R4C15, 2), "")) -> 
A72: =1+R[-1]C -> 71 | B72: =IF(ISERROR(Selection!RC[+2]), "", IF(ISERROR(Selection!RC[+2]), "", Selection!RC[+4])) ->  | C72: =IF(ISERROR(Selection!RC[+1]), "", IF(ISERROR(Selection!RC[+1]), "", Selection!RC[+1])) ->  | D72: =IF(EQUAL(RC[-1], ""), "", IF(EQUAL(Menus!R10C11, "2001Grossed"), VLOOKUP(MAX(Selection!RC[+9]:RC[+10]), R2C14:R4C15, 2), "")) -> 
A73: =1+R[-1]C -> 72 | B73: =IF(ISERROR(Selection!RC[+2]), "", IF(ISERROR(Selection!RC[+2]), "", Selection!RC[+4])) ->  | C73: =IF(ISERROR(Selection!RC[+1]), "", IF(ISERROR(Selection!RC[+1]), "", Selection!RC[+1])) ->  | D73: =IF(EQUAL(RC[-1], ""), "", IF(EQUAL(Menus!R10C11, "2001Grossed"), VLOOKUP(MAX(Selection!RC[+9]:RC[+10]), R2C14:R4C15, 2), "")) -> 
A74: =1+R[-1]C -> 73 | B74: =IF(ISERROR(Selection!RC[+2]), "", IF(ISERROR(Selection!RC[+2]), "", Selection!RC[+4])) ->  | C74: =IF(ISERROR(Selection!RC[+1]), "", IF(ISERROR(Selection!RC[+1]), "", Selection!RC[+1])) ->  | D74: =IF(EQUAL(RC[-1], ""), "", IF(EQUAL(Menus!R10C11, "2001Grossed"), VLOOKUP(MAX(Selection!RC[+9]:RC[+10]), R2C14:R4C15, 2), "")) -> 
A75: =1+R[-1]C -> 74 | B75: =IF(ISERROR(Selection!RC[+2]), "", IF(ISERROR(Selection!RC[+2]), "", Selection!RC[+4])) ->  | C75: =IF(ISERROR(Selection!RC[+1]), "", IF(ISERROR(Selection!RC[+1]), "", Selection!RC[+1])) ->  | D75: =IF(EQUAL(RC[-1], ""), "", IF(EQUAL(Menus!R10C11, "2001Grossed"), VLOOKUP(MAX(Selection!RC[+9]:RC[+10]), R2C14:R4C15, 2), "")) -> 
A76: =1+R[-1]C -> 75 | B76: =IF(ISERROR(Selection!RC[+2]), "", IF(ISERROR(Selection!RC[+2]), "", Selection!RC[+4])) ->  | C76: =IF(ISERROR(Selection!RC[+1]), "", IF(ISERROR(Selection!RC[+1]), "", Selection!RC[+1])) ->  | D76: =IF(EQUAL(RC[-1], ""), "", IF(EQUAL(Menus!R10C11, "2001Grossed"), VLOOKUP(MAX(Selection!RC[+9]:RC[+10]), R2C14:R4C15, 2), "")) -> 
A77: =1+R[-1]C -> 76 | B77: =IF(ISERROR(Selection!RC[+2]), "", IF(ISERROR(Selection!RC[+2]), "", Selection!RC[+4])) ->  | C77: =IF(ISERROR(Selection!RC[+1]), "", IF(ISERROR(Selection!RC[+1]), "", Selection!RC[+1])) ->  | D77: =IF(EQUAL(RC[-1], ""), "", IF(EQUAL(Menus!R10C11, "2001Grossed"), VLOOKUP(MAX(Selection!RC[+9]:RC[+10]), R2C14:R4C15, 2), "")) -> 
A78: =1+R[-1]C -> 77 | B78: =IF(ISERROR(Selection!RC[+2]), "", IF(ISERROR(Selection!RC[+2]), "", Selection!RC[+4])) ->  | C78: =IF(ISERROR(Selection!RC[+1]), "", IF(ISERROR(Selection!RC[+1]), "", Selection!RC[+1])) ->  | D78: =IF(EQUAL(RC[-1], ""), "", IF(EQUAL(Menus!R10C11, "2001Grossed"), VLOOKUP(MAX(Selection!RC[+9]:RC[+10]), R2C14:R4C15, 2), "")) -> 
A79: =1+R[-1]C -> 78 | B79: =IF(ISERROR(Selection!RC[+2]), "", IF(ISERROR(Selection!RC[+2]), "", Selection!RC[+4])) ->  | C79: =IF(ISERROR(Selection!RC[+1]), "", IF(ISERROR(Selection!RC[+1]), "", Selection!RC[+1])) ->  | D79: =IF(EQUAL(RC[-1], ""), "", IF(EQUAL(Menus!R10C11, "2001Grossed"), VLOOKUP(MAX(Selection!RC[+9]:RC[+10]), R2C14:R4C15, 2), "")) -> 
A80: =1+R[-1]C -> 79 | B80: =IF(ISERROR(Selection!RC[+2]), "", IF(ISERROR(Selection!RC[+2]), "", Selection!RC[+4])) ->  | C80: =IF(ISERROR(Selection!RC[+1]), "", IF(ISERROR(Selection!RC[+1]), "", Selection!RC[+1])) ->  | D80: =IF(EQUAL(RC[-1], ""), "", IF(EQUAL(Menus!R10C11, "2001Grossed"), VLOOKUP(MAX(Selection!RC[+9]:RC[+10]), R2C14:R4C15, 2), "")) -> 
A81: =1+R[-1]C -> 80 | B81: =IF(ISERROR(Selection!RC[+2]), "", IF(ISERROR(Selection!RC[+2]), "", Selection!RC[+4])) ->  | C81: =IF(ISERROR(Selection!RC[+1]), "", IF(ISERROR(Selection!RC[+1]), "", Selection!RC[+1])) ->  | D81: =IF(EQUAL(RC[-1], ""), "", IF(EQUAL(Menus!R10C11, "2001Grossed"), VLOOKUP(MAX(Selection!RC[+9]:RC[+10]), R2C14:R4C15, 2), "")) -> 
A82: =1+R[-1]C -> 81 | B82: =IF(ISERROR(Selection!RC[+2]), "", IF(ISERROR(Selection!RC[+2]), "", Selection!RC[+4])) ->  | C82: =IF(ISERROR(Selection!RC[+1]), "", IF(ISERROR(Selection!RC[+1]), "", Selection!RC[+1])) ->  | D82: =IF(EQUAL(RC[-1], ""), "", IF(EQUAL(Menus!R10C11, "2001Grossed"), VLOOKUP(MAX(Selection!RC[+9]:RC[+10]), R2C14:R4C15, 2), "")) -> 
A83: =1+R[-1]C -> 82 | B83: =IF(ISERROR(Selection!RC[+2]), "", IF(ISERROR(Selection!RC[+2]), "", Selection!RC[+4])) ->  | C83: =IF(ISERROR(Selection!RC[+1]), "", IF(ISERROR(Selection!RC[+1]), "", Selection!RC[+1])) ->  | D83: =IF(EQUAL(RC[-1], ""), "", IF(EQUAL(Menus!R10C11, "2001Grossed"), VLOOKUP(MAX(Selection!RC[+9]:RC[+10]), R2C14:R4C15, 2), "")) -> 
A84: =1+R[-1]C -> 83 | B84: =IF(ISERROR(Selection!RC[+2]), "", IF(ISERROR(Selection!RC[+2]), "", Selection!RC[+4])) ->  | C84: =IF(ISERROR(Selection!RC[+1]), "", IF(ISERROR(Selection!RC[+1]), "", Selection!RC[+1])) ->  | D84: =IF(EQUAL(RC[-1], ""), "", IF(EQUAL(Menus!R10C11, "2001Grossed"), VLOOKUP(MAX(Selection!RC[+9]:RC[+10]), R2C14:R4C15, 2), "")) -> 
A85: =1+R[-1]C -> 84 | B85: =IF(ISERROR(Selection!RC[+2]), "", IF(ISERROR(Selection!RC[+2]), "", Selection!RC[+4])) ->  | C85: =IF(ISERROR(Selection!RC[+1]), "", IF(ISERROR(Selection!RC[+1]), "", Selection!RC[+1])) ->  | D85: =IF(EQUAL(RC[-1], ""), "", IF(EQUAL(Menus!R10C11, "2001Grossed"), VLOOKUP(MAX(Selection!RC[+9]:RC[+10]), R2C14:R4C15, 2), "")) -> 
A86: =1+R[-1]C -> 85 | B86: =IF(ISERROR(Selection!RC[+2]), "", IF(ISERROR(Selection!RC[+2]), "", Selection!RC[+4])) ->  | C86: =IF(ISERROR(Selection!RC[+1]), "", IF(ISERROR(Selection!RC[+1]), "", Selection!RC[+1])) ->  | D86: =IF(EQUAL(RC[-1], ""), "", IF(EQUAL(Menus!R10C11, "2001Grossed"), VLOOKUP(MAX(Selection!RC[+9]:RC[+10]), R2C14:R4C15, 2), "")) -> 
A87: =1+R[-1]C -> 86 | B87: =IF(ISERROR(Selection!RC[+2]), "", IF(ISERROR(Selection!RC[+2]), "", Selection!RC[+4])) ->  | C87: =IF(ISERROR(Selection!RC[+1]), "", IF(ISERROR(Selection!RC[+1]), "", Selection!RC[+1])) ->  | D87: =IF(EQUAL(RC[-1], ""), "", IF(EQUAL(Menus!R10C11, "2001Grossed"), VLOOKUP(MAX(Selection!RC[+9]:RC[+10]), R2C14:R4C15, 2), "")) -> 
A88: =1+R[-1]C -> 87 | B88: =IF(ISERROR(Selection!RC[+2]), "", IF(ISERROR(Selection!RC[+2]), "", Selection!RC[+4])) ->  | C88: =IF(ISERROR(Selection!RC[+1]), "", IF(ISERROR(Selection!RC[+1]), "", Selection!RC[+1])) ->  | D88: =IF(EQUAL(RC[-1], ""), "", IF(EQUAL(Menus!R10C11, "2001Grossed"), VLOOKUP(MAX(Selection!RC[+9]:RC[+10]), R2C14:R4C15, 2), "")) -> 
A89: =1+R[-1]C -> 88 | B89: =IF(ISERROR(Selection!RC[+2]), "", IF(ISERROR(Selection!RC[+2]), "", Selection!RC[+4])) ->  | C89: =IF(ISERROR(Selection!RC[+1]), "", IF(ISERROR(Selection!RC[+1]), "", Selection!RC[+1])) ->  | D89: =IF(EQUAL(RC[-1], ""), "", IF(EQUAL(Menus!R10C11, "2001Grossed"), VLOOKUP(MAX(Selection!RC[+9]:RC[+10]), R2C14:R4C15, 2), "")) -> 
A90: =1+R[-1]C -> 89 | B90: =IF(ISERROR(Selection!RC[+2]), "", IF(ISERROR(Selection!RC[+2]), "", Selection!RC[+4])) ->  | C90: =IF(ISERROR(Selection!RC[+1]), "", IF(ISERROR(Selection!RC[+1]), "", Selection!RC[+1])) ->  | D90: =IF(EQUAL(RC[-1], ""), "", IF(EQUAL(Menus!R10C11, "2001Grossed"), VLOOKUP(MAX(Selection!RC[+9]:RC[+10]), R2C14:R4C15, 2), "")) -> 
A91: =1+R[-1]C -> 90 | B91: =IF(ISERROR(Selection!RC[+2]), "", IF(ISERROR(Selection!RC[+2]), "", Selection!RC[+4])) ->  | C91: =IF(ISERROR(Selection!RC[+1]), "", IF(ISERROR(Selection!RC[+1]), "", Selection!RC[+1])) ->  | D91: =IF(EQUAL(RC[-1], ""), "", IF(EQUAL(Menus!R10C11, "2001Grossed"), VLOOKUP(MAX(Selection!RC[+9]:RC[+10]), R2C14:R4C15, 2), "")) -> 
A92: =1+R[-1]C -> 91 | B92: =IF(ISERROR(Selection!RC[+2]), "", IF(ISERROR(Selection!RC[+2]), "", Selection!RC[+4])) ->  | C92: =IF(ISERROR(Selection!RC[+1]), "", IF(ISERROR(Selection!RC[+1]), "", Selection!RC[+1])) ->  | D92: =IF(EQUAL(RC[-1], ""), "", IF(EQUAL(Menus!R10C11, "2001Grossed"), VLOOKUP(MAX(Selection!RC[+9]:RC[+10]), R2C14:R4C15, 2), "")) -> 
A93: =1+R[-1]C -> 92 | B93: =IF(ISERROR(Selection!RC[+2]), "", IF(ISERROR(Selection!RC[+2]), "", Selection!RC[+4])) ->  | C93: =IF(ISERROR(Selection!RC[+1]), "", IF(ISERROR(Selection!RC[+1]), "", Selection!RC[+1])) ->  | D93: =IF(EQUAL(RC[-1], ""), "", IF(EQUAL(Menus!R10C11, "2001Grossed"), VLOOKUP(MAX(Selection!RC[+9]:RC[+10]), R2C14:R4C15, 2), "")) -> 
A94: =1+R[-1]C -> 93 | B94: =IF(ISERROR(Selection!RC[+2]), "", IF(ISERROR(Selection!RC[+2]), "", Selection!RC[+4])) ->  | C94: =IF(ISERROR(Selection!RC[+1]), "", IF(ISERROR(Selection!RC[+1]), "", Selection!RC[+1])) ->  | D94: =IF(EQUAL(RC[-1], ""), "", IF(EQUAL(Menus!R10C11, "2001Grossed"), VLOOKUP(MAX(Selection!RC[+9]:RC[+10]), R2C14:R4C15, 2), "")) -> 
A95: =1+R[-1]C -> 94 | B95: =IF(ISERROR(Selection!RC[+2]), "", IF(ISERROR(Selection!RC[+2]), "", Selection!RC[+4])) ->  | C95: =IF(ISERROR(Selection!RC[+1]), "", IF(ISERROR(Selection!RC[+1]), "", Selection!RC[+1])) ->  | D95: =IF(EQUAL(RC[-1], ""), "", IF(EQUAL(Menus!R10C11, "2001Grossed"), VLOOKUP(MAX(Selection!RC[+9]:RC[+10]), R2C14:R4C15, 2), "")) -> 
A96: =1+R[-1]C -> 95 | B96: =IF(ISERROR(Selection!RC[+2]), "", IF(ISERROR(Selection!RC[+2]), "", Selection!RC[+4])) ->  | C96: =IF(ISERROR(Selection!RC[+1]), "", IF(ISERROR(Selection!RC[+1]), "", Selection!RC[+1])) ->  | D96: =IF(EQUAL(RC[-1], ""), "", IF(EQUAL(Menus!R10C11, "2001Grossed"), VLOOKUP(MAX(Selection!RC[+9]:RC[+10]), R2C14:R4C15, 2), "")) -> 
A97: =1+R[-1]C -> 96 | B97: =IF(ISERROR(Selection!RC[+2]), "", IF(ISERROR(Selection!RC[+2]), "", Selection!RC[+4])) ->  | C97: =IF(ISERROR(Selection!RC[+1]), "", IF(ISERROR(Selection!RC[+1]), "", Selection!RC[+1])) ->  | D97: =IF(EQUAL(RC[-1], ""), "", IF(EQUAL(Menus!R10C11, "2001Grossed"), VLOOKUP(MAX(Selection!RC[+9]:RC[+10]), R2C14:R4C15, 2), "")) -> 
A98: =1+R[-1]C -> 97 | B98: =IF(ISERROR(Selection!RC[+2]), "", IF(ISERROR(Selection!RC[+2]), "", Selection!RC[+4])) ->  | C98: =IF(ISERROR(Selection!RC[+1]), "", IF(ISERROR(Selection!RC[+1]), "", Selection!RC[+1])) ->  | D98: =IF(EQUAL(RC[-1], ""), "", IF(EQUAL(Menus!R10C11, "2001Grossed"), VLOOKUP(MAX(Selection!RC[+9]:RC[+10]), R2C14:R4C15, 2), "")) -> 
A99: =1+R[-1]C -> 98 | B99: =IF(ISERROR(Selection!RC[+2]), "", IF(ISERROR(Selection!RC[+2]), "", Selection!RC[+4])) ->  | C99: =IF(ISERROR(Selection!RC[+1]), "", IF(ISERROR(Selection!RC[+1]), "", Selection!RC[+1])) ->  | D99: =IF(EQUAL(RC[-1], ""), "", IF(EQUAL(Menus!R10C11, "2001Grossed"), VLOOKUP(MAX(Selection!RC[+9]:RC[+10]), R2C14:R4C15, 2), "")) -> 
A100: =1+R[-1]C -> 99 | B100: =IF(ISERROR(Selection!RC[+2]), "", IF(ISERROR(Selection!RC[+2]), "", Selection!RC[+4])) ->  | C100: =IF(ISERROR(Selection!RC[+1]), "", IF(ISERROR(Selection!RC[+1]), "", Selection!RC[+1])) ->  | D100: =IF(EQUAL(RC[-1], ""), "", IF(EQUAL(Menus!R10C11, "2001Grossed"), VLOOKUP(MAX(Selection!RC[+9]:RC[+10]), R2C14:R4C15, 2), "")) -> 
A101: =1+R[-1]C -> 100 | B101: =IF(ISERROR(Selection!RC[+2]), "", IF(ISERROR(Selection!RC[+2]), "", Selection!RC[+4])) ->  | C101: =IF(ISERROR(Selection!RC[+1]), "", IF(ISERROR(Selection!RC[+1]), "", Selection!RC[+1])) ->  | D101: =IF(EQUAL(RC[-1], ""), "", IF(EQUAL(Menus!R10C11, "2001Grossed"), VLOOKUP(MAX(Selection!RC[+9]:RC[+10]), R2C14:R4C15, 2), "")) -> 

Sheet: Selection
A1: 'Row in data sheet | B1: 'x | C1: 'y | D1: 'Recurrent Expenditure (Euros) - Staff / Library Staff FTE - Total Staff | E1: 'Library Staff FTE - Total Staff | F1: 'Name | G1: 'EFTA | H1: 'EU | I1: 'België Nederlandstalige Universiteiten | J1: 'Belgique universités francophones | K1: =SUM(R[+1]C:R[+500]C) -> 21 | M1: 'Real data x | N1: 'Real data y
A2: 16 | B2: =INDEX(2001Grossed!R1C1:R46C51, RC1, 26) -> 899 | C2: =INDEX(2001Grossed!R1C1:R46C51, RC1, 27) -> 38129876 | D2: =IF(Menus!R9C10, RC[-1]/RC[-2], RC[-1]) -> 42413.6551724138 | E2: =IF(RC11=1, RC[-3], NA()) -> 899 | F2: =INDEX(2001Grossed!R1C1:R46C51, RC1, 1) -> Denmark | G2: =IF(EQUAL(INDEX(2001Grossed!R1C1:R46C51, RC1, 2), R1C), RC4, NA()) -> #NA | H2: =IF(EQUAL(INDEX(2001Grossed!R1C1:R46C51, RC1, 2), R1C), RC4, NA()) -> 42413.6551724138 | I2: =IF(EQUAL(INDEX(2001Grossed!R1C1:R46C51, RC1, 2), R1C), RC4, NA()) -> #NA | J2: =IF(EQUAL(INDEX(2001Grossed!R1C1:R46C51, RC1, 2), R1C), RC4, NA()) -> #NA | K2: =IF(OR(AND(NOT(ISERROR(RC7)), ISNUMBER(RC7)), AND(NOT(ISERROR(RC8)), ISNUMBER(RC8)), AND(NOT(ISERROR(RC9)), ISNUMBER(RC9)), AND(NOT(ISERROR(RC10)), ISNUMBER(RC10))), 1, 0) -> 1 | M2: =INDEX(Gross!R1C1:R46C51, RC1, 26) -> 0 | N2: =INDEX(Gross!R1C1:R46C51, RC1, 27) -> 0 | P2: 1 | Q2: 'Apportioned or estimated from previous years returns
A3: 26 | B3: =INDEX(2001Grossed!R1C1:R46C51, RC[-1], 26) -> 964 | C3: =INDEX(2001Grossed!R1C1:R46C51, RC1, 27) -> 38591900 | D3: =IF(Menus!R9C10, RC[-1]/RC[-2], RC[-1]) -> 40033.0912863071 | E3: =IF(RC11=1, RC[-3], NA()) -> 964 | F3: =INDEX(2001Grossed!R1C1:R46C51, RC1, 1) -> Norway | G3: =IF(EQUAL(INDEX(2001Grossed!R1C1:R46C51, RC1, 2), R1C), RC4, NA()) -> 40033.0912863071 | H3: =IF(EQUAL(INDEX(2001Grossed!R1C1:R46C51, RC1, 2), R1C), RC4, NA()) -> #NA | I3: =IF(EQUAL(INDEX(2001Grossed!R1C1:R46C51, RC1, 2), R1C), RC4, NA()) -> #NA | J3: =IF(EQUAL(INDEX(2001Grossed!R1C1:R46C51, RC1, 2), R1C), RC4, NA()) -> #NA | K3: =IF(OR(AND(NOT(ISERROR(RC7)), ISNUMBER(RC7)), AND(NOT(ISERROR(RC8)), ISNUMBER(RC8)), AND(NOT(ISERROR(RC9)), ISNUMBER(RC9)), AND(NOT(ISERROR(RC10)), ISNUMBER(RC10))), 1, 0) -> 1 | M3: =INDEX(Gross!R1C1:R46C51, RC1, 26) -> 0 | N3: =INDEX(Gross!R1C1:R46C51, RC1, 27) -> 0
A4: 19 | B4: =INDEX(2001Grossed!R1C1:R46C51, RC[-1], 26) -> 4364 | C4: =INDEX(2001Grossed!R1C1:R46C51, RC1, 27) -> 167287948 | D4: =IF(Menus!R9C10, RC[-1]/RC[-2], RC[-1]) -> 38333.6269477544 | E4: =IF(RC11=1, RC[-3], NA()) -> 4364 | F4: =INDEX(2001Grossed!R1C1:R46C51, RC1, 1) -> France | G4: =IF(EQUAL(INDEX(2001Grossed!R1C1:R46C51, RC1, 2), R1C), RC4, NA()) -> #NA | H4: =IF(EQUAL(INDEX(2001Grossed!R1C1:R46C51, RC1, 2), R1C), RC4, NA()) -> 38333.6269477544 | I4: =IF(EQUAL(INDEX(2001Grossed!R1C1:R46C51, RC1, 2), R1C), RC4, NA()) -> #NA | J4: =IF(EQUAL(INDEX(2001Grossed!R1C1:R46C51, RC1, 2), R1C), RC4, NA()) -> #NA | K4: =IF(OR(AND(NOT(ISERROR(RC7)), ISNUMBER(RC7)), AND(NOT(ISERROR(RC8)), ISNUMBER(RC8)), AND(NOT(ISERROR(RC9)), ISNUMBER(RC9)), AND(NOT(ISERROR(RC10)), ISNUMBER(RC10))), 1, 0) -> 1 | M4: =INDEX(Gross!R1C1:R46C51, RC1, 26) -> 1 | N4: =INDEX(Gross!R1C1:R46C51, RC1, 27) -> 1
A5: 29 | B5: =INDEX(2001Grossed!R1C1:R46C51, RC[-1], 26) -> 1733 | C5: =INDEX(2001Grossed!R1C1:R46C51, RC1, 27) -> 66313682 | D5: =IF(Menus!R9C10, RC[-1]/RC[-2], RC[-1]) -> 38265.2521638777 | E5: =IF(RC11=1, RC[-3], NA()) -> 1733 | F5: =INDEX(2001Grossed!R1C1:R46C51, RC1, 1) -> Sweden | G5: =IF(EQUAL(INDEX(2001Grossed!R1C1:R46C51, RC1, 2), R1C), RC4, NA()) -> #NA | H5: =IF(EQUAL(INDEX(2001Grossed!R1C1:R46C51, RC1, 2), R1C), RC4, NA()) -> 38265.2521638777 | I5: =IF(EQUAL(INDEX(2001Grossed!R1C1:R46C51, RC1, 2), R1C), RC4, NA()) -> #NA | J5: =IF(EQUAL(INDEX(2001Grossed!R1C1:R46C51, RC1, 2), R1C), RC4, NA()) -> #NA | K5: =IF(OR(AND(NOT(ISERROR(RC7)), ISNUMBER(RC7)), AND(NOT(ISERROR(RC8)), ISNUMBER(RC8)), AND(NOT(ISERROR(RC9)), ISNUMBER(RC9)), AND(NOT(ISERROR(RC10)), ISNUMBER(RC10))), 1, 0) -> 1 | M5: =INDEX(Gross!R1C1:R46C51, RC1, 26) -> 0 | N5: =INDEX(Gross!R1C1:R46C51, RC1, 27) -> 0
A6: 23 | B6: =INDEX(2001Grossed!R1C1:R46C51, RC[-1], 26) -> 5 | C6: =INDEX(2001Grossed!R1C1:R46C51, RC1, 27) -> 185623 | D6: =IF(Menus!R9C10, RC[-1]/RC[-2], RC[-1]) -> 37124.6 | E6: =IF(RC11=1, RC[-3], NA()) -> 5 | F6: =INDEX(2001Grossed!R1C1:R46C51, RC1, 1) -> Liechtenstein | G6: =IF(EQUAL(INDEX(2001Grossed!R1C1:R46C51, RC1, 2), R1C), RC4, NA()) -> 37124.6 | H6: =IF(EQUAL(INDEX(2001Grossed!R1C1:R46C51, RC1, 2), R1C), RC4, NA()) -> #NA | I6: =IF(EQUAL(INDEX(2001Grossed!R1C1:R46C51, RC1, 2), R1C), RC4, NA()) -> #NA | J6: =IF(EQUAL(INDEX(2001Grossed!R1C1:R46C51, RC1, 2), R1C), RC4, NA()) -> #NA | K6: =IF(OR(AND(NOT(ISERROR(RC7)), ISNUMBER(RC7)), AND(NOT(ISERROR(RC8)), ISNUMBER(RC8)), AND(NOT(ISERROR(RC9)), ISNUMBER(RC9)), AND(NOT(ISERROR(RC10)), ISNUMBER(RC10))), 1, 0) -> 1 | M6: =INDEX(Gross!R1C1:R46C51, RC1, 26) -> 2 | N6: =INDEX(Gross!R1C1:R46C51, RC1, 27) -> 2
A7: 31 | B7: =INDEX(2001Grossed!R1C1:R46C51, RC[-1], 26) -> 9820 | C7: =INDEX(2001Grossed!R1C1:R46C51, RC1, 27) -> 349430033 | D7: =IF(Menus!R9C10, RC[-1]/RC[-2], RC[-1]) -> 35583.5064154786 | E7: =IF(RC11=1, RC[-3], NA()) -> 9820 | F7: =INDEX(2001Grossed!R1C1:R46C51, RC1, 1) -> UK | G7: =IF(EQUAL(INDEX(2001Grossed!R1C1:R46C51, RC1, 2), R1C), RC4, NA()) -> #NA | H7: =IF(EQUAL(INDEX(2001Grossed!R1C1:R46C51, RC1, 2), R1C), RC4, NA()) -> 35583.5064154786 | I7: =IF(EQUAL(INDEX(2001Grossed!R1C1:R46C51, RC1, 2), R1C), RC4, NA()) -> #NA | J7: =IF(EQUAL(INDEX(2001Grossed!R1C1:R46C51, RC1, 2), R1C), RC4, NA()) -> #NA | K7: =IF(OR(AND(NOT(ISERROR(RC7)), ISNUMBER(RC7)), AND(NOT(ISERROR(RC8)), ISNUMBER(RC8)), AND(NOT(ISERROR(RC9)), ISNUMBER(RC9)), AND(NOT(ISERROR(RC10)), ISNUMBER(RC10))), 1, 0) -> 1 | M7: =INDEX(Gross!R1C1:R46C51, RC1, 26) -> 0 | N7: =INDEX(Gross!R1C1:R46C51, RC1, 27) -> 0
A8: 24 | B8: =INDEX(2001Grossed!R1C1:R46C51, RC[-1], 26) -> 9 | C8: =INDEX(2001Grossed!R1C1:R46C51, RC1, 27) -> 303856 | D8: =IF(Menus!R9C10, RC[-1]/RC[-2], RC[-1]) -> 33761.7777777778 | E8: =IF(RC11=1, RC[-3], NA()) -> 9 | F8: =INDEX(2001Grossed!R1C1:R46C51, RC1, 1) -> Luxembourg | G8: =IF(EQUAL(INDEX(2001Grossed!R1C1:R46C51, RC1, 2), R1C), RC4, NA()) -> #NA | H8: =IF(EQUAL(INDEX(2001Grossed!R1C1:R46C51, RC1, 2), R1C), RC4, NA()) -> 33761.7777777778 | I8: =IF(EQUAL(INDEX(2001Grossed!R1C1:R46C51, RC1, 2), R1C), RC4, NA()) -> #NA | J8: =IF(EQUAL(INDEX(2001Grossed!R1C1:R46C51, RC1, 2), R1C), RC4, NA()) -> #NA | K8: =IF(OR(AND(NOT(ISERROR(RC7)), ISNUMBER(RC7)), AND(NOT(ISERROR(RC8)), ISNUMBER(RC8)), AND(NOT(ISERROR(RC9)), ISNUMBER(RC9)), AND(NOT(ISERROR(RC10)), ISNUMBER(RC10))), 1, 0) -> 1 | M8: =INDEX(Gross!R1C1:R46C51, RC1, 26) -> 1 | N8: =INDEX(Gross!R1C1:R46C51, RC1, 27) -> 1
A9: 25 | B9: =INDEX(2001Grossed!R1C1:R46C51, RC[-1], 26) -> 1870 | C9: =INDEX(2001Grossed!R1C1:R46C51, RC1, 27) -> 59373118 | D9: =IF(Menus!R9C10, RC[-1]/RC[-2], RC[-1]) -> 31750.3304812834 | E9: =IF(RC11=1, RC[-3], NA()) -> 1870 | F9: =INDEX(2001Grossed!R1C1:R46C51, RC1, 1) -> Netherlands | G9: =IF(EQUAL(INDEX(2001Grossed!R1C1:R46C51, RC1, 2), R1C), RC4, NA()) -> #NA | H9: =IF(EQUAL(INDEX(2001Grossed!R1C1:R46C51, RC1, 2), R1C), RC4, NA()) -> 31750.3304812834 | I9: =IF(EQUAL(INDEX(2001Grossed!R1C1:R46C51, RC1, 2), R1C), RC4, NA()) -> #NA | J9: =IF(EQUAL(INDEX(2001Grossed!R1C1:R46C51, RC1, 2), R1C), RC4, NA()) -> #NA | K9: =IF(OR(AND(NOT(ISERROR(RC7)), ISNUMBER(RC7)), AND(NOT(ISERROR(RC8)), ISNUMBER(RC8)), AND(NOT(ISERROR(RC9)), ISNUMBER(RC9)), AND(NOT(ISERROR(RC10)), ISNUMBER(RC10))), 1, 0) -> 1 | M9: =INDEX(Gross!R1C1:R46C51, RC1, 26) -> 1 | N9: =INDEX(Gross!R1C1:R46C51, RC1, 27) -> 2
A10: 12 | B10: =INDEX(2001Grossed!R1C1:R46C51, RC[-1], 26) -> 941 | C10: =INDEX(2001Grossed!R1C1:R46C51, RC1, 27) -> 29650270 | D10: =IF(Menus!R9C10, RC[-1]/RC[-2], RC[-1]) -> 31509.3198724761 | E10: =IF(RC11=1, RC[-3], NA()) -> 941 | F10: =INDEX(2001Grossed!R1C1:R46C51, RC1, 1) -> Austria | G10: =IF(EQUAL(INDEX(2001Grossed!R1C1:R46C51, RC1, 2), R1C), RC4, NA()) -> #NA | H10: =IF(EQUAL(INDEX(2001Grossed!R1C1:R46C51, RC1, 2), R1C), RC4, NA()) -> 31509.3198724761 | I10: =IF(EQUAL(INDEX(2001Grossed!R1C1:R46C51, RC1, 2), R1C), RC4, NA()) -> #NA | J10: =IF(EQUAL(INDEX(2001Grossed!R1C1:R46C51, RC1, 2), R1C), RC4, NA()) -> #NA | K10: =IF(OR(AND(NOT(ISERROR(RC7)), ISNUMBER(RC7)), AND(NOT(ISERROR(RC8)), ISNUMBER(RC8)), AND(NOT(ISERROR(RC9)), ISNUMBER(RC9)), AND(NOT(ISERROR(RC10)), ISNUMBER(RC10))), 1, 0) -> 1 | M10: =INDEX(Gross!R1C1:R46C51, RC1, 26) -> 2 | N10: =INDEX(Gross!R1C1:R46C51, RC1, 27) -> 2
A11: 22 | B11: =INDEX(2001Grossed!R1C1:R46C51, RC[-1], 26) -> 6532 | C11: =INDEX(2001Grossed!R1C1:R46C51, RC1, 27) -> 203627804 | D11: =IF(Menus!R9C10, RC[-1]/RC[-2], RC[-1]) -> 31173.8830373546 | E11: =IF(RC11=1, RC[-3], NA()) -> 6532 | F11: =INDEX(2001Grossed!R1C1:R46C51, RC1, 1) -> Italy | G11: =IF(EQUAL(INDEX(2001Grossed!R1C1:R46C51, RC1, 2), R1C), RC4, NA()) -> #NA | H11: =IF(EQUAL(INDEX(2001Grossed!R1C1:R46C51, RC1, 2), R1C), RC4, NA()) -> 31173.8830373546 | I11: =IF(EQUAL(INDEX(2001Grossed!R1C1:R46C51, RC1, 2), R1C), RC4, NA()) -> #NA | J11: =IF(EQUAL(INDEX(2001Grossed!R1C1:R46C51, RC1, 2), R1C), RC4, NA()) -> #NA | K11: =IF(OR(AND(NOT(ISERROR(RC7)), ISNUMBER(RC7)), AND(NOT(ISERROR(RC8)), ISNUMBER(RC8)), AND(NOT(ISERROR(RC9)), ISNUMBER(RC9)), AND(NOT(ISERROR(RC10)), ISNUMBER(RC10))), 1, 0) -> 1 | M11: =INDEX(Gross!R1C1:R46C51, RC1, 26) -> 2 | N11: =INDEX(Gross!R1C1:R46C51, RC1, 27) -> 2
A12: 21 | B12: =INDEX(2001Grossed!R1C1:R46C51, RC[-1], 26) -> 54 | C12: =INDEX(2001Grossed!R1C1:R46C51, RC1, 27) -> 1484979 | D12: =IF(Menus!R9C10, RC[-1]/RC[-2], RC[-1]) -> 27499.6111111111 | E12: =IF(RC11=1, RC[-3], NA()) -> 54 | F12: =INDEX(2001Grossed!R1C1:R46C51, RC1, 1) -> Iceland | G12: =IF(EQUAL(INDEX(2001Grossed!R1C1:R46C51, RC1, 2), R1C), RC4, NA()) -> 27499.6111111111 | H12: =IF(EQUAL(INDEX(2001Grossed!R1C1:R46C51, RC1, 2), R1C), RC4, NA()) -> #NA | I12: =IF(EQUAL(INDEX(2001Grossed!R1C1:R46C51, RC1, 2), R1C), RC4, NA()) -> #NA | J12: =IF(EQUAL(INDEX(2001Grossed!R1C1:R46C51, RC1, 2), R1C), RC4, NA()) -> #NA | K12: =IF(OR(AND(NOT(ISERROR(RC7)), ISNUMBER(RC7)), AND(NOT(ISERROR(RC8)), ISNUMBER(RC8)), AND(NOT(ISERROR(RC9)), ISNUMBER(RC9)), AND(NOT(ISERROR(RC10)), ISNUMBER(RC10))), 1, 0) -> 1 | M12: =INDEX(Gross!R1C1:R46C51, RC1, 26) -> 2 | N12: =INDEX(Gross!R1C1:R46C51, RC1, 27) -> 2
A13: 18 | B13: =INDEX(2001Grossed!R1C1:R46C51, RC[-1], 26) -> 1448 | C13: =INDEX(2001Grossed!R1C1:R46C51, RC1, 27) -> 39607466 | D13: =IF(Menus!R9C10, RC[-1]/RC[-2], RC[-1]) -> 27353.2223756906 | E13: =IF(RC11=1, RC[-3], NA()) -> 1448 | F13: =INDEX(2001Grossed!R1C1:R46C51, RC1, 1) -> Finland | G13: =IF(EQUAL(INDEX(2001Grossed!R1C1:R46C51, RC1, 2), R1C), RC4, NA()) -> #NA | H13: =IF(EQUAL(INDEX(2001Grossed!R1C1:R46C51, RC1, 2), R1C), RC4, NA()) -> 27353.2223756906 | I13: =IF(EQUAL(INDEX(2001Grossed!R1C1:R46C51, RC1, 2), R1C), RC4, NA()) -> #NA | J13: =IF(EQUAL(INDEX(2001Grossed!R1C1:R46C51, RC1, 2), R1C), RC4, NA()) -> #NA | K13: =IF(OR(AND(NOT(ISERROR(RC7)), ISNUMBER(RC7)), AND(NOT(ISERROR(RC8)), ISNUMBER(RC8)), AND(NOT(ISERROR(RC9)), ISNUMBER(RC9)), AND(NOT(ISERROR(RC10)), ISNUMBER(RC10))), 1, 0) -> 1 | M13: =INDEX(Gross!R1C1:R46C51, RC1, 26) -> 0 | N13: =INDEX(Gross!R1C1:R46C51, RC1, 27) -> 0
A14: 13 | B14: =INDEX(2001Grossed!R1C1:R46C51, RC[-1], 26) -> 307 | C14: =INDEX(2001Grossed!R1C1:R46C51, RC1, 27) -> 8375210 | D14: =IF(Menus!R9C10, RC[-1]/RC[-2], RC[-1]) -> 27280.8143322476 | E14: =IF(RC11=1, RC[-3], NA()) -> 307 | F14: =INDEX(2001Grossed!R1C1:R46C51, RC1, 1) -> België Nederlandstalige Universiteiten | G14: =IF(EQUAL(INDEX(2001Grossed!R1C1:R46C51, RC1, 2), R1C), RC4, NA()) -> #NA | H14: =IF(EQUAL(INDEX(2001Grossed!R1C1:R46C51, RC1, 2), R1C), RC4, NA()) -> #NA | I14: =IF(EQUAL(INDEX(2001Grossed!R1C1:R46C51, RC1, 2), R1C), RC4, NA()) -> 27280.8143322476 | J14: =IF(EQUAL(INDEX(2001Grossed!R1C1:R46C51, RC1, 2), R1C), RC4, NA()) -> #NA | K14: =IF(OR(AND(NOT(ISERROR(RC7)), ISNUMBER(RC7)), AND(NOT(ISERROR(RC8)), ISNUMBER(RC8)), AND(NOT(ISERROR(RC9)), ISNUMBER(RC9)), AND(NOT(ISERROR(RC10)), ISNUMBER(RC10))), 1, 0) -> 1 | M14: =INDEX(Gross!R1C1:R46C51, RC1, 26) -> 0 | N14: =INDEX(Gross!R1C1:R46C51, RC1, 27) -> 0
A15: 32 | B15: =INDEX(2001Grossed!R1C1:R46C51, RC[-1], 26) -> 8869 | C15: =INDEX(2001Grossed!R1C1:R46C51, RC1, 27) -> 240640929 | D15: =IF(Menus!R9C10, RC[-1]/RC[-2], RC[-1]) -> 27132.8141842372 | E15: =IF(RC11=1, RC[-3], NA()) -> 8869 | F15: =INDEX(2001Grossed!R1C1:R46C51, RC1, 1) -> Germany | G15: =IF(EQUAL(INDEX(2001Grossed!R1C1:R46C51, RC1, 2), R1C), RC4, NA()) -> #NA | H15: =IF(EQUAL(INDEX(2001Grossed!R1C1:R46C51, RC1, 2), R1C), RC4, NA()) -> 27132.8141842372 | I15: =IF(EQUAL(INDEX(2001Grossed!R1C1:R46C51, RC1, 2), R1C), RC4, NA()) -> #NA | J15: =IF(EQUAL(INDEX(2001Grossed!R1C1:R46C51, RC1, 2), R1C), RC4, NA()) -> #NA | K15: =IF(OR(AND(NOT(ISERROR(RC7)), ISNUMBER(RC7)), AND(NOT(ISERROR(RC8)), ISNUMBER(RC8)), AND(NOT(ISERROR(RC9)), ISNUMBER(RC9)), AND(NOT(ISERROR(RC10)), ISNUMBER(RC10))), 1, 0) -> 1 | M15: =INDEX(Gross!R1C1:R46C51, RC1, 26) -> 0 | N15: =INDEX(Gross!R1C1:R46C51, RC1, 27) -> 0
A16: 15 | B16: =INDEX(2001Grossed!R1C1:R46C51, RC[-1], 26) -> 609 | C16: =INDEX(2001Grossed!R1C1:R46C51, RC1, 27) -> 15437393 | D16: =IF(Menus!R9C10, RC[-1]/RC[-2], RC[-1]) -> 25348.7569786535 | E16: =IF(RC11=1, RC[-3], NA()) -> 609 | F16: =INDEX(2001Grossed!R1C1:R46C51, RC1, 1) -> Belgium | G16: =IF(EQUAL(INDEX(2001Grossed!R1C1:R46C51, RC1, 2), R1C), RC4, NA()) -> #NA | H16: =IF(EQUAL(INDEX(2001Grossed!R1C1:R46C51, RC1, 2), R1C), RC4, NA()) -> 25348.7569786535 | I16: =IF(EQUAL(INDEX(2001Grossed!R1C1:R46C51, RC1, 2), R1C), RC4, NA()) -> #NA | J16: =IF(EQUAL(INDEX(2001Grossed!R1C1:R46C51, RC1, 2), R1C), RC4, NA()) -> #NA | K16: =IF(OR(AND(NOT(ISERROR(RC7)), ISNUMBER(RC7)), AND(NOT(ISERROR(RC8)), ISNUMBER(RC8)), AND(NOT(ISERROR(RC9)), ISNUMBER(RC9)), AND(NOT(ISERROR(RC10)), ISNUMBER(RC10))), 1, 0) -> 1 | M16: =INDEX(Gross!R1C1:R46C51, RC1, 26) -> 0 | N16: =INDEX(Gross!R1C1:R46C51, RC1, 27) -> 0
A17: 14 | B17: =INDEX(2001Grossed!R1C1:R46C51, RC[-1], 26) -> 301 | C17: =INDEX(2001Grossed!R1C1:R46C51, RC1, 27) -> 7062183 | D17: =IF(Menus!R9C10, RC[-1]/RC[-2], RC[-1]) -> 23462.4019933555 | E17: =IF(RC11=1, RC[-3], NA()) -> 301 | F17: =INDEX(2001Grossed!R1C1:R46C51, RC1, 1) -> Belgique universités francophones | G17: =IF(EQUAL(INDEX(2001Grossed!R1C1:R46C51, RC1, 2), R1C), RC4, NA()) -> #NA | H17: =IF(EQUAL(INDEX(2001Grossed!R1C1:R46C51, RC1, 2), R1C), RC4, NA()) -> #NA | I17: =IF(EQUAL(INDEX(2001Grossed!R1C1:R46C51, RC1, 2), R1C), RC4, NA()) -> #NA | J17: =IF(EQUAL(INDEX(2001Grossed!R1C1:R46C51, RC1, 2), R1C), RC4, NA()) -> 23462.4019933555 | K17: =IF(OR(AND(NOT(ISERROR(RC7)), ISNUMBER(RC7)), AND(NOT(ISERROR(RC8)), ISNUMBER(RC8)), AND(NOT(ISERROR(RC9)), ISNUMBER(RC9)), AND(NOT(ISERROR(RC10)), ISNUMBER(RC10))), 1, 0) -> 1 | M17: =INDEX(Gross!R1C1:R46C51, RC1, 26) -> 0 | N17: =INDEX(Gross!R1C1:R46C51, RC1, 27) -> 0 | P17: 0 | Q17: 'Returned Data for year 2000
A18: 30 | B18: =INDEX(2001Grossed!R1C1:R46C51, RC[-1], 26) -> 1429 | C18: =INDEX(2001Grossed!R1C1:R46C51, RC1, 27) -> 30070810 | D18: =IF(Menus!R9C10, RC[-1]/RC[-2], RC[-1]) -> 21043.2540237929 | E18: =IF(RC11=1, RC[-3], NA()) -> 1429 | F18: =INDEX(2001Grossed!R1C1:R46C51, RC1, 1) -> Switzerland | G18: =IF(EQUAL(INDEX(2001Grossed!R1C1:R46C51, RC1, 2), R1C), RC4, NA()) -> 21043.2540237929 | H18: =IF(EQUAL(INDEX(2001Grossed!R1C1:R46C51, RC1, 2), R1C), RC4, NA()) -> #NA | I18: =IF(EQUAL(INDEX(2001Grossed!R1C1:R46C51, RC1, 2), R1C), RC4, NA()) -> #NA | J18: =IF(EQUAL(INDEX(2001Grossed!R1C1:R46C51, RC1, 2), R1C), RC4, NA()) -> #NA | K18: =IF(OR(AND(NOT(ISERROR(RC7)), ISNUMBER(RC7)), AND(NOT(ISERROR(RC8)), ISNUMBER(RC8)), AND(NOT(ISERROR(RC9)), ISNUMBER(RC9)), AND(NOT(ISERROR(RC10)), ISNUMBER(RC10))), 1, 0) -> 1 | M18: =INDEX(Gross!R1C1:R46C51, RC1, 26) -> 2 | N18: =INDEX(Gross!R1C1:R46C51, RC1, 27) -> 2
A19: 17 | B19: =INDEX(2001Grossed!R1C1:R46C51, RC[-1], 26) -> 750 | C19: =INDEX(2001Grossed!R1C1:R46C51, RC1, 27) -> 15063180 | D19: =IF(Menus!R9C10, RC[-1]/RC[-2], RC[-1]) -> 20084.24 | E19: =IF(RC11=1, RC[-3], NA()) -> 750 | F19: =INDEX(2001Grossed!R1C1:R46C51, RC1, 1) -> Eire | G19: =IF(EQUAL(INDEX(2001Grossed!R1C1:R46C51, RC1, 2), R1C), RC4, NA()) -> #NA | H19: =IF(EQUAL(INDEX(2001Grossed!R1C1:R46C51, RC1, 2), R1C), RC4, NA()) -> 20084.24 | I19: =IF(EQUAL(INDEX(2001Grossed!R1C1:R46C51, RC1, 2), R1C), RC4, NA()) -> #NA | J19: =IF(EQUAL(INDEX(2001Grossed!R1C1:R46C51, RC1, 2), R1C), RC4, NA()) -> #NA | K19: =IF(OR(AND(NOT(ISERROR(RC7)), ISNUMBER(RC7)), AND(NOT(ISERROR(RC8)), ISNUMBER(RC8)), AND(NOT(ISERROR(RC9)), ISNUMBER(RC9)), AND(NOT(ISERROR(RC10)), ISNUMBER(RC10))), 1, 0) -> 1 | M19: =INDEX(Gross!R1C1:R46C51, RC1, 26) -> 2 | N19: =INDEX(Gross!R1C1:R46C51, RC1, 27) -> 2
A20: 28 | B20: =INDEX(2001Grossed!R1C1:R46C51, RC[-1], 26) -> 7430 | C20: =INDEX(2001Grossed!R1C1:R46C51, RC1, 27) -> 122788945 | D20: =IF(Menus!R9C10, RC[-1]/RC[-2], RC[-1]) -> 16526.102960969 | E20: =IF(RC11=1, RC[-3], NA()) -> 7430 | F20: =INDEX(2001Grossed!R1C1:R46C51, RC1, 1) -> Spain | G20: =IF(EQUAL(INDEX(2001Grossed!R1C1:R46C51, RC1, 2), R1C), RC4, NA()) -> #NA | H20: =IF(EQUAL(INDEX(2001Grossed!R1C1:R46C51, RC1, 2), R1C), RC4, NA()) -> 16526.102960969 | I20: =IF(EQUAL(INDEX(2001Grossed!R1C1:R46C51, RC1, 2), R1C), RC4, NA()) -> #NA | J20: =IF(EQUAL(INDEX(2001Grossed!R1C1:R46C51, RC1, 2), R1C), RC4, NA()) -> #NA | K20: =IF(OR(AND(NOT(ISERROR(RC7)), ISNUMBER(RC7)), AND(NOT(ISERROR(RC8)), ISNUMBER(RC8)), AND(NOT(ISERROR(RC9)), ISNUMBER(RC9)), AND(NOT(ISERROR(RC10)), ISNUMBER(RC10))), 1, 0) -> 1 | M20: =INDEX(Gross!R1C1:R46C51, RC1, 26) -> 1 | N20: =INDEX(Gross!R1C1:R46C51, RC1, 27) -> 1
A21: 27 | B21: =INDEX(2001Grossed!R1C1:R46C51, RC[-1], 26) -> 1215 | C21: =INDEX(2001Grossed!R1C1:R46C51, RC1, 27) -> 7048520 | D21: =IF(Menus!R9C10, RC[-1]/RC[-2], RC[-1]) -> 5801.25102880658 | E21: =IF(RC11=1, RC[-3], NA()) -> 1215 | F21: =INDEX(2001Grossed!R1C1:R46C51, RC1, 1) -> Portugal | G21: =IF(EQUAL(INDEX(2001Grossed!R1C1:R46C51, RC1, 2), R1C), RC4, NA()) -> #NA | H21: =IF(EQUAL(INDEX(2001Grossed!R1C1:R46C51, RC1, 2), R1C), RC4, NA()) -> 5801.25102880658 | I21: =IF(EQUAL(INDEX(2001Grossed!R1C1:R46C51, RC1, 2), R1C), RC4, NA()) -> #NA | J21: =IF(EQUAL(INDEX(2001Grossed!R1C1:R46C51, RC1, 2), R1C), RC4, NA()) -> #NA | K21: =IF(OR(AND(NOT(ISERROR(RC7)), ISNUMBER(RC7)), AND(NOT(ISERROR(RC8)), ISNUMBER(RC8)), AND(NOT(ISERROR(RC9)), ISNUMBER(RC9)), AND(NOT(ISERROR(RC10)), ISNUMBER(RC10))), 1, 0) -> 1 | M21: =INDEX(Gross!R1C1:R46C51, RC1, 26) -> 1 | N21: =INDEX(Gross!R1C1:R46C51, RC1, 27) -> 1 | P21: 2 | Q21: 'Grossed on regional averages
A22: 20 | B22: =INDEX(2001Grossed!R1C1:R46C51, RC[-1], 26) -> 1123 | C22: =INDEX(2001Grossed!R1C1:R46C51, RC1, 27) -> 4055275 | D22: =IF(Menus!R9C10, RC[-1]/RC[-2], RC[-1]) -> 3611.10863757792 | E22: =IF(RC11=1, RC[-3], NA()) -> 1123 | F22: =INDEX(2001Grossed!R1C1:R46C51, RC1, 1) -> Greece | G22: =IF(EQUAL(INDEX(2001Grossed!R1C1:R46C51, RC1, 2), R1C), RC4, NA()) -> #NA | H22: =IF(EQUAL(INDEX(2001Grossed!R1C1:R46C51, RC1, 2), R1C), RC4, NA()) -> 3611.10863757792 | I22: =IF(EQUAL(INDEX(2001Grossed!R1C1:R46C51, RC1, 2), R1C), RC4, NA()) -> #NA | J22: =IF(EQUAL(INDEX(2001Grossed!R1C1:R46C51, RC1, 2), R1C), RC4, NA()) -> #NA | K22: =IF(OR(AND(NOT(ISERROR(RC7)), ISNUMBER(RC7)), AND(NOT(ISERROR(RC8)), ISNUMBER(RC8)), AND(NOT(ISERROR(RC9)), ISNUMBER(RC9)), AND(NOT(ISERROR(RC10)), ISNUMBER(RC10))), 1, 0) -> 1 | M22: =INDEX(Gross!R1C1:R46C51, RC1, 26) -> 0 | N22: =INDEX(Gross!R1C1:R46C51, RC1, 27) -> 1
A23: 176 | B23: =INDEX(2001Grossed!R1C1:R46C51, RC[-1], 26) -> #REF! | C23: =INDEX(2001Grossed!R1C1:R46C51, RC1, 27) -> #REF! | D23: =IF(Menus!R9C10, RC[-1]/RC[-2], RC[-1]) -> #REF! | E23: =IF(RC11=1, RC[-3], NA()) -> #NA | F23: =INDEX(2001Grossed!R1C1:R46C51, RC1, 1) -> #REF! | G23: =IF(EQUAL(INDEX(2001Grossed!R1C1:R46C51, RC1, 2), R1C), RC4, NA()) -> #REF! | H23: =IF(EQUAL(INDEX(2001Grossed!R1C1:R46C51, RC1, 2), R1C), RC4, NA()) -> #REF! | I23: =IF(EQUAL(INDEX(2001Grossed!R1C1:R46C51, RC1, 2), R1C), RC4, NA()) -> #REF! | J23: =IF(EQUAL(INDEX(2001Grossed!R1C1:R46C51, RC1, 2), R1C), RC4, NA()) -> #REF! | K23: =IF(OR(AND(NOT(ISERROR(RC7)), ISNUMBER(RC7)), AND(NOT(ISERROR(RC8)), ISNUMBER(RC8)), AND(NOT(ISERROR(RC9)), ISNUMBER(RC9)), AND(NOT(ISERROR(RC10)), ISNUMBER(RC10))), 1, 0) -> 0 | M23: =INDEX(Gross!R1C1:R46C51, RC1, 26) -> #REF! | N23: =INDEX(Gross!R1C1:R46C51, RC1, 27) -> #REF!
A24: 129 | B24: =INDEX(2001Grossed!R1C1:R46C51, RC[-1], 26) -> #REF! | C24: =INDEX(2001Grossed!R1C1:R46C51, RC1, 27) -> #REF! | D24: =IF(Menus!R9C10, RC[-1]/RC[-2], RC[-1]) -> #REF! | E24: =IF(RC11=1, RC[-3], NA()) -> #NA | F24: =INDEX(2001Grossed!R1C1:R46C51, RC1, 1) -> #REF! | G24: =IF(EQUAL(INDEX(2001Grossed!R1C1:R46C51, RC1, 2), R1C), RC4, NA()) -> #REF! | H24: =IF(EQUAL(INDEX(2001Grossed!R1C1:R46C51, RC1, 2), R1C), RC4, NA()) -> #REF! | I24: =IF(EQUAL(INDEX(2001Grossed!R1C1:R46C51, RC1, 2), R1C), RC4, NA()) -> #REF! | J24: =IF(EQUAL(INDEX(2001Grossed!R1C1:R46C51, RC1, 2), R1C), RC4, NA()) -> #REF! | K24: =IF(OR(AND(NOT(ISERROR(RC7)), ISNUMBER(RC7)), AND(NOT(ISERROR(RC8)), ISNUMBER(RC8)), AND(NOT(ISERROR(RC9)), ISNUMBER(RC9)), AND(NOT(ISERROR(RC10)), ISNUMBER(RC10))), 1, 0) -> 0 | M24: =INDEX(Gross!R1C1:R46C51, RC1, 26) -> #REF! | N24: =INDEX(Gross!R1C1:R46C51, RC1, 27) -> #REF!
A25: 125 | B25: =INDEX(2001Grossed!R1C1:R46C51, RC[-1], 26) -> #REF! | C25: =INDEX(2001Grossed!R1C1:R46C51, RC1, 27) -> #REF! | D25: =IF(Menus!R9C10, RC[-1]/RC[-2], RC[-1]) -> #REF! | E25: =IF(RC11=1, RC[-3], NA()) -> #NA | F25: =INDEX(2001Grossed!R1C1:R46C51, RC1, 1) -> #REF! | G25: =IF(EQUAL(INDEX(2001Grossed!R1C1:R46C51, RC1, 2), R1C), RC4, NA()) -> #REF! | H25: =IF(EQUAL(INDEX(2001Grossed!R1C1:R46C51, RC1, 2), R1C), RC4, NA()) -> #REF! | I25: =IF(EQUAL(INDEX(2001Grossed!R1C1:R46C51, RC1, 2), R1C), RC4, NA()) -> #REF! | J25: =IF(EQUAL(INDEX(2001Grossed!R1C1:R46C51, RC1, 2), R1C), RC4, NA()) -> #REF! | K25: =IF(OR(AND(NOT(ISERROR(RC7)), ISNUMBER(RC7)), AND(NOT(ISERROR(RC8)), ISNUMBER(RC8)), AND(NOT(ISERROR(RC9)), ISNUMBER(RC9)), AND(NOT(ISERROR(RC10)), ISNUMBER(RC10))), 1, 0) -> 0 | M25: =INDEX(Gross!R1C1:R46C51, RC1, 26) -> #REF! | N25: =INDEX(Gross!R1C1:R46C51, RC1, 27) -> #REF!
A26: 47 | B26: =INDEX(2001Grossed!R1C1:R46C51, RC[-1], 26) -> #REF! | C26: =INDEX(2001Grossed!R1C1:R46C51, RC1, 27) -> #REF! | D26: =IF(Menus!R9C10, RC[-1]/RC[-2], RC[-1]) -> #REF! | E26: =IF(RC11=1, RC[-3], NA()) -> #NA | F26: =INDEX(2001Grossed!R1C1:R46C51, RC1, 1) -> #REF! | G26: =IF(EQUAL(INDEX(2001Grossed!R1C1:R46C51, RC1, 2), R1C), RC4, NA()) -> #REF! | H26: =IF(EQUAL(INDEX(2001Grossed!R1C1:R46C51, RC1, 2), R1C), RC4, NA()) -> #REF! | I26: =IF(EQUAL(INDEX(2001Grossed!R1C1:R46C51, RC1, 2), R1C), RC4, NA()) -> #REF! | J26: =IF(EQUAL(INDEX(2001Grossed!R1C1:R46C51, RC1, 2), R1C), RC4, NA()) -> #REF! | K26: =IF(OR(AND(NOT(ISERROR(RC7)), ISNUMBER(RC7)), AND(NOT(ISERROR(RC8)), ISNUMBER(RC8)), AND(NOT(ISERROR(RC9)), ISNUMBER(RC9)), AND(NOT(ISERROR(RC10)), ISNUMBER(RC10))), 1, 0) -> 0 | M26: =INDEX(Gross!R1C1:R46C51, RC1, 26) -> #REF! | N26: =INDEX(Gross!R1C1:R46C51, RC1, 27) -> #REF!
A27: 187 | B27: =INDEX(2001Grossed!R1C1:R46C51, RC[-1], 26) -> #REF! | C27: =INDEX(2001Grossed!R1C1:R46C51, RC1, 27) -> #REF! | D27: =IF(Menus!R9C10, RC[-1]/RC[-2], RC[-1]) -> #REF! | E27: =IF(RC11=1, RC[-3], NA()) -> #NA | F27: =INDEX(2001Grossed!R1C1:R46C51, RC1, 1) -> #REF! | G27: =IF(EQUAL(INDEX(2001Grossed!R1C1:R46C51, RC1, 2), R1C), RC4, NA()) -> #REF! | H27: =IF(EQUAL(INDEX(2001Grossed!R1C1:R46C51, RC1, 2), R1C), RC4, NA()) -> #REF! | I27: =IF(EQUAL(INDEX(2001Grossed!R1C1:R46C51, RC1, 2), R1C), RC4, NA()) -> #REF! | J27: =IF(EQUAL(INDEX(2001Grossed!R1C1:R46C51, RC1, 2), R1C), RC4, NA()) -> #REF! | K27: =IF(OR(AND(NOT(ISERROR(RC7)), ISNUMBER(RC7)), AND(NOT(ISERROR(RC8)), ISNUMBER(RC8)), AND(NOT(ISERROR(RC9)), ISNUMBER(RC9)), AND(NOT(ISERROR(RC10)), ISNUMBER(RC10))), 1, 0) -> 0 | M27: =INDEX(Gross!R1C1:R46C51, RC1, 26) -> #REF! | N27: =INDEX(Gross!R1C1:R46C51, RC1, 27) -> #REF!
A28: 122 | B28: =INDEX(2001Grossed!R1C1:R46C51, RC[-1], 26) -> #REF! | C28: =INDEX(2001Grossed!R1C1:R46C51, RC1, 27) -> #REF! | D28: =IF(Menus!R9C10, RC[-1]/RC[-2], RC[-1]) -> #REF! | E28: =IF(RC11=1, RC[-3], NA()) -> #NA | F28: =INDEX(2001Grossed!R1C1:R46C51, RC1, 1) -> #REF! | G28: =IF(EQUAL(INDEX(2001Grossed!R1C1:R46C51, RC1, 2), R1C), RC4, NA()) -> #REF! | H28: =IF(EQUAL(INDEX(2001Grossed!R1C1:R46C51, RC1, 2), R1C), RC4, NA()) -> #REF! | I28: =IF(EQUAL(INDEX(2001Grossed!R1C1:R46C51, RC1, 2), R1C), RC4, NA()) -> #REF! | J28: =IF(EQUAL(INDEX(2001Grossed!R1C1:R46C51, RC1, 2), R1C), RC4, NA()) -> #REF! | K28: =IF(OR(AND(NOT(ISERROR(RC7)), ISNUMBER(RC7)), AND(NOT(ISERROR(RC8)), ISNUMBER(RC8)), AND(NOT(ISERROR(RC9)), ISNUMBER(RC9)), AND(NOT(ISERROR(RC10)), ISNUMBER(RC10))), 1, 0) -> 0 | M28: =INDEX(Gross!R1C1:R46C51, RC1, 26) -> #REF! | N28: =INDEX(Gross!R1C1:R46C51, RC1, 27) -> #REF!
A29: 86 | B29: =INDEX(2001Grossed!R1C1:R46C51, RC[-1], 26) -> #REF! | C29: =INDEX(2001Grossed!R1C1:R46C51, RC1, 27) -> #REF! | D29: =IF(Menus!R9C10, RC[-1]/RC[-2], RC[-1]) -> #REF! | E29: =IF(RC11=1, RC[-3], NA()) -> #NA | F29: =INDEX(2001Grossed!R1C1:R46C51, RC1, 1) -> #REF! | G29: =IF(EQUAL(INDEX(2001Grossed!R1C1:R46C51, RC1, 2), R1C), RC4, NA()) -> #REF! | H29: =IF(EQUAL(INDEX(2001Grossed!R1C1:R46C51, RC1, 2), R1C), RC4, NA()) -> #REF! | I29: =IF(EQUAL(INDEX(2001Grossed!R1C1:R46C51, RC1, 2), R1C), RC4, NA()) -> #REF! | J29: =IF(EQUAL(INDEX(2001Grossed!R1C1:R46C51, RC1, 2), R1C), RC4, NA()) -> #REF! | K29: =IF(OR(AND(NOT(ISERROR(RC7)), ISNUMBER(RC7)), AND(NOT(ISERROR(RC8)), ISNUMBER(RC8)), AND(NOT(ISERROR(RC9)), ISNUMBER(RC9)), AND(NOT(ISERROR(RC10)), ISNUMBER(RC10))), 1, 0) -> 0 | M29: =INDEX(Gross!R1C1:R46C51, RC1, 26) -> #REF! | N29: =INDEX(Gross!R1C1:R46C51, RC1, 27) -> #REF!
A30: 167 | B30: =INDEX(2001Grossed!R1C1:R46C51, RC[-1], 26) -> #REF! | C30: =INDEX(2001Grossed!R1C1:R46C51, RC1, 27) -> #REF! | D30: =IF(Menus!R9C10, RC[-1]/RC[-2], RC[-1]) -> #REF! | E30: =IF(RC11=1, RC[-3], NA()) -> #NA | F30: =INDEX(2001Grossed!R1C1:R46C51, RC1, 1) -> #REF! | G30: =IF(EQUAL(INDEX(2001Grossed!R1C1:R46C51, RC1, 2), R1C), RC4, NA()) -> #REF! | H30: =IF(EQUAL(INDEX(2001Grossed!R1C1:R46C51, RC1, 2), R1C), RC4, NA()) -> #REF! | I30: =IF(EQUAL(INDEX(2001Grossed!R1C1:R46C51, RC1, 2), R1C), RC4, NA()) -> #REF! | J30: =IF(EQUAL(INDEX(2001Grossed!R1C1:R46C51, RC1, 2), R1C), RC4, NA()) -> #REF! | K30: =IF(OR(AND(NOT(ISERROR(RC7)), ISNUMBER(RC7)), AND(NOT(ISERROR(RC8)), ISNUMBER(RC8)), AND(NOT(ISERROR(RC9)), ISNUMBER(RC9)), AND(NOT(ISERROR(RC10)), ISNUMBER(RC10))), 1, 0) -> 0 | M30: =INDEX(Gross!R1C1:R46C51, RC1, 26) -> #REF! | N30: =INDEX(Gross!R1C1:R46C51, RC1, 27) -> #REF!
A31: 113 | B31: =INDEX(2001Grossed!R1C1:R46C51, RC[-1], 26) -> #REF! | C31: =INDEX(2001Grossed!R1C1:R46C51, RC1, 27) -> #REF! | D31: =IF(Menus!R9C10, RC[-1]/RC[-2], RC[-1]) -> #REF! | E31: =IF(RC11=1, RC[-3], NA()) -> #NA | F31: =INDEX(2001Grossed!R1C1:R46C51, RC1, 1) -> #REF! | G31: =IF(EQUAL(INDEX(2001Grossed!R1C1:R46C51, RC1, 2), R1C), RC4, NA()) -> #REF! | H31: =IF(EQUAL(INDEX(2001Grossed!R1C1:R46C51, RC1, 2), R1C), RC4, NA()) -> #REF! | I31: =IF(EQUAL(INDEX(2001Grossed!R1C1:R46C51, RC1, 2), R1C), RC4, NA()) -> #REF! | J31: =IF(EQUAL(INDEX(2001Grossed!R1C1:R46C51, RC1, 2), R1C), RC4, NA()) -> #REF! | K31: =IF(OR(AND(NOT(ISERROR(RC7)), ISNUMBER(RC7)), AND(NOT(ISERROR(RC8)), ISNUMBER(RC8)), AND(NOT(ISERROR(RC9)), ISNUMBER(RC9)), AND(NOT(ISERROR(RC10)), ISNUMBER(RC10))), 1, 0) -> 0 | M31: =INDEX(Gross!R1C1:R46C51, RC1, 26) -> #REF! | N31: =INDEX(Gross!R1C1:R46C51, RC1, 27) -> #REF!
A32: 119 | B32: =INDEX(2001Grossed!R1C1:R46C51, RC[-1], 26) -> #REF! | C32: =INDEX(2001Grossed!R1C1:R46C51, RC1, 27) -> #REF! | D32: =IF(Menus!R9C10, RC[-1]/RC[-2], RC[-1]) -> #REF! | E32: =IF(RC11=1, RC[-3], NA()) -> #NA | F32: =INDEX(2001Grossed!R1C1:R46C51, RC1, 1) -> #REF! | G32: =IF(EQUAL(INDEX(2001Grossed!R1C1:R46C51, RC1, 2), R1C), RC4, NA()) -> #REF! | H32: =IF(EQUAL(INDEX(2001Grossed!R1C1:R46C51, RC1, 2), R1C), RC4, NA()) -> #REF! | I32: =IF(EQUAL(INDEX(2001Grossed!R1C1:R46C51, RC1, 2), R1C), RC4, NA()) -> #REF! | J32: =IF(EQUAL(INDEX(2001Grossed!R1C1:R46C51, RC1, 2), R1C), RC4, NA()) -> #REF! | K32: =IF(OR(AND(NOT(ISERROR(RC7)), ISNUMBER(RC7)), AND(NOT(ISERROR(RC8)), ISNUMBER(RC8)), AND(NOT(ISERROR(RC9)), ISNUMBER(RC9)), AND(NOT(ISERROR(RC10)), ISNUMBER(RC10))), 1, 0) -> 0 | M32: =INDEX(Gross!R1C1:R46C51, RC1, 26) -> #REF! | N32: =INDEX(Gross!R1C1:R46C51, RC1, 27) -> #REF!
A33: 91 | B33: =INDEX(2001Grossed!R1C1:R46C51, RC[-1], 26) -> #REF! | C33: =INDEX(2001Grossed!R1C1:R46C51, RC1, 27) -> #REF! | D33: =IF(Menus!R9C10, RC[-1]/RC[-2], RC[-1]) -> #REF! | E33: =IF(RC11=1, RC[-3], NA()) -> #NA | F33: =INDEX(2001Grossed!R1C1:R46C51, RC1, 1) -> #REF! | G33: =IF(EQUAL(INDEX(2001Grossed!R1C1:R46C51, RC1, 2), R1C), RC4, NA()) -> #REF! | H33: =IF(EQUAL(INDEX(2001Grossed!R1C1:R46C51, RC1, 2), R1C), RC4, NA()) -> #REF! | I33: =IF(EQUAL(INDEX(2001Grossed!R1C1:R46C51, RC1, 2), R1C), RC4, NA()) -> #REF! | J33: =IF(EQUAL(INDEX(2001Grossed!R1C1:R46C51, RC1, 2), R1C), RC4, NA()) -> #REF! | K33: =IF(OR(AND(NOT(ISERROR(RC7)), ISNUMBER(RC7)), AND(NOT(ISERROR(RC8)), ISNUMBER(RC8)), AND(NOT(ISERROR(RC9)), ISNUMBER(RC9)), AND(NOT(ISERROR(RC10)), ISNUMBER(RC10))), 1, 0) -> 0 | M33: =INDEX(Gross!R1C1:R46C51, RC1, 26) -> #REF! | N33: =INDEX(Gross!R1C1:R46C51, RC1, 27) -> #REF!
A34: 75 | B34: =INDEX(2001Grossed!R1C1:R46C51, RC[-1], 26) -> #REF! | C34: =INDEX(2001Grossed!R1C1:R46C51, RC1, 27) -> #REF! | D34: =IF(Menus!R9C10, RC[-1]/RC[-2], RC[-1]) -> #REF! | E34: =IF(RC11=1, RC[-3], NA()) -> #NA | F34: =INDEX(2001Grossed!R1C1:R46C51, RC1, 1) -> #REF! | G34: =IF(EQUAL(INDEX(2001Grossed!R1C1:R46C51, RC1, 2), R1C), RC4, NA()) -> #REF! | H34: =IF(EQUAL(INDEX(2001Grossed!R1C1:R46C51, RC1, 2), R1C), RC4, NA()) -> #REF! | I34: =IF(EQUAL(INDEX(2001Grossed!R1C1:R46C51, RC1, 2), R1C), RC4, NA()) -> #REF! | J34: =IF(EQUAL(INDEX(2001Grossed!R1C1:R46C51, RC1, 2), R1C), RC4, NA()) -> #REF! | K34: =IF(OR(AND(NOT(ISERROR(RC7)), ISNUMBER(RC7)), AND(NOT(ISERROR(RC8)), ISNUMBER(RC8)), AND(NOT(ISERROR(RC9)), ISNUMBER(RC9)), AND(NOT(ISERROR(RC10)), ISNUMBER(RC10))), 1, 0) -> 0 | M34: =INDEX(Gross!R1C1:R46C51, RC1, 26) -> #REF! | N34: =INDEX(Gross!R1C1:R46C51, RC1, 27) -> #REF!
A35: 65 | B35: =INDEX(2001Grossed!R1C1:R46C51, RC[-1], 26) -> #REF! | C35: =INDEX(2001Grossed!R1C1:R46C51, RC1, 27) -> #REF! | D35: =IF(Menus!R9C10, RC[-1]/RC[-2], RC[-1]) -> #REF! | E35: =IF(RC11=1, RC[-3], NA()) -> #NA | F35: =INDEX(2001Grossed!R1C1:R46C51, RC1, 1) -> #REF! | G35: =IF(EQUAL(INDEX(2001Grossed!R1C1:R46C51, RC1, 2), R1C), RC4, NA()) -> #REF! | H35: =IF(EQUAL(INDEX(2001Grossed!R1C1:R46C51, RC1, 2), R1C), RC4, NA()) -> #REF! | I35: =IF(EQUAL(INDEX(2001Grossed!R1C1:R46C51, RC1, 2), R1C), RC4, NA()) -> #REF! | J35: =IF(EQUAL(INDEX(2001Grossed!R1C1:R46C51, RC1, 2), R1C), RC4, NA()) -> #REF! | K35: =IF(OR(AND(NOT(ISERROR(RC7)), ISNUMBER(RC7)), AND(NOT(ISERROR(RC8)), ISNUMBER(RC8)), AND(NOT(ISERROR(RC9)), ISNUMBER(RC9)), AND(NOT(ISERROR(RC10)), ISNUMBER(RC10))), 1, 0) -> 0 | M35: =INDEX(Gross!R1C1:R46C51, RC1, 26) -> #REF! | N35: =INDEX(Gross!R1C1:R46C51, RC1, 27) -> #REF!
A36: 49 | B36: =INDEX(2001Grossed!R1C1:R46C51, RC[-1], 26) -> #REF! | C36: =INDEX(2001Grossed!R1C1:R46C51, RC1, 27) -> #REF! | D36: =IF(Menus!R9C10, RC[-1]/RC[-2], RC[-1]) -> #REF! | E36: =IF(RC11=1, RC[-3], NA()) -> #NA | F36: =INDEX(2001Grossed!R1C1:R46C51, RC1, 1) -> #REF! | G36: =IF(EQUAL(INDEX(2001Grossed!R1C1:R46C51, RC1, 2), R1C), RC4, NA()) -> #REF! | H36: =IF(EQUAL(INDEX(2001Grossed!R1C1:R46C51, RC1, 2), R1C), RC4, NA()) -> #REF! | I36: =IF(EQUAL(INDEX(2001Grossed!R1C1:R46C51, RC1, 2), R1C), RC4, NA()) -> #REF! | J36: =IF(EQUAL(INDEX(2001Grossed!R1C1:R46C51, RC1, 2), R1C), RC4, NA()) -> #REF! | K36: =IF(OR(AND(NOT(ISERROR(RC7)), ISNUMBER(RC7)), AND(NOT(ISERROR(RC8)), ISNUMBER(RC8)), AND(NOT(ISERROR(RC9)), ISNUMBER(RC9)), AND(NOT(ISERROR(RC10)), ISNUMBER(RC10))), 1, 0) -> 0 | M36: =INDEX(Gross!R1C1:R46C51, RC1, 26) -> #REF! | N36: =INDEX(Gross!R1C1:R46C51, RC1, 27) -> #REF!
A37: 171 | B37: =INDEX(2001Grossed!R1C1:R46C51, RC[-1], 26) -> #REF! | C37: =INDEX(2001Grossed!R1C1:R46C51, RC1, 27) -> #REF! | D37: =IF(Menus!R9C10, RC[-1]/RC[-2], RC[-1]) -> #REF! | E37: =IF(RC11=1, RC[-3], NA()) -> #NA | F37: =INDEX(2001Grossed!R1C1:R46C51, RC1, 1) -> #REF! | G37: =IF(EQUAL(INDEX(2001Grossed!R1C1:R46C51, RC1, 2), R1C), RC4, NA()) -> #REF! | H37: =IF(EQUAL(INDEX(2001Grossed!R1C1:R46C51, RC1, 2), R1C), RC4, NA()) -> #REF! | I37: =IF(EQUAL(INDEX(2001Grossed!R1C1:R46C51, RC1, 2), R1C), RC4, NA()) -> #REF! | J37: =IF(EQUAL(INDEX(2001Grossed!R1C1:R46C51, RC1, 2), R1C), RC4, NA()) -> #REF! | K37: =IF(OR(AND(NOT(ISERROR(RC7)), ISNUMBER(RC7)), AND(NOT(ISERROR(RC8)), ISNUMBER(RC8)), AND(NOT(ISERROR(RC9)), ISNUMBER(RC9)), AND(NOT(ISERROR(RC10)), ISNUMBER(RC10))), 1, 0) -> 0 | M37: =INDEX(Gross!R1C1:R46C51, RC1, 26) -> #REF! | N37: =INDEX(Gross!R1C1:R46C51, RC1, 27) -> #REF!
A38: 138 | B38: =INDEX(2001Grossed!R1C1:R46C51, RC[-1], 26) -> #REF! | C38: =INDEX(2001Grossed!R1C1:R46C51, RC1, 27) -> #REF! | D38: =IF(Menus!R9C10, RC[-1]/RC[-2], RC[-1]) -> #REF! | E38: =IF(RC11=1, RC[-3], NA()) -> #NA | F38: =INDEX(2001Grossed!R1C1:R46C51, RC1, 1) -> #REF! | G38: =IF(EQUAL(INDEX(2001Grossed!R1C1:R46C51, RC1, 2), R1C), RC4, NA()) -> #REF! | H38: =IF(EQUAL(INDEX(2001Grossed!R1C1:R46C51, RC1, 2), R1C), RC4, NA()) -> #REF! | I38: =IF(EQUAL(INDEX(2001Grossed!R1C1:R46C51, RC1, 2), R1C), RC4, NA()) -> #REF! | J38: =IF(EQUAL(INDEX(2001Grossed!R1C1:R46C51, RC1, 2), R1C), RC4, NA()) -> #REF! | K38: =IF(OR(AND(NOT(ISERROR(RC7)), ISNUMBER(RC7)), AND(NOT(ISERROR(RC8)), ISNUMBER(RC8)), AND(NOT(ISERROR(RC9)), ISNUMBER(RC9)), AND(NOT(ISERROR(RC10)), ISNUMBER(RC10))), 1, 0) -> 0 | M38: =INDEX(Gross!R1C1:R46C51, RC1, 26) -> #REF! | N38: =INDEX(Gross!R1C1:R46C51, RC1, 27) -> #REF!
A39: 107 | B39: =INDEX(2001Grossed!R1C1:R46C51, RC[-1], 26) -> #REF! | C39: =INDEX(2001Grossed!R1C1:R46C51, RC1, 27) -> #REF! | D39: =IF(Menus!R9C10, RC[-1]/RC[-2], RC[-1]) -> #REF! | E39: =IF(RC11=1, RC[-3], NA()) -> #NA | F39: =INDEX(2001Grossed!R1C1:R46C51, RC1, 1) -> #REF! | G39: =IF(EQUAL(INDEX(2001Grossed!R1C1:R46C51, RC1, 2), R1C), RC4, NA()) -> #REF! | H39: =IF(EQUAL(INDEX(2001Grossed!R1C1:R46C51, RC1, 2), R1C), RC4, NA()) -> #REF! | I39: =IF(EQUAL(INDEX(2001Grossed!R1C1:R46C51, RC1, 2), R1C), RC4, NA()) -> #REF! | J39: =IF(EQUAL(INDEX(2001Grossed!R1C1:R46C51, RC1, 2), R1C), RC4, NA()) -> #REF! | K39: =IF(OR(AND(NOT(ISERROR(RC7)), ISNUMBER(RC7)), AND(NOT(ISERROR(RC8)), ISNUMBER(RC8)), AND(NOT(ISERROR(RC9)), ISNUMBER(RC9)), AND(NOT(ISERROR(RC10)), ISNUMBER(RC10))), 1, 0) -> 0 | M39: =INDEX(Gross!R1C1:R46C51, RC1, 26) -> #REF! | N39: =INDEX(Gross!R1C1:R46C51, RC1, 27) -> #REF!
A40: 67 | B40: =INDEX(2001Grossed!R1C1:R46C51, RC[-1], 26) -> #REF! | C40: =INDEX(2001Grossed!R1C1:R46C51, RC1, 27) -> #REF! | D40: =IF(Menus!R9C10, RC[-1]/RC[-2], RC[-1]) -> #REF! | E40: =IF(RC11=1, RC[-3], NA()) -> #NA | F40: =INDEX(2001Grossed!R1C1:R46C51, RC1, 1) -> #REF! | G40: =IF(EQUAL(INDEX(2001Grossed!R1C1:R46C51, RC1, 2), R1C), RC4, NA()) -> #REF! | H40: =IF(EQUAL(INDEX(2001Grossed!R1C1:R46C51, RC1, 2), R1C), RC4, NA()) -> #REF! | I40: =IF(EQUAL(INDEX(2001Grossed!R1C1:R46C51, RC1, 2), R1C), RC4, NA()) -> #REF! | J40: =IF(EQUAL(INDEX(2001Grossed!R1C1:R46C51, RC1, 2), R1C), RC4, NA()) -> #REF! | K40: =IF(OR(AND(NOT(ISERROR(RC7)), ISNUMBER(RC7)), AND(NOT(ISERROR(RC8)), ISNUMBER(RC8)), AND(NOT(ISERROR(RC9)), ISNUMBER(RC9)), AND(NOT(ISERROR(RC10)), ISNUMBER(RC10))), 1, 0) -> 0 | M40: =INDEX(Gross!R1C1:R46C51, RC1, 26) -> #REF! | N40: =INDEX(Gross!R1C1:R46C51, RC1, 27) -> #REF!
A41: 96 | B41: =INDEX(2001Grossed!R1C1:R46C51, RC[-1], 26) -> #REF! | C41: =INDEX(2001Grossed!R1C1:R46C51, RC1, 27) -> #REF! | D41: =IF(Menus!R9C10, RC[-1]/RC[-2], RC[-1]) -> #REF! | E41: =IF(RC11=1, RC[-3], NA()) -> #NA | F41: =INDEX(2001Grossed!R1C1:R46C51, RC1, 1) -> #REF! | G41: =IF(EQUAL(INDEX(2001Grossed!R1C1:R46C51, RC1, 2), R1C), RC4, NA()) -> #REF! | H41: =IF(EQUAL(INDEX(2001Grossed!R1C1:R46C51, RC1, 2), R1C), RC4, NA()) -> #REF! | I41: =IF(EQUAL(INDEX(2001Grossed!R1C1:R46C51, RC1, 2), R1C), RC4, NA()) -> #REF! | J41: =IF(EQUAL(INDEX(2001Grossed!R1C1:R46C51, RC1, 2), R1C), RC4, NA()) -> #REF! | K41: =IF(OR(AND(NOT(ISERROR(RC7)), ISNUMBER(RC7)), AND(NOT(ISERROR(RC8)), ISNUMBER(RC8)), AND(NOT(ISERROR(RC9)), ISNUMBER(RC9)), AND(NOT(ISERROR(RC10)), ISNUMBER(RC10))), 1, 0) -> 0 | M41: =INDEX(Gross!R1C1:R46C51, RC1, 26) -> #REF! | N41: =INDEX(Gross!R1C1:R46C51, RC1, 27) -> #REF!
A42: 186 | B42: =INDEX(2001Grossed!R1C1:R46C51, RC[-1], 26) -> #REF! | C42: =INDEX(2001Grossed!R1C1:R46C51, RC1, 27) -> #REF! | D42: =IF(Menus!R9C10, RC[-1]/RC[-2], RC[-1]) -> #REF! | E42: =IF(RC11=1, RC[-3], NA()) -> #NA | F42: =INDEX(2001Grossed!R1C1:R46C51, RC1, 1) -> #REF! | G42: =IF(EQUAL(INDEX(2001Grossed!R1C1:R46C51, RC1, 2), R1C), RC4, NA()) -> #REF! | H42: =IF(EQUAL(INDEX(2001Grossed!R1C1:R46C51, RC1, 2), R1C), RC4, NA()) -> #REF! | I42: =IF(EQUAL(INDEX(2001Grossed!R1C1:R46C51, RC1, 2), R1C), RC4, NA()) -> #REF! | J42: =IF(EQUAL(INDEX(2001Grossed!R1C1:R46C51, RC1, 2), R1C), RC4, NA()) -> #REF! | K42: =IF(OR(AND(NOT(ISERROR(RC7)), ISNUMBER(RC7)), AND(NOT(ISERROR(RC8)), ISNUMBER(RC8)), AND(NOT(ISERROR(RC9)), ISNUMBER(RC9)), AND(NOT(ISERROR(RC10)), ISNUMBER(RC10))), 1, 0) -> 0 | M42: =INDEX(Gross!R1C1:R46C51, RC1, 26) -> #REF! | N42: =INDEX(Gross!R1C1:R46C51, RC1, 27) -> #REF!
A43: 182 | B43: =INDEX(2001Grossed!R1C1:R46C51, RC[-1], 26) -> #REF! | C43: =INDEX(2001Grossed!R1C1:R46C51, RC1, 27) -> #REF! | D43: =IF(Menus!R9C10, RC[-1]/RC[-2], RC[-1]) -> #REF! | E43: =IF(RC11=1, RC[-3], NA()) -> #NA | F43: =INDEX(2001Grossed!R1C1:R46C51, RC1, 1) -> #REF! | G43: =IF(EQUAL(INDEX(2001Grossed!R1C1:R46C51, RC1, 2), R1C), RC4, NA()) -> #REF! | H43: =IF(EQUAL(INDEX(2001Grossed!R1C1:R46C51, RC1, 2), R1C), RC4, NA()) -> #REF! | I43: =IF(EQUAL(INDEX(2001Grossed!R1C1:R46C51, RC1, 2), R1C), RC4, NA()) -> #REF! | J43: =IF(EQUAL(INDEX(2001Grossed!R1C1:R46C51, RC1, 2), R1C), RC4, NA()) -> #REF! | K43: =IF(OR(AND(NOT(ISERROR(RC7)), ISNUMBER(RC7)), AND(NOT(ISERROR(RC8)), ISNUMBER(RC8)), AND(NOT(ISERROR(RC9)), ISNUMBER(RC9)), AND(NOT(ISERROR(RC10)), ISNUMBER(RC10))), 1, 0) -> 0 | M43: =INDEX(Gross!R1C1:R46C51, RC1, 26) -> #REF! | N43: =INDEX(Gross!R1C1:R46C51, RC1, 27) -> #REF!
A44: 56 | B44: =INDEX(2001Grossed!R1C1:R46C51, RC[-1], 26) -> #REF! | C44: =INDEX(2001Grossed!R1C1:R46C51, RC1, 27) -> #REF! | D44: =IF(Menus!R9C10, RC[-1]/RC[-2], RC[-1]) -> #REF! | E44: =IF(RC11=1, RC[-3], NA()) -> #NA | F44: =INDEX(2001Grossed!R1C1:R46C51, RC1, 1) -> #REF! | G44: =IF(EQUAL(INDEX(2001Grossed!R1C1:R46C51, RC1, 2), R1C), RC4, NA()) -> #REF! | H44: =IF(EQUAL(INDEX(2001Grossed!R1C1:R46C51, RC1, 2), R1C), RC4, NA()) -> #REF! | I44: =IF(EQUAL(INDEX(2001Grossed!R1C1:R46C51, RC1, 2), R1C), RC4, NA()) -> #REF! | J44: =IF(EQUAL(INDEX(2001Grossed!R1C1:R46C51, RC1, 2), R1C), RC4, NA()) -> #REF! | K44: =IF(OR(AND(NOT(ISERROR(RC7)), ISNUMBER(RC7)), AND(NOT(ISERROR(RC8)), ISNUMBER(RC8)), AND(NOT(ISERROR(RC9)), ISNUMBER(RC9)), AND(NOT(ISERROR(RC10)), ISNUMBER(RC10))), 1, 0) -> 0 | M44: =INDEX(Gross!R1C1:R46C51, RC1, 26) -> #REF! | N44: =INDEX(Gross!R1C1:R46C51, RC1, 27) -> #REF!
A45: 183 | B45: =INDEX(2001Grossed!R1C1:R46C51, RC[-1], 26) -> #REF! | C45: =INDEX(2001Grossed!R1C1:R46C51, RC1, 27) -> #REF! | D45: =IF(Menus!R9C10, RC[-1]/RC[-2], RC[-1]) -> #REF! | E45: =IF(RC11=1, RC[-3], NA()) -> #NA | F45: =INDEX(2001Grossed!R1C1:R46C51, RC1, 1) -> #REF! | G45: =IF(EQUAL(INDEX(2001Grossed!R1C1:R46C51, RC1, 2), R1C), RC4, NA()) -> #REF! | H45: =IF(EQUAL(INDEX(2001Grossed!R1C1:R46C51, RC1, 2), R1C), RC4, NA()) -> #REF! | I45: =IF(EQUAL(INDEX(2001Grossed!R1C1:R46C51, RC1, 2), R1C), RC4, NA()) -> #REF! | J45: =IF(EQUAL(INDEX(2001Grossed!R1C1:R46C51, RC1, 2), R1C), RC4, NA()) -> #REF! | K45: =IF(OR(AND(NOT(ISERROR(RC7)), ISNUMBER(RC7)), AND(NOT(ISERROR(RC8)), ISNUMBER(RC8)), AND(NOT(ISERROR(RC9)), ISNUMBER(RC9)), AND(NOT(ISERROR(RC10)), ISNUMBER(RC10))), 1, 0) -> 0 | M45: =INDEX(Gross!R1C1:R46C51, RC1, 26) -> #REF! | N45: =INDEX(Gross!R1C1:R46C51, RC1, 27) -> #REF!
A46: 99 | B46: =INDEX(2001Grossed!R1C1:R46C51, RC[-1], 26) -> #REF! | C46: =INDEX(2001Grossed!R1C1:R46C51, RC1, 27) -> #REF! | D46: =IF(Menus!R9C10, RC[-1]/RC[-2], RC[-1]) -> #REF! | E46: =IF(RC11=1, RC[-3], NA()) -> #NA | F46: =INDEX(2001Grossed!R1C1:R46C51, RC1, 1) -> #REF! | G46: =IF(EQUAL(INDEX(2001Grossed!R1C1:R46C51, RC1, 2), R1C), RC4, NA()) -> #REF! | H46: =IF(EQUAL(INDEX(2001Grossed!R1C1:R46C51, RC1, 2), R1C), RC4, NA()) -> #REF! | I46: =IF(EQUAL(INDEX(2001Grossed!R1C1:R46C51, RC1, 2), R1C), RC4, NA()) -> #REF! | J46: =IF(EQUAL(INDEX(2001Grossed!R1C1:R46C51, RC1, 2), R1C), RC4, NA()) -> #REF! | K46: =IF(OR(AND(NOT(ISERROR(RC7)), ISNUMBER(RC7)), AND(NOT(ISERROR(RC8)), ISNUMBER(RC8)), AND(NOT(ISERROR(RC9)), ISNUMBER(RC9)), AND(NOT(ISERROR(RC10)), ISNUMBER(RC10))), 1, 0) -> 0 | M46: =INDEX(Gross!R1C1:R46C51, RC1, 26) -> #REF! | N46: =INDEX(Gross!R1C1:R46C51, RC1, 27) -> #REF!
A47: 148 | B47: =INDEX(2001Grossed!R1C1:R46C51, RC[-1], 26) -> #REF! | C47: =INDEX(2001Grossed!R1C1:R46C51, RC1, 27) -> #REF! | D47: =IF(Menus!R9C10, RC[-1]/RC[-2], RC[-1]) -> #REF! | E47: =IF(RC11=1, RC[-3], NA()) -> #NA | F47: =INDEX(2001Grossed!R1C1:R46C51, RC1, 1) -> #REF! | G47: =IF(EQUAL(INDEX(2001Grossed!R1C1:R46C51, RC1, 2), R1C), RC4, NA()) -> #REF! | H47: =IF(EQUAL(INDEX(2001Grossed!R1C1:R46C51, RC1, 2), R1C), RC4, NA()) -> #REF! | I47: =IF(EQUAL(INDEX(2001Grossed!R1C1:R46C51, RC1, 2), R1C), RC4, NA()) -> #REF! | J47: =IF(EQUAL(INDEX(2001Grossed!R1C1:R46C51, RC1, 2), R1C), RC4, NA()) -> #REF! | K47: =IF(OR(AND(NOT(ISERROR(RC7)), ISNUMBER(RC7)), AND(NOT(ISERROR(RC8)), ISNUMBER(RC8)), AND(NOT(ISERROR(RC9)), ISNUMBER(RC9)), AND(NOT(ISERROR(RC10)), ISNUMBER(RC10))), 1, 0) -> 0 | M47: =INDEX(Gross!R1C1:R46C51, RC1, 26) -> #REF! | N47: =INDEX(Gross!R1C1:R46C51, RC1, 27) -> #REF!
A48: 94 | B48: =INDEX(2001Grossed!R1C1:R46C51, RC[-1], 26) -> #REF! | C48: =INDEX(2001Grossed!R1C1:R46C51, RC1, 27) -> #REF! | D48: =IF(Menus!R9C10, RC[-1]/RC[-2], RC[-1]) -> #REF! | E48: =IF(RC11=1, RC[-3], NA()) -> #NA | F48: =INDEX(2001Grossed!R1C1:R46C51, RC1, 1) -> #REF! | G48: =IF(EQUAL(INDEX(2001Grossed!R1C1:R46C51, RC1, 2), R1C), RC4, NA()) -> #REF! | H48: =IF(EQUAL(INDEX(2001Grossed!R1C1:R46C51, RC1, 2), R1C), RC4, NA()) -> #REF! | I48: =IF(EQUAL(INDEX(2001Grossed!R1C1:R46C51, RC1, 2), R1C), RC4, NA()) -> #REF! | J48: =IF(EQUAL(INDEX(2001Grossed!R1C1:R46C51, RC1, 2), R1C), RC4, NA()) -> #REF! | K48: =IF(OR(AND(NOT(ISERROR(RC7)), ISNUMBER(RC7)), AND(NOT(ISERROR(RC8)), ISNUMBER(RC8)), AND(NOT(ISERROR(RC9)), ISNUMBER(RC9)), AND(NOT(ISERROR(RC10)), ISNUMBER(RC10))), 1, 0) -> 0 | M48: =INDEX(Gross!R1C1:R46C51, RC1, 26) -> #REF! | N48: =INDEX(Gross!R1C1:R46C51, RC1, 27) -> #REF!
A49: 194 | B49: =INDEX(2001Grossed!R1C1:R46C51, RC[-1], 26) -> #REF! | C49: =INDEX(2001Grossed!R1C1:R46C51, RC1, 27) -> #REF! | D49: =IF(Menus!R9C10, RC[-1]/RC[-2], RC[-1]) -> #REF! | E49: =IF(RC11=1, RC[-3], NA()) -> #NA | F49: =INDEX(2001Grossed!R1C1:R46C51, RC1, 1) -> #REF! | G49: =IF(EQUAL(INDEX(2001Grossed!R1C1:R46C51, RC1, 2), R1C), RC4, NA()) -> #REF! | H49: =IF(EQUAL(INDEX(2001Grossed!R1C1:R46C51, RC1, 2), R1C), RC4, NA()) -> #REF! | I49: =IF(EQUAL(INDEX(2001Grossed!R1C1:R46C51, RC1, 2), R1C), RC4, NA()) -> #REF! | J49: =IF(EQUAL(INDEX(2001Grossed!R1C1:R46C51, RC1, 2), R1C), RC4, NA()) -> #REF! | K49: =IF(OR(AND(NOT(ISERROR(RC7)), ISNUMBER(RC7)), AND(NOT(ISERROR(RC8)), ISNUMBER(RC8)), AND(NOT(ISERROR(RC9)), ISNUMBER(RC9)), AND(NOT(ISERROR(RC10)), ISNUMBER(RC10))), 1, 0) -> 0 | M49: =INDEX(Gross!R1C1:R46C51, RC1, 26) -> #REF! | N49: =INDEX(Gross!R1C1:R46C51, RC1, 27) -> #REF!
A50: 136 | B50: =INDEX(2001Grossed!R1C1:R46C51, RC[-1], 26) -> #REF! | C50: =INDEX(2001Grossed!R1C1:R46C51, RC1, 27) -> #REF! | D50: =IF(Menus!R9C10, RC[-1]/RC[-2], RC[-1]) -> #REF! | E50: =IF(RC11=1, RC[-3], NA()) -> #NA | F50: =INDEX(2001Grossed!R1C1:R46C51, RC1, 1) -> #REF! | G50: =IF(EQUAL(INDEX(2001Grossed!R1C1:R46C51, RC1, 2), R1C), RC4, NA()) -> #REF! | H50: =IF(EQUAL(INDEX(2001Grossed!R1C1:R46C51, RC1, 2), R1C), RC4, NA()) -> #REF! | I50: =IF(EQUAL(INDEX(2001Grossed!R1C1:R46C51, RC1, 2), R1C), RC4, NA()) -> #REF! | J50: =IF(EQUAL(INDEX(2001Grossed!R1C1:R46C51, RC1, 2), R1C), RC4, NA()) -> #REF! | K50: =IF(OR(AND(NOT(ISERROR(RC7)), ISNUMBER(RC7)), AND(NOT(ISERROR(RC8)), ISNUMBER(RC8)), AND(NOT(ISERROR(RC9)), ISNUMBER(RC9)), AND(NOT(ISERROR(RC10)), ISNUMBER(RC10))), 1, 0) -> 0 | M50: =INDEX(Gross!R1C1:R46C51, RC1, 26) -> #REF! | N50: =INDEX(Gross!R1C1:R46C51, RC1, 27) -> #REF!
A51: 196 | B51: =INDEX(2001Grossed!R1C1:R46C51, RC[-1], 26) -> #REF! | C51: =INDEX(2001Grossed!R1C1:R46C51, RC1, 27) -> #REF! | D51: =IF(Menus!R9C10, RC[-1]/RC[-2], RC[-1]) -> #REF! | E51: =IF(RC11=1, RC[-3], NA()) -> #NA | F51: =INDEX(2001Grossed!R1C1:R46C51, RC1, 1) -> #REF! | G51: =IF(EQUAL(INDEX(2001Grossed!R1C1:R46C51, RC1, 2), R1C), RC4, NA()) -> #REF! | H51: =IF(EQUAL(INDEX(2001Grossed!R1C1:R46C51, RC1, 2), R1C), RC4, NA()) -> #REF! | I51: =IF(EQUAL(INDEX(2001Grossed!R1C1:R46C51, RC1, 2), R1C), RC4, NA()) -> #REF! | J51: =IF(EQUAL(INDEX(2001Grossed!R1C1:R46C51, RC1, 2), R1C), RC4, NA()) -> #REF! | K51: =IF(OR(AND(NOT(ISERROR(RC7)), ISNUMBER(RC7)), AND(NOT(ISERROR(RC8)), ISNUMBER(RC8)), AND(NOT(ISERROR(RC9)), ISNUMBER(RC9)), AND(NOT(ISERROR(RC10)), ISNUMBER(RC10))), 1, 0) -> 0 | M51: =INDEX(Gross!R1C1:R46C51, RC1, 26) -> #REF! | N51: =INDEX(Gross!R1C1:R46C51, RC1, 27) -> #REF!
A52: 179 | B52: =INDEX(2001Grossed!R1C1:R46C51, RC[-1], 26) -> #REF! | C52: =INDEX(2001Grossed!R1C1:R46C51, RC1, 27) -> #REF! | D52: =IF(Menus!R9C10, RC[-1]/RC[-2], RC[-1]) -> #REF! | E52: =IF(RC11=1, RC[-3], NA()) -> #NA | F52: =INDEX(2001Grossed!R1C1:R46C51, RC1, 1) -> #REF! | G52: =IF(EQUAL(INDEX(2001Grossed!R1C1:R46C51, RC1, 2), R1C), RC4, NA()) -> #REF! | H52: =IF(EQUAL(INDEX(2001Grossed!R1C1:R46C51, RC1, 2), R1C), RC4, NA()) -> #REF! | I52: =IF(EQUAL(INDEX(2001Grossed!R1C1:R46C51, RC1, 2), R1C), RC4, NA()) -> #REF! | J52: =IF(EQUAL(INDEX(2001Grossed!R1C1:R46C51, RC1, 2), R1C), RC4, NA()) -> #REF! | K52: =IF(OR(AND(NOT(ISERROR(RC7)), ISNUMBER(RC7)), AND(NOT(ISERROR(RC8)), ISNUMBER(RC8)), AND(NOT(ISERROR(RC9)), ISNUMBER(RC9)), AND(NOT(ISERROR(RC10)), ISNUMBER(RC10))), 1, 0) -> 0 | M52: =INDEX(Gross!R1C1:R46C51, RC1, 26) -> #REF! | N52: =INDEX(Gross!R1C1:R46C51, RC1, 27) -> #REF!
A53: 157 | B53: =INDEX(2001Grossed!R1C1:R46C51, RC[-1], 26) -> #REF! | C53: =INDEX(2001Grossed!R1C1:R46C51, RC1, 27) -> #REF! | D53: =IF(Menus!R9C10, RC[-1]/RC[-2], RC[-1]) -> #REF! | E53: =IF(RC11=1, RC[-3], NA()) -> #NA | F53: =INDEX(2001Grossed!R1C1:R46C51, RC1, 1) -> #REF! | G53: =IF(EQUAL(INDEX(2001Grossed!R1C1:R46C51, RC1, 2), R1C), RC4, NA()) -> #REF! | H53: =IF(EQUAL(INDEX(2001Grossed!R1C1:R46C51, RC1, 2), R1C), RC4, NA()) -> #REF! | I53: =IF(EQUAL(INDEX(2001Grossed!R1C1:R46C51, RC1, 2), R1C), RC4, NA()) -> #REF! | J53: =IF(EQUAL(INDEX(2001Grossed!R1C1:R46C51, RC1, 2), R1C), RC4, NA()) -> #REF! | K53: =IF(OR(AND(NOT(ISERROR(RC7)), ISNUMBER(RC7)), AND(NOT(ISERROR(RC8)), ISNUMBER(RC8)), AND(NOT(ISERROR(RC9)), ISNUMBER(RC9)), AND(NOT(ISERROR(RC10)), ISNUMBER(RC10))), 1, 0) -> 0 | M53: =INDEX(Gross!R1C1:R46C51, RC1, 26) -> #REF! | N53: =INDEX(Gross!R1C1:R46C51, RC1, 27) -> #REF!
A54: 159 | B54: =INDEX(2001Grossed!R1C1:R46C51, RC[-1], 26) -> #REF! | C54: =INDEX(2001Grossed!R1C1:R46C51, RC1, 27) -> #REF! | D54: =IF(Menus!R9C10, RC[-1]/RC[-2], RC[-1]) -> #REF! | E54: =IF(RC11=1, RC[-3], NA()) -> #NA | F54: =INDEX(2001Grossed!R1C1:R46C51, RC1, 1) -> #REF! | G54: =IF(EQUAL(INDEX(2001Grossed!R1C1:R46C51, RC1, 2), R1C), RC4, NA()) -> #REF! | H54: =IF(EQUAL(INDEX(2001Grossed!R1C1:R46C51, RC1, 2), R1C), RC4, NA()) -> #REF! | I54: =IF(EQUAL(INDEX(2001Grossed!R1C1:R46C51, RC1, 2), R1C), RC4, NA()) -> #REF! | J54: =IF(EQUAL(INDEX(2001Grossed!R1C1:R46C51, RC1, 2), R1C), RC4, NA()) -> #REF! | K54: =IF(OR(AND(NOT(ISERROR(RC7)), ISNUMBER(RC7)), AND(NOT(ISERROR(RC8)), ISNUMBER(RC8)), AND(NOT(ISERROR(RC9)), ISNUMBER(RC9)), AND(NOT(ISERROR(RC10)), ISNUMBER(RC10))), 1, 0) -> 0 | M54: =INDEX(Gross!R1C1:R46C51, RC1, 26) -> #REF! | N54: =INDEX(Gross!R1C1:R46C51, RC1, 27) -> #REF!
A55: 93 | B55: =INDEX(2001Grossed!R1C1:R46C51, RC[-1], 26) -> #REF! | C55: =INDEX(2001Grossed!R1C1:R46C51, RC1, 27) -> #REF! | D55: =IF(Menus!R9C10, RC[-1]/RC[-2], RC[-1]) -> #REF! | E55: =IF(RC11=1, RC[-3], NA()) -> #NA | F55: =INDEX(2001Grossed!R1C1:R46C51, RC1, 1) -> #REF! | G55: =IF(EQUAL(INDEX(2001Grossed!R1C1:R46C51, RC1, 2), R1C), RC4, NA()) -> #REF! | H55: =IF(EQUAL(INDEX(2001Grossed!R1C1:R46C51, RC1, 2), R1C), RC4, NA()) -> #REF! | I55: =IF(EQUAL(INDEX(2001Grossed!R1C1:R46C51, RC1, 2), R1C), RC4, NA()) -> #REF! | J55: =IF(EQUAL(INDEX(2001Grossed!R1C1:R46C51, RC1, 2), R1C), RC4, NA()) -> #REF! | K55: =IF(OR(AND(NOT(ISERROR(RC7)), ISNUMBER(RC7)), AND(NOT(ISERROR(RC8)), ISNUMBER(RC8)), AND(NOT(ISERROR(RC9)), ISNUMBER(RC9)), AND(NOT(ISERROR(RC10)), ISNUMBER(RC10))), 1, 0) -> 0 | M55: =INDEX(Gross!R1C1:R46C51, RC1, 26) -> #REF! | N55: =INDEX(Gross!R1C1:R46C51, RC1, 27) -> #REF!
A56: 79 | B56: =INDEX(2001Grossed!R1C1:R46C51, RC[-1], 26) -> #REF! | C56: =INDEX(2001Grossed!R1C1:R46C51, RC1, 27) -> #REF! | D56: =IF(Menus!R9C10, RC[-1]/RC[-2], RC[-1]) -> #REF! | E56: =IF(RC11=1, RC[-3], NA()) -> #NA | F56: =INDEX(2001Grossed!R1C1:R46C51, RC1, 1) -> #REF! | G56: =IF(EQUAL(INDEX(2001Grossed!R1C1:R46C51, RC1, 2), R1C), RC4, NA()) -> #REF! | H56: =IF(EQUAL(INDEX(2001Grossed!R1C1:R46C51, RC1, 2), R1C), RC4, NA()) -> #REF! | I56: =IF(EQUAL(INDEX(2001Grossed!R1C1:R46C51, RC1, 2), R1C), RC4, NA()) -> #REF! | J56: =IF(EQUAL(INDEX(2001Grossed!R1C1:R46C51, RC1, 2), R1C), RC4, NA()) -> #REF! | K56: =IF(OR(AND(NOT(ISERROR(RC7)), ISNUMBER(RC7)), AND(NOT(ISERROR(RC8)), ISNUMBER(RC8)), AND(NOT(ISERROR(RC9)), ISNUMBER(RC9)), AND(NOT(ISERROR(RC10)), ISNUMBER(RC10))), 1, 0) -> 0 | M56: =INDEX(Gross!R1C1:R46C51, RC1, 26) -> #REF! | N56: =INDEX(Gross!R1C1:R46C51, RC1, 27) -> #REF!
A57: 51 | B57: =INDEX(2001Grossed!R1C1:R46C51, RC[-1], 26) -> #REF! | C57: =INDEX(2001Grossed!R1C1:R46C51, RC1, 27) -> #REF! | D57: =IF(Menus!R9C10, RC[-1]/RC[-2], RC[-1]) -> #REF! | E57: =IF(RC11=1, RC[-3], NA()) -> #NA | F57: =INDEX(2001Grossed!R1C1:R46C51, RC1, 1) -> #REF! | G57: =IF(EQUAL(INDEX(2001Grossed!R1C1:R46C51, RC1, 2), R1C), RC4, NA()) -> #REF! | H57: =IF(EQUAL(INDEX(2001Grossed!R1C1:R46C51, RC1, 2), R1C), RC4, NA()) -> #REF! | I57: =IF(EQUAL(INDEX(2001Grossed!R1C1:R46C51, RC1, 2), R1C), RC4, NA()) -> #REF! | J57: =IF(EQUAL(INDEX(2001Grossed!R1C1:R46C51, RC1, 2), R1C), RC4, NA()) -> #REF! | K57: =IF(OR(AND(NOT(ISERROR(RC7)), ISNUMBER(RC7)), AND(NOT(ISERROR(RC8)), ISNUMBER(RC8)), AND(NOT(ISERROR(RC9)), ISNUMBER(RC9)), AND(NOT(ISERROR(RC10)), ISNUMBER(RC10))), 1, 0) -> 0 | M57: =INDEX(Gross!R1C1:R46C51, RC1, 26) -> #REF! | N57: =INDEX(Gross!R1C1:R46C51, RC1, 27) -> #REF!
A58: 53 | B58: =INDEX(2001Grossed!R1C1:R46C51, RC[-1], 26) -> #REF! | C58: =INDEX(2001Grossed!R1C1:R46C51, RC1, 27) -> #REF! | D58: =IF(Menus!R9C10, RC[-1]/RC[-2], RC[-1]) -> #REF! | E58: =IF(RC11=1, RC[-3], NA()) -> #NA | F58: =INDEX(2001Grossed!R1C1:R46C51, RC1, 1) -> #REF! | G58: =IF(EQUAL(INDEX(2001Grossed!R1C1:R46C51, RC1, 2), R1C), RC4, NA()) -> #REF! | H58: =IF(EQUAL(INDEX(2001Grossed!R1C1:R46C51, RC1, 2), R1C), RC4, NA()) -> #REF! | I58: =IF(EQUAL(INDEX(2001Grossed!R1C1:R46C51, RC1, 2), R1C), RC4, NA()) -> #REF! | J58: =IF(EQUAL(INDEX(2001Grossed!R1C1:R46C51, RC1, 2), R1C), RC4, NA()) -> #REF! | K58: =IF(OR(AND(NOT(ISERROR(RC7)), ISNUMBER(RC7)), AND(NOT(ISERROR(RC8)), ISNUMBER(RC8)), AND(NOT(ISERROR(RC9)), ISNUMBER(RC9)), AND(NOT(ISERROR(RC10)), ISNUMBER(RC10))), 1, 0) -> 0 | M58: =INDEX(Gross!R1C1:R46C51, RC1, 26) -> #REF! | N58: =INDEX(Gross!R1C1:R46C51, RC1, 27) -> #REF!
A59: 124 | B59: =INDEX(2001Grossed!R1C1:R46C51, RC[-1], 26) -> #REF! | C59: =INDEX(2001Grossed!R1C1:R46C51, RC1, 27) -> #REF! | D59: =IF(Menus!R9C10, RC[-1]/RC[-2], RC[-1]) -> #REF! | E59: =IF(RC11=1, RC[-3], NA()) -> #NA | F59: =INDEX(2001Grossed!R1C1:R46C51, RC1, 1) -> #REF! | G59: =IF(EQUAL(INDEX(2001Grossed!R1C1:R46C51, RC1, 2), R1C), RC4, NA()) -> #REF! | H59: =IF(EQUAL(INDEX(2001Grossed!R1C1:R46C51, RC1, 2), R1C), RC4, NA()) -> #REF! | I59: =IF(EQUAL(INDEX(2001Grossed!R1C1:R46C51, RC1, 2), R1C), RC4, NA()) -> #REF! | J59: =IF(EQUAL(INDEX(2001Grossed!R1C1:R46C51, RC1, 2), R1C), RC4, NA()) -> #REF! | K59: =IF(OR(AND(NOT(ISERROR(RC7)), ISNUMBER(RC7)), AND(NOT(ISERROR(RC8)), ISNUMBER(RC8)), AND(NOT(ISERROR(RC9)), ISNUMBER(RC9)), AND(NOT(ISERROR(RC10)), ISNUMBER(RC10))), 1, 0) -> 0 | M59: =INDEX(Gross!R1C1:R46C51, RC1, 26) -> #REF! | N59: =INDEX(Gross!R1C1:R46C51, RC1, 27) -> #REF!
A60: 126 | B60: =INDEX(2001Grossed!R1C1:R46C51, RC[-1], 26) -> #REF! | C60: =INDEX(2001Grossed!R1C1:R46C51, RC1, 27) -> #REF! | D60: =IF(Menus!R9C10, RC[-1]/RC[-2], RC[-1]) -> #REF! | E60: =IF(RC11=1, RC[-3], NA()) -> #NA | F60: =INDEX(2001Grossed!R1C1:R46C51, RC1, 1) -> #REF! | G60: =IF(EQUAL(INDEX(2001Grossed!R1C1:R46C51, RC1, 2), R1C), RC4, NA()) -> #REF! | H60: =IF(EQUAL(INDEX(2001Grossed!R1C1:R46C51, RC1, 2), R1C), RC4, NA()) -> #REF! | I60: =IF(EQUAL(INDEX(2001Grossed!R1C1:R46C51, RC1, 2), R1C), RC4, NA()) -> #REF! | J60: =IF(EQUAL(INDEX(2001Grossed!R1C1:R46C51, RC1, 2), R1C), RC4, NA()) -> #REF! | K60: =IF(OR(AND(NOT(ISERROR(RC7)), ISNUMBER(RC7)), AND(NOT(ISERROR(RC8)), ISNUMBER(RC8)), AND(NOT(ISERROR(RC9)), ISNUMBER(RC9)), AND(NOT(ISERROR(RC10)), ISNUMBER(RC10))), 1, 0) -> 0 | M60: =INDEX(Gross!R1C1:R46C51, RC1, 26) -> #REF! | N60: =INDEX(Gross!R1C1:R46C51, RC1, 27) -> #REF!
A61: 162 | B61: =INDEX(2001Grossed!R1C1:R46C51, RC[-1], 26) -> #REF! | C61: =INDEX(2001Grossed!R1C1:R46C51, RC1, 27) -> #REF! | D61: =IF(Menus!R9C10, RC[-1]/RC[-2], RC[-1]) -> #REF! | E61: =IF(RC11=1, RC[-3], NA()) -> #NA | F61: =INDEX(2001Grossed!R1C1:R46C51, RC1, 1) -> #REF! | G61: =IF(EQUAL(INDEX(2001Grossed!R1C1:R46C51, RC1, 2), R1C), RC4, NA()) -> #REF! | H61: =IF(EQUAL(INDEX(2001Grossed!R1C1:R46C51, RC1, 2), R1C), RC4, NA()) -> #REF! | I61: =IF(EQUAL(INDEX(2001Grossed!R1C1:R46C51, RC1, 2), R1C), RC4, NA()) -> #REF! | J61: =IF(EQUAL(INDEX(2001Grossed!R1C1:R46C51, RC1, 2), R1C), RC4, NA()) -> #REF! | K61: =IF(OR(AND(NOT(ISERROR(RC7)), ISNUMBER(RC7)), AND(NOT(ISERROR(RC8)), ISNUMBER(RC8)), AND(NOT(ISERROR(RC9)), ISNUMBER(RC9)), AND(NOT(ISERROR(RC10)), ISNUMBER(RC10))), 1, 0) -> 0 | M61: =INDEX(Gross!R1C1:R46C51, RC1, 26) -> #REF! | N61: =INDEX(Gross!R1C1:R46C51, RC1, 27) -> #REF!
A62: 70 | B62: =INDEX(2001Grossed!R1C1:R46C51, RC[-1], 26) -> #REF! | C62: =INDEX(2001Grossed!R1C1:R46C51, RC1, 27) -> #REF! | D62: =IF(Menus!R9C10, RC[-1]/RC[-2], RC[-1]) -> #REF! | E62: =IF(RC11=1, RC[-3], NA()) -> #NA | F62: =INDEX(2001Grossed!R1C1:R46C51, RC1, 1) -> #REF! | G62: =IF(EQUAL(INDEX(2001Grossed!R1C1:R46C51, RC1, 2), R1C), RC4, NA()) -> #REF! | H62: =IF(EQUAL(INDEX(2001Grossed!R1C1:R46C51, RC1, 2), R1C), RC4, NA()) -> #REF! | I62: =IF(EQUAL(INDEX(2001Grossed!R1C1:R46C51, RC1, 2), R1C), RC4, NA()) -> #REF! | J62: =IF(EQUAL(INDEX(2001Grossed!R1C1:R46C51, RC1, 2), R1C), RC4, NA()) -> #REF! | K62: =IF(OR(AND(NOT(ISERROR(RC7)), ISNUMBER(RC7)), AND(NOT(ISERROR(RC8)), ISNUMBER(RC8)), AND(NOT(ISERROR(RC9)), ISNUMBER(RC9)), AND(NOT(ISERROR(RC10)), ISNUMBER(RC10))), 1, 0) -> 0 | M62: =INDEX(Gross!R1C1:R46C51, RC1, 26) -> #REF! | N62: =INDEX(Gross!R1C1:R46C51, RC1, 27) -> #REF!
A63: 58 | B63: =INDEX(2001Grossed!R1C1:R46C51, RC[-1], 26) -> #REF! | C63: =INDEX(2001Grossed!R1C1:R46C51, RC1, 27) -> #REF! | D63: =IF(Menus!R9C10, RC[-1]/RC[-2], RC[-1]) -> #REF! | E63: =IF(RC11=1, RC[-3], NA()) -> #NA | F63: =INDEX(2001Grossed!R1C1:R46C51, RC1, 1) -> #REF! | G63: =IF(EQUAL(INDEX(2001Grossed!R1C1:R46C51, RC1, 2), R1C), RC4, NA()) -> #REF! | H63: =IF(EQUAL(INDEX(2001Grossed!R1C1:R46C51, RC1, 2), R1C), RC4, NA()) -> #REF! | I63: =IF(EQUAL(INDEX(2001Grossed!R1C1:R46C51, RC1, 2), R1C), RC4, NA()) -> #REF! | J63: =IF(EQUAL(INDEX(2001Grossed!R1C1:R46C51, RC1, 2), R1C), RC4, NA()) -> #REF! | K63: =IF(OR(AND(NOT(ISERROR(RC7)), ISNUMBER(RC7)), AND(NOT(ISERROR(RC8)), ISNUMBER(RC8)), AND(NOT(ISERROR(RC9)), ISNUMBER(RC9)), AND(NOT(ISERROR(RC10)), ISNUMBER(RC10))), 1, 0) -> 0 | M63: =INDEX(Gross!R1C1:R46C51, RC1, 26) -> #REF! | N63: =INDEX(Gross!R1C1:R46C51, RC1, 27) -> #REF!
A64: 130 | B64: =INDEX(2001Grossed!R1C1:R46C51, RC[-1], 26) -> #REF! | C64: =INDEX(2001Grossed!R1C1:R46C51, RC1, 27) -> #REF! | D64: =IF(Menus!R9C10, RC[-1]/RC[-2], RC[-1]) -> #REF! | E64: =IF(RC11=1, RC[-3], NA()) -> #NA | F64: =INDEX(2001Grossed!R1C1:R46C51, RC1, 1) -> #REF! | G64: =IF(EQUAL(INDEX(2001Grossed!R1C1:R46C51, RC1, 2), R1C), RC4, NA()) -> #REF! | H64: =IF(EQUAL(INDEX(2001Grossed!R1C1:R46C51, RC1, 2), R1C), RC4, NA()) -> #REF! | I64: =IF(EQUAL(INDEX(2001Grossed!R1C1:R46C51, RC1, 2), R1C), RC4, NA()) -> #REF! | J64: =IF(EQUAL(INDEX(2001Grossed!R1C1:R46C51, RC1, 2), R1C), RC4, NA()) -> #REF! | K64: =IF(OR(AND(NOT(ISERROR(RC7)), ISNUMBER(RC7)), AND(NOT(ISERROR(RC8)), ISNUMBER(RC8)), AND(NOT(ISERROR(RC9)), ISNUMBER(RC9)), AND(NOT(ISERROR(RC10)), ISNUMBER(RC10))), 1, 0) -> 0 | M64: =INDEX(Gross!R1C1:R46C51, RC1, 26) -> #REF! | N64: =INDEX(Gross!R1C1:R46C51, RC1, 27) -> #REF!
A65: 115 | B65: =INDEX(2001Grossed!R1C1:R46C51, RC[-1], 26) -> #REF! | C65: =INDEX(2001Grossed!R1C1:R46C51, RC1, 27) -> #REF! | D65: =IF(Menus!R9C10, RC[-1]/RC[-2], RC[-1]) -> #REF! | E65: =IF(RC11=1, RC[-3], NA()) -> #NA | F65: =INDEX(2001Grossed!R1C1:R46C51, RC1, 1) -> #REF! | G65: =IF(EQUAL(INDEX(2001Grossed!R1C1:R46C51, RC1, 2), R1C), RC4, NA()) -> #REF! | H65: =IF(EQUAL(INDEX(2001Grossed!R1C1:R46C51, RC1, 2), R1C), RC4, NA()) -> #REF! | I65: =IF(EQUAL(INDEX(2001Grossed!R1C1:R46C51, RC1, 2), R1C), RC4, NA()) -> #REF! | J65: =IF(EQUAL(INDEX(2001Grossed!R1C1:R46C51, RC1, 2), R1C), RC4, NA()) -> #REF! | K65: =IF(OR(AND(NOT(ISERROR(RC7)), ISNUMBER(RC7)), AND(NOT(ISERROR(RC8)), ISNUMBER(RC8)), AND(NOT(ISERROR(RC9)), ISNUMBER(RC9)), AND(NOT(ISERROR(RC10)), ISNUMBER(RC10))), 1, 0) -> 0 | M65: =INDEX(Gross!R1C1:R46C51, RC1, 26) -> #REF! | N65: =INDEX(Gross!R1C1:R46C51, RC1, 27) -> #REF!
A66: 73 | B66: =INDEX(2001Grossed!R1C1:R46C51, RC[-1], 26) -> #REF! | C66: =INDEX(2001Grossed!R1C1:R46C51, RC1, 27) -> #REF! | D66: =IF(Menus!R9C10, RC[-1]/RC[-2], RC[-1]) -> #REF! | E66: =IF(RC11=1, RC[-3], NA()) -> #NA | F66: =INDEX(2001Grossed!R1C1:R46C51, RC1, 1) -> #REF! | G66: =IF(EQUAL(INDEX(2001Grossed!R1C1:R46C51, RC1, 2), R1C), RC4, NA()) -> #REF! | H66: =IF(EQUAL(INDEX(2001Grossed!R1C1:R46C51, RC1, 2), R1C), RC4, NA()) -> #REF! | I66: =IF(EQUAL(INDEX(2001Grossed!R1C1:R46C51, RC1, 2), R1C), RC4, NA()) -> #REF! | J66: =IF(EQUAL(INDEX(2001Grossed!R1C1:R46C51, RC1, 2), R1C), RC4, NA()) -> #REF! | K66: =IF(OR(AND(NOT(ISERROR(RC7)), ISNUMBER(RC7)), AND(NOT(ISERROR(RC8)), ISNUMBER(RC8)), AND(NOT(ISERROR(RC9)), ISNUMBER(RC9)), AND(NOT(ISERROR(RC10)), ISNUMBER(RC10))), 1, 0) -> 0 | M66: =INDEX(Gross!R1C1:R46C51, RC1, 26) -> #REF! | N66: =INDEX(Gross!R1C1:R46C51, RC1, 27) -> #REF!
A67: 100 | B67: =INDEX(2001Grossed!R1C1:R46C51, RC[-1], 26) -> #REF! | C67: =INDEX(2001Grossed!R1C1:R46C51, RC1, 27) -> #REF! | D67: =IF(Menus!R9C10, RC[-1]/RC[-2], RC[-1]) -> #REF! | E67: =IF(RC11=1, RC[-3], NA()) -> #NA | F67: =INDEX(2001Grossed!R1C1:R46C51, RC1, 1) -> #REF! | G67: =IF(EQUAL(INDEX(2001Grossed!R1C1:R46C51, RC1, 2), R1C), RC4, NA()) -> #REF! | H67: =IF(EQUAL(INDEX(2001Grossed!R1C1:R46C51, RC1, 2), R1C), RC4, NA()) -> #REF! | I67: =IF(EQUAL(INDEX(2001Grossed!R1C1:R46C51, RC1, 2), R1C), RC4, NA()) -> #REF! | J67: =IF(EQUAL(INDEX(2001Grossed!R1C1:R46C51, RC1, 2), R1C), RC4, NA()) -> #REF! | K67: =IF(OR(AND(NOT(ISERROR(RC7)), ISNUMBER(RC7)), AND(NOT(ISERROR(RC8)), ISNUMBER(RC8)), AND(NOT(ISERROR(RC9)), ISNUMBER(RC9)), AND(NOT(ISERROR(RC10)), ISNUMBER(RC10))), 1, 0) -> 0 | M67: =INDEX(Gross!R1C1:R46C51, RC1, 26) -> #REF! | N67: =INDEX(Gross!R1C1:R46C51, RC1, 27) -> #REF!
A68: 82 | B68: =INDEX(2001Grossed!R1C1:R46C51, RC[-1], 26) -> #REF! | C68: =INDEX(2001Grossed!R1C1:R46C51, RC1, 27) -> #REF! | D68: =IF(Menus!R9C10, RC[-1]/RC[-2], RC[-1]) -> #REF! | E68: =IF(RC11=1, RC[-3], NA()) -> #NA | F68: =INDEX(2001Grossed!R1C1:R46C51, RC1, 1) -> #REF! | G68: =IF(EQUAL(INDEX(2001Grossed!R1C1:R46C51, RC1, 2), R1C), RC4, NA()) -> #REF! | H68: =IF(EQUAL(INDEX(2001Grossed!R1C1:R46C51, RC1, 2), R1C), RC4, NA()) -> #REF! | I68: =IF(EQUAL(INDEX(2001Grossed!R1C1:R46C51, RC1, 2), R1C), RC4, NA()) -> #REF! | J68: =IF(EQUAL(INDEX(2001Grossed!R1C1:R46C51, RC1, 2), R1C), RC4, NA()) -> #REF! | K68: =IF(OR(AND(NOT(ISERROR(RC7)), ISNUMBER(RC7)), AND(NOT(ISERROR(RC8)), ISNUMBER(RC8)), AND(NOT(ISERROR(RC9)), ISNUMBER(RC9)), AND(NOT(ISERROR(RC10)), ISNUMBER(RC10))), 1, 0) -> 0 | M68: =INDEX(Gross!R1C1:R46C51, RC1, 26) -> #REF! | N68: =INDEX(Gross!R1C1:R46C51, RC1, 27) -> #REF!
A69: 178 | B69: =INDEX(2001Grossed!R1C1:R46C51, RC[-1], 26) -> #REF! | C69: =INDEX(2001Grossed!R1C1:R46C51, RC1, 27) -> #REF! | D69: =IF(Menus!R9C10, RC[-1]/RC[-2], RC[-1]) -> #REF! | E69: =IF(RC11=1, RC[-3], NA()) -> #NA | F69: =INDEX(2001Grossed!R1C1:R46C51, RC1, 1) -> #REF! | G69: =IF(EQUAL(INDEX(2001Grossed!R1C1:R46C51, RC1, 2), R1C), RC4, NA()) -> #REF! | H69: =IF(EQUAL(INDEX(2001Grossed!R1C1:R46C51, RC1, 2), R1C), RC4, NA()) -> #REF! | I69: =IF(EQUAL(INDEX(2001Grossed!R1C1:R46C51, RC1, 2), R1C), RC4, NA()) -> #REF! | J69: =IF(EQUAL(INDEX(2001Grossed!R1C1:R46C51, RC1, 2), R1C), RC4, NA()) -> #REF! | K69: =IF(OR(AND(NOT(ISERROR(RC7)), ISNUMBER(RC7)), AND(NOT(ISERROR(RC8)), ISNUMBER(RC8)), AND(NOT(ISERROR(RC9)), ISNUMBER(RC9)), AND(NOT(ISERROR(RC10)), ISNUMBER(RC10))), 1, 0) -> 0 | M69: =INDEX(Gross!R1C1:R46C51, RC1, 26) -> #REF! | N69: =INDEX(Gross!R1C1:R46C51, RC1, 27) -> #REF!
A70: 117 | B70: =INDEX(2001Grossed!R1C1:R46C51, RC[-1], 26) -> #REF! | C70: =INDEX(2001Grossed!R1C1:R46C51, RC1, 27) -> #REF! | D70: =IF(Menus!R9C10, RC[-1]/RC[-2], RC[-1]) -> #REF! | E70: =IF(RC11=1, RC[-3], NA()) -> #NA | F70: =INDEX(2001Grossed!R1C1:R46C51, RC1, 1) -> #REF! | G70: =IF(EQUAL(INDEX(2001Grossed!R1C1:R46C51, RC1, 2), R1C), RC4, NA()) -> #REF! | H70: =IF(EQUAL(INDEX(2001Grossed!R1C1:R46C51, RC1, 2), R1C), RC4, NA()) -> #REF! | I70: =IF(EQUAL(INDEX(2001Grossed!R1C1:R46C51, RC1, 2), R1C), RC4, NA()) -> #REF! | J70: =IF(EQUAL(INDEX(2001Grossed!R1C1:R46C51, RC1, 2), R1C), RC4, NA()) -> #REF! | K70: =IF(OR(AND(NOT(ISERROR(RC7)), ISNUMBER(RC7)), AND(NOT(ISERROR(RC8)), ISNUMBER(RC8)), AND(NOT(ISERROR(RC9)), ISNUMBER(RC9)), AND(NOT(ISERROR(RC10)), ISNUMBER(RC10))), 1, 0) -> 0 | M70: =INDEX(Gross!R1C1:R46C51, RC1, 26) -> #REF! | N70: =INDEX(Gross!R1C1:R46C51, RC1, 27) -> #REF!
A71: 150 | B71: =INDEX(2001Grossed!R1C1:R46C51, RC[-1], 26) -> #REF! | C71: =INDEX(2001Grossed!R1C1:R46C51, RC1, 27) -> #REF! | D71: =IF(Menus!R9C10, RC[-1]/RC[-2], RC[-1]) -> #REF! | E71: =IF(RC11=1, RC[-3], NA()) -> #NA | F71: =INDEX(2001Grossed!R1C1:R46C51, RC1, 1) -> #REF! | G71: =IF(EQUAL(INDEX(2001Grossed!R1C1:R46C51, RC1, 2), R1C), RC4, NA()) -> #REF! | H71: =IF(EQUAL(INDEX(2001Grossed!R1C1:R46C51, RC1, 2), R1C), RC4, NA()) -> #REF! | I71: =IF(EQUAL(INDEX(2001Grossed!R1C1:R46C51, RC1, 2), R1C), RC4, NA()) -> #REF! | J71: =IF(EQUAL(INDEX(2001Grossed!R1C1:R46C51, RC1, 2), R1C), RC4, NA()) -> #REF! | K71: =IF(OR(AND(NOT(ISERROR(RC7)), ISNUMBER(RC7)), AND(NOT(ISERROR(RC8)), ISNUMBER(RC8)), AND(NOT(ISERROR(RC9)), ISNUMBER(RC9)), AND(NOT(ISERROR(RC10)), ISNUMBER(RC10))), 1, 0) -> 0 | M71: =INDEX(Gross!R1C1:R46C51, RC1, 26) -> #REF! | N71: =INDEX(Gross!R1C1:R46C51, RC1, 27) -> #REF!
A72: 184 | B72: =INDEX(2001Grossed!R1C1:R46C51, RC[-1], 26) -> #REF! | C72: =INDEX(2001Grossed!R1C1:R46C51, RC1, 27) -> #REF! | D72: =IF(Menus!R9C10, RC[-1]/RC[-2], RC[-1]) -> #REF! | E72: =IF(RC11=1, RC[-3], NA()) -> #NA | F72: =INDEX(2001Grossed!R1C1:R46C51, RC1, 1) -> #REF! | G72: =IF(EQUAL(INDEX(2001Grossed!R1C1:R46C51, RC1, 2), R1C), RC4, NA()) -> #REF! | H72: =IF(EQUAL(INDEX(2001Grossed!R1C1:R46C51, RC1, 2), R1C), RC4, NA()) -> #REF! | I72: =IF(EQUAL(INDEX(2001Grossed!R1C1:R46C51, RC1, 2), R1C), RC4, NA()) -> #REF! | J72: =IF(EQUAL(INDEX(2001Grossed!R1C1:R46C51, RC1, 2), R1C), RC4, NA()) -> #REF! | K72: =IF(OR(AND(NOT(ISERROR(RC7)), ISNUMBER(RC7)), AND(NOT(ISERROR(RC8)), ISNUMBER(RC8)), AND(NOT(ISERROR(RC9)), ISNUMBER(RC9)), AND(NOT(ISERROR(RC10)), ISNUMBER(RC10))), 1, 0) -> 0 | M72: =INDEX(Gross!R1C1:R46C51, RC1, 26) -> #REF! | N72: =INDEX(Gross!R1C1:R46C51, RC1, 27) -> #REF!
A73: 143 | B73: =INDEX(2001Grossed!R1C1:R46C51, RC[-1], 26) -> #REF! | C73: =INDEX(2001Grossed!R1C1:R46C51, RC1, 27) -> #REF! | D73: =IF(Menus!R9C10, RC[-1]/RC[-2], RC[-1]) -> #REF! | E73: =IF(RC11=1, RC[-3], NA()) -> #NA | F73: =INDEX(2001Grossed!R1C1:R46C51, RC1, 1) -> #REF! | G73: =IF(EQUAL(INDEX(2001Grossed!R1C1:R46C51, RC1, 2), R1C), RC4, NA()) -> #REF! | H73: =IF(EQUAL(INDEX(2001Grossed!R1C1:R46C51, RC1, 2), R1C), RC4, NA()) -> #REF! | I73: =IF(EQUAL(INDEX(2001Grossed!R1C1:R46C51, RC1, 2), R1C), RC4, NA()) -> #REF! | J73: =IF(EQUAL(INDEX(2001Grossed!R1C1:R46C51, RC1, 2), R1C), RC4, NA()) -> #REF! | K73: =IF(OR(AND(NOT(ISERROR(RC7)), ISNUMBER(RC7)), AND(NOT(ISERROR(RC8)), ISNUMBER(RC8)), AND(NOT(ISERROR(RC9)), ISNUMBER(RC9)), AND(NOT(ISERROR(RC10)), ISNUMBER(RC10))), 1, 0) -> 0 | M73: =INDEX(Gross!R1C1:R46C51, RC1, 26) -> #REF! | N73: =INDEX(Gross!R1C1:R46C51, RC1, 27) -> #REF!
A74: 105 | B74: =INDEX(2001Grossed!R1C1:R46C51, RC[-1], 26) -> #REF! | C74: =INDEX(2001Grossed!R1C1:R46C51, RC1, 27) -> #REF! | D74: =IF(Menus!R9C10, RC[-1]/RC[-2], RC[-1]) -> #REF! | E74: =IF(RC11=1, RC[-3], NA()) -> #NA | F74: =INDEX(2001Grossed!R1C1:R46C51, RC1, 1) -> #REF! | G74: =IF(EQUAL(INDEX(2001Grossed!R1C1:R46C51, RC1, 2), R1C), RC4, NA()) -> #REF! | H74: =IF(EQUAL(INDEX(2001Grossed!R1C1:R46C51, RC1, 2), R1C), RC4, NA()) -> #REF! | I74: =IF(EQUAL(INDEX(2001Grossed!R1C1:R46C51, RC1, 2), R1C), RC4, NA()) -> #REF! | J74: =IF(EQUAL(INDEX(2001Grossed!R1C1:R46C51, RC1, 2), R1C), RC4, NA()) -> #REF! | K74: =IF(OR(AND(NOT(ISERROR(RC7)), ISNUMBER(RC7)), AND(NOT(ISERROR(RC8)), ISNUMBER(RC8)), AND(NOT(ISERROR(RC9)), ISNUMBER(RC9)), AND(NOT(ISERROR(RC10)), ISNUMBER(RC10))), 1, 0) -> 0 | M74: =INDEX(Gross!R1C1:R46C51, RC1, 26) -> #REF! | N74: =INDEX(Gross!R1C1:R46C51, RC1, 27) -> #REF!
A75: 146 | B75: =INDEX(2001Grossed!R1C1:R46C51, RC[-1], 26) -> #REF! | C75: =INDEX(2001Grossed!R1C1:R46C51, RC1, 27) -> #REF! | D75: =IF(Menus!R9C10, RC[-1]/RC[-2], RC[-1]) -> #REF! | E75: =IF(RC11=1, RC[-3], NA()) -> #NA | F75: =INDEX(2001Grossed!R1C1:R46C51, RC1, 1) -> #REF! | G75: =IF(EQUAL(INDEX(2001Grossed!R1C1:R46C51, RC1, 2), R1C), RC4, NA()) -> #REF! | H75: =IF(EQUAL(INDEX(2001Grossed!R1C1:R46C51, RC1, 2), R1C), RC4, NA()) -> #REF! | I75: =IF(EQUAL(INDEX(2001Grossed!R1C1:R46C51, RC1, 2), R1C), RC4, NA()) -> #REF! | J75: =IF(EQUAL(INDEX(2001Grossed!R1C1:R46C51, RC1, 2), R1C), RC4, NA()) -> #REF! | K75: =IF(OR(AND(NOT(ISERROR(RC7)), ISNUMBER(RC7)), AND(NOT(ISERROR(RC8)), ISNUMBER(RC8)), AND(NOT(ISERROR(RC9)), ISNUMBER(RC9)), AND(NOT(ISERROR(RC10)), ISNUMBER(RC10))), 1, 0) -> 0 | M75: =INDEX(Gross!R1C1:R46C51, RC1, 26) -> #REF! | N75: =INDEX(Gross!R1C1:R46C51, RC1, 27) -> #REF!
A76: 62 | B76: =INDEX(2001Grossed!R1C1:R46C51, RC[-1], 26) -> #REF! | C76: =INDEX(2001Grossed!R1C1:R46C51, RC1, 27) -> #REF! | D76: =IF(Menus!R9C10, RC[-1]/RC[-2], RC[-1]) -> #REF! | E76: =IF(RC11=1, RC[-3], NA()) -> #NA | F76: =INDEX(2001Grossed!R1C1:R46C51, RC1, 1) -> #REF! | G76: =IF(EQUAL(INDEX(2001Grossed!R1C1:R46C51, RC1, 2), R1C), RC4, NA()) -> #REF! | H76: =IF(EQUAL(INDEX(2001Grossed!R1C1:R46C51, RC1, 2), R1C), RC4, NA()) -> #REF! | I76: =IF(EQUAL(INDEX(2001Grossed!R1C1:R46C51, RC1, 2), R1C), RC4, NA()) -> #REF! | J76: =IF(EQUAL(INDEX(2001Grossed!R1C1:R46C51, RC1, 2), R1C), RC4, NA()) -> #REF! | K76: =IF(OR(AND(NOT(ISERROR(RC7)), ISNUMBER(RC7)), AND(NOT(ISERROR(RC8)), ISNUMBER(RC8)), AND(NOT(ISERROR(RC9)), ISNUMBER(RC9)), AND(NOT(ISERROR(RC10)), ISNUMBER(RC10))), 1, 0) -> 0 | M76: =INDEX(Gross!R1C1:R46C51, RC1, 26) -> #REF! | N76: =INDEX(Gross!R1C1:R46C51, RC1, 27) -> #REF!
A77: 154 | B77: =INDEX(2001Grossed!R1C1:R46C51, RC[-1], 26) -> #REF! | C77: =INDEX(2001Grossed!R1C1:R46C51, RC1, 27) -> #REF! | D77: =IF(Menus!R9C10, RC[-1]/RC[-2], RC[-1]) -> #REF! | E77: =IF(RC11=1, RC[-3], NA()) -> #NA | F77: =INDEX(2001Grossed!R1C1:R46C51, RC1, 1) -> #REF! | G77: =IF(EQUAL(INDEX(2001Grossed!R1C1:R46C51, RC1, 2), R1C), RC4, NA()) -> #REF! | H77: =IF(EQUAL(INDEX(2001Grossed!R1C1:R46C51, RC1, 2), R1C), RC4, NA()) -> #REF! | I77: =IF(EQUAL(INDEX(2001Grossed!R1C1:R46C51, RC1, 2), R1C), RC4, NA()) -> #REF! | J77: =IF(EQUAL(INDEX(2001Grossed!R1C1:R46C51, RC1, 2), R1C), RC4, NA()) -> #REF! | K77: =IF(OR(AND(NOT(ISERROR(RC7)), ISNUMBER(RC7)), AND(NOT(ISERROR(RC8)), ISNUMBER(RC8)), AND(NOT(ISERROR(RC9)), ISNUMBER(RC9)), AND(NOT(ISERROR(RC10)), ISNUMBER(RC10))), 1, 0) -> 0 | M77: =INDEX(Gross!R1C1:R46C51, RC1, 26) -> #REF! | N77: =INDEX(Gross!R1C1:R46C51, RC1, 27) -> #REF!
A78: 88 | B78: =INDEX(2001Grossed!R1C1:R46C51, RC[-1], 26) -> #REF! | C78: =INDEX(2001Grossed!R1C1:R46C51, RC1, 27) -> #REF! | D78: =IF(Menus!R9C10, RC[-1]/RC[-2], RC[-1]) -> #REF! | E78: =IF(RC11=1, RC[-3], NA()) -> #NA | F78: =INDEX(2001Grossed!R1C1:R46C51, RC1, 1) -> #REF! | G78: =IF(EQUAL(INDEX(2001Grossed!R1C1:R46C51, RC1, 2), R1C), RC4, NA()) -> #REF! | H78: =IF(EQUAL(INDEX(2001Grossed!R1C1:R46C51, RC1, 2), R1C), RC4, NA()) -> #REF! | I78: =IF(EQUAL(INDEX(2001Grossed!R1C1:R46C51, RC1, 2), R1C), RC4, NA()) -> #REF! | J78: =IF(EQUAL(INDEX(2001Grossed!R1C1:R46C51, RC1, 2), R1C), RC4, NA()) -> #REF! | K78: =IF(OR(AND(NOT(ISERROR(RC7)), ISNUMBER(RC7)), AND(NOT(ISERROR(RC8)), ISNUMBER(RC8)), AND(NOT(ISERROR(RC9)), ISNUMBER(RC9)), AND(NOT(ISERROR(RC10)), ISNUMBER(RC10))), 1, 0) -> 0 | M78: =INDEX(Gross!R1C1:R46C51, RC1, 26) -> #REF! | N78: =INDEX(Gross!R1C1:R46C51, RC1, 27) -> #REF!
A79: 109 | B79: =INDEX(2001Grossed!R1C1:R46C51, RC[-1], 26) -> #REF! | C79: =INDEX(2001Grossed!R1C1:R46C51, RC1, 27) -> #REF! | D79: =IF(Menus!R9C10, RC[-1]/RC[-2], RC[-1]) -> #REF! | E79: =IF(RC11=1, RC[-3], NA()) -> #NA | F79: =INDEX(2001Grossed!R1C1:R46C51, RC1, 1) -> #REF! | G79: =IF(EQUAL(INDEX(2001Grossed!R1C1:R46C51, RC1, 2), R1C), RC4, NA()) -> #REF! | H79: =IF(EQUAL(INDEX(2001Grossed!R1C1:R46C51, RC1, 2), R1C), RC4, NA()) -> #REF! | I79: =IF(EQUAL(INDEX(2001Grossed!R1C1:R46C51, RC1, 2), R1C), RC4, NA()) -> #REF! | J79: =IF(EQUAL(INDEX(2001Grossed!R1C1:R46C51, RC1, 2), R1C), RC4, NA()) -> #REF! | K79: =IF(OR(AND(NOT(ISERROR(RC7)), ISNUMBER(RC7)), AND(NOT(ISERROR(RC8)), ISNUMBER(RC8)), AND(NOT(ISERROR(RC9)), ISNUMBER(RC9)), AND(NOT(ISERROR(RC10)), ISNUMBER(RC10))), 1, 0) -> 0 | M79: =INDEX(Gross!R1C1:R46C51, RC1, 26) -> #REF! | N79: =INDEX(Gross!R1C1:R46C51, RC1, 27) -> #REF!
A80: 160 | B80: =INDEX(2001Grossed!R1C1:R46C51, RC[-1], 26) -> #REF! | C80: =INDEX(2001Grossed!R1C1:R46C51, RC1, 27) -> #REF! | D80: =IF(Menus!R9C10, RC[-1]/RC[-2], RC[-1]) -> #REF! | E80: =IF(RC11=1, RC[-3], NA()) -> #NA | F80: =INDEX(2001Grossed!R1C1:R46C51, RC1, 1) -> #REF! | G80: =IF(EQUAL(INDEX(2001Grossed!R1C1:R46C51, RC1, 2), R1C), RC4, NA()) -> #REF! | H80: =IF(EQUAL(INDEX(2001Grossed!R1C1:R46C51, RC1, 2), R1C), RC4, NA()) -> #REF! | I80: =IF(EQUAL(INDEX(2001Grossed!R1C1:R46C51, RC1, 2), R1C), RC4, NA()) -> #REF! | J80: =IF(EQUAL(INDEX(2001Grossed!R1C1:R46C51, RC1, 2), R1C), RC4, NA()) -> #REF! | K80: =IF(OR(AND(NOT(ISERROR(RC7)), ISNUMBER(RC7)), AND(NOT(ISERROR(RC8)), ISNUMBER(RC8)), AND(NOT(ISERROR(RC9)), ISNUMBER(RC9)), AND(NOT(ISERROR(RC10)), ISNUMBER(RC10))), 1, 0) -> 0 | M80: =INDEX(Gross!R1C1:R46C51, RC1, 26) -> #REF! | N80: =INDEX(Gross!R1C1:R46C51, RC1, 27) -> #REF!
A81: 81 | B81: =INDEX(2001Grossed!R1C1:R46C51, RC[-1], 26) -> #REF! | C81: =INDEX(2001Grossed!R1C1:R46C51, RC1, 27) -> #REF! | D81: =IF(Menus!R9C10, RC[-1]/RC[-2], RC[-1]) -> #REF! | E81: =IF(RC11=1, RC[-3], NA()) -> #NA | F81: =INDEX(2001Grossed!R1C1:R46C51, RC1, 1) -> #REF! | G81: =IF(EQUAL(INDEX(2001Grossed!R1C1:R46C51, RC1, 2), R1C), RC4, NA()) -> #REF! | H81: =IF(EQUAL(INDEX(2001Grossed!R1C1:R46C51, RC1, 2), R1C), RC4, NA()) -> #REF! | I81: =IF(EQUAL(INDEX(2001Grossed!R1C1:R46C51, RC1, 2), R1C), RC4, NA()) -> #REF! | J81: =IF(EQUAL(INDEX(2001Grossed!R1C1:R46C51, RC1, 2), R1C), RC4, NA()) -> #REF! | K81: =IF(OR(AND(NOT(ISERROR(RC7)), ISNUMBER(RC7)), AND(NOT(ISERROR(RC8)), ISNUMBER(RC8)), AND(NOT(ISERROR(RC9)), ISNUMBER(RC9)), AND(NOT(ISERROR(RC10)), ISNUMBER(RC10))), 1, 0) -> 0 | M81: =INDEX(Gross!R1C1:R46C51, RC1, 26) -> #REF! | N81: =INDEX(Gross!R1C1:R46C51, RC1, 27) -> #REF!
A82: 112 | B82: =INDEX(2001Grossed!R1C1:R46C51, RC[-1], 26) -> #REF! | C82: =INDEX(2001Grossed!R1C1:R46C51, RC1, 27) -> #REF! | D82: =IF(Menus!R9C10, RC[-1]/RC[-2], RC[-1]) -> #REF! | E82: =IF(RC11=1, RC[-3], NA()) -> #NA | F82: =INDEX(2001Grossed!R1C1:R46C51, RC1, 1) -> #REF! | G82: =IF(EQUAL(INDEX(2001Grossed!R1C1:R46C51, RC1, 2), R1C), RC4, NA()) -> #REF! | H82: =IF(EQUAL(INDEX(2001Grossed!R1C1:R46C51, RC1, 2), R1C), RC4, NA()) -> #REF! | I82: =IF(EQUAL(INDEX(2001Grossed!R1C1:R46C51, RC1, 2), R1C), RC4, NA()) -> #REF! | J82: =IF(EQUAL(INDEX(2001Grossed!R1C1:R46C51, RC1, 2), R1C), RC4, NA()) -> #REF! | K82: =IF(OR(AND(NOT(ISERROR(RC7)), ISNUMBER(RC7)), AND(NOT(ISERROR(RC8)), ISNUMBER(RC8)), AND(NOT(ISERROR(RC9)), ISNUMBER(RC9)), AND(NOT(ISERROR(RC10)), ISNUMBER(RC10))), 1, 0) -> 0 | M82: =INDEX(Gross!R1C1:R46C51, RC1, 26) -> #REF! | N82: =INDEX(Gross!R1C1:R46C51, RC1, 27) -> #REF!
A83: 68 | B83: =INDEX(2001Grossed!R1C1:R46C51, RC[-1], 26) -> #REF! | C83: =INDEX(2001Grossed!R1C1:R46C51, RC1, 27) -> #REF! | D83: =IF(Menus!R9C10, RC[-1]/RC[-2], RC[-1]) -> #REF! | E83: =IF(RC11=1, RC[-3], NA()) -> #NA | F83: =INDEX(2001Grossed!R1C1:R46C51, RC1, 1) -> #REF! | G83: =IF(EQUAL(INDEX(2001Grossed!R1C1:R46C51, RC1, 2), R1C), RC4, NA()) -> #REF! | H83: =IF(EQUAL(INDEX(2001Grossed!R1C1:R46C51, RC1, 2), R1C), RC4, NA()) -> #REF! | I83: =IF(EQUAL(INDEX(2001Grossed!R1C1:R46C51, RC1, 2), R1C), RC4, NA()) -> #REF! | J83: =IF(EQUAL(INDEX(2001Grossed!R1C1:R46C51, RC1, 2), R1C), RC4, NA()) -> #REF! | K83: =IF(OR(AND(NOT(ISERROR(RC7)), ISNUMBER(RC7)), AND(NOT(ISERROR(RC8)), ISNUMBER(RC8)), AND(NOT(ISERROR(RC9)), ISNUMBER(RC9)), AND(NOT(ISERROR(RC10)), ISNUMBER(RC10))), 1, 0) -> 0 | M83: =INDEX(Gross!R1C1:R46C51, RC1, 26) -> #REF! | N83: =INDEX(Gross!R1C1:R46C51, RC1, 27) -> #REF!
A84: 190 | B84: =INDEX(2001Grossed!R1C1:R46C51, RC[-1], 26) -> #REF! | C84: =INDEX(2001Grossed!R1C1:R46C51, RC1, 27) -> #REF! | D84: =IF(Menus!R9C10, RC[-1]/RC[-2], RC[-1]) -> #REF! | E84: =IF(RC11=1, RC[-3], NA()) -> #NA | F84: =INDEX(2001Grossed!R1C1:R46C51, RC1, 1) -> #REF! | G84: =IF(EQUAL(INDEX(2001Grossed!R1C1:R46C51, RC1, 2), R1C), RC4, NA()) -> #REF! | H84: =IF(EQUAL(INDEX(2001Grossed!R1C1:R46C51, RC1, 2), R1C), RC4, NA()) -> #REF! | I84: =IF(EQUAL(INDEX(2001Grossed!R1C1:R46C51, RC1, 2), R1C), RC4, NA()) -> #REF! | J84: =IF(EQUAL(INDEX(2001Grossed!R1C1:R46C51, RC1, 2), R1C), RC4, NA()) -> #REF! | K84: =IF(OR(AND(NOT(ISERROR(RC7)), ISNUMBER(RC7)), AND(NOT(ISERROR(RC8)), ISNUMBER(RC8)), AND(NOT(ISERROR(RC9)), ISNUMBER(RC9)), AND(NOT(ISERROR(RC10)), ISNUMBER(RC10))), 1, 0) -> 0 | M84: =INDEX(Gross!R1C1:R46C51, RC1, 26) -> #REF! | N84: =INDEX(Gross!R1C1:R46C51, RC1, 27) -> #REF!
A85: 69 | B85: =INDEX(2001Grossed!R1C1:R46C51, RC[-1], 26) -> #REF! | C85: =INDEX(2001Grossed!R1C1:R46C51, RC1, 27) -> #REF! | D85: =IF(Menus!R9C10, RC[-1]/RC[-2], RC[-1]) -> #REF! | E85: =IF(RC11=1, RC[-3], NA()) -> #NA | F85: =INDEX(2001Grossed!R1C1:R46C51, RC1, 1) -> #REF! | G85: =IF(EQUAL(INDEX(2001Grossed!R1C1:R46C51, RC1, 2), R1C), RC4, NA()) -> #REF! | H85: =IF(EQUAL(INDEX(2001Grossed!R1C1:R46C51, RC1, 2), R1C), RC4, NA()) -> #REF! | I85: =IF(EQUAL(INDEX(2001Grossed!R1C1:R46C51, RC1, 2), R1C), RC4, NA()) -> #REF! | J85: =IF(EQUAL(INDEX(2001Grossed!R1C1:R46C51, RC1, 2), R1C), RC4, NA()) -> #REF! | K85: =IF(OR(AND(NOT(ISERROR(RC7)), ISNUMBER(RC7)), AND(NOT(ISERROR(RC8)), ISNUMBER(RC8)), AND(NOT(ISERROR(RC9)), ISNUMBER(RC9)), AND(NOT(ISERROR(RC10)), ISNUMBER(RC10))), 1, 0) -> 0 | M85: =INDEX(Gross!R1C1:R46C51, RC1, 26) -> #REF! | N85: =INDEX(Gross!R1C1:R46C51, RC1, 27) -> #REF!
A86: 134 | B86: =INDEX(2001Grossed!R1C1:R46C51, RC[-1], 26) -> #REF! | C86: =INDEX(2001Grossed!R1C1:R46C51, RC1, 27) -> #REF! | D86: =IF(Menus!R9C10, RC[-1]/RC[-2], RC[-1]) -> #REF! | E86: =IF(RC11=1, RC[-3], NA()) -> #NA | F86: =INDEX(2001Grossed!R1C1:R46C51, RC1, 1) -> #REF! | G86: =IF(EQUAL(INDEX(2001Grossed!R1C1:R46C51, RC1, 2), R1C), RC4, NA()) -> #REF! | H86: =IF(EQUAL(INDEX(2001Grossed!R1C1:R46C51, RC1, 2), R1C), RC4, NA()) -> #REF! | I86: =IF(EQUAL(INDEX(2001Grossed!R1C1:R46C51, RC1, 2), R1C), RC4, NA()) -> #REF! | J86: =IF(EQUAL(INDEX(2001Grossed!R1C1:R46C51, RC1, 2), R1C), RC4, NA()) -> #REF! | K86: =IF(OR(AND(NOT(ISERROR(RC7)), ISNUMBER(RC7)), AND(NOT(ISERROR(RC8)), ISNUMBER(RC8)), AND(NOT(ISERROR(RC9)), ISNUMBER(RC9)), AND(NOT(ISERROR(RC10)), ISNUMBER(RC10))), 1, 0) -> 0 | M86: =INDEX(Gross!R1C1:R46C51, RC1, 26) -> #REF! | N86: =INDEX(Gross!R1C1:R46C51, RC1, 27) -> #REF!
A87: 135 | B87: =INDEX(2001Grossed!R1C1:R46C51, RC[-1], 26) -> #REF! | C87: =INDEX(2001Grossed!R1C1:R46C51, RC1, 27) -> #REF! | D87: =IF(Menus!R9C10, RC[-1]/RC[-2], RC[-1]) -> #REF! | E87: =IF(RC11=1, RC[-3], NA()) -> #NA | F87: =INDEX(2001Grossed!R1C1:R46C51, RC1, 1) -> #REF! | G87: =IF(EQUAL(INDEX(2001Grossed!R1C1:R46C51, RC1, 2), R1C), RC4, NA()) -> #REF! | H87: =IF(EQUAL(INDEX(2001Grossed!R1C1:R46C51, RC1, 2), R1C), RC4, NA()) -> #REF! | I87: =IF(EQUAL(INDEX(2001Grossed!R1C1:R46C51, RC1, 2), R1C), RC4, NA()) -> #REF! | J87: =IF(EQUAL(INDEX(2001Grossed!R1C1:R46C51, RC1, 2), R1C), RC4, NA()) -> #REF! | K87: =IF(OR(AND(NOT(ISERROR(RC7)), ISNUMBER(RC7)), AND(NOT(ISERROR(RC8)), ISNUMBER(RC8)), AND(NOT(ISERROR(RC9)), ISNUMBER(RC9)), AND(NOT(ISERROR(RC10)), ISNUMBER(RC10))), 1, 0) -> 0 | M87: =INDEX(Gross!R1C1:R46C51, RC1, 26) -> #REF! | N87: =INDEX(Gross!R1C1:R46C51, RC1, 27) -> #REF!
A88: 193 | B88: =INDEX(2001Grossed!R1C1:R46C51, RC[-1], 26) -> #REF! | C88: =INDEX(2001Grossed!R1C1:R46C51, RC1, 27) -> #REF! | D88: =IF(Menus!R9C10, RC[-1]/RC[-2], RC[-1]) -> #REF! | E88: =IF(RC11=1, RC[-3], NA()) -> #NA | F88: =INDEX(2001Grossed!R1C1:R46C51, RC1, 1) -> #REF! | G88: =IF(EQUAL(INDEX(2001Grossed!R1C1:R46C51, RC1, 2), R1C), RC4, NA()) -> #REF! | H88: =IF(EQUAL(INDEX(2001Grossed!R1C1:R46C51, RC1, 2), R1C), RC4, NA()) -> #REF! | I88: =IF(EQUAL(INDEX(2001Grossed!R1C1:R46C51, RC1, 2), R1C), RC4, NA()) -> #REF! | J88: =IF(EQUAL(INDEX(2001Grossed!R1C1:R46C51, RC1, 2), R1C), RC4, NA()) -> #REF! | K88: =IF(OR(AND(NOT(ISERROR(RC7)), ISNUMBER(RC7)), AND(NOT(ISERROR(RC8)), ISNUMBER(RC8)), AND(NOT(ISERROR(RC9)), ISNUMBER(RC9)), AND(NOT(ISERROR(RC10)), ISNUMBER(RC10))), 1, 0) -> 0 | M88: =INDEX(Gross!R1C1:R46C51, RC1, 26) -> #REF! | N88: =INDEX(Gross!R1C1:R46C51, RC1, 27) -> #REF!
A89: 55 | B89: =INDEX(2001Grossed!R1C1:R46C51, RC[-1], 26) -> #REF! | C89: =INDEX(2001Grossed!R1C1:R46C51, RC1, 27) -> #REF! | D89: =IF(Menus!R9C10, RC[-1]/RC[-2], RC[-1]) -> #REF! | E89: =IF(RC11=1, RC[-3], NA()) -> #NA | F89: =INDEX(2001Grossed!R1C1:R46C51, RC1, 1) -> #REF! | G89: =IF(EQUAL(INDEX(2001Grossed!R1C1:R46C51, RC1, 2), R1C), RC4, NA()) -> #REF! | H89: =IF(EQUAL(INDEX(2001Grossed!R1C1:R46C51, RC1, 2), R1C), RC4, NA()) -> #REF! | I89: =IF(EQUAL(INDEX(2001Grossed!R1C1:R46C51, RC1, 2), R1C), RC4, NA()) -> #REF! | J89: =IF(EQUAL(INDEX(2001Grossed!R1C1:R46C51, RC1, 2), R1C), RC4, NA()) -> #REF! | K89: =IF(OR(AND(NOT(ISERROR(RC7)), ISNUMBER(RC7)), AND(NOT(ISERROR(RC8)), ISNUMBER(RC8)), AND(NOT(ISERROR(RC9)), ISNUMBER(RC9)), AND(NOT(ISERROR(RC10)), ISNUMBER(RC10))), 1, 0) -> 0 | M89: =INDEX(Gross!R1C1:R46C51, RC1, 26) -> #REF! | N89: =INDEX(Gross!R1C1:R46C51, RC1, 27) -> #REF!
A90: 188 | B90: =INDEX(2001Grossed!R1C1:R46C51, RC[-1], 26) -> #REF! | C90: =INDEX(2001Grossed!R1C1:R46C51, RC1, 27) -> #REF! | D90: =IF(Menus!R9C10, RC[-1]/RC[-2], RC[-1]) -> #REF! | E90: =IF(RC11=1, RC[-3], NA()) -> #NA | F90: =INDEX(2001Grossed!R1C1:R46C51, RC1, 1) -> #REF! | G90: =IF(EQUAL(INDEX(2001Grossed!R1C1:R46C51, RC1, 2), R1C), RC4, NA()) -> #REF! | H90: =IF(EQUAL(INDEX(2001Grossed!R1C1:R46C51, RC1, 2), R1C), RC4, NA()) -> #REF! | I90: =IF(EQUAL(INDEX(2001Grossed!R1C1:R46C51, RC1, 2), R1C), RC4, NA()) -> #REF! | J90: =IF(EQUAL(INDEX(2001Grossed!R1C1:R46C51, RC1, 2), R1C), RC4, NA()) -> #REF! | K90: =IF(OR(AND(NOT(ISERROR(RC7)), ISNUMBER(RC7)), AND(NOT(ISERROR(RC8)), ISNUMBER(RC8)), AND(NOT(ISERROR(RC9)), ISNUMBER(RC9)), AND(NOT(ISERROR(RC10)), ISNUMBER(RC10))), 1, 0) -> 0 | M90: =INDEX(Gross!R1C1:R46C51, RC1, 26) -> #REF! | N90: =INDEX(Gross!R1C1:R46C51, RC1, 27) -> #REF!
A91: 116 | B91: =INDEX(2001Grossed!R1C1:R46C51, RC[-1], 26) -> #REF! | C91: =INDEX(2001Grossed!R1C1:R46C51, RC1, 27) -> #REF! | D91: =IF(Menus!R9C10, RC[-1]/RC[-2], RC[-1]) -> #REF! | E91: =IF(RC11=1, RC[-3], NA()) -> #NA | F91: =INDEX(2001Grossed!R1C1:R46C51, RC1, 1) -> #REF! | G91: =IF(EQUAL(INDEX(2001Grossed!R1C1:R46C51, RC1, 2), R1C), RC4, NA()) -> #REF! | H91: =IF(EQUAL(INDEX(2001Grossed!R1C1:R46C51, RC1, 2), R1C), RC4, NA()) -> #REF! | I91: =IF(EQUAL(INDEX(2001Grossed!R1C1:R46C51, RC1, 2), R1C), RC4, NA()) -> #REF! | J91: =IF(EQUAL(INDEX(2001Grossed!R1C1:R46C51, RC1, 2), R1C), RC4, NA()) -> #REF! | K91: =IF(OR(AND(NOT(ISERROR(RC7)), ISNUMBER(RC7)), AND(NOT(ISERROR(RC8)), ISNUMBER(RC8)), AND(NOT(ISERROR(RC9)), ISNUMBER(RC9)), AND(NOT(ISERROR(RC10)), ISNUMBER(RC10))), 1, 0) -> 0 | M91: =INDEX(Gross!R1C1:R46C51, RC1, 26) -> #REF! | N91: =INDEX(Gross!R1C1:R46C51, RC1, 27) -> #REF!
A92: 95 | B92: =INDEX(2001Grossed!R1C1:R46C51, RC[-1], 26) -> #REF! | C92: =INDEX(2001Grossed!R1C1:R46C51, RC1, 27) -> #REF! | D92: =IF(Menus!R9C10, RC[-1]/RC[-2], RC[-1]) -> #REF! | E92: =IF(RC11=1, RC[-3], NA()) -> #NA | F92: =INDEX(2001Grossed!R1C1:R46C51, RC1, 1) -> #REF! | G92: =IF(EQUAL(INDEX(2001Grossed!R1C1:R46C51, RC1, 2), R1C), RC4, NA()) -> #REF! | H92: =IF(EQUAL(INDEX(2001Grossed!R1C1:R46C51, RC1, 2), R1C), RC4, NA()) -> #REF! | I92: =IF(EQUAL(INDEX(2001Grossed!R1C1:R46C51, RC1, 2), R1C), RC4, NA()) -> #REF! | J92: =IF(EQUAL(INDEX(2001Grossed!R1C1:R46C51, RC1, 2), R1C), RC4, NA()) -> #REF! | K92: =IF(OR(AND(NOT(ISERROR(RC7)), ISNUMBER(RC7)), AND(NOT(ISERROR(RC8)), ISNUMBER(RC8)), AND(NOT(ISERROR(RC9)), ISNUMBER(RC9)), AND(NOT(ISERROR(RC10)), ISNUMBER(RC10))), 1, 0) -> 0 | M92: =INDEX(Gross!R1C1:R46C51, RC1, 26) -> #REF! | N92: =INDEX(Gross!R1C1:R46C51, RC1, 27) -> #REF!
A93: 181 | B93: =INDEX(2001Grossed!R1C1:R46C51, RC[-1], 26) -> #REF! | C93: =INDEX(2001Grossed!R1C1:R46C51, RC1, 27) -> #REF! | D93: =IF(Menus!R9C10, RC[-1]/RC[-2], RC[-1]) -> #REF! | E93: =IF(RC11=1, RC[-3], NA()) -> #NA | F93: =INDEX(2001Grossed!R1C1:R46C51, RC1, 1) -> #REF! | G93: =IF(EQUAL(INDEX(2001Grossed!R1C1:R46C51, RC1, 2), R1C), RC4, NA()) -> #REF! | H93: =IF(EQUAL(INDEX(2001Grossed!R1C1:R46C51, RC1, 2), R1C), RC4, NA()) -> #REF! | I93: =IF(EQUAL(INDEX(2001Grossed!R1C1:R46C51, RC1, 2), R1C), RC4, NA()) -> #REF! | J93: =IF(EQUAL(INDEX(2001Grossed!R1C1:R46C51, RC1, 2), R1C), RC4, NA()) -> #REF! | K93: =IF(OR(AND(NOT(ISERROR(RC7)), ISNUMBER(RC7)), AND(NOT(ISERROR(RC8)), ISNUMBER(RC8)), AND(NOT(ISERROR(RC9)), ISNUMBER(RC9)), AND(NOT(ISERROR(RC10)), ISNUMBER(RC10))), 1, 0) -> 0 | M93: =INDEX(Gross!R1C1:R46C51, RC1, 26) -> #REF! | N93: =INDEX(Gross!R1C1:R46C51, RC1, 27) -> #REF!
A94: 161 | B94: =INDEX(2001Grossed!R1C1:R46C51, RC[-1], 26) -> #REF! | C94: =INDEX(2001Grossed!R1C1:R46C51, RC1, 27) -> #REF! | D94: =IF(Menus!R9C10, RC[-1]/RC[-2], RC[-1]) -> #REF! | E94: =IF(RC11=1, RC[-3], NA()) -> #NA | F94: =INDEX(2001Grossed!R1C1:R46C51, RC1, 1) -> #REF! | G94: =IF(EQUAL(INDEX(2001Grossed!R1C1:R46C51, RC1, 2), R1C), RC4, NA()) -> #REF! | H94: =IF(EQUAL(INDEX(2001Grossed!R1C1:R46C51, RC1, 2), R1C), RC4, NA()) -> #REF! | I94: =IF(EQUAL(INDEX(2001Grossed!R1C1:R46C51, RC1, 2), R1C), RC4, NA()) -> #REF! | J94: =IF(EQUAL(INDEX(2001Grossed!R1C1:R46C51, RC1, 2), R1C), RC4, NA()) -> #REF! | K94: =IF(OR(AND(NOT(ISERROR(RC7)), ISNUMBER(RC7)), AND(NOT(ISERROR(RC8)), ISNUMBER(RC8)), AND(NOT(ISERROR(RC9)), ISNUMBER(RC9)), AND(NOT(ISERROR(RC10)), ISNUMBER(RC10))), 1, 0) -> 0 | M94: =INDEX(Gross!R1C1:R46C51, RC1, 26) -> #REF! | N94: =INDEX(Gross!R1C1:R46C51, RC1, 27) -> #REF!
A95: 145 | B95: =INDEX(2001Grossed!R1C1:R46C51, RC[-1], 26) -> #REF! | C95: =INDEX(2001Grossed!R1C1:R46C51, RC1, 27) -> #REF! | D95: =IF(Menus!R9C10, RC[-1]/RC[-2], RC[-1]) -> #REF! | E95: =IF(RC11=1, RC[-3], NA()) -> #NA | F95: =INDEX(2001Grossed!R1C1:R46C51, RC1, 1) -> #REF! | G95: =IF(EQUAL(INDEX(2001Grossed!R1C1:R46C51, RC1, 2), R1C), RC4, NA()) -> #REF! | H95: =IF(EQUAL(INDEX(2001Grossed!R1C1:R46C51, RC1, 2), R1C), RC4, NA()) -> #REF! | I95: =IF(EQUAL(INDEX(2001Grossed!R1C1:R46C51, RC1, 2), R1C), RC4, NA()) -> #REF! | J95: =IF(EQUAL(INDEX(2001Grossed!R1C1:R46C51, RC1, 2), R1C), RC4, NA()) -> #REF! | K95: =IF(OR(AND(NOT(ISERROR(RC7)), ISNUMBER(RC7)), AND(NOT(ISERROR(RC8)), ISNUMBER(RC8)), AND(NOT(ISERROR(RC9)), ISNUMBER(RC9)), AND(NOT(ISERROR(RC10)), ISNUMBER(RC10))), 1, 0) -> 0 | M95: =INDEX(Gross!R1C1:R46C51, RC1, 26) -> #REF! | N95: =INDEX(Gross!R1C1:R46C51, RC1, 27) -> #REF!
A96: 74 | B96: =INDEX(2001Grossed!R1C1:R46C51, RC[-1], 26) -> #REF! | C96: =INDEX(2001Grossed!R1C1:R46C51, RC1, 27) -> #REF! | D96: =IF(Menus!R9C10, RC[-1]/RC[-2], RC[-1]) -> #REF! | E96: =IF(RC11=1, RC[-3], NA()) -> #NA | F96: =INDEX(2001Grossed!R1C1:R46C51, RC1, 1) -> #REF! | G96: =IF(EQUAL(INDEX(2001Grossed!R1C1:R46C51, RC1, 2), R1C), RC4, NA()) -> #REF! | H96: =IF(EQUAL(INDEX(2001Grossed!R1C1:R46C51, RC1, 2), R1C), RC4, NA()) -> #REF! | I96: =IF(EQUAL(INDEX(2001Grossed!R1C1:R46C51, RC1, 2), R1C), RC4, NA()) -> #REF! | J96: =IF(EQUAL(INDEX(2001Grossed!R1C1:R46C51, RC1, 2), R1C), RC4, NA()) -> #REF! | K96: =IF(OR(AND(NOT(ISERROR(RC7)), ISNUMBER(RC7)), AND(NOT(ISERROR(RC8)), ISNUMBER(RC8)), AND(NOT(ISERROR(RC9)), ISNUMBER(RC9)), AND(NOT(ISERROR(RC10)), ISNUMBER(RC10))), 1, 0) -> 0 | M96: =INDEX(Gross!R1C1:R46C51, RC1, 26) -> #REF! | N96: =INDEX(Gross!R1C1:R46C51, RC1, 27) -> #REF!
A97: 163 | B97: =INDEX(2001Grossed!R1C1:R46C51, RC[-1], 26) -> #REF! | C97: =INDEX(2001Grossed!R1C1:R46C51, RC1, 27) -> #REF! | D97: =IF(Menus!R9C10, RC[-1]/RC[-2], RC[-1]) -> #REF! | E97: =IF(RC11=1, RC[-3], NA()) -> #NA | F97: =INDEX(2001Grossed!R1C1:R46C51, RC1, 1) -> #REF! | G97: =IF(EQUAL(INDEX(2001Grossed!R1C1:R46C51, RC1, 2), R1C), RC4, NA()) -> #REF! | H97: =IF(EQUAL(INDEX(2001Grossed!R1C1:R46C51, RC1, 2), R1C), RC4, NA()) -> #REF! | I97: =IF(EQUAL(INDEX(2001Grossed!R1C1:R46C51, RC1, 2), R1C), RC4, NA()) -> #REF! | J97: =IF(EQUAL(INDEX(2001Grossed!R1C1:R46C51, RC1, 2), R1C), RC4, NA()) -> #REF! | K97: =IF(OR(AND(NOT(ISERROR(RC7)), ISNUMBER(RC7)), AND(NOT(ISERROR(RC8)), ISNUMBER(RC8)), AND(NOT(ISERROR(RC9)), ISNUMBER(RC9)), AND(NOT(ISERROR(RC10)), ISNUMBER(RC10))), 1, 0) -> 0 | M97: =INDEX(Gross!R1C1:R46C51, RC1, 26) -> #REF! | N97: =INDEX(Gross!R1C1:R46C51, RC1, 27) -> #REF!
A98: 164 | B98: =INDEX(2001Grossed!R1C1:R46C51, RC[-1], 26) -> #REF! | C98: =INDEX(2001Grossed!R1C1:R46C51, RC1, 27) -> #REF! | D98: =IF(Menus!R9C10, RC[-1]/RC[-2], RC[-1]) -> #REF! | E98: =IF(RC11=1, RC[-3], NA()) -> #NA | F98: =INDEX(2001Grossed!R1C1:R46C51, RC1, 1) -> #REF! | G98: =IF(EQUAL(INDEX(2001Grossed!R1C1:R46C51, RC1, 2), R1C), RC4, NA()) -> #REF! | H98: =IF(EQUAL(INDEX(2001Grossed!R1C1:R46C51, RC1, 2), R1C), RC4, NA()) -> #REF! | I98: =IF(EQUAL(INDEX(2001Grossed!R1C1:R46C51, RC1, 2), R1C), RC4, NA()) -> #REF! | J98: =IF(EQUAL(INDEX(2001Grossed!R1C1:R46C51, RC1, 2), R1C), RC4, NA()) -> #REF! | K98: =IF(OR(AND(NOT(ISERROR(RC7)), ISNUMBER(RC7)), AND(NOT(ISERROR(RC8)), ISNUMBER(RC8)), AND(NOT(ISERROR(RC9)), ISNUMBER(RC9)), AND(NOT(ISERROR(RC10)), ISNUMBER(RC10))), 1, 0) -> 0 | M98: =INDEX(Gross!R1C1:R46C51, RC1, 26) -> #REF! | N98: =INDEX(Gross!R1C1:R46C51, RC1, 27) -> #REF!
A99: 155 | B99: =INDEX(2001Grossed!R1C1:R46C51, RC[-1], 26) -> #REF! | C99: =INDEX(2001Grossed!R1C1:R46C51, RC1, 27) -> #REF! | D99: =IF(Menus!R9C10, RC[-1]/RC[-2], RC[-1]) -> #REF! | E99: =IF(RC11=1, RC[-3], NA()) -> #NA | F99: =INDEX(2001Grossed!R1C1:R46C51, RC1, 1) -> #REF! | G99: =IF(EQUAL(INDEX(2001Grossed!R1C1:R46C51, RC1, 2), R1C), RC4, NA()) -> #REF! | H99: =IF(EQUAL(INDEX(2001Grossed!R1C1:R46C51, RC1, 2), R1C), RC4, NA()) -> #REF! | I99: =IF(EQUAL(INDEX(2001Grossed!R1C1:R46C51, RC1, 2), R1C), RC4, NA()) -> #REF! | J99: =IF(EQUAL(INDEX(2001Grossed!R1C1:R46C51, RC1, 2), R1C), RC4, NA()) -> #REF! | K99: =IF(OR(AND(NOT(ISERROR(RC7)), ISNUMBER(RC7)), AND(NOT(ISERROR(RC8)), ISNUMBER(RC8)), AND(NOT(ISERROR(RC9)), ISNUMBER(RC9)), AND(NOT(ISERROR(RC10)), ISNUMBER(RC10))), 1, 0) -> 0 | M99: =INDEX(Gross!R1C1:R46C51, RC1, 26) -> #REF! | N99: =INDEX(Gross!R1C1:R46C51, RC1, 27) -> #REF!
A100: 84 | B100: =INDEX(2001Grossed!R1C1:R46C51, RC[-1], 26) -> #REF! | C100: =INDEX(2001Grossed!R1C1:R46C51, RC1, 27) -> #REF! | D100: =IF(Menus!R9C10, RC[-1]/RC[-2], RC[-1]) -> #REF! | E100: =IF(RC11=1, RC[-3], NA()) -> #NA | F100: =INDEX(2001Grossed!R1C1:R46C51, RC1, 1) -> #REF! | G100: =IF(EQUAL(INDEX(2001Grossed!R1C1:R46C51, RC1, 2), R1C), RC4, NA()) -> #REF! | H100: =IF(EQUAL(INDEX(2001Grossed!R1C1:R46C51, RC1, 2), R1C), RC4, NA()) -> #REF! | I100: =IF(EQUAL(INDEX(2001Grossed!R1C1:R46C51, RC1, 2), R1C), RC4, NA()) -> #REF! | J100: =IF(EQUAL(INDEX(2001Grossed!R1C1:R46C51, RC1, 2), R1C), RC4, NA()) -> #REF! | K100: =IF(OR(AND(NOT(ISERROR(RC7)), ISNUMBER(RC7)), AND(NOT(ISERROR(RC8)), ISNUMBER(RC8)), AND(NOT(ISERROR(RC9)), ISNUMBER(RC9)), AND(NOT(ISERROR(RC10)), ISNUMBER(RC10))), 1, 0) -> 0 | M100: =INDEX(Gross!R1C1:R46C51, RC1, 26) -> #REF! | N100: =INDEX(Gross!R1C1:R46C51, RC1, 27) -> #REF!
A101: 85 | B101: =INDEX(2001Grossed!R1C1:R46C51, RC[-1], 26) -> #REF! | C101: =INDEX(2001Grossed!R1C1:R46C51, RC1, 27) -> #REF! | D101: =IF(Menus!R9C10, RC[-1]/RC[-2], RC[-1]) -> #REF! | E101: =IF(RC11=1, RC[-3], NA()) -> #NA | F101: =INDEX(2001Grossed!R1C1:R46C51, RC1, 1) -> #REF! | G101: =IF(EQUAL(INDEX(2001Grossed!R1C1:R46C51, RC1, 2), R1C), RC4, NA()) -> #REF! | H101: =IF(EQUAL(INDEX(2001Grossed!R1C1:R46C51, RC1, 2), R1C), RC4, NA()) -> #REF! | I101: =IF(EQUAL(INDEX(2001Grossed!R1C1:R46C51, RC1, 2), R1C), RC4, NA()) -> #REF! | J101: =IF(EQUAL(INDEX(2001Grossed!R1C1:R46C51, RC1, 2), R1C), RC4, NA()) -> #REF! | K101: =IF(OR(AND(NOT(ISERROR(RC7)), ISNUMBER(RC7)), AND(NOT(ISERROR(RC8)), ISNUMBER(RC8)), AND(NOT(ISERROR(RC9)), ISNUMBER(RC9)), AND(NOT(ISERROR(RC10)), ISNUMBER(RC10))), 1, 0) -> 0 | M101: =INDEX(Gross!R1C1:R46C51, RC1, 26) -> #REF! | N101: =INDEX(Gross!R1C1:R46C51, RC1, 27) -> #REF!
A102: 63 | B102: =INDEX(2001Grossed!R1C1:R46C51, RC[-1], 26) -> #REF! | C102: =INDEX(2001Grossed!R1C1:R46C51, RC1, 27) -> #REF! | D102: =IF(Menus!R9C10, RC[-1]/RC[-2], RC[-1]) -> #REF! | E102: =IF(RC11=1, RC[-3], NA()) -> #NA | F102: =INDEX(2001Grossed!R1C1:R46C51, RC1, 1) -> #REF! | G102: =IF(EQUAL(INDEX(2001Grossed!R1C1:R46C51, RC1, 2), R1C), RC4, NA()) -> #REF! | H102: =IF(EQUAL(INDEX(2001Grossed!R1C1:R46C51, RC1, 2), R1C), RC4, NA()) -> #REF! | I102: =IF(EQUAL(INDEX(2001Grossed!R1C1:R46C51, RC1, 2), R1C), RC4, NA()) -> #REF! | J102: =IF(EQUAL(INDEX(2001Grossed!R1C1:R46C51, RC1, 2), R1C), RC4, NA()) -> #REF! | K102: =IF(OR(AND(NOT(ISERROR(RC7)), ISNUMBER(RC7)), AND(NOT(ISERROR(RC8)), ISNUMBER(RC8)), AND(NOT(ISERROR(RC9)), ISNUMBER(RC9)), AND(NOT(ISERROR(RC10)), ISNUMBER(RC10))), 1, 0) -> 0 | M102: =INDEX(Gross!R1C1:R46C51, RC1, 26) -> #REF! | N102: =INDEX(Gross!R1C1:R46C51, RC1, 27) -> #REF!
A103: 80 | B103: =INDEX(2001Grossed!R1C1:R46C51, RC[-1], 26) -> #REF! | C103: =INDEX(2001Grossed!R1C1:R46C51, RC1, 27) -> #REF! | D103: =IF(Menus!R9C10, RC[-1]/RC[-2], RC[-1]) -> #REF! | E103: =IF(RC11=1, RC[-3], NA()) -> #NA | F103: =INDEX(2001Grossed!R1C1:R46C51, RC1, 1) -> #REF! | G103: =IF(EQUAL(INDEX(2001Grossed!R1C1:R46C51, RC1, 2), R1C), RC4, NA()) -> #REF! | H103: =IF(EQUAL(INDEX(2001Grossed!R1C1:R46C51, RC1, 2), R1C), RC4, NA()) -> #REF! | I103: =IF(EQUAL(INDEX(2001Grossed!R1C1:R46C51, RC1, 2), R1C), RC4, NA()) -> #REF! | J103: =IF(EQUAL(INDEX(2001Grossed!R1C1:R46C51, RC1, 2), R1C), RC4, NA()) -> #REF! | K103: =IF(OR(AND(NOT(ISERROR(RC7)), ISNUMBER(RC7)), AND(NOT(ISERROR(RC8)), ISNUMBER(RC8)), AND(NOT(ISERROR(RC9)), ISNUMBER(RC9)), AND(NOT(ISERROR(RC10)), ISNUMBER(RC10))), 1, 0) -> 0 | M103: =INDEX(Gross!R1C1:R46C51, RC1, 26) -> #REF! | N103: =INDEX(Gross!R1C1:R46C51, RC1, 27) -> #REF!
A104: 50 | B104: =INDEX(2001Grossed!R1C1:R46C51, RC[-1], 26) -> #REF! | C104: =INDEX(2001Grossed!R1C1:R46C51, RC1, 27) -> #REF! | D104: =IF(Menus!R9C10, RC[-1]/RC[-2], RC[-1]) -> #REF! | E104: =IF(RC11=1, RC[-3], NA()) -> #NA | F104: =INDEX(2001Grossed!R1C1:R46C51, RC1, 1) -> #REF! | G104: =IF(EQUAL(INDEX(2001Grossed!R1C1:R46C51, RC1, 2), R1C), RC4, NA()) -> #REF! | H104: =IF(EQUAL(INDEX(2001Grossed!R1C1:R46C51, RC1, 2), R1C), RC4, NA()) -> #REF! | I104: =IF(EQUAL(INDEX(2001Grossed!R1C1:R46C51, RC1, 2), R1C), RC4, NA()) -> #REF! | J104: =IF(EQUAL(INDEX(2001Grossed!R1C1:R46C51, RC1, 2), R1C), RC4, NA()) -> #REF! | K104: =IF(OR(AND(NOT(ISERROR(RC7)), ISNUMBER(RC7)), AND(NOT(ISERROR(RC8)), ISNUMBER(RC8)), AND(NOT(ISERROR(RC9)), ISNUMBER(RC9)), AND(NOT(ISERROR(RC10)), ISNUMBER(RC10))), 1, 0) -> 0 | M104: =INDEX(Gross!R1C1:R46C51, RC1, 26) -> #REF! | N104: =INDEX(Gross!R1C1:R46C51, RC1, 27) -> #REF!
A105: 120 | B105: =INDEX(2001Grossed!R1C1:R46C51, RC[-1], 26) -> #REF! | C105: =INDEX(2001Grossed!R1C1:R46C51, RC1, 27) -> #REF! | D105: =IF(Menus!R9C10, RC[-1]/RC[-2], RC[-1]) -> #REF! | E105: =IF(RC11=1, RC[-3], NA()) -> #NA | F105: =INDEX(2001Grossed!R1C1:R46C51, RC1, 1) -> #REF! | G105: =IF(EQUAL(INDEX(2001Grossed!R1C1:R46C51, RC1, 2), R1C), RC4, NA()) -> #REF! | H105: =IF(EQUAL(INDEX(2001Grossed!R1C1:R46C51, RC1, 2), R1C), RC4, NA()) -> #REF! | I105: =IF(EQUAL(INDEX(2001Grossed!R1C1:R46C51, RC1, 2), R1C), RC4, NA()) -> #REF! | J105: =IF(EQUAL(INDEX(2001Grossed!R1C1:R46C51, RC1, 2), R1C), RC4, NA()) -> #REF! | K105: =IF(OR(AND(NOT(ISERROR(RC7)), ISNUMBER(RC7)), AND(NOT(ISERROR(RC8)), ISNUMBER(RC8)), AND(NOT(ISERROR(RC9)), ISNUMBER(RC9)), AND(NOT(ISERROR(RC10)), ISNUMBER(RC10))), 1, 0) -> 0 | M105: =INDEX(Gross!R1C1:R46C51, RC1, 26) -> #REF! | N105: =INDEX(Gross!R1C1:R46C51, RC1, 27) -> #REF!
A106: 149 | B106: =INDEX(2001Grossed!R1C1:R46C51, RC[-1], 26) -> #REF! | C106: =INDEX(2001Grossed!R1C1:R46C51, RC1, 27) -> #REF! | D106: =IF(Menus!R9C10, RC[-1]/RC[-2], RC[-1]) -> #REF! | E106: =IF(RC11=1, RC[-3], NA()) -> #NA | F106: =INDEX(2001Grossed!R1C1:R46C51, RC1, 1) -> #REF! | G106: =IF(EQUAL(INDEX(2001Grossed!R1C1:R46C51, RC1, 2), R1C), RC4, NA()) -> #REF! | H106: =IF(EQUAL(INDEX(2001Grossed!R1C1:R46C51, RC1, 2), R1C), RC4, NA()) -> #REF! | I106: =IF(EQUAL(INDEX(2001Grossed!R1C1:R46C51, RC1, 2), R1C), RC4, NA()) -> #REF! | J106: =IF(EQUAL(INDEX(2001Grossed!R1C1:R46C51, RC1, 2), R1C), RC4, NA()) -> #REF! | K106: =IF(OR(AND(NOT(ISERROR(RC7)), ISNUMBER(RC7)), AND(NOT(ISERROR(RC8)), ISNUMBER(RC8)), AND(NOT(ISERROR(RC9)), ISNUMBER(RC9)), AND(NOT(ISERROR(RC10)), ISNUMBER(RC10))), 1, 0) -> 0 | M106: =INDEX(Gross!R1C1:R46C51, RC1, 26) -> #REF! | N106: =INDEX(Gross!R1C1:R46C51, RC1, 27) -> #REF!
A107: 197 | B107: =INDEX(2001Grossed!R1C1:R46C51, RC[-1], 26) -> #REF! | C107: =INDEX(2001Grossed!R1C1:R46C51, RC1, 27) -> #REF! | D107: =IF(Menus!R9C10, RC[-1]/RC[-2], RC[-1]) -> #REF! | E107: =IF(RC11=1, RC[-3], NA()) -> #NA | F107: =INDEX(2001Grossed!R1C1:R46C51, RC1, 1) -> #REF! | G107: =IF(EQUAL(INDEX(2001Grossed!R1C1:R46C51, RC1, 2), R1C), RC4, NA()) -> #REF! | H107: =IF(EQUAL(INDEX(2001Grossed!R1C1:R46C51, RC1, 2), R1C), RC4, NA()) -> #REF! | I107: =IF(EQUAL(INDEX(2001Grossed!R1C1:R46C51, RC1, 2), R1C), RC4, NA()) -> #REF! | J107: =IF(EQUAL(INDEX(2001Grossed!R1C1:R46C51, RC1, 2), R1C), RC4, NA()) -> #REF! | K107: =IF(OR(AND(NOT(ISERROR(RC7)), ISNUMBER(RC7)), AND(NOT(ISERROR(RC8)), ISNUMBER(RC8)), AND(NOT(ISERROR(RC9)), ISNUMBER(RC9)), AND(NOT(ISERROR(RC10)), ISNUMBER(RC10))), 1, 0) -> 0 | M107: =INDEX(Gross!R1C1:R46C51, RC1, 26) -> #REF! | N107: =INDEX(Gross!R1C1:R46C51, RC1, 27) -> #REF!
A108: 104 | B108: =INDEX(2001Grossed!R1C1:R46C51, RC[-1], 26) -> #REF! | C108: =INDEX(2001Grossed!R1C1:R46C51, RC1, 27) -> #REF! | D108: =IF(Menus!R9C10, RC[-1]/RC[-2], RC[-1]) -> #REF! | E108: =IF(RC11=1, RC[-3], NA()) -> #NA | F108: =INDEX(2001Grossed!R1C1:R46C51, RC1, 1) -> #REF! | G108: =IF(EQUAL(INDEX(2001Grossed!R1C1:R46C51, RC1, 2), R1C), RC4, NA()) -> #REF! | H108: =IF(EQUAL(INDEX(2001Grossed!R1C1:R46C51, RC1, 2), R1C), RC4, NA()) -> #REF! | I108: =IF(EQUAL(INDEX(2001Grossed!R1C1:R46C51, RC1, 2), R1C), RC4, NA()) -> #REF! | J108: =IF(EQUAL(INDEX(2001Grossed!R1C1:R46C51, RC1, 2), R1C), RC4, NA()) -> #REF! | K108: =IF(OR(AND(NOT(ISERROR(RC7)), ISNUMBER(RC7)), AND(NOT(ISERROR(RC8)), ISNUMBER(RC8)), AND(NOT(ISERROR(RC9)), ISNUMBER(RC9)), AND(NOT(ISERROR(RC10)), ISNUMBER(RC10))), 1, 0) -> 0 | M108: =INDEX(Gross!R1C1:R46C51, RC1, 26) -> #REF! | N108: =INDEX(Gross!R1C1:R46C51, RC1, 27) -> #REF!
A109: 165 | B109: =INDEX(2001Grossed!R1C1:R46C51, RC[-1], 26) -> #REF! | C109: =INDEX(2001Grossed!R1C1:R46C51, RC1, 27) -> #REF! | D109: =IF(Menus!R9C10, RC[-1]/RC[-2], RC[-1]) -> #REF! | E109: =IF(RC11=1, RC[-3], NA()) -> #NA | F109: =INDEX(2001Grossed!R1C1:R46C51, RC1, 1) -> #REF! | G109: =IF(EQUAL(INDEX(2001Grossed!R1C1:R46C51, RC1, 2), R1C), RC4, NA()) -> #REF! | H109: =IF(EQUAL(INDEX(2001Grossed!R1C1:R46C51, RC1, 2), R1C), RC4, NA()) -> #REF! | I109: =IF(EQUAL(INDEX(2001Grossed!R1C1:R46C51, RC1, 2), R1C), RC4, NA()) -> #REF! | J109: =IF(EQUAL(INDEX(2001Grossed!R1C1:R46C51, RC1, 2), R1C), RC4, NA()) -> #REF! | K109: =IF(OR(AND(NOT(ISERROR(RC7)), ISNUMBER(RC7)), AND(NOT(ISERROR(RC8)), ISNUMBER(RC8)), AND(NOT(ISERROR(RC9)), ISNUMBER(RC9)), AND(NOT(ISERROR(RC10)), ISNUMBER(RC10))), 1, 0) -> 0 | M109: =INDEX(Gross!R1C1:R46C51, RC1, 26) -> #REF! | N109: =INDEX(Gross!R1C1:R46C51, RC1, 27) -> #REF!
A110: 189 | B110: =INDEX(2001Grossed!R1C1:R46C51, RC[-1], 26) -> #REF! | C110: =INDEX(2001Grossed!R1C1:R46C51, RC1, 27) -> #REF! | D110: =IF(Menus!R9C10, RC[-1]/RC[-2], RC[-1]) -> #REF! | E110: =IF(RC11=1, RC[-3], NA()) -> #NA | F110: =INDEX(2001Grossed!R1C1:R46C51, RC1, 1) -> #REF! | G110: =IF(EQUAL(INDEX(2001Grossed!R1C1:R46C51, RC1, 2), R1C), RC4, NA()) -> #REF! | H110: =IF(EQUAL(INDEX(2001Grossed!R1C1:R46C51, RC1, 2), R1C), RC4, NA()) -> #REF! | I110: =IF(EQUAL(INDEX(2001Grossed!R1C1:R46C51, RC1, 2), R1C), RC4, NA()) -> #REF! | J110: =IF(EQUAL(INDEX(2001Grossed!R1C1:R46C51, RC1, 2), R1C), RC4, NA()) -> #REF! | K110: =IF(OR(AND(NOT(ISERROR(RC7)), ISNUMBER(RC7)), AND(NOT(ISERROR(RC8)), ISNUMBER(RC8)), AND(NOT(ISERROR(RC9)), ISNUMBER(RC9)), AND(NOT(ISERROR(RC10)), ISNUMBER(RC10))), 1, 0) -> 0 | M110: =INDEX(Gross!R1C1:R46C51, RC1, 26) -> #REF! | N110: =INDEX(Gross!R1C1:R46C51, RC1, 27) -> #REF!
A111: 175 | B111: =INDEX(2001Grossed!R1C1:R46C51, RC[-1], 26) -> #REF! | C111: =INDEX(2001Grossed!R1C1:R46C51, RC1, 27) -> #REF! | D111: =IF(Menus!R9C10, RC[-1]/RC[-2], RC[-1]) -> #REF! | E111: =IF(RC11=1, RC[-3], NA()) -> #NA | F111: =INDEX(2001Grossed!R1C1:R46C51, RC1, 1) -> #REF! | G111: =IF(EQUAL(INDEX(2001Grossed!R1C1:R46C51, RC1, 2), R1C), RC4, NA()) -> #REF! | H111: =IF(EQUAL(INDEX(2001Grossed!R1C1:R46C51, RC1, 2), R1C), RC4, NA()) -> #REF! | I111: =IF(EQUAL(INDEX(2001Grossed!R1C1:R46C51, RC1, 2), R1C), RC4, NA()) -> #REF! | J111: =IF(EQUAL(INDEX(2001Grossed!R1C1:R46C51, RC1, 2), R1C), RC4, NA()) -> #REF! | K111: =IF(OR(AND(NOT(ISERROR(RC7)), ISNUMBER(RC7)), AND(NOT(ISERROR(RC8)), ISNUMBER(RC8)), AND(NOT(ISERROR(RC9)), ISNUMBER(RC9)), AND(NOT(ISERROR(RC10)), ISNUMBER(RC10))), 1, 0) -> 0 | M111: =INDEX(Gross!R1C1:R46C51, RC1, 26) -> #REF! | N111: =INDEX(Gross!R1C1:R46C51, RC1, 27) -> #REF!
A112: 66 | B112: =INDEX(2001Grossed!R1C1:R46C51, RC[-1], 26) -> #REF! | C112: =INDEX(2001Grossed!R1C1:R46C51, RC1, 27) -> #REF! | D112: =IF(Menus!R9C10, RC[-1]/RC[-2], RC[-1]) -> #REF! | E112: =IF(RC11=1, RC[-3], NA()) -> #NA | F112: =INDEX(2001Grossed!R1C1:R46C51, RC1, 1) -> #REF! | G112: =IF(EQUAL(INDEX(2001Grossed!R1C1:R46C51, RC1, 2), R1C), RC4, NA()) -> #REF! | H112: =IF(EQUAL(INDEX(2001Grossed!R1C1:R46C51, RC1, 2), R1C), RC4, NA()) -> #REF! | I112: =IF(EQUAL(INDEX(2001Grossed!R1C1:R46C51, RC1, 2), R1C), RC4, NA()) -> #REF! | J112: =IF(EQUAL(INDEX(2001Grossed!R1C1:R46C51, RC1, 2), R1C), RC4, NA()) -> #REF! | K112: =IF(OR(AND(NOT(ISERROR(RC7)), ISNUMBER(RC7)), AND(NOT(ISERROR(RC8)), ISNUMBER(RC8)), AND(NOT(ISERROR(RC9)), ISNUMBER(RC9)), AND(NOT(ISERROR(RC10)), ISNUMBER(RC10))), 1, 0) -> 0 | M112: =INDEX(Gross!R1C1:R46C51, RC1, 26) -> #REF! | N112: =INDEX(Gross!R1C1:R46C51, RC1, 27) -> #REF!
A113: 89 | B113: =INDEX(2001Grossed!R1C1:R46C51, RC[-1], 26) -> #REF! | C113: =INDEX(2001Grossed!R1C1:R46C51, RC1, 27) -> #REF! | D113: =IF(Menus!R9C10, RC[-1]/RC[-2], RC[-1]) -> #REF! | E113: =IF(RC11=1, RC[-3], NA()) -> #NA | F113: =INDEX(2001Grossed!R1C1:R46C51, RC1, 1) -> #REF! | G113: =IF(EQUAL(INDEX(2001Grossed!R1C1:R46C51, RC1, 2), R1C), RC4, NA()) -> #REF! | H113: =IF(EQUAL(INDEX(2001Grossed!R1C1:R46C51, RC1, 2), R1C), RC4, NA()) -> #REF! | I113: =IF(EQUAL(INDEX(2001Grossed!R1C1:R46C51, RC1, 2), R1C), RC4, NA()) -> #REF! | J113: =IF(EQUAL(INDEX(2001Grossed!R1C1:R46C51, RC1, 2), R1C), RC4, NA()) -> #REF! | K113: =IF(OR(AND(NOT(ISERROR(RC7)), ISNUMBER(RC7)), AND(NOT(ISERROR(RC8)), ISNUMBER(RC8)), AND(NOT(ISERROR(RC9)), ISNUMBER(RC9)), AND(NOT(ISERROR(RC10)), ISNUMBER(RC10))), 1, 0) -> 0 | M113: =INDEX(Gross!R1C1:R46C51, RC1, 26) -> #REF! | N113: =INDEX(Gross!R1C1:R46C51, RC1, 27) -> #REF!
A114: 92 | B114: =INDEX(2001Grossed!R1C1:R46C51, RC[-1], 26) -> #REF! | C114: =INDEX(2001Grossed!R1C1:R46C51, RC1, 27) -> #REF! | D114: =IF(Menus!R9C10, RC[-1]/RC[-2], RC[-1]) -> #REF! | E114: =IF(RC11=1, RC[-3], NA()) -> #NA | F114: =INDEX(2001Grossed!R1C1:R46C51, RC1, 1) -> #REF! | G114: =IF(EQUAL(INDEX(2001Grossed!R1C1:R46C51, RC1, 2), R1C), RC4, NA()) -> #REF! | H114: =IF(EQUAL(INDEX(2001Grossed!R1C1:R46C51, RC1, 2), R1C), RC4, NA()) -> #REF! | I114: =IF(EQUAL(INDEX(2001Grossed!R1C1:R46C51, RC1, 2), R1C), RC4, NA()) -> #REF! | J114: =IF(EQUAL(INDEX(2001Grossed!R1C1:R46C51, RC1, 2), R1C), RC4, NA()) -> #REF! | K114: =IF(OR(AND(NOT(ISERROR(RC7)), ISNUMBER(RC7)), AND(NOT(ISERROR(RC8)), ISNUMBER(RC8)), AND(NOT(ISERROR(RC9)), ISNUMBER(RC9)), AND(NOT(ISERROR(RC10)), ISNUMBER(RC10))), 1, 0) -> 0 | M114: =INDEX(Gross!R1C1:R46C51, RC1, 26) -> #REF! | N114: =INDEX(Gross!R1C1:R46C51, RC1, 27) -> #REF!
A115: 177 | B115: =INDEX(2001Grossed!R1C1:R46C51, RC[-1], 26) -> #REF! | C115: =INDEX(2001Grossed!R1C1:R46C51, RC1, 27) -> #REF! | D115: =IF(Menus!R9C10, RC[-1]/RC[-2], RC[-1]) -> #REF! | E115: =IF(RC11=1, RC[-3], NA()) -> #NA | F115: =INDEX(2001Grossed!R1C1:R46C51, RC1, 1) -> #REF! | G115: =IF(EQUAL(INDEX(2001Grossed!R1C1:R46C51, RC1, 2), R1C), RC4, NA()) -> #REF! | H115: =IF(EQUAL(INDEX(2001Grossed!R1C1:R46C51, RC1, 2), R1C), RC4, NA()) -> #REF! | I115: =IF(EQUAL(INDEX(2001Grossed!R1C1:R46C51, RC1, 2), R1C), RC4, NA()) -> #REF! | J115: =IF(EQUAL(INDEX(2001Grossed!R1C1:R46C51, RC1, 2), R1C), RC4, NA()) -> #REF! | K115: =IF(OR(AND(NOT(ISERROR(RC7)), ISNUMBER(RC7)), AND(NOT(ISERROR(RC8)), ISNUMBER(RC8)), AND(NOT(ISERROR(RC9)), ISNUMBER(RC9)), AND(NOT(ISERROR(RC10)), ISNUMBER(RC10))), 1, 0) -> 0 | M115: =INDEX(Gross!R1C1:R46C51, RC1, 26) -> #REF! | N115: =INDEX(Gross!R1C1:R46C51, RC1, 27) -> #REF!
A116: 169 | B116: =INDEX(2001Grossed!R1C1:R46C51, RC[-1], 26) -> #REF! | C116: =INDEX(2001Grossed!R1C1:R46C51, RC1, 27) -> #REF! | D116: =IF(Menus!R9C10, RC[-1]/RC[-2], RC[-1]) -> #REF! | E116: =IF(RC11=1, RC[-3], NA()) -> #NA | F116: =INDEX(2001Grossed!R1C1:R46C51, RC1, 1) -> #REF! | G116: =IF(EQUAL(INDEX(2001Grossed!R1C1:R46C51, RC1, 2), R1C), RC4, NA()) -> #REF! | H116: =IF(EQUAL(INDEX(2001Grossed!R1C1:R46C51, RC1, 2), R1C), RC4, NA()) -> #REF! | I116: =IF(EQUAL(INDEX(2001Grossed!R1C1:R46C51, RC1, 2), R1C), RC4, NA()) -> #REF! | J116: =IF(EQUAL(INDEX(2001Grossed!R1C1:R46C51, RC1, 2), R1C), RC4, NA()) -> #REF! | K116: =IF(OR(AND(NOT(ISERROR(RC7)), ISNUMBER(RC7)), AND(NOT(ISERROR(RC8)), ISNUMBER(RC8)), AND(NOT(ISERROR(RC9)), ISNUMBER(RC9)), AND(NOT(ISERROR(RC10)), ISNUMBER(RC10))), 1, 0) -> 0 | M116: =INDEX(Gross!R1C1:R46C51, RC1, 26) -> #REF! | N116: =INDEX(Gross!R1C1:R46C51, RC1, 27) -> #REF!
A117: 140 | B117: =INDEX(2001Grossed!R1C1:R46C51, RC[-1], 26) -> #REF! | C117: =INDEX(2001Grossed!R1C1:R46C51, RC1, 27) -> #REF! | D117: =IF(Menus!R9C10, RC[-1]/RC[-2], RC[-1]) -> #REF! | E117: =IF(RC11=1, RC[-3], NA()) -> #NA | F117: =INDEX(2001Grossed!R1C1:R46C51, RC1, 1) -> #REF! | G117: =IF(EQUAL(INDEX(2001Grossed!R1C1:R46C51, RC1, 2), R1C), RC4, NA()) -> #REF! | H117: =IF(EQUAL(INDEX(2001Grossed!R1C1:R46C51, RC1, 2), R1C), RC4, NA()) -> #REF! | I117: =IF(EQUAL(INDEX(2001Grossed!R1C1:R46C51, RC1, 2), R1C), RC4, NA()) -> #REF! | J117: =IF(EQUAL(INDEX(2001Grossed!R1C1:R46C51, RC1, 2), R1C), RC4, NA()) -> #REF! | K117: =IF(OR(AND(NOT(ISERROR(RC7)), ISNUMBER(RC7)), AND(NOT(ISERROR(RC8)), ISNUMBER(RC8)), AND(NOT(ISERROR(RC9)), ISNUMBER(RC9)), AND(NOT(ISERROR(RC10)), ISNUMBER(RC10))), 1, 0) -> 0 | M117: =INDEX(Gross!R1C1:R46C51, RC1, 26) -> #REF! | N117: =INDEX(Gross!R1C1:R46C51, RC1, 27) -> #REF!
A118: 166 | B118: =INDEX(2001Grossed!R1C1:R46C51, RC[-1], 26) -> #REF! | C118: =INDEX(2001Grossed!R1C1:R46C51, RC1, 27) -> #REF! | D118: =IF(Menus!R9C10, RC[-1]/RC[-2], RC[-1]) -> #REF! | E118: =IF(RC11=1, RC[-3], NA()) -> #NA | F118: =INDEX(2001Grossed!R1C1:R46C51, RC1, 1) -> #REF! | G118: =IF(EQUAL(INDEX(2001Grossed!R1C1:R46C51, RC1, 2), R1C), RC4, NA()) -> #REF! | H118: =IF(EQUAL(INDEX(2001Grossed!R1C1:R46C51, RC1, 2), R1C), RC4, NA()) -> #REF! | I118: =IF(EQUAL(INDEX(2001Grossed!R1C1:R46C51, RC1, 2), R1C), RC4, NA()) -> #REF! | J118: =IF(EQUAL(INDEX(2001Grossed!R1C1:R46C51, RC1, 2), R1C), RC4, NA()) -> #REF! | K118: =IF(OR(AND(NOT(ISERROR(RC7)), ISNUMBER(RC7)), AND(NOT(ISERROR(RC8)), ISNUMBER(RC8)), AND(NOT(ISERROR(RC9)), ISNUMBER(RC9)), AND(NOT(ISERROR(RC10)), ISNUMBER(RC10))), 1, 0) -> 0 | M118: =INDEX(Gross!R1C1:R46C51, RC1, 26) -> #REF! | N118: =INDEX(Gross!R1C1:R46C51, RC1, 27) -> #REF!
A119: 172 | B119: =INDEX(2001Grossed!R1C1:R46C51, RC[-1], 26) -> #REF! | C119: =INDEX(2001Grossed!R1C1:R46C51, RC1, 27) -> #REF! | D119: =IF(Menus!R9C10, RC[-1]/RC[-2], RC[-1]) -> #REF! | E119: =IF(RC11=1, RC[-3], NA()) -> #NA | F119: =INDEX(2001Grossed!R1C1:R46C51, RC1, 1) -> #REF! | G119: =IF(EQUAL(INDEX(2001Grossed!R1C1:R46C51, RC1, 2), R1C), RC4, NA()) -> #REF! | H119: =IF(EQUAL(INDEX(2001Grossed!R1C1:R46C51, RC1, 2), R1C), RC4, NA()) -> #REF! | I119: =IF(EQUAL(INDEX(2001Grossed!R1C1:R46C51, RC1, 2), R1C), RC4, NA()) -> #REF! | J119: =IF(EQUAL(INDEX(2001Grossed!R1C1:R46C51, RC1, 2), R1C), RC4, NA()) -> #REF! | K119: =IF(OR(AND(NOT(ISERROR(RC7)), ISNUMBER(RC7)), AND(NOT(ISERROR(RC8)), ISNUMBER(RC8)), AND(NOT(ISERROR(RC9)), ISNUMBER(RC9)), AND(NOT(ISERROR(RC10)), ISNUMBER(RC10))), 1, 0) -> 0 | M119: =INDEX(Gross!R1C1:R46C51, RC1, 26) -> #REF! | N119: =INDEX(Gross!R1C1:R46C51, RC1, 27) -> #REF!
A120: 110 | B120: =INDEX(2001Grossed!R1C1:R46C51, RC[-1], 26) -> #REF! | C120: =INDEX(2001Grossed!R1C1:R46C51, RC1, 27) -> #REF! | D120: =IF(Menus!R9C10, RC[-1]/RC[-2], RC[-1]) -> #REF! | E120: =IF(RC11=1, RC[-3], NA()) -> #NA | F120: =INDEX(2001Grossed!R1C1:R46C51, RC1, 1) -> #REF! | G120: =IF(EQUAL(INDEX(2001Grossed!R1C1:R46C51, RC1, 2), R1C), RC4, NA()) -> #REF! | H120: =IF(EQUAL(INDEX(2001Grossed!R1C1:R46C51, RC1, 2), R1C), RC4, NA()) -> #REF! | I120: =IF(EQUAL(INDEX(2001Grossed!R1C1:R46C51, RC1, 2), R1C), RC4, NA()) -> #REF! | J120: =IF(EQUAL(INDEX(2001Grossed!R1C1:R46C51, RC1, 2), R1C), RC4, NA()) -> #REF! | K120: =IF(OR(AND(NOT(ISERROR(RC7)), ISNUMBER(RC7)), AND(NOT(ISERROR(RC8)), ISNUMBER(RC8)), AND(NOT(ISERROR(RC9)), ISNUMBER(RC9)), AND(NOT(ISERROR(RC10)), ISNUMBER(RC10))), 1, 0) -> 0 | M120: =INDEX(Gross!R1C1:R46C51, RC1, 26) -> #REF! | N120: =INDEX(Gross!R1C1:R46C51, RC1, 27) -> #REF!
A121: 139 | B121: =INDEX(2001Grossed!R1C1:R46C51, RC[-1], 26) -> #REF! | C121: =INDEX(2001Grossed!R1C1:R46C51, RC1, 27) -> #REF! | D121: =IF(Menus!R9C10, RC[-1]/RC[-2], RC[-1]) -> #REF! | E121: =IF(RC11=1, RC[-3], NA()) -> #NA | F121: =INDEX(2001Grossed!R1C1:R46C51, RC1, 1) -> #REF! | G121: =IF(EQUAL(INDEX(2001Grossed!R1C1:R46C51, RC1, 2), R1C), RC4, NA()) -> #REF! | H121: =IF(EQUAL(INDEX(2001Grossed!R1C1:R46C51, RC1, 2), R1C), RC4, NA()) -> #REF! | I121: =IF(EQUAL(INDEX(2001Grossed!R1C1:R46C51, RC1, 2), R1C), RC4, NA()) -> #REF! | J121: =IF(EQUAL(INDEX(2001Grossed!R1C1:R46C51, RC1, 2), R1C), RC4, NA()) -> #REF! | K121: =IF(OR(AND(NOT(ISERROR(RC7)), ISNUMBER(RC7)), AND(NOT(ISERROR(RC8)), ISNUMBER(RC8)), AND(NOT(ISERROR(RC9)), ISNUMBER(RC9)), AND(NOT(ISERROR(RC10)), ISNUMBER(RC10))), 1, 0) -> 0 | M121: =INDEX(Gross!R1C1:R46C51, RC1, 26) -> #REF! | N121: =INDEX(Gross!R1C1:R46C51, RC1, 27) -> #REF!
A122: 156 | B122: =INDEX(2001Grossed!R1C1:R46C51, RC[-1], 26) -> #REF! | C122: =INDEX(2001Grossed!R1C1:R46C51, RC1, 27) -> #REF! | D122: =IF(Menus!R9C10, RC[-1]/RC[-2], RC[-1]) -> #REF! | E122: =IF(RC11=1, RC[-3], NA()) -> #NA | F122: =INDEX(2001Grossed!R1C1:R46C51, RC1, 1) -> #REF! | G122: =IF(EQUAL(INDEX(2001Grossed!R1C1:R46C51, RC1, 2), R1C), RC4, NA()) -> #REF! | H122: =IF(EQUAL(INDEX(2001Grossed!R1C1:R46C51, RC1, 2), R1C), RC4, NA()) -> #REF! | I122: =IF(EQUAL(INDEX(2001Grossed!R1C1:R46C51, RC1, 2), R1C), RC4, NA()) -> #REF! | J122: =IF(EQUAL(INDEX(2001Grossed!R1C1:R46C51, RC1, 2), R1C), RC4, NA()) -> #REF! | K122: =IF(OR(AND(NOT(ISERROR(RC7)), ISNUMBER(RC7)), AND(NOT(ISERROR(RC8)), ISNUMBER(RC8)), AND(NOT(ISERROR(RC9)), ISNUMBER(RC9)), AND(NOT(ISERROR(RC10)), ISNUMBER(RC10))), 1, 0) -> 0 | M122: =INDEX(Gross!R1C1:R46C51, RC1, 26) -> #REF! | N122: =INDEX(Gross!R1C1:R46C51, RC1, 27) -> #REF!
A123: 191 | B123: =INDEX(2001Grossed!R1C1:R46C51, RC[-1], 26) -> #REF! | C123: =INDEX(2001Grossed!R1C1:R46C51, RC1, 27) -> #REF! | D123: =IF(Menus!R9C10, RC[-1]/RC[-2], RC[-1]) -> #REF! | E123: =IF(RC11=1, RC[-3], NA()) -> #NA | F123: =INDEX(2001Grossed!R1C1:R46C51, RC1, 1) -> #REF! | G123: =IF(EQUAL(INDEX(2001Grossed!R1C1:R46C51, RC1, 2), R1C), RC4, NA()) -> #REF! | H123: =IF(EQUAL(INDEX(2001Grossed!R1C1:R46C51, RC1, 2), R1C), RC4, NA()) -> #REF! | I123: =IF(EQUAL(INDEX(2001Grossed!R1C1:R46C51, RC1, 2), R1C), RC4, NA()) -> #REF! | J123: =IF(EQUAL(INDEX(2001Grossed!R1C1:R46C51, RC1, 2), R1C), RC4, NA()) -> #REF! | K123: =IF(OR(AND(NOT(ISERROR(RC7)), ISNUMBER(RC7)), AND(NOT(ISERROR(RC8)), ISNUMBER(RC8)), AND(NOT(ISERROR(RC9)), ISNUMBER(RC9)), AND(NOT(ISERROR(RC10)), ISNUMBER(RC10))), 1, 0) -> 0 | M123: =INDEX(Gross!R1C1:R46C51, RC1, 26) -> #REF! | N123: =INDEX(Gross!R1C1:R46C51, RC1, 27) -> #REF!
A124: 192 | B124: =INDEX(2001Grossed!R1C1:R46C51, RC[-1], 26) -> #REF! | C124: =INDEX(2001Grossed!R1C1:R46C51, RC1, 27) -> #REF! | D124: =IF(Menus!R9C10, RC[-1]/RC[-2], RC[-1]) -> #REF! | E124: =IF(RC11=1, RC[-3], NA()) -> #NA | F124: =INDEX(2001Grossed!R1C1:R46C51, RC1, 1) -> #REF! | G124: =IF(EQUAL(INDEX(2001Grossed!R1C1:R46C51, RC1, 2), R1C), RC4, NA()) -> #REF! | H124: =IF(EQUAL(INDEX(2001Grossed!R1C1:R46C51, RC1, 2), R1C), RC4, NA()) -> #REF! | I124: =IF(EQUAL(INDEX(2001Grossed!R1C1:R46C51, RC1, 2), R1C), RC4, NA()) -> #REF! | J124: =IF(EQUAL(INDEX(2001Grossed!R1C1:R46C51, RC1, 2), R1C), RC4, NA()) -> #REF! | K124: =IF(OR(AND(NOT(ISERROR(RC7)), ISNUMBER(RC7)), AND(NOT(ISERROR(RC8)), ISNUMBER(RC8)), AND(NOT(ISERROR(RC9)), ISNUMBER(RC9)), AND(NOT(ISERROR(RC10)), ISNUMBER(RC10))), 1, 0) -> 0 | M124: =INDEX(Gross!R1C1:R46C51, RC1, 26) -> #REF! | N124: =INDEX(Gross!R1C1:R46C51, RC1, 27) -> #REF!
A125: 137 | B125: =INDEX(2001Grossed!R1C1:R46C51, RC[-1], 26) -> #REF! | C125: =INDEX(2001Grossed!R1C1:R46C51, RC1, 27) -> #REF! | D125: =IF(Menus!R9C10, RC[-1]/RC[-2], RC[-1]) -> #REF! | E125: =IF(RC11=1, RC[-3], NA()) -> #NA | F125: =INDEX(2001Grossed!R1C1:R46C51, RC1, 1) -> #REF! | G125: =IF(EQUAL(INDEX(2001Grossed!R1C1:R46C51, RC1, 2), R1C), RC4, NA()) -> #REF! | H125: =IF(EQUAL(INDEX(2001Grossed!R1C1:R46C51, RC1, 2), R1C), RC4, NA()) -> #REF! | I125: =IF(EQUAL(INDEX(2001Grossed!R1C1:R46C51, RC1, 2), R1C), RC4, NA()) -> #REF! | J125: =IF(EQUAL(INDEX(2001Grossed!R1C1:R46C51, RC1, 2), R1C), RC4, NA()) -> #REF! | K125: =IF(OR(AND(NOT(ISERROR(RC7)), ISNUMBER(RC7)), AND(NOT(ISERROR(RC8)), ISNUMBER(RC8)), AND(NOT(ISERROR(RC9)), ISNUMBER(RC9)), AND(NOT(ISERROR(RC10)), ISNUMBER(RC10))), 1, 0) -> 0 | M125: =INDEX(Gross!R1C1:R46C51, RC1, 26) -> #REF! | N125: =INDEX(Gross!R1C1:R46C51, RC1, 27) -> #REF!
A126: 83 | B126: =INDEX(2001Grossed!R1C1:R46C51, RC[-1], 26) -> #REF! | C126: =INDEX(2001Grossed!R1C1:R46C51, RC1, 27) -> #REF! | D126: =IF(Menus!R9C10, RC[-1]/RC[-2], RC[-1]) -> #REF! | E126: =IF(RC11=1, RC[-3], NA()) -> #NA | F126: =INDEX(2001Grossed!R1C1:R46C51, RC1, 1) -> #REF! | G126: =IF(EQUAL(INDEX(2001Grossed!R1C1:R46C51, RC1, 2), R1C), RC4, NA()) -> #REF! | H126: =IF(EQUAL(INDEX(2001Grossed!R1C1:R46C51, RC1, 2), R1C), RC4, NA()) -> #REF! | I126: =IF(EQUAL(INDEX(2001Grossed!R1C1:R46C51, RC1, 2), R1C), RC4, NA()) -> #REF! | J126: =IF(EQUAL(INDEX(2001Grossed!R1C1:R46C51, RC1, 2), R1C), RC4, NA()) -> #REF! | K126: =IF(OR(AND(NOT(ISERROR(RC7)), ISNUMBER(RC7)), AND(NOT(ISERROR(RC8)), ISNUMBER(RC8)), AND(NOT(ISERROR(RC9)), ISNUMBER(RC9)), AND(NOT(ISERROR(RC10)), ISNUMBER(RC10))), 1, 0) -> 0 | M126: =INDEX(Gross!R1C1:R46C51, RC1, 26) -> #REF! | N126: =INDEX(Gross!R1C1:R46C51, RC1, 27) -> #REF!
A127: 76 | B127: =INDEX(2001Grossed!R1C1:R46C51, RC[-1], 26) -> #REF! | C127: =INDEX(2001Grossed!R1C1:R46C51, RC1, 27) -> #REF! | D127: =IF(Menus!R9C10, RC[-1]/RC[-2], RC[-1]) -> #REF! | E127: =IF(RC11=1, RC[-3], NA()) -> #NA | F127: =INDEX(2001Grossed!R1C1:R46C51, RC1, 1) -> #REF! | G127: =IF(EQUAL(INDEX(2001Grossed!R1C1:R46C51, RC1, 2), R1C), RC4, NA()) -> #REF! | H127: =IF(EQUAL(INDEX(2001Grossed!R1C1:R46C51, RC1, 2), R1C), RC4, NA()) -> #REF! | I127: =IF(EQUAL(INDEX(2001Grossed!R1C1:R46C51, RC1, 2), R1C), RC4, NA()) -> #REF! | J127: =IF(EQUAL(INDEX(2001Grossed!R1C1:R46C51, RC1, 2), R1C), RC4, NA()) -> #REF! | K127: =IF(OR(AND(NOT(ISERROR(RC7)), ISNUMBER(RC7)), AND(NOT(ISERROR(RC8)), ISNUMBER(RC8)), AND(NOT(ISERROR(RC9)), ISNUMBER(RC9)), AND(NOT(ISERROR(RC10)), ISNUMBER(RC10))), 1, 0) -> 0 | M127: =INDEX(Gross!R1C1:R46C51, RC1, 26) -> #REF! | N127: =INDEX(Gross!R1C1:R46C51, RC1, 27) -> #REF!
A128: 61 | B128: =INDEX(2001Grossed!R1C1:R46C51, RC[-1], 26) -> #REF! | C128: =INDEX(2001Grossed!R1C1:R46C51, RC1, 27) -> #REF! | D128: =IF(Menus!R9C10, RC[-1]/RC[-2], RC[-1]) -> #REF! | E128: =IF(RC11=1, RC[-3], NA()) -> #NA | F128: =INDEX(2001Grossed!R1C1:R46C51, RC1, 1) -> #REF! | G128: =IF(EQUAL(INDEX(2001Grossed!R1C1:R46C51, RC1, 2), R1C), RC4, NA()) -> #REF! | H128: =IF(EQUAL(INDEX(2001Grossed!R1C1:R46C51, RC1, 2), R1C), RC4, NA()) -> #REF! | I128: =IF(EQUAL(INDEX(2001Grossed!R1C1:R46C51, RC1, 2), R1C), RC4, NA()) -> #REF! | J128: =IF(EQUAL(INDEX(2001Grossed!R1C1:R46C51, RC1, 2), R1C), RC4, NA()) -> #REF! | K128: =IF(OR(AND(NOT(ISERROR(RC7)), ISNUMBER(RC7)), AND(NOT(ISERROR(RC8)), ISNUMBER(RC8)), AND(NOT(ISERROR(RC9)), ISNUMBER(RC9)), AND(NOT(ISERROR(RC10)), ISNUMBER(RC10))), 1, 0) -> 0 | M128: =INDEX(Gross!R1C1:R46C51, RC1, 26) -> #REF! | N128: =INDEX(Gross!R1C1:R46C51, RC1, 27) -> #REF!
A129: 152 | B129: =INDEX(2001Grossed!R1C1:R46C51, RC[-1], 26) -> #REF! | C129: =INDEX(2001Grossed!R1C1:R46C51, RC1, 27) -> #REF! | D129: =IF(Menus!R9C10, RC[-1]/RC[-2], RC[-1]) -> #REF! | E129: =IF(RC11=1, RC[-3], NA()) -> #NA | F129: =INDEX(2001Grossed!R1C1:R46C51, RC1, 1) -> #REF! | G129: =IF(EQUAL(INDEX(2001Grossed!R1C1:R46C51, RC1, 2), R1C), RC4, NA()) -> #REF! | H129: =IF(EQUAL(INDEX(2001Grossed!R1C1:R46C51, RC1, 2), R1C), RC4, NA()) -> #REF! | I129: =IF(EQUAL(INDEX(2001Grossed!R1C1:R46C51, RC1, 2), R1C), RC4, NA()) -> #REF! | J129: =IF(EQUAL(INDEX(2001Grossed!R1C1:R46C51, RC1, 2), R1C), RC4, NA()) -> #REF! | K129: =IF(OR(AND(NOT(ISERROR(RC7)), ISNUMBER(RC7)), AND(NOT(ISERROR(RC8)), ISNUMBER(RC8)), AND(NOT(ISERROR(RC9)), ISNUMBER(RC9)), AND(NOT(ISERROR(RC10)), ISNUMBER(RC10))), 1, 0) -> 0 | M129: =INDEX(Gross!R1C1:R46C51, RC1, 26) -> #REF! | N129: =INDEX(Gross!R1C1:R46C51, RC1, 27) -> #REF!
A130: 78 | B130: =INDEX(2001Grossed!R1C1:R46C51, RC[-1], 26) -> #REF! | C130: =INDEX(2001Grossed!R1C1:R46C51, RC1, 27) -> #REF! | D130: =IF(Menus!R9C10, RC[-1]/RC[-2], RC[-1]) -> #REF! | E130: =IF(RC11=1, RC[-3], NA()) -> #NA | F130: =INDEX(2001Grossed!R1C1:R46C51, RC1, 1) -> #REF! | G130: =IF(EQUAL(INDEX(2001Grossed!R1C1:R46C51, RC1, 2), R1C), RC4, NA()) -> #REF! | H130: =IF(EQUAL(INDEX(2001Grossed!R1C1:R46C51, RC1, 2), R1C), RC4, NA()) -> #REF! | I130: =IF(EQUAL(INDEX(2001Grossed!R1C1:R46C51, RC1, 2), R1C), RC4, NA()) -> #REF! | J130: =IF(EQUAL(INDEX(2001Grossed!R1C1:R46C51, RC1, 2), R1C), RC4, NA()) -> #REF! | K130: =IF(OR(AND(NOT(ISERROR(RC7)), ISNUMBER(RC7)), AND(NOT(ISERROR(RC8)), ISNUMBER(RC8)), AND(NOT(ISERROR(RC9)), ISNUMBER(RC9)), AND(NOT(ISERROR(RC10)), ISNUMBER(RC10))), 1, 0) -> 0 | M130: =INDEX(Gross!R1C1:R46C51, RC1, 26) -> #REF! | N130: =INDEX(Gross!R1C1:R46C51, RC1, 27) -> #REF!
A131: 144 | B131: =INDEX(2001Grossed!R1C1:R46C51, RC[-1], 26) -> #REF! | C131: =INDEX(2001Grossed!R1C1:R46C51, RC1, 27) -> #REF! | D131: =IF(Menus!R9C10, RC[-1]/RC[-2], RC[-1]) -> #REF! | E131: =IF(RC11=1, RC[-3], NA()) -> #NA | F131: =INDEX(2001Grossed!R1C1:R46C51, RC1, 1) -> #REF! | G131: =IF(EQUAL(INDEX(2001Grossed!R1C1:R46C51, RC1, 2), R1C), RC4, NA()) -> #REF! | H131: =IF(EQUAL(INDEX(2001Grossed!R1C1:R46C51, RC1, 2), R1C), RC4, NA()) -> #REF! | I131: =IF(EQUAL(INDEX(2001Grossed!R1C1:R46C51, RC1, 2), R1C), RC4, NA()) -> #REF! | J131: =IF(EQUAL(INDEX(2001Grossed!R1C1:R46C51, RC1, 2), R1C), RC4, NA()) -> #REF! | K131: =IF(OR(AND(NOT(ISERROR(RC7)), ISNUMBER(RC7)), AND(NOT(ISERROR(RC8)), ISNUMBER(RC8)), AND(NOT(ISERROR(RC9)), ISNUMBER(RC9)), AND(NOT(ISERROR(RC10)), ISNUMBER(RC10))), 1, 0) -> 0 | M131: =INDEX(Gross!R1C1:R46C51, RC1, 26) -> #REF! | N131: =INDEX(Gross!R1C1:R46C51, RC1, 27) -> #REF!
A132: 153 | B132: =INDEX(2001Grossed!R1C1:R46C51, RC[-1], 26) -> #REF! | C132: =INDEX(2001Grossed!R1C1:R46C51, RC1, 27) -> #REF! | D132: =IF(Menus!R9C10, RC[-1]/RC[-2], RC[-1]) -> #REF! | E132: =IF(RC11=1, RC[-3], NA()) -> #NA | F132: =INDEX(2001Grossed!R1C1:R46C51, RC1, 1) -> #REF! | G132: =IF(EQUAL(INDEX(2001Grossed!R1C1:R46C51, RC1, 2), R1C), RC4, NA()) -> #REF! | H132: =IF(EQUAL(INDEX(2001Grossed!R1C1:R46C51, RC1, 2), R1C), RC4, NA()) -> #REF! | I132: =IF(EQUAL(INDEX(2001Grossed!R1C1:R46C51, RC1, 2), R1C), RC4, NA()) -> #REF! | J132: =IF(EQUAL(INDEX(2001Grossed!R1C1:R46C51, RC1, 2), R1C), RC4, NA()) -> #REF! | K132: =IF(OR(AND(NOT(ISERROR(RC7)), ISNUMBER(RC7)), AND(NOT(ISERROR(RC8)), ISNUMBER(RC8)), AND(NOT(ISERROR(RC9)), ISNUMBER(RC9)), AND(NOT(ISERROR(RC10)), ISNUMBER(RC10))), 1, 0) -> 0 | M132: =INDEX(Gross!R1C1:R46C51, RC1, 26) -> #REF! | N132: =INDEX(Gross!R1C1:R46C51, RC1, 27) -> #REF!
A133: 147 | B133: =INDEX(2001Grossed!R1C1:R46C51, RC[-1], 26) -> #REF! | C133: =INDEX(2001Grossed!R1C1:R46C51, RC1, 27) -> #REF! | D133: =IF(Menus!R9C10, RC[-1]/RC[-2], RC[-1]) -> #REF! | E133: =IF(RC11=1, RC[-3], NA()) -> #NA | F133: =INDEX(2001Grossed!R1C1:R46C51, RC1, 1) -> #REF! | G133: =IF(EQUAL(INDEX(2001Grossed!R1C1:R46C51, RC1, 2), R1C), RC4, NA()) -> #REF! | H133: =IF(EQUAL(INDEX(2001Grossed!R1C1:R46C51, RC1, 2), R1C), RC4, NA()) -> #REF! | I133: =IF(EQUAL(INDEX(2001Grossed!R1C1:R46C51, RC1, 2), R1C), RC4, NA()) -> #REF! | J133: =IF(EQUAL(INDEX(2001Grossed!R1C1:R46C51, RC1, 2), R1C), RC4, NA()) -> #REF! | K133: =IF(OR(AND(NOT(ISERROR(RC7)), ISNUMBER(RC7)), AND(NOT(ISERROR(RC8)), ISNUMBER(RC8)), AND(NOT(ISERROR(RC9)), ISNUMBER(RC9)), AND(NOT(ISERROR(RC10)), ISNUMBER(RC10))), 1, 0) -> 0 | M133: =INDEX(Gross!R1C1:R46C51, RC1, 26) -> #REF! | N133: =INDEX(Gross!R1C1:R46C51, RC1, 27) -> #REF!
A134: 132 | B134: =INDEX(2001Grossed!R1C1:R46C51, RC[-1], 26) -> #REF! | C134: =INDEX(2001Grossed!R1C1:R46C51, RC1, 27) -> #REF! | D134: =IF(Menus!R9C10, RC[-1]/RC[-2], RC[-1]) -> #REF! | E134: =IF(RC11=1, RC[-3], NA()) -> #NA | F134: =INDEX(2001Grossed!R1C1:R46C51, RC1, 1) -> #REF! | G134: =IF(EQUAL(INDEX(2001Grossed!R1C1:R46C51, RC1, 2), R1C), RC4, NA()) -> #REF! | H134: =IF(EQUAL(INDEX(2001Grossed!R1C1:R46C51, RC1, 2), R1C), RC4, NA()) -> #REF! | I134: =IF(EQUAL(INDEX(2001Grossed!R1C1:R46C51, RC1, 2), R1C), RC4, NA()) -> #REF! | J134: =IF(EQUAL(INDEX(2001Grossed!R1C1:R46C51, RC1, 2), R1C), RC4, NA()) -> #REF! | K134: =IF(OR(AND(NOT(ISERROR(RC7)), ISNUMBER(RC7)), AND(NOT(ISERROR(RC8)), ISNUMBER(RC8)), AND(NOT(ISERROR(RC9)), ISNUMBER(RC9)), AND(NOT(ISERROR(RC10)), ISNUMBER(RC10))), 1, 0) -> 0 | M134: =INDEX(Gross!R1C1:R46C51, RC1, 26) -> #REF! | N134: =INDEX(Gross!R1C1:R46C51, RC1, 27) -> #REF!
A135: 90 | B135: =INDEX(2001Grossed!R1C1:R46C51, RC[-1], 26) -> #REF! | C135: =INDEX(2001Grossed!R1C1:R46C51, RC1, 27) -> #REF! | D135: =IF(Menus!R9C10, RC[-1]/RC[-2], RC[-1]) -> #REF! | E135: =IF(RC11=1, RC[-3], NA()) -> #NA | F135: =INDEX(2001Grossed!R1C1:R46C51, RC1, 1) -> #REF! | G135: =IF(EQUAL(INDEX(2001Grossed!R1C1:R46C51, RC1, 2), R1C), RC4, NA()) -> #REF! | H135: =IF(EQUAL(INDEX(2001Grossed!R1C1:R46C51, RC1, 2), R1C), RC4, NA()) -> #REF! | I135: =IF(EQUAL(INDEX(2001Grossed!R1C1:R46C51, RC1, 2), R1C), RC4, NA()) -> #REF! | J135: =IF(EQUAL(INDEX(2001Grossed!R1C1:R46C51, RC1, 2), R1C), RC4, NA()) -> #REF! | K135: =IF(OR(AND(NOT(ISERROR(RC7)), ISNUMBER(RC7)), AND(NOT(ISERROR(RC8)), ISNUMBER(RC8)), AND(NOT(ISERROR(RC9)), ISNUMBER(RC9)), AND(NOT(ISERROR(RC10)), ISNUMBER(RC10))), 1, 0) -> 0 | M135: =INDEX(Gross!R1C1:R46C51, RC1, 26) -> #REF! | N135: =INDEX(Gross!R1C1:R46C51, RC1, 27) -> #REF!
A136: 128 | B136: =INDEX(2001Grossed!R1C1:R46C51, RC[-1], 26) -> #REF! | C136: =INDEX(2001Grossed!R1C1:R46C51, RC1, 27) -> #REF! | D136: =IF(Menus!R9C10, RC[-1]/RC[-2], RC[-1]) -> #REF! | E136: =IF(RC11=1, RC[-3], NA()) -> #NA | F136: =INDEX(2001Grossed!R1C1:R46C51, RC1, 1) -> #REF! | G136: =IF(EQUAL(INDEX(2001Grossed!R1C1:R46C51, RC1, 2), R1C), RC4, NA()) -> #REF! | H136: =IF(EQUAL(INDEX(2001Grossed!R1C1:R46C51, RC1, 2), R1C), RC4, NA()) -> #REF! | I136: =IF(EQUAL(INDEX(2001Grossed!R1C1:R46C51, RC1, 2), R1C), RC4, NA()) -> #REF! | J136: =IF(EQUAL(INDEX(2001Grossed!R1C1:R46C51, RC1, 2), R1C), RC4, NA()) -> #REF! | K136: =IF(OR(AND(NOT(ISERROR(RC7)), ISNUMBER(RC7)), AND(NOT(ISERROR(RC8)), ISNUMBER(RC8)), AND(NOT(ISERROR(RC9)), ISNUMBER(RC9)), AND(NOT(ISERROR(RC10)), ISNUMBER(RC10))), 1, 0) -> 0 | M136: =INDEX(Gross!R1C1:R46C51, RC1, 26) -> #REF! | N136: =INDEX(Gross!R1C1:R46C51, RC1, 27) -> #REF!
A137: 57 | B137: =INDEX(2001Grossed!R1C1:R46C51, RC[-1], 26) -> #REF! | C137: =INDEX(2001Grossed!R1C1:R46C51, RC1, 27) -> #REF! | D137: =IF(Menus!R9C10, RC[-1]/RC[-2], RC[-1]) -> #REF! | E137: =IF(RC11=1, RC[-3], NA()) -> #NA | F137: =INDEX(2001Grossed!R1C1:R46C51, RC1, 1) -> #REF! | G137: =IF(EQUAL(INDEX(2001Grossed!R1C1:R46C51, RC1, 2), R1C), RC4, NA()) -> #REF! | H137: =IF(EQUAL(INDEX(2001Grossed!R1C1:R46C51, RC1, 2), R1C), RC4, NA()) -> #REF! | I137: =IF(EQUAL(INDEX(2001Grossed!R1C1:R46C51, RC1, 2), R1C), RC4, NA()) -> #REF! | J137: =IF(EQUAL(INDEX(2001Grossed!R1C1:R46C51, RC1, 2), R1C), RC4, NA()) -> #REF! | K137: =IF(OR(AND(NOT(ISERROR(RC7)), ISNUMBER(RC7)), AND(NOT(ISERROR(RC8)), ISNUMBER(RC8)), AND(NOT(ISERROR(RC9)), ISNUMBER(RC9)), AND(NOT(ISERROR(RC10)), ISNUMBER(RC10))), 1, 0) -> 0 | M137: =INDEX(Gross!R1C1:R46C51, RC1, 26) -> #REF! | N137: =INDEX(Gross!R1C1:R46C51, RC1, 27) -> #REF!
A138: 71 | B138: =INDEX(2001Grossed!R1C1:R46C51, RC[-1], 26) -> #REF! | C138: =INDEX(2001Grossed!R1C1:R46C51, RC1, 27) -> #REF! | D138: =IF(Menus!R9C10, RC[-1]/RC[-2], RC[-1]) -> #REF! | E138: =IF(RC11=1, RC[-3], NA()) -> #NA | F138: =INDEX(2001Grossed!R1C1:R46C51, RC1, 1) -> #REF! | G138: =IF(EQUAL(INDEX(2001Grossed!R1C1:R46C51, RC1, 2), R1C), RC4, NA()) -> #REF! | H138: =IF(EQUAL(INDEX(2001Grossed!R1C1:R46C51, RC1, 2), R1C), RC4, NA()) -> #REF! | I138: =IF(EQUAL(INDEX(2001Grossed!R1C1:R46C51, RC1, 2), R1C), RC4, NA()) -> #REF! | J138: =IF(EQUAL(INDEX(2001Grossed!R1C1:R46C51, RC1, 2), R1C), RC4, NA()) -> #REF! | K138: =IF(OR(AND(NOT(ISERROR(RC7)), ISNUMBER(RC7)), AND(NOT(ISERROR(RC8)), ISNUMBER(RC8)), AND(NOT(ISERROR(RC9)), ISNUMBER(RC9)), AND(NOT(ISERROR(RC10)), ISNUMBER(RC10))), 1, 0) -> 0 | M138: =INDEX(Gross!R1C1:R46C51, RC1, 26) -> #REF! | N138: =INDEX(Gross!R1C1:R46C51, RC1, 27) -> #REF!
A139: 168 | B139: =INDEX(2001Grossed!R1C1:R46C51, RC[-1], 26) -> #REF! | C139: =INDEX(2001Grossed!R1C1:R46C51, RC1, 27) -> #REF! | D139: =IF(Menus!R9C10, RC[-1]/RC[-2], RC[-1]) -> #REF! | E139: =IF(RC11=1, RC[-3], NA()) -> #NA | F139: =INDEX(2001Grossed!R1C1:R46C51, RC1, 1) -> #REF! | G139: =IF(EQUAL(INDEX(2001Grossed!R1C1:R46C51, RC1, 2), R1C), RC4, NA()) -> #REF! | H139: =IF(EQUAL(INDEX(2001Grossed!R1C1:R46C51, RC1, 2), R1C), RC4, NA()) -> #REF! | I139: =IF(EQUAL(INDEX(2001Grossed!R1C1:R46C51, RC1, 2), R1C), RC4, NA()) -> #REF! | J139: =IF(EQUAL(INDEX(2001Grossed!R1C1:R46C51, RC1, 2), R1C), RC4, NA()) -> #REF! | K139: =IF(OR(AND(NOT(ISERROR(RC7)), ISNUMBER(RC7)), AND(NOT(ISERROR(RC8)), ISNUMBER(RC8)), AND(NOT(ISERROR(RC9)), ISNUMBER(RC9)), AND(NOT(ISERROR(RC10)), ISNUMBER(RC10))), 1, 0) -> 0 | M139: =INDEX(Gross!R1C1:R46C51, RC1, 26) -> #REF! | N139: =INDEX(Gross!R1C1:R46C51, RC1, 27) -> #REF!
A140: 106 | B140: =INDEX(2001Grossed!R1C1:R46C51, RC[-1], 26) -> #REF! | C140: =INDEX(2001Grossed!R1C1:R46C51, RC1, 27) -> #REF! | D140: =IF(Menus!R9C10, RC[-1]/RC[-2], RC[-1]) -> #REF! | E140: =IF(RC11=1, RC[-3], NA()) -> #NA | F140: =INDEX(2001Grossed!R1C1:R46C51, RC1, 1) -> #REF! | G140: =IF(EQUAL(INDEX(2001Grossed!R1C1:R46C51, RC1, 2), R1C), RC4, NA()) -> #REF! | H140: =IF(EQUAL(INDEX(2001Grossed!R1C1:R46C51, RC1, 2), R1C), RC4, NA()) -> #REF! | I140: =IF(EQUAL(INDEX(2001Grossed!R1C1:R46C51, RC1, 2), R1C), RC4, NA()) -> #REF! | J140: =IF(EQUAL(INDEX(2001Grossed!R1C1:R46C51, RC1, 2), R1C), RC4, NA()) -> #REF! | K140: =IF(OR(AND(NOT(ISERROR(RC7)), ISNUMBER(RC7)), AND(NOT(ISERROR(RC8)), ISNUMBER(RC8)), AND(NOT(ISERROR(RC9)), ISNUMBER(RC9)), AND(NOT(ISERROR(RC10)), ISNUMBER(RC10))), 1, 0) -> 0 | M140: =INDEX(Gross!R1C1:R46C51, RC1, 26) -> #REF! | N140: =INDEX(Gross!R1C1:R46C51, RC1, 27) -> #REF!
A141: 111 | B141: =INDEX(2001Grossed!R1C1:R46C51, RC[-1], 26) -> #REF! | C141: =INDEX(2001Grossed!R1C1:R46C51, RC1, 27) -> #REF! | D141: =IF(Menus!R9C10, RC[-1]/RC[-2], RC[-1]) -> #REF! | E141: =IF(RC11=1, RC[-3], NA()) -> #NA | F141: =INDEX(2001Grossed!R1C1:R46C51, RC1, 1) -> #REF! | G141: =IF(EQUAL(INDEX(2001Grossed!R1C1:R46C51, RC1, 2), R1C), RC4, NA()) -> #REF! | H141: =IF(EQUAL(INDEX(2001Grossed!R1C1:R46C51, RC1, 2), R1C), RC4, NA()) -> #REF! | I141: =IF(EQUAL(INDEX(2001Grossed!R1C1:R46C51, RC1, 2), R1C), RC4, NA()) -> #REF! | J141: =IF(EQUAL(INDEX(2001Grossed!R1C1:R46C51, RC1, 2), R1C), RC4, NA()) -> #REF! | K141: =IF(OR(AND(NOT(ISERROR(RC7)), ISNUMBER(RC7)), AND(NOT(ISERROR(RC8)), ISNUMBER(RC8)), AND(NOT(ISERROR(RC9)), ISNUMBER(RC9)), AND(NOT(ISERROR(RC10)), ISNUMBER(RC10))), 1, 0) -> 0 | M141: =INDEX(Gross!R1C1:R46C51, RC1, 26) -> #REF! | N141: =INDEX(Gross!R1C1:R46C51, RC1, 27) -> #REF!
A142: 133 | B142: =INDEX(2001Grossed!R1C1:R46C51, RC[-1], 26) -> #REF! | C142: =INDEX(2001Grossed!R1C1:R46C51, RC1, 27) -> #REF! | D142: =IF(Menus!R9C10, RC[-1]/RC[-2], RC[-1]) -> #REF! | E142: =IF(RC11=1, RC[-3], NA()) -> #NA | F142: =INDEX(2001Grossed!R1C1:R46C51, RC1, 1) -> #REF! | G142: =IF(EQUAL(INDEX(2001Grossed!R1C1:R46C51, RC1, 2), R1C), RC4, NA()) -> #REF! | H142: =IF(EQUAL(INDEX(2001Grossed!R1C1:R46C51, RC1, 2), R1C), RC4, NA()) -> #REF! | I142: =IF(EQUAL(INDEX(2001Grossed!R1C1:R46C51, RC1, 2), R1C), RC4, NA()) -> #REF! | J142: =IF(EQUAL(INDEX(2001Grossed!R1C1:R46C51, RC1, 2), R1C), RC4, NA()) -> #REF! | K142: =IF(OR(AND(NOT(ISERROR(RC7)), ISNUMBER(RC7)), AND(NOT(ISERROR(RC8)), ISNUMBER(RC8)), AND(NOT(ISERROR(RC9)), ISNUMBER(RC9)), AND(NOT(ISERROR(RC10)), ISNUMBER(RC10))), 1, 0) -> 0 | M142: =INDEX(Gross!R1C1:R46C51, RC1, 26) -> #REF! | N142: =INDEX(Gross!R1C1:R46C51, RC1, 27) -> #REF!
A143: 101 | B143: =INDEX(2001Grossed!R1C1:R46C51, RC[-1], 26) -> #REF! | C143: =INDEX(2001Grossed!R1C1:R46C51, RC1, 27) -> #REF! | D143: =IF(Menus!R9C10, RC[-1]/RC[-2], RC[-1]) -> #REF! | E143: =IF(RC11=1, RC[-3], NA()) -> #NA | F143: =INDEX(2001Grossed!R1C1:R46C51, RC1, 1) -> #REF! | G143: =IF(EQUAL(INDEX(2001Grossed!R1C1:R46C51, RC1, 2), R1C), RC4, NA()) -> #REF! | H143: =IF(EQUAL(INDEX(2001Grossed!R1C1:R46C51, RC1, 2), R1C), RC4, NA()) -> #REF! | I143: =IF(EQUAL(INDEX(2001Grossed!R1C1:R46C51, RC1, 2), R1C), RC4, NA()) -> #REF! | J143: =IF(EQUAL(INDEX(2001Grossed!R1C1:R46C51, RC1, 2), R1C), RC4, NA()) -> #REF! | K143: =IF(OR(AND(NOT(ISERROR(RC7)), ISNUMBER(RC7)), AND(NOT(ISERROR(RC8)), ISNUMBER(RC8)), AND(NOT(ISERROR(RC9)), ISNUMBER(RC9)), AND(NOT(ISERROR(RC10)), ISNUMBER(RC10))), 1, 0) -> 0 | M143: =INDEX(Gross!R1C1:R46C51, RC1, 26) -> #REF! | N143: =INDEX(Gross!R1C1:R46C51, RC1, 27) -> #REF!
A144: 102 | B144: =INDEX(2001Grossed!R1C1:R46C51, RC[-1], 26) -> #REF! | C144: =INDEX(2001Grossed!R1C1:R46C51, RC1, 27) -> #REF! | D144: =IF(Menus!R9C10, RC[-1]/RC[-2], RC[-1]) -> #REF! | E144: =IF(RC11=1, RC[-3], NA()) -> #NA | F144: =INDEX(2001Grossed!R1C1:R46C51, RC1, 1) -> #REF! | G144: =IF(EQUAL(INDEX(2001Grossed!R1C1:R46C51, RC1, 2), R1C), RC4, NA()) -> #REF! | H144: =IF(EQUAL(INDEX(2001Grossed!R1C1:R46C51, RC1, 2), R1C), RC4, NA()) -> #REF! | I144: =IF(EQUAL(INDEX(2001Grossed!R1C1:R46C51, RC1, 2), R1C), RC4, NA()) -> #REF! | J144: =IF(EQUAL(INDEX(2001Grossed!R1C1:R46C51, RC1, 2), R1C), RC4, NA()) -> #REF! | K144: =IF(OR(AND(NOT(ISERROR(RC7)), ISNUMBER(RC7)), AND(NOT(ISERROR(RC8)), ISNUMBER(RC8)), AND(NOT(ISERROR(RC9)), ISNUMBER(RC9)), AND(NOT(ISERROR(RC10)), ISNUMBER(RC10))), 1, 0) -> 0 | M144: =INDEX(Gross!R1C1:R46C51, RC1, 26) -> #REF! | N144: =INDEX(Gross!R1C1:R46C51, RC1, 27) -> #REF!
A145: 185 | B145: =INDEX(2001Grossed!R1C1:R46C51, RC[-1], 26) -> #REF! | C145: =INDEX(2001Grossed!R1C1:R46C51, RC1, 27) -> #REF! | D145: =IF(Menus!R9C10, RC[-1]/RC[-2], RC[-1]) -> #REF! | E145: =IF(RC11=1, RC[-3], NA()) -> #NA | F145: =INDEX(2001Grossed!R1C1:R46C51, RC1, 1) -> #REF! | G145: =IF(EQUAL(INDEX(2001Grossed!R1C1:R46C51, RC1, 2), R1C), RC4, NA()) -> #REF! | H145: =IF(EQUAL(INDEX(2001Grossed!R1C1:R46C51, RC1, 2), R1C), RC4, NA()) -> #REF! | I145: =IF(EQUAL(INDEX(2001Grossed!R1C1:R46C51, RC1, 2), R1C), RC4, NA()) -> #REF! | J145: =IF(EQUAL(INDEX(2001Grossed!R1C1:R46C51, RC1, 2), R1C), RC4, NA()) -> #REF! | K145: =IF(OR(AND(NOT(ISERROR(RC7)), ISNUMBER(RC7)), AND(NOT(ISERROR(RC8)), ISNUMBER(RC8)), AND(NOT(ISERROR(RC9)), ISNUMBER(RC9)), AND(NOT(ISERROR(RC10)), ISNUMBER(RC10))), 1, 0) -> 0 | M145: =INDEX(Gross!R1C1:R46C51, RC1, 26) -> #REF! | N145: =INDEX(Gross!R1C1:R46C51, RC1, 27) -> #REF!
A146: 170 | B146: =INDEX(2001Grossed!R1C1:R46C51, RC[-1], 26) -> #REF! | C146: =INDEX(2001Grossed!R1C1:R46C51, RC1, 27) -> #REF! | D146: =IF(Menus!R9C10, RC[-1]/RC[-2], RC[-1]) -> #REF! | E146: =IF(RC11=1, RC[-3], NA()) -> #NA | F146: =INDEX(2001Grossed!R1C1:R46C51, RC1, 1) -> #REF! | G146: =IF(EQUAL(INDEX(2001Grossed!R1C1:R46C51, RC1, 2), R1C), RC4, NA()) -> #REF! | H146: =IF(EQUAL(INDEX(2001Grossed!R1C1:R46C51, RC1, 2), R1C), RC4, NA()) -> #REF! | I146: =IF(EQUAL(INDEX(2001Grossed!R1C1:R46C51, RC1, 2), R1C), RC4, NA()) -> #REF! | J146: =IF(EQUAL(INDEX(2001Grossed!R1C1:R46C51, RC1, 2), R1C), RC4, NA()) -> #REF! | K146: =IF(OR(AND(NOT(ISERROR(RC7)), ISNUMBER(RC7)), AND(NOT(ISERROR(RC8)), ISNUMBER(RC8)), AND(NOT(ISERROR(RC9)), ISNUMBER(RC9)), AND(NOT(ISERROR(RC10)), ISNUMBER(RC10))), 1, 0) -> 0 | M146: =INDEX(Gross!R1C1:R46C51, RC1, 26) -> #REF! | N146: =INDEX(Gross!R1C1:R46C51, RC1, 27) -> #REF!
A147: 151 | B147: =INDEX(2001Grossed!R1C1:R46C51, RC[-1], 26) -> #REF! | C147: =INDEX(2001Grossed!R1C1:R46C51, RC1, 27) -> #REF! | D147: =IF(Menus!R9C10, RC[-1]/RC[-2], RC[-1]) -> #REF! | E147: =IF(RC11=1, RC[-3], NA()) -> #NA | F147: =INDEX(2001Grossed!R1C1:R46C51, RC1, 1) -> #REF! | G147: =IF(EQUAL(INDEX(2001Grossed!R1C1:R46C51, RC1, 2), R1C), RC4, NA()) -> #REF! | H147: =IF(EQUAL(INDEX(2001Grossed!R1C1:R46C51, RC1, 2), R1C), RC4, NA()) -> #REF! | I147: =IF(EQUAL(INDEX(2001Grossed!R1C1:R46C51, RC1, 2), R1C), RC4, NA()) -> #REF! | J147: =IF(EQUAL(INDEX(2001Grossed!R1C1:R46C51, RC1, 2), R1C), RC4, NA()) -> #REF! | K147: =IF(OR(AND(NOT(ISERROR(RC7)), ISNUMBER(RC7)), AND(NOT(ISERROR(RC8)), ISNUMBER(RC8)), AND(NOT(ISERROR(RC9)), ISNUMBER(RC9)), AND(NOT(ISERROR(RC10)), ISNUMBER(RC10))), 1, 0) -> 0 | M147: =INDEX(Gross!R1C1:R46C51, RC1, 26) -> #REF! | N147: =INDEX(Gross!R1C1:R46C51, RC1, 27) -> #REF!
A148: 174 | B148: =INDEX(2001Grossed!R1C1:R46C51, RC[-1], 26) -> #REF! | C148: =INDEX(2001Grossed!R1C1:R46C51, RC1, 27) -> #REF! | D148: =IF(Menus!R9C10, RC[-1]/RC[-2], RC[-1]) -> #REF! | E148: =IF(RC11=1, RC[-3], NA()) -> #NA | F148: =INDEX(2001Grossed!R1C1:R46C51, RC1, 1) -> #REF! | G148: =IF(EQUAL(INDEX(2001Grossed!R1C1:R46C51, RC1, 2), R1C), RC4, NA()) -> #REF! | H148: =IF(EQUAL(INDEX(2001Grossed!R1C1:R46C51, RC1, 2), R1C), RC4, NA()) -> #REF! | I148: =IF(EQUAL(INDEX(2001Grossed!R1C1:R46C51, RC1, 2), R1C), RC4, NA()) -> #REF! | J148: =IF(EQUAL(INDEX(2001Grossed!R1C1:R46C51, RC1, 2), R1C), RC4, NA()) -> #REF! | K148: =IF(OR(AND(NOT(ISERROR(RC7)), ISNUMBER(RC7)), AND(NOT(ISERROR(RC8)), ISNUMBER(RC8)), AND(NOT(ISERROR(RC9)), ISNUMBER(RC9)), AND(NOT(ISERROR(RC10)), ISNUMBER(RC10))), 1, 0) -> 0 | M148: =INDEX(Gross!R1C1:R46C51, RC1, 26) -> #REF! | N148: =INDEX(Gross!R1C1:R46C51, RC1, 27) -> #REF!
A149: 142 | B149: =INDEX(2001Grossed!R1C1:R46C51, RC[-1], 26) -> #REF! | C149: =INDEX(2001Grossed!R1C1:R46C51, RC1, 27) -> #REF! | D149: =IF(Menus!R9C10, RC[-1]/RC[-2], RC[-1]) -> #REF! | E149: =IF(RC11=1, RC[-3], NA()) -> #NA | F149: =INDEX(2001Grossed!R1C1:R46C51, RC1, 1) -> #REF! | G149: =IF(EQUAL(INDEX(2001Grossed!R1C1:R46C51, RC1, 2), R1C), RC4, NA()) -> #REF! | H149: =IF(EQUAL(INDEX(2001Grossed!R1C1:R46C51, RC1, 2), R1C), RC4, NA()) -> #REF! | I149: =IF(EQUAL(INDEX(2001Grossed!R1C1:R46C51, RC1, 2), R1C), RC4, NA()) -> #REF! | J149: =IF(EQUAL(INDEX(2001Grossed!R1C1:R46C51, RC1, 2), R1C), RC4, NA()) -> #REF! | K149: =IF(OR(AND(NOT(ISERROR(RC7)), ISNUMBER(RC7)), AND(NOT(ISERROR(RC8)), ISNUMBER(RC8)), AND(NOT(ISERROR(RC9)), ISNUMBER(RC9)), AND(NOT(ISERROR(RC10)), ISNUMBER(RC10))), 1, 0) -> 0 | M149: =INDEX(Gross!R1C1:R46C51, RC1, 26) -> #REF! | N149: =INDEX(Gross!R1C1:R46C51, RC1, 27) -> #REF!
A150: 59 | B150: =INDEX(2001Grossed!R1C1:R46C51, RC[-1], 26) -> #REF! | C150: =INDEX(2001Grossed!R1C1:R46C51, RC1, 27) -> #REF! | D150: =IF(Menus!R9C10, RC[-1]/RC[-2], RC[-1]) -> #REF! | E150: =IF(RC11=1, RC[-3], NA()) -> #NA | F150: =INDEX(2001Grossed!R1C1:R46C51, RC1, 1) -> #REF! | G150: =IF(EQUAL(INDEX(2001Grossed!R1C1:R46C51, RC1, 2), R1C), RC4, NA()) -> #REF! | H150: =IF(EQUAL(INDEX(2001Grossed!R1C1:R46C51, RC1, 2), R1C), RC4, NA()) -> #REF! | I150: =IF(EQUAL(INDEX(2001Grossed!R1C1:R46C51, RC1, 2), R1C), RC4, NA()) -> #REF! | J150: =IF(EQUAL(INDEX(2001Grossed!R1C1:R46C51, RC1, 2), R1C), RC4, NA()) -> #REF! | K150: =IF(OR(AND(NOT(ISERROR(RC7)), ISNUMBER(RC7)), AND(NOT(ISERROR(RC8)), ISNUMBER(RC8)), AND(NOT(ISERROR(RC9)), ISNUMBER(RC9)), AND(NOT(ISERROR(RC10)), ISNUMBER(RC10))), 1, 0) -> 0 | M150: =INDEX(Gross!R1C1:R46C51, RC1, 26) -> #REF! | N150: =INDEX(Gross!R1C1:R46C51, RC1, 27) -> #REF!
A151: 108 | B151: =INDEX(2001Grossed!R1C1:R46C51, RC[-1], 26) -> #REF! | C151: =INDEX(2001Grossed!R1C1:R46C51, RC1, 27) -> #REF! | D151: =IF(Menus!R9C10, RC[-1]/RC[-2], RC[-1]) -> #REF! | E151: =IF(RC11=1, RC[-3], NA()) -> #NA | F151: =INDEX(2001Grossed!R1C1:R46C51, RC1, 1) -> #REF! | G151: =IF(EQUAL(INDEX(2001Grossed!R1C1:R46C51, RC1, 2), R1C), RC4, NA()) -> #REF! | H151: =IF(EQUAL(INDEX(2001Grossed!R1C1:R46C51, RC1, 2), R1C), RC4, NA()) -> #REF! | I151: =IF(EQUAL(INDEX(2001Grossed!R1C1:R46C51, RC1, 2), R1C), RC4, NA()) -> #REF! | J151: =IF(EQUAL(INDEX(2001Grossed!R1C1:R46C51, RC1, 2), R1C), RC4, NA()) -> #REF! | K151: =IF(OR(AND(NOT(ISERROR(RC7)), ISNUMBER(RC7)), AND(NOT(ISERROR(RC8)), ISNUMBER(RC8)), AND(NOT(ISERROR(RC9)), ISNUMBER(RC9)), AND(NOT(ISERROR(RC10)), ISNUMBER(RC10))), 1, 0) -> 0 | M151: =INDEX(Gross!R1C1:R46C51, RC1, 26) -> #REF! | N151: =INDEX(Gross!R1C1:R46C51, RC1, 27) -> #REF!
A152: 173 | B152: =INDEX(2001Grossed!R1C1:R46C51, RC[-1], 26) -> #REF! | C152: =INDEX(2001Grossed!R1C1:R46C51, RC1, 27) -> #REF! | D152: =IF(Menus!R9C10, RC[-1]/RC[-2], RC[-1]) -> #REF! | E152: =IF(RC11=1, RC[-3], NA()) -> #NA | F152: =INDEX(2001Grossed!R1C1:R46C51, RC1, 1) -> #REF! | G152: =IF(EQUAL(INDEX(2001Grossed!R1C1:R46C51, RC1, 2), R1C), RC4, NA()) -> #REF! | H152: =IF(EQUAL(INDEX(2001Grossed!R1C1:R46C51, RC1, 2), R1C), RC4, NA()) -> #REF! | I152: =IF(EQUAL(INDEX(2001Grossed!R1C1:R46C51, RC1, 2), R1C), RC4, NA()) -> #REF! | J152: =IF(EQUAL(INDEX(2001Grossed!R1C1:R46C51, RC1, 2), R1C), RC4, NA()) -> #REF! | K152: =IF(OR(AND(NOT(ISERROR(RC7)), ISNUMBER(RC7)), AND(NOT(ISERROR(RC8)), ISNUMBER(RC8)), AND(NOT(ISERROR(RC9)), ISNUMBER(RC9)), AND(NOT(ISERROR(RC10)), ISNUMBER(RC10))), 1, 0) -> 0 | M152: =INDEX(Gross!R1C1:R46C51, RC1, 26) -> #REF! | N152: =INDEX(Gross!R1C1:R46C51, RC1, 27) -> #REF!
A153: 52 | B153: =INDEX(2001Grossed!R1C1:R46C51, RC[-1], 26) -> #REF! | C153: =INDEX(2001Grossed!R1C1:R46C51, RC1, 27) -> #REF! | D153: =IF(Menus!R9C10, RC[-1]/RC[-2], RC[-1]) -> #REF! | E153: =IF(RC11=1, RC[-3], NA()) -> #NA | F153: =INDEX(2001Grossed!R1C1:R46C51, RC1, 1) -> #REF! | G153: =IF(EQUAL(INDEX(2001Grossed!R1C1:R46C51, RC1, 2), R1C), RC4, NA()) -> #REF! | H153: =IF(EQUAL(INDEX(2001Grossed!R1C1:R46C51, RC1, 2), R1C), RC4, NA()) -> #REF! | I153: =IF(EQUAL(INDEX(2001Grossed!R1C1:R46C51, RC1, 2), R1C), RC4, NA()) -> #REF! | J153: =IF(EQUAL(INDEX(2001Grossed!R1C1:R46C51, RC1, 2), R1C), RC4, NA()) -> #REF! | K153: =IF(OR(AND(NOT(ISERROR(RC7)), ISNUMBER(RC7)), AND(NOT(ISERROR(RC8)), ISNUMBER(RC8)), AND(NOT(ISERROR(RC9)), ISNUMBER(RC9)), AND(NOT(ISERROR(RC10)), ISNUMBER(RC10))), 1, 0) -> 0 | M153: =INDEX(Gross!R1C1:R46C51, RC1, 26) -> #REF! | N153: =INDEX(Gross!R1C1:R46C51, RC1, 27) -> #REF!
A154: 64 | B154: =INDEX(2001Grossed!R1C1:R46C51, RC[-1], 26) -> #REF! | C154: =INDEX(2001Grossed!R1C1:R46C51, RC1, 27) -> #REF! | D154: =IF(Menus!R9C10, RC[-1]/RC[-2], RC[-1]) -> #REF! | E154: =IF(RC11=1, RC[-3], NA()) -> #NA | F154: =INDEX(2001Grossed!R1C1:R46C51, RC1, 1) -> #REF! | G154: =IF(EQUAL(INDEX(2001Grossed!R1C1:R46C51, RC1, 2), R1C), RC4, NA()) -> #REF! | H154: =IF(EQUAL(INDEX(2001Grossed!R1C1:R46C51, RC1, 2), R1C), RC4, NA()) -> #REF! | I154: =IF(EQUAL(INDEX(2001Grossed!R1C1:R46C51, RC1, 2), R1C), RC4, NA()) -> #REF! | J154: =IF(EQUAL(INDEX(2001Grossed!R1C1:R46C51, RC1, 2), R1C), RC4, NA()) -> #REF! | K154: =IF(OR(AND(NOT(ISERROR(RC7)), ISNUMBER(RC7)), AND(NOT(ISERROR(RC8)), ISNUMBER(RC8)), AND(NOT(ISERROR(RC9)), ISNUMBER(RC9)), AND(NOT(ISERROR(RC10)), ISNUMBER(RC10))), 1, 0) -> 0 | M154: =INDEX(Gross!R1C1:R46C51, RC1, 26) -> #REF! | N154: =INDEX(Gross!R1C1:R46C51, RC1, 27) -> #REF!
A155: 121 | B155: =INDEX(2001Grossed!R1C1:R46C51, RC[-1], 26) -> #REF! | C155: =INDEX(2001Grossed!R1C1:R46C51, RC1, 27) -> #REF! | D155: =IF(Menus!R9C10, RC[-1]/RC[-2], RC[-1]) -> #REF! | E155: =IF(RC11=1, RC[-3], NA()) -> #NA | F155: =INDEX(2001Grossed!R1C1:R46C51, RC1, 1) -> #REF! | G155: =IF(EQUAL(INDEX(2001Grossed!R1C1:R46C51, RC1, 2), R1C), RC4, NA()) -> #REF! | H155: =IF(EQUAL(INDEX(2001Grossed!R1C1:R46C51, RC1, 2), R1C), RC4, NA()) -> #REF! | I155: =IF(EQUAL(INDEX(2001Grossed!R1C1:R46C51, RC1, 2), R1C), RC4, NA()) -> #REF! | J155: =IF(EQUAL(INDEX(2001Grossed!R1C1:R46C51, RC1, 2), R1C), RC4, NA()) -> #REF! | K155: =IF(OR(AND(NOT(ISERROR(RC7)), ISNUMBER(RC7)), AND(NOT(ISERROR(RC8)), ISNUMBER(RC8)), AND(NOT(ISERROR(RC9)), ISNUMBER(RC9)), AND(NOT(ISERROR(RC10)), ISNUMBER(RC10))), 1, 0) -> 0 | M155: =INDEX(Gross!R1C1:R46C51, RC1, 26) -> #REF! | N155: =INDEX(Gross!R1C1:R46C51, RC1, 27) -> #REF!
A156: 141 | B156: =INDEX(2001Grossed!R1C1:R46C51, RC[-1], 26) -> #REF! | C156: =INDEX(2001Grossed!R1C1:R46C51, RC1, 27) -> #REF! | D156: =IF(Menus!R9C10, RC[-1]/RC[-2], RC[-1]) -> #REF! | E156: =IF(RC11=1, RC[-3], NA()) -> #NA | F156: =INDEX(2001Grossed!R1C1:R46C51, RC1, 1) -> #REF! | G156: =IF(EQUAL(INDEX(2001Grossed!R1C1:R46C51, RC1, 2), R1C), RC4, NA()) -> #REF! | H156: =IF(EQUAL(INDEX(2001Grossed!R1C1:R46C51, RC1, 2), R1C), RC4, NA()) -> #REF! | I156: =IF(EQUAL(INDEX(2001Grossed!R1C1:R46C51, RC1, 2), R1C), RC4, NA()) -> #REF! | J156: =IF(EQUAL(INDEX(2001Grossed!R1C1:R46C51, RC1, 2), R1C), RC4, NA()) -> #REF! | K156: =IF(OR(AND(NOT(ISERROR(RC7)), ISNUMBER(RC7)), AND(NOT(ISERROR(RC8)), ISNUMBER(RC8)), AND(NOT(ISERROR(RC9)), ISNUMBER(RC9)), AND(NOT(ISERROR(RC10)), ISNUMBER(RC10))), 1, 0) -> 0 | M156: =INDEX(Gross!R1C1:R46C51, RC1, 26) -> #REF! | N156: =INDEX(Gross!R1C1:R46C51, RC1, 27) -> #REF!
A157: 114 | B157: =INDEX(2001Grossed!R1C1:R46C51, RC[-1], 26) -> #REF! | C157: =INDEX(2001Grossed!R1C1:R46C51, RC1, 27) -> #REF! | D157: =IF(Menus!R9C10, RC[-1]/RC[-2], RC[-1]) -> #REF! | E157: =IF(RC11=1, RC[-3], NA()) -> #NA | F157: =INDEX(2001Grossed!R1C1:R46C51, RC1, 1) -> #REF! | G157: =IF(EQUAL(INDEX(2001Grossed!R1C1:R46C51, RC1, 2), R1C), RC4, NA()) -> #REF! | H157: =IF(EQUAL(INDEX(2001Grossed!R1C1:R46C51, RC1, 2), R1C), RC4, NA()) -> #REF! | I157: =IF(EQUAL(INDEX(2001Grossed!R1C1:R46C51, RC1, 2), R1C), RC4, NA()) -> #REF! | J157: =IF(EQUAL(INDEX(2001Grossed!R1C1:R46C51, RC1, 2), R1C), RC4, NA()) -> #REF! | K157: =IF(OR(AND(NOT(ISERROR(RC7)), ISNUMBER(RC7)), AND(NOT(ISERROR(RC8)), ISNUMBER(RC8)), AND(NOT(ISERROR(RC9)), ISNUMBER(RC9)), AND(NOT(ISERROR(RC10)), ISNUMBER(RC10))), 1, 0) -> 0 | M157: =INDEX(Gross!R1C1:R46C51, RC1, 26) -> #REF! | N157: =INDEX(Gross!R1C1:R46C51, RC1, 27) -> #REF!
A158: 180 | B158: =INDEX(2001Grossed!R1C1:R46C51, RC[-1], 26) -> #REF! | C158: =INDEX(2001Grossed!R1C1:R46C51, RC1, 27) -> #REF! | D158: =IF(Menus!R9C10, RC[-1]/RC[-2], RC[-1]) -> #REF! | E158: =IF(RC11=1, RC[-3], NA()) -> #NA | F158: =INDEX(2001Grossed!R1C1:R46C51, RC1, 1) -> #REF! | G158: =IF(EQUAL(INDEX(2001Grossed!R1C1:R46C51, RC1, 2), R1C), RC4, NA()) -> #REF! | H158: =IF(EQUAL(INDEX(2001Grossed!R1C1:R46C51, RC1, 2), R1C), RC4, NA()) -> #REF! | I158: =IF(EQUAL(INDEX(2001Grossed!R1C1:R46C51, RC1, 2), R1C), RC4, NA()) -> #REF! | J158: =IF(EQUAL(INDEX(2001Grossed!R1C1:R46C51, RC1, 2), R1C), RC4, NA()) -> #REF! | K158: =IF(OR(AND(NOT(ISERROR(RC7)), ISNUMBER(RC7)), AND(NOT(ISERROR(RC8)), ISNUMBER(RC8)), AND(NOT(ISERROR(RC9)), ISNUMBER(RC9)), AND(NOT(ISERROR(RC10)), ISNUMBER(RC10))), 1, 0) -> 0 | M158: =INDEX(Gross!R1C1:R46C51, RC1, 26) -> #REF! | N158: =INDEX(Gross!R1C1:R46C51, RC1, 27) -> #REF!
A159: 60 | B159: =INDEX(2001Grossed!R1C1:R46C51, RC[-1], 26) -> #REF! | C159: =INDEX(2001Grossed!R1C1:R46C51, RC1, 27) -> #REF! | D159: =IF(Menus!R9C10, RC[-1]/RC[-2], RC[-1]) -> #REF! | E159: =IF(RC11=1, RC[-3], NA()) -> #NA | F159: =INDEX(2001Grossed!R1C1:R46C51, RC1, 1) -> #REF! | G159: =IF(EQUAL(INDEX(2001Grossed!R1C1:R46C51, RC1, 2), R1C), RC4, NA()) -> #REF! | H159: =IF(EQUAL(INDEX(2001Grossed!R1C1:R46C51, RC1, 2), R1C), RC4, NA()) -> #REF! | I159: =IF(EQUAL(INDEX(2001Grossed!R1C1:R46C51, RC1, 2), R1C), RC4, NA()) -> #REF! | J159: =IF(EQUAL(INDEX(2001Grossed!R1C1:R46C51, RC1, 2), R1C), RC4, NA()) -> #REF! | K159: =IF(OR(AND(NOT(ISERROR(RC7)), ISNUMBER(RC7)), AND(NOT(ISERROR(RC8)), ISNUMBER(RC8)), AND(NOT(ISERROR(RC9)), ISNUMBER(RC9)), AND(NOT(ISERROR(RC10)), ISNUMBER(RC10))), 1, 0) -> 0 | M159: =INDEX(Gross!R1C1:R46C51, RC1, 26) -> #REF! | N159: =INDEX(Gross!R1C1:R46C51, RC1, 27) -> #REF!
A160: 72 | B160: =INDEX(2001Grossed!R1C1:R46C51, RC[-1], 26) -> #REF! | C160: =INDEX(2001Grossed!R1C1:R46C51, RC1, 27) -> #REF! | D160: =IF(Menus!R9C10, RC[-1]/RC[-2], RC[-1]) -> #REF! | E160: =IF(RC11=1, RC[-3], NA()) -> #NA | F160: =INDEX(2001Grossed!R1C1:R46C51, RC1, 1) -> #REF! | G160: =IF(EQUAL(INDEX(2001Grossed!R1C1:R46C51, RC1, 2), R1C), RC4, NA()) -> #REF! | H160: =IF(EQUAL(INDEX(2001Grossed!R1C1:R46C51, RC1, 2), R1C), RC4, NA()) -> #REF! | I160: =IF(EQUAL(INDEX(2001Grossed!R1C1:R46C51, RC1, 2), R1C), RC4, NA()) -> #REF! | J160: =IF(EQUAL(INDEX(2001Grossed!R1C1:R46C51, RC1, 2), R1C), RC4, NA()) -> #REF! | K160: =IF(OR(AND(NOT(ISERROR(RC7)), ISNUMBER(RC7)), AND(NOT(ISERROR(RC8)), ISNUMBER(RC8)), AND(NOT(ISERROR(RC9)), ISNUMBER(RC9)), AND(NOT(ISERROR(RC10)), ISNUMBER(RC10))), 1, 0) -> 0 | M160: =INDEX(Gross!R1C1:R46C51, RC1, 26) -> #REF! | N160: =INDEX(Gross!R1C1:R46C51, RC1, 27) -> #REF!
A161: 198 | B161: =INDEX(2001Grossed!R1C1:R46C51, RC[-1], 26) -> #REF! | C161: =INDEX(2001Grossed!R1C1:R46C51, RC1, 27) -> #REF! | D161: =IF(Menus!R9C10, RC[-1]/RC[-2], RC[-1]) -> #REF! | E161: =IF(RC11=1, RC[-3], NA()) -> #NA | F161: =INDEX(2001Grossed!R1C1:R46C51, RC1, 1) -> #REF! | G161: =IF(EQUAL(INDEX(2001Grossed!R1C1:R46C51, RC1, 2), R1C), RC4, NA()) -> #REF! | H161: =IF(EQUAL(INDEX(2001Grossed!R1C1:R46C51, RC1, 2), R1C), RC4, NA()) -> #REF! | I161: =IF(EQUAL(INDEX(2001Grossed!R1C1:R46C51, RC1, 2), R1C), RC4, NA()) -> #REF! | J161: =IF(EQUAL(INDEX(2001Grossed!R1C1:R46C51, RC1, 2), R1C), RC4, NA()) -> #REF! | K161: =IF(OR(AND(NOT(ISERROR(RC7)), ISNUMBER(RC7)), AND(NOT(ISERROR(RC8)), ISNUMBER(RC8)), AND(NOT(ISERROR(RC9)), ISNUMBER(RC9)), AND(NOT(ISERROR(RC10)), ISNUMBER(RC10))), 1, 0) -> 0 | M161: =INDEX(Gross!R1C1:R46C51, RC1, 26) -> #REF! | N161: =INDEX(Gross!R1C1:R46C51, RC1, 27) -> #REF!
A162: 199 | B162: =INDEX(2001Grossed!R1C1:R46C51, RC[-1], 26) -> #REF! | C162: =INDEX(2001Grossed!R1C1:R46C51, RC1, 27) -> #REF! | D162: =IF(Menus!R9C10, RC[-1]/RC[-2], RC[-1]) -> #REF! | E162: =IF(RC11=1, RC[-3], NA()) -> #NA | F162: =INDEX(2001Grossed!R1C1:R46C51, RC1, 1) -> #REF! | G162: =IF(EQUAL(INDEX(2001Grossed!R1C1:R46C51, RC1, 2), R1C), RC4, NA()) -> #REF! | H162: =IF(EQUAL(INDEX(2001Grossed!R1C1:R46C51, RC1, 2), R1C), RC4, NA()) -> #REF! | I162: =IF(EQUAL(INDEX(2001Grossed!R1C1:R46C51, RC1, 2), R1C), RC4, NA()) -> #REF! | J162: =IF(EQUAL(INDEX(2001Grossed!R1C1:R46C51, RC1, 2), R1C), RC4, NA()) -> #REF! | K162: =IF(OR(AND(NOT(ISERROR(RC7)), ISNUMBER(RC7)), AND(NOT(ISERROR(RC8)), ISNUMBER(RC8)), AND(NOT(ISERROR(RC9)), ISNUMBER(RC9)), AND(NOT(ISERROR(RC10)), ISNUMBER(RC10))), 1, 0) -> 0 | M162: =INDEX(Gross!R1C1:R46C51, RC1, 26) -> #REF! | N162: =INDEX(Gross!R1C1:R46C51, RC1, 27) -> #REF!
A163: 200 | B163: =INDEX(2001Grossed!R1C1:R46C51, RC[-1], 26) -> #REF! | C163: =INDEX(2001Grossed!R1C1:R46C51, RC1, 27) -> #REF! | D163: =IF(Menus!R9C10, RC[-1]/RC[-2], RC[-1]) -> #REF! | E163: =IF(RC11=1, RC[-3], NA()) -> #NA | F163: =INDEX(2001Grossed!R1C1:R46C51, RC1, 1) -> #REF! | G163: =IF(EQUAL(INDEX(2001Grossed!R1C1:R46C51, RC1, 2), R1C), RC4, NA()) -> #REF! | H163: =IF(EQUAL(INDEX(2001Grossed!R1C1:R46C51, RC1, 2), R1C), RC4, NA()) -> #REF! | I163: =IF(EQUAL(INDEX(2001Grossed!R1C1:R46C51, RC1, 2), R1C), RC4, NA()) -> #REF! | J163: =IF(EQUAL(INDEX(2001Grossed!R1C1:R46C51, RC1, 2), R1C), RC4, NA()) -> #REF! | K163: =IF(OR(AND(NOT(ISERROR(RC7)), ISNUMBER(RC7)), AND(NOT(ISERROR(RC8)), ISNUMBER(RC8)), AND(NOT(ISERROR(RC9)), ISNUMBER(RC9)), AND(NOT(ISERROR(RC10)), ISNUMBER(RC10))), 1, 0) -> 0 | M163: =INDEX(Gross!R1C1:R46C51, RC1, 26) -> #REF! | N163: =INDEX(Gross!R1C1:R46C51, RC1, 27) -> #REF!
A164: 201 | B164: =INDEX(2001Grossed!R1C1:R46C51, RC[-1], 26) -> #REF! | C164: =INDEX(2001Grossed!R1C1:R46C51, RC1, 27) -> #REF! | D164: =IF(Menus!R9C10, RC[-1]/RC[-2], RC[-1]) -> #REF! | E164: =IF(RC11=1, RC[-3], NA()) -> #NA | F164: =INDEX(2001Grossed!R1C1:R46C51, RC1, 1) -> #REF! | G164: =IF(EQUAL(INDEX(2001Grossed!R1C1:R46C51, RC1, 2), R1C), RC4, NA()) -> #REF! | H164: =IF(EQUAL(INDEX(2001Grossed!R1C1:R46C51, RC1, 2), R1C), RC4, NA()) -> #REF! | I164: =IF(EQUAL(INDEX(2001Grossed!R1C1:R46C51, RC1, 2), R1C), RC4, NA()) -> #REF! | J164: =IF(EQUAL(INDEX(2001Grossed!R1C1:R46C51, RC1, 2), R1C), RC4, NA()) -> #REF! | K164: =IF(OR(AND(NOT(ISERROR(RC7)), ISNUMBER(RC7)), AND(NOT(ISERROR(RC8)), ISNUMBER(RC8)), AND(NOT(ISERROR(RC9)), ISNUMBER(RC9)), AND(NOT(ISERROR(RC10)), ISNUMBER(RC10))), 1, 0) -> 0 | M164: =INDEX(Gross!R1C1:R46C51, RC1, 26) -> #REF! | N164: =INDEX(Gross!R1C1:R46C51, RC1, 27) -> #REF!
A165: 202 | B165: =INDEX(2001Grossed!R1C1:R46C51, RC[-1], 26) -> #REF! | C165: =INDEX(2001Grossed!R1C1:R46C51, RC1, 27) -> #REF! | D165: =IF(Menus!R9C10, RC[-1]/RC[-2], RC[-1]) -> #REF! | E165: =IF(RC11=1, RC[-3], NA()) -> #NA | F165: =INDEX(2001Grossed!R1C1:R46C51, RC1, 1) -> #REF! | G165: =IF(EQUAL(INDEX(2001Grossed!R1C1:R46C51, RC1, 2), R1C), RC4, NA()) -> #REF! | H165: =IF(EQUAL(INDEX(2001Grossed!R1C1:R46C51, RC1, 2), R1C), RC4, NA()) -> #REF! | I165: =IF(EQUAL(INDEX(2001Grossed!R1C1:R46C51, RC1, 2), R1C), RC4, NA()) -> #REF! | J165: =IF(EQUAL(INDEX(2001Grossed!R1C1:R46C51, RC1, 2), R1C), RC4, NA()) -> #REF! | K165: =IF(OR(AND(NOT(ISERROR(RC7)), ISNUMBER(RC7)), AND(NOT(ISERROR(RC8)), ISNUMBER(RC8)), AND(NOT(ISERROR(RC9)), ISNUMBER(RC9)), AND(NOT(ISERROR(RC10)), ISNUMBER(RC10))), 1, 0) -> 0 | M165: =INDEX(Gross!R1C1:R46C51, RC1, 26) -> #REF! | N165: =INDEX(Gross!R1C1:R46C51, RC1, 27) -> #REF!
A166: 203 | B166: =INDEX(2001Grossed!R1C1:R46C51, RC[-1], 26) -> #REF! | C166: =INDEX(2001Grossed!R1C1:R46C51, RC1, 27) -> #REF! | D166: =IF(Menus!R9C10, RC[-1]/RC[-2], RC[-1]) -> #REF! | E166: =IF(RC11=1, RC[-3], NA()) -> #NA | F166: =INDEX(2001Grossed!R1C1:R46C51, RC1, 1) -> #REF! | G166: =IF(EQUAL(INDEX(2001Grossed!R1C1:R46C51, RC1, 2), R1C), RC4, NA()) -> #REF! | H166: =IF(EQUAL(INDEX(2001Grossed!R1C1:R46C51, RC1, 2), R1C), RC4, NA()) -> #REF! | I166: =IF(EQUAL(INDEX(2001Grossed!R1C1:R46C51, RC1, 2), R1C), RC4, NA()) -> #REF! | J166: =IF(EQUAL(INDEX(2001Grossed!R1C1:R46C51, RC1, 2), R1C), RC4, NA()) -> #REF! | K166: =IF(OR(AND(NOT(ISERROR(RC7)), ISNUMBER(RC7)), AND(NOT(ISERROR(RC8)), ISNUMBER(RC8)), AND(NOT(ISERROR(RC9)), ISNUMBER(RC9)), AND(NOT(ISERROR(RC10)), ISNUMBER(RC10))), 1, 0) -> 0 | M166: =INDEX(Gross!R1C1:R46C51, RC1, 26) -> #REF! | N166: =INDEX(Gross!R1C1:R46C51, RC1, 27) -> #REF!
A167: 204 | B167: =INDEX(2001Grossed!R1C1:R46C51, RC[-1], 26) -> #REF! | C167: =INDEX(2001Grossed!R1C1:R46C51, RC1, 27) -> #REF! | D167: =IF(Menus!R9C10, RC[-1]/RC[-2], RC[-1]) -> #REF! | E167: =IF(RC11=1, RC[-3], NA()) -> #NA | F167: =INDEX(2001Grossed!R1C1:R46C51, RC1, 1) -> #REF! | G167: =IF(EQUAL(INDEX(2001Grossed!R1C1:R46C51, RC1, 2), R1C), RC4, NA()) -> #REF! | H167: =IF(EQUAL(INDEX(2001Grossed!R1C1:R46C51, RC1, 2), R1C), RC4, NA()) -> #REF! | I167: =IF(EQUAL(INDEX(2001Grossed!R1C1:R46C51, RC1, 2), R1C), RC4, NA()) -> #REF! | J167: =IF(EQUAL(INDEX(2001Grossed!R1C1:R46C51, RC1, 2), R1C), RC4, NA()) -> #REF! | K167: =IF(OR(AND(NOT(ISERROR(RC7)), ISNUMBER(RC7)), AND(NOT(ISERROR(RC8)), ISNUMBER(RC8)), AND(NOT(ISERROR(RC9)), ISNUMBER(RC9)), AND(NOT(ISERROR(RC10)), ISNUMBER(RC10))), 1, 0) -> 0 | M167: =INDEX(Gross!R1C1:R46C51, RC1, 26) -> #REF! | N167: =INDEX(Gross!R1C1:R46C51, RC1, 27) -> #REF!
A168: 205 | B168: =INDEX(2001Grossed!R1C1:R46C51, RC[-1], 26) -> #REF! | C168: =INDEX(2001Grossed!R1C1:R46C51, RC1, 27) -> #REF! | D168: =IF(Menus!R9C10, RC[-1]/RC[-2], RC[-1]) -> #REF! | E168: =IF(RC11=1, RC[-3], NA()) -> #NA | F168: =INDEX(2001Grossed!R1C1:R46C51, RC1, 1) -> #REF! | G168: =IF(EQUAL(INDEX(2001Grossed!R1C1:R46C51, RC1, 2), R1C), RC4, NA()) -> #REF! | H168: =IF(EQUAL(INDEX(2001Grossed!R1C1:R46C51, RC1, 2), R1C), RC4, NA()) -> #REF! | I168: =IF(EQUAL(INDEX(2001Grossed!R1C1:R46C51, RC1, 2), R1C), RC4, NA()) -> #REF! | J168: =IF(EQUAL(INDEX(2001Grossed!R1C1:R46C51, RC1, 2), R1C), RC4, NA()) -> #REF! | K168: =IF(OR(AND(NOT(ISERROR(RC7)), ISNUMBER(RC7)), AND(NOT(ISERROR(RC8)), ISNUMBER(RC8)), AND(NOT(ISERROR(RC9)), ISNUMBER(RC9)), AND(NOT(ISERROR(RC10)), ISNUMBER(RC10))), 1, 0) -> 0 | M168: =INDEX(Gross!R1C1:R46C51, RC1, 26) -> #REF! | N168: =INDEX(Gross!R1C1:R46C51, RC1, 27) -> #REF!
A169: 206 | B169: =INDEX(2001Grossed!R1C1:R46C51, RC[-1], 26) -> #REF! | C169: =INDEX(2001Grossed!R1C1:R46C51, RC1, 27) -> #REF! | D169: =IF(Menus!R9C10, RC[-1]/RC[-2], RC[-1]) -> #REF! | E169: =IF(RC11=1, RC[-3], NA()) -> #NA | F169: =INDEX(2001Grossed!R1C1:R46C51, RC1, 1) -> #REF! | G169: =IF(EQUAL(INDEX(2001Grossed!R1C1:R46C51, RC1, 2), R1C), RC4, NA()) -> #REF! | H169: =IF(EQUAL(INDEX(2001Grossed!R1C1:R46C51, RC1, 2), R1C), RC4, NA()) -> #REF! | I169: =IF(EQUAL(INDEX(2001Grossed!R1C1:R46C51, RC1, 2), R1C), RC4, NA()) -> #REF! | J169: =IF(EQUAL(INDEX(2001Grossed!R1C1:R46C51, RC1, 2), R1C), RC4, NA()) -> #REF! | K169: =IF(OR(AND(NOT(ISERROR(RC7)), ISNUMBER(RC7)), AND(NOT(ISERROR(RC8)), ISNUMBER(RC8)), AND(NOT(ISERROR(RC9)), ISNUMBER(RC9)), AND(NOT(ISERROR(RC10)), ISNUMBER(RC10))), 1, 0) -> 0 | M169: =INDEX(Gross!R1C1:R46C51, RC1, 26) -> #REF! | N169: =INDEX(Gross!R1C1:R46C51, RC1, 27) -> #REF!
A170: 207 | B170: =INDEX(2001Grossed!R1C1:R46C51, RC[-1], 26) -> #REF! | C170: =INDEX(2001Grossed!R1C1:R46C51, RC1, 27) -> #REF! | D170: =IF(Menus!R9C10, RC[-1]/RC[-2], RC[-1]) -> #REF! | E170: =IF(RC11=1, RC[-3], NA()) -> #NA | F170: =INDEX(2001Grossed!R1C1:R46C51, RC1, 1) -> #REF! | G170: =IF(EQUAL(INDEX(2001Grossed!R1C1:R46C51, RC1, 2), R1C), RC4, NA()) -> #REF! | H170: =IF(EQUAL(INDEX(2001Grossed!R1C1:R46C51, RC1, 2), R1C), RC4, NA()) -> #REF! | I170: =IF(EQUAL(INDEX(2001Grossed!R1C1:R46C51, RC1, 2), R1C), RC4, NA()) -> #REF! | J170: =IF(EQUAL(INDEX(2001Grossed!R1C1:R46C51, RC1, 2), R1C), RC4, NA()) -> #REF! | K170: =IF(OR(AND(NOT(ISERROR(RC7)), ISNUMBER(RC7)), AND(NOT(ISERROR(RC8)), ISNUMBER(RC8)), AND(NOT(ISERROR(RC9)), ISNUMBER(RC9)), AND(NOT(ISERROR(RC10)), ISNUMBER(RC10))), 1, 0) -> 0 | M170: =INDEX(Gross!R1C1:R46C51, RC1, 26) -> #REF! | N170: =INDEX(Gross!R1C1:R46C51, RC1, 27) -> #REF!
A171: 208 | B171: =INDEX(2001Grossed!R1C1:R46C51, RC[-1], 26) -> #REF! | C171: =INDEX(2001Grossed!R1C1:R46C51, RC1, 27) -> #REF! | D171: =IF(Menus!R9C10, RC[-1]/RC[-2], RC[-1]) -> #REF! | E171: =IF(RC11=1, RC[-3], NA()) -> #NA | F171: =INDEX(2001Grossed!R1C1:R46C51, RC1, 1) -> #REF! | G171: =IF(EQUAL(INDEX(2001Grossed!R1C1:R46C51, RC1, 2), R1C), RC4, NA()) -> #REF! | H171: =IF(EQUAL(INDEX(2001Grossed!R1C1:R46C51, RC1, 2), R1C), RC4, NA()) -> #REF! | I171: =IF(EQUAL(INDEX(2001Grossed!R1C1:R46C51, RC1, 2), R1C), RC4, NA()) -> #REF! | J171: =IF(EQUAL(INDEX(2001Grossed!R1C1:R46C51, RC1, 2), R1C), RC4, NA()) -> #REF! | K171: =IF(OR(AND(NOT(ISERROR(RC7)), ISNUMBER(RC7)), AND(NOT(ISERROR(RC8)), ISNUMBER(RC8)), AND(NOT(ISERROR(RC9)), ISNUMBER(RC9)), AND(NOT(ISERROR(RC10)), ISNUMBER(RC10))), 1, 0) -> 0 | M171: =INDEX(Gross!R1C1:R46C51, RC1, 26) -> #REF! | N171: =INDEX(Gross!R1C1:R46C51, RC1, 27) -> #REF!
A172: 209 | B172: =INDEX(2001Grossed!R1C1:R46C51, RC[-1], 26) -> #REF! | C172: =INDEX(2001Grossed!R1C1:R46C51, RC1, 27) -> #REF! | D172: =IF(Menus!R9C10, RC[-1]/RC[-2], RC[-1]) -> #REF! | E172: =IF(RC11=1, RC[-3], NA()) -> #NA | F172: =INDEX(2001Grossed!R1C1:R46C51, RC1, 1) -> #REF! | G172: =IF(EQUAL(INDEX(2001Grossed!R1C1:R46C51, RC1, 2), R1C), RC4, NA()) -> #REF! | H172: =IF(EQUAL(INDEX(2001Grossed!R1C1:R46C51, RC1, 2), R1C), RC4, NA()) -> #REF! | I172: =IF(EQUAL(INDEX(2001Grossed!R1C1:R46C51, RC1, 2), R1C), RC4, NA()) -> #REF! | J172: =IF(EQUAL(INDEX(2001Grossed!R1C1:R46C51, RC1, 2), R1C), RC4, NA()) -> #REF! | K172: =IF(OR(AND(NOT(ISERROR(RC7)), ISNUMBER(RC7)), AND(NOT(ISERROR(RC8)), ISNUMBER(RC8)), AND(NOT(ISERROR(RC9)), ISNUMBER(RC9)), AND(NOT(ISERROR(RC10)), ISNUMBER(RC10))), 1, 0) -> 0 | M172: =INDEX(Gross!R1C1:R46C51, RC1, 26) -> #REF! | N172: =INDEX(Gross!R1C1:R46C51, RC1, 27) -> #REF!
A173: 210 | B173: =INDEX(2001Grossed!R1C1:R46C51, RC[-1], 26) -> #REF! | C173: =INDEX(2001Grossed!R1C1:R46C51, RC1, 27) -> #REF! | D173: =IF(Menus!R9C10, RC[-1]/RC[-2], RC[-1]) -> #REF! | E173: =IF(RC11=1, RC[-3], NA()) -> #NA | F173: =INDEX(2001Grossed!R1C1:R46C51, RC1, 1) -> #REF! | G173: =IF(EQUAL(INDEX(2001Grossed!R1C1:R46C51, RC1, 2), R1C), RC4, NA()) -> #REF! | H173: =IF(EQUAL(INDEX(2001Grossed!R1C1:R46C51, RC1, 2), R1C), RC4, NA()) -> #REF! | I173: =IF(EQUAL(INDEX(2001Grossed!R1C1:R46C51, RC1, 2), R1C), RC4, NA()) -> #REF! | J173: =IF(EQUAL(INDEX(2001Grossed!R1C1:R46C51, RC1, 2), R1C), RC4, NA()) -> #REF! | K173: =IF(OR(AND(NOT(ISERROR(RC7)), ISNUMBER(RC7)), AND(NOT(ISERROR(RC8)), ISNUMBER(RC8)), AND(NOT(ISERROR(RC9)), ISNUMBER(RC9)), AND(NOT(ISERROR(RC10)), ISNUMBER(RC10))), 1, 0) -> 0 | M173: =INDEX(Gross!R1C1:R46C51, RC1, 26) -> #REF! | N173: =INDEX(Gross!R1C1:R46C51, RC1, 27) -> #REF!
A174: 211 | B174: =INDEX(2001Grossed!R1C1:R46C51, RC[-1], 26) -> #REF! | C174: =INDEX(2001Grossed!R1C1:R46C51, RC1, 27) -> #REF! | D174: =IF(Menus!R9C10, RC[-1]/RC[-2], RC[-1]) -> #REF! | E174: =IF(RC11=1, RC[-3], NA()) -> #NA | F174: =INDEX(2001Grossed!R1C1:R46C51, RC1, 1) -> #REF! | G174: =IF(EQUAL(INDEX(2001Grossed!R1C1:R46C51, RC1, 2), R1C), RC4, NA()) -> #REF! | H174: =IF(EQUAL(INDEX(2001Grossed!R1C1:R46C51, RC1, 2), R1C), RC4, NA()) -> #REF! | I174: =IF(EQUAL(INDEX(2001Grossed!R1C1:R46C51, RC1, 2), R1C), RC4, NA()) -> #REF! | J174: =IF(EQUAL(INDEX(2001Grossed!R1C1:R46C51, RC1, 2), R1C), RC4, NA()) -> #REF! | K174: =IF(OR(AND(NOT(ISERROR(RC7)), ISNUMBER(RC7)), AND(NOT(ISERROR(RC8)), ISNUMBER(RC8)), AND(NOT(ISERROR(RC9)), ISNUMBER(RC9)), AND(NOT(ISERROR(RC10)), ISNUMBER(RC10))), 1, 0) -> 0 | M174: =INDEX(Gross!R1C1:R46C51, RC1, 26) -> #REF! | N174: =INDEX(Gross!R1C1:R46C51, RC1, 27) -> #REF!
A175: 212 | B175: =INDEX(2001Grossed!R1C1:R46C51, RC[-1], 26) -> #REF! | C175: =INDEX(2001Grossed!R1C1:R46C51, RC1, 27) -> #REF! | D175: =IF(Menus!R9C10, RC[-1]/RC[-2], RC[-1]) -> #REF! | E175: =IF(RC11=1, RC[-3], NA()) -> #NA | F175: =INDEX(2001Grossed!R1C1:R46C51, RC1, 1) -> #REF! | G175: =IF(EQUAL(INDEX(2001Grossed!R1C1:R46C51, RC1, 2), R1C), RC4, NA()) -> #REF! | H175: =IF(EQUAL(INDEX(2001Grossed!R1C1:R46C51, RC1, 2), R1C), RC4, NA()) -> #REF! | I175: =IF(EQUAL(INDEX(2001Grossed!R1C1:R46C51, RC1, 2), R1C), RC4, NA()) -> #REF! | J175: =IF(EQUAL(INDEX(2001Grossed!R1C1:R46C51, RC1, 2), R1C), RC4, NA()) -> #REF! | K175: =IF(OR(AND(NOT(ISERROR(RC7)), ISNUMBER(RC7)), AND(NOT(ISERROR(RC8)), ISNUMBER(RC8)), AND(NOT(ISERROR(RC9)), ISNUMBER(RC9)), AND(NOT(ISERROR(RC10)), ISNUMBER(RC10))), 1, 0) -> 0 | M175: =INDEX(Gross!R1C1:R46C51, RC1, 26) -> #REF! | N175: =INDEX(Gross!R1C1:R46C51, RC1, 27) -> #REF!
A176: 213 | B176: =INDEX(2001Grossed!R1C1:R46C51, RC[-1], 26) -> #REF! | C176: =INDEX(2001Grossed!R1C1:R46C51, RC1, 27) -> #REF! | D176: =IF(Menus!R9C10, RC[-1]/RC[-2], RC[-1]) -> #REF! | E176: =IF(RC11=1, RC[-3], NA()) -> #NA | F176: =INDEX(2001Grossed!R1C1:R46C51, RC1, 1) -> #REF! | G176: =IF(EQUAL(INDEX(2001Grossed!R1C1:R46C51, RC1, 2), R1C), RC4, NA()) -> #REF! | H176: =IF(EQUAL(INDEX(2001Grossed!R1C1:R46C51, RC1, 2), R1C), RC4, NA()) -> #REF! | I176: =IF(EQUAL(INDEX(2001Grossed!R1C1:R46C51, RC1, 2), R1C), RC4, NA()) -> #REF! | J176: =IF(EQUAL(INDEX(2001Grossed!R1C1:R46C51, RC1, 2), R1C), RC4, NA()) -> #REF! | K176: =IF(OR(AND(NOT(ISERROR(RC7)), ISNUMBER(RC7)), AND(NOT(ISERROR(RC8)), ISNUMBER(RC8)), AND(NOT(ISERROR(RC9)), ISNUMBER(RC9)), AND(NOT(ISERROR(RC10)), ISNUMBER(RC10))), 1, 0) -> 0 | M176: =INDEX(Gross!R1C1:R46C51, RC1, 26) -> #REF! | N176: =INDEX(Gross!R1C1:R46C51, RC1, 27) -> #REF!
A177: 214 | B177: =INDEX(2001Grossed!R1C1:R46C51, RC[-1], 26) -> #REF! | C177: =INDEX(2001Grossed!R1C1:R46C51, RC1, 27) -> #REF! | D177: =IF(Menus!R9C10, RC[-1]/RC[-2], RC[-1]) -> #REF! | E177: =IF(RC11=1, RC[-3], NA()) -> #NA | F177: =INDEX(2001Grossed!R1C1:R46C51, RC1, 1) -> #REF! | G177: =IF(EQUAL(INDEX(2001Grossed!R1C1:R46C51, RC1, 2), R1C), RC4, NA()) -> #REF! | H177: =IF(EQUAL(INDEX(2001Grossed!R1C1:R46C51, RC1, 2), R1C), RC4, NA()) -> #REF! | I177: =IF(EQUAL(INDEX(2001Grossed!R1C1:R46C51, RC1, 2), R1C), RC4, NA()) -> #REF! | J177: =IF(EQUAL(INDEX(2001Grossed!R1C1:R46C51, RC1, 2), R1C), RC4, NA()) -> #REF! | K177: =IF(OR(AND(NOT(ISERROR(RC7)), ISNUMBER(RC7)), AND(NOT(ISERROR(RC8)), ISNUMBER(RC8)), AND(NOT(ISERROR(RC9)), ISNUMBER(RC9)), AND(NOT(ISERROR(RC10)), ISNUMBER(RC10))), 1, 0) -> 0 | M177: =INDEX(Gross!R1C1:R46C51, RC1, 26) -> #REF! | N177: =INDEX(Gross!R1C1:R46C51, RC1, 27) -> #REF!
A178: 215 | B178: =INDEX(2001Grossed!R1C1:R46C51, RC[-1], 26) -> #REF! | C178: =INDEX(2001Grossed!R1C1:R46C51, RC1, 27) -> #REF! | D178: =IF(Menus!R9C10, RC[-1]/RC[-2], RC[-1]) -> #REF! | E178: =IF(RC11=1, RC[-3], NA()) -> #NA | F178: =INDEX(2001Grossed!R1C1:R46C51, RC1, 1) -> #REF! | G178: =IF(EQUAL(INDEX(2001Grossed!R1C1:R46C51, RC1, 2), R1C), RC4, NA()) -> #REF! | H178: =IF(EQUAL(INDEX(2001Grossed!R1C1:R46C51, RC1, 2), R1C), RC4, NA()) -> #REF! | I178: =IF(EQUAL(INDEX(2001Grossed!R1C1:R46C51, RC1, 2), R1C), RC4, NA()) -> #REF! | J178: =IF(EQUAL(INDEX(2001Grossed!R1C1:R46C51, RC1, 2), R1C), RC4, NA()) -> #REF! | K178: =IF(OR(AND(NOT(ISERROR(RC7)), ISNUMBER(RC7)), AND(NOT(ISERROR(RC8)), ISNUMBER(RC8)), AND(NOT(ISERROR(RC9)), ISNUMBER(RC9)), AND(NOT(ISERROR(RC10)), ISNUMBER(RC10))), 1, 0) -> 0 | M178: =INDEX(Gross!R1C1:R46C51, RC1, 26) -> #REF! | N178: =INDEX(Gross!R1C1:R46C51, RC1, 27) -> #REF!
A179: 216 | B179: =INDEX(2001Grossed!R1C1:R46C51, RC[-1], 26) -> #REF! | C179: =INDEX(2001Grossed!R1C1:R46C51, RC1, 27) -> #REF! | D179: =IF(Menus!R9C10, RC[-1]/RC[-2], RC[-1]) -> #REF! | E179: =IF(RC11=1, RC[-3], NA()) -> #NA | F179: =INDEX(2001Grossed!R1C1:R46C51, RC1, 1) -> #REF! | G179: =IF(EQUAL(INDEX(2001Grossed!R1C1:R46C51, RC1, 2), R1C), RC4, NA()) -> #REF! | H179: =IF(EQUAL(INDEX(2001Grossed!R1C1:R46C51, RC1, 2), R1C), RC4, NA()) -> #REF! | I179: =IF(EQUAL(INDEX(2001Grossed!R1C1:R46C51, RC1, 2), R1C), RC4, NA()) -> #REF! | J179: =IF(EQUAL(INDEX(2001Grossed!R1C1:R46C51, RC1, 2), R1C), RC4, NA()) -> #REF! | K179: =IF(OR(AND(NOT(ISERROR(RC7)), ISNUMBER(RC7)), AND(NOT(ISERROR(RC8)), ISNUMBER(RC8)), AND(NOT(ISERROR(RC9)), ISNUMBER(RC9)), AND(NOT(ISERROR(RC10)), ISNUMBER(RC10))), 1, 0) -> 0 | M179: =INDEX(Gross!R1C1:R46C51, RC1, 26) -> #REF! | N179: =INDEX(Gross!R1C1:R46C51, RC1, 27) -> #REF!
A180: 217 | B180: =INDEX(2001Grossed!R1C1:R46C51, RC[-1], 26) -> #REF! | C180: =INDEX(2001Grossed!R1C1:R46C51, RC1, 27) -> #REF! | D180: =IF(Menus!R9C10, RC[-1]/RC[-2], RC[-1]) -> #REF! | E180: =IF(RC11=1, RC[-3], NA()) -> #NA | F180: =INDEX(2001Grossed!R1C1:R46C51, RC1, 1) -> #REF! | G180: =IF(EQUAL(INDEX(2001Grossed!R1C1:R46C51, RC1, 2), R1C), RC4, NA()) -> #REF! | H180: =IF(EQUAL(INDEX(2001Grossed!R1C1:R46C51, RC1, 2), R1C), RC4, NA()) -> #REF! | I180: =IF(EQUAL(INDEX(2001Grossed!R1C1:R46C51, RC1, 2), R1C), RC4, NA()) -> #REF! | J180: =IF(EQUAL(INDEX(2001Grossed!R1C1:R46C51, RC1, 2), R1C), RC4, NA()) -> #REF! | K180: =IF(OR(AND(NOT(ISERROR(RC7)), ISNUMBER(RC7)), AND(NOT(ISERROR(RC8)), ISNUMBER(RC8)), AND(NOT(ISERROR(RC9)), ISNUMBER(RC9)), AND(NOT(ISERROR(RC10)), ISNUMBER(RC10))), 1, 0) -> 0 | M180: =INDEX(Gross!R1C1:R46C51, RC1, 26) -> #REF! | N180: =INDEX(Gross!R1C1:R46C51, RC1, 27) -> #REF!
A181: 218 | B181: =INDEX(2001Grossed!R1C1:R46C51, RC[-1], 26) -> #REF! | C181: =INDEX(2001Grossed!R1C1:R46C51, RC1, 27) -> #REF! | D181: =IF(Menus!R9C10, RC[-1]/RC[-2], RC[-1]) -> #REF! | E181: =IF(RC11=1, RC[-3], NA()) -> #NA | F181: =INDEX(2001Grossed!R1C1:R46C51, RC1, 1) -> #REF! | G181: =IF(EQUAL(INDEX(2001Grossed!R1C1:R46C51, RC1, 2), R1C), RC4, NA()) -> #REF! | H181: =IF(EQUAL(INDEX(2001Grossed!R1C1:R46C51, RC1, 2), R1C), RC4, NA()) -> #REF! | I181: =IF(EQUAL(INDEX(2001Grossed!R1C1:R46C51, RC1, 2), R1C), RC4, NA()) -> #REF! | J181: =IF(EQUAL(INDEX(2001Grossed!R1C1:R46C51, RC1, 2), R1C), RC4, NA()) -> #REF! | K181: =IF(OR(AND(NOT(ISERROR(RC7)), ISNUMBER(RC7)), AND(NOT(ISERROR(RC8)), ISNUMBER(RC8)), AND(NOT(ISERROR(RC9)), ISNUMBER(RC9)), AND(NOT(ISERROR(RC10)), ISNUMBER(RC10))), 1, 0) -> 0 | M181: =INDEX(Gross!R1C1:R46C51, RC1, 26) -> #REF! | N181: =INDEX(Gross!R1C1:R46C51, RC1, 27) -> #REF!
A182: 219 | B182: =INDEX(2001Grossed!R1C1:R46C51, RC[-1], 26) -> #REF! | C182: =INDEX(2001Grossed!R1C1:R46C51, RC1, 27) -> #REF! | D182: =IF(Menus!R9C10, RC[-1]/RC[-2], RC[-1]) -> #REF! | E182: =IF(RC11=1, RC[-3], NA()) -> #NA | F182: =INDEX(2001Grossed!R1C1:R46C51, RC1, 1) -> #REF! | G182: =IF(EQUAL(INDEX(2001Grossed!R1C1:R46C51, RC1, 2), R1C), RC4, NA()) -> #REF! | H182: =IF(EQUAL(INDEX(2001Grossed!R1C1:R46C51, RC1, 2), R1C), RC4, NA()) -> #REF! | I182: =IF(EQUAL(INDEX(2001Grossed!R1C1:R46C51, RC1, 2), R1C), RC4, NA()) -> #REF! | J182: =IF(EQUAL(INDEX(2001Grossed!R1C1:R46C51, RC1, 2), R1C), RC4, NA()) -> #REF! | K182: =IF(OR(AND(NOT(ISERROR(RC7)), ISNUMBER(RC7)), AND(NOT(ISERROR(RC8)), ISNUMBER(RC8)), AND(NOT(ISERROR(RC9)), ISNUMBER(RC9)), AND(NOT(ISERROR(RC10)), ISNUMBER(RC10))), 1, 0) -> 0 | M182: =INDEX(Gross!R1C1:R46C51, RC1, 26) -> #REF! | N182: =INDEX(Gross!R1C1:R46C51, RC1, 27) -> #REF!
A183: 220 | B183: =INDEX(2001Grossed!R1C1:R46C51, RC[-1], 26) -> #REF! | C183: =INDEX(2001Grossed!R1C1:R46C51, RC1, 27) -> #REF! | D183: =IF(Menus!R9C10, RC[-1]/RC[-2], RC[-1]) -> #REF! | E183: =IF(RC11=1, RC[-3], NA()) -> #NA | F183: =INDEX(2001Grossed!R1C1:R46C51, RC1, 1) -> #REF! | G183: =IF(EQUAL(INDEX(2001Grossed!R1C1:R46C51, RC1, 2), R1C), RC4, NA()) -> #REF! | H183: =IF(EQUAL(INDEX(2001Grossed!R1C1:R46C51, RC1, 2), R1C), RC4, NA()) -> #REF! | I183: =IF(EQUAL(INDEX(2001Grossed!R1C1:R46C51, RC1, 2), R1C), RC4, NA()) -> #REF! | J183: =IF(EQUAL(INDEX(2001Grossed!R1C1:R46C51, RC1, 2), R1C), RC4, NA()) -> #REF! | K183: =IF(OR(AND(NOT(ISERROR(RC7)), ISNUMBER(RC7)), AND(NOT(ISERROR(RC8)), ISNUMBER(RC8)), AND(NOT(ISERROR(RC9)), ISNUMBER(RC9)), AND(NOT(ISERROR(RC10)), ISNUMBER(RC10))), 1, 0) -> 0 | M183: =INDEX(Gross!R1C1:R46C51, RC1, 26) -> #REF! | N183: =INDEX(Gross!R1C1:R46C51, RC1, 27) -> #REF!
A184: 221 | B184: =INDEX(2001Grossed!R1C1:R46C51, RC[-1], 26) -> #REF! | C184: =INDEX(2001Grossed!R1C1:R46C51, RC1, 27) -> #REF! | D184: =IF(Menus!R9C10, RC[-1]/RC[-2], RC[-1]) -> #REF! | E184: =IF(RC11=1, RC[-3], NA()) -> #NA | F184: =INDEX(2001Grossed!R1C1:R46C51, RC1, 1) -> #REF! | G184: =IF(EQUAL(INDEX(2001Grossed!R1C1:R46C51, RC1, 2), R1C), RC4, NA()) -> #REF! | H184: =IF(EQUAL(INDEX(2001Grossed!R1C1:R46C51, RC1, 2), R1C), RC4, NA()) -> #REF! | I184: =IF(EQUAL(INDEX(2001Grossed!R1C1:R46C51, RC1, 2), R1C), RC4, NA()) -> #REF! | J184: =IF(EQUAL(INDEX(2001Grossed!R1C1:R46C51, RC1, 2), R1C), RC4, NA()) -> #REF! | K184: =IF(OR(AND(NOT(ISERROR(RC7)), ISNUMBER(RC7)), AND(NOT(ISERROR(RC8)), ISNUMBER(RC8)), AND(NOT(ISERROR(RC9)), ISNUMBER(RC9)), AND(NOT(ISERROR(RC10)), ISNUMBER(RC10))), 1, 0) -> 0 | M184: =INDEX(Gross!R1C1:R46C51, RC1, 26) -> #REF! | N184: =INDEX(Gross!R1C1:R46C51, RC1, 27) -> #REF!
A185: 222 | B185: =INDEX(2001Grossed!R1C1:R46C51, RC[-1], 26) -> #REF! | C185: =INDEX(2001Grossed!R1C1:R46C51, RC1, 27) -> #REF! | D185: =IF(Menus!R9C10, RC[-1]/RC[-2], RC[-1]) -> #REF! | E185: =IF(RC11=1, RC[-3], NA()) -> #NA | F185: =INDEX(2001Grossed!R1C1:R46C51, RC1, 1) -> #REF! | G185: =IF(EQUAL(INDEX(2001Grossed!R1C1:R46C51, RC1, 2), R1C), RC4, NA()) -> #REF! | H185: =IF(EQUAL(INDEX(2001Grossed!R1C1:R46C51, RC1, 2), R1C), RC4, NA()) -> #REF! | I185: =IF(EQUAL(INDEX(2001Grossed!R1C1:R46C51, RC1, 2), R1C), RC4, NA()) -> #REF! | J185: =IF(EQUAL(INDEX(2001Grossed!R1C1:R46C51, RC1, 2), R1C), RC4, NA()) -> #REF! | K185: =IF(OR(AND(NOT(ISERROR(RC7)), ISNUMBER(RC7)), AND(NOT(ISERROR(RC8)), ISNUMBER(RC8)), AND(NOT(ISERROR(RC9)), ISNUMBER(RC9)), AND(NOT(ISERROR(RC10)), ISNUMBER(RC10))), 1, 0) -> 0 | M185: =INDEX(Gross!R1C1:R46C51, RC1, 26) -> #REF! | N185: =INDEX(Gross!R1C1:R46C51, RC1, 27) -> #REF!
A186: 223 | B186: =INDEX(2001Grossed!R1C1:R46C51, RC[-1], 26) -> #REF! | C186: =INDEX(2001Grossed!R1C1:R46C51, RC1, 27) -> #REF! | D186: =IF(Menus!R9C10, RC[-1]/RC[-2], RC[-1]) -> #REF! | E186: =IF(RC11=1, RC[-3], NA()) -> #NA | F186: =INDEX(2001Grossed!R1C1:R46C51, RC1, 1) -> #REF! | G186: =IF(EQUAL(INDEX(2001Grossed!R1C1:R46C51, RC1, 2), R1C), RC4, NA()) -> #REF! | H186: =IF(EQUAL(INDEX(2001Grossed!R1C1:R46C51, RC1, 2), R1C), RC4, NA()) -> #REF! | I186: =IF(EQUAL(INDEX(2001Grossed!R1C1:R46C51, RC1, 2), R1C), RC4, NA()) -> #REF! | J186: =IF(EQUAL(INDEX(2001Grossed!R1C1:R46C51, RC1, 2), R1C), RC4, NA()) -> #REF! | K186: =IF(OR(AND(NOT(ISERROR(RC7)), ISNUMBER(RC7)), AND(NOT(ISERROR(RC8)), ISNUMBER(RC8)), AND(NOT(ISERROR(RC9)), ISNUMBER(RC9)), AND(NOT(ISERROR(RC10)), ISNUMBER(RC10))), 1, 0) -> 0 | M186: =INDEX(Gross!R1C1:R46C51, RC1, 26) -> #REF! | N186: =INDEX(Gross!R1C1:R46C51, RC1, 27) -> #REF!
A187: 224 | B187: =INDEX(2001Grossed!R1C1:R46C51, RC[-1], 26) -> #REF! | C187: =INDEX(2001Grossed!R1C1:R46C51, RC1, 27) -> #REF! | D187: =IF(Menus!R9C10, RC[-1]/RC[-2], RC[-1]) -> #REF! | E187: =IF(RC11=1, RC[-3], NA()) -> #NA | F187: =INDEX(2001Grossed!R1C1:R46C51, RC1, 1) -> #REF! | G187: =IF(EQUAL(INDEX(2001Grossed!R1C1:R46C51, RC1, 2), R1C), RC4, NA()) -> #REF! | H187: =IF(EQUAL(INDEX(2001Grossed!R1C1:R46C51, RC1, 2), R1C), RC4, NA()) -> #REF! | I187: =IF(EQUAL(INDEX(2001Grossed!R1C1:R46C51, RC1, 2), R1C), RC4, NA()) -> #REF! | J187: =IF(EQUAL(INDEX(2001Grossed!R1C1:R46C51, RC1, 2), R1C), RC4, NA()) -> #REF! | K187: =IF(OR(AND(NOT(ISERROR(RC7)), ISNUMBER(RC7)), AND(NOT(ISERROR(RC8)), ISNUMBER(RC8)), AND(NOT(ISERROR(RC9)), ISNUMBER(RC9)), AND(NOT(ISERROR(RC10)), ISNUMBER(RC10))), 1, 0) -> 0 | M187: =INDEX(Gross!R1C1:R46C51, RC1, 26) -> #REF! | N187: =INDEX(Gross!R1C1:R46C51, RC1, 27) -> #REF!
A188: 225 | B188: =INDEX(2001Grossed!R1C1:R46C51, RC[-1], 26) -> #REF! | C188: =INDEX(2001Grossed!R1C1:R46C51, RC1, 27) -> #REF! | D188: =IF(Menus!R9C10, RC[-1]/RC[-2], RC[-1]) -> #REF! | E188: =IF(RC11=1, RC[-3], NA()) -> #NA | F188: =INDEX(2001Grossed!R1C1:R46C51, RC1, 1) -> #REF! | G188: =IF(EQUAL(INDEX(2001Grossed!R1C1:R46C51, RC1, 2), R1C), RC4, NA()) -> #REF! | H188: =IF(EQUAL(INDEX(2001Grossed!R1C1:R46C51, RC1, 2), R1C), RC4, NA()) -> #REF! | I188: =IF(EQUAL(INDEX(2001Grossed!R1C1:R46C51, RC1, 2), R1C), RC4, NA()) -> #REF! | J188: =IF(EQUAL(INDEX(2001Grossed!R1C1:R46C51, RC1, 2), R1C), RC4, NA()) -> #REF! | K188: =IF(OR(AND(NOT(ISERROR(RC7)), ISNUMBER(RC7)), AND(NOT(ISERROR(RC8)), ISNUMBER(RC8)), AND(NOT(ISERROR(RC9)), ISNUMBER(RC9)), AND(NOT(ISERROR(RC10)), ISNUMBER(RC10))), 1, 0) -> 0 | M188: =INDEX(Gross!R1C1:R46C51, RC1, 26) -> #REF! | N188: =INDEX(Gross!R1C1:R46C51, RC1, 27) -> #REF!
A189: 226 | B189: =INDEX(2001Grossed!R1C1:R46C51, RC[-1], 26) -> #REF! | C189: =INDEX(2001Grossed!R1C1:R46C51, RC1, 27) -> #REF! | D189: =IF(Menus!R9C10, RC[-1]/RC[-2], RC[-1]) -> #REF! | E189: =IF(RC11=1, RC[-3], NA()) -> #NA | F189: =INDEX(2001Grossed!R1C1:R46C51, RC1, 1) -> #REF! | G189: =IF(EQUAL(INDEX(2001Grossed!R1C1:R46C51, RC1, 2), R1C), RC4, NA()) -> #REF! | H189: =IF(EQUAL(INDEX(2001Grossed!R1C1:R46C51, RC1, 2), R1C), RC4, NA()) -> #REF! | I189: =IF(EQUAL(INDEX(2001Grossed!R1C1:R46C51, RC1, 2), R1C), RC4, NA()) -> #REF! | J189: =IF(EQUAL(INDEX(2001Grossed!R1C1:R46C51, RC1, 2), R1C), RC4, NA()) -> #REF! | K189: =IF(OR(AND(NOT(ISERROR(RC7)), ISNUMBER(RC7)), AND(NOT(ISERROR(RC8)), ISNUMBER(RC8)), AND(NOT(ISERROR(RC9)), ISNUMBER(RC9)), AND(NOT(ISERROR(RC10)), ISNUMBER(RC10))), 1, 0) -> 0 | M189: =INDEX(Gross!R1C1:R46C51, RC1, 26) -> #REF! | N189: =INDEX(Gross!R1C1:R46C51, RC1, 27) -> #REF!
A190: 227 | B190: =INDEX(2001Grossed!R1C1:R46C51, RC[-1], 26) -> #REF! | C190: =INDEX(2001Grossed!R1C1:R46C51, RC1, 27) -> #REF! | D190: =IF(Menus!R9C10, RC[-1]/RC[-2], RC[-1]) -> #REF! | E190: =IF(RC11=1, RC[-3], NA()) -> #NA | F190: =INDEX(2001Grossed!R1C1:R46C51, RC1, 1) -> #REF! | G190: =IF(EQUAL(INDEX(2001Grossed!R1C1:R46C51, RC1, 2), R1C), RC4, NA()) -> #REF! | H190: =IF(EQUAL(INDEX(2001Grossed!R1C1:R46C51, RC1, 2), R1C), RC4, NA()) -> #REF! | I190: =IF(EQUAL(INDEX(2001Grossed!R1C1:R46C51, RC1, 2), R1C), RC4, NA()) -> #REF! | J190: =IF(EQUAL(INDEX(2001Grossed!R1C1:R46C51, RC1, 2), R1C), RC4, NA()) -> #REF! | K190: =IF(OR(AND(NOT(ISERROR(RC7)), ISNUMBER(RC7)), AND(NOT(ISERROR(RC8)), ISNUMBER(RC8)), AND(NOT(ISERROR(RC9)), ISNUMBER(RC9)), AND(NOT(ISERROR(RC10)), ISNUMBER(RC10))), 1, 0) -> 0 | M190: =INDEX(Gross!R1C1:R46C51, RC1, 26) -> #REF! | N190: =INDEX(Gross!R1C1:R46C51, RC1, 27) -> #REF!
A191: 228 | B191: =INDEX(2001Grossed!R1C1:R46C51, RC[-1], 26) -> #REF! | C191: =INDEX(2001Grossed!R1C1:R46C51, RC1, 27) -> #REF! | D191: =IF(Menus!R9C10, RC[-1]/RC[-2], RC[-1]) -> #REF! | E191: =IF(RC11=1, RC[-3], NA()) -> #NA | F191: =INDEX(2001Grossed!R1C1:R46C51, RC1, 1) -> #REF! | G191: =IF(EQUAL(INDEX(2001Grossed!R1C1:R46C51, RC1, 2), R1C), RC4, NA()) -> #REF! | H191: =IF(EQUAL(INDEX(2001Grossed!R1C1:R46C51, RC1, 2), R1C), RC4, NA()) -> #REF! | I191: =IF(EQUAL(INDEX(2001Grossed!R1C1:R46C51, RC1, 2), R1C), RC4, NA()) -> #REF! | J191: =IF(EQUAL(INDEX(2001Grossed!R1C1:R46C51, RC1, 2), R1C), RC4, NA()) -> #REF! | K191: =IF(OR(AND(NOT(ISERROR(RC7)), ISNUMBER(RC7)), AND(NOT(ISERROR(RC8)), ISNUMBER(RC8)), AND(NOT(ISERROR(RC9)), ISNUMBER(RC9)), AND(NOT(ISERROR(RC10)), ISNUMBER(RC10))), 1, 0) -> 0 | M191: =INDEX(Gross!R1C1:R46C51, RC1, 26) -> #REF! | N191: =INDEX(Gross!R1C1:R46C51, RC1, 27) -> #REF!
A192: 229 | B192: =INDEX(2001Grossed!R1C1:R46C51, RC[-1], 26) -> #REF! | C192: =INDEX(2001Grossed!R1C1:R46C51, RC1, 27) -> #REF! | D192: =IF(Menus!R9C10, RC[-1]/RC[-2], RC[-1]) -> #REF! | E192: =IF(RC11=1, RC[-3], NA()) -> #NA | F192: =INDEX(2001Grossed!R1C1:R46C51, RC1, 1) -> #REF! | G192: =IF(EQUAL(INDEX(2001Grossed!R1C1:R46C51, RC1, 2), R1C), RC4, NA()) -> #REF! | H192: =IF(EQUAL(INDEX(2001Grossed!R1C1:R46C51, RC1, 2), R1C), RC4, NA()) -> #REF! | I192: =IF(EQUAL(INDEX(2001Grossed!R1C1:R46C51, RC1, 2), R1C), RC4, NA()) -> #REF! | J192: =IF(EQUAL(INDEX(2001Grossed!R1C1:R46C51, RC1, 2), R1C), RC4, NA()) -> #REF! | K192: =IF(OR(AND(NOT(ISERROR(RC7)), ISNUMBER(RC7)), AND(NOT(ISERROR(RC8)), ISNUMBER(RC8)), AND(NOT(ISERROR(RC9)), ISNUMBER(RC9)), AND(NOT(ISERROR(RC10)), ISNUMBER(RC10))), 1, 0) -> 0 | M192: =INDEX(Gross!R1C1:R46C51, RC1, 26) -> #REF! | N192: =INDEX(Gross!R1C1:R46C51, RC1, 27) -> #REF!
A193: 230 | B193: =INDEX(2001Grossed!R1C1:R46C51, RC[-1], 26) -> #REF! | C193: =INDEX(2001Grossed!R1C1:R46C51, RC1, 27) -> #REF! | D193: =IF(Menus!R9C10, RC[-1]/RC[-2], RC[-1]) -> #REF! | E193: =IF(RC11=1, RC[-3], NA()) -> #NA | F193: =INDEX(2001Grossed!R1C1:R46C51, RC1, 1) -> #REF! | G193: =IF(EQUAL(INDEX(2001Grossed!R1C1:R46C51, RC1, 2), R1C), RC4, NA()) -> #REF! | H193: =IF(EQUAL(INDEX(2001Grossed!R1C1:R46C51, RC1, 2), R1C), RC4, NA()) -> #REF! | I193: =IF(EQUAL(INDEX(2001Grossed!R1C1:R46C51, RC1, 2), R1C), RC4, NA()) -> #REF! | J193: =IF(EQUAL(INDEX(2001Grossed!R1C1:R46C51, RC1, 2), R1C), RC4, NA()) -> #REF! | K193: =IF(OR(AND(NOT(ISERROR(RC7)), ISNUMBER(RC7)), AND(NOT(ISERROR(RC8)), ISNUMBER(RC8)), AND(NOT(ISERROR(RC9)), ISNUMBER(RC9)), AND(NOT(ISERROR(RC10)), ISNUMBER(RC10))), 1, 0) -> 0 | M193: =INDEX(Gross!R1C1:R46C51, RC1, 26) -> #REF! | N193: =INDEX(Gross!R1C1:R46C51, RC1, 27) -> #REF!
A194: 231 | B194: =INDEX(2001Grossed!R1C1:R46C51, RC[-1], 26) -> #REF! | C194: =INDEX(2001Grossed!R1C1:R46C51, RC1, 27) -> #REF! | D194: =IF(Menus!R9C10, RC[-1]/RC[-2], RC[-1]) -> #REF! | E194: =IF(RC11=1, RC[-3], NA()) -> #NA | F194: =INDEX(2001Grossed!R1C1:R46C51, RC1, 1) -> #REF! | G194: =IF(EQUAL(INDEX(2001Grossed!R1C1:R46C51, RC1, 2), R1C), RC4, NA()) -> #REF! | H194: =IF(EQUAL(INDEX(2001Grossed!R1C1:R46C51, RC1, 2), R1C), RC4, NA()) -> #REF! | I194: =IF(EQUAL(INDEX(2001Grossed!R1C1:R46C51, RC1, 2), R1C), RC4, NA()) -> #REF! | J194: =IF(EQUAL(INDEX(2001Grossed!R1C1:R46C51, RC1, 2), R1C), RC4, NA()) -> #REF! | K194: =IF(OR(AND(NOT(ISERROR(RC7)), ISNUMBER(RC7)), AND(NOT(ISERROR(RC8)), ISNUMBER(RC8)), AND(NOT(ISERROR(RC9)), ISNUMBER(RC9)), AND(NOT(ISERROR(RC10)), ISNUMBER(RC10))), 1, 0) -> 0 | M194: =INDEX(Gross!R1C1:R46C51, RC1, 26) -> #REF! | N194: =INDEX(Gross!R1C1:R46C51, RC1, 27) -> #REF!
A195: 232 | B195: =INDEX(2001Grossed!R1C1:R46C51, RC[-1], 26) -> #REF! | C195: =INDEX(2001Grossed!R1C1:R46C51, RC1, 27) -> #REF! | D195: =IF(Menus!R9C10, RC[-1]/RC[-2], RC[-1]) -> #REF! | E195: =IF(RC11=1, RC[-3], NA()) -> #NA | F195: =INDEX(2001Grossed!R1C1:R46C51, RC1, 1) -> #REF! | G195: =IF(EQUAL(INDEX(2001Grossed!R1C1:R46C51, RC1, 2), R1C), RC4, NA()) -> #REF! | H195: =IF(EQUAL(INDEX(2001Grossed!R1C1:R46C51, RC1, 2), R1C), RC4, NA()) -> #REF! | I195: =IF(EQUAL(INDEX(2001Grossed!R1C1:R46C51, RC1, 2), R1C), RC4, NA()) -> #REF! | J195: =IF(EQUAL(INDEX(2001Grossed!R1C1:R46C51, RC1, 2), R1C), RC4, NA()) -> #REF! | K195: =IF(OR(AND(NOT(ISERROR(RC7)), ISNUMBER(RC7)), AND(NOT(ISERROR(RC8)), ISNUMBER(RC8)), AND(NOT(ISERROR(RC9)), ISNUMBER(RC9)), AND(NOT(ISERROR(RC10)), ISNUMBER(RC10))), 1, 0) -> 0 | M195: =INDEX(Gross!R1C1:R46C51, RC1, 26) -> #REF! | N195: =INDEX(Gross!R1C1:R46C51, RC1, 27) -> #REF!
A196: 233 | B196: =INDEX(2001Grossed!R1C1:R46C51, RC[-1], 26) -> #REF! | C196: =INDEX(2001Grossed!R1C1:R46C51, RC1, 27) -> #REF! | D196: =IF(Menus!R9C10, RC[-1]/RC[-2], RC[-1]) -> #REF! | E196: =IF(RC11=1, RC[-3], NA()) -> #NA | F196: =INDEX(2001Grossed!R1C1:R46C51, RC1, 1) -> #REF! | G196: =IF(EQUAL(INDEX(2001Grossed!R1C1:R46C51, RC1, 2), R1C), RC4, NA()) -> #REF! | H196: =IF(EQUAL(INDEX(2001Grossed!R1C1:R46C51, RC1, 2), R1C), RC4, NA()) -> #REF! | I196: =IF(EQUAL(INDEX(2001Grossed!R1C1:R46C51, RC1, 2), R1C), RC4, NA()) -> #REF! | J196: =IF(EQUAL(INDEX(2001Grossed!R1C1:R46C51, RC1, 2), R1C), RC4, NA()) -> #REF! | K196: =IF(OR(AND(NOT(ISERROR(RC7)), ISNUMBER(RC7)), AND(NOT(ISERROR(RC8)), ISNUMBER(RC8)), AND(NOT(ISERROR(RC9)), ISNUMBER(RC9)), AND(NOT(ISERROR(RC10)), ISNUMBER(RC10))), 1, 0) -> 0 | M196: =INDEX(Gross!R1C1:R46C51, RC1, 26) -> #REF! | N196: =INDEX(Gross!R1C1:R46C51, RC1, 27) -> #REF!
A197: 234 | B197: =INDEX(2001Grossed!R1C1:R46C51, RC[-1], 26) -> #REF! | C197: =INDEX(2001Grossed!R1C1:R46C51, RC1, 27) -> #REF! | D197: =IF(Menus!R9C10, RC[-1]/RC[-2], RC[-1]) -> #REF! | E197: =IF(RC11=1, RC[-3], NA()) -> #NA | F197: =INDEX(2001Grossed!R1C1:R46C51, RC1, 1) -> #REF! | G197: =IF(EQUAL(INDEX(2001Grossed!R1C1:R46C51, RC1, 2), R1C), RC4, NA()) -> #REF! | H197: =IF(EQUAL(INDEX(2001Grossed!R1C1:R46C51, RC1, 2), R1C), RC4, NA()) -> #REF! | I197: =IF(EQUAL(INDEX(2001Grossed!R1C1:R46C51, RC1, 2), R1C), RC4, NA()) -> #REF! | J197: =IF(EQUAL(INDEX(2001Grossed!R1C1:R46C51, RC1, 2), R1C), RC4, NA()) -> #REF! | K197: =IF(OR(AND(NOT(ISERROR(RC7)), ISNUMBER(RC7)), AND(NOT(ISERROR(RC8)), ISNUMBER(RC8)), AND(NOT(ISERROR(RC9)), ISNUMBER(RC9)), AND(NOT(ISERROR(RC10)), ISNUMBER(RC10))), 1, 0) -> 0 | M197: =INDEX(Gross!R1C1:R46C51, RC1, 26) -> #REF! | N197: =INDEX(Gross!R1C1:R46C51, RC1, 27) -> #REF!
A198: 235 | B198: =INDEX(2001Grossed!R1C1:R46C51, RC[-1], 26) -> #REF! | C198: =INDEX(2001Grossed!R1C1:R46C51, RC1, 27) -> #REF! | D198: =IF(Menus!R9C10, RC[-1]/RC[-2], RC[-1]) -> #REF! | E198: =IF(RC11=1, RC[-3], NA()) -> #NA | F198: =INDEX(2001Grossed!R1C1:R46C51, RC1, 1) -> #REF! | G198: =IF(EQUAL(INDEX(2001Grossed!R1C1:R46C51, RC1, 2), R1C), RC4, NA()) -> #REF! | H198: =IF(EQUAL(INDEX(2001Grossed!R1C1:R46C51, RC1, 2), R1C), RC4, NA()) -> #REF! | I198: =IF(EQUAL(INDEX(2001Grossed!R1C1:R46C51, RC1, 2), R1C), RC4, NA()) -> #REF! | J198: =IF(EQUAL(INDEX(2001Grossed!R1C1:R46C51, RC1, 2), R1C), RC4, NA()) -> #REF! | K198: =IF(OR(AND(NOT(ISERROR(RC7)), ISNUMBER(RC7)), AND(NOT(ISERROR(RC8)), ISNUMBER(RC8)), AND(NOT(ISERROR(RC9)), ISNUMBER(RC9)), AND(NOT(ISERROR(RC10)), ISNUMBER(RC10))), 1, 0) -> 0 | M198: =INDEX(Gross!R1C1:R46C51, RC1, 26) -> #REF! | N198: =INDEX(Gross!R1C1:R46C51, RC1, 27) -> #REF!
A199: 236 | B199: =INDEX(2001Grossed!R1C1:R46C51, RC[-1], 26) -> #REF! | C199: =INDEX(2001Grossed!R1C1:R46C51, RC1, 27) -> #REF! | D199: =IF(Menus!R9C10, RC[-1]/RC[-2], RC[-1]) -> #REF! | E199: =IF(RC11=1, RC[-3], NA()) -> #NA | F199: =INDEX(2001Grossed!R1C1:R46C51, RC1, 1) -> #REF! | G199: =IF(EQUAL(INDEX(2001Grossed!R1C1:R46C51, RC1, 2), R1C), RC4, NA()) -> #REF! | H199: =IF(EQUAL(INDEX(2001Grossed!R1C1:R46C51, RC1, 2), R1C), RC4, NA()) -> #REF! | I199: =IF(EQUAL(INDEX(2001Grossed!R1C1:R46C51, RC1, 2), R1C), RC4, NA()) -> #REF! | J199: =IF(EQUAL(INDEX(2001Grossed!R1C1:R46C51, RC1, 2), R1C), RC4, NA()) -> #REF! | K199: =IF(OR(AND(NOT(ISERROR(RC7)), ISNUMBER(RC7)), AND(NOT(ISERROR(RC8)), ISNUMBER(RC8)), AND(NOT(ISERROR(RC9)), ISNUMBER(RC9)), AND(NOT(ISERROR(RC10)), ISNUMBER(RC10))), 1, 0) -> 0 | M199: =INDEX(Gross!R1C1:R46C51, RC1, 26) -> #REF! | N199: =INDEX(Gross!R1C1:R46C51, RC1, 27) -> #REF!
A200: 237 | B200: =INDEX(2001Grossed!R1C1:R46C51, RC[-1], 26) -> #REF! | C200: =INDEX(2001Grossed!R1C1:R46C51, RC1, 27) -> #REF! | D200: =IF(Menus!R9C10, RC[-1]/RC[-2], RC[-1]) -> #REF! | E200: =IF(RC11=1, RC[-3], NA()) -> #NA | F200: =INDEX(2001Grossed!R1C1:R46C51, RC1, 1) -> #REF! | G200: =IF(EQUAL(INDEX(2001Grossed!R1C1:R46C51, RC1, 2), R1C), RC4, NA()) -> #REF! | H200: =IF(EQUAL(INDEX(2001Grossed!R1C1:R46C51, RC1, 2), R1C), RC4, NA()) -> #REF! | I200: =IF(EQUAL(INDEX(2001Grossed!R1C1:R46C51, RC1, 2), R1C), RC4, NA()) -> #REF! | J200: =IF(EQUAL(INDEX(2001Grossed!R1C1:R46C51, RC1, 2), R1C), RC4, NA()) -> #REF! | K200: =IF(OR(AND(NOT(ISERROR(RC7)), ISNUMBER(RC7)), AND(NOT(ISERROR(RC8)), ISNUMBER(RC8)), AND(NOT(ISERROR(RC9)), ISNUMBER(RC9)), AND(NOT(ISERROR(RC10)), ISNUMBER(RC10))), 1, 0) -> 0 | M200: =INDEX(Gross!R1C1:R46C51, RC1, 26) -> #REF! | N200: =INDEX(Gross!R1C1:R46C51, RC1, 27) -> #REF!
A201: 238 | B201: =INDEX(2001Grossed!R1C1:R46C51, RC[-1], 26) -> #REF! | C201: =INDEX(2001Grossed!R1C1:R46C51, RC1, 27) -> #REF! | D201: =IF(Menus!R9C10, RC[-1]/RC[-2], RC[-1]) -> #REF! | E201: =IF(RC11=1, RC[-3], NA()) -> #NA | F201: =INDEX(2001Grossed!R1C1:R46C51, RC1, 1) -> #REF! | G201: =IF(EQUAL(INDEX(2001Grossed!R1C1:R46C51, RC1, 2), R1C), RC4, NA()) -> #REF! | H201: =IF(EQUAL(INDEX(2001Grossed!R1C1:R46C51, RC1, 2), R1C), RC4, NA()) -> #REF! | I201: =IF(EQUAL(INDEX(2001Grossed!R1C1:R46C51, RC1, 2), R1C), RC4, NA()) -> #REF! | J201: =IF(EQUAL(INDEX(2001Grossed!R1C1:R46C51, RC1, 2), R1C), RC4, NA()) -> #REF! | K201: =IF(OR(AND(NOT(ISERROR(RC7)), ISNUMBER(RC7)), AND(NOT(ISERROR(RC8)), ISNUMBER(RC8)), AND(NOT(ISERROR(RC9)), ISNUMBER(RC9)), AND(NOT(ISERROR(RC10)), ISNUMBER(RC10))), 1, 0) -> 0 | M201: =INDEX(Gross!R1C1:R46C51, RC1, 26) -> #REF! | N201: =INDEX(Gross!R1C1:R46C51, RC1, 27) -> #REF!
A202: 239 | B202: =INDEX(2001Grossed!R1C1:R46C51, RC[-1], 26) -> #REF! | C202: =INDEX(2001Grossed!R1C1:R46C51, RC1, 27) -> #REF! | D202: =IF(Menus!R9C10, RC[-1]/RC[-2], RC[-1]) -> #REF! | E202: =IF(RC11=1, RC[-3], NA()) -> #NA | F202: =INDEX(2001Grossed!R1C1:R46C51, RC1, 1) -> #REF! | G202: =IF(EQUAL(INDEX(2001Grossed!R1C1:R46C51, RC1, 2), R1C), RC4, NA()) -> #REF! | H202: =IF(EQUAL(INDEX(2001Grossed!R1C1:R46C51, RC1, 2), R1C), RC4, NA()) -> #REF! | I202: =IF(EQUAL(INDEX(2001Grossed!R1C1:R46C51, RC1, 2), R1C), RC4, NA()) -> #REF! | J202: =IF(EQUAL(INDEX(2001Grossed!R1C1:R46C51, RC1, 2), R1C), RC4, NA()) -> #REF! | K202: =IF(OR(AND(NOT(ISERROR(RC7)), ISNUMBER(RC7)), AND(NOT(ISERROR(RC8)), ISNUMBER(RC8)), AND(NOT(ISERROR(RC9)), ISNUMBER(RC9)), AND(NOT(ISERROR(RC10)), ISNUMBER(RC10))), 1, 0) -> 0 | M202: =INDEX(Gross!R1C1:R46C51, RC1, 26) -> #REF! | N202: =INDEX(Gross!R1C1:R46C51, RC1, 27) -> #REF!
A203: 240 | B203: =INDEX(2001Grossed!R1C1:R46C51, RC[-1], 26) -> #REF! | C203: =INDEX(2001Grossed!R1C1:R46C51, RC1, 27) -> #REF! | D203: =IF(Menus!R9C10, RC[-1]/RC[-2], RC[-1]) -> #REF! | E203: =IF(RC11=1, RC[-3], NA()) -> #NA | F203: =INDEX(2001Grossed!R1C1:R46C51, RC1, 1) -> #REF! | G203: =IF(EQUAL(INDEX(2001Grossed!R1C1:R46C51, RC1, 2), R1C), RC4, NA()) -> #REF! | H203: =IF(EQUAL(INDEX(2001Grossed!R1C1:R46C51, RC1, 2), R1C), RC4, NA()) -> #REF! | I203: =IF(EQUAL(INDEX(2001Grossed!R1C1:R46C51, RC1, 2), R1C), RC4, NA()) -> #REF! | J203: =IF(EQUAL(INDEX(2001Grossed!R1C1:R46C51, RC1, 2), R1C), RC4, NA()) -> #REF! | K203: =IF(OR(AND(NOT(ISERROR(RC7)), ISNUMBER(RC7)), AND(NOT(ISERROR(RC8)), ISNUMBER(RC8)), AND(NOT(ISERROR(RC9)), ISNUMBER(RC9)), AND(NOT(ISERROR(RC10)), ISNUMBER(RC10))), 1, 0) -> 0 | M203: =INDEX(Gross!R1C1:R46C51, RC1, 26) -> #REF! | N203: =INDEX(Gross!R1C1:R46C51, RC1, 27) -> #REF!
A204: 241 | B204: =INDEX(2001Grossed!R1C1:R46C51, RC[-1], 26) -> #REF! | C204: =INDEX(2001Grossed!R1C1:R46C51, RC1, 27) -> #REF! | D204: =IF(Menus!R9C10, RC[-1]/RC[-2], RC[-1]) -> #REF! | E204: =IF(RC11=1, RC[-3], NA()) -> #NA | F204: =INDEX(2001Grossed!R1C1:R46C51, RC1, 1) -> #REF! | G204: =IF(EQUAL(INDEX(2001Grossed!R1C1:R46C51, RC1, 2), R1C), RC4, NA()) -> #REF! | H204: =IF(EQUAL(INDEX(2001Grossed!R1C1:R46C51, RC1, 2), R1C), RC4, NA()) -> #REF! | I204: =IF(EQUAL(INDEX(2001Grossed!R1C1:R46C51, RC1, 2), R1C), RC4, NA()) -> #REF! | J204: =IF(EQUAL(INDEX(2001Grossed!R1C1:R46C51, RC1, 2), R1C), RC4, NA()) -> #REF! | K204: =IF(OR(AND(NOT(ISERROR(RC7)), ISNUMBER(RC7)), AND(NOT(ISERROR(RC8)), ISNUMBER(RC8)), AND(NOT(ISERROR(RC9)), ISNUMBER(RC9)), AND(NOT(ISERROR(RC10)), ISNUMBER(RC10))), 1, 0) -> 0 | M204: =INDEX(Gross!R1C1:R46C51, RC1, 26) -> #REF! | N204: =INDEX(Gross!R1C1:R46C51, RC1, 27) -> #REF!
A205: 242 | B205: =INDEX(2001Grossed!R1C1:R46C51, RC[-1], 26) -> #REF! | C205: =INDEX(2001Grossed!R1C1:R46C51, RC1, 27) -> #REF! | D205: =IF(Menus!R9C10, RC[-1]/RC[-2], RC[-1]) -> #REF! | E205: =IF(RC11=1, RC[-3], NA()) -> #NA | F205: =INDEX(2001Grossed!R1C1:R46C51, RC1, 1) -> #REF! | G205: =IF(EQUAL(INDEX(2001Grossed!R1C1:R46C51, RC1, 2), R1C), RC4, NA()) -> #REF! | H205: =IF(EQUAL(INDEX(2001Grossed!R1C1:R46C51, RC1, 2), R1C), RC4, NA()) -> #REF! | I205: =IF(EQUAL(INDEX(2001Grossed!R1C1:R46C51, RC1, 2), R1C), RC4, NA()) -> #REF! | J205: =IF(EQUAL(INDEX(2001Grossed!R1C1:R46C51, RC1, 2), R1C), RC4, NA()) -> #REF! | K205: =IF(OR(AND(NOT(ISERROR(RC7)), ISNUMBER(RC7)), AND(NOT(ISERROR(RC8)), ISNUMBER(RC8)), AND(NOT(ISERROR(RC9)), ISNUMBER(RC9)), AND(NOT(ISERROR(RC10)), ISNUMBER(RC10))), 1, 0) -> 0 | M205: =INDEX(Gross!R1C1:R46C51, RC1, 26) -> #REF! | N205: =INDEX(Gross!R1C1:R46C51, RC1, 27) -> #REF!
A206: 243 | B206: =INDEX(2001Grossed!R1C1:R46C51, RC[-1], 26) -> #REF! | C206: =INDEX(2001Grossed!R1C1:R46C51, RC1, 27) -> #REF! | D206: =IF(Menus!R9C10, RC[-1]/RC[-2], RC[-1]) -> #REF! | E206: =IF(RC11=1, RC[-3], NA()) -> #NA | F206: =INDEX(2001Grossed!R1C1:R46C51, RC1, 1) -> #REF! | G206: =IF(EQUAL(INDEX(2001Grossed!R1C1:R46C51, RC1, 2), R1C), RC4, NA()) -> #REF! | H206: =IF(EQUAL(INDEX(2001Grossed!R1C1:R46C51, RC1, 2), R1C), RC4, NA()) -> #REF! | I206: =IF(EQUAL(INDEX(2001Grossed!R1C1:R46C51, RC1, 2), R1C), RC4, NA()) -> #REF! | J206: =IF(EQUAL(INDEX(2001Grossed!R1C1:R46C51, RC1, 2), R1C), RC4, NA()) -> #REF! | K206: =IF(OR(AND(NOT(ISERROR(RC7)), ISNUMBER(RC7)), AND(NOT(ISERROR(RC8)), ISNUMBER(RC8)), AND(NOT(ISERROR(RC9)), ISNUMBER(RC9)), AND(NOT(ISERROR(RC10)), ISNUMBER(RC10))), 1, 0) -> 0 | M206: =INDEX(Gross!R1C1:R46C51, RC1, 26) -> #REF! | N206: =INDEX(Gross!R1C1:R46C51, RC1, 27) -> #REF!
A207: 244 | B207: =INDEX(2001Grossed!R1C1:R46C51, RC[-1], 26) -> #REF! | C207: =INDEX(2001Grossed!R1C1:R46C51, RC1, 27) -> #REF! | D207: =IF(Menus!R9C10, RC[-1]/RC[-2], RC[-1]) -> #REF! | E207: =IF(RC11=1, RC[-3], NA()) -> #NA | F207: =INDEX(2001Grossed!R1C1:R46C51, RC1, 1) -> #REF! | G207: =IF(EQUAL(INDEX(2001Grossed!R1C1:R46C51, RC1, 2), R1C), RC4, NA()) -> #REF! | H207: =IF(EQUAL(INDEX(2001Grossed!R1C1:R46C51, RC1, 2), R1C), RC4, NA()) -> #REF! | I207: =IF(EQUAL(INDEX(2001Grossed!R1C1:R46C51, RC1, 2), R1C), RC4, NA()) -> #REF! | J207: =IF(EQUAL(INDEX(2001Grossed!R1C1:R46C51, RC1, 2), R1C), RC4, NA()) -> #REF! | K207: =IF(OR(AND(NOT(ISERROR(RC7)), ISNUMBER(RC7)), AND(NOT(ISERROR(RC8)), ISNUMBER(RC8)), AND(NOT(ISERROR(RC9)), ISNUMBER(RC9)), AND(NOT(ISERROR(RC10)), ISNUMBER(RC10))), 1, 0) -> 0 | M207: =INDEX(Gross!R1C1:R46C51, RC1, 26) -> #REF! | N207: =INDEX(Gross!R1C1:R46C51, RC1, 27) -> #REF!
A208: 245 | B208: =INDEX(2001Grossed!R1C1:R46C51, RC[-1], 26) -> #REF! | C208: =INDEX(2001Grossed!R1C1:R46C51, RC1, 27) -> #REF! | D208: =IF(Menus!R9C10, RC[-1]/RC[-2], RC[-1]) -> #REF! | E208: =IF(RC11=1, RC[-3], NA()) -> #NA | F208: =INDEX(2001Grossed!R1C1:R46C51, RC1, 1) -> #REF! | G208: =IF(EQUAL(INDEX(2001Grossed!R1C1:R46C51, RC1, 2), R1C), RC4, NA()) -> #REF! | H208: =IF(EQUAL(INDEX(2001Grossed!R1C1:R46C51, RC1, 2), R1C), RC4, NA()) -> #REF! | I208: =IF(EQUAL(INDEX(2001Grossed!R1C1:R46C51, RC1, 2), R1C), RC4, NA()) -> #REF! | J208: =IF(EQUAL(INDEX(2001Grossed!R1C1:R46C51, RC1, 2), R1C), RC4, NA()) -> #REF! | K208: =IF(OR(AND(NOT(ISERROR(RC7)), ISNUMBER(RC7)), AND(NOT(ISERROR(RC8)), ISNUMBER(RC8)), AND(NOT(ISERROR(RC9)), ISNUMBER(RC9)), AND(NOT(ISERROR(RC10)), ISNUMBER(RC10))), 1, 0) -> 0 | M208: =INDEX(Gross!R1C1:R46C51, RC1, 26) -> #REF! | N208: =INDEX(Gross!R1C1:R46C51, RC1, 27) -> #REF!
A209: 246 | B209: =INDEX(2001Grossed!R1C1:R46C51, RC[-1], 26) -> #REF! | C209: =INDEX(2001Grossed!R1C1:R46C51, RC1, 27) -> #REF! | D209: =IF(Menus!R9C10, RC[-1]/RC[-2], RC[-1]) -> #REF! | E209: =IF(RC11=1, RC[-3], NA()) -> #NA | F209: =INDEX(2001Grossed!R1C1:R46C51, RC1, 1) -> #REF! | G209: =IF(EQUAL(INDEX(2001Grossed!R1C1:R46C51, RC1, 2), R1C), RC4, NA()) -> #REF! | H209: =IF(EQUAL(INDEX(2001Grossed!R1C1:R46C51, RC1, 2), R1C), RC4, NA()) -> #REF! | I209: =IF(EQUAL(INDEX(2001Grossed!R1C1:R46C51, RC1, 2), R1C), RC4, NA()) -> #REF! | J209: =IF(EQUAL(INDEX(2001Grossed!R1C1:R46C51, RC1, 2), R1C), RC4, NA()) -> #REF! | K209: =IF(OR(AND(NOT(ISERROR(RC7)), ISNUMBER(RC7)), AND(NOT(ISERROR(RC8)), ISNUMBER(RC8)), AND(NOT(ISERROR(RC9)), ISNUMBER(RC9)), AND(NOT(ISERROR(RC10)), ISNUMBER(RC10))), 1, 0) -> 0 | M209: =INDEX(Gross!R1C1:R46C51, RC1, 26) -> #REF! | N209: =INDEX(Gross!R1C1:R46C51, RC1, 27) -> #REF!
A210: 247 | B210: =INDEX(2001Grossed!R1C1:R46C51, RC[-1], 26) -> #REF! | C210: =INDEX(2001Grossed!R1C1:R46C51, RC1, 27) -> #REF! | D210: =IF(Menus!R9C10, RC[-1]/RC[-2], RC[-1]) -> #REF! | E210: =IF(RC11=1, RC[-3], NA()) -> #NA | F210: =INDEX(2001Grossed!R1C1:R46C51, RC1, 1) -> #REF! | G210: =IF(EQUAL(INDEX(2001Grossed!R1C1:R46C51, RC1, 2), R1C), RC4, NA()) -> #REF! | H210: =IF(EQUAL(INDEX(2001Grossed!R1C1:R46C51, RC1, 2), R1C), RC4, NA()) -> #REF! | I210: =IF(EQUAL(INDEX(2001Grossed!R1C1:R46C51, RC1, 2), R1C), RC4, NA()) -> #REF! | J210: =IF(EQUAL(INDEX(2001Grossed!R1C1:R46C51, RC1, 2), R1C), RC4, NA()) -> #REF! | K210: =IF(OR(AND(NOT(ISERROR(RC7)), ISNUMBER(RC7)), AND(NOT(ISERROR(RC8)), ISNUMBER(RC8)), AND(NOT(ISERROR(RC9)), ISNUMBER(RC9)), AND(NOT(ISERROR(RC10)), ISNUMBER(RC10))), 1, 0) -> 0 | M210: =INDEX(Gross!R1C1:R46C51, RC1, 26) -> #REF! | N210: =INDEX(Gross!R1C1:R46C51, RC1, 27) -> #REF!
A211: 248 | B211: =INDEX(2001Grossed!R1C1:R46C51, RC[-1], 26) -> #REF! | C211: =INDEX(2001Grossed!R1C1:R46C51, RC1, 27) -> #REF! | D211: =IF(Menus!R9C10, RC[-1]/RC[-2], RC[-1]) -> #REF! | E211: =IF(RC11=1, RC[-3], NA()) -> #NA | F211: =INDEX(2001Grossed!R1C1:R46C51, RC1, 1) -> #REF! | G211: =IF(EQUAL(INDEX(2001Grossed!R1C1:R46C51, RC1, 2), R1C), RC4, NA()) -> #REF! | H211: =IF(EQUAL(INDEX(2001Grossed!R1C1:R46C51, RC1, 2), R1C), RC4, NA()) -> #REF! | I211: =IF(EQUAL(INDEX(2001Grossed!R1C1:R46C51, RC1, 2), R1C), RC4, NA()) -> #REF! | J211: =IF(EQUAL(INDEX(2001Grossed!R1C1:R46C51, RC1, 2), R1C), RC4, NA()) -> #REF! | K211: =IF(OR(AND(NOT(ISERROR(RC7)), ISNUMBER(RC7)), AND(NOT(ISERROR(RC8)), ISNUMBER(RC8)), AND(NOT(ISERROR(RC9)), ISNUMBER(RC9)), AND(NOT(ISERROR(RC10)), ISNUMBER(RC10))), 1, 0) -> 0 | M211: =INDEX(Gross!R1C1:R46C51, RC1, 26) -> #REF! | N211: =INDEX(Gross!R1C1:R46C51, RC1, 27) -> #REF!
A212: 249 | B212: =INDEX(2001Grossed!R1C1:R46C51, RC[-1], 26) -> #REF! | C212: =INDEX(2001Grossed!R1C1:R46C51, RC1, 27) -> #REF! | D212: =IF(Menus!R9C10, RC[-1]/RC[-2], RC[-1]) -> #REF! | E212: =IF(RC11=1, RC[-3], NA()) -> #NA | F212: =INDEX(2001Grossed!R1C1:R46C51, RC1, 1) -> #REF! | G212: =IF(EQUAL(INDEX(2001Grossed!R1C1:R46C51, RC1, 2), R1C), RC4, NA()) -> #REF! | H212: =IF(EQUAL(INDEX(2001Grossed!R1C1:R46C51, RC1, 2), R1C), RC4, NA()) -> #REF! | I212: =IF(EQUAL(INDEX(2001Grossed!R1C1:R46C51, RC1, 2), R1C), RC4, NA()) -> #REF! | J212: =IF(EQUAL(INDEX(2001Grossed!R1C1:R46C51, RC1, 2), R1C), RC4, NA()) -> #REF! | K212: =IF(OR(AND(NOT(ISERROR(RC7)), ISNUMBER(RC7)), AND(NOT(ISERROR(RC8)), ISNUMBER(RC8)), AND(NOT(ISERROR(RC9)), ISNUMBER(RC9)), AND(NOT(ISERROR(RC10)), ISNUMBER(RC10))), 1, 0) -> 0 | M212: =INDEX(Gross!R1C1:R46C51, RC1, 26) -> #REF! | N212: =INDEX(Gross!R1C1:R46C51, RC1, 27) -> #REF!
A213: 250 | B213: =INDEX(2001Grossed!R1C1:R46C51, RC[-1], 26) -> #REF! | C213: =INDEX(2001Grossed!R1C1:R46C51, RC1, 27) -> #REF! | D213: =IF(Menus!R9C10, RC[-1]/RC[-2], RC[-1]) -> #REF! | E213: =IF(RC11=1, RC[-3], NA()) -> #NA | F213: =INDEX(2001Grossed!R1C1:R46C51, RC1, 1) -> #REF! | G213: =IF(EQUAL(INDEX(2001Grossed!R1C1:R46C51, RC1, 2), R1C), RC4, NA()) -> #REF! | H213: =IF(EQUAL(INDEX(2001Grossed!R1C1:R46C51, RC1, 2), R1C), RC4, NA()) -> #REF! | I213: =IF(EQUAL(INDEX(2001Grossed!R1C1:R46C51, RC1, 2), R1C), RC4, NA()) -> #REF! | J213: =IF(EQUAL(INDEX(2001Grossed!R1C1:R46C51, RC1, 2), R1C), RC4, NA()) -> #REF! | K213: =IF(OR(AND(NOT(ISERROR(RC7)), ISNUMBER(RC7)), AND(NOT(ISERROR(RC8)), ISNUMBER(RC8)), AND(NOT(ISERROR(RC9)), ISNUMBER(RC9)), AND(NOT(ISERROR(RC10)), ISNUMBER(RC10))), 1, 0) -> 0 | M213: =INDEX(Gross!R1C1:R46C51, RC1, 26) -> #REF! | N213: =INDEX(Gross!R1C1:R46C51, RC1, 27) -> #REF!
A214: 251 | B214: =INDEX(2001Grossed!R1C1:R46C51, RC[-1], 26) -> #REF! | C214: =INDEX(2001Grossed!R1C1:R46C51, RC1, 27) -> #REF! | D214: =IF(Menus!R9C10, RC[-1]/RC[-2], RC[-1]) -> #REF! | E214: =IF(RC11=1, RC[-3], NA()) -> #NA | F214: =INDEX(2001Grossed!R1C1:R46C51, RC1, 1) -> #REF! | G214: =IF(EQUAL(INDEX(2001Grossed!R1C1:R46C51, RC1, 2), R1C), RC4, NA()) -> #REF! | H214: =IF(EQUAL(INDEX(2001Grossed!R1C1:R46C51, RC1, 2), R1C), RC4, NA()) -> #REF! | I214: =IF(EQUAL(INDEX(2001Grossed!R1C1:R46C51, RC1, 2), R1C), RC4, NA()) -> #REF! | J214: =IF(EQUAL(INDEX(2001Grossed!R1C1:R46C51, RC1, 2), R1C), RC4, NA()) -> #REF! | K214: =IF(OR(AND(NOT(ISERROR(RC7)), ISNUMBER(RC7)), AND(NOT(ISERROR(RC8)), ISNUMBER(RC8)), AND(NOT(ISERROR(RC9)), ISNUMBER(RC9)), AND(NOT(ISERROR(RC10)), ISNUMBER(RC10))), 1, 0) -> 0 | M214: =INDEX(Gross!R1C1:R46C51, RC1, 26) -> #REF! | N214: =INDEX(Gross!R1C1:R46C51, RC1, 27) -> #REF!
A215: 252 | B215: =INDEX(2001Grossed!R1C1:R46C51, RC[-1], 26) -> #REF! | C215: =INDEX(2001Grossed!R1C1:R46C51, RC1, 27) -> #REF! | D215: =IF(Menus!R9C10, RC[-1]/RC[-2], RC[-1]) -> #REF! | E215: =IF(RC11=1, RC[-3], NA()) -> #NA | F215: =INDEX(2001Grossed!R1C1:R46C51, RC1, 1) -> #REF! | G215: =IF(EQUAL(INDEX(2001Grossed!R1C1:R46C51, RC1, 2), R1C), RC4, NA()) -> #REF! | H215: =IF(EQUAL(INDEX(2001Grossed!R1C1:R46C51, RC1, 2), R1C), RC4, NA()) -> #REF! | I215: =IF(EQUAL(INDEX(2001Grossed!R1C1:R46C51, RC1, 2), R1C), RC4, NA()) -> #REF! | J215: =IF(EQUAL(INDEX(2001Grossed!R1C1:R46C51, RC1, 2), R1C), RC4, NA()) -> #REF! | K215: =IF(OR(AND(NOT(ISERROR(RC7)), ISNUMBER(RC7)), AND(NOT(ISERROR(RC8)), ISNUMBER(RC8)), AND(NOT(ISERROR(RC9)), ISNUMBER(RC9)), AND(NOT(ISERROR(RC10)), ISNUMBER(RC10))), 1, 0) -> 0 | M215: =INDEX(Gross!R1C1:R46C51, RC1, 26) -> #REF! | N215: =INDEX(Gross!R1C1:R46C51, RC1, 27) -> #REF!
A216: 253 | B216: =INDEX(2001Grossed!R1C1:R46C51, RC[-1], 26) -> #REF! | C216: =INDEX(2001Grossed!R1C1:R46C51, RC1, 27) -> #REF! | D216: =IF(Menus!R9C10, RC[-1]/RC[-2], RC[-1]) -> #REF! | E216: =IF(RC11=1, RC[-3], NA()) -> #NA | F216: =INDEX(2001Grossed!R1C1:R46C51, RC1, 1) -> #REF! | G216: =IF(EQUAL(INDEX(2001Grossed!R1C1:R46C51, RC1, 2), R1C), RC4, NA()) -> #REF! | H216: =IF(EQUAL(INDEX(2001Grossed!R1C1:R46C51, RC1, 2), R1C), RC4, NA()) -> #REF! | I216: =IF(EQUAL(INDEX(2001Grossed!R1C1:R46C51, RC1, 2), R1C), RC4, NA()) -> #REF! | J216: =IF(EQUAL(INDEX(2001Grossed!R1C1:R46C51, RC1, 2), R1C), RC4, NA()) -> #REF! | K216: =IF(OR(AND(NOT(ISERROR(RC7)), ISNUMBER(RC7)), AND(NOT(ISERROR(RC8)), ISNUMBER(RC8)), AND(NOT(ISERROR(RC9)), ISNUMBER(RC9)), AND(NOT(ISERROR(RC10)), ISNUMBER(RC10))), 1, 0) -> 0 | M216: =INDEX(Gross!R1C1:R46C51, RC1, 26) -> #REF! | N216: =INDEX(Gross!R1C1:R46C51, RC1, 27) -> #REF!
A217: 254 | B217: =INDEX(2001Grossed!R1C1:R46C51, RC[-1], 26) -> #REF! | C217: =INDEX(2001Grossed!R1C1:R46C51, RC1, 27) -> #REF! | D217: =IF(Menus!R9C10, RC[-1]/RC[-2], RC[-1]) -> #REF! | E217: =IF(RC11=1, RC[-3], NA()) -> #NA | F217: =INDEX(2001Grossed!R1C1:R46C51, RC1, 1) -> #REF! | G217: =IF(EQUAL(INDEX(2001Grossed!R1C1:R46C51, RC1, 2), R1C), RC4, NA()) -> #REF! | H217: =IF(EQUAL(INDEX(2001Grossed!R1C1:R46C51, RC1, 2), R1C), RC4, NA()) -> #REF! | I217: =IF(EQUAL(INDEX(2001Grossed!R1C1:R46C51, RC1, 2), R1C), RC4, NA()) -> #REF! | J217: =IF(EQUAL(INDEX(2001Grossed!R1C1:R46C51, RC1, 2), R1C), RC4, NA()) -> #REF! | K217: =IF(OR(AND(NOT(ISERROR(RC7)), ISNUMBER(RC7)), AND(NOT(ISERROR(RC8)), ISNUMBER(RC8)), AND(NOT(ISERROR(RC9)), ISNUMBER(RC9)), AND(NOT(ISERROR(RC10)), ISNUMBER(RC10))), 1, 0) -> 0 | M217: =INDEX(Gross!R1C1:R46C51, RC1, 26) -> #REF! | N217: =INDEX(Gross!R1C1:R46C51, RC1, 27) -> #REF!
A218: 255 | B218: =INDEX(2001Grossed!R1C1:R46C51, RC[-1], 26) -> #REF! | C218: =INDEX(2001Grossed!R1C1:R46C51, RC1, 27) -> #REF! | D218: =IF(Menus!R9C10, RC[-1]/RC[-2], RC[-1]) -> #REF! | E218: =IF(RC11=1, RC[-3], NA()) -> #NA | F218: =INDEX(2001Grossed!R1C1:R46C51, RC1, 1) -> #REF! | G218: =IF(EQUAL(INDEX(2001Grossed!R1C1:R46C51, RC1, 2), R1C), RC4, NA()) -> #REF! | H218: =IF(EQUAL(INDEX(2001Grossed!R1C1:R46C51, RC1, 2), R1C), RC4, NA()) -> #REF! | I218: =IF(EQUAL(INDEX(2001Grossed!R1C1:R46C51, RC1, 2), R1C), RC4, NA()) -> #REF! | J218: =IF(EQUAL(INDEX(2001Grossed!R1C1:R46C51, RC1, 2), R1C), RC4, NA()) -> #REF! | K218: =IF(OR(AND(NOT(ISERROR(RC7)), ISNUMBER(RC7)), AND(NOT(ISERROR(RC8)), ISNUMBER(RC8)), AND(NOT(ISERROR(RC9)), ISNUMBER(RC9)), AND(NOT(ISERROR(RC10)), ISNUMBER(RC10))), 1, 0) -> 0 | M218: =INDEX(Gross!R1C1:R46C51, RC1, 26) -> #REF! | N218: =INDEX(Gross!R1C1:R46C51, RC1, 27) -> #REF!
A219: 256 | B219: =INDEX(2001Grossed!R1C1:R46C51, RC[-1], 26) -> #REF! | C219: =INDEX(2001Grossed!R1C1:R46C51, RC1, 27) -> #REF! | D219: =IF(Menus!R9C10, RC[-1]/RC[-2], RC[-1]) -> #REF! | E219: =IF(RC11=1, RC[-3], NA()) -> #NA | F219: =INDEX(2001Grossed!R1C1:R46C51, RC1, 1) -> #REF! | G219: =IF(EQUAL(INDEX(2001Grossed!R1C1:R46C51, RC1, 2), R1C), RC4, NA()) -> #REF! | H219: =IF(EQUAL(INDEX(2001Grossed!R1C1:R46C51, RC1, 2), R1C), RC4, NA()) -> #REF! | I219: =IF(EQUAL(INDEX(2001Grossed!R1C1:R46C51, RC1, 2), R1C), RC4, NA()) -> #REF! | J219: =IF(EQUAL(INDEX(2001Grossed!R1C1:R46C51, RC1, 2), R1C), RC4, NA()) -> #REF! | K219: =IF(OR(AND(NOT(ISERROR(RC7)), ISNUMBER(RC7)), AND(NOT(ISERROR(RC8)), ISNUMBER(RC8)), AND(NOT(ISERROR(RC9)), ISNUMBER(RC9)), AND(NOT(ISERROR(RC10)), ISNUMBER(RC10))), 1, 0) -> 0 | M219: =INDEX(Gross!R1C1:R46C51, RC1, 26) -> #REF! | N219: =INDEX(Gross!R1C1:R46C51, RC1, 27) -> #REF!
A220: 257 | B220: =INDEX(2001Grossed!R1C1:R46C51, RC[-1], 26) -> #REF! | C220: =INDEX(2001Grossed!R1C1:R46C51, RC1, 27) -> #REF! | D220: =IF(Menus!R9C10, RC[-1]/RC[-2], RC[-1]) -> #REF! | E220: =IF(RC11=1, RC[-3], NA()) -> #NA | F220: =INDEX(2001Grossed!R1C1:R46C51, RC1, 1) -> #REF! | G220: =IF(EQUAL(INDEX(2001Grossed!R1C1:R46C51, RC1, 2), R1C), RC4, NA()) -> #REF! | H220: =IF(EQUAL(INDEX(2001Grossed!R1C1:R46C51, RC1, 2), R1C), RC4, NA()) -> #REF! | I220: =IF(EQUAL(INDEX(2001Grossed!R1C1:R46C51, RC1, 2), R1C), RC4, NA()) -> #REF! | J220: =IF(EQUAL(INDEX(2001Grossed!R1C1:R46C51, RC1, 2), R1C), RC4, NA()) -> #REF! | K220: =IF(OR(AND(NOT(ISERROR(RC7)), ISNUMBER(RC7)), AND(NOT(ISERROR(RC8)), ISNUMBER(RC8)), AND(NOT(ISERROR(RC9)), ISNUMBER(RC9)), AND(NOT(ISERROR(RC10)), ISNUMBER(RC10))), 1, 0) -> 0 | M220: =INDEX(Gross!R1C1:R46C51, RC1, 26) -> #REF! | N220: =INDEX(Gross!R1C1:R46C51, RC1, 27) -> #REF!
A221: 258 | B221: =INDEX(2001Grossed!R1C1:R46C51, RC[-1], 26) -> #REF! | C221: =INDEX(2001Grossed!R1C1:R46C51, RC1, 27) -> #REF! | D221: =IF(Menus!R9C10, RC[-1]/RC[-2], RC[-1]) -> #REF! | E221: =IF(RC11=1, RC[-3], NA()) -> #NA | F221: =INDEX(2001Grossed!R1C1:R46C51, RC1, 1) -> #REF! | G221: =IF(EQUAL(INDEX(2001Grossed!R1C1:R46C51, RC1, 2), R1C), RC4, NA()) -> #REF! | H221: =IF(EQUAL(INDEX(2001Grossed!R1C1:R46C51, RC1, 2), R1C), RC4, NA()) -> #REF! | I221: =IF(EQUAL(INDEX(2001Grossed!R1C1:R46C51, RC1, 2), R1C), RC4, NA()) -> #REF! | J221: =IF(EQUAL(INDEX(2001Grossed!R1C1:R46C51, RC1, 2), R1C), RC4, NA()) -> #REF! | K221: =IF(OR(AND(NOT(ISERROR(RC7)), ISNUMBER(RC7)), AND(NOT(ISERROR(RC8)), ISNUMBER(RC8)), AND(NOT(ISERROR(RC9)), ISNUMBER(RC9)), AND(NOT(ISERROR(RC10)), ISNUMBER(RC10))), 1, 0) -> 0 | M221: =INDEX(Gross!R1C1:R46C51, RC1, 26) -> #REF! | N221: =INDEX(Gross!R1C1:R46C51, RC1, 27) -> #REF!
A222: 259 | B222: =INDEX(2001Grossed!R1C1:R46C51, RC[-1], 26) -> #REF! | C222: =INDEX(2001Grossed!R1C1:R46C51, RC1, 27) -> #REF! | D222: =IF(Menus!R9C10, RC[-1]/RC[-2], RC[-1]) -> #REF! | E222: =IF(RC11=1, RC[-3], NA()) -> #NA | F222: =INDEX(2001Grossed!R1C1:R46C51, RC1, 1) -> #REF! | G222: =IF(EQUAL(INDEX(2001Grossed!R1C1:R46C51, RC1, 2), R1C), RC4, NA()) -> #REF! | H222: =IF(EQUAL(INDEX(2001Grossed!R1C1:R46C51, RC1, 2), R1C), RC4, NA()) -> #REF! | I222: =IF(EQUAL(INDEX(2001Grossed!R1C1:R46C51, RC1, 2), R1C), RC4, NA()) -> #REF! | J222: =IF(EQUAL(INDEX(2001Grossed!R1C1:R46C51, RC1, 2), R1C), RC4, NA()) -> #REF! | K222: =IF(OR(AND(NOT(ISERROR(RC7)), ISNUMBER(RC7)), AND(NOT(ISERROR(RC8)), ISNUMBER(RC8)), AND(NOT(ISERROR(RC9)), ISNUMBER(RC9)), AND(NOT(ISERROR(RC10)), ISNUMBER(RC10))), 1, 0) -> 0 | M222: =INDEX(Gross!R1C1:R46C51, RC1, 26) -> #REF! | N222: =INDEX(Gross!R1C1:R46C51, RC1, 27) -> #REF!
A223: 260 | B223: =INDEX(2001Grossed!R1C1:R46C51, RC[-1], 26) -> #REF! | C223: =INDEX(2001Grossed!R1C1:R46C51, RC1, 27) -> #REF! | D223: =IF(Menus!R9C10, RC[-1]/RC[-2], RC[-1]) -> #REF! | E223: =IF(RC11=1, RC[-3], NA()) -> #NA | F223: =INDEX(2001Grossed!R1C1:R46C51, RC1, 1) -> #REF! | G223: =IF(EQUAL(INDEX(2001Grossed!R1C1:R46C51, RC1, 2), R1C), RC4, NA()) -> #REF! | H223: =IF(EQUAL(INDEX(2001Grossed!R1C1:R46C51, RC1, 2), R1C), RC4, NA()) -> #REF! | I223: =IF(EQUAL(INDEX(2001Grossed!R1C1:R46C51, RC1, 2), R1C), RC4, NA()) -> #REF! | J223: =IF(EQUAL(INDEX(2001Grossed!R1C1:R46C51, RC1, 2), R1C), RC4, NA()) -> #REF! | K223: =IF(OR(AND(NOT(ISERROR(RC7)), ISNUMBER(RC7)), AND(NOT(ISERROR(RC8)), ISNUMBER(RC8)), AND(NOT(ISERROR(RC9)), ISNUMBER(RC9)), AND(NOT(ISERROR(RC10)), ISNUMBER(RC10))), 1, 0) -> 0 | M223: =INDEX(Gross!R1C1:R46C51, RC1, 26) -> #REF! | N223: =INDEX(Gross!R1C1:R46C51, RC1, 27) -> #REF!
A224: 261 | B224: =INDEX(2001Grossed!R1C1:R46C51, RC[-1], 26) -> #REF! | C224: =INDEX(2001Grossed!R1C1:R46C51, RC1, 27) -> #REF! | D224: =IF(Menus!R9C10, RC[-1]/RC[-2], RC[-1]) -> #REF! | E224: =IF(RC11=1, RC[-3], NA()) -> #NA | F224: =INDEX(2001Grossed!R1C1:R46C51, RC1, 1) -> #REF! | G224: =IF(EQUAL(INDEX(2001Grossed!R1C1:R46C51, RC1, 2), R1C), RC4, NA()) -> #REF! | H224: =IF(EQUAL(INDEX(2001Grossed!R1C1:R46C51, RC1, 2), R1C), RC4, NA()) -> #REF! | I224: =IF(EQUAL(INDEX(2001Grossed!R1C1:R46C51, RC1, 2), R1C), RC4, NA()) -> #REF! | J224: =IF(EQUAL(INDEX(2001Grossed!R1C1:R46C51, RC1, 2), R1C), RC4, NA()) -> #REF! | K224: =IF(OR(AND(NOT(ISERROR(RC7)), ISNUMBER(RC7)), AND(NOT(ISERROR(RC8)), ISNUMBER(RC8)), AND(NOT(ISERROR(RC9)), ISNUMBER(RC9)), AND(NOT(ISERROR(RC10)), ISNUMBER(RC10))), 1, 0) -> 0 | M224: =INDEX(Gross!R1C1:R46C51, RC1, 26) -> #REF! | N224: =INDEX(Gross!R1C1:R46C51, RC1, 27) -> #REF!
A225: 262 | B225: =INDEX(2001Grossed!R1C1:R46C51, RC[-1], 26) -> #REF! | C225: =INDEX(2001Grossed!R1C1:R46C51, RC1, 27) -> #REF! | D225: =IF(Menus!R9C10, RC[-1]/RC[-2], RC[-1]) -> #REF! | E225: =IF(RC11=1, RC[-3], NA()) -> #NA | F225: =INDEX(2001Grossed!R1C1:R46C51, RC1, 1) -> #REF! | G225: =IF(EQUAL(INDEX(2001Grossed!R1C1:R46C51, RC1, 2), R1C), RC4, NA()) -> #REF! | H225: =IF(EQUAL(INDEX(2001Grossed!R1C1:R46C51, RC1, 2), R1C), RC4, NA()) -> #REF! | I225: =IF(EQUAL(INDEX(2001Grossed!R1C1:R46C51, RC1, 2), R1C), RC4, NA()) -> #REF! | J225: =IF(EQUAL(INDEX(2001Grossed!R1C1:R46C51, RC1, 2), R1C), RC4, NA()) -> #REF! | K225: =IF(OR(AND(NOT(ISERROR(RC7)), ISNUMBER(RC7)), AND(NOT(ISERROR(RC8)), ISNUMBER(RC8)), AND(NOT(ISERROR(RC9)), ISNUMBER(RC9)), AND(NOT(ISERROR(RC10)), ISNUMBER(RC10))), 1, 0) -> 0 | M225: =INDEX(Gross!R1C1:R46C51, RC1, 26) -> #REF! | N225: =INDEX(Gross!R1C1:R46C51, RC1, 27) -> #REF!
A226: 263 | B226: =INDEX(2001Grossed!R1C1:R46C51, RC[-1], 26) -> #REF! | C226: =INDEX(2001Grossed!R1C1:R46C51, RC1, 27) -> #REF! | D226: =IF(Menus!R9C10, RC[-1]/RC[-2], RC[-1]) -> #REF! | E226: =IF(RC11=1, RC[-3], NA()) -> #NA | F226: =INDEX(2001Grossed!R1C1:R46C51, RC1, 1) -> #REF! | G226: =IF(EQUAL(INDEX(2001Grossed!R1C1:R46C51, RC1, 2), R1C), RC4, NA()) -> #REF! | H226: =IF(EQUAL(INDEX(2001Grossed!R1C1:R46C51, RC1, 2), R1C), RC4, NA()) -> #REF! | I226: =IF(EQUAL(INDEX(2001Grossed!R1C1:R46C51, RC1, 2), R1C), RC4, NA()) -> #REF! | J226: =IF(EQUAL(INDEX(2001Grossed!R1C1:R46C51, RC1, 2), R1C), RC4, NA()) -> #REF! | K226: =IF(OR(AND(NOT(ISERROR(RC7)), ISNUMBER(RC7)), AND(NOT(ISERROR(RC8)), ISNUMBER(RC8)), AND(NOT(ISERROR(RC9)), ISNUMBER(RC9)), AND(NOT(ISERROR(RC10)), ISNUMBER(RC10))), 1, 0) -> 0 | M226: =INDEX(Gross!R1C1:R46C51, RC1, 26) -> #REF! | N226: =INDEX(Gross!R1C1:R46C51, RC1, 27) -> #REF!
A227: 264 | B227: =INDEX(2001Grossed!R1C1:R46C51, RC[-1], 26) -> #REF! | C227: =INDEX(2001Grossed!R1C1:R46C51, RC1, 27) -> #REF! | D227: =IF(Menus!R9C10, RC[-1]/RC[-2], RC[-1]) -> #REF! | E227: =IF(RC11=1, RC[-3], NA()) -> #NA | F227: =INDEX(2001Grossed!R1C1:R46C51, RC1, 1) -> #REF! | G227: =IF(EQUAL(INDEX(2001Grossed!R1C1:R46C51, RC1, 2), R1C), RC4, NA()) -> #REF! | H227: =IF(EQUAL(INDEX(2001Grossed!R1C1:R46C51, RC1, 2), R1C), RC4, NA()) -> #REF! | I227: =IF(EQUAL(INDEX(2001Grossed!R1C1:R46C51, RC1, 2), R1C), RC4, NA()) -> #REF! | J227: =IF(EQUAL(INDEX(2001Grossed!R1C1:R46C51, RC1, 2), R1C), RC4, NA()) -> #REF! | K227: =IF(OR(AND(NOT(ISERROR(RC7)), ISNUMBER(RC7)), AND(NOT(ISERROR(RC8)), ISNUMBER(RC8)), AND(NOT(ISERROR(RC9)), ISNUMBER(RC9)), AND(NOT(ISERROR(RC10)), ISNUMBER(RC10))), 1, 0) -> 0 | M227: =INDEX(Gross!R1C1:R46C51, RC1, 26) -> #REF! | N227: =INDEX(Gross!R1C1:R46C51, RC1, 27) -> #REF!
A228: 265 | B228: =INDEX(2001Grossed!R1C1:R46C51, RC[-1], 26) -> #REF! | C228: =INDEX(2001Grossed!R1C1:R46C51, RC1, 27) -> #REF! | D228: =IF(Menus!R9C10, RC[-1]/RC[-2], RC[-1]) -> #REF! | E228: =IF(RC11=1, RC[-3], NA()) -> #NA | F228: =INDEX(2001Grossed!R1C1:R46C51, RC1, 1) -> #REF! | G228: =IF(EQUAL(INDEX(2001Grossed!R1C1:R46C51, RC1, 2), R1C), RC4, NA()) -> #REF! | H228: =IF(EQUAL(INDEX(2001Grossed!R1C1:R46C51, RC1, 2), R1C), RC4, NA()) -> #REF! | I228: =IF(EQUAL(INDEX(2001Grossed!R1C1:R46C51, RC1, 2), R1C), RC4, NA()) -> #REF! | J228: =IF(EQUAL(INDEX(2001Grossed!R1C1:R46C51, RC1, 2), R1C), RC4, NA()) -> #REF! | K228: =IF(OR(AND(NOT(ISERROR(RC7)), ISNUMBER(RC7)), AND(NOT(ISERROR(RC8)), ISNUMBER(RC8)), AND(NOT(ISERROR(RC9)), ISNUMBER(RC9)), AND(NOT(ISERROR(RC10)), ISNUMBER(RC10))), 1, 0) -> 0 | M228: =INDEX(Gross!R1C1:R46C51, RC1, 26) -> #REF! | N228: =INDEX(Gross!R1C1:R46C51, RC1, 27) -> #REF!
A229: 266 | B229: =INDEX(2001Grossed!R1C1:R46C51, RC[-1], 26) -> #REF! | C229: =INDEX(2001Grossed!R1C1:R46C51, RC1, 27) -> #REF! | D229: =IF(Menus!R9C10, RC[-1]/RC[-2], RC[-1]) -> #REF! | E229: =IF(RC11=1, RC[-3], NA()) -> #NA | F229: =INDEX(2001Grossed!R1C1:R46C51, RC1, 1) -> #REF! | G229: =IF(EQUAL(INDEX(2001Grossed!R1C1:R46C51, RC1, 2), R1C), RC4, NA()) -> #REF! | H229: =IF(EQUAL(INDEX(2001Grossed!R1C1:R46C51, RC1, 2), R1C), RC4, NA()) -> #REF! | I229: =IF(EQUAL(INDEX(2001Grossed!R1C1:R46C51, RC1, 2), R1C), RC4, NA()) -> #REF! | J229: =IF(EQUAL(INDEX(2001Grossed!R1C1:R46C51, RC1, 2), R1C), RC4, NA()) -> #REF! | K229: =IF(OR(AND(NOT(ISERROR(RC7)), ISNUMBER(RC7)), AND(NOT(ISERROR(RC8)), ISNUMBER(RC8)), AND(NOT(ISERROR(RC9)), ISNUMBER(RC9)), AND(NOT(ISERROR(RC10)), ISNUMBER(RC10))), 1, 0) -> 0 | M229: =INDEX(Gross!R1C1:R46C51, RC1, 26) -> #REF! | N229: =INDEX(Gross!R1C1:R46C51, RC1, 27) -> #REF!
A230: 267 | B230: =INDEX(2001Grossed!R1C1:R46C51, RC[-1], 26) -> #REF! | C230: =INDEX(2001Grossed!R1C1:R46C51, RC1, 27) -> #REF! | D230: =IF(Menus!R9C10, RC[-1]/RC[-2], RC[-1]) -> #REF! | E230: =IF(RC11=1, RC[-3], NA()) -> #NA | F230: =INDEX(2001Grossed!R1C1:R46C51, RC1, 1) -> #REF! | G230: =IF(EQUAL(INDEX(2001Grossed!R1C1:R46C51, RC1, 2), R1C), RC4, NA()) -> #REF! | H230: =IF(EQUAL(INDEX(2001Grossed!R1C1:R46C51, RC1, 2), R1C), RC4, NA()) -> #REF! | I230: =IF(EQUAL(INDEX(2001Grossed!R1C1:R46C51, RC1, 2), R1C), RC4, NA()) -> #REF! | J230: =IF(EQUAL(INDEX(2001Grossed!R1C1:R46C51, RC1, 2), R1C), RC4, NA()) -> #REF! | K230: =IF(OR(AND(NOT(ISERROR(RC7)), ISNUMBER(RC7)), AND(NOT(ISERROR(RC8)), ISNUMBER(RC8)), AND(NOT(ISERROR(RC9)), ISNUMBER(RC9)), AND(NOT(ISERROR(RC10)), ISNUMBER(RC10))), 1, 0) -> 0 | M230: =INDEX(Gross!R1C1:R46C51, RC1, 26) -> #REF! | N230: =INDEX(Gross!R1C1:R46C51, RC1, 27) -> #REF!
A231: 268 | B231: =INDEX(2001Grossed!R1C1:R46C51, RC[-1], 26) -> #REF! | C231: =INDEX(2001Grossed!R1C1:R46C51, RC1, 27) -> #REF! | D231: =IF(Menus!R9C10, RC[-1]/RC[-2], RC[-1]) -> #REF! | E231: =IF(RC11=1, RC[-3], NA()) -> #NA | F231: =INDEX(2001Grossed!R1C1:R46C51, RC1, 1) -> #REF! | G231: =IF(EQUAL(INDEX(2001Grossed!R1C1:R46C51, RC1, 2), R1C), RC4, NA()) -> #REF! | H231: =IF(EQUAL(INDEX(2001Grossed!R1C1:R46C51, RC1, 2), R1C), RC4, NA()) -> #REF! | I231: =IF(EQUAL(INDEX(2001Grossed!R1C1:R46C51, RC1, 2), R1C), RC4, NA()) -> #REF! | J231: =IF(EQUAL(INDEX(2001Grossed!R1C1:R46C51, RC1, 2), R1C), RC4, NA()) -> #REF! | K231: =IF(OR(AND(NOT(ISERROR(RC7)), ISNUMBER(RC7)), AND(NOT(ISERROR(RC8)), ISNUMBER(RC8)), AND(NOT(ISERROR(RC9)), ISNUMBER(RC9)), AND(NOT(ISERROR(RC10)), ISNUMBER(RC10))), 1, 0) -> 0 | M231: =INDEX(Gross!R1C1:R46C51, RC1, 26) -> #REF! | N231: =INDEX(Gross!R1C1:R46C51, RC1, 27) -> #REF!
A232: 269 | B232: =INDEX(2001Grossed!R1C1:R46C51, RC[-1], 26) -> #REF! | C232: =INDEX(2001Grossed!R1C1:R46C51, RC1, 27) -> #REF! | D232: =IF(Menus!R9C10, RC[-1]/RC[-2], RC[-1]) -> #REF! | E232: =IF(RC11=1, RC[-3], NA()) -> #NA | F232: =INDEX(2001Grossed!R1C1:R46C51, RC1, 1) -> #REF! | G232: =IF(EQUAL(INDEX(2001Grossed!R1C1:R46C51, RC1, 2), R1C), RC4, NA()) -> #REF! | H232: =IF(EQUAL(INDEX(2001Grossed!R1C1:R46C51, RC1, 2), R1C), RC4, NA()) -> #REF! | I232: =IF(EQUAL(INDEX(2001Grossed!R1C1:R46C51, RC1, 2), R1C), RC4, NA()) -> #REF! | J232: =IF(EQUAL(INDEX(2001Grossed!R1C1:R46C51, RC1, 2), R1C), RC4, NA()) -> #REF! | K232: =IF(OR(AND(NOT(ISERROR(RC7)), ISNUMBER(RC7)), AND(NOT(ISERROR(RC8)), ISNUMBER(RC8)), AND(NOT(ISERROR(RC9)), ISNUMBER(RC9)), AND(NOT(ISERROR(RC10)), ISNUMBER(RC10))), 1, 0) -> 0 | M232: =INDEX(Gross!R1C1:R46C51, RC1, 26) -> #REF! | N232: =INDEX(Gross!R1C1:R46C51, RC1, 27) -> #REF!
A233: 270 | B233: =INDEX(2001Grossed!R1C1:R46C51, RC[-1], 26) -> #REF! | C233: =INDEX(2001Grossed!R1C1:R46C51, RC1, 27) -> #REF! | D233: =IF(Menus!R9C10, RC[-1]/RC[-2], RC[-1]) -> #REF! | E233: =IF(RC11=1, RC[-3], NA()) -> #NA | F233: =INDEX(2001Grossed!R1C1:R46C51, RC1, 1) -> #REF! | G233: =IF(EQUAL(INDEX(2001Grossed!R1C1:R46C51, RC1, 2), R1C), RC4, NA()) -> #REF! | H233: =IF(EQUAL(INDEX(2001Grossed!R1C1:R46C51, RC1, 2), R1C), RC4, NA()) -> #REF! | I233: =IF(EQUAL(INDEX(2001Grossed!R1C1:R46C51, RC1, 2), R1C), RC4, NA()) -> #REF! | J233: =IF(EQUAL(INDEX(2001Grossed!R1C1:R46C51, RC1, 2), R1C), RC4, NA()) -> #REF! | K233: =IF(OR(AND(NOT(ISERROR(RC7)), ISNUMBER(RC7)), AND(NOT(ISERROR(RC8)), ISNUMBER(RC8)), AND(NOT(ISERROR(RC9)), ISNUMBER(RC9)), AND(NOT(ISERROR(RC10)), ISNUMBER(RC10))), 1, 0) -> 0 | M233: =INDEX(Gross!R1C1:R46C51, RC1, 26) -> #REF! | N233: =INDEX(Gross!R1C1:R46C51, RC1, 27) -> #REF!
A234: 271 | B234: =INDEX(2001Grossed!R1C1:R46C51, RC[-1], 26) -> #REF! | C234: =INDEX(2001Grossed!R1C1:R46C51, RC1, 27) -> #REF! | D234: =IF(Menus!R9C10, RC[-1]/RC[-2], RC[-1]) -> #REF! | E234: =IF(RC11=1, RC[-3], NA()) -> #NA | F234: =INDEX(2001Grossed!R1C1:R46C51, RC1, 1) -> #REF! | G234: =IF(EQUAL(INDEX(2001Grossed!R1C1:R46C51, RC1, 2), R1C), RC4, NA()) -> #REF! | H234: =IF(EQUAL(INDEX(2001Grossed!R1C1:R46C51, RC1, 2), R1C), RC4, NA()) -> #REF! | I234: =IF(EQUAL(INDEX(2001Grossed!R1C1:R46C51, RC1, 2), R1C), RC4, NA()) -> #REF! | J234: =IF(EQUAL(INDEX(2001Grossed!R1C1:R46C51, RC1, 2), R1C), RC4, NA()) -> #REF! | K234: =IF(OR(AND(NOT(ISERROR(RC7)), ISNUMBER(RC7)), AND(NOT(ISERROR(RC8)), ISNUMBER(RC8)), AND(NOT(ISERROR(RC9)), ISNUMBER(RC9)), AND(NOT(ISERROR(RC10)), ISNUMBER(RC10))), 1, 0) -> 0 | M234: =INDEX(Gross!R1C1:R46C51, RC1, 26) -> #REF! | N234: =INDEX(Gross!R1C1:R46C51, RC1, 27) -> #REF!
A235: 272 | B235: =INDEX(2001Grossed!R1C1:R46C51, RC[-1], 26) -> #REF! | C235: =INDEX(2001Grossed!R1C1:R46C51, RC1, 27) -> #REF! | D235: =IF(Menus!R9C10, RC[-1]/RC[-2], RC[-1]) -> #REF! | E235: =IF(RC11=1, RC[-3], NA()) -> #NA | F235: =INDEX(2001Grossed!R1C1:R46C51, RC1, 1) -> #REF! | G235: =IF(EQUAL(INDEX(2001Grossed!R1C1:R46C51, RC1, 2), R1C), RC4, NA()) -> #REF! | H235: =IF(EQUAL(INDEX(2001Grossed!R1C1:R46C51, RC1, 2), R1C), RC4, NA()) -> #REF! | I235: =IF(EQUAL(INDEX(2001Grossed!R1C1:R46C51, RC1, 2), R1C), RC4, NA()) -> #REF! | J235: =IF(EQUAL(INDEX(2001Grossed!R1C1:R46C51, RC1, 2), R1C), RC4, NA()) -> #REF! | K235: =IF(OR(AND(NOT(ISERROR(RC7)), ISNUMBER(RC7)), AND(NOT(ISERROR(RC8)), ISNUMBER(RC8)), AND(NOT(ISERROR(RC9)), ISNUMBER(RC9)), AND(NOT(ISERROR(RC10)), ISNUMBER(RC10))), 1, 0) -> 0 | M235: =INDEX(Gross!R1C1:R46C51, RC1, 26) -> #REF! | N235: =INDEX(Gross!R1C1:R46C51, RC1, 27) -> #REF!
A236: 273 | B236: =INDEX(2001Grossed!R1C1:R46C51, RC[-1], 26) -> #REF! | C236: =INDEX(2001Grossed!R1C1:R46C51, RC1, 27) -> #REF! | D236: =IF(Menus!R9C10, RC[-1]/RC[-2], RC[-1]) -> #REF! | E236: =IF(RC11=1, RC[-3], NA()) -> #NA | F236: =INDEX(2001Grossed!R1C1:R46C51, RC1, 1) -> #REF! | G236: =IF(EQUAL(INDEX(2001Grossed!R1C1:R46C51, RC1, 2), R1C), RC4, NA()) -> #REF! | H236: =IF(EQUAL(INDEX(2001Grossed!R1C1:R46C51, RC1, 2), R1C), RC4, NA()) -> #REF! | I236: =IF(EQUAL(INDEX(2001Grossed!R1C1:R46C51, RC1, 2), R1C), RC4, NA()) -> #REF! | J236: =IF(EQUAL(INDEX(2001Grossed!R1C1:R46C51, RC1, 2), R1C), RC4, NA()) -> #REF! | K236: =IF(OR(AND(NOT(ISERROR(RC7)), ISNUMBER(RC7)), AND(NOT(ISERROR(RC8)), ISNUMBER(RC8)), AND(NOT(ISERROR(RC9)), ISNUMBER(RC9)), AND(NOT(ISERROR(RC10)), ISNUMBER(RC10))), 1, 0) -> 0 | M236: =INDEX(Gross!R1C1:R46C51, RC1, 26) -> #REF! | N236: =INDEX(Gross!R1C1:R46C51, RC1, 27) -> #REF!
A237: 274 | B237: =INDEX(2001Grossed!R1C1:R46C51, RC[-1], 26) -> #REF! | C237: =INDEX(2001Grossed!R1C1:R46C51, RC1, 27) -> #REF! | D237: =IF(Menus!R9C10, RC[-1]/RC[-2], RC[-1]) -> #REF! | E237: =IF(RC11=1, RC[-3], NA()) -> #NA | F237: =INDEX(2001Grossed!R1C1:R46C51, RC1, 1) -> #REF! | G237: =IF(EQUAL(INDEX(2001Grossed!R1C1:R46C51, RC1, 2), R1C), RC4, NA()) -> #REF! | H237: =IF(EQUAL(INDEX(2001Grossed!R1C1:R46C51, RC1, 2), R1C), RC4, NA()) -> #REF! | I237: =IF(EQUAL(INDEX(2001Grossed!R1C1:R46C51, RC1, 2), R1C), RC4, NA()) -> #REF! | J237: =IF(EQUAL(INDEX(2001Grossed!R1C1:R46C51, RC1, 2), R1C), RC4, NA()) -> #REF! | K237: =IF(OR(AND(NOT(ISERROR(RC7)), ISNUMBER(RC7)), AND(NOT(ISERROR(RC8)), ISNUMBER(RC8)), AND(NOT(ISERROR(RC9)), ISNUMBER(RC9)), AND(NOT(ISERROR(RC10)), ISNUMBER(RC10))), 1, 0) -> 0 | M237: =INDEX(Gross!R1C1:R46C51, RC1, 26) -> #REF! | N237: =INDEX(Gross!R1C1:R46C51, RC1, 27) -> #REF!
A238: 275 | B238: =INDEX(2001Grossed!R1C1:R46C51, RC[-1], 26) -> #REF! | C238: =INDEX(2001Grossed!R1C1:R46C51, RC1, 27) -> #REF! | D238: =IF(Menus!R9C10, RC[-1]/RC[-2], RC[-1]) -> #REF! | E238: =IF(RC11=1, RC[-3], NA()) -> #NA | F238: =INDEX(2001Grossed!R1C1:R46C51, RC1, 1) -> #REF! | G238: =IF(EQUAL(INDEX(2001Grossed!R1C1:R46C51, RC1, 2), R1C), RC4, NA()) -> #REF! | H238: =IF(EQUAL(INDEX(2001Grossed!R1C1:R46C51, RC1, 2), R1C), RC4, NA()) -> #REF! | I238: =IF(EQUAL(INDEX(2001Grossed!R1C1:R46C51, RC1, 2), R1C), RC4, NA()) -> #REF! | J238: =IF(EQUAL(INDEX(2001Grossed!R1C1:R46C51, RC1, 2), R1C), RC4, NA()) -> #REF! | K238: =IF(OR(AND(NOT(ISERROR(RC7)), ISNUMBER(RC7)), AND(NOT(ISERROR(RC8)), ISNUMBER(RC8)), AND(NOT(ISERROR(RC9)), ISNUMBER(RC9)), AND(NOT(ISERROR(RC10)), ISNUMBER(RC10))), 1, 0) -> 0 | M238: =INDEX(Gross!R1C1:R46C51, RC1, 26) -> #REF! | N238: =INDEX(Gross!R1C1:R46C51, RC1, 27) -> #REF!
A239: 276 | B239: =INDEX(2001Grossed!R1C1:R46C51, RC[-1], 26) -> #REF! | C239: =INDEX(2001Grossed!R1C1:R46C51, RC1, 27) -> #REF! | D239: =IF(Menus!R9C10, RC[-1]/RC[-2], RC[-1]) -> #REF! | E239: =IF(RC11=1, RC[-3], NA()) -> #NA | F239: =INDEX(2001Grossed!R1C1:R46C51, RC1, 1) -> #REF! | G239: =IF(EQUAL(INDEX(2001Grossed!R1C1:R46C51, RC1, 2), R1C), RC4, NA()) -> #REF! | H239: =IF(EQUAL(INDEX(2001Grossed!R1C1:R46C51, RC1, 2), R1C), RC4, NA()) -> #REF! | I239: =IF(EQUAL(INDEX(2001Grossed!R1C1:R46C51, RC1, 2), R1C), RC4, NA()) -> #REF! | J239: =IF(EQUAL(INDEX(2001Grossed!R1C1:R46C51, RC1, 2), R1C), RC4, NA()) -> #REF! | K239: =IF(OR(AND(NOT(ISERROR(RC7)), ISNUMBER(RC7)), AND(NOT(ISERROR(RC8)), ISNUMBER(RC8)), AND(NOT(ISERROR(RC9)), ISNUMBER(RC9)), AND(NOT(ISERROR(RC10)), ISNUMBER(RC10))), 1, 0) -> 0 | M239: =INDEX(Gross!R1C1:R46C51, RC1, 26) -> #REF! | N239: =INDEX(Gross!R1C1:R46C51, RC1, 27) -> #REF!
A240: 277 | B240: =INDEX(2001Grossed!R1C1:R46C51, RC[-1], 26) -> #REF! | C240: =INDEX(2001Grossed!R1C1:R46C51, RC1, 27) -> #REF! | D240: =IF(Menus!R9C10, RC[-1]/RC[-2], RC[-1]) -> #REF! | E240: =IF(RC11=1, RC[-3], NA()) -> #NA | F240: =INDEX(2001Grossed!R1C1:R46C51, RC1, 1) -> #REF! | G240: =IF(EQUAL(INDEX(2001Grossed!R1C1:R46C51, RC1, 2), R1C), RC4, NA()) -> #REF! | H240: =IF(EQUAL(INDEX(2001Grossed!R1C1:R46C51, RC1, 2), R1C), RC4, NA()) -> #REF! | I240: =IF(EQUAL(INDEX(2001Grossed!R1C1:R46C51, RC1, 2), R1C), RC4, NA()) -> #REF! | J240: =IF(EQUAL(INDEX(2001Grossed!R1C1:R46C51, RC1, 2), R1C), RC4, NA()) -> #REF! | K240: =IF(OR(AND(NOT(ISERROR(RC7)), ISNUMBER(RC7)), AND(NOT(ISERROR(RC8)), ISNUMBER(RC8)), AND(NOT(ISERROR(RC9)), ISNUMBER(RC9)), AND(NOT(ISERROR(RC10)), ISNUMBER(RC10))), 1, 0) -> 0 | M240: =INDEX(Gross!R1C1:R46C51, RC1, 26) -> #REF! | N240: =INDEX(Gross!R1C1:R46C51, RC1, 27) -> #REF!
A241: 278 | B241: =INDEX(2001Grossed!R1C1:R46C51, RC[-1], 26) -> #REF! | C241: =INDEX(2001Grossed!R1C1:R46C51, RC1, 27) -> #REF! | D241: =IF(Menus!R9C10, RC[-1]/RC[-2], RC[-1]) -> #REF! | E241: =IF(RC11=1, RC[-3], NA()) -> #NA | F241: =INDEX(2001Grossed!R1C1:R46C51, RC1, 1) -> #REF! | G241: =IF(EQUAL(INDEX(2001Grossed!R1C1:R46C51, RC1, 2), R1C), RC4, NA()) -> #REF! | H241: =IF(EQUAL(INDEX(2001Grossed!R1C1:R46C51, RC1, 2), R1C), RC4, NA()) -> #REF! | I241: =IF(EQUAL(INDEX(2001Grossed!R1C1:R46C51, RC1, 2), R1C), RC4, NA()) -> #REF! | J241: =IF(EQUAL(INDEX(2001Grossed!R1C1:R46C51, RC1, 2), R1C), RC4, NA()) -> #REF! | K241: =IF(OR(AND(NOT(ISERROR(RC7)), ISNUMBER(RC7)), AND(NOT(ISERROR(RC8)), ISNUMBER(RC8)), AND(NOT(ISERROR(RC9)), ISNUMBER(RC9)), AND(NOT(ISERROR(RC10)), ISNUMBER(RC10))), 1, 0) -> 0 | M241: =INDEX(Gross!R1C1:R46C51, RC1, 26) -> #REF! | N241: =INDEX(Gross!R1C1:R46C51, RC1, 27) -> #REF!
A242: 279 | B242: =INDEX(2001Grossed!R1C1:R46C51, RC[-1], 26) -> #REF! | C242: =INDEX(2001Grossed!R1C1:R46C51, RC1, 27) -> #REF! | D242: =IF(Menus!R9C10, RC[-1]/RC[-2], RC[-1]) -> #REF! | E242: =IF(RC11=1, RC[-3], NA()) -> #NA | F242: =INDEX(2001Grossed!R1C1:R46C51, RC1, 1) -> #REF! | G242: =IF(EQUAL(INDEX(2001Grossed!R1C1:R46C51, RC1, 2), R1C), RC4, NA()) -> #REF! | H242: =IF(EQUAL(INDEX(2001Grossed!R1C1:R46C51, RC1, 2), R1C), RC4, NA()) -> #REF! | I242: =IF(EQUAL(INDEX(2001Grossed!R1C1:R46C51, RC1, 2), R1C), RC4, NA()) -> #REF! | J242: =IF(EQUAL(INDEX(2001Grossed!R1C1:R46C51, RC1, 2), R1C), RC4, NA()) -> #REF! | K242: =IF(OR(AND(NOT(ISERROR(RC7)), ISNUMBER(RC7)), AND(NOT(ISERROR(RC8)), ISNUMBER(RC8)), AND(NOT(ISERROR(RC9)), ISNUMBER(RC9)), AND(NOT(ISERROR(RC10)), ISNUMBER(RC10))), 1, 0) -> 0 | M242: =INDEX(Gross!R1C1:R46C51, RC1, 26) -> #REF! | N242: =INDEX(Gross!R1C1:R46C51, RC1, 27) -> #REF!
A243: 280 | B243: =INDEX(2001Grossed!R1C1:R46C51, RC[-1], 26) -> #REF! | C243: =INDEX(2001Grossed!R1C1:R46C51, RC1, 27) -> #REF! | D243: =IF(Menus!R9C10, RC[-1]/RC[-2], RC[-1]) -> #REF! | E243: =IF(RC11=1, RC[-3], NA()) -> #NA | F243: =INDEX(2001Grossed!R1C1:R46C51, RC1, 1) -> #REF! | G243: =IF(EQUAL(INDEX(2001Grossed!R1C1:R46C51, RC1, 2), R1C), RC4, NA()) -> #REF! | H243: =IF(EQUAL(INDEX(2001Grossed!R1C1:R46C51, RC1, 2), R1C), RC4, NA()) -> #REF! | I243: =IF(EQUAL(INDEX(2001Grossed!R1C1:R46C51, RC1, 2), R1C), RC4, NA()) -> #REF! | J243: =IF(EQUAL(INDEX(2001Grossed!R1C1:R46C51, RC1, 2), R1C), RC4, NA()) -> #REF! | K243: =IF(OR(AND(NOT(ISERROR(RC7)), ISNUMBER(RC7)), AND(NOT(ISERROR(RC8)), ISNUMBER(RC8)), AND(NOT(ISERROR(RC9)), ISNUMBER(RC9)), AND(NOT(ISERROR(RC10)), ISNUMBER(RC10))), 1, 0) -> 0 | M243: =INDEX(Gross!R1C1:R46C51, RC1, 26) -> #REF! | N243: =INDEX(Gross!R1C1:R46C51, RC1, 27) -> #REF!
A244: 281 | B244: =INDEX(2001Grossed!R1C1:R46C51, RC[-1], 26) -> #REF! | C244: =INDEX(2001Grossed!R1C1:R46C51, RC1, 27) -> #REF! | D244: =IF(Menus!R9C10, RC[-1]/RC[-2], RC[-1]) -> #REF! | E244: =IF(RC11=1, RC[-3], NA()) -> #NA | F244: =INDEX(2001Grossed!R1C1:R46C51, RC1, 1) -> #REF! | G244: =IF(EQUAL(INDEX(2001Grossed!R1C1:R46C51, RC1, 2), R1C), RC4, NA()) -> #REF! | H244: =IF(EQUAL(INDEX(2001Grossed!R1C1:R46C51, RC1, 2), R1C), RC4, NA()) -> #REF! | I244: =IF(EQUAL(INDEX(2001Grossed!R1C1:R46C51, RC1, 2), R1C), RC4, NA()) -> #REF! | J244: =IF(EQUAL(INDEX(2001Grossed!R1C1:R46C51, RC1, 2), R1C), RC4, NA()) -> #REF! | K244: =IF(OR(AND(NOT(ISERROR(RC7)), ISNUMBER(RC7)), AND(NOT(ISERROR(RC8)), ISNUMBER(RC8)), AND(NOT(ISERROR(RC9)), ISNUMBER(RC9)), AND(NOT(ISERROR(RC10)), ISNUMBER(RC10))), 1, 0) -> 0 | M244: =INDEX(Gross!R1C1:R46C51, RC1, 26) -> #REF! | N244: =INDEX(Gross!R1C1:R46C51, RC1, 27) -> #REF!
A245: 282 | B245: =INDEX(2001Grossed!R1C1:R46C51, RC[-1], 26) -> #REF! | C245: =INDEX(2001Grossed!R1C1:R46C51, RC1, 27) -> #REF! | D245: =IF(Menus!R9C10, RC[-1]/RC[-2], RC[-1]) -> #REF! | E245: =IF(RC11=1, RC[-3], NA()) -> #NA | F245: =INDEX(2001Grossed!R1C1:R46C51, RC1, 1) -> #REF! | G245: =IF(EQUAL(INDEX(2001Grossed!R1C1:R46C51, RC1, 2), R1C), RC4, NA()) -> #REF! | H245: =IF(EQUAL(INDEX(2001Grossed!R1C1:R46C51, RC1, 2), R1C), RC4, NA()) -> #REF! | I245: =IF(EQUAL(INDEX(2001Grossed!R1C1:R46C51, RC1, 2), R1C), RC4, NA()) -> #REF! | J245: =IF(EQUAL(INDEX(2001Grossed!R1C1:R46C51, RC1, 2), R1C), RC4, NA()) -> #REF! | K245: =IF(OR(AND(NOT(ISERROR(RC7)), ISNUMBER(RC7)), AND(NOT(ISERROR(RC8)), ISNUMBER(RC8)), AND(NOT(ISERROR(RC9)), ISNUMBER(RC9)), AND(NOT(ISERROR(RC10)), ISNUMBER(RC10))), 1, 0) -> 0 | M245: =INDEX(Gross!R1C1:R46C51, RC1, 26) -> #REF! | N245: =INDEX(Gross!R1C1:R46C51, RC1, 27) -> #REF!
A246: 283 | B246: =INDEX(2001Grossed!R1C1:R46C51, RC[-1], 26) -> #REF! | C246: =INDEX(2001Grossed!R1C1:R46C51, RC1, 27) -> #REF! | D246: =IF(Menus!R9C10, RC[-1]/RC[-2], RC[-1]) -> #REF! | E246: =IF(RC11=1, RC[-3], NA()) -> #NA | F246: =INDEX(2001Grossed!R1C1:R46C51, RC1, 1) -> #REF! | G246: =IF(EQUAL(INDEX(2001Grossed!R1C1:R46C51, RC1, 2), R1C), RC4, NA()) -> #REF! | H246: =IF(EQUAL(INDEX(2001Grossed!R1C1:R46C51, RC1, 2), R1C), RC4, NA()) -> #REF! | I246: =IF(EQUAL(INDEX(2001Grossed!R1C1:R46C51, RC1, 2), R1C), RC4, NA()) -> #REF! | J246: =IF(EQUAL(INDEX(2001Grossed!R1C1:R46C51, RC1, 2), R1C), RC4, NA()) -> #REF! | K246: =IF(OR(AND(NOT(ISERROR(RC7)), ISNUMBER(RC7)), AND(NOT(ISERROR(RC8)), ISNUMBER(RC8)), AND(NOT(ISERROR(RC9)), ISNUMBER(RC9)), AND(NOT(ISERROR(RC10)), ISNUMBER(RC10))), 1, 0) -> 0 | M246: =INDEX(Gross!R1C1:R46C51, RC1, 26) -> #REF! | N246: =INDEX(Gross!R1C1:R46C51, RC1, 27) -> #REF!
A247: 284 | B247: =INDEX(2001Grossed!R1C1:R46C51, RC[-1], 26) -> #REF! | C247: =INDEX(2001Grossed!R1C1:R46C51, RC1, 27) -> #REF! | D247: =IF(Menus!R9C10, RC[-1]/RC[-2], RC[-1]) -> #REF! | E247: =IF(RC11=1, RC[-3], NA()) -> #NA | F247: =INDEX(2001Grossed!R1C1:R46C51, RC1, 1) -> #REF! | G247: =IF(EQUAL(INDEX(2001Grossed!R1C1:R46C51, RC1, 2), R1C), RC4, NA()) -> #REF! | H247: =IF(EQUAL(INDEX(2001Grossed!R1C1:R46C51, RC1, 2), R1C), RC4, NA()) -> #REF! | I247: =IF(EQUAL(INDEX(2001Grossed!R1C1:R46C51, RC1, 2), R1C), RC4, NA()) -> #REF! | J247: =IF(EQUAL(INDEX(2001Grossed!R1C1:R46C51, RC1, 2), R1C), RC4, NA()) -> #REF! | K247: =IF(OR(AND(NOT(ISERROR(RC7)), ISNUMBER(RC7)), AND(NOT(ISERROR(RC8)), ISNUMBER(RC8)), AND(NOT(ISERROR(RC9)), ISNUMBER(RC9)), AND(NOT(ISERROR(RC10)), ISNUMBER(RC10))), 1, 0) -> 0 | M247: =INDEX(Gross!R1C1:R46C51, RC1, 26) -> #REF! | N247: =INDEX(Gross!R1C1:R46C51, RC1, 27) -> #REF!
A248: 285 | B248: =INDEX(2001Grossed!R1C1:R46C51, RC[-1], 26) -> #REF! | C248: =INDEX(2001Grossed!R1C1:R46C51, RC1, 27) -> #REF! | D248: =IF(Menus!R9C10, RC[-1]/RC[-2], RC[-1]) -> #REF! | E248: =IF(RC11=1, RC[-3], NA()) -> #NA | F248: =INDEX(2001Grossed!R1C1:R46C51, RC1, 1) -> #REF! | G248: =IF(EQUAL(INDEX(2001Grossed!R1C1:R46C51, RC1, 2), R1C), RC4, NA()) -> #REF! | H248: =IF(EQUAL(INDEX(2001Grossed!R1C1:R46C51, RC1, 2), R1C), RC4, NA()) -> #REF! | I248: =IF(EQUAL(INDEX(2001Grossed!R1C1:R46C51, RC1, 2), R1C), RC4, NA()) -> #REF! | J248: =IF(EQUAL(INDEX(2001Grossed!R1C1:R46C51, RC1, 2), R1C), RC4, NA()) -> #REF! | K248: =IF(OR(AND(NOT(ISERROR(RC7)), ISNUMBER(RC7)), AND(NOT(ISERROR(RC8)), ISNUMBER(RC8)), AND(NOT(ISERROR(RC9)), ISNUMBER(RC9)), AND(NOT(ISERROR(RC10)), ISNUMBER(RC10))), 1, 0) -> 0 | M248: =INDEX(Gross!R1C1:R46C51, RC1, 26) -> #REF! | N248: =INDEX(Gross!R1C1:R46C51, RC1, 27) -> #REF!
A249: 286 | B249: =INDEX(2001Grossed!R1C1:R46C51, RC[-1], 26) -> #REF! | C249: =INDEX(2001Grossed!R1C1:R46C51, RC1, 27) -> #REF! | D249: =IF(Menus!R9C10, RC[-1]/RC[-2], RC[-1]) -> #REF! | E249: =IF(RC11=1, RC[-3], NA()) -> #NA | F249: =INDEX(2001Grossed!R1C1:R46C51, RC1, 1) -> #REF! | G249: =IF(EQUAL(INDEX(2001Grossed!R1C1:R46C51, RC1, 2), R1C), RC4, NA()) -> #REF! | H249: =IF(EQUAL(INDEX(2001Grossed!R1C1:R46C51, RC1, 2), R1C), RC4, NA()) -> #REF! | I249: =IF(EQUAL(INDEX(2001Grossed!R1C1:R46C51, RC1, 2), R1C), RC4, NA()) -> #REF! | J249: =IF(EQUAL(INDEX(2001Grossed!R1C1:R46C51, RC1, 2), R1C), RC4, NA()) -> #REF! | K249: =IF(OR(AND(NOT(ISERROR(RC7)), ISNUMBER(RC7)), AND(NOT(ISERROR(RC8)), ISNUMBER(RC8)), AND(NOT(ISERROR(RC9)), ISNUMBER(RC9)), AND(NOT(ISERROR(RC10)), ISNUMBER(RC10))), 1, 0) -> 0 | M249: =INDEX(Gross!R1C1:R46C51, RC1, 26) -> #REF! | N249: =INDEX(Gross!R1C1:R46C51, RC1, 27) -> #REF!
A250: 287 | B250: =INDEX(2001Grossed!R1C1:R46C51, RC[-1], 26) -> #REF! | C250: =INDEX(2001Grossed!R1C1:R46C51, RC1, 27) -> #REF! | D250: =IF(Menus!R9C10, RC[-1]/RC[-2], RC[-1]) -> #REF! | E250: =IF(RC11=1, RC[-3], NA()) -> #NA | F250: =INDEX(2001Grossed!R1C1:R46C51, RC1, 1) -> #REF! | G250: =IF(EQUAL(INDEX(2001Grossed!R1C1:R46C51, RC1, 2), R1C), RC4, NA()) -> #REF! | H250: =IF(EQUAL(INDEX(2001Grossed!R1C1:R46C51, RC1, 2), R1C), RC4, NA()) -> #REF! | I250: =IF(EQUAL(INDEX(2001Grossed!R1C1:R46C51, RC1, 2), R1C), RC4, NA()) -> #REF! | J250: =IF(EQUAL(INDEX(2001Grossed!R1C1:R46C51, RC1, 2), R1C), RC4, NA()) -> #REF! | K250: =IF(OR(AND(NOT(ISERROR(RC7)), ISNUMBER(RC7)), AND(NOT(ISERROR(RC8)), ISNUMBER(RC8)), AND(NOT(ISERROR(RC9)), ISNUMBER(RC9)), AND(NOT(ISERROR(RC10)), ISNUMBER(RC10))), 1, 0) -> 0 | M250: =INDEX(Gross!R1C1:R46C51, RC1, 26) -> #REF! | N250: =INDEX(Gross!R1C1:R46C51, RC1, 27) -> #REF!
A251: 288 | B251: =INDEX(2001Grossed!R1C1:R46C51, RC[-1], 26) -> #REF! | C251: =INDEX(2001Grossed!R1C1:R46C51, RC1, 27) -> #REF! | D251: =IF(Menus!R9C10, RC[-1]/RC[-2], RC[-1]) -> #REF! | E251: =IF(RC11=1, RC[-3], NA()) -> #NA | F251: =INDEX(2001Grossed!R1C1:R46C51, RC1, 1) -> #REF! | G251: =IF(EQUAL(INDEX(2001Grossed!R1C1:R46C51, RC1, 2), R1C), RC4, NA()) -> #REF! | H251: =IF(EQUAL(INDEX(2001Grossed!R1C1:R46C51, RC1, 2), R1C), RC4, NA()) -> #REF! | I251: =IF(EQUAL(INDEX(2001Grossed!R1C1:R46C51, RC1, 2), R1C), RC4, NA()) -> #REF! | J251: =IF(EQUAL(INDEX(2001Grossed!R1C1:R46C51, RC1, 2), R1C), RC4, NA()) -> #REF! | K251: =IF(OR(AND(NOT(ISERROR(RC7)), ISNUMBER(RC7)), AND(NOT(ISERROR(RC8)), ISNUMBER(RC8)), AND(NOT(ISERROR(RC9)), ISNUMBER(RC9)), AND(NOT(ISERROR(RC10)), ISNUMBER(RC10))), 1, 0) -> 0 | M251: =INDEX(Gross!R1C1:R46C51, RC1, 26) -> #REF! | N251: =INDEX(Gross!R1C1:R46C51, RC1, 27) -> #REF!
A252: 289 | B252: =INDEX(2001Grossed!R1C1:R46C51, RC[-1], 26) -> #REF! | C252: =INDEX(2001Grossed!R1C1:R46C51, RC1, 27) -> #REF! | D252: =IF(Menus!R9C10, RC[-1]/RC[-2], RC[-1]) -> #REF! | E252: =IF(RC11=1, RC[-3], NA()) -> #NA | F252: =INDEX(2001Grossed!R1C1:R46C51, RC1, 1) -> #REF! | G252: =IF(EQUAL(INDEX(2001Grossed!R1C1:R46C51, RC1, 2), R1C), RC4, NA()) -> #REF! | H252: =IF(EQUAL(INDEX(2001Grossed!R1C1:R46C51, RC1, 2), R1C), RC4, NA()) -> #REF! | I252: =IF(EQUAL(INDEX(2001Grossed!R1C1:R46C51, RC1, 2), R1C), RC4, NA()) -> #REF! | J252: =IF(EQUAL(INDEX(2001Grossed!R1C1:R46C51, RC1, 2), R1C), RC4, NA()) -> #REF! | K252: =IF(OR(AND(NOT(ISERROR(RC7)), ISNUMBER(RC7)), AND(NOT(ISERROR(RC8)), ISNUMBER(RC8)), AND(NOT(ISERROR(RC9)), ISNUMBER(RC9)), AND(NOT(ISERROR(RC10)), ISNUMBER(RC10))), 1, 0) -> 0 | M252: =INDEX(Gross!R1C1:R46C51, RC1, 26) -> #REF! | N252: =INDEX(Gross!R1C1:R46C51, RC1, 27) -> #REF!
A253: 290 | B253: =INDEX(2001Grossed!R1C1:R46C51, RC[-1], 26) -> #REF! | C253: =INDEX(2001Grossed!R1C1:R46C51, RC1, 27) -> #REF! | D253: =IF(Menus!R9C10, RC[-1]/RC[-2], RC[-1]) -> #REF! | E253: =IF(RC11=1, RC[-3], NA()) -> #NA | F253: =INDEX(2001Grossed!R1C1:R46C51, RC1, 1) -> #REF! | G253: =IF(EQUAL(INDEX(2001Grossed!R1C1:R46C51, RC1, 2), R1C), RC4, NA()) -> #REF! | H253: =IF(EQUAL(INDEX(2001Grossed!R1C1:R46C51, RC1, 2), R1C), RC4, NA()) -> #REF! | I253: =IF(EQUAL(INDEX(2001Grossed!R1C1:R46C51, RC1, 2), R1C), RC4, NA()) -> #REF! | J253: =IF(EQUAL(INDEX(2001Grossed!R1C1:R46C51, RC1, 2), R1C), RC4, NA()) -> #REF! | K253: =IF(OR(AND(NOT(ISERROR(RC7)), ISNUMBER(RC7)), AND(NOT(ISERROR(RC8)), ISNUMBER(RC8)), AND(NOT(ISERROR(RC9)), ISNUMBER(RC9)), AND(NOT(ISERROR(RC10)), ISNUMBER(RC10))), 1, 0) -> 0 | M253: =INDEX(Gross!R1C1:R46C51, RC1, 26) -> #REF! | N253: =INDEX(Gross!R1C1:R46C51, RC1, 27) -> #REF!
A254: 291 | B254: =INDEX(2001Grossed!R1C1:R46C51, RC[-1], 26) -> #REF! | C254: =INDEX(2001Grossed!R1C1:R46C51, RC1, 27) -> #REF! | D254: =IF(Menus!R9C10, RC[-1]/RC[-2], RC[-1]) -> #REF! | E254: =IF(RC11=1, RC[-3], NA()) -> #NA | F254: =INDEX(2001Grossed!R1C1:R46C51, RC1, 1) -> #REF! | G254: =IF(EQUAL(INDEX(2001Grossed!R1C1:R46C51, RC1, 2), R1C), RC4, NA()) -> #REF! | H254: =IF(EQUAL(INDEX(2001Grossed!R1C1:R46C51, RC1, 2), R1C), RC4, NA()) -> #REF! | I254: =IF(EQUAL(INDEX(2001Grossed!R1C1:R46C51, RC1, 2), R1C), RC4, NA()) -> #REF! | J254: =IF(EQUAL(INDEX(2001Grossed!R1C1:R46C51, RC1, 2), R1C), RC4, NA()) -> #REF! | K254: =IF(OR(AND(NOT(ISERROR(RC7)), ISNUMBER(RC7)), AND(NOT(ISERROR(RC8)), ISNUMBER(RC8)), AND(NOT(ISERROR(RC9)), ISNUMBER(RC9)), AND(NOT(ISERROR(RC10)), ISNUMBER(RC10))), 1, 0) -> 0 | M254: =INDEX(Gross!R1C1:R46C51, RC1, 26) -> #REF! | N254: =INDEX(Gross!R1C1:R46C51, RC1, 27) -> #REF!
A255: 292 | B255: =INDEX(2001Grossed!R1C1:R46C51, RC[-1], 26) -> #REF! | C255: =INDEX(2001Grossed!R1C1:R46C51, RC1, 27) -> #REF! | D255: =IF(Menus!R9C10, RC[-1]/RC[-2], RC[-1]) -> #REF! | E255: =IF(RC11=1, RC[-3], NA()) -> #NA | F255: =INDEX(2001Grossed!R1C1:R46C51, RC1, 1) -> #REF! | G255: =IF(EQUAL(INDEX(2001Grossed!R1C1:R46C51, RC1, 2), R1C), RC4, NA()) -> #REF! | H255: =IF(EQUAL(INDEX(2001Grossed!R1C1:R46C51, RC1, 2), R1C), RC4, NA()) -> #REF! | I255: =IF(EQUAL(INDEX(2001Grossed!R1C1:R46C51, RC1, 2), R1C), RC4, NA()) -> #REF! | J255: =IF(EQUAL(INDEX(2001Grossed!R1C1:R46C51, RC1, 2), R1C), RC4, NA()) -> #REF! | K255: =IF(OR(AND(NOT(ISERROR(RC7)), ISNUMBER(RC7)), AND(NOT(ISERROR(RC8)), ISNUMBER(RC8)), AND(NOT(ISERROR(RC9)), ISNUMBER(RC9)), AND(NOT(ISERROR(RC10)), ISNUMBER(RC10))), 1, 0) -> 0 | M255: =INDEX(Gross!R1C1:R46C51, RC1, 26) -> #REF! | N255: =INDEX(Gross!R1C1:R46C51, RC1, 27) -> #REF!
A256: 293 | B256: =INDEX(2001Grossed!R1C1:R46C51, RC[-1], 26) -> #REF! | C256: =INDEX(2001Grossed!R1C1:R46C51, RC1, 27) -> #REF! | D256: =IF(Menus!R9C10, RC[-1]/RC[-2], RC[-1]) -> #REF! | E256: =IF(RC11=1, RC[-3], NA()) -> #NA | F256: =INDEX(2001Grossed!R1C1:R46C51, RC1, 1) -> #REF! | G256: =IF(EQUAL(INDEX(2001Grossed!R1C1:R46C51, RC1, 2), R1C), RC4, NA()) -> #REF! | H256: =IF(EQUAL(INDEX(2001Grossed!R1C1:R46C51, RC1, 2), R1C), RC4, NA()) -> #REF! | I256: =IF(EQUAL(INDEX(2001Grossed!R1C1:R46C51, RC1, 2), R1C), RC4, NA()) -> #REF! | J256: =IF(EQUAL(INDEX(2001Grossed!R1C1:R46C51, RC1, 2), R1C), RC4, NA()) -> #REF! | K256: =IF(OR(AND(NOT(ISERROR(RC7)), ISNUMBER(RC7)), AND(NOT(ISERROR(RC8)), ISNUMBER(RC8)), AND(NOT(ISERROR(RC9)), ISNUMBER(RC9)), AND(NOT(ISERROR(RC10)), ISNUMBER(RC10))), 1, 0) -> 0 | M256: =INDEX(Gross!R1C1:R46C51, RC1, 26) -> #REF! | N256: =INDEX(Gross!R1C1:R46C51, RC1, 27) -> #REF!
A257: 294 | B257: =INDEX(2001Grossed!R1C1:R46C51, RC[-1], 26) -> #REF! | C257: =INDEX(2001Grossed!R1C1:R46C51, RC1, 27) -> #REF! | D257: =IF(Menus!R9C10, RC[-1]/RC[-2], RC[-1]) -> #REF! | E257: =IF(RC11=1, RC[-3], NA()) -> #NA | F257: =INDEX(2001Grossed!R1C1:R46C51, RC1, 1) -> #REF! | G257: =IF(EQUAL(INDEX(2001Grossed!R1C1:R46C51, RC1, 2), R1C), RC4, NA()) -> #REF! | H257: =IF(EQUAL(INDEX(2001Grossed!R1C1:R46C51, RC1, 2), R1C), RC4, NA()) -> #REF! | I257: =IF(EQUAL(INDEX(2001Grossed!R1C1:R46C51, RC1, 2), R1C), RC4, NA()) -> #REF! | J257: =IF(EQUAL(INDEX(2001Grossed!R1C1:R46C51, RC1, 2), R1C), RC4, NA()) -> #REF! | K257: =IF(OR(AND(NOT(ISERROR(RC7)), ISNUMBER(RC7)), AND(NOT(ISERROR(RC8)), ISNUMBER(RC8)), AND(NOT(ISERROR(RC9)), ISNUMBER(RC9)), AND(NOT(ISERROR(RC10)), ISNUMBER(RC10))), 1, 0) -> 0 | M257: =INDEX(Gross!R1C1:R46C51, RC1, 26) -> #REF! | N257: =INDEX(Gross!R1C1:R46C51, RC1, 27) -> #REF!
A258: 295 | B258: =INDEX(2001Grossed!R1C1:R46C51, RC[-1], 26) -> #REF! | C258: =INDEX(2001Grossed!R1C1:R46C51, RC1, 27) -> #REF! | D258: =IF(Menus!R9C10, RC[-1]/RC[-2], RC[-1]) -> #REF! | E258: =IF(RC11=1, RC[-3], NA()) -> #NA | F258: =INDEX(2001Grossed!R1C1:R46C51, RC1, 1) -> #REF! | G258: =IF(EQUAL(INDEX(2001Grossed!R1C1:R46C51, RC1, 2), R1C), RC4, NA()) -> #REF! | H258: =IF(EQUAL(INDEX(2001Grossed!R1C1:R46C51, RC1, 2), R1C), RC4, NA()) -> #REF! | I258: =IF(EQUAL(INDEX(2001Grossed!R1C1:R46C51, RC1, 2), R1C), RC4, NA()) -> #REF! | J258: =IF(EQUAL(INDEX(2001Grossed!R1C1:R46C51, RC1, 2), R1C), RC4, NA()) -> #REF! | K258: =IF(OR(AND(NOT(ISERROR(RC7)), ISNUMBER(RC7)), AND(NOT(ISERROR(RC8)), ISNUMBER(RC8)), AND(NOT(ISERROR(RC9)), ISNUMBER(RC9)), AND(NOT(ISERROR(RC10)), ISNUMBER(RC10))), 1, 0) -> 0 | M258: =INDEX(Gross!R1C1:R46C51, RC1, 26) -> #REF! | N258: =INDEX(Gross!R1C1:R46C51, RC1, 27) -> #REF!
A259: 296 | B259: =INDEX(2001Grossed!R1C1:R46C51, RC[-1], 26) -> #REF! | C259: =INDEX(2001Grossed!R1C1:R46C51, RC1, 27) -> #REF! | D259: =IF(Menus!R9C10, RC[-1]/RC[-2], RC[-1]) -> #REF! | E259: =IF(RC11=1, RC[-3], NA()) -> #NA | F259: =INDEX(2001Grossed!R1C1:R46C51, RC1, 1) -> #REF! | G259: =IF(EQUAL(INDEX(2001Grossed!R1C1:R46C51, RC1, 2), R1C), RC4, NA()) -> #REF! | H259: =IF(EQUAL(INDEX(2001Grossed!R1C1:R46C51, RC1, 2), R1C), RC4, NA()) -> #REF! | I259: =IF(EQUAL(INDEX(2001Grossed!R1C1:R46C51, RC1, 2), R1C), RC4, NA()) -> #REF! | J259: =IF(EQUAL(INDEX(2001Grossed!R1C1:R46C51, RC1, 2), R1C), RC4, NA()) -> #REF! | K259: =IF(OR(AND(NOT(ISERROR(RC7)), ISNUMBER(RC7)), AND(NOT(ISERROR(RC8)), ISNUMBER(RC8)), AND(NOT(ISERROR(RC9)), ISNUMBER(RC9)), AND(NOT(ISERROR(RC10)), ISNUMBER(RC10))), 1, 0) -> 0 | M259: =INDEX(Gross!R1C1:R46C51, RC1, 26) -> #REF! | N259: =INDEX(Gross!R1C1:R46C51, RC1, 27) -> #REF!
A260: 297 | B260: =INDEX(2001Grossed!R1C1:R46C51, RC[-1], 26) -> #REF! | C260: =INDEX(2001Grossed!R1C1:R46C51, RC1, 27) -> #REF! | D260: =IF(Menus!R9C10, RC[-1]/RC[-2], RC[-1]) -> #REF! | E260: =IF(RC11=1, RC[-3], NA()) -> #NA | F260: =INDEX(2001Grossed!R1C1:R46C51, RC1, 1) -> #REF! | G260: =IF(EQUAL(INDEX(2001Grossed!R1C1:R46C51, RC1, 2), R1C), RC4, NA()) -> #REF! | H260: =IF(EQUAL(INDEX(2001Grossed!R1C1:R46C51, RC1, 2), R1C), RC4, NA()) -> #REF! | I260: =IF(EQUAL(INDEX(2001Grossed!R1C1:R46C51, RC1, 2), R1C), RC4, NA()) -> #REF! | J260: =IF(EQUAL(INDEX(2001Grossed!R1C1:R46C51, RC1, 2), R1C), RC4, NA()) -> #REF! | K260: =IF(OR(AND(NOT(ISERROR(RC7)), ISNUMBER(RC7)), AND(NOT(ISERROR(RC8)), ISNUMBER(RC8)), AND(NOT(ISERROR(RC9)), ISNUMBER(RC9)), AND(NOT(ISERROR(RC10)), ISNUMBER(RC10))), 1, 0) -> 0 | M260: =INDEX(Gross!R1C1:R46C51, RC1, 26) -> #REF! | N260: =INDEX(Gross!R1C1:R46C51, RC1, 27) -> #REF!
A261: 298 | B261: =INDEX(2001Grossed!R1C1:R46C51, RC[-1], 26) -> #REF! | C261: =INDEX(2001Grossed!R1C1:R46C51, RC1, 27) -> #REF! | D261: =IF(Menus!R9C10, RC[-1]/RC[-2], RC[-1]) -> #REF! | E261: =IF(RC11=1, RC[-3], NA()) -> #NA | F261: =INDEX(2001Grossed!R1C1:R46C51, RC1, 1) -> #REF! | G261: =IF(EQUAL(INDEX(2001Grossed!R1C1:R46C51, RC1, 2), R1C), RC4, NA()) -> #REF! | H261: =IF(EQUAL(INDEX(2001Grossed!R1C1:R46C51, RC1, 2), R1C), RC4, NA()) -> #REF! | I261: =IF(EQUAL(INDEX(2001Grossed!R1C1:R46C51, RC1, 2), R1C), RC4, NA()) -> #REF! | J261: =IF(EQUAL(INDEX(2001Grossed!R1C1:R46C51, RC1, 2), R1C), RC4, NA()) -> #REF! | K261: =IF(OR(AND(NOT(ISERROR(RC7)), ISNUMBER(RC7)), AND(NOT(ISERROR(RC8)), ISNUMBER(RC8)), AND(NOT(ISERROR(RC9)), ISNUMBER(RC9)), AND(NOT(ISERROR(RC10)), ISNUMBER(RC10))), 1, 0) -> 0 | M261: =INDEX(Gross!R1C1:R46C51, RC1, 26) -> #REF! | N261: =INDEX(Gross!R1C1:R46C51, RC1, 27) -> #REF!
A262: 299 | B262: =INDEX(2001Grossed!R1C1:R46C51, RC[-1], 26) -> #REF! | C262: =INDEX(2001Grossed!R1C1:R46C51, RC1, 27) -> #REF! | D262: =IF(Menus!R9C10, RC[-1]/RC[-2], RC[-1]) -> #REF! | E262: =IF(RC11=1, RC[-3], NA()) -> #NA | F262: =INDEX(2001Grossed!R1C1:R46C51, RC1, 1) -> #REF! | G262: =IF(EQUAL(INDEX(2001Grossed!R1C1:R46C51, RC1, 2), R1C), RC4, NA()) -> #REF! | H262: =IF(EQUAL(INDEX(2001Grossed!R1C1:R46C51, RC1, 2), R1C), RC4, NA()) -> #REF! | I262: =IF(EQUAL(INDEX(2001Grossed!R1C1:R46C51, RC1, 2), R1C), RC4, NA()) -> #REF! | J262: =IF(EQUAL(INDEX(2001Grossed!R1C1:R46C51, RC1, 2), R1C), RC4, NA()) -> #REF! | K262: =IF(OR(AND(NOT(ISERROR(RC7)), ISNUMBER(RC7)), AND(NOT(ISERROR(RC8)), ISNUMBER(RC8)), AND(NOT(ISERROR(RC9)), ISNUMBER(RC9)), AND(NOT(ISERROR(RC10)), ISNUMBER(RC10))), 1, 0) -> 0 | M262: =INDEX(Gross!R1C1:R46C51, RC1, 26) -> #REF! | N262: =INDEX(Gross!R1C1:R46C51, RC1, 27) -> #REF!
A263: 300 | B263: =INDEX(2001Grossed!R1C1:R46C51, RC[-1], 26) -> #REF! | C263: =INDEX(2001Grossed!R1C1:R46C51, RC1, 27) -> #REF! | D263: =IF(Menus!R9C10, RC[-1]/RC[-2], RC[-1]) -> #REF! | E263: =IF(RC11=1, RC[-3], NA()) -> #NA | F263: =INDEX(2001Grossed!R1C1:R46C51, RC1, 1) -> #REF! | G263: =IF(EQUAL(INDEX(2001Grossed!R1C1:R46C51, RC1, 2), R1C), RC4, NA()) -> #REF! | H263: =IF(EQUAL(INDEX(2001Grossed!R1C1:R46C51, RC1, 2), R1C), RC4, NA()) -> #REF! | I263: =IF(EQUAL(INDEX(2001Grossed!R1C1:R46C51, RC1, 2), R1C), RC4, NA()) -> #REF! | J263: =IF(EQUAL(INDEX(2001Grossed!R1C1:R46C51, RC1, 2), R1C), RC4, NA()) -> #REF! | K263: =IF(OR(AND(NOT(ISERROR(RC7)), ISNUMBER(RC7)), AND(NOT(ISERROR(RC8)), ISNUMBER(RC8)), AND(NOT(ISERROR(RC9)), ISNUMBER(RC9)), AND(NOT(ISERROR(RC10)), ISNUMBER(RC10))), 1, 0) -> 0 | M263: =INDEX(Gross!R1C1:R46C51, RC1, 26) -> #REF! | N263: =INDEX(Gross!R1C1:R46C51, RC1, 27) -> #REF!
A264: 301 | B264: =INDEX(2001Grossed!R1C1:R46C51, RC[-1], 26) -> #REF! | C264: =INDEX(2001Grossed!R1C1:R46C51, RC1, 27) -> #REF! | D264: =IF(Menus!R9C10, RC[-1]/RC[-2], RC[-1]) -> #REF! | E264: =IF(RC11=1, RC[-3], NA()) -> #NA | F264: =INDEX(2001Grossed!R1C1:R46C51, RC1, 1) -> #REF! | G264: =IF(EQUAL(INDEX(2001Grossed!R1C1:R46C51, RC1, 2), R1C), RC4, NA()) -> #REF! | H264: =IF(EQUAL(INDEX(2001Grossed!R1C1:R46C51, RC1, 2), R1C), RC4, NA()) -> #REF! | I264: =IF(EQUAL(INDEX(2001Grossed!R1C1:R46C51, RC1, 2), R1C), RC4, NA()) -> #REF! | J264: =IF(EQUAL(INDEX(2001Grossed!R1C1:R46C51, RC1, 2), R1C), RC4, NA()) -> #REF! | K264: =IF(OR(AND(NOT(ISERROR(RC7)), ISNUMBER(RC7)), AND(NOT(ISERROR(RC8)), ISNUMBER(RC8)), AND(NOT(ISERROR(RC9)), ISNUMBER(RC9)), AND(NOT(ISERROR(RC10)), ISNUMBER(RC10))), 1, 0) -> 0 | M264: =INDEX(Gross!R1C1:R46C51, RC1, 26) -> #REF! | N264: =INDEX(Gross!R1C1:R46C51, RC1, 27) -> #REF!
A265: 302 | B265: =INDEX(2001Grossed!R1C1:R46C51, RC[-1], 26) -> #REF! | C265: =INDEX(2001Grossed!R1C1:R46C51, RC1, 27) -> #REF! | D265: =IF(Menus!R9C10, RC[-1]/RC[-2], RC[-1]) -> #REF! | E265: =IF(RC11=1, RC[-3], NA()) -> #NA | F265: =INDEX(2001Grossed!R1C1:R46C51, RC1, 1) -> #REF! | G265: =IF(EQUAL(INDEX(2001Grossed!R1C1:R46C51, RC1, 2), R1C), RC4, NA()) -> #REF! | H265: =IF(EQUAL(INDEX(2001Grossed!R1C1:R46C51, RC1, 2), R1C), RC4, NA()) -> #REF! | I265: =IF(EQUAL(INDEX(2001Grossed!R1C1:R46C51, RC1, 2), R1C), RC4, NA()) -> #REF! | J265: =IF(EQUAL(INDEX(2001Grossed!R1C1:R46C51, RC1, 2), R1C), RC4, NA()) -> #REF! | K265: =IF(OR(AND(NOT(ISERROR(RC7)), ISNUMBER(RC7)), AND(NOT(ISERROR(RC8)), ISNUMBER(RC8)), AND(NOT(ISERROR(RC9)), ISNUMBER(RC9)), AND(NOT(ISERROR(RC10)), ISNUMBER(RC10))), 1, 0) -> 0 | M265: =INDEX(Gross!R1C1:R46C51, RC1, 26) -> #REF! | N265: =INDEX(Gross!R1C1:R46C51, RC1, 27) -> #REF!
A266: 303 | B266: =INDEX(2001Grossed!R1C1:R46C51, RC[-1], 26) -> #REF! | C266: =INDEX(2001Grossed!R1C1:R46C51, RC1, 27) -> #REF! | D266: =IF(Menus!R9C10, RC[-1]/RC[-2], RC[-1]) -> #REF! | E266: =IF(RC11=1, RC[-3], NA()) -> #NA | F266: =INDEX(2001Grossed!R1C1:R46C51, RC1, 1) -> #REF! | G266: =IF(EQUAL(INDEX(2001Grossed!R1C1:R46C51, RC1, 2), R1C), RC4, NA()) -> #REF! | H266: =IF(EQUAL(INDEX(2001Grossed!R1C1:R46C51, RC1, 2), R1C), RC4, NA()) -> #REF! | I266: =IF(EQUAL(INDEX(2001Grossed!R1C1:R46C51, RC1, 2), R1C), RC4, NA()) -> #REF! | J266: =IF(EQUAL(INDEX(2001Grossed!R1C1:R46C51, RC1, 2), R1C), RC4, NA()) -> #REF! | K266: =IF(OR(AND(NOT(ISERROR(RC7)), ISNUMBER(RC7)), AND(NOT(ISERROR(RC8)), ISNUMBER(RC8)), AND(NOT(ISERROR(RC9)), ISNUMBER(RC9)), AND(NOT(ISERROR(RC10)), ISNUMBER(RC10))), 1, 0) -> 0 | M266: =INDEX(Gross!R1C1:R46C51, RC1, 26) -> #REF! | N266: =INDEX(Gross!R1C1:R46C51, RC1, 27) -> #REF!
A267: 304 | B267: =INDEX(2001Grossed!R1C1:R46C51, RC[-1], 26) -> #REF! | C267: =INDEX(2001Grossed!R1C1:R46C51, RC1, 27) -> #REF! | D267: =IF(Menus!R9C10, RC[-1]/RC[-2], RC[-1]) -> #REF! | E267: =IF(RC11=1, RC[-3], NA()) -> #NA | F267: =INDEX(2001Grossed!R1C1:R46C51, RC1, 1) -> #REF! | G267: =IF(EQUAL(INDEX(2001Grossed!R1C1:R46C51, RC1, 2), R1C), RC4, NA()) -> #REF! | H267: =IF(EQUAL(INDEX(2001Grossed!R1C1:R46C51, RC1, 2), R1C), RC4, NA()) -> #REF! | I267: =IF(EQUAL(INDEX(2001Grossed!R1C1:R46C51, RC1, 2), R1C), RC4, NA()) -> #REF! | J267: =IF(EQUAL(INDEX(2001Grossed!R1C1:R46C51, RC1, 2), R1C), RC4, NA()) -> #REF! | K267: =IF(OR(AND(NOT(ISERROR(RC7)), ISNUMBER(RC7)), AND(NOT(ISERROR(RC8)), ISNUMBER(RC8)), AND(NOT(ISERROR(RC9)), ISNUMBER(RC9)), AND(NOT(ISERROR(RC10)), ISNUMBER(RC10))), 1, 0) -> 0 | M267: =INDEX(Gross!R1C1:R46C51, RC1, 26) -> #REF! | N267: =INDEX(Gross!R1C1:R46C51, RC1, 27) -> #REF!
A268: 305 | B268: =INDEX(2001Grossed!R1C1:R46C51, RC[-1], 26) -> #REF! | C268: =INDEX(2001Grossed!R1C1:R46C51, RC1, 27) -> #REF! | D268: =IF(Menus!R9C10, RC[-1]/RC[-2], RC[-1]) -> #REF! | E268: =IF(RC11=1, RC[-3], NA()) -> #NA | F268: =INDEX(2001Grossed!R1C1:R46C51, RC1, 1) -> #REF! | G268: =IF(EQUAL(INDEX(2001Grossed!R1C1:R46C51, RC1, 2), R1C), RC4, NA()) -> #REF! | H268: =IF(EQUAL(INDEX(2001Grossed!R1C1:R46C51, RC1, 2), R1C), RC4, NA()) -> #REF! | I268: =IF(EQUAL(INDEX(2001Grossed!R1C1:R46C51, RC1, 2), R1C), RC4, NA()) -> #REF! | J268: =IF(EQUAL(INDEX(2001Grossed!R1C1:R46C51, RC1, 2), R1C), RC4, NA()) -> #REF! | K268: =IF(OR(AND(NOT(ISERROR(RC7)), ISNUMBER(RC7)), AND(NOT(ISERROR(RC8)), ISNUMBER(RC8)), AND(NOT(ISERROR(RC9)), ISNUMBER(RC9)), AND(NOT(ISERROR(RC10)), ISNUMBER(RC10))), 1, 0) -> 0 | M268: =INDEX(Gross!R1C1:R46C51, RC1, 26) -> #REF! | N268: =INDEX(Gross!R1C1:R46C51, RC1, 27) -> #REF!
A269: 306 | B269: =INDEX(2001Grossed!R1C1:R46C51, RC[-1], 26) -> #REF! | C269: =INDEX(2001Grossed!R1C1:R46C51, RC1, 27) -> #REF! | D269: =IF(Menus!R9C10, RC[-1]/RC[-2], RC[-1]) -> #REF! | E269: =IF(RC11=1, RC[-3], NA()) -> #NA | F269: =INDEX(2001Grossed!R1C1:R46C51, RC1, 1) -> #REF! | G269: =IF(EQUAL(INDEX(2001Grossed!R1C1:R46C51, RC1, 2), R1C), RC4, NA()) -> #REF! | H269: =IF(EQUAL(INDEX(2001Grossed!R1C1:R46C51, RC1, 2), R1C), RC4, NA()) -> #REF! | I269: =IF(EQUAL(INDEX(2001Grossed!R1C1:R46C51, RC1, 2), R1C), RC4, NA()) -> #REF! | J269: =IF(EQUAL(INDEX(2001Grossed!R1C1:R46C51, RC1, 2), R1C), RC4, NA()) -> #REF! | K269: =IF(OR(AND(NOT(ISERROR(RC7)), ISNUMBER(RC7)), AND(NOT(ISERROR(RC8)), ISNUMBER(RC8)), AND(NOT(ISERROR(RC9)), ISNUMBER(RC9)), AND(NOT(ISERROR(RC10)), ISNUMBER(RC10))), 1, 0) -> 0 | M269: =INDEX(Gross!R1C1:R46C51, RC1, 26) -> #REF! | N269: =INDEX(Gross!R1C1:R46C51, RC1, 27) -> #REF!
A270: 307 | B270: =INDEX(2001Grossed!R1C1:R46C51, RC[-1], 26) -> #REF! | C270: =INDEX(2001Grossed!R1C1:R46C51, RC1, 27) -> #REF! | D270: =IF(Menus!R9C10, RC[-1]/RC[-2], RC[-1]) -> #REF! | E270: =IF(RC11=1, RC[-3], NA()) -> #NA | F270: =INDEX(2001Grossed!R1C1:R46C51, RC1, 1) -> #REF! | G270: =IF(EQUAL(INDEX(2001Grossed!R1C1:R46C51, RC1, 2), R1C), RC4, NA()) -> #REF! | H270: =IF(EQUAL(INDEX(2001Grossed!R1C1:R46C51, RC1, 2), R1C), RC4, NA()) -> #REF! | I270: =IF(EQUAL(INDEX(2001Grossed!R1C1:R46C51, RC1, 2), R1C), RC4, NA()) -> #REF! | J270: =IF(EQUAL(INDEX(2001Grossed!R1C1:R46C51, RC1, 2), R1C), RC4, NA()) -> #REF! | K270: =IF(OR(AND(NOT(ISERROR(RC7)), ISNUMBER(RC7)), AND(NOT(ISERROR(RC8)), ISNUMBER(RC8)), AND(NOT(ISERROR(RC9)), ISNUMBER(RC9)), AND(NOT(ISERROR(RC10)), ISNUMBER(RC10))), 1, 0) -> 0 | M270: =INDEX(Gross!R1C1:R46C51, RC1, 26) -> #REF! | N270: =INDEX(Gross!R1C1:R46C51, RC1, 27) -> #REF!
A271: 308 | B271: =INDEX(2001Grossed!R1C1:R46C51, RC[-1], 26) -> #REF! | C271: =INDEX(2001Grossed!R1C1:R46C51, RC1, 27) -> #REF! | D271: =IF(Menus!R9C10, RC[-1]/RC[-2], RC[-1]) -> #REF! | E271: =IF(RC11=1, RC[-3], NA()) -> #NA | F271: =INDEX(2001Grossed!R1C1:R46C51, RC1, 1) -> #REF! | G271: =IF(EQUAL(INDEX(2001Grossed!R1C1:R46C51, RC1, 2), R1C), RC4, NA()) -> #REF! | H271: =IF(EQUAL(INDEX(2001Grossed!R1C1:R46C51, RC1, 2), R1C), RC4, NA()) -> #REF! | I271: =IF(EQUAL(INDEX(2001Grossed!R1C1:R46C51, RC1, 2), R1C), RC4, NA()) -> #REF! | J271: =IF(EQUAL(INDEX(2001Grossed!R1C1:R46C51, RC1, 2), R1C), RC4, NA()) -> #REF! | K271: =IF(OR(AND(NOT(ISERROR(RC7)), ISNUMBER(RC7)), AND(NOT(ISERROR(RC8)), ISNUMBER(RC8)), AND(NOT(ISERROR(RC9)), ISNUMBER(RC9)), AND(NOT(ISERROR(RC10)), ISNUMBER(RC10))), 1, 0) -> 0 | M271: =INDEX(Gross!R1C1:R46C51, RC1, 26) -> #REF! | N271: =INDEX(Gross!R1C1:R46C51, RC1, 27) -> #REF!
A272: 309 | B272: =INDEX(2001Grossed!R1C1:R46C51, RC[-1], 26) -> #REF! | C272: =INDEX(2001Grossed!R1C1:R46C51, RC1, 27) -> #REF! | D272: =IF(Menus!R9C10, RC[-1]/RC[-2], RC[-1]) -> #REF! | E272: =IF(RC11=1, RC[-3], NA()) -> #NA | F272: =INDEX(2001Grossed!R1C1:R46C51, RC1, 1) -> #REF! | G272: =IF(EQUAL(INDEX(2001Grossed!R1C1:R46C51, RC1, 2), R1C), RC4, NA()) -> #REF! | H272: =IF(EQUAL(INDEX(2001Grossed!R1C1:R46C51, RC1, 2), R1C), RC4, NA()) -> #REF! | I272: =IF(EQUAL(INDEX(2001Grossed!R1C1:R46C51, RC1, 2), R1C), RC4, NA()) -> #REF! | J272: =IF(EQUAL(INDEX(2001Grossed!R1C1:R46C51, RC1, 2), R1C), RC4, NA()) -> #REF! | K272: =IF(OR(AND(NOT(ISERROR(RC7)), ISNUMBER(RC7)), AND(NOT(ISERROR(RC8)), ISNUMBER(RC8)), AND(NOT(ISERROR(RC9)), ISNUMBER(RC9)), AND(NOT(ISERROR(RC10)), ISNUMBER(RC10))), 1, 0) -> 0 | M272: =INDEX(Gross!R1C1:R46C51, RC1, 26) -> #REF! | N272: =INDEX(Gross!R1C1:R46C51, RC1, 27) -> #REF!
A273: 310 | B273: =INDEX(2001Grossed!R1C1:R46C51, RC[-1], 26) -> #REF! | C273: =INDEX(2001Grossed!R1C1:R46C51, RC1, 27) -> #REF! | D273: =IF(Menus!R9C10, RC[-1]/RC[-2], RC[-1]) -> #REF! | E273: =IF(RC11=1, RC[-3], NA()) -> #NA | F273: =INDEX(2001Grossed!R1C1:R46C51, RC1, 1) -> #REF! | G273: =IF(EQUAL(INDEX(2001Grossed!R1C1:R46C51, RC1, 2), R1C), RC4, NA()) -> #REF! | H273: =IF(EQUAL(INDEX(2001Grossed!R1C1:R46C51, RC1, 2), R1C), RC4, NA()) -> #REF! | I273: =IF(EQUAL(INDEX(2001Grossed!R1C1:R46C51, RC1, 2), R1C), RC4, NA()) -> #REF! | J273: =IF(EQUAL(INDEX(2001Grossed!R1C1:R46C51, RC1, 2), R1C), RC4, NA()) -> #REF! | K273: =IF(OR(AND(NOT(ISERROR(RC7)), ISNUMBER(RC7)), AND(NOT(ISERROR(RC8)), ISNUMBER(RC8)), AND(NOT(ISERROR(RC9)), ISNUMBER(RC9)), AND(NOT(ISERROR(RC10)), ISNUMBER(RC10))), 1, 0) -> 0 | M273: =INDEX(Gross!R1C1:R46C51, RC1, 26) -> #REF! | N273: =INDEX(Gross!R1C1:R46C51, RC1, 27) -> #REF!
A274: 311 | B274: =INDEX(2001Grossed!R1C1:R46C51, RC[-1], 26) -> #REF! | C274: =INDEX(2001Grossed!R1C1:R46C51, RC1, 27) -> #REF! | D274: =IF(Menus!R9C10, RC[-1]/RC[-2], RC[-1]) -> #REF! | E274: =IF(RC11=1, RC[-3], NA()) -> #NA | F274: =INDEX(2001Grossed!R1C1:R46C51, RC1, 1) -> #REF! | G274: =IF(EQUAL(INDEX(2001Grossed!R1C1:R46C51, RC1, 2), R1C), RC4, NA()) -> #REF! | H274: =IF(EQUAL(INDEX(2001Grossed!R1C1:R46C51, RC1, 2), R1C), RC4, NA()) -> #REF! | I274: =IF(EQUAL(INDEX(2001Grossed!R1C1:R46C51, RC1, 2), R1C), RC4, NA()) -> #REF! | J274: =IF(EQUAL(INDEX(2001Grossed!R1C1:R46C51, RC1, 2), R1C), RC4, NA()) -> #REF! | K274: =IF(OR(AND(NOT(ISERROR(RC7)), ISNUMBER(RC7)), AND(NOT(ISERROR(RC8)), ISNUMBER(RC8)), AND(NOT(ISERROR(RC9)), ISNUMBER(RC9)), AND(NOT(ISERROR(RC10)), ISNUMBER(RC10))), 1, 0) -> 0 | M274: =INDEX(Gross!R1C1:R46C51, RC1, 26) -> #REF! | N274: =INDEX(Gross!R1C1:R46C51, RC1, 27) -> #REF!
A275: 312 | B275: =INDEX(2001Grossed!R1C1:R46C51, RC[-1], 26) -> #REF! | C275: =INDEX(2001Grossed!R1C1:R46C51, RC1, 27) -> #REF! | D275: =IF(Menus!R9C10, RC[-1]/RC[-2], RC[-1]) -> #REF! | E275: =IF(RC11=1, RC[-3], NA()) -> #NA | F275: =INDEX(2001Grossed!R1C1:R46C51, RC1, 1) -> #REF! | G275: =IF(EQUAL(INDEX(2001Grossed!R1C1:R46C51, RC1, 2), R1C), RC4, NA()) -> #REF! | H275: =IF(EQUAL(INDEX(2001Grossed!R1C1:R46C51, RC1, 2), R1C), RC4, NA()) -> #REF! | I275: =IF(EQUAL(INDEX(2001Grossed!R1C1:R46C51, RC1, 2), R1C), RC4, NA()) -> #REF! | J275: =IF(EQUAL(INDEX(2001Grossed!R1C1:R46C51, RC1, 2), R1C), RC4, NA()) -> #REF! | K275: =IF(OR(AND(NOT(ISERROR(RC7)), ISNUMBER(RC7)), AND(NOT(ISERROR(RC8)), ISNUMBER(RC8)), AND(NOT(ISERROR(RC9)), ISNUMBER(RC9)), AND(NOT(ISERROR(RC10)), ISNUMBER(RC10))), 1, 0) -> 0 | M275: =INDEX(Gross!R1C1:R46C51, RC1, 26) -> #REF! | N275: =INDEX(Gross!R1C1:R46C51, RC1, 27) -> #REF!
A276: 313 | B276: =INDEX(2001Grossed!R1C1:R46C51, RC[-1], 26) -> #REF! | C276: =INDEX(2001Grossed!R1C1:R46C51, RC1, 27) -> #REF! | D276: =IF(Menus!R9C10, RC[-1]/RC[-2], RC[-1]) -> #REF! | E276: =IF(RC11=1, RC[-3], NA()) -> #NA | F276: =INDEX(2001Grossed!R1C1:R46C51, RC1, 1) -> #REF! | G276: =IF(EQUAL(INDEX(2001Grossed!R1C1:R46C51, RC1, 2), R1C), RC4, NA()) -> #REF! | H276: =IF(EQUAL(INDEX(2001Grossed!R1C1:R46C51, RC1, 2), R1C), RC4, NA()) -> #REF! | I276: =IF(EQUAL(INDEX(2001Grossed!R1C1:R46C51, RC1, 2), R1C), RC4, NA()) -> #REF! | J276: =IF(EQUAL(INDEX(2001Grossed!R1C1:R46C51, RC1, 2), R1C), RC4, NA()) -> #REF! | K276: =IF(OR(AND(NOT(ISERROR(RC7)), ISNUMBER(RC7)), AND(NOT(ISERROR(RC8)), ISNUMBER(RC8)), AND(NOT(ISERROR(RC9)), ISNUMBER(RC9)), AND(NOT(ISERROR(RC10)), ISNUMBER(RC10))), 1, 0) -> 0 | M276: =INDEX(Gross!R1C1:R46C51, RC1, 26) -> #REF! | N276: =INDEX(Gross!R1C1:R46C51, RC1, 27) -> #REF!
A277: 314 | B277: =INDEX(2001Grossed!R1C1:R46C51, RC[-1], 26) -> #REF! | C277: =INDEX(2001Grossed!R1C1:R46C51, RC1, 27) -> #REF! | D277: =IF(Menus!R9C10, RC[-1]/RC[-2], RC[-1]) -> #REF! | E277: =IF(RC11=1, RC[-3], NA()) -> #NA | F277: =INDEX(2001Grossed!R1C1:R46C51, RC1, 1) -> #REF! | G277: =IF(EQUAL(INDEX(2001Grossed!R1C1:R46C51, RC1, 2), R1C), RC4, NA()) -> #REF! | H277: =IF(EQUAL(INDEX(2001Grossed!R1C1:R46C51, RC1, 2), R1C), RC4, NA()) -> #REF! | I277: =IF(EQUAL(INDEX(2001Grossed!R1C1:R46C51, RC1, 2), R1C), RC4, NA()) -> #REF! | J277: =IF(EQUAL(INDEX(2001Grossed!R1C1:R46C51, RC1, 2), R1C), RC4, NA()) -> #REF! | K277: =IF(OR(AND(NOT(ISERROR(RC7)), ISNUMBER(RC7)), AND(NOT(ISERROR(RC8)), ISNUMBER(RC8)), AND(NOT(ISERROR(RC9)), ISNUMBER(RC9)), AND(NOT(ISERROR(RC10)), ISNUMBER(RC10))), 1, 0) -> 0 | M277: =INDEX(Gross!R1C1:R46C51, RC1, 26) -> #REF! | N277: =INDEX(Gross!R1C1:R46C51, RC1, 27) -> #REF!
A278: 315 | B278: =INDEX(2001Grossed!R1C1:R46C51, RC[-1], 26) -> #REF! | C278: =INDEX(2001Grossed!R1C1:R46C51, RC1, 27) -> #REF! | D278: =IF(Menus!R9C10, RC[-1]/RC[-2], RC[-1]) -> #REF! | E278: =IF(RC11=1, RC[-3], NA()) -> #NA | F278: =INDEX(2001Grossed!R1C1:R46C51, RC1, 1) -> #REF! | G278: =IF(EQUAL(INDEX(2001Grossed!R1C1:R46C51, RC1, 2), R1C), RC4, NA()) -> #REF! | H278: =IF(EQUAL(INDEX(2001Grossed!R1C1:R46C51, RC1, 2), R1C), RC4, NA()) -> #REF! | I278: =IF(EQUAL(INDEX(2001Grossed!R1C1:R46C51, RC1, 2), R1C), RC4, NA()) -> #REF! | J278: =IF(EQUAL(INDEX(2001Grossed!R1C1:R46C51, RC1, 2), R1C), RC4, NA()) -> #REF! | K278: =IF(OR(AND(NOT(ISERROR(RC7)), ISNUMBER(RC7)), AND(NOT(ISERROR(RC8)), ISNUMBER(RC8)), AND(NOT(ISERROR(RC9)), ISNUMBER(RC9)), AND(NOT(ISERROR(RC10)), ISNUMBER(RC10))), 1, 0) -> 0 | M278: =INDEX(Gross!R1C1:R46C51, RC1, 26) -> #REF! | N278: =INDEX(Gross!R1C1:R46C51, RC1, 27) -> #REF!
A279: 316 | B279: =INDEX(2001Grossed!R1C1:R46C51, RC[-1], 26) -> #REF! | C279: =INDEX(2001Grossed!R1C1:R46C51, RC1, 27) -> #REF! | D279: =IF(Menus!R9C10, RC[-1]/RC[-2], RC[-1]) -> #REF! | E279: =IF(RC11=1, RC[-3], NA()) -> #NA | F279: =INDEX(2001Grossed!R1C1:R46C51, RC1, 1) -> #REF! | G279: =IF(EQUAL(INDEX(2001Grossed!R1C1:R46C51, RC1, 2), R1C), RC4, NA()) -> #REF! | H279: =IF(EQUAL(INDEX(2001Grossed!R1C1:R46C51, RC1, 2), R1C), RC4, NA()) -> #REF! | I279: =IF(EQUAL(INDEX(2001Grossed!R1C1:R46C51, RC1, 2), R1C), RC4, NA()) -> #REF! | J279: =IF(EQUAL(INDEX(2001Grossed!R1C1:R46C51, RC1, 2), R1C), RC4, NA()) -> #REF! | K279: =IF(OR(AND(NOT(ISERROR(RC7)), ISNUMBER(RC7)), AND(NOT(ISERROR(RC8)), ISNUMBER(RC8)), AND(NOT(ISERROR(RC9)), ISNUMBER(RC9)), AND(NOT(ISERROR(RC10)), ISNUMBER(RC10))), 1, 0) -> 0 | M279: =INDEX(Gross!R1C1:R46C51, RC1, 26) -> #REF! | N279: =INDEX(Gross!R1C1:R46C51, RC1, 27) -> #REF!
A280: 317 | B280: =INDEX(2001Grossed!R1C1:R46C51, RC[-1], 26) -> #REF! | C280: =INDEX(2001Grossed!R1C1:R46C51, RC1, 27) -> #REF! | D280: =IF(Menus!R9C10, RC[-1]/RC[-2], RC[-1]) -> #REF! | E280: =IF(RC11=1, RC[-3], NA()) -> #NA | F280: =INDEX(2001Grossed!R1C1:R46C51, RC1, 1) -> #REF! | G280: =IF(EQUAL(INDEX(2001Grossed!R1C1:R46C51, RC1, 2), R1C), RC4, NA()) -> #REF! | H280: =IF(EQUAL(INDEX(2001Grossed!R1C1:R46C51, RC1, 2), R1C), RC4, NA()) -> #REF! | I280: =IF(EQUAL(INDEX(2001Grossed!R1C1:R46C51, RC1, 2), R1C), RC4, NA()) -> #REF! | J280: =IF(EQUAL(INDEX(2001Grossed!R1C1:R46C51, RC1, 2), R1C), RC4, NA()) -> #REF! | K280: =IF(OR(AND(NOT(ISERROR(RC7)), ISNUMBER(RC7)), AND(NOT(ISERROR(RC8)), ISNUMBER(RC8)), AND(NOT(ISERROR(RC9)), ISNUMBER(RC9)), AND(NOT(ISERROR(RC10)), ISNUMBER(RC10))), 1, 0) -> 0 | M280: =INDEX(Gross!R1C1:R46C51, RC1, 26) -> #REF! | N280: =INDEX(Gross!R1C1:R46C51, RC1, 27) -> #REF!
A281: 318 | B281: =INDEX(2001Grossed!R1C1:R46C51, RC[-1], 26) -> #REF! | C281: =INDEX(2001Grossed!R1C1:R46C51, RC1, 27) -> #REF! | D281: =IF(Menus!R9C10, RC[-1]/RC[-2], RC[-1]) -> #REF! | E281: =IF(RC11=1, RC[-3], NA()) -> #NA | F281: =INDEX(2001Grossed!R1C1:R46C51, RC1, 1) -> #REF! | G281: =IF(EQUAL(INDEX(2001Grossed!R1C1:R46C51, RC1, 2), R1C), RC4, NA()) -> #REF! | H281: =IF(EQUAL(INDEX(2001Grossed!R1C1:R46C51, RC1, 2), R1C), RC4, NA()) -> #REF! | I281: =IF(EQUAL(INDEX(2001Grossed!R1C1:R46C51, RC1, 2), R1C), RC4, NA()) -> #REF! | J281: =IF(EQUAL(INDEX(2001Grossed!R1C1:R46C51, RC1, 2), R1C), RC4, NA()) -> #REF! | K281: =IF(OR(AND(NOT(ISERROR(RC7)), ISNUMBER(RC7)), AND(NOT(ISERROR(RC8)), ISNUMBER(RC8)), AND(NOT(ISERROR(RC9)), ISNUMBER(RC9)), AND(NOT(ISERROR(RC10)), ISNUMBER(RC10))), 1, 0) -> 0 | M281: =INDEX(Gross!R1C1:R46C51, RC1, 26) -> #REF! | N281: =INDEX(Gross!R1C1:R46C51, RC1, 27) -> #REF!
A282: 319 | B282: =INDEX(2001Grossed!R1C1:R46C51, RC[-1], 26) -> #REF! | C282: =INDEX(2001Grossed!R1C1:R46C51, RC1, 27) -> #REF! | D282: =IF(Menus!R9C10, RC[-1]/RC[-2], RC[-1]) -> #REF! | E282: =IF(RC11=1, RC[-3], NA()) -> #NA | F282: =INDEX(2001Grossed!R1C1:R46C51, RC1, 1) -> #REF! | G282: =IF(EQUAL(INDEX(2001Grossed!R1C1:R46C51, RC1, 2), R1C), RC4, NA()) -> #REF! | H282: =IF(EQUAL(INDEX(2001Grossed!R1C1:R46C51, RC1, 2), R1C), RC4, NA()) -> #REF! | I282: =IF(EQUAL(INDEX(2001Grossed!R1C1:R46C51, RC1, 2), R1C), RC4, NA()) -> #REF! | J282: =IF(EQUAL(INDEX(2001Grossed!R1C1:R46C51, RC1, 2), R1C), RC4, NA()) -> #REF! | K282: =IF(OR(AND(NOT(ISERROR(RC7)), ISNUMBER(RC7)), AND(NOT(ISERROR(RC8)), ISNUMBER(RC8)), AND(NOT(ISERROR(RC9)), ISNUMBER(RC9)), AND(NOT(ISERROR(RC10)), ISNUMBER(RC10))), 1, 0) -> 0 | M282: =INDEX(Gross!R1C1:R46C51, RC1, 26) -> #REF! | N282: =INDEX(Gross!R1C1:R46C51, RC1, 27) -> #REF!
A283: 320 | B283: =INDEX(2001Grossed!R1C1:R46C51, RC[-1], 26) -> #REF! | C283: =INDEX(2001Grossed!R1C1:R46C51, RC1, 27) -> #REF! | D283: =IF(Menus!R9C10, RC[-1]/RC[-2], RC[-1]) -> #REF! | E283: =IF(RC11=1, RC[-3], NA()) -> #NA | F283: =INDEX(2001Grossed!R1C1:R46C51, RC1, 1) -> #REF! | G283: =IF(EQUAL(INDEX(2001Grossed!R1C1:R46C51, RC1, 2), R1C), RC4, NA()) -> #REF! | H283: =IF(EQUAL(INDEX(2001Grossed!R1C1:R46C51, RC1, 2), R1C), RC4, NA()) -> #REF! | I283: =IF(EQUAL(INDEX(2001Grossed!R1C1:R46C51, RC1, 2), R1C), RC4, NA()) -> #REF! | J283: =IF(EQUAL(INDEX(2001Grossed!R1C1:R46C51, RC1, 2), R1C), RC4, NA()) -> #REF! | K283: =IF(OR(AND(NOT(ISERROR(RC7)), ISNUMBER(RC7)), AND(NOT(ISERROR(RC8)), ISNUMBER(RC8)), AND(NOT(ISERROR(RC9)), ISNUMBER(RC9)), AND(NOT(ISERROR(RC10)), ISNUMBER(RC10))), 1, 0) -> 0 | M283: =INDEX(Gross!R1C1:R46C51, RC1, 26) -> #REF! | N283: =INDEX(Gross!R1C1:R46C51, RC1, 27) -> #REF!
A284: 321 | B284: =INDEX(2001Grossed!R1C1:R46C51, RC[-1], 26) -> #REF! | C284: =INDEX(2001Grossed!R1C1:R46C51, RC1, 27) -> #REF! | D284: =IF(Menus!R9C10, RC[-1]/RC[-2], RC[-1]) -> #REF! | E284: =IF(RC11=1, RC[-3], NA()) -> #NA | F284: =INDEX(2001Grossed!R1C1:R46C51, RC1, 1) -> #REF! | G284: =IF(EQUAL(INDEX(2001Grossed!R1C1:R46C51, RC1, 2), R1C), RC4, NA()) -> #REF! | H284: =IF(EQUAL(INDEX(2001Grossed!R1C1:R46C51, RC1, 2), R1C), RC4, NA()) -> #REF! | I284: =IF(EQUAL(INDEX(2001Grossed!R1C1:R46C51, RC1, 2), R1C), RC4, NA()) -> #REF! | J284: =IF(EQUAL(INDEX(2001Grossed!R1C1:R46C51, RC1, 2), R1C), RC4, NA()) -> #REF! | K284: =IF(OR(AND(NOT(ISERROR(RC7)), ISNUMBER(RC7)), AND(NOT(ISERROR(RC8)), ISNUMBER(RC8)), AND(NOT(ISERROR(RC9)), ISNUMBER(RC9)), AND(NOT(ISERROR(RC10)), ISNUMBER(RC10))), 1, 0) -> 0 | M284: =INDEX(Gross!R1C1:R46C51, RC1, 26) -> #REF! | N284: =INDEX(Gross!R1C1:R46C51, RC1, 27) -> #REF!
A285: 322 | B285: =INDEX(2001Grossed!R1C1:R46C51, RC[-1], 26) -> #REF! | C285: =INDEX(2001Grossed!R1C1:R46C51, RC1, 27) -> #REF! | D285: =IF(Menus!R9C10, RC[-1]/RC[-2], RC[-1]) -> #REF! | E285: =IF(RC11=1, RC[-3], NA()) -> #NA | F285: =INDEX(2001Grossed!R1C1:R46C51, RC1, 1) -> #REF! | G285: =IF(EQUAL(INDEX(2001Grossed!R1C1:R46C51, RC1, 2), R1C), RC4, NA()) -> #REF! | H285: =IF(EQUAL(INDEX(2001Grossed!R1C1:R46C51, RC1, 2), R1C), RC4, NA()) -> #REF! | I285: =IF(EQUAL(INDEX(2001Grossed!R1C1:R46C51, RC1, 2), R1C), RC4, NA()) -> #REF! | J285: =IF(EQUAL(INDEX(2001Grossed!R1C1:R46C51, RC1, 2), R1C), RC4, NA()) -> #REF! | K285: =IF(OR(AND(NOT(ISERROR(RC7)), ISNUMBER(RC7)), AND(NOT(ISERROR(RC8)), ISNUMBER(RC8)), AND(NOT(ISERROR(RC9)), ISNUMBER(RC9)), AND(NOT(ISERROR(RC10)), ISNUMBER(RC10))), 1, 0) -> 0 | M285: =INDEX(Gross!R1C1:R46C51, RC1, 26) -> #REF! | N285: =INDEX(Gross!R1C1:R46C51, RC1, 27) -> #REF!
A286: 323 | B286: =INDEX(2001Grossed!R1C1:R46C51, RC[-1], 26) -> #REF! | C286: =INDEX(2001Grossed!R1C1:R46C51, RC1, 27) -> #REF! | D286: =IF(Menus!R9C10, RC[-1]/RC[-2], RC[-1]) -> #REF! | E286: =IF(RC11=1, RC[-3], NA()) -> #NA | F286: =INDEX(2001Grossed!R1C1:R46C51, RC1, 1) -> #REF! | G286: =IF(EQUAL(INDEX(2001Grossed!R1C1:R46C51, RC1, 2), R1C), RC4, NA()) -> #REF! | H286: =IF(EQUAL(INDEX(2001Grossed!R1C1:R46C51, RC1, 2), R1C), RC4, NA()) -> #REF! | I286: =IF(EQUAL(INDEX(2001Grossed!R1C1:R46C51, RC1, 2), R1C), RC4, NA()) -> #REF! | J286: =IF(EQUAL(INDEX(2001Grossed!R1C1:R46C51, RC1, 2), R1C), RC4, NA()) -> #REF! | K286: =IF(OR(AND(NOT(ISERROR(RC7)), ISNUMBER(RC7)), AND(NOT(ISERROR(RC8)), ISNUMBER(RC8)), AND(NOT(ISERROR(RC9)), ISNUMBER(RC9)), AND(NOT(ISERROR(RC10)), ISNUMBER(RC10))), 1, 0) -> 0 | M286: =INDEX(Gross!R1C1:R46C51, RC1, 26) -> #REF! | N286: =INDEX(Gross!R1C1:R46C51, RC1, 27) -> #REF!
A287: 324 | B287: =INDEX(2001Grossed!R1C1:R46C51, RC[-1], 26) -> #REF! | C287: =INDEX(2001Grossed!R1C1:R46C51, RC1, 27) -> #REF! | D287: =IF(Menus!R9C10, RC[-1]/RC[-2], RC[-1]) -> #REF! | E287: =IF(RC11=1, RC[-3], NA()) -> #NA | F287: =INDEX(2001Grossed!R1C1:R46C51, RC1, 1) -> #REF! | G287: =IF(EQUAL(INDEX(2001Grossed!R1C1:R46C51, RC1, 2), R1C), RC4, NA()) -> #REF! | H287: =IF(EQUAL(INDEX(2001Grossed!R1C1:R46C51, RC1, 2), R1C), RC4, NA()) -> #REF! | I287: =IF(EQUAL(INDEX(2001Grossed!R1C1:R46C51, RC1, 2), R1C), RC4, NA()) -> #REF! | J287: =IF(EQUAL(INDEX(2001Grossed!R1C1:R46C51, RC1, 2), R1C), RC4, NA()) -> #REF! | K287: =IF(OR(AND(NOT(ISERROR(RC7)), ISNUMBER(RC7)), AND(NOT(ISERROR(RC8)), ISNUMBER(RC8)), AND(NOT(ISERROR(RC9)), ISNUMBER(RC9)), AND(NOT(ISERROR(RC10)), ISNUMBER(RC10))), 1, 0) -> 0 | M287: =INDEX(Gross!R1C1:R46C51, RC1, 26) -> #REF! | N287: =INDEX(Gross!R1C1:R46C51, RC1, 27) -> #REF!
A288: 325 | B288: =INDEX(2001Grossed!R1C1:R46C51, RC[-1], 26) -> #REF! | C288: =INDEX(2001Grossed!R1C1:R46C51, RC1, 27) -> #REF! | D288: =IF(Menus!R9C10, RC[-1]/RC[-2], RC[-1]) -> #REF! | E288: =IF(RC11=1, RC[-3], NA()) -> #NA | F288: =INDEX(2001Grossed!R1C1:R46C51, RC1, 1) -> #REF! | G288: =IF(EQUAL(INDEX(2001Grossed!R1C1:R46C51, RC1, 2), R1C), RC4, NA()) -> #REF! | H288: =IF(EQUAL(INDEX(2001Grossed!R1C1:R46C51, RC1, 2), R1C), RC4, NA()) -> #REF! | I288: =IF(EQUAL(INDEX(2001Grossed!R1C1:R46C51, RC1, 2), R1C), RC4, NA()) -> #REF! | J288: =IF(EQUAL(INDEX(2001Grossed!R1C1:R46C51, RC1, 2), R1C), RC4, NA()) -> #REF! | K288: =IF(OR(AND(NOT(ISERROR(RC7)), ISNUMBER(RC7)), AND(NOT(ISERROR(RC8)), ISNUMBER(RC8)), AND(NOT(ISERROR(RC9)), ISNUMBER(RC9)), AND(NOT(ISERROR(RC10)), ISNUMBER(RC10))), 1, 0) -> 0 | M288: =INDEX(Gross!R1C1:R46C51, RC1, 26) -> #REF! | N288: =INDEX(Gross!R1C1:R46C51, RC1, 27) -> #REF!
A289: 326 | B289: =INDEX(2001Grossed!R1C1:R46C51, RC[-1], 26) -> #REF! | C289: =INDEX(2001Grossed!R1C1:R46C51, RC1, 27) -> #REF! | D289: =IF(Menus!R9C10, RC[-1]/RC[-2], RC[-1]) -> #REF! | E289: =IF(RC11=1, RC[-3], NA()) -> #NA | F289: =INDEX(2001Grossed!R1C1:R46C51, RC1, 1) -> #REF! | G289: =IF(EQUAL(INDEX(2001Grossed!R1C1:R46C51, RC1, 2), R1C), RC4, NA()) -> #REF! | H289: =IF(EQUAL(INDEX(2001Grossed!R1C1:R46C51, RC1, 2), R1C), RC4, NA()) -> #REF! | I289: =IF(EQUAL(INDEX(2001Grossed!R1C1:R46C51, RC1, 2), R1C), RC4, NA()) -> #REF! | J289: =IF(EQUAL(INDEX(2001Grossed!R1C1:R46C51, RC1, 2), R1C), RC4, NA()) -> #REF! | K289: =IF(OR(AND(NOT(ISERROR(RC7)), ISNUMBER(RC7)), AND(NOT(ISERROR(RC8)), ISNUMBER(RC8)), AND(NOT(ISERROR(RC9)), ISNUMBER(RC9)), AND(NOT(ISERROR(RC10)), ISNUMBER(RC10))), 1, 0) -> 0 | M289: =INDEX(Gross!R1C1:R46C51, RC1, 26) -> #REF! | N289: =INDEX(Gross!R1C1:R46C51, RC1, 27) -> #REF!
A290: 327 | B290: =INDEX(2001Grossed!R1C1:R46C51, RC[-1], 26) -> #REF! | C290: =INDEX(2001Grossed!R1C1:R46C51, RC1, 27) -> #REF! | D290: =IF(Menus!R9C10, RC[-1]/RC[-2], RC[-1]) -> #REF! | E290: =IF(RC11=1, RC[-3], NA()) -> #NA | F290: =INDEX(2001Grossed!R1C1:R46C51, RC1, 1) -> #REF! | G290: =IF(EQUAL(INDEX(2001Grossed!R1C1:R46C51, RC1, 2), R1C), RC4, NA()) -> #REF! | H290: =IF(EQUAL(INDEX(2001Grossed!R1C1:R46C51, RC1, 2), R1C), RC4, NA()) -> #REF! | I290: =IF(EQUAL(INDEX(2001Grossed!R1C1:R46C51, RC1, 2), R1C), RC4, NA()) -> #REF! | J290: =IF(EQUAL(INDEX(2001Grossed!R1C1:R46C51, RC1, 2), R1C), RC4, NA()) -> #REF! | K290: =IF(OR(AND(NOT(ISERROR(RC7)), ISNUMBER(RC7)), AND(NOT(ISERROR(RC8)), ISNUMBER(RC8)), AND(NOT(ISERROR(RC9)), ISNUMBER(RC9)), AND(NOT(ISERROR(RC10)), ISNUMBER(RC10))), 1, 0) -> 0 | M290: =INDEX(Gross!R1C1:R46C51, RC1, 26) -> #REF! | N290: =INDEX(Gross!R1C1:R46C51, RC1, 27) -> #REF!
A291: 328 | B291: =INDEX(2001Grossed!R1C1:R46C51, RC[-1], 26) -> #REF! | C291: =INDEX(2001Grossed!R1C1:R46C51, RC1, 27) -> #REF! | D291: =IF(Menus!R9C10, RC[-1]/RC[-2], RC[-1]) -> #REF! | E291: =IF(RC11=1, RC[-3], NA()) -> #NA | F291: =INDEX(2001Grossed!R1C1:R46C51, RC1, 1) -> #REF! | G291: =IF(EQUAL(INDEX(2001Grossed!R1C1:R46C51, RC1, 2), R1C), RC4, NA()) -> #REF! | H291: =IF(EQUAL(INDEX(2001Grossed!R1C1:R46C51, RC1, 2), R1C), RC4, NA()) -> #REF! | I291: =IF(EQUAL(INDEX(2001Grossed!R1C1:R46C51, RC1, 2), R1C), RC4, NA()) -> #REF! | J291: =IF(EQUAL(INDEX(2001Grossed!R1C1:R46C51, RC1, 2), R1C), RC4, NA()) -> #REF! | K291: =IF(OR(AND(NOT(ISERROR(RC7)), ISNUMBER(RC7)), AND(NOT(ISERROR(RC8)), ISNUMBER(RC8)), AND(NOT(ISERROR(RC9)), ISNUMBER(RC9)), AND(NOT(ISERROR(RC10)), ISNUMBER(RC10))), 1, 0) -> 0 | M291: =INDEX(Gross!R1C1:R46C51, RC1, 26) -> #REF! | N291: =INDEX(Gross!R1C1:R46C51, RC1, 27) -> #REF!
A292: 329 | B292: =INDEX(2001Grossed!R1C1:R46C51, RC[-1], 26) -> #REF! | C292: =INDEX(2001Grossed!R1C1:R46C51, RC1, 27) -> #REF! | D292: =IF(Menus!R9C10, RC[-1]/RC[-2], RC[-1]) -> #REF! | E292: =IF(RC11=1, RC[-3], NA()) -> #NA | F292: =INDEX(2001Grossed!R1C1:R46C51, RC1, 1) -> #REF! | G292: =IF(EQUAL(INDEX(2001Grossed!R1C1:R46C51, RC1, 2), R1C), RC4, NA()) -> #REF! | H292: =IF(EQUAL(INDEX(2001Grossed!R1C1:R46C51, RC1, 2), R1C), RC4, NA()) -> #REF! | I292: =IF(EQUAL(INDEX(2001Grossed!R1C1:R46C51, RC1, 2), R1C), RC4, NA()) -> #REF! | J292: =IF(EQUAL(INDEX(2001Grossed!R1C1:R46C51, RC1, 2), R1C), RC4, NA()) -> #REF! | K292: =IF(OR(AND(NOT(ISERROR(RC7)), ISNUMBER(RC7)), AND(NOT(ISERROR(RC8)), ISNUMBER(RC8)), AND(NOT(ISERROR(RC9)), ISNUMBER(RC9)), AND(NOT(ISERROR(RC10)), ISNUMBER(RC10))), 1, 0) -> 0 | M292: =INDEX(Gross!R1C1:R46C51, RC1, 26) -> #REF! | N292: =INDEX(Gross!R1C1:R46C51, RC1, 27) -> #REF!
A293: 330 | B293: =INDEX(2001Grossed!R1C1:R46C51, RC[-1], 26) -> #REF! | C293: =INDEX(2001Grossed!R1C1:R46C51, RC1, 27) -> #REF! | D293: =IF(Menus!R9C10, RC[-1]/RC[-2], RC[-1]) -> #REF! | E293: =IF(RC11=1, RC[-3], NA()) -> #NA | F293: =INDEX(2001Grossed!R1C1:R46C51, RC1, 1) -> #REF! | G293: =IF(EQUAL(INDEX(2001Grossed!R1C1:R46C51, RC1, 2), R1C), RC4, NA()) -> #REF! | H293: =IF(EQUAL(INDEX(2001Grossed!R1C1:R46C51, RC1, 2), R1C), RC4, NA()) -> #REF! | I293: =IF(EQUAL(INDEX(2001Grossed!R1C1:R46C51, RC1, 2), R1C), RC4, NA()) -> #REF! | J293: =IF(EQUAL(INDEX(2001Grossed!R1C1:R46C51, RC1, 2), R1C), RC4, NA()) -> #REF! | K293: =IF(OR(AND(NOT(ISERROR(RC7)), ISNUMBER(RC7)), AND(NOT(ISERROR(RC8)), ISNUMBER(RC8)), AND(NOT(ISERROR(RC9)), ISNUMBER(RC9)), AND(NOT(ISERROR(RC10)), ISNUMBER(RC10))), 1, 0) -> 0 | M293: =INDEX(Gross!R1C1:R46C51, RC1, 26) -> #REF! | N293: =INDEX(Gross!R1C1:R46C51, RC1, 27) -> #REF!
A294: 331 | B294: =INDEX(2001Grossed!R1C1:R46C51, RC[-1], 26) -> #REF! | C294: =INDEX(2001Grossed!R1C1:R46C51, RC1, 27) -> #REF! | D294: =IF(Menus!R9C10, RC[-1]/RC[-2], RC[-1]) -> #REF! | E294: =IF(RC11=1, RC[-3], NA()) -> #NA | F294: =INDEX(2001Grossed!R1C1:R46C51, RC1, 1) -> #REF! | G294: =IF(EQUAL(INDEX(2001Grossed!R1C1:R46C51, RC1, 2), R1C), RC4, NA()) -> #REF! | H294: =IF(EQUAL(INDEX(2001Grossed!R1C1:R46C51, RC1, 2), R1C), RC4, NA()) -> #REF! | I294: =IF(EQUAL(INDEX(2001Grossed!R1C1:R46C51, RC1, 2), R1C), RC4, NA()) -> #REF! | J294: =IF(EQUAL(INDEX(2001Grossed!R1C1:R46C51, RC1, 2), R1C), RC4, NA()) -> #REF! | K294: =IF(OR(AND(NOT(ISERROR(RC7)), ISNUMBER(RC7)), AND(NOT(ISERROR(RC8)), ISNUMBER(RC8)), AND(NOT(ISERROR(RC9)), ISNUMBER(RC9)), AND(NOT(ISERROR(RC10)), ISNUMBER(RC10))), 1, 0) -> 0 | M294: =INDEX(Gross!R1C1:R46C51, RC1, 26) -> #REF! | N294: =INDEX(Gross!R1C1:R46C51, RC1, 27) -> #REF!
A295: 332 | B295: =INDEX(2001Grossed!R1C1:R46C51, RC[-1], 26) -> #REF! | C295: =INDEX(2001Grossed!R1C1:R46C51, RC1, 27) -> #REF! | D295: =IF(Menus!R9C10, RC[-1]/RC[-2], RC[-1]) -> #REF! | E295: =IF(RC11=1, RC[-3], NA()) -> #NA | F295: =INDEX(2001Grossed!R1C1:R46C51, RC1, 1) -> #REF! | G295: =IF(EQUAL(INDEX(2001Grossed!R1C1:R46C51, RC1, 2), R1C), RC4, NA()) -> #REF! | H295: =IF(EQUAL(INDEX(2001Grossed!R1C1:R46C51, RC1, 2), R1C), RC4, NA()) -> #REF! | I295: =IF(EQUAL(INDEX(2001Grossed!R1C1:R46C51, RC1, 2), R1C), RC4, NA()) -> #REF! | J295: =IF(EQUAL(INDEX(2001Grossed!R1C1:R46C51, RC1, 2), R1C), RC4, NA()) -> #REF! | K295: =IF(OR(AND(NOT(ISERROR(RC7)), ISNUMBER(RC7)), AND(NOT(ISERROR(RC8)), ISNUMBER(RC8)), AND(NOT(ISERROR(RC9)), ISNUMBER(RC9)), AND(NOT(ISERROR(RC10)), ISNUMBER(RC10))), 1, 0) -> 0 | M295: =INDEX(Gross!R1C1:R46C51, RC1, 26) -> #REF! | N295: =INDEX(Gross!R1C1:R46C51, RC1, 27) -> #REF!
A296: 333 | B296: =INDEX(2001Grossed!R1C1:R46C51, RC[-1], 26) -> #REF! | C296: =INDEX(2001Grossed!R1C1:R46C51, RC1, 27) -> #REF! | D296: =IF(Menus!R9C10, RC[-1]/RC[-2], RC[-1]) -> #REF! | E296: =IF(RC11=1, RC[-3], NA()) -> #NA | F296: =INDEX(2001Grossed!R1C1:R46C51, RC1, 1) -> #REF! | G296: =IF(EQUAL(INDEX(2001Grossed!R1C1:R46C51, RC1, 2), R1C), RC4, NA()) -> #REF! | H296: =IF(EQUAL(INDEX(2001Grossed!R1C1:R46C51, RC1, 2), R1C), RC4, NA()) -> #REF! | I296: =IF(EQUAL(INDEX(2001Grossed!R1C1:R46C51, RC1, 2), R1C), RC4, NA()) -> #REF! | J296: =IF(EQUAL(INDEX(2001Grossed!R1C1:R46C51, RC1, 2), R1C), RC4, NA()) -> #REF! | K296: =IF(OR(AND(NOT(ISERROR(RC7)), ISNUMBER(RC7)), AND(NOT(ISERROR(RC8)), ISNUMBER(RC8)), AND(NOT(ISERROR(RC9)), ISNUMBER(RC9)), AND(NOT(ISERROR(RC10)), ISNUMBER(RC10))), 1, 0) -> 0 | M296: =INDEX(Gross!R1C1:R46C51, RC1, 26) -> #REF! | N296: =INDEX(Gross!R1C1:R46C51, RC1, 27) -> #REF!
A297: 334 | B297: =INDEX(2001Grossed!R1C1:R46C51, RC[-1], 26) -> #REF! | C297: =INDEX(2001Grossed!R1C1:R46C51, RC1, 27) -> #REF! | D297: =IF(Menus!R9C10, RC[-1]/RC[-2], RC[-1]) -> #REF! | E297: =IF(RC11=1, RC[-3], NA()) -> #NA | F297: =INDEX(2001Grossed!R1C1:R46C51, RC1, 1) -> #REF! | G297: =IF(EQUAL(INDEX(2001Grossed!R1C1:R46C51, RC1, 2), R1C), RC4, NA()) -> #REF! | H297: =IF(EQUAL(INDEX(2001Grossed!R1C1:R46C51, RC1, 2), R1C), RC4, NA()) -> #REF! | I297: =IF(EQUAL(INDEX(2001Grossed!R1C1:R46C51, RC1, 2), R1C), RC4, NA()) -> #REF! | J297: =IF(EQUAL(INDEX(2001Grossed!R1C1:R46C51, RC1, 2), R1C), RC4, NA()) -> #REF! | K297: =IF(OR(AND(NOT(ISERROR(RC7)), ISNUMBER(RC7)), AND(NOT(ISERROR(RC8)), ISNUMBER(RC8)), AND(NOT(ISERROR(RC9)), ISNUMBER(RC9)), AND(NOT(ISERROR(RC10)), ISNUMBER(RC10))), 1, 0) -> 0 | M297: =INDEX(Gross!R1C1:R46C51, RC1, 26) -> #REF! | N297: =INDEX(Gross!R1C1:R46C51, RC1, 27) -> #REF!
A298: 335 | B298: =INDEX(2001Grossed!R1C1:R46C51, RC[-1], 26) -> #REF! | C298: =INDEX(2001Grossed!R1C1:R46C51, RC1, 27) -> #REF! | D298: =IF(Menus!R9C10, RC[-1]/RC[-2], RC[-1]) -> #REF! | E298: =IF(RC11=1, RC[-3], NA()) -> #NA | F298: =INDEX(2001Grossed!R1C1:R46C51, RC1, 1) -> #REF! | G298: =IF(EQUAL(INDEX(2001Grossed!R1C1:R46C51, RC1, 2), R1C), RC4, NA()) -> #REF! | H298: =IF(EQUAL(INDEX(2001Grossed!R1C1:R46C51, RC1, 2), R1C), RC4, NA()) -> #REF! | I298: =IF(EQUAL(INDEX(2001Grossed!R1C1:R46C51, RC1, 2), R1C), RC4, NA()) -> #REF! | J298: =IF(EQUAL(INDEX(2001Grossed!R1C1:R46C51, RC1, 2), R1C), RC4, NA()) -> #REF! | K298: =IF(OR(AND(NOT(ISERROR(RC7)), ISNUMBER(RC7)), AND(NOT(ISERROR(RC8)), ISNUMBER(RC8)), AND(NOT(ISERROR(RC9)), ISNUMBER(RC9)), AND(NOT(ISERROR(RC10)), ISNUMBER(RC10))), 1, 0) -> 0 | M298: =INDEX(Gross!R1C1:R46C51, RC1, 26) -> #REF! | N298: =INDEX(Gross!R1C1:R46C51, RC1, 27) -> #REF!
A299: 336 | B299: =INDEX(2001Grossed!R1C1:R46C51, RC[-1], 26) -> #REF! | C299: =INDEX(2001Grossed!R1C1:R46C51, RC1, 27) -> #REF! | D299: =IF(Menus!R9C10, RC[-1]/RC[-2], RC[-1]) -> #REF! | E299: =IF(RC11=1, RC[-3], NA()) -> #NA | F299: =INDEX(2001Grossed!R1C1:R46C51, RC1, 1) -> #REF! | G299: =IF(EQUAL(INDEX(2001Grossed!R1C1:R46C51, RC1, 2), R1C), RC4, NA()) -> #REF! | H299: =IF(EQUAL(INDEX(2001Grossed!R1C1:R46C51, RC1, 2), R1C), RC4, NA()) -> #REF! | I299: =IF(EQUAL(INDEX(2001Grossed!R1C1:R46C51, RC1, 2), R1C), RC4, NA()) -> #REF! | J299: =IF(EQUAL(INDEX(2001Grossed!R1C1:R46C51, RC1, 2), R1C), RC4, NA()) -> #REF! | K299: =IF(OR(AND(NOT(ISERROR(RC7)), ISNUMBER(RC7)), AND(NOT(ISERROR(RC8)), ISNUMBER(RC8)), AND(NOT(ISERROR(RC9)), ISNUMBER(RC9)), AND(NOT(ISERROR(RC10)), ISNUMBER(RC10))), 1, 0) -> 0 | M299: =INDEX(Gross!R1C1:R46C51, RC1, 26) -> #REF! | N299: =INDEX(Gross!R1C1:R46C51, RC1, 27) -> #REF!
A300: 337 | B300: =INDEX(2001Grossed!R1C1:R46C51, RC[-1], 26) -> #REF! | C300: =INDEX(2001Grossed!R1C1:R46C51, RC1, 27) -> #REF! | D300: =IF(Menus!R9C10, RC[-1]/RC[-2], RC[-1]) -> #REF! | E300: =IF(RC11=1, RC[-3], NA()) -> #NA | F300: =INDEX(2001Grossed!R1C1:R46C51, RC1, 1) -> #REF! | G300: =IF(EQUAL(INDEX(2001Grossed!R1C1:R46C51, RC1, 2), R1C), RC4, NA()) -> #REF! | H300: =IF(EQUAL(INDEX(2001Grossed!R1C1:R46C51, RC1, 2), R1C), RC4, NA()) -> #REF! | I300: =IF(EQUAL(INDEX(2001Grossed!R1C1:R46C51, RC1, 2), R1C), RC4, NA()) -> #REF! | J300: =IF(EQUAL(INDEX(2001Grossed!R1C1:R46C51, RC1, 2), R1C), RC4, NA()) -> #REF! | K300: =IF(OR(AND(NOT(ISERROR(RC7)), ISNUMBER(RC7)), AND(NOT(ISERROR(RC8)), ISNUMBER(RC8)), AND(NOT(ISERROR(RC9)), ISNUMBER(RC9)), AND(NOT(ISERROR(RC10)), ISNUMBER(RC10))), 1, 0) -> 0 | M300: =INDEX(Gross!R1C1:R46C51, RC1, 26) -> #REF! | N300: =INDEX(Gross!R1C1:R46C51, RC1, 27) -> #REF!
A301: 338 | B301: =INDEX(2001Grossed!R1C1:R46C51, RC[-1], 26) -> #REF! | C301: =INDEX(2001Grossed!R1C1:R46C51, RC1, 27) -> #REF! | D301: =IF(Menus!R9C10, RC[-1]/RC[-2], RC[-1]) -> #REF! | E301: =IF(RC11=1, RC[-3], NA()) -> #NA | F301: =INDEX(2001Grossed!R1C1:R46C51, RC1, 1) -> #REF! | G301: =IF(EQUAL(INDEX(2001Grossed!R1C1:R46C51, RC1, 2), R1C), RC4, NA()) -> #REF! | H301: =IF(EQUAL(INDEX(2001Grossed!R1C1:R46C51, RC1, 2), R1C), RC4, NA()) -> #REF! | I301: =IF(EQUAL(INDEX(2001Grossed!R1C1:R46C51, RC1, 2), R1C), RC4, NA()) -> #REF! | J301: =IF(EQUAL(INDEX(2001Grossed!R1C1:R46C51, RC1, 2), R1C), RC4, NA()) -> #REF! | K301: =IF(OR(AND(NOT(ISERROR(RC7)), ISNUMBER(RC7)), AND(NOT(ISERROR(RC8)), ISNUMBER(RC8)), AND(NOT(ISERROR(RC9)), ISNUMBER(RC9)), AND(NOT(ISERROR(RC10)), ISNUMBER(RC10))), 1, 0) -> 0 | M301: =INDEX(Gross!R1C1:R46C51, RC1, 26) -> #REF! | N301: =INDEX(Gross!R1C1:R46C51, RC1, 27) -> #REF!
A302: 339 | B302: =INDEX(2001Grossed!R1C1:R46C51, RC[-1], 26) -> #REF! | C302: =INDEX(2001Grossed!R1C1:R46C51, RC1, 27) -> #REF! | D302: =IF(Menus!R9C10, RC[-1]/RC[-2], RC[-1]) -> #REF! | E302: =IF(RC11=1, RC[-3], NA()) -> #NA | F302: =INDEX(2001Grossed!R1C1:R46C51, RC1, 1) -> #REF! | G302: =IF(EQUAL(INDEX(2001Grossed!R1C1:R46C51, RC1, 2), R1C), RC4, NA()) -> #REF! | H302: =IF(EQUAL(INDEX(2001Grossed!R1C1:R46C51, RC1, 2), R1C), RC4, NA()) -> #REF! | I302: =IF(EQUAL(INDEX(2001Grossed!R1C1:R46C51, RC1, 2), R1C), RC4, NA()) -> #REF! | J302: =IF(EQUAL(INDEX(2001Grossed!R1C1:R46C51, RC1, 2), R1C), RC4, NA()) -> #REF! | K302: =IF(OR(AND(NOT(ISERROR(RC7)), ISNUMBER(RC7)), AND(NOT(ISERROR(RC8)), ISNUMBER(RC8)), AND(NOT(ISERROR(RC9)), ISNUMBER(RC9)), AND(NOT(ISERROR(RC10)), ISNUMBER(RC10))), 1, 0) -> 0 | M302: =INDEX(Gross!R1C1:R46C51, RC1, 26) -> #REF! | N302: =INDEX(Gross!R1C1:R46C51, RC1, 27) -> #REF!
A303: 340 | B303: =INDEX(2001Grossed!R1C1:R46C51, RC[-1], 26) -> #REF! | C303: =INDEX(2001Grossed!R1C1:R46C51, RC1, 27) -> #REF! | D303: =IF(Menus!R9C10, RC[-1]/RC[-2], RC[-1]) -> #REF! | E303: =IF(RC11=1, RC[-3], NA()) -> #NA | F303: =INDEX(2001Grossed!R1C1:R46C51, RC1, 1) -> #REF! | G303: =IF(EQUAL(INDEX(2001Grossed!R1C1:R46C51, RC1, 2), R1C), RC4, NA()) -> #REF! | H303: =IF(EQUAL(INDEX(2001Grossed!R1C1:R46C51, RC1, 2), R1C), RC4, NA()) -> #REF! | I303: =IF(EQUAL(INDEX(2001Grossed!R1C1:R46C51, RC1, 2), R1C), RC4, NA()) -> #REF! | J303: =IF(EQUAL(INDEX(2001Grossed!R1C1:R46C51, RC1, 2), R1C), RC4, NA()) -> #REF! | K303: =IF(OR(AND(NOT(ISERROR(RC7)), ISNUMBER(RC7)), AND(NOT(ISERROR(RC8)), ISNUMBER(RC8)), AND(NOT(ISERROR(RC9)), ISNUMBER(RC9)), AND(NOT(ISERROR(RC10)), ISNUMBER(RC10))), 1, 0) -> 0 | M303: =INDEX(Gross!R1C1:R46C51, RC1, 26) -> #REF! | N303: =INDEX(Gross!R1C1:R46C51, RC1, 27) -> #REF!
A304: 341 | B304: =INDEX(2001Grossed!R1C1:R46C51, RC[-1], 26) -> #REF! | C304: =INDEX(2001Grossed!R1C1:R46C51, RC1, 27) -> #REF! | D304: =IF(Menus!R9C10, RC[-1]/RC[-2], RC[-1]) -> #REF! | E304: =IF(RC11=1, RC[-3], NA()) -> #NA | F304: =INDEX(2001Grossed!R1C1:R46C51, RC1, 1) -> #REF! | G304: =IF(EQUAL(INDEX(2001Grossed!R1C1:R46C51, RC1, 2), R1C), RC4, NA()) -> #REF! | H304: =IF(EQUAL(INDEX(2001Grossed!R1C1:R46C51, RC1, 2), R1C), RC4, NA()) -> #REF! | I304: =IF(EQUAL(INDEX(2001Grossed!R1C1:R46C51, RC1, 2), R1C), RC4, NA()) -> #REF! | J304: =IF(EQUAL(INDEX(2001Grossed!R1C1:R46C51, RC1, 2), R1C), RC4, NA()) -> #REF! | K304: =IF(OR(AND(NOT(ISERROR(RC7)), ISNUMBER(RC7)), AND(NOT(ISERROR(RC8)), ISNUMBER(RC8)), AND(NOT(ISERROR(RC9)), ISNUMBER(RC9)), AND(NOT(ISERROR(RC10)), ISNUMBER(RC10))), 1, 0) -> 0 | M304: =INDEX(Gross!R1C1:R46C51, RC1, 26) -> #REF! | N304: =INDEX(Gross!R1C1:R46C51, RC1, 27) -> #REF!
A305: 342 | B305: =INDEX(2001Grossed!R1C1:R46C51, RC[-1], 26) -> #REF! | C305: =INDEX(2001Grossed!R1C1:R46C51, RC1, 27) -> #REF! | D305: =IF(Menus!R9C10, RC[-1]/RC[-2], RC[-1]) -> #REF! | E305: =IF(RC11=1, RC[-3], NA()) -> #NA | F305: =INDEX(2001Grossed!R1C1:R46C51, RC1, 1) -> #REF! | G305: =IF(EQUAL(INDEX(2001Grossed!R1C1:R46C51, RC1, 2), R1C), RC4, NA()) -> #REF! | H305: =IF(EQUAL(INDEX(2001Grossed!R1C1:R46C51, RC1, 2), R1C), RC4, NA()) -> #REF! | I305: =IF(EQUAL(INDEX(2001Grossed!R1C1:R46C51, RC1, 2), R1C), RC4, NA()) -> #REF! | J305: =IF(EQUAL(INDEX(2001Grossed!R1C1:R46C51, RC1, 2), R1C), RC4, NA()) -> #REF! | K305: =IF(OR(AND(NOT(ISERROR(RC7)), ISNUMBER(RC7)), AND(NOT(ISERROR(RC8)), ISNUMBER(RC8)), AND(NOT(ISERROR(RC9)), ISNUMBER(RC9)), AND(NOT(ISERROR(RC10)), ISNUMBER(RC10))), 1, 0) -> 0 | M305: =INDEX(Gross!R1C1:R46C51, RC1, 26) -> #REF! | N305: =INDEX(Gross!R1C1:R46C51, RC1, 27) -> #REF!
A306: 343 | B306: =INDEX(2001Grossed!R1C1:R46C51, RC[-1], 26) -> #REF! | C306: =INDEX(2001Grossed!R1C1:R46C51, RC1, 27) -> #REF! | D306: =IF(Menus!R9C10, RC[-1]/RC[-2], RC[-1]) -> #REF! | E306: =IF(RC11=1, RC[-3], NA()) -> #NA | F306: =INDEX(2001Grossed!R1C1:R46C51, RC1, 1) -> #REF! | G306: =IF(EQUAL(INDEX(2001Grossed!R1C1:R46C51, RC1, 2), R1C), RC4, NA()) -> #REF! | H306: =IF(EQUAL(INDEX(2001Grossed!R1C1:R46C51, RC1, 2), R1C), RC4, NA()) -> #REF! | I306: =IF(EQUAL(INDEX(2001Grossed!R1C1:R46C51, RC1, 2), R1C), RC4, NA()) -> #REF! | J306: =IF(EQUAL(INDEX(2001Grossed!R1C1:R46C51, RC1, 2), R1C), RC4, NA()) -> #REF! | K306: =IF(OR(AND(NOT(ISERROR(RC7)), ISNUMBER(RC7)), AND(NOT(ISERROR(RC8)), ISNUMBER(RC8)), AND(NOT(ISERROR(RC9)), ISNUMBER(RC9)), AND(NOT(ISERROR(RC10)), ISNUMBER(RC10))), 1, 0) -> 0 | M306: =INDEX(Gross!R1C1:R46C51, RC1, 26) -> #REF! | N306: =INDEX(Gross!R1C1:R46C51, RC1, 27) -> #REF!
A307: 344 | B307: =INDEX(2001Grossed!R1C1:R46C51, RC[-1], 26) -> #REF! | C307: =INDEX(2001Grossed!R1C1:R46C51, RC1, 27) -> #REF! | D307: =IF(Menus!R9C10, RC[-1]/RC[-2], RC[-1]) -> #REF! | E307: =IF(RC11=1, RC[-3], NA()) -> #NA | F307: =INDEX(2001Grossed!R1C1:R46C51, RC1, 1) -> #REF! | G307: =IF(EQUAL(INDEX(2001Grossed!R1C1:R46C51, RC1, 2), R1C), RC4, NA()) -> #REF! | H307: =IF(EQUAL(INDEX(2001Grossed!R1C1:R46C51, RC1, 2), R1C), RC4, NA()) -> #REF! | I307: =IF(EQUAL(INDEX(2001Grossed!R1C1:R46C51, RC1, 2), R1C), RC4, NA()) -> #REF! | J307: =IF(EQUAL(INDEX(2001Grossed!R1C1:R46C51, RC1, 2), R1C), RC4, NA()) -> #REF! | K307: =IF(OR(AND(NOT(ISERROR(RC7)), ISNUMBER(RC7)), AND(NOT(ISERROR(RC8)), ISNUMBER(RC8)), AND(NOT(ISERROR(RC9)), ISNUMBER(RC9)), AND(NOT(ISERROR(RC10)), ISNUMBER(RC10))), 1, 0) -> 0 | M307: =INDEX(Gross!R1C1:R46C51, RC1, 26) -> #REF! | N307: =INDEX(Gross!R1C1:R46C51, RC1, 27) -> #REF!
A308: 345 | B308: =INDEX(2001Grossed!R1C1:R46C51, RC[-1], 26) -> #REF! | C308: =INDEX(2001Grossed!R1C1:R46C51, RC1, 27) -> #REF! | D308: =IF(Menus!R9C10, RC[-1]/RC[-2], RC[-1]) -> #REF! | E308: =IF(RC11=1, RC[-3], NA()) -> #NA | F308: =INDEX(2001Grossed!R1C1:R46C51, RC1, 1) -> #REF! | G308: =IF(EQUAL(INDEX(2001Grossed!R1C1:R46C51, RC1, 2), R1C), RC4, NA()) -> #REF! | H308: =IF(EQUAL(INDEX(2001Grossed!R1C1:R46C51, RC1, 2), R1C), RC4, NA()) -> #REF! | I308: =IF(EQUAL(INDEX(2001Grossed!R1C1:R46C51, RC1, 2), R1C), RC4, NA()) -> #REF! | J308: =IF(EQUAL(INDEX(2001Grossed!R1C1:R46C51, RC1, 2), R1C), RC4, NA()) -> #REF! | K308: =IF(OR(AND(NOT(ISERROR(RC7)), ISNUMBER(RC7)), AND(NOT(ISERROR(RC8)), ISNUMBER(RC8)), AND(NOT(ISERROR(RC9)), ISNUMBER(RC9)), AND(NOT(ISERROR(RC10)), ISNUMBER(RC10))), 1, 0) -> 0 | M308: =INDEX(Gross!R1C1:R46C51, RC1, 26) -> #REF! | N308: =INDEX(Gross!R1C1:R46C51, RC1, 27) -> #REF!
A309: 346 | B309: =INDEX(2001Grossed!R1C1:R46C51, RC[-1], 26) -> #REF! | C309: =INDEX(2001Grossed!R1C1:R46C51, RC1, 27) -> #REF! | D309: =IF(Menus!R9C10, RC[-1]/RC[-2], RC[-1]) -> #REF! | E309: =IF(RC11=1, RC[-3], NA()) -> #NA | F309: =INDEX(2001Grossed!R1C1:R46C51, RC1, 1) -> #REF! | G309: =IF(EQUAL(INDEX(2001Grossed!R1C1:R46C51, RC1, 2), R1C), RC4, NA()) -> #REF! | H309: =IF(EQUAL(INDEX(2001Grossed!R1C1:R46C51, RC1, 2), R1C), RC4, NA()) -> #REF! | I309: =IF(EQUAL(INDEX(2001Grossed!R1C1:R46C51, RC1, 2), R1C), RC4, NA()) -> #REF! | J309: =IF(EQUAL(INDEX(2001Grossed!R1C1:R46C51, RC1, 2), R1C), RC4, NA()) -> #REF! | K309: =IF(OR(AND(NOT(ISERROR(RC7)), ISNUMBER(RC7)), AND(NOT(ISERROR(RC8)), ISNUMBER(RC8)), AND(NOT(ISERROR(RC9)), ISNUMBER(RC9)), AND(NOT(ISERROR(RC10)), ISNUMBER(RC10))), 1, 0) -> 0 | M309: =INDEX(Gross!R1C1:R46C51, RC1, 26) -> #REF! | N309: =INDEX(Gross!R1C1:R46C51, RC1, 27) -> #REF!
A310: 347 | B310: =INDEX(2001Grossed!R1C1:R46C51, RC[-1], 26) -> #REF! | C310: =INDEX(2001Grossed!R1C1:R46C51, RC1, 27) -> #REF! | D310: =IF(Menus!R9C10, RC[-1]/RC[-2], RC[-1]) -> #REF! | E310: =IF(RC11=1, RC[-3], NA()) -> #NA | F310: =INDEX(2001Grossed!R1C1:R46C51, RC1, 1) -> #REF! | G310: =IF(EQUAL(INDEX(2001Grossed!R1C1:R46C51, RC1, 2), R1C), RC4, NA()) -> #REF! | H310: =IF(EQUAL(INDEX(2001Grossed!R1C1:R46C51, RC1, 2), R1C), RC4, NA()) -> #REF! | I310: =IF(EQUAL(INDEX(2001Grossed!R1C1:R46C51, RC1, 2), R1C), RC4, NA()) -> #REF! | J310: =IF(EQUAL(INDEX(2001Grossed!R1C1:R46C51, RC1, 2), R1C), RC4, NA()) -> #REF! | K310: =IF(OR(AND(NOT(ISERROR(RC7)), ISNUMBER(RC7)), AND(NOT(ISERROR(RC8)), ISNUMBER(RC8)), AND(NOT(ISERROR(RC9)), ISNUMBER(RC9)), AND(NOT(ISERROR(RC10)), ISNUMBER(RC10))), 1, 0) -> 0 | M310: =INDEX(Gross!R1C1:R46C51, RC1, 26) -> #REF! | N310: =INDEX(Gross!R1C1:R46C51, RC1, 27) -> #REF!
A311: 348 | B311: =INDEX(2001Grossed!R1C1:R46C51, RC[-1], 26) -> #REF! | C311: =INDEX(2001Grossed!R1C1:R46C51, RC1, 27) -> #REF! | D311: =IF(Menus!R9C10, RC[-1]/RC[-2], RC[-1]) -> #REF! | E311: =IF(RC11=1, RC[-3], NA()) -> #NA | F311: =INDEX(2001Grossed!R1C1:R46C51, RC1, 1) -> #REF! | G311: =IF(EQUAL(INDEX(2001Grossed!R1C1:R46C51, RC1, 2), R1C), RC4, NA()) -> #REF! | H311: =IF(EQUAL(INDEX(2001Grossed!R1C1:R46C51, RC1, 2), R1C), RC4, NA()) -> #REF! | I311: =IF(EQUAL(INDEX(2001Grossed!R1C1:R46C51, RC1, 2), R1C), RC4, NA()) -> #REF! | J311: =IF(EQUAL(INDEX(2001Grossed!R1C1:R46C51, RC1, 2), R1C), RC4, NA()) -> #REF! | K311: =IF(OR(AND(NOT(ISERROR(RC7)), ISNUMBER(RC7)), AND(NOT(ISERROR(RC8)), ISNUMBER(RC8)), AND(NOT(ISERROR(RC9)), ISNUMBER(RC9)), AND(NOT(ISERROR(RC10)), ISNUMBER(RC10))), 1, 0) -> 0 | M311: =INDEX(Gross!R1C1:R46C51, RC1, 26) -> #REF! | N311: =INDEX(Gross!R1C1:R46C51, RC1, 27) -> #REF!
A312: 349 | B312: =INDEX(2001Grossed!R1C1:R46C51, RC[-1], 26) -> #REF! | C312: =INDEX(2001Grossed!R1C1:R46C51, RC1, 27) -> #REF! | D312: =IF(Menus!R9C10, RC[-1]/RC[-2], RC[-1]) -> #REF! | E312: =IF(RC11=1, RC[-3], NA()) -> #NA | F312: =INDEX(2001Grossed!R1C1:R46C51, RC1, 1) -> #REF! | G312: =IF(EQUAL(INDEX(2001Grossed!R1C1:R46C51, RC1, 2), R1C), RC4, NA()) -> #REF! | H312: =IF(EQUAL(INDEX(2001Grossed!R1C1:R46C51, RC1, 2), R1C), RC4, NA()) -> #REF! | I312: =IF(EQUAL(INDEX(2001Grossed!R1C1:R46C51, RC1, 2), R1C), RC4, NA()) -> #REF! | J312: =IF(EQUAL(INDEX(2001Grossed!R1C1:R46C51, RC1, 2), R1C), RC4, NA()) -> #REF! | K312: =IF(OR(AND(NOT(ISERROR(RC7)), ISNUMBER(RC7)), AND(NOT(ISERROR(RC8)), ISNUMBER(RC8)), AND(NOT(ISERROR(RC9)), ISNUMBER(RC9)), AND(NOT(ISERROR(RC10)), ISNUMBER(RC10))), 1, 0) -> 0 | M312: =INDEX(Gross!R1C1:R46C51, RC1, 26) -> #REF! | N312: =INDEX(Gross!R1C1:R46C51, RC1, 27) -> #REF!
A313: 350 | B313: =INDEX(2001Grossed!R1C1:R46C51, RC[-1], 26) -> #REF! | C313: =INDEX(2001Grossed!R1C1:R46C51, RC1, 27) -> #REF! | D313: =IF(Menus!R9C10, RC[-1]/RC[-2], RC[-1]) -> #REF! | E313: =IF(RC11=1, RC[-3], NA()) -> #NA | F313: =INDEX(2001Grossed!R1C1:R46C51, RC1, 1) -> #REF! | G313: =IF(EQUAL(INDEX(2001Grossed!R1C1:R46C51, RC1, 2), R1C), RC4, NA()) -> #REF! | H313: =IF(EQUAL(INDEX(2001Grossed!R1C1:R46C51, RC1, 2), R1C), RC4, NA()) -> #REF! | I313: =IF(EQUAL(INDEX(2001Grossed!R1C1:R46C51, RC1, 2), R1C), RC4, NA()) -> #REF! | J313: =IF(EQUAL(INDEX(2001Grossed!R1C1:R46C51, RC1, 2), R1C), RC4, NA()) -> #REF! | K313: =IF(OR(AND(NOT(ISERROR(RC7)), ISNUMBER(RC7)), AND(NOT(ISERROR(RC8)), ISNUMBER(RC8)), AND(NOT(ISERROR(RC9)), ISNUMBER(RC9)), AND(NOT(ISERROR(RC10)), ISNUMBER(RC10))), 1, 0) -> 0 | M313: =INDEX(Gross!R1C1:R46C51, RC1, 26) -> #REF! | N313: =INDEX(Gross!R1C1:R46C51, RC1, 27) -> #REF!
A314: 351 | B314: =INDEX(2001Grossed!R1C1:R46C51, RC[-1], 26) -> #REF! | C314: =INDEX(2001Grossed!R1C1:R46C51, RC1, 27) -> #REF! | D314: =IF(Menus!R9C10, RC[-1]/RC[-2], RC[-1]) -> #REF! | E314: =IF(RC11=1, RC[-3], NA()) -> #NA | F314: =INDEX(2001Grossed!R1C1:R46C51, RC1, 1) -> #REF! | G314: =IF(EQUAL(INDEX(2001Grossed!R1C1:R46C51, RC1, 2), R1C), RC4, NA()) -> #REF! | H314: =IF(EQUAL(INDEX(2001Grossed!R1C1:R46C51, RC1, 2), R1C), RC4, NA()) -> #REF! | I314: =IF(EQUAL(INDEX(2001Grossed!R1C1:R46C51, RC1, 2), R1C), RC4, NA()) -> #REF! | J314: =IF(EQUAL(INDEX(2001Grossed!R1C1:R46C51, RC1, 2), R1C), RC4, NA()) -> #REF! | K314: =IF(OR(AND(NOT(ISERROR(RC7)), ISNUMBER(RC7)), AND(NOT(ISERROR(RC8)), ISNUMBER(RC8)), AND(NOT(ISERROR(RC9)), ISNUMBER(RC9)), AND(NOT(ISERROR(RC10)), ISNUMBER(RC10))), 1, 0) -> 0 | M314: =INDEX(Gross!R1C1:R46C51, RC1, 26) -> #REF! | N314: =INDEX(Gross!R1C1:R46C51, RC1, 27) -> #REF!
A315: 352 | B315: =INDEX(2001Grossed!R1C1:R46C51, RC[-1], 26) -> #REF! | C315: =INDEX(2001Grossed!R1C1:R46C51, RC1, 27) -> #REF! | D315: =IF(Menus!R9C10, RC[-1]/RC[-2], RC[-1]) -> #REF! | E315: =IF(RC11=1, RC[-3], NA()) -> #NA | F315: =INDEX(2001Grossed!R1C1:R46C51, RC1, 1) -> #REF! | G315: =IF(EQUAL(INDEX(2001Grossed!R1C1:R46C51, RC1, 2), R1C), RC4, NA()) -> #REF! | H315: =IF(EQUAL(INDEX(2001Grossed!R1C1:R46C51, RC1, 2), R1C), RC4, NA()) -> #REF! | I315: =IF(EQUAL(INDEX(2001Grossed!R1C1:R46C51, RC1, 2), R1C), RC4, NA()) -> #REF! | J315: =IF(EQUAL(INDEX(2001Grossed!R1C1:R46C51, RC1, 2), R1C), RC4, NA()) -> #REF! | K315: =IF(OR(AND(NOT(ISERROR(RC7)), ISNUMBER(RC7)), AND(NOT(ISERROR(RC8)), ISNUMBER(RC8)), AND(NOT(ISERROR(RC9)), ISNUMBER(RC9)), AND(NOT(ISERROR(RC10)), ISNUMBER(RC10))), 1, 0) -> 0 | M315: =INDEX(Gross!R1C1:R46C51, RC1, 26) -> #REF! | N315: =INDEX(Gross!R1C1:R46C51, RC1, 27) -> #REF!
A316: 353 | B316: =INDEX(2001Grossed!R1C1:R46C51, RC[-1], 26) -> #REF! | C316: =INDEX(2001Grossed!R1C1:R46C51, RC1, 27) -> #REF! | D316: =IF(Menus!R9C10, RC[-1]/RC[-2], RC[-1]) -> #REF! | E316: =IF(RC11=1, RC[-3], NA()) -> #NA | F316: =INDEX(2001Grossed!R1C1:R46C51, RC1, 1) -> #REF! | G316: =IF(EQUAL(INDEX(2001Grossed!R1C1:R46C51, RC1, 2), R1C), RC4, NA()) -> #REF! | H316: =IF(EQUAL(INDEX(2001Grossed!R1C1:R46C51, RC1, 2), R1C), RC4, NA()) -> #REF! | I316: =IF(EQUAL(INDEX(2001Grossed!R1C1:R46C51, RC1, 2), R1C), RC4, NA()) -> #REF! | J316: =IF(EQUAL(INDEX(2001Grossed!R1C1:R46C51, RC1, 2), R1C), RC4, NA()) -> #REF! | K316: =IF(OR(AND(NOT(ISERROR(RC7)), ISNUMBER(RC7)), AND(NOT(ISERROR(RC8)), ISNUMBER(RC8)), AND(NOT(ISERROR(RC9)), ISNUMBER(RC9)), AND(NOT(ISERROR(RC10)), ISNUMBER(RC10))), 1, 0) -> 0 | M316: =INDEX(Gross!R1C1:R46C51, RC1, 26) -> #REF! | N316: =INDEX(Gross!R1C1:R46C51, RC1, 27) -> #REF!
A317: 354 | B317: =INDEX(2001Grossed!R1C1:R46C51, RC[-1], 26) -> #REF! | C317: =INDEX(2001Grossed!R1C1:R46C51, RC1, 27) -> #REF! | D317: =IF(Menus!R9C10, RC[-1]/RC[-2], RC[-1]) -> #REF! | E317: =IF(RC11=1, RC[-3], NA()) -> #NA | F317: =INDEX(2001Grossed!R1C1:R46C51, RC1, 1) -> #REF! | G317: =IF(EQUAL(INDEX(2001Grossed!R1C1:R46C51, RC1, 2), R1C), RC4, NA()) -> #REF! | H317: =IF(EQUAL(INDEX(2001Grossed!R1C1:R46C51, RC1, 2), R1C), RC4, NA()) -> #REF! | I317: =IF(EQUAL(INDEX(2001Grossed!R1C1:R46C51, RC1, 2), R1C), RC4, NA()) -> #REF! | J317: =IF(EQUAL(INDEX(2001Grossed!R1C1:R46C51, RC1, 2), R1C), RC4, NA()) -> #REF! | K317: =IF(OR(AND(NOT(ISERROR(RC7)), ISNUMBER(RC7)), AND(NOT(ISERROR(RC8)), ISNUMBER(RC8)), AND(NOT(ISERROR(RC9)), ISNUMBER(RC9)), AND(NOT(ISERROR(RC10)), ISNUMBER(RC10))), 1, 0) -> 0 | M317: =INDEX(Gross!R1C1:R46C51, RC1, 26) -> #REF! | N317: =INDEX(Gross!R1C1:R46C51, RC1, 27) -> #REF!
A318: 355 | B318: =INDEX(2001Grossed!R1C1:R46C51, RC[-1], 26) -> #REF! | C318: =INDEX(2001Grossed!R1C1:R46C51, RC1, 27) -> #REF! | D318: =IF(Menus!R9C10, RC[-1]/RC[-2], RC[-1]) -> #REF! | E318: =IF(RC11=1, RC[-3], NA()) -> #NA | F318: =INDEX(2001Grossed!R1C1:R46C51, RC1, 1) -> #REF! | G318: =IF(EQUAL(INDEX(2001Grossed!R1C1:R46C51, RC1, 2), R1C), RC4, NA()) -> #REF! | H318: =IF(EQUAL(INDEX(2001Grossed!R1C1:R46C51, RC1, 2), R1C), RC4, NA()) -> #REF! | I318: =IF(EQUAL(INDEX(2001Grossed!R1C1:R46C51, RC1, 2), R1C), RC4, NA()) -> #REF! | J318: =IF(EQUAL(INDEX(2001Grossed!R1C1:R46C51, RC1, 2), R1C), RC4, NA()) -> #REF! | K318: =IF(OR(AND(NOT(ISERROR(RC7)), ISNUMBER(RC7)), AND(NOT(ISERROR(RC8)), ISNUMBER(RC8)), AND(NOT(ISERROR(RC9)), ISNUMBER(RC9)), AND(NOT(ISERROR(RC10)), ISNUMBER(RC10))), 1, 0) -> 0 | M318: =INDEX(Gross!R1C1:R46C51, RC1, 26) -> #REF! | N318: =INDEX(Gross!R1C1:R46C51, RC1, 27) -> #REF!
A319: 356 | B319: =INDEX(2001Grossed!R1C1:R46C51, RC[-1], 26) -> #REF! | C319: =INDEX(2001Grossed!R1C1:R46C51, RC1, 27) -> #REF! | D319: =IF(Menus!R9C10, RC[-1]/RC[-2], RC[-1]) -> #REF! | E319: =IF(RC11=1, RC[-3], NA()) -> #NA | F319: =INDEX(2001Grossed!R1C1:R46C51, RC1, 1) -> #REF! | G319: =IF(EQUAL(INDEX(2001Grossed!R1C1:R46C51, RC1, 2), R1C), RC4, NA()) -> #REF! | H319: =IF(EQUAL(INDEX(2001Grossed!R1C1:R46C51, RC1, 2), R1C), RC4, NA()) -> #REF! | I319: =IF(EQUAL(INDEX(2001Grossed!R1C1:R46C51, RC1, 2), R1C), RC4, NA()) -> #REF! | J319: =IF(EQUAL(INDEX(2001Grossed!R1C1:R46C51, RC1, 2), R1C), RC4, NA()) -> #REF! | K319: =IF(OR(AND(NOT(ISERROR(RC7)), ISNUMBER(RC7)), AND(NOT(ISERROR(RC8)), ISNUMBER(RC8)), AND(NOT(ISERROR(RC9)), ISNUMBER(RC9)), AND(NOT(ISERROR(RC10)), ISNUMBER(RC10))), 1, 0) -> 0 | M319: =INDEX(Gross!R1C1:R46C51, RC1, 26) -> #REF! | N319: =INDEX(Gross!R1C1:R46C51, RC1, 27) -> #REF!
A320: 357 | B320: =INDEX(2001Grossed!R1C1:R46C51, RC[-1], 26) -> #REF! | C320: =INDEX(2001Grossed!R1C1:R46C51, RC1, 27) -> #REF! | D320: =IF(Menus!R9C10, RC[-1]/RC[-2], RC[-1]) -> #REF! | E320: =IF(RC11=1, RC[-3], NA()) -> #NA | F320: =INDEX(2001Grossed!R1C1:R46C51, RC1, 1) -> #REF! | G320: =IF(EQUAL(INDEX(2001Grossed!R1C1:R46C51, RC1, 2), R1C), RC4, NA()) -> #REF! | H320: =IF(EQUAL(INDEX(2001Grossed!R1C1:R46C51, RC1, 2), R1C), RC4, NA()) -> #REF! | I320: =IF(EQUAL(INDEX(2001Grossed!R1C1:R46C51, RC1, 2), R1C), RC4, NA()) -> #REF! | J320: =IF(EQUAL(INDEX(2001Grossed!R1C1:R46C51, RC1, 2), R1C), RC4, NA()) -> #REF! | K320: =IF(OR(AND(NOT(ISERROR(RC7)), ISNUMBER(RC7)), AND(NOT(ISERROR(RC8)), ISNUMBER(RC8)), AND(NOT(ISERROR(RC9)), ISNUMBER(RC9)), AND(NOT(ISERROR(RC10)), ISNUMBER(RC10))), 1, 0) -> 0 | M320: =INDEX(Gross!R1C1:R46C51, RC1, 26) -> #REF! | N320: =INDEX(Gross!R1C1:R46C51, RC1, 27) -> #REF!
A321: 358 | B321: =INDEX(2001Grossed!R1C1:R46C51, RC[-1], 26) -> #REF! | C321: =INDEX(2001Grossed!R1C1:R46C51, RC1, 27) -> #REF! | D321: =IF(Menus!R9C10, RC[-1]/RC[-2], RC[-1]) -> #REF! | E321: =IF(RC11=1, RC[-3], NA()) -> #NA | F321: =INDEX(2001Grossed!R1C1:R46C51, RC1, 1) -> #REF! | G321: =IF(EQUAL(INDEX(2001Grossed!R1C1:R46C51, RC1, 2), R1C), RC4, NA()) -> #REF! | H321: =IF(EQUAL(INDEX(2001Grossed!R1C1:R46C51, RC1, 2), R1C), RC4, NA()) -> #REF! | I321: =IF(EQUAL(INDEX(2001Grossed!R1C1:R46C51, RC1, 2), R1C), RC4, NA()) -> #REF! | J321: =IF(EQUAL(INDEX(2001Grossed!R1C1:R46C51, RC1, 2), R1C), RC4, NA()) -> #REF! | K321: =IF(OR(AND(NOT(ISERROR(RC7)), ISNUMBER(RC7)), AND(NOT(ISERROR(RC8)), ISNUMBER(RC8)), AND(NOT(ISERROR(RC9)), ISNUMBER(RC9)), AND(NOT(ISERROR(RC10)), ISNUMBER(RC10))), 1, 0) -> 0 | M321: =INDEX(Gross!R1C1:R46C51, RC1, 26) -> #REF! | N321: =INDEX(Gross!R1C1:R46C51, RC1, 27) -> #REF!
A322: 359 | B322: =INDEX(2001Grossed!R1C1:R46C51, RC[-1], 26) -> #REF! | C322: =INDEX(2001Grossed!R1C1:R46C51, RC1, 27) -> #REF! | D322: =IF(Menus!R9C10, RC[-1]/RC[-2], RC[-1]) -> #REF! | E322: =IF(RC11=1, RC[-3], NA()) -> #NA | F322: =INDEX(2001Grossed!R1C1:R46C51, RC1, 1) -> #REF! | G322: =IF(EQUAL(INDEX(2001Grossed!R1C1:R46C51, RC1, 2), R1C), RC4, NA()) -> #REF! | H322: =IF(EQUAL(INDEX(2001Grossed!R1C1:R46C51, RC1, 2), R1C), RC4, NA()) -> #REF! | I322: =IF(EQUAL(INDEX(2001Grossed!R1C1:R46C51, RC1, 2), R1C), RC4, NA()) -> #REF! | J322: =IF(EQUAL(INDEX(2001Grossed!R1C1:R46C51, RC1, 2), R1C), RC4, NA()) -> #REF! | K322: =IF(OR(AND(NOT(ISERROR(RC7)), ISNUMBER(RC7)), AND(NOT(ISERROR(RC8)), ISNUMBER(RC8)), AND(NOT(ISERROR(RC9)), ISNUMBER(RC9)), AND(NOT(ISERROR(RC10)), ISNUMBER(RC10))), 1, 0) -> 0 | M322: =INDEX(Gross!R1C1:R46C51, RC1, 26) -> #REF! | N322: =INDEX(Gross!R1C1:R46C51, RC1, 27) -> #REF!
A323: 360 | B323: =INDEX(2001Grossed!R1C1:R46C51, RC[-1], 26) -> #REF! | C323: =INDEX(2001Grossed!R1C1:R46C51, RC1, 27) -> #REF! | D323: =IF(Menus!R9C10, RC[-1]/RC[-2], RC[-1]) -> #REF! | E323: =IF(RC11=1, RC[-3], NA()) -> #NA | F323: =INDEX(2001Grossed!R1C1:R46C51, RC1, 1) -> #REF! | G323: =IF(EQUAL(INDEX(2001Grossed!R1C1:R46C51, RC1, 2), R1C), RC4, NA()) -> #REF! | H323: =IF(EQUAL(INDEX(2001Grossed!R1C1:R46C51, RC1, 2), R1C), RC4, NA()) -> #REF! | I323: =IF(EQUAL(INDEX(2001Grossed!R1C1:R46C51, RC1, 2), R1C), RC4, NA()) -> #REF! | J323: =IF(EQUAL(INDEX(2001Grossed!R1C1:R46C51, RC1, 2), R1C), RC4, NA()) -> #REF! | K323: =IF(OR(AND(NOT(ISERROR(RC7)), ISNUMBER(RC7)), AND(NOT(ISERROR(RC8)), ISNUMBER(RC8)), AND(NOT(ISERROR(RC9)), ISNUMBER(RC9)), AND(NOT(ISERROR(RC10)), ISNUMBER(RC10))), 1, 0) -> 0 | M323: =INDEX(Gross!R1C1:R46C51, RC1, 26) -> #REF! | N323: =INDEX(Gross!R1C1:R46C51, RC1, 27) -> #REF!
A324: 361 | B324: =INDEX(2001Grossed!R1C1:R46C51, RC[-1], 26) -> #REF! | C324: =INDEX(2001Grossed!R1C1:R46C51, RC1, 27) -> #REF! | D324: =IF(Menus!R9C10, RC[-1]/RC[-2], RC[-1]) -> #REF! | E324: =IF(RC11=1, RC[-3], NA()) -> #NA | F324: =INDEX(2001Grossed!R1C1:R46C51, RC1, 1) -> #REF! | G324: =IF(EQUAL(INDEX(2001Grossed!R1C1:R46C51, RC1, 2), R1C), RC4, NA()) -> #REF! | H324: =IF(EQUAL(INDEX(2001Grossed!R1C1:R46C51, RC1, 2), R1C), RC4, NA()) -> #REF! | I324: =IF(EQUAL(INDEX(2001Grossed!R1C1:R46C51, RC1, 2), R1C), RC4, NA()) -> #REF! | J324: =IF(EQUAL(INDEX(2001Grossed!R1C1:R46C51, RC1, 2), R1C), RC4, NA()) -> #REF! | K324: =IF(OR(AND(NOT(ISERROR(RC7)), ISNUMBER(RC7)), AND(NOT(ISERROR(RC8)), ISNUMBER(RC8)), AND(NOT(ISERROR(RC9)), ISNUMBER(RC9)), AND(NOT(ISERROR(RC10)), ISNUMBER(RC10))), 1, 0) -> 0 | M324: =INDEX(Gross!R1C1:R46C51, RC1, 26) -> #REF! | N324: =INDEX(Gross!R1C1:R46C51, RC1, 27) -> #REF!
A325: 362 | B325: =INDEX(2001Grossed!R1C1:R46C51, RC[-1], 26) -> #REF! | C325: =INDEX(2001Grossed!R1C1:R46C51, RC1, 27) -> #REF! | D325: =IF(Menus!R9C10, RC[-1]/RC[-2], RC[-1]) -> #REF! | E325: =IF(RC11=1, RC[-3], NA()) -> #NA | F325: =INDEX(2001Grossed!R1C1:R46C51, RC1, 1) -> #REF! | G325: =IF(EQUAL(INDEX(2001Grossed!R1C1:R46C51, RC1, 2), R1C), RC4, NA()) -> #REF! | H325: =IF(EQUAL(INDEX(2001Grossed!R1C1:R46C51, RC1, 2), R1C), RC4, NA()) -> #REF! | I325: =IF(EQUAL(INDEX(2001Grossed!R1C1:R46C51, RC1, 2), R1C), RC4, NA()) -> #REF! | J325: =IF(EQUAL(INDEX(2001Grossed!R1C1:R46C51, RC1, 2), R1C), RC4, NA()) -> #REF! | K325: =IF(OR(AND(NOT(ISERROR(RC7)), ISNUMBER(RC7)), AND(NOT(ISERROR(RC8)), ISNUMBER(RC8)), AND(NOT(ISERROR(RC9)), ISNUMBER(RC9)), AND(NOT(ISERROR(RC10)), ISNUMBER(RC10))), 1, 0) -> 0 | M325: =INDEX(Gross!R1C1:R46C51, RC1, 26) -> #REF! | N325: =INDEX(Gross!R1C1:R46C51, RC1, 27) -> #REF!
A326: 363 | B326: =INDEX(2001Grossed!R1C1:R46C51, RC[-1], 26) -> #REF! | C326: =INDEX(2001Grossed!R1C1:R46C51, RC1, 27) -> #REF! | D326: =IF(Menus!R9C10, RC[-1]/RC[-2], RC[-1]) -> #REF! | E326: =IF(RC11=1, RC[-3], NA()) -> #NA | F326: =INDEX(2001Grossed!R1C1:R46C51, RC1, 1) -> #REF! | G326: =IF(EQUAL(INDEX(2001Grossed!R1C1:R46C51, RC1, 2), R1C), RC4, NA()) -> #REF! | H326: =IF(EQUAL(INDEX(2001Grossed!R1C1:R46C51, RC1, 2), R1C), RC4, NA()) -> #REF! | I326: =IF(EQUAL(INDEX(2001Grossed!R1C1:R46C51, RC1, 2), R1C), RC4, NA()) -> #REF! | J326: =IF(EQUAL(INDEX(2001Grossed!R1C1:R46C51, RC1, 2), R1C), RC4, NA()) -> #REF! | K326: =IF(OR(AND(NOT(ISERROR(RC7)), ISNUMBER(RC7)), AND(NOT(ISERROR(RC8)), ISNUMBER(RC8)), AND(NOT(ISERROR(RC9)), ISNUMBER(RC9)), AND(NOT(ISERROR(RC10)), ISNUMBER(RC10))), 1, 0) -> 0 | M326: =INDEX(Gross!R1C1:R46C51, RC1, 26) -> #REF! | N326: =INDEX(Gross!R1C1:R46C51, RC1, 27) -> #REF!
A327: 364 | B327: =INDEX(2001Grossed!R1C1:R46C51, RC[-1], 26) -> #REF! | C327: =INDEX(2001Grossed!R1C1:R46C51, RC1, 27) -> #REF! | D327: =IF(Menus!R9C10, RC[-1]/RC[-2], RC[-1]) -> #REF! | E327: =IF(RC11=1, RC[-3], NA()) -> #NA | F327: =INDEX(2001Grossed!R1C1:R46C51, RC1, 1) -> #REF! | G327: =IF(EQUAL(INDEX(2001Grossed!R1C1:R46C51, RC1, 2), R1C), RC4, NA()) -> #REF! | H327: =IF(EQUAL(INDEX(2001Grossed!R1C1:R46C51, RC1, 2), R1C), RC4, NA()) -> #REF! | I327: =IF(EQUAL(INDEX(2001Grossed!R1C1:R46C51, RC1, 2), R1C), RC4, NA()) -> #REF! | J327: =IF(EQUAL(INDEX(2001Grossed!R1C1:R46C51, RC1, 2), R1C), RC4, NA()) -> #REF! | K327: =IF(OR(AND(NOT(ISERROR(RC7)), ISNUMBER(RC7)), AND(NOT(ISERROR(RC8)), ISNUMBER(RC8)), AND(NOT(ISERROR(RC9)), ISNUMBER(RC9)), AND(NOT(ISERROR(RC10)), ISNUMBER(RC10))), 1, 0) -> 0 | M327: =INDEX(Gross!R1C1:R46C51, RC1, 26) -> #REF! | N327: =INDEX(Gross!R1C1:R46C51, RC1, 27) -> #REF!
A328: 365 | B328: =INDEX(2001Grossed!R1C1:R46C51, RC[-1], 26) -> #REF! | C328: =INDEX(2001Grossed!R1C1:R46C51, RC1, 27) -> #REF! | D328: =IF(Menus!R9C10, RC[-1]/RC[-2], RC[-1]) -> #REF! | E328: =IF(RC11=1, RC[-3], NA()) -> #NA | F328: =INDEX(2001Grossed!R1C1:R46C51, RC1, 1) -> #REF! | G328: =IF(EQUAL(INDEX(2001Grossed!R1C1:R46C51, RC1, 2), R1C), RC4, NA()) -> #REF! | H328: =IF(EQUAL(INDEX(2001Grossed!R1C1:R46C51, RC1, 2), R1C), RC4, NA()) -> #REF! | I328: =IF(EQUAL(INDEX(2001Grossed!R1C1:R46C51, RC1, 2), R1C), RC4, NA()) -> #REF! | J328: =IF(EQUAL(INDEX(2001Grossed!R1C1:R46C51, RC1, 2), R1C), RC4, NA()) -> #REF! | K328: =IF(OR(AND(NOT(ISERROR(RC7)), ISNUMBER(RC7)), AND(NOT(ISERROR(RC8)), ISNUMBER(RC8)), AND(NOT(ISERROR(RC9)), ISNUMBER(RC9)), AND(NOT(ISERROR(RC10)), ISNUMBER(RC10))), 1, 0) -> 0 | M328: =INDEX(Gross!R1C1:R46C51, RC1, 26) -> #REF! | N328: =INDEX(Gross!R1C1:R46C51, RC1, 27) -> #REF!
A329: 366 | B329: =INDEX(2001Grossed!R1C1:R46C51, RC[-1], 26) -> #REF! | C329: =INDEX(2001Grossed!R1C1:R46C51, RC1, 27) -> #REF! | D329: =IF(Menus!R9C10, RC[-1]/RC[-2], RC[-1]) -> #REF! | E329: =IF(RC11=1, RC[-3], NA()) -> #NA | F329: =INDEX(2001Grossed!R1C1:R46C51, RC1, 1) -> #REF! | G329: =IF(EQUAL(INDEX(2001Grossed!R1C1:R46C51, RC1, 2), R1C), RC4, NA()) -> #REF! | H329: =IF(EQUAL(INDEX(2001Grossed!R1C1:R46C51, RC1, 2), R1C), RC4, NA()) -> #REF! | I329: =IF(EQUAL(INDEX(2001Grossed!R1C1:R46C51, RC1, 2), R1C), RC4, NA()) -> #REF! | J329: =IF(EQUAL(INDEX(2001Grossed!R1C1:R46C51, RC1, 2), R1C), RC4, NA()) -> #REF! | K329: =IF(OR(AND(NOT(ISERROR(RC7)), ISNUMBER(RC7)), AND(NOT(ISERROR(RC8)), ISNUMBER(RC8)), AND(NOT(ISERROR(RC9)), ISNUMBER(RC9)), AND(NOT(ISERROR(RC10)), ISNUMBER(RC10))), 1, 0) -> 0 | M329: =INDEX(Gross!R1C1:R46C51, RC1, 26) -> #REF! | N329: =INDEX(Gross!R1C1:R46C51, RC1, 27) -> #REF!
A330: 367 | B330: =INDEX(2001Grossed!R1C1:R46C51, RC[-1], 26) -> #REF! | C330: =INDEX(2001Grossed!R1C1:R46C51, RC1, 27) -> #REF! | D330: =IF(Menus!R9C10, RC[-1]/RC[-2], RC[-1]) -> #REF! | E330: =IF(RC11=1, RC[-3], NA()) -> #NA | F330: =INDEX(2001Grossed!R1C1:R46C51, RC1, 1) -> #REF! | G330: =IF(EQUAL(INDEX(2001Grossed!R1C1:R46C51, RC1, 2), R1C), RC4, NA()) -> #REF! | H330: =IF(EQUAL(INDEX(2001Grossed!R1C1:R46C51, RC1, 2), R1C), RC4, NA()) -> #REF! | I330: =IF(EQUAL(INDEX(2001Grossed!R1C1:R46C51, RC1, 2), R1C), RC4, NA()) -> #REF! | J330: =IF(EQUAL(INDEX(2001Grossed!R1C1:R46C51, RC1, 2), R1C), RC4, NA()) -> #REF! | K330: =IF(OR(AND(NOT(ISERROR(RC7)), ISNUMBER(RC7)), AND(NOT(ISERROR(RC8)), ISNUMBER(RC8)), AND(NOT(ISERROR(RC9)), ISNUMBER(RC9)), AND(NOT(ISERROR(RC10)), ISNUMBER(RC10))), 1, 0) -> 0 | M330: =INDEX(Gross!R1C1:R46C51, RC1, 26) -> #REF! | N330: =INDEX(Gross!R1C1:R46C51, RC1, 27) -> #REF!
A331: 368 | B331: =INDEX(2001Grossed!R1C1:R46C51, RC[-1], 26) -> #REF! | C331: =INDEX(2001Grossed!R1C1:R46C51, RC1, 27) -> #REF! | D331: =IF(Menus!R9C10, RC[-1]/RC[-2], RC[-1]) -> #REF! | E331: =IF(RC11=1, RC[-3], NA()) -> #NA | F331: =INDEX(2001Grossed!R1C1:R46C51, RC1, 1) -> #REF! | G331: =IF(EQUAL(INDEX(2001Grossed!R1C1:R46C51, RC1, 2), R1C), RC4, NA()) -> #REF! | H331: =IF(EQUAL(INDEX(2001Grossed!R1C1:R46C51, RC1, 2), R1C), RC4, NA()) -> #REF! | I331: =IF(EQUAL(INDEX(2001Grossed!R1C1:R46C51, RC1, 2), R1C), RC4, NA()) -> #REF! | J331: =IF(EQUAL(INDEX(2001Grossed!R1C1:R46C51, RC1, 2), R1C), RC4, NA()) -> #REF! | K331: =IF(OR(AND(NOT(ISERROR(RC7)), ISNUMBER(RC7)), AND(NOT(ISERROR(RC8)), ISNUMBER(RC8)), AND(NOT(ISERROR(RC9)), ISNUMBER(RC9)), AND(NOT(ISERROR(RC10)), ISNUMBER(RC10))), 1, 0) -> 0 | M331: =INDEX(Gross!R1C1:R46C51, RC1, 26) -> #REF! | N331: =INDEX(Gross!R1C1:R46C51, RC1, 27) -> #REF!
A332: 369 | B332: =INDEX(2001Grossed!R1C1:R46C51, RC[-1], 26) -> #REF! | C332: =INDEX(2001Grossed!R1C1:R46C51, RC1, 27) -> #REF! | D332: =IF(Menus!R9C10, RC[-1]/RC[-2], RC[-1]) -> #REF! | E332: =IF(RC11=1, RC[-3], NA()) -> #NA | F332: =INDEX(2001Grossed!R1C1:R46C51, RC1, 1) -> #REF! | G332: =IF(EQUAL(INDEX(2001Grossed!R1C1:R46C51, RC1, 2), R1C), RC4, NA()) -> #REF! | H332: =IF(EQUAL(INDEX(2001Grossed!R1C1:R46C51, RC1, 2), R1C), RC4, NA()) -> #REF! | I332: =IF(EQUAL(INDEX(2001Grossed!R1C1:R46C51, RC1, 2), R1C), RC4, NA()) -> #REF! | J332: =IF(EQUAL(INDEX(2001Grossed!R1C1:R46C51, RC1, 2), R1C), RC4, NA()) -> #REF! | K332: =IF(OR(AND(NOT(ISERROR(RC7)), ISNUMBER(RC7)), AND(NOT(ISERROR(RC8)), ISNUMBER(RC8)), AND(NOT(ISERROR(RC9)), ISNUMBER(RC9)), AND(NOT(ISERROR(RC10)), ISNUMBER(RC10))), 1, 0) -> 0 | M332: =INDEX(Gross!R1C1:R46C51, RC1, 26) -> #REF! | N332: =INDEX(Gross!R1C1:R46C51, RC1, 27) -> #REF!
A333: 370 | B333: =INDEX(2001Grossed!R1C1:R46C51, RC[-1], 26) -> #REF! | C333: =INDEX(2001Grossed!R1C1:R46C51, RC1, 27) -> #REF! | D333: =IF(Menus!R9C10, RC[-1]/RC[-2], RC[-1]) -> #REF! | E333: =IF(RC11=1, RC[-3], NA()) -> #NA | F333: =INDEX(2001Grossed!R1C1:R46C51, RC1, 1) -> #REF! | G333: =IF(EQUAL(INDEX(2001Grossed!R1C1:R46C51, RC1, 2), R1C), RC4, NA()) -> #REF! | H333: =IF(EQUAL(INDEX(2001Grossed!R1C1:R46C51, RC1, 2), R1C), RC4, NA()) -> #REF! | I333: =IF(EQUAL(INDEX(2001Grossed!R1C1:R46C51, RC1, 2), R1C), RC4, NA()) -> #REF! | J333: =IF(EQUAL(INDEX(2001Grossed!R1C1:R46C51, RC1, 2), R1C), RC4, NA()) -> #REF! | K333: =IF(OR(AND(NOT(ISERROR(RC7)), ISNUMBER(RC7)), AND(NOT(ISERROR(RC8)), ISNUMBER(RC8)), AND(NOT(ISERROR(RC9)), ISNUMBER(RC9)), AND(NOT(ISERROR(RC10)), ISNUMBER(RC10))), 1, 0) -> 0 | M333: =INDEX(Gross!R1C1:R46C51, RC1, 26) -> #REF! | N333: =INDEX(Gross!R1C1:R46C51, RC1, 27) -> #REF!
A334: 371 | B334: =INDEX(2001Grossed!R1C1:R46C51, RC[-1], 26) -> #REF! | C334: =INDEX(2001Grossed!R1C1:R46C51, RC1, 27) -> #REF! | D334: =IF(Menus!R9C10, RC[-1]/RC[-2], RC[-1]) -> #REF! | E334: =IF(RC11=1, RC[-3], NA()) -> #NA | F334: =INDEX(2001Grossed!R1C1:R46C51, RC1, 1) -> #REF! | G334: =IF(EQUAL(INDEX(2001Grossed!R1C1:R46C51, RC1, 2), R1C), RC4, NA()) -> #REF! | H334: =IF(EQUAL(INDEX(2001Grossed!R1C1:R46C51, RC1, 2), R1C), RC4, NA()) -> #REF! | I334: =IF(EQUAL(INDEX(2001Grossed!R1C1:R46C51, RC1, 2), R1C), RC4, NA()) -> #REF! | J334: =IF(EQUAL(INDEX(2001Grossed!R1C1:R46C51, RC1, 2), R1C), RC4, NA()) -> #REF! | K334: =IF(OR(AND(NOT(ISERROR(RC7)), ISNUMBER(RC7)), AND(NOT(ISERROR(RC8)), ISNUMBER(RC8)), AND(NOT(ISERROR(RC9)), ISNUMBER(RC9)), AND(NOT(ISERROR(RC10)), ISNUMBER(RC10))), 1, 0) -> 0 | M334: =INDEX(Gross!R1C1:R46C51, RC1, 26) -> #REF! | N334: =INDEX(Gross!R1C1:R46C51, RC1, 27) -> #REF!
A335: 372 | B335: =INDEX(2001Grossed!R1C1:R46C51, RC[-1], 26) -> #REF! | C335: =INDEX(2001Grossed!R1C1:R46C51, RC1, 27) -> #REF! | D335: =IF(Menus!R9C10, RC[-1]/RC[-2], RC[-1]) -> #REF! | E335: =IF(RC11=1, RC[-3], NA()) -> #NA | F335: =INDEX(2001Grossed!R1C1:R46C51, RC1, 1) -> #REF! | G335: =IF(EQUAL(INDEX(2001Grossed!R1C1:R46C51, RC1, 2), R1C), RC4, NA()) -> #REF! | H335: =IF(EQUAL(INDEX(2001Grossed!R1C1:R46C51, RC1, 2), R1C), RC4, NA()) -> #REF! | I335: =IF(EQUAL(INDEX(2001Grossed!R1C1:R46C51, RC1, 2), R1C), RC4, NA()) -> #REF! | J335: =IF(EQUAL(INDEX(2001Grossed!R1C1:R46C51, RC1, 2), R1C), RC4, NA()) -> #REF! | K335: =IF(OR(AND(NOT(ISERROR(RC7)), ISNUMBER(RC7)), AND(NOT(ISERROR(RC8)), ISNUMBER(RC8)), AND(NOT(ISERROR(RC9)), ISNUMBER(RC9)), AND(NOT(ISERROR(RC10)), ISNUMBER(RC10))), 1, 0) -> 0 | M335: =INDEX(Gross!R1C1:R46C51, RC1, 26) -> #REF! | N335: =INDEX(Gross!R1C1:R46C51, RC1, 27) -> #REF!
A336: 373 | B336: =INDEX(2001Grossed!R1C1:R46C51, RC[-1], 26) -> #REF! | C336: =INDEX(2001Grossed!R1C1:R46C51, RC1, 27) -> #REF! | D336: =IF(Menus!R9C10, RC[-1]/RC[-2], RC[-1]) -> #REF! | E336: =IF(RC11=1, RC[-3], NA()) -> #NA | F336: =INDEX(2001Grossed!R1C1:R46C51, RC1, 1) -> #REF! | G336: =IF(EQUAL(INDEX(2001Grossed!R1C1:R46C51, RC1, 2), R1C), RC4, NA()) -> #REF! | H336: =IF(EQUAL(INDEX(2001Grossed!R1C1:R46C51, RC1, 2), R1C), RC4, NA()) -> #REF! | I336: =IF(EQUAL(INDEX(2001Grossed!R1C1:R46C51, RC1, 2), R1C), RC4, NA()) -> #REF! | J336: =IF(EQUAL(INDEX(2001Grossed!R1C1:R46C51, RC1, 2), R1C), RC4, NA()) -> #REF! | K336: =IF(OR(AND(NOT(ISERROR(RC7)), ISNUMBER(RC7)), AND(NOT(ISERROR(RC8)), ISNUMBER(RC8)), AND(NOT(ISERROR(RC9)), ISNUMBER(RC9)), AND(NOT(ISERROR(RC10)), ISNUMBER(RC10))), 1, 0) -> 0 | M336: =INDEX(Gross!R1C1:R46C51, RC1, 26) -> #REF! | N336: =INDEX(Gross!R1C1:R46C51, RC1, 27) -> #REF!
A337: 374 | B337: =INDEX(2001Grossed!R1C1:R46C51, RC[-1], 26) -> #REF! | C337: =INDEX(2001Grossed!R1C1:R46C51, RC1, 27) -> #REF! | D337: =IF(Menus!R9C10, RC[-1]/RC[-2], RC[-1]) -> #REF! | E337: =IF(RC11=1, RC[-3], NA()) -> #NA | F337: =INDEX(2001Grossed!R1C1:R46C51, RC1, 1) -> #REF! | G337: =IF(EQUAL(INDEX(2001Grossed!R1C1:R46C51, RC1, 2), R1C), RC4, NA()) -> #REF! | H337: =IF(EQUAL(INDEX(2001Grossed!R1C1:R46C51, RC1, 2), R1C), RC4, NA()) -> #REF! | I337: =IF(EQUAL(INDEX(2001Grossed!R1C1:R46C51, RC1, 2), R1C), RC4, NA()) -> #REF! | J337: =IF(EQUAL(INDEX(2001Grossed!R1C1:R46C51, RC1, 2), R1C), RC4, NA()) -> #REF! | K337: =IF(OR(AND(NOT(ISERROR(RC7)), ISNUMBER(RC7)), AND(NOT(ISERROR(RC8)), ISNUMBER(RC8)), AND(NOT(ISERROR(RC9)), ISNUMBER(RC9)), AND(NOT(ISERROR(RC10)), ISNUMBER(RC10))), 1, 0) -> 0 | M337: =INDEX(Gross!R1C1:R46C51, RC1, 26) -> #REF! | N337: =INDEX(Gross!R1C1:R46C51, RC1, 27) -> #REF!
A338: 375 | B338: =INDEX(2001Grossed!R1C1:R46C51, RC[-1], 26) -> #REF! | C338: =INDEX(2001Grossed!R1C1:R46C51, RC1, 27) -> #REF! | D338: =IF(Menus!R9C10, RC[-1]/RC[-2], RC[-1]) -> #REF! | E338: =IF(RC11=1, RC[-3], NA()) -> #NA | F338: =INDEX(2001Grossed!R1C1:R46C51, RC1, 1) -> #REF! | G338: =IF(EQUAL(INDEX(2001Grossed!R1C1:R46C51, RC1, 2), R1C), RC4, NA()) -> #REF! | H338: =IF(EQUAL(INDEX(2001Grossed!R1C1:R46C51, RC1, 2), R1C), RC4, NA()) -> #REF! | I338: =IF(EQUAL(INDEX(2001Grossed!R1C1:R46C51, RC1, 2), R1C), RC4, NA()) -> #REF! | J338: =IF(EQUAL(INDEX(2001Grossed!R1C1:R46C51, RC1, 2), R1C), RC4, NA()) -> #REF! | K338: =IF(OR(AND(NOT(ISERROR(RC7)), ISNUMBER(RC7)), AND(NOT(ISERROR(RC8)), ISNUMBER(RC8)), AND(NOT(ISERROR(RC9)), ISNUMBER(RC9)), AND(NOT(ISERROR(RC10)), ISNUMBER(RC10))), 1, 0) -> 0 | M338: =INDEX(Gross!R1C1:R46C51, RC1, 26) -> #REF! | N338: =INDEX(Gross!R1C1:R46C51, RC1, 27) -> #REF!
A339: 376 | B339: =INDEX(2001Grossed!R1C1:R46C51, RC[-1], 26) -> #REF! | C339: =INDEX(2001Grossed!R1C1:R46C51, RC1, 27) -> #REF! | D339: =IF(Menus!R9C10, RC[-1]/RC[-2], RC[-1]) -> #REF! | E339: =IF(RC11=1, RC[-3], NA()) -> #NA | F339: =INDEX(2001Grossed!R1C1:R46C51, RC1, 1) -> #REF! | G339: =IF(EQUAL(INDEX(2001Grossed!R1C1:R46C51, RC1, 2), R1C), RC4, NA()) -> #REF! | H339: =IF(EQUAL(INDEX(2001Grossed!R1C1:R46C51, RC1, 2), R1C), RC4, NA()) -> #REF! | I339: =IF(EQUAL(INDEX(2001Grossed!R1C1:R46C51, RC1, 2), R1C), RC4, NA()) -> #REF! | J339: =IF(EQUAL(INDEX(2001Grossed!R1C1:R46C51, RC1, 2), R1C), RC4, NA()) -> #REF! | K339: =IF(OR(AND(NOT(ISERROR(RC7)), ISNUMBER(RC7)), AND(NOT(ISERROR(RC8)), ISNUMBER(RC8)), AND(NOT(ISERROR(RC9)), ISNUMBER(RC9)), AND(NOT(ISERROR(RC10)), ISNUMBER(RC10))), 1, 0) -> 0 | M339: =INDEX(Gross!R1C1:R46C51, RC1, 26) -> #REF! | N339: =INDEX(Gross!R1C1:R46C51, RC1, 27) -> #REF!
A340: 377 | B340: =INDEX(2001Grossed!R1C1:R46C51, RC[-1], 26) -> #REF! | C340: =INDEX(2001Grossed!R1C1:R46C51, RC1, 27) -> #REF! | D340: =IF(Menus!R9C10, RC[-1]/RC[-2], RC[-1]) -> #REF! | E340: =IF(RC11=1, RC[-3], NA()) -> #NA | F340: =INDEX(2001Grossed!R1C1:R46C51, RC1, 1) -> #REF! | G340: =IF(EQUAL(INDEX(2001Grossed!R1C1:R46C51, RC1, 2), R1C), RC4, NA()) -> #REF! | H340: =IF(EQUAL(INDEX(2001Grossed!R1C1:R46C51, RC1, 2), R1C), RC4, NA()) -> #REF! | I340: =IF(EQUAL(INDEX(2001Grossed!R1C1:R46C51, RC1, 2), R1C), RC4, NA()) -> #REF! | J340: =IF(EQUAL(INDEX(2001Grossed!R1C1:R46C51, RC1, 2), R1C), RC4, NA()) -> #REF! | K340: =IF(OR(AND(NOT(ISERROR(RC7)), ISNUMBER(RC7)), AND(NOT(ISERROR(RC8)), ISNUMBER(RC8)), AND(NOT(ISERROR(RC9)), ISNUMBER(RC9)), AND(NOT(ISERROR(RC10)), ISNUMBER(RC10))), 1, 0) -> 0 | M340: =INDEX(Gross!R1C1:R46C51, RC1, 26) -> #REF! | N340: =INDEX(Gross!R1C1:R46C51, RC1, 27) -> #REF!
A341: 378 | B341: =INDEX(2001Grossed!R1C1:R46C51, RC[-1], 26) -> #REF! | C341: =INDEX(2001Grossed!R1C1:R46C51, RC1, 27) -> #REF! | D341: =IF(Menus!R9C10, RC[-1]/RC[-2], RC[-1]) -> #REF! | E341: =IF(RC11=1, RC[-3], NA()) -> #NA | F341: =INDEX(2001Grossed!R1C1:R46C51, RC1, 1) -> #REF! | G341: =IF(EQUAL(INDEX(2001Grossed!R1C1:R46C51, RC1, 2), R1C), RC4, NA()) -> #REF! | H341: =IF(EQUAL(INDEX(2001Grossed!R1C1:R46C51, RC1, 2), R1C), RC4, NA()) -> #REF! | I341: =IF(EQUAL(INDEX(2001Grossed!R1C1:R46C51, RC1, 2), R1C), RC4, NA()) -> #REF! | J341: =IF(EQUAL(INDEX(2001Grossed!R1C1:R46C51, RC1, 2), R1C), RC4, NA()) -> #REF! | K341: =IF(OR(AND(NOT(ISERROR(RC7)), ISNUMBER(RC7)), AND(NOT(ISERROR(RC8)), ISNUMBER(RC8)), AND(NOT(ISERROR(RC9)), ISNUMBER(RC9)), AND(NOT(ISERROR(RC10)), ISNUMBER(RC10))), 1, 0) -> 0 | M341: =INDEX(Gross!R1C1:R46C51, RC1, 26) -> #REF! | N341: =INDEX(Gross!R1C1:R46C51, RC1, 27) -> #REF!
A342: 379 | B342: =INDEX(2001Grossed!R1C1:R46C51, RC[-1], 26) -> #REF! | C342: =INDEX(2001Grossed!R1C1:R46C51, RC1, 27) -> #REF! | D342: =IF(Menus!R9C10, RC[-1]/RC[-2], RC[-1]) -> #REF! | E342: =IF(RC11=1, RC[-3], NA()) -> #NA | F342: =INDEX(2001Grossed!R1C1:R46C51, RC1, 1) -> #REF! | G342: =IF(EQUAL(INDEX(2001Grossed!R1C1:R46C51, RC1, 2), R1C), RC4, NA()) -> #REF! | H342: =IF(EQUAL(INDEX(2001Grossed!R1C1:R46C51, RC1, 2), R1C), RC4, NA()) -> #REF! | I342: =IF(EQUAL(INDEX(2001Grossed!R1C1:R46C51, RC1, 2), R1C), RC4, NA()) -> #REF! | J342: =IF(EQUAL(INDEX(2001Grossed!R1C1:R46C51, RC1, 2), R1C), RC4, NA()) -> #REF! | K342: =IF(OR(AND(NOT(ISERROR(RC7)), ISNUMBER(RC7)), AND(NOT(ISERROR(RC8)), ISNUMBER(RC8)), AND(NOT(ISERROR(RC9)), ISNUMBER(RC9)), AND(NOT(ISERROR(RC10)), ISNUMBER(RC10))), 1, 0) -> 0 | M342: =INDEX(Gross!R1C1:R46C51, RC1, 26) -> #REF! | N342: =INDEX(Gross!R1C1:R46C51, RC1, 27) -> #REF!
A343: 380 | B343: =INDEX(2001Grossed!R1C1:R46C51, RC[-1], 26) -> #REF! | C343: =INDEX(2001Grossed!R1C1:R46C51, RC1, 27) -> #REF! | D343: =IF(Menus!R9C10, RC[-1]/RC[-2], RC[-1]) -> #REF! | E343: =IF(RC11=1, RC[-3], NA()) -> #NA | F343: =INDEX(2001Grossed!R1C1:R46C51, RC1, 1) -> #REF! | G343: =IF(EQUAL(INDEX(2001Grossed!R1C1:R46C51, RC1, 2), R1C), RC4, NA()) -> #REF! | H343: =IF(EQUAL(INDEX(2001Grossed!R1C1:R46C51, RC1, 2), R1C), RC4, NA()) -> #REF! | I343: =IF(EQUAL(INDEX(2001Grossed!R1C1:R46C51, RC1, 2), R1C), RC4, NA()) -> #REF! | J343: =IF(EQUAL(INDEX(2001Grossed!R1C1:R46C51, RC1, 2), R1C), RC4, NA()) -> #REF! | K343: =IF(OR(AND(NOT(ISERROR(RC7)), ISNUMBER(RC7)), AND(NOT(ISERROR(RC8)), ISNUMBER(RC8)), AND(NOT(ISERROR(RC9)), ISNUMBER(RC9)), AND(NOT(ISERROR(RC10)), ISNUMBER(RC10))), 1, 0) -> 0 | M343: =INDEX(Gross!R1C1:R46C51, RC1, 26) -> #REF! | N343: =INDEX(Gross!R1C1:R46C51, RC1, 27) -> #REF!
A344: 381 | B344: =INDEX(2001Grossed!R1C1:R46C51, RC[-1], 26) -> #REF! | C344: =INDEX(2001Grossed!R1C1:R46C51, RC1, 27) -> #REF! | D344: =IF(Menus!R9C10, RC[-1]/RC[-2], RC[-1]) -> #REF! | E344: =IF(RC11=1, RC[-3], NA()) -> #NA | F344: =INDEX(2001Grossed!R1C1:R46C51, RC1, 1) -> #REF! | G344: =IF(EQUAL(INDEX(2001Grossed!R1C1:R46C51, RC1, 2), R1C), RC4, NA()) -> #REF! | H344: =IF(EQUAL(INDEX(2001Grossed!R1C1:R46C51, RC1, 2), R1C), RC4, NA()) -> #REF! | I344: =IF(EQUAL(INDEX(2001Grossed!R1C1:R46C51, RC1, 2), R1C), RC4, NA()) -> #REF! | J344: =IF(EQUAL(INDEX(2001Grossed!R1C1:R46C51, RC1, 2), R1C), RC4, NA()) -> #REF! | K344: =IF(OR(AND(NOT(ISERROR(RC7)), ISNUMBER(RC7)), AND(NOT(ISERROR(RC8)), ISNUMBER(RC8)), AND(NOT(ISERROR(RC9)), ISNUMBER(RC9)), AND(NOT(ISERROR(RC10)), ISNUMBER(RC10))), 1, 0) -> 0 | M344: =INDEX(Gross!R1C1:R46C51, RC1, 26) -> #REF! | N344: =INDEX(Gross!R1C1:R46C51, RC1, 27) -> #REF!
A345: 382 | B345: =INDEX(2001Grossed!R1C1:R46C51, RC[-1], 26) -> #REF! | C345: =INDEX(2001Grossed!R1C1:R46C51, RC1, 27) -> #REF! | D345: =IF(Menus!R9C10, RC[-1]/RC[-2], RC[-1]) -> #REF! | E345: =IF(RC11=1, RC[-3], NA()) -> #NA | F345: =INDEX(2001Grossed!R1C1:R46C51, RC1, 1) -> #REF! | G345: =IF(EQUAL(INDEX(2001Grossed!R1C1:R46C51, RC1, 2), R1C), RC4, NA()) -> #REF! | H345: =IF(EQUAL(INDEX(2001Grossed!R1C1:R46C51, RC1, 2), R1C), RC4, NA()) -> #REF! | I345: =IF(EQUAL(INDEX(2001Grossed!R1C1:R46C51, RC1, 2), R1C), RC4, NA()) -> #REF! | J345: =IF(EQUAL(INDEX(2001Grossed!R1C1:R46C51, RC1, 2), R1C), RC4, NA()) -> #REF! | K345: =IF(OR(AND(NOT(ISERROR(RC7)), ISNUMBER(RC7)), AND(NOT(ISERROR(RC8)), ISNUMBER(RC8)), AND(NOT(ISERROR(RC9)), ISNUMBER(RC9)), AND(NOT(ISERROR(RC10)), ISNUMBER(RC10))), 1, 0) -> 0 | M345: =INDEX(Gross!R1C1:R46C51, RC1, 26) -> #REF! | N345: =INDEX(Gross!R1C1:R46C51, RC1, 27) -> #REF!
A346: 383 | B346: =INDEX(2001Grossed!R1C1:R46C51, RC[-1], 26) -> #REF! | C346: =INDEX(2001Grossed!R1C1:R46C51, RC1, 27) -> #REF! | D346: =IF(Menus!R9C10, RC[-1]/RC[-2], RC[-1]) -> #REF! | E346: =IF(RC11=1, RC[-3], NA()) -> #NA | F346: =INDEX(2001Grossed!R1C1:R46C51, RC1, 1) -> #REF! | G346: =IF(EQUAL(INDEX(2001Grossed!R1C1:R46C51, RC1, 2), R1C), RC4, NA()) -> #REF! | H346: =IF(EQUAL(INDEX(2001Grossed!R1C1:R46C51, RC1, 2), R1C), RC4, NA()) -> #REF! | I346: =IF(EQUAL(INDEX(2001Grossed!R1C1:R46C51, RC1, 2), R1C), RC4, NA()) -> #REF! | J346: =IF(EQUAL(INDEX(2001Grossed!R1C1:R46C51, RC1, 2), R1C), RC4, NA()) -> #REF! | K346: =IF(OR(AND(NOT(ISERROR(RC7)), ISNUMBER(RC7)), AND(NOT(ISERROR(RC8)), ISNUMBER(RC8)), AND(NOT(ISERROR(RC9)), ISNUMBER(RC9)), AND(NOT(ISERROR(RC10)), ISNUMBER(RC10))), 1, 0) -> 0 | M346: =INDEX(Gross!R1C1:R46C51, RC1, 26) -> #REF! | N346: =INDEX(Gross!R1C1:R46C51, RC1, 27) -> #REF!
A347: 384 | B347: =INDEX(2001Grossed!R1C1:R46C51, RC[-1], 26) -> #REF! | C347: =INDEX(2001Grossed!R1C1:R46C51, RC1, 27) -> #REF! | D347: =IF(Menus!R9C10, RC[-1]/RC[-2], RC[-1]) -> #REF! | E347: =IF(RC11=1, RC[-3], NA()) -> #NA | F347: =INDEX(2001Grossed!R1C1:R46C51, RC1, 1) -> #REF! | G347: =IF(EQUAL(INDEX(2001Grossed!R1C1:R46C51, RC1, 2), R1C), RC4, NA()) -> #REF! | H347: =IF(EQUAL(INDEX(2001Grossed!R1C1:R46C51, RC1, 2), R1C), RC4, NA()) -> #REF! | I347: =IF(EQUAL(INDEX(2001Grossed!R1C1:R46C51, RC1, 2), R1C), RC4, NA()) -> #REF! | J347: =IF(EQUAL(INDEX(2001Grossed!R1C1:R46C51, RC1, 2), R1C), RC4, NA()) -> #REF! | K347: =IF(OR(AND(NOT(ISERROR(RC7)), ISNUMBER(RC7)), AND(NOT(ISERROR(RC8)), ISNUMBER(RC8)), AND(NOT(ISERROR(RC9)), ISNUMBER(RC9)), AND(NOT(ISERROR(RC10)), ISNUMBER(RC10))), 1, 0) -> 0 | M347: =INDEX(Gross!R1C1:R46C51, RC1, 26) -> #REF! | N347: =INDEX(Gross!R1C1:R46C51, RC1, 27) -> #REF!
A348: 385 | B348: =INDEX(2001Grossed!R1C1:R46C51, RC[-1], 26) -> #REF! | C348: =INDEX(2001Grossed!R1C1:R46C51, RC1, 27) -> #REF! | D348: =IF(Menus!R9C10, RC[-1]/RC[-2], RC[-1]) -> #REF! | E348: =IF(RC11=1, RC[-3], NA()) -> #NA | F348: =INDEX(2001Grossed!R1C1:R46C51, RC1, 1) -> #REF! | G348: =IF(EQUAL(INDEX(2001Grossed!R1C1:R46C51, RC1, 2), R1C), RC4, NA()) -> #REF! | H348: =IF(EQUAL(INDEX(2001Grossed!R1C1:R46C51, RC1, 2), R1C), RC4, NA()) -> #REF! | I348: =IF(EQUAL(INDEX(2001Grossed!R1C1:R46C51, RC1, 2), R1C), RC4, NA()) -> #REF! | J348: =IF(EQUAL(INDEX(2001Grossed!R1C1:R46C51, RC1, 2), R1C), RC4, NA()) -> #REF! | K348: =IF(OR(AND(NOT(ISERROR(RC7)), ISNUMBER(RC7)), AND(NOT(ISERROR(RC8)), ISNUMBER(RC8)), AND(NOT(ISERROR(RC9)), ISNUMBER(RC9)), AND(NOT(ISERROR(RC10)), ISNUMBER(RC10))), 1, 0) -> 0 | M348: =INDEX(Gross!R1C1:R46C51, RC1, 26) -> #REF! | N348: =INDEX(Gross!R1C1:R46C51, RC1, 27) -> #REF!
A349: 386 | B349: =INDEX(2001Grossed!R1C1:R46C51, RC[-1], 26) -> #REF! | C349: =INDEX(2001Grossed!R1C1:R46C51, RC1, 27) -> #REF! | D349: =IF(Menus!R9C10, RC[-1]/RC[-2], RC[-1]) -> #REF! | E349: =IF(RC11=1, RC[-3], NA()) -> #NA | F349: =INDEX(2001Grossed!R1C1:R46C51, RC1, 1) -> #REF! | G349: =IF(EQUAL(INDEX(2001Grossed!R1C1:R46C51, RC1, 2), R1C), RC4, NA()) -> #REF! | H349: =IF(EQUAL(INDEX(2001Grossed!R1C1:R46C51, RC1, 2), R1C), RC4, NA()) -> #REF! | I349: =IF(EQUAL(INDEX(2001Grossed!R1C1:R46C51, RC1, 2), R1C), RC4, NA()) -> #REF! | J349: =IF(EQUAL(INDEX(2001Grossed!R1C1:R46C51, RC1, 2), R1C), RC4, NA()) -> #REF! | K349: =IF(OR(AND(NOT(ISERROR(RC7)), ISNUMBER(RC7)), AND(NOT(ISERROR(RC8)), ISNUMBER(RC8)), AND(NOT(ISERROR(RC9)), ISNUMBER(RC9)), AND(NOT(ISERROR(RC10)), ISNUMBER(RC10))), 1, 0) -> 0 | M349: =INDEX(Gross!R1C1:R46C51, RC1, 26) -> #REF! | N349: =INDEX(Gross!R1C1:R46C51, RC1, 27) -> #REF!
A350: 387 | B350: =INDEX(2001Grossed!R1C1:R46C51, RC[-1], 26) -> #REF! | C350: =INDEX(2001Grossed!R1C1:R46C51, RC1, 27) -> #REF! | D350: =IF(Menus!R9C10, RC[-1]/RC[-2], RC[-1]) -> #REF! | E350: =IF(RC11=1, RC[-3], NA()) -> #NA | F350: =INDEX(2001Grossed!R1C1:R46C51, RC1, 1) -> #REF! | G350: =IF(EQUAL(INDEX(2001Grossed!R1C1:R46C51, RC1, 2), R1C), RC4, NA()) -> #REF! | H350: =IF(EQUAL(INDEX(2001Grossed!R1C1:R46C51, RC1, 2), R1C), RC4, NA()) -> #REF! | I350: =IF(EQUAL(INDEX(2001Grossed!R1C1:R46C51, RC1, 2), R1C), RC4, NA()) -> #REF! | J350: =IF(EQUAL(INDEX(2001Grossed!R1C1:R46C51, RC1, 2), R1C), RC4, NA()) -> #REF! | K350: =IF(OR(AND(NOT(ISERROR(RC7)), ISNUMBER(RC7)), AND(NOT(ISERROR(RC8)), ISNUMBER(RC8)), AND(NOT(ISERROR(RC9)), ISNUMBER(RC9)), AND(NOT(ISERROR(RC10)), ISNUMBER(RC10))), 1, 0) -> 0 | M350: =INDEX(Gross!R1C1:R46C51, RC1, 26) -> #REF! | N350: =INDEX(Gross!R1C1:R46C51, RC1, 27) -> #REF!
A351: 388 | B351: =INDEX(2001Grossed!R1C1:R46C51, RC[-1], 26) -> #REF! | C351: =INDEX(2001Grossed!R1C1:R46C51, RC1, 27) -> #REF! | D351: =IF(Menus!R9C10, RC[-1]/RC[-2], RC[-1]) -> #REF! | E351: =IF(RC11=1, RC[-3], NA()) -> #NA | F351: =INDEX(2001Grossed!R1C1:R46C51, RC1, 1) -> #REF! | G351: =IF(EQUAL(INDEX(2001Grossed!R1C1:R46C51, RC1, 2), R1C), RC4, NA()) -> #REF! | H351: =IF(EQUAL(INDEX(2001Grossed!R1C1:R46C51, RC1, 2), R1C), RC4, NA()) -> #REF! | I351: =IF(EQUAL(INDEX(2001Grossed!R1C1:R46C51, RC1, 2), R1C), RC4, NA()) -> #REF! | J351: =IF(EQUAL(INDEX(2001Grossed!R1C1:R46C51, RC1, 2), R1C), RC4, NA()) -> #REF! | K351: =IF(OR(AND(NOT(ISERROR(RC7)), ISNUMBER(RC7)), AND(NOT(ISERROR(RC8)), ISNUMBER(RC8)), AND(NOT(ISERROR(RC9)), ISNUMBER(RC9)), AND(NOT(ISERROR(RC10)), ISNUMBER(RC10))), 1, 0) -> 0 | M351: =INDEX(Gross!R1C1:R46C51, RC1, 26) -> #REF! | N351: =INDEX(Gross!R1C1:R46C51, RC1, 27) -> #REF!
A352: 389 | B352: =INDEX(2001Grossed!R1C1:R46C51, RC[-1], 26) -> #REF! | C352: =INDEX(2001Grossed!R1C1:R46C51, RC1, 27) -> #REF! | D352: =IF(Menus!R9C10, RC[-1]/RC[-2], RC[-1]) -> #REF! | E352: =IF(RC11=1, RC[-3], NA()) -> #NA | F352: =INDEX(2001Grossed!R1C1:R46C51, RC1, 1) -> #REF! | G352: =IF(EQUAL(INDEX(2001Grossed!R1C1:R46C51, RC1, 2), R1C), RC4, NA()) -> #REF! | H352: =IF(EQUAL(INDEX(2001Grossed!R1C1:R46C51, RC1, 2), R1C), RC4, NA()) -> #REF! | I352: =IF(EQUAL(INDEX(2001Grossed!R1C1:R46C51, RC1, 2), R1C), RC4, NA()) -> #REF! | J352: =IF(EQUAL(INDEX(2001Grossed!R1C1:R46C51, RC1, 2), R1C), RC4, NA()) -> #REF! | K352: =IF(OR(AND(NOT(ISERROR(RC7)), ISNUMBER(RC7)), AND(NOT(ISERROR(RC8)), ISNUMBER(RC8)), AND(NOT(ISERROR(RC9)), ISNUMBER(RC9)), AND(NOT(ISERROR(RC10)), ISNUMBER(RC10))), 1, 0) -> 0 | M352: =INDEX(Gross!R1C1:R46C51, RC1, 26) -> #REF! | N352: =INDEX(Gross!R1C1:R46C51, RC1, 27) -> #REF!
A353: 390 | B353: =INDEX(2001Grossed!R1C1:R46C51, RC[-1], 26) -> #REF! | C353: =INDEX(2001Grossed!R1C1:R46C51, RC1, 27) -> #REF! | D353: =IF(Menus!R9C10, RC[-1]/RC[-2], RC[-1]) -> #REF! | E353: =IF(RC11=1, RC[-3], NA()) -> #NA | F353: =INDEX(2001Grossed!R1C1:R46C51, RC1, 1) -> #REF! | G353: =IF(EQUAL(INDEX(2001Grossed!R1C1:R46C51, RC1, 2), R1C), RC4, NA()) -> #REF! | H353: =IF(EQUAL(INDEX(2001Grossed!R1C1:R46C51, RC1, 2), R1C), RC4, NA()) -> #REF! | I353: =IF(EQUAL(INDEX(2001Grossed!R1C1:R46C51, RC1, 2), R1C), RC4, NA()) -> #REF! | J353: =IF(EQUAL(INDEX(2001Grossed!R1C1:R46C51, RC1, 2), R1C), RC4, NA()) -> #REF! | K353: =IF(OR(AND(NOT(ISERROR(RC7)), ISNUMBER(RC7)), AND(NOT(ISERROR(RC8)), ISNUMBER(RC8)), AND(NOT(ISERROR(RC9)), ISNUMBER(RC9)), AND(NOT(ISERROR(RC10)), ISNUMBER(RC10))), 1, 0) -> 0 | M353: =INDEX(Gross!R1C1:R46C51, RC1, 26) -> #REF! | N353: =INDEX(Gross!R1C1:R46C51, RC1, 27) -> #REF!
A354: 391 | B354: =INDEX(2001Grossed!R1C1:R46C51, RC[-1], 26) -> #REF! | C354: =INDEX(2001Grossed!R1C1:R46C51, RC1, 27) -> #REF! | D354: =IF(Menus!R9C10, RC[-1]/RC[-2], RC[-1]) -> #REF! | E354: =IF(RC11=1, RC[-3], NA()) -> #NA | F354: =INDEX(2001Grossed!R1C1:R46C51, RC1, 1) -> #REF! | G354: =IF(EQUAL(INDEX(2001Grossed!R1C1:R46C51, RC1, 2), R1C), RC4, NA()) -> #REF! | H354: =IF(EQUAL(INDEX(2001Grossed!R1C1:R46C51, RC1, 2), R1C), RC4, NA()) -> #REF! | I354: =IF(EQUAL(INDEX(2001Grossed!R1C1:R46C51, RC1, 2), R1C), RC4, NA()) -> #REF! | J354: =IF(EQUAL(INDEX(2001Grossed!R1C1:R46C51, RC1, 2), R1C), RC4, NA()) -> #REF! | K354: =IF(OR(AND(NOT(ISERROR(RC7)), ISNUMBER(RC7)), AND(NOT(ISERROR(RC8)), ISNUMBER(RC8)), AND(NOT(ISERROR(RC9)), ISNUMBER(RC9)), AND(NOT(ISERROR(RC10)), ISNUMBER(RC10))), 1, 0) -> 0 | M354: =INDEX(Gross!R1C1:R46C51, RC1, 26) -> #REF! | N354: =INDEX(Gross!R1C1:R46C51, RC1, 27) -> #REF!
A355: 392 | B355: =INDEX(2001Grossed!R1C1:R46C51, RC[-1], 26) -> #REF! | C355: =INDEX(2001Grossed!R1C1:R46C51, RC1, 27) -> #REF! | D355: =IF(Menus!R9C10, RC[-1]/RC[-2], RC[-1]) -> #REF! | E355: =IF(RC11=1, RC[-3], NA()) -> #NA | F355: =INDEX(2001Grossed!R1C1:R46C51, RC1, 1) -> #REF! | G355: =IF(EQUAL(INDEX(2001Grossed!R1C1:R46C51, RC1, 2), R1C), RC4, NA()) -> #REF! | H355: =IF(EQUAL(INDEX(2001Grossed!R1C1:R46C51, RC1, 2), R1C), RC4, NA()) -> #REF! | I355: =IF(EQUAL(INDEX(2001Grossed!R1C1:R46C51, RC1, 2), R1C), RC4, NA()) -> #REF! | J355: =IF(EQUAL(INDEX(2001Grossed!R1C1:R46C51, RC1, 2), R1C), RC4, NA()) -> #REF! | K355: =IF(OR(AND(NOT(ISERROR(RC7)), ISNUMBER(RC7)), AND(NOT(ISERROR(RC8)), ISNUMBER(RC8)), AND(NOT(ISERROR(RC9)), ISNUMBER(RC9)), AND(NOT(ISERROR(RC10)), ISNUMBER(RC10))), 1, 0) -> 0 | M355: =INDEX(Gross!R1C1:R46C51, RC1, 26) -> #REF! | N355: =INDEX(Gross!R1C1:R46C51, RC1, 27) -> #REF!
A356: 393 | B356: =INDEX(2001Grossed!R1C1:R46C51, RC[-1], 26) -> #REF! | C356: =INDEX(2001Grossed!R1C1:R46C51, RC1, 27) -> #REF! | D356: =IF(Menus!R9C10, RC[-1]/RC[-2], RC[-1]) -> #REF! | E356: =IF(RC11=1, RC[-3], NA()) -> #NA | F356: =INDEX(2001Grossed!R1C1:R46C51, RC1, 1) -> #REF! | G356: =IF(EQUAL(INDEX(2001Grossed!R1C1:R46C51, RC1, 2), R1C), RC4, NA()) -> #REF! | H356: =IF(EQUAL(INDEX(2001Grossed!R1C1:R46C51, RC1, 2), R1C), RC4, NA()) -> #REF! | I356: =IF(EQUAL(INDEX(2001Grossed!R1C1:R46C51, RC1, 2), R1C), RC4, NA()) -> #REF! | J356: =IF(EQUAL(INDEX(2001Grossed!R1C1:R46C51, RC1, 2), R1C), RC4, NA()) -> #REF! | K356: =IF(OR(AND(NOT(ISERROR(RC7)), ISNUMBER(RC7)), AND(NOT(ISERROR(RC8)), ISNUMBER(RC8)), AND(NOT(ISERROR(RC9)), ISNUMBER(RC9)), AND(NOT(ISERROR(RC10)), ISNUMBER(RC10))), 1, 0) -> 0 | M356: =INDEX(Gross!R1C1:R46C51, RC1, 26) -> #REF! | N356: =INDEX(Gross!R1C1:R46C51, RC1, 27) -> #REF!
A357: 394 | B357: =INDEX(2001Grossed!R1C1:R46C51, RC[-1], 26) -> #REF! | C357: =INDEX(2001Grossed!R1C1:R46C51, RC1, 27) -> #REF! | D357: =IF(Menus!R9C10, RC[-1]/RC[-2], RC[-1]) -> #REF! | E357: =IF(RC11=1, RC[-3], NA()) -> #NA | F357: =INDEX(2001Grossed!R1C1:R46C51, RC1, 1) -> #REF! | G357: =IF(EQUAL(INDEX(2001Grossed!R1C1:R46C51, RC1, 2), R1C), RC4, NA()) -> #REF! | H357: =IF(EQUAL(INDEX(2001Grossed!R1C1:R46C51, RC1, 2), R1C), RC4, NA()) -> #REF! | I357: =IF(EQUAL(INDEX(2001Grossed!R1C1:R46C51, RC1, 2), R1C), RC4, NA()) -> #REF! | J357: =IF(EQUAL(INDEX(2001Grossed!R1C1:R46C51, RC1, 2), R1C), RC4, NA()) -> #REF! | K357: =IF(OR(AND(NOT(ISERROR(RC7)), ISNUMBER(RC7)), AND(NOT(ISERROR(RC8)), ISNUMBER(RC8)), AND(NOT(ISERROR(RC9)), ISNUMBER(RC9)), AND(NOT(ISERROR(RC10)), ISNUMBER(RC10))), 1, 0) -> 0 | M357: =INDEX(Gross!R1C1:R46C51, RC1, 26) -> #REF! | N357: =INDEX(Gross!R1C1:R46C51, RC1, 27) -> #REF!
A358: 395 | B358: =INDEX(2001Grossed!R1C1:R46C51, RC[-1], 26) -> #REF! | C358: =INDEX(2001Grossed!R1C1:R46C51, RC1, 27) -> #REF! | D358: =IF(Menus!R9C10, RC[-1]/RC[-2], RC[-1]) -> #REF! | E358: =IF(RC11=1, RC[-3], NA()) -> #NA | F358: =INDEX(2001Grossed!R1C1:R46C51, RC1, 1) -> #REF! | G358: =IF(EQUAL(INDEX(2001Grossed!R1C1:R46C51, RC1, 2), R1C), RC4, NA()) -> #REF! | H358: =IF(EQUAL(INDEX(2001Grossed!R1C1:R46C51, RC1, 2), R1C), RC4, NA()) -> #REF! | I358: =IF(EQUAL(INDEX(2001Grossed!R1C1:R46C51, RC1, 2), R1C), RC4, NA()) -> #REF! | J358: =IF(EQUAL(INDEX(2001Grossed!R1C1:R46C51, RC1, 2), R1C), RC4, NA()) -> #REF! | K358: =IF(OR(AND(NOT(ISERROR(RC7)), ISNUMBER(RC7)), AND(NOT(ISERROR(RC8)), ISNUMBER(RC8)), AND(NOT(ISERROR(RC9)), ISNUMBER(RC9)), AND(NOT(ISERROR(RC10)), ISNUMBER(RC10))), 1, 0) -> 0 | M358: =INDEX(Gross!R1C1:R46C51, RC1, 26) -> #REF! | N358: =INDEX(Gross!R1C1:R46C51, RC1, 27) -> #REF!
A359: 396 | B359: =INDEX(2001Grossed!R1C1:R46C51, RC[-1], 26) -> #REF! | C359: =INDEX(2001Grossed!R1C1:R46C51, RC1, 27) -> #REF! | D359: =IF(Menus!R9C10, RC[-1]/RC[-2], RC[-1]) -> #REF! | E359: =IF(RC11=1, RC[-3], NA()) -> #NA | F359: =INDEX(2001Grossed!R1C1:R46C51, RC1, 1) -> #REF! | G359: =IF(EQUAL(INDEX(2001Grossed!R1C1:R46C51, RC1, 2), R1C), RC4, NA()) -> #REF! | H359: =IF(EQUAL(INDEX(2001Grossed!R1C1:R46C51, RC1, 2), R1C), RC4, NA()) -> #REF! | I359: =IF(EQUAL(INDEX(2001Grossed!R1C1:R46C51, RC1, 2), R1C), RC4, NA()) -> #REF! | J359: =IF(EQUAL(INDEX(2001Grossed!R1C1:R46C51, RC1, 2), R1C), RC4, NA()) -> #REF! | K359: =IF(OR(AND(NOT(ISERROR(RC7)), ISNUMBER(RC7)), AND(NOT(ISERROR(RC8)), ISNUMBER(RC8)), AND(NOT(ISERROR(RC9)), ISNUMBER(RC9)), AND(NOT(ISERROR(RC10)), ISNUMBER(RC10))), 1, 0) -> 0 | M359: =INDEX(Gross!R1C1:R46C51, RC1, 26) -> #REF! | N359: =INDEX(Gross!R1C1:R46C51, RC1, 27) -> #REF!
A360: 397 | B360: =INDEX(2001Grossed!R1C1:R46C51, RC[-1], 26) -> #REF! | C360: =INDEX(2001Grossed!R1C1:R46C51, RC1, 27) -> #REF! | D360: =IF(Menus!R9C10, RC[-1]/RC[-2], RC[-1]) -> #REF! | E360: =IF(RC11=1, RC[-3], NA()) -> #NA | F360: =INDEX(2001Grossed!R1C1:R46C51, RC1, 1) -> #REF! | G360: =IF(EQUAL(INDEX(2001Grossed!R1C1:R46C51, RC1, 2), R1C), RC4, NA()) -> #REF! | H360: =IF(EQUAL(INDEX(2001Grossed!R1C1:R46C51, RC1, 2), R1C), RC4, NA()) -> #REF! | I360: =IF(EQUAL(INDEX(2001Grossed!R1C1:R46C51, RC1, 2), R1C), RC4, NA()) -> #REF! | J360: =IF(EQUAL(INDEX(2001Grossed!R1C1:R46C51, RC1, 2), R1C), RC4, NA()) -> #REF! | K360: =IF(OR(AND(NOT(ISERROR(RC7)), ISNUMBER(RC7)), AND(NOT(ISERROR(RC8)), ISNUMBER(RC8)), AND(NOT(ISERROR(RC9)), ISNUMBER(RC9)), AND(NOT(ISERROR(RC10)), ISNUMBER(RC10))), 1, 0) -> 0 | M360: =INDEX(Gross!R1C1:R46C51, RC1, 26) -> #REF! | N360: =INDEX(Gross!R1C1:R46C51, RC1, 27) -> #REF!
A361: 398 | B361: =INDEX(2001Grossed!R1C1:R46C51, RC[-1], 26) -> #REF! | C361: =INDEX(2001Grossed!R1C1:R46C51, RC1, 27) -> #REF! | D361: =IF(Menus!R9C10, RC[-1]/RC[-2], RC[-1]) -> #REF! | E361: =IF(RC11=1, RC[-3], NA()) -> #NA | F361: =INDEX(2001Grossed!R1C1:R46C51, RC1, 1) -> #REF! | G361: =IF(EQUAL(INDEX(2001Grossed!R1C1:R46C51, RC1, 2), R1C), RC4, NA()) -> #REF! | H361: =IF(EQUAL(INDEX(2001Grossed!R1C1:R46C51, RC1, 2), R1C), RC4, NA()) -> #REF! | I361: =IF(EQUAL(INDEX(2001Grossed!R1C1:R46C51, RC1, 2), R1C), RC4, NA()) -> #REF! | J361: =IF(EQUAL(INDEX(2001Grossed!R1C1:R46C51, RC1, 2), R1C), RC4, NA()) -> #REF! | K361: =IF(OR(AND(NOT(ISERROR(RC7)), ISNUMBER(RC7)), AND(NOT(ISERROR(RC8)), ISNUMBER(RC8)), AND(NOT(ISERROR(RC9)), ISNUMBER(RC9)), AND(NOT(ISERROR(RC10)), ISNUMBER(RC10))), 1, 0) -> 0 | M361: =INDEX(Gross!R1C1:R46C51, RC1, 26) -> #REF! | N361: =INDEX(Gross!R1C1:R46C51, RC1, 27) -> #REF!
A362: 399 | B362: =INDEX(2001Grossed!R1C1:R46C51, RC[-1], 26) -> #REF! | C362: =INDEX(2001Grossed!R1C1:R46C51, RC1, 27) -> #REF! | D362: =IF(Menus!R9C10, RC[-1]/RC[-2], RC[-1]) -> #REF! | E362: =IF(RC11=1, RC[-3], NA()) -> #NA | F362: =INDEX(2001Grossed!R1C1:R46C51, RC1, 1) -> #REF! | G362: =IF(EQUAL(INDEX(2001Grossed!R1C1:R46C51, RC1, 2), R1C), RC4, NA()) -> #REF! | H362: =IF(EQUAL(INDEX(2001Grossed!R1C1:R46C51, RC1, 2), R1C), RC4, NA()) -> #REF! | I362: =IF(EQUAL(INDEX(2001Grossed!R1C1:R46C51, RC1, 2), R1C), RC4, NA()) -> #REF! | J362: =IF(EQUAL(INDEX(2001Grossed!R1C1:R46C51, RC1, 2), R1C), RC4, NA()) -> #REF! | K362: =IF(OR(AND(NOT(ISERROR(RC7)), ISNUMBER(RC7)), AND(NOT(ISERROR(RC8)), ISNUMBER(RC8)), AND(NOT(ISERROR(RC9)), ISNUMBER(RC9)), AND(NOT(ISERROR(RC10)), ISNUMBER(RC10))), 1, 0) -> 0 | M362: =INDEX(Gross!R1C1:R46C51, RC1, 26) -> #REF! | N362: =INDEX(Gross!R1C1:R46C51, RC1, 27) -> #REF!
A363: 400 | B363: =INDEX(2001Grossed!R1C1:R46C51, RC[-1], 26) -> #REF! | C363: =INDEX(2001Grossed!R1C1:R46C51, RC1, 27) -> #REF! | D363: =IF(Menus!R9C10, RC[-1]/RC[-2], RC[-1]) -> #REF! | E363: =IF(RC11=1, RC[-3], NA()) -> #NA | F363: =INDEX(2001Grossed!R1C1:R46C51, RC1, 1) -> #REF! | G363: =IF(EQUAL(INDEX(2001Grossed!R1C1:R46C51, RC1, 2), R1C), RC4, NA()) -> #REF! | H363: =IF(EQUAL(INDEX(2001Grossed!R1C1:R46C51, RC1, 2), R1C), RC4, NA()) -> #REF! | I363: =IF(EQUAL(INDEX(2001Grossed!R1C1:R46C51, RC1, 2), R1C), RC4, NA()) -> #REF! | J363: =IF(EQUAL(INDEX(2001Grossed!R1C1:R46C51, RC1, 2), R1C), RC4, NA()) -> #REF! | K363: =IF(OR(AND(NOT(ISERROR(RC7)), ISNUMBER(RC7)), AND(NOT(ISERROR(RC8)), ISNUMBER(RC8)), AND(NOT(ISERROR(RC9)), ISNUMBER(RC9)), AND(NOT(ISERROR(RC10)), ISNUMBER(RC10))), 1, 0) -> 0 | M363: =INDEX(Gross!R1C1:R46C51, RC1, 26) -> #REF! | N363: =INDEX(Gross!R1C1:R46C51, RC1, 27) -> #REF!
A364: 401 | B364: =INDEX(2001Grossed!R1C1:R46C51, RC[-1], 26) -> #REF! | C364: =INDEX(2001Grossed!R1C1:R46C51, RC1, 27) -> #REF! | D364: =IF(Menus!R9C10, RC[-1]/RC[-2], RC[-1]) -> #REF! | E364: =IF(RC11=1, RC[-3], NA()) -> #NA | F364: =INDEX(2001Grossed!R1C1:R46C51, RC1, 1) -> #REF! | G364: =IF(EQUAL(INDEX(2001Grossed!R1C1:R46C51, RC1, 2), R1C), RC4, NA()) -> #REF! | H364: =IF(EQUAL(INDEX(2001Grossed!R1C1:R46C51, RC1, 2), R1C), RC4, NA()) -> #REF! | I364: =IF(EQUAL(INDEX(2001Grossed!R1C1:R46C51, RC1, 2), R1C), RC4, NA()) -> #REF! | J364: =IF(EQUAL(INDEX(2001Grossed!R1C1:R46C51, RC1, 2), R1C), RC4, NA()) -> #REF! | K364: =IF(OR(AND(NOT(ISERROR(RC7)), ISNUMBER(RC7)), AND(NOT(ISERROR(RC8)), ISNUMBER(RC8)), AND(NOT(ISERROR(RC9)), ISNUMBER(RC9)), AND(NOT(ISERROR(RC10)), ISNUMBER(RC10))), 1, 0) -> 0 | M364: =INDEX(Gross!R1C1:R46C51, RC1, 26) -> #REF! | N364: =INDEX(Gross!R1C1:R46C51, RC1, 27) -> #REF!
A365: 402 | B365: =INDEX(2001Grossed!R1C1:R46C51, RC[-1], 26) -> #REF! | C365: =INDEX(2001Grossed!R1C1:R46C51, RC1, 27) -> #REF! | D365: =IF(Menus!R9C10, RC[-1]/RC[-2], RC[-1]) -> #REF! | E365: =IF(RC11=1, RC[-3], NA()) -> #NA | F365: =INDEX(2001Grossed!R1C1:R46C51, RC1, 1) -> #REF! | G365: =IF(EQUAL(INDEX(2001Grossed!R1C1:R46C51, RC1, 2), R1C), RC4, NA()) -> #REF! | H365: =IF(EQUAL(INDEX(2001Grossed!R1C1:R46C51, RC1, 2), R1C), RC4, NA()) -> #REF! | I365: =IF(EQUAL(INDEX(2001Grossed!R1C1:R46C51, RC1, 2), R1C), RC4, NA()) -> #REF! | J365: =IF(EQUAL(INDEX(2001Grossed!R1C1:R46C51, RC1, 2), R1C), RC4, NA()) -> #REF! | K365: =IF(OR(AND(NOT(ISERROR(RC7)), ISNUMBER(RC7)), AND(NOT(ISERROR(RC8)), ISNUMBER(RC8)), AND(NOT(ISERROR(RC9)), ISNUMBER(RC9)), AND(NOT(ISERROR(RC10)), ISNUMBER(RC10))), 1, 0) -> 0 | M365: =INDEX(Gross!R1C1:R46C51, RC1, 26) -> #REF! | N365: =INDEX(Gross!R1C1:R46C51, RC1, 27) -> #REF!
A366: 403 | B366: =INDEX(2001Grossed!R1C1:R46C51, RC[-1], 26) -> #REF! | C366: =INDEX(2001Grossed!R1C1:R46C51, RC1, 27) -> #REF! | D366: =IF(Menus!R9C10, RC[-1]/RC[-2], RC[-1]) -> #REF! | E366: =IF(RC11=1, RC[-3], NA()) -> #NA | F366: =INDEX(2001Grossed!R1C1:R46C51, RC1, 1) -> #REF! | G366: =IF(EQUAL(INDEX(2001Grossed!R1C1:R46C51, RC1, 2), R1C), RC4, NA()) -> #REF! | H366: =IF(EQUAL(INDEX(2001Grossed!R1C1:R46C51, RC1, 2), R1C), RC4, NA()) -> #REF! | I366: =IF(EQUAL(INDEX(2001Grossed!R1C1:R46C51, RC1, 2), R1C), RC4, NA()) -> #REF! | J366: =IF(EQUAL(INDEX(2001Grossed!R1C1:R46C51, RC1, 2), R1C), RC4, NA()) -> #REF! | K366: =IF(OR(AND(NOT(ISERROR(RC7)), ISNUMBER(RC7)), AND(NOT(ISERROR(RC8)), ISNUMBER(RC8)), AND(NOT(ISERROR(RC9)), ISNUMBER(RC9)), AND(NOT(ISERROR(RC10)), ISNUMBER(RC10))), 1, 0) -> 0 | M366: =INDEX(Gross!R1C1:R46C51, RC1, 26) -> #REF! | N366: =INDEX(Gross!R1C1:R46C51, RC1, 27) -> #REF!
A367: 404 | B367: =INDEX(2001Grossed!R1C1:R46C51, RC[-1], 26) -> #REF! | C367: =INDEX(2001Grossed!R1C1:R46C51, RC1, 27) -> #REF! | D367: =IF(Menus!R9C10, RC[-1]/RC[-2], RC[-1]) -> #REF! | E367: =IF(RC11=1, RC[-3], NA()) -> #NA | F367: =INDEX(2001Grossed!R1C1:R46C51, RC1, 1) -> #REF! | G367: =IF(EQUAL(INDEX(2001Grossed!R1C1:R46C51, RC1, 2), R1C), RC4, NA()) -> #REF! | H367: =IF(EQUAL(INDEX(2001Grossed!R1C1:R46C51, RC1, 2), R1C), RC4, NA()) -> #REF! | I367: =IF(EQUAL(INDEX(2001Grossed!R1C1:R46C51, RC1, 2), R1C), RC4, NA()) -> #REF! | J367: =IF(EQUAL(INDEX(2001Grossed!R1C1:R46C51, RC1, 2), R1C), RC4, NA()) -> #REF! | K367: =IF(OR(AND(NOT(ISERROR(RC7)), ISNUMBER(RC7)), AND(NOT(ISERROR(RC8)), ISNUMBER(RC8)), AND(NOT(ISERROR(RC9)), ISNUMBER(RC9)), AND(NOT(ISERROR(RC10)), ISNUMBER(RC10))), 1, 0) -> 0 | M367: =INDEX(Gross!R1C1:R46C51, RC1, 26) -> #REF! | N367: =INDEX(Gross!R1C1:R46C51, RC1, 27) -> #REF!
A368: 405 | B368: =INDEX(2001Grossed!R1C1:R46C51, RC[-1], 26) -> #REF! | C368: =INDEX(2001Grossed!R1C1:R46C51, RC1, 27) -> #REF! | D368: =IF(Menus!R9C10, RC[-1]/RC[-2], RC[-1]) -> #REF! | E368: =IF(RC11=1, RC[-3], NA()) -> #NA | F368: =INDEX(2001Grossed!R1C1:R46C51, RC1, 1) -> #REF! | G368: =IF(EQUAL(INDEX(2001Grossed!R1C1:R46C51, RC1, 2), R1C), RC4, NA()) -> #REF! | H368: =IF(EQUAL(INDEX(2001Grossed!R1C1:R46C51, RC1, 2), R1C), RC4, NA()) -> #REF! | I368: =IF(EQUAL(INDEX(2001Grossed!R1C1:R46C51, RC1, 2), R1C), RC4, NA()) -> #REF! | J368: =IF(EQUAL(INDEX(2001Grossed!R1C1:R46C51, RC1, 2), R1C), RC4, NA()) -> #REF! | K368: =IF(OR(AND(NOT(ISERROR(RC7)), ISNUMBER(RC7)), AND(NOT(ISERROR(RC8)), ISNUMBER(RC8)), AND(NOT(ISERROR(RC9)), ISNUMBER(RC9)), AND(NOT(ISERROR(RC10)), ISNUMBER(RC10))), 1, 0) -> 0 | M368: =INDEX(Gross!R1C1:R46C51, RC1, 26) -> #REF! | N368: =INDEX(Gross!R1C1:R46C51, RC1, 27) -> #REF!
A369: 406 | B369: =INDEX(2001Grossed!R1C1:R46C51, RC[-1], 26) -> #REF! | C369: =INDEX(2001Grossed!R1C1:R46C51, RC1, 27) -> #REF! | D369: =IF(Menus!R9C10, RC[-1]/RC[-2], RC[-1]) -> #REF! | E369: =IF(RC11=1, RC[-3], NA()) -> #NA | F369: =INDEX(2001Grossed!R1C1:R46C51, RC1, 1) -> #REF! | G369: =IF(EQUAL(INDEX(2001Grossed!R1C1:R46C51, RC1, 2), R1C), RC4, NA()) -> #REF! | H369: =IF(EQUAL(INDEX(2001Grossed!R1C1:R46C51, RC1, 2), R1C), RC4, NA()) -> #REF! | I369: =IF(EQUAL(INDEX(2001Grossed!R1C1:R46C51, RC1, 2), R1C), RC4, NA()) -> #REF! | J369: =IF(EQUAL(INDEX(2001Grossed!R1C1:R46C51, RC1, 2), R1C), RC4, NA()) -> #REF! | K369: =IF(OR(AND(NOT(ISERROR(RC7)), ISNUMBER(RC7)), AND(NOT(ISERROR(RC8)), ISNUMBER(RC8)), AND(NOT(ISERROR(RC9)), ISNUMBER(RC9)), AND(NOT(ISERROR(RC10)), ISNUMBER(RC10))), 1, 0) -> 0 | M369: =INDEX(Gross!R1C1:R46C51, RC1, 26) -> #REF! | N369: =INDEX(Gross!R1C1:R46C51, RC1, 27) -> #REF!
A370: 407 | B370: =INDEX(2001Grossed!R1C1:R46C51, RC[-1], 26) -> #REF! | C370: =INDEX(2001Grossed!R1C1:R46C51, RC1, 27) -> #REF! | D370: =IF(Menus!R9C10, RC[-1]/RC[-2], RC[-1]) -> #REF! | E370: =IF(RC11=1, RC[-3], NA()) -> #NA | F370: =INDEX(2001Grossed!R1C1:R46C51, RC1, 1) -> #REF! | G370: =IF(EQUAL(INDEX(2001Grossed!R1C1:R46C51, RC1, 2), R1C), RC4, NA()) -> #REF! | H370: =IF(EQUAL(INDEX(2001Grossed!R1C1:R46C51, RC1, 2), R1C), RC4, NA()) -> #REF! | I370: =IF(EQUAL(INDEX(2001Grossed!R1C1:R46C51, RC1, 2), R1C), RC4, NA()) -> #REF! | J370: =IF(EQUAL(INDEX(2001Grossed!R1C1:R46C51, RC1, 2), R1C), RC4, NA()) -> #REF! | K370: =IF(OR(AND(NOT(ISERROR(RC7)), ISNUMBER(RC7)), AND(NOT(ISERROR(RC8)), ISNUMBER(RC8)), AND(NOT(ISERROR(RC9)), ISNUMBER(RC9)), AND(NOT(ISERROR(RC10)), ISNUMBER(RC10))), 1, 0) -> 0 | M370: =INDEX(Gross!R1C1:R46C51, RC1, 26) -> #REF! | N370: =INDEX(Gross!R1C1:R46C51, RC1, 27) -> #REF!
A371: 408 | B371: =INDEX(2001Grossed!R1C1:R46C51, RC[-1], 26) -> #REF! | C371: =INDEX(2001Grossed!R1C1:R46C51, RC1, 27) -> #REF! | D371: =IF(Menus!R9C10, RC[-1]/RC[-2], RC[-1]) -> #REF! | E371: =IF(RC11=1, RC[-3], NA()) -> #NA | F371: =INDEX(2001Grossed!R1C1:R46C51, RC1, 1) -> #REF! | G371: =IF(EQUAL(INDEX(2001Grossed!R1C1:R46C51, RC1, 2), R1C), RC4, NA()) -> #REF! | H371: =IF(EQUAL(INDEX(2001Grossed!R1C1:R46C51, RC1, 2), R1C), RC4, NA()) -> #REF! | I371: =IF(EQUAL(INDEX(2001Grossed!R1C1:R46C51, RC1, 2), R1C), RC4, NA()) -> #REF! | J371: =IF(EQUAL(INDEX(2001Grossed!R1C1:R46C51, RC1, 2), R1C), RC4, NA()) -> #REF! | K371: =IF(OR(AND(NOT(ISERROR(RC7)), ISNUMBER(RC7)), AND(NOT(ISERROR(RC8)), ISNUMBER(RC8)), AND(NOT(ISERROR(RC9)), ISNUMBER(RC9)), AND(NOT(ISERROR(RC10)), ISNUMBER(RC10))), 1, 0) -> 0 | M371: =INDEX(Gross!R1C1:R46C51, RC1, 26) -> #REF! | N371: =INDEX(Gross!R1C1:R46C51, RC1, 27) -> #REF!
A372: 409 | B372: =INDEX(2001Grossed!R1C1:R46C51, RC[-1], 26) -> #REF! | C372: =INDEX(2001Grossed!R1C1:R46C51, RC1, 27) -> #REF! | D372: =IF(Menus!R9C10, RC[-1]/RC[-2], RC[-1]) -> #REF! | E372: =IF(RC11=1, RC[-3], NA()) -> #NA | F372: =INDEX(2001Grossed!R1C1:R46C51, RC1, 1) -> #REF! | G372: =IF(EQUAL(INDEX(2001Grossed!R1C1:R46C51, RC1, 2), R1C), RC4, NA()) -> #REF! | H372: =IF(EQUAL(INDEX(2001Grossed!R1C1:R46C51, RC1, 2), R1C), RC4, NA()) -> #REF! | I372: =IF(EQUAL(INDEX(2001Grossed!R1C1:R46C51, RC1, 2), R1C), RC4, NA()) -> #REF! | J372: =IF(EQUAL(INDEX(2001Grossed!R1C1:R46C51, RC1, 2), R1C), RC4, NA()) -> #REF! | K372: =IF(OR(AND(NOT(ISERROR(RC7)), ISNUMBER(RC7)), AND(NOT(ISERROR(RC8)), ISNUMBER(RC8)), AND(NOT(ISERROR(RC9)), ISNUMBER(RC9)), AND(NOT(ISERROR(RC10)), ISNUMBER(RC10))), 1, 0) -> 0 | M372: =INDEX(Gross!R1C1:R46C51, RC1, 26) -> #REF! | N372: =INDEX(Gross!R1C1:R46C51, RC1, 27) -> #REF!
A373: 410 | B373: =INDEX(2001Grossed!R1C1:R46C51, RC[-1], 26) -> #REF! | C373: =INDEX(2001Grossed!R1C1:R46C51, RC1, 27) -> #REF! | D373: =IF(Menus!R9C10, RC[-1]/RC[-2], RC[-1]) -> #REF! | E373: =IF(RC11=1, RC[-3], NA()) -> #NA | F373: =INDEX(2001Grossed!R1C1:R46C51, RC1, 1) -> #REF! | G373: =IF(EQUAL(INDEX(2001Grossed!R1C1:R46C51, RC1, 2), R1C), RC4, NA()) -> #REF! | H373: =IF(EQUAL(INDEX(2001Grossed!R1C1:R46C51, RC1, 2), R1C), RC4, NA()) -> #REF! | I373: =IF(EQUAL(INDEX(2001Grossed!R1C1:R46C51, RC1, 2), R1C), RC4, NA()) -> #REF! | J373: =IF(EQUAL(INDEX(2001Grossed!R1C1:R46C51, RC1, 2), R1C), RC4, NA()) -> #REF! | K373: =IF(OR(AND(NOT(ISERROR(RC7)), ISNUMBER(RC7)), AND(NOT(ISERROR(RC8)), ISNUMBER(RC8)), AND(NOT(ISERROR(RC9)), ISNUMBER(RC9)), AND(NOT(ISERROR(RC10)), ISNUMBER(RC10))), 1, 0) -> 0 | M373: =INDEX(Gross!R1C1:R46C51, RC1, 26) -> #REF! | N373: =INDEX(Gross!R1C1:R46C51, RC1, 27) -> #REF!
A374: 411 | B374: =INDEX(2001Grossed!R1C1:R46C51, RC[-1], 26) -> #REF! | C374: =INDEX(2001Grossed!R1C1:R46C51, RC1, 27) -> #REF! | D374: =IF(Menus!R9C10, RC[-1]/RC[-2], RC[-1]) -> #REF! | E374: =IF(RC11=1, RC[-3], NA()) -> #NA | F374: =INDEX(2001Grossed!R1C1:R46C51, RC1, 1) -> #REF! | G374: =IF(EQUAL(INDEX(2001Grossed!R1C1:R46C51, RC1, 2), R1C), RC4, NA()) -> #REF! | H374: =IF(EQUAL(INDEX(2001Grossed!R1C1:R46C51, RC1, 2), R1C), RC4, NA()) -> #REF! | I374: =IF(EQUAL(INDEX(2001Grossed!R1C1:R46C51, RC1, 2), R1C), RC4, NA()) -> #REF! | J374: =IF(EQUAL(INDEX(2001Grossed!R1C1:R46C51, RC1, 2), R1C), RC4, NA()) -> #REF! | K374: =IF(OR(AND(NOT(ISERROR(RC7)), ISNUMBER(RC7)), AND(NOT(ISERROR(RC8)), ISNUMBER(RC8)), AND(NOT(ISERROR(RC9)), ISNUMBER(RC9)), AND(NOT(ISERROR(RC10)), ISNUMBER(RC10))), 1, 0) -> 0 | M374: =INDEX(Gross!R1C1:R46C51, RC1, 26) -> #REF! | N374: =INDEX(Gross!R1C1:R46C51, RC1, 27) -> #REF!
A375: 412 | B375: =INDEX(2001Grossed!R1C1:R46C51, RC[-1], 26) -> #REF! | C375: =INDEX(2001Grossed!R1C1:R46C51, RC1, 27) -> #REF! | D375: =IF(Menus!R9C10, RC[-1]/RC[-2], RC[-1]) -> #REF! | E375: =IF(RC11=1, RC[-3], NA()) -> #NA | F375: =INDEX(2001Grossed!R1C1:R46C51, RC1, 1) -> #REF! | G375: =IF(EQUAL(INDEX(2001Grossed!R1C1:R46C51, RC1, 2), R1C), RC4, NA()) -> #REF! | H375: =IF(EQUAL(INDEX(2001Grossed!R1C1:R46C51, RC1, 2), R1C), RC4, NA()) -> #REF! | I375: =IF(EQUAL(INDEX(2001Grossed!R1C1:R46C51, RC1, 2), R1C), RC4, NA()) -> #REF! | J375: =IF(EQUAL(INDEX(2001Grossed!R1C1:R46C51, RC1, 2), R1C), RC4, NA()) -> #REF! | K375: =IF(OR(AND(NOT(ISERROR(RC7)), ISNUMBER(RC7)), AND(NOT(ISERROR(RC8)), ISNUMBER(RC8)), AND(NOT(ISERROR(RC9)), ISNUMBER(RC9)), AND(NOT(ISERROR(RC10)), ISNUMBER(RC10))), 1, 0) -> 0 | M375: =INDEX(Gross!R1C1:R46C51, RC1, 26) -> #REF! | N375: =INDEX(Gross!R1C1:R46C51, RC1, 27) -> #REF!
A376: 413 | B376: =INDEX(2001Grossed!R1C1:R46C51, RC[-1], 26) -> #REF! | C376: =INDEX(2001Grossed!R1C1:R46C51, RC1, 27) -> #REF! | D376: =IF(Menus!R9C10, RC[-1]/RC[-2], RC[-1]) -> #REF! | E376: =IF(RC11=1, RC[-3], NA()) -> #NA | F376: =INDEX(2001Grossed!R1C1:R46C51, RC1, 1) -> #REF! | G376: =IF(EQUAL(INDEX(2001Grossed!R1C1:R46C51, RC1, 2), R1C), RC4, NA()) -> #REF! | H376: =IF(EQUAL(INDEX(2001Grossed!R1C1:R46C51, RC1, 2), R1C), RC4, NA()) -> #REF! | I376: =IF(EQUAL(INDEX(2001Grossed!R1C1:R46C51, RC1, 2), R1C), RC4, NA()) -> #REF! | J376: =IF(EQUAL(INDEX(2001Grossed!R1C1:R46C51, RC1, 2), R1C), RC4, NA()) -> #REF! | K376: =IF(OR(AND(NOT(ISERROR(RC7)), ISNUMBER(RC7)), AND(NOT(ISERROR(RC8)), ISNUMBER(RC8)), AND(NOT(ISERROR(RC9)), ISNUMBER(RC9)), AND(NOT(ISERROR(RC10)), ISNUMBER(RC10))), 1, 0) -> 0 | M376: =INDEX(Gross!R1C1:R46C51, RC1, 26) -> #REF! | N376: =INDEX(Gross!R1C1:R46C51, RC1, 27) -> #REF!
A377: 414 | B377: =INDEX(2001Grossed!R1C1:R46C51, RC[-1], 26) -> #REF! | C377: =INDEX(2001Grossed!R1C1:R46C51, RC1, 27) -> #REF! | D377: =IF(Menus!R9C10, RC[-1]/RC[-2], RC[-1]) -> #REF! | E377: =IF(RC11=1, RC[-3], NA()) -> #NA | F377: =INDEX(2001Grossed!R1C1:R46C51, RC1, 1) -> #REF! | G377: =IF(EQUAL(INDEX(2001Grossed!R1C1:R46C51, RC1, 2), R1C), RC4, NA()) -> #REF! | H377: =IF(EQUAL(INDEX(2001Grossed!R1C1:R46C51, RC1, 2), R1C), RC4, NA()) -> #REF! | I377: =IF(EQUAL(INDEX(2001Grossed!R1C1:R46C51, RC1, 2), R1C), RC4, NA()) -> #REF! | J377: =IF(EQUAL(INDEX(2001Grossed!R1C1:R46C51, RC1, 2), R1C), RC4, NA()) -> #REF! | K377: =IF(OR(AND(NOT(ISERROR(RC7)), ISNUMBER(RC7)), AND(NOT(ISERROR(RC8)), ISNUMBER(RC8)), AND(NOT(ISERROR(RC9)), ISNUMBER(RC9)), AND(NOT(ISERROR(RC10)), ISNUMBER(RC10))), 1, 0) -> 0 | M377: =INDEX(Gross!R1C1:R46C51, RC1, 26) -> #REF! | N377: =INDEX(Gross!R1C1:R46C51, RC1, 27) -> #REF!
A378: 415 | B378: =INDEX(2001Grossed!R1C1:R46C51, RC[-1], 26) -> #REF! | C378: =INDEX(2001Grossed!R1C1:R46C51, RC1, 27) -> #REF! | D378: =IF(Menus!R9C10, RC[-1]/RC[-2], RC[-1]) -> #REF! | E378: =IF(RC11=1, RC[-3], NA()) -> #NA | F378: =INDEX(2001Grossed!R1C1:R46C51, RC1, 1) -> #REF! | G378: =IF(EQUAL(INDEX(2001Grossed!R1C1:R46C51, RC1, 2), R1C), RC4, NA()) -> #REF! | H378: =IF(EQUAL(INDEX(2001Grossed!R1C1:R46C51, RC1, 2), R1C), RC4, NA()) -> #REF! | I378: =IF(EQUAL(INDEX(2001Grossed!R1C1:R46C51, RC1, 2), R1C), RC4, NA()) -> #REF! | J378: =IF(EQUAL(INDEX(2001Grossed!R1C1:R46C51, RC1, 2), R1C), RC4, NA()) -> #REF! | K378: =IF(OR(AND(NOT(ISERROR(RC7)), ISNUMBER(RC7)), AND(NOT(ISERROR(RC8)), ISNUMBER(RC8)), AND(NOT(ISERROR(RC9)), ISNUMBER(RC9)), AND(NOT(ISERROR(RC10)), ISNUMBER(RC10))), 1, 0) -> 0 | M378: =INDEX(Gross!R1C1:R46C51, RC1, 26) -> #REF! | N378: =INDEX(Gross!R1C1:R46C51, RC1, 27) -> #REF!
A379: 416 | B379: =INDEX(2001Grossed!R1C1:R46C51, RC[-1], 26) -> #REF! | C379: =INDEX(2001Grossed!R1C1:R46C51, RC1, 27) -> #REF! | D379: =IF(Menus!R9C10, RC[-1]/RC[-2], RC[-1]) -> #REF! | E379: =IF(RC11=1, RC[-3], NA()) -> #NA | F379: =INDEX(2001Grossed!R1C1:R46C51, RC1, 1) -> #REF! | G379: =IF(EQUAL(INDEX(2001Grossed!R1C1:R46C51, RC1, 2), R1C), RC4, NA()) -> #REF! | H379: =IF(EQUAL(INDEX(2001Grossed!R1C1:R46C51, RC1, 2), R1C), RC4, NA()) -> #REF! | I379: =IF(EQUAL(INDEX(2001Grossed!R1C1:R46C51, RC1, 2), R1C), RC4, NA()) -> #REF! | J379: =IF(EQUAL(INDEX(2001Grossed!R1C1:R46C51, RC1, 2), R1C), RC4, NA()) -> #REF! | K379: =IF(OR(AND(NOT(ISERROR(RC7)), ISNUMBER(RC7)), AND(NOT(ISERROR(RC8)), ISNUMBER(RC8)), AND(NOT(ISERROR(RC9)), ISNUMBER(RC9)), AND(NOT(ISERROR(RC10)), ISNUMBER(RC10))), 1, 0) -> 0 | M379: =INDEX(Gross!R1C1:R46C51, RC1, 26) -> #REF! | N379: =INDEX(Gross!R1C1:R46C51, RC1, 27) -> #REF!
A380: 417 | B380: =INDEX(2001Grossed!R1C1:R46C51, RC[-1], 26) -> #REF! | C380: =INDEX(2001Grossed!R1C1:R46C51, RC1, 27) -> #REF! | D380: =IF(Menus!R9C10, RC[-1]/RC[-2], RC[-1]) -> #REF! | E380: =IF(RC11=1, RC[-3], NA()) -> #NA | F380: =INDEX(2001Grossed!R1C1:R46C51, RC1, 1) -> #REF! | G380: =IF(EQUAL(INDEX(2001Grossed!R1C1:R46C51, RC1, 2), R1C), RC4, NA()) -> #REF! | H380: =IF(EQUAL(INDEX(2001Grossed!R1C1:R46C51, RC1, 2), R1C), RC4, NA()) -> #REF! | I380: =IF(EQUAL(INDEX(2001Grossed!R1C1:R46C51, RC1, 2), R1C), RC4, NA()) -> #REF! | J380: =IF(EQUAL(INDEX(2001Grossed!R1C1:R46C51, RC1, 2), R1C), RC4, NA()) -> #REF! | K380: =IF(OR(AND(NOT(ISERROR(RC7)), ISNUMBER(RC7)), AND(NOT(ISERROR(RC8)), ISNUMBER(RC8)), AND(NOT(ISERROR(RC9)), ISNUMBER(RC9)), AND(NOT(ISERROR(RC10)), ISNUMBER(RC10))), 1, 0) -> 0 | M380: =INDEX(Gross!R1C1:R46C51, RC1, 26) -> #REF! | N380: =INDEX(Gross!R1C1:R46C51, RC1, 27) -> #REF!
A381: 418 | B381: =INDEX(2001Grossed!R1C1:R46C51, RC[-1], 26) -> #REF! | C381: =INDEX(2001Grossed!R1C1:R46C51, RC1, 27) -> #REF! | D381: =IF(Menus!R9C10, RC[-1]/RC[-2], RC[-1]) -> #REF! | E381: =IF(RC11=1, RC[-3], NA()) -> #NA | F381: =INDEX(2001Grossed!R1C1:R46C51, RC1, 1) -> #REF! | G381: =IF(EQUAL(INDEX(2001Grossed!R1C1:R46C51, RC1, 2), R1C), RC4, NA()) -> #REF! | H381: =IF(EQUAL(INDEX(2001Grossed!R1C1:R46C51, RC1, 2), R1C), RC4, NA()) -> #REF! | I381: =IF(EQUAL(INDEX(2001Grossed!R1C1:R46C51, RC1, 2), R1C), RC4, NA()) -> #REF! | J381: =IF(EQUAL(INDEX(2001Grossed!R1C1:R46C51, RC1, 2), R1C), RC4, NA()) -> #REF! | K381: =IF(OR(AND(NOT(ISERROR(RC7)), ISNUMBER(RC7)), AND(NOT(ISERROR(RC8)), ISNUMBER(RC8)), AND(NOT(ISERROR(RC9)), ISNUMBER(RC9)), AND(NOT(ISERROR(RC10)), ISNUMBER(RC10))), 1, 0) -> 0 | M381: =INDEX(Gross!R1C1:R46C51, RC1, 26) -> #REF! | N381: =INDEX(Gross!R1C1:R46C51, RC1, 27) -> #REF!
A382: 419 | B382: =INDEX(2001Grossed!R1C1:R46C51, RC[-1], 26) -> #REF! | C382: =INDEX(2001Grossed!R1C1:R46C51, RC1, 27) -> #REF! | D382: =IF(Menus!R9C10, RC[-1]/RC[-2], RC[-1]) -> #REF! | E382: =IF(RC11=1, RC[-3], NA()) -> #NA | F382: =INDEX(2001Grossed!R1C1:R46C51, RC1, 1) -> #REF! | G382: =IF(EQUAL(INDEX(2001Grossed!R1C1:R46C51, RC1, 2), R1C), RC4, NA()) -> #REF! | H382: =IF(EQUAL(INDEX(2001Grossed!R1C1:R46C51, RC1, 2), R1C), RC4, NA()) -> #REF! | I382: =IF(EQUAL(INDEX(2001Grossed!R1C1:R46C51, RC1, 2), R1C), RC4, NA()) -> #REF! | J382: =IF(EQUAL(INDEX(2001Grossed!R1C1:R46C51, RC1, 2), R1C), RC4, NA()) -> #REF! | K382: =IF(OR(AND(NOT(ISERROR(RC7)), ISNUMBER(RC7)), AND(NOT(ISERROR(RC8)), ISNUMBER(RC8)), AND(NOT(ISERROR(RC9)), ISNUMBER(RC9)), AND(NOT(ISERROR(RC10)), ISNUMBER(RC10))), 1, 0) -> 0 | M382: =INDEX(Gross!R1C1:R46C51, RC1, 26) -> #REF! | N382: =INDEX(Gross!R1C1:R46C51, RC1, 27) -> #REF!
A383: 420 | B383: =INDEX(2001Grossed!R1C1:R46C51, RC[-1], 26) -> #REF! | C383: =INDEX(2001Grossed!R1C1:R46C51, RC1, 27) -> #REF! | D383: =IF(Menus!R9C10, RC[-1]/RC[-2], RC[-1]) -> #REF! | E383: =IF(RC11=1, RC[-3], NA()) -> #NA | F383: =INDEX(2001Grossed!R1C1:R46C51, RC1, 1) -> #REF! | G383: =IF(EQUAL(INDEX(2001Grossed!R1C1:R46C51, RC1, 2), R1C), RC4, NA()) -> #REF! | H383: =IF(EQUAL(INDEX(2001Grossed!R1C1:R46C51, RC1, 2), R1C), RC4, NA()) -> #REF! | I383: =IF(EQUAL(INDEX(2001Grossed!R1C1:R46C51, RC1, 2), R1C), RC4, NA()) -> #REF! | J383: =IF(EQUAL(INDEX(2001Grossed!R1C1:R46C51, RC1, 2), R1C), RC4, NA()) -> #REF! | K383: =IF(OR(AND(NOT(ISERROR(RC7)), ISNUMBER(RC7)), AND(NOT(ISERROR(RC8)), ISNUMBER(RC8)), AND(NOT(ISERROR(RC9)), ISNUMBER(RC9)), AND(NOT(ISERROR(RC10)), ISNUMBER(RC10))), 1, 0) -> 0 | M383: =INDEX(Gross!R1C1:R46C51, RC1, 26) -> #REF! | N383: =INDEX(Gross!R1C1:R46C51, RC1, 27) -> #REF!
A384: 421 | B384: =INDEX(2001Grossed!R1C1:R46C51, RC[-1], 26) -> #REF! | C384: =INDEX(2001Grossed!R1C1:R46C51, RC1, 27) -> #REF! | D384: =IF(Menus!R9C10, RC[-1]/RC[-2], RC[-1]) -> #REF! | E384: =IF(RC11=1, RC[-3], NA()) -> #NA | F384: =INDEX(2001Grossed!R1C1:R46C51, RC1, 1) -> #REF! | G384: =IF(EQUAL(INDEX(2001Grossed!R1C1:R46C51, RC1, 2), R1C), RC4, NA()) -> #REF! | H384: =IF(EQUAL(INDEX(2001Grossed!R1C1:R46C51, RC1, 2), R1C), RC4, NA()) -> #REF! | I384: =IF(EQUAL(INDEX(2001Grossed!R1C1:R46C51, RC1, 2), R1C), RC4, NA()) -> #REF! | J384: =IF(EQUAL(INDEX(2001Grossed!R1C1:R46C51, RC1, 2), R1C), RC4, NA()) -> #REF! | K384: =IF(OR(AND(NOT(ISERROR(RC7)), ISNUMBER(RC7)), AND(NOT(ISERROR(RC8)), ISNUMBER(RC8)), AND(NOT(ISERROR(RC9)), ISNUMBER(RC9)), AND(NOT(ISERROR(RC10)), ISNUMBER(RC10))), 1, 0) -> 0 | M384: =INDEX(Gross!R1C1:R46C51, RC1, 26) -> #REF! | N384: =INDEX(Gross!R1C1:R46C51, RC1, 27) -> #REF!
A385: 422 | B385: =INDEX(2001Grossed!R1C1:R46C51, RC[-1], 26) -> #REF! | C385: =INDEX(2001Grossed!R1C1:R46C51, RC1, 27) -> #REF! | D385: =IF(Menus!R9C10, RC[-1]/RC[-2], RC[-1]) -> #REF! | E385: =IF(RC11=1, RC[-3], NA()) -> #NA | F385: =INDEX(2001Grossed!R1C1:R46C51, RC1, 1) -> #REF! | G385: =IF(EQUAL(INDEX(2001Grossed!R1C1:R46C51, RC1, 2), R1C), RC4, NA()) -> #REF! | H385: =IF(EQUAL(INDEX(2001Grossed!R1C1:R46C51, RC1, 2), R1C), RC4, NA()) -> #REF! | I385: =IF(EQUAL(INDEX(2001Grossed!R1C1:R46C51, RC1, 2), R1C), RC4, NA()) -> #REF! | J385: =IF(EQUAL(INDEX(2001Grossed!R1C1:R46C51, RC1, 2), R1C), RC4, NA()) -> #REF! | K385: =IF(OR(AND(NOT(ISERROR(RC7)), ISNUMBER(RC7)), AND(NOT(ISERROR(RC8)), ISNUMBER(RC8)), AND(NOT(ISERROR(RC9)), ISNUMBER(RC9)), AND(NOT(ISERROR(RC10)), ISNUMBER(RC10))), 1, 0) -> 0 | M385: =INDEX(Gross!R1C1:R46C51, RC1, 26) -> #REF! | N385: =INDEX(Gross!R1C1:R46C51, RC1, 27) -> #REF!
A386: 423 | B386: =INDEX(2001Grossed!R1C1:R46C51, RC[-1], 26) -> #REF! | C386: =INDEX(2001Grossed!R1C1:R46C51, RC1, 27) -> #REF! | D386: =IF(Menus!R9C10, RC[-1]/RC[-2], RC[-1]) -> #REF! | E386: =IF(RC11=1, RC[-3], NA()) -> #NA | F386: =INDEX(2001Grossed!R1C1:R46C51, RC1, 1) -> #REF! | G386: =IF(EQUAL(INDEX(2001Grossed!R1C1:R46C51, RC1, 2), R1C), RC4, NA()) -> #REF! | H386: =IF(EQUAL(INDEX(2001Grossed!R1C1:R46C51, RC1, 2), R1C), RC4, NA()) -> #REF! | I386: =IF(EQUAL(INDEX(2001Grossed!R1C1:R46C51, RC1, 2), R1C), RC4, NA()) -> #REF! | J386: =IF(EQUAL(INDEX(2001Grossed!R1C1:R46C51, RC1, 2), R1C), RC4, NA()) -> #REF! | K386: =IF(OR(AND(NOT(ISERROR(RC7)), ISNUMBER(RC7)), AND(NOT(ISERROR(RC8)), ISNUMBER(RC8)), AND(NOT(ISERROR(RC9)), ISNUMBER(RC9)), AND(NOT(ISERROR(RC10)), ISNUMBER(RC10))), 1, 0) -> 0 | M386: =INDEX(Gross!R1C1:R46C51, RC1, 26) -> #REF! | N386: =INDEX(Gross!R1C1:R46C51, RC1, 27) -> #REF!
A387: 424 | B387: =INDEX(2001Grossed!R1C1:R46C51, RC[-1], 26) -> #REF! | C387: =INDEX(2001Grossed!R1C1:R46C51, RC1, 27) -> #REF! | D387: =IF(Menus!R9C10, RC[-1]/RC[-2], RC[-1]) -> #REF! | E387: =IF(RC11=1, RC[-3], NA()) -> #NA | F387: =INDEX(2001Grossed!R1C1:R46C51, RC1, 1) -> #REF! | G387: =IF(EQUAL(INDEX(2001Grossed!R1C1:R46C51, RC1, 2), R1C), RC4, NA()) -> #REF! | H387: =IF(EQUAL(INDEX(2001Grossed!R1C1:R46C51, RC1, 2), R1C), RC4, NA()) -> #REF! | I387: =IF(EQUAL(INDEX(2001Grossed!R1C1:R46C51, RC1, 2), R1C), RC4, NA()) -> #REF! | J387: =IF(EQUAL(INDEX(2001Grossed!R1C1:R46C51, RC1, 2), R1C), RC4, NA()) -> #REF! | K387: =IF(OR(AND(NOT(ISERROR(RC7)), ISNUMBER(RC7)), AND(NOT(ISERROR(RC8)), ISNUMBER(RC8)), AND(NOT(ISERROR(RC9)), ISNUMBER(RC9)), AND(NOT(ISERROR(RC10)), ISNUMBER(RC10))), 1, 0) -> 0 | M387: =INDEX(Gross!R1C1:R46C51, RC1, 26) -> #REF! | N387: =INDEX(Gross!R1C1:R46C51, RC1, 27) -> #REF!
A388: 425 | B388: =INDEX(2001Grossed!R1C1:R46C51, RC[-1], 26) -> #REF! | C388: =INDEX(2001Grossed!R1C1:R46C51, RC1, 27) -> #REF! | D388: =IF(Menus!R9C10, RC[-1]/RC[-2], RC[-1]) -> #REF! | E388: =IF(RC11=1, RC[-3], NA()) -> #NA | F388: =INDEX(2001Grossed!R1C1:R46C51, RC1, 1) -> #REF! | G388: =IF(EQUAL(INDEX(2001Grossed!R1C1:R46C51, RC1, 2), R1C), RC4, NA()) -> #REF! | H388: =IF(EQUAL(INDEX(2001Grossed!R1C1:R46C51, RC1, 2), R1C), RC4, NA()) -> #REF! | I388: =IF(EQUAL(INDEX(2001Grossed!R1C1:R46C51, RC1, 2), R1C), RC4, NA()) -> #REF! | J388: =IF(EQUAL(INDEX(2001Grossed!R1C1:R46C51, RC1, 2), R1C), RC4, NA()) -> #REF! | K388: =IF(OR(AND(NOT(ISERROR(RC7)), ISNUMBER(RC7)), AND(NOT(ISERROR(RC8)), ISNUMBER(RC8)), AND(NOT(ISERROR(RC9)), ISNUMBER(RC9)), AND(NOT(ISERROR(RC10)), ISNUMBER(RC10))), 1, 0) -> 0 | M388: =INDEX(Gross!R1C1:R46C51, RC1, 26) -> #REF! | N388: =INDEX(Gross!R1C1:R46C51, RC1, 27) -> #REF!
A389: 426 | B389: =INDEX(2001Grossed!R1C1:R46C51, RC[-1], 26) -> #REF! | C389: =INDEX(2001Grossed!R1C1:R46C51, RC1, 27) -> #REF! | D389: =IF(Menus!R9C10, RC[-1]/RC[-2], RC[-1]) -> #REF! | E389: =IF(RC11=1, RC[-3], NA()) -> #NA | F389: =INDEX(2001Grossed!R1C1:R46C51, RC1, 1) -> #REF! | G389: =IF(EQUAL(INDEX(2001Grossed!R1C1:R46C51, RC1, 2), R1C), RC4, NA()) -> #REF! | H389: =IF(EQUAL(INDEX(2001Grossed!R1C1:R46C51, RC1, 2), R1C), RC4, NA()) -> #REF! | I389: =IF(EQUAL(INDEX(2001Grossed!R1C1:R46C51, RC1, 2), R1C), RC4, NA()) -> #REF! | J389: =IF(EQUAL(INDEX(2001Grossed!R1C1:R46C51, RC1, 2), R1C), RC4, NA()) -> #REF! | K389: =IF(OR(AND(NOT(ISERROR(RC7)), ISNUMBER(RC7)), AND(NOT(ISERROR(RC8)), ISNUMBER(RC8)), AND(NOT(ISERROR(RC9)), ISNUMBER(RC9)), AND(NOT(ISERROR(RC10)), ISNUMBER(RC10))), 1, 0) -> 0 | M389: =INDEX(Gross!R1C1:R46C51, RC1, 26) -> #REF! | N389: =INDEX(Gross!R1C1:R46C51, RC1, 27) -> #REF!
A390: 427 | B390: =INDEX(2001Grossed!R1C1:R46C51, RC[-1], 26) -> #REF! | C390: =INDEX(2001Grossed!R1C1:R46C51, RC1, 27) -> #REF! | D390: =IF(Menus!R9C10, RC[-1]/RC[-2], RC[-1]) -> #REF! | E390: =IF(RC11=1, RC[-3], NA()) -> #NA | F390: =INDEX(2001Grossed!R1C1:R46C51, RC1, 1) -> #REF! | G390: =IF(EQUAL(INDEX(2001Grossed!R1C1:R46C51, RC1, 2), R1C), RC4, NA()) -> #REF! | H390: =IF(EQUAL(INDEX(2001Grossed!R1C1:R46C51, RC1, 2), R1C), RC4, NA()) -> #REF! | I390: =IF(EQUAL(INDEX(2001Grossed!R1C1:R46C51, RC1, 2), R1C), RC4, NA()) -> #REF! | J390: =IF(EQUAL(INDEX(2001Grossed!R1C1:R46C51, RC1, 2), R1C), RC4, NA()) -> #REF! | K390: =IF(OR(AND(NOT(ISERROR(RC7)), ISNUMBER(RC7)), AND(NOT(ISERROR(RC8)), ISNUMBER(RC8)), AND(NOT(ISERROR(RC9)), ISNUMBER(RC9)), AND(NOT(ISERROR(RC10)), ISNUMBER(RC10))), 1, 0) -> 0 | M390: =INDEX(Gross!R1C1:R46C51, RC1, 26) -> #REF! | N390: =INDEX(Gross!R1C1:R46C51, RC1, 27) -> #REF!
A391: 428 | B391: =INDEX(2001Grossed!R1C1:R46C51, RC[-1], 26) -> #REF! | C391: =INDEX(2001Grossed!R1C1:R46C51, RC1, 27) -> #REF! | D391: =IF(Menus!R9C10, RC[-1]/RC[-2], RC[-1]) -> #REF! | E391: =IF(RC11=1, RC[-3], NA()) -> #NA | F391: =INDEX(2001Grossed!R1C1:R46C51, RC1, 1) -> #REF! | G391: =IF(EQUAL(INDEX(2001Grossed!R1C1:R46C51, RC1, 2), R1C), RC4, NA()) -> #REF! | H391: =IF(EQUAL(INDEX(2001Grossed!R1C1:R46C51, RC1, 2), R1C), RC4, NA()) -> #REF! | I391: =IF(EQUAL(INDEX(2001Grossed!R1C1:R46C51, RC1, 2), R1C), RC4, NA()) -> #REF! | J391: =IF(EQUAL(INDEX(2001Grossed!R1C1:R46C51, RC1, 2), R1C), RC4, NA()) -> #REF! | K391: =IF(OR(AND(NOT(ISERROR(RC7)), ISNUMBER(RC7)), AND(NOT(ISERROR(RC8)), ISNUMBER(RC8)), AND(NOT(ISERROR(RC9)), ISNUMBER(RC9)), AND(NOT(ISERROR(RC10)), ISNUMBER(RC10))), 1, 0) -> 0 | M391: =INDEX(Gross!R1C1:R46C51, RC1, 26) -> #REF! | N391: =INDEX(Gross!R1C1:R46C51, RC1, 27) -> #REF!
A392: 429 | B392: =INDEX(2001Grossed!R1C1:R46C51, RC[-1], 26) -> #REF! | C392: =INDEX(2001Grossed!R1C1:R46C51, RC1, 27) -> #REF! | D392: =IF(Menus!R9C10, RC[-1]/RC[-2], RC[-1]) -> #REF! | E392: =IF(RC11=1, RC[-3], NA()) -> #NA | F392: =INDEX(2001Grossed!R1C1:R46C51, RC1, 1) -> #REF! | G392: =IF(EQUAL(INDEX(2001Grossed!R1C1:R46C51, RC1, 2), R1C), RC4, NA()) -> #REF! | H392: =IF(EQUAL(INDEX(2001Grossed!R1C1:R46C51, RC1, 2), R1C), RC4, NA()) -> #REF! | I392: =IF(EQUAL(INDEX(2001Grossed!R1C1:R46C51, RC1, 2), R1C), RC4, NA()) -> #REF! | J392: =IF(EQUAL(INDEX(2001Grossed!R1C1:R46C51, RC1, 2), R1C), RC4, NA()) -> #REF! | K392: =IF(OR(AND(NOT(ISERROR(RC7)), ISNUMBER(RC7)), AND(NOT(ISERROR(RC8)), ISNUMBER(RC8)), AND(NOT(ISERROR(RC9)), ISNUMBER(RC9)), AND(NOT(ISERROR(RC10)), ISNUMBER(RC10))), 1, 0) -> 0 | M392: =INDEX(Gross!R1C1:R46C51, RC1, 26) -> #REF! | N392: =INDEX(Gross!R1C1:R46C51, RC1, 27) -> #REF!
A393: 430 | B393: =INDEX(2001Grossed!R1C1:R46C51, RC[-1], 26) -> #REF! | C393: =INDEX(2001Grossed!R1C1:R46C51, RC1, 27) -> #REF! | D393: =IF(Menus!R9C10, RC[-1]/RC[-2], RC[-1]) -> #REF! | E393: =IF(RC11=1, RC[-3], NA()) -> #NA | F393: =INDEX(2001Grossed!R1C1:R46C51, RC1, 1) -> #REF! | G393: =IF(EQUAL(INDEX(2001Grossed!R1C1:R46C51, RC1, 2), R1C), RC4, NA()) -> #REF! | H393: =IF(EQUAL(INDEX(2001Grossed!R1C1:R46C51, RC1, 2), R1C), RC4, NA()) -> #REF! | I393: =IF(EQUAL(INDEX(2001Grossed!R1C1:R46C51, RC1, 2), R1C), RC4, NA()) -> #REF! | J393: =IF(EQUAL(INDEX(2001Grossed!R1C1:R46C51, RC1, 2), R1C), RC4, NA()) -> #REF! | K393: =IF(OR(AND(NOT(ISERROR(RC7)), ISNUMBER(RC7)), AND(NOT(ISERROR(RC8)), ISNUMBER(RC8)), AND(NOT(ISERROR(RC9)), ISNUMBER(RC9)), AND(NOT(ISERROR(RC10)), ISNUMBER(RC10))), 1, 0) -> 0 | M393: =INDEX(Gross!R1C1:R46C51, RC1, 26) -> #REF! | N393: =INDEX(Gross!R1C1:R46C51, RC1, 27) -> #REF!
A394: 431 | B394: =INDEX(2001Grossed!R1C1:R46C51, RC[-1], 26) -> #REF! | C394: =INDEX(2001Grossed!R1C1:R46C51, RC1, 27) -> #REF! | D394: =IF(Menus!R9C10, RC[-1]/RC[-2], RC[-1]) -> #REF! | E394: =IF(RC11=1, RC[-3], NA()) -> #NA | F394: =INDEX(2001Grossed!R1C1:R46C51, RC1, 1) -> #REF! | G394: =IF(EQUAL(INDEX(2001Grossed!R1C1:R46C51, RC1, 2), R1C), RC4, NA()) -> #REF! | H394: =IF(EQUAL(INDEX(2001Grossed!R1C1:R46C51, RC1, 2), R1C), RC4, NA()) -> #REF! | I394: =IF(EQUAL(INDEX(2001Grossed!R1C1:R46C51, RC1, 2), R1C), RC4, NA()) -> #REF! | J394: =IF(EQUAL(INDEX(2001Grossed!R1C1:R46C51, RC1, 2), R1C), RC4, NA()) -> #REF! | K394: =IF(OR(AND(NOT(ISERROR(RC7)), ISNUMBER(RC7)), AND(NOT(ISERROR(RC8)), ISNUMBER(RC8)), AND(NOT(ISERROR(RC9)), ISNUMBER(RC9)), AND(NOT(ISERROR(RC10)), ISNUMBER(RC10))), 1, 0) -> 0 | M394: =INDEX(Gross!R1C1:R46C51, RC1, 26) -> #REF! | N394: =INDEX(Gross!R1C1:R46C51, RC1, 27) -> #REF!
A395: 432 | B395: =INDEX(2001Grossed!R1C1:R46C51, RC[-1], 26) -> #REF! | C395: =INDEX(2001Grossed!R1C1:R46C51, RC1, 27) -> #REF! | D395: =IF(Menus!R9C10, RC[-1]/RC[-2], RC[-1]) -> #REF! | E395: =IF(RC11=1, RC[-3], NA()) -> #NA | F395: =INDEX(2001Grossed!R1C1:R46C51, RC1, 1) -> #REF! | G395: =IF(EQUAL(INDEX(2001Grossed!R1C1:R46C51, RC1, 2), R1C), RC4, NA()) -> #REF! | H395: =IF(EQUAL(INDEX(2001Grossed!R1C1:R46C51, RC1, 2), R1C), RC4, NA()) -> #REF! | I395: =IF(EQUAL(INDEX(2001Grossed!R1C1:R46C51, RC1, 2), R1C), RC4, NA()) -> #REF! | J395: =IF(EQUAL(INDEX(2001Grossed!R1C1:R46C51, RC1, 2), R1C), RC4, NA()) -> #REF! | K395: =IF(OR(AND(NOT(ISERROR(RC7)), ISNUMBER(RC7)), AND(NOT(ISERROR(RC8)), ISNUMBER(RC8)), AND(NOT(ISERROR(RC9)), ISNUMBER(RC9)), AND(NOT(ISERROR(RC10)), ISNUMBER(RC10))), 1, 0) -> 0 | M395: =INDEX(Gross!R1C1:R46C51, RC1, 26) -> #REF! | N395: =INDEX(Gross!R1C1:R46C51, RC1, 27) -> #REF!
A396: 433 | B396: =INDEX(2001Grossed!R1C1:R46C51, RC[-1], 26) -> #REF! | C396: =INDEX(2001Grossed!R1C1:R46C51, RC1, 27) -> #REF! | D396: =IF(Menus!R9C10, RC[-1]/RC[-2], RC[-1]) -> #REF! | E396: =IF(RC11=1, RC[-3], NA()) -> #NA | F396: =INDEX(2001Grossed!R1C1:R46C51, RC1, 1) -> #REF! | G396: =IF(EQUAL(INDEX(2001Grossed!R1C1:R46C51, RC1, 2), R1C), RC4, NA()) -> #REF! | H396: =IF(EQUAL(INDEX(2001Grossed!R1C1:R46C51, RC1, 2), R1C), RC4, NA()) -> #REF! | I396: =IF(EQUAL(INDEX(2001Grossed!R1C1:R46C51, RC1, 2), R1C), RC4, NA()) -> #REF! | J396: =IF(EQUAL(INDEX(2001Grossed!R1C1:R46C51, RC1, 2), R1C), RC4, NA()) -> #REF! | K396: =IF(OR(AND(NOT(ISERROR(RC7)), ISNUMBER(RC7)), AND(NOT(ISERROR(RC8)), ISNUMBER(RC8)), AND(NOT(ISERROR(RC9)), ISNUMBER(RC9)), AND(NOT(ISERROR(RC10)), ISNUMBER(RC10))), 1, 0) -> 0 | M396: =INDEX(Gross!R1C1:R46C51, RC1, 26) -> #REF! | N396: =INDEX(Gross!R1C1:R46C51, RC1, 27) -> #REF!
A397: 434 | B397: =INDEX(2001Grossed!R1C1:R46C51, RC[-1], 26) -> #REF! | C397: =INDEX(2001Grossed!R1C1:R46C51, RC1, 27) -> #REF! | D397: =IF(Menus!R9C10, RC[-1]/RC[-2], RC[-1]) -> #REF! | E397: =IF(RC11=1, RC[-3], NA()) -> #NA | F397: =INDEX(2001Grossed!R1C1:R46C51, RC1, 1) -> #REF! | G397: =IF(EQUAL(INDEX(2001Grossed!R1C1:R46C51, RC1, 2), R1C), RC4, NA()) -> #REF! | H397: =IF(EQUAL(INDEX(2001Grossed!R1C1:R46C51, RC1, 2), R1C), RC4, NA()) -> #REF! | I397: =IF(EQUAL(INDEX(2001Grossed!R1C1:R46C51, RC1, 2), R1C), RC4, NA()) -> #REF! | J397: =IF(EQUAL(INDEX(2001Grossed!R1C1:R46C51, RC1, 2), R1C), RC4, NA()) -> #REF! | K397: =IF(OR(AND(NOT(ISERROR(RC7)), ISNUMBER(RC7)), AND(NOT(ISERROR(RC8)), ISNUMBER(RC8)), AND(NOT(ISERROR(RC9)), ISNUMBER(RC9)), AND(NOT(ISERROR(RC10)), ISNUMBER(RC10))), 1, 0) -> 0 | M397: =INDEX(Gross!R1C1:R46C51, RC1, 26) -> #REF! | N397: =INDEX(Gross!R1C1:R46C51, RC1, 27) -> #REF!
A398: 435 | B398: =INDEX(2001Grossed!R1C1:R46C51, RC[-1], 26) -> #REF! | C398: =INDEX(2001Grossed!R1C1:R46C51, RC1, 27) -> #REF! | D398: =IF(Menus!R9C10, RC[-1]/RC[-2], RC[-1]) -> #REF! | E398: =IF(RC11=1, RC[-3], NA()) -> #NA | F398: =INDEX(2001Grossed!R1C1:R46C51, RC1, 1) -> #REF! | G398: =IF(EQUAL(INDEX(2001Grossed!R1C1:R46C51, RC1, 2), R1C), RC4, NA()) -> #REF! | H398: =IF(EQUAL(INDEX(2001Grossed!R1C1:R46C51, RC1, 2), R1C), RC4, NA()) -> #REF! | I398: =IF(EQUAL(INDEX(2001Grossed!R1C1:R46C51, RC1, 2), R1C), RC4, NA()) -> #REF! | J398: =IF(EQUAL(INDEX(2001Grossed!R1C1:R46C51, RC1, 2), R1C), RC4, NA()) -> #REF! | K398: =IF(OR(AND(NOT(ISERROR(RC7)), ISNUMBER(RC7)), AND(NOT(ISERROR(RC8)), ISNUMBER(RC8)), AND(NOT(ISERROR(RC9)), ISNUMBER(RC9)), AND(NOT(ISERROR(RC10)), ISNUMBER(RC10))), 1, 0) -> 0 | M398: =INDEX(Gross!R1C1:R46C51, RC1, 26) -> #REF! | N398: =INDEX(Gross!R1C1:R46C51, RC1, 27) -> #REF!
A399: 436 | B399: =INDEX(2001Grossed!R1C1:R46C51, RC[-1], 26) -> #REF! | C399: =INDEX(2001Grossed!R1C1:R46C51, RC1, 27) -> #REF! | D399: =IF(Menus!R9C10, RC[-1]/RC[-2], RC[-1]) -> #REF! | E399: =IF(RC11=1, RC[-3], NA()) -> #NA | F399: =INDEX(2001Grossed!R1C1:R46C51, RC1, 1) -> #REF! | G399: =IF(EQUAL(INDEX(2001Grossed!R1C1:R46C51, RC1, 2), R1C), RC4, NA()) -> #REF! | H399: =IF(EQUAL(INDEX(2001Grossed!R1C1:R46C51, RC1, 2), R1C), RC4, NA()) -> #REF! | I399: =IF(EQUAL(INDEX(2001Grossed!R1C1:R46C51, RC1, 2), R1C), RC4, NA()) -> #REF! | J399: =IF(EQUAL(INDEX(2001Grossed!R1C1:R46C51, RC1, 2), R1C), RC4, NA()) -> #REF! | K399: =IF(OR(AND(NOT(ISERROR(RC7)), ISNUMBER(RC7)), AND(NOT(ISERROR(RC8)), ISNUMBER(RC8)), AND(NOT(ISERROR(RC9)), ISNUMBER(RC9)), AND(NOT(ISERROR(RC10)), ISNUMBER(RC10))), 1, 0) -> 0 | M399: =INDEX(Gross!R1C1:R46C51, RC1, 26) -> #REF! | N399: =INDEX(Gross!R1C1:R46C51, RC1, 27) -> #REF!
A400: 437 | B400: =INDEX(2001Grossed!R1C1:R46C51, RC[-1], 26) -> #REF! | C400: =INDEX(2001Grossed!R1C1:R46C51, RC1, 27) -> #REF! | D400: =IF(Menus!R9C10, RC[-1]/RC[-2], RC[-1]) -> #REF! | E400: =IF(RC11=1, RC[-3], NA()) -> #NA | F400: =INDEX(2001Grossed!R1C1:R46C51, RC1, 1) -> #REF! | G400: =IF(EQUAL(INDEX(2001Grossed!R1C1:R46C51, RC1, 2), R1C), RC4, NA()) -> #REF! | H400: =IF(EQUAL(INDEX(2001Grossed!R1C1:R46C51, RC1, 2), R1C), RC4, NA()) -> #REF! | I400: =IF(EQUAL(INDEX(2001Grossed!R1C1:R46C51, RC1, 2), R1C), RC4, NA()) -> #REF! | J400: =IF(EQUAL(INDEX(2001Grossed!R1C1:R46C51, RC1, 2), R1C), RC4, NA()) -> #REF! | K400: =IF(OR(AND(NOT(ISERROR(RC7)), ISNUMBER(RC7)), AND(NOT(ISERROR(RC8)), ISNUMBER(RC8)), AND(NOT(ISERROR(RC9)), ISNUMBER(RC9)), AND(NOT(ISERROR(RC10)), ISNUMBER(RC10))), 1, 0) -> 0 | M400: =INDEX(Gross!R1C1:R46C51, RC1, 26) -> #REF! | N400: =INDEX(Gross!R1C1:R46C51, RC1, 27) -> #REF!
A401: 438 | B401: =INDEX(2001Grossed!R1C1:R46C51, RC[-1], 26) -> #REF! | C401: =INDEX(2001Grossed!R1C1:R46C51, RC1, 27) -> #REF! | D401: =IF(Menus!R9C10, RC[-1]/RC[-2], RC[-1]) -> #REF! | E401: =IF(RC11=1, RC[-3], NA()) -> #NA | F401: =INDEX(2001Grossed!R1C1:R46C51, RC1, 1) -> #REF! | G401: =IF(EQUAL(INDEX(2001Grossed!R1C1:R46C51, RC1, 2), R1C), RC4, NA()) -> #REF! | H401: =IF(EQUAL(INDEX(2001Grossed!R1C1:R46C51, RC1, 2), R1C), RC4, NA()) -> #REF! | I401: =IF(EQUAL(INDEX(2001Grossed!R1C1:R46C51, RC1, 2), R1C), RC4, NA()) -> #REF! | J401: =IF(EQUAL(INDEX(2001Grossed!R1C1:R46C51, RC1, 2), R1C), RC4, NA()) -> #REF! | K401: =IF(OR(AND(NOT(ISERROR(RC7)), ISNUMBER(RC7)), AND(NOT(ISERROR(RC8)), ISNUMBER(RC8)), AND(NOT(ISERROR(RC9)), ISNUMBER(RC9)), AND(NOT(ISERROR(RC10)), ISNUMBER(RC10))), 1, 0) -> 0 | M401: =INDEX(Gross!R1C1:R46C51, RC1, 26) -> #REF! | N401: =INDEX(Gross!R1C1:R46C51, RC1, 27) -> #REF!
A402: 439 | B402: =INDEX(2001Grossed!R1C1:R46C51, RC[-1], 26) -> #REF! | C402: =INDEX(2001Grossed!R1C1:R46C51, RC1, 27) -> #REF! | D402: =IF(Menus!R9C10, RC[-1]/RC[-2], RC[-1]) -> #REF! | E402: =IF(RC11=1, RC[-3], NA()) -> #NA | F402: =INDEX(2001Grossed!R1C1:R46C51, RC1, 1) -> #REF! | G402: =IF(EQUAL(INDEX(2001Grossed!R1C1:R46C51, RC1, 2), R1C), RC4, NA()) -> #REF! | H402: =IF(EQUAL(INDEX(2001Grossed!R1C1:R46C51, RC1, 2), R1C), RC4, NA()) -> #REF! | I402: =IF(EQUAL(INDEX(2001Grossed!R1C1:R46C51, RC1, 2), R1C), RC4, NA()) -> #REF! | J402: =IF(EQUAL(INDEX(2001Grossed!R1C1:R46C51, RC1, 2), R1C), RC4, NA()) -> #REF! | K402: =IF(OR(AND(NOT(ISERROR(RC7)), ISNUMBER(RC7)), AND(NOT(ISERROR(RC8)), ISNUMBER(RC8)), AND(NOT(ISERROR(RC9)), ISNUMBER(RC9)), AND(NOT(ISERROR(RC10)), ISNUMBER(RC10))), 1, 0) -> 0 | M402: =INDEX(Gross!R1C1:R46C51, RC1, 26) -> #REF! | N402: =INDEX(Gross!R1C1:R46C51, RC1, 27) -> #REF!
A403: 440 | B403: =INDEX(2001Grossed!R1C1:R46C51, RC[-1], 26) -> #REF! | C403: =INDEX(2001Grossed!R1C1:R46C51, RC1, 27) -> #REF! | D403: =IF(Menus!R9C10, RC[-1]/RC[-2], RC[-1]) -> #REF! | E403: =IF(RC11=1, RC[-3], NA()) -> #NA | F403: =INDEX(2001Grossed!R1C1:R46C51, RC1, 1) -> #REF! | G403: =IF(EQUAL(INDEX(2001Grossed!R1C1:R46C51, RC1, 2), R1C), RC4, NA()) -> #REF! | H403: =IF(EQUAL(INDEX(2001Grossed!R1C1:R46C51, RC1, 2), R1C), RC4, NA()) -> #REF! | I403: =IF(EQUAL(INDEX(2001Grossed!R1C1:R46C51, RC1, 2), R1C), RC4, NA()) -> #REF! | J403: =IF(EQUAL(INDEX(2001Grossed!R1C1:R46C51, RC1, 2), R1C), RC4, NA()) -> #REF! | K403: =IF(OR(AND(NOT(ISERROR(RC7)), ISNUMBER(RC7)), AND(NOT(ISERROR(RC8)), ISNUMBER(RC8)), AND(NOT(ISERROR(RC9)), ISNUMBER(RC9)), AND(NOT(ISERROR(RC10)), ISNUMBER(RC10))), 1, 0) -> 0 | M403: =INDEX(Gross!R1C1:R46C51, RC1, 26) -> #REF! | N403: =INDEX(Gross!R1C1:R46C51, RC1, 27) -> #REF!
A404: 441 | B404: =INDEX(2001Grossed!R1C1:R46C51, RC[-1], 26) -> #REF! | C404: =INDEX(2001Grossed!R1C1:R46C51, RC1, 27) -> #REF! | D404: =IF(Menus!R9C10, RC[-1]/RC[-2], RC[-1]) -> #REF! | E404: =IF(RC11=1, RC[-3], NA()) -> #NA | F404: =INDEX(2001Grossed!R1C1:R46C51, RC1, 1) -> #REF! | G404: =IF(EQUAL(INDEX(2001Grossed!R1C1:R46C51, RC1, 2), R1C), RC4, NA()) -> #REF! | H404: =IF(EQUAL(INDEX(2001Grossed!R1C1:R46C51, RC1, 2), R1C), RC4, NA()) -> #REF! | I404: =IF(EQUAL(INDEX(2001Grossed!R1C1:R46C51, RC1, 2), R1C), RC4, NA()) -> #REF! | J404: =IF(EQUAL(INDEX(2001Grossed!R1C1:R46C51, RC1, 2), R1C), RC4, NA()) -> #REF! | K404: =IF(OR(AND(NOT(ISERROR(RC7)), ISNUMBER(RC7)), AND(NOT(ISERROR(RC8)), ISNUMBER(RC8)), AND(NOT(ISERROR(RC9)), ISNUMBER(RC9)), AND(NOT(ISERROR(RC10)), ISNUMBER(RC10))), 1, 0) -> 0 | M404: =INDEX(Gross!R1C1:R46C51, RC1, 26) -> #REF! | N404: =INDEX(Gross!R1C1:R46C51, RC1, 27) -> #REF!
A405: 442 | B405: =INDEX(2001Grossed!R1C1:R46C51, RC[-1], 26) -> #REF! | C405: =INDEX(2001Grossed!R1C1:R46C51, RC1, 27) -> #REF! | D405: =IF(Menus!R9C10, RC[-1]/RC[-2], RC[-1]) -> #REF! | E405: =IF(RC11=1, RC[-3], NA()) -> #NA | F405: =INDEX(2001Grossed!R1C1:R46C51, RC1, 1) -> #REF! | G405: =IF(EQUAL(INDEX(2001Grossed!R1C1:R46C51, RC1, 2), R1C), RC4, NA()) -> #REF! | H405: =IF(EQUAL(INDEX(2001Grossed!R1C1:R46C51, RC1, 2), R1C), RC4, NA()) -> #REF! | I405: =IF(EQUAL(INDEX(2001Grossed!R1C1:R46C51, RC1, 2), R1C), RC4, NA()) -> #REF! | J405: =IF(EQUAL(INDEX(2001Grossed!R1C1:R46C51, RC1, 2), R1C), RC4, NA()) -> #REF! | K405: =IF(OR(AND(NOT(ISERROR(RC7)), ISNUMBER(RC7)), AND(NOT(ISERROR(RC8)), ISNUMBER(RC8)), AND(NOT(ISERROR(RC9)), ISNUMBER(RC9)), AND(NOT(ISERROR(RC10)), ISNUMBER(RC10))), 1, 0) -> 0 | M405: =INDEX(Gross!R1C1:R46C51, RC1, 26) -> #REF! | N405: =INDEX(Gross!R1C1:R46C51, RC1, 27) -> #REF!
A406: 443 | B406: =INDEX(2001Grossed!R1C1:R46C51, RC[-1], 26) -> #REF! | C406: =INDEX(2001Grossed!R1C1:R46C51, RC1, 27) -> #REF! | D406: =IF(Menus!R9C10, RC[-1]/RC[-2], RC[-1]) -> #REF! | E406: =IF(RC11=1, RC[-3], NA()) -> #NA | F406: =INDEX(2001Grossed!R1C1:R46C51, RC1, 1) -> #REF! | G406: =IF(EQUAL(INDEX(2001Grossed!R1C1:R46C51, RC1, 2), R1C), RC4, NA()) -> #REF! | H406: =IF(EQUAL(INDEX(2001Grossed!R1C1:R46C51, RC1, 2), R1C), RC4, NA()) -> #REF! | I406: =IF(EQUAL(INDEX(2001Grossed!R1C1:R46C51, RC1, 2), R1C), RC4, NA()) -> #REF! | J406: =IF(EQUAL(INDEX(2001Grossed!R1C1:R46C51, RC1, 2), R1C), RC4, NA()) -> #REF! | K406: =IF(OR(AND(NOT(ISERROR(RC7)), ISNUMBER(RC7)), AND(NOT(ISERROR(RC8)), ISNUMBER(RC8)), AND(NOT(ISERROR(RC9)), ISNUMBER(RC9)), AND(NOT(ISERROR(RC10)), ISNUMBER(RC10))), 1, 0) -> 0 | M406: =INDEX(Gross!R1C1:R46C51, RC1, 26) -> #REF! | N406: =INDEX(Gross!R1C1:R46C51, RC1, 27) -> #REF!
A407: 444 | B407: =INDEX(2001Grossed!R1C1:R46C51, RC[-1], 26) -> #REF! | C407: =INDEX(2001Grossed!R1C1:R46C51, RC1, 27) -> #REF! | D407: =IF(Menus!R9C10, RC[-1]/RC[-2], RC[-1]) -> #REF! | E407: =IF(RC11=1, RC[-3], NA()) -> #NA | F407: =INDEX(2001Grossed!R1C1:R46C51, RC1, 1) -> #REF! | G407: =IF(EQUAL(INDEX(2001Grossed!R1C1:R46C51, RC1, 2), R1C), RC4, NA()) -> #REF! | H407: =IF(EQUAL(INDEX(2001Grossed!R1C1:R46C51, RC1, 2), R1C), RC4, NA()) -> #REF! | I407: =IF(EQUAL(INDEX(2001Grossed!R1C1:R46C51, RC1, 2), R1C), RC4, NA()) -> #REF! | J407: =IF(EQUAL(INDEX(2001Grossed!R1C1:R46C51, RC1, 2), R1C), RC4, NA()) -> #REF! | K407: =IF(OR(AND(NOT(ISERROR(RC7)), ISNUMBER(RC7)), AND(NOT(ISERROR(RC8)), ISNUMBER(RC8)), AND(NOT(ISERROR(RC9)), ISNUMBER(RC9)), AND(NOT(ISERROR(RC10)), ISNUMBER(RC10))), 1, 0) -> 0 | M407: =INDEX(Gross!R1C1:R46C51, RC1, 26) -> #REF! | N407: =INDEX(Gross!R1C1:R46C51, RC1, 27) -> #REF!
A408: 445 | B408: =INDEX(2001Grossed!R1C1:R46C51, RC[-1], 26) -> #REF! | C408: =INDEX(2001Grossed!R1C1:R46C51, RC1, 27) -> #REF! | D408: =IF(Menus!R9C10, RC[-1]/RC[-2], RC[-1]) -> #REF! | E408: =IF(RC11=1, RC[-3], NA()) -> #NA | F408: =INDEX(2001Grossed!R1C1:R46C51, RC1, 1) -> #REF! | G408: =IF(EQUAL(INDEX(2001Grossed!R1C1:R46C51, RC1, 2), R1C), RC4, NA()) -> #REF! | H408: =IF(EQUAL(INDEX(2001Grossed!R1C1:R46C51, RC1, 2), R1C), RC4, NA()) -> #REF! | I408: =IF(EQUAL(INDEX(2001Grossed!R1C1:R46C51, RC1, 2), R1C), RC4, NA()) -> #REF! | J408: =IF(EQUAL(INDEX(2001Grossed!R1C1:R46C51, RC1, 2), R1C), RC4, NA()) -> #REF! | K408: =IF(OR(AND(NOT(ISERROR(RC7)), ISNUMBER(RC7)), AND(NOT(ISERROR(RC8)), ISNUMBER(RC8)), AND(NOT(ISERROR(RC9)), ISNUMBER(RC9)), AND(NOT(ISERROR(RC10)), ISNUMBER(RC10))), 1, 0) -> 0 | M408: =INDEX(Gross!R1C1:R46C51, RC1, 26) -> #REF! | N408: =INDEX(Gross!R1C1:R46C51, RC1, 27) -> #REF!
A409: 446 | B409: =INDEX(2001Grossed!R1C1:R46C51, RC[-1], 26) -> #REF! | C409: =INDEX(2001Grossed!R1C1:R46C51, RC1, 27) -> #REF! | D409: =IF(Menus!R9C10, RC[-1]/RC[-2], RC[-1]) -> #REF! | E409: =IF(RC11=1, RC[-3], NA()) -> #NA | F409: =INDEX(2001Grossed!R1C1:R46C51, RC1, 1) -> #REF! | G409: =IF(EQUAL(INDEX(2001Grossed!R1C1:R46C51, RC1, 2), R1C), RC4, NA()) -> #REF! | H409: =IF(EQUAL(INDEX(2001Grossed!R1C1:R46C51, RC1, 2), R1C), RC4, NA()) -> #REF! | I409: =IF(EQUAL(INDEX(2001Grossed!R1C1:R46C51, RC1, 2), R1C), RC4, NA()) -> #REF! | J409: =IF(EQUAL(INDEX(2001Grossed!R1C1:R46C51, RC1, 2), R1C), RC4, NA()) -> #REF! | K409: =IF(OR(AND(NOT(ISERROR(RC7)), ISNUMBER(RC7)), AND(NOT(ISERROR(RC8)), ISNUMBER(RC8)), AND(NOT(ISERROR(RC9)), ISNUMBER(RC9)), AND(NOT(ISERROR(RC10)), ISNUMBER(RC10))), 1, 0) -> 0 | M409: =INDEX(Gross!R1C1:R46C51, RC1, 26) -> #REF! | N409: =INDEX(Gross!R1C1:R46C51, RC1, 27) -> #REF!
A410: 447 | B410: =INDEX(2001Grossed!R1C1:R46C51, RC[-1], 26) -> #REF! | C410: =INDEX(2001Grossed!R1C1:R46C51, RC1, 27) -> #REF! | D410: =IF(Menus!R9C10, RC[-1]/RC[-2], RC[-1]) -> #REF! | E410: =IF(RC11=1, RC[-3], NA()) -> #NA | F410: =INDEX(2001Grossed!R1C1:R46C51, RC1, 1) -> #REF! | G410: =IF(EQUAL(INDEX(2001Grossed!R1C1:R46C51, RC1, 2), R1C), RC4, NA()) -> #REF! | H410: =IF(EQUAL(INDEX(2001Grossed!R1C1:R46C51, RC1, 2), R1C), RC4, NA()) -> #REF! | I410: =IF(EQUAL(INDEX(2001Grossed!R1C1:R46C51, RC1, 2), R1C), RC4, NA()) -> #REF! | J410: =IF(EQUAL(INDEX(2001Grossed!R1C1:R46C51, RC1, 2), R1C), RC4, NA()) -> #REF! | K410: =IF(OR(AND(NOT(ISERROR(RC7)), ISNUMBER(RC7)), AND(NOT(ISERROR(RC8)), ISNUMBER(RC8)), AND(NOT(ISERROR(RC9)), ISNUMBER(RC9)), AND(NOT(ISERROR(RC10)), ISNUMBER(RC10))), 1, 0) -> 0 | M410: =INDEX(Gross!R1C1:R46C51, RC1, 26) -> #REF! | N410: =INDEX(Gross!R1C1:R46C51, RC1, 27) -> #REF!
A411: 448 | B411: =INDEX(2001Grossed!R1C1:R46C51, RC[-1], 26) -> #REF! | C411: =INDEX(2001Grossed!R1C1:R46C51, RC1, 27) -> #REF! | D411: =IF(Menus!R9C10, RC[-1]/RC[-2], RC[-1]) -> #REF! | E411: =IF(RC11=1, RC[-3], NA()) -> #NA | F411: =INDEX(2001Grossed!R1C1:R46C51, RC1, 1) -> #REF! | G411: =IF(EQUAL(INDEX(2001Grossed!R1C1:R46C51, RC1, 2), R1C), RC4, NA()) -> #REF! | H411: =IF(EQUAL(INDEX(2001Grossed!R1C1:R46C51, RC1, 2), R1C), RC4, NA()) -> #REF! | I411: =IF(EQUAL(INDEX(2001Grossed!R1C1:R46C51, RC1, 2), R1C), RC4, NA()) -> #REF! | J411: =IF(EQUAL(INDEX(2001Grossed!R1C1:R46C51, RC1, 2), R1C), RC4, NA()) -> #REF! | K411: =IF(OR(AND(NOT(ISERROR(RC7)), ISNUMBER(RC7)), AND(NOT(ISERROR(RC8)), ISNUMBER(RC8)), AND(NOT(ISERROR(RC9)), ISNUMBER(RC9)), AND(NOT(ISERROR(RC10)), ISNUMBER(RC10))), 1, 0) -> 0 | M411: =INDEX(Gross!R1C1:R46C51, RC1, 26) -> #REF! | N411: =INDEX(Gross!R1C1:R46C51, RC1, 27) -> #REF!
A412: 449 | B412: =INDEX(2001Grossed!R1C1:R46C51, RC[-1], 26) -> #REF! | C412: =INDEX(2001Grossed!R1C1:R46C51, RC1, 27) -> #REF! | D412: =IF(Menus!R9C10, RC[-1]/RC[-2], RC[-1]) -> #REF! | E412: =IF(RC11=1, RC[-3], NA()) -> #NA | F412: =INDEX(2001Grossed!R1C1:R46C51, RC1, 1) -> #REF! | G412: =IF(EQUAL(INDEX(2001Grossed!R1C1:R46C51, RC1, 2), R1C), RC4, NA()) -> #REF! | H412: =IF(EQUAL(INDEX(2001Grossed!R1C1:R46C51, RC1, 2), R1C), RC4, NA()) -> #REF! | I412: =IF(EQUAL(INDEX(2001Grossed!R1C1:R46C51, RC1, 2), R1C), RC4, NA()) -> #REF! | J412: =IF(EQUAL(INDEX(2001Grossed!R1C1:R46C51, RC1, 2), R1C), RC4, NA()) -> #REF! | K412: =IF(OR(AND(NOT(ISERROR(RC7)), ISNUMBER(RC7)), AND(NOT(ISERROR(RC8)), ISNUMBER(RC8)), AND(NOT(ISERROR(RC9)), ISNUMBER(RC9)), AND(NOT(ISERROR(RC10)), ISNUMBER(RC10))), 1, 0) -> 0 | M412: =INDEX(Gross!R1C1:R46C51, RC1, 26) -> #REF! | N412: =INDEX(Gross!R1C1:R46C51, RC1, 27) -> #REF!
A413: 450 | B413: =INDEX(2001Grossed!R1C1:R46C51, RC[-1], 26) -> #REF! | C413: =INDEX(2001Grossed!R1C1:R46C51, RC1, 27) -> #REF! | D413: =IF(Menus!R9C10, RC[-1]/RC[-2], RC[-1]) -> #REF! | E413: =IF(RC11=1, RC[-3], NA()) -> #NA | F413: =INDEX(2001Grossed!R1C1:R46C51, RC1, 1) -> #REF! | G413: =IF(EQUAL(INDEX(2001Grossed!R1C1:R46C51, RC1, 2), R1C), RC4, NA()) -> #REF! | H413: =IF(EQUAL(INDEX(2001Grossed!R1C1:R46C51, RC1, 2), R1C), RC4, NA()) -> #REF! | I413: =IF(EQUAL(INDEX(2001Grossed!R1C1:R46C51, RC1, 2), R1C), RC4, NA()) -> #REF! | J413: =IF(EQUAL(INDEX(2001Grossed!R1C1:R46C51, RC1, 2), R1C), RC4, NA()) -> #REF! | K413: =IF(OR(AND(NOT(ISERROR(RC7)), ISNUMBER(RC7)), AND(NOT(ISERROR(RC8)), ISNUMBER(RC8)), AND(NOT(ISERROR(RC9)), ISNUMBER(RC9)), AND(NOT(ISERROR(RC10)), ISNUMBER(RC10))), 1, 0) -> 0 | M413: =INDEX(Gross!R1C1:R46C51, RC1, 26) -> #REF! | N413: =INDEX(Gross!R1C1:R46C51, RC1, 27) -> #REF!
A414: 451 | B414: =INDEX(2001Grossed!R1C1:R46C51, RC[-1], 26) -> #REF! | C414: =INDEX(2001Grossed!R1C1:R46C51, RC1, 27) -> #REF! | D414: =IF(Menus!R9C10, RC[-1]/RC[-2], RC[-1]) -> #REF! | E414: =IF(RC11=1, RC[-3], NA()) -> #NA | F414: =INDEX(2001Grossed!R1C1:R46C51, RC1, 1) -> #REF! | G414: =IF(EQUAL(INDEX(2001Grossed!R1C1:R46C51, RC1, 2), R1C), RC4, NA()) -> #REF! | H414: =IF(EQUAL(INDEX(2001Grossed!R1C1:R46C51, RC1, 2), R1C), RC4, NA()) -> #REF! | I414: =IF(EQUAL(INDEX(2001Grossed!R1C1:R46C51, RC1, 2), R1C), RC4, NA()) -> #REF! | J414: =IF(EQUAL(INDEX(2001Grossed!R1C1:R46C51, RC1, 2), R1C), RC4, NA()) -> #REF! | K414: =IF(OR(AND(NOT(ISERROR(RC7)), ISNUMBER(RC7)), AND(NOT(ISERROR(RC8)), ISNUMBER(RC8)), AND(NOT(ISERROR(RC9)), ISNUMBER(RC9)), AND(NOT(ISERROR(RC10)), ISNUMBER(RC10))), 1, 0) -> 0 | M414: =INDEX(Gross!R1C1:R46C51, RC1, 26) -> #REF! | N414: =INDEX(Gross!R1C1:R46C51, RC1, 27) -> #REF!
A415: 452 | B415: =INDEX(2001Grossed!R1C1:R46C51, RC[-1], 26) -> #REF! | C415: =INDEX(2001Grossed!R1C1:R46C51, RC1, 27) -> #REF! | D415: =IF(Menus!R9C10, RC[-1]/RC[-2], RC[-1]) -> #REF! | E415: =IF(RC11=1, RC[-3], NA()) -> #NA | F415: =INDEX(2001Grossed!R1C1:R46C51, RC1, 1) -> #REF! | G415: =IF(EQUAL(INDEX(2001Grossed!R1C1:R46C51, RC1, 2), R1C), RC4, NA()) -> #REF! | H415: =IF(EQUAL(INDEX(2001Grossed!R1C1:R46C51, RC1, 2), R1C), RC4, NA()) -> #REF! | I415: =IF(EQUAL(INDEX(2001Grossed!R1C1:R46C51, RC1, 2), R1C), RC4, NA()) -> #REF! | J415: =IF(EQUAL(INDEX(2001Grossed!R1C1:R46C51, RC1, 2), R1C), RC4, NA()) -> #REF! | K415: =IF(OR(AND(NOT(ISERROR(RC7)), ISNUMBER(RC7)), AND(NOT(ISERROR(RC8)), ISNUMBER(RC8)), AND(NOT(ISERROR(RC9)), ISNUMBER(RC9)), AND(NOT(ISERROR(RC10)), ISNUMBER(RC10))), 1, 0) -> 0 | M415: =INDEX(Gross!R1C1:R46C51, RC1, 26) -> #REF! | N415: =INDEX(Gross!R1C1:R46C51, RC1, 27) -> #REF!
A416: 453 | B416: =INDEX(2001Grossed!R1C1:R46C51, RC[-1], 26) -> #REF! | C416: =INDEX(2001Grossed!R1C1:R46C51, RC1, 27) -> #REF! | D416: =IF(Menus!R9C10, RC[-1]/RC[-2], RC[-1]) -> #REF! | E416: =IF(RC11=1, RC[-3], NA()) -> #NA | F416: =INDEX(2001Grossed!R1C1:R46C51, RC1, 1) -> #REF! | G416: =IF(EQUAL(INDEX(2001Grossed!R1C1:R46C51, RC1, 2), R1C), RC4, NA()) -> #REF! | H416: =IF(EQUAL(INDEX(2001Grossed!R1C1:R46C51, RC1, 2), R1C), RC4, NA()) -> #REF! | I416: =IF(EQUAL(INDEX(2001Grossed!R1C1:R46C51, RC1, 2), R1C), RC4, NA()) -> #REF! | J416: =IF(EQUAL(INDEX(2001Grossed!R1C1:R46C51, RC1, 2), R1C), RC4, NA()) -> #REF! | K416: =IF(OR(AND(NOT(ISERROR(RC7)), ISNUMBER(RC7)), AND(NOT(ISERROR(RC8)), ISNUMBER(RC8)), AND(NOT(ISERROR(RC9)), ISNUMBER(RC9)), AND(NOT(ISERROR(RC10)), ISNUMBER(RC10))), 1, 0) -> 0 | M416: =INDEX(Gross!R1C1:R46C51, RC1, 26) -> #REF! | N416: =INDEX(Gross!R1C1:R46C51, RC1, 27) -> #REF!
A417: 454 | B417: =INDEX(2001Grossed!R1C1:R46C51, RC[-1], 26) -> #REF! | C417: =INDEX(2001Grossed!R1C1:R46C51, RC1, 27) -> #REF! | D417: =IF(Menus!R9C10, RC[-1]/RC[-2], RC[-1]) -> #REF! | E417: =IF(RC11=1, RC[-3], NA()) -> #NA | F417: =INDEX(2001Grossed!R1C1:R46C51, RC1, 1) -> #REF! | G417: =IF(EQUAL(INDEX(2001Grossed!R1C1:R46C51, RC1, 2), R1C), RC4, NA()) -> #REF! | H417: =IF(EQUAL(INDEX(2001Grossed!R1C1:R46C51, RC1, 2), R1C), RC4, NA()) -> #REF! | I417: =IF(EQUAL(INDEX(2001Grossed!R1C1:R46C51, RC1, 2), R1C), RC4, NA()) -> #REF! | J417: =IF(EQUAL(INDEX(2001Grossed!R1C1:R46C51, RC1, 2), R1C), RC4, NA()) -> #REF! | K417: =IF(OR(AND(NOT(ISERROR(RC7)), ISNUMBER(RC7)), AND(NOT(ISERROR(RC8)), ISNUMBER(RC8)), AND(NOT(ISERROR(RC9)), ISNUMBER(RC9)), AND(NOT(ISERROR(RC10)), ISNUMBER(RC10))), 1, 0) -> 0 | M417: =INDEX(Gross!R1C1:R46C51, RC1, 26) -> #REF! | N417: =INDEX(Gross!R1C1:R46C51, RC1, 27) -> #REF!
A418: 455 | B418: =INDEX(2001Grossed!R1C1:R46C51, RC[-1], 26) -> #REF! | C418: =INDEX(2001Grossed!R1C1:R46C51, RC1, 27) -> #REF! | D418: =IF(Menus!R9C10, RC[-1]/RC[-2], RC[-1]) -> #REF! | E418: =IF(RC11=1, RC[-3], NA()) -> #NA | F418: =INDEX(2001Grossed!R1C1:R46C51, RC1, 1) -> #REF! | G418: =IF(EQUAL(INDEX(2001Grossed!R1C1:R46C51, RC1, 2), R1C), RC4, NA()) -> #REF! | H418: =IF(EQUAL(INDEX(2001Grossed!R1C1:R46C51, RC1, 2), R1C), RC4, NA()) -> #REF! | I418: =IF(EQUAL(INDEX(2001Grossed!R1C1:R46C51, RC1, 2), R1C), RC4, NA()) -> #REF! | J418: =IF(EQUAL(INDEX(2001Grossed!R1C1:R46C51, RC1, 2), R1C), RC4, NA()) -> #REF! | K418: =IF(OR(AND(NOT(ISERROR(RC7)), ISNUMBER(RC7)), AND(NOT(ISERROR(RC8)), ISNUMBER(RC8)), AND(NOT(ISERROR(RC9)), ISNUMBER(RC9)), AND(NOT(ISERROR(RC10)), ISNUMBER(RC10))), 1, 0) -> 0 | M418: =INDEX(Gross!R1C1:R46C51, RC1, 26) -> #REF! | N418: =INDEX(Gross!R1C1:R46C51, RC1, 27) -> #REF!
A419: 456 | B419: =INDEX(2001Grossed!R1C1:R46C51, RC[-1], 26) -> #REF! | C419: =INDEX(2001Grossed!R1C1:R46C51, RC1, 27) -> #REF! | D419: =IF(Menus!R9C10, RC[-1]/RC[-2], RC[-1]) -> #REF! | E419: =IF(RC11=1, RC[-3], NA()) -> #NA | F419: =INDEX(2001Grossed!R1C1:R46C51, RC1, 1) -> #REF! | G419: =IF(EQUAL(INDEX(2001Grossed!R1C1:R46C51, RC1, 2), R1C), RC4, NA()) -> #REF! | H419: =IF(EQUAL(INDEX(2001Grossed!R1C1:R46C51, RC1, 2), R1C), RC4, NA()) -> #REF! | I419: =IF(EQUAL(INDEX(2001Grossed!R1C1:R46C51, RC1, 2), R1C), RC4, NA()) -> #REF! | J419: =IF(EQUAL(INDEX(2001Grossed!R1C1:R46C51, RC1, 2), R1C), RC4, NA()) -> #REF! | K419: =IF(OR(AND(NOT(ISERROR(RC7)), ISNUMBER(RC7)), AND(NOT(ISERROR(RC8)), ISNUMBER(RC8)), AND(NOT(ISERROR(RC9)), ISNUMBER(RC9)), AND(NOT(ISERROR(RC10)), ISNUMBER(RC10))), 1, 0) -> 0 | M419: =INDEX(Gross!R1C1:R46C51, RC1, 26) -> #REF! | N419: =INDEX(Gross!R1C1:R46C51, RC1, 27) -> #REF!
A420: 457 | B420: =INDEX(2001Grossed!R1C1:R46C51, RC[-1], 26) -> #REF! | C420: =INDEX(2001Grossed!R1C1:R46C51, RC1, 27) -> #REF! | D420: =IF(Menus!R9C10, RC[-1]/RC[-2], RC[-1]) -> #REF! | E420: =IF(RC11=1, RC[-3], NA()) -> #NA | F420: =INDEX(2001Grossed!R1C1:R46C51, RC1, 1) -> #REF! | G420: =IF(EQUAL(INDEX(2001Grossed!R1C1:R46C51, RC1, 2), R1C), RC4, NA()) -> #REF! | H420: =IF(EQUAL(INDEX(2001Grossed!R1C1:R46C51, RC1, 2), R1C), RC4, NA()) -> #REF! | I420: =IF(EQUAL(INDEX(2001Grossed!R1C1:R46C51, RC1, 2), R1C), RC4, NA()) -> #REF! | J420: =IF(EQUAL(INDEX(2001Grossed!R1C1:R46C51, RC1, 2), R1C), RC4, NA()) -> #REF! | K420: =IF(OR(AND(NOT(ISERROR(RC7)), ISNUMBER(RC7)), AND(NOT(ISERROR(RC8)), ISNUMBER(RC8)), AND(NOT(ISERROR(RC9)), ISNUMBER(RC9)), AND(NOT(ISERROR(RC10)), ISNUMBER(RC10))), 1, 0) -> 0 | M420: =INDEX(Gross!R1C1:R46C51, RC1, 26) -> #REF! | N420: =INDEX(Gross!R1C1:R46C51, RC1, 27) -> #REF!
A421: 458 | B421: =INDEX(2001Grossed!R1C1:R46C51, RC[-1], 26) -> #REF! | C421: =INDEX(2001Grossed!R1C1:R46C51, RC1, 27) -> #REF! | D421: =IF(Menus!R9C10, RC[-1]/RC[-2], RC[-1]) -> #REF! | E421: =IF(RC11=1, RC[-3], NA()) -> #NA | F421: =INDEX(2001Grossed!R1C1:R46C51, RC1, 1) -> #REF! | G421: =IF(EQUAL(INDEX(2001Grossed!R1C1:R46C51, RC1, 2), R1C), RC4, NA()) -> #REF! | H421: =IF(EQUAL(INDEX(2001Grossed!R1C1:R46C51, RC1, 2), R1C), RC4, NA()) -> #REF! | I421: =IF(EQUAL(INDEX(2001Grossed!R1C1:R46C51, RC1, 2), R1C), RC4, NA()) -> #REF! | J421: =IF(EQUAL(INDEX(2001Grossed!R1C1:R46C51, RC1, 2), R1C), RC4, NA()) -> #REF! | K421: =IF(OR(AND(NOT(ISERROR(RC7)), ISNUMBER(RC7)), AND(NOT(ISERROR(RC8)), ISNUMBER(RC8)), AND(NOT(ISERROR(RC9)), ISNUMBER(RC9)), AND(NOT(ISERROR(RC10)), ISNUMBER(RC10))), 1, 0) -> 0 | M421: =INDEX(Gross!R1C1:R46C51, RC1, 26) -> #REF! | N421: =INDEX(Gross!R1C1:R46C51, RC1, 27) -> #REF!
A422: 459 | B422: =INDEX(2001Grossed!R1C1:R46C51, RC[-1], 26) -> #REF! | C422: =INDEX(2001Grossed!R1C1:R46C51, RC1, 27) -> #REF! | D422: =IF(Menus!R9C10, RC[-1]/RC[-2], RC[-1]) -> #REF! | E422: =IF(RC11=1, RC[-3], NA()) -> #NA | F422: =INDEX(2001Grossed!R1C1:R46C51, RC1, 1) -> #REF! | G422: =IF(EQUAL(INDEX(2001Grossed!R1C1:R46C51, RC1, 2), R1C), RC4, NA()) -> #REF! | H422: =IF(EQUAL(INDEX(2001Grossed!R1C1:R46C51, RC1, 2), R1C), RC4, NA()) -> #REF! | I422: =IF(EQUAL(INDEX(2001Grossed!R1C1:R46C51, RC1, 2), R1C), RC4, NA()) -> #REF! | J422: =IF(EQUAL(INDEX(2001Grossed!R1C1:R46C51, RC1, 2), R1C), RC4, NA()) -> #REF! | K422: =IF(OR(AND(NOT(ISERROR(RC7)), ISNUMBER(RC7)), AND(NOT(ISERROR(RC8)), ISNUMBER(RC8)), AND(NOT(ISERROR(RC9)), ISNUMBER(RC9)), AND(NOT(ISERROR(RC10)), ISNUMBER(RC10))), 1, 0) -> 0 | M422: =INDEX(Gross!R1C1:R46C51, RC1, 26) -> #REF! | N422: =INDEX(Gross!R1C1:R46C51, RC1, 27) -> #REF!
A423: 460 | B423: =INDEX(2001Grossed!R1C1:R46C51, RC[-1], 26) -> #REF! | C423: =INDEX(2001Grossed!R1C1:R46C51, RC1, 27) -> #REF! | D423: =IF(Menus!R9C10, RC[-1]/RC[-2], RC[-1]) -> #REF! | E423: =IF(RC11=1, RC[-3], NA()) -> #NA | F423: =INDEX(2001Grossed!R1C1:R46C51, RC1, 1) -> #REF! | G423: =IF(EQUAL(INDEX(2001Grossed!R1C1:R46C51, RC1, 2), R1C), RC4, NA()) -> #REF! | H423: =IF(EQUAL(INDEX(2001Grossed!R1C1:R46C51, RC1, 2), R1C), RC4, NA()) -> #REF! | I423: =IF(EQUAL(INDEX(2001Grossed!R1C1:R46C51, RC1, 2), R1C), RC4, NA()) -> #REF! | J423: =IF(EQUAL(INDEX(2001Grossed!R1C1:R46C51, RC1, 2), R1C), RC4, NA()) -> #REF! | K423: =IF(OR(AND(NOT(ISERROR(RC7)), ISNUMBER(RC7)), AND(NOT(ISERROR(RC8)), ISNUMBER(RC8)), AND(NOT(ISERROR(RC9)), ISNUMBER(RC9)), AND(NOT(ISERROR(RC10)), ISNUMBER(RC10))), 1, 0) -> 0 | M423: =INDEX(Gross!R1C1:R46C51, RC1, 26) -> #REF! | N423: =INDEX(Gross!R1C1:R46C51, RC1, 27) -> #REF!
A424: 461 | B424: =INDEX(2001Grossed!R1C1:R46C51, RC[-1], 26) -> #REF! | C424: =INDEX(2001Grossed!R1C1:R46C51, RC1, 27) -> #REF! | D424: =IF(Menus!R9C10, RC[-1]/RC[-2], RC[-1]) -> #REF! | E424: =IF(RC11=1, RC[-3], NA()) -> #NA | F424: =INDEX(2001Grossed!R1C1:R46C51, RC1, 1) -> #REF! | G424: =IF(EQUAL(INDEX(2001Grossed!R1C1:R46C51, RC1, 2), R1C), RC4, NA()) -> #REF! | H424: =IF(EQUAL(INDEX(2001Grossed!R1C1:R46C51, RC1, 2), R1C), RC4, NA()) -> #REF! | I424: =IF(EQUAL(INDEX(2001Grossed!R1C1:R46C51, RC1, 2), R1C), RC4, NA()) -> #REF! | J424: =IF(EQUAL(INDEX(2001Grossed!R1C1:R46C51, RC1, 2), R1C), RC4, NA()) -> #REF! | K424: =IF(OR(AND(NOT(ISERROR(RC7)), ISNUMBER(RC7)), AND(NOT(ISERROR(RC8)), ISNUMBER(RC8)), AND(NOT(ISERROR(RC9)), ISNUMBER(RC9)), AND(NOT(ISERROR(RC10)), ISNUMBER(RC10))), 1, 0) -> 0 | M424: =INDEX(Gross!R1C1:R46C51, RC1, 26) -> #REF! | N424: =INDEX(Gross!R1C1:R46C51, RC1, 27) -> #REF!
A425: 462 | B425: =INDEX(2001Grossed!R1C1:R46C51, RC[-1], 26) -> #REF! | C425: =INDEX(2001Grossed!R1C1:R46C51, RC1, 27) -> #REF! | D425: =IF(Menus!R9C10, RC[-1]/RC[-2], RC[-1]) -> #REF! | E425: =IF(RC11=1, RC[-3], NA()) -> #NA | F425: =INDEX(2001Grossed!R1C1:R46C51, RC1, 1) -> #REF! | G425: =IF(EQUAL(INDEX(2001Grossed!R1C1:R46C51, RC1, 2), R1C), RC4, NA()) -> #REF! | H425: =IF(EQUAL(INDEX(2001Grossed!R1C1:R46C51, RC1, 2), R1C), RC4, NA()) -> #REF! | I425: =IF(EQUAL(INDEX(2001Grossed!R1C1:R46C51, RC1, 2), R1C), RC4, NA()) -> #REF! | J425: =IF(EQUAL(INDEX(2001Grossed!R1C1:R46C51, RC1, 2), R1C), RC4, NA()) -> #REF! | K425: =IF(OR(AND(NOT(ISERROR(RC7)), ISNUMBER(RC7)), AND(NOT(ISERROR(RC8)), ISNUMBER(RC8)), AND(NOT(ISERROR(RC9)), ISNUMBER(RC9)), AND(NOT(ISERROR(RC10)), ISNUMBER(RC10))), 1, 0) -> 0 | M425: =INDEX(Gross!R1C1:R46C51, RC1, 26) -> #REF! | N425: =INDEX(Gross!R1C1:R46C51, RC1, 27) -> #REF!
A426: 463 | B426: =INDEX(2001Grossed!R1C1:R46C51, RC[-1], 26) -> #REF! | C426: =INDEX(2001Grossed!R1C1:R46C51, RC1, 27) -> #REF! | D426: =IF(Menus!R9C10, RC[-1]/RC[-2], RC[-1]) -> #REF! | E426: =IF(RC11=1, RC[-3], NA()) -> #NA | F426: =INDEX(2001Grossed!R1C1:R46C51, RC1, 1) -> #REF! | G426: =IF(EQUAL(INDEX(2001Grossed!R1C1:R46C51, RC1, 2), R1C), RC4, NA()) -> #REF! | H426: =IF(EQUAL(INDEX(2001Grossed!R1C1:R46C51, RC1, 2), R1C), RC4, NA()) -> #REF! | I426: =IF(EQUAL(INDEX(2001Grossed!R1C1:R46C51, RC1, 2), R1C), RC4, NA()) -> #REF! | J426: =IF(EQUAL(INDEX(2001Grossed!R1C1:R46C51, RC1, 2), R1C), RC4, NA()) -> #REF! | K426: =IF(OR(AND(NOT(ISERROR(RC7)), ISNUMBER(RC7)), AND(NOT(ISERROR(RC8)), ISNUMBER(RC8)), AND(NOT(ISERROR(RC9)), ISNUMBER(RC9)), AND(NOT(ISERROR(RC10)), ISNUMBER(RC10))), 1, 0) -> 0 | M426: =INDEX(Gross!R1C1:R46C51, RC1, 26) -> #REF! | N426: =INDEX(Gross!R1C1:R46C51, RC1, 27) -> #REF!
A427: 464 | B427: =INDEX(2001Grossed!R1C1:R46C51, RC[-1], 26) -> #REF! | C427: =INDEX(2001Grossed!R1C1:R46C51, RC1, 27) -> #REF! | D427: =IF(Menus!R9C10, RC[-1]/RC[-2], RC[-1]) -> #REF! | E427: =IF(RC11=1, RC[-3], NA()) -> #NA | F427: =INDEX(2001Grossed!R1C1:R46C51, RC1, 1) -> #REF! | G427: =IF(EQUAL(INDEX(2001Grossed!R1C1:R46C51, RC1, 2), R1C), RC4, NA()) -> #REF! | H427: =IF(EQUAL(INDEX(2001Grossed!R1C1:R46C51, RC1, 2), R1C), RC4, NA()) -> #REF! | I427: =IF(EQUAL(INDEX(2001Grossed!R1C1:R46C51, RC1, 2), R1C), RC4, NA()) -> #REF! | J427: =IF(EQUAL(INDEX(2001Grossed!R1C1:R46C51, RC1, 2), R1C), RC4, NA()) -> #REF! | K427: =IF(OR(AND(NOT(ISERROR(RC7)), ISNUMBER(RC7)), AND(NOT(ISERROR(RC8)), ISNUMBER(RC8)), AND(NOT(ISERROR(RC9)), ISNUMBER(RC9)), AND(NOT(ISERROR(RC10)), ISNUMBER(RC10))), 1, 0) -> 0 | M427: =INDEX(Gross!R1C1:R46C51, RC1, 26) -> #REF! | N427: =INDEX(Gross!R1C1:R46C51, RC1, 27) -> #REF!
A428: 465 | B428: =INDEX(2001Grossed!R1C1:R46C51, RC[-1], 26) -> #REF! | C428: =INDEX(2001Grossed!R1C1:R46C51, RC1, 27) -> #REF! | D428: =IF(Menus!R9C10, RC[-1]/RC[-2], RC[-1]) -> #REF! | E428: =IF(RC11=1, RC[-3], NA()) -> #NA | F428: =INDEX(2001Grossed!R1C1:R46C51, RC1, 1) -> #REF! | G428: =IF(EQUAL(INDEX(2001Grossed!R1C1:R46C51, RC1, 2), R1C), RC4, NA()) -> #REF! | H428: =IF(EQUAL(INDEX(2001Grossed!R1C1:R46C51, RC1, 2), R1C), RC4, NA()) -> #REF! | I428: =IF(EQUAL(INDEX(2001Grossed!R1C1:R46C51, RC1, 2), R1C), RC4, NA()) -> #REF! | J428: =IF(EQUAL(INDEX(2001Grossed!R1C1:R46C51, RC1, 2), R1C), RC4, NA()) -> #REF! | K428: =IF(OR(AND(NOT(ISERROR(RC7)), ISNUMBER(RC7)), AND(NOT(ISERROR(RC8)), ISNUMBER(RC8)), AND(NOT(ISERROR(RC9)), ISNUMBER(RC9)), AND(NOT(ISERROR(RC10)), ISNUMBER(RC10))), 1, 0) -> 0 | M428: =INDEX(Gross!R1C1:R46C51, RC1, 26) -> #REF! | N428: =INDEX(Gross!R1C1:R46C51, RC1, 27) -> #REF!
A429: 466 | B429: =INDEX(2001Grossed!R1C1:R46C51, RC[-1], 26) -> #REF! | C429: =INDEX(2001Grossed!R1C1:R46C51, RC1, 27) -> #REF! | D429: =IF(Menus!R9C10, RC[-1]/RC[-2], RC[-1]) -> #REF! | E429: =IF(RC11=1, RC[-3], NA()) -> #NA | F429: =INDEX(2001Grossed!R1C1:R46C51, RC1, 1) -> #REF! | G429: =IF(EQUAL(INDEX(2001Grossed!R1C1:R46C51, RC1, 2), R1C), RC4, NA()) -> #REF! | H429: =IF(EQUAL(INDEX(2001Grossed!R1C1:R46C51, RC1, 2), R1C), RC4, NA()) -> #REF! | I429: =IF(EQUAL(INDEX(2001Grossed!R1C1:R46C51, RC1, 2), R1C), RC4, NA()) -> #REF! | J429: =IF(EQUAL(INDEX(2001Grossed!R1C1:R46C51, RC1, 2), R1C), RC4, NA()) -> #REF! | K429: =IF(OR(AND(NOT(ISERROR(RC7)), ISNUMBER(RC7)), AND(NOT(ISERROR(RC8)), ISNUMBER(RC8)), AND(NOT(ISERROR(RC9)), ISNUMBER(RC9)), AND(NOT(ISERROR(RC10)), ISNUMBER(RC10))), 1, 0) -> 0 | M429: =INDEX(Gross!R1C1:R46C51, RC1, 26) -> #REF! | N429: =INDEX(Gross!R1C1:R46C51, RC1, 27) -> #REF!
A430: 467 | B430: =INDEX(2001Grossed!R1C1:R46C51, RC[-1], 26) -> #REF! | C430: =INDEX(2001Grossed!R1C1:R46C51, RC1, 27) -> #REF! | D430: =IF(Menus!R9C10, RC[-1]/RC[-2], RC[-1]) -> #REF! | E430: =IF(RC11=1, RC[-3], NA()) -> #NA | F430: =INDEX(2001Grossed!R1C1:R46C51, RC1, 1) -> #REF! | G430: =IF(EQUAL(INDEX(2001Grossed!R1C1:R46C51, RC1, 2), R1C), RC4, NA()) -> #REF! | H430: =IF(EQUAL(INDEX(2001Grossed!R1C1:R46C51, RC1, 2), R1C), RC4, NA()) -> #REF! | I430: =IF(EQUAL(INDEX(2001Grossed!R1C1:R46C51, RC1, 2), R1C), RC4, NA()) -> #REF! | J430: =IF(EQUAL(INDEX(2001Grossed!R1C1:R46C51, RC1, 2), R1C), RC4, NA()) -> #REF! | K430: =IF(OR(AND(NOT(ISERROR(RC7)), ISNUMBER(RC7)), AND(NOT(ISERROR(RC8)), ISNUMBER(RC8)), AND(NOT(ISERROR(RC9)), ISNUMBER(RC9)), AND(NOT(ISERROR(RC10)), ISNUMBER(RC10))), 1, 0) -> 0 | M430: =INDEX(Gross!R1C1:R46C51, RC1, 26) -> #REF! | N430: =INDEX(Gross!R1C1:R46C51, RC1, 27) -> #REF!
A431: 468 | B431: =INDEX(2001Grossed!R1C1:R46C51, RC[-1], 26) -> #REF! | C431: =INDEX(2001Grossed!R1C1:R46C51, RC1, 27) -> #REF! | D431: =IF(Menus!R9C10, RC[-1]/RC[-2], RC[-1]) -> #REF! | E431: =IF(RC11=1, RC[-3], NA()) -> #NA | F431: =INDEX(2001Grossed!R1C1:R46C51, RC1, 1) -> #REF! | G431: =IF(EQUAL(INDEX(2001Grossed!R1C1:R46C51, RC1, 2), R1C), RC4, NA()) -> #REF! | H431: =IF(EQUAL(INDEX(2001Grossed!R1C1:R46C51, RC1, 2), R1C), RC4, NA()) -> #REF! | I431: =IF(EQUAL(INDEX(2001Grossed!R1C1:R46C51, RC1, 2), R1C), RC4, NA()) -> #REF! | J431: =IF(EQUAL(INDEX(2001Grossed!R1C1:R46C51, RC1, 2), R1C), RC4, NA()) -> #REF! | K431: =IF(OR(AND(NOT(ISERROR(RC7)), ISNUMBER(RC7)), AND(NOT(ISERROR(RC8)), ISNUMBER(RC8)), AND(NOT(ISERROR(RC9)), ISNUMBER(RC9)), AND(NOT(ISERROR(RC10)), ISNUMBER(RC10))), 1, 0) -> 0 | M431: =INDEX(Gross!R1C1:R46C51, RC1, 26) -> #REF! | N431: =INDEX(Gross!R1C1:R46C51, RC1, 27) -> #REF!
A432: 469 | B432: =INDEX(2001Grossed!R1C1:R46C51, RC[-1], 26) -> #REF! | C432: =INDEX(2001Grossed!R1C1:R46C51, RC1, 27) -> #REF! | D432: =IF(Menus!R9C10, RC[-1]/RC[-2], RC[-1]) -> #REF! | E432: =IF(RC11=1, RC[-3], NA()) -> #NA | F432: =INDEX(2001Grossed!R1C1:R46C51, RC1, 1) -> #REF! | G432: =IF(EQUAL(INDEX(2001Grossed!R1C1:R46C51, RC1, 2), R1C), RC4, NA()) -> #REF! | H432: =IF(EQUAL(INDEX(2001Grossed!R1C1:R46C51, RC1, 2), R1C), RC4, NA()) -> #REF! | I432: =IF(EQUAL(INDEX(2001Grossed!R1C1:R46C51, RC1, 2), R1C), RC4, NA()) -> #REF! | J432: =IF(EQUAL(INDEX(2001Grossed!R1C1:R46C51, RC1, 2), R1C), RC4, NA()) -> #REF! | K432: =IF(OR(AND(NOT(ISERROR(RC7)), ISNUMBER(RC7)), AND(NOT(ISERROR(RC8)), ISNUMBER(RC8)), AND(NOT(ISERROR(RC9)), ISNUMBER(RC9)), AND(NOT(ISERROR(RC10)), ISNUMBER(RC10))), 1, 0) -> 0 | M432: =INDEX(Gross!R1C1:R46C51, RC1, 26) -> #REF! | N432: =INDEX(Gross!R1C1:R46C51, RC1, 27) -> #REF!
A433: 470 | B433: =INDEX(2001Grossed!R1C1:R46C51, RC[-1], 26) -> #REF! | C433: =INDEX(2001Grossed!R1C1:R46C51, RC1, 27) -> #REF! | D433: =IF(Menus!R9C10, RC[-1]/RC[-2], RC[-1]) -> #REF! | E433: =IF(RC11=1, RC[-3], NA()) -> #NA | F433: =INDEX(2001Grossed!R1C1:R46C51, RC1, 1) -> #REF! | G433: =IF(EQUAL(INDEX(2001Grossed!R1C1:R46C51, RC1, 2), R1C), RC4, NA()) -> #REF! | H433: =IF(EQUAL(INDEX(2001Grossed!R1C1:R46C51, RC1, 2), R1C), RC4, NA()) -> #REF! | I433: =IF(EQUAL(INDEX(2001Grossed!R1C1:R46C51, RC1, 2), R1C), RC4, NA()) -> #REF! | J433: =IF(EQUAL(INDEX(2001Grossed!R1C1:R46C51, RC1, 2), R1C), RC4, NA()) -> #REF! | K433: =IF(OR(AND(NOT(ISERROR(RC7)), ISNUMBER(RC7)), AND(NOT(ISERROR(RC8)), ISNUMBER(RC8)), AND(NOT(ISERROR(RC9)), ISNUMBER(RC9)), AND(NOT(ISERROR(RC10)), ISNUMBER(RC10))), 1, 0) -> 0 | M433: =INDEX(Gross!R1C1:R46C51, RC1, 26) -> #REF! | N433: =INDEX(Gross!R1C1:R46C51, RC1, 27) -> #REF!
A434: 471 | B434: =INDEX(2001Grossed!R1C1:R46C51, RC[-1], 26) -> #REF! | C434: =INDEX(2001Grossed!R1C1:R46C51, RC1, 27) -> #REF! | D434: =IF(Menus!R9C10, RC[-1]/RC[-2], RC[-1]) -> #REF! | E434: =IF(RC11=1, RC[-3], NA()) -> #NA | F434: =INDEX(2001Grossed!R1C1:R46C51, RC1, 1) -> #REF! | G434: =IF(EQUAL(INDEX(2001Grossed!R1C1:R46C51, RC1, 2), R1C), RC4, NA()) -> #REF! | H434: =IF(EQUAL(INDEX(2001Grossed!R1C1:R46C51, RC1, 2), R1C), RC4, NA()) -> #REF! | I434: =IF(EQUAL(INDEX(2001Grossed!R1C1:R46C51, RC1, 2), R1C), RC4, NA()) -> #REF! | J434: =IF(EQUAL(INDEX(2001Grossed!R1C1:R46C51, RC1, 2), R1C), RC4, NA()) -> #REF! | K434: =IF(OR(AND(NOT(ISERROR(RC7)), ISNUMBER(RC7)), AND(NOT(ISERROR(RC8)), ISNUMBER(RC8)), AND(NOT(ISERROR(RC9)), ISNUMBER(RC9)), AND(NOT(ISERROR(RC10)), ISNUMBER(RC10))), 1, 0) -> 0 | M434: =INDEX(Gross!R1C1:R46C51, RC1, 26) -> #REF! | N434: =INDEX(Gross!R1C1:R46C51, RC1, 27) -> #REF!
A435: 472 | B435: =INDEX(2001Grossed!R1C1:R46C51, RC[-1], 26) -> #REF! | C435: =INDEX(2001Grossed!R1C1:R46C51, RC1, 27) -> #REF! | D435: =IF(Menus!R9C10, RC[-1]/RC[-2], RC[-1]) -> #REF! | E435: =IF(RC11=1, RC[-3], NA()) -> #NA | F435: =INDEX(2001Grossed!R1C1:R46C51, RC1, 1) -> #REF! | G435: =IF(EQUAL(INDEX(2001Grossed!R1C1:R46C51, RC1, 2), R1C), RC4, NA()) -> #REF! | H435: =IF(EQUAL(INDEX(2001Grossed!R1C1:R46C51, RC1, 2), R1C), RC4, NA()) -> #REF! | I435: =IF(EQUAL(INDEX(2001Grossed!R1C1:R46C51, RC1, 2), R1C), RC4, NA()) -> #REF! | J435: =IF(EQUAL(INDEX(2001Grossed!R1C1:R46C51, RC1, 2), R1C), RC4, NA()) -> #REF! | K435: =IF(OR(AND(NOT(ISERROR(RC7)), ISNUMBER(RC7)), AND(NOT(ISERROR(RC8)), ISNUMBER(RC8)), AND(NOT(ISERROR(RC9)), ISNUMBER(RC9)), AND(NOT(ISERROR(RC10)), ISNUMBER(RC10))), 1, 0) -> 0 | M435: =INDEX(Gross!R1C1:R46C51, RC1, 26) -> #REF! | N435: =INDEX(Gross!R1C1:R46C51, RC1, 27) -> #REF!
A436: 473 | B436: =INDEX(2001Grossed!R1C1:R46C51, RC[-1], 26) -> #REF! | C436: =INDEX(2001Grossed!R1C1:R46C51, RC1, 27) -> #REF! | D436: =IF(Menus!R9C10, RC[-1]/RC[-2], RC[-1]) -> #REF! | E436: =IF(RC11=1, RC[-3], NA()) -> #NA | F436: =INDEX(2001Grossed!R1C1:R46C51, RC1, 1) -> #REF! | G436: =IF(EQUAL(INDEX(2001Grossed!R1C1:R46C51, RC1, 2), R1C), RC4, NA()) -> #REF! | H436: =IF(EQUAL(INDEX(2001Grossed!R1C1:R46C51, RC1, 2), R1C), RC4, NA()) -> #REF! | I436: =IF(EQUAL(INDEX(2001Grossed!R1C1:R46C51, RC1, 2), R1C), RC4, NA()) -> #REF! | J436: =IF(EQUAL(INDEX(2001Grossed!R1C1:R46C51, RC1, 2), R1C), RC4, NA()) -> #REF! | K436: =IF(OR(AND(NOT(ISERROR(RC7)), ISNUMBER(RC7)), AND(NOT(ISERROR(RC8)), ISNUMBER(RC8)), AND(NOT(ISERROR(RC9)), ISNUMBER(RC9)), AND(NOT(ISERROR(RC10)), ISNUMBER(RC10))), 1, 0) -> 0 | M436: =INDEX(Gross!R1C1:R46C51, RC1, 26) -> #REF! | N436: =INDEX(Gross!R1C1:R46C51, RC1, 27) -> #REF!
A437: 474 | B437: =INDEX(2001Grossed!R1C1:R46C51, RC[-1], 26) -> #REF! | C437: =INDEX(2001Grossed!R1C1:R46C51, RC1, 27) -> #REF! | D437: =IF(Menus!R9C10, RC[-1]/RC[-2], RC[-1]) -> #REF! | E437: =IF(RC11=1, RC[-3], NA()) -> #NA | F437: =INDEX(2001Grossed!R1C1:R46C51, RC1, 1) -> #REF! | G437: =IF(EQUAL(INDEX(2001Grossed!R1C1:R46C51, RC1, 2), R1C), RC4, NA()) -> #REF! | H437: =IF(EQUAL(INDEX(2001Grossed!R1C1:R46C51, RC1, 2), R1C), RC4, NA()) -> #REF! | I437: =IF(EQUAL(INDEX(2001Grossed!R1C1:R46C51, RC1, 2), R1C), RC4, NA()) -> #REF! | J437: =IF(EQUAL(INDEX(2001Grossed!R1C1:R46C51, RC1, 2), R1C), RC4, NA()) -> #REF! | K437: =IF(OR(AND(NOT(ISERROR(RC7)), ISNUMBER(RC7)), AND(NOT(ISERROR(RC8)), ISNUMBER(RC8)), AND(NOT(ISERROR(RC9)), ISNUMBER(RC9)), AND(NOT(ISERROR(RC10)), ISNUMBER(RC10))), 1, 0) -> 0 | M437: =INDEX(Gross!R1C1:R46C51, RC1, 26) -> #REF! | N437: =INDEX(Gross!R1C1:R46C51, RC1, 27) -> #REF!
A438: 475 | B438: =INDEX(2001Grossed!R1C1:R46C51, RC[-1], 26) -> #REF! | C438: =INDEX(2001Grossed!R1C1:R46C51, RC1, 27) -> #REF! | D438: =IF(Menus!R9C10, RC[-1]/RC[-2], RC[-1]) -> #REF! | E438: =IF(RC11=1, RC[-3], NA()) -> #NA | F438: =INDEX(2001Grossed!R1C1:R46C51, RC1, 1) -> #REF! | G438: =IF(EQUAL(INDEX(2001Grossed!R1C1:R46C51, RC1, 2), R1C), RC4, NA()) -> #REF! | H438: =IF(EQUAL(INDEX(2001Grossed!R1C1:R46C51, RC1, 2), R1C), RC4, NA()) -> #REF! | I438: =IF(EQUAL(INDEX(2001Grossed!R1C1:R46C51, RC1, 2), R1C), RC4, NA()) -> #REF! | J438: =IF(EQUAL(INDEX(2001Grossed!R1C1:R46C51, RC1, 2), R1C), RC4, NA()) -> #REF! | K438: =IF(OR(AND(NOT(ISERROR(RC7)), ISNUMBER(RC7)), AND(NOT(ISERROR(RC8)), ISNUMBER(RC8)), AND(NOT(ISERROR(RC9)), ISNUMBER(RC9)), AND(NOT(ISERROR(RC10)), ISNUMBER(RC10))), 1, 0) -> 0 | M438: =INDEX(Gross!R1C1:R46C51, RC1, 26) -> #REF! | N438: =INDEX(Gross!R1C1:R46C51, RC1, 27) -> #REF!
A439: 476 | B439: =INDEX(2001Grossed!R1C1:R46C51, RC[-1], 26) -> #REF! | C439: =INDEX(2001Grossed!R1C1:R46C51, RC1, 27) -> #REF! | D439: =IF(Menus!R9C10, RC[-1]/RC[-2], RC[-1]) -> #REF! | E439: =IF(RC11=1, RC[-3], NA()) -> #NA | F439: =INDEX(2001Grossed!R1C1:R46C51, RC1, 1) -> #REF! | G439: =IF(EQUAL(INDEX(2001Grossed!R1C1:R46C51, RC1, 2), R1C), RC4, NA()) -> #REF! | H439: =IF(EQUAL(INDEX(2001Grossed!R1C1:R46C51, RC1, 2), R1C), RC4, NA()) -> #REF! | I439: =IF(EQUAL(INDEX(2001Grossed!R1C1:R46C51, RC1, 2), R1C), RC4, NA()) -> #REF! | J439: =IF(EQUAL(INDEX(2001Grossed!R1C1:R46C51, RC1, 2), R1C), RC4, NA()) -> #REF! | K439: =IF(OR(AND(NOT(ISERROR(RC7)), ISNUMBER(RC7)), AND(NOT(ISERROR(RC8)), ISNUMBER(RC8)), AND(NOT(ISERROR(RC9)), ISNUMBER(RC9)), AND(NOT(ISERROR(RC10)), ISNUMBER(RC10))), 1, 0) -> 0 | M439: =INDEX(Gross!R1C1:R46C51, RC1, 26) -> #REF! | N439: =INDEX(Gross!R1C1:R46C51, RC1, 27) -> #REF!
A440: 477 | B440: =INDEX(2001Grossed!R1C1:R46C51, RC[-1], 26) -> #REF! | C440: =INDEX(2001Grossed!R1C1:R46C51, RC1, 27) -> #REF! | D440: =IF(Menus!R9C10, RC[-1]/RC[-2], RC[-1]) -> #REF! | E440: =IF(RC11=1, RC[-3], NA()) -> #NA | F440: =INDEX(2001Grossed!R1C1:R46C51, RC1, 1) -> #REF! | G440: =IF(EQUAL(INDEX(2001Grossed!R1C1:R46C51, RC1, 2), R1C), RC4, NA()) -> #REF! | H440: =IF(EQUAL(INDEX(2001Grossed!R1C1:R46C51, RC1, 2), R1C), RC4, NA()) -> #REF! | I440: =IF(EQUAL(INDEX(2001Grossed!R1C1:R46C51, RC1, 2), R1C), RC4, NA()) -> #REF! | J440: =IF(EQUAL(INDEX(2001Grossed!R1C1:R46C51, RC1, 2), R1C), RC4, NA()) -> #REF! | K440: =IF(OR(AND(NOT(ISERROR(RC7)), ISNUMBER(RC7)), AND(NOT(ISERROR(RC8)), ISNUMBER(RC8)), AND(NOT(ISERROR(RC9)), ISNUMBER(RC9)), AND(NOT(ISERROR(RC10)), ISNUMBER(RC10))), 1, 0) -> 0 | M440: =INDEX(Gross!R1C1:R46C51, RC1, 26) -> #REF! | N440: =INDEX(Gross!R1C1:R46C51, RC1, 27) -> #REF!
A441: 478 | B441: =INDEX(2001Grossed!R1C1:R46C51, RC[-1], 26) -> #REF! | C441: =INDEX(2001Grossed!R1C1:R46C51, RC1, 27) -> #REF! | D441: =IF(Menus!R9C10, RC[-1]/RC[-2], RC[-1]) -> #REF! | E441: =IF(RC11=1, RC[-3], NA()) -> #NA | F441: =INDEX(2001Grossed!R1C1:R46C51, RC1, 1) -> #REF! | G441: =IF(EQUAL(INDEX(2001Grossed!R1C1:R46C51, RC1, 2), R1C), RC4, NA()) -> #REF! | H441: =IF(EQUAL(INDEX(2001Grossed!R1C1:R46C51, RC1, 2), R1C), RC4, NA()) -> #REF! | I441: =IF(EQUAL(INDEX(2001Grossed!R1C1:R46C51, RC1, 2), R1C), RC4, NA()) -> #REF! | J441: =IF(EQUAL(INDEX(2001Grossed!R1C1:R46C51, RC1, 2), R1C), RC4, NA()) -> #REF! | K441: =IF(OR(AND(NOT(ISERROR(RC7)), ISNUMBER(RC7)), AND(NOT(ISERROR(RC8)), ISNUMBER(RC8)), AND(NOT(ISERROR(RC9)), ISNUMBER(RC9)), AND(NOT(ISERROR(RC10)), ISNUMBER(RC10))), 1, 0) -> 0 | M441: =INDEX(Gross!R1C1:R46C51, RC1, 26) -> #REF! | N441: =INDEX(Gross!R1C1:R46C51, RC1, 27) -> #REF!
A442: 479 | B442: =INDEX(2001Grossed!R1C1:R46C51, RC[-1], 26) -> #REF! | C442: =INDEX(2001Grossed!R1C1:R46C51, RC1, 27) -> #REF! | D442: =IF(Menus!R9C10, RC[-1]/RC[-2], RC[-1]) -> #REF! | E442: =IF(RC11=1, RC[-3], NA()) -> #NA | F442: =INDEX(2001Grossed!R1C1:R46C51, RC1, 1) -> #REF! | G442: =IF(EQUAL(INDEX(2001Grossed!R1C1:R46C51, RC1, 2), R1C), RC4, NA()) -> #REF! | H442: =IF(EQUAL(INDEX(2001Grossed!R1C1:R46C51, RC1, 2), R1C), RC4, NA()) -> #REF! | I442: =IF(EQUAL(INDEX(2001Grossed!R1C1:R46C51, RC1, 2), R1C), RC4, NA()) -> #REF! | J442: =IF(EQUAL(INDEX(2001Grossed!R1C1:R46C51, RC1, 2), R1C), RC4, NA()) -> #REF! | K442: =IF(OR(AND(NOT(ISERROR(RC7)), ISNUMBER(RC7)), AND(NOT(ISERROR(RC8)), ISNUMBER(RC8)), AND(NOT(ISERROR(RC9)), ISNUMBER(RC9)), AND(NOT(ISERROR(RC10)), ISNUMBER(RC10))), 1, 0) -> 0 | M442: =INDEX(Gross!R1C1:R46C51, RC1, 26) -> #REF! | N442: =INDEX(Gross!R1C1:R46C51, RC1, 27) -> #REF!
A443: 480 | B443: =INDEX(2001Grossed!R1C1:R46C51, RC[-1], 26) -> #REF! | C443: =INDEX(2001Grossed!R1C1:R46C51, RC1, 27) -> #REF! | D443: =IF(Menus!R9C10, RC[-1]/RC[-2], RC[-1]) -> #REF! | E443: =IF(RC11=1, RC[-3], NA()) -> #NA | F443: =INDEX(2001Grossed!R1C1:R46C51, RC1, 1) -> #REF! | G443: =IF(EQUAL(INDEX(2001Grossed!R1C1:R46C51, RC1, 2), R1C), RC4, NA()) -> #REF! | H443: =IF(EQUAL(INDEX(2001Grossed!R1C1:R46C51, RC1, 2), R1C), RC4, NA()) -> #REF! | I443: =IF(EQUAL(INDEX(2001Grossed!R1C1:R46C51, RC1, 2), R1C), RC4, NA()) -> #REF! | J443: =IF(EQUAL(INDEX(2001Grossed!R1C1:R46C51, RC1, 2), R1C), RC4, NA()) -> #REF! | K443: =IF(OR(AND(NOT(ISERROR(RC7)), ISNUMBER(RC7)), AND(NOT(ISERROR(RC8)), ISNUMBER(RC8)), AND(NOT(ISERROR(RC9)), ISNUMBER(RC9)), AND(NOT(ISERROR(RC10)), ISNUMBER(RC10))), 1, 0) -> 0 | M443: =INDEX(Gross!R1C1:R46C51, RC1, 26) -> #REF! | N443: =INDEX(Gross!R1C1:R46C51, RC1, 27) -> #REF!
A444: 481 | B444: =INDEX(2001Grossed!R1C1:R46C51, RC[-1], 26) -> #REF! | C444: =INDEX(2001Grossed!R1C1:R46C51, RC1, 27) -> #REF! | D444: =IF(Menus!R9C10, RC[-1]/RC[-2], RC[-1]) -> #REF! | E444: =IF(RC11=1, RC[-3], NA()) -> #NA | F444: =INDEX(2001Grossed!R1C1:R46C51, RC1, 1) -> #REF! | G444: =IF(EQUAL(INDEX(2001Grossed!R1C1:R46C51, RC1, 2), R1C), RC4, NA()) -> #REF! | H444: =IF(EQUAL(INDEX(2001Grossed!R1C1:R46C51, RC1, 2), R1C), RC4, NA()) -> #REF! | I444: =IF(EQUAL(INDEX(2001Grossed!R1C1:R46C51, RC1, 2), R1C), RC4, NA()) -> #REF! | J444: =IF(EQUAL(INDEX(2001Grossed!R1C1:R46C51, RC1, 2), R1C), RC4, NA()) -> #REF! | K444: =IF(OR(AND(NOT(ISERROR(RC7)), ISNUMBER(RC7)), AND(NOT(ISERROR(RC8)), ISNUMBER(RC8)), AND(NOT(ISERROR(RC9)), ISNUMBER(RC9)), AND(NOT(ISERROR(RC10)), ISNUMBER(RC10))), 1, 0) -> 0 | M444: =INDEX(Gross!R1C1:R46C51, RC1, 26) -> #REF! | N444: =INDEX(Gross!R1C1:R46C51, RC1, 27) -> #REF!
A445: 482 | B445: =INDEX(2001Grossed!R1C1:R46C51, RC[-1], 26) -> #REF! | C445: =INDEX(2001Grossed!R1C1:R46C51, RC1, 27) -> #REF! | D445: =IF(Menus!R9C10, RC[-1]/RC[-2], RC[-1]) -> #REF! | E445: =IF(RC11=1, RC[-3], NA()) -> #NA | F445: =INDEX(2001Grossed!R1C1:R46C51, RC1, 1) -> #REF! | G445: =IF(EQUAL(INDEX(2001Grossed!R1C1:R46C51, RC1, 2), R1C), RC4, NA()) -> #REF! | H445: =IF(EQUAL(INDEX(2001Grossed!R1C1:R46C51, RC1, 2), R1C), RC4, NA()) -> #REF! | I445: =IF(EQUAL(INDEX(2001Grossed!R1C1:R46C51, RC1, 2), R1C), RC4, NA()) -> #REF! | J445: =IF(EQUAL(INDEX(2001Grossed!R1C1:R46C51, RC1, 2), R1C), RC4, NA()) -> #REF! | K445: =IF(OR(AND(NOT(ISERROR(RC7)), ISNUMBER(RC7)), AND(NOT(ISERROR(RC8)), ISNUMBER(RC8)), AND(NOT(ISERROR(RC9)), ISNUMBER(RC9)), AND(NOT(ISERROR(RC10)), ISNUMBER(RC10))), 1, 0) -> 0 | M445: =INDEX(Gross!R1C1:R46C51, RC1, 26) -> #REF! | N445: =INDEX(Gross!R1C1:R46C51, RC1, 27) -> #REF!
A446: 483 | B446: =INDEX(2001Grossed!R1C1:R46C51, RC[-1], 26) -> #REF! | C446: =INDEX(2001Grossed!R1C1:R46C51, RC1, 27) -> #REF! | D446: =IF(Menus!R9C10, RC[-1]/RC[-2], RC[-1]) -> #REF! | E446: =IF(RC11=1, RC[-3], NA()) -> #NA | F446: =INDEX(2001Grossed!R1C1:R46C51, RC1, 1) -> #REF! | G446: =IF(EQUAL(INDEX(2001Grossed!R1C1:R46C51, RC1, 2), R1C), RC4, NA()) -> #REF! | H446: =IF(EQUAL(INDEX(2001Grossed!R1C1:R46C51, RC1, 2), R1C), RC4, NA()) -> #REF! | I446: =IF(EQUAL(INDEX(2001Grossed!R1C1:R46C51, RC1, 2), R1C), RC4, NA()) -> #REF! | J446: =IF(EQUAL(INDEX(2001Grossed!R1C1:R46C51, RC1, 2), R1C), RC4, NA()) -> #REF! | K446: =IF(OR(AND(NOT(ISERROR(RC7)), ISNUMBER(RC7)), AND(NOT(ISERROR(RC8)), ISNUMBER(RC8)), AND(NOT(ISERROR(RC9)), ISNUMBER(RC9)), AND(NOT(ISERROR(RC10)), ISNUMBER(RC10))), 1, 0) -> 0 | M446: =INDEX(Gross!R1C1:R46C51, RC1, 26) -> #REF! | N446: =INDEX(Gross!R1C1:R46C51, RC1, 27) -> #REF!
A447: 484 | B447: =INDEX(2001Grossed!R1C1:R46C51, RC[-1], 26) -> #REF! | C447: =INDEX(2001Grossed!R1C1:R46C51, RC1, 27) -> #REF! | D447: =IF(Menus!R9C10, RC[-1]/RC[-2], RC[-1]) -> #REF! | E447: =IF(RC11=1, RC[-3], NA()) -> #NA | F447: =INDEX(2001Grossed!R1C1:R46C51, RC1, 1) -> #REF! | G447: =IF(EQUAL(INDEX(2001Grossed!R1C1:R46C51, RC1, 2), R1C), RC4, NA()) -> #REF! | H447: =IF(EQUAL(INDEX(2001Grossed!R1C1:R46C51, RC1, 2), R1C), RC4, NA()) -> #REF! | I447: =IF(EQUAL(INDEX(2001Grossed!R1C1:R46C51, RC1, 2), R1C), RC4, NA()) -> #REF! | J447: =IF(EQUAL(INDEX(2001Grossed!R1C1:R46C51, RC1, 2), R1C), RC4, NA()) -> #REF! | K447: =IF(OR(AND(NOT(ISERROR(RC7)), ISNUMBER(RC7)), AND(NOT(ISERROR(RC8)), ISNUMBER(RC8)), AND(NOT(ISERROR(RC9)), ISNUMBER(RC9)), AND(NOT(ISERROR(RC10)), ISNUMBER(RC10))), 1, 0) -> 0 | M447: =INDEX(Gross!R1C1:R46C51, RC1, 26) -> #REF! | N447: =INDEX(Gross!R1C1:R46C51, RC1, 27) -> #REF!
A448: 485 | B448: =INDEX(2001Grossed!R1C1:R46C51, RC[-1], 26) -> #REF! | C448: =INDEX(2001Grossed!R1C1:R46C51, RC1, 27) -> #REF! | D448: =IF(Menus!R9C10, RC[-1]/RC[-2], RC[-1]) -> #REF! | E448: =IF(RC11=1, RC[-3], NA()) -> #NA | F448: =INDEX(2001Grossed!R1C1:R46C51, RC1, 1) -> #REF! | G448: =IF(EQUAL(INDEX(2001Grossed!R1C1:R46C51, RC1, 2), R1C), RC4, NA()) -> #REF! | H448: =IF(EQUAL(INDEX(2001Grossed!R1C1:R46C51, RC1, 2), R1C), RC4, NA()) -> #REF! | I448: =IF(EQUAL(INDEX(2001Grossed!R1C1:R46C51, RC1, 2), R1C), RC4, NA()) -> #REF! | J448: =IF(EQUAL(INDEX(2001Grossed!R1C1:R46C51, RC1, 2), R1C), RC4, NA()) -> #REF! | K448: =IF(OR(AND(NOT(ISERROR(RC7)), ISNUMBER(RC7)), AND(NOT(ISERROR(RC8)), ISNUMBER(RC8)), AND(NOT(ISERROR(RC9)), ISNUMBER(RC9)), AND(NOT(ISERROR(RC10)), ISNUMBER(RC10))), 1, 0) -> 0 | M448: =INDEX(Gross!R1C1:R46C51, RC1, 26) -> #REF! | N448: =INDEX(Gross!R1C1:R46C51, RC1, 27) -> #REF!
A449: 486 | B449: =INDEX(2001Grossed!R1C1:R46C51, RC[-1], 26) -> #REF! | C449: =INDEX(2001Grossed!R1C1:R46C51, RC1, 27) -> #REF! | D449: =IF(Menus!R9C10, RC[-1]/RC[-2], RC[-1]) -> #REF! | E449: =IF(RC11=1, RC[-3], NA()) -> #NA | F449: =INDEX(2001Grossed!R1C1:R46C51, RC1, 1) -> #REF! | G449: =IF(EQUAL(INDEX(2001Grossed!R1C1:R46C51, RC1, 2), R1C), RC4, NA()) -> #REF! | H449: =IF(EQUAL(INDEX(2001Grossed!R1C1:R46C51, RC1, 2), R1C), RC4, NA()) -> #REF! | I449: =IF(EQUAL(INDEX(2001Grossed!R1C1:R46C51, RC1, 2), R1C), RC4, NA()) -> #REF! | J449: =IF(EQUAL(INDEX(2001Grossed!R1C1:R46C51, RC1, 2), R1C), RC4, NA()) -> #REF! | K449: =IF(OR(AND(NOT(ISERROR(RC7)), ISNUMBER(RC7)), AND(NOT(ISERROR(RC8)), ISNUMBER(RC8)), AND(NOT(ISERROR(RC9)), ISNUMBER(RC9)), AND(NOT(ISERROR(RC10)), ISNUMBER(RC10))), 1, 0) -> 0 | M449: =INDEX(Gross!R1C1:R46C51, RC1, 26) -> #REF! | N449: =INDEX(Gross!R1C1:R46C51, RC1, 27) -> #REF!
A450: 487 | B450: =INDEX(2001Grossed!R1C1:R46C51, RC[-1], 26) -> #REF! | C450: =INDEX(2001Grossed!R1C1:R46C51, RC1, 27) -> #REF! | D450: =IF(Menus!R9C10, RC[-1]/RC[-2], RC[-1]) -> #REF! | E450: =IF(RC11=1, RC[-3], NA()) -> #NA | F450: =INDEX(2001Grossed!R1C1:R46C51, RC1, 1) -> #REF! | G450: =IF(EQUAL(INDEX(2001Grossed!R1C1:R46C51, RC1, 2), R1C), RC4, NA()) -> #REF! | H450: =IF(EQUAL(INDEX(2001Grossed!R1C1:R46C51, RC1, 2), R1C), RC4, NA()) -> #REF! | I450: =IF(EQUAL(INDEX(2001Grossed!R1C1:R46C51, RC1, 2), R1C), RC4, NA()) -> #REF! | J450: =IF(EQUAL(INDEX(2001Grossed!R1C1:R46C51, RC1, 2), R1C), RC4, NA()) -> #REF! | K450: =IF(OR(AND(NOT(ISERROR(RC7)), ISNUMBER(RC7)), AND(NOT(ISERROR(RC8)), ISNUMBER(RC8)), AND(NOT(ISERROR(RC9)), ISNUMBER(RC9)), AND(NOT(ISERROR(RC10)), ISNUMBER(RC10))), 1, 0) -> 0 | M450: =INDEX(Gross!R1C1:R46C51, RC1, 26) -> #REF! | N450: =INDEX(Gross!R1C1:R46C51, RC1, 27) -> #REF!
A451: 488 | B451: =INDEX(2001Grossed!R1C1:R46C51, RC[-1], 26) -> #REF! | C451: =INDEX(2001Grossed!R1C1:R46C51, RC1, 27) -> #REF! | D451: =IF(Menus!R9C10, RC[-1]/RC[-2], RC[-1]) -> #REF! | E451: =IF(RC11=1, RC[-3], NA()) -> #NA | F451: =INDEX(2001Grossed!R1C1:R46C51, RC1, 1) -> #REF! | G451: =IF(EQUAL(INDEX(2001Grossed!R1C1:R46C51, RC1, 2), R1C), RC4, NA()) -> #REF! | H451: =IF(EQUAL(INDEX(2001Grossed!R1C1:R46C51, RC1, 2), R1C), RC4, NA()) -> #REF! | I451: =IF(EQUAL(INDEX(2001Grossed!R1C1:R46C51, RC1, 2), R1C), RC4, NA()) -> #REF! | J451: =IF(EQUAL(INDEX(2001Grossed!R1C1:R46C51, RC1, 2), R1C), RC4, NA()) -> #REF! | K451: =IF(OR(AND(NOT(ISERROR(RC7)), ISNUMBER(RC7)), AND(NOT(ISERROR(RC8)), ISNUMBER(RC8)), AND(NOT(ISERROR(RC9)), ISNUMBER(RC9)), AND(NOT(ISERROR(RC10)), ISNUMBER(RC10))), 1, 0) -> 0 | M451: =INDEX(Gross!R1C1:R46C51, RC1, 26) -> #REF! | N451: =INDEX(Gross!R1C1:R46C51, RC1, 27) -> #REF!
A452: 489 | B452: =INDEX(2001Grossed!R1C1:R46C51, RC[-1], 26) -> #REF! | C452: =INDEX(2001Grossed!R1C1:R46C51, RC1, 27) -> #REF! | D452: =IF(Menus!R9C10, RC[-1]/RC[-2], RC[-1]) -> #REF! | E452: =IF(RC11=1, RC[-3], NA()) -> #NA | F452: =INDEX(2001Grossed!R1C1:R46C51, RC1, 1) -> #REF! | G452: =IF(EQUAL(INDEX(2001Grossed!R1C1:R46C51, RC1, 2), R1C), RC4, NA()) -> #REF! | H452: =IF(EQUAL(INDEX(2001Grossed!R1C1:R46C51, RC1, 2), R1C), RC4, NA()) -> #REF! | I452: =IF(EQUAL(INDEX(2001Grossed!R1C1:R46C51, RC1, 2), R1C), RC4, NA()) -> #REF! | J452: =IF(EQUAL(INDEX(2001Grossed!R1C1:R46C51, RC1, 2), R1C), RC4, NA()) -> #REF! | K452: =IF(OR(AND(NOT(ISERROR(RC7)), ISNUMBER(RC7)), AND(NOT(ISERROR(RC8)), ISNUMBER(RC8)), AND(NOT(ISERROR(RC9)), ISNUMBER(RC9)), AND(NOT(ISERROR(RC10)), ISNUMBER(RC10))), 1, 0) -> 0 | M452: =INDEX(Gross!R1C1:R46C51, RC1, 26) -> #REF! | N452: =INDEX(Gross!R1C1:R46C51, RC1, 27) -> #REF!
A453: 490 | B453: =INDEX(2001Grossed!R1C1:R46C51, RC[-1], 26) -> #REF! | C453: =INDEX(2001Grossed!R1C1:R46C51, RC1, 27) -> #REF! | D453: =IF(Menus!R9C10, RC[-1]/RC[-2], RC[-1]) -> #REF! | E453: =IF(RC11=1, RC[-3], NA()) -> #NA | F453: =INDEX(2001Grossed!R1C1:R46C51, RC1, 1) -> #REF! | G453: =IF(EQUAL(INDEX(2001Grossed!R1C1:R46C51, RC1, 2), R1C), RC4, NA()) -> #REF! | H453: =IF(EQUAL(INDEX(2001Grossed!R1C1:R46C51, RC1, 2), R1C), RC4, NA()) -> #REF! | I453: =IF(EQUAL(INDEX(2001Grossed!R1C1:R46C51, RC1, 2), R1C), RC4, NA()) -> #REF! | J453: =IF(EQUAL(INDEX(2001Grossed!R1C1:R46C51, RC1, 2), R1C), RC4, NA()) -> #REF! | K453: =IF(OR(AND(NOT(ISERROR(RC7)), ISNUMBER(RC7)), AND(NOT(ISERROR(RC8)), ISNUMBER(RC8)), AND(NOT(ISERROR(RC9)), ISNUMBER(RC9)), AND(NOT(ISERROR(RC10)), ISNUMBER(RC10))), 1, 0) -> 0 | M453: =INDEX(Gross!R1C1:R46C51, RC1, 26) -> #REF! | N453: =INDEX(Gross!R1C1:R46C51, RC1, 27) -> #REF!
A454: 491 | B454: =INDEX(2001Grossed!R1C1:R46C51, RC[-1], 26) -> #REF! | C454: =INDEX(2001Grossed!R1C1:R46C51, RC1, 27) -> #REF! | D454: =IF(Menus!R9C10, RC[-1]/RC[-2], RC[-1]) -> #REF! | E454: =IF(RC11=1, RC[-3], NA()) -> #NA | F454: =INDEX(2001Grossed!R1C1:R46C51, RC1, 1) -> #REF! | G454: =IF(EQUAL(INDEX(2001Grossed!R1C1:R46C51, RC1, 2), R1C), RC4, NA()) -> #REF! | H454: =IF(EQUAL(INDEX(2001Grossed!R1C1:R46C51, RC1, 2), R1C), RC4, NA()) -> #REF! | I454: =IF(EQUAL(INDEX(2001Grossed!R1C1:R46C51, RC1, 2), R1C), RC4, NA()) -> #REF! | J454: =IF(EQUAL(INDEX(2001Grossed!R1C1:R46C51, RC1, 2), R1C), RC4, NA()) -> #REF! | K454: =IF(OR(AND(NOT(ISERROR(RC7)), ISNUMBER(RC7)), AND(NOT(ISERROR(RC8)), ISNUMBER(RC8)), AND(NOT(ISERROR(RC9)), ISNUMBER(RC9)), AND(NOT(ISERROR(RC10)), ISNUMBER(RC10))), 1, 0) -> 0 | M454: =INDEX(Gross!R1C1:R46C51, RC1, 26) -> #REF! | N454: =INDEX(Gross!R1C1:R46C51, RC1, 27) -> #REF!
A455: 492 | B455: =INDEX(2001Grossed!R1C1:R46C51, RC[-1], 26) -> #REF! | C455: =INDEX(2001Grossed!R1C1:R46C51, RC1, 27) -> #REF! | D455: =IF(Menus!R9C10, RC[-1]/RC[-2], RC[-1]) -> #REF! | E455: =IF(RC11=1, RC[-3], NA()) -> #NA | F455: =INDEX(2001Grossed!R1C1:R46C51, RC1, 1) -> #REF! | G455: =IF(EQUAL(INDEX(2001Grossed!R1C1:R46C51, RC1, 2), R1C), RC4, NA()) -> #REF! | H455: =IF(EQUAL(INDEX(2001Grossed!R1C1:R46C51, RC1, 2), R1C), RC4, NA()) -> #REF! | I455: =IF(EQUAL(INDEX(2001Grossed!R1C1:R46C51, RC1, 2), R1C), RC4, NA()) -> #REF! | J455: =IF(EQUAL(INDEX(2001Grossed!R1C1:R46C51, RC1, 2), R1C), RC4, NA()) -> #REF! | K455: =IF(OR(AND(NOT(ISERROR(RC7)), ISNUMBER(RC7)), AND(NOT(ISERROR(RC8)), ISNUMBER(RC8)), AND(NOT(ISERROR(RC9)), ISNUMBER(RC9)), AND(NOT(ISERROR(RC10)), ISNUMBER(RC10))), 1, 0) -> 0 | M455: =INDEX(Gross!R1C1:R46C51, RC1, 26) -> #REF! | N455: =INDEX(Gross!R1C1:R46C51, RC1, 27) -> #REF!
A456: 493 | B456: =INDEX(2001Grossed!R1C1:R46C51, RC[-1], 26) -> #REF! | C456: =INDEX(2001Grossed!R1C1:R46C51, RC1, 27) -> #REF! | D456: =IF(Menus!R9C10, RC[-1]/RC[-2], RC[-1]) -> #REF! | E456: =IF(RC11=1, RC[-3], NA()) -> #NA | F456: =INDEX(2001Grossed!R1C1:R46C51, RC1, 1) -> #REF! | G456: =IF(EQUAL(INDEX(2001Grossed!R1C1:R46C51, RC1, 2), R1C), RC4, NA()) -> #REF! | H456: =IF(EQUAL(INDEX(2001Grossed!R1C1:R46C51, RC1, 2), R1C), RC4, NA()) -> #REF! | I456: =IF(EQUAL(INDEX(2001Grossed!R1C1:R46C51, RC1, 2), R1C), RC4, NA()) -> #REF! | J456: =IF(EQUAL(INDEX(2001Grossed!R1C1:R46C51, RC1, 2), R1C), RC4, NA()) -> #REF! | K456: =IF(OR(AND(NOT(ISERROR(RC7)), ISNUMBER(RC7)), AND(NOT(ISERROR(RC8)), ISNUMBER(RC8)), AND(NOT(ISERROR(RC9)), ISNUMBER(RC9)), AND(NOT(ISERROR(RC10)), ISNUMBER(RC10))), 1, 0) -> 0 | M456: =INDEX(Gross!R1C1:R46C51, RC1, 26) -> #REF! | N456: =INDEX(Gross!R1C1:R46C51, RC1, 27) -> #REF!
A457: 494 | B457: =INDEX(2001Grossed!R1C1:R46C51, RC[-1], 26) -> #REF! | C457: =INDEX(2001Grossed!R1C1:R46C51, RC1, 27) -> #REF! | D457: =IF(Menus!R9C10, RC[-1]/RC[-2], RC[-1]) -> #REF! | E457: =IF(RC11=1, RC[-3], NA()) -> #NA | F457: =INDEX(2001Grossed!R1C1:R46C51, RC1, 1) -> #REF! | G457: =IF(EQUAL(INDEX(2001Grossed!R1C1:R46C51, RC1, 2), R1C), RC4, NA()) -> #REF! | H457: =IF(EQUAL(INDEX(2001Grossed!R1C1:R46C51, RC1, 2), R1C), RC4, NA()) -> #REF! | I457: =IF(EQUAL(INDEX(2001Grossed!R1C1:R46C51, RC1, 2), R1C), RC4, NA()) -> #REF! | J457: =IF(EQUAL(INDEX(2001Grossed!R1C1:R46C51, RC1, 2), R1C), RC4, NA()) -> #REF! | K457: =IF(OR(AND(NOT(ISERROR(RC7)), ISNUMBER(RC7)), AND(NOT(ISERROR(RC8)), ISNUMBER(RC8)), AND(NOT(ISERROR(RC9)), ISNUMBER(RC9)), AND(NOT(ISERROR(RC10)), ISNUMBER(RC10))), 1, 0) -> 0 | M457: =INDEX(Gross!R1C1:R46C51, RC1, 26) -> #REF! | N457: =INDEX(Gross!R1C1:R46C51, RC1, 27) -> #REF!
A458: 495 | B458: =INDEX(2001Grossed!R1C1:R46C51, RC[-1], 26) -> #REF! | C458: =INDEX(2001Grossed!R1C1:R46C51, RC1, 27) -> #REF! | D458: =IF(Menus!R9C10, RC[-1]/RC[-2], RC[-1]) -> #REF! | E458: =IF(RC11=1, RC[-3], NA()) -> #NA | F458: =INDEX(2001Grossed!R1C1:R46C51, RC1, 1) -> #REF! | G458: =IF(EQUAL(INDEX(2001Grossed!R1C1:R46C51, RC1, 2), R1C), RC4, NA()) -> #REF! | H458: =IF(EQUAL(INDEX(2001Grossed!R1C1:R46C51, RC1, 2), R1C), RC4, NA()) -> #REF! | I458: =IF(EQUAL(INDEX(2001Grossed!R1C1:R46C51, RC1, 2), R1C), RC4, NA()) -> #REF! | J458: =IF(EQUAL(INDEX(2001Grossed!R1C1:R46C51, RC1, 2), R1C), RC4, NA()) -> #REF! | K458: =IF(OR(AND(NOT(ISERROR(RC7)), ISNUMBER(RC7)), AND(NOT(ISERROR(RC8)), ISNUMBER(RC8)), AND(NOT(ISERROR(RC9)), ISNUMBER(RC9)), AND(NOT(ISERROR(RC10)), ISNUMBER(RC10))), 1, 0) -> 0 | M458: =INDEX(Gross!R1C1:R46C51, RC1, 26) -> #REF! | N458: =INDEX(Gross!R1C1:R46C51, RC1, 27) -> #REF!
A459: 496 | B459: =INDEX(2001Grossed!R1C1:R46C51, RC[-1], 26) -> #REF! | C459: =INDEX(2001Grossed!R1C1:R46C51, RC1, 27) -> #REF! | D459: =IF(Menus!R9C10, RC[-1]/RC[-2], RC[-1]) -> #REF! | E459: =IF(RC11=1, RC[-3], NA()) -> #NA | F459: =INDEX(2001Grossed!R1C1:R46C51, RC1, 1) -> #REF! | G459: =IF(EQUAL(INDEX(2001Grossed!R1C1:R46C51, RC1, 2), R1C), RC4, NA()) -> #REF! | H459: =IF(EQUAL(INDEX(2001Grossed!R1C1:R46C51, RC1, 2), R1C), RC4, NA()) -> #REF! | I459: =IF(EQUAL(INDEX(2001Grossed!R1C1:R46C51, RC1, 2), R1C), RC4, NA()) -> #REF! | J459: =IF(EQUAL(INDEX(2001Grossed!R1C1:R46C51, RC1, 2), R1C), RC4, NA()) -> #REF! | K459: =IF(OR(AND(NOT(ISERROR(RC7)), ISNUMBER(RC7)), AND(NOT(ISERROR(RC8)), ISNUMBER(RC8)), AND(NOT(ISERROR(RC9)), ISNUMBER(RC9)), AND(NOT(ISERROR(RC10)), ISNUMBER(RC10))), 1, 0) -> 0 | M459: =INDEX(Gross!R1C1:R46C51, RC1, 26) -> #REF! | N459: =INDEX(Gross!R1C1:R46C51, RC1, 27) -> #REF!
A460: 497 | B460: =INDEX(2001Grossed!R1C1:R46C51, RC[-1], 26) -> #REF! | C460: =INDEX(2001Grossed!R1C1:R46C51, RC1, 27) -> #REF! | D460: =IF(Menus!R9C10, RC[-1]/RC[-2], RC[-1]) -> #REF! | E460: =IF(RC11=1, RC[-3], NA()) -> #NA | F460: =INDEX(2001Grossed!R1C1:R46C51, RC1, 1) -> #REF! | G460: =IF(EQUAL(INDEX(2001Grossed!R1C1:R46C51, RC1, 2), R1C), RC4, NA()) -> #REF! | H460: =IF(EQUAL(INDEX(2001Grossed!R1C1:R46C51, RC1, 2), R1C), RC4, NA()) -> #REF! | I460: =IF(EQUAL(INDEX(2001Grossed!R1C1:R46C51, RC1, 2), R1C), RC4, NA()) -> #REF! | J460: =IF(EQUAL(INDEX(2001Grossed!R1C1:R46C51, RC1, 2), R1C), RC4, NA()) -> #REF! | K460: =IF(OR(AND(NOT(ISERROR(RC7)), ISNUMBER(RC7)), AND(NOT(ISERROR(RC8)), ISNUMBER(RC8)), AND(NOT(ISERROR(RC9)), ISNUMBER(RC9)), AND(NOT(ISERROR(RC10)), ISNUMBER(RC10))), 1, 0) -> 0 | M460: =INDEX(Gross!R1C1:R46C51, RC1, 26) -> #REF! | N460: =INDEX(Gross!R1C1:R46C51, RC1, 27) -> #REF!
A461: 498 | B461: =INDEX(2001Grossed!R1C1:R46C51, RC[-1], 26) -> #REF! | C461: =INDEX(2001Grossed!R1C1:R46C51, RC1, 27) -> #REF! | D461: =IF(Menus!R9C10, RC[-1]/RC[-2], RC[-1]) -> #REF! | E461: =IF(RC11=1, RC[-3], NA()) -> #NA | F461: =INDEX(2001Grossed!R1C1:R46C51, RC1, 1) -> #REF! | G461: =IF(EQUAL(INDEX(2001Grossed!R1C1:R46C51, RC1, 2), R1C), RC4, NA()) -> #REF! | H461: =IF(EQUAL(INDEX(2001Grossed!R1C1:R46C51, RC1, 2), R1C), RC4, NA()) -> #REF! | I461: =IF(EQUAL(INDEX(2001Grossed!R1C1:R46C51, RC1, 2), R1C), RC4, NA()) -> #REF! | J461: =IF(EQUAL(INDEX(2001Grossed!R1C1:R46C51, RC1, 2), R1C), RC4, NA()) -> #REF! | K461: =IF(OR(AND(NOT(ISERROR(RC7)), ISNUMBER(RC7)), AND(NOT(ISERROR(RC8)), ISNUMBER(RC8)), AND(NOT(ISERROR(RC9)), ISNUMBER(RC9)), AND(NOT(ISERROR(RC10)), ISNUMBER(RC10))), 1, 0) -> 0 | M461: =INDEX(Gross!R1C1:R46C51, RC1, 26) -> #REF! | N461: =INDEX(Gross!R1C1:R46C51, RC1, 27) -> #REF!
A462: 499 | B462: =INDEX(2001Grossed!R1C1:R46C51, RC[-1], 26) -> #REF! | C462: =INDEX(2001Grossed!R1C1:R46C51, RC1, 27) -> #REF! | D462: =IF(Menus!R9C10, RC[-1]/RC[-2], RC[-1]) -> #REF! | E462: =IF(RC11=1, RC[-3], NA()) -> #NA | F462: =INDEX(2001Grossed!R1C1:R46C51, RC1, 1) -> #REF! | G462: =IF(EQUAL(INDEX(2001Grossed!R1C1:R46C51, RC1, 2), R1C), RC4, NA()) -> #REF! | H462: =IF(EQUAL(INDEX(2001Grossed!R1C1:R46C51, RC1, 2), R1C), RC4, NA()) -> #REF! | I462: =IF(EQUAL(INDEX(2001Grossed!R1C1:R46C51, RC1, 2), R1C), RC4, NA()) -> #REF! | J462: =IF(EQUAL(INDEX(2001Grossed!R1C1:R46C51, RC1, 2), R1C), RC4, NA()) -> #REF! | K462: =IF(OR(AND(NOT(ISERROR(RC7)), ISNUMBER(RC7)), AND(NOT(ISERROR(RC8)), ISNUMBER(RC8)), AND(NOT(ISERROR(RC9)), ISNUMBER(RC9)), AND(NOT(ISERROR(RC10)), ISNUMBER(RC10))), 1, 0) -> 0 | M462: =INDEX(Gross!R1C1:R46C51, RC1, 26) -> #REF! | N462: =INDEX(Gross!R1C1:R46C51, RC1, 27) -> #REF!
A463: 500 | B463: =INDEX(2001Grossed!R1C1:R46C51, RC[-1], 26) -> #REF! | C463: =INDEX(2001Grossed!R1C1:R46C51, RC1, 27) -> #REF! | D463: =IF(Menus!R9C10, RC[-1]/RC[-2], RC[-1]) -> #REF! | E463: =IF(RC11=1, RC[-3], NA()) -> #NA | F463: =INDEX(2001Grossed!R1C1:R46C51, RC1, 1) -> #REF! | G463: =IF(EQUAL(INDEX(2001Grossed!R1C1:R46C51, RC1, 2), R1C), RC4, NA()) -> #REF! | H463: =IF(EQUAL(INDEX(2001Grossed!R1C1:R46C51, RC1, 2), R1C), RC4, NA()) -> #REF! | I463: =IF(EQUAL(INDEX(2001Grossed!R1C1:R46C51, RC1, 2), R1C), RC4, NA()) -> #REF! | J463: =IF(EQUAL(INDEX(2001Grossed!R1C1:R46C51, RC1, 2), R1C), RC4, NA()) -> #REF! | K463: =IF(OR(AND(NOT(ISERROR(RC7)), ISNUMBER(RC7)), AND(NOT(ISERROR(RC8)), ISNUMBER(RC8)), AND(NOT(ISERROR(RC9)), ISNUMBER(RC9)), AND(NOT(ISERROR(RC10)), ISNUMBER(RC10))), 1, 0) -> 0 | M463: =INDEX(Gross!R1C1:R46C51, RC1, 26) -> #REF! | N463: =INDEX(Gross!R1C1:R46C51, RC1, 27) -> #REF!
A464: 501 | B464: =INDEX(2001Grossed!R1C1:R46C51, RC[-1], 26) -> #REF! | C464: =INDEX(2001Grossed!R1C1:R46C51, RC1, 27) -> #REF! | D464: =IF(Menus!R9C10, RC[-1]/RC[-2], RC[-1]) -> #REF! | E464: =IF(RC11=1, RC[-3], NA()) -> #NA | F464: =INDEX(2001Grossed!R1C1:R46C51, RC1, 1) -> #REF! | G464: =IF(EQUAL(INDEX(2001Grossed!R1C1:R46C51, RC1, 2), R1C), RC4, NA()) -> #REF! | H464: =IF(EQUAL(INDEX(2001Grossed!R1C1:R46C51, RC1, 2), R1C), RC4, NA()) -> #REF! | I464: =IF(EQUAL(INDEX(2001Grossed!R1C1:R46C51, RC1, 2), R1C), RC4, NA()) -> #REF! | J464: =IF(EQUAL(INDEX(2001Grossed!R1C1:R46C51, RC1, 2), R1C), RC4, NA()) -> #REF! | K464: =IF(OR(AND(NOT(ISERROR(RC7)), ISNUMBER(RC7)), AND(NOT(ISERROR(RC8)), ISNUMBER(RC8)), AND(NOT(ISERROR(RC9)), ISNUMBER(RC9)), AND(NOT(ISERROR(RC10)), ISNUMBER(RC10))), 1, 0) -> 0 | M464: =INDEX(Gross!R1C1:R46C51, RC1, 26) -> #REF! | N464: =INDEX(Gross!R1C1:R46C51, RC1, 27) -> #REF!
A465: 48 | B465: =INDEX(2001Grossed!R1C1:R46C51, RC[-1], 26) -> #REF! | C465: =INDEX(2001Grossed!R1C1:R46C51, RC1, 27) -> #REF! | D465: =IF(Menus!R9C10, RC[-1]/RC[-2], RC[-1]) -> #REF! | E465: =IF(RC11=1, RC[-3], NA()) -> #NA | F465: =INDEX(2001Grossed!R1C1:R46C51, RC1, 1) -> #REF! | G465: =IF(EQUAL(INDEX(2001Grossed!R1C1:R46C51, RC1, 2), R1C), RC4, NA()) -> #REF! | H465: =IF(EQUAL(INDEX(2001Grossed!R1C1:R46C51, RC1, 2), R1C), RC4, NA()) -> #REF! | I465: =IF(EQUAL(INDEX(2001Grossed!R1C1:R46C51, RC1, 2), R1C), RC4, NA()) -> #REF! | J465: =IF(EQUAL(INDEX(2001Grossed!R1C1:R46C51, RC1, 2), R1C), RC4, NA()) -> #REF! | K465: =IF(OR(AND(NOT(ISERROR(RC7)), ISNUMBER(RC7)), AND(NOT(ISERROR(RC8)), ISNUMBER(RC8)), AND(NOT(ISERROR(RC9)), ISNUMBER(RC9)), AND(NOT(ISERROR(RC10)), ISNUMBER(RC10))), 1, 0) -> 0 | M465: =INDEX(Gross!R1C1:R46C51, RC1, 26) -> #REF! | N465: =INDEX(Gross!R1C1:R46C51, RC1, 27) -> #REF!
A466: 195 | B466: =INDEX(2001Grossed!R1C1:R46C51, RC[-1], 26) -> #REF! | C466: =INDEX(2001Grossed!R1C1:R46C51, RC1, 27) -> #REF! | D466: =IF(Menus!R9C10, RC[-1]/RC[-2], RC[-1]) -> #REF! | E466: =IF(RC11=1, RC[-3], NA()) -> #NA | F466: =INDEX(2001Grossed!R1C1:R46C51, RC1, 1) -> #REF! | G466: =IF(EQUAL(INDEX(2001Grossed!R1C1:R46C51, RC1, 2), R1C), RC4, NA()) -> #REF! | H466: =IF(EQUAL(INDEX(2001Grossed!R1C1:R46C51, RC1, 2), R1C), RC4, NA()) -> #REF! | I466: =IF(EQUAL(INDEX(2001Grossed!R1C1:R46C51, RC1, 2), R1C), RC4, NA()) -> #REF! | J466: =IF(EQUAL(INDEX(2001Grossed!R1C1:R46C51, RC1, 2), R1C), RC4, NA()) -> #REF! | K466: =IF(OR(AND(NOT(ISERROR(RC7)), ISNUMBER(RC7)), AND(NOT(ISERROR(RC8)), ISNUMBER(RC8)), AND(NOT(ISERROR(RC9)), ISNUMBER(RC9)), AND(NOT(ISERROR(RC10)), ISNUMBER(RC10))), 1, 0) -> 0 | M466: =INDEX(Gross!R1C1:R46C51, RC1, 26) -> #REF! | N466: =INDEX(Gross!R1C1:R46C51, RC1, 27) -> #REF!
A467: 103 | B467: =INDEX(2001Grossed!R1C1:R46C51, RC[-1], 26) -> #REF! | C467: =INDEX(2001Grossed!R1C1:R46C51, RC1, 27) -> #REF! | D467: =IF(Menus!R9C10, RC[-1]/RC[-2], RC[-1]) -> #REF! | E467: =IF(RC11=1, RC[-3], NA()) -> #NA | F467: =INDEX(2001Grossed!R1C1:R46C51, RC1, 1) -> #REF! | G467: =IF(EQUAL(INDEX(2001Grossed!R1C1:R46C51, RC1, 2), R1C), RC4, NA()) -> #REF! | H467: =IF(EQUAL(INDEX(2001Grossed!R1C1:R46C51, RC1, 2), R1C), RC4, NA()) -> #REF! | I467: =IF(EQUAL(INDEX(2001Grossed!R1C1:R46C51, RC1, 2), R1C), RC4, NA()) -> #REF! | J467: =IF(EQUAL(INDEX(2001Grossed!R1C1:R46C51, RC1, 2), R1C), RC4, NA()) -> #REF! | K467: =IF(OR(AND(NOT(ISERROR(RC7)), ISNUMBER(RC7)), AND(NOT(ISERROR(RC8)), ISNUMBER(RC8)), AND(NOT(ISERROR(RC9)), ISNUMBER(RC9)), AND(NOT(ISERROR(RC10)), ISNUMBER(RC10))), 1, 0) -> 0 | M467: =INDEX(Gross!R1C1:R46C51, RC1, 26) -> #REF! | N467: =INDEX(Gross!R1C1:R46C51, RC1, 27) -> #REF!
A468: 158 | B468: =INDEX(2001Grossed!R1C1:R46C51, RC[-1], 26) -> #REF! | C468: =INDEX(2001Grossed!R1C1:R46C51, RC1, 27) -> #REF! | D468: =IF(Menus!R9C10, RC[-1]/RC[-2], RC[-1]) -> #REF! | E468: =IF(RC11=1, RC[-3], NA()) -> #NA | F468: =INDEX(2001Grossed!R1C1:R46C51, RC1, 1) -> #REF! | G468: =IF(EQUAL(INDEX(2001Grossed!R1C1:R46C51, RC1, 2), R1C), RC4, NA()) -> #REF! | H468: =IF(EQUAL(INDEX(2001Grossed!R1C1:R46C51, RC1, 2), R1C), RC4, NA()) -> #REF! | I468: =IF(EQUAL(INDEX(2001Grossed!R1C1:R46C51, RC1, 2), R1C), RC4, NA()) -> #REF! | J468: =IF(EQUAL(INDEX(2001Grossed!R1C1:R46C51, RC1, 2), R1C), RC4, NA()) -> #REF! | K468: =IF(OR(AND(NOT(ISERROR(RC7)), ISNUMBER(RC7)), AND(NOT(ISERROR(RC8)), ISNUMBER(RC8)), AND(NOT(ISERROR(RC9)), ISNUMBER(RC9)), AND(NOT(ISERROR(RC10)), ISNUMBER(RC10))), 1, 0) -> 0 | M468: =INDEX(Gross!R1C1:R46C51, RC1, 26) -> #REF! | N468: =INDEX(Gross!R1C1:R46C51, RC1, 27) -> #REF!
A469: 77 | B469: =INDEX(2001Grossed!R1C1:R46C51, RC[-1], 26) -> #REF! | C469: =INDEX(2001Grossed!R1C1:R46C51, RC1, 27) -> #REF! | D469: =IF(Menus!R9C10, RC[-1]/RC[-2], RC[-1]) -> #REF! | E469: =IF(RC11=1, RC[-3], NA()) -> #NA | F469: =INDEX(2001Grossed!R1C1:R46C51, RC1, 1) -> #REF! | G469: =IF(EQUAL(INDEX(2001Grossed!R1C1:R46C51, RC1, 2), R1C), RC4, NA()) -> #REF! | H469: =IF(EQUAL(INDEX(2001Grossed!R1C1:R46C51, RC1, 2), R1C), RC4, NA()) -> #REF! | I469: =IF(EQUAL(INDEX(2001Grossed!R1C1:R46C51, RC1, 2), R1C), RC4, NA()) -> #REF! | J469: =IF(EQUAL(INDEX(2001Grossed!R1C1:R46C51, RC1, 2), R1C), RC4, NA()) -> #REF! | K469: =IF(OR(AND(NOT(ISERROR(RC7)), ISNUMBER(RC7)), AND(NOT(ISERROR(RC8)), ISNUMBER(RC8)), AND(NOT(ISERROR(RC9)), ISNUMBER(RC9)), AND(NOT(ISERROR(RC10)), ISNUMBER(RC10))), 1, 0) -> 0 | M469: =INDEX(Gross!R1C1:R46C51, RC1, 26) -> #REF! | N469: =INDEX(Gross!R1C1:R46C51, RC1, 27) -> #REF!
A470: 54 | B470: =INDEX(2001Grossed!R1C1:R46C51, RC[-1], 26) -> #REF! | C470: =INDEX(2001Grossed!R1C1:R46C51, RC1, 27) -> #REF! | D470: =IF(Menus!R9C10, RC[-1]/RC[-2], RC[-1]) -> #REF! | E470: =IF(RC11=1, RC[-3], NA()) -> #NA | F470: =INDEX(2001Grossed!R1C1:R46C51, RC1, 1) -> #REF! | G470: =IF(EQUAL(INDEX(2001Grossed!R1C1:R46C51, RC1, 2), R1C), RC4, NA()) -> #REF! | H470: =IF(EQUAL(INDEX(2001Grossed!R1C1:R46C51, RC1, 2), R1C), RC4, NA()) -> #REF! | I470: =IF(EQUAL(INDEX(2001Grossed!R1C1:R46C51, RC1, 2), R1C), RC4, NA()) -> #REF! | J470: =IF(EQUAL(INDEX(2001Grossed!R1C1:R46C51, RC1, 2), R1C), RC4, NA()) -> #REF! | K470: =IF(OR(AND(NOT(ISERROR(RC7)), ISNUMBER(RC7)), AND(NOT(ISERROR(RC8)), ISNUMBER(RC8)), AND(NOT(ISERROR(RC9)), ISNUMBER(RC9)), AND(NOT(ISERROR(RC10)), ISNUMBER(RC10))), 1, 0) -> 0 | M470: =INDEX(Gross!R1C1:R46C51, RC1, 26) -> #REF! | N470: =INDEX(Gross!R1C1:R46C51, RC1, 27) -> #REF!
A471: 97 | B471: =INDEX(2001Grossed!R1C1:R46C51, RC[-1], 26) -> #REF! | C471: =INDEX(2001Grossed!R1C1:R46C51, RC1, 27) -> #REF! | D471: =IF(Menus!R9C10, RC[-1]/RC[-2], RC[-1]) -> #REF! | E471: =IF(RC11=1, RC[-3], NA()) -> #NA | F471: =INDEX(2001Grossed!R1C1:R46C51, RC1, 1) -> #REF! | G471: =IF(EQUAL(INDEX(2001Grossed!R1C1:R46C51, RC1, 2), R1C), RC4, NA()) -> #REF! | H471: =IF(EQUAL(INDEX(2001Grossed!R1C1:R46C51, RC1, 2), R1C), RC4, NA()) -> #REF! | I471: =IF(EQUAL(INDEX(2001Grossed!R1C1:R46C51, RC1, 2), R1C), RC4, NA()) -> #REF! | J471: =IF(EQUAL(INDEX(2001Grossed!R1C1:R46C51, RC1, 2), R1C), RC4, NA()) -> #REF! | K471: =IF(OR(AND(NOT(ISERROR(RC7)), ISNUMBER(RC7)), AND(NOT(ISERROR(RC8)), ISNUMBER(RC8)), AND(NOT(ISERROR(RC9)), ISNUMBER(RC9)), AND(NOT(ISERROR(RC10)), ISNUMBER(RC10))), 1, 0) -> 0 | M471: =INDEX(Gross!R1C1:R46C51, RC1, 26) -> #REF! | N471: =INDEX(Gross!R1C1:R46C51, RC1, 27) -> #REF!
A472: 87 | B472: =INDEX(2001Grossed!R1C1:R46C51, RC[-1], 26) -> #REF! | C472: =INDEX(2001Grossed!R1C1:R46C51, RC1, 27) -> #REF! | D472: =IF(Menus!R9C10, RC[-1]/RC[-2], RC[-1]) -> #REF! | E472: =IF(RC11=1, RC[-3], NA()) -> #NA | F472: =INDEX(2001Grossed!R1C1:R46C51, RC1, 1) -> #REF! | G472: =IF(EQUAL(INDEX(2001Grossed!R1C1:R46C51, RC1, 2), R1C), RC4, NA()) -> #REF! | H472: =IF(EQUAL(INDEX(2001Grossed!R1C1:R46C51, RC1, 2), R1C), RC4, NA()) -> #REF! | I472: =IF(EQUAL(INDEX(2001Grossed!R1C1:R46C51, RC1, 2), R1C), RC4, NA()) -> #REF! | J472: =IF(EQUAL(INDEX(2001Grossed!R1C1:R46C51, RC1, 2), R1C), RC4, NA()) -> #REF! | K472: =IF(OR(AND(NOT(ISERROR(RC7)), ISNUMBER(RC7)), AND(NOT(ISERROR(RC8)), ISNUMBER(RC8)), AND(NOT(ISERROR(RC9)), ISNUMBER(RC9)), AND(NOT(ISERROR(RC10)), ISNUMBER(RC10))), 1, 0) -> 0 | M472: =INDEX(Gross!R1C1:R46C51, RC1, 26) -> #REF! | N472: =INDEX(Gross!R1C1:R46C51, RC1, 27) -> #REF!
A473: 123 | B473: =INDEX(2001Grossed!R1C1:R46C51, RC[-1], 26) -> #REF! | C473: =INDEX(2001Grossed!R1C1:R46C51, RC1, 27) -> #REF! | D473: =IF(Menus!R9C10, RC[-1]/RC[-2], RC[-1]) -> #REF! | E473: =IF(RC11=1, RC[-3], NA()) -> #NA | F473: =INDEX(2001Grossed!R1C1:R46C51, RC1, 1) -> #REF! | G473: =IF(EQUAL(INDEX(2001Grossed!R1C1:R46C51, RC1, 2), R1C), RC4, NA()) -> #REF! | H473: =IF(EQUAL(INDEX(2001Grossed!R1C1:R46C51, RC1, 2), R1C), RC4, NA()) -> #REF! | I473: =IF(EQUAL(INDEX(2001Grossed!R1C1:R46C51, RC1, 2), R1C), RC4, NA()) -> #REF! | J473: =IF(EQUAL(INDEX(2001Grossed!R1C1:R46C51, RC1, 2), R1C), RC4, NA()) -> #REF! | K473: =IF(OR(AND(NOT(ISERROR(RC7)), ISNUMBER(RC7)), AND(NOT(ISERROR(RC8)), ISNUMBER(RC8)), AND(NOT(ISERROR(RC9)), ISNUMBER(RC9)), AND(NOT(ISERROR(RC10)), ISNUMBER(RC10))), 1, 0) -> 0 | M473: =INDEX(Gross!R1C1:R46C51, RC1, 26) -> #REF! | N473: =INDEX(Gross!R1C1:R46C51, RC1, 27) -> #REF!
A474: 131 | B474: =INDEX(2001Grossed!R1C1:R46C51, RC[-1], 26) -> #REF! | C474: =INDEX(2001Grossed!R1C1:R46C51, RC1, 27) -> #REF! | D474: =IF(Menus!R9C10, RC[-1]/RC[-2], RC[-1]) -> #REF! | E474: =IF(RC11=1, RC[-3], NA()) -> #NA | F474: =INDEX(2001Grossed!R1C1:R46C51, RC1, 1) -> #REF! | G474: =IF(EQUAL(INDEX(2001Grossed!R1C1:R46C51, RC1, 2), R1C), RC4, NA()) -> #REF! | H474: =IF(EQUAL(INDEX(2001Grossed!R1C1:R46C51, RC1, 2), R1C), RC4, NA()) -> #REF! | I474: =IF(EQUAL(INDEX(2001Grossed!R1C1:R46C51, RC1, 2), R1C), RC4, NA()) -> #REF! | J474: =IF(EQUAL(INDEX(2001Grossed!R1C1:R46C51, RC1, 2), R1C), RC4, NA()) -> #REF! | K474: =IF(OR(AND(NOT(ISERROR(RC7)), ISNUMBER(RC7)), AND(NOT(ISERROR(RC8)), ISNUMBER(RC8)), AND(NOT(ISERROR(RC9)), ISNUMBER(RC9)), AND(NOT(ISERROR(RC10)), ISNUMBER(RC10))), 1, 0) -> 0 | M474: =INDEX(Gross!R1C1:R46C51, RC1, 26) -> #REF! | N474: =INDEX(Gross!R1C1:R46C51, RC1, 27) -> #REF!
A475: 127 | B475: =INDEX(2001Grossed!R1C1:R46C51, RC[-1], 26) -> #REF! | C475: =INDEX(2001Grossed!R1C1:R46C51, RC1, 27) -> #REF! | D475: =IF(Menus!R9C10, RC[-1]/RC[-2], RC[-1]) -> #REF! | E475: =IF(RC11=1, RC[-3], NA()) -> #NA | F475: =INDEX(2001Grossed!R1C1:R46C51, RC1, 1) -> #REF! | G475: =IF(EQUAL(INDEX(2001Grossed!R1C1:R46C51, RC1, 2), R1C), RC4, NA()) -> #REF! | H475: =IF(EQUAL(INDEX(2001Grossed!R1C1:R46C51, RC1, 2), R1C), RC4, NA()) -> #REF! | I475: =IF(EQUAL(INDEX(2001Grossed!R1C1:R46C51, RC1, 2), R1C), RC4, NA()) -> #REF! | J475: =IF(EQUAL(INDEX(2001Grossed!R1C1:R46C51, RC1, 2), R1C), RC4, NA()) -> #REF! | K475: =IF(OR(AND(NOT(ISERROR(RC7)), ISNUMBER(RC7)), AND(NOT(ISERROR(RC8)), ISNUMBER(RC8)), AND(NOT(ISERROR(RC9)), ISNUMBER(RC9)), AND(NOT(ISERROR(RC10)), ISNUMBER(RC10))), 1, 0) -> 0 | M475: =INDEX(Gross!R1C1:R46C51, RC1, 26) -> #REF! | N475: =INDEX(Gross!R1C1:R46C51, RC1, 27) -> #REF!
A476: 98 | B476: =INDEX(2001Grossed!R1C1:R46C51, RC[-1], 26) -> #REF! | C476: =INDEX(2001Grossed!R1C1:R46C51, RC1, 27) -> #REF! | D476: =IF(Menus!R9C10, RC[-1]/RC[-2], RC[-1]) -> #REF! | E476: =IF(RC11=1, RC[-3], NA()) -> #NA | F476: =INDEX(2001Grossed!R1C1:R46C51, RC1, 1) -> #REF! | G476: =IF(EQUAL(INDEX(2001Grossed!R1C1:R46C51, RC1, 2), R1C), RC4, NA()) -> #REF! | H476: =IF(EQUAL(INDEX(2001Grossed!R1C1:R46C51, RC1, 2), R1C), RC4, NA()) -> #REF! | I476: =IF(EQUAL(INDEX(2001Grossed!R1C1:R46C51, RC1, 2), R1C), RC4, NA()) -> #REF! | J476: =IF(EQUAL(INDEX(2001Grossed!R1C1:R46C51, RC1, 2), R1C), RC4, NA()) -> #REF! | K476: =IF(OR(AND(NOT(ISERROR(RC7)), ISNUMBER(RC7)), AND(NOT(ISERROR(RC8)), ISNUMBER(RC8)), AND(NOT(ISERROR(RC9)), ISNUMBER(RC9)), AND(NOT(ISERROR(RC10)), ISNUMBER(RC10))), 1, 0) -> 0 | M476: =INDEX(Gross!R1C1:R46C51, RC1, 26) -> #REF! | N476: =INDEX(Gross!R1C1:R46C51, RC1, 27) -> #REF!
A477: 118 | B477: =INDEX(2001Grossed!R1C1:R46C51, RC[-1], 26) -> #REF! | C477: =INDEX(2001Grossed!R1C1:R46C51, RC1, 27) -> #REF! | D477: =IF(Menus!R9C10, RC[-1]/RC[-2], RC[-1]) -> #REF! | E477: =IF(RC11=1, RC[-3], NA()) -> #NA | F477: =INDEX(2001Grossed!R1C1:R46C51, RC1, 1) -> #REF! | G477: =IF(EQUAL(INDEX(2001Grossed!R1C1:R46C51, RC1, 2), R1C), RC4, NA()) -> #REF! | H477: =IF(EQUAL(INDEX(2001Grossed!R1C1:R46C51, RC1, 2), R1C), RC4, NA()) -> #REF! | I477: =IF(EQUAL(INDEX(2001Grossed!R1C1:R46C51, RC1, 2), R1C), RC4, NA()) -> #REF! | J477: =IF(EQUAL(INDEX(2001Grossed!R1C1:R46C51, RC1, 2), R1C), RC4, NA()) -> #REF! | K477: =IF(OR(AND(NOT(ISERROR(RC7)), ISNUMBER(RC7)), AND(NOT(ISERROR(RC8)), ISNUMBER(RC8)), AND(NOT(ISERROR(RC9)), ISNUMBER(RC9)), AND(NOT(ISERROR(RC10)), ISNUMBER(RC10))), 1, 0) -> 0 | M477: =INDEX(Gross!R1C1:R46C51, RC1, 26) -> #REF! | N477: =INDEX(Gross!R1C1:R46C51, RC1, 27) -> #REF!
A478: 35 | B478: =INDEX(2001Grossed!R1C1:R46C51, RC[-1], 26) -> 3355 | C478: =INDEX(2001Grossed!R1C1:R46C51, RC1, 27) -> 167752600 | D478: =IF(Menus!R9C10, RC[-1]/RC[-2], RC[-1]) -> 50000.7749627422 | E478: =IF(RC11=1, RC[-3], NA()) -> #NA | F478: =INDEX(2001Grossed!R1C1:R46C51, RC1, 1) -> Australia | G478: =IF(EQUAL(INDEX(2001Grossed!R1C1:R46C51, RC1, 2), R1C), RC4, NA()) -> #NA | H478: =IF(EQUAL(INDEX(2001Grossed!R1C1:R46C51, RC1, 2), R1C), RC4, NA()) -> #NA | I478: =IF(EQUAL(INDEX(2001Grossed!R1C1:R46C51, RC1, 2), R1C), RC4, NA()) -> #NA | J478: =IF(EQUAL(INDEX(2001Grossed!R1C1:R46C51, RC1, 2), R1C), RC4, NA()) -> #NA | K478: =IF(OR(AND(NOT(ISERROR(RC7)), ISNUMBER(RC7)), AND(NOT(ISERROR(RC8)), ISNUMBER(RC8)), AND(NOT(ISERROR(RC9)), ISNUMBER(RC9)), AND(NOT(ISERROR(RC10)), ISNUMBER(RC10))), 1, 0) -> 0 | M478: =INDEX(Gross!R1C1:R46C51, RC1, 26) -> 2 | N478: =INDEX(Gross!R1C1:R46C51, RC1, 27) -> 2
A479: 38 | B479: =INDEX(2001Grossed!R1C1:R46C51, RC[-1], 26) -> 13349 | C479: =INDEX(2001Grossed!R1C1:R46C51, RC1, 27) -> 402701509 | D479: =IF(Menus!R9C10, RC[-1]/RC[-2], RC[-1]) -> 30167.166754064 | E479: =IF(RC11=1, RC[-3], NA()) -> #NA | F479: =INDEX(2001Grossed!R1C1:R46C51, RC1, 1) -> Canada | G479: =IF(EQUAL(INDEX(2001Grossed!R1C1:R46C51, RC1, 2), R1C), RC4, NA()) -> #NA | H479: =IF(EQUAL(INDEX(2001Grossed!R1C1:R46C51, RC1, 2), R1C), RC4, NA()) -> #NA | I479: =IF(EQUAL(INDEX(2001Grossed!R1C1:R46C51, RC1, 2), R1C), RC4, NA()) -> #NA | J479: =IF(EQUAL(INDEX(2001Grossed!R1C1:R46C51, RC1, 2), R1C), RC4, NA()) -> #NA | K479: =IF(OR(AND(NOT(ISERROR(RC7)), ISNUMBER(RC7)), AND(NOT(ISERROR(RC8)), ISNUMBER(RC8)), AND(NOT(ISERROR(RC9)), ISNUMBER(RC9)), AND(NOT(ISERROR(RC10)), ISNUMBER(RC10))), 1, 0) -> 0 | M479: =INDEX(Gross!R1C1:R46C51, RC1, 26) -> 1 | N479: =INDEX(Gross!R1C1:R46C51, RC1, 27) -> 1
A480: 43 | B480: =INDEX(2001Grossed!R1C1:R46C51, RC[-1], 26) -> 2452 | C480: =INDEX(2001Grossed!R1C1:R46C51, RC1, 27) -> 70333312 | D480: =IF(Menus!R9C10, RC[-1]/RC[-2], RC[-1]) -> 28684.0587275693 | E480: =IF(RC11=1, RC[-3], NA()) -> #NA | F480: =INDEX(2001Grossed!R1C1:R46C51, RC1, 1) -> EFTA - Total | G480: =IF(EQUAL(INDEX(2001Grossed!R1C1:R46C51, RC1, 2), R1C), RC4, NA()) -> #NA | H480: =IF(EQUAL(INDEX(2001Grossed!R1C1:R46C51, RC1, 2), R1C), RC4, NA()) -> #NA | I480: =IF(EQUAL(INDEX(2001Grossed!R1C1:R46C51, RC1, 2), R1C), RC4, NA()) -> #NA | J480: =IF(EQUAL(INDEX(2001Grossed!R1C1:R46C51, RC1, 2), R1C), RC4, NA()) -> #NA | K480: =IF(OR(AND(NOT(ISERROR(RC7)), ISNUMBER(RC7)), AND(NOT(ISERROR(RC8)), ISNUMBER(RC8)), AND(NOT(ISERROR(RC9)), ISNUMBER(RC9)), AND(NOT(ISERROR(RC10)), ISNUMBER(RC10))), 1, 0) -> 0 | M480: =INDEX(Gross!R1C1:R46C51, RC1, 26) -> 0 | N480: =INDEX(Gross!R1C1:R46C51, RC1, 27) -> 0
A481: 42 | B481: =INDEX(2001Grossed!R1C1:R46C51, RC[-1], 26) -> 47560 | C481: =INDEX(2001Grossed!R1C1:R46C51, RC1, 27) -> 1354514691 | D481: =IF(Menus!R9C10, RC[-1]/RC[-2], RC[-1]) -> 28480.1238645921 | E481: =IF(RC11=1, RC[-3], NA()) -> #NA | F481: =INDEX(2001Grossed!R1C1:R46C51, RC1, 1) -> EU - Total | G481: =IF(EQUAL(INDEX(2001Grossed!R1C1:R46C51, RC1, 2), R1C), RC4, NA()) -> #NA | H481: =IF(EQUAL(INDEX(2001Grossed!R1C1:R46C51, RC1, 2), R1C), RC4, NA()) -> #NA | I481: =IF(EQUAL(INDEX(2001Grossed!R1C1:R46C51, RC1, 2), R1C), RC4, NA()) -> #NA | J481: =IF(EQUAL(INDEX(2001Grossed!R1C1:R46C51, RC1, 2), R1C), RC4, NA()) -> #NA | K481: =IF(OR(AND(NOT(ISERROR(RC7)), ISNUMBER(RC7)), AND(NOT(ISERROR(RC8)), ISNUMBER(RC8)), AND(NOT(ISERROR(RC9)), ISNUMBER(RC9)), AND(NOT(ISERROR(RC10)), ISNUMBER(RC10))), 1, 0) -> 0 | M481: =INDEX(Gross!R1C1:R46C51, RC1, 26) -> 0 | N481: =INDEX(Gross!R1C1:R46C51, RC1, 27) -> 0
A482: 39 | B482: =INDEX(2001Grossed!R1C1:R46C51, RC[-1], 26) -> 991 | C482: =INDEX(2001Grossed!R1C1:R46C51, RC1, 27) -> 26738387 | D482: =IF(Menus!R9C10, RC[-1]/RC[-2], RC[-1]) -> 26981.2179616549 | E482: =IF(RC11=1, RC[-3], NA()) -> #NA | F482: =INDEX(2001Grossed!R1C1:R46C51, RC1, 1) -> New Zealand | G482: =IF(EQUAL(INDEX(2001Grossed!R1C1:R46C51, RC1, 2), R1C), RC4, NA()) -> #NA | H482: =IF(EQUAL(INDEX(2001Grossed!R1C1:R46C51, RC1, 2), R1C), RC4, NA()) -> #NA | I482: =IF(EQUAL(INDEX(2001Grossed!R1C1:R46C51, RC1, 2), R1C), RC4, NA()) -> #NA | J482: =IF(EQUAL(INDEX(2001Grossed!R1C1:R46C51, RC1, 2), R1C), RC4, NA()) -> #NA | K482: =IF(OR(AND(NOT(ISERROR(RC7)), ISNUMBER(RC7)), AND(NOT(ISERROR(RC8)), ISNUMBER(RC8)), AND(NOT(ISERROR(RC9)), ISNUMBER(RC9)), AND(NOT(ISERROR(RC10)), ISNUMBER(RC10))), 1, 0) -> 0 | M482: =INDEX(Gross!R1C1:R46C51, RC1, 26) -> 2 | N482: =INDEX(Gross!R1C1:R46C51, RC1, 27) -> 2
A483: 33 | B483: =INDEX(2001Grossed!R1C1:R46C51, RC[-1], 26) -> 96709 | C483: =INDEX(2001Grossed!R1C1:R46C51, RC1, 27) -> 2534637034 | D483: =IF(Menus!R9C10, RC[-1]/RC[-2], RC[-1]) -> 26208.9054172828 | E483: =IF(RC11=1, RC[-3], NA()) -> #NA | F483: =INDEX(2001Grossed!R1C1:R46C51, RC1, 1) -> USA | G483: =IF(EQUAL(INDEX(2001Grossed!R1C1:R46C51, RC1, 2), R1C), RC4, NA()) -> #NA | H483: =IF(EQUAL(INDEX(2001Grossed!R1C1:R46C51, RC1, 2), R1C), RC4, NA()) -> #NA | I483: =IF(EQUAL(INDEX(2001Grossed!R1C1:R46C51, RC1, 2), R1C), RC4, NA()) -> #NA | J483: =IF(EQUAL(INDEX(2001Grossed!R1C1:R46C51, RC1, 2), R1C), RC4, NA()) -> #NA | K483: =IF(OR(AND(NOT(ISERROR(RC7)), ISNUMBER(RC7)), AND(NOT(ISERROR(RC8)), ISNUMBER(RC8)), AND(NOT(ISERROR(RC9)), ISNUMBER(RC9)), AND(NOT(ISERROR(RC10)), ISNUMBER(RC10))), 1, 0) -> 0 | M483: =INDEX(Gross!R1C1:R46C51, RC1, 26) -> 1 | N483: =INDEX(Gross!R1C1:R46C51, RC1, 27) -> 1
A484: 44 | B484: =INDEX(2001Grossed!R1C1:R46C51, RC[-1], 26) -> 138257 | C484: =INDEX(2001Grossed!R1C1:R46C51, RC1, 27) -> 3544120087 | D484: =IF(Menus!R9C10, RC[-1]/RC[-2], RC[-1]) -> 25634.2903939764 | E484: =IF(RC11=1, RC[-3], NA()) -> #NA | F484: =INDEX(2001Grossed!R1C1:R46C51, RC1, 1) -> World A - Total | G484: =IF(EQUAL(INDEX(2001Grossed!R1C1:R46C51, RC1, 2), R1C), RC4, NA()) -> #NA | H484: =IF(EQUAL(INDEX(2001Grossed!R1C1:R46C51, RC1, 2), R1C), RC4, NA()) -> #NA | I484: =IF(EQUAL(INDEX(2001Grossed!R1C1:R46C51, RC1, 2), R1C), RC4, NA()) -> #NA | J484: =IF(EQUAL(INDEX(2001Grossed!R1C1:R46C51, RC1, 2), R1C), RC4, NA()) -> #NA | K484: =IF(OR(AND(NOT(ISERROR(RC7)), ISNUMBER(RC7)), AND(NOT(ISERROR(RC8)), ISNUMBER(RC8)), AND(NOT(ISERROR(RC9)), ISNUMBER(RC9)), AND(NOT(ISERROR(RC10)), ISNUMBER(RC10))), 1, 0) -> 0 | M484: =INDEX(Gross!R1C1:R46C51, RC1, 26) -> 0 | N484: =INDEX(Gross!R1C1:R46C51, RC1, 27) -> 0
A485: 37 | B485: =INDEX(2001Grossed!R1C1:R46C51, RC[-1], 26) -> 9443 | C485: =INDEX(2001Grossed!R1C1:R46C51, RC1, 27) -> 195146717 | D485: =IF(Menus!R9C10, RC[-1]/RC[-2], RC[-1]) -> 20665.7542094673 | E485: =IF(RC11=1, RC[-3], NA()) -> #NA | F485: =INDEX(2001Grossed!R1C1:R46C51, RC1, 1) -> Korea | G485: =IF(EQUAL(INDEX(2001Grossed!R1C1:R46C51, RC1, 2), R1C), RC4, NA()) -> #NA | H485: =IF(EQUAL(INDEX(2001Grossed!R1C1:R46C51, RC1, 2), R1C), RC4, NA()) -> #NA | I485: =IF(EQUAL(INDEX(2001Grossed!R1C1:R46C51, RC1, 2), R1C), RC4, NA()) -> #NA | J485: =IF(EQUAL(INDEX(2001Grossed!R1C1:R46C51, RC1, 2), R1C), RC4, NA()) -> #NA | K485: =IF(OR(AND(NOT(ISERROR(RC7)), ISNUMBER(RC7)), AND(NOT(ISERROR(RC8)), ISNUMBER(RC8)), AND(NOT(ISERROR(RC9)), ISNUMBER(RC9)), AND(NOT(ISERROR(RC10)), ISNUMBER(RC10))), 1, 0) -> 0 | M485: =INDEX(Gross!R1C1:R46C51, RC1, 26) -> 2 | N485: =INDEX(Gross!R1C1:R46C51, RC1, 27) -> 2
A486: 36 | B486: =INDEX(2001Grossed!R1C1:R46C51, RC[-1], 26) -> 14410 | C486: =INDEX(2001Grossed!R1C1:R46C51, RC1, 27) -> 217143840 | D486: =IF(Menus!R9C10, RC[-1]/RC[-2], RC[-1]) -> 15068.9687716863 | E486: =IF(RC11=1, RC[-3], NA()) -> #NA | F486: =INDEX(2001Grossed!R1C1:R46C51, RC1, 1) -> Japan | G486: =IF(EQUAL(INDEX(2001Grossed!R1C1:R46C51, RC1, 2), R1C), RC4, NA()) -> #NA | H486: =IF(EQUAL(INDEX(2001Grossed!R1C1:R46C51, RC1, 2), R1C), RC4, NA()) -> #NA | I486: =IF(EQUAL(INDEX(2001Grossed!R1C1:R46C51, RC1, 2), R1C), RC4, NA()) -> #NA | J486: =IF(EQUAL(INDEX(2001Grossed!R1C1:R46C51, RC1, 2), R1C), RC4, NA()) -> #NA | K486: =IF(OR(AND(NOT(ISERROR(RC7)), ISNUMBER(RC7)), AND(NOT(ISERROR(RC8)), ISNUMBER(RC8)), AND(NOT(ISERROR(RC9)), ISNUMBER(RC9)), AND(NOT(ISERROR(RC10)), ISNUMBER(RC10))), 1, 0) -> 0 | M486: =INDEX(Gross!R1C1:R46C51, RC1, 26) -> 0 | N486: =INDEX(Gross!R1C1:R46C51, RC1, 27) -> 1
A487: 4 | B487: =INDEX(2001Grossed!R1C1:R46C51, RC[-1], 26) -> 578 | C487: =INDEX(2001Grossed!R1C1:R46C51, RC1, 27) -> 2398155 | D487: =IF(Menus!R9C10, RC[-1]/RC[-2], RC[-1]) -> 4149.05709342561 | E487: =IF(RC11=1, RC[-3], NA()) -> #NA | F487: =INDEX(2001Grossed!R1C1:R46C51, RC1, 1) -> Estonia | G487: =IF(EQUAL(INDEX(2001Grossed!R1C1:R46C51, RC1, 2), R1C), RC4, NA()) -> #NA | H487: =IF(EQUAL(INDEX(2001Grossed!R1C1:R46C51, RC1, 2), R1C), RC4, NA()) -> #NA | I487: =IF(EQUAL(INDEX(2001Grossed!R1C1:R46C51, RC1, 2), R1C), RC4, NA()) -> #NA | J487: =IF(EQUAL(INDEX(2001Grossed!R1C1:R46C51, RC1, 2), R1C), RC4, NA()) -> #NA | K487: =IF(OR(AND(NOT(ISERROR(RC7)), ISNUMBER(RC7)), AND(NOT(ISERROR(RC8)), ISNUMBER(RC8)), AND(NOT(ISERROR(RC9)), ISNUMBER(RC9)), AND(NOT(ISERROR(RC10)), ISNUMBER(RC10))), 1, 0) -> 0 | M487: =INDEX(Gross!R1C1:R46C51, RC1, 26) -> 0 | N487: =INDEX(Gross!R1C1:R46C51, RC1, 27) -> 0
A488: 3 | B488: =INDEX(2001Grossed!R1C1:R46C51, RC[-1], 26) -> 767 | C488: =INDEX(2001Grossed!R1C1:R46C51, RC1, 27) -> 2673385 | D488: =IF(Menus!R9C10, RC[-1]/RC[-2], RC[-1]) -> 3485.50847457627 | E488: =IF(RC11=1, RC[-3], NA()) -> #NA | F488: =INDEX(2001Grossed!R1C1:R46C51, RC1, 1) -> Czech Republic | G488: =IF(EQUAL(INDEX(2001Grossed!R1C1:R46C51, RC1, 2), R1C), RC4, NA()) -> #NA | H488: =IF(EQUAL(INDEX(2001Grossed!R1C1:R46C51, RC1, 2), R1C), RC4, NA()) -> #NA | I488: =IF(EQUAL(INDEX(2001Grossed!R1C1:R46C51, RC1, 2), R1C), RC4, NA()) -> #NA | J488: =IF(EQUAL(INDEX(2001Grossed!R1C1:R46C51, RC1, 2), R1C), RC4, NA()) -> #NA | K488: =IF(OR(AND(NOT(ISERROR(RC7)), ISNUMBER(RC7)), AND(NOT(ISERROR(RC8)), ISNUMBER(RC8)), AND(NOT(ISERROR(RC9)), ISNUMBER(RC9)), AND(NOT(ISERROR(RC10)), ISNUMBER(RC10))), 1, 0) -> 0 | M488: =INDEX(Gross!R1C1:R46C51, RC1, 26) -> 0 | N488: =INDEX(Gross!R1C1:R46C51, RC1, 27) -> 2
A489: 5 | B489: =INDEX(2001Grossed!R1C1:R46C51, RC[-1], 26) -> 1401 | C489: =INDEX(2001Grossed!R1C1:R46C51, RC1, 27) -> 4490076 | D489: =IF(Menus!R9C10, RC[-1]/RC[-2], RC[-1]) -> 3204.90792291221 | E489: =IF(RC11=1, RC[-3], NA()) -> #NA | F489: =INDEX(2001Grossed!R1C1:R46C51, RC1, 1) -> Hungary | G489: =IF(EQUAL(INDEX(2001Grossed!R1C1:R46C51, RC1, 2), R1C), RC4, NA()) -> #NA | H489: =IF(EQUAL(INDEX(2001Grossed!R1C1:R46C51, RC1, 2), R1C), RC4, NA()) -> #NA | I489: =IF(EQUAL(INDEX(2001Grossed!R1C1:R46C51, RC1, 2), R1C), RC4, NA()) -> #NA | J489: =IF(EQUAL(INDEX(2001Grossed!R1C1:R46C51, RC1, 2), R1C), RC4, NA()) -> #NA | K489: =IF(OR(AND(NOT(ISERROR(RC7)), ISNUMBER(RC7)), AND(NOT(ISERROR(RC8)), ISNUMBER(RC8)), AND(NOT(ISERROR(RC9)), ISNUMBER(RC9)), AND(NOT(ISERROR(RC10)), ISNUMBER(RC10))), 1, 0) -> 0 | M489: =INDEX(Gross!R1C1:R46C51, RC1, 26) -> 1 | N489: =INDEX(Gross!R1C1:R46C51, RC1, 27) -> 1
A490: 11 | B490: =INDEX(2001Grossed!R1C1:R46C51, RC[-1], 26) -> 356 | C490: =INDEX(2001Grossed!R1C1:R46C51, RC1, 27) -> 1005555 | D490: =IF(Menus!R9C10, RC[-1]/RC[-2], RC[-1]) -> 2824.59269662921 | E490: =IF(RC11=1, RC[-3], NA()) -> #NA | F490: =INDEX(2001Grossed!R1C1:R46C51, RC1, 1) -> Slovenia | G490: =IF(EQUAL(INDEX(2001Grossed!R1C1:R46C51, RC1, 2), R1C), RC4, NA()) -> #NA | H490: =IF(EQUAL(INDEX(2001Grossed!R1C1:R46C51, RC1, 2), R1C), RC4, NA()) -> #NA | I490: =IF(EQUAL(INDEX(2001Grossed!R1C1:R46C51, RC1, 2), R1C), RC4, NA()) -> #NA | J490: =IF(EQUAL(INDEX(2001Grossed!R1C1:R46C51, RC1, 2), R1C), RC4, NA()) -> #NA | K490: =IF(OR(AND(NOT(ISERROR(RC7)), ISNUMBER(RC7)), AND(NOT(ISERROR(RC8)), ISNUMBER(RC8)), AND(NOT(ISERROR(RC9)), ISNUMBER(RC9)), AND(NOT(ISERROR(RC10)), ISNUMBER(RC10))), 1, 0) -> 0 | M490: =INDEX(Gross!R1C1:R46C51, RC1, 26) -> 0 | N490: =INDEX(Gross!R1C1:R46C51, RC1, 27) -> 1
A491: 6 | B491: =INDEX(2001Grossed!R1C1:R46C51, RC[-1], 26) -> 405 | C491: =INDEX(2001Grossed!R1C1:R46C51, RC1, 27) -> 1106524 | D491: =IF(Menus!R9C10, RC[-1]/RC[-2], RC[-1]) -> 2732.15802469136 | E491: =IF(RC11=1, RC[-3], NA()) -> #NA | F491: =INDEX(2001Grossed!R1C1:R46C51, RC1, 1) -> Latvia | G491: =IF(EQUAL(INDEX(2001Grossed!R1C1:R46C51, RC1, 2), R1C), RC4, NA()) -> #NA | H491: =IF(EQUAL(INDEX(2001Grossed!R1C1:R46C51, RC1, 2), R1C), RC4, NA()) -> #NA | I491: =IF(EQUAL(INDEX(2001Grossed!R1C1:R46C51, RC1, 2), R1C), RC4, NA()) -> #NA | J491: =IF(EQUAL(INDEX(2001Grossed!R1C1:R46C51, RC1, 2), R1C), RC4, NA()) -> #NA | K491: =IF(OR(AND(NOT(ISERROR(RC7)), ISNUMBER(RC7)), AND(NOT(ISERROR(RC8)), ISNUMBER(RC8)), AND(NOT(ISERROR(RC9)), ISNUMBER(RC9)), AND(NOT(ISERROR(RC10)), ISNUMBER(RC10))), 1, 0) -> 0 | M491: =INDEX(Gross!R1C1:R46C51, RC1, 26) -> 0 | N491: =INDEX(Gross!R1C1:R46C51, RC1, 27) -> 0
A492: 7 | B492: =INDEX(2001Grossed!R1C1:R46C51, RC[-1], 26) -> 686 | C492: =INDEX(2001Grossed!R1C1:R46C51, RC1, 27) -> 1856644 | D492: =IF(Menus!R9C10, RC[-1]/RC[-2], RC[-1]) -> 2706.47813411079 | E492: =IF(RC11=1, RC[-3], NA()) -> #NA | F492: =INDEX(2001Grossed!R1C1:R46C51, RC1, 1) -> Lithuania | G492: =IF(EQUAL(INDEX(2001Grossed!R1C1:R46C51, RC1, 2), R1C), RC4, NA()) -> #NA | H492: =IF(EQUAL(INDEX(2001Grossed!R1C1:R46C51, RC1, 2), R1C), RC4, NA()) -> #NA | I492: =IF(EQUAL(INDEX(2001Grossed!R1C1:R46C51, RC1, 2), R1C), RC4, NA()) -> #NA | J492: =IF(EQUAL(INDEX(2001Grossed!R1C1:R46C51, RC1, 2), R1C), RC4, NA()) -> #NA | K492: =IF(OR(AND(NOT(ISERROR(RC7)), ISNUMBER(RC7)), AND(NOT(ISERROR(RC8)), ISNUMBER(RC8)), AND(NOT(ISERROR(RC9)), ISNUMBER(RC9)), AND(NOT(ISERROR(RC10)), ISNUMBER(RC10))), 1, 0) -> 0 | M492: =INDEX(Gross!R1C1:R46C51, RC1, 26) -> 0 | N492: =INDEX(Gross!R1C1:R46C51, RC1, 27) -> 0
A493: 46 | B493: =INDEX(2001Grossed!R1C1:R46C51, RC[-1], 26) -> 11413 | C493: =INDEX(2001Grossed!R1C1:R46C51, RC1, 27) -> 28300167 | D493: =IF(Menus!R9C10, RC[-1]/RC[-2], RC[-1]) -> 2479.64312625953 | E493: =IF(RC11=1, RC[-3], NA()) -> #NA | F493: =INDEX(2001Grossed!R1C1:R46C51, RC1, 1) -> EU Accession Countries - Totals | G493: =IF(EQUAL(INDEX(2001Grossed!R1C1:R46C51, RC1, 2), R1C), RC4, NA()) -> #NA | H493: =IF(EQUAL(INDEX(2001Grossed!R1C1:R46C51, RC1, 2), R1C), RC4, NA()) -> #NA | I493: =IF(EQUAL(INDEX(2001Grossed!R1C1:R46C51, RC1, 2), R1C), RC4, NA()) -> #NA | J493: =IF(EQUAL(INDEX(2001Grossed!R1C1:R46C51, RC1, 2), R1C), RC4, NA()) -> #NA | K493: =IF(OR(AND(NOT(ISERROR(RC7)), ISNUMBER(RC7)), AND(NOT(ISERROR(RC8)), ISNUMBER(RC8)), AND(NOT(ISERROR(RC9)), ISNUMBER(RC9)), AND(NOT(ISERROR(RC10)), ISNUMBER(RC10))), 1, 0) -> 0 | M493: =INDEX(Gross!R1C1:R46C51, RC1, 26) -> 0 | N493: =INDEX(Gross!R1C1:R46C51, RC1, 27) -> 0
A494: 10 | B494: =INDEX(2001Grossed!R1C1:R46C51, RC[-1], 26) -> 498 | C494: =INDEX(2001Grossed!R1C1:R46C51, RC1, 27) -> 1189740 | D494: =IF(Menus!R9C10, RC[-1]/RC[-2], RC[-1]) -> 2389.03614457831 | E494: =IF(RC11=1, RC[-3], NA()) -> #NA | F494: =INDEX(2001Grossed!R1C1:R46C51, RC1, 1) -> Slovak Rep | G494: =IF(EQUAL(INDEX(2001Grossed!R1C1:R46C51, RC1, 2), R1C), RC4, NA()) -> #NA | H494: =IF(EQUAL(INDEX(2001Grossed!R1C1:R46C51, RC1, 2), R1C), RC4, NA()) -> #NA | I494: =IF(EQUAL(INDEX(2001Grossed!R1C1:R46C51, RC1, 2), R1C), RC4, NA()) -> #NA | J494: =IF(EQUAL(INDEX(2001Grossed!R1C1:R46C51, RC1, 2), R1C), RC4, NA()) -> #NA | K494: =IF(OR(AND(NOT(ISERROR(RC7)), ISNUMBER(RC7)), AND(NOT(ISERROR(RC8)), ISNUMBER(RC8)), AND(NOT(ISERROR(RC9)), ISNUMBER(RC9)), AND(NOT(ISERROR(RC10)), ISNUMBER(RC10))), 1, 0) -> 0 | M494: =INDEX(Gross!R1C1:R46C51, RC1, 26) -> 0 | N494: =INDEX(Gross!R1C1:R46C51, RC1, 27) -> 0
A495: 41 | B495: =INDEX(2001Grossed!R1C1:R46C51, RC[-1], 26) -> 15703 | C495: =INDEX(2001Grossed!R1C1:R46C51, RC1, 27) -> 33263888 | D495: =IF(Menus!R9C10, RC[-1]/RC[-2], RC[-1]) -> 2118.31420747628 | E495: =IF(RC11=1, RC[-3], NA()) -> #NA | F495: =INDEX(2001Grossed!R1C1:R46C51, RC1, 1) -> CEE - Total | G495: =IF(EQUAL(INDEX(2001Grossed!R1C1:R46C51, RC1, 2), R1C), RC4, NA()) -> #NA | H495: =IF(EQUAL(INDEX(2001Grossed!R1C1:R46C51, RC1, 2), R1C), RC4, NA()) -> #NA | I495: =IF(EQUAL(INDEX(2001Grossed!R1C1:R46C51, RC1, 2), R1C), RC4, NA()) -> #NA | J495: =IF(EQUAL(INDEX(2001Grossed!R1C1:R46C51, RC1, 2), R1C), RC4, NA()) -> #NA | K495: =IF(OR(AND(NOT(ISERROR(RC7)), ISNUMBER(RC7)), AND(NOT(ISERROR(RC8)), ISNUMBER(RC8)), AND(NOT(ISERROR(RC9)), ISNUMBER(RC9)), AND(NOT(ISERROR(RC10)), ISNUMBER(RC10))), 1, 0) -> 0 | M495: =INDEX(Gross!R1C1:R46C51, RC1, 26) -> 0 | N495: =INDEX(Gross!R1C1:R46C51, RC1, 27) -> 0
A496: 34 | B496: =INDEX(2001Grossed!R1C1:R46C51, RC[-1], 26) -> 1518 | C496: =INDEX(2001Grossed!R1C1:R46C51, RC1, 27) -> 2938235 | D496: =IF(Menus!R9C10, RC[-1]/RC[-2], RC[-1]) -> 1935.59617918314 | E496: =IF(RC11=1, RC[-3], NA()) -> #NA | F496: =INDEX(2001Grossed!R1C1:R46C51, RC1, 1) -> Turkey | G496: =IF(EQUAL(INDEX(2001Grossed!R1C1:R46C51, RC1, 2), R1C), RC4, NA()) -> #NA | H496: =IF(EQUAL(INDEX(2001Grossed!R1C1:R46C51, RC1, 2), R1C), RC4, NA()) -> #NA | I496: =IF(EQUAL(INDEX(2001Grossed!R1C1:R46C51, RC1, 2), R1C), RC4, NA()) -> #NA | J496: =IF(EQUAL(INDEX(2001Grossed!R1C1:R46C51, RC1, 2), R1C), RC4, NA()) -> #NA | K496: =IF(OR(AND(NOT(ISERROR(RC7)), ISNUMBER(RC7)), AND(NOT(ISERROR(RC8)), ISNUMBER(RC8)), AND(NOT(ISERROR(RC9)), ISNUMBER(RC9)), AND(NOT(ISERROR(RC10)), ISNUMBER(RC10))), 1, 0) -> 0 | M496: =INDEX(Gross!R1C1:R46C51, RC1, 26) -> 2 | N496: =INDEX(Gross!R1C1:R46C51, RC1, 27) -> 2
A497: 45 | B497: =INDEX(2001Grossed!R1C1:R46C51, RC[-1], 26) -> 3740 | C497: =INDEX(2001Grossed!R1C1:R46C51, RC1, 27) -> 6618301 | D497: =IF(Menus!R9C10, RC[-1]/RC[-2], RC[-1]) -> 1769.59919786096 | E497: =IF(RC11=1, RC[-3], NA()) -> #NA | F497: =INDEX(2001Grossed!R1C1:R46C51, RC1, 1) -> World B - Total | G497: =IF(EQUAL(INDEX(2001Grossed!R1C1:R46C51, RC1, 2), R1C), RC4, NA()) -> #NA | H497: =IF(EQUAL(INDEX(2001Grossed!R1C1:R46C51, RC1, 2), R1C), RC4, NA()) -> #NA | I497: =IF(EQUAL(INDEX(2001Grossed!R1C1:R46C51, RC1, 2), R1C), RC4, NA()) -> #NA | J497: =IF(EQUAL(INDEX(2001Grossed!R1C1:R46C51, RC1, 2), R1C), RC4, NA()) -> #NA | K497: =IF(OR(AND(NOT(ISERROR(RC7)), ISNUMBER(RC7)), AND(NOT(ISERROR(RC8)), ISNUMBER(RC8)), AND(NOT(ISERROR(RC9)), ISNUMBER(RC9)), AND(NOT(ISERROR(RC10)), ISNUMBER(RC10))), 1, 0) -> 0 | M497: =INDEX(Gross!R1C1:R46C51, RC1, 26) -> 0 | N497: =INDEX(Gross!R1C1:R46C51, RC1, 27) -> 0
A498: 9 | B498: =INDEX(2001Grossed!R1C1:R46C51, RC[-1], 26) -> 3655 | C498: =INDEX(2001Grossed!R1C1:R46C51, RC1, 27) -> 6382567 | D498: =IF(Menus!R9C10, RC[-1]/RC[-2], RC[-1]) -> 1746.25636114911 | E498: =IF(RC11=1, RC[-3], NA()) -> #NA | F498: =INDEX(2001Grossed!R1C1:R46C51, RC1, 1) -> Romania | G498: =IF(EQUAL(INDEX(2001Grossed!R1C1:R46C51, RC1, 2), R1C), RC4, NA()) -> #NA | H498: =IF(EQUAL(INDEX(2001Grossed!R1C1:R46C51, RC1, 2), R1C), RC4, NA()) -> #NA | I498: =IF(EQUAL(INDEX(2001Grossed!R1C1:R46C51, RC1, 2), R1C), RC4, NA()) -> #NA | J498: =IF(EQUAL(INDEX(2001Grossed!R1C1:R46C51, RC1, 2), R1C), RC4, NA()) -> #NA | K498: =IF(OR(AND(NOT(ISERROR(RC7)), ISNUMBER(RC7)), AND(NOT(ISERROR(RC8)), ISNUMBER(RC8)), AND(NOT(ISERROR(RC9)), ISNUMBER(RC9)), AND(NOT(ISERROR(RC10)), ISNUMBER(RC10))), 1, 0) -> 0 | M498: =INDEX(Gross!R1C1:R46C51, RC1, 26) -> 2 | N498: =INDEX(Gross!R1C1:R46C51, RC1, 27) -> 2
A499: 8 | B499: =INDEX(2001Grossed!R1C1:R46C51, RC[-1], 26) -> 6549 | C499: =INDEX(2001Grossed!R1C1:R46C51, RC1, 27) -> 11210209 | D499: =IF(Menus!R9C10, RC[-1]/RC[-2], RC[-1]) -> 1711.74362498091 | E499: =IF(RC11=1, RC[-3], NA()) -> #NA | F499: =INDEX(2001Grossed!R1C1:R46C51, RC1, 1) -> Poland | G499: =IF(EQUAL(INDEX(2001Grossed!R1C1:R46C51, RC1, 2), R1C), RC4, NA()) -> #NA | H499: =IF(EQUAL(INDEX(2001Grossed!R1C1:R46C51, RC1, 2), R1C), RC4, NA()) -> #NA | I499: =IF(EQUAL(INDEX(2001Grossed!R1C1:R46C51, RC1, 2), R1C), RC4, NA()) -> #NA | J499: =IF(EQUAL(INDEX(2001Grossed!R1C1:R46C51, RC1, 2), R1C), RC4, NA()) -> #NA | K499: =IF(OR(AND(NOT(ISERROR(RC7)), ISNUMBER(RC7)), AND(NOT(ISERROR(RC8)), ISNUMBER(RC8)), AND(NOT(ISERROR(RC9)), ISNUMBER(RC9)), AND(NOT(ISERROR(RC10)), ISNUMBER(RC10))), 1, 0) -> 0 | M499: =INDEX(Gross!R1C1:R46C51, RC1, 26) -> 2 | N499: =INDEX(Gross!R1C1:R46C51, RC1, 27) -> 2
A500: 40 | B500: =INDEX(2001Grossed!R1C1:R46C51, RC[-1], 26) -> 2222 | C500: =INDEX(2001Grossed!R1C1:R46C51, RC1, 27) -> 3680066 | D500: =IF(Menus!R9C10, RC[-1]/RC[-2], RC[-1]) -> 1656.19531953195 | E500: =IF(RC11=1, RC[-3], NA()) -> #NA | F500: =INDEX(2001Grossed!R1C1:R46C51, RC1, 1) -> Mexico | G500: =IF(EQUAL(INDEX(2001Grossed!R1C1:R46C51, RC1, 2), R1C), RC4, NA()) -> #NA | H500: =IF(EQUAL(INDEX(2001Grossed!R1C1:R46C51, RC1, 2), R1C), RC4, NA()) -> #NA | I500: =IF(EQUAL(INDEX(2001Grossed!R1C1:R46C51, RC1, 2), R1C), RC4, NA()) -> #NA | J500: =IF(EQUAL(INDEX(2001Grossed!R1C1:R46C51, RC1, 2), R1C), RC4, NA()) -> #NA | K500: =IF(OR(AND(NOT(ISERROR(RC7)), ISNUMBER(RC7)), AND(NOT(ISERROR(RC8)), ISNUMBER(RC8)), AND(NOT(ISERROR(RC9)), ISNUMBER(RC9)), AND(NOT(ISERROR(RC10)), ISNUMBER(RC10))), 1, 0) -> 0 | M500: =INDEX(Gross!R1C1:R46C51, RC1, 26) -> 2 | N500: =INDEX(Gross!R1C1:R46C51, RC1, 27) -> 2
A501: 2 | B501: =INDEX(2001Grossed!R1C1:R46C51, RC[-1], 26) -> 808 | C501: =INDEX(2001Grossed!R1C1:R46C51, RC1, 27) -> 951033 | D501: =IF(Menus!R9C10, RC[-1]/RC[-2], RC[-1]) -> 1177.02103960396 | E501: =IF(RC11=1, RC[-3], NA()) -> #NA | F501: =INDEX(2001Grossed!R1C1:R46C51, RC1, 1) -> Bulgaria | G501: =IF(EQUAL(INDEX(2001Grossed!R1C1:R46C51, RC1, 2), R1C), RC4, NA()) -> #NA | H501: =IF(EQUAL(INDEX(2001Grossed!R1C1:R46C51, RC1, 2), R1C), RC4, NA()) -> #NA | I501: =IF(EQUAL(INDEX(2001Grossed!R1C1:R46C51, RC1, 2), R1C), RC4, NA()) -> #NA | J501: =IF(EQUAL(INDEX(2001Grossed!R1C1:R46C51, RC1, 2), R1C), RC4, NA()) -> #NA | K501: =IF(OR(AND(NOT(ISERROR(RC7)), ISNUMBER(RC7)), AND(NOT(ISERROR(RC8)), ISNUMBER(RC8)), AND(NOT(ISERROR(RC9)), ISNUMBER(RC9)), AND(NOT(ISERROR(RC10)), ISNUMBER(RC10))), 1, 0) -> 0 | M501: =INDEX(Gross!R1C1:R46C51, RC1, 26) -> 1 | N501: =INDEX(Gross!R1C1:R46C51, RC1, 27) -> 1

Sheet: Dialogbox
B24: 'Totals include figures for all countries covered by LibEcon
B25: 'The year 2001 grossed shows real and grossed data based on previous years returns and country type averages
B26: 'To view data quality see 'Ranking' sheet
B27: 'All totals for all years shown relate to grossed data
B28: 'EU Accession Country Totals included estimates for Cyprus and Malta
B30: 'This introductory section gives a short overview of the Belgian institutional
B31: 'structure in order to help understanding the way libraries are organized in
B32: 'Belgium.
B33: 'The reforms of the State implemented in 1980, 1988, 1993 and 2001 have led to
B34: 'Belgium being turned into a federal country. Belgium consists of three geographical
B35: '(and economic) regions - the Flemish Region, the Walloon Region and the Brussels-
B36: 'Capital Region - and three cultural communities - the Flemish Community (Vlaamse
B38: 'speaking Community. The three cultural (and speech) communities are a product of
B39: 'history: the country is situated at the junction between the Latin and Germanic
B40: 'languages: French, Dutch and German.
B42: 'As a result of the reforms, the decision-making power is no longer exclusively in the
B43: 'hands of the Federal Parliament and the Federal Government. Each of the
B44: 'Communities and Regions has a Parliament and a Government too.
B46: 'The Communities are essentially competent for culture (including museums, libraries
B47: 'and archives) and education and the so-called personalized matters related to health
B48: 'policy (health care policy and health education) and to assistance to individuals
B49: '(family, youth, elderly, etc). The Regions are responsible in particular for the fields of
B50: 'the economy, energy (nuclear energy remains, however, a federal competence),
B51: 'public works, agriculture, the environment and transport. The federal authority retains
B52: 'among others: the foreign affairs, defence, justice, finances, social security, important
B53: 'sectors of public health and domestic affairs, etc. It supports also the activities of a
B54: 'series of federal scientific and cultural institutions.
B56: 'Organisational framework for the libraries
B57: 'The public competences in the sector of libraries are widely spread among the federal
B58: 'entities. Except the Royal Library (and the libraries of the federal scientific and cultural
B59: 'institutions) which is placed under the responsibility of the Belgian Federal Science
B60: 'Policy Office, the other scientific and public libraries lie with the Flemish, French and
B61: 'German-speaking Communities or even with the provincial and local authorities.
B63: 'The policies regarding public libraries are defined since 1978 by Community decrees
B64: 'and implemented by a special administration for public libraries located within the
B65: 'ministries of Culture of the Communities. Higher Councils for public libraries (advisory
B66: 'bodies) have also been installed in the Flemish and the French Communities.
B68: 'The university libraries are placed under the authority of the leading bodies of each
B69: 'university. There is no central administration responsible at Community level for these
B70: 'libraries.

Sheet: Help
J1: 'Information included within the LIBECON database
B3: 'DATA STRUCTURE | J3: 'Shown in order of appearance on database and questionnaire
B5: 'Data is split into 6 sheets all with the same data structure and order.
B6: 'The data includes the 5 years of data 1997 to 2001. Also included is 'Grossed' data for 2001, this
B7: 'shows 'real' submitted data, data estimated from previous years submissions or data based on | J7: 'NON-FINANCIAL INFORMATION
B9: 'explanation is given in the 'Data types' section of this help sheet. | J9: 'Potential Population Served '000s (this will vary with library sector)
B11: 'The data is set out in the order of the questionnaires, with population (000's) in the first data column. | I11: 'LIBRARIES:
B12: 'The non-financial data comes first with the financial data following. | J12: 'Total Administrative Units
J13: 'Service Points
B14: '"World B". For a list of the country groups click here.
I15: 'COLLECTIONS:
J16: 'Books & Bound Periodicals
J17: 'Current Periodicals - Titles
J18: 'Current Periodicals - Subscriptions
B19: 'The Y value will show up on the Histogram (or bar chart) or can be shown divided by the X value | J19: 'Manuscripts
J20: 'Microforms
J21: 'Audio-visual Materials
J22: 'CD-ROMs
B23: 'Add trendline'.
I24: 'ADDITIONS:
J25: 'Books & Bound Periodicals
B26: 'y value, or y divided by x if the 'y/x plot' box is ticked. | J26: 'Audio-visual Materials
I28: 'FACILITIES & SERVICES:
J29: 'Percentage Stock on Open Access
B30: 'CHANGING COMPARATOR GROUPS | J30: 'Percentage Catalogue Records Automated
J31: 'Number of Workstations for users
J32: '- Number connected to the internet (included above)
B33: 'sheet. Then the relevant Country Type(s) needs to be changed as required on the Dialogbox sheet.
B34: 'Press the 'Update Type' to display the new options before reusing the model. | I34: 'USE AND USERS:
J35: 'Registered Users
B36: 'This may be useful for identifying regions such as; 'Baltic States' , 'Eastern Europe' etc. or for | J36: 'Loan Transactions / Consultations
B37: 'singling out individual countries to be shown. | J37: 'Number of Visits
B39: 'As an example, copy highlighted column in row D by pressing this button.
J40: 'Potential Total Population Served
J42: 'NUMBER OF STAFF
I44: 'LIBRARY STAFF (Full-time equivalent):
B45: 'USER NOTES | J45: 'Trained Librarians
J46: 'Other Library Staff
J47: 'Total Staff
J49: 'FINANCIAL INFORMATION
B50: 'column at the end of the database. Editing cells, copying, pasting, and sorting columns or rows is
B52: 'other worksheets refer to them, and moving or inserting columns and rows will affect the formulae.
J53: 'Staff
J54: 'Acquisition of Stock
J55: 'Electronic Information
B56: 'DATA TYPES | J56: 'Automation
J57: 'Premises and Related Costs
B58: 'Data is shown in three forms. | J58: 'New Buildings / Refurbishment
J59: 'Other Expenditure
B60: 'headings. ONLY returned data are shown in the 1997 to 2001 datasheets. | J60: 'TOTAL EXPENDITURE
B62: 'The following two data types only appear in the '2001 Grossed' datasheet.
J63: 'Public Funding
B64: 'figures have been spread over relevant headings in line with country type ratios. Also, where data | J64: 'Fees & Charges
B65: 'has been submitted in previous years, but not in 2001 then previous years financial figures have been | J65: 'Other Income
B66: 'increased or decreased in line with the trend for the relevant country type. | J66: 'TOTAL INCOME
B68: 'figures have been estimated using population served (dependant on library type) and country type | I68: 'CAPITAL EXPENDITURE (not included above):
B69: 'averages. (The Gross sheet indicates the data type 0 for returned, 1 for based on returned and | J69: 'New Buildings / Refurbishment
B70: '2 for grossed on class averages.
J71: 'Acquisition of Stock
J72: 'Automation
J73: 'Other Capital Expenditure
J74: 'TOTAL CAPITAL PAYMENTS
B78: 'CONTACT
B80: 'If you have any questions or comments please contact Martin Jennings on;
B84: 'IPF Ltd
B85: '6th Floor, NLA Tower
B86: '12 - 16 Addiscombe Road
B87: 'Croydon
B88: 'CR0 0XT
B89: 'UK
B91: 'Tel: 020 8667 8530
B94: 'Country Name | C94: 'Type | D94: 'Region (Example)
B95: 'Bulgaria | C95: 'CEE | D95: 'Eastern Europe
B96: 'Czech Republic | C96: 'CEE | D96: 'Eastern Europe
B97: 'Estonia | C97: 'CEE | D97: 'Baltic States
B98: 'Hungary | C98: 'CEE | D98: 'Eastern Europe
B99: 'Latvia | C99: 'CEE | D99: 'Baltic States
B100: 'Lithuania | C100: 'CEE | D100: 'Baltic States
B101: 'Poland | C101: 'CEE | D101: 'Eastern Europe
B102: 'Romania | C102: 'CEE | D102: 'Eastern Europe
B103: 'Slovak Rep | C103: 'CEE | D103: 'Eastern Europe
B104: 'Slovenia | C104: 'CEE | D104: 'Eastern Europe
B105: 'Iceland | C105: 'EFTA | D105: 'Northern Europe
B106: 'Liechtenstein | C106: 'EFTA | D106: 'Central Europe
B107: 'Norway | C107: 'EFTA | D107: 'Northern Europe
B108: 'Switzerland | C108: 'EFTA | D108: 'Central Europe
B109: 'Austria | C109: 'EU | D109: 'Central Europe
B110: 'Belgium | C110: 'EU | D110: 'Central Europe
B111: 'Denmark | C111: 'EU | D111: 'Northern Europe
B112: 'Eire | C112: 'EU | D112: 'Central Europe
B113: 'Finland | C113: 'EU | D113: 'Northern Europe
B114: 'France | C114: 'EU | D114: 'Central Europe
B115: 'Germany | C115: 'EU | D115: 'Central Europe
B116: 'Greece | C116: 'EU | D116: 'Southern Europe
B117: 'Italy | C117: 'EU | D117: 'Southern Europe
B118: 'Luxembourg | C118: 'EU | D118: 'Central Europe
B119: 'Netherlands | C119: 'EU | D119: 'Central Europe
B120: 'Portugal | C120: 'EU | D120: 'Southern Europe
B121: 'Spain | C121: 'EU | D121: 'Southern Europe
B122: 'Sweden | C122: 'EU | D122: 'Northern Europe
B123: 'UK | C123: 'EU | D123: 'Central Europe
B124: 'Australia | C124: 'World - A | D124: 'Australasia
B125: 'Canada | C125: 'World - A | D125: 'Northern America
B126: 'Japan | C126: 'World - A | D126: 'Asia
B127: 'Korea | C127: 'World - A | D127: 'Asia
B128: 'New Zealand | C128: 'World - A | D128: 'Australasia
B129: 'USA | C129: 'World - A | D129: 'Northern America
B130: 'Mexico | C130: 'World - B | D130: 'Rest of the World
B131: 'Turkey | C131: 'World - B | D131: 'Rest of the World

Sheet: Menus
A1: 'Parameters (transposed from Data sheet) | B1: 'Row | C1: 'Names (from selected data sheet) | D1: 'Types (from selected data sheet) | F1: 'Types (pivot-tabled) | I1: 'Currently selected parameters (generated by dialog box) | N1: 'Data sheets
B2: 2 | C2: =INDEX(2001Grossed!R1C1:R70C14, RC[-1], 1) -> Bulgaria | D2: =INDEX(2001Grossed!R1C1:R70C14, RC2, 2) -> CEE | F2: 'Count of Types (from selected data sheet) | I2: 'Box | J2: 'Menu position | N2: 2001
A3: 'Libraries - Total Administrative Units | B3: 3 | C3: =INDEX(2001Grossed!R1C1:R70C14, RC[-1], 1) -> Czech Republic | D3: =INDEX(2001Grossed!R1C1:R70C14, RC2, 2) -> CEE | F3: 'Types (from selected data sheet) | G3: 'Total | I3: 'x param | J3: 24 | L3: 'from param list | N3: 2000
A4: 'Libraries - Service Points | B4: 4 | C4: =INDEX(2001Grossed!R1C1:R70C14, RC[-1], 1) -> Estonia | D4: =INDEX(2001Grossed!R1C1:R70C14, RC2, 2) -> CEE | F4: 0 | G4: 455 | I4: 'y param | J4: 23 | L4: 'from param list | N4: 1999
A5: 'Collections - Books & Bound Periodicals | B5: 5 | C5: =INDEX(2001Grossed!R1C1:R70C14, RC[-1], 1) -> Hungary | D5: =INDEX(2001Grossed!R1C1:R70C14, RC2, 2) -> CEE | F5: 'Totals | G5: 6 | I5: 'Type 1 | J5: 4 | K5: =INDEX(R[-1]C[-5]:R[+49]C[-5], RC[-1], 1) -> EFTA | L5: 'from types | N5: 1998
A6: 'Collections - Current Periodicals - Titles | B6: 6 | C6: =INDEX(2001Grossed!R1C1:R70C14, RC[-1], 1) -> Latvia | D6: =INDEX(2001Grossed!R1C1:R70C14, RC2, 2) -> CEE | F6: 'CEE | G6: 10 | I6: 'Type 2 | J6: 5 | K6: =INDEX(R[-2]C[-5]:R[+48]C[-5], RC[-1], 1) -> EU | L6: 'from types | N6: 1997
A7: 'Collections - Current Periodicals - Subscriptions | B7: 7 | C7: =INDEX(2001Grossed!R1C1:R70C14, RC[-1], 1) -> Lithuania | D7: =INDEX(2001Grossed!R1C1:R70C14, RC2, 2) -> CEE | F7: 'EFTA | G7: 4 | I7: 'Type 3 | J7: 8 | K7: =INDEX(R[-3]C[-5]:R[+47]C[-5], RC[-1], 1) -> België Nederlandstalige Universiteiten | L7: 'from types | N7: '2001Grossed
A8: 'Collections - Manuscripts | B8: 8 | C8: =INDEX(2001Grossed!R1C1:R70C14, RC[-1], 1) -> Poland | D8: =INDEX(2001Grossed!R1C1:R70C14, RC2, 2) -> CEE | F8: 'EU | G8: 15 | I8: 'Identify | J8: 12 | K8: =INDEX(R[-6]C[-8]:R[+493]C[-8], RC[-1], 1) -> België Nederlandstalige Universiteiten | L8: 'from data
A9: 'Collections - Microforms | B9: 9 | C9: =INDEX(2001Grossed!R1C1:R70C14, RC[-1], 1) -> Romania | D9: =INDEX(2001Grossed!R1C1:R70C14, RC2, 2) -> CEE | F9: 'World - A | G9: 6 | I9: 'Plot y/x | J9: 1
A10: 'Collections - Audio-visual Materials | B10: 10 | C10: =INDEX(2001Grossed!R1C1:R70C14, RC[-1], 1) -> Slovak Rep | D10: =INDEX(2001Grossed!R1C1:R70C14, RC2, 2) -> CEE | F10: 'World - B | G10: 2 | I10: 'Data sheet | J10: 6 | K10: =INDEX(R[-8]C[+3]:R[+41]C[+3], RC[-1], 1) -> 2001Grossed | L10: 'from data sheets list
A11: 'Collections - CD-ROMs | B11: 11 | C11: =INDEX(2001Grossed!R1C1:R70C14, RC[-1], 1) -> Slovenia | D11: =INDEX(2001Grossed!R1C1:R70C14, RC2, 2) -> CEE | F11: 'België Nederlandstalige Universiteiten | G11: 1 | K11: =IF(EQUAL(R[-1]C, "2000 Grossed"), "Gross", "") -> 
A12: 'Additions - Books & Bound Periodicals | B12: 12 | C12: =INDEX(2001Grossed!R1C1:R70C14, RC[-1], 1) -> Austria | D12: =INDEX(2001Grossed!R1C1:R70C14, RC2, 2) -> EU | F12: 'Belgique universités francophones | G12: 1
A13: 'Additions - Audio-visual Materials | B13: 13 | C13: =INDEX(2001Grossed!R1C1:R70C14, RC[-1], 1) -> België Nederlandstalige Universiteiten | D13: =INDEX(2001Grossed!R1C1:R70C14, RC2, 2) -> België Nederlandstalige Universiteiten
A14: 'Facilities & Services - Percentage Stock on Open Access | B14: 14 | C14: =INDEX(2001Grossed!R1C1:R70C14, RC[-1], 1) -> Belgique universités francophones | D14: =INDEX(2001Grossed!R1C1:R70C14, RC2, 2) -> Belgique universités francophones
A15: 'Facilities & Services - Percentage Catalogue Records Automated | B15: 15 | C15: =INDEX(2001Grossed!R1C1:R70C14, RC[-1], 1) -> Belgium | D15: =INDEX(2001Grossed!R1C1:R70C14, RC2, 2) -> EU
A16: 'Facilities & Services - Number of Workstations for users | B16: 16 | C16: =INDEX(2001Grossed!R1C1:R70C14, RC[-1], 1) -> Denmark | D16: =INDEX(2001Grossed!R1C1:R70C14, RC2, 2) -> EU
A17: 'Facilities & Services - Number connected to the internet | B17: 17 | C17: =INDEX(2001Grossed!R1C1:R70C14, RC[-1], 1) -> Eire | D17: =INDEX(2001Grossed!R1C1:R70C14, RC2, 2) -> EU
A18: 'Use & Users - Registered Users | B18: 18 | C18: =INDEX(2001Grossed!R1C1:R70C14, RC[-1], 1) -> Finland | D18: =INDEX(2001Grossed!R1C1:R70C14, RC2, 2) -> EU
A19: 'Use & Users - Consultations | B19: 19 | C19: =INDEX(2001Grossed!R1C1:R70C14, RC[-1], 1) -> France | D19: =INDEX(2001Grossed!R1C1:R70C14, RC2, 2) -> EU
A20: 'Use & Users - Number of Visits | B20: 20 | C20: =INDEX(2001Grossed!R1C1:R70C14, RC[-1], 1) -> Greece | D20: =INDEX(2001Grossed!R1C1:R70C14, RC2, 2) -> EU
A21: 'Use & Users - Staff & Students | B21: 21 | C21: =INDEX(2001Grossed!R1C1:R70C14, RC[-1], 1) -> Iceland | D21: =INDEX(2001Grossed!R1C1:R70C14, RC2, 2) -> EFTA
A22: 'Library Staff FTE - Trained Librarians | B22: 22 | C22: =INDEX(2001Grossed!R1C1:R70C14, RC[-1], 1) -> Italy | D22: =INDEX(2001Grossed!R1C1:R70C14, RC2, 2) -> EU
A23: 'Library Staff FTE - Other Library Staff | B23: 23 | C23: =INDEX(2001Grossed!R1C1:R70C14, RC[-1], 1) -> Liechtenstein | D23: =INDEX(2001Grossed!R1C1:R70C14, RC2, 2) -> EFTA
A24: 'Library Staff FTE - Total Staff | B24: 24 | C24: =INDEX(2001Grossed!R1C1:R70C14, RC[-1], 1) -> Luxembourg | D24: =INDEX(2001Grossed!R1C1:R70C14, RC2, 2) -> EU
A25: 'Recurrent Expenditure (Euros) - Staff | B25: 25 | C25: =INDEX(2001Grossed!R1C1:R70C14, RC[-1], 1) -> Netherlands | D25: =INDEX(2001Grossed!R1C1:R70C14, RC2, 2) -> EU
A26: 'Recurrent Expenditure (Euros) - Acquisition of Stock | B26: 26 | C26: =INDEX(2001Grossed!R1C1:R70C14, RC[-1], 1) -> Norway | D26: =INDEX(2001Grossed!R1C1:R70C14, RC2, 2) -> EFTA
A27: 'Recurrent Expenditure (Euros) - Electronic Information | B27: 27 | C27: =INDEX(2001Grossed!R1C1:R70C14, RC[-1], 1) -> Portugal | D27: =INDEX(2001Grossed!R1C1:R70C14, RC2, 2) -> EU
A28: 'Recurrent Expenditure (Euros) - Automation | B28: 28 | C28: =INDEX(2001Grossed!R1C1:R70C14, RC[-1], 1) -> Spain | D28: =INDEX(2001Grossed!R1C1:R70C14, RC2, 2) -> EU
A29: 'Recurrent Expenditure (Euros) - Premises and Related Costs | B29: 29 | C29: =INDEX(2001Grossed!R1C1:R70C14, RC[-1], 1) -> Sweden | D29: =INDEX(2001Grossed!R1C1:R70C14, RC2, 2) -> EU
A30: 'Recurrent Expenditure (Euros) - New Buildings / Refurbishment | B30: 30 | C30: =INDEX(2001Grossed!R1C1:R70C14, RC[-1], 1) -> Switzerland | D30: =INDEX(2001Grossed!R1C1:R70C14, RC2, 2) -> EFTA
A31: 'Recurrent Expenditure (Euros) - Other Expenditure | B31: 31 | C31: =INDEX(2001Grossed!R1C1:R70C14, RC[-1], 1) -> UK | D31: =INDEX(2001Grossed!R1C1:R70C14, RC2, 2) -> EU
A32: 'Recurrent Expenditure (Euros) - TOTAL EXPENDITURE | B32: 32 | C32: =INDEX(2001Grossed!R1C1:R70C14, RC[-1], 1) -> Germany | D32: =INDEX(2001Grossed!R1C1:R70C14, RC2, 2) -> EU
A33: 'Income - Public Funding | B33: 33 | C33: =INDEX(2001Grossed!R1C1:R70C14, RC[-1], 1) -> USA | D33: =INDEX(2001Grossed!R1C1:R70C14, RC2, 2) -> World - A
A34: 'Income - Fees & Charges | B34: 34 | C34: =INDEX(2001Grossed!R1C1:R70C14, RC[-1], 1) -> Turkey | D34: =INDEX(2001Grossed!R1C1:R70C14, RC2, 2) -> World - B
A35: 'Income - Other Income | B35: 35 | C35: =INDEX(2001Grossed!R1C1:R70C14, RC[-1], 1) -> Australia | D35: =INDEX(2001Grossed!R1C1:R70C14, RC2, 2) -> World - A
A36: 'Income - TOTAL INCOME | B36: 36 | C36: =INDEX(2001Grossed!R1C1:R70C14, RC[-1], 1) -> Japan | D36: =INDEX(2001Grossed!R1C1:R70C14, RC2, 2) -> World - A
A37: 'Capital Expenditure - New Buildings / Refurbishment | B37: 37 | C37: =INDEX(2001Grossed!R1C1:R70C14, RC[-1], 1) -> Korea | D37: =INDEX(2001Grossed!R1C1:R70C14, RC2, 2) -> World - A
A38: 'Capital Expenditure - Acquisition of Stock | B38: 38 | C38: =INDEX(2001Grossed!R1C1:R70C14, RC[-1], 1) -> Canada | D38: =INDEX(2001Grossed!R1C1:R70C14, RC2, 2) -> World - A
A39: 'Capital Expenditure - Automation | B39: 39 | C39: =INDEX(2001Grossed!R1C1:R70C14, RC[-1], 1) -> New Zealand | D39: =INDEX(2001Grossed!R1C1:R70C14, RC2, 2) -> World - A
A40: 'Capital Expenditure - Other Capital Expenditure | B40: 40 | C40: =INDEX(2001Grossed!R1C1:R70C14, RC[-1], 1) -> Mexico | D40: =INDEX(2001Grossed!R1C1:R70C14, RC2, 2) -> World - B
A41: 'Capital Expenditure - TOTAL CAPITAL PAYMENTS | B41: 41 | C41: =INDEX(2001Grossed!R1C1:R70C14, RC[-1], 1) -> CEE - Total | D41: =INDEX(2001Grossed!R1C1:R70C14, RC2, 2) -> Totals
A42: 'Additions | B42: 42 | C42: =INDEX(2001Grossed!R1C1:R70C14, RC[-1], 1) -> EU - Total | D42: =INDEX(2001Grossed!R1C1:R70C14, RC2, 2) -> Totals
A43: 'Loans per visit | B43: 43 | C43: =INDEX(2001Grossed!R1C1:R70C14, RC[-1], 1) -> EFTA - Total | D43: =INDEX(2001Grossed!R1C1:R70C14, RC2, 2) -> Totals
A44: 'Cost per pop | B44: 44 | C44: =INDEX(2001Grossed!R1C1:R70C14, RC[-1], 1) -> World A - Total | D44: =INDEX(2001Grossed!R1C1:R70C14, RC2, 2) -> Totals
A45: 'Users per 1000 pop | B45: 45 | C45: =INDEX(2001Grossed!R1C1:R70C14, RC[-1], 1) -> World B - Total | D45: =INDEX(2001Grossed!R1C1:R70C14, RC2, 2) -> Totals
A46: 'visits per 1000 pop | B46: 46 | C46: =INDEX(2001Grossed!R1C1:R70C14, RC[-1], 1) -> EU Accession Countries - Totals | D46: =INDEX(2001Grossed!R1C1:R70C14, RC2, 2) -> Totals
A47: 'Bookstock per 1000 pop | B47: 47 | C47: =INDEX(2001Grossed!R1C1:R70C14, RC[-1], 1) ->  | D47: =INDEX(2001Grossed!R1C1:R70C14, RC2, 2) -> 
A48: 'Total stock per 1000 pop | B48: 48 | C48: =INDEX(2001Grossed!R1C1:R70C14, RC[-1], 1) ->  | D48: =INDEX(2001Grossed!R1C1:R70C14, RC2, 2) -> 
A49: 'AV materials per 1000 pop | B49: 49 | C49: =INDEX(2001Grossed!R1C1:R70C14, RC[-1], 1) ->  | D49: =INDEX(2001Grossed!R1C1:R70C14, RC2, 2) -> 
A50: 0 | B50: 50 | C50: =INDEX(2001Grossed!R1C1:R70C14, RC[-1], 1) ->  | D50: =INDEX(2001Grossed!R1C1:R70C14, RC2, 2) -> 
A51: 0 | B51: 51 | C51: =INDEX(2001Grossed!R1C1:R70C14, RC[-1], 1) ->  | D51: =INDEX(2001Grossed!R1C1:R70C14, RC2, 2) -> 
A52: 0 | B52: 52 | C52: =INDEX(2001Grossed!R1C1:R70C14, RC[-1], 1) -> 0 | D52: =INDEX(2001Grossed!R1C1:R70C14, RC2, 2) -> 0
A53: 0 | B53: 53 | C53: =INDEX(2001Grossed!R1C1:R70C14, RC[-1], 1) -> 0 | D53: =INDEX(2001Grossed!R1C1:R70C14, RC2, 2) -> 0
A54: 0 | B54: 54 | C54: =INDEX(2001Grossed!R1C1:R70C14, RC[-1], 1) -> 0 | D54: =INDEX(2001Grossed!R1C1:R70C14, RC2, 2) -> 0
A55: 0 | B55: 55 | C55: =INDEX(2001Grossed!R1C1:R70C14, RC[-1], 1) -> 0 | D55: =INDEX(2001Grossed!R1C1:R70C14, RC2, 2) -> 0
A56: 0 | B56: 56 | C56: =INDEX(2001Grossed!R1C1:R70C14, RC[-1], 1) -> 0 | D56: =INDEX(2001Grossed!R1C1:R70C14, RC2, 2) -> 0
A57: 0 | B57: 57 | C57: =INDEX(2001Grossed!R1C1:R70C14, RC[-1], 1) -> 0 | D57: =INDEX(2001Grossed!R1C1:R70C14, RC2, 2) -> 0
A58: 0 | B58: 58 | C58: =INDEX(2001Grossed!R1C1:R70C14, RC[-1], 1) -> 0 | D58: =INDEX(2001Grossed!R1C1:R70C14, RC2, 2) -> 0
A59: 0 | B59: 59 | C59: =INDEX(2001Grossed!R1C1:R70C14, RC[-1], 1) -> 0 | D59: =INDEX(2001Grossed!R1C1:R70C14, RC2, 2) -> 0
A60: 0 | B60: 60 | C60: =INDEX(2001Grossed!R1C1:R70C14, RC[-1], 1) -> 0 | D60: =INDEX(2001Grossed!R1C1:R70C14, RC2, 2) -> 0
A61: 0 | B61: 61 | C61: =INDEX(2001Grossed!R1C1:R70C14, RC[-1], 1) -> 0 | D61: =INDEX(2001Grossed!R1C1:R70C14, RC2, 2) -> 0
A62: 0 | B62: 62 | C62: =INDEX(2001Grossed!R1C1:R70C14, RC[-1], 1) -> 0 | D62: =INDEX(2001Grossed!R1C1:R70C14, RC2, 2) -> 0
A63: 0 | B63: 63 | C63: =INDEX(2001Grossed!R1C1:R70C14, RC[-1], 1) -> 0 | D63: =INDEX(2001Grossed!R1C1:R70C14, RC2, 2) -> 0
A64: 0 | B64: 64 | C64: =INDEX(2001Grossed!R1C1:R70C14, RC[-1], 1) -> 0 | D64: =INDEX(2001Grossed!R1C1:R70C14, RC2, 2) -> 0
A65: 0 | B65: 65 | C65: =INDEX(2001Grossed!R1C1:R70C14, RC[-1], 1) -> 0 | D65: =INDEX(2001Grossed!R1C1:R70C14, RC2, 2) -> 0
A66: 0 | B66: 66 | C66: =INDEX(2001Grossed!R1C1:R70C14, RC[-1], 1) -> 0 | D66: =INDEX(2001Grossed!R1C1:R70C14, RC2, 2) -> 0
A67: 0 | B67: 67 | C67: =INDEX(2001Grossed!R1C1:R70C14, RC[-1], 1) -> 0 | D67: =INDEX(2001Grossed!R1C1:R70C14, RC2, 2) -> 0
A68: 0 | B68: 68 | C68: =INDEX(2001Grossed!R1C1:R70C14, RC[-1], 1) -> 0 | D68: =INDEX(2001Grossed!R1C1:R70C14, RC2, 2) -> 0
A69: 0 | B69: 69 | C69: =INDEX(2001Grossed!R1C1:R70C14, RC[-1], 1) -> 0 | D69: =INDEX(2001Grossed!R1C1:R70C14, RC2, 2) -> 0
A70: 0 | B70: 70 | C70: =INDEX(2001Grossed!R1C1:R70C14, RC[-1], 1) -> 0 | D70: =INDEX(2001Grossed!R1C1:R70C14, RC2, 2) -> 0
A71: 0 | B71: 71 | C71: =INDEX(2001Grossed!R1C1:R70C14, RC[-1], 1) -> #REF! | D71: =INDEX(2001Grossed!R1C1:R70C14, RC2, 2) -> #REF!
A72: 0 | B72: 72 | C72: =INDEX(2001Grossed!R1C1:R70C14, RC[-1], 1) -> #REF! | D72: =INDEX(2001Grossed!R1C1:R70C14, RC2, 2) -> #REF!
A73: 0 | B73: 73 | C73: =INDEX(2001Grossed!R1C1:R70C14, RC[-1], 1) -> #REF! | D73: =INDEX(2001Grossed!R1C1:R70C14, RC2, 2) -> #REF!
A74: 0 | B74: 74 | C74: =INDEX(2001Grossed!R1C1:R70C14, RC[-1], 1) -> #REF! | D74: =INDEX(2001Grossed!R1C1:R70C14, RC2, 2) -> #REF!
A75: 0 | B75: 75 | C75: =INDEX(2001Grossed!R1C1:R70C14, RC[-1], 1) -> #REF! | D75: =INDEX(2001Grossed!R1C1:R70C14, RC2, 2) -> #REF!
A76: 0 | B76: 76 | C76: =INDEX(2001Grossed!R1C1:R70C14, RC[-1], 1) -> #REF! | D76: =INDEX(2001Grossed!R1C1:R70C14, RC2, 2) -> #REF!
A77: 0 | B77: 77 | C77: =INDEX(2001Grossed!R1C1:R70C14, RC[-1], 1) -> #REF! | D77: =INDEX(2001Grossed!R1C1:R70C14, RC2, 2) -> #REF!
A78: 0 | B78: 78 | C78: =INDEX(2001Grossed!R1C1:R70C14, RC[-1], 1) -> #REF! | D78: =INDEX(2001Grossed!R1C1:R70C14, RC2, 2) -> #REF!
A79: 0 | B79: 79 | C79: =INDEX(2001Grossed!R1C1:R70C14, RC[-1], 1) -> #REF! | D79: =INDEX(2001Grossed!R1C1:R70C14, RC2, 2) -> #REF!
A80: 0 | B80: 80 | C80: =INDEX(2001Grossed!R1C1:R70C14, RC[-1], 1) -> #REF! | D80: =INDEX(2001Grossed!R1C1:R70C14, RC2, 2) -> #REF!
A81: 0 | B81: 81 | C81: =INDEX(2001Grossed!R1C1:R70C14, RC[-1], 1) -> #REF! | D81: =INDEX(2001Grossed!R1C1:R70C14, RC2, 2) -> #REF!
A82: 0 | B82: 82 | C82: =INDEX(2001Grossed!R1C1:R70C14, RC[-1], 1) -> #REF! | D82: =INDEX(2001Grossed!R1C1:R70C14, RC2, 2) -> #REF!
A83: 0 | B83: 83 | C83: =INDEX(2001Grossed!R1C1:R70C14, RC[-1], 1) -> #REF! | D83: =INDEX(2001Grossed!R1C1:R70C14, RC2, 2) -> #REF!
A84: 0 | B84: 84 | C84: =INDEX(2001Grossed!R1C1:R70C14, RC[-1], 1) -> #REF! | D84: =INDEX(2001Grossed!R1C1:R70C14, RC2, 2) -> #REF!
A85: 0 | B85: 85 | C85: =INDEX(2001Grossed!R1C1:R70C14, RC[-1], 1) -> #REF! | D85: =INDEX(2001Grossed!R1C1:R70C14, RC2, 2) -> #REF!
A86: 0 | B86: 86 | C86: =INDEX(2001Grossed!R1C1:R70C14, RC[-1], 1) -> #REF! | D86: =INDEX(2001Grossed!R1C1:R70C14, RC2, 2) -> #REF!
A87: 0 | B87: 87 | C87: =INDEX(2001Grossed!R1C1:R70C14, RC[-1], 1) -> #REF! | D87: =INDEX(2001Grossed!R1C1:R70C14, RC2, 2) -> #REF!
A88: 0 | B88: 88 | C88: =INDEX(2001Grossed!R1C1:R70C14, RC[-1], 1) -> #REF! | D88: =INDEX(2001Grossed!R1C1:R70C14, RC2, 2) -> #REF!
A89: 0 | B89: 89 | C89: =INDEX(2001Grossed!R1C1:R70C14, RC[-1], 1) -> #REF! | D89: =INDEX(2001Grossed!R1C1:R70C14, RC2, 2) -> #REF!
A90: 0 | B90: 90 | C90: =INDEX(2001Grossed!R1C1:R70C14, RC[-1], 1) -> #REF! | D90: =INDEX(2001Grossed!R1C1:R70C14, RC2, 2) -> #REF!
A91: 0 | B91: 91 | C91: =INDEX(2001Grossed!R1C1:R70C14, RC[-1], 1) -> #REF! | D91: =INDEX(2001Grossed!R1C1:R70C14, RC2, 2) -> #REF!
A92: 0 | B92: 92 | C92: =INDEX(2001Grossed!R1C1:R70C14, RC[-1], 1) -> #REF! | D92: =INDEX(2001Grossed!R1C1:R70C14, RC2, 2) -> #REF!
A93: 0 | B93: 93 | C93: =INDEX(2001Grossed!R1C1:R70C14, RC[-1], 1) -> #REF! | D93: =INDEX(2001Grossed!R1C1:R70C14, RC2, 2) -> #REF!
A94: 0 | B94: 94 | C94: =INDEX(2001Grossed!R1C1:R70C14, RC[-1], 1) -> #REF! | D94: =INDEX(2001Grossed!R1C1:R70C14, RC2, 2) -> #REF!
A95: 0 | B95: 95 | C95: =INDEX(2001Grossed!R1C1:R70C14, RC[-1], 1) -> #REF! | D95: =INDEX(2001Grossed!R1C1:R70C14, RC2, 2) -> #REF!
A96: 0 | B96: 96 | C96: =INDEX(2001Grossed!R1C1:R70C14, RC[-1], 1) -> #REF! | D96: =INDEX(2001Grossed!R1C1:R70C14, RC2, 2) -> #REF!
A97: 0 | B97: 97 | C97: =INDEX(2001Grossed!R1C1:R70C14, RC[-1], 1) -> #REF! | D97: =INDEX(2001Grossed!R1C1:R70C14, RC2, 2) -> #REF!
A98: 0 | B98: 98 | C98: =INDEX(2001Grossed!R1C1:R70C14, RC[-1], 1) -> #REF! | D98: =INDEX(2001Grossed!R1C1:R70C14, RC2, 2) -> #REF!
A99: 0 | B99: 99 | C99: =INDEX(2001Grossed!R1C1:R70C14, RC[-1], 1) -> #REF! | D99: =INDEX(2001Grossed!R1C1:R70C14, RC2, 2) -> #REF!
A100: 0 | B100: 100 | C100: =INDEX(2001Grossed!R1C1:R70C14, RC[-1], 1) -> #REF! | D100: =INDEX(2001Grossed!R1C1:R70C14, RC2, 2) -> #REF!
A101: 0 | B101: 101 | C101: =INDEX(2001Grossed!R1C1:R70C14, RC[-1], 1) -> #REF! | D101: =INDEX(2001Grossed!R1C1:R70C14, RC2, 2) -> #REF!
A102: 0 | B102: 102 | C102: =INDEX(2001Grossed!R1C1:R70C14, RC[-1], 1) -> #REF! | D102: =INDEX(2001Grossed!R1C1:R70C14, RC2, 2) -> #REF!
A103: 0 | B103: 103 | C103: =INDEX(2001Grossed!R1C1:R70C14, RC[-1], 1) -> #REF! | D103: =INDEX(2001Grossed!R1C1:R70C14, RC2, 2) -> #REF!
A104: 0 | B104: 104 | C104: =INDEX(2001Grossed!R1C1:R70C14, RC[-1], 1) -> #REF! | D104: =INDEX(2001Grossed!R1C1:R70C14, RC2, 2) -> #REF!
A105: 0 | B105: 105 | C105: =INDEX(2001Grossed!R1C1:R70C14, RC[-1], 1) -> #REF! | D105: =INDEX(2001Grossed!R1C1:R70C14, RC2, 2) -> #REF!
A106: 0 | B106: 106 | C106: =INDEX(2001Grossed!R1C1:R70C14, RC[-1], 1) -> #REF! | D106: =INDEX(2001Grossed!R1C1:R70C14, RC2, 2) -> #REF!
A107: 0 | B107: 107 | C107: =INDEX(2001Grossed!R1C1:R70C14, RC[-1], 1) -> #REF! | D107: =INDEX(2001Grossed!R1C1:R70C14, RC2, 2) -> #REF!
A108: 0 | B108: 108 | C108: =INDEX(2001Grossed!R1C1:R70C14, RC[-1], 1) -> #REF! | D108: =INDEX(2001Grossed!R1C1:R70C14, RC2, 2) -> #REF!
A109: 0 | B109: 109 | C109: =INDEX(2001Grossed!R1C1:R70C14, RC[-1], 1) -> #REF! | D109: =INDEX(2001Grossed!R1C1:R70C14, RC2, 2) -> #REF!
A110: 0 | B110: 110 | C110: =INDEX(2001Grossed!R1C1:R70C14, RC[-1], 1) -> #REF! | D110: =INDEX(2001Grossed!R1C1:R70C14, RC2, 2) -> #REF!
A111: 0 | B111: 111 | C111: =INDEX(2001Grossed!R1C1:R70C14, RC[-1], 1) -> #REF! | D111: =INDEX(2001Grossed!R1C1:R70C14, RC2, 2) -> #REF!
A112: 0 | B112: 112 | C112: =INDEX(2001Grossed!R1C1:R70C14, RC[-1], 1) -> #REF! | D112: =INDEX(2001Grossed!R1C1:R70C14, RC2, 2) -> #REF!
A113: 0 | B113: 113 | C113: =INDEX(2001Grossed!R1C1:R70C14, RC[-1], 1) -> #REF! | D113: =INDEX(2001Grossed!R1C1:R70C14, RC2, 2) -> #REF!
A114: 0 | B114: 114 | C114: =INDEX(2001Grossed!R1C1:R70C14, RC[-1], 1) -> #REF! | D114: =INDEX(2001Grossed!R1C1:R70C14, RC2, 2) -> #REF!
A115: 0 | B115: 115 | C115: =INDEX(2001Grossed!R1C1:R70C14, RC[-1], 1) -> #REF! | D115: =INDEX(2001Grossed!R1C1:R70C14, RC2, 2) -> #REF!
A116: 0 | B116: 116 | C116: =INDEX(2001Grossed!R1C1:R70C14, RC[-1], 1) -> #REF! | D116: =INDEX(2001Grossed!R1C1:R70C14, RC2, 2) -> #REF!
A117: 0 | B117: 117 | C117: =INDEX(2001Grossed!R1C1:R70C14, RC[-1], 1) -> #REF! | D117: =INDEX(2001Grossed!R1C1:R70C14, RC2, 2) -> #REF!
A118: 0 | B118: 118 | C118: =INDEX(2001Grossed!R1C1:R70C14, RC[-1], 1) -> #REF! | D118: =INDEX(2001Grossed!R1C1:R70C14, RC2, 2) -> #REF!
A119: 0 | B119: 119 | C119: =INDEX(2001Grossed!R1C1:R70C14, RC[-1], 1) -> #REF! | D119: =INDEX(2001Grossed!R1C1:R70C14, RC2, 2) -> #REF!
A120: 0 | B120: 120 | C120: =INDEX(2001Grossed!R1C1:R70C14, RC[-1], 1) -> #REF! | D120: =INDEX(2001Grossed!R1C1:R70C14, RC2, 2) -> #REF!
A121: 0 | B121: 121 | C121: =INDEX(2001Grossed!R1C1:R70C14, RC[-1], 1) -> #REF! | D121: =INDEX(2001Grossed!R1C1:R70C14, RC2, 2) -> #REF!
A122: 0 | B122: 122 | C122: =INDEX(2001Grossed!R1C1:R70C14, RC[-1], 1) -> #REF! | D122: =INDEX(2001Grossed!R1C1:R70C14, RC2, 2) -> #REF!
A123: 0 | B123: 123 | C123: =INDEX(2001Grossed!R1C1:R70C14, RC[-1], 1) -> #REF! | D123: =INDEX(2001Grossed!R1C1:R70C14, RC2, 2) -> #REF!
A124: 0 | B124: 124 | C124: =INDEX(2001Grossed!R1C1:R70C14, RC[-1], 1) -> #REF! | D124: =INDEX(2001Grossed!R1C1:R70C14, RC2, 2) -> #REF!
A125: 0 | B125: 125 | C125: =INDEX(2001Grossed!R1C1:R70C14, RC[-1], 1) -> #REF! | D125: =INDEX(2001Grossed!R1C1:R70C14, RC2, 2) -> #REF!
A126: 0 | B126: 126 | C126: =INDEX(2001Grossed!R1C1:R70C14, RC[-1], 1) -> #REF! | D126: =INDEX(2001Grossed!R1C1:R70C14, RC2, 2) -> #REF!
A127: 0 | B127: 127 | C127: =INDEX(2001Grossed!R1C1:R70C14, RC[-1], 1) -> #REF! | D127: =INDEX(2001Grossed!R1C1:R70C14, RC2, 2) -> #REF!
A128: 0 | B128: 128 | C128: =INDEX(2001Grossed!R1C1:R70C14, RC[-1], 1) -> #REF! | D128: =INDEX(2001Grossed!R1C1:R70C14, RC2, 2) -> #REF!
A129: 0 | B129: 129 | C129: =INDEX(2001Grossed!R1C1:R70C14, RC[-1], 1) -> #REF! | D129: =INDEX(2001Grossed!R1C1:R70C14, RC2, 2) -> #REF!
A130: 0 | B130: 130 | C130: =INDEX(2001Grossed!R1C1:R70C14, RC[-1], 1) -> #REF! | D130: =INDEX(2001Grossed!R1C1:R70C14, RC2, 2) -> #REF!
A131: 0 | B131: 131 | C131: =INDEX(2001Grossed!R1C1:R70C14, RC[-1], 1) -> #REF! | D131: =INDEX(2001Grossed!R1C1:R70C14, RC2, 2) -> #REF!
A132: 0 | B132: 132 | C132: =INDEX(2001Grossed!R1C1:R70C14, RC[-1], 1) -> #REF! | D132: =INDEX(2001Grossed!R1C1:R70C14, RC2, 2) -> #REF!
A133: 0 | B133: 133 | C133: =INDEX(2001Grossed!R1C1:R70C14, RC[-1], 1) -> #REF! | D133: =INDEX(2001Grossed!R1C1:R70C14, RC2, 2) -> #REF!
A134: 0 | B134: 134 | C134: =INDEX(2001Grossed!R1C1:R70C14, RC[-1], 1) -> #REF! | D134: =INDEX(2001Grossed!R1C1:R70C14, RC2, 2) -> #REF!
A135: 0 | B135: 135 | C135: =INDEX(2001Grossed!R1C1:R70C14, RC[-1], 1) -> #REF! | D135: =INDEX(2001Grossed!R1C1:R70C14, RC2, 2) -> #REF!
A136: 0 | B136: 136 | C136: =INDEX(2001Grossed!R1C1:R70C14, RC[-1], 1) -> #REF! | D136: =INDEX(2001Grossed!R1C1:R70C14, RC2, 2) -> #REF!
A137: 0 | B137: 137 | C137: =INDEX(2001Grossed!R1C1:R70C14, RC[-1], 1) -> #REF! | D137: =INDEX(2001Grossed!R1C1:R70C14, RC2, 2) -> #REF!
A138: 0 | B138: 138 | C138: =INDEX(2001Grossed!R1C1:R70C14, RC[-1], 1) -> #REF! | D138: =INDEX(2001Grossed!R1C1:R70C14, RC2, 2) -> #REF!
A139: 0 | B139: 139 | C139: =INDEX(2001Grossed!R1C1:R70C14, RC[-1], 1) -> #REF! | D139: =INDEX(2001Grossed!R1C1:R70C14, RC2, 2) -> #REF!
A140: 0 | B140: 140 | C140: =INDEX(2001Grossed!R1C1:R70C14, RC[-1], 1) -> #REF! | D140: =INDEX(2001Grossed!R1C1:R70C14, RC2, 2) -> #REF!
A141: 0 | B141: 141 | C141: =INDEX(2001Grossed!R1C1:R70C14, RC[-1], 1) -> #REF! | D141: =INDEX(2001Grossed!R1C1:R70C14, RC2, 2) -> #REF!
A142: 0 | B142: 142 | C142: =INDEX(2001Grossed!R1C1:R70C14, RC[-1], 1) -> #REF! | D142: =INDEX(2001Grossed!R1C1:R70C14, RC2, 2) -> #REF!
A143: 0 | B143: 143 | C143: =INDEX(2001Grossed!R1C1:R70C14, RC[-1], 1) -> #REF! | D143: =INDEX(2001Grossed!R1C1:R70C14, RC2, 2) -> #REF!
A144: 0 | B144: 144 | C144: =INDEX(2001Grossed!R1C1:R70C14, RC[-1], 1) -> #REF! | D144: =INDEX(2001Grossed!R1C1:R70C14, RC2, 2) -> #REF!
A145: 0 | B145: 145 | C145: =INDEX(2001Grossed!R1C1:R70C14, RC[-1], 1) -> #REF! | D145: =INDEX(2001Grossed!R1C1:R70C14, RC2, 2) -> #REF!
A146: 0 | B146: 146 | C146: =INDEX(2001Grossed!R1C1:R70C14, RC[-1], 1) -> #REF! | D146: =INDEX(2001Grossed!R1C1:R70C14, RC2, 2) -> #REF!
A147: 0 | B147: 147 | C147: =INDEX(2001Grossed!R1C1:R70C14, RC[-1], 1) -> #REF! | D147: =INDEX(2001Grossed!R1C1:R70C14, RC2, 2) -> #REF!
A148: 0 | B148: 148 | C148: =INDEX(2001Grossed!R1C1:R70C14, RC[-1], 1) -> #REF! | D148: =INDEX(2001Grossed!R1C1:R70C14, RC2, 2) -> #REF!
A149: 0 | B149: 149 | C149: =INDEX(2001Grossed!R1C1:R70C14, RC[-1], 1) -> #REF! | D149: =INDEX(2001Grossed!R1C1:R70C14, RC2, 2) -> #REF!
A150: 0 | B150: 150 | C150: =INDEX(2001Grossed!R1C1:R70C14, RC[-1], 1) -> #REF! | D150: =INDEX(2001Grossed!R1C1:R70C14, RC2, 2) -> #REF!
A151: 0 | B151: 151 | C151: =INDEX(2001Grossed!R1C1:R70C14, RC[-1], 1) -> #REF! | D151: =INDEX(2001Grossed!R1C1:R70C14, RC2, 2) -> #REF!
A152: 0 | B152: 152 | C152: =INDEX(2001Grossed!R1C1:R70C14, RC[-1], 1) -> #REF! | D152: =INDEX(2001Grossed!R1C1:R70C14, RC2, 2) -> #REF!
A153: 0 | B153: 153 | C153: =INDEX(2001Grossed!R1C1:R70C14, RC[-1], 1) -> #REF! | D153: =INDEX(2001Grossed!R1C1:R70C14, RC2, 2) -> #REF!
A154: 0 | B154: 154 | C154: =INDEX(2001Grossed!R1C1:R70C14, RC[-1], 1) -> #REF! | D154: =INDEX(2001Grossed!R1C1:R70C14, RC2, 2) -> #REF!
A155: 0 | B155: 155 | C155: =INDEX(2001Grossed!R1C1:R70C14, RC[-1], 1) -> #REF! | D155: =INDEX(2001Grossed!R1C1:R70C14, RC2, 2) -> #REF!
A156: 0 | B156: 156 | C156: =INDEX(2001Grossed!R1C1:R70C14, RC[-1], 1) -> #REF! | D156: =INDEX(2001Grossed!R1C1:R70C14, RC2, 2) -> #REF!
A157: 0 | B157: 157 | C157: =INDEX(2001Grossed!R1C1:R70C14, RC[-1], 1) -> #REF! | D157: =INDEX(2001Grossed!R1C1:R70C14, RC2, 2) -> #REF!
A158: 0 | B158: 158 | C158: =INDEX(2001Grossed!R1C1:R70C14, RC[-1], 1) -> #REF! | D158: =INDEX(2001Grossed!R1C1:R70C14, RC2, 2) -> #REF!
A159: 0 | B159: 159 | C159: =INDEX(2001Grossed!R1C1:R70C14, RC[-1], 1) -> #REF! | D159: =INDEX(2001Grossed!R1C1:R70C14, RC2, 2) -> #REF!
A160: 0 | B160: 160 | C160: =INDEX(2001Grossed!R1C1:R70C14, RC[-1], 1) -> #REF! | D160: =INDEX(2001Grossed!R1C1:R70C14, RC2, 2) -> #REF!
A161: 0 | B161: 161 | C161: =INDEX(2001Grossed!R1C1:R70C14, RC[-1], 1) -> #REF! | D161: =INDEX(2001Grossed!R1C1:R70C14, RC2, 2) -> #REF!
A162: 0 | B162: 162 | C162: =INDEX(2001Grossed!R1C1:R70C14, RC[-1], 1) -> #REF! | D162: =INDEX(2001Grossed!R1C1:R70C14, RC2, 2) -> #REF!
A163: 0 | B163: 163 | C163: =INDEX(2001Grossed!R1C1:R70C14, RC[-1], 1) -> #REF! | D163: =INDEX(2001Grossed!R1C1:R70C14, RC2, 2) -> #REF!
A164: 0 | B164: 164 | C164: =INDEX(2001Grossed!R1C1:R70C14, RC[-1], 1) -> #REF! | D164: =INDEX(2001Grossed!R1C1:R70C14, RC2, 2) -> #REF!
A165: 0 | B165: 165 | C165: =INDEX(2001Grossed!R1C1:R70C14, RC[-1], 1) -> #REF! | D165: =INDEX(2001Grossed!R1C1:R70C14, RC2, 2) -> #REF!
A166: 0 | B166: 166 | C166: =INDEX(2001Grossed!R1C1:R70C14, RC[-1], 1) -> #REF! | D166: =INDEX(2001Grossed!R1C1:R70C14, RC2, 2) -> #REF!
A167: 0 | B167: 167 | C167: =INDEX(2001Grossed!R1C1:R70C14, RC[-1], 1) -> #REF! | D167: =INDEX(2001Grossed!R1C1:R70C14, RC2, 2) -> #REF!
A168: 0 | B168: 168 | C168: =INDEX(2001Grossed!R1C1:R70C14, RC[-1], 1) -> #REF! | D168: =INDEX(2001Grossed!R1C1:R70C14, RC2, 2) -> #REF!
A169: 0 | B169: 169 | C169: =INDEX(2001Grossed!R1C1:R70C14, RC[-1], 1) -> #REF! | D169: =INDEX(2001Grossed!R1C1:R70C14, RC2, 2) -> #REF!
A170: 0 | B170: 170 | C170: =INDEX(2001Grossed!R1C1:R70C14, RC[-1], 1) -> #REF! | D170: =INDEX(2001Grossed!R1C1:R70C14, RC2, 2) -> #REF!
A171: 0 | B171: 171 | C171: =INDEX(2001Grossed!R1C1:R70C14, RC[-1], 1) -> #REF! | D171: =INDEX(2001Grossed!R1C1:R70C14, RC2, 2) -> #REF!
A172: 0 | B172: 172 | C172: =INDEX(2001Grossed!R1C1:R70C14, RC[-1], 1) -> #REF! | D172: =INDEX(2001Grossed!R1C1:R70C14, RC2, 2) -> #REF!
A173: 0 | B173: 173 | C173: =INDEX(2001Grossed!R1C1:R70C14, RC[-1], 1) -> #REF! | D173: =INDEX(2001Grossed!R1C1:R70C14, RC2, 2) -> #REF!
A174: 0 | B174: 174 | C174: =INDEX(2001Grossed!R1C1:R70C14, RC[-1], 1) -> #REF! | D174: =INDEX(2001Grossed!R1C1:R70C14, RC2, 2) -> #REF!
A175: 0 | B175: 175 | C175: =INDEX(2001Grossed!R1C1:R70C14, RC[-1], 1) -> #REF! | D175: =INDEX(2001Grossed!R1C1:R70C14, RC2, 2) -> #REF!
A176: 0 | B176: 176 | C176: =INDEX(2001Grossed!R1C1:R70C14, RC[-1], 1) -> #REF! | D176: =INDEX(2001Grossed!R1C1:R70C14, RC2, 2) -> #REF!
A177: 0 | B177: 177 | C177: =INDEX(2001Grossed!R1C1:R70C14, RC[-1], 1) -> #REF! | D177: =INDEX(2001Grossed!R1C1:R70C14, RC2, 2) -> #REF!
A178: 0 | B178: 178 | C178: =INDEX(2001Grossed!R1C1:R70C14, RC[-1], 1) -> #REF! | D178: =INDEX(2001Grossed!R1C1:R70C14, RC2, 2) -> #REF!
A179: 0 | B179: 179 | C179: =INDEX(2001Grossed!R1C1:R70C14, RC[-1], 1) -> #REF! | D179: =INDEX(2001Grossed!R1C1:R70C14, RC2, 2) -> #REF!
A180: 0 | B180: 180 | C180: =INDEX(2001Grossed!R1C1:R70C14, RC[-1], 1) -> #REF! | D180: =INDEX(2001Grossed!R1C1:R70C14, RC2, 2) -> #REF!
A181: 0 | B181: 181 | C181: =INDEX(2001Grossed!R1C1:R70C14, RC[-1], 1) -> #REF! | D181: =INDEX(2001Grossed!R1C1:R70C14, RC2, 2) -> #REF!
A182: 0 | B182: 182 | C182: =INDEX(2001Grossed!R1C1:R70C14, RC[-1], 1) -> #REF! | D182: =INDEX(2001Grossed!R1C1:R70C14, RC2, 2) -> #REF!
A183: 0 | B183: 183 | C183: =INDEX(2001Grossed!R1C1:R70C14, RC[-1], 1) -> #REF! | D183: =INDEX(2001Grossed!R1C1:R70C14, RC2, 2) -> #REF!
A184: 0 | B184: 184 | C184: =INDEX(2001Grossed!R1C1:R70C14, RC[-1], 1) -> #REF! | D184: =INDEX(2001Grossed!R1C1:R70C14, RC2, 2) -> #REF!
A185: 0 | B185: 185 | C185: =INDEX(2001Grossed!R1C1:R70C14, RC[-1], 1) -> #REF! | D185: =INDEX(2001Grossed!R1C1:R70C14, RC2, 2) -> #REF!
A186: 0 | B186: 186 | C186: =INDEX(2001Grossed!R1C1:R70C14, RC[-1], 1) -> #REF! | D186: =INDEX(2001Grossed!R1C1:R70C14, RC2, 2) -> #REF!
A187: 0 | B187: 187 | C187: =INDEX(2001Grossed!R1C1:R70C14, RC[-1], 1) -> #REF! | D187: =INDEX(2001Grossed!R1C1:R70C14, RC2, 2) -> #REF!
A188: 0 | B188: 188 | C188: =INDEX(2001Grossed!R1C1:R70C14, RC[-1], 1) -> #REF! | D188: =INDEX(2001Grossed!R1C1:R70C14, RC2, 2) -> #REF!
A189: 0 | B189: 189 | C189: =INDEX(2001Grossed!R1C1:R70C14, RC[-1], 1) -> #REF! | D189: =INDEX(2001Grossed!R1C1:R70C14, RC2, 2) -> #REF!
A190: 0 | B190: 190 | C190: =INDEX(2001Grossed!R1C1:R70C14, RC[-1], 1) -> #REF! | D190: =INDEX(2001Grossed!R1C1:R70C14, RC2, 2) -> #REF!
A191: 0 | B191: 191 | C191: =INDEX(2001Grossed!R1C1:R70C14, RC[-1], 1) -> #REF! | D191: =INDEX(2001Grossed!R1C1:R70C14, RC2, 2) -> #REF!
A192: 0 | B192: 192 | C192: =INDEX(2001Grossed!R1C1:R70C14, RC[-1], 1) -> #REF! | D192: =INDEX(2001Grossed!R1C1:R70C14, RC2, 2) -> #REF!
A193: 0 | B193: 193 | C193: =INDEX(2001Grossed!R1C1:R70C14, RC[-1], 1) -> #REF! | D193: =INDEX(2001Grossed!R1C1:R70C14, RC2, 2) -> #REF!
A194: 0 | B194: 194 | C194: =INDEX(2001Grossed!R1C1:R70C14, RC[-1], 1) -> #REF! | D194: =INDEX(2001Grossed!R1C1:R70C14, RC2, 2) -> #REF!
A195: 0 | B195: 195 | C195: =INDEX(2001Grossed!R1C1:R70C14, RC[-1], 1) -> #REF! | D195: =INDEX(2001Grossed!R1C1:R70C14, RC2, 2) -> #REF!
A196: 0 | B196: 196 | C196: =INDEX(2001Grossed!R1C1:R70C14, RC[-1], 1) -> #REF! | D196: =INDEX(2001Grossed!R1C1:R70C14, RC2, 2) -> #REF!
A197: 0 | B197: 197 | C197: =INDEX(2001Grossed!R1C1:R70C14, RC[-1], 1) -> #REF! | D197: =INDEX(2001Grossed!R1C1:R70C14, RC2, 2) -> #REF!
A198: 0 | B198: 198 | C198: =INDEX(2001Grossed!R1C1:R70C14, RC[-1], 1) -> #REF! | D198: =INDEX(2001Grossed!R1C1:R70C14, RC2, 2) -> #REF!
A199: 0 | B199: 199 | C199: =INDEX(2001Grossed!R1C1:R70C14, RC[-1], 1) -> #REF! | D199: =INDEX(2001Grossed!R1C1:R70C14, RC2, 2) -> #REF!
A200: 0 | B200: 200 | C200: =INDEX(2001Grossed!R1C1:R70C14, RC[-1], 1) -> #REF! | D200: =INDEX(2001Grossed!R1C1:R70C14, RC2, 2) -> #REF!
A201: 0 | B201: 201 | C201: =INDEX(2001Grossed!R1C1:R70C14, RC[-1], 1) -> #REF! | D201: =INDEX(2001Grossed!R1C1:R70C14, RC2, 2) -> #REF!
A202: 0 | B202: 202 | C202: =INDEX(2001Grossed!R1C1:R70C14, RC[-1], 1) -> #REF! | D202: =INDEX(2001Grossed!R1C1:R70C14, RC2, 2) -> #REF!
A203: 0 | B203: 203 | C203: =INDEX(2001Grossed!R1C1:R70C14, RC[-1], 1) -> #REF! | D203: =INDEX(2001Grossed!R1C1:R70C14, RC2, 2) -> #REF!
A204: 0 | B204: 204 | C204: =INDEX(2001Grossed!R1C1:R70C14, RC[-1], 1) -> #REF! | D204: =INDEX(2001Grossed!R1C1:R70C14, RC2, 2) -> #REF!
A205: 0 | B205: 205 | C205: =INDEX(2001Grossed!R1C1:R70C14, RC[-1], 1) -> #REF! | D205: =INDEX(2001Grossed!R1C1:R70C14, RC2, 2) -> #REF!
A206: 0 | B206: 206 | C206: =INDEX(2001Grossed!R1C1:R70C14, RC[-1], 1) -> #REF! | D206: =INDEX(2001Grossed!R1C1:R70C14, RC2, 2) -> #REF!
A207: 0 | B207: 207 | C207: =INDEX(2001Grossed!R1C1:R70C14, RC[-1], 1) -> #REF! | D207: =INDEX(2001Grossed!R1C1:R70C14, RC2, 2) -> #REF!
A208: 0 | B208: 208 | C208: =INDEX(2001Grossed!R1C1:R70C14, RC[-1], 1) -> #REF! | D208: =INDEX(2001Grossed!R1C1:R70C14, RC2, 2) -> #REF!
A209: 0 | B209: 209 | C209: =INDEX(2001Grossed!R1C1:R70C14, RC[-1], 1) -> #REF! | D209: =INDEX(2001Grossed!R1C1:R70C14, RC2, 2) -> #REF!
A210: 0 | B210: 210 | C210: =INDEX(2001Grossed!R1C1:R70C14, RC[-1], 1) -> #REF! | D210: =INDEX(2001Grossed!R1C1:R70C14, RC2, 2) -> #REF!
A211: 0 | B211: 211 | C211: =INDEX(2001Grossed!R1C1:R70C14, RC[-1], 1) -> #REF! | D211: =INDEX(2001Grossed!R1C1:R70C14, RC2, 2) -> #REF!
A212: 0 | B212: 212 | C212: =INDEX(2001Grossed!R1C1:R70C14, RC[-1], 1) -> #REF! | D212: =INDEX(2001Grossed!R1C1:R70C14, RC2, 2) -> #REF!
A213: 0 | B213: 213 | C213: =INDEX(2001Grossed!R1C1:R70C14, RC[-1], 1) -> #REF! | D213: =INDEX(2001Grossed!R1C1:R70C14, RC2, 2) -> #REF!
A214: 0 | B214: 214 | C214: =INDEX(2001Grossed!R1C1:R70C14, RC[-1], 1) -> #REF! | D214: =INDEX(2001Grossed!R1C1:R70C14, RC2, 2) -> #REF!
A215: 0 | B215: 215 | C215: =INDEX(2001Grossed!R1C1:R70C14, RC[-1], 1) -> #REF! | D215: =INDEX(2001Grossed!R1C1:R70C14, RC2, 2) -> #REF!
A216: 0 | B216: 216 | C216: =INDEX(2001Grossed!R1C1:R70C14, RC[-1], 1) -> #REF! | D216: =INDEX(2001Grossed!R1C1:R70C14, RC2, 2) -> #REF!
A217: 0 | B217: 217 | C217: =INDEX(2001Grossed!R1C1:R70C14, RC[-1], 1) -> #REF! | D217: =INDEX(2001Grossed!R1C1:R70C14, RC2, 2) -> #REF!
A218: 0 | B218: 218 | C218: =INDEX(2001Grossed!R1C1:R70C14, RC[-1], 1) -> #REF! | D218: =INDEX(2001Grossed!R1C1:R70C14, RC2, 2) -> #REF!
A219: 0 | B219: 219 | C219: =INDEX(2001Grossed!R1C1:R70C14, RC[-1], 1) -> #REF! | D219: =INDEX(2001Grossed!R1C1:R70C14, RC2, 2) -> #REF!
A220: 0 | B220: 220 | C220: =INDEX(2001Grossed!R1C1:R70C14, RC[-1], 1) -> #REF! | D220: =INDEX(2001Grossed!R1C1:R70C14, RC2, 2) -> #REF!
A221: 0 | B221: 221 | C221: =INDEX(2001Grossed!R1C1:R70C14, RC[-1], 1) -> #REF! | D221: =INDEX(2001Grossed!R1C1:R70C14, RC2, 2) -> #REF!
A222: 0 | B222: 222 | C222: =INDEX(2001Grossed!R1C1:R70C14, RC[-1], 1) -> #REF! | D222: =INDEX(2001Grossed!R1C1:R70C14, RC2, 2) -> #REF!
A223: 0 | B223: 223 | C223: =INDEX(2001Grossed!R1C1:R70C14, RC[-1], 1) -> #REF! | D223: =INDEX(2001Grossed!R1C1:R70C14, RC2, 2) -> #REF!
A224: 0 | B224: 224 | C224: =INDEX(2001Grossed!R1C1:R70C14, RC[-1], 1) -> #REF! | D224: =INDEX(2001Grossed!R1C1:R70C14, RC2, 2) -> #REF!
A225: 0 | B225: 225 | C225: =INDEX(2001Grossed!R1C1:R70C14, RC[-1], 1) -> #REF! | D225: =INDEX(2001Grossed!R1C1:R70C14, RC2, 2) -> #REF!
A226: 0 | B226: 226 | C226: =INDEX(2001Grossed!R1C1:R70C14, RC[-1], 1) -> #REF! | D226: =INDEX(2001Grossed!R1C1:R70C14, RC2, 2) -> #REF!
A227: 0 | B227: 227 | C227: =INDEX(2001Grossed!R1C1:R70C14, RC[-1], 1) -> #REF! | D227: =INDEX(2001Grossed!R1C1:R70C14, RC2, 2) -> #REF!
A228: 0 | B228: 228 | C228: =INDEX(2001Grossed!R1C1:R70C14, RC[-1], 1) -> #REF! | D228: =INDEX(2001Grossed!R1C1:R70C14, RC2, 2) -> #REF!
A229: 0 | B229: 229 | C229: =INDEX(2001Grossed!R1C1:R70C14, RC[-1], 1) -> #REF! | D229: =INDEX(2001Grossed!R1C1:R70C14, RC2, 2) -> #REF!
A230: 0 | B230: 230 | C230: =INDEX(2001Grossed!R1C1:R70C14, RC[-1], 1) -> #REF! | D230: =INDEX(2001Grossed!R1C1:R70C14, RC2, 2) -> #REF!
A231: 0 | B231: 231 | C231: =INDEX(2001Grossed!R1C1:R70C14, RC[-1], 1) -> #REF! | D231: =INDEX(2001Grossed!R1C1:R70C14, RC2, 2) -> #REF!
A232: 0 | B232: 232 | C232: =INDEX(2001Grossed!R1C1:R70C14, RC[-1], 1) -> #REF! | D232: =INDEX(2001Grossed!R1C1:R70C14, RC2, 2) -> #REF!
A233: 0 | B233: 233 | C233: =INDEX(2001Grossed!R1C1:R70C14, RC[-1], 1) -> #REF! | D233: =INDEX(2001Grossed!R1C1:R70C14, RC2, 2) -> #REF!
A234: 0 | B234: 234 | C234: =INDEX(2001Grossed!R1C1:R70C14, RC[-1], 1) -> #REF! | D234: =INDEX(2001Grossed!R1C1:R70C14, RC2, 2) -> #REF!
A235: 0 | B235: 235 | C235: =INDEX(2001Grossed!R1C1:R70C14, RC[-1], 1) -> #REF! | D235: =INDEX(2001Grossed!R1C1:R70C14, RC2, 2) -> #REF!
A236: 0 | B236: 236 | C236: =INDEX(2001Grossed!R1C1:R70C14, RC[-1], 1) -> #REF! | D236: =INDEX(2001Grossed!R1C1:R70C14, RC2, 2) -> #REF!
A237: 0 | B237: 237 | C237: =INDEX(2001Grossed!R1C1:R70C14, RC[-1], 1) -> #REF! | D237: =INDEX(2001Grossed!R1C1:R70C14, RC2, 2) -> #REF!
A238: 0 | B238: 238 | C238: =INDEX(2001Grossed!R1C1:R70C14, RC[-1], 1) -> #REF! | D238: =INDEX(2001Grossed!R1C1:R70C14, RC2, 2) -> #REF!
A239: 0 | B239: 239 | C239: =INDEX(2001Grossed!R1C1:R70C14, RC[-1], 1) -> #REF! | D239: =INDEX(2001Grossed!R1C1:R70C14, RC2, 2) -> #REF!
A240: 0 | B240: 240 | C240: =INDEX(2001Grossed!R1C1:R70C14, RC[-1], 1) -> #REF! | D240: =INDEX(2001Grossed!R1C1:R70C14, RC2, 2) -> #REF!
A241: 0 | B241: 241 | C241: =INDEX(2001Grossed!R1C1:R70C14, RC[-1], 1) -> #REF! | D241: =INDEX(2001Grossed!R1C1:R70C14, RC2, 2) -> #REF!
A242: 0 | B242: 242 | C242: =INDEX(2001Grossed!R1C1:R70C14, RC[-1], 1) -> #REF! | D242: =INDEX(2001Grossed!R1C1:R70C14, RC2, 2) -> #REF!
A243: 0 | B243: 243 | C243: =INDEX(2001Grossed!R1C1:R70C14, RC[-1], 1) -> #REF! | D243: =INDEX(2001Grossed!R1C1:R70C14, RC2, 2) -> #REF!
A244: 0 | B244: 244 | C244: =INDEX(2001Grossed!R1C1:R70C14, RC[-1], 1) -> #REF! | D244: =INDEX(2001Grossed!R1C1:R70C14, RC2, 2) -> #REF!
A245: 0 | B245: 245 | C245: =INDEX(2001Grossed!R1C1:R70C14, RC[-1], 1) -> #REF! | D245: =INDEX(2001Grossed!R1C1:R70C14, RC2, 2) -> #REF!
A246: 0 | B246: 246 | C246: =INDEX(2001Grossed!R1C1:R70C14, RC[-1], 1) -> #REF! | D246: =INDEX(2001Grossed!R1C1:R70C14, RC2, 2) -> #REF!
A247: 0 | B247: 247 | C247: =INDEX(2001Grossed!R1C1:R70C14, RC[-1], 1) -> #REF! | D247: =INDEX(2001Grossed!R1C1:R70C14, RC2, 2) -> #REF!
A248: 0 | B248: 248 | C248: =INDEX(2001Grossed!R1C1:R70C14, RC[-1], 1) -> #REF! | D248: =INDEX(2001Grossed!R1C1:R70C14, RC2, 2) -> #REF!
A249: 0 | B249: 249 | C249: =INDEX(2001Grossed!R1C1:R70C14, RC[-1], 1) -> #REF! | D249: =INDEX(2001Grossed!R1C1:R70C14, RC2, 2) -> #REF!
A250: 0 | B250: 250 | C250: =INDEX(2001Grossed!R1C1:R70C14, RC[-1], 1) -> #REF! | D250: =INDEX(2001Grossed!R1C1:R70C14, RC2, 2) -> #REF!
A251: 0 | B251: 251 | C251: =INDEX(2001Grossed!R1C1:R70C14, RC[-1], 1) -> #REF! | D251: =INDEX(2001Grossed!R1C1:R70C14, RC2, 2) -> #REF!
A252: 0 | B252: 252 | C252: =INDEX(2001Grossed!R1C1:R70C14, RC[-1], 1) -> #REF! | D252: =INDEX(2001Grossed!R1C1:R70C14, RC2, 2) -> #REF!
A253: 0 | B253: 253 | C253: =INDEX(2001Grossed!R1C1:R70C14, RC[-1], 1) -> #REF! | D253: =INDEX(2001Grossed!R1C1:R70C14, RC2, 2) -> #REF!
A254: 0 | B254: 254 | C254: =INDEX(2001Grossed!R1C1:R70C14, RC[-1], 1) -> #REF! | D254: =INDEX(2001Grossed!R1C1:R70C14, RC2, 2) -> #REF!
B255: 255 | C255: =INDEX(2001Grossed!R1C1:R70C14, RC[-1], 1) -> #REF! | D255: =INDEX(2001Grossed!R1C1:R70C14, RC2, 2) -> #REF!
B256: 256 | C256: =INDEX(2001Grossed!R1C1:R70C14, RC[-1], 1) -> #REF! | D256: =INDEX(2001Grossed!R1C1:R70C14, RC2, 2) -> #REF!
B257: 257 | C257: =INDEX(2001Grossed!R1C1:R70C14, RC[-1], 1) -> #REF! | D257: =INDEX(2001Grossed!R1C1:R70C14, RC2, 2) -> #REF!
B258: 258 | C258: =INDEX(2001Grossed!R1C1:R70C14, RC[-1], 1) -> #REF! | D258: =INDEX(2001Grossed!R1C1:R70C14, RC2, 2) -> #REF!
B259: 259 | C259: =INDEX(2001Grossed!R1C1:R70C14, RC[-1], 1) -> #REF! | D259: =INDEX(2001Grossed!R1C1:R70C14, RC2, 2) -> #REF!
B260: 260 | C260: =INDEX(2001Grossed!R1C1:R70C14, RC[-1], 1) -> #REF! | D260: =INDEX(2001Grossed!R1C1:R70C14, RC2, 2) -> #REF!
B261: 261 | C261: =INDEX(2001Grossed!R1C1:R70C14, RC[-1], 1) -> #REF! | D261: =INDEX(2001Grossed!R1C1:R70C14, RC2, 2) -> #REF!
B262: 262 | C262: =INDEX(2001Grossed!R1C1:R70C14, RC[-1], 1) -> #REF! | D262: =INDEX(2001Grossed!R1C1:R70C14, RC2, 2) -> #REF!
B263: 263 | C263: =INDEX(2001Grossed!R1C1:R70C14, RC[-1], 1) -> #REF! | D263: =INDEX(2001Grossed!R1C1:R70C14, RC2, 2) -> #REF!
B264: 264 | C264: =INDEX(2001Grossed!R1C1:R70C14, RC[-1], 1) -> #REF! | D264: =INDEX(2001Grossed!R1C1:R70C14, RC2, 2) -> #REF!
B265: 265 | C265: =INDEX(2001Grossed!R1C1:R70C14, RC[-1], 1) -> #REF! | D265: =INDEX(2001Grossed!R1C1:R70C14, RC2, 2) -> #REF!
B266: 266 | C266: =INDEX(2001Grossed!R1C1:R70C14, RC[-1], 1) -> #REF! | D266: =INDEX(2001Grossed!R1C1:R70C14, RC2, 2) -> #REF!
B267: 267 | C267: =INDEX(2001Grossed!R1C1:R70C14, RC[-1], 1) -> #REF! | D267: =INDEX(2001Grossed!R1C1:R70C14, RC2, 2) -> #REF!
B268: 268 | C268: =INDEX(2001Grossed!R1C1:R70C14, RC[-1], 1) -> #REF! | D268: =INDEX(2001Grossed!R1C1:R70C14, RC2, 2) -> #REF!
B269: 269 | C269: =INDEX(2001Grossed!R1C1:R70C14, RC[-1], 1) -> #REF! | D269: =INDEX(2001Grossed!R1C1:R70C14, RC2, 2) -> #REF!
B270: 270 | C270: =INDEX(2001Grossed!R1C1:R70C14, RC[-1], 1) -> #REF! | D270: =INDEX(2001Grossed!R1C1:R70C14, RC2, 2) -> #REF!
B271: 271 | C271: =INDEX(2001Grossed!R1C1:R70C14, RC[-1], 1) -> #REF! | D271: =INDEX(2001Grossed!R1C1:R70C14, RC2, 2) -> #REF!
B272: 272 | C272: =INDEX(2001Grossed!R1C1:R70C14, RC[-1], 1) -> #REF! | D272: =INDEX(2001Grossed!R1C1:R70C14, RC2, 2) -> #REF!
B273: 273 | C273: =INDEX(2001Grossed!R1C1:R70C14, RC[-1], 1) -> #REF! | D273: =INDEX(2001Grossed!R1C1:R70C14, RC2, 2) -> #REF!
B274: 274 | C274: =INDEX(2001Grossed!R1C1:R70C14, RC[-1], 1) -> #REF! | D274: =INDEX(2001Grossed!R1C1:R70C14, RC2, 2) -> #REF!
B275: 275 | C275: =INDEX(2001Grossed!R1C1:R70C14, RC[-1], 1) -> #REF! | D275: =INDEX(2001Grossed!R1C1:R70C14, RC2, 2) -> #REF!
B276: 276 | C276: =INDEX(2001Grossed!R1C1:R70C14, RC[-1], 1) -> #REF! | D276: =INDEX(2001Grossed!R1C1:R70C14, RC2, 2) -> #REF!
B277: 277 | C277: =INDEX(2001Grossed!R1C1:R70C14, RC[-1], 1) -> #REF! | D277: =INDEX(2001Grossed!R1C1:R70C14, RC2, 2) -> #REF!
B278: 278 | C278: =INDEX(2001Grossed!R1C1:R70C14, RC[-1], 1) -> #REF! | D278: =INDEX(2001Grossed!R1C1:R70C14, RC2, 2) -> #REF!
B279: 279 | C279: =INDEX(2001Grossed!R1C1:R70C14, RC[-1], 1) -> #REF! | D279: =INDEX(2001Grossed!R1C1:R70C14, RC2, 2) -> #REF!
B280: 280 | C280: =INDEX(2001Grossed!R1C1:R70C14, RC[-1], 1) -> #REF! | D280: =INDEX(2001Grossed!R1C1:R70C14, RC2, 2) -> #REF!
B281: 281 | C281: =INDEX(2001Grossed!R1C1:R70C14, RC[-1], 1) -> #REF! | D281: =INDEX(2001Grossed!R1C1:R70C14, RC2, 2) -> #REF!
B282: 282 | C282: =INDEX(2001Grossed!R1C1:R70C14, RC[-1], 1) -> #REF! | D282: =INDEX(2001Grossed!R1C1:R70C14, RC2, 2) -> #REF!
B283: 283 | C283: =INDEX(2001Grossed!R1C1:R70C14, RC[-1], 1) -> #REF! | D283: =INDEX(2001Grossed!R1C1:R70C14, RC2, 2) -> #REF!
B284: 284 | C284: =INDEX(2001Grossed!R1C1:R70C14, RC[-1], 1) -> #REF! | D284: =INDEX(2001Grossed!R1C1:R70C14, RC2, 2) -> #REF!
B285: 285 | C285: =INDEX(2001Grossed!R1C1:R70C14, RC[-1], 1) -> #REF! | D285: =INDEX(2001Grossed!R1C1:R70C14, RC2, 2) -> #REF!
B286: 286 | C286: =INDEX(2001Grossed!R1C1:R70C14, RC[-1], 1) -> #REF! | D286: =INDEX(2001Grossed!R1C1:R70C14, RC2, 2) -> #REF!
B287: 287 | C287: =INDEX(2001Grossed!R1C1:R70C14, RC[-1], 1) -> #REF! | D287: =INDEX(2001Grossed!R1C1:R70C14, RC2, 2) -> #REF!
B288: 288 | C288: =INDEX(2001Grossed!R1C1:R70C14, RC[-1], 1) -> #REF! | D288: =INDEX(2001Grossed!R1C1:R70C14, RC2, 2) -> #REF!
B289: 289 | C289: =INDEX(2001Grossed!R1C1:R70C14, RC[-1], 1) -> #REF! | D289: =INDEX(2001Grossed!R1C1:R70C14, RC2, 2) -> #REF!
B290: 290 | C290: =INDEX(2001Grossed!R1C1:R70C14, RC[-1], 1) -> #REF! | D290: =INDEX(2001Grossed!R1C1:R70C14, RC2, 2) -> #REF!
B291: 291 | C291: =INDEX(2001Grossed!R1C1:R70C14, RC[-1], 1) -> #REF! | D291: =INDEX(2001Grossed!R1C1:R70C14, RC2, 2) -> #REF!
B292: 292 | C292: =INDEX(2001Grossed!R1C1:R70C14, RC[-1], 1) -> #REF! | D292: =INDEX(2001Grossed!R1C1:R70C14, RC2, 2) -> #REF!
B293: 293 | C293: =INDEX(2001Grossed!R1C1:R70C14, RC[-1], 1) -> #REF! | D293: =INDEX(2001Grossed!R1C1:R70C14, RC2, 2) -> #REF!
B294: 294 | C294: =INDEX(2001Grossed!R1C1:R70C14, RC[-1], 1) -> #REF! | D294: =INDEX(2001Grossed!R1C1:R70C14, RC2, 2) -> #REF!
B295: 295 | C295: =INDEX(2001Grossed!R1C1:R70C14, RC[-1], 1) -> #REF! | D295: =INDEX(2001Grossed!R1C1:R70C14, RC2, 2) -> #REF!
B296: 296 | C296: =INDEX(2001Grossed!R1C1:R70C14, RC[-1], 1) -> #REF! | D296: =INDEX(2001Grossed!R1C1:R70C14, RC2, 2) -> #REF!
B297: 297 | C297: =INDEX(2001Grossed!R1C1:R70C14, RC[-1], 1) -> #REF! | D297: =INDEX(2001Grossed!R1C1:R70C14, RC2, 2) -> #REF!
B298: 298 | C298: =INDEX(2001Grossed!R1C1:R70C14, RC[-1], 1) -> #REF! | D298: =INDEX(2001Grossed!R1C1:R70C14, RC2, 2) -> #REF!
B299: 299 | C299: =INDEX(2001Grossed!R1C1:R70C14, RC[-1], 1) -> #REF! | D299: =INDEX(2001Grossed!R1C1:R70C14, RC2, 2) -> #REF!
B300: 300 | C300: =INDEX(2001Grossed!R1C1:R70C14, RC[-1], 1) -> #REF! | D300: =INDEX(2001Grossed!R1C1:R70C14, RC2, 2) -> #REF!
B301: 301 | C301: =INDEX(2001Grossed!R1C1:R70C14, RC[-1], 1) -> #REF! | D301: =INDEX(2001Grossed!R1C1:R70C14, RC2, 2) -> #REF!
B302: 302 | C302: =INDEX(2001Grossed!R1C1:R70C14, RC[-1], 1) -> #REF! | D302: =INDEX(2001Grossed!R1C1:R70C14, RC2, 2) -> #REF!
B303: 303 | C303: =INDEX(2001Grossed!R1C1:R70C14, RC[-1], 1) -> #REF! | D303: =INDEX(2001Grossed!R1C1:R70C14, RC2, 2) -> #REF!
B304: 304 | C304: =INDEX(2001Grossed!R1C1:R70C14, RC[-1], 1) -> #REF! | D304: =INDEX(2001Grossed!R1C1:R70C14, RC2, 2) -> #REF!
B305: 305 | C305: =INDEX(2001Grossed!R1C1:R70C14, RC[-1], 1) -> #REF! | D305: =INDEX(2001Grossed!R1C1:R70C14, RC2, 2) -> #REF!
B306: 306 | C306: =INDEX(2001Grossed!R1C1:R70C14, RC[-1], 1) -> #REF! | D306: =INDEX(2001Grossed!R1C1:R70C14, RC2, 2) -> #REF!
B307: 307 | C307: =INDEX(2001Grossed!R1C1:R70C14, RC[-1], 1) -> #REF! | D307: =INDEX(2001Grossed!R1C1:R70C14, RC2, 2) -> #REF!
B308: 308 | C308: =INDEX(2001Grossed!R1C1:R70C14, RC[-1], 1) -> #REF! | D308: =INDEX(2001Grossed!R1C1:R70C14, RC2, 2) -> #REF!
B309: 309 | C309: =INDEX(2001Grossed!R1C1:R70C14, RC[-1], 1) -> #REF! | D309: =INDEX(2001Grossed!R1C1:R70C14, RC2, 2) -> #REF!
B310: 310 | C310: =INDEX(2001Grossed!R1C1:R70C14, RC[-1], 1) -> #REF! | D310: =INDEX(2001Grossed!R1C1:R70C14, RC2, 2) -> #REF!
B311: 311 | C311: =INDEX(2001Grossed!R1C1:R70C14, RC[-1], 1) -> #REF! | D311: =INDEX(2001Grossed!R1C1:R70C14, RC2, 2) -> #REF!
B312: 312 | C312: =INDEX(2001Grossed!R1C1:R70C14, RC[-1], 1) -> #REF! | D312: =INDEX(2001Grossed!R1C1:R70C14, RC2, 2) -> #REF!
B313: 313 | C313: =INDEX(2001Grossed!R1C1:R70C14, RC[-1], 1) -> #REF! | D313: =INDEX(2001Grossed!R1C1:R70C14, RC2, 2) -> #REF!
B314: 314 | C314: =INDEX(2001Grossed!R1C1:R70C14, RC[-1], 1) -> #REF! | D314: =INDEX(2001Grossed!R1C1:R70C14, RC2, 2) -> #REF!
B315: 315 | C315: =INDEX(2001Grossed!R1C1:R70C14, RC[-1], 1) -> #REF! | D315: =INDEX(2001Grossed!R1C1:R70C14, RC2, 2) -> #REF!
B316: 316 | C316: =INDEX(2001Grossed!R1C1:R70C14, RC[-1], 1) -> #REF! | D316: =INDEX(2001Grossed!R1C1:R70C14, RC2, 2) -> #REF!
B317: 317 | C317: =INDEX(2001Grossed!R1C1:R70C14, RC[-1], 1) -> #REF! | D317: =INDEX(2001Grossed!R1C1:R70C14, RC2, 2) -> #REF!
B318: 318 | C318: =INDEX(2001Grossed!R1C1:R70C14, RC[-1], 1) -> #REF! | D318: =INDEX(2001Grossed!R1C1:R70C14, RC2, 2) -> #REF!
B319: 319 | C319: =INDEX(2001Grossed!R1C1:R70C14, RC[-1], 1) -> #REF! | D319: =INDEX(2001Grossed!R1C1:R70C14, RC2, 2) -> #REF!
B320: 320 | C320: =INDEX(2001Grossed!R1C1:R70C14, RC[-1], 1) -> #REF! | D320: =INDEX(2001Grossed!R1C1:R70C14, RC2, 2) -> #REF!
B321: 321 | C321: =INDEX(2001Grossed!R1C1:R70C14, RC[-1], 1) -> #REF! | D321: =INDEX(2001Grossed!R1C1:R70C14, RC2, 2) -> #REF!
B322: 322 | C322: =INDEX(2001Grossed!R1C1:R70C14, RC[-1], 1) -> #REF! | D322: =INDEX(2001Grossed!R1C1:R70C14, RC2, 2) -> #REF!
B323: 323 | C323: =INDEX(2001Grossed!R1C1:R70C14, RC[-1], 1) -> #REF! | D323: =INDEX(2001Grossed!R1C1:R70C14, RC2, 2) -> #REF!
B324: 324 | C324: =INDEX(2001Grossed!R1C1:R70C14, RC[-1], 1) -> #REF! | D324: =INDEX(2001Grossed!R1C1:R70C14, RC2, 2) -> #REF!
B325: 325 | C325: =INDEX(2001Grossed!R1C1:R70C14, RC[-1], 1) -> #REF! | D325: =INDEX(2001Grossed!R1C1:R70C14, RC2, 2) -> #REF!
B326: 326 | C326: =INDEX(2001Grossed!R1C1:R70C14, RC[-1], 1) -> #REF! | D326: =INDEX(2001Grossed!R1C1:R70C14, RC2, 2) -> #REF!
B327: 327 | C327: =INDEX(2001Grossed!R1C1:R70C14, RC[-1], 1) -> #REF! | D327: =INDEX(2001Grossed!R1C1:R70C14, RC2, 2) -> #REF!
B328: 328 | C328: =INDEX(2001Grossed!R1C1:R70C14, RC[-1], 1) -> #REF! | D328: =INDEX(2001Grossed!R1C1:R70C14, RC2, 2) -> #REF!
B329: 329 | C329: =INDEX(2001Grossed!R1C1:R70C14, RC[-1], 1) -> #REF! | D329: =INDEX(2001Grossed!R1C1:R70C14, RC2, 2) -> #REF!
B330: 330 | C330: =INDEX(2001Grossed!R1C1:R70C14, RC[-1], 1) -> #REF! | D330: =INDEX(2001Grossed!R1C1:R70C14, RC2, 2) -> #REF!
B331: 331 | C331: =INDEX(2001Grossed!R1C1:R70C14, RC[-1], 1) -> #REF! | D331: =INDEX(2001Grossed!R1C1:R70C14, RC2, 2) -> #REF!
B332: 332 | C332: =INDEX(2001Grossed!R1C1:R70C14, RC[-1], 1) -> #REF! | D332: =INDEX(2001Grossed!R1C1:R70C14, RC2, 2) -> #REF!
B333: 333 | C333: =INDEX(2001Grossed!R1C1:R70C14, RC[-1], 1) -> #REF! | D333: =INDEX(2001Grossed!R1C1:R70C14, RC2, 2) -> #REF!
B334: 334 | C334: =INDEX(2001Grossed!R1C1:R70C14, RC[-1], 1) -> #REF! | D334: =INDEX(2001Grossed!R1C1:R70C14, RC2, 2) -> #REF!
B335: 335 | C335: =INDEX(2001Grossed!R1C1:R70C14, RC[-1], 1) -> #REF! | D335: =INDEX(2001Grossed!R1C1:R70C14, RC2, 2) -> #REF!
B336: 336 | C336: =INDEX(2001Grossed!R1C1:R70C14, RC[-1], 1) -> #REF! | D336: =INDEX(2001Grossed!R1C1:R70C14, RC2, 2) -> #REF!
B337: 337 | C337: =INDEX(2001Grossed!R1C1:R70C14, RC[-1], 1) -> #REF! | D337: =INDEX(2001Grossed!R1C1:R70C14, RC2, 2) -> #REF!
B338: 338 | C338: =INDEX(2001Grossed!R1C1:R70C14, RC[-1], 1) -> #REF! | D338: =INDEX(2001Grossed!R1C1:R70C14, RC2, 2) -> #REF!
B339: 339 | C339: =INDEX(2001Grossed!R1C1:R70C14, RC[-1], 1) -> #REF! | D339: =INDEX(2001Grossed!R1C1:R70C14, RC2, 2) -> #REF!
B340: 340 | C340: =INDEX(2001Grossed!R1C1:R70C14, RC[-1], 1) -> #REF! | D340: =INDEX(2001Grossed!R1C1:R70C14, RC2, 2) -> #REF!
B341: 341 | C341: =INDEX(2001Grossed!R1C1:R70C14, RC[-1], 1) -> #REF! | D341: =INDEX(2001Grossed!R1C1:R70C14, RC2, 2) -> #REF!
B342: 342 | C342: =INDEX(2001Grossed!R1C1:R70C14, RC[-1], 1) -> #REF! | D342: =INDEX(2001Grossed!R1C1:R70C14, RC2, 2) -> #REF!
B343: 343 | C343: =INDEX(2001Grossed!R1C1:R70C14, RC[-1], 1) -> #REF! | D343: =INDEX(2001Grossed!R1C1:R70C14, RC2, 2) -> #REF!
B344: 344 | C344: =INDEX(2001Grossed!R1C1:R70C14, RC[-1], 1) -> #REF! | D344: =INDEX(2001Grossed!R1C1:R70C14, RC2, 2) -> #REF!
B345: 345 | C345: =INDEX(2001Grossed!R1C1:R70C14, RC[-1], 1) -> #REF! | D345: =INDEX(2001Grossed!R1C1:R70C14, RC2, 2) -> #REF!
B346: 346 | C346: =INDEX(2001Grossed!R1C1:R70C14, RC[-1], 1) -> #REF! | D346: =INDEX(2001Grossed!R1C1:R70C14, RC2, 2) -> #REF!
B347: 347 | C347: =INDEX(2001Grossed!R1C1:R70C14, RC[-1], 1) -> #REF! | D347: =INDEX(2001Grossed!R1C1:R70C14, RC2, 2) -> #REF!
B348: 348 | C348: =INDEX(2001Grossed!R1C1:R70C14, RC[-1], 1) -> #REF! | D348: =INDEX(2001Grossed!R1C1:R70C14, RC2, 2) -> #REF!
B349: 349 | C349: =INDEX(2001Grossed!R1C1:R70C14, RC[-1], 1) -> #REF! | D349: =INDEX(2001Grossed!R1C1:R70C14, RC2, 2) -> #REF!
B350: 350 | C350: =INDEX(2001Grossed!R1C1:R70C14, RC[-1], 1) -> #REF! | D350: =INDEX(2001Grossed!R1C1:R70C14, RC2, 2) -> #REF!
B351: 351 | C351: =INDEX(2001Grossed!R1C1:R70C14, RC[-1], 1) -> #REF! | D351: =INDEX(2001Grossed!R1C1:R70C14, RC2, 2) -> #REF!
B352: 352 | C352: =INDEX(2001Grossed!R1C1:R70C14, RC[-1], 1) -> #REF! | D352: =INDEX(2001Grossed!R1C1:R70C14, RC2, 2) -> #REF!
B353: 353 | C353: =INDEX(2001Grossed!R1C1:R70C14, RC[-1], 1) -> #REF! | D353: =INDEX(2001Grossed!R1C1:R70C14, RC2, 2) -> #REF!
B354: 354 | C354: =INDEX(2001Grossed!R1C1:R70C14, RC[-1], 1) -> #REF! | D354: =INDEX(2001Grossed!R1C1:R70C14, RC2, 2) -> #REF!
B355: 355 | C355: =INDEX(2001Grossed!R1C1:R70C14, RC[-1], 1) -> #REF! | D355: =INDEX(2001Grossed!R1C1:R70C14, RC2, 2) -> #REF!
B356: 356 | C356: =INDEX(2001Grossed!R1C1:R70C14, RC[-1], 1) -> #REF! | D356: =INDEX(2001Grossed!R1C1:R70C14, RC2, 2) -> #REF!
B357: 357 | C357: =INDEX(2001Grossed!R1C1:R70C14, RC[-1], 1) -> #REF! | D357: =INDEX(2001Grossed!R1C1:R70C14, RC2, 2) -> #REF!
B358: 358 | C358: =INDEX(2001Grossed!R1C1:R70C14, RC[-1], 1) -> #REF! | D358: =INDEX(2001Grossed!R1C1:R70C14, RC2, 2) -> #REF!
B359: 359 | C359: =INDEX(2001Grossed!R1C1:R70C14, RC[-1], 1) -> #REF! | D359: =INDEX(2001Grossed!R1C1:R70C14, RC2, 2) -> #REF!
B360: 360 | C360: =INDEX(2001Grossed!R1C1:R70C14, RC[-1], 1) -> #REF! | D360: =INDEX(2001Grossed!R1C1:R70C14, RC2, 2) -> #REF!
B361: 361 | C361: =INDEX(2001Grossed!R1C1:R70C14, RC[-1], 1) -> #REF! | D361: =INDEX(2001Grossed!R1C1:R70C14, RC2, 2) -> #REF!
B362: 362 | C362: =INDEX(2001Grossed!R1C1:R70C14, RC[-1], 1) -> #REF! | D362: =INDEX(2001Grossed!R1C1:R70C14, RC2, 2) -> #REF!
B363: 363 | C363: =INDEX(2001Grossed!R1C1:R70C14, RC[-1], 1) -> #REF! | D363: =INDEX(2001Grossed!R1C1:R70C14, RC2, 2) -> #REF!
B364: 364 | C364: =INDEX(2001Grossed!R1C1:R70C14, RC[-1], 1) -> #REF! | D364: =INDEX(2001Grossed!R1C1:R70C14, RC2, 2) -> #REF!
B365: 365 | C365: =INDEX(2001Grossed!R1C1:R70C14, RC[-1], 1) -> #REF! | D365: =INDEX(2001Grossed!R1C1:R70C14, RC2, 2) -> #REF!
B366: 366 | C366: =INDEX(2001Grossed!R1C1:R70C14, RC[-1], 1) -> #REF! | D366: =INDEX(2001Grossed!R1C1:R70C14, RC2, 2) -> #REF!
B367: 367 | C367: =INDEX(2001Grossed!R1C1:R70C14, RC[-1], 1) -> #REF! | D367: =INDEX(2001Grossed!R1C1:R70C14, RC2, 2) -> #REF!
B368: 368 | C368: =INDEX(2001Grossed!R1C1:R70C14, RC[-1], 1) -> #REF! | D368: =INDEX(2001Grossed!R1C1:R70C14, RC2, 2) -> #REF!
B369: 369 | C369: =INDEX(2001Grossed!R1C1:R70C14, RC[-1], 1) -> #REF! | D369: =INDEX(2001Grossed!R1C1:R70C14, RC2, 2) -> #REF!
B370: 370 | C370: =INDEX(2001Grossed!R1C1:R70C14, RC[-1], 1) -> #REF! | D370: =INDEX(2001Grossed!R1C1:R70C14, RC2, 2) -> #REF!
B371: 371 | C371: =INDEX(2001Grossed!R1C1:R70C14, RC[-1], 1) -> #REF! | D371: =INDEX(2001Grossed!R1C1:R70C14, RC2, 2) -> #REF!
B372: 372 | C372: =INDEX(2001Grossed!R1C1:R70C14, RC[-1], 1) -> #REF! | D372: =INDEX(2001Grossed!R1C1:R70C14, RC2, 2) -> #REF!
B373: 373 | C373: =INDEX(2001Grossed!R1C1:R70C14, RC[-1], 1) -> #REF! | D373: =INDEX(2001Grossed!R1C1:R70C14, RC2, 2) -> #REF!
B374: 374 | C374: =INDEX(2001Grossed!R1C1:R70C14, RC[-1], 1) -> #REF! | D374: =INDEX(2001Grossed!R1C1:R70C14, RC2, 2) -> #REF!
B375: 375 | C375: =INDEX(2001Grossed!R1C1:R70C14, RC[-1], 1) -> #REF! | D375: =INDEX(2001Grossed!R1C1:R70C14, RC2, 2) -> #REF!
B376: 376 | C376: =INDEX(2001Grossed!R1C1:R70C14, RC[-1], 1) -> #REF! | D376: =INDEX(2001Grossed!R1C1:R70C14, RC2, 2) -> #REF!
B377: 377 | C377: =INDEX(2001Grossed!R1C1:R70C14, RC[-1], 1) -> #REF! | D377: =INDEX(2001Grossed!R1C1:R70C14, RC2, 2) -> #REF!
B378: 378 | C378: =INDEX(2001Grossed!R1C1:R70C14, RC[-1], 1) -> #REF! | D378: =INDEX(2001Grossed!R1C1:R70C14, RC2, 2) -> #REF!
B379: 379 | C379: =INDEX(2001Grossed!R1C1:R70C14, RC[-1], 1) -> #REF! | D379: =INDEX(2001Grossed!R1C1:R70C14, RC2, 2) -> #REF!
B380: 380 | C380: =INDEX(2001Grossed!R1C1:R70C14, RC[-1], 1) -> #REF! | D380: =INDEX(2001Grossed!R1C1:R70C14, RC2, 2) -> #REF!
B381: 381 | C381: =INDEX(2001Grossed!R1C1:R70C14, RC[-1], 1) -> #REF! | D381: =INDEX(2001Grossed!R1C1:R70C14, RC2, 2) -> #REF!
B382: 382 | C382: =INDEX(2001Grossed!R1C1:R70C14, RC[-1], 1) -> #REF! | D382: =INDEX(2001Grossed!R1C1:R70C14, RC2, 2) -> #REF!
B383: 383 | C383: =INDEX(2001Grossed!R1C1:R70C14, RC[-1], 1) -> #REF! | D383: =INDEX(2001Grossed!R1C1:R70C14, RC2, 2) -> #REF!
B384: 384 | C384: =INDEX(2001Grossed!R1C1:R70C14, RC[-1], 1) -> #REF! | D384: =INDEX(2001Grossed!R1C1:R70C14, RC2, 2) -> #REF!
B385: 385 | C385: =INDEX(2001Grossed!R1C1:R70C14, RC[-1], 1) -> #REF! | D385: =INDEX(2001Grossed!R1C1:R70C14, RC2, 2) -> #REF!
B386: 386 | C386: =INDEX(2001Grossed!R1C1:R70C14, RC[-1], 1) -> #REF! | D386: =INDEX(2001Grossed!R1C1:R70C14, RC2, 2) -> #REF!
B387: 387 | C387: =INDEX(2001Grossed!R1C1:R70C14, RC[-1], 1) -> #REF! | D387: =INDEX(2001Grossed!R1C1:R70C14, RC2, 2) -> #REF!
B388: 388 | C388: =INDEX(2001Grossed!R1C1:R70C14, RC[-1], 1) -> #REF! | D388: =INDEX(2001Grossed!R1C1:R70C14, RC2, 2) -> #REF!
B389: 389 | C389: =INDEX(2001Grossed!R1C1:R70C14, RC[-1], 1) -> #REF! | D389: =INDEX(2001Grossed!R1C1:R70C14, RC2, 2) -> #REF!
B390: 390 | C390: =INDEX(2001Grossed!R1C1:R70C14, RC[-1], 1) -> #REF! | D390: =INDEX(2001Grossed!R1C1:R70C14, RC2, 2) -> #REF!
B391: 391 | C391: =INDEX(2001Grossed!R1C1:R70C14, RC[-1], 1) -> #REF! | D391: =INDEX(2001Grossed!R1C1:R70C14, RC2, 2) -> #REF!
B392: 392 | C392: =INDEX(2001Grossed!R1C1:R70C14, RC[-1], 1) -> #REF! | D392: =INDEX(2001Grossed!R1C1:R70C14, RC2, 2) -> #REF!
B393: 393 | C393: =INDEX(2001Grossed!R1C1:R70C14, RC[-1], 1) -> #REF! | D393: =INDEX(2001Grossed!R1C1:R70C14, RC2, 2) -> #REF!
B394: 394 | C394: =INDEX(2001Grossed!R1C1:R70C14, RC[-1], 1) -> #REF! | D394: =INDEX(2001Grossed!R1C1:R70C14, RC2, 2) -> #REF!
B395: 395 | C395: =INDEX(2001Grossed!R1C1:R70C14, RC[-1], 1) -> #REF! | D395: =INDEX(2001Grossed!R1C1:R70C14, RC2, 2) -> #REF!
B396: 396 | C396: =INDEX(2001Grossed!R1C1:R70C14, RC[-1], 1) -> #REF! | D396: =INDEX(2001Grossed!R1C1:R70C14, RC2, 2) -> #REF!
B397: 397 | C397: =INDEX(2001Grossed!R1C1:R70C14, RC[-1], 1) -> #REF! | D397: =INDEX(2001Grossed!R1C1:R70C14, RC2, 2) -> #REF!
B398: 398 | C398: =INDEX(2001Grossed!R1C1:R70C14, RC[-1], 1) -> #REF! | D398: =INDEX(2001Grossed!R1C1:R70C14, RC2, 2) -> #REF!
B399: 399 | C399: =INDEX(2001Grossed!R1C1:R70C14, RC[-1], 1) -> #REF! | D399: =INDEX(2001Grossed!R1C1:R70C14, RC2, 2) -> #REF!
B400: 400 | C400: =INDEX(2001Grossed!R1C1:R70C14, RC[-1], 1) -> #REF! | D400: =INDEX(2001Grossed!R1C1:R70C14, RC2, 2) -> #REF!
B401: 401 | C401: =INDEX(2001Grossed!R1C1:R70C14, RC[-1], 1) -> #REF! | D401: =INDEX(2001Grossed!R1C1:R70C14, RC2, 2) -> #REF!
B402: 402 | C402: =INDEX(2001Grossed!R1C1:R70C14, RC[-1], 1) -> #REF! | D402: =INDEX(2001Grossed!R1C1:R70C14, RC2, 2) -> #REF!
B403: 403 | C403: =INDEX(2001Grossed!R1C1:R70C14, RC[-1], 1) -> #REF! | D403: =INDEX(2001Grossed!R1C1:R70C14, RC2, 2) -> #REF!
B404: 404 | C404: =INDEX(2001Grossed!R1C1:R70C14, RC[-1], 1) -> #REF! | D404: =INDEX(2001Grossed!R1C1:R70C14, RC2, 2) -> #REF!
B405: 405 | C405: =INDEX(2001Grossed!R1C1:R70C14, RC[-1], 1) -> #REF! | D405: =INDEX(2001Grossed!R1C1:R70C14, RC2, 2) -> #REF!
B406: 406 | C406: =INDEX(2001Grossed!R1C1:R70C14, RC[-1], 1) -> #REF! | D406: =INDEX(2001Grossed!R1C1:R70C14, RC2, 2) -> #REF!
B407: 407 | C407: =INDEX(2001Grossed!R1C1:R70C14, RC[-1], 1) -> #REF! | D407: =INDEX(2001Grossed!R1C1:R70C14, RC2, 2) -> #REF!
B408: 408 | C408: =INDEX(2001Grossed!R1C1:R70C14, RC[-1], 1) -> #REF! | D408: =INDEX(2001Grossed!R1C1:R70C14, RC2, 2) -> #REF!
B409: 409 | C409: =INDEX(2001Grossed!R1C1:R70C14, RC[-1], 1) -> #REF! | D409: =INDEX(2001Grossed!R1C1:R70C14, RC2, 2) -> #REF!
B410: 410 | C410: =INDEX(2001Grossed!R1C1:R70C14, RC[-1], 1) -> #REF! | D410: =INDEX(2001Grossed!R1C1:R70C14, RC2, 2) -> #REF!
B411: 411 | C411: =INDEX(2001Grossed!R1C1:R70C14, RC[-1], 1) -> #REF! | D411: =INDEX(2001Grossed!R1C1:R70C14, RC2, 2) -> #REF!
B412: 412 | C412: =INDEX(2001Grossed!R1C1:R70C14, RC[-1], 1) -> #REF! | D412: =INDEX(2001Grossed!R1C1:R70C14, RC2, 2) -> #REF!
B413: 413 | C413: =INDEX(2001Grossed!R1C1:R70C14, RC[-1], 1) -> #REF! | D413: =INDEX(2001Grossed!R1C1:R70C14, RC2, 2) -> #REF!
B414: 414 | C414: =INDEX(2001Grossed!R1C1:R70C14, RC[-1], 1) -> #REF! | D414: =INDEX(2001Grossed!R1C1:R70C14, RC2, 2) -> #REF!
B415: 415 | C415: =INDEX(2001Grossed!R1C1:R70C14, RC[-1], 1) -> #REF! | D415: =INDEX(2001Grossed!R1C1:R70C14, RC2, 2) -> #REF!
B416: 416 | C416: =INDEX(2001Grossed!R1C1:R70C14, RC[-1], 1) -> #REF! | D416: =INDEX(2001Grossed!R1C1:R70C14, RC2, 2) -> #REF!
B417: 417 | C417: =INDEX(2001Grossed!R1C1:R70C14, RC[-1], 1) -> #REF! | D417: =INDEX(2001Grossed!R1C1:R70C14, RC2, 2) -> #REF!
B418: 418 | C418: =INDEX(2001Grossed!R1C1:R70C14, RC[-1], 1) -> #REF! | D418: =INDEX(2001Grossed!R1C1:R70C14, RC2, 2) -> #REF!
B419: 419 | C419: =INDEX(2001Grossed!R1C1:R70C14, RC[-1], 1) -> #REF! | D419: =INDEX(2001Grossed!R1C1:R70C14, RC2, 2) -> #REF!
B420: 420 | C420: =INDEX(2001Grossed!R1C1:R70C14, RC[-1], 1) -> #REF! | D420: =INDEX(2001Grossed!R1C1:R70C14, RC2, 2) -> #REF!
B421: 421 | C421: =INDEX(2001Grossed!R1C1:R70C14, RC[-1], 1) -> #REF! | D421: =INDEX(2001Grossed!R1C1:R70C14, RC2, 2) -> #REF!
B422: 422 | C422: =INDEX(2001Grossed!R1C1:R70C14, RC[-1], 1) -> #REF! | D422: =INDEX(2001Grossed!R1C1:R70C14, RC2, 2) -> #REF!
B423: 423 | C423: =INDEX(2001Grossed!R1C1:R70C14, RC[-1], 1) -> #REF! | D423: =INDEX(2001Grossed!R1C1:R70C14, RC2, 2) -> #REF!
B424: 424 | C424: =INDEX(2001Grossed!R1C1:R70C14, RC[-1], 1) -> #REF! | D424: =INDEX(2001Grossed!R1C1:R70C14, RC2, 2) -> #REF!
B425: 425 | C425: =INDEX(2001Grossed!R1C1:R70C14, RC[-1], 1) -> #REF! | D425: =INDEX(2001Grossed!R1C1:R70C14, RC2, 2) -> #REF!
B426: 426 | C426: =INDEX(2001Grossed!R1C1:R70C14, RC[-1], 1) -> #REF! | D426: =INDEX(2001Grossed!R1C1:R70C14, RC2, 2) -> #REF!
B427: 427 | C427: =INDEX(2001Grossed!R1C1:R70C14, RC[-1], 1) -> #REF! | D427: =INDEX(2001Grossed!R1C1:R70C14, RC2, 2) -> #REF!
B428: 428 | C428: =INDEX(2001Grossed!R1C1:R70C14, RC[-1], 1) -> #REF! | D428: =INDEX(2001Grossed!R1C1:R70C14, RC2, 2) -> #REF!
B429: 429 | C429: =INDEX(2001Grossed!R1C1:R70C14, RC[-1], 1) -> #REF! | D429: =INDEX(2001Grossed!R1C1:R70C14, RC2, 2) -> #REF!
B430: 430 | C430: =INDEX(2001Grossed!R1C1:R70C14, RC[-1], 1) -> #REF! | D430: =INDEX(2001Grossed!R1C1:R70C14, RC2, 2) -> #REF!
B431: 431 | C431: =INDEX(2001Grossed!R1C1:R70C14, RC[-1], 1) -> #REF! | D431: =INDEX(2001Grossed!R1C1:R70C14, RC2, 2) -> #REF!
B432: 432 | C432: =INDEX(2001Grossed!R1C1:R70C14, RC[-1], 1) -> #REF! | D432: =INDEX(2001Grossed!R1C1:R70C14, RC2, 2) -> #REF!
B433: 433 | C433: =INDEX(2001Grossed!R1C1:R70C14, RC[-1], 1) -> #REF! | D433: =INDEX(2001Grossed!R1C1:R70C14, RC2, 2) -> #REF!
B434: 434 | C434: =INDEX(2001Grossed!R1C1:R70C14, RC[-1], 1) -> #REF! | D434: =INDEX(2001Grossed!R1C1:R70C14, RC2, 2) -> #REF!
B435: 435 | C435: =INDEX(2001Grossed!R1C1:R70C14, RC[-1], 1) -> #REF! | D435: =INDEX(2001Grossed!R1C1:R70C14, RC2, 2) -> #REF!
B436: 436 | C436: =INDEX(2001Grossed!R1C1:R70C14, RC[-1], 1) -> #REF! | D436: =INDEX(2001Grossed!R1C1:R70C14, RC2, 2) -> #REF!
B437: 437 | C437: =INDEX(2001Grossed!R1C1:R70C14, RC[-1], 1) -> #REF! | D437: =INDEX(2001Grossed!R1C1:R70C14, RC2, 2) -> #REF!
B438: 438 | C438: =INDEX(2001Grossed!R1C1:R70C14, RC[-1], 1) -> #REF! | D438: =INDEX(2001Grossed!R1C1:R70C14, RC2, 2) -> #REF!
B439: 439 | C439: =INDEX(2001Grossed!R1C1:R70C14, RC[-1], 1) -> #REF! | D439: =INDEX(2001Grossed!R1C1:R70C14, RC2, 2) -> #REF!
B440: 440 | C440: =INDEX(2001Grossed!R1C1:R70C14, RC[-1], 1) -> #REF! | D440: =INDEX(2001Grossed!R1C1:R70C14, RC2, 2) -> #REF!
B441: 441 | C441: =INDEX(2001Grossed!R1C1:R70C14, RC[-1], 1) -> #REF! | D441: =INDEX(2001Grossed!R1C1:R70C14, RC2, 2) -> #REF!
B442: 442 | C442: =INDEX(2001Grossed!R1C1:R70C14, RC[-1], 1) -> #REF! | D442: =INDEX(2001Grossed!R1C1:R70C14, RC2, 2) -> #REF!
B443: 443 | C443: =INDEX(2001Grossed!R1C1:R70C14, RC[-1], 1) -> #REF! | D443: =INDEX(2001Grossed!R1C1:R70C14, RC2, 2) -> #REF!
B444: 444 | C444: =INDEX(2001Grossed!R1C1:R70C14, RC[-1], 1) -> #REF! | D444: =INDEX(2001Grossed!R1C1:R70C14, RC2, 2) -> #REF!
B445: 445 | C445: =INDEX(2001Grossed!R1C1:R70C14, RC[-1], 1) -> #REF! | D445: =INDEX(2001Grossed!R1C1:R70C14, RC2, 2) -> #REF!
B446: 446 | C446: =INDEX(2001Grossed!R1C1:R70C14, RC[-1], 1) -> #REF! | D446: =INDEX(2001Grossed!R1C1:R70C14, RC2, 2) -> #REF!
B447: 447 | C447: =INDEX(2001Grossed!R1C1:R70C14, RC[-1], 1) -> #REF! | D447: =INDEX(2001Grossed!R1C1:R70C14, RC2, 2) -> #REF!
B448: 448 | C448: =INDEX(2001Grossed!R1C1:R70C14, RC[-1], 1) -> #REF! | D448: =INDEX(2001Grossed!R1C1:R70C14, RC2, 2) -> #REF!
B449: 449 | C449: =INDEX(2001Grossed!R1C1:R70C14, RC[-1], 1) -> #REF! | D449: =INDEX(2001Grossed!R1C1:R70C14, RC2, 2) -> #REF!
B450: 450 | C450: =INDEX(2001Grossed!R1C1:R70C14, RC[-1], 1) -> #REF! | D450: =INDEX(2001Grossed!R1C1:R70C14, RC2, 2) -> #REF!
B451: 451 | C451: =INDEX(2001Grossed!R1C1:R70C14, RC[-1], 1) -> #REF! | D451: =INDEX(2001Grossed!R1C1:R70C14, RC2, 2) -> #REF!
B452: 452 | C452: =INDEX(2001Grossed!R1C1:R70C14, RC[-1], 1) -> #REF! | D452: =INDEX(2001Grossed!R1C1:R70C14, RC2, 2) -> #REF!
B453: 453 | C453: =INDEX(2001Grossed!R1C1:R70C14, RC[-1], 1) -> #REF! | D453: =INDEX(2001Grossed!R1C1:R70C14, RC2, 2) -> #REF!
B454: 454 | C454: =INDEX(2001Grossed!R1C1:R70C14, RC[-1], 1) -> #REF! | D454: =INDEX(2001Grossed!R1C1:R70C14, RC2, 2) -> #REF!
B455: 455 | C455: =INDEX(2001Grossed!R1C1:R70C14, RC[-1], 1) -> #REF! | D455: =INDEX(2001Grossed!R1C1:R70C14, RC2, 2) -> #REF!
B456: 456 | C456: =INDEX(2001Grossed!R1C1:R70C14, RC[-1], 1) -> #REF! | D456: =INDEX(2001Grossed!R1C1:R70C14, RC2, 2) -> #REF!
B457: 457 | C457: =INDEX(2001Grossed!R1C1:R70C14, RC[-1], 1) -> #REF! | D457: =INDEX(2001Grossed!R1C1:R70C14, RC2, 2) -> #REF!
B458: 458 | C458: =INDEX(2001Grossed!R1C1:R70C14, RC[-1], 1) -> #REF! | D458: =INDEX(2001Grossed!R1C1:R70C14, RC2, 2) -> #REF!
B459: 459 | C459: =INDEX(2001Grossed!R1C1:R70C14, RC[-1], 1) -> #REF! | D459: =INDEX(2001Grossed!R1C1:R70C14, RC2, 2) -> #REF!
B460: 460 | C460: =INDEX(2001Grossed!R1C1:R70C14, RC[-1], 1) -> #REF! | D460: =INDEX(2001Grossed!R1C1:R70C14, RC2, 2) -> #REF!
B461: 461 | C461: =INDEX(2001Grossed!R1C1:R70C14, RC[-1], 1) -> #REF! | D461: =INDEX(2001Grossed!R1C1:R70C14, RC2, 2) -> #REF!
B462: 462 | C462: =INDEX(2001Grossed!R1C1:R70C14, RC[-1], 1) -> #REF! | D462: =INDEX(2001Grossed!R1C1:R70C14, RC2, 2) -> #REF!
B463: 463 | C463: =INDEX(2001Grossed!R1C1:R70C14, RC[-1], 1) -> #REF! | D463: =INDEX(2001Grossed!R1C1:R70C14, RC2, 2) -> #REF!
B464: 464 | C464: =INDEX(2001Grossed!R1C1:R70C14, RC[-1], 1) -> #REF! | D464: =INDEX(2001Grossed!R1C1:R70C14, RC2, 2) -> #REF!
B465: 465 | C465: =INDEX(2001Grossed!R1C1:R70C14, RC[-1], 1) -> #REF! | D465: =INDEX(2001Grossed!R1C1:R70C14, RC2, 2) -> #REF!
B466: 466 | C466: =INDEX(2001Grossed!R1C1:R70C14, RC[-1], 1) -> #REF! | D466: =INDEX(2001Grossed!R1C1:R70C14, RC2, 2) -> #REF!
B467: 467 | C467: =INDEX(2001Grossed!R1C1:R70C14, RC[-1], 1) -> #REF! | D467: =INDEX(2001Grossed!R1C1:R70C14, RC2, 2) -> #REF!
B468: 468 | C468: =INDEX(2001Grossed!R1C1:R70C14, RC[-1], 1) -> #REF! | D468: =INDEX(2001Grossed!R1C1:R70C14, RC2, 2) -> #REF!
B469: 469 | C469: =INDEX(2001Grossed!R1C1:R70C14, RC[-1], 1) -> #REF! | D469: =INDEX(2001Grossed!R1C1:R70C14, RC2, 2) -> #REF!
B470: 470 | C470: =INDEX(2001Grossed!R1C1:R70C14, RC[-1], 1) -> #REF! | D470: =INDEX(2001Grossed!R1C1:R70C14, RC2, 2) -> #REF!
B471: 471 | C471: =INDEX(2001Grossed!R1C1:R70C14, RC[-1], 1) -> #REF! | D471: =INDEX(2001Grossed!R1C1:R70C14, RC2, 2) -> #REF!
B472: 472 | C472: =INDEX(2001Grossed!R1C1:R70C14, RC[-1], 1) -> #REF! | D472: =INDEX(2001Grossed!R1C1:R70C14, RC2, 2) -> #REF!
B473: 473 | C473: =INDEX(2001Grossed!R1C1:R70C14, RC[-1], 1) -> #REF! | D473: =INDEX(2001Grossed!R1C1:R70C14, RC2, 2) -> #REF!
B474: 474 | C474: =INDEX(2001Grossed!R1C1:R70C14, RC[-1], 1) -> #REF! | D474: =INDEX(2001Grossed!R1C1:R70C14, RC2, 2) -> #REF!
B475: 475 | C475: =INDEX(2001Grossed!R1C1:R70C14, RC[-1], 1) -> #REF! | D475: =INDEX(2001Grossed!R1C1:R70C14, RC2, 2) -> #REF!
B476: 476 | C476: =INDEX(2001Grossed!R1C1:R70C14, RC[-1], 1) -> #REF! | D476: =INDEX(2001Grossed!R1C1:R70C14, RC2, 2) -> #REF!
B477: 477 | C477: =INDEX(2001Grossed!R1C1:R70C14, RC[-1], 1) -> #REF! | D477: =INDEX(2001Grossed!R1C1:R70C14, RC2, 2) -> #REF!
B478: 478 | C478: =INDEX(2001Grossed!R1C1:R70C14, RC[-1], 1) -> #REF! | D478: =INDEX(2001Grossed!R1C1:R70C14, RC2, 2) -> #REF!
B479: 479 | C479: =INDEX(2001Grossed!R1C1:R70C14, RC[-1], 1) -> #REF! | D479: =INDEX(2001Grossed!R1C1:R70C14, RC2, 2) -> #REF!
B480: 480 | C480: =INDEX(2001Grossed!R1C1:R70C14, RC[-1], 1) -> #REF! | D480: =INDEX(2001Grossed!R1C1:R70C14, RC2, 2) -> #REF!
B481: 481 | C481: =INDEX(2001Grossed!R1C1:R70C14, RC[-1], 1) -> #REF! | D481: =INDEX(2001Grossed!R1C1:R70C14, RC2, 2) -> #REF!
B482: 482 | C482: =INDEX(2001Grossed!R1C1:R70C14, RC[-1], 1) -> #REF! | D482: =INDEX(2001Grossed!R1C1:R70C14, RC2, 2) -> #REF!
B483: 483 | C483: =INDEX(2001Grossed!R1C1:R70C14, RC[-1], 1) -> #REF! | D483: =INDEX(2001Grossed!R1C1:R70C14, RC2, 2) -> #REF!
B484: 484 | C484: =INDEX(2001Grossed!R1C1:R70C14, RC[-1], 1) -> #REF! | D484: =INDEX(2001Grossed!R1C1:R70C14, RC2, 2) -> #REF!
B485: 485 | C485: =INDEX(2001Grossed!R1C1:R70C14, RC[-1], 1) -> #REF! | D485: =INDEX(2001Grossed!R1C1:R70C14, RC2, 2) -> #REF!
B486: 486 | C486: =INDEX(2001Grossed!R1C1:R70C14, RC[-1], 1) -> #REF! | D486: =INDEX(2001Grossed!R1C1:R70C14, RC2, 2) -> #REF!
B487: 487 | C487: =INDEX(2001Grossed!R1C1:R70C14, RC[-1], 1) -> #REF! | D487: =INDEX(2001Grossed!R1C1:R70C14, RC2, 2) -> #REF!
B488: 488 | C488: =INDEX(2001Grossed!R1C1:R70C14, RC[-1], 1) -> #REF! | D488: =INDEX(2001Grossed!R1C1:R70C14, RC2, 2) -> #REF!
B489: 489 | C489: =INDEX(2001Grossed!R1C1:R70C14, RC[-1], 1) -> #REF! | D489: =INDEX(2001Grossed!R1C1:R70C14, RC2, 2) -> #REF!
B490: 490 | C490: =INDEX(2001Grossed!R1C1:R70C14, RC[-1], 1) -> #REF! | D490: =INDEX(2001Grossed!R1C1:R70C14, RC2, 2) -> #REF!
B491: 491 | C491: =INDEX(2001Grossed!R1C1:R70C14, RC[-1], 1) -> #REF! | D491: =INDEX(2001Grossed!R1C1:R70C14, RC2, 2) -> #REF!
B492: 492 | C492: =INDEX(2001Grossed!R1C1:R70C14, RC[-1], 1) -> #REF! | D492: =INDEX(2001Grossed!R1C1:R70C14, RC2, 2) -> #REF!
B493: 493 | C493: =INDEX(2001Grossed!R1C1:R70C14, RC[-1], 1) -> #REF! | D493: =INDEX(2001Grossed!R1C1:R70C14, RC2, 2) -> #REF!
B494: 494 | C494: =INDEX(2001Grossed!R1C1:R70C14, RC[-1], 1) -> #REF! | D494: =INDEX(2001Grossed!R1C1:R70C14, RC2, 2) -> #REF!
B495: 495 | C495: =INDEX(2001Grossed!R1C1:R70C14, RC[-1], 1) -> #REF! | D495: =INDEX(2001Grossed!R1C1:R70C14, RC2, 2) -> #REF!
B496: 496 | C496: =INDEX(2001Grossed!R1C1:R70C14, RC[-1], 1) -> #REF! | D496: =INDEX(2001Grossed!R1C1:R70C14, RC2, 2) -> #REF!
B497: 497 | C497: =INDEX(2001Grossed!R1C1:R70C14, RC[-1], 1) -> #REF! | D497: =INDEX(2001Grossed!R1C1:R70C14, RC2, 2) -> #REF!
B498: 498 | C498: =INDEX(2001Grossed!R1C1:R70C14, RC[-1], 1) -> #REF! | D498: =INDEX(2001Grossed!R1C1:R70C14, RC2, 2) -> #REF!
B499: 499 | C499: =INDEX(2001Grossed!R1C1:R70C14, RC[-1], 1) -> #REF! | D499: =INDEX(2001Grossed!R1C1:R70C14, RC2, 2) -> #REF!
B500: 500 | C500: =INDEX(2001Grossed!R1C1:R70C14, RC[-1], 1) -> #REF! | D500: =INDEX(2001Grossed!R1C1:R70C14, RC2, 2) -> #REF!
B501: 501 | C501: =INDEX(2001Grossed!R1C1:R70C14, RC[-1], 1) -> #REF! | D501: =INDEX(2001Grossed!R1C1:R70C14, RC2, 2) -> #REF!

Sheet: @SDF
A1: =DEFINE("VLOOKUP_PICKER", RC[+1], RC[+2], RC[+3], RC[+4]) -> FUN VLOOKUP_PICKER AT #0 | B1: =IF(EQUAL(RC[+1], RC[+2]), RC[+3], "VLOOKUP_MARKER") -> #EMPTY!
A2: =DEFINE("VLOOKUP_REPLACER", RC[+1], RC[+2], RC[+3]) -> FUN VLOOKUP_REPLACER AT #1 | B2: =IF(EQUAL(RC[+1], "VLOOKUP_MARKER"), RC[+2], RC[+1]) -> #EMPTY!
A3: =DEFINE("VLOOKUP", RC[+1], RC[+2], RC[+3], RC[+4]) -> FUN VLOOKUP AT #2 | B3: =IF(EQUAL(RC[+5], "VLOOKUP_MARKER"), NA(), RC[+5]) -> #EMPTY! | G3: =REDUCE(CLOSURE("VLOOKUP_REPLACER"), "VLOOKUP_MARKER", ROWMAP(CLOSURE("VLOOKUP_PICKER", RC[-4], NA(), NA()), HCAT(SLICE(RC[-3], 1, 1, ROWS(RC[-3]), 1), SLICE(RC[-3], 1, RC[-2], ROWS(RC[-3]), RC[-2])))) -> #EMPTY!
A4: =DEFINE("ISNUMBER", RC[+1], RC[+2]) -> FUN ISNUMBER AT #3 | B4: =NOT(ISERROR(RC[+1]+1)) -> 0