Sheet: TheBusiness
A1: 'Outline of the Business
A3: 'This example is based in a fictional business that makes and sells shampoo.
A5: 'Product Range
A6: 'We are a new business, and the product range is small. We have 2 types of shampoo, Apple Blossom and Fragrant Lemon, and each comes in 3 sizes 100ml, 250ml and 500ml. Our product range is:
A8: 'Code | B8: 'Description | C8: 'Bottles per Carton | D8: 'Forecast Cartons per Week
A9: 'AB100 | B9: 'Apple Blossom 100ml | C9: 48 | D9: 1000
A10: 'AB250 | B10: 'Apple Blossom 250ml | C10: 48 | D10: 1400
A11: 'AB500 | B11: 'Apple Blossom 500ml | C11: 24 | D11: 800
A12: 'FL100 | B12: 'Fragrant Lemon 100ml | C12: 48 | D12: 200
A13: 'FL250 | B13: 'Fragrant Lemon 250ml | C13: 48 | D13: 1200
A14: 'FL500 | B14: 'Fragrant Lemon 500ml | C14: 24 | D14: 1600
A16: 'The Process
A17: 'We buy a base shampoo in bulk, pump it into a blending vessel, add either apple or lemon essence to it, stir it, pump it into a holding vessel from where it is fed to the filling line where the bottles are filled, labelled, shrink wrapped 6 together, packed into corrugated cartons, and stacked on pallets.
A19: 'Bill of Materials
A20: 'There is one base shampoo, two fragrances, three bottle sizes and six labels. The 100ml and 250ml bottles are fitted with a flip top cap, and the 500ml bottle has a screw cap. The 100ml bottles are packed 48 to a small carton, the 250ml is packed 48 in a large carton and the 500ml uses the same carton but 24 to a carton. Two of the bottle labels are pasted on the carton, one on each end.
A22: 'Glue, shrink wrap and adhesive tape for the cartons are considered to be consumables, and the pallets are hired from a national pallet pool. The minimum that a customer can buy is one carton, so that is the SKU (stock keeping unit).
A24: 'Capacities
A25: 'Blending is quicker than filling, 100ml and 250ml bottles can be filled at 70 per minute, and 500ml bottles at 40 per minute. To change the line from one bottle size to another takes time, but we shall ignore change over times in this example.

Sheet: ItemMaster
A1: 'Item Master
A3: 'The item master file contains details of both finished products and raw materials.
A4: 'This data would typically be stored in a host system, and transferred to Excel via an ODBC link and MS Query.
A6: 'Code | B6: 'Description | C6: 'Unit of Measure | D6: 'Warehouse | E6: 'Supplier | F6: 'Supplier Name | G6: 'Lead Time Days | H6: 'Inventory
A7: 'AB100 | B7: 'Apple Blossom 100ml | C7: 'carton | D7: 'FP | E7: '01 | F7: =VLOOKUP(RC[-1], SupplierMaster!R4C1:R10C2, 2, 0) -> #ERR: ArgCount | H7: 1854
A8: 'AB250 | B8: 'Apple Blossom 250ml | C8: 'carton | D8: 'FP | E8: '01 | F8: =VLOOKUP(RC[-1], SupplierMaster!R4C1:R10C2, 2, 0) -> #ERR: ArgCount | H8: 1470
A9: 'AB500 | B9: 'Apple Blossom 500ml | C9: 'carton | D9: 'FP | E9: '01 | F9: =VLOOKUP(RC[-1], SupplierMaster!R4C1:R10C2, 2, 0) -> #ERR: ArgCount | H9: 470
A10: 'FL100 | B10: 'Fragrant Lemon 100ml | C10: 'carton | D10: 'FP | E10: '01 | F10: =VLOOKUP(RC[-1], SupplierMaster!R4C1:R10C2, 2, 0) -> #ERR: ArgCount | H10: 488
A11: 'FL250 | B11: 'Fragrant Lemon 250ml | C11: 'carton | D11: 'FP | E11: '01 | F11: =VLOOKUP(RC[-1], SupplierMaster!R4C1:R10C2, 2, 0) -> #ERR: ArgCount | H11: 1148
A12: 'FL500 | B12: 'Fragrant Lemon 500ml | C12: 'carton | D12: 'FP | E12: '01 | F12: =VLOOKUP(RC[-1], SupplierMaster!R4C1:R10C2, 2, 0) -> #ERR: ArgCount | H12: 766
A13: 'BS01 | B13: 'Base Shampoo | C13: 'litre | D13: 'RM | E13: 'AC01 | F13: =VLOOKUP(RC[-1], SupplierMaster!R4C1:R10C2, 2, 0) -> #ERR: ArgCount | G13: 14 | H13: 34276
A14: 'ESA | B14: 'Apple essence | C14: 'litre | D14: 'RM | E14: 'CE01 | F14: =VLOOKUP(RC[-1], SupplierMaster!R4C1:R10C2, 2, 0) -> #ERR: ArgCount | G14: 30 | H14: 1494
A15: 'ESL | B15: 'Lemon essence | C15: 'litre | D15: 'RM | E15: 'CE01 | F15: =VLOOKUP(RC[-1], SupplierMaster!R4C1:R10C2, 2, 0) -> #ERR: ArgCount | G15: 30 | H15: 1002
A16: 'BT100 | B16: 'Bottle 100ml | C16: 'each | D16: 'RM | E16: 'BP01 | F16: =VLOOKUP(RC[-1], SupplierMaster!R4C1:R10C2, 2, 0) -> #ERR: ArgCount | G16: 21 | H16: 122472
A17: 'BT250 | B17: 'Bottle 250ml | C17: 'each | D17: 'RM | E17: 'BP01 | F17: =VLOOKUP(RC[-1], SupplierMaster!R4C1:R10C2, 2, 0) -> #ERR: ArgCount | G17: 21 | H17: 184968
A18: 'BT500 | B18: 'Bottle 500ml | C18: 'each | D18: 'RM | E18: 'BP01 | F18: =VLOOKUP(RC[-1], SupplierMaster!R4C1:R10C2, 2, 0) -> Best Plastics | G18: 21 | H18: 36516
A19: 'CAPF | B19: 'Flip cap | C19: 'each | D19: 'RM | E19: 'BP01 | F19: =VLOOKUP(RC[-1], SupplierMaster!R4C1:R10C2, 2, 0) -> #ERR: ArgCount | G19: 21 | H19: 65738
A20: 'CAPS | B20: 'Screw cap | C20: 'each | D20: 'RM | E20: 'BP01 | F20: =VLOOKUP(RC[-1], SupplierMaster!R4C1:R10C2, 2, 0) -> #ERR: ArgCount | G20: 21 | H20: 37818
A21: 'LAB10 | B21: 'Label Apple Blossom 100ml | C21: 'each | D21: 'RM | E21: 'DP01 | F21: =VLOOKUP(RC[-1], SupplierMaster!R4C1:R10C2, 2, 0) -> #ERR: ArgCount | G21: 7 | H21: 211796
A22: 'LAB25 | B22: 'Label Apple Blossom 250ml | C22: 'each | D22: 'RM | E22: 'DP01 | F22: =VLOOKUP(RC[-1], SupplierMaster!R4C1:R10C2, 2, 0) -> #ERR: ArgCount | G22: 7 | H22: 266776
A23: 'LAB50 | B23: 'Label Apple Blossom 500ml | C23: 'each | D23: 'RM | E23: 'DP01 | F23: =VLOOKUP(RC[-1], SupplierMaster!R4C1:R10C2, 2, 0) -> #ERR: ArgCount | G23: 7 | H23: 24964
A24: 'LFL10 | B24: 'Label Fragrant Lemon 100ml | C24: 'each | D24: 'RM | E24: 'DP01 | F24: =VLOOKUP(RC[-1], SupplierMaster!R4C1:R10C2, 2, 0) -> #ERR: ArgCount | G24: 7 | H24: 32140
A25: 'LFL25 | B25: 'Label Fragrant Lemon 250ml | C25: 'each | D25: 'RM | E25: 'DP01 | F25: =VLOOKUP(RC[-1], SupplierMaster!R4C1:R10C2, 2, 0) -> #ERR: ArgCount | G25: 7 | H25: 83496
A26: 'LFL50 | B26: 'Label Fragrant Lemon 500ml | C26: 'each | D26: 'RM | E26: 'DP01 | F26: =VLOOKUP(RC[-1], SupplierMaster!R4C1:R10C2, 2, 0) -> #ERR: ArgCount | G26: 7 | H26: 117354
A27: 'CARS | B27: 'Carton small | C27: 'each | D27: 'RM | E27: 'EC01 | F27: =VLOOKUP(RC[-1], SupplierMaster!R4C1:R10C2, 2, 0) -> #ERR: ArgCount | G27: 21 | H27: 998
A28: 'CARL | B28: 'Carton large | C28: 'each | D28: 'RM | E28: 'EC01 | F28: =VLOOKUP(RC[-1], SupplierMaster!R4C1:R10C2, 2, 0) -> #ERR: ArgCount | G28: 21 | H28: 4368

Sheet: SupplierMaster
A1: 'Supplier Master
A4: 'Code | B4: 'Supplier Name
A5: 'AC01 | B5: 'Ace Chemicals
A6: 'BP01 | B6: 'Best Plastics
A7: 'CE01 | B7: 'Chang Essences
A8: 'DP01 | B8: 'Dave's Printing
A9: 'EC01 | B9: 'Eduardo Corrugates

Sheet: BillofMaterials
A1: 'Bill of Material
A3: 'This is a typical structure of a single level bill of materials, describing the relationship between
A4: 'products and components
A6: 'Product | B6: 'Component | C6: 'Qty | D6: 'Component Description
A7: 'AB100 | B7: 'BS01 | C7: 4.8 | D7: =VLOOKUP(RC[-2], ItemMaster!R7C1:R31C9, 2, 0) -> #ERR: ArgCount
A8: 'AB100 | B8: 'BT100 | C8: 48 | D8: =VLOOKUP(RC[-2], ItemMaster!R7C1:R31C9, 2, 0) -> #ERR: ArgCount
A9: 'AB100 | B9: 'CAPF | C9: 48 | D9: =VLOOKUP(RC[-2], ItemMaster!R7C1:R31C9, 2, 0) -> #ERR: ArgCount
A10: 'AB100 | B10: 'CARS | C10: 1 | D10: =VLOOKUP(RC[-2], ItemMaster!R7C1:R31C9, 2, 0) -> #ERR: ArgCount
A11: 'AB100 | B11: 'ESA | C11: 0.048 | D11: =VLOOKUP(RC[-2], ItemMaster!R7C1:R31C9, 2, 0) -> #ERR: ArgCount
A12: 'AB100 | B12: 'LAB10 | C12: 50 | D12: =VLOOKUP(RC[-2], ItemMaster!R7C1:R31C9, 2, 0) -> #ERR: ArgCount
A13: 'AB250 | B13: 'BS01 | C13: 12 | D13: =VLOOKUP(RC[-2], ItemMaster!R7C1:R31C9, 2, 0) -> #ERR: ArgCount
A14: 'AB250 | B14: 'BT250 | C14: 48 | D14: =VLOOKUP(RC[-2], ItemMaster!R7C1:R31C9, 2, 0) -> #ERR: ArgCount
A15: 'AB250 | B15: 'CAPF | C15: 48 | D15: =VLOOKUP(RC[-2], ItemMaster!R7C1:R31C9, 2, 0) -> #ERR: ArgCount
A16: 'AB250 | B16: 'CARL | C16: 1 | D16: =VLOOKUP(RC[-2], ItemMaster!R7C1:R31C9, 2, 0) -> #ERR: ArgCount
A17: 'AB250 | B17: 'ESA | C17: 0.12 | D17: =VLOOKUP(RC[-2], ItemMaster!R7C1:R31C9, 2, 0) -> #ERR: ArgCount
A18: 'AB250 | B18: 'LAB25 | C18: 50 | D18: =VLOOKUP(RC[-2], ItemMaster!R7C1:R31C9, 2, 0) -> #ERR: ArgCount
A19: 'AB500 | B19: 'BS01 | C19: 12 | D19: =VLOOKUP(RC[-2], ItemMaster!R7C1:R31C9, 2, 0) -> #ERR: ArgCount
A20: 'AB500 | B20: 'BT500 | C20: 24 | D20: =VLOOKUP(RC[-2], ItemMaster!R7C1:R31C9, 2, 0) -> #ERR: ArgCount
A21: 'AB500 | B21: 'CAPS | C21: 24 | D21: =VLOOKUP(RC[-2], ItemMaster!R7C1:R31C9, 2, 0) -> #ERR: ArgCount
A22: 'AB500 | B22: 'CARL | C22: 1 | D22: =VLOOKUP(RC[-2], ItemMaster!R7C1:R31C9, 2, 0) -> #ERR: ArgCount
A23: 'AB500 | B23: 'ESA | C23: 0.12 | D23: =VLOOKUP(RC[-2], ItemMaster!R7C1:R31C9, 2, 0) -> #ERR: ArgCount
A24: 'AB500 | B24: 'LAB50 | C24: 26 | D24: =VLOOKUP(RC[-2], ItemMaster!R7C1:R31C9, 2, 0) -> #ERR: ArgCount
A25: 'FL100 | B25: 'BS01 | C25: 4.8 | D25: =VLOOKUP(RC[-2], ItemMaster!R7C1:R31C9, 2, 0) -> #ERR: ArgCount
A26: 'FL100 | B26: 'BT100 | C26: 48 | D26: =VLOOKUP(RC[-2], ItemMaster!R7C1:R31C9, 2, 0) -> #ERR: ArgCount
A27: 'FL100 | B27: 'CAPF | C27: 48 | D27: =VLOOKUP(RC[-2], ItemMaster!R7C1:R31C9, 2, 0) -> #ERR: ArgCount
A28: 'FL100 | B28: 'CARS | C28: 1 | D28: =VLOOKUP(RC[-2], ItemMaster!R7C1:R31C9, 2, 0) -> #ERR: ArgCount
A29: 'FL100 | B29: 'ESL | C29: 0.048 | D29: =VLOOKUP(RC[-2], ItemMaster!R7C1:R31C9, 2, 0) -> #ERR: ArgCount
A30: 'FL100 | B30: 'LFL10 | C30: 50 | D30: =VLOOKUP(RC[-2], ItemMaster!R7C1:R31C9, 2, 0) -> #ERR: ArgCount
A31: 'FL250 | B31: 'BS01 | C31: 12 | D31: =VLOOKUP(RC[-2], ItemMaster!R7C1:R31C9, 2, 0) -> #ERR: ArgCount
A32: 'FL250 | B32: 'BT250 | C32: 48 | D32: =VLOOKUP(RC[-2], ItemMaster!R7C1:R31C9, 2, 0) -> #ERR: ArgCount
A33: 'FL250 | B33: 'CAPF | C33: 48 | D33: =VLOOKUP(RC[-2], ItemMaster!R7C1:R31C9, 2, 0) -> #ERR: ArgCount
A34: 'FL250 | B34: 'CARL | C34: 1 | D34: =VLOOKUP(RC[-2], ItemMaster!R7C1:R31C9, 2, 0) -> #ERR: ArgCount
A35: 'FL250 | B35: 'ESL | C35: 0.12 | D35: =VLOOKUP(RC[-2], ItemMaster!R7C1:R31C9, 2, 0) -> #ERR: ArgCount
A36: 'FL250 | B36: 'LFL25 | C36: 50 | D36: =VLOOKUP(RC[-2], ItemMaster!R7C1:R31C9, 2, 0) -> #ERR: ArgCount
A37: 'FL500 | B37: 'BS01 | C37: 12 | D37: =VLOOKUP(RC[-2], ItemMaster!R7C1:R31C9, 2, 0) -> #ERR: ArgCount
A38: 'FL500 | B38: 'BT500 | C38: 24 | D38: =VLOOKUP(RC[-2], ItemMaster!R7C1:R31C9, 2, 0) -> #ERR: ArgCount
A39: 'FL500 | B39: 'CAPS | C39: 24 | D39: =VLOOKUP(RC[-2], ItemMaster!R7C1:R31C9, 2, 0) -> #ERR: ArgCount
A40: 'FL500 | B40: 'CARL | C40: 1 | D40: =VLOOKUP(RC[-2], ItemMaster!R7C1:R31C9, 2, 0) -> #ERR: ArgCount
A41: 'FL500 | B41: 'ESL | C41: 0.12 | D41: =VLOOKUP(RC[-2], ItemMaster!R7C1:R31C9, 2, 0) -> #ERR: ArgCount
A42: 'FL500 | B42: 'LFL50 | C42: 26 | D42: =VLOOKUP(RC[-2], ItemMaster!R7C1:R31C9, 2, 0) -> #ERR: ArgCount

Sheet: PurchaseOrders
A1: 'Purchase Orders
A3: 'This table lists the components that are on order from the suppliers, and the date they are due to
A4: 'be delivered.
A6: 'Code | B6: 'Description | C6: 'Supplier | D6: 'Supplier Name | E6: 'Qty | F6: 'Due in
A7: 'BS01 | B7: =VLOOKUP(RC[-1], ItemMaster!R6C1:R31C8, 2, 0) -> #ERR: ArgCount | C7: 'AC01 | D7: =VLOOKUP(RC[-1], SupplierMaster!R4C1:R10C2, 2, 0) -> #ERR: ArgCount | E7: 100000 | F7: 36603
A8: 'BS01 | B8: =VLOOKUP(RC[-1], ItemMaster!R6C1:R31C8, 2, 0) -> #ERR: ArgCount | C8: 'AC01 | D8: =VLOOKUP(RC[-1], SupplierMaster!R4C1:R10C2, 2, 0) -> #ERR: ArgCount | E8: 100000 | F8: 36615
A9: 'BT100 | B9: =VLOOKUP(RC[-1], ItemMaster!R6C1:R31C8, 2, 0) -> #ERR: ArgCount | C9: 'BP01 | D9: =VLOOKUP(RC[-1], SupplierMaster!R4C1:R10C2, 2, 0) -> #ERR: ArgCount | E9: 40000 | F9: 36630
A10: 'BT250 | B10: =VLOOKUP(RC[-1], ItemMaster!R6C1:R31C8, 2, 0) -> #ERR: ArgCount | C10: 'BP01 | D10: =VLOOKUP(RC[-1], SupplierMaster!R4C1:R10C2, 2, 0) -> #ERR: ArgCount | E10: 90000 | F10: 36603
A11: 'BT250 | B11: =VLOOKUP(RC[-1], ItemMaster!R6C1:R31C8, 2, 0) -> #ERR: ArgCount | C11: 'BP01 | D11: =VLOOKUP(RC[-1], SupplierMaster!R4C1:R10C2, 2, 0) -> #ERR: ArgCount | E11: 40000 | F11: 36617
A12: 'BT250 | B12: =VLOOKUP(RC[-1], ItemMaster!R6C1:R31C8, 2, 0) -> #ERR: ArgCount | C12: 'BP01 | D12: =VLOOKUP(RC[-1], SupplierMaster!R4C1:R10C2, 2, 0) -> #ERR: ArgCount | E12: 50000 | F12: 36638
A13: 'BT500 | B13: =VLOOKUP(RC[-1], ItemMaster!R6C1:R31C8, 2, 0) -> #ERR: ArgCount | C13: 'BP01 | D13: =VLOOKUP(RC[-1], SupplierMaster!R4C1:R10C2, 2, 0) -> #ERR: ArgCount | E13: 100000 | F13: 36601
A14: 'BT500 | B14: =VLOOKUP(RC[-1], ItemMaster!R6C1:R31C8, 2, 0) -> #ERR: ArgCount | C14: 'BP01 | D14: =VLOOKUP(RC[-1], SupplierMaster!R4C1:R10C2, 2, 0) -> #ERR: ArgCount | E14: 50000 | F14: 36617
A15: 'BT500 | B15: =VLOOKUP(RC[-1], ItemMaster!R6C1:R31C8, 2, 0) -> #ERR: ArgCount | C15: 'BP01 | D15: =VLOOKUP(RC[-1], SupplierMaster!R4C1:R10C2, 2, 0) -> #ERR: ArgCount | E15: 50000 | F15: 36631
A16: 'CAPF | B16: =VLOOKUP(RC[-1], ItemMaster!R6C1:R31C8, 2, 0) -> #ERR: ArgCount | C16: 'BP01 | D16: =VLOOKUP(RC[-1], SupplierMaster!R4C1:R10C2, 2, 0) -> #ERR: ArgCount | E16: 200000 | F16: 36601
A17: 'CAPF | B17: =VLOOKUP(RC[-1], ItemMaster!R6C1:R31C8, 2, 0) -> #ERR: ArgCount | C17: 'BP01 | D17: =VLOOKUP(RC[-1], SupplierMaster!R4C1:R10C2, 2, 0) -> #ERR: ArgCount | E17: 300000 | F17: 36623
A18: 'CAPS | B18: =VLOOKUP(RC[-1], ItemMaster!R6C1:R31C8, 2, 0) -> #ERR: ArgCount | C18: 'BP01 | D18: =VLOOKUP(RC[-1], SupplierMaster!R4C1:R10C2, 2, 0) -> #ERR: ArgCount | E18: 100000 | F18: 36602
A19: 'CAPS | B19: =VLOOKUP(RC[-1], ItemMaster!R6C1:R31C8, 2, 0) -> #ERR: ArgCount | C19: 'BP01 | D19: =VLOOKUP(RC[-1], SupplierMaster!R4C1:R10C2, 2, 0) -> #ERR: ArgCount | E19: 100000 | F19: 36618
A20: 'CARL | B20: =VLOOKUP(RC[-1], ItemMaster!R6C1:R31C8, 2, 0) -> #ERR: ArgCount | C20: 'EC01 | D20: =VLOOKUP(RC[-1], SupplierMaster!R4C1:R10C2, 2, 0) -> #ERR: ArgCount | E20: 8000 | F20: 36599
A21: 'CARL | B21: =VLOOKUP(RC[-1], ItemMaster!R6C1:R31C8, 2, 0) -> #ERR: ArgCount | C21: 'EC01 | D21: =VLOOKUP(RC[-1], SupplierMaster!R4C1:R10C2, 2, 0) -> #ERR: ArgCount | E21: 5000 | F21: 36620
A22: 'CARS | B22: =VLOOKUP(RC[-1], ItemMaster!R6C1:R31C8, 2, 0) -> #ERR: ArgCount | C22: 'EC01 | D22: =VLOOKUP(RC[-1], SupplierMaster!R4C1:R10C2, 2, 0) -> #ERR: ArgCount | E22: 1000 | F22: 36603
A23: 'CARS | B23: =VLOOKUP(RC[-1], ItemMaster!R6C1:R31C8, 2, 0) -> #ERR: ArgCount | C23: 'EC01 | D23: =VLOOKUP(RC[-1], SupplierMaster!R4C1:R10C2, 2, 0) -> #ERR: ArgCount | E23: 1000 | F23: 36642
A24: 'ESA | B24: =VLOOKUP(RC[-1], ItemMaster!R6C1:R31C8, 2, 0) -> #ERR: ArgCount | C24: 'CE01 | D24: =VLOOKUP(RC[-1], SupplierMaster!R4C1:R10C2, 2, 0) -> #ERR: ArgCount | E24: 60 | F24: 36608
A25: 'ESA | B25: =VLOOKUP(RC[-1], ItemMaster!R6C1:R31C8, 2, 0) -> #ERR: ArgCount | C25: 'CE01 | D25: =VLOOKUP(RC[-1], SupplierMaster!R4C1:R10C2, 2, 0) -> #ERR: ArgCount | E25: 100 | F25: 36622
A26: 'ESL | B26: =VLOOKUP(RC[-1], ItemMaster!R6C1:R31C8, 2, 0) -> #ERR: ArgCount | C26: 'CE01 | D26: =VLOOKUP(RC[-1], SupplierMaster!R4C1:R10C2, 2, 0) -> #ERR: ArgCount | E26: 350 | F26: 36619
A27: 'LAB10 | B27: =VLOOKUP(RC[-1], ItemMaster!R6C1:R31C8, 2, 0) -> #ERR: ArgCount | C27: 'DP01 | D27: =VLOOKUP(RC[-1], SupplierMaster!R4C1:R10C2, 2, 0) -> #ERR: ArgCount | E27: 50000 | F27: 36623
A28: 'LAB25 | B28: =VLOOKUP(RC[-1], ItemMaster!R6C1:R31C8, 2, 0) -> #ERR: ArgCount | C28: 'DP01 | D28: =VLOOKUP(RC[-1], SupplierMaster!R4C1:R10C2, 2, 0) -> #ERR: ArgCount | E28: 70000 | F28: 36599
A29: 'LAB25 | B29: =VLOOKUP(RC[-1], ItemMaster!R6C1:R31C8, 2, 0) -> #ERR: ArgCount | C29: 'DP01 | D29: =VLOOKUP(RC[-1], SupplierMaster!R4C1:R10C2, 2, 0) -> #ERR: ArgCount | E29: 60000 | F29: 36606
A30: 'LAB50 | B30: =VLOOKUP(RC[-1], ItemMaster!R6C1:R31C8, 2, 0) -> #ERR: ArgCount | C30: 'DP01 | D30: =VLOOKUP(RC[-1], SupplierMaster!R4C1:R10C2, 2, 0) -> #ERR: ArgCount | E30: 20000 | F30: 36618
A31: 'LAB50 | B31: =VLOOKUP(RC[-1], ItemMaster!R6C1:R31C8, 2, 0) -> #ERR: ArgCount | C31: 'DP01 | D31: =VLOOKUP(RC[-1], SupplierMaster!R4C1:R10C2, 2, 0) -> #ERR: ArgCount | E31: 20000 | F31: 36632
A32: 'LAB50 | B32: =VLOOKUP(RC[-1], ItemMaster!R6C1:R31C8, 2, 0) -> #ERR: ArgCount | C32: 'DP01 | D32: =VLOOKUP(RC[-1], SupplierMaster!R4C1:R10C2, 2, 0) -> #ERR: ArgCount | E32: 20000 | F32: 36646
A33: 'LFL10 | B33: =VLOOKUP(RC[-1], ItemMaster!R6C1:R31C8, 2, 0) -> #ERR: ArgCount | C33: 'DP01 | D33: =VLOOKUP(RC[-1], SupplierMaster!R4C1:R10C2, 2, 0) -> #ERR: ArgCount | E33: 10000 | F33: 36630
A34: 'LFL10 | B34: =VLOOKUP(RC[-1], ItemMaster!R6C1:R31C8, 2, 0) -> #ERR: ArgCount | C34: 'DP01 | D34: =VLOOKUP(RC[-1], SupplierMaster!R4C1:R10C2, 2, 0) -> #ERR: ArgCount | E34: 10000 | F34: 36644
A35: 'LFL25 | B35: =VLOOKUP(RC[-1], ItemMaster!R6C1:R31C8, 2, 0) -> #ERR: ArgCount | C35: 'DP01 | D35: =VLOOKUP(RC[-1], SupplierMaster!R4C1:R10C2, 2, 0) -> #ERR: ArgCount | E35: 60000 | F35: 36602
A36: 'LFL25 | B36: =VLOOKUP(RC[-1], ItemMaster!R6C1:R31C8, 2, 0) -> #ERR: ArgCount | C36: 'DP01 | D36: =VLOOKUP(RC[-1], SupplierMaster!R4C1:R10C2, 2, 0) -> #ERR: ArgCount | E36: 60000 | F36: 36616
A37: 'LFL50 | B37: =VLOOKUP(RC[-1], ItemMaster!R6C1:R31C8, 2, 0) -> #ERR: ArgCount | C37: 'DP01 | D37: =VLOOKUP(RC[-1], SupplierMaster!R4C1:R10C2, 2, 0) -> #ERR: ArgCount | E37: 40000 | F37: 36615
A38: 'LFL50 | B38: =VLOOKUP(RC[-1], ItemMaster!R6C1:R31C8, 2, 0) -> #ERR: ArgCount | C38: 'DP01 | D38: =VLOOKUP(RC[-1], SupplierMaster!R4C1:R10C2, 2, 0) -> #ERR: ArgCount | E38: 40000 | F38: 36629

Sheet: FiniteSchedule
A1: 'Make-to-Stock (Inventory) Schedule
A3: 'This schedule is contained in the MRP system, purely to generate a demand for materials. | E3: =HLOOKUP("AB500", FiniteSchedule!R7C10:R11C15, 2, 0) -> #ERR: ArgCount
A4: 'Explanations of the fomulae, and how the system is constructed, is contained in Section 42 of the scheduling tutorial, downloadable from
B5: 'www.production-scheduling.com
A7: 'Start of the first job: | D7: 36599.3333333333 | J7: 'AB100 | K7: 'AB250 | L7: 'AB500 | M7: 'FL100 | N7: 'FL250 | O7: 'FL500 | P7: 'AB100 | Q7: 'AB250 | R7: 'AB500 | S7: 'FL100 | T7: 'FL250 | U7: 'FL500
A8: 'Product running now: | D8: "AB500" | F8: 'Speed - cartons per hour | J8: =70*60/VLOOKUP(R[-1]C, TheBusiness!R8C1:R15C4, 3, 0) -> #ERR: ArgCount | K8: =70*60/VLOOKUP(R[-1]C, TheBusiness!R8C1:R15C4, 3, 0) -> #ERR: ArgCount | L8: =70*60/VLOOKUP(R[-1]C, TheBusiness!R8C1:R15C4, 3, 0) -> #ERR: ArgCount | M8: =70*60/VLOOKUP(R[-1]C, TheBusiness!R8C1:R15C4, 3, 0) -> #ERR: ArgCount | N8: =70*60/VLOOKUP(R[-1]C, TheBusiness!R8C1:R15C4, 3, 0) -> #ERR: ArgCount | O8: =70*60/VLOOKUP(R[-1]C, TheBusiness!R8C1:R15C4, 3, 0) -> #ERR: ArgCount
A9: 'Quantity committed: | D9: 110 | F9: 'Forecast sales - cartons per week | J9: =VLOOKUP(R[-2]C, TheBusiness!R8C1:R15C4, 4, 0) -> #ERR: ArgCount | K9: =VLOOKUP(R[-2]C, TheBusiness!R8C1:R15C4, 4, 0) -> #ERR: ArgCount | L9: =VLOOKUP(R[-2]C, TheBusiness!R8C1:R15C4, 4, 0) -> #ERR: ArgCount | M9: =VLOOKUP(R[-2]C, TheBusiness!R8C1:R15C4, 4, 0) -> #ERR: ArgCount | N9: =VLOOKUP(R[-2]C, TheBusiness!R8C1:R15C4, 4, 0) -> #ERR: ArgCount | O9: =VLOOKUP(R[-2]C, TheBusiness!R8C1:R15C4, 4, 0) -> #ERR: ArgCount
F10: 'Min cover - weeks | J10: 0.5 | K10: 0.5 | L10: 0.5 | M10: 0.5 | N10: 0.5 | O10: 0.5
A11: 'Utilization: | C11: =SUM(R[+6]C[+4]:R[+29]C[+4])/SUM(R[+6]C[+4]:R[+29]C[+4], R[+6]C[+2]:R[+29]C[+2]) -> #ERR: ArgCount | F11: 'Max cover - weeks | J11: 2 | K11: 2 | L11: 2 | M11: 2 | N11: 2 | O11: 2
F12: 'Min cover - cartons | J12: =R[-3]C*R[-2]C -> #ERR: ArgCount | K12: =R[-3]C*R[-2]C -> #ERR: ArgCount | L12: =R[-3]C*R[-2]C -> #ERR: ArgCount | M12: =R[-3]C*R[-2]C -> #ERR: ArgCount | N12: =R[-3]C*R[-2]C -> #ERR: ArgCount | O12: =R[-3]C*R[-2]C -> #ERR: ArgCount
F13: 'Max cover - cartons | J13: =R[-4]C*R[-2]C -> #ERR: ArgCount | K13: =R[-4]C*R[-2]C -> #ERR: ArgCount | L13: =R[-4]C*R[-2]C -> #ERR: ArgCount | M13: =R[-4]C*R[-2]C -> #ERR: ArgCount | N13: =R[-4]C*R[-2]C -> #ERR: ArgCount | O13: =R[-4]C*R[-2]C -> #ERR: ArgCount
A15: 'Product | B15: 'Force | C15: 'Qty | D15: 'Force | E15: 'Idle hours | F15: 'Force | G15: 'Run hours | H15: 'Start | I15: 'Stop | J15: 'Projected Inventory - units | P15: 'Projected Cover - weeks | V15: 'Lowest Cover | W15: 'Offset | X15: 'Next Prod | Y15: 'Inventory | Z15: 'Speed | AA15: 'For-cast | AB15: 'Min Cover | AC15: 'Min cartons | AD15: 'Max cartons | AE15: 'To make
F16: 'Opening stock: | I16: =R[-9]C[-5] -> 36599.3333333333 | J16: =VLOOKUP(R[-9]C, ItemMaster!R6C1:R31C8, 8, 0) -> #ERR: ArgCount | K16: =VLOOKUP(R[-9]C, ItemMaster!R6C1:R31C8, 8, 0) -> #ERR: ArgCount | L16: =VLOOKUP(R[-9]C, ItemMaster!R6C1:R31C8, 8, 0) -> #ERR: ArgCount | M16: =VLOOKUP(R[-9]C, ItemMaster!R6C1:R31C8, 8, 0) -> #ERR: ArgCount | N16: =VLOOKUP(R[-9]C, ItemMaster!R6C1:R31C8, 8, 0) -> #ERR: ArgCount | O16: =VLOOKUP(R[-9]C, ItemMaster!R6C1:R31C8, 8, 0) -> #ERR: ArgCount | P16: =RC[-6]/R9C[-6] -> #ERR: ArgCount | Q16: =RC[-6]/R9C[-6] -> #ERR: ArgCount | R16: =RC[-6]/R9C[-6] -> #ERR: ArgCount | S16: =RC[-6]/R9C[-6] -> #ERR: ArgCount | T16: =RC[-6]/R9C[-6] -> #ERR: ArgCount | U16: =RC[-6]/R9C[-6] -> #ERR: ArgCount
A17: =IF(RC[+4], "Idle", IF(ISERROR(R[-1]C), R8C[+3], IF(ISERROR(RC[+1]), R[-1]C[+23], RC[+1]))) -> AB500 | C17: =IF(EQUAL(RC[-2], "Idle"), 0, IF(ISERROR(R[-1]C), R9C[+1], IF(ISERROR(RC[+1]), ROUND(R[-1]C[+28], 0), RC[+1]))) -> 110 | E17: =MAX(IF(ISERROR(RC[+1]), IF(NOT(ISERROR(R[-1]C[+22])), ROUND((R[-1]C[+20]-R[-1]C[+24])/R[-1]C[+22], 7), 0)*168, RC[+1]), 0) -> 0 | G17: =IF(RC[-4]=0, 0, RC[-4]/HLOOKUP(RC[-6], R7C10:R11C15, 2, 0)) -> #ERR: ArgCount | H17: =R[-1]C[+1] -> 36599.3333333333 | I17: =RC[-1]+(RC[-2]+RC[-4])/24 -> #ERR: ArgCount | J17: =R[-1]C-R9C*(RC7+RC5)/168+EQUAL(RC1, R7C)*RC3 -> #ERR: ArgCount | K17: =R[-1]C-R9C*(RC7+RC5)/168+EQUAL(RC1, R7C)*RC3 -> #ERR: ArgCount | L17: =R[-1]C-R9C*(RC7+RC5)/168+EQUAL(RC1, R7C)*RC3 -> #ERR: ArgCount | M17: =R[-1]C-R9C*(RC7+RC5)/168+EQUAL(RC1, R7C)*RC3 -> #ERR: ArgCount | N17: =R[-1]C-R9C*(RC7+RC5)/168+EQUAL(RC1, R7C)*RC3 -> #ERR: ArgCount | O17: =R[-1]C-R9C*(RC7+RC5)/168+EQUAL(RC1, R7C)*RC3 -> #ERR: ArgCount | P17: =RC[-6]/R9C[-6] -> #ERR: ArgCount | Q17: =RC[-6]/R9C[-6] -> #ERR: ArgCount | R17: =RC[-6]/R9C[-6] -> #ERR: ArgCount | S17: =RC[-6]/R9C[-6] -> #ERR: ArgCount | T17: =RC[-6]/R9C[-6] -> #ERR: ArgCount | U17: =RC[-6]/R9C[-6] -> #ERR: ArgCount | V17: =MIN(RC[-6]:RC[-1]) -> #ERR: ArgCount | W17: =MATCH(RC[-1], RC[-7]:RC[-2], 0) -> #ERR: ArgCount | X17: =INDEX(R7C[-8]:R7C[-3], 1, RC[-1]) -> #ERR: ArgCount | Y17: =INDEX(RC[-15]:RC[-10], 1, RC[-2]) -> #ERR: ArgCount | Z17: =INDEX(R8C[-16]:R8C[-11], 1, RC[-3]) -> #ERR: ArgCount | AA17: =INDEX(R9C[-17]:R9C[-12], 1, RC[-4]) -> #ERR: ArgCount | AB17: =INDEX(R10C[-18]:R10C[-13], 1, RC[-5]) -> #ERR: ArgCount | AC17: =INDEX(R12C[-19]:R12C[-14], 1, RC[-6]) -> #ERR: ArgCount | AD17: =INDEX(R13C[-20]:R13C[-15], 1, RC[-7]) -> #ERR: ArgCount | AE17: =RC[-1]-RC[-6]+RC[-4]*(RC[-1]-RC[-6])/(RC[-5]-RC[-4]/168)/168 -> #ERR: ArgCount
A18: =IF(RC[+4], "Idle", IF(ISERROR(R[-1]C), R8C[+3], IF(ISERROR(RC[+1]), R[-1]C[+23], RC[+1]))) -> #ERR: ArgCount | C18: =IF(EQUAL(RC[-2], "Idle"), 0, IF(ISERROR(R[-1]C), R9C[+1], IF(ISERROR(RC[+1]), ROUND(R[-1]C[+28], 0), RC[+1]))) -> #ERR: ArgCount | E18: =MAX(IF(ISERROR(RC[+1]), IF(NOT(ISERROR(R[-1]C[+22])), ROUND((R[-1]C[+20]-R[-1]C[+24])/R[-1]C[+22], 7), 0)*168, RC[+1]), 0) -> 0 | G18: =IF(RC[-4]=0, 0, RC[-4]/HLOOKUP(RC[-6], R7C10:R11C15, 2, 0)) -> #ERR: ArgCount | H18: =R[-1]C[+1] -> #ERR: ArgCount | I18: =RC[-1]+(RC[-2]+RC[-4])/24 -> #ERR: ArgCount | J18: =R[-1]C-R9C*(RC7+RC5)/168+EQUAL(RC1, R7C)*RC3 -> #ERR: ArgCount | K18: =R[-1]C-R9C*(RC7+RC5)/168+EQUAL(RC1, R7C)*RC3 -> #ERR: ArgCount | L18: =R[-1]C-R9C*(RC7+RC5)/168+EQUAL(RC1, R7C)*RC3 -> #ERR: ArgCount | M18: =R[-1]C-R9C*(RC7+RC5)/168+EQUAL(RC1, R7C)*RC3 -> #ERR: ArgCount | N18: =R[-1]C-R9C*(RC7+RC5)/168+EQUAL(RC1, R7C)*RC3 -> #ERR: ArgCount | O18: =R[-1]C-R9C*(RC7+RC5)/168+EQUAL(RC1, R7C)*RC3 -> #ERR: ArgCount | P18: =RC[-6]/R9C[-6] -> #ERR: ArgCount | Q18: =RC[-6]/R9C[-6] -> #ERR: ArgCount | R18: =RC[-6]/R9C[-6] -> #ERR: ArgCount | S18: =RC[-6]/R9C[-6] -> #ERR: ArgCount | T18: =RC[-6]/R9C[-6] -> #ERR: ArgCount | U18: =RC[-6]/R9C[-6] -> #ERR: ArgCount | V18: =MIN(RC[-6]:RC[-1]) -> #ERR: ArgCount | W18: =MATCH(RC[-1], RC[-7]:RC[-2], 0) -> #ERR: ArgCount | X18: =INDEX(R7C[-8]:R7C[-3], 1, RC[-1]) -> #ERR: ArgCount | Y18: =INDEX(RC[-15]:RC[-10], 1, RC[-2]) -> #ERR: ArgCount | Z18: =INDEX(R8C[-16]:R8C[-11], 1, RC[-3]) -> #ERR: ArgCount | AA18: =INDEX(R9C[-17]:R9C[-12], 1, RC[-4]) -> #ERR: ArgCount | AB18: =INDEX(R10C[-18]:R10C[-13], 1, RC[-5]) -> #ERR: ArgCount | AC18: =INDEX(R12C[-19]:R12C[-14], 1, RC[-6]) -> #ERR: ArgCount | AD18: =INDEX(R13C[-20]:R13C[-15], 1, RC[-7]) -> #ERR: ArgCount | AE18: =RC[-1]-RC[-6]+RC[-4]*(RC[-1]-RC[-6])/(RC[-5]-RC[-4]/168)/168 -> #ERR: ArgCount
A19: =IF(RC[+4], "Idle", IF(ISERROR(R[-1]C), R8C[+3], IF(ISERROR(RC[+1]), R[-1]C[+23], RC[+1]))) -> AB500 | C19: =IF(EQUAL(RC[-2], "Idle"), 0, IF(ISERROR(R[-1]C), R9C[+1], IF(ISERROR(RC[+1]), ROUND(R[-1]C[+28], 0), RC[+1]))) -> 110 | E19: =MAX(IF(ISERROR(RC[+1]), IF(NOT(ISERROR(R[-1]C[+22])), ROUND((R[-1]C[+20]-R[-1]C[+24])/R[-1]C[+22], 7), 0)*168, RC[+1]), 0) -> 0 | G19: =IF(RC[-4]=0, 0, RC[-4]/HLOOKUP(RC[-6], R7C10:R11C15, 2, 0)) -> #ERR: ArgCount | H19: =R[-1]C[+1] -> #ERR: ArgCount | I19: =RC[-1]+(RC[-2]+RC[-4])/24 -> #ERR: ArgCount | J19: =R[-1]C-R9C*(RC7+RC5)/168+EQUAL(RC1, R7C)*RC3 -> #ERR: ArgCount | K19: =R[-1]C-R9C*(RC7+RC5)/168+EQUAL(RC1, R7C)*RC3 -> #ERR: ArgCount | L19: =R[-1]C-R9C*(RC7+RC5)/168+EQUAL(RC1, R7C)*RC3 -> #ERR: ArgCount | M19: =R[-1]C-R9C*(RC7+RC5)/168+EQUAL(RC1, R7C)*RC3 -> #ERR: ArgCount | N19: =R[-1]C-R9C*(RC7+RC5)/168+EQUAL(RC1, R7C)*RC3 -> #ERR: ArgCount | O19: =R[-1]C-R9C*(RC7+RC5)/168+EQUAL(RC1, R7C)*RC3 -> #ERR: ArgCount | P19: =RC[-6]/R9C[-6] -> #ERR: ArgCount | Q19: =RC[-6]/R9C[-6] -> #ERR: ArgCount | R19: =RC[-6]/R9C[-6] -> #ERR: ArgCount | S19: =RC[-6]/R9C[-6] -> #ERR: ArgCount | T19: =RC[-6]/R9C[-6] -> #ERR: ArgCount | U19: =RC[-6]/R9C[-6] -> #ERR: ArgCount | V19: =MIN(RC[-6]:RC[-1]) -> #ERR: ArgCount | W19: =MATCH(RC[-1], RC[-7]:RC[-2], 0) -> #ERR: ArgCount | X19: =INDEX(R7C[-8]:R7C[-3], 1, RC[-1]) -> #ERR: ArgCount | Y19: =INDEX(RC[-15]:RC[-10], 1, RC[-2]) -> #ERR: ArgCount | Z19: =INDEX(R8C[-16]:R8C[-11], 1, RC[-3]) -> #ERR: ArgCount | AA19: =INDEX(R9C[-17]:R9C[-12], 1, RC[-4]) -> #ERR: ArgCount | AB19: =INDEX(R10C[-18]:R10C[-13], 1, RC[-5]) -> #ERR: ArgCount | AC19: =INDEX(R12C[-19]:R12C[-14], 1, RC[-6]) -> #ERR: ArgCount | AD19: =INDEX(R13C[-20]:R13C[-15], 1, RC[-7]) -> #ERR: ArgCount | AE19: =RC[-1]-RC[-6]+RC[-4]*(RC[-1]-RC[-6])/(RC[-5]-RC[-4]/168)/168 -> #ERR: ArgCount
A20: =IF(RC[+4], "Idle", IF(ISERROR(R[-1]C), R8C[+3], IF(ISERROR(RC[+1]), R[-1]C[+23], RC[+1]))) -> #ERR: ArgCount | C20: =IF(EQUAL(RC[-2], "Idle"), 0, IF(ISERROR(R[-1]C), R9C[+1], IF(ISERROR(RC[+1]), ROUND(R[-1]C[+28], 0), RC[+1]))) -> #ERR: ArgCount | E20: =MAX(IF(ISERROR(RC[+1]), IF(NOT(ISERROR(R[-1]C[+22])), ROUND((R[-1]C[+20]-R[-1]C[+24])/R[-1]C[+22], 7), 0)*168, RC[+1]), 0) -> 0 | G20: =IF(RC[-4]=0, 0, RC[-4]/HLOOKUP(RC[-6], R7C10:R11C15, 2, 0)) -> #ERR: ArgCount | H20: =R[-1]C[+1] -> #ERR: ArgCount | I20: =RC[-1]+(RC[-2]+RC[-4])/24 -> #ERR: ArgCount | J20: =R[-1]C-R9C*(RC7+RC5)/168+EQUAL(RC1, R7C)*RC3 -> #ERR: ArgCount | K20: =R[-1]C-R9C*(RC7+RC5)/168+EQUAL(RC1, R7C)*RC3 -> #ERR: ArgCount | L20: =R[-1]C-R9C*(RC7+RC5)/168+EQUAL(RC1, R7C)*RC3 -> #ERR: ArgCount | M20: =R[-1]C-R9C*(RC7+RC5)/168+EQUAL(RC1, R7C)*RC3 -> #ERR: ArgCount | N20: =R[-1]C-R9C*(RC7+RC5)/168+EQUAL(RC1, R7C)*RC3 -> #ERR: ArgCount | O20: =R[-1]C-R9C*(RC7+RC5)/168+EQUAL(RC1, R7C)*RC3 -> #ERR: ArgCount | P20: =RC[-6]/R9C[-6] -> #ERR: ArgCount | Q20: =RC[-6]/R9C[-6] -> #ERR: ArgCount | R20: =RC[-6]/R9C[-6] -> #ERR: ArgCount | S20: =RC[-6]/R9C[-6] -> #ERR: ArgCount | T20: =RC[-6]/R9C[-6] -> #ERR: ArgCount | U20: =RC[-6]/R9C[-6] -> #ERR: ArgCount | V20: =MIN(RC[-6]:RC[-1]) -> #ERR: ArgCount | W20: =MATCH(RC[-1], RC[-7]:RC[-2], 0) -> #ERR: ArgCount | X20: =INDEX(R7C[-8]:R7C[-3], 1, RC[-1]) -> #ERR: ArgCount | Y20: =INDEX(RC[-15]:RC[-10], 1, RC[-2]) -> #ERR: ArgCount | Z20: =INDEX(R8C[-16]:R8C[-11], 1, RC[-3]) -> #ERR: ArgCount | AA20: =INDEX(R9C[-17]:R9C[-12], 1, RC[-4]) -> #ERR: ArgCount | AB20: =INDEX(R10C[-18]:R10C[-13], 1, RC[-5]) -> #ERR: ArgCount | AC20: =INDEX(R12C[-19]:R12C[-14], 1, RC[-6]) -> #ERR: ArgCount | AD20: =INDEX(R13C[-20]:R13C[-15], 1, RC[-7]) -> #ERR: ArgCount | AE20: =RC[-1]-RC[-6]+RC[-4]*(RC[-1]-RC[-6])/(RC[-5]-RC[-4]/168)/168 -> #ERR: ArgCount
A21: =IF(RC[+4], "Idle", IF(ISERROR(R[-1]C), R8C[+3], IF(ISERROR(RC[+1]), R[-1]C[+23], RC[+1]))) -> AB500 | C21: =IF(EQUAL(RC[-2], "Idle"), 0, IF(ISERROR(R[-1]C), R9C[+1], IF(ISERROR(RC[+1]), ROUND(R[-1]C[+28], 0), RC[+1]))) -> 110 | E21: =MAX(IF(ISERROR(RC[+1]), IF(NOT(ISERROR(R[-1]C[+22])), ROUND((R[-1]C[+20]-R[-1]C[+24])/R[-1]C[+22], 7), 0)*168, RC[+1]), 0) -> 0 | G21: =IF(RC[-4]=0, 0, RC[-4]/HLOOKUP(RC[-6], R7C10:R11C15, 2, 0)) -> #ERR: ArgCount | H21: =R[-1]C[+1] -> #ERR: ArgCount | I21: =RC[-1]+(RC[-2]+RC[-4])/24 -> #ERR: ArgCount | J21: =R[-1]C-R9C*(RC7+RC5)/168+EQUAL(RC1, R7C)*RC3 -> #ERR: ArgCount | K21: =R[-1]C-R9C*(RC7+RC5)/168+EQUAL(RC1, R7C)*RC3 -> #ERR: ArgCount | L21: =R[-1]C-R9C*(RC7+RC5)/168+EQUAL(RC1, R7C)*RC3 -> #ERR: ArgCount | M21: =R[-1]C-R9C*(RC7+RC5)/168+EQUAL(RC1, R7C)*RC3 -> #ERR: ArgCount | N21: =R[-1]C-R9C*(RC7+RC5)/168+EQUAL(RC1, R7C)*RC3 -> #ERR: ArgCount | O21: =R[-1]C-R9C*(RC7+RC5)/168+EQUAL(RC1, R7C)*RC3 -> #ERR: ArgCount | P21: =RC[-6]/R9C[-6] -> #ERR: ArgCount | Q21: =RC[-6]/R9C[-6] -> #ERR: ArgCount | R21: =RC[-6]/R9C[-6] -> #ERR: ArgCount | S21: =RC[-6]/R9C[-6] -> #ERR: ArgCount | T21: =RC[-6]/R9C[-6] -> #ERR: ArgCount | U21: =RC[-6]/R9C[-6] -> #ERR: ArgCount | V21: =MIN(RC[-6]:RC[-1]) -> #ERR: ArgCount | W21: =MATCH(RC[-1], RC[-7]:RC[-2], 0) -> #ERR: ArgCount | X21: =INDEX(R7C[-8]:R7C[-3], 1, RC[-1]) -> #ERR: ArgCount | Y21: =INDEX(RC[-15]:RC[-10], 1, RC[-2]) -> #ERR: ArgCount | Z21: =INDEX(R8C[-16]:R8C[-11], 1, RC[-3]) -> #ERR: ArgCount | AA21: =INDEX(R9C[-17]:R9C[-12], 1, RC[-4]) -> #ERR: ArgCount | AB21: =INDEX(R10C[-18]:R10C[-13], 1, RC[-5]) -> #ERR: ArgCount | AC21: =INDEX(R12C[-19]:R12C[-14], 1, RC[-6]) -> #ERR: ArgCount | AD21: =INDEX(R13C[-20]:R13C[-15], 1, RC[-7]) -> #ERR: ArgCount | AE21: =RC[-1]-RC[-6]+RC[-4]*(RC[-1]-RC[-6])/(RC[-5]-RC[-4]/168)/168 -> #ERR: ArgCount
A22: =IF(RC[+4], "Idle", IF(ISERROR(R[-1]C), R8C[+3], IF(ISERROR(RC[+1]), R[-1]C[+23], RC[+1]))) -> #ERR: ArgCount | C22: =IF(EQUAL(RC[-2], "Idle"), 0, IF(ISERROR(R[-1]C), R9C[+1], IF(ISERROR(RC[+1]), ROUND(R[-1]C[+28], 0), RC[+1]))) -> #ERR: ArgCount | E22: =MAX(IF(ISERROR(RC[+1]), IF(NOT(ISERROR(R[-1]C[+22])), ROUND((R[-1]C[+20]-R[-1]C[+24])/R[-1]C[+22], 7), 0)*168, RC[+1]), 0) -> 0 | G22: =IF(RC[-4]=0, 0, RC[-4]/HLOOKUP(RC[-6], R7C10:R11C15, 2, 0)) -> #ERR: ArgCount | H22: =R[-1]C[+1] -> #ERR: ArgCount | I22: =RC[-1]+(RC[-2]+RC[-4])/24 -> #ERR: ArgCount | J22: =R[-1]C-R9C*(RC7+RC5)/168+EQUAL(RC1, R7C)*RC3 -> #ERR: ArgCount | K22: =R[-1]C-R9C*(RC7+RC5)/168+EQUAL(RC1, R7C)*RC3 -> #ERR: ArgCount | L22: =R[-1]C-R9C*(RC7+RC5)/168+EQUAL(RC1, R7C)*RC3 -> #ERR: ArgCount | M22: =R[-1]C-R9C*(RC7+RC5)/168+EQUAL(RC1, R7C)*RC3 -> #ERR: ArgCount | N22: =R[-1]C-R9C*(RC7+RC5)/168+EQUAL(RC1, R7C)*RC3 -> #ERR: ArgCount | O22: =R[-1]C-R9C*(RC7+RC5)/168+EQUAL(RC1, R7C)*RC3 -> #ERR: ArgCount | P22: =RC[-6]/R9C[-6] -> #ERR: ArgCount | Q22: =RC[-6]/R9C[-6] -> #ERR: ArgCount | R22: =RC[-6]/R9C[-6] -> #ERR: ArgCount | S22: =RC[-6]/R9C[-6] -> #ERR: ArgCount | T22: =RC[-6]/R9C[-6] -> #ERR: ArgCount | U22: =RC[-6]/R9C[-6] -> #ERR: ArgCount | V22: =MIN(RC[-6]:RC[-1]) -> #ERR: ArgCount | W22: =MATCH(RC[-1], RC[-7]:RC[-2], 0) -> #ERR: ArgCount | X22: =INDEX(R7C[-8]:R7C[-3], 1, RC[-1]) -> #ERR: ArgCount | Y22: =INDEX(RC[-15]:RC[-10], 1, RC[-2]) -> #ERR: ArgCount | Z22: =INDEX(R8C[-16]:R8C[-11], 1, RC[-3]) -> #ERR: ArgCount | AA22: =INDEX(R9C[-17]:R9C[-12], 1, RC[-4]) -> #ERR: ArgCount | AB22: =INDEX(R10C[-18]:R10C[-13], 1, RC[-5]) -> #ERR: ArgCount | AC22: =INDEX(R12C[-19]:R12C[-14], 1, RC[-6]) -> #ERR: ArgCount | AD22: =INDEX(R13C[-20]:R13C[-15], 1, RC[-7]) -> #ERR: ArgCount | AE22: =RC[-1]-RC[-6]+RC[-4]*(RC[-1]-RC[-6])/(RC[-5]-RC[-4]/168)/168 -> #ERR: ArgCount
A23: =IF(RC[+4], "Idle", IF(ISERROR(R[-1]C), R8C[+3], IF(ISERROR(RC[+1]), R[-1]C[+23], RC[+1]))) -> AB500 | C23: =IF(EQUAL(RC[-2], "Idle"), 0, IF(ISERROR(R[-1]C), R9C[+1], IF(ISERROR(RC[+1]), ROUND(R[-1]C[+28], 0), RC[+1]))) -> 110 | E23: =MAX(IF(ISERROR(RC[+1]), IF(NOT(ISERROR(R[-1]C[+22])), ROUND((R[-1]C[+20]-R[-1]C[+24])/R[-1]C[+22], 7), 0)*168, RC[+1]), 0) -> 0 | G23: =IF(RC[-4]=0, 0, RC[-4]/HLOOKUP(RC[-6], R7C10:R11C15, 2, 0)) -> #ERR: ArgCount | H23: =R[-1]C[+1] -> #ERR: ArgCount | I23: =RC[-1]+(RC[-2]+RC[-4])/24 -> #ERR: ArgCount | J23: =R[-1]C-R9C*(RC7+RC5)/168+EQUAL(RC1, R7C)*RC3 -> #ERR: ArgCount | K23: =R[-1]C-R9C*(RC7+RC5)/168+EQUAL(RC1, R7C)*RC3 -> #ERR: ArgCount | L23: =R[-1]C-R9C*(RC7+RC5)/168+EQUAL(RC1, R7C)*RC3 -> #ERR: ArgCount | M23: =R[-1]C-R9C*(RC7+RC5)/168+EQUAL(RC1, R7C)*RC3 -> #ERR: ArgCount | N23: =R[-1]C-R9C*(RC7+RC5)/168+EQUAL(RC1, R7C)*RC3 -> #ERR: ArgCount | O23: =R[-1]C-R9C*(RC7+RC5)/168+EQUAL(RC1, R7C)*RC3 -> #ERR: ArgCount | P23: =RC[-6]/R9C[-6] -> #ERR: ArgCount | Q23: =RC[-6]/R9C[-6] -> #ERR: ArgCount | R23: =RC[-6]/R9C[-6] -> #ERR: ArgCount | S23: =RC[-6]/R9C[-6] -> #ERR: ArgCount | T23: =RC[-6]/R9C[-6] -> #ERR: ArgCount | U23: =RC[-6]/R9C[-6] -> #ERR: ArgCount | V23: =MIN(RC[-6]:RC[-1]) -> #ERR: ArgCount | W23: =MATCH(RC[-1], RC[-7]:RC[-2], 0) -> #ERR: ArgCount | X23: =INDEX(R7C[-8]:R7C[-3], 1, RC[-1]) -> #ERR: ArgCount | Y23: =INDEX(RC[-15]:RC[-10], 1, RC[-2]) -> #ERR: ArgCount | Z23: =INDEX(R8C[-16]:R8C[-11], 1, RC[-3]) -> #ERR: ArgCount | AA23: =INDEX(R9C[-17]:R9C[-12], 1, RC[-4]) -> #ERR: ArgCount | AB23: =INDEX(R10C[-18]:R10C[-13], 1, RC[-5]) -> #ERR: ArgCount | AC23: =INDEX(R12C[-19]:R12C[-14], 1, RC[-6]) -> #ERR: ArgCount | AD23: =INDEX(R13C[-20]:R13C[-15], 1, RC[-7]) -> #ERR: ArgCount | AE23: =RC[-1]-RC[-6]+RC[-4]*(RC[-1]-RC[-6])/(RC[-5]-RC[-4]/168)/168 -> #ERR: ArgCount
A24: =IF(RC[+4], "Idle", IF(ISERROR(R[-1]C), R8C[+3], IF(ISERROR(RC[+1]), R[-1]C[+23], RC[+1]))) -> #ERR: ArgCount | C24: =IF(EQUAL(RC[-2], "Idle"), 0, IF(ISERROR(R[-1]C), R9C[+1], IF(ISERROR(RC[+1]), ROUND(R[-1]C[+28], 0), RC[+1]))) -> #ERR: ArgCount | E24: =MAX(IF(ISERROR(RC[+1]), IF(NOT(ISERROR(R[-1]C[+22])), ROUND((R[-1]C[+20]-R[-1]C[+24])/R[-1]C[+22], 7), 0)*168, RC[+1]), 0) -> 0 | G24: =IF(RC[-4]=0, 0, RC[-4]/HLOOKUP(RC[-6], R7C10:R11C15, 2, 0)) -> #ERR: ArgCount | H24: =R[-1]C[+1] -> #ERR: ArgCount | I24: =RC[-1]+(RC[-2]+RC[-4])/24 -> #ERR: ArgCount | J24: =R[-1]C-R9C*(RC7+RC5)/168+EQUAL(RC1, R7C)*RC3 -> #ERR: ArgCount | K24: =R[-1]C-R9C*(RC7+RC5)/168+EQUAL(RC1, R7C)*RC3 -> #ERR: ArgCount | L24: =R[-1]C-R9C*(RC7+RC5)/168+EQUAL(RC1, R7C)*RC3 -> #ERR: ArgCount | M24: =R[-1]C-R9C*(RC7+RC5)/168+EQUAL(RC1, R7C)*RC3 -> #ERR: ArgCount | N24: =R[-1]C-R9C*(RC7+RC5)/168+EQUAL(RC1, R7C)*RC3 -> #ERR: ArgCount | O24: =R[-1]C-R9C*(RC7+RC5)/168+EQUAL(RC1, R7C)*RC3 -> #ERR: ArgCount | P24: =RC[-6]/R9C[-6] -> #ERR: ArgCount | Q24: =RC[-6]/R9C[-6] -> #ERR: ArgCount | R24: =RC[-6]/R9C[-6] -> #ERR: ArgCount | S24: =RC[-6]/R9C[-6] -> #ERR: ArgCount | T24: =RC[-6]/R9C[-6] -> #ERR: ArgCount | U24: =RC[-6]/R9C[-6] -> #ERR: ArgCount | V24: =MIN(RC[-6]:RC[-1]) -> #ERR: ArgCount | W24: =MATCH(RC[-1], RC[-7]:RC[-2], 0) -> #ERR: ArgCount | X24: =INDEX(R7C[-8]:R7C[-3], 1, RC[-1]) -> #ERR: ArgCount | Y24: =INDEX(RC[-15]:RC[-10], 1, RC[-2]) -> #ERR: ArgCount | Z24: =INDEX(R8C[-16]:R8C[-11], 1, RC[-3]) -> #ERR: ArgCount | AA24: =INDEX(R9C[-17]:R9C[-12], 1, RC[-4]) -> #ERR: ArgCount | AB24: =INDEX(R10C[-18]:R10C[-13], 1, RC[-5]) -> #ERR: ArgCount | AC24: =INDEX(R12C[-19]:R12C[-14], 1, RC[-6]) -> #ERR: ArgCount | AD24: =INDEX(R13C[-20]:R13C[-15], 1, RC[-7]) -> #ERR: ArgCount | AE24: =RC[-1]-RC[-6]+RC[-4]*(RC[-1]-RC[-6])/(RC[-5]-RC[-4]/168)/168 -> #ERR: ArgCount
A25: =IF(RC[+4], "Idle", IF(ISERROR(R[-1]C), R8C[+3], IF(ISERROR(RC[+1]), R[-1]C[+23], RC[+1]))) -> AB500 | C25: =IF(EQUAL(RC[-2], "Idle"), 0, IF(ISERROR(R[-1]C), R9C[+1], IF(ISERROR(RC[+1]), ROUND(R[-1]C[+28], 0), RC[+1]))) -> 110 | E25: =MAX(IF(ISERROR(RC[+1]), IF(NOT(ISERROR(R[-1]C[+22])), ROUND((R[-1]C[+20]-R[-1]C[+24])/R[-1]C[+22], 7), 0)*168, RC[+1]), 0) -> 0 | G25: =IF(RC[-4]=0, 0, RC[-4]/HLOOKUP(RC[-6], R7C10:R11C15, 2, 0)) -> #ERR: ArgCount | H25: =R[-1]C[+1] -> #ERR: ArgCount | I25: =RC[-1]+(RC[-2]+RC[-4])/24 -> #ERR: ArgCount | J25: =R[-1]C-R9C*(RC7+RC5)/168+EQUAL(RC1, R7C)*RC3 -> #ERR: ArgCount | K25: =R[-1]C-R9C*(RC7+RC5)/168+EQUAL(RC1, R7C)*RC3 -> #ERR: ArgCount | L25: =R[-1]C-R9C*(RC7+RC5)/168+EQUAL(RC1, R7C)*RC3 -> #ERR: ArgCount | M25: =R[-1]C-R9C*(RC7+RC5)/168+EQUAL(RC1, R7C)*RC3 -> #ERR: ArgCount | N25: =R[-1]C-R9C*(RC7+RC5)/168+EQUAL(RC1, R7C)*RC3 -> #ERR: ArgCount | O25: =R[-1]C-R9C*(RC7+RC5)/168+EQUAL(RC1, R7C)*RC3 -> #ERR: ArgCount | P25: =RC[-6]/R9C[-6] -> #ERR: ArgCount | Q25: =RC[-6]/R9C[-6] -> #ERR: ArgCount | R25: =RC[-6]/R9C[-6] -> #ERR: ArgCount | S25: =RC[-6]/R9C[-6] -> #ERR: ArgCount | T25: =RC[-6]/R9C[-6] -> #ERR: ArgCount | U25: =RC[-6]/R9C[-6] -> #ERR: ArgCount | V25: =MIN(RC[-6]:RC[-1]) -> #ERR: ArgCount | W25: =MATCH(RC[-1], RC[-7]:RC[-2], 0) -> #ERR: ArgCount | X25: =INDEX(R7C[-8]:R7C[-3], 1, RC[-1]) -> #ERR: ArgCount | Y25: =INDEX(RC[-15]:RC[-10], 1, RC[-2]) -> #ERR: ArgCount | Z25: =INDEX(R8C[-16]:R8C[-11], 1, RC[-3]) -> #ERR: ArgCount | AA25: =INDEX(R9C[-17]:R9C[-12], 1, RC[-4]) -> #ERR: ArgCount | AB25: =INDEX(R10C[-18]:R10C[-13], 1, RC[-5]) -> #ERR: ArgCount | AC25: =INDEX(R12C[-19]:R12C[-14], 1, RC[-6]) -> #ERR: ArgCount | AD25: =INDEX(R13C[-20]:R13C[-15], 1, RC[-7]) -> #ERR: ArgCount | AE25: =RC[-1]-RC[-6]+RC[-4]*(RC[-1]-RC[-6])/(RC[-5]-RC[-4]/168)/168 -> #ERR: ArgCount
A26: =IF(RC[+4], "Idle", IF(ISERROR(R[-1]C), R8C[+3], IF(ISERROR(RC[+1]), R[-1]C[+23], RC[+1]))) -> #ERR: ArgCount | C26: =IF(EQUAL(RC[-2], "Idle"), 0, IF(ISERROR(R[-1]C), R9C[+1], IF(ISERROR(RC[+1]), ROUND(R[-1]C[+28], 0), RC[+1]))) -> #ERR: ArgCount | E26: =MAX(IF(ISERROR(RC[+1]), IF(NOT(ISERROR(R[-1]C[+22])), ROUND((R[-1]C[+20]-R[-1]C[+24])/R[-1]C[+22], 7), 0)*168, RC[+1]), 0) -> 0 | G26: =IF(RC[-4]=0, 0, RC[-4]/HLOOKUP(RC[-6], R7C10:R11C15, 2, 0)) -> #ERR: ArgCount | H26: =R[-1]C[+1] -> #ERR: ArgCount | I26: =RC[-1]+(RC[-2]+RC[-4])/24 -> #ERR: ArgCount | J26: =R[-1]C-R9C*(RC7+RC5)/168+EQUAL(RC1, R7C)*RC3 -> #ERR: ArgCount | K26: =R[-1]C-R9C*(RC7+RC5)/168+EQUAL(RC1, R7C)*RC3 -> #ERR: ArgCount | L26: =R[-1]C-R9C*(RC7+RC5)/168+EQUAL(RC1, R7C)*RC3 -> #ERR: ArgCount | M26: =R[-1]C-R9C*(RC7+RC5)/168+EQUAL(RC1, R7C)*RC3 -> #ERR: ArgCount | N26: =R[-1]C-R9C*(RC7+RC5)/168+EQUAL(RC1, R7C)*RC3 -> #ERR: ArgCount | O26: =R[-1]C-R9C*(RC7+RC5)/168+EQUAL(RC1, R7C)*RC3 -> #ERR: ArgCount | P26: =RC[-6]/R9C[-6] -> #ERR: ArgCount | Q26: =RC[-6]/R9C[-6] -> #ERR: ArgCount | R26: =RC[-6]/R9C[-6] -> #ERR: ArgCount | S26: =RC[-6]/R9C[-6] -> #ERR: ArgCount | T26: =RC[-6]/R9C[-6] -> #ERR: ArgCount | U26: =RC[-6]/R9C[-6] -> #ERR: ArgCount | V26: =MIN(RC[-6]:RC[-1]) -> #ERR: ArgCount | W26: =MATCH(RC[-1], RC[-7]:RC[-2], 0) -> #ERR: ArgCount | X26: =INDEX(R7C[-8]:R7C[-3], 1, RC[-1]) -> #ERR: ArgCount | Y26: =INDEX(RC[-15]:RC[-10], 1, RC[-2]) -> #ERR: ArgCount | Z26: =INDEX(R8C[-16]:R8C[-11], 1, RC[-3]) -> #ERR: ArgCount | AA26: =INDEX(R9C[-17]:R9C[-12], 1, RC[-4]) -> #ERR: ArgCount | AB26: =INDEX(R10C[-18]:R10C[-13], 1, RC[-5]) -> #ERR: ArgCount | AC26: =INDEX(R12C[-19]:R12C[-14], 1, RC[-6]) -> #ERR: ArgCount | AD26: =INDEX(R13C[-20]:R13C[-15], 1, RC[-7]) -> #ERR: ArgCount | AE26: =RC[-1]-RC[-6]+RC[-4]*(RC[-1]-RC[-6])/(RC[-5]-RC[-4]/168)/168 -> #ERR: ArgCount
A27: =IF(RC[+4], "Idle", IF(ISERROR(R[-1]C), R8C[+3], IF(ISERROR(RC[+1]), R[-1]C[+23], RC[+1]))) -> AB500 | C27: =IF(EQUAL(RC[-2], "Idle"), 0, IF(ISERROR(R[-1]C), R9C[+1], IF(ISERROR(RC[+1]), ROUND(R[-1]C[+28], 0), RC[+1]))) -> 110 | E27: =MAX(IF(ISERROR(RC[+1]), IF(NOT(ISERROR(R[-1]C[+22])), ROUND((R[-1]C[+20]-R[-1]C[+24])/R[-1]C[+22], 7), 0)*168, RC[+1]), 0) -> 0 | G27: =IF(RC[-4]=0, 0, RC[-4]/HLOOKUP(RC[-6], R7C10:R11C15, 2, 0)) -> #ERR: ArgCount | H27: =R[-1]C[+1] -> #ERR: ArgCount | I27: =RC[-1]+(RC[-2]+RC[-4])/24 -> #ERR: ArgCount | J27: =R[-1]C-R9C*(RC7+RC5)/168+EQUAL(RC1, R7C)*RC3 -> #ERR: ArgCount | K27: =R[-1]C-R9C*(RC7+RC5)/168+EQUAL(RC1, R7C)*RC3 -> #ERR: ArgCount | L27: =R[-1]C-R9C*(RC7+RC5)/168+EQUAL(RC1, R7C)*RC3 -> #ERR: ArgCount | M27: =R[-1]C-R9C*(RC7+RC5)/168+EQUAL(RC1, R7C)*RC3 -> #ERR: ArgCount | N27: =R[-1]C-R9C*(RC7+RC5)/168+EQUAL(RC1, R7C)*RC3 -> #ERR: ArgCount | O27: =R[-1]C-R9C*(RC7+RC5)/168+EQUAL(RC1, R7C)*RC3 -> #ERR: ArgCount | P27: =RC[-6]/R9C[-6] -> #ERR: ArgCount | Q27: =RC[-6]/R9C[-6] -> #ERR: ArgCount | R27: =RC[-6]/R9C[-6] -> #ERR: ArgCount | S27: =RC[-6]/R9C[-6] -> #ERR: ArgCount | T27: =RC[-6]/R9C[-6] -> #ERR: ArgCount | U27: =RC[-6]/R9C[-6] -> #ERR: ArgCount | V27: =MIN(RC[-6]:RC[-1]) -> #ERR: ArgCount | W27: =MATCH(RC[-1], RC[-7]:RC[-2], 0) -> #ERR: ArgCount | X27: =INDEX(R7C[-8]:R7C[-3], 1, RC[-1]) -> #ERR: ArgCount | Y27: =INDEX(RC[-15]:RC[-10], 1, RC[-2]) -> #ERR: ArgCount | Z27: =INDEX(R8C[-16]:R8C[-11], 1, RC[-3]) -> #ERR: ArgCount | AA27: =INDEX(R9C[-17]:R9C[-12], 1, RC[-4]) -> #ERR: ArgCount | AB27: =INDEX(R10C[-18]:R10C[-13], 1, RC[-5]) -> #ERR: ArgCount | AC27: =INDEX(R12C[-19]:R12C[-14], 1, RC[-6]) -> #ERR: ArgCount | AD27: =INDEX(R13C[-20]:R13C[-15], 1, RC[-7]) -> #ERR: ArgCount | AE27: =RC[-1]-RC[-6]+RC[-4]*(RC[-1]-RC[-6])/(RC[-5]-RC[-4]/168)/168 -> #ERR: ArgCount
A28: =IF(RC[+4], "Idle", IF(ISERROR(R[-1]C), R8C[+3], IF(ISERROR(RC[+1]), R[-1]C[+23], RC[+1]))) -> #ERR: ArgCount | C28: =IF(EQUAL(RC[-2], "Idle"), 0, IF(ISERROR(R[-1]C), R9C[+1], IF(ISERROR(RC[+1]), ROUND(R[-1]C[+28], 0), RC[+1]))) -> #ERR: ArgCount | E28: =MAX(IF(ISERROR(RC[+1]), IF(NOT(ISERROR(R[-1]C[+22])), ROUND((R[-1]C[+20]-R[-1]C[+24])/R[-1]C[+22], 7), 0)*168, RC[+1]), 0) -> 0 | G28: =IF(RC[-4]=0, 0, RC[-4]/HLOOKUP(RC[-6], R7C10:R11C15, 2, 0)) -> #ERR: ArgCount | H28: =R[-1]C[+1] -> #ERR: ArgCount | I28: =RC[-1]+(RC[-2]+RC[-4])/24 -> #ERR: ArgCount | J28: =R[-1]C-R9C*(RC7+RC5)/168+EQUAL(RC1, R7C)*RC3 -> #ERR: ArgCount | K28: =R[-1]C-R9C*(RC7+RC5)/168+EQUAL(RC1, R7C)*RC3 -> #ERR: ArgCount | L28: =R[-1]C-R9C*(RC7+RC5)/168+EQUAL(RC1, R7C)*RC3 -> #ERR: ArgCount | M28: =R[-1]C-R9C*(RC7+RC5)/168+EQUAL(RC1, R7C)*RC3 -> #ERR: ArgCount | N28: =R[-1]C-R9C*(RC7+RC5)/168+EQUAL(RC1, R7C)*RC3 -> #ERR: ArgCount | O28: =R[-1]C-R9C*(RC7+RC5)/168+EQUAL(RC1, R7C)*RC3 -> #ERR: ArgCount | P28: =RC[-6]/R9C[-6] -> #ERR: ArgCount | Q28: =RC[-6]/R9C[-6] -> #ERR: ArgCount | R28: =RC[-6]/R9C[-6] -> #ERR: ArgCount | S28: =RC[-6]/R9C[-6] -> #ERR: ArgCount | T28: =RC[-6]/R9C[-6] -> #ERR: ArgCount | U28: =RC[-6]/R9C[-6] -> #ERR: ArgCount | V28: =MIN(RC[-6]:RC[-1]) -> #ERR: ArgCount | W28: =MATCH(RC[-1], RC[-7]:RC[-2], 0) -> #ERR: ArgCount | X28: =INDEX(R7C[-8]:R7C[-3], 1, RC[-1]) -> #ERR: ArgCount | Y28: =INDEX(RC[-15]:RC[-10], 1, RC[-2]) -> #ERR: ArgCount | Z28: =INDEX(R8C[-16]:R8C[-11], 1, RC[-3]) -> #ERR: ArgCount | AA28: =INDEX(R9C[-17]:R9C[-12], 1, RC[-4]) -> #ERR: ArgCount | AB28: =INDEX(R10C[-18]:R10C[-13], 1, RC[-5]) -> #ERR: ArgCount | AC28: =INDEX(R12C[-19]:R12C[-14], 1, RC[-6]) -> #ERR: ArgCount | AD28: =INDEX(R13C[-20]:R13C[-15], 1, RC[-7]) -> #ERR: ArgCount | AE28: =RC[-1]-RC[-6]+RC[-4]*(RC[-1]-RC[-6])/(RC[-5]-RC[-4]/168)/168 -> #ERR: ArgCount
A29: =IF(RC[+4], "Idle", IF(ISERROR(R[-1]C), R8C[+3], IF(ISERROR(RC[+1]), R[-1]C[+23], RC[+1]))) -> AB500 | C29: =IF(EQUAL(RC[-2], "Idle"), 0, IF(ISERROR(R[-1]C), R9C[+1], IF(ISERROR(RC[+1]), ROUND(R[-1]C[+28], 0), RC[+1]))) -> 110 | E29: =MAX(IF(ISERROR(RC[+1]), IF(NOT(ISERROR(R[-1]C[+22])), ROUND((R[-1]C[+20]-R[-1]C[+24])/R[-1]C[+22], 7), 0)*168, RC[+1]), 0) -> 0 | G29: =IF(RC[-4]=0, 0, RC[-4]/HLOOKUP(RC[-6], R7C10:R11C15, 2, 0)) -> #ERR: ArgCount | H29: =R[-1]C[+1] -> #ERR: ArgCount | I29: =RC[-1]+(RC[-2]+RC[-4])/24 -> #ERR: ArgCount | J29: =R[-1]C-R9C*(RC7+RC5)/168+EQUAL(RC1, R7C)*RC3 -> #ERR: ArgCount | K29: =R[-1]C-R9C*(RC7+RC5)/168+EQUAL(RC1, R7C)*RC3 -> #ERR: ArgCount | L29: =R[-1]C-R9C*(RC7+RC5)/168+EQUAL(RC1, R7C)*RC3 -> #ERR: ArgCount | M29: =R[-1]C-R9C*(RC7+RC5)/168+EQUAL(RC1, R7C)*RC3 -> #ERR: ArgCount | N29: =R[-1]C-R9C*(RC7+RC5)/168+EQUAL(RC1, R7C)*RC3 -> #ERR: ArgCount | O29: =R[-1]C-R9C*(RC7+RC5)/168+EQUAL(RC1, R7C)*RC3 -> #ERR: ArgCount | P29: =RC[-6]/R9C[-6] -> #ERR: ArgCount | Q29: =RC[-6]/R9C[-6] -> #ERR: ArgCount | R29: =RC[-6]/R9C[-6] -> #ERR: ArgCount | S29: =RC[-6]/R9C[-6] -> #ERR: ArgCount | T29: =RC[-6]/R9C[-6] -> #ERR: ArgCount | U29: =RC[-6]/R9C[-6] -> #ERR: ArgCount | V29: =MIN(RC[-6]:RC[-1]) -> #ERR: ArgCount | W29: =MATCH(RC[-1], RC[-7]:RC[-2], 0) -> #ERR: ArgCount | X29: =INDEX(R7C[-8]:R7C[-3], 1, RC[-1]) -> #ERR: ArgCount | Y29: =INDEX(RC[-15]:RC[-10], 1, RC[-2]) -> #ERR: ArgCount | Z29: =INDEX(R8C[-16]:R8C[-11], 1, RC[-3]) -> #ERR: ArgCount | AA29: =INDEX(R9C[-17]:R9C[-12], 1, RC[-4]) -> #ERR: ArgCount | AB29: =INDEX(R10C[-18]:R10C[-13], 1, RC[-5]) -> #ERR: ArgCount | AC29: =INDEX(R12C[-19]:R12C[-14], 1, RC[-6]) -> #ERR: ArgCount | AD29: =INDEX(R13C[-20]:R13C[-15], 1, RC[-7]) -> #ERR: ArgCount | AE29: =RC[-1]-RC[-6]+RC[-4]*(RC[-1]-RC[-6])/(RC[-5]-RC[-4]/168)/168 -> #ERR: ArgCount
A30: =IF(RC[+4], "Idle", IF(ISERROR(R[-1]C), R8C[+3], IF(ISERROR(RC[+1]), R[-1]C[+23], RC[+1]))) -> #ERR: ArgCount | C30: =IF(EQUAL(RC[-2], "Idle"), 0, IF(ISERROR(R[-1]C), R9C[+1], IF(ISERROR(RC[+1]), ROUND(R[-1]C[+28], 0), RC[+1]))) -> #ERR: ArgCount | E30: =MAX(IF(ISERROR(RC[+1]), IF(NOT(ISERROR(R[-1]C[+22])), ROUND((R[-1]C[+20]-R[-1]C[+24])/R[-1]C[+22], 7), 0)*168, RC[+1]), 0) -> 0 | G30: =IF(RC[-4]=0, 0, RC[-4]/HLOOKUP(RC[-6], R7C10:R11C15, 2, 0)) -> #ERR: ArgCount | H30: =R[-1]C[+1] -> #ERR: ArgCount | I30: =RC[-1]+(RC[-2]+RC[-4])/24 -> #ERR: ArgCount | J30: =R[-1]C-R9C*(RC7+RC5)/168+EQUAL(RC1, R7C)*RC3 -> #ERR: ArgCount | K30: =R[-1]C-R9C*(RC7+RC5)/168+EQUAL(RC1, R7C)*RC3 -> #ERR: ArgCount | L30: =R[-1]C-R9C*(RC7+RC5)/168+EQUAL(RC1, R7C)*RC3 -> #ERR: ArgCount | M30: =R[-1]C-R9C*(RC7+RC5)/168+EQUAL(RC1, R7C)*RC3 -> #ERR: ArgCount | N30: =R[-1]C-R9C*(RC7+RC5)/168+EQUAL(RC1, R7C)*RC3 -> #ERR: ArgCount | O30: =R[-1]C-R9C*(RC7+RC5)/168+EQUAL(RC1, R7C)*RC3 -> #ERR: ArgCount | P30: =RC[-6]/R9C[-6] -> #ERR: ArgCount | Q30: =RC[-6]/R9C[-6] -> #ERR: ArgCount | R30: =RC[-6]/R9C[-6] -> #ERR: ArgCount | S30: =RC[-6]/R9C[-6] -> #ERR: ArgCount | T30: =RC[-6]/R9C[-6] -> #ERR: ArgCount | U30: =RC[-6]/R9C[-6] -> #ERR: ArgCount | V30: =MIN(RC[-6]:RC[-1]) -> #ERR: ArgCount | W30: =MATCH(RC[-1], RC[-7]:RC[-2], 0) -> #ERR: ArgCount | X30: =INDEX(R7C[-8]:R7C[-3], 1, RC[-1]) -> #ERR: ArgCount | Y30: =INDEX(RC[-15]:RC[-10], 1, RC[-2]) -> #ERR: ArgCount | Z30: =INDEX(R8C[-16]:R8C[-11], 1, RC[-3]) -> #ERR: ArgCount | AA30: =INDEX(R9C[-17]:R9C[-12], 1, RC[-4]) -> #ERR: ArgCount | AB30: =INDEX(R10C[-18]:R10C[-13], 1, RC[-5]) -> #ERR: ArgCount | AC30: =INDEX(R12C[-19]:R12C[-14], 1, RC[-6]) -> #ERR: ArgCount | AD30: =INDEX(R13C[-20]:R13C[-15], 1, RC[-7]) -> #ERR: ArgCount | AE30: =RC[-1]-RC[-6]+RC[-4]*(RC[-1]-RC[-6])/(RC[-5]-RC[-4]/168)/168 -> #ERR: ArgCount
A31: =IF(RC[+4], "Idle", IF(ISERROR(R[-1]C), R8C[+3], IF(ISERROR(RC[+1]), R[-1]C[+23], RC[+1]))) -> AB500 | C31: =IF(EQUAL(RC[-2], "Idle"), 0, IF(ISERROR(R[-1]C), R9C[+1], IF(ISERROR(RC[+1]), ROUND(R[-1]C[+28], 0), RC[+1]))) -> 110 | E31: =MAX(IF(ISERROR(RC[+1]), IF(NOT(ISERROR(R[-1]C[+22])), ROUND((R[-1]C[+20]-R[-1]C[+24])/R[-1]C[+22], 7), 0)*168, RC[+1]), 0) -> 0 | G31: =IF(RC[-4]=0, 0, RC[-4]/HLOOKUP(RC[-6], R7C10:R11C15, 2, 0)) -> #ERR: ArgCount | H31: =R[-1]C[+1] -> #ERR: ArgCount | I31: =RC[-1]+(RC[-2]+RC[-4])/24 -> #ERR: ArgCount | J31: =R[-1]C-R9C*(RC7+RC5)/168+EQUAL(RC1, R7C)*RC3 -> #ERR: ArgCount | K31: =R[-1]C-R9C*(RC7+RC5)/168+EQUAL(RC1, R7C)*RC3 -> #ERR: ArgCount | L31: =R[-1]C-R9C*(RC7+RC5)/168+EQUAL(RC1, R7C)*RC3 -> #ERR: ArgCount | M31: =R[-1]C-R9C*(RC7+RC5)/168+EQUAL(RC1, R7C)*RC3 -> #ERR: ArgCount | N31: =R[-1]C-R9C*(RC7+RC5)/168+EQUAL(RC1, R7C)*RC3 -> #ERR: ArgCount | O31: =R[-1]C-R9C*(RC7+RC5)/168+EQUAL(RC1, R7C)*RC3 -> #ERR: ArgCount | P31: =RC[-6]/R9C[-6] -> #ERR: ArgCount | Q31: =RC[-6]/R9C[-6] -> #ERR: ArgCount | R31: =RC[-6]/R9C[-6] -> #ERR: ArgCount | S31: =RC[-6]/R9C[-6] -> #ERR: ArgCount | T31: =RC[-6]/R9C[-6] -> #ERR: ArgCount | U31: =RC[-6]/R9C[-6] -> #ERR: ArgCount | V31: =MIN(RC[-6]:RC[-1]) -> #ERR: ArgCount | W31: =MATCH(RC[-1], RC[-7]:RC[-2], 0) -> #ERR: ArgCount | X31: =INDEX(R7C[-8]:R7C[-3], 1, RC[-1]) -> #ERR: ArgCount | Y31: =INDEX(RC[-15]:RC[-10], 1, RC[-2]) -> #ERR: ArgCount | Z31: =INDEX(R8C[-16]:R8C[-11], 1, RC[-3]) -> #ERR: ArgCount | AA31: =INDEX(R9C[-17]:R9C[-12], 1, RC[-4]) -> #ERR: ArgCount | AB31: =INDEX(R10C[-18]:R10C[-13], 1, RC[-5]) -> #ERR: ArgCount | AC31: =INDEX(R12C[-19]:R12C[-14], 1, RC[-6]) -> #ERR: ArgCount | AD31: =INDEX(R13C[-20]:R13C[-15], 1, RC[-7]) -> #ERR: ArgCount | AE31: =RC[-1]-RC[-6]+RC[-4]*(RC[-1]-RC[-6])/(RC[-5]-RC[-4]/168)/168 -> #ERR: ArgCount
A32: =IF(RC[+4], "Idle", IF(ISERROR(R[-1]C), R8C[+3], IF(ISERROR(RC[+1]), R[-1]C[+23], RC[+1]))) -> #ERR: ArgCount | C32: =IF(EQUAL(RC[-2], "Idle"), 0, IF(ISERROR(R[-1]C), R9C[+1], IF(ISERROR(RC[+1]), ROUND(R[-1]C[+28], 0), RC[+1]))) -> #ERR: ArgCount | E32: =MAX(IF(ISERROR(RC[+1]), IF(NOT(ISERROR(R[-1]C[+22])), ROUND((R[-1]C[+20]-R[-1]C[+24])/R[-1]C[+22], 7), 0)*168, RC[+1]), 0) -> 0 | G32: =IF(RC[-4]=0, 0, RC[-4]/HLOOKUP(RC[-6], R7C10:R11C15, 2, 0)) -> #ERR: ArgCount | H32: =R[-1]C[+1] -> #ERR: ArgCount | I32: =RC[-1]+(RC[-2]+RC[-4])/24 -> #ERR: ArgCount | J32: =R[-1]C-R9C*(RC7+RC5)/168+EQUAL(RC1, R7C)*RC3 -> #ERR: ArgCount | K32: =R[-1]C-R9C*(RC7+RC5)/168+EQUAL(RC1, R7C)*RC3 -> #ERR: ArgCount | L32: =R[-1]C-R9C*(RC7+RC5)/168+EQUAL(RC1, R7C)*RC3 -> #ERR: ArgCount | M32: =R[-1]C-R9C*(RC7+RC5)/168+EQUAL(RC1, R7C)*RC3 -> #ERR: ArgCount | N32: =R[-1]C-R9C*(RC7+RC5)/168+EQUAL(RC1, R7C)*RC3 -> #ERR: ArgCount | O32: =R[-1]C-R9C*(RC7+RC5)/168+EQUAL(RC1, R7C)*RC3 -> #ERR: ArgCount | P32: =RC[-6]/R9C[-6] -> #ERR: ArgCount | Q32: =RC[-6]/R9C[-6] -> #ERR: ArgCount | R32: =RC[-6]/R9C[-6] -> #ERR: ArgCount | S32: =RC[-6]/R9C[-6] -> #ERR: ArgCount | T32: =RC[-6]/R9C[-6] -> #ERR: ArgCount | U32: =RC[-6]/R9C[-6] -> #ERR: ArgCount | V32: =MIN(RC[-6]:RC[-1]) -> #ERR: ArgCount | W32: =MATCH(RC[-1], RC[-7]:RC[-2], 0) -> #ERR: ArgCount | X32: =INDEX(R7C[-8]:R7C[-3], 1, RC[-1]) -> #ERR: ArgCount | Y32: =INDEX(RC[-15]:RC[-10], 1, RC[-2]) -> #ERR: ArgCount | Z32: =INDEX(R8C[-16]:R8C[-11], 1, RC[-3]) -> #ERR: ArgCount | AA32: =INDEX(R9C[-17]:R9C[-12], 1, RC[-4]) -> #ERR: ArgCount | AB32: =INDEX(R10C[-18]:R10C[-13], 1, RC[-5]) -> #ERR: ArgCount | AC32: =INDEX(R12C[-19]:R12C[-14], 1, RC[-6]) -> #ERR: ArgCount | AD32: =INDEX(R13C[-20]:R13C[-15], 1, RC[-7]) -> #ERR: ArgCount | AE32: =RC[-1]-RC[-6]+RC[-4]*(RC[-1]-RC[-6])/(RC[-5]-RC[-4]/168)/168 -> #ERR: ArgCount
A33: =IF(RC[+4], "Idle", IF(ISERROR(R[-1]C), R8C[+3], IF(ISERROR(RC[+1]), R[-1]C[+23], RC[+1]))) -> AB500 | C33: =IF(EQUAL(RC[-2], "Idle"), 0, IF(ISERROR(R[-1]C), R9C[+1], IF(ISERROR(RC[+1]), ROUND(R[-1]C[+28], 0), RC[+1]))) -> 110 | E33: =MAX(IF(ISERROR(RC[+1]), IF(NOT(ISERROR(R[-1]C[+22])), ROUND((R[-1]C[+20]-R[-1]C[+24])/R[-1]C[+22], 7), 0)*168, RC[+1]), 0) -> 0 | G33: =IF(RC[-4]=0, 0, RC[-4]/HLOOKUP(RC[-6], R7C10:R11C15, 2, 0)) -> #ERR: ArgCount | H33: =R[-1]C[+1] -> #ERR: ArgCount | I33: =RC[-1]+(RC[-2]+RC[-4])/24 -> #ERR: ArgCount | J33: =R[-1]C-R9C*(RC7+RC5)/168+EQUAL(RC1, R7C)*RC3 -> #ERR: ArgCount | K33: =R[-1]C-R9C*(RC7+RC5)/168+EQUAL(RC1, R7C)*RC3 -> #ERR: ArgCount | L33: =R[-1]C-R9C*(RC7+RC5)/168+EQUAL(RC1, R7C)*RC3 -> #ERR: ArgCount | M33: =R[-1]C-R9C*(RC7+RC5)/168+EQUAL(RC1, R7C)*RC3 -> #ERR: ArgCount | N33: =R[-1]C-R9C*(RC7+RC5)/168+EQUAL(RC1, R7C)*RC3 -> #ERR: ArgCount | O33: =R[-1]C-R9C*(RC7+RC5)/168+EQUAL(RC1, R7C)*RC3 -> #ERR: ArgCount | P33: =RC[-6]/R9C[-6] -> #ERR: ArgCount | Q33: =RC[-6]/R9C[-6] -> #ERR: ArgCount | R33: =RC[-6]/R9C[-6] -> #ERR: ArgCount | S33: =RC[-6]/R9C[-6] -> #ERR: ArgCount | T33: =RC[-6]/R9C[-6] -> #ERR: ArgCount | U33: =RC[-6]/R9C[-6] -> #ERR: ArgCount | V33: =MIN(RC[-6]:RC[-1]) -> #ERR: ArgCount | W33: =MATCH(RC[-1], RC[-7]:RC[-2], 0) -> #ERR: ArgCount | X33: =INDEX(R7C[-8]:R7C[-3], 1, RC[-1]) -> #ERR: ArgCount | Y33: =INDEX(RC[-15]:RC[-10], 1, RC[-2]) -> #ERR: ArgCount | Z33: =INDEX(R8C[-16]:R8C[-11], 1, RC[-3]) -> #ERR: ArgCount | AA33: =INDEX(R9C[-17]:R9C[-12], 1, RC[-4]) -> #ERR: ArgCount | AB33: =INDEX(R10C[-18]:R10C[-13], 1, RC[-5]) -> #ERR: ArgCount | AC33: =INDEX(R12C[-19]:R12C[-14], 1, RC[-6]) -> #ERR: ArgCount | AD33: =INDEX(R13C[-20]:R13C[-15], 1, RC[-7]) -> #ERR: ArgCount | AE33: =RC[-1]-RC[-6]+RC[-4]*(RC[-1]-RC[-6])/(RC[-5]-RC[-4]/168)/168 -> #ERR: ArgCount
A34: =IF(RC[+4], "Idle", IF(ISERROR(R[-1]C), R8C[+3], IF(ISERROR(RC[+1]), R[-1]C[+23], RC[+1]))) -> #ERR: ArgCount | C34: =IF(EQUAL(RC[-2], "Idle"), 0, IF(ISERROR(R[-1]C), R9C[+1], IF(ISERROR(RC[+1]), ROUND(R[-1]C[+28], 0), RC[+1]))) -> #ERR: ArgCount | E34: =MAX(IF(ISERROR(RC[+1]), IF(NOT(ISERROR(R[-1]C[+22])), ROUND((R[-1]C[+20]-R[-1]C[+24])/R[-1]C[+22], 7), 0)*168, RC[+1]), 0) -> 0 | G34: =IF(RC[-4]=0, 0, RC[-4]/HLOOKUP(RC[-6], R7C10:R11C15, 2, 0)) -> #ERR: ArgCount | H34: =R[-1]C[+1] -> #ERR: ArgCount | I34: =RC[-1]+(RC[-2]+RC[-4])/24 -> #ERR: ArgCount | J34: =R[-1]C-R9C*(RC7+RC5)/168+EQUAL(RC1, R7C)*RC3 -> #ERR: ArgCount | K34: =R[-1]C-R9C*(RC7+RC5)/168+EQUAL(RC1, R7C)*RC3 -> #ERR: ArgCount | L34: =R[-1]C-R9C*(RC7+RC5)/168+EQUAL(RC1, R7C)*RC3 -> #ERR: ArgCount | M34: =R[-1]C-R9C*(RC7+RC5)/168+EQUAL(RC1, R7C)*RC3 -> #ERR: ArgCount | N34: =R[-1]C-R9C*(RC7+RC5)/168+EQUAL(RC1, R7C)*RC3 -> #ERR: ArgCount | O34: =R[-1]C-R9C*(RC7+RC5)/168+EQUAL(RC1, R7C)*RC3 -> #ERR: ArgCount | P34: =RC[-6]/R9C[-6] -> #ERR: ArgCount | Q34: =RC[-6]/R9C[-6] -> #ERR: ArgCount | R34: =RC[-6]/R9C[-6] -> #ERR: ArgCount | S34: =RC[-6]/R9C[-6] -> #ERR: ArgCount | T34: =RC[-6]/R9C[-6] -> #ERR: ArgCount | U34: =RC[-6]/R9C[-6] -> #ERR: ArgCount | V34: =MIN(RC[-6]:RC[-1]) -> #ERR: ArgCount | W34: =MATCH(RC[-1], RC[-7]:RC[-2], 0) -> #ERR: ArgCount | X34: =INDEX(R7C[-8]:R7C[-3], 1, RC[-1]) -> #ERR: ArgCount | Y34: =INDEX(RC[-15]:RC[-10], 1, RC[-2]) -> #ERR: ArgCount | Z34: =INDEX(R8C[-16]:R8C[-11], 1, RC[-3]) -> #ERR: ArgCount | AA34: =INDEX(R9C[-17]:R9C[-12], 1, RC[-4]) -> #ERR: ArgCount | AB34: =INDEX(R10C[-18]:R10C[-13], 1, RC[-5]) -> #ERR: ArgCount | AC34: =INDEX(R12C[-19]:R12C[-14], 1, RC[-6]) -> #ERR: ArgCount | AD34: =INDEX(R13C[-20]:R13C[-15], 1, RC[-7]) -> #ERR: ArgCount | AE34: =RC[-1]-RC[-6]+RC[-4]*(RC[-1]-RC[-6])/(RC[-5]-RC[-4]/168)/168 -> #ERR: ArgCount
A35: =IF(RC[+4], "Idle", IF(ISERROR(R[-1]C), R8C[+3], IF(ISERROR(RC[+1]), R[-1]C[+23], RC[+1]))) -> AB500 | C35: =IF(EQUAL(RC[-2], "Idle"), 0, IF(ISERROR(R[-1]C), R9C[+1], IF(ISERROR(RC[+1]), ROUND(R[-1]C[+28], 0), RC[+1]))) -> 110 | E35: =MAX(IF(ISERROR(RC[+1]), IF(NOT(ISERROR(R[-1]C[+22])), ROUND((R[-1]C[+20]-R[-1]C[+24])/R[-1]C[+22], 7), 0)*168, RC[+1]), 0) -> 0 | G35: =IF(RC[-4]=0, 0, RC[-4]/HLOOKUP(RC[-6], R7C10:R11C15, 2, 0)) -> #ERR: ArgCount | H35: =R[-1]C[+1] -> #ERR: ArgCount | I35: =RC[-1]+(RC[-2]+RC[-4])/24 -> #ERR: ArgCount | J35: =R[-1]C-R9C*(RC7+RC5)/168+EQUAL(RC1, R7C)*RC3 -> #ERR: ArgCount | K35: =R[-1]C-R9C*(RC7+RC5)/168+EQUAL(RC1, R7C)*RC3 -> #ERR: ArgCount | L35: =R[-1]C-R9C*(RC7+RC5)/168+EQUAL(RC1, R7C)*RC3 -> #ERR: ArgCount | M35: =R[-1]C-R9C*(RC7+RC5)/168+EQUAL(RC1, R7C)*RC3 -> #ERR: ArgCount | N35: =R[-1]C-R9C*(RC7+RC5)/168+EQUAL(RC1, R7C)*RC3 -> #ERR: ArgCount | O35: =R[-1]C-R9C*(RC7+RC5)/168+EQUAL(RC1, R7C)*RC3 -> #ERR: ArgCount | P35: =RC[-6]/R9C[-6] -> #ERR: ArgCount | Q35: =RC[-6]/R9C[-6] -> #ERR: ArgCount | R35: =RC[-6]/R9C[-6] -> #ERR: ArgCount | S35: =RC[-6]/R9C[-6] -> #ERR: ArgCount | T35: =RC[-6]/R9C[-6] -> #ERR: ArgCount | U35: =RC[-6]/R9C[-6] -> #ERR: ArgCount | V35: =MIN(RC[-6]:RC[-1]) -> #ERR: ArgCount | W35: =MATCH(RC[-1], RC[-7]:RC[-2], 0) -> #ERR: ArgCount | X35: =INDEX(R7C[-8]:R7C[-3], 1, RC[-1]) -> #ERR: ArgCount | Y35: =INDEX(RC[-15]:RC[-10], 1, RC[-2]) -> #ERR: ArgCount | Z35: =INDEX(R8C[-16]:R8C[-11], 1, RC[-3]) -> #ERR: ArgCount | AA35: =INDEX(R9C[-17]:R9C[-12], 1, RC[-4]) -> #ERR: ArgCount | AB35: =INDEX(R10C[-18]:R10C[-13], 1, RC[-5]) -> #ERR: ArgCount | AC35: =INDEX(R12C[-19]:R12C[-14], 1, RC[-6]) -> #ERR: ArgCount | AD35: =INDEX(R13C[-20]:R13C[-15], 1, RC[-7]) -> #ERR: ArgCount | AE35: =RC[-1]-RC[-6]+RC[-4]*(RC[-1]-RC[-6])/(RC[-5]-RC[-4]/168)/168 -> #ERR: ArgCount
A36: =IF(RC[+4], "Idle", IF(ISERROR(R[-1]C), R8C[+3], IF(ISERROR(RC[+1]), R[-1]C[+23], RC[+1]))) -> #ERR: ArgCount | C36: =IF(EQUAL(RC[-2], "Idle"), 0, IF(ISERROR(R[-1]C), R9C[+1], IF(ISERROR(RC[+1]), ROUND(R[-1]C[+28], 0), RC[+1]))) -> #ERR: ArgCount | E36: =MAX(IF(ISERROR(RC[+1]), IF(NOT(ISERROR(R[-1]C[+22])), ROUND((R[-1]C[+20]-R[-1]C[+24])/R[-1]C[+22], 7), 0)*168, RC[+1]), 0) -> 0 | G36: =IF(RC[-4]=0, 0, RC[-4]/HLOOKUP(RC[-6], R7C10:R11C15, 2, 0)) -> #ERR: ArgCount | H36: =R[-1]C[+1] -> #ERR: ArgCount | I36: =RC[-1]+(RC[-2]+RC[-4])/24 -> #ERR: ArgCount | J36: =R[-1]C-R9C*(RC7+RC5)/168+EQUAL(RC1, R7C)*RC3 -> #ERR: ArgCount | K36: =R[-1]C-R9C*(RC7+RC5)/168+EQUAL(RC1, R7C)*RC3 -> #ERR: ArgCount | L36: =R[-1]C-R9C*(RC7+RC5)/168+EQUAL(RC1, R7C)*RC3 -> #ERR: ArgCount | M36: =R[-1]C-R9C*(RC7+RC5)/168+EQUAL(RC1, R7C)*RC3 -> #ERR: ArgCount | N36: =R[-1]C-R9C*(RC7+RC5)/168+EQUAL(RC1, R7C)*RC3 -> #ERR: ArgCount | O36: =R[-1]C-R9C*(RC7+RC5)/168+EQUAL(RC1, R7C)*RC3 -> #ERR: ArgCount | P36: =RC[-6]/R9C[-6] -> #ERR: ArgCount | Q36: =RC[-6]/R9C[-6] -> #ERR: ArgCount | R36: =RC[-6]/R9C[-6] -> #ERR: ArgCount | S36: =RC[-6]/R9C[-6] -> #ERR: ArgCount | T36: =RC[-6]/R9C[-6] -> #ERR: ArgCount | U36: =RC[-6]/R9C[-6] -> #ERR: ArgCount | V36: =MIN(RC[-6]:RC[-1]) -> #ERR: ArgCount | W36: =MATCH(RC[-1], RC[-7]:RC[-2], 0) -> #ERR: ArgCount | X36: =INDEX(R7C[-8]:R7C[-3], 1, RC[-1]) -> #ERR: ArgCount | Y36: =INDEX(RC[-15]:RC[-10], 1, RC[-2]) -> #ERR: ArgCount | Z36: =INDEX(R8C[-16]:R8C[-11], 1, RC[-3]) -> #ERR: ArgCount | AA36: =INDEX(R9C[-17]:R9C[-12], 1, RC[-4]) -> #ERR: ArgCount | AB36: =INDEX(R10C[-18]:R10C[-13], 1, RC[-5]) -> #ERR: ArgCount | AC36: =INDEX(R12C[-19]:R12C[-14], 1, RC[-6]) -> #ERR: ArgCount | AD36: =INDEX(R13C[-20]:R13C[-15], 1, RC[-7]) -> #ERR: ArgCount | AE36: =RC[-1]-RC[-6]+RC[-4]*(RC[-1]-RC[-6])/(RC[-5]-RC[-4]/168)/168 -> #ERR: ArgCount
A37: =IF(RC[+4], "Idle", IF(ISERROR(R[-1]C), R8C[+3], IF(ISERROR(RC[+1]), R[-1]C[+23], RC[+1]))) -> AB500 | C37: =IF(EQUAL(RC[-2], "Idle"), 0, IF(ISERROR(R[-1]C), R9C[+1], IF(ISERROR(RC[+1]), ROUND(R[-1]C[+28], 0), RC[+1]))) -> 110 | E37: =MAX(IF(ISERROR(RC[+1]), IF(NOT(ISERROR(R[-1]C[+22])), ROUND((R[-1]C[+20]-R[-1]C[+24])/R[-1]C[+22], 7), 0)*168, RC[+1]), 0) -> 0 | G37: =IF(RC[-4]=0, 0, RC[-4]/HLOOKUP(RC[-6], R7C10:R11C15, 2, 0)) -> #ERR: ArgCount | H37: =R[-1]C[+1] -> #ERR: ArgCount | I37: =RC[-1]+(RC[-2]+RC[-4])/24 -> #ERR: ArgCount | J37: =R[-1]C-R9C*(RC7+RC5)/168+EQUAL(RC1, R7C)*RC3 -> #ERR: ArgCount | K37: =R[-1]C-R9C*(RC7+RC5)/168+EQUAL(RC1, R7C)*RC3 -> #ERR: ArgCount | L37: =R[-1]C-R9C*(RC7+RC5)/168+EQUAL(RC1, R7C)*RC3 -> #ERR: ArgCount | M37: =R[-1]C-R9C*(RC7+RC5)/168+EQUAL(RC1, R7C)*RC3 -> #ERR: ArgCount | N37: =R[-1]C-R9C*(RC7+RC5)/168+EQUAL(RC1, R7C)*RC3 -> #ERR: ArgCount | O37: =R[-1]C-R9C*(RC7+RC5)/168+EQUAL(RC1, R7C)*RC3 -> #ERR: ArgCount | P37: =RC[-6]/R9C[-6] -> #ERR: ArgCount | Q37: =RC[-6]/R9C[-6] -> #ERR: ArgCount | R37: =RC[-6]/R9C[-6] -> #ERR: ArgCount | S37: =RC[-6]/R9C[-6] -> #ERR: ArgCount | T37: =RC[-6]/R9C[-6] -> #ERR: ArgCount | U37: =RC[-6]/R9C[-6] -> #ERR: ArgCount | V37: =MIN(RC[-6]:RC[-1]) -> #ERR: ArgCount | W37: =MATCH(RC[-1], RC[-7]:RC[-2], 0) -> #ERR: ArgCount | X37: =INDEX(R7C[-8]:R7C[-3], 1, RC[-1]) -> #ERR: ArgCount | Y37: =INDEX(RC[-15]:RC[-10], 1, RC[-2]) -> #ERR: ArgCount | Z37: =INDEX(R8C[-16]:R8C[-11], 1, RC[-3]) -> #ERR: ArgCount | AA37: =INDEX(R9C[-17]:R9C[-12], 1, RC[-4]) -> #ERR: ArgCount | AB37: =INDEX(R10C[-18]:R10C[-13], 1, RC[-5]) -> #ERR: ArgCount | AC37: =INDEX(R12C[-19]:R12C[-14], 1, RC[-6]) -> #ERR: ArgCount | AD37: =INDEX(R13C[-20]:R13C[-15], 1, RC[-7]) -> #ERR: ArgCount | AE37: =RC[-1]-RC[-6]+RC[-4]*(RC[-1]-RC[-6])/(RC[-5]-RC[-4]/168)/168 -> #ERR: ArgCount
A38: =IF(RC[+4], "Idle", IF(ISERROR(R[-1]C), R8C[+3], IF(ISERROR(RC[+1]), R[-1]C[+23], RC[+1]))) -> #ERR: ArgCount | C38: =IF(EQUAL(RC[-2], "Idle"), 0, IF(ISERROR(R[-1]C), R9C[+1], IF(ISERROR(RC[+1]), ROUND(R[-1]C[+28], 0), RC[+1]))) -> #ERR: ArgCount | E38: =MAX(IF(ISERROR(RC[+1]), IF(NOT(ISERROR(R[-1]C[+22])), ROUND((R[-1]C[+20]-R[-1]C[+24])/R[-1]C[+22], 7), 0)*168, RC[+1]), 0) -> 0 | G38: =IF(RC[-4]=0, 0, RC[-4]/HLOOKUP(RC[-6], R7C10:R11C15, 2, 0)) -> #ERR: ArgCount | H38: =R[-1]C[+1] -> #ERR: ArgCount | I38: =RC[-1]+(RC[-2]+RC[-4])/24 -> #ERR: ArgCount | J38: =R[-1]C-R9C*(RC7+RC5)/168+EQUAL(RC1, R7C)*RC3 -> #ERR: ArgCount | K38: =R[-1]C-R9C*(RC7+RC5)/168+EQUAL(RC1, R7C)*RC3 -> #ERR: ArgCount | L38: =R[-1]C-R9C*(RC7+RC5)/168+EQUAL(RC1, R7C)*RC3 -> #ERR: ArgCount | M38: =R[-1]C-R9C*(RC7+RC5)/168+EQUAL(RC1, R7C)*RC3 -> #ERR: ArgCount | N38: =R[-1]C-R9C*(RC7+RC5)/168+EQUAL(RC1, R7C)*RC3 -> #ERR: ArgCount | O38: =R[-1]C-R9C*(RC7+RC5)/168+EQUAL(RC1, R7C)*RC3 -> #ERR: ArgCount | P38: =RC[-6]/R9C[-6] -> #ERR: ArgCount | Q38: =RC[-6]/R9C[-6] -> #ERR: ArgCount | R38: =RC[-6]/R9C[-6] -> #ERR: ArgCount | S38: =RC[-6]/R9C[-6] -> #ERR: ArgCount | T38: =RC[-6]/R9C[-6] -> #ERR: ArgCount | U38: =RC[-6]/R9C[-6] -> #ERR: ArgCount | V38: =MIN(RC[-6]:RC[-1]) -> #ERR: ArgCount | W38: =MATCH(RC[-1], RC[-7]:RC[-2], 0) -> #ERR: ArgCount | X38: =INDEX(R7C[-8]:R7C[-3], 1, RC[-1]) -> #ERR: ArgCount | Y38: =INDEX(RC[-15]:RC[-10], 1, RC[-2]) -> #ERR: ArgCount | Z38: =INDEX(R8C[-16]:R8C[-11], 1, RC[-3]) -> #ERR: ArgCount | AA38: =INDEX(R9C[-17]:R9C[-12], 1, RC[-4]) -> #ERR: ArgCount | AB38: =INDEX(R10C[-18]:R10C[-13], 1, RC[-5]) -> #ERR: ArgCount | AC38: =INDEX(R12C[-19]:R12C[-14], 1, RC[-6]) -> #ERR: ArgCount | AD38: =INDEX(R13C[-20]:R13C[-15], 1, RC[-7]) -> #ERR: ArgCount | AE38: =RC[-1]-RC[-6]+RC[-4]*(RC[-1]-RC[-6])/(RC[-5]-RC[-4]/168)/168 -> #ERR: ArgCount
A39: =IF(RC[+4], "Idle", IF(ISERROR(R[-1]C), R8C[+3], IF(ISERROR(RC[+1]), R[-1]C[+23], RC[+1]))) -> AB500 | C39: =IF(EQUAL(RC[-2], "Idle"), 0, IF(ISERROR(R[-1]C), R9C[+1], IF(ISERROR(RC[+1]), ROUND(R[-1]C[+28], 0), RC[+1]))) -> 110 | E39: =MAX(IF(ISERROR(RC[+1]), IF(NOT(ISERROR(R[-1]C[+22])), ROUND((R[-1]C[+20]-R[-1]C[+24])/R[-1]C[+22], 7), 0)*168, RC[+1]), 0) -> 0 | G39: =IF(RC[-4]=0, 0, RC[-4]/HLOOKUP(RC[-6], R7C10:R11C15, 2, 0)) -> #ERR: ArgCount | H39: =R[-1]C[+1] -> #ERR: ArgCount | I39: =RC[-1]+(RC[-2]+RC[-4])/24 -> #ERR: ArgCount | J39: =R[-1]C-R9C*(RC7+RC5)/168+EQUAL(RC1, R7C)*RC3 -> #ERR: ArgCount | K39: =R[-1]C-R9C*(RC7+RC5)/168+EQUAL(RC1, R7C)*RC3 -> #ERR: ArgCount | L39: =R[-1]C-R9C*(RC7+RC5)/168+EQUAL(RC1, R7C)*RC3 -> #ERR: ArgCount | M39: =R[-1]C-R9C*(RC7+RC5)/168+EQUAL(RC1, R7C)*RC3 -> #ERR: ArgCount | N39: =R[-1]C-R9C*(RC7+RC5)/168+EQUAL(RC1, R7C)*RC3 -> #ERR: ArgCount | O39: =R[-1]C-R9C*(RC7+RC5)/168+EQUAL(RC1, R7C)*RC3 -> #ERR: ArgCount | P39: =RC[-6]/R9C[-6] -> #ERR: ArgCount | Q39: =RC[-6]/R9C[-6] -> #ERR: ArgCount | R39: =RC[-6]/R9C[-6] -> #ERR: ArgCount | S39: =RC[-6]/R9C[-6] -> #ERR: ArgCount | T39: =RC[-6]/R9C[-6] -> #ERR: ArgCount | U39: =RC[-6]/R9C[-6] -> #ERR: ArgCount | V39: =MIN(RC[-6]:RC[-1]) -> #ERR: ArgCount | W39: =MATCH(RC[-1], RC[-7]:RC[-2], 0) -> #ERR: ArgCount | X39: =INDEX(R7C[-8]:R7C[-3], 1, RC[-1]) -> #ERR: ArgCount | Y39: =INDEX(RC[-15]:RC[-10], 1, RC[-2]) -> #ERR: ArgCount | Z39: =INDEX(R8C[-16]:R8C[-11], 1, RC[-3]) -> #ERR: ArgCount | AA39: =INDEX(R9C[-17]:R9C[-12], 1, RC[-4]) -> #ERR: ArgCount | AB39: =INDEX(R10C[-18]:R10C[-13], 1, RC[-5]) -> #ERR: ArgCount | AC39: =INDEX(R12C[-19]:R12C[-14], 1, RC[-6]) -> #ERR: ArgCount | AD39: =INDEX(R13C[-20]:R13C[-15], 1, RC[-7]) -> #ERR: ArgCount | AE39: =RC[-1]-RC[-6]+RC[-4]*(RC[-1]-RC[-6])/(RC[-5]-RC[-4]/168)/168 -> #ERR: ArgCount
A40: =IF(RC[+4], "Idle", IF(ISERROR(R[-1]C), R8C[+3], IF(ISERROR(RC[+1]), R[-1]C[+23], RC[+1]))) -> #ERR: ArgCount | C40: =IF(EQUAL(RC[-2], "Idle"), 0, IF(ISERROR(R[-1]C), R9C[+1], IF(ISERROR(RC[+1]), ROUND(R[-1]C[+28], 0), RC[+1]))) -> #ERR: ArgCount | E40: =MAX(IF(ISERROR(RC[+1]), IF(NOT(ISERROR(R[-1]C[+22])), ROUND((R[-1]C[+20]-R[-1]C[+24])/R[-1]C[+22], 7), 0)*168, RC[+1]), 0) -> 0 | G40: =IF(RC[-4]=0, 0, RC[-4]/HLOOKUP(RC[-6], R7C10:R11C15, 2, 0)) -> #ERR: ArgCount | H40: =R[-1]C[+1] -> #ERR: ArgCount | I40: =RC[-1]+(RC[-2]+RC[-4])/24 -> #ERR: ArgCount | J40: =R[-1]C-R9C*(RC7+RC5)/168+EQUAL(RC1, R7C)*RC3 -> #ERR: ArgCount | K40: =R[-1]C-R9C*(RC7+RC5)/168+EQUAL(RC1, R7C)*RC3 -> #ERR: ArgCount | L40: =R[-1]C-R9C*(RC7+RC5)/168+EQUAL(RC1, R7C)*RC3 -> #ERR: ArgCount | M40: =R[-1]C-R9C*(RC7+RC5)/168+EQUAL(RC1, R7C)*RC3 -> #ERR: ArgCount | N40: =R[-1]C-R9C*(RC7+RC5)/168+EQUAL(RC1, R7C)*RC3 -> #ERR: ArgCount | O40: =R[-1]C-R9C*(RC7+RC5)/168+EQUAL(RC1, R7C)*RC3 -> #ERR: ArgCount | P40: =RC[-6]/R9C[-6] -> #ERR: ArgCount | Q40: =RC[-6]/R9C[-6] -> #ERR: ArgCount | R40: =RC[-6]/R9C[-6] -> #ERR: ArgCount | S40: =RC[-6]/R9C[-6] -> #ERR: ArgCount | T40: =RC[-6]/R9C[-6] -> #ERR: ArgCount | U40: =RC[-6]/R9C[-6] -> #ERR: ArgCount | V40: =MIN(RC[-6]:RC[-1]) -> #ERR: ArgCount | W40: =MATCH(RC[-1], RC[-7]:RC[-2], 0) -> #ERR: ArgCount | X40: =INDEX(R7C[-8]:R7C[-3], 1, RC[-1]) -> #ERR: ArgCount | Y40: =INDEX(RC[-15]:RC[-10], 1, RC[-2]) -> #ERR: ArgCount | Z40: =INDEX(R8C[-16]:R8C[-11], 1, RC[-3]) -> #ERR: ArgCount | AA40: =INDEX(R9C[-17]:R9C[-12], 1, RC[-4]) -> #ERR: ArgCount | AB40: =INDEX(R10C[-18]:R10C[-13], 1, RC[-5]) -> #ERR: ArgCount | AC40: =INDEX(R12C[-19]:R12C[-14], 1, RC[-6]) -> #ERR: ArgCount | AD40: =INDEX(R13C[-20]:R13C[-15], 1, RC[-7]) -> #ERR: ArgCount | AE40: =RC[-1]-RC[-6]+RC[-4]*(RC[-1]-RC[-6])/(RC[-5]-RC[-4]/168)/168 -> #ERR: ArgCount

Sheet: MaketoInventoryLogic
A1: 'Make-to-Inventory Logic Explained
A3: 'The logic works as follows:
A5: '- | B5: 'the first job is the "Product running now"
B6: '- | C6: 'it starts at the "Start of the first job"
B7: '- | C7: 'and the "Quantity committed" is specified
A8: '- | B8: 'the duration of the job is calculated from the speed, and shown in the "Run hours" column
A9: '- | B9: 'a separate column for each product records the projected inventory level at the end of each job
A10: '- | B10: 'at the end of each job, the inventory level of one product has risen, and the other four products have fallen
A11: '- | B11: 'the opening inventory is recorded at the top of the columns, and would typically come from an inventory management system
A12: '- | B12: 'the inventory at the end of the job is the opening inventory, less the forecast sales for the duration of the job, plus the production quantity of the job
A13: '- | B13: 'another bank of six columns expresses the projected inventory level as days of cover
A14: '- | B14: 'the product with the lowest cover at the end of the job is identified as the next product to be made
A15: '- | B15: 'the quantity to make is that required to increase the inventory level to the maximum, plus sufficient to replenish the amount sold while the job was running
A16: '- | B16: 'the duration of the next job is calculated, and the cycle begins again
A17: '- | B17: 'if the projected inventory level of the lowest cover product is above its minimum, then an idle period is scheduled
A18: '- | B18: 'the duration of the idle period is the time it will take for forecast sales to reduce the inventory to the minimum and trigger the next run
A20: 'You will see from the chart of inventory cover, that the model attempts to keep the inventory of each product between the minimum and maximum.

Sheet: ProductionRuns
A1: 'This is a PivotTable of the Finite Schedule on the previous sheet.
A2: 'For each product, it lists the start time, and numbers each production run.
A5: 'Prod/Run | B5: 'Prod | C5: 'Product | D5: 'Start | E5: 'Total | F5: 'Run
A6: =IF(RC[+3], RC[+1]&"/"&RC[+5], "") -> AB100/1 | B6: =IF(RC[+2], IF(ISERROR(RC[+1]), R[-1]C, RC[+1]), "") -> AB100 | C6: 'AB100 | D6: 36608.8113310185 | E6: 1609 | F6: =IF(RC[-2], IF(EQUAL(RC[-4], R[-1]C[-4]), R[-1]C+1, 1), "") -> 1
A7: =IF(RC[+3], RC[+1]&"/"&RC[+5], "") -> AB100/2 | B7: =IF(RC[+2], IF(ISERROR(RC[+1]), R[-1]C, RC[+1]), "") -> AB100 | D7: 36620.0743287037 | E7: 1609 | F7: =IF(RC[-2], IF(EQUAL(RC[-4], R[-1]C[-4]), R[-1]C+1, 1), "") -> 2
A8: =IF(RC[+3], RC[+1]&"/"&RC[+5], "") -> AB250/1 | B8: =IF(RC[+2], IF(ISERROR(RC[+1]), R[-1]C, RC[+1]), "") -> AB250 | C8: 'AB250 | D8: 36603.4633333333 | E8: 2383 | F8: =IF(RC[-2], IF(EQUAL(RC[-4], R[-1]C[-4]), R[-1]C+1, 1), "") -> 1
A9: =IF(RC[+3], RC[+1]&"/"&RC[+5], "") -> AB250/2 | B9: =IF(RC[+2], IF(ISERROR(RC[+1]), R[-1]C, RC[+1]), "") -> AB250 | D9: 36615.0983333333 | E9: 2321 | F9: =IF(RC[-2], IF(EQUAL(RC[-4], R[-1]C[-4]), R[-1]C+1, 1), "") -> 2
A10: =IF(RC[+3], RC[+1]&"/"&RC[+5], "") -> AB500/1 | B10: =IF(RC[+2], IF(ISERROR(RC[+1]), R[-1]C, RC[+1]), "") -> AB500 | C10: 'AB500 | D10: 36599.3333333333 | E10: 110 | F10: =IF(RC[-2], IF(EQUAL(RC[-4], R[-1]C[-4]), R[-1]C+1, 1), "") -> 1
A11: =IF(RC[+3], RC[+1]&"/"&RC[+5], "") -> AB500/2 | B11: =IF(RC[+2], IF(ISERROR(RC[+1]), R[-1]C, RC[+1]), "") -> AB500 | D11: 36600.9083333333 | E11: 1234 | F11: =IF(RC[-2], IF(EQUAL(RC[-4], R[-1]C[-4]), R[-1]C+1, 1), "") -> 2
A12: =IF(RC[+3], RC[+1]&"/"&RC[+5], "") -> AB500/3 | B12: =IF(RC[+2], IF(ISERROR(RC[+1]), R[-1]C, RC[+1]), "") -> AB500 | D12: 36611.7058333333 | E12: 1234 | F12: =IF(RC[-2], IF(EQUAL(RC[-4], R[-1]C[-4]), R[-1]C+1, 1), "") -> 3
A13: =IF(RC[+3], RC[+1]&"/"&RC[+5], "") -> FL100/1 | B13: =IF(RC[+2], IF(ISERROR(RC[+1]), R[-1]C, RC[+1]), "") -> FL100 | C13: 'FL100 | D13: 36612.9133333333 | E13: 304 | F13: =IF(RC[-2], IF(EQUAL(RC[-4], R[-1]C[-4]), R[-1]C+1, 1), "") -> 1
A14: =IF(RC[+3], RC[+1]&"/"&RC[+5], "") -> FL250/1 | B14: =IF(RC[+2], IF(ISERROR(RC[+1]), R[-1]C, RC[+1]), "") -> FL250 | C14: 'FL250 | D14: 36602.53 | E14: 1960 | F14: =IF(RC[-2], IF(EQUAL(RC[-4], R[-1]C[-4]), R[-1]C+1, 1), "") -> 1
A15: =IF(RC[+3], RC[+1]&"/"&RC[+5], "") -> FL250/2 | B15: =IF(RC[+2], IF(ISERROR(RC[+1]), R[-1]C, RC[+1]), "") -> FL250 | D15: 36613.9633333333 | E15: 1960 | F15: =IF(RC[-2], IF(EQUAL(RC[-4], R[-1]C[-4]), R[-1]C+1, 1), "") -> 2
A16: =IF(RC[+3], RC[+1]&"/"&RC[+5], "") -> FL500/1 | B16: =IF(RC[+2], IF(ISERROR(RC[+1]), R[-1]C, RC[+1]), "") -> FL500 | C16: 'FL500 | D16: 36599.359525463 | E16: 2580 | F16: =IF(RC[-2], IF(EQUAL(RC[-4], R[-1]C[-4]), R[-1]C+1, 1), "") -> 1
A17: =IF(RC[+3], RC[+1]&"/"&RC[+5], "") -> FL500/2 | B17: =IF(RC[+2], IF(ISERROR(RC[+1]), R[-1]C, RC[+1]), "") -> FL500 | D17: 36610.4720833333 | E17: 2538 | F17: =IF(RC[-2], IF(EQUAL(RC[-4], R[-1]C[-4]), R[-1]C+1, 1), "") -> 2
A18: =IF(RC[+3], RC[+1]&"/"&RC[+5], "") -> FL500/3 | B18: =IF(RC[+2], IF(ISERROR(RC[+1]), R[-1]C, RC[+1]), "") -> FL500 | D18: 36621.5758333333 | E18: 2538 | F18: =IF(RC[-2], IF(EQUAL(RC[-4], R[-1]C[-4]), R[-1]C+1, 1), "") -> 3
C19: 'Grand Total | E19: 22380

Sheet: BOMx3
A1: 'This sheet allows for 3 production runs of each product. The Bill of Materials is repeated 3 times,
A2: 'and the quantities of each component required for each production run, is calculated.
A4: 'Product/Run | B4: 'Component | C4: 'Qty each | D4: 'Production Run Index | E4: 'Start Date | F4: 'Production Qty | G4: 'Component Quantity Required
A5: =BillofMaterials!R[+2]C&"/1" -> AB100/1 | B5: =BillofMaterials!R[+2]C -> BS01 | C5: =BillofMaterials!R[+2]C -> 4.8 | D5: =MATCH(RC[-3], ProductionRuns!R1C1:R26C1, 0) -> 6 | E5: =IF(ISERROR(RC4), 0, INT(INDEX(ProductionRuns!R1C1:R26C7, RC4, 4))) -> 36608 | F5: =IF(ISERROR(RC4), 0, INDEX(ProductionRuns!R1C1:R26C7, RC4, 5)) -> 1609 | G5: =RC[-1]*RC[-4] -> 7723.2
A6: =BillofMaterials!R[+2]C&"/1" -> AB100/1 | B6: =BillofMaterials!R[+2]C -> BT100 | C6: =BillofMaterials!R[+2]C -> 48 | D6: =MATCH(RC[-3], ProductionRuns!R1C1:R26C1, 0) -> 6 | E6: =IF(ISERROR(RC4), 0, INT(INDEX(ProductionRuns!R1C1:R26C7, RC4, 4))) -> 36608 | F6: =IF(ISERROR(RC4), 0, INDEX(ProductionRuns!R1C1:R26C7, RC4, 5)) -> 1609 | G6: =RC[-1]*RC[-4] -> 77232
A7: =BillofMaterials!R[+2]C&"/1" -> AB100/1 | B7: =BillofMaterials!R[+2]C -> CAPF | C7: =BillofMaterials!R[+2]C -> 48 | D7: =MATCH(RC[-3], ProductionRuns!R1C1:R26C1, 0) -> 6 | E7: =IF(ISERROR(RC4), 0, INT(INDEX(ProductionRuns!R1C1:R26C7, RC4, 4))) -> 36608 | F7: =IF(ISERROR(RC4), 0, INDEX(ProductionRuns!R1C1:R26C7, RC4, 5)) -> 1609 | G7: =RC[-1]*RC[-4] -> 77232
A8: =BillofMaterials!R[+2]C&"/1" -> AB100/1 | B8: =BillofMaterials!R[+2]C -> CARS | C8: =BillofMaterials!R[+2]C -> 1 | D8: =MATCH(RC[-3], ProductionRuns!R1C1:R26C1, 0) -> 6 | E8: =IF(ISERROR(RC4), 0, INT(INDEX(ProductionRuns!R1C1:R26C7, RC4, 4))) -> 36608 | F8: =IF(ISERROR(RC4), 0, INDEX(ProductionRuns!R1C1:R26C7, RC4, 5)) -> 1609 | G8: =RC[-1]*RC[-4] -> 1609
A9: =BillofMaterials!R[+2]C&"/1" -> AB100/1 | B9: =BillofMaterials!R[+2]C -> ESA | C9: =BillofMaterials!R[+2]C -> 0.048 | D9: =MATCH(RC[-3], ProductionRuns!R1C1:R26C1, 0) -> 6 | E9: =IF(ISERROR(RC4), 0, INT(INDEX(ProductionRuns!R1C1:R26C7, RC4, 4))) -> 36608 | F9: =IF(ISERROR(RC4), 0, INDEX(ProductionRuns!R1C1:R26C7, RC4, 5)) -> 1609 | G9: =RC[-1]*RC[-4] -> 77.232
A10: =BillofMaterials!R[+2]C&"/1" -> AB100/1 | B10: =BillofMaterials!R[+2]C -> LAB10 | C10: =BillofMaterials!R[+2]C -> 50 | D10: =MATCH(RC[-3], ProductionRuns!R1C1:R26C1, 0) -> 6 | E10: =IF(ISERROR(RC4), 0, INT(INDEX(ProductionRuns!R1C1:R26C7, RC4, 4))) -> 36608 | F10: =IF(ISERROR(RC4), 0, INDEX(ProductionRuns!R1C1:R26C7, RC4, 5)) -> 1609 | G10: =RC[-1]*RC[-4] -> 80450
A11: =BillofMaterials!R[+2]C&"/1" -> AB250/1 | B11: =BillofMaterials!R[+2]C -> BS01 | C11: =BillofMaterials!R[+2]C -> 12 | D11: =MATCH(RC[-3], ProductionRuns!R1C1:R26C1, 0) -> 8 | E11: =IF(ISERROR(RC4), 0, INT(INDEX(ProductionRuns!R1C1:R26C7, RC4, 4))) -> 36603 | F11: =IF(ISERROR(RC4), 0, INDEX(ProductionRuns!R1C1:R26C7, RC4, 5)) -> 2383 | G11: =RC[-1]*RC[-4] -> 28596
A12: =BillofMaterials!R[+2]C&"/1" -> AB250/1 | B12: =BillofMaterials!R[+2]C -> BT250 | C12: =BillofMaterials!R[+2]C -> 48 | D12: =MATCH(RC[-3], ProductionRuns!R1C1:R26C1, 0) -> 8 | E12: =IF(ISERROR(RC4), 0, INT(INDEX(ProductionRuns!R1C1:R26C7, RC4, 4))) -> 36603 | F12: =IF(ISERROR(RC4), 0, INDEX(ProductionRuns!R1C1:R26C7, RC4, 5)) -> 2383 | G12: =RC[-1]*RC[-4] -> 114384
A13: =BillofMaterials!R[+2]C&"/1" -> AB250/1 | B13: =BillofMaterials!R[+2]C -> CAPF | C13: =BillofMaterials!R[+2]C -> 48 | D13: =MATCH(RC[-3], ProductionRuns!R1C1:R26C1, 0) -> 8 | E13: =IF(ISERROR(RC4), 0, INT(INDEX(ProductionRuns!R1C1:R26C7, RC4, 4))) -> 36603 | F13: =IF(ISERROR(RC4), 0, INDEX(ProductionRuns!R1C1:R26C7, RC4, 5)) -> 2383 | G13: =RC[-1]*RC[-4] -> 114384
A14: =BillofMaterials!R[+2]C&"/1" -> AB250/1 | B14: =BillofMaterials!R[+2]C -> CARL | C14: =BillofMaterials!R[+2]C -> 1 | D14: =MATCH(RC[-3], ProductionRuns!R1C1:R26C1, 0) -> 8 | E14: =IF(ISERROR(RC4), 0, INT(INDEX(ProductionRuns!R1C1:R26C7, RC4, 4))) -> 36603 | F14: =IF(ISERROR(RC4), 0, INDEX(ProductionRuns!R1C1:R26C7, RC4, 5)) -> 2383 | G14: =RC[-1]*RC[-4] -> 2383
A15: =BillofMaterials!R[+2]C&"/1" -> AB250/1 | B15: =BillofMaterials!R[+2]C -> ESA | C15: =BillofMaterials!R[+2]C -> 0.12 | D15: =MATCH(RC[-3], ProductionRuns!R1C1:R26C1, 0) -> 8 | E15: =IF(ISERROR(RC4), 0, INT(INDEX(ProductionRuns!R1C1:R26C7, RC4, 4))) -> 36603 | F15: =IF(ISERROR(RC4), 0, INDEX(ProductionRuns!R1C1:R26C7, RC4, 5)) -> 2383 | G15: =RC[-1]*RC[-4] -> 285.96
A16: =BillofMaterials!R[+2]C&"/1" -> AB250/1 | B16: =BillofMaterials!R[+2]C -> LAB25 | C16: =BillofMaterials!R[+2]C -> 50 | D16: =MATCH(RC[-3], ProductionRuns!R1C1:R26C1, 0) -> 8 | E16: =IF(ISERROR(RC4), 0, INT(INDEX(ProductionRuns!R1C1:R26C7, RC4, 4))) -> 36603 | F16: =IF(ISERROR(RC4), 0, INDEX(ProductionRuns!R1C1:R26C7, RC4, 5)) -> 2383 | G16: =RC[-1]*RC[-4] -> 119150
A17: =BillofMaterials!R[+2]C&"/1" -> AB500/1 | B17: =BillofMaterials!R[+2]C -> BS01 | C17: =BillofMaterials!R[+2]C -> 12 | D17: =MATCH(RC[-3], ProductionRuns!R1C1:R26C1, 0) -> 10 | E17: =IF(ISERROR(RC4), 0, INT(INDEX(ProductionRuns!R1C1:R26C7, RC4, 4))) -> 36599 | F17: =IF(ISERROR(RC4), 0, INDEX(ProductionRuns!R1C1:R26C7, RC4, 5)) -> 110 | G17: =RC[-1]*RC[-4] -> 1320
A18: =BillofMaterials!R[+2]C&"/1" -> AB500/1 | B18: =BillofMaterials!R[+2]C -> BT500 | C18: =BillofMaterials!R[+2]C -> 24 | D18: =MATCH(RC[-3], ProductionRuns!R1C1:R26C1, 0) -> 10 | E18: =IF(ISERROR(RC4), 0, INT(INDEX(ProductionRuns!R1C1:R26C7, RC4, 4))) -> 36599 | F18: =IF(ISERROR(RC4), 0, INDEX(ProductionRuns!R1C1:R26C7, RC4, 5)) -> 110 | G18: =RC[-1]*RC[-4] -> 2640
A19: =BillofMaterials!R[+2]C&"/1" -> AB500/1 | B19: =BillofMaterials!R[+2]C -> CAPS | C19: =BillofMaterials!R[+2]C -> 24 | D19: =MATCH(RC[-3], ProductionRuns!R1C1:R26C1, 0) -> 10 | E19: =IF(ISERROR(RC4), 0, INT(INDEX(ProductionRuns!R1C1:R26C7, RC4, 4))) -> 36599 | F19: =IF(ISERROR(RC4), 0, INDEX(ProductionRuns!R1C1:R26C7, RC4, 5)) -> 110 | G19: =RC[-1]*RC[-4] -> 2640
A20: =BillofMaterials!R[+2]C&"/1" -> AB500/1 | B20: =BillofMaterials!R[+2]C -> CARL | C20: =BillofMaterials!R[+2]C -> 1 | D20: =MATCH(RC[-3], ProductionRuns!R1C1:R26C1, 0) -> 10 | E20: =IF(ISERROR(RC4), 0, INT(INDEX(ProductionRuns!R1C1:R26C7, RC4, 4))) -> 36599 | F20: =IF(ISERROR(RC4), 0, INDEX(ProductionRuns!R1C1:R26C7, RC4, 5)) -> 110 | G20: =RC[-1]*RC[-4] -> 110
A21: =BillofMaterials!R[+2]C&"/1" -> AB500/1 | B21: =BillofMaterials!R[+2]C -> ESA | C21: =BillofMaterials!R[+2]C -> 0.12 | D21: =MATCH(RC[-3], ProductionRuns!R1C1:R26C1, 0) -> 10 | E21: =IF(ISERROR(RC4), 0, INT(INDEX(ProductionRuns!R1C1:R26C7, RC4, 4))) -> 36599 | F21: =IF(ISERROR(RC4), 0, INDEX(ProductionRuns!R1C1:R26C7, RC4, 5)) -> 110 | G21: =RC[-1]*RC[-4] -> 13.2
A22: =BillofMaterials!R[+2]C&"/1" -> AB500/1 | B22: =BillofMaterials!R[+2]C -> LAB50 | C22: =BillofMaterials!R[+2]C -> 26 | D22: =MATCH(RC[-3], ProductionRuns!R1C1:R26C1, 0) -> 10 | E22: =IF(ISERROR(RC4), 0, INT(INDEX(ProductionRuns!R1C1:R26C7, RC4, 4))) -> 36599 | F22: =IF(ISERROR(RC4), 0, INDEX(ProductionRuns!R1C1:R26C7, RC4, 5)) -> 110 | G22: =RC[-1]*RC[-4] -> 2860
A23: =BillofMaterials!R[+2]C&"/1" -> FL100/1 | B23: =BillofMaterials!R[+2]C -> BS01 | C23: =BillofMaterials!R[+2]C -> 4.8 | D23: =MATCH(RC[-3], ProductionRuns!R1C1:R26C1, 0) -> 13 | E23: =IF(ISERROR(RC4), 0, INT(INDEX(ProductionRuns!R1C1:R26C7, RC4, 4))) -> 36612 | F23: =IF(ISERROR(RC4), 0, INDEX(ProductionRuns!R1C1:R26C7, RC4, 5)) -> 304 | G23: =RC[-1]*RC[-4] -> 1459.2
A24: =BillofMaterials!R[+2]C&"/1" -> FL100/1 | B24: =BillofMaterials!R[+2]C -> BT100 | C24: =BillofMaterials!R[+2]C -> 48 | D24: =MATCH(RC[-3], ProductionRuns!R1C1:R26C1, 0) -> 13 | E24: =IF(ISERROR(RC4), 0, INT(INDEX(ProductionRuns!R1C1:R26C7, RC4, 4))) -> 36612 | F24: =IF(ISERROR(RC4), 0, INDEX(ProductionRuns!R1C1:R26C7, RC4, 5)) -> 304 | G24: =RC[-1]*RC[-4] -> 14592
A25: =BillofMaterials!R[+2]C&"/1" -> FL100/1 | B25: =BillofMaterials!R[+2]C -> CAPF | C25: =BillofMaterials!R[+2]C -> 48 | D25: =MATCH(RC[-3], ProductionRuns!R1C1:R26C1, 0) -> 13 | E25: =IF(ISERROR(RC4), 0, INT(INDEX(ProductionRuns!R1C1:R26C7, RC4, 4))) -> 36612 | F25: =IF(ISERROR(RC4), 0, INDEX(ProductionRuns!R1C1:R26C7, RC4, 5)) -> 304 | G25: =RC[-1]*RC[-4] -> 14592
A26: =BillofMaterials!R[+2]C&"/1" -> FL100/1 | B26: =BillofMaterials!R[+2]C -> CARS | C26: =BillofMaterials!R[+2]C -> 1 | D26: =MATCH(RC[-3], ProductionRuns!R1C1:R26C1, 0) -> 13 | E26: =IF(ISERROR(RC4), 0, INT(INDEX(ProductionRuns!R1C1:R26C7, RC4, 4))) -> 36612 | F26: =IF(ISERROR(RC4), 0, INDEX(ProductionRuns!R1C1:R26C7, RC4, 5)) -> 304 | G26: =RC[-1]*RC[-4] -> 304
A27: =BillofMaterials!R[+2]C&"/1" -> FL100/1 | B27: =BillofMaterials!R[+2]C -> ESL | C27: =BillofMaterials!R[+2]C -> 0.048 | D27: =MATCH(RC[-3], ProductionRuns!R1C1:R26C1, 0) -> 13 | E27: =IF(ISERROR(RC4), 0, INT(INDEX(ProductionRuns!R1C1:R26C7, RC4, 4))) -> 36612 | F27: =IF(ISERROR(RC4), 0, INDEX(ProductionRuns!R1C1:R26C7, RC4, 5)) -> 304 | G27: =RC[-1]*RC[-4] -> 14.592
A28: =BillofMaterials!R[+2]C&"/1" -> FL100/1 | B28: =BillofMaterials!R[+2]C -> LFL10 | C28: =BillofMaterials!R[+2]C -> 50 | D28: =MATCH(RC[-3], ProductionRuns!R1C1:R26C1, 0) -> 13 | E28: =IF(ISERROR(RC4), 0, INT(INDEX(ProductionRuns!R1C1:R26C7, RC4, 4))) -> 36612 | F28: =IF(ISERROR(RC4), 0, INDEX(ProductionRuns!R1C1:R26C7, RC4, 5)) -> 304 | G28: =RC[-1]*RC[-4] -> 15200
A29: =BillofMaterials!R[+2]C&"/1" -> FL250/1 | B29: =BillofMaterials!R[+2]C -> BS01 | C29: =BillofMaterials!R[+2]C -> 12 | D29: =MATCH(RC[-3], ProductionRuns!R1C1:R26C1, 0) -> 14 | E29: =IF(ISERROR(RC4), 0, INT(INDEX(ProductionRuns!R1C1:R26C7, RC4, 4))) -> 36602 | F29: =IF(ISERROR(RC4), 0, INDEX(ProductionRuns!R1C1:R26C7, RC4, 5)) -> 1960 | G29: =RC[-1]*RC[-4] -> 23520
A30: =BillofMaterials!R[+2]C&"/1" -> FL250/1 | B30: =BillofMaterials!R[+2]C -> BT250 | C30: =BillofMaterials!R[+2]C -> 48 | D30: =MATCH(RC[-3], ProductionRuns!R1C1:R26C1, 0) -> 14 | E30: =IF(ISERROR(RC4), 0, INT(INDEX(ProductionRuns!R1C1:R26C7, RC4, 4))) -> 36602 | F30: =IF(ISERROR(RC4), 0, INDEX(ProductionRuns!R1C1:R26C7, RC4, 5)) -> 1960 | G30: =RC[-1]*RC[-4] -> 94080
A31: =BillofMaterials!R[+2]C&"/1" -> FL250/1 | B31: =BillofMaterials!R[+2]C -> CAPF | C31: =BillofMaterials!R[+2]C -> 48 | D31: =MATCH(RC[-3], ProductionRuns!R1C1:R26C1, 0) -> 14 | E31: =IF(ISERROR(RC4), 0, INT(INDEX(ProductionRuns!R1C1:R26C7, RC4, 4))) -> 36602 | F31: =IF(ISERROR(RC4), 0, INDEX(ProductionRuns!R1C1:R26C7, RC4, 5)) -> 1960 | G31: =RC[-1]*RC[-4] -> 94080
A32: =BillofMaterials!R[+2]C&"/1" -> FL250/1 | B32: =BillofMaterials!R[+2]C -> CARL | C32: =BillofMaterials!R[+2]C -> 1 | D32: =MATCH(RC[-3], ProductionRuns!R1C1:R26C1, 0) -> 14 | E32: =IF(ISERROR(RC4), 0, INT(INDEX(ProductionRuns!R1C1:R26C7, RC4, 4))) -> 36602 | F32: =IF(ISERROR(RC4), 0, INDEX(ProductionRuns!R1C1:R26C7, RC4, 5)) -> 1960 | G32: =RC[-1]*RC[-4] -> 1960
A33: =BillofMaterials!R[+2]C&"/1" -> FL250/1 | B33: =BillofMaterials!R[+2]C -> ESL | C33: =BillofMaterials!R[+2]C -> 0.12 | D33: =MATCH(RC[-3], ProductionRuns!R1C1:R26C1, 0) -> 14 | E33: =IF(ISERROR(RC4), 0, INT(INDEX(ProductionRuns!R1C1:R26C7, RC4, 4))) -> 36602 | F33: =IF(ISERROR(RC4), 0, INDEX(ProductionRuns!R1C1:R26C7, RC4, 5)) -> 1960 | G33: =RC[-1]*RC[-4] -> 235.2
A34: =BillofMaterials!R[+2]C&"/1" -> FL250/1 | B34: =BillofMaterials!R[+2]C -> LFL25 | C34: =BillofMaterials!R[+2]C -> 50 | D34: =MATCH(RC[-3], ProductionRuns!R1C1:R26C1, 0) -> 14 | E34: =IF(ISERROR(RC4), 0, INT(INDEX(ProductionRuns!R1C1:R26C7, RC4, 4))) -> 36602 | F34: =IF(ISERROR(RC4), 0, INDEX(ProductionRuns!R1C1:R26C7, RC4, 5)) -> 1960 | G34: =RC[-1]*RC[-4] -> 98000
A35: =BillofMaterials!R[+2]C&"/1" -> FL500/1 | B35: =BillofMaterials!R[+2]C -> BS01 | C35: =BillofMaterials!R[+2]C -> 12 | D35: =MATCH(RC[-3], ProductionRuns!R1C1:R26C1, 0) -> 16 | E35: =IF(ISERROR(RC4), 0, INT(INDEX(ProductionRuns!R1C1:R26C7, RC4, 4))) -> 36599 | F35: =IF(ISERROR(RC4), 0, INDEX(ProductionRuns!R1C1:R26C7, RC4, 5)) -> 2580 | G35: =RC[-1]*RC[-4] -> 30960
A36: =BillofMaterials!R[+2]C&"/1" -> FL500/1 | B36: =BillofMaterials!R[+2]C -> BT500 | C36: =BillofMaterials!R[+2]C -> 24 | D36: =MATCH(RC[-3], ProductionRuns!R1C1:R26C1, 0) -> 16 | E36: =IF(ISERROR(RC4), 0, INT(INDEX(ProductionRuns!R1C1:R26C7, RC4, 4))) -> 36599 | F36: =IF(ISERROR(RC4), 0, INDEX(ProductionRuns!R1C1:R26C7, RC4, 5)) -> 2580 | G36: =RC[-1]*RC[-4] -> 61920
A37: =BillofMaterials!R[+2]C&"/1" -> FL500/1 | B37: =BillofMaterials!R[+2]C -> CAPS | C37: =BillofMaterials!R[+2]C -> 24 | D37: =MATCH(RC[-3], ProductionRuns!R1C1:R26C1, 0) -> 16 | E37: =IF(ISERROR(RC4), 0, INT(INDEX(ProductionRuns!R1C1:R26C7, RC4, 4))) -> 36599 | F37: =IF(ISERROR(RC4), 0, INDEX(ProductionRuns!R1C1:R26C7, RC4, 5)) -> 2580 | G37: =RC[-1]*RC[-4] -> 61920
A38: =BillofMaterials!R[+2]C&"/1" -> FL500/1 | B38: =BillofMaterials!R[+2]C -> CARL | C38: =BillofMaterials!R[+2]C -> 1 | D38: =MATCH(RC[-3], ProductionRuns!R1C1:R26C1, 0) -> 16 | E38: =IF(ISERROR(RC4), 0, INT(INDEX(ProductionRuns!R1C1:R26C7, RC4, 4))) -> 36599 | F38: =IF(ISERROR(RC4), 0, INDEX(ProductionRuns!R1C1:R26C7, RC4, 5)) -> 2580 | G38: =RC[-1]*RC[-4] -> 2580
A39: =BillofMaterials!R[+2]C&"/1" -> FL500/1 | B39: =BillofMaterials!R[+2]C -> ESL | C39: =BillofMaterials!R[+2]C -> 0.12 | D39: =MATCH(RC[-3], ProductionRuns!R1C1:R26C1, 0) -> 16 | E39: =IF(ISERROR(RC4), 0, INT(INDEX(ProductionRuns!R1C1:R26C7, RC4, 4))) -> 36599 | F39: =IF(ISERROR(RC4), 0, INDEX(ProductionRuns!R1C1:R26C7, RC4, 5)) -> 2580 | G39: =RC[-1]*RC[-4] -> 309.6
A40: =BillofMaterials!R[+2]C&"/1" -> FL500/1 | B40: =BillofMaterials!R[+2]C -> LFL50 | C40: =BillofMaterials!R[+2]C -> 26 | D40: =MATCH(RC[-3], ProductionRuns!R1C1:R26C1, 0) -> 16 | E40: =IF(ISERROR(RC4), 0, INT(INDEX(ProductionRuns!R1C1:R26C7, RC4, 4))) -> 36599 | F40: =IF(ISERROR(RC4), 0, INDEX(ProductionRuns!R1C1:R26C7, RC4, 5)) -> 2580 | G40: =RC[-1]*RC[-4] -> 67080
A41: =BillofMaterials!R[+2]C&"/1" -> #REF! | B41: =BillofMaterials!R[+2]C -> #REF! | C41: =BillofMaterials!R[+2]C -> #REF! | D41: =MATCH(RC[-3], ProductionRuns!R1C1:R26C1, 0) -> #REF! | E41: =IF(ISERROR(RC4), 0, INT(INDEX(ProductionRuns!R1C1:R26C7, RC4, 4))) -> 0 | F41: =IF(ISERROR(RC4), 0, INDEX(ProductionRuns!R1C1:R26C7, RC4, 5)) -> 0 | G41: =RC[-1]*RC[-4] -> #REF!
A42: =BillofMaterials!R[+2]C&"/1" -> #REF! | B42: =BillofMaterials!R[+2]C -> #REF! | C42: =BillofMaterials!R[+2]C -> #REF! | D42: =MATCH(RC[-3], ProductionRuns!R1C1:R26C1, 0) -> #REF! | E42: =IF(ISERROR(RC4), 0, INT(INDEX(ProductionRuns!R1C1:R26C7, RC4, 4))) -> 0 | F42: =IF(ISERROR(RC4), 0, INDEX(ProductionRuns!R1C1:R26C7, RC4, 5)) -> 0 | G42: =RC[-1]*RC[-4] -> #REF!
A43: =BillofMaterials!R[+2]C&"/1" -> #REF! | B43: =BillofMaterials!R[+2]C -> #REF! | C43: =BillofMaterials!R[+2]C -> #REF! | D43: =MATCH(RC[-3], ProductionRuns!R1C1:R26C1, 0) -> #REF! | E43: =IF(ISERROR(RC4), 0, INT(INDEX(ProductionRuns!R1C1:R26C7, RC4, 4))) -> 0 | F43: =IF(ISERROR(RC4), 0, INDEX(ProductionRuns!R1C1:R26C7, RC4, 5)) -> 0 | G43: =RC[-1]*RC[-4] -> #REF!
A44: =BillofMaterials!R[+2]C&"/1" -> #REF! | B44: =BillofMaterials!R[+2]C -> #REF! | C44: =BillofMaterials!R[+2]C -> #REF! | D44: =MATCH(RC[-3], ProductionRuns!R1C1:R26C1, 0) -> #REF! | E44: =IF(ISERROR(RC4), 0, INT(INDEX(ProductionRuns!R1C1:R26C7, RC4, 4))) -> 0 | F44: =IF(ISERROR(RC4), 0, INDEX(ProductionRuns!R1C1:R26C7, RC4, 5)) -> 0 | G44: =RC[-1]*RC[-4] -> #REF!
A45: =BillofMaterials!R[+2]C&"/1" -> #REF! | B45: =BillofMaterials!R[+2]C -> #REF! | C45: =BillofMaterials!R[+2]C -> #REF! | D45: =MATCH(RC[-3], ProductionRuns!R1C1:R26C1, 0) -> #REF! | E45: =IF(ISERROR(RC4), 0, INT(INDEX(ProductionRuns!R1C1:R26C7, RC4, 4))) -> 0 | F45: =IF(ISERROR(RC4), 0, INDEX(ProductionRuns!R1C1:R26C7, RC4, 5)) -> 0 | G45: =RC[-1]*RC[-4] -> #REF!
A46: =BillofMaterials!R[+2]C&"/1" -> #REF! | B46: =BillofMaterials!R[+2]C -> #REF! | C46: =BillofMaterials!R[+2]C -> #REF! | D46: =MATCH(RC[-3], ProductionRuns!R1C1:R26C1, 0) -> #REF! | E46: =IF(ISERROR(RC4), 0, INT(INDEX(ProductionRuns!R1C1:R26C7, RC4, 4))) -> 0 | F46: =IF(ISERROR(RC4), 0, INDEX(ProductionRuns!R1C1:R26C7, RC4, 5)) -> 0 | G46: =RC[-1]*RC[-4] -> #REF!
A47: =BillofMaterials!R[+2]C&"/1" -> #REF! | B47: =BillofMaterials!R[+2]C -> #REF! | C47: =BillofMaterials!R[+2]C -> #REF! | D47: =MATCH(RC[-3], ProductionRuns!R1C1:R26C1, 0) -> #REF! | E47: =IF(ISERROR(RC4), 0, INT(INDEX(ProductionRuns!R1C1:R26C7, RC4, 4))) -> 0 | F47: =IF(ISERROR(RC4), 0, INDEX(ProductionRuns!R1C1:R26C7, RC4, 5)) -> 0 | G47: =RC[-1]*RC[-4] -> #REF!
A48: =BillofMaterials!R[+2]C&"/1" -> #REF! | B48: =BillofMaterials!R[+2]C -> #REF! | C48: =BillofMaterials!R[+2]C -> #REF! | D48: =MATCH(RC[-3], ProductionRuns!R1C1:R26C1, 0) -> #REF! | E48: =IF(ISERROR(RC4), 0, INT(INDEX(ProductionRuns!R1C1:R26C7, RC4, 4))) -> 0 | F48: =IF(ISERROR(RC4), 0, INDEX(ProductionRuns!R1C1:R26C7, RC4, 5)) -> 0 | G48: =RC[-1]*RC[-4] -> #REF!
A49: =BillofMaterials!R[+2]C&"/1" -> #REF! | B49: =BillofMaterials!R[+2]C -> #REF! | C49: =BillofMaterials!R[+2]C -> #REF! | D49: =MATCH(RC[-3], ProductionRuns!R1C1:R26C1, 0) -> #REF! | E49: =IF(ISERROR(RC4), 0, INT(INDEX(ProductionRuns!R1C1:R26C7, RC4, 4))) -> 0 | F49: =IF(ISERROR(RC4), 0, INDEX(ProductionRuns!R1C1:R26C7, RC4, 5)) -> 0 | G49: =RC[-1]*RC[-4] -> #REF!
A50: =BillofMaterials!R[+2]C&"/1" -> #REF! | B50: =BillofMaterials!R[+2]C -> #REF! | C50: =BillofMaterials!R[+2]C -> #REF! | D50: =MATCH(RC[-3], ProductionRuns!R1C1:R26C1, 0) -> #REF! | E50: =IF(ISERROR(RC4), 0, INT(INDEX(ProductionRuns!R1C1:R26C7, RC4, 4))) -> 0 | F50: =IF(ISERROR(RC4), 0, INDEX(ProductionRuns!R1C1:R26C7, RC4, 5)) -> 0 | G50: =RC[-1]*RC[-4] -> #REF!
A51: =BillofMaterials!R[-44]C&"/2" -> AB100/2 | B51: =BillofMaterials!R[-44]C -> BS01 | C51: =BillofMaterials!R[-44]C -> 4.8 | D51: =MATCH(RC[-3], ProductionRuns!R1C1:R26C1, 0) -> 7 | E51: =IF(ISERROR(RC4), 0, INT(INDEX(ProductionRuns!R1C1:R26C7, RC4, 4))) -> 36620 | F51: =IF(ISERROR(RC4), 0, INDEX(ProductionRuns!R1C1:R26C7, RC4, 5)) -> 1609 | G51: =RC[-1]*RC[-4] -> 7723.2
A52: =BillofMaterials!R[-44]C&"/2" -> AB100/2 | B52: =BillofMaterials!R[-44]C -> BT100 | C52: =BillofMaterials!R[-44]C -> 48 | D52: =MATCH(RC[-3], ProductionRuns!R1C1:R26C1, 0) -> 7 | E52: =IF(ISERROR(RC4), 0, INT(INDEX(ProductionRuns!R1C1:R26C7, RC4, 4))) -> 36620 | F52: =IF(ISERROR(RC4), 0, INDEX(ProductionRuns!R1C1:R26C7, RC4, 5)) -> 1609 | G52: =RC[-1]*RC[-4] -> 77232
A53: =BillofMaterials!R[-44]C&"/2" -> AB100/2 | B53: =BillofMaterials!R[-44]C -> CAPF | C53: =BillofMaterials!R[-44]C -> 48 | D53: =MATCH(RC[-3], ProductionRuns!R1C1:R26C1, 0) -> 7 | E53: =IF(ISERROR(RC4), 0, INT(INDEX(ProductionRuns!R1C1:R26C7, RC4, 4))) -> 36620 | F53: =IF(ISERROR(RC4), 0, INDEX(ProductionRuns!R1C1:R26C7, RC4, 5)) -> 1609 | G53: =RC[-1]*RC[-4] -> 77232
A54: =BillofMaterials!R[-44]C&"/2" -> AB100/2 | B54: =BillofMaterials!R[-44]C -> CARS | C54: =BillofMaterials!R[-44]C -> 1 | D54: =MATCH(RC[-3], ProductionRuns!R1C1:R26C1, 0) -> 7 | E54: =IF(ISERROR(RC4), 0, INT(INDEX(ProductionRuns!R1C1:R26C7, RC4, 4))) -> 36620 | F54: =IF(ISERROR(RC4), 0, INDEX(ProductionRuns!R1C1:R26C7, RC4, 5)) -> 1609 | G54: =RC[-1]*RC[-4] -> 1609
A55: =BillofMaterials!R[-44]C&"/2" -> AB100/2 | B55: =BillofMaterials!R[-44]C -> ESA | C55: =BillofMaterials!R[-44]C -> 0.048 | D55: =MATCH(RC[-3], ProductionRuns!R1C1:R26C1, 0) -> 7 | E55: =IF(ISERROR(RC4), 0, INT(INDEX(ProductionRuns!R1C1:R26C7, RC4, 4))) -> 36620 | F55: =IF(ISERROR(RC4), 0, INDEX(ProductionRuns!R1C1:R26C7, RC4, 5)) -> 1609 | G55: =RC[-1]*RC[-4] -> 77.232
A56: =BillofMaterials!R[-44]C&"/2" -> AB100/2 | B56: =BillofMaterials!R[-44]C -> LAB10 | C56: =BillofMaterials!R[-44]C -> 50 | D56: =MATCH(RC[-3], ProductionRuns!R1C1:R26C1, 0) -> 7 | E56: =IF(ISERROR(RC4), 0, INT(INDEX(ProductionRuns!R1C1:R26C7, RC4, 4))) -> 36620 | F56: =IF(ISERROR(RC4), 0, INDEX(ProductionRuns!R1C1:R26C7, RC4, 5)) -> 1609 | G56: =RC[-1]*RC[-4] -> 80450
A57: =BillofMaterials!R[-44]C&"/2" -> AB250/2 | B57: =BillofMaterials!R[-44]C -> BS01 | C57: =BillofMaterials!R[-44]C -> 12 | D57: =MATCH(RC[-3], ProductionRuns!R1C1:R26C1, 0) -> 9 | E57: =IF(ISERROR(RC4), 0, INT(INDEX(ProductionRuns!R1C1:R26C7, RC4, 4))) -> 36615 | F57: =IF(ISERROR(RC4), 0, INDEX(ProductionRuns!R1C1:R26C7, RC4, 5)) -> 2321 | G57: =RC[-1]*RC[-4] -> 27852
A58: =BillofMaterials!R[-44]C&"/2" -> AB250/2 | B58: =BillofMaterials!R[-44]C -> BT250 | C58: =BillofMaterials!R[-44]C -> 48 | D58: =MATCH(RC[-3], ProductionRuns!R1C1:R26C1, 0) -> 9 | E58: =IF(ISERROR(RC4), 0, INT(INDEX(ProductionRuns!R1C1:R26C7, RC4, 4))) -> 36615 | F58: =IF(ISERROR(RC4), 0, INDEX(ProductionRuns!R1C1:R26C7, RC4, 5)) -> 2321 | G58: =RC[-1]*RC[-4] -> 111408
A59: =BillofMaterials!R[-44]C&"/2" -> AB250/2 | B59: =BillofMaterials!R[-44]C -> CAPF | C59: =BillofMaterials!R[-44]C -> 48 | D59: =MATCH(RC[-3], ProductionRuns!R1C1:R26C1, 0) -> 9 | E59: =IF(ISERROR(RC4), 0, INT(INDEX(ProductionRuns!R1C1:R26C7, RC4, 4))) -> 36615 | F59: =IF(ISERROR(RC4), 0, INDEX(ProductionRuns!R1C1:R26C7, RC4, 5)) -> 2321 | G59: =RC[-1]*RC[-4] -> 111408
A60: =BillofMaterials!R[-44]C&"/2" -> AB250/2 | B60: =BillofMaterials!R[-44]C -> CARL | C60: =BillofMaterials!R[-44]C -> 1 | D60: =MATCH(RC[-3], ProductionRuns!R1C1:R26C1, 0) -> 9 | E60: =IF(ISERROR(RC4), 0, INT(INDEX(ProductionRuns!R1C1:R26C7, RC4, 4))) -> 36615 | F60: =IF(ISERROR(RC4), 0, INDEX(ProductionRuns!R1C1:R26C7, RC4, 5)) -> 2321 | G60: =RC[-1]*RC[-4] -> 2321
A61: =BillofMaterials!R[-44]C&"/2" -> AB250/2 | B61: =BillofMaterials!R[-44]C -> ESA | C61: =BillofMaterials!R[-44]C -> 0.12 | D61: =MATCH(RC[-3], ProductionRuns!R1C1:R26C1, 0) -> 9 | E61: =IF(ISERROR(RC4), 0, INT(INDEX(ProductionRuns!R1C1:R26C7, RC4, 4))) -> 36615 | F61: =IF(ISERROR(RC4), 0, INDEX(ProductionRuns!R1C1:R26C7, RC4, 5)) -> 2321 | G61: =RC[-1]*RC[-4] -> 278.52
A62: =BillofMaterials!R[-44]C&"/2" -> AB250/2 | B62: =BillofMaterials!R[-44]C -> LAB25 | C62: =BillofMaterials!R[-44]C -> 50 | D62: =MATCH(RC[-3], ProductionRuns!R1C1:R26C1, 0) -> 9 | E62: =IF(ISERROR(RC4), 0, INT(INDEX(ProductionRuns!R1C1:R26C7, RC4, 4))) -> 36615 | F62: =IF(ISERROR(RC4), 0, INDEX(ProductionRuns!R1C1:R26C7, RC4, 5)) -> 2321 | G62: =RC[-1]*RC[-4] -> 116050
A63: =BillofMaterials!R[-44]C&"/2" -> AB500/2 | B63: =BillofMaterials!R[-44]C -> BS01 | C63: =BillofMaterials!R[-44]C -> 12 | D63: =MATCH(RC[-3], ProductionRuns!R1C1:R26C1, 0) -> 11 | E63: =IF(ISERROR(RC4), 0, INT(INDEX(ProductionRuns!R1C1:R26C7, RC4, 4))) -> 36600 | F63: =IF(ISERROR(RC4), 0, INDEX(ProductionRuns!R1C1:R26C7, RC4, 5)) -> 1234 | G63: =RC[-1]*RC[-4] -> 14808
A64: =BillofMaterials!R[-44]C&"/2" -> AB500/2 | B64: =BillofMaterials!R[-44]C -> BT500 | C64: =BillofMaterials!R[-44]C -> 24 | D64: =MATCH(RC[-3], ProductionRuns!R1C1:R26C1, 0) -> 11 | E64: =IF(ISERROR(RC4), 0, INT(INDEX(ProductionRuns!R1C1:R26C7, RC4, 4))) -> 36600 | F64: =IF(ISERROR(RC4), 0, INDEX(ProductionRuns!R1C1:R26C7, RC4, 5)) -> 1234 | G64: =RC[-1]*RC[-4] -> 29616
A65: =BillofMaterials!R[-44]C&"/2" -> AB500/2 | B65: =BillofMaterials!R[-44]C -> CAPS | C65: =BillofMaterials!R[-44]C -> 24 | D65: =MATCH(RC[-3], ProductionRuns!R1C1:R26C1, 0) -> 11 | E65: =IF(ISERROR(RC4), 0, INT(INDEX(ProductionRuns!R1C1:R26C7, RC4, 4))) -> 36600 | F65: =IF(ISERROR(RC4), 0, INDEX(ProductionRuns!R1C1:R26C7, RC4, 5)) -> 1234 | G65: =RC[-1]*RC[-4] -> 29616
A66: =BillofMaterials!R[-44]C&"/2" -> AB500/2 | B66: =BillofMaterials!R[-44]C -> CARL | C66: =BillofMaterials!R[-44]C -> 1 | D66: =MATCH(RC[-3], ProductionRuns!R1C1:R26C1, 0) -> 11 | E66: =IF(ISERROR(RC4), 0, INT(INDEX(ProductionRuns!R1C1:R26C7, RC4, 4))) -> 36600 | F66: =IF(ISERROR(RC4), 0, INDEX(ProductionRuns!R1C1:R26C7, RC4, 5)) -> 1234 | G66: =RC[-1]*RC[-4] -> 1234
A67: =BillofMaterials!R[-44]C&"/2" -> AB500/2 | B67: =BillofMaterials!R[-44]C -> ESA | C67: =BillofMaterials!R[-44]C -> 0.12 | D67: =MATCH(RC[-3], ProductionRuns!R1C1:R26C1, 0) -> 11 | E67: =IF(ISERROR(RC4), 0, INT(INDEX(ProductionRuns!R1C1:R26C7, RC4, 4))) -> 36600 | F67: =IF(ISERROR(RC4), 0, INDEX(ProductionRuns!R1C1:R26C7, RC4, 5)) -> 1234 | G67: =RC[-1]*RC[-4] -> 148.08
A68: =BillofMaterials!R[-44]C&"/2" -> AB500/2 | B68: =BillofMaterials!R[-44]C -> LAB50 | C68: =BillofMaterials!R[-44]C -> 26 | D68: =MATCH(RC[-3], ProductionRuns!R1C1:R26C1, 0) -> 11 | E68: =IF(ISERROR(RC4), 0, INT(INDEX(ProductionRuns!R1C1:R26C7, RC4, 4))) -> 36600 | F68: =IF(ISERROR(RC4), 0, INDEX(ProductionRuns!R1C1:R26C7, RC4, 5)) -> 1234 | G68: =RC[-1]*RC[-4] -> 32084
A69: =BillofMaterials!R[-44]C&"/2" -> FL100/2 | B69: =BillofMaterials!R[-44]C -> BS01 | C69: =BillofMaterials!R[-44]C -> 4.8 | D69: =MATCH(RC[-3], ProductionRuns!R1C1:R26C1, 0) -> #NA | E69: =IF(ISERROR(RC4), 0, INT(INDEX(ProductionRuns!R1C1:R26C7, RC4, 4))) -> 0 | F69: =IF(ISERROR(RC4), 0, INDEX(ProductionRuns!R1C1:R26C7, RC4, 5)) -> 0 | G69: =RC[-1]*RC[-4] -> 0
A70: =BillofMaterials!R[-44]C&"/2" -> FL100/2 | B70: =BillofMaterials!R[-44]C -> BT100 | C70: =BillofMaterials!R[-44]C -> 48 | D70: =MATCH(RC[-3], ProductionRuns!R1C1:R26C1, 0) -> #NA | E70: =IF(ISERROR(RC4), 0, INT(INDEX(ProductionRuns!R1C1:R26C7, RC4, 4))) -> 0 | F70: =IF(ISERROR(RC4), 0, INDEX(ProductionRuns!R1C1:R26C7, RC4, 5)) -> 0 | G70: =RC[-1]*RC[-4] -> 0
A71: =BillofMaterials!R[-44]C&"/2" -> FL100/2 | B71: =BillofMaterials!R[-44]C -> CAPF | C71: =BillofMaterials!R[-44]C -> 48 | D71: =MATCH(RC[-3], ProductionRuns!R1C1:R26C1, 0) -> #NA | E71: =IF(ISERROR(RC4), 0, INT(INDEX(ProductionRuns!R1C1:R26C7, RC4, 4))) -> 0 | F71: =IF(ISERROR(RC4), 0, INDEX(ProductionRuns!R1C1:R26C7, RC4, 5)) -> 0 | G71: =RC[-1]*RC[-4] -> 0
A72: =BillofMaterials!R[-44]C&"/2" -> FL100/2 | B72: =BillofMaterials!R[-44]C -> CARS | C72: =BillofMaterials!R[-44]C -> 1 | D72: =MATCH(RC[-3], ProductionRuns!R1C1:R26C1, 0) -> #NA | E72: =IF(ISERROR(RC4), 0, INT(INDEX(ProductionRuns!R1C1:R26C7, RC4, 4))) -> 0 | F72: =IF(ISERROR(RC4), 0, INDEX(ProductionRuns!R1C1:R26C7, RC4, 5)) -> 0 | G72: =RC[-1]*RC[-4] -> 0
A73: =BillofMaterials!R[-44]C&"/2" -> FL100/2 | B73: =BillofMaterials!R[-44]C -> ESL | C73: =BillofMaterials!R[-44]C -> 0.048 | D73: =MATCH(RC[-3], ProductionRuns!R1C1:R26C1, 0) -> #NA | E73: =IF(ISERROR(RC4), 0, INT(INDEX(ProductionRuns!R1C1:R26C7, RC4, 4))) -> 0 | F73: =IF(ISERROR(RC4), 0, INDEX(ProductionRuns!R1C1:R26C7, RC4, 5)) -> 0 | G73: =RC[-1]*RC[-4] -> 0
A74: =BillofMaterials!R[-44]C&"/2" -> FL100/2 | B74: =BillofMaterials!R[-44]C -> LFL10 | C74: =BillofMaterials!R[-44]C -> 50 | D74: =MATCH(RC[-3], ProductionRuns!R1C1:R26C1, 0) -> #NA | E74: =IF(ISERROR(RC4), 0, INT(INDEX(ProductionRuns!R1C1:R26C7, RC4, 4))) -> 0 | F74: =IF(ISERROR(RC4), 0, INDEX(ProductionRuns!R1C1:R26C7, RC4, 5)) -> 0 | G74: =RC[-1]*RC[-4] -> 0
A75: =BillofMaterials!R[-44]C&"/2" -> FL250/2 | B75: =BillofMaterials!R[-44]C -> BS01 | C75: =BillofMaterials!R[-44]C -> 12 | D75: =MATCH(RC[-3], ProductionRuns!R1C1:R26C1, 0) -> 15 | E75: =IF(ISERROR(RC4), 0, INT(INDEX(ProductionRuns!R1C1:R26C7, RC4, 4))) -> 36613 | F75: =IF(ISERROR(RC4), 0, INDEX(ProductionRuns!R1C1:R26C7, RC4, 5)) -> 1960 | G75: =RC[-1]*RC[-4] -> 23520
A76: =BillofMaterials!R[-44]C&"/2" -> FL250/2 | B76: =BillofMaterials!R[-44]C -> BT250 | C76: =BillofMaterials!R[-44]C -> 48 | D76: =MATCH(RC[-3], ProductionRuns!R1C1:R26C1, 0) -> 15 | E76: =IF(ISERROR(RC4), 0, INT(INDEX(ProductionRuns!R1C1:R26C7, RC4, 4))) -> 36613 | F76: =IF(ISERROR(RC4), 0, INDEX(ProductionRuns!R1C1:R26C7, RC4, 5)) -> 1960 | G76: =RC[-1]*RC[-4] -> 94080
A77: =BillofMaterials!R[-44]C&"/2" -> FL250/2 | B77: =BillofMaterials!R[-44]C -> CAPF | C77: =BillofMaterials!R[-44]C -> 48 | D77: =MATCH(RC[-3], ProductionRuns!R1C1:R26C1, 0) -> 15 | E77: =IF(ISERROR(RC4), 0, INT(INDEX(ProductionRuns!R1C1:R26C7, RC4, 4))) -> 36613 | F77: =IF(ISERROR(RC4), 0, INDEX(ProductionRuns!R1C1:R26C7, RC4, 5)) -> 1960 | G77: =RC[-1]*RC[-4] -> 94080
A78: =BillofMaterials!R[-44]C&"/2" -> FL250/2 | B78: =BillofMaterials!R[-44]C -> CARL | C78: =BillofMaterials!R[-44]C -> 1 | D78: =MATCH(RC[-3], ProductionRuns!R1C1:R26C1, 0) -> 15 | E78: =IF(ISERROR(RC4), 0, INT(INDEX(ProductionRuns!R1C1:R26C7, RC4, 4))) -> 36613 | F78: =IF(ISERROR(RC4), 0, INDEX(ProductionRuns!R1C1:R26C7, RC4, 5)) -> 1960 | G78: =RC[-1]*RC[-4] -> 1960
A79: =BillofMaterials!R[-44]C&"/2" -> FL250/2 | B79: =BillofMaterials!R[-44]C -> ESL | C79: =BillofMaterials!R[-44]C -> 0.12 | D79: =MATCH(RC[-3], ProductionRuns!R1C1:R26C1, 0) -> 15 | E79: =IF(ISERROR(RC4), 0, INT(INDEX(ProductionRuns!R1C1:R26C7, RC4, 4))) -> 36613 | F79: =IF(ISERROR(RC4), 0, INDEX(ProductionRuns!R1C1:R26C7, RC4, 5)) -> 1960 | G79: =RC[-1]*RC[-4] -> 235.2
A80: =BillofMaterials!R[-44]C&"/2" -> FL250/2 | B80: =BillofMaterials!R[-44]C -> LFL25 | C80: =BillofMaterials!R[-44]C -> 50 | D80: =MATCH(RC[-3], ProductionRuns!R1C1:R26C1, 0) -> 15 | E80: =IF(ISERROR(RC4), 0, INT(INDEX(ProductionRuns!R1C1:R26C7, RC4, 4))) -> 36613 | F80: =IF(ISERROR(RC4), 0, INDEX(ProductionRuns!R1C1:R26C7, RC4, 5)) -> 1960 | G80: =RC[-1]*RC[-4] -> 98000
A81: =BillofMaterials!R[-44]C&"/2" -> FL500/2 | B81: =BillofMaterials!R[-44]C -> BS01 | C81: =BillofMaterials!R[-44]C -> 12 | D81: =MATCH(RC[-3], ProductionRuns!R1C1:R26C1, 0) -> 17 | E81: =IF(ISERROR(RC4), 0, INT(INDEX(ProductionRuns!R1C1:R26C7, RC4, 4))) -> 36610 | F81: =IF(ISERROR(RC4), 0, INDEX(ProductionRuns!R1C1:R26C7, RC4, 5)) -> 2538 | G81: =RC[-1]*RC[-4] -> 30456
A82: =BillofMaterials!R[-44]C&"/2" -> FL500/2 | B82: =BillofMaterials!R[-44]C -> BT500 | C82: =BillofMaterials!R[-44]C -> 24 | D82: =MATCH(RC[-3], ProductionRuns!R1C1:R26C1, 0) -> 17 | E82: =IF(ISERROR(RC4), 0, INT(INDEX(ProductionRuns!R1C1:R26C7, RC4, 4))) -> 36610 | F82: =IF(ISERROR(RC4), 0, INDEX(ProductionRuns!R1C1:R26C7, RC4, 5)) -> 2538 | G82: =RC[-1]*RC[-4] -> 60912
A83: =BillofMaterials!R[-44]C&"/2" -> FL500/2 | B83: =BillofMaterials!R[-44]C -> CAPS | C83: =BillofMaterials!R[-44]C -> 24 | D83: =MATCH(RC[-3], ProductionRuns!R1C1:R26C1, 0) -> 17 | E83: =IF(ISERROR(RC4), 0, INT(INDEX(ProductionRuns!R1C1:R26C7, RC4, 4))) -> 36610 | F83: =IF(ISERROR(RC4), 0, INDEX(ProductionRuns!R1C1:R26C7, RC4, 5)) -> 2538 | G83: =RC[-1]*RC[-4] -> 60912
A84: =BillofMaterials!R[-44]C&"/2" -> FL500/2 | B84: =BillofMaterials!R[-44]C -> CARL | C84: =BillofMaterials!R[-44]C -> 1 | D84: =MATCH(RC[-3], ProductionRuns!R1C1:R26C1, 0) -> 17 | E84: =IF(ISERROR(RC4), 0, INT(INDEX(ProductionRuns!R1C1:R26C7, RC4, 4))) -> 36610 | F84: =IF(ISERROR(RC4), 0, INDEX(ProductionRuns!R1C1:R26C7, RC4, 5)) -> 2538 | G84: =RC[-1]*RC[-4] -> 2538
A85: =BillofMaterials!R[-44]C&"/2" -> FL500/2 | B85: =BillofMaterials!R[-44]C -> ESL | C85: =BillofMaterials!R[-44]C -> 0.12 | D85: =MATCH(RC[-3], ProductionRuns!R1C1:R26C1, 0) -> 17 | E85: =IF(ISERROR(RC4), 0, INT(INDEX(ProductionRuns!R1C1:R26C7, RC4, 4))) -> 36610 | F85: =IF(ISERROR(RC4), 0, INDEX(ProductionRuns!R1C1:R26C7, RC4, 5)) -> 2538 | G85: =RC[-1]*RC[-4] -> 304.56
A86: =BillofMaterials!R[-44]C&"/2" -> FL500/2 | B86: =BillofMaterials!R[-44]C -> LFL50 | C86: =BillofMaterials!R[-44]C -> 26 | D86: =MATCH(RC[-3], ProductionRuns!R1C1:R26C1, 0) -> 17 | E86: =IF(ISERROR(RC4), 0, INT(INDEX(ProductionRuns!R1C1:R26C7, RC4, 4))) -> 36610 | F86: =IF(ISERROR(RC4), 0, INDEX(ProductionRuns!R1C1:R26C7, RC4, 5)) -> 2538 | G86: =RC[-1]*RC[-4] -> 65988
A87: =BillofMaterials!R[-44]C&"/2" -> #REF! | B87: =BillofMaterials!R[-44]C -> #REF! | C87: =BillofMaterials!R[-44]C -> #REF! | D87: =MATCH(RC[-3], ProductionRuns!R1C1:R26C1, 0) -> #REF! | E87: =IF(ISERROR(RC4), 0, INT(INDEX(ProductionRuns!R1C1:R26C7, RC4, 4))) -> 0 | F87: =IF(ISERROR(RC4), 0, INDEX(ProductionRuns!R1C1:R26C7, RC4, 5)) -> 0 | G87: =RC[-1]*RC[-4] -> #REF!
A88: =BillofMaterials!R[-44]C&"/2" -> #REF! | B88: =BillofMaterials!R[-44]C -> #REF! | C88: =BillofMaterials!R[-44]C -> #REF! | D88: =MATCH(RC[-3], ProductionRuns!R1C1:R26C1, 0) -> #REF! | E88: =IF(ISERROR(RC4), 0, INT(INDEX(ProductionRuns!R1C1:R26C7, RC4, 4))) -> 0 | F88: =IF(ISERROR(RC4), 0, INDEX(ProductionRuns!R1C1:R26C7, RC4, 5)) -> 0 | G88: =RC[-1]*RC[-4] -> #REF!
A89: =BillofMaterials!R[-44]C&"/2" -> #REF! | B89: =BillofMaterials!R[-44]C -> #REF! | C89: =BillofMaterials!R[-44]C -> #REF! | D89: =MATCH(RC[-3], ProductionRuns!R1C1:R26C1, 0) -> #REF! | E89: =IF(ISERROR(RC4), 0, INT(INDEX(ProductionRuns!R1C1:R26C7, RC4, 4))) -> 0 | F89: =IF(ISERROR(RC4), 0, INDEX(ProductionRuns!R1C1:R26C7, RC4, 5)) -> 0 | G89: =RC[-1]*RC[-4] -> #REF!
A90: =BillofMaterials!R[-44]C&"/2" -> #REF! | B90: =BillofMaterials!R[-44]C -> #REF! | C90: =BillofMaterials!R[-44]C -> #REF! | D90: =MATCH(RC[-3], ProductionRuns!R1C1:R26C1, 0) -> #REF! | E90: =IF(ISERROR(RC4), 0, INT(INDEX(ProductionRuns!R1C1:R26C7, RC4, 4))) -> 0 | F90: =IF(ISERROR(RC4), 0, INDEX(ProductionRuns!R1C1:R26C7, RC4, 5)) -> 0 | G90: =RC[-1]*RC[-4] -> #REF!
A91: =BillofMaterials!R[-44]C&"/2" -> #REF! | B91: =BillofMaterials!R[-44]C -> #REF! | C91: =BillofMaterials!R[-44]C -> #REF! | D91: =MATCH(RC[-3], ProductionRuns!R1C1:R26C1, 0) -> #REF! | E91: =IF(ISERROR(RC4), 0, INT(INDEX(ProductionRuns!R1C1:R26C7, RC4, 4))) -> 0 | F91: =IF(ISERROR(RC4), 0, INDEX(ProductionRuns!R1C1:R26C7, RC4, 5)) -> 0 | G91: =RC[-1]*RC[-4] -> #REF!
A92: =BillofMaterials!R[-44]C&"/2" -> #REF! | B92: =BillofMaterials!R[-44]C -> #REF! | C92: =BillofMaterials!R[-44]C -> #REF! | D92: =MATCH(RC[-3], ProductionRuns!R1C1:R26C1, 0) -> #REF! | E92: =IF(ISERROR(RC4), 0, INT(INDEX(ProductionRuns!R1C1:R26C7, RC4, 4))) -> 0 | F92: =IF(ISERROR(RC4), 0, INDEX(ProductionRuns!R1C1:R26C7, RC4, 5)) -> 0 | G92: =RC[-1]*RC[-4] -> #REF!
A93: =BillofMaterials!R[-44]C&"/2" -> #REF! | B93: =BillofMaterials!R[-44]C -> #REF! | C93: =BillofMaterials!R[-44]C -> #REF! | D93: =MATCH(RC[-3], ProductionRuns!R1C1:R26C1, 0) -> #REF! | E93: =IF(ISERROR(RC4), 0, INT(INDEX(ProductionRuns!R1C1:R26C7, RC4, 4))) -> 0 | F93: =IF(ISERROR(RC4), 0, INDEX(ProductionRuns!R1C1:R26C7, RC4, 5)) -> 0 | G93: =RC[-1]*RC[-4] -> #REF!
A94: =BillofMaterials!R[-44]C&"/2" -> #REF! | B94: =BillofMaterials!R[-44]C -> #REF! | C94: =BillofMaterials!R[-44]C -> #REF! | D94: =MATCH(RC[-3], ProductionRuns!R1C1:R26C1, 0) -> #REF! | E94: =IF(ISERROR(RC4), 0, INT(INDEX(ProductionRuns!R1C1:R26C7, RC4, 4))) -> 0 | F94: =IF(ISERROR(RC4), 0, INDEX(ProductionRuns!R1C1:R26C7, RC4, 5)) -> 0 | G94: =RC[-1]*RC[-4] -> #REF!
A95: =BillofMaterials!R[-44]C&"/2" -> #REF! | B95: =BillofMaterials!R[-44]C -> #REF! | C95: =BillofMaterials!R[-44]C -> #REF! | D95: =MATCH(RC[-3], ProductionRuns!R1C1:R26C1, 0) -> #REF! | E95: =IF(ISERROR(RC4), 0, INT(INDEX(ProductionRuns!R1C1:R26C7, RC4, 4))) -> 0 | F95: =IF(ISERROR(RC4), 0, INDEX(ProductionRuns!R1C1:R26C7, RC4, 5)) -> 0 | G95: =RC[-1]*RC[-4] -> #REF!
A96: =BillofMaterials!R[-44]C&"/2" -> #REF! | B96: =BillofMaterials!R[-44]C -> #REF! | C96: =BillofMaterials!R[-44]C -> #REF! | D96: =MATCH(RC[-3], ProductionRuns!R1C1:R26C1, 0) -> #REF! | E96: =IF(ISERROR(RC4), 0, INT(INDEX(ProductionRuns!R1C1:R26C7, RC4, 4))) -> 0 | F96: =IF(ISERROR(RC4), 0, INDEX(ProductionRuns!R1C1:R26C7, RC4, 5)) -> 0 | G96: =RC[-1]*RC[-4] -> #REF!
A97: =BillofMaterials!R[-90]C&"/3" -> AB100/3 | B97: =BillofMaterials!R[-90]C -> BS01 | C97: =BillofMaterials!R[-90]C -> 4.8 | D97: =MATCH(RC[-3], ProductionRuns!R1C1:R26C1, 0) -> #NA | E97: =IF(ISERROR(RC4), 0, INT(INDEX(ProductionRuns!R1C1:R26C7, RC4, 4))) -> 0 | F97: =IF(ISERROR(RC4), 0, INDEX(ProductionRuns!R1C1:R26C7, RC4, 5)) -> 0 | G97: =RC[-1]*RC[-4] -> 0
A98: =BillofMaterials!R[-90]C&"/3" -> AB100/3 | B98: =BillofMaterials!R[-90]C -> BT100 | C98: =BillofMaterials!R[-90]C -> 48 | D98: =MATCH(RC[-3], ProductionRuns!R1C1:R26C1, 0) -> #NA | E98: =IF(ISERROR(RC4), 0, INT(INDEX(ProductionRuns!R1C1:R26C7, RC4, 4))) -> 0 | F98: =IF(ISERROR(RC4), 0, INDEX(ProductionRuns!R1C1:R26C7, RC4, 5)) -> 0 | G98: =RC[-1]*RC[-4] -> 0
A99: =BillofMaterials!R[-90]C&"/3" -> AB100/3 | B99: =BillofMaterials!R[-90]C -> CAPF | C99: =BillofMaterials!R[-90]C -> 48 | D99: =MATCH(RC[-3], ProductionRuns!R1C1:R26C1, 0) -> #NA | E99: =IF(ISERROR(RC4), 0, INT(INDEX(ProductionRuns!R1C1:R26C7, RC4, 4))) -> 0 | F99: =IF(ISERROR(RC4), 0, INDEX(ProductionRuns!R1C1:R26C7, RC4, 5)) -> 0 | G99: =RC[-1]*RC[-4] -> 0
A100: =BillofMaterials!R[-90]C&"/3" -> AB100/3 | B100: =BillofMaterials!R[-90]C -> CARS | C100: =BillofMaterials!R[-90]C -> 1 | D100: =MATCH(RC[-3], ProductionRuns!R1C1:R26C1, 0) -> #NA | E100: =IF(ISERROR(RC4), 0, INT(INDEX(ProductionRuns!R1C1:R26C7, RC4, 4))) -> 0 | F100: =IF(ISERROR(RC4), 0, INDEX(ProductionRuns!R1C1:R26C7, RC4, 5)) -> 0 | G100: =RC[-1]*RC[-4] -> 0
A101: =BillofMaterials!R[-90]C&"/3" -> AB100/3 | B101: =BillofMaterials!R[-90]C -> ESA | C101: =BillofMaterials!R[-90]C -> 0.048 | D101: =MATCH(RC[-3], ProductionRuns!R1C1:R26C1, 0) -> #NA | E101: =IF(ISERROR(RC4), 0, INT(INDEX(ProductionRuns!R1C1:R26C7, RC4, 4))) -> 0 | F101: =IF(ISERROR(RC4), 0, INDEX(ProductionRuns!R1C1:R26C7, RC4, 5)) -> 0 | G101: =RC[-1]*RC[-4] -> 0
A102: =BillofMaterials!R[-90]C&"/3" -> AB100/3 | B102: =BillofMaterials!R[-90]C -> LAB10 | C102: =BillofMaterials!R[-90]C -> 50 | D102: =MATCH(RC[-3], ProductionRuns!R1C1:R26C1, 0) -> #NA | E102: =IF(ISERROR(RC4), 0, INT(INDEX(ProductionRuns!R1C1:R26C7, RC4, 4))) -> 0 | F102: =IF(ISERROR(RC4), 0, INDEX(ProductionRuns!R1C1:R26C7, RC4, 5)) -> 0 | G102: =RC[-1]*RC[-4] -> 0
A103: =BillofMaterials!R[-90]C&"/3" -> AB250/3 | B103: =BillofMaterials!R[-90]C -> BS01 | C103: =BillofMaterials!R[-90]C -> 12 | D103: =MATCH(RC[-3], ProductionRuns!R1C1:R26C1, 0) -> #NA | E103: =IF(ISERROR(RC4), 0, INT(INDEX(ProductionRuns!R1C1:R26C7, RC4, 4))) -> 0 | F103: =IF(ISERROR(RC4), 0, INDEX(ProductionRuns!R1C1:R26C7, RC4, 5)) -> 0 | G103: =RC[-1]*RC[-4] -> 0
A104: =BillofMaterials!R[-90]C&"/3" -> AB250/3 | B104: =BillofMaterials!R[-90]C -> BT250 | C104: =BillofMaterials!R[-90]C -> 48 | D104: =MATCH(RC[-3], ProductionRuns!R1C1:R26C1, 0) -> #NA | E104: =IF(ISERROR(RC4), 0, INT(INDEX(ProductionRuns!R1C1:R26C7, RC4, 4))) -> 0 | F104: =IF(ISERROR(RC4), 0, INDEX(ProductionRuns!R1C1:R26C7, RC4, 5)) -> 0 | G104: =RC[-1]*RC[-4] -> 0
A105: =BillofMaterials!R[-90]C&"/3" -> AB250/3 | B105: =BillofMaterials!R[-90]C -> CAPF | C105: =BillofMaterials!R[-90]C -> 48 | D105: =MATCH(RC[-3], ProductionRuns!R1C1:R26C1, 0) -> #NA | E105: =IF(ISERROR(RC4), 0, INT(INDEX(ProductionRuns!R1C1:R26C7, RC4, 4))) -> 0 | F105: =IF(ISERROR(RC4), 0, INDEX(ProductionRuns!R1C1:R26C7, RC4, 5)) -> 0 | G105: =RC[-1]*RC[-4] -> 0
A106: =BillofMaterials!R[-90]C&"/3" -> AB250/3 | B106: =BillofMaterials!R[-90]C -> CARL | C106: =BillofMaterials!R[-90]C -> 1 | D106: =MATCH(RC[-3], ProductionRuns!R1C1:R26C1, 0) -> #NA | E106: =IF(ISERROR(RC4), 0, INT(INDEX(ProductionRuns!R1C1:R26C7, RC4, 4))) -> 0 | F106: =IF(ISERROR(RC4), 0, INDEX(ProductionRuns!R1C1:R26C7, RC4, 5)) -> 0 | G106: =RC[-1]*RC[-4] -> 0
A107: =BillofMaterials!R[-90]C&"/3" -> AB250/3 | B107: =BillofMaterials!R[-90]C -> ESA | C107: =BillofMaterials!R[-90]C -> 0.12 | D107: =MATCH(RC[-3], ProductionRuns!R1C1:R26C1, 0) -> #NA | E107: =IF(ISERROR(RC4), 0, INT(INDEX(ProductionRuns!R1C1:R26C7, RC4, 4))) -> 0 | F107: =IF(ISERROR(RC4), 0, INDEX(ProductionRuns!R1C1:R26C7, RC4, 5)) -> 0 | G107: =RC[-1]*RC[-4] -> 0
A108: =BillofMaterials!R[-90]C&"/3" -> AB250/3 | B108: =BillofMaterials!R[-90]C -> LAB25 | C108: =BillofMaterials!R[-90]C -> 50 | D108: =MATCH(RC[-3], ProductionRuns!R1C1:R26C1, 0) -> #NA | E108: =IF(ISERROR(RC4), 0, INT(INDEX(ProductionRuns!R1C1:R26C7, RC4, 4))) -> 0 | F108: =IF(ISERROR(RC4), 0, INDEX(ProductionRuns!R1C1:R26C7, RC4, 5)) -> 0 | G108: =RC[-1]*RC[-4] -> 0
A109: =BillofMaterials!R[-90]C&"/3" -> AB500/3 | B109: =BillofMaterials!R[-90]C -> BS01 | C109: =BillofMaterials!R[-90]C -> 12 | D109: =MATCH(RC[-3], ProductionRuns!R1C1:R26C1, 0) -> 12 | E109: =IF(ISERROR(RC4), 0, INT(INDEX(ProductionRuns!R1C1:R26C7, RC4, 4))) -> 36611 | F109: =IF(ISERROR(RC4), 0, INDEX(ProductionRuns!R1C1:R26C7, RC4, 5)) -> 1234 | G109: =RC[-1]*RC[-4] -> 14808
A110: =BillofMaterials!R[-90]C&"/3" -> AB500/3 | B110: =BillofMaterials!R[-90]C -> BT500 | C110: =BillofMaterials!R[-90]C -> 24 | D110: =MATCH(RC[-3], ProductionRuns!R1C1:R26C1, 0) -> 12 | E110: =IF(ISERROR(RC4), 0, INT(INDEX(ProductionRuns!R1C1:R26C7, RC4, 4))) -> 36611 | F110: =IF(ISERROR(RC4), 0, INDEX(ProductionRuns!R1C1:R26C7, RC4, 5)) -> 1234 | G110: =RC[-1]*RC[-4] -> 29616
A111: =BillofMaterials!R[-90]C&"/3" -> AB500/3 | B111: =BillofMaterials!R[-90]C -> CAPS | C111: =BillofMaterials!R[-90]C -> 24 | D111: =MATCH(RC[-3], ProductionRuns!R1C1:R26C1, 0) -> 12 | E111: =IF(ISERROR(RC4), 0, INT(INDEX(ProductionRuns!R1C1:R26C7, RC4, 4))) -> 36611 | F111: =IF(ISERROR(RC4), 0, INDEX(ProductionRuns!R1C1:R26C7, RC4, 5)) -> 1234 | G111: =RC[-1]*RC[-4] -> 29616
A112: =BillofMaterials!R[-90]C&"/3" -> AB500/3 | B112: =BillofMaterials!R[-90]C -> CARL | C112: =BillofMaterials!R[-90]C -> 1 | D112: =MATCH(RC[-3], ProductionRuns!R1C1:R26C1, 0) -> 12 | E112: =IF(ISERROR(RC4), 0, INT(INDEX(ProductionRuns!R1C1:R26C7, RC4, 4))) -> 36611 | F112: =IF(ISERROR(RC4), 0, INDEX(ProductionRuns!R1C1:R26C7, RC4, 5)) -> 1234 | G112: =RC[-1]*RC[-4] -> 1234
A113: =BillofMaterials!R[-90]C&"/3" -> AB500/3 | B113: =BillofMaterials!R[-90]C -> ESA | C113: =BillofMaterials!R[-90]C -> 0.12 | D113: =MATCH(RC[-3], ProductionRuns!R1C1:R26C1, 0) -> 12 | E113: =IF(ISERROR(RC4), 0, INT(INDEX(ProductionRuns!R1C1:R26C7, RC4, 4))) -> 36611 | F113: =IF(ISERROR(RC4), 0, INDEX(ProductionRuns!R1C1:R26C7, RC4, 5)) -> 1234 | G113: =RC[-1]*RC[-4] -> 148.08
A114: =BillofMaterials!R[-90]C&"/3" -> AB500/3 | B114: =BillofMaterials!R[-90]C -> LAB50 | C114: =BillofMaterials!R[-90]C -> 26 | D114: =MATCH(RC[-3], ProductionRuns!R1C1:R26C1, 0) -> 12 | E114: =IF(ISERROR(RC4), 0, INT(INDEX(ProductionRuns!R1C1:R26C7, RC4, 4))) -> 36611 | F114: =IF(ISERROR(RC4), 0, INDEX(ProductionRuns!R1C1:R26C7, RC4, 5)) -> 1234 | G114: =RC[-1]*RC[-4] -> 32084
A115: =BillofMaterials!R[-90]C&"/3" -> FL100/3 | B115: =BillofMaterials!R[-90]C -> BS01 | C115: =BillofMaterials!R[-90]C -> 4.8 | D115: =MATCH(RC[-3], ProductionRuns!R1C1:R26C1, 0) -> #NA | E115: =IF(ISERROR(RC4), 0, INT(INDEX(ProductionRuns!R1C1:R26C7, RC4, 4))) -> 0 | F115: =IF(ISERROR(RC4), 0, INDEX(ProductionRuns!R1C1:R26C7, RC4, 5)) -> 0 | G115: =RC[-1]*RC[-4] -> 0
A116: =BillofMaterials!R[-90]C&"/3" -> FL100/3 | B116: =BillofMaterials!R[-90]C -> BT100 | C116: =BillofMaterials!R[-90]C -> 48 | D116: =MATCH(RC[-3], ProductionRuns!R1C1:R26C1, 0) -> #NA | E116: =IF(ISERROR(RC4), 0, INT(INDEX(ProductionRuns!R1C1:R26C7, RC4, 4))) -> 0 | F116: =IF(ISERROR(RC4), 0, INDEX(ProductionRuns!R1C1:R26C7, RC4, 5)) -> 0 | G116: =RC[-1]*RC[-4] -> 0
A117: =BillofMaterials!R[-90]C&"/3" -> FL100/3 | B117: =BillofMaterials!R[-90]C -> CAPF | C117: =BillofMaterials!R[-90]C -> 48 | D117: =MATCH(RC[-3], ProductionRuns!R1C1:R26C1, 0) -> #NA | E117: =IF(ISERROR(RC4), 0, INT(INDEX(ProductionRuns!R1C1:R26C7, RC4, 4))) -> 0 | F117: =IF(ISERROR(RC4), 0, INDEX(ProductionRuns!R1C1:R26C7, RC4, 5)) -> 0 | G117: =RC[-1]*RC[-4] -> 0
A118: =BillofMaterials!R[-90]C&"/3" -> FL100/3 | B118: =BillofMaterials!R[-90]C -> CARS | C118: =BillofMaterials!R[-90]C -> 1 | D118: =MATCH(RC[-3], ProductionRuns!R1C1:R26C1, 0) -> #NA | E118: =IF(ISERROR(RC4), 0, INT(INDEX(ProductionRuns!R1C1:R26C7, RC4, 4))) -> 0 | F118: =IF(ISERROR(RC4), 0, INDEX(ProductionRuns!R1C1:R26C7, RC4, 5)) -> 0 | G118: =RC[-1]*RC[-4] -> 0
A119: =BillofMaterials!R[-90]C&"/3" -> FL100/3 | B119: =BillofMaterials!R[-90]C -> ESL | C119: =BillofMaterials!R[-90]C -> 0.048 | D119: =MATCH(RC[-3], ProductionRuns!R1C1:R26C1, 0) -> #NA | E119: =IF(ISERROR(RC4), 0, INT(INDEX(ProductionRuns!R1C1:R26C7, RC4, 4))) -> 0 | F119: =IF(ISERROR(RC4), 0, INDEX(ProductionRuns!R1C1:R26C7, RC4, 5)) -> 0 | G119: =RC[-1]*RC[-4] -> 0
A120: =BillofMaterials!R[-90]C&"/3" -> FL100/3 | B120: =BillofMaterials!R[-90]C -> LFL10 | C120: =BillofMaterials!R[-90]C -> 50 | D120: =MATCH(RC[-3], ProductionRuns!R1C1:R26C1, 0) -> #NA | E120: =IF(ISERROR(RC4), 0, INT(INDEX(ProductionRuns!R1C1:R26C7, RC4, 4))) -> 0 | F120: =IF(ISERROR(RC4), 0, INDEX(ProductionRuns!R1C1:R26C7, RC4, 5)) -> 0 | G120: =RC[-1]*RC[-4] -> 0
A121: =BillofMaterials!R[-90]C&"/3" -> FL250/3 | B121: =BillofMaterials!R[-90]C -> BS01 | C121: =BillofMaterials!R[-90]C -> 12 | D121: =MATCH(RC[-3], ProductionRuns!R1C1:R26C1, 0) -> #NA | E121: =IF(ISERROR(RC4), 0, INT(INDEX(ProductionRuns!R1C1:R26C7, RC4, 4))) -> 0 | F121: =IF(ISERROR(RC4), 0, INDEX(ProductionRuns!R1C1:R26C7, RC4, 5)) -> 0 | G121: =RC[-1]*RC[-4] -> 0
A122: =BillofMaterials!R[-90]C&"/3" -> FL250/3 | B122: =BillofMaterials!R[-90]C -> BT250 | C122: =BillofMaterials!R[-90]C -> 48 | D122: =MATCH(RC[-3], ProductionRuns!R1C1:R26C1, 0) -> #NA | E122: =IF(ISERROR(RC4), 0, INT(INDEX(ProductionRuns!R1C1:R26C7, RC4, 4))) -> 0 | F122: =IF(ISERROR(RC4), 0, INDEX(ProductionRuns!R1C1:R26C7, RC4, 5)) -> 0 | G122: =RC[-1]*RC[-4] -> 0
A123: =BillofMaterials!R[-90]C&"/3" -> FL250/3 | B123: =BillofMaterials!R[-90]C -> CAPF | C123: =BillofMaterials!R[-90]C -> 48 | D123: =MATCH(RC[-3], ProductionRuns!R1C1:R26C1, 0) -> #NA | E123: =IF(ISERROR(RC4), 0, INT(INDEX(ProductionRuns!R1C1:R26C7, RC4, 4))) -> 0 | F123: =IF(ISERROR(RC4), 0, INDEX(ProductionRuns!R1C1:R26C7, RC4, 5)) -> 0 | G123: =RC[-1]*RC[-4] -> 0
A124: =BillofMaterials!R[-90]C&"/3" -> FL250/3 | B124: =BillofMaterials!R[-90]C -> CARL | C124: =BillofMaterials!R[-90]C -> 1 | D124: =MATCH(RC[-3], ProductionRuns!R1C1:R26C1, 0) -> #NA | E124: =IF(ISERROR(RC4), 0, INT(INDEX(ProductionRuns!R1C1:R26C7, RC4, 4))) -> 0 | F124: =IF(ISERROR(RC4), 0, INDEX(ProductionRuns!R1C1:R26C7, RC4, 5)) -> 0 | G124: =RC[-1]*RC[-4] -> 0
A125: =BillofMaterials!R[-90]C&"/3" -> FL250/3 | B125: =BillofMaterials!R[-90]C -> ESL | C125: =BillofMaterials!R[-90]C -> 0.12 | D125: =MATCH(RC[-3], ProductionRuns!R1C1:R26C1, 0) -> #NA | E125: =IF(ISERROR(RC4), 0, INT(INDEX(ProductionRuns!R1C1:R26C7, RC4, 4))) -> 0 | F125: =IF(ISERROR(RC4), 0, INDEX(ProductionRuns!R1C1:R26C7, RC4, 5)) -> 0 | G125: =RC[-1]*RC[-4] -> 0
A126: =BillofMaterials!R[-90]C&"/3" -> FL250/3 | B126: =BillofMaterials!R[-90]C -> LFL25 | C126: =BillofMaterials!R[-90]C -> 50 | D126: =MATCH(RC[-3], ProductionRuns!R1C1:R26C1, 0) -> #NA | E126: =IF(ISERROR(RC4), 0, INT(INDEX(ProductionRuns!R1C1:R26C7, RC4, 4))) -> 0 | F126: =IF(ISERROR(RC4), 0, INDEX(ProductionRuns!R1C1:R26C7, RC4, 5)) -> 0 | G126: =RC[-1]*RC[-4] -> 0
A127: =BillofMaterials!R[-90]C&"/3" -> FL500/3 | B127: =BillofMaterials!R[-90]C -> BS01 | C127: =BillofMaterials!R[-90]C -> 12 | D127: =MATCH(RC[-3], ProductionRuns!R1C1:R26C1, 0) -> 18 | E127: =IF(ISERROR(RC4), 0, INT(INDEX(ProductionRuns!R1C1:R26C7, RC4, 4))) -> 36621 | F127: =IF(ISERROR(RC4), 0, INDEX(ProductionRuns!R1C1:R26C7, RC4, 5)) -> 2538 | G127: =RC[-1]*RC[-4] -> 30456
A128: =BillofMaterials!R[-90]C&"/3" -> FL500/3 | B128: =BillofMaterials!R[-90]C -> BT500 | C128: =BillofMaterials!R[-90]C -> 24 | D128: =MATCH(RC[-3], ProductionRuns!R1C1:R26C1, 0) -> 18 | E128: =IF(ISERROR(RC4), 0, INT(INDEX(ProductionRuns!R1C1:R26C7, RC4, 4))) -> 36621 | F128: =IF(ISERROR(RC4), 0, INDEX(ProductionRuns!R1C1:R26C7, RC4, 5)) -> 2538 | G128: =RC[-1]*RC[-4] -> 60912
A129: =BillofMaterials!R[-90]C&"/3" -> FL500/3 | B129: =BillofMaterials!R[-90]C -> CAPS | C129: =BillofMaterials!R[-90]C -> 24 | D129: =MATCH(RC[-3], ProductionRuns!R1C1:R26C1, 0) -> 18 | E129: =IF(ISERROR(RC4), 0, INT(INDEX(ProductionRuns!R1C1:R26C7, RC4, 4))) -> 36621 | F129: =IF(ISERROR(RC4), 0, INDEX(ProductionRuns!R1C1:R26C7, RC4, 5)) -> 2538 | G129: =RC[-1]*RC[-4] -> 60912
A130: =BillofMaterials!R[-90]C&"/3" -> FL500/3 | B130: =BillofMaterials!R[-90]C -> CARL | C130: =BillofMaterials!R[-90]C -> 1 | D130: =MATCH(RC[-3], ProductionRuns!R1C1:R26C1, 0) -> 18 | E130: =IF(ISERROR(RC4), 0, INT(INDEX(ProductionRuns!R1C1:R26C7, RC4, 4))) -> 36621 | F130: =IF(ISERROR(RC4), 0, INDEX(ProductionRuns!R1C1:R26C7, RC4, 5)) -> 2538 | G130: =RC[-1]*RC[-4] -> 2538
A131: =BillofMaterials!R[-90]C&"/3" -> FL500/3 | B131: =BillofMaterials!R[-90]C -> ESL | C131: =BillofMaterials!R[-90]C -> 0.12 | D131: =MATCH(RC[-3], ProductionRuns!R1C1:R26C1, 0) -> 18 | E131: =IF(ISERROR(RC4), 0, INT(INDEX(ProductionRuns!R1C1:R26C7, RC4, 4))) -> 36621 | F131: =IF(ISERROR(RC4), 0, INDEX(ProductionRuns!R1C1:R26C7, RC4, 5)) -> 2538 | G131: =RC[-1]*RC[-4] -> 304.56
A132: =BillofMaterials!R[-90]C&"/3" -> FL500/3 | B132: =BillofMaterials!R[-90]C -> LFL50 | C132: =BillofMaterials!R[-90]C -> 26 | D132: =MATCH(RC[-3], ProductionRuns!R1C1:R26C1, 0) -> 18 | E132: =IF(ISERROR(RC4), 0, INT(INDEX(ProductionRuns!R1C1:R26C7, RC4, 4))) -> 36621 | F132: =IF(ISERROR(RC4), 0, INDEX(ProductionRuns!R1C1:R26C7, RC4, 5)) -> 2538 | G132: =RC[-1]*RC[-4] -> 65988
A133: =BillofMaterials!R[-90]C&"/3" -> #REF! | B133: =BillofMaterials!R[-90]C -> #REF! | C133: =BillofMaterials!R[-90]C -> #REF! | D133: =MATCH(RC[-3], ProductionRuns!R1C1:R26C1, 0) -> #REF! | E133: =IF(ISERROR(RC4), 0, INT(INDEX(ProductionRuns!R1C1:R26C7, RC4, 4))) -> 0 | F133: =IF(ISERROR(RC4), 0, INDEX(ProductionRuns!R1C1:R26C7, RC4, 5)) -> 0 | G133: =RC[-1]*RC[-4] -> #REF!
A134: =BillofMaterials!R[-90]C&"/3" -> #REF! | B134: =BillofMaterials!R[-90]C -> #REF! | C134: =BillofMaterials!R[-90]C -> #REF! | D134: =MATCH(RC[-3], ProductionRuns!R1C1:R26C1, 0) -> #REF! | E134: =IF(ISERROR(RC4), 0, INT(INDEX(ProductionRuns!R1C1:R26C7, RC4, 4))) -> 0 | F134: =IF(ISERROR(RC4), 0, INDEX(ProductionRuns!R1C1:R26C7, RC4, 5)) -> 0 | G134: =RC[-1]*RC[-4] -> #REF!
A135: =BillofMaterials!R[-90]C&"/3" -> #REF! | B135: =BillofMaterials!R[-90]C -> #REF! | C135: =BillofMaterials!R[-90]C -> #REF! | D135: =MATCH(RC[-3], ProductionRuns!R1C1:R26C1, 0) -> #REF! | E135: =IF(ISERROR(RC4), 0, INT(INDEX(ProductionRuns!R1C1:R26C7, RC4, 4))) -> 0 | F135: =IF(ISERROR(RC4), 0, INDEX(ProductionRuns!R1C1:R26C7, RC4, 5)) -> 0 | G135: =RC[-1]*RC[-4] -> #REF!
A136: =BillofMaterials!R[-90]C&"/3" -> #REF! | B136: =BillofMaterials!R[-90]C -> #REF! | C136: =BillofMaterials!R[-90]C -> #REF! | D136: =MATCH(RC[-3], ProductionRuns!R1C1:R26C1, 0) -> #REF! | E136: =IF(ISERROR(RC4), 0, INT(INDEX(ProductionRuns!R1C1:R26C7, RC4, 4))) -> 0 | F136: =IF(ISERROR(RC4), 0, INDEX(ProductionRuns!R1C1:R26C7, RC4, 5)) -> 0 | G136: =RC[-1]*RC[-4] -> #REF!
A137: =BillofMaterials!R[-90]C&"/3" -> #REF! | B137: =BillofMaterials!R[-90]C -> #REF! | C137: =BillofMaterials!R[-90]C -> #REF! | D137: =MATCH(RC[-3], ProductionRuns!R1C1:R26C1, 0) -> #REF! | E137: =IF(ISERROR(RC4), 0, INT(INDEX(ProductionRuns!R1C1:R26C7, RC4, 4))) -> 0 | F137: =IF(ISERROR(RC4), 0, INDEX(ProductionRuns!R1C1:R26C7, RC4, 5)) -> 0 | G137: =RC[-1]*RC[-4] -> #REF!
A138: =BillofMaterials!R[-90]C&"/3" -> #REF! | B138: =BillofMaterials!R[-90]C -> #REF! | C138: =BillofMaterials!R[-90]C -> #REF! | D138: =MATCH(RC[-3], ProductionRuns!R1C1:R26C1, 0) -> #REF! | E138: =IF(ISERROR(RC4), 0, INT(INDEX(ProductionRuns!R1C1:R26C7, RC4, 4))) -> 0 | F138: =IF(ISERROR(RC4), 0, INDEX(ProductionRuns!R1C1:R26C7, RC4, 5)) -> 0 | G138: =RC[-1]*RC[-4] -> #REF!
A139: =BillofMaterials!R[-90]C&"/3" -> #REF! | B139: =BillofMaterials!R[-90]C -> #REF! | C139: =BillofMaterials!R[-90]C -> #REF! | D139: =MATCH(RC[-3], ProductionRuns!R1C1:R26C1, 0) -> #REF! | E139: =IF(ISERROR(RC4), 0, INT(INDEX(ProductionRuns!R1C1:R26C7, RC4, 4))) -> 0 | F139: =IF(ISERROR(RC4), 0, INDEX(ProductionRuns!R1C1:R26C7, RC4, 5)) -> 0 | G139: =RC[-1]*RC[-4] -> #REF!
A140: =BillofMaterials!R[-90]C&"/3" -> #REF! | B140: =BillofMaterials!R[-90]C -> #REF! | C140: =BillofMaterials!R[-90]C -> #REF! | D140: =MATCH(RC[-3], ProductionRuns!R1C1:R26C1, 0) -> #REF! | E140: =IF(ISERROR(RC4), 0, INT(INDEX(ProductionRuns!R1C1:R26C7, RC4, 4))) -> 0 | F140: =IF(ISERROR(RC4), 0, INDEX(ProductionRuns!R1C1:R26C7, RC4, 5)) -> 0 | G140: =RC[-1]*RC[-4] -> #REF!
A141: =BillofMaterials!R[-90]C&"/3" -> #REF! | B141: =BillofMaterials!R[-90]C -> #REF! | C141: =BillofMaterials!R[-90]C -> #REF! | D141: =MATCH(RC[-3], ProductionRuns!R1C1:R26C1, 0) -> #REF! | E141: =IF(ISERROR(RC4), 0, INT(INDEX(ProductionRuns!R1C1:R26C7, RC4, 4))) -> 0 | F141: =IF(ISERROR(RC4), 0, INDEX(ProductionRuns!R1C1:R26C7, RC4, 5)) -> 0 | G141: =RC[-1]*RC[-4] -> #REF!
A142: =BillofMaterials!R[-90]C&"/3" -> #REF! | B142: =BillofMaterials!R[-90]C -> #REF! | C142: =BillofMaterials!R[-90]C -> #REF! | D142: =MATCH(RC[-3], ProductionRuns!R1C1:R26C1, 0) -> #REF! | E142: =IF(ISERROR(RC4), 0, INT(INDEX(ProductionRuns!R1C1:R26C7, RC4, 4))) -> 0 | F142: =IF(ISERROR(RC4), 0, INDEX(ProductionRuns!R1C1:R26C7, RC4, 5)) -> 0 | G142: =RC[-1]*RC[-4] -> #REF!

Sheet: AllocateInventory
A1: 'Columns A to D are a PivotTable of the database on BOM x 3, and the rest are formulae.
A2: 'At row 150 there are links to the Purchase Orders worksheet.
A3: 'Here component inventory is allocated to the earliest production runs first.
H4: =MATCH(R[+2]C, ItemMaster!R6C1:R6C27, 0) -> 2 | I4: =MATCH(R[+2]C, ItemMaster!R6C1:R6C27, 0) -> 5 | J4: =MATCH(R[+2]C, ItemMaster!R6C1:R6C27, 0) -> 6 | K4: =MATCH(R[+2]C, ItemMaster!R6C1:R6C27, 0) -> 8
A6: 'Component | B6: 'Start Date | C6: 'Product/Run | D6: 'Total | E6: 'Component | F6: 'Start Date | G6: 'Item Index | H6: 'Description | I6: 'Supplier | J6: 'Supplier Name | K6: 'Inventory | L6: 'Balance Remaining | M6: 'Get In | N6: 'On order
A7: 'BS01 | B7: 36599 | C7: 'AB500/1 | D7: 1320 | E7: =IF(R7C4, IF(ISERROR(R7C1), R[-1]C, R7C1), "") -> BS01 | F7: =IF(R7C4, IF(ISERROR(R7C2), R[-1]C, R7C2), "") -> 36599 | G7: =MATCH(RC[-2], ItemMaster!R1C1:R31C1, 0) -> 13 | H7: =INDEX(ItemMaster!R1C1:R31C8, RC7, R4C) -> Base Shampoo | I7: =INDEX(ItemMaster!R1C1:R31C8, RC7, R4C) -> AC01 | J7: =INDEX(ItemMaster!R1C1:R31C8, RC7, R4C) -> #ERR: ArgCount | K7: =INDEX(ItemMaster!R1C1:R31C8, RC7, R4C) -> 34276 | L7: =IF(EQUAL(RC[-7], R[-1]C[-7]), R[-1]C, RC[-1])-RC[-8] -> 32956 | M7: =IF(RC[-1]>0, 0, MIN(RC[-9], RC[-1]*-1)) -> 0
C8: 'FL500/1 | D8: 30960 | E8: =IF(R7C4, IF(ISERROR(R7C1), R[-1]C, R7C1), "") -> BS01 | F8: =IF(R7C4, IF(ISERROR(R7C2), R[-1]C, R7C2), "") -> 36599 | G8: =MATCH(RC[-2], ItemMaster!R1C1:R31C1, 0) -> 13 | H8: =INDEX(ItemMaster!R1C1:R31C8, RC7, R4C) -> Base Shampoo | I8: =INDEX(ItemMaster!R1C1:R31C8, RC7, R4C) -> AC01 | J8: =INDEX(ItemMaster!R1C1:R31C8, RC7, R4C) -> #ERR: ArgCount | K8: =INDEX(ItemMaster!R1C1:R31C8, RC7, R4C) -> 34276 | L8: =IF(EQUAL(RC[-7], R[-1]C[-7]), R[-1]C, RC[-1])-RC[-8] -> 1996 | M8: =IF(RC[-1]>0, 0, MIN(RC[-9], RC[-1]*-1)) -> 0
B9: 36600 | C9: 'AB500/2 | D9: 14808 | E9: =IF(R7C4, IF(ISERROR(R7C1), R[-1]C, R7C1), "") -> BS01 | F9: =IF(R7C4, IF(ISERROR(R7C2), R[-1]C, R7C2), "") -> 36599 | G9: =MATCH(RC[-2], ItemMaster!R1C1:R31C1, 0) -> 13 | H9: =INDEX(ItemMaster!R1C1:R31C8, RC7, R4C) -> Base Shampoo | I9: =INDEX(ItemMaster!R1C1:R31C8, RC7, R4C) -> AC01 | J9: =INDEX(ItemMaster!R1C1:R31C8, RC7, R4C) -> #ERR: ArgCount | K9: =INDEX(ItemMaster!R1C1:R31C8, RC7, R4C) -> 34276 | L9: =IF(EQUAL(RC[-7], R[-1]C[-7]), R[-1]C, RC[-1])-RC[-8] -> -12812 | M9: =IF(RC[-1]>0, 0, MIN(RC[-9], RC[-1]*-1)) -> 12812
B10: 36602 | C10: 'FL250/1 | D10: 23520 | E10: =IF(R7C4, IF(ISERROR(R7C1), R[-1]C, R7C1), "") -> BS01 | F10: =IF(R7C4, IF(ISERROR(R7C2), R[-1]C, R7C2), "") -> 36599 | G10: =MATCH(RC[-2], ItemMaster!R1C1:R31C1, 0) -> 13 | H10: =INDEX(ItemMaster!R1C1:R31C8, RC7, R4C) -> Base Shampoo | I10: =INDEX(ItemMaster!R1C1:R31C8, RC7, R4C) -> AC01 | J10: =INDEX(ItemMaster!R1C1:R31C8, RC7, R4C) -> #ERR: ArgCount | K10: =INDEX(ItemMaster!R1C1:R31C8, RC7, R4C) -> 34276 | L10: =IF(EQUAL(RC[-7], R[-1]C[-7]), R[-1]C, RC[-1])-RC[-8] -> -36332 | M10: =IF(RC[-1]>0, 0, MIN(RC[-9], RC[-1]*-1)) -> 23520
B11: 36603 | C11: 'AB250/1 | D11: 28596 | E11: =IF(R7C4, IF(ISERROR(R7C1), R[-1]C, R7C1), "") -> BS01 | F11: =IF(R7C4, IF(ISERROR(R7C2), R[-1]C, R7C2), "") -> 36599 | G11: =MATCH(RC[-2], ItemMaster!R1C1:R31C1, 0) -> 13 | H11: =INDEX(ItemMaster!R1C1:R31C8, RC7, R4C) -> Base Shampoo | I11: =INDEX(ItemMaster!R1C1:R31C8, RC7, R4C) -> AC01 | J11: =INDEX(ItemMaster!R1C1:R31C8, RC7, R4C) -> #ERR: ArgCount | K11: =INDEX(ItemMaster!R1C1:R31C8, RC7, R4C) -> 34276 | L11: =IF(EQUAL(RC[-7], R[-1]C[-7]), R[-1]C, RC[-1])-RC[-8] -> -64928 | M11: =IF(RC[-1]>0, 0, MIN(RC[-9], RC[-1]*-1)) -> 28596
B12: 36608 | C12: 'AB100/1 | D12: 7723.2 | E12: =IF(R7C4, IF(ISERROR(R7C1), R[-1]C, R7C1), "") -> BS01 | F12: =IF(R7C4, IF(ISERROR(R7C2), R[-1]C, R7C2), "") -> 36599 | G12: =MATCH(RC[-2], ItemMaster!R1C1:R31C1, 0) -> 13 | H12: =INDEX(ItemMaster!R1C1:R31C8, RC7, R4C) -> Base Shampoo | I12: =INDEX(ItemMaster!R1C1:R31C8, RC7, R4C) -> AC01 | J12: =INDEX(ItemMaster!R1C1:R31C8, RC7, R4C) -> #ERR: ArgCount | K12: =INDEX(ItemMaster!R1C1:R31C8, RC7, R4C) -> 34276 | L12: =IF(EQUAL(RC[-7], R[-1]C[-7]), R[-1]C, RC[-1])-RC[-8] -> -72651.2 | M12: =IF(RC[-1]>0, 0, MIN(RC[-9], RC[-1]*-1)) -> 7723.2
B13: 36610 | C13: 'FL500/2 | D13: 30456 | E13: =IF(R7C4, IF(ISERROR(R7C1), R[-1]C, R7C1), "") -> BS01 | F13: =IF(R7C4, IF(ISERROR(R7C2), R[-1]C, R7C2), "") -> 36599 | G13: =MATCH(RC[-2], ItemMaster!R1C1:R31C1, 0) -> 13 | H13: =INDEX(ItemMaster!R1C1:R31C8, RC7, R4C) -> Base Shampoo | I13: =INDEX(ItemMaster!R1C1:R31C8, RC7, R4C) -> AC01 | J13: =INDEX(ItemMaster!R1C1:R31C8, RC7, R4C) -> #ERR: ArgCount | K13: =INDEX(ItemMaster!R1C1:R31C8, RC7, R4C) -> 34276 | L13: =IF(EQUAL(RC[-7], R[-1]C[-7]), R[-1]C, RC[-1])-RC[-8] -> -103107.2 | M13: =IF(RC[-1]>0, 0, MIN(RC[-9], RC[-1]*-1)) -> 30456
B14: 36611 | C14: 'AB500/3 | D14: 14808 | E14: =IF(R7C4, IF(ISERROR(R7C1), R[-1]C, R7C1), "") -> BS01 | F14: =IF(R7C4, IF(ISERROR(R7C2), R[-1]C, R7C2), "") -> 36599 | G14: =MATCH(RC[-2], ItemMaster!R1C1:R31C1, 0) -> 13 | H14: =INDEX(ItemMaster!R1C1:R31C8, RC7, R4C) -> Base Shampoo | I14: =INDEX(ItemMaster!R1C1:R31C8, RC7, R4C) -> AC01 | J14: =INDEX(ItemMaster!R1C1:R31C8, RC7, R4C) -> #ERR: ArgCount | K14: =INDEX(ItemMaster!R1C1:R31C8, RC7, R4C) -> 34276 | L14: =IF(EQUAL(RC[-7], R[-1]C[-7]), R[-1]C, RC[-1])-RC[-8] -> -117915.2 | M14: =IF(RC[-1]>0, 0, MIN(RC[-9], RC[-1]*-1)) -> 14808
B15: 36612 | C15: 'FL100/1 | D15: 1459.2 | E15: =IF(R7C4, IF(ISERROR(R7C1), R[-1]C, R7C1), "") -> BS01 | F15: =IF(R7C4, IF(ISERROR(R7C2), R[-1]C, R7C2), "") -> 36599 | G15: =MATCH(RC[-2], ItemMaster!R1C1:R31C1, 0) -> 13 | H15: =INDEX(ItemMaster!R1C1:R31C8, RC7, R4C) -> Base Shampoo | I15: =INDEX(ItemMaster!R1C1:R31C8, RC7, R4C) -> AC01 | J15: =INDEX(ItemMaster!R1C1:R31C8, RC7, R4C) -> #ERR: ArgCount | K15: =INDEX(ItemMaster!R1C1:R31C8, RC7, R4C) -> 34276 | L15: =IF(EQUAL(RC[-7], R[-1]C[-7]), R[-1]C, RC[-1])-RC[-8] -> -119374.4 | M15: =IF(RC[-1]>0, 0, MIN(RC[-9], RC[-1]*-1)) -> 1459.2
B16: 36613 | C16: 'FL250/2 | D16: 23520 | E16: =IF(R7C4, IF(ISERROR(R7C1), R[-1]C, R7C1), "") -> BS01 | F16: =IF(R7C4, IF(ISERROR(R7C2), R[-1]C, R7C2), "") -> 36599 | G16: =MATCH(RC[-2], ItemMaster!R1C1:R31C1, 0) -> 13 | H16: =INDEX(ItemMaster!R1C1:R31C8, RC7, R4C) -> Base Shampoo | I16: =INDEX(ItemMaster!R1C1:R31C8, RC7, R4C) -> AC01 | J16: =INDEX(ItemMaster!R1C1:R31C8, RC7, R4C) -> #ERR: ArgCount | K16: =INDEX(ItemMaster!R1C1:R31C8, RC7, R4C) -> 34276 | L16: =IF(EQUAL(RC[-7], R[-1]C[-7]), R[-1]C, RC[-1])-RC[-8] -> -142894.4 | M16: =IF(RC[-1]>0, 0, MIN(RC[-9], RC[-1]*-1)) -> 23520
B17: 36615 | C17: 'AB250/2 | D17: 27852 | E17: =IF(R7C4, IF(ISERROR(R7C1), R[-1]C, R7C1), "") -> BS01 | F17: =IF(R7C4, IF(ISERROR(R7C2), R[-1]C, R7C2), "") -> 36599 | G17: =MATCH(RC[-2], ItemMaster!R1C1:R31C1, 0) -> 13 | H17: =INDEX(ItemMaster!R1C1:R31C8, RC7, R4C) -> Base Shampoo | I17: =INDEX(ItemMaster!R1C1:R31C8, RC7, R4C) -> AC01 | J17: =INDEX(ItemMaster!R1C1:R31C8, RC7, R4C) -> #ERR: ArgCount | K17: =INDEX(ItemMaster!R1C1:R31C8, RC7, R4C) -> 34276 | L17: =IF(EQUAL(RC[-7], R[-1]C[-7]), R[-1]C, RC[-1])-RC[-8] -> -170746.4 | M17: =IF(RC[-1]>0, 0, MIN(RC[-9], RC[-1]*-1)) -> 27852
B18: 36620 | C18: 'AB100/2 | D18: 7723.2 | E18: =IF(R7C4, IF(ISERROR(R7C1), R[-1]C, R7C1), "") -> BS01 | F18: =IF(R7C4, IF(ISERROR(R7C2), R[-1]C, R7C2), "") -> 36599 | G18: =MATCH(RC[-2], ItemMaster!R1C1:R31C1, 0) -> 13 | H18: =INDEX(ItemMaster!R1C1:R31C8, RC7, R4C) -> Base Shampoo | I18: =INDEX(ItemMaster!R1C1:R31C8, RC7, R4C) -> AC01 | J18: =INDEX(ItemMaster!R1C1:R31C8, RC7, R4C) -> #ERR: ArgCount | K18: =INDEX(ItemMaster!R1C1:R31C8, RC7, R4C) -> 34276 | L18: =IF(EQUAL(RC[-7], R[-1]C[-7]), R[-1]C, RC[-1])-RC[-8] -> -178469.6 | M18: =IF(RC[-1]>0, 0, MIN(RC[-9], RC[-1]*-1)) -> 7723.2
B19: 36621 | C19: 'FL500/3 | D19: 30456 | E19: =IF(R7C4, IF(ISERROR(R7C1), R[-1]C, R7C1), "") -> BS01 | F19: =IF(R7C4, IF(ISERROR(R7C2), R[-1]C, R7C2), "") -> 36599 | G19: =MATCH(RC[-2], ItemMaster!R1C1:R31C1, 0) -> 13 | H19: =INDEX(ItemMaster!R1C1:R31C8, RC7, R4C) -> Base Shampoo | I19: =INDEX(ItemMaster!R1C1:R31C8, RC7, R4C) -> AC01 | J19: =INDEX(ItemMaster!R1C1:R31C8, RC7, R4C) -> #ERR: ArgCount | K19: =INDEX(ItemMaster!R1C1:R31C8, RC7, R4C) -> 34276 | L19: =IF(EQUAL(RC[-7], R[-1]C[-7]), R[-1]C, RC[-1])-RC[-8] -> -208925.6 | M19: =IF(RC[-1]>0, 0, MIN(RC[-9], RC[-1]*-1)) -> 30456
A20: 'BT100 | B20: 36608 | C20: 'AB100/1 | D20: 77232 | E20: =IF(R7C4, IF(ISERROR(R7C1), R[-1]C, R7C1), "") -> BS01 | F20: =IF(R7C4, IF(ISERROR(R7C2), R[-1]C, R7C2), "") -> 36599 | G20: =MATCH(RC[-2], ItemMaster!R1C1:R31C1, 0) -> 13 | H20: =INDEX(ItemMaster!R1C1:R31C8, RC7, R4C) -> Base Shampoo | I20: =INDEX(ItemMaster!R1C1:R31C8, RC7, R4C) -> AC01 | J20: =INDEX(ItemMaster!R1C1:R31C8, RC7, R4C) -> #ERR: ArgCount | K20: =INDEX(ItemMaster!R1C1:R31C8, RC7, R4C) -> 34276 | L20: =IF(EQUAL(RC[-7], R[-1]C[-7]), R[-1]C, RC[-1])-RC[-8] -> -286157.6 | M20: =IF(RC[-1]>0, 0, MIN(RC[-9], RC[-1]*-1)) -> 77232
B21: 36612 | C21: 'FL100/1 | D21: 14592 | E21: =IF(R7C4, IF(ISERROR(R7C1), R[-1]C, R7C1), "") -> BS01 | F21: =IF(R7C4, IF(ISERROR(R7C2), R[-1]C, R7C2), "") -> 36599 | G21: =MATCH(RC[-2], ItemMaster!R1C1:R31C1, 0) -> 13 | H21: =INDEX(ItemMaster!R1C1:R31C8, RC7, R4C) -> Base Shampoo | I21: =INDEX(ItemMaster!R1C1:R31C8, RC7, R4C) -> AC01 | J21: =INDEX(ItemMaster!R1C1:R31C8, RC7, R4C) -> #ERR: ArgCount | K21: =INDEX(ItemMaster!R1C1:R31C8, RC7, R4C) -> 34276 | L21: =IF(EQUAL(RC[-7], R[-1]C[-7]), R[-1]C, RC[-1])-RC[-8] -> -300749.6 | M21: =IF(RC[-1]>0, 0, MIN(RC[-9], RC[-1]*-1)) -> 14592
B22: 36620 | C22: 'AB100/2 | D22: 77232 | E22: =IF(R7C4, IF(ISERROR(R7C1), R[-1]C, R7C1), "") -> BS01 | F22: =IF(R7C4, IF(ISERROR(R7C2), R[-1]C, R7C2), "") -> 36599 | G22: =MATCH(RC[-2], ItemMaster!R1C1:R31C1, 0) -> 13 | H22: =INDEX(ItemMaster!R1C1:R31C8, RC7, R4C) -> Base Shampoo | I22: =INDEX(ItemMaster!R1C1:R31C8, RC7, R4C) -> AC01 | J22: =INDEX(ItemMaster!R1C1:R31C8, RC7, R4C) -> #ERR: ArgCount | K22: =INDEX(ItemMaster!R1C1:R31C8, RC7, R4C) -> 34276 | L22: =IF(EQUAL(RC[-7], R[-1]C[-7]), R[-1]C, RC[-1])-RC[-8] -> -377981.6 | M22: =IF(RC[-1]>0, 0, MIN(RC[-9], RC[-1]*-1)) -> 77232
A23: 'BT250 | B23: 36602 | C23: 'FL250/1 | D23: 94080 | E23: =IF(R7C4, IF(ISERROR(R7C1), R[-1]C, R7C1), "") -> BS01 | F23: =IF(R7C4, IF(ISERROR(R7C2), R[-1]C, R7C2), "") -> 36599 | G23: =MATCH(RC[-2], ItemMaster!R1C1:R31C1, 0) -> 13 | H23: =INDEX(ItemMaster!R1C1:R31C8, RC7, R4C) -> Base Shampoo | I23: =INDEX(ItemMaster!R1C1:R31C8, RC7, R4C) -> AC01 | J23: =INDEX(ItemMaster!R1C1:R31C8, RC7, R4C) -> #ERR: ArgCount | K23: =INDEX(ItemMaster!R1C1:R31C8, RC7, R4C) -> 34276 | L23: =IF(EQUAL(RC[-7], R[-1]C[-7]), R[-1]C, RC[-1])-RC[-8] -> -472061.6 | M23: =IF(RC[-1]>0, 0, MIN(RC[-9], RC[-1]*-1)) -> 94080
B24: 36603 | C24: 'AB250/1 | D24: 114384 | E24: =IF(R7C4, IF(ISERROR(R7C1), R[-1]C, R7C1), "") -> BS01 | F24: =IF(R7C4, IF(ISERROR(R7C2), R[-1]C, R7C2), "") -> 36599 | G24: =MATCH(RC[-2], ItemMaster!R1C1:R31C1, 0) -> 13 | H24: =INDEX(ItemMaster!R1C1:R31C8, RC7, R4C) -> Base Shampoo | I24: =INDEX(ItemMaster!R1C1:R31C8, RC7, R4C) -> AC01 | J24: =INDEX(ItemMaster!R1C1:R31C8, RC7, R4C) -> #ERR: ArgCount | K24: =INDEX(ItemMaster!R1C1:R31C8, RC7, R4C) -> 34276 | L24: =IF(EQUAL(RC[-7], R[-1]C[-7]), R[-1]C, RC[-1])-RC[-8] -> -586445.6 | M24: =IF(RC[-1]>0, 0, MIN(RC[-9], RC[-1]*-1)) -> 114384
B25: 36613 | C25: 'FL250/2 | D25: 94080 | E25: =IF(R7C4, IF(ISERROR(R7C1), R[-1]C, R7C1), "") -> BS01 | F25: =IF(R7C4, IF(ISERROR(R7C2), R[-1]C, R7C2), "") -> 36599 | G25: =MATCH(RC[-2], ItemMaster!R1C1:R31C1, 0) -> 13 | H25: =INDEX(ItemMaster!R1C1:R31C8, RC7, R4C) -> Base Shampoo | I25: =INDEX(ItemMaster!R1C1:R31C8, RC7, R4C) -> AC01 | J25: =INDEX(ItemMaster!R1C1:R31C8, RC7, R4C) -> #ERR: ArgCount | K25: =INDEX(ItemMaster!R1C1:R31C8, RC7, R4C) -> 34276 | L25: =IF(EQUAL(RC[-7], R[-1]C[-7]), R[-1]C, RC[-1])-RC[-8] -> -680525.6 | M25: =IF(RC[-1]>0, 0, MIN(RC[-9], RC[-1]*-1)) -> 94080
B26: 36615 | C26: 'AB250/2 | D26: 111408 | E26: =IF(R7C4, IF(ISERROR(R7C1), R[-1]C, R7C1), "") -> BS01 | F26: =IF(R7C4, IF(ISERROR(R7C2), R[-1]C, R7C2), "") -> 36599 | G26: =MATCH(RC[-2], ItemMaster!R1C1:R31C1, 0) -> 13 | H26: =INDEX(ItemMaster!R1C1:R31C8, RC7, R4C) -> Base Shampoo | I26: =INDEX(ItemMaster!R1C1:R31C8, RC7, R4C) -> AC01 | J26: =INDEX(ItemMaster!R1C1:R31C8, RC7, R4C) -> #ERR: ArgCount | K26: =INDEX(ItemMaster!R1C1:R31C8, RC7, R4C) -> 34276 | L26: =IF(EQUAL(RC[-7], R[-1]C[-7]), R[-1]C, RC[-1])-RC[-8] -> -791933.6 | M26: =IF(RC[-1]>0, 0, MIN(RC[-9], RC[-1]*-1)) -> 111408
A27: 'BT500 | B27: 36599 | C27: 'AB500/1 | D27: 2640 | E27: =IF(R7C4, IF(ISERROR(R7C1), R[-1]C, R7C1), "") -> BS01 | F27: =IF(R7C4, IF(ISERROR(R7C2), R[-1]C, R7C2), "") -> 36599 | G27: =MATCH(RC[-2], ItemMaster!R1C1:R31C1, 0) -> 13 | H27: =INDEX(ItemMaster!R1C1:R31C8, RC7, R4C) -> Base Shampoo | I27: =INDEX(ItemMaster!R1C1:R31C8, RC7, R4C) -> AC01 | J27: =INDEX(ItemMaster!R1C1:R31C8, RC7, R4C) -> #ERR: ArgCount | K27: =INDEX(ItemMaster!R1C1:R31C8, RC7, R4C) -> 34276 | L27: =IF(EQUAL(RC[-7], R[-1]C[-7]), R[-1]C, RC[-1])-RC[-8] -> -794573.6 | M27: =IF(RC[-1]>0, 0, MIN(RC[-9], RC[-1]*-1)) -> 2640
C28: 'FL500/1 | D28: 61920 | E28: =IF(R7C4, IF(ISERROR(R7C1), R[-1]C, R7C1), "") -> BS01 | F28: =IF(R7C4, IF(ISERROR(R7C2), R[-1]C, R7C2), "") -> 36599 | G28: =MATCH(RC[-2], ItemMaster!R1C1:R31C1, 0) -> 13 | H28: =INDEX(ItemMaster!R1C1:R31C8, RC7, R4C) -> Base Shampoo | I28: =INDEX(ItemMaster!R1C1:R31C8, RC7, R4C) -> AC01 | J28: =INDEX(ItemMaster!R1C1:R31C8, RC7, R4C) -> #ERR: ArgCount | K28: =INDEX(ItemMaster!R1C1:R31C8, RC7, R4C) -> 34276 | L28: =IF(EQUAL(RC[-7], R[-1]C[-7]), R[-1]C, RC[-1])-RC[-8] -> -856493.6 | M28: =IF(RC[-1]>0, 0, MIN(RC[-9], RC[-1]*-1)) -> 61920
B29: 36600 | C29: 'AB500/2 | D29: 29616 | E29: =IF(R7C4, IF(ISERROR(R7C1), R[-1]C, R7C1), "") -> BS01 | F29: =IF(R7C4, IF(ISERROR(R7C2), R[-1]C, R7C2), "") -> 36599 | G29: =MATCH(RC[-2], ItemMaster!R1C1:R31C1, 0) -> 13 | H29: =INDEX(ItemMaster!R1C1:R31C8, RC7, R4C) -> Base Shampoo | I29: =INDEX(ItemMaster!R1C1:R31C8, RC7, R4C) -> AC01 | J29: =INDEX(ItemMaster!R1C1:R31C8, RC7, R4C) -> #ERR: ArgCount | K29: =INDEX(ItemMaster!R1C1:R31C8, RC7, R4C) -> 34276 | L29: =IF(EQUAL(RC[-7], R[-1]C[-7]), R[-1]C, RC[-1])-RC[-8] -> -886109.6 | M29: =IF(RC[-1]>0, 0, MIN(RC[-9], RC[-1]*-1)) -> 29616
B30: 36610 | C30: 'FL500/2 | D30: 60912 | E30: =IF(R7C4, IF(ISERROR(R7C1), R[-1]C, R7C1), "") -> BS01 | F30: =IF(R7C4, IF(ISERROR(R7C2), R[-1]C, R7C2), "") -> 36599 | G30: =MATCH(RC[-2], ItemMaster!R1C1:R31C1, 0) -> 13 | H30: =INDEX(ItemMaster!R1C1:R31C8, RC7, R4C) -> Base Shampoo | I30: =INDEX(ItemMaster!R1C1:R31C8, RC7, R4C) -> AC01 | J30: =INDEX(ItemMaster!R1C1:R31C8, RC7, R4C) -> #ERR: ArgCount | K30: =INDEX(ItemMaster!R1C1:R31C8, RC7, R4C) -> 34276 | L30: =IF(EQUAL(RC[-7], R[-1]C[-7]), R[-1]C, RC[-1])-RC[-8] -> -947021.6 | M30: =IF(RC[-1]>0, 0, MIN(RC[-9], RC[-1]*-1)) -> 60912
B31: 36611 | C31: 'AB500/3 | D31: 29616 | E31: =IF(R7C4, IF(ISERROR(R7C1), R[-1]C, R7C1), "") -> BS01 | F31: =IF(R7C4, IF(ISERROR(R7C2), R[-1]C, R7C2), "") -> 36599 | G31: =MATCH(RC[-2], ItemMaster!R1C1:R31C1, 0) -> 13 | H31: =INDEX(ItemMaster!R1C1:R31C8, RC7, R4C) -> Base Shampoo | I31: =INDEX(ItemMaster!R1C1:R31C8, RC7, R4C) -> AC01 | J31: =INDEX(ItemMaster!R1C1:R31C8, RC7, R4C) -> #ERR: ArgCount | K31: =INDEX(ItemMaster!R1C1:R31C8, RC7, R4C) -> 34276 | L31: =IF(EQUAL(RC[-7], R[-1]C[-7]), R[-1]C, RC[-1])-RC[-8] -> -976637.6 | M31: =IF(RC[-1]>0, 0, MIN(RC[-9], RC[-1]*-1)) -> 29616
B32: 36621 | C32: 'FL500/3 | D32: 60912 | E32: =IF(R7C4, IF(ISERROR(R7C1), R[-1]C, R7C1), "") -> BS01 | F32: =IF(R7C4, IF(ISERROR(R7C2), R[-1]C, R7C2), "") -> 36599 | G32: =MATCH(RC[-2], ItemMaster!R1C1:R31C1, 0) -> 13 | H32: =INDEX(ItemMaster!R1C1:R31C8, RC7, R4C) -> Base Shampoo | I32: =INDEX(ItemMaster!R1C1:R31C8, RC7, R4C) -> AC01 | J32: =INDEX(ItemMaster!R1C1:R31C8, RC7, R4C) -> #ERR: ArgCount | K32: =INDEX(ItemMaster!R1C1:R31C8, RC7, R4C) -> 34276 | L32: =IF(EQUAL(RC[-7], R[-1]C[-7]), R[-1]C, RC[-1])-RC[-8] -> -1037549.6 | M32: =IF(RC[-1]>0, 0, MIN(RC[-9], RC[-1]*-1)) -> 60912
A33: 'CAPF | B33: 36602 | C33: 'FL250/1 | D33: 94080 | E33: =IF(R7C4, IF(ISERROR(R7C1), R[-1]C, R7C1), "") -> BS01 | F33: =IF(R7C4, IF(ISERROR(R7C2), R[-1]C, R7C2), "") -> 36599 | G33: =MATCH(RC[-2], ItemMaster!R1C1:R31C1, 0) -> 13 | H33: =INDEX(ItemMaster!R1C1:R31C8, RC7, R4C) -> Base Shampoo | I33: =INDEX(ItemMaster!R1C1:R31C8, RC7, R4C) -> AC01 | J33: =INDEX(ItemMaster!R1C1:R31C8, RC7, R4C) -> #ERR: ArgCount | K33: =INDEX(ItemMaster!R1C1:R31C8, RC7, R4C) -> 34276 | L33: =IF(EQUAL(RC[-7], R[-1]C[-7]), R[-1]C, RC[-1])-RC[-8] -> -1131629.6 | M33: =IF(RC[-1]>0, 0, MIN(RC[-9], RC[-1]*-1)) -> 94080
B34: 36603 | C34: 'AB250/1 | D34: 114384 | E34: =IF(R7C4, IF(ISERROR(R7C1), R[-1]C, R7C1), "") -> BS01 | F34: =IF(R7C4, IF(ISERROR(R7C2), R[-1]C, R7C2), "") -> 36599 | G34: =MATCH(RC[-2], ItemMaster!R1C1:R31C1, 0) -> 13 | H34: =INDEX(ItemMaster!R1C1:R31C8, RC7, R4C) -> Base Shampoo | I34: =INDEX(ItemMaster!R1C1:R31C8, RC7, R4C) -> AC01 | J34: =INDEX(ItemMaster!R1C1:R31C8, RC7, R4C) -> #ERR: ArgCount | K34: =INDEX(ItemMaster!R1C1:R31C8, RC7, R4C) -> 34276 | L34: =IF(EQUAL(RC[-7], R[-1]C[-7]), R[-1]C, RC[-1])-RC[-8] -> -1246013.6 | M34: =IF(RC[-1]>0, 0, MIN(RC[-9], RC[-1]*-1)) -> 114384
B35: 36608 | C35: 'AB100/1 | D35: 77232 | E35: =IF(R7C4, IF(ISERROR(R7C1), R[-1]C, R7C1), "") -> BS01 | F35: =IF(R7C4, IF(ISERROR(R7C2), R[-1]C, R7C2), "") -> 36599 | G35: =MATCH(RC[-2], ItemMaster!R1C1:R31C1, 0) -> 13 | H35: =INDEX(ItemMaster!R1C1:R31C8, RC7, R4C) -> Base Shampoo | I35: =INDEX(ItemMaster!R1C1:R31C8, RC7, R4C) -> AC01 | J35: =INDEX(ItemMaster!R1C1:R31C8, RC7, R4C) -> #ERR: ArgCount | K35: =INDEX(ItemMaster!R1C1:R31C8, RC7, R4C) -> 34276 | L35: =IF(EQUAL(RC[-7], R[-1]C[-7]), R[-1]C, RC[-1])-RC[-8] -> -1323245.6 | M35: =IF(RC[-1]>0, 0, MIN(RC[-9], RC[-1]*-1)) -> 77232
B36: 36612 | C36: 'FL100/1 | D36: 14592 | E36: =IF(R7C4, IF(ISERROR(R7C1), R[-1]C, R7C1), "") -> BS01 | F36: =IF(R7C4, IF(ISERROR(R7C2), R[-1]C, R7C2), "") -> 36599 | G36: =MATCH(RC[-2], ItemMaster!R1C1:R31C1, 0) -> 13 | H36: =INDEX(ItemMaster!R1C1:R31C8, RC7, R4C) -> Base Shampoo | I36: =INDEX(ItemMaster!R1C1:R31C8, RC7, R4C) -> AC01 | J36: =INDEX(ItemMaster!R1C1:R31C8, RC7, R4C) -> #ERR: ArgCount | K36: =INDEX(ItemMaster!R1C1:R31C8, RC7, R4C) -> 34276 | L36: =IF(EQUAL(RC[-7], R[-1]C[-7]), R[-1]C, RC[-1])-RC[-8] -> -1337837.6 | M36: =IF(RC[-1]>0, 0, MIN(RC[-9], RC[-1]*-1)) -> 14592
B37: 36613 | C37: 'FL250/2 | D37: 94080 | E37: =IF(R7C4, IF(ISERROR(R7C1), R[-1]C, R7C1), "") -> BS01 | F37: =IF(R7C4, IF(ISERROR(R7C2), R[-1]C, R7C2), "") -> 36599 | G37: =MATCH(RC[-2], ItemMaster!R1C1:R31C1, 0) -> 13 | H37: =INDEX(ItemMaster!R1C1:R31C8, RC7, R4C) -> Base Shampoo | I37: =INDEX(ItemMaster!R1C1:R31C8, RC7, R4C) -> AC01 | J37: =INDEX(ItemMaster!R1C1:R31C8, RC7, R4C) -> #ERR: ArgCount | K37: =INDEX(ItemMaster!R1C1:R31C8, RC7, R4C) -> 34276 | L37: =IF(EQUAL(RC[-7], R[-1]C[-7]), R[-1]C, RC[-1])-RC[-8] -> -1431917.6 | M37: =IF(RC[-1]>0, 0, MIN(RC[-9], RC[-1]*-1)) -> 94080
B38: 36615 | C38: 'AB250/2 | D38: 111408 | E38: =IF(R7C4, IF(ISERROR(R7C1), R[-1]C, R7C1), "") -> BS01 | F38: =IF(R7C4, IF(ISERROR(R7C2), R[-1]C, R7C2), "") -> 36599 | G38: =MATCH(RC[-2], ItemMaster!R1C1:R31C1, 0) -> 13 | H38: =INDEX(ItemMaster!R1C1:R31C8, RC7, R4C) -> Base Shampoo | I38: =INDEX(ItemMaster!R1C1:R31C8, RC7, R4C) -> AC01 | J38: =INDEX(ItemMaster!R1C1:R31C8, RC7, R4C) -> #ERR: ArgCount | K38: =INDEX(ItemMaster!R1C1:R31C8, RC7, R4C) -> 34276 | L38: =IF(EQUAL(RC[-7], R[-1]C[-7]), R[-1]C, RC[-1])-RC[-8] -> -1543325.6 | M38: =IF(RC[-1]>0, 0, MIN(RC[-9], RC[-1]*-1)) -> 111408
B39: 36620 | C39: 'AB100/2 | D39: 77232 | E39: =IF(R7C4, IF(ISERROR(R7C1), R[-1]C, R7C1), "") -> BS01 | F39: =IF(R7C4, IF(ISERROR(R7C2), R[-1]C, R7C2), "") -> 36599 | G39: =MATCH(RC[-2], ItemMaster!R1C1:R31C1, 0) -> 13 | H39: =INDEX(ItemMaster!R1C1:R31C8, RC7, R4C) -> Base Shampoo | I39: =INDEX(ItemMaster!R1C1:R31C8, RC7, R4C) -> AC01 | J39: =INDEX(ItemMaster!R1C1:R31C8, RC7, R4C) -> #ERR: ArgCount | K39: =INDEX(ItemMaster!R1C1:R31C8, RC7, R4C) -> 34276 | L39: =IF(EQUAL(RC[-7], R[-1]C[-7]), R[-1]C, RC[-1])-RC[-8] -> -1620557.6 | M39: =IF(RC[-1]>0, 0, MIN(RC[-9], RC[-1]*-1)) -> 77232
A40: 'CAPS | B40: 36599 | C40: 'AB500/1 | D40: 2640 | E40: =IF(R7C4, IF(ISERROR(R7C1), R[-1]C, R7C1), "") -> BS01 | F40: =IF(R7C4, IF(ISERROR(R7C2), R[-1]C, R7C2), "") -> 36599 | G40: =MATCH(RC[-2], ItemMaster!R1C1:R31C1, 0) -> 13 | H40: =INDEX(ItemMaster!R1C1:R31C8, RC7, R4C) -> Base Shampoo | I40: =INDEX(ItemMaster!R1C1:R31C8, RC7, R4C) -> AC01 | J40: =INDEX(ItemMaster!R1C1:R31C8, RC7, R4C) -> #ERR: ArgCount | K40: =INDEX(ItemMaster!R1C1:R31C8, RC7, R4C) -> 34276 | L40: =IF(EQUAL(RC[-7], R[-1]C[-7]), R[-1]C, RC[-1])-RC[-8] -> -1623197.6 | M40: =IF(RC[-1]>0, 0, MIN(RC[-9], RC[-1]*-1)) -> 2640
C41: 'FL500/1 | D41: 61920 | E41: =IF(R7C4, IF(ISERROR(R7C1), R[-1]C, R7C1), "") -> BS01 | F41: =IF(R7C4, IF(ISERROR(R7C2), R[-1]C, R7C2), "") -> 36599 | G41: =MATCH(RC[-2], ItemMaster!R1C1:R31C1, 0) -> 13 | H41: =INDEX(ItemMaster!R1C1:R31C8, RC7, R4C) -> Base Shampoo | I41: =INDEX(ItemMaster!R1C1:R31C8, RC7, R4C) -> AC01 | J41: =INDEX(ItemMaster!R1C1:R31C8, RC7, R4C) -> #ERR: ArgCount | K41: =INDEX(ItemMaster!R1C1:R31C8, RC7, R4C) -> 34276 | L41: =IF(EQUAL(RC[-7], R[-1]C[-7]), R[-1]C, RC[-1])-RC[-8] -> -1685117.6 | M41: =IF(RC[-1]>0, 0, MIN(RC[-9], RC[-1]*-1)) -> 61920
B42: 36600 | C42: 'AB500/2 | D42: 29616 | E42: =IF(R7C4, IF(ISERROR(R7C1), R[-1]C, R7C1), "") -> BS01 | F42: =IF(R7C4, IF(ISERROR(R7C2), R[-1]C, R7C2), "") -> 36599 | G42: =MATCH(RC[-2], ItemMaster!R1C1:R31C1, 0) -> 13 | H42: =INDEX(ItemMaster!R1C1:R31C8, RC7, R4C) -> Base Shampoo | I42: =INDEX(ItemMaster!R1C1:R31C8, RC7, R4C) -> AC01 | J42: =INDEX(ItemMaster!R1C1:R31C8, RC7, R4C) -> #ERR: ArgCount | K42: =INDEX(ItemMaster!R1C1:R31C8, RC7, R4C) -> 34276 | L42: =IF(EQUAL(RC[-7], R[-1]C[-7]), R[-1]C, RC[-1])-RC[-8] -> -1714733.6 | M42: =IF(RC[-1]>0, 0, MIN(RC[-9], RC[-1]*-1)) -> 29616
B43: 36610 | C43: 'FL500/2 | D43: 60912 | E43: =IF(R7C4, IF(ISERROR(R7C1), R[-1]C, R7C1), "") -> BS01 | F43: =IF(R7C4, IF(ISERROR(R7C2), R[-1]C, R7C2), "") -> 36599 | G43: =MATCH(RC[-2], ItemMaster!R1C1:R31C1, 0) -> 13 | H43: =INDEX(ItemMaster!R1C1:R31C8, RC7, R4C) -> Base Shampoo | I43: =INDEX(ItemMaster!R1C1:R31C8, RC7, R4C) -> AC01 | J43: =INDEX(ItemMaster!R1C1:R31C8, RC7, R4C) -> #ERR: ArgCount | K43: =INDEX(ItemMaster!R1C1:R31C8, RC7, R4C) -> 34276 | L43: =IF(EQUAL(RC[-7], R[-1]C[-7]), R[-1]C, RC[-1])-RC[-8] -> -1775645.6 | M43: =IF(RC[-1]>0, 0, MIN(RC[-9], RC[-1]*-1)) -> 60912
B44: 36611 | C44: 'AB500/3 | D44: 29616 | E44: =IF(R7C4, IF(ISERROR(R7C1), R[-1]C, R7C1), "") -> BS01 | F44: =IF(R7C4, IF(ISERROR(R7C2), R[-1]C, R7C2), "") -> 36599 | G44: =MATCH(RC[-2], ItemMaster!R1C1:R31C1, 0) -> 13 | H44: =INDEX(ItemMaster!R1C1:R31C8, RC7, R4C) -> Base Shampoo | I44: =INDEX(ItemMaster!R1C1:R31C8, RC7, R4C) -> AC01 | J44: =INDEX(ItemMaster!R1C1:R31C8, RC7, R4C) -> #ERR: ArgCount | K44: =INDEX(ItemMaster!R1C1:R31C8, RC7, R4C) -> 34276 | L44: =IF(EQUAL(RC[-7], R[-1]C[-7]), R[-1]C, RC[-1])-RC[-8] -> -1805261.6 | M44: =IF(RC[-1]>0, 0, MIN(RC[-9], RC[-1]*-1)) -> 29616
B45: 36621 | C45: 'FL500/3 | D45: 60912 | E45: =IF(R7C4, IF(ISERROR(R7C1), R[-1]C, R7C1), "") -> BS01 | F45: =IF(R7C4, IF(ISERROR(R7C2), R[-1]C, R7C2), "") -> 36599 | G45: =MATCH(RC[-2], ItemMaster!R1C1:R31C1, 0) -> 13 | H45: =INDEX(ItemMaster!R1C1:R31C8, RC7, R4C) -> Base Shampoo | I45: =INDEX(ItemMaster!R1C1:R31C8, RC7, R4C) -> AC01 | J45: =INDEX(ItemMaster!R1C1:R31C8, RC7, R4C) -> #ERR: ArgCount | K45: =INDEX(ItemMaster!R1C1:R31C8, RC7, R4C) -> 34276 | L45: =IF(EQUAL(RC[-7], R[-1]C[-7]), R[-1]C, RC[-1])-RC[-8] -> -1866173.6 | M45: =IF(RC[-1]>0, 0, MIN(RC[-9], RC[-1]*-1)) -> 60912
A46: 'CARL | B46: 36599 | C46: 'AB500/1 | D46: 110 | E46: =IF(R7C4, IF(ISERROR(R7C1), R[-1]C, R7C1), "") -> BS01 | F46: =IF(R7C4, IF(ISERROR(R7C2), R[-1]C, R7C2), "") -> 36599 | G46: =MATCH(RC[-2], ItemMaster!R1C1:R31C1, 0) -> 13 | H46: =INDEX(ItemMaster!R1C1:R31C8, RC7, R4C) -> Base Shampoo | I46: =INDEX(ItemMaster!R1C1:R31C8, RC7, R4C) -> AC01 | J46: =INDEX(ItemMaster!R1C1:R31C8, RC7, R4C) -> #ERR: ArgCount | K46: =INDEX(ItemMaster!R1C1:R31C8, RC7, R4C) -> 34276 | L46: =IF(EQUAL(RC[-7], R[-1]C[-7]), R[-1]C, RC[-1])-RC[-8] -> -1866283.6 | M46: =IF(RC[-1]>0, 0, MIN(RC[-9], RC[-1]*-1)) -> 110
C47: 'FL500/1 | D47: 2580 | E47: =IF(R7C4, IF(ISERROR(R7C1), R[-1]C, R7C1), "") -> BS01 | F47: =IF(R7C4, IF(ISERROR(R7C2), R[-1]C, R7C2), "") -> 36599 | G47: =MATCH(RC[-2], ItemMaster!R1C1:R31C1, 0) -> 13 | H47: =INDEX(ItemMaster!R1C1:R31C8, RC7, R4C) -> Base Shampoo | I47: =INDEX(ItemMaster!R1C1:R31C8, RC7, R4C) -> AC01 | J47: =INDEX(ItemMaster!R1C1:R31C8, RC7, R4C) -> #ERR: ArgCount | K47: =INDEX(ItemMaster!R1C1:R31C8, RC7, R4C) -> 34276 | L47: =IF(EQUAL(RC[-7], R[-1]C[-7]), R[-1]C, RC[-1])-RC[-8] -> -1868863.6 | M47: =IF(RC[-1]>0, 0, MIN(RC[-9], RC[-1]*-1)) -> 2580
B48: 36600 | C48: 'AB500/2 | D48: 1234 | E48: =IF(R7C4, IF(ISERROR(R7C1), R[-1]C, R7C1), "") -> BS01 | F48: =IF(R7C4, IF(ISERROR(R7C2), R[-1]C, R7C2), "") -> 36599 | G48: =MATCH(RC[-2], ItemMaster!R1C1:R31C1, 0) -> 13 | H48: =INDEX(ItemMaster!R1C1:R31C8, RC7, R4C) -> Base Shampoo | I48: =INDEX(ItemMaster!R1C1:R31C8, RC7, R4C) -> AC01 | J48: =INDEX(ItemMaster!R1C1:R31C8, RC7, R4C) -> #ERR: ArgCount | K48: =INDEX(ItemMaster!R1C1:R31C8, RC7, R4C) -> 34276 | L48: =IF(EQUAL(RC[-7], R[-1]C[-7]), R[-1]C, RC[-1])-RC[-8] -> -1870097.6 | M48: =IF(RC[-1]>0, 0, MIN(RC[-9], RC[-1]*-1)) -> 1234
B49: 36602 | C49: 'FL250/1 | D49: 1960 | E49: =IF(R7C4, IF(ISERROR(R7C1), R[-1]C, R7C1), "") -> BS01 | F49: =IF(R7C4, IF(ISERROR(R7C2), R[-1]C, R7C2), "") -> 36599 | G49: =MATCH(RC[-2], ItemMaster!R1C1:R31C1, 0) -> 13 | H49: =INDEX(ItemMaster!R1C1:R31C8, RC7, R4C) -> Base Shampoo | I49: =INDEX(ItemMaster!R1C1:R31C8, RC7, R4C) -> AC01 | J49: =INDEX(ItemMaster!R1C1:R31C8, RC7, R4C) -> #ERR: ArgCount | K49: =INDEX(ItemMaster!R1C1:R31C8, RC7, R4C) -> 34276 | L49: =IF(EQUAL(RC[-7], R[-1]C[-7]), R[-1]C, RC[-1])-RC[-8] -> -1872057.6 | M49: =IF(RC[-1]>0, 0, MIN(RC[-9], RC[-1]*-1)) -> 1960
B50: 36603 | C50: 'AB250/1 | D50: 2383 | E50: =IF(R7C4, IF(ISERROR(R7C1), R[-1]C, R7C1), "") -> BS01 | F50: =IF(R7C4, IF(ISERROR(R7C2), R[-1]C, R7C2), "") -> 36599 | G50: =MATCH(RC[-2], ItemMaster!R1C1:R31C1, 0) -> 13 | H50: =INDEX(ItemMaster!R1C1:R31C8, RC7, R4C) -> Base Shampoo | I50: =INDEX(ItemMaster!R1C1:R31C8, RC7, R4C) -> AC01 | J50: =INDEX(ItemMaster!R1C1:R31C8, RC7, R4C) -> #ERR: ArgCount | K50: =INDEX(ItemMaster!R1C1:R31C8, RC7, R4C) -> 34276 | L50: =IF(EQUAL(RC[-7], R[-1]C[-7]), R[-1]C, RC[-1])-RC[-8] -> -1874440.6 | M50: =IF(RC[-1]>0, 0, MIN(RC[-9], RC[-1]*-1)) -> 2383
B51: 36610 | C51: 'FL500/2 | D51: 2538 | E51: =IF(R7C4, IF(ISERROR(R7C1), R[-1]C, R7C1), "") -> BS01 | F51: =IF(R7C4, IF(ISERROR(R7C2), R[-1]C, R7C2), "") -> 36599 | G51: =MATCH(RC[-2], ItemMaster!R1C1:R31C1, 0) -> 13 | H51: =INDEX(ItemMaster!R1C1:R31C8, RC7, R4C) -> Base Shampoo | I51: =INDEX(ItemMaster!R1C1:R31C8, RC7, R4C) -> AC01 | J51: =INDEX(ItemMaster!R1C1:R31C8, RC7, R4C) -> #ERR: ArgCount | K51: =INDEX(ItemMaster!R1C1:R31C8, RC7, R4C) -> 34276 | L51: =IF(EQUAL(RC[-7], R[-1]C[-7]), R[-1]C, RC[-1])-RC[-8] -> -1876978.6 | M51: =IF(RC[-1]>0, 0, MIN(RC[-9], RC[-1]*-1)) -> 2538
B52: 36611 | C52: 'AB500/3 | D52: 1234 | E52: =IF(R7C4, IF(ISERROR(R7C1), R[-1]C, R7C1), "") -> BS01 | F52: =IF(R7C4, IF(ISERROR(R7C2), R[-1]C, R7C2), "") -> 36599 | G52: =MATCH(RC[-2], ItemMaster!R1C1:R31C1, 0) -> 13 | H52: =INDEX(ItemMaster!R1C1:R31C8, RC7, R4C) -> Base Shampoo | I52: =INDEX(ItemMaster!R1C1:R31C8, RC7, R4C) -> AC01 | J52: =INDEX(ItemMaster!R1C1:R31C8, RC7, R4C) -> #ERR: ArgCount | K52: =INDEX(ItemMaster!R1C1:R31C8, RC7, R4C) -> 34276 | L52: =IF(EQUAL(RC[-7], R[-1]C[-7]), R[-1]C, RC[-1])-RC[-8] -> -1878212.6 | M52: =IF(RC[-1]>0, 0, MIN(RC[-9], RC[-1]*-1)) -> 1234
B53: 36613 | C53: 'FL250/2 | D53: 1960 | E53: =IF(R7C4, IF(ISERROR(R7C1), R[-1]C, R7C1), "") -> BS01 | F53: =IF(R7C4, IF(ISERROR(R7C2), R[-1]C, R7C2), "") -> 36599 | G53: =MATCH(RC[-2], ItemMaster!R1C1:R31C1, 0) -> 13 | H53: =INDEX(ItemMaster!R1C1:R31C8, RC7, R4C) -> Base Shampoo | I53: =INDEX(ItemMaster!R1C1:R31C8, RC7, R4C) -> AC01 | J53: =INDEX(ItemMaster!R1C1:R31C8, RC7, R4C) -> #ERR: ArgCount | K53: =INDEX(ItemMaster!R1C1:R31C8, RC7, R4C) -> 34276 | L53: =IF(EQUAL(RC[-7], R[-1]C[-7]), R[-1]C, RC[-1])-RC[-8] -> -1880172.6 | M53: =IF(RC[-1]>0, 0, MIN(RC[-9], RC[-1]*-1)) -> 1960
B54: 36615 | C54: 'AB250/2 | D54: 2321 | E54: =IF(R7C4, IF(ISERROR(R7C1), R[-1]C, R7C1), "") -> BS01 | F54: =IF(R7C4, IF(ISERROR(R7C2), R[-1]C, R7C2), "") -> 36599 | G54: =MATCH(RC[-2], ItemMaster!R1C1:R31C1, 0) -> 13 | H54: =INDEX(ItemMaster!R1C1:R31C8, RC7, R4C) -> Base Shampoo | I54: =INDEX(ItemMaster!R1C1:R31C8, RC7, R4C) -> AC01 | J54: =INDEX(ItemMaster!R1C1:R31C8, RC7, R4C) -> #ERR: ArgCount | K54: =INDEX(ItemMaster!R1C1:R31C8, RC7, R4C) -> 34276 | L54: =IF(EQUAL(RC[-7], R[-1]C[-7]), R[-1]C, RC[-1])-RC[-8] -> -1882493.6 | M54: =IF(RC[-1]>0, 0, MIN(RC[-9], RC[-1]*-1)) -> 2321
B55: 36621 | C55: 'FL500/3 | D55: 2538 | E55: =IF(R7C4, IF(ISERROR(R7C1), R[-1]C, R7C1), "") -> BS01 | F55: =IF(R7C4, IF(ISERROR(R7C2), R[-1]C, R7C2), "") -> 36599 | G55: =MATCH(RC[-2], ItemMaster!R1C1:R31C1, 0) -> 13 | H55: =INDEX(ItemMaster!R1C1:R31C8, RC7, R4C) -> Base Shampoo | I55: =INDEX(ItemMaster!R1C1:R31C8, RC7, R4C) -> AC01 | J55: =INDEX(ItemMaster!R1C1:R31C8, RC7, R4C) -> #ERR: ArgCount | K55: =INDEX(ItemMaster!R1C1:R31C8, RC7, R4C) -> 34276 | L55: =IF(EQUAL(RC[-7], R[-1]C[-7]), R[-1]C, RC[-1])-RC[-8] -> -1885031.6 | M55: =IF(RC[-1]>0, 0, MIN(RC[-9], RC[-1]*-1)) -> 2538
A56: 'CARS | B56: 36608 | C56: 'AB100/1 | D56: 1609 | E56: =IF(R7C4, IF(ISERROR(R7C1), R[-1]C, R7C1), "") -> BS01 | F56: =IF(R7C4, IF(ISERROR(R7C2), R[-1]C, R7C2), "") -> 36599 | G56: =MATCH(RC[-2], ItemMaster!R1C1:R31C1, 0) -> 13 | H56: =INDEX(ItemMaster!R1C1:R31C8, RC7, R4C) -> Base Shampoo | I56: =INDEX(ItemMaster!R1C1:R31C8, RC7, R4C) -> AC01 | J56: =INDEX(ItemMaster!R1C1:R31C8, RC7, R4C) -> #ERR: ArgCount | K56: =INDEX(ItemMaster!R1C1:R31C8, RC7, R4C) -> 34276 | L56: =IF(EQUAL(RC[-7], R[-1]C[-7]), R[-1]C, RC[-1])-RC[-8] -> -1886640.6 | M56: =IF(RC[-1]>0, 0, MIN(RC[-9], RC[-1]*-1)) -> 1609
B57: 36612 | C57: 'FL100/1 | D57: 304 | E57: =IF(R7C4, IF(ISERROR(R7C1), R[-1]C, R7C1), "") -> BS01 | F57: =IF(R7C4, IF(ISERROR(R7C2), R[-1]C, R7C2), "") -> 36599 | G57: =MATCH(RC[-2], ItemMaster!R1C1:R31C1, 0) -> 13 | H57: =INDEX(ItemMaster!R1C1:R31C8, RC7, R4C) -> Base Shampoo | I57: =INDEX(ItemMaster!R1C1:R31C8, RC7, R4C) -> AC01 | J57: =INDEX(ItemMaster!R1C1:R31C8, RC7, R4C) -> #ERR: ArgCount | K57: =INDEX(ItemMaster!R1C1:R31C8, RC7, R4C) -> 34276 | L57: =IF(EQUAL(RC[-7], R[-1]C[-7]), R[-1]C, RC[-1])-RC[-8] -> -1886944.6 | M57: =IF(RC[-1]>0, 0, MIN(RC[-9], RC[-1]*-1)) -> 304
B58: 36620 | C58: 'AB100/2 | D58: 1609 | E58: =IF(R7C4, IF(ISERROR(R7C1), R[-1]C, R7C1), "") -> BS01 | F58: =IF(R7C4, IF(ISERROR(R7C2), R[-1]C, R7C2), "") -> 36599 | G58: =MATCH(RC[-2], ItemMaster!R1C1:R31C1, 0) -> 13 | H58: =INDEX(ItemMaster!R1C1:R31C8, RC7, R4C) -> Base Shampoo | I58: =INDEX(ItemMaster!R1C1:R31C8, RC7, R4C) -> AC01 | J58: =INDEX(ItemMaster!R1C1:R31C8, RC7, R4C) -> #ERR: ArgCount | K58: =INDEX(ItemMaster!R1C1:R31C8, RC7, R4C) -> 34276 | L58: =IF(EQUAL(RC[-7], R[-1]C[-7]), R[-1]C, RC[-1])-RC[-8] -> -1888553.6 | M58: =IF(RC[-1]>0, 0, MIN(RC[-9], RC[-1]*-1)) -> 1609
A59: 'ESA | B59: 36599 | C59: 'AB500/1 | D59: 13.2 | E59: =IF(R7C4, IF(ISERROR(R7C1), R[-1]C, R7C1), "") -> BS01 | F59: =IF(R7C4, IF(ISERROR(R7C2), R[-1]C, R7C2), "") -> 36599 | G59: =MATCH(RC[-2], ItemMaster!R1C1:R31C1, 0) -> 13 | H59: =INDEX(ItemMaster!R1C1:R31C8, RC7, R4C) -> Base Shampoo | I59: =INDEX(ItemMaster!R1C1:R31C8, RC7, R4C) -> AC01 | J59: =INDEX(ItemMaster!R1C1:R31C8, RC7, R4C) -> #ERR: ArgCount | K59: =INDEX(ItemMaster!R1C1:R31C8, RC7, R4C) -> 34276 | L59: =IF(EQUAL(RC[-7], R[-1]C[-7]), R[-1]C, RC[-1])-RC[-8] -> -1888566.8 | M59: =IF(RC[-1]>0, 0, MIN(RC[-9], RC[-1]*-1)) -> 13.2
B60: 36600 | C60: 'AB500/2 | D60: 148.08 | E60: =IF(R7C4, IF(ISERROR(R7C1), R[-1]C, R7C1), "") -> BS01 | F60: =IF(R7C4, IF(ISERROR(R7C2), R[-1]C, R7C2), "") -> 36599 | G60: =MATCH(RC[-2], ItemMaster!R1C1:R31C1, 0) -> 13 | H60: =INDEX(ItemMaster!R1C1:R31C8, RC7, R4C) -> Base Shampoo | I60: =INDEX(ItemMaster!R1C1:R31C8, RC7, R4C) -> AC01 | J60: =INDEX(ItemMaster!R1C1:R31C8, RC7, R4C) -> #ERR: ArgCount | K60: =INDEX(ItemMaster!R1C1:R31C8, RC7, R4C) -> 34276 | L60: =IF(EQUAL(RC[-7], R[-1]C[-7]), R[-1]C, RC[-1])-RC[-8] -> -1888714.88 | M60: =IF(RC[-1]>0, 0, MIN(RC[-9], RC[-1]*-1)) -> 148.08
B61: 36603 | C61: 'AB250/1 | D61: 285.96 | E61: =IF(R7C4, IF(ISERROR(R7C1), R[-1]C, R7C1), "") -> BS01 | F61: =IF(R7C4, IF(ISERROR(R7C2), R[-1]C, R7C2), "") -> 36599 | G61: =MATCH(RC[-2], ItemMaster!R1C1:R31C1, 0) -> 13 | H61: =INDEX(ItemMaster!R1C1:R31C8, RC7, R4C) -> Base Shampoo | I61: =INDEX(ItemMaster!R1C1:R31C8, RC7, R4C) -> AC01 | J61: =INDEX(ItemMaster!R1C1:R31C8, RC7, R4C) -> #ERR: ArgCount | K61: =INDEX(ItemMaster!R1C1:R31C8, RC7, R4C) -> 34276 | L61: =IF(EQUAL(RC[-7], R[-1]C[-7]), R[-1]C, RC[-1])-RC[-8] -> -1889000.84 | M61: =IF(RC[-1]>0, 0, MIN(RC[-9], RC[-1]*-1)) -> 285.96
B62: 36608 | C62: 'AB100/1 | D62: 77.232 | E62: =IF(R7C4, IF(ISERROR(R7C1), R[-1]C, R7C1), "") -> BS01 | F62: =IF(R7C4, IF(ISERROR(R7C2), R[-1]C, R7C2), "") -> 36599 | G62: =MATCH(RC[-2], ItemMaster!R1C1:R31C1, 0) -> 13 | H62: =INDEX(ItemMaster!R1C1:R31C8, RC7, R4C) -> Base Shampoo | I62: =INDEX(ItemMaster!R1C1:R31C8, RC7, R4C) -> AC01 | J62: =INDEX(ItemMaster!R1C1:R31C8, RC7, R4C) -> #ERR: ArgCount | K62: =INDEX(ItemMaster!R1C1:R31C8, RC7, R4C) -> 34276 | L62: =IF(EQUAL(RC[-7], R[-1]C[-7]), R[-1]C, RC[-1])-RC[-8] -> -1889078.072 | M62: =IF(RC[-1]>0, 0, MIN(RC[-9], RC[-1]*-1)) -> 77.232
B63: 36611 | C63: 'AB500/3 | D63: 148.08 | E63: =IF(R7C4, IF(ISERROR(R7C1), R[-1]C, R7C1), "") -> BS01 | F63: =IF(R7C4, IF(ISERROR(R7C2), R[-1]C, R7C2), "") -> 36599 | G63: =MATCH(RC[-2], ItemMaster!R1C1:R31C1, 0) -> 13 | H63: =INDEX(ItemMaster!R1C1:R31C8, RC7, R4C) -> Base Shampoo | I63: =INDEX(ItemMaster!R1C1:R31C8, RC7, R4C) -> AC01 | J63: =INDEX(ItemMaster!R1C1:R31C8, RC7, R4C) -> #ERR: ArgCount | K63: =INDEX(ItemMaster!R1C1:R31C8, RC7, R4C) -> 34276 | L63: =IF(EQUAL(RC[-7], R[-1]C[-7]), R[-1]C, RC[-1])-RC[-8] -> -1889226.152 | M63: =IF(RC[-1]>0, 0, MIN(RC[-9], RC[-1]*-1)) -> 148.08
B64: 36615 | C64: 'AB250/2 | D64: 278.52 | E64: =IF(R7C4, IF(ISERROR(R7C1), R[-1]C, R7C1), "") -> BS01 | F64: =IF(R7C4, IF(ISERROR(R7C2), R[-1]C, R7C2), "") -> 36599 | G64: =MATCH(RC[-2], ItemMaster!R1C1:R31C1, 0) -> 13 | H64: =INDEX(ItemMaster!R1C1:R31C8, RC7, R4C) -> Base Shampoo | I64: =INDEX(ItemMaster!R1C1:R31C8, RC7, R4C) -> AC01 | J64: =INDEX(ItemMaster!R1C1:R31C8, RC7, R4C) -> #ERR: ArgCount | K64: =INDEX(ItemMaster!R1C1:R31C8, RC7, R4C) -> 34276 | L64: =IF(EQUAL(RC[-7], R[-1]C[-7]), R[-1]C, RC[-1])-RC[-8] -> -1889504.672 | M64: =IF(RC[-1]>0, 0, MIN(RC[-9], RC[-1]*-1)) -> 278.52
B65: 36620 | C65: 'AB100/2 | D65: 77.232 | E65: =IF(R7C4, IF(ISERROR(R7C1), R[-1]C, R7C1), "") -> BS01 | F65: =IF(R7C4, IF(ISERROR(R7C2), R[-1]C, R7C2), "") -> 36599 | G65: =MATCH(RC[-2], ItemMaster!R1C1:R31C1, 0) -> 13 | H65: =INDEX(ItemMaster!R1C1:R31C8, RC7, R4C) -> Base Shampoo | I65: =INDEX(ItemMaster!R1C1:R31C8, RC7, R4C) -> AC01 | J65: =INDEX(ItemMaster!R1C1:R31C8, RC7, R4C) -> #ERR: ArgCount | K65: =INDEX(ItemMaster!R1C1:R31C8, RC7, R4C) -> 34276 | L65: =IF(EQUAL(RC[-7], R[-1]C[-7]), R[-1]C, RC[-1])-RC[-8] -> -1889581.904 | M65: =IF(RC[-1]>0, 0, MIN(RC[-9], RC[-1]*-1)) -> 77.232
A66: 'ESL | B66: 36599 | C66: 'FL500/1 | D66: 309.6 | E66: =IF(R7C4, IF(ISERROR(R7C1), R[-1]C, R7C1), "") -> BS01 | F66: =IF(R7C4, IF(ISERROR(R7C2), R[-1]C, R7C2), "") -> 36599 | G66: =MATCH(RC[-2], ItemMaster!R1C1:R31C1, 0) -> 13 | H66: =INDEX(ItemMaster!R1C1:R31C8, RC7, R4C) -> Base Shampoo | I66: =INDEX(ItemMaster!R1C1:R31C8, RC7, R4C) -> AC01 | J66: =INDEX(ItemMaster!R1C1:R31C8, RC7, R4C) -> #ERR: ArgCount | K66: =INDEX(ItemMaster!R1C1:R31C8, RC7, R4C) -> 34276 | L66: =IF(EQUAL(RC[-7], R[-1]C[-7]), R[-1]C, RC[-1])-RC[-8] -> -1889891.504 | M66: =IF(RC[-1]>0, 0, MIN(RC[-9], RC[-1]*-1)) -> 309.6
B67: 36602 | C67: 'FL250/1 | D67: 235.2 | E67: =IF(R7C4, IF(ISERROR(R7C1), R[-1]C, R7C1), "") -> BS01 | F67: =IF(R7C4, IF(ISERROR(R7C2), R[-1]C, R7C2), "") -> 36599 | G67: =MATCH(RC[-2], ItemMaster!R1C1:R31C1, 0) -> 13 | H67: =INDEX(ItemMaster!R1C1:R31C8, RC7, R4C) -> Base Shampoo | I67: =INDEX(ItemMaster!R1C1:R31C8, RC7, R4C) -> AC01 | J67: =INDEX(ItemMaster!R1C1:R31C8, RC7, R4C) -> #ERR: ArgCount | K67: =INDEX(ItemMaster!R1C1:R31C8, RC7, R4C) -> 34276 | L67: =IF(EQUAL(RC[-7], R[-1]C[-7]), R[-1]C, RC[-1])-RC[-8] -> -1890126.704 | M67: =IF(RC[-1]>0, 0, MIN(RC[-9], RC[-1]*-1)) -> 235.2
B68: 36610 | C68: 'FL500/2 | D68: 304.56 | E68: =IF(R7C4, IF(ISERROR(R7C1), R[-1]C, R7C1), "") -> BS01 | F68: =IF(R7C4, IF(ISERROR(R7C2), R[-1]C, R7C2), "") -> 36599 | G68: =MATCH(RC[-2], ItemMaster!R1C1:R31C1, 0) -> 13 | H68: =INDEX(ItemMaster!R1C1:R31C8, RC7, R4C) -> Base Shampoo | I68: =INDEX(ItemMaster!R1C1:R31C8, RC7, R4C) -> AC01 | J68: =INDEX(ItemMaster!R1C1:R31C8, RC7, R4C) -> #ERR: ArgCount | K68: =INDEX(ItemMaster!R1C1:R31C8, RC7, R4C) -> 34276 | L68: =IF(EQUAL(RC[-7], R[-1]C[-7]), R[-1]C, RC[-1])-RC[-8] -> -1890431.264 | M68: =IF(RC[-1]>0, 0, MIN(RC[-9], RC[-1]*-1)) -> 304.56
B69: 36612 | C69: 'FL100/1 | D69: 14.592 | E69: =IF(R7C4, IF(ISERROR(R7C1), R[-1]C, R7C1), "") -> BS01 | F69: =IF(R7C4, IF(ISERROR(R7C2), R[-1]C, R7C2), "") -> 36599 | G69: =MATCH(RC[-2], ItemMaster!R1C1:R31C1, 0) -> 13 | H69: =INDEX(ItemMaster!R1C1:R31C8, RC7, R4C) -> Base Shampoo | I69: =INDEX(ItemMaster!R1C1:R31C8, RC7, R4C) -> AC01 | J69: =INDEX(ItemMaster!R1C1:R31C8, RC7, R4C) -> #ERR: ArgCount | K69: =INDEX(ItemMaster!R1C1:R31C8, RC7, R4C) -> 34276 | L69: =IF(EQUAL(RC[-7], R[-1]C[-7]), R[-1]C, RC[-1])-RC[-8] -> -1890445.856 | M69: =IF(RC[-1]>0, 0, MIN(RC[-9], RC[-1]*-1)) -> 14.592
B70: 36613 | C70: 'FL250/2 | D70: 235.2 | E70: =IF(R7C4, IF(ISERROR(R7C1), R[-1]C, R7C1), "") -> BS01 | F70: =IF(R7C4, IF(ISERROR(R7C2), R[-1]C, R7C2), "") -> 36599 | G70: =MATCH(RC[-2], ItemMaster!R1C1:R31C1, 0) -> 13 | H70: =INDEX(ItemMaster!R1C1:R31C8, RC7, R4C) -> Base Shampoo | I70: =INDEX(ItemMaster!R1C1:R31C8, RC7, R4C) -> AC01 | J70: =INDEX(ItemMaster!R1C1:R31C8, RC7, R4C) -> #ERR: ArgCount | K70: =INDEX(ItemMaster!R1C1:R31C8, RC7, R4C) -> 34276 | L70: =IF(EQUAL(RC[-7], R[-1]C[-7]), R[-1]C, RC[-1])-RC[-8] -> -1890681.056 | M70: =IF(RC[-1]>0, 0, MIN(RC[-9], RC[-1]*-1)) -> 235.2
B71: 36621 | C71: 'FL500/3 | D71: 304.56 | E71: =IF(R7C4, IF(ISERROR(R7C1), R[-1]C, R7C1), "") -> BS01 | F71: =IF(R7C4, IF(ISERROR(R7C2), R[-1]C, R7C2), "") -> 36599 | G71: =MATCH(RC[-2], ItemMaster!R1C1:R31C1, 0) -> 13 | H71: =INDEX(ItemMaster!R1C1:R31C8, RC7, R4C) -> Base Shampoo | I71: =INDEX(ItemMaster!R1C1:R31C8, RC7, R4C) -> AC01 | J71: =INDEX(ItemMaster!R1C1:R31C8, RC7, R4C) -> #ERR: ArgCount | K71: =INDEX(ItemMaster!R1C1:R31C8, RC7, R4C) -> 34276 | L71: =IF(EQUAL(RC[-7], R[-1]C[-7]), R[-1]C, RC[-1])-RC[-8] -> -1890985.616 | M71: =IF(RC[-1]>0, 0, MIN(RC[-9], RC[-1]*-1)) -> 304.56
A72: 'LAB10 | B72: 36608 | C72: 'AB100/1 | D72: 80450 | E72: =IF(R7C4, IF(ISERROR(R7C1), R[-1]C, R7C1), "") -> BS01 | F72: =IF(R7C4, IF(ISERROR(R7C2), R[-1]C, R7C2), "") -> 36599 | G72: =MATCH(RC[-2], ItemMaster!R1C1:R31C1, 0) -> 13 | H72: =INDEX(ItemMaster!R1C1:R31C8, RC7, R4C) -> Base Shampoo | I72: =INDEX(ItemMaster!R1C1:R31C8, RC7, R4C) -> AC01 | J72: =INDEX(ItemMaster!R1C1:R31C8, RC7, R4C) -> #ERR: ArgCount | K72: =INDEX(ItemMaster!R1C1:R31C8, RC7, R4C) -> 34276 | L72: =IF(EQUAL(RC[-7], R[-1]C[-7]), R[-1]C, RC[-1])-RC[-8] -> -1971435.616 | M72: =IF(RC[-1]>0, 0, MIN(RC[-9], RC[-1]*-1)) -> 80450
B73: 36620 | C73: 'AB100/2 | D73: 80450 | E73: =IF(R7C4, IF(ISERROR(R7C1), R[-1]C, R7C1), "") -> BS01 | F73: =IF(R7C4, IF(ISERROR(R7C2), R[-1]C, R7C2), "") -> 36599 | G73: =MATCH(RC[-2], ItemMaster!R1C1:R31C1, 0) -> 13 | H73: =INDEX(ItemMaster!R1C1:R31C8, RC7, R4C) -> Base Shampoo | I73: =INDEX(ItemMaster!R1C1:R31C8, RC7, R4C) -> AC01 | J73: =INDEX(ItemMaster!R1C1:R31C8, RC7, R4C) -> #ERR: ArgCount | K73: =INDEX(ItemMaster!R1C1:R31C8, RC7, R4C) -> 34276 | L73: =IF(EQUAL(RC[-7], R[-1]C[-7]), R[-1]C, RC[-1])-RC[-8] -> -2051885.616 | M73: =IF(RC[-1]>0, 0, MIN(RC[-9], RC[-1]*-1)) -> 80450
A74: 'LAB25 | B74: 36603 | C74: 'AB250/1 | D74: 119150 | E74: =IF(R7C4, IF(ISERROR(R7C1), R[-1]C, R7C1), "") -> BS01 | F74: =IF(R7C4, IF(ISERROR(R7C2), R[-1]C, R7C2), "") -> 36599 | G74: =MATCH(RC[-2], ItemMaster!R1C1:R31C1, 0) -> 13 | H74: =INDEX(ItemMaster!R1C1:R31C8, RC7, R4C) -> Base Shampoo | I74: =INDEX(ItemMaster!R1C1:R31C8, RC7, R4C) -> AC01 | J74: =INDEX(ItemMaster!R1C1:R31C8, RC7, R4C) -> #ERR: ArgCount | K74: =INDEX(ItemMaster!R1C1:R31C8, RC7, R4C) -> 34276 | L74: =IF(EQUAL(RC[-7], R[-1]C[-7]), R[-1]C, RC[-1])-RC[-8] -> -2171035.616 | M74: =IF(RC[-1]>0, 0, MIN(RC[-9], RC[-1]*-1)) -> 119150
B75: 36615 | C75: 'AB250/2 | D75: 116050 | E75: =IF(R7C4, IF(ISERROR(R7C1), R[-1]C, R7C1), "") -> BS01 | F75: =IF(R7C4, IF(ISERROR(R7C2), R[-1]C, R7C2), "") -> 36599 | G75: =MATCH(RC[-2], ItemMaster!R1C1:R31C1, 0) -> 13 | H75: =INDEX(ItemMaster!R1C1:R31C8, RC7, R4C) -> Base Shampoo | I75: =INDEX(ItemMaster!R1C1:R31C8, RC7, R4C) -> AC01 | J75: =INDEX(ItemMaster!R1C1:R31C8, RC7, R4C) -> #ERR: ArgCount | K75: =INDEX(ItemMaster!R1C1:R31C8, RC7, R4C) -> 34276 | L75: =IF(EQUAL(RC[-7], R[-1]C[-7]), R[-1]C, RC[-1])-RC[-8] -> -2287085.616 | M75: =IF(RC[-1]>0, 0, MIN(RC[-9], RC[-1]*-1)) -> 116050
A76: 'LAB50 | B76: 36599 | C76: 'AB500/1 | D76: 2860 | E76: =IF(R7C4, IF(ISERROR(R7C1), R[-1]C, R7C1), "") -> BS01 | F76: =IF(R7C4, IF(ISERROR(R7C2), R[-1]C, R7C2), "") -> 36599 | G76: =MATCH(RC[-2], ItemMaster!R1C1:R31C1, 0) -> 13 | H76: =INDEX(ItemMaster!R1C1:R31C8, RC7, R4C) -> Base Shampoo | I76: =INDEX(ItemMaster!R1C1:R31C8, RC7, R4C) -> AC01 | J76: =INDEX(ItemMaster!R1C1:R31C8, RC7, R4C) -> #ERR: ArgCount | K76: =INDEX(ItemMaster!R1C1:R31C8, RC7, R4C) -> 34276 | L76: =IF(EQUAL(RC[-7], R[-1]C[-7]), R[-1]C, RC[-1])-RC[-8] -> -2289945.616 | M76: =IF(RC[-1]>0, 0, MIN(RC[-9], RC[-1]*-1)) -> 2860
B77: 36600 | C77: 'AB500/2 | D77: 32084 | E77: =IF(R7C4, IF(ISERROR(R7C1), R[-1]C, R7C1), "") -> BS01 | F77: =IF(R7C4, IF(ISERROR(R7C2), R[-1]C, R7C2), "") -> 36599 | G77: =MATCH(RC[-2], ItemMaster!R1C1:R31C1, 0) -> 13 | H77: =INDEX(ItemMaster!R1C1:R31C8, RC7, R4C) -> Base Shampoo | I77: =INDEX(ItemMaster!R1C1:R31C8, RC7, R4C) -> AC01 | J77: =INDEX(ItemMaster!R1C1:R31C8, RC7, R4C) -> #ERR: ArgCount | K77: =INDEX(ItemMaster!R1C1:R31C8, RC7, R4C) -> 34276 | L77: =IF(EQUAL(RC[-7], R[-1]C[-7]), R[-1]C, RC[-1])-RC[-8] -> -2322029.616 | M77: =IF(RC[-1]>0, 0, MIN(RC[-9], RC[-1]*-1)) -> 32084
B78: 36611 | C78: 'AB500/3 | D78: 32084 | E78: =IF(R7C4, IF(ISERROR(R7C1), R[-1]C, R7C1), "") -> BS01 | F78: =IF(R7C4, IF(ISERROR(R7C2), R[-1]C, R7C2), "") -> 36599 | G78: =MATCH(RC[-2], ItemMaster!R1C1:R31C1, 0) -> 13 | H78: =INDEX(ItemMaster!R1C1:R31C8, RC7, R4C) -> Base Shampoo | I78: =INDEX(ItemMaster!R1C1:R31C8, RC7, R4C) -> AC01 | J78: =INDEX(ItemMaster!R1C1:R31C8, RC7, R4C) -> #ERR: ArgCount | K78: =INDEX(ItemMaster!R1C1:R31C8, RC7, R4C) -> 34276 | L78: =IF(EQUAL(RC[-7], R[-1]C[-7]), R[-1]C, RC[-1])-RC[-8] -> -2354113.616 | M78: =IF(RC[-1]>0, 0, MIN(RC[-9], RC[-1]*-1)) -> 32084
A79: 'LFL10 | B79: 36612 | C79: 'FL100/1 | D79: 15200 | E79: =IF(R7C4, IF(ISERROR(R7C1), R[-1]C, R7C1), "") -> BS01 | F79: =IF(R7C4, IF(ISERROR(R7C2), R[-1]C, R7C2), "") -> 36599 | G79: =MATCH(RC[-2], ItemMaster!R1C1:R31C1, 0) -> 13 | H79: =INDEX(ItemMaster!R1C1:R31C8, RC7, R4C) -> Base Shampoo | I79: =INDEX(ItemMaster!R1C1:R31C8, RC7, R4C) -> AC01 | J79: =INDEX(ItemMaster!R1C1:R31C8, RC7, R4C) -> #ERR: ArgCount | K79: =INDEX(ItemMaster!R1C1:R31C8, RC7, R4C) -> 34276 | L79: =IF(EQUAL(RC[-7], R[-1]C[-7]), R[-1]C, RC[-1])-RC[-8] -> -2369313.616 | M79: =IF(RC[-1]>0, 0, MIN(RC[-9], RC[-1]*-1)) -> 15200
A80: 'LFL25 | B80: 36602 | C80: 'FL250/1 | D80: 98000 | E80: =IF(R7C4, IF(ISERROR(R7C1), R[-1]C, R7C1), "") -> BS01 | F80: =IF(R7C4, IF(ISERROR(R7C2), R[-1]C, R7C2), "") -> 36599 | G80: =MATCH(RC[-2], ItemMaster!R1C1:R31C1, 0) -> 13 | H80: =INDEX(ItemMaster!R1C1:R31C8, RC7, R4C) -> Base Shampoo | I80: =INDEX(ItemMaster!R1C1:R31C8, RC7, R4C) -> AC01 | J80: =INDEX(ItemMaster!R1C1:R31C8, RC7, R4C) -> #ERR: ArgCount | K80: =INDEX(ItemMaster!R1C1:R31C8, RC7, R4C) -> 34276 | L80: =IF(EQUAL(RC[-7], R[-1]C[-7]), R[-1]C, RC[-1])-RC[-8] -> -2467313.616 | M80: =IF(RC[-1]>0, 0, MIN(RC[-9], RC[-1]*-1)) -> 98000
B81: 36613 | C81: 'FL250/2 | D81: 98000 | E81: =IF(R7C4, IF(ISERROR(R7C1), R[-1]C, R7C1), "") -> BS01 | F81: =IF(R7C4, IF(ISERROR(R7C2), R[-1]C, R7C2), "") -> 36599 | G81: =MATCH(RC[-2], ItemMaster!R1C1:R31C1, 0) -> 13 | H81: =INDEX(ItemMaster!R1C1:R31C8, RC7, R4C) -> Base Shampoo | I81: =INDEX(ItemMaster!R1C1:R31C8, RC7, R4C) -> AC01 | J81: =INDEX(ItemMaster!R1C1:R31C8, RC7, R4C) -> #ERR: ArgCount | K81: =INDEX(ItemMaster!R1C1:R31C8, RC7, R4C) -> 34276 | L81: =IF(EQUAL(RC[-7], R[-1]C[-7]), R[-1]C, RC[-1])-RC[-8] -> -2565313.616 | M81: =IF(RC[-1]>0, 0, MIN(RC[-9], RC[-1]*-1)) -> 98000
A82: 'LFL50 | B82: 36599 | C82: 'FL500/1 | D82: 67080 | E82: =IF(R7C4, IF(ISERROR(R7C1), R[-1]C, R7C1), "") -> BS01 | F82: =IF(R7C4, IF(ISERROR(R7C2), R[-1]C, R7C2), "") -> 36599 | G82: =MATCH(RC[-2], ItemMaster!R1C1:R31C1, 0) -> 13 | H82: =INDEX(ItemMaster!R1C1:R31C8, RC7, R4C) -> Base Shampoo | I82: =INDEX(ItemMaster!R1C1:R31C8, RC7, R4C) -> AC01 | J82: =INDEX(ItemMaster!R1C1:R31C8, RC7, R4C) -> #ERR: ArgCount | K82: =INDEX(ItemMaster!R1C1:R31C8, RC7, R4C) -> 34276 | L82: =IF(EQUAL(RC[-7], R[-1]C[-7]), R[-1]C, RC[-1])-RC[-8] -> -2632393.616 | M82: =IF(RC[-1]>0, 0, MIN(RC[-9], RC[-1]*-1)) -> 67080
B83: 36610 | C83: 'FL500/2 | D83: 65988 | E83: =IF(R7C4, IF(ISERROR(R7C1), R[-1]C, R7C1), "") -> BS01 | F83: =IF(R7C4, IF(ISERROR(R7C2), R[-1]C, R7C2), "") -> 36599 | G83: =MATCH(RC[-2], ItemMaster!R1C1:R31C1, 0) -> 13 | H83: =INDEX(ItemMaster!R1C1:R31C8, RC7, R4C) -> Base Shampoo | I83: =INDEX(ItemMaster!R1C1:R31C8, RC7, R4C) -> AC01 | J83: =INDEX(ItemMaster!R1C1:R31C8, RC7, R4C) -> #ERR: ArgCount | K83: =INDEX(ItemMaster!R1C1:R31C8, RC7, R4C) -> 34276 | L83: =IF(EQUAL(RC[-7], R[-1]C[-7]), R[-1]C, RC[-1])-RC[-8] -> -2698381.616 | M83: =IF(RC[-1]>0, 0, MIN(RC[-9], RC[-1]*-1)) -> 65988
B84: 36621 | C84: 'FL500/3 | D84: 65988 | E84: =IF(R7C4, IF(ISERROR(R7C1), R[-1]C, R7C1), "") -> BS01 | F84: =IF(R7C4, IF(ISERROR(R7C2), R[-1]C, R7C2), "") -> 36599 | G84: =MATCH(RC[-2], ItemMaster!R1C1:R31C1, 0) -> 13 | H84: =INDEX(ItemMaster!R1C1:R31C8, RC7, R4C) -> Base Shampoo | I84: =INDEX(ItemMaster!R1C1:R31C8, RC7, R4C) -> AC01 | J84: =INDEX(ItemMaster!R1C1:R31C8, RC7, R4C) -> #ERR: ArgCount | K84: =INDEX(ItemMaster!R1C1:R31C8, RC7, R4C) -> 34276 | L84: =IF(EQUAL(RC[-7], R[-1]C[-7]), R[-1]C, RC[-1])-RC[-8] -> -2764369.616 | M84: =IF(RC[-1]>0, 0, MIN(RC[-9], RC[-1]*-1)) -> 65988
B85: 0 | D85: 0 | E85: =IF(RC[-1], IF(ISERROR(RC[-4]), R[-1]C, RC[-4]), "") ->  | F85: =IF(RC[-2], IF(ISERROR(RC[-4]), R[-1]C, RC[-4]), "") ->  | G85: =MATCH(RC[-2], ItemMaster!R1C1:R31C1, 0) -> #NA | H85: =INDEX(ItemMaster!R1C1:R31C8, RC7, R4C) -> #NA | I85: =INDEX(ItemMaster!R1C1:R31C8, RC7, R4C) -> #NA | J85: =INDEX(ItemMaster!R1C1:R31C8, RC7, R4C) -> #NA | K85: =INDEX(ItemMaster!R1C1:R31C8, RC7, R4C) -> #NA | L85: =IF(EQUAL(RC[-7], R[-1]C[-7]), R[-1]C, RC[-1])-RC[-8] -> #NA | M85: =IF(RC[-1]>0, 0, MIN(RC[-9], RC[-1]*-1)) -> #NA
B86: 0 | D86: 0 | E86: =IF(RC[-1], IF(ISERROR(RC[-4]), R[-1]C, RC[-4]), "") ->  | F86: =IF(RC[-2], IF(ISERROR(RC[-4]), R[-1]C, RC[-4]), "") ->  | G86: =MATCH(RC[-2], ItemMaster!R1C1:R31C1, 0) -> #NA | H86: =INDEX(ItemMaster!R1C1:R31C8, RC7, R4C) -> #NA | I86: =INDEX(ItemMaster!R1C1:R31C8, RC7, R4C) -> #NA | J86: =INDEX(ItemMaster!R1C1:R31C8, RC7, R4C) -> #NA | K86: =INDEX(ItemMaster!R1C1:R31C8, RC7, R4C) -> #NA | L86: =IF(EQUAL(RC[-7], R[-1]C[-7]), R[-1]C, RC[-1])-RC[-8] -> #NA | M86: =IF(RC[-1]>0, 0, MIN(RC[-9], RC[-1]*-1)) -> #NA
B87: 0 | D87: 0 | E87: =IF(RC[-1], IF(ISERROR(RC[-4]), R[-1]C, RC[-4]), "") ->  | F87: =IF(RC[-2], IF(ISERROR(RC[-4]), R[-1]C, RC[-4]), "") ->  | G87: =MATCH(RC[-2], ItemMaster!R1C1:R31C1, 0) -> #NA | H87: =INDEX(ItemMaster!R1C1:R31C8, RC7, R4C) -> #NA | I87: =INDEX(ItemMaster!R1C1:R31C8, RC7, R4C) -> #NA | J87: =INDEX(ItemMaster!R1C1:R31C8, RC7, R4C) -> #NA | K87: =INDEX(ItemMaster!R1C1:R31C8, RC7, R4C) -> #NA | L87: =IF(EQUAL(RC[-7], R[-1]C[-7]), R[-1]C, RC[-1])-RC[-8] -> #NA | M87: =IF(RC[-1]>0, 0, MIN(RC[-9], RC[-1]*-1)) -> #NA
B88: 0 | D88: 0 | E88: =IF(RC[-1], IF(ISERROR(RC[-4]), R[-1]C, RC[-4]), "") ->  | F88: =IF(RC[-2], IF(ISERROR(RC[-4]), R[-1]C, RC[-4]), "") ->  | G88: =MATCH(RC[-2], ItemMaster!R1C1:R31C1, 0) -> #NA | H88: =INDEX(ItemMaster!R1C1:R31C8, RC7, R4C) -> #NA | I88: =INDEX(ItemMaster!R1C1:R31C8, RC7, R4C) -> #NA | J88: =INDEX(ItemMaster!R1C1:R31C8, RC7, R4C) -> #NA | K88: =INDEX(ItemMaster!R1C1:R31C8, RC7, R4C) -> #NA | L88: =IF(EQUAL(RC[-7], R[-1]C[-7]), R[-1]C, RC[-1])-RC[-8] -> #NA | M88: =IF(RC[-1]>0, 0, MIN(RC[-9], RC[-1]*-1)) -> #NA
B89: 0 | D89: 0 | E89: =IF(RC[-1], IF(ISERROR(RC[-4]), R[-1]C, RC[-4]), "") ->  | F89: =IF(RC[-2], IF(ISERROR(RC[-4]), R[-1]C, RC[-4]), "") ->  | G89: =MATCH(RC[-2], ItemMaster!R1C1:R31C1, 0) -> #NA | H89: =INDEX(ItemMaster!R1C1:R31C8, RC7, R4C) -> #NA | I89: =INDEX(ItemMaster!R1C1:R31C8, RC7, R4C) -> #NA | J89: =INDEX(ItemMaster!R1C1:R31C8, RC7, R4C) -> #NA | K89: =INDEX(ItemMaster!R1C1:R31C8, RC7, R4C) -> #NA | L89: =IF(EQUAL(RC[-7], R[-1]C[-7]), R[-1]C, RC[-1])-RC[-8] -> #NA | M89: =IF(RC[-1]>0, 0, MIN(RC[-9], RC[-1]*-1)) -> #NA
B90: 0 | D90: 0 | E90: =IF(RC[-1], IF(ISERROR(RC[-4]), R[-1]C, RC[-4]), "") ->  | F90: =IF(RC[-2], IF(ISERROR(RC[-4]), R[-1]C, RC[-4]), "") ->  | G90: =MATCH(RC[-2], ItemMaster!R1C1:R31C1, 0) -> #NA | H90: =INDEX(ItemMaster!R1C1:R31C8, RC7, R4C) -> #NA | I90: =INDEX(ItemMaster!R1C1:R31C8, RC7, R4C) -> #NA | J90: =INDEX(ItemMaster!R1C1:R31C8, RC7, R4C) -> #NA | K90: =INDEX(ItemMaster!R1C1:R31C8, RC7, R4C) -> #NA | L90: =IF(EQUAL(RC[-7], R[-1]C[-7]), R[-1]C, RC[-1])-RC[-8] -> #NA | M90: =IF(RC[-1]>0, 0, MIN(RC[-9], RC[-1]*-1)) -> #NA
B91: 0 | D91: 0 | E91: =IF(RC[-1], IF(ISERROR(RC[-4]), R[-1]C, RC[-4]), "") ->  | F91: =IF(RC[-2], IF(ISERROR(RC[-4]), R[-1]C, RC[-4]), "") ->  | G91: =MATCH(RC[-2], ItemMaster!R1C1:R31C1, 0) -> #NA | H91: =INDEX(ItemMaster!R1C1:R31C8, RC7, R4C) -> #NA | I91: =INDEX(ItemMaster!R1C1:R31C8, RC7, R4C) -> #NA | J91: =INDEX(ItemMaster!R1C1:R31C8, RC7, R4C) -> #NA | K91: =INDEX(ItemMaster!R1C1:R31C8, RC7, R4C) -> #NA | L91: =IF(EQUAL(RC[-7], R[-1]C[-7]), R[-1]C, RC[-1])-RC[-8] -> #NA | M91: =IF(RC[-1]>0, 0, MIN(RC[-9], RC[-1]*-1)) -> #NA
B92: 0 | D92: 0 | E92: =IF(RC[-1], IF(ISERROR(RC[-4]), R[-1]C, RC[-4]), "") ->  | F92: =IF(RC[-2], IF(ISERROR(RC[-4]), R[-1]C, RC[-4]), "") ->  | G92: =MATCH(RC[-2], ItemMaster!R1C1:R31C1, 0) -> #NA | H92: =INDEX(ItemMaster!R1C1:R31C8, RC7, R4C) -> #NA | I92: =INDEX(ItemMaster!R1C1:R31C8, RC7, R4C) -> #NA | J92: =INDEX(ItemMaster!R1C1:R31C8, RC7, R4C) -> #NA | K92: =INDEX(ItemMaster!R1C1:R31C8, RC7, R4C) -> #NA | L92: =IF(EQUAL(RC[-7], R[-1]C[-7]), R[-1]C, RC[-1])-RC[-8] -> #NA | M92: =IF(RC[-1]>0, 0, MIN(RC[-9], RC[-1]*-1)) -> #NA
B93: 0 | D93: 0 | E93: =IF(RC[-1], IF(ISERROR(RC[-4]), R[-1]C, RC[-4]), "") ->  | F93: =IF(RC[-2], IF(ISERROR(RC[-4]), R[-1]C, RC[-4]), "") ->  | G93: =MATCH(RC[-2], ItemMaster!R1C1:R31C1, 0) -> #NA | H93: =INDEX(ItemMaster!R1C1:R31C8, RC7, R4C) -> #NA | I93: =INDEX(ItemMaster!R1C1:R31C8, RC7, R4C) -> #NA | J93: =INDEX(ItemMaster!R1C1:R31C8, RC7, R4C) -> #NA | K93: =INDEX(ItemMaster!R1C1:R31C8, RC7, R4C) -> #NA | L93: =IF(EQUAL(RC[-7], R[-1]C[-7]), R[-1]C, RC[-1])-RC[-8] -> #NA | M93: =IF(RC[-1]>0, 0, MIN(RC[-9], RC[-1]*-1)) -> #NA
B94: 0 | D94: 0 | E94: =IF(RC[-1], IF(ISERROR(RC[-4]), R[-1]C, RC[-4]), "") ->  | F94: =IF(RC[-2], IF(ISERROR(RC[-4]), R[-1]C, RC[-4]), "") ->  | G94: =MATCH(RC[-2], ItemMaster!R1C1:R31C1, 0) -> #NA | H94: =INDEX(ItemMaster!R1C1:R31C8, RC7, R4C) -> #NA | I94: =INDEX(ItemMaster!R1C1:R31C8, RC7, R4C) -> #NA | J94: =INDEX(ItemMaster!R1C1:R31C8, RC7, R4C) -> #NA | K94: =INDEX(ItemMaster!R1C1:R31C8, RC7, R4C) -> #NA | L94: =IF(EQUAL(RC[-7], R[-1]C[-7]), R[-1]C, RC[-1])-RC[-8] -> #NA | M94: =IF(RC[-1]>0, 0, MIN(RC[-9], RC[-1]*-1)) -> #NA
B95: 0 | D95: 0 | E95: =IF(RC[-1], IF(ISERROR(RC[-4]), R[-1]C, RC[-4]), "") ->  | F95: =IF(RC[-2], IF(ISERROR(RC[-4]), R[-1]C, RC[-4]), "") ->  | G95: =MATCH(RC[-2], ItemMaster!R1C1:R31C1, 0) -> #NA | H95: =INDEX(ItemMaster!R1C1:R31C8, RC7, R4C) -> #NA | I95: =INDEX(ItemMaster!R1C1:R31C8, RC7, R4C) -> #NA | J95: =INDEX(ItemMaster!R1C1:R31C8, RC7, R4C) -> #NA | K95: =INDEX(ItemMaster!R1C1:R31C8, RC7, R4C) -> #NA | L95: =IF(EQUAL(RC[-7], R[-1]C[-7]), R[-1]C, RC[-1])-RC[-8] -> #NA | M95: =IF(RC[-1]>0, 0, MIN(RC[-9], RC[-1]*-1)) -> #NA
B96: 0 | D96: 0 | E96: =IF(RC[-1], IF(ISERROR(RC[-4]), R[-1]C, RC[-4]), "") ->  | F96: =IF(RC[-2], IF(ISERROR(RC[-4]), R[-1]C, RC[-4]), "") ->  | G96: =MATCH(RC[-2], ItemMaster!R1C1:R31C1, 0) -> #NA | H96: =INDEX(ItemMaster!R1C1:R31C8, RC7, R4C) -> #NA | I96: =INDEX(ItemMaster!R1C1:R31C8, RC7, R4C) -> #NA | J96: =INDEX(ItemMaster!R1C1:R31C8, RC7, R4C) -> #NA | K96: =INDEX(ItemMaster!R1C1:R31C8, RC7, R4C) -> #NA | L96: =IF(EQUAL(RC[-7], R[-1]C[-7]), R[-1]C, RC[-1])-RC[-8] -> #NA | M96: =IF(RC[-1]>0, 0, MIN(RC[-9], RC[-1]*-1)) -> #NA
B97: 0 | D97: 0 | E97: =IF(RC[-1], IF(ISERROR(RC[-4]), R[-1]C, RC[-4]), "") ->  | F97: =IF(RC[-2], IF(ISERROR(RC[-4]), R[-1]C, RC[-4]), "") ->  | G97: =MATCH(RC[-2], ItemMaster!R1C1:R31C1, 0) -> #NA | H97: =INDEX(ItemMaster!R1C1:R31C8, RC7, R4C) -> #NA | I97: =INDEX(ItemMaster!R1C1:R31C8, RC7, R4C) -> #NA | J97: =INDEX(ItemMaster!R1C1:R31C8, RC7, R4C) -> #NA | K97: =INDEX(ItemMaster!R1C1:R31C8, RC7, R4C) -> #NA | L97: =IF(EQUAL(RC[-7], R[-1]C[-7]), R[-1]C, RC[-1])-RC[-8] -> #NA | M97: =IF(RC[-1]>0, 0, MIN(RC[-9], RC[-1]*-1)) -> #NA
B98: 0 | D98: 0 | E98: =IF(RC[-1], IF(ISERROR(RC[-4]), R[-1]C, RC[-4]), "") ->  | F98: =IF(RC[-2], IF(ISERROR(RC[-4]), R[-1]C, RC[-4]), "") ->  | G98: =MATCH(RC[-2], ItemMaster!R1C1:R31C1, 0) -> #NA | H98: =INDEX(ItemMaster!R1C1:R31C8, RC7, R4C) -> #NA | I98: =INDEX(ItemMaster!R1C1:R31C8, RC7, R4C) -> #NA | J98: =INDEX(ItemMaster!R1C1:R31C8, RC7, R4C) -> #NA | K98: =INDEX(ItemMaster!R1C1:R31C8, RC7, R4C) -> #NA | L98: =IF(EQUAL(RC[-7], R[-1]C[-7]), R[-1]C, RC[-1])-RC[-8] -> #NA | M98: =IF(RC[-1]>0, 0, MIN(RC[-9], RC[-1]*-1)) -> #NA
B99: 0 | D99: 0 | E99: =IF(RC[-1], IF(ISERROR(RC[-4]), R[-1]C, RC[-4]), "") ->  | F99: =IF(RC[-2], IF(ISERROR(RC[-4]), R[-1]C, RC[-4]), "") ->  | G99: =MATCH(RC[-2], ItemMaster!R1C1:R31C1, 0) -> #NA | H99: =INDEX(ItemMaster!R1C1:R31C8, RC7, R4C) -> #NA | I99: =INDEX(ItemMaster!R1C1:R31C8, RC7, R4C) -> #NA | J99: =INDEX(ItemMaster!R1C1:R31C8, RC7, R4C) -> #NA | K99: =INDEX(ItemMaster!R1C1:R31C8, RC7, R4C) -> #NA | L99: =IF(EQUAL(RC[-7], R[-1]C[-7]), R[-1]C, RC[-1])-RC[-8] -> #NA | M99: =IF(RC[-1]>0, 0, MIN(RC[-9], RC[-1]*-1)) -> #NA
B100: 0 | D100: 0 | E100: =IF(RC[-1], IF(ISERROR(RC[-4]), R[-1]C, RC[-4]), "") ->  | F100: =IF(RC[-2], IF(ISERROR(RC[-4]), R[-1]C, RC[-4]), "") ->  | G100: =MATCH(RC[-2], ItemMaster!R1C1:R31C1, 0) -> #NA | H100: =INDEX(ItemMaster!R1C1:R31C8, RC7, R4C) -> #NA | I100: =INDEX(ItemMaster!R1C1:R31C8, RC7, R4C) -> #NA | J100: =INDEX(ItemMaster!R1C1:R31C8, RC7, R4C) -> #NA | K100: =INDEX(ItemMaster!R1C1:R31C8, RC7, R4C) -> #NA | L100: =IF(EQUAL(RC[-7], R[-1]C[-7]), R[-1]C, RC[-1])-RC[-8] -> #NA | M100: =IF(RC[-1]>0, 0, MIN(RC[-9], RC[-1]*-1)) -> #NA
B101: 0 | D101: 0 | E101: =IF(RC[-1], IF(ISERROR(RC[-4]), R[-1]C, RC[-4]), "") ->  | F101: =IF(RC[-2], IF(ISERROR(RC[-4]), R[-1]C, RC[-4]), "") ->  | G101: =MATCH(RC[-2], ItemMaster!R1C1:R31C1, 0) -> #NA | H101: =INDEX(ItemMaster!R1C1:R31C8, RC7, R4C) -> #NA | I101: =INDEX(ItemMaster!R1C1:R31C8, RC7, R4C) -> #NA | J101: =INDEX(ItemMaster!R1C1:R31C8, RC7, R4C) -> #NA | K101: =INDEX(ItemMaster!R1C1:R31C8, RC7, R4C) -> #NA | L101: =IF(EQUAL(RC[-7], R[-1]C[-7]), R[-1]C, RC[-1])-RC[-8] -> #NA | M101: =IF(RC[-1]>0, 0, MIN(RC[-9], RC[-1]*-1)) -> #NA
B102: 0 | D102: 0 | E102: =IF(RC[-1], IF(ISERROR(RC[-4]), R[-1]C, RC[-4]), "") ->  | F102: =IF(RC[-2], IF(ISERROR(RC[-4]), R[-1]C, RC[-4]), "") ->  | G102: =MATCH(RC[-2], ItemMaster!R1C1:R31C1, 0) -> #NA | H102: =INDEX(ItemMaster!R1C1:R31C8, RC7, R4C) -> #NA | I102: =INDEX(ItemMaster!R1C1:R31C8, RC7, R4C) -> #NA | J102: =INDEX(ItemMaster!R1C1:R31C8, RC7, R4C) -> #NA | K102: =INDEX(ItemMaster!R1C1:R31C8, RC7, R4C) -> #NA | L102: =IF(EQUAL(RC[-7], R[-1]C[-7]), R[-1]C, RC[-1])-RC[-8] -> #NA | M102: =IF(RC[-1]>0, 0, MIN(RC[-9], RC[-1]*-1)) -> #NA
B103: 0 | D103: 0 | E103: =IF(RC[-1], IF(ISERROR(RC[-4]), R[-1]C, RC[-4]), "") ->  | F103: =IF(RC[-2], IF(ISERROR(RC[-4]), R[-1]C, RC[-4]), "") ->  | G103: =MATCH(RC[-2], ItemMaster!R1C1:R31C1, 0) -> #NA | H103: =INDEX(ItemMaster!R1C1:R31C8, RC7, R4C) -> #NA | I103: =INDEX(ItemMaster!R1C1:R31C8, RC7, R4C) -> #NA | J103: =INDEX(ItemMaster!R1C1:R31C8, RC7, R4C) -> #NA | K103: =INDEX(ItemMaster!R1C1:R31C8, RC7, R4C) -> #NA | L103: =IF(EQUAL(RC[-7], R[-1]C[-7]), R[-1]C, RC[-1])-RC[-8] -> #NA | M103: =IF(RC[-1]>0, 0, MIN(RC[-9], RC[-1]*-1)) -> #NA
B104: 0 | D104: 0 | E104: =IF(RC[-1], IF(ISERROR(RC[-4]), R[-1]C, RC[-4]), "") ->  | F104: =IF(RC[-2], IF(ISERROR(RC[-4]), R[-1]C, RC[-4]), "") ->  | G104: =MATCH(RC[-2], ItemMaster!R1C1:R31C1, 0) -> #NA | H104: =INDEX(ItemMaster!R1C1:R31C8, RC7, R4C) -> #NA | I104: =INDEX(ItemMaster!R1C1:R31C8, RC7, R4C) -> #NA | J104: =INDEX(ItemMaster!R1C1:R31C8, RC7, R4C) -> #NA | K104: =INDEX(ItemMaster!R1C1:R31C8, RC7, R4C) -> #NA | L104: =IF(EQUAL(RC[-7], R[-1]C[-7]), R[-1]C, RC[-1])-RC[-8] -> #NA | M104: =IF(RC[-1]>0, 0, MIN(RC[-9], RC[-1]*-1)) -> #NA
B105: 0 | D105: 0 | E105: =IF(RC[-1], IF(ISERROR(RC[-4]), R[-1]C, RC[-4]), "") ->  | F105: =IF(RC[-2], IF(ISERROR(RC[-4]), R[-1]C, RC[-4]), "") ->  | G105: =MATCH(RC[-2], ItemMaster!R1C1:R31C1, 0) -> #NA | H105: =INDEX(ItemMaster!R1C1:R31C8, RC7, R4C) -> #NA | I105: =INDEX(ItemMaster!R1C1:R31C8, RC7, R4C) -> #NA | J105: =INDEX(ItemMaster!R1C1:R31C8, RC7, R4C) -> #NA | K105: =INDEX(ItemMaster!R1C1:R31C8, RC7, R4C) -> #NA | L105: =IF(EQUAL(RC[-7], R[-1]C[-7]), R[-1]C, RC[-1])-RC[-8] -> #NA | M105: =IF(RC[-1]>0, 0, MIN(RC[-9], RC[-1]*-1)) -> #NA
B106: 0 | D106: 0 | E106: =IF(RC[-1], IF(ISERROR(RC[-4]), R[-1]C, RC[-4]), "") ->  | F106: =IF(RC[-2], IF(ISERROR(RC[-4]), R[-1]C, RC[-4]), "") ->  | G106: =MATCH(RC[-2], ItemMaster!R1C1:R31C1, 0) -> #NA | H106: =INDEX(ItemMaster!R1C1:R31C8, RC7, R4C) -> #NA | I106: =INDEX(ItemMaster!R1C1:R31C8, RC7, R4C) -> #NA | J106: =INDEX(ItemMaster!R1C1:R31C8, RC7, R4C) -> #NA | K106: =INDEX(ItemMaster!R1C1:R31C8, RC7, R4C) -> #NA | L106: =IF(EQUAL(RC[-7], R[-1]C[-7]), R[-1]C, RC[-1])-RC[-8] -> #NA | M106: =IF(RC[-1]>0, 0, MIN(RC[-9], RC[-1]*-1)) -> #NA
B107: 0 | D107: 0 | E107: =IF(RC[-1], IF(ISERROR(RC[-4]), R[-1]C, RC[-4]), "") ->  | F107: =IF(RC[-2], IF(ISERROR(RC[-4]), R[-1]C, RC[-4]), "") ->  | G107: =MATCH(RC[-2], ItemMaster!R1C1:R31C1, 0) -> #NA | H107: =INDEX(ItemMaster!R1C1:R31C8, RC7, R4C) -> #NA | I107: =INDEX(ItemMaster!R1C1:R31C8, RC7, R4C) -> #NA | J107: =INDEX(ItemMaster!R1C1:R31C8, RC7, R4C) -> #NA | K107: =INDEX(ItemMaster!R1C1:R31C8, RC7, R4C) -> #NA | L107: =IF(EQUAL(RC[-7], R[-1]C[-7]), R[-1]C, RC[-1])-RC[-8] -> #NA | M107: =IF(RC[-1]>0, 0, MIN(RC[-9], RC[-1]*-1)) -> #NA
B108: 0 | D108: 0 | E108: =IF(RC[-1], IF(ISERROR(RC[-4]), R[-1]C, RC[-4]), "") ->  | F108: =IF(RC[-2], IF(ISERROR(RC[-4]), R[-1]C, RC[-4]), "") ->  | G108: =MATCH(RC[-2], ItemMaster!R1C1:R31C1, 0) -> #NA | H108: =INDEX(ItemMaster!R1C1:R31C8, RC7, R4C) -> #NA | I108: =INDEX(ItemMaster!R1C1:R31C8, RC7, R4C) -> #NA | J108: =INDEX(ItemMaster!R1C1:R31C8, RC7, R4C) -> #NA | K108: =INDEX(ItemMaster!R1C1:R31C8, RC7, R4C) -> #NA | L108: =IF(EQUAL(RC[-7], R[-1]C[-7]), R[-1]C, RC[-1])-RC[-8] -> #NA | M108: =IF(RC[-1]>0, 0, MIN(RC[-9], RC[-1]*-1)) -> #NA
B109: 0 | D109: 0 | E109: =IF(RC[-1], IF(ISERROR(RC[-4]), R[-1]C, RC[-4]), "") ->  | F109: =IF(RC[-2], IF(ISERROR(RC[-4]), R[-1]C, RC[-4]), "") ->  | G109: =MATCH(RC[-2], ItemMaster!R1C1:R31C1, 0) -> #NA | H109: =INDEX(ItemMaster!R1C1:R31C8, RC7, R4C) -> #NA | I109: =INDEX(ItemMaster!R1C1:R31C8, RC7, R4C) -> #NA | J109: =INDEX(ItemMaster!R1C1:R31C8, RC7, R4C) -> #NA | K109: =INDEX(ItemMaster!R1C1:R31C8, RC7, R4C) -> #NA | L109: =IF(EQUAL(RC[-7], R[-1]C[-7]), R[-1]C, RC[-1])-RC[-8] -> #NA | M109: =IF(RC[-1]>0, 0, MIN(RC[-9], RC[-1]*-1)) -> #NA
B110: 0 | D110: 0 | E110: =IF(RC[-1], IF(ISERROR(RC[-4]), R[-1]C, RC[-4]), "") ->  | F110: =IF(RC[-2], IF(ISERROR(RC[-4]), R[-1]C, RC[-4]), "") ->  | G110: =MATCH(RC[-2], ItemMaster!R1C1:R31C1, 0) -> #NA | H110: =INDEX(ItemMaster!R1C1:R31C8, RC7, R4C) -> #NA | I110: =INDEX(ItemMaster!R1C1:R31C8, RC7, R4C) -> #NA | J110: =INDEX(ItemMaster!R1C1:R31C8, RC7, R4C) -> #NA | K110: =INDEX(ItemMaster!R1C1:R31C8, RC7, R4C) -> #NA | L110: =IF(EQUAL(RC[-7], R[-1]C[-7]), R[-1]C, RC[-1])-RC[-8] -> #NA | M110: =IF(RC[-1]>0, 0, MIN(RC[-9], RC[-1]*-1)) -> #NA
B111: 0 | D111: 0 | E111: =IF(RC[-1], IF(ISERROR(RC[-4]), R[-1]C, RC[-4]), "") ->  | F111: =IF(RC[-2], IF(ISERROR(RC[-4]), R[-1]C, RC[-4]), "") ->  | G111: =MATCH(RC[-2], ItemMaster!R1C1:R31C1, 0) -> #NA | H111: =INDEX(ItemMaster!R1C1:R31C8, RC7, R4C) -> #NA | I111: =INDEX(ItemMaster!R1C1:R31C8, RC7, R4C) -> #NA | J111: =INDEX(ItemMaster!R1C1:R31C8, RC7, R4C) -> #NA | K111: =INDEX(ItemMaster!R1C1:R31C8, RC7, R4C) -> #NA | L111: =IF(EQUAL(RC[-7], R[-1]C[-7]), R[-1]C, RC[-1])-RC[-8] -> #NA | M111: =IF(RC[-1]>0, 0, MIN(RC[-9], RC[-1]*-1)) -> #NA
B112: 0 | D112: 0 | E112: =IF(RC[-1], IF(ISERROR(RC[-4]), R[-1]C, RC[-4]), "") ->  | F112: =IF(RC[-2], IF(ISERROR(RC[-4]), R[-1]C, RC[-4]), "") ->  | G112: =MATCH(RC[-2], ItemMaster!R1C1:R31C1, 0) -> #NA | H112: =INDEX(ItemMaster!R1C1:R31C8, RC7, R4C) -> #NA | I112: =INDEX(ItemMaster!R1C1:R31C8, RC7, R4C) -> #NA | J112: =INDEX(ItemMaster!R1C1:R31C8, RC7, R4C) -> #NA | K112: =INDEX(ItemMaster!R1C1:R31C8, RC7, R4C) -> #NA | L112: =IF(EQUAL(RC[-7], R[-1]C[-7]), R[-1]C, RC[-1])-RC[-8] -> #NA | M112: =IF(RC[-1]>0, 0, MIN(RC[-9], RC[-1]*-1)) -> #NA
B113: 0 | D113: 0 | E113: =IF(RC[-1], IF(ISERROR(RC[-4]), R[-1]C, RC[-4]), "") ->  | F113: =IF(RC[-2], IF(ISERROR(RC[-4]), R[-1]C, RC[-4]), "") ->  | G113: =MATCH(RC[-2], ItemMaster!R1C1:R31C1, 0) -> #NA | H113: =INDEX(ItemMaster!R1C1:R31C8, RC7, R4C) -> #NA | I113: =INDEX(ItemMaster!R1C1:R31C8, RC7, R4C) -> #NA | J113: =INDEX(ItemMaster!R1C1:R31C8, RC7, R4C) -> #NA | K113: =INDEX(ItemMaster!R1C1:R31C8, RC7, R4C) -> #NA | L113: =IF(EQUAL(RC[-7], R[-1]C[-7]), R[-1]C, RC[-1])-RC[-8] -> #NA | M113: =IF(RC[-1]>0, 0, MIN(RC[-9], RC[-1]*-1)) -> #NA
B114: 0 | D114: 0 | E114: =IF(RC[-1], IF(ISERROR(RC[-4]), R[-1]C, RC[-4]), "") ->  | F114: =IF(RC[-2], IF(ISERROR(RC[-4]), R[-1]C, RC[-4]), "") ->  | G114: =MATCH(RC[-2], ItemMaster!R1C1:R31C1, 0) -> #NA | H114: =INDEX(ItemMaster!R1C1:R31C8, RC7, R4C) -> #NA | I114: =INDEX(ItemMaster!R1C1:R31C8, RC7, R4C) -> #NA | J114: =INDEX(ItemMaster!R1C1:R31C8, RC7, R4C) -> #NA | K114: =INDEX(ItemMaster!R1C1:R31C8, RC7, R4C) -> #NA | L114: =IF(EQUAL(RC[-7], R[-1]C[-7]), R[-1]C, RC[-1])-RC[-8] -> #NA | M114: =IF(RC[-1]>0, 0, MIN(RC[-9], RC[-1]*-1)) -> #NA
B115: 0 | D115: 0 | E115: =IF(RC[-1], IF(ISERROR(RC[-4]), R[-1]C, RC[-4]), "") ->  | F115: =IF(RC[-2], IF(ISERROR(RC[-4]), R[-1]C, RC[-4]), "") ->  | G115: =MATCH(RC[-2], ItemMaster!R1C1:R31C1, 0) -> #NA | H115: =INDEX(ItemMaster!R1C1:R31C8, RC7, R4C) -> #NA | I115: =INDEX(ItemMaster!R1C1:R31C8, RC7, R4C) -> #NA | J115: =INDEX(ItemMaster!R1C1:R31C8, RC7, R4C) -> #NA | K115: =INDEX(ItemMaster!R1C1:R31C8, RC7, R4C) -> #NA | L115: =IF(EQUAL(RC[-7], R[-1]C[-7]), R[-1]C, RC[-1])-RC[-8] -> #NA | M115: =IF(RC[-1]>0, 0, MIN(RC[-9], RC[-1]*-1)) -> #NA
B116: 0 | D116: 0 | E116: =IF(RC[-1], IF(ISERROR(RC[-4]), R[-1]C, RC[-4]), "") ->  | F116: =IF(RC[-2], IF(ISERROR(RC[-4]), R[-1]C, RC[-4]), "") ->  | G116: =MATCH(RC[-2], ItemMaster!R1C1:R31C1, 0) -> #NA | H116: =INDEX(ItemMaster!R1C1:R31C8, RC7, R4C) -> #NA | I116: =INDEX(ItemMaster!R1C1:R31C8, RC7, R4C) -> #NA | J116: =INDEX(ItemMaster!R1C1:R31C8, RC7, R4C) -> #NA | K116: =INDEX(ItemMaster!R1C1:R31C8, RC7, R4C) -> #NA | L116: =IF(EQUAL(RC[-7], R[-1]C[-7]), R[-1]C, RC[-1])-RC[-8] -> #NA | M116: =IF(RC[-1]>0, 0, MIN(RC[-9], RC[-1]*-1)) -> #NA
B117: 0 | D117: 0 | E117: =IF(RC[-1], IF(ISERROR(RC[-4]), R[-1]C, RC[-4]), "") ->  | F117: =IF(RC[-2], IF(ISERROR(RC[-4]), R[-1]C, RC[-4]), "") ->  | G117: =MATCH(RC[-2], ItemMaster!R1C1:R31C1, 0) -> #NA | H117: =INDEX(ItemMaster!R1C1:R31C8, RC7, R4C) -> #NA | I117: =INDEX(ItemMaster!R1C1:R31C8, RC7, R4C) -> #NA | J117: =INDEX(ItemMaster!R1C1:R31C8, RC7, R4C) -> #NA | K117: =INDEX(ItemMaster!R1C1:R31C8, RC7, R4C) -> #NA | L117: =IF(EQUAL(RC[-7], R[-1]C[-7]), R[-1]C, RC[-1])-RC[-8] -> #NA | M117: =IF(RC[-1]>0, 0, MIN(RC[-9], RC[-1]*-1)) -> #NA
B118: 0 | D118: 0 | E118: =IF(RC[-1], IF(ISERROR(RC[-4]), R[-1]C, RC[-4]), "") ->  | F118: =IF(RC[-2], IF(ISERROR(RC[-4]), R[-1]C, RC[-4]), "") ->  | G118: =MATCH(RC[-2], ItemMaster!R1C1:R31C1, 0) -> #NA | H118: =INDEX(ItemMaster!R1C1:R31C8, RC7, R4C) -> #NA | I118: =INDEX(ItemMaster!R1C1:R31C8, RC7, R4C) -> #NA | J118: =INDEX(ItemMaster!R1C1:R31C8, RC7, R4C) -> #NA | K118: =INDEX(ItemMaster!R1C1:R31C8, RC7, R4C) -> #NA | L118: =IF(EQUAL(RC[-7], R[-1]C[-7]), R[-1]C, RC[-1])-RC[-8] -> #NA | M118: =IF(RC[-1]>0, 0, MIN(RC[-9], RC[-1]*-1)) -> #NA
B119: 0 | D119: 0 | E119: =IF(RC[-1], IF(ISERROR(RC[-4]), R[-1]C, RC[-4]), "") ->  | F119: =IF(RC[-2], IF(ISERROR(RC[-4]), R[-1]C, RC[-4]), "") ->  | G119: =MATCH(RC[-2], ItemMaster!R1C1:R31C1, 0) -> #NA | H119: =INDEX(ItemMaster!R1C1:R31C8, RC7, R4C) -> #NA | I119: =INDEX(ItemMaster!R1C1:R31C8, RC7, R4C) -> #NA | J119: =INDEX(ItemMaster!R1C1:R31C8, RC7, R4C) -> #NA | K119: =INDEX(ItemMaster!R1C1:R31C8, RC7, R4C) -> #NA | L119: =IF(EQUAL(RC[-7], R[-1]C[-7]), R[-1]C, RC[-1])-RC[-8] -> #NA | M119: =IF(RC[-1]>0, 0, MIN(RC[-9], RC[-1]*-1)) -> #NA
B120: 0 | D120: 0 | E120: =IF(RC[-1], IF(ISERROR(RC[-4]), R[-1]C, RC[-4]), "") ->  | F120: =IF(RC[-2], IF(ISERROR(RC[-4]), R[-1]C, RC[-4]), "") ->  | G120: =MATCH(RC[-2], ItemMaster!R1C1:R31C1, 0) -> #NA | H120: =INDEX(ItemMaster!R1C1:R31C8, RC7, R4C) -> #NA | I120: =INDEX(ItemMaster!R1C1:R31C8, RC7, R4C) -> #NA | J120: =INDEX(ItemMaster!R1C1:R31C8, RC7, R4C) -> #NA | K120: =INDEX(ItemMaster!R1C1:R31C8, RC7, R4C) -> #NA | L120: =IF(EQUAL(RC[-7], R[-1]C[-7]), R[-1]C, RC[-1])-RC[-8] -> #NA | M120: =IF(RC[-1]>0, 0, MIN(RC[-9], RC[-1]*-1)) -> #NA
B121: 0 | D121: 0 | E121: =IF(RC[-1], IF(ISERROR(RC[-4]), R[-1]C, RC[-4]), "") ->  | F121: =IF(RC[-2], IF(ISERROR(RC[-4]), R[-1]C, RC[-4]), "") ->  | G121: =MATCH(RC[-2], ItemMaster!R1C1:R31C1, 0) -> #NA | H121: =INDEX(ItemMaster!R1C1:R31C8, RC7, R4C) -> #NA | I121: =INDEX(ItemMaster!R1C1:R31C8, RC7, R4C) -> #NA | J121: =INDEX(ItemMaster!R1C1:R31C8, RC7, R4C) -> #NA | K121: =INDEX(ItemMaster!R1C1:R31C8, RC7, R4C) -> #NA | L121: =IF(EQUAL(RC[-7], R[-1]C[-7]), R[-1]C, RC[-1])-RC[-8] -> #NA | M121: =IF(RC[-1]>0, 0, MIN(RC[-9], RC[-1]*-1)) -> #NA
B122: 0 | D122: 0 | E122: =IF(RC[-1], IF(ISERROR(RC[-4]), R[-1]C, RC[-4]), "") ->  | F122: =IF(RC[-2], IF(ISERROR(RC[-4]), R[-1]C, RC[-4]), "") ->  | G122: =MATCH(RC[-2], ItemMaster!R1C1:R31C1, 0) -> #NA | H122: =INDEX(ItemMaster!R1C1:R31C8, RC7, R4C) -> #NA | I122: =INDEX(ItemMaster!R1C1:R31C8, RC7, R4C) -> #NA | J122: =INDEX(ItemMaster!R1C1:R31C8, RC7, R4C) -> #NA | K122: =INDEX(ItemMaster!R1C1:R31C8, RC7, R4C) -> #NA | L122: =IF(EQUAL(RC[-7], R[-1]C[-7]), R[-1]C, RC[-1])-RC[-8] -> #NA | M122: =IF(RC[-1]>0, 0, MIN(RC[-9], RC[-1]*-1)) -> #NA
B123: 0 | D123: 0 | E123: =IF(RC[-1], IF(ISERROR(RC[-4]), R[-1]C, RC[-4]), "") ->  | F123: =IF(RC[-2], IF(ISERROR(RC[-4]), R[-1]C, RC[-4]), "") ->  | G123: =MATCH(RC[-2], ItemMaster!R1C1:R31C1, 0) -> #NA | H123: =INDEX(ItemMaster!R1C1:R31C8, RC7, R4C) -> #NA | I123: =INDEX(ItemMaster!R1C1:R31C8, RC7, R4C) -> #NA | J123: =INDEX(ItemMaster!R1C1:R31C8, RC7, R4C) -> #NA | K123: =INDEX(ItemMaster!R1C1:R31C8, RC7, R4C) -> #NA | L123: =IF(EQUAL(RC[-7], R[-1]C[-7]), R[-1]C, RC[-1])-RC[-8] -> #NA | M123: =IF(RC[-1]>0, 0, MIN(RC[-9], RC[-1]*-1)) -> #NA
B124: 0 | D124: 0 | E124: =IF(RC[-1], IF(ISERROR(RC[-4]), R[-1]C, RC[-4]), "") ->  | F124: =IF(RC[-2], IF(ISERROR(RC[-4]), R[-1]C, RC[-4]), "") ->  | G124: =MATCH(RC[-2], ItemMaster!R1C1:R31C1, 0) -> #NA | H124: =INDEX(ItemMaster!R1C1:R31C8, RC7, R4C) -> #NA | I124: =INDEX(ItemMaster!R1C1:R31C8, RC7, R4C) -> #NA | J124: =INDEX(ItemMaster!R1C1:R31C8, RC7, R4C) -> #NA | K124: =INDEX(ItemMaster!R1C1:R31C8, RC7, R4C) -> #NA | L124: =IF(EQUAL(RC[-7], R[-1]C[-7]), R[-1]C, RC[-1])-RC[-8] -> #NA | M124: =IF(RC[-1]>0, 0, MIN(RC[-9], RC[-1]*-1)) -> #NA
B125: 0 | D125: 0 | E125: =IF(RC[-1], IF(ISERROR(RC[-4]), R[-1]C, RC[-4]), "") ->  | F125: =IF(RC[-2], IF(ISERROR(RC[-4]), R[-1]C, RC[-4]), "") ->  | G125: =MATCH(RC[-2], ItemMaster!R1C1:R31C1, 0) -> #NA | H125: =INDEX(ItemMaster!R1C1:R31C8, RC7, R4C) -> #NA | I125: =INDEX(ItemMaster!R1C1:R31C8, RC7, R4C) -> #NA | J125: =INDEX(ItemMaster!R1C1:R31C8, RC7, R4C) -> #NA | K125: =INDEX(ItemMaster!R1C1:R31C8, RC7, R4C) -> #NA | L125: =IF(EQUAL(RC[-7], R[-1]C[-7]), R[-1]C, RC[-1])-RC[-8] -> #NA | M125: =IF(RC[-1]>0, 0, MIN(RC[-9], RC[-1]*-1)) -> #NA
B126: 0 | D126: 0 | E126: =IF(RC[-1], IF(ISERROR(RC[-4]), R[-1]C, RC[-4]), "") ->  | F126: =IF(RC[-2], IF(ISERROR(RC[-4]), R[-1]C, RC[-4]), "") ->  | G126: =MATCH(RC[-2], ItemMaster!R1C1:R31C1, 0) -> #NA | H126: =INDEX(ItemMaster!R1C1:R31C8, RC7, R4C) -> #NA | I126: =INDEX(ItemMaster!R1C1:R31C8, RC7, R4C) -> #NA | J126: =INDEX(ItemMaster!R1C1:R31C8, RC7, R4C) -> #NA | K126: =INDEX(ItemMaster!R1C1:R31C8, RC7, R4C) -> #NA | L126: =IF(EQUAL(RC[-7], R[-1]C[-7]), R[-1]C, RC[-1])-RC[-8] -> #NA | M126: =IF(RC[-1]>0, 0, MIN(RC[-9], RC[-1]*-1)) -> #NA
B127: 0 | D127: 0 | E127: =IF(RC[-1], IF(ISERROR(RC[-4]), R[-1]C, RC[-4]), "") ->  | F127: =IF(RC[-2], IF(ISERROR(RC[-4]), R[-1]C, RC[-4]), "") ->  | G127: =MATCH(RC[-2], ItemMaster!R1C1:R31C1, 0) -> #NA | H127: =INDEX(ItemMaster!R1C1:R31C8, RC7, R4C) -> #NA | I127: =INDEX(ItemMaster!R1C1:R31C8, RC7, R4C) -> #NA | J127: =INDEX(ItemMaster!R1C1:R31C8, RC7, R4C) -> #NA | K127: =INDEX(ItemMaster!R1C1:R31C8, RC7, R4C) -> #NA | L127: =IF(EQUAL(RC[-7], R[-1]C[-7]), R[-1]C, RC[-1])-RC[-8] -> #NA | M127: =IF(RC[-1]>0, 0, MIN(RC[-9], RC[-1]*-1)) -> #NA
B128: 0 | D128: 0 | E128: =IF(RC[-1], IF(ISERROR(RC[-4]), R[-1]C, RC[-4]), "") ->  | F128: =IF(RC[-2], IF(ISERROR(RC[-4]), R[-1]C, RC[-4]), "") ->  | G128: =MATCH(RC[-2], ItemMaster!R1C1:R31C1, 0) -> #NA | H128: =INDEX(ItemMaster!R1C1:R31C8, RC7, R4C) -> #NA | I128: =INDEX(ItemMaster!R1C1:R31C8, RC7, R4C) -> #NA | J128: =INDEX(ItemMaster!R1C1:R31C8, RC7, R4C) -> #NA | K128: =INDEX(ItemMaster!R1C1:R31C8, RC7, R4C) -> #NA | L128: =IF(EQUAL(RC[-7], R[-1]C[-7]), R[-1]C, RC[-1])-RC[-8] -> #NA | M128: =IF(RC[-1]>0, 0, MIN(RC[-9], RC[-1]*-1)) -> #NA
B129: 0 | D129: 0 | E129: =IF(RC[-1], IF(ISERROR(RC[-4]), R[-1]C, RC[-4]), "") ->  | F129: =IF(RC[-2], IF(ISERROR(RC[-4]), R[-1]C, RC[-4]), "") ->  | G129: =MATCH(RC[-2], ItemMaster!R1C1:R31C1, 0) -> #NA | H129: =INDEX(ItemMaster!R1C1:R31C8, RC7, R4C) -> #NA | I129: =INDEX(ItemMaster!R1C1:R31C8, RC7, R4C) -> #NA | J129: =INDEX(ItemMaster!R1C1:R31C8, RC7, R4C) -> #NA | K129: =INDEX(ItemMaster!R1C1:R31C8, RC7, R4C) -> #NA | L129: =IF(EQUAL(RC[-7], R[-1]C[-7]), R[-1]C, RC[-1])-RC[-8] -> #NA | M129: =IF(RC[-1]>0, 0, MIN(RC[-9], RC[-1]*-1)) -> #NA
B130: 0 | D130: 0 | E130: =IF(RC[-1], IF(ISERROR(RC[-4]), R[-1]C, RC[-4]), "") ->  | F130: =IF(RC[-2], IF(ISERROR(RC[-4]), R[-1]C, RC[-4]), "") ->  | G130: =MATCH(RC[-2], ItemMaster!R1C1:R31C1, 0) -> #NA | H130: =INDEX(ItemMaster!R1C1:R31C8, RC7, R4C) -> #NA | I130: =INDEX(ItemMaster!R1C1:R31C8, RC7, R4C) -> #NA | J130: =INDEX(ItemMaster!R1C1:R31C8, RC7, R4C) -> #NA | K130: =INDEX(ItemMaster!R1C1:R31C8, RC7, R4C) -> #NA | L130: =IF(EQUAL(RC[-7], R[-1]C[-7]), R[-1]C, RC[-1])-RC[-8] -> #NA | M130: =IF(RC[-1]>0, 0, MIN(RC[-9], RC[-1]*-1)) -> #NA
B131: 0 | D131: 0 | E131: =IF(RC[-1], IF(ISERROR(RC[-4]), R[-1]C, RC[-4]), "") ->  | F131: =IF(RC[-2], IF(ISERROR(RC[-4]), R[-1]C, RC[-4]), "") ->  | G131: =MATCH(RC[-2], ItemMaster!R1C1:R31C1, 0) -> #NA | H131: =INDEX(ItemMaster!R1C1:R31C8, RC7, R4C) -> #NA | I131: =INDEX(ItemMaster!R1C1:R31C8, RC7, R4C) -> #NA | J131: =INDEX(ItemMaster!R1C1:R31C8, RC7, R4C) -> #NA | K131: =INDEX(ItemMaster!R1C1:R31C8, RC7, R4C) -> #NA | L131: =IF(EQUAL(RC[-7], R[-1]C[-7]), R[-1]C, RC[-1])-RC[-8] -> #NA | M131: =IF(RC[-1]>0, 0, MIN(RC[-9], RC[-1]*-1)) -> #NA
B132: 0 | D132: 0 | E132: =IF(RC[-1], IF(ISERROR(RC[-4]), R[-1]C, RC[-4]), "") ->  | F132: =IF(RC[-2], IF(ISERROR(RC[-4]), R[-1]C, RC[-4]), "") ->  | G132: =MATCH(RC[-2], ItemMaster!R1C1:R31C1, 0) -> #NA | H132: =INDEX(ItemMaster!R1C1:R31C8, RC7, R4C) -> #NA | I132: =INDEX(ItemMaster!R1C1:R31C8, RC7, R4C) -> #NA | J132: =INDEX(ItemMaster!R1C1:R31C8, RC7, R4C) -> #NA | K132: =INDEX(ItemMaster!R1C1:R31C8, RC7, R4C) -> #NA | L132: =IF(EQUAL(RC[-7], R[-1]C[-7]), R[-1]C, RC[-1])-RC[-8] -> #NA | M132: =IF(RC[-1]>0, 0, MIN(RC[-9], RC[-1]*-1)) -> #NA
B133: 0 | D133: 0 | E133: =IF(RC[-1], IF(ISERROR(RC[-4]), R[-1]C, RC[-4]), "") ->  | F133: =IF(RC[-2], IF(ISERROR(RC[-4]), R[-1]C, RC[-4]), "") ->  | G133: =MATCH(RC[-2], ItemMaster!R1C1:R31C1, 0) -> #NA | H133: =INDEX(ItemMaster!R1C1:R31C8, RC7, R4C) -> #NA | I133: =INDEX(ItemMaster!R1C1:R31C8, RC7, R4C) -> #NA | J133: =INDEX(ItemMaster!R1C1:R31C8, RC7, R4C) -> #NA | K133: =INDEX(ItemMaster!R1C1:R31C8, RC7, R4C) -> #NA | L133: =IF(EQUAL(RC[-7], R[-1]C[-7]), R[-1]C, RC[-1])-RC[-8] -> #NA | M133: =IF(RC[-1]>0, 0, MIN(RC[-9], RC[-1]*-1)) -> #NA
B134: 0 | D134: 0 | E134: =IF(RC[-1], IF(ISERROR(RC[-4]), R[-1]C, RC[-4]), "") ->  | F134: =IF(RC[-2], IF(ISERROR(RC[-4]), R[-1]C, RC[-4]), "") ->  | G134: =MATCH(RC[-2], ItemMaster!R1C1:R31C1, 0) -> #NA | H134: =INDEX(ItemMaster!R1C1:R31C8, RC7, R4C) -> #NA | I134: =INDEX(ItemMaster!R1C1:R31C8, RC7, R4C) -> #NA | J134: =INDEX(ItemMaster!R1C1:R31C8, RC7, R4C) -> #NA | K134: =INDEX(ItemMaster!R1C1:R31C8, RC7, R4C) -> #NA | L134: =IF(EQUAL(RC[-7], R[-1]C[-7]), R[-1]C, RC[-1])-RC[-8] -> #NA | M134: =IF(RC[-1]>0, 0, MIN(RC[-9], RC[-1]*-1)) -> #NA
B135: 0 | D135: 0 | E135: =IF(RC[-1], IF(ISERROR(RC[-4]), R[-1]C, RC[-4]), "") ->  | F135: =IF(RC[-2], IF(ISERROR(RC[-4]), R[-1]C, RC[-4]), "") ->  | G135: =MATCH(RC[-2], ItemMaster!R1C1:R31C1, 0) -> #NA | H135: =INDEX(ItemMaster!R1C1:R31C8, RC7, R4C) -> #NA | I135: =INDEX(ItemMaster!R1C1:R31C8, RC7, R4C) -> #NA | J135: =INDEX(ItemMaster!R1C1:R31C8, RC7, R4C) -> #NA | K135: =INDEX(ItemMaster!R1C1:R31C8, RC7, R4C) -> #NA | L135: =IF(EQUAL(RC[-7], R[-1]C[-7]), R[-1]C, RC[-1])-RC[-8] -> #NA | M135: =IF(RC[-1]>0, 0, MIN(RC[-9], RC[-1]*-1)) -> #NA
B136: 0 | D136: 0 | E136: =IF(RC[-1], IF(ISERROR(RC[-4]), R[-1]C, RC[-4]), "") ->  | F136: =IF(RC[-2], IF(ISERROR(RC[-4]), R[-1]C, RC[-4]), "") ->  | G136: =MATCH(RC[-2], ItemMaster!R1C1:R31C1, 0) -> #NA | H136: =INDEX(ItemMaster!R1C1:R31C8, RC7, R4C) -> #NA | I136: =INDEX(ItemMaster!R1C1:R31C8, RC7, R4C) -> #NA | J136: =INDEX(ItemMaster!R1C1:R31C8, RC7, R4C) -> #NA | K136: =INDEX(ItemMaster!R1C1:R31C8, RC7, R4C) -> #NA | L136: =IF(EQUAL(RC[-7], R[-1]C[-7]), R[-1]C, RC[-1])-RC[-8] -> #NA | M136: =IF(RC[-1]>0, 0, MIN(RC[-9], RC[-1]*-1)) -> #NA
B137: 0 | D137: 0 | E137: =IF(RC[-1], IF(ISERROR(RC[-4]), R[-1]C, RC[-4]), "") ->  | F137: =IF(RC[-2], IF(ISERROR(RC[-4]), R[-1]C, RC[-4]), "") ->  | G137: =MATCH(RC[-2], ItemMaster!R1C1:R31C1, 0) -> #NA | H137: =INDEX(ItemMaster!R1C1:R31C8, RC7, R4C) -> #NA | I137: =INDEX(ItemMaster!R1C1:R31C8, RC7, R4C) -> #NA | J137: =INDEX(ItemMaster!R1C1:R31C8, RC7, R4C) -> #NA | K137: =INDEX(ItemMaster!R1C1:R31C8, RC7, R4C) -> #NA | L137: =IF(EQUAL(RC[-7], R[-1]C[-7]), R[-1]C, RC[-1])-RC[-8] -> #NA | M137: =IF(RC[-1]>0, 0, MIN(RC[-9], RC[-1]*-1)) -> #NA
B138: 0 | D138: 0 | E138: =IF(RC[-1], IF(ISERROR(RC[-4]), R[-1]C, RC[-4]), "") ->  | F138: =IF(RC[-2], IF(ISERROR(RC[-4]), R[-1]C, RC[-4]), "") ->  | G138: =MATCH(RC[-2], ItemMaster!R1C1:R31C1, 0) -> #NA | H138: =INDEX(ItemMaster!R1C1:R31C8, RC7, R4C) -> #NA | I138: =INDEX(ItemMaster!R1C1:R31C8, RC7, R4C) -> #NA | J138: =INDEX(ItemMaster!R1C1:R31C8, RC7, R4C) -> #NA | K138: =INDEX(ItemMaster!R1C1:R31C8, RC7, R4C) -> #NA | L138: =IF(EQUAL(RC[-7], R[-1]C[-7]), R[-1]C, RC[-1])-RC[-8] -> #NA | M138: =IF(RC[-1]>0, 0, MIN(RC[-9], RC[-1]*-1)) -> #NA
B139: 0 | D139: 0 | E139: =IF(RC[-1], IF(ISERROR(RC[-4]), R[-1]C, RC[-4]), "") ->  | F139: =IF(RC[-2], IF(ISERROR(RC[-4]), R[-1]C, RC[-4]), "") ->  | G139: =MATCH(RC[-2], ItemMaster!R1C1:R31C1, 0) -> #NA | H139: =INDEX(ItemMaster!R1C1:R31C8, RC7, R4C) -> #NA | I139: =INDEX(ItemMaster!R1C1:R31C8, RC7, R4C) -> #NA | J139: =INDEX(ItemMaster!R1C1:R31C8, RC7, R4C) -> #NA | K139: =INDEX(ItemMaster!R1C1:R31C8, RC7, R4C) -> #NA | L139: =IF(EQUAL(RC[-7], R[-1]C[-7]), R[-1]C, RC[-1])-RC[-8] -> #NA | M139: =IF(RC[-1]>0, 0, MIN(RC[-9], RC[-1]*-1)) -> #NA
B140: 0 | D140: 0 | E140: =IF(RC[-1], IF(ISERROR(RC[-4]), R[-1]C, RC[-4]), "") ->  | F140: =IF(RC[-2], IF(ISERROR(RC[-4]), R[-1]C, RC[-4]), "") ->  | G140: =MATCH(RC[-2], ItemMaster!R1C1:R31C1, 0) -> #NA | H140: =INDEX(ItemMaster!R1C1:R31C8, RC7, R4C) -> #NA | I140: =INDEX(ItemMaster!R1C1:R31C8, RC7, R4C) -> #NA | J140: =INDEX(ItemMaster!R1C1:R31C8, RC7, R4C) -> #NA | K140: =INDEX(ItemMaster!R1C1:R31C8, RC7, R4C) -> #NA | L140: =IF(EQUAL(RC[-7], R[-1]C[-7]), R[-1]C, RC[-1])-RC[-8] -> #NA | M140: =IF(RC[-1]>0, 0, MIN(RC[-9], RC[-1]*-1)) -> #NA
B141: 0 | D141: 0 | E141: =IF(RC[-1], IF(ISERROR(RC[-4]), R[-1]C, RC[-4]), "") ->  | F141: =IF(RC[-2], IF(ISERROR(RC[-4]), R[-1]C, RC[-4]), "") ->  | G141: =MATCH(RC[-2], ItemMaster!R1C1:R31C1, 0) -> #NA | H141: =INDEX(ItemMaster!R1C1:R31C8, RC7, R4C) -> #NA | I141: =INDEX(ItemMaster!R1C1:R31C8, RC7, R4C) -> #NA | J141: =INDEX(ItemMaster!R1C1:R31C8, RC7, R4C) -> #NA | K141: =INDEX(ItemMaster!R1C1:R31C8, RC7, R4C) -> #NA | L141: =IF(EQUAL(RC[-7], R[-1]C[-7]), R[-1]C, RC[-1])-RC[-8] -> #NA | M141: =IF(RC[-1]>0, 0, MIN(RC[-9], RC[-1]*-1)) -> #NA
B142: 0 | D142: 0 | E142: =IF(RC[-1], IF(ISERROR(RC[-4]), R[-1]C, RC[-4]), "") ->  | F142: =IF(RC[-2], IF(ISERROR(RC[-4]), R[-1]C, RC[-4]), "") ->  | G142: =MATCH(RC[-2], ItemMaster!R1C1:R31C1, 0) -> #NA | H142: =INDEX(ItemMaster!R1C1:R31C8, RC7, R4C) -> #NA | I142: =INDEX(ItemMaster!R1C1:R31C8, RC7, R4C) -> #NA | J142: =INDEX(ItemMaster!R1C1:R31C8, RC7, R4C) -> #NA | K142: =INDEX(ItemMaster!R1C1:R31C8, RC7, R4C) -> #NA | L142: =IF(EQUAL(RC[-7], R[-1]C[-7]), R[-1]C, RC[-1])-RC[-8] -> #NA | M142: =IF(RC[-1]>0, 0, MIN(RC[-9], RC[-1]*-1)) -> #NA
B143: 0 | D143: 0 | E143: =IF(RC[-1], IF(ISERROR(RC[-4]), R[-1]C, RC[-4]), "") ->  | F143: =IF(RC[-2], IF(ISERROR(RC[-4]), R[-1]C, RC[-4]), "") ->  | G143: =MATCH(RC[-2], ItemMaster!R1C1:R31C1, 0) -> #NA | H143: =INDEX(ItemMaster!R1C1:R31C8, RC7, R4C) -> #NA | I143: =INDEX(ItemMaster!R1C1:R31C8, RC7, R4C) -> #NA | J143: =INDEX(ItemMaster!R1C1:R31C8, RC7, R4C) -> #NA | K143: =INDEX(ItemMaster!R1C1:R31C8, RC7, R4C) -> #NA | L143: =IF(EQUAL(RC[-7], R[-1]C[-7]), R[-1]C, RC[-1])-RC[-8] -> #NA | M143: =IF(RC[-1]>0, 0, MIN(RC[-9], RC[-1]*-1)) -> #NA
B144: 0 | D144: 0 | E144: =IF(RC[-1], IF(ISERROR(RC[-4]), R[-1]C, RC[-4]), "") ->  | F144: =IF(RC[-2], IF(ISERROR(RC[-4]), R[-1]C, RC[-4]), "") ->  | G144: =MATCH(RC[-2], ItemMaster!R1C1:R31C1, 0) -> #NA | H144: =INDEX(ItemMaster!R1C1:R31C8, RC7, R4C) -> #NA | I144: =INDEX(ItemMaster!R1C1:R31C8, RC7, R4C) -> #NA | J144: =INDEX(ItemMaster!R1C1:R31C8, RC7, R4C) -> #NA | K144: =INDEX(ItemMaster!R1C1:R31C8, RC7, R4C) -> #NA | L144: =IF(EQUAL(RC[-7], R[-1]C[-7]), R[-1]C, RC[-1])-RC[-8] -> #NA | M144: =IF(RC[-1]>0, 0, MIN(RC[-9], RC[-1]*-1)) -> #NA
B145: 0 | D145: 0 | E145: =IF(RC[-1], IF(ISERROR(RC[-4]), R[-1]C, RC[-4]), "") ->  | F145: =IF(RC[-2], IF(ISERROR(RC[-4]), R[-1]C, RC[-4]), "") ->  | G145: =MATCH(RC[-2], ItemMaster!R1C1:R31C1, 0) -> #NA | H145: =INDEX(ItemMaster!R1C1:R31C8, RC7, R4C) -> #NA | I145: =INDEX(ItemMaster!R1C1:R31C8, RC7, R4C) -> #NA | J145: =INDEX(ItemMaster!R1C1:R31C8, RC7, R4C) -> #NA | K145: =INDEX(ItemMaster!R1C1:R31C8, RC7, R4C) -> #NA | L145: =IF(EQUAL(RC[-7], R[-1]C[-7]), R[-1]C, RC[-1])-RC[-8] -> #NA | M145: =IF(RC[-1]>0, 0, MIN(RC[-9], RC[-1]*-1)) -> #NA
B146: 0 | D146: 0 | E146: =IF(RC[-1], IF(ISERROR(RC[-4]), R[-1]C, RC[-4]), "") ->  | F146: =IF(RC[-2], IF(ISERROR(RC[-4]), R[-1]C, RC[-4]), "") ->  | G146: =MATCH(RC[-2], ItemMaster!R1C1:R31C1, 0) -> #NA | H146: =INDEX(ItemMaster!R1C1:R31C8, RC7, R4C) -> #NA | I146: =INDEX(ItemMaster!R1C1:R31C8, RC7, R4C) -> #NA | J146: =INDEX(ItemMaster!R1C1:R31C8, RC7, R4C) -> #NA | K146: =INDEX(ItemMaster!R1C1:R31C8, RC7, R4C) -> #NA | L146: =IF(EQUAL(RC[-7], R[-1]C[-7]), R[-1]C, RC[-1])-RC[-8] -> #NA | M146: =IF(RC[-1]>0, 0, MIN(RC[-9], RC[-1]*-1)) -> #NA
B147: 0 | D147: 0 | E147: =IF(RC[-1], IF(ISERROR(RC[-4]), R[-1]C, RC[-4]), "") ->  | F147: =IF(RC[-2], IF(ISERROR(RC[-4]), R[-1]C, RC[-4]), "") ->  | G147: =MATCH(RC[-2], ItemMaster!R1C1:R31C1, 0) -> #NA | H147: =INDEX(ItemMaster!R1C1:R31C8, RC7, R4C) -> #NA | I147: =INDEX(ItemMaster!R1C1:R31C8, RC7, R4C) -> #NA | J147: =INDEX(ItemMaster!R1C1:R31C8, RC7, R4C) -> #NA | K147: =INDEX(ItemMaster!R1C1:R31C8, RC7, R4C) -> #NA | L147: =IF(EQUAL(RC[-7], R[-1]C[-7]), R[-1]C, RC[-1])-RC[-8] -> #NA | M147: =IF(RC[-1]>0, 0, MIN(RC[-9], RC[-1]*-1)) -> #NA
B148: 0 | D148: 0 | E148: =IF(RC[-1], IF(ISERROR(RC[-4]), R[-1]C, RC[-4]), "") ->  | F148: =IF(RC[-2], IF(ISERROR(RC[-4]), R[-1]C, RC[-4]), "") ->  | G148: =MATCH(RC[-2], ItemMaster!R1C1:R31C1, 0) -> #NA | H148: =INDEX(ItemMaster!R1C1:R31C8, RC7, R4C) -> #NA | I148: =INDEX(ItemMaster!R1C1:R31C8, RC7, R4C) -> #NA | J148: =INDEX(ItemMaster!R1C1:R31C8, RC7, R4C) -> #NA | K148: =INDEX(ItemMaster!R1C1:R31C8, RC7, R4C) -> #NA | L148: =IF(EQUAL(RC[-7], R[-1]C[-7]), R[-1]C, RC[-1])-RC[-8] -> #NA | M148: =IF(RC[-1]>0, 0, MIN(RC[-9], RC[-1]*-1)) -> #NA
B149: 0 | D149: 0 | E149: =IF(RC[-1], IF(ISERROR(RC[-4]), R[-1]C, RC[-4]), "") ->  | F149: =IF(RC[-2], IF(ISERROR(RC[-4]), R[-1]C, RC[-4]), "") ->  | G149: =MATCH(RC[-2], ItemMaster!R1C1:R31C1, 0) -> #NA | H149: =INDEX(ItemMaster!R1C1:R31C8, RC7, R4C) -> #NA | I149: =INDEX(ItemMaster!R1C1:R31C8, RC7, R4C) -> #NA | J149: =INDEX(ItemMaster!R1C1:R31C8, RC7, R4C) -> #NA | K149: =INDEX(ItemMaster!R1C1:R31C8, RC7, R4C) -> #NA | L149: =IF(EQUAL(RC[-7], R[-1]C[-7]), R[-1]C, RC[-1])-RC[-8] -> #NA | M149: =IF(RC[-1]>0, 0, MIN(RC[-9], RC[-1]*-1)) -> #NA
E150: =PurchaseOrders!R[-143]C[-4]:R[-93]C[-4] -> #REF! | F150: =PurchaseOrders!R[-143]C:R[-93]C -> #REF! | H150: =PurchaseOrders!R[-143]C[-6]:R[-93]C[-4] -> #REF! | I150: =PurchaseOrders!R[-143]C[-6]:R[-93]C[-4] -> #REF! | J150: =PurchaseOrders!R[-143]C[-6]:R[-93]C[-4] -> #REF! | N150: =PurchaseOrders!R[-143]C[-9]:R[-93]C[-9] -> #REF!
E151: =PurchaseOrders!R[-143]C[-4]:R[-93]C[-4] -> #REF! | F151: =PurchaseOrders!R[-143]C:R[-93]C -> #REF! | H151: =PurchaseOrders!R[-143]C[-6]:R[-93]C[-4] -> #REF! | I151: =PurchaseOrders!R[-143]C[-6]:R[-93]C[-4] -> #REF! | J151: =PurchaseOrders!R[-143]C[-6]:R[-93]C[-4] -> #REF! | N151: =PurchaseOrders!R[-143]C[-9]:R[-93]C[-9] -> #REF!
E152: =PurchaseOrders!R[-143]C[-4]:R[-93]C[-4] -> #REF! | F152: =PurchaseOrders!R[-143]C:R[-93]C -> #REF! | H152: =PurchaseOrders!R[-143]C[-6]:R[-93]C[-4] -> #REF! | I152: =PurchaseOrders!R[-143]C[-6]:R[-93]C[-4] -> #REF! | J152: =PurchaseOrders!R[-143]C[-6]:R[-93]C[-4] -> #REF! | N152: =PurchaseOrders!R[-143]C[-9]:R[-93]C[-9] -> #REF!
E153: =PurchaseOrders!R[-143]C[-4]:R[-93]C[-4] -> #REF! | F153: =PurchaseOrders!R[-143]C:R[-93]C -> #REF! | H153: =PurchaseOrders!R[-143]C[-6]:R[-93]C[-4] -> #REF! | I153: =PurchaseOrders!R[-143]C[-6]:R[-93]C[-4] -> #REF! | J153: =PurchaseOrders!R[-143]C[-6]:R[-93]C[-4] -> #REF! | N153: =PurchaseOrders!R[-143]C[-9]:R[-93]C[-9] -> #REF!
E154: =PurchaseOrders!R[-143]C[-4]:R[-93]C[-4] -> #REF! | F154: =PurchaseOrders!R[-143]C:R[-93]C -> #REF! | H154: =PurchaseOrders!R[-143]C[-6]:R[-93]C[-4] -> #REF! | I154: =PurchaseOrders!R[-143]C[-6]:R[-93]C[-4] -> #REF! | J154: =PurchaseOrders!R[-143]C[-6]:R[-93]C[-4] -> #REF! | N154: =PurchaseOrders!R[-143]C[-9]:R[-93]C[-9] -> #REF!
E155: =PurchaseOrders!R[-143]C[-4]:R[-93]C[-4] -> #REF! | F155: =PurchaseOrders!R[-143]C:R[-93]C -> #REF! | H155: =PurchaseOrders!R[-143]C[-6]:R[-93]C[-4] -> #REF! | I155: =PurchaseOrders!R[-143]C[-6]:R[-93]C[-4] -> #REF! | J155: =PurchaseOrders!R[-143]C[-6]:R[-93]C[-4] -> #REF! | N155: =PurchaseOrders!R[-143]C[-9]:R[-93]C[-9] -> #REF!
E156: =PurchaseOrders!R[-143]C[-4]:R[-93]C[-4] -> #REF! | F156: =PurchaseOrders!R[-143]C:R[-93]C -> #REF! | H156: =PurchaseOrders!R[-143]C[-6]:R[-93]C[-4] -> #REF! | I156: =PurchaseOrders!R[-143]C[-6]:R[-93]C[-4] -> #REF! | J156: =PurchaseOrders!R[-143]C[-6]:R[-93]C[-4] -> #REF! | N156: =PurchaseOrders!R[-143]C[-9]:R[-93]C[-9] -> #REF!
E157: =PurchaseOrders!R[-143]C[-4]:R[-93]C[-4] -> #REF! | F157: =PurchaseOrders!R[-143]C:R[-93]C -> #REF! | H157: =PurchaseOrders!R[-143]C[-6]:R[-93]C[-4] -> #REF! | I157: =PurchaseOrders!R[-143]C[-6]:R[-93]C[-4] -> #REF! | J157: =PurchaseOrders!R[-143]C[-6]:R[-93]C[-4] -> #REF! | N157: =PurchaseOrders!R[-143]C[-9]:R[-93]C[-9] -> #REF!
E158: =PurchaseOrders!R[-143]C[-4]:R[-93]C[-4] -> #REF! | F158: =PurchaseOrders!R[-143]C:R[-93]C -> #REF! | H158: =PurchaseOrders!R[-143]C[-6]:R[-93]C[-4] -> #REF! | I158: =PurchaseOrders!R[-143]C[-6]:R[-93]C[-4] -> #REF! | J158: =PurchaseOrders!R[-143]C[-6]:R[-93]C[-4] -> #REF! | N158: =PurchaseOrders!R[-143]C[-9]:R[-93]C[-9] -> #REF!
E159: =PurchaseOrders!R[-143]C[-4]:R[-93]C[-4] -> #REF! | F159: =PurchaseOrders!R[-143]C:R[-93]C -> #REF! | H159: =PurchaseOrders!R[-143]C[-6]:R[-93]C[-4] -> #REF! | I159: =PurchaseOrders!R[-143]C[-6]:R[-93]C[-4] -> #REF! | J159: =PurchaseOrders!R[-143]C[-6]:R[-93]C[-4] -> #REF! | N159: =PurchaseOrders!R[-143]C[-9]:R[-93]C[-9] -> #REF!
E160: =PurchaseOrders!R[-143]C[-4]:R[-93]C[-4] -> #REF! | F160: =PurchaseOrders!R[-143]C:R[-93]C -> #REF! | H160: =PurchaseOrders!R[-143]C[-6]:R[-93]C[-4] -> #REF! | I160: =PurchaseOrders!R[-143]C[-6]:R[-93]C[-4] -> #REF! | J160: =PurchaseOrders!R[-143]C[-6]:R[-93]C[-4] -> #REF! | N160: =PurchaseOrders!R[-143]C[-9]:R[-93]C[-9] -> #REF!
E161: =PurchaseOrders!R[-143]C[-4]:R[-93]C[-4] -> #REF! | F161: =PurchaseOrders!R[-143]C:R[-93]C -> #REF! | H161: =PurchaseOrders!R[-143]C[-6]:R[-93]C[-4] -> #REF! | I161: =PurchaseOrders!R[-143]C[-6]:R[-93]C[-4] -> #REF! | J161: =PurchaseOrders!R[-143]C[-6]:R[-93]C[-4] -> #REF! | N161: =PurchaseOrders!R[-143]C[-9]:R[-93]C[-9] -> #REF!
E162: =PurchaseOrders!R[-143]C[-4]:R[-93]C[-4] -> #REF! | F162: =PurchaseOrders!R[-143]C:R[-93]C -> #REF! | H162: =PurchaseOrders!R[-143]C[-6]:R[-93]C[-4] -> #REF! | I162: =PurchaseOrders!R[-143]C[-6]:R[-93]C[-4] -> #REF! | J162: =PurchaseOrders!R[-143]C[-6]:R[-93]C[-4] -> #REF! | N162: =PurchaseOrders!R[-143]C[-9]:R[-93]C[-9] -> #REF!
E163: =PurchaseOrders!R[-143]C[-4]:R[-93]C[-4] -> #REF! | F163: =PurchaseOrders!R[-143]C:R[-93]C -> #REF! | H163: =PurchaseOrders!R[-143]C[-6]:R[-93]C[-4] -> #REF! | I163: =PurchaseOrders!R[-143]C[-6]:R[-93]C[-4] -> #REF! | J163: =PurchaseOrders!R[-143]C[-6]:R[-93]C[-4] -> #REF! | N163: =PurchaseOrders!R[-143]C[-9]:R[-93]C[-9] -> #REF!
E164: =PurchaseOrders!R[-143]C[-4]:R[-93]C[-4] -> #REF! | F164: =PurchaseOrders!R[-143]C:R[-93]C -> #REF! | H164: =PurchaseOrders!R[-143]C[-6]:R[-93]C[-4] -> #REF! | I164: =PurchaseOrders!R[-143]C[-6]:R[-93]C[-4] -> #REF! | J164: =PurchaseOrders!R[-143]C[-6]:R[-93]C[-4] -> #REF! | N164: =PurchaseOrders!R[-143]C[-9]:R[-93]C[-9] -> #REF!
E165: =PurchaseOrders!R[-143]C[-4]:R[-93]C[-4] -> #REF! | F165: =PurchaseOrders!R[-143]C:R[-93]C -> #REF! | H165: =PurchaseOrders!R[-143]C[-6]:R[-93]C[-4] -> #REF! | I165: =PurchaseOrders!R[-143]C[-6]:R[-93]C[-4] -> #REF! | J165: =PurchaseOrders!R[-143]C[-6]:R[-93]C[-4] -> #REF! | N165: =PurchaseOrders!R[-143]C[-9]:R[-93]C[-9] -> #REF!
E166: =PurchaseOrders!R[-143]C[-4]:R[-93]C[-4] -> #REF! | F166: =PurchaseOrders!R[-143]C:R[-93]C -> #REF! | H166: =PurchaseOrders!R[-143]C[-6]:R[-93]C[-4] -> #REF! | I166: =PurchaseOrders!R[-143]C[-6]:R[-93]C[-4] -> #REF! | J166: =PurchaseOrders!R[-143]C[-6]:R[-93]C[-4] -> #REF! | N166: =PurchaseOrders!R[-143]C[-9]:R[-93]C[-9] -> #REF!
E167: =PurchaseOrders!R[-143]C[-4]:R[-93]C[-4] -> #REF! | F167: =PurchaseOrders!R[-143]C:R[-93]C -> #REF! | H167: =PurchaseOrders!R[-143]C[-6]:R[-93]C[-4] -> #REF! | I167: =PurchaseOrders!R[-143]C[-6]:R[-93]C[-4] -> #REF! | J167: =PurchaseOrders!R[-143]C[-6]:R[-93]C[-4] -> #REF! | N167: =PurchaseOrders!R[-143]C[-9]:R[-93]C[-9] -> #REF!
E168: =PurchaseOrders!R[-143]C[-4]:R[-93]C[-4] -> #REF! | F168: =PurchaseOrders!R[-143]C:R[-93]C -> #REF! | H168: =PurchaseOrders!R[-143]C[-6]:R[-93]C[-4] -> #REF! | I168: =PurchaseOrders!R[-143]C[-6]:R[-93]C[-4] -> #REF! | J168: =PurchaseOrders!R[-143]C[-6]:R[-93]C[-4] -> #REF! | N168: =PurchaseOrders!R[-143]C[-9]:R[-93]C[-9] -> #REF!
E169: =PurchaseOrders!R[-143]C[-4]:R[-93]C[-4] -> #REF! | F169: =PurchaseOrders!R[-143]C:R[-93]C -> #REF! | H169: =PurchaseOrders!R[-143]C[-6]:R[-93]C[-4] -> #REF! | I169: =PurchaseOrders!R[-143]C[-6]:R[-93]C[-4] -> #REF! | J169: =PurchaseOrders!R[-143]C[-6]:R[-93]C[-4] -> #REF! | N169: =PurchaseOrders!R[-143]C[-9]:R[-93]C[-9] -> #REF!
E170: =PurchaseOrders!R[-143]C[-4]:R[-93]C[-4] -> #REF! | F170: =PurchaseOrders!R[-143]C:R[-93]C -> #REF! | H170: =PurchaseOrders!R[-143]C[-6]:R[-93]C[-4] -> #REF! | I170: =PurchaseOrders!R[-143]C[-6]:R[-93]C[-4] -> #REF! | J170: =PurchaseOrders!R[-143]C[-6]:R[-93]C[-4] -> #REF! | N170: =PurchaseOrders!R[-143]C[-9]:R[-93]C[-9] -> #REF!
E171: =PurchaseOrders!R[-143]C[-4]:R[-93]C[-4] -> #REF! | F171: =PurchaseOrders!R[-143]C:R[-93]C -> #REF! | H171: =PurchaseOrders!R[-143]C[-6]:R[-93]C[-4] -> #REF! | I171: =PurchaseOrders!R[-143]C[-6]:R[-93]C[-4] -> #REF! | J171: =PurchaseOrders!R[-143]C[-6]:R[-93]C[-4] -> #REF! | N171: =PurchaseOrders!R[-143]C[-9]:R[-93]C[-9] -> #REF!
E172: =PurchaseOrders!R[-143]C[-4]:R[-93]C[-4] -> #REF! | F172: =PurchaseOrders!R[-143]C:R[-93]C -> #REF! | H172: =PurchaseOrders!R[-143]C[-6]:R[-93]C[-4] -> #REF! | I172: =PurchaseOrders!R[-143]C[-6]:R[-93]C[-4] -> #REF! | J172: =PurchaseOrders!R[-143]C[-6]:R[-93]C[-4] -> #REF! | N172: =PurchaseOrders!R[-143]C[-9]:R[-93]C[-9] -> #REF!
E173: =PurchaseOrders!R[-143]C[-4]:R[-93]C[-4] -> #REF! | F173: =PurchaseOrders!R[-143]C:R[-93]C -> #REF! | H173: =PurchaseOrders!R[-143]C[-6]:R[-93]C[-4] -> #REF! | I173: =PurchaseOrders!R[-143]C[-6]:R[-93]C[-4] -> #REF! | J173: =PurchaseOrders!R[-143]C[-6]:R[-93]C[-4] -> #REF! | N173: =PurchaseOrders!R[-143]C[-9]:R[-93]C[-9] -> #REF!
E174: =PurchaseOrders!R[-143]C[-4]:R[-93]C[-4] -> #REF! | F174: =PurchaseOrders!R[-143]C:R[-93]C -> #REF! | H174: =PurchaseOrders!R[-143]C[-6]:R[-93]C[-4] -> #REF! | I174: =PurchaseOrders!R[-143]C[-6]:R[-93]C[-4] -> #REF! | J174: =PurchaseOrders!R[-143]C[-6]:R[-93]C[-4] -> #REF! | N174: =PurchaseOrders!R[-143]C[-9]:R[-93]C[-9] -> #REF!
E175: =PurchaseOrders!R[-143]C[-4]:R[-93]C[-4] -> #REF! | F175: =PurchaseOrders!R[-143]C:R[-93]C -> #REF! | H175: =PurchaseOrders!R[-143]C[-6]:R[-93]C[-4] -> #REF! | I175: =PurchaseOrders!R[-143]C[-6]:R[-93]C[-4] -> #REF! | J175: =PurchaseOrders!R[-143]C[-6]:R[-93]C[-4] -> #REF! | N175: =PurchaseOrders!R[-143]C[-9]:R[-93]C[-9] -> #REF!
E176: =PurchaseOrders!R[-143]C[-4]:R[-93]C[-4] -> #REF! | F176: =PurchaseOrders!R[-143]C:R[-93]C -> #REF! | H176: =PurchaseOrders!R[-143]C[-6]:R[-93]C[-4] -> #REF! | I176: =PurchaseOrders!R[-143]C[-6]:R[-93]C[-4] -> #REF! | J176: =PurchaseOrders!R[-143]C[-6]:R[-93]C[-4] -> #REF! | N176: =PurchaseOrders!R[-143]C[-9]:R[-93]C[-9] -> #REF!
E177: =PurchaseOrders!R[-143]C[-4]:R[-93]C[-4] -> #REF! | F177: =PurchaseOrders!R[-143]C:R[-93]C -> #REF! | H177: =PurchaseOrders!R[-143]C[-6]:R[-93]C[-4] -> #REF! | I177: =PurchaseOrders!R[-143]C[-6]:R[-93]C[-4] -> #REF! | J177: =PurchaseOrders!R[-143]C[-6]:R[-93]C[-4] -> #REF! | N177: =PurchaseOrders!R[-143]C[-9]:R[-93]C[-9] -> #REF!
E178: =PurchaseOrders!R[-143]C[-4]:R[-93]C[-4] -> #REF! | F178: =PurchaseOrders!R[-143]C:R[-93]C -> #REF! | H178: =PurchaseOrders!R[-143]C[-6]:R[-93]C[-4] -> #REF! | I178: =PurchaseOrders!R[-143]C[-6]:R[-93]C[-4] -> #REF! | J178: =PurchaseOrders!R[-143]C[-6]:R[-93]C[-4] -> #REF! | N178: =PurchaseOrders!R[-143]C[-9]:R[-93]C[-9] -> #REF!
E179: =PurchaseOrders!R[-143]C[-4]:R[-93]C[-4] -> #REF! | F179: =PurchaseOrders!R[-143]C:R[-93]C -> #REF! | H179: =PurchaseOrders!R[-143]C[-6]:R[-93]C[-4] -> #REF! | I179: =PurchaseOrders!R[-143]C[-6]:R[-93]C[-4] -> #REF! | J179: =PurchaseOrders!R[-143]C[-6]:R[-93]C[-4] -> #REF! | N179: =PurchaseOrders!R[-143]C[-9]:R[-93]C[-9] -> #REF!
E180: =PurchaseOrders!R[-143]C[-4]:R[-93]C[-4] -> #REF! | F180: =PurchaseOrders!R[-143]C:R[-93]C -> #REF! | H180: =PurchaseOrders!R[-143]C[-6]:R[-93]C[-4] -> #REF! | I180: =PurchaseOrders!R[-143]C[-6]:R[-93]C[-4] -> #REF! | J180: =PurchaseOrders!R[-143]C[-6]:R[-93]C[-4] -> #REF! | N180: =PurchaseOrders!R[-143]C[-9]:R[-93]C[-9] -> #REF!
E181: =PurchaseOrders!R[-143]C[-4]:R[-93]C[-4] -> #REF! | F181: =PurchaseOrders!R[-143]C:R[-93]C -> #REF! | H181: =PurchaseOrders!R[-143]C[-6]:R[-93]C[-4] -> #REF! | I181: =PurchaseOrders!R[-143]C[-6]:R[-93]C[-4] -> #REF! | J181: =PurchaseOrders!R[-143]C[-6]:R[-93]C[-4] -> #REF! | N181: =PurchaseOrders!R[-143]C[-9]:R[-93]C[-9] -> #REF!
E182: =PurchaseOrders!R[-143]C[-4]:R[-93]C[-4] -> #REF! | F182: =PurchaseOrders!R[-143]C:R[-93]C -> #REF! | H182: =PurchaseOrders!R[-143]C[-6]:R[-93]C[-4] -> #REF! | I182: =PurchaseOrders!R[-143]C[-6]:R[-93]C[-4] -> #REF! | J182: =PurchaseOrders!R[-143]C[-6]:R[-93]C[-4] -> #REF! | N182: =PurchaseOrders!R[-143]C[-9]:R[-93]C[-9] -> #REF!
E183: =PurchaseOrders!R[-143]C[-4]:R[-93]C[-4] -> #REF! | F183: =PurchaseOrders!R[-143]C:R[-93]C -> #REF! | H183: =PurchaseOrders!R[-143]C[-6]:R[-93]C[-4] -> #REF! | I183: =PurchaseOrders!R[-143]C[-6]:R[-93]C[-4] -> #REF! | J183: =PurchaseOrders!R[-143]C[-6]:R[-93]C[-4] -> #REF! | N183: =PurchaseOrders!R[-143]C[-9]:R[-93]C[-9] -> #REF!
E184: =PurchaseOrders!R[-143]C[-4]:R[-93]C[-4] -> #REF! | F184: =PurchaseOrders!R[-143]C:R[-93]C -> #REF! | H184: =PurchaseOrders!R[-143]C[-6]:R[-93]C[-4] -> #REF! | I184: =PurchaseOrders!R[-143]C[-6]:R[-93]C[-4] -> #REF! | J184: =PurchaseOrders!R[-143]C[-6]:R[-93]C[-4] -> #REF! | N184: =PurchaseOrders!R[-143]C[-9]:R[-93]C[-9] -> #REF!
E185: =PurchaseOrders!R[-143]C[-4]:R[-93]C[-4] -> #REF! | F185: =PurchaseOrders!R[-143]C:R[-93]C -> #REF! | H185: =PurchaseOrders!R[-143]C[-6]:R[-93]C[-4] -> #REF! | I185: =PurchaseOrders!R[-143]C[-6]:R[-93]C[-4] -> #REF! | J185: =PurchaseOrders!R[-143]C[-6]:R[-93]C[-4] -> #REF! | N185: =PurchaseOrders!R[-143]C[-9]:R[-93]C[-9] -> #REF!
E186: =PurchaseOrders!R[-143]C[-4]:R[-93]C[-4] -> #REF! | F186: =PurchaseOrders!R[-143]C:R[-93]C -> #REF! | H186: =PurchaseOrders!R[-143]C[-6]:R[-93]C[-4] -> #REF! | I186: =PurchaseOrders!R[-143]C[-6]:R[-93]C[-4] -> #REF! | J186: =PurchaseOrders!R[-143]C[-6]:R[-93]C[-4] -> #REF! | N186: =PurchaseOrders!R[-143]C[-9]:R[-93]C[-9] -> #REF!
E187: =PurchaseOrders!R[-143]C[-4]:R[-93]C[-4] -> #REF! | F187: =PurchaseOrders!R[-143]C:R[-93]C -> #REF! | H187: =PurchaseOrders!R[-143]C[-6]:R[-93]C[-4] -> #REF! | I187: =PurchaseOrders!R[-143]C[-6]:R[-93]C[-4] -> #REF! | J187: =PurchaseOrders!R[-143]C[-6]:R[-93]C[-4] -> #REF! | N187: =PurchaseOrders!R[-143]C[-9]:R[-93]C[-9] -> #REF!
E188: =PurchaseOrders!R[-143]C[-4]:R[-93]C[-4] -> #REF! | F188: =PurchaseOrders!R[-143]C:R[-93]C -> #REF! | H188: =PurchaseOrders!R[-143]C[-6]:R[-93]C[-4] -> #REF! | I188: =PurchaseOrders!R[-143]C[-6]:R[-93]C[-4] -> #REF! | J188: =PurchaseOrders!R[-143]C[-6]:R[-93]C[-4] -> #REF! | N188: =PurchaseOrders!R[-143]C[-9]:R[-93]C[-9] -> #REF!
E189: =PurchaseOrders!R[-143]C[-4]:R[-93]C[-4] -> #REF! | F189: =PurchaseOrders!R[-143]C:R[-93]C -> #REF! | H189: =PurchaseOrders!R[-143]C[-6]:R[-93]C[-4] -> #REF! | I189: =PurchaseOrders!R[-143]C[-6]:R[-93]C[-4] -> #REF! | J189: =PurchaseOrders!R[-143]C[-6]:R[-93]C[-4] -> #REF! | N189: =PurchaseOrders!R[-143]C[-9]:R[-93]C[-9] -> #REF!
E190: =PurchaseOrders!R[-143]C[-4]:R[-93]C[-4] -> #REF! | F190: =PurchaseOrders!R[-143]C:R[-93]C -> #REF! | H190: =PurchaseOrders!R[-143]C[-6]:R[-93]C[-4] -> #REF! | I190: =PurchaseOrders!R[-143]C[-6]:R[-93]C[-4] -> #REF! | J190: =PurchaseOrders!R[-143]C[-6]:R[-93]C[-4] -> #REF! | N190: =PurchaseOrders!R[-143]C[-9]:R[-93]C[-9] -> #REF!
E191: =PurchaseOrders!R[-143]C[-4]:R[-93]C[-4] -> #REF! | F191: =PurchaseOrders!R[-143]C:R[-93]C -> #REF! | H191: =PurchaseOrders!R[-143]C[-6]:R[-93]C[-4] -> #REF! | I191: =PurchaseOrders!R[-143]C[-6]:R[-93]C[-4] -> #REF! | J191: =PurchaseOrders!R[-143]C[-6]:R[-93]C[-4] -> #REF! | N191: =PurchaseOrders!R[-143]C[-9]:R[-93]C[-9] -> #REF!
E192: =PurchaseOrders!R[-143]C[-4]:R[-93]C[-4] -> #REF! | F192: =PurchaseOrders!R[-143]C:R[-93]C -> #REF! | H192: =PurchaseOrders!R[-143]C[-6]:R[-93]C[-4] -> #REF! | I192: =PurchaseOrders!R[-143]C[-6]:R[-93]C[-4] -> #REF! | J192: =PurchaseOrders!R[-143]C[-6]:R[-93]C[-4] -> #REF! | N192: =PurchaseOrders!R[-143]C[-9]:R[-93]C[-9] -> #REF!
E193: =PurchaseOrders!R[-143]C[-4]:R[-93]C[-4] -> #REF! | F193: =PurchaseOrders!R[-143]C:R[-93]C -> #REF! | H193: =PurchaseOrders!R[-143]C[-6]:R[-93]C[-4] -> #REF! | I193: =PurchaseOrders!R[-143]C[-6]:R[-93]C[-4] -> #REF! | J193: =PurchaseOrders!R[-143]C[-6]:R[-93]C[-4] -> #REF! | N193: =PurchaseOrders!R[-143]C[-9]:R[-93]C[-9] -> #REF!
E194: =PurchaseOrders!R[-143]C[-4]:R[-93]C[-4] -> #REF! | F194: =PurchaseOrders!R[-143]C:R[-93]C -> #REF! | H194: =PurchaseOrders!R[-143]C[-6]:R[-93]C[-4] -> #REF! | I194: =PurchaseOrders!R[-143]C[-6]:R[-93]C[-4] -> #REF! | J194: =PurchaseOrders!R[-143]C[-6]:R[-93]C[-4] -> #REF! | N194: =PurchaseOrders!R[-143]C[-9]:R[-93]C[-9] -> #REF!
E195: =PurchaseOrders!R[-143]C[-4]:R[-93]C[-4] -> #REF! | F195: =PurchaseOrders!R[-143]C:R[-93]C -> #REF! | H195: =PurchaseOrders!R[-143]C[-6]:R[-93]C[-4] -> #REF! | I195: =PurchaseOrders!R[-143]C[-6]:R[-93]C[-4] -> #REF! | J195: =PurchaseOrders!R[-143]C[-6]:R[-93]C[-4] -> #REF! | N195: =PurchaseOrders!R[-143]C[-9]:R[-93]C[-9] -> #REF!
E196: =PurchaseOrders!R[-143]C[-4]:R[-93]C[-4] -> #REF! | F196: =PurchaseOrders!R[-143]C:R[-93]C -> #REF! | H196: =PurchaseOrders!R[-143]C[-6]:R[-93]C[-4] -> #REF! | I196: =PurchaseOrders!R[-143]C[-6]:R[-93]C[-4] -> #REF! | J196: =PurchaseOrders!R[-143]C[-6]:R[-93]C[-4] -> #REF! | N196: =PurchaseOrders!R[-143]C[-9]:R[-93]C[-9] -> #REF!
E197: =PurchaseOrders!R[-143]C[-4]:R[-93]C[-4] -> #REF! | F197: =PurchaseOrders!R[-143]C:R[-93]C -> #REF! | H197: =PurchaseOrders!R[-143]C[-6]:R[-93]C[-4] -> #REF! | I197: =PurchaseOrders!R[-143]C[-6]:R[-93]C[-4] -> #REF! | J197: =PurchaseOrders!R[-143]C[-6]:R[-93]C[-4] -> #REF! | N197: =PurchaseOrders!R[-143]C[-9]:R[-93]C[-9] -> #REF!
E198: =PurchaseOrders!R[-143]C[-4]:R[-93]C[-4] -> #REF! | F198: =PurchaseOrders!R[-143]C:R[-93]C -> #REF! | H198: =PurchaseOrders!R[-143]C[-6]:R[-93]C[-4] -> #REF! | I198: =PurchaseOrders!R[-143]C[-6]:R[-93]C[-4] -> #REF! | J198: =PurchaseOrders!R[-143]C[-6]:R[-93]C[-4] -> #REF! | N198: =PurchaseOrders!R[-143]C[-9]:R[-93]C[-9] -> #REF!
E199: =PurchaseOrders!R[-143]C[-4]:R[-93]C[-4] -> #REF! | F199: =PurchaseOrders!R[-143]C:R[-93]C -> #REF! | H199: =PurchaseOrders!R[-143]C[-6]:R[-93]C[-4] -> #REF! | I199: =PurchaseOrders!R[-143]C[-6]:R[-93]C[-4] -> #REF! | J199: =PurchaseOrders!R[-143]C[-6]:R[-93]C[-4] -> #REF! | N199: =PurchaseOrders!R[-143]C[-9]:R[-93]C[-9] -> #REF!

Sheet: PurchaseActionReport
A1: 'Components that will be required after inventory has been exhausted are listed here
A2: 'and compared with components on order.
A3: 'Columns A to F are a PivotTable of the Allocate Inventory worksheet, and G contains
A4: 'a formula to calculate projected inventory of each component. Negative projected
A5: 'inventory indicates that orders need to be chased or placed to support scheduled
A6: 'production.
D10: 'Balance
A11: 'Supplier Name | B11: 'Description | C11: 'Start Date | D11: 'Product/Run | E11: ' Get In | F11: ' On order | G11: 0
A12: 'Ace Chemicals | B12: 'Base Shampoo | C12: 36600 | D12: 'AB500/2 | E12: 12812 | F12: 0 | G12: =IF(EQUAL(RIGHT(RC[-5], 5), "Total"), 0, R[-1]C+RC[-1]-RC[-2]) -> -12812
B13: 'Base Shampoo | C13: 36602 | D13: 'FL250/1 | E13: 23520 | F13: 0 | G13: =IF(EQUAL(RIGHT(RC[-5], 5), "Total"), 0, R[-1]C+RC[-1]-RC[-2]) -> -36332
B14: 'Base Shampoo | C14: 36603 | D14: 'AB250/1 | E14: 28596 | F14: 0 | G14: =IF(EQUAL(RIGHT(RC[-5], 5), "Total"), 0, R[-1]C+RC[-1]-RC[-2]) -> -64928
B15: 'Base Shampoo | E15: 0 | F15: 100000 | G15: =IF(EQUAL(RIGHT(RC[-5], 5), "Total"), 0, R[-1]C+RC[-1]-RC[-2]) -> 35072
B16: 'Base Shampoo | C16: 36608 | D16: 'AB100/1 | E16: 7723.2 | F16: 0 | G16: =IF(EQUAL(RIGHT(RC[-5], 5), "Total"), 0, R[-1]C+RC[-1]-RC[-2]) -> 27348.8
B17: 'Base Shampoo | C17: 36610 | D17: 'FL500/2 | E17: 30456 | F17: 0 | G17: =IF(EQUAL(RIGHT(RC[-5], 5), "Total"), 0, R[-1]C+RC[-1]-RC[-2]) -> -3107.2
B18: 'Base Shampoo | C18: 36611 | D18: 'AB500/3 | E18: 14808 | F18: 0 | G18: =IF(EQUAL(RIGHT(RC[-5], 5), "Total"), 0, R[-1]C+RC[-1]-RC[-2]) -> -17915.2
B19: 'Base Shampoo | C19: 36612 | D19: 'FL100/1 | E19: 1459.2 | F19: 0 | G19: =IF(EQUAL(RIGHT(RC[-5], 5), "Total"), 0, R[-1]C+RC[-1]-RC[-2]) -> -19374.4
B20: 'Base Shampoo | C20: 36613 | D20: 'FL250/2 | E20: 23520 | F20: 0 | G20: =IF(EQUAL(RIGHT(RC[-5], 5), "Total"), 0, R[-1]C+RC[-1]-RC[-2]) -> -42894.4
B21: 'Base Shampoo | C21: 36615 | D21: 'AB250/2 | E21: 27852 | F21: 0 | G21: =IF(EQUAL(RIGHT(RC[-5], 5), "Total"), 0, R[-1]C+RC[-1]-RC[-2]) -> -70746.4
B22: 'Base Shampoo | E22: 0 | F22: 100000 | G22: =IF(EQUAL(RIGHT(RC[-5], 5), "Total"), 0, R[-1]C+RC[-1]-RC[-2]) -> 29253.6
B23: 'Base Shampoo | C23: 36620 | D23: 'AB100/2 | E23: 7723.2 | F23: 0 | G23: =IF(EQUAL(RIGHT(RC[-5], 5), "Total"), 0, R[-1]C+RC[-1]-RC[-2]) -> 21530.4
B24: 'Base Shampoo | C24: 36621 | D24: 'FL500/3 | E24: 30456 | F24: 0 | G24: =IF(EQUAL(RIGHT(RC[-5], 5), "Total"), 0, R[-1]C+RC[-1]-RC[-2]) -> -8925.59999999999
B25: 'Base Shampoo Total | C25: 208925.6 | D25: 200000 | E25: 0 | F25: 0 | G25: =IF(EQUAL(RIGHT(RC[-5], 5), "Total"), 0, R[-1]C+RC[-1]-RC[-2]) -> 0
A26: 'Best Plastics | B26: 'Bottle 100ml | C26: 36620 | D26: 'AB100/2 | E26: 46584 | F26: 0 | G26: =IF(EQUAL(RIGHT(RC[-5], 5), "Total"), 0, R[-1]C+RC[-1]-RC[-2]) -> -46584
B27: 'Bottle 100ml | C27: 36630 | E27: 0 | F27: 40000 | G27: =IF(EQUAL(RIGHT(RC[-5], 5), "Total"), 0, R[-1]C+RC[-1]-RC[-2]) -> -6584
B28: 'Bottle 100ml Total | C28: 46584 | D28: 40000 | E28: 0 | F28: 0 | G28: =IF(EQUAL(RIGHT(RC[-5], 5), "Total"), 0, R[-1]C+RC[-1]-RC[-2]) -> 0
B29: 'Bottle 250ml | C29: 36603 | D29: 'AB250/1 | E29: 23496 | F29: 0 | G29: =IF(EQUAL(RIGHT(RC[-5], 5), "Total"), 0, R[-1]C+RC[-1]-RC[-2]) -> -23496
B30: 'Bottle 250ml | E30: 0 | F30: 90000 | G30: =IF(EQUAL(RIGHT(RC[-5], 5), "Total"), 0, R[-1]C+RC[-1]-RC[-2]) -> 66504
B31: 'Bottle 250ml | C31: 36613 | D31: 'FL250/2 | E31: 94080 | F31: 0 | G31: =IF(EQUAL(RIGHT(RC[-5], 5), "Total"), 0, R[-1]C+RC[-1]-RC[-2]) -> -27576
B32: 'Bottle 250ml | C32: 36615 | D32: 'AB250/2 | E32: 111408 | F32: 0 | G32: =IF(EQUAL(RIGHT(RC[-5], 5), "Total"), 0, R[-1]C+RC[-1]-RC[-2]) -> -138984
B33: 'Bottle 250ml | C33: 36617 | E33: 0 | F33: 40000 | G33: =IF(EQUAL(RIGHT(RC[-5], 5), "Total"), 0, R[-1]C+RC[-1]-RC[-2]) -> -98984
B34: 'Bottle 250ml | C34: 36638 | E34: 0 | F34: 50000 | G34: =IF(EQUAL(RIGHT(RC[-5], 5), "Total"), 0, R[-1]C+RC[-1]-RC[-2]) -> -48984
B35: 'Bottle 250ml Total | C35: 228984 | D35: 180000 | E35: 0 | F35: 0 | G35: =IF(EQUAL(RIGHT(RC[-5], 5), "Total"), 0, R[-1]C+RC[-1]-RC[-2]) -> 0
B36: 'Bottle 500ml | C36: 36599 | D36: 'FL500/1 | E36: 28044 | F36: 0 | G36: =IF(EQUAL(RIGHT(RC[-5], 5), "Total"), 0, R[-1]C+RC[-1]-RC[-2]) -> -28044
B37: 'Bottle 500ml | C37: 36600 | D37: 'AB500/2 | E37: 29616 | F37: 0 | G37: =IF(EQUAL(RIGHT(RC[-5], 5), "Total"), 0, R[-1]C+RC[-1]-RC[-2]) -> -57660
B38: 'Bottle 500ml | C38: 36601 | E38: 0 | F38: 100000 | G38: =IF(EQUAL(RIGHT(RC[-5], 5), "Total"), 0, R[-1]C+RC[-1]-RC[-2]) -> 42340
B39: 'Bottle 500ml | C39: 36610 | D39: 'FL500/2 | E39: 60912 | F39: 0 | G39: =IF(EQUAL(RIGHT(RC[-5], 5), "Total"), 0, R[-1]C+RC[-1]-RC[-2]) -> -18572
B40: 'Bottle 500ml | C40: 36611 | D40: 'AB500/3 | E40: 29616 | F40: 0 | G40: =IF(EQUAL(RIGHT(RC[-5], 5), "Total"), 0, R[-1]C+RC[-1]-RC[-2]) -> -48188
B41: 'Bottle 500ml | C41: 36617 | E41: 0 | F41: 50000 | G41: =IF(EQUAL(RIGHT(RC[-5], 5), "Total"), 0, R[-1]C+RC[-1]-RC[-2]) -> 1812
B42: 'Bottle 500ml | C42: 36621 | D42: 'FL500/3 | E42: 60912 | F42: 0 | G42: =IF(EQUAL(RIGHT(RC[-5], 5), "Total"), 0, R[-1]C+RC[-1]-RC[-2]) -> -59100
B43: 'Bottle 500ml | C43: 36631 | E43: 0 | F43: 50000 | G43: =IF(EQUAL(RIGHT(RC[-5], 5), "Total"), 0, R[-1]C+RC[-1]-RC[-2]) -> -9100
B44: 'Bottle 500ml Total | C44: 209100 | D44: 200000 | E44: 0 | F44: 0 | G44: =IF(EQUAL(RIGHT(RC[-5], 5), "Total"), 0, R[-1]C+RC[-1]-RC[-2]) -> 0
B45: 'Flip cap | C45: 36601 | E45: 0 | F45: 200000 | G45: =IF(EQUAL(RIGHT(RC[-5], 5), "Total"), 0, R[-1]C+RC[-1]-RC[-2]) -> 200000
B46: 'Flip cap | C46: 36602 | D46: 'FL250/1 | E46: 28342 | F46: 0 | G46: =IF(EQUAL(RIGHT(RC[-5], 5), "Total"), 0, R[-1]C+RC[-1]-RC[-2]) -> 171658
B47: 'Flip cap | C47: 36603 | D47: 'AB250/1 | E47: 114384 | F47: 0 | G47: =IF(EQUAL(RIGHT(RC[-5], 5), "Total"), 0, R[-1]C+RC[-1]-RC[-2]) -> 57274
B48: 'Flip cap | C48: 36608 | D48: 'AB100/1 | E48: 77232 | F48: 0 | G48: =IF(EQUAL(RIGHT(RC[-5], 5), "Total"), 0, R[-1]C+RC[-1]-RC[-2]) -> -19958
B49: 'Flip cap | C49: 36612 | D49: 'FL100/1 | E49: 14592 | F49: 0 | G49: =IF(EQUAL(RIGHT(RC[-5], 5), "Total"), 0, R[-1]C+RC[-1]-RC[-2]) -> -34550
B50: 'Flip cap | C50: 36613 | D50: 'FL250/2 | E50: 94080 | F50: 0 | G50: =IF(EQUAL(RIGHT(RC[-5], 5), "Total"), 0, R[-1]C+RC[-1]-RC[-2]) -> -128630
B51: 'Flip cap | C51: 36615 | D51: 'AB250/2 | E51: 111408 | F51: 0 | G51: =IF(EQUAL(RIGHT(RC[-5], 5), "Total"), 0, R[-1]C+RC[-1]-RC[-2]) -> -240038
B52: 'Flip cap | C52: 36620 | D52: 'AB100/2 | E52: 77232 | F52: 0 | G52: =IF(EQUAL(RIGHT(RC[-5], 5), "Total"), 0, R[-1]C+RC[-1]-RC[-2]) -> -317270
B53: 'Flip cap | C53: 36623 | F53: 300000 | G53: =IF(EQUAL(RIGHT(RC[-5], 5), "Total"), 0, R[-1]C+RC[-1]-RC[-2]) -> #EMPTY!
B54: 'Flip cap Total | C54: 517270 | D54: 500000 | E54: 0 | F54: 0 | G54: =IF(EQUAL(RIGHT(RC[-5], 5), "Total"), 0, R[-1]C+RC[-1]-RC[-2]) -> 0
B55: 'Screw cap | C55: 36599 | D55: 'FL500/1 | E55: 26742 | F55: 0 | G55: =IF(EQUAL(RIGHT(RC[-5], 5), "Total"), 0, R[-1]C+RC[-1]-RC[-2]) -> -26742
B56: 'Screw cap | C56: 36600 | D56: 'AB500/2 | E56: 29616 | F56: 0 | G56: =IF(EQUAL(RIGHT(RC[-5], 5), "Total"), 0, R[-1]C+RC[-1]-RC[-2]) -> -56358
B57: 'Screw cap | C57: 36602 | E57: 0 | F57: 100000 | G57: =IF(EQUAL(RIGHT(RC[-5], 5), "Total"), 0, R[-1]C+RC[-1]-RC[-2]) -> 43642
B58: 'Screw cap | C58: 36610 | D58: 'FL500/2 | E58: 60912 | F58: 0 | G58: =IF(EQUAL(RIGHT(RC[-5], 5), "Total"), 0, R[-1]C+RC[-1]-RC[-2]) -> -17270
B59: 'Screw cap | C59: 36611 | D59: 'AB500/3 | E59: 29616 | F59: 0 | G59: =IF(EQUAL(RIGHT(RC[-5], 5), "Total"), 0, R[-1]C+RC[-1]-RC[-2]) -> -46886
B60: 'Screw cap | C60: 36618 | E60: 0 | F60: 100000 | G60: =IF(EQUAL(RIGHT(RC[-5], 5), "Total"), 0, R[-1]C+RC[-1]-RC[-2]) -> 53114
B61: 'Screw cap | C61: 36621 | D61: 'FL500/3 | E61: 60912 | F61: 0 | G61: =IF(EQUAL(RIGHT(RC[-5], 5), "Total"), 0, R[-1]C+RC[-1]-RC[-2]) -> -7798
B62: 'Screw cap Total | C62: 207798 | D62: 200000 | E62: 0 | F62: 0 | G62: =IF(EQUAL(RIGHT(RC[-5], 5), "Total"), 0, R[-1]C+RC[-1]-RC[-2]) -> 0
A63: 'Chang Essences | B63: 'Apple essence | C63: 36608 | E63: 0 | F63: 60 | G63: =IF(EQUAL(RIGHT(RC[-5], 5), "Total"), 0, R[-1]C+RC[-1]-RC[-2]) -> 60
B64: 'Apple essence | C64: 36622 | E64: 0 | F64: 100 | G64: =IF(EQUAL(RIGHT(RC[-5], 5), "Total"), 0, R[-1]C+RC[-1]-RC[-2]) -> 160
B65: 'Apple essence Total | D65: 160 | E65: 0 | F65: 0 | G65: =IF(EQUAL(RIGHT(RC[-5], 5), "Total"), 0, R[-1]C+RC[-1]-RC[-2]) -> 0
B66: 'Lemon essence | C66: 36613 | D66: 'FL250/2 | E66: 97.152 | F66: 0 | G66: =IF(EQUAL(RIGHT(RC[-5], 5), "Total"), 0, R[-1]C+RC[-1]-RC[-2]) -> -97.152
B67: 'Lemon essence | C67: 36619 | E67: 0 | F67: 350 | G67: =IF(EQUAL(RIGHT(RC[-5], 5), "Total"), 0, R[-1]C+RC[-1]-RC[-2]) -> 252.848
B68: 'Lemon essence | C68: 36621 | D68: 'FL500/3 | E68: 304.56 | F68: 0 | G68: =IF(EQUAL(RIGHT(RC[-5], 5), "Total"), 0, R[-1]C+RC[-1]-RC[-2]) -> -51.712
B69: 'Lemon essence Total | C69: 401.712 | D69: 350 | E69: 0 | F69: 0 | G69: =IF(EQUAL(RIGHT(RC[-5], 5), "Total"), 0, R[-1]C+RC[-1]-RC[-2]) -> 0
A70: 'Dave's Printing | B70: 'Label Apple Blossom 100ml | C70: 36623 | E70: 0 | F70: 50000 | G70: =IF(EQUAL(RIGHT(RC[-5], 5), "Total"), 0, R[-1]C+RC[-1]-RC[-2]) -> 50000
B71: 'Label Apple Blossom 100ml Total | D71: 50000 | E71: 0 | F71: 0 | G71: =IF(EQUAL(RIGHT(RC[-5], 5), "Total"), 0, R[-1]C+RC[-1]-RC[-2]) -> 0
B72: 'Label Apple Blossom 250ml | C72: 36599 | E72: 0 | F72: 70000 | G72: =IF(EQUAL(RIGHT(RC[-5], 5), "Total"), 0, R[-1]C+RC[-1]-RC[-2]) -> 70000
B73: 'Label Apple Blossom 250ml | C73: 36606 | E73: 0 | F73: 60000 | G73: =IF(EQUAL(RIGHT(RC[-5], 5), "Total"), 0, R[-1]C+RC[-1]-RC[-2]) -> 130000
B74: 'Label Apple Blossom 250ml Total | D74: 130000 | E74: 0 | F74: 0 | G74: =IF(EQUAL(RIGHT(RC[-5], 5), "Total"), 0, R[-1]C+RC[-1]-RC[-2]) -> 0
B75: 'Label Apple Blossom 500ml | C75: 36600 | D75: 'AB500/2 | E75: 9980 | F75: 0 | G75: =IF(EQUAL(RIGHT(RC[-5], 5), "Total"), 0, R[-1]C+RC[-1]-RC[-2]) -> -9980
B76: 'Label Apple Blossom 500ml | C76: 36611 | D76: 'AB500/3 | E76: 32084 | F76: 0 | G76: =IF(EQUAL(RIGHT(RC[-5], 5), "Total"), 0, R[-1]C+RC[-1]-RC[-2]) -> -42064
B77: 'Label Apple Blossom 500ml | C77: 36618 | E77: 0 | F77: 20000 | G77: =IF(EQUAL(RIGHT(RC[-5], 5), "Total"), 0, R[-1]C+RC[-1]-RC[-2]) -> -22064
B78: 'Label Apple Blossom 500ml | C78: 36632 | E78: 0 | F78: 20000 | G78: =IF(EQUAL(RIGHT(RC[-5], 5), "Total"), 0, R[-1]C+RC[-1]-RC[-2]) -> -2064
B79: 'Label Apple Blossom 500ml | C79: 36646 | E79: 0 | F79: 20000 | G79: =IF(EQUAL(RIGHT(RC[-5], 5), "Total"), 0, R[-1]C+RC[-1]-RC[-2]) -> 17936
B80: 'Label Apple Blossom 500ml Total | C80: 42064 | D80: 60000 | E80: 0 | F80: 0 | G80: =IF(EQUAL(RIGHT(RC[-5], 5), "Total"), 0, R[-1]C+RC[-1]-RC[-2]) -> 0
B81: 'Label Fragrant Lemon 100ml | C81: 36630 | E81: 0 | F81: 10000 | G81: =IF(EQUAL(RIGHT(RC[-5], 5), "Total"), 0, R[-1]C+RC[-1]-RC[-2]) -> 10000
B82: 'Label Fragrant Lemon 100ml | C82: 36644 | E82: 0 | F82: 10000 | G82: =IF(EQUAL(RIGHT(RC[-5], 5), "Total"), 0, R[-1]C+RC[-1]-RC[-2]) -> 20000
B83: 'Label Fragrant Lemon 100ml Total | D83: 20000 | E83: 0 | F83: 0 | G83: =IF(EQUAL(RIGHT(RC[-5], 5), "Total"), 0, R[-1]C+RC[-1]-RC[-2]) -> 0
B84: 'Label Fragrant Lemon 250ml | C84: 36602 | D84: 'FL250/1 | E84: 14504 | F84: 0 | G84: =IF(EQUAL(RIGHT(RC[-5], 5), "Total"), 0, R[-1]C+RC[-1]-RC[-2]) -> -14504
B85: 'Label Fragrant Lemon 250ml | E85: 0 | F85: 60000 | G85: =IF(EQUAL(RIGHT(RC[-5], 5), "Total"), 0, R[-1]C+RC[-1]-RC[-2]) -> 45496
B86: 'Label Fragrant Lemon 250ml | C86: 36613 | D86: 'FL250/2 | E86: 98000 | F86: 0 | G86: =IF(EQUAL(RIGHT(RC[-5], 5), "Total"), 0, R[-1]C+RC[-1]-RC[-2]) -> -52504
B87: 'Label Fragrant Lemon 250ml | C87: 36616 | E87: 0 | F87: 60000 | G87: =IF(EQUAL(RIGHT(RC[-5], 5), "Total"), 0, R[-1]C+RC[-1]-RC[-2]) -> 7496
B88: 'Label Fragrant Lemon 250ml Total | C88: 112504 | D88: 120000 | E88: 0 | F88: 0 | G88: =IF(EQUAL(RIGHT(RC[-5], 5), "Total"), 0, R[-1]C+RC[-1]-RC[-2]) -> 0
B89: 'Label Fragrant Lemon 500ml | C89: 36610 | D89: 'FL500/2 | E89: 15714 | F89: 0 | G89: =IF(EQUAL(RIGHT(RC[-5], 5), "Total"), 0, R[-1]C+RC[-1]-RC[-2]) -> -15714
B90: 'Label Fragrant Lemon 500ml | C90: 36615 | E90: 0 | F90: 40000 | G90: =IF(EQUAL(RIGHT(RC[-5], 5), "Total"), 0, R[-1]C+RC[-1]-RC[-2]) -> 24286
B91: 'Label Fragrant Lemon 500ml | C91: 36621 | D91: 'FL500/3 | E91: 65988 | F91: 0 | G91: =IF(EQUAL(RIGHT(RC[-5], 5), "Total"), 0, R[-1]C+RC[-1]-RC[-2]) -> -41702
B92: 'Label Fragrant Lemon 500ml | C92: 36629 | E92: 0 | F92: 40000 | G92: =IF(EQUAL(RIGHT(RC[-5], 5), "Total"), 0, R[-1]C+RC[-1]-RC[-2]) -> -1702
B93: 'Label Fragrant Lemon 500ml Total | C93: 81702 | D93: 80000 | E93: 0 | F93: 0 | G93: =IF(EQUAL(RIGHT(RC[-5], 5), "Total"), 0, R[-1]C+RC[-1]-RC[-2]) -> 0
A94: 'Eduardo Corrugates | B94: 'Carton large | C94: 36599 | E94: 0 | F94: 8000 | G94: =IF(EQUAL(RIGHT(RC[-5], 5), "Total"), 0, R[-1]C+RC[-1]-RC[-2]) -> 8000
B95: 'Carton large | C95: 36602 | D95: 'FL250/1 | E95: 1516 | F95: 0 | G95: =IF(EQUAL(RIGHT(RC[-5], 5), "Total"), 0, R[-1]C+RC[-1]-RC[-2]) -> 6484
B96: 'Carton large | C96: 36603 | D96: 'AB250/1 | E96: 2383 | F96: 0 | G96: =IF(EQUAL(RIGHT(RC[-5], 5), "Total"), 0, R[-1]C+RC[-1]-RC[-2]) -> 4101
B97: 'Carton large | C97: 36610 | D97: 'FL500/2 | E97: 2538 | F97: 0 | G97: =IF(EQUAL(RIGHT(RC[-5], 5), "Total"), 0, R[-1]C+RC[-1]-RC[-2]) -> 1563
B98: 'Carton large | C98: 36611 | D98: 'AB500/3 | E98: 1234 | F98: 0 | G98: =IF(EQUAL(RIGHT(RC[-5], 5), "Total"), 0, R[-1]C+RC[-1]-RC[-2]) -> 329
B99: 'Carton large | C99: 36613 | D99: 'FL250/2 | E99: 1960 | F99: 0 | G99: =IF(EQUAL(RIGHT(RC[-5], 5), "Total"), 0, R[-1]C+RC[-1]-RC[-2]) -> -1631
B100: 'Carton large | C100: 36615 | D100: 'AB250/2 | E100: 2321 | F100: 0 | G100: =IF(EQUAL(RIGHT(RC[-5], 5), "Total"), 0, R[-1]C+RC[-1]-RC[-2]) -> -3952
B101: 'Carton large | C101: 36620 | E101: 0 | F101: 5000 | G101: =IF(EQUAL(RIGHT(RC[-5], 5), "Total"), 0, R[-1]C+RC[-1]-RC[-2]) -> 1048
B102: 'Carton large | C102: 36621 | D102: 'FL500/3 | E102: 2538 | F102: 0 | G102: =IF(EQUAL(RIGHT(RC[-5], 5), "Total"), 0, R[-1]C+RC[-1]-RC[-2]) -> -1490
B103: 'Carton large Total | C103: 14490 | D103: 13000 | E103: 0 | F103: 0 | G103: =IF(EQUAL(RIGHT(RC[-5], 5), "Total"), 0, R[-1]C+RC[-1]-RC[-2]) -> 0
B104: 'Carton small | C104: 36603 | E104: 0 | F104: 1000 | G104: =IF(EQUAL(RIGHT(RC[-5], 5), "Total"), 0, R[-1]C+RC[-1]-RC[-2]) -> 1000
B105: 'Carton small | C105: 36608 | D105: 'AB100/1 | E105: 611 | F105: 0 | G105: =IF(EQUAL(RIGHT(RC[-5], 5), "Total"), 0, R[-1]C+RC[-1]-RC[-2]) -> 389
B106: 'Carton small | C106: 36612 | D106: 'FL100/1 | E106: 304 | F106: 0 | G106: =IF(EQUAL(RIGHT(RC[-5], 5), "Total"), 0, R[-1]C+RC[-1]-RC[-2]) -> 85
B107: 'Carton small | C107: 36620 | D107: 'AB100/2 | E107: 1609 | F107: 0 | G107: =IF(EQUAL(RIGHT(RC[-5], 5), "Total"), 0, R[-1]C+RC[-1]-RC[-2]) -> -1524
B108: 'Carton small | C108: 36642 | E108: 0 | F108: 1000 | G108: =IF(EQUAL(RIGHT(RC[-5], 5), "Total"), 0, R[-1]C+RC[-1]-RC[-2]) -> -524
B109: 'Carton small Total | C109: 2524 | D109: 2000 | E109: 0 | F109: 0 | G109: =IF(EQUAL(RIGHT(RC[-5], 5), "Total"), 0, R[-1]C+RC[-1]-RC[-2]) -> 0

Sheet: InventoryRationingCalculation
F1: =MATCH("Inventory", ItemMaster!R6C1:R6C26, 0) -> 8 | J1: =MATCH("Inventory", ItemMaster!R6C1:R6C26, 0) -> 8
A3: 'Bill of Materials | E3: 'First Pass Calculations | T3: 'Second Pass Calculations
A4: 'Product | B4: 'Component | C4: 'Qty | D4: 'Component Description | E4: 'Product Sales Forcast per Week | F4: 'Product Inventory | G4: 'Product Inventory Cover Weeks | H4: 'Component Sales Forcast per Week | I4: 'Total Component Sales Forecast | J4: 'Components in Inventory | K4: 'Components in Product Inventory | L4: 'Total Components in Product Inventory | M4: 'Total Average Inventory Cover | N4: 'Product Cover Below Average | O4: 'Min Average Cover | P4: 'Make Weeks | Q4: 'Make Product | R4: 'Use Component | S4: 'Total Use Component | T4: 'Product Inventory 2 | U4: 'Product Inventory Cover Weeks 2 | V4: 'Component Sales Forcast per Week 2 | W4: 'Total Component Sales Forecast 2 | X4: 'Components in Inventory 2 | Y4: 'Components in Product Inventory 2 | Z4: 'Total Components in Product Inventory 2 | AA4: 'Total Average Inventory Cover 2 | AB4: 'Product Cover Below Average 2 | AC4: 'Min Average Cover 2 | AD4: 'Make Weeks 2 | AE4: 'Make Product 2 | AF4: 'Use Component 2 | AG4: 'Total Use Component 2 | AH4: 'Components in Inventory 3 | AI4: 'Make Product 1+2
A5: =BillofMaterials!R[+2]C -> AB100 | B5: =BillofMaterials!R[+2]C -> BS01 | C5: =BillofMaterials!R[+2]C -> 4.8 | D5: =BillofMaterials!R[+2]C -> #ERR: ArgCount | E5: =VLOOKUP(RC[-4], TheBusiness!R8C1:R14C4, 4, 0) -> #ERR: ArgCount | F5: =VLOOKUP(RC[-5], ItemMaster!R6C1:R31C8, R1C, 0) -> #ERR: ArgCount | G5: =IF(RC[-2], RC[-1]/RC[-2], 0) -> #ERR: ArgCount | H5: =RC[-3]*RC[-5]*RC[+6] -> #ERR: ArgCount | I5: =MAX(VLOOKUP(RC[-7], ComponentsPivot!R3C1:R25C7, 2, 0), RC[-4]*RC[-6]) -> #ERR: ArgCount | J5: =VLOOKUP(RC[-8], ItemMaster!R6C1:R31C8, R1C, 0) -> #ERR: ArgCount | K5: =RC[-5]*RC[-8]*RC[+3] -> #ERR: ArgCount | L5: =VLOOKUP(RC[-10], ComponentsPivot!R3C1:R25C3, 3, 0) -> #ERR: ArgCount | M5: =IF(RC[-4], (RC[-1]+RC[-3])/RC[-4], 0) -> #ERR: ArgCount | N5: =AND(RC[+1], RC[-7]<RC[-1]) -> #ERR: ArgCount | O5: =VLOOKUP(RC[-14], ProductsPivot!R4C1:R12C3, 2, 0) -> #ERR: ArgCount | P5: =MAX(RC[-1]-RC[-9], 0) -> #ERR: ArgCount | Q5: =RC[-1]*RC[-12] -> #ERR: ArgCount | R5: =RC[-1]*RC[-15] -> #ERR: ArgCount | S5: =VLOOKUP(RC[-17], ComponentsPivot!R3C1:R25C4, 4, 0) -> #ERR: ArgCount | T5: =RC[-14]+RC[-3] -> #ERR: ArgCount | U5: =IF(RC[-16], RC[-1]/RC[-16], 0) -> #ERR: ArgCount | V5: =RC[-17]*RC[-19]*RC[+6] -> #ERR: ArgCount | W5: =MAX(VLOOKUP(RC[-21], ComponentsPivot!R3C1:R25C7, 5, 0), RC[-18]*RC[-20]) -> #ERR: ArgCount | X5: =RC[-14]-RC[-5] -> #ERR: ArgCount | Y5: =RC[-5]*RC[-22]*RC[+3] -> #ERR: ArgCount | Z5: =VLOOKUP(RC[-24], ComponentsPivot!R3C1:R25C7, 6, 0) -> #ERR: ArgCount | AA5: =IF(RC[-4], (RC[-1]+RC[-3])/RC[-4], 0) -> #ERR: ArgCount | AB5: =RC[+1]>RC[-7] -> #ERR: ArgCount | AC5: =VLOOKUP(RC[-28], ProductsPivot!R4C1:R12C3, 3, 0) -> #ERR: ArgCount | AD5: =MAX(RC[-1]-RC[-9], 0) -> #ERR: ArgCount | AE5: =RC[-1]*RC[-26] -> #ERR: ArgCount | AF5: =RC[-1]*RC[-29] -> #ERR: ArgCount | AG5: =VLOOKUP(RC[-31], ComponentsPivot!R3C1:R25C7, 7, 0) -> #ERR: ArgCount | AH5: =RC[-10]-RC[-1] -> #ERR: ArgCount | AI5: =ROUND(RC[-18]+RC[-4], 0) -> #ERR: ArgCount
A6: =BillofMaterials!R[+2]C -> AB100 | B6: =BillofMaterials!R[+2]C -> BT100 | C6: =BillofMaterials!R[+2]C -> 48 | D6: =BillofMaterials!R[+2]C -> #ERR: ArgCount | E6: =VLOOKUP(RC[-4], TheBusiness!R8C1:R14C4, 4, 0) -> #ERR: ArgCount | F6: =VLOOKUP(RC[-5], ItemMaster!R6C1:R31C8, R1C, 0) -> #ERR: ArgCount | G6: =IF(RC[-2], RC[-1]/RC[-2], 0) -> #ERR: ArgCount | H6: =RC[-3]*RC[-5]*RC[+6] -> #ERR: ArgCount | I6: =MAX(VLOOKUP(RC[-7], ComponentsPivot!R3C1:R25C7, 2, 0), RC[-4]*RC[-6]) -> #ERR: ArgCount | J6: =VLOOKUP(RC[-8], ItemMaster!R6C1:R31C8, R1C, 0) -> #ERR: ArgCount | K6: =RC[-5]*RC[-8]*RC[+3] -> #ERR: ArgCount | L6: =VLOOKUP(RC[-10], ComponentsPivot!R3C1:R25C3, 3, 0) -> #ERR: ArgCount | M6: =IF(RC[-4], (RC[-1]+RC[-3])/RC[-4], 0) -> #ERR: ArgCount | N6: =AND(RC[+1], RC[-7]<RC[-1]) -> #ERR: ArgCount | O6: =VLOOKUP(RC[-14], ProductsPivot!R4C1:R12C3, 2, 0) -> #ERR: ArgCount | P6: =MAX(RC[-1]-RC[-9], 0) -> #ERR: ArgCount | Q6: =RC[-1]*RC[-12] -> #ERR: ArgCount | R6: =RC[-1]*RC[-15] -> #ERR: ArgCount | S6: =VLOOKUP(RC[-17], ComponentsPivot!R3C1:R25C4, 4, 0) -> #ERR: ArgCount | T6: =RC[-14]+RC[-3] -> #ERR: ArgCount | U6: =IF(RC[-16], RC[-1]/RC[-16], 0) -> #ERR: ArgCount | V6: =RC[-17]*RC[-19]*RC[+6] -> #ERR: ArgCount | W6: =MAX(VLOOKUP(RC[-21], ComponentsPivot!R3C1:R25C7, 5, 0), RC[-18]*RC[-20]) -> #ERR: ArgCount | X6: =RC[-14]-RC[-5] -> #ERR: ArgCount | Y6: =RC[-5]*RC[-22]*RC[+3] -> #ERR: ArgCount | Z6: =VLOOKUP(RC[-24], ComponentsPivot!R3C1:R25C7, 6, 0) -> #ERR: ArgCount | AA6: =IF(RC[-4], (RC[-1]+RC[-3])/RC[-4], 0) -> #ERR: ArgCount | AB6: =RC[+1]>RC[-7] -> #ERR: ArgCount | AC6: =VLOOKUP(RC[-28], ProductsPivot!R4C1:R12C3, 3, 0) -> #ERR: ArgCount | AD6: =MAX(RC[-1]-RC[-9], 0) -> #ERR: ArgCount | AE6: =RC[-1]*RC[-26] -> #ERR: ArgCount | AF6: =RC[-1]*RC[-29] -> #ERR: ArgCount | AG6: =VLOOKUP(RC[-31], ComponentsPivot!R3C1:R25C7, 7, 0) -> #ERR: ArgCount | AH6: =RC[-10]-RC[-1] -> #ERR: ArgCount | AI6: =ROUND(RC[-18]+RC[-4], 0) -> #ERR: ArgCount
A7: =BillofMaterials!R[+2]C -> AB100 | B7: =BillofMaterials!R[+2]C -> CAPF | C7: =BillofMaterials!R[+2]C -> 48 | D7: =BillofMaterials!R[+2]C -> #ERR: ArgCount | E7: =VLOOKUP(RC[-4], TheBusiness!R8C1:R14C4, 4, 0) -> #ERR: ArgCount | F7: =VLOOKUP(RC[-5], ItemMaster!R6C1:R31C8, R1C, 0) -> #ERR: ArgCount | G7: =IF(RC[-2], RC[-1]/RC[-2], 0) -> #ERR: ArgCount | H7: =RC[-3]*RC[-5]*RC[+6] -> #ERR: ArgCount | I7: =MAX(VLOOKUP(RC[-7], ComponentsPivot!R3C1:R25C7, 2, 0), RC[-4]*RC[-6]) -> #ERR: ArgCount | J7: =VLOOKUP(RC[-8], ItemMaster!R6C1:R31C8, R1C, 0) -> #ERR: ArgCount | K7: =RC[-5]*RC[-8]*RC[+3] -> #ERR: ArgCount | L7: =VLOOKUP(RC[-10], ComponentsPivot!R3C1:R25C3, 3, 0) -> #ERR: ArgCount | M7: =IF(RC[-4], (RC[-1]+RC[-3])/RC[-4], 0) -> #ERR: ArgCount | N7: =AND(RC[+1], RC[-7]<RC[-1]) -> #ERR: ArgCount | O7: =VLOOKUP(RC[-14], ProductsPivot!R4C1:R12C3, 2, 0) -> #ERR: ArgCount | P7: =MAX(RC[-1]-RC[-9], 0) -> #ERR: ArgCount | Q7: =RC[-1]*RC[-12] -> #ERR: ArgCount | R7: =RC[-1]*RC[-15] -> #ERR: ArgCount | S7: =VLOOKUP(RC[-17], ComponentsPivot!R3C1:R25C4, 4, 0) -> #ERR: ArgCount | T7: =RC[-14]+RC[-3] -> #ERR: ArgCount | U7: =IF(RC[-16], RC[-1]/RC[-16], 0) -> #ERR: ArgCount | V7: =RC[-17]*RC[-19]*RC[+6] -> #ERR: ArgCount | W7: =MAX(VLOOKUP(RC[-21], ComponentsPivot!R3C1:R25C7, 5, 0), RC[-18]*RC[-20]) -> #ERR: ArgCount | X7: =RC[-14]-RC[-5] -> #ERR: ArgCount | Y7: =RC[-5]*RC[-22]*RC[+3] -> #ERR: ArgCount | Z7: =VLOOKUP(RC[-24], ComponentsPivot!R3C1:R25C7, 6, 0) -> #ERR: ArgCount | AA7: =IF(RC[-4], (RC[-1]+RC[-3])/RC[-4], 0) -> #ERR: ArgCount | AB7: =RC[+1]>RC[-7] -> #ERR: ArgCount | AC7: =VLOOKUP(RC[-28], ProductsPivot!R4C1:R12C3, 3, 0) -> #ERR: ArgCount | AD7: =MAX(RC[-1]-RC[-9], 0) -> #ERR: ArgCount | AE7: =RC[-1]*RC[-26] -> #ERR: ArgCount | AF7: =RC[-1]*RC[-29] -> #ERR: ArgCount | AG7: =VLOOKUP(RC[-31], ComponentsPivot!R3C1:R25C7, 7, 0) -> #ERR: ArgCount | AH7: =RC[-10]-RC[-1] -> #ERR: ArgCount | AI7: =ROUND(RC[-18]+RC[-4], 0) -> #ERR: ArgCount
A8: =BillofMaterials!R[+2]C -> AB100 | B8: =BillofMaterials!R[+2]C -> CARS | C8: =BillofMaterials!R[+2]C -> 1 | D8: =BillofMaterials!R[+2]C -> #ERR: ArgCount | E8: =VLOOKUP(RC[-4], TheBusiness!R8C1:R14C4, 4, 0) -> #ERR: ArgCount | F8: =VLOOKUP(RC[-5], ItemMaster!R6C1:R31C8, R1C, 0) -> #ERR: ArgCount | G8: =IF(RC[-2], RC[-1]/RC[-2], 0) -> #ERR: ArgCount | H8: =RC[-3]*RC[-5]*RC[+6] -> #ERR: ArgCount | I8: =MAX(VLOOKUP(RC[-7], ComponentsPivot!R3C1:R25C7, 2, 0), RC[-4]*RC[-6]) -> #ERR: ArgCount | J8: =VLOOKUP(RC[-8], ItemMaster!R6C1:R31C8, R1C, 0) -> #ERR: ArgCount | K8: =RC[-5]*RC[-8]*RC[+3] -> #ERR: ArgCount | L8: =VLOOKUP(RC[-10], ComponentsPivot!R3C1:R25C3, 3, 0) -> #ERR: ArgCount | M8: =IF(RC[-4], (RC[-1]+RC[-3])/RC[-4], 0) -> #ERR: ArgCount | N8: =AND(RC[+1], RC[-7]<RC[-1]) -> #ERR: ArgCount | O8: =VLOOKUP(RC[-14], ProductsPivot!R4C1:R12C3, 2, 0) -> #ERR: ArgCount | P8: =MAX(RC[-1]-RC[-9], 0) -> #ERR: ArgCount | Q8: =RC[-1]*RC[-12] -> #ERR: ArgCount | R8: =RC[-1]*RC[-15] -> #ERR: ArgCount | S8: =VLOOKUP(RC[-17], ComponentsPivot!R3C1:R25C4, 4, 0) -> #ERR: ArgCount | T8: =RC[-14]+RC[-3] -> #ERR: ArgCount | U8: =IF(RC[-16], RC[-1]/RC[-16], 0) -> #ERR: ArgCount | V8: =RC[-17]*RC[-19]*RC[+6] -> #ERR: ArgCount | W8: =MAX(VLOOKUP(RC[-21], ComponentsPivot!R3C1:R25C7, 5, 0), RC[-18]*RC[-20]) -> #ERR: ArgCount | X8: =RC[-14]-RC[-5] -> #ERR: ArgCount | Y8: =RC[-5]*RC[-22]*RC[+3] -> #ERR: ArgCount | Z8: =VLOOKUP(RC[-24], ComponentsPivot!R3C1:R25C7, 6, 0) -> #ERR: ArgCount | AA8: =IF(RC[-4], (RC[-1]+RC[-3])/RC[-4], 0) -> #ERR: ArgCount | AB8: =RC[+1]>RC[-7] -> #ERR: ArgCount | AC8: =VLOOKUP(RC[-28], ProductsPivot!R4C1:R12C3, 3, 0) -> #ERR: ArgCount | AD8: =MAX(RC[-1]-RC[-9], 0) -> #ERR: ArgCount | AE8: =RC[-1]*RC[-26] -> #ERR: ArgCount | AF8: =RC[-1]*RC[-29] -> #ERR: ArgCount | AG8: =VLOOKUP(RC[-31], ComponentsPivot!R3C1:R25C7, 7, 0) -> #ERR: ArgCount | AH8: =RC[-10]-RC[-1] -> #ERR: ArgCount | AI8: =ROUND(RC[-18]+RC[-4], 0) -> #ERR: ArgCount
A9: =BillofMaterials!R[+2]C -> AB100 | B9: =BillofMaterials!R[+2]C -> ESA | C9: =BillofMaterials!R[+2]C -> 0.048 | D9: =BillofMaterials!R[+2]C -> #ERR: ArgCount | E9: =VLOOKUP(RC[-4], TheBusiness!R8C1:R14C4, 4, 0) -> #ERR: ArgCount | F9: =VLOOKUP(RC[-5], ItemMaster!R6C1:R31C8, R1C, 0) -> #ERR: ArgCount | G9: =IF(RC[-2], RC[-1]/RC[-2], 0) -> #ERR: ArgCount | H9: =RC[-3]*RC[-5]*RC[+6] -> #ERR: ArgCount | I9: =MAX(VLOOKUP(RC[-7], ComponentsPivot!R3C1:R25C7, 2, 0), RC[-4]*RC[-6]) -> #ERR: ArgCount | J9: =VLOOKUP(RC[-8], ItemMaster!R6C1:R31C8, R1C, 0) -> #ERR: ArgCount | K9: =RC[-5]*RC[-8]*RC[+3] -> #ERR: ArgCount | L9: =VLOOKUP(RC[-10], ComponentsPivot!R3C1:R25C3, 3, 0) -> #ERR: ArgCount | M9: =IF(RC[-4], (RC[-1]+RC[-3])/RC[-4], 0) -> #ERR: ArgCount | N9: =AND(RC[+1], RC[-7]<RC[-1]) -> #ERR: ArgCount | O9: =VLOOKUP(RC[-14], ProductsPivot!R4C1:R12C3, 2, 0) -> #ERR: ArgCount | P9: =MAX(RC[-1]-RC[-9], 0) -> #ERR: ArgCount | Q9: =RC[-1]*RC[-12] -> #ERR: ArgCount | R9: =RC[-1]*RC[-15] -> #ERR: ArgCount | S9: =VLOOKUP(RC[-17], ComponentsPivot!R3C1:R25C4, 4, 0) -> #ERR: ArgCount | T9: =RC[-14]+RC[-3] -> #ERR: ArgCount | U9: =IF(RC[-16], RC[-1]/RC[-16], 0) -> #ERR: ArgCount | V9: =RC[-17]*RC[-19]*RC[+6] -> #ERR: ArgCount | W9: =MAX(VLOOKUP(RC[-21], ComponentsPivot!R3C1:R25C7, 5, 0), RC[-18]*RC[-20]) -> #ERR: ArgCount | X9: =RC[-14]-RC[-5] -> #ERR: ArgCount | Y9: =RC[-5]*RC[-22]*RC[+3] -> #ERR: ArgCount | Z9: =VLOOKUP(RC[-24], ComponentsPivot!R3C1:R25C7, 6, 0) -> #ERR: ArgCount | AA9: =IF(RC[-4], (RC[-1]+RC[-3])/RC[-4], 0) -> #ERR: ArgCount | AB9: =RC[+1]>RC[-7] -> #ERR: ArgCount | AC9: =VLOOKUP(RC[-28], ProductsPivot!R4C1:R12C3, 3, 0) -> #ERR: ArgCount | AD9: =MAX(RC[-1]-RC[-9], 0) -> #ERR: ArgCount | AE9: =RC[-1]*RC[-26] -> #ERR: ArgCount | AF9: =RC[-1]*RC[-29] -> #ERR: ArgCount | AG9: =VLOOKUP(RC[-31], ComponentsPivot!R3C1:R25C7, 7, 0) -> #ERR: ArgCount | AH9: =RC[-10]-RC[-1] -> #ERR: ArgCount | AI9: =ROUND(RC[-18]+RC[-4], 0) -> #ERR: ArgCount
A10: =BillofMaterials!R[+2]C -> AB100 | B10: =BillofMaterials!R[+2]C -> LAB10 | C10: =BillofMaterials!R[+2]C -> 50 | D10: =BillofMaterials!R[+2]C -> #ERR: ArgCount | E10: =VLOOKUP(RC[-4], TheBusiness!R8C1:R14C4, 4, 0) -> #ERR: ArgCount | F10: =VLOOKUP(RC[-5], ItemMaster!R6C1:R31C8, R1C, 0) -> #ERR: ArgCount | G10: =IF(RC[-2], RC[-1]/RC[-2], 0) -> #ERR: ArgCount | H10: =RC[-3]*RC[-5]*RC[+6] -> #ERR: ArgCount | I10: =MAX(VLOOKUP(RC[-7], ComponentsPivot!R3C1:R25C7, 2, 0), RC[-4]*RC[-6]) -> #ERR: ArgCount | J10: =VLOOKUP(RC[-8], ItemMaster!R6C1:R31C8, R1C, 0) -> #ERR: ArgCount | K10: =RC[-5]*RC[-8]*RC[+3] -> #ERR: ArgCount | L10: =VLOOKUP(RC[-10], ComponentsPivot!R3C1:R25C3, 3, 0) -> #ERR: ArgCount | M10: =IF(RC[-4], (RC[-1]+RC[-3])/RC[-4], 0) -> #ERR: ArgCount | N10: =AND(RC[+1], RC[-7]<RC[-1]) -> #ERR: ArgCount | O10: =VLOOKUP(RC[-14], ProductsPivot!R4C1:R12C3, 2, 0) -> #ERR: ArgCount | P10: =MAX(RC[-1]-RC[-9], 0) -> #ERR: ArgCount | Q10: =RC[-1]*RC[-12] -> #ERR: ArgCount | R10: =RC[-1]*RC[-15] -> #ERR: ArgCount | S10: =VLOOKUP(RC[-17], ComponentsPivot!R3C1:R25C4, 4, 0) -> #ERR: ArgCount | T10: =RC[-14]+RC[-3] -> #ERR: ArgCount | U10: =IF(RC[-16], RC[-1]/RC[-16], 0) -> #ERR: ArgCount | V10: =RC[-17]*RC[-19]*RC[+6] -> #ERR: ArgCount | W10: =MAX(VLOOKUP(RC[-21], ComponentsPivot!R3C1:R25C7, 5, 0), RC[-18]*RC[-20]) -> #ERR: ArgCount | X10: =RC[-14]-RC[-5] -> #ERR: ArgCount | Y10: =RC[-5]*RC[-22]*RC[+3] -> #ERR: ArgCount | Z10: =VLOOKUP(RC[-24], ComponentsPivot!R3C1:R25C7, 6, 0) -> #ERR: ArgCount | AA10: =IF(RC[-4], (RC[-1]+RC[-3])/RC[-4], 0) -> #ERR: ArgCount | AB10: =RC[+1]>RC[-7] -> #ERR: ArgCount | AC10: =VLOOKUP(RC[-28], ProductsPivot!R4C1:R12C3, 3, 0) -> #ERR: ArgCount | AD10: =MAX(RC[-1]-RC[-9], 0) -> #ERR: ArgCount | AE10: =RC[-1]*RC[-26] -> #ERR: ArgCount | AF10: =RC[-1]*RC[-29] -> #ERR: ArgCount | AG10: =VLOOKUP(RC[-31], ComponentsPivot!R3C1:R25C7, 7, 0) -> #ERR: ArgCount | AH10: =RC[-10]-RC[-1] -> #ERR: ArgCount | AI10: =ROUND(RC[-18]+RC[-4], 0) -> #ERR: ArgCount
A11: =BillofMaterials!R[+2]C -> AB250 | B11: =BillofMaterials!R[+2]C -> BS01 | C11: =BillofMaterials!R[+2]C -> 12 | D11: =BillofMaterials!R[+2]C -> #ERR: ArgCount | E11: =VLOOKUP(RC[-4], TheBusiness!R8C1:R14C4, 4, 0) -> #ERR: ArgCount | F11: =VLOOKUP(RC[-5], ItemMaster!R6C1:R31C8, R1C, 0) -> #ERR: ArgCount | G11: =IF(RC[-2], RC[-1]/RC[-2], 0) -> #ERR: ArgCount | H11: =RC[-3]*RC[-5]*RC[+6] -> #ERR: ArgCount | I11: =MAX(VLOOKUP(RC[-7], ComponentsPivot!R3C1:R25C7, 2, 0), RC[-4]*RC[-6]) -> #ERR: ArgCount | J11: =VLOOKUP(RC[-8], ItemMaster!R6C1:R31C8, R1C, 0) -> #ERR: ArgCount | K11: =RC[-5]*RC[-8]*RC[+3] -> #ERR: ArgCount | L11: =VLOOKUP(RC[-10], ComponentsPivot!R3C1:R25C3, 3, 0) -> #ERR: ArgCount | M11: =IF(RC[-4], (RC[-1]+RC[-3])/RC[-4], 0) -> #ERR: ArgCount | N11: =AND(RC[+1], RC[-7]<RC[-1]) -> #ERR: ArgCount | O11: =VLOOKUP(RC[-14], ProductsPivot!R4C1:R12C3, 2, 0) -> #ERR: ArgCount | P11: =MAX(RC[-1]-RC[-9], 0) -> #ERR: ArgCount | Q11: =RC[-1]*RC[-12] -> #ERR: ArgCount | R11: =RC[-1]*RC[-15] -> #ERR: ArgCount | S11: =VLOOKUP(RC[-17], ComponentsPivot!R3C1:R25C4, 4, 0) -> #ERR: ArgCount | T11: =RC[-14]+RC[-3] -> #ERR: ArgCount | U11: =IF(RC[-16], RC[-1]/RC[-16], 0) -> #ERR: ArgCount | V11: =RC[-17]*RC[-19]*RC[+6] -> #ERR: ArgCount | W11: =MAX(VLOOKUP(RC[-21], ComponentsPivot!R3C1:R25C7, 5, 0), RC[-18]*RC[-20]) -> #ERR: ArgCount | X11: =RC[-14]-RC[-5] -> #ERR: ArgCount | Y11: =RC[-5]*RC[-22]*RC[+3] -> #ERR: ArgCount | Z11: =VLOOKUP(RC[-24], ComponentsPivot!R3C1:R25C7, 6, 0) -> #ERR: ArgCount | AA11: =IF(RC[-4], (RC[-1]+RC[-3])/RC[-4], 0) -> #ERR: ArgCount | AB11: =RC[+1]>RC[-7] -> #ERR: ArgCount | AC11: =VLOOKUP(RC[-28], ProductsPivot!R4C1:R12C3, 3, 0) -> #ERR: ArgCount | AD11: =MAX(RC[-1]-RC[-9], 0) -> #ERR: ArgCount | AE11: =RC[-1]*RC[-26] -> #ERR: ArgCount | AF11: =RC[-1]*RC[-29] -> #ERR: ArgCount | AG11: =VLOOKUP(RC[-31], ComponentsPivot!R3C1:R25C7, 7, 0) -> #ERR: ArgCount | AH11: =RC[-10]-RC[-1] -> #ERR: ArgCount | AI11: =ROUND(RC[-18]+RC[-4], 0) -> #ERR: ArgCount
A12: =BillofMaterials!R[+2]C -> AB250 | B12: =BillofMaterials!R[+2]C -> BT250 | C12: =BillofMaterials!R[+2]C -> 48 | D12: =BillofMaterials!R[+2]C -> #ERR: ArgCount | E12: =VLOOKUP(RC[-4], TheBusiness!R8C1:R14C4, 4, 0) -> #ERR: ArgCount | F12: =VLOOKUP(RC[-5], ItemMaster!R6C1:R31C8, R1C, 0) -> #ERR: ArgCount | G12: =IF(RC[-2], RC[-1]/RC[-2], 0) -> #ERR: ArgCount | H12: =RC[-3]*RC[-5]*RC[+6] -> #ERR: ArgCount | I12: =MAX(VLOOKUP(RC[-7], ComponentsPivot!R3C1:R25C7, 2, 0), RC[-4]*RC[-6]) -> #ERR: ArgCount | J12: =VLOOKUP(RC[-8], ItemMaster!R6C1:R31C8, R1C, 0) -> #ERR: ArgCount | K12: =RC[-5]*RC[-8]*RC[+3] -> #ERR: ArgCount | L12: =VLOOKUP(RC[-10], ComponentsPivot!R3C1:R25C3, 3, 0) -> #ERR: ArgCount | M12: =IF(RC[-4], (RC[-1]+RC[-3])/RC[-4], 0) -> #ERR: ArgCount | N12: =AND(RC[+1], RC[-7]<RC[-1]) -> #ERR: ArgCount | O12: =VLOOKUP(RC[-14], ProductsPivot!R4C1:R12C3, 2, 0) -> #ERR: ArgCount | P12: =MAX(RC[-1]-RC[-9], 0) -> #ERR: ArgCount | Q12: =RC[-1]*RC[-12] -> #ERR: ArgCount | R12: =RC[-1]*RC[-15] -> #ERR: ArgCount | S12: =VLOOKUP(RC[-17], ComponentsPivot!R3C1:R25C4, 4, 0) -> #ERR: ArgCount | T12: =RC[-14]+RC[-3] -> #ERR: ArgCount | U12: =IF(RC[-16], RC[-1]/RC[-16], 0) -> #ERR: ArgCount | V12: =RC[-17]*RC[-19]*RC[+6] -> #ERR: ArgCount | W12: =MAX(VLOOKUP(RC[-21], ComponentsPivot!R3C1:R25C7, 5, 0), RC[-18]*RC[-20]) -> #ERR: ArgCount | X12: =RC[-14]-RC[-5] -> #ERR: ArgCount | Y12: =RC[-5]*RC[-22]*RC[+3] -> #ERR: ArgCount | Z12: =VLOOKUP(RC[-24], ComponentsPivot!R3C1:R25C7, 6, 0) -> #ERR: ArgCount | AA12: =IF(RC[-4], (RC[-1]+RC[-3])/RC[-4], 0) -> #ERR: ArgCount | AB12: =RC[+1]>RC[-7] -> #ERR: ArgCount | AC12: =VLOOKUP(RC[-28], ProductsPivot!R4C1:R12C3, 3, 0) -> #ERR: ArgCount | AD12: =MAX(RC[-1]-RC[-9], 0) -> #ERR: ArgCount | AE12: =RC[-1]*RC[-26] -> #ERR: ArgCount | AF12: =RC[-1]*RC[-29] -> #ERR: ArgCount | AG12: =VLOOKUP(RC[-31], ComponentsPivot!R3C1:R25C7, 7, 0) -> #ERR: ArgCount | AH12: =RC[-10]-RC[-1] -> #ERR: ArgCount | AI12: =ROUND(RC[-18]+RC[-4], 0) -> #ERR: ArgCount
A13: =BillofMaterials!R[+2]C -> AB250 | B13: =BillofMaterials!R[+2]C -> CAPF | C13: =BillofMaterials!R[+2]C -> 48 | D13: =BillofMaterials!R[+2]C -> #ERR: ArgCount | E13: =VLOOKUP(RC[-4], TheBusiness!R8C1:R14C4, 4, 0) -> #ERR: ArgCount | F13: =VLOOKUP(RC[-5], ItemMaster!R6C1:R31C8, R1C, 0) -> #ERR: ArgCount | G13: =IF(RC[-2], RC[-1]/RC[-2], 0) -> #ERR: ArgCount | H13: =RC[-3]*RC[-5]*RC[+6] -> #ERR: ArgCount | I13: =MAX(VLOOKUP(RC[-7], ComponentsPivot!R3C1:R25C7, 2, 0), RC[-4]*RC[-6]) -> #ERR: ArgCount | J13: =VLOOKUP(RC[-8], ItemMaster!R6C1:R31C8, R1C, 0) -> #ERR: ArgCount | K13: =RC[-5]*RC[-8]*RC[+3] -> #ERR: ArgCount | L13: =VLOOKUP(RC[-10], ComponentsPivot!R3C1:R25C3, 3, 0) -> #ERR: ArgCount | M13: =IF(RC[-4], (RC[-1]+RC[-3])/RC[-4], 0) -> #ERR: ArgCount | N13: =AND(RC[+1], RC[-7]<RC[-1]) -> #ERR: ArgCount | O13: =VLOOKUP(RC[-14], ProductsPivot!R4C1:R12C3, 2, 0) -> #ERR: ArgCount | P13: =MAX(RC[-1]-RC[-9], 0) -> #ERR: ArgCount | Q13: =RC[-1]*RC[-12] -> #ERR: ArgCount | R13: =RC[-1]*RC[-15] -> #ERR: ArgCount | S13: =VLOOKUP(RC[-17], ComponentsPivot!R3C1:R25C4, 4, 0) -> #ERR: ArgCount | T13: =RC[-14]+RC[-3] -> #ERR: ArgCount | U13: =IF(RC[-16], RC[-1]/RC[-16], 0) -> #ERR: ArgCount | V13: =RC[-17]*RC[-19]*RC[+6] -> #ERR: ArgCount | W13: =MAX(VLOOKUP(RC[-21], ComponentsPivot!R3C1:R25C7, 5, 0), RC[-18]*RC[-20]) -> #ERR: ArgCount | X13: =RC[-14]-RC[-5] -> #ERR: ArgCount | Y13: =RC[-5]*RC[-22]*RC[+3] -> #ERR: ArgCount | Z13: =VLOOKUP(RC[-24], ComponentsPivot!R3C1:R25C7, 6, 0) -> #ERR: ArgCount | AA13: =IF(RC[-4], (RC[-1]+RC[-3])/RC[-4], 0) -> #ERR: ArgCount | AB13: =RC[+1]>RC[-7] -> #ERR: ArgCount | AC13: =VLOOKUP(RC[-28], ProductsPivot!R4C1:R12C3, 3, 0) -> #ERR: ArgCount | AD13: =MAX(RC[-1]-RC[-9], 0) -> #ERR: ArgCount | AE13: =RC[-1]*RC[-26] -> #ERR: ArgCount | AF13: =RC[-1]*RC[-29] -> #ERR: ArgCount | AG13: =VLOOKUP(RC[-31], ComponentsPivot!R3C1:R25C7, 7, 0) -> #ERR: ArgCount | AH13: =RC[-10]-RC[-1] -> #ERR: ArgCount | AI13: =ROUND(RC[-18]+RC[-4], 0) -> #ERR: ArgCount
A14: =BillofMaterials!R[+2]C -> AB250 | B14: =BillofMaterials!R[+2]C -> CARL | C14: =BillofMaterials!R[+2]C -> 1 | D14: =BillofMaterials!R[+2]C -> #ERR: ArgCount | E14: =VLOOKUP(RC[-4], TheBusiness!R8C1:R14C4, 4, 0) -> #ERR: ArgCount | F14: =VLOOKUP(RC[-5], ItemMaster!R6C1:R31C8, R1C, 0) -> #ERR: ArgCount | G14: =IF(RC[-2], RC[-1]/RC[-2], 0) -> #ERR: ArgCount | H14: =RC[-3]*RC[-5]*RC[+6] -> #ERR: ArgCount | I14: =MAX(VLOOKUP(RC[-7], ComponentsPivot!R3C1:R25C7, 2, 0), RC[-4]*RC[-6]) -> #ERR: ArgCount | J14: =VLOOKUP(RC[-8], ItemMaster!R6C1:R31C8, R1C, 0) -> #ERR: ArgCount | K14: =RC[-5]*RC[-8]*RC[+3] -> #ERR: ArgCount | L14: =VLOOKUP(RC[-10], ComponentsPivot!R3C1:R25C3, 3, 0) -> #ERR: ArgCount | M14: =IF(RC[-4], (RC[-1]+RC[-3])/RC[-4], 0) -> #ERR: ArgCount | N14: =AND(RC[+1], RC[-7]<RC[-1]) -> #ERR: ArgCount | O14: =VLOOKUP(RC[-14], ProductsPivot!R4C1:R12C3, 2, 0) -> #ERR: ArgCount | P14: =MAX(RC[-1]-RC[-9], 0) -> #ERR: ArgCount | Q14: =RC[-1]*RC[-12] -> #ERR: ArgCount | R14: =RC[-1]*RC[-15] -> #ERR: ArgCount | S14: =VLOOKUP(RC[-17], ComponentsPivot!R3C1:R25C4, 4, 0) -> #ERR: ArgCount | T14: =RC[-14]+RC[-3] -> #ERR: ArgCount | U14: =IF(RC[-16], RC[-1]/RC[-16], 0) -> #ERR: ArgCount | V14: =RC[-17]*RC[-19]*RC[+6] -> #ERR: ArgCount | W14: =MAX(VLOOKUP(RC[-21], ComponentsPivot!R3C1:R25C7, 5, 0), RC[-18]*RC[-20]) -> #ERR: ArgCount | X14: =RC[-14]-RC[-5] -> #ERR: ArgCount | Y14: =RC[-5]*RC[-22]*RC[+3] -> #ERR: ArgCount | Z14: =VLOOKUP(RC[-24], ComponentsPivot!R3C1:R25C7, 6, 0) -> #ERR: ArgCount | AA14: =IF(RC[-4], (RC[-1]+RC[-3])/RC[-4], 0) -> #ERR: ArgCount | AB14: =RC[+1]>RC[-7] -> #ERR: ArgCount | AC14: =VLOOKUP(RC[-28], ProductsPivot!R4C1:R12C3, 3, 0) -> #ERR: ArgCount | AD14: =MAX(RC[-1]-RC[-9], 0) -> #ERR: ArgCount | AE14: =RC[-1]*RC[-26] -> #ERR: ArgCount | AF14: =RC[-1]*RC[-29] -> #ERR: ArgCount | AG14: =VLOOKUP(RC[-31], ComponentsPivot!R3C1:R25C7, 7, 0) -> #ERR: ArgCount | AH14: =RC[-10]-RC[-1] -> #ERR: ArgCount | AI14: =ROUND(RC[-18]+RC[-4], 0) -> #ERR: ArgCount
A15: =BillofMaterials!R[+2]C -> AB250 | B15: =BillofMaterials!R[+2]C -> ESA | C15: =BillofMaterials!R[+2]C -> 0.12 | D15: =BillofMaterials!R[+2]C -> #ERR: ArgCount | E15: =VLOOKUP(RC[-4], TheBusiness!R8C1:R14C4, 4, 0) -> #ERR: ArgCount | F15: =VLOOKUP(RC[-5], ItemMaster!R6C1:R31C8, R1C, 0) -> #ERR: ArgCount | G15: =IF(RC[-2], RC[-1]/RC[-2], 0) -> #ERR: ArgCount | H15: =RC[-3]*RC[-5]*RC[+6] -> #ERR: ArgCount | I15: =MAX(VLOOKUP(RC[-7], ComponentsPivot!R3C1:R25C7, 2, 0), RC[-4]*RC[-6]) -> #ERR: ArgCount | J15: =VLOOKUP(RC[-8], ItemMaster!R6C1:R31C8, R1C, 0) -> #ERR: ArgCount | K15: =RC[-5]*RC[-8]*RC[+3] -> #ERR: ArgCount | L15: =VLOOKUP(RC[-10], ComponentsPivot!R3C1:R25C3, 3, 0) -> #ERR: ArgCount | M15: =IF(RC[-4], (RC[-1]+RC[-3])/RC[-4], 0) -> #ERR: ArgCount | N15: =AND(RC[+1], RC[-7]<RC[-1]) -> #ERR: ArgCount | O15: =VLOOKUP(RC[-14], ProductsPivot!R4C1:R12C3, 2, 0) -> #ERR: ArgCount | P15: =MAX(RC[-1]-RC[-9], 0) -> #ERR: ArgCount | Q15: =RC[-1]*RC[-12] -> #ERR: ArgCount | R15: =RC[-1]*RC[-15] -> #ERR: ArgCount | S15: =VLOOKUP(RC[-17], ComponentsPivot!R3C1:R25C4, 4, 0) -> #ERR: ArgCount | T15: =RC[-14]+RC[-3] -> #ERR: ArgCount | U15: =IF(RC[-16], RC[-1]/RC[-16], 0) -> #ERR: ArgCount | V15: =RC[-17]*RC[-19]*RC[+6] -> #ERR: ArgCount | W15: =MAX(VLOOKUP(RC[-21], ComponentsPivot!R3C1:R25C7, 5, 0), RC[-18]*RC[-20]) -> #ERR: ArgCount | X15: =RC[-14]-RC[-5] -> #ERR: ArgCount | Y15: =RC[-5]*RC[-22]*RC[+3] -> #ERR: ArgCount | Z15: =VLOOKUP(RC[-24], ComponentsPivot!R3C1:R25C7, 6, 0) -> #ERR: ArgCount | AA15: =IF(RC[-4], (RC[-1]+RC[-3])/RC[-4], 0) -> #ERR: ArgCount | AB15: =RC[+1]>RC[-7] -> #ERR: ArgCount | AC15: =VLOOKUP(RC[-28], ProductsPivot!R4C1:R12C3, 3, 0) -> #ERR: ArgCount | AD15: =MAX(RC[-1]-RC[-9], 0) -> #ERR: ArgCount | AE15: =RC[-1]*RC[-26] -> #ERR: ArgCount | AF15: =RC[-1]*RC[-29] -> #ERR: ArgCount | AG15: =VLOOKUP(RC[-31], ComponentsPivot!R3C1:R25C7, 7, 0) -> #ERR: ArgCount | AH15: =RC[-10]-RC[-1] -> #ERR: ArgCount | AI15: =ROUND(RC[-18]+RC[-4], 0) -> #ERR: ArgCount
A16: =BillofMaterials!R[+2]C -> AB250 | B16: =BillofMaterials!R[+2]C -> LAB25 | C16: =BillofMaterials!R[+2]C -> 50 | D16: =BillofMaterials!R[+2]C -> #ERR: ArgCount | E16: =VLOOKUP(RC[-4], TheBusiness!R8C1:R14C4, 4, 0) -> #ERR: ArgCount | F16: =VLOOKUP(RC[-5], ItemMaster!R6C1:R31C8, R1C, 0) -> #ERR: ArgCount | G16: =IF(RC[-2], RC[-1]/RC[-2], 0) -> #ERR: ArgCount | H16: =RC[-3]*RC[-5]*RC[+6] -> #ERR: ArgCount | I16: =MAX(VLOOKUP(RC[-7], ComponentsPivot!R3C1:R25C7, 2, 0), RC[-4]*RC[-6]) -> #ERR: ArgCount | J16: =VLOOKUP(RC[-8], ItemMaster!R6C1:R31C8, R1C, 0) -> #ERR: ArgCount | K16: =RC[-5]*RC[-8]*RC[+3] -> #ERR: ArgCount | L16: =VLOOKUP(RC[-10], ComponentsPivot!R3C1:R25C3, 3, 0) -> #ERR: ArgCount | M16: =IF(RC[-4], (RC[-1]+RC[-3])/RC[-4], 0) -> #ERR: ArgCount | N16: =AND(RC[+1], RC[-7]<RC[-1]) -> #ERR: ArgCount | O16: =VLOOKUP(RC[-14], ProductsPivot!R4C1:R12C3, 2, 0) -> #ERR: ArgCount | P16: =MAX(RC[-1]-RC[-9], 0) -> #ERR: ArgCount | Q16: =RC[-1]*RC[-12] -> #ERR: ArgCount | R16: =RC[-1]*RC[-15] -> #ERR: ArgCount | S16: =VLOOKUP(RC[-17], ComponentsPivot!R3C1:R25C4, 4, 0) -> #ERR: ArgCount | T16: =RC[-14]+RC[-3] -> #ERR: ArgCount | U16: =IF(RC[-16], RC[-1]/RC[-16], 0) -> #ERR: ArgCount | V16: =RC[-17]*RC[-19]*RC[+6] -> #ERR: ArgCount | W16: =MAX(VLOOKUP(RC[-21], ComponentsPivot!R3C1:R25C7, 5, 0), RC[-18]*RC[-20]) -> #ERR: ArgCount | X16: =RC[-14]-RC[-5] -> #ERR: ArgCount | Y16: =RC[-5]*RC[-22]*RC[+3] -> #ERR: ArgCount | Z16: =VLOOKUP(RC[-24], ComponentsPivot!R3C1:R25C7, 6, 0) -> #ERR: ArgCount | AA16: =IF(RC[-4], (RC[-1]+RC[-3])/RC[-4], 0) -> #ERR: ArgCount | AB16: =RC[+1]>RC[-7] -> #ERR: ArgCount | AC16: =VLOOKUP(RC[-28], ProductsPivot!R4C1:R12C3, 3, 0) -> #ERR: ArgCount | AD16: =MAX(RC[-1]-RC[-9], 0) -> #ERR: ArgCount | AE16: =RC[-1]*RC[-26] -> #ERR: ArgCount | AF16: =RC[-1]*RC[-29] -> #ERR: ArgCount | AG16: =VLOOKUP(RC[-31], ComponentsPivot!R3C1:R25C7, 7, 0) -> #ERR: ArgCount | AH16: =RC[-10]-RC[-1] -> #ERR: ArgCount | AI16: =ROUND(RC[-18]+RC[-4], 0) -> #ERR: ArgCount
A17: =BillofMaterials!R[+2]C -> AB500 | B17: =BillofMaterials!R[+2]C -> BS01 | C17: =BillofMaterials!R[+2]C -> 12 | D17: =BillofMaterials!R[+2]C -> #ERR: ArgCount | E17: =VLOOKUP(RC[-4], TheBusiness!R8C1:R14C4, 4, 0) -> #ERR: ArgCount | F17: =VLOOKUP(RC[-5], ItemMaster!R6C1:R31C8, R1C, 0) -> #ERR: ArgCount | G17: =IF(RC[-2], RC[-1]/RC[-2], 0) -> #ERR: ArgCount | H17: =RC[-3]*RC[-5]*RC[+6] -> #ERR: ArgCount | I17: =MAX(VLOOKUP(RC[-7], ComponentsPivot!R3C1:R25C7, 2, 0), RC[-4]*RC[-6]) -> #ERR: ArgCount | J17: =VLOOKUP(RC[-8], ItemMaster!R6C1:R31C8, R1C, 0) -> #ERR: ArgCount | K17: =RC[-5]*RC[-8]*RC[+3] -> #ERR: ArgCount | L17: =VLOOKUP(RC[-10], ComponentsPivot!R3C1:R25C3, 3, 0) -> #ERR: ArgCount | M17: =IF(RC[-4], (RC[-1]+RC[-3])/RC[-4], 0) -> #ERR: ArgCount | N17: =AND(RC[+1], RC[-7]<RC[-1]) -> #ERR: ArgCount | O17: =VLOOKUP(RC[-14], ProductsPivot!R4C1:R12C3, 2, 0) -> #ERR: ArgCount | P17: =MAX(RC[-1]-RC[-9], 0) -> #ERR: ArgCount | Q17: =RC[-1]*RC[-12] -> #ERR: ArgCount | R17: =RC[-1]*RC[-15] -> #ERR: ArgCount | S17: =VLOOKUP(RC[-17], ComponentsPivot!R3C1:R25C4, 4, 0) -> #ERR: ArgCount | T17: =RC[-14]+RC[-3] -> #ERR: ArgCount | U17: =IF(RC[-16], RC[-1]/RC[-16], 0) -> #ERR: ArgCount | V17: =RC[-17]*RC[-19]*RC[+6] -> #ERR: ArgCount | W17: =MAX(VLOOKUP(RC[-21], ComponentsPivot!R3C1:R25C7, 5, 0), RC[-18]*RC[-20]) -> #ERR: ArgCount | X17: =RC[-14]-RC[-5] -> #ERR: ArgCount | Y17: =RC[-5]*RC[-22]*RC[+3] -> #ERR: ArgCount | Z17: =VLOOKUP(RC[-24], ComponentsPivot!R3C1:R25C7, 6, 0) -> #ERR: ArgCount | AA17: =IF(RC[-4], (RC[-1]+RC[-3])/RC[-4], 0) -> #ERR: ArgCount | AB17: =RC[+1]>RC[-7] -> #ERR: ArgCount | AC17: =VLOOKUP(RC[-28], ProductsPivot!R4C1:R12C3, 3, 0) -> #ERR: ArgCount | AD17: =MAX(RC[-1]-RC[-9], 0) -> #ERR: ArgCount | AE17: =RC[-1]*RC[-26] -> #ERR: ArgCount | AF17: =RC[-1]*RC[-29] -> #ERR: ArgCount | AG17: =VLOOKUP(RC[-31], ComponentsPivot!R3C1:R25C7, 7, 0) -> #ERR: ArgCount | AH17: =RC[-10]-RC[-1] -> #ERR: ArgCount | AI17: =ROUND(RC[-18]+RC[-4], 0) -> #ERR: ArgCount
A18: =BillofMaterials!R[+2]C -> AB500 | B18: =BillofMaterials!R[+2]C -> BT500 | C18: =BillofMaterials!R[+2]C -> 24 | D18: =BillofMaterials!R[+2]C -> #ERR: ArgCount | E18: =VLOOKUP(RC[-4], TheBusiness!R8C1:R14C4, 4, 0) -> #ERR: ArgCount | F18: =VLOOKUP(RC[-5], ItemMaster!R6C1:R31C8, R1C, 0) -> #ERR: ArgCount | G18: =IF(RC[-2], RC[-1]/RC[-2], 0) -> #ERR: ArgCount | H18: =RC[-3]*RC[-5]*RC[+6] -> #ERR: ArgCount | I18: =MAX(VLOOKUP(RC[-7], ComponentsPivot!R3C1:R25C7, 2, 0), RC[-4]*RC[-6]) -> #ERR: ArgCount | J18: =VLOOKUP(RC[-8], ItemMaster!R6C1:R31C8, R1C, 0) -> #ERR: ArgCount | K18: =RC[-5]*RC[-8]*RC[+3] -> #ERR: ArgCount | L18: =VLOOKUP(RC[-10], ComponentsPivot!R3C1:R25C3, 3, 0) -> #ERR: ArgCount | M18: =IF(RC[-4], (RC[-1]+RC[-3])/RC[-4], 0) -> #ERR: ArgCount | N18: =AND(RC[+1], RC[-7]<RC[-1]) -> #ERR: ArgCount | O18: =VLOOKUP(RC[-14], ProductsPivot!R4C1:R12C3, 2, 0) -> #ERR: ArgCount | P18: =MAX(RC[-1]-RC[-9], 0) -> #ERR: ArgCount | Q18: =RC[-1]*RC[-12] -> #ERR: ArgCount | R18: =RC[-1]*RC[-15] -> #ERR: ArgCount | S18: =VLOOKUP(RC[-17], ComponentsPivot!R3C1:R25C4, 4, 0) -> #ERR: ArgCount | T18: =RC[-14]+RC[-3] -> #ERR: ArgCount | U18: =IF(RC[-16], RC[-1]/RC[-16], 0) -> #ERR: ArgCount | V18: =RC[-17]*RC[-19]*RC[+6] -> #ERR: ArgCount | W18: =MAX(VLOOKUP(RC[-21], ComponentsPivot!R3C1:R25C7, 5, 0), RC[-18]*RC[-20]) -> #ERR: ArgCount | X18: =RC[-14]-RC[-5] -> #ERR: ArgCount | Y18: =RC[-5]*RC[-22]*RC[+3] -> #ERR: ArgCount | Z18: =VLOOKUP(RC[-24], ComponentsPivot!R3C1:R25C7, 6, 0) -> #ERR: ArgCount | AA18: =IF(RC[-4], (RC[-1]+RC[-3])/RC[-4], 0) -> #ERR: ArgCount | AB18: =RC[+1]>RC[-7] -> #ERR: ArgCount | AC18: =VLOOKUP(RC[-28], ProductsPivot!R4C1:R12C3, 3, 0) -> #ERR: ArgCount | AD18: =MAX(RC[-1]-RC[-9], 0) -> #ERR: ArgCount | AE18: =RC[-1]*RC[-26] -> #ERR: ArgCount | AF18: =RC[-1]*RC[-29] -> #ERR: ArgCount | AG18: =VLOOKUP(RC[-31], ComponentsPivot!R3C1:R25C7, 7, 0) -> #ERR: ArgCount | AH18: =RC[-10]-RC[-1] -> #ERR: ArgCount | AI18: =ROUND(RC[-18]+RC[-4], 0) -> #ERR: ArgCount
A19: =BillofMaterials!R[+2]C -> AB500 | B19: =BillofMaterials!R[+2]C -> CAPS | C19: =BillofMaterials!R[+2]C -> 24 | D19: =BillofMaterials!R[+2]C -> #ERR: ArgCount | E19: =VLOOKUP(RC[-4], TheBusiness!R8C1:R14C4, 4, 0) -> #ERR: ArgCount | F19: =VLOOKUP(RC[-5], ItemMaster!R6C1:R31C8, R1C, 0) -> #ERR: ArgCount | G19: =IF(RC[-2], RC[-1]/RC[-2], 0) -> #ERR: ArgCount | H19: =RC[-3]*RC[-5]*RC[+6] -> #ERR: ArgCount | I19: =MAX(VLOOKUP(RC[-7], ComponentsPivot!R3C1:R25C7, 2, 0), RC[-4]*RC[-6]) -> #ERR: ArgCount | J19: =VLOOKUP(RC[-8], ItemMaster!R6C1:R31C8, R1C, 0) -> #ERR: ArgCount | K19: =RC[-5]*RC[-8]*RC[+3] -> #ERR: ArgCount | L19: =VLOOKUP(RC[-10], ComponentsPivot!R3C1:R25C3, 3, 0) -> #ERR: ArgCount | M19: =IF(RC[-4], (RC[-1]+RC[-3])/RC[-4], 0) -> #ERR: ArgCount | N19: =AND(RC[+1], RC[-7]<RC[-1]) -> #ERR: ArgCount | O19: =VLOOKUP(RC[-14], ProductsPivot!R4C1:R12C3, 2, 0) -> #ERR: ArgCount | P19: =MAX(RC[-1]-RC[-9], 0) -> #ERR: ArgCount | Q19: =RC[-1]*RC[-12] -> #ERR: ArgCount | R19: =RC[-1]*RC[-15] -> #ERR: ArgCount | S19: =VLOOKUP(RC[-17], ComponentsPivot!R3C1:R25C4, 4, 0) -> #ERR: ArgCount | T19: =RC[-14]+RC[-3] -> #ERR: ArgCount | U19: =IF(RC[-16], RC[-1]/RC[-16], 0) -> #ERR: ArgCount | V19: =RC[-17]*RC[-19]*RC[+6] -> #ERR: ArgCount | W19: =MAX(VLOOKUP(RC[-21], ComponentsPivot!R3C1:R25C7, 5, 0), RC[-18]*RC[-20]) -> #ERR: ArgCount | X19: =RC[-14]-RC[-5] -> #ERR: ArgCount | Y19: =RC[-5]*RC[-22]*RC[+3] -> #ERR: ArgCount | Z19: =VLOOKUP(RC[-24], ComponentsPivot!R3C1:R25C7, 6, 0) -> #ERR: ArgCount | AA19: =IF(RC[-4], (RC[-1]+RC[-3])/RC[-4], 0) -> #ERR: ArgCount | AB19: =RC[+1]>RC[-7] -> #ERR: ArgCount | AC19: =VLOOKUP(RC[-28], ProductsPivot!R4C1:R12C3, 3, 0) -> #ERR: ArgCount | AD19: =MAX(RC[-1]-RC[-9], 0) -> #ERR: ArgCount | AE19: =RC[-1]*RC[-26] -> #ERR: ArgCount | AF19: =RC[-1]*RC[-29] -> #ERR: ArgCount | AG19: =VLOOKUP(RC[-31], ComponentsPivot!R3C1:R25C7, 7, 0) -> #ERR: ArgCount | AH19: =RC[-10]-RC[-1] -> #ERR: ArgCount | AI19: =ROUND(RC[-18]+RC[-4], 0) -> #ERR: ArgCount
A20: =BillofMaterials!R[+2]C -> AB500 | B20: =BillofMaterials!R[+2]C -> CARL | C20: =BillofMaterials!R[+2]C -> 1 | D20: =BillofMaterials!R[+2]C -> #ERR: ArgCount | E20: =VLOOKUP(RC[-4], TheBusiness!R8C1:R14C4, 4, 0) -> #ERR: ArgCount | F20: =VLOOKUP(RC[-5], ItemMaster!R6C1:R31C8, R1C, 0) -> #ERR: ArgCount | G20: =IF(RC[-2], RC[-1]/RC[-2], 0) -> #ERR: ArgCount | H20: =RC[-3]*RC[-5]*RC[+6] -> #ERR: ArgCount | I20: =MAX(VLOOKUP(RC[-7], ComponentsPivot!R3C1:R25C7, 2, 0), RC[-4]*RC[-6]) -> #ERR: ArgCount | J20: =VLOOKUP(RC[-8], ItemMaster!R6C1:R31C8, R1C, 0) -> #ERR: ArgCount | K20: =RC[-5]*RC[-8]*RC[+3] -> #ERR: ArgCount | L20: =VLOOKUP(RC[-10], ComponentsPivot!R3C1:R25C3, 3, 0) -> #ERR: ArgCount | M20: =IF(RC[-4], (RC[-1]+RC[-3])/RC[-4], 0) -> #ERR: ArgCount | N20: =AND(RC[+1], RC[-7]<RC[-1]) -> #ERR: ArgCount | O20: =VLOOKUP(RC[-14], ProductsPivot!R4C1:R12C3, 2, 0) -> #ERR: ArgCount | P20: =MAX(RC[-1]-RC[-9], 0) -> #ERR: ArgCount | Q20: =RC[-1]*RC[-12] -> #ERR: ArgCount | R20: =RC[-1]*RC[-15] -> #ERR: ArgCount | S20: =VLOOKUP(RC[-17], ComponentsPivot!R3C1:R25C4, 4, 0) -> #ERR: ArgCount | T20: =RC[-14]+RC[-3] -> #ERR: ArgCount | U20: =IF(RC[-16], RC[-1]/RC[-16], 0) -> #ERR: ArgCount | V20: =RC[-17]*RC[-19]*RC[+6] -> #ERR: ArgCount | W20: =MAX(VLOOKUP(RC[-21], ComponentsPivot!R3C1:R25C7, 5, 0), RC[-18]*RC[-20]) -> #ERR: ArgCount | X20: =RC[-14]-RC[-5] -> #ERR: ArgCount | Y20: =RC[-5]*RC[-22]*RC[+3] -> #ERR: ArgCount | Z20: =VLOOKUP(RC[-24], ComponentsPivot!R3C1:R25C7, 6, 0) -> #ERR: ArgCount | AA20: =IF(RC[-4], (RC[-1]+RC[-3])/RC[-4], 0) -> #ERR: ArgCount | AB20: =RC[+1]>RC[-7] -> #ERR: ArgCount | AC20: =VLOOKUP(RC[-28], ProductsPivot!R4C1:R12C3, 3, 0) -> #ERR: ArgCount | AD20: =MAX(RC[-1]-RC[-9], 0) -> #ERR: ArgCount | AE20: =RC[-1]*RC[-26] -> #ERR: ArgCount | AF20: =RC[-1]*RC[-29] -> #ERR: ArgCount | AG20: =VLOOKUP(RC[-31], ComponentsPivot!R3C1:R25C7, 7, 0) -> #ERR: ArgCount | AH20: =RC[-10]-RC[-1] -> #ERR: ArgCount | AI20: =ROUND(RC[-18]+RC[-4], 0) -> #ERR: ArgCount
A21: =BillofMaterials!R[+2]C -> AB500 | B21: =BillofMaterials!R[+2]C -> ESA | C21: =BillofMaterials!R[+2]C -> 0.12 | D21: =BillofMaterials!R[+2]C -> #ERR: ArgCount | E21: =VLOOKUP(RC[-4], TheBusiness!R8C1:R14C4, 4, 0) -> #ERR: ArgCount | F21: =VLOOKUP(RC[-5], ItemMaster!R6C1:R31C8, R1C, 0) -> #ERR: ArgCount | G21: =IF(RC[-2], RC[-1]/RC[-2], 0) -> #ERR: ArgCount | H21: =RC[-3]*RC[-5]*RC[+6] -> #ERR: ArgCount | I21: =MAX(VLOOKUP(RC[-7], ComponentsPivot!R3C1:R25C7, 2, 0), RC[-4]*RC[-6]) -> #ERR: ArgCount | J21: =VLOOKUP(RC[-8], ItemMaster!R6C1:R31C8, R1C, 0) -> #ERR: ArgCount | K21: =RC[-5]*RC[-8]*RC[+3] -> #ERR: ArgCount | L21: =VLOOKUP(RC[-10], ComponentsPivot!R3C1:R25C3, 3, 0) -> #ERR: ArgCount | M21: =IF(RC[-4], (RC[-1]+RC[-3])/RC[-4], 0) -> #ERR: ArgCount | N21: =AND(RC[+1], RC[-7]<RC[-1]) -> #ERR: ArgCount | O21: =VLOOKUP(RC[-14], ProductsPivot!R4C1:R12C3, 2, 0) -> #ERR: ArgCount | P21: =MAX(RC[-1]-RC[-9], 0) -> #ERR: ArgCount | Q21: =RC[-1]*RC[-12] -> #ERR: ArgCount | R21: =RC[-1]*RC[-15] -> #ERR: ArgCount | S21: =VLOOKUP(RC[-17], ComponentsPivot!R3C1:R25C4, 4, 0) -> #ERR: ArgCount | T21: =RC[-14]+RC[-3] -> #ERR: ArgCount | U21: =IF(RC[-16], RC[-1]/RC[-16], 0) -> #ERR: ArgCount | V21: =RC[-17]*RC[-19]*RC[+6] -> #ERR: ArgCount | W21: =MAX(VLOOKUP(RC[-21], ComponentsPivot!R3C1:R25C7, 5, 0), RC[-18]*RC[-20]) -> #ERR: ArgCount | X21: =RC[-14]-RC[-5] -> #ERR: ArgCount | Y21: =RC[-5]*RC[-22]*RC[+3] -> #ERR: ArgCount | Z21: =VLOOKUP(RC[-24], ComponentsPivot!R3C1:R25C7, 6, 0) -> #ERR: ArgCount | AA21: =IF(RC[-4], (RC[-1]+RC[-3])/RC[-4], 0) -> #ERR: ArgCount | AB21: =RC[+1]>RC[-7] -> #ERR: ArgCount | AC21: =VLOOKUP(RC[-28], ProductsPivot!R4C1:R12C3, 3, 0) -> #ERR: ArgCount | AD21: =MAX(RC[-1]-RC[-9], 0) -> #ERR: ArgCount | AE21: =RC[-1]*RC[-26] -> #ERR: ArgCount | AF21: =RC[-1]*RC[-29] -> #ERR: ArgCount | AG21: =VLOOKUP(RC[-31], ComponentsPivot!R3C1:R25C7, 7, 0) -> #ERR: ArgCount | AH21: =RC[-10]-RC[-1] -> #ERR: ArgCount | AI21: =ROUND(RC[-18]+RC[-4], 0) -> #ERR: ArgCount
A22: =BillofMaterials!R[+2]C -> AB500 | B22: =BillofMaterials!R[+2]C -> LAB50 | C22: =BillofMaterials!R[+2]C -> 26 | D22: =BillofMaterials!R[+2]C -> #ERR: ArgCount | E22: =VLOOKUP(RC[-4], TheBusiness!R8C1:R14C4, 4, 0) -> #ERR: ArgCount | F22: =VLOOKUP(RC[-5], ItemMaster!R6C1:R31C8, R1C, 0) -> #ERR: ArgCount | G22: =IF(RC[-2], RC[-1]/RC[-2], 0) -> #ERR: ArgCount | H22: =RC[-3]*RC[-5]*RC[+6] -> #ERR: ArgCount | I22: =MAX(VLOOKUP(RC[-7], ComponentsPivot!R3C1:R25C7, 2, 0), RC[-4]*RC[-6]) -> #ERR: ArgCount | J22: =VLOOKUP(RC[-8], ItemMaster!R6C1:R31C8, R1C, 0) -> #ERR: ArgCount | K22: =RC[-5]*RC[-8]*RC[+3] -> #ERR: ArgCount | L22: =VLOOKUP(RC[-10], ComponentsPivot!R3C1:R25C3, 3, 0) -> #ERR: ArgCount | M22: =IF(RC[-4], (RC[-1]+RC[-3])/RC[-4], 0) -> #ERR: ArgCount | N22: =AND(RC[+1], RC[-7]<RC[-1]) -> #ERR: ArgCount | O22: =VLOOKUP(RC[-14], ProductsPivot!R4C1:R12C3, 2, 0) -> #ERR: ArgCount | P22: =MAX(RC[-1]-RC[-9], 0) -> #ERR: ArgCount | Q22: =RC[-1]*RC[-12] -> #ERR: ArgCount | R22: =RC[-1]*RC[-15] -> #ERR: ArgCount | S22: =VLOOKUP(RC[-17], ComponentsPivot!R3C1:R25C4, 4, 0) -> #ERR: ArgCount | T22: =RC[-14]+RC[-3] -> #ERR: ArgCount | U22: =IF(RC[-16], RC[-1]/RC[-16], 0) -> #ERR: ArgCount | V22: =RC[-17]*RC[-19]*RC[+6] -> #ERR: ArgCount | W22: =MAX(VLOOKUP(RC[-21], ComponentsPivot!R3C1:R25C7, 5, 0), RC[-18]*RC[-20]) -> #ERR: ArgCount | X22: =RC[-14]-RC[-5] -> #ERR: ArgCount | Y22: =RC[-5]*RC[-22]*RC[+3] -> #ERR: ArgCount | Z22: =VLOOKUP(RC[-24], ComponentsPivot!R3C1:R25C7, 6, 0) -> #ERR: ArgCount | AA22: =IF(RC[-4], (RC[-1]+RC[-3])/RC[-4], 0) -> #ERR: ArgCount | AB22: =RC[+1]>RC[-7] -> #ERR: ArgCount | AC22: =VLOOKUP(RC[-28], ProductsPivot!R4C1:R12C3, 3, 0) -> #ERR: ArgCount | AD22: =MAX(RC[-1]-RC[-9], 0) -> #ERR: ArgCount | AE22: =RC[-1]*RC[-26] -> #ERR: ArgCount | AF22: =RC[-1]*RC[-29] -> #ERR: ArgCount | AG22: =VLOOKUP(RC[-31], ComponentsPivot!R3C1:R25C7, 7, 0) -> #ERR: ArgCount | AH22: =RC[-10]-RC[-1] -> #ERR: ArgCount | AI22: =ROUND(RC[-18]+RC[-4], 0) -> #ERR: ArgCount
A23: =BillofMaterials!R[+2]C -> FL100 | B23: =BillofMaterials!R[+2]C -> BS01 | C23: =BillofMaterials!R[+2]C -> 4.8 | D23: =BillofMaterials!R[+2]C -> #ERR: ArgCount | E23: =VLOOKUP(RC[-4], TheBusiness!R8C1:R14C4, 4, 0) -> #ERR: ArgCount | F23: =VLOOKUP(RC[-5], ItemMaster!R6C1:R31C8, R1C, 0) -> #ERR: ArgCount | G23: =IF(RC[-2], RC[-1]/RC[-2], 0) -> #ERR: ArgCount | H23: =RC[-3]*RC[-5]*RC[+6] -> #ERR: ArgCount | I23: =MAX(VLOOKUP(RC[-7], ComponentsPivot!R3C1:R25C7, 2, 0), RC[-4]*RC[-6]) -> #ERR: ArgCount | J23: =VLOOKUP(RC[-8], ItemMaster!R6C1:R31C8, R1C, 0) -> #ERR: ArgCount | K23: =RC[-5]*RC[-8]*RC[+3] -> #ERR: ArgCount | L23: =VLOOKUP(RC[-10], ComponentsPivot!R3C1:R25C3, 3, 0) -> #ERR: ArgCount | M23: =IF(RC[-4], (RC[-1]+RC[-3])/RC[-4], 0) -> #ERR: ArgCount | N23: =AND(RC[+1], RC[-7]<RC[-1]) -> #ERR: ArgCount | O23: =VLOOKUP(RC[-14], ProductsPivot!R4C1:R12C3, 2, 0) -> #ERR: ArgCount | P23: =MAX(RC[-1]-RC[-9], 0) -> #ERR: ArgCount | Q23: =RC[-1]*RC[-12] -> #ERR: ArgCount | R23: =RC[-1]*RC[-15] -> #ERR: ArgCount | S23: =VLOOKUP(RC[-17], ComponentsPivot!R3C1:R25C4, 4, 0) -> #ERR: ArgCount | T23: =RC[-14]+RC[-3] -> #ERR: ArgCount | U23: =IF(RC[-16], RC[-1]/RC[-16], 0) -> #ERR: ArgCount | V23: =RC[-17]*RC[-19]*RC[+6] -> #ERR: ArgCount | W23: =MAX(VLOOKUP(RC[-21], ComponentsPivot!R3C1:R25C7, 5, 0), RC[-18]*RC[-20]) -> #ERR: ArgCount | X23: =RC[-14]-RC[-5] -> #ERR: ArgCount | Y23: =RC[-5]*RC[-22]*RC[+3] -> #ERR: ArgCount | Z23: =VLOOKUP(RC[-24], ComponentsPivot!R3C1:R25C7, 6, 0) -> #ERR: ArgCount | AA23: =IF(RC[-4], (RC[-1]+RC[-3])/RC[-4], 0) -> #ERR: ArgCount | AB23: =RC[+1]>RC[-7] -> #ERR: ArgCount | AC23: =VLOOKUP(RC[-28], ProductsPivot!R4C1:R12C3, 3, 0) -> #ERR: ArgCount | AD23: =MAX(RC[-1]-RC[-9], 0) -> #ERR: ArgCount | AE23: =RC[-1]*RC[-26] -> #ERR: ArgCount | AF23: =RC[-1]*RC[-29] -> #ERR: ArgCount | AG23: =VLOOKUP(RC[-31], ComponentsPivot!R3C1:R25C7, 7, 0) -> #ERR: ArgCount | AH23: =RC[-10]-RC[-1] -> #ERR: ArgCount | AI23: =ROUND(RC[-18]+RC[-4], 0) -> #ERR: ArgCount
A24: =BillofMaterials!R[+2]C -> FL100 | B24: =BillofMaterials!R[+2]C -> BT100 | C24: =BillofMaterials!R[+2]C -> 48 | D24: =BillofMaterials!R[+2]C -> #ERR: ArgCount | E24: =VLOOKUP(RC[-4], TheBusiness!R8C1:R14C4, 4, 0) -> #ERR: ArgCount | F24: =VLOOKUP(RC[-5], ItemMaster!R6C1:R31C8, R1C, 0) -> #ERR: ArgCount | G24: =IF(RC[-2], RC[-1]/RC[-2], 0) -> #ERR: ArgCount | H24: =RC[-3]*RC[-5]*RC[+6] -> #ERR: ArgCount | I24: =MAX(VLOOKUP(RC[-7], ComponentsPivot!R3C1:R25C7, 2, 0), RC[-4]*RC[-6]) -> #ERR: ArgCount | J24: =VLOOKUP(RC[-8], ItemMaster!R6C1:R31C8, R1C, 0) -> #ERR: ArgCount | K24: =RC[-5]*RC[-8]*RC[+3] -> #ERR: ArgCount | L24: =VLOOKUP(RC[-10], ComponentsPivot!R3C1:R25C3, 3, 0) -> #ERR: ArgCount | M24: =IF(RC[-4], (RC[-1]+RC[-3])/RC[-4], 0) -> #ERR: ArgCount | N24: =AND(RC[+1], RC[-7]<RC[-1]) -> #ERR: ArgCount | O24: =VLOOKUP(RC[-14], ProductsPivot!R4C1:R12C3, 2, 0) -> #ERR: ArgCount | P24: =MAX(RC[-1]-RC[-9], 0) -> #ERR: ArgCount | Q24: =RC[-1]*RC[-12] -> #ERR: ArgCount | R24: =RC[-1]*RC[-15] -> #ERR: ArgCount | S24: =VLOOKUP(RC[-17], ComponentsPivot!R3C1:R25C4, 4, 0) -> #ERR: ArgCount | T24: =RC[-14]+RC[-3] -> #ERR: ArgCount | U24: =IF(RC[-16], RC[-1]/RC[-16], 0) -> #ERR: ArgCount | V24: =RC[-17]*RC[-19]*RC[+6] -> #ERR: ArgCount | W24: =MAX(VLOOKUP(RC[-21], ComponentsPivot!R3C1:R25C7, 5, 0), RC[-18]*RC[-20]) -> #ERR: ArgCount | X24: =RC[-14]-RC[-5] -> #ERR: ArgCount | Y24: =RC[-5]*RC[-22]*RC[+3] -> #ERR: ArgCount | Z24: =VLOOKUP(RC[-24], ComponentsPivot!R3C1:R25C7, 6, 0) -> #ERR: ArgCount | AA24: =IF(RC[-4], (RC[-1]+RC[-3])/RC[-4], 0) -> #ERR: ArgCount | AB24: =RC[+1]>RC[-7] -> #ERR: ArgCount | AC24: =VLOOKUP(RC[-28], ProductsPivot!R4C1:R12C3, 3, 0) -> #ERR: ArgCount | AD24: =MAX(RC[-1]-RC[-9], 0) -> #ERR: ArgCount | AE24: =RC[-1]*RC[-26] -> #ERR: ArgCount | AF24: =RC[-1]*RC[-29] -> #ERR: ArgCount | AG24: =VLOOKUP(RC[-31], ComponentsPivot!R3C1:R25C7, 7, 0) -> #ERR: ArgCount | AH24: =RC[-10]-RC[-1] -> #ERR: ArgCount | AI24: =ROUND(RC[-18]+RC[-4], 0) -> #ERR: ArgCount
A25: =BillofMaterials!R[+2]C -> FL100 | B25: =BillofMaterials!R[+2]C -> CAPF | C25: =BillofMaterials!R[+2]C -> 48 | D25: =BillofMaterials!R[+2]C -> #ERR: ArgCount | E25: =VLOOKUP(RC[-4], TheBusiness!R8C1:R14C4, 4, 0) -> #ERR: ArgCount | F25: =VLOOKUP(RC[-5], ItemMaster!R6C1:R31C8, R1C, 0) -> #ERR: ArgCount | G25: =IF(RC[-2], RC[-1]/RC[-2], 0) -> #ERR: ArgCount | H25: =RC[-3]*RC[-5]*RC[+6] -> #ERR: ArgCount | I25: =MAX(VLOOKUP(RC[-7], ComponentsPivot!R3C1:R25C7, 2, 0), RC[-4]*RC[-6]) -> #ERR: ArgCount | J25: =VLOOKUP(RC[-8], ItemMaster!R6C1:R31C8, R1C, 0) -> #ERR: ArgCount | K25: =RC[-5]*RC[-8]*RC[+3] -> #ERR: ArgCount | L25: =VLOOKUP(RC[-10], ComponentsPivot!R3C1:R25C3, 3, 0) -> #ERR: ArgCount | M25: =IF(RC[-4], (RC[-1]+RC[-3])/RC[-4], 0) -> #ERR: ArgCount | N25: =AND(RC[+1], RC[-7]<RC[-1]) -> #ERR: ArgCount | O25: =VLOOKUP(RC[-14], ProductsPivot!R4C1:R12C3, 2, 0) -> #ERR: ArgCount | P25: =MAX(RC[-1]-RC[-9], 0) -> #ERR: ArgCount | Q25: =RC[-1]*RC[-12] -> #ERR: ArgCount | R25: =RC[-1]*RC[-15] -> #ERR: ArgCount | S25: =VLOOKUP(RC[-17], ComponentsPivot!R3C1:R25C4, 4, 0) -> #ERR: ArgCount | T25: =RC[-14]+RC[-3] -> #ERR: ArgCount | U25: =IF(RC[-16], RC[-1]/RC[-16], 0) -> #ERR: ArgCount | V25: =RC[-17]*RC[-19]*RC[+6] -> #ERR: ArgCount | W25: =MAX(VLOOKUP(RC[-21], ComponentsPivot!R3C1:R25C7, 5, 0), RC[-18]*RC[-20]) -> #ERR: ArgCount | X25: =RC[-14]-RC[-5] -> #ERR: ArgCount | Y25: =RC[-5]*RC[-22]*RC[+3] -> #ERR: ArgCount | Z25: =VLOOKUP(RC[-24], ComponentsPivot!R3C1:R25C7, 6, 0) -> #ERR: ArgCount | AA25: =IF(RC[-4], (RC[-1]+RC[-3])/RC[-4], 0) -> #ERR: ArgCount | AB25: =RC[+1]>RC[-7] -> #ERR: ArgCount | AC25: =VLOOKUP(RC[-28], ProductsPivot!R4C1:R12C3, 3, 0) -> #ERR: ArgCount | AD25: =MAX(RC[-1]-RC[-9], 0) -> #ERR: ArgCount | AE25: =RC[-1]*RC[-26] -> #ERR: ArgCount | AF25: =RC[-1]*RC[-29] -> #ERR: ArgCount | AG25: =VLOOKUP(RC[-31], ComponentsPivot!R3C1:R25C7, 7, 0) -> #ERR: ArgCount | AH25: =RC[-10]-RC[-1] -> #ERR: ArgCount | AI25: =ROUND(RC[-18]+RC[-4], 0) -> #ERR: ArgCount
A26: =BillofMaterials!R[+2]C -> FL100 | B26: =BillofMaterials!R[+2]C -> CARS | C26: =BillofMaterials!R[+2]C -> 1 | D26: =BillofMaterials!R[+2]C -> #ERR: ArgCount | E26: =VLOOKUP(RC[-4], TheBusiness!R8C1:R14C4, 4, 0) -> #ERR: ArgCount | F26: =VLOOKUP(RC[-5], ItemMaster!R6C1:R31C8, R1C, 0) -> #ERR: ArgCount | G26: =IF(RC[-2], RC[-1]/RC[-2], 0) -> #ERR: ArgCount | H26: =RC[-3]*RC[-5]*RC[+6] -> #ERR: ArgCount | I26: =MAX(VLOOKUP(RC[-7], ComponentsPivot!R3C1:R25C7, 2, 0), RC[-4]*RC[-6]) -> #ERR: ArgCount | J26: =VLOOKUP(RC[-8], ItemMaster!R6C1:R31C8, R1C, 0) -> #ERR: ArgCount | K26: =RC[-5]*RC[-8]*RC[+3] -> #ERR: ArgCount | L26: =VLOOKUP(RC[-10], ComponentsPivot!R3C1:R25C3, 3, 0) -> #ERR: ArgCount | M26: =IF(RC[-4], (RC[-1]+RC[-3])/RC[-4], 0) -> #ERR: ArgCount | N26: =AND(RC[+1], RC[-7]<RC[-1]) -> #ERR: ArgCount | O26: =VLOOKUP(RC[-14], ProductsPivot!R4C1:R12C3, 2, 0) -> #ERR: ArgCount | P26: =MAX(RC[-1]-RC[-9], 0) -> #ERR: ArgCount | Q26: =RC[-1]*RC[-12] -> #ERR: ArgCount | R26: =RC[-1]*RC[-15] -> #ERR: ArgCount | S26: =VLOOKUP(RC[-17], ComponentsPivot!R3C1:R25C4, 4, 0) -> #ERR: ArgCount | T26: =RC[-14]+RC[-3] -> #ERR: ArgCount | U26: =IF(RC[-16], RC[-1]/RC[-16], 0) -> #ERR: ArgCount | V26: =RC[-17]*RC[-19]*RC[+6] -> #ERR: ArgCount | W26: =MAX(VLOOKUP(RC[-21], ComponentsPivot!R3C1:R25C7, 5, 0), RC[-18]*RC[-20]) -> #ERR: ArgCount | X26: =RC[-14]-RC[-5] -> #ERR: ArgCount | Y26: =RC[-5]*RC[-22]*RC[+3] -> #ERR: ArgCount | Z26: =VLOOKUP(RC[-24], ComponentsPivot!R3C1:R25C7, 6, 0) -> #ERR: ArgCount | AA26: =IF(RC[-4], (RC[-1]+RC[-3])/RC[-4], 0) -> #ERR: ArgCount | AB26: =RC[+1]>RC[-7] -> #ERR: ArgCount | AC26: =VLOOKUP(RC[-28], ProductsPivot!R4C1:R12C3, 3, 0) -> #ERR: ArgCount | AD26: =MAX(RC[-1]-RC[-9], 0) -> #ERR: ArgCount | AE26: =RC[-1]*RC[-26] -> #ERR: ArgCount | AF26: =RC[-1]*RC[-29] -> #ERR: ArgCount | AG26: =VLOOKUP(RC[-31], ComponentsPivot!R3C1:R25C7, 7, 0) -> #ERR: ArgCount | AH26: =RC[-10]-RC[-1] -> #ERR: ArgCount | AI26: =ROUND(RC[-18]+RC[-4], 0) -> #ERR: ArgCount
A27: =BillofMaterials!R[+2]C -> FL100 | B27: =BillofMaterials!R[+2]C -> ESL | C27: =BillofMaterials!R[+2]C -> 0.048 | D27: =BillofMaterials!R[+2]C -> #ERR: ArgCount | E27: =VLOOKUP(RC[-4], TheBusiness!R8C1:R14C4, 4, 0) -> #ERR: ArgCount | F27: =VLOOKUP(RC[-5], ItemMaster!R6C1:R31C8, R1C, 0) -> #ERR: ArgCount | G27: =IF(RC[-2], RC[-1]/RC[-2], 0) -> #ERR: ArgCount | H27: =RC[-3]*RC[-5]*RC[+6] -> #ERR: ArgCount | I27: =MAX(VLOOKUP(RC[-7], ComponentsPivot!R3C1:R25C7, 2, 0), RC[-4]*RC[-6]) -> #ERR: ArgCount | J27: =VLOOKUP(RC[-8], ItemMaster!R6C1:R31C8, R1C, 0) -> #ERR: ArgCount | K27: =RC[-5]*RC[-8]*RC[+3] -> #ERR: ArgCount | L27: =VLOOKUP(RC[-10], ComponentsPivot!R3C1:R25C3, 3, 0) -> #ERR: ArgCount | M27: =IF(RC[-4], (RC[-1]+RC[-3])/RC[-4], 0) -> #ERR: ArgCount | N27: =AND(RC[+1], RC[-7]<RC[-1]) -> #ERR: ArgCount | O27: =VLOOKUP(RC[-14], ProductsPivot!R4C1:R12C3, 2, 0) -> #ERR: ArgCount | P27: =MAX(RC[-1]-RC[-9], 0) -> #ERR: ArgCount | Q27: =RC[-1]*RC[-12] -> #ERR: ArgCount | R27: =RC[-1]*RC[-15] -> #ERR: ArgCount | S27: =VLOOKUP(RC[-17], ComponentsPivot!R3C1:R25C4, 4, 0) -> #ERR: ArgCount | T27: =RC[-14]+RC[-3] -> #ERR: ArgCount | U27: =IF(RC[-16], RC[-1]/RC[-16], 0) -> #ERR: ArgCount | V27: =RC[-17]*RC[-19]*RC[+6] -> #ERR: ArgCount | W27: =MAX(VLOOKUP(RC[-21], ComponentsPivot!R3C1:R25C7, 5, 0), RC[-18]*RC[-20]) -> #ERR: ArgCount | X27: =RC[-14]-RC[-5] -> #ERR: ArgCount | Y27: =RC[-5]*RC[-22]*RC[+3] -> #ERR: ArgCount | Z27: =VLOOKUP(RC[-24], ComponentsPivot!R3C1:R25C7, 6, 0) -> #ERR: ArgCount | AA27: =IF(RC[-4], (RC[-1]+RC[-3])/RC[-4], 0) -> #ERR: ArgCount | AB27: =RC[+1]>RC[-7] -> #ERR: ArgCount | AC27: =VLOOKUP(RC[-28], ProductsPivot!R4C1:R12C3, 3, 0) -> #ERR: ArgCount | AD27: =MAX(RC[-1]-RC[-9], 0) -> #ERR: ArgCount | AE27: =RC[-1]*RC[-26] -> #ERR: ArgCount | AF27: =RC[-1]*RC[-29] -> #ERR: ArgCount | AG27: =VLOOKUP(RC[-31], ComponentsPivot!R3C1:R25C7, 7, 0) -> #ERR: ArgCount | AH27: =RC[-10]-RC[-1] -> #ERR: ArgCount | AI27: =ROUND(RC[-18]+RC[-4], 0) -> #ERR: ArgCount
A28: =BillofMaterials!R[+2]C -> FL100 | B28: =BillofMaterials!R[+2]C -> LFL10 | C28: =BillofMaterials!R[+2]C -> 50 | D28: =BillofMaterials!R[+2]C -> #ERR: ArgCount | E28: =VLOOKUP(RC[-4], TheBusiness!R8C1:R14C4, 4, 0) -> #ERR: ArgCount | F28: =VLOOKUP(RC[-5], ItemMaster!R6C1:R31C8, R1C, 0) -> #ERR: ArgCount | G28: =IF(RC[-2], RC[-1]/RC[-2], 0) -> #ERR: ArgCount | H28: =RC[-3]*RC[-5]*RC[+6] -> #ERR: ArgCount | I28: =MAX(VLOOKUP(RC[-7], ComponentsPivot!R3C1:R25C7, 2, 0), RC[-4]*RC[-6]) -> #ERR: ArgCount | J28: =VLOOKUP(RC[-8], ItemMaster!R6C1:R31C8, R1C, 0) -> #ERR: ArgCount | K28: =RC[-5]*RC[-8]*RC[+3] -> #ERR: ArgCount | L28: =VLOOKUP(RC[-10], ComponentsPivot!R3C1:R25C3, 3, 0) -> #ERR: ArgCount | M28: =IF(RC[-4], (RC[-1]+RC[-3])/RC[-4], 0) -> #ERR: ArgCount | N28: =AND(RC[+1], RC[-7]<RC[-1]) -> #ERR: ArgCount | O28: =VLOOKUP(RC[-14], ProductsPivot!R4C1:R12C3, 2, 0) -> #ERR: ArgCount | P28: =MAX(RC[-1]-RC[-9], 0) -> #ERR: ArgCount | Q28: =RC[-1]*RC[-12] -> #ERR: ArgCount | R28: =RC[-1]*RC[-15] -> #ERR: ArgCount | S28: =VLOOKUP(RC[-17], ComponentsPivot!R3C1:R25C4, 4, 0) -> #ERR: ArgCount | T28: =RC[-14]+RC[-3] -> #ERR: ArgCount | U28: =IF(RC[-16], RC[-1]/RC[-16], 0) -> #ERR: ArgCount | V28: =RC[-17]*RC[-19]*RC[+6] -> #ERR: ArgCount | W28: =MAX(VLOOKUP(RC[-21], ComponentsPivot!R3C1:R25C7, 5, 0), RC[-18]*RC[-20]) -> #ERR: ArgCount | X28: =RC[-14]-RC[-5] -> #ERR: ArgCount | Y28: =RC[-5]*RC[-22]*RC[+3] -> #ERR: ArgCount | Z28: =VLOOKUP(RC[-24], ComponentsPivot!R3C1:R25C7, 6, 0) -> #ERR: ArgCount | AA28: =IF(RC[-4], (RC[-1]+RC[-3])/RC[-4], 0) -> #ERR: ArgCount | AB28: =RC[+1]>RC[-7] -> #ERR: ArgCount | AC28: =VLOOKUP(RC[-28], ProductsPivot!R4C1:R12C3, 3, 0) -> #ERR: ArgCount | AD28: =MAX(RC[-1]-RC[-9], 0) -> #ERR: ArgCount | AE28: =RC[-1]*RC[-26] -> #ERR: ArgCount | AF28: =RC[-1]*RC[-29] -> #ERR: ArgCount | AG28: =VLOOKUP(RC[-31], ComponentsPivot!R3C1:R25C7, 7, 0) -> #ERR: ArgCount | AH28: =RC[-10]-RC[-1] -> #ERR: ArgCount | AI28: =ROUND(RC[-18]+RC[-4], 0) -> #ERR: ArgCount
A29: =BillofMaterials!R[+2]C -> FL250 | B29: =BillofMaterials!R[+2]C -> BS01 | C29: =BillofMaterials!R[+2]C -> 12 | D29: =BillofMaterials!R[+2]C -> #ERR: ArgCount | E29: =VLOOKUP(RC[-4], TheBusiness!R8C1:R14C4, 4, 0) -> #ERR: ArgCount | F29: =VLOOKUP(RC[-5], ItemMaster!R6C1:R31C8, R1C, 0) -> #ERR: ArgCount | G29: =IF(RC[-2], RC[-1]/RC[-2], 0) -> #ERR: ArgCount | H29: =RC[-3]*RC[-5]*RC[+6] -> #ERR: ArgCount | I29: =MAX(VLOOKUP(RC[-7], ComponentsPivot!R3C1:R25C7, 2, 0), RC[-4]*RC[-6]) -> #ERR: ArgCount | J29: =VLOOKUP(RC[-8], ItemMaster!R6C1:R31C8, R1C, 0) -> #ERR: ArgCount | K29: =RC[-5]*RC[-8]*RC[+3] -> #ERR: ArgCount | L29: =VLOOKUP(RC[-10], ComponentsPivot!R3C1:R25C3, 3, 0) -> #ERR: ArgCount | M29: =IF(RC[-4], (RC[-1]+RC[-3])/RC[-4], 0) -> #ERR: ArgCount | N29: =AND(RC[+1], RC[-7]<RC[-1]) -> #ERR: ArgCount | O29: =VLOOKUP(RC[-14], ProductsPivot!R4C1:R12C3, 2, 0) -> #ERR: ArgCount | P29: =MAX(RC[-1]-RC[-9], 0) -> #ERR: ArgCount | Q29: =RC[-1]*RC[-12] -> #ERR: ArgCount | R29: =RC[-1]*RC[-15] -> #ERR: ArgCount | S29: =VLOOKUP(RC[-17], ComponentsPivot!R3C1:R25C4, 4, 0) -> #ERR: ArgCount | T29: =RC[-14]+RC[-3] -> #ERR: ArgCount | U29: =IF(RC[-16], RC[-1]/RC[-16], 0) -> #ERR: ArgCount | V29: =RC[-17]*RC[-19]*RC[+6] -> #ERR: ArgCount | W29: =MAX(VLOOKUP(RC[-21], ComponentsPivot!R3C1:R25C7, 5, 0), RC[-18]*RC[-20]) -> #ERR: ArgCount | X29: =RC[-14]-RC[-5] -> #ERR: ArgCount | Y29: =RC[-5]*RC[-22]*RC[+3] -> #ERR: ArgCount | Z29: =VLOOKUP(RC[-24], ComponentsPivot!R3C1:R25C7, 6, 0) -> #ERR: ArgCount | AA29: =IF(RC[-4], (RC[-1]+RC[-3])/RC[-4], 0) -> #ERR: ArgCount | AB29: =RC[+1]>RC[-7] -> #ERR: ArgCount | AC29: =VLOOKUP(RC[-28], ProductsPivot!R4C1:R12C3, 3, 0) -> #ERR: ArgCount | AD29: =MAX(RC[-1]-RC[-9], 0) -> #ERR: ArgCount | AE29: =RC[-1]*RC[-26] -> #ERR: ArgCount | AF29: =RC[-1]*RC[-29] -> #ERR: ArgCount | AG29: =VLOOKUP(RC[-31], ComponentsPivot!R3C1:R25C7, 7, 0) -> #ERR: ArgCount | AH29: =RC[-10]-RC[-1] -> #ERR: ArgCount | AI29: =ROUND(RC[-18]+RC[-4], 0) -> #ERR: ArgCount
A30: =BillofMaterials!R[+2]C -> FL250 | B30: =BillofMaterials!R[+2]C -> BT250 | C30: =BillofMaterials!R[+2]C -> 48 | D30: =BillofMaterials!R[+2]C -> #ERR: ArgCount | E30: =VLOOKUP(RC[-4], TheBusiness!R8C1:R14C4, 4, 0) -> #ERR: ArgCount | F30: =VLOOKUP(RC[-5], ItemMaster!R6C1:R31C8, R1C, 0) -> #ERR: ArgCount | G30: =IF(RC[-2], RC[-1]/RC[-2], 0) -> #ERR: ArgCount | H30: =RC[-3]*RC[-5]*RC[+6] -> #ERR: ArgCount | I30: =MAX(VLOOKUP(RC[-7], ComponentsPivot!R3C1:R25C7, 2, 0), RC[-4]*RC[-6]) -> #ERR: ArgCount | J30: =VLOOKUP(RC[-8], ItemMaster!R6C1:R31C8, R1C, 0) -> #ERR: ArgCount | K30: =RC[-5]*RC[-8]*RC[+3] -> #ERR: ArgCount | L30: =VLOOKUP(RC[-10], ComponentsPivot!R3C1:R25C3, 3, 0) -> #ERR: ArgCount | M30: =IF(RC[-4], (RC[-1]+RC[-3])/RC[-4], 0) -> #ERR: ArgCount | N30: =AND(RC[+1], RC[-7]<RC[-1]) -> #ERR: ArgCount | O30: =VLOOKUP(RC[-14], ProductsPivot!R4C1:R12C3, 2, 0) -> #ERR: ArgCount | P30: =MAX(RC[-1]-RC[-9], 0) -> #ERR: ArgCount | Q30: =RC[-1]*RC[-12] -> #ERR: ArgCount | R30: =RC[-1]*RC[-15] -> #ERR: ArgCount | S30: =VLOOKUP(RC[-17], ComponentsPivot!R3C1:R25C4, 4, 0) -> #ERR: ArgCount | T30: =RC[-14]+RC[-3] -> #ERR: ArgCount | U30: =IF(RC[-16], RC[-1]/RC[-16], 0) -> #ERR: ArgCount | V30: =RC[-17]*RC[-19]*RC[+6] -> #ERR: ArgCount | W30: =MAX(VLOOKUP(RC[-21], ComponentsPivot!R3C1:R25C7, 5, 0), RC[-18]*RC[-20]) -> #ERR: ArgCount | X30: =RC[-14]-RC[-5] -> #ERR: ArgCount | Y30: =RC[-5]*RC[-22]*RC[+3] -> #ERR: ArgCount | Z30: =VLOOKUP(RC[-24], ComponentsPivot!R3C1:R25C7, 6, 0) -> #ERR: ArgCount | AA30: =IF(RC[-4], (RC[-1]+RC[-3])/RC[-4], 0) -> #ERR: ArgCount | AB30: =RC[+1]>RC[-7] -> #ERR: ArgCount | AC30: =VLOOKUP(RC[-28], ProductsPivot!R4C1:R12C3, 3, 0) -> #ERR: ArgCount | AD30: =MAX(RC[-1]-RC[-9], 0) -> #ERR: ArgCount | AE30: =RC[-1]*RC[-26] -> #ERR: ArgCount | AF30: =RC[-1]*RC[-29] -> #ERR: ArgCount | AG30: =VLOOKUP(RC[-31], ComponentsPivot!R3C1:R25C7, 7, 0) -> #ERR: ArgCount | AH30: =RC[-10]-RC[-1] -> #ERR: ArgCount | AI30: =ROUND(RC[-18]+RC[-4], 0) -> #ERR: ArgCount
A31: =BillofMaterials!R[+2]C -> FL250 | B31: =BillofMaterials!R[+2]C -> CAPF | C31: =BillofMaterials!R[+2]C -> 48 | D31: =BillofMaterials!R[+2]C -> #ERR: ArgCount | E31: =VLOOKUP(RC[-4], TheBusiness!R8C1:R14C4, 4, 0) -> #ERR: ArgCount | F31: =VLOOKUP(RC[-5], ItemMaster!R6C1:R31C8, R1C, 0) -> #ERR: ArgCount | G31: =IF(RC[-2], RC[-1]/RC[-2], 0) -> #ERR: ArgCount | H31: =RC[-3]*RC[-5]*RC[+6] -> #ERR: ArgCount | I31: =MAX(VLOOKUP(RC[-7], ComponentsPivot!R3C1:R25C7, 2, 0), RC[-4]*RC[-6]) -> #ERR: ArgCount | J31: =VLOOKUP(RC[-8], ItemMaster!R6C1:R31C8, R1C, 0) -> #ERR: ArgCount | K31: =RC[-5]*RC[-8]*RC[+3] -> #ERR: ArgCount | L31: =VLOOKUP(RC[-10], ComponentsPivot!R3C1:R25C3, 3, 0) -> #ERR: ArgCount | M31: =IF(RC[-4], (RC[-1]+RC[-3])/RC[-4], 0) -> #ERR: ArgCount | N31: =AND(RC[+1], RC[-7]<RC[-1]) -> #ERR: ArgCount | O31: =VLOOKUP(RC[-14], ProductsPivot!R4C1:R12C3, 2, 0) -> #ERR: ArgCount | P31: =MAX(RC[-1]-RC[-9], 0) -> #ERR: ArgCount | Q31: =RC[-1]*RC[-12] -> #ERR: ArgCount | R31: =RC[-1]*RC[-15] -> #ERR: ArgCount | S31: =VLOOKUP(RC[-17], ComponentsPivot!R3C1:R25C4, 4, 0) -> #ERR: ArgCount | T31: =RC[-14]+RC[-3] -> #ERR: ArgCount | U31: =IF(RC[-16], RC[-1]/RC[-16], 0) -> #ERR: ArgCount | V31: =RC[-17]*RC[-19]*RC[+6] -> #ERR: ArgCount | W31: =MAX(VLOOKUP(RC[-21], ComponentsPivot!R3C1:R25C7, 5, 0), RC[-18]*RC[-20]) -> #ERR: ArgCount | X31: =RC[-14]-RC[-5] -> #ERR: ArgCount | Y31: =RC[-5]*RC[-22]*RC[+3] -> #ERR: ArgCount | Z31: =VLOOKUP(RC[-24], ComponentsPivot!R3C1:R25C7, 6, 0) -> #ERR: ArgCount | AA31: =IF(RC[-4], (RC[-1]+RC[-3])/RC[-4], 0) -> #ERR: ArgCount | AB31: =RC[+1]>RC[-7] -> #ERR: ArgCount | AC31: =VLOOKUP(RC[-28], ProductsPivot!R4C1:R12C3, 3, 0) -> #ERR: ArgCount | AD31: =MAX(RC[-1]-RC[-9], 0) -> #ERR: ArgCount | AE31: =RC[-1]*RC[-26] -> #ERR: ArgCount | AF31: =RC[-1]*RC[-29] -> #ERR: ArgCount | AG31: =VLOOKUP(RC[-31], ComponentsPivot!R3C1:R25C7, 7, 0) -> #ERR: ArgCount | AH31: =RC[-10]-RC[-1] -> #ERR: ArgCount | AI31: =ROUND(RC[-18]+RC[-4], 0) -> #ERR: ArgCount
A32: =BillofMaterials!R[+2]C -> FL250 | B32: =BillofMaterials!R[+2]C -> CARL | C32: =BillofMaterials!R[+2]C -> 1 | D32: =BillofMaterials!R[+2]C -> #ERR: ArgCount | E32: =VLOOKUP(RC[-4], TheBusiness!R8C1:R14C4, 4, 0) -> #ERR: ArgCount | F32: =VLOOKUP(RC[-5], ItemMaster!R6C1:R31C8, R1C, 0) -> #ERR: ArgCount | G32: =IF(RC[-2], RC[-1]/RC[-2], 0) -> #ERR: ArgCount | H32: =RC[-3]*RC[-5]*RC[+6] -> #ERR: ArgCount | I32: =MAX(VLOOKUP(RC[-7], ComponentsPivot!R3C1:R25C7, 2, 0), RC[-4]*RC[-6]) -> #ERR: ArgCount | J32: =VLOOKUP(RC[-8], ItemMaster!R6C1:R31C8, R1C, 0) -> #ERR: ArgCount | K32: =RC[-5]*RC[-8]*RC[+3] -> #ERR: ArgCount | L32: =VLOOKUP(RC[-10], ComponentsPivot!R3C1:R25C3, 3, 0) -> #ERR: ArgCount | M32: =IF(RC[-4], (RC[-1]+RC[-3])/RC[-4], 0) -> #ERR: ArgCount | N32: =AND(RC[+1], RC[-7]<RC[-1]) -> #ERR: ArgCount | O32: =VLOOKUP(RC[-14], ProductsPivot!R4C1:R12C3, 2, 0) -> #ERR: ArgCount | P32: =MAX(RC[-1]-RC[-9], 0) -> #ERR: ArgCount | Q32: =RC[-1]*RC[-12] -> #ERR: ArgCount | R32: =RC[-1]*RC[-15] -> #ERR: ArgCount | S32: =VLOOKUP(RC[-17], ComponentsPivot!R3C1:R25C4, 4, 0) -> #ERR: ArgCount | T32: =RC[-14]+RC[-3] -> #ERR: ArgCount | U32: =IF(RC[-16], RC[-1]/RC[-16], 0) -> #ERR: ArgCount | V32: =RC[-17]*RC[-19]*RC[+6] -> #ERR: ArgCount | W32: =MAX(VLOOKUP(RC[-21], ComponentsPivot!R3C1:R25C7, 5, 0), RC[-18]*RC[-20]) -> #ERR: ArgCount | X32: =RC[-14]-RC[-5] -> #ERR: ArgCount | Y32: =RC[-5]*RC[-22]*RC[+3] -> #ERR: ArgCount | Z32: =VLOOKUP(RC[-24], ComponentsPivot!R3C1:R25C7, 6, 0) -> #ERR: ArgCount | AA32: =IF(RC[-4], (RC[-1]+RC[-3])/RC[-4], 0) -> #ERR: ArgCount | AB32: =RC[+1]>RC[-7] -> #ERR: ArgCount | AC32: =VLOOKUP(RC[-28], ProductsPivot!R4C1:R12C3, 3, 0) -> #ERR: ArgCount | AD32: =MAX(RC[-1]-RC[-9], 0) -> #ERR: ArgCount | AE32: =RC[-1]*RC[-26] -> #ERR: ArgCount | AF32: =RC[-1]*RC[-29] -> #ERR: ArgCount | AG32: =VLOOKUP(RC[-31], ComponentsPivot!R3C1:R25C7, 7, 0) -> #ERR: ArgCount | AH32: =RC[-10]-RC[-1] -> #ERR: ArgCount | AI32: =ROUND(RC[-18]+RC[-4], 0) -> #ERR: ArgCount
A33: =BillofMaterials!R[+2]C -> FL250 | B33: =BillofMaterials!R[+2]C -> ESL | C33: =BillofMaterials!R[+2]C -> 0.12 | D33: =BillofMaterials!R[+2]C -> #ERR: ArgCount | E33: =VLOOKUP(RC[-4], TheBusiness!R8C1:R14C4, 4, 0) -> #ERR: ArgCount | F33: =VLOOKUP(RC[-5], ItemMaster!R6C1:R31C8, R1C, 0) -> #ERR: ArgCount | G33: =IF(RC[-2], RC[-1]/RC[-2], 0) -> #ERR: ArgCount | H33: =RC[-3]*RC[-5]*RC[+6] -> #ERR: ArgCount | I33: =MAX(VLOOKUP(RC[-7], ComponentsPivot!R3C1:R25C7, 2, 0), RC[-4]*RC[-6]) -> #ERR: ArgCount | J33: =VLOOKUP(RC[-8], ItemMaster!R6C1:R31C8, R1C, 0) -> #ERR: ArgCount | K33: =RC[-5]*RC[-8]*RC[+3] -> #ERR: ArgCount | L33: =VLOOKUP(RC[-10], ComponentsPivot!R3C1:R25C3, 3, 0) -> #ERR: ArgCount | M33: =IF(RC[-4], (RC[-1]+RC[-3])/RC[-4], 0) -> #ERR: ArgCount | N33: =AND(RC[+1], RC[-7]<RC[-1]) -> #ERR: ArgCount | O33: =VLOOKUP(RC[-14], ProductsPivot!R4C1:R12C3, 2, 0) -> #ERR: ArgCount | P33: =MAX(RC[-1]-RC[-9], 0) -> #ERR: ArgCount | Q33: =RC[-1]*RC[-12] -> #ERR: ArgCount | R33: =RC[-1]*RC[-15] -> #ERR: ArgCount | S33: =VLOOKUP(RC[-17], ComponentsPivot!R3C1:R25C4, 4, 0) -> #ERR: ArgCount | T33: =RC[-14]+RC[-3] -> #ERR: ArgCount | U33: =IF(RC[-16], RC[-1]/RC[-16], 0) -> #ERR: ArgCount | V33: =RC[-17]*RC[-19]*RC[+6] -> #ERR: ArgCount | W33: =MAX(VLOOKUP(RC[-21], ComponentsPivot!R3C1:R25C7, 5, 0), RC[-18]*RC[-20]) -> #ERR: ArgCount | X33: =RC[-14]-RC[-5] -> #ERR: ArgCount | Y33: =RC[-5]*RC[-22]*RC[+3] -> #ERR: ArgCount | Z33: =VLOOKUP(RC[-24], ComponentsPivot!R3C1:R25C7, 6, 0) -> #ERR: ArgCount | AA33: =IF(RC[-4], (RC[-1]+RC[-3])/RC[-4], 0) -> #ERR: ArgCount | AB33: =RC[+1]>RC[-7] -> #ERR: ArgCount | AC33: =VLOOKUP(RC[-28], ProductsPivot!R4C1:R12C3, 3, 0) -> #ERR: ArgCount | AD33: =MAX(RC[-1]-RC[-9], 0) -> #ERR: ArgCount | AE33: =RC[-1]*RC[-26] -> #ERR: ArgCount | AF33: =RC[-1]*RC[-29] -> #ERR: ArgCount | AG33: =VLOOKUP(RC[-31], ComponentsPivot!R3C1:R25C7, 7, 0) -> #ERR: ArgCount | AH33: =RC[-10]-RC[-1] -> #ERR: ArgCount | AI33: =ROUND(RC[-18]+RC[-4], 0) -> #ERR: ArgCount
A34: =BillofMaterials!R[+2]C -> FL250 | B34: =BillofMaterials!R[+2]C -> LFL25 | C34: =BillofMaterials!R[+2]C -> 50 | D34: =BillofMaterials!R[+2]C -> #ERR: ArgCount | E34: =VLOOKUP(RC[-4], TheBusiness!R8C1:R14C4, 4, 0) -> #ERR: ArgCount | F34: =VLOOKUP(RC[-5], ItemMaster!R6C1:R31C8, R1C, 0) -> #ERR: ArgCount | G34: =IF(RC[-2], RC[-1]/RC[-2], 0) -> #ERR: ArgCount | H34: =RC[-3]*RC[-5]*RC[+6] -> #ERR: ArgCount | I34: =MAX(VLOOKUP(RC[-7], ComponentsPivot!R3C1:R25C7, 2, 0), RC[-4]*RC[-6]) -> #ERR: ArgCount | J34: =VLOOKUP(RC[-8], ItemMaster!R6C1:R31C8, R1C, 0) -> #ERR: ArgCount | K34: =RC[-5]*RC[-8]*RC[+3] -> #ERR: ArgCount | L34: =VLOOKUP(RC[-10], ComponentsPivot!R3C1:R25C3, 3, 0) -> #ERR: ArgCount | M34: =IF(RC[-4], (RC[-1]+RC[-3])/RC[-4], 0) -> #ERR: ArgCount | N34: =AND(RC[+1], RC[-7]<RC[-1]) -> #ERR: ArgCount | O34: =VLOOKUP(RC[-14], ProductsPivot!R4C1:R12C3, 2, 0) -> #ERR: ArgCount | P34: =MAX(RC[-1]-RC[-9], 0) -> #ERR: ArgCount | Q34: =RC[-1]*RC[-12] -> #ERR: ArgCount | R34: =RC[-1]*RC[-15] -> #ERR: ArgCount | S34: =VLOOKUP(RC[-17], ComponentsPivot!R3C1:R25C4, 4, 0) -> #ERR: ArgCount | T34: =RC[-14]+RC[-3] -> #ERR: ArgCount | U34: =IF(RC[-16], RC[-1]/RC[-16], 0) -> #ERR: ArgCount | V34: =RC[-17]*RC[-19]*RC[+6] -> #ERR: ArgCount | W34: =MAX(VLOOKUP(RC[-21], ComponentsPivot!R3C1:R25C7, 5, 0), RC[-18]*RC[-20]) -> #ERR: ArgCount | X34: =RC[-14]-RC[-5] -> #ERR: ArgCount | Y34: =RC[-5]*RC[-22]*RC[+3] -> #ERR: ArgCount | Z34: =VLOOKUP(RC[-24], ComponentsPivot!R3C1:R25C7, 6, 0) -> #ERR: ArgCount | AA34: =IF(RC[-4], (RC[-1]+RC[-3])/RC[-4], 0) -> #ERR: ArgCount | AB34: =RC[+1]>RC[-7] -> #ERR: ArgCount | AC34: =VLOOKUP(RC[-28], ProductsPivot!R4C1:R12C3, 3, 0) -> #ERR: ArgCount | AD34: =MAX(RC[-1]-RC[-9], 0) -> #ERR: ArgCount | AE34: =RC[-1]*RC[-26] -> #ERR: ArgCount | AF34: =RC[-1]*RC[-29] -> #ERR: ArgCount | AG34: =VLOOKUP(RC[-31], ComponentsPivot!R3C1:R25C7, 7, 0) -> #ERR: ArgCount | AH34: =RC[-10]-RC[-1] -> #ERR: ArgCount | AI34: =ROUND(RC[-18]+RC[-4], 0) -> #ERR: ArgCount
A35: =BillofMaterials!R[+2]C -> FL500 | B35: =BillofMaterials!R[+2]C -> BS01 | C35: =BillofMaterials!R[+2]C -> 12 | D35: =BillofMaterials!R[+2]C -> #ERR: ArgCount | E35: =VLOOKUP(RC[-4], TheBusiness!R8C1:R14C4, 4, 0) -> #ERR: ArgCount | F35: =VLOOKUP(RC[-5], ItemMaster!R6C1:R31C8, R1C, 0) -> #ERR: ArgCount | G35: =IF(RC[-2], RC[-1]/RC[-2], 0) -> #ERR: ArgCount | H35: =RC[-3]*RC[-5]*RC[+6] -> #ERR: ArgCount | I35: =MAX(VLOOKUP(RC[-7], ComponentsPivot!R3C1:R25C7, 2, 0), RC[-4]*RC[-6]) -> #ERR: ArgCount | J35: =VLOOKUP(RC[-8], ItemMaster!R6C1:R31C8, R1C, 0) -> #ERR: ArgCount | K35: =RC[-5]*RC[-8]*RC[+3] -> #ERR: ArgCount | L35: =VLOOKUP(RC[-10], ComponentsPivot!R3C1:R25C3, 3, 0) -> #ERR: ArgCount | M35: =IF(RC[-4], (RC[-1]+RC[-3])/RC[-4], 0) -> #ERR: ArgCount | N35: =AND(RC[+1], RC[-7]<RC[-1]) -> #ERR: ArgCount | O35: =VLOOKUP(RC[-14], ProductsPivot!R4C1:R12C3, 2, 0) -> #ERR: ArgCount | P35: =MAX(RC[-1]-RC[-9], 0) -> #ERR: ArgCount | Q35: =RC[-1]*RC[-12] -> #ERR: ArgCount | R35: =RC[-1]*RC[-15] -> #ERR: ArgCount | S35: =VLOOKUP(RC[-17], ComponentsPivot!R3C1:R25C4, 4, 0) -> #ERR: ArgCount | T35: =RC[-14]+RC[-3] -> #ERR: ArgCount | U35: =IF(RC[-16], RC[-1]/RC[-16], 0) -> #ERR: ArgCount | V35: =RC[-17]*RC[-19]*RC[+6] -> #ERR: ArgCount | W35: =MAX(VLOOKUP(RC[-21], ComponentsPivot!R3C1:R25C7, 5, 0), RC[-18]*RC[-20]) -> #ERR: ArgCount | X35: =RC[-14]-RC[-5] -> #ERR: ArgCount | Y35: =RC[-5]*RC[-22]*RC[+3] -> #ERR: ArgCount | Z35: =VLOOKUP(RC[-24], ComponentsPivot!R3C1:R25C7, 6, 0) -> #ERR: ArgCount | AA35: =IF(RC[-4], (RC[-1]+RC[-3])/RC[-4], 0) -> #ERR: ArgCount | AB35: =RC[+1]>RC[-7] -> #ERR: ArgCount | AC35: =VLOOKUP(RC[-28], ProductsPivot!R4C1:R12C3, 3, 0) -> #ERR: ArgCount | AD35: =MAX(RC[-1]-RC[-9], 0) -> #ERR: ArgCount | AE35: =RC[-1]*RC[-26] -> #ERR: ArgCount | AF35: =RC[-1]*RC[-29] -> #ERR: ArgCount | AG35: =VLOOKUP(RC[-31], ComponentsPivot!R3C1:R25C7, 7, 0) -> #ERR: ArgCount | AH35: =RC[-10]-RC[-1] -> #ERR: ArgCount | AI35: =ROUND(RC[-18]+RC[-4], 0) -> #ERR: ArgCount
A36: =BillofMaterials!R[+2]C -> FL500 | B36: =BillofMaterials!R[+2]C -> BT500 | C36: =BillofMaterials!R[+2]C -> 24 | D36: =BillofMaterials!R[+2]C -> #ERR: ArgCount | E36: =VLOOKUP(RC[-4], TheBusiness!R8C1:R14C4, 4, 0) -> #ERR: ArgCount | F36: =VLOOKUP(RC[-5], ItemMaster!R6C1:R31C8, R1C, 0) -> #ERR: ArgCount | G36: =IF(RC[-2], RC[-1]/RC[-2], 0) -> #ERR: ArgCount | H36: =RC[-3]*RC[-5]*RC[+6] -> #ERR: ArgCount | I36: =MAX(VLOOKUP(RC[-7], ComponentsPivot!R3C1:R25C7, 2, 0), RC[-4]*RC[-6]) -> #ERR: ArgCount | J36: =VLOOKUP(RC[-8], ItemMaster!R6C1:R31C8, R1C, 0) -> #ERR: ArgCount | K36: =RC[-5]*RC[-8]*RC[+3] -> #ERR: ArgCount | L36: =VLOOKUP(RC[-10], ComponentsPivot!R3C1:R25C3, 3, 0) -> #ERR: ArgCount | M36: =IF(RC[-4], (RC[-1]+RC[-3])/RC[-4], 0) -> #ERR: ArgCount | N36: =AND(RC[+1], RC[-7]<RC[-1]) -> #ERR: ArgCount | O36: =VLOOKUP(RC[-14], ProductsPivot!R4C1:R12C3, 2, 0) -> #ERR: ArgCount | P36: =MAX(RC[-1]-RC[-9], 0) -> #ERR: ArgCount | Q36: =RC[-1]*RC[-12] -> #ERR: ArgCount | R36: =RC[-1]*RC[-15] -> #ERR: ArgCount | S36: =VLOOKUP(RC[-17], ComponentsPivot!R3C1:R25C4, 4, 0) -> #ERR: ArgCount | T36: =RC[-14]+RC[-3] -> #ERR: ArgCount | U36: =IF(RC[-16], RC[-1]/RC[-16], 0) -> #ERR: ArgCount | V36: =RC[-17]*RC[-19]*RC[+6] -> #ERR: ArgCount | W36: =MAX(VLOOKUP(RC[-21], ComponentsPivot!R3C1:R25C7, 5, 0), RC[-18]*RC[-20]) -> #ERR: ArgCount | X36: =RC[-14]-RC[-5] -> #ERR: ArgCount | Y36: =RC[-5]*RC[-22]*RC[+3] -> #ERR: ArgCount | Z36: =VLOOKUP(RC[-24], ComponentsPivot!R3C1:R25C7, 6, 0) -> #ERR: ArgCount | AA36: =IF(RC[-4], (RC[-1]+RC[-3])/RC[-4], 0) -> #ERR: ArgCount | AB36: =RC[+1]>RC[-7] -> #ERR: ArgCount | AC36: =VLOOKUP(RC[-28], ProductsPivot!R4C1:R12C3, 3, 0) -> #ERR: ArgCount | AD36: =MAX(RC[-1]-RC[-9], 0) -> #ERR: ArgCount | AE36: =RC[-1]*RC[-26] -> #ERR: ArgCount | AF36: =RC[-1]*RC[-29] -> #ERR: ArgCount | AG36: =VLOOKUP(RC[-31], ComponentsPivot!R3C1:R25C7, 7, 0) -> #ERR: ArgCount | AH36: =RC[-10]-RC[-1] -> #ERR: ArgCount | AI36: =ROUND(RC[-18]+RC[-4], 0) -> #ERR: ArgCount
A37: =BillofMaterials!R[+2]C -> FL500 | B37: =BillofMaterials!R[+2]C -> CAPS | C37: =BillofMaterials!R[+2]C -> 24 | D37: =BillofMaterials!R[+2]C -> #ERR: ArgCount | E37: =VLOOKUP(RC[-4], TheBusiness!R8C1:R14C4, 4, 0) -> #ERR: ArgCount | F37: =VLOOKUP(RC[-5], ItemMaster!R6C1:R31C8, R1C, 0) -> #ERR: ArgCount | G37: =IF(RC[-2], RC[-1]/RC[-2], 0) -> #ERR: ArgCount | H37: =RC[-3]*RC[-5]*RC[+6] -> #ERR: ArgCount | I37: =MAX(VLOOKUP(RC[-7], ComponentsPivot!R3C1:R25C7, 2, 0), RC[-4]*RC[-6]) -> #ERR: ArgCount | J37: =VLOOKUP(RC[-8], ItemMaster!R6C1:R31C8, R1C, 0) -> #ERR: ArgCount | K37: =RC[-5]*RC[-8]*RC[+3] -> #ERR: ArgCount | L37: =VLOOKUP(RC[-10], ComponentsPivot!R3C1:R25C3, 3, 0) -> #ERR: ArgCount | M37: =IF(RC[-4], (RC[-1]+RC[-3])/RC[-4], 0) -> #ERR: ArgCount | N37: =AND(RC[+1], RC[-7]<RC[-1]) -> #ERR: ArgCount | O37: =VLOOKUP(RC[-14], ProductsPivot!R4C1:R12C3, 2, 0) -> #ERR: ArgCount | P37: =MAX(RC[-1]-RC[-9], 0) -> #ERR: ArgCount | Q37: =RC[-1]*RC[-12] -> #ERR: ArgCount | R37: =RC[-1]*RC[-15] -> #ERR: ArgCount | S37: =VLOOKUP(RC[-17], ComponentsPivot!R3C1:R25C4, 4, 0) -> #ERR: ArgCount | T37: =RC[-14]+RC[-3] -> #ERR: ArgCount | U37: =IF(RC[-16], RC[-1]/RC[-16], 0) -> #ERR: ArgCount | V37: =RC[-17]*RC[-19]*RC[+6] -> #ERR: ArgCount | W37: =MAX(VLOOKUP(RC[-21], ComponentsPivot!R3C1:R25C7, 5, 0), RC[-18]*RC[-20]) -> #ERR: ArgCount | X37: =RC[-14]-RC[-5] -> #ERR: ArgCount | Y37: =RC[-5]*RC[-22]*RC[+3] -> #ERR: ArgCount | Z37: =VLOOKUP(RC[-24], ComponentsPivot!R3C1:R25C7, 6, 0) -> #ERR: ArgCount | AA37: =IF(RC[-4], (RC[-1]+RC[-3])/RC[-4], 0) -> #ERR: ArgCount | AB37: =RC[+1]>RC[-7] -> #ERR: ArgCount | AC37: =VLOOKUP(RC[-28], ProductsPivot!R4C1:R12C3, 3, 0) -> #ERR: ArgCount | AD37: =MAX(RC[-1]-RC[-9], 0) -> #ERR: ArgCount | AE37: =RC[-1]*RC[-26] -> #ERR: ArgCount | AF37: =RC[-1]*RC[-29] -> #ERR: ArgCount | AG37: =VLOOKUP(RC[-31], ComponentsPivot!R3C1:R25C7, 7, 0) -> #ERR: ArgCount | AH37: =RC[-10]-RC[-1] -> #ERR: ArgCount | AI37: =ROUND(RC[-18]+RC[-4], 0) -> #ERR: ArgCount
A38: =BillofMaterials!R[+2]C -> FL500 | B38: =BillofMaterials!R[+2]C -> CARL | C38: =BillofMaterials!R[+2]C -> 1 | D38: =BillofMaterials!R[+2]C -> #ERR: ArgCount | E38: =VLOOKUP(RC[-4], TheBusiness!R8C1:R14C4, 4, 0) -> #ERR: ArgCount | F38: =VLOOKUP(RC[-5], ItemMaster!R6C1:R31C8, R1C, 0) -> #ERR: ArgCount | G38: =IF(RC[-2], RC[-1]/RC[-2], 0) -> #ERR: ArgCount | H38: =RC[-3]*RC[-5]*RC[+6] -> #ERR: ArgCount | I38: =MAX(VLOOKUP(RC[-7], ComponentsPivot!R3C1:R25C7, 2, 0), RC[-4]*RC[-6]) -> #ERR: ArgCount | J38: =VLOOKUP(RC[-8], ItemMaster!R6C1:R31C8, R1C, 0) -> #ERR: ArgCount | K38: =RC[-5]*RC[-8]*RC[+3] -> #ERR: ArgCount | L38: =VLOOKUP(RC[-10], ComponentsPivot!R3C1:R25C3, 3, 0) -> #ERR: ArgCount | M38: =IF(RC[-4], (RC[-1]+RC[-3])/RC[-4], 0) -> #ERR: ArgCount | N38: =AND(RC[+1], RC[-7]<RC[-1]) -> #ERR: ArgCount | O38: =VLOOKUP(RC[-14], ProductsPivot!R4C1:R12C3, 2, 0) -> #ERR: ArgCount | P38: =MAX(RC[-1]-RC[-9], 0) -> #ERR: ArgCount | Q38: =RC[-1]*RC[-12] -> #ERR: ArgCount | R38: =RC[-1]*RC[-15] -> #ERR: ArgCount | S38: =VLOOKUP(RC[-17], ComponentsPivot!R3C1:R25C4, 4, 0) -> #ERR: ArgCount | T38: =RC[-14]+RC[-3] -> #ERR: ArgCount | U38: =IF(RC[-16], RC[-1]/RC[-16], 0) -> #ERR: ArgCount | V38: =RC[-17]*RC[-19]*RC[+6] -> #ERR: ArgCount | W38: =MAX(VLOOKUP(RC[-21], ComponentsPivot!R3C1:R25C7, 5, 0), RC[-18]*RC[-20]) -> #ERR: ArgCount | X38: =RC[-14]-RC[-5] -> #ERR: ArgCount | Y38: =RC[-5]*RC[-22]*RC[+3] -> #ERR: ArgCount | Z38: =VLOOKUP(RC[-24], ComponentsPivot!R3C1:R25C7, 6, 0) -> #ERR: ArgCount | AA38: =IF(RC[-4], (RC[-1]+RC[-3])/RC[-4], 0) -> #ERR: ArgCount | AB38: =RC[+1]>RC[-7] -> #ERR: ArgCount | AC38: =VLOOKUP(RC[-28], ProductsPivot!R4C1:R12C3, 3, 0) -> #ERR: ArgCount | AD38: =MAX(RC[-1]-RC[-9], 0) -> #ERR: ArgCount | AE38: =RC[-1]*RC[-26] -> #ERR: ArgCount | AF38: =RC[-1]*RC[-29] -> #ERR: ArgCount | AG38: =VLOOKUP(RC[-31], ComponentsPivot!R3C1:R25C7, 7, 0) -> #ERR: ArgCount | AH38: =RC[-10]-RC[-1] -> #ERR: ArgCount | AI38: =ROUND(RC[-18]+RC[-4], 0) -> #ERR: ArgCount
A39: =BillofMaterials!R[+2]C -> FL500 | B39: =BillofMaterials!R[+2]C -> ESL | C39: =BillofMaterials!R[+2]C -> 0.12 | D39: =BillofMaterials!R[+2]C -> #ERR: ArgCount | E39: =VLOOKUP(RC[-4], TheBusiness!R8C1:R14C4, 4, 0) -> #ERR: ArgCount | F39: =VLOOKUP(RC[-5], ItemMaster!R6C1:R31C8, R1C, 0) -> #ERR: ArgCount | G39: =IF(RC[-2], RC[-1]/RC[-2], 0) -> #ERR: ArgCount | H39: =RC[-3]*RC[-5]*RC[+6] -> #ERR: ArgCount | I39: =MAX(VLOOKUP(RC[-7], ComponentsPivot!R3C1:R25C7, 2, 0), RC[-4]*RC[-6]) -> #ERR: ArgCount | J39: =VLOOKUP(RC[-8], ItemMaster!R6C1:R31C8, R1C, 0) -> #ERR: ArgCount | K39: =RC[-5]*RC[-8]*RC[+3] -> #ERR: ArgCount | L39: =VLOOKUP(RC[-10], ComponentsPivot!R3C1:R25C3, 3, 0) -> #ERR: ArgCount | M39: =IF(RC[-4], (RC[-1]+RC[-3])/RC[-4], 0) -> #ERR: ArgCount | N39: =AND(RC[+1], RC[-7]<RC[-1]) -> #ERR: ArgCount | O39: =VLOOKUP(RC[-14], ProductsPivot!R4C1:R12C3, 2, 0) -> #ERR: ArgCount | P39: =MAX(RC[-1]-RC[-9], 0) -> #ERR: ArgCount | Q39: =RC[-1]*RC[-12] -> #ERR: ArgCount | R39: =RC[-1]*RC[-15] -> #ERR: ArgCount | S39: =VLOOKUP(RC[-17], ComponentsPivot!R3C1:R25C4, 4, 0) -> #ERR: ArgCount | T39: =RC[-14]+RC[-3] -> #ERR: ArgCount | U39: =IF(RC[-16], RC[-1]/RC[-16], 0) -> #ERR: ArgCount | V39: =RC[-17]*RC[-19]*RC[+6] -> #ERR: ArgCount | W39: =MAX(VLOOKUP(RC[-21], ComponentsPivot!R3C1:R25C7, 5, 0), RC[-18]*RC[-20]) -> #ERR: ArgCount | X39: =RC[-14]-RC[-5] -> #ERR: ArgCount | Y39: =RC[-5]*RC[-22]*RC[+3] -> #ERR: ArgCount | Z39: =VLOOKUP(RC[-24], ComponentsPivot!R3C1:R25C7, 6, 0) -> #ERR: ArgCount | AA39: =IF(RC[-4], (RC[-1]+RC[-3])/RC[-4], 0) -> #ERR: ArgCount | AB39: =RC[+1]>RC[-7] -> #ERR: ArgCount | AC39: =VLOOKUP(RC[-28], ProductsPivot!R4C1:R12C3, 3, 0) -> #ERR: ArgCount | AD39: =MAX(RC[-1]-RC[-9], 0) -> #ERR: ArgCount | AE39: =RC[-1]*RC[-26] -> #ERR: ArgCount | AF39: =RC[-1]*RC[-29] -> #ERR: ArgCount | AG39: =VLOOKUP(RC[-31], ComponentsPivot!R3C1:R25C7, 7, 0) -> #ERR: ArgCount | AH39: =RC[-10]-RC[-1] -> #ERR: ArgCount | AI39: =ROUND(RC[-18]+RC[-4], 0) -> #ERR: ArgCount
A40: =BillofMaterials!R[+2]C -> FL500 | B40: =BillofMaterials!R[+2]C -> LFL50 | C40: =BillofMaterials!R[+2]C -> 26 | D40: =BillofMaterials!R[+2]C -> #ERR: ArgCount | E40: =VLOOKUP(RC[-4], TheBusiness!R8C1:R14C4, 4, 0) -> #ERR: ArgCount | F40: =VLOOKUP(RC[-5], ItemMaster!R6C1:R31C8, R1C, 0) -> #ERR: ArgCount | G40: =IF(RC[-2], RC[-1]/RC[-2], 0) -> #ERR: ArgCount | H40: =RC[-3]*RC[-5]*RC[+6] -> #ERR: ArgCount | I40: =MAX(VLOOKUP(RC[-7], ComponentsPivot!R3C1:R25C7, 2, 0), RC[-4]*RC[-6]) -> #ERR: ArgCount | J40: =VLOOKUP(RC[-8], ItemMaster!R6C1:R31C8, R1C, 0) -> #ERR: ArgCount | K40: =RC[-5]*RC[-8]*RC[+3] -> #ERR: ArgCount | L40: =VLOOKUP(RC[-10], ComponentsPivot!R3C1:R25C3, 3, 0) -> #ERR: ArgCount | M40: =IF(RC[-4], (RC[-1]+RC[-3])/RC[-4], 0) -> #ERR: ArgCount | N40: =AND(RC[+1], RC[-7]<RC[-1]) -> #ERR: ArgCount | O40: =VLOOKUP(RC[-14], ProductsPivot!R4C1:R12C3, 2, 0) -> #ERR: ArgCount | P40: =MAX(RC[-1]-RC[-9], 0) -> #ERR: ArgCount | Q40: =RC[-1]*RC[-12] -> #ERR: ArgCount | R40: =RC[-1]*RC[-15] -> #ERR: ArgCount | S40: =VLOOKUP(RC[-17], ComponentsPivot!R3C1:R25C4, 4, 0) -> #ERR: ArgCount | T40: =RC[-14]+RC[-3] -> #ERR: ArgCount | U40: =IF(RC[-16], RC[-1]/RC[-16], 0) -> #ERR: ArgCount | V40: =RC[-17]*RC[-19]*RC[+6] -> #ERR: ArgCount | W40: =MAX(VLOOKUP(RC[-21], ComponentsPivot!R3C1:R25C7, 5, 0), RC[-18]*RC[-20]) -> #ERR: ArgCount | X40: =RC[-14]-RC[-5] -> #ERR: ArgCount | Y40: =RC[-5]*RC[-22]*RC[+3] -> #ERR: ArgCount | Z40: =VLOOKUP(RC[-24], ComponentsPivot!R3C1:R25C7, 6, 0) -> #ERR: ArgCount | AA40: =IF(RC[-4], (RC[-1]+RC[-3])/RC[-4], 0) -> #ERR: ArgCount | AB40: =RC[+1]>RC[-7] -> #ERR: ArgCount | AC40: =VLOOKUP(RC[-28], ProductsPivot!R4C1:R12C3, 3, 0) -> #ERR: ArgCount | AD40: =MAX(RC[-1]-RC[-9], 0) -> #ERR: ArgCount | AE40: =RC[-1]*RC[-26] -> #ERR: ArgCount | AF40: =RC[-1]*RC[-29] -> #ERR: ArgCount | AG40: =VLOOKUP(RC[-31], ComponentsPivot!R3C1:R25C7, 7, 0) -> #ERR: ArgCount | AH40: =RC[-10]-RC[-1] -> #ERR: ArgCount | AI40: =ROUND(RC[-18]+RC[-4], 0) -> #ERR: ArgCount

Sheet: ComponentsPivot
A4: 'Component | B4: 'Sum of Component Sales Forcast per Week | C4: 'Sum of Components in Product Inventory | D4: 'Sum of Use Component | E4: 'Sum of Component Sales Forcast per Week 2 | F4: 'Sum of Components in Product Inventory 2 | G4: 'Sum of Use Component 2
A5: 'BS01 | B5: 60000 | C5: 46248 | D5: 28714.48 | E5: 960 | F5: 2342.4 | G5: 2391.208
A6: 'BT100 | B6: 57600 | C6: 112416 | D6: 0 | E6: 9600 | F6: 23424 | G6: 23912.08
A7: 'BT250 | B7: 124800 | C7: 125664 | D7: 41825.92 | E7: 0 | F7: 0 | G7: 0
A8: 'BT500 | B8: 57600 | C8: 29664 | D8: 36516 | E8: 0 | F8: 0 | G8: 0
A9: 'CAPF | B9: 124800 | C9: 125664 | D9: 41825.92 | E9: 9600 | F9: 23424 | G9: 23912.08
A10: 'CAPS | B10: 57600 | C10: 29664 | D10: 36516 | E10: 0 | F10: 0 | G10: 0
A11: 'CARL | B11: 5000 | C11: 3854 | D11: 2392.87333333333 | E11: 0 | F11: 0 | G11: 0
A12: 'CARS | B12: 200 | C12: 488 | D12: 0 | E12: 200 | F12: 488 | G12: 498.168333333333
A13: 'ESA | B13: 312 | C13: 321.792 | D13: 102.9672 | E13: 0 | F13: 0 | G13: 0
A14: 'ESL | B14: 345.6 | C14: 253.104 | D14: 184.1776 | E14: 9.6 | F14: 23.424 | G14: 23.91208
A15: 'LAB10 | B15: 50000 | C15: 92700 | D15: 0 | E15: 0 | F15: 0 | G15: 0
A16: 'LAB25 | B16: 70000 | C16: 73500 | D16: 20444.6666666667 | E16: 0 | F16: 0 | G16: 0
A17: 'LAB50 | B17: 20800 | C17: 12220 | D17: 11678.3333333333 | E17: 0 | F17: 0 | G17: 0
A18: 'LFL10 | B18: 10000 | C18: 24400 | D18: 0 | E18: 10000 | F18: 24400 | G18: 24908.4166666667
A19: 'LFL25 | B19: 60000 | C19: 57400 | D19: 23124 | E19: 0 | F19: 0 | G19: 0
A20: 'LFL50 | B20: 41600 | C20: 19916 | D20: 27880.6666666667 | E20: 0 | F20: 0 | G20: 0

Sheet: ProductsPivot
A4: 'Product | B4: 'Min of Total Average Inventory Cover | C4: 'Min of Total Average Inventory Cover 2 | D4: 'Product to make with components in inventory
A5: 'AB100 | B5: 1.34206666666667 | C5: 0.986168333333333 | D5: 0
A6: 'AB250 | B6: 1.34206666666667 | C6: 0.470471428571429 | D6: 2454
A7: 'AB500 | B7: 1.14895833333333 | C7: 0 | D7: 2694
A8: 'FL100 | B8: 1.34206666666667 | C8: 4.93084166666667 | D8: 2988
A9: 'FL250 | B9: 1.34206666666667 | C9: 0.548883333333333 | D9: 2772
A10: 'FL500 | B10: 1.14895833333333 | C10: 0 | D10: 6432

Sheet: @SDF
A1: =DEFINE("ISBLANK", RC[+1], RC[+2]) -> FUN ISBLANK AT #0 | B1: =ISERROR(RC[+1]) -> 1
A2: =DEFINE("MATCH_PICKER", RC[+1], RC[+2], RC[+3], RC[+4]) -> FUN MATCH_PICKER AT #1 | B2: =IF(RC[+2]>0, RC[+2], IF(EQUAL(RC[+1], RC[+3]), ABS(RC[+2]), RC[+2]-1)) -> #EMPTY!
A3: =DEFINE("MATCH", RC[+1], RC[+2], RC[+3], RC[+4]) -> FUN MATCH AT #2 | B3: =IF(RC[+4]<0, NA(), RC[+4]) -> #EMPTY! | F3: =REDUCE(CLOSURE("MATCH_PICKER", RC[-3], NA(), NA()), -1, RC[-2]) -> #EMPTY!
A4: =DEFINE("RIGHT", RC[+1], RC[+2], RC[+3]) -> FUN RIGHT AT #3 | B4: =EXTERN("System.String.Substring(I)T", RC[+1], EXTERN("System.String.get_Length()I", RC[+1])-RC[+2]) -> #EXTERN: Non-static method requires a target.
A5: =DEFINE("INT", RC[+1], RC[+2]) -> FUN INT AT #4 | B5: =FLOOR(RC[+1], 1) -> #EMPTY!

Sheet: @Lookup
A1: 'Excel-style lookup functions implemented as sheet-defined functions
A3: =DEFINE("matchcolaux", R[+8]C[+1], R[+1]C[+1], R[+2]C[+1], R[+3]C[+1], R[+4]C[+1]) -> FUN MATCHCOLAUX AT #5 | B3: 'MATCHCOLAUX(x, arr, a, b)
A4: 'x =
A5: 'arr =
A6: 'a =
A7: 'b =
A8: 'm = | B8: =CEILING((R[-2]C+R[-1]C)/2, 1) -> #EMPTY!
B9: =MATCHCOLAUX(R[-5]C, R[-4]C, R[-1]C, R[-2]C) -> #EMPTY!
B10: =MATCHCOLAUX(R[-6]C, R[-5]C, R[-4]C, R[-2]C-1) -> #EMPTY!
A11: 'result = | B11: =IF(R[-5]C>R[-4]C, NA(), IF(EQUAL(INDEX(R[-6]C, 1, R[-5]C), R[-7]C), R[-5]C, MATCHCOLAUX(R[-7]C, R[-6]C, R[-5]C+1, R[-4]C))) -> #EMPTY!
A13: =DEFINE("matchrowaux", R[+6]C[+1], R[+1]C[+1], R[+2]C[+1], R[+3]C[+1], R[+4]C[+1]) -> FUN MATCHROWAUX AT #6 | B13: 'MATCHROWAUX(x, arr, a, b)
A14: 'x =
A15: 'arr =
A16: 'a =
A17: 'b =
A18: 'm = | B18: =CEILING((R[-2]C+R[-1]C)/2, 1) -> #EMPTY!
A19: 'result = | B19: =IF(R[-3]C>R[-2]C, NA(), IF(EQUAL(INDEX(R[-4]C, R[-3]C, 1), R[-5]C), R[-3]C, MATCHROWAUX(R[-5]C, R[-4]C, R[-3]C+1, R[-2]C))) -> #EMPTY!
A26: =DEFINE("hlookup", R[+4]C[+1], R[+1]C[+1], R[+2]C[+1], R[+3]C[+1], RC[+2]) -> FUN HLOOKUP AT #7 | B26: 'HLOOKUP(x, arr, r) | D26: 'dummy
A27: 'x =
A28: 'arr =
A29: 'r =
A30: 'result = | B30: =INDEX(R[-2]C, R[-1]C, MATCHCOLAUX(R[-3]C, R[-2]C, 1, COLUMNS(R[-2]C))) -> #EMPTY!
A32: =DEFINE("vlookup", R[+4]C[+1], R[+1]C[+1], R[+2]C[+1], R[+3]C[+1], RC[+2]) -> FUN VLOOKUP AT #8 | B32: 'VLOOKUP(x, arr, r) | D32: 'dummy
A33: 'x =
A34: 'arr =
A35: 'c =
A36: 'result = | B36: =INDEX(R[-2]C, MATCHROWAUX(R[-3]C, R[-2]C, 1, ROWS(R[-2]C)), R[-1]C) -> #EMPTY!