Sheet: Sheet1
A2: Pollutant | B2: POINT | C2: AREA | D2: MOBILE | E2: NONROAD | F2: NEW YORK STATE | G2: NEW YORK STATE | H2: ALBANY | L2: ALBANY | M2: ALLEGANY | Q2: ALLEGANY | R2: BRONX | V2: BRONX | W2: BROOME | AA2: BROOME | AB2: CATTARAUGUS | AF2: CATTARAUGUS | AG2: CAYUGA | AK2: CAYUGA | AL2: CHAUTAUQUA | AP2: CHAUTAUQUA | AQ2: CHEMUNG | AT2: 0 | AU2: CHEMUNG | AV2: CHENANGO | AY2: 0 | AZ2: CHENANGO | BA2: CLINTON | BD2: 0 | BE2: CLINTON | BF2: COLUMBIA | BI2: 0 | BJ2: COLUMBIA | BK2: CORTLAND | BN2: 0 | BO2: CORTLAND | BP2: DELAWARE | BS2: 0 | BT2: DELAWARE | BU2: DUTCHESS | BX2: 0 | BY2: DUTCHESS | BZ2: ERIE | CC2: 0 | CD2: ERIE | CE2: ESSEX | CH2: 0 | CI2: ESSEX | CJ2: FRANKLIN | CM2: 0 | CN2: FRANKLIN | CO2: FULTON | CR2: 0 | CS2: FULTON | CT2: GENESEE | CW2: 0 | CX2: GENESEE | CY2: GREENE | DB2: 0 | DC2: GREENE | DD2: HAMILTON | DG2: 0 | DH2: HAMILTON | DI2: HERKIMER | DL2: 0 | DM2: HERKIMER | DN2: JEFFERSON | DQ2: 0 | DR2: JEFFERSON | DS2: KINGS | DV2: 0 | DW2: KINGS | DX2: LEWIS | EA2: 0 | EB2: LEWIS | EC2: LIVINGSTON | EF2: 0 | EG2: LIVINGSTON | EH2: MADISON | EK2: 0 | EL2: MADISON | EM2: MONROE | EP2: 0 | EQ2: MONROE | ER2: MONTGOMERY | EU2: 0 | EV2: MONTGOMERY | EW2: NASSAU | EZ2: 0 | FA2: NASSAU | FB2: NEW YORK | FE2: 0 | FF2: NEW YORK | FG2: NIAGARA | FJ2: 0 | FK2: NIAGARA | FL2: ONEIDA | FO2: 0 | FP2: ONEIDA | FQ2: ONONDAGA | FT2: 0 | FU2: ONONDAGA | FV2: ONTARIO | FY2: 0 | FZ2: ONTARIO | GA2: ORANGE | GD2: 0 | GE2: ORANGE | GF2: ORLEANS | GI2: 0 | GJ2: ORLEANS | GK2: OSWEGO | GN2: 0 | GO2: OSWEGO | GP2: OTSEGO | GS2: 0 | GT2: OTSEGO | GU2: PUTNAM | GX2: 0 | GY2: PUTNAM | GZ2: QUEENS | HC2: 0 | HD2: QUEENS | HE2: RENSSELAER | HH2: 0 | HI2: RENSSELAER | HJ2: RICHMOND | HM2: 0 | HN2: RICHMOND | HO2: ROCKLAND | HR2: 0 | HS2: ROCKLAND | HT2: SARATOGA | HW2: 0 | HX2: SARATOGA | HY2: SCHENECTADY | IB2: 0 | IC2: SCHENECTADY | ID2: SCHOHARIE | IG2: 0 | IH2: SCHOHARIE | II2: SCHUYLER | IL2: 0 | IM2: SCHUYLER
A3: 0 | B3: TOTAL LBS | C3: TOTAL LBS | D3: TOTAL LBS | E3: TOTAL LBS | F3: TOTAL LBS | G3: TOTAL LBS | H3: ONROAD | I3: AREA | J3: POINT | K3: NONROAD | L3: TOTAL LBS | M3: ONROAD | N3: AREA | O3: POINT | P3: NONROAD | Q3: TOTAL LBS | R3: ONROAD | S3: AREA | T3: POINT | U3: NONROAD | V3: TOTAL LBS | W3: ONROAD | X3: AREA | Y3: POINT | Z3: NONROAD | AA3: TOTAL LBS | AB3: ONROAD | AC3: AREA | AD3: POINT | AE3: NONROAD | AF3: TOTAL LBS | AG3: ONROAD | AH3: AREA | AI3: POINT | AJ3: NONROAD | AK3: TOTAL LBS | AL3: ONROAD | AM3: AREA | AN3: POINT | AO3: NONROAD | AP3: TOTAL LBS | AQ3: ONROAD | AR3: AREA | AS3: POINT | AT3: NONROAD | AU3: TOTAL LBS | AV3: ONROAD | AW3: AREA | AX3: POINT | AY3: NONROAD | AZ3: TOTAL LBS | BA3: ONROAD | BB3: AREA | BC3: POINT | BD3: NONROAD | BE3: TOTAL LBS | BF3: ONROAD | BG3: AREA | BH3: POINT | BI3: NONROAD | BJ3: TOTAL LBS | BK3: ONROAD | BL3: AREA | BM3: POINT | BN3: NONROAD | BO3: TOTAL LBS | BP3: ONROAD | BQ3: AREA | BR3: POINT | BS3: NONROAD | BT3: TOTAL LBS | BU3: ONROAD | BV3: AREA | BW3: POINT | BX3: NONROAD | BY3: TOTAL LBS | BZ3: ONROAD | CA3: AREA | CB3: POINT | CC3: NONROAD | CD3: TOTAL LBS | CE3: ONROAD | CF3: AREA | CG3: POINT | CH3: NONROAD | CI3: TOTAL LBS | CJ3: ONROAD | CK3: AREA | CL3: POINT | CM3: NONROAD | CN3: TOTAL LBS | CO3: ONROAD | CP3: AREA | CQ3: POINT | CR3: NONROAD | CS3: TOTAL LBS | CT3: ONROAD | CU3: AREA | CV3: POINT | CW3: NONROAD | CX3: TOTAL LBS | CY3: ONROAD | CZ3: AREA | DA3: POINT | DB3: NONROAD | DC3: TOTAL LBS | DD3: ONROAD | DE3: AREA | DF3: POINT | DG3: NONROAD | DH3: TOTAL LBS | DI3: ONROAD | DJ3: AREA | DK3: POINT | DL3: NONROAD | DM3: TOTAL LBS | DN3: ONROAD | DO3: AREA | DP3: POINT | DQ3: NONROAD | DR3: TOTAL LBS | DS3: ONROAD | DT3: AREA | DU3: POINT | DV3: NONROAD | DW3: TOTAL LBS | DX3: ONROAD | DY3: AREA | DZ3: POINT | EA3: NONROAD | EB3: TOTAL LBS | EC3: ONROAD | ED3: AREA | EE3: POINT | EF3: NONROAD | EG3: TOTAL LBS | EH3: ONROAD | EI3: AREA | EJ3: POINT | EK3: NONROAD | EL3: TOTAL LBS | EM3: ONROAD | EN3: AREA | EO3: POINT | EP3: NONROAD | EQ3: TOTAL LBS | ER3: ONROAD | ES3: AREA | ET3: POINT | EU3: NONROAD | EV3: TOTAL LBS | EW3: ONROAD | EX3: AREA | EY3: POINT | EZ3: NONROAD | FA3: TOTAL LBS | FB3: ONROAD | FC3: AREA | FD3: POINT | FE3: NONROAD | FF3: TOTAL LBS | FG3: ONROAD | FH3: AREA | FI3: POINT | FJ3: NONROAD | FK3: TOTAL LBS | FL3: ONROAD | FM3: AREA | FN3: POINT | FO3: NONROAD | FP3: TOTAL LBS | FQ3: ONROAD | FR3: AREA | FS3: POINT | FT3: NONROAD | FU3: TOTAL LBS | FV3: ONROAD | FW3: AREA | FX3: POINT | FY3: NONROAD | FZ3: TOTAL LBS | GA3: ONROAD | GB3: AREA | GC3: POINT | GD3: NONROAD | GE3: TOTAL LBS | GF3: ONROAD | GG3: AREA | GH3: POINT | GI3: NONROAD | GJ3: TOTAL LBS | GK3: ONROAD | GL3: AREA | GM3: POINT | GN3: NONROAD | GO3: TOTAL LBS | GP3: ONROAD | GQ3: AREA | GR3: POINT | GS3: NONROAD | GT3: TOTAL LBS | GU3: ONROAD | GV3: AREA | GW3: POINT | GX3: NONROAD | GY3: TOTAL LBS | GZ3: ONROAD | HA3: AREA | HB3: POINT | HC3: NONROAD | HD3: TOTAL LBS | HE3: ONROAD | HF3: AREA | HG3: POINT | HH3: NONROAD | HI3: TOTAL LBS | HJ3: ONROAD | HK3: AREA | HL3: POINT | HM3: NONROAD | HN3: TOTAL LBS | HO3: ONROAD | HP3: AREA | HQ3: POINT | HR3: NONROAD | HS3: TOTAL LBS | HT3: ONROAD | HU3: AREA | HV3: POINT | HW3: NONROAD | HX3: TOTAL LBS | HY3: ONROAD | HZ3: AREA | IA3: POINT | IB3: NONROAD | IC3: TOTAL LBS | ID3: ONROAD | IE3: AREA | IF3: POINT | IG3: NONROAD | IH3: TOTAL LBS | II3: ONROAD | IJ3: AREA | IK3: POINT | IL3: NONROAD | IM3: TOTAL LBS
A4: ACENAPTHENE | B4: =RC[8]+RC[13]+RC[18]+RC[23]+RC[28]+RC[33]+RC[38]+RC[43]+RC[48]+RC[53]+RC[58]+RC[63]+RC[68]+RC[73]+RC[78]+RC[83]+RC[88]+RC[93]+RC[98]+RC[103]+RC[108]+RC[113]+RC[118]+RC[123]+RC[128]+RC[133]+RC[138]+RC[143]+RC[148]+RC[153]+RC[158]+RC[163]+RC[168]+RC[173]+RC[178]+RC[183]+RC[188]+RC[193]+RC[198]+RC[203]+RC[208]+RC[213]+RC[218]+RC[223]+RC[228]+RC[233]+RC[238]+RC[243]+Sheet2!RC[2]+Sheet2!RC[7]+Sheet2!RC[12]+Sheet2!RC[17]+Sheet2!RC[22]+Sheet2!RC[27]+Sheet2!RC[32]+Sheet2!RC[37]+Sheet2!RC[42]+Sheet2!RC[47]+Sheet2!RC[57]+Sheet2!RC[52]+Sheet2!RC[62]+Sheet2!RC[67] -> 2604.16 | C4: =RC[6]+RC[11]+RC[16]+RC[21]+RC[26]+RC[31]+RC[36]+RC[41]+RC[46]+RC[51]+RC[56]+RC[61]+RC[66]+RC[71]+RC[76]+RC[81]+RC[86]+RC[91]+RC[96]+RC[101]+RC[106]+RC[111]+RC[116]+RC[121]+RC[126]+RC[131]+RC[136]+RC[141]+RC[146]+RC[151]+RC[156]+RC[161]+RC[166]+RC[171]+RC[176]+RC[181]+RC[186]+RC[191]+RC[196]+RC[201]+RC[206]+RC[211]+RC[216]+RC[221]+RC[226]+RC[231]+RC[236]+RC[241]+Sheet2!RC+Sheet2!RC[5]+Sheet2!RC[10]+Sheet2!RC[15]+Sheet2!RC[20]+Sheet2!RC[25]+Sheet2!RC[30]+Sheet2!RC[35]+Sheet2!RC[40]+Sheet2!RC[45]+Sheet2!RC[50]+Sheet2!RC[55]+Sheet2!RC[60]+Sheet2!RC[65] -> 0 | D4: =RC[4]+RC[9]+RC[14]+RC[19]+RC[24]+RC[29]+RC[34]+RC[39]+RC[44]+RC[49]+RC[54]+RC[59]+RC[64]+RC[69]+RC[74]+RC[79]+RC[84]+RC[89]+RC[94]+RC[99]+RC[104]+RC[109]+RC[114]+RC[119]+RC[124]+RC[129]+RC[134]+RC[139]+RC[144]+RC[149]+RC[154]+RC[159]+RC[164]+RC[169]+RC[174]+RC[179]+RC[184]+RC[189]+RC[194]+RC[199]+RC[204]+RC[209]+RC[214]+RC[219]+RC[224]+RC[229]+RC[234]+RC[239]+Sheet2!RC[3]+Sheet2!RC[-2]+Sheet2!RC[8]+Sheet2!RC[13]+Sheet2!RC[18]+Sheet2!RC[23]+Sheet2!RC[28]+Sheet2!RC[33]+Sheet2!RC[38]+Sheet2!RC[43]+Sheet2!RC[48]+Sheet2!RC[53]+Sheet2!RC[58]+Sheet2!RC[63] -> 0 | E4: =RC[6]+RC[11]+RC[16]+RC[21]+RC[26]+RC[31]+RC[36]+RC[41]+RC[46]+RC[51]+RC[56]+RC[61]+RC[66]+RC[71]+RC[76]+RC[81]+RC[86]+RC[91]+RC[96]+RC[101]+RC[106]+RC[111]+RC[116]+RC[121]+RC[126]+RC[131]+RC[136]+RC[141]+RC[146]+RC[151]+RC[156]+RC[161]+RC[166]+RC[171]+RC[176]+RC[181]+RC[186]+RC[191]+RC[196]+RC[201]+RC[206]+RC[211]+RC[216]+RC[221]+RC[226]+RC[231]+RC[236]+RC[241]+Sheet2!RC+Sheet2!RC[5]+Sheet2!RC[10]+Sheet2!RC[15]+Sheet2!RC[20]+Sheet2!RC[25]+Sheet2!RC[30]+Sheet2!RC[35]+Sheet2!RC[40]+Sheet2!RC[45]+Sheet2!RC[50]+Sheet2!RC[55]+Sheet2!RC[60]+Sheet2!RC[65] -> 0 | F4: =SUM(RC[-4]:RC[-1]) -> 2604.16 | G4: =Sheet1!RC[5]+Sheet1!RC[10]+Sheet1!RC[15]+Sheet1!RC[20]+Sheet1!RC[25]+Sheet1!RC[30]+Sheet1!RC[35]+Sheet1!RC[40]+Sheet1!RC[45]+Sheet1!RC[50]+Sheet1!RC[55]+Sheet1!RC[60]+Sheet1!RC[65]+Sheet1!RC[70]+Sheet1!RC[75]+Sheet1!RC[80]+Sheet1!RC[85]+Sheet1!RC[90]+Sheet1!RC[95]+Sheet1!RC[100]+Sheet1!RC[105]+Sheet1!RC[110]+Sheet1!RC[115]+Sheet1!RC[120]+Sheet1!RC[125]+Sheet1!RC[130]+Sheet1!RC[135]+Sheet1!RC[140]+Sheet1!RC[145]+Sheet1!RC[150]+Sheet1!RC[155]+Sheet1!RC[160]+Sheet1!RC[165]+Sheet1!RC[170]+Sheet1!RC[175]+Sheet1!RC[180]+Sheet1!RC[185]+Sheet1!RC[190]+Sheet1!RC[195]+Sheet1!RC[200]+Sheet1!RC[205]+Sheet1!RC[210]+Sheet1!RC[215]+Sheet1!RC[220]+Sheet1!RC[225]+Sheet1!RC[230]+Sheet1!RC[235]+Sheet1!RC[240]+Sheet2!RC[-1]+Sheet2!RC[4]+Sheet2!RC[9]+Sheet2!RC[14]+Sheet2!RC[19]+Sheet2!RC[24]+Sheet2!RC[29]+Sheet2!RC[34]+Sheet2!RC[39]+Sheet2!RC[44]+Sheet2!RC[49]+Sheet2!RC[54]+Sheet2!RC[59]+Sheet2!RC[64] -> 2604.16 | H4: 0 | I4: 0 | J4: 0 | K4: 0 | L4: =SUM(RC[-4]:RC[-1]) -> 0 | M4: 0 | N4: 0 | O4: 0 | P4: 0 | Q4: =SUM(RC[-4]:RC[-1]) -> 0 | R4: 0 | S4: 0 | T4: 0 | U4: 0 | V4: =SUM(RC[-4]:RC[-1]) -> 0 | W4: 0 | X4: 0 | Y4: 0 | Z4: 0 | AA4: =SUM(RC[-4]:RC[-1]) -> 0 | AB4: 0 | AC4: 0 | AD4: 0 | AE4: 0 | AF4: =SUM(RC[-4]:RC[-1]) -> 0 | AG4: 0 | AH4: 0 | AI4: 0 | AJ4: 0 | AK4: =SUM(RC[-4]:RC[-1]) -> 0 | AL4: 0 | AM4: 0 | AN4: 0 | AO4: 0 | AP4: =SUM(RC[-4]:RC[-1]) -> 0 | AQ4: 0 | AR4: 0 | AS4: 0 | AT4: 0 | AU4: =SUM(RC[-4]:RC[-1]) -> 0 | AV4: 0 | AW4: 0 | AX4: 0 | AY4: 0 | AZ4: =SUM(RC[-4]:RC[-1]) -> 0 | BA4: 0 | BB4: 0 | BC4: 0 | BD4: 0 | BE4: =SUM(RC[-4]:RC[-1]) -> 0 | BF4: 0 | BG4: 0 | BH4: 0 | BI4: 0 | BJ4: =SUM(RC[-4]:RC[-1]) -> 0 | BK4: 0 | BL4: 0 | BM4: 0 | BN4: 0 | BO4: =SUM(RC[-4]:RC[-1]) -> 0 | BP4: 0 | BQ4: 0 | BR4: 0 | BS4: 0 | BT4: =SUM(RC[-4]:RC[-1]) -> 0 | BU4: 0 | BV4: 0 | BW4: 0 | BX4: 0 | BY4: =SUM(RC[-4]:RC[-1]) -> 0 | BZ4: 0 | CA4: 0 | CB4: 2566 | CC4: 0 | CD4: =SUM(RC[-4]:RC[-1]) -> 2566 | CE4: 0 | CF4: 0 | CG4: 0 | CH4: 0 | CI4: =SUM(RC[-4]:RC[-1]) -> 0 | CJ4: 0 | CK4: 0 | CL4: 0 | CM4: 0 | CN4: =SUM(RC[-4]:RC[-1]) -> 0 | CO4: 0 | CP4: 0 | CQ4: 0 | CR4: 0 | CS4: =SUM(RC[-4]:RC[-1]) -> 0 | CT4: 0 | CU4: 0 | CV4: 0 | CW4: 0 | CX4: =SUM(RC[-4]:RC[-1]) -> 0 | CY4: 0 | CZ4: 0 | DA4: 0 | DB4: 0 | DC4: =SUM(RC[-4]:RC[-1]) -> 0 | DD4: 0 | DE4: 0 | DF4: 0 | DG4: 0 | DH4: =SUM(RC[-4]:RC[-1]) -> 0 | DI4: 0 | DJ4: 0 | DK4: 0 | DL4: 0 | DM4: =SUM(RC[-4]:RC[-1]) -> 0 | DN4: 0 | DO4: 0 | DP4: 0 | DQ4: 0 | DR4: =SUM(RC[-4]:RC[-1]) -> 0 | DS4: 0 | DT4: 0 | DU4: 0 | DV4: 0 | DW4: =SUM(RC[-4]:RC[-1]) -> 0 | DX4: 0 | DY4: 0 | DZ4: 0 | EA4: 0 | EB4: =SUM(RC[-4]:RC[-1]) -> 0 | EC4: 0 | ED4: 0 | EE4: 0 | EF4: 0 | EG4: =SUM(RC[-4]:RC[-1]) -> 0 | EH4: 0 | EI4: 0 | EJ4: 0 | EK4: 0 | EL4: =SUM(RC[-4]:RC[-1]) -> 0 | EM4: 0 | EN4: 0 | EO4: 0 | EP4: 0 | EQ4: =SUM(RC[-4]:RC[-1]) -> 0 | ER4: 0 | ES4: 0 | ET4: 0 | EU4: 0 | EV4: =SUM(RC[-4]:RC[-1]) -> 0 | EW4: 0 | EX4: 0 | EY4: 0 | EZ4: 0 | FA4: =SUM(RC[-4]:RC[-1]) -> 0 | FB4: 0 | FC4: 0 | FD4: 0 | FE4: 0 | FF4: =SUM(RC[-4]:RC[-1]) -> 0 | FG4: 0 | FH4: 0 | FI4: 0 | FJ4: 0 | FK4: =SUM(RC[-4]:RC[-1]) -> 0 | FL4: 0 | FM4: 0 | FN4: 0 | FO4: 0 | FP4: =SUM(RC[-4]:RC[-1]) -> 0 | FQ4: 0 | FR4: 0 | FS4: 0 | FT4: 0 | FU4: =SUM(RC[-4]:RC[-1]) -> 0 | FV4: 0 | FW4: 0 | FX4: 0 | FY4: 0 | FZ4: =SUM(RC[-4]:RC[-1]) -> 0 | GA4: 0 | GB4: 0 | GC4: 0 | GD4: 0 | GE4: =SUM(RC[-4]:RC[-1]) -> 0 | GF4: 0 | GG4: 0 | GH4: 0 | GI4: 0 | GJ4: =SUM(RC[-4]:RC[-1]) -> 0 | GK4: 0 | GL4: 0 | GM4: 0 | GN4: 0 | GO4: =SUM(RC[-4]:RC[-1]) -> 0 | GP4: 0 | GQ4: 0 | GR4: 0 | GS4: 0 | GT4: =SUM(RC[-4]:RC[-1]) -> 0 | GU4: 0 | GV4: 0 | GW4: 0 | GX4: 0 | GY4: =SUM(RC[-4]:RC[-1]) -> 0 | GZ4: 0 | HA4: 0 | HB4: 0 | HC4: 0 | HD4: =SUM(RC[-4]:RC[-1]) -> 0 | HE4: 0 | HF4: 0 | HG4: 0 | HH4: 0 | HI4: =SUM(RC[-4]:RC[-1]) -> 0 | HJ4: 0 | HK4: 0 | HL4: 38.159999999999997 | HM4: 0 | HN4: =SUM(RC[-4]:RC[-1]) -> 38.159999999999997 | HO4: 0 | HP4: 0 | HQ4: 0 | HR4: 0 | HS4: =SUM(RC[-4]:RC[-1]) -> 0 | HT4: 0 | HU4: 0 | HV4: 0 | HW4: 0 | HX4: =SUM(RC[-4]:RC[-1]) -> 0 | HY4: 0 | HZ4: 0 | IA4: 0 | IB4: 0 | IC4: =SUM(RC[-4]:RC[-1]) -> 0 | ID4: 0 | IE4: 0 | IF4: 0 | IG4: 0 | IH4: =SUM(RC[-4]:RC[-1]) -> 0 | II4: 0 | IJ4: 0 | IK4: 0 | IL4: 0 | IM4: =SUM(RC[-4]:RC[-1]) -> 0
A5: ACENAPTHTHYL | B5: =RC[8]+RC[13]+RC[18]+RC[23]+RC[28]+RC[33]+RC[38]+RC[43]+RC[48]+RC[53]+RC[58]+RC[63]+RC[68]+RC[73]+RC[78]+RC[83]+RC[88]+RC[93]+RC[98]+RC[103]+RC[108]+RC[113]+RC[118]+RC[123]+RC[128]+RC[133]+RC[138]+RC[143]+RC[148]+RC[153]+RC[158]+RC[163]+RC[168]+RC[173]+RC[178]+RC[183]+RC[188]+RC[193]+RC[198]+RC[203]+RC[208]+RC[213]+RC[218]+RC[223]+RC[228]+RC[233]+RC[238]+RC[243]+Sheet2!RC[2]+Sheet2!RC[7]+Sheet2!RC[12]+Sheet2!RC[17]+Sheet2!RC[22]+Sheet2!RC[27]+Sheet2!RC[32]+Sheet2!RC[37]+Sheet2!RC[42]+Sheet2!RC[47]+Sheet2!RC[57]+Sheet2!RC[52]+Sheet2!RC[62]+Sheet2!RC[67] -> 0 | C5: =RC[6]+RC[11]+RC[16]+RC[21]+RC[26]+RC[31]+RC[36]+RC[41]+RC[46]+RC[51]+RC[56]+RC[61]+RC[66]+RC[71]+RC[76]+RC[81]+RC[86]+RC[91]+RC[96]+RC[101]+RC[106]+RC[111]+RC[116]+RC[121]+RC[126]+RC[131]+RC[136]+RC[141]+RC[146]+RC[151]+RC[156]+RC[161]+RC[166]+RC[171]+RC[176]+RC[181]+RC[186]+RC[191]+RC[196]+RC[201]+RC[206]+RC[211]+RC[216]+RC[221]+RC[226]+RC[231]+RC[236]+RC[241]+Sheet2!RC+Sheet2!RC[5]+Sheet2!RC[10]+Sheet2!RC[15]+Sheet2!RC[20]+Sheet2!RC[25]+Sheet2!RC[30]+Sheet2!RC[35]+Sheet2!RC[40]+Sheet2!RC[45]+Sheet2!RC[50]+Sheet2!RC[55]+Sheet2!RC[60]+Sheet2!RC[65] -> 0 | D5: =RC[4]+RC[9]+RC[14]+RC[19]+RC[24]+RC[29]+RC[34]+RC[39]+RC[44]+RC[49]+RC[54]+RC[59]+RC[64]+RC[69]+RC[74]+RC[79]+RC[84]+RC[89]+RC[94]+RC[99]+RC[104]+RC[109]+RC[114]+RC[119]+RC[124]+RC[129]+RC[134]+RC[139]+RC[144]+RC[149]+RC[154]+RC[159]+RC[164]+RC[169]+RC[174]+RC[179]+RC[184]+RC[189]+RC[194]+RC[199]+RC[204]+RC[209]+RC[214]+RC[219]+RC[224]+RC[229]+RC[234]+RC[239]+Sheet2!RC[3]+Sheet2!RC[-2]+Sheet2!RC[8]+Sheet2!RC[13]+Sheet2!RC[18]+Sheet2!RC[23]+Sheet2!RC[28]+Sheet2!RC[33]+Sheet2!RC[38]+Sheet2!RC[43]+Sheet2!RC[48]+Sheet2!RC[53]+Sheet2!RC[58]+Sheet2!RC[63] -> 0 | E5: =RC[6]+RC[11]+RC[16]+RC[21]+RC[26]+RC[31]+RC[36]+RC[41]+RC[46]+RC[51]+RC[56]+RC[61]+RC[66]+RC[71]+RC[76]+RC[81]+RC[86]+RC[91]+RC[96]+RC[101]+RC[106]+RC[111]+RC[116]+RC[121]+RC[126]+RC[131]+RC[136]+RC[141]+RC[146]+RC[151]+RC[156]+RC[161]+RC[166]+RC[171]+RC[176]+RC[181]+RC[186]+RC[191]+RC[196]+RC[201]+RC[206]+RC[211]+RC[216]+RC[221]+RC[226]+RC[231]+RC[236]+RC[241]+Sheet2!RC+Sheet2!RC[5]+Sheet2!RC[10]+Sheet2!RC[15]+Sheet2!RC[20]+Sheet2!RC[25]+Sheet2!RC[30]+Sheet2!RC[35]+Sheet2!RC[40]+Sheet2!RC[45]+Sheet2!RC[50]+Sheet2!RC[55]+Sheet2!RC[60]+Sheet2!RC[65] -> 0 | F5: =SUM(RC[-4]:RC[-1]) -> 0 | G5: =Sheet1!RC[5]+Sheet1!RC[10]+Sheet1!RC[15]+Sheet1!RC[20]+Sheet1!RC[25]+Sheet1!RC[30]+Sheet1!RC[35]+Sheet1!RC[40]+Sheet1!RC[45]+Sheet1!RC[50]+Sheet1!RC[55]+Sheet1!RC[60]+Sheet1!RC[65]+Sheet1!RC[70]+Sheet1!RC[75]+Sheet1!RC[80]+Sheet1!RC[85]+Sheet1!RC[90]+Sheet1!RC[95]+Sheet1!RC[100]+Sheet1!RC[105]+Sheet1!RC[110]+Sheet1!RC[115]+Sheet1!RC[120]+Sheet1!RC[125]+Sheet1!RC[130]+Sheet1!RC[135]+Sheet1!RC[140]+Sheet1!RC[145]+Sheet1!RC[150]+Sheet1!RC[155]+Sheet1!RC[160]+Sheet1!RC[165]+Sheet1!RC[170]+Sheet1!RC[175]+Sheet1!RC[180]+Sheet1!RC[185]+Sheet1!RC[190]+Sheet1!RC[195]+Sheet1!RC[200]+Sheet1!RC[205]+Sheet1!RC[210]+Sheet1!RC[215]+Sheet1!RC[220]+Sheet1!RC[225]+Sheet1!RC[230]+Sheet1!RC[235]+Sheet1!RC[240]+Sheet2!RC[-1]+Sheet2!RC[4]+Sheet2!RC[9]+Sheet2!RC[14]+Sheet2!RC[19]+Sheet2!RC[24]+Sheet2!RC[29]+Sheet2!RC[34]+Sheet2!RC[39]+Sheet2!RC[44]+Sheet2!RC[49]+Sheet2!RC[54]+Sheet2!RC[59]+Sheet2!RC[64] -> 0 | H5: 0 | I5: 0 | J5: 0 | K5: 0 | L5: =SUM(RC[-4]:RC[-1]) -> 0 | M5: 0 | N5: 0 | O5: 0 | P5: 0 | Q5: =SUM(RC[-4]:RC[-1]) -> 0 | R5: 0 | S5: 0 | T5: 0 | U5: 0 | V5: =SUM(RC[-4]:RC[-1]) -> 0 | W5: 0 | X5: 0 | Y5: 0 | Z5: 0 | AA5: =SUM(RC[-4]:RC[-1]) -> 0 | AB5: 0 | AC5: 0 | AD5: 0 | AE5: 0 | AF5: =SUM(RC[-4]:RC[-1]) -> 0 | AG5: 0 | AH5: 0 | AI5: 0 | AJ5: 0 | AK5: =SUM(RC[-4]:RC[-1]) -> 0 | AL5: 0 | AM5: 0 | AN5: 0 | AO5: 0 | AP5: =SUM(RC[-4]:RC[-1]) -> 0 | AQ5: 0 | AR5: 0 | AS5: 0 | AT5: 0 | AU5: =SUM(RC[-4]:RC[-1]) -> 0 | AV5: 0 | AW5: 0 | AX5: 0 | AY5: 0 | AZ5: =SUM(RC[-4]:RC[-1]) -> 0 | BA5: 0 | BB5: 0 | BC5: 0 | BD5: 0 | BE5: =SUM(RC[-4]:RC[-1]) -> 0 | BF5: 0 | BG5: 0 | BH5: 0 | BI5: 0 | BJ5: =SUM(RC[-4]:RC[-1]) -> 0 | BK5: 0 | BL5: 0 | BM5: 0 | BN5: 0 | BO5: =SUM(RC[-4]:RC[-1]) -> 0 | BP5: 0 | BQ5: 0 | BR5: 0 | BS5: 0 | BT5: =SUM(RC[-4]:RC[-1]) -> 0 | BU5: 0 | BV5: 0 | BW5: 0 | BX5: 0 | BY5: =SUM(RC[-4]:RC[-1]) -> 0 | BZ5: 0 | CA5: 0 | CB5: 0 | CC5: 0 | CD5: =SUM(RC[-4]:RC[-1]) -> 0 | CE5: 0 | CF5: 0 | CG5: 0 | CH5: 0 | CI5: =SUM(RC[-4]:RC[-1]) -> 0 | CJ5: 0 | CK5: 0 | CL5: 0 | CM5: 0 | CN5: =SUM(RC[-4]:RC[-1]) -> 0 | CO5: 0 | CP5: 0 | CQ5: 0 | CR5: 0 | CS5: =SUM(RC[-4]:RC[-1]) -> 0 | CT5: 0 | CU5: 0 | CV5: 0 | CW5: 0 | CX5: =SUM(RC[-4]:RC[-1]) -> 0 | CY5: 0 | CZ5: 0 | DA5: 0 | DB5: 0 | DC5: =SUM(RC[-4]:RC[-1]) -> 0 | DD5: 0 | DE5: 0 | DF5: 0 | DG5: 0 | DH5: =SUM(RC[-4]:RC[-1]) -> 0 | DI5: 0 | DJ5: 0 | DK5: 0 | DL5: 0 | DM5: =SUM(RC[-4]:RC[-1]) -> 0 | DN5: 0 | DO5: 0 | DP5: 0 | DQ5: 0 | DR5: =SUM(RC[-4]:RC[-1]) -> 0 | DS5: 0 | DT5: 0 | DU5: 0 | DV5: 0 | DW5: =SUM(RC[-4]:RC[-1]) -> 0 | DX5: 0 | DY5: 0 | DZ5: 0 | EA5: 0 | EB5: =SUM(RC[-4]:RC[-1]) -> 0 | EC5: 0 | ED5: 0 | EE5: 0 | EF5: 0 | EG5: =SUM(RC[-4]:RC[-1]) -> 0 | EH5: 0 | EI5: 0 | EJ5: 0 | EK5: 0 | EL5: =SUM(RC[-4]:RC[-1]) -> 0 | EM5: 0 | EN5: 0 | EO5: 0 | EP5: 0 | EQ5: =SUM(RC[-4]:RC[-1]) -> 0 | ER5: 0 | ES5: 0 | ET5: 0 | EU5: 0 | EV5: =SUM(RC[-4]:RC[-1]) -> 0 | EW5: 0 | EX5: 0 | EY5: 0 | EZ5: 0 | FA5: =SUM(RC[-4]:RC[-1]) -> 0 | FB5: 0 | FC5: 0 | FD5: 0 | FE5: 0 | FF5: =SUM(RC[-4]:RC[-1]) -> 0 | FG5: 0 | FH5: 0 | FI5: 0 | FJ5: 0 | FK5: =SUM(RC[-4]:RC[-1]) -> 0 | FL5: 0 | FM5: 0 | FN5: 0 | FO5: 0 | FP5: =SUM(RC[-4]:RC[-1]) -> 0 | FQ5: 0 | FR5: 0 | FS5: 0 | FT5: 0 | FU5: =SUM(RC[-4]:RC[-1]) -> 0 | FV5: 0 | FW5: 0 | FX5: 0 | FY5: 0 | FZ5: =SUM(RC[-4]:RC[-1]) -> 0 | GA5: 0 | GB5: 0 | GC5: 0 | GD5: 0 | GE5: =SUM(RC[-4]:RC[-1]) -> 0 | GF5: 0 | GG5: 0 | GH5: 0 | GI5: 0 | GJ5: =SUM(RC[-4]:RC[-1]) -> 0 | GK5: 0 | GL5: 0 | GM5: 0 | GN5: 0 | GO5: =SUM(RC[-4]:RC[-1]) -> 0 | GP5: 0 | GQ5: 0 | GR5: 0 | GS5: 0 | GT5: =SUM(RC[-4]:RC[-1]) -> 0 | GU5: 0 | GV5: 0 | GW5: 0 | GX5: 0 | GY5: =SUM(RC[-4]:RC[-1]) -> 0 | GZ5: 0 | HA5: 0 | HB5: 0 | HC5: 0 | HD5: =SUM(RC[-4]:RC[-1]) -> 0 | HE5: 0 | HF5: 0 | HG5: 0 | HH5: 0 | HI5: =SUM(RC[-4]:RC[-1]) -> 0 | HJ5: 0 | HK5: 0 | HL5: 0 | HM5: 0 | HN5: =SUM(RC[-4]:RC[-1]) -> 0 | HO5: 0 | HP5: 0 | HQ5: 0 | HR5: 0 | HS5: =SUM(RC[-4]:RC[-1]) -> 0 | HT5: 0 | HU5: 0 | HV5: 0 | HW5: 0 | HX5: =SUM(RC[-4]:RC[-1]) -> 0 | HY5: 0 | HZ5: 0 | IA5: 0 | IB5: 0 | IC5: =SUM(RC[-4]:RC[-1]) -> 0 | ID5: 0 | IE5: 0 | IF5: 0 | IG5: 0 | IH5: =SUM(RC[-4]:RC[-1]) -> 0 | II5: 0 | IJ5: 0 | IK5: 0 | IL5: 0 | IM5: =SUM(RC[-4]:RC[-1]) -> 0
A6: ACETALDEHYDE | B6: =RC[8]+RC[13]+RC[18]+RC[23]+RC[28]+RC[33]+RC[38]+RC[43]+RC[48]+RC[53]+RC[58]+RC[63]+RC[68]+RC[73]+RC[78]+RC[83]+RC[88]+RC[93]+RC[98]+RC[103]+RC[108]+RC[113]+RC[118]+RC[123]+RC[128]+RC[133]+RC[138]+RC[143]+RC[148]+RC[153]+RC[158]+RC[163]+RC[168]+RC[173]+RC[178]+RC[183]+RC[188]+RC[193]+RC[198]+RC[203]+RC[208]+RC[213]+RC[218]+RC[223]+RC[228]+RC[233]+RC[238]+RC[243]+Sheet2!RC[2]+Sheet2!RC[7]+Sheet2!RC[12]+Sheet2!RC[17]+Sheet2!RC[22]+Sheet2!RC[27]+Sheet2!RC[32]+Sheet2!RC[37]+Sheet2!RC[42]+Sheet2!RC[47]+Sheet2!RC[57]+Sheet2!RC[52]+Sheet2!RC[62]+Sheet2!RC[67] -> 75151.155000000028 | C6: =RC[6]+RC[11]+RC[16]+RC[21]+RC[26]+RC[31]+RC[36]+RC[41]+RC[46]+RC[51]+RC[56]+RC[61]+RC[66]+RC[71]+RC[76]+RC[81]+RC[86]+RC[91]+RC[96]+RC[101]+RC[106]+RC[111]+RC[116]+RC[121]+RC[126]+RC[131]+RC[136]+RC[141]+RC[146]+RC[151]+RC[156]+RC[161]+RC[166]+RC[171]+RC[176]+RC[181]+RC[186]+RC[191]+RC[196]+RC[201]+RC[206]+RC[211]+RC[216]+RC[221]+RC[226]+RC[231]+RC[236]+RC[241]+Sheet2!RC+Sheet2!RC[5]+Sheet2!RC[10]+Sheet2!RC[15]+Sheet2!RC[20]+Sheet2!RC[25]+Sheet2!RC[30]+Sheet2!RC[35]+Sheet2!RC[40]+Sheet2!RC[45]+Sheet2!RC[50]+Sheet2!RC[55]+Sheet2!RC[60]+Sheet2!RC[65] -> 26305.388999999988 | D6: =RC[4]+RC[9]+RC[14]+RC[19]+RC[24]+RC[29]+RC[34]+RC[39]+RC[44]+RC[49]+RC[54]+RC[59]+RC[64]+RC[69]+RC[74]+RC[79]+RC[84]+RC[89]+RC[94]+RC[99]+RC[104]+RC[109]+RC[114]+RC[119]+RC[124]+RC[129]+RC[134]+RC[139]+RC[144]+RC[149]+RC[154]+RC[159]+RC[164]+RC[169]+RC[174]+RC[179]+RC[184]+RC[189]+RC[194]+RC[199]+RC[204]+RC[209]+RC[214]+RC[219]+RC[224]+RC[229]+RC[234]+RC[239]+Sheet2!RC[3]+Sheet2!RC[-2]+Sheet2!RC[8]+Sheet2!RC[13]+Sheet2!RC[18]+Sheet2!RC[23]+Sheet2!RC[28]+Sheet2!RC[33]+Sheet2!RC[38]+Sheet2!RC[43]+Sheet2!RC[48]+Sheet2!RC[53]+Sheet2!RC[58]+Sheet2!RC[63] -> 3747974 | E6: =RC[6]+RC[11]+RC[16]+RC[21]+RC[26]+RC[31]+RC[36]+RC[41]+RC[46]+RC[51]+RC[56]+RC[61]+RC[66]+RC[71]+RC[76]+RC[81]+RC[86]+RC[91]+RC[96]+RC[101]+RC[106]+RC[111]+RC[116]+RC[121]+RC[126]+RC[131]+RC[136]+RC[141]+RC[146]+RC[151]+RC[156]+RC[161]+RC[166]+RC[171]+RC[176]+RC[181]+RC[186]+RC[191]+RC[196]+RC[201]+RC[206]+RC[211]+RC[216]+RC[221]+RC[226]+RC[231]+RC[236]+RC[241]+Sheet2!RC+Sheet2!RC[5]+Sheet2!RC[10]+Sheet2!RC[15]+Sheet2!RC[20]+Sheet2!RC[25]+Sheet2!RC[30]+Sheet2!RC[35]+Sheet2!RC[40]+Sheet2!RC[45]+Sheet2!RC[50]+Sheet2!RC[55]+Sheet2!RC[60]+Sheet2!RC[65] -> 2613786.1754369992 | F6: =SUM(RC[-4]:RC[-1]) -> 6463216.7194369994 | G6: =Sheet1!RC[5]+Sheet1!RC[10]+Sheet1!RC[15]+Sheet1!RC[20]+Sheet1!RC[25]+Sheet1!RC[30]+Sheet1!RC[35]+Sheet1!RC[40]+Sheet1!RC[45]+Sheet1!RC[50]+Sheet1!RC[55]+Sheet1!RC[60]+Sheet1!RC[65]+Sheet1!RC[70]+Sheet1!RC[75]+Sheet1!RC[80]+Sheet1!RC[85]+Sheet1!RC[90]+Sheet1!RC[95]+Sheet1!RC[100]+Sheet1!RC[105]+Sheet1!RC[110]+Sheet1!RC[115]+Sheet1!RC[120]+Sheet1!RC[125]+Sheet1!RC[130]+Sheet1!RC[135]+Sheet1!RC[140]+Sheet1!RC[145]+Sheet1!RC[150]+Sheet1!RC[155]+Sheet1!RC[160]+Sheet1!RC[165]+Sheet1!RC[170]+Sheet1!RC[175]+Sheet1!RC[180]+Sheet1!RC[185]+Sheet1!RC[190]+Sheet1!RC[195]+Sheet1!RC[200]+Sheet1!RC[205]+Sheet1!RC[210]+Sheet1!RC[215]+Sheet1!RC[220]+Sheet1!RC[225]+Sheet1!RC[230]+Sheet1!RC[235]+Sheet1!RC[240]+Sheet2!RC[-1]+Sheet2!RC[4]+Sheet2!RC[9]+Sheet2!RC[14]+Sheet2!RC[19]+Sheet2!RC[24]+Sheet2!RC[29]+Sheet2!RC[34]+Sheet2!RC[39]+Sheet2!RC[44]+Sheet2!RC[49]+Sheet2!RC[54]+Sheet2!RC[59]+Sheet2!RC[64] -> 6463216.7194369985 | H6: 98075 | I6: 314.23 | J6: 64.599999999999994 | K6: 49957.060528845017 | L6: =SUM(RC[-4]:RC[-1]) -> 148410.89052884502 | M6: 14949 | N6: 200.27 | O6: 9.0350000000000001 | P6: 7435.002898673999 | Q6: =SUM(RC[-4]:RC[-1]) -> 22593.307898674 | R6: 106975 | S6: 0 | T6: 12.1 | U6: 73863.230255090035 | V6: =SUM(RC[-4]:RC[-1]) -> 180850.33025509003 | W6: 71473 | X6: 246.52 | Y6: 229.88 | Z6: 20547.377719007993 | AA6: =SUM(RC[-4]:RC[-1]) -> 92496.777719008009 | AB6: 23879 | AC6: 884.5 | AD6: 0.17899999999999999 | AE6: 20454.085265506008 | AF6: =SUM(RC[-4]:RC[-1]) -> 45217.764265506004 | AG6: 20576 | AH6: 0 | AI6: 0 | AJ6: 17666.878839434004 | AK6: =SUM(RC[-4]:RC[-1]) -> 38242.878839434008 | AL6: 43355 | AM6: 0 | AN6: 33.659999999999997 | AO6: 28246.230317195994 | AP6: =SUM(RC[-4]:RC[-1]) -> 71634.890317195997 | AQ6: 23871 | AR6: 422.47 | AS6: 0 | AT6: 12844.648928223 | AU6: =SUM(RC[-4]:RC[-1]) -> 37138.118928223004 | AV6: 14064 | AW6: 404.8 | AX6: 186.32 | AY6: 10599.307051482007 | AZ6: =SUM(RC[-4]:RC[-1]) -> 25254.427051482005 | BA6: 24361 | BB6: 265.11900000000003 | BC6: 120.46 | BD6: 13161.137853714004 | BE6: =SUM(RC[-4]:RC[-1]) -> 37907.716853714002 | BF6: 18231 | BG6: 171.66 | BH6: 4.03 | BI6: 10942.701004823999 | BJ6: =SUM(RC[-4]:RC[-1]) -> 29349.391004824 | BK6: 17165 | BL6: 57.22 | BM6: 65.959999999999994 | BN6: 7827.4624364849997 | BO6: =SUM(RC[-4]:RC[-1]) -> 25115.642436484999 | BP6: 15779 | BQ6: 448.7 | BR6: 0 | BS6: 11105.127653076002 | BT6: =SUM(RC[-4]:RC[-1]) -> 27332.827653076005 | BU6: 68701 | BV6: 835.4 | BW6: 0.74399999999999999 | BX6: 35472.473045756989 | BY6: =SUM(RC[-4]:RC[-1]) -> 105009.61704575698 | BZ6: 213501 | CA6: 5.71 | CB6: 239.62 | CC6: 133601.11614118997 | CD6: =SUM(RC[-4]:RC[-1]) -> 347347.44614118995 | CE6: 15073 | CF6: 837.32 | CG6: 32051 | CH6: 9681.0436295969994 | CI6: =SUM(RC[-4]:RC[-1]) -> 57642.363629596999 | CJ6: 13176 | CK6: 106.33 | CL6: 0 | CM6: 7755.3407197890028 | CN6: =SUM(RC[-4]:RC[-1]) -> 21037.670719789003 | CO6: 11885 | CP6: 95.83 | CQ6: 0 | CR6: 6175.7839297969995 | CS6: =SUM(RC[-4]:RC[-1]) -> 18156.613929797 | CT6: 29102 | CU6: 23.84 | CV6: 0 | CW6: 13396.631477625991 | CX6: =SUM(RC[-4]:RC[-1]) -> 42522.471477625993 | CY6: 20151 | CZ6: 406.2 | DA6: 0 | DB6: 5460.0975998740014 | DC6: =SUM(RC[-4]:RC[-1]) -> 26017.297599874 | DD6: 3801 | DE6: 7.15 | DF6: 0 | DG6: 1520.7583954270001 | DH6: =SUM(RC[-4]:RC[-1]) -> 5328.908395427 | DI6: 22637 | DJ6: 128.74 | DK6: 28.74 | DL6: 13796.073698164006 | DM6: =SUM(RC[-4]:RC[-1]) -> 36590.553698164011 | DN6: 36869 | DO6: 0 | DP6: 2231.06 | DQ6: 20000.653512029992 | DR6: =SUM(RC[-4]:RC[-1]) -> 59100.713512029994 | DS6: 165090 | DT6: 0 | DU6: 2094.4 | DV6: 127113.09800622796 | DW6: =SUM(RC[-4]:RC[-1]) -> 294297.49800622795 | DX6: 7433 | DY6: 11.92 | DZ6: 133 | EA6: 8238.0645469559968 | EB6: =SUM(RC[-4]:RC[-1]) -> 15815.984546955997 | EC6: 20676 | ED6: 0 | EE6: 155.947 | EF6: 12099.544641021996 | EG6: =SUM(RC[-4]:RC[-1]) -> 32931.491641021996 | EH6: 21397 | EI6: 13.81 | EJ6: 0 | EK6: 9684.7170565659926 | EL6: =SUM(RC[-4]:RC[-1]) -> 31095.527056565996 | EM6: 181697 | EN6: 0 | EO6: 14251.46 | EP6: 123986.60620673001 | EQ6: =SUM(RC[-4]:RC[-1]) -> 319935.06620672997 | ER6: 21996 | ES6: 0 | ET6: 159.47 | EU6: 10223.429313716 | EV6: =SUM(RC[-4]:RC[-1]) -> 32378.899313716 | EW6: 414291 | EX6: 0 | EY6: 823.29 | EZ6: 133104.95686310407 | FA6: =SUM(RC[-4]:RC[-1]) -> 548219.24686310405 | FB6: 134010 | FC6: 0 | FD6: 249.82 | FE6: 407885.27605578006 | FF6: =SUM(RC[-4]:RC[-1]) -> 542145.09605578007 | FG6: 40376 | FH6: 0 | FI6: 1802.37 | FJ6: 29978.057889569012 | FK6: =SUM(RC[-4]:RC[-1]) -> 72156.427889569022 | FL6: 65271 | FM6: 9.52 | FN6: 223.78 | FO6: 111166.29579287404 | FP6: =SUM(RC[-4]:RC[-1]) -> 176670.59579287402 | FQ6: 119736 | FR6: 0 | FS6: 105.52 | FT6: 66361.524249017995 | FU6: =SUM(RC[-4]:RC[-1]) -> 186203.04424901801 | FV6: 33215 | FW6: 251.2 | FX6: 21.23 | FY6: 21601.95971647001 | FZ6: =SUM(RC[-4]:RC[-1]) -> 55089.38971647001 | GA6: 94098 | GB6: 7781 | GC6: 237.3 | GD6: 51762.377341084015 | GE6: =SUM(RC[-4]:RC[-1]) -> 153878.67734108403 | GF6: 9181 | GG6: 2.38 | GH6: 0 | GI6: 7521.1473792760025 | GJ6: =SUM(RC[-4]:RC[-1]) -> 16704.527379276002 | GK6: 30080 | GL6: 0 | GM6: 280.81 | GN6: 14180.511005100005 | GO6: =SUM(RC[-4]:RC[-1]) -> 44541.321005100006 | GP6: 19395 | GQ6: 15.25 | GR6: 0 | GS6: 10844.132387370004 | GT6: =SUM(RC[-4]:RC[-1]) -> 30254.382387370002 | GU6: 34476 | GV6: 176.41 | GW6: 0 | GX6: 10076.74216586601 | GY6: =SUM(RC[-4]:RC[-1]) -> 44729.152165866013 | GZ6: 216492 | HA6: 0 | HB6: 2923 | HC6: 271253.70265790989 | HD6: =SUM(RC[-4]:RC[-1]) -> 490668.70265790989 | HE6: 40987 | HF6: 410 | HG6: 1558.05 | HH6: 17813.010237016009 | HI6: =SUM(RC[-4]:RC[-1]) -> 60768.060237016012 | HJ6: 67602 | HK6: 0 | HL6: 0 | HM6: 44598.545922901998 | HN6: =SUM(RC[-4]:RC[-1]) -> 112200.54592290201 | HO6: 73892 | HP6: 2634.51 | HQ6: 8.33 | HR6: 34755.595393493997 | HS6: =SUM(RC[-4]:RC[-1]) -> 111290.435393494 | HT6: 62034 | HU6: 484.94 | HV6: 4340.1499999999996 | HW6: 18552.302926343997 | HX6: =SUM(RC[-4]:RC[-1]) -> 85411.392926343993 | HY6: 33994 | HZ6: 11.92 | IA6: 2578.56 | IB6: 30230.161273452009 | IC6: =SUM(RC[-4]:RC[-1]) -> 66814.641273451998 | ID6: 10821 | IE6: 490.17 | IF6: 5.07 | IG6: 13911.649741755002 | IH6: =SUM(RC[-4]:RC[-1]) -> 25227.889741755003 | II6: 5185 | IJ6: 271.79000000000002 | IK6: 0 | IL6: 4368.8504816469986 | IM6: =SUM(RC[-4]:RC[-1]) -> 9825.6404816469985
A7: ACROLEIN | B7: =RC[8]+RC[13]+RC[18]+RC[23]+RC[28]+RC[33]+RC[38]+RC[43]+RC[48]+RC[53]+RC[58]+RC[63]+RC[68]+RC[73]+RC[78]+RC[83]+RC[88]+RC[93]+RC[98]+RC[103]+RC[108]+RC[113]+RC[118]+RC[123]+RC[128]+RC[133]+RC[138]+RC[143]+RC[148]+RC[153]+RC[158]+RC[163]+RC[168]+RC[173]+RC[178]+RC[183]+RC[188]+RC[193]+RC[198]+RC[203]+RC[208]+RC[213]+RC[218]+RC[223]+RC[228]+RC[233]+RC[238]+RC[243]+Sheet2!RC[2]+Sheet2!RC[7]+Sheet2!RC[12]+Sheet2!RC[17]+Sheet2!RC[22]+Sheet2!RC[27]+Sheet2!RC[32]+Sheet2!RC[37]+Sheet2!RC[42]+Sheet2!RC[47]+Sheet2!RC[57]+Sheet2!RC[52]+Sheet2!RC[62]+Sheet2!RC[67] -> 19719.480800000001 | C7: =RC[6]+RC[11]+RC[16]+RC[21]+RC[26]+RC[31]+RC[36]+RC[41]+RC[46]+RC[51]+RC[56]+RC[61]+RC[66]+RC[71]+RC[76]+RC[81]+RC[86]+RC[91]+RC[96]+RC[101]+RC[106]+RC[111]+RC[116]+RC[121]+RC[126]+RC[131]+RC[136]+RC[141]+RC[146]+RC[151]+RC[156]+RC[161]+RC[166]+RC[171]+RC[176]+RC[181]+RC[186]+RC[191]+RC[196]+RC[201]+RC[206]+RC[211]+RC[216]+RC[221]+RC[226]+RC[231]+RC[236]+RC[241]+Sheet2!RC+Sheet2!RC[5]+Sheet2!RC[10]+Sheet2!RC[15]+Sheet2!RC[20]+Sheet2!RC[25]+Sheet2!RC[30]+Sheet2!RC[35]+Sheet2!RC[40]+Sheet2!RC[45]+Sheet2!RC[50]+Sheet2!RC[55]+Sheet2!RC[60]+Sheet2!RC[65] -> 245220.919666 | D7: =RC[4]+RC[9]+RC[14]+RC[19]+RC[24]+RC[29]+RC[34]+RC[39]+RC[44]+RC[49]+RC[54]+RC[59]+RC[64]+RC[69]+RC[74]+RC[79]+RC[84]+RC[89]+RC[94]+RC[99]+RC[104]+RC[109]+RC[114]+RC[119]+RC[124]+RC[129]+RC[134]+RC[139]+RC[144]+RC[149]+RC[154]+RC[159]+RC[164]+RC[169]+RC[174]+RC[179]+RC[184]+RC[189]+RC[194]+RC[199]+RC[204]+RC[209]+RC[214]+RC[219]+RC[224]+RC[229]+RC[234]+RC[239]+Sheet2!RC[3]+Sheet2!RC[-2]+Sheet2!RC[8]+Sheet2!RC[13]+Sheet2!RC[18]+Sheet2!RC[23]+Sheet2!RC[28]+Sheet2!RC[33]+Sheet2!RC[38]+Sheet2!RC[43]+Sheet2!RC[48]+Sheet2!RC[53]+Sheet2!RC[58]+Sheet2!RC[63] -> 451628 | E7: =RC[6]+RC[11]+RC[16]+RC[21]+RC[26]+RC[31]+RC[36]+RC[41]+RC[46]+RC[51]+RC[56]+RC[61]+RC[66]+RC[71]+RC[76]+RC[81]+RC[86]+RC[91]+RC[96]+RC[101]+RC[106]+RC[111]+RC[116]+RC[121]+RC[126]+RC[131]+RC[136]+RC[141]+RC[146]+RC[151]+RC[156]+RC[161]+RC[166]+RC[171]+RC[176]+RC[181]+RC[186]+RC[191]+RC[196]+RC[201]+RC[206]+RC[211]+RC[216]+RC[221]+RC[226]+RC[231]+RC[236]+RC[241]+Sheet2!RC+Sheet2!RC[5]+Sheet2!RC[10]+Sheet2!RC[15]+Sheet2!RC[20]+Sheet2!RC[25]+Sheet2!RC[30]+Sheet2!RC[35]+Sheet2!RC[40]+Sheet2!RC[45]+Sheet2!RC[50]+Sheet2!RC[55]+Sheet2!RC[60]+Sheet2!RC[65] -> 103720.53347524971 | F7: =SUM(RC[-4]:RC[-1]) -> 820288.93394124974 | G7: =Sheet1!RC[5]+Sheet1!RC[10]+Sheet1!RC[15]+Sheet1!RC[20]+Sheet1!RC[25]+Sheet1!RC[30]+Sheet1!RC[35]+Sheet1!RC[40]+Sheet1!RC[45]+Sheet1!RC[50]+Sheet1!RC[55]+Sheet1!RC[60]+Sheet1!RC[65]+Sheet1!RC[70]+Sheet1!RC[75]+Sheet1!RC[80]+Sheet1!RC[85]+Sheet1!RC[90]+Sheet1!RC[95]+Sheet1!RC[100]+Sheet1!RC[105]+Sheet1!RC[110]+Sheet1!RC[115]+Sheet1!RC[120]+Sheet1!RC[125]+Sheet1!RC[130]+Sheet1!RC[135]+Sheet1!RC[140]+Sheet1!RC[145]+Sheet1!RC[150]+Sheet1!RC[155]+Sheet1!RC[160]+Sheet1!RC[165]+Sheet1!RC[170]+Sheet1!RC[175]+Sheet1!RC[180]+Sheet1!RC[185]+Sheet1!RC[190]+Sheet1!RC[195]+Sheet1!RC[200]+Sheet1!RC[205]+Sheet1!RC[210]+Sheet1!RC[215]+Sheet1!RC[220]+Sheet1!RC[225]+Sheet1!RC[230]+Sheet1!RC[235]+Sheet1!RC[240]+Sheet2!RC[-1]+Sheet2!RC[4]+Sheet2!RC[9]+Sheet2!RC[14]+Sheet2!RC[19]+Sheet2!RC[24]+Sheet2!RC[29]+Sheet2!RC[34]+Sheet2!RC[39]+Sheet2!RC[44]+Sheet2!RC[49]+Sheet2!RC[54]+Sheet2!RC[59]+Sheet2!RC[64] -> 820288.93394124974 | H7: 12402 | I7: 3242.46 | J7: 62.4 | K7: 1178.7702279276007 | L7: =SUM(RC[-4]:RC[-1]) -> 16885.630227927599 | M7: 1728 | N7: 568 | O7: 0 | P7: 235.19939292199987 | Q7: =SUM(RC[-4]:RC[-1]) -> 2531.1993929219998 | R7: 12989 | S7: 23993.259765999999 | T7: 0 | U7: 891.32733593100011 | V7: =SUM(RC[-4]:RC[-1]) -> 37873.587101931 | W7: 8320 | X7: 1539.1 | Y7: 1.82 | Z7: 913.33194543939976 | AA7: =SUM(RC[-4]:RC[-1]) -> 10774.251945439401 | AB7: 2895 | AC7: 1557.65 | AD7: 0 | AE7: 969.11943878750014 | AF7: =SUM(RC[-4]:RC[-1]) -> 5421.7694387874999 | AG7: 2565 | AH7: 765.78 | AI7: 0 | AJ7: 273.06909593710014 | AK7: =SUM(RC[-4]:RC[-1]) -> 3603.8490959370997 | AL7: 4933 | AM7: 1404.8 | AN7: 29.09 | AO7: 867.77823009940028 | AP7: =SUM(RC[-4]:RC[-1]) -> 7234.6682300994007 | AQ7: 3006 | AR7: 1387 | AS7: 0 | AT7: 479.92574882420001 | AU7: =SUM(RC[-4]:RC[-1]) -> 4872.9257488242001 | AV7: 1686 | AW7: 724.74 | AX7: 180.31 | AY7: 303.95168451319984 | AZ7: =SUM(RC[-4]:RC[-1]) -> 2895.0016845131995 | BA7: 2856 | BB7: 924.49 | BC7: 115.92 | BD7: 418.26391278260002 | BE7: =SUM(RC[-4]:RC[-1]) -> 4314.6739127825995 | BF7: 2290 | BG7: 715.85 | BH7: 0.9 | BI7: 333.76489447880004 | BJ7: =SUM(RC[-4]:RC[-1]) -> 3340.5148944788002 | BK7: 2070 | BL7: 160.84 | BM7: 61.7 | BN7: 277.93801760079998 | BO7: =SUM(RC[-4]:RC[-1]) -> 2570.4780176007998 | BP7: 1890 | BQ7: 932.58 | BR7: 0 | BS7: 398.1618212679 | BT7: =SUM(RC[-4]:RC[-1]) -> 3220.7418212678999 | BU7: 8484 | BV7: 2789.72 | BW7: 0.72 | BX7: 1093.8316557797004 | BY7: =SUM(RC[-4]:RC[-1]) -> 12368.271655779699 | BZ7: 26055 | CA7: 10361.94 | CB7: 339.91 | CC7: 6637.5117977329965 | CD7: =SUM(RC[-4]:RC[-1]) -> 43394.361797733 | CE7: 1707 | CF7: 1249.97 | CG7: 387 | CH7: 604.74018088880007 | CI7: =SUM(RC[-4]:RC[-1]) -> 3948.7101808888001 | CJ7: 1643 | CK7: 1003.01 | CL7: 0 | CM7: 292.45507386719999 | CN7: =SUM(RC[-4]:RC[-1]) -> 2938.4650738672003 | CO7: 1487 | CP7: 490.04 | CQ7: 0 | CR7: 223.32757573899997 | CS7: =SUM(RC[-4]:RC[-1]) -> 2200.3675757390001 | CT7: 3442 | CU7: 465.98 | CV7: 0 | CW7: 211.64663415620007 | CX7: =SUM(RC[-4]:RC[-1]) -> 4119.6266341562005 | CY7: 456 | CZ7: 959.5 | DA7: 39.53 | DB7: 203.34242263040011 | DC7: =SUM(RC[-4]:RC[-1]) -> 1658.3724226304 | DD7: 456 | DE7: 63.1999 | DF7: 0 | DG7: 84.147239510500057 | DH7: =SUM(RC[-4]:RC[-1]) -> 603.34713951050003 | DI7: 2721 | DJ7: 600.28 | DK7: 1E-3 | DL7: 361.84660625449993 | DM7: =SUM(RC[-4]:RC[-1]) -> 3683.1276062544998 | DN7: 4292 | DO7: 1288.1600000000001 | DP7: 49.06 | DQ7: 358.77519635249996 | DR7: =SUM(RC[-4]:RC[-1]) -> 5987.9951963525 | DS7: 20194 | DT7: 45577.57 | DU7: 13.15 | DV7: 2556.9852385059994 | DW7: =SUM(RC[-4]:RC[-1]) -> 68341.705238505994 | DX7: 918 | DY7: 331.88 | DZ7: 0 | EA7: 202.60138495819999 | EB7: =SUM(RC[-4]:RC[-1]) -> 1452.4813849582001 | EC7: 2438 | ED7: 166.57 | EE7: 150.07 | EF7: 223.6945162210001 | EG7: =SUM(RC[-4]:RC[-1]) -> 2978.3345162210003 | EH7: 2532 | EI7: 607.71 | EJ7: 0 | EK7: 157.92861388449992 | EL7: =SUM(RC[-4]:RC[-1]) -> 3297.6386138845 | EM7: 23964 | EN7: 5345.3 | EO7: 1160.8399999999999 | EP7: 3040.8435448209989 | EQ7: =SUM(RC[-4]:RC[-1]) -> 33510.983544821 | ER7: 2520 | ES7: 152.1 | ET7: 154.33000000000001 | EU7: 143.50851675889999 | EV7: =SUM(RC[-4]:RC[-1]) -> 2969.9385167588998 | EW7: 50731 | EX7: 2900.88 | EY7: 766.71 | EZ7: 5389.2601835934975 | FA7: =SUM(RC[-4]:RC[-1]) -> 59787.850183593495 | FB7: 16266 | FC7: 31179.58 | FD7: 0 | FE7: 5547.9614230899997 | FF7: =SUM(RC[-4]:RC[-1]) -> 52993.541423089999 | FG7: 5068 | FH7: 1673.58 | FI7: 1712.39 | FJ7: 797.67612565119998 | FK7: =SUM(RC[-4]:RC[-1]) -> 9251.6461256511993 | FL7: 7987 | FM7: 2104.4 | FN7: 56.14 | FO7: 814.13876215280015 | FP7: =SUM(RC[-4]:RC[-1]) -> 10961.678762152798 | FQ7: 15100 | FR7: 5375.7 | FS7: 97.13 | FT7: 3888.739570459401 | FU7: =SUM(RC[-4]:RC[-1]) -> 24461.569570459404 | FV7: 4045 | FW7: 859.4 | FX7: 7.37 | FY7: 405.68551129230002 | FZ7: =SUM(RC[-4]:RC[-1]) -> 5317.4555112922999 | GA7: 11111 | GB7: 10495.2 | GC7: 216.17 | GD7: 1246.3831981369997 | GE7: =SUM(RC[-4]:RC[-1]) -> 23068.753198136998 | GF7: 1151 | GG7: 605.97 | GH7: 0 | GI7: 110.85418347339998 | GJ7: =SUM(RC[-4]:RC[-1]) -> 1867.8241834733999 | GK7: 3672 | GL7: 791.1 | GM7: 196.5 | GN7: 420.78345949279981 | GO7: =SUM(RC[-4]:RC[-1]) -> 5080.3834594928003 | GP7: 2213 | GQ7: 401.26 | GR7: 0 | GS7: 320.59167522000001 | GT7: =SUM(RC[-4]:RC[-1]) -> 2934.8516752200003 | GU7: 4087 | GV7: 441.87 | GW7: 0 | GX7: 366.89348923380004 | GY7: =SUM(RC[-4]:RC[-1]) -> 4895.7634892338001 | GZ7: 26134 | HA7: 40196.6 | HB7: 56 | HC7: 39301.318442249991 | HD7: =SUM(RC[-4]:RC[-1]) -> 105687.91844225 | HE7: 5163 | HF7: 2363.1999999999998 | HG7: 6005.5 | HH7: 449.73621622560012 | HI7: =SUM(RC[-4]:RC[-1]) -> 13981.4362162256 | HJ7: 8099 | HK7: 8302 | HL7: 148.63 | HM7: 896.19127949819972 | HN7: =SUM(RC[-4]:RC[-1]) -> 17445.821279498199 | HO7: 8290 | HP7: 3547.58 | HQ7: 0.53 | HR7: 1125.9025004375999 | HS7: =SUM(RC[-4]:RC[-1]) -> 12964.0125004376 | HT7: 7815 | HU7: 1523.04 | HV7: 214.86 | HW7: 425.4672497392001 | HX7: =SUM(RC[-4]:RC[-1]) -> 9978.3672497392017 | HY7: 4237 | HZ7: 382.58 | IA7: 2498.54 | IB7: 700.90848256449954 | IC7: =SUM(RC[-4]:RC[-1]) -> 7819.0284825644994 | ID7: 1261 | IE7: 691.66 | IF7: 0 | IG7: 518.56026996880018 | IH7: =SUM(RC[-4]:RC[-1]) -> 2471.2202699688 | II7: 596 | IJ7: 474.99 | IK7: 0 | IL7: 69.808834700200023 | IM7: =SUM(RC[-4]:RC[-1]) -> 1140.7988347002001
A8: ACRYLAMIDE | B8: =RC[8]+RC[13]+RC[18]+RC[23]+RC[28]+RC[33]+RC[38]+RC[43]+RC[48]+RC[53]+RC[58]+RC[63]+RC[68]+RC[73]+RC[78]+RC[83]+RC[88]+RC[93]+RC[98]+RC[103]+RC[108]+RC[113]+RC[118]+RC[123]+RC[128]+RC[133]+RC[138]+RC[143]+RC[148]+RC[153]+RC[158]+RC[163]+RC[168]+RC[173]+RC[178]+RC[183]+RC[188]+RC[193]+RC[198]+RC[203]+RC[208]+RC[213]+RC[218]+RC[223]+RC[228]+RC[233]+RC[238]+RC[243]+Sheet2!RC[2]+Sheet2!RC[7]+Sheet2!RC[12]+Sheet2!RC[17]+Sheet2!RC[22]+Sheet2!RC[27]+Sheet2!RC[32]+Sheet2!RC[37]+Sheet2!RC[42]+Sheet2!RC[47]+Sheet2!RC[57]+Sheet2!RC[52]+Sheet2!RC[62]+Sheet2!RC[67] -> 0 | C8: =RC[6]+RC[11]+RC[16]+RC[21]+RC[26]+RC[31]+RC[36]+RC[41]+RC[46]+RC[51]+RC[56]+RC[61]+RC[66]+RC[71]+RC[76]+RC[81]+RC[86]+RC[91]+RC[96]+RC[101]+RC[106]+RC[111]+RC[116]+RC[121]+RC[126]+RC[131]+RC[136]+RC[141]+RC[146]+RC[151]+RC[156]+RC[161]+RC[166]+RC[171]+RC[176]+RC[181]+RC[186]+RC[191]+RC[196]+RC[201]+RC[206]+RC[211]+RC[216]+RC[221]+RC[226]+RC[231]+RC[236]+RC[241]+Sheet2!RC+Sheet2!RC[5]+Sheet2!RC[10]+Sheet2!RC[15]+Sheet2!RC[20]+Sheet2!RC[25]+Sheet2!RC[30]+Sheet2!RC[35]+Sheet2!RC[40]+Sheet2!RC[45]+Sheet2!RC[50]+Sheet2!RC[55]+Sheet2!RC[60]+Sheet2!RC[65] -> 0 | D8: =RC[4]+RC[9]+RC[14]+RC[19]+RC[24]+RC[29]+RC[34]+RC[39]+RC[44]+RC[49]+RC[54]+RC[59]+RC[64]+RC[69]+RC[74]+RC[79]+RC[84]+RC[89]+RC[94]+RC[99]+RC[104]+RC[109]+RC[114]+RC[119]+RC[124]+RC[129]+RC[134]+RC[139]+RC[144]+RC[149]+RC[154]+RC[159]+RC[164]+RC[169]+RC[174]+RC[179]+RC[184]+RC[189]+RC[194]+RC[199]+RC[204]+RC[209]+RC[214]+RC[219]+RC[224]+RC[229]+RC[234]+RC[239]+Sheet2!RC[3]+Sheet2!RC[-2]+Sheet2!RC[8]+Sheet2!RC[13]+Sheet2!RC[18]+Sheet2!RC[23]+Sheet2!RC[28]+Sheet2!RC[33]+Sheet2!RC[38]+Sheet2!RC[43]+Sheet2!RC[48]+Sheet2!RC[53]+Sheet2!RC[58]+Sheet2!RC[63] -> 0 | E8: =RC[6]+RC[11]+RC[16]+RC[21]+RC[26]+RC[31]+RC[36]+RC[41]+RC[46]+RC[51]+RC[56]+RC[61]+RC[66]+RC[71]+RC[76]+RC[81]+RC[86]+RC[91]+RC[96]+RC[101]+RC[106]+RC[111]+RC[116]+RC[121]+RC[126]+RC[131]+RC[136]+RC[141]+RC[146]+RC[151]+RC[156]+RC[161]+RC[166]+RC[171]+RC[176]+RC[181]+RC[186]+RC[191]+RC[196]+RC[201]+RC[206]+RC[211]+RC[216]+RC[221]+RC[226]+RC[231]+RC[236]+RC[241]+Sheet2!RC+Sheet2!RC[5]+Sheet2!RC[10]+Sheet2!RC[15]+Sheet2!RC[20]+Sheet2!RC[25]+Sheet2!RC[30]+Sheet2!RC[35]+Sheet2!RC[40]+Sheet2!RC[45]+Sheet2!RC[50]+Sheet2!RC[55]+Sheet2!RC[60]+Sheet2!RC[65] -> 0 | F8: =SUM(RC[-4]:RC[-1]) -> 0 | G8: =Sheet1!RC[5]+Sheet1!RC[10]+Sheet1!RC[15]+Sheet1!RC[20]+Sheet1!RC[25]+Sheet1!RC[30]+Sheet1!RC[35]+Sheet1!RC[40]+Sheet1!RC[45]+Sheet1!RC[50]+Sheet1!RC[55]+Sheet1!RC[60]+Sheet1!RC[65]+Sheet1!RC[70]+Sheet1!RC[75]+Sheet1!RC[80]+Sheet1!RC[85]+Sheet1!RC[90]+Sheet1!RC[95]+Sheet1!RC[100]+Sheet1!RC[105]+Sheet1!RC[110]+Sheet1!RC[115]+Sheet1!RC[120]+Sheet1!RC[125]+Sheet1!RC[130]+Sheet1!RC[135]+Sheet1!RC[140]+Sheet1!RC[145]+Sheet1!RC[150]+Sheet1!RC[155]+Sheet1!RC[160]+Sheet1!RC[165]+Sheet1!RC[170]+Sheet1!RC[175]+Sheet1!RC[180]+Sheet1!RC[185]+Sheet1!RC[190]+Sheet1!RC[195]+Sheet1!RC[200]+Sheet1!RC[205]+Sheet1!RC[210]+Sheet1!RC[215]+Sheet1!RC[220]+Sheet1!RC[225]+Sheet1!RC[230]+Sheet1!RC[235]+Sheet1!RC[240]+Sheet2!RC[-1]+Sheet2!RC[4]+Sheet2!RC[9]+Sheet2!RC[14]+Sheet2!RC[19]+Sheet2!RC[24]+Sheet2!RC[29]+Sheet2!RC[34]+Sheet2!RC[39]+Sheet2!RC[44]+Sheet2!RC[49]+Sheet2!RC[54]+Sheet2!RC[59]+Sheet2!RC[64] -> 0 | H8: 0 | I8: 0 | J8: 0 | K8: 0 | L8: =SUM(RC[-4]:RC[-1]) -> 0 | M8: 0 | N8: 0 | O8: 0 | P8: 0 | Q8: =SUM(RC[-4]:RC[-1]) -> 0 | R8: 0 | S8: 0 | T8: 0 | U8: 0 | V8: =SUM(RC[-4]:RC[-1]) -> 0 | W8: 0 | X8: 0 | Y8: 0 | Z8: 0 | AA8: =SUM(RC[-4]:RC[-1]) -> 0 | AB8: 0 | AC8: 0 | AD8: 0 | AE8: 0 | AF8: =SUM(RC[-4]:RC[-1]) -> 0 | AG8: 0 | AH8: 0 | AI8: 0 | AJ8: 0 | AK8: =SUM(RC[-4]:RC[-1]) -> 0 | AL8: 0 | AM8: 0 | AN8: 0 | AO8: 0 | AP8: =SUM(RC[-4]:RC[-1]) -> 0 | AQ8: 0 | AR8: 0 | AS8: 0 | AT8: 0 | AU8: =SUM(RC[-4]:RC[-1]) -> 0 | AV8: 0 | AW8: 0 | AX8: 0 | AY8: 0 | AZ8: =SUM(RC[-4]:RC[-1]) -> 0 | BA8: 0 | BB8: 0 | BC8: 0 | BD8: 0 | BE8: =SUM(RC[-4]:RC[-1]) -> 0 | BF8: 0 | BG8: 0 | BH8: 0 | BI8: 0 | BJ8: =SUM(RC[-4]:RC[-1]) -> 0 | BK8: 0 | BL8: 0 | BM8: 0 | BN8: 0 | BO8: =SUM(RC[-4]:RC[-1]) -> 0 | BP8: 0 | BQ8: 0 | BR8: 0 | BS8: 0 | BT8: =SUM(RC[-4]:RC[-1]) -> 0 | BU8: 0 | BV8: 0 | BW8: 0 | BX8: 0 | BY8: =SUM(RC[-4]:RC[-1]) -> 0 | BZ8: 0 | CA8: 0 | CB8: 0 | CC8: 0 | CD8: =SUM(RC[-4]:RC[-1]) -> 0 | CE8: 0 | CF8: 0 | CG8: 0 | CH8: 0 | CI8: =SUM(RC[-4]:RC[-1]) -> 0 | CJ8: 0 | CK8: 0 | CL8: 0 | CM8: 0 | CN8: =SUM(RC[-4]:RC[-1]) -> 0 | CO8: 0 | CP8: 0 | CQ8: 0 | CR8: 0 | CS8: =SUM(RC[-4]:RC[-1]) -> 0 | CT8: 0 | CU8: 0 | CV8: 0 | CW8: 0 | CX8: =SUM(RC[-4]:RC[-1]) -> 0 | CY8: 0 | CZ8: 0 | DA8: 0 | DB8: 0 | DC8: =SUM(RC[-4]:RC[-1]) -> 0 | DD8: 0 | DE8: 0 | DF8: 0 | DG8: 0 | DH8: =SUM(RC[-4]:RC[-1]) -> 0 | DI8: 0 | DJ8: 0 | DK8: 0 | DL8: 0 | DM8: =SUM(RC[-4]:RC[-1]) -> 0 | DN8: 0 | DO8: 0 | DP8: 0 | DQ8: 0 | DR8: =SUM(RC[-4]:RC[-1]) -> 0 | DS8: 0 | DT8: 0 | DU8: 0 | DV8: 0 | DW8: =SUM(RC[-4]:RC[-1]) -> 0 | DX8: 0 | DY8: 0 | DZ8: 0 | EA8: 0 | EB8: =SUM(RC[-4]:RC[-1]) -> 0 | EC8: 0 | ED8: 0 | EE8: 0 | EF8: 0 | EG8: =SUM(RC[-4]:RC[-1]) -> 0 | EH8: 0 | EI8: 0 | EJ8: 0 | EK8: 0 | EL8: =SUM(RC[-4]:RC[-1]) -> 0 | EM8: 0 | EN8: 0 | EO8: 0 | EP8: 0 | EQ8: =SUM(RC[-4]:RC[-1]) -> 0 | ER8: 0 | ES8: 0 | ET8: 0 | EU8: 0 | EV8: =SUM(RC[-4]:RC[-1]) -> 0 | EW8: 0 | EX8: 0 | EY8: 0 | EZ8: 0 | FA8: =SUM(RC[-4]:RC[-1]) -> 0 | FB8: 0 | FC8: 0 | FD8: 0 | FE8: 0 | FF8: =SUM(RC[-4]:RC[-1]) -> 0 | FG8: 0 | FH8: 0 | FI8: 0 | FJ8: 0 | FK8: =SUM(RC[-4]:RC[-1]) -> 0 | FL8: 0 | FM8: 0 | FN8: 0 | FO8: 0 | FP8: =SUM(RC[-4]:RC[-1]) -> 0 | FQ8: 0 | FR8: 0 | FS8: 0 | FT8: 0 | FU8: =SUM(RC[-4]:RC[-1]) -> 0 | FV8: 0 | FW8: 0 | FX8: 0 | FY8: 0 | FZ8: =SUM(RC[-4]:RC[-1]) -> 0 | GA8: 0 | GB8: 0 | GC8: 0 | GD8: 0 | GE8: =SUM(RC[-4]:RC[-1]) -> 0 | GF8: 0 | GG8: 0 | GH8: 0 | GI8: 0 | GJ8: =SUM(RC[-4]:RC[-1]) -> 0 | GK8: 0 | GL8: 0 | GM8: 0 | GN8: 0 | GO8: =SUM(RC[-4]:RC[-1]) -> 0 | GP8: 0 | GQ8: 0 | GR8: 0 | GS8: 0 | GT8: =SUM(RC[-4]:RC[-1]) -> 0 | GU8: 0 | GV8: 0 | GW8: 0 | GX8: 0 | GY8: =SUM(RC[-4]:RC[-1]) -> 0 | GZ8: 0 | HA8: 0 | HB8: 0 | HC8: 0 | HD8: =SUM(RC[-4]:RC[-1]) -> 0 | HE8: 0 | HF8: 0 | HG8: 0 | HH8: 0 | HI8: =SUM(RC[-4]:RC[-1]) -> 0 | HJ8: 0 | HK8: 0 | HL8: 0 | HM8: 0 | HN8: =SUM(RC[-4]:RC[-1]) -> 0 | HO8: 0 | HP8: 0 | HQ8: 0 | HR8: 0 | HS8: =SUM(RC[-4]:RC[-1]) -> 0 | HT8: 0 | HU8: 0 | HV8: 0 | HW8: 0 | HX8: =SUM(RC[-4]:RC[-1]) -> 0 | HY8: 0 | HZ8: 0 | IA8: 0 | IB8: 0 | IC8: =SUM(RC[-4]:RC[-1]) -> 0 | ID8: 0 | IE8: 0 | IF8: 0 | IG8: 0 | IH8: =SUM(RC[-4]:RC[-1]) -> 0 | II8: 0 | IJ8: 0 | IK8: 0 | IL8: 0 | IM8: =SUM(RC[-4]:RC[-1]) -> 0
A9: ACRYLONITRIL | B9: =RC[8]+RC[13]+RC[18]+RC[23]+RC[28]+RC[33]+RC[38]+RC[43]+RC[48]+RC[53]+RC[58]+RC[63]+RC[68]+RC[73]+RC[78]+RC[83]+RC[88]+RC[93]+RC[98]+RC[103]+RC[108]+RC[113]+RC[118]+RC[123]+RC[128]+RC[133]+RC[138]+RC[143]+RC[148]+RC[153]+RC[158]+RC[163]+RC[168]+RC[173]+RC[178]+RC[183]+RC[188]+RC[193]+RC[198]+RC[203]+RC[208]+RC[213]+RC[218]+RC[223]+RC[228]+RC[233]+RC[238]+RC[243]+Sheet2!RC[2]+Sheet2!RC[7]+Sheet2!RC[12]+Sheet2!RC[17]+Sheet2!RC[22]+Sheet2!RC[27]+Sheet2!RC[32]+Sheet2!RC[37]+Sheet2!RC[42]+Sheet2!RC[47]+Sheet2!RC[57]+Sheet2!RC[52]+Sheet2!RC[62]+Sheet2!RC[67] -> 10084.894 | C9: =RC[6]+RC[11]+RC[16]+RC[21]+RC[26]+RC[31]+RC[36]+RC[41]+RC[46]+RC[51]+RC[56]+RC[61]+RC[66]+RC[71]+RC[76]+RC[81]+RC[86]+RC[91]+RC[96]+RC[101]+RC[106]+RC[111]+RC[116]+RC[121]+RC[126]+RC[131]+RC[136]+RC[141]+RC[146]+RC[151]+RC[156]+RC[161]+RC[166]+RC[171]+RC[176]+RC[181]+RC[186]+RC[191]+RC[196]+RC[201]+RC[206]+RC[211]+RC[216]+RC[221]+RC[226]+RC[231]+RC[236]+RC[241]+Sheet2!RC+Sheet2!RC[5]+Sheet2!RC[10]+Sheet2!RC[15]+Sheet2!RC[20]+Sheet2!RC[25]+Sheet2!RC[30]+Sheet2!RC[35]+Sheet2!RC[40]+Sheet2!RC[45]+Sheet2!RC[50]+Sheet2!RC[55]+Sheet2!RC[60]+Sheet2!RC[65] -> 21955.40990000001 | D9: =RC[4]+RC[9]+RC[14]+RC[19]+RC[24]+RC[29]+RC[34]+RC[39]+RC[44]+RC[49]+RC[54]+RC[59]+RC[64]+RC[69]+RC[74]+RC[79]+RC[84]+RC[89]+RC[94]+RC[99]+RC[104]+RC[109]+RC[114]+RC[119]+RC[124]+RC[129]+RC[134]+RC[139]+RC[144]+RC[149]+RC[154]+RC[159]+RC[164]+RC[169]+RC[174]+RC[179]+RC[184]+RC[189]+RC[194]+RC[199]+RC[204]+RC[209]+RC[214]+RC[219]+RC[224]+RC[229]+RC[234]+RC[239]+Sheet2!RC[3]+Sheet2!RC[-2]+Sheet2!RC[8]+Sheet2!RC[13]+Sheet2!RC[18]+Sheet2!RC[23]+Sheet2!RC[28]+Sheet2!RC[33]+Sheet2!RC[38]+Sheet2!RC[43]+Sheet2!RC[48]+Sheet2!RC[53]+Sheet2!RC[58]+Sheet2!RC[63] -> 0 | E9: =RC[6]+RC[11]+RC[16]+RC[21]+RC[26]+RC[31]+RC[36]+RC[41]+RC[46]+RC[51]+RC[56]+RC[61]+RC[66]+RC[71]+RC[76]+RC[81]+RC[86]+RC[91]+RC[96]+RC[101]+RC[106]+RC[111]+RC[116]+RC[121]+RC[126]+RC[131]+RC[136]+RC[141]+RC[146]+RC[151]+RC[156]+RC[161]+RC[166]+RC[171]+RC[176]+RC[181]+RC[186]+RC[191]+RC[196]+RC[201]+RC[206]+RC[211]+RC[216]+RC[221]+RC[226]+RC[231]+RC[236]+RC[241]+Sheet2!RC+Sheet2!RC[5]+Sheet2!RC[10]+Sheet2!RC[15]+Sheet2!RC[20]+Sheet2!RC[25]+Sheet2!RC[30]+Sheet2!RC[35]+Sheet2!RC[40]+Sheet2!RC[45]+Sheet2!RC[50]+Sheet2!RC[55]+Sheet2!RC[60]+Sheet2!RC[65] -> 0 | F9: =SUM(RC[-4]:RC[-1]) -> 32040.30390000001 | G9: =Sheet1!RC[5]+Sheet1!RC[10]+Sheet1!RC[15]+Sheet1!RC[20]+Sheet1!RC[25]+Sheet1!RC[30]+Sheet1!RC[35]+Sheet1!RC[40]+Sheet1!RC[45]+Sheet1!RC[50]+Sheet1!RC[55]+Sheet1!RC[60]+Sheet1!RC[65]+Sheet1!RC[70]+Sheet1!RC[75]+Sheet1!RC[80]+Sheet1!RC[85]+Sheet1!RC[90]+Sheet1!RC[95]+Sheet1!RC[100]+Sheet1!RC[105]+Sheet1!RC[110]+Sheet1!RC[115]+Sheet1!RC[120]+Sheet1!RC[125]+Sheet1!RC[130]+Sheet1!RC[135]+Sheet1!RC[140]+Sheet1!RC[145]+Sheet1!RC[150]+Sheet1!RC[155]+Sheet1!RC[160]+Sheet1!RC[165]+Sheet1!RC[170]+Sheet1!RC[175]+Sheet1!RC[180]+Sheet1!RC[185]+Sheet1!RC[190]+Sheet1!RC[195]+Sheet1!RC[200]+Sheet1!RC[205]+Sheet1!RC[210]+Sheet1!RC[215]+Sheet1!RC[220]+Sheet1!RC[225]+Sheet1!RC[230]+Sheet1!RC[235]+Sheet1!RC[240]+Sheet2!RC[-1]+Sheet2!RC[4]+Sheet2!RC[9]+Sheet2!RC[14]+Sheet2!RC[19]+Sheet2!RC[24]+Sheet2!RC[29]+Sheet2!RC[34]+Sheet2!RC[39]+Sheet2!RC[44]+Sheet2!RC[49]+Sheet2!RC[54]+Sheet2!RC[59]+Sheet2!RC[64] -> 32040.303899999999 | H9: 0 | I9: 0 | J9: 299.45 | K9: 0 | L9: =SUM(RC[-4]:RC[-1]) -> 299.45 | M9: 0 | N9: 62.83 | O9: 0 | P9: 0 | Q9: =SUM(RC[-4]:RC[-1]) -> 62.83 | R9: 0 | S9: 0 | T9: 0 | U9: 0 | V9: =SUM(RC[-4]:RC[-1]) -> 0 | W9: 0 | X9: 242.69 | Y9: 0.98 | Z9: 0 | AA9: =SUM(RC[-4]:RC[-1]) -> 243.67 | AB9: 0 | AC9: 105 | AD9: 0 | AE9: 0 | AF9: =SUM(RC[-4]:RC[-1]) -> 105 | AG9: 0 | AH9: 101.55 | AI9: 0 | AJ9: 0 | AK9: =SUM(RC[-4]:RC[-1]) -> 101.55 | AL9: 0 | AM9: 170.83 | AN9: 15.57 | AO9: 0 | AP9: =SUM(RC[-4]:RC[-1]) -> 186.4 | AQ9: 0 | AR9: 114.02 | AS9: 135.44 | AT9: 0 | AU9: =SUM(RC[-4]:RC[-1]) -> 249.45999999999998 | AV9: 0 | AW9: 63.02 | AX9: 91.16 | AY9: 0 | AZ9: =SUM(RC[-4]:RC[-1]) -> 154.18 | BA9: 0 | BB9: 99.08 | BC9: 61.52 | BD9: 0 | BE9: =SUM(RC[-4]:RC[-1]) -> 160.6 | BF9: 0 | BG9: 78.308999999999997 | BH9: 0.48 | BI9: 0 | BJ9: =SUM(RC[-4]:RC[-1]) -> 78.789000000000001 | BK9: 0 | BL9: 59.66 | BM9: 32.9 | BN9: 0 | BO9: =SUM(RC[-4]:RC[-1]) -> 92.56 | BP9: 0 | BQ9: 57.61 | BR9: 0 | BS9: 0 | BT9: =SUM(RC[-4]:RC[-1]) -> 57.61 | BU9: 0 | BV9: 33.42 | BW9: 0.38 | BX9: 0 | BY9: =SUM(RC[-4]:RC[-1]) -> 33.800000000000004 | BZ9: 0 | CA9: 1150.9899 | CB9: 2005.07 | CC9: 0 | CD9: =SUM(RC[-4]:RC[-1]) -> 3156.0599000000002 | CE9: 0 | CF9: 46.61 | CG9: 0 | CH9: 0 | CI9: =SUM(RC[-4]:RC[-1]) -> 46.61 | CJ9: 0 | CK9: 60.298999999999999 | CL9: 0 | CM9: 0 | CN9: =SUM(RC[-4]:RC[-1]) -> 60.298999999999999 | CO9: 0 | CP9: 65.69 | CQ9: 0 | CR9: 0 | CS9: =SUM(RC[-4]:RC[-1]) -> 65.69 | CT9: 0 | CU9: 75.099999999999994 | CV9: 0 | CW9: 0 | CX9: =SUM(RC[-4]:RC[-1]) -> 75.099999999999994 | CY9: 0 | CZ9: 60.09 | DA9: 0 | DB9: 0 | DC9: =SUM(RC[-4]:RC[-1]) -> 60.09 | DD9: 0 | DE9: 6.4489999999999998 | DF9: 0 | DG9: 0 | DH9: =SUM(RC[-4]:RC[-1]) -> 6.4489999999999998 | DI9: 0 | DJ9: 78.75 | DK9: 1E-3 | DL9: 0 | DM9: =SUM(RC[-4]:RC[-1]) -> 78.751000000000005 | DN9: 0 | DO9: 136.63 | DP9: 245.06 | DQ9: 0 | DR9: =SUM(RC[-4]:RC[-1]) -> 381.69 | DS9: 0 | DT9: 0 | DU9: 7.6440000000000001 | DV9: 0 | DW9: =SUM(RC[-4]:RC[-1]) -> 7.6440000000000001 | DX9: 0 | DY9: 33.909999999999997 | DZ9: 0 | EA9: 0 | EB9: =SUM(RC[-4]:RC[-1]) -> 33.909999999999997 | EC9: 0 | ED9: 81.84 | EE9: 79.650000000000006 | EF9: 0 | EG9: =SUM(RC[-4]:RC[-1]) -> 161.49 | EH9: 0 | EI9: 88.41 | EJ9: 0 | EK9: 0 | EL9: =SUM(RC[-4]:RC[-1]) -> 88.41 | EM9: 0 | EN9: 885.55 | EO9: 611.51 | EP9: 0 | EQ9: =SUM(RC[-4]:RC[-1]) -> 1497.06 | ER9: 0 | ES9: 62.61 | ET9: 82.31 | EU9: 0 | EV9: =SUM(RC[-4]:RC[-1]) -> 144.92000000000002 | EW9: 0 | EX9: 1622.22 | EY9: 408.97 | EZ9: 0 | FA9: =SUM(RC[-4]:RC[-1]) -> 2031.19 | FB9: 0 | FC9: 0 | FD9: 0 | FE9: 0 | FF9: =SUM(RC[-4]:RC[-1]) -> 0 | FG9: 0 | FH9: 268.69 | FI9: 1070 | FJ9: 0 | FK9: =SUM(RC[-4]:RC[-1]) -> 1338.69 | FL9: 0 | FM9: 285.54000000000002 | FN9: 25.15 | FO9: 0 | FP9: =SUM(RC[-4]:RC[-1]) -> 310.69 | FQ9: 0 | FR9: 567 | FS9: 54.58 | FT9: 0 | FU9: =SUM(RC[-4]:RC[-1]) -> 621.58000000000004 | FV9: 0 | FW9: 124 | FX9: 7.05 | FY9: 0 | FZ9: =SUM(RC[-4]:RC[-1]) -> 131.05000000000001 | GA9: 0 | GB9: 415.4 | GC9: 286.79000000000002 | GD9: 0 | GE9: =SUM(RC[-4]:RC[-1]) -> 702.19 | GF9: 0 | GG9: 55.95 | GH9: 0 | GI9: 0 | GJ9: =SUM(RC[-4]:RC[-1]) -> 55.95 | GK9: 0 | GL9: 153.97 | GM9: 121.63 | GN9: 0 | GO9: =SUM(RC[-4]:RC[-1]) -> 275.60000000000002 | GP9: 0 | GQ9: 75.3 | GR9: 0 | GS9: 0 | GT9: =SUM(RC[-4]:RC[-1]) -> 75.3 | GU9: 0 | GV9: 117.88 | GW9: 0 | GX9: 0 | GY9: =SUM(RC[-4]:RC[-1]) -> 117.88 | GZ9: 0 | HA9: 0 | HB9: 0 | HC9: 0 | HD9: =SUM(RC[-4]:RC[-1]) -> 0 | HE9: 0 | HF9: 188.25 | HG9: 64.77 | HH9: 0 | HI9: =SUM(RC[-4]:RC[-1]) -> 253.01999999999998 | HJ9: 0 | HK9: 9233.4699999999993 | HL9: 130.09 | HM9: 0 | HN9: =SUM(RC[-4]:RC[-1]) -> 9363.56 | HO9: 0 | HP9: 353.04 | HQ9: 0.28399999999999997 | HR9: 0 | HS9: =SUM(RC[-4]:RC[-1]) -> 353.32400000000001 | HT9: 0 | HU9: 248.27 | HV9: 29.155000000000001 | HW9: 0 | HX9: =SUM(RC[-4]:RC[-1]) -> 277.42500000000001 | HY9: 0 | HZ9: 178.83 | IA9: 1388.54 | IB9: 0 | IC9: =SUM(RC[-4]:RC[-1]) -> 1567.37 | ID9: 0 | IE9: 39.83 | IF9: 0 | IG9: 0 | IH9: =SUM(RC[-4]:RC[-1]) -> 39.83 | II9: 0 | IJ9: 23.89 | IK9: 0 | IL9: 0 | IM9: =SUM(RC[-4]:RC[-1]) -> 23.89
A10: ANTHRACENE | B10: =RC[8]+RC[13]+RC[18]+RC[23]+RC[28]+RC[33]+RC[38]+RC[43]+RC[48]+RC[53]+RC[58]+RC[63]+RC[68]+RC[73]+RC[78]+RC[83]+RC[88]+RC[93]+RC[98]+RC[103]+RC[108]+RC[113]+RC[118]+RC[123]+RC[128]+RC[133]+RC[138]+RC[143]+RC[148]+RC[153]+RC[158]+RC[163]+RC[168]+RC[173]+RC[178]+RC[183]+RC[188]+RC[193]+RC[198]+RC[203]+RC[208]+RC[213]+RC[218]+RC[223]+RC[228]+RC[233]+RC[238]+RC[243]+Sheet2!RC[2]+Sheet2!RC[7]+Sheet2!RC[12]+Sheet2!RC[17]+Sheet2!RC[22]+Sheet2!RC[27]+Sheet2!RC[32]+Sheet2!RC[37]+Sheet2!RC[42]+Sheet2!RC[47]+Sheet2!RC[57]+Sheet2!RC[52]+Sheet2!RC[62]+Sheet2!RC[67] -> 554.01 | C10: =RC[6]+RC[11]+RC[16]+RC[21]+RC[26]+RC[31]+RC[36]+RC[41]+RC[46]+RC[51]+RC[56]+RC[61]+RC[66]+RC[71]+RC[76]+RC[81]+RC[86]+RC[91]+RC[96]+RC[101]+RC[106]+RC[111]+RC[116]+RC[121]+RC[126]+RC[131]+RC[136]+RC[141]+RC[146]+RC[151]+RC[156]+RC[161]+RC[166]+RC[171]+RC[176]+RC[181]+RC[186]+RC[191]+RC[196]+RC[201]+RC[206]+RC[211]+RC[216]+RC[221]+RC[226]+RC[231]+RC[236]+RC[241]+Sheet2!RC+Sheet2!RC[5]+Sheet2!RC[10]+Sheet2!RC[15]+Sheet2!RC[20]+Sheet2!RC[25]+Sheet2!RC[30]+Sheet2!RC[35]+Sheet2!RC[40]+Sheet2!RC[45]+Sheet2!RC[50]+Sheet2!RC[55]+Sheet2!RC[60]+Sheet2!RC[65] -> 0 | D10: =RC[4]+RC[9]+RC[14]+RC[19]+RC[24]+RC[29]+RC[34]+RC[39]+RC[44]+RC[49]+RC[54]+RC[59]+RC[64]+RC[69]+RC[74]+RC[79]+RC[84]+RC[89]+RC[94]+RC[99]+RC[104]+RC[109]+RC[114]+RC[119]+RC[124]+RC[129]+RC[134]+RC[139]+RC[144]+RC[149]+RC[154]+RC[159]+RC[164]+RC[169]+RC[174]+RC[179]+RC[184]+RC[189]+RC[194]+RC[199]+RC[204]+RC[209]+RC[214]+RC[219]+RC[224]+RC[229]+RC[234]+RC[239]+Sheet2!RC[3]+Sheet2!RC[-2]+Sheet2!RC[8]+Sheet2!RC[13]+Sheet2!RC[18]+Sheet2!RC[23]+Sheet2!RC[28]+Sheet2!RC[33]+Sheet2!RC[38]+Sheet2!RC[43]+Sheet2!RC[48]+Sheet2!RC[53]+Sheet2!RC[58]+Sheet2!RC[63] -> 0 | E10: =RC[6]+RC[11]+RC[16]+RC[21]+RC[26]+RC[31]+RC[36]+RC[41]+RC[46]+RC[51]+RC[56]+RC[61]+RC[66]+RC[71]+RC[76]+RC[81]+RC[86]+RC[91]+RC[96]+RC[101]+RC[106]+RC[111]+RC[116]+RC[121]+RC[126]+RC[131]+RC[136]+RC[141]+RC[146]+RC[151]+RC[156]+RC[161]+RC[166]+RC[171]+RC[176]+RC[181]+RC[186]+RC[191]+RC[196]+RC[201]+RC[206]+RC[211]+RC[216]+RC[221]+RC[226]+RC[231]+RC[236]+RC[241]+Sheet2!RC+Sheet2!RC[5]+Sheet2!RC[10]+Sheet2!RC[15]+Sheet2!RC[20]+Sheet2!RC[25]+Sheet2!RC[30]+Sheet2!RC[35]+Sheet2!RC[40]+Sheet2!RC[45]+Sheet2!RC[50]+Sheet2!RC[55]+Sheet2!RC[60]+Sheet2!RC[65] -> 26.943055970753392 | F10: =SUM(RC[-4]:RC[-1]) -> 580.95305597075344 | G10: =Sheet1!RC[5]+Sheet1!RC[10]+Sheet1!RC[15]+Sheet1!RC[20]+Sheet1!RC[25]+Sheet1!RC[30]+Sheet1!RC[35]+Sheet1!RC[40]+Sheet1!RC[45]+Sheet1!RC[50]+Sheet1!RC[55]+Sheet1!RC[60]+Sheet1!RC[65]+Sheet1!RC[70]+Sheet1!RC[75]+Sheet1!RC[80]+Sheet1!RC[85]+Sheet1!RC[90]+Sheet1!RC[95]+Sheet1!RC[100]+Sheet1!RC[105]+Sheet1!RC[110]+Sheet1!RC[115]+Sheet1!RC[120]+Sheet1!RC[125]+Sheet1!RC[130]+Sheet1!RC[135]+Sheet1!RC[140]+Sheet1!RC[145]+Sheet1!RC[150]+Sheet1!RC[155]+Sheet1!RC[160]+Sheet1!RC[165]+Sheet1!RC[170]+Sheet1!RC[175]+Sheet1!RC[180]+Sheet1!RC[185]+Sheet1!RC[190]+Sheet1!RC[195]+Sheet1!RC[200]+Sheet1!RC[205]+Sheet1!RC[210]+Sheet1!RC[215]+Sheet1!RC[220]+Sheet1!RC[225]+Sheet1!RC[230]+Sheet1!RC[235]+Sheet1!RC[240]+Sheet2!RC[-1]+Sheet2!RC[4]+Sheet2!RC[9]+Sheet2!RC[14]+Sheet2!RC[19]+Sheet2!RC[24]+Sheet2!RC[29]+Sheet2!RC[34]+Sheet2!RC[39]+Sheet2!RC[44]+Sheet2!RC[49]+Sheet2!RC[54]+Sheet2!RC[59]+Sheet2!RC[64] -> 580.95305597075367 | H10: 0 | I10: 0 | J10: 0 | K10: 0.48668100595280006 | L10: =SUM(RC[-4]:RC[-1]) -> 0.48668100595280006 | M10: 0 | N10: 0 | O10: 0 | P10: 0.11506695727960006 | Q10: =SUM(RC[-4]:RC[-1]) -> 0.11506695727960006 | R10: 0 | S10: 0 | T10: 0 | U10: 0.45006277911199999 | V10: =SUM(RC[-4]:RC[-1]) -> 0.45006277911199999 | W10: 0 | X10: 0 | Y10: 0 | Z10: 0.26960669433520007 | AA10: =SUM(RC[-4]:RC[-1]) -> 0.26960669433520007 | AB10: 0 | AC10: 0 | AD10: 0 | AE10: 0.52474119482320003 | AF10: =SUM(RC[-4]:RC[-1]) -> 0.52474119482320003 | AG10: 0 | AH10: 0 | AI10: 0 | AJ10: 0.13913287038719996 | AK10: =SUM(RC[-4]:RC[-1]) -> 0.13913287038719996 | AL10: 0 | AM10: 0 | AN10: 0 | AO10: 0.40220673249140015 | AP10: =SUM(RC[-4]:RC[-1]) -> 0.40220673249140015 | AQ10: 0 | AR10: 0 | AS10: 0 | AT10: 0.11268814597059995 | AU10: =SUM(RC[-4]:RC[-1]) -> 0.11268814597059995 | AV10: 0 | AW10: 0 | AX10: 0 | AY10: 0.15419845463280013 | AZ10: =SUM(RC[-4]:RC[-1]) -> 0.15419845463280013 | BA10: 0 | BB10: 0 | BC10: 0 | BD10: 0.19124860668400004 | BE10: =SUM(RC[-4]:RC[-1]) -> 0.19124860668400004 | BF10: 0 | BG10: 0 | BH10: 0 | BI10: 0.14548079808139991 | BJ10: =SUM(RC[-4]:RC[-1]) -> 0.14548079808139991 | BK10: 0 | BL10: 0 | BM10: 0 | BN10: 0.14380029205059991 | BO10: =SUM(RC[-4]:RC[-1]) -> 0.14380029205059991 | BP10: 0 | BQ10: 0 | BR10: 0 | BS10: 0.21009704044540001 | BT10: =SUM(RC[-4]:RC[-1]) -> 0.21009704044540001 | BU10: 0 | BV10: 0 | BW10: 0 | BX10: 0.45795237996200011 | BY10: =SUM(RC[-4]:RC[-1]) -> 0.45795237996200011 | BZ10: 0 | CA10: 0 | CB10: 552 | CC10: 1.4378866256776004 | CD10: =SUM(RC[-4]:RC[-1]) -> 553.43788662567761 | CE10: 0 | CF10: 0 | CG10: 2.0099999999999998 | CH10: 0.32583186934239994 | CI10: =SUM(RC[-4]:RC[-1]) -> 2.3358318693423996 | CJ10: 0 | CK10: 0 | CL10: 0 | CM10: 0.12819628214180004 | CN10: =SUM(RC[-4]:RC[-1]) -> 0.12819628214180004 | CO10: 0 | CP10: 0 | CQ10: 0 | CR10: 0.10185880680739998 | CS10: =SUM(RC[-4]:RC[-1]) -> 0.10185880680739998 | CT10: 0 | CU10: 0 | CV10: 0 | CW10: 0.10068149744959999 | CX10: =SUM(RC[-4]:RC[-1]) -> 0.10068149744959999 | CY10: 0 | CZ10: 0 | DA10: 0 | DB10: 9.5751457416399982E-2 | DC10: =SUM(RC[-4]:RC[-1]) -> 9.5751457416399982E-2 | DD10: 0 | DE10: 0 | DF10: 0 | DG10: 4.0451099349400013E-2 | DH10: =SUM(RC[-4]:RC[-1]) -> 4.0451099349400013E-2 | DI10: 0 | DJ10: 0 | DK10: 0 | DL10: 0.18600674870260014 | DM10: =SUM(RC[-4]:RC[-1]) -> 0.18600674870260014 | DN10: 0 | DO10: 0 | DP10: 0 | DQ10: 0.14646606168780002 | DR10: =SUM(RC[-4]:RC[-1]) -> 0.14646606168780002 | DS10: 0 | DT10: 0 | DU10: 0 | DV10: 1.0831273832873995 | DW10: =SUM(RC[-4]:RC[-1]) -> 1.0831273832873995 | DX10: 0 | DY10: 0 | DZ10: 0 | EA10: 0.1119404702952 | EB10: =SUM(RC[-4]:RC[-1]) -> 0.1119404702952 | EC10: 0 | ED10: 0 | EE10: 0 | EF10: 0.1088862691344 | EG10: =SUM(RC[-4]:RC[-1]) -> 0.1088862691344 | EH10: 0 | EI10: 0 | EJ10: 0 | EK10: 7.6000393775199987E-2 | EL10: =SUM(RC[-4]:RC[-1]) -> 7.6000393775199987E-2 | EM10: 0 | EN10: 0 | EO10: 0 | EP10: 1.2097260789995994 | EQ10: =SUM(RC[-4]:RC[-1]) -> 1.2097260789995994 | ER10: 0 | ES10: 0 | ET10: 0 | EU10: 6.9735288388599992E-2 | EV10: =SUM(RC[-4]:RC[-1]) -> 6.9735288388599992E-2 | EW10: 0 | EX10: 0 | EY10: 0 | EZ10: 2.0701569939174016 | FA10: =SUM(RC[-4]:RC[-1]) -> 2.0701569939174016 | FB10: 0 | FC10: 0 | FD10: 0 | FE10: 2.5211865056319995 | FF10: =SUM(RC[-4]:RC[-1]) -> 2.5211865056319995 | FG10: 0 | FH10: 0 | FI10: 0 | FJ10: 0.31800567314280009 | FK10: =SUM(RC[-4]:RC[-1]) -> 0.31800567314280009 | FL10: 0 | FM10: 0 | FN10: 0 | FO10: 0.3446630762820001 | FP10: =SUM(RC[-4]:RC[-1]) -> 0.3446630762820001 | FQ10: 0 | FR10: 0 | FS10: 0 | FT10: 0.75581392469180042 | FU10: =SUM(RC[-4]:RC[-1]) -> 0.75581392469180042 | FV10: 0 | FW10: 0 | FX10: 0 | FY10: 0.18890708183799995 | FZ10: =SUM(RC[-4]:RC[-1]) -> 0.18890708183799995 | GA10: 0 | GB10: 0 | GC10: 0 | GD10: 0.4587929535598001 | GE10: =SUM(RC[-4]:RC[-1]) -> 0.4587929535598001 | GF10: 0 | GG10: 0 | GH10: 0 | GI10: 5.8995556063399984E-2 | GJ10: =SUM(RC[-4]:RC[-1]) -> 5.8995556063399984E-2 | GK10: 0 | GL10: 0 | GM10: 0 | GN10: 0.20452271823960011 | GO10: =SUM(RC[-4]:RC[-1]) -> 0.20452271823960011 | GP10: 0 | GQ10: 0 | GR10: 0 | GS10: 0.1579135279204 | GT10: =SUM(RC[-4]:RC[-1]) -> 0.1579135279204 | GU10: 0 | GV10: 0 | GW10: 0 | GX10: 0.15644145820280003 | GY10: =SUM(RC[-4]:RC[-1]) -> 0.15644145820280003 | GZ10: 0 | HA10: 0 | HB10: 0 | HC10: 2.2139637079449996 | HD10: =SUM(RC[-4]:RC[-1]) -> 2.2139637079449996 | HE10: 0 | HF10: 0 | HG10: 0 | HH10: 0.21518709623780002 | HI10: =SUM(RC[-4]:RC[-1]) -> 0.21518709623780002 | HJ10: 0 | HK10: 0 | HL10: 0 | HM10: 0.39860034586099991 | HN10: =SUM(RC[-4]:RC[-1]) -> 0.39860034586099991 | HO10: 0 | HP10: 0 | HQ10: 0 | HR10: 0.46886024357420003 | HS10: =SUM(RC[-4]:RC[-1]) -> 0.46886024357420003 | HT10: 0 | HU10: 0 | HV10: 0 | HW10: 0.1949640084617999 | HX10: =SUM(RC[-4]:RC[-1]) -> 0.1949640084617999 | HY10: 0 | HZ10: 0 | IA10: 0 | IB10: 0.31585680233320007 | IC10: =SUM(RC[-4]:RC[-1]) -> 0.31585680233320007 | ID10: 0 | IE10: 0 | IF10: 0 | IG10: 0.15624885798079999 | IH10: =SUM(RC[-4]:RC[-1]) -> 0.15624885798079999 | II10: 0 | IJ10: 0 | IK10: 0 | IL10: 3.3819720049600002E-2 | IM10: =SUM(RC[-4]:RC[-1]) -> 3.3819720049600002E-2
A11: ANTIMONY | B11: =RC[8]+RC[13]+RC[18]+RC[23]+RC[28]+RC[33]+RC[38]+RC[43]+RC[48]+RC[53]+RC[58]+RC[63]+RC[68]+RC[73]+RC[78]+RC[83]+RC[88]+RC[93]+RC[98]+RC[103]+RC[108]+RC[113]+RC[118]+RC[123]+RC[128]+RC[133]+RC[138]+RC[143]+RC[148]+RC[153]+RC[158]+RC[163]+RC[168]+RC[173]+RC[178]+RC[183]+RC[188]+RC[193]+RC[198]+RC[203]+RC[208]+RC[213]+RC[218]+RC[223]+RC[228]+RC[233]+RC[238]+RC[243]+Sheet2!RC[2]+Sheet2!RC[7]+Sheet2!RC[12]+Sheet2!RC[17]+Sheet2!RC[22]+Sheet2!RC[27]+Sheet2!RC[32]+Sheet2!RC[37]+Sheet2!RC[42]+Sheet2!RC[47]+Sheet2!RC[57]+Sheet2!RC[52]+Sheet2!RC[62]+Sheet2!RC[67] -> 29897.792000000005 | C11: =RC[6]+RC[11]+RC[16]+RC[21]+RC[26]+RC[31]+RC[36]+RC[41]+RC[46]+RC[51]+RC[56]+RC[61]+RC[66]+RC[71]+RC[76]+RC[81]+RC[86]+RC[91]+RC[96]+RC[101]+RC[106]+RC[111]+RC[116]+RC[121]+RC[126]+RC[131]+RC[136]+RC[141]+RC[146]+RC[151]+RC[156]+RC[161]+RC[166]+RC[171]+RC[176]+RC[181]+RC[186]+RC[191]+RC[196]+RC[201]+RC[206]+RC[211]+RC[216]+RC[221]+RC[226]+RC[231]+RC[236]+RC[241]+Sheet2!RC+Sheet2!RC[5]+Sheet2!RC[10]+Sheet2!RC[15]+Sheet2!RC[20]+Sheet2!RC[25]+Sheet2!RC[30]+Sheet2!RC[35]+Sheet2!RC[40]+Sheet2!RC[45]+Sheet2!RC[50]+Sheet2!RC[55]+Sheet2!RC[60]+Sheet2!RC[65] -> 0 | D11: =RC[4]+RC[9]+RC[14]+RC[19]+RC[24]+RC[29]+RC[34]+RC[39]+RC[44]+RC[49]+RC[54]+RC[59]+RC[64]+RC[69]+RC[74]+RC[79]+RC[84]+RC[89]+RC[94]+RC[99]+RC[104]+RC[109]+RC[114]+RC[119]+RC[124]+RC[129]+RC[134]+RC[139]+RC[144]+RC[149]+RC[154]+RC[159]+RC[164]+RC[169]+RC[174]+RC[179]+RC[184]+RC[189]+RC[194]+RC[199]+RC[204]+RC[209]+RC[214]+RC[219]+RC[224]+RC[229]+RC[234]+RC[239]+Sheet2!RC[3]+Sheet2!RC[-2]+Sheet2!RC[8]+Sheet2!RC[13]+Sheet2!RC[18]+Sheet2!RC[23]+Sheet2!RC[28]+Sheet2!RC[33]+Sheet2!RC[38]+Sheet2!RC[43]+Sheet2!RC[48]+Sheet2!RC[53]+Sheet2!RC[58]+Sheet2!RC[63] -> 0 | E11: =RC[6]+RC[11]+RC[16]+RC[21]+RC[26]+RC[31]+RC[36]+RC[41]+RC[46]+RC[51]+RC[56]+RC[61]+RC[66]+RC[71]+RC[76]+RC[81]+RC[86]+RC[91]+RC[96]+RC[101]+RC[106]+RC[111]+RC[116]+RC[121]+RC[126]+RC[131]+RC[136]+RC[141]+RC[146]+RC[151]+RC[156]+RC[161]+RC[166]+RC[171]+RC[176]+RC[181]+RC[186]+RC[191]+RC[196]+RC[201]+RC[206]+RC[211]+RC[216]+RC[221]+RC[226]+RC[231]+RC[236]+RC[241]+Sheet2!RC+Sheet2!RC[5]+Sheet2!RC[10]+Sheet2!RC[15]+Sheet2!RC[20]+Sheet2!RC[25]+Sheet2!RC[30]+Sheet2!RC[35]+Sheet2!RC[40]+Sheet2!RC[45]+Sheet2!RC[50]+Sheet2!RC[55]+Sheet2!RC[60]+Sheet2!RC[65] -> 0 | F11: =SUM(RC[-4]:RC[-1]) -> 29897.792000000005 | G11: =Sheet1!RC[5]+Sheet1!RC[10]+Sheet1!RC[15]+Sheet1!RC[20]+Sheet1!RC[25]+Sheet1!RC[30]+Sheet1!RC[35]+Sheet1!RC[40]+Sheet1!RC[45]+Sheet1!RC[50]+Sheet1!RC[55]+Sheet1!RC[60]+Sheet1!RC[65]+Sheet1!RC[70]+Sheet1!RC[75]+Sheet1!RC[80]+Sheet1!RC[85]+Sheet1!RC[90]+Sheet1!RC[95]+Sheet1!RC[100]+Sheet1!RC[105]+Sheet1!RC[110]+Sheet1!RC[115]+Sheet1!RC[120]+Sheet1!RC[125]+Sheet1!RC[130]+Sheet1!RC[135]+Sheet1!RC[140]+Sheet1!RC[145]+Sheet1!RC[150]+Sheet1!RC[155]+Sheet1!RC[160]+Sheet1!RC[165]+Sheet1!RC[170]+Sheet1!RC[175]+Sheet1!RC[180]+Sheet1!RC[185]+Sheet1!RC[190]+Sheet1!RC[195]+Sheet1!RC[200]+Sheet1!RC[205]+Sheet1!RC[210]+Sheet1!RC[215]+Sheet1!RC[220]+Sheet1!RC[225]+Sheet1!RC[230]+Sheet1!RC[235]+Sheet1!RC[240]+Sheet2!RC[-1]+Sheet2!RC[4]+Sheet2!RC[9]+Sheet2!RC[14]+Sheet2!RC[19]+Sheet2!RC[24]+Sheet2!RC[29]+Sheet2!RC[34]+Sheet2!RC[39]+Sheet2!RC[44]+Sheet2!RC[49]+Sheet2!RC[54]+Sheet2!RC[59]+Sheet2!RC[64] -> 29897.792000000005 | H11: 0 | I11: 0 | J11: 3451 | K11: 0 | L11: =SUM(RC[-4]:RC[-1]) -> 3451 | M11: 0 | N11: 0 | O11: 0 | P11: 0 | Q11: =SUM(RC[-4]:RC[-1]) -> 0 | R11: 0 | S11: 0 | T11: 0 | U11: 0 | V11: =SUM(RC[-4]:RC[-1]) -> 0 | W11: 0 | X11: 0 | Y11: 139.19999999999999 | Z11: 0 | AA11: =SUM(RC[-4]:RC[-1]) -> 139.19999999999999 | AB11: 0 | AC11: 0 | AD11: 0 | AE11: 0 | AF11: =SUM(RC[-4]:RC[-1]) -> 0 | AG11: 0 | AH11: 0 | AI11: 25.93 | AJ11: 0 | AK11: =SUM(RC[-4]:RC[-1]) -> 25.93 | AL11: 0 | AM11: 0 | AN11: 516.49 | AO11: 0 | AP11: =SUM(RC[-4]:RC[-1]) -> 516.49 | AQ11: 0 | AR11: 0 | AS11: 5.4770000000000003 | AT11: 0 | AU11: =SUM(RC[-4]:RC[-1]) -> 5.4770000000000003 | AV11: 0 | AW11: 0 | AX11: 1.82 | AY11: 0 | AZ11: =SUM(RC[-4]:RC[-1]) -> 1.82 | BA11: 0 | BB11: 0 | BC11: 0.46 | BD11: 0 | BE11: =SUM(RC[-4]:RC[-1]) -> 0.46 | BF11: 0 | BG11: 0 | BH11: 0 | BI11: 0 | BJ11: =SUM(RC[-4]:RC[-1]) -> 0 | BK11: 0 | BL11: 0 | BM11: 0.03 | BN11: 0 | BO11: =SUM(RC[-4]:RC[-1]) -> 0.03 | BP11: 0 | BQ11: 0 | BR11: 31.98 | BS11: 0 | BT11: =SUM(RC[-4]:RC[-1]) -> 31.98 | BU11: 0 | BV11: 0 | BW11: 1.667 | BX11: 0 | BY11: =SUM(RC[-4]:RC[-1]) -> 1.667 | BZ11: 0 | CA11: 0 | CB11: 2071.63 | CC11: 0 | CD11: =SUM(RC[-4]:RC[-1]) -> 2071.63 | CE11: 0 | CF11: 0 | CG11: 24.38 | CH11: 0 | CI11: =SUM(RC[-4]:RC[-1]) -> 24.38 | CJ11: 0 | CK11: 0 | CL11: 0 | CM11: 0 | CN11: =SUM(RC[-4]:RC[-1]) -> 0 | CO11: 0 | CP11: 0 | CQ11: 0 | CR11: 0 | CS11: =SUM(RC[-4]:RC[-1]) -> 0 | CT11: 0 | CU11: 0 | CV11: 0 | CW11: 0 | CX11: =SUM(RC[-4]:RC[-1]) -> 0 | CY11: 0 | CZ11: 0 | DA11: 1608.2 | DB11: 0 | DC11: =SUM(RC[-4]:RC[-1]) -> 1608.2 | DD11: 0 | DE11: 0 | DF11: 0 | DG11: 0 | DH11: =SUM(RC[-4]:RC[-1]) -> 0 | DI11: 0 | DJ11: 0 | DK11: 11.83 | DL11: 0 | DM11: =SUM(RC[-4]:RC[-1]) -> 11.83 | DN11: 0 | DO11: 0 | DP11: 0 | DQ11: 0 | DR11: =SUM(RC[-4]:RC[-1]) -> 0 | DS11: 0 | DT11: 0 | DU11: 73.72 | DV11: 0 | DW11: =SUM(RC[-4]:RC[-1]) -> 73.72 | DX11: 0 | DY11: 0 | DZ11: 13.988 | EA11: 0 | EB11: =SUM(RC[-4]:RC[-1]) -> 13.988 | EC11: 0 | ED11: 0 | EE11: 0 | EF11: 0 | EG11: =SUM(RC[-4]:RC[-1]) -> 0 | EH11: 0 | EI11: 0 | EJ11: 0 | EK11: 0 | EL11: =SUM(RC[-4]:RC[-1]) -> 0 | EM11: 0 | EN11: 0 | EO11: 669.08 | EP11: 0 | EQ11: =SUM(RC[-4]:RC[-1]) -> 669.08 | ER11: 0 | ES11: 0 | ET11: 389.49 | EU11: 0 | EV11: =SUM(RC[-4]:RC[-1]) -> 389.49 | EW11: 0 | EX11: 0 | EY11: 514.69000000000005 | EZ11: 0 | FA11: =SUM(RC[-4]:RC[-1]) -> 514.69000000000005 | FB11: 0 | FC11: 0 | FD11: 0 | FE11: 0 | FF11: =SUM(RC[-4]:RC[-1]) -> 0 | FG11: 0 | FH11: 0 | FI11: 14940.6 | FJ11: 0 | FK11: =SUM(RC[-4]:RC[-1]) -> 14940.6 | FL11: 0 | FM11: 0 | FN11: 132.24 | FO11: 0 | FP11: =SUM(RC[-4]:RC[-1]) -> 132.24 | FQ11: 0 | FR11: 0 | FS11: 136.18 | FT11: 0 | FU11: =SUM(RC[-4]:RC[-1]) -> 136.18 | FV11: 0 | FW11: 0 | FX11: 119 | FY11: 0 | FZ11: =SUM(RC[-4]:RC[-1]) -> 119 | GA11: 0 | GB11: 0 | GC11: 31.35 | GD11: 0 | GE11: =SUM(RC[-4]:RC[-1]) -> 31.35 | GF11: 0 | GG11: 0 | GH11: 0 | GI11: 0 | GJ11: =SUM(RC[-4]:RC[-1]) -> 0 | GK11: 0 | GL11: 0 | GM11: 553.54 | GN11: 0 | GO11: =SUM(RC[-4]:RC[-1]) -> 553.54 | GP11: 0 | GQ11: 0 | GR11: 0 | GS11: 0 | GT11: =SUM(RC[-4]:RC[-1]) -> 0 | GU11: 0 | GV11: 0 | GW11: 0 | GX11: 0 | GY11: =SUM(RC[-4]:RC[-1]) -> 0 | GZ11: 0 | HA11: 0 | HB11: 0 | HC11: 0 | HD11: =SUM(RC[-4]:RC[-1]) -> 0 | HE11: 0 | HF11: 0 | HG11: 1.97 | HH11: 0 | HI11: =SUM(RC[-4]:RC[-1]) -> 1.97 | HJ11: 0 | HK11: 0 | HL11: 401.81 | HM11: 0 | HN11: =SUM(RC[-4]:RC[-1]) -> 401.81 | HO11: 0 | HP11: 0 | HQ11: 367.12 | HR11: 0 | HS11: =SUM(RC[-4]:RC[-1]) -> 367.12 | HT11: 0 | HU11: 0 | HV11: 33.85 | HW11: 0 | HX11: =SUM(RC[-4]:RC[-1]) -> 33.85 | HY11: 0 | HZ11: 0 | IA11: 32.97 | IB11: 0 | IC11: =SUM(RC[-4]:RC[-1]) -> 32.97 | ID11: 0 | IE11: 0 | IF11: 0 | IG11: 0 | IH11: =SUM(RC[-4]:RC[-1]) -> 0 | II11: 0 | IJ11: 0 | IK11: 8.9499999999999993 | IL11: 0 | IM11: =SUM(RC[-4]:RC[-1]) -> 8.9499999999999993
A12: ARSENIC | B12: =RC[8]+RC[13]+RC[18]+RC[23]+RC[28]+RC[33]+RC[38]+RC[43]+RC[48]+RC[53]+RC[58]+RC[63]+RC[68]+RC[73]+RC[78]+RC[83]+RC[88]+RC[93]+RC[98]+RC[103]+RC[108]+RC[113]+RC[118]+RC[123]+RC[128]+RC[133]+RC[138]+RC[143]+RC[148]+RC[153]+RC[158]+RC[163]+RC[168]+RC[173]+RC[178]+RC[183]+RC[188]+RC[193]+RC[198]+RC[203]+RC[208]+RC[213]+RC[218]+RC[223]+RC[228]+RC[233]+RC[238]+RC[243]+Sheet2!RC[2]+Sheet2!RC[7]+Sheet2!RC[12]+Sheet2!RC[17]+Sheet2!RC[22]+Sheet2!RC[27]+Sheet2!RC[32]+Sheet2!RC[37]+Sheet2!RC[42]+Sheet2!RC[47]+Sheet2!RC[57]+Sheet2!RC[52]+Sheet2!RC[62]+Sheet2!RC[67] -> 19214.516200000002 | C12: =RC[6]+RC[11]+RC[16]+RC[21]+RC[26]+RC[31]+RC[36]+RC[41]+RC[46]+RC[51]+RC[56]+RC[61]+RC[66]+RC[71]+RC[76]+RC[81]+RC[86]+RC[91]+RC[96]+RC[101]+RC[106]+RC[111]+RC[116]+RC[121]+RC[126]+RC[131]+RC[136]+RC[141]+RC[146]+RC[151]+RC[156]+RC[161]+RC[166]+RC[171]+RC[176]+RC[181]+RC[186]+RC[191]+RC[196]+RC[201]+RC[206]+RC[211]+RC[216]+RC[221]+RC[226]+RC[231]+RC[236]+RC[241]+Sheet2!RC+Sheet2!RC[5]+Sheet2!RC[10]+Sheet2!RC[15]+Sheet2!RC[20]+Sheet2!RC[25]+Sheet2!RC[30]+Sheet2!RC[35]+Sheet2!RC[40]+Sheet2!RC[45]+Sheet2!RC[50]+Sheet2!RC[55]+Sheet2!RC[60]+Sheet2!RC[65] -> 0 | D12: =RC[4]+RC[9]+RC[14]+RC[19]+RC[24]+RC[29]+RC[34]+RC[39]+RC[44]+RC[49]+RC[54]+RC[59]+RC[64]+RC[69]+RC[74]+RC[79]+RC[84]+RC[89]+RC[94]+RC[99]+RC[104]+RC[109]+RC[114]+RC[119]+RC[124]+RC[129]+RC[134]+RC[139]+RC[144]+RC[149]+RC[154]+RC[159]+RC[164]+RC[169]+RC[174]+RC[179]+RC[184]+RC[189]+RC[194]+RC[199]+RC[204]+RC[209]+RC[214]+RC[219]+RC[224]+RC[229]+RC[234]+RC[239]+Sheet2!RC[3]+Sheet2!RC[-2]+Sheet2!RC[8]+Sheet2!RC[13]+Sheet2!RC[18]+Sheet2!RC[23]+Sheet2!RC[28]+Sheet2!RC[33]+Sheet2!RC[38]+Sheet2!RC[43]+Sheet2!RC[48]+Sheet2!RC[53]+Sheet2!RC[58]+Sheet2!RC[63] -> 6 | E12: =RC[6]+RC[11]+RC[16]+RC[21]+RC[26]+RC[31]+RC[36]+RC[41]+RC[46]+RC[51]+RC[56]+RC[61]+RC[66]+RC[71]+RC[76]+RC[81]+RC[86]+RC[91]+RC[96]+RC[101]+RC[106]+RC[111]+RC[116]+RC[121]+RC[126]+RC[131]+RC[136]+RC[141]+RC[146]+RC[151]+RC[156]+RC[161]+RC[166]+RC[171]+RC[176]+RC[181]+RC[186]+RC[191]+RC[196]+RC[201]+RC[206]+RC[211]+RC[216]+RC[221]+RC[226]+RC[231]+RC[236]+RC[241]+Sheet2!RC+Sheet2!RC[5]+Sheet2!RC[10]+Sheet2!RC[15]+Sheet2!RC[20]+Sheet2!RC[25]+Sheet2!RC[30]+Sheet2!RC[35]+Sheet2!RC[40]+Sheet2!RC[45]+Sheet2!RC[50]+Sheet2!RC[55]+Sheet2!RC[60]+Sheet2!RC[65] -> 0 | F12: =SUM(RC[-4]:RC[-1]) -> 19220.516200000002 | G12: =Sheet1!RC[5]+Sheet1!RC[10]+Sheet1!RC[15]+Sheet1!RC[20]+Sheet1!RC[25]+Sheet1!RC[30]+Sheet1!RC[35]+Sheet1!RC[40]+Sheet1!RC[45]+Sheet1!RC[50]+Sheet1!RC[55]+Sheet1!RC[60]+Sheet1!RC[65]+Sheet1!RC[70]+Sheet1!RC[75]+Sheet1!RC[80]+Sheet1!RC[85]+Sheet1!RC[90]+Sheet1!RC[95]+Sheet1!RC[100]+Sheet1!RC[105]+Sheet1!RC[110]+Sheet1!RC[115]+Sheet1!RC[120]+Sheet1!RC[125]+Sheet1!RC[130]+Sheet1!RC[135]+Sheet1!RC[140]+Sheet1!RC[145]+Sheet1!RC[150]+Sheet1!RC[155]+Sheet1!RC[160]+Sheet1!RC[165]+Sheet1!RC[170]+Sheet1!RC[175]+Sheet1!RC[180]+Sheet1!RC[185]+Sheet1!RC[190]+Sheet1!RC[195]+Sheet1!RC[200]+Sheet1!RC[205]+Sheet1!RC[210]+Sheet1!RC[215]+Sheet1!RC[220]+Sheet1!RC[225]+Sheet1!RC[230]+Sheet1!RC[235]+Sheet1!RC[240]+Sheet2!RC[-1]+Sheet2!RC[4]+Sheet2!RC[9]+Sheet2!RC[14]+Sheet2!RC[19]+Sheet2!RC[24]+Sheet2!RC[29]+Sheet2!RC[34]+Sheet2!RC[39]+Sheet2!RC[44]+Sheet2!RC[49]+Sheet2!RC[54]+Sheet2!RC[59]+Sheet2!RC[64] -> 19220.516200000002 | H12: 0 | I12: 0 | J12: 3132 | K12: 0 | L12: =SUM(RC[-4]:RC[-1]) -> 3132 | M12: 0 | N12: 0 | O12: 0 | P12: 0 | Q12: =SUM(RC[-4]:RC[-1]) -> 0 | R12: 0 | S12: 0 | T12: 0 | U12: 0 | V12: =SUM(RC[-4]:RC[-1]) -> 0 | W12: 0 | X12: 0 | Y12: 199.42 | Z12: 0 | AA12: =SUM(RC[-4]:RC[-1]) -> 199.42 | AB12: 0 | AC12: 0 | AD12: 0 | AE12: 0 | AF12: =SUM(RC[-4]:RC[-1]) -> 0 | AG12: 0 | AH12: 0 | AI12: 82.99 | AJ12: 0 | AK12: =SUM(RC[-4]:RC[-1]) -> 82.99 | AL12: 0 | AM12: 0 | AN12: 733.63 | AO12: 0 | AP12: =SUM(RC[-4]:RC[-1]) -> 733.63 | AQ12: 0 | AR12: 0 | AS12: 62.96 | AT12: 0 | AU12: =SUM(RC[-4]:RC[-1]) -> 62.96 | AV12: 0 | AW12: 0 | AX12: 2.56 | AY12: 0 | AZ12: =SUM(RC[-4]:RC[-1]) -> 2.56 | BA12: 0 | BB12: 0 | BC12: 0 | BD12: 0 | BE12: =SUM(RC[-4]:RC[-1]) -> 0 | BF12: 0 | BG12: 0 | BH12: 0 | BI12: 0 | BJ12: =SUM(RC[-4]:RC[-1]) -> 0 | BK12: 0 | BL12: 0 | BM12: 10 | BN12: 0 | BO12: =SUM(RC[-4]:RC[-1]) -> 10 | BP12: 0 | BQ12: 0 | BR12: 30.85 | BS12: 0 | BT12: =SUM(RC[-4]:RC[-1]) -> 30.85 | BU12: 0 | BV12: 0 | BW12: 11.05 | BX12: 0 | BY12: =SUM(RC[-4]:RC[-1]) -> 11.05 | BZ12: 1 | CA12: 0 | CB12: 2659 | CC12: 0 | CD12: =SUM(RC[-4]:RC[-1]) -> 2660 | CE12: 0 | CF12: 0 | CG12: 3.62 | CH12: 0 | CI12: =SUM(RC[-4]:RC[-1]) -> 3.62 | CJ12: 0 | CK12: 0 | CL12: 0 | CM12: 0 | CN12: =SUM(RC[-4]:RC[-1]) -> 0 | CO12: 0 | CP12: 0 | CQ12: 0 | CR12: 0 | CS12: =SUM(RC[-4]:RC[-1]) -> 0 | CT12: 0 | CU12: 0 | CV12: 0 | CW12: 0 | CX12: =SUM(RC[-4]:RC[-1]) -> 0 | CY12: 0 | CZ12: 0 | DA12: 2094.75 | DB12: 0 | DC12: =SUM(RC[-4]:RC[-1]) -> 2094.75 | DD12: 0 | DE12: 0 | DF12: 0 | DG12: 0 | DH12: =SUM(RC[-4]:RC[-1]) -> 0 | DI12: 0 | DJ12: 0 | DK12: 16.190000000000001 | DL12: 0 | DM12: =SUM(RC[-4]:RC[-1]) -> 16.190000000000001 | DN12: 0 | DO12: 0 | DP12: 11.44 | DQ12: 0 | DR12: =SUM(RC[-4]:RC[-1]) -> 11.44 | DS12: 0 | DT12: 0 | DU12: 105.81 | DV12: 0 | DW12: =SUM(RC[-4]:RC[-1]) -> 105.81 | DX12: 0 | DY12: 0 | DZ12: 20.07 | EA12: 0 | EB12: =SUM(RC[-4]:RC[-1]) -> 20.07 | EC12: 0 | ED12: 0 | EE12: 0 | EF12: 0 | EG12: =SUM(RC[-4]:RC[-1]) -> 0 | EH12: 0 | EI12: 0 | EJ12: 0 | EK12: 0 | EL12: =SUM(RC[-4]:RC[-1]) -> 0 | EM12: 1 | EN12: 0 | EO12: 959.42 | EP12: 0 | EQ12: =SUM(RC[-4]:RC[-1]) -> 960.42 | ER12: 0 | ES12: 0 | ET12: 559.01 | EU12: 0 | EV12: =SUM(RC[-4]:RC[-1]) -> 559.01 | EW12: 1 | EX12: 0 | EY12: 739.72 | EZ12: 0 | FA12: =SUM(RC[-4]:RC[-1]) -> 740.72 | FB12: 0 | FC12: 0 | FD12: 0 | FE12: 0 | FF12: =SUM(RC[-4]:RC[-1]) -> 0 | FG12: 0 | FH12: 0 | FI12: 752 | FJ12: 0 | FK12: =SUM(RC[-4]:RC[-1]) -> 752 | FL12: 0 | FM12: 0 | FN12: 198.6 | FO12: 0 | FP12: =SUM(RC[-4]:RC[-1]) -> 198.6 | FQ12: 0 | FR12: 0 | FS12: 49.44 | FT12: 0 | FU12: =SUM(RC[-4]:RC[-1]) -> 49.44 | FV12: 0 | FW12: 0 | FX12: 235.9 | FY12: 0 | FZ12: =SUM(RC[-4]:RC[-1]) -> 235.9 | GA12: 0 | GB12: 0 | GC12: 144.31 | GD12: 0 | GE12: =SUM(RC[-4]:RC[-1]) -> 144.31 | GF12: 0 | GG12: 0 | GH12: 0 | GI12: 0 | GJ12: =SUM(RC[-4]:RC[-1]) -> 0 | GK12: 0 | GL12: 0 | GM12: 339.7 | GN12: 0 | GO12: =SUM(RC[-4]:RC[-1]) -> 339.7 | GP12: 0 | GQ12: 0 | GR12: 0 | GS12: 0 | GT12: =SUM(RC[-4]:RC[-1]) -> 0 | GU12: 0 | GV12: 0 | GW12: 0 | GX12: 0 | GY12: =SUM(RC[-4]:RC[-1]) -> 0 | GZ12: 1 | HA12: 0 | HB12: 0.9 | HC12: 0 | HD12: =SUM(RC[-4]:RC[-1]) -> 1.9 | HE12: 0 | HF12: 0 | HG12: 0 | HH12: 0 | HI12: =SUM(RC[-4]:RC[-1]) -> 0 | HJ12: 0 | HK12: 0 | HL12: 576.38 | HM12: 0 | HN12: =SUM(RC[-4]:RC[-1]) -> 576.38 | HO12: 0 | HP12: 0 | HQ12: 524.61 | HR12: 0 | HS12: =SUM(RC[-4]:RC[-1]) -> 524.61 | HT12: 0 | HU12: 0 | HV12: 19.87 | HW12: 0 | HX12: =SUM(RC[-4]:RC[-1]) -> 19.87 | HY12: 0 | HZ12: 0 | IA12: 18.233000000000001 | IB12: 0 | IC12: =SUM(RC[-4]:RC[-1]) -> 18.233000000000001 | ID12: 0 | IE12: 0 | IF12: 0 | IG12: 0 | IH12: =SUM(RC[-4]:RC[-1]) -> 0 | II12: 0 | IJ12: 0 | IK12: 48.8 | IL12: 0 | IM12: =SUM(RC[-4]:RC[-1]) -> 48.8
A13: ATRIZINE | B13: =RC[8]+RC[13]+RC[18]+RC[23]+RC[28]+RC[33]+RC[38]+RC[43]+RC[48]+RC[53]+RC[58]+RC[63]+RC[68]+RC[73]+RC[78]+RC[83]+RC[88]+RC[93]+RC[98]+RC[103]+RC[108]+RC[113]+RC[118]+RC[123]+RC[128]+RC[133]+RC[138]+RC[143]+RC[148]+RC[153]+RC[158]+RC[163]+RC[168]+RC[173]+RC[178]+RC[183]+RC[188]+RC[193]+RC[198]+RC[203]+RC[208]+RC[213]+RC[218]+RC[223]+RC[228]+RC[233]+RC[238]+RC[243]+Sheet2!RC[2]+Sheet2!RC[7]+Sheet2!RC[12]+Sheet2!RC[17]+Sheet2!RC[22]+Sheet2!RC[27]+Sheet2!RC[32]+Sheet2!RC[37]+Sheet2!RC[42]+Sheet2!RC[47]+Sheet2!RC[57]+Sheet2!RC[52]+Sheet2!RC[62]+Sheet2!RC[67] -> 0 | C13: =RC[6]+RC[11]+RC[16]+RC[21]+RC[26]+RC[31]+RC[36]+RC[41]+RC[46]+RC[51]+RC[56]+RC[61]+RC[66]+RC[71]+RC[76]+RC[81]+RC[86]+RC[91]+RC[96]+RC[101]+RC[106]+RC[111]+RC[116]+RC[121]+RC[126]+RC[131]+RC[136]+RC[141]+RC[146]+RC[151]+RC[156]+RC[161]+RC[166]+RC[171]+RC[176]+RC[181]+RC[186]+RC[191]+RC[196]+RC[201]+RC[206]+RC[211]+RC[216]+RC[221]+RC[226]+RC[231]+RC[236]+RC[241]+Sheet2!RC+Sheet2!RC[5]+Sheet2!RC[10]+Sheet2!RC[15]+Sheet2!RC[20]+Sheet2!RC[25]+Sheet2!RC[30]+Sheet2!RC[35]+Sheet2!RC[40]+Sheet2!RC[45]+Sheet2!RC[50]+Sheet2!RC[55]+Sheet2!RC[60]+Sheet2!RC[65] -> 120278.00779999999 | D13: =RC[4]+RC[9]+RC[14]+RC[19]+RC[24]+RC[29]+RC[34]+RC[39]+RC[44]+RC[49]+RC[54]+RC[59]+RC[64]+RC[69]+RC[74]+RC[79]+RC[84]+RC[89]+RC[94]+RC[99]+RC[104]+RC[109]+RC[114]+RC[119]+RC[124]+RC[129]+RC[134]+RC[139]+RC[144]+RC[149]+RC[154]+RC[159]+RC[164]+RC[169]+RC[174]+RC[179]+RC[184]+RC[189]+RC[194]+RC[199]+RC[204]+RC[209]+RC[214]+RC[219]+RC[224]+RC[229]+RC[234]+RC[239]+Sheet2!RC[3]+Sheet2!RC[-2]+Sheet2!RC[8]+Sheet2!RC[13]+Sheet2!RC[18]+Sheet2!RC[23]+Sheet2!RC[28]+Sheet2!RC[33]+Sheet2!RC[38]+Sheet2!RC[43]+Sheet2!RC[48]+Sheet2!RC[53]+Sheet2!RC[58]+Sheet2!RC[63] -> 0 | E13: =RC[6]+RC[11]+RC[16]+RC[21]+RC[26]+RC[31]+RC[36]+RC[41]+RC[46]+RC[51]+RC[56]+RC[61]+RC[66]+RC[71]+RC[76]+RC[81]+RC[86]+RC[91]+RC[96]+RC[101]+RC[106]+RC[111]+RC[116]+RC[121]+RC[126]+RC[131]+RC[136]+RC[141]+RC[146]+RC[151]+RC[156]+RC[161]+RC[166]+RC[171]+RC[176]+RC[181]+RC[186]+RC[191]+RC[196]+RC[201]+RC[206]+RC[211]+RC[216]+RC[221]+RC[226]+RC[231]+RC[236]+RC[241]+Sheet2!RC+Sheet2!RC[5]+Sheet2!RC[10]+Sheet2!RC[15]+Sheet2!RC[20]+Sheet2!RC[25]+Sheet2!RC[30]+Sheet2!RC[35]+Sheet2!RC[40]+Sheet2!RC[45]+Sheet2!RC[50]+Sheet2!RC[55]+Sheet2!RC[60]+Sheet2!RC[65] -> 0 | F13: =SUM(RC[-4]:RC[-1]) -> 120278.00779999999 | G13: =Sheet1!RC[5]+Sheet1!RC[10]+Sheet1!RC[15]+Sheet1!RC[20]+Sheet1!RC[25]+Sheet1!RC[30]+Sheet1!RC[35]+Sheet1!RC[40]+Sheet1!RC[45]+Sheet1!RC[50]+Sheet1!RC[55]+Sheet1!RC[60]+Sheet1!RC[65]+Sheet1!RC[70]+Sheet1!RC[75]+Sheet1!RC[80]+Sheet1!RC[85]+Sheet1!RC[90]+Sheet1!RC[95]+Sheet1!RC[100]+Sheet1!RC[105]+Sheet1!RC[110]+Sheet1!RC[115]+Sheet1!RC[120]+Sheet1!RC[125]+Sheet1!RC[130]+Sheet1!RC[135]+Sheet1!RC[140]+Sheet1!RC[145]+Sheet1!RC[150]+Sheet1!RC[155]+Sheet1!RC[160]+Sheet1!RC[165]+Sheet1!RC[170]+Sheet1!RC[175]+Sheet1!RC[180]+Sheet1!RC[185]+Sheet1!RC[190]+Sheet1!RC[195]+Sheet1!RC[200]+Sheet1!RC[205]+Sheet1!RC[210]+Sheet1!RC[215]+Sheet1!RC[220]+Sheet1!RC[225]+Sheet1!RC[230]+Sheet1!RC[235]+Sheet1!RC[240]+Sheet2!RC[-1]+Sheet2!RC[4]+Sheet2!RC[9]+Sheet2!RC[14]+Sheet2!RC[19]+Sheet2!RC[24]+Sheet2!RC[29]+Sheet2!RC[34]+Sheet2!RC[39]+Sheet2!RC[44]+Sheet2!RC[49]+Sheet2!RC[54]+Sheet2!RC[59]+Sheet2!RC[64] -> 120278.00779999999 | H13: 0 | I13: 241.55 | J13: 0 | K13: 0 | L13: =SUM(RC[-4]:RC[-1]) -> 241.55 | M13: 0 | N13: 1516.95 | O13: 0 | P13: 0 | Q13: =SUM(RC[-4]:RC[-1]) -> 1516.95 | R13: 0 | S13: 0 | T13: 0 | U13: 0 | V13: =SUM(RC[-4]:RC[-1]) -> 0 | W13: 0 | X13: 613.08000000000004 | Y13: 0 | Z13: 0 | AA13: =SUM(RC[-4]:RC[-1]) -> 613.08000000000004 | AB13: 0 | AC13: 3590.55 | AD13: 0 | AE13: 0 | AF13: =SUM(RC[-4]:RC[-1]) -> 3590.55 | AG13: 0 | AH13: 5780.58 | AI13: 0 | AJ13: 0 | AK13: =SUM(RC[-4]:RC[-1]) -> 5780.58 | AL13: 0 | AM13: 3152.17 | AN13: 0 | AO13: 0 | AP13: =SUM(RC[-4]:RC[-1]) -> 3152.17 | AQ13: 0 | AR13: 179.3 | AS13: 0 | AT13: 0 | AU13: =SUM(RC[-4]:RC[-1]) -> 179.3 | AV13: 0 | AW13: 1978.66 | AX13: 0 | AY13: 0 | AZ13: =SUM(RC[-4]:RC[-1]) -> 1978.66 | BA13: 0 | BB13: 2717.4899 | BC13: 0 | BD13: 0 | BE13: =SUM(RC[-4]:RC[-1]) -> 2717.4899 | BF13: 0 | BG13: 1197.6400000000001 | BH13: 0 | BI13: 0 | BJ13: =SUM(RC[-4]:RC[-1]) -> 1197.6400000000001 | BK13: 0 | BL13: 2191.15 | BM13: 0 | BN13: 0 | BO13: =SUM(RC[-4]:RC[-1]) -> 2191.15 | BP13: 0 | BQ13: 461.01 | BR13: 0 | BS13: 0 | BT13: =SUM(RC[-4]:RC[-1]) -> 461.01 | BU13: 0 | BV13: 307.01 | BW13: 0 | BX13: 0 | BY13: =SUM(RC[-4]:RC[-1]) -> 307.01 | BZ13: 0 | CA13: 2277.37 | CB13: 0 | CC13: 0 | CD13: =SUM(RC[-4]:RC[-1]) -> 2277.37 | CE13: 0 | CF13: 741.69 | CG13: 0 | CH13: 0 | CI13: =SUM(RC[-4]:RC[-1]) -> 741.69 | CJ13: 0 | CK13: 2149.58 | CL13: 0 | CM13: 0 | CN13: =SUM(RC[-4]:RC[-1]) -> 2149.58 | CO13: 0 | CP13: 95.38 | CQ13: 0 | CR13: 0 | CS13: =SUM(RC[-4]:RC[-1]) -> 95.38 | CT13: 0 | CU13: 2941 | CV13: 0 | CW13: 0 | CX13: =SUM(RC[-4]:RC[-1]) -> 2941 | CY13: 0 | CZ13: 94.18 | DA13: 0 | DB13: 0 | DC13: =SUM(RC[-4]:RC[-1]) -> 94.18 | DD13: 0 | DE13: 0 | DF13: 0 | DG13: 0 | DH13: =SUM(RC[-4]:RC[-1]) -> 0 | DI13: 0 | DJ13: 2326.6 | DK13: 0 | DL13: 0 | DM13: =SUM(RC[-4]:RC[-1]) -> 2326.6 | DN13: 0 | DO13: 1877.27 | DP13: 0 | DQ13: 0 | DR13: =SUM(RC[-4]:RC[-1]) -> 1877.27 | DS13: 0 | DT13: 27.899899999999999 | DU13: 0 | DV13: 0 | DW13: =SUM(RC[-4]:RC[-1]) -> 27.899899999999999 | DX13: 0 | DY13: 3684.8989999999999 | DZ13: 0 | EA13: 0 | EB13: =SUM(RC[-4]:RC[-1]) -> 3684.8989999999999 | EC13: 0 | ED13: 5228.54 | EE13: 0 | EF13: 0 | EG13: =SUM(RC[-4]:RC[-1]) -> 5228.54 | EH13: 0 | EI13: 6383.43 | EJ13: 0 | EK13: 0 | EL13: =SUM(RC[-4]:RC[-1]) -> 6383.43 | EM13: 0 | EN13: 2194.3000000000002 | EO13: 0 | EP13: 0 | EQ13: =SUM(RC[-4]:RC[-1]) -> 2194.3000000000002 | ER13: 0 | ES13: 1997.8 | ET13: 0 | EU13: 0 | EV13: =SUM(RC[-4]:RC[-1]) -> 1997.8 | EW13: 0 | EX13: 0 | EY13: 0 | EZ13: 0 | FA13: =SUM(RC[-4]:RC[-1]) -> 0 | FB13: 0 | FC13: 0 | FD13: 0 | FE13: 0 | FF13: =SUM(RC[-4]:RC[-1]) -> 0 | FG13: 0 | FH13: 3097.25 | FI13: 0 | FJ13: 0 | FK13: =SUM(RC[-4]:RC[-1]) -> 3097.25 | FL13: 0 | FM13: 6777.4 | FN13: 0 | FO13: 0 | FP13: =SUM(RC[-4]:RC[-1]) -> 6777.4 | FQ13: 0 | FR13: 6022 | FS13: 0 | FT13: 0 | FU13: =SUM(RC[-4]:RC[-1]) -> 6022 | FV13: 0 | FW13: 4678.2 | FX13: 0 | FY13: 0 | FZ13: =SUM(RC[-4]:RC[-1]) -> 4678.2 | GA13: 0 | GB13: 632.5 | GC13: 0 | GD13: 0 | GE13: =SUM(RC[-4]:RC[-1]) -> 632.5 | GF13: 0 | GG13: 3556.84 | GH13: 0 | GI13: 0 | GJ13: =SUM(RC[-4]:RC[-1]) -> 3556.84 | GK13: 0 | GL13: 1917 | GM13: 0 | GN13: 0 | GO13: =SUM(RC[-4]:RC[-1]) -> 1917 | GP13: 0 | GQ13: 2437.1 | GR13: 0 | GS13: 0 | GT13: =SUM(RC[-4]:RC[-1]) -> 2437.1 | GU13: 0 | GV13: 18.79 | GW13: 0 | GX13: 0 | GY13: =SUM(RC[-4]:RC[-1]) -> 18.79 | GZ13: 0 | HA13: 7.44 | HB13: 0 | HC13: 0 | HD13: =SUM(RC[-4]:RC[-1]) -> 7.44 | HE13: 0 | HF13: 2462.3000000000002 | HG13: 0 | HH13: 0 | HI13: =SUM(RC[-4]:RC[-1]) -> 2462.3000000000002 | HJ13: 0 | HK13: 0 | HL13: 0 | HM13: 0 | HN13: =SUM(RC[-4]:RC[-1]) -> 0 | HO13: 0 | HP13: 0 | HQ13: 0 | HR13: 0 | HS13: =SUM(RC[-4]:RC[-1]) -> 0 | HT13: 0 | HU13: 793.9 | HV13: 0 | HW13: 0 | HX13: =SUM(RC[-4]:RC[-1]) -> 793.9 | HY13: 0 | HZ13: 16.399999999999999 | IA13: 0 | IB13: 0 | IC13: =SUM(RC[-4]:RC[-1]) -> 16.399999999999999 | ID13: 0 | IE13: 197.22 | IF13: 0 | IG13: 0 | IH13: =SUM(RC[-4]:RC[-1]) -> 197.22 | II13: 0 | IJ13: 565.75 | IK13: 0 | IL13: 0 | IM13: =SUM(RC[-4]:RC[-1]) -> 565.75
A14: BENZ (A) ANTHR | B14: =RC[8]+RC[13]+RC[18]+RC[23]+RC[28]+RC[33]+RC[38]+RC[43]+RC[48]+RC[53]+RC[58]+RC[63]+RC[68]+RC[73]+RC[78]+RC[83]+RC[88]+RC[93]+RC[98]+RC[103]+RC[108]+RC[113]+RC[118]+RC[123]+RC[128]+RC[133]+RC[138]+RC[143]+RC[148]+RC[153]+RC[158]+RC[163]+RC[168]+RC[173]+RC[178]+RC[183]+RC[188]+RC[193]+RC[198]+RC[203]+RC[208]+RC[213]+RC[218]+RC[223]+RC[228]+RC[233]+RC[238]+RC[243]+Sheet2!RC[2]+Sheet2!RC[7]+Sheet2!RC[12]+Sheet2!RC[17]+Sheet2!RC[22]+Sheet2!RC[27]+Sheet2!RC[32]+Sheet2!RC[37]+Sheet2!RC[42]+Sheet2!RC[47]+Sheet2!RC[57]+Sheet2!RC[52]+Sheet2!RC[62]+Sheet2!RC[67] -> 80 | C14: =RC[6]+RC[11]+RC[16]+RC[21]+RC[26]+RC[31]+RC[36]+RC[41]+RC[46]+RC[51]+RC[56]+RC[61]+RC[66]+RC[71]+RC[76]+RC[81]+RC[86]+RC[91]+RC[96]+RC[101]+RC[106]+RC[111]+RC[116]+RC[121]+RC[126]+RC[131]+RC[136]+RC[141]+RC[146]+RC[151]+RC[156]+RC[161]+RC[166]+RC[171]+RC[176]+RC[181]+RC[186]+RC[191]+RC[196]+RC[201]+RC[206]+RC[211]+RC[216]+RC[221]+RC[226]+RC[231]+RC[236]+RC[241]+Sheet2!RC+Sheet2!RC[5]+Sheet2!RC[10]+Sheet2!RC[15]+Sheet2!RC[20]+Sheet2!RC[25]+Sheet2!RC[30]+Sheet2!RC[35]+Sheet2!RC[40]+Sheet2!RC[45]+Sheet2!RC[50]+Sheet2!RC[55]+Sheet2!RC[60]+Sheet2!RC[65] -> 399.12698000000012 | D14: =RC[4]+RC[9]+RC[14]+RC[19]+RC[24]+RC[29]+RC[34]+RC[39]+RC[44]+RC[49]+RC[54]+RC[59]+RC[64]+RC[69]+RC[74]+RC[79]+RC[84]+RC[89]+RC[94]+RC[99]+RC[104]+RC[109]+RC[114]+RC[119]+RC[124]+RC[129]+RC[134]+RC[139]+RC[144]+RC[149]+RC[154]+RC[159]+RC[164]+RC[169]+RC[174]+RC[179]+RC[184]+RC[189]+RC[194]+RC[199]+RC[204]+RC[209]+RC[214]+RC[219]+RC[224]+RC[229]+RC[234]+RC[239]+Sheet2!RC[3]+Sheet2!RC[-2]+Sheet2!RC[8]+Sheet2!RC[13]+Sheet2!RC[18]+Sheet2!RC[23]+Sheet2!RC[28]+Sheet2!RC[33]+Sheet2!RC[38]+Sheet2!RC[43]+Sheet2!RC[48]+Sheet2!RC[53]+Sheet2!RC[58]+Sheet2!RC[63] -> 0 | E14: =RC[6]+RC[11]+RC[16]+RC[21]+RC[26]+RC[31]+RC[36]+RC[41]+RC[46]+RC[51]+RC[56]+RC[61]+RC[66]+RC[71]+RC[76]+RC[81]+RC[86]+RC[91]+RC[96]+RC[101]+RC[106]+RC[111]+RC[116]+RC[121]+RC[126]+RC[131]+RC[136]+RC[141]+RC[146]+RC[151]+RC[156]+RC[161]+RC[166]+RC[171]+RC[176]+RC[181]+RC[186]+RC[191]+RC[196]+RC[201]+RC[206]+RC[211]+RC[216]+RC[221]+RC[226]+RC[231]+RC[236]+RC[241]+Sheet2!RC+Sheet2!RC[5]+Sheet2!RC[10]+Sheet2!RC[15]+Sheet2!RC[20]+Sheet2!RC[25]+Sheet2!RC[30]+Sheet2!RC[35]+Sheet2!RC[40]+Sheet2!RC[45]+Sheet2!RC[50]+Sheet2!RC[55]+Sheet2!RC[60]+Sheet2!RC[65] -> 375.30752816126216 | F14: =SUM(RC[-4]:RC[-1]) -> 854.43450816126233 | G14: =Sheet1!RC[5]+Sheet1!RC[10]+Sheet1!RC[15]+Sheet1!RC[20]+Sheet1!RC[25]+Sheet1!RC[30]+Sheet1!RC[35]+Sheet1!RC[40]+Sheet1!RC[45]+Sheet1!RC[50]+Sheet1!RC[55]+Sheet1!RC[60]+Sheet1!RC[65]+Sheet1!RC[70]+Sheet1!RC[75]+Sheet1!RC[80]+Sheet1!RC[85]+Sheet1!RC[90]+Sheet1!RC[95]+Sheet1!RC[100]+Sheet1!RC[105]+Sheet1!RC[110]+Sheet1!RC[115]+Sheet1!RC[120]+Sheet1!RC[125]+Sheet1!RC[130]+Sheet1!RC[135]+Sheet1!RC[140]+Sheet1!RC[145]+Sheet1!RC[150]+Sheet1!RC[155]+Sheet1!RC[160]+Sheet1!RC[165]+Sheet1!RC[170]+Sheet1!RC[175]+Sheet1!RC[180]+Sheet1!RC[185]+Sheet1!RC[190]+Sheet1!RC[195]+Sheet1!RC[200]+Sheet1!RC[205]+Sheet1!RC[210]+Sheet1!RC[215]+Sheet1!RC[220]+Sheet1!RC[225]+Sheet1!RC[230]+Sheet1!RC[235]+Sheet1!RC[240]+Sheet2!RC[-1]+Sheet2!RC[4]+Sheet2!RC[9]+Sheet2!RC[14]+Sheet2!RC[19]+Sheet2!RC[24]+Sheet2!RC[29]+Sheet2!RC[34]+Sheet2!RC[39]+Sheet2!RC[44]+Sheet2!RC[49]+Sheet2!RC[54]+Sheet2!RC[59]+Sheet2!RC[64] -> 854.43450816126187 | H14: 0 | I14: 4.7690000000000001 | J14: 0 | K14: 7.040824343191999 | L14: =SUM(RC[-4]:RC[-1]) -> 11.809824343191998 | M14: 0 | N14: 3.0390000000000001 | O14: 0 | P14: 1.6608417270360001 | Q14: =SUM(RC[-4]:RC[-1]) -> 4.6998417270360004 | R14: 0 | S14: 0 | T14: 0 | U14: 6.5126221856999988 | V14: =SUM(RC[-4]:RC[-1]) -> 6.5126221856999988 | W14: 0 | X14: 3.74 | Y14: 0 | Z14: 3.8254157442740007 | AA14: =SUM(RC[-4]:RC[-1]) -> 7.5654157442740004 | AB14: 0 | AC14: 13.43 | AD14: 0 | AE14: 7.5916416516559995 | AF14: =SUM(RC[-4]:RC[-1]) -> 21.021641651655997 | AG14: 0 | AH14: 0 | AI14: 0 | AJ14: 2.0133234806700018 | AK14: =SUM(RC[-4]:RC[-1]) -> 2.0133234806700018 | AL14: 0 | AM14: 0 | AN14: 0 | AO14: 5.8095721115299988 | AP14: =SUM(RC[-4]:RC[-1]) -> 5.8095721115299988 | AQ14: 0 | AR14: 6.4 | AS14: 0 | AT14: 1.5546706780599999 | AU14: =SUM(RC[-4]:RC[-1]) -> 7.9546706780600003 | AV14: 0 | AW14: 6.13 | AX14: 0 | AY14: 2.2268516547720001 | AZ14: =SUM(RC[-4]:RC[-1]) -> 8.3568516547720009 | BA14: 0 | BB14: 4.01999 | BC14: 0 | BD14: 2.7566884818360013 | BE14: =SUM(RC[-4]:RC[-1]) -> 6.7766784818360009 | BF14: 0 | BG14: 2.5990000000000002 | BH14: 0 | BI14: 2.0990181369999998 | BJ14: =SUM(RC[-4]:RC[-1]) -> 4.698018137 | BK14: 0 | BL14: 0.86 | BM14: 0 | BN14: 2.0802943462880008 | BO14: =SUM(RC[-4]:RC[-1]) -> 2.9402943462880007 | BP14: 0 | BQ14: 6.8 | BR14: 0 | BS14: 3.0388660939759999 | BT14: =SUM(RC[-4]:RC[-1]) -> 9.8388660939759998 | BU14: 0 | BV14: 12.68 | BW14: 0 | BX14: 6.6060353935680025 | BY14: =SUM(RC[-4]:RC[-1]) -> 19.286035393568003 | BZ14: 0 | CA14: 7.0000000000000007E-2 | CB14: 70 | CC14: 19.730545997260009 | CD14: =SUM(RC[-4]:RC[-1]) -> 89.800545997260002 | CE14: 0 | CF14: 12.71 | CG14: 0 | CH14: 4.7149735144620015 | CI14: =SUM(RC[-4]:RC[-1]) -> 17.424973514462003 | CJ14: 0 | CK14: 1.61 | CL14: 0 | CM14: 1.846049632236 | CN14: =SUM(RC[-4]:RC[-1]) -> 3.4560496322360001 | CO14: 0 | CP14: 1.45 | CQ14: 0 | CR14: 1.4739512431260002 | CS14: =SUM(RC[-4]:RC[-1]) -> 2.923951243126 | CT14: 0 | CU14: 0.36 | CV14: 0 | CW14: 1.4566814177579996 | CX14: =SUM(RC[-4]:RC[-1]) -> 1.8166814177579997 | CY14: 0 | CZ14: 6.15 | DA14: 0 | DB14: 1.3855752837779993 | DC14: =SUM(RC[-4]:RC[-1]) -> 7.5355752837779999 | DD14: 0 | DE14: 0.1 | DF14: 0 | DG14: 0.58534979787399988 | DH14: =SUM(RC[-4]:RC[-1]) -> 0.68534979787399986 | DI14: 0 | DJ14: 1.95 | DK14: 0 | DL14: 2.691618730645998 | DM14: =SUM(RC[-4]:RC[-1]) -> 4.6416187306459982 | DN14: 0 | DO14: 0 | DP14: 0 | DQ14: 2.0943053189819998 | DR14: =SUM(RC[-4]:RC[-1]) -> 2.0943053189819998 | DS14: 0 | DT14: 0 | DU14: 0 | DV14: 15.673379454723998 | DW14: =SUM(RC[-4]:RC[-1]) -> 15.673379454723998 | DX14: 0 | DY14: 0.18 | DZ14: 0 | EA14: 1.6198395120639986 | EB14: =SUM(RC[-4]:RC[-1]) -> 1.7998395120639985 | EC14: 0 | ED14: 0 | EE14: 0 | EF14: 1.5722896372279997 | EG14: =SUM(RC[-4]:RC[-1]) -> 1.5722896372279997 | EH14: 0 | EI14: 0.2 | EJ14: 0 | EK14: 1.0996326953919999 | EL14: =SUM(RC[-4]:RC[-1]) -> 1.2996326953919999 | EM14: 0 | EN14: 0 | EO14: 0 | EP14: 17.432226521251994 | EQ14: =SUM(RC[-4]:RC[-1]) -> 17.432226521251994 | ER14: 0 | ES14: 0 | ET14: 0 | EU14: 1.0091048016840003 | EV14: =SUM(RC[-4]:RC[-1]) -> 1.0091048016840003 | EW14: 0 | EX14: 0 | EY14: 0 | EZ14: 29.956221740059984 | FA14: =SUM(RC[-4]:RC[-1]) -> 29.956221740059984 | FB14: 0 | FC14: 0 | FD14: 0 | FE14: 36.482740946650011 | FF14: =SUM(RC[-4]:RC[-1]) -> 36.482740946650011 | FG14: 0 | FH14: 0 | FI14: 0 | FJ14: 4.5962281746279992 | FK14: =SUM(RC[-4]:RC[-1]) -> 4.5962281746279992 | FL14: 0 | FM14: 0.14000000000000001 | FN14: 10 | FO14: 4.9836321253760012 | FP14: =SUM(RC[-4]:RC[-1]) -> 15.123632125376002 | FQ14: 0 | FR14: 0 | FS14: 0 | FT14: 10.254955674396001 | FU14: =SUM(RC[-4]:RC[-1]) -> 10.254955674396001 | FV14: 0 | FW14: 3.8 | FX14: 0 | FY14: 2.7335797859419997 | FZ14: =SUM(RC[-4]:RC[-1]) -> 6.5335797859419991 | GA14: 0 | GB14: 118.16 | GC14: 0 | GD14: 6.6006434713980022 | GE14: =SUM(RC[-4]:RC[-1]) -> 124.760643471398 | GF14: 0 | GG14: 0.02 | GH14: 0 | GI14: 0.8536955555639999 | GJ14: =SUM(RC[-4]:RC[-1]) -> 0.87369555556399991 | GK14: 0 | GL14: 0 | GM14: 0 | GN14: 2.9595533100720011 | GO14: =SUM(RC[-4]:RC[-1]) -> 2.9595533100720011 | GP14: 0 | GQ14: 0.23 | GR14: 0 | GS14: 2.2823140246479992 | GT14: =SUM(RC[-4]:RC[-1]) -> 2.5123140246479991 | GU14: 0 | GV14: 2.67 | GW14: 0 | GX14: 2.2637895411259992 | GY14: =SUM(RC[-4]:RC[-1]) -> 4.9337895411259991 | GZ14: 0 | HA14: 0 | HB14: 0 | HC14: 20.084871275019996 | HD14: =SUM(RC[-4]:RC[-1]) -> 20.084871275019996 | HE14: 0 | HF14: 6.21 | HG14: 0 | HH14: 3.1138702829519991 | HI14: =SUM(RC[-4]:RC[-1]) -> 9.323870282951999 | HJ14: 0 | HK14: 0 | HL14: 0 | HM14: 5.7679445035299972 | HN14: =SUM(RC[-4]:RC[-1]) -> 5.7679445035299972 | HO14: 0 | HP14: 40 | HQ14: 0 | HR14: 6.7846478890700004 | HS14: =SUM(RC[-4]:RC[-1]) -> 46.784647889070001 | HT14: 0 | HU14: 7.36 | HV14: 0 | HW14: 2.8124504139579996 | HX14: =SUM(RC[-4]:RC[-1]) -> 10.172450413958 | HY14: 0 | HZ14: 0.18 | IA14: 0 | IB14: 4.5671098171720006 | IC14: =SUM(RC[-4]:RC[-1]) -> 4.7471098171720003 | ID14: 0 | IE14: 7.44 | IF14: 0 | IG14: 2.2551427273280011 | IH14: =SUM(RC[-4]:RC[-1]) -> 9.6951427273280011 | II14: 0 | IJ14: 4.1199899999999996 | IK14: 0 | IL14: 0.48938809327000005 | IM14: =SUM(RC[-4]:RC[-1]) -> 4.6093780932699993
A15: BENZ (GHI) PE | B15: =RC[8]+RC[13]+RC[18]+RC[23]+RC[28]+RC[33]+RC[38]+RC[43]+RC[48]+RC[53]+RC[58]+RC[63]+RC[68]+RC[73]+RC[78]+RC[83]+RC[88]+RC[93]+RC[98]+RC[103]+RC[108]+RC[113]+RC[118]+RC[123]+RC[128]+RC[133]+RC[138]+RC[143]+RC[148]+RC[153]+RC[158]+RC[163]+RC[168]+RC[173]+RC[178]+RC[183]+RC[188]+RC[193]+RC[198]+RC[203]+RC[208]+RC[213]+RC[218]+RC[223]+RC[228]+RC[233]+RC[238]+RC[243]+Sheet2!RC[2]+Sheet2!RC[7]+Sheet2!RC[12]+Sheet2!RC[17]+Sheet2!RC[22]+Sheet2!RC[27]+Sheet2!RC[32]+Sheet2!RC[37]+Sheet2!RC[42]+Sheet2!RC[47]+Sheet2!RC[57]+Sheet2!RC[52]+Sheet2!RC[62]+Sheet2!RC[67] -> 0 | C15: =RC[6]+RC[11]+RC[16]+RC[21]+RC[26]+RC[31]+RC[36]+RC[41]+RC[46]+RC[51]+RC[56]+RC[61]+RC[66]+RC[71]+RC[76]+RC[81]+RC[86]+RC[91]+RC[96]+RC[101]+RC[106]+RC[111]+RC[116]+RC[121]+RC[126]+RC[131]+RC[136]+RC[141]+RC[146]+RC[151]+RC[156]+RC[161]+RC[166]+RC[171]+RC[176]+RC[181]+RC[186]+RC[191]+RC[196]+RC[201]+RC[206]+RC[211]+RC[216]+RC[221]+RC[226]+RC[231]+RC[236]+RC[241]+Sheet2!RC+Sheet2!RC[5]+Sheet2!RC[10]+Sheet2!RC[15]+Sheet2!RC[20]+Sheet2!RC[25]+Sheet2!RC[30]+Sheet2!RC[35]+Sheet2!RC[40]+Sheet2!RC[45]+Sheet2!RC[50]+Sheet2!RC[55]+Sheet2!RC[60]+Sheet2!RC[65] -> 0 | D15: =RC[4]+RC[9]+RC[14]+RC[19]+RC[24]+RC[29]+RC[34]+RC[39]+RC[44]+RC[49]+RC[54]+RC[59]+RC[64]+RC[69]+RC[74]+RC[79]+RC[84]+RC[89]+RC[94]+RC[99]+RC[104]+RC[109]+RC[114]+RC[119]+RC[124]+RC[129]+RC[134]+RC[139]+RC[144]+RC[149]+RC[154]+RC[159]+RC[164]+RC[169]+RC[174]+RC[179]+RC[184]+RC[189]+RC[194]+RC[199]+RC[204]+RC[209]+RC[214]+RC[219]+RC[224]+RC[229]+RC[234]+RC[239]+Sheet2!RC[3]+Sheet2!RC[-2]+Sheet2!RC[8]+Sheet2!RC[13]+Sheet2!RC[18]+Sheet2!RC[23]+Sheet2!RC[28]+Sheet2!RC[33]+Sheet2!RC[38]+Sheet2!RC[43]+Sheet2!RC[48]+Sheet2!RC[53]+Sheet2!RC[58]+Sheet2!RC[63] -> 0 | E15: =RC[6]+RC[11]+RC[16]+RC[21]+RC[26]+RC[31]+RC[36]+RC[41]+RC[46]+RC[51]+RC[56]+RC[61]+RC[66]+RC[71]+RC[76]+RC[81]+RC[86]+RC[91]+RC[96]+RC[101]+RC[106]+RC[111]+RC[116]+RC[121]+RC[126]+RC[131]+RC[136]+RC[141]+RC[146]+RC[151]+RC[156]+RC[161]+RC[166]+RC[171]+RC[176]+RC[181]+RC[186]+RC[191]+RC[196]+RC[201]+RC[206]+RC[211]+RC[216]+RC[221]+RC[226]+RC[231]+RC[236]+RC[241]+Sheet2!RC+Sheet2!RC[5]+Sheet2!RC[10]+Sheet2!RC[15]+Sheet2!RC[20]+Sheet2!RC[25]+Sheet2!RC[30]+Sheet2!RC[35]+Sheet2!RC[40]+Sheet2!RC[45]+Sheet2!RC[50]+Sheet2!RC[55]+Sheet2!RC[60]+Sheet2!RC[65] -> 737.38976873362799 | F15: =SUM(RC[-4]:RC[-1]) -> 737.38976873362799 | G15: =Sheet1!RC[5]+Sheet1!RC[10]+Sheet1!RC[15]+Sheet1!RC[20]+Sheet1!RC[25]+Sheet1!RC[30]+Sheet1!RC[35]+Sheet1!RC[40]+Sheet1!RC[45]+Sheet1!RC[50]+Sheet1!RC[55]+Sheet1!RC[60]+Sheet1!RC[65]+Sheet1!RC[70]+Sheet1!RC[75]+Sheet1!RC[80]+Sheet1!RC[85]+Sheet1!RC[90]+Sheet1!RC[95]+Sheet1!RC[100]+Sheet1!RC[105]+Sheet1!RC[110]+Sheet1!RC[115]+Sheet1!RC[120]+Sheet1!RC[125]+Sheet1!RC[130]+Sheet1!RC[135]+Sheet1!RC[140]+Sheet1!RC[145]+Sheet1!RC[150]+Sheet1!RC[155]+Sheet1!RC[160]+Sheet1!RC[165]+Sheet1!RC[170]+Sheet1!RC[175]+Sheet1!RC[180]+Sheet1!RC[185]+Sheet1!RC[190]+Sheet1!RC[195]+Sheet1!RC[200]+Sheet1!RC[205]+Sheet1!RC[210]+Sheet1!RC[215]+Sheet1!RC[220]+Sheet1!RC[225]+Sheet1!RC[230]+Sheet1!RC[235]+Sheet1!RC[240]+Sheet2!RC[-1]+Sheet2!RC[4]+Sheet2!RC[9]+Sheet2!RC[14]+Sheet2!RC[19]+Sheet2!RC[24]+Sheet2!RC[29]+Sheet2!RC[34]+Sheet2!RC[39]+Sheet2!RC[44]+Sheet2!RC[49]+Sheet2!RC[54]+Sheet2!RC[59]+Sheet2!RC[64] -> 737.38976873362799 | H15: 0 | I15: 0 | J15: 0 | K15: 13.871737978110001 | L15: =SUM(RC[-4]:RC[-1]) -> 13.871737978110001 | M15: 0 | N15: 0 | O15: 0 | P15: 3.27168081088 | Q15: =SUM(RC[-4]:RC[-1]) -> 3.27168081088 | R15: 0 | S15: 0 | T15: 0 | U15: 12.831311825679997 | V15: =SUM(RC[-4]:RC[-1]) -> 12.831311825679997 | W15: 0 | X15: 0 | Y15: 0 | Z15: 7.5267392507000004 | AA15: =SUM(RC[-4]:RC[-1]) -> 7.5267392507000004 | AB15: 0 | AC15: 0 | AD15: 0 | AE15: 14.95689936094 | AF15: =SUM(RC[-4]:RC[-1]) -> 14.95689936094 | AG15: 0 | AH15: 0 | AI15: 0 | AJ15: 3.9666835761800012 | AK15: =SUM(RC[-4]:RC[-1]) -> 3.9666835761800012 | AL15: 0 | AM15: 0 | AN15: 0 | AO15: 11.444778349797998 | AP15: =SUM(RC[-4]:RC[-1]) -> 11.444778349797998 | AQ15: 0 | AR15: 0 | AS15: 0 | AT15: 3.0526630616639987 | AU15: =SUM(RC[-4]:RC[-1]) -> 3.0526630616639987 | AV15: 0 | AW15: 0 | AX15: 0 | AY15: 4.3868093187900019 | AZ15: =SUM(RC[-4]:RC[-1]) -> 4.3868093187900019 | BA15: 0 | BB15: 0 | BC15: 0 | BD15: 5.4294850034040003 | BE15: =SUM(RC[-4]:RC[-1]) -> 5.4294850034040003 | BF15: 0 | BG15: 0 | BH15: 0 | BI15: 4.1347499625919992 | BJ15: =SUM(RC[-4]:RC[-1]) -> 4.1347499625919992 | BK15: 0 | BL15: 0 | BM15: 0 | BN15: 4.098544820402001 | BO15: =SUM(RC[-4]:RC[-1]) -> 4.098544820402001 | BP15: 0 | BQ15: 0 | BR15: 0 | BS15: 5.9870319964739993 | BT15: =SUM(RC[-4]:RC[-1]) -> 5.9870319964739993 | BU15: 0 | BV15: 0 | BW15: 0 | BX15: 13.012740862350002 | BY15: =SUM(RC[-4]:RC[-1]) -> 13.012740862350002 | BZ15: 0 | CA15: 0 | CB15: 0 | CC15: 38.722894763090004 | CD15: =SUM(RC[-4]:RC[-1]) -> 38.722894763090004 | CE15: 0 | CF15: 0 | CG15: 0 | CH15: 9.2894708121760026 | CI15: =SUM(RC[-4]:RC[-1]) -> 9.2894708121760026 | CJ15: 0 | CK15: 0 | CL15: 0 | CM15: 3.6359863921599986 | CN15: =SUM(RC[-4]:RC[-1]) -> 3.6359863921599986 | CO15: 0 | CP15: 0 | CQ15: 0 | CR15: 2.9040004763239993 | CS15: =SUM(RC[-4]:RC[-1]) -> 2.9040004763239993 | CT15: 0 | CU15: 0 | CV15: 0 | CW15: 2.8699509110159984 | CX15: =SUM(RC[-4]:RC[-1]) -> 2.8699509110159984 | CY15: 0 | CZ15: 0 | DA15: 0 | DB15: 2.7298786411920002 | DC15: =SUM(RC[-4]:RC[-1]) -> 2.7298786411920002 | DD15: 0 | DE15: 0 | DF15: 0 | DG15: 1.1532623587979991 | DH15: =SUM(RC[-4]:RC[-1]) -> 1.1532623587979991 | DI15: 0 | DJ15: 0 | DK15: 0 | DL15: 5.3030577596540001 | DM15: =SUM(RC[-4]:RC[-1]) -> 5.3030577596540001 | DN15: 0 | DO15: 0 | DP15: 0 | DQ15: 4.1227209477099995 | DR15: =SUM(RC[-4]:RC[-1]) -> 4.1227209477099995 | DS15: 0 | DT15: 0 | DU15: 0 | DV15: 30.88005534101401 | DW15: =SUM(RC[-4]:RC[-1]) -> 30.88005534101401 | DX15: 0 | DY15: 0 | DZ15: 0 | EA15: 3.1914242633919976 | EB15: =SUM(RC[-4]:RC[-1]) -> 3.1914242633919976 | EC15: 0 | ED15: 0 | EE15: 0 | EF15: 3.0973317194419989 | EG15: =SUM(RC[-4]:RC[-1]) -> 3.0973317194419989 | EH15: 0 | EI15: 0 | EJ15: 0 | EK15: 2.1665014374619993 | EL15: =SUM(RC[-4]:RC[-1]) -> 2.1665014374619993 | EM15: 0 | EN15: 0 | EO15: 0 | EP15: 34.336212188860003 | EQ15: =SUM(RC[-4]:RC[-1]) -> 34.336212188860003 | ER15: 0 | ES15: 0 | ET15: 0 | EU15: 1.9881566205840009 | EV15: =SUM(RC[-4]:RC[-1]) -> 1.9881566205840009 | EW15: 0 | EX15: 0 | EY15: 0 | EZ15: 59.020391905738016 | FA15: =SUM(RC[-4]:RC[-1]) -> 59.020391905738016 | FB15: 0 | FC15: 0 | FD15: 0 | FE15: 71.879216788559972 | FF15: =SUM(RC[-4]:RC[-1]) -> 71.879216788559972 | FG15: 0 | FH15: 0 | FI15: 0 | FJ15: 9.0548331549799919 | FK15: =SUM(RC[-4]:RC[-1]) -> 9.0548331549799919 | FL15: 0 | FM15: 0 | FN15: 0 | FO15: 9.8183401027419972 | FP15: =SUM(RC[-4]:RC[-1]) -> 9.8183401027419972 | FQ15: 0 | FR15: 0 | FS15: 0 | FT15: 20.108356964529996 | FU15: =SUM(RC[-4]:RC[-1]) -> 20.108356964529996 | FV15: 0 | FW15: 0 | FX15: 0 | FY15: 5.3857524117100004 | FZ15: =SUM(RC[-4]:RC[-1]) -> 5.3857524117100004 | GA15: 0 | GB15: 0 | GC15: 0 | GD15: 12.999945183442005 | GE15: =SUM(RC[-4]:RC[-1]) -> 12.999945183442005 | GF15: 0 | GG15: 0 | GH15: 0 | GI15: 1.6819651526319992 | GJ15: =SUM(RC[-4]:RC[-1]) -> 1.6819651526319992 | GK15: 0 | GL15: 0 | GM15: 0 | GN15: 5.8309511398679987 | GO15: =SUM(RC[-4]:RC[-1]) -> 5.8309511398679987 | GP15: 0 | GQ15: 0 | GR15: 0 | GS15: 4.4962965221099989 | GT15: =SUM(RC[-4]:RC[-1]) -> 4.4962965221099989 | GU15: 0 | GV15: 0 | GW15: 0 | GX15: 4.4601575898639982 | GY15: =SUM(RC[-4]:RC[-1]) -> 4.4601575898639982 | GZ15: 0 | HA15: 0 | HB15: 0 | HC15: 37.886216268350019 | HD15: =SUM(RC[-4]:RC[-1]) -> 37.886216268350019 | HE15: 0 | HF15: 0 | HG15: 0 | HH15: 6.1349944708379995 | HI15: =SUM(RC[-4]:RC[-1]) -> 6.1349944708379995 | HJ15: 0 | HK15: 0 | HL15: 0 | HM15: 11.364124368920004 | HN15: =SUM(RC[-4]:RC[-1]) -> 11.364124368920004 | HO15: 0 | HP15: 0 | HQ15: 0 | HR15: 13.367244388810001 | HS15: =SUM(RC[-4]:RC[-1]) -> 13.367244388810001 | HT15: 0 | HU15: 0 | HV15: 0 | HW15: 5.5400392212139984 | HX15: =SUM(RC[-4]:RC[-1]) -> 5.5400392212139984 | HY15: 0 | HZ15: 0 | IA15: 0 | IB15: 8.9977673178700002 | IC15: =SUM(RC[-4]:RC[-1]) -> 8.9977673178700002 | ID15: 0 | IE15: 0 | IF15: 0 | IG15: 4.442401454456002 | IH15: =SUM(RC[-4]:RC[-1]) -> 4.442401454456002 | II15: 0 | IJ15: 0 | IK15: 0 | IL15: 0.96420201190199994 | IM15: =SUM(RC[-4]:RC[-1]) -> 0.96420201190199994
A16: BENZENE | B16: =RC[8]+RC[13]+RC[18]+RC[23]+RC[28]+RC[33]+RC[38]+RC[43]+RC[48]+RC[53]+RC[58]+RC[63]+RC[68]+RC[73]+RC[78]+RC[83]+RC[88]+RC[93]+RC[98]+RC[103]+RC[108]+RC[113]+RC[118]+RC[123]+RC[128]+RC[133]+RC[138]+RC[143]+RC[148]+RC[153]+RC[158]+RC[163]+RC[168]+RC[173]+RC[178]+RC[183]+RC[188]+RC[193]+RC[198]+RC[203]+RC[208]+RC[213]+RC[218]+RC[223]+RC[228]+RC[233]+RC[238]+RC[243]+Sheet2!RC[2]+Sheet2!RC[7]+Sheet2!RC[12]+Sheet2!RC[17]+Sheet2!RC[22]+Sheet2!RC[27]+Sheet2!RC[32]+Sheet2!RC[37]+Sheet2!RC[42]+Sheet2!RC[47]+Sheet2!RC[57]+Sheet2!RC[52]+Sheet2!RC[62]+Sheet2!RC[67] -> 305041.18900000007 | C16: =RC[6]+RC[11]+RC[16]+RC[21]+RC[26]+RC[31]+RC[36]+RC[41]+RC[46]+RC[51]+RC[56]+RC[61]+RC[66]+RC[71]+RC[76]+RC[81]+RC[86]+RC[91]+RC[96]+RC[101]+RC[106]+RC[111]+RC[116]+RC[121]+RC[126]+RC[131]+RC[136]+RC[141]+RC[146]+RC[151]+RC[156]+RC[161]+RC[166]+RC[171]+RC[176]+RC[181]+RC[186]+RC[191]+RC[196]+RC[201]+RC[206]+RC[211]+RC[216]+RC[221]+RC[226]+RC[231]+RC[236]+RC[241]+Sheet2!RC+Sheet2!RC[5]+Sheet2!RC[10]+Sheet2!RC[15]+Sheet2!RC[20]+Sheet2!RC[25]+Sheet2!RC[30]+Sheet2!RC[35]+Sheet2!RC[40]+Sheet2!RC[45]+Sheet2!RC[50]+Sheet2!RC[55]+Sheet2!RC[60]+Sheet2!RC[65] -> 3840934.8549999995 | D16: =RC[4]+RC[9]+RC[14]+RC[19]+RC[24]+RC[29]+RC[34]+RC[39]+RC[44]+RC[49]+RC[54]+RC[59]+RC[64]+RC[69]+RC[74]+RC[79]+RC[84]+RC[89]+RC[94]+RC[99]+RC[104]+RC[109]+RC[114]+RC[119]+RC[124]+RC[129]+RC[134]+RC[139]+RC[144]+RC[149]+RC[154]+RC[159]+RC[164]+RC[169]+RC[174]+RC[179]+RC[184]+RC[189]+RC[194]+RC[199]+RC[204]+RC[209]+RC[214]+RC[219]+RC[224]+RC[229]+RC[234]+RC[239]+Sheet2!RC[3]+Sheet2!RC[-2]+Sheet2!RC[8]+Sheet2!RC[13]+Sheet2!RC[18]+Sheet2!RC[23]+Sheet2!RC[28]+Sheet2!RC[33]+Sheet2!RC[38]+Sheet2!RC[43]+Sheet2!RC[48]+Sheet2!RC[53]+Sheet2!RC[58]+Sheet2!RC[63] -> 22637178 | E16: =RC[6]+RC[11]+RC[16]+RC[21]+RC[26]+RC[31]+RC[36]+RC[41]+RC[46]+RC[51]+RC[56]+RC[61]+RC[66]+RC[71]+RC[76]+RC[81]+RC[86]+RC[91]+RC[96]+RC[101]+RC[106]+RC[111]+RC[116]+RC[121]+RC[126]+RC[131]+RC[136]+RC[141]+RC[146]+RC[151]+RC[156]+RC[161]+RC[166]+RC[171]+RC[176]+RC[181]+RC[186]+RC[191]+RC[196]+RC[201]+RC[206]+RC[211]+RC[216]+RC[221]+RC[226]+RC[231]+RC[236]+RC[241]+Sheet2!RC+Sheet2!RC[5]+Sheet2!RC[10]+Sheet2!RC[15]+Sheet2!RC[20]+Sheet2!RC[25]+Sheet2!RC[30]+Sheet2!RC[35]+Sheet2!RC[40]+Sheet2!RC[45]+Sheet2!RC[50]+Sheet2!RC[55]+Sheet2!RC[60]+Sheet2!RC[65] -> 4925492.0081143891 | F16: =SUM(RC[-4]:RC[-1]) -> 31708646.05211439 | G16: =Sheet1!RC[5]+Sheet1!RC[10]+Sheet1!RC[15]+Sheet1!RC[20]+Sheet1!RC[25]+Sheet1!RC[30]+Sheet1!RC[35]+Sheet1!RC[40]+Sheet1!RC[45]+Sheet1!RC[50]+Sheet1!RC[55]+Sheet1!RC[60]+Sheet1!RC[65]+Sheet1!RC[70]+Sheet1!RC[75]+Sheet1!RC[80]+Sheet1!RC[85]+Sheet1!RC[90]+Sheet1!RC[95]+Sheet1!RC[100]+Sheet1!RC[105]+Sheet1!RC[110]+Sheet1!RC[115]+Sheet1!RC[120]+Sheet1!RC[125]+Sheet1!RC[130]+Sheet1!RC[135]+Sheet1!RC[140]+Sheet1!RC[145]+Sheet1!RC[150]+Sheet1!RC[155]+Sheet1!RC[160]+Sheet1!RC[165]+Sheet1!RC[170]+Sheet1!RC[175]+Sheet1!RC[180]+Sheet1!RC[185]+Sheet1!RC[190]+Sheet1!RC[195]+Sheet1!RC[200]+Sheet1!RC[205]+Sheet1!RC[210]+Sheet1!RC[215]+Sheet1!RC[220]+Sheet1!RC[225]+Sheet1!RC[230]+Sheet1!RC[235]+Sheet1!RC[240]+Sheet2!RC[-1]+Sheet2!RC[4]+Sheet2!RC[9]+Sheet2!RC[14]+Sheet2!RC[19]+Sheet2!RC[24]+Sheet2!RC[29]+Sheet2!RC[34]+Sheet2!RC[39]+Sheet2!RC[44]+Sheet2!RC[49]+Sheet2!RC[54]+Sheet2!RC[59]+Sheet2!RC[64] -> 31708646.052114394 | H16: 648271 | I16: 95619.46 | J16: 6440 | K16: 93398.473032250025 | L16: =SUM(RC[-4]:RC[-1]) -> 843728.93303225003 | M16: 83346 | N16: 9472.56 | O16: 2962.71 | P16: 18480.992191949994 | Q16: =SUM(RC[-4]:RC[-1]) -> 114262.26219194999 | R16: 654383 | S16: 173740.13 | T16: 4565.88 | U16: 84075.504877789994 | V16: =SUM(RC[-4]:RC[-1]) -> 916764.51487779 | W16: 404243 | X16: 36041.919999999998 | Y16: 561 | Z16: 53561.037951850012 | AA16: =SUM(RC[-4]:RC[-1]) -> 494406.95795185002 | AB16: 145958 | AC16: 16761.900000000001 | AD16: 0.97 | AE16: 79057.672816810024 | AF16: =SUM(RC[-4]:RC[-1]) -> 241778.54281681002 | AG16: 132451 | AH16: 14458.3 | AI16: 2328.15 | AJ16: 24352.629437810014 | AK16: =SUM(RC[-4]:RC[-1]) -> 173590.07943781 | AL16: 234554 | AM16: 15012.996999999999 | AN16: 2888.95 | AO16: 67989.60459853003 | AP16: =SUM(RC[-4]:RC[-1]) -> 320445.55159853003 | AQ16: 156567 | AR16: 17860.722000000002 | AS16: 1357.22 | AT16: 21205.800873940017 | AU16: =SUM(RC[-4]:RC[-1]) -> 196990.74287394003 | AV16: 84119 | AW16: 8398.48 | AX16: 1106.32 | AY16: 24544.929478169997 | AZ16: =SUM(RC[-4]:RC[-1]) -> 118168.72947817 | BA16: 139686 | BB16: 16925.510999999999 | BC16: 934.9 | BD16: 31682.894900720006 | BE16: =SUM(RC[-4]:RC[-1]) -> 189229.30590072001 | BF16: 118974 | BG16: 12277.28 | BH16: 41.27 | BI16: 25623.337740899984 | BJ16: =SUM(RC[-4]:RC[-1]) -> 156915.88774089998 | BK16: 103873 | BL16: 7668.78 | BM16: 610.87 | BN16: 22919.993720699978 | BO16: =SUM(RC[-4]:RC[-1]) -> 135072.64372069997 | BP16: 94189 | BQ16: 8959.7800000000007 | BR16: 44.7 | BS16: 32687.121778999994 | BT16: =SUM(RC[-4]:RC[-1]) -> 135880.60177899999 | BU16: 434707 | BV16: 49703.31 | BW16: 355.78 | BX16: 84730.388142399985 | BY16: =SUM(RC[-4]:RC[-1]) -> 569496.47814240004 | BZ16: 1320931 | CA16: 173751.56 | CB16: 72101.52 | CC16: 271600.31149180001 | CD16: =SUM(RC[-4]:RC[-1]) -> 1838384.3914918001 | CE16: 80703 | CF16: 9525.4789999999994 | CG16: 821.96 | CH16: 48819.904860759991 | CI16: =SUM(RC[-4]:RC[-1]) -> 139870.34386075998 | CJ16: 84895 | CK16: 8801.2900000000009 | CL16: 0.85 | CM16: 20892.007483380006 | CN16: =SUM(RC[-4]:RC[-1]) -> 114589.14748338002 | CO16: 77069 | CP16: 8965.84 | CQ16: 1.58 | CR16: 18109.01174680001 | CS16: =SUM(RC[-4]:RC[-1]) -> 104145.43174680001 | CT16: 169720 | CU16: 14325.79 | CV16: 402 | CW16: 18209.293197240007 | CX16: =SUM(RC[-4]:RC[-1]) -> 202657.08319724002 | CY16: 114054 | CZ16: 14322.08 | DA16: 4347.585 | DB16: 16493.900449730012 | DC16: =SUM(RC[-4]:RC[-1]) -> 149217.56544973003 | DD16: 22790 | DE16: 1086.44 | DF16: 0 | DG16: 6709.1089923800046 | DH16: =SUM(RC[-4]:RC[-1]) -> 30585.548992380005 | DI16: 136130 | DJ16: 10192.154 | DK16: 224.21 | DL16: 30342.64565454 | DM16: =SUM(RC[-4]:RC[-1]) -> 176889.00965453999 | DN16: 208489 | DO16: 21272.33 | DP16: 6963.9 | DQ16: 25772.908014469998 | DR16: =SUM(RC[-4]:RC[-1]) -> 262498.13801446999 | DS16: 1024537 | DT16: 378727.72 | DU16: 3300.71 | DV16: 217419.20725828005 | DW16: =SUM(RC[-4]:RC[-1]) -> 1623984.6372582801 | DX16: 47042 | DY16: 4830.5 | DZ16: 25.844999999999999 | EA16: 17531.098308170007 | EB16: =SUM(RC[-4]:RC[-1]) -> 69429.443308170012 | EC16: 119854 | ED16: 12804.3 | EE16: 743.02 | EF16: 18583.54826675 | EG16: =SUM(RC[-4]:RC[-1]) -> 151984.86826674998 | EH16: 124922 | EI16: 11664.9 | EJ16: 0 | EK16: 13988.015333400008 | EL16: =SUM(RC[-4]:RC[-1]) -> 150574.91533340001 | EM16: 1294424 | EN16: 133528.94 | EO16: 13728.6 | EP16: 233811.46039411993 | EQ16: =SUM(RC[-4]:RC[-1]) -> 1675493.0003941199 | ER16: 120633 | ES16: 10839.7 | ET16: 1153.28 | EU16: 12615.237445999999 | EV16: =SUM(RC[-4]:RC[-1]) -> 145241.21744600002 | EW16: 2575608 | EX16: 234842.73 | EY16: 19022.16 | EZ16: 423496.42267765017 | FA16: =SUM(RC[-4]:RC[-1]) -> 3252969.3126776502 | FB16: 821749 | FC16: 567791.30000000005 | FD16: 10155.98 | FE16: 505234.15327205986 | FF16: =SUM(RC[-4]:RC[-1]) -> 1904930.43327206 | FG16: 263173 | FH16: 31017.54 | FI16: 16264.22 | FJ16: 60131.702640140014 | FK16: =SUM(RC[-4]:RC[-1]) -> 370586.46264013997 | FL16: 406118 | FM16: 38483.699999999997 | FN16: 1634.6 | FO16: 64364.245329439975 | FP16: =SUM(RC[-4]:RC[-1]) -> 510600.54532943998 | FQ16: 787627 | FR16: 80126.100000000006 | FS16: 4629 | FT16: 142747.46564235006 | FU16: =SUM(RC[-4]:RC[-1]) -> 1015129.56564235 | FV16: 204700 | FW16: 20538.400000000001 | FX16: 388.8 | FY16: 35234.408084750001 | FZ16: =SUM(RC[-4]:RC[-1]) -> 260861.60808474998 | GA16: 546910 | GB16: 78143.100000000006 | GC16: 8288.59 | GD16: 85940.776719460002 | GE16: =SUM(RC[-4]:RC[-1]) -> 719282.46671945998 | GF16: 59714 | GG16: 7278.4 | GH16: 21.34 | GI16: 10157.472613360003 | GJ16: =SUM(RC[-4]:RC[-1]) -> 77171.212613359996 | GK16: 186290 | GL16: 19824.310000000001 | GM16: 3044.95 | GN16: 34877.460681420023 | GO16: =SUM(RC[-4]:RC[-1]) -> 244036.72068142003 | GP16: 105324 | GQ16: 10605.3 | GR16: 5.3 | GS16: 25983.86044738999 | GT16: =SUM(RC[-4]:RC[-1]) -> 141918.46044738998 | GU16: 202106 | GV16: 15862.9 | GW16: 0 | GX16: 29424.318116899998 | GY16: =SUM(RC[-4]:RC[-1]) -> 247393.21811689998 | GZ16: 1310505 | HA16: 296985.58 | HB16: 24364.400000000001 | HC16: 288635.39893453009 | HD16: =SUM(RC[-4]:RC[-1]) -> 1920490.3789345301 | HE16: 268992 | HF16: 44281.7 | HG16: 3184.9 | HH16: 37778.495692910015 | HI16: =SUM(RC[-4]:RC[-1]) -> 354237.09569291002 | HJ16: 403090 | HK16: 404616.5 | HL16: 8157.76 | HM16: 76651.603810700006 | HN16: =SUM(RC[-4]:RC[-1]) -> 892515.86381070002 | HO16: 386431 | HP16: 56017.47 | HQ16: 726.55 | HR16: 90879.567811289977 | HS16: =SUM(RC[-4]:RC[-1]) -> 534054.58781128994 | HT16: 407261 | HU16: 31047.8 | HV16: 5146.09 | HW16: 33053.554767659989 | HX16: =SUM(RC[-4]:RC[-1]) -> 476508.44476766 | HY16: 218824 | HZ16: 22678.38 | IA16: 14795.45 | IB16: 58313.263436509995 | IC16: =SUM(RC[-4]:RC[-1]) -> 314611.09343651001 | ID16: 61295 | IE16: 6604.33 | IF16: 22.43 | IG16: 31270.56108782001 | IH16: =SUM(RC[-4]:RC[-1]) -> 99192.321087820004 | II16: 28563 | IJ16: 3942.5720000000001 | IK16: 0 | IL16: 6225.5776237700011 | IM16: =SUM(RC[-4]:RC[-1]) -> 38731.149623770005
A17: BENZO (A) PYRE | B17: =RC[8]+RC[13]+RC[18]+RC[23]+RC[28]+RC[33]+RC[38]+RC[43]+RC[48]+RC[53]+RC[58]+RC[63]+RC[68]+RC[73]+RC[78]+RC[83]+RC[88]+RC[93]+RC[98]+RC[103]+RC[108]+RC[113]+RC[118]+RC[123]+RC[128]+RC[133]+RC[138]+RC[143]+RC[148]+RC[153]+RC[158]+RC[163]+RC[168]+RC[173]+RC[178]+RC[183]+RC[188]+RC[193]+RC[198]+RC[203]+RC[208]+RC[213]+RC[218]+RC[223]+RC[228]+RC[233]+RC[238]+RC[243]+Sheet2!RC[2]+Sheet2!RC[7]+Sheet2!RC[12]+Sheet2!RC[17]+Sheet2!RC[22]+Sheet2!RC[27]+Sheet2!RC[32]+Sheet2!RC[37]+Sheet2!RC[42]+Sheet2!RC[47]+Sheet2!RC[57]+Sheet2!RC[52]+Sheet2!RC[62]+Sheet2!RC[67] -> 30.6099 | C17: =RC[6]+RC[11]+RC[16]+RC[21]+RC[26]+RC[31]+RC[36]+RC[41]+RC[46]+RC[51]+RC[56]+RC[61]+RC[66]+RC[71]+RC[76]+RC[81]+RC[86]+RC[91]+RC[96]+RC[101]+RC[106]+RC[111]+RC[116]+RC[121]+RC[126]+RC[131]+RC[136]+RC[141]+RC[146]+RC[151]+RC[156]+RC[161]+RC[166]+RC[171]+RC[176]+RC[181]+RC[186]+RC[191]+RC[196]+RC[201]+RC[206]+RC[211]+RC[216]+RC[221]+RC[226]+RC[231]+RC[236]+RC[241]+Sheet2!RC+Sheet2!RC[5]+Sheet2!RC[10]+Sheet2!RC[15]+Sheet2!RC[20]+Sheet2!RC[25]+Sheet2!RC[30]+Sheet2!RC[35]+Sheet2!RC[40]+Sheet2!RC[45]+Sheet2!RC[50]+Sheet2!RC[55]+Sheet2!RC[60]+Sheet2!RC[65] -> 94.936889999999991 | D17: =RC[4]+RC[9]+RC[14]+RC[19]+RC[24]+RC[29]+RC[34]+RC[39]+RC[44]+RC[49]+RC[54]+RC[59]+RC[64]+RC[69]+RC[74]+RC[79]+RC[84]+RC[89]+RC[94]+RC[99]+RC[104]+RC[109]+RC[114]+RC[119]+RC[124]+RC[129]+RC[134]+RC[139]+RC[144]+RC[149]+RC[154]+RC[159]+RC[164]+RC[169]+RC[174]+RC[179]+RC[184]+RC[189]+RC[194]+RC[199]+RC[204]+RC[209]+RC[214]+RC[219]+RC[224]+RC[229]+RC[234]+RC[239]+Sheet2!RC[3]+Sheet2!RC[-2]+Sheet2!RC[8]+Sheet2!RC[13]+Sheet2!RC[18]+Sheet2!RC[23]+Sheet2!RC[28]+Sheet2!RC[33]+Sheet2!RC[38]+Sheet2!RC[43]+Sheet2!RC[48]+Sheet2!RC[53]+Sheet2!RC[58]+Sheet2!RC[63] -> 0 | E17: =RC[6]+RC[11]+RC[16]+RC[21]+RC[26]+RC[31]+RC[36]+RC[41]+RC[46]+RC[51]+RC[56]+RC[61]+RC[66]+RC[71]+RC[76]+RC[81]+RC[86]+RC[91]+RC[96]+RC[101]+RC[106]+RC[111]+RC[116]+RC[121]+RC[126]+RC[131]+RC[136]+RC[141]+RC[146]+RC[151]+RC[156]+RC[161]+RC[166]+RC[171]+RC[176]+RC[181]+RC[186]+RC[191]+RC[196]+RC[201]+RC[206]+RC[211]+RC[216]+RC[221]+RC[226]+RC[231]+RC[236]+RC[241]+Sheet2!RC+Sheet2!RC[5]+Sheet2!RC[10]+Sheet2!RC[15]+Sheet2!RC[20]+Sheet2!RC[25]+Sheet2!RC[30]+Sheet2!RC[35]+Sheet2!RC[40]+Sheet2!RC[45]+Sheet2!RC[50]+Sheet2!RC[55]+Sheet2!RC[60]+Sheet2!RC[65] -> 221.26920708512392 | F17: =SUM(RC[-4]:RC[-1]) -> 346.81599708512391 | G17: =Sheet1!RC[5]+Sheet1!RC[10]+Sheet1!RC[15]+Sheet1!RC[20]+Sheet1!RC[25]+Sheet1!RC[30]+Sheet1!RC[35]+Sheet1!RC[40]+Sheet1!RC[45]+Sheet1!RC[50]+Sheet1!RC[55]+Sheet1!RC[60]+Sheet1!RC[65]+Sheet1!RC[70]+Sheet1!RC[75]+Sheet1!RC[80]+Sheet1!RC[85]+Sheet1!RC[90]+Sheet1!RC[95]+Sheet1!RC[100]+Sheet1!RC[105]+Sheet1!RC[110]+Sheet1!RC[115]+Sheet1!RC[120]+Sheet1!RC[125]+Sheet1!RC[130]+Sheet1!RC[135]+Sheet1!RC[140]+Sheet1!RC[145]+Sheet1!RC[150]+Sheet1!RC[155]+Sheet1!RC[160]+Sheet1!RC[165]+Sheet1!RC[170]+Sheet1!RC[175]+Sheet1!RC[180]+Sheet1!RC[185]+Sheet1!RC[190]+Sheet1!RC[195]+Sheet1!RC[200]+Sheet1!RC[205]+Sheet1!RC[210]+Sheet1!RC[215]+Sheet1!RC[220]+Sheet1!RC[225]+Sheet1!RC[230]+Sheet1!RC[235]+Sheet1!RC[240]+Sheet2!RC[-1]+Sheet2!RC[4]+Sheet2!RC[9]+Sheet2!RC[14]+Sheet2!RC[19]+Sheet2!RC[24]+Sheet2!RC[29]+Sheet2!RC[34]+Sheet2!RC[39]+Sheet2!RC[44]+Sheet2!RC[49]+Sheet2!RC[54]+Sheet2!RC[59]+Sheet2!RC[64] -> 346.81599708512391 | H17: 0 | I17: 1.129 | J17: 0 | K17: 4.150088351377998 | L17: =SUM(RC[-4]:RC[-1]) -> 5.2790883513779985 | M17: 0 | N17: 0.72 | O17: 0 | P17: 0.97896314326000067 | Q17: =SUM(RC[-4]:RC[-1]) -> 1.6989631432600008 | R17: 0 | S17: 0 | T17: 0 | U17: 3.8387350062199994 | V17: =SUM(RC[-4]:RC[-1]) -> 3.8387350062199994 | W17: 0 | X17: 0.88998999999999995 | Y17: 0 | Z17: 2.2550679588160003 | AA17: =SUM(RC[-4]:RC[-1]) -> 3.1450579588160004 | AB17: 0 | AC17: 3.2 | AD17: 0 | AE17: 4.4747520610900002 | AF17: =SUM(RC[-4]:RC[-1]) -> 7.6747520610900004 | AG17: 0 | AH17: 0 | AI17: 0 | AJ17: 1.1867141278720001 | AK17: =SUM(RC[-4]:RC[-1]) -> 1.1867141278720001 | AL17: 0 | AM17: 0 | AN17: 0.55000000000000004 | AO17: 3.4243723558920003 | AP17: =SUM(RC[-4]:RC[-1]) -> 3.9743723558920001 | AQ17: 0 | AR17: 1.52 | AS17: 0 | AT17: 0.91662544947799962 | AU17: =SUM(RC[-4]:RC[-1]) -> 2.4366254494779995 | AV17: 0 | AW17: 1.46 | AX17: 0 | AY17: 1.3125870741359997 | AZ17: =SUM(RC[-4]:RC[-1]) -> 2.7725870741359997 | BA17: 0 | BB17: 0.95 | BC17: 0 | BD17: 1.6249173090260001 | BE17: =SUM(RC[-4]:RC[-1]) -> 2.574917309026 | BF17: 0 | BG17: 0.62 | BH17: 0 | BI17: 1.2372443000259996 | BJ17: =SUM(RC[-4]:RC[-1]) -> 1.8572443000259997 | BK17: 0 | BL17: 0.2 | BM17: 0 | BN17: 1.22619126243 | BO17: =SUM(RC[-4]:RC[-1]) -> 1.4261912624299999 | BP17: 0 | BQ17: 1.62 | BR17: 0 | BS17: 1.7912050003060001 | BT17: =SUM(RC[-4]:RC[-1]) -> 3.4112050003060004 | BU17: 0 | BV17: 3.01 | BW17: 0 | BX17: 3.8938629320779978 | BY17: =SUM(RC[-4]:RC[-1]) -> 6.9038629320779972 | BZ17: 0 | CA17: 0.01 | CB17: 2.9899999999999999E-2 | CC17: 11.633564019919998 | CD17: =SUM(RC[-4]:RC[-1]) -> 11.673464019919997 | CE17: 0 | CF17: 3.0299 | CG17: 0 | CH17: 2.7791511817959984 | CI17: =SUM(RC[-4]:RC[-1]) -> 5.8090511817959989 | CJ17: 0 | CK17: 0.37 | CL17: 0 | CM17: 1.0881439257959993 | CN17: =SUM(RC[-4]:RC[-1]) -> 1.4581439257959992 | CO17: 0 | CP17: 0.34 | CQ17: 0 | CR17: 0.86879327011399965 | CS17: =SUM(RC[-4]:RC[-1]) -> 1.2087932701139996 | CT17: 0 | CU17: 7.0000000000000007E-2 | CV17: 0 | CW17: 0.85861345817400014 | CX17: =SUM(RC[-4]:RC[-1]) -> 0.92861345817400021 | CY17: 0 | CZ17: 1.47 | DA17: 0 | DB17: 0.81670154437000042 | DC17: =SUM(RC[-4]:RC[-1]) -> 2.2867015443700005 | DD17: 0 | DE17: 0.01 | DF17: 0 | DG17: 0.34502353746800007 | DH17: =SUM(RC[-4]:RC[-1]) -> 0.35502353746800008 | DI17: 0 | DJ17: 0.46 | DK17: 0 | DL17: 1.5865230035939997 | DM17: =SUM(RC[-4]:RC[-1]) -> 2.0465230035939999 | DN17: 0 | DO17: 0 | DP17: 0 | DQ17: 1.2345344503880002 | DR17: =SUM(RC[-4]:RC[-1]) -> 1.2345344503880002 | DS17: 0 | DT17: 0 | DU17: 0 | DV17: 9.2383814385559972 | DW17: =SUM(RC[-4]:RC[-1]) -> 9.2383814385559972 | DX17: 0 | DY17: 0.03 | DZ17: 0 | EA17: 0.95478265820400032 | EB17: =SUM(RC[-4]:RC[-1]) -> 0.98478265820400035 | EC17: 0 | ED17: 0 | EE17: 0 | EF17: 0.92676457513000021 | EG17: =SUM(RC[-4]:RC[-1]) -> 0.92676457513000021 | EH17: 0 | EI17: 0.05 | EJ17: 0 | EK17: 0.64815749765199948 | EL17: =SUM(RC[-4]:RC[-1]) -> 0.69815749765199953 | EM17: 0 | EN17: 0 | EO17: 0 | EP17: 10.275307902918001 | EQ17: =SUM(RC[-4]:RC[-1]) -> 10.275307902918001 | ER17: 0 | ES17: 0 | ET17: 0 | EU17: 0.59479730134599995 | EV17: =SUM(RC[-4]:RC[-1]) -> 0.59479730134599995 | EW17: 0 | EX17: 0 | EY17: 0 | EZ17: 17.657169158529985 | FA17: =SUM(RC[-4]:RC[-1]) -> 17.657169158529985 | FB17: 0 | FC17: 0 | FD17: 0 | FE17: 21.504042384159995 | FF17: =SUM(RC[-4]:RC[-1]) -> 21.504042384159995 | FG17: 0 | FH17: 0 | FI17: 30.03 | FJ17: 2.7091788712860017 | FK17: =SUM(RC[-4]:RC[-1]) -> 32.739178871286001 | FL17: 0 | FM17: 0.02 | FN17: 0 | FO17: 2.9375215013520011 | FP17: =SUM(RC[-4]:RC[-1]) -> 2.9575215013520011 | FQ17: 0 | FR17: 0 | FS17: 0 | FT17: 6.0470073731799934 | FU17: =SUM(RC[-4]:RC[-1]) -> 6.0470073731799934 | FV17: 0 | FW17: 0.9 | FX17: 0 | FY17: 1.611256301744 | FZ17: =SUM(RC[-4]:RC[-1]) -> 2.5112563017439999 | GA17: 0 | GB17: 28.2 | GC17: 0 | GD17: 3.8907306901640002 | GE17: =SUM(RC[-4]:RC[-1]) -> 32.090730690164001 | GF17: 0 | GG17: 8.0000000000000002E-3 | GH17: 0 | GI17: 0.50319385991200027 | GJ17: =SUM(RC[-4]:RC[-1]) -> 0.51119385991200028 | GK17: 0 | GL17: 0 | GM17: 0 | GN17: 1.744452681099999 | GO17: =SUM(RC[-4]:RC[-1]) -> 1.744452681099999 | GP17: 0 | GQ17: 0.05 | GR17: 0 | GS17: 1.3452741851420005 | GT17: =SUM(RC[-4]:RC[-1]) -> 1.3952741851420005 | GU17: 0 | GV17: 0.62 | GW17: 0 | GX17: 1.3343495564499996 | GY17: =SUM(RC[-4]:RC[-1]) -> 1.9543495564499995 | GZ17: 0 | HA17: 0 | HB17: 0 | HC17: 11.880870326520002 | HD17: =SUM(RC[-4]:RC[-1]) -> 11.880870326520002 | HE17: 0 | HF17: 1.48 | HG17: 0 | HH17: 1.8354117894540003 | HI17: =SUM(RC[-4]:RC[-1]) -> 3.3154117894540001 | HJ17: 0 | HK17: 0 | HL17: 0 | HM17: 3.3998061009499989 | HN17: =SUM(RC[-4]:RC[-1]) -> 3.3998061009499989 | HO17: 0 | HP17: 9.5500000000000007 | HQ17: 0 | HR17: 3.9990877047919988 | HS17: =SUM(RC[-4]:RC[-1]) -> 13.549087704791999 | HT17: 0 | HU17: 1.75 | HV17: 0 | HW17: 1.6577688313840009 | HX17: =SUM(RC[-4]:RC[-1]) -> 3.4077688313840007 | HY17: 0 | HZ17: 0.03 | IA17: 0 | IB17: 2.6920064514239996 | IC17: =SUM(RC[-4]:RC[-1]) -> 2.7220064514239994 | ID17: 0 | IE17: 1.76 | IF17: 0 | IG17: 1.3292692349319999 | IH17: =SUM(RC[-4]:RC[-1]) -> 3.0892692349319999 | II17: 0 | IJ17: 0.98 | IK17: 0 | IL17: 0.28846028677000002 | IM17: =SUM(RC[-4]:RC[-1]) -> 1.2684602867699999
A18: BENZO (B) FLUO | B18: =RC[8]+RC[13]+RC[18]+RC[23]+RC[28]+RC[33]+RC[38]+RC[43]+RC[48]+RC[53]+RC[58]+RC[63]+RC[68]+RC[73]+RC[78]+RC[83]+RC[88]+RC[93]+RC[98]+RC[103]+RC[108]+RC[113]+RC[118]+RC[123]+RC[128]+RC[133]+RC[138]+RC[143]+RC[148]+RC[153]+RC[158]+RC[163]+RC[168]+RC[173]+RC[178]+RC[183]+RC[188]+RC[193]+RC[198]+RC[203]+RC[208]+RC[213]+RC[218]+RC[223]+RC[228]+RC[233]+RC[238]+RC[243]+Sheet2!RC[2]+Sheet2!RC[7]+Sheet2!RC[12]+Sheet2!RC[17]+Sheet2!RC[22]+Sheet2!RC[27]+Sheet2!RC[32]+Sheet2!RC[37]+Sheet2!RC[42]+Sheet2!RC[47]+Sheet2!RC[57]+Sheet2!RC[52]+Sheet2!RC[62]+Sheet2!RC[67] -> 8.76 | C18: =RC[6]+RC[11]+RC[16]+RC[21]+RC[26]+RC[31]+RC[36]+RC[41]+RC[46]+RC[51]+RC[56]+RC[61]+RC[66]+RC[71]+RC[76]+RC[81]+RC[86]+RC[91]+RC[96]+RC[101]+RC[106]+RC[111]+RC[116]+RC[121]+RC[126]+RC[131]+RC[136]+RC[141]+RC[146]+RC[151]+RC[156]+RC[161]+RC[166]+RC[171]+RC[176]+RC[181]+RC[186]+RC[191]+RC[196]+RC[201]+RC[206]+RC[211]+RC[216]+RC[221]+RC[226]+RC[231]+RC[236]+RC[241]+Sheet2!RC+Sheet2!RC[5]+Sheet2!RC[10]+Sheet2!RC[15]+Sheet2!RC[20]+Sheet2!RC[25]+Sheet2!RC[30]+Sheet2!RC[35]+Sheet2!RC[40]+Sheet2!RC[45]+Sheet2!RC[50]+Sheet2!RC[55]+Sheet2!RC[60]+Sheet2!RC[65] -> 0 | D18: =RC[4]+RC[9]+RC[14]+RC[19]+RC[24]+RC[29]+RC[34]+RC[39]+RC[44]+RC[49]+RC[54]+RC[59]+RC[64]+RC[69]+RC[74]+RC[79]+RC[84]+RC[89]+RC[94]+RC[99]+RC[104]+RC[109]+RC[114]+RC[119]+RC[124]+RC[129]+RC[134]+RC[139]+RC[144]+RC[149]+RC[154]+RC[159]+RC[164]+RC[169]+RC[174]+RC[179]+RC[184]+RC[189]+RC[194]+RC[199]+RC[204]+RC[209]+RC[214]+RC[219]+RC[224]+RC[229]+RC[234]+RC[239]+Sheet2!RC[3]+Sheet2!RC[-2]+Sheet2!RC[8]+Sheet2!RC[13]+Sheet2!RC[18]+Sheet2!RC[23]+Sheet2!RC[28]+Sheet2!RC[33]+Sheet2!RC[38]+Sheet2!RC[43]+Sheet2!RC[48]+Sheet2!RC[53]+Sheet2!RC[58]+Sheet2!RC[63] -> 0 | E18: =RC[6]+RC[11]+RC[16]+RC[21]+RC[26]+RC[31]+RC[36]+RC[41]+RC[46]+RC[51]+RC[56]+RC[61]+RC[66]+RC[71]+RC[76]+RC[81]+RC[86]+RC[91]+RC[96]+RC[101]+RC[106]+RC[111]+RC[116]+RC[121]+RC[126]+RC[131]+RC[136]+RC[141]+RC[146]+RC[151]+RC[156]+RC[161]+RC[166]+RC[171]+RC[176]+RC[181]+RC[186]+RC[191]+RC[196]+RC[201]+RC[206]+RC[211]+RC[216]+RC[221]+RC[226]+RC[231]+RC[236]+RC[241]+Sheet2!RC+Sheet2!RC[5]+Sheet2!RC[10]+Sheet2!RC[15]+Sheet2!RC[20]+Sheet2!RC[25]+Sheet2!RC[30]+Sheet2!RC[35]+Sheet2!RC[40]+Sheet2!RC[45]+Sheet2!RC[50]+Sheet2!RC[55]+Sheet2!RC[60]+Sheet2!RC[65] -> 192.17795794010206 | F18: =SUM(RC[-4]:RC[-1]) -> 200.93795794010205 | G18: =Sheet1!RC[5]+Sheet1!RC[10]+Sheet1!RC[15]+Sheet1!RC[20]+Sheet1!RC[25]+Sheet1!RC[30]+Sheet1!RC[35]+Sheet1!RC[40]+Sheet1!RC[45]+Sheet1!RC[50]+Sheet1!RC[55]+Sheet1!RC[60]+Sheet1!RC[65]+Sheet1!RC[70]+Sheet1!RC[75]+Sheet1!RC[80]+Sheet1!RC[85]+Sheet1!RC[90]+Sheet1!RC[95]+Sheet1!RC[100]+Sheet1!RC[105]+Sheet1!RC[110]+Sheet1!RC[115]+Sheet1!RC[120]+Sheet1!RC[125]+Sheet1!RC[130]+Sheet1!RC[135]+Sheet1!RC[140]+Sheet1!RC[145]+Sheet1!RC[150]+Sheet1!RC[155]+Sheet1!RC[160]+Sheet1!RC[165]+Sheet1!RC[170]+Sheet1!RC[175]+Sheet1!RC[180]+Sheet1!RC[185]+Sheet1!RC[190]+Sheet1!RC[195]+Sheet1!RC[200]+Sheet1!RC[205]+Sheet1!RC[210]+Sheet1!RC[215]+Sheet1!RC[220]+Sheet1!RC[225]+Sheet1!RC[230]+Sheet1!RC[235]+Sheet1!RC[240]+Sheet2!RC[-1]+Sheet2!RC[4]+Sheet2!RC[9]+Sheet2!RC[14]+Sheet2!RC[19]+Sheet2!RC[24]+Sheet2!RC[29]+Sheet2!RC[34]+Sheet2!RC[39]+Sheet2!RC[44]+Sheet2!RC[49]+Sheet2!RC[54]+Sheet2!RC[59]+Sheet2!RC[64] -> 200.937957940102 | H18: 0 | I18: 0 | J18: 0 | K18: 3.6157420377619993 | L18: =SUM(RC[-4]:RC[-1]) -> 3.6157420377619993 | M18: 0 | N18: 0 | O18: 0 | P18: 0.85276795239999992 | Q18: =SUM(RC[-4]:RC[-1]) -> 0.85276795239999992 | R18: 0 | S18: 0 | T18: 0 | U18: 3.3445641148480001 | V18: =SUM(RC[-4]:RC[-1]) -> 3.3445641148480001 | W18: 0 | X18: 0 | Y18: 0 | Z18: 1.9617551789259995 | AA18: =SUM(RC[-4]:RC[-1]) -> 1.9617551789259995 | AB18: 0 | AC18: 0 | AD18: 0 | AE18: 3.8985510286480003 | AF18: =SUM(RC[-4]:RC[-1]) -> 3.8985510286480003 | AG18: 0 | AH18: 0 | AI18: 0 | AJ18: 1.0339359631460001 | AK18: =SUM(RC[-4]:RC[-1]) -> 1.0339359631460001 | AL18: 0 | AM18: 0 | AN18: 0 | AO18: 2.9831078861860001 | AP18: =SUM(RC[-4]:RC[-1]) -> 2.9831078861860001 | AQ18: 0 | AR18: 0 | AS18: 0 | AT18: 0.79556035905200007 | AU18: =SUM(RC[-4]:RC[-1]) -> 0.79556035905200007 | AV18: 0 | AW18: 0 | AX18: 0 | AY18: 1.1434298073119991 | AZ18: =SUM(RC[-4]:RC[-1]) -> 1.1434298073119991 | BA18: 0 | BB18: 0 | BC18: 0 | BD18: 1.4151929760379993 | BE18: =SUM(RC[-4]:RC[-1]) -> 1.4151929760379993 | BF18: 0 | BG18: 0 | BH18: 0 | BI18: 1.0777301757220006 | BJ18: =SUM(RC[-4]:RC[-1]) -> 1.0777301757220006 | BK18: 0 | BL18: 0 | BM18: 0 | BN18: 1.0682980560320003 | BO18: =SUM(RC[-4]:RC[-1]) -> 1.0682980560320003 | BP18: 0 | BQ18: 0 | BR18: 0 | BS18: 1.5605355219259998 | BT18: =SUM(RC[-4]:RC[-1]) -> 1.5605355219259998 | BU18: 0 | BV18: 0 | BW18: 0 | BX18: 3.3918004880880019 | BY18: =SUM(RC[-4]:RC[-1]) -> 3.3918004880880019 | BZ18: 0 | CA18: 0 | CB18: 8.76 | CC18: 10.09138715041 | CD18: =SUM(RC[-4]:RC[-1]) -> 18.851387150409998 | CE18: 0 | CF18: 0 | CG18: 0 | CH18: 2.4213219835019997 | CI18: =SUM(RC[-4]:RC[-1]) -> 2.4213219835019997 | CJ18: 0 | CK18: 0 | CL18: 0 | CM18: 0.9477182348940002 | CN18: =SUM(RC[-4]:RC[-1]) -> 0.9477182348940002 | CO18: 0 | CP18: 0 | CQ18: 0 | CR18: 0.75693988587600014 | CS18: =SUM(RC[-4]:RC[-1]) -> 0.75693988587600014 | CT18: 0 | CU18: 0 | CV18: 0 | CW18: 0.74806715322599981 | CX18: =SUM(RC[-4]:RC[-1]) -> 0.74806715322599981 | CY18: 0 | CZ18: 0 | DA18: 0 | DB18: 0.71155327093200005 | DC18: =SUM(RC[-4]:RC[-1]) -> 0.71155327093200005 | DD18: 0 | DE18: 0 | DF18: 0 | DG18: 0.300601537586 | DH18: =SUM(RC[-4]:RC[-1]) -> 0.300601537586 | DI18: 0 | DJ18: 0 | DK18: 0 | DL18: 1.3822609398839996 | DM18: =SUM(RC[-4]:RC[-1]) -> 1.3822609398839996 | DN18: 0 | DO18: 0 | DP18: 0 | DQ18: 1.0745640279600002 | DR18: =SUM(RC[-4]:RC[-1]) -> 1.0745640279600002 | DS18: 0 | DT18: 0 | DU18: 0 | DV18: 8.0490795049180015 | DW18: =SUM(RC[-4]:RC[-1]) -> 8.0490795049180015 | DX18: 0 | DY18: 0 | DZ18: 0 | EA18: 0.83185570942599962 | EB18: =SUM(RC[-4]:RC[-1]) -> 0.83185570942599962 | EC18: 0 | ED18: 0 | EE18: 0 | EF18: 0.80732862251800019 | EG18: =SUM(RC[-4]:RC[-1]) -> 0.80732862251800019 | EH18: 0 | EI18: 0 | EJ18: 0 | EK18: 0.56471056237999995 | EL18: =SUM(RC[-4]:RC[-1]) -> 0.56471056237999995 | EM18: 0 | EN18: 0 | EO18: 0 | EP18: 8.9498106365560002 | EQ18: =SUM(RC[-4]:RC[-1]) -> 8.9498106365560002 | ER18: 0 | ES18: 0 | ET18: 0 | EU18: 0.51822351227599994 | EV18: =SUM(RC[-4]:RC[-1]) -> 0.51822351227599994 | EW18: 0 | EX18: 0 | EY18: 0 | EZ18: 15.383988954599996 | FA18: =SUM(RC[-4]:RC[-1]) -> 15.383988954599996 | FB18: 0 | FC18: 0 | FD18: 0 | FE18: 18.735822156730009 | FF18: =SUM(RC[-4]:RC[-1]) -> 18.735822156730009 | FG18: 0 | FH18: 0 | FI18: 0 | FJ18: 2.3601804958820018 | FK18: =SUM(RC[-4]:RC[-1]) -> 2.3601804958820018 | FL18: 0 | FM18: 0 | FN18: 0 | FO18: 2.5591920008200018 | FP18: =SUM(RC[-4]:RC[-1]) -> 2.5591920008200018 | FQ18: 0 | FR18: 0 | FS18: 0 | FT18: 5.240109460585999 | FU18: =SUM(RC[-4]:RC[-1]) -> 5.240109460585999 | FV18: 0 | FW18: 0 | FX18: 0 | FY18: 1.4038262568019995 | FZ18: =SUM(RC[-4]:RC[-1]) -> 1.4038262568019995 | GA18: 0 | GB18: 0 | GC18: 0 | GD18: 3.3884469232980008 | GE18: =SUM(RC[-4]:RC[-1]) -> 3.3884469232980008 | GF18: 0 | GG18: 0 | GH18: 0 | GI18: 0.43841277771599996 | GJ18: =SUM(RC[-4]:RC[-1]) -> 0.43841277771599996 | GK18: 0 | GL18: 0 | GM18: 0 | GN18: 1.5198604231259998 | GO18: =SUM(RC[-4]:RC[-1]) -> 1.5198604231259998 | GP18: 0 | GQ18: 0 | GR18: 0 | GS18: 1.17197165677 | GT18: =SUM(RC[-4]:RC[-1]) -> 1.17197165677 | GU18: 0 | GV18: 0 | GW18: 0 | GX18: 1.1625611237459998 | GY18: =SUM(RC[-4]:RC[-1]) -> 1.1625611237459998 | GZ18: 0 | HA18: 0 | HB18: 0 | HC18: 9.8534147677119979 | HD18: =SUM(RC[-4]:RC[-1]) -> 9.8534147677119979 | HE18: 0 | HF18: 0 | HG18: 0 | HH18: 1.5991135015900007 | HI18: =SUM(RC[-4]:RC[-1]) -> 1.5991135015900007 | HJ18: 0 | HK18: 0 | HL18: 0 | HM18: 2.9621246395800003 | HN18: =SUM(RC[-4]:RC[-1]) -> 2.9621246395800003 | HO18: 0 | HP18: 0 | HQ18: 0 | HR18: 3.4842412276999997 | HS18: =SUM(RC[-4]:RC[-1]) -> 3.4842412276999997 | HT18: 0 | HU18: 0 | HV18: 0 | HW18: 1.4440216121820004 | HX18: =SUM(RC[-4]:RC[-1]) -> 1.4440216121820004 | HY18: 0 | HZ18: 0 | IA18: 0 | IB18: 2.3453085532720008 | IC18: =SUM(RC[-4]:RC[-1]) -> 2.3453085532720008 | ID18: 0 | IE18: 0 | IF18: 0 | IG18: 1.1579277704019999 | IH18: =SUM(RC[-4]:RC[-1]) -> 1.1579277704019999 | II18: 0 | IJ18: 0 | IK18: 0 | IL18: 0.25132472324000005 | IM18: =SUM(RC[-4]:RC[-1]) -> 0.25132472324000005
A19: BENZO (K) FLUO | B19: =RC[8]+RC[13]+RC[18]+RC[23]+RC[28]+RC[33]+RC[38]+RC[43]+RC[48]+RC[53]+RC[58]+RC[63]+RC[68]+RC[73]+RC[78]+RC[83]+RC[88]+RC[93]+RC[98]+RC[103]+RC[108]+RC[113]+RC[118]+RC[123]+RC[128]+RC[133]+RC[138]+RC[143]+RC[148]+RC[153]+RC[158]+RC[163]+RC[168]+RC[173]+RC[178]+RC[183]+RC[188]+RC[193]+RC[198]+RC[203]+RC[208]+RC[213]+RC[218]+RC[223]+RC[228]+RC[233]+RC[238]+RC[243]+Sheet2!RC[2]+Sheet2!RC[7]+Sheet2!RC[12]+Sheet2!RC[17]+Sheet2!RC[22]+Sheet2!RC[27]+Sheet2!RC[32]+Sheet2!RC[37]+Sheet2!RC[42]+Sheet2!RC[47]+Sheet2!RC[57]+Sheet2!RC[52]+Sheet2!RC[62]+Sheet2!RC[67] -> 0 | C19: =RC[6]+RC[11]+RC[16]+RC[21]+RC[26]+RC[31]+RC[36]+RC[41]+RC[46]+RC[51]+RC[56]+RC[61]+RC[66]+RC[71]+RC[76]+RC[81]+RC[86]+RC[91]+RC[96]+RC[101]+RC[106]+RC[111]+RC[116]+RC[121]+RC[126]+RC[131]+RC[136]+RC[141]+RC[146]+RC[151]+RC[156]+RC[161]+RC[166]+RC[171]+RC[176]+RC[181]+RC[186]+RC[191]+RC[196]+RC[201]+RC[206]+RC[211]+RC[216]+RC[221]+RC[226]+RC[231]+RC[236]+RC[241]+Sheet2!RC+Sheet2!RC[5]+Sheet2!RC[10]+Sheet2!RC[15]+Sheet2!RC[20]+Sheet2!RC[25]+Sheet2!RC[30]+Sheet2!RC[35]+Sheet2!RC[40]+Sheet2!RC[45]+Sheet2!RC[50]+Sheet2!RC[55]+Sheet2!RC[60]+Sheet2!RC[65] -> 0 | D19: =RC[4]+RC[9]+RC[14]+RC[19]+RC[24]+RC[29]+RC[34]+RC[39]+RC[44]+RC[49]+RC[54]+RC[59]+RC[64]+RC[69]+RC[74]+RC[79]+RC[84]+RC[89]+RC[94]+RC[99]+RC[104]+RC[109]+RC[114]+RC[119]+RC[124]+RC[129]+RC[134]+RC[139]+RC[144]+RC[149]+RC[154]+RC[159]+RC[164]+RC[169]+RC[174]+RC[179]+RC[184]+RC[189]+RC[194]+RC[199]+RC[204]+RC[209]+RC[214]+RC[219]+RC[224]+RC[229]+RC[234]+RC[239]+Sheet2!RC[3]+Sheet2!RC[-2]+Sheet2!RC[8]+Sheet2!RC[13]+Sheet2!RC[18]+Sheet2!RC[23]+Sheet2!RC[28]+Sheet2!RC[33]+Sheet2!RC[38]+Sheet2!RC[43]+Sheet2!RC[48]+Sheet2!RC[53]+Sheet2!RC[58]+Sheet2!RC[63] -> 0 | E19: =RC[6]+RC[11]+RC[16]+RC[21]+RC[26]+RC[31]+RC[36]+RC[41]+RC[46]+RC[51]+RC[56]+RC[61]+RC[66]+RC[71]+RC[76]+RC[81]+RC[86]+RC[91]+RC[96]+RC[101]+RC[106]+RC[111]+RC[116]+RC[121]+RC[126]+RC[131]+RC[136]+RC[141]+RC[146]+RC[151]+RC[156]+RC[161]+RC[166]+RC[171]+RC[176]+RC[181]+RC[186]+RC[191]+RC[196]+RC[201]+RC[206]+RC[211]+RC[216]+RC[221]+RC[226]+RC[231]+RC[236]+RC[241]+Sheet2!RC+Sheet2!RC[5]+Sheet2!RC[10]+Sheet2!RC[15]+Sheet2!RC[20]+Sheet2!RC[25]+Sheet2!RC[30]+Sheet2!RC[35]+Sheet2!RC[40]+Sheet2!RC[45]+Sheet2!RC[50]+Sheet2!RC[55]+Sheet2!RC[60]+Sheet2!RC[65] -> 206.38399201037996 | F19: =SUM(RC[-4]:RC[-1]) -> 206.38399201037996 | G19: =Sheet1!RC[5]+Sheet1!RC[10]+Sheet1!RC[15]+Sheet1!RC[20]+Sheet1!RC[25]+Sheet1!RC[30]+Sheet1!RC[35]+Sheet1!RC[40]+Sheet1!RC[45]+Sheet1!RC[50]+Sheet1!RC[55]+Sheet1!RC[60]+Sheet1!RC[65]+Sheet1!RC[70]+Sheet1!RC[75]+Sheet1!RC[80]+Sheet1!RC[85]+Sheet1!RC[90]+Sheet1!RC[95]+Sheet1!RC[100]+Sheet1!RC[105]+Sheet1!RC[110]+Sheet1!RC[115]+Sheet1!RC[120]+Sheet1!RC[125]+Sheet1!RC[130]+Sheet1!RC[135]+Sheet1!RC[140]+Sheet1!RC[145]+Sheet1!RC[150]+Sheet1!RC[155]+Sheet1!RC[160]+Sheet1!RC[165]+Sheet1!RC[170]+Sheet1!RC[175]+Sheet1!RC[180]+Sheet1!RC[185]+Sheet1!RC[190]+Sheet1!RC[195]+Sheet1!RC[200]+Sheet1!RC[205]+Sheet1!RC[210]+Sheet1!RC[215]+Sheet1!RC[220]+Sheet1!RC[225]+Sheet1!RC[230]+Sheet1!RC[235]+Sheet1!RC[240]+Sheet2!RC[-1]+Sheet2!RC[4]+Sheet2!RC[9]+Sheet2!RC[14]+Sheet2!RC[19]+Sheet2!RC[24]+Sheet2!RC[29]+Sheet2!RC[34]+Sheet2!RC[39]+Sheet2!RC[44]+Sheet2!RC[49]+Sheet2!RC[54]+Sheet2!RC[59]+Sheet2!RC[64] -> 206.38399201037996 | H19: 0 | I19: 0 | J19: 0 | K19: 3.8830192623979984 | L19: =SUM(RC[-4]:RC[-1]) -> 3.8830192623979984 | M19: 0 | N19: 0 | O19: 0 | P19: 0.91581079652999953 | Q19: =SUM(RC[-4]:RC[-1]) -> 0.91581079652999953 | R19: 0 | S19: 0 | T19: 0 | U19: 3.5917839360700001 | V19: =SUM(RC[-4]:RC[-1]) -> 3.5917839360700001 | W19: 0 | X19: 0 | Y19: 0 | Z19: 2.1067690182019994 | AA19: =SUM(RC[-4]:RC[-1]) -> 2.1067690182019994 | AB19: 0 | AC19: 0 | AD19: 0 | AE19: 4.1867718066179993 | AF19: =SUM(RC[-4]:RC[-1]) -> 4.1867718066179993 | AG19: 0 | AH19: 0 | AI19: 0 | AJ19: 1.1103663391439995 | AK19: =SUM(RC[-4]:RC[-1]) -> 1.1103663391439995 | AL19: 0 | AM19: 0 | AN19: 0 | AO19: 3.2036375020319969 | AP19: =SUM(RC[-4]:RC[-1]) -> 3.2036375020319969 | AQ19: 0 | AR19: 0 | AS19: 0 | AT19: 0.85436736447799977 | AU19: =SUM(RC[-4]:RC[-1]) -> 0.85436736447799977 | AV19: 0 | AW19: 0 | AX19: 0 | AY19: 1.227960193008 | AZ19: =SUM(RC[-4]:RC[-1]) -> 1.227960193008 | BA19: 0 | BB19: 0 | BC19: 0 | BD19: 1.5198125091720003 | BE19: =SUM(RC[-4]:RC[-1]) -> 1.5198125091720003 | BF19: 0 | BG19: 0 | BH19: 0 | BI19: 1.1574010687780001 | BJ19: =SUM(RC[-4]:RC[-1]) -> 1.1574010687780001 | BK19: 0 | BL19: 0 | BM19: 0 | BN19: 1.1472750911980001 | BO19: =SUM(RC[-4]:RC[-1]) -> 1.1472750911980001 | BP19: 0 | BQ19: 0 | BR19: 0 | BS19: 1.6759038920339997 | BT19: =SUM(RC[-4]:RC[-1]) -> 1.6759038920339997 | BU19: 0 | BV19: 0 | BW19: 0 | BX19: 3.6425325457619997 | BY19: =SUM(RC[-4]:RC[-1]) -> 3.6425325457619997 | BZ19: 0 | CA19: 0 | CB19: 0 | CC19: 10.837343362129996 | CD19: =SUM(RC[-4]:RC[-1]) -> 10.837343362129996 | CE19: 0 | CF19: 0 | CG19: 0 | CH19: 2.600332602668002 | CI19: =SUM(RC[-4]:RC[-1]) -> 2.600332602668002 | CJ19: 0 | CK19: 0 | CL19: 0 | CM19: 1.0177801538659994 | CN19: =SUM(RC[-4]:RC[-1]) -> 1.0177801538659994 | CO19: 0 | CP19: 0 | CQ19: 0 | CR19: 0.81289657128400028 | CS19: =SUM(RC[-4]:RC[-1]) -> 0.81289657128400028 | CT19: 0 | CU19: 0 | CV19: 0 | CW19: 0.80336535658200015 | CX19: =SUM(RC[-4]:RC[-1]) -> 0.80336535658200015 | CY19: 0 | CZ19: 0 | DA19: 0 | DB19: 0.76415561695800005 | DC19: =SUM(RC[-4]:RC[-1]) -> 0.76415561695800005 | DD19: 0 | DE19: 0 | DF19: 0 | DG19: 0.32282445943600002 | DH19: =SUM(RC[-4]:RC[-1]) -> 0.32282445943600002 | DI19: 0 | DJ19: 0 | DK19: 0 | DL19: 1.4844469304859997 | DM19: =SUM(RC[-4]:RC[-1]) -> 1.4844469304859997 | DN19: 0 | DO19: 0 | DP19: 0 | DQ19: 1.1539961777000001 | DR19: =SUM(RC[-4]:RC[-1]) -> 1.1539961777000001 | DS19: 0 | DT19: 0 | DU19: 0 | DV19: 8.6440513125319995 | DW19: =SUM(RC[-4]:RC[-1]) -> 8.6440513125319995 | DX19: 0 | DY19: 0 | DZ19: 0 | EA19: 0.89335229821399986 | EB19: =SUM(RC[-4]:RC[-1]) -> 0.89335229821399986 | EC19: 0 | ED19: 0 | EE19: 0 | EF19: 0.86700887728400011 | EG19: =SUM(RC[-4]:RC[-1]) -> 0.86700887728400011 | EH19: 0 | EI19: 0 | EJ19: 0 | EK19: 0.6064538868499999 | EL19: =SUM(RC[-4]:RC[-1]) -> 0.6064538868499999 | EM19: 0 | EN19: 0 | EO19: 0 | EP19: 9.6113801050839971 | EQ19: =SUM(RC[-4]:RC[-1]) -> 9.6113801050839971 | ER19: 0 | ES19: 0 | ET19: 0 | EU19: 0.55653109267399992 | EV19: =SUM(RC[-4]:RC[-1]) -> 0.55653109267399992 | EW19: 0 | EX19: 0 | EY19: 0 | EZ19: 16.521188253139997 | FA19: =SUM(RC[-4]:RC[-1]) -> 16.521188253139997 | FB19: 0 | FC19: 0 | FD19: 0 | FE19: 20.120683723030005 | FF19: =SUM(RC[-4]:RC[-1]) -> 20.120683723030005 | FG19: 0 | FH19: 0 | FI19: 0 | FJ19: 2.5346480182439999 | FK19: =SUM(RC[-4]:RC[-1]) -> 2.5346480182439999 | FL19: 0 | FM19: 0 | FN19: 0 | FO19: 2.7483741399159998 | FP19: =SUM(RC[-4]:RC[-1]) -> 2.7483741399159998 | FQ19: 0 | FR19: 0 | FS19: 0 | FT19: 5.6274586358540013 | FU19: =SUM(RC[-4]:RC[-1]) -> 5.6274586358540013 | FV19: 0 | FW19: 0 | FX19: 0 | FY19: 1.5075972920019998 | FZ19: =SUM(RC[-4]:RC[-1]) -> 1.5075972920019998 | GA19: 0 | GB19: 0 | GC19: 0 | GD19: 3.6389218774020002 | GE19: =SUM(RC[-4]:RC[-1]) -> 3.6389218774020002 | GF19: 0 | GG19: 0 | GH19: 0 | GI19: 0.47082086312199978 | GJ19: =SUM(RC[-4]:RC[-1]) -> 0.47082086312199978 | GK19: 0 | GL19: 0 | GM19: 0 | GN19: 1.6322169444639998 | GO19: =SUM(RC[-4]:RC[-1]) -> 1.6322169444639998 | GP19: 0 | GQ19: 0 | GR19: 0 | GS19: 1.2586114073399997 | GT19: =SUM(RC[-4]:RC[-1]) -> 1.2586114073399997 | GU19: 0 | GV19: 0 | GW19: 0 | GX19: 1.2485014536139993 | GY19: =SUM(RC[-4]:RC[-1]) -> 1.2485014536139993 | GZ19: 0 | HA19: 0 | HB19: 0 | HC19: 10.581748552269996 | HD19: =SUM(RC[-4]:RC[-1]) -> 10.581748552269996 | HE19: 0 | HF19: 0 | HG19: 0 | HH19: 1.7173263077600003 | HI19: =SUM(RC[-4]:RC[-1]) -> 1.7173263077600003 | HJ19: 0 | HK19: 0 | HL19: 0 | HM19: 3.1810834797900016 | HN19: =SUM(RC[-4]:RC[-1]) -> 3.1810834797900016 | HO19: 0 | HP19: 0 | HQ19: 0 | HR19: 3.7418026744600006 | HS19: =SUM(RC[-4]:RC[-1]) -> 3.7418026744600006 | HT19: 0 | HU19: 0 | HV19: 0 | HW19: 1.5507692816880001 | HX19: =SUM(RC[-4]:RC[-1]) -> 1.5507692816880001 | HY19: 0 | HZ19: 0 | IA19: 0 | IB19: 2.5186778063399999 | IC19: =SUM(RC[-4]:RC[-1]) -> 2.5186778063399999 | ID19: 0 | IE19: 0 | IF19: 0 | IG19: 1.2435221693580001 | IH19: =SUM(RC[-4]:RC[-1]) -> 1.2435221693580001 | II19: 0 | IJ19: 0 | IK19: 0 | IL19: 0.2699025548700002 | IM19: =SUM(RC[-4]:RC[-1]) -> 0.2699025548700002
A20: BERYLLIUM | B20: =RC[8]+RC[13]+RC[18]+RC[23]+RC[28]+RC[33]+RC[38]+RC[43]+RC[48]+RC[53]+RC[58]+RC[63]+RC[68]+RC[73]+RC[78]+RC[83]+RC[88]+RC[93]+RC[98]+RC[103]+RC[108]+RC[113]+RC[118]+RC[123]+RC[128]+RC[133]+RC[138]+RC[143]+RC[148]+RC[153]+RC[158]+RC[163]+RC[168]+RC[173]+RC[178]+RC[183]+RC[188]+RC[193]+RC[198]+RC[203]+RC[208]+RC[213]+RC[218]+RC[223]+RC[228]+RC[233]+RC[238]+RC[243]+Sheet2!RC[2]+Sheet2!RC[7]+Sheet2!RC[12]+Sheet2!RC[17]+Sheet2!RC[22]+Sheet2!RC[27]+Sheet2!RC[32]+Sheet2!RC[37]+Sheet2!RC[42]+Sheet2!RC[47]+Sheet2!RC[57]+Sheet2!RC[52]+Sheet2!RC[62]+Sheet2!RC[67] -> 20.700700000000001 | C20: =RC[6]+RC[11]+RC[16]+RC[21]+RC[26]+RC[31]+RC[36]+RC[41]+RC[46]+RC[51]+RC[56]+RC[61]+RC[66]+RC[71]+RC[76]+RC[81]+RC[86]+RC[91]+RC[96]+RC[101]+RC[106]+RC[111]+RC[116]+RC[121]+RC[126]+RC[131]+RC[136]+RC[141]+RC[146]+RC[151]+RC[156]+RC[161]+RC[166]+RC[171]+RC[176]+RC[181]+RC[186]+RC[191]+RC[196]+RC[201]+RC[206]+RC[211]+RC[216]+RC[221]+RC[226]+RC[231]+RC[236]+RC[241]+Sheet2!RC+Sheet2!RC[5]+Sheet2!RC[10]+Sheet2!RC[15]+Sheet2!RC[20]+Sheet2!RC[25]+Sheet2!RC[30]+Sheet2!RC[35]+Sheet2!RC[40]+Sheet2!RC[45]+Sheet2!RC[50]+Sheet2!RC[55]+Sheet2!RC[60]+Sheet2!RC[65] -> 0 | D20: =RC[4]+RC[9]+RC[14]+RC[19]+RC[24]+RC[29]+RC[34]+RC[39]+RC[44]+RC[49]+RC[54]+RC[59]+RC[64]+RC[69]+RC[74]+RC[79]+RC[84]+RC[89]+RC[94]+RC[99]+RC[104]+RC[109]+RC[114]+RC[119]+RC[124]+RC[129]+RC[134]+RC[139]+RC[144]+RC[149]+RC[154]+RC[159]+RC[164]+RC[169]+RC[174]+RC[179]+RC[184]+RC[189]+RC[194]+RC[199]+RC[204]+RC[209]+RC[214]+RC[219]+RC[224]+RC[229]+RC[234]+RC[239]+Sheet2!RC[3]+Sheet2!RC[-2]+Sheet2!RC[8]+Sheet2!RC[13]+Sheet2!RC[18]+Sheet2!RC[23]+Sheet2!RC[28]+Sheet2!RC[33]+Sheet2!RC[38]+Sheet2!RC[43]+Sheet2!RC[48]+Sheet2!RC[53]+Sheet2!RC[58]+Sheet2!RC[63] -> 0 | E20: =RC[6]+RC[11]+RC[16]+RC[21]+RC[26]+RC[31]+RC[36]+RC[41]+RC[46]+RC[51]+RC[56]+RC[61]+RC[66]+RC[71]+RC[76]+RC[81]+RC[86]+RC[91]+RC[96]+RC[101]+RC[106]+RC[111]+RC[116]+RC[121]+RC[126]+RC[131]+RC[136]+RC[141]+RC[146]+RC[151]+RC[156]+RC[161]+RC[166]+RC[171]+RC[176]+RC[181]+RC[186]+RC[191]+RC[196]+RC[201]+RC[206]+RC[211]+RC[216]+RC[221]+RC[226]+RC[231]+RC[236]+RC[241]+Sheet2!RC+Sheet2!RC[5]+Sheet2!RC[10]+Sheet2!RC[15]+Sheet2!RC[20]+Sheet2!RC[25]+Sheet2!RC[30]+Sheet2!RC[35]+Sheet2!RC[40]+Sheet2!RC[45]+Sheet2!RC[50]+Sheet2!RC[55]+Sheet2!RC[60]+Sheet2!RC[65] -> 0 | F20: =SUM(RC[-4]:RC[-1]) -> 20.700700000000001 | G20: =Sheet1!RC[5]+Sheet1!RC[10]+Sheet1!RC[15]+Sheet1!RC[20]+Sheet1!RC[25]+Sheet1!RC[30]+Sheet1!RC[35]+Sheet1!RC[40]+Sheet1!RC[45]+Sheet1!RC[50]+Sheet1!RC[55]+Sheet1!RC[60]+Sheet1!RC[65]+Sheet1!RC[70]+Sheet1!RC[75]+Sheet1!RC[80]+Sheet1!RC[85]+Sheet1!RC[90]+Sheet1!RC[95]+Sheet1!RC[100]+Sheet1!RC[105]+Sheet1!RC[110]+Sheet1!RC[115]+Sheet1!RC[120]+Sheet1!RC[125]+Sheet1!RC[130]+Sheet1!RC[135]+Sheet1!RC[140]+Sheet1!RC[145]+Sheet1!RC[150]+Sheet1!RC[155]+Sheet1!RC[160]+Sheet1!RC[165]+Sheet1!RC[170]+Sheet1!RC[175]+Sheet1!RC[180]+Sheet1!RC[185]+Sheet1!RC[190]+Sheet1!RC[195]+Sheet1!RC[200]+Sheet1!RC[205]+Sheet1!RC[210]+Sheet1!RC[215]+Sheet1!RC[220]+Sheet1!RC[225]+Sheet1!RC[230]+Sheet1!RC[235]+Sheet1!RC[240]+Sheet2!RC[-1]+Sheet2!RC[4]+Sheet2!RC[9]+Sheet2!RC[14]+Sheet2!RC[19]+Sheet2!RC[24]+Sheet2!RC[29]+Sheet2!RC[34]+Sheet2!RC[39]+Sheet2!RC[44]+Sheet2!RC[49]+Sheet2!RC[54]+Sheet2!RC[59]+Sheet2!RC[64] -> 20.700700000000001 | H20: 0 | I20: 0 | J20: 1.03 | K20: 0 | L20: =SUM(RC[-4]:RC[-1]) -> 1.03 | M20: 0 | N20: 0 | O20: 0 | P20: 0 | Q20: =SUM(RC[-4]:RC[-1]) -> 0 | R20: 0 | S20: 0 | T20: 0 | U20: 0 | V20: =SUM(RC[-4]:RC[-1]) -> 0 | W20: 0 | X20: 0 | Y20: 0 | Z20: 0 | AA20: =SUM(RC[-4]:RC[-1]) -> 0 | AB20: 0 | AC20: 0 | AD20: 0 | AE20: 0 | AF20: =SUM(RC[-4]:RC[-1]) -> 0 | AG20: 0 | AH20: 0 | AI20: 0.03 | AJ20: 0 | AK20: =SUM(RC[-4]:RC[-1]) -> 0.03 | AL20: 0 | AM20: 0 | AN20: 0 | AO20: 0 | AP20: =SUM(RC[-4]:RC[-1]) -> 0 | AQ20: 0 | AR20: 0 | AS20: 0 | AT20: 0 | AU20: =SUM(RC[-4]:RC[-1]) -> 0 | AV20: 0 | AW20: 0 | AX20: 0 | AY20: 0 | AZ20: =SUM(RC[-4]:RC[-1]) -> 0 | BA20: 0 | BB20: 0 | BC20: 0 | BD20: 0 | BE20: =SUM(RC[-4]:RC[-1]) -> 0 | BF20: 0 | BG20: 0 | BH20: 0 | BI20: 0 | BJ20: =SUM(RC[-4]:RC[-1]) -> 0 | BK20: 0 | BL20: 0 | BM20: 0 | BN20: 0 | BO20: =SUM(RC[-4]:RC[-1]) -> 0 | BP20: 0 | BQ20: 0 | BR20: 0 | BS20: 0 | BT20: =SUM(RC[-4]:RC[-1]) -> 0 | BU20: 0 | BV20: 0 | BW20: 0 | BX20: 0 | BY20: =SUM(RC[-4]:RC[-1]) -> 0 | BZ20: 0 | CA20: 0 | CB20: 9.5 | CC20: 0 | CD20: =SUM(RC[-4]:RC[-1]) -> 9.5 | CE20: 0 | CF20: 0 | CG20: 1 | CH20: 0 | CI20: =SUM(RC[-4]:RC[-1]) -> 1 | CJ20: 0 | CK20: 0 | CL20: 0 | CM20: 0 | CN20: =SUM(RC[-4]:RC[-1]) -> 0 | CO20: 0 | CP20: 0 | CQ20: 0 | CR20: 0 | CS20: =SUM(RC[-4]:RC[-1]) -> 0 | CT20: 0 | CU20: 0 | CV20: 0 | CW20: 0 | CX20: =SUM(RC[-4]:RC[-1]) -> 0 | CY20: 0 | CZ20: 0 | DA20: 0 | DB20: 0 | DC20: =SUM(RC[-4]:RC[-1]) -> 0 | DD20: 0 | DE20: 0 | DF20: 0 | DG20: 0 | DH20: =SUM(RC[-4]:RC[-1]) -> 0 | DI20: 0 | DJ20: 0 | DK20: 0 | DL20: 0 | DM20: =SUM(RC[-4]:RC[-1]) -> 0 | DN20: 0 | DO20: 0 | DP20: 0 | DQ20: 0 | DR20: =SUM(RC[-4]:RC[-1]) -> 0 | DS20: 0 | DT20: 0 | DU20: 0 | DV20: 0 | DW20: =SUM(RC[-4]:RC[-1]) -> 0 | DX20: 0 | DY20: 0 | DZ20: 0 | EA20: 0 | EB20: =SUM(RC[-4]:RC[-1]) -> 0 | EC20: 0 | ED20: 0 | EE20: 0 | EF20: 0 | EG20: =SUM(RC[-4]:RC[-1]) -> 0 | EH20: 0 | EI20: 0 | EJ20: 0 | EK20: 0 | EL20: =SUM(RC[-4]:RC[-1]) -> 0 | EM20: 0 | EN20: 0 | EO20: 0 | EP20: 0 | EQ20: =SUM(RC[-4]:RC[-1]) -> 0 | ER20: 0 | ES20: 0 | ET20: 0 | EU20: 0 | EV20: =SUM(RC[-4]:RC[-1]) -> 0 | EW20: 0 | EX20: 0 | EY20: 0 | EZ20: 0 | FA20: =SUM(RC[-4]:RC[-1]) -> 0 | FB20: 0 | FC20: 0 | FD20: 0 | FE20: 0 | FF20: =SUM(RC[-4]:RC[-1]) -> 0 | FG20: 0 | FH20: 0 | FI20: 0.37 | FJ20: 0 | FK20: =SUM(RC[-4]:RC[-1]) -> 0.37 | FL20: 0 | FM20: 0 | FN20: 0 | FO20: 0 | FP20: =SUM(RC[-4]:RC[-1]) -> 0 | FQ20: 0 | FR20: 0 | FS20: 7.0000000000000007E-2 | FT20: 0 | FU20: =SUM(RC[-4]:RC[-1]) -> 7.0000000000000007E-2 | FV20: 0 | FW20: 0 | FX20: 0 | FY20: 0 | FZ20: =SUM(RC[-4]:RC[-1]) -> 0 | GA20: 0 | GB20: 0 | GC20: 7.09 | GD20: 0 | GE20: =SUM(RC[-4]:RC[-1]) -> 7.09 | GF20: 0 | GG20: 0 | GH20: 0 | GI20: 0 | GJ20: =SUM(RC[-4]:RC[-1]) -> 0 | GK20: 0 | GL20: 0 | GM20: 0.1 | GN20: 0 | GO20: =SUM(RC[-4]:RC[-1]) -> 0.1 | GP20: 0 | GQ20: 0 | GR20: 0 | GS20: 0 | GT20: =SUM(RC[-4]:RC[-1]) -> 0 | GU20: 0 | GV20: 0 | GW20: 0 | GX20: 0 | GY20: =SUM(RC[-4]:RC[-1]) -> 0 | GZ20: 0 | HA20: 0 | HB20: 0 | HC20: 0 | HD20: =SUM(RC[-4]:RC[-1]) -> 0 | HE20: 0 | HF20: 0 | HG20: 0 | HH20: 0 | HI20: =SUM(RC[-4]:RC[-1]) -> 0 | HJ20: 0 | HK20: 0 | HL20: 0 | HM20: 0 | HN20: =SUM(RC[-4]:RC[-1]) -> 0 | HO20: 0 | HP20: 0 | HQ20: 0 | HR20: 0 | HS20: =SUM(RC[-4]:RC[-1]) -> 0 | HT20: 0 | HU20: 0 | HV20: 0 | HW20: 0 | HX20: =SUM(RC[-4]:RC[-1]) -> 0 | HY20: 0 | HZ20: 0 | IA20: 0 | IB20: 0 | IC20: =SUM(RC[-4]:RC[-1]) -> 0 | ID20: 0 | IE20: 0 | IF20: 0 | IG20: 0 | IH20: =SUM(RC[-4]:RC[-1]) -> 0 | II20: 0 | IJ20: 0 | IK20: 0 | IL20: 0 | IM20: =SUM(RC[-4]:RC[-1]) -> 0
A21: BUTADIENE,13 | B21: =RC[8]+RC[13]+RC[18]+RC[23]+RC[28]+RC[33]+RC[38]+RC[43]+RC[48]+RC[53]+RC[58]+RC[63]+RC[68]+RC[73]+RC[78]+RC[83]+RC[88]+RC[93]+RC[98]+RC[103]+RC[108]+RC[113]+RC[118]+RC[123]+RC[128]+RC[133]+RC[138]+RC[143]+RC[148]+RC[153]+RC[158]+RC[163]+RC[168]+RC[173]+RC[178]+RC[183]+RC[188]+RC[193]+RC[198]+RC[203]+RC[208]+RC[213]+RC[218]+RC[223]+RC[228]+RC[233]+RC[238]+RC[243]+Sheet2!RC[2]+Sheet2!RC[7]+Sheet2!RC[12]+Sheet2!RC[17]+Sheet2!RC[22]+Sheet2!RC[27]+Sheet2!RC[32]+Sheet2!RC[37]+Sheet2!RC[42]+Sheet2!RC[47]+Sheet2!RC[57]+Sheet2!RC[52]+Sheet2!RC[62]+Sheet2!RC[67] -> 28492.665399999998 | C21: =RC[6]+RC[11]+RC[16]+RC[21]+RC[26]+RC[31]+RC[36]+RC[41]+RC[46]+RC[51]+RC[56]+RC[61]+RC[66]+RC[71]+RC[76]+RC[81]+RC[86]+RC[91]+RC[96]+RC[101]+RC[106]+RC[111]+RC[116]+RC[121]+RC[126]+RC[131]+RC[136]+RC[141]+RC[146]+RC[151]+RC[156]+RC[161]+RC[166]+RC[171]+RC[176]+RC[181]+RC[186]+RC[191]+RC[196]+RC[201]+RC[206]+RC[211]+RC[216]+RC[221]+RC[226]+RC[231]+RC[236]+RC[241]+Sheet2!RC+Sheet2!RC[5]+Sheet2!RC[10]+Sheet2!RC[15]+Sheet2!RC[20]+Sheet2!RC[25]+Sheet2!RC[30]+Sheet2!RC[35]+Sheet2!RC[40]+Sheet2!RC[45]+Sheet2!RC[50]+Sheet2!RC[55]+Sheet2!RC[60]+Sheet2!RC[65] -> 7603027.8039999995 | D21: =RC[4]+RC[9]+RC[14]+RC[19]+RC[24]+RC[29]+RC[34]+RC[39]+RC[44]+RC[49]+RC[54]+RC[59]+RC[64]+RC[69]+RC[74]+RC[79]+RC[84]+RC[89]+RC[94]+RC[99]+RC[104]+RC[109]+RC[114]+RC[119]+RC[124]+RC[129]+RC[134]+RC[139]+RC[144]+RC[149]+RC[154]+RC[159]+RC[164]+RC[169]+RC[174]+RC[179]+RC[184]+RC[189]+RC[194]+RC[199]+RC[204]+RC[209]+RC[214]+RC[219]+RC[224]+RC[229]+RC[234]+RC[239]+Sheet2!RC[3]+Sheet2!RC[-2]+Sheet2!RC[8]+Sheet2!RC[13]+Sheet2!RC[18]+Sheet2!RC[23]+Sheet2!RC[28]+Sheet2!RC[33]+Sheet2!RC[38]+Sheet2!RC[43]+Sheet2!RC[48]+Sheet2!RC[53]+Sheet2!RC[58]+Sheet2!RC[63] -> 2905018 | E21: =RC[6]+RC[11]+RC[16]+RC[21]+RC[26]+RC[31]+RC[36]+RC[41]+RC[46]+RC[51]+RC[56]+RC[61]+RC[66]+RC[71]+RC[76]+RC[81]+RC[86]+RC[91]+RC[96]+RC[101]+RC[106]+RC[111]+RC[116]+RC[121]+RC[126]+RC[131]+RC[136]+RC[141]+RC[146]+RC[151]+RC[156]+RC[161]+RC[166]+RC[171]+RC[176]+RC[181]+RC[186]+RC[191]+RC[196]+RC[201]+RC[206]+RC[211]+RC[216]+RC[221]+RC[226]+RC[231]+RC[236]+RC[241]+Sheet2!RC+Sheet2!RC[5]+Sheet2!RC[10]+Sheet2!RC[15]+Sheet2!RC[20]+Sheet2!RC[25]+Sheet2!RC[30]+Sheet2!RC[35]+Sheet2!RC[40]+Sheet2!RC[45]+Sheet2!RC[50]+Sheet2!RC[55]+Sheet2!RC[60]+Sheet2!RC[65] -> 747936.03441234014 | F21: =SUM(RC[-4]:RC[-1]) -> 11284474.503812339 | G21: =Sheet1!RC[5]+Sheet1!RC[10]+Sheet1!RC[15]+Sheet1!RC[20]+Sheet1!RC[25]+Sheet1!RC[30]+Sheet1!RC[35]+Sheet1!RC[40]+Sheet1!RC[45]+Sheet1!RC[50]+Sheet1!RC[55]+Sheet1!RC[60]+Sheet1!RC[65]+Sheet1!RC[70]+Sheet1!RC[75]+Sheet1!RC[80]+Sheet1!RC[85]+Sheet1!RC[90]+Sheet1!RC[95]+Sheet1!RC[100]+Sheet1!RC[105]+Sheet1!RC[110]+Sheet1!RC[115]+Sheet1!RC[120]+Sheet1!RC[125]+Sheet1!RC[130]+Sheet1!RC[135]+Sheet1!RC[140]+Sheet1!RC[145]+Sheet1!RC[150]+Sheet1!RC[155]+Sheet1!RC[160]+Sheet1!RC[165]+Sheet1!RC[170]+Sheet1!RC[175]+Sheet1!RC[180]+Sheet1!RC[185]+Sheet1!RC[190]+Sheet1!RC[195]+Sheet1!RC[200]+Sheet1!RC[205]+Sheet1!RC[210]+Sheet1!RC[215]+Sheet1!RC[220]+Sheet1!RC[225]+Sheet1!RC[230]+Sheet1!RC[235]+Sheet1!RC[240]+Sheet2!RC[-1]+Sheet2!RC[4]+Sheet2!RC[9]+Sheet2!RC[14]+Sheet2!RC[19]+Sheet2!RC[24]+Sheet2!RC[29]+Sheet2!RC[34]+Sheet2!RC[39]+Sheet2!RC[44]+Sheet2!RC[49]+Sheet2!RC[54]+Sheet2!RC[59]+Sheet2!RC[64] -> 11284474.503812337 | H21: 82730 | I21: 209112 | J21: 61.26 | K21: 13899.239345057002 | L21: =SUM(RC[-4]:RC[-1]) -> 305802.499345057 | M21: 10569 | N21: 31241.26 | O21: 12.42 | P21: 2181.4128149569997 | Q21: =SUM(RC[-4]:RC[-1]) -> 44004.092814956995 | R21: 83491 | S21: 249533.37 | T21: 428.09 | U21: 12366.841168577999 | V21: =SUM(RC[-4]:RC[-1]) -> 345819.30116857804 | W21: 51261 | X21: 132524.82 | Y21: 37.32 | Z21: 8503.2761581520008 | AA21: =SUM(RC[-4]:RC[-1]) -> 192326.41615815202 | AB21: 18577 | AC21: 40579.51 | AD21: 0 | AE21: 8181.2282808550008 | AF21: =SUM(RC[-4]:RC[-1]) -> 67337.738280855003 | AG21: 16892 | AH21: 49862.74 | AI21: 0 | AJ21: 3270.8589094859999 | AK21: =SUM(RC[-4]:RC[-1]) -> 70025.598909485998 | AL21: 29665 | AM21: 62369.58 | AN21: 232.1 | AO21: 8609.048332868997 | AP21: =SUM(RC[-4]:RC[-1]) -> 100875.72833286901 | AQ21: 19983 | AR21: 44984.23 | AS21: 0 | AT21: 3403.7892879714982 | AU21: =SUM(RC[-4]:RC[-1]) -> 68371.019287971503 | AV21: 10701 | AW21: 28232.18 | AX21: 91.73 | AY21: 2854.456326986 | AZ21: =SUM(RC[-4]:RC[-1]) -> 41879.366326986004 | BA21: 17724 | BB21: 53588.411 | BC21: 3.17 | BD21: 3939.9348445719979 | BE21: =SUM(RC[-4]:RC[-1]) -> 75255.515844571986 | BF21: 15181 | BG21: 49362.12 | BH21: 0.46 | BI21: 3437.1647125409995 | BJ21: =SUM(RC[-4]:RC[-1]) -> 67980.744712540996 | BK21: 13212 | BL21: 39382.239999999998 | BM21: 31.36 | BN21: 2640.2640505950008 | BO21: =SUM(RC[-4]:RC[-1]) -> 55265.864050595002 | BP21: 11984 | BQ21: 23194.45 | BR21: 19.829999999999998 | BS21: 3607.7205319619998 | BT21: =SUM(RC[-4]:RC[-1]) -> 38806.000531961996 | BU21: 55395 | BV21: 144314.34 | BW21: 0.36 | BX21: 12119.526330997 | BY21: =SUM(RC[-4]:RC[-1]) -> 211829.22633099699 | BZ21: 168237 | CA21: 530693.78 | CB21: 1141.644 | CC21: 43716.087583550005 | CD21: =SUM(RC[-4]:RC[-1]) -> 743788.51158355002 | CE21: 10214 | CF21: 27287.413 | CG21: 0 | CH21: 4957.310971351003 | CI21: =SUM(RC[-4]:RC[-1]) -> 42458.723971351006 | CJ21: 10828 | CK21: 24274.92 | CL21: 0.75 | CM21: 2543.9035123000008 | CN21: =SUM(RC[-4]:RC[-1]) -> 37647.573512299998 | CO21: 9831 | CP21: 26915.8 | CQ21: 0 | CR21: 2434.8914182970002 | CS21: =SUM(RC[-4]:RC[-1]) -> 39181.691418297007 | CT21: 21557 | CU21: 71334.3 | CV21: 0 | CW21: 2538.7209717249989 | CX21: =SUM(RC[-4]:RC[-1]) -> 95430.020971724996 | CY21: 14470 | CZ21: 41389.14 | DA21: 167.3 | DB21: 2121.8010044149987 | DC21: =SUM(RC[-4]:RC[-1]) -> 58148.241004415002 | DD21: 2899 | DE21: 4781.96 | DF21: 0 | DG21: 811.84604969300051 | DH21: =SUM(RC[-4]:RC[-1]) -> 8492.8060496930011 | DI21: 17310 | DJ21: 42356.4 | DK21: 0 | DL21: 3631.5185951790017 | DM21: =SUM(RC[-4]:RC[-1]) -> 63297.918595179006 | DN21: 26436 | DO21: 67551.39 | DP21: 58.207999999999998 | DQ21: 3607.4046145349994 | DR21: =SUM(RC[-4]:RC[-1]) -> 97653.002614534998 | DS21: 130722 | DT21: 356242.48 | DU21: 1801.29 | DV21: 33838.155304677006 | DW21: =SUM(RC[-4]:RC[-1]) -> 522603.92530467699 | DX21: 5996 | DY21: 18045.169999999998 | DZ21: 0.46 | EA21: 1973.8812394599995 | EB21: =SUM(RC[-4]:RC[-1]) -> 26015.511239459996 | EC21: 15219 | ED21: 50938.7 | EE21: 2E-3 | EF21: 2432.8426899649994 | EG21: =SUM(RC[-4]:RC[-1]) -> 68590.544689964983 | EH21: 15866 | EI21: 33699.9 | EJ21: 0 | EK21: 2003.1339267589997 | EL21: =SUM(RC[-4]:RC[-1]) -> 51569.033926759002 | EM21: 165705 | EN21: 399225.36 | EO21: 538.59 | EP21: 35317.33000005599 | EQ21: =SUM(RC[-4]:RC[-1]) -> 600786.28000005591 | ER21: 15270 | ES21: 46298.8 | ET21: 81.819999999999993 | EU21: 1762.8262308080002 | EV21: =SUM(RC[-4]:RC[-1]) -> 63413.446230808004 | EW21: 328695 | EX21: 739900.73 | EY21: 5421.57 | EZ21: 66107.462780017973 | FA21: =SUM(RC[-4]:RC[-1]) -> 1140124.7627800179 | FB21: 104523 | FC21: 218307.25 | FD21: 3357.84 | FE21: 79350.477629394954 | FF21: =SUM(RC[-4]:RC[-1]) -> 405538.56762939499 | FG21: 33590 | FH21: 94265.65 | FI21: 1072.18 | FJ21: 8828.160471584004 | FK21: =SUM(RC[-4]:RC[-1]) -> 137755.99047158399 | FL21: 51697 | FM21: 139075.88 | FN21: 1911.9469999999999 | FO21: 9244.2652598029981 | FP21: =SUM(RC[-4]:RC[-1]) -> 201929.092259803 | FQ21: 100493 | FR21: 264442.42 | FS21: 68.209999999999994 | FT21: 23394.507681985993 | FU21: =SUM(RC[-4]:RC[-1]) -> 388398.13768198597 | FV21: 26063 | FW21: 76768.600000000006 | FX21: 2.44 | FY21: 5098.5613000179992 | FZ21: =SUM(RC[-4]:RC[-1]) -> 107932.60130001801 | GA21: 69474 | GB21: 198199.8 | GC21: 421.82 | GD21: 12762.813371239998 | GE21: =SUM(RC[-4]:RC[-1]) -> 280858.43337123998 | GF21: 7620 | GG21: 19494.23 | GH21: 5 | GI21: 1343.0184150319997 | GJ21: =SUM(RC[-4]:RC[-1]) -> 28462.248415031998 | GK21: 23719 | GL21: 78600.2 | GM21: 123.8 | GN21: 4451.8296949679961 | GO21: =SUM(RC[-4]:RC[-1]) -> 106894.82969496799 | GP21: 13342 | GQ21: 35285.699999999997 | GR21: 0 | GS21: 3164.793013753002 | GT21: =SUM(RC[-4]:RC[-1]) -> 51792.493013753003 | GU21: 25651 | GV21: 51650.09 | GW21: 0 | GX21: 4226.1822874639975 | GY21: =SUM(RC[-4]:RC[-1]) -> 81527.272287463988 | GZ21: 167051 | HA21: 489854.38 | HB21: 2627.36 | HC21: 68104.716176419985 | HD21: =SUM(RC[-4]:RC[-1]) -> 727637.45617641998 | HE21: 34317 | HF21: 79845.320000000007 | HG21: 51.73 | HH21: 5036.7458763550012 | HI21: =SUM(RC[-4]:RC[-1]) -> 119250.795876355 | HJ21: 51387 | HK21: 174563.7 | HL21: 477.7 | HM21: 11441.994145740999 | HN21: =SUM(RC[-4]:RC[-1]) -> 237870.39414574101 | HO21: 49080 | HP21: 78253.8 | HQ21: 74.13 | HR21: 13505.174219005996 | HS21: =SUM(RC[-4]:RC[-1]) -> 140913.104219006 | HT21: 51955 | HU21: 110503.89 | HV21: 279.31 | HW21: 4282.998357112001 | HX21: =SUM(RC[-4]:RC[-1]) -> 167021.19835711201 | HY21: 27895 | HZ21: 85050.96 | IA21: 1269.3499999999999 | IB21: 8315.5145548499968 | IC21: =SUM(RC[-4]:RC[-1]) -> 122530.82455485001 | ID21: 7779 | IE21: 17432.580000000002 | IF21: 0 | IG21: 4919.722284722 | IH21: =SUM(RC[-4]:RC[-1]) -> 30131.302284722002 | II21: 3620 | IJ21: 10909.46 | IK21: 223.22 | IL21: 892.40424685500034 | IM21: =SUM(RC[-4]:RC[-1]) -> 15645.084246854998
A22: CADMIUM | B22: =RC[8]+RC[13]+RC[18]+RC[23]+RC[28]+RC[33]+RC[38]+RC[43]+RC[48]+RC[53]+RC[58]+RC[63]+RC[68]+RC[73]+RC[78]+RC[83]+RC[88]+RC[93]+RC[98]+RC[103]+RC[108]+RC[113]+RC[118]+RC[123]+RC[128]+RC[133]+RC[138]+RC[143]+RC[148]+RC[153]+RC[158]+RC[163]+RC[168]+RC[173]+RC[178]+RC[183]+RC[188]+RC[193]+RC[198]+RC[203]+RC[208]+RC[213]+RC[218]+RC[223]+RC[228]+RC[233]+RC[238]+RC[243]+Sheet2!RC[2]+Sheet2!RC[7]+Sheet2!RC[12]+Sheet2!RC[17]+Sheet2!RC[22]+Sheet2!RC[27]+Sheet2!RC[32]+Sheet2!RC[37]+Sheet2!RC[42]+Sheet2!RC[47]+Sheet2!RC[57]+Sheet2!RC[52]+Sheet2!RC[62]+Sheet2!RC[67] -> 6015.4589999999998 | C22: =RC[6]+RC[11]+RC[16]+RC[21]+RC[26]+RC[31]+RC[36]+RC[41]+RC[46]+RC[51]+RC[56]+RC[61]+RC[66]+RC[71]+RC[76]+RC[81]+RC[86]+RC[91]+RC[96]+RC[101]+RC[106]+RC[111]+RC[116]+RC[121]+RC[126]+RC[131]+RC[136]+RC[141]+RC[146]+RC[151]+RC[156]+RC[161]+RC[166]+RC[171]+RC[176]+RC[181]+RC[186]+RC[191]+RC[196]+RC[201]+RC[206]+RC[211]+RC[216]+RC[221]+RC[226]+RC[231]+RC[236]+RC[241]+Sheet2!RC+Sheet2!RC[5]+Sheet2!RC[10]+Sheet2!RC[15]+Sheet2!RC[20]+Sheet2!RC[25]+Sheet2!RC[30]+Sheet2!RC[35]+Sheet2!RC[40]+Sheet2!RC[45]+Sheet2!RC[50]+Sheet2!RC[55]+Sheet2!RC[60]+Sheet2!RC[65] -> 0 | D22: =RC[4]+RC[9]+RC[14]+RC[19]+RC[24]+RC[29]+RC[34]+RC[39]+RC[44]+RC[49]+RC[54]+RC[59]+RC[64]+RC[69]+RC[74]+RC[79]+RC[84]+RC[89]+RC[94]+RC[99]+RC[104]+RC[109]+RC[114]+RC[119]+RC[124]+RC[129]+RC[134]+RC[139]+RC[144]+RC[149]+RC[154]+RC[159]+RC[164]+RC[169]+RC[174]+RC[179]+RC[184]+RC[189]+RC[194]+RC[199]+RC[204]+RC[209]+RC[214]+RC[219]+RC[224]+RC[229]+RC[234]+RC[239]+Sheet2!RC[3]+Sheet2!RC[-2]+Sheet2!RC[8]+Sheet2!RC[13]+Sheet2!RC[18]+Sheet2!RC[23]+Sheet2!RC[28]+Sheet2!RC[33]+Sheet2!RC[38]+Sheet2!RC[43]+Sheet2!RC[48]+Sheet2!RC[53]+Sheet2!RC[58]+Sheet2!RC[63] -> 0 | E22: =RC[6]+RC[11]+RC[16]+RC[21]+RC[26]+RC[31]+RC[36]+RC[41]+RC[46]+RC[51]+RC[56]+RC[61]+RC[66]+RC[71]+RC[76]+RC[81]+RC[86]+RC[91]+RC[96]+RC[101]+RC[106]+RC[111]+RC[116]+RC[121]+RC[126]+RC[131]+RC[136]+RC[141]+RC[146]+RC[151]+RC[156]+RC[161]+RC[166]+RC[171]+RC[176]+RC[181]+RC[186]+RC[191]+RC[196]+RC[201]+RC[206]+RC[211]+RC[216]+RC[221]+RC[226]+RC[231]+RC[236]+RC[241]+Sheet2!RC+Sheet2!RC[5]+Sheet2!RC[10]+Sheet2!RC[15]+Sheet2!RC[20]+Sheet2!RC[25]+Sheet2!RC[30]+Sheet2!RC[35]+Sheet2!RC[40]+Sheet2!RC[45]+Sheet2!RC[50]+Sheet2!RC[55]+Sheet2!RC[60]+Sheet2!RC[65] -> 0 | F22: =SUM(RC[-4]:RC[-1]) -> 6015.4589999999998 | G22: =Sheet1!RC[5]+Sheet1!RC[10]+Sheet1!RC[15]+Sheet1!RC[20]+Sheet1!RC[25]+Sheet1!RC[30]+Sheet1!RC[35]+Sheet1!RC[40]+Sheet1!RC[45]+Sheet1!RC[50]+Sheet1!RC[55]+Sheet1!RC[60]+Sheet1!RC[65]+Sheet1!RC[70]+Sheet1!RC[75]+Sheet1!RC[80]+Sheet1!RC[85]+Sheet1!RC[90]+Sheet1!RC[95]+Sheet1!RC[100]+Sheet1!RC[105]+Sheet1!RC[110]+Sheet1!RC[115]+Sheet1!RC[120]+Sheet1!RC[125]+Sheet1!RC[130]+Sheet1!RC[135]+Sheet1!RC[140]+Sheet1!RC[145]+Sheet1!RC[150]+Sheet1!RC[155]+Sheet1!RC[160]+Sheet1!RC[165]+Sheet1!RC[170]+Sheet1!RC[175]+Sheet1!RC[180]+Sheet1!RC[185]+Sheet1!RC[190]+Sheet1!RC[195]+Sheet1!RC[200]+Sheet1!RC[205]+Sheet1!RC[210]+Sheet1!RC[215]+Sheet1!RC[220]+Sheet1!RC[225]+Sheet1!RC[230]+Sheet1!RC[235]+Sheet1!RC[240]+Sheet2!RC[-1]+Sheet2!RC[4]+Sheet2!RC[9]+Sheet2!RC[14]+Sheet2!RC[19]+Sheet2!RC[24]+Sheet2!RC[29]+Sheet2!RC[34]+Sheet2!RC[39]+Sheet2!RC[44]+Sheet2!RC[49]+Sheet2!RC[54]+Sheet2!RC[59]+Sheet2!RC[64] -> 6015.4589999999998 | H22: 0 | I22: 0 | J22: 891 | K22: 0 | L22: =SUM(RC[-4]:RC[-1]) -> 891 | M22: 0 | N22: 0 | O22: 0 | P22: 0 | Q22: =SUM(RC[-4]:RC[-1]) -> 0 | R22: 0 | S22: 0 | T22: 0 | U22: 0 | V22: =SUM(RC[-4]:RC[-1]) -> 0 | W22: 0 | X22: 0 | Y22: 56.9 | Z22: 0 | AA22: =SUM(RC[-4]:RC[-1]) -> 56.9 | AB22: 0 | AC22: 0 | AD22: 0 | AE22: 0 | AF22: =SUM(RC[-4]:RC[-1]) -> 0 | AG22: 0 | AH22: 0 | AI22: 54.63 | AJ22: 0 | AK22: =SUM(RC[-4]:RC[-1]) -> 54.63 | AL22: 0 | AM22: 0 | AN22: 217.07 | AO22: 0 | AP22: =SUM(RC[-4]:RC[-1]) -> 217.07 | AQ22: 0 | AR22: 0 | AS22: 11.3 | AT22: 0 | AU22: =SUM(RC[-4]:RC[-1]) -> 11.3 | AV22: 0 | AW22: 0 | AX22: 2.62 | AY22: 0 | AZ22: =SUM(RC[-4]:RC[-1]) -> 2.62 | BA22: 0 | BB22: 0 | BC22: 0.64 | BD22: 0 | BE22: =SUM(RC[-4]:RC[-1]) -> 0.64 | BF22: 0 | BG22: 0 | BH22: 0.99 | BI22: 0 | BJ22: =SUM(RC[-4]:RC[-1]) -> 0.99 | BK22: 0 | BL22: 0 | BM22: 10 | BN22: 0 | BO22: =SUM(RC[-4]:RC[-1]) -> 10 | BP22: 0 | BQ22: 0 | BR22: 11.36 | BS22: 0 | BT22: =SUM(RC[-4]:RC[-1]) -> 11.36 | BU22: 0 | BV22: 0 | BW22: 1.6 | BX22: 0 | BY22: =SUM(RC[-4]:RC[-1]) -> 1.6 | BZ22: 0 | CA22: 0 | CB22: 927.46 | CC22: 0 | CD22: =SUM(RC[-4]:RC[-1]) -> 927.46 | CE22: 0 | CF22: 0 | CG22: 10.117000000000001 | CH22: 0 | CI22: =SUM(RC[-4]:RC[-1]) -> 10.117000000000001 | CJ22: 0 | CK22: 0 | CL22: 0 | CM22: 0 | CN22: =SUM(RC[-4]:RC[-1]) -> 0 | CO22: 0 | CP22: 0 | CQ22: 0 | CR22: 0 | CS22: =SUM(RC[-4]:RC[-1]) -> 0 | CT22: 0 | CU22: 0 | CV22: 0 | CW22: 0 | CX22: =SUM(RC[-4]:RC[-1]) -> 0 | CY22: 0 | CZ22: 0 | DA22: 597.9 | DB22: 0 | DC22: =SUM(RC[-4]:RC[-1]) -> 597.9 | DD22: 0 | DE22: 0 | DF22: 0 | DG22: 0 | DH22: =SUM(RC[-4]:RC[-1]) -> 0 | DI22: 0 | DJ22: 0 | DK22: 6.14 | DL22: 0 | DM22: =SUM(RC[-4]:RC[-1]) -> 6.14 | DN22: 0 | DO22: 0 | DP22: 10.19 | DQ22: 0 | DR22: =SUM(RC[-4]:RC[-1]) -> 10.19 | DS22: 0 | DT22: 0 | DU22: 31.036999999999999 | DV22: 0 | DW22: =SUM(RC[-4]:RC[-1]) -> 31.036999999999999 | DX22: 0 | DY22: 0 | DZ22: 5.7 | EA22: 0 | EB22: =SUM(RC[-4]:RC[-1]) -> 5.7 | EC22: 0 | ED22: 0 | EE22: 25.15 | EF22: 0 | EG22: =SUM(RC[-4]:RC[-1]) -> 25.15 | EH22: 0 | EI22: 0 | EJ22: 0 | EK22: 0 | EL22: =SUM(RC[-4]:RC[-1]) -> 0 | EM22: 0 | EN22: 0 | EO22: 291.12 | EP22: 0 | EQ22: =SUM(RC[-4]:RC[-1]) -> 291.12 | ER22: 0 | ES22: 0 | ET22: 159.47 | EU22: 0 | EV22: =SUM(RC[-4]:RC[-1]) -> 159.47 | EW22: 0 | EX22: 0 | EY22: 216.11 | EZ22: 0 | FA22: =SUM(RC[-4]:RC[-1]) -> 216.11 | FB22: 0 | FC22: 0 | FD22: 0 | FE22: 0 | FF22: =SUM(RC[-4]:RC[-1]) -> 0 | FG22: 0 | FH22: 0 | FI22: 297.83 | FJ22: 0 | FK22: =SUM(RC[-4]:RC[-1]) -> 297.83 | FL22: 0 | FM22: 0 | FN22: 63.97 | FO22: 0 | FP22: =SUM(RC[-4]:RC[-1]) -> 63.97 | FQ22: 0 | FR22: 0 | FS22: 20.62 | FT22: 0 | FU22: =SUM(RC[-4]:RC[-1]) -> 20.62 | FV22: 0 | FW22: 0 | FX22: 60.54 | FY22: 0 | FZ22: =SUM(RC[-4]:RC[-1]) -> 60.54 | GA22: 0 | GB22: 0 | GC22: 44 | GD22: 0 | GE22: =SUM(RC[-4]:RC[-1]) -> 44 | GF22: 0 | GG22: 0 | GH22: 0 | GI22: 0 | GJ22: =SUM(RC[-4]:RC[-1]) -> 0 | GK22: 0 | GL22: 0 | GM22: 125.57 | GN22: 0 | GO22: =SUM(RC[-4]:RC[-1]) -> 125.57 | GP22: 0 | GQ22: 0 | GR22: 0.86 | GS22: 0 | GT22: =SUM(RC[-4]:RC[-1]) -> 0.86 | GU22: 0 | GV22: 0 | GW22: 0 | GX22: 0 | GY22: =SUM(RC[-4]:RC[-1]) -> 0 | GZ22: 0 | HA22: 0 | HB22: 6.01 | HC22: 0 | HD22: =SUM(RC[-4]:RC[-1]) -> 6.01 | HE22: 0 | HF22: 0 | HG22: 2.77 | HH22: 0 | HI22: =SUM(RC[-4]:RC[-1]) -> 2.77 | HJ22: 0 | HK22: 0 | HL22: 164.08 | HM22: 0 | HN22: =SUM(RC[-4]:RC[-1]) -> 164.08 | HO22: 0 | HP22: 0 | HQ22: 151.76 | HR22: 0 | HS22: =SUM(RC[-4]:RC[-1]) -> 151.76 | HT22: 0 | HU22: 0 | HV22: 29.68 | HW22: 0 | HX22: =SUM(RC[-4]:RC[-1]) -> 29.68 | HY22: 0 | HZ22: 0 | IA22: 29.78 | IB22: 0 | IC22: =SUM(RC[-4]:RC[-1]) -> 29.78 | ID22: 0 | IE22: 0 | IF22: 0 | IG22: 0 | IH22: =SUM(RC[-4]:RC[-1]) -> 0 | II22: 0 | IJ22: 0 | IK22: 37.295000000000002 | IL22: 0 | IM22: =SUM(RC[-4]:RC[-1]) -> 37.295000000000002
A23: CARBON TETRA | B23: =RC[8]+RC[13]+RC[18]+RC[23]+RC[28]+RC[33]+RC[38]+RC[43]+RC[48]+RC[53]+RC[58]+RC[63]+RC[68]+RC[73]+RC[78]+RC[83]+RC[88]+RC[93]+RC[98]+RC[103]+RC[108]+RC[113]+RC[118]+RC[123]+RC[128]+RC[133]+RC[138]+RC[143]+RC[148]+RC[153]+RC[158]+RC[163]+RC[168]+RC[173]+RC[178]+RC[183]+RC[188]+RC[193]+RC[198]+RC[203]+RC[208]+RC[213]+RC[218]+RC[223]+RC[228]+RC[233]+RC[238]+RC[243]+Sheet2!RC[2]+Sheet2!RC[7]+Sheet2!RC[12]+Sheet2!RC[17]+Sheet2!RC[22]+Sheet2!RC[27]+Sheet2!RC[32]+Sheet2!RC[37]+Sheet2!RC[42]+Sheet2!RC[47]+Sheet2!RC[57]+Sheet2!RC[52]+Sheet2!RC[62]+Sheet2!RC[67] -> 15167.984899999999 | C23: =RC[6]+RC[11]+RC[16]+RC[21]+RC[26]+RC[31]+RC[36]+RC[41]+RC[46]+RC[51]+RC[56]+RC[61]+RC[66]+RC[71]+RC[76]+RC[81]+RC[86]+RC[91]+RC[96]+RC[101]+RC[106]+RC[111]+RC[116]+RC[121]+RC[126]+RC[131]+RC[136]+RC[141]+RC[146]+RC[151]+RC[156]+RC[161]+RC[166]+RC[171]+RC[176]+RC[181]+RC[186]+RC[191]+RC[196]+RC[201]+RC[206]+RC[211]+RC[216]+RC[221]+RC[226]+RC[231]+RC[236]+RC[241]+Sheet2!RC+Sheet2!RC[5]+Sheet2!RC[10]+Sheet2!RC[15]+Sheet2!RC[20]+Sheet2!RC[25]+Sheet2!RC[30]+Sheet2!RC[35]+Sheet2!RC[40]+Sheet2!RC[45]+Sheet2!RC[50]+Sheet2!RC[55]+Sheet2!RC[60]+Sheet2!RC[65] -> 12459.578000000001 | D23: =RC[4]+RC[9]+RC[14]+RC[19]+RC[24]+RC[29]+RC[34]+RC[39]+RC[44]+RC[49]+RC[54]+RC[59]+RC[64]+RC[69]+RC[74]+RC[79]+RC[84]+RC[89]+RC[94]+RC[99]+RC[104]+RC[109]+RC[114]+RC[119]+RC[124]+RC[129]+RC[134]+RC[139]+RC[144]+RC[149]+RC[154]+RC[159]+RC[164]+RC[169]+RC[174]+RC[179]+RC[184]+RC[189]+RC[194]+RC[199]+RC[204]+RC[209]+RC[214]+RC[219]+RC[224]+RC[229]+RC[234]+RC[239]+Sheet2!RC[3]+Sheet2!RC[-2]+Sheet2!RC[8]+Sheet2!RC[13]+Sheet2!RC[18]+Sheet2!RC[23]+Sheet2!RC[28]+Sheet2!RC[33]+Sheet2!RC[38]+Sheet2!RC[43]+Sheet2!RC[48]+Sheet2!RC[53]+Sheet2!RC[58]+Sheet2!RC[63] -> 0 | E23: =RC[6]+RC[11]+RC[16]+RC[21]+RC[26]+RC[31]+RC[36]+RC[41]+RC[46]+RC[51]+RC[56]+RC[61]+RC[66]+RC[71]+RC[76]+RC[81]+RC[86]+RC[91]+RC[96]+RC[101]+RC[106]+RC[111]+RC[116]+RC[121]+RC[126]+RC[131]+RC[136]+RC[141]+RC[146]+RC[151]+RC[156]+RC[161]+RC[166]+RC[171]+RC[176]+RC[181]+RC[186]+RC[191]+RC[196]+RC[201]+RC[206]+RC[211]+RC[216]+RC[221]+RC[226]+RC[231]+RC[236]+RC[241]+Sheet2!RC+Sheet2!RC[5]+Sheet2!RC[10]+Sheet2!RC[15]+Sheet2!RC[20]+Sheet2!RC[25]+Sheet2!RC[30]+Sheet2!RC[35]+Sheet2!RC[40]+Sheet2!RC[45]+Sheet2!RC[50]+Sheet2!RC[55]+Sheet2!RC[60]+Sheet2!RC[65] -> 0 | F23: =SUM(RC[-4]:RC[-1]) -> 27627.562900000001 | G23: =Sheet1!RC[5]+Sheet1!RC[10]+Sheet1!RC[15]+Sheet1!RC[20]+Sheet1!RC[25]+Sheet1!RC[30]+Sheet1!RC[35]+Sheet1!RC[40]+Sheet1!RC[45]+Sheet1!RC[50]+Sheet1!RC[55]+Sheet1!RC[60]+Sheet1!RC[65]+Sheet1!RC[70]+Sheet1!RC[75]+Sheet1!RC[80]+Sheet1!RC[85]+Sheet1!RC[90]+Sheet1!RC[95]+Sheet1!RC[100]+Sheet1!RC[105]+Sheet1!RC[110]+Sheet1!RC[115]+Sheet1!RC[120]+Sheet1!RC[125]+Sheet1!RC[130]+Sheet1!RC[135]+Sheet1!RC[140]+Sheet1!RC[145]+Sheet1!RC[150]+Sheet1!RC[155]+Sheet1!RC[160]+Sheet1!RC[165]+Sheet1!RC[170]+Sheet1!RC[175]+Sheet1!RC[180]+Sheet1!RC[185]+Sheet1!RC[190]+Sheet1!RC[195]+Sheet1!RC[200]+Sheet1!RC[205]+Sheet1!RC[210]+Sheet1!RC[215]+Sheet1!RC[220]+Sheet1!RC[225]+Sheet1!RC[230]+Sheet1!RC[235]+Sheet1!RC[240]+Sheet2!RC[-1]+Sheet2!RC[4]+Sheet2!RC[9]+Sheet2!RC[14]+Sheet2!RC[19]+Sheet2!RC[24]+Sheet2!RC[29]+Sheet2!RC[34]+Sheet2!RC[39]+Sheet2!RC[44]+Sheet2!RC[49]+Sheet2!RC[54]+Sheet2!RC[59]+Sheet2!RC[64] -> 27627.562900000001 | H23: 0 | I23: 261.39 | J23: 12.43 | K23: 0 | L23: =SUM(RC[-4]:RC[-1]) -> 273.82 | M23: 0 | N23: 16.125 | O23: 0 | P23: 0 | Q23: =SUM(RC[-4]:RC[-1]) -> 16.125 | R23: 0 | S23: 702.26 | T23: 0 | U23: 0 | V23: =SUM(RC[-4]:RC[-1]) -> 702.26 | W23: 0 | X23: 108.124 | Y23: 0.33300000000000002 | Z23: 0 | AA23: =SUM(RC[-4]:RC[-1]) -> 108.45699999999999 | AB23: 0 | AC23: 41.8 | AD23: 0 | AE23: 0 | AF23: =SUM(RC[-4]:RC[-1]) -> 41.8 | AG23: 0 | AH23: 39.225000000000001 | AI23: 0 | AJ23: 0 | AK23: =SUM(RC[-4]:RC[-1]) -> 39.225000000000001 | AL23: 0 | AM23: 97.137 | AN23: 4.8498999999999999 | AO23: 0 | AP23: =SUM(RC[-4]:RC[-1]) -> 101.98690000000001 | AQ23: 0 | AR23: 75.69 | AS23: 0.25 | AT23: 0 | AU23: =SUM(RC[-4]:RC[-1]) -> 75.94 | AV23: 0 | AW23: 12.448 | AX23: 30.05 | AY23: 0 | AZ23: =SUM(RC[-4]:RC[-1]) -> 42.498000000000005 | BA23: 0 | BB23: 75.138999999999996 | BC23: 19.420000000000002 | BD23: 0 | BE23: =SUM(RC[-4]:RC[-1]) -> 94.558999999999997 | BF23: 0 | BG23: 15.71 | BH23: 0.15 | BI23: 0 | BJ23: =SUM(RC[-4]:RC[-1]) -> 15.860000000000001 | BK23: 0 | BL23: 35.950000000000003 | BM23: 10.28 | BN23: 0 | BO23: =SUM(RC[-4]:RC[-1]) -> 46.230000000000004 | BP23: 0 | BQ23: 18.739999999999998 | BR23: 0.09 | BS23: 0 | BT23: =SUM(RC[-4]:RC[-1]) -> 18.829999999999998 | BU23: 0 | BV23: 74.978999999999999 | BW23: 0.11 | BX23: 0 | BY23: =SUM(RC[-4]:RC[-1]) -> 75.088999999999999 | BZ23: 0 | CA23: 1001.29 | CB23: 48.84 | CC23: 0 | CD23: =SUM(RC[-4]:RC[-1]) -> 1050.1299999999999 | CE23: 0 | CF23: 17.18 | CG23: 0 | CH23: 0 | CI23: =SUM(RC[-4]:RC[-1]) -> 17.18 | CJ23: 0 | CK23: 22.78 | CL23: 0 | CM23: 0 | CN23: =SUM(RC[-4]:RC[-1]) -> 22.78 | CO23: 0 | CP23: 37.164000000000001 | CQ23: 0 | CR23: 0 | CS23: =SUM(RC[-4]:RC[-1]) -> 37.164000000000001 | CT23: 0 | CU23: 31.64 | CV23: 0 | CW23: 0 | CX23: =SUM(RC[-4]:RC[-1]) -> 31.64 | CY23: 0 | CZ23: 12.62 | DA23: 0 | DB23: 0 | DC23: =SUM(RC[-4]:RC[-1]) -> 12.62 | DD23: 0 | DE23: 1.41 | DF23: 0 | DG23: 0 | DH23: =SUM(RC[-4]:RC[-1]) -> 1.41 | DI23: 0 | DJ23: 52.28 | DK23: 1E-3 | DL23: 0 | DM23: =SUM(RC[-4]:RC[-1]) -> 52.280999999999999 | DN23: 0 | DO23: 84.06 | DP23: 49.46 | DQ23: 0 | DR23: =SUM(RC[-4]:RC[-1]) -> 133.52000000000001 | DS23: 0 | DT23: 2370.127 | DU23: 2.1909999999999998 | DV23: 0 | DW23: =SUM(RC[-4]:RC[-1]) -> 2372.3179999999998 | DX23: 0 | DY23: 4.83 | DZ23: 7.81 | EA23: 0 | EB23: =SUM(RC[-4]:RC[-1]) -> 12.64 | EC23: 0 | ED23: 29.64 | EE23: 0 | EF23: 0 | EG23: =SUM(RC[-4]:RC[-1]) -> 29.64 | EH23: 0 | EI23: 24.14 | EJ23: 0 | EK23: 0 | EL23: =SUM(RC[-4]:RC[-1]) -> 24.14 | EM23: 0 | EN23: 588.17999999999995 | EO23: 6009.02 | EP23: 0 | EQ23: =SUM(RC[-4]:RC[-1]) -> 6597.2000000000007 | ER23: 0 | ES23: 56.46 | ET23: 25.722000000000001 | EU23: 0 | EV23: =SUM(RC[-4]:RC[-1]) -> 82.182000000000002 | EW23: 0 | EX23: 588.20000000000005 | EY23: 127.89 | EZ23: 0 | FA23: =SUM(RC[-4]:RC[-1]) -> 716.09 | FB23: 0 | FC23: 1474.74 | FD23: 0 | FE23: 0 | FF23: =SUM(RC[-4]:RC[-1]) -> 1474.74 | FG23: 0 | FH23: 364.43 | FI23: 6704.6 | FJ23: 0 | FK23: =SUM(RC[-4]:RC[-1]) -> 7069.0300000000007 | FL23: 0 | FM23: 245.38 | FN23: 7.86 | FO23: 0 | FP23: =SUM(RC[-4]:RC[-1]) -> 253.24 | FQ23: 0 | FR23: 401 | FS23: 21.16 | FT23: 0 | FU23: =SUM(RC[-4]:RC[-1]) -> 422.16 | FV23: 0 | FW23: 54.7 | FX23: 7.03 | FY23: 0 | FZ23: =SUM(RC[-4]:RC[-1]) -> 61.730000000000004 | GA23: 0 | GB23: 139.09 | GC23: 42 | GD23: 0 | GE23: =SUM(RC[-4]:RC[-1]) -> 181.09 | GF23: 0 | GG23: 17.3 | GH23: 0 | GI23: 0 | GJ23: =SUM(RC[-4]:RC[-1]) -> 17.3 | GK23: 0 | GL23: 43.7 | GM23: 39.4 | GN23: 0 | GO23: =SUM(RC[-4]:RC[-1]) -> 83.1 | GP23: 0 | GQ23: 17 | GR23: 0 | GS23: 0 | GT23: =SUM(RC[-4]:RC[-1]) -> 17 | GU23: 0 | GV23: 6.1230000000000002 | GW23: 0 | GX23: 0 | GY23: =SUM(RC[-4]:RC[-1]) -> 6.1230000000000002 | GZ23: 0 | HA23: 1316.73 | HB23: 0 | HC23: 0 | HD23: =SUM(RC[-4]:RC[-1]) -> 1316.73 | HE23: 0 | HF23: 97.91 | HG23: 20.63 | HH23: 0 | HI23: =SUM(RC[-4]:RC[-1]) -> 118.53999999999999 | HJ23: 0 | HK23: 367.68 | HL23: 117.55 | HM23: 0 | HN23: =SUM(RC[-4]:RC[-1]) -> 485.23 | HO23: 0 | HP23: 159.80000000000001 | HQ23: 0.08 | HR23: 0 | HS23: =SUM(RC[-4]:RC[-1]) -> 159.88000000000002 | HT23: 0 | HU23: 55.103000000000002 | HV23: 9.11 | HW23: 0 | HX23: =SUM(RC[-4]:RC[-1]) -> 64.212999999999994 | HY23: 0 | HZ23: 79.680000000000007 | IA23: 503.21 | IB23: 0 | IC23: =SUM(RC[-4]:RC[-1]) -> 582.89 | ID23: 0 | IE23: 5.99 | IF23: 0 | IG23: 0 | IH23: =SUM(RC[-4]:RC[-1]) -> 5.99 | II23: 0 | IJ23: 3.12 | IK23: 0 | IL23: 0 | IM23: =SUM(RC[-4]:RC[-1]) -> 3.12
A24: CHLOROFORM | B24: =RC[8]+RC[13]+RC[18]+RC[23]+RC[28]+RC[33]+RC[38]+RC[43]+RC[48]+RC[53]+RC[58]+RC[63]+RC[68]+RC[73]+RC[78]+RC[83]+RC[88]+RC[93]+RC[98]+RC[103]+RC[108]+RC[113]+RC[118]+RC[123]+RC[128]+RC[133]+RC[138]+RC[143]+RC[148]+RC[153]+RC[158]+RC[163]+RC[168]+RC[173]+RC[178]+RC[183]+RC[188]+RC[193]+RC[198]+RC[203]+RC[208]+RC[213]+RC[218]+RC[223]+RC[228]+RC[233]+RC[238]+RC[243]+Sheet2!RC[2]+Sheet2!RC[7]+Sheet2!RC[12]+Sheet2!RC[17]+Sheet2!RC[22]+Sheet2!RC[27]+Sheet2!RC[32]+Sheet2!RC[37]+Sheet2!RC[42]+Sheet2!RC[47]+Sheet2!RC[57]+Sheet2!RC[52]+Sheet2!RC[62]+Sheet2!RC[67] -> 11157.3169 | C24: =RC[6]+RC[11]+RC[16]+RC[21]+RC[26]+RC[31]+RC[36]+RC[41]+RC[46]+RC[51]+RC[56]+RC[61]+RC[66]+RC[71]+RC[76]+RC[81]+RC[86]+RC[91]+RC[96]+RC[101]+RC[106]+RC[111]+RC[116]+RC[121]+RC[126]+RC[131]+RC[136]+RC[141]+RC[146]+RC[151]+RC[156]+RC[161]+RC[166]+RC[171]+RC[176]+RC[181]+RC[186]+RC[191]+RC[196]+RC[201]+RC[206]+RC[211]+RC[216]+RC[221]+RC[226]+RC[231]+RC[236]+RC[241]+Sheet2!RC+Sheet2!RC[5]+Sheet2!RC[10]+Sheet2!RC[15]+Sheet2!RC[20]+Sheet2!RC[25]+Sheet2!RC[30]+Sheet2!RC[35]+Sheet2!RC[40]+Sheet2!RC[45]+Sheet2!RC[50]+Sheet2!RC[55]+Sheet2!RC[60]+Sheet2!RC[65] -> 70805.409000000014 | D24: =RC[4]+RC[9]+RC[14]+RC[19]+RC[24]+RC[29]+RC[34]+RC[39]+RC[44]+RC[49]+RC[54]+RC[59]+RC[64]+RC[69]+RC[74]+RC[79]+RC[84]+RC[89]+RC[94]+RC[99]+RC[104]+RC[109]+RC[114]+RC[119]+RC[124]+RC[129]+RC[134]+RC[139]+RC[144]+RC[149]+RC[154]+RC[159]+RC[164]+RC[169]+RC[174]+RC[179]+RC[184]+RC[189]+RC[194]+RC[199]+RC[204]+RC[209]+RC[214]+RC[219]+RC[224]+RC[229]+RC[234]+RC[239]+Sheet2!RC[3]+Sheet2!RC[-2]+Sheet2!RC[8]+Sheet2!RC[13]+Sheet2!RC[18]+Sheet2!RC[23]+Sheet2!RC[28]+Sheet2!RC[33]+Sheet2!RC[38]+Sheet2!RC[43]+Sheet2!RC[48]+Sheet2!RC[53]+Sheet2!RC[58]+Sheet2!RC[63] -> 0 | E24: =RC[6]+RC[11]+RC[16]+RC[21]+RC[26]+RC[31]+RC[36]+RC[41]+RC[46]+RC[51]+RC[56]+RC[61]+RC[66]+RC[71]+RC[76]+RC[81]+RC[86]+RC[91]+RC[96]+RC[101]+RC[106]+RC[111]+RC[116]+RC[121]+RC[126]+RC[131]+RC[136]+RC[141]+RC[146]+RC[151]+RC[156]+RC[161]+RC[166]+RC[171]+RC[176]+RC[181]+RC[186]+RC[191]+RC[196]+RC[201]+RC[206]+RC[211]+RC[216]+RC[221]+RC[226]+RC[231]+RC[236]+RC[241]+Sheet2!RC+Sheet2!RC[5]+Sheet2!RC[10]+Sheet2!RC[15]+Sheet2!RC[20]+Sheet2!RC[25]+Sheet2!RC[30]+Sheet2!RC[35]+Sheet2!RC[40]+Sheet2!RC[45]+Sheet2!RC[50]+Sheet2!RC[55]+Sheet2!RC[60]+Sheet2!RC[65] -> 0 | F24: =SUM(RC[-4]:RC[-1]) -> 81962.725900000019 | G24: =Sheet1!RC[5]+Sheet1!RC[10]+Sheet1!RC[15]+Sheet1!RC[20]+Sheet1!RC[25]+Sheet1!RC[30]+Sheet1!RC[35]+Sheet1!RC[40]+Sheet1!RC[45]+Sheet1!RC[50]+Sheet1!RC[55]+Sheet1!RC[60]+Sheet1!RC[65]+Sheet1!RC[70]+Sheet1!RC[75]+Sheet1!RC[80]+Sheet1!RC[85]+Sheet1!RC[90]+Sheet1!RC[95]+Sheet1!RC[100]+Sheet1!RC[105]+Sheet1!RC[110]+Sheet1!RC[115]+Sheet1!RC[120]+Sheet1!RC[125]+Sheet1!RC[130]+Sheet1!RC[135]+Sheet1!RC[140]+Sheet1!RC[145]+Sheet1!RC[150]+Sheet1!RC[155]+Sheet1!RC[160]+Sheet1!RC[165]+Sheet1!RC[170]+Sheet1!RC[175]+Sheet1!RC[180]+Sheet1!RC[185]+Sheet1!RC[190]+Sheet1!RC[195]+Sheet1!RC[200]+Sheet1!RC[205]+Sheet1!RC[210]+Sheet1!RC[215]+Sheet1!RC[220]+Sheet1!RC[225]+Sheet1!RC[230]+Sheet1!RC[235]+Sheet1!RC[240]+Sheet2!RC[-1]+Sheet2!RC[4]+Sheet2!RC[9]+Sheet2!RC[14]+Sheet2!RC[19]+Sheet2!RC[24]+Sheet2!RC[29]+Sheet2!RC[34]+Sheet2!RC[39]+Sheet2!RC[44]+Sheet2!RC[49]+Sheet2!RC[54]+Sheet2!RC[59]+Sheet2!RC[64] -> 81962.725900000005 | H24: 0 | I24: 1485.6279999999999 | J24: 176.92 | K24: 0 | L24: =SUM(RC[-4]:RC[-1]) -> 1662.548 | M24: 0 | N24: 91.59 | O24: 0 | P24: 0 | Q24: =SUM(RC[-4]:RC[-1]) -> 91.59 | R24: 0 | S24: 3993.1 | T24: 0 | U24: 0 | V24: =SUM(RC[-4]:RC[-1]) -> 3993.1 | W24: 0 | X24: 614.36099999999999 | Y24: 7.9899999999999999E-2 | Z24: 0 | AA24: =SUM(RC[-4]:RC[-1]) -> 614.44089999999994 | AB24: 0 | AC24: 237.52 | AD24: 0 | AE24: 0 | AF24: =SUM(RC[-4]:RC[-1]) -> 237.52 | AG24: 0 | AH24: 222.87 | AI24: 0 | AJ24: 0 | AK24: =SUM(RC[-4]:RC[-1]) -> 222.87 | AL24: 0 | AM24: 552.01800000000003 | AN24: 0.72799999999999998 | AO24: 0 | AP24: =SUM(RC[-4]:RC[-1]) -> 552.74599999999998 | AQ24: 0 | AR24: 430.22 | AS24: 1.1499999999999999 | AT24: 0 | AU24: =SUM(RC[-4]:RC[-1]) -> 431.37 | AV24: 0 | AW24: 70.680000000000007 | AX24: 4.5 | AY24: 0 | AZ24: =SUM(RC[-4]:RC[-1]) -> 75.180000000000007 | BA24: 0 | BB24: 427 | BC24: 2.59 | BD24: 0 | BE24: =SUM(RC[-4]:RC[-1]) -> 429.59 | BF24: 0 | BG24: 89.2 | BH24: 0.02 | BI24: 0 | BJ24: =SUM(RC[-4]:RC[-1]) -> 89.22 | BK24: 0 | BL24: 204.34 | BM24: 1.54 | BN24: 0 | BO24: =SUM(RC[-4]:RC[-1]) -> 205.88 | BP24: 0 | BQ24: 106.5 | BR24: 0 | BS24: 0 | BT24: =SUM(RC[-4]:RC[-1]) -> 106.5 | BU24: 0 | BV24: 425.709 | BW24: 20 | BX24: 0 | BY24: =SUM(RC[-4]:RC[-1]) -> 445.709 | BZ24: 0 | CA24: 5691.29 | CB24: 82.99 | CC24: 0 | CD24: =SUM(RC[-4]:RC[-1]) -> 5774.28 | CE24: 0 | CF24: 97.62 | CG24: 4364 | CH24: 0 | CI24: =SUM(RC[-4]:RC[-1]) -> 4461.62 | CJ24: 0 | CK24: 129 | CL24: 0 | CM24: 0 | CN24: =SUM(RC[-4]:RC[-1]) -> 129 | CO24: 0 | CP24: 211.19 | CQ24: 0 | CR24: 0 | CS24: =SUM(RC[-4]:RC[-1]) -> 211.19 | CT24: 0 | CU24: 179.8 | CV24: 0 | CW24: 0 | CX24: =SUM(RC[-4]:RC[-1]) -> 179.8 | CY24: 0 | CZ24: 71.66 | DA24: 0 | DB24: 0 | DC24: =SUM(RC[-4]:RC[-1]) -> 71.66 | DD24: 0 | DE24: 8.0299999999999994 | DF24: 0 | DG24: 0 | DH24: =SUM(RC[-4]:RC[-1]) -> 8.0299999999999994 | DI24: 0 | DJ24: 297.15699999999998 | DK24: 1E-3 | DL24: 0 | DM24: =SUM(RC[-4]:RC[-1]) -> 297.15799999999996 | DN24: 0 | DO24: 477.57 | DP24: 51.06 | DQ24: 0 | DR24: =SUM(RC[-4]:RC[-1]) -> 528.63 | DS24: 0 | DT24: 13476.71 | DU24: 0.32 | DV24: 0 | DW24: =SUM(RC[-4]:RC[-1]) -> 13477.029999999999 | DX24: 0 | DY24: 27.41 | DZ24: 0 | EA24: 0 | EB24: =SUM(RC[-4]:RC[-1]) -> 27.41 | EC24: 0 | ED24: 168.48 | EE24: 3.35 | EF24: 0 | EG24: =SUM(RC[-4]:RC[-1]) -> 171.82999999999998 | EH24: 0 | EI24: 137.11000000000001 | EJ24: 0 | EK24: 0 | EL24: =SUM(RC[-4]:RC[-1]) -> 137.11000000000001 | EM24: 0 | EN24: 3342.78 | EO24: 1825.61 | EP24: 0 | EQ24: =SUM(RC[-4]:RC[-1]) -> 5168.3900000000003 | ER24: 0 | ES24: 320.95 | ET24: 3.85 | EU24: 0 | EV24: =SUM(RC[-4]:RC[-1]) -> 324.8 | EW24: 0 | EX24: 3341.51 | EY24: 40.29 | EZ24: 0 | FA24: =SUM(RC[-4]:RC[-1]) -> 3381.8 | FB24: 0 | FC24: 8385.509 | FD24: 0 | FE24: 0 | FF24: =SUM(RC[-4]:RC[-1]) -> 8385.509 | FG24: 0 | FH24: 2071.71 | FI24: 1056.26 | FJ24: 0 | FK24: =SUM(RC[-4]:RC[-1]) -> 3127.9700000000003 | FL24: 0 | FM24: 1394.72 | FN24: 1.17 | FO24: 0 | FP24: =SUM(RC[-4]:RC[-1]) -> 1395.89 | FQ24: 0 | FR24: 2279.23 | FS24: 8.24 | FT24: 0 | FU24: =SUM(RC[-4]:RC[-1]) -> 2287.4699999999998 | FV24: 0 | FW24: 311.2 | FX24: 7.02 | FY24: 0 | FZ24: =SUM(RC[-4]:RC[-1]) -> 318.21999999999997 | GA24: 0 | GB24: 790.12 | GC24: 7.04 | GD24: 0 | GE24: =SUM(RC[-4]:RC[-1]) -> 797.16 | GF24: 0 | GG24: 98.3 | GH24: 0 | GI24: 0 | GJ24: =SUM(RC[-4]:RC[-1]) -> 98.3 | GK24: 0 | GL24: 248.3 | GM24: 7 | GN24: 0 | GO24: =SUM(RC[-4]:RC[-1]) -> 255.3 | GP24: 0 | GQ24: 96.87 | GR24: 0 | GS24: 0 | GT24: =SUM(RC[-4]:RC[-1]) -> 96.87 | GU24: 0 | GV24: 34.621000000000002 | GW24: 0 | GX24: 0 | GY24: =SUM(RC[-4]:RC[-1]) -> 34.621000000000002 | GZ24: 0 | HA24: 7487 | HB24: 0 | HC24: 0 | HD24: =SUM(RC[-4]:RC[-1]) -> 7487 | HE24: 0 | HF24: 556.44000000000005 | HG24: 3.42 | HH24: 0 | HI24: =SUM(RC[-4]:RC[-1]) -> 559.86 | HJ24: 0 | HK24: 2073.1999999999998 | HL24: 108.92 | HM24: 0 | HN24: =SUM(RC[-4]:RC[-1]) -> 2182.12 | HO24: 0 | HP24: 908.04 | HQ24: 131 | HR24: 0 | HS24: =SUM(RC[-4]:RC[-1]) -> 1039.04 | HT24: 0 | HU24: 312.87 | HV24: 881.01 | HW24: 0 | HX24: =SUM(RC[-4]:RC[-1]) -> 1193.8800000000001 | HY24: 0 | HZ24: 452.82 | IA24: 1172.75 | IB24: 0 | IC24: =SUM(RC[-4]:RC[-1]) -> 1625.57 | ID24: 0 | IE24: 34.03 | IF24: 0 | IG24: 0 | IH24: =SUM(RC[-4]:RC[-1]) -> 34.03 | II24: 0 | IJ24: 17.760000000000002 | IK24: 0 | IL24: 0 | IM24: =SUM(RC[-4]:RC[-1]) -> 17.760000000000002
A25: CHROMIUM | B25: =RC[8]+RC[13]+RC[18]+RC[23]+RC[28]+RC[33]+RC[38]+RC[43]+RC[48]+RC[53]+RC[58]+RC[63]+RC[68]+RC[73]+RC[78]+RC[83]+RC[88]+RC[93]+RC[98]+RC[103]+RC[108]+RC[113]+RC[118]+RC[123]+RC[128]+RC[133]+RC[138]+RC[143]+RC[148]+RC[153]+RC[158]+RC[163]+RC[168]+RC[173]+RC[178]+RC[183]+RC[188]+RC[193]+RC[198]+RC[203]+RC[208]+RC[213]+RC[218]+RC[223]+RC[228]+RC[233]+RC[238]+RC[243]+Sheet2!RC[2]+Sheet2!RC[7]+Sheet2!RC[12]+Sheet2!RC[17]+Sheet2!RC[22]+Sheet2!RC[27]+Sheet2!RC[32]+Sheet2!RC[37]+Sheet2!RC[42]+Sheet2!RC[47]+Sheet2!RC[57]+Sheet2!RC[52]+Sheet2!RC[62]+Sheet2!RC[67] -> 19067.125700000004 | C25: =RC[6]+RC[11]+RC[16]+RC[21]+RC[26]+RC[31]+RC[36]+RC[41]+RC[46]+RC[51]+RC[56]+RC[61]+RC[66]+RC[71]+RC[76]+RC[81]+RC[86]+RC[91]+RC[96]+RC[101]+RC[106]+RC[111]+RC[116]+RC[121]+RC[126]+RC[131]+RC[136]+RC[141]+RC[146]+RC[151]+RC[156]+RC[161]+RC[166]+RC[171]+RC[176]+RC[181]+RC[186]+RC[191]+RC[196]+RC[201]+RC[206]+RC[211]+RC[216]+RC[221]+RC[226]+RC[231]+RC[236]+RC[241]+Sheet2!RC+Sheet2!RC[5]+Sheet2!RC[10]+Sheet2!RC[15]+Sheet2!RC[20]+Sheet2!RC[25]+Sheet2!RC[30]+Sheet2!RC[35]+Sheet2!RC[40]+Sheet2!RC[45]+Sheet2!RC[50]+Sheet2!RC[55]+Sheet2!RC[60]+Sheet2!RC[65] -> 0 | D25: =RC[4]+RC[9]+RC[14]+RC[19]+RC[24]+RC[29]+RC[34]+RC[39]+RC[44]+RC[49]+RC[54]+RC[59]+RC[64]+RC[69]+RC[74]+RC[79]+RC[84]+RC[89]+RC[94]+RC[99]+RC[104]+RC[109]+RC[114]+RC[119]+RC[124]+RC[129]+RC[134]+RC[139]+RC[144]+RC[149]+RC[154]+RC[159]+RC[164]+RC[169]+RC[174]+RC[179]+RC[184]+RC[189]+RC[194]+RC[199]+RC[204]+RC[209]+RC[214]+RC[219]+RC[224]+RC[229]+RC[234]+RC[239]+Sheet2!RC[3]+Sheet2!RC[-2]+Sheet2!RC[8]+Sheet2!RC[13]+Sheet2!RC[18]+Sheet2!RC[23]+Sheet2!RC[28]+Sheet2!RC[33]+Sheet2!RC[38]+Sheet2!RC[43]+Sheet2!RC[48]+Sheet2!RC[53]+Sheet2!RC[58]+Sheet2!RC[63] -> 390 | E25: =RC[6]+RC[11]+RC[16]+RC[21]+RC[26]+RC[31]+RC[36]+RC[41]+RC[46]+RC[51]+RC[56]+RC[61]+RC[66]+RC[71]+RC[76]+RC[81]+RC[86]+RC[91]+RC[96]+RC[101]+RC[106]+RC[111]+RC[116]+RC[121]+RC[126]+RC[131]+RC[136]+RC[141]+RC[146]+RC[151]+RC[156]+RC[161]+RC[166]+RC[171]+RC[176]+RC[181]+RC[186]+RC[191]+RC[196]+RC[201]+RC[206]+RC[211]+RC[216]+RC[221]+RC[226]+RC[231]+RC[236]+RC[241]+Sheet2!RC+Sheet2!RC[5]+Sheet2!RC[10]+Sheet2!RC[15]+Sheet2!RC[20]+Sheet2!RC[25]+Sheet2!RC[30]+Sheet2!RC[35]+Sheet2!RC[40]+Sheet2!RC[45]+Sheet2!RC[50]+Sheet2!RC[55]+Sheet2!RC[60]+Sheet2!RC[65] -> 1747.2473308000001 | F25: =SUM(RC[-4]:RC[-1]) -> 21204.373030800005 | G25: =Sheet1!RC[5]+Sheet1!RC[10]+Sheet1!RC[15]+Sheet1!RC[20]+Sheet1!RC[25]+Sheet1!RC[30]+Sheet1!RC[35]+Sheet1!RC[40]+Sheet1!RC[45]+Sheet1!RC[50]+Sheet1!RC[55]+Sheet1!RC[60]+Sheet1!RC[65]+Sheet1!RC[70]+Sheet1!RC[75]+Sheet1!RC[80]+Sheet1!RC[85]+Sheet1!RC[90]+Sheet1!RC[95]+Sheet1!RC[100]+Sheet1!RC[105]+Sheet1!RC[110]+Sheet1!RC[115]+Sheet1!RC[120]+Sheet1!RC[125]+Sheet1!RC[130]+Sheet1!RC[135]+Sheet1!RC[140]+Sheet1!RC[145]+Sheet1!RC[150]+Sheet1!RC[155]+Sheet1!RC[160]+Sheet1!RC[165]+Sheet1!RC[170]+Sheet1!RC[175]+Sheet1!RC[180]+Sheet1!RC[185]+Sheet1!RC[190]+Sheet1!RC[195]+Sheet1!RC[200]+Sheet1!RC[205]+Sheet1!RC[210]+Sheet1!RC[215]+Sheet1!RC[220]+Sheet1!RC[225]+Sheet1!RC[230]+Sheet1!RC[235]+Sheet1!RC[240]+Sheet2!RC[-1]+Sheet2!RC[4]+Sheet2!RC[9]+Sheet2!RC[14]+Sheet2!RC[19]+Sheet2!RC[24]+Sheet2!RC[29]+Sheet2!RC[34]+Sheet2!RC[39]+Sheet2!RC[44]+Sheet2!RC[49]+Sheet2!RC[54]+Sheet2!RC[59]+Sheet2!RC[64] -> 21204.373030799994 | H25: 11 | I25: 0 | J25: 1119.5 | K25: 53.26359889999997 | L25: =SUM(RC[-4]:RC[-1]) -> 1183.7635989 | M25: 2 | N25: 0 | O25: 6.75 | P25: 5.4037937999999999 | Q25: =SUM(RC[-4]:RC[-1]) -> 14.153793799999999 | R25: 10 | S25: 0 | T25: 244.92 | U25: 55.337345800000008 | V25: =SUM(RC[-4]:RC[-1]) -> 310.2573458 | W25: 7 | X25: 0 | Y25: 63.9 | Z25: 13.534665500000003 | AA25: =SUM(RC[-4]:RC[-1]) -> 84.434665500000008 | AB25: 3 | AC25: 0 | AD25: 0.02 | AE25: 18.949607999999998 | AF25: =SUM(RC[-4]:RC[-1]) -> 21.969607999999997 | AG25: 3 | AH25: 0 | AI25: 92.56 | AJ25: 10.7232708 | AK25: =SUM(RC[-4]:RC[-1]) -> 106.2832708 | AL25: 5 | AM25: 0 | AN25: 1431.57 | AO25: 21.337330999999988 | AP25: =SUM(RC[-4]:RC[-1]) -> 1457.9073309999999 | AQ25: 3 | AR25: 0 | AS25: 614.80999999999995 | AT25: 8.0086880000000011 | AU25: =SUM(RC[-4]:RC[-1]) -> 625.81868799999995 | AV25: 2 | AW25: 0 | AX25: 10 | AY25: 7.854131800000002 | AZ25: =SUM(RC[-4]:RC[-1]) -> 19.854131800000001 | BA25: 3 | BB25: 0 | BC25: 31.65 | BD25: 8.976489599999999 | BE25: =SUM(RC[-4]:RC[-1]) -> 43.626489599999999 | BF25: 3 | BG25: 0 | BH25: 2.29 | BI25: 9.8706265000000002 | BJ25: =SUM(RC[-4]:RC[-1]) -> 15.160626499999999 | BK25: 2 | BL25: 0 | BM25: 2.37 | BN25: 6.5567631999999989 | BO25: =SUM(RC[-4]:RC[-1]) -> 10.9267632 | BP25: 2 | BQ25: 0 | BR25: 11.97 | BS25: 8.1807925000000008 | BT25: =SUM(RC[-4]:RC[-1]) -> 22.150792500000001 | BU25: 8 | BV25: 0 | BW25: 102.3 | BX25: 23.658009999999994 | BY25: =SUM(RC[-4]:RC[-1]) -> 133.95801 | BZ25: 26 | CA25: 0 | CB25: 1990.9 | CC25: 93.536176599999948 | CD25: =SUM(RC[-4]:RC[-1]) -> 2110.4361766000002 | CE25: 2 | CF25: 0 | CG25: 19.117000000000001 | CH25: 8.1371579999999959 | CI25: =SUM(RC[-4]:RC[-1]) -> 29.254157999999997 | CJ25: 1 | CK25: 0 | CL25: 0 | CM25: 5.3797079999999999 | CN25: =SUM(RC[-4]:RC[-1]) -> 6.3797079999999999 | CO25: 1 | CP25: 0 | CQ25: 0.02 | CR25: 4.7968027999999983 | CS25: =SUM(RC[-4]:RC[-1]) -> 5.8168027999999978 | CT25: 4 | CU25: 0 | CV25: 43.3 | CW25: 6.581029199999997 | CX25: =SUM(RC[-4]:RC[-1]) -> 53.881029199999993 | CY25: 3 | CZ25: 0 | DA25: 212.87 | DB25: 3.1719101999999992 | DC25: =SUM(RC[-4]:RC[-1]) -> 219.04191020000002 | DD25: 0 | DE25: 0 | DF25: 0 | DG25: 0.77355019999999997 | DH25: =SUM(RC[-4]:RC[-1]) -> 0.77355019999999997 | DI25: 3 | DJ25: 0 | DK25: 3.75 | DL25: 8.6417209000000046 | DM25: =SUM(RC[-4]:RC[-1]) -> 15.391720900000005 | DN25: 4 | DO25: 0 | DP25: 223.89 | DQ25: 12.294946799999998 | DR25: =SUM(RC[-4]:RC[-1]) -> 240.18494679999998 | DS25: 14 | DT25: 0 | DU25: 186.47 | DV25: 94.190363200000007 | DW25: =SUM(RC[-4]:RC[-1]) -> 294.66036320000001 | DX25: 1 | DY25: 0 | DZ25: 0 | EA25: 5.7464237999999996 | EB25: =SUM(RC[-4]:RC[-1]) -> 6.7464237999999996 | EC25: 3 | ED25: 0 | EE25: 8.9 | EF25: 6.947183700000001 | EG25: =SUM(RC[-4]:RC[-1]) -> 18.847183700000002 | EH25: 3 | EI25: 0 | EJ25: 0 | EK25: 5.9933436000000011 | EL25: =SUM(RC[-4]:RC[-1]) -> 8.9933436000000011 | EM25: 19 | EN25: 0 | EO25: 267.92 | EP25: 84.397454799999991 | EQ25: =SUM(RC[-4]:RC[-1]) -> 371.31745480000001 | ER25: 3 | ES25: 0 | ET25: 57.51 | EU25: 4.9358650000000006 | EV25: =SUM(RC[-4]:RC[-1]) -> 65.445864999999998 | EW25: 34 | EX25: 0 | EY25: 484.05 | EZ25: 92.432382700000019 | FA25: =SUM(RC[-4]:RC[-1]) -> 610.48238270000002 | FB25: 9 | FC25: 0 | FD25: 1286.31 | FE25: 281.84999940000006 | FF25: =SUM(RC[-4]:RC[-1]) -> 1577.1599994000001 | FG25: 5 | FH25: 0 | FI25: 643.47 | FJ25: 20.656549800000004 | FK25: =SUM(RC[-4]:RC[-1]) -> 669.12654980000002 | FL25: 7 | FM25: 0 | FN25: 201.79 | FO25: 19.034025200000009 | FP25: =SUM(RC[-4]:RC[-1]) -> 227.82402519999999 | FQ25: 13 | FR25: 0 | FS25: 154.69 | FT25: 42.256173400000002 | FU25: =SUM(RC[-4]:RC[-1]) -> 209.94617339999999 | FV25: 4 | FW25: 0 | FX25: 789.13 | FY25: 14.265051 | FZ25: =SUM(RC[-4]:RC[-1]) -> 807.39505099999997 | GA25: 3 | GB25: 0 | GC25: 475 | GD25: 40.248961899999991 | GE25: =SUM(RC[-4]:RC[-1]) -> 518.24896190000004 | GF25: 1 | GG25: 0 | GH25: 4.0540000000000003 | GI25: 5.4830040000000011 | GJ25: =SUM(RC[-4]:RC[-1]) -> 10.537004000000001 | GK25: 4 | GL25: 0 | GM25: 172.23 | GN25: 10.489218999999999 | GO25: =SUM(RC[-4]:RC[-1]) -> 186.71921899999998 | GP25: 2 | GQ25: 0 | GR25: 0 | GS25: 7.0081276000000026 | GT25: =SUM(RC[-4]:RC[-1]) -> 9.0081276000000017 | GU25: 4 | GV25: 0 | GW25: 0 | GX25: 11.961011599999996 | GY25: =SUM(RC[-4]:RC[-1]) -> 15.961011599999996 | GZ25: 21 | HA25: 0 | HB25: 3969.8 | HC25: 141.47099559999995 | HD25: =SUM(RC[-4]:RC[-1]) -> 4132.2709955999999 | HE25: 4 | HF25: 0 | HG25: 22.28 | HH25: 14.060027 | HI25: =SUM(RC[-4]:RC[-1]) -> 40.340026999999999 | HJ25: 7 | HK25: 0 | HL25: 1123.92 | HM25: 31.445606699999995 | HN25: =SUM(RC[-4]:RC[-1]) -> 1162.3656067000002 | HO25: 8 | HP25: 0 | HQ25: 81.37 | HR25: 29.211413099999998 | HS25: =SUM(RC[-4]:RC[-1]) -> 118.58141310000001 | HT25: 7 | HU25: 0 | HV25: 195.51 | HW25: 12.253445699999999 | HX25: =SUM(RC[-4]:RC[-1]) -> 214.76344569999998 | HY25: 4 | HZ25: 0 | IA25: 110.94 | IB25: 21.072417300000001 | IC25: =SUM(RC[-4]:RC[-1]) -> 136.01241730000001 | ID25: 1 | IE25: 0 | IF25: 0.63 | IG25: 9.2290222000000011 | IH25: =SUM(RC[-4]:RC[-1]) -> 10.859022200000002 | II25: 1 | IJ25: 0 | IK25: 778.2287 | IL25: 2.6276817999999986 | IM25: =SUM(RC[-4]:RC[-1]) -> 781.85638180000001
A26: CHROMIUM VI | B26: =RC[8]+RC[13]+RC[18]+RC[23]+RC[28]+RC[33]+RC[38]+RC[43]+RC[48]+RC[53]+RC[58]+RC[63]+RC[68]+RC[73]+RC[78]+RC[83]+RC[88]+RC[93]+RC[98]+RC[103]+RC[108]+RC[113]+RC[118]+RC[123]+RC[128]+RC[133]+RC[138]+RC[143]+RC[148]+RC[153]+RC[158]+RC[163]+RC[168]+RC[173]+RC[178]+RC[183]+RC[188]+RC[193]+RC[198]+RC[203]+RC[208]+RC[213]+RC[218]+RC[223]+RC[228]+RC[233]+RC[238]+RC[243]+Sheet2!RC[2]+Sheet2!RC[7]+Sheet2!RC[12]+Sheet2!RC[17]+Sheet2!RC[22]+Sheet2!RC[27]+Sheet2!RC[32]+Sheet2!RC[37]+Sheet2!RC[42]+Sheet2!RC[47]+Sheet2!RC[57]+Sheet2!RC[52]+Sheet2!RC[62]+Sheet2!RC[67] -> 0 | C26: =RC[6]+RC[11]+RC[16]+RC[21]+RC[26]+RC[31]+RC[36]+RC[41]+RC[46]+RC[51]+RC[56]+RC[61]+RC[66]+RC[71]+RC[76]+RC[81]+RC[86]+RC[91]+RC[96]+RC[101]+RC[106]+RC[111]+RC[116]+RC[121]+RC[126]+RC[131]+RC[136]+RC[141]+RC[146]+RC[151]+RC[156]+RC[161]+RC[166]+RC[171]+RC[176]+RC[181]+RC[186]+RC[191]+RC[196]+RC[201]+RC[206]+RC[211]+RC[216]+RC[221]+RC[226]+RC[231]+RC[236]+RC[241]+Sheet2!RC+Sheet2!RC[5]+Sheet2!RC[10]+Sheet2!RC[15]+Sheet2!RC[20]+Sheet2!RC[25]+Sheet2!RC[30]+Sheet2!RC[35]+Sheet2!RC[40]+Sheet2!RC[45]+Sheet2!RC[50]+Sheet2!RC[55]+Sheet2!RC[60]+Sheet2!RC[65] -> 7779.9180000000015 | D26: =RC[4]+RC[9]+RC[14]+RC[19]+RC[24]+RC[29]+RC[34]+RC[39]+RC[44]+RC[49]+RC[54]+RC[59]+RC[64]+RC[69]+RC[74]+RC[79]+RC[84]+RC[89]+RC[94]+RC[99]+RC[104]+RC[109]+RC[114]+RC[119]+RC[124]+RC[129]+RC[134]+RC[139]+RC[144]+RC[149]+RC[154]+RC[159]+RC[164]+RC[169]+RC[174]+RC[179]+RC[184]+RC[189]+RC[194]+RC[199]+RC[204]+RC[209]+RC[214]+RC[219]+RC[224]+RC[229]+RC[234]+RC[239]+Sheet2!RC[3]+Sheet2!RC[-2]+Sheet2!RC[8]+Sheet2!RC[13]+Sheet2!RC[18]+Sheet2!RC[23]+Sheet2!RC[28]+Sheet2!RC[33]+Sheet2!RC[38]+Sheet2!RC[43]+Sheet2!RC[48]+Sheet2!RC[53]+Sheet2!RC[58]+Sheet2!RC[63] -> 0 | E26: =RC[6]+RC[11]+RC[16]+RC[21]+RC[26]+RC[31]+RC[36]+RC[41]+RC[46]+RC[51]+RC[56]+RC[61]+RC[66]+RC[71]+RC[76]+RC[81]+RC[86]+RC[91]+RC[96]+RC[101]+RC[106]+RC[111]+RC[116]+RC[121]+RC[126]+RC[131]+RC[136]+RC[141]+RC[146]+RC[151]+RC[156]+RC[161]+RC[166]+RC[171]+RC[176]+RC[181]+RC[186]+RC[191]+RC[196]+RC[201]+RC[206]+RC[211]+RC[216]+RC[221]+RC[226]+RC[231]+RC[236]+RC[241]+Sheet2!RC+Sheet2!RC[5]+Sheet2!RC[10]+Sheet2!RC[15]+Sheet2!RC[20]+Sheet2!RC[25]+Sheet2!RC[30]+Sheet2!RC[35]+Sheet2!RC[40]+Sheet2!RC[45]+Sheet2!RC[50]+Sheet2!RC[55]+Sheet2!RC[60]+Sheet2!RC[65] -> 0 | F26: =SUM(RC[-4]:RC[-1]) -> 7779.9180000000015 | G26: =Sheet1!RC[5]+Sheet1!RC[10]+Sheet1!RC[15]+Sheet1!RC[20]+Sheet1!RC[25]+Sheet1!RC[30]+Sheet1!RC[35]+Sheet1!RC[40]+Sheet1!RC[45]+Sheet1!RC[50]+Sheet1!RC[55]+Sheet1!RC[60]+Sheet1!RC[65]+Sheet1!RC[70]+Sheet1!RC[75]+Sheet1!RC[80]+Sheet1!RC[85]+Sheet1!RC[90]+Sheet1!RC[95]+Sheet1!RC[100]+Sheet1!RC[105]+Sheet1!RC[110]+Sheet1!RC[115]+Sheet1!RC[120]+Sheet1!RC[125]+Sheet1!RC[130]+Sheet1!RC[135]+Sheet1!RC[140]+Sheet1!RC[145]+Sheet1!RC[150]+Sheet1!RC[155]+Sheet1!RC[160]+Sheet1!RC[165]+Sheet1!RC[170]+Sheet1!RC[175]+Sheet1!RC[180]+Sheet1!RC[185]+Sheet1!RC[190]+Sheet1!RC[195]+Sheet1!RC[200]+Sheet1!RC[205]+Sheet1!RC[210]+Sheet1!RC[215]+Sheet1!RC[220]+Sheet1!RC[225]+Sheet1!RC[230]+Sheet1!RC[235]+Sheet1!RC[240]+Sheet2!RC[-1]+Sheet2!RC[4]+Sheet2!RC[9]+Sheet2!RC[14]+Sheet2!RC[19]+Sheet2!RC[24]+Sheet2!RC[29]+Sheet2!RC[34]+Sheet2!RC[39]+Sheet2!RC[44]+Sheet2!RC[49]+Sheet2!RC[54]+Sheet2!RC[59]+Sheet2!RC[64] -> 7779.9180000000015 | H26: 0 | I26: 369.04 | J26: 0 | K26: 0 | L26: =SUM(RC[-4]:RC[-1]) -> 369.04 | M26: 0 | N26: 0 | O26: 0 | P26: 0 | Q26: =SUM(RC[-4]:RC[-1]) -> 0 | R26: 0 | S26: 226.91 | T26: 0 | U26: 0 | V26: =SUM(RC[-4]:RC[-1]) -> 226.91 | W26: 0 | X26: 55.18 | Y26: 0 | Z26: 0 | AA26: =SUM(RC[-4]:RC[-1]) -> 55.18 | AB26: 0 | AC26: 324.11 | AD26: 0 | AE26: 0 | AF26: =SUM(RC[-4]:RC[-1]) -> 324.11 | AG26: 0 | AH26: 0 | AI26: 0 | AJ26: 0 | AK26: =SUM(RC[-4]:RC[-1]) -> 0 | AL26: 0 | AM26: 276.339 | AN26: 0 | AO26: 0 | AP26: =SUM(RC[-4]:RC[-1]) -> 276.339 | AQ26: 0 | AR26: 52.36 | AS26: 0 | AT26: 0 | AU26: =SUM(RC[-4]:RC[-1]) -> 52.36 | AV26: 0 | AW26: 1.75 | AX26: 0 | AY26: 0 | AZ26: =SUM(RC[-4]:RC[-1]) -> 1.75 | BA26: 0 | BB26: 0 | BC26: 0 | BD26: 0 | BE26: =SUM(RC[-4]:RC[-1]) -> 0 | BF26: 0 | BG26: 9.89 | BH26: 0 | BI26: 0 | BJ26: =SUM(RC[-4]:RC[-1]) -> 9.89 | BK26: 0 | BL26: 0 | BM26: 0 | BN26: 0 | BO26: =SUM(RC[-4]:RC[-1]) -> 0 | BP26: 0 | BQ26: 49.5 | BR26: 0 | BS26: 0 | BT26: =SUM(RC[-4]:RC[-1]) -> 49.5 | BU26: 0 | BV26: 0.05 | BW26: 0 | BX26: 0 | BY26: =SUM(RC[-4]:RC[-1]) -> 0.05 | BZ26: 0 | CA26: 269.04000000000002 | CB26: 0 | CC26: 0 | CD26: =SUM(RC[-4]:RC[-1]) -> 269.04000000000002 | CE26: 0 | CF26: 0 | CG26: 0 | CH26: 0 | CI26: =SUM(RC[-4]:RC[-1]) -> 0 | CJ26: 0 | CK26: 0 | CL26: 0 | CM26: 0 | CN26: =SUM(RC[-4]:RC[-1]) -> 0 | CO26: 0 | CP26: 0 | CQ26: 0 | CR26: 0 | CS26: =SUM(RC[-4]:RC[-1]) -> 0 | CT26: 0 | CU26: 315.75 | CV26: 0 | CW26: 0 | CX26: =SUM(RC[-4]:RC[-1]) -> 315.75 | CY26: 0 | CZ26: 0 | DA26: 0 | DB26: 0 | DC26: =SUM(RC[-4]:RC[-1]) -> 0 | DD26: 0 | DE26: 0 | DF26: 0 | DG26: 0 | DH26: =SUM(RC[-4]:RC[-1]) -> 0 | DI26: 0 | DJ26: 28.73 | DK26: 0 | DL26: 0 | DM26: =SUM(RC[-4]:RC[-1]) -> 28.73 | DN26: 0 | DO26: 0 | DP26: 0 | DQ26: 0 | DR26: =SUM(RC[-4]:RC[-1]) -> 0 | DS26: 0 | DT26: 3000.87 | DU26: 0 | DV26: 0 | DW26: =SUM(RC[-4]:RC[-1]) -> 3000.87 | DX26: 0 | DY26: 0 | DZ26: 0 | EA26: 0 | EB26: =SUM(RC[-4]:RC[-1]) -> 0 | EC26: 0 | ED26: 0 | EE26: 0 | EF26: 0 | EG26: =SUM(RC[-4]:RC[-1]) -> 0 | EH26: 0 | EI26: 0 | EJ26: 0 | EK26: 0 | EL26: =SUM(RC[-4]:RC[-1]) -> 0 | EM26: 0 | EN26: 118.6 | EO26: 0 | EP26: 0 | EQ26: =SUM(RC[-4]:RC[-1]) -> 118.6 | ER26: 0 | ES26: 0 | ET26: 0 | EU26: 0 | EV26: =SUM(RC[-4]:RC[-1]) -> 0 | EW26: 0 | EX26: 6.63 | EY26: 0 | EZ26: 0 | FA26: =SUM(RC[-4]:RC[-1]) -> 6.63 | FB26: 0 | FC26: 3.05 | FD26: 0 | FE26: 0 | FF26: =SUM(RC[-4]:RC[-1]) -> 3.05 | FG26: 0 | FH26: 557.03 | FI26: 0 | FJ26: 0 | FK26: =SUM(RC[-4]:RC[-1]) -> 557.03 | FL26: 0 | FM26: 7.2190000000000003 | FN26: 0 | FO26: 0 | FP26: =SUM(RC[-4]:RC[-1]) -> 7.2190000000000003 | FQ26: 0 | FR26: 137.27000000000001 | FS26: 0 | FT26: 0 | FU26: =SUM(RC[-4]:RC[-1]) -> 137.27000000000001 | FV26: 0 | FW26: 0 | FX26: 0 | FY26: 0 | FZ26: =SUM(RC[-4]:RC[-1]) -> 0 | GA26: 0 | GB26: 0 | GC26: 0 | GD26: 0 | GE26: =SUM(RC[-4]:RC[-1]) -> 0 | GF26: 0 | GG26: 0 | GH26: 0 | GI26: 0 | GJ26: =SUM(RC[-4]:RC[-1]) -> 0 | GK26: 0 | GL26: 0.47 | GM26: 0 | GN26: 0 | GO26: =SUM(RC[-4]:RC[-1]) -> 0.47 | GP26: 0 | GQ26: 0 | GR26: 0 | GS26: 0 | GT26: =SUM(RC[-4]:RC[-1]) -> 0 | GU26: 0 | GV26: 0 | GW26: 0 | GX26: 0 | GY26: =SUM(RC[-4]:RC[-1]) -> 0 | GZ26: 0 | HA26: 1423.83 | HB26: 0 | HC26: 0 | HD26: =SUM(RC[-4]:RC[-1]) -> 1423.83 | HE26: 0 | HF26: 0 | HG26: 0 | HH26: 0 | HI26: =SUM(RC[-4]:RC[-1]) -> 0 | HJ26: 0 | HK26: 2.64 | HL26: 0 | HM26: 0 | HN26: =SUM(RC[-4]:RC[-1]) -> 2.64 | HO26: 0 | HP26: 0 | HQ26: 0 | HR26: 0 | HS26: =SUM(RC[-4]:RC[-1]) -> 0 | HT26: 0 | HU26: 0 | HV26: 0 | HW26: 0 | HX26: =SUM(RC[-4]:RC[-1]) -> 0 | HY26: 0 | HZ26: 0.87 | IA26: 0 | IB26: 0 | IC26: =SUM(RC[-4]:RC[-1]) -> 0.87 | ID26: 0 | IE26: 0 | IF26: 0 | IG26: 0 | IH26: =SUM(RC[-4]:RC[-1]) -> 0 | II26: 0 | IJ26: 0 | IK26: 0 | IL26: 0 | IM26: =SUM(RC[-4]:RC[-1]) -> 0
A27: CHRYSENE | B27: =RC[8]+RC[13]+RC[18]+RC[23]+RC[28]+RC[33]+RC[38]+RC[43]+RC[48]+RC[53]+RC[58]+RC[63]+RC[68]+RC[73]+RC[78]+RC[83]+RC[88]+RC[93]+RC[98]+RC[103]+RC[108]+RC[113]+RC[118]+RC[123]+RC[128]+RC[133]+RC[138]+RC[143]+RC[148]+RC[153]+RC[158]+RC[163]+RC[168]+RC[173]+RC[178]+RC[183]+RC[188]+RC[193]+RC[198]+RC[203]+RC[208]+RC[213]+RC[218]+RC[223]+RC[228]+RC[233]+RC[238]+RC[243]+Sheet2!RC[2]+Sheet2!RC[7]+Sheet2!RC[12]+Sheet2!RC[17]+Sheet2!RC[22]+Sheet2!RC[27]+Sheet2!RC[32]+Sheet2!RC[37]+Sheet2!RC[42]+Sheet2!RC[47]+Sheet2!RC[57]+Sheet2!RC[52]+Sheet2!RC[62]+Sheet2!RC[67] -> 17.5 | C27: =RC[6]+RC[11]+RC[16]+RC[21]+RC[26]+RC[31]+RC[36]+RC[41]+RC[46]+RC[51]+RC[56]+RC[61]+RC[66]+RC[71]+RC[76]+RC[81]+RC[86]+RC[91]+RC[96]+RC[101]+RC[106]+RC[111]+RC[116]+RC[121]+RC[126]+RC[131]+RC[136]+RC[141]+RC[146]+RC[151]+RC[156]+RC[161]+RC[166]+RC[171]+RC[176]+RC[181]+RC[186]+RC[191]+RC[196]+RC[201]+RC[206]+RC[211]+RC[216]+RC[221]+RC[226]+RC[231]+RC[236]+RC[241]+Sheet2!RC+Sheet2!RC[5]+Sheet2!RC[10]+Sheet2!RC[15]+Sheet2!RC[20]+Sheet2!RC[25]+Sheet2!RC[30]+Sheet2!RC[35]+Sheet2!RC[40]+Sheet2!RC[45]+Sheet2!RC[50]+Sheet2!RC[55]+Sheet2!RC[60]+Sheet2!RC[65] -> 399.13490000000019 | D27: =RC[4]+RC[9]+RC[14]+RC[19]+RC[24]+RC[29]+RC[34]+RC[39]+RC[44]+RC[49]+RC[54]+RC[59]+RC[64]+RC[69]+RC[74]+RC[79]+RC[84]+RC[89]+RC[94]+RC[99]+RC[104]+RC[109]+RC[114]+RC[119]+RC[124]+RC[129]+RC[134]+RC[139]+RC[144]+RC[149]+RC[154]+RC[159]+RC[164]+RC[169]+RC[174]+RC[179]+RC[184]+RC[189]+RC[194]+RC[199]+RC[204]+RC[209]+RC[214]+RC[219]+RC[224]+RC[229]+RC[234]+RC[239]+Sheet2!RC[3]+Sheet2!RC[-2]+Sheet2!RC[8]+Sheet2!RC[13]+Sheet2!RC[18]+Sheet2!RC[23]+Sheet2!RC[28]+Sheet2!RC[33]+Sheet2!RC[38]+Sheet2!RC[43]+Sheet2!RC[48]+Sheet2!RC[53]+Sheet2!RC[58]+Sheet2!RC[63] -> 0 | E27: =RC[6]+RC[11]+RC[16]+RC[21]+RC[26]+RC[31]+RC[36]+RC[41]+RC[46]+RC[51]+RC[56]+RC[61]+RC[66]+RC[71]+RC[76]+RC[81]+RC[86]+RC[91]+RC[96]+RC[101]+RC[106]+RC[111]+RC[116]+RC[121]+RC[126]+RC[131]+RC[136]+RC[141]+RC[146]+RC[151]+RC[156]+RC[161]+RC[166]+RC[171]+RC[176]+RC[181]+RC[186]+RC[191]+RC[196]+RC[201]+RC[206]+RC[211]+RC[216]+RC[221]+RC[226]+RC[231]+RC[236]+RC[241]+Sheet2!RC+Sheet2!RC[5]+Sheet2!RC[10]+Sheet2!RC[15]+Sheet2!RC[20]+Sheet2!RC[25]+Sheet2!RC[30]+Sheet2!RC[35]+Sheet2!RC[40]+Sheet2!RC[45]+Sheet2!RC[50]+Sheet2!RC[55]+Sheet2!RC[60]+Sheet2!RC[65] -> 283.15493070445399 | F27: =SUM(RC[-4]:RC[-1]) -> 699.78983070445418 | G27: =Sheet1!RC[5]+Sheet1!RC[10]+Sheet1!RC[15]+Sheet1!RC[20]+Sheet1!RC[25]+Sheet1!RC[30]+Sheet1!RC[35]+Sheet1!RC[40]+Sheet1!RC[45]+Sheet1!RC[50]+Sheet1!RC[55]+Sheet1!RC[60]+Sheet1!RC[65]+Sheet1!RC[70]+Sheet1!RC[75]+Sheet1!RC[80]+Sheet1!RC[85]+Sheet1!RC[90]+Sheet1!RC[95]+Sheet1!RC[100]+Sheet1!RC[105]+Sheet1!RC[110]+Sheet1!RC[115]+Sheet1!RC[120]+Sheet1!RC[125]+Sheet1!RC[130]+Sheet1!RC[135]+Sheet1!RC[140]+Sheet1!RC[145]+Sheet1!RC[150]+Sheet1!RC[155]+Sheet1!RC[160]+Sheet1!RC[165]+Sheet1!RC[170]+Sheet1!RC[175]+Sheet1!RC[180]+Sheet1!RC[185]+Sheet1!RC[190]+Sheet1!RC[195]+Sheet1!RC[200]+Sheet1!RC[205]+Sheet1!RC[210]+Sheet1!RC[215]+Sheet1!RC[220]+Sheet1!RC[225]+Sheet1!RC[230]+Sheet1!RC[235]+Sheet1!RC[240]+Sheet2!RC[-1]+Sheet2!RC[4]+Sheet2!RC[9]+Sheet2!RC[14]+Sheet2!RC[19]+Sheet2!RC[24]+Sheet2!RC[29]+Sheet2!RC[34]+Sheet2!RC[39]+Sheet2!RC[44]+Sheet2!RC[49]+Sheet2!RC[54]+Sheet2!RC[59]+Sheet2!RC[64] -> 699.78983070445383 | H27: 0 | I27: 4.7698999999999998 | J27: 0 | K27: 5.3235188385380035 | L27: =SUM(RC[-4]:RC[-1]) -> 10.093418838538003 | M27: 0 | N27: 3.0390000000000001 | O27: 0 | P27: 1.2556105302319986 | Q27: =SUM(RC[-4]:RC[-1]) -> 4.2946105302319992 | R27: 0 | S27: 0 | T27: 0 | U27: 4.924247886819999 | V27: =SUM(RC[-4]:RC[-1]) -> 4.924247886819999 | W27: 0 | X27: 3.74 | Y27: 0 | Z27: 2.8893760178280017 | AA27: =SUM(RC[-4]:RC[-1]) -> 6.6293760178280019 | AB27: 0 | AC27: 13.43 | AD27: 0 | AE27: 5.7399767380020013 | AF27: =SUM(RC[-4]:RC[-1]) -> 19.169976738001999 | AG27: 0 | AH27: 0 | AI27: 0 | AJ27: 1.5222834405739989 | AK27: =SUM(RC[-4]:RC[-1]) -> 1.5222834405739989 | AL27: 0 | AM27: 0 | AN27: 0 | AO27: 4.3922390017899993 | AP27: =SUM(RC[-4]:RC[-1]) -> 4.3922390017899993 | AQ27: 0 | AR27: 6.4 | AS27: 0 | AT27: 1.1723909554099994 | AU27: =SUM(RC[-4]:RC[-1]) -> 7.5723909554099995 | AV27: 0 | AW27: 6.13 | AX27: 0 | AY27: 1.6835634329479992 | AZ27: =SUM(RC[-4]:RC[-1]) -> 7.8135634329479995 | BA27: 0 | BB27: 4.0190000000000001 | BC27: 0 | BD27: 2.0838185157019993 | BE27: =SUM(RC[-4]:RC[-1]) -> 6.1028185157019994 | BF27: 0 | BG27: 2.5990000000000002 | BH27: 0 | BI27: 1.5868464799100002 | BJ27: =SUM(RC[-4]:RC[-1]) -> 4.1858464799100004 | BK27: 0 | BL27: 0.86 | BM27: 0 | BN27: 1.572890793564 | BO27: =SUM(RC[-4]:RC[-1]) -> 2.4328907935639998 | BP27: 0 | BQ27: 6.8 | BR27: 0 | BS27: 2.2976381922200004 | BT27: =SUM(RC[-4]:RC[-1]) -> 9.0976381922199998 | BU27: 0 | BV27: 12.68 | BW27: 0 | BX27: 4.9940819363980022 | BY27: =SUM(RC[-4]:RC[-1]) -> 17.674081936398004 | BZ27: 0 | CA27: 7.0000000000000007E-2 | CB27: 17.5 | CC27: 14.873041197714 | CD27: =SUM(RC[-4]:RC[-1]) -> 32.443041197714003 | CE27: 0 | CF27: 12.71 | CG27: 0 | CH27: 3.564985426300002 | CI27: =SUM(RC[-4]:RC[-1]) -> 16.274985426300002 | CJ27: 0 | CK27: 1.61 | CL27: 0 | CM27: 1.3954731072440003 | CN27: =SUM(RC[-4]:RC[-1]) -> 3.0054731072440006 | CO27: 0 | CP27: 1.45 | CQ27: 0 | CR27: 1.1144553061279998 | CS27: =SUM(RC[-4]:RC[-1]) -> 2.564455306128 | CT27: 0 | CU27: 0.36 | CV27: 0 | CW27: 1.1013944783799998 | CX27: =SUM(RC[-4]:RC[-1]) -> 1.4613944783799999 | CY27: 0 | CZ27: 6.1589999999999998 | DA27: 0 | DB27: 1.047633759594 | DC27: =SUM(RC[-4]:RC[-1]) -> 7.2066337595940002 | DD27: 0 | DE27: 0.1 | DF27: 0 | DG27: 0.44258240681799993 | DH27: =SUM(RC[-4]:RC[-1]) -> 0.54258240681799996 | DI27: 0 | DJ27: 1.95 | DK27: 0 | DL27: 2.0351361680920004 | DM27: =SUM(RC[-4]:RC[-1]) -> 3.9851361680920006 | DN27: 0 | DO27: 0 | DP27: 0 | DQ27: 1.5824598588560002 | DR27: =SUM(RC[-4]:RC[-1]) -> 1.5824598588560002 | DS27: 0 | DT27: 0 | DU27: 0 | DV27: 11.850710986961994 | DW27: =SUM(RC[-4]:RC[-1]) -> 11.850710986961994 | DX27: 0 | DY27: 0.18 | DZ27: 0 | EA27: 1.22476400311 | EB27: =SUM(RC[-4]:RC[-1]) -> 1.4047640031099999 | EC27: 0 | ED27: 0 | EE27: 0 | EF27: 1.1886934672540002 | EG27: =SUM(RC[-4]:RC[-1]) -> 1.1886934672540002 | EH27: 0 | EI27: 0.20899999999999999 | EJ27: 0 | EK27: 0.83143342043599944 | EL27: =SUM(RC[-4]:RC[-1]) -> 1.0404334204359995 | EM27: 0 | EN27: 0 | EO27: 0 | EP27: 13.177903474956 | EQ27: =SUM(RC[-4]:RC[-1]) -> 13.177903474956 | ER27: 0 | ES27: 0 | ET27: 0 | EU27: 0.76298875992400006 | EV27: =SUM(RC[-4]:RC[-1]) -> 0.76298875992400006 | EW27: 0 | EX27: 0 | EY27: 0 | EZ27: 22.649906087936007 | FA27: =SUM(RC[-4]:RC[-1]) -> 22.649906087936007 | FB27: 0 | FC27: 0 | FD27: 0 | FE27: 27.584886453260005 | FF27: =SUM(RC[-4]:RC[-1]) -> 27.584886453260005 | FG27: 0 | FH27: 0 | FI27: 0 | FJ27: 3.4749993182519998 | FK27: =SUM(RC[-4]:RC[-1]) -> 3.4749993182519998 | FL27: 0 | FM27: 0.14000000000000001 | FN27: 0 | FO27: 3.7679847828399988 | FP27: =SUM(RC[-4]:RC[-1]) -> 3.9079847828399989 | FQ27: 0 | FR27: 0 | FS27: 0 | FT27: 7.7248391648220016 | FU27: =SUM(RC[-4]:RC[-1]) -> 7.7248391648220016 | FV27: 0 | FW27: 3.8 | FX27: 0 | FY27: 2.0668719129959991 | FZ27: =SUM(RC[-4]:RC[-1]) -> 5.8668719129959985 | GA27: 0 | GB27: 118.16 | GC27: 0 | GD27: 4.9893848006519992 | GE27: =SUM(RC[-4]:RC[-1]) -> 123.149384800652 | GF27: 0 | GG27: 0.02 | GH27: 0 | GI27: 0.64548407235999983 | GJ27: =SUM(RC[-4]:RC[-1]) -> 0.66548407235999985 | GK27: 0 | GL27: 0 | GM27: 0 | GN27: 2.2377216963519997 | GO27: =SUM(RC[-4]:RC[-1]) -> 2.2377216963519997 | GP27: 0 | GQ27: 0.23 | GR27: 0 | GS27: 1.7255597359339996 | GT27: =SUM(RC[-4]:RC[-1]) -> 1.9555597359339996 | GU27: 0 | GV27: 2.67 | GW27: 0 | GX27: 1.7116525177279995 | GY27: =SUM(RC[-4]:RC[-1]) -> 4.3816525177279999 | GZ27: 0 | HA27: 0 | HB27: 0 | HC27: 14.678884875290002 | HD27: =SUM(RC[-4]:RC[-1]) -> 14.678884875290002 | HE27: 0 | HF27: 6.21 | HG27: 0 | HH27: 2.3544039105819996 | HI27: =SUM(RC[-4]:RC[-1]) -> 8.5644039105819996 | HJ27: 0 | HK27: 0 | HL27: 0 | HM27: 4.3611667698700005 | HN27: =SUM(RC[-4]:RC[-1]) -> 4.3611667698700005 | HO27: 0 | HP27: 40 | HQ27: 0 | HR27: 5.1298803527839985 | HS27: =SUM(RC[-4]:RC[-1]) -> 45.129880352783999 | HT27: 0 | HU27: 7.36 | HV27: 0 | HW27: 2.1261851210480009 | HX27: =SUM(RC[-4]:RC[-1]) -> 9.4861851210480008 | HY27: 0 | HZ27: 0.18 | IA27: 0 | IB27: 3.4530789092140015 | IC27: =SUM(RC[-4]:RC[-1]) -> 3.6330789092140017 | ID27: 0 | IE27: 7.44 | IF27: 0 | IG27: 1.7049058558799994 | IH27: =SUM(RC[-4]:RC[-1]) -> 9.1449058558799994 | II27: 0 | IJ27: 4.1100000000000003 | IK27: 0 | IL27: 0.37002906080799997 | IM27: =SUM(RC[-4]:RC[-1]) -> 4.4800290608080005
A28: COBALT | B28: =RC[8]+RC[13]+RC[18]+RC[23]+RC[28]+RC[33]+RC[38]+RC[43]+RC[48]+RC[53]+RC[58]+RC[63]+RC[68]+RC[73]+RC[78]+RC[83]+RC[88]+RC[93]+RC[98]+RC[103]+RC[108]+RC[113]+RC[118]+RC[123]+RC[128]+RC[133]+RC[138]+RC[143]+RC[148]+RC[153]+RC[158]+RC[163]+RC[168]+RC[173]+RC[178]+RC[183]+RC[188]+RC[193]+RC[198]+RC[203]+RC[208]+RC[213]+RC[218]+RC[223]+RC[228]+RC[233]+RC[238]+RC[243]+Sheet2!RC[2]+Sheet2!RC[7]+Sheet2!RC[12]+Sheet2!RC[17]+Sheet2!RC[22]+Sheet2!RC[27]+Sheet2!RC[32]+Sheet2!RC[37]+Sheet2!RC[42]+Sheet2!RC[47]+Sheet2!RC[57]+Sheet2!RC[52]+Sheet2!RC[62]+Sheet2!RC[67] -> 41356.345000000008 | C28: =RC[6]+RC[11]+RC[16]+RC[21]+RC[26]+RC[31]+RC[36]+RC[41]+RC[46]+RC[51]+RC[56]+RC[61]+RC[66]+RC[71]+RC[76]+RC[81]+RC[86]+RC[91]+RC[96]+RC[101]+RC[106]+RC[111]+RC[116]+RC[121]+RC[126]+RC[131]+RC[136]+RC[141]+RC[146]+RC[151]+RC[156]+RC[161]+RC[166]+RC[171]+RC[176]+RC[181]+RC[186]+RC[191]+RC[196]+RC[201]+RC[206]+RC[211]+RC[216]+RC[221]+RC[226]+RC[231]+RC[236]+RC[241]+Sheet2!RC+Sheet2!RC[5]+Sheet2!RC[10]+Sheet2!RC[15]+Sheet2!RC[20]+Sheet2!RC[25]+Sheet2!RC[30]+Sheet2!RC[35]+Sheet2!RC[40]+Sheet2!RC[45]+Sheet2!RC[50]+Sheet2!RC[55]+Sheet2!RC[60]+Sheet2!RC[65] -> 0 | D28: =RC[4]+RC[9]+RC[14]+RC[19]+RC[24]+RC[29]+RC[34]+RC[39]+RC[44]+RC[49]+RC[54]+RC[59]+RC[64]+RC[69]+RC[74]+RC[79]+RC[84]+RC[89]+RC[94]+RC[99]+RC[104]+RC[109]+RC[114]+RC[119]+RC[124]+RC[129]+RC[134]+RC[139]+RC[144]+RC[149]+RC[154]+RC[159]+RC[164]+RC[169]+RC[174]+RC[179]+RC[184]+RC[189]+RC[194]+RC[199]+RC[204]+RC[209]+RC[214]+RC[219]+RC[224]+RC[229]+RC[234]+RC[239]+Sheet2!RC[3]+Sheet2!RC[-2]+Sheet2!RC[8]+Sheet2!RC[13]+Sheet2!RC[18]+Sheet2!RC[23]+Sheet2!RC[28]+Sheet2!RC[33]+Sheet2!RC[38]+Sheet2!RC[43]+Sheet2!RC[48]+Sheet2!RC[53]+Sheet2!RC[58]+Sheet2!RC[63] -> 0 | E28: =RC[6]+RC[11]+RC[16]+RC[21]+RC[26]+RC[31]+RC[36]+RC[41]+RC[46]+RC[51]+RC[56]+RC[61]+RC[66]+RC[71]+RC[76]+RC[81]+RC[86]+RC[91]+RC[96]+RC[101]+RC[106]+RC[111]+RC[116]+RC[121]+RC[126]+RC[131]+RC[136]+RC[141]+RC[146]+RC[151]+RC[156]+RC[161]+RC[166]+RC[171]+RC[176]+RC[181]+RC[186]+RC[191]+RC[196]+RC[201]+RC[206]+RC[211]+RC[216]+RC[221]+RC[226]+RC[231]+RC[236]+RC[241]+Sheet2!RC+Sheet2!RC[5]+Sheet2!RC[10]+Sheet2!RC[15]+Sheet2!RC[20]+Sheet2!RC[25]+Sheet2!RC[30]+Sheet2!RC[35]+Sheet2!RC[40]+Sheet2!RC[45]+Sheet2!RC[50]+Sheet2!RC[55]+Sheet2!RC[60]+Sheet2!RC[65] -> 0 | F28: =SUM(RC[-4]:RC[-1]) -> 41356.345000000008 | G28: =Sheet1!RC[5]+Sheet1!RC[10]+Sheet1!RC[15]+Sheet1!RC[20]+Sheet1!RC[25]+Sheet1!RC[30]+Sheet1!RC[35]+Sheet1!RC[40]+Sheet1!RC[45]+Sheet1!RC[50]+Sheet1!RC[55]+Sheet1!RC[60]+Sheet1!RC[65]+Sheet1!RC[70]+Sheet1!RC[75]+Sheet1!RC[80]+Sheet1!RC[85]+Sheet1!RC[90]+Sheet1!RC[95]+Sheet1!RC[100]+Sheet1!RC[105]+Sheet1!RC[110]+Sheet1!RC[115]+Sheet1!RC[120]+Sheet1!RC[125]+Sheet1!RC[130]+Sheet1!RC[135]+Sheet1!RC[140]+Sheet1!RC[145]+Sheet1!RC[150]+Sheet1!RC[155]+Sheet1!RC[160]+Sheet1!RC[165]+Sheet1!RC[170]+Sheet1!RC[175]+Sheet1!RC[180]+Sheet1!RC[185]+Sheet1!RC[190]+Sheet1!RC[195]+Sheet1!RC[200]+Sheet1!RC[205]+Sheet1!RC[210]+Sheet1!RC[215]+Sheet1!RC[220]+Sheet1!RC[225]+Sheet1!RC[230]+Sheet1!RC[235]+Sheet1!RC[240]+Sheet2!RC[-1]+Sheet2!RC[4]+Sheet2!RC[9]+Sheet2!RC[14]+Sheet2!RC[19]+Sheet2!RC[24]+Sheet2!RC[29]+Sheet2!RC[34]+Sheet2!RC[39]+Sheet2!RC[44]+Sheet2!RC[49]+Sheet2!RC[54]+Sheet2!RC[59]+Sheet2!RC[64] -> 41356.345000000008 | H28: 0 | I28: 0 | J28: 2046.1 | K28: 0 | L28: =SUM(RC[-4]:RC[-1]) -> 2046.1 | M28: 0 | N28: 0 | O28: 24.56 | P28: 0 | Q28: =SUM(RC[-4]:RC[-1]) -> 24.56 | R28: 0 | S28: 0 | T28: 801.88 | U28: 0 | V28: =SUM(RC[-4]:RC[-1]) -> 801.88 | W28: 0 | X28: 0 | Y28: 197.43 | Z28: 0 | AA28: =SUM(RC[-4]:RC[-1]) -> 197.43 | AB28: 0 | AC28: 0 | AD28: 0.09 | AE28: 0 | AF28: =SUM(RC[-4]:RC[-1]) -> 0.09 | AG28: 0 | AH28: 0 | AI28: 37.113999999999997 | AJ28: 0 | AK28: =SUM(RC[-4]:RC[-1]) -> 37.113999999999997 | AL28: 0 | AM28: 0 | AN28: 58.76 | AO28: 0 | AP28: =SUM(RC[-4]:RC[-1]) -> 58.76 | AQ28: 0 | AR28: 0 | AS28: 54.31 | AT28: 0 | AU28: =SUM(RC[-4]:RC[-1]) -> 54.31 | AV28: 0 | AW28: 0 | AX28: 28.26 | AY28: 0 | AZ28: =SUM(RC[-4]:RC[-1]) -> 28.26 | BA28: 0 | BB28: 0 | BC28: 113.97 | BD28: 0 | BE28: =SUM(RC[-4]:RC[-1]) -> 113.97 | BF28: 0 | BG28: 0 | BH28: 6.79 | BI28: 0 | BJ28: =SUM(RC[-4]:RC[-1]) -> 6.79 | BK28: 0 | BL28: 0 | BM28: 8.6199999999999992 | BN28: 0 | BO28: =SUM(RC[-4]:RC[-1]) -> 8.6199999999999992 | BP28: 0 | BQ28: 0 | BR28: 14.8 | BS28: 0 | BT28: =SUM(RC[-4]:RC[-1]) -> 14.8 | BU28: 0 | BV28: 0 | BW28: 224.06 | BX28: 0 | BY28: =SUM(RC[-4]:RC[-1]) -> 224.06 | BZ28: 0 | CA28: 0 | CB28: 3645.48 | CC28: 0 | CD28: =SUM(RC[-4]:RC[-1]) -> 3645.48 | CE28: 0 | CF28: 0 | CG28: 2.0099999999999998 | CH28: 0 | CI28: =SUM(RC[-4]:RC[-1]) -> 2.0099999999999998 | CJ28: 0 | CK28: 0 | CL28: 0 | CM28: 0 | CN28: =SUM(RC[-4]:RC[-1]) -> 0 | CO28: 0 | CP28: 0 | CQ28: 7.0000000000000007E-2 | CR28: 0 | CS28: =SUM(RC[-4]:RC[-1]) -> 7.0000000000000007E-2 | CT28: 0 | CU28: 0 | CV28: 157.57 | CW28: 0 | CX28: =SUM(RC[-4]:RC[-1]) -> 157.57 | CY28: 0 | CZ28: 0 | DA28: 57.25 | DB28: 0 | DC28: =SUM(RC[-4]:RC[-1]) -> 57.25 | DD28: 0 | DE28: 0 | DF28: 0 | DG28: 0 | DH28: =SUM(RC[-4]:RC[-1]) -> 0 | DI28: 0 | DJ28: 0 | DK28: 3.6659999999999999 | DL28: 0 | DM28: =SUM(RC[-4]:RC[-1]) -> 3.6659999999999999 | DN28: 0 | DO28: 0 | DP28: 225.64 | DQ28: 0 | DR28: =SUM(RC[-4]:RC[-1]) -> 225.64 | DS28: 0 | DT28: 0 | DU28: 571.55999999999995 | DV28: 0 | DW28: =SUM(RC[-4]:RC[-1]) -> 571.55999999999995 | DX28: 0 | DY28: 0 | DZ28: 22.22 | EA28: 0 | EB28: =SUM(RC[-4]:RC[-1]) -> 22.22 | EC28: 0 | ED28: 0 | EE28: 21.28 | EF28: 0 | EG28: =SUM(RC[-4]:RC[-1]) -> 21.28 | EH28: 0 | EI28: 0 | EJ28: 0 | EK28: 0 | EL28: =SUM(RC[-4]:RC[-1]) -> 0 | EM28: 0 | EN28: 0 | EO28: 609.34 | EP28: 0 | EQ28: =SUM(RC[-4]:RC[-1]) -> 609.34 | ER28: 0 | ES28: 0 | ET28: 48.08 | EU28: 0 | EV28: =SUM(RC[-4]:RC[-1]) -> 48.08 | EW28: 0 | EX28: 0 | EY28: 155.69999999999999 | EZ28: 0 | FA28: =SUM(RC[-4]:RC[-1]) -> 155.69999999999999 | FB28: 0 | FC28: 0 | FD28: 4455.24 | FE28: 0 | FF28: =SUM(RC[-4]:RC[-1]) -> 4455.24 | FG28: 0 | FH28: 0 | FI28: 337.51 | FJ28: 0 | FK28: =SUM(RC[-4]:RC[-1]) -> 337.51 | FL28: 0 | FM28: 0 | FN28: 642.94000000000005 | FO28: 0 | FP28: =SUM(RC[-4]:RC[-1]) -> 642.94000000000005 | FQ28: 0 | FR28: 0 | FS28: 519.25 | FT28: 0 | FU28: =SUM(RC[-4]:RC[-1]) -> 519.25 | FV28: 0 | FW28: 0 | FX28: 14.994999999999999 | FY28: 0 | FZ28: =SUM(RC[-4]:RC[-1]) -> 14.994999999999999 | GA28: 0 | GB28: 0 | GC28: 1079 | GD28: 0 | GE28: =SUM(RC[-4]:RC[-1]) -> 1079 | GF28: 0 | GG28: 0 | GH28: 14.74 | GI28: 0 | GJ28: =SUM(RC[-4]:RC[-1]) -> 14.74 | GK28: 0 | GL28: 0 | GM28: 502.2 | GN28: 0 | GO28: =SUM(RC[-4]:RC[-1]) -> 502.2 | GP28: 0 | GQ28: 0 | GR28: 3.12 | GS28: 0 | GT28: =SUM(RC[-4]:RC[-1]) -> 3.12 | GU28: 0 | GV28: 0 | GW28: 0 | GX28: 0 | GY28: =SUM(RC[-4]:RC[-1]) -> 0 | GZ28: 0 | HA28: 0 | HB28: 14355.5 | HC28: 0 | HD28: =SUM(RC[-4]:RC[-1]) -> 14355.5 | HE28: 0 | HF28: 0 | HG28: 70.69 | HH28: 0 | HI28: =SUM(RC[-4]:RC[-1]) -> 70.69 | HJ28: 0 | HK28: 0 | HL28: 3920.84 | HM28: 0 | HN28: =SUM(RC[-4]:RC[-1]) -> 3920.84 | HO28: 0 | HP28: 0 | HQ28: 141.96 | HR28: 0 | HS28: =SUM(RC[-4]:RC[-1]) -> 141.96 | HT28: 0 | HU28: 0 | HV28: 665.11 | HW28: 0 | HX28: =SUM(RC[-4]:RC[-1]) -> 665.11 | HY28: 0 | HZ28: 0 | IA28: 282.82 | IB28: 0 | IC28: =SUM(RC[-4]:RC[-1]) -> 282.82 | ID28: 0 | IE28: 0 | IF28: 2.2999999999999998 | IG28: 0 | IH28: =SUM(RC[-4]:RC[-1]) -> 2.2999999999999998 | II28: 0 | IJ28: 0 | IK28: 903.64 | IL28: 0 | IM28: =SUM(RC[-4]:RC[-1]) -> 903.64
A29: COKE OVEN GAS | B29: =RC[8]+RC[13]+RC[18]+RC[23]+RC[28]+RC[33]+RC[38]+RC[43]+RC[48]+RC[53]+RC[58]+RC[63]+RC[68]+RC[73]+RC[78]+RC[83]+RC[88]+RC[93]+RC[98]+RC[103]+RC[108]+RC[113]+RC[118]+RC[123]+RC[128]+RC[133]+RC[138]+RC[143]+RC[148]+RC[153]+RC[158]+RC[163]+RC[168]+RC[173]+RC[178]+RC[183]+RC[188]+RC[193]+RC[198]+RC[203]+RC[208]+RC[213]+RC[218]+RC[223]+RC[228]+RC[233]+RC[238]+RC[243]+Sheet2!RC[2]+Sheet2!RC[7]+Sheet2!RC[12]+Sheet2!RC[17]+Sheet2!RC[22]+Sheet2!RC[27]+Sheet2!RC[32]+Sheet2!RC[37]+Sheet2!RC[42]+Sheet2!RC[47]+Sheet2!RC[57]+Sheet2!RC[52]+Sheet2!RC[62]+Sheet2!RC[67] -> 0 | C29: =RC[6]+RC[11]+RC[16]+RC[21]+RC[26]+RC[31]+RC[36]+RC[41]+RC[46]+RC[51]+RC[56]+RC[61]+RC[66]+RC[71]+RC[76]+RC[81]+RC[86]+RC[91]+RC[96]+RC[101]+RC[106]+RC[111]+RC[116]+RC[121]+RC[126]+RC[131]+RC[136]+RC[141]+RC[146]+RC[151]+RC[156]+RC[161]+RC[166]+RC[171]+RC[176]+RC[181]+RC[186]+RC[191]+RC[196]+RC[201]+RC[206]+RC[211]+RC[216]+RC[221]+RC[226]+RC[231]+RC[236]+RC[241]+Sheet2!RC+Sheet2!RC[5]+Sheet2!RC[10]+Sheet2!RC[15]+Sheet2!RC[20]+Sheet2!RC[25]+Sheet2!RC[30]+Sheet2!RC[35]+Sheet2!RC[40]+Sheet2!RC[45]+Sheet2!RC[50]+Sheet2!RC[55]+Sheet2!RC[60]+Sheet2!RC[65] -> 0 | D29: =RC[4]+RC[9]+RC[14]+RC[19]+RC[24]+RC[29]+RC[34]+RC[39]+RC[44]+RC[49]+RC[54]+RC[59]+RC[64]+RC[69]+RC[74]+RC[79]+RC[84]+RC[89]+RC[94]+RC[99]+RC[104]+RC[109]+RC[114]+RC[119]+RC[124]+RC[129]+RC[134]+RC[139]+RC[144]+RC[149]+RC[154]+RC[159]+RC[164]+RC[169]+RC[174]+RC[179]+RC[184]+RC[189]+RC[194]+RC[199]+RC[204]+RC[209]+RC[214]+RC[219]+RC[224]+RC[229]+RC[234]+RC[239]+Sheet2!RC[3]+Sheet2!RC[-2]+Sheet2!RC[8]+Sheet2!RC[13]+Sheet2!RC[18]+Sheet2!RC[23]+Sheet2!RC[28]+Sheet2!RC[33]+Sheet2!RC[38]+Sheet2!RC[43]+Sheet2!RC[48]+Sheet2!RC[53]+Sheet2!RC[58]+Sheet2!RC[63] -> 0 | E29: =RC[6]+RC[11]+RC[16]+RC[21]+RC[26]+RC[31]+RC[36]+RC[41]+RC[46]+RC[51]+RC[56]+RC[61]+RC[66]+RC[71]+RC[76]+RC[81]+RC[86]+RC[91]+RC[96]+RC[101]+RC[106]+RC[111]+RC[116]+RC[121]+RC[126]+RC[131]+RC[136]+RC[141]+RC[146]+RC[151]+RC[156]+RC[161]+RC[166]+RC[171]+RC[176]+RC[181]+RC[186]+RC[191]+RC[196]+RC[201]+RC[206]+RC[211]+RC[216]+RC[221]+RC[226]+RC[231]+RC[236]+RC[241]+Sheet2!RC+Sheet2!RC[5]+Sheet2!RC[10]+Sheet2!RC[15]+Sheet2!RC[20]+Sheet2!RC[25]+Sheet2!RC[30]+Sheet2!RC[35]+Sheet2!RC[40]+Sheet2!RC[45]+Sheet2!RC[50]+Sheet2!RC[55]+Sheet2!RC[60]+Sheet2!RC[65] -> 0 | F29: =SUM(RC[-4]:RC[-1]) -> 0 | G29: =Sheet1!RC[5]+Sheet1!RC[10]+Sheet1!RC[15]+Sheet1!RC[20]+Sheet1!RC[25]+Sheet1!RC[30]+Sheet1!RC[35]+Sheet1!RC[40]+Sheet1!RC[45]+Sheet1!RC[50]+Sheet1!RC[55]+Sheet1!RC[60]+Sheet1!RC[65]+Sheet1!RC[70]+Sheet1!RC[75]+Sheet1!RC[80]+Sheet1!RC[85]+Sheet1!RC[90]+Sheet1!RC[95]+Sheet1!RC[100]+Sheet1!RC[105]+Sheet1!RC[110]+Sheet1!RC[115]+Sheet1!RC[120]+Sheet1!RC[125]+Sheet1!RC[130]+Sheet1!RC[135]+Sheet1!RC[140]+Sheet1!RC[145]+Sheet1!RC[150]+Sheet1!RC[155]+Sheet1!RC[160]+Sheet1!RC[165]+Sheet1!RC[170]+Sheet1!RC[175]+Sheet1!RC[180]+Sheet1!RC[185]+Sheet1!RC[190]+Sheet1!RC[195]+Sheet1!RC[200]+Sheet1!RC[205]+Sheet1!RC[210]+Sheet1!RC[215]+Sheet1!RC[220]+Sheet1!RC[225]+Sheet1!RC[230]+Sheet1!RC[235]+Sheet1!RC[240]+Sheet2!RC[-1]+Sheet2!RC[4]+Sheet2!RC[9]+Sheet2!RC[14]+Sheet2!RC[19]+Sheet2!RC[24]+Sheet2!RC[29]+Sheet2!RC[34]+Sheet2!RC[39]+Sheet2!RC[44]+Sheet2!RC[49]+Sheet2!RC[54]+Sheet2!RC[59]+Sheet2!RC[64] -> 0 | H29: 0 | I29: 0 | J29: 0 | K29: 0 | L29: =SUM(RC[-4]:RC[-1]) -> 0 | M29: 0 | N29: 0 | O29: 0 | P29: 0 | Q29: =SUM(RC[-4]:RC[-1]) -> 0 | R29: 0 | S29: 0 | T29: 0 | U29: 0 | V29: =SUM(RC[-4]:RC[-1]) -> 0 | W29: 0 | X29: 0 | Y29: 0 | Z29: 0 | AA29: =SUM(RC[-4]:RC[-1]) -> 0 | AB29: 0 | AC29: 0 | AD29: 0 | AE29: 0 | AF29: =SUM(RC[-4]:RC[-1]) -> 0 | AG29: 0 | AH29: 0 | AI29: 0 | AJ29: 0 | AK29: =SUM(RC[-4]:RC[-1]) -> 0 | AL29: 0 | AM29: 0 | AN29: 0 | AO29: 0 | AP29: =SUM(RC[-4]:RC[-1]) -> 0 | AQ29: 0 | AR29: 0 | AS29: 0 | AT29: 0 | AU29: =SUM(RC[-4]:RC[-1]) -> 0 | AV29: 0 | AW29: 0 | AX29: 0 | AY29: 0 | AZ29: =SUM(RC[-4]:RC[-1]) -> 0 | BA29: 0 | BB29: 0 | BC29: 0 | BD29: 0 | BE29: =SUM(RC[-4]:RC[-1]) -> 0 | BF29: 0 | BG29: 0 | BH29: 0 | BI29: 0 | BJ29: =SUM(RC[-4]:RC[-1]) -> 0 | BK29: 0 | BL29: 0 | BM29: 0 | BN29: 0 | BO29: =SUM(RC[-4]:RC[-1]) -> 0 | BP29: 0 | BQ29: 0 | BR29: 0 | BS29: 0 | BT29: =SUM(RC[-4]:RC[-1]) -> 0 | BU29: 0 | BV29: 0 | BW29: 0 | BX29: 0 | BY29: =SUM(RC[-4]:RC[-1]) -> 0 | BZ29: 0 | CA29: 0 | CB29: 0 | CC29: 0 | CD29: =SUM(RC[-4]:RC[-1]) -> 0 | CE29: 0 | CF29: 0 | CG29: 0 | CH29: 0 | CI29: =SUM(RC[-4]:RC[-1]) -> 0 | CJ29: 0 | CK29: 0 | CL29: 0 | CM29: 0 | CN29: =SUM(RC[-4]:RC[-1]) -> 0 | CO29: 0 | CP29: 0 | CQ29: 0 | CR29: 0 | CS29: =SUM(RC[-4]:RC[-1]) -> 0 | CT29: 0 | CU29: 0 | CV29: 0 | CW29: 0 | CX29: =SUM(RC[-4]:RC[-1]) -> 0 | CY29: 0 | CZ29: 0 | DA29: 0 | DB29: 0 | DC29: =SUM(RC[-4]:RC[-1]) -> 0 | DD29: 0 | DE29: 0 | DF29: 0 | DG29: 0 | DH29: =SUM(RC[-4]:RC[-1]) -> 0 | DI29: 0 | DJ29: 0 | DK29: 0 | DL29: 0 | DM29: =SUM(RC[-4]:RC[-1]) -> 0 | DN29: 0 | DO29: 0 | DP29: 0 | DQ29: 0 | DR29: =SUM(RC[-4]:RC[-1]) -> 0 | DS29: 0 | DT29: 0 | DU29: 0 | DV29: 0 | DW29: =SUM(RC[-4]:RC[-1]) -> 0 | DX29: 0 | DY29: 0 | DZ29: 0 | EA29: 0 | EB29: =SUM(RC[-4]:RC[-1]) -> 0 | EC29: 0 | ED29: 0 | EE29: 0 | EF29: 0 | EG29: =SUM(RC[-4]:RC[-1]) -> 0 | EH29: 0 | EI29: 0 | EJ29: 0 | EK29: 0 | EL29: =SUM(RC[-4]:RC[-1]) -> 0 | EM29: 0 | EN29: 0 | EO29: 0 | EP29: 0 | EQ29: =SUM(RC[-4]:RC[-1]) -> 0 | ER29: 0 | ES29: 0 | ET29: 0 | EU29: 0 | EV29: =SUM(RC[-4]:RC[-1]) -> 0 | EW29: 0 | EX29: 0 | EY29: 0 | EZ29: 0 | FA29: =SUM(RC[-4]:RC[-1]) -> 0 | FB29: 0 | FC29: 0 | FD29: 0 | FE29: 0 | FF29: =SUM(RC[-4]:RC[-1]) -> 0 | FG29: 0 | FH29: 0 | FI29: 0 | FJ29: 0 | FK29: =SUM(RC[-4]:RC[-1]) -> 0 | FL29: 0 | FM29: 0 | FN29: 0 | FO29: 0 | FP29: =SUM(RC[-4]:RC[-1]) -> 0 | FQ29: 0 | FR29: 0 | FS29: 0 | FT29: 0 | FU29: =SUM(RC[-4]:RC[-1]) -> 0 | FV29: 0 | FW29: 0 | FX29: 0 | FY29: 0 | FZ29: =SUM(RC[-4]:RC[-1]) -> 0 | GA29: 0 | GB29: 0 | GC29: 0 | GD29: 0 | GE29: =SUM(RC[-4]:RC[-1]) -> 0 | GF29: 0 | GG29: 0 | GH29: 0 | GI29: 0 | GJ29: =SUM(RC[-4]:RC[-1]) -> 0 | GK29: 0 | GL29: 0 | GM29: 0 | GN29: 0 | GO29: =SUM(RC[-4]:RC[-1]) -> 0 | GP29: 0 | GQ29: 0 | GR29: 0 | GS29: 0 | GT29: =SUM(RC[-4]:RC[-1]) -> 0 | GU29: 0 | GV29: 0 | GW29: 0 | GX29: 0 | GY29: =SUM(RC[-4]:RC[-1]) -> 0 | GZ29: 0 | HA29: 0 | HB29: 0 | HC29: 0 | HD29: =SUM(RC[-4]:RC[-1]) -> 0 | HE29: 0 | HF29: 0 | HG29: 0 | HH29: 0 | HI29: =SUM(RC[-4]:RC[-1]) -> 0 | HJ29: 0 | HK29: 0 | HL29: 0 | HM29: 0 | HN29: =SUM(RC[-4]:RC[-1]) -> 0 | HO29: 0 | HP29: 0 | HQ29: 0 | HR29: 0 | HS29: =SUM(RC[-4]:RC[-1]) -> 0 | HT29: 0 | HU29: 0 | HV29: 0 | HW29: 0 | HX29: =SUM(RC[-4]:RC[-1]) -> 0 | HY29: 0 | HZ29: 0 | IA29: 0 | IB29: 0 | IC29: =SUM(RC[-4]:RC[-1]) -> 0 | ID29: 0 | IE29: 0 | IF29: 0 | IG29: 0 | IH29: =SUM(RC[-4]:RC[-1]) -> 0 | II29: 0 | IJ29: 0 | IK29: 0 | IL29: 0 | IM29: =SUM(RC[-4]:RC[-1]) -> 0
A30: COPPER | B30: =RC[8]+RC[13]+RC[18]+RC[23]+RC[28]+RC[33]+RC[38]+RC[43]+RC[48]+RC[53]+RC[58]+RC[63]+RC[68]+RC[73]+RC[78]+RC[83]+RC[88]+RC[93]+RC[98]+RC[103]+RC[108]+RC[113]+RC[118]+RC[123]+RC[128]+RC[133]+RC[138]+RC[143]+RC[148]+RC[153]+RC[158]+RC[163]+RC[168]+RC[173]+RC[178]+RC[183]+RC[188]+RC[193]+RC[198]+RC[203]+RC[208]+RC[213]+RC[218]+RC[223]+RC[228]+RC[233]+RC[238]+RC[243]+Sheet2!RC[2]+Sheet2!RC[7]+Sheet2!RC[12]+Sheet2!RC[17]+Sheet2!RC[22]+Sheet2!RC[27]+Sheet2!RC[32]+Sheet2!RC[37]+Sheet2!RC[42]+Sheet2!RC[47]+Sheet2!RC[57]+Sheet2!RC[52]+Sheet2!RC[62]+Sheet2!RC[67] -> 36058.988999999994 | C30: =RC[6]+RC[11]+RC[16]+RC[21]+RC[26]+RC[31]+RC[36]+RC[41]+RC[46]+RC[51]+RC[56]+RC[61]+RC[66]+RC[71]+RC[76]+RC[81]+RC[86]+RC[91]+RC[96]+RC[101]+RC[106]+RC[111]+RC[116]+RC[121]+RC[126]+RC[131]+RC[136]+RC[141]+RC[146]+RC[151]+RC[156]+RC[161]+RC[166]+RC[171]+RC[176]+RC[181]+RC[186]+RC[191]+RC[196]+RC[201]+RC[206]+RC[211]+RC[216]+RC[221]+RC[226]+RC[231]+RC[236]+RC[241]+Sheet2!RC+Sheet2!RC[5]+Sheet2!RC[10]+Sheet2!RC[15]+Sheet2!RC[20]+Sheet2!RC[25]+Sheet2!RC[30]+Sheet2!RC[35]+Sheet2!RC[40]+Sheet2!RC[45]+Sheet2!RC[50]+Sheet2!RC[55]+Sheet2!RC[60]+Sheet2!RC[65] -> 0 | D30: =RC[4]+RC[9]+RC[14]+RC[19]+RC[24]+RC[29]+RC[34]+RC[39]+RC[44]+RC[49]+RC[54]+RC[59]+RC[64]+RC[69]+RC[74]+RC[79]+RC[84]+RC[89]+RC[94]+RC[99]+RC[104]+RC[109]+RC[114]+RC[119]+RC[124]+RC[129]+RC[134]+RC[139]+RC[144]+RC[149]+RC[154]+RC[159]+RC[164]+RC[169]+RC[174]+RC[179]+RC[184]+RC[189]+RC[194]+RC[199]+RC[204]+RC[209]+RC[214]+RC[219]+RC[224]+RC[229]+RC[234]+RC[239]+Sheet2!RC[3]+Sheet2!RC[-2]+Sheet2!RC[8]+Sheet2!RC[13]+Sheet2!RC[18]+Sheet2!RC[23]+Sheet2!RC[28]+Sheet2!RC[33]+Sheet2!RC[38]+Sheet2!RC[43]+Sheet2!RC[48]+Sheet2!RC[53]+Sheet2!RC[58]+Sheet2!RC[63] -> 1785 | E30: =RC[6]+RC[11]+RC[16]+RC[21]+RC[26]+RC[31]+RC[36]+RC[41]+RC[46]+RC[51]+RC[56]+RC[61]+RC[66]+RC[71]+RC[76]+RC[81]+RC[86]+RC[91]+RC[96]+RC[101]+RC[106]+RC[111]+RC[116]+RC[121]+RC[126]+RC[131]+RC[136]+RC[141]+RC[146]+RC[151]+RC[156]+RC[161]+RC[166]+RC[171]+RC[176]+RC[181]+RC[186]+RC[191]+RC[196]+RC[201]+RC[206]+RC[211]+RC[216]+RC[221]+RC[226]+RC[231]+RC[236]+RC[241]+Sheet2!RC+Sheet2!RC[5]+Sheet2!RC[10]+Sheet2!RC[15]+Sheet2!RC[20]+Sheet2!RC[25]+Sheet2!RC[30]+Sheet2!RC[35]+Sheet2!RC[40]+Sheet2!RC[45]+Sheet2!RC[50]+Sheet2!RC[55]+Sheet2!RC[60]+Sheet2!RC[65] -> 123.91500000000001 | F30: =SUM(RC[-4]:RC[-1]) -> 37967.903999999995 | G30: =Sheet1!RC[5]+Sheet1!RC[10]+Sheet1!RC[15]+Sheet1!RC[20]+Sheet1!RC[25]+Sheet1!RC[30]+Sheet1!RC[35]+Sheet1!RC[40]+Sheet1!RC[45]+Sheet1!RC[50]+Sheet1!RC[55]+Sheet1!RC[60]+Sheet1!RC[65]+Sheet1!RC[70]+Sheet1!RC[75]+Sheet1!RC[80]+Sheet1!RC[85]+Sheet1!RC[90]+Sheet1!RC[95]+Sheet1!RC[100]+Sheet1!RC[105]+Sheet1!RC[110]+Sheet1!RC[115]+Sheet1!RC[120]+Sheet1!RC[125]+Sheet1!RC[130]+Sheet1!RC[135]+Sheet1!RC[140]+Sheet1!RC[145]+Sheet1!RC[150]+Sheet1!RC[155]+Sheet1!RC[160]+Sheet1!RC[165]+Sheet1!RC[170]+Sheet1!RC[175]+Sheet1!RC[180]+Sheet1!RC[185]+Sheet1!RC[190]+Sheet1!RC[195]+Sheet1!RC[200]+Sheet1!RC[205]+Sheet1!RC[210]+Sheet1!RC[215]+Sheet1!RC[220]+Sheet1!RC[225]+Sheet1!RC[230]+Sheet1!RC[235]+Sheet1!RC[240]+Sheet2!RC[-1]+Sheet2!RC[4]+Sheet2!RC[9]+Sheet2!RC[14]+Sheet2!RC[19]+Sheet2!RC[24]+Sheet2!RC[29]+Sheet2!RC[34]+Sheet2!RC[39]+Sheet2!RC[44]+Sheet2!RC[49]+Sheet2!RC[54]+Sheet2!RC[59]+Sheet2!RC[64] -> 37967.903999999995 | H30: 50 | I30: 0 | J30: 2378.67 | K30: 32.01 | L30: =SUM(RC[-4]:RC[-1]) -> 2460.6800000000003 | M30: 9 | N30: 0 | O30: 0.61 | P30: 0 | Q30: =SUM(RC[-4]:RC[-1]) -> 9.61 | R30: 46 | S30: 0 | T30: 58.999000000000002 | U30: 1.4550000000000001 | V30: =SUM(RC[-4]:RC[-1]) -> 106.45399999999999 | W30: 35 | X30: 0 | Y30: 168.1 | Z30: 0 | AA30: =SUM(RC[-4]:RC[-1]) -> 203.1 | AB30: 13 | AC30: 0 | AD30: 2E-3 | AE30: 0 | AF30: =SUM(RC[-4]:RC[-1]) -> 13.002000000000001 | AG30: 12 | AH30: 0 | AI30: 130.1 | AJ30: 1.425 | AK30: =SUM(RC[-4]:RC[-1]) -> 143.52500000000001 | AL30: 27 | AM30: 0 | AN30: 1301.55 | AO30: 4.7249999999999996 | AP30: =SUM(RC[-4]:RC[-1]) -> 1333.2749999999999 | AQ30: 13 | AR30: 0 | AS30: 7.19 | AT30: 0 | AU30: =SUM(RC[-4]:RC[-1]) -> 20.190000000000001 | AV30: 8 | AW30: 0 | AX30: 4.9560000000000004 | AY30: 0 | AZ30: =SUM(RC[-4]:RC[-1]) -> 12.956 | BA30: 15 | BB30: 0 | BC30: 3.45 | BD30: 0 | BE30: =SUM(RC[-4]:RC[-1]) -> 18.45 | BF30: 11 | BG30: 0 | BH30: 1.2110000000000001 | BI30: 6.585 | BJ30: =SUM(RC[-4]:RC[-1]) -> 18.795999999999999 | BK30: 10 | BL30: 0 | BM30: 0.22 | BN30: 0 | BO30: =SUM(RC[-4]:RC[-1]) -> 10.220000000000001 | BP30: 9 | BQ30: 0 | BR30: 43.06 | BS30: 0 | BT30: =SUM(RC[-4]:RC[-1]) -> 52.06 | BU30: 34 | BV30: 0 | BW30: 46.89 | BX30: 0.03 | BY30: =SUM(RC[-4]:RC[-1]) -> 80.92 | BZ30: 118 | CA30: 0 | CB30: 8511.0300000000007 | CC30: 16.02 | CD30: =SUM(RC[-4]:RC[-1]) -> 8645.0500000000011 | CE30: 10 | CF30: 0 | CG30: 9.4700000000000006 | CH30: 0 | CI30: =SUM(RC[-4]:RC[-1]) -> 19.47 | CJ30: 7 | CK30: 0 | CL30: 0 | CM30: 0.09 | CN30: =SUM(RC[-4]:RC[-1]) -> 7.09 | CO30: 6 | CP30: 0 | CQ30: 1E-3 | CR30: 0 | CS30: =SUM(RC[-4]:RC[-1]) -> 6.0010000000000003 | CT30: 19 | CU30: 0 | CV30: 3.93 | CW30: 0 | CX30: =SUM(RC[-4]:RC[-1]) -> 22.93 | CY30: 13 | CZ30: 0 | DA30: 1859.06 | DB30: 1.4999999999999999E-2 | DC30: =SUM(RC[-4]:RC[-1]) -> 1872.075 | DD30: 2 | DE30: 0 | DF30: 0 | DG30: 0 | DH30: =SUM(RC[-4]:RC[-1]) -> 2 | DI30: 12 | DJ30: 0 | DK30: 14.63 | DL30: 0 | DM30: =SUM(RC[-4]:RC[-1]) -> 26.630000000000003 | DN30: 22 | DO30: 0 | DP30: 148.80000000000001 | DQ30: 0.09 | DR30: =SUM(RC[-4]:RC[-1]) -> 170.89000000000001 | DS30: 64 | DT30: 0 | DU30: 133.54 | DV30: 2.625 | DW30: =SUM(RC[-4]:RC[-1]) -> 200.16499999999999 | DX30: 4 | DY30: 0 | DZ30: 17.16 | EA30: 0 | EB30: =SUM(RC[-4]:RC[-1]) -> 21.16 | EC30: 13 | ED30: 0 | EE30: 5.39 | EF30: 0 | EG30: =SUM(RC[-4]:RC[-1]) -> 18.39 | EH30: 13 | EI30: 0 | EJ30: 0 | EK30: 0 | EL30: =SUM(RC[-4]:RC[-1]) -> 13 | EM30: 80 | EN30: 0 | EO30: 832.45 | EP30: 1.4999999999999999E-2 | EQ30: =SUM(RC[-4]:RC[-1]) -> 912.46500000000003 | ER30: 14 | ES30: 0 | ET30: 458.2 | EU30: 0 | EV30: =SUM(RC[-4]:RC[-1]) -> 472.2 | EW30: 157 | EX30: 0 | EY30: 665.77 | EZ30: 1.5449999999999999 | FA30: =SUM(RC[-4]:RC[-1]) -> 824.31499999999994 | FB30: 39 | FC30: 0 | FD30: 208.92 | FE30: 1.425 | FF30: =SUM(RC[-4]:RC[-1]) -> 249.345 | FG30: 21 | FH30: 0 | FI30: 9693.7000000000007 | FJ30: 1.4550000000000001 | FK30: =SUM(RC[-4]:RC[-1]) -> 9716.1550000000007 | FL30: 33 | FM30: 0 | FN30: 172.16 | FO30: 1.575 | FP30: =SUM(RC[-4]:RC[-1]) -> 206.73499999999999 | FQ30: 58 | FR30: 0 | FS30: 1128.2 | FT30: 0 | FU30: =SUM(RC[-4]:RC[-1]) -> 1186.2 | FV30: 20 | FW30: 0 | FX30: 135.53 | FY30: 0 | FZ30: =SUM(RC[-4]:RC[-1]) -> 155.53 | GA30: 16 | GB30: 0 | GC30: 217.9 | GD30: 8.25 | GE30: =SUM(RC[-4]:RC[-1]) -> 242.15 | GF30: 5 | GG30: 0 | GH30: 0.36 | GI30: 1.425 | GJ30: =SUM(RC[-4]:RC[-1]) -> 6.7850000000000001 | GK30: 18 | GL30: 0 | GM30: 310 | GN30: 1.47 | GO30: =SUM(RC[-4]:RC[-1]) -> 329.47 | GP30: 12 | GQ30: 0 | GR30: 7.0000000000000007E-2 | GS30: 0 | GT30: =SUM(RC[-4]:RC[-1]) -> 12.07 | GU30: 16 | GV30: 0 | GW30: 0 | GX30: 8.25 | GY30: =SUM(RC[-4]:RC[-1]) -> 24.25 | GZ30: 92 | HA30: 0 | HB30: 382.46 | HC30: 4.2300000000000004 | HD30: =SUM(RC[-4]:RC[-1]) -> 478.69 | HE30: 20 | HF30: 0 | HG30: 51.74 | HH30: 2.7749999999999999 | HI30: =SUM(RC[-4]:RC[-1]) -> 74.515000000000015 | HJ30: 32 | HK30: 0 | HL30: 569.5 | HM30: 1.4999999999999999E-2 | HN30: =SUM(RC[-4]:RC[-1]) -> 601.51499999999999 | HO30: 36 | HP30: 0 | HQ30: 434.19 | HR30: 8.52 | HS30: =SUM(RC[-4]:RC[-1]) -> 478.71 | HT30: 30 | HU30: 0 | HV30: 382.14 | HW30: 0.09 | HX30: =SUM(RC[-4]:RC[-1]) -> 412.22999999999996 | HY30: 18 | HZ30: 0 | IA30: 59.32 | IB30: 0.435 | IC30: =SUM(RC[-4]:RC[-1]) -> 77.754999999999995 | ID30: 6 | IE30: 0 | IF30: 0.05 | IG30: 0 | IH30: =SUM(RC[-4]:RC[-1]) -> 6.05 | II30: 3 | IJ30: 0 | IK30: 499 | IL30: 0 | IM30: =SUM(RC[-4]:RC[-1]) -> 502
A31: DIBENZAHAN | B31: =RC[8]+RC[13]+RC[18]+RC[23]+RC[28]+RC[33]+RC[38]+RC[43]+RC[48]+RC[53]+RC[58]+RC[63]+RC[68]+RC[73]+RC[78]+RC[83]+RC[88]+RC[93]+RC[98]+RC[103]+RC[108]+RC[113]+RC[118]+RC[123]+RC[128]+RC[133]+RC[138]+RC[143]+RC[148]+RC[153]+RC[158]+RC[163]+RC[168]+RC[173]+RC[178]+RC[183]+RC[188]+RC[193]+RC[198]+RC[203]+RC[208]+RC[213]+RC[218]+RC[223]+RC[228]+RC[233]+RC[238]+RC[243]+Sheet2!RC[2]+Sheet2!RC[7]+Sheet2!RC[12]+Sheet2!RC[17]+Sheet2!RC[22]+Sheet2!RC[27]+Sheet2!RC[32]+Sheet2!RC[37]+Sheet2!RC[42]+Sheet2!RC[47]+Sheet2!RC[57]+Sheet2!RC[52]+Sheet2!RC[62]+Sheet2!RC[67] -> 9 | C31: =RC[6]+RC[11]+RC[16]+RC[21]+RC[26]+RC[31]+RC[36]+RC[41]+RC[46]+RC[51]+RC[56]+RC[61]+RC[66]+RC[71]+RC[76]+RC[81]+RC[86]+RC[91]+RC[96]+RC[101]+RC[106]+RC[111]+RC[116]+RC[121]+RC[126]+RC[131]+RC[136]+RC[141]+RC[146]+RC[151]+RC[156]+RC[161]+RC[166]+RC[171]+RC[176]+RC[181]+RC[186]+RC[191]+RC[196]+RC[201]+RC[206]+RC[211]+RC[216]+RC[221]+RC[226]+RC[231]+RC[236]+RC[241]+Sheet2!RC+Sheet2!RC[5]+Sheet2!RC[10]+Sheet2!RC[15]+Sheet2!RC[20]+Sheet2!RC[25]+Sheet2!RC[30]+Sheet2!RC[35]+Sheet2!RC[40]+Sheet2!RC[45]+Sheet2!RC[50]+Sheet2!RC[55]+Sheet2!RC[60]+Sheet2!RC[65] -> 0 | D31: =RC[4]+RC[9]+RC[14]+RC[19]+RC[24]+RC[29]+RC[34]+RC[39]+RC[44]+RC[49]+RC[54]+RC[59]+RC[64]+RC[69]+RC[74]+RC[79]+RC[84]+RC[89]+RC[94]+RC[99]+RC[104]+RC[109]+RC[114]+RC[119]+RC[124]+RC[129]+RC[134]+RC[139]+RC[144]+RC[149]+RC[154]+RC[159]+RC[164]+RC[169]+RC[174]+RC[179]+RC[184]+RC[189]+RC[194]+RC[199]+RC[204]+RC[209]+RC[214]+RC[219]+RC[224]+RC[229]+RC[234]+RC[239]+Sheet2!RC[3]+Sheet2!RC[-2]+Sheet2!RC[8]+Sheet2!RC[13]+Sheet2!RC[18]+Sheet2!RC[23]+Sheet2!RC[28]+Sheet2!RC[33]+Sheet2!RC[38]+Sheet2!RC[43]+Sheet2!RC[48]+Sheet2!RC[53]+Sheet2!RC[58]+Sheet2!RC[63] -> 0 | E31: =RC[6]+RC[11]+RC[16]+RC[21]+RC[26]+RC[31]+RC[36]+RC[41]+RC[46]+RC[51]+RC[56]+RC[61]+RC[66]+RC[71]+RC[76]+RC[81]+RC[86]+RC[91]+RC[96]+RC[101]+RC[106]+RC[111]+RC[116]+RC[121]+RC[126]+RC[131]+RC[136]+RC[141]+RC[146]+RC[151]+RC[156]+RC[161]+RC[166]+RC[171]+RC[176]+RC[181]+RC[186]+RC[191]+RC[196]+RC[201]+RC[206]+RC[211]+RC[216]+RC[221]+RC[226]+RC[231]+RC[236]+RC[241]+Sheet2!RC+Sheet2!RC[5]+Sheet2!RC[10]+Sheet2!RC[15]+Sheet2!RC[20]+Sheet2!RC[25]+Sheet2!RC[30]+Sheet2!RC[35]+Sheet2!RC[40]+Sheet2!RC[45]+Sheet2!RC[50]+Sheet2!RC[55]+Sheet2!RC[60]+Sheet2!RC[65] -> 0 | F31: =SUM(RC[-4]:RC[-1]) -> 9 | G31: =Sheet1!RC[5]+Sheet1!RC[10]+Sheet1!RC[15]+Sheet1!RC[20]+Sheet1!RC[25]+Sheet1!RC[30]+Sheet1!RC[35]+Sheet1!RC[40]+Sheet1!RC[45]+Sheet1!RC[50]+Sheet1!RC[55]+Sheet1!RC[60]+Sheet1!RC[65]+Sheet1!RC[70]+Sheet1!RC[75]+Sheet1!RC[80]+Sheet1!RC[85]+Sheet1!RC[90]+Sheet1!RC[95]+Sheet1!RC[100]+Sheet1!RC[105]+Sheet1!RC[110]+Sheet1!RC[115]+Sheet1!RC[120]+Sheet1!RC[125]+Sheet1!RC[130]+Sheet1!RC[135]+Sheet1!RC[140]+Sheet1!RC[145]+Sheet1!RC[150]+Sheet1!RC[155]+Sheet1!RC[160]+Sheet1!RC[165]+Sheet1!RC[170]+Sheet1!RC[175]+Sheet1!RC[180]+Sheet1!RC[185]+Sheet1!RC[190]+Sheet1!RC[195]+Sheet1!RC[200]+Sheet1!RC[205]+Sheet1!RC[210]+Sheet1!RC[215]+Sheet1!RC[220]+Sheet1!RC[225]+Sheet1!RC[230]+Sheet1!RC[235]+Sheet1!RC[240]+Sheet2!RC[-1]+Sheet2!RC[4]+Sheet2!RC[9]+Sheet2!RC[14]+Sheet2!RC[19]+Sheet2!RC[24]+Sheet2!RC[29]+Sheet2!RC[34]+Sheet2!RC[39]+Sheet2!RC[44]+Sheet2!RC[49]+Sheet2!RC[54]+Sheet2!RC[59]+Sheet2!RC[64] -> 9 | H31: 0 | I31: 0 | J31: 0 | K31: 0 | L31: =SUM(RC[-4]:RC[-1]) -> 0 | M31: 0 | N31: 0 | O31: 0 | P31: 0 | Q31: =SUM(RC[-4]:RC[-1]) -> 0 | R31: 0 | S31: 0 | T31: 0 | U31: 0 | V31: =SUM(RC[-4]:RC[-1]) -> 0 | W31: 0 | X31: 0 | Y31: 0 | Z31: 0 | AA31: =SUM(RC[-4]:RC[-1]) -> 0 | AB31: 0 | AC31: 0 | AD31: 0 | AE31: 0 | AF31: =SUM(RC[-4]:RC[-1]) -> 0 | AG31: 0 | AH31: 0 | AI31: 0 | AJ31: 0 | AK31: =SUM(RC[-4]:RC[-1]) -> 0 | AL31: 0 | AM31: 0 | AN31: 0 | AO31: 0 | AP31: =SUM(RC[-4]:RC[-1]) -> 0 | AQ31: 0 | AR31: 0 | AS31: 0 | AT31: 0 | AU31: =SUM(RC[-4]:RC[-1]) -> 0 | AV31: 0 | AW31: 0 | AX31: 0 | AY31: 0 | AZ31: =SUM(RC[-4]:RC[-1]) -> 0 | BA31: 0 | BB31: 0 | BC31: 0 | BD31: 0 | BE31: =SUM(RC[-4]:RC[-1]) -> 0 | BF31: 0 | BG31: 0 | BH31: 0 | BI31: 0 | BJ31: =SUM(RC[-4]:RC[-1]) -> 0 | BK31: 0 | BL31: 0 | BM31: 0 | BN31: 0 | BO31: =SUM(RC[-4]:RC[-1]) -> 0 | BP31: 0 | BQ31: 0 | BR31: 0 | BS31: 0 | BT31: =SUM(RC[-4]:RC[-1]) -> 0 | BU31: 0 | BV31: 0 | BW31: 0 | BX31: 0 | BY31: =SUM(RC[-4]:RC[-1]) -> 0 | BZ31: 0 | CA31: 0 | CB31: 9 | CC31: 0 | CD31: =SUM(RC[-4]:RC[-1]) -> 9 | CE31: 0 | CF31: 0 | CG31: 0 | CH31: 0 | CI31: =SUM(RC[-4]:RC[-1]) -> 0 | CJ31: 0 | CK31: 0 | CL31: 0 | CM31: 0 | CN31: =SUM(RC[-4]:RC[-1]) -> 0 | CO31: 0 | CP31: 0 | CQ31: 0 | CR31: 0 | CS31: =SUM(RC[-4]:RC[-1]) -> 0 | CT31: 0 | CU31: 0 | CV31: 0 | CW31: 0 | CX31: =SUM(RC[-4]:RC[-1]) -> 0 | CY31: 0 | CZ31: 0 | DA31: 0 | DB31: 0 | DC31: =SUM(RC[-4]:RC[-1]) -> 0 | DD31: 0 | DE31: 0 | DF31: 0 | DG31: 0 | DH31: =SUM(RC[-4]:RC[-1]) -> 0 | DI31: 0 | DJ31: 0 | DK31: 0 | DL31: 0 | DM31: =SUM(RC[-4]:RC[-1]) -> 0 | DN31: 0 | DO31: 0 | DP31: 0 | DQ31: 0 | DR31: =SUM(RC[-4]:RC[-1]) -> 0 | DS31: 0 | DT31: 0 | DU31: 0 | DV31: 0 | DW31: =SUM(RC[-4]:RC[-1]) -> 0 | DX31: 0 | DY31: 0 | DZ31: 0 | EA31: 0 | EB31: =SUM(RC[-4]:RC[-1]) -> 0 | EC31: 0 | ED31: 0 | EE31: 0 | EF31: 0 | EG31: =SUM(RC[-4]:RC[-1]) -> 0 | EH31: 0 | EI31: 0 | EJ31: 0 | EK31: 0 | EL31: =SUM(RC[-4]:RC[-1]) -> 0 | EM31: 0 | EN31: 0 | EO31: 0 | EP31: 0 | EQ31: =SUM(RC[-4]:RC[-1]) -> 0 | ER31: 0 | ES31: 0 | ET31: 0 | EU31: 0 | EV31: =SUM(RC[-4]:RC[-1]) -> 0 | EW31: 0 | EX31: 0 | EY31: 0 | EZ31: 0 | FA31: =SUM(RC[-4]:RC[-1]) -> 0 | FB31: 0 | FC31: 0 | FD31: 0 | FE31: 0 | FF31: =SUM(RC[-4]:RC[-1]) -> 0 | FG31: 0 | FH31: 0 | FI31: 0 | FJ31: 0 | FK31: =SUM(RC[-4]:RC[-1]) -> 0 | FL31: 0 | FM31: 0 | FN31: 0 | FO31: 0 | FP31: =SUM(RC[-4]:RC[-1]) -> 0 | FQ31: 0 | FR31: 0 | FS31: 0 | FT31: 0 | FU31: =SUM(RC[-4]:RC[-1]) -> 0 | FV31: 0 | FW31: 0 | FX31: 0 | FY31: 0 | FZ31: =SUM(RC[-4]:RC[-1]) -> 0 | GA31: 0 | GB31: 0 | GC31: 0 | GD31: 0 | GE31: =SUM(RC[-4]:RC[-1]) -> 0 | GF31: 0 | GG31: 0 | GH31: 0 | GI31: 0 | GJ31: =SUM(RC[-4]:RC[-1]) -> 0 | GK31: 0 | GL31: 0 | GM31: 0 | GN31: 0 | GO31: =SUM(RC[-4]:RC[-1]) -> 0 | GP31: 0 | GQ31: 0 | GR31: 0 | GS31: 0 | GT31: =SUM(RC[-4]:RC[-1]) -> 0 | GU31: 0 | GV31: 0 | GW31: 0 | GX31: 0 | GY31: =SUM(RC[-4]:RC[-1]) -> 0 | GZ31: 0 | HA31: 0 | HB31: 0 | HC31: 0 | HD31: =SUM(RC[-4]:RC[-1]) -> 0 | HE31: 0 | HF31: 0 | HG31: 0 | HH31: 0 | HI31: =SUM(RC[-4]:RC[-1]) -> 0 | HJ31: 0 | HK31: 0 | HL31: 0 | HM31: 0 | HN31: =SUM(RC[-4]:RC[-1]) -> 0 | HO31: 0 | HP31: 0 | HQ31: 0 | HR31: 0 | HS31: =SUM(RC[-4]:RC[-1]) -> 0 | HT31: 0 | HU31: 0 | HV31: 0 | HW31: 0 | HX31: =SUM(RC[-4]:RC[-1]) -> 0 | HY31: 0 | HZ31: 0 | IA31: 0 | IB31: 0 | IC31: =SUM(RC[-4]:RC[-1]) -> 0 | ID31: 0 | IE31: 0 | IF31: 0 | IG31: 0 | IH31: =SUM(RC[-4]:RC[-1]) -> 0 | II31: 0 | IJ31: 0 | IK31: 0 | IL31: 0 | IM31: =SUM(RC[-4]:RC[-1]) -> 0
A32: BIBROMOET,12 | B32: =RC[8]+RC[13]+RC[18]+RC[23]+RC[28]+RC[33]+RC[38]+RC[43]+RC[48]+RC[53]+RC[58]+RC[63]+RC[68]+RC[73]+RC[78]+RC[83]+RC[88]+RC[93]+RC[98]+RC[103]+RC[108]+RC[113]+RC[118]+RC[123]+RC[128]+RC[133]+RC[138]+RC[143]+RC[148]+RC[153]+RC[158]+RC[163]+RC[168]+RC[173]+RC[178]+RC[183]+RC[188]+RC[193]+RC[198]+RC[203]+RC[208]+RC[213]+RC[218]+RC[223]+RC[228]+RC[233]+RC[238]+RC[243]+Sheet2!RC[2]+Sheet2!RC[7]+Sheet2!RC[12]+Sheet2!RC[17]+Sheet2!RC[22]+Sheet2!RC[27]+Sheet2!RC[32]+Sheet2!RC[37]+Sheet2!RC[42]+Sheet2!RC[47]+Sheet2!RC[57]+Sheet2!RC[52]+Sheet2!RC[62]+Sheet2!RC[67] -> 411.10070000000007 | C32: =RC[6]+RC[11]+RC[16]+RC[21]+RC[26]+RC[31]+RC[36]+RC[41]+RC[46]+RC[51]+RC[56]+RC[61]+RC[66]+RC[71]+RC[76]+RC[81]+RC[86]+RC[91]+RC[96]+RC[101]+RC[106]+RC[111]+RC[116]+RC[121]+RC[126]+RC[131]+RC[136]+RC[141]+RC[146]+RC[151]+RC[156]+RC[161]+RC[166]+RC[171]+RC[176]+RC[181]+RC[186]+RC[191]+RC[196]+RC[201]+RC[206]+RC[211]+RC[216]+RC[221]+RC[226]+RC[231]+RC[236]+RC[241]+Sheet2!RC+Sheet2!RC[5]+Sheet2!RC[10]+Sheet2!RC[15]+Sheet2!RC[20]+Sheet2!RC[25]+Sheet2!RC[30]+Sheet2!RC[35]+Sheet2!RC[40]+Sheet2!RC[45]+Sheet2!RC[50]+Sheet2!RC[55]+Sheet2!RC[60]+Sheet2!RC[65] -> 484.36170000000004 | D32: =RC[4]+RC[9]+RC[14]+RC[19]+RC[24]+RC[29]+RC[34]+RC[39]+RC[44]+RC[49]+RC[54]+RC[59]+RC[64]+RC[69]+RC[74]+RC[79]+RC[84]+RC[89]+RC[94]+RC[99]+RC[104]+RC[109]+RC[114]+RC[119]+RC[124]+RC[129]+RC[134]+RC[139]+RC[144]+RC[149]+RC[154]+RC[159]+RC[164]+RC[169]+RC[174]+RC[179]+RC[184]+RC[189]+RC[194]+RC[199]+RC[204]+RC[209]+RC[214]+RC[219]+RC[224]+RC[229]+RC[234]+RC[239]+Sheet2!RC[3]+Sheet2!RC[-2]+Sheet2!RC[8]+Sheet2!RC[13]+Sheet2!RC[18]+Sheet2!RC[23]+Sheet2!RC[28]+Sheet2!RC[33]+Sheet2!RC[38]+Sheet2!RC[43]+Sheet2!RC[48]+Sheet2!RC[53]+Sheet2!RC[58]+Sheet2!RC[63] -> 0 | E32: =RC[6]+RC[11]+RC[16]+RC[21]+RC[26]+RC[31]+RC[36]+RC[41]+RC[46]+RC[51]+RC[56]+RC[61]+RC[66]+RC[71]+RC[76]+RC[81]+RC[86]+RC[91]+RC[96]+RC[101]+RC[106]+RC[111]+RC[116]+RC[121]+RC[126]+RC[131]+RC[136]+RC[141]+RC[146]+RC[151]+RC[156]+RC[161]+RC[166]+RC[171]+RC[176]+RC[181]+RC[186]+RC[191]+RC[196]+RC[201]+RC[206]+RC[211]+RC[216]+RC[221]+RC[226]+RC[231]+RC[236]+RC[241]+Sheet2!RC+Sheet2!RC[5]+Sheet2!RC[10]+Sheet2!RC[15]+Sheet2!RC[20]+Sheet2!RC[25]+Sheet2!RC[30]+Sheet2!RC[35]+Sheet2!RC[40]+Sheet2!RC[45]+Sheet2!RC[50]+Sheet2!RC[55]+Sheet2!RC[60]+Sheet2!RC[65] -> 0 | F32: =SUM(RC[-4]:RC[-1]) -> 895.46240000000012 | G32: =Sheet1!RC[5]+Sheet1!RC[10]+Sheet1!RC[15]+Sheet1!RC[20]+Sheet1!RC[25]+Sheet1!RC[30]+Sheet1!RC[35]+Sheet1!RC[40]+Sheet1!RC[45]+Sheet1!RC[50]+Sheet1!RC[55]+Sheet1!RC[60]+Sheet1!RC[65]+Sheet1!RC[70]+Sheet1!RC[75]+Sheet1!RC[80]+Sheet1!RC[85]+Sheet1!RC[90]+Sheet1!RC[95]+Sheet1!RC[100]+Sheet1!RC[105]+Sheet1!RC[110]+Sheet1!RC[115]+Sheet1!RC[120]+Sheet1!RC[125]+Sheet1!RC[130]+Sheet1!RC[135]+Sheet1!RC[140]+Sheet1!RC[145]+Sheet1!RC[150]+Sheet1!RC[155]+Sheet1!RC[160]+Sheet1!RC[165]+Sheet1!RC[170]+Sheet1!RC[175]+Sheet1!RC[180]+Sheet1!RC[185]+Sheet1!RC[190]+Sheet1!RC[195]+Sheet1!RC[200]+Sheet1!RC[205]+Sheet1!RC[210]+Sheet1!RC[215]+Sheet1!RC[220]+Sheet1!RC[225]+Sheet1!RC[230]+Sheet1!RC[235]+Sheet1!RC[240]+Sheet2!RC[-1]+Sheet2!RC[4]+Sheet2!RC[9]+Sheet2!RC[14]+Sheet2!RC[19]+Sheet2!RC[24]+Sheet2!RC[29]+Sheet2!RC[34]+Sheet2!RC[39]+Sheet2!RC[44]+Sheet2!RC[49]+Sheet2!RC[54]+Sheet2!RC[59]+Sheet2!RC[64] -> 895.46239999999977 | H32: 0 | I32: 13.32 | J32: 2.42 | K32: 0 | L32: =SUM(RC[-4]:RC[-1]) -> 15.74 | M32: 0 | N32: 1.9669000000000001 | O32: 0 | P32: 0 | Q32: =SUM(RC[-4]:RC[-1]) -> 1.9669000000000001 | R32: 0 | S32: 15.67 | T32: 0 | U32: 0 | V32: =SUM(RC[-4]:RC[-1]) -> 15.67 | W32: 0 | X32: 8.44 | Y32: 3.5000000000000003E-2 | Z32: 0 | AA32: =SUM(RC[-4]:RC[-1]) -> 8.4749999999999996 | AB32: 0 | AC32: 2.5 | AD32: 0 | AE32: 0 | AF32: =SUM(RC[-4]:RC[-1]) -> 2.5 | AG32: 0 | AH32: 3.17 | AI32: 0 | AJ32: 0 | AK32: =SUM(RC[-4]:RC[-1]) -> 3.17 | AL32: 0 | AM32: 3.9998999999999998 | AN32: 1E-3 | AO32: 0 | AP32: =SUM(RC[-4]:RC[-1]) -> 4.0008999999999997 | AQ32: 0 | AR32: 2.84 | AS32: 7.0000000000000007E-2 | AT32: 0 | AU32: =SUM(RC[-4]:RC[-1]) -> 2.9099999999999997 | AV32: 0 | AW32: 1.7699 | AX32: 0 | AY32: 0 | AZ32: =SUM(RC[-4]:RC[-1]) -> 1.7699 | BA32: 0 | BB32: 3.38 | BC32: 0 | BD32: 0 | BE32: =SUM(RC[-4]:RC[-1]) -> 3.38 | BF32: 0 | BG32: 3.109 | BH32: 3.0000000000000001E-3 | BI32: 0 | BJ32: =SUM(RC[-4]:RC[-1]) -> 3.1120000000000001 | BK32: 0 | BL32: 2.48 | BM32: 6.9999999999999999E-4 | BN32: 0 | BO32: =SUM(RC[-4]:RC[-1]) -> 2.4807000000000001 | BP32: 0 | BQ32: 1.45 | BR32: 6.96 | BS32: 0 | BT32: =SUM(RC[-4]:RC[-1]) -> 8.41 | BU32: 0 | BV32: 9.19 | BW32: 0 | BX32: 0 | BY32: =SUM(RC[-4]:RC[-1]) -> 9.19 | BZ32: 0 | CA32: 34 | CB32: 23.495000000000001 | CC32: 0 | CD32: =SUM(RC[-4]:RC[-1]) -> 57.495000000000005 | CE32: 0 | CF32: 1.669 | CG32: 0 | CH32: 0 | CI32: =SUM(RC[-4]:RC[-1]) -> 1.669 | CJ32: 0 | CK32: 1.54 | CL32: 0 | CM32: 0 | CN32: =SUM(RC[-4]:RC[-1]) -> 1.54 | CO32: 0 | CP32: 1.6990000000000001 | CQ32: 0 | CR32: 0 | CS32: =SUM(RC[-4]:RC[-1]) -> 1.6990000000000001 | CT32: 0 | CU32: 4.51 | CV32: 0 | CW32: 0 | CX32: =SUM(RC[-4]:RC[-1]) -> 4.51 | CY32: 0 | CZ32: 2.57 | DA32: 0 | DB32: 0 | DC32: =SUM(RC[-4]:RC[-1]) -> 2.57 | DD32: 0 | DE32: 0.28999999999999998 | DF32: 0 | DG32: 0 | DH32: =SUM(RC[-4]:RC[-1]) -> 0.28999999999999998 | DI32: 0 | DJ32: 2.68 | DK32: 1E-3 | DL32: 0 | DM32: =SUM(RC[-4]:RC[-1]) -> 2.681 | DN32: 0 | DO32: 4.29 | DP32: 49.26 | DQ32: 0 | DR32: =SUM(RC[-4]:RC[-1]) -> 53.55 | DS32: 0 | DT32: 22.35 | DU32: 0 | DV32: 0 | DW32: =SUM(RC[-4]:RC[-1]) -> 22.35 | DX32: 0 | DY32: 1.1299999999999999 | DZ32: 0 | EA32: 0 | EB32: =SUM(RC[-4]:RC[-1]) -> 1.1299999999999999 | EC32: 0 | ED32: 0 | EE32: 3.0000000000000001E-3 | EF32: 0 | EG32: =SUM(RC[-4]:RC[-1]) -> 3.0000000000000001E-3 | EH32: 0 | EI32: 2.14 | EJ32: 0 | EK32: 0 | EL32: =SUM(RC[-4]:RC[-1]) -> 2.14 | EM32: 0 | EN32: 25.59 | EO32: 32.450000000000003 | EP32: 0 | EQ32: =SUM(RC[-4]:RC[-1]) -> 58.040000000000006 | ER32: 0 | ES32: 2.93 | ET32: 0 | EU32: 0 | EV32: =SUM(RC[-4]:RC[-1]) -> 2.93 | EW32: 0 | EX32: 47.43 | EY32: 0.13200000000000001 | EZ32: 0 | FA32: =SUM(RC[-4]:RC[-1]) -> 47.561999999999998 | FB32: 0 | FC32: 13.6 | FD32: 0 | FE32: 0 | FF32: =SUM(RC[-4]:RC[-1]) -> 13.6 | FG32: 0 | FH32: 6.06 | FI32: 33.659999999999997 | FJ32: 0 | FK32: =SUM(RC[-4]:RC[-1]) -> 39.72 | FL32: 0 | FM32: 8.8699999999999992 | FN32: 0 | FO32: 0 | FP32: =SUM(RC[-4]:RC[-1]) -> 8.8699999999999992 | FQ32: 0 | FR32: 16.899999999999999 | FS32: 5.96 | FT32: 0 | FU32: =SUM(RC[-4]:RC[-1]) -> 22.86 | FV32: 0 | FW32: 4.8600000000000003 | FX32: 7.02 | FY32: 0 | FZ32: =SUM(RC[-4]:RC[-1]) -> 11.879999999999999 | GA32: 0 | GB32: 12.199 | GC32: 0 | GD32: 0 | GE32: =SUM(RC[-4]:RC[-1]) -> 12.199 | GF32: 0 | GG32: 1.24 | GH32: 0 | GI32: 0 | GJ32: =SUM(RC[-4]:RC[-1]) -> 1.24 | GK32: 0 | GL32: 5.01 | GM32: 0 | GN32: 0 | GO32: =SUM(RC[-4]:RC[-1]) -> 5.01 | GP32: 0 | GQ32: 2.25 | GR32: 0 | GS32: 0 | GT32: =SUM(RC[-4]:RC[-1]) -> 2.25 | GU32: 0 | GV32: 3.29 | GW32: 0 | GX32: 0 | GY32: =SUM(RC[-4]:RC[-1]) -> 3.29 | GZ32: 0 | HA32: 30.77 | HB32: 0 | HC32: 0 | HD32: =SUM(RC[-4]:RC[-1]) -> 30.77 | HE32: 0 | HF32: 5.07 | HG32: 0.49 | HH32: 0 | HI32: =SUM(RC[-4]:RC[-1]) -> 5.5600000000000005 | HJ32: 0 | HK32: 16.13 | HL32: 112.29 | HM32: 0 | HN32: =SUM(RC[-4]:RC[-1]) -> 128.42000000000002 | HO32: 0 | HP32: 4.93 | HQ32: 0.75 | HR32: 0 | HS32: =SUM(RC[-4]:RC[-1]) -> 5.68 | HT32: 0 | HU32: 7.03 | HV32: 0 | HW32: 0 | HX32: =SUM(RC[-4]:RC[-1]) -> 7.03 | HY32: 0 | HZ32: 5.43 | IA32: 104.11 | IB32: 0 | IC32: =SUM(RC[-4]:RC[-1]) -> 109.53999999999999 | ID32: 0 | IE32: 1.06 | IF32: 0 | IG32: 0 | IH32: =SUM(RC[-4]:RC[-1]) -> 1.06 | II32: 0 | IJ32: 0.67 | IK32: 0 | IL32: 0 | IM32: =SUM(RC[-4]:RC[-1]) -> 0.67
A33: DIBUTYL PHTH | B33: =RC[8]+RC[13]+RC[18]+RC[23]+RC[28]+RC[33]+RC[38]+RC[43]+RC[48]+RC[53]+RC[58]+RC[63]+RC[68]+RC[73]+RC[78]+RC[83]+RC[88]+RC[93]+RC[98]+RC[103]+RC[108]+RC[113]+RC[118]+RC[123]+RC[128]+RC[133]+RC[138]+RC[143]+RC[148]+RC[153]+RC[158]+RC[163]+RC[168]+RC[173]+RC[178]+RC[183]+RC[188]+RC[193]+RC[198]+RC[203]+RC[208]+RC[213]+RC[218]+RC[223]+RC[228]+RC[233]+RC[238]+RC[243]+Sheet2!RC[2]+Sheet2!RC[7]+Sheet2!RC[12]+Sheet2!RC[17]+Sheet2!RC[22]+Sheet2!RC[27]+Sheet2!RC[32]+Sheet2!RC[37]+Sheet2!RC[42]+Sheet2!RC[47]+Sheet2!RC[57]+Sheet2!RC[52]+Sheet2!RC[62]+Sheet2!RC[67] -> 27949.445800000001 | C33: =RC[6]+RC[11]+RC[16]+RC[21]+RC[26]+RC[31]+RC[36]+RC[41]+RC[46]+RC[51]+RC[56]+RC[61]+RC[66]+RC[71]+RC[76]+RC[81]+RC[86]+RC[91]+RC[96]+RC[101]+RC[106]+RC[111]+RC[116]+RC[121]+RC[126]+RC[131]+RC[136]+RC[141]+RC[146]+RC[151]+RC[156]+RC[161]+RC[166]+RC[171]+RC[176]+RC[181]+RC[186]+RC[191]+RC[196]+RC[201]+RC[206]+RC[211]+RC[216]+RC[221]+RC[226]+RC[231]+RC[236]+RC[241]+Sheet2!RC+Sheet2!RC[5]+Sheet2!RC[10]+Sheet2!RC[15]+Sheet2!RC[20]+Sheet2!RC[25]+Sheet2!RC[30]+Sheet2!RC[35]+Sheet2!RC[40]+Sheet2!RC[45]+Sheet2!RC[50]+Sheet2!RC[55]+Sheet2!RC[60]+Sheet2!RC[65] -> 1450014.4154999999 | D33: =RC[4]+RC[9]+RC[14]+RC[19]+RC[24]+RC[29]+RC[34]+RC[39]+RC[44]+RC[49]+RC[54]+RC[59]+RC[64]+RC[69]+RC[74]+RC[79]+RC[84]+RC[89]+RC[94]+RC[99]+RC[104]+RC[109]+RC[114]+RC[119]+RC[124]+RC[129]+RC[134]+RC[139]+RC[144]+RC[149]+RC[154]+RC[159]+RC[164]+RC[169]+RC[174]+RC[179]+RC[184]+RC[189]+RC[194]+RC[199]+RC[204]+RC[209]+RC[214]+RC[219]+RC[224]+RC[229]+RC[234]+RC[239]+Sheet2!RC[3]+Sheet2!RC[-2]+Sheet2!RC[8]+Sheet2!RC[13]+Sheet2!RC[18]+Sheet2!RC[23]+Sheet2!RC[28]+Sheet2!RC[33]+Sheet2!RC[38]+Sheet2!RC[43]+Sheet2!RC[48]+Sheet2!RC[53]+Sheet2!RC[58]+Sheet2!RC[63] -> 0 | E33: =RC[6]+RC[11]+RC[16]+RC[21]+RC[26]+RC[31]+RC[36]+RC[41]+RC[46]+RC[51]+RC[56]+RC[61]+RC[66]+RC[71]+RC[76]+RC[81]+RC[86]+RC[91]+RC[96]+RC[101]+RC[106]+RC[111]+RC[116]+RC[121]+RC[126]+RC[131]+RC[136]+RC[141]+RC[146]+RC[151]+RC[156]+RC[161]+RC[166]+RC[171]+RC[176]+RC[181]+RC[186]+RC[191]+RC[196]+RC[201]+RC[206]+RC[211]+RC[216]+RC[221]+RC[226]+RC[231]+RC[236]+RC[241]+Sheet2!RC+Sheet2!RC[5]+Sheet2!RC[10]+Sheet2!RC[15]+Sheet2!RC[20]+Sheet2!RC[25]+Sheet2!RC[30]+Sheet2!RC[35]+Sheet2!RC[40]+Sheet2!RC[45]+Sheet2!RC[50]+Sheet2!RC[55]+Sheet2!RC[60]+Sheet2!RC[65] -> 0 | F33: =SUM(RC[-4]:RC[-1]) -> 1477963.8613 | G33: =Sheet1!RC[5]+Sheet1!RC[10]+Sheet1!RC[15]+Sheet1!RC[20]+Sheet1!RC[25]+Sheet1!RC[30]+Sheet1!RC[35]+Sheet1!RC[40]+Sheet1!RC[45]+Sheet1!RC[50]+Sheet1!RC[55]+Sheet1!RC[60]+Sheet1!RC[65]+Sheet1!RC[70]+Sheet1!RC[75]+Sheet1!RC[80]+Sheet1!RC[85]+Sheet1!RC[90]+Sheet1!RC[95]+Sheet1!RC[100]+Sheet1!RC[105]+Sheet1!RC[110]+Sheet1!RC[115]+Sheet1!RC[120]+Sheet1!RC[125]+Sheet1!RC[130]+Sheet1!RC[135]+Sheet1!RC[140]+Sheet1!RC[145]+Sheet1!RC[150]+Sheet1!RC[155]+Sheet1!RC[160]+Sheet1!RC[165]+Sheet1!RC[170]+Sheet1!RC[175]+Sheet1!RC[180]+Sheet1!RC[185]+Sheet1!RC[190]+Sheet1!RC[195]+Sheet1!RC[200]+Sheet1!RC[205]+Sheet1!RC[210]+Sheet1!RC[215]+Sheet1!RC[220]+Sheet1!RC[225]+Sheet1!RC[230]+Sheet1!RC[235]+Sheet1!RC[240]+Sheet2!RC[-1]+Sheet2!RC[4]+Sheet2!RC[9]+Sheet2!RC[14]+Sheet2!RC[19]+Sheet2!RC[24]+Sheet2!RC[29]+Sheet2!RC[34]+Sheet2!RC[39]+Sheet2!RC[44]+Sheet2!RC[49]+Sheet2!RC[54]+Sheet2!RC[59]+Sheet2!RC[64] -> 1477963.8613 | H33: 0 | I33: 37985.25 | J33: 0.5 | K33: 0 | L33: =SUM(RC[-4]:RC[-1]) -> 37985.75 | M33: 0 | N33: 6576.1265000000003 | O33: 0 | P33: 0 | Q33: =SUM(RC[-4]:RC[-1]) -> 6576.1265000000003 | R33: 0 | S33: 62286.35 | T33: 0 | U33: 0 | V33: =SUM(RC[-4]:RC[-1]) -> 62286.35 | W33: 0 | X33: 2538.34 | Y33: 95.504000000000005 | Z33: 0 | AA33: =SUM(RC[-4]:RC[-1]) -> 2633.8440000000001 | AB33: 0 | AC33: 10989 | AD33: 0 | AE33: 0 | AF33: =SUM(RC[-4]:RC[-1]) -> 10989 | AG33: 0 | AH33: 10628.23 | AI33: 0 | AJ33: 0 | AK33: =SUM(RC[-4]:RC[-1]) -> 10628.23 | AL33: 0 | AM33: 17877.57 | AN33: 74.16 | AO33: 0 | AP33: =SUM(RC[-4]:RC[-1]) -> 17951.73 | AQ33: 0 | AR33: 11933.62 | AS33: 0 | AT33: 0 | AU33: =SUM(RC[-4]:RC[-1]) -> 11933.62 | AV33: 0 | AW33: 6595.76 | AX33: 1.5 | AY33: 0 | AZ33: =SUM(RC[-4]:RC[-1]) -> 6597.26 | BA33: 0 | BB33: 10370.540000000001 | BC33: 148 | BD33: 0 | BE33: =SUM(RC[-4]:RC[-1]) -> 10518.54 | BF33: 0 | BG33: 8195.5400000000009 | BH33: 0.65 | BI33: 0 | BJ33: =SUM(RC[-4]:RC[-1]) -> 8196.19 | BK33: 0 | BL33: 6244.8 | BM33: 0.51 | BN33: 0 | BO33: =SUM(RC[-4]:RC[-1]) -> 6245.31 | BP33: 0 | BQ33: 6030.94 | BR33: 0 | BS33: 0 | BT33: =SUM(RC[-4]:RC[-1]) -> 6030.94 | BU33: 0 | BV33: 34893.279999999999 | BW33: 6.0000000000000001E-3 | BX33: 0 | BY33: =SUM(RC[-4]:RC[-1]) -> 34893.286 | BZ33: 0 | CA33: 120452.01 | CB33: 194.17 | CC33: 0 | CD33: =SUM(RC[-4]:RC[-1]) -> 120646.18 | CE33: 0 | CF33: 4879.05 | CG33: 0 | CH33: 0 | CI33: =SUM(RC[-4]:RC[-1]) -> 4879.05 | CJ33: 0 | CK33: 6310.49 | CL33: 0 | CM33: 0 | CN33: =SUM(RC[-4]:RC[-1]) -> 6310.49 | CO33: 0 | CP33: 6875.05 | CQ33: 0 | CR33: 0 | CS33: =SUM(RC[-4]:RC[-1]) -> 6875.05 | CT33: 0 | CU33: 7866.03 | CV33: 0 | CW33: 0 | CX33: =SUM(RC[-4]:RC[-1]) -> 7866.03 | CY33: 0 | CZ33: 6289.2960000000003 | DA33: 0 | DB33: 0 | DC33: =SUM(RC[-4]:RC[-1]) -> 6289.2960000000003 | DD33: 0 | DE33: 675.13 | DF33: 0 | DG33: 0 | DH33: =SUM(RC[-4]:RC[-1]) -> 675.13 | DI33: 0 | DJ33: 8241.32 | DK33: 743 | DL33: 0 | DM33: =SUM(RC[-4]:RC[-1]) -> 8984.32 | DN33: 0 | DO33: 14298.8 | DP33: 0 | DQ33: 0 | DR33: =SUM(RC[-4]:RC[-1]) -> 14298.8 | DS33: 0 | DT33: 118318 | DU33: 1.6 | DV33: 0 | DW33: =SUM(RC[-4]:RC[-1]) -> 118319.6 | DX33: 0 | DY33: 3549.85 | DZ33: 27.5 | EA33: 0 | EB33: =SUM(RC[-4]:RC[-1]) -> 3577.35 | EC33: 0 | ED33: 8566.14 | EE33: 0 | EF33: 0 | EG33: =SUM(RC[-4]:RC[-1]) -> 8566.14 | EH33: 0 | EI33: 9252.4699999999993 | EJ33: 0 | EK33: 0 | EL33: =SUM(RC[-4]:RC[-1]) -> 9252.4699999999993 | EM33: 0 | EN33: 92674.17 | EO33: 5638.6 | EP33: 0 | EQ33: =SUM(RC[-4]:RC[-1]) -> 98312.77 | ER33: 0 | ES33: 6552.1 | ET33: 1.28 | EU33: 0 | EV33: =SUM(RC[-4]:RC[-1]) -> 6553.38 | EW33: 0 | EX33: 68074.133000000002 | EY33: 6.3879999999999999 | EZ33: 0 | FA33: =SUM(RC[-4]:RC[-1]) -> 68080.521000000008 | FB33: 0 | FC33: 80946.98 | FD33: 0 | FE33: 0 | FF33: =SUM(RC[-4]:RC[-1]) -> 80946.98 | FG33: 0 | FH33: 28119.4 | FI33: 12.55 | FJ33: 0 | FK33: =SUM(RC[-4]:RC[-1]) -> 28131.95 | FL33: 0 | FM33: 29882.06 | FN33: 107.23 | FO33: 0 | FP33: =SUM(RC[-4]:RC[-1]) -> 29989.29 | FQ33: 0 | FR33: 59346.18 | FS33: 874.75 | FT33: 0 | FU33: =SUM(RC[-4]:RC[-1]) -> 60220.93 | FV33: 0 | FW33: 12981.1 | FX33: 4.0000000000000002E-4 | FY33: 0 | FZ33: =SUM(RC[-4]:RC[-1]) -> 12981.100400000001 | GA33: 0 | GB33: 30304.28 | GC33: 1.72 | GD33: 0 | GE33: =SUM(RC[-4]:RC[-1]) -> 30306 | GF33: 0 | GG33: 5856.63 | GH33: 0 | GI33: 0 | GJ33: =SUM(RC[-4]:RC[-1]) -> 5856.63 | GK33: 0 | GL33: 16114.1 | GM33: 1.9 | GN33: 0 | GO33: =SUM(RC[-4]:RC[-1]) -> 16116 | GP33: 0 | GQ33: 7885.55 | GR33: 0 | GS33: 0 | GT33: =SUM(RC[-4]:RC[-1]) -> 7885.55 | GU33: 0 | GV33: 12337.6 | GW33: 0 | GX33: 0 | GY33: =SUM(RC[-4]:RC[-1]) -> 12337.6 | GZ33: 0 | HA33: 104357.1 | HB33: 12 | HC33: 0 | HD33: =SUM(RC[-4]:RC[-1]) -> 104369.1 | HE33: 0 | HF33: 19700.5 | HG33: 0.74 | HH33: 0 | HI33: =SUM(RC[-4]:RC[-1]) -> 19701.240000000002 | HJ33: 0 | HK33: 21557.4 | HL33: 0.3 | HM33: 0 | HN33: =SUM(RC[-4]:RC[-1]) -> 21557.7 | HO33: 0 | HP33: 14815 | HQ33: 0 | HR33: 0 | HS33: =SUM(RC[-4]:RC[-1]) -> 14815 | HT33: 0 | HU33: 25982 | HV33: 16102.7 | HW33: 0 | HX33: =SUM(RC[-4]:RC[-1]) -> 42084.7 | HY33: 0 | HZ33: 18715.28 | IA33: 750.85 | IB33: 0 | IC33: =SUM(RC[-4]:RC[-1]) -> 19466.129999999997 | ID33: 0 | IE33: 4169.18 | IF33: 0 | IG33: 0 | IH33: =SUM(RC[-4]:RC[-1]) -> 4169.18 | II33: 0 | IJ33: 2501.38 | IK33: 0 | IL33: 0 | IM33: =SUM(RC[-4]:RC[-1]) -> 2501.38
A34: DICHLOROETH12 | B34: =RC[8]+RC[13]+RC[18]+RC[23]+RC[28]+RC[33]+RC[38]+RC[43]+RC[48]+RC[53]+RC[58]+RC[63]+RC[68]+RC[73]+RC[78]+RC[83]+RC[88]+RC[93]+RC[98]+RC[103]+RC[108]+RC[113]+RC[118]+RC[123]+RC[128]+RC[133]+RC[138]+RC[143]+RC[148]+RC[153]+RC[158]+RC[163]+RC[168]+RC[173]+RC[178]+RC[183]+RC[188]+RC[193]+RC[198]+RC[203]+RC[208]+RC[213]+RC[218]+RC[223]+RC[228]+RC[233]+RC[238]+RC[243]+Sheet2!RC[2]+Sheet2!RC[7]+Sheet2!RC[12]+Sheet2!RC[17]+Sheet2!RC[22]+Sheet2!RC[27]+Sheet2!RC[32]+Sheet2!RC[37]+Sheet2!RC[42]+Sheet2!RC[47]+Sheet2!RC[57]+Sheet2!RC[52]+Sheet2!RC[62]+Sheet2!RC[67] -> 20138.261999999999 | C34: =RC[6]+RC[11]+RC[16]+RC[21]+RC[26]+RC[31]+RC[36]+RC[41]+RC[46]+RC[51]+RC[56]+RC[61]+RC[66]+RC[71]+RC[76]+RC[81]+RC[86]+RC[91]+RC[96]+RC[101]+RC[106]+RC[111]+RC[116]+RC[121]+RC[126]+RC[131]+RC[136]+RC[141]+RC[146]+RC[151]+RC[156]+RC[161]+RC[166]+RC[171]+RC[176]+RC[181]+RC[186]+RC[191]+RC[196]+RC[201]+RC[206]+RC[211]+RC[216]+RC[221]+RC[226]+RC[231]+RC[236]+RC[241]+Sheet2!RC+Sheet2!RC[5]+Sheet2!RC[10]+Sheet2!RC[15]+Sheet2!RC[20]+Sheet2!RC[25]+Sheet2!RC[30]+Sheet2!RC[35]+Sheet2!RC[40]+Sheet2!RC[45]+Sheet2!RC[50]+Sheet2!RC[55]+Sheet2!RC[60]+Sheet2!RC[65] -> 7562.2758899999999 | D34: =RC[4]+RC[9]+RC[14]+RC[19]+RC[24]+RC[29]+RC[34]+RC[39]+RC[44]+RC[49]+RC[54]+RC[59]+RC[64]+RC[69]+RC[74]+RC[79]+RC[84]+RC[89]+RC[94]+RC[99]+RC[104]+RC[109]+RC[114]+RC[119]+RC[124]+RC[129]+RC[134]+RC[139]+RC[144]+RC[149]+RC[154]+RC[159]+RC[164]+RC[169]+RC[174]+RC[179]+RC[184]+RC[189]+RC[194]+RC[199]+RC[204]+RC[209]+RC[214]+RC[219]+RC[224]+RC[229]+RC[234]+RC[239]+Sheet2!RC[3]+Sheet2!RC[-2]+Sheet2!RC[8]+Sheet2!RC[13]+Sheet2!RC[18]+Sheet2!RC[23]+Sheet2!RC[28]+Sheet2!RC[33]+Sheet2!RC[38]+Sheet2!RC[43]+Sheet2!RC[48]+Sheet2!RC[53]+Sheet2!RC[58]+Sheet2!RC[63] -> 0 | E34: =RC[6]+RC[11]+RC[16]+RC[21]+RC[26]+RC[31]+RC[36]+RC[41]+RC[46]+RC[51]+RC[56]+RC[61]+RC[66]+RC[71]+RC[76]+RC[81]+RC[86]+RC[91]+RC[96]+RC[101]+RC[106]+RC[111]+RC[116]+RC[121]+RC[126]+RC[131]+RC[136]+RC[141]+RC[146]+RC[151]+RC[156]+RC[161]+RC[166]+RC[171]+RC[176]+RC[181]+RC[186]+RC[191]+RC[196]+RC[201]+RC[206]+RC[211]+RC[216]+RC[221]+RC[226]+RC[231]+RC[236]+RC[241]+Sheet2!RC+Sheet2!RC[5]+Sheet2!RC[10]+Sheet2!RC[15]+Sheet2!RC[20]+Sheet2!RC[25]+Sheet2!RC[30]+Sheet2!RC[35]+Sheet2!RC[40]+Sheet2!RC[45]+Sheet2!RC[50]+Sheet2!RC[55]+Sheet2!RC[60]+Sheet2!RC[65] -> 0 | F34: =SUM(RC[-4]:RC[-1]) -> 27700.53789 | G34: =Sheet1!RC[5]+Sheet1!RC[10]+Sheet1!RC[15]+Sheet1!RC[20]+Sheet1!RC[25]+Sheet1!RC[30]+Sheet1!RC[35]+Sheet1!RC[40]+Sheet1!RC[45]+Sheet1!RC[50]+Sheet1!RC[55]+Sheet1!RC[60]+Sheet1!RC[65]+Sheet1!RC[70]+Sheet1!RC[75]+Sheet1!RC[80]+Sheet1!RC[85]+Sheet1!RC[90]+Sheet1!RC[95]+Sheet1!RC[100]+Sheet1!RC[105]+Sheet1!RC[110]+Sheet1!RC[115]+Sheet1!RC[120]+Sheet1!RC[125]+Sheet1!RC[130]+Sheet1!RC[135]+Sheet1!RC[140]+Sheet1!RC[145]+Sheet1!RC[150]+Sheet1!RC[155]+Sheet1!RC[160]+Sheet1!RC[165]+Sheet1!RC[170]+Sheet1!RC[175]+Sheet1!RC[180]+Sheet1!RC[185]+Sheet1!RC[190]+Sheet1!RC[195]+Sheet1!RC[200]+Sheet1!RC[205]+Sheet1!RC[210]+Sheet1!RC[215]+Sheet1!RC[220]+Sheet1!RC[225]+Sheet1!RC[230]+Sheet1!RC[235]+Sheet1!RC[240]+Sheet2!RC[-1]+Sheet2!RC[4]+Sheet2!RC[9]+Sheet2!RC[14]+Sheet2!RC[19]+Sheet2!RC[24]+Sheet2!RC[29]+Sheet2!RC[34]+Sheet2!RC[39]+Sheet2!RC[44]+Sheet2!RC[49]+Sheet2!RC[54]+Sheet2!RC[59]+Sheet2!RC[64] -> 27700.53789 | H34: 0 | I34: 178.93 | J34: 84.08 | K34: 0 | L34: =SUM(RC[-4]:RC[-1]) -> 263.01 | M34: 0 | N34: 27.649000000000001 | O34: 0 | P34: 0 | Q34: =SUM(RC[-4]:RC[-1]) -> 27.649000000000001 | R34: 0 | S34: 161.23999000000001 | T34: 0 | U34: 0 | V34: =SUM(RC[-4]:RC[-1]) -> 161.23999000000001 | W34: 0 | X34: 114.889 | Y34: 212.5 | Z34: 0 | AA34: =SUM(RC[-4]:RC[-1]) -> 327.38900000000001 | AB34: 0 | AC34: 38.299999999999997 | AD34: 0 | AE34: 0 | AF34: =SUM(RC[-4]:RC[-1]) -> 38.299999999999997 | AG34: 0 | AH34: 44.5 | AI34: 0 | AJ34: 0 | AK34: =SUM(RC[-4]:RC[-1]) -> 44.5 | AL34: 0 | AM34: 60.9 | AN34: 40.72 | AO34: 0 | AP34: =SUM(RC[-4]:RC[-1]) -> 101.62 | AQ34: 0 | AR34: 42.58 | AS34: 16.36 | AT34: 0 | AU34: =SUM(RC[-4]:RC[-1]) -> 58.94 | AV34: 0 | AW34: 25.61 | AX34: 252.43600000000001 | AY34: 0 | AZ34: =SUM(RC[-4]:RC[-1]) -> 278.04599999999999 | BA34: 0 | BB34: 46.45 | BC34: 181.99 | BD34: 0 | BE34: =SUM(RC[-4]:RC[-1]) -> 228.44 | BF34: 0 | BG34: 41.27 | BH34: 1.26 | BI34: 0 | BJ34: =SUM(RC[-4]:RC[-1]) -> 42.53 | BK34: 0 | BL34: 32.65 | BM34: 86.38 | BN34: 0 | BO34: =SUM(RC[-4]:RC[-1]) -> 119.03 | BP34: 0 | BQ34: 21.65 | BR34: 0 | BS34: 0 | BT34: =SUM(RC[-4]:RC[-1]) -> 21.65 | BU34: 0 | BV34: 133.08000000000001 | BW34: 1.008 | BX34: 0 | BY34: =SUM(RC[-4]:RC[-1]) -> 134.08800000000002 | BZ34: 0 | CA34: 482.36 | CB34: 316.10000000000002 | CC34: 0 | CD34: =SUM(RC[-4]:RC[-1]) -> 798.46 | CE34: 0 | CF34: 22.74 | CG34: 2081 | CH34: 0 | CI34: =SUM(RC[-4]:RC[-1]) -> 2103.7399999999998 | CJ34: 0 | CK34: 22.9 | CL34: 0 | CM34: 0 | CN34: =SUM(RC[-4]:RC[-1]) -> 22.9 | CO34: 0 | CP34: 25.279 | CQ34: 0 | CR34: 0 | CS34: =SUM(RC[-4]:RC[-1]) -> 25.279 | CT34: 0 | CU34: 55.19 | CV34: 0 | CW34: 0 | CX34: =SUM(RC[-4]:RC[-1]) -> 55.19 | CY34: 0 | CZ34: 33.75 | DA34: 0 | DB34: 0 | DC34: =SUM(RC[-4]:RC[-1]) -> 33.75 | DD34: 0 | DE34: 3.84 | DF34: 0 | DG34: 0 | DH34: =SUM(RC[-4]:RC[-1]) -> 3.84 | DI34: 0 | DJ34: 36.81 | DK34: 0 | DL34: 0 | DM34: =SUM(RC[-4]:RC[-1]) -> 36.81 | DN34: 0 | DO34: 60.18 | DP34: 23.6 | DQ34: 0 | DR34: =SUM(RC[-4]:RC[-1]) -> 83.78 | DS34: 0 | DT34: 230.07990000000001 | DU34: 18.41 | DV34: 0 | DW34: =SUM(RC[-4]:RC[-1]) -> 248.48990000000001 | DX34: 0 | DY34: 15.75 | DZ34: 0 | EA34: 0 | EB34: =SUM(RC[-4]:RC[-1]) -> 15.75 | EC34: 0 | ED34: 42.83 | EE34: 211.27 | EF34: 0 | EG34: =SUM(RC[-4]:RC[-1]) -> 254.10000000000002 | EH34: 0 | EI34: 32.44 | EJ34: 0 | EK34: 0 | EL34: =SUM(RC[-4]:RC[-1]) -> 32.44 | EM34: 0 | EN34: 365.27 | EO34: 1531.49 | EP34: 0 | EQ34: =SUM(RC[-4]:RC[-1]) -> 1896.76 | ER34: 0 | ES34: 37.4 | ET34: 216.06 | EU34: 0 | EV34: =SUM(RC[-4]:RC[-1]) -> 253.46 | EW34: 0 | EX34: 674.75 | EY34: 1073.241 | EZ34: 0 | FA34: =SUM(RC[-4]:RC[-1]) -> 1747.991 | FB34: 0 | FC34: 140.96 | FD34: 0 | FE34: 0 | FF34: =SUM(RC[-4]:RC[-1]) -> 140.96 | FG34: 0 | FH34: 93.41 | FI34: 2351.5700000000002 | FJ34: 0 | FK34: =SUM(RC[-4]:RC[-1]) -> 2444.98 | FL34: 0 | FM34: 124.44 | FN34: 66.03 | FO34: 0 | FP34: =SUM(RC[-4]:RC[-1]) -> 190.47 | FQ34: 0 | FR34: 239.57 | FS34: 127.63 | FT34: 0 | FU34: =SUM(RC[-4]:RC[-1]) -> 367.2 | FV34: 0 | FW34: 64.48 | FX34: 6.7000000000000004E-2 | FY34: 0 | FZ34: =SUM(RC[-4]:RC[-1]) -> 64.546999999999997 | GA34: 0 | GB34: 173.4 | GC34: 310.35000000000002 | GD34: 0 | GE34: =SUM(RC[-4]:RC[-1]) -> 483.75 | GF34: 0 | GG34: 19.34 | GH34: 0 | GI34: 0 | GJ34: =SUM(RC[-4]:RC[-1]) -> 19.34 | GK34: 0 | GL34: 0 | GM34: 319.2 | GN34: 0 | GO34: =SUM(RC[-4]:RC[-1]) -> 319.2 | GP34: 0 | GQ34: 31.89 | GR34: 0 | GS34: 0 | GT34: =SUM(RC[-4]:RC[-1]) -> 31.89 | GU34: 0 | GV34: 47.52 | GW34: 0 | GX34: 0 | GY34: =SUM(RC[-4]:RC[-1]) -> 47.52 | GZ34: 0 | HA34: 316.62 | HB34: 0 | HC34: 0 | HD34: =SUM(RC[-4]:RC[-1]) -> 316.62 | HE34: 0 | HF34: 74.11 | HG34: 169.2 | HH34: 0 | HI34: =SUM(RC[-4]:RC[-1]) -> 243.31 | HJ34: 0 | HK34: 1227.9000000000001 | HL34: 159.31 | HM34: 0 | HN34: =SUM(RC[-4]:RC[-1]) -> 1387.21 | HO34: 0 | HP34: 91.56 | HQ34: 0 | HR34: 0 | HS34: =SUM(RC[-4]:RC[-1]) -> 91.56 | HT34: 0 | HU34: 101.16 | HV34: 76.53 | HW34: 0 | HX34: =SUM(RC[-4]:RC[-1]) -> 177.69 | HY34: 0 | HZ34: 76.62 | IA34: 3352.45 | IB34: 0 | IC34: =SUM(RC[-4]:RC[-1]) -> 3429.0699999999997 | ID34: 0 | IE34: 15.76 | IF34: 0 | IG34: 0 | IH34: =SUM(RC[-4]:RC[-1]) -> 15.76 | II34: 0 | IJ34: 9.75 | IK34: 0 | IL34: 0 | IM34: =SUM(RC[-4]:RC[-1]) -> 9.75
A35: DIEYLHEX PHT | B35: =RC[8]+RC[13]+RC[18]+RC[23]+RC[28]+RC[33]+RC[38]+RC[43]+RC[48]+RC[53]+RC[58]+RC[63]+RC[68]+RC[73]+RC[78]+RC[83]+RC[88]+RC[93]+RC[98]+RC[103]+RC[108]+RC[113]+RC[118]+RC[123]+RC[128]+RC[133]+RC[138]+RC[143]+RC[148]+RC[153]+RC[158]+RC[163]+RC[168]+RC[173]+RC[178]+RC[183]+RC[188]+RC[193]+RC[198]+RC[203]+RC[208]+RC[213]+RC[218]+RC[223]+RC[228]+RC[233]+RC[238]+RC[243]+Sheet2!RC[2]+Sheet2!RC[7]+Sheet2!RC[12]+Sheet2!RC[17]+Sheet2!RC[22]+Sheet2!RC[27]+Sheet2!RC[32]+Sheet2!RC[37]+Sheet2!RC[42]+Sheet2!RC[47]+Sheet2!RC[57]+Sheet2!RC[52]+Sheet2!RC[62]+Sheet2!RC[67] -> 3928.29 | C35: =RC[6]+RC[11]+RC[16]+RC[21]+RC[26]+RC[31]+RC[36]+RC[41]+RC[46]+RC[51]+RC[56]+RC[61]+RC[66]+RC[71]+RC[76]+RC[81]+RC[86]+RC[91]+RC[96]+RC[101]+RC[106]+RC[111]+RC[116]+RC[121]+RC[126]+RC[131]+RC[136]+RC[141]+RC[146]+RC[151]+RC[156]+RC[161]+RC[166]+RC[171]+RC[176]+RC[181]+RC[186]+RC[191]+RC[196]+RC[201]+RC[206]+RC[211]+RC[216]+RC[221]+RC[226]+RC[231]+RC[236]+RC[241]+Sheet2!RC+Sheet2!RC[5]+Sheet2!RC[10]+Sheet2!RC[15]+Sheet2!RC[20]+Sheet2!RC[25]+Sheet2!RC[30]+Sheet2!RC[35]+Sheet2!RC[40]+Sheet2!RC[45]+Sheet2!RC[50]+Sheet2!RC[55]+Sheet2!RC[60]+Sheet2!RC[65] -> 0 | D35: =RC[4]+RC[9]+RC[14]+RC[19]+RC[24]+RC[29]+RC[34]+RC[39]+RC[44]+RC[49]+RC[54]+RC[59]+RC[64]+RC[69]+RC[74]+RC[79]+RC[84]+RC[89]+RC[94]+RC[99]+RC[104]+RC[109]+RC[114]+RC[119]+RC[124]+RC[129]+RC[134]+RC[139]+RC[144]+RC[149]+RC[154]+RC[159]+RC[164]+RC[169]+RC[174]+RC[179]+RC[184]+RC[189]+RC[194]+RC[199]+RC[204]+RC[209]+RC[214]+RC[219]+RC[224]+RC[229]+RC[234]+RC[239]+Sheet2!RC[3]+Sheet2!RC[-2]+Sheet2!RC[8]+Sheet2!RC[13]+Sheet2!RC[18]+Sheet2!RC[23]+Sheet2!RC[28]+Sheet2!RC[33]+Sheet2!RC[38]+Sheet2!RC[43]+Sheet2!RC[48]+Sheet2!RC[53]+Sheet2!RC[58]+Sheet2!RC[63] -> 0 | E35: =RC[6]+RC[11]+RC[16]+RC[21]+RC[26]+RC[31]+RC[36]+RC[41]+RC[46]+RC[51]+RC[56]+RC[61]+RC[66]+RC[71]+RC[76]+RC[81]+RC[86]+RC[91]+RC[96]+RC[101]+RC[106]+RC[111]+RC[116]+RC[121]+RC[126]+RC[131]+RC[136]+RC[141]+RC[146]+RC[151]+RC[156]+RC[161]+RC[166]+RC[171]+RC[176]+RC[181]+RC[186]+RC[191]+RC[196]+RC[201]+RC[206]+RC[211]+RC[216]+RC[221]+RC[226]+RC[231]+RC[236]+RC[241]+Sheet2!RC+Sheet2!RC[5]+Sheet2!RC[10]+Sheet2!RC[15]+Sheet2!RC[20]+Sheet2!RC[25]+Sheet2!RC[30]+Sheet2!RC[35]+Sheet2!RC[40]+Sheet2!RC[45]+Sheet2!RC[50]+Sheet2!RC[55]+Sheet2!RC[60]+Sheet2!RC[65] -> 0 | F35: =SUM(RC[-4]:RC[-1]) -> 3928.29 | G35: =Sheet1!RC[5]+Sheet1!RC[10]+Sheet1!RC[15]+Sheet1!RC[20]+Sheet1!RC[25]+Sheet1!RC[30]+Sheet1!RC[35]+Sheet1!RC[40]+Sheet1!RC[45]+Sheet1!RC[50]+Sheet1!RC[55]+Sheet1!RC[60]+Sheet1!RC[65]+Sheet1!RC[70]+Sheet1!RC[75]+Sheet1!RC[80]+Sheet1!RC[85]+Sheet1!RC[90]+Sheet1!RC[95]+Sheet1!RC[100]+Sheet1!RC[105]+Sheet1!RC[110]+Sheet1!RC[115]+Sheet1!RC[120]+Sheet1!RC[125]+Sheet1!RC[130]+Sheet1!RC[135]+Sheet1!RC[140]+Sheet1!RC[145]+Sheet1!RC[150]+Sheet1!RC[155]+Sheet1!RC[160]+Sheet1!RC[165]+Sheet1!RC[170]+Sheet1!RC[175]+Sheet1!RC[180]+Sheet1!RC[185]+Sheet1!RC[190]+Sheet1!RC[195]+Sheet1!RC[200]+Sheet1!RC[205]+Sheet1!RC[210]+Sheet1!RC[215]+Sheet1!RC[220]+Sheet1!RC[225]+Sheet1!RC[230]+Sheet1!RC[235]+Sheet1!RC[240]+Sheet2!RC[-1]+Sheet2!RC[4]+Sheet2!RC[9]+Sheet2!RC[14]+Sheet2!RC[19]+Sheet2!RC[24]+Sheet2!RC[29]+Sheet2!RC[34]+Sheet2!RC[39]+Sheet2!RC[44]+Sheet2!RC[49]+Sheet2!RC[54]+Sheet2!RC[59]+Sheet2!RC[64] -> 3928.29 | H35: 0 | I35: 0 | J35: 0 | K35: 0 | L35: =SUM(RC[-4]:RC[-1]) -> 0 | M35: 0 | N35: 0 | O35: 0 | P35: 0 | Q35: =SUM(RC[-4]:RC[-1]) -> 0 | R35: 0 | S35: 0 | T35: 0 | U35: 0 | V35: =SUM(RC[-4]:RC[-1]) -> 0 | W35: 0 | X35: 0 | Y35: 102.5 | Z35: 0 | AA35: =SUM(RC[-4]:RC[-1]) -> 102.5 | AB35: 0 | AC35: 0 | AD35: 0 | AE35: 0 | AF35: =SUM(RC[-4]:RC[-1]) -> 0 | AG35: 0 | AH35: 0 | AI35: 0 | AJ35: 0 | AK35: =SUM(RC[-4]:RC[-1]) -> 0 | AL35: 0 | AM35: 0 | AN35: 0 | AO35: 0 | AP35: =SUM(RC[-4]:RC[-1]) -> 0 | AQ35: 0 | AR35: 0 | AS35: 0 | AT35: 0 | AU35: =SUM(RC[-4]:RC[-1]) -> 0 | AV35: 0 | AW35: 0 | AX35: 10 | AY35: 0 | AZ35: =SUM(RC[-4]:RC[-1]) -> 10 | BA35: 0 | BB35: 0 | BC35: 0 | BD35: 0 | BE35: =SUM(RC[-4]:RC[-1]) -> 0 | BF35: 0 | BG35: 0 | BH35: 0 | BI35: 0 | BJ35: =SUM(RC[-4]:RC[-1]) -> 0 | BK35: 0 | BL35: 0 | BM35: 0 | BN35: 0 | BO35: =SUM(RC[-4]:RC[-1]) -> 0 | BP35: 0 | BQ35: 0 | BR35: 0 | BS35: 0 | BT35: =SUM(RC[-4]:RC[-1]) -> 0 | BU35: 0 | BV35: 0 | BW35: 600 | BX35: 0 | BY35: =SUM(RC[-4]:RC[-1]) -> 600 | BZ35: 0 | CA35: 0 | CB35: 146.44 | CC35: 0 | CD35: =SUM(RC[-4]:RC[-1]) -> 146.44 | CE35: 0 | CF35: 0 | CG35: 0 | CH35: 0 | CI35: =SUM(RC[-4]:RC[-1]) -> 0 | CJ35: 0 | CK35: 0 | CL35: 0 | CM35: 0 | CN35: =SUM(RC[-4]:RC[-1]) -> 0 | CO35: 0 | CP35: 0 | CQ35: 0 | CR35: 0 | CS35: =SUM(RC[-4]:RC[-1]) -> 0 | CT35: 0 | CU35: 0 | CV35: 0 | CW35: 0 | CX35: =SUM(RC[-4]:RC[-1]) -> 0 | CY35: 0 | CZ35: 0 | DA35: 0 | DB35: 0 | DC35: =SUM(RC[-4]:RC[-1]) -> 0 | DD35: 0 | DE35: 0 | DF35: 0 | DG35: 0 | DH35: =SUM(RC[-4]:RC[-1]) -> 0 | DI35: 0 | DJ35: 0 | DK35: 0 | DL35: 0 | DM35: =SUM(RC[-4]:RC[-1]) -> 0 | DN35: 0 | DO35: 0 | DP35: 0 | DQ35: 0 | DR35: =SUM(RC[-4]:RC[-1]) -> 0 | DS35: 0 | DT35: 0 | DU35: 0 | DV35: 0 | DW35: =SUM(RC[-4]:RC[-1]) -> 0 | DX35: 0 | DY35: 0 | DZ35: 0 | EA35: 0 | EB35: =SUM(RC[-4]:RC[-1]) -> 0 | EC35: 0 | ED35: 0 | EE35: 0 | EF35: 0 | EG35: =SUM(RC[-4]:RC[-1]) -> 0 | EH35: 0 | EI35: 0 | EJ35: 0 | EK35: 0 | EL35: =SUM(RC[-4]:RC[-1]) -> 0 | EM35: 0 | EN35: 0 | EO35: 10 | EP35: 0 | EQ35: =SUM(RC[-4]:RC[-1]) -> 10 | ER35: 0 | ES35: 0 | ET35: 0 | EU35: 0 | EV35: =SUM(RC[-4]:RC[-1]) -> 0 | EW35: 0 | EX35: 0 | EY35: 0 | EZ35: 0 | FA35: =SUM(RC[-4]:RC[-1]) -> 0 | FB35: 0 | FC35: 0 | FD35: 0 | FE35: 0 | FF35: =SUM(RC[-4]:RC[-1]) -> 0 | FG35: 0 | FH35: 0 | FI35: 0 | FJ35: 0 | FK35: =SUM(RC[-4]:RC[-1]) -> 0 | FL35: 0 | FM35: 0 | FN35: 0 | FO35: 0 | FP35: =SUM(RC[-4]:RC[-1]) -> 0 | FQ35: 0 | FR35: 0 | FS35: 0 | FT35: 0 | FU35: =SUM(RC[-4]:RC[-1]) -> 0 | FV35: 0 | FW35: 0 | FX35: 0 | FY35: 0 | FZ35: =SUM(RC[-4]:RC[-1]) -> 0 | GA35: 0 | GB35: 0 | GC35: 0 | GD35: 0 | GE35: =SUM(RC[-4]:RC[-1]) -> 0 | GF35: 0 | GG35: 0 | GH35: 832 | GI35: 0 | GJ35: =SUM(RC[-4]:RC[-1]) -> 832 | GK35: 0 | GL35: 0 | GM35: 0 | GN35: 0 | GO35: =SUM(RC[-4]:RC[-1]) -> 0 | GP35: 0 | GQ35: 0 | GR35: 0 | GS35: 0 | GT35: =SUM(RC[-4]:RC[-1]) -> 0 | GU35: 0 | GV35: 0 | GW35: 0 | GX35: 0 | GY35: =SUM(RC[-4]:RC[-1]) -> 0 | GZ35: 0 | HA35: 0 | HB35: 1957 | HC35: 0 | HD35: =SUM(RC[-4]:RC[-1]) -> 1957 | HE35: 0 | HF35: 0 | HG35: 0 | HH35: 0 | HI35: =SUM(RC[-4]:RC[-1]) -> 0 | HJ35: 0 | HK35: 0 | HL35: 0 | HM35: 0 | HN35: =SUM(RC[-4]:RC[-1]) -> 0 | HO35: 0 | HP35: 0 | HQ35: 0 | HR35: 0 | HS35: =SUM(RC[-4]:RC[-1]) -> 0 | HT35: 0 | HU35: 0 | HV35: 0 | HW35: 0 | HX35: =SUM(RC[-4]:RC[-1]) -> 0 | HY35: 0 | HZ35: 0 | IA35: 0 | IB35: 0 | IC35: =SUM(RC[-4]:RC[-1]) -> 0 | ID35: 0 | IE35: 0 | IF35: 0 | IG35: 0 | IH35: =SUM(RC[-4]:RC[-1]) -> 0 | II35: 0 | IJ35: 0 | IK35: 0 | IL35: 0 | IM35: =SUM(RC[-4]:RC[-1]) -> 0
A36: ETHYLBENZENE | B36: =RC[8]+RC[13]+RC[18]+RC[23]+RC[28]+RC[33]+RC[38]+RC[43]+RC[48]+RC[53]+RC[58]+RC[63]+RC[68]+RC[73]+RC[78]+RC[83]+RC[88]+RC[93]+RC[98]+RC[103]+RC[108]+RC[113]+RC[118]+RC[123]+RC[128]+RC[133]+RC[138]+RC[143]+RC[148]+RC[153]+RC[158]+RC[163]+RC[168]+RC[173]+RC[178]+RC[183]+RC[188]+RC[193]+RC[198]+RC[203]+RC[208]+RC[213]+RC[218]+RC[223]+RC[228]+RC[233]+RC[238]+RC[243]+Sheet2!RC[2]+Sheet2!RC[7]+Sheet2!RC[12]+Sheet2!RC[17]+Sheet2!RC[22]+Sheet2!RC[27]+Sheet2!RC[32]+Sheet2!RC[37]+Sheet2!RC[42]+Sheet2!RC[47]+Sheet2!RC[57]+Sheet2!RC[52]+Sheet2!RC[62]+Sheet2!RC[67] -> 144914.13400000002 | C36: =RC[6]+RC[11]+RC[16]+RC[21]+RC[26]+RC[31]+RC[36]+RC[41]+RC[46]+RC[51]+RC[56]+RC[61]+RC[66]+RC[71]+RC[76]+RC[81]+RC[86]+RC[91]+RC[96]+RC[101]+RC[106]+RC[111]+RC[116]+RC[121]+RC[126]+RC[131]+RC[136]+RC[141]+RC[146]+RC[151]+RC[156]+RC[161]+RC[166]+RC[171]+RC[176]+RC[181]+RC[186]+RC[191]+RC[196]+RC[201]+RC[206]+RC[211]+RC[216]+RC[221]+RC[226]+RC[231]+RC[236]+RC[241]+Sheet2!RC+Sheet2!RC[5]+Sheet2!RC[10]+Sheet2!RC[15]+Sheet2!RC[20]+Sheet2!RC[25]+Sheet2!RC[30]+Sheet2!RC[35]+Sheet2!RC[40]+Sheet2!RC[45]+Sheet2!RC[50]+Sheet2!RC[55]+Sheet2!RC[60]+Sheet2!RC[65] -> 2000421.5410000002 | D36: =RC[4]+RC[9]+RC[14]+RC[19]+RC[24]+RC[29]+RC[34]+RC[39]+RC[44]+RC[49]+RC[54]+RC[59]+RC[64]+RC[69]+RC[74]+RC[79]+RC[84]+RC[89]+RC[94]+RC[99]+RC[104]+RC[109]+RC[114]+RC[119]+RC[124]+RC[129]+RC[134]+RC[139]+RC[144]+RC[149]+RC[154]+RC[159]+RC[164]+RC[169]+RC[174]+RC[179]+RC[184]+RC[189]+RC[194]+RC[199]+RC[204]+RC[209]+RC[214]+RC[219]+RC[224]+RC[229]+RC[234]+RC[239]+Sheet2!RC[3]+Sheet2!RC[-2]+Sheet2!RC[8]+Sheet2!RC[13]+Sheet2!RC[18]+Sheet2!RC[23]+Sheet2!RC[28]+Sheet2!RC[33]+Sheet2!RC[38]+Sheet2!RC[43]+Sheet2!RC[48]+Sheet2!RC[53]+Sheet2!RC[58]+Sheet2!RC[63] -> 9001763 | E36: =RC[6]+RC[11]+RC[16]+RC[21]+RC[26]+RC[31]+RC[36]+RC[41]+RC[46]+RC[51]+RC[56]+RC[61]+RC[66]+RC[71]+RC[76]+RC[81]+RC[86]+RC[91]+RC[96]+RC[101]+RC[106]+RC[111]+RC[116]+RC[121]+RC[126]+RC[131]+RC[136]+RC[141]+RC[146]+RC[151]+RC[156]+RC[161]+RC[166]+RC[171]+RC[176]+RC[181]+RC[186]+RC[191]+RC[196]+RC[201]+RC[206]+RC[211]+RC[216]+RC[221]+RC[226]+RC[231]+RC[236]+RC[241]+Sheet2!RC+Sheet2!RC[5]+Sheet2!RC[10]+Sheet2!RC[15]+Sheet2!RC[20]+Sheet2!RC[25]+Sheet2!RC[30]+Sheet2!RC[35]+Sheet2!RC[40]+Sheet2!RC[45]+Sheet2!RC[50]+Sheet2!RC[55]+Sheet2!RC[60]+Sheet2!RC[65] -> 2392153.5319632641 | F36: =SUM(RC[-4]:RC[-1]) -> 13539252.206963265 | G36: =Sheet1!RC[5]+Sheet1!RC[10]+Sheet1!RC[15]+Sheet1!RC[20]+Sheet1!RC[25]+Sheet1!RC[30]+Sheet1!RC[35]+Sheet1!RC[40]+Sheet1!RC[45]+Sheet1!RC[50]+Sheet1!RC[55]+Sheet1!RC[60]+Sheet1!RC[65]+Sheet1!RC[70]+Sheet1!RC[75]+Sheet1!RC[80]+Sheet1!RC[85]+Sheet1!RC[90]+Sheet1!RC[95]+Sheet1!RC[100]+Sheet1!RC[105]+Sheet1!RC[110]+Sheet1!RC[115]+Sheet1!RC[120]+Sheet1!RC[125]+Sheet1!RC[130]+Sheet1!RC[135]+Sheet1!RC[140]+Sheet1!RC[145]+Sheet1!RC[150]+Sheet1!RC[155]+Sheet1!RC[160]+Sheet1!RC[165]+Sheet1!RC[170]+Sheet1!RC[175]+Sheet1!RC[180]+Sheet1!RC[185]+Sheet1!RC[190]+Sheet1!RC[195]+Sheet1!RC[200]+Sheet1!RC[205]+Sheet1!RC[210]+Sheet1!RC[215]+Sheet1!RC[220]+Sheet1!RC[225]+Sheet1!RC[230]+Sheet1!RC[235]+Sheet1!RC[240]+Sheet2!RC[-1]+Sheet2!RC[4]+Sheet2!RC[9]+Sheet2!RC[14]+Sheet2!RC[19]+Sheet2!RC[24]+Sheet2!RC[29]+Sheet2!RC[34]+Sheet2!RC[39]+Sheet2!RC[44]+Sheet2!RC[49]+Sheet2!RC[54]+Sheet2!RC[59]+Sheet2!RC[64] -> 13539252.206963262 | H36: 255585 | I36: 65234.96 | J36: 2519.77 | K36: 48353.709569602994 | L36: =SUM(RC[-4]:RC[-1]) -> 371693.43956960301 | M36: 32644 | N36: 3738.2 | O36: 3.01 | P36: 13413.816868619999 | Q36: =SUM(RC[-4]:RC[-1]) -> 49799.02686862 | R36: 260365 | S36: 51886.27 | T36: 4.0350000000000001 | U36: 0.48831057461600008 | V36: =SUM(RC[-4]:RC[-1]) -> 312255.79331057461 | W36: 157994 | X36: 14614.02 | Y36: 2410.38 | Z36: 27298.661348046993 | AA36: =SUM(RC[-4]:RC[-1]) -> 202317.06134804699 | AB36: 57424 | AC36: 6079.41 | AD36: 0.05 | AE36: 65559.684099833001 | AF36: =SUM(RC[-4]:RC[-1]) -> 129063.14409983301 | AG36: 52310 | AH36: 6038.5439999999999 | AI36: 199.76 | AJ36: 13784.583069042001 | AK36: =SUM(RC[-4]:RC[-1]) -> 72332.887069042001 | AL36: 92408 | AM36: 9862.3140000000003 | AN36: 1549.75 | AO36: 46148.504801194998 | AP36: =SUM(RC[-4]:RC[-1]) -> 149968.56880119501 | AQ36: 61323 | AR36: 6624.9 | AS36: 197.3 | AT36: 10237.424935409996 | AU36: =SUM(RC[-4]:RC[-1]) -> 78382.624935409985 | AV36: 33037 | AW36: 3703.2 | AX36: 90.94 | AY36: 17763.841374456995 | AZ36: =SUM(RC[-4]:RC[-1]) -> 54594.981374456998 | BA36: 54822 | BB36: 5960.49 | BC36: 42.09 | BD36: 21646.259645125996 | BE36: =SUM(RC[-4]:RC[-1]) -> 82470.839645125991 | BF36: 47187 | BG36: 6358.01 | BH36: 1020.67 | BI36: 16227.330177766007 | BJ36: =SUM(RC[-4]:RC[-1]) -> 70793.010177766002 | BK36: 41034 | BL36: 3688.43 | BM36: 379.66 | BN36: 17068.247468111 | BO36: =SUM(RC[-4]:RC[-1]) -> 62170.337468111 | BP36: 37034 | BQ36: 3349.25 | BR36: 11.48 | BS36: 25387.626175826001 | BT36: =SUM(RC[-4]:RC[-1]) -> 65782.356175826004 | BU36: 171879 | BV36: 23222.31 | BW36: 10.25 | BX36: 48790.947369154979 | BY36: =SUM(RC[-4]:RC[-1]) -> 243902.50736915498 | BZ36: 520567 | CA36: 70828.41 | CB36: 18100.400000000001 | CC36: 136645.39173724499 | CD36: =SUM(RC[-4]:RC[-1]) -> 746141.20173724508 | CE36: 31791 | CF36: 2821.46 | CG36: 1562.16 | CH36: 41671.35767695398 | CI36: =SUM(RC[-4]:RC[-1]) -> 77845.977676953975 | CJ36: 33345 | CK36: 3509.86 | CL36: 0 | CM36: 14846.056259910009 | CN36: =SUM(RC[-4]:RC[-1]) -> 51700.916259910009 | CO36: 30237 | CP36: 3832 | CQ36: 35 | CR36: 11494.210278706994 | CS36: =SUM(RC[-4]:RC[-1]) -> 45598.210278706996 | CT36: 67073 | CU36: 4946.51 | CV36: 0 | CW36: 10016.997425657002 | CX36: =SUM(RC[-4]:RC[-1]) -> 82036.507425656993 | CY36: 44999 | CZ36: 8641.2099999999991 | DA36: 0 | DB36: 11089.217909963001 | DC36: =SUM(RC[-4]:RC[-1]) -> 64729.427909963 | DD36: 8983 | DE36: 405.65 | DF36: 0 | DG36: 4934.2619484249972 | DH36: =SUM(RC[-4]:RC[-1]) -> 14322.911948424997 | DI36: 53520 | DJ36: 4733.8999999999996 | DK36: 642.65 | DL36: 21427.165564721981 | DM36: =SUM(RC[-4]:RC[-1]) -> 80323.715564721992 | DN36: 81751 | DO36: 8133.56 | DP36: 3228.97 | DQ36: 13583.571091595004 | DR36: =SUM(RC[-4]:RC[-1]) -> 106697.101091595 | DS36: 405185 | DT36: 128771.99 | DU36: 769.69 | DV36: 100069.76074124197 | DW36: =SUM(RC[-4]:RC[-1]) -> 634796.44074124191 | DX36: 18499 | DY36: 2035.14 | DZ36: 4848.5 | EA36: 12791.882048425996 | EB36: =SUM(RC[-4]:RC[-1]) -> 38174.522048425992 | EC36: 47394 | ED36: 5015.8900000000003 | EE36: 54.499000000000002 | EF36: 11120.766358831001 | EG36: =SUM(RC[-4]:RC[-1]) -> 63585.155358831005 | EH36: 49184 | EI36: 5121.1629999999996 | EJ36: 0 | EK36: 7155.446695003001 | EL36: =SUM(RC[-4]:RC[-1]) -> 61460.609695003004 | EM36: 509673 | EN36: 52185.87 | EO36: 6800.6 | EP36: 118460.21111221501 | EQ36: =SUM(RC[-4]:RC[-1]) -> 687119.68111221492 | ER36: 47610 | ES36: 3941.6 | ET36: 858 | EU36: 6820.5798505020011 | EV36: =SUM(RC[-4]:RC[-1]) -> 59230.179850501998 | EW36: 1014396 | EX36: 71662.58 | EY36: 5529.88 | EZ36: 218963.1962297842 | FA36: =SUM(RC[-4]:RC[-1]) -> 1310551.6562297842 | FB36: 322282 | FC36: 494455.79 | FD36: 68.510000000000005 | FE36: 2.7682517206699986 | FF36: =SUM(RC[-4]:RC[-1]) -> 816809.06825172075 | FG36: 103691 | FH36: 15479.65 | FI36: 1423.03 | FJ36: 32271.541340265001 | FK36: =SUM(RC[-4]:RC[-1]) -> 152865.22134026501 | FL36: 159931 | FM36: 16975.41 | FN36: 1314.91 | FO36: 36593.513460008988 | FP36: =SUM(RC[-4]:RC[-1]) -> 214814.83346000899 | FQ36: 310262 | FR36: 33542.160000000003 | FS36: 3417 | FT36: 71003.522142640024 | FU36: =SUM(RC[-4]:RC[-1]) -> 418224.68214264006 | FV36: 80897 | FW36: 7592.7 | FX36: 361.9 | FY36: 18210.820897808004 | FZ36: =SUM(RC[-4]:RC[-1]) -> 107062.420897808 | GA36: 216159 | GB36: 25023.86 | GC36: 5848.45 | GD36: 44157.832153149007 | GE36: =SUM(RC[-4]:RC[-1]) -> 291189.14215314901 | GF36: 23559 | GG36: 3216.3 | GH36: 0 | GI36: 5701.2301050439983 | GJ36: =SUM(RC[-4]:RC[-1]) -> 32476.530105043996 | GK36: 73569 | GL36: 9195.7000000000007 | GM36: 213.15 | GN36: 23113.501548740009 | GO36: =SUM(RC[-4]:RC[-1]) -> 106091.35154874 | GP36: 41352 | GQ36: 4455.24 | GR36: 0 | GS36: 18109.779230900996 | GT36: =SUM(RC[-4]:RC[-1]) -> 63917.019230900994 | GU36: 79744 | GV36: 6917.41 | GW36: 0 | GX36: 17155.556185385994 | GY36: =SUM(RC[-4]:RC[-1]) -> 103816.966185386 | GZ36: 519407 | HA36: 86030.6 | HB36: 772.14 | HC36: 116160.46182791202 | HD36: =SUM(RC[-4]:RC[-1]) -> 722370.20182791201 | HE36: 105865 | HF36: 30890.9 | HG36: 2445.7600000000002 | HH36: 23257.451221534993 | HI36: =SUM(RC[-4]:RC[-1]) -> 162459.11122153499 | HJ36: 160568 | HK36: 425030 | HL36: 5078.34 | HM36: 38168.709090128999 | HN36: =SUM(RC[-4]:RC[-1]) -> 628845.04909012897 | HO36: 153078 | HP36: 19709.97 | HQ36: 27.01 | HR36: 49560.521867205003 | HS36: =SUM(RC[-4]:RC[-1]) -> 222375.50186720502 | HT36: 160297 | HU36: 14593.84 | HV36: 4324.0600000000004 | HW36: 20584.010866141998 | HX36: =SUM(RC[-4]:RC[-1]) -> 199798.91086614199 | HY36: 86280 | HZ36: 10596.33 | IA36: 53094.75 | IB36: 32193.383478003991 | IC36: =SUM(RC[-4]:RC[-1]) -> 182164.46347800401 | ID36: 24052 | IE36: 2331.67 | IF36: 1.69 | IG36: 15740.254168819001 | IH36: =SUM(RC[-4]:RC[-1]) -> 42125.614168818996 | II36: 11194 | IJ36: 1405.36 | IK36: 0 | IL36: 3157.6247432109999 | IM36: =SUM(RC[-4]:RC[-1]) -> 15756.984743211
A37: ETHYLENE OXI | B37: =RC[8]+RC[13]+RC[18]+RC[23]+RC[28]+RC[33]+RC[38]+RC[43]+RC[48]+RC[53]+RC[58]+RC[63]+RC[68]+RC[73]+RC[78]+RC[83]+RC[88]+RC[93]+RC[98]+RC[103]+RC[108]+RC[113]+RC[118]+RC[123]+RC[128]+RC[133]+RC[138]+RC[143]+RC[148]+RC[153]+RC[158]+RC[163]+RC[168]+RC[173]+RC[178]+RC[183]+RC[188]+RC[193]+RC[198]+RC[203]+RC[208]+RC[213]+RC[218]+RC[223]+RC[228]+RC[233]+RC[238]+RC[243]+Sheet2!RC[2]+Sheet2!RC[7]+Sheet2!RC[12]+Sheet2!RC[17]+Sheet2!RC[22]+Sheet2!RC[27]+Sheet2!RC[32]+Sheet2!RC[37]+Sheet2!RC[42]+Sheet2!RC[47]+Sheet2!RC[57]+Sheet2!RC[52]+Sheet2!RC[62]+Sheet2!RC[67] -> 5517.2379999999994 | C37: =RC[6]+RC[11]+RC[16]+RC[21]+RC[26]+RC[31]+RC[36]+RC[41]+RC[46]+RC[51]+RC[56]+RC[61]+RC[66]+RC[71]+RC[76]+RC[81]+RC[86]+RC[91]+RC[96]+RC[101]+RC[106]+RC[111]+RC[116]+RC[121]+RC[126]+RC[131]+RC[136]+RC[141]+RC[146]+RC[151]+RC[156]+RC[161]+RC[166]+RC[171]+RC[176]+RC[181]+RC[186]+RC[191]+RC[196]+RC[201]+RC[206]+RC[211]+RC[216]+RC[221]+RC[226]+RC[231]+RC[236]+RC[241]+Sheet2!RC+Sheet2!RC[5]+Sheet2!RC[10]+Sheet2!RC[15]+Sheet2!RC[20]+Sheet2!RC[25]+Sheet2!RC[30]+Sheet2!RC[35]+Sheet2!RC[40]+Sheet2!RC[45]+Sheet2!RC[50]+Sheet2!RC[55]+Sheet2!RC[60]+Sheet2!RC[65] -> 391867.62790000002 | D37: =RC[4]+RC[9]+RC[14]+RC[19]+RC[24]+RC[29]+RC[34]+RC[39]+RC[44]+RC[49]+RC[54]+RC[59]+RC[64]+RC[69]+RC[74]+RC[79]+RC[84]+RC[89]+RC[94]+RC[99]+RC[104]+RC[109]+RC[114]+RC[119]+RC[124]+RC[129]+RC[134]+RC[139]+RC[144]+RC[149]+RC[154]+RC[159]+RC[164]+RC[169]+RC[174]+RC[179]+RC[184]+RC[189]+RC[194]+RC[199]+RC[204]+RC[209]+RC[214]+RC[219]+RC[224]+RC[229]+RC[234]+RC[239]+Sheet2!RC[3]+Sheet2!RC[-2]+Sheet2!RC[8]+Sheet2!RC[13]+Sheet2!RC[18]+Sheet2!RC[23]+Sheet2!RC[28]+Sheet2!RC[33]+Sheet2!RC[38]+Sheet2!RC[43]+Sheet2!RC[48]+Sheet2!RC[53]+Sheet2!RC[58]+Sheet2!RC[63] -> 0 | E37: =RC[6]+RC[11]+RC[16]+RC[21]+RC[26]+RC[31]+RC[36]+RC[41]+RC[46]+RC[51]+RC[56]+RC[61]+RC[66]+RC[71]+RC[76]+RC[81]+RC[86]+RC[91]+RC[96]+RC[101]+RC[106]+RC[111]+RC[116]+RC[121]+RC[126]+RC[131]+RC[136]+RC[141]+RC[146]+RC[151]+RC[156]+RC[161]+RC[166]+RC[171]+RC[176]+RC[181]+RC[186]+RC[191]+RC[196]+RC[201]+RC[206]+RC[211]+RC[216]+RC[221]+RC[226]+RC[231]+RC[236]+RC[241]+Sheet2!RC+Sheet2!RC[5]+Sheet2!RC[10]+Sheet2!RC[15]+Sheet2!RC[20]+Sheet2!RC[25]+Sheet2!RC[30]+Sheet2!RC[35]+Sheet2!RC[40]+Sheet2!RC[45]+Sheet2!RC[50]+Sheet2!RC[55]+Sheet2!RC[60]+Sheet2!RC[65] -> 0 | F37: =SUM(RC[-4]:RC[-1]) -> 397384.86590000003 | G37: =Sheet1!RC[5]+Sheet1!RC[10]+Sheet1!RC[15]+Sheet1!RC[20]+Sheet1!RC[25]+Sheet1!RC[30]+Sheet1!RC[35]+Sheet1!RC[40]+Sheet1!RC[45]+Sheet1!RC[50]+Sheet1!RC[55]+Sheet1!RC[60]+Sheet1!RC[65]+Sheet1!RC[70]+Sheet1!RC[75]+Sheet1!RC[80]+Sheet1!RC[85]+Sheet1!RC[90]+Sheet1!RC[95]+Sheet1!RC[100]+Sheet1!RC[105]+Sheet1!RC[110]+Sheet1!RC[115]+Sheet1!RC[120]+Sheet1!RC[125]+Sheet1!RC[130]+Sheet1!RC[135]+Sheet1!RC[140]+Sheet1!RC[145]+Sheet1!RC[150]+Sheet1!RC[155]+Sheet1!RC[160]+Sheet1!RC[165]+Sheet1!RC[170]+Sheet1!RC[175]+Sheet1!RC[180]+Sheet1!RC[185]+Sheet1!RC[190]+Sheet1!RC[195]+Sheet1!RC[200]+Sheet1!RC[205]+Sheet1!RC[210]+Sheet1!RC[215]+Sheet1!RC[220]+Sheet1!RC[225]+Sheet1!RC[230]+Sheet1!RC[235]+Sheet1!RC[240]+Sheet2!RC[-1]+Sheet2!RC[4]+Sheet2!RC[9]+Sheet2!RC[14]+Sheet2!RC[19]+Sheet2!RC[24]+Sheet2!RC[29]+Sheet2!RC[34]+Sheet2!RC[39]+Sheet2!RC[44]+Sheet2!RC[49]+Sheet2!RC[54]+Sheet2!RC[59]+Sheet2!RC[64] -> 397384.86590000021 | H37: 0 | I37: 6880 | J37: 2.5 | K37: 0 | L37: =SUM(RC[-4]:RC[-1]) -> 6882.5 | M37: 0 | N37: 900.41 | O37: 0 | P37: 0 | Q37: =SUM(RC[-4]:RC[-1]) -> 900.41 | R37: 0 | S37: 25263.94 | T37: 564 | U37: 0 | V37: =SUM(RC[-4]:RC[-1]) -> 25827.94 | W37: 0 | X37: 4033.43 | Y37: 7.0000000000000007E-2 | Z37: 0 | AA37: =SUM(RC[-4]:RC[-1]) -> 4033.5 | AB37: 0 | AC37: 1769.88 | AD37: 0 | AE37: 0 | AF37: =SUM(RC[-4]:RC[-1]) -> 1769.88 | AG37: 0 | AH37: 1546.93 | AI37: 0 | AJ37: 0 | AK37: =SUM(RC[-4]:RC[-1]) -> 1546.93 | AL37: 0 | AM37: 2995.4989999999998 | AN37: 17.260000000000002 | AO37: 0 | AP37: =SUM(RC[-4]:RC[-1]) -> 3012.759 | AQ37: 0 | AR37: 1995.08 | AS37: 0 | AT37: 0 | AU37: =SUM(RC[-4]:RC[-1]) -> 1995.08 | AV37: 0 | AW37: 870.26 | AX37: 7.51 | AY37: 0 | AZ37: =SUM(RC[-4]:RC[-1]) -> 877.77 | BA37: 0 | BB37: 1659.79 | BC37: 4.53 | BD37: 0 | BE37: =SUM(RC[-4]:RC[-1]) -> 1664.32 | BF37: 0 | BG37: 1297.69 | BH37: 0.03 | BI37: 0 | BJ37: =SUM(RC[-4]:RC[-1]) -> 1297.72 | BK37: 0 | BL37: 1051.4100000000001 | BM37: 2.65 | BN37: 0 | BO37: =SUM(RC[-4]:RC[-1]) -> 1054.0600000000002 | BP37: 0 | BQ37: 914.72 | BR37: 0 | BS37: 0 | BT37: =SUM(RC[-4]:RC[-1]) -> 914.72 | BU37: 0 | BV37: 5198.8999999999996 | BW37: 0.02 | BX37: 0 | BY37: =SUM(RC[-4]:RC[-1]) -> 5198.92 | BZ37: 0 | CA37: 20779.29 | CB37: 36.549999999999997 | CC37: 0 | CD37: =SUM(RC[-4]:RC[-1]) -> 20815.84 | CE37: 0 | CF37: 624.05999999999995 | CG37: 0 | CH37: 0 | CI37: =SUM(RC[-4]:RC[-1]) -> 624.05999999999995 | CJ37: 0 | CK37: 1044.5999999999999 | CL37: 0 | CM37: 0 | CN37: =SUM(RC[-4]:RC[-1]) -> 1044.5999999999999 | CO37: 0 | CP37: 1021.73 | CQ37: 0 | CR37: 0 | CS37: =SUM(RC[-4]:RC[-1]) -> 1021.73 | CT37: 0 | CU37: 1212.54 | CV37: 0 | CW37: 0 | CX37: =SUM(RC[-4]:RC[-1]) -> 1212.54 | CY37: 0 | CZ37: 730.04 | DA37: 0 | DB37: 0 | DC37: =SUM(RC[-4]:RC[-1]) -> 730.04 | DD37: 0 | DE37: 78 | DF37: 0 | DG37: 0 | DH37: =SUM(RC[-4]:RC[-1]) -> 78 | DI37: 0 | DJ37: 1137.04 | DK37: 0 | DL37: 0 | DM37: =SUM(RC[-4]:RC[-1]) -> 1137.04 | DN37: 0 | DO37: 2255.63 | DP37: 0 | DQ37: 0 | DR37: =SUM(RC[-4]:RC[-1]) -> 2255.63 | DS37: 0 | DT37: 48124.74 | DU37: 40.229999999999997 | DV37: 0 | DW37: =SUM(RC[-4]:RC[-1]) -> 48164.97 | DX37: 0 | DY37: 509.47 | DZ37: 0 | EA37: 0 | EB37: =SUM(RC[-4]:RC[-1]) -> 509.47 | EC37: 0 | ED37: 1124.22 | EE37: 5.8680000000000003 | EF37: 0 | EG37: =SUM(RC[-4]:RC[-1]) -> 1130.088 | EH37: 0 | EI37: 1328.37 | EJ37: 0 | EK37: 0 | EL37: =SUM(RC[-4]:RC[-1]) -> 1328.37 | EM37: 0 | EN37: 15258.95 | EO37: 46.75 | EP37: 0 | EQ37: =SUM(RC[-4]:RC[-1]) -> 15305.7 | ER37: 0 | ES37: 1155.6400000000001 | ET37: 6.43 | EU37: 0 | EV37: =SUM(RC[-4]:RC[-1]) -> 1162.0700000000002 | EW37: 0 | EX37: 28259.09 | EY37: 56.89 | EZ37: 0 | FA37: =SUM(RC[-4]:RC[-1]) -> 28315.98 | FB37: 0 | FC37: 49051.58 | FD37: 1358 | FE37: 0 | FF37: =SUM(RC[-4]:RC[-1]) -> 50409.58 | FG37: 0 | FH37: 4580.99 | FI37: 2246.52 | FJ37: 0 | FK37: =SUM(RC[-4]:RC[-1]) -> 6827.51 | FL37: 0 | FM37: 4675.1799000000001 | FN37: 1.96 | FO37: 0 | FP37: =SUM(RC[-4]:RC[-1]) -> 4677.1399000000001 | FQ37: 0 | FR37: 9711.18 | FS37: 3.79 | FT37: 0 | FU37: =SUM(RC[-4]:RC[-1]) -> 9714.9700000000012 | FV37: 0 | FW37: 2233 | FX37: 2E-3 | FY37: 0 | FZ37: =SUM(RC[-4]:RC[-1]) -> 2233.002 | GA37: 0 | GB37: 6689.799 | GC37: 162.19999999999999 | GD37: 0 | GE37: =SUM(RC[-4]:RC[-1]) -> 6851.9989999999998 | GF37: 0 | GG37: 807.91 | GH37: 0 | GI37: 0 | GJ37: =SUM(RC[-4]:RC[-1]) -> 807.91 | GK37: 0 | GL37: 2287.1999999999998 | GM37: 9.5 | GN37: 0 | GO37: =SUM(RC[-4]:RC[-1]) -> 2296.6999999999998 | GP37: 0 | GQ37: 1470.9 | GR37: 0 | GS37: 0 | GT37: =SUM(RC[-4]:RC[-1]) -> 1470.9 | GU37: 0 | GV37: 1727.99 | GW37: 0 | GX37: 0 | GY37: =SUM(RC[-4]:RC[-1]) -> 1727.99 | GZ37: 0 | HA37: 38555.699999999997 | HB37: 97.42 | HC37: 0 | HD37: =SUM(RC[-4]:RC[-1]) -> 38653.119999999995 | HE37: 0 | HF37: 3081.07 | HG37: 4.9400000000000004 | HH37: 0 | HI37: =SUM(RC[-4]:RC[-1]) -> 3086.01 | HJ37: 0 | HK37: 8199 | HL37: 1.53 | HM37: 0 | HN37: =SUM(RC[-4]:RC[-1]) -> 8200.5300000000007 | HO37: 0 | HP37: 5795.75 | HQ37: 2.04 | HR37: 0 | HS37: =SUM(RC[-4]:RC[-1]) -> 5797.79 | HT37: 0 | HU37: 3324.43 | HV37: 2.4 | HW37: 0 | HX37: =SUM(RC[-4]:RC[-1]) -> 3326.83 | HY37: 0 | HZ37: 3246.52 | IA37: 99.683999999999997 | IB37: 0 | IC37: =SUM(RC[-4]:RC[-1]) -> 3346.2040000000002 | ID37: 0 | IE37: 556.1 | IF37: 0 | IG37: 0 | IH37: =SUM(RC[-4]:RC[-1]) -> 556.1 | II37: 0 | IJ37: 373.33 | IK37: 0 | IL37: 0 | IM37: =SUM(RC[-4]:RC[-1]) -> 373.33
A38: FLUORANTHENE | B38: =RC[8]+RC[13]+RC[18]+RC[23]+RC[28]+RC[33]+RC[38]+RC[43]+RC[48]+RC[53]+RC[58]+RC[63]+RC[68]+RC[73]+RC[78]+RC[83]+RC[88]+RC[93]+RC[98]+RC[103]+RC[108]+RC[113]+RC[118]+RC[123]+RC[128]+RC[133]+RC[138]+RC[143]+RC[148]+RC[153]+RC[158]+RC[163]+RC[168]+RC[173]+RC[178]+RC[183]+RC[188]+RC[193]+RC[198]+RC[203]+RC[208]+RC[213]+RC[218]+RC[223]+RC[228]+RC[233]+RC[238]+RC[243]+Sheet2!RC[2]+Sheet2!RC[7]+Sheet2!RC[12]+Sheet2!RC[17]+Sheet2!RC[22]+Sheet2!RC[27]+Sheet2!RC[32]+Sheet2!RC[37]+Sheet2!RC[42]+Sheet2!RC[47]+Sheet2!RC[57]+Sheet2!RC[52]+Sheet2!RC[62]+Sheet2!RC[67] -> 1473.47 | C38: =RC[6]+RC[11]+RC[16]+RC[21]+RC[26]+RC[31]+RC[36]+RC[41]+RC[46]+RC[51]+RC[56]+RC[61]+RC[66]+RC[71]+RC[76]+RC[81]+RC[86]+RC[91]+RC[96]+RC[101]+RC[106]+RC[111]+RC[116]+RC[121]+RC[126]+RC[131]+RC[136]+RC[141]+RC[146]+RC[151]+RC[156]+RC[161]+RC[166]+RC[171]+RC[176]+RC[181]+RC[186]+RC[191]+RC[196]+RC[201]+RC[206]+RC[211]+RC[216]+RC[221]+RC[226]+RC[231]+RC[236]+RC[241]+Sheet2!RC+Sheet2!RC[5]+Sheet2!RC[10]+Sheet2!RC[15]+Sheet2!RC[20]+Sheet2!RC[25]+Sheet2!RC[30]+Sheet2!RC[35]+Sheet2!RC[40]+Sheet2!RC[45]+Sheet2!RC[50]+Sheet2!RC[55]+Sheet2!RC[60]+Sheet2!RC[65] -> 433.25589000000002 | D38: =RC[4]+RC[9]+RC[14]+RC[19]+RC[24]+RC[29]+RC[34]+RC[39]+RC[44]+RC[49]+RC[54]+RC[59]+RC[64]+RC[69]+RC[74]+RC[79]+RC[84]+RC[89]+RC[94]+RC[99]+RC[104]+RC[109]+RC[114]+RC[119]+RC[124]+RC[129]+RC[134]+RC[139]+RC[144]+RC[149]+RC[154]+RC[159]+RC[164]+RC[169]+RC[174]+RC[179]+RC[184]+RC[189]+RC[194]+RC[199]+RC[204]+RC[209]+RC[214]+RC[219]+RC[224]+RC[229]+RC[234]+RC[239]+Sheet2!RC[3]+Sheet2!RC[-2]+Sheet2!RC[8]+Sheet2!RC[13]+Sheet2!RC[18]+Sheet2!RC[23]+Sheet2!RC[28]+Sheet2!RC[33]+Sheet2!RC[38]+Sheet2!RC[43]+Sheet2!RC[48]+Sheet2!RC[53]+Sheet2!RC[58]+Sheet2!RC[63] -> 0 | E38: =RC[6]+RC[11]+RC[16]+RC[21]+RC[26]+RC[31]+RC[36]+RC[41]+RC[46]+RC[51]+RC[56]+RC[61]+RC[66]+RC[71]+RC[76]+RC[81]+RC[86]+RC[91]+RC[96]+RC[101]+RC[106]+RC[111]+RC[116]+RC[121]+RC[126]+RC[131]+RC[136]+RC[141]+RC[146]+RC[151]+RC[156]+RC[161]+RC[166]+RC[171]+RC[176]+RC[181]+RC[186]+RC[191]+RC[196]+RC[201]+RC[206]+RC[211]+RC[216]+RC[221]+RC[226]+RC[231]+RC[236]+RC[241]+Sheet2!RC+Sheet2!RC[5]+Sheet2!RC[10]+Sheet2!RC[15]+Sheet2!RC[20]+Sheet2!RC[25]+Sheet2!RC[30]+Sheet2!RC[35]+Sheet2!RC[40]+Sheet2!RC[45]+Sheet2!RC[50]+Sheet2!RC[55]+Sheet2!RC[60]+Sheet2!RC[65] -> 240854.000614666 | F38: =SUM(RC[-4]:RC[-1]) -> 242760.726504666 | G38: =Sheet1!RC[5]+Sheet1!RC[10]+Sheet1!RC[15]+Sheet1!RC[20]+Sheet1!RC[25]+Sheet1!RC[30]+Sheet1!RC[35]+Sheet1!RC[40]+Sheet1!RC[45]+Sheet1!RC[50]+Sheet1!RC[55]+Sheet1!RC[60]+Sheet1!RC[65]+Sheet1!RC[70]+Sheet1!RC[75]+Sheet1!RC[80]+Sheet1!RC[85]+Sheet1!RC[90]+Sheet1!RC[95]+Sheet1!RC[100]+Sheet1!RC[105]+Sheet1!RC[110]+Sheet1!RC[115]+Sheet1!RC[120]+Sheet1!RC[125]+Sheet1!RC[130]+Sheet1!RC[135]+Sheet1!RC[140]+Sheet1!RC[145]+Sheet1!RC[150]+Sheet1!RC[155]+Sheet1!RC[160]+Sheet1!RC[165]+Sheet1!RC[170]+Sheet1!RC[175]+Sheet1!RC[180]+Sheet1!RC[185]+Sheet1!RC[190]+Sheet1!RC[195]+Sheet1!RC[200]+Sheet1!RC[205]+Sheet1!RC[210]+Sheet1!RC[215]+Sheet1!RC[220]+Sheet1!RC[225]+Sheet1!RC[230]+Sheet1!RC[235]+Sheet1!RC[240]+Sheet2!RC[-1]+Sheet2!RC[4]+Sheet2!RC[9]+Sheet2!RC[14]+Sheet2!RC[19]+Sheet2!RC[24]+Sheet2!RC[29]+Sheet2!RC[34]+Sheet2!RC[39]+Sheet2!RC[44]+Sheet2!RC[49]+Sheet2!RC[54]+Sheet2!RC[59]+Sheet2!RC[64] -> 242760.72650466589 | H38: 0 | I38: 5.1790000000000003 | J38: 0 | K38: 4.608381434790001 | L38: =SUM(RC[-4]:RC[-1]) -> 9.7873814347900012 | M38: 0 | N38: 3.2989999999999999 | O38: 0 | P38: 1.0878119036299998 | Q38: =SUM(RC[-4]:RC[-1]) -> 4.38681190363 | R38: 0 | S38: 0 | T38: 0 | U38: 37368.328839016038 | V38: =SUM(RC[-4]:RC[-1]) -> 37368.328839016038 | W38: 0 | X38: 4.05 | Y38: 0 | Z38: 2.5190337561920004 | AA38: =SUM(RC[-4]:RC[-1]) -> 6.5690337561920007 | AB38: 0 | AC38: 14.57 | AD38: 0 | AE38: 4.9688465757099998 | AF38: =SUM(RC[-4]:RC[-1]) -> 19.53884657571 | AG38: 0 | AH38: 0 | AI38: 0 | AJ38: 1.3176688654239996 | AK38: =SUM(RC[-4]:RC[-1]) -> 1.3176688654239996 | AL38: 0 | AM38: 0 | AN38: 0 | AO38: 3.8042916910139999 | AP38: =SUM(RC[-4]:RC[-1]) -> 3.8042916910139999 | AQ38: 0 | AR38: 6.96 | AS38: 0 | AT38: 1.0330231490660002 | AU38: =SUM(RC[-4]:RC[-1]) -> 7.9930231490660004 | AV38: 0 | AW38: 6.67 | AX38: 0 | AY38: 1.4582987659300009 | AZ38: =SUM(RC[-4]:RC[-1]) -> 8.1282987659300012 | BA38: 0 | BB38: 4.3699899999999996 | BC38: 0 | BD38: 1.8069976185720003 | BE38: =SUM(RC[-4]:RC[-1]) -> 6.1769876185719994 | BF38: 0 | BG38: 2.81 | BH38: 273.47000000000003 | BI38: 1.3749658872619999 | BJ38: =SUM(RC[-4]:RC[-1]) -> 277.65496588726205 | BK38: 0 | BL38: 0.93 | BM38: 0 | BN38: 1.36160923474 | BO38: =SUM(RC[-4]:RC[-1]) -> 2.2916092347400001 | BP38: 0 | BQ38: 7.38 | BR38: 0 | BS38: 1.9891217082619994 | BT38: =SUM(RC[-4]:RC[-1]) -> 9.369121708262 | BU38: 0 | BV38: 13.77 | BW38: 0 | BX38: 4.3275660999260008 | BY38: =SUM(RC[-4]:RC[-1]) -> 18.097566099925999 | BZ38: 0 | CA38: 0.09 | CB38: 1200 | CC38: 13.135222321360004 | CD38: =SUM(RC[-4]:RC[-1]) -> 1213.22522232136 | CE38: 0 | CF38: 13.8 | CG38: 0 | CH38: 3.0858181326520002 | CI38: =SUM(RC[-4]:RC[-1]) -> 16.885818132652002 | CJ38: 0 | CK38: 1.75 | CL38: 0 | CM38: 1.2099678911319998 | CN38: =SUM(RC[-4]:RC[-1]) -> 2.959967891132 | CO38: 0 | CP38: 1.57 | CQ38: 0 | CR38: 0.96466044453799993 | CS38: =SUM(RC[-4]:RC[-1]) -> 2.5346604445379999 | CT38: 0 | CU38: 0.38990000000000002 | CV38: 0 | CW38: 0.95340579213799992 | CX38: =SUM(RC[-4]:RC[-1]) -> 1.3433057921380001 | CY38: 0 | CZ38: 6.69 | DA38: 0 | DB38: 0.90682072806999992 | DC38: =SUM(RC[-4]:RC[-1]) -> 7.59682072807 | DD38: 0 | DE38: 0.1 | DF38: 0 | DG38: 0.38309498221799992 | DH38: =SUM(RC[-4]:RC[-1]) -> 0.48309498221799996 | DI38: 0 | DJ38: 2.11 | DK38: 0 | DL38: 1.7615916369080002 | DM38: =SUM(RC[-4]:RC[-1]) -> 3.8715916369080001 | DN38: 0 | DO38: 0 | DP38: 0 | DQ38: 1.3758563289860004 | DR38: =SUM(RC[-4]:RC[-1]) -> 1.3758563289860004 | DS38: 0 | DT38: 0 | DU38: 0 | DV38: 10.257818376986 | DW38: =SUM(RC[-4]:RC[-1]) -> 10.257818376986 | DX38: 0 | DY38: 0.188 | DZ38: 0 | EA38: 1.0601419897480002 | EB38: =SUM(RC[-4]:RC[-1]) -> 1.2481419897480002 | EC38: 0 | ED38: 0 | EE38: 0 | EF38: 1.0296837460299999 | EG38: =SUM(RC[-4]:RC[-1]) -> 1.0296837460299999 | EH38: 0 | EI38: 0.21 | EJ38: 0 | EK38: 0.71970747631799992 | EL38: =SUM(RC[-4]:RC[-1]) -> 0.92970747631799988 | EM38: 0 | EN38: 0 | EO38: 0 | EP38: 11.423369526796003 | EQ38: =SUM(RC[-4]:RC[-1]) -> 11.423369526796003 | ER38: 0 | ES38: 0 | ET38: 0 | EU38: 0.66043317657800005 | EV38: =SUM(RC[-4]:RC[-1]) -> 0.66043317657800005 | EW38: 0 | EX38: 0 | EY38: 0 | EZ38: 19.605505300750014 | FA38: =SUM(RC[-4]:RC[-1]) -> 19.605505300750014 | FB38: 0 | FC38: 0 | FD38: 0 | FE38: 203265.16988918601 | FF38: =SUM(RC[-4]:RC[-1]) -> 203265.16988918601 | FG38: 0 | FH38: 0 | FI38: 0 | FJ38: 3.0092246775979983 | FK38: =SUM(RC[-4]:RC[-1]) -> 3.0092246775979983 | FL38: 0 | FM38: 0.15 | FN38: 0 | FO38: 3.2624195335880009 | FP38: =SUM(RC[-4]:RC[-1]) -> 3.4124195335880008 | FQ38: 0 | FR38: 0 | FS38: 0 | FT38: 6.8527512065799998 | FU38: =SUM(RC[-4]:RC[-1]) -> 6.8527512065799998 | FV38: 0 | FW38: 4.13 | FX38: 0 | FY38: 1.7890574270020001 | FZ38: =SUM(RC[-4]:RC[-1]) -> 5.9190574270020004 | GA38: 0 | GB38: 128.25 | GC38: 0 | GD38: 4.3275098319080003 | GE38: =SUM(RC[-4]:RC[-1]) -> 132.577509831908 | GF38: 0 | GG38: 0.02 | GH38: 0 | GI38: 0.55872237949200021 | GJ38: =SUM(RC[-4]:RC[-1]) -> 0.57872237949200023 | GK38: 0 | GL38: 0 | GM38: 0 | GN38: 1.9369472063800004 | GO38: =SUM(RC[-4]:RC[-1]) -> 1.9369472063800004 | GP38: 0 | GQ38: 0.25 | GR38: 0 | GS38: 1.4942610109680003 | GT38: =SUM(RC[-4]:RC[-1]) -> 1.7442610109680003 | GU38: 0 | GV38: 2.9 | GW38: 0 | GX38: 1.4815875226899999 | GY38: =SUM(RC[-4]:RC[-1]) -> 4.3815875226899994 | GZ38: 0 | HA38: 0 | HB38: 0 | HC38: 15.618782601040001 | HD38: =SUM(RC[-4]:RC[-1]) -> 15.618782601040001 | HE38: 0 | HF38: 6.76 | HG38: 0 | HH38: 2.0379446936579999 | HI38: =SUM(RC[-4]:RC[-1]) -> 8.7979446936579997 | HJ38: 0 | HK38: 0 | HL38: 0 | HM38: 3.7749694078999991 | HN38: =SUM(RC[-4]:RC[-1]) -> 3.7749694078999991 | HO38: 0 | HP38: 43.43 | HQ38: 0 | HR38: 4.4403655429840008 | HS38: =SUM(RC[-4]:RC[-1]) -> 47.870365542984004 | HT38: 0 | HU38: 7.98 | HV38: 0 | HW38: 1.8424067213080004 | HX38: =SUM(RC[-4]:RC[-1]) -> 9.8224067213080009 | HY38: 0 | HZ38: 0.18 | IA38: 0 | IB38: 2.9897423654280022 | IC38: =SUM(RC[-4]:RC[-1]) -> 3.1697423654280024 | ID38: 0 | IE38: 8.07 | IF38: 0 | IG38: 1.4770841881139998 | IH38: =SUM(RC[-4]:RC[-1]) -> 9.5470841881140007 | II38: 0 | IJ38: 4.4800000000000004 | IK38: 0 | IL38: 0.32029214661399991 | IM38: =SUM(RC[-4]:RC[-1]) -> 4.8002921466140007
A39: FLUORENE | B39: =RC[8]+RC[13]+RC[18]+RC[23]+RC[28]+RC[33]+RC[38]+RC[43]+RC[48]+RC[53]+RC[58]+RC[63]+RC[68]+RC[73]+RC[78]+RC[83]+RC[88]+RC[93]+RC[98]+RC[103]+RC[108]+RC[113]+RC[118]+RC[123]+RC[128]+RC[133]+RC[138]+RC[143]+RC[148]+RC[153]+RC[158]+RC[163]+RC[168]+RC[173]+RC[178]+RC[183]+RC[188]+RC[193]+RC[198]+RC[203]+RC[208]+RC[213]+RC[218]+RC[223]+RC[228]+RC[233]+RC[238]+RC[243]+Sheet2!RC[2]+Sheet2!RC[7]+Sheet2!RC[12]+Sheet2!RC[17]+Sheet2!RC[22]+Sheet2!RC[27]+Sheet2!RC[32]+Sheet2!RC[37]+Sheet2!RC[42]+Sheet2!RC[47]+Sheet2!RC[57]+Sheet2!RC[52]+Sheet2!RC[62]+Sheet2!RC[67] -> 0 | C39: =RC[6]+RC[11]+RC[16]+RC[21]+RC[26]+RC[31]+RC[36]+RC[41]+RC[46]+RC[51]+RC[56]+RC[61]+RC[66]+RC[71]+RC[76]+RC[81]+RC[86]+RC[91]+RC[96]+RC[101]+RC[106]+RC[111]+RC[116]+RC[121]+RC[126]+RC[131]+RC[136]+RC[141]+RC[146]+RC[151]+RC[156]+RC[161]+RC[166]+RC[171]+RC[176]+RC[181]+RC[186]+RC[191]+RC[196]+RC[201]+RC[206]+RC[211]+RC[216]+RC[221]+RC[226]+RC[231]+RC[236]+RC[241]+Sheet2!RC+Sheet2!RC[5]+Sheet2!RC[10]+Sheet2!RC[15]+Sheet2!RC[20]+Sheet2!RC[25]+Sheet2!RC[30]+Sheet2!RC[35]+Sheet2!RC[40]+Sheet2!RC[45]+Sheet2!RC[50]+Sheet2!RC[55]+Sheet2!RC[60]+Sheet2!RC[65] -> 0 | D39: =RC[4]+RC[9]+RC[14]+RC[19]+RC[24]+RC[29]+RC[34]+RC[39]+RC[44]+RC[49]+RC[54]+RC[59]+RC[64]+RC[69]+RC[74]+RC[79]+RC[84]+RC[89]+RC[94]+RC[99]+RC[104]+RC[109]+RC[114]+RC[119]+RC[124]+RC[129]+RC[134]+RC[139]+RC[144]+RC[149]+RC[154]+RC[159]+RC[164]+RC[169]+RC[174]+RC[179]+RC[184]+RC[189]+RC[194]+RC[199]+RC[204]+RC[209]+RC[214]+RC[219]+RC[224]+RC[229]+RC[234]+RC[239]+Sheet2!RC[3]+Sheet2!RC[-2]+Sheet2!RC[8]+Sheet2!RC[13]+Sheet2!RC[18]+Sheet2!RC[23]+Sheet2!RC[28]+Sheet2!RC[33]+Sheet2!RC[38]+Sheet2!RC[43]+Sheet2!RC[48]+Sheet2!RC[53]+Sheet2!RC[58]+Sheet2!RC[63] -> 0 | E39: =RC[6]+RC[11]+RC[16]+RC[21]+RC[26]+RC[31]+RC[36]+RC[41]+RC[46]+RC[51]+RC[56]+RC[61]+RC[66]+RC[71]+RC[76]+RC[81]+RC[86]+RC[91]+RC[96]+RC[101]+RC[106]+RC[111]+RC[116]+RC[121]+RC[126]+RC[131]+RC[136]+RC[141]+RC[146]+RC[151]+RC[156]+RC[161]+RC[166]+RC[171]+RC[176]+RC[181]+RC[186]+RC[191]+RC[196]+RC[201]+RC[206]+RC[211]+RC[216]+RC[221]+RC[226]+RC[231]+RC[236]+RC[241]+Sheet2!RC+Sheet2!RC[5]+Sheet2!RC[10]+Sheet2!RC[15]+Sheet2!RC[20]+Sheet2!RC[25]+Sheet2!RC[30]+Sheet2!RC[35]+Sheet2!RC[40]+Sheet2!RC[45]+Sheet2!RC[50]+Sheet2!RC[55]+Sheet2!RC[60]+Sheet2!RC[65] -> 0 | F39: =SUM(RC[-4]:RC[-1]) -> 0 | G39: =Sheet1!RC[5]+Sheet1!RC[10]+Sheet1!RC[15]+Sheet1!RC[20]+Sheet1!RC[25]+Sheet1!RC[30]+Sheet1!RC[35]+Sheet1!RC[40]+Sheet1!RC[45]+Sheet1!RC[50]+Sheet1!RC[55]+Sheet1!RC[60]+Sheet1!RC[65]+Sheet1!RC[70]+Sheet1!RC[75]+Sheet1!RC[80]+Sheet1!RC[85]+Sheet1!RC[90]+Sheet1!RC[95]+Sheet1!RC[100]+Sheet1!RC[105]+Sheet1!RC[110]+Sheet1!RC[115]+Sheet1!RC[120]+Sheet1!RC[125]+Sheet1!RC[130]+Sheet1!RC[135]+Sheet1!RC[140]+Sheet1!RC[145]+Sheet1!RC[150]+Sheet1!RC[155]+Sheet1!RC[160]+Sheet1!RC[165]+Sheet1!RC[170]+Sheet1!RC[175]+Sheet1!RC[180]+Sheet1!RC[185]+Sheet1!RC[190]+Sheet1!RC[195]+Sheet1!RC[200]+Sheet1!RC[205]+Sheet1!RC[210]+Sheet1!RC[215]+Sheet1!RC[220]+Sheet1!RC[225]+Sheet1!RC[230]+Sheet1!RC[235]+Sheet1!RC[240]+Sheet2!RC[-1]+Sheet2!RC[4]+Sheet2!RC[9]+Sheet2!RC[14]+Sheet2!RC[19]+Sheet2!RC[24]+Sheet2!RC[29]+Sheet2!RC[34]+Sheet2!RC[39]+Sheet2!RC[44]+Sheet2!RC[49]+Sheet2!RC[54]+Sheet2!RC[59]+Sheet2!RC[64] -> 0 | H39: 0 | I39: 0 | J39: 0 | K39: 0 | L39: =SUM(RC[-4]:RC[-1]) -> 0 | M39: 0 | N39: 0 | O39: 0 | P39: 0 | Q39: =SUM(RC[-4]:RC[-1]) -> 0 | R39: 0 | S39: 0 | T39: 0 | U39: 0 | V39: =SUM(RC[-4]:RC[-1]) -> 0 | W39: 0 | X39: 0 | Y39: 0 | Z39: 0 | AA39: =SUM(RC[-4]:RC[-1]) -> 0 | AB39: 0 | AC39: 0 | AD39: 0 | AE39: 0 | AF39: =SUM(RC[-4]:RC[-1]) -> 0 | AG39: 0 | AH39: 0 | AI39: 0 | AJ39: 0 | AK39: =SUM(RC[-4]:RC[-1]) -> 0 | AL39: 0 | AM39: 0 | AN39: 0 | AO39: 0 | AP39: =SUM(RC[-4]:RC[-1]) -> 0 | AQ39: 0 | AR39: 0 | AS39: 0 | AT39: 0 | AU39: =SUM(RC[-4]:RC[-1]) -> 0 | AV39: 0 | AW39: 0 | AX39: 0 | AY39: 0 | AZ39: =SUM(RC[-4]:RC[-1]) -> 0 | BA39: 0 | BB39: 0 | BC39: 0 | BD39: 0 | BE39: =SUM(RC[-4]:RC[-1]) -> 0 | BF39: 0 | BG39: 0 | BH39: 0 | BI39: 0 | BJ39: =SUM(RC[-4]:RC[-1]) -> 0 | BK39: 0 | BL39: 0 | BM39: 0 | BN39: 0 | BO39: =SUM(RC[-4]:RC[-1]) -> 0 | BP39: 0 | BQ39: 0 | BR39: 0 | BS39: 0 | BT39: =SUM(RC[-4]:RC[-1]) -> 0 | BU39: 0 | BV39: 0 | BW39: 0 | BX39: 0 | BY39: =SUM(RC[-4]:RC[-1]) -> 0 | BZ39: 0 | CA39: 0 | CB39: 0 | CC39: 0 | CD39: =SUM(RC[-4]:RC[-1]) -> 0 | CE39: 0 | CF39: 0 | CG39: 0 | CH39: 0 | CI39: =SUM(RC[-4]:RC[-1]) -> 0 | CJ39: 0 | CK39: 0 | CL39: 0 | CM39: 0 | CN39: =SUM(RC[-4]:RC[-1]) -> 0 | CO39: 0 | CP39: 0 | CQ39: 0 | CR39: 0 | CS39: =SUM(RC[-4]:RC[-1]) -> 0 | CT39: 0 | CU39: 0 | CV39: 0 | CW39: 0 | CX39: =SUM(RC[-4]:RC[-1]) -> 0 | CY39: 0 | CZ39: 0 | DA39: 0 | DB39: 0 | DC39: =SUM(RC[-4]:RC[-1]) -> 0 | DD39: 0 | DE39: 0 | DF39: 0 | DG39: 0 | DH39: =SUM(RC[-4]:RC[-1]) -> 0 | DI39: 0 | DJ39: 0 | DK39: 0 | DL39: 0 | DM39: =SUM(RC[-4]:RC[-1]) -> 0 | DN39: 0 | DO39: 0 | DP39: 0 | DQ39: 0 | DR39: =SUM(RC[-4]:RC[-1]) -> 0 | DS39: 0 | DT39: 0 | DU39: 0 | DV39: 0 | DW39: =SUM(RC[-4]:RC[-1]) -> 0 | DX39: 0 | DY39: 0 | DZ39: 0 | EA39: 0 | EB39: =SUM(RC[-4]:RC[-1]) -> 0 | EC39: 0 | ED39: 0 | EE39: 0 | EF39: 0 | EG39: =SUM(RC[-4]:RC[-1]) -> 0 | EH39: 0 | EI39: 0 | EJ39: 0 | EK39: 0 | EL39: =SUM(RC[-4]:RC[-1]) -> 0 | EM39: 0 | EN39: 0 | EO39: 0 | EP39: 0 | EQ39: =SUM(RC[-4]:RC[-1]) -> 0 | ER39: 0 | ES39: 0 | ET39: 0 | EU39: 0 | EV39: =SUM(RC[-4]:RC[-1]) -> 0 | EW39: 0 | EX39: 0 | EY39: 0 | EZ39: 0 | FA39: =SUM(RC[-4]:RC[-1]) -> 0 | FB39: 0 | FC39: 0 | FD39: 0 | FE39: 0 | FF39: =SUM(RC[-4]:RC[-1]) -> 0 | FG39: 0 | FH39: 0 | FI39: 0 | FJ39: 0 | FK39: =SUM(RC[-4]:RC[-1]) -> 0 | FL39: 0 | FM39: 0 | FN39: 0 | FO39: 0 | FP39: =SUM(RC[-4]:RC[-1]) -> 0 | FQ39: 0 | FR39: 0 | FS39: 0 | FT39: 0 | FU39: =SUM(RC[-4]:RC[-1]) -> 0 | FV39: 0 | FW39: 0 | FX39: 0 | FY39: 0 | FZ39: =SUM(RC[-4]:RC[-1]) -> 0 | GA39: 0 | GB39: 0 | GC39: 0 | GD39: 0 | GE39: =SUM(RC[-4]:RC[-1]) -> 0 | GF39: 0 | GG39: 0 | GH39: 0 | GI39: 0 | GJ39: =SUM(RC[-4]:RC[-1]) -> 0 | GK39: 0 | GL39: 0 | GM39: 0 | GN39: 0 | GO39: =SUM(RC[-4]:RC[-1]) -> 0 | GP39: 0 | GQ39: 0 | GR39: 0 | GS39: 0 | GT39: =SUM(RC[-4]:RC[-1]) -> 0 | GU39: 0 | GV39: 0 | GW39: 0 | GX39: 0 | GY39: =SUM(RC[-4]:RC[-1]) -> 0 | GZ39: 0 | HA39: 0 | HB39: 0 | HC39: 0 | HD39: =SUM(RC[-4]:RC[-1]) -> 0 | HE39: 0 | HF39: 0 | HG39: 0 | HH39: 0 | HI39: =SUM(RC[-4]:RC[-1]) -> 0 | HJ39: 0 | HK39: 0 | HL39: 0 | HM39: 0 | HN39: =SUM(RC[-4]:RC[-1]) -> 0 | HO39: 0 | HP39: 0 | HQ39: 0 | HR39: 0 | HS39: =SUM(RC[-4]:RC[-1]) -> 0 | HT39: 0 | HU39: 0 | HV39: 0 | HW39: 0 | HX39: =SUM(RC[-4]:RC[-1]) -> 0 | HY39: 0 | HZ39: 0 | IA39: 0 | IB39: 0 | IC39: =SUM(RC[-4]:RC[-1]) -> 0 | ID39: 0 | IE39: 0 | IF39: 0 | IG39: 0 | IH39: =SUM(RC[-4]:RC[-1]) -> 0 | II39: 0 | IJ39: 0 | IK39: 0 | IL39: 0 | IM39: =SUM(RC[-4]:RC[-1]) -> 0
A40: FORMALDEHYDE | B40: =RC[8]+RC[13]+RC[18]+RC[23]+RC[28]+RC[33]+RC[38]+RC[43]+RC[48]+RC[53]+RC[58]+RC[63]+RC[68]+RC[73]+RC[78]+RC[83]+RC[88]+RC[93]+RC[98]+RC[103]+RC[108]+RC[113]+RC[118]+RC[123]+RC[128]+RC[133]+RC[138]+RC[143]+RC[148]+RC[153]+RC[158]+RC[163]+RC[168]+RC[173]+RC[178]+RC[183]+RC[188]+RC[193]+RC[198]+RC[203]+RC[208]+RC[213]+RC[218]+RC[223]+RC[228]+RC[233]+RC[238]+RC[243]+Sheet2!RC[2]+Sheet2!RC[7]+Sheet2!RC[12]+Sheet2!RC[17]+Sheet2!RC[22]+Sheet2!RC[27]+Sheet2!RC[32]+Sheet2!RC[37]+Sheet2!RC[42]+Sheet2!RC[47]+Sheet2!RC[57]+Sheet2!RC[52]+Sheet2!RC[62]+Sheet2!RC[67] -> 998719.36299999978 | C40: =RC[6]+RC[11]+RC[16]+RC[21]+RC[26]+RC[31]+RC[36]+RC[41]+RC[46]+RC[51]+RC[56]+RC[61]+RC[66]+RC[71]+RC[76]+RC[81]+RC[86]+RC[91]+RC[96]+RC[101]+RC[106]+RC[111]+RC[116]+RC[121]+RC[126]+RC[131]+RC[136]+RC[141]+RC[146]+RC[151]+RC[156]+RC[161]+RC[166]+RC[171]+RC[176]+RC[181]+RC[186]+RC[191]+RC[196]+RC[201]+RC[206]+RC[211]+RC[216]+RC[221]+RC[226]+RC[231]+RC[236]+RC[241]+Sheet2!RC+Sheet2!RC[5]+Sheet2!RC[10]+Sheet2!RC[15]+Sheet2!RC[20]+Sheet2!RC[25]+Sheet2!RC[30]+Sheet2!RC[35]+Sheet2!RC[40]+Sheet2!RC[45]+Sheet2!RC[50]+Sheet2!RC[55]+Sheet2!RC[60]+Sheet2!RC[65] -> 223553.5269 | D40: =RC[4]+RC[9]+RC[14]+RC[19]+RC[24]+RC[29]+RC[34]+RC[39]+RC[44]+RC[49]+RC[54]+RC[59]+RC[64]+RC[69]+RC[74]+RC[79]+RC[84]+RC[89]+RC[94]+RC[99]+RC[104]+RC[109]+RC[114]+RC[119]+RC[124]+RC[129]+RC[134]+RC[139]+RC[144]+RC[149]+RC[154]+RC[159]+RC[164]+RC[169]+RC[174]+RC[179]+RC[184]+RC[189]+RC[194]+RC[199]+RC[204]+RC[209]+RC[214]+RC[219]+RC[224]+RC[229]+RC[234]+RC[239]+Sheet2!RC[3]+Sheet2!RC[-2]+Sheet2!RC[8]+Sheet2!RC[13]+Sheet2!RC[18]+Sheet2!RC[23]+Sheet2!RC[28]+Sheet2!RC[33]+Sheet2!RC[38]+Sheet2!RC[43]+Sheet2!RC[48]+Sheet2!RC[53]+Sheet2!RC[58]+Sheet2!RC[63] -> 9856663 | E40: =RC[6]+RC[11]+RC[16]+RC[21]+RC[26]+RC[31]+RC[36]+RC[41]+RC[46]+RC[51]+RC[56]+RC[61]+RC[66]+RC[71]+RC[76]+RC[81]+RC[86]+RC[91]+RC[96]+RC[101]+RC[106]+RC[111]+RC[116]+RC[121]+RC[126]+RC[131]+RC[136]+RC[141]+RC[146]+RC[151]+RC[156]+RC[161]+RC[166]+RC[171]+RC[176]+RC[181]+RC[186]+RC[191]+RC[196]+RC[201]+RC[206]+RC[211]+RC[216]+RC[221]+RC[226]+RC[231]+RC[236]+RC[241]+Sheet2!RC+Sheet2!RC[5]+Sheet2!RC[10]+Sheet2!RC[15]+Sheet2!RC[20]+Sheet2!RC[25]+Sheet2!RC[30]+Sheet2!RC[35]+Sheet2!RC[40]+Sheet2!RC[45]+Sheet2!RC[50]+Sheet2!RC[55]+Sheet2!RC[60]+Sheet2!RC[65] -> 4798532.3861793736 | F40: =SUM(RC[-4]:RC[-1]) -> 15877468.276079372 | G40: =Sheet1!RC[5]+Sheet1!RC[10]+Sheet1!RC[15]+Sheet1!RC[20]+Sheet1!RC[25]+Sheet1!RC[30]+Sheet1!RC[35]+Sheet1!RC[40]+Sheet1!RC[45]+Sheet1!RC[50]+Sheet1!RC[55]+Sheet1!RC[60]+Sheet1!RC[65]+Sheet1!RC[70]+Sheet1!RC[75]+Sheet1!RC[80]+Sheet1!RC[85]+Sheet1!RC[90]+Sheet1!RC[95]+Sheet1!RC[100]+Sheet1!RC[105]+Sheet1!RC[110]+Sheet1!RC[115]+Sheet1!RC[120]+Sheet1!RC[125]+Sheet1!RC[130]+Sheet1!RC[135]+Sheet1!RC[140]+Sheet1!RC[145]+Sheet1!RC[150]+Sheet1!RC[155]+Sheet1!RC[160]+Sheet1!RC[165]+Sheet1!RC[170]+Sheet1!RC[175]+Sheet1!RC[180]+Sheet1!RC[185]+Sheet1!RC[190]+Sheet1!RC[195]+Sheet1!RC[200]+Sheet1!RC[205]+Sheet1!RC[210]+Sheet1!RC[215]+Sheet1!RC[220]+Sheet1!RC[225]+Sheet1!RC[230]+Sheet1!RC[235]+Sheet1!RC[240]+Sheet2!RC[-1]+Sheet2!RC[4]+Sheet2!RC[9]+Sheet2!RC[14]+Sheet2!RC[19]+Sheet2!RC[24]+Sheet2!RC[29]+Sheet2!RC[34]+Sheet2!RC[39]+Sheet2!RC[44]+Sheet2!RC[49]+Sheet2!RC[54]+Sheet2!RC[59]+Sheet2!RC[64] -> 15877468.276079372 | H40: 255073 | I40: 3054 | J40: 69701 | K40: 106001.40988706 | L40: =SUM(RC[-4]:RC[-1]) -> 433829.40988706 | M40: 39745 | N40: 1411.99 | O40: 865.58 | P40: 15555.097910205004 | Q40: =SUM(RC[-4]:RC[-1]) -> 57577.667910205004 | R40: 281082 | S40: 7134.32 | T40: 19834 | U40: 4.2623551112000015 | V40: =SUM(RC[-4]:RC[-1]) -> 308054.5823551112 | W40: 189719 | X40: 2109.9899999999998 | Y40: 3859.8 | Z40: 44705.991032496 | AA40: =SUM(RC[-4]:RC[-1]) -> 240394.78103249599 | AB40: 62769 | AC40: 5838.07 | AD40: 273.23 | AE40: 40134.214789580983 | AF40: =SUM(RC[-4]:RC[-1]) -> 109014.51478958098 | AG40: 53710 | AH40: 284.524 | AI40: 258.8 | AJ40: 38040.270871599991 | AK40: =SUM(RC[-4]:RC[-1]) -> 92293.594871599984 | AL40: 115688 | AM40: 509.15100000000001 | AN40: 528.89 | AO40: 62428.749685589959 | AP40: =SUM(RC[-4]:RC[-1]) -> 179154.79068558995 | AQ40: 62149 | AR40: 3008.2 | AS40: 866.4 | AT40: 28050.743912475999 | AU40: =SUM(RC[-4]:RC[-1]) -> 94074.34391247599 | AV40: 37071 | AW40: 2689.12 | AX40: 408.53 | AY40: 21694.664758764018 | AZ40: =SUM(RC[-4]:RC[-1]) -> 61863.31475876402 | BA40: 64556 | BB40: 1931.37 | BC40: 23015.57 | BD40: 27090.044883085004 | BE40: =SUM(RC[-4]:RC[-1]) -> 116592.98488308501 | BF40: 47498 | BG40: 1288.22 | BH40: 41 | BI40: 25111.061290025991 | BJ40: =SUM(RC[-4]:RC[-1]) -> 73938.281290025989 | BK40: 45179 | BL40: 448.94 | BM40: 202 | BN40: 15744.108770427001 | BO40: =SUM(RC[-4]:RC[-1]) -> 61574.048770427005 | BP40: 41600 | BQ40: 2998.6 | BR40: 41593 | BS40: 22785.800244689999 | BT40: =SUM(RC[-4]:RC[-1]) -> 108977.40024469001 | BU40: 179763 | BV40: 6060.34 | BW40: 880 | BX40: 77552.870918025044 | BY40: =SUM(RC[-4]:RC[-1]) -> 264256.21091802506 | BZ40: 560305 | CA40: 3712.3 | CB40: 32907.949999999997 | CC40: 296650.93387220032 | CD40: =SUM(RC[-4]:RC[-1]) -> 893576.18387220032 | CE40: 40263 | CF40: 5418.5150000000003 | CG40: 5491.69 | CH40: 18932.209549646006 | CI40: =SUM(RC[-4]:RC[-1]) -> 70105.414549646011 | CJ40: 34389 | CK40: 940.83 | CL40: 40.128 | CM40: 15919.32783335 | CN40: =SUM(RC[-4]:RC[-1]) -> 51289.285833349997 | CO40: 30992 | CP40: 762.66 | CQ40: 117 | CR40: 12811.126949655998 | CS40: =SUM(RC[-4]:RC[-1]) -> 44682.786949656002 | CT40: 76957 | CU40: 332.22 | CV40: 5327.03 | CW40: 29887.919161214009 | CX40: =SUM(RC[-4]:RC[-1]) -> 112504.16916121401 | CY40: 53482 | CZ40: 2749.14 | DA40: 94.46 | DB40: 12625.177502364004 | DC40: =SUM(RC[-4]:RC[-1]) -> 68950.777502363999 | DD40: 10015 | DE40: 64.7 | DF40: 0 | DG40: 3107.6559623959993 | DH40: =SUM(RC[-4]:RC[-1]) -> 13187.355962395999 | DI40: 59632 | DJ40: 1005.74 | DK40: 1018.25 | DL40: 29612.967643580003 | DM40: =SUM(RC[-4]:RC[-1]) -> 91268.957643579997 | DN40: 97867 | DO40: 446.01 | DP40: 44178.26 | DQ40: 48697.004266969991 | DR40: =SUM(RC[-4]:RC[-1]) -> 191188.27426696999 | DS40: 432987 | DT40: 13670.8 | DU40: 41585.834999999999 | DV40: 266547.82564897608 | DW40: =SUM(RC[-4]:RC[-1]) -> 754791.46064897603 | DX40: 19447 | DY40: 184 | DZ40: 31265.34 | EA40: 16535.764654448001 | EB40: =SUM(RC[-4]:RC[-1]) -> 67432.10465444799 | EC40: 54718 | ED40: 194.2542 | EE40: 540 | EF40: 25309.911062768002 | EG40: =SUM(RC[-4]:RC[-1]) -> 80762.165262768001 | EH40: 56676 | EI40: 316.82 | EJ40: 0 | EK40: 20166.56868195501 | EL40: =SUM(RC[-4]:RC[-1]) -> 77159.38868195501 | EM40: 467278 | EN40: 2201.0500000000002 | EO40: 5838.77 | EP40: 262906.6359390099 | EQ40: =SUM(RC[-4]:RC[-1]) -> 738224.4559390099 | ER40: 58601 | ES40: 105 | ET40: 458.13 | EU40: 23098.716680560006 | EV40: =SUM(RC[-4]:RC[-1]) -> 82262.846680560004 | EW40: 1086301 | EX40: 2382.23 | EY40: 27235.71 | EZ40: 287246.6631490381 | FA40: =SUM(RC[-4]:RC[-1]) -> 1403165.603149038 | FB40: 352147 | FC40: 9335.5499999999993 | FD40: 64700 | FE40: 23.877063878920016 | FF40: =SUM(RC[-4]:RC[-1]) -> 426206.42706387892 | FG40: 105209 | FH40: 701.06 | FI40: 32377.84 | FJ40: 63246.155727637997 | FK40: =SUM(RC[-4]:RC[-1]) -> 201534.05572763798 | FL40: 171182 | FM40: 862 | FN40: 2432.2399999999998 | FO40: 408926.386720996 | FP40: =SUM(RC[-4]:RC[-1]) -> 583402.62672099599 | FQ40: 311626 | FR40: 1863.9 | FS40: 25660.400000000001 | FT40: 145085.86969434604 | FU40: =SUM(RC[-4]:RC[-1]) -> 484236.16969434608 | FV40: 87216 | FW40: 1855.3 | FX40: 887.07 | FY40: 44722.171991573996 | FZ40: =SUM(RC[-4]:RC[-1]) -> 134680.54199157399 | GA40: 248932 | GB40: 50073.2 | GC40: 85882.33 | GD40: 109989.57114347001 | GE40: =SUM(RC[-4]:RC[-1]) -> 494877.10114347003 | GF40: 23930 | GG40: 213.2 | GH40: 49.6 | GI40: 15706.984254207997 | GJ40: =SUM(RC[-4]:RC[-1]) -> 39899.784254207996 | GK40: 78935 | GL40: 344 | GM40: 41295.1 | GN40: 29875.687714733987 | GO40: =SUM(RC[-4]:RC[-1]) -> 150449.787714734 | GP40: 51723 | GQ40: 263.68 | GR40: 10.6 | GS40: 22650.236685384985 | GT40: =SUM(RC[-4]:RC[-1]) -> 74647.516685384981 | GU40: 91120 | GV40: 1292.8 | GW40: 339.6 | GX40: 22785.931403408002 | GY40: =SUM(RC[-4]:RC[-1]) -> 115538.33140340801 | GZ40: 569659 | HA40: 11968.55 | HB40: 125699.16 | HC40: 649036.96400298062 | HD40: =SUM(RC[-4]:RC[-1]) -> 1356363.6740029808 | HE40: 106709 | HF40: 3236.5 | HG40: 2568.12 | HH40: 37650.107402021982 | HI40: =SUM(RC[-4]:RC[-1]) -> 150163.72740202199 | HJ40: 178211 | HK40: 2481 | HL40: 11756.68 | HM40: 94070.155014582997 | HN40: =SUM(RC[-4]:RC[-1]) -> 286518.83501458296 | HO40: 197802 | HP40: 0 | HQ40: 21650.2 | HR40: 75071.355454399993 | HS40: =SUM(RC[-4]:RC[-1]) -> 294523.55545440002 | HT40: 161496 | HU40: 3552.3 | HV40: 7477.48 | HW40: 38367.082462857987 | HX40: =SUM(RC[-4]:RC[-1]) -> 210892.86246285797 | HY40: 88742 | HZ40: 351.15499999999997 | IA40: 25085.5 | IB40: 63046.694599805 | IC40: =SUM(RC[-4]:RC[-1]) -> 177225.34959980499 | ID40: 28715 | IE40: 3175.0877 | IF40: 143.63 | IG40: 30002.546196969997 | IH40: =SUM(RC[-4]:RC[-1]) -> 62036.263896969998 | II40: 13804 | IJ40: 1783.47 | IK40: 625.95000000000005 | IL40: 9058.0150562319923 | IM40: =SUM(RC[-4]:RC[-1]) -> 25271.435056231992
A41: GLYCOL ETHRS | B41: =RC[8]+RC[13]+RC[18]+RC[23]+RC[28]+RC[33]+RC[38]+RC[43]+RC[48]+RC[53]+RC[58]+RC[63]+RC[68]+RC[73]+RC[78]+RC[83]+RC[88]+RC[93]+RC[98]+RC[103]+RC[108]+RC[113]+RC[118]+RC[123]+RC[128]+RC[133]+RC[138]+RC[143]+RC[148]+RC[153]+RC[158]+RC[163]+RC[168]+RC[173]+RC[178]+RC[183]+RC[188]+RC[193]+RC[198]+RC[203]+RC[208]+RC[213]+RC[218]+RC[223]+RC[228]+RC[233]+RC[238]+RC[243]+Sheet2!RC[2]+Sheet2!RC[7]+Sheet2!RC[12]+Sheet2!RC[17]+Sheet2!RC[22]+Sheet2!RC[27]+Sheet2!RC[32]+Sheet2!RC[37]+Sheet2!RC[42]+Sheet2!RC[47]+Sheet2!RC[57]+Sheet2!RC[52]+Sheet2!RC[62]+Sheet2!RC[67] -> 132 | C41: =RC[6]+RC[11]+RC[16]+RC[21]+RC[26]+RC[31]+RC[36]+RC[41]+RC[46]+RC[51]+RC[56]+RC[61]+RC[66]+RC[71]+RC[76]+RC[81]+RC[86]+RC[91]+RC[96]+RC[101]+RC[106]+RC[111]+RC[116]+RC[121]+RC[126]+RC[131]+RC[136]+RC[141]+RC[146]+RC[151]+RC[156]+RC[161]+RC[166]+RC[171]+RC[176]+RC[181]+RC[186]+RC[191]+RC[196]+RC[201]+RC[206]+RC[211]+RC[216]+RC[221]+RC[226]+RC[231]+RC[236]+RC[241]+Sheet2!RC+Sheet2!RC[5]+Sheet2!RC[10]+Sheet2!RC[15]+Sheet2!RC[20]+Sheet2!RC[25]+Sheet2!RC[30]+Sheet2!RC[35]+Sheet2!RC[40]+Sheet2!RC[45]+Sheet2!RC[50]+Sheet2!RC[55]+Sheet2!RC[60]+Sheet2!RC[65] -> 0 | D41: =RC[4]+RC[9]+RC[14]+RC[19]+RC[24]+RC[29]+RC[34]+RC[39]+RC[44]+RC[49]+RC[54]+RC[59]+RC[64]+RC[69]+RC[74]+RC[79]+RC[84]+RC[89]+RC[94]+RC[99]+RC[104]+RC[109]+RC[114]+RC[119]+RC[124]+RC[129]+RC[134]+RC[139]+RC[144]+RC[149]+RC[154]+RC[159]+RC[164]+RC[169]+RC[174]+RC[179]+RC[184]+RC[189]+RC[194]+RC[199]+RC[204]+RC[209]+RC[214]+RC[219]+RC[224]+RC[229]+RC[234]+RC[239]+Sheet2!RC[3]+Sheet2!RC[-2]+Sheet2!RC[8]+Sheet2!RC[13]+Sheet2!RC[18]+Sheet2!RC[23]+Sheet2!RC[28]+Sheet2!RC[33]+Sheet2!RC[38]+Sheet2!RC[43]+Sheet2!RC[48]+Sheet2!RC[53]+Sheet2!RC[58]+Sheet2!RC[63] -> 0 | E41: =RC[6]+RC[11]+RC[16]+RC[21]+RC[26]+RC[31]+RC[36]+RC[41]+RC[46]+RC[51]+RC[56]+RC[61]+RC[66]+RC[71]+RC[76]+RC[81]+RC[86]+RC[91]+RC[96]+RC[101]+RC[106]+RC[111]+RC[116]+RC[121]+RC[126]+RC[131]+RC[136]+RC[141]+RC[146]+RC[151]+RC[156]+RC[161]+RC[166]+RC[171]+RC[176]+RC[181]+RC[186]+RC[191]+RC[196]+RC[201]+RC[206]+RC[211]+RC[216]+RC[221]+RC[226]+RC[231]+RC[236]+RC[241]+Sheet2!RC+Sheet2!RC[5]+Sheet2!RC[10]+Sheet2!RC[15]+Sheet2!RC[20]+Sheet2!RC[25]+Sheet2!RC[30]+Sheet2!RC[35]+Sheet2!RC[40]+Sheet2!RC[45]+Sheet2!RC[50]+Sheet2!RC[55]+Sheet2!RC[60]+Sheet2!RC[65] -> 0 | F41: =SUM(RC[-4]:RC[-1]) -> 132 | G41: =Sheet1!RC[5]+Sheet1!RC[10]+Sheet1!RC[15]+Sheet1!RC[20]+Sheet1!RC[25]+Sheet1!RC[30]+Sheet1!RC[35]+Sheet1!RC[40]+Sheet1!RC[45]+Sheet1!RC[50]+Sheet1!RC[55]+Sheet1!RC[60]+Sheet1!RC[65]+Sheet1!RC[70]+Sheet1!RC[75]+Sheet1!RC[80]+Sheet1!RC[85]+Sheet1!RC[90]+Sheet1!RC[95]+Sheet1!RC[100]+Sheet1!RC[105]+Sheet1!RC[110]+Sheet1!RC[115]+Sheet1!RC[120]+Sheet1!RC[125]+Sheet1!RC[130]+Sheet1!RC[135]+Sheet1!RC[140]+Sheet1!RC[145]+Sheet1!RC[150]+Sheet1!RC[155]+Sheet1!RC[160]+Sheet1!RC[165]+Sheet1!RC[170]+Sheet1!RC[175]+Sheet1!RC[180]+Sheet1!RC[185]+Sheet1!RC[190]+Sheet1!RC[195]+Sheet1!RC[200]+Sheet1!RC[205]+Sheet1!RC[210]+Sheet1!RC[215]+Sheet1!RC[220]+Sheet1!RC[225]+Sheet1!RC[230]+Sheet1!RC[235]+Sheet1!RC[240]+Sheet2!RC[-1]+Sheet2!RC[4]+Sheet2!RC[9]+Sheet2!RC[14]+Sheet2!RC[19]+Sheet2!RC[24]+Sheet2!RC[29]+Sheet2!RC[34]+Sheet2!RC[39]+Sheet2!RC[44]+Sheet2!RC[49]+Sheet2!RC[54]+Sheet2!RC[59]+Sheet2!RC[64] -> 132 | H41: 0 | I41: 0 | J41: 0 | K41: 0 | L41: =SUM(RC[-4]:RC[-1]) -> 0 | M41: 0 | N41: 0 | O41: 0 | P41: 0 | Q41: =SUM(RC[-4]:RC[-1]) -> 0 | R41: 0 | S41: 0 | T41: 0 | U41: 0 | V41: =SUM(RC[-4]:RC[-1]) -> 0 | W41: 0 | X41: 0 | Y41: 0 | Z41: 0 | AA41: =SUM(RC[-4]:RC[-1]) -> 0 | AB41: 0 | AC41: 0 | AD41: 0 | AE41: 0 | AF41: =SUM(RC[-4]:RC[-1]) -> 0 | AG41: 0 | AH41: 0 | AI41: 0 | AJ41: 0 | AK41: =SUM(RC[-4]:RC[-1]) -> 0 | AL41: 0 | AM41: 0 | AN41: 0 | AO41: 0 | AP41: =SUM(RC[-4]:RC[-1]) -> 0 | AQ41: 0 | AR41: 0 | AS41: 0 | AT41: 0 | AU41: =SUM(RC[-4]:RC[-1]) -> 0 | AV41: 0 | AW41: 0 | AX41: 0 | AY41: 0 | AZ41: =SUM(RC[-4]:RC[-1]) -> 0 | BA41: 0 | BB41: 0 | BC41: 0 | BD41: 0 | BE41: =SUM(RC[-4]:RC[-1]) -> 0 | BF41: 0 | BG41: 0 | BH41: 0 | BI41: 0 | BJ41: =SUM(RC[-4]:RC[-1]) -> 0 | BK41: 0 | BL41: 0 | BM41: 0 | BN41: 0 | BO41: =SUM(RC[-4]:RC[-1]) -> 0 | BP41: 0 | BQ41: 0 | BR41: 0 | BS41: 0 | BT41: =SUM(RC[-4]:RC[-1]) -> 0 | BU41: 0 | BV41: 0 | BW41: 0 | BX41: 0 | BY41: =SUM(RC[-4]:RC[-1]) -> 0 | BZ41: 0 | CA41: 0 | CB41: 0 | CC41: 0 | CD41: =SUM(RC[-4]:RC[-1]) -> 0 | CE41: 0 | CF41: 0 | CG41: 0 | CH41: 0 | CI41: =SUM(RC[-4]:RC[-1]) -> 0 | CJ41: 0 | CK41: 0 | CL41: 0 | CM41: 0 | CN41: =SUM(RC[-4]:RC[-1]) -> 0 | CO41: 0 | CP41: 0 | CQ41: 0 | CR41: 0 | CS41: =SUM(RC[-4]:RC[-1]) -> 0 | CT41: 0 | CU41: 0 | CV41: 0 | CW41: 0 | CX41: =SUM(RC[-4]:RC[-1]) -> 0 | CY41: 0 | CZ41: 0 | DA41: 0 | DB41: 0 | DC41: =SUM(RC[-4]:RC[-1]) -> 0 | DD41: 0 | DE41: 0 | DF41: 0 | DG41: 0 | DH41: =SUM(RC[-4]:RC[-1]) -> 0 | DI41: 0 | DJ41: 0 | DK41: 0 | DL41: 0 | DM41: =SUM(RC[-4]:RC[-1]) -> 0 | DN41: 0 | DO41: 0 | DP41: 0 | DQ41: 0 | DR41: =SUM(RC[-4]:RC[-1]) -> 0 | DS41: 0 | DT41: 0 | DU41: 0 | DV41: 0 | DW41: =SUM(RC[-4]:RC[-1]) -> 0 | DX41: 0 | DY41: 0 | DZ41: 0 | EA41: 0 | EB41: =SUM(RC[-4]:RC[-1]) -> 0 | EC41: 0 | ED41: 0 | EE41: 0 | EF41: 0 | EG41: =SUM(RC[-4]:RC[-1]) -> 0 | EH41: 0 | EI41: 0 | EJ41: 0 | EK41: 0 | EL41: =SUM(RC[-4]:RC[-1]) -> 0 | EM41: 0 | EN41: 0 | EO41: 0 | EP41: 0 | EQ41: =SUM(RC[-4]:RC[-1]) -> 0 | ER41: 0 | ES41: 0 | ET41: 0 | EU41: 0 | EV41: =SUM(RC[-4]:RC[-1]) -> 0 | EW41: 0 | EX41: 0 | EY41: 0 | EZ41: 0 | FA41: =SUM(RC[-4]:RC[-1]) -> 0 | FB41: 0 | FC41: 0 | FD41: 0 | FE41: 0 | FF41: =SUM(RC[-4]:RC[-1]) -> 0 | FG41: 0 | FH41: 0 | FI41: 0 | FJ41: 0 | FK41: =SUM(RC[-4]:RC[-1]) -> 0 | FL41: 0 | FM41: 0 | FN41: 0 | FO41: 0 | FP41: =SUM(RC[-4]:RC[-1]) -> 0 | FQ41: 0 | FR41: 0 | FS41: 0 | FT41: 0 | FU41: =SUM(RC[-4]:RC[-1]) -> 0 | FV41: 0 | FW41: 0 | FX41: 0 | FY41: 0 | FZ41: =SUM(RC[-4]:RC[-1]) -> 0 | GA41: 0 | GB41: 0 | GC41: 0 | GD41: 0 | GE41: =SUM(RC[-4]:RC[-1]) -> 0 | GF41: 0 | GG41: 0 | GH41: 0 | GI41: 0 | GJ41: =SUM(RC[-4]:RC[-1]) -> 0 | GK41: 0 | GL41: 0 | GM41: 0 | GN41: 0 | GO41: =SUM(RC[-4]:RC[-1]) -> 0 | GP41: 0 | GQ41: 0 | GR41: 0 | GS41: 0 | GT41: =SUM(RC[-4]:RC[-1]) -> 0 | GU41: 0 | GV41: 0 | GW41: 0 | GX41: 0 | GY41: =SUM(RC[-4]:RC[-1]) -> 0 | GZ41: 0 | HA41: 0 | HB41: 0 | HC41: 0 | HD41: =SUM(RC[-4]:RC[-1]) -> 0 | HE41: 0 | HF41: 0 | HG41: 0 | HH41: 0 | HI41: =SUM(RC[-4]:RC[-1]) -> 0 | HJ41: 0 | HK41: 0 | HL41: 0 | HM41: 0 | HN41: =SUM(RC[-4]:RC[-1]) -> 0 | HO41: 0 | HP41: 0 | HQ41: 0 | HR41: 0 | HS41: =SUM(RC[-4]:RC[-1]) -> 0 | HT41: 0 | HU41: 0 | HV41: 0 | HW41: 0 | HX41: =SUM(RC[-4]:RC[-1]) -> 0 | HY41: 0 | HZ41: 0 | IA41: 0 | IB41: 0 | IC41: =SUM(RC[-4]:RC[-1]) -> 0 | ID41: 0 | IE41: 0 | IF41: 0 | IG41: 0 | IH41: =SUM(RC[-4]:RC[-1]) -> 0 | II41: 0 | IJ41: 0 | IK41: 0 | IL41: 0 | IM41: =SUM(RC[-4]:RC[-1]) -> 0
A42: HEXCLBENZENE | B42: =RC[8]+RC[13]+RC[18]+RC[23]+RC[28]+RC[33]+RC[38]+RC[43]+RC[48]+RC[53]+RC[58]+RC[63]+RC[68]+RC[73]+RC[78]+RC[83]+RC[88]+RC[93]+RC[98]+RC[103]+RC[108]+RC[113]+RC[118]+RC[123]+RC[128]+RC[133]+RC[138]+RC[143]+RC[148]+RC[153]+RC[158]+RC[163]+RC[168]+RC[173]+RC[178]+RC[183]+RC[188]+RC[193]+RC[198]+RC[203]+RC[208]+RC[213]+RC[218]+RC[223]+RC[228]+RC[233]+RC[238]+RC[243]+Sheet2!RC[2]+Sheet2!RC[7]+Sheet2!RC[12]+Sheet2!RC[17]+Sheet2!RC[22]+Sheet2!RC[27]+Sheet2!RC[32]+Sheet2!RC[37]+Sheet2!RC[42]+Sheet2!RC[47]+Sheet2!RC[57]+Sheet2!RC[52]+Sheet2!RC[62]+Sheet2!RC[67] -> 0 | C42: =RC[6]+RC[11]+RC[16]+RC[21]+RC[26]+RC[31]+RC[36]+RC[41]+RC[46]+RC[51]+RC[56]+RC[61]+RC[66]+RC[71]+RC[76]+RC[81]+RC[86]+RC[91]+RC[96]+RC[101]+RC[106]+RC[111]+RC[116]+RC[121]+RC[126]+RC[131]+RC[136]+RC[141]+RC[146]+RC[151]+RC[156]+RC[161]+RC[166]+RC[171]+RC[176]+RC[181]+RC[186]+RC[191]+RC[196]+RC[201]+RC[206]+RC[211]+RC[216]+RC[221]+RC[226]+RC[231]+RC[236]+RC[241]+Sheet2!RC+Sheet2!RC[5]+Sheet2!RC[10]+Sheet2!RC[15]+Sheet2!RC[20]+Sheet2!RC[25]+Sheet2!RC[30]+Sheet2!RC[35]+Sheet2!RC[40]+Sheet2!RC[45]+Sheet2!RC[50]+Sheet2!RC[55]+Sheet2!RC[60]+Sheet2!RC[65] -> 0 | D42: =RC[4]+RC[9]+RC[14]+RC[19]+RC[24]+RC[29]+RC[34]+RC[39]+RC[44]+RC[49]+RC[54]+RC[59]+RC[64]+RC[69]+RC[74]+RC[79]+RC[84]+RC[89]+RC[94]+RC[99]+RC[104]+RC[109]+RC[114]+RC[119]+RC[124]+RC[129]+RC[134]+RC[139]+RC[144]+RC[149]+RC[154]+RC[159]+RC[164]+RC[169]+RC[174]+RC[179]+RC[184]+RC[189]+RC[194]+RC[199]+RC[204]+RC[209]+RC[214]+RC[219]+RC[224]+RC[229]+RC[234]+RC[239]+Sheet2!RC[3]+Sheet2!RC[-2]+Sheet2!RC[8]+Sheet2!RC[13]+Sheet2!RC[18]+Sheet2!RC[23]+Sheet2!RC[28]+Sheet2!RC[33]+Sheet2!RC[38]+Sheet2!RC[43]+Sheet2!RC[48]+Sheet2!RC[53]+Sheet2!RC[58]+Sheet2!RC[63] -> 0 | E42: =RC[6]+RC[11]+RC[16]+RC[21]+RC[26]+RC[31]+RC[36]+RC[41]+RC[46]+RC[51]+RC[56]+RC[61]+RC[66]+RC[71]+RC[76]+RC[81]+RC[86]+RC[91]+RC[96]+RC[101]+RC[106]+RC[111]+RC[116]+RC[121]+RC[126]+RC[131]+RC[136]+RC[141]+RC[146]+RC[151]+RC[156]+RC[161]+RC[166]+RC[171]+RC[176]+RC[181]+RC[186]+RC[191]+RC[196]+RC[201]+RC[206]+RC[211]+RC[216]+RC[221]+RC[226]+RC[231]+RC[236]+RC[241]+Sheet2!RC+Sheet2!RC[5]+Sheet2!RC[10]+Sheet2!RC[15]+Sheet2!RC[20]+Sheet2!RC[25]+Sheet2!RC[30]+Sheet2!RC[35]+Sheet2!RC[40]+Sheet2!RC[45]+Sheet2!RC[50]+Sheet2!RC[55]+Sheet2!RC[60]+Sheet2!RC[65] -> 0 | F42: =SUM(RC[-4]:RC[-1]) -> 0 | G42: =Sheet1!RC[5]+Sheet1!RC[10]+Sheet1!RC[15]+Sheet1!RC[20]+Sheet1!RC[25]+Sheet1!RC[30]+Sheet1!RC[35]+Sheet1!RC[40]+Sheet1!RC[45]+Sheet1!RC[50]+Sheet1!RC[55]+Sheet1!RC[60]+Sheet1!RC[65]+Sheet1!RC[70]+Sheet1!RC[75]+Sheet1!RC[80]+Sheet1!RC[85]+Sheet1!RC[90]+Sheet1!RC[95]+Sheet1!RC[100]+Sheet1!RC[105]+Sheet1!RC[110]+Sheet1!RC[115]+Sheet1!RC[120]+Sheet1!RC[125]+Sheet1!RC[130]+Sheet1!RC[135]+Sheet1!RC[140]+Sheet1!RC[145]+Sheet1!RC[150]+Sheet1!RC[155]+Sheet1!RC[160]+Sheet1!RC[165]+Sheet1!RC[170]+Sheet1!RC[175]+Sheet1!RC[180]+Sheet1!RC[185]+Sheet1!RC[190]+Sheet1!RC[195]+Sheet1!RC[200]+Sheet1!RC[205]+Sheet1!RC[210]+Sheet1!RC[215]+Sheet1!RC[220]+Sheet1!RC[225]+Sheet1!RC[230]+Sheet1!RC[235]+Sheet1!RC[240]+Sheet2!RC[-1]+Sheet2!RC[4]+Sheet2!RC[9]+Sheet2!RC[14]+Sheet2!RC[19]+Sheet2!RC[24]+Sheet2!RC[29]+Sheet2!RC[34]+Sheet2!RC[39]+Sheet2!RC[44]+Sheet2!RC[49]+Sheet2!RC[54]+Sheet2!RC[59]+Sheet2!RC[64] -> 0 | H42: 0 | I42: 0 | J42: 0 | K42: 0 | L42: =SUM(RC[-4]:RC[-1]) -> 0 | M42: 0 | N42: 0 | O42: 0 | P42: 0 | Q42: =SUM(RC[-4]:RC[-1]) -> 0 | R42: 0 | S42: 0 | T42: 0 | U42: 0 | V42: =SUM(RC[-4]:RC[-1]) -> 0 | W42: 0 | X42: 0 | Y42: 0 | Z42: 0 | AA42: =SUM(RC[-4]:RC[-1]) -> 0 | AB42: 0 | AC42: 0 | AD42: 0 | AE42: 0 | AF42: =SUM(RC[-4]:RC[-1]) -> 0 | AG42: 0 | AH42: 0 | AI42: 0 | AJ42: 0 | AK42: =SUM(RC[-4]:RC[-1]) -> 0 | AL42: 0 | AM42: 0 | AN42: 0 | AO42: 0 | AP42: =SUM(RC[-4]:RC[-1]) -> 0 | AQ42: 0 | AR42: 0 | AS42: 0 | AT42: 0 | AU42: =SUM(RC[-4]:RC[-1]) -> 0 | AV42: 0 | AW42: 0 | AX42: 0 | AY42: 0 | AZ42: =SUM(RC[-4]:RC[-1]) -> 0 | BA42: 0 | BB42: 0 | BC42: 0 | BD42: 0 | BE42: =SUM(RC[-4]:RC[-1]) -> 0 | BF42: 0 | BG42: 0 | BH42: 0 | BI42: 0 | BJ42: =SUM(RC[-4]:RC[-1]) -> 0 | BK42: 0 | BL42: 0 | BM42: 0 | BN42: 0 | BO42: =SUM(RC[-4]:RC[-1]) -> 0 | BP42: 0 | BQ42: 0 | BR42: 0 | BS42: 0 | BT42: =SUM(RC[-4]:RC[-1]) -> 0 | BU42: 0 | BV42: 0 | BW42: 0 | BX42: 0 | BY42: =SUM(RC[-4]:RC[-1]) -> 0 | BZ42: 0 | CA42: 0 | CB42: 0 | CC42: 0 | CD42: =SUM(RC[-4]:RC[-1]) -> 0 | CE42: 0 | CF42: 0 | CG42: 0 | CH42: 0 | CI42: =SUM(RC[-4]:RC[-1]) -> 0 | CJ42: 0 | CK42: 0 | CL42: 0 | CM42: 0 | CN42: =SUM(RC[-4]:RC[-1]) -> 0 | CO42: 0 | CP42: 0 | CQ42: 0 | CR42: 0 | CS42: =SUM(RC[-4]:RC[-1]) -> 0 | CT42: 0 | CU42: 0 | CV42: 0 | CW42: 0 | CX42: =SUM(RC[-4]:RC[-1]) -> 0 | CY42: 0 | CZ42: 0 | DA42: 0 | DB42: 0 | DC42: =SUM(RC[-4]:RC[-1]) -> 0 | DD42: 0 | DE42: 0 | DF42: 0 | DG42: 0 | DH42: =SUM(RC[-4]:RC[-1]) -> 0 | DI42: 0 | DJ42: 0 | DK42: 0 | DL42: 0 | DM42: =SUM(RC[-4]:RC[-1]) -> 0 | DN42: 0 | DO42: 0 | DP42: 0 | DQ42: 0 | DR42: =SUM(RC[-4]:RC[-1]) -> 0 | DS42: 0 | DT42: 0 | DU42: 0 | DV42: 0 | DW42: =SUM(RC[-4]:RC[-1]) -> 0 | DX42: 0 | DY42: 0 | DZ42: 0 | EA42: 0 | EB42: =SUM(RC[-4]:RC[-1]) -> 0 | EC42: 0 | ED42: 0 | EE42: 0 | EF42: 0 | EG42: =SUM(RC[-4]:RC[-1]) -> 0 | EH42: 0 | EI42: 0 | EJ42: 0 | EK42: 0 | EL42: =SUM(RC[-4]:RC[-1]) -> 0 | EM42: 0 | EN42: 0 | EO42: 0 | EP42: 0 | EQ42: =SUM(RC[-4]:RC[-1]) -> 0 | ER42: 0 | ES42: 0 | ET42: 0 | EU42: 0 | EV42: =SUM(RC[-4]:RC[-1]) -> 0 | EW42: 0 | EX42: 0 | EY42: 0 | EZ42: 0 | FA42: =SUM(RC[-4]:RC[-1]) -> 0 | FB42: 0 | FC42: 0 | FD42: 0 | FE42: 0 | FF42: =SUM(RC[-4]:RC[-1]) -> 0 | FG42: 0 | FH42: 0 | FI42: 0 | FJ42: 0 | FK42: =SUM(RC[-4]:RC[-1]) -> 0 | FL42: 0 | FM42: 0 | FN42: 0 | FO42: 0 | FP42: =SUM(RC[-4]:RC[-1]) -> 0 | FQ42: 0 | FR42: 0 | FS42: 0 | FT42: 0 | FU42: =SUM(RC[-4]:RC[-1]) -> 0 | FV42: 0 | FW42: 0 | FX42: 0 | FY42: 0 | FZ42: =SUM(RC[-4]:RC[-1]) -> 0 | GA42: 0 | GB42: 0 | GC42: 0 | GD42: 0 | GE42: =SUM(RC[-4]:RC[-1]) -> 0 | GF42: 0 | GG42: 0 | GH42: 0 | GI42: 0 | GJ42: =SUM(RC[-4]:RC[-1]) -> 0 | GK42: 0 | GL42: 0 | GM42: 0 | GN42: 0 | GO42: =SUM(RC[-4]:RC[-1]) -> 0 | GP42: 0 | GQ42: 0 | GR42: 0 | GS42: 0 | GT42: =SUM(RC[-4]:RC[-1]) -> 0 | GU42: 0 | GV42: 0 | GW42: 0 | GX42: 0 | GY42: =SUM(RC[-4]:RC[-1]) -> 0 | GZ42: 0 | HA42: 0 | HB42: 0 | HC42: 0 | HD42: =SUM(RC[-4]:RC[-1]) -> 0 | HE42: 0 | HF42: 0 | HG42: 0 | HH42: 0 | HI42: =SUM(RC[-4]:RC[-1]) -> 0 | HJ42: 0 | HK42: 0 | HL42: 0 | HM42: 0 | HN42: =SUM(RC[-4]:RC[-1]) -> 0 | HO42: 0 | HP42: 0 | HQ42: 0 | HR42: 0 | HS42: =SUM(RC[-4]:RC[-1]) -> 0 | HT42: 0 | HU42: 0 | HV42: 0 | HW42: 0 | HX42: =SUM(RC[-4]:RC[-1]) -> 0 | HY42: 0 | HZ42: 0 | IA42: 0 | IB42: 0 | IC42: =SUM(RC[-4]:RC[-1]) -> 0 | ID42: 0 | IE42: 0 | IF42: 0 | IG42: 0 | IH42: =SUM(RC[-4]:RC[-1]) -> 0 | II42: 0 | IJ42: 0 | IK42: 0 | IL42: 0 | IM42: =SUM(RC[-4]:RC[-1]) -> 0
A43: INDN(123CDPY | B43: =RC[8]+RC[13]+RC[18]+RC[23]+RC[28]+RC[33]+RC[38]+RC[43]+RC[48]+RC[53]+RC[58]+RC[63]+RC[68]+RC[73]+RC[78]+RC[83]+RC[88]+RC[93]+RC[98]+RC[103]+RC[108]+RC[113]+RC[118]+RC[123]+RC[128]+RC[133]+RC[138]+RC[143]+RC[148]+RC[153]+RC[158]+RC[163]+RC[168]+RC[173]+RC[178]+RC[183]+RC[188]+RC[193]+RC[198]+RC[203]+RC[208]+RC[213]+RC[218]+RC[223]+RC[228]+RC[233]+RC[238]+RC[243]+Sheet2!RC[2]+Sheet2!RC[7]+Sheet2!RC[12]+Sheet2!RC[17]+Sheet2!RC[22]+Sheet2!RC[27]+Sheet2!RC[32]+Sheet2!RC[37]+Sheet2!RC[42]+Sheet2!RC[47]+Sheet2!RC[57]+Sheet2!RC[52]+Sheet2!RC[62]+Sheet2!RC[67] -> 0 | C43: =RC[6]+RC[11]+RC[16]+RC[21]+RC[26]+RC[31]+RC[36]+RC[41]+RC[46]+RC[51]+RC[56]+RC[61]+RC[66]+RC[71]+RC[76]+RC[81]+RC[86]+RC[91]+RC[96]+RC[101]+RC[106]+RC[111]+RC[116]+RC[121]+RC[126]+RC[131]+RC[136]+RC[141]+RC[146]+RC[151]+RC[156]+RC[161]+RC[166]+RC[171]+RC[176]+RC[181]+RC[186]+RC[191]+RC[196]+RC[201]+RC[206]+RC[211]+RC[216]+RC[221]+RC[226]+RC[231]+RC[236]+RC[241]+Sheet2!RC+Sheet2!RC[5]+Sheet2!RC[10]+Sheet2!RC[15]+Sheet2!RC[20]+Sheet2!RC[25]+Sheet2!RC[30]+Sheet2!RC[35]+Sheet2!RC[40]+Sheet2!RC[45]+Sheet2!RC[50]+Sheet2!RC[55]+Sheet2!RC[60]+Sheet2!RC[65] -> 0.06 | D43: =RC[4]+RC[9]+RC[14]+RC[19]+RC[24]+RC[29]+RC[34]+RC[39]+RC[44]+RC[49]+RC[54]+RC[59]+RC[64]+RC[69]+RC[74]+RC[79]+RC[84]+RC[89]+RC[94]+RC[99]+RC[104]+RC[109]+RC[114]+RC[119]+RC[124]+RC[129]+RC[134]+RC[139]+RC[144]+RC[149]+RC[154]+RC[159]+RC[164]+RC[169]+RC[174]+RC[179]+RC[184]+RC[189]+RC[194]+RC[199]+RC[204]+RC[209]+RC[214]+RC[219]+RC[224]+RC[229]+RC[234]+RC[239]+Sheet2!RC[3]+Sheet2!RC[-2]+Sheet2!RC[8]+Sheet2!RC[13]+Sheet2!RC[18]+Sheet2!RC[23]+Sheet2!RC[28]+Sheet2!RC[33]+Sheet2!RC[38]+Sheet2!RC[43]+Sheet2!RC[48]+Sheet2!RC[53]+Sheet2!RC[58]+Sheet2!RC[63] -> 0 | E43: =RC[6]+RC[11]+RC[16]+RC[21]+RC[26]+RC[31]+RC[36]+RC[41]+RC[46]+RC[51]+RC[56]+RC[61]+RC[66]+RC[71]+RC[76]+RC[81]+RC[86]+RC[91]+RC[96]+RC[101]+RC[106]+RC[111]+RC[116]+RC[121]+RC[126]+RC[131]+RC[136]+RC[141]+RC[146]+RC[151]+RC[156]+RC[161]+RC[166]+RC[171]+RC[176]+RC[181]+RC[186]+RC[191]+RC[196]+RC[201]+RC[206]+RC[211]+RC[216]+RC[221]+RC[226]+RC[231]+RC[236]+RC[241]+Sheet2!RC+Sheet2!RC[5]+Sheet2!RC[10]+Sheet2!RC[15]+Sheet2!RC[20]+Sheet2!RC[25]+Sheet2!RC[30]+Sheet2!RC[35]+Sheet2!RC[40]+Sheet2!RC[45]+Sheet2!RC[50]+Sheet2!RC[55]+Sheet2!RC[60]+Sheet2!RC[65] -> 999247.71627641434 | F43: =SUM(RC[-4]:RC[-1]) -> 999247.7762764144 | G43: =Sheet1!RC[5]+Sheet1!RC[10]+Sheet1!RC[15]+Sheet1!RC[20]+Sheet1!RC[25]+Sheet1!RC[30]+Sheet1!RC[35]+Sheet1!RC[40]+Sheet1!RC[45]+Sheet1!RC[50]+Sheet1!RC[55]+Sheet1!RC[60]+Sheet1!RC[65]+Sheet1!RC[70]+Sheet1!RC[75]+Sheet1!RC[80]+Sheet1!RC[85]+Sheet1!RC[90]+Sheet1!RC[95]+Sheet1!RC[100]+Sheet1!RC[105]+Sheet1!RC[110]+Sheet1!RC[115]+Sheet1!RC[120]+Sheet1!RC[125]+Sheet1!RC[130]+Sheet1!RC[135]+Sheet1!RC[140]+Sheet1!RC[145]+Sheet1!RC[150]+Sheet1!RC[155]+Sheet1!RC[160]+Sheet1!RC[165]+Sheet1!RC[170]+Sheet1!RC[175]+Sheet1!RC[180]+Sheet1!RC[185]+Sheet1!RC[190]+Sheet1!RC[195]+Sheet1!RC[200]+Sheet1!RC[205]+Sheet1!RC[210]+Sheet1!RC[215]+Sheet1!RC[220]+Sheet1!RC[225]+Sheet1!RC[230]+Sheet1!RC[235]+Sheet1!RC[240]+Sheet2!RC[-1]+Sheet2!RC[4]+Sheet2!RC[9]+Sheet2!RC[14]+Sheet2!RC[19]+Sheet2!RC[24]+Sheet2!RC[29]+Sheet2!RC[34]+Sheet2!RC[39]+Sheet2!RC[44]+Sheet2!RC[49]+Sheet2!RC[54]+Sheet2!RC[59]+Sheet2!RC[64] -> 999247.77627641428 | H43: 0 | I43: 0 | J43: 0 | K43: 0.65268169155999978 | L43: =SUM(RC[-4]:RC[-1]) -> 0.65268169155999978 | M43: 0 | N43: 0 | O43: 0 | P43: 0.16897029216040005 | Q43: =SUM(RC[-4]:RC[-1]) -> 0.16897029216040005 | R43: 0 | S43: 0 | T43: 0 | U43: 152356.25755674002 | V43: =SUM(RC[-4]:RC[-1]) -> 152356.25755674002 | W43: 0 | X43: 0 | Y43: 0 | Z43: 0.37811998414699977 | AA43: =SUM(RC[-4]:RC[-1]) -> 0.37811998414699977 | AB43: 0 | AC43: 0 | AD43: 0 | AE43: 0.81164912478119988 | AF43: =SUM(RC[-4]:RC[-1]) -> 0.81164912478119988 | AG43: 0 | AH43: 0 | AI43: 0 | AJ43: 0.17763293513179995 | AK43: =SUM(RC[-4]:RC[-1]) -> 0.17763293513179995 | AL43: 0 | AM43: 0.06 | AN43: 0 | AO43: 0.59210413390119976 | AP43: =SUM(RC[-4]:RC[-1]) -> 0.6521041339011997 | AQ43: 0 | AR43: 0 | AS43: 0 | AT43: 0.13951064731000012 | AU43: =SUM(RC[-4]:RC[-1]) -> 0.13951064731000012 | AV43: 0 | AW43: 0 | AX43: 0 | AY43: 0.22267692450880003 | AZ43: =SUM(RC[-4]:RC[-1]) -> 0.22267692450880003 | BA43: 0 | BB43: 0 | BC43: 0 | BD43: 0.27532439342279996 | BE43: =SUM(RC[-4]:RC[-1]) -> 0.27532439342279996 | BF43: 0 | BG43: 0 | BH43: 0 | BI43: 0.21141215109119996 | BJ43: =SUM(RC[-4]:RC[-1]) -> 0.21141215109119996 | BK43: 0 | BL43: 0 | BM43: 0 | BN43: 0.21455149594919995 | BO43: =SUM(RC[-4]:RC[-1]) -> 0.21455149594919995 | BP43: 0 | BQ43: 0 | BR43: 0 | BS43: 0.31681217210419998 | BT43: =SUM(RC[-4]:RC[-1]) -> 0.31681217210419998 | BU43: 0 | BV43: 0 | BW43: 0 | BX43: 0.64871221060599993 | BY43: =SUM(RC[-4]:RC[-1]) -> 0.64871221060599993 | BZ43: 0 | CA43: 0 | CB43: 0 | CC43: 1.8707097642319996 | CD43: =SUM(RC[-4]:RC[-1]) -> 1.8707097642319996 | CE43: 0 | CF43: 0 | CG43: 0 | CH43: 0.51604471095820026 | CI43: =SUM(RC[-4]:RC[-1]) -> 0.51604471095820026 | CJ43: 0 | CK43: 0 | CL43: 0 | CM43: 0.18799900271160003 | CN43: =SUM(RC[-4]:RC[-1]) -> 0.18799900271160003 | CO43: 0 | CP43: 0 | CQ43: 0 | CR43: 0.15041337484960005 | CS43: =SUM(RC[-4]:RC[-1]) -> 0.15041337484960005 | CT43: 0 | CU43: 0 | CV43: 0 | CW43: 0.13115513236480003 | CX43: =SUM(RC[-4]:RC[-1]) -> 0.13115513236480003 | CY43: 0 | CZ43: 0 | DA43: 0 | DB43: 0.14333571214340002 | DC43: =SUM(RC[-4]:RC[-1]) -> 0.14333571214340002 | DD43: 0 | DE43: 0 | DF43: 0 | DG43: 6.3043314718600002E-2 | DH43: =SUM(RC[-4]:RC[-1]) -> 6.3043314718600002E-2 | DI43: 0 | DJ43: 0 | DK43: 0 | DL43: 0.27094734529180003 | DM43: =SUM(RC[-4]:RC[-1]) -> 0.27094734529180003 | DN43: 0 | DO43: 0 | DP43: 0 | DQ43: 0.1758022575382 | DR43: =SUM(RC[-4]:RC[-1]) -> 0.1758022575382 | DS43: 0 | DT43: 0 | DU43: 0 | DV43: 1.3816655478188 | DW43: =SUM(RC[-4]:RC[-1]) -> 1.3816655478188 | DX43: 0 | DY43: 0 | DZ43: 0 | EA43: 0.15901418857340002 | EB43: =SUM(RC[-4]:RC[-1]) -> 0.15901418857340002 | EC43: 0 | ED43: 0 | EE43: 0 | EF43: 0.14194814227240002 | EG43: =SUM(RC[-4]:RC[-1]) -> 0.14194814227240002 | EH43: 0 | EI43: 0 | EJ43: 0 | EK43: 9.4403503414399986E-2 | EL43: =SUM(RC[-4]:RC[-1]) -> 9.4403503414399986E-2 | EM43: 0 | EN43: 0 | EO43: 0 | EP43: 1.6072608560149997 | EQ43: =SUM(RC[-4]:RC[-1]) -> 1.6072608560149997 | ER43: 0 | ES43: 0 | ET43: 0 | EU43: 8.9289617402199983E-2 | EV43: =SUM(RC[-4]:RC[-1]) -> 8.9289617402199983E-2 | EW43: 0 | EX43: 0 | EY43: 0 | EZ43: 3.0495313774361992 | FA43: =SUM(RC[-4]:RC[-1]) -> 3.0495313774361992 | FB43: 0 | FC43: 0 | FD43: 0 | FE43: 846859.53152810025 | FF43: =SUM(RC[-4]:RC[-1]) -> 846859.53152810025 | FG43: 0 | FH43: 0 | FI43: 0 | FJ43: 0.43254894276600031 | FK43: =SUM(RC[-4]:RC[-1]) -> 0.43254894276600031 | FL43: 0 | FM43: 0 | FN43: 0 | FO43: 0.4881645581502001 | FP43: =SUM(RC[-4]:RC[-1]) -> 0.4881645581502001 | FQ43: 0 | FR43: 0 | FS43: 0 | FT43: 0.97616668304800014 | FU43: =SUM(RC[-4]:RC[-1]) -> 0.97616668304800014 | FV43: 0 | FW43: 0 | FX43: 0 | FY43: 0.24211186178280003 | FZ43: =SUM(RC[-4]:RC[-1]) -> 0.24211186178280003 | GA43: 0 | GB43: 0 | GC43: 0 | GD43: 0.58910396378699958 | GE43: =SUM(RC[-4]:RC[-1]) -> 0.58910396378699958 | GF43: 0 | GG43: 0 | GH43: 0 | GI43: 7.2774343784200002E-2 | GJ43: =SUM(RC[-4]:RC[-1]) -> 7.2774343784200002E-2 | GK43: 0 | GL43: 0 | GM43: 0 | GN43: 0.29718115468159995 | GO43: =SUM(RC[-4]:RC[-1]) -> 0.29718115468159995 | GP43: 0 | GQ43: 0 | GR43: 0 | GS43: 0.22980286491860005 | GT43: =SUM(RC[-4]:RC[-1]) -> 0.22980286491860005 | GU43: 0 | GV43: 0 | GW43: 0 | GX43: 0.22984277950939991 | GY43: =SUM(RC[-4]:RC[-1]) -> 0.22984277950939991 | GZ43: 0 | HA43: 0 | HB43: 0 | HC43: 1.5368249141450001 | HD43: =SUM(RC[-4]:RC[-1]) -> 1.5368249141450001 | HE43: 0 | HF43: 0 | HG43: 0 | HH43: 0.30198048550599993 | HI43: =SUM(RC[-4]:RC[-1]) -> 0.30198048550599993 | HJ43: 0 | HK43: 0 | HL43: 0 | HM43: 0.51551612311599981 | HN43: =SUM(RC[-4]:RC[-1]) -> 0.51551612311599981 | HO43: 0 | HP43: 0 | HQ43: 0 | HR43: 0.67259861752900008 | HS43: =SUM(RC[-4]:RC[-1]) -> 0.67259861752900008 | HT43: 0 | HU43: 0 | HV43: 0 | HW43: 0.26295103090800004 | HX43: =SUM(RC[-4]:RC[-1]) -> 0.26295103090800004 | HY43: 0 | HZ43: 0 | IA43: 0 | IB43: 0.42685220190999984 | IC43: =SUM(RC[-4]:RC[-1]) -> 0.42685220190999984 | ID43: 0 | IE43: 0 | IF43: 0 | IG43: 0.21686757546240001 | IH43: =SUM(RC[-4]:RC[-1]) -> 0.21686757546240001 | II43: 0 | IJ43: 0 | IK43: 0 | IL43: 4.1656861847199994E-2 | IM43: =SUM(RC[-4]:RC[-1]) -> 4.1656861847199994E-2
A44: LEAD | B44: =RC[8]+RC[13]+RC[18]+RC[23]+RC[28]+RC[33]+RC[38]+RC[43]+RC[48]+RC[53]+RC[58]+RC[63]+RC[68]+RC[73]+RC[78]+RC[83]+RC[88]+RC[93]+RC[98]+RC[103]+RC[108]+RC[113]+RC[118]+RC[123]+RC[128]+RC[133]+RC[138]+RC[143]+RC[148]+RC[153]+RC[158]+RC[163]+RC[168]+RC[173]+RC[178]+RC[183]+RC[188]+RC[193]+RC[198]+RC[203]+RC[208]+RC[213]+RC[218]+RC[223]+RC[228]+RC[233]+RC[238]+RC[243]+Sheet2!RC[2]+Sheet2!RC[7]+Sheet2!RC[12]+Sheet2!RC[17]+Sheet2!RC[22]+Sheet2!RC[27]+Sheet2!RC[32]+Sheet2!RC[37]+Sheet2!RC[42]+Sheet2!RC[47]+Sheet2!RC[57]+Sheet2!RC[52]+Sheet2!RC[62]+Sheet2!RC[67] -> 62330.560999999987 | C44: =RC[6]+RC[11]+RC[16]+RC[21]+RC[26]+RC[31]+RC[36]+RC[41]+RC[46]+RC[51]+RC[56]+RC[61]+RC[66]+RC[71]+RC[76]+RC[81]+RC[86]+RC[91]+RC[96]+RC[101]+RC[106]+RC[111]+RC[116]+RC[121]+RC[126]+RC[131]+RC[136]+RC[141]+RC[146]+RC[151]+RC[156]+RC[161]+RC[166]+RC[171]+RC[176]+RC[181]+RC[186]+RC[191]+RC[196]+RC[201]+RC[206]+RC[211]+RC[216]+RC[221]+RC[226]+RC[231]+RC[236]+RC[241]+Sheet2!RC+Sheet2!RC[5]+Sheet2!RC[10]+Sheet2!RC[15]+Sheet2!RC[20]+Sheet2!RC[25]+Sheet2!RC[30]+Sheet2!RC[35]+Sheet2!RC[40]+Sheet2!RC[45]+Sheet2!RC[50]+Sheet2!RC[55]+Sheet2!RC[60]+Sheet2!RC[65] -> 10.291762999999994 | D44: =RC[4]+RC[9]+RC[14]+RC[19]+RC[24]+RC[29]+RC[34]+RC[39]+RC[44]+RC[49]+RC[54]+RC[59]+RC[64]+RC[69]+RC[74]+RC[79]+RC[84]+RC[89]+RC[94]+RC[99]+RC[104]+RC[109]+RC[114]+RC[119]+RC[124]+RC[129]+RC[134]+RC[139]+RC[144]+RC[149]+RC[154]+RC[159]+RC[164]+RC[169]+RC[174]+RC[179]+RC[184]+RC[189]+RC[194]+RC[199]+RC[204]+RC[209]+RC[214]+RC[219]+RC[224]+RC[229]+RC[234]+RC[239]+Sheet2!RC[3]+Sheet2!RC[-2]+Sheet2!RC[8]+Sheet2!RC[13]+Sheet2!RC[18]+Sheet2!RC[23]+Sheet2!RC[28]+Sheet2!RC[33]+Sheet2!RC[38]+Sheet2!RC[43]+Sheet2!RC[48]+Sheet2!RC[53]+Sheet2!RC[58]+Sheet2!RC[63] -> 19569 | E44: =RC[6]+RC[11]+RC[16]+RC[21]+RC[26]+RC[31]+RC[36]+RC[41]+RC[46]+RC[51]+RC[56]+RC[61]+RC[66]+RC[71]+RC[76]+RC[81]+RC[86]+RC[91]+RC[96]+RC[101]+RC[106]+RC[111]+RC[116]+RC[121]+RC[126]+RC[131]+RC[136]+RC[141]+RC[146]+RC[151]+RC[156]+RC[161]+RC[166]+RC[171]+RC[176]+RC[181]+RC[186]+RC[191]+RC[196]+RC[201]+RC[206]+RC[211]+RC[216]+RC[221]+RC[226]+RC[231]+RC[236]+RC[241]+Sheet2!RC+Sheet2!RC[5]+Sheet2!RC[10]+Sheet2!RC[15]+Sheet2!RC[20]+Sheet2!RC[25]+Sheet2!RC[30]+Sheet2!RC[35]+Sheet2!RC[40]+Sheet2!RC[45]+Sheet2!RC[50]+Sheet2!RC[55]+Sheet2!RC[60]+Sheet2!RC[65] -> 199.31373682212705 | F44: =SUM(RC[-4]:RC[-1]) -> 82109.166499822109 | G44: =Sheet1!RC[5]+Sheet1!RC[10]+Sheet1!RC[15]+Sheet1!RC[20]+Sheet1!RC[25]+Sheet1!RC[30]+Sheet1!RC[35]+Sheet1!RC[40]+Sheet1!RC[45]+Sheet1!RC[50]+Sheet1!RC[55]+Sheet1!RC[60]+Sheet1!RC[65]+Sheet1!RC[70]+Sheet1!RC[75]+Sheet1!RC[80]+Sheet1!RC[85]+Sheet1!RC[90]+Sheet1!RC[95]+Sheet1!RC[100]+Sheet1!RC[105]+Sheet1!RC[110]+Sheet1!RC[115]+Sheet1!RC[120]+Sheet1!RC[125]+Sheet1!RC[130]+Sheet1!RC[135]+Sheet1!RC[140]+Sheet1!RC[145]+Sheet1!RC[150]+Sheet1!RC[155]+Sheet1!RC[160]+Sheet1!RC[165]+Sheet1!RC[170]+Sheet1!RC[175]+Sheet1!RC[180]+Sheet1!RC[185]+Sheet1!RC[190]+Sheet1!RC[195]+Sheet1!RC[200]+Sheet1!RC[205]+Sheet1!RC[210]+Sheet1!RC[215]+Sheet1!RC[220]+Sheet1!RC[225]+Sheet1!RC[230]+Sheet1!RC[235]+Sheet1!RC[240]+Sheet2!RC[-1]+Sheet2!RC[4]+Sheet2!RC[9]+Sheet2!RC[14]+Sheet2!RC[19]+Sheet2!RC[24]+Sheet2!RC[29]+Sheet2!RC[34]+Sheet2!RC[39]+Sheet2!RC[44]+Sheet2!RC[49]+Sheet2!RC[54]+Sheet2!RC[59]+Sheet2!RC[64] -> 82109.166499822124 | H44: 544 | I44: 0.14000000000000001 | J44: 6128.67 | K44: 46.948 | L44: =SUM(RC[-4]:RC[-1]) -> 6719.7580000000007 | M44: 97 | N44: 1.763E-2 | O44: 0.61 | P44: 0 | Q44: =SUM(RC[-4]:RC[-1]) -> 97.627629999999996 | R44: 507 | S44: 1.175 | T44: 77.17 | U44: 0.49418792908699988 | V44: =SUM(RC[-4]:RC[-1]) -> 585.83918792908707 | W44: 381 | X44: 0 | Y44: 387.91 | Z44: 0 | AA44: =SUM(RC[-4]:RC[-1]) -> 768.91000000000008 | AB44: 146 | AC44: 0.03 | AD44: 2E-3 | AE44: 0 | AF44: =SUM(RC[-4]:RC[-1]) -> 146.03200000000001 | AG44: 127 | AH44: 0.03 | AI44: 738.04 | AJ44: 2.09 | AK44: =SUM(RC[-4]:RC[-1]) -> 867.16 | AL44: 294 | AM44: 0 | AN44: 1450.49 | AO44: 6.93 | AP44: =SUM(RC[-4]:RC[-1]) -> 1751.42 | AQ44: 147 | AR44: 0.04 | AS44: 532.45000000000005 | AT44: 8.5570615999999919 | AU44: =SUM(RC[-4]:RC[-1]) -> 688.04706160000001 | AV44: 89 | AW44: 1.4E-2 | AX44: 5.89 | AY44: 9.942916600000002 | AZ44: =SUM(RC[-4]:RC[-1]) -> 104.8469166 | BA44: 163 | BB44: 3.1E-2 | BC44: 3.081 | BD44: 0 | BE44: =SUM(RC[-4]:RC[-1]) -> 166.11199999999999 | BF44: 125 | BG44: 0.02 | BH44: 0.23 | BI44: 9.6579999999999995 | BJ44: =SUM(RC[-4]:RC[-1]) -> 134.90799999999999 | BK44: 113 | BL44: 0 | BM44: 16.2 | BN44: 0 | BO44: =SUM(RC[-4]:RC[-1]) -> 129.19999999999999 | BP44: 103 | BQ44: 0.02 | BR44: 65.319999999999993 | BS44: 0 | BT44: =SUM(RC[-4]:RC[-1]) -> 168.33999999999997 | BU44: 369 | BV44: 0.09 | BW44: 64.849999999999994 | BX44: 4.3999999999999997E-2 | BY44: =SUM(RC[-4]:RC[-1]) -> 433.98399999999992 | BZ44: 1292 | CA44: 0.50700000000000001 | CB44: 6376.15 | CC44: 23.495999999999999 | CD44: =SUM(RC[-4]:RC[-1]) -> 7692.1529999999993 | CE44: 114 | CF44: 0.01 | CG44: 341.11 | CH44: 0 | CI44: =SUM(RC[-4]:RC[-1]) -> 455.12 | CJ44: 77 | CK44: 0.04 | CL44: 0 | CM44: 0.13200000000000001 | CN44: =SUM(RC[-4]:RC[-1]) -> 77.172000000000011 | CO44: 63 | CP44: 1.9E-2 | CQ44: 1E-3 | CR44: 0 | CS44: =SUM(RC[-4]:RC[-1]) -> 63.019999999999996 | CT44: 203 | CU44: 0.02 | CV44: 3.93 | CW44: 0 | CX44: =SUM(RC[-4]:RC[-1]) -> 206.95000000000002 | CY44: 144 | CZ44: 0.02 | DA44: 4371.7700000000004 | DB44: 2.1999999999999999E-2 | DC44: =SUM(RC[-4]:RC[-1]) -> 4515.8120000000008 | DD44: 25 | DE44: 2.0999999999999999E-3 | DF44: 0 | DG44: 0 | DH44: =SUM(RC[-4]:RC[-1]) -> 25.002099999999999 | DI44: 134 | DJ44: 0.02 | DK44: 30.61 | DL44: 0 | DM44: =SUM(RC[-4]:RC[-1]) -> 164.63 | DN44: 245 | DO44: 0.03 | DP44: 219.09 | DQ44: 0.13200000000000001 | DR44: =SUM(RC[-4]:RC[-1]) -> 464.25200000000001 | DS44: 701 | DT44: 2.2323 | DU44: 258.07 | DV44: 3.85 | DW44: =SUM(RC[-4]:RC[-1]) -> 965.15230000000008 | DX44: 45 | DY44: 0.01 | DZ44: 38.229999999999997 | EA44: 0 | EB44: =SUM(RC[-4]:RC[-1]) -> 83.24 | EC44: 147 | ED44: 0.02 | EE44: 7.6669999999999998 | EF44: 0 | EG44: =SUM(RC[-4]:RC[-1]) -> 154.68700000000001 | EH44: 141 | EI44: 0.02 | EJ44: 0 | EK44: 0 | EL44: =SUM(RC[-4]:RC[-1]) -> 141.02000000000001 | EM44: 879 | EN44: 0.26 | EO44: 1833.8 | EP44: 2.1999999999999999E-2 | EQ44: =SUM(RC[-4]:RC[-1]) -> 2713.0819999999999 | ER44: 154 | ES44: 7.0000000000000001E-3 | ET44: 1042.43 | EU44: 0 | EV44: =SUM(RC[-4]:RC[-1]) -> 1196.4370000000001 | EW44: 1716 | EX44: 0.14000000000000001 | EY44: 1548.2 | EZ44: 2.266 | FA44: =SUM(RC[-4]:RC[-1]) -> 3266.6060000000002 | FB44: 431 | FC44: 1.5269999999999999 | FD44: 254.43 | FE44: 2.8015706930399982 | FF44: =SUM(RC[-4]:RC[-1]) -> 689.75857069304004 | FG44: 232 | FH44: 0.08 | FI44: 11798.53 | FJ44: 2.1339999999999999 | FK44: =SUM(RC[-4]:RC[-1]) -> 12032.744000000001 | FL44: 362 | FM44: 0.10199999999999999 | FN44: 377.6 | FO44: 2.31 | FP44: =SUM(RC[-4]:RC[-1]) -> 742.01199999999994 | FQ44: 639 | FR44: 0.26 | FS44: 221.2 | FT44: 0 | FU44: =SUM(RC[-4]:RC[-1]) -> 860.46 | FV44: 219 | FW44: 0.02 | FX44: 975.43 | FY44: 0 | FZ44: =SUM(RC[-4]:RC[-1]) -> 1194.45 | GA44: 179 | GB44: 0.11 | GC44: 641.34 | GD44: 12.1 | GE44: =SUM(RC[-4]:RC[-1]) -> 832.55000000000007 | GF44: 55 | GG44: 0.02 | GH44: 0.36 | GI44: 2.09 | GJ44: =SUM(RC[-4]:RC[-1]) -> 57.47 | GK44: 192 | GL44: 0.03 | GM44: 1014.52 | GN44: 2.1560000000000001 | GO44: =SUM(RC[-4]:RC[-1]) -> 1208.7059999999999 | GP44: 133 | GQ44: 1.7999999999999999E-2 | GR44: 7.0000000000000007E-2 | GS44: 0 | GT44: =SUM(RC[-4]:RC[-1]) -> 133.08799999999999 | GU44: 180 | GV44: 1.2E-2 | GW44: 0 | GX44: 12.1 | GY44: =SUM(RC[-4]:RC[-1]) -> 192.11199999999999 | GZ44: 1008 | HA44: 1.9 | HB44: 398.24 | HC44: 6.2039999999999997 | HD44: =SUM(RC[-4]:RC[-1]) -> 1414.3439999999998 | HE44: 216 | HF44: 0.09 | HG44: 6.26 | HH44: 4.07 | HI44: =SUM(RC[-4]:RC[-1]) -> 226.42 | HJ44: 350 | HK44: 0.4 | HL44: 1172 | HM44: 2.1999999999999999E-2 | HN44: =SUM(RC[-4]:RC[-1]) -> 1522.422 | HO44: 391 | HP44: 0.03 | HQ44: 984.77 | HR44: 12.496 | HS44: =SUM(RC[-4]:RC[-1]) -> 1388.296 | HT44: 333 | HU44: 0.04 | HV44: 60.64 | HW44: 0.13200000000000001 | HX44: =SUM(RC[-4]:RC[-1]) -> 393.81200000000001 | HY44: 197 | HZ44: 1.7999999999999999E-2 | IA44: 35.75 | IB44: 0.63800000000000001 | IC44: =SUM(RC[-4]:RC[-1]) -> 233.40600000000001 | ID44: 69 | IE44: 8.0000000000000002E-3 | IF44: 0.05 | IG44: 0 | IH44: =SUM(RC[-4]:RC[-1]) -> 69.057999999999993 | II44: 34 | IJ44: 8.9999999999999993E-3 | IK44: 794 | IL44: 0 | IM44: =SUM(RC[-4]:RC[-1]) -> 828.00900000000001
A45: MANGANESE | B45: =RC[8]+RC[13]+RC[18]+RC[23]+RC[28]+RC[33]+RC[38]+RC[43]+RC[48]+RC[53]+RC[58]+RC[63]+RC[68]+RC[73]+RC[78]+RC[83]+RC[88]+RC[93]+RC[98]+RC[103]+RC[108]+RC[113]+RC[118]+RC[123]+RC[128]+RC[133]+RC[138]+RC[143]+RC[148]+RC[153]+RC[158]+RC[163]+RC[168]+RC[173]+RC[178]+RC[183]+RC[188]+RC[193]+RC[198]+RC[203]+RC[208]+RC[213]+RC[218]+RC[223]+RC[228]+RC[233]+RC[238]+RC[243]+Sheet2!RC[2]+Sheet2!RC[7]+Sheet2!RC[12]+Sheet2!RC[17]+Sheet2!RC[22]+Sheet2!RC[27]+Sheet2!RC[32]+Sheet2!RC[37]+Sheet2!RC[42]+Sheet2!RC[47]+Sheet2!RC[57]+Sheet2!RC[52]+Sheet2!RC[62]+Sheet2!RC[67] -> 14788.724 | C45: =RC[6]+RC[11]+RC[16]+RC[21]+RC[26]+RC[31]+RC[36]+RC[41]+RC[46]+RC[51]+RC[56]+RC[61]+RC[66]+RC[71]+RC[76]+RC[81]+RC[86]+RC[91]+RC[96]+RC[101]+RC[106]+RC[111]+RC[116]+RC[121]+RC[126]+RC[131]+RC[136]+RC[141]+RC[146]+RC[151]+RC[156]+RC[161]+RC[166]+RC[171]+RC[176]+RC[181]+RC[186]+RC[191]+RC[196]+RC[201]+RC[206]+RC[211]+RC[216]+RC[221]+RC[226]+RC[231]+RC[236]+RC[241]+Sheet2!RC+Sheet2!RC[5]+Sheet2!RC[10]+Sheet2!RC[15]+Sheet2!RC[20]+Sheet2!RC[25]+Sheet2!RC[30]+Sheet2!RC[35]+Sheet2!RC[40]+Sheet2!RC[45]+Sheet2!RC[50]+Sheet2!RC[55]+Sheet2!RC[60]+Sheet2!RC[65] -> 196.36039999999997 | D45: =RC[4]+RC[9]+RC[14]+RC[19]+RC[24]+RC[29]+RC[34]+RC[39]+RC[44]+RC[49]+RC[54]+RC[59]+RC[64]+RC[69]+RC[74]+RC[79]+RC[84]+RC[89]+RC[94]+RC[99]+RC[104]+RC[109]+RC[114]+RC[119]+RC[124]+RC[129]+RC[134]+RC[139]+RC[144]+RC[149]+RC[154]+RC[159]+RC[164]+RC[169]+RC[174]+RC[179]+RC[184]+RC[189]+RC[194]+RC[199]+RC[204]+RC[209]+RC[214]+RC[219]+RC[224]+RC[229]+RC[234]+RC[239]+Sheet2!RC[3]+Sheet2!RC[-2]+Sheet2!RC[8]+Sheet2!RC[13]+Sheet2!RC[18]+Sheet2!RC[23]+Sheet2!RC[28]+Sheet2!RC[33]+Sheet2!RC[38]+Sheet2!RC[43]+Sheet2!RC[48]+Sheet2!RC[53]+Sheet2!RC[58]+Sheet2!RC[63] -> 717 | E45: =RC[6]+RC[11]+RC[16]+RC[21]+RC[26]+RC[31]+RC[36]+RC[41]+RC[46]+RC[51]+RC[56]+RC[61]+RC[66]+RC[71]+RC[76]+RC[81]+RC[86]+RC[91]+RC[96]+RC[101]+RC[106]+RC[111]+RC[116]+RC[121]+RC[126]+RC[131]+RC[136]+RC[141]+RC[146]+RC[151]+RC[156]+RC[161]+RC[166]+RC[171]+RC[176]+RC[181]+RC[186]+RC[191]+RC[196]+RC[201]+RC[206]+RC[211]+RC[216]+RC[221]+RC[226]+RC[231]+RC[236]+RC[241]+Sheet2!RC+Sheet2!RC[5]+Sheet2!RC[10]+Sheet2!RC[15]+Sheet2!RC[20]+Sheet2!RC[25]+Sheet2!RC[30]+Sheet2!RC[35]+Sheet2!RC[40]+Sheet2!RC[45]+Sheet2!RC[50]+Sheet2!RC[55]+Sheet2!RC[60]+Sheet2!RC[65] -> 1563.2564216999999 | F45: =SUM(RC[-4]:RC[-1]) -> 17265.3408217 | G45: =Sheet1!RC[5]+Sheet1!RC[10]+Sheet1!RC[15]+Sheet1!RC[20]+Sheet1!RC[25]+Sheet1!RC[30]+Sheet1!RC[35]+Sheet1!RC[40]+Sheet1!RC[45]+Sheet1!RC[50]+Sheet1!RC[55]+Sheet1!RC[60]+Sheet1!RC[65]+Sheet1!RC[70]+Sheet1!RC[75]+Sheet1!RC[80]+Sheet1!RC[85]+Sheet1!RC[90]+Sheet1!RC[95]+Sheet1!RC[100]+Sheet1!RC[105]+Sheet1!RC[110]+Sheet1!RC[115]+Sheet1!RC[120]+Sheet1!RC[125]+Sheet1!RC[130]+Sheet1!RC[135]+Sheet1!RC[140]+Sheet1!RC[145]+Sheet1!RC[150]+Sheet1!RC[155]+Sheet1!RC[160]+Sheet1!RC[165]+Sheet1!RC[170]+Sheet1!RC[175]+Sheet1!RC[180]+Sheet1!RC[185]+Sheet1!RC[190]+Sheet1!RC[195]+Sheet1!RC[200]+Sheet1!RC[205]+Sheet1!RC[210]+Sheet1!RC[215]+Sheet1!RC[220]+Sheet1!RC[225]+Sheet1!RC[230]+Sheet1!RC[235]+Sheet1!RC[240]+Sheet2!RC[-1]+Sheet2!RC[4]+Sheet2!RC[9]+Sheet2!RC[14]+Sheet2!RC[19]+Sheet2!RC[24]+Sheet2!RC[29]+Sheet2!RC[34]+Sheet2!RC[39]+Sheet2!RC[44]+Sheet2!RC[49]+Sheet2!RC[54]+Sheet2!RC[59]+Sheet2!RC[64] -> 17265.340821699996 | H45: 20 | I45: 1.9279999999999999 | J45: 834.5 | K45: 56.039548500000009 | L45: =SUM(RC[-4]:RC[-1]) -> 912.46754850000002 | M45: 19 | N45: 0.23799999999999999 | O45: 0.61 | P45: 7.025382600000003 | Q45: =SUM(RC[-4]:RC[-1]) -> 26.873382600000003 | R45: 19 | S45: 15.86 | T45: 43.93 | U45: 2.1339999999999999 | V45: =SUM(RC[-4]:RC[-1]) -> 80.923999999999992 | W45: 12 | X45: 0.84840000000000004 | Y45: 40.08 | Z45: 15.174091099999997 | AA45: =SUM(RC[-4]:RC[-1]) -> 68.102491099999995 | AB45: 5 | AC45: 0.42 | AD45: 2E-3 | AE45: 27.744491000000004 | AF45: =SUM(RC[-4]:RC[-1]) -> 33.166491000000001 | AG45: 5 | AH45: 0.5 | AI45: 425.73 | AJ45: 11.105950399999998 | AK45: =SUM(RC[-4]:RC[-1]) -> 442.3359504 | AL45: 9 | AM45: 0.92 | AN45: 335.01 | AO45: 26.154438199999994 | AP45: =SUM(RC[-4]:RC[-1]) -> 371.08443820000002 | AQ45: 5 | AR45: 0.62 | AS45: 9.57 | AT45: 2.2229140000000007 | AU45: =SUM(RC[-4]:RC[-1]) -> 17.412914000000001 | AV45: 3 | AW45: 0.20100000000000001 | AX45: 43.68 | AY45: 1.9953728000000002 | AZ45: =SUM(RC[-4]:RC[-1]) -> 48.876372799999999 | BA45: 5 | BB45: 0.42899999999999999 | BC45: 5.03 | BD45: 10.538853599999989 | BE45: =SUM(RC[-4]:RC[-1]) -> 20.997853599999988 | BF45: 5 | BG45: 0.35499999999999998 | BH45: 0.94 | BI45: 10.2920345 | BJ45: =SUM(RC[-4]:RC[-1]) -> 16.587034500000001 | BK45: 4 | BL45: 0.06 | BM45: 10.210000000000001 | BN45: 8.8777478999999975 | BO45: =SUM(RC[-4]:RC[-1]) -> 23.147747899999999 | BP45: 3 | BQ45: 0.308 | BR45: 36.9 | BS45: 10.87656 | BT45: =SUM(RC[-4]:RC[-1]) -> 51.084559999999996 | BU45: 14 | BV45: 1.27 | BW45: 10.31 | BX45: 26.36691840000001 | BY45: =SUM(RC[-4]:RC[-1]) -> 51.946918400000008 | BZ45: 46 | CA45: 6.84 | CB45: 1095.08 | CC45: 101.65082739999997 | CD45: =SUM(RC[-4]:RC[-1]) -> 1249.5708273999999 | CE45: 4 | CF45: 0.25 | CG45: 49.2 | CH45: 12.226003600000002 | CI45: =SUM(RC[-4]:RC[-1]) -> 65.676003600000001 | CJ45: 3 | CK45: 0.59 | CL45: 0 | CM45: 6.5780711000000016 | CN45: =SUM(RC[-4]:RC[-1]) -> 10.168071100000002 | CO45: 2 | CP45: 0.25 | CQ45: 1E-3 | CR45: 6.0663642999999974 | CS45: =SUM(RC[-4]:RC[-1]) -> 8.3173642999999977 | CT45: 7 | CU45: 0.28999999999999998 | CV45: 3.93 | CW45: 6.8389764 | CX45: =SUM(RC[-4]:RC[-1]) -> 18.058976399999999 | CY45: 5 | CZ45: 0.35499999999999998 | DA45: 3060.93 | DB45: 3.4879713999999993 | DC45: =SUM(RC[-4]:RC[-1]) -> 3069.7729713999997 | DD45: 1 | DE45: 0.03 | DF45: 0 | DG45: 0.84503539999999999 | DH45: =SUM(RC[-4]:RC[-1]) -> 1.8750354 | DI45: 5 | DJ45: 0.3 | DK45: 7.26 | DL45: 10.534384899999999 | DM45: =SUM(RC[-4]:RC[-1]) -> 23.094384899999998 | DN45: 7 | DO45: 0.85 | DP45: 86.105000000000004 | DQ45: 12.824439600000003 | DR45: =SUM(RC[-4]:RC[-1]) -> 106.7794396 | DS45: 26 | DT45: 30.137 | DU45: 60.81 | DV45: 99.883803200000003 | DW45: =SUM(RC[-4]:RC[-1]) -> 216.83080319999999 | DX45: 2 | DY45: 0.21099999999999999 | DZ45: 5.79 | EA45: 6.9528030000000047 | EB45: =SUM(RC[-4]:RC[-1]) -> 14.953803000000004 | EC45: 5 | ED45: 0.3 | EE45: 3.51 | EF45: 7.1784608999999993 | EG45: =SUM(RC[-4]:RC[-1]) -> 15.988460899999998 | EH45: 5 | EI45: 0.39 | EJ45: 0 | EK45: 6.3022739999999997 | EL45: =SUM(RC[-4]:RC[-1]) -> 11.692273999999999 | EM45: 36 | EN45: 3.53 | EO45: 266.25 | EP45: 91.942642600000042 | EQ45: =SUM(RC[-4]:RC[-1]) -> 397.72264260000003 | ER45: 5 | ES45: 0.1 | ET45: 143.83000000000001 | EU45: 5.1351478000000013 | EV45: =SUM(RC[-4]:RC[-1]) -> 154.06514780000001 | EW45: 61 | EX45: 1.91 | EY45: 228.5 | EZ45: 107.24120130000001 | FA45: =SUM(RC[-4]:RC[-1]) -> 398.65120129999997 | FB45: 16 | FC45: 20.6 | FD45: 171.20500000000001 | FE45: 2.09 | FF45: =SUM(RC[-4]:RC[-1]) -> 209.89500000000001 | FG45: 9 | FH45: 1.1060000000000001 | FI45: 2828.31 | FJ45: 22.228792599999995 | FK45: =SUM(RC[-4]:RC[-1]) -> 2860.6447926000001 | FL45: 13 | FM45: 1.38 | FN45: 133.80000000000001 | FO45: 21.289137199999992 | FP45: =SUM(RC[-4]:RC[-1]) -> 169.46913720000001 | FQ45: 24 | FR45: 3.55 | FS45: 194.4 | FT45: 46.683451000000005 | FU45: =SUM(RC[-4]:RC[-1]) -> 268.63345100000004 | FV45: 8 | FW45: 0.3 | FX45: 70.161000000000001 | FY45: 15.327382199999999 | FZ45: =SUM(RC[-4]:RC[-1]) -> 93.788382200000001 | GA45: 6 | GB45: 1.59 | GC45: 245.85 | GD45: 42.793469900000019 | GE45: =SUM(RC[-4]:RC[-1]) -> 296.23346990000005 | GF45: 2 | GG45: 0.33 | GH45: 0.36 | GI45: 5.6140003999999966 | GJ45: =SUM(RC[-4]:RC[-1]) -> 8.3040003999999961 | GK45: 7 | GL45: 0.52 | GM45: 485.15 | GN45: 12.077258999999998 | GO45: =SUM(RC[-4]:RC[-1]) -> 504.74725899999999 | GP45: 4 | GQ45: 0.25 | GR45: 7.0000000000000007E-2 | GS45: 8.4553433000000027 | GT45: =SUM(RC[-4]:RC[-1]) -> 12.775343300000003 | GU45: 6 | GV45: 0.17 | GW45: 0 | GX45: 12.859510799999995 | GY45: =SUM(RC[-4]:RC[-1]) -> 19.029510799999997 | GZ45: 38 | HA45: 26.57 | HB45: 496.66 | HC45: 147.59209600000003 | HD45: =SUM(RC[-4]:RC[-1]) -> 708.8220960000001 | HE45: 8 | HF45: 1.28 | HG45: 12.57 | HH45: 15.804897200000001 | HI45: =SUM(RC[-4]:RC[-1]) -> 37.654897200000001 | HJ45: 13 | HK45: 5.48 | HL45: 245.25 | HM45: 34.0954099 | HN45: =SUM(RC[-4]:RC[-1]) -> 297.82540990000001 | HO45: 14 | HP45: 53 | HQ45: 145.07 | HR45: 32.231065900000011 | HS45: =SUM(RC[-4]:RC[-1]) -> 244.3010659 | HT45: 12 | HU45: 0.67 | HV45: 102.62 | HW45: 13.869351500000002 | HX45: =SUM(RC[-4]:RC[-1]) -> 129.15935150000001 | HY45: 7 | HZ45: 0.24399999999999999 | IA45: 109.22 | IB45: 23.227548500000001 | IC45: =SUM(RC[-4]:RC[-1]) -> 139.69154850000001 | ID45: 2 | IE45: 0.12 | IF45: 0.05 | IG45: 10.160483800000002 | IH45: =SUM(RC[-4]:RC[-1]) -> 12.330483800000001 | II45: 1 | IJ45: 0.127 | IK45: 287 | IL45: 2.7388257999999994 | IM45: =SUM(RC[-4]:RC[-1]) -> 290.86582579999998
A46: MERCURY | B46: =RC[8]+RC[13]+RC[18]+RC[23]+RC[28]+RC[33]+RC[38]+RC[43]+RC[48]+RC[53]+RC[58]+RC[63]+RC[68]+RC[73]+RC[78]+RC[83]+RC[88]+RC[93]+RC[98]+RC[103]+RC[108]+RC[113]+RC[118]+RC[123]+RC[128]+RC[133]+RC[138]+RC[143]+RC[148]+RC[153]+RC[158]+RC[163]+RC[168]+RC[173]+RC[178]+RC[183]+RC[188]+RC[193]+RC[198]+RC[203]+RC[208]+RC[213]+RC[218]+RC[223]+RC[228]+RC[233]+RC[238]+RC[243]+Sheet2!RC[2]+Sheet2!RC[7]+Sheet2!RC[12]+Sheet2!RC[17]+Sheet2!RC[22]+Sheet2!RC[27]+Sheet2!RC[32]+Sheet2!RC[37]+Sheet2!RC[42]+Sheet2!RC[47]+Sheet2!RC[57]+Sheet2!RC[52]+Sheet2!RC[62]+Sheet2!RC[67] -> 2144.8789999999999 | C46: =RC[6]+RC[11]+RC[16]+RC[21]+RC[26]+RC[31]+RC[36]+RC[41]+RC[46]+RC[51]+RC[56]+RC[61]+RC[66]+RC[71]+RC[76]+RC[81]+RC[86]+RC[91]+RC[96]+RC[101]+RC[106]+RC[111]+RC[116]+RC[121]+RC[126]+RC[131]+RC[136]+RC[141]+RC[146]+RC[151]+RC[156]+RC[161]+RC[166]+RC[171]+RC[176]+RC[181]+RC[186]+RC[191]+RC[196]+RC[201]+RC[206]+RC[211]+RC[216]+RC[221]+RC[226]+RC[231]+RC[236]+RC[241]+Sheet2!RC+Sheet2!RC[5]+Sheet2!RC[10]+Sheet2!RC[15]+Sheet2!RC[20]+Sheet2!RC[25]+Sheet2!RC[30]+Sheet2!RC[35]+Sheet2!RC[40]+Sheet2!RC[45]+Sheet2!RC[50]+Sheet2!RC[55]+Sheet2!RC[60]+Sheet2!RC[65] -> 465.86637999999999 | D46: =RC[4]+RC[9]+RC[14]+RC[19]+RC[24]+RC[29]+RC[34]+RC[39]+RC[44]+RC[49]+RC[54]+RC[59]+RC[64]+RC[69]+RC[74]+RC[79]+RC[84]+RC[89]+RC[94]+RC[99]+RC[104]+RC[109]+RC[114]+RC[119]+RC[124]+RC[129]+RC[134]+RC[139]+RC[144]+RC[149]+RC[154]+RC[159]+RC[164]+RC[169]+RC[174]+RC[179]+RC[184]+RC[189]+RC[194]+RC[199]+RC[204]+RC[209]+RC[214]+RC[219]+RC[224]+RC[229]+RC[234]+RC[239]+Sheet2!RC[3]+Sheet2!RC[-2]+Sheet2!RC[8]+Sheet2!RC[13]+Sheet2!RC[18]+Sheet2!RC[23]+Sheet2!RC[28]+Sheet2!RC[33]+Sheet2!RC[38]+Sheet2!RC[43]+Sheet2!RC[48]+Sheet2!RC[53]+Sheet2!RC[58]+Sheet2!RC[63] -> 370 | E46: =RC[6]+RC[11]+RC[16]+RC[21]+RC[26]+RC[31]+RC[36]+RC[41]+RC[46]+RC[51]+RC[56]+RC[61]+RC[66]+RC[71]+RC[76]+RC[81]+RC[86]+RC[91]+RC[96]+RC[101]+RC[106]+RC[111]+RC[116]+RC[121]+RC[126]+RC[131]+RC[136]+RC[141]+RC[146]+RC[151]+RC[156]+RC[161]+RC[166]+RC[171]+RC[176]+RC[181]+RC[186]+RC[191]+RC[196]+RC[201]+RC[206]+RC[211]+RC[216]+RC[221]+RC[226]+RC[231]+RC[236]+RC[241]+Sheet2!RC+Sheet2!RC[5]+Sheet2!RC[10]+Sheet2!RC[15]+Sheet2!RC[20]+Sheet2!RC[25]+Sheet2!RC[30]+Sheet2!RC[35]+Sheet2!RC[40]+Sheet2!RC[45]+Sheet2!RC[50]+Sheet2!RC[55]+Sheet2!RC[60]+Sheet2!RC[65] -> 706.80774599999972 | F46: =SUM(RC[-4]:RC[-1]) -> 3687.5531259999998 | G46: =Sheet1!RC[5]+Sheet1!RC[10]+Sheet1!RC[15]+Sheet1!RC[20]+Sheet1!RC[25]+Sheet1!RC[30]+Sheet1!RC[35]+Sheet1!RC[40]+Sheet1!RC[45]+Sheet1!RC[50]+Sheet1!RC[55]+Sheet1!RC[60]+Sheet1!RC[65]+Sheet1!RC[70]+Sheet1!RC[75]+Sheet1!RC[80]+Sheet1!RC[85]+Sheet1!RC[90]+Sheet1!RC[95]+Sheet1!RC[100]+Sheet1!RC[105]+Sheet1!RC[110]+Sheet1!RC[115]+Sheet1!RC[120]+Sheet1!RC[125]+Sheet1!RC[130]+Sheet1!RC[135]+Sheet1!RC[140]+Sheet1!RC[145]+Sheet1!RC[150]+Sheet1!RC[155]+Sheet1!RC[160]+Sheet1!RC[165]+Sheet1!RC[170]+Sheet1!RC[175]+Sheet1!RC[180]+Sheet1!RC[185]+Sheet1!RC[190]+Sheet1!RC[195]+Sheet1!RC[200]+Sheet1!RC[205]+Sheet1!RC[210]+Sheet1!RC[215]+Sheet1!RC[220]+Sheet1!RC[225]+Sheet1!RC[230]+Sheet1!RC[235]+Sheet1!RC[240]+Sheet2!RC[-1]+Sheet2!RC[4]+Sheet2!RC[9]+Sheet2!RC[14]+Sheet2!RC[19]+Sheet2!RC[24]+Sheet2!RC[29]+Sheet2!RC[34]+Sheet2!RC[39]+Sheet2!RC[44]+Sheet2!RC[49]+Sheet2!RC[54]+Sheet2!RC[59]+Sheet2!RC[64] -> 3687.5531259999989 | H46: 10 | I46: 7.4799899999999999 | J46: 146.1 | K46: 9.1055772000000008 | L46: =SUM(RC[-4]:RC[-1]) -> 172.68556720000001 | M46: 2 | N46: 1.28949 | O46: 0 | P46: 1.3508947999999998 | Q46: =SUM(RC[-4]:RC[-1]) -> 4.6403847999999996 | R46: 9 | S46: 30.399000000000001 | T46: 0 | U46: 57.580022599999992 | V46: =SUM(RC[-4]:RC[-1]) -> 96.979022599999993 | W46: 8 | X46: 4.9999000000000002 | Y46: 58.301000000000002 | Z46: 3.671877599999998 | AA46: =SUM(RC[-4]:RC[-1]) -> 74.972777600000001 | AB46: 3 | AC46: 2.16 | AD46: 0 | AE46: 4.367163800000001 | AF46: =SUM(RC[-4]:RC[-1]) -> 9.5271638000000003 | AG46: 2 | AH46: 2.08 | AI46: 0.99 | AJ46: 2.7608298000000002 | AK46: =SUM(RC[-4]:RC[-1]) -> 7.8308298000000001 | AL46: 6 | AM46: 3.51 | AN46: 13.39 | AO46: 4.6694152000000004 | AP46: =SUM(RC[-4]:RC[-1]) -> 27.569415199999998 | AQ46: 3 | AR46: 2.33 | AS46: 0.02 | AT46: 0 | AU46: =SUM(RC[-4]:RC[-1]) -> 5.35 | AV46: 2 | AW46: 1.2989999999999999 | AX46: 0.01 | AY46: 0 | AZ46: =SUM(RC[-4]:RC[-1]) -> 3.3089999999999997 | BA46: 4 | BB46: 2.02 | BC46: 0 | BD46: 2.3787155999999992 | BE46: =SUM(RC[-4]:RC[-1]) -> 8.3987155999999992 | BF46: 2 | BG46: 1.61 | BH46: 0 | BI46: 1.5805304000000002 | BJ46: =SUM(RC[-4]:RC[-1]) -> 5.1905304000000001 | BK46: 2 | BL46: 1.22 | BM46: 10 | BN46: 1.5970532000000004 | BO46: =SUM(RC[-4]:RC[-1]) -> 14.8170532 | BP46: 2 | BQ46: 1.1879999999999999 | BR46: 0.7 | BS46: 2.0164445999999998 | BT46: =SUM(RC[-4]:RC[-1]) -> 5.9044445999999997 | BU46: 6 | BV46: 6.87 | BW46: 99.6 | BX46: 6.4315234000000014 | BY46: =SUM(RC[-4]:RC[-1]) -> 118.9015234 | BZ46: 24 | CA46: 23.73 | CB46: 31.46 | CC46: 22.864820200000008 | CD46: =SUM(RC[-4]:RC[-1]) -> 102.05482020000001 | CE46: 2 | CF46: 0.95699999999999996 | CG46: 3.02 | CH46: 1.8381348000000004 | CI46: =SUM(RC[-4]:RC[-1]) -> 7.8151348000000009 | CJ46: 1 | CK46: 1.23 | CL46: 0 | CM46: 1.3781399999999999 | CN46: =SUM(RC[-4]:RC[-1]) -> 3.6081399999999997 | CO46: 1 | CP46: 1.34 | CQ46: 0 | CR46: 1.2193768000000003 | CS46: =SUM(RC[-4]:RC[-1]) -> 3.5593767999999999 | CT46: 4 | CU46: 1.53 | CV46: 0 | CW46: 1.849586 | CX46: =SUM(RC[-4]:RC[-1]) -> 7.3795859999999998 | CY46: 3 | CZ46: 1.23 | DA46: 12.29 | DB46: 0.86592420000000025 | DC46: =SUM(RC[-4]:RC[-1]) -> 17.385924199999998 | DD46: 1 | DE46: 0.13 | DF46: 0 | DG46: 0.2125042 | DH46: =SUM(RC[-4]:RC[-1]) -> 1.3425041999999998 | DI46: 3 | DJ46: 1.62 | DK46: 0.17 | DL46: 2.2437460000000011 | DM46: =SUM(RC[-4]:RC[-1]) -> 7.0337460000000007 | DN46: 5 | DO46: 2.8 | DP46: 5.1999999999999998E-2 | DQ46: 3.4335500000000008 | DR46: =SUM(RC[-4]:RC[-1]) -> 11.285550000000001 | DS46: 13 | DT46: 57.75 | DU46: 0.56000000000000005 | DV46: 25.7595752 | DW46: =SUM(RC[-4]:RC[-1]) -> 97.069575200000003 | DX46: 1 | DY46: 0.69 | DZ46: 0.106 | EA46: 1.4982188000000003 | EB46: =SUM(RC[-4]:RC[-1]) -> 3.2942188000000003 | EC46: 3 | ED46: 1.67 | EE46: 0 | EF46: 1.9573765999999997 | EG46: =SUM(RC[-4]:RC[-1]) -> 6.6273765999999998 | EH46: 3 | EI46: 1.81 | EJ46: 0 | EK46: 1.6756063999999997 | EL46: =SUM(RC[-4]:RC[-1]) -> 6.4856064 | EM46: 14 | EN46: 18.263000000000002 | EO46: 95.55 | EP46: 23.212612999999987 | EQ46: =SUM(RC[-4]:RC[-1]) -> 151.02561299999999 | ER46: 3 | ES46: 1.28 | ET46: 2.95 | EU46: 1.3865229999999999 | EV46: =SUM(RC[-4]:RC[-1]) -> 8.6165230000000008 | EW46: 32 | EX46: 33.46 | EY46: 75.47 | EZ46: 24.367216500000008 | FA46: =SUM(RC[-4]:RC[-1]) -> 165.29721650000002 | FB46: 8 | FC46: 39.5 | FD46: 0 | FE46: 291.86989229999995 | FF46: =SUM(RC[-4]:RC[-1]) -> 339.36989229999995 | FG46: 4 | FH46: 5.53 | FI46: 729.57 | FJ46: 5.4518757999999963 | FK46: =SUM(RC[-4]:RC[-1]) -> 744.55187580000006 | FL46: 7 | FM46: 5.88 | FN46: 10.99 | FO46: 4.885327199999999 | FP46: =SUM(RC[-4]:RC[-1]) -> 28.755327199999996 | FQ46: 12 | FR46: 11.68 | FS46: 107.6 | FT46: 11.546135600000005 | FU46: =SUM(RC[-4]:RC[-1]) -> 142.82613560000001 | FV46: 4 | FW46: 2.54 | FX46: 0.81 | FY46: 3.9492607999999998 | FZ46: =SUM(RC[-4]:RC[-1]) -> 11.299260799999999 | GA46: 4 | GB46: 8.5 | GC46: 97.31 | GD46: 9.7065476000000004 | GE46: =SUM(RC[-4]:RC[-1]) -> 119.5165476 | GF46: 1 | GG46: 1.1399999999999999 | GH46: 0 | GI46: 1.2935729999999999 | GJ46: =SUM(RC[-4]:RC[-1]) -> 3.4335729999999995 | GK46: 4 | GL46: 3.17 | GM46: 3 | GN46: 2.5423340000000008 | GO46: =SUM(RC[-4]:RC[-1]) -> 12.712334 | GP46: 3 | GQ46: 1.54 | GR46: 0 | GS46: 1.8300345999999994 | GT46: =SUM(RC[-4]:RC[-1]) -> 6.3700345999999994 | GU46: 3 | GV46: 2.42 | GW46: 0 | GX46: 1.8202295999999993 | GY46: =SUM(RC[-4]:RC[-1]) -> 7.2402295999999993 | GZ46: 18 | HA46: 50.93 | HB46: 0.9 | HC46: 38.927495399999991 | HD46: =SUM(RC[-4]:RC[-1]) -> 108.75749540000001 | HE46: 4 | HF46: 3.86 | HG46: 0 | HH46: 3.3081659999999991 | HI46: =SUM(RC[-4]:RC[-1]) -> 11.168165999999999 | HJ46: 6 | HK46: 11.9 | HL46: 3.05 | HM46: 8.6662967999999978 | HN46: =SUM(RC[-4]:RC[-1]) -> 29.616296799999997 | HO46: 7 | HP46: 7.28 | HQ46: 2.88 | HR46: 6.4476260000000005 | HS46: =SUM(RC[-4]:RC[-1]) -> 23.607626 | HT46: 6 | HU46: 5.0999999999999996 | HV46: 0.14000000000000001 | HW46: 3.2923576000000017 | HX46: =SUM(RC[-4]:RC[-1]) -> 14.532357600000001 | HY46: 4 | HZ46: 3.68 | IA46: 5.7 | IB46: 5.685551199999999 | IC46: =SUM(RC[-4]:RC[-1]) -> 19.065551199999998 | ID46: 1 | IE46: 0.81 | IF46: 0 | IG46: 2.5259752 | IH46: =SUM(RC[-4]:RC[-1]) -> 4.3359752 | II46: 1 | IJ46: 0.48299999999999998 | IK46: 36 | IL46: 0.73753479999999993 | IM46: =SUM(RC[-4]:RC[-1]) -> 38.220534799999996
A47: METHENE(B)4- | B47: =RC[8]+RC[13]+RC[18]+RC[23]+RC[28]+RC[33]+RC[38]+RC[43]+RC[48]+RC[53]+RC[58]+RC[63]+RC[68]+RC[73]+RC[78]+RC[83]+RC[88]+RC[93]+RC[98]+RC[103]+RC[108]+RC[113]+RC[118]+RC[123]+RC[128]+RC[133]+RC[138]+RC[143]+RC[148]+RC[153]+RC[158]+RC[163]+RC[168]+RC[173]+RC[178]+RC[183]+RC[188]+RC[193]+RC[198]+RC[203]+RC[208]+RC[213]+RC[218]+RC[223]+RC[228]+RC[233]+RC[238]+RC[243]+Sheet2!RC[2]+Sheet2!RC[7]+Sheet2!RC[12]+Sheet2!RC[17]+Sheet2!RC[22]+Sheet2!RC[27]+Sheet2!RC[32]+Sheet2!RC[37]+Sheet2!RC[42]+Sheet2!RC[47]+Sheet2!RC[57]+Sheet2!RC[52]+Sheet2!RC[62]+Sheet2!RC[67] -> 62693.691099999989 | C47: =RC[6]+RC[11]+RC[16]+RC[21]+RC[26]+RC[31]+RC[36]+RC[41]+RC[46]+RC[51]+RC[56]+RC[61]+RC[66]+RC[71]+RC[76]+RC[81]+RC[86]+RC[91]+RC[96]+RC[101]+RC[106]+RC[111]+RC[116]+RC[121]+RC[126]+RC[131]+RC[136]+RC[141]+RC[146]+RC[151]+RC[156]+RC[161]+RC[166]+RC[171]+RC[176]+RC[181]+RC[186]+RC[191]+RC[196]+RC[201]+RC[206]+RC[211]+RC[216]+RC[221]+RC[226]+RC[231]+RC[236]+RC[241]+Sheet2!RC+Sheet2!RC[5]+Sheet2!RC[10]+Sheet2!RC[15]+Sheet2!RC[20]+Sheet2!RC[25]+Sheet2!RC[30]+Sheet2!RC[35]+Sheet2!RC[40]+Sheet2!RC[45]+Sheet2!RC[50]+Sheet2!RC[55]+Sheet2!RC[60]+Sheet2!RC[65] -> 0 | D47: =RC[4]+RC[9]+RC[14]+RC[19]+RC[24]+RC[29]+RC[34]+RC[39]+RC[44]+RC[49]+RC[54]+RC[59]+RC[64]+RC[69]+RC[74]+RC[79]+RC[84]+RC[89]+RC[94]+RC[99]+RC[104]+RC[109]+RC[114]+RC[119]+RC[124]+RC[129]+RC[134]+RC[139]+RC[144]+RC[149]+RC[154]+RC[159]+RC[164]+RC[169]+RC[174]+RC[179]+RC[184]+RC[189]+RC[194]+RC[199]+RC[204]+RC[209]+RC[214]+RC[219]+RC[224]+RC[229]+RC[234]+RC[239]+Sheet2!RC[3]+Sheet2!RC[-2]+Sheet2!RC[8]+Sheet2!RC[13]+Sheet2!RC[18]+Sheet2!RC[23]+Sheet2!RC[28]+Sheet2!RC[33]+Sheet2!RC[38]+Sheet2!RC[43]+Sheet2!RC[48]+Sheet2!RC[53]+Sheet2!RC[58]+Sheet2!RC[63] -> 0 | E47: =RC[6]+RC[11]+RC[16]+RC[21]+RC[26]+RC[31]+RC[36]+RC[41]+RC[46]+RC[51]+RC[56]+RC[61]+RC[66]+RC[71]+RC[76]+RC[81]+RC[86]+RC[91]+RC[96]+RC[101]+RC[106]+RC[111]+RC[116]+RC[121]+RC[126]+RC[131]+RC[136]+RC[141]+RC[146]+RC[151]+RC[156]+RC[161]+RC[166]+RC[171]+RC[176]+RC[181]+RC[186]+RC[191]+RC[196]+RC[201]+RC[206]+RC[211]+RC[216]+RC[221]+RC[226]+RC[231]+RC[236]+RC[241]+Sheet2!RC+Sheet2!RC[5]+Sheet2!RC[10]+Sheet2!RC[15]+Sheet2!RC[20]+Sheet2!RC[25]+Sheet2!RC[30]+Sheet2!RC[35]+Sheet2!RC[40]+Sheet2!RC[45]+Sheet2!RC[50]+Sheet2!RC[55]+Sheet2!RC[60]+Sheet2!RC[65] -> 0 | F47: =SUM(RC[-4]:RC[-1]) -> 62693.691099999989 | G47: =Sheet1!RC[5]+Sheet1!RC[10]+Sheet1!RC[15]+Sheet1!RC[20]+Sheet1!RC[25]+Sheet1!RC[30]+Sheet1!RC[35]+Sheet1!RC[40]+Sheet1!RC[45]+Sheet1!RC[50]+Sheet1!RC[55]+Sheet1!RC[60]+Sheet1!RC[65]+Sheet1!RC[70]+Sheet1!RC[75]+Sheet1!RC[80]+Sheet1!RC[85]+Sheet1!RC[90]+Sheet1!RC[95]+Sheet1!RC[100]+Sheet1!RC[105]+Sheet1!RC[110]+Sheet1!RC[115]+Sheet1!RC[120]+Sheet1!RC[125]+Sheet1!RC[130]+Sheet1!RC[135]+Sheet1!RC[140]+Sheet1!RC[145]+Sheet1!RC[150]+Sheet1!RC[155]+Sheet1!RC[160]+Sheet1!RC[165]+Sheet1!RC[170]+Sheet1!RC[175]+Sheet1!RC[180]+Sheet1!RC[185]+Sheet1!RC[190]+Sheet1!RC[195]+Sheet1!RC[200]+Sheet1!RC[205]+Sheet1!RC[210]+Sheet1!RC[215]+Sheet1!RC[220]+Sheet1!RC[225]+Sheet1!RC[230]+Sheet1!RC[235]+Sheet1!RC[240]+Sheet2!RC[-1]+Sheet2!RC[4]+Sheet2!RC[9]+Sheet2!RC[14]+Sheet2!RC[19]+Sheet2!RC[24]+Sheet2!RC[29]+Sheet2!RC[34]+Sheet2!RC[39]+Sheet2!RC[44]+Sheet2!RC[49]+Sheet2!RC[54]+Sheet2!RC[59]+Sheet2!RC[64] -> 62693.691099999989 | H47: 0 | I47: 0 | J47: 0 | K47: 0 | L47: =SUM(RC[-4]:RC[-1]) -> 0 | M47: 0 | N47: 0 | O47: 0 | P47: 0 | Q47: =SUM(RC[-4]:RC[-1]) -> 0 | R47: 0 | S47: 0 | T47: 0 | U47: 0 | V47: =SUM(RC[-4]:RC[-1]) -> 0 | W47: 0 | X47: 0 | Y47: 0 | Z47: 0 | AA47: =SUM(RC[-4]:RC[-1]) -> 0 | AB47: 0 | AC47: 0 | AD47: 0 | AE47: 0 | AF47: =SUM(RC[-4]:RC[-1]) -> 0 | AG47: 0 | AH47: 0 | AI47: 0 | AJ47: 0 | AK47: =SUM(RC[-4]:RC[-1]) -> 0 | AL47: 0 | AM47: 0 | AN47: 0 | AO47: 0 | AP47: =SUM(RC[-4]:RC[-1]) -> 0 | AQ47: 0 | AR47: 0 | AS47: 0 | AT47: 0 | AU47: =SUM(RC[-4]:RC[-1]) -> 0 | AV47: 0 | AW47: 0 | AX47: 0 | AY47: 0 | AZ47: =SUM(RC[-4]:RC[-1]) -> 0 | BA47: 0 | BB47: 0 | BC47: 0 | BD47: 0 | BE47: =SUM(RC[-4]:RC[-1]) -> 0 | BF47: 0 | BG47: 0 | BH47: 0 | BI47: 0 | BJ47: =SUM(RC[-4]:RC[-1]) -> 0 | BK47: 0 | BL47: 0 | BM47: 30 | BN47: 0 | BO47: =SUM(RC[-4]:RC[-1]) -> 30 | BP47: 0 | BQ47: 0 | BR47: 0 | BS47: 0 | BT47: =SUM(RC[-4]:RC[-1]) -> 0 | BU47: 0 | BV47: 0 | BW47: 0 | BX47: 0 | BY47: =SUM(RC[-4]:RC[-1]) -> 0 | BZ47: 0 | CA47: 0 | CB47: 61.36 | CC47: 0 | CD47: =SUM(RC[-4]:RC[-1]) -> 61.36 | CE47: 0 | CF47: 0 | CG47: 0 | CH47: 0 | CI47: =SUM(RC[-4]:RC[-1]) -> 0 | CJ47: 0 | CK47: 0 | CL47: 0 | CM47: 0 | CN47: =SUM(RC[-4]:RC[-1]) -> 0 | CO47: 0 | CP47: 0 | CQ47: 0 | CR47: 0 | CS47: =SUM(RC[-4]:RC[-1]) -> 0 | CT47: 0 | CU47: 0 | CV47: 0 | CW47: 0 | CX47: =SUM(RC[-4]:RC[-1]) -> 0 | CY47: 0 | CZ47: 0 | DA47: 0 | DB47: 0 | DC47: =SUM(RC[-4]:RC[-1]) -> 0 | DD47: 0 | DE47: 0 | DF47: 0 | DG47: 0 | DH47: =SUM(RC[-4]:RC[-1]) -> 0 | DI47: 0 | DJ47: 0 | DK47: 0 | DL47: 0 | DM47: =SUM(RC[-4]:RC[-1]) -> 0 | DN47: 0 | DO47: 0 | DP47: 0 | DQ47: 0 | DR47: =SUM(RC[-4]:RC[-1]) -> 0 | DS47: 0 | DT47: 0 | DU47: 0 | DV47: 0 | DW47: =SUM(RC[-4]:RC[-1]) -> 0 | DX47: 0 | DY47: 0 | DZ47: 0 | EA47: 0 | EB47: =SUM(RC[-4]:RC[-1]) -> 0 | EC47: 0 | ED47: 0 | EE47: 0 | EF47: 0 | EG47: =SUM(RC[-4]:RC[-1]) -> 0 | EH47: 0 | EI47: 0 | EJ47: 0 | EK47: 0 | EL47: =SUM(RC[-4]:RC[-1]) -> 0 | EM47: 0 | EN47: 0 | EO47: 1E-4 | EP47: 0 | EQ47: =SUM(RC[-4]:RC[-1]) -> 1E-4 | ER47: 0 | ES47: 0 | ET47: 0 | EU47: 0 | EV47: =SUM(RC[-4]:RC[-1]) -> 0 | EW47: 0 | EX47: 0 | EY47: 0 | EZ47: 0 | FA47: =SUM(RC[-4]:RC[-1]) -> 0 | FB47: 0 | FC47: 0 | FD47: 0 | FE47: 0 | FF47: =SUM(RC[-4]:RC[-1]) -> 0 | FG47: 0 | FH47: 0 | FI47: 0 | FJ47: 0 | FK47: =SUM(RC[-4]:RC[-1]) -> 0 | FL47: 0 | FM47: 0 | FN47: 0 | FO47: 0 | FP47: =SUM(RC[-4]:RC[-1]) -> 0 | FQ47: 0 | FR47: 0 | FS47: 23.788 | FT47: 0 | FU47: =SUM(RC[-4]:RC[-1]) -> 23.788 | FV47: 0 | FW47: 0 | FX47: 62507 | FY47: 0 | FZ47: =SUM(RC[-4]:RC[-1]) -> 62507 | GA47: 0 | GB47: 0 | GC47: 0 | GD47: 0 | GE47: =SUM(RC[-4]:RC[-1]) -> 0 | GF47: 0 | GG47: 0 | GH47: 0 | GI47: 0 | GJ47: =SUM(RC[-4]:RC[-1]) -> 0 | GK47: 0 | GL47: 0 | GM47: 35.253 | GN47: 0 | GO47: =SUM(RC[-4]:RC[-1]) -> 35.253 | GP47: 0 | GQ47: 0 | GR47: 0 | GS47: 0 | GT47: =SUM(RC[-4]:RC[-1]) -> 0 | GU47: 0 | GV47: 0 | GW47: 0 | GX47: 0 | GY47: =SUM(RC[-4]:RC[-1]) -> 0 | GZ47: 0 | HA47: 0 | HB47: 0 | HC47: 0 | HD47: =SUM(RC[-4]:RC[-1]) -> 0 | HE47: 0 | HF47: 0 | HG47: 0 | HH47: 0 | HI47: =SUM(RC[-4]:RC[-1]) -> 0 | HJ47: 0 | HK47: 0 | HL47: 0 | HM47: 0 | HN47: =SUM(RC[-4]:RC[-1]) -> 0 | HO47: 0 | HP47: 0 | HQ47: 0 | HR47: 0 | HS47: =SUM(RC[-4]:RC[-1]) -> 0 | HT47: 0 | HU47: 0 | HV47: 0 | HW47: 0 | HX47: =SUM(RC[-4]:RC[-1]) -> 0 | HY47: 0 | HZ47: 0 | IA47: 0 | IB47: 0 | IC47: =SUM(RC[-4]:RC[-1]) -> 0 | ID47: 0 | IE47: 0 | IF47: 0 | IG47: 0 | IH47: =SUM(RC[-4]:RC[-1]) -> 0 | II47: 0 | IJ47: 0 | IK47: 0 | IL47: 0 | IM47: =SUM(RC[-4]:RC[-1]) -> 0
A48: METHYLENE CL | B48: =RC[8]+RC[13]+RC[18]+RC[23]+RC[28]+RC[33]+RC[38]+RC[43]+RC[48]+RC[53]+RC[58]+RC[63]+RC[68]+RC[73]+RC[78]+RC[83]+RC[88]+RC[93]+RC[98]+RC[103]+RC[108]+RC[113]+RC[118]+RC[123]+RC[128]+RC[133]+RC[138]+RC[143]+RC[148]+RC[153]+RC[158]+RC[163]+RC[168]+RC[173]+RC[178]+RC[183]+RC[188]+RC[193]+RC[198]+RC[203]+RC[208]+RC[213]+RC[218]+RC[223]+RC[228]+RC[233]+RC[238]+RC[243]+Sheet2!RC[2]+Sheet2!RC[7]+Sheet2!RC[12]+Sheet2!RC[17]+Sheet2!RC[22]+Sheet2!RC[27]+Sheet2!RC[32]+Sheet2!RC[37]+Sheet2!RC[42]+Sheet2!RC[47]+Sheet2!RC[57]+Sheet2!RC[52]+Sheet2!RC[62]+Sheet2!RC[67] -> 1614878.78 | C48: =RC[6]+RC[11]+RC[16]+RC[21]+RC[26]+RC[31]+RC[36]+RC[41]+RC[46]+RC[51]+RC[56]+RC[61]+RC[66]+RC[71]+RC[76]+RC[81]+RC[86]+RC[91]+RC[96]+RC[101]+RC[106]+RC[111]+RC[116]+RC[121]+RC[126]+RC[131]+RC[136]+RC[141]+RC[146]+RC[151]+RC[156]+RC[161]+RC[166]+RC[171]+RC[176]+RC[181]+RC[186]+RC[191]+RC[196]+RC[201]+RC[206]+RC[211]+RC[216]+RC[221]+RC[226]+RC[231]+RC[236]+RC[241]+Sheet2!RC+Sheet2!RC[5]+Sheet2!RC[10]+Sheet2!RC[15]+Sheet2!RC[20]+Sheet2!RC[25]+Sheet2!RC[30]+Sheet2!RC[35]+Sheet2!RC[40]+Sheet2!RC[45]+Sheet2!RC[50]+Sheet2!RC[55]+Sheet2!RC[60]+Sheet2!RC[65] -> 6697310.3659999995 | D48: =RC[4]+RC[9]+RC[14]+RC[19]+RC[24]+RC[29]+RC[34]+RC[39]+RC[44]+RC[49]+RC[54]+RC[59]+RC[64]+RC[69]+RC[74]+RC[79]+RC[84]+RC[89]+RC[94]+RC[99]+RC[104]+RC[109]+RC[114]+RC[119]+RC[124]+RC[129]+RC[134]+RC[139]+RC[144]+RC[149]+RC[154]+RC[159]+RC[164]+RC[169]+RC[174]+RC[179]+RC[184]+RC[189]+RC[194]+RC[199]+RC[204]+RC[209]+RC[214]+RC[219]+RC[224]+RC[229]+RC[234]+RC[239]+Sheet2!RC[3]+Sheet2!RC[-2]+Sheet2!RC[8]+Sheet2!RC[13]+Sheet2!RC[18]+Sheet2!RC[23]+Sheet2!RC[28]+Sheet2!RC[33]+Sheet2!RC[38]+Sheet2!RC[43]+Sheet2!RC[48]+Sheet2!RC[53]+Sheet2!RC[58]+Sheet2!RC[63] -> 0 | E48: =RC[6]+RC[11]+RC[16]+RC[21]+RC[26]+RC[31]+RC[36]+RC[41]+RC[46]+RC[51]+RC[56]+RC[61]+RC[66]+RC[71]+RC[76]+RC[81]+RC[86]+RC[91]+RC[96]+RC[101]+RC[106]+RC[111]+RC[116]+RC[121]+RC[126]+RC[131]+RC[136]+RC[141]+RC[146]+RC[151]+RC[156]+RC[161]+RC[166]+RC[171]+RC[176]+RC[181]+RC[186]+RC[191]+RC[196]+RC[201]+RC[206]+RC[211]+RC[216]+RC[221]+RC[226]+RC[231]+RC[236]+RC[241]+Sheet2!RC+Sheet2!RC[5]+Sheet2!RC[10]+Sheet2!RC[15]+Sheet2!RC[20]+Sheet2!RC[25]+Sheet2!RC[30]+Sheet2!RC[35]+Sheet2!RC[40]+Sheet2!RC[45]+Sheet2!RC[50]+Sheet2!RC[55]+Sheet2!RC[60]+Sheet2!RC[65] -> 0 | F48: =SUM(RC[-4]:RC[-1]) -> 8312189.1459999997 | G48: =Sheet1!RC[5]+Sheet1!RC[10]+Sheet1!RC[15]+Sheet1!RC[20]+Sheet1!RC[25]+Sheet1!RC[30]+Sheet1!RC[35]+Sheet1!RC[40]+Sheet1!RC[45]+Sheet1!RC[50]+Sheet1!RC[55]+Sheet1!RC[60]+Sheet1!RC[65]+Sheet1!RC[70]+Sheet1!RC[75]+Sheet1!RC[80]+Sheet1!RC[85]+Sheet1!RC[90]+Sheet1!RC[95]+Sheet1!RC[100]+Sheet1!RC[105]+Sheet1!RC[110]+Sheet1!RC[115]+Sheet1!RC[120]+Sheet1!RC[125]+Sheet1!RC[130]+Sheet1!RC[135]+Sheet1!RC[140]+Sheet1!RC[145]+Sheet1!RC[150]+Sheet1!RC[155]+Sheet1!RC[160]+Sheet1!RC[165]+Sheet1!RC[170]+Sheet1!RC[175]+Sheet1!RC[180]+Sheet1!RC[185]+Sheet1!RC[190]+Sheet1!RC[195]+Sheet1!RC[200]+Sheet1!RC[205]+Sheet1!RC[210]+Sheet1!RC[215]+Sheet1!RC[220]+Sheet1!RC[225]+Sheet1!RC[230]+Sheet1!RC[235]+Sheet1!RC[240]+Sheet2!RC[-1]+Sheet2!RC[4]+Sheet2!RC[9]+Sheet2!RC[14]+Sheet2!RC[19]+Sheet2!RC[24]+Sheet2!RC[29]+Sheet2!RC[34]+Sheet2!RC[39]+Sheet2!RC[44]+Sheet2!RC[49]+Sheet2!RC[54]+Sheet2!RC[59]+Sheet2!RC[64] -> 8312189.1459999988 | H48: 0 | I48: 116915.42 | J48: 0 | K48: 0 | L48: =SUM(RC[-4]:RC[-1]) -> 116915.42 | M48: 0 | N48: 19782.13 | O48: 0 | P48: 0 | Q48: =SUM(RC[-4]:RC[-1]) -> 19782.13 | R48: 0 | S48: 477785.26 | T48: 0 | U48: 0 | V48: =SUM(RC[-4]:RC[-1]) -> 477785.26 | W48: 0 | X48: 69482.778000000006 | Y48: 3.99 | Z48: 0 | AA48: =SUM(RC[-4]:RC[-1]) -> 69486.768000000011 | AB48: 0 | AC48: 33285.637999999999 | AD48: 0 | AE48: 0 | AF48: =SUM(RC[-4]:RC[-1]) -> 33285.637999999999 | AG48: 0 | AH48: 30531.472000000002 | AI48: 127.75 | AJ48: 0 | AK48: =SUM(RC[-4]:RC[-1]) -> 30659.222000000002 | AL48: 0 | AM48: 17177.990000000002 | AN48: 215.18 | AO48: 0 | AP48: =SUM(RC[-4]:RC[-1]) -> 17393.170000000002 | AQ48: 0 | AR48: 36312.92 | AS48: 542.22 | AT48: 0 | AU48: =SUM(RC[-4]:RC[-1]) -> 36855.14 | AV48: 0 | AW48: 14743.53 | AX48: 0 | AY48: 0 | AZ48: =SUM(RC[-4]:RC[-1]) -> 14743.53 | BA48: 0 | BB48: 31768.71 | BC48: 21358.2 | BD48: 0 | BE48: =SUM(RC[-4]:RC[-1]) -> 53126.91 | BF48: 0 | BG48: 19019 | BH48: 14034.2 | BI48: 0 | BJ48: =SUM(RC[-4]:RC[-1]) -> 33053.199999999997 | BK48: 0 | BL48: 8452.83 | BM48: 26684.799999999999 | BN48: 0 | BO48: =SUM(RC[-4]:RC[-1]) -> 35137.629999999997 | BP48: 0 | BQ48: 17891.61 | BR48: 18.100000000000001 | BS48: 0 | BT48: =SUM(RC[-4]:RC[-1]) -> 17909.71 | BU48: 0 | BV48: 102532.45 | BW48: 0 | BX48: 0 | BY48: =SUM(RC[-4]:RC[-1]) -> 102532.45 | BZ48: 0 | CA48: 317287.76 | CB48: 7849.73 | CC48: 0 | CD48: =SUM(RC[-4]:RC[-1]) -> 325137.49 | CE48: 0 | CF48: 15168.5 | CG48: 16 | CH48: 0 | CI48: =SUM(RC[-4]:RC[-1]) -> 15184.5 | CJ48: 0 | CK48: 19932.349999999999 | CL48: 0 | CM48: 0 | CN48: =SUM(RC[-4]:RC[-1]) -> 19932.349999999999 | CO48: 0 | CP48: 17573.400000000001 | CQ48: 0 | CR48: 0 | CS48: =SUM(RC[-4]:RC[-1]) -> 17573.400000000001 | CT48: 0 | CU48: 23950.59 | CV48: 0 | CW48: 0 | CX48: =SUM(RC[-4]:RC[-1]) -> 23950.59 | CY48: 0 | CZ48: 18130.07 | DA48: 0 | DB48: 0 | DC48: =SUM(RC[-4]:RC[-1]) -> 18130.07 | DD48: 0 | DE48: 2086.2399999999998 | DF48: 0 | DG48: 0 | DH48: =SUM(RC[-4]:RC[-1]) -> 2086.2399999999998 | DI48: 0 | DJ48: 13841.02 | DK48: 0 | DL48: 0 | DM48: =SUM(RC[-4]:RC[-1]) -> 13841.02 | DN48: 0 | DO48: 44272.47 | DP48: 708.79 | DQ48: 0 | DR48: =SUM(RC[-4]:RC[-1]) -> 44981.26 | DS48: 0 | DT48: 895241.1 | DU48: 0 | DV48: 0 | DW48: =SUM(RC[-4]:RC[-1]) -> 895241.1 | DX48: 0 | DY48: 10635.62 | DZ48: 19 | EA48: 0 | EB48: =SUM(RC[-4]:RC[-1]) -> 10654.62 | EC48: 0 | ED48: 25554.400000000001 | EE48: 0 | EF48: 0 | EG48: =SUM(RC[-4]:RC[-1]) -> 25554.400000000001 | EH48: 0 | EI48: 27598.400000000001 | EJ48: 0 | EK48: 0 | EL48: =SUM(RC[-4]:RC[-1]) -> 27598.400000000001 | EM48: 0 | EN48: 277882.7 | EO48: 1343767.9 | EP48: 0 | EQ48: =SUM(RC[-4]:RC[-1]) -> 1621650.5999999999 | ER48: 0 | ES48: 16658 | ET48: 0 | EU48: 0 | EV48: =SUM(RC[-4]:RC[-1]) -> 16658 | EW48: 0 | EX48: 485636.45 | EY48: 0 | EZ48: 0 | FA48: =SUM(RC[-4]:RC[-1]) -> 485636.45 | FB48: 0 | FC48: 571686 | FD48: 389.76 | FE48: 0 | FF48: =SUM(RC[-4]:RC[-1]) -> 572075.76 | FG48: 0 | FH48: 31085.01 | FI48: 13.55 | FJ48: 0 | FK48: =SUM(RC[-4]:RC[-1]) -> 31098.559999999998 | FL48: 0 | FM48: 59577.16 | FN48: 2.73 | FO48: 0 | FP48: =SUM(RC[-4]:RC[-1]) -> 59579.890000000007 | FQ48: 0 | FR48: 149405.9 | FS48: 152880 | FT48: 0 | FU48: =SUM(RC[-4]:RC[-1]) -> 302285.90000000002 | FV48: 0 | FW48: 39500.9 | FX48: 7.87 | FY48: 0 | FZ48: =SUM(RC[-4]:RC[-1]) -> 39508.770000000004 | GA48: 0 | GB48: 96162.2 | GC48: 654.84 | GD48: 0 | GE48: =SUM(RC[-4]:RC[-1]) -> 96817.04 | GF48: 0 | GG48: 17532.2 | GH48: 0 | GI48: 0 | GJ48: =SUM(RC[-4]:RC[-1]) -> 17532.2 | GK48: 0 | GL48: 38629.300000000003 | GM48: 209.59 | GN48: 0 | GO48: =SUM(RC[-4]:RC[-1]) -> 38838.89 | GP48: 0 | GQ48: 24203.8 | GR48: 0 | GS48: 0 | GT48: =SUM(RC[-4]:RC[-1]) -> 24203.8 | GU48: 0 | GV48: 37233.589999999997 | GW48: 0 | GX48: 0 | GY48: =SUM(RC[-4]:RC[-1]) -> 37233.589999999997 | GZ48: 0 | HA48: 795713.5 | HB48: 1244 | HC48: 0 | HD48: =SUM(RC[-4]:RC[-1]) -> 796957.5 | HE48: 0 | HF48: 60133.599999999999 | HG48: 0 | HH48: 0 | HI48: =SUM(RC[-4]:RC[-1]) -> 60133.599999999999 | HJ48: 0 | HK48: 193928.05 | HL48: 454.06 | HM48: 0 | HN48: =SUM(RC[-4]:RC[-1]) -> 194382.11 | HO48: 0 | HP48: 106553.64 | HQ48: 659 | HR48: 0 | HS48: =SUM(RC[-4]:RC[-1]) -> 107212.64 | HT48: 0 | HU48: 61328.94 | HV48: 129.21 | HW48: 0 | HX48: =SUM(RC[-4]:RC[-1]) -> 61458.15 | HY48: 0 | HZ48: 41864.538 | IA48: 12070.15 | IB48: 0 | IC48: =SUM(RC[-4]:RC[-1]) -> 53934.688000000002 | ID48: 0 | IE48: 12471.44 | IF48: 0 | IG48: 0 | IH48: =SUM(RC[-4]:RC[-1]) -> 12471.44 | II48: 0 | IJ48: 7537.75 | IK48: 0 | IL48: 0 | IM48: =SUM(RC[-4]:RC[-1]) -> 7537.75
A49: NAPHTHALENE | B49: =RC[8]+RC[13]+RC[18]+RC[23]+RC[28]+RC[33]+RC[38]+RC[43]+RC[48]+RC[53]+RC[58]+RC[63]+RC[68]+RC[73]+RC[78]+RC[83]+RC[88]+RC[93]+RC[98]+RC[103]+RC[108]+RC[113]+RC[118]+RC[123]+RC[128]+RC[133]+RC[138]+RC[143]+RC[148]+RC[153]+RC[158]+RC[163]+RC[168]+RC[173]+RC[178]+RC[183]+RC[188]+RC[193]+RC[198]+RC[203]+RC[208]+RC[213]+RC[218]+RC[223]+RC[228]+RC[233]+RC[238]+RC[243]+Sheet2!RC[2]+Sheet2!RC[7]+Sheet2!RC[12]+Sheet2!RC[17]+Sheet2!RC[22]+Sheet2!RC[27]+Sheet2!RC[32]+Sheet2!RC[37]+Sheet2!RC[42]+Sheet2!RC[47]+Sheet2!RC[57]+Sheet2!RC[52]+Sheet2!RC[62]+Sheet2!RC[67] -> 27124.481589999999 | C49: =RC[6]+RC[11]+RC[16]+RC[21]+RC[26]+RC[31]+RC[36]+RC[41]+RC[46]+RC[51]+RC[56]+RC[61]+RC[66]+RC[71]+RC[76]+RC[81]+RC[86]+RC[91]+RC[96]+RC[101]+RC[106]+RC[111]+RC[116]+RC[121]+RC[126]+RC[131]+RC[136]+RC[141]+RC[146]+RC[151]+RC[156]+RC[161]+RC[166]+RC[171]+RC[176]+RC[181]+RC[186]+RC[191]+RC[196]+RC[201]+RC[206]+RC[211]+RC[216]+RC[221]+RC[226]+RC[231]+RC[236]+RC[241]+Sheet2!RC+Sheet2!RC[5]+Sheet2!RC[10]+Sheet2!RC[15]+Sheet2!RC[20]+Sheet2!RC[25]+Sheet2!RC[30]+Sheet2!RC[35]+Sheet2!RC[40]+Sheet2!RC[45]+Sheet2!RC[50]+Sheet2!RC[55]+Sheet2!RC[60]+Sheet2!RC[65] -> 2846096.3479999993 | D49: =RC[4]+RC[9]+RC[14]+RC[19]+RC[24]+RC[29]+RC[34]+RC[39]+RC[44]+RC[49]+RC[54]+RC[59]+RC[64]+RC[69]+RC[74]+RC[79]+RC[84]+RC[89]+RC[94]+RC[99]+RC[104]+RC[109]+RC[114]+RC[119]+RC[124]+RC[129]+RC[134]+RC[139]+RC[144]+RC[149]+RC[154]+RC[159]+RC[164]+RC[169]+RC[174]+RC[179]+RC[184]+RC[189]+RC[194]+RC[199]+RC[204]+RC[209]+RC[214]+RC[219]+RC[224]+RC[229]+RC[234]+RC[239]+Sheet2!RC[3]+Sheet2!RC[-2]+Sheet2!RC[8]+Sheet2!RC[13]+Sheet2!RC[18]+Sheet2!RC[23]+Sheet2!RC[28]+Sheet2!RC[33]+Sheet2!RC[38]+Sheet2!RC[43]+Sheet2!RC[48]+Sheet2!RC[53]+Sheet2!RC[58]+Sheet2!RC[63] -> 1398991 | E49: =RC[6]+RC[11]+RC[16]+RC[21]+RC[26]+RC[31]+RC[36]+RC[41]+RC[46]+RC[51]+RC[56]+RC[61]+RC[66]+RC[71]+RC[76]+RC[81]+RC[86]+RC[91]+RC[96]+RC[101]+RC[106]+RC[111]+RC[116]+RC[121]+RC[126]+RC[131]+RC[136]+RC[141]+RC[146]+RC[151]+RC[156]+RC[161]+RC[166]+RC[171]+RC[176]+RC[181]+RC[186]+RC[191]+RC[196]+RC[201]+RC[206]+RC[211]+RC[216]+RC[221]+RC[226]+RC[231]+RC[236]+RC[241]+Sheet2!RC+Sheet2!RC[5]+Sheet2!RC[10]+Sheet2!RC[15]+Sheet2!RC[20]+Sheet2!RC[25]+Sheet2!RC[30]+Sheet2!RC[35]+Sheet2!RC[40]+Sheet2!RC[45]+Sheet2!RC[50]+Sheet2!RC[55]+Sheet2!RC[60]+Sheet2!RC[65] -> 958.83702019000009 | F49: =SUM(RC[-4]:RC[-1]) -> 4273170.6666101897 | G49: =Sheet1!RC[5]+Sheet1!RC[10]+Sheet1!RC[15]+Sheet1!RC[20]+Sheet1!RC[25]+Sheet1!RC[30]+Sheet1!RC[35]+Sheet1!RC[40]+Sheet1!RC[45]+Sheet1!RC[50]+Sheet1!RC[55]+Sheet1!RC[60]+Sheet1!RC[65]+Sheet1!RC[70]+Sheet1!RC[75]+Sheet1!RC[80]+Sheet1!RC[85]+Sheet1!RC[90]+Sheet1!RC[95]+Sheet1!RC[100]+Sheet1!RC[105]+Sheet1!RC[110]+Sheet1!RC[115]+Sheet1!RC[120]+Sheet1!RC[125]+Sheet1!RC[130]+Sheet1!RC[135]+Sheet1!RC[140]+Sheet1!RC[145]+Sheet1!RC[150]+Sheet1!RC[155]+Sheet1!RC[160]+Sheet1!RC[165]+Sheet1!RC[170]+Sheet1!RC[175]+Sheet1!RC[180]+Sheet1!RC[185]+Sheet1!RC[190]+Sheet1!RC[195]+Sheet1!RC[200]+Sheet1!RC[205]+Sheet1!RC[210]+Sheet1!RC[215]+Sheet1!RC[220]+Sheet1!RC[225]+Sheet1!RC[230]+Sheet1!RC[235]+Sheet1!RC[240]+Sheet2!RC[-1]+Sheet2!RC[4]+Sheet2!RC[9]+Sheet2!RC[14]+Sheet2!RC[19]+Sheet2!RC[24]+Sheet2!RC[29]+Sheet2!RC[34]+Sheet2!RC[39]+Sheet2!RC[44]+Sheet2!RC[49]+Sheet2!RC[54]+Sheet2!RC[59]+Sheet2!RC[64] -> 4273170.6666101888 | H49: 39816 | I49: 54251.519999999997 | J49: 14.57 | K49: 15.5532258 | L49: =SUM(RC[-4]:RC[-1]) -> 94097.643225799999 | M49: 5082 | N49: 9078 | O49: 0 | P49: 0.68262800000000001 | Q49: =SUM(RC[-4]:RC[-1]) -> 14160.682628 | R49: 40293 | S49: 135603.88 | T49: 0 | U49: 15.280861200000004 | V49: =SUM(RC[-4]:RC[-1]) -> 175912.16086120001 | W49: 24633 | X49: 71702.27 | Y49: 371.78 | Z49: 8.4387179999999997 | AA49: =SUM(RC[-4]:RC[-1]) -> 96715.488718000008 | AB49: 8939 | AC49: 16696.830000000002 | AD49: 0 | AE49: 0.31934341999999999 | AF49: =SUM(RC[-4]:RC[-1]) -> 25636.149343420002 | AG49: 8135 | AH49: 14397.3 | AI49: 73.83 | AJ49: 0 | AK49: =SUM(RC[-4]:RC[-1]) -> 22606.13 | AL49: 14302 | AM49: 21551.8 | AN49: 107.67 | AO49: 3.3854250000000001 | AP49: =SUM(RC[-4]:RC[-1]) -> 35964.855425000002 | AQ49: 9596 | AR49: 18014.48 | AS49: 542.04 | AT49: 4.2993628000000008 | AU49: =SUM(RC[-4]:RC[-1]) -> 28156.819362800001 | AV49: 5147 | AW49: 18313.3 | AX49: 13.52 | AY49: 0.69429026999999999 | AZ49: =SUM(RC[-4]:RC[-1]) -> 23474.514290269999 | BA49: 8528 | BB49: 12009.42 | BC49: 0 | BD49: 0.68327170000000004 | BE49: =SUM(RC[-4]:RC[-1]) -> 20538.103271699998 | BF49: 7321 | BG49: 19686.099999999999 | BH49: 0.06 | BI49: 1.2546751 | BJ49: =SUM(RC[-4]:RC[-1]) -> 27008.414675100001 | BK49: 6367 | BL49: 6851.13 | BM49: 4.62 | BN49: 2.7489E-2 | BO49: =SUM(RC[-4]:RC[-1]) -> 13222.777489000002 | BP49: 5765 | BQ49: 32619.538 | BR49: 0 | BS49: 6.4766020000000007E-2 | BT49: =SUM(RC[-4]:RC[-1]) -> 38384.602766019998 | BU49: 26693 | BV49: 50315.24 | BW49: 0.05 | BX49: 1.5927305999999999 | BY49: =SUM(RC[-4]:RC[-1]) -> 77009.882730599988 | BZ49: 80986 | CA49: 146935.45000000001 | CB49: 19762.87 | CC49: 69.481351000000004 | CD49: =SUM(RC[-4]:RC[-1]) -> 247753.801351 | CE49: 4923 | CF49: 5678.35 | CG49: 54 | CH49: 0 | CI49: =SUM(RC[-4]:RC[-1]) -> 10655.35 | CJ49: 5205 | CK49: 24454.69 | CL49: 0 | CM49: 4.3910794500000003 | CN49: =SUM(RC[-4]:RC[-1]) -> 29664.081079449999 | CO49: 4724 | CP49: 6999 | CQ49: 0 | CR49: 0 | CS49: =SUM(RC[-4]:RC[-1]) -> 11723 | CT49: 10393 | CU49: 9879.57 | CV49: 0 | CW49: 0.49103725999999998 | CX49: =SUM(RC[-4]:RC[-1]) -> 20273.061037259999 | CY49: 6974 | CZ49: 9240.43 | DA49: 9.5845000000000002 | DB49: 0 | DC49: =SUM(RC[-4]:RC[-1]) -> 16224.014500000001 | DD49: 1396 | DE49: 1916.43 | DF49: 0 | DG49: 0 | DH49: =SUM(RC[-4]:RC[-1]) -> 3312.4300000000003 | DI49: 8329 | DJ49: 10290.450000000001 | DK49: 9.0000000000000006E-5 | DL49: 0 | DM49: =SUM(RC[-4]:RC[-1]) -> 18619.450090000002 | DN49: 12717 | DO49: 29672.07 | DP49: 0 | DQ49: 1.1987483400000001 | DR49: =SUM(RC[-4]:RC[-1]) -> 42390.26874834 | DS49: 62964 | DT49: 210560.22 | DU49: 227.77 | DV49: 0 | DW49: =SUM(RC[-4]:RC[-1]) -> 273751.99 | DX49: 2884 | DY49: 3687.46 | DZ49: 0 | EA49: 0 | EB49: =SUM(RC[-4]:RC[-1]) -> 6571.46 | EC49: 7339 | ED49: 10193.75 | EE49: 0 | EF49: 1.36014452 | EG49: =SUM(RC[-4]:RC[-1]) -> 17534.11014452 | EH49: 7640 | EI49: 11406.3 | EJ49: 0 | EK49: 6.2474999999999996E-3 | EL49: =SUM(RC[-4]:RC[-1]) -> 19046.306247500001 | EM49: 79660 | EN49: 129240.1 | EO49: 87.307000000000002 | EP49: 15.362360000000001 | EQ49: =SUM(RC[-4]:RC[-1]) -> 209002.76936000001 | ER49: 7365 | ES49: 7470.9 | ET49: 38.659999999999997 | EU49: 0 | EV49: =SUM(RC[-4]:RC[-1]) -> 14874.56 | EW49: 158096 | EX49: 195093.5 | EY49: 199.86 | EZ49: 0 | FA49: =SUM(RC[-4]:RC[-1]) -> 353389.36 | FB49: 50255 | FC49: 222613.2 | FD49: 0 | FE49: 79.078320600000012 | FF49: =SUM(RC[-4]:RC[-1]) -> 272947.27832059999 | FG49: 16161 | FH49: 36727.5 | FI49: 118.96 | FJ49: 16.082311560000001 | FK49: =SUM(RC[-4]:RC[-1]) -> 53023.542311559999 | FL49: 24885 | FM49: 33388.019999999997 | FN49: 198.39 | FO49: 4.8548517599999998 | FP49: =SUM(RC[-4]:RC[-1]) -> 58476.264851759996 | FQ49: 48354 | FR49: 75093 | FS49: 610.84 | FT49: 49.931703800000001 | FU49: =SUM(RC[-4]:RC[-1]) -> 124107.7717038 | FV49: 12559 | FW49: 70314.899999999994 | FX49: 0.06 | FY49: 0 | FZ49: =SUM(RC[-4]:RC[-1]) -> 82873.959999999992 | GA49: 33494 | GB49: 53865.7 | GC49: 67.14 | GD49: 37.708939000000008 | GE49: =SUM(RC[-4]:RC[-1]) -> 87464.548939 | GF49: 3668 | GG49: 5881 | GH49: 0 | GI49: 0 | GJ49: =SUM(RC[-4]:RC[-1]) -> 9549 | GK49: 11427 | GL49: 19049.400000000001 | GM49: 18.63 | GN49: 0 | GO49: =SUM(RC[-4]:RC[-1]) -> 30495.030000000002 | GP49: 6422 | GQ49: 15990.56 | GR49: 0 | GS49: 0.61286412000000001 | GT49: =SUM(RC[-4]:RC[-1]) -> 22413.172864119999 | GU49: 12364 | GV49: 11748.11 | GW49: 0 | GX49: 0 | GY49: =SUM(RC[-4]:RC[-1]) -> 24112.11 | GZ49: 80536 | HA49: 200048.55 | HB49: 0 | HC49: 512.80792743999996 | HD49: =SUM(RC[-4]:RC[-1]) -> 281097.35792743997 | HE49: 16507 | HF49: 26722.04 | HG49: 556.62 | HH49: 0 | HI49: =SUM(RC[-4]:RC[-1]) -> 43785.66 | HJ49: 24813 | HK49: 122269.3 | HL49: 972.7 | HM49: 0 | HN49: =SUM(RC[-4]:RC[-1]) -> 148055 | HO49: 23668 | HP49: 75472.899999999994 | HQ49: 0 | HR49: 0 | HS49: =SUM(RC[-4]:RC[-1]) -> 99140.9 | HT49: 24993 | HU49: 55655.37 | HV49: 5.04 | HW49: 5.5796257999999996 | HX49: =SUM(RC[-4]:RC[-1]) -> 80658.989625799994 | HY49: 13429 | HZ49: 18055.53 | IA49: 177.64 | IB49: 0.40722525999999998 | IC49: =SUM(RC[-4]:RC[-1]) -> 31662.57722526 | ID49: 3742 | IE49: 7870.5 | IF49: 0 | IG49: 30.159888680000002 | IH49: =SUM(RC[-4]:RC[-1]) -> 11642.65988868 | II49: 1741 | IJ49: 3470.66 | IK49: 0 | IL49: 0 | IM49: =SUM(RC[-4]:RC[-1]) -> 5211.66
A50: NICKEL | B50: =RC[8]+RC[13]+RC[18]+RC[23]+RC[28]+RC[33]+RC[38]+RC[43]+RC[48]+RC[53]+RC[58]+RC[63]+RC[68]+RC[73]+RC[78]+RC[83]+RC[88]+RC[93]+RC[98]+RC[103]+RC[108]+RC[113]+RC[118]+RC[123]+RC[128]+RC[133]+RC[138]+RC[143]+RC[148]+RC[153]+RC[158]+RC[163]+RC[168]+RC[173]+RC[178]+RC[183]+RC[188]+RC[193]+RC[198]+RC[203]+RC[208]+RC[213]+RC[218]+RC[223]+RC[228]+RC[233]+RC[238]+RC[243]+Sheet2!RC[2]+Sheet2!RC[7]+Sheet2!RC[12]+Sheet2!RC[17]+Sheet2!RC[22]+Sheet2!RC[27]+Sheet2!RC[32]+Sheet2!RC[37]+Sheet2!RC[42]+Sheet2!RC[47]+Sheet2!RC[57]+Sheet2!RC[52]+Sheet2!RC[62]+Sheet2!RC[67] -> 40612.5098 | C50: =RC[6]+RC[11]+RC[16]+RC[21]+RC[26]+RC[31]+RC[36]+RC[41]+RC[46]+RC[51]+RC[56]+RC[61]+RC[66]+RC[71]+RC[76]+RC[81]+RC[86]+RC[91]+RC[96]+RC[101]+RC[106]+RC[111]+RC[116]+RC[121]+RC[126]+RC[131]+RC[136]+RC[141]+RC[146]+RC[151]+RC[156]+RC[161]+RC[166]+RC[171]+RC[176]+RC[181]+RC[186]+RC[191]+RC[196]+RC[201]+RC[206]+RC[211]+RC[216]+RC[221]+RC[226]+RC[231]+RC[236]+RC[241]+Sheet2!RC+Sheet2!RC[5]+Sheet2!RC[10]+Sheet2!RC[15]+Sheet2!RC[20]+Sheet2!RC[25]+Sheet2!RC[30]+Sheet2!RC[35]+Sheet2!RC[40]+Sheet2!RC[45]+Sheet2!RC[50]+Sheet2!RC[55]+Sheet2!RC[60]+Sheet2!RC[65] -> 0 | D50: =RC[4]+RC[9]+RC[14]+RC[19]+RC[24]+RC[29]+RC[34]+RC[39]+RC[44]+RC[49]+RC[54]+RC[59]+RC[64]+RC[69]+RC[74]+RC[79]+RC[84]+RC[89]+RC[94]+RC[99]+RC[104]+RC[109]+RC[114]+RC[119]+RC[124]+RC[129]+RC[134]+RC[139]+RC[144]+RC[149]+RC[154]+RC[159]+RC[164]+RC[169]+RC[174]+RC[179]+RC[184]+RC[189]+RC[194]+RC[199]+RC[204]+RC[209]+RC[214]+RC[219]+RC[224]+RC[229]+RC[234]+RC[239]+Sheet2!RC[3]+Sheet2!RC[-2]+Sheet2!RC[8]+Sheet2!RC[13]+Sheet2!RC[18]+Sheet2!RC[23]+Sheet2!RC[28]+Sheet2!RC[33]+Sheet2!RC[38]+Sheet2!RC[43]+Sheet2!RC[48]+Sheet2!RC[53]+Sheet2!RC[58]+Sheet2!RC[63] -> 488 | E50: =RC[6]+RC[11]+RC[16]+RC[21]+RC[26]+RC[31]+RC[36]+RC[41]+RC[46]+RC[51]+RC[56]+RC[61]+RC[66]+RC[71]+RC[76]+RC[81]+RC[86]+RC[91]+RC[96]+RC[101]+RC[106]+RC[111]+RC[116]+RC[121]+RC[126]+RC[131]+RC[136]+RC[141]+RC[146]+RC[151]+RC[156]+RC[161]+RC[166]+RC[171]+RC[176]+RC[181]+RC[186]+RC[191]+RC[196]+RC[201]+RC[206]+RC[211]+RC[216]+RC[221]+RC[226]+RC[231]+RC[236]+RC[241]+Sheet2!RC+Sheet2!RC[5]+Sheet2!RC[10]+Sheet2!RC[15]+Sheet2!RC[20]+Sheet2!RC[25]+Sheet2!RC[30]+Sheet2!RC[35]+Sheet2!RC[40]+Sheet2!RC[45]+Sheet2!RC[50]+Sheet2!RC[55]+Sheet2!RC[60]+Sheet2!RC[65] -> 9702.0997719000006 | F50: =SUM(RC[-4]:RC[-1]) -> 50802.6095719 | G50: =Sheet1!RC[5]+Sheet1!RC[10]+Sheet1!RC[15]+Sheet1!RC[20]+Sheet1!RC[25]+Sheet1!RC[30]+Sheet1!RC[35]+Sheet1!RC[40]+Sheet1!RC[45]+Sheet1!RC[50]+Sheet1!RC[55]+Sheet1!RC[60]+Sheet1!RC[65]+Sheet1!RC[70]+Sheet1!RC[75]+Sheet1!RC[80]+Sheet1!RC[85]+Sheet1!RC[90]+Sheet1!RC[95]+Sheet1!RC[100]+Sheet1!RC[105]+Sheet1!RC[110]+Sheet1!RC[115]+Sheet1!RC[120]+Sheet1!RC[125]+Sheet1!RC[130]+Sheet1!RC[135]+Sheet1!RC[140]+Sheet1!RC[145]+Sheet1!RC[150]+Sheet1!RC[155]+Sheet1!RC[160]+Sheet1!RC[165]+Sheet1!RC[170]+Sheet1!RC[175]+Sheet1!RC[180]+Sheet1!RC[185]+Sheet1!RC[190]+Sheet1!RC[195]+Sheet1!RC[200]+Sheet1!RC[205]+Sheet1!RC[210]+Sheet1!RC[215]+Sheet1!RC[220]+Sheet1!RC[225]+Sheet1!RC[230]+Sheet1!RC[235]+Sheet1!RC[240]+Sheet2!RC[-1]+Sheet2!RC[4]+Sheet2!RC[9]+Sheet2!RC[14]+Sheet2!RC[19]+Sheet2!RC[24]+Sheet2!RC[29]+Sheet2!RC[34]+Sheet2!RC[39]+Sheet2!RC[44]+Sheet2!RC[49]+Sheet2!RC[54]+Sheet2!RC[59]+Sheet2!RC[64] -> 50802.609571899986 | H50: 14 | I50: 0 | J50: 744.64 | K50: 2304.2422195000008 | L50: =SUM(RC[-4]:RC[-1]) -> 3062.8822195000007 | M50: 2 | N50: 0 | O50: 6.75 | P50: 3.5127986 | Q50: =SUM(RC[-4]:RC[-1]) -> 12.2627986 | R50: 13 | S50: 0 | T50: 3004.35 | U50: 128.97886169999995 | V50: =SUM(RC[-4]:RC[-1]) -> 3146.3288616999998 | W50: 9 | X50: 0 | Y50: 88.62 | Z50: 7.0106231999999986 | AA50: =SUM(RC[-4]:RC[-1]) -> 104.6306232 | AB50: 4 | AC50: 0 | AD50: 0.02 | AE50: 14.612721000000002 | AF50: =SUM(RC[-4]:RC[-1]) -> 18.632721000000004 | AG50: 3 | AH50: 0 | AI50: 133.55000000000001 | AJ50: 106.34945099999996 | AK50: =SUM(RC[-4]:RC[-1]) -> 242.89945099999997 | AL50: 7 | AM50: 0 | AN50: 627.99 | AO50: 349.15755439999998 | AP50: =SUM(RC[-4]:RC[-1]) -> 984.14755439999999 | AQ50: 3 | AR50: 0 | AS50: 29.64 | AT50: 3.837046800000004 | AU50: =SUM(RC[-4]:RC[-1]) -> 36.477046800000004 | AV50: 2 | AW50: 0 | AX50: 54.86 | AY50: 4.9077785999999985 | AZ50: =SUM(RC[-4]:RC[-1]) -> 61.7677786 | BA50: 4 | BB50: 0 | BC50: 34.11 | BD50: 5.0002403999999974 | BE50: =SUM(RC[-4]:RC[-1]) -> 43.110240399999995 | BF50: 3 | BG50: 0 | BH50: 5.88 | BI50: 473.44556960000011 | BJ50: =SUM(RC[-4]:RC[-1]) -> 482.32556960000011 | BK50: 3 | BL50: 0 | BM50: 12.37 | BN50: 4.5231490999999977 | BO50: =SUM(RC[-4]:RC[-1]) -> 19.893149099999995 | BP50: 2 | BQ50: 0 | BR50: 267.02 | BS50: 5.4957870000000009 | BT50: =SUM(RC[-4]:RC[-1]) -> 274.51578699999999 | BU50: 10 | BV50: 0 | BW50: 102.76 | BX50: 14.2748176 | BY50: =SUM(RC[-4]:RC[-1]) -> 127.03481760000001 | BZ50: 32 | CA50: 0 | CB50: 5401.8 | CC50: 1186.8274598999997 | CD50: =SUM(RC[-4]:RC[-1]) -> 6620.6274598999998 | CE50: 3 | CF50: 0 | CG50: 74.536799999999999 | CH50: 6.5053112999999998 | CI50: =SUM(RC[-4]:RC[-1]) -> 84.042111300000002 | CJ50: 2 | CK50: 0 | CL50: 0 | CM50: 9.5988095999999992 | CN50: =SUM(RC[-4]:RC[-1]) -> 11.598809599999999 | CO50: 2 | CP50: 0 | CQ50: 0.02 | CR50: 2.9928300000000001 | CS50: =SUM(RC[-4]:RC[-1]) -> 5.0128300000000001 | CT50: 5 | CU50: 0 | CV50: 43.33 | CW50: 3.0108306000000007 | CX50: =SUM(RC[-4]:RC[-1]) -> 51.340830599999997 | CY50: 3 | CZ50: 0 | DA50: 168.61 | DB50: 2.6607924000000001 | DC50: =SUM(RC[-4]:RC[-1]) -> 174.2707924 | DD50: 1 | DE50: 0 | DF50: 0 | DG50: 0.38428440000000003 | DH50: =SUM(RC[-4]:RC[-1]) -> 1.3842844000000001 | DI50: 3 | DJ50: 0 | DK50: 3.68 | DL50: 5.1005609999999981 | DM50: =SUM(RC[-4]:RC[-1]) -> 11.780560999999999 | DN50: 6 | DO50: 0 | DP50: 135.27000000000001 | DQ50: 12.068793399999997 | DR50: =SUM(RC[-4]:RC[-1]) -> 153.33879340000001 | DS50: 18 | DT50: 0 | DU50: 2441.35 | DV50: 231.49043259999999 | DW50: =SUM(RC[-4]:RC[-1]) -> 2690.8404326 | DX50: 1 | DY50: 0 | DZ50: 21.51 | EA50: 3.3531757999999994 | EB50: =SUM(RC[-4]:RC[-1]) -> 25.8631758 | EC50: 4 | ED50: 0 | EE50: 353.54 | EF50: 3.148069 | EG50: =SUM(RC[-4]:RC[-1]) -> 360.68806900000004 | EH50: 3 | EI50: 0 | EJ50: 0 | EK50: 2.7965957999999986 | EL50: =SUM(RC[-4]:RC[-1]) -> 5.7965957999999986 | EM50: 24 | EN50: 0 | EO50: 372.77 | EP50: 42.807524900000026 | EQ50: =SUM(RC[-4]:RC[-1]) -> 439.57752490000001 | ER50: 4 | ES50: 0 | ET50: 39.74 | EU50: 2.2624603999999997 | EV50: =SUM(RC[-4]:RC[-1]) -> 46.002460400000004 | EW50: 43 | EX50: 0 | EY50: 545.59900000000005 | EZ50: 160.5604582 | FA50: =SUM(RC[-4]:RC[-1]) -> 749.15945820000002 | FB50: 11 | FC50: 0 | FD50: 8195.98 | FE50: 229.65979990000008 | FF50: =SUM(RC[-4]:RC[-1]) -> 8436.6397999000001 | FG50: 6 | FH50: 0 | FI50: 946.9 | FJ50: 113.62081959999999 | FK50: =SUM(RC[-4]:RC[-1]) -> 1066.5208195999999 | FL50: 9 | FM50: 0 | FN50: 302.58999999999997 | FO50: 121.97442679999995 | FP50: =SUM(RC[-4]:RC[-1]) -> 433.56442679999992 | FQ50: 16 | FR50: 0 | FS50: 450.8 | FT50: 21.377541299999997 | FU50: =SUM(RC[-4]:RC[-1]) -> 488.17754130000003 | FV50: 5 | FW50: 0 | FX50: 29.8 | FY50: 6.8976948000000027 | FZ50: =SUM(RC[-4]:RC[-1]) -> 41.697694800000001 | GA50: 4 | GB50: 0 | GC50: 1373.74 | GD50: 606.59312039999998 | GE50: =SUM(RC[-4]:RC[-1]) -> 1984.3331204000001 | GF50: 1 | GG50: 0 | GH50: 4.0540000000000003 | GI50: 103.9178562 | GJ50: =SUM(RC[-4]:RC[-1]) -> 108.9718562 | GK50: 5 | GL50: 0 | GM50: 522.1 | GN50: 110.34317099999996 | GO50: =SUM(RC[-4]:RC[-1]) -> 637.44317100000001 | GP50: 3 | GQ50: 0 | GR50: 0.86 | GS50: 4.0716662000000028 | GT50: =SUM(RC[-4]:RC[-1]) -> 7.9316662000000022 | GU50: 4 | GV50: 0 | GW50: 0 | GX50: 593.25480199999993 | GY50: =SUM(RC[-4]:RC[-1]) -> 597.25480199999993 | GZ50: 26 | HA50: 0 | HB50: 5625.11 | HC50: 366.35795269999966 | HD50: =SUM(RC[-4]:RC[-1]) -> 6017.4679526999989 | HE50: 5 | HF50: 0 | HG50: 201.79 | HH50: 204.91563019999995 | HI50: =SUM(RC[-4]:RC[-1]) -> 411.70563019999997 | HJ50: 9 | HK50: 0 | HL50: 1140 | HM50: 16.500614800000001 | HN50: =SUM(RC[-4]:RC[-1]) -> 1165.5006148 | HO50: 10 | HP50: 0 | HQ50: 66.22 | HR50: 621.43958740000028 | HS50: =SUM(RC[-4]:RC[-1]) -> 697.65958740000031 | HT50: 8 | HU50: 0 | HV50: 201.21 | HW50: 12.852883200000003 | HX50: =SUM(RC[-4]:RC[-1]) -> 222.06288320000002 | HY50: 5 | HZ50: 0 | IA50: 866.74 | IB50: 41.597180399999999 | IC50: =SUM(RC[-4]:RC[-1]) -> 913.33718039999997 | ID50: 2 | IE50: 0 | IF50: 0.63 | IG50: 4.6428026000000022 | IH50: =SUM(RC[-4]:RC[-1]) -> 7.2728026000000021 | II50: 1 | IJ50: 0 | IK50: 298.8 | IL50: 1.2081842000000003 | IM50: =SUM(RC[-4]:RC[-1]) -> 301.00818420000002
A51: PCDD | B51: =RC[8]+RC[13]+RC[18]+RC[23]+RC[28]+RC[33]+RC[38]+RC[43]+RC[48]+RC[53]+RC[58]+RC[63]+RC[68]+RC[73]+RC[78]+RC[83]+RC[88]+RC[93]+RC[98]+RC[103]+RC[108]+RC[113]+RC[118]+RC[123]+RC[128]+RC[133]+RC[138]+RC[143]+RC[148]+RC[153]+RC[158]+RC[163]+RC[168]+RC[173]+RC[178]+RC[183]+RC[188]+RC[193]+RC[198]+RC[203]+RC[208]+RC[213]+RC[218]+RC[223]+RC[228]+RC[233]+RC[238]+RC[243]+Sheet2!RC[2]+Sheet2!RC[7]+Sheet2!RC[12]+Sheet2!RC[17]+Sheet2!RC[22]+Sheet2!RC[27]+Sheet2!RC[32]+Sheet2!RC[37]+Sheet2!RC[42]+Sheet2!RC[47]+Sheet2!RC[57]+Sheet2!RC[52]+Sheet2!RC[62]+Sheet2!RC[67] -> 0 | C51: =RC[6]+RC[11]+RC[16]+RC[21]+RC[26]+RC[31]+RC[36]+RC[41]+RC[46]+RC[51]+RC[56]+RC[61]+RC[66]+RC[71]+RC[76]+RC[81]+RC[86]+RC[91]+RC[96]+RC[101]+RC[106]+RC[111]+RC[116]+RC[121]+RC[126]+RC[131]+RC[136]+RC[141]+RC[146]+RC[151]+RC[156]+RC[161]+RC[166]+RC[171]+RC[176]+RC[181]+RC[186]+RC[191]+RC[196]+RC[201]+RC[206]+RC[211]+RC[216]+RC[221]+RC[226]+RC[231]+RC[236]+RC[241]+Sheet2!RC+Sheet2!RC[5]+Sheet2!RC[10]+Sheet2!RC[15]+Sheet2!RC[20]+Sheet2!RC[25]+Sheet2!RC[30]+Sheet2!RC[35]+Sheet2!RC[40]+Sheet2!RC[45]+Sheet2!RC[50]+Sheet2!RC[55]+Sheet2!RC[60]+Sheet2!RC[65] -> 0 | D51: =RC[4]+RC[9]+RC[14]+RC[19]+RC[24]+RC[29]+RC[34]+RC[39]+RC[44]+RC[49]+RC[54]+RC[59]+RC[64]+RC[69]+RC[74]+RC[79]+RC[84]+RC[89]+RC[94]+RC[99]+RC[104]+RC[109]+RC[114]+RC[119]+RC[124]+RC[129]+RC[134]+RC[139]+RC[144]+RC[149]+RC[154]+RC[159]+RC[164]+RC[169]+RC[174]+RC[179]+RC[184]+RC[189]+RC[194]+RC[199]+RC[204]+RC[209]+RC[214]+RC[219]+RC[224]+RC[229]+RC[234]+RC[239]+Sheet2!RC[3]+Sheet2!RC[-2]+Sheet2!RC[8]+Sheet2!RC[13]+Sheet2!RC[18]+Sheet2!RC[23]+Sheet2!RC[28]+Sheet2!RC[33]+Sheet2!RC[38]+Sheet2!RC[43]+Sheet2!RC[48]+Sheet2!RC[53]+Sheet2!RC[58]+Sheet2!RC[63] -> 0 | E51: =RC[6]+RC[11]+RC[16]+RC[21]+RC[26]+RC[31]+RC[36]+RC[41]+RC[46]+RC[51]+RC[56]+RC[61]+RC[66]+RC[71]+RC[76]+RC[81]+RC[86]+RC[91]+RC[96]+RC[101]+RC[106]+RC[111]+RC[116]+RC[121]+RC[126]+RC[131]+RC[136]+RC[141]+RC[146]+RC[151]+RC[156]+RC[161]+RC[166]+RC[171]+RC[176]+RC[181]+RC[186]+RC[191]+RC[196]+RC[201]+RC[206]+RC[211]+RC[216]+RC[221]+RC[226]+RC[231]+RC[236]+RC[241]+Sheet2!RC+Sheet2!RC[5]+Sheet2!RC[10]+Sheet2!RC[15]+Sheet2!RC[20]+Sheet2!RC[25]+Sheet2!RC[30]+Sheet2!RC[35]+Sheet2!RC[40]+Sheet2!RC[45]+Sheet2!RC[50]+Sheet2!RC[55]+Sheet2!RC[60]+Sheet2!RC[65] -> 0 | F51: =SUM(RC[-4]:RC[-1]) -> 0 | G51: =Sheet1!RC[5]+Sheet1!RC[10]+Sheet1!RC[15]+Sheet1!RC[20]+Sheet1!RC[25]+Sheet1!RC[30]+Sheet1!RC[35]+Sheet1!RC[40]+Sheet1!RC[45]+Sheet1!RC[50]+Sheet1!RC[55]+Sheet1!RC[60]+Sheet1!RC[65]+Sheet1!RC[70]+Sheet1!RC[75]+Sheet1!RC[80]+Sheet1!RC[85]+Sheet1!RC[90]+Sheet1!RC[95]+Sheet1!RC[100]+Sheet1!RC[105]+Sheet1!RC[110]+Sheet1!RC[115]+Sheet1!RC[120]+Sheet1!RC[125]+Sheet1!RC[130]+Sheet1!RC[135]+Sheet1!RC[140]+Sheet1!RC[145]+Sheet1!RC[150]+Sheet1!RC[155]+Sheet1!RC[160]+Sheet1!RC[165]+Sheet1!RC[170]+Sheet1!RC[175]+Sheet1!RC[180]+Sheet1!RC[185]+Sheet1!RC[190]+Sheet1!RC[195]+Sheet1!RC[200]+Sheet1!RC[205]+Sheet1!RC[210]+Sheet1!RC[215]+Sheet1!RC[220]+Sheet1!RC[225]+Sheet1!RC[230]+Sheet1!RC[235]+Sheet1!RC[240]+Sheet2!RC[-1]+Sheet2!RC[4]+Sheet2!RC[9]+Sheet2!RC[14]+Sheet2!RC[19]+Sheet2!RC[24]+Sheet2!RC[29]+Sheet2!RC[34]+Sheet2!RC[39]+Sheet2!RC[44]+Sheet2!RC[49]+Sheet2!RC[54]+Sheet2!RC[59]+Sheet2!RC[64] -> 0 | H51: 0 | I51: 0 | J51: 0 | K51: 0 | L51: =SUM(RC[-4]:RC[-1]) -> 0 | M51: 0 | N51: 0 | O51: 0 | P51: 0 | Q51: =SUM(RC[-4]:RC[-1]) -> 0 | R51: 0 | S51: 0 | T51: 0 | U51: 0 | V51: =SUM(RC[-4]:RC[-1]) -> 0 | W51: 0 | X51: 0 | Y51: 0 | Z51: 0 | AA51: =SUM(RC[-4]:RC[-1]) -> 0 | AB51: 0 | AC51: 0 | AD51: 0 | AE51: 0 | AF51: =SUM(RC[-4]:RC[-1]) -> 0 | AG51: 0 | AH51: 0 | AI51: 0 | AJ51: 0 | AK51: =SUM(RC[-4]:RC[-1]) -> 0 | AL51: 0 | AM51: 0 | AN51: 0 | AO51: 0 | AP51: =SUM(RC[-4]:RC[-1]) -> 0 | AQ51: 0 | AR51: 0 | AS51: 0 | AT51: 0 | AU51: =SUM(RC[-4]:RC[-1]) -> 0 | AV51: 0 | AW51: 0 | AX51: 0 | AY51: 0 | AZ51: =SUM(RC[-4]:RC[-1]) -> 0 | BA51: 0 | BB51: 0 | BC51: 0 | BD51: 0 | BE51: =SUM(RC[-4]:RC[-1]) -> 0 | BF51: 0 | BG51: 0 | BH51: 0 | BI51: 0 | BJ51: =SUM(RC[-4]:RC[-1]) -> 0 | BK51: 0 | BL51: 0 | BM51: 0 | BN51: 0 | BO51: =SUM(RC[-4]:RC[-1]) -> 0 | BP51: 0 | BQ51: 0 | BR51: 0 | BS51: 0 | BT51: =SUM(RC[-4]:RC[-1]) -> 0 | BU51: 0 | BV51: 0 | BW51: 0 | BX51: 0 | BY51: =SUM(RC[-4]:RC[-1]) -> 0 | BZ51: 0 | CA51: 0 | CB51: 0 | CC51: 0 | CD51: =SUM(RC[-4]:RC[-1]) -> 0 | CE51: 0 | CF51: 0 | CG51: 0 | CH51: 0 | CI51: =SUM(RC[-4]:RC[-1]) -> 0 | CJ51: 0 | CK51: 0 | CL51: 0 | CM51: 0 | CN51: =SUM(RC[-4]:RC[-1]) -> 0 | CO51: 0 | CP51: 0 | CQ51: 0 | CR51: 0 | CS51: =SUM(RC[-4]:RC[-1]) -> 0 | CT51: 0 | CU51: 0 | CV51: 0 | CW51: 0 | CX51: =SUM(RC[-4]:RC[-1]) -> 0 | CY51: 0 | CZ51: 0 | DA51: 0 | DB51: 0 | DC51: =SUM(RC[-4]:RC[-1]) -> 0 | DD51: 0 | DE51: 0 | DF51: 0 | DG51: 0 | DH51: =SUM(RC[-4]:RC[-1]) -> 0 | DI51: 0 | DJ51: 0 | DK51: 0 | DL51: 0 | DM51: =SUM(RC[-4]:RC[-1]) -> 0 | DN51: 0 | DO51: 0 | DP51: 0 | DQ51: 0 | DR51: =SUM(RC[-4]:RC[-1]) -> 0 | DS51: 0 | DT51: 0 | DU51: 0 | DV51: 0 | DW51: =SUM(RC[-4]:RC[-1]) -> 0 | DX51: 0 | DY51: 0 | DZ51: 0 | EA51: 0 | EB51: =SUM(RC[-4]:RC[-1]) -> 0 | EC51: 0 | ED51: 0 | EE51: 0 | EF51: 0 | EG51: =SUM(RC[-4]:RC[-1]) -> 0 | EH51: 0 | EI51: 0 | EJ51: 0 | EK51: 0 | EL51: =SUM(RC[-4]:RC[-1]) -> 0 | EM51: 0 | EN51: 0 | EO51: 0 | EP51: 0 | EQ51: =SUM(RC[-4]:RC[-1]) -> 0 | ER51: 0 | ES51: 0 | ET51: 0 | EU51: 0 | EV51: =SUM(RC[-4]:RC[-1]) -> 0 | EW51: 0 | EX51: 0 | EY51: 0 | EZ51: 0 | FA51: =SUM(RC[-4]:RC[-1]) -> 0 | FB51: 0 | FC51: 0 | FD51: 0 | FE51: 0 | FF51: =SUM(RC[-4]:RC[-1]) -> 0 | FG51: 0 | FH51: 0 | FI51: 0 | FJ51: 0 | FK51: =SUM(RC[-4]:RC[-1]) -> 0 | FL51: 0 | FM51: 0 | FN51: 0 | FO51: 0 | FP51: =SUM(RC[-4]:RC[-1]) -> 0 | FQ51: 0 | FR51: 0 | FS51: 0 | FT51: 0 | FU51: =SUM(RC[-4]:RC[-1]) -> 0 | FV51: 0 | FW51: 0 | FX51: 0 | FY51: 0 | FZ51: =SUM(RC[-4]:RC[-1]) -> 0 | GA51: 0 | GB51: 0 | GC51: 0 | GD51: 0 | GE51: =SUM(RC[-4]:RC[-1]) -> 0 | GF51: 0 | GG51: 0 | GH51: 0 | GI51: 0 | GJ51: =SUM(RC[-4]:RC[-1]) -> 0 | GK51: 0 | GL51: 0 | GM51: 0 | GN51: 0 | GO51: =SUM(RC[-4]:RC[-1]) -> 0 | GP51: 0 | GQ51: 0 | GR51: 0 | GS51: 0 | GT51: =SUM(RC[-4]:RC[-1]) -> 0 | GU51: 0 | GV51: 0 | GW51: 0 | GX51: 0 | GY51: =SUM(RC[-4]:RC[-1]) -> 0 | GZ51: 0 | HA51: 0 | HB51: 0 | HC51: 0 | HD51: =SUM(RC[-4]:RC[-1]) -> 0 | HE51: 0 | HF51: 0 | HG51: 0 | HH51: 0 | HI51: =SUM(RC[-4]:RC[-1]) -> 0 | HJ51: 0 | HK51: 0 | HL51: 0 | HM51: 0 | HN51: =SUM(RC[-4]:RC[-1]) -> 0 | HO51: 0 | HP51: 0 | HQ51: 0 | HR51: 0 | HS51: =SUM(RC[-4]:RC[-1]) -> 0 | HT51: 0 | HU51: 0 | HV51: 0 | HW51: 0 | HX51: =SUM(RC[-4]:RC[-1]) -> 0 | HY51: 0 | HZ51: 0 | IA51: 0 | IB51: 0 | IC51: =SUM(RC[-4]:RC[-1]) -> 0 | ID51: 0 | IE51: 0 | IF51: 0 | IG51: 0 | IH51: =SUM(RC[-4]:RC[-1]) -> 0 | II51: 0 | IJ51: 0 | IK51: 0 | IL51: 0 | IM51: =SUM(RC[-4]:RC[-1]) -> 0
A52: PCDF | B52: =RC[8]+RC[13]+RC[18]+RC[23]+RC[28]+RC[33]+RC[38]+RC[43]+RC[48]+RC[53]+RC[58]+RC[63]+RC[68]+RC[73]+RC[78]+RC[83]+RC[88]+RC[93]+RC[98]+RC[103]+RC[108]+RC[113]+RC[118]+RC[123]+RC[128]+RC[133]+RC[138]+RC[143]+RC[148]+RC[153]+RC[158]+RC[163]+RC[168]+RC[173]+RC[178]+RC[183]+RC[188]+RC[193]+RC[198]+RC[203]+RC[208]+RC[213]+RC[218]+RC[223]+RC[228]+RC[233]+RC[238]+RC[243]+Sheet2!RC[2]+Sheet2!RC[7]+Sheet2!RC[12]+Sheet2!RC[17]+Sheet2!RC[22]+Sheet2!RC[27]+Sheet2!RC[32]+Sheet2!RC[37]+Sheet2!RC[42]+Sheet2!RC[47]+Sheet2!RC[57]+Sheet2!RC[52]+Sheet2!RC[62]+Sheet2!RC[67] -> 0 | C52: =RC[6]+RC[11]+RC[16]+RC[21]+RC[26]+RC[31]+RC[36]+RC[41]+RC[46]+RC[51]+RC[56]+RC[61]+RC[66]+RC[71]+RC[76]+RC[81]+RC[86]+RC[91]+RC[96]+RC[101]+RC[106]+RC[111]+RC[116]+RC[121]+RC[126]+RC[131]+RC[136]+RC[141]+RC[146]+RC[151]+RC[156]+RC[161]+RC[166]+RC[171]+RC[176]+RC[181]+RC[186]+RC[191]+RC[196]+RC[201]+RC[206]+RC[211]+RC[216]+RC[221]+RC[226]+RC[231]+RC[236]+RC[241]+Sheet2!RC+Sheet2!RC[5]+Sheet2!RC[10]+Sheet2!RC[15]+Sheet2!RC[20]+Sheet2!RC[25]+Sheet2!RC[30]+Sheet2!RC[35]+Sheet2!RC[40]+Sheet2!RC[45]+Sheet2!RC[50]+Sheet2!RC[55]+Sheet2!RC[60]+Sheet2!RC[65] -> 0 | D52: =RC[4]+RC[9]+RC[14]+RC[19]+RC[24]+RC[29]+RC[34]+RC[39]+RC[44]+RC[49]+RC[54]+RC[59]+RC[64]+RC[69]+RC[74]+RC[79]+RC[84]+RC[89]+RC[94]+RC[99]+RC[104]+RC[109]+RC[114]+RC[119]+RC[124]+RC[129]+RC[134]+RC[139]+RC[144]+RC[149]+RC[154]+RC[159]+RC[164]+RC[169]+RC[174]+RC[179]+RC[184]+RC[189]+RC[194]+RC[199]+RC[204]+RC[209]+RC[214]+RC[219]+RC[224]+RC[229]+RC[234]+RC[239]+Sheet2!RC[3]+Sheet2!RC[-2]+Sheet2!RC[8]+Sheet2!RC[13]+Sheet2!RC[18]+Sheet2!RC[23]+Sheet2!RC[28]+Sheet2!RC[33]+Sheet2!RC[38]+Sheet2!RC[43]+Sheet2!RC[48]+Sheet2!RC[53]+Sheet2!RC[58]+Sheet2!RC[63] -> 0 | E52: =RC[6]+RC[11]+RC[16]+RC[21]+RC[26]+RC[31]+RC[36]+RC[41]+RC[46]+RC[51]+RC[56]+RC[61]+RC[66]+RC[71]+RC[76]+RC[81]+RC[86]+RC[91]+RC[96]+RC[101]+RC[106]+RC[111]+RC[116]+RC[121]+RC[126]+RC[131]+RC[136]+RC[141]+RC[146]+RC[151]+RC[156]+RC[161]+RC[166]+RC[171]+RC[176]+RC[181]+RC[186]+RC[191]+RC[196]+RC[201]+RC[206]+RC[211]+RC[216]+RC[221]+RC[226]+RC[231]+RC[236]+RC[241]+Sheet2!RC+Sheet2!RC[5]+Sheet2!RC[10]+Sheet2!RC[15]+Sheet2!RC[20]+Sheet2!RC[25]+Sheet2!RC[30]+Sheet2!RC[35]+Sheet2!RC[40]+Sheet2!RC[45]+Sheet2!RC[50]+Sheet2!RC[55]+Sheet2!RC[60]+Sheet2!RC[65] -> 0 | F52: =SUM(RC[-4]:RC[-1]) -> 0 | G52: =Sheet1!RC[5]+Sheet1!RC[10]+Sheet1!RC[15]+Sheet1!RC[20]+Sheet1!RC[25]+Sheet1!RC[30]+Sheet1!RC[35]+Sheet1!RC[40]+Sheet1!RC[45]+Sheet1!RC[50]+Sheet1!RC[55]+Sheet1!RC[60]+Sheet1!RC[65]+Sheet1!RC[70]+Sheet1!RC[75]+Sheet1!RC[80]+Sheet1!RC[85]+Sheet1!RC[90]+Sheet1!RC[95]+Sheet1!RC[100]+Sheet1!RC[105]+Sheet1!RC[110]+Sheet1!RC[115]+Sheet1!RC[120]+Sheet1!RC[125]+Sheet1!RC[130]+Sheet1!RC[135]+Sheet1!RC[140]+Sheet1!RC[145]+Sheet1!RC[150]+Sheet1!RC[155]+Sheet1!RC[160]+Sheet1!RC[165]+Sheet1!RC[170]+Sheet1!RC[175]+Sheet1!RC[180]+Sheet1!RC[185]+Sheet1!RC[190]+Sheet1!RC[195]+Sheet1!RC[200]+Sheet1!RC[205]+Sheet1!RC[210]+Sheet1!RC[215]+Sheet1!RC[220]+Sheet1!RC[225]+Sheet1!RC[230]+Sheet1!RC[235]+Sheet1!RC[240]+Sheet2!RC[-1]+Sheet2!RC[4]+Sheet2!RC[9]+Sheet2!RC[14]+Sheet2!RC[19]+Sheet2!RC[24]+Sheet2!RC[29]+Sheet2!RC[34]+Sheet2!RC[39]+Sheet2!RC[44]+Sheet2!RC[49]+Sheet2!RC[54]+Sheet2!RC[59]+Sheet2!RC[64] -> 0 | H52: 0 | I52: 0 | J52: 0 | K52: 0 | L52: =SUM(RC[-4]:RC[-1]) -> 0 | M52: 0 | N52: 0 | O52: 0 | P52: 0 | Q52: =SUM(RC[-4]:RC[-1]) -> 0 | R52: 0 | S52: 0 | T52: 0 | U52: 0 | V52: =SUM(RC[-4]:RC[-1]) -> 0 | W52: 0 | X52: 0 | Y52: 0 | Z52: 0 | AA52: =SUM(RC[-4]:RC[-1]) -> 0 | AB52: 0 | AC52: 0 | AD52: 0 | AE52: 0 | AF52: =SUM(RC[-4]:RC[-1]) -> 0 | AG52: 0 | AH52: 0 | AI52: 0 | AJ52: 0 | AK52: =SUM(RC[-4]:RC[-1]) -> 0 | AL52: 0 | AM52: 0 | AN52: 0 | AO52: 0 | AP52: =SUM(RC[-4]:RC[-1]) -> 0 | AQ52: 0 | AR52: 0 | AS52: 0 | AT52: 0 | AU52: =SUM(RC[-4]:RC[-1]) -> 0 | AV52: 0 | AW52: 0 | AX52: 0 | AY52: 0 | AZ52: =SUM(RC[-4]:RC[-1]) -> 0 | BA52: 0 | BB52: 0 | BC52: 0 | BD52: 0 | BE52: =SUM(RC[-4]:RC[-1]) -> 0 | BF52: 0 | BG52: 0 | BH52: 0 | BI52: 0 | BJ52: =SUM(RC[-4]:RC[-1]) -> 0 | BK52: 0 | BL52: 0 | BM52: 0 | BN52: 0 | BO52: =SUM(RC[-4]:RC[-1]) -> 0 | BP52: 0 | BQ52: 0 | BR52: 0 | BS52: 0 | BT52: =SUM(RC[-4]:RC[-1]) -> 0 | BU52: 0 | BV52: 0 | BW52: 0 | BX52: 0 | BY52: =SUM(RC[-4]:RC[-1]) -> 0 | BZ52: 0 | CA52: 0 | CB52: 0 | CC52: 0 | CD52: =SUM(RC[-4]:RC[-1]) -> 0 | CE52: 0 | CF52: 0 | CG52: 0 | CH52: 0 | CI52: =SUM(RC[-4]:RC[-1]) -> 0 | CJ52: 0 | CK52: 0 | CL52: 0 | CM52: 0 | CN52: =SUM(RC[-4]:RC[-1]) -> 0 | CO52: 0 | CP52: 0 | CQ52: 0 | CR52: 0 | CS52: =SUM(RC[-4]:RC[-1]) -> 0 | CT52: 0 | CU52: 0 | CV52: 0 | CW52: 0 | CX52: =SUM(RC[-4]:RC[-1]) -> 0 | CY52: 0 | CZ52: 0 | DA52: 0 | DB52: 0 | DC52: =SUM(RC[-4]:RC[-1]) -> 0 | DD52: 0 | DE52: 0 | DF52: 0 | DG52: 0 | DH52: =SUM(RC[-4]:RC[-1]) -> 0 | DI52: 0 | DJ52: 0 | DK52: 0 | DL52: 0 | DM52: =SUM(RC[-4]:RC[-1]) -> 0 | DN52: 0 | DO52: 0 | DP52: 0 | DQ52: 0 | DR52: =SUM(RC[-4]:RC[-1]) -> 0 | DS52: 0 | DT52: 0 | DU52: 0 | DV52: 0 | DW52: =SUM(RC[-4]:RC[-1]) -> 0 | DX52: 0 | DY52: 0 | DZ52: 0 | EA52: 0 | EB52: =SUM(RC[-4]:RC[-1]) -> 0 | EC52: 0 | ED52: 0 | EE52: 0 | EF52: 0 | EG52: =SUM(RC[-4]:RC[-1]) -> 0 | EH52: 0 | EI52: 0 | EJ52: 0 | EK52: 0 | EL52: =SUM(RC[-4]:RC[-1]) -> 0 | EM52: 0 | EN52: 0 | EO52: 0 | EP52: 0 | EQ52: =SUM(RC[-4]:RC[-1]) -> 0 | ER52: 0 | ES52: 0 | ET52: 0 | EU52: 0 | EV52: =SUM(RC[-4]:RC[-1]) -> 0 | EW52: 0 | EX52: 0 | EY52: 0 | EZ52: 0 | FA52: =SUM(RC[-4]:RC[-1]) -> 0 | FB52: 0 | FC52: 0 | FD52: 0 | FE52: 0 | FF52: =SUM(RC[-4]:RC[-1]) -> 0 | FG52: 0 | FH52: 0 | FI52: 0 | FJ52: 0 | FK52: =SUM(RC[-4]:RC[-1]) -> 0 | FL52: 0 | FM52: 0 | FN52: 0 | FO52: 0 | FP52: =SUM(RC[-4]:RC[-1]) -> 0 | FQ52: 0 | FR52: 0 | FS52: 0 | FT52: 0 | FU52: =SUM(RC[-4]:RC[-1]) -> 0 | FV52: 0 | FW52: 0 | FX52: 0 | FY52: 0 | FZ52: =SUM(RC[-4]:RC[-1]) -> 0 | GA52: 0 | GB52: 0 | GC52: 0 | GD52: 0 | GE52: =SUM(RC[-4]:RC[-1]) -> 0 | GF52: 0 | GG52: 0 | GH52: 0 | GI52: 0 | GJ52: =SUM(RC[-4]:RC[-1]) -> 0 | GK52: 0 | GL52: 0 | GM52: 0 | GN52: 0 | GO52: =SUM(RC[-4]:RC[-1]) -> 0 | GP52: 0 | GQ52: 0 | GR52: 0 | GS52: 0 | GT52: =SUM(RC[-4]:RC[-1]) -> 0 | GU52: 0 | GV52: 0 | GW52: 0 | GX52: 0 | GY52: =SUM(RC[-4]:RC[-1]) -> 0 | GZ52: 0 | HA52: 0 | HB52: 0 | HC52: 0 | HD52: =SUM(RC[-4]:RC[-1]) -> 0 | HE52: 0 | HF52: 0 | HG52: 0 | HH52: 0 | HI52: =SUM(RC[-4]:RC[-1]) -> 0 | HJ52: 0 | HK52: 0 | HL52: 0 | HM52: 0 | HN52: =SUM(RC[-4]:RC[-1]) -> 0 | HO52: 0 | HP52: 0 | HQ52: 0 | HR52: 0 | HS52: =SUM(RC[-4]:RC[-1]) -> 0 | HT52: 0 | HU52: 0 | HV52: 0 | HW52: 0 | HX52: =SUM(RC[-4]:RC[-1]) -> 0 | HY52: 0 | HZ52: 0 | IA52: 0 | IB52: 0 | IC52: =SUM(RC[-4]:RC[-1]) -> 0 | ID52: 0 | IE52: 0 | IF52: 0 | IG52: 0 | IH52: =SUM(RC[-4]:RC[-1]) -> 0 | II52: 0 | IJ52: 0 | IK52: 0 | IL52: 0 | IM52: =SUM(RC[-4]:RC[-1]) -> 0
A53: PERC | B53: =RC[8]+RC[13]+RC[18]+RC[23]+RC[28]+RC[33]+RC[38]+RC[43]+RC[48]+RC[53]+RC[58]+RC[63]+RC[68]+RC[73]+RC[78]+RC[83]+RC[88]+RC[93]+RC[98]+RC[103]+RC[108]+RC[113]+RC[118]+RC[123]+RC[128]+RC[133]+RC[138]+RC[143]+RC[148]+RC[153]+RC[158]+RC[163]+RC[168]+RC[173]+RC[178]+RC[183]+RC[188]+RC[193]+RC[198]+RC[203]+RC[208]+RC[213]+RC[218]+RC[223]+RC[228]+RC[233]+RC[238]+RC[243]+Sheet2!RC[2]+Sheet2!RC[7]+Sheet2!RC[12]+Sheet2!RC[17]+Sheet2!RC[22]+Sheet2!RC[27]+Sheet2!RC[32]+Sheet2!RC[37]+Sheet2!RC[42]+Sheet2!RC[47]+Sheet2!RC[57]+Sheet2!RC[52]+Sheet2!RC[62]+Sheet2!RC[67] -> 123175.62699999999 | C53: =RC[6]+RC[11]+RC[16]+RC[21]+RC[26]+RC[31]+RC[36]+RC[41]+RC[46]+RC[51]+RC[56]+RC[61]+RC[66]+RC[71]+RC[76]+RC[81]+RC[86]+RC[91]+RC[96]+RC[101]+RC[106]+RC[111]+RC[116]+RC[121]+RC[126]+RC[131]+RC[136]+RC[141]+RC[146]+RC[151]+RC[156]+RC[161]+RC[166]+RC[171]+RC[176]+RC[181]+RC[186]+RC[191]+RC[196]+RC[201]+RC[206]+RC[211]+RC[216]+RC[221]+RC[226]+RC[231]+RC[236]+RC[241]+Sheet2!RC+Sheet2!RC[5]+Sheet2!RC[10]+Sheet2!RC[15]+Sheet2!RC[20]+Sheet2!RC[25]+Sheet2!RC[30]+Sheet2!RC[35]+Sheet2!RC[40]+Sheet2!RC[45]+Sheet2!RC[50]+Sheet2!RC[55]+Sheet2!RC[60]+Sheet2!RC[65] -> 14999808.9989 | D53: =RC[4]+RC[9]+RC[14]+RC[19]+RC[24]+RC[29]+RC[34]+RC[39]+RC[44]+RC[49]+RC[54]+RC[59]+RC[64]+RC[69]+RC[74]+RC[79]+RC[84]+RC[89]+RC[94]+RC[99]+RC[104]+RC[109]+RC[114]+RC[119]+RC[124]+RC[129]+RC[134]+RC[139]+RC[144]+RC[149]+RC[154]+RC[159]+RC[164]+RC[169]+RC[174]+RC[179]+RC[184]+RC[189]+RC[194]+RC[199]+RC[204]+RC[209]+RC[214]+RC[219]+RC[224]+RC[229]+RC[234]+RC[239]+Sheet2!RC[3]+Sheet2!RC[-2]+Sheet2!RC[8]+Sheet2!RC[13]+Sheet2!RC[18]+Sheet2!RC[23]+Sheet2!RC[28]+Sheet2!RC[33]+Sheet2!RC[38]+Sheet2!RC[43]+Sheet2!RC[48]+Sheet2!RC[53]+Sheet2!RC[58]+Sheet2!RC[63] -> 0 | E53: =RC[6]+RC[11]+RC[16]+RC[21]+RC[26]+RC[31]+RC[36]+RC[41]+RC[46]+RC[51]+RC[56]+RC[61]+RC[66]+RC[71]+RC[76]+RC[81]+RC[86]+RC[91]+RC[96]+RC[101]+RC[106]+RC[111]+RC[116]+RC[121]+RC[126]+RC[131]+RC[136]+RC[141]+RC[146]+RC[151]+RC[156]+RC[161]+RC[166]+RC[171]+RC[176]+RC[181]+RC[186]+RC[191]+RC[196]+RC[201]+RC[206]+RC[211]+RC[216]+RC[221]+RC[226]+RC[231]+RC[236]+RC[241]+Sheet2!RC+Sheet2!RC[5]+Sheet2!RC[10]+Sheet2!RC[15]+Sheet2!RC[20]+Sheet2!RC[25]+Sheet2!RC[30]+Sheet2!RC[35]+Sheet2!RC[40]+Sheet2!RC[45]+Sheet2!RC[50]+Sheet2!RC[55]+Sheet2!RC[60]+Sheet2!RC[65] -> 0 | F53: =SUM(RC[-4]:RC[-1]) -> 15122984.6259 | G53: =Sheet1!RC[5]+Sheet1!RC[10]+Sheet1!RC[15]+Sheet1!RC[20]+Sheet1!RC[25]+Sheet1!RC[30]+Sheet1!RC[35]+Sheet1!RC[40]+Sheet1!RC[45]+Sheet1!RC[50]+Sheet1!RC[55]+Sheet1!RC[60]+Sheet1!RC[65]+Sheet1!RC[70]+Sheet1!RC[75]+Sheet1!RC[80]+Sheet1!RC[85]+Sheet1!RC[90]+Sheet1!RC[95]+Sheet1!RC[100]+Sheet1!RC[105]+Sheet1!RC[110]+Sheet1!RC[115]+Sheet1!RC[120]+Sheet1!RC[125]+Sheet1!RC[130]+Sheet1!RC[135]+Sheet1!RC[140]+Sheet1!RC[145]+Sheet1!RC[150]+Sheet1!RC[155]+Sheet1!RC[160]+Sheet1!RC[165]+Sheet1!RC[170]+Sheet1!RC[175]+Sheet1!RC[180]+Sheet1!RC[185]+Sheet1!RC[190]+Sheet1!RC[195]+Sheet1!RC[200]+Sheet1!RC[205]+Sheet1!RC[210]+Sheet1!RC[215]+Sheet1!RC[220]+Sheet1!RC[225]+Sheet1!RC[230]+Sheet1!RC[235]+Sheet1!RC[240]+Sheet2!RC[-1]+Sheet2!RC[4]+Sheet2!RC[9]+Sheet2!RC[14]+Sheet2!RC[19]+Sheet2!RC[24]+Sheet2!RC[29]+Sheet2!RC[34]+Sheet2!RC[39]+Sheet2!RC[44]+Sheet2!RC[49]+Sheet2!RC[54]+Sheet2!RC[59]+Sheet2!RC[64] -> 15122984.625900002 | H53: 0 | I53: 263233.05 | J53: 0.89700000000000002 | K53: 0 | L53: =SUM(RC[-4]:RC[-1]) -> 263233.94699999999 | M53: 0 | N53: 28317.49 | O53: 0 | P53: 0 | Q53: =SUM(RC[-4]:RC[-1]) -> 28317.49 | R53: 0 | S53: 1099470.3334999999 | T53: 21974 | U53: 0 | V53: =SUM(RC[-4]:RC[-1]) -> 1121444.3334999999 | W53: 0 | X53: 121406 | Y53: 5153.1000000000004 | Z53: 0 | AA53: =SUM(RC[-4]:RC[-1]) -> 126559.1 | AB53: 0 | AC53: 68616.240000000005 | AD53: 0 | AE53: 0 | AF53: =SUM(RC[-4]:RC[-1]) -> 68616.240000000005 | AG53: 0 | AH53: 46845.1 | AI53: 230.58 | AJ53: 0 | AK53: =SUM(RC[-4]:RC[-1]) -> 47075.68 | AL53: 0 | AM53: 26283.9 | AN53: 424.22 | AO53: 0 | AP53: =SUM(RC[-4]:RC[-1]) -> 26708.120000000003 | AQ53: 0 | AR53: 71928.31 | AS53: 343.83 | AT53: 0 | AU53: =SUM(RC[-4]:RC[-1]) -> 72272.14 | AV53: 0 | AW53: 21234.7 | AX53: 0 | AY53: 0 | AZ53: =SUM(RC[-4]:RC[-1]) -> 21234.7 | BA53: 0 | BB53: 53898.737000000001 | BC53: 0 | BD53: 0 | BE53: =SUM(RC[-4]:RC[-1]) -> 53898.737000000001 | BF53: 0 | BG53: 26438.83 | BH53: 0 | BI53: 0 | BJ53: =SUM(RC[-4]:RC[-1]) -> 26438.83 | BK53: 0 | BL53: 20501.55 | BM53: 0 | BN53: 0 | BO53: =SUM(RC[-4]:RC[-1]) -> 20501.55 | BP53: 0 | BQ53: 26121.86 | BR53: 1.9 | BS53: 0 | BT53: =SUM(RC[-4]:RC[-1]) -> 26123.760000000002 | BU53: 0 | BV53: 196780.19 | BW53: 4460 | BX53: 0 | BY53: =SUM(RC[-4]:RC[-1]) -> 201240.19 | BZ53: 0 | CA53: 630133.98340000003 | CB53: 27514.5 | CC53: 0 | CD53: =SUM(RC[-4]:RC[-1]) -> 657648.48340000003 | CE53: 0 | CF53: 21890.89 | CG53: 1804 | CH53: 0 | CI53: =SUM(RC[-4]:RC[-1]) -> 23694.89 | CJ53: 0 | CK53: 36210.94 | CL53: 0 | CM53: 0 | CN53: =SUM(RC[-4]:RC[-1]) -> 36210.94 | CO53: 0 | CP53: 44940.43 | CQ53: 0 | CR53: 0 | CS53: =SUM(RC[-4]:RC[-1]) -> 44940.43 | CT53: 0 | CU53: 39085.699999999997 | CV53: 0 | CW53: 0 | CX53: =SUM(RC[-4]:RC[-1]) -> 39085.699999999997 | CY53: 0 | CZ53: 31680.9 | DA53: 0 | DB53: 0 | DC53: =SUM(RC[-4]:RC[-1]) -> 31680.9 | DD53: 0 | DE53: 3007.46 | DF53: 0 | DG53: 0 | DH53: =SUM(RC[-4]:RC[-1]) -> 3007.46 | DI53: 0 | DJ53: 20611.830000000002 | DK53: 0 | DL53: 0 | DM53: =SUM(RC[-4]:RC[-1]) -> 20611.830000000002 | DN53: 0 | DO53: 81781.320000000007 | DP53: 361 | DQ53: 0 | DR53: =SUM(RC[-4]:RC[-1]) -> 82142.320000000007 | DS53: 0 | DT53: 1966101.2549999999 | DU53: 0 | DV53: 0 | DW53: =SUM(RC[-4]:RC[-1]) -> 1966101.2549999999 | DX53: 0 | DY53: 15212.85 | DZ53: 0 | EA53: 0 | EB53: =SUM(RC[-4]:RC[-1]) -> 15212.85 | EC53: 0 | ED53: 46893.34 | EE53: 0 | EF53: 0 | EG53: =SUM(RC[-4]:RC[-1]) -> 46893.34 | EH53: 0 | EI53: 43745.78 | EJ53: 0 | EK53: 0 | EL53: =SUM(RC[-4]:RC[-1]) -> 43745.78 | EM53: 0 | EN53: 519367.7 | EO53: 24.48 | EP53: 0 | EQ53: =SUM(RC[-4]:RC[-1]) -> 519392.18 | ER53: 0 | ES53: 25771.53 | ET53: 0 | EU53: 0 | EV53: =SUM(RC[-4]:RC[-1]) -> 25771.53 | EW53: 0 | EX53: 1494364.56 | EY53: 111.19 | EZ53: 0 | FA53: =SUM(RC[-4]:RC[-1]) -> 1494475.75 | FB53: 0 | FC53: 1373721.3 | FD53: 8.42 | FE53: 0 | FF53: =SUM(RC[-4]:RC[-1]) -> 1373729.72 | FG53: 0 | FH53: 48182.5 | FI53: 15897.8 | FJ53: 0 | FK53: =SUM(RC[-4]:RC[-1]) -> 64080.3 | FL53: 0 | FM53: 100350.6 | FN53: 3.88 | FO53: 0 | FP53: =SUM(RC[-4]:RC[-1]) -> 100354.48000000001 | FQ53: 0 | FR53: 289163.59999999998 | FS53: 0 | FT53: 0 | FU53: =SUM(RC[-4]:RC[-1]) -> 289163.59999999998 | FV53: 0 | FW53: 73934.600000000006 | FX53: 14.2 | FY53: 0 | FZ53: =SUM(RC[-4]:RC[-1]) -> 73948.800000000003 | GA53: 0 | GB53: 198794.9 | GC53: 5890.2 | GD53: 0 | GE53: =SUM(RC[-4]:RC[-1]) -> 204685.1 | GF53: 0 | GG53: 28037.599999999999 | GH53: 0 | GI53: 0 | GJ53: =SUM(RC[-4]:RC[-1]) -> 28037.599999999999 | GK53: 0 | GL53: 58812.2 | GM53: 378.28 | GN53: 0 | GO53: =SUM(RC[-4]:RC[-1]) -> 59190.479999999996 | GP53: 0 | GQ53: 38685.24 | GR53: 0 | GS53: 0 | GT53: =SUM(RC[-4]:RC[-1]) -> 38685.24 | GU53: 0 | GV53: 64098.07 | GW53: 0 | GX53: 0 | GY53: =SUM(RC[-4]:RC[-1]) -> 64098.07 | GZ53: 0 | HA53: 1985677.3 | HB53: 28065 | HC53: 0 | HD53: =SUM(RC[-4]:RC[-1]) -> 2013742.3 | HE53: 0 | HF53: 116312.3 | HG53: 0 | HH53: 0 | HI53: =SUM(RC[-4]:RC[-1]) -> 116312.3 | HJ53: 0 | HK53: 381382.58 | HL53: 1260.18 | HM53: 0 | HN53: =SUM(RC[-4]:RC[-1]) -> 382642.76 | HO53: 0 | HP53: 279427.39 | HQ53: 0.05 | HR53: 0 | HS53: =SUM(RC[-4]:RC[-1]) -> 279427.44 | HT53: 0 | HU53: 128768.23 | HV53: 257.10000000000002 | HW53: 0 | HX53: =SUM(RC[-4]:RC[-1]) -> 129025.33 | HY53: 0 | HZ53: 89712.33 | IA53: 49.04 | IB53: 0 | IC53: =SUM(RC[-4]:RC[-1]) -> 89761.37 | ID53: 0 | IE53: 21618.85 | IF53: 0 | IG53: 0 | IH53: =SUM(RC[-4]:RC[-1]) -> 21618.85 | II53: 0 | IJ53: 11068.89 | IK53: 0 | IL53: 0 | IM53: =SUM(RC[-4]:RC[-1]) -> 11068.89
A54: PHENANTHRENE | B54: =RC[8]+RC[13]+RC[18]+RC[23]+RC[28]+RC[33]+RC[38]+RC[43]+RC[48]+RC[53]+RC[58]+RC[63]+RC[68]+RC[73]+RC[78]+RC[83]+RC[88]+RC[93]+RC[98]+RC[103]+RC[108]+RC[113]+RC[118]+RC[123]+RC[128]+RC[133]+RC[138]+RC[143]+RC[148]+RC[153]+RC[158]+RC[163]+RC[168]+RC[173]+RC[178]+RC[183]+RC[188]+RC[193]+RC[198]+RC[203]+RC[208]+RC[213]+RC[218]+RC[223]+RC[228]+RC[233]+RC[238]+RC[243]+Sheet2!RC[2]+Sheet2!RC[7]+Sheet2!RC[12]+Sheet2!RC[17]+Sheet2!RC[22]+Sheet2!RC[27]+Sheet2!RC[32]+Sheet2!RC[37]+Sheet2!RC[42]+Sheet2!RC[47]+Sheet2!RC[57]+Sheet2!RC[52]+Sheet2!RC[62]+Sheet2!RC[67] -> 2892.9100000000003 | C54: =RC[6]+RC[11]+RC[16]+RC[21]+RC[26]+RC[31]+RC[36]+RC[41]+RC[46]+RC[51]+RC[56]+RC[61]+RC[66]+RC[71]+RC[76]+RC[81]+RC[86]+RC[91]+RC[96]+RC[101]+RC[106]+RC[111]+RC[116]+RC[121]+RC[126]+RC[131]+RC[136]+RC[141]+RC[146]+RC[151]+RC[156]+RC[161]+RC[166]+RC[171]+RC[176]+RC[181]+RC[186]+RC[191]+RC[196]+RC[201]+RC[206]+RC[211]+RC[216]+RC[221]+RC[226]+RC[231]+RC[236]+RC[241]+Sheet2!RC+Sheet2!RC[5]+Sheet2!RC[10]+Sheet2!RC[15]+Sheet2!RC[20]+Sheet2!RC[25]+Sheet2!RC[30]+Sheet2!RC[35]+Sheet2!RC[40]+Sheet2!RC[45]+Sheet2!RC[50]+Sheet2!RC[55]+Sheet2!RC[60]+Sheet2!RC[65] -> 0 | D54: =RC[4]+RC[9]+RC[14]+RC[19]+RC[24]+RC[29]+RC[34]+RC[39]+RC[44]+RC[49]+RC[54]+RC[59]+RC[64]+RC[69]+RC[74]+RC[79]+RC[84]+RC[89]+RC[94]+RC[99]+RC[104]+RC[109]+RC[114]+RC[119]+RC[124]+RC[129]+RC[134]+RC[139]+RC[144]+RC[149]+RC[154]+RC[159]+RC[164]+RC[169]+RC[174]+RC[179]+RC[184]+RC[189]+RC[194]+RC[199]+RC[204]+RC[209]+RC[214]+RC[219]+RC[224]+RC[229]+RC[234]+RC[239]+Sheet2!RC[3]+Sheet2!RC[-2]+Sheet2!RC[8]+Sheet2!RC[13]+Sheet2!RC[18]+Sheet2!RC[23]+Sheet2!RC[28]+Sheet2!RC[33]+Sheet2!RC[38]+Sheet2!RC[43]+Sheet2!RC[48]+Sheet2!RC[53]+Sheet2!RC[58]+Sheet2!RC[63] -> 0 | E54: =RC[6]+RC[11]+RC[16]+RC[21]+RC[26]+RC[31]+RC[36]+RC[41]+RC[46]+RC[51]+RC[56]+RC[61]+RC[66]+RC[71]+RC[76]+RC[81]+RC[86]+RC[91]+RC[96]+RC[101]+RC[106]+RC[111]+RC[116]+RC[121]+RC[126]+RC[131]+RC[136]+RC[141]+RC[146]+RC[151]+RC[156]+RC[161]+RC[166]+RC[171]+RC[176]+RC[181]+RC[186]+RC[191]+RC[196]+RC[201]+RC[206]+RC[211]+RC[216]+RC[221]+RC[226]+RC[231]+RC[236]+RC[241]+Sheet2!RC+Sheet2!RC[5]+Sheet2!RC[10]+Sheet2!RC[15]+Sheet2!RC[20]+Sheet2!RC[25]+Sheet2!RC[30]+Sheet2!RC[35]+Sheet2!RC[40]+Sheet2!RC[45]+Sheet2!RC[50]+Sheet2!RC[55]+Sheet2!RC[60]+Sheet2!RC[65] -> 105.66505906386479 | F54: =SUM(RC[-4]:RC[-1]) -> 2998.575059063865 | G54: =Sheet1!RC[5]+Sheet1!RC[10]+Sheet1!RC[15]+Sheet1!RC[20]+Sheet1!RC[25]+Sheet1!RC[30]+Sheet1!RC[35]+Sheet1!RC[40]+Sheet1!RC[45]+Sheet1!RC[50]+Sheet1!RC[55]+Sheet1!RC[60]+Sheet1!RC[65]+Sheet1!RC[70]+Sheet1!RC[75]+Sheet1!RC[80]+Sheet1!RC[85]+Sheet1!RC[90]+Sheet1!RC[95]+Sheet1!RC[100]+Sheet1!RC[105]+Sheet1!RC[110]+Sheet1!RC[115]+Sheet1!RC[120]+Sheet1!RC[125]+Sheet1!RC[130]+Sheet1!RC[135]+Sheet1!RC[140]+Sheet1!RC[145]+Sheet1!RC[150]+Sheet1!RC[155]+Sheet1!RC[160]+Sheet1!RC[165]+Sheet1!RC[170]+Sheet1!RC[175]+Sheet1!RC[180]+Sheet1!RC[185]+Sheet1!RC[190]+Sheet1!RC[195]+Sheet1!RC[200]+Sheet1!RC[205]+Sheet1!RC[210]+Sheet1!RC[215]+Sheet1!RC[220]+Sheet1!RC[225]+Sheet1!RC[230]+Sheet1!RC[235]+Sheet1!RC[240]+Sheet2!RC[-1]+Sheet2!RC[4]+Sheet2!RC[9]+Sheet2!RC[14]+Sheet2!RC[19]+Sheet2!RC[24]+Sheet2!RC[29]+Sheet2!RC[34]+Sheet2!RC[39]+Sheet2!RC[44]+Sheet2!RC[49]+Sheet2!RC[54]+Sheet2!RC[59]+Sheet2!RC[64] -> 2998.5750590638654 | H54: 0 | I54: 0 | J54: 0 | K54: 1.6525511357710001 | L54: =SUM(RC[-4]:RC[-1]) -> 1.6525511357710001 | M54: 0 | N54: 0 | O54: 0 | P54: 0.39406987038780006 | Q54: =SUM(RC[-4]:RC[-1]) -> 0.39406987038780006 | R54: 0 | S54: 0 | T54: 0 | U54: 1.5266926762850006 | V54: =SUM(RC[-4]:RC[-1]) -> 1.5266926762850006 | W54: 0 | X54: 0 | Y54: 133.25 | Z54: 0.98595924716000027 | AA54: =SUM(RC[-4]:RC[-1]) -> 134.23595924716 | AB54: 0 | AC54: 0 | AD54: 0 | AE54: 1.7814802355918002 | AF54: =SUM(RC[-4]:RC[-1]) -> 1.7814802355918002 | AG54: 0 | AH54: 0 | AI54: 0 | AJ54: 0.47196331405520031 | AK54: =SUM(RC[-4]:RC[-1]) -> 0.47196331405520031 | AL54: 0 | AM54: 0 | AN54: 0 | AO54: 1.3736912705840003 | AP54: =SUM(RC[-4]:RC[-1]) -> 1.3736912705840003 | AQ54: 0 | AR54: 0 | AS54: 0 | AT54: 0.4548929340879998 | AU54: =SUM(RC[-4]:RC[-1]) -> 0.4548929340879998 | AV54: 0 | AW54: 0 | AX54: 0 | AY54: 0.5270262449787998 | AZ54: =SUM(RC[-4]:RC[-1]) -> 0.5270262449787998 | BA54: 0 | BB54: 0 | BC54: 0 | BD54: 0.66219305793820027 | BE54: =SUM(RC[-4]:RC[-1]) -> 0.66219305793820027 | BF54: 0 | BG54: 0 | BH54: 0 | BI54: 0.49893908147779986 | BJ54: =SUM(RC[-4]:RC[-1]) -> 0.49893908147779986 | BK54: 0 | BL54: 0 | BM54: 0 | BN54: 0.48830371010619977 | BO54: =SUM(RC[-4]:RC[-1]) -> 0.48830371010619977 | BP54: 0 | BQ54: 0 | BR54: 611.65 | BS54: 0.71388246096700025 | BT54: =SUM(RC[-4]:RC[-1]) -> 612.36388246096703 | BU54: 0 | BV54: 0 | BW54: 0 | BX54: 1.5717904715280002 | BY54: =SUM(RC[-4]:RC[-1]) -> 1.5717904715280002 | BZ54: 0 | CA54: 0 | CB54: 2146 | CC54: 5.927638859095004 | CD54: =SUM(RC[-4]:RC[-1]) -> 2151.9276388590952 | CE54: 0 | CF54: 0 | CG54: 2.0099999999999998 | CH54: 1.105279179256601 | CI54: =SUM(RC[-4]:RC[-1]) -> 3.1152791792566008 | CJ54: 0 | CK54: 0 | CL54: 0 | CM54: 0.44282629377239996 | CN54: =SUM(RC[-4]:RC[-1]) -> 0.44282629377239996 | CO54: 0 | CP54: 0 | CQ54: 0 | CR54: 0.34552307601620008 | CS54: =SUM(RC[-4]:RC[-1]) -> 0.34552307601620008 | CT54: 0 | CU54: 0 | CV54: 0 | CW54: 0.34173330194320001 | CX54: =SUM(RC[-4]:RC[-1]) -> 0.34173330194320001 | CY54: 0 | CZ54: 0 | DA54: 0 | DB54: 0.32480585138380014 | DC54: =SUM(RC[-4]:RC[-1]) -> 0.32480585138380014 | DD54: 0 | DE54: 0 | DF54: 0 | DG54: 0.13721726332359999 | DH54: =SUM(RC[-4]:RC[-1]) -> 0.13721726332359999 | DI54: 0 | DJ54: 0 | DK54: 0 | DL54: 0.63096775786679982 | DM54: =SUM(RC[-4]:RC[-1]) -> 0.63096775786679982 | DN54: 0 | DO54: 0 | DP54: 0 | DQ54: 0.52135539043239987 | DR54: =SUM(RC[-4]:RC[-1]) -> 0.52135539043239987 | DS54: 0 | DT54: 0 | DU54: 0 | DV54: 3.6741597283465977 | DW54: =SUM(RC[-4]:RC[-1]) -> 3.6741597283465977 | DX54: 0 | DY54: 0 | DZ54: 0 | EA54: 0.37972184805999998 | EB54: =SUM(RC[-4]:RC[-1]) -> 0.37972184805999998 | EC54: 0 | ED54: 0 | EE54: 0 | EF54: 0.37231922315279997 | EG54: =SUM(RC[-4]:RC[-1]) -> 0.37231922315279997 | EH54: 0 | EI54: 0 | EJ54: 0 | EK54: 0.25792216952539998 | EL54: =SUM(RC[-4]:RC[-1]) -> 0.25792216952539998 | EM54: 0 | EN54: 0 | EO54: 0 | EP54: 4.1683584754999998 | EQ54: =SUM(RC[-4]:RC[-1]) -> 4.1683584754999998 | ER54: 0 | ES54: 0 | ET54: 0 | EU54: 0.23655443913340005 | EV54: =SUM(RC[-4]:RC[-1]) -> 0.23655443913340005 | EW54: 0 | EX54: 0 | EY54: 0 | EZ54: 7.0223380471050039 | FA54: =SUM(RC[-4]:RC[-1]) -> 7.0223380471050039 | FB54: 0 | FC54: 0 | FD54: 0 | FE54: 8.5523111427350003 | FF54: =SUM(RC[-4]:RC[-1]) -> 8.5523111427350003 | FG54: 0 | FH54: 0 | FI54: 0 | FJ54: 1.0839334874969999 | FK54: =SUM(RC[-4]:RC[-1]) -> 1.0839334874969999 | FL54: 0 | FM54: 0 | FN54: 0 | FO54: 1.1726780995739998 | FP54: =SUM(RC[-4]:RC[-1]) -> 1.1726780995739998 | FQ54: 0 | FR54: 0 | FS54: 0 | FT54: 3.2334952697249988 | FU54: =SUM(RC[-4]:RC[-1]) -> 3.2334952697249988 | FV54: 0 | FW54: 0 | FX54: 0 | FY54: 0.64080624301099975 | FZ54: =SUM(RC[-4]:RC[-1]) -> 0.64080624301099975 | GA54: 0 | GB54: 0 | GC54: 0 | GD54: 1.5901735300319999 | GE54: =SUM(RC[-4]:RC[-1]) -> 1.5901735300319999 | GF54: 0 | GG54: 0 | GH54: 0 | GI54: 0.20012336712079989 | GJ54: =SUM(RC[-4]:RC[-1]) -> 0.20012336712079989 | GK54: 0 | GL54: 0 | GM54: 0 | GN54: 0.69377718295200019 | GO54: =SUM(RC[-4]:RC[-1]) -> 0.69377718295200019 | GP54: 0 | GQ54: 0 | GR54: 0 | GS54: 0.53812454374900009 | GT54: =SUM(RC[-4]:RC[-1]) -> 0.53812454374900009 | GU54: 0 | GV54: 0 | GW54: 0 | GX54: 0.53067705760799966 | GY54: =SUM(RC[-4]:RC[-1]) -> 0.53067705760799966 | GZ54: 0 | HA54: 0 | HB54: 0 | HC54: 19.245236645489989 | HD54: =SUM(RC[-4]:RC[-1]) -> 19.245236645489989 | HE54: 0 | HF54: 0 | HG54: 0 | HH54: 0.7299526831059997 | HI54: =SUM(RC[-4]:RC[-1]) -> 0.7299526831059997 | HJ54: 0 | HK54: 0 | HL54: 0 | HM54: 1.3521228858160008 | HN54: =SUM(RC[-4]:RC[-1]) -> 1.3521228858160008 | HO54: 0 | HP54: 0 | HQ54: 0 | HR54: 1.5904567871829995 | HS54: =SUM(RC[-4]:RC[-1]) -> 1.5904567871829995 | HT54: 0 | HU54: 0 | HV54: 0 | HW54: 0.6691027260950011 | HX54: =SUM(RC[-4]:RC[-1]) -> 0.6691027260950011 | HY54: 0 | HZ54: 0 | IA54: 0 | IB54: 1.0745306626030002 | IC54: =SUM(RC[-4]:RC[-1]) -> 1.0745306626030002 | ID54: 0 | IE54: 0 | IF54: 0 | IG54: 0.53519309763200018 | IH54: =SUM(RC[-4]:RC[-1]) -> 0.53519309763200018 | II54: 0 | IJ54: 0 | IK54: 0 | IL54: 0.11472247371699998 | IM54: =SUM(RC[-4]:RC[-1]) -> 0.11472247371699998
A55: PHENOL | B55: =RC[8]+RC[13]+RC[18]+RC[23]+RC[28]+RC[33]+RC[38]+RC[43]+RC[48]+RC[53]+RC[58]+RC[63]+RC[68]+RC[73]+RC[78]+RC[83]+RC[88]+RC[93]+RC[98]+RC[103]+RC[108]+RC[113]+RC[118]+RC[123]+RC[128]+RC[133]+RC[138]+RC[143]+RC[148]+RC[153]+RC[158]+RC[163]+RC[168]+RC[173]+RC[178]+RC[183]+RC[188]+RC[193]+RC[198]+RC[203]+RC[208]+RC[213]+RC[218]+RC[223]+RC[228]+RC[233]+RC[238]+RC[243]+Sheet2!RC[2]+Sheet2!RC[7]+Sheet2!RC[12]+Sheet2!RC[17]+Sheet2!RC[22]+Sheet2!RC[27]+Sheet2!RC[32]+Sheet2!RC[37]+Sheet2!RC[42]+Sheet2!RC[47]+Sheet2!RC[57]+Sheet2!RC[52]+Sheet2!RC[62]+Sheet2!RC[67] -> 178750.73099999997 | C55: =RC[6]+RC[11]+RC[16]+RC[21]+RC[26]+RC[31]+RC[36]+RC[41]+RC[46]+RC[51]+RC[56]+RC[61]+RC[66]+RC[71]+RC[76]+RC[81]+RC[86]+RC[91]+RC[96]+RC[101]+RC[106]+RC[111]+RC[116]+RC[121]+RC[126]+RC[131]+RC[136]+RC[141]+RC[146]+RC[151]+RC[156]+RC[161]+RC[166]+RC[171]+RC[176]+RC[181]+RC[186]+RC[191]+RC[196]+RC[201]+RC[206]+RC[211]+RC[216]+RC[221]+RC[226]+RC[231]+RC[236]+RC[241]+Sheet2!RC+Sheet2!RC[5]+Sheet2!RC[10]+Sheet2!RC[15]+Sheet2!RC[20]+Sheet2!RC[25]+Sheet2!RC[30]+Sheet2!RC[35]+Sheet2!RC[40]+Sheet2!RC[45]+Sheet2!RC[50]+Sheet2!RC[55]+Sheet2!RC[60]+Sheet2!RC[65] -> 0 | D55: =RC[4]+RC[9]+RC[14]+RC[19]+RC[24]+RC[29]+RC[34]+RC[39]+RC[44]+RC[49]+RC[54]+RC[59]+RC[64]+RC[69]+RC[74]+RC[79]+RC[84]+RC[89]+RC[94]+RC[99]+RC[104]+RC[109]+RC[114]+RC[119]+RC[124]+RC[129]+RC[134]+RC[139]+RC[144]+RC[149]+RC[154]+RC[159]+RC[164]+RC[169]+RC[174]+RC[179]+RC[184]+RC[189]+RC[194]+RC[199]+RC[204]+RC[209]+RC[214]+RC[219]+RC[224]+RC[229]+RC[234]+RC[239]+Sheet2!RC[3]+Sheet2!RC[-2]+Sheet2!RC[8]+Sheet2!RC[13]+Sheet2!RC[18]+Sheet2!RC[23]+Sheet2!RC[28]+Sheet2!RC[33]+Sheet2!RC[38]+Sheet2!RC[43]+Sheet2!RC[48]+Sheet2!RC[53]+Sheet2!RC[58]+Sheet2!RC[63] -> 0 | E55: =RC[6]+RC[11]+RC[16]+RC[21]+RC[26]+RC[31]+RC[36]+RC[41]+RC[46]+RC[51]+RC[56]+RC[61]+RC[66]+RC[71]+RC[76]+RC[81]+RC[86]+RC[91]+RC[96]+RC[101]+RC[106]+RC[111]+RC[116]+RC[121]+RC[126]+RC[131]+RC[136]+RC[141]+RC[146]+RC[151]+RC[156]+RC[161]+RC[166]+RC[171]+RC[176]+RC[181]+RC[186]+RC[191]+RC[196]+RC[201]+RC[206]+RC[211]+RC[216]+RC[221]+RC[226]+RC[231]+RC[236]+RC[241]+Sheet2!RC+Sheet2!RC[5]+Sheet2!RC[10]+Sheet2!RC[15]+Sheet2!RC[20]+Sheet2!RC[25]+Sheet2!RC[30]+Sheet2!RC[35]+Sheet2!RC[40]+Sheet2!RC[45]+Sheet2!RC[50]+Sheet2!RC[55]+Sheet2!RC[60]+Sheet2!RC[65] -> 5396.2960000000003 | F55: =SUM(RC[-4]:RC[-1]) -> 184147.02699999997 | G55: =Sheet1!RC[5]+Sheet1!RC[10]+Sheet1!RC[15]+Sheet1!RC[20]+Sheet1!RC[25]+Sheet1!RC[30]+Sheet1!RC[35]+Sheet1!RC[40]+Sheet1!RC[45]+Sheet1!RC[50]+Sheet1!RC[55]+Sheet1!RC[60]+Sheet1!RC[65]+Sheet1!RC[70]+Sheet1!RC[75]+Sheet1!RC[80]+Sheet1!RC[85]+Sheet1!RC[90]+Sheet1!RC[95]+Sheet1!RC[100]+Sheet1!RC[105]+Sheet1!RC[110]+Sheet1!RC[115]+Sheet1!RC[120]+Sheet1!RC[125]+Sheet1!RC[130]+Sheet1!RC[135]+Sheet1!RC[140]+Sheet1!RC[145]+Sheet1!RC[150]+Sheet1!RC[155]+Sheet1!RC[160]+Sheet1!RC[165]+Sheet1!RC[170]+Sheet1!RC[175]+Sheet1!RC[180]+Sheet1!RC[185]+Sheet1!RC[190]+Sheet1!RC[195]+Sheet1!RC[200]+Sheet1!RC[205]+Sheet1!RC[210]+Sheet1!RC[215]+Sheet1!RC[220]+Sheet1!RC[225]+Sheet1!RC[230]+Sheet1!RC[235]+Sheet1!RC[240]+Sheet2!RC[-1]+Sheet2!RC[4]+Sheet2!RC[9]+Sheet2!RC[14]+Sheet2!RC[19]+Sheet2!RC[24]+Sheet2!RC[29]+Sheet2!RC[34]+Sheet2!RC[39]+Sheet2!RC[44]+Sheet2!RC[49]+Sheet2!RC[54]+Sheet2!RC[59]+Sheet2!RC[64] -> 184147.027 | H55: 0 | I55: 0 | J55: 60983.6 | K55: 7.4720000000000004 | L55: =SUM(RC[-4]:RC[-1]) -> 60991.072 | M55: 0 | N55: 0 | O55: 0 | P55: 10.364000000000001 | Q55: =SUM(RC[-4]:RC[-1]) -> 10.364000000000001 | R55: 0 | S55: 0 | T55: 0 | U55: 0 | V55: =SUM(RC[-4]:RC[-1]) -> 0 | W55: 0 | X55: 0 | Y55: 327.72 | Z55: 69.495999999999995 | AA55: =SUM(RC[-4]:RC[-1]) -> 397.21600000000001 | AB55: 0 | AC55: 0 | AD55: 0 | AE55: 5.9359999999999999 | AF55: =SUM(RC[-4]:RC[-1]) -> 5.9359999999999999 | AG55: 0 | AH55: 0 | AI55: 0.86 | AJ55: 0 | AK55: =SUM(RC[-4]:RC[-1]) -> 0.86 | AL55: 0 | AM55: 0 | AN55: 26.91 | AO55: 20.292000000000002 | AP55: =SUM(RC[-4]:RC[-1]) -> 47.201999999999998 | AQ55: 0 | AR55: 0 | AS55: 0 | AT55: 51.584000000000003 | AU55: =SUM(RC[-4]:RC[-1]) -> 51.584000000000003 | AV55: 0 | AW55: 0 | AX55: 163.78 | AY55: 7.3960000000000008 | AZ55: =SUM(RC[-4]:RC[-1]) -> 171.17599999999999 | BA55: 0 | BB55: 0 | BC55: 122.27 | BD55: 19.832000000000001 | BE55: =SUM(RC[-4]:RC[-1]) -> 142.102 | BF55: 0 | BG55: 0 | BH55: 0.82199999999999995 | BI55: 10.995999999999999 | BJ55: =SUM(RC[-4]:RC[-1]) -> 11.817999999999998 | BK55: 0 | BL55: 0 | BM55: 56.04 | BN55: 2.9039999999999999 | BO55: =SUM(RC[-4]:RC[-1]) -> 58.944000000000003 | BP55: 0 | BQ55: 0 | BR55: 2.96 | BS55: 2.7919999999999998 | BT55: =SUM(RC[-4]:RC[-1]) -> 5.7519999999999998 | BU55: 0 | BV55: 0 | BW55: 203.15 | BX55: 62.384 | BY55: =SUM(RC[-4]:RC[-1]) -> 265.53399999999999 | BZ55: 0 | CA55: 0 | CB55: 36977.279999999999 | CC55: 418.56 | CD55: =SUM(RC[-4]:RC[-1]) -> 37395.839999999997 | CE55: 0 | CF55: 0 | CG55: 0 | CH55: 0 | CI55: =SUM(RC[-4]:RC[-1]) -> 0 | CJ55: 0 | CK55: 0 | CL55: 0 | CM55: 18.155999999999999 | CN55: =SUM(RC[-4]:RC[-1]) -> 18.155999999999999 | CO55: 0 | CP55: 0 | CQ55: 0 | CR55: 0 | CS55: =SUM(RC[-4]:RC[-1]) -> 0 | CT55: 0 | CU55: 0 | CV55: 0 | CW55: 1.224 | CX55: =SUM(RC[-4]:RC[-1]) -> 1.224 | CY55: 0 | CZ55: 0 | DA55: 766.76 | DB55: 0 | DC55: =SUM(RC[-4]:RC[-1]) -> 766.76 | DD55: 0 | DE55: 0 | DF55: 0 | DG55: 0 | DH55: =SUM(RC[-4]:RC[-1]) -> 0 | DI55: 0 | DJ55: 0 | DK55: 0 | DL55: 0 | DM55: =SUM(RC[-4]:RC[-1]) -> 0 | DN55: 0 | DO55: 0 | DP55: 0 | DQ55: 12.86 | DR55: =SUM(RC[-4]:RC[-1]) -> 12.86 | DS55: 0 | DT55: 0 | DU55: 12.36 | DV55: 0 | DW55: =SUM(RC[-4]:RC[-1]) -> 12.36 | DX55: 0 | DY55: 0 | DZ55: 0 | EA55: 0 | EB55: =SUM(RC[-4]:RC[-1]) -> 0 | EC55: 0 | ED55: 0 | EE55: 21.96 | EF55: 13.388 | EG55: =SUM(RC[-4]:RC[-1]) -> 35.347999999999999 | EH55: 0 | EI55: 0 | EJ55: 0 | EK55: 0.66 | EL55: =SUM(RC[-4]:RC[-1]) -> 0.66 | EM55: 0 | EN55: 0 | EO55: 1426.396 | EP55: 108.54799999999999 | EQ55: =SUM(RC[-4]:RC[-1]) -> 1534.944 | ER55: 0 | ES55: 0 | ET55: 140.18 | EU55: 0 | EV55: =SUM(RC[-4]:RC[-1]) -> 140.18 | EW55: 0 | EX55: 0 | EY55: 698.31299999999999 | EZ55: 0 | FA55: =SUM(RC[-4]:RC[-1]) -> 698.31299999999999 | FB55: 0 | FC55: 0 | FD55: 0 | FE55: 0 | FF55: =SUM(RC[-4]:RC[-1]) -> 0 | FG55: 0 | FH55: 0 | FI55: 6413 | FJ55: 16.007999999999999 | FK55: =SUM(RC[-4]:RC[-1]) -> 6429.0079999999998 | FL55: 0 | FM55: 0 | FN55: 71.2 | FO55: 14.128 | FP55: =SUM(RC[-4]:RC[-1]) -> 85.328000000000003 | FQ55: 0 | FR55: 0 | FS55: 87.02 | FT55: 229.07599999999999 | FU55: =SUM(RC[-4]:RC[-1]) -> 316.096 | FV55: 0 | FW55: 0 | FX55: 8.24 | FY55: 0 | FZ55: =SUM(RC[-4]:RC[-1]) -> 8.24 | GA55: 0 | GB55: 0 | GC55: 211.01 | GD55: 103.84400000000001 | GE55: =SUM(RC[-4]:RC[-1]) -> 314.85399999999998 | GF55: 0 | GG55: 0 | GH55: 275 | GI55: 0 | GJ55: =SUM(RC[-4]:RC[-1]) -> 275 | GK55: 0 | GL55: 0 | GM55: 207.15 | GN55: 0 | GO55: =SUM(RC[-4]:RC[-1]) -> 207.15 | GP55: 0 | GQ55: 0 | GR55: 0 | GS55: 4.944 | GT55: =SUM(RC[-4]:RC[-1]) -> 4.944 | GU55: 0 | GV55: 0 | GW55: 1170.25 | GX55: 0 | GY55: =SUM(RC[-4]:RC[-1]) -> 1170.25 | GZ55: 0 | HA55: 0 | HB55: 0 | HC55: 3854.28 | HD55: =SUM(RC[-4]:RC[-1]) -> 3854.28 | HE55: 0 | HF55: 0 | HG55: 108.3 | HH55: 0 | HI55: =SUM(RC[-4]:RC[-1]) -> 108.3 | HJ55: 0 | HK55: 0 | HL55: 49.55 | HM55: 0 | HN55: =SUM(RC[-4]:RC[-1]) -> 49.55 | HO55: 0 | HP55: 0 | HQ55: 3516 | HR55: 0 | HS55: =SUM(RC[-4]:RC[-1]) -> 3516 | HT55: 0 | HU55: 0 | HV55: 60.9 | HW55: 15.516 | HX55: =SUM(RC[-4]:RC[-1]) -> 76.415999999999997 | HY55: 0 | HZ55: 0 | IA55: 53896.33 | IB55: 10.119999999999999 | IC55: =SUM(RC[-4]:RC[-1]) -> 53906.450000000004 | ID55: 0 | IE55: 0 | IF55: 0 | IG55: 32.316000000000003 | IH55: =SUM(RC[-4]:RC[-1]) -> 32.316000000000003 | II55: 0 | IJ55: 0 | IK55: 0 | IL55: 0 | IM55: =SUM(RC[-4]:RC[-1]) -> 0
A56: PHOSGENE | B56: =RC[8]+RC[13]+RC[18]+RC[23]+RC[28]+RC[33]+RC[38]+RC[43]+RC[48]+RC[53]+RC[58]+RC[63]+RC[68]+RC[73]+RC[78]+RC[83]+RC[88]+RC[93]+RC[98]+RC[103]+RC[108]+RC[113]+RC[118]+RC[123]+RC[128]+RC[133]+RC[138]+RC[143]+RC[148]+RC[153]+RC[158]+RC[163]+RC[168]+RC[173]+RC[178]+RC[183]+RC[188]+RC[193]+RC[198]+RC[203]+RC[208]+RC[213]+RC[218]+RC[223]+RC[228]+RC[233]+RC[238]+RC[243]+Sheet2!RC[2]+Sheet2!RC[7]+Sheet2!RC[12]+Sheet2!RC[17]+Sheet2!RC[22]+Sheet2!RC[27]+Sheet2!RC[32]+Sheet2!RC[37]+Sheet2!RC[42]+Sheet2!RC[47]+Sheet2!RC[57]+Sheet2!RC[52]+Sheet2!RC[62]+Sheet2!RC[67] -> 456.11 | C56: =RC[6]+RC[11]+RC[16]+RC[21]+RC[26]+RC[31]+RC[36]+RC[41]+RC[46]+RC[51]+RC[56]+RC[61]+RC[66]+RC[71]+RC[76]+RC[81]+RC[86]+RC[91]+RC[96]+RC[101]+RC[106]+RC[111]+RC[116]+RC[121]+RC[126]+RC[131]+RC[136]+RC[141]+RC[146]+RC[151]+RC[156]+RC[161]+RC[166]+RC[171]+RC[176]+RC[181]+RC[186]+RC[191]+RC[196]+RC[201]+RC[206]+RC[211]+RC[216]+RC[221]+RC[226]+RC[231]+RC[236]+RC[241]+Sheet2!RC+Sheet2!RC[5]+Sheet2!RC[10]+Sheet2!RC[15]+Sheet2!RC[20]+Sheet2!RC[25]+Sheet2!RC[30]+Sheet2!RC[35]+Sheet2!RC[40]+Sheet2!RC[45]+Sheet2!RC[50]+Sheet2!RC[55]+Sheet2!RC[60]+Sheet2!RC[65] -> 0 | D56: =RC[4]+RC[9]+RC[14]+RC[19]+RC[24]+RC[29]+RC[34]+RC[39]+RC[44]+RC[49]+RC[54]+RC[59]+RC[64]+RC[69]+RC[74]+RC[79]+RC[84]+RC[89]+RC[94]+RC[99]+RC[104]+RC[109]+RC[114]+RC[119]+RC[124]+RC[129]+RC[134]+RC[139]+RC[144]+RC[149]+RC[154]+RC[159]+RC[164]+RC[169]+RC[174]+RC[179]+RC[184]+RC[189]+RC[194]+RC[199]+RC[204]+RC[209]+RC[214]+RC[219]+RC[224]+RC[229]+RC[234]+RC[239]+Sheet2!RC[3]+Sheet2!RC[-2]+Sheet2!RC[8]+Sheet2!RC[13]+Sheet2!RC[18]+Sheet2!RC[23]+Sheet2!RC[28]+Sheet2!RC[33]+Sheet2!RC[38]+Sheet2!RC[43]+Sheet2!RC[48]+Sheet2!RC[53]+Sheet2!RC[58]+Sheet2!RC[63] -> 0 | E56: =RC[6]+RC[11]+RC[16]+RC[21]+RC[26]+RC[31]+RC[36]+RC[41]+RC[46]+RC[51]+RC[56]+RC[61]+RC[66]+RC[71]+RC[76]+RC[81]+RC[86]+RC[91]+RC[96]+RC[101]+RC[106]+RC[111]+RC[116]+RC[121]+RC[126]+RC[131]+RC[136]+RC[141]+RC[146]+RC[151]+RC[156]+RC[161]+RC[166]+RC[171]+RC[176]+RC[181]+RC[186]+RC[191]+RC[196]+RC[201]+RC[206]+RC[211]+RC[216]+RC[221]+RC[226]+RC[231]+RC[236]+RC[241]+Sheet2!RC+Sheet2!RC[5]+Sheet2!RC[10]+Sheet2!RC[15]+Sheet2!RC[20]+Sheet2!RC[25]+Sheet2!RC[30]+Sheet2!RC[35]+Sheet2!RC[40]+Sheet2!RC[45]+Sheet2!RC[50]+Sheet2!RC[55]+Sheet2!RC[60]+Sheet2!RC[65] -> 0 | F56: =SUM(RC[-4]:RC[-1]) -> 456.11 | G56: =Sheet1!RC[5]+Sheet1!RC[10]+Sheet1!RC[15]+Sheet1!RC[20]+Sheet1!RC[25]+Sheet1!RC[30]+Sheet1!RC[35]+Sheet1!RC[40]+Sheet1!RC[45]+Sheet1!RC[50]+Sheet1!RC[55]+Sheet1!RC[60]+Sheet1!RC[65]+Sheet1!RC[70]+Sheet1!RC[75]+Sheet1!RC[80]+Sheet1!RC[85]+Sheet1!RC[90]+Sheet1!RC[95]+Sheet1!RC[100]+Sheet1!RC[105]+Sheet1!RC[110]+Sheet1!RC[115]+Sheet1!RC[120]+Sheet1!RC[125]+Sheet1!RC[130]+Sheet1!RC[135]+Sheet1!RC[140]+Sheet1!RC[145]+Sheet1!RC[150]+Sheet1!RC[155]+Sheet1!RC[160]+Sheet1!RC[165]+Sheet1!RC[170]+Sheet1!RC[175]+Sheet1!RC[180]+Sheet1!RC[185]+Sheet1!RC[190]+Sheet1!RC[195]+Sheet1!RC[200]+Sheet1!RC[205]+Sheet1!RC[210]+Sheet1!RC[215]+Sheet1!RC[220]+Sheet1!RC[225]+Sheet1!RC[230]+Sheet1!RC[235]+Sheet1!RC[240]+Sheet2!RC[-1]+Sheet2!RC[4]+Sheet2!RC[9]+Sheet2!RC[14]+Sheet2!RC[19]+Sheet2!RC[24]+Sheet2!RC[29]+Sheet2!RC[34]+Sheet2!RC[39]+Sheet2!RC[44]+Sheet2!RC[49]+Sheet2!RC[54]+Sheet2!RC[59]+Sheet2!RC[64] -> 456.11 | H56: 0 | I56: 0 | J56: 0 | K56: 0 | L56: =SUM(RC[-4]:RC[-1]) -> 0 | M56: 0 | N56: 0 | O56: 0 | P56: 0 | Q56: =SUM(RC[-4]:RC[-1]) -> 0 | R56: 0 | S56: 0 | T56: 0 | U56: 0 | V56: =SUM(RC[-4]:RC[-1]) -> 0 | W56: 0 | X56: 0 | Y56: 0 | Z56: 0 | AA56: =SUM(RC[-4]:RC[-1]) -> 0 | AB56: 0 | AC56: 0 | AD56: 0 | AE56: 0 | AF56: =SUM(RC[-4]:RC[-1]) -> 0 | AG56: 0 | AH56: 0 | AI56: 0 | AJ56: 0 | AK56: =SUM(RC[-4]:RC[-1]) -> 0 | AL56: 0 | AM56: 0 | AN56: 0 | AO56: 0 | AP56: =SUM(RC[-4]:RC[-1]) -> 0 | AQ56: 0 | AR56: 0 | AS56: 0 | AT56: 0 | AU56: =SUM(RC[-4]:RC[-1]) -> 0 | AV56: 0 | AW56: 0 | AX56: 0 | AY56: 0 | AZ56: =SUM(RC[-4]:RC[-1]) -> 0 | BA56: 0 | BB56: 0 | BC56: 0 | BD56: 0 | BE56: =SUM(RC[-4]:RC[-1]) -> 0 | BF56: 0 | BG56: 0 | BH56: 0 | BI56: 0 | BJ56: =SUM(RC[-4]:RC[-1]) -> 0 | BK56: 0 | BL56: 0 | BM56: 0 | BN56: 0 | BO56: =SUM(RC[-4]:RC[-1]) -> 0 | BP56: 0 | BQ56: 0 | BR56: 0 | BS56: 0 | BT56: =SUM(RC[-4]:RC[-1]) -> 0 | BU56: 0 | BV56: 0 | BW56: 0 | BX56: 0 | BY56: =SUM(RC[-4]:RC[-1]) -> 0 | BZ56: 0 | CA56: 0 | CB56: 0 | CC56: 0 | CD56: =SUM(RC[-4]:RC[-1]) -> 0 | CE56: 0 | CF56: 0 | CG56: 0 | CH56: 0 | CI56: =SUM(RC[-4]:RC[-1]) -> 0 | CJ56: 0 | CK56: 0 | CL56: 0 | CM56: 0 | CN56: =SUM(RC[-4]:RC[-1]) -> 0 | CO56: 0 | CP56: 0 | CQ56: 0 | CR56: 0 | CS56: =SUM(RC[-4]:RC[-1]) -> 0 | CT56: 0 | CU56: 0 | CV56: 0 | CW56: 0 | CX56: =SUM(RC[-4]:RC[-1]) -> 0 | CY56: 0 | CZ56: 0 | DA56: 0 | DB56: 0 | DC56: =SUM(RC[-4]:RC[-1]) -> 0 | DD56: 0 | DE56: 0 | DF56: 0 | DG56: 0 | DH56: =SUM(RC[-4]:RC[-1]) -> 0 | DI56: 0 | DJ56: 0 | DK56: 0 | DL56: 0 | DM56: =SUM(RC[-4]:RC[-1]) -> 0 | DN56: 0 | DO56: 0 | DP56: 0 | DQ56: 0 | DR56: =SUM(RC[-4]:RC[-1]) -> 0 | DS56: 0 | DT56: 0 | DU56: 0 | DV56: 0 | DW56: =SUM(RC[-4]:RC[-1]) -> 0 | DX56: 0 | DY56: 0 | DZ56: 0 | EA56: 0 | EB56: =SUM(RC[-4]:RC[-1]) -> 0 | EC56: 0 | ED56: 0 | EE56: 0 | EF56: 0 | EG56: =SUM(RC[-4]:RC[-1]) -> 0 | EH56: 0 | EI56: 0 | EJ56: 0 | EK56: 0 | EL56: =SUM(RC[-4]:RC[-1]) -> 0 | EM56: 0 | EN56: 0 | EO56: 0 | EP56: 0 | EQ56: =SUM(RC[-4]:RC[-1]) -> 0 | ER56: 0 | ES56: 0 | ET56: 387.11 | EU56: 0 | EV56: =SUM(RC[-4]:RC[-1]) -> 387.11 | EW56: 0 | EX56: 0 | EY56: 0 | EZ56: 0 | FA56: =SUM(RC[-4]:RC[-1]) -> 0 | FB56: 0 | FC56: 0 | FD56: 0 | FE56: 0 | FF56: =SUM(RC[-4]:RC[-1]) -> 0 | FG56: 0 | FH56: 0 | FI56: 69 | FJ56: 0 | FK56: =SUM(RC[-4]:RC[-1]) -> 69 | FL56: 0 | FM56: 0 | FN56: 0 | FO56: 0 | FP56: =SUM(RC[-4]:RC[-1]) -> 0 | FQ56: 0 | FR56: 0 | FS56: 0 | FT56: 0 | FU56: =SUM(RC[-4]:RC[-1]) -> 0 | FV56: 0 | FW56: 0 | FX56: 0 | FY56: 0 | FZ56: =SUM(RC[-4]:RC[-1]) -> 0 | GA56: 0 | GB56: 0 | GC56: 0 | GD56: 0 | GE56: =SUM(RC[-4]:RC[-1]) -> 0 | GF56: 0 | GG56: 0 | GH56: 0 | GI56: 0 | GJ56: =SUM(RC[-4]:RC[-1]) -> 0 | GK56: 0 | GL56: 0 | GM56: 0 | GN56: 0 | GO56: =SUM(RC[-4]:RC[-1]) -> 0 | GP56: 0 | GQ56: 0 | GR56: 0 | GS56: 0 | GT56: =SUM(RC[-4]:RC[-1]) -> 0 | GU56: 0 | GV56: 0 | GW56: 0 | GX56: 0 | GY56: =SUM(RC[-4]:RC[-1]) -> 0 | GZ56: 0 | HA56: 0 | HB56: 0 | HC56: 0 | HD56: =SUM(RC[-4]:RC[-1]) -> 0 | HE56: 0 | HF56: 0 | HG56: 0 | HH56: 0 | HI56: =SUM(RC[-4]:RC[-1]) -> 0 | HJ56: 0 | HK56: 0 | HL56: 0 | HM56: 0 | HN56: =SUM(RC[-4]:RC[-1]) -> 0 | HO56: 0 | HP56: 0 | HQ56: 0 | HR56: 0 | HS56: =SUM(RC[-4]:RC[-1]) -> 0 | HT56: 0 | HU56: 0 | HV56: 0 | HW56: 0 | HX56: =SUM(RC[-4]:RC[-1]) -> 0 | HY56: 0 | HZ56: 0 | IA56: 0 | IB56: 0 | IC56: =SUM(RC[-4]:RC[-1]) -> 0 | ID56: 0 | IE56: 0 | IF56: 0 | IG56: 0 | IH56: =SUM(RC[-4]:RC[-1]) -> 0 | II56: 0 | IJ56: 0 | IK56: 0 | IL56: 0 | IM56: =SUM(RC[-4]:RC[-1]) -> 0
A57: PYRENE | B57: =RC[8]+RC[13]+RC[18]+RC[23]+RC[28]+RC[33]+RC[38]+RC[43]+RC[48]+RC[53]+RC[58]+RC[63]+RC[68]+RC[73]+RC[78]+RC[83]+RC[88]+RC[93]+RC[98]+RC[103]+RC[108]+RC[113]+RC[118]+RC[123]+RC[128]+RC[133]+RC[138]+RC[143]+RC[148]+RC[153]+RC[158]+RC[163]+RC[168]+RC[173]+RC[178]+RC[183]+RC[188]+RC[193]+RC[198]+RC[203]+RC[208]+RC[213]+RC[218]+RC[223]+RC[228]+RC[233]+RC[238]+RC[243]+Sheet2!RC[2]+Sheet2!RC[7]+Sheet2!RC[12]+Sheet2!RC[17]+Sheet2!RC[22]+Sheet2!RC[27]+Sheet2!RC[32]+Sheet2!RC[37]+Sheet2!RC[42]+Sheet2!RC[47]+Sheet2!RC[57]+Sheet2!RC[52]+Sheet2!RC[62]+Sheet2!RC[67] -> 2146 | C57: =RC[6]+RC[11]+RC[16]+RC[21]+RC[26]+RC[31]+RC[36]+RC[41]+RC[46]+RC[51]+RC[56]+RC[61]+RC[66]+RC[71]+RC[76]+RC[81]+RC[86]+RC[91]+RC[96]+RC[101]+RC[106]+RC[111]+RC[116]+RC[121]+RC[126]+RC[131]+RC[136]+RC[141]+RC[146]+RC[151]+RC[156]+RC[161]+RC[166]+RC[171]+RC[176]+RC[181]+RC[186]+RC[191]+RC[196]+RC[201]+RC[206]+RC[211]+RC[216]+RC[221]+RC[226]+RC[231]+RC[236]+RC[241]+Sheet2!RC+Sheet2!RC[5]+Sheet2!RC[10]+Sheet2!RC[15]+Sheet2!RC[20]+Sheet2!RC[25]+Sheet2!RC[30]+Sheet2!RC[35]+Sheet2!RC[40]+Sheet2!RC[45]+Sheet2!RC[50]+Sheet2!RC[55]+Sheet2!RC[60]+Sheet2!RC[65] -> 0 | D57: =RC[4]+RC[9]+RC[14]+RC[19]+RC[24]+RC[29]+RC[34]+RC[39]+RC[44]+RC[49]+RC[54]+RC[59]+RC[64]+RC[69]+RC[74]+RC[79]+RC[84]+RC[89]+RC[94]+RC[99]+RC[104]+RC[109]+RC[114]+RC[119]+RC[124]+RC[129]+RC[134]+RC[139]+RC[144]+RC[149]+RC[154]+RC[159]+RC[164]+RC[169]+RC[174]+RC[179]+RC[184]+RC[189]+RC[194]+RC[199]+RC[204]+RC[209]+RC[214]+RC[219]+RC[224]+RC[229]+RC[234]+RC[239]+Sheet2!RC[3]+Sheet2!RC[-2]+Sheet2!RC[8]+Sheet2!RC[13]+Sheet2!RC[18]+Sheet2!RC[23]+Sheet2!RC[28]+Sheet2!RC[33]+Sheet2!RC[38]+Sheet2!RC[43]+Sheet2!RC[48]+Sheet2!RC[53]+Sheet2!RC[58]+Sheet2!RC[63] -> 0 | E57: =RC[6]+RC[11]+RC[16]+RC[21]+RC[26]+RC[31]+RC[36]+RC[41]+RC[46]+RC[51]+RC[56]+RC[61]+RC[66]+RC[71]+RC[76]+RC[81]+RC[86]+RC[91]+RC[96]+RC[101]+RC[106]+RC[111]+RC[116]+RC[121]+RC[126]+RC[131]+RC[136]+RC[141]+RC[146]+RC[151]+RC[156]+RC[161]+RC[166]+RC[171]+RC[176]+RC[181]+RC[186]+RC[191]+RC[196]+RC[201]+RC[206]+RC[211]+RC[216]+RC[221]+RC[226]+RC[231]+RC[236]+RC[241]+Sheet2!RC+Sheet2!RC[5]+Sheet2!RC[10]+Sheet2!RC[15]+Sheet2!RC[20]+Sheet2!RC[25]+Sheet2!RC[30]+Sheet2!RC[35]+Sheet2!RC[40]+Sheet2!RC[45]+Sheet2!RC[50]+Sheet2!RC[55]+Sheet2!RC[60]+Sheet2!RC[65] -> 160.52276635840497 | F57: =SUM(RC[-4]:RC[-1]) -> 2306.5227663584051 | G57: =Sheet1!RC[5]+Sheet1!RC[10]+Sheet1!RC[15]+Sheet1!RC[20]+Sheet1!RC[25]+Sheet1!RC[30]+Sheet1!RC[35]+Sheet1!RC[40]+Sheet1!RC[45]+Sheet1!RC[50]+Sheet1!RC[55]+Sheet1!RC[60]+Sheet1!RC[65]+Sheet1!RC[70]+Sheet1!RC[75]+Sheet1!RC[80]+Sheet1!RC[85]+Sheet1!RC[90]+Sheet1!RC[95]+Sheet1!RC[100]+Sheet1!RC[105]+Sheet1!RC[110]+Sheet1!RC[115]+Sheet1!RC[120]+Sheet1!RC[125]+Sheet1!RC[130]+Sheet1!RC[135]+Sheet1!RC[140]+Sheet1!RC[145]+Sheet1!RC[150]+Sheet1!RC[155]+Sheet1!RC[160]+Sheet1!RC[165]+Sheet1!RC[170]+Sheet1!RC[175]+Sheet1!RC[180]+Sheet1!RC[185]+Sheet1!RC[190]+Sheet1!RC[195]+Sheet1!RC[200]+Sheet1!RC[205]+Sheet1!RC[210]+Sheet1!RC[215]+Sheet1!RC[220]+Sheet1!RC[225]+Sheet1!RC[230]+Sheet1!RC[235]+Sheet1!RC[240]+Sheet2!RC[-1]+Sheet2!RC[4]+Sheet2!RC[9]+Sheet2!RC[14]+Sheet2!RC[19]+Sheet2!RC[24]+Sheet2!RC[29]+Sheet2!RC[34]+Sheet2!RC[39]+Sheet2!RC[44]+Sheet2!RC[49]+Sheet2!RC[54]+Sheet2!RC[59]+Sheet2!RC[64] -> 2306.5227663584037 | H57: 0 | I57: 0 | J57: 0 | K57: 2.957804564543399 | L57: =SUM(RC[-4]:RC[-1]) -> 2.957804564543399 | M57: 0 | N57: 0 | O57: 0 | P57: 0.69844478824560008 | Q57: =SUM(RC[-4]:RC[-1]) -> 0.69844478824560008 | R57: 0 | S57: 0 | T57: 0 | U57: 2.7356216875300001 | V57: =SUM(RC[-4]:RC[-1]) -> 2.7356216875300001 | W57: 0 | X57: 0 | Y57: 0 | Z57: 1.6217042818080007 | AA57: =SUM(RC[-4]:RC[-1]) -> 1.6217042818080007 | AB57: 0 | AC57: 0 | AD57: 0 | AE57: 3.189130812276999 | AF57: =SUM(RC[-4]:RC[-1]) -> 3.189130812276999 | AG57: 0 | AH57: 0 | AI57: 0 | AJ57: 0.84568947883259971 | AK57: =SUM(RC[-4]:RC[-1]) -> 0.84568947883259971 | AL57: 0 | AM57: 0 | AN57: 0 | AO57: 2.4423171388210023 | AP57: =SUM(RC[-4]:RC[-1]) -> 2.4423171388210023 | AQ57: 0 | AR57: 0 | AS57: 0 | AT57: 0.66795292825740038 | AU57: =SUM(RC[-4]:RC[-1]) -> 0.66795292825740038 | AV57: 0 | AW57: 0 | AX57: 0 | AY57: 0.93624133049899982 | AZ57: =SUM(RC[-4]:RC[-1]) -> 0.93624133049899982 | BA57: 0 | BB57: 0 | BC57: 0 | BD57: 1.1606921278650004 | BE57: =SUM(RC[-4]:RC[-1]) -> 1.1606921278650004 | BF57: 0 | BG57: 0 | BH57: 0 | BI57: 0.88287127808499966 | BJ57: =SUM(RC[-4]:RC[-1]) -> 0.88287127808499966 | BK57: 0 | BL57: 0 | BM57: 0 | BN57: 0.87392467321819989 | BO57: =SUM(RC[-4]:RC[-1]) -> 0.87392467321819989 | BP57: 0 | BQ57: 0 | BR57: 0 | BS57: 1.2767158456589993 | BT57: =SUM(RC[-4]:RC[-1]) -> 1.2767158456589993 | BU57: 0 | BV57: 0 | BW57: 0 | BX57: 2.7788435229189998 | BY57: =SUM(RC[-4]:RC[-1]) -> 2.7788435229189998 | BZ57: 0 | CA57: 0 | CB57: 2146 | CC57: 8.4999948349709982 | CD57: =SUM(RC[-4]:RC[-1]) -> 2154.4999948349709 | CE57: 0 | CF57: 0 | CG57: 0 | CH57: 1.9804856755022 | CI57: =SUM(RC[-4]:RC[-1]) -> 1.9804856755022 | CJ57: 0 | CK57: 0 | CL57: 0 | CM57: 0.77716355752679989 | CN57: =SUM(RC[-4]:RC[-1]) -> 0.77716355752679989 | CO57: 0 | CP57: 0 | CQ57: 0 | CR57: 0.61912426755360039 | CS57: =SUM(RC[-4]:RC[-1]) -> 0.61912426755360039 | CT57: 0 | CU57: 0 | CV57: 0 | CW57: 0.61191826802699967 | CX57: =SUM(RC[-4]:RC[-1]) -> 0.61191826802699967 | CY57: 0 | CZ57: 0 | DA57: 0 | DB57: 0.58200191643639998 | DC57: =SUM(RC[-4]:RC[-1]) -> 0.58200191643639998 | DD57: 0 | DE57: 0 | DF57: 0 | DG57: 0.24587179690719999 | DH57: =SUM(RC[-4]:RC[-1]) -> 0.24587179690719999 | DI57: 0 | DJ57: 0 | DK57: 0 | DL57: 1.1305977021529998 | DM57: =SUM(RC[-4]:RC[-1]) -> 1.1305977021529998 | DN57: 0 | DO57: 0 | DP57: 0 | DQ57: 0.88466332353159993 | DR57: =SUM(RC[-4]:RC[-1]) -> 0.88466332353159993 | DS57: 0 | DT57: 0 | DU57: 0 | DV57: 6.583559476176795 | DW57: =SUM(RC[-4]:RC[-1]) -> 6.583559476176795 | DX57: 0 | DY57: 0 | DZ57: 0 | EA57: 0.68040396995579999 | EB57: =SUM(RC[-4]:RC[-1]) -> 0.68040396995579999 | EC57: 0 | ED57: 0 | EE57: 0 | EF57: 0.66108118787599979 | EG57: =SUM(RC[-4]:RC[-1]) -> 0.66108118787599979 | EH57: 0 | EI57: 0 | EJ57: 0 | EK57: 0.46192288311399993 | EL57: =SUM(RC[-4]:RC[-1]) -> 0.46192288311399993 | EM57: 0 | EN57: 0 | EO57: 0 | EP57: 7.3364728221619977 | EQ57: =SUM(RC[-4]:RC[-1]) -> 7.3364728221619977 | ER57: 0 | ES57: 0 | ET57: 0 | EU57: 0.42387104317800001 | EV57: =SUM(RC[-4]:RC[-1]) -> 0.42387104317800001 | EW57: 0 | EX57: 0 | EY57: 0 | EZ57: 12.582953150446404 | FA57: =SUM(RC[-4]:RC[-1]) -> 12.582953150446404 | FB57: 0 | FC57: 0 | FD57: 0 | FE57: 15.324552663790007 | FF57: =SUM(RC[-4]:RC[-1]) -> 15.324552663790007 | FG57: 0 | FH57: 0 | FI57: 0 | FJ57: 1.9316997693609994 | FK57: =SUM(RC[-4]:RC[-1]) -> 1.9316997693609994 | FL57: 0 | FM57: 0 | FN57: 0 | FO57: 2.0940939062609991 | FP57: =SUM(RC[-4]:RC[-1]) -> 2.0940939062609991 | FQ57: 0 | FR57: 0 | FS57: 0 | FT57: 4.4422350099480008 | FU57: =SUM(RC[-4]:RC[-1]) -> 4.4422350099480008 | FV57: 0 | FW57: 0 | FX57: 0 | FY57: 1.1482313176349996 | FZ57: =SUM(RC[-4]:RC[-1]) -> 1.1482313176349996 | GA57: 0 | GB57: 0 | GC57: 0 | GD57: 2.779981491216001 | GE57: =SUM(RC[-4]:RC[-1]) -> 2.779981491216001 | GF57: 0 | GG57: 0 | GH57: 0 | GI57: 0.35859224281300001 | GJ57: =SUM(RC[-4]:RC[-1]) -> 0.35859224281300001 | GK57: 0 | GL57: 0 | GM57: 0 | GN57: 1.2431427268549997 | GO57: =SUM(RC[-4]:RC[-1]) -> 1.2431427268549997 | GP57: 0 | GQ57: 0 | GR57: 0 | GS57: 0.95920890127579972 | GT57: =SUM(RC[-4]:RC[-1]) -> 0.95920890127579972 | GU57: 0 | GV57: 0 | GW57: 0 | GX57: 0.95089192670480016 | GY57: =SUM(RC[-4]:RC[-1]) -> 0.95089192670480016 | GZ57: 0 | HA57: 0 | HB57: 0 | HC57: 10.796842567599988 | HD57: =SUM(RC[-4]:RC[-1]) -> 10.796842567599988 | HE57: 0 | HF57: 0 | HG57: 0 | HH57: 1.3079651422409995 | HI57: =SUM(RC[-4]:RC[-1]) -> 1.3079651422409995 | HJ57: 0 | HK57: 0 | HL57: 0 | HM57: 2.4228063899139998 | HN57: =SUM(RC[-4]:RC[-1]) -> 2.4228063899139998 | HO57: 0 | HP57: 0 | HQ57: 0 | HR57: 2.8498569964639988 | HS57: =SUM(RC[-4]:RC[-1]) -> 2.8498569964639988 | HT57: 0 | HU57: 0 | HV57: 0 | HW57: 1.1830527117128005 | HX57: =SUM(RC[-4]:RC[-1]) -> 1.1830527117128005 | HY57: 0 | HZ57: 0 | IA57: 0 | IB57: 1.9190710114931997 | IC57: =SUM(RC[-4]:RC[-1]) -> 1.9190710114931997 | ID57: 0 | IE57: 0 | IF57: 0 | IG57: 0.9483941207519998 | IH57: =SUM(RC[-4]:RC[-1]) -> 0.9483941207519998 | II57: 0 | IJ57: 0 | IK57: 0 | IL57: 0.20556616501239999 | IM57: =SUM(RC[-4]:RC[-1]) -> 0.20556616501239999
A58: STYRENE | B58: =RC[8]+RC[13]+RC[18]+RC[23]+RC[28]+RC[33]+RC[38]+RC[43]+RC[48]+RC[53]+RC[58]+RC[63]+RC[68]+RC[73]+RC[78]+RC[83]+RC[88]+RC[93]+RC[98]+RC[103]+RC[108]+RC[113]+RC[118]+RC[123]+RC[128]+RC[133]+RC[138]+RC[143]+RC[148]+RC[153]+RC[158]+RC[163]+RC[168]+RC[173]+RC[178]+RC[183]+RC[188]+RC[193]+RC[198]+RC[203]+RC[208]+RC[213]+RC[218]+RC[223]+RC[228]+RC[233]+RC[238]+RC[243]+Sheet2!RC[2]+Sheet2!RC[7]+Sheet2!RC[12]+Sheet2!RC[17]+Sheet2!RC[22]+Sheet2!RC[27]+Sheet2!RC[32]+Sheet2!RC[37]+Sheet2!RC[42]+Sheet2!RC[47]+Sheet2!RC[57]+Sheet2!RC[52]+Sheet2!RC[62]+Sheet2!RC[67] -> 140405.43 | C58: =RC[6]+RC[11]+RC[16]+RC[21]+RC[26]+RC[31]+RC[36]+RC[41]+RC[46]+RC[51]+RC[56]+RC[61]+RC[66]+RC[71]+RC[76]+RC[81]+RC[86]+RC[91]+RC[96]+RC[101]+RC[106]+RC[111]+RC[116]+RC[121]+RC[126]+RC[131]+RC[136]+RC[141]+RC[146]+RC[151]+RC[156]+RC[161]+RC[166]+RC[171]+RC[176]+RC[181]+RC[186]+RC[191]+RC[196]+RC[201]+RC[206]+RC[211]+RC[216]+RC[221]+RC[226]+RC[231]+RC[236]+RC[241]+Sheet2!RC+Sheet2!RC[5]+Sheet2!RC[10]+Sheet2!RC[15]+Sheet2!RC[20]+Sheet2!RC[25]+Sheet2!RC[30]+Sheet2!RC[35]+Sheet2!RC[40]+Sheet2!RC[45]+Sheet2!RC[50]+Sheet2!RC[55]+Sheet2!RC[60]+Sheet2!RC[65] -> 223341.11700000003 | D58: =RC[4]+RC[9]+RC[14]+RC[19]+RC[24]+RC[29]+RC[34]+RC[39]+RC[44]+RC[49]+RC[54]+RC[59]+RC[64]+RC[69]+RC[74]+RC[79]+RC[84]+RC[89]+RC[94]+RC[99]+RC[104]+RC[109]+RC[114]+RC[119]+RC[124]+RC[129]+RC[134]+RC[139]+RC[144]+RC[149]+RC[154]+RC[159]+RC[164]+RC[169]+RC[174]+RC[179]+RC[184]+RC[189]+RC[194]+RC[199]+RC[204]+RC[209]+RC[214]+RC[219]+RC[224]+RC[229]+RC[234]+RC[239]+Sheet2!RC[3]+Sheet2!RC[-2]+Sheet2!RC[8]+Sheet2!RC[13]+Sheet2!RC[18]+Sheet2!RC[23]+Sheet2!RC[28]+Sheet2!RC[33]+Sheet2!RC[38]+Sheet2!RC[43]+Sheet2!RC[48]+Sheet2!RC[53]+Sheet2!RC[58]+Sheet2!RC[63] -> 3149613 | E58: =RC[6]+RC[11]+RC[16]+RC[21]+RC[26]+RC[31]+RC[36]+RC[41]+RC[46]+RC[51]+RC[56]+RC[61]+RC[66]+RC[71]+RC[76]+RC[81]+RC[86]+RC[91]+RC[96]+RC[101]+RC[106]+RC[111]+RC[116]+RC[121]+RC[126]+RC[131]+RC[136]+RC[141]+RC[146]+RC[151]+RC[156]+RC[161]+RC[166]+RC[171]+RC[176]+RC[181]+RC[186]+RC[191]+RC[196]+RC[201]+RC[206]+RC[211]+RC[216]+RC[221]+RC[226]+RC[231]+RC[236]+RC[241]+Sheet2!RC+Sheet2!RC[5]+Sheet2!RC[10]+Sheet2!RC[15]+Sheet2!RC[20]+Sheet2!RC[25]+Sheet2!RC[30]+Sheet2!RC[35]+Sheet2!RC[40]+Sheet2!RC[45]+Sheet2!RC[50]+Sheet2!RC[55]+Sheet2!RC[60]+Sheet2!RC[65] -> 145092.95455688346 | F58: =SUM(RC[-4]:RC[-1]) -> 3658452.5015568836 | G58: =Sheet1!RC[5]+Sheet1!RC[10]+Sheet1!RC[15]+Sheet1!RC[20]+Sheet1!RC[25]+Sheet1!RC[30]+Sheet1!RC[35]+Sheet1!RC[40]+Sheet1!RC[45]+Sheet1!RC[50]+Sheet1!RC[55]+Sheet1!RC[60]+Sheet1!RC[65]+Sheet1!RC[70]+Sheet1!RC[75]+Sheet1!RC[80]+Sheet1!RC[85]+Sheet1!RC[90]+Sheet1!RC[95]+Sheet1!RC[100]+Sheet1!RC[105]+Sheet1!RC[110]+Sheet1!RC[115]+Sheet1!RC[120]+Sheet1!RC[125]+Sheet1!RC[130]+Sheet1!RC[135]+Sheet1!RC[140]+Sheet1!RC[145]+Sheet1!RC[150]+Sheet1!RC[155]+Sheet1!RC[160]+Sheet1!RC[165]+Sheet1!RC[170]+Sheet1!RC[175]+Sheet1!RC[180]+Sheet1!RC[185]+Sheet1!RC[190]+Sheet1!RC[195]+Sheet1!RC[200]+Sheet1!RC[205]+Sheet1!RC[210]+Sheet1!RC[215]+Sheet1!RC[220]+Sheet1!RC[225]+Sheet1!RC[230]+Sheet1!RC[235]+Sheet1!RC[240]+Sheet2!RC[-1]+Sheet2!RC[4]+Sheet2!RC[9]+Sheet2!RC[14]+Sheet2!RC[19]+Sheet2!RC[24]+Sheet2!RC[29]+Sheet2!RC[34]+Sheet2!RC[39]+Sheet2!RC[44]+Sheet2!RC[49]+Sheet2!RC[54]+Sheet2!RC[59]+Sheet2!RC[64] -> 3658452.5015568836 | H58: 87464 | I58: 6813.02 | J58: 11542.65 | K58: 2515.9111091298005 | L58: =SUM(RC[-4]:RC[-1]) -> 108335.58110912979 | M58: 10904 | N58: 716.82 | O58: 0 | P58: 736.89116617139996 | Q58: =SUM(RC[-4]:RC[-1]) -> 12357.711166171399 | R58: 97128 | S58: 5658.58 | T58: 0 | U58: 2108.1321464809998 | V58: =SUM(RC[-4]:RC[-1]) -> 104894.712146481 | W58: 51662 | X58: 3092 | Y58: 4.4800000000000004 | Z58: 1441.2298122981006 | AA58: =SUM(RC[-4]:RC[-1]) -> 56199.709812298104 | AB58: 19588 | AC58: 979.13499999999999 | AD58: 0 | AE58: 3555.6678067962998 | AF58: =SUM(RC[-4]:RC[-1]) -> 24122.802806796299 | AG58: 18293 | AH58: 1174.03 | AI58: 209.82 | AJ58: 757.2434533742005 | AK58: =SUM(RC[-4]:RC[-1]) -> 20434.0934533742 | AL58: 33571 | AM58: 1596.51 | AN58: 72.97 | AO58: 2469.7846463113005 | AP58: =SUM(RC[-4]:RC[-1]) -> 37710.264646311305 | AQ58: 19474 | AR58: 1142 | AS58: 0 | AT58: 601.83003943690017 | AU58: =SUM(RC[-4]:RC[-1]) -> 21217.8300394369 | AV58: 11084 | AW58: 646.76 | AX58: 714.28 | AY58: 976.07563408820022 | AZ58: =SUM(RC[-4]:RC[-1]) -> 13421.115634088201 | BA58: 18663 | BB58: 1299.94 | BC58: 253.21 | BD58: 1186.9839923649999 | BE58: =SUM(RC[-4]:RC[-1]) -> 21403.133992364998 | BF58: 17161 | BG58: 1160.9100000000001 | BH58: 2.27 | BI58: 862.85905647389984 | BJ58: =SUM(RC[-4]:RC[-1]) -> 19187.039056473899 | BK58: 14680 | BL58: 911.65 | BM58: 1194.77 | BN58: 922.79591487459982 | BO58: =SUM(RC[-4]:RC[-1]) -> 17709.2159148746 | BP58: 12563 | BQ58: 549.57600000000002 | BR58: 0 | BS58: 1375.9033741003998 | BT58: =SUM(RC[-4]:RC[-1]) -> 14488.479374100401 | BU58: 61211 | BV58: 3515.57 | BW58: 1.8 | BX58: 2600.7625884227991 | BY58: =SUM(RC[-4]:RC[-1]) -> 67329.132588422799 | BZ58: 179710 | CA58: 13655.42 | CB58: 42059.97 | CC58: 7546.5993236910017 | CD58: =SUM(RC[-4]:RC[-1]) -> 242971.98932369103 | CE58: 11443 | CF58: 608.85 | CG58: 625 | CH58: 2240.9976603294981 | CI58: =SUM(RC[-4]:RC[-1]) -> 14917.847660329498 | CJ58: 10988 | CK58: 587.25599999999997 | CL58: 0 | CM58: 819.83181475449999 | CN58: =SUM(RC[-4]:RC[-1]) -> 12395.087814754499 | CO58: 9836 | CP58: 670.29 | CQ58: 0 | CR58: 596.81863483429981 | CS58: =SUM(RC[-4]:RC[-1]) -> 11103.108634834301 | CT58: 24327 | CU58: 1560.99 | CV58: 0 | CW58: 540.38899053650005 | CX58: =SUM(RC[-4]:RC[-1]) -> 26428.378990536501 | CY58: 16174 | CZ58: 1111.71 | DA58: 0 | DB58: 580.35058882170006 | DC58: =SUM(RC[-4]:RC[-1]) -> 17866.0605888217 | DD58: 3136 | DE58: 104.84 | DF58: 0 | DG58: 258.35485228029995 | DH58: =SUM(RC[-4]:RC[-1]) -> 3499.1948522803 | DI58: 18260 | DJ58: 1017.79 | DK58: 26792 | DL58: 1154.2474106310003 | DM58: =SUM(RC[-4]:RC[-1]) -> 47224.037410631005 | DN58: 27720 | DO58: 1640.47 | DP58: 302 | DQ58: 773.7863176269999 | DR58: =SUM(RC[-4]:RC[-1]) -> 30436.256317627001 | DS58: 142503 | DT58: 12246.79 | DU58: 33.700000000000003 | DV58: 5144.0979788498007 | DW58: =SUM(RC[-4]:RC[-1]) -> 159927.58797884983 | DX58: 6208 | DY58: 405.93 | DZ58: 233.83 | EA58: 704.39899924869962 | EB58: =SUM(RC[-4]:RC[-1]) -> 7552.1589992486997 | EC58: 17321 | ED58: 1157.97 | EE58: 327.81 | EF58: 629.37125154880016 | EG58: =SUM(RC[-4]:RC[-1]) -> 19436.151251548803 | EH58: 17178 | EI58: 811.26 | EJ58: 0 | EK58: 389.27589533039981 | EL58: =SUM(RC[-4]:RC[-1]) -> 18378.535895330398 | EM58: 167686 | EN58: 9934.11 | EO58: 4670 | EP58: 6253.2965810548003 | EQ58: =SUM(RC[-4]:RC[-1]) -> 188543.40658105479 | ER58: 17487 | ES58: 1088.2 | ET58: 0 | EU58: 369.09551697229995 | EV58: =SUM(RC[-4]:RC[-1]) -> 18944.295516972299 | EW58: 340816 | EX58: 17365.18 | EY58: 1969.3 | EZ58: 10627.795421537598 | FA58: =SUM(RC[-4]:RC[-1]) -> 370778.27542153758 | FB58: 107000 | FC58: 24791.9 | FD58: 0 | FE58: 10984.522393859999 | FF58: =SUM(RC[-4]:RC[-1]) -> 142776.42239386 | FG58: 35136 | FH58: 2784.46 | FI58: 4315.6099999999997 | FJ58: 1697.6985201130003 | FK58: =SUM(RC[-4]:RC[-1]) -> 43933.768520113001 | FL58: 55123 | FM58: 3501.77 | FN58: 194.91 | FO58: 1903.8542126645007 | FP58: =SUM(RC[-4]:RC[-1]) -> 60723.534212664497 | FQ58: 105387 | FR58: 6576.8 | FS58: 228.61 | FT58: 3928.8304165759009 | FU58: =SUM(RC[-4]:RC[-1]) -> 116121.24041657591 | FV58: 28821 | FW58: 1757.6 | FX58: 1355 | FY58: 971.50030049770021 | FZ58: =SUM(RC[-4]:RC[-1]) -> 32905.100300497696 | GA58: 78350 | GB58: 4639.5 | GC58: 531.82000000000005 | GD58: 2479.7138330072007 | GE58: =SUM(RC[-4]:RC[-1]) -> 86001.033833007212 | GF58: 8111 | GG58: 480.14 | GH58: 553 | GI58: 319.25554597399992 | GJ58: =SUM(RC[-4]:RC[-1]) -> 9463.3955459739991 | GK58: 26042 | GL58: 1814.1 | GM58: 14100.2 | GN58: 1226.4872031482 | GO58: =SUM(RC[-4]:RC[-1]) -> 43182.787203148204 | GP58: 14285 | GQ58: 816.73 | GR58: 0 | GS58: 978.66896388409987 | GT58: =SUM(RC[-4]:RC[-1]) -> 16080.398963884099 | GU58: 28693 | GV58: 1169.8599999999999 | GW58: 0 | GX58: 870.51681733630005 | GY58: =SUM(RC[-4]:RC[-1]) -> 30733.376817336302 | GZ58: 187984 | HA58: 10571.34 | HB58: 1046 | HC58: 12473.248106443005 | HD58: =SUM(RC[-4]:RC[-1]) -> 212074.588106443 | HE58: 35643 | HF58: 2788.33 | HG58: 405.03 | HH58: 1234.7409581995005 | HI58: =SUM(RC[-4]:RC[-1]) -> 40071.100958199502 | HJ58: 60868 | HK58: 19679.7 | HL58: 2121.4299999999998 | HM58: 1999.3157421669994 | HN58: =SUM(RC[-4]:RC[-1]) -> 84668.445742166994 | HO58: 56091 | HP58: 2346.17 | HQ58: 1.17 | HR58: 2497.2652994699997 | HS58: =SUM(RC[-4]:RC[-1]) -> 60935.605299469993 | HT58: 54037 | HU58: 2565.7199999999998 | HV58: 211.62 | HW58: 1141.5010926105995 | HX58: =SUM(RC[-4]:RC[-1]) -> 57955.841092610601 | HY58: 29797 | HZ58: 2030.01 | IA58: 2068.2199999999998 | IB58: 1706.6122752861997 | IC58: =SUM(RC[-4]:RC[-1]) -> 35601.842275286195 | ID58: 8145 | IE58: 392.75 | IF58: 0 | IG58: 833.47001652239942 | IH58: =SUM(RC[-4]:RC[-1]) -> 9371.2200165223985 | II58: 3779 | IJ58: 244.31 | IK58: 0 | IL58: 171.9313731252 | IM58: =SUM(RC[-4]:RC[-1]) -> 4195.2413731252
A59: TCDD,2378 | B59: =RC[8]+RC[13]+RC[18]+RC[23]+RC[28]+RC[33]+RC[38]+RC[43]+RC[48]+RC[53]+RC[58]+RC[63]+RC[68]+RC[73]+RC[78]+RC[83]+RC[88]+RC[93]+RC[98]+RC[103]+RC[108]+RC[113]+RC[118]+RC[123]+RC[128]+RC[133]+RC[138]+RC[143]+RC[148]+RC[153]+RC[158]+RC[163]+RC[168]+RC[173]+RC[178]+RC[183]+RC[188]+RC[193]+RC[198]+RC[203]+RC[208]+RC[213]+RC[218]+RC[223]+RC[228]+RC[233]+RC[238]+RC[243]+Sheet2!RC[2]+Sheet2!RC[7]+Sheet2!RC[12]+Sheet2!RC[17]+Sheet2!RC[22]+Sheet2!RC[27]+Sheet2!RC[32]+Sheet2!RC[37]+Sheet2!RC[42]+Sheet2!RC[47]+Sheet2!RC[57]+Sheet2!RC[52]+Sheet2!RC[62]+Sheet2!RC[67] -> 13.098800000000001 | C59: =RC[6]+RC[11]+RC[16]+RC[21]+RC[26]+RC[31]+RC[36]+RC[41]+RC[46]+RC[51]+RC[56]+RC[61]+RC[66]+RC[71]+RC[76]+RC[81]+RC[86]+RC[91]+RC[96]+RC[101]+RC[106]+RC[111]+RC[116]+RC[121]+RC[126]+RC[131]+RC[136]+RC[141]+RC[146]+RC[151]+RC[156]+RC[161]+RC[166]+RC[171]+RC[176]+RC[181]+RC[186]+RC[191]+RC[196]+RC[201]+RC[206]+RC[211]+RC[216]+RC[221]+RC[226]+RC[231]+RC[236]+RC[241]+Sheet2!RC+Sheet2!RC[5]+Sheet2!RC[10]+Sheet2!RC[15]+Sheet2!RC[20]+Sheet2!RC[25]+Sheet2!RC[30]+Sheet2!RC[35]+Sheet2!RC[40]+Sheet2!RC[45]+Sheet2!RC[50]+Sheet2!RC[55]+Sheet2!RC[60]+Sheet2!RC[65] -> 0 | D59: =RC[4]+RC[9]+RC[14]+RC[19]+RC[24]+RC[29]+RC[34]+RC[39]+RC[44]+RC[49]+RC[54]+RC[59]+RC[64]+RC[69]+RC[74]+RC[79]+RC[84]+RC[89]+RC[94]+RC[99]+RC[104]+RC[109]+RC[114]+RC[119]+RC[124]+RC[129]+RC[134]+RC[139]+RC[144]+RC[149]+RC[154]+RC[159]+RC[164]+RC[169]+RC[174]+RC[179]+RC[184]+RC[189]+RC[194]+RC[199]+RC[204]+RC[209]+RC[214]+RC[219]+RC[224]+RC[229]+RC[234]+RC[239]+Sheet2!RC[3]+Sheet2!RC[-2]+Sheet2!RC[8]+Sheet2!RC[13]+Sheet2!RC[18]+Sheet2!RC[23]+Sheet2!RC[28]+Sheet2!RC[33]+Sheet2!RC[38]+Sheet2!RC[43]+Sheet2!RC[48]+Sheet2!RC[53]+Sheet2!RC[58]+Sheet2!RC[63] -> 0 | E59: =RC[6]+RC[11]+RC[16]+RC[21]+RC[26]+RC[31]+RC[36]+RC[41]+RC[46]+RC[51]+RC[56]+RC[61]+RC[66]+RC[71]+RC[76]+RC[81]+RC[86]+RC[91]+RC[96]+RC[101]+RC[106]+RC[111]+RC[116]+RC[121]+RC[126]+RC[131]+RC[136]+RC[141]+RC[146]+RC[151]+RC[156]+RC[161]+RC[166]+RC[171]+RC[176]+RC[181]+RC[186]+RC[191]+RC[196]+RC[201]+RC[206]+RC[211]+RC[216]+RC[221]+RC[226]+RC[231]+RC[236]+RC[241]+Sheet2!RC+Sheet2!RC[5]+Sheet2!RC[10]+Sheet2!RC[15]+Sheet2!RC[20]+Sheet2!RC[25]+Sheet2!RC[30]+Sheet2!RC[35]+Sheet2!RC[40]+Sheet2!RC[45]+Sheet2!RC[50]+Sheet2!RC[55]+Sheet2!RC[60]+Sheet2!RC[65] -> 0 | F59: =SUM(RC[-4]:RC[-1]) -> 13.098800000000001 | G59: =Sheet1!RC[5]+Sheet1!RC[10]+Sheet1!RC[15]+Sheet1!RC[20]+Sheet1!RC[25]+Sheet1!RC[30]+Sheet1!RC[35]+Sheet1!RC[40]+Sheet1!RC[45]+Sheet1!RC[50]+Sheet1!RC[55]+Sheet1!RC[60]+Sheet1!RC[65]+Sheet1!RC[70]+Sheet1!RC[75]+Sheet1!RC[80]+Sheet1!RC[85]+Sheet1!RC[90]+Sheet1!RC[95]+Sheet1!RC[100]+Sheet1!RC[105]+Sheet1!RC[110]+Sheet1!RC[115]+Sheet1!RC[120]+Sheet1!RC[125]+Sheet1!RC[130]+Sheet1!RC[135]+Sheet1!RC[140]+Sheet1!RC[145]+Sheet1!RC[150]+Sheet1!RC[155]+Sheet1!RC[160]+Sheet1!RC[165]+Sheet1!RC[170]+Sheet1!RC[175]+Sheet1!RC[180]+Sheet1!RC[185]+Sheet1!RC[190]+Sheet1!RC[195]+Sheet1!RC[200]+Sheet1!RC[205]+Sheet1!RC[210]+Sheet1!RC[215]+Sheet1!RC[220]+Sheet1!RC[225]+Sheet1!RC[230]+Sheet1!RC[235]+Sheet1!RC[240]+Sheet2!RC[-1]+Sheet2!RC[4]+Sheet2!RC[9]+Sheet2!RC[14]+Sheet2!RC[19]+Sheet2!RC[24]+Sheet2!RC[29]+Sheet2!RC[34]+Sheet2!RC[39]+Sheet2!RC[44]+Sheet2!RC[49]+Sheet2!RC[54]+Sheet2!RC[59]+Sheet2!RC[64] -> 13.098800000000001 | H59: 0 | I59: 0 | J59: 0 | K59: 0 | L59: =SUM(RC[-4]:RC[-1]) -> 0 | M59: 0 | N59: 0 | O59: 0 | P59: 0 | Q59: =SUM(RC[-4]:RC[-1]) -> 0 | R59: 0 | S59: 0 | T59: 0 | U59: 0 | V59: =SUM(RC[-4]:RC[-1]) -> 0 | W59: 0 | X59: 0 | Y59: 0 | Z59: 0 | AA59: =SUM(RC[-4]:RC[-1]) -> 0 | AB59: 0 | AC59: 0 | AD59: 0 | AE59: 0 | AF59: =SUM(RC[-4]:RC[-1]) -> 0 | AG59: 0 | AH59: 0 | AI59: 0 | AJ59: 0 | AK59: =SUM(RC[-4]:RC[-1]) -> 0 | AL59: 0 | AM59: 0 | AN59: 0 | AO59: 0 | AP59: =SUM(RC[-4]:RC[-1]) -> 0 | AQ59: 0 | AR59: 0 | AS59: 0 | AT59: 0 | AU59: =SUM(RC[-4]:RC[-1]) -> 0 | AV59: 0 | AW59: 0 | AX59: 0 | AY59: 0 | AZ59: =SUM(RC[-4]:RC[-1]) -> 0 | BA59: 0 | BB59: 0 | BC59: 0 | BD59: 0 | BE59: =SUM(RC[-4]:RC[-1]) -> 0 | BF59: 0 | BG59: 0 | BH59: 0 | BI59: 0 | BJ59: =SUM(RC[-4]:RC[-1]) -> 0 | BK59: 0 | BL59: 0 | BM59: 0 | BN59: 0 | BO59: =SUM(RC[-4]:RC[-1]) -> 0 | BP59: 0 | BQ59: 0 | BR59: 0 | BS59: 0 | BT59: =SUM(RC[-4]:RC[-1]) -> 0 | BU59: 0 | BV59: 0 | BW59: 0 | BX59: 0 | BY59: =SUM(RC[-4]:RC[-1]) -> 0 | BZ59: 0 | CA59: 0 | CB59: 0 | CC59: 0 | CD59: =SUM(RC[-4]:RC[-1]) -> 0 | CE59: 0 | CF59: 0 | CG59: 1.0900000000000001 | CH59: 0 | CI59: =SUM(RC[-4]:RC[-1]) -> 1.0900000000000001 | CJ59: 0 | CK59: 0 | CL59: 0 | CM59: 0 | CN59: =SUM(RC[-4]:RC[-1]) -> 0 | CO59: 0 | CP59: 0 | CQ59: 0 | CR59: 0 | CS59: =SUM(RC[-4]:RC[-1]) -> 0 | CT59: 0 | CU59: 0 | CV59: 0 | CW59: 0 | CX59: =SUM(RC[-4]:RC[-1]) -> 0 | CY59: 0 | CZ59: 0 | DA59: 0 | DB59: 0 | DC59: =SUM(RC[-4]:RC[-1]) -> 0 | DD59: 0 | DE59: 0 | DF59: 0 | DG59: 0 | DH59: =SUM(RC[-4]:RC[-1]) -> 0 | DI59: 0 | DJ59: 0 | DK59: 0 | DL59: 0 | DM59: =SUM(RC[-4]:RC[-1]) -> 0 | DN59: 0 | DO59: 0 | DP59: 0 | DQ59: 0 | DR59: =SUM(RC[-4]:RC[-1]) -> 0 | DS59: 0 | DT59: 0 | DU59: 0 | DV59: 0 | DW59: =SUM(RC[-4]:RC[-1]) -> 0 | DX59: 0 | DY59: 0 | DZ59: 0 | EA59: 0 | EB59: =SUM(RC[-4]:RC[-1]) -> 0 | EC59: 0 | ED59: 0 | EE59: 0 | EF59: 0 | EG59: =SUM(RC[-4]:RC[-1]) -> 0 | EH59: 0 | EI59: 0 | EJ59: 0 | EK59: 0 | EL59: =SUM(RC[-4]:RC[-1]) -> 0 | EM59: 0 | EN59: 0 | EO59: 0 | EP59: 0 | EQ59: =SUM(RC[-4]:RC[-1]) -> 0 | ER59: 0 | ES59: 0 | ET59: 0 | EU59: 0 | EV59: =SUM(RC[-4]:RC[-1]) -> 0 | EW59: 0 | EX59: 0 | EY59: 0 | EZ59: 0 | FA59: =SUM(RC[-4]:RC[-1]) -> 0 | FB59: 0 | FC59: 0 | FD59: 0 | FE59: 0 | FF59: =SUM(RC[-4]:RC[-1]) -> 0 | FG59: 0 | FH59: 0 | FI59: 0 | FJ59: 0 | FK59: =SUM(RC[-4]:RC[-1]) -> 0 | FL59: 0 | FM59: 0 | FN59: 10 | FO59: 0 | FP59: =SUM(RC[-4]:RC[-1]) -> 10 | FQ59: 0 | FR59: 0 | FS59: 6.0000000000000001E-3 | FT59: 0 | FU59: =SUM(RC[-4]:RC[-1]) -> 6.0000000000000001E-3 | FV59: 0 | FW59: 0 | FX59: 0 | FY59: 0 | FZ59: =SUM(RC[-4]:RC[-1]) -> 0 | GA59: 0 | GB59: 0 | GC59: 0 | GD59: 0 | GE59: =SUM(RC[-4]:RC[-1]) -> 0 | GF59: 0 | GG59: 0 | GH59: 0 | GI59: 0 | GJ59: =SUM(RC[-4]:RC[-1]) -> 0 | GK59: 0 | GL59: 0 | GM59: 2E-3 | GN59: 0 | GO59: =SUM(RC[-4]:RC[-1]) -> 2E-3 | GP59: 0 | GQ59: 0 | GR59: 0 | GS59: 0 | GT59: =SUM(RC[-4]:RC[-1]) -> 0 | GU59: 0 | GV59: 0 | GW59: 0 | GX59: 0 | GY59: =SUM(RC[-4]:RC[-1]) -> 0 | GZ59: 0 | HA59: 0 | HB59: 0 | HC59: 0 | HD59: =SUM(RC[-4]:RC[-1]) -> 0 | HE59: 0 | HF59: 0 | HG59: 0 | HH59: 0 | HI59: =SUM(RC[-4]:RC[-1]) -> 0 | HJ59: 0 | HK59: 0 | HL59: 0 | HM59: 0 | HN59: =SUM(RC[-4]:RC[-1]) -> 0 | HO59: 0 | HP59: 0 | HQ59: 8.0000000000000004E-4 | HR59: 0 | HS59: =SUM(RC[-4]:RC[-1]) -> 8.0000000000000004E-4 | HT59: 0 | HU59: 0 | HV59: 0 | HW59: 0 | HX59: =SUM(RC[-4]:RC[-1]) -> 0 | HY59: 0 | HZ59: 0 | IA59: 0 | IB59: 0 | IC59: =SUM(RC[-4]:RC[-1]) -> 0 | ID59: 0 | IE59: 0 | IF59: 0 | IG59: 0 | IH59: =SUM(RC[-4]:RC[-1]) -> 0 | II59: 0 | IJ59: 0 | IK59: 0 | IL59: 0 | IM59: =SUM(RC[-4]:RC[-1]) -> 0
A60: TCDF,2378 | B60: =RC[8]+RC[13]+RC[18]+RC[23]+RC[28]+RC[33]+RC[38]+RC[43]+RC[48]+RC[53]+RC[58]+RC[63]+RC[68]+RC[73]+RC[78]+RC[83]+RC[88]+RC[93]+RC[98]+RC[103]+RC[108]+RC[113]+RC[118]+RC[123]+RC[128]+RC[133]+RC[138]+RC[143]+RC[148]+RC[153]+RC[158]+RC[163]+RC[168]+RC[173]+RC[178]+RC[183]+RC[188]+RC[193]+RC[198]+RC[203]+RC[208]+RC[213]+RC[218]+RC[223]+RC[228]+RC[233]+RC[238]+RC[243]+Sheet2!RC[2]+Sheet2!RC[7]+Sheet2!RC[12]+Sheet2!RC[17]+Sheet2!RC[22]+Sheet2!RC[27]+Sheet2!RC[32]+Sheet2!RC[37]+Sheet2!RC[42]+Sheet2!RC[47]+Sheet2!RC[57]+Sheet2!RC[52]+Sheet2!RC[62]+Sheet2!RC[67] -> 0 | C60: =RC[6]+RC[11]+RC[16]+RC[21]+RC[26]+RC[31]+RC[36]+RC[41]+RC[46]+RC[51]+RC[56]+RC[61]+RC[66]+RC[71]+RC[76]+RC[81]+RC[86]+RC[91]+RC[96]+RC[101]+RC[106]+RC[111]+RC[116]+RC[121]+RC[126]+RC[131]+RC[136]+RC[141]+RC[146]+RC[151]+RC[156]+RC[161]+RC[166]+RC[171]+RC[176]+RC[181]+RC[186]+RC[191]+RC[196]+RC[201]+RC[206]+RC[211]+RC[216]+RC[221]+RC[226]+RC[231]+RC[236]+RC[241]+Sheet2!RC+Sheet2!RC[5]+Sheet2!RC[10]+Sheet2!RC[15]+Sheet2!RC[20]+Sheet2!RC[25]+Sheet2!RC[30]+Sheet2!RC[35]+Sheet2!RC[40]+Sheet2!RC[45]+Sheet2!RC[50]+Sheet2!RC[55]+Sheet2!RC[60]+Sheet2!RC[65] -> 0 | D60: =RC[4]+RC[9]+RC[14]+RC[19]+RC[24]+RC[29]+RC[34]+RC[39]+RC[44]+RC[49]+RC[54]+RC[59]+RC[64]+RC[69]+RC[74]+RC[79]+RC[84]+RC[89]+RC[94]+RC[99]+RC[104]+RC[109]+RC[114]+RC[119]+RC[124]+RC[129]+RC[134]+RC[139]+RC[144]+RC[149]+RC[154]+RC[159]+RC[164]+RC[169]+RC[174]+RC[179]+RC[184]+RC[189]+RC[194]+RC[199]+RC[204]+RC[209]+RC[214]+RC[219]+RC[224]+RC[229]+RC[234]+RC[239]+Sheet2!RC[3]+Sheet2!RC[-2]+Sheet2!RC[8]+Sheet2!RC[13]+Sheet2!RC[18]+Sheet2!RC[23]+Sheet2!RC[28]+Sheet2!RC[33]+Sheet2!RC[38]+Sheet2!RC[43]+Sheet2!RC[48]+Sheet2!RC[53]+Sheet2!RC[58]+Sheet2!RC[63] -> 0 | E60: =RC[6]+RC[11]+RC[16]+RC[21]+RC[26]+RC[31]+RC[36]+RC[41]+RC[46]+RC[51]+RC[56]+RC[61]+RC[66]+RC[71]+RC[76]+RC[81]+RC[86]+RC[91]+RC[96]+RC[101]+RC[106]+RC[111]+RC[116]+RC[121]+RC[126]+RC[131]+RC[136]+RC[141]+RC[146]+RC[151]+RC[156]+RC[161]+RC[166]+RC[171]+RC[176]+RC[181]+RC[186]+RC[191]+RC[196]+RC[201]+RC[206]+RC[211]+RC[216]+RC[221]+RC[226]+RC[231]+RC[236]+RC[241]+Sheet2!RC+Sheet2!RC[5]+Sheet2!RC[10]+Sheet2!RC[15]+Sheet2!RC[20]+Sheet2!RC[25]+Sheet2!RC[30]+Sheet2!RC[35]+Sheet2!RC[40]+Sheet2!RC[45]+Sheet2!RC[50]+Sheet2!RC[55]+Sheet2!RC[60]+Sheet2!RC[65] -> 0 | F60: =SUM(RC[-4]:RC[-1]) -> 0 | G60: =Sheet1!RC[5]+Sheet1!RC[10]+Sheet1!RC[15]+Sheet1!RC[20]+Sheet1!RC[25]+Sheet1!RC[30]+Sheet1!RC[35]+Sheet1!RC[40]+Sheet1!RC[45]+Sheet1!RC[50]+Sheet1!RC[55]+Sheet1!RC[60]+Sheet1!RC[65]+Sheet1!RC[70]+Sheet1!RC[75]+Sheet1!RC[80]+Sheet1!RC[85]+Sheet1!RC[90]+Sheet1!RC[95]+Sheet1!RC[100]+Sheet1!RC[105]+Sheet1!RC[110]+Sheet1!RC[115]+Sheet1!RC[120]+Sheet1!RC[125]+Sheet1!RC[130]+Sheet1!RC[135]+Sheet1!RC[140]+Sheet1!RC[145]+Sheet1!RC[150]+Sheet1!RC[155]+Sheet1!RC[160]+Sheet1!RC[165]+Sheet1!RC[170]+Sheet1!RC[175]+Sheet1!RC[180]+Sheet1!RC[185]+Sheet1!RC[190]+Sheet1!RC[195]+Sheet1!RC[200]+Sheet1!RC[205]+Sheet1!RC[210]+Sheet1!RC[215]+Sheet1!RC[220]+Sheet1!RC[225]+Sheet1!RC[230]+Sheet1!RC[235]+Sheet1!RC[240]+Sheet2!RC[-1]+Sheet2!RC[4]+Sheet2!RC[9]+Sheet2!RC[14]+Sheet2!RC[19]+Sheet2!RC[24]+Sheet2!RC[29]+Sheet2!RC[34]+Sheet2!RC[39]+Sheet2!RC[44]+Sheet2!RC[49]+Sheet2!RC[54]+Sheet2!RC[59]+Sheet2!RC[64] -> 0 | H60: 0 | I60: 0 | J60: 0 | K60: 0 | L60: =SUM(RC[-4]:RC[-1]) -> 0 | M60: 0 | N60: 0 | O60: 0 | P60: 0 | Q60: =SUM(RC[-4]:RC[-1]) -> 0 | R60: 0 | S60: 0 | T60: 0 | U60: 0 | V60: =SUM(RC[-4]:RC[-1]) -> 0 | W60: 0 | X60: 0 | Y60: 0 | Z60: 0 | AA60: =SUM(RC[-4]:RC[-1]) -> 0 | AB60: 0 | AC60: 0 | AD60: 0 | AE60: 0 | AF60: =SUM(RC[-4]:RC[-1]) -> 0 | AG60: 0 | AH60: 0 | AI60: 0 | AJ60: 0 | AK60: =SUM(RC[-4]:RC[-1]) -> 0 | AL60: 0 | AM60: 0 | AN60: 0 | AO60: 0 | AP60: =SUM(RC[-4]:RC[-1]) -> 0 | AQ60: 0 | AR60: 0 | AS60: 0 | AT60: 0 | AU60: =SUM(RC[-4]:RC[-1]) -> 0 | AV60: 0 | AW60: 0 | AX60: 0 | AY60: 0 | AZ60: =SUM(RC[-4]:RC[-1]) -> 0 | BA60: 0 | BB60: 0 | BC60: 0 | BD60: 0 | BE60: =SUM(RC[-4]:RC[-1]) -> 0 | BF60: 0 | BG60: 0 | BH60: 0 | BI60: 0 | BJ60: =SUM(RC[-4]:RC[-1]) -> 0 | BK60: 0 | BL60: 0 | BM60: 0 | BN60: 0 | BO60: =SUM(RC[-4]:RC[-1]) -> 0 | BP60: 0 | BQ60: 0 | BR60: 0 | BS60: 0 | BT60: =SUM(RC[-4]:RC[-1]) -> 0 | BU60: 0 | BV60: 0 | BW60: 0 | BX60: 0 | BY60: =SUM(RC[-4]:RC[-1]) -> 0 | BZ60: 0 | CA60: 0 | CB60: 0 | CC60: 0 | CD60: =SUM(RC[-4]:RC[-1]) -> 0 | CE60: 0 | CF60: 0 | CG60: 0 | CH60: 0 | CI60: =SUM(RC[-4]:RC[-1]) -> 0 | CJ60: 0 | CK60: 0 | CL60: 0 | CM60: 0 | CN60: =SUM(RC[-4]:RC[-1]) -> 0 | CO60: 0 | CP60: 0 | CQ60: 0 | CR60: 0 | CS60: =SUM(RC[-4]:RC[-1]) -> 0 | CT60: 0 | CU60: 0 | CV60: 0 | CW60: 0 | CX60: =SUM(RC[-4]:RC[-1]) -> 0 | CY60: 0 | CZ60: 0 | DA60: 0 | DB60: 0 | DC60: =SUM(RC[-4]:RC[-1]) -> 0 | DD60: 0 | DE60: 0 | DF60: 0 | DG60: 0 | DH60: =SUM(RC[-4]:RC[-1]) -> 0 | DI60: 0 | DJ60: 0 | DK60: 0 | DL60: 0 | DM60: =SUM(RC[-4]:RC[-1]) -> 0 | DN60: 0 | DO60: 0 | DP60: 0 | DQ60: 0 | DR60: =SUM(RC[-4]:RC[-1]) -> 0 | DS60: 0 | DT60: 0 | DU60: 0 | DV60: 0 | DW60: =SUM(RC[-4]:RC[-1]) -> 0 | DX60: 0 | DY60: 0 | DZ60: 0 | EA60: 0 | EB60: =SUM(RC[-4]:RC[-1]) -> 0 | EC60: 0 | ED60: 0 | EE60: 0 | EF60: 0 | EG60: =SUM(RC[-4]:RC[-1]) -> 0 | EH60: 0 | EI60: 0 | EJ60: 0 | EK60: 0 | EL60: =SUM(RC[-4]:RC[-1]) -> 0 | EM60: 0 | EN60: 0 | EO60: 0 | EP60: 0 | EQ60: =SUM(RC[-4]:RC[-1]) -> 0 | ER60: 0 | ES60: 0 | ET60: 0 | EU60: 0 | EV60: =SUM(RC[-4]:RC[-1]) -> 0 | EW60: 0 | EX60: 0 | EY60: 0 | EZ60: 0 | FA60: =SUM(RC[-4]:RC[-1]) -> 0 | FB60: 0 | FC60: 0 | FD60: 0 | FE60: 0 | FF60: =SUM(RC[-4]:RC[-1]) -> 0 | FG60: 0 | FH60: 0 | FI60: 0 | FJ60: 0 | FK60: =SUM(RC[-4]:RC[-1]) -> 0 | FL60: 0 | FM60: 0 | FN60: 0 | FO60: 0 | FP60: =SUM(RC[-4]:RC[-1]) -> 0 | FQ60: 0 | FR60: 0 | FS60: 0 | FT60: 0 | FU60: =SUM(RC[-4]:RC[-1]) -> 0 | FV60: 0 | FW60: 0 | FX60: 0 | FY60: 0 | FZ60: =SUM(RC[-4]:RC[-1]) -> 0 | GA60: 0 | GB60: 0 | GC60: 0 | GD60: 0 | GE60: =SUM(RC[-4]:RC[-1]) -> 0 | GF60: 0 | GG60: 0 | GH60: 0 | GI60: 0 | GJ60: =SUM(RC[-4]:RC[-1]) -> 0 | GK60: 0 | GL60: 0 | GM60: 0 | GN60: 0 | GO60: =SUM(RC[-4]:RC[-1]) -> 0 | GP60: 0 | GQ60: 0 | GR60: 0 | GS60: 0 | GT60: =SUM(RC[-4]:RC[-1]) -> 0 | GU60: 0 | GV60: 0 | GW60: 0 | GX60: 0 | GY60: =SUM(RC[-4]:RC[-1]) -> 0 | GZ60: 0 | HA60: 0 | HB60: 0 | HC60: 0 | HD60: =SUM(RC[-4]:RC[-1]) -> 0 | HE60: 0 | HF60: 0 | HG60: 0 | HH60: 0 | HI60: =SUM(RC[-4]:RC[-1]) -> 0 | HJ60: 0 | HK60: 0 | HL60: 0 | HM60: 0 | HN60: =SUM(RC[-4]:RC[-1]) -> 0 | HO60: 0 | HP60: 0 | HQ60: 0 | HR60: 0 | HS60: =SUM(RC[-4]:RC[-1]) -> 0 | HT60: 0 | HU60: 0 | HV60: 0 | HW60: 0 | HX60: =SUM(RC[-4]:RC[-1]) -> 0 | HY60: 0 | HZ60: 0 | IA60: 0 | IB60: 0 | IC60: =SUM(RC[-4]:RC[-1]) -> 0 | ID60: 0 | IE60: 0 | IF60: 0 | IG60: 0 | IH60: =SUM(RC[-4]:RC[-1]) -> 0 | II60: 0 | IJ60: 0 | IK60: 0 | IL60: 0 | IM60: =SUM(RC[-4]:RC[-1]) -> 0
A61: TCE,111 | B61: =RC[8]+RC[13]+RC[18]+RC[23]+RC[28]+RC[33]+RC[38]+RC[43]+RC[48]+RC[53]+RC[58]+RC[63]+RC[68]+RC[73]+RC[78]+RC[83]+RC[88]+RC[93]+RC[98]+RC[103]+RC[108]+RC[113]+RC[118]+RC[123]+RC[128]+RC[133]+RC[138]+RC[143]+RC[148]+RC[153]+RC[158]+RC[163]+RC[168]+RC[173]+RC[178]+RC[183]+RC[188]+RC[193]+RC[198]+RC[203]+RC[208]+RC[213]+RC[218]+RC[223]+RC[228]+RC[233]+RC[238]+RC[243]+Sheet2!RC[2]+Sheet2!RC[7]+Sheet2!RC[12]+Sheet2!RC[17]+Sheet2!RC[22]+Sheet2!RC[27]+Sheet2!RC[32]+Sheet2!RC[37]+Sheet2!RC[42]+Sheet2!RC[47]+Sheet2!RC[57]+Sheet2!RC[52]+Sheet2!RC[62]+Sheet2!RC[67] -> 31599.437000000005 | C61: =RC[6]+RC[11]+RC[16]+RC[21]+RC[26]+RC[31]+RC[36]+RC[41]+RC[46]+RC[51]+RC[56]+RC[61]+RC[66]+RC[71]+RC[76]+RC[81]+RC[86]+RC[91]+RC[96]+RC[101]+RC[106]+RC[111]+RC[116]+RC[121]+RC[126]+RC[131]+RC[136]+RC[141]+RC[146]+RC[151]+RC[156]+RC[161]+RC[166]+RC[171]+RC[176]+RC[181]+RC[186]+RC[191]+RC[196]+RC[201]+RC[206]+RC[211]+RC[216]+RC[221]+RC[226]+RC[231]+RC[236]+RC[241]+Sheet2!RC+Sheet2!RC[5]+Sheet2!RC[10]+Sheet2!RC[15]+Sheet2!RC[20]+Sheet2!RC[25]+Sheet2!RC[30]+Sheet2!RC[35]+Sheet2!RC[40]+Sheet2!RC[45]+Sheet2!RC[50]+Sheet2!RC[55]+Sheet2!RC[60]+Sheet2!RC[65] -> 34600367.994000003 | D61: =RC[4]+RC[9]+RC[14]+RC[19]+RC[24]+RC[29]+RC[34]+RC[39]+RC[44]+RC[49]+RC[54]+RC[59]+RC[64]+RC[69]+RC[74]+RC[79]+RC[84]+RC[89]+RC[94]+RC[99]+RC[104]+RC[109]+RC[114]+RC[119]+RC[124]+RC[129]+RC[134]+RC[139]+RC[144]+RC[149]+RC[154]+RC[159]+RC[164]+RC[169]+RC[174]+RC[179]+RC[184]+RC[189]+RC[194]+RC[199]+RC[204]+RC[209]+RC[214]+RC[219]+RC[224]+RC[229]+RC[234]+RC[239]+Sheet2!RC[3]+Sheet2!RC[-2]+Sheet2!RC[8]+Sheet2!RC[13]+Sheet2!RC[18]+Sheet2!RC[23]+Sheet2!RC[28]+Sheet2!RC[33]+Sheet2!RC[38]+Sheet2!RC[43]+Sheet2!RC[48]+Sheet2!RC[53]+Sheet2!RC[58]+Sheet2!RC[63] -> 0 | E61: =RC[6]+RC[11]+RC[16]+RC[21]+RC[26]+RC[31]+RC[36]+RC[41]+RC[46]+RC[51]+RC[56]+RC[61]+RC[66]+RC[71]+RC[76]+RC[81]+RC[86]+RC[91]+RC[96]+RC[101]+RC[106]+RC[111]+RC[116]+RC[121]+RC[126]+RC[131]+RC[136]+RC[141]+RC[146]+RC[151]+RC[156]+RC[161]+RC[166]+RC[171]+RC[176]+RC[181]+RC[186]+RC[191]+RC[196]+RC[201]+RC[206]+RC[211]+RC[216]+RC[221]+RC[226]+RC[231]+RC[236]+RC[241]+Sheet2!RC+Sheet2!RC[5]+Sheet2!RC[10]+Sheet2!RC[15]+Sheet2!RC[20]+Sheet2!RC[25]+Sheet2!RC[30]+Sheet2!RC[35]+Sheet2!RC[40]+Sheet2!RC[45]+Sheet2!RC[50]+Sheet2!RC[55]+Sheet2!RC[60]+Sheet2!RC[65] -> 0 | F61: =SUM(RC[-4]:RC[-1]) -> 34631967.431000002 | G61: =Sheet1!RC[5]+Sheet1!RC[10]+Sheet1!RC[15]+Sheet1!RC[20]+Sheet1!RC[25]+Sheet1!RC[30]+Sheet1!RC[35]+Sheet1!RC[40]+Sheet1!RC[45]+Sheet1!RC[50]+Sheet1!RC[55]+Sheet1!RC[60]+Sheet1!RC[65]+Sheet1!RC[70]+Sheet1!RC[75]+Sheet1!RC[80]+Sheet1!RC[85]+Sheet1!RC[90]+Sheet1!RC[95]+Sheet1!RC[100]+Sheet1!RC[105]+Sheet1!RC[110]+Sheet1!RC[115]+Sheet1!RC[120]+Sheet1!RC[125]+Sheet1!RC[130]+Sheet1!RC[135]+Sheet1!RC[140]+Sheet1!RC[145]+Sheet1!RC[150]+Sheet1!RC[155]+Sheet1!RC[160]+Sheet1!RC[165]+Sheet1!RC[170]+Sheet1!RC[175]+Sheet1!RC[180]+Sheet1!RC[185]+Sheet1!RC[190]+Sheet1!RC[195]+Sheet1!RC[200]+Sheet1!RC[205]+Sheet1!RC[210]+Sheet1!RC[215]+Sheet1!RC[220]+Sheet1!RC[225]+Sheet1!RC[230]+Sheet1!RC[235]+Sheet1!RC[240]+Sheet2!RC[-1]+Sheet2!RC[4]+Sheet2!RC[9]+Sheet2!RC[14]+Sheet2!RC[19]+Sheet2!RC[24]+Sheet2!RC[29]+Sheet2!RC[34]+Sheet2!RC[39]+Sheet2!RC[44]+Sheet2!RC[49]+Sheet2!RC[54]+Sheet2!RC[59]+Sheet2!RC[64] -> 34631967.430999994 | H61: 0 | I61: 587928.91 | J61: 0 | K61: 0 | L61: =SUM(RC[-4]:RC[-1]) -> 587928.91 | M61: 0 | N61: 99974.66 | O61: 0 | P61: 0 | Q61: =SUM(RC[-4]:RC[-1]) -> 99974.66 | R61: 0 | S61: 2581884.91 | T61: 0 | U61: 0 | V61: =SUM(RC[-4]:RC[-1]) -> 2581884.91 | W61: 0 | X61: 347425 | Y61: 21.27 | Z61: 0 | AA61: =SUM(RC[-4]:RC[-1]) -> 347446.27 | AB61: 0 | AC61: 167956.54 | AD61: 0 | AE61: 0 | AF61: =SUM(RC[-4]:RC[-1]) -> 167956.54 | AG61: 0 | AH61: 153438 | AI61: 694.55 | AJ61: 0 | AK61: =SUM(RC[-4]:RC[-1]) -> 154132.54999999999 | AL61: 0 | AM61: 71551.48 | AN61: 64.41 | AO61: 0 | AP61: =SUM(RC[-4]:RC[-1]) -> 71615.89 | AQ61: 0 | AR61: 182586 | AS61: 310.45999999999998 | AT61: 0 | AU61: =SUM(RC[-4]:RC[-1]) -> 182896.46 | AV61: 0 | AW61: 72646.509999999995 | AX61: 10 | AY61: 0 | AZ61: =SUM(RC[-4]:RC[-1]) -> 72656.509999999995 | BA61: 0 | BB61: 159604.15900000001 | BC61: 0 | BD61: 0 | BE61: =SUM(RC[-4]:RC[-1]) -> 159604.15900000001 | BF61: 0 | BG61: 94065.83 | BH61: 0 | BI61: 0 | BJ61: =SUM(RC[-4]:RC[-1]) -> 94065.83 | BK61: 0 | BL61: 38278.75 | BM61: 0 | BN61: 0 | BO61: =SUM(RC[-4]:RC[-1]) -> 38278.75 | BP61: 0 | BQ61: 90231.150999999998 | BR61: 0.09 | BS61: 0 | BT61: =SUM(RC[-4]:RC[-1]) -> 90231.240999999995 | BU61: 0 | BV61: 517492.01 | BW61: 170 | BX61: 0 | BY61: =SUM(RC[-4]:RC[-1]) -> 517662.01 | BZ61: 0 | CA61: 1569683.4 | CB61: 225.54 | CC61: 0 | CD61: =SUM(RC[-4]:RC[-1]) -> 1569908.94 | CE61: 0 | CF61: 76724.154999999999 | CG61: 0 | CH61: 0 | CI61: =SUM(RC[-4]:RC[-1]) -> 76724.154999999999 | CJ61: 0 | CK61: 100927.458 | CL61: 0 | CM61: 0 | CN61: =SUM(RC[-4]:RC[-1]) -> 100927.458 | CO61: 0 | CP61: 87145.755000000005 | CQ61: 0 | CR61: 0 | CS61: =SUM(RC[-4]:RC[-1]) -> 87145.755000000005 | CT61: 0 | CU61: 120861.09 | CV61: 0 | CW61: 0 | CX61: =SUM(RC[-4]:RC[-1]) -> 120861.09 | CY61: 0 | CZ61: 91388.83 | DA61: 0 | DB61: 0 | DC61: =SUM(RC[-4]:RC[-1]) -> 91388.83 | DD61: 0 | DE61: 10570.66 | DF61: 0 | DG61: 0 | DH61: =SUM(RC[-4]:RC[-1]) -> 10570.66 | DI61: 0 | DJ61: 65004.78 | DK61: 0 | DL61: 0 | DM61: =SUM(RC[-4]:RC[-1]) -> 65004.78 | DN61: 0 | DO61: 223075.61 | DP61: 37.4 | DQ61: 0 | DR61: =SUM(RC[-4]:RC[-1]) -> 223113.00999999998 | DS61: 0 | DT61: 4813039.2300000004 | DU61: 0 | DV61: 0 | DW61: =SUM(RC[-4]:RC[-1]) -> 4813039.2300000004 | DX61: 0 | DY61: 53824.45 | DZ61: 0 | EA61: 0 | EB61: =SUM(RC[-4]:RC[-1]) -> 53824.45 | EC61: 0 | ED61: 128860.92 | EE61: 0 | EF61: 0 | EG61: =SUM(RC[-4]:RC[-1]) -> 128860.92 | EH61: 0 | EI61: 139352.14000000001 | EJ61: 0 | EK61: 0 | EL61: =SUM(RC[-4]:RC[-1]) -> 139352.14000000001 | EM61: 0 | EN61: 1395539.9 | EO61: 246.45 | EP61: 0 | EQ61: =SUM(RC[-4]:RC[-1]) -> 1395786.3499999999 | ER61: 0 | ES61: 82069.759999999995 | ET61: 0 | EU61: 0 | EV61: =SUM(RC[-4]:RC[-1]) -> 82069.759999999995 | EW61: 0 | EX61: 2595812.2799999998 | EY61: 26 | EZ61: 0 | FA61: =SUM(RC[-4]:RC[-1]) -> 2595838.2799999998 | FB61: 0 | FC61: 3074508.7999999998 | FD61: 12.18 | FE61: 0 | FF61: =SUM(RC[-4]:RC[-1]) -> 3074520.98 | FG61: 0 | FH61: 129680.1 | FI61: 43.24 | FJ61: 0 | FK61: =SUM(RC[-4]:RC[-1]) -> 129723.34000000001 | FL61: 0 | FM61: 285445.7 | FN61: 8.4969999999999999 | FO61: 0 | FP61: =SUM(RC[-4]:RC[-1]) -> 285454.19699999999 | FQ61: 0 | FR61: 737919.2 | FS61: 0 | FT61: 0 | FU61: =SUM(RC[-4]:RC[-1]) -> 737919.2 | FV61: 0 | FW61: 199262.45 | FX61: 42.79 | FY61: 0 | FZ61: =SUM(RC[-4]:RC[-1]) -> 199305.24000000002 | GA61: 0 | GB61: 503127.7 | GC61: 49.03 | GD61: 0 | GE61: =SUM(RC[-4]:RC[-1]) -> 503176.73000000004 | GF61: 0 | GG61: 88502 | GH61: 0 | GI61: 0 | GJ61: =SUM(RC[-4]:RC[-1]) -> 88502 | GK61: 0 | GL61: 191355.8 | GM61: 1140.46 | GN61: 0 | GO61: =SUM(RC[-4]:RC[-1]) -> 192496.25999999998 | GP61: 0 | GQ61: 122559.1 | GR61: 0 | GS61: 0 | GT61: =SUM(RC[-4]:RC[-1]) -> 122559.1 | GU61: 0 | GV61: 188781.94 | GW61: 0 | GX61: 0 | GY61: =SUM(RC[-4]:RC[-1]) -> 188781.94 | GZ61: 0 | HA61: 4296479.9800000004 | HB61: 0 | HC61: 0 | HD61: =SUM(RC[-4]:RC[-1]) -> 4296479.9800000004 | HE61: 0 | HF61: 303070.15999999997 | HG61: 0 | HH61: 0 | HI61: =SUM(RC[-4]:RC[-1]) -> 303070.15999999997 | HJ61: 0 | HK61: 866610.1 | HL61: 172.05 | HM61: 0 | HN61: =SUM(RC[-4]:RC[-1]) -> 866782.15 | HO61: 0 | HP61: 568880.66 | HQ61: 0 | HR61: 0 | HS61: =SUM(RC[-4]:RC[-1]) -> 568880.66 | HT61: 0 | HU61: 30370.366000000002 | HV61: 21015.08 | HW61: 0 | HX61: =SUM(RC[-4]:RC[-1]) -> 51385.446000000004 | HY61: 0 | HZ61: 205254.5 | IA61: 169.9 | IB61: 0 | IC61: =SUM(RC[-4]:RC[-1]) -> 205424.4 | ID61: 0 | IE61: 63100.3 | IF61: 0 | IG61: 0 | IH61: =SUM(RC[-4]:RC[-1]) -> 63100.3 | II61: 0 | IJ61: 38169.58 | IK61: 0 | IL61: 0 | IM61: =SUM(RC[-4]:RC[-1]) -> 38169.58
A62: TOLUENE | B62: =RC[8]+RC[13]+RC[18]+RC[23]+RC[28]+RC[33]+RC[38]+RC[43]+RC[48]+RC[53]+RC[58]+RC[63]+RC[68]+RC[73]+RC[78]+RC[83]+RC[88]+RC[93]+RC[98]+RC[103]+RC[108]+RC[113]+RC[118]+RC[123]+RC[128]+RC[133]+RC[138]+RC[143]+RC[148]+RC[153]+RC[158]+RC[163]+RC[168]+RC[173]+RC[178]+RC[183]+RC[188]+RC[193]+RC[198]+RC[203]+RC[208]+RC[213]+RC[218]+RC[223]+RC[228]+RC[233]+RC[238]+RC[243]+Sheet2!RC[2]+Sheet2!RC[7]+Sheet2!RC[12]+Sheet2!RC[17]+Sheet2!RC[22]+Sheet2!RC[27]+Sheet2!RC[32]+Sheet2!RC[37]+Sheet2!RC[42]+Sheet2!RC[47]+Sheet2!RC[57]+Sheet2!RC[52]+Sheet2!RC[62]+Sheet2!RC[67] -> 2944453.4699999993 | C62: =RC[6]+RC[11]+RC[16]+RC[21]+RC[26]+RC[31]+RC[36]+RC[41]+RC[46]+RC[51]+RC[56]+RC[61]+RC[66]+RC[71]+RC[76]+RC[81]+RC[86]+RC[91]+RC[96]+RC[101]+RC[106]+RC[111]+RC[116]+RC[121]+RC[126]+RC[131]+RC[136]+RC[141]+RC[146]+RC[151]+RC[156]+RC[161]+RC[166]+RC[171]+RC[176]+RC[181]+RC[186]+RC[191]+RC[196]+RC[201]+RC[206]+RC[211]+RC[216]+RC[221]+RC[226]+RC[231]+RC[236]+RC[241]+Sheet2!RC+Sheet2!RC[5]+Sheet2!RC[10]+Sheet2!RC[15]+Sheet2!RC[20]+Sheet2!RC[25]+Sheet2!RC[30]+Sheet2!RC[35]+Sheet2!RC[40]+Sheet2!RC[45]+Sheet2!RC[50]+Sheet2!RC[55]+Sheet2!RC[60]+Sheet2!RC[65] -> 32101180.029199999 | D62: =RC[4]+RC[9]+RC[14]+RC[19]+RC[24]+RC[29]+RC[34]+RC[39]+RC[44]+RC[49]+RC[54]+RC[59]+RC[64]+RC[69]+RC[74]+RC[79]+RC[84]+RC[89]+RC[94]+RC[99]+RC[104]+RC[109]+RC[114]+RC[119]+RC[124]+RC[129]+RC[134]+RC[139]+RC[144]+RC[149]+RC[154]+RC[159]+RC[164]+RC[169]+RC[174]+RC[179]+RC[184]+RC[189]+RC[194]+RC[199]+RC[204]+RC[209]+RC[214]+RC[219]+RC[224]+RC[229]+RC[234]+RC[239]+Sheet2!RC[3]+Sheet2!RC[-2]+Sheet2!RC[8]+Sheet2!RC[13]+Sheet2!RC[18]+Sheet2!RC[23]+Sheet2!RC[28]+Sheet2!RC[33]+Sheet2!RC[38]+Sheet2!RC[43]+Sheet2!RC[48]+Sheet2!RC[53]+Sheet2!RC[58]+Sheet2!RC[63] -> 62876189 | E62: =RC[6]+RC[11]+RC[16]+RC[21]+RC[26]+RC[31]+RC[36]+RC[41]+RC[46]+RC[51]+RC[56]+RC[61]+RC[66]+RC[71]+RC[76]+RC[81]+RC[86]+RC[91]+RC[96]+RC[101]+RC[106]+RC[111]+RC[116]+RC[121]+RC[126]+RC[131]+RC[136]+RC[141]+RC[146]+RC[151]+RC[156]+RC[161]+RC[166]+RC[171]+RC[176]+RC[181]+RC[186]+RC[191]+RC[196]+RC[201]+RC[206]+RC[211]+RC[216]+RC[221]+RC[226]+RC[231]+RC[236]+RC[241]+Sheet2!RC+Sheet2!RC[5]+Sheet2!RC[10]+Sheet2!RC[15]+Sheet2!RC[20]+Sheet2!RC[25]+Sheet2!RC[30]+Sheet2!RC[35]+Sheet2!RC[40]+Sheet2!RC[45]+Sheet2!RC[50]+Sheet2!RC[55]+Sheet2!RC[60]+Sheet2!RC[65] -> 10357646.38143268 | F62: =SUM(RC[-4]:RC[-1]) -> 108279468.88063268 | G62: =Sheet1!RC[5]+Sheet1!RC[10]+Sheet1!RC[15]+Sheet1!RC[20]+Sheet1!RC[25]+Sheet1!RC[30]+Sheet1!RC[35]+Sheet1!RC[40]+Sheet1!RC[45]+Sheet1!RC[50]+Sheet1!RC[55]+Sheet1!RC[60]+Sheet1!RC[65]+Sheet1!RC[70]+Sheet1!RC[75]+Sheet1!RC[80]+Sheet1!RC[85]+Sheet1!RC[90]+Sheet1!RC[95]+Sheet1!RC[100]+Sheet1!RC[105]+Sheet1!RC[110]+Sheet1!RC[115]+Sheet1!RC[120]+Sheet1!RC[125]+Sheet1!RC[130]+Sheet1!RC[135]+Sheet1!RC[140]+Sheet1!RC[145]+Sheet1!RC[150]+Sheet1!RC[155]+Sheet1!RC[160]+Sheet1!RC[165]+Sheet1!RC[170]+Sheet1!RC[175]+Sheet1!RC[180]+Sheet1!RC[185]+Sheet1!RC[190]+Sheet1!RC[195]+Sheet1!RC[200]+Sheet1!RC[205]+Sheet1!RC[210]+Sheet1!RC[215]+Sheet1!RC[220]+Sheet1!RC[225]+Sheet1!RC[230]+Sheet1!RC[235]+Sheet1!RC[240]+Sheet2!RC[-1]+Sheet2!RC[4]+Sheet2!RC[9]+Sheet2!RC[14]+Sheet2!RC[19]+Sheet2!RC[24]+Sheet2!RC[29]+Sheet2!RC[34]+Sheet2!RC[39]+Sheet2!RC[44]+Sheet2!RC[49]+Sheet2!RC[54]+Sheet2!RC[59]+Sheet2!RC[64] -> 108279468.88063267 | H62: 1787659 | I62: 680676.67 | J62: 106225.35 | K62: 189390.25896555994 | L62: =SUM(RC[-4]:RC[-1]) -> 2763951.2789655598 | M62: 228048 | N62: 85108.562999999995 | O62: 4029.82 | P62: 54252.881053549965 | Q62: =SUM(RC[-4]:RC[-1]) -> 371439.26405354997 | R62: 1815577 | S62: 1777635.23 | T62: 2035.32 | U62: 146546.71357141007 | V62: =SUM(RC[-4]:RC[-1]) -> 3741794.26357141 | W62: 1104485 | X62: 321808 | Y62: 1734 | Z62: 106928.33477398998 | AA62: =SUM(RC[-4]:RC[-1]) -> 1534955.3347739899 | AB62: 401360 | AC62: 140465.06 | AD62: 0.39800000000000002 | AE62: 266261.34936699993 | AF62: =SUM(RC[-4]:RC[-1]) -> 808086.80736700003 | AG62: 365579 | AH62: 135117.1 | AI62: 2728.28 | AJ62: 54874.59610183999 | AK62: =SUM(RC[-4]:RC[-1]) -> 558298.97610184003 | AL62: 643929 | AM62: 153285.49 | AN62: 3120.46 | AO62: 185097.47908396999 | AP62: =SUM(RC[-4]:RC[-1]) -> 985432.42908396991 | AQ62: 429668 | AR62: 155000 | AS62: 1939.598 | AT62: 40449.728734710028 | AU62: =SUM(RC[-4]:RC[-1]) -> 627057.32673471002 | AV62: 230951 | AW62: 73919.899999999994 | AX62: 75546.960000000006 | AY62: 71803.026685179968 | AZ62: =SUM(RC[-4]:RC[-1]) -> 452220.88668518001 | BA62: 382923 | BB62: 140699.04999999999 | BC62: 29122.35 | BD62: 87207.577361189949 | BE62: =SUM(RC[-4]:RC[-1]) -> 639951.97736119002 | BF62: 329479 | BG62: 103614.84 | BH62: 10907.1 | BI62: 64765.558737979984 | BJ62: =SUM(RC[-4]:RC[-1]) -> 508766.49873797991 | BK62: 286419 | BL62: 64724.77 | BM62: 5582.73 | BN62: 68923.485228089965 | BO62: =SUM(RC[-4]:RC[-1]) -> 425649.98522808996 | BP62: 258820 | BQ62: 76274 | BR62: 61455.23 | BS62: 102766.69412425999 | BT62: =SUM(RC[-4]:RC[-1]) -> 499315.92412425997 | BU62: 1200433 | BV62: 452052.91 | BW62: 48324.94 | BX62: 193803.87940332008 | BY62: =SUM(RC[-4]:RC[-1]) -> 1894614.72940332 | BZ62: 3637825 | CA62: 1447143.6662000001 | CB62: 386675.6 | CC62: 533348.59625527984 | CD62: =SUM(RC[-4]:RC[-1]) -> 6004992.8624552796 | CE62: 221560 | CF62: 66674.759999999995 | CG62: 930.5 | CH62: 169240.7602247099 | CI62: =SUM(RC[-4]:RC[-1]) -> 458406.02022470988 | CJ62: 233389 | CK62: 82119.61 | CL62: 0 | CM62: 60008.51611709001 | CN62: =SUM(RC[-4]:RC[-1]) -> 375517.12611709 | CO62: 211713 | CP62: 82209.600000000006 | CQ62: 0.79 | CR62: 45687.207446729983 | CS62: =SUM(RC[-4]:RC[-1]) -> 339610.59744672995 | CT62: 467818 | CU62: 114711.1 | CV62: 205.22399999999999 | CW62: 39683.666693969994 | CX62: =SUM(RC[-4]:RC[-1]) -> 622417.99069397 | CY62: 313826 | CZ62: 102090.61 | DA62: 1689.95 | DB62: 44293.913453200024 | DC62: =SUM(RC[-4]:RC[-1]) -> 461900.47345320001 | DD62: 62733 | DE62: 9353.32 | DF62: 0 | DG62: 19812.209671459994 | DH62: =SUM(RC[-4]:RC[-1]) -> 91898.529671459997 | DI62: 374006 | DJ62: 88003.03 | DK62: 1447.27 | DL62: 86210.349818439936 | DM62: =SUM(RC[-4]:RC[-1]) -> 549666.64981843997 | DN62: 570987 | DO62: 190859.38 | DP62: 9246.8700000000008 | DQ62: 53998.102127869977 | DR62: =SUM(RC[-4]:RC[-1]) -> 825091.35212786996 | DS62: 2830304 | DT62: 3514817.78 | DU62: 25495.11 | DV62: 387766.41887971014 | DW62: =SUM(RC[-4]:RC[-1]) -> 6758383.3088797098 | DX62: 129395 | DY62: 45851.68 | DZ62: 168377.54 | EA62: 51744.409829590026 | EB62: =SUM(RC[-4]:RC[-1]) -> 395368.62982958998 | EC62: 330472 | ED62: 114328.27 | EE62: 166.51 | EF62: 44722.772436930019 | EG62: =SUM(RC[-4]:RC[-1]) -> 489689.55243693007 | EH62: 343388 | EI62: 115605.19 | EJ62: 0 | EK62: 28223.34289479001 | EL62: =SUM(RC[-4]:RC[-1]) -> 487216.53289479 | EM62: 3570836 | EN62: 1207324.5 | EO62: 412888.44 | EP62: 464637.25802072027 | EQ62: =SUM(RC[-4]:RC[-1]) -> 5655686.1980207209 | ER62: 331721 | ES62: 86766.8 | ET62: 11306.87 | EU62: 26994.104067229997 | EV62: =SUM(RC[-4]:RC[-1]) -> 456788.77406723 | EW62: 7094145 | EX62: 2109017.41 | EY62: 21657.54 | EZ62: 849317.9929709296 | FA62: =SUM(RC[-4]:RC[-1]) -> 10074137.94297093 | FB62: 2254141 | FC62: 3824941.3 | FD62: 3183.2 | FE62: 784231.37734659994 | FF62: =SUM(RC[-4]:RC[-1]) -> 6866496.8773465995 | FG62: 725337 | FH62: 264651.59999999998 | FI62: 17581.39 | FJ62: 126966.30917595999 | FK62: =SUM(RC[-4]:RC[-1]) -> 1134536.29917596 | FL62: 1117732 | FM62: 337032.6 | FN62: 10263.68 | FO62: 144471.25894242997 | FP62: =SUM(RC[-4]:RC[-1]) -> 1609499.5389424299 | FQ62: 2170388 | FR62: 721382.40000000002 | FS62: 27666.85 | FT62: 275967.36532632011 | FU62: =SUM(RC[-4]:RC[-1]) -> 3195404.6153263203 | FV62: 564839 | FW62: 175716.3 | FX62: 590.54999999999995 | FY62: 71651.740286110013 | FZ62: =SUM(RC[-4]:RC[-1]) -> 812797.59028611006 | GA62: 1507632 | GB62: 517814.2 | GC62: 435378.33 | GD62: 175202.50392138006 | GE62: =SUM(RC[-4]:RC[-1]) -> 2636027.0339213801 | GF62: 164730 | GG62: 72827.7 | GH62: 10.67 | GI62: 22751.866720219994 | GJ62: =SUM(RC[-4]:RC[-1]) -> 260320.23672022001 | GK62: 513787 | GL62: 187414.2 | GM62: 6700.53 | GN62: 92431.400324479924 | GO62: =SUM(RC[-4]:RC[-1]) -> 800333.13032447989 | GP62: 288554 | GQ62: 101873.13 | GR62: 2.65 | GS62: 72854.292781469994 | GT62: =SUM(RC[-4]:RC[-1]) -> 463284.07278147002 | GU62: 556338 | GV62: 155438.04999999999 | GW62: 0 | GX62: 67572.830249639985 | GY62: =SUM(RC[-4]:RC[-1]) -> 779348.88024963997 | GZ62: 3624492 | HA62: 2994221.38 | HB62: 33750.49 | HC62: 449822.51411050995 | HD62: =SUM(RC[-4]:RC[-1]) -> 7102286.3841105103 | HE62: 740709 | HF62: 330057 | HG62: 20908.080000000002 | HH62: 92583.872267529965 | HI62: =SUM(RC[-4]:RC[-1]) -> 1184257.9522675301 | HJ62: 1118872 | HK62: 2525915.27 | HL62: 20489.34 | HM62: 149295.29887054002 | HN62: =SUM(RC[-4]:RC[-1]) -> 3814571.9088705401 | HO62: 1066087 | HP62: 457584.22 | HQ62: 142963 | HR62: 194094.78662891002 | HS62: =SUM(RC[-4]:RC[-1]) -> 1860729.0066289101 | HT62: 1121527 | HU62: 295296.02 | HV62: 141781.79999999999 | HW62: 82565.858425279905 | HX62: =SUM(RC[-4]:RC[-1]) -> 1641170.6784252799 | HY62: 603175 | HZ62: 213783.72 | IA62: 78398.880000000005 | IB62: 127209.84062854007 | IC62: =SUM(RC[-4]:RC[-1]) -> 1022567.44062854 | ID62: 167998 | IE62: 53057.14 | IF62: 8.43 | IG62: 61592.777070919969 | IH62: =SUM(RC[-4]:RC[-1]) -> 282656.34707091999 | II62: 78172 | IJ62: 32037.23 | IK62: 156.47999999999999 | IL62: 12445.396159440003 | IM62: =SUM(RC[-4]:RC[-1]) -> 122811.10615943999
A63: TOLUENE24DII | B63: =RC[8]+RC[13]+RC[18]+RC[23]+RC[28]+RC[33]+RC[38]+RC[43]+RC[48]+RC[53]+RC[58]+RC[63]+RC[68]+RC[73]+RC[78]+RC[83]+RC[88]+RC[93]+RC[98]+RC[103]+RC[108]+RC[113]+RC[118]+RC[123]+RC[128]+RC[133]+RC[138]+RC[143]+RC[148]+RC[153]+RC[158]+RC[163]+RC[168]+RC[173]+RC[178]+RC[183]+RC[188]+RC[193]+RC[198]+RC[203]+RC[208]+RC[213]+RC[218]+RC[223]+RC[228]+RC[233]+RC[238]+RC[243]+Sheet2!RC[2]+Sheet2!RC[7]+Sheet2!RC[12]+Sheet2!RC[17]+Sheet2!RC[22]+Sheet2!RC[27]+Sheet2!RC[32]+Sheet2!RC[37]+Sheet2!RC[42]+Sheet2!RC[47]+Sheet2!RC[57]+Sheet2!RC[52]+Sheet2!RC[62]+Sheet2!RC[67] -> 357.76 | C63: =RC[6]+RC[11]+RC[16]+RC[21]+RC[26]+RC[31]+RC[36]+RC[41]+RC[46]+RC[51]+RC[56]+RC[61]+RC[66]+RC[71]+RC[76]+RC[81]+RC[86]+RC[91]+RC[96]+RC[101]+RC[106]+RC[111]+RC[116]+RC[121]+RC[126]+RC[131]+RC[136]+RC[141]+RC[146]+RC[151]+RC[156]+RC[161]+RC[166]+RC[171]+RC[176]+RC[181]+RC[186]+RC[191]+RC[196]+RC[201]+RC[206]+RC[211]+RC[216]+RC[221]+RC[226]+RC[231]+RC[236]+RC[241]+Sheet2!RC+Sheet2!RC[5]+Sheet2!RC[10]+Sheet2!RC[15]+Sheet2!RC[20]+Sheet2!RC[25]+Sheet2!RC[30]+Sheet2!RC[35]+Sheet2!RC[40]+Sheet2!RC[45]+Sheet2!RC[50]+Sheet2!RC[55]+Sheet2!RC[60]+Sheet2!RC[65] -> 4410.8738000000003 | D63: =RC[4]+RC[9]+RC[14]+RC[19]+RC[24]+RC[29]+RC[34]+RC[39]+RC[44]+RC[49]+RC[54]+RC[59]+RC[64]+RC[69]+RC[74]+RC[79]+RC[84]+RC[89]+RC[94]+RC[99]+RC[104]+RC[109]+RC[114]+RC[119]+RC[124]+RC[129]+RC[134]+RC[139]+RC[144]+RC[149]+RC[154]+RC[159]+RC[164]+RC[169]+RC[174]+RC[179]+RC[184]+RC[189]+RC[194]+RC[199]+RC[204]+RC[209]+RC[214]+RC[219]+RC[224]+RC[229]+RC[234]+RC[239]+Sheet2!RC[3]+Sheet2!RC[-2]+Sheet2!RC[8]+Sheet2!RC[13]+Sheet2!RC[18]+Sheet2!RC[23]+Sheet2!RC[28]+Sheet2!RC[33]+Sheet2!RC[38]+Sheet2!RC[43]+Sheet2!RC[48]+Sheet2!RC[53]+Sheet2!RC[58]+Sheet2!RC[63] -> 0 | E63: =RC[6]+RC[11]+RC[16]+RC[21]+RC[26]+RC[31]+RC[36]+RC[41]+RC[46]+RC[51]+RC[56]+RC[61]+RC[66]+RC[71]+RC[76]+RC[81]+RC[86]+RC[91]+RC[96]+RC[101]+RC[106]+RC[111]+RC[116]+RC[121]+RC[126]+RC[131]+RC[136]+RC[141]+RC[146]+RC[151]+RC[156]+RC[161]+RC[166]+RC[171]+RC[176]+RC[181]+RC[186]+RC[191]+RC[196]+RC[201]+RC[206]+RC[211]+RC[216]+RC[221]+RC[226]+RC[231]+RC[236]+RC[241]+Sheet2!RC+Sheet2!RC[5]+Sheet2!RC[10]+Sheet2!RC[15]+Sheet2!RC[20]+Sheet2!RC[25]+Sheet2!RC[30]+Sheet2!RC[35]+Sheet2!RC[40]+Sheet2!RC[45]+Sheet2!RC[50]+Sheet2!RC[55]+Sheet2!RC[60]+Sheet2!RC[65] -> 0 | F63: =SUM(RC[-4]:RC[-1]) -> 4768.6338000000005 | G63: =Sheet1!RC[5]+Sheet1!RC[10]+Sheet1!RC[15]+Sheet1!RC[20]+Sheet1!RC[25]+Sheet1!RC[30]+Sheet1!RC[35]+Sheet1!RC[40]+Sheet1!RC[45]+Sheet1!RC[50]+Sheet1!RC[55]+Sheet1!RC[60]+Sheet1!RC[65]+Sheet1!RC[70]+Sheet1!RC[75]+Sheet1!RC[80]+Sheet1!RC[85]+Sheet1!RC[90]+Sheet1!RC[95]+Sheet1!RC[100]+Sheet1!RC[105]+Sheet1!RC[110]+Sheet1!RC[115]+Sheet1!RC[120]+Sheet1!RC[125]+Sheet1!RC[130]+Sheet1!RC[135]+Sheet1!RC[140]+Sheet1!RC[145]+Sheet1!RC[150]+Sheet1!RC[155]+Sheet1!RC[160]+Sheet1!RC[165]+Sheet1!RC[170]+Sheet1!RC[175]+Sheet1!RC[180]+Sheet1!RC[185]+Sheet1!RC[190]+Sheet1!RC[195]+Sheet1!RC[200]+Sheet1!RC[205]+Sheet1!RC[210]+Sheet1!RC[215]+Sheet1!RC[220]+Sheet1!RC[225]+Sheet1!RC[230]+Sheet1!RC[235]+Sheet1!RC[240]+Sheet2!RC[-1]+Sheet2!RC[4]+Sheet2!RC[9]+Sheet2!RC[14]+Sheet2!RC[19]+Sheet2!RC[24]+Sheet2!RC[29]+Sheet2!RC[34]+Sheet2!RC[39]+Sheet2!RC[44]+Sheet2!RC[49]+Sheet2!RC[54]+Sheet2!RC[59]+Sheet2!RC[64] -> 4768.6337999999978 | H63: 0 | I63: 113.88 | J63: 2.42 | K63: 0 | L63: =SUM(RC[-4]:RC[-1]) -> 116.3 | M63: 0 | N63: 19.71 | O63: 0 | P63: 0 | Q63: =SUM(RC[-4]:RC[-1]) -> 19.71 | R63: 0 | S63: 186.27 | T63: 0 | U63: 0 | V63: =SUM(RC[-4]:RC[-1]) -> 186.27 | W63: 0 | X63: 76.099999999999994 | Y63: 3.5000000000000003E-2 | Z63: 0 | AA63: =SUM(RC[-4]:RC[-1]) -> 76.134999999999991 | AB63: 0 | AC63: 32.945999999999998 | AD63: 0 | AE63: 0 | AF63: =SUM(RC[-4]:RC[-1]) -> 32.945999999999998 | AG63: 0 | AH63: 31.864000000000001 | AI63: 0 | AJ63: 0 | AK63: =SUM(RC[-4]:RC[-1]) -> 31.864000000000001 | AL63: 0 | AM63: 53.597999999999999 | AN63: 1E-3 | AO63: 0 | AP63: =SUM(RC[-4]:RC[-1]) -> 53.598999999999997 | AQ63: 0 | AR63: 35.777000000000001 | AS63: 0 | AT63: 0 | AU63: =SUM(RC[-4]:RC[-1]) -> 35.777000000000001 | AV63: 0 | AW63: 19.774000000000001 | AX63: 0 | AY63: 0 | AZ63: =SUM(RC[-4]:RC[-1]) -> 19.774000000000001 | BA63: 0 | BB63: 31.09 | BC63: 0 | BD63: 0 | BE63: =SUM(RC[-4]:RC[-1]) -> 31.09 | BF63: 0 | BG63: 24.57 | BH63: 3.0000000000000001E-3 | BI63: 0 | BJ63: =SUM(RC[-4]:RC[-1]) -> 24.573 | BK63: 0 | BL63: 18.722000000000001 | BM63: 0 | BN63: 0 | BO63: =SUM(RC[-4]:RC[-1]) -> 18.722000000000001 | BP63: 0 | BQ63: 18.079999999999998 | BR63: 6.0000000000000001E-3 | BS63: 0 | BT63: =SUM(RC[-4]:RC[-1]) -> 18.085999999999999 | BU63: 0 | BV63: 104.61 | BW63: 0 | BX63: 0 | BY63: =SUM(RC[-4]:RC[-1]) -> 104.61 | BZ63: 0 | CA63: 361.12299999999999 | CB63: 16.495000000000001 | CC63: 0 | CD63: =SUM(RC[-4]:RC[-1]) -> 377.61799999999999 | CE63: 0 | CF63: 14.627000000000001 | CG63: 0 | CH63: 0 | CI63: =SUM(RC[-4]:RC[-1]) -> 14.627000000000001 | CJ63: 0 | CK63: 18.91 | CL63: 0 | CM63: 0 | CN63: =SUM(RC[-4]:RC[-1]) -> 18.91 | CO63: 0 | CP63: 20.611000000000001 | CQ63: 0 | CR63: 0 | CS63: =SUM(RC[-4]:RC[-1]) -> 20.611000000000001 | CT63: 0 | CU63: 23.58 | CV63: 0 | CW63: 0 | CX63: =SUM(RC[-4]:RC[-1]) -> 23.58 | CY63: 0 | CZ63: 18.850000000000001 | DA63: 0 | DB63: 0 | DC63: =SUM(RC[-4]:RC[-1]) -> 18.850000000000001 | DD63: 0 | DE63: 2.02 | DF63: 0 | DG63: 0 | DH63: =SUM(RC[-4]:RC[-1]) -> 2.02 | DI63: 0 | DJ63: 24.7 | DK63: 1E-3 | DL63: 0 | DM63: =SUM(RC[-4]:RC[-1]) -> 24.701000000000001 | DN63: 0 | DO63: 42.8688 | DP63: 49.06 | DQ63: 0 | DR63: =SUM(RC[-4]:RC[-1]) -> 91.928799999999995 | DS63: 0 | DT63: 353.85 | DU63: 0 | DV63: 0 | DW63: =SUM(RC[-4]:RC[-1]) -> 353.85 | DX63: 0 | DY63: 10.64 | DZ63: 0 | EA63: 0 | EB63: =SUM(RC[-4]:RC[-1]) -> 10.64 | EC63: 0 | ED63: 25.68 | EE63: 3.0000000000000001E-3 | EF63: 0 | EG63: =SUM(RC[-4]:RC[-1]) -> 25.683 | EH63: 0 | EI63: 27.73 | EJ63: 0 | EK63: 0 | EL63: =SUM(RC[-4]:RC[-1]) -> 27.73 | EM63: 0 | EN63: 277.83999999999997 | EO63: 49.168999999999997 | EP63: 0 | EQ63: =SUM(RC[-4]:RC[-1]) -> 327.00899999999996 | ER63: 0 | ES63: 19.64 | ET63: 0 | EU63: 0 | EV63: =SUM(RC[-4]:RC[-1]) -> 19.64 | EW63: 0 | EX63: 203.58799999999999 | EY63: 0.13200000000000001 | EZ63: 0 | FA63: =SUM(RC[-4]:RC[-1]) -> 203.72 | FB63: 0 | FC63: 242.08 | FD63: 0 | FE63: 0 | FF63: =SUM(RC[-4]:RC[-1]) -> 242.08 | FG63: 0 | FH63: 84.3 | FI63: 33.659999999999997 | FJ63: 0 | FK63: =SUM(RC[-4]:RC[-1]) -> 117.96 | FL63: 0 | FM63: 89.5 | FN63: 1.4999999999999999E-2 | FO63: 0 | FP63: =SUM(RC[-4]:RC[-1]) -> 89.515000000000001 | FQ63: 0 | FR63: 177.9 | FS63: 5.96 | FT63: 0 | FU63: =SUM(RC[-4]:RC[-1]) -> 183.86 | FV63: 0 | FW63: 38.9 | FX63: 7.02 | FY63: 0 | FZ63: =SUM(RC[-4]:RC[-1]) -> 45.92 | GA63: 0 | GB63: 90.7 | GC63: 0 | GD63: 0 | GE63: =SUM(RC[-4]:RC[-1]) -> 90.7 | GF63: 0 | GG63: 17.55 | GH63: 0 | GI63: 0 | GJ63: =SUM(RC[-4]:RC[-1]) -> 17.55 | GK63: 0 | GL63: 48.31 | GM63: 0 | GN63: 0 | GO63: =SUM(RC[-4]:RC[-1]) -> 48.31 | GP63: 0 | GQ63: 23.64 | GR63: 0 | GS63: 0 | GT63: =SUM(RC[-4]:RC[-1]) -> 23.64 | GU63: 0 | GV63: 36.988999999999997 | GW63: 0 | GX63: 0 | GY63: =SUM(RC[-4]:RC[-1]) -> 36.988999999999997 | GZ63: 0 | HA63: 312.10000000000002 | HB63: 0 | HC63: 0 | HD63: =SUM(RC[-4]:RC[-1]) -> 312.10000000000002 | HE63: 0 | HF63: 59.06 | HG63: 0.49 | HH63: 0 | HI63: =SUM(RC[-4]:RC[-1]) -> 59.550000000000004 | HJ63: 0 | HK63: 64.47 | HL63: 0 | HM63: 0 | HN63: =SUM(RC[-4]:RC[-1]) -> 64.47 | HO63: 0 | HP63: 44.3 | HQ63: 0 | HR63: 0 | HS63: =SUM(RC[-4]:RC[-1]) -> 44.3 | HT63: 0 | HU63: 77.89 | HV63: 48.35 | HW63: 0 | HX63: =SUM(RC[-4]:RC[-1]) -> 126.24000000000001 | HY63: 0 | HZ63: 56.109000000000002 | IA63: 104.31 | IB63: 0 | IC63: =SUM(RC[-4]:RC[-1]) -> 160.41900000000001 | ID63: 0 | IE63: 12.499000000000001 | IF63: 0 | IG63: 0 | IH63: =SUM(RC[-4]:RC[-1]) -> 12.499000000000001 | II63: 0 | IJ63: 7.4989999999999997 | IK63: 0 | IL63: 0 | IM63: =SUM(RC[-4]:RC[-1]) -> 7.4989999999999997
A64: TRICHLORETHY | B64: =RC[8]+RC[13]+RC[18]+RC[23]+RC[28]+RC[33]+RC[38]+RC[43]+RC[48]+RC[53]+RC[58]+RC[63]+RC[68]+RC[73]+RC[78]+RC[83]+RC[88]+RC[93]+RC[98]+RC[103]+RC[108]+RC[113]+RC[118]+RC[123]+RC[128]+RC[133]+RC[138]+RC[143]+RC[148]+RC[153]+RC[158]+RC[163]+RC[168]+RC[173]+RC[178]+RC[183]+RC[188]+RC[193]+RC[198]+RC[203]+RC[208]+RC[213]+RC[218]+RC[223]+RC[228]+RC[233]+RC[238]+RC[243]+Sheet2!RC[2]+Sheet2!RC[7]+Sheet2!RC[12]+Sheet2!RC[17]+Sheet2!RC[22]+Sheet2!RC[27]+Sheet2!RC[32]+Sheet2!RC[37]+Sheet2!RC[42]+Sheet2!RC[47]+Sheet2!RC[57]+Sheet2!RC[52]+Sheet2!RC[62]+Sheet2!RC[67] -> 335139.14 | C64: =RC[6]+RC[11]+RC[16]+RC[21]+RC[26]+RC[31]+RC[36]+RC[41]+RC[46]+RC[51]+RC[56]+RC[61]+RC[66]+RC[71]+RC[76]+RC[81]+RC[86]+RC[91]+RC[96]+RC[101]+RC[106]+RC[111]+RC[116]+RC[121]+RC[126]+RC[131]+RC[136]+RC[141]+RC[146]+RC[151]+RC[156]+RC[161]+RC[166]+RC[171]+RC[176]+RC[181]+RC[186]+RC[191]+RC[196]+RC[201]+RC[206]+RC[211]+RC[216]+RC[221]+RC[226]+RC[231]+RC[236]+RC[241]+Sheet2!RC+Sheet2!RC[5]+Sheet2!RC[10]+Sheet2!RC[15]+Sheet2!RC[20]+Sheet2!RC[25]+Sheet2!RC[30]+Sheet2!RC[35]+Sheet2!RC[40]+Sheet2!RC[45]+Sheet2!RC[50]+Sheet2!RC[55]+Sheet2!RC[60]+Sheet2!RC[65] -> 26320094.059700001 | D64: =RC[4]+RC[9]+RC[14]+RC[19]+RC[24]+RC[29]+RC[34]+RC[39]+RC[44]+RC[49]+RC[54]+RC[59]+RC[64]+RC[69]+RC[74]+RC[79]+RC[84]+RC[89]+RC[94]+RC[99]+RC[104]+RC[109]+RC[114]+RC[119]+RC[124]+RC[129]+RC[134]+RC[139]+RC[144]+RC[149]+RC[154]+RC[159]+RC[164]+RC[169]+RC[174]+RC[179]+RC[184]+RC[189]+RC[194]+RC[199]+RC[204]+RC[209]+RC[214]+RC[219]+RC[224]+RC[229]+RC[234]+RC[239]+Sheet2!RC[3]+Sheet2!RC[-2]+Sheet2!RC[8]+Sheet2!RC[13]+Sheet2!RC[18]+Sheet2!RC[23]+Sheet2!RC[28]+Sheet2!RC[33]+Sheet2!RC[38]+Sheet2!RC[43]+Sheet2!RC[48]+Sheet2!RC[53]+Sheet2!RC[58]+Sheet2!RC[63] -> 0 | E64: =RC[6]+RC[11]+RC[16]+RC[21]+RC[26]+RC[31]+RC[36]+RC[41]+RC[46]+RC[51]+RC[56]+RC[61]+RC[66]+RC[71]+RC[76]+RC[81]+RC[86]+RC[91]+RC[96]+RC[101]+RC[106]+RC[111]+RC[116]+RC[121]+RC[126]+RC[131]+RC[136]+RC[141]+RC[146]+RC[151]+RC[156]+RC[161]+RC[166]+RC[171]+RC[176]+RC[181]+RC[186]+RC[191]+RC[196]+RC[201]+RC[206]+RC[211]+RC[216]+RC[221]+RC[226]+RC[231]+RC[236]+RC[241]+Sheet2!RC+Sheet2!RC[5]+Sheet2!RC[10]+Sheet2!RC[15]+Sheet2!RC[20]+Sheet2!RC[25]+Sheet2!RC[30]+Sheet2!RC[35]+Sheet2!RC[40]+Sheet2!RC[45]+Sheet2!RC[50]+Sheet2!RC[55]+Sheet2!RC[60]+Sheet2!RC[65] -> 0 | F64: =SUM(RC[-4]:RC[-1]) -> 26655233.199700002 | G64: =Sheet1!RC[5]+Sheet1!RC[10]+Sheet1!RC[15]+Sheet1!RC[20]+Sheet1!RC[25]+Sheet1!RC[30]+Sheet1!RC[35]+Sheet1!RC[40]+Sheet1!RC[45]+Sheet1!RC[50]+Sheet1!RC[55]+Sheet1!RC[60]+Sheet1!RC[65]+Sheet1!RC[70]+Sheet1!RC[75]+Sheet1!RC[80]+Sheet1!RC[85]+Sheet1!RC[90]+Sheet1!RC[95]+Sheet1!RC[100]+Sheet1!RC[105]+Sheet1!RC[110]+Sheet1!RC[115]+Sheet1!RC[120]+Sheet1!RC[125]+Sheet1!RC[130]+Sheet1!RC[135]+Sheet1!RC[140]+Sheet1!RC[145]+Sheet1!RC[150]+Sheet1!RC[155]+Sheet1!RC[160]+Sheet1!RC[165]+Sheet1!RC[170]+Sheet1!RC[175]+Sheet1!RC[180]+Sheet1!RC[185]+Sheet1!RC[190]+Sheet1!RC[195]+Sheet1!RC[200]+Sheet1!RC[205]+Sheet1!RC[210]+Sheet1!RC[215]+Sheet1!RC[220]+Sheet1!RC[225]+Sheet1!RC[230]+Sheet1!RC[235]+Sheet1!RC[240]+Sheet2!RC[-1]+Sheet2!RC[4]+Sheet2!RC[9]+Sheet2!RC[14]+Sheet2!RC[19]+Sheet2!RC[24]+Sheet2!RC[29]+Sheet2!RC[34]+Sheet2!RC[39]+Sheet2!RC[44]+Sheet2!RC[49]+Sheet2!RC[54]+Sheet2!RC[59]+Sheet2!RC[64] -> 26655233.199699998 | H64: 0 | I64: 448435.13 | J64: 21 | K64: 0 | L64: =SUM(RC[-4]:RC[-1]) -> 448456.13 | M64: 0 | N64: 75977.789999999994 | O64: 0 | P64: 0 | Q64: =SUM(RC[-4]:RC[-1]) -> 75977.789999999994 | R64: 0 | S64: 2003728.55 | T64: 3555 | U64: 0 | V64: =SUM(RC[-4]:RC[-1]) -> 2007283.55 | W64: 0 | X64: 256740.1 | Y64: 104.03 | Z64: 0 | AA64: =SUM(RC[-4]:RC[-1]) -> 256844.13 | AB64: 0 | AC64: 127780.08 | AD64: 0 | AE64: 0 | AF64: =SUM(RC[-4]:RC[-1]) -> 127780.08 | AG64: 0 | AH64: 115068 | AI64: 657.16 | AJ64: 0 | AK64: =SUM(RC[-4]:RC[-1]) -> 115725.16 | AL64: 0 | AM64: 16993.349999999999 | AN64: 16060.95 | AO64: 0 | AP64: =SUM(RC[-4]:RC[-1]) -> 33054.300000000003 | AQ64: 0 | AR64: 138888.4 | AS64: 418.72 | AT64: 0 | AU64: =SUM(RC[-4]:RC[-1]) -> 139307.12 | AV64: 0 | AW64: 50072.33 | AX64: 242 | AY64: 0 | AZ64: =SUM(RC[-4]:RC[-1]) -> 50314.33 | BA64: 0 | BB64: 121562.09 | BC64: 0 | BD64: 0 | BE64: =SUM(RC[-4]:RC[-1]) -> 121562.09 | BF64: 0 | BG64: 65811.38 | BH64: 0 | BI64: 0 | BJ64: =SUM(RC[-4]:RC[-1]) -> 65811.38 | BK64: 0 | BL64: 18501.98 | BM64: 0 | BN64: 0 | BO64: =SUM(RC[-4]:RC[-1]) -> 18501.98 | BP64: 0 | BQ64: 68294.570000000007 | BR64: 2888.56 | BS64: 0 | BT64: =SUM(RC[-4]:RC[-1]) -> 71183.13 | BU64: 0 | BV64: 390882 | BW64: 0 | BX64: 0 | BY64: =SUM(RC[-4]:RC[-1]) -> 390882 | BZ64: 0 | CA64: 1142881 | CB64: 270.26 | CC64: 0 | CD64: =SUM(RC[-4]:RC[-1]) -> 1143151.26 | CE64: 0 | CF64: 58772.94 | CG64: 249 | CH64: 0 | CI64: =SUM(RC[-4]:RC[-1]) -> 59021.94 | CJ64: 0 | CK64: 77617.517000000007 | CL64: 0 | CM64: 0 | CN64: =SUM(RC[-4]:RC[-1]) -> 77617.517000000007 | CO64: 0 | CP64: 62954.8 | CQ64: 0 | CR64: 0 | CS64: =SUM(RC[-4]:RC[-1]) -> 62954.8 | CT64: 0 | CU64: 92065.04 | CV64: 0 | CW64: 0 | CX64: =SUM(RC[-4]:RC[-1]) -> 92065.04 | CY64: 0 | CZ64: 68671.47 | DA64: 0 | DB64: 0 | DC64: =SUM(RC[-4]:RC[-1]) -> 68671.47 | DD64: 0 | DE64: 8091.02 | DF64: 0 | DG64: 0 | DH64: =SUM(RC[-4]:RC[-1]) -> 8091.02 | DI64: 0 | DJ64: 38116.07 | DK64: 0 | DL64: 0 | DM64: =SUM(RC[-4]:RC[-1]) -> 38116.07 | DN64: 0 | DO64: 170498.41 | DP64: 216.19 | DQ64: 0 | DR64: =SUM(RC[-4]:RC[-1]) -> 170714.6 | DS64: 0 | DT64: 3717737.5126999998 | DU64: 76950 | DV64: 0 | DW64: =SUM(RC[-4]:RC[-1]) -> 3794687.5126999998 | DX64: 0 | DY64: 40885.800000000003 | DZ64: 0 | EA64: 0 | EB64: =SUM(RC[-4]:RC[-1]) -> 40885.800000000003 | EC64: 0 | ED64: 97659.45 | EE64: 0 | EF64: 0 | EG64: =SUM(RC[-4]:RC[-1]) -> 97659.45 | EH64: 0 | EI64: 105656.83 | EJ64: 0 | EK64: 0 | EL64: =SUM(RC[-4]:RC[-1]) -> 105656.83 | EM64: 0 | EN64: 1057397 | EO64: 17874.2 | EP64: 0 | EQ64: =SUM(RC[-4]:RC[-1]) -> 1075271.2 | ER64: 0 | ES64: 59027.9 | ET64: 0 | EU64: 0 | EV64: =SUM(RC[-4]:RC[-1]) -> 59027.9 | EW64: 0 | EX64: 1976151.94 | EY64: 854 | EZ64: 0 | FA64: =SUM(RC[-4]:RC[-1]) -> 1977005.94 | FB64: 0 | FC64: 2337195 | FD64: 0 | FE64: 0 | FF64: =SUM(RC[-4]:RC[-1]) -> 2337195 | FG64: 0 | FH64: 42541.599999999999 | FI64: 167.31 | FJ64: 0 | FK64: =SUM(RC[-4]:RC[-1]) -> 42708.909999999996 | FL64: 0 | FM64: 185166.2 | FN64: 77277 | FO64: 0 | FP64: =SUM(RC[-4]:RC[-1]) -> 262443.2 | FQ64: 0 | FR64: 529719.80000000005 | FS64: 0 | FT64: 0 | FU64: =SUM(RC[-4]:RC[-1]) -> 529719.80000000005 | FV64: 0 | FW64: 151746.29999999999 | FX64: 40.49 | FY64: 0 | FZ64: =SUM(RC[-4]:RC[-1]) -> 151786.78999999998 | GA64: 0 | GB64: 353045.4 | GC64: 196.49 | GD64: 0 | GE64: =SUM(RC[-4]:RC[-1]) -> 353241.89 | GF64: 0 | GG64: 67153.8 | GH64: 0 | GI64: 0 | GJ64: =SUM(RC[-4]:RC[-1]) -> 67153.8 | GK64: 0 | GL64: 135432.6 | GM64: 1078.1199999999999 | GN64: 0 | GO64: =SUM(RC[-4]:RC[-1]) -> 136510.72 | GP64: 0 | GQ64: 93644.18 | GR64: 0 | GS64: 0 | GT64: =SUM(RC[-4]:RC[-1]) -> 93644.18 | GU64: 0 | GV64: 143741 | GW64: 0 | GX64: 0 | GY64: =SUM(RC[-4]:RC[-1]) -> 143741 | GZ64: 0 | HA64: 3329125.31 | HB64: 0 | HC64: 0 | HD64: =SUM(RC[-4]:RC[-1]) -> 3329125.31 | HE64: 0 | HF64: 230894.7 | HG64: 0 | HH64: 0 | HI64: =SUM(RC[-4]:RC[-1]) -> 230894.7 | HJ64: 0 | HK64: 666091.68000000005 | HL64: 512.49 | HM64: 0 | HN64: =SUM(RC[-4]:RC[-1]) -> 666604.17000000004 | HO64: 0 | HP64: 433749.9 | HQ64: 0 | HR64: 0 | HS64: =SUM(RC[-4]:RC[-1]) -> 433749.9 | HT64: 0 | HU64: 213821.54 | HV64: 527.25 | HW64: 0 | HX64: =SUM(RC[-4]:RC[-1]) -> 214348.79 | HY64: 0 | HZ64: 141163.98000000001 | IA64: 140.29 | IB64: 0 | IC64: =SUM(RC[-4]:RC[-1]) -> 141304.27000000002 | ID64: 0 | IE64: 47909.8 | IF64: 0 | IG64: 0 | IH64: =SUM(RC[-4]:RC[-1]) -> 47909.8 | II64: 0 | IJ64: 29039.96 | IK64: 0 | IL64: 0 | IM64: =SUM(RC[-4]:RC[-1]) -> 29039.96
A65: TRIFLURALIN | B65: =RC[8]+RC[13]+RC[18]+RC[23]+RC[28]+RC[33]+RC[38]+RC[43]+RC[48]+RC[53]+RC[58]+RC[63]+RC[68]+RC[73]+RC[78]+RC[83]+RC[88]+RC[93]+RC[98]+RC[103]+RC[108]+RC[113]+RC[118]+RC[123]+RC[128]+RC[133]+RC[138]+RC[143]+RC[148]+RC[153]+RC[158]+RC[163]+RC[168]+RC[173]+RC[178]+RC[183]+RC[188]+RC[193]+RC[198]+RC[203]+RC[208]+RC[213]+RC[218]+RC[223]+RC[228]+RC[233]+RC[238]+RC[243]+Sheet2!RC[2]+Sheet2!RC[7]+Sheet2!RC[12]+Sheet2!RC[17]+Sheet2!RC[22]+Sheet2!RC[27]+Sheet2!RC[32]+Sheet2!RC[37]+Sheet2!RC[42]+Sheet2!RC[47]+Sheet2!RC[57]+Sheet2!RC[52]+Sheet2!RC[62]+Sheet2!RC[67] -> 184.9 | C65: =RC[6]+RC[11]+RC[16]+RC[21]+RC[26]+RC[31]+RC[36]+RC[41]+RC[46]+RC[51]+RC[56]+RC[61]+RC[66]+RC[71]+RC[76]+RC[81]+RC[86]+RC[91]+RC[96]+RC[101]+RC[106]+RC[111]+RC[116]+RC[121]+RC[126]+RC[131]+RC[136]+RC[141]+RC[146]+RC[151]+RC[156]+RC[161]+RC[166]+RC[171]+RC[176]+RC[181]+RC[186]+RC[191]+RC[196]+RC[201]+RC[206]+RC[211]+RC[216]+RC[221]+RC[226]+RC[231]+RC[236]+RC[241]+Sheet2!RC+Sheet2!RC[5]+Sheet2!RC[10]+Sheet2!RC[15]+Sheet2!RC[20]+Sheet2!RC[25]+Sheet2!RC[30]+Sheet2!RC[35]+Sheet2!RC[40]+Sheet2!RC[45]+Sheet2!RC[50]+Sheet2!RC[55]+Sheet2!RC[60]+Sheet2!RC[65] -> 12756.328 | D65: =RC[4]+RC[9]+RC[14]+RC[19]+RC[24]+RC[29]+RC[34]+RC[39]+RC[44]+RC[49]+RC[54]+RC[59]+RC[64]+RC[69]+RC[74]+RC[79]+RC[84]+RC[89]+RC[94]+RC[99]+RC[104]+RC[109]+RC[114]+RC[119]+RC[124]+RC[129]+RC[134]+RC[139]+RC[144]+RC[149]+RC[154]+RC[159]+RC[164]+RC[169]+RC[174]+RC[179]+RC[184]+RC[189]+RC[194]+RC[199]+RC[204]+RC[209]+RC[214]+RC[219]+RC[224]+RC[229]+RC[234]+RC[239]+Sheet2!RC[3]+Sheet2!RC[-2]+Sheet2!RC[8]+Sheet2!RC[13]+Sheet2!RC[18]+Sheet2!RC[23]+Sheet2!RC[28]+Sheet2!RC[33]+Sheet2!RC[38]+Sheet2!RC[43]+Sheet2!RC[48]+Sheet2!RC[53]+Sheet2!RC[58]+Sheet2!RC[63] -> 0 | E65: =RC[6]+RC[11]+RC[16]+RC[21]+RC[26]+RC[31]+RC[36]+RC[41]+RC[46]+RC[51]+RC[56]+RC[61]+RC[66]+RC[71]+RC[76]+RC[81]+RC[86]+RC[91]+RC[96]+RC[101]+RC[106]+RC[111]+RC[116]+RC[121]+RC[126]+RC[131]+RC[136]+RC[141]+RC[146]+RC[151]+RC[156]+RC[161]+RC[166]+RC[171]+RC[176]+RC[181]+RC[186]+RC[191]+RC[196]+RC[201]+RC[206]+RC[211]+RC[216]+RC[221]+RC[226]+RC[231]+RC[236]+RC[241]+Sheet2!RC+Sheet2!RC[5]+Sheet2!RC[10]+Sheet2!RC[15]+Sheet2!RC[20]+Sheet2!RC[25]+Sheet2!RC[30]+Sheet2!RC[35]+Sheet2!RC[40]+Sheet2!RC[45]+Sheet2!RC[50]+Sheet2!RC[55]+Sheet2!RC[60]+Sheet2!RC[65] -> 0 | F65: =SUM(RC[-4]:RC[-1]) -> 12941.227999999999 | G65: =Sheet1!RC[5]+Sheet1!RC[10]+Sheet1!RC[15]+Sheet1!RC[20]+Sheet1!RC[25]+Sheet1!RC[30]+Sheet1!RC[35]+Sheet1!RC[40]+Sheet1!RC[45]+Sheet1!RC[50]+Sheet1!RC[55]+Sheet1!RC[60]+Sheet1!RC[65]+Sheet1!RC[70]+Sheet1!RC[75]+Sheet1!RC[80]+Sheet1!RC[85]+Sheet1!RC[90]+Sheet1!RC[95]+Sheet1!RC[100]+Sheet1!RC[105]+Sheet1!RC[110]+Sheet1!RC[115]+Sheet1!RC[120]+Sheet1!RC[125]+Sheet1!RC[130]+Sheet1!RC[135]+Sheet1!RC[140]+Sheet1!RC[145]+Sheet1!RC[150]+Sheet1!RC[155]+Sheet1!RC[160]+Sheet1!RC[165]+Sheet1!RC[170]+Sheet1!RC[175]+Sheet1!RC[180]+Sheet1!RC[185]+Sheet1!RC[190]+Sheet1!RC[195]+Sheet1!RC[200]+Sheet1!RC[205]+Sheet1!RC[210]+Sheet1!RC[215]+Sheet1!RC[220]+Sheet1!RC[225]+Sheet1!RC[230]+Sheet1!RC[235]+Sheet1!RC[240]+Sheet2!RC[-1]+Sheet2!RC[4]+Sheet2!RC[9]+Sheet2!RC[14]+Sheet2!RC[19]+Sheet2!RC[24]+Sheet2!RC[29]+Sheet2!RC[34]+Sheet2!RC[39]+Sheet2!RC[44]+Sheet2!RC[49]+Sheet2!RC[54]+Sheet2!RC[59]+Sheet2!RC[64] -> 12941.228000000001 | H65: 0 | I65: 0 | J65: 0 | K65: 0 | L65: =SUM(RC[-4]:RC[-1]) -> 0 | M65: 0 | N65: 0 | O65: 0 | P65: 0 | Q65: =SUM(RC[-4]:RC[-1]) -> 0 | R65: 0 | S65: 0 | T65: 0 | U65: 0 | V65: =SUM(RC[-4]:RC[-1]) -> 0 | W65: 0 | X65: 9.5 | Y65: 0 | Z65: 0 | AA65: =SUM(RC[-4]:RC[-1]) -> 9.5 | AB65: 0 | AC65: 0 | AD65: 0 | AE65: 0 | AF65: =SUM(RC[-4]:RC[-1]) -> 0 | AG65: 0 | AH65: 399.5 | AI65: 0 | AJ65: 0 | AK65: =SUM(RC[-4]:RC[-1]) -> 399.5 | AL65: 0 | AM65: 0.50900000000000001 | AN65: 0 | AO65: 0 | AP65: =SUM(RC[-4]:RC[-1]) -> 0.50900000000000001 | AQ65: 0 | AR65: 0 | AS65: 184.9 | AT65: 0 | AU65: =SUM(RC[-4]:RC[-1]) -> 184.9 | AV65: 0 | AW65: 0 | AX65: 0 | AY65: 0 | AZ65: =SUM(RC[-4]:RC[-1]) -> 0 | BA65: 0 | BB65: 0 | BC65: 0 | BD65: 0 | BE65: =SUM(RC[-4]:RC[-1]) -> 0 | BF65: 0 | BG65: 66.37 | BH65: 0 | BI65: 0 | BJ65: =SUM(RC[-4]:RC[-1]) -> 66.37 | BK65: 0 | BL65: 9.51 | BM65: 0 | BN65: 0 | BO65: =SUM(RC[-4]:RC[-1]) -> 9.51 | BP65: 0 | BQ65: 0 | BR65: 0 | BS65: 0 | BT65: =SUM(RC[-4]:RC[-1]) -> 0 | BU65: 0 | BV65: 0 | BW65: 0 | BX65: 0 | BY65: =SUM(RC[-4]:RC[-1]) -> 0 | BZ65: 0 | CA65: 475.64 | CB65: 0 | CC65: 0 | CD65: =SUM(RC[-4]:RC[-1]) -> 475.64 | CE65: 0 | CF65: 0 | CG65: 0 | CH65: 0 | CI65: =SUM(RC[-4]:RC[-1]) -> 0 | CJ65: 0 | CK65: 76.099000000000004 | CL65: 0 | CM65: 0 | CN65: =SUM(RC[-4]:RC[-1]) -> 76.099000000000004 | CO65: 0 | CP65: 0 | CQ65: 0 | CR65: 0 | CS65: =SUM(RC[-4]:RC[-1]) -> 0 | CT65: 0 | CU65: 1142.5 | CV65: 0 | CW65: 0 | CX65: =SUM(RC[-4]:RC[-1]) -> 1142.5 | CY65: 0 | CZ65: 20.84 | DA65: 0 | DB65: 0 | DC65: =SUM(RC[-4]:RC[-1]) -> 20.84 | DD65: 0 | DE65: 0 | DF65: 0 | DG65: 0 | DH65: =SUM(RC[-4]:RC[-1]) -> 0 | DI65: 0 | DJ65: 47.56 | DK65: 0 | DL65: 0 | DM65: =SUM(RC[-4]:RC[-1]) -> 47.56 | DN65: 0 | DO65: 0 | DP65: 0 | DQ65: 0 | DR65: =SUM(RC[-4]:RC[-1]) -> 0 | DS65: 0 | DT65: 0 | DU65: 0 | DV65: 0 | DW65: =SUM(RC[-4]:RC[-1]) -> 0 | DX65: 0 | DY65: 0 | DZ65: 0 | EA65: 0 | EB65: =SUM(RC[-4]:RC[-1]) -> 0 | EC65: 0 | ED65: 742.95 | EE65: 0 | EF65: 0 | EG65: =SUM(RC[-4]:RC[-1]) -> 742.95 | EH65: 0 | EI65: 9.51 | EJ65: 0 | EK65: 0 | EL65: =SUM(RC[-4]:RC[-1]) -> 9.51 | EM65: 0 | EN65: 522 | EO65: 0 | EP65: 0 | EQ65: =SUM(RC[-4]:RC[-1]) -> 522 | ER65: 0 | ES65: 0 | ET65: 0 | EU65: 0 | EV65: =SUM(RC[-4]:RC[-1]) -> 0 | EW65: 0 | EX65: 0 | EY65: 0 | EZ65: 0 | FA65: =SUM(RC[-4]:RC[-1]) -> 0 | FB65: 0 | FC65: 0 | FD65: 0 | FE65: 0 | FF65: =SUM(RC[-4]:RC[-1]) -> 0 | FG65: 0 | FH65: 485.5 | FI65: 0 | FJ65: 0 | FK65: =SUM(RC[-4]:RC[-1]) -> 485.5 | FL65: 0 | FM65: 903.7 | FN65: 0 | FO65: 0 | FP65: =SUM(RC[-4]:RC[-1]) -> 903.7 | FQ65: 0 | FR65: 55.08 | FS65: 0 | FT65: 0 | FU65: =SUM(RC[-4]:RC[-1]) -> 55.08 | FV65: 0 | FW65: 2326.9 | FX65: 0 | FY65: 0 | FZ65: =SUM(RC[-4]:RC[-1]) -> 2326.9 | GA65: 0 | GB65: 54.45 | GC65: 0 | GD65: 0 | GE65: =SUM(RC[-4]:RC[-1]) -> 54.45 | GF65: 0 | GG65: 1877.88 | GH65: 0 | GI65: 0 | GJ65: =SUM(RC[-4]:RC[-1]) -> 1877.88 | GK65: 0 | GL65: 132.30000000000001 | GM65: 0 | GN65: 0 | GO65: =SUM(RC[-4]:RC[-1]) -> 132.30000000000001 | GP65: 0 | GQ65: 9.51 | GR65: 0 | GS65: 0 | GT65: =SUM(RC[-4]:RC[-1]) -> 9.51 | GU65: 0 | GV65: 0 | GW65: 0 | GX65: 0 | GY65: =SUM(RC[-4]:RC[-1]) -> 0 | GZ65: 0 | HA65: 0 | HB65: 0 | HC65: 0 | HD65: =SUM(RC[-4]:RC[-1]) -> 0 | HE65: 0 | HF65: 25.9 | HG65: 0 | HH65: 0 | HI65: =SUM(RC[-4]:RC[-1]) -> 25.9 | HJ65: 0 | HK65: 0 | HL65: 0 | HM65: 0 | HN65: =SUM(RC[-4]:RC[-1]) -> 0 | HO65: 0 | HP65: 0 | HQ65: 0 | HR65: 0 | HS65: =SUM(RC[-4]:RC[-1]) -> 0 | HT65: 0 | HU65: 0 | HV65: 0 | HW65: 0 | HX65: =SUM(RC[-4]:RC[-1]) -> 0 | HY65: 0 | HZ65: 0 | IA65: 0 | IB65: 0 | IC65: =SUM(RC[-4]:RC[-1]) -> 0 | ID65: 0 | IE65: 0 | IF65: 0 | IG65: 0 | IH65: =SUM(RC[-4]:RC[-1]) -> 0 | II65: 0 | IJ65: 0 | IK65: 0 | IL65: 0 | IM65: =SUM(RC[-4]:RC[-1]) -> 0
A66: VINYL CHLOR | B66: =RC[8]+RC[13]+RC[18]+RC[23]+RC[28]+RC[33]+RC[38]+RC[43]+RC[48]+RC[53]+RC[58]+RC[63]+RC[68]+RC[73]+RC[78]+RC[83]+RC[88]+RC[93]+RC[98]+RC[103]+RC[108]+RC[113]+RC[118]+RC[123]+RC[128]+RC[133]+RC[138]+RC[143]+RC[148]+RC[153]+RC[158]+RC[163]+RC[168]+RC[173]+RC[178]+RC[183]+RC[188]+RC[193]+RC[198]+RC[203]+RC[208]+RC[213]+RC[218]+RC[223]+RC[228]+RC[233]+RC[238]+RC[243]+Sheet2!RC[2]+Sheet2!RC[7]+Sheet2!RC[12]+Sheet2!RC[17]+Sheet2!RC[22]+Sheet2!RC[27]+Sheet2!RC[32]+Sheet2!RC[37]+Sheet2!RC[42]+Sheet2!RC[47]+Sheet2!RC[57]+Sheet2!RC[52]+Sheet2!RC[62]+Sheet2!RC[67] -> 16945.355 | C66: =RC[6]+RC[11]+RC[16]+RC[21]+RC[26]+RC[31]+RC[36]+RC[41]+RC[46]+RC[51]+RC[56]+RC[61]+RC[66]+RC[71]+RC[76]+RC[81]+RC[86]+RC[91]+RC[96]+RC[101]+RC[106]+RC[111]+RC[116]+RC[121]+RC[126]+RC[131]+RC[136]+RC[141]+RC[146]+RC[151]+RC[156]+RC[161]+RC[166]+RC[171]+RC[176]+RC[181]+RC[186]+RC[191]+RC[196]+RC[201]+RC[206]+RC[211]+RC[216]+RC[221]+RC[226]+RC[231]+RC[236]+RC[241]+Sheet2!RC+Sheet2!RC[5]+Sheet2!RC[10]+Sheet2!RC[15]+Sheet2!RC[20]+Sheet2!RC[25]+Sheet2!RC[30]+Sheet2!RC[35]+Sheet2!RC[40]+Sheet2!RC[45]+Sheet2!RC[50]+Sheet2!RC[55]+Sheet2!RC[60]+Sheet2!RC[65] -> 250342.08799999999 | D66: =RC[4]+RC[9]+RC[14]+RC[19]+RC[24]+RC[29]+RC[34]+RC[39]+RC[44]+RC[49]+RC[54]+RC[59]+RC[64]+RC[69]+RC[74]+RC[79]+RC[84]+RC[89]+RC[94]+RC[99]+RC[104]+RC[109]+RC[114]+RC[119]+RC[124]+RC[129]+RC[134]+RC[139]+RC[144]+RC[149]+RC[154]+RC[159]+RC[164]+RC[169]+RC[174]+RC[179]+RC[184]+RC[189]+RC[194]+RC[199]+RC[204]+RC[209]+RC[214]+RC[219]+RC[224]+RC[229]+RC[234]+RC[239]+Sheet2!RC[3]+Sheet2!RC[-2]+Sheet2!RC[8]+Sheet2!RC[13]+Sheet2!RC[18]+Sheet2!RC[23]+Sheet2!RC[28]+Sheet2!RC[33]+Sheet2!RC[38]+Sheet2!RC[43]+Sheet2!RC[48]+Sheet2!RC[53]+Sheet2!RC[58]+Sheet2!RC[63] -> 0 | E66: =RC[6]+RC[11]+RC[16]+RC[21]+RC[26]+RC[31]+RC[36]+RC[41]+RC[46]+RC[51]+RC[56]+RC[61]+RC[66]+RC[71]+RC[76]+RC[81]+RC[86]+RC[91]+RC[96]+RC[101]+RC[106]+RC[111]+RC[116]+RC[121]+RC[126]+RC[131]+RC[136]+RC[141]+RC[146]+RC[151]+RC[156]+RC[161]+RC[166]+RC[171]+RC[176]+RC[181]+RC[186]+RC[191]+RC[196]+RC[201]+RC[206]+RC[211]+RC[216]+RC[221]+RC[226]+RC[231]+RC[236]+RC[241]+Sheet2!RC+Sheet2!RC[5]+Sheet2!RC[10]+Sheet2!RC[15]+Sheet2!RC[20]+Sheet2!RC[25]+Sheet2!RC[30]+Sheet2!RC[35]+Sheet2!RC[40]+Sheet2!RC[45]+Sheet2!RC[50]+Sheet2!RC[55]+Sheet2!RC[60]+Sheet2!RC[65] -> 0 | F66: =SUM(RC[-4]:RC[-1]) -> 267287.44299999997 | G66: =Sheet1!RC[5]+Sheet1!RC[10]+Sheet1!RC[15]+Sheet1!RC[20]+Sheet1!RC[25]+Sheet1!RC[30]+Sheet1!RC[35]+Sheet1!RC[40]+Sheet1!RC[45]+Sheet1!RC[50]+Sheet1!RC[55]+Sheet1!RC[60]+Sheet1!RC[65]+Sheet1!RC[70]+Sheet1!RC[75]+Sheet1!RC[80]+Sheet1!RC[85]+Sheet1!RC[90]+Sheet1!RC[95]+Sheet1!RC[100]+Sheet1!RC[105]+Sheet1!RC[110]+Sheet1!RC[115]+Sheet1!RC[120]+Sheet1!RC[125]+Sheet1!RC[130]+Sheet1!RC[135]+Sheet1!RC[140]+Sheet1!RC[145]+Sheet1!RC[150]+Sheet1!RC[155]+Sheet1!RC[160]+Sheet1!RC[165]+Sheet1!RC[170]+Sheet1!RC[175]+Sheet1!RC[180]+Sheet1!RC[185]+Sheet1!RC[190]+Sheet1!RC[195]+Sheet1!RC[200]+Sheet1!RC[205]+Sheet1!RC[210]+Sheet1!RC[215]+Sheet1!RC[220]+Sheet1!RC[225]+Sheet1!RC[230]+Sheet1!RC[235]+Sheet1!RC[240]+Sheet2!RC[-1]+Sheet2!RC[4]+Sheet2!RC[9]+Sheet2!RC[14]+Sheet2!RC[19]+Sheet2!RC[24]+Sheet2!RC[29]+Sheet2!RC[34]+Sheet2!RC[39]+Sheet2!RC[44]+Sheet2!RC[49]+Sheet2!RC[54]+Sheet2!RC[59]+Sheet2!RC[64] -> 267287.44300000009 | H66: 0 | I66: 5103 | J66: 58.552999999999997 | K66: 0 | L66: =SUM(RC[-4]:RC[-1]) -> 5161.5529999999999 | M66: 0 | N66: 368.81 | O66: 0 | P66: 0 | Q66: =SUM(RC[-4]:RC[-1]) -> 368.81 | R66: 0 | S66: 12410 | T66: 0 | U66: 0 | V66: =SUM(RC[-4]:RC[-1]) -> 12410 | W66: 0 | X66: 2234.3000000000002 | Y66: 211.59 | Z66: 0 | AA66: =SUM(RC[-4]:RC[-1]) -> 2445.8900000000003 | AB66: 0 | AC66: 878.79 | AD66: 0 | AE66: 0 | AF66: =SUM(RC[-4]:RC[-1]) -> 878.79 | AG66: 0 | AH66: 828.66499999999996 | AI66: 0 | AJ66: 0 | AK66: =SUM(RC[-4]:RC[-1]) -> 828.66499999999996 | AL66: 0 | AM66: 1944.36 | AN66: 25.94 | AO66: 0 | AP66: =SUM(RC[-4]:RC[-1]) -> 1970.3 | AQ66: 0 | AR66: 1489.78 | AS66: 0 | AT66: 0 | AU66: =SUM(RC[-4]:RC[-1]) -> 1489.78 | AV66: 0 | AW66: 304.10000000000002 | AX66: 160.77000000000001 | AY66: 0 | AZ66: =SUM(RC[-4]:RC[-1]) -> 464.87 | BA66: 0 | BB66: 1459.95 | BC66: 104.26 | BD66: 0 | BE66: =SUM(RC[-4]:RC[-1]) -> 1564.21 | BF66: 0 | BG66: 382.12 | BH66: 0.8 | BI66: 0 | BJ66: =SUM(RC[-4]:RC[-1]) -> 382.92 | BK66: 0 | BL66: 715 | BM66: 55.02 | BN66: 0 | BO66: =SUM(RC[-4]:RC[-1]) -> 770.02 | BP66: 0 | BQ66: 408.17 | BR66: 0 | BS66: 0 | BT66: =SUM(RC[-4]:RC[-1]) -> 408.17 | BU66: 0 | BV66: 1769.5 | BW66: 0.64200000000000002 | BX66: 0 | BY66: =SUM(RC[-4]:RC[-1]) -> 1770.1420000000001 | BZ66: 0 | CA66: 19228.900000000001 | CB66: 3313.43 | CC66: 0 | CD66: =SUM(RC[-4]:RC[-1]) -> 22542.33 | CE66: 0 | CF66: 365.84 | CG66: 0 | CH66: 0 | CI66: =SUM(RC[-4]:RC[-1]) -> 365.84 | CJ66: 0 | CK66: 481.69 | CL66: 0 | CM66: 0 | CN66: =SUM(RC[-4]:RC[-1]) -> 481.69 | CO66: 0 | CP66: 744.32 | CQ66: 0 | CR66: 0 | CS66: =SUM(RC[-4]:RC[-1]) -> 744.32 | CT66: 0 | CU66: 659.46600000000001 | CV66: 0 | CW66: 0 | CX66: =SUM(RC[-4]:RC[-1]) -> 659.46600000000001 | CY66: 0 | CZ66: 303.2 | DA66: 0 | DB66: 0 | DC66: =SUM(RC[-4]:RC[-1]) -> 303.2 | DD66: 0 | DE66: 33.61 | DF66: 0 | DG66: 0 | DH66: =SUM(RC[-4]:RC[-1]) -> 33.61 | DI66: 0 | DJ66: 1028.97 | DK66: 0 | DL66: 0 | DM66: =SUM(RC[-4]:RC[-1]) -> 1028.97 | DN66: 0 | DO66: 1667.2 | DP66: 267.79000000000002 | DQ66: 0 | DR66: =SUM(RC[-4]:RC[-1]) -> 1934.99 | DS66: 0 | DT66: 41883.75 | DU66: 11.85 | DV66: 0 | DW66: =SUM(RC[-4]:RC[-1]) -> 41895.599999999999 | DX66: 0 | DY66: 130.6 | DZ66: 0 | EA66: 0 | EB66: =SUM(RC[-4]:RC[-1]) -> 130.6 | EC66: 0 | ED66: 633.23800000000006 | EE66: 134.97999999999999 | EF66: 0 | EG66: =SUM(RC[-4]:RC[-1]) -> 768.21800000000007 | EH66: 0 | EI66: 544.52 | EJ66: 0 | EK66: 0 | EL66: =SUM(RC[-4]:RC[-1]) -> 544.52 | EM66: 0 | EN66: 11574.682000000001 | EO66: 1410.92 | EP66: 0 | EQ66: =SUM(RC[-4]:RC[-1]) -> 12985.602000000001 | ER66: 0 | ES66: 1081.33 | ET66: 137.61000000000001 | EU66: 0 | EV66: =SUM(RC[-4]:RC[-1]) -> 1218.94 | EW66: 0 | EX66: 12557.147000000001 | EY66: 843.52 | EZ66: 0 | FA66: =SUM(RC[-4]:RC[-1]) -> 13400.667000000001 | FB66: 0 | FC66: 26061 | FD66: 0 | FE66: 0 | FF66: =SUM(RC[-4]:RC[-1]) -> 26061 | FG66: 0 | FH66: 6798.3 | FI66: 1554.42 | FJ66: 0 | FK66: =SUM(RC[-4]:RC[-1]) -> 8352.7200000000012 | FL66: 0 | FM66: 4716.95 | FN66: 42.06 | FO66: 0 | FP66: =SUM(RC[-4]:RC[-1]) -> 4759.01 | FQ66: 0 | FR66: 7842.9 | FS66: 81.290000000000006 | FT66: 0 | FU66: =SUM(RC[-4]:RC[-1]) -> 7924.19 | FV66: 0 | FW66: 1133.5 | FX66: 0.04 | FY66: 0 | FZ66: =SUM(RC[-4]:RC[-1]) -> 1133.54 | GA66: 0 | GB66: 3011.83 | GC66: 425 | GD66: 0 | GE66: =SUM(RC[-4]:RC[-1]) -> 3436.83 | GF66: 0 | GG66: 380.45 | GH66: 2 | GI66: 0 | GJ66: =SUM(RC[-4]:RC[-1]) -> 382.45 | GK66: 0 | GL66: 978.12 | GM66: 203.35 | GN66: 0 | GO66: =SUM(RC[-4]:RC[-1]) -> 1181.47 | GP66: 0 | GQ66: 401.9 | GR66: 0 | GS66: 0 | GT66: =SUM(RC[-4]:RC[-1]) -> 401.9 | GU66: 0 | GV66: 265.47000000000003 | GW66: 0 | GX66: 0 | GY66: =SUM(RC[-4]:RC[-1]) -> 265.47000000000003 | GZ66: 0 | HA66: 23268.75 | HB66: 0 | HC66: 0 | HD66: =SUM(RC[-4]:RC[-1]) -> 23268.75 | HE66: 0 | HF66: 1981.4 | HG66: 107.85 | HH66: 0 | HI66: =SUM(RC[-4]:RC[-1]) -> 2089.25 | HJ66: 0 | HK66: 18807.07 | HL66: 627.73 | HM66: 0 | HN66: =SUM(RC[-4]:RC[-1]) -> 19434.8 | HO66: 0 | HP66: 3294.8 | HQ66: 0.48 | HR66: 0 | HS66: =SUM(RC[-4]:RC[-1]) -> 3295.28 | HT66: 0 | HU66: 1304.81 | HV66: 473.69 | HW66: 0 | HX66: =SUM(RC[-4]:RC[-1]) -> 1778.5 | HY66: 0 | HZ66: 1646.77 | IA66: 2135.1999999999998 | IB66: 0 | IC66: =SUM(RC[-4]:RC[-1]) -> 3781.97 | ID66: 0 | IE66: 159.13999999999999 | IF66: 0 | IG66: 0 | IH66: =SUM(RC[-4]:RC[-1]) -> 159.13999999999999 | II66: 0 | IJ66: 87.23 | IK66: 0 | IL66: 0 | IM66: =SUM(RC[-4]:RC[-1]) -> 87.23
A67: XYLENES ISO | B67: =RC[8]+RC[13]+RC[18]+RC[23]+RC[28]+RC[33]+RC[38]+RC[43]+RC[48]+RC[53]+RC[58]+RC[63]+RC[68]+RC[73]+RC[78]+RC[83]+RC[88]+RC[93]+RC[98]+RC[103]+RC[108]+RC[113]+RC[118]+RC[123]+RC[128]+RC[133]+RC[138]+RC[143]+RC[148]+RC[153]+RC[158]+RC[163]+RC[168]+RC[173]+RC[178]+RC[183]+RC[188]+RC[193]+RC[198]+RC[203]+RC[208]+RC[213]+RC[218]+RC[223]+RC[228]+RC[233]+RC[238]+RC[243]+Sheet2!RC[2]+Sheet2!RC[7]+Sheet2!RC[12]+Sheet2!RC[17]+Sheet2!RC[22]+Sheet2!RC[27]+Sheet2!RC[32]+Sheet2!RC[37]+Sheet2!RC[42]+Sheet2!RC[47]+Sheet2!RC[57]+Sheet2!RC[52]+Sheet2!RC[62]+Sheet2!RC[67] -> 794149.40399999986 | C67: =RC[6]+RC[11]+RC[16]+RC[21]+RC[26]+RC[31]+RC[36]+RC[41]+RC[46]+RC[51]+RC[56]+RC[61]+RC[66]+RC[71]+RC[76]+RC[81]+RC[86]+RC[91]+RC[96]+RC[101]+RC[106]+RC[111]+RC[116]+RC[121]+RC[126]+RC[131]+RC[136]+RC[141]+RC[146]+RC[151]+RC[156]+RC[161]+RC[166]+RC[171]+RC[176]+RC[181]+RC[186]+RC[191]+RC[196]+RC[201]+RC[206]+RC[211]+RC[216]+RC[221]+RC[226]+RC[231]+RC[236]+RC[241]+Sheet2!RC+Sheet2!RC[5]+Sheet2!RC[10]+Sheet2!RC[15]+Sheet2!RC[20]+Sheet2!RC[25]+Sheet2!RC[30]+Sheet2!RC[35]+Sheet2!RC[40]+Sheet2!RC[45]+Sheet2!RC[50]+Sheet2!RC[55]+Sheet2!RC[60]+Sheet2!RC[65] -> 23504702.391030002 | D67: =RC[4]+RC[9]+RC[14]+RC[19]+RC[24]+RC[29]+RC[34]+RC[39]+RC[44]+RC[49]+RC[54]+RC[59]+RC[64]+RC[69]+RC[74]+RC[79]+RC[84]+RC[89]+RC[94]+RC[99]+RC[104]+RC[109]+RC[114]+RC[119]+RC[124]+RC[129]+RC[134]+RC[139]+RC[144]+RC[149]+RC[154]+RC[159]+RC[164]+RC[169]+RC[174]+RC[179]+RC[184]+RC[189]+RC[194]+RC[199]+RC[204]+RC[209]+RC[214]+RC[219]+RC[224]+RC[229]+RC[234]+RC[239]+Sheet2!RC[3]+Sheet2!RC[-2]+Sheet2!RC[8]+Sheet2!RC[13]+Sheet2!RC[18]+Sheet2!RC[23]+Sheet2!RC[28]+Sheet2!RC[33]+Sheet2!RC[38]+Sheet2!RC[43]+Sheet2!RC[48]+Sheet2!RC[53]+Sheet2!RC[58]+Sheet2!RC[63] -> 35496981 | E67: =RC[6]+RC[11]+RC[16]+RC[21]+RC[26]+RC[31]+RC[36]+RC[41]+RC[46]+RC[51]+RC[56]+RC[61]+RC[66]+RC[71]+RC[76]+RC[81]+RC[86]+RC[91]+RC[96]+RC[101]+RC[106]+RC[111]+RC[116]+RC[121]+RC[126]+RC[131]+RC[136]+RC[141]+RC[146]+RC[151]+RC[156]+RC[161]+RC[166]+RC[171]+RC[176]+RC[181]+RC[186]+RC[191]+RC[196]+RC[201]+RC[206]+RC[211]+RC[216]+RC[221]+RC[226]+RC[231]+RC[236]+RC[241]+Sheet2!RC+Sheet2!RC[5]+Sheet2!RC[10]+Sheet2!RC[15]+Sheet2!RC[20]+Sheet2!RC[25]+Sheet2!RC[30]+Sheet2!RC[35]+Sheet2!RC[40]+Sheet2!RC[45]+Sheet2!RC[50]+Sheet2!RC[55]+Sheet2!RC[60]+Sheet2!RC[65] -> 9967785.25268865 | F67: =SUM(RC[-4]:RC[-1]) -> 69763618.047718644 | G67: =Sheet1!RC[5]+Sheet1!RC[10]+Sheet1!RC[15]+Sheet1!RC[20]+Sheet1!RC[25]+Sheet1!RC[30]+Sheet1!RC[35]+Sheet1!RC[40]+Sheet1!RC[45]+Sheet1!RC[50]+Sheet1!RC[55]+Sheet1!RC[60]+Sheet1!RC[65]+Sheet1!RC[70]+Sheet1!RC[75]+Sheet1!RC[80]+Sheet1!RC[85]+Sheet1!RC[90]+Sheet1!RC[95]+Sheet1!RC[100]+Sheet1!RC[105]+Sheet1!RC[110]+Sheet1!RC[115]+Sheet1!RC[120]+Sheet1!RC[125]+Sheet1!RC[130]+Sheet1!RC[135]+Sheet1!RC[140]+Sheet1!RC[145]+Sheet1!RC[150]+Sheet1!RC[155]+Sheet1!RC[160]+Sheet1!RC[165]+Sheet1!RC[170]+Sheet1!RC[175]+Sheet1!RC[180]+Sheet1!RC[185]+Sheet1!RC[190]+Sheet1!RC[195]+Sheet1!RC[200]+Sheet1!RC[205]+Sheet1!RC[210]+Sheet1!RC[215]+Sheet1!RC[220]+Sheet1!RC[225]+Sheet1!RC[230]+Sheet1!RC[235]+Sheet1!RC[240]+Sheet2!RC[-1]+Sheet2!RC[4]+Sheet2!RC[9]+Sheet2!RC[14]+Sheet2!RC[19]+Sheet2!RC[24]+Sheet2!RC[29]+Sheet2!RC[34]+Sheet2!RC[39]+Sheet2!RC[44]+Sheet2!RC[49]+Sheet2!RC[54]+Sheet2!RC[59]+Sheet2!RC[64] -> 69763618.047718659 | H67: 1008801 | I67: 542880.37919000001 | J67: 6295.4 | K67: 192349.62085614007 | L67: =SUM(RC[-4]:RC[-1]) -> 1750326.40004614 | M67: 128809 | N67: 50896.21 | O67: 2886.02 | P67: 57779.060220699983 | Q67: =SUM(RC[-4]:RC[-1]) -> 240370.29022069997 | R67: 1024966 | S67: 1208024.6399999999 | T67: 8.07 | U67: 144628.42860506001 | V67: =SUM(RC[-4]:RC[-1]) -> 2377627.1386050596 | W67: 623796 | X67: 195410.1 | Y67: 13278.18 | Z67: 107464.0256348 | AA67: =SUM(RC[-4]:RC[-1]) -> 939948.3056348 | AB67: 226584 | AC67: 86071.76 | AD67: 0.11899999999999999 | AE67: 288437.18309665 | AF67: =SUM(RC[-4]:RC[-1]) -> 601093.06209665001 | AG67: 206329 | AH67: 82017.87 | AI67: 816.65 | AJ67: 56647.321488829984 | AK67: =SUM(RC[-4]:RC[-1]) -> 345810.84148882999 | AL67: 363785 | AM67: 110946.5 | AN67: 17696.330000000002 | AO67: 0 | AP67: =SUM(RC[-4]:RC[-1]) -> 492427.83 | AQ67: 242473 | AR67: 96071.79 | AS67: 561.5 | AT67: 988.33473668000011 | AU67: =SUM(RC[-4]:RC[-1]) -> 340094.62473667995 | AV67: 130396 | AW67: 46391.421999999999 | AX67: 3566.04 | AY67: 76569.399760989923 | AZ67: =SUM(RC[-4]:RC[-1]) -> 256922.86176098994 | BA67: 216253 | BB67: 85405.93 | BC67: 19.489999999999998 | BD67: 92170.844587719999 | BE67: =SUM(RC[-4]:RC[-1]) -> 393849.26458771998 | BF67: 185944 | BG67: 67304 | BH67: 6009.28 | BI67: 67772.892859469997 | BJ67: =SUM(RC[-4]:RC[-1]) -> 327030.17285947001 | BK67: 161706 | BL67: 42171.14 | BM67: 1245.22 | BN67: 73780.23365448002 | BO67: =SUM(RC[-4]:RC[-1]) -> 278902.59365448006 | BP67: 146133 | BQ67: 46595.597840000002 | BR67: 1014.21 | BS67: 110562.99503018003 | BT67: =SUM(RC[-4]:RC[-1]) -> 304305.80287017999 | BU67: 677576 | BV67: 285174.84999999998 | BW67: 33.32 | BX67: 0 | BY67: =SUM(RC[-4]:RC[-1]) -> 962784.16999999993 | BZ67: 2053569 | CA67: 963916.76 | CB67: 26555.749 | CC67: 538262.11742286012 | CD67: =SUM(RC[-4]:RC[-1]) -> 3582303.6264228597 | CE67: 125176 | CF67: 39268.17 | CG67: 1470 | CH67: 183897.22931886997 | CI67: =SUM(RC[-4]:RC[-1]) -> 349811.39931886992 | CJ67: 131720 | CK67: 49482.73 | CL67: 0 | CM67: 63669.458569129965 | CN67: =SUM(RC[-4]:RC[-1]) -> 244872.18856912997 | CO67: 119482 | CP67: 51989.72 | CQ67: 881 | CR67: 47939.283990009964 | CS67: =SUM(RC[-4]:RC[-1]) -> 220292.00399000995 | CT67: 264174 | CU67: 64363.47 | CV67: 0 | CW67: 40735.303428040017 | CX67: =SUM(RC[-4]:RC[-1]) -> 369272.77342803997 | CY67: 177245 | CZ67: 74818.25 | DA67: 0 | DB67: 46837.634565389977 | DC67: =SUM(RC[-4]:RC[-1]) -> 298900.88456538995 | DD67: 35419 | DE67: 5347.52 | DF67: 0 | DG67: 21180.744446490007 | DH67: =SUM(RC[-4]:RC[-1]) -> 61947.264446490008 | DI67: 211161 | DJ67: 57696.09 | DK67: 11785.19 | DL67: 91772.845238449969 | DM67: =SUM(RC[-4]:RC[-1]) -> 372415.12523844995 | DN67: 322486 | DO67: 115796.76 | DP67: 749.59 | DQ67: 55027.58871369002 | DR67: =SUM(RC[-4]:RC[-1]) -> 494059.93871369003 | DS67: 1597684 | DT67: 2537529.14 | DU67: 13144.26 | DV67: 384572.87055137975 | DW67: =SUM(RC[-4]:RC[-1]) -> 4532930.2705513798 | DX67: 73035 | DY67: 27122.99 | DZ67: 34139 | EA67: 55311.260219470008 | EB67: =SUM(RC[-4]:RC[-1]) -> 189608.25021947001 | EC67: 186622 | ED67: 67432.31 | EE67: 3.53 | EF67: 46336.02620919999 | EG67: =SUM(RC[-4]:RC[-1]) -> 300393.8662092 | EH67: 193907 | EI67: 70719 | EJ67: 0 | EK67: 28620.793036300009 | EL67: =SUM(RC[-4]:RC[-1]) -> 293246.79303629999 | EM67: 2014332 | EN67: 744212.05 | EO67: 19615 | EP67: 468605.31160881999 | EQ67: =SUM(RC[-4]:RC[-1]) -> 3246764.36160882 | ER67: 187389 | ES67: 52667.75 | ET67: 3022.51 | EU67: 27648.650053319998 | EV67: =SUM(RC[-4]:RC[-1]) -> 270727.91005332 | EW67: 4004512 | EX67: 1338580.81 | EY67: 17176.990000000002 | EZ67: 860907.82378698979 | FA67: =SUM(RC[-4]:RC[-1]) -> 6221177.6237869905 | FB67: 1272529 | FC67: 3854577.0189999999 | FD67: 421.19 | FE67: 754360.83826096973 | FF67: =SUM(RC[-4]:RC[-1]) -> 5881888.0472609699 | FG67: 409344 | FH67: 196389.3 | FI67: 1457.38 | FJ67: 129640.01052403988 | FK67: =SUM(RC[-4]:RC[-1]) -> 736830.69052403991 | FL67: 630948 | FM67: 220727.01 | FN67: 60505.08 | FO67: 148860.20091762001 | FP67: =SUM(RC[-4]:RC[-1]) -> 1061040.2909176201 | FQ67: 1224808 | FR67: 455697.4 | FS67: 21965.119999999999 | FT67: 278464.65305075009 | FU67: =SUM(RC[-4]:RC[-1]) -> 1980935.17305075 | FV67: 318863 | FW67: 103807.4 | FX67: 537.34 | FY67: 72796.143002830009 | FZ67: =SUM(RC[-4]:RC[-1]) -> 496003.88300283009 | GA67: 851364 | GB67: 349955.27 | GC67: 25544.639999999999 | GD67: 0 | GE67: =SUM(RC[-4]:RC[-1]) -> 1226863.9099999999 | GF67: 92967 | GG67: 44869.48 | GH67: 12 | GI67: 23466.50035219999 | GJ67: =SUM(RC[-4]:RC[-1]) -> 161314.98035219999 | GK67: 290036 | GL67: 116803.2 | GM67: 547.35 | GN67: 97587.874874729925 | GO67: =SUM(RC[-4]:RC[-1]) -> 504974.42487472994 | GP67: 163011 | GQ67: 60965.2 | GR67: 0 | GS67: 77355.601879520022 | GT67: =SUM(RC[-4]:RC[-1]) -> 301331.80187952006 | GU67: 314152 | GV67: 92878.94 | GW67: 0 | GX67: 69987.326492790031 | GY67: =SUM(RC[-4]:RC[-1]) -> 477018.26649279002 | GZ67: 2046279 | HA67: 2027130.8 | HB67: 7156.98 | HC67: 442030.10942683992 | HD67: =SUM(RC[-4]:RC[-1]) -> 4522596.8894268395 | HE67: 418006 | HF67: 262497.2 | HG67: 32345.99 | HH67: 96763.336517199961 | HI67: =SUM(RC[-4]:RC[-1]) -> 809612.52651719993 | HJ67: 631737 | HK67: 2556076.2999999998 | HL67: 14771.1 | HM67: 150564.85367734992 | HN67: =SUM(RC[-4]:RC[-1]) -> 3353149.25367735 | HO67: 602387 | HP67: 318942.34399999998 | HQ67: 2384.2800000000002 | HR67: 198789.83863598001 | HS67: =SUM(RC[-4]:RC[-1]) -> 1122503.46263598 | HT67: 632913 | HU67: 184685.99 | HV67: 20476.86 | HW67: 86284.26356508999 | HX67: =SUM(RC[-4]:RC[-1]) -> 924360.11356509 | HY67: 340426 | HZ67: 135323.63 | IA67: 338249.8 | IB67: 130534.53579458001 | IC67: =SUM(RC[-4]:RC[-1]) -> 944533.96579457994 | ID67: 94882 | IE67: 31867.7 | IF67: 3.38 | IG67: 61863.850783440015 | IH67: =SUM(RC[-4]:RC[-1]) -> 188616.93078344001 | II67: 44157 | IJ67: 19142.18 | IK67: 0 | IL67: 12607.78838586 | IM67: =SUM(RC[-4]:RC[-1]) -> 75906.968385860004

Sheet: Sheet2
A2: Pollutant | B2: SENECA | F2: SENECA | G2: ST LAWRENCE | K2: ST LAWRENCE | L2: STEUBEN | P2: STEUBEN | Q2: SUFFOLK | U2: SUFFOLK | V2: SULLIVAN | Z2: SULLIVAN | AA2: TIOGA | AE2: TIOGA | AF2: TOMPKINS | AJ2: TOMPKINS | AK2: ULSTER | AO2: ULSTER | AP2: WARREN | AT2: WARREN | AU2: WASHINGTON | AY2: WASHINGTON | AZ2: WAYNE | BD2: WAYNE | BE2: WESTCHESTER | BI2: WESTCHESTER | BJ2: WYOMING | BN2: WYOMING | BO2: YATES | BS2: YATES
B3: ONROAD | C3: AREA | D3: POINT | E3: NONROAD | F3: TOTAL LBS | G3: ONROAD | H3: AREA | I3: POINT | J3: NONROAD | K3: TOTAL LBS | L3: ONROAD | M3: AREA | N3: POINT | O3: NONROAD | P3: TOTAL LBS | Q3: ONROAD | R3: AREA | S3: POINT | T3: NONROAD | U3: TOTAL LBS | V3: ONROAD | W3: AREA | X3: POINT | Y3: NONROAD | Z3: TOTAL LBS | AA3: ONROAD | AB3: AREA | AC3: POINT | AD3: NONROAD | AE3: TOTAL LBS | AF3: ONROAD | AG3: AREA | AH3: POINT | AI3: NONROAD | AJ3: TOTAL LBS | AK3: ONROAD | AL3: AREA | AM3: POINT | AN3: NONROAD | AO3: TOTAL LBS | AP3: ONROAD | AQ3: AREA | AR3: POINT | AS3: NONROAD | AT3: TOTAL LBS | AU3: ONROAD | AV3: AREA | AW3: POINT | AX3: NONROAD | AY3: TOTAL LBS | AZ3: ONROAD | BA3: AREA | BB3: POINT | BC3: NONROAD | BD3: TOTAL LBS | BE3: ONROAD | BF3: AREA | BG3: POINT | BH3: NONROAD | BI3: TOTAL LBS | BJ3: ONROAD | BK3: AREA | BL3: POINT | BM3: NONROAD | BN3: TOTAL LBS | BO3: ONROAD | BP3: AREA | BQ3: POINT | BR3: NONROAD | BS3: TOTAL LBS
A4: ACENAPTHENE | B4: 0 | C4: 0 | D4: 0 | E4: 0 | F4: =SUM(RC[-4]:RC[-1]) -> 0 | G4: 0 | H4: 0 | I4: 0 | J4: 0 | K4: =SUM(RC[-4]:RC[-1]) -> 0 | L4: 0 | M4: 0 | N4: 0 | O4: 0 | P4: =SUM(RC[-4]:RC[-1]) -> 0 | Q4: 0 | R4: 0 | S4: 0 | T4: 0 | U4: =SUM(RC[-4]:RC[-1]) -> 0 | V4: 0 | W4: 0 | X4: 0 | Y4: 0 | Z4: =SUM(RC[-4]:RC[-1]) -> 0 | AA4: 0 | AB4: 0 | AC4: 0 | AD4: 0 | AE4: =SUM(RC[-4]:RC[-1]) -> 0 | AF4: 0 | AG4: 0 | AH4: 0 | AI4: 0 | AJ4: =SUM(RC[-4]:RC[-1]) -> 0 | AK4: 0 | AL4: 0 | AM4: 0 | AN4: 0 | AO4: =SUM(RC[-4]:RC[-1]) -> 0 | AP4: 0 | AQ4: 0 | AR4: 0 | AS4: 0 | AT4: =SUM(RC[-4]:RC[-1]) -> 0 | AU4: 0 | AV4: 0 | AW4: 0 | AX4: 0 | AY4: =SUM(RC[-4]:RC[-1]) -> 0 | AZ4: 0 | BA4: 0 | BB4: 0 | BC4: 0 | BD4: =SUM(RC[-4]:RC[-1]) -> 0 | BE4: 0 | BF4: 0 | BG4: 0 | BH4: 0 | BI4: =SUM(RC[-4]:RC[-1]) -> 0 | BJ4: 0 | BK4: 0 | BL4: 0 | BM4: 0 | BN4: =SUM(RC[-4]:RC[-1]) -> 0 | BO4: 0 | BP4: 0 | BQ4: 0 | BR4: 0 | BS4: =SUM(RC[-4]:RC[-1]) -> 0
A5: ACENAPTHTHYL | B5: 0 | C5: 0 | D5: 0 | E5: 0 | F5: =SUM(RC[-4]:RC[-1]) -> 0 | G5: 0 | H5: 0 | I5: 0 | J5: 0 | K5: =SUM(RC[-4]:RC[-1]) -> 0 | L5: 0 | M5: 0 | N5: 0 | O5: 0 | P5: =SUM(RC[-4]:RC[-1]) -> 0 | Q5: 0 | R5: 0 | S5: 0 | T5: 0 | U5: =SUM(RC[-4]:RC[-1]) -> 0 | V5: 0 | W5: 0 | X5: 0 | Y5: 0 | Z5: =SUM(RC[-4]:RC[-1]) -> 0 | AA5: 0 | AB5: 0 | AC5: 0 | AD5: 0 | AE5: =SUM(RC[-4]:RC[-1]) -> 0 | AF5: 0 | AG5: 0 | AH5: 0 | AI5: 0 | AJ5: =SUM(RC[-4]:RC[-1]) -> 0 | AK5: 0 | AL5: 0 | AM5: 0 | AN5: 0 | AO5: =SUM(RC[-4]:RC[-1]) -> 0 | AP5: 0 | AQ5: 0 | AR5: 0 | AS5: 0 | AT5: =SUM(RC[-4]:RC[-1]) -> 0 | AU5: 0 | AV5: 0 | AW5: 0 | AX5: 0 | AY5: =SUM(RC[-4]:RC[-1]) -> 0 | AZ5: 0 | BA5: 0 | BB5: 0 | BC5: 0 | BD5: =SUM(RC[-4]:RC[-1]) -> 0 | BE5: 0 | BF5: 0 | BG5: 0 | BH5: 0 | BI5: =SUM(RC[-4]:RC[-1]) -> 0 | BJ5: 0 | BK5: 0 | BL5: 0 | BM5: 0 | BN5: =SUM(RC[-4]:RC[-1]) -> 0 | BO5: 0 | BP5: 0 | BQ5: 0 | BR5: 0 | BS5: =SUM(RC[-4]:RC[-1]) -> 0
A6: ACETALDEHYDE | B6: 13085 | C6: 620.35 | D6: 221.88 | E6: 2393.4726662959988 | F6: =SUM(RC[-4]:RC[-1]) -> 16320.702666295998 | G6: 28934 | H6: 293.25 | I6: 503.7 | J6: 6191.0926127699995 | K6: =SUM(RC[-4]:RC[-1]) -> 35922.042612769998 | L6: 42775 | M6: 1641.26 | N6: 20.3 | O6: 23362.347258149999 | P6: =SUM(RC[-4]:RC[-1]) -> 67798.907258150008 | Q6: 373224 | R6: 624.65 | S6: 370.49 | T6: 201416.13987383491 | U6: =SUM(RC[-4]:RC[-1]) -> 575635.27987383492 | V6: 21971 | W6: 1341.3 | X6: 0 | Y6: 13158.590111539997 | Z6: =SUM(RC[-4]:RC[-1]) -> 36470.890111539993 | AA6: 18187 | AB6: 753.8 | AC6: 0 | AD6: 7876.4116008899991 | AE6: =SUM(RC[-4]:RC[-1]) -> 26817.211600889997 | AF6: 20597 | AG6: 37.659999999999997 | AH6: 133.30000000000001 | AI6: 14392.236593865002 | AJ6: =SUM(RC[-4]:RC[-1]) -> 35160.196593865003 | AK6: 50479 | AL6: 1274.57 | AM6: 0 | AN6: 24423.137255234997 | AO6: =SUM(RC[-4]:RC[-1]) -> 76176.707255235 | AP6: 23165 | AQ6: 654.69000000000005 | AR6: 5259.2 | AS6: 15765.535971883002 | AT6: =SUM(RC[-4]:RC[-1]) -> 44844.425971883 | AU6: 15742 | AV6: 589.35 | AW6: 0 | AX6: 9264.6610474250028 | AY6: =SUM(RC[-4]:RC[-1]) -> 25596.011047425003 | AZ6: 18459 | BA6: 0 | BB6: 1354.53 | BC6: 16890.199401144004 | BD6: =SUM(RC[-4]:RC[-1]) -> 36703.729401144003 | BE6: 256310 | BF6: 23.84 | BG6: 58.81 | BH6: 140758.86624647406 | BI6: =SUM(RC[-4]:RC[-1]) -> 397151.51624647406 | BJ6: 7975 | BK6: 0 | BL6: 0 | BM6: 10145.525113092996 | BN6: =SUM(RC[-4]:RC[-1]) -> 18120.525113092997 | BO6: 5997 | BP6: 23.84 | BQ6: 0 | BR6: 4925.4775323410022 | BS6: =SUM(RC[-4]:RC[-1]) -> 10946.317532341003
A7: ACROLEIN | B7: 1596 | C7: 857.28 | D7: 209.5 | E7: 32.8969918823 | F7: =SUM(RC[-4]:RC[-1]) -> 2695.6769918822997 | G7: 3627 | H7: 948.64 | I7: 554.53 | J7: 82.131862057799978 | K7: =SUM(RC[-4]:RC[-1]) -> 5212.3018620578005 | L7: 4769 | M7: 2232 | N7: 12.52 | O7: 315.48129374839999 | P7: =SUM(RC[-4]:RC[-1]) -> 7329.0012937484007 | Q7: 45015 | R7: 2925.85 | S7: 24.889800000000001 | T7: 8550.3348477120016 | U7: =SUM(RC[-4]:RC[-1]) -> 56516.074647711997 | V7: 2704 | W7: 1945.86 | X7: 0 | Y7: 772.3741401161999 | Z7: =SUM(RC[-4]:RC[-1]) -> 5422.2341401161993 | AA7: 2198 | AB7: 1056.82 | AC7: 0 | AD7: 294.94411183260013 | AE7: =SUM(RC[-4]:RC[-1]) -> 3549.7641118326001 | AF7: 2677 | AG7: 39.11 | AH7: 128.88999999999999 | AI7: 285.14736981100003 | AJ7: =SUM(RC[-4]:RC[-1]) -> 3130.1473698109999 | AK7: 6101 | AL7: 2226.46 | AM7: 0 | AN7: 755.44678714889994 | AO7: =SUM(RC[-4]:RC[-1]) -> 9082.9067871488987 | AP7: 2796 | AQ7: 827.02 | AR7: 3995.99 | AS7: 696.68680677419991 | AT7: =SUM(RC[-4]:RC[-1]) -> 8315.6968067742 | AU7: 1979 | AV7: 1149.6600000000001 | AW7: 0 | AX7: 160.92574116080002 | AY7: =SUM(RC[-4]:RC[-1]) -> 3289.5857411607999 | AZ7: 2311 | BA7: 441.22 | BB7: 12.96 | BC7: 257.9034970335 | BD7: =SUM(RC[-4]:RC[-1]) -> 3023.0834970335004 | BE7: 28199 | BF7: 6465.55 | BG7: 56.98 | BH7: 4518.5283488528012 | BI7: =SUM(RC[-4]:RC[-1]) -> 39240.058348852806 | BJ7: 996 | BK7: 263.7 | BL7: 0 | BM7: 162.22878499769996 | BN7: =SUM(RC[-4]:RC[-1]) -> 1421.9287849976999 | BO7: 695 | BP7: 161.68 | BQ7: 0 | BR7: 100.85409036830001 | BS7: =SUM(RC[-4]:RC[-1]) -> 957.5340903683001
A8: ACRYLAMIDE | B8: 0 | C8: 0 | D8: 0 | E8: 0 | F8: =SUM(RC[-4]:RC[-1]) -> 0 | G8: 0 | H8: 0 | I8: 0 | J8: 0 | K8: =SUM(RC[-4]:RC[-1]) -> 0 | L8: 0 | M8: 0 | N8: 0 | O8: 0 | P8: =SUM(RC[-4]:RC[-1]) -> 0 | Q8: 0 | R8: 0 | S8: 0 | T8: 0 | U8: =SUM(RC[-4]:RC[-1]) -> 0 | V8: 0 | W8: 0 | X8: 0 | Y8: 0 | Z8: =SUM(RC[-4]:RC[-1]) -> 0 | AA8: 0 | AB8: 0 | AC8: 0 | AD8: 0 | AE8: =SUM(RC[-4]:RC[-1]) -> 0 | AF8: 0 | AG8: 0 | AH8: 0 | AI8: 0 | AJ8: =SUM(RC[-4]:RC[-1]) -> 0 | AK8: 0 | AL8: 0 | AM8: 0 | AN8: 0 | AO8: =SUM(RC[-4]:RC[-1]) -> 0 | AP8: 0 | AQ8: 0 | AR8: 0 | AS8: 0 | AT8: =SUM(RC[-4]:RC[-1]) -> 0 | AU8: 0 | AV8: 0 | AW8: 0 | AX8: 0 | AY8: =SUM(RC[-4]:RC[-1]) -> 0 | AZ8: 0 | BA8: 0 | BB8: 0 | BC8: 0 | BD8: =SUM(RC[-4]:RC[-1]) -> 0 | BE8: 0 | BF8: 0 | BG8: 0 | BH8: 0 | BI8: =SUM(RC[-4]:RC[-1]) -> 0 | BJ8: 0 | BK8: 0 | BL8: 0 | BM8: 0 | BN8: =SUM(RC[-4]:RC[-1]) -> 0 | BO8: 0 | BP8: 0 | BQ8: 0 | BR8: 0 | BS8: =SUM(RC[-4]:RC[-1]) -> 0
A9: ACRYLONITRIL | B9: 0 | C9: 39.68 | D9: 270.43 | E9: 0 | F9: =SUM(RC[-4]:RC[-1]) -> 310.11 | G9: 0 | H9: 140.27000000000001 | I9: 259.98 | J9: 0 | K9: =SUM(RC[-4]:RC[-1]) -> 400.25 | L9: 0 | M9: 121.44 | N9: 7.78 | O9: 0 | P9: =SUM(RC[-4]:RC[-1]) -> 129.22 | Q9: 0 | R9: 1720.17 | S9: 13.27 | T9: 0 | U9: =SUM(RC[-4]:RC[-1]) -> 1733.44 | V9: 0 | W9: 86.18 | X9: 0 | Y9: 0 | Z9: =SUM(RC[-4]:RC[-1]) -> 86.18 | AA9: 0 | AB9: 64.900000000000006 | AC9: 0 | AD9: 0 | AE9: =SUM(RC[-4]:RC[-1]) -> 64.900000000000006 | AF9: 0 | AG9: 121.38 | AH9: 68.739999999999995 | AI9: 0 | AJ9: =SUM(RC[-4]:RC[-1]) -> 190.12 | AK9: 0 | AL9: 207.94 | AM9: 0 | AN9: 0 | AO9: =SUM(RC[-4]:RC[-1]) -> 207.94 | AP9: 0 | AQ9: 76.37 | AR9: 2131.1999999999998 | AS9: 0 | AT9: =SUM(RC[-4]:RC[-1]) -> 2207.5699999999997 | AU9: 0 | AV9: 74.75 | AW9: 0 | AX9: 0 | AY9: =SUM(RC[-4]:RC[-1]) -> 74.75 | AZ9: 0 | BA9: 118.773 | BB9: 33.25 | BC9: 0 | BD9: =SUM(RC[-4]:RC[-1]) -> 152.023 | BE9: 0 | BF9: 1125.6500000000001 | BG9: 44.11 | BH9: 0 | BI9: =SUM(RC[-4]:RC[-1]) -> 1169.76 | BJ9: 0 | BK9: 54.91 | BL9: 0 | BM9: 0 | BN9: =SUM(RC[-4]:RC[-1]) -> 54.91 | BO9: 0 | BP9: 30.52 | BQ9: 0 | BR9: 0 | BS9: =SUM(RC[-4]:RC[-1]) -> 30.52
A10: ANTHRACENE | B10: 0 | C10: 0 | D10: 0 | E10: 1.5418214906800003E-2 | F10: =SUM(RC[-4]:RC[-1]) -> 1.5418214906800003E-2 | G10: 0 | H10: 0 | I10: 0 | J10: 3.95932197756E-2 | K10: =SUM(RC[-4]:RC[-1]) -> 3.95932197756E-2 | L10: 0 | M10: 0 | N10: 0 | O10: 0.1689401634774001 | P10: =SUM(RC[-4]:RC[-1]) -> 0.1689401634774001 | Q10: 0 | R10: 0 | S10: 0 | T10: 2.8702220038505994 | U10: =SUM(RC[-4]:RC[-1]) -> 2.8702220038505994 | V10: 0 | W10: 0 | X10: 0 | Y10: 0.38718023378899991 | Z10: =SUM(RC[-4]:RC[-1]) -> 0.38718023378899991 | AA10: 0 | AB10: 0 | AC10: 0 | AD10: 0.14796060447359999 | AE10: =SUM(RC[-4]:RC[-1]) -> 0.14796060447359999 | AF10: 0 | AG10: 0 | AH10: 0 | AI10: 0.11990958614159997 | AJ10: =SUM(RC[-4]:RC[-1]) -> 0.11990958614159997 | AK10: 0 | AL10: 0 | AM10: 0 | AN10: 0.36044508825940008 | AO10: =SUM(RC[-4]:RC[-1]) -> 0.36044508825940008 | AP10: 0 | AQ10: 0 | AR10: 0 | AS10: 0.34517556030999996 | AT10: =SUM(RC[-4]:RC[-1]) -> 0.34517556030999996 | AU10: 0 | AV10: 0 | AW10: 0 | AX10: 7.7183682491800021E-2 | AY10: =SUM(RC[-4]:RC[-1]) -> 7.7183682491800021E-2 | AZ10: 0 | BA10: 0 | BB10: 0 | BC10: 0.12190472179159993 | BD10: =SUM(RC[-4]:RC[-1]) -> 0.12190472179159993 | BE10: 0 | BF10: 0 | BG10: 0 | BH10: 1.8914154319371996 | BI10: =SUM(RC[-4]:RC[-1]) -> 1.8914154319371996 | BJ10: 0 | BK10: 0 | BL10: 0 | BM10: 8.6133663105800021E-2 | BN10: =SUM(RC[-4]:RC[-1]) -> 8.6133663105800021E-2 | BO10: 0 | BP10: 0 | BQ10: 0 | BR10: 5.3163259845999983E-2 | BS10: =SUM(RC[-4]:RC[-1]) -> 5.3163259845999983E-2
A11: ANTIMONY | B11: 0 | C11: 0 | D11: 0 | E11: 0 | F11: =SUM(RC[-4]:RC[-1]) -> 0 | G11: 0 | H11: 0 | I11: 1056 | J11: 0 | K11: =SUM(RC[-4]:RC[-1]) -> 1056 | L11: 0 | M11: 0 | N11: 806.31 | O11: 0 | P11: =SUM(RC[-4]:RC[-1]) -> 806.31 | Q11: 0 | R11: 0 | S11: 44.44 | T11: 0 | U11: =SUM(RC[-4]:RC[-1]) -> 44.44 | V11: 0 | W11: 0 | X11: 0 | Y11: 0 | Z11: =SUM(RC[-4]:RC[-1]) -> 0 | AA11: 0 | AB11: 0 | AC11: 0 | AD11: 0 | AE11: =SUM(RC[-4]:RC[-1]) -> 0 | AF11: 0 | AG11: 0 | AH11: 6.2 | AI11: 0 | AJ11: =SUM(RC[-4]:RC[-1]) -> 6.2 | AK11: 0 | AL11: 0 | AM11: 5.0599999999999996 | AN11: 0 | AO11: =SUM(RC[-4]:RC[-1]) -> 5.0599999999999996 | AP11: 0 | AQ11: 0 | AR11: 76.540000000000006 | AS11: 0 | AT11: =SUM(RC[-4]:RC[-1]) -> 76.540000000000006 | AU11: 0 | AV11: 0 | AW11: 4.3499999999999996 | AX11: 0 | AY11: =SUM(RC[-4]:RC[-1]) -> 4.3499999999999996 | AZ11: 0 | BA11: 0 | BB11: 129.38 | BC11: 0 | BD11: =SUM(RC[-4]:RC[-1]) -> 129.38 | BE11: 0 | BF11: 0 | BG11: 1447.43 | BH11: 0 | BI11: =SUM(RC[-4]:RC[-1]) -> 1447.43 | BJ11: 0 | BK11: 0 | BL11: 11.44 | BM11: 0 | BN11: =SUM(RC[-4]:RC[-1]) -> 11.44 | BO11: 0 | BP11: 0 | BQ11: 0 | BR11: 0 | BS11: =SUM(RC[-4]:RC[-1]) -> 0
A12: ARSENIC | B12: 0 | C12: 0 | D12: 0 | E12: 0 | F12: =SUM(RC[-4]:RC[-1]) -> 0 | G12: 0 | H12: 0 | I12: 1234.2 | J12: 0 | K12: =SUM(RC[-4]:RC[-1]) -> 1234.2 | L12: 0 | M12: 0 | N12: 1155.3499999999999 | O12: 0 | P12: =SUM(RC[-4]:RC[-1]) -> 1155.3499999999999 | Q12: 1 | R12: 0 | S12: 103.53 | T12: 0 | U12: =SUM(RC[-4]:RC[-1]) -> 104.53 | V12: 0 | W12: 0 | X12: 0 | Y12: 0 | Z12: =SUM(RC[-4]:RC[-1]) -> 0 | AA12: 0 | AB12: 0 | AC12: 0 | AD12: 0 | AE12: =SUM(RC[-4]:RC[-1]) -> 0 | AF12: 0 | AG12: 0 | AH12: 4.9432 | AI12: 0 | AJ12: =SUM(RC[-4]:RC[-1]) -> 4.9432 | AK12: 0 | AL12: 0 | AM12: 2.21 | AN12: 0 | AO12: =SUM(RC[-4]:RC[-1]) -> 2.21 | AP12: 0 | AQ12: 0 | AR12: 106.49 | AS12: 0 | AT12: =SUM(RC[-4]:RC[-1]) -> 106.49 | AU12: 0 | AV12: 0 | AW12: 1.82 | AX12: 0 | AY12: =SUM(RC[-4]:RC[-1]) -> 1.82 | AZ12: 0 | BA12: 0 | BB12: 185.57 | BC12: 0 | BD12: =SUM(RC[-4]:RC[-1]) -> 185.57 | BE12: 1 | BF12: 0 | BG12: 2076.98 | BH12: 0 | BI12: =SUM(RC[-4]:RC[-1]) -> 2077.98 | BJ12: 0 | BK12: 0 | BL12: 0.19 | BM12: 0 | BN12: =SUM(RC[-4]:RC[-1]) -> 0.19 | BO12: 0 | BP12: 0 | BQ12: 0 | BR12: 0 | BS12: =SUM(RC[-4]:RC[-1]) -> 0
A13: ATRIZINE | B13: 0 | C13: 3067.8 | D13: 0 | E13: 0 | F13: =SUM(RC[-4]:RC[-1]) -> 3067.8 | G13: 0 | H13: 6844.93 | I13: 0 | J13: 0 | K13: =SUM(RC[-4]:RC[-1]) -> 6844.93 | L13: 0 | M13: 3796.35 | N13: 0 | O13: 0 | P13: =SUM(RC[-4]:RC[-1]) -> 3796.35 | Q13: 0 | R13: 329.7 | S13: 0 | T13: 0 | U13: =SUM(RC[-4]:RC[-1]) -> 329.7 | V13: 0 | W13: 289.54000000000002 | X13: 0 | Y13: 0 | Z13: =SUM(RC[-4]:RC[-1]) -> 289.54000000000002 | AA13: 0 | AB13: 1183.0999999999999 | AC13: 0 | AD13: 0 | AE13: =SUM(RC[-4]:RC[-1]) -> 1183.0999999999999 | AF13: 0 | AG13: 1917.21 | AH13: 0 | AI13: 0 | AJ13: =SUM(RC[-4]:RC[-1]) -> 1917.21 | AK13: 0 | AL13: 206.559 | AM13: 0 | AN13: 0 | AO13: =SUM(RC[-4]:RC[-1]) -> 206.559 | AP13: 0 | AQ13: 4.6500000000000004 | AR13: 0 | AS13: 0 | AT13: =SUM(RC[-4]:RC[-1]) -> 4.6500000000000004 | AU13: 0 | AV13: 2180.12 | AW13: 0 | AX13: 0 | AY13: =SUM(RC[-4]:RC[-1]) -> 2180.12 | AZ13: 0 | BA13: 4482.95 | BB13: 0 | BC13: 0 | BD13: =SUM(RC[-4]:RC[-1]) -> 4482.95 | BE13: 0 | BF13: 1.8 | BG13: 0 | BH13: 0 | BI13: =SUM(RC[-4]:RC[-1]) -> 1.8 | BJ13: 0 | BK13: 5001.66 | BL13: 0 | BM13: 0 | BN13: =SUM(RC[-4]:RC[-1]) -> 5001.66 | BO13: 0 | BP13: 1844.47 | BQ13: 0 | BR13: 0 | BS13: =SUM(RC[-4]:RC[-1]) -> 1844.47
A14: BENZ (A) ANTHR | B14: 0 | C14: 9.42 | D14: 0 | E14: 0.22310888994400008 | F14: =SUM(RC[-4]:RC[-1]) -> 9.6431088899439992 | G14: 0 | H14: 4.4400000000000004 | I14: 0 | J14: 0.57293274134000005 | K14: =SUM(RC[-4]:RC[-1]) -> 5.0129327413400002 | L14: 0 | M14: 24.92 | N14: 0 | O14: 2.4415070733799999 | P14: =SUM(RC[-4]:RC[-1]) -> 27.36150707338 | Q14: 0 | R14: 9.4700000000000006 | S14: 0 | T14: 41.088948815001984 | U14: =SUM(RC[-4]:RC[-1]) -> 50.558948815001983 | V14: 0 | W14: 20.37 | X14: 0 | Y14: 5.602236233046006 | Z14: =SUM(RC[-4]:RC[-1]) -> 25.972236233046008 | AA14: 0 | AB14: 11.43 | AC14: 0 | AD14: 2.1410711140280023 | AE14: =SUM(RC[-4]:RC[-1]) -> 13.571071114028001 | AF14: 0 | AG14: 0.56000000000000005 | AH14: 0 | AI14: 1.7201909063619996 | AJ14: =SUM(RC[-4]:RC[-1]) -> 2.2801909063619998 | AK14: 0 | AL14: 19.350000000000001 | AM14: 0 | AN14: 5.2157897726959987 | AO14: =SUM(RC[-4]:RC[-1]) -> 24.565789772696 | AP14: 0 | AQ14: 9.93 | AR14: 0 | AS14: 4.9913430859500005 | AT14: =SUM(RC[-4]:RC[-1]) -> 14.921343085949999 | AU14: 0 | AV14: 8.94 | AW14: 0 | AX14: 1.1168865672179997 | AY14: =SUM(RC[-4]:RC[-1]) -> 10.056886567217999 | AZ14: 0 | BA14: 0 | BB14: 0 | BC14: 1.764022130560001 | BD14: =SUM(RC[-4]:RC[-1]) -> 1.764022130560001 | BE14: 0 | BF14: 0.36 | BG14: 0 | BH14: 27.368823190682008 | BI14: =SUM(RC[-4]:RC[-1]) -> 27.728823190682007 | BJ14: 0 | BK14: 0 | BL14: 0 | BM14: 1.2463982823620001 | BN14: =SUM(RC[-4]:RC[-1]) -> 1.2463982823620001 | BO14: 0 | BP14: 0.36 | BQ14: 0 | BR14: 0.76930041850800024 | BS14: =SUM(RC[-4]:RC[-1]) -> 1.1293004185080002
A15: BENZ (GHI) PE | B15: 0 | C15: 0 | D15: 0 | E15: 0.43957431645999984 | F15: =SUM(RC[-4]:RC[-1]) -> 0.43957431645999984 | G15: 0 | H15: 0 | I15: 0 | J15: 1.1288050329680002 | K15: =SUM(RC[-4]:RC[-1]) -> 1.1288050329680002 | L15: 0 | M15: 0 | N15: 0 | O15: 4.8099076899800002 | P15: =SUM(RC[-4]:RC[-1]) -> 4.8099076899800002 | Q15: 0 | R15: 0 | S15: 0 | T15: 80.892757516046032 | U15: =SUM(RC[-4]:RC[-1]) -> 80.892757516046032 | V15: 0 | W15: 0 | X15: 0 | Y15: 11.037515158858005 | Z15: =SUM(RC[-4]:RC[-1]) -> 11.037515158858005 | AA15: 0 | AB15: 0 | AC15: 0 | AD15: 4.218361605320001 | AE15: =SUM(RC[-4]:RC[-1]) -> 4.218361605320001 | AF15: 0 | AG15: 0 | AH15: 0 | AI15: 3.3872896259260004 | AJ15: =SUM(RC[-4]:RC[-1]) -> 3.3872896259260004 | AK15: 0 | AL15: 0 | AM15: 0 | AN15: 10.276214659824005 | AO15: =SUM(RC[-4]:RC[-1]) -> 10.276214659824005 | AP15: 0 | AQ15: 0 | AR15: 0 | AS15: 9.8335532583020093 | AT15: =SUM(RC[-4]:RC[-1]) -> 9.8335532583020093 | AU15: 0 | AV15: 0 | AW15: 0 | AX15: 2.2005109043959998 | AY15: =SUM(RC[-4]:RC[-1]) -> 2.2005109043959998 | AZ15: 0 | BA15: 0 | BB15: 0 | BC15: 3.4755106141819994 | BD15: =SUM(RC[-4]:RC[-1]) -> 3.4755106141819994 | BE15: 0 | BF15: 0 | BG15: 0 | BH15: 53.92245182830402 | BI15: =SUM(RC[-4]:RC[-1]) -> 53.92245182830402 | BJ15: 0 | BK15: 0 | BL15: 0 | BM15: 2.4556733757019997 | BN15: =SUM(RC[-4]:RC[-1]) -> 2.4556733757019997 | BO15: 0 | BP15: 0 | BQ15: 0 | BR15: 1.5156859179860009 | BS15: =SUM(RC[-4]:RC[-1]) -> 1.5156859179860009
A16: BENZENE | B16: 80933 | C16: 7756.67 | D16: 1213.54 | E16: 2984.7416099699999 | F16: =SUM(RC[-4]:RC[-1]) -> 92887.951609969998 | G16: 188124 | H16: 16729.32 | I16: 10152.6 | J16: 7552.3746379699996 | K16: =SUM(RC[-4]:RC[-1]) -> 222558.29463797002 | L16: 221794 | M16: 16868.98 | N16: 449.18 | O16: 28792.864800230011 | P16: =SUM(RC[-4]:RC[-1]) -> 267905.02480022999 | Q16: 2252846 | R16: 248780.55 | S16: 15664.65 | T16: 560694.19465213979 | U16: =SUM(RC[-4]:RC[-1]) -> 3077985.3946521394 | V16: 138060 | W16: 17928.3 | X16: 44.27 | Y16: 61392.708010249997 | Z16: =SUM(RC[-4]:RC[-1]) -> 217425.27801024998 | AA16: 110488 | AB16: 10752.55 | AC16: 0 | AD16: 24191.577248359969 | AE16: =SUM(RC[-4]:RC[-1]) -> 145432.12724835996 | AF16: 142864 | AG16: 16503.29 | AH16: 1871.7 | AI16: 21414.632969729999 | AJ16: =SUM(RC[-4]:RC[-1]) -> 182653.62296973003 | AK16: 140436 | AL16: 32342.53 | AM16: 28.689 | AN16: 62165.70173510001 | AO16: =SUM(RC[-4]:RC[-1]) -> 234972.92073510002 | AP16: 140436 | AQ16: 14620.5 | AR16: 24368.7 | AS16: 55542.879158630014 | AT16: =SUM(RC[-4]:RC[-1]) -> 234968.07915863002 | AU16: 102918 | AV16: 9753.7099999999991 | AW16: 629.04999999999995 | AX16: 14136.656015589999 | AY16: =SUM(RC[-4]:RC[-1]) -> 127437.41601558999 | AZ16: 119688 | BA16: 16027.1 | BB16: 147.34 | BC16: 22580.766478899997 | BD16: =SUM(RC[-4]:RC[-1]) -> 158443.20647889999 | BE16: 1287666 | BF16: 153239.29999999999 | BG16: 2563.4899999999998 | BH16: 364936.62798220012 | BI16: =SUM(RC[-4]:RC[-1]) -> 1808405.4179822002 | BJ16: 51534 | BK16: 7280 | BL16: 41.68 | BM16: 14673.374051969997 | BN16: =SUM(RC[-4]:RC[-1]) -> 73529.054051970001 | BO16: 33597 | BP16: 4123.79 | BQ16: 0 | BR16: 8824.5589325999972 | BS16: =SUM(RC[-4]:RC[-1]) -> 46545.348932599998
A17: BENZO (A) PYRE | B17: 0 | C17: 2.2400000000000002 | D17: 0 | E17: 0.13150718345999998 | F17: =SUM(RC[-4]:RC[-1]) -> 2.3715071834600003 | G17: 0 | H17: 1.05 | I17: 0 | J17: 0.33770392629599982 | K17: =SUM(RC[-4]:RC[-1]) -> 1.3877039262959998 | L17: 0 | M17: 5.94 | N17: 0 | O17: 1.4391059499160002 | P17: =SUM(RC[-4]:RC[-1]) -> 7.379105949916001 | Q17: 0 | R17: 2.25 | S17: 0 | T17: 24.220663315635999 | U17: =SUM(RC[-4]:RC[-1]) -> 26.470663315635999 | V17: 0 | W17: 4.8600000000000003 | X17: 0 | Y17: 3.302134096417999 | Z17: =SUM(RC[-4]:RC[-1]) -> 8.1621340964179989 | AA17: 0 | AB17: 2.73 | AC17: 0 | AD17: 1.262013847722 | AE17: =SUM(RC[-4]:RC[-1]) -> 3.9920138477220002 | AF17: 0 | AG17: 0.12 | AH17: 0 | AI17: 1.0139749342740005 | AJ17: =SUM(RC[-4]:RC[-1]) -> 1.1339749342740006 | AK17: 0 | AL17: 4.6100000000000003 | AM17: 0 | AN17: 3.0743493265020008 | AO17: =SUM(RC[-4]:RC[-1]) -> 7.6843493265020015 | AP17: 0 | AQ17: 2.36 | AR17: 0 | AS17: 2.9420625128279974 | AT17: =SUM(RC[-4]:RC[-1]) -> 5.3020625128279972 | AU17: 0 | AV17: 2.13 | AW17: 0 | AX17: 0.65832719940599982 | AY17: =SUM(RC[-4]:RC[-1]) -> 2.7883271994059999 | AZ17: 0 | BA17: 0 | BB17: 0 | BC17: 1.0397688897339998 | BD17: =SUM(RC[-4]:RC[-1]) -> 1.0397688897339998 | BE17: 0 | BF17: 7.0000000000000007E-2 | BG17: 0 | BH17: 16.132058657324002 | BI17: =SUM(RC[-4]:RC[-1]) -> 16.202058657324002 | BJ17: 0 | BK17: 0 | BL17: 0 | BM17: 0.73466477671799957 | BN17: =SUM(RC[-4]:RC[-1]) -> 0.73466477671799957 | BO17: 0 | BP17: 7.0000000000000007E-2 | BQ17: 0 | BR17: 0.45344908221000035 | BS17: =SUM(RC[-4]:RC[-1]) -> 0.52344908221000042
A18: BENZO (B) FLUO | B18: 0 | C18: 0 | D18: 0 | E18: 0.11457792729400004 | F18: =SUM(RC[-4]:RC[-1]) -> 0.11457792729400004 | G18: 0 | H18: 0 | I18: 0 | J18: 0.29423035213000004 | K18: =SUM(RC[-4]:RC[-1]) -> 0.29423035213000004 | L18: 0 | M18: 0 | N18: 0 | O18: 1.2537225121240001 | P18: =SUM(RC[-4]:RC[-1]) -> 1.2537225121240001 | Q18: 0 | R18: 0 | S18: 0 | T18: 21.084325273691999 | U18: =SUM(RC[-4]:RC[-1]) -> 21.084325273691999 | V18: 0 | W18: 0 | X18: 0 | Y18: 2.8769585418140031 | Z18: =SUM(RC[-4]:RC[-1]) -> 2.8769585418140031 | AA18: 0 | AB18: 0 | AC18: 0 | AD18: 1.0995302546679995 | AE18: =SUM(RC[-4]:RC[-1]) -> 1.0995302546679995 | AF18: 0 | AG18: 0 | AH18: 0 | AI18: 0.88289127036399973 | AJ18: =SUM(RC[-4]:RC[-1]) -> 0.88289127036399973 | AK18: 0 | AL18: 0 | AM18: 0 | AN18: 2.6785363678299996 | AO18: =SUM(RC[-4]:RC[-1]) -> 2.6785363678299996 | AP18: 0 | AQ18: 0 | AR18: 0 | AS18: 2.563140897362 | AT18: =SUM(RC[-4]:RC[-1]) -> 2.563140897362 | AU18: 0 | AV18: 0 | AW18: 0 | AX18: 0.57357514351000027 | AY18: =SUM(RC[-4]:RC[-1]) -> 0.57357514351000027 | AZ18: 0 | BA18: 0 | BB18: 0 | BC18: 0.90591112640200033 | BD18: =SUM(RC[-4]:RC[-1]) -> 0.90591112640200033 | BE18: 0 | BF18: 0 | BG18: 0 | BH18: 14.055161980877998 | BI18: =SUM(RC[-4]:RC[-1]) -> 14.055161980877998 | BJ18: 0 | BK18: 0 | BL18: 0 | BM18: 0.64008309703200028 | BN18: =SUM(RC[-4]:RC[-1]) -> 0.64008309703200028 | BO18: 0 | BP18: 0 | BQ18: 0 | BR18: 0.39506989081800015 | BS18: =SUM(RC[-4]:RC[-1]) -> 0.39506989081800015
A19: BENZO (K) FLUO | B19: 0 | C19: 0 | D19: 0 | E19: 0.12304714661600002 | F19: =SUM(RC[-4]:RC[-1]) -> 0.12304714661600002 | G19: 0 | H19: 0 | I19: 0 | J19: 0.31597893684999989 | K19: =SUM(RC[-4]:RC[-1]) -> 0.31597893684999989 | L19: 0 | M19: 0 | N19: 0 | O19: 1.3463988168760004 | P19: =SUM(RC[-4]:RC[-1]) -> 1.3463988168760004 | Q19: 0 | R19: 0 | S19: 0 | T19: 22.642911272747988 | U19: =SUM(RC[-4]:RC[-1]) -> 22.642911272747988 | V19: 0 | W19: 0 | X19: 0 | Y19: 3.0896502643559995 | Z19: =SUM(RC[-4]:RC[-1]) -> 3.0896502643559995 | AA19: 0 | AB19: 0 | AC19: 0 | AD19: 1.1808157141039992 | AE19: =SUM(RC[-4]:RC[-1]) -> 1.1808157141039992 | AF19: 0 | AG19: 0 | AH19: 0 | AI19: 0.94815517607999966 | AJ19: =SUM(RC[-4]:RC[-1]) -> 0.94815517607999966 | AK19: 0 | AL19: 0 | AM19: 0 | AN19: 2.8765483699519994 | AO19: =SUM(RC[-4]:RC[-1]) -> 2.8765483699519994 | AP19: 0 | AQ19: 0 | AR19: 0 | AS19: 2.7526294765079995 | AT19: =SUM(RC[-4]:RC[-1]) -> 2.7526294765079995 | AU19: 0 | AV19: 0 | AW19: 0 | AX19: 0.61597410328000002 | AY19: =SUM(RC[-4]:RC[-1]) -> 0.61597410328000002 | AZ19: 0 | BA19: 0 | BB19: 0 | BC19: 0.97287618309000035 | BD19: =SUM(RC[-4]:RC[-1]) -> 0.97287618309000035 | BE19: 0 | BF19: 0 | BG19: 0 | BH19: 15.094146169782006 | BI19: =SUM(RC[-4]:RC[-1]) -> 15.094146169782006 | BJ19: 0 | BK19: 0 | BL19: 0 | BM19: 0.68739955723000024 | BN19: =SUM(RC[-4]:RC[-1]) -> 0.68739955723000024 | BO19: 0 | BP19: 0 | BQ19: 0 | BR19: 0.4242752590719997 | BS19: =SUM(RC[-4]:RC[-1]) -> 0.4242752590719997
A20: BERYLLIUM | B20: 0 | C20: 0 | D20: 0 | E20: 0 | F20: =SUM(RC[-4]:RC[-1]) -> 0 | G20: 0 | H20: 0 | I20: 1 | J20: 0 | K20: =SUM(RC[-4]:RC[-1]) -> 1 | L20: 0 | M20: 0 | N20: 0 | O20: 0 | P20: =SUM(RC[-4]:RC[-1]) -> 0 | Q20: 0 | R20: 0 | S20: 0.46 | T20: 0 | U20: =SUM(RC[-4]:RC[-1]) -> 0.46 | V20: 0 | W20: 0 | X20: 0 | Y20: 0 | Z20: =SUM(RC[-4]:RC[-1]) -> 0 | AA20: 0 | AB20: 0 | AC20: 0 | AD20: 0 | AE20: =SUM(RC[-4]:RC[-1]) -> 0 | AF20: 0 | AG20: 0 | AH20: 6.9999999999999999E-4 | AI20: 0 | AJ20: =SUM(RC[-4]:RC[-1]) -> 6.9999999999999999E-4 | AK20: 0 | AL20: 0 | AM20: 0 | AN20: 0 | AO20: =SUM(RC[-4]:RC[-1]) -> 0 | AP20: 0 | AQ20: 0 | AR20: 0 | AS20: 0 | AT20: =SUM(RC[-4]:RC[-1]) -> 0 | AU20: 0 | AV20: 0 | AW20: 0.05 | AX20: 0 | AY20: =SUM(RC[-4]:RC[-1]) -> 0.05 | AZ20: 0 | BA20: 0 | BB20: 0 | BC20: 0 | BD20: =SUM(RC[-4]:RC[-1]) -> 0 | BE20: 0 | BF20: 0 | BG20: 0 | BH20: 0 | BI20: =SUM(RC[-4]:RC[-1]) -> 0 | BJ20: 0 | BK20: 0 | BL20: 0 | BM20: 0 | BN20: =SUM(RC[-4]:RC[-1]) -> 0 | BO20: 0 | BP20: 0 | BQ20: 0 | BR20: 0 | BS20: =SUM(RC[-4]:RC[-1]) -> 0
A21: BUTADIENE,13 | B21: 10304 | C21: 20571.07 | D21: 2.12 | E21: 454.69075971400008 | F21: =SUM(RC[-4]:RC[-1]) -> 31331.880759714 | G21: 24002 | H21: 54075.89 | I21: 266.15499999999997 | J21: 1133.9599813060001 | K21: =SUM(RC[-4]:RC[-1]) -> 79478.004981306003 | L21: 28025 | M21: 66910.8 | N21: 5.27 | O21: 3793.3109074450008 | P21: =SUM(RC[-4]:RC[-1]) -> 98734.380907445011 | Q21: 287476 | R21: 850521.56 | S21: 3575.94 | T21: 85782.261876331992 | U21: =SUM(RC[-4]:RC[-1]) -> 1227355.7618763321 | V21: 17598 | W21: 50648.800000000003 | X21: 10.33 | Y21: 6913.9851271489979 | Z21: =SUM(RC[-4]:RC[-1]) -> 75171.115127149009 | AA21: 14061 | AB21: 27434.03 | AC21: 0 | AD21: 2891.1848393800014 | AE21: =SUM(RC[-4]:RC[-1]) -> 44386.214839380002 | AF21: 18280 | AG21: 47502.54 | AH21: 265.29000000000002 | AI21: 3027.9099370069998 | AJ21: =SUM(RC[-4]:RC[-1]) -> 69075.739937007005 | AK21: 39033 | AL21: 106637.44 | AM21: 6.61 | AN21: 8045.8132638749967 | AO21: =SUM(RC[-4]:RC[-1]) -> 153722.86326387498 | AP21: 17865 | AQ21: 50192.12 | AR21: 2031.3 | AS21: 6468.0382201230013 | AT21: =SUM(RC[-4]:RC[-1]) -> 76556.458220122993 | AU21: 13135 | AV21: 27459 | AW21: 0.44940000000000002 | AX21: 2007.3951923120012 | AY21: =SUM(RC[-4]:RC[-1]) -> 42601.844592312002 | AZ21: 15272 | BA21: 55397.05 | BB21: 33.76 | BC21: 3246.2471510390019 | BD21: =SUM(RC[-4]:RC[-1]) -> 73949.057151039 | BE21: 163255 | BF21: 347224.8 | BG21: 199.67 | BH21: 53992.62964912998 | BI21: =SUM(RC[-4]:RC[-1]) -> 564672.0996491299 | BJ21: 6575 | BK21: 24825 | BL21: 0 | BM21: 1905.5399439649996 | BN21: =SUM(RC[-4]:RC[-1]) -> 33305.539943964999 | BO21: 4261 | BP21: 11906.3 | BQ21: 0 | BR21: 1095.3105888930004 | BS21: =SUM(RC[-4]:RC[-1]) -> 17262.610588893
A22: CADMIUM | B22: 0 | C22: 0 | D22: 0 | E22: 0 | F22: =SUM(RC[-4]:RC[-1]) -> 0 | G22: 0 | H22: 0 | I22: 351.34 | J22: 0 | K22: =SUM(RC[-4]:RC[-1]) -> 351.34 | L22: 0 | M22: 0 | N22: 362.4 | O22: 0 | P22: =SUM(RC[-4]:RC[-1]) -> 362.4 | Q22: 0 | R22: 0 | S22: 38.99 | T22: 0 | U22: =SUM(RC[-4]:RC[-1]) -> 38.99 | V22: 0 | W22: 0 | X22: 0 | Y22: 0 | Z22: =SUM(RC[-4]:RC[-1]) -> 0 | AA22: 0 | AB22: 0 | AC22: 0 | AD22: 0 | AE22: =SUM(RC[-4]:RC[-1]) -> 0 | AF22: 0 | AG22: 0 | AH22: 2.59 | AI22: 0 | AJ22: =SUM(RC[-4]:RC[-1]) -> 2.59 | AK22: 0 | AL22: 0 | AM22: 0.12 | AN22: 0 | AO22: =SUM(RC[-4]:RC[-1]) -> 0.12 | AP22: 0 | AQ22: 0 | AR22: 32.74 | AS22: 0 | AT22: =SUM(RC[-4]:RC[-1]) -> 32.74 | AU22: 0 | AV22: 0 | AW22: 8.56 | AX22: 0 | AY22: =SUM(RC[-4]:RC[-1]) -> 8.56 | AZ22: 0 | BA22: 0 | BB22: 53.1 | BC22: 0 | BD22: =SUM(RC[-4]:RC[-1]) -> 53.1 | BE22: 0 | BF22: 0 | BG22: 592.35 | BH22: 0 | BI22: =SUM(RC[-4]:RC[-1]) -> 592.35 | BJ22: 0 | BK22: 0 | BL22: 0 | BM22: 0 | BN22: =SUM(RC[-4]:RC[-1]) -> 0 | BO22: 0 | BP22: 0 | BQ22: 0 | BR22: 0 | BS22: =SUM(RC[-4]:RC[-1]) -> 0
A23: CARBON TETRA | B23: 0 | C23: 18.059999999999999 | D23: 35.11 | E23: 0 | F23: =SUM(RC[-4]:RC[-1]) -> 53.17 | G23: 0 | H23: 78.42 | I23: 81.239999999999995 | J23: 0 | K23: =SUM(RC[-4]:RC[-1]) -> 159.66 | L23: 0 | M23: 34.630000000000003 | N23: 4.05 | O23: 0 | P23: =SUM(RC[-4]:RC[-1]) -> 38.68 | Q23: 0 | R23: 175.14699999999999 | S23: 4.1479999999999997 | T23: 0 | U23: =SUM(RC[-4]:RC[-1]) -> 179.29499999999999 | V23: 0 | W23: 53.307000000000002 | X23: 0 | Y23: 0 | Z23: =SUM(RC[-4]:RC[-1]) -> 53.307000000000002 | AA23: 0 | AB23: 14.68 | AC23: 0 | AD23: 0 | AE23: =SUM(RC[-4]:RC[-1]) -> 14.68 | AF23: 0 | AG23: 45.95 | AH23: 21.48 | AI23: 0 | AJ23: =SUM(RC[-4]:RC[-1]) -> 67.430000000000007 | AK23: 0 | AL23: 48.36 | AM23: 0 | AN23: 0 | AO23: =SUM(RC[-4]:RC[-1]) -> 48.36 | AP23: 0 | AQ23: 41.56 | AR23: 719 | AS23: 0 | AT23: =SUM(RC[-4]:RC[-1]) -> 760.56 | AU23: 0 | AV23: 12.26 | AW23: 0 | AX23: 0 | AY23: =SUM(RC[-4]:RC[-1]) -> 12.26 | AZ23: 0 | BA23: 30.79 | BB23: 447.44 | BC23: 0 | BD23: =SUM(RC[-4]:RC[-1]) -> 478.23 | BE23: 0 | BF23: 542.94000000000005 | BG23: 33.99 | BH23: 0 | BI23: =SUM(RC[-4]:RC[-1]) -> 576.93000000000006 | BJ23: 0 | BK23: 9.65 | BL23: 0 | BM23: 0 | BN23: =SUM(RC[-4]:RC[-1]) -> 9.65 | BO23: 0 | BP23: 7.63 | BQ23: 0 | BR23: 0 | BS23: =SUM(RC[-4]:RC[-1]) -> 7.63
A24: CHLOROFORM | B24: 0 | C24: 102.65 | D24: 4.6900000000000004 | E24: 0 | F24: =SUM(RC[-4]:RC[-1]) -> 107.34 | G24: 0 | H24: 445.68 | I24: 12.186 | J24: 0 | K24: =SUM(RC[-4]:RC[-1]) -> 457.86599999999999 | L24: 0 | M24: 196.69 | N24: 2.61 | O24: 0 | P24: =SUM(RC[-4]:RC[-1]) -> 199.3 | Q24: 0 | R24: 992.66 | S24: 0.66200000000000003 | T24: 0 | U24: =SUM(RC[-4]:RC[-1]) -> 993.322 | V24: 0 | W24: 302.98 | X24: 0 | Y24: 0 | Z24: =SUM(RC[-4]:RC[-1]) -> 302.98 | AA24: 0 | AB24: 83.4 | AC24: 0 | AD24: 0 | AE24: =SUM(RC[-4]:RC[-1]) -> 83.4 | AF24: 0 | AG24: 261.08 | AH24: 3.22 | AI24: 0 | AJ24: =SUM(RC[-4]:RC[-1]) -> 264.3 | AK24: 0 | AL24: 274.63 | AM24: 0 | AN24: 0 | AO24: =SUM(RC[-4]:RC[-1]) -> 274.63 | AP24: 0 | AQ24: 236.24 | AR24: 1140.8 | AS24: 0 | AT24: =SUM(RC[-4]:RC[-1]) -> 1377.04 | AU24: 0 | AV24: 69.61 | AW24: 0 | AX24: 0 | AY24: =SUM(RC[-4]:RC[-1]) -> 69.61 | AZ24: 0 | BA24: 174.9 | BB24: 0.32 | BC24: 0 | BD24: =SUM(RC[-4]:RC[-1]) -> 175.22 | BE24: 0 | BF24: 3085 | BG24: 30 | BH24: 0 | BI24: =SUM(RC[-4]:RC[-1]) -> 3115 | BJ24: 0 | BK24: 54.765999999999998 | BL24: 0 | BM24: 0 | BN24: =SUM(RC[-4]:RC[-1]) -> 54.765999999999998 | BO24: 0 | BP24: 43.38 | BQ24: 0 | BR24: 0 | BS24: =SUM(RC[-4]:RC[-1]) -> 43.38
A25: CHROMIUM | B25: 2 | C25: 0 | D25: 6.99 | E25: 1.4890889999999997 | F25: =SUM(RC[-4]:RC[-1]) -> 10.479089 | G25: 3 | H25: 0 | I25: 262.10000000000002 | J25: 3.8534708999999987 | K25: =SUM(RC[-4]:RC[-1]) -> 268.95347090000001 | L25: 5 | M25: 0 | N25: 212.4 | O25: 15.032773800000003 | P25: =SUM(RC[-4]:RC[-1]) -> 232.43277380000001 | Q25: 40 | R25: 0 | S25: 768.8 | T25: 147.57129920000003 | U25: =SUM(RC[-4]:RC[-1]) -> 956.37129919999995 | V25: 3 | W25: 0 | X25: 4.5999999999999999E-2 | Y25: 7.8593038000000019 | Z25: =SUM(RC[-4]:RC[-1]) -> 10.905303800000002 | AA25: 2 | AB25: 0 | AC25: 0 | AD25: 6.0193115999999982 | AE25: =SUM(RC[-4]:RC[-1]) -> 8.0193115999999982 | AF25: 2 | AG25: 0 | AH25: 20.76 | AI25: 9.505540799999995 | AJ25: =SUM(RC[-4]:RC[-1]) -> 32.265540799999997 | AK25: 7 | AL25: 0 | AM25: 38.85 | AN25: 15.862548500000003 | AO25: =SUM(RC[-4]:RC[-1]) -> 61.712548500000004 | AP25: 3 | AQ25: 0 | AR25: 144.5 | AS25: 11.267937099999999 | AT25: =SUM(RC[-4]:RC[-1]) -> 158.76793710000001 | AU25: 2 | AV25: 0 | AW25: 47.83 | AX25: 5.6759722000000012 | AY25: =SUM(RC[-4]:RC[-1]) -> 55.505972200000002 | AZ25: 2 | BA25: 0 | BB25: 22.57 | BC25: 11.405041599999999 | BD25: =SUM(RC[-4]:RC[-1]) -> 35.975041599999997 | BE25: 27 | BF25: 0 | BG25: 296.39999999999998 | BH25: 98.560331099999914 | BI25: =SUM(RC[-4]:RC[-1]) -> 421.96033109999991 | BJ25: 1 | BK25: 0 | BL25: 3.22 | BM25: 6.0476086000000064 | BN25: =SUM(RC[-4]:RC[-1]) -> 10.267608600000006 | BO25: 1 | BP25: 0 | BQ25: 0 | BR25: 2.8632354000000002 | BS25: =SUM(RC[-4]:RC[-1]) -> 3.8632354000000002
A26: CHROMIUM VI | B26: 0 | C26: 0 | D26: 0 | E26: 0 | F26: =SUM(RC[-4]:RC[-1]) -> 0 | G26: 0 | H26: 0 | I26: 0 | J26: 0 | K26: =SUM(RC[-4]:RC[-1]) -> 0 | L26: 0 | M26: 0 | N26: 0 | O26: 0 | P26: =SUM(RC[-4]:RC[-1]) -> 0 | Q26: 0 | R26: 50 | S26: 0 | T26: 0 | U26: =SUM(RC[-4]:RC[-1]) -> 50 | V26: 0 | W26: 0 | X26: 0 | Y26: 0 | Z26: =SUM(RC[-4]:RC[-1]) -> 0 | AA26: 0 | AB26: 0 | AC26: 0 | AD26: 0 | AE26: =SUM(RC[-4]:RC[-1]) -> 0 | AF26: 0 | AG26: 0 | AH26: 0 | AI26: 0 | AJ26: =SUM(RC[-4]:RC[-1]) -> 0 | AK26: 0 | AL26: 492.79 | AM26: 0 | AN26: 0 | AO26: =SUM(RC[-4]:RC[-1]) -> 492.79 | AP26: 0 | AQ26: 0 | AR26: 0 | AS26: 0 | AT26: =SUM(RC[-4]:RC[-1]) -> 0 | AU26: 0 | AV26: 0 | AW26: 0 | AX26: 0 | AY26: =SUM(RC[-4]:RC[-1]) -> 0 | AZ26: 0 | BA26: 0 | BB26: 0 | BC26: 0 | BD26: =SUM(RC[-4]:RC[-1]) -> 0 | BE26: 0 | BF26: 0 | BG26: 0 | BH26: 0 | BI26: =SUM(RC[-4]:RC[-1]) -> 0 | BJ26: 0 | BK26: 0 | BL26: 0 | BM26: 0 | BN26: =SUM(RC[-4]:RC[-1]) -> 0 | BO26: 0 | BP26: 0 | BQ26: 0 | BR26: 0 | BS26: =SUM(RC[-4]:RC[-1]) -> 0
A27: CHRYSENE | B27: 0 | C27: 9.42 | D27: 0 | E27: 0.168694240794 | F27: =SUM(RC[-4]:RC[-1]) -> 9.5886942407940001 | G27: 0 | H27: 4.4400000000000004 | I27: 0 | J27: 0.43319877014799996 | K27: =SUM(RC[-4]:RC[-1]) -> 4.873198770148 | L27: 0 | M27: 24.92 | N27: 0 | O27: 1.8459259305640001 | P27: =SUM(RC[-4]:RC[-1]) -> 26.765925930564002 | Q27: 0 | R27: 9.4700000000000006 | S27: 0 | T27: 31.048955461693986 | U27: =SUM(RC[-4]:RC[-1]) -> 40.518955461693984 | V27: 0 | W27: 20.37 | X27: 0 | Y27: 4.2358275031459973 | Z27: =SUM(RC[-4]:RC[-1]) -> 24.605827503145999 | AA27: 0 | AB27: 11.43 | AC27: 0 | AD27: 1.6188644267320003 | AE27: =SUM(RC[-4]:RC[-1]) -> 13.048864426731999 | AF27: 0 | AG27: 0.56000000000000005 | AH27: 0 | AI27: 1.3001026673099998 | AJ27: =SUM(RC[-4]:RC[-1]) -> 1.8601026673099998 | AK27: 0 | AL27: 19.350000000000001 | AM27: 0 | AN27: 3.9436620309419994 | AO27: =SUM(RC[-4]:RC[-1]) -> 23.293662030942002 | AP27: 0 | AQ27: 9.93 | AR27: 0 | AS27: 3.773825321423999 | AT27: =SUM(RC[-4]:RC[-1]) -> 13.703825321423999 | AU27: 0 | AV27: 8.94 | AW27: 0 | AX27: 0.8444832504059997 | AY27: =SUM(RC[-4]:RC[-1]) -> 9.7844832504059998 | AZ27: 0 | BA27: 0 | BB27: 0 | BC27: 1.3337855264620007 | BD27: =SUM(RC[-4]:RC[-1]) -> 1.3337855264620007 | BE27: 0 | BF27: 0.36 | BG27: 0 | BH27: 20.693563124840004 | BI27: =SUM(RC[-4]:RC[-1]) -> 21.053563124840004 | BJ27: 0 | BK27: 0 | BL27: 0 | BM27: 0.94240795717599946 | BN27: =SUM(RC[-4]:RC[-1]) -> 0.94240795717599946 | BO27: 0 | BP27: 0.36 | BQ27: 0 | BR27: 0.58167051250399959 | BS27: =SUM(RC[-4]:RC[-1]) -> 0.94167051250399958
A28: COBALT | B28: 0 | C28: 0 | D28: 25.44 | E28: 0 | F28: =SUM(RC[-4]:RC[-1]) -> 25.44 | G28: 0 | H28: 0 | I28: 281.98 | J28: 0 | K28: =SUM(RC[-4]:RC[-1]) -> 281.98 | L28: 0 | M28: 0 | N28: 158.32 | O28: 0 | P28: =SUM(RC[-4]:RC[-1]) -> 158.32 | Q28: 0 | R28: 0 | S28: 2686.68 | T28: 0 | U28: =SUM(RC[-4]:RC[-1]) -> 2686.68 | V28: 0 | W28: 0 | X28: 0.14000000000000001 | Y28: 0 | Z28: =SUM(RC[-4]:RC[-1]) -> 0.14000000000000001 | AA28: 0 | AB28: 0 | AC28: 0 | AD28: 0 | AE28: =SUM(RC[-4]:RC[-1]) -> 0 | AF28: 0 | AG28: 0 | AH28: 73.290000000000006 | AI28: 0 | AJ28: =SUM(RC[-4]:RC[-1]) -> 73.290000000000006 | AK28: 0 | AL28: 0 | AM28: 31.24 | AN28: 0 | AO28: =SUM(RC[-4]:RC[-1]) -> 31.24 | AP28: 0 | AQ28: 0 | AR28: 444.3 | AS28: 0 | AT28: =SUM(RC[-4]:RC[-1]) -> 444.3 | AU28: 0 | AV28: 0 | AW28: 117.56 | AX28: 0 | AY28: =SUM(RC[-4]:RC[-1]) -> 117.56 | AZ28: 0 | BA28: 0 | BB28: 28.41 | BC28: 0 | BD28: =SUM(RC[-4]:RC[-1]) -> 28.41 | BE28: 0 | BF28: 0 | BG28: 453.55 | BH28: 0 | BI28: =SUM(RC[-4]:RC[-1]) -> 453.55 | BJ28: 0 | BK28: 0 | BL28: 6.97 | BM28: 0 | BN28: =SUM(RC[-4]:RC[-1]) -> 6.97 | BO28: 0 | BP28: 0 | BQ28: 0 | BR28: 0 | BS28: =SUM(RC[-4]:RC[-1]) -> 0
A29: COKE OVEN GAS | B29: 0 | C29: 0 | D29: 0 | E29: 0 | F29: =SUM(RC[-4]:RC[-1]) -> 0 | G29: 0 | H29: 0 | I29: 0 | J29: 0 | K29: =SUM(RC[-4]:RC[-1]) -> 0 | L29: 0 | M29: 0 | N29: 0 | O29: 0 | P29: =SUM(RC[-4]:RC[-1]) -> 0 | Q29: 0 | R29: 0 | S29: 0 | T29: 0 | U29: =SUM(RC[-4]:RC[-1]) -> 0 | V29: 0 | W29: 0 | X29: 0 | Y29: 0 | Z29: =SUM(RC[-4]:RC[-1]) -> 0 | AA29: 0 | AB29: 0 | AC29: 0 | AD29: 0 | AE29: =SUM(RC[-4]:RC[-1]) -> 0 | AF29: 0 | AG29: 0 | AH29: 0 | AI29: 0 | AJ29: =SUM(RC[-4]:RC[-1]) -> 0 | AK29: 0 | AL29: 0 | AM29: 0 | AN29: 0 | AO29: =SUM(RC[-4]:RC[-1]) -> 0 | AP29: 0 | AQ29: 0 | AR29: 0 | AS29: 0 | AT29: =SUM(RC[-4]:RC[-1]) -> 0 | AU29: 0 | AV29: 0 | AW29: 0 | AX29: 0 | AY29: =SUM(RC[-4]:RC[-1]) -> 0 | AZ29: 0 | BA29: 0 | BB29: 0 | BC29: 0 | BD29: =SUM(RC[-4]:RC[-1]) -> 0 | BE29: 0 | BF29: 0 | BG29: 0 | BH29: 0 | BI29: =SUM(RC[-4]:RC[-1]) -> 0 | BJ29: 0 | BK29: 0 | BL29: 0 | BM29: 0 | BN29: =SUM(RC[-4]:RC[-1]) -> 0 | BO29: 0 | BP29: 0 | BQ29: 0 | BR29: 0 | BS29: =SUM(RC[-4]:RC[-1]) -> 0
A30: COPPER | B30: 8 | C30: 0 | D30: 0.63 | E30: 0 | F30: =SUM(RC[-4]:RC[-1]) -> 8.6300000000000008 | G30: 15 | H30: 0 | I30: 1240.8399999999999 | J30: 0 | K30: =SUM(RC[-4]:RC[-1]) -> 1255.8399999999999 | L30: 27 | M30: 0 | N30: 1015.25 | O30: 0 | P30: =SUM(RC[-4]:RC[-1]) -> 1042.25 | Q30: 184 | R30: 0 | S30: 149.94999999999999 | T30: 14.04 | U30: =SUM(RC[-4]:RC[-1]) -> 347.99 | V30: 12 | W30: 0 | X30: 0.01 | Y30: 0 | Z30: =SUM(RC[-4]:RC[-1]) -> 12.01 | AA30: 12 | AB30: 0 | AC30: 0 | AD30: 0 | AE30: =SUM(RC[-4]:RC[-1]) -> 12 | AF30: 10 | AG30: 0 | AH30: 7.05 | AI30: 0 | AJ30: =SUM(RC[-4]:RC[-1]) -> 17.05 | AK30: 31 | AL30: 0 | AM30: 40.42 | AN30: 0.03 | AO30: =SUM(RC[-4]:RC[-1]) -> 71.45 | AP30: 13 | AQ30: 0 | AR30: 101.24 | AS30: 0 | AT30: =SUM(RC[-4]:RC[-1]) -> 114.24 | AU30: 8 | AV30: 0 | AW30: 43.7 | AX30: 0 | AY30: =SUM(RC[-4]:RC[-1]) -> 51.7 | AZ30: 10 | BA30: 0 | BB30: 152.54 | BC30: 3.2850000000000001 | BD30: =SUM(RC[-4]:RC[-1]) -> 165.82499999999999 | BE30: 126 | BF30: 0 | BG30: 2255.6999999999998 | BH30: 1.4999999999999999E-2 | BI30: =SUM(RC[-4]:RC[-1]) -> 2381.7149999999997 | BJ30: 4 | BK30: 0 | BL30: 1.98 | BM30: 0 | BN30: =SUM(RC[-4]:RC[-1]) -> 5.98 | BO30: 4 | BP30: 0 | BQ30: 0 | BR30: 0 | BS30: =SUM(RC[-4]:RC[-1]) -> 4
A31: DIBENZAHAN | B31: 0 | C31: 0 | D31: 0 | E31: 0 | F31: =SUM(RC[-4]:RC[-1]) -> 0 | G31: 0 | H31: 0 | I31: 0 | J31: 0 | K31: =SUM(RC[-4]:RC[-1]) -> 0 | L31: 0 | M31: 0 | N31: 0 | O31: 0 | P31: =SUM(RC[-4]:RC[-1]) -> 0 | Q31: 0 | R31: 0 | S31: 0 | T31: 0 | U31: =SUM(RC[-4]:RC[-1]) -> 0 | V31: 0 | W31: 0 | X31: 0 | Y31: 0 | Z31: =SUM(RC[-4]:RC[-1]) -> 0 | AA31: 0 | AB31: 0 | AC31: 0 | AD31: 0 | AE31: =SUM(RC[-4]:RC[-1]) -> 0 | AF31: 0 | AG31: 0 | AH31: 0 | AI31: 0 | AJ31: =SUM(RC[-4]:RC[-1]) -> 0 | AK31: 0 | AL31: 0 | AM31: 0 | AN31: 0 | AO31: =SUM(RC[-4]:RC[-1]) -> 0 | AP31: 0 | AQ31: 0 | AR31: 0 | AS31: 0 | AT31: =SUM(RC[-4]:RC[-1]) -> 0 | AU31: 0 | AV31: 0 | AW31: 0 | AX31: 0 | AY31: =SUM(RC[-4]:RC[-1]) -> 0 | AZ31: 0 | BA31: 0 | BB31: 0 | BC31: 0 | BD31: =SUM(RC[-4]:RC[-1]) -> 0 | BE31: 0 | BF31: 0 | BG31: 0 | BH31: 0 | BI31: =SUM(RC[-4]:RC[-1]) -> 0 | BJ31: 0 | BK31: 0 | BL31: 0 | BM31: 0 | BN31: =SUM(RC[-4]:RC[-1]) -> 0 | BO31: 0 | BP31: 0 | BQ31: 0 | BR31: 0 | BS31: =SUM(RC[-4]:RC[-1]) -> 0
A32: BIBROMOET,12 | B32: 0 | C32: 1.2589999999999999 | D32: 0 | E32: 0 | F32: =SUM(RC[-4]:RC[-1]) -> 1.2589999999999999 | G32: 0 | H32: 3.43 | I32: 0 | J32: 0 | K32: =SUM(RC[-4]:RC[-1]) -> 3.43 | L32: 0 | M32: 4.1500000000000004 | N32: 2.36 | O32: 0 | P32: =SUM(RC[-4]:RC[-1]) -> 6.51 | Q32: 0 | R32: 54.42 | S32: 0 | T32: 0 | U32: =SUM(RC[-4]:RC[-1]) -> 54.42 | V32: 0 | W32: 3.13 | X32: 0 | Y32: 0 | Z32: =SUM(RC[-4]:RC[-1]) -> 3.13 | AA32: 0 | AB32: 1.68 | AC32: 0 | AD32: 0 | AE32: =SUM(RC[-4]:RC[-1]) -> 1.68 | AF32: 0 | AG32: 3.02 | AH32: 0 | AI32: 0 | AJ32: =SUM(RC[-4]:RC[-1]) -> 3.02 | AK32: 0 | AL32: 6.72 | AM32: 0 | AN32: 0 | AO32: =SUM(RC[-4]:RC[-1]) -> 6.72 | AP32: 0 | AQ32: 3.14 | AR32: 0 | AS32: 0 | AT32: =SUM(RC[-4]:RC[-1]) -> 3.14 | AU32: 0 | AV32: 1.7 | AW32: 0 | AX32: 0 | AY32: =SUM(RC[-4]:RC[-1]) -> 1.7 | AZ32: 0 | BA32: 3.52 | BB32: 0.24 | BC32: 0 | BD32: =SUM(RC[-4]:RC[-1]) -> 3.76 | BE32: 0 | BF32: 22.43 | BG32: 29.39 | BH32: 0 | BI32: =SUM(RC[-4]:RC[-1]) -> 51.82 | BJ32: 0 | BK32: 1.56 | BL32: 0 | BM32: 0 | BN32: =SUM(RC[-4]:RC[-1]) -> 1.56 | BO32: 0 | BP32: 0.73 | BQ32: 0 | BR32: 0 | BS32: =SUM(RC[-4]:RC[-1]) -> 0.73
A33: DIBUTYL PHTH | B33: 0 | C33: 4152.92 | D33: 0.03 | E33: 0 | F33: =SUM(RC[-4]:RC[-1]) -> 4152.95 | G33: 0 | H33: 14680.3 | I33: 4.0599999999999996 | J33: 0 | K33: =SUM(RC[-4]:RC[-1]) -> 14684.359999999999 | L33: 0 | M33: 12709 | N33: 0.08 | O33: 0 | P33: =SUM(RC[-4]:RC[-1]) -> 12709.08 | Q33: 0 | R33: 72183.899999999994 | S33: 0.3574 | T33: 0 | U33: =SUM(RC[-4]:RC[-1]) -> 72184.257399999988 | V33: 0 | W33: 9018.7999999999993 | X33: 0 | Y33: 0 | Z33: =SUM(RC[-4]:RC[-1]) -> 9018.7999999999993 | AA33: 0 | AB33: 6792.45 | AC33: 0 | AD33: 0 | AE33: =SUM(RC[-4]:RC[-1]) -> 6792.45 | AF33: 0 | AG33: 12703.46 | AH33: 1.07 | AI33: 0 | AJ33: =SUM(RC[-4]:RC[-1]) -> 12704.529999999999 | AK33: 0 | AL33: 21762.11 | AM33: 2957.43 | AN33: 0 | AO33: =SUM(RC[-4]:RC[-1]) -> 24719.54 | AP33: 0 | AQ33: 7992.47 | AR33: 105.13 | AS33: 0 | AT33: =SUM(RC[-4]:RC[-1]) -> 8097.6 | AU33: 0 | AV33: 7823.3 | AW33: 74.709999999999994 | AX33: 0 | AY33: =SUM(RC[-4]:RC[-1]) -> 7898.01 | AZ33: 0 | BA33: 12425.73 | BB33: 8.25 | BC33: 0 | BD33: =SUM(RC[-4]:RC[-1]) -> 12433.98 | BE33: 0 | BF33: 47236.27 | BG33: 0.22 | BH33: 0 | BI33: =SUM(RC[-4]:RC[-1]) -> 47236.49 | BJ33: 0 | BK33: 5748.27 | BL33: 0 | BM33: 0 | BN33: =SUM(RC[-4]:RC[-1]) -> 5748.27 | BO33: 0 | BP33: 3194.33 | BQ33: 0 | BR33: 0 | BS33: =SUM(RC[-4]:RC[-1]) -> 3194.33
A34: DICHLOROETH12 | B34: 0 | C34: 17.68 | D34: 294.95999999999998 | E34: 0 | F34: =SUM(RC[-4]:RC[-1]) -> 312.64 | G34: 0 | H34: 51.73 | I34: 682.44 | J34: 0 | K34: =SUM(RC[-4]:RC[-1]) -> 734.17000000000007 | L34: 0 | M34: 56.889000000000003 | N34: 14.22 | O34: 0 | P34: =SUM(RC[-4]:RC[-1]) -> 71.109000000000009 | Q34: 0 | R34: 757.78 | S34: 34.840000000000003 | T34: 0 | U34: =SUM(RC[-4]:RC[-1]) -> 792.62 | V34: 0 | W34: 42.29 | X34: 0 | Y34: 0 | Z34: =SUM(RC[-4]:RC[-1]) -> 42.29 | AA34: 0 | AB34: 25.07 | AC34: 0 | AD34: 0 | AE34: =SUM(RC[-4]:RC[-1]) -> 25.07 | AF34: 0 | AG34: 45.35 | AH34: 180.4 | AI34: 0 | AJ34: =SUM(RC[-4]:RC[-1]) -> 225.75 | AK34: 0 | AL34: 93.29 | AM34: 0 | AN34: 0 | AO34: =SUM(RC[-4]:RC[-1]) -> 93.29 | AP34: 0 | AQ34: 41.27 | AR34: 5594.4 | AS34: 0 | AT34: =SUM(RC[-4]:RC[-1]) -> 5635.67 | AU34: 0 | AV34: 26.4 | AW34: 0 | AX34: 0 | AY34: =SUM(RC[-4]:RC[-1]) -> 26.4 | AZ34: 0 | BA34: 50.17 | BB34: 18.14 | BC34: 0 | BD34: =SUM(RC[-4]:RC[-1]) -> 68.31 | BE34: 0 | BF34: 360.57 | BG34: 38.619999999999997 | BH34: 0 | BI34: =SUM(RC[-4]:RC[-1]) -> 399.19 | BJ34: 0 | BK34: 22.67 | BL34: 0 | BM34: 0 | BN34: =SUM(RC[-4]:RC[-1]) -> 22.67 | BO34: 0 | BP34: 11.36 | BQ34: 0 | BR34: 0 | BS34: =SUM(RC[-4]:RC[-1]) -> 11.36
A35: DIEYLHEX PHT | B35: 0 | C35: 0 | D35: 0 | E35: 0 | F35: =SUM(RC[-4]:RC[-1]) -> 0 | G35: 0 | H35: 0 | I35: 0 | J35: 0 | K35: =SUM(RC[-4]:RC[-1]) -> 0 | L35: 0 | M35: 0 | N35: 0 | O35: 0 | P35: =SUM(RC[-4]:RC[-1]) -> 0 | Q35: 0 | R35: 0 | S35: 254 | T35: 0 | U35: =SUM(RC[-4]:RC[-1]) -> 254 | V35: 0 | W35: 0 | X35: 0 | Y35: 0 | Z35: =SUM(RC[-4]:RC[-1]) -> 0 | AA35: 0 | AB35: 0 | AC35: 0 | AD35: 0 | AE35: =SUM(RC[-4]:RC[-1]) -> 0 | AF35: 0 | AG35: 0 | AH35: 0 | AI35: 0 | AJ35: =SUM(RC[-4]:RC[-1]) -> 0 | AK35: 0 | AL35: 0 | AM35: 0 | AN35: 0 | AO35: =SUM(RC[-4]:RC[-1]) -> 0 | AP35: 0 | AQ35: 0 | AR35: 2 | AS35: 0 | AT35: =SUM(RC[-4]:RC[-1]) -> 2 | AU35: 0 | AV35: 0 | AW35: 0 | AX35: 0 | AY35: =SUM(RC[-4]:RC[-1]) -> 0 | AZ35: 0 | BA35: 0 | BB35: 14.35 | BC35: 0 | BD35: =SUM(RC[-4]:RC[-1]) -> 14.35 | BE35: 0 | BF35: 0 | BG35: 0 | BH35: 0 | BI35: =SUM(RC[-4]:RC[-1]) -> 0 | BJ35: 0 | BK35: 0 | BL35: 0 | BM35: 0 | BN35: =SUM(RC[-4]:RC[-1]) -> 0 | BO35: 0 | BP35: 0 | BQ35: 0 | BR35: 0 | BS35: =SUM(RC[-4]:RC[-1]) -> 0
A36: ETHYLBENZENE | B36: 31954 | C36: 2366.3000000000002 | D36: 887.99 | E36: 1303.2948946580002 | F36: =SUM(RC[-4]:RC[-1]) -> 36511.584894658001 | G36: 73860 | H36: 8134.12 | I36: 4020.06 | J36: 3336.1284354219997 | K36: =SUM(RC[-4]:RC[-1]) -> 89350.30843542199 | L36: 86771 | M36: 7298.2 | N36: 2747.9 | O36: 15844.816398192001 | P36: =SUM(RC[-4]:RC[-1]) -> 112661.916398192 | Q36: 894703 | R36: 86582.71 | S36: 3028.6 | T36: 300641.50933512679 | U36: =SUM(RC[-4]:RC[-1]) -> 1284955.8193351268 | V36: 54207 | W36: 5223.2700000000004 | X36: 0 | Y36: 48236.63168678998 | Z36: =SUM(RC[-4]:RC[-1]) -> 107666.90168678999 | AA36: 43344 | AB36: 3786.42 | AC36: 0 | AD36: 17512.354103172991 | AE36: =SUM(RC[-4]:RC[-1]) -> 64642.774103172989 | AF36: 56088 | AG36: 7049.6 | AH36: 46.24 | AI36: 11466.937155029009 | AJ36: =SUM(RC[-4]:RC[-1]) -> 74650.777155029005 | AK36: 121455 | AL36: 17316.78 | AM36: 0 | AN36: 40798.689639081997 | AO36: =SUM(RC[-4]:RC[-1]) -> 179570.469639082 | AP36: 55305 | AQ36: 4709.32 | AR36: 1554.16 | AS36: 41670.50505663603 | AT36: =SUM(RC[-4]:RC[-1]) -> 103238.98505663604 | AU36: 40487 | AV36: 4307.09 | AW36: 2487.7600000000002 | AX36: 7443.1207444559959 | AY36: =SUM(RC[-4]:RC[-1]) -> 54724.970744455997 | AZ36: 47255 | BA36: 7018.38 | BB36: 689.14 | BC36: 11680.147817825004 | BD36: =SUM(RC[-4]:RC[-1]) -> 66642.667817825 | BE36: 511396 | BF36: 47232.86 | BG36: 115.59 | BH36: 200012.42797499709 | BI36: =SUM(RC[-4]:RC[-1]) -> 758756.87797499704 | BJ36: 20341 | BK36: 3235.1 | BL36: 76.5 | BM36: 8590.8718801300038 | BN36: =SUM(RC[-4]:RC[-1]) -> 32243.471880130004 | BO36: 13157 | BP36: 1771.4 | BQ36: 0 | BR36: 5702.4161211810006 | BS36: =SUM(RC[-4]:RC[-1]) -> 20630.816121181
A37: ETHYLENE OXI | B37: 0 | C37: 482.05 | D37: 35.6 | E37: 0 | F37: =SUM(RC[-4]:RC[-1]) -> 517.65 | G37: 0 | H37: 2301.1 | I37: 20.311 | J37: 0 | K37: =SUM(RC[-4]:RC[-1]) -> 2321.4110000000001 | L37: 0 | M37: 2173.39 | N37: 0.42299999999999999 | O37: 0 | P37: =SUM(RC[-4]:RC[-1]) -> 2173.8129999999996 | Q37: 0 | R37: 26513.85 | S37: 22.21 | T37: 0 | U37: =SUM(RC[-4]:RC[-1]) -> 26536.059999999998 | V37: 0 | W37: 1387.84 | X37: 0 | Y37: 0 | Z37: =SUM(RC[-4]:RC[-1]) -> 1387.84 | AA37: 0 | AB37: 788.46 | AC37: 0 | AD37: 0 | AE37: =SUM(RC[-4]:RC[-1]) -> 788.46 | AF37: 0 | AG37: 1474.59 | AH37: 5.37 | AI37: 0 | AJ37: =SUM(RC[-4]:RC[-1]) -> 1479.9599999999998 | AK37: 0 | AL37: 3214.45 | AM37: 0 | AN37: 0 | AO37: =SUM(RC[-4]:RC[-1]) -> 3214.45 | AP37: 0 | AQ37: 1496 | AR37: 184.5 | AS37: 0 | AT37: =SUM(RC[-4]:RC[-1]) -> 1680.5 | AU37: 0 | AV37: 1032.58 | AW37: 0 | AX37: 0 | AY37: =SUM(RC[-4]:RC[-1]) -> 1032.58 | AZ37: 0 | BA37: 1745.42 | BB37: 57.93 | BC37: 0 | BD37: =SUM(RC[-4]:RC[-1]) -> 1803.3500000000001 | BE37: 0 | BF37: 20529.62 | BG37: 409.62 | BH37: 0 | BI37: =SUM(RC[-4]:RC[-1]) -> 20939.239999999998 | BJ37: 0 | BK37: 851.25 | BL37: 0 | BM37: 0 | BN37: =SUM(RC[-4]:RC[-1]) -> 851.25 | BO37: 0 | BP37: 488.05 | BQ37: 0 | BR37: 0 | BS37: =SUM(RC[-4]:RC[-1]) -> 488.05
A38: FLUORANTHENE | B38: 0 | C38: 10.220000000000001 | D38: 0 | E38: 0.14601928119600005 | F38: =SUM(RC[-4]:RC[-1]) -> 10.366019281196001 | G38: 0 | H38: 4.82 | I38: 0 | J38: 0.37497048782399989 | K38: =SUM(RC[-4]:RC[-1]) -> 5.1949704878240004 | L38: 0 | M38: 27.04 | N38: 0 | O38: 1.5985259744119995 | P38: =SUM(RC[-4]:RC[-1]) -> 28.638525974411998 | Q38: 0 | R38: 10.28 | S38: 0 | T38: 26.982909670526009 | U38: =SUM(RC[-4]:RC[-1]) -> 37.262909670526007 | V38: 0 | W38: 22.11 | X38: 0 | Y38: 3.6666011256420012 | Z38: =SUM(RC[-4]:RC[-1]) -> 25.776601125641999 | AA38: 0 | AB38: 12.42 | AC38: 0 | AD38: 1.4012721464639994 | AE38: =SUM(RC[-4]:RC[-1]) -> 13.821272146463999 | AF38: 0 | AG38: 0.62 | AH38: 0 | AI38: 1.1287727728880004 | AJ38: =SUM(RC[-4]:RC[-1]) -> 1.7487727728880005 | AK38: 0 | AL38: 21.01 | AM38: 0 | AN38: 3.4136006265940009 | AO38: =SUM(RC[-4]:RC[-1]) -> 24.423600626594002 | AP38: 0 | AQ38: 10.78 | AR38: 0 | AS38: 3.2673934789639976 | AT38: =SUM(RC[-4]:RC[-1]) -> 14.047393478963997 | AU38: 0 | AV38: 9.7100000000000009 | AW38: 0 | AX38: 0.73097363407400007 | AY38: =SUM(RC[-4]:RC[-1]) -> 10.440973634074002 | AZ38: 0 | BA38: 0 | BB38: 0 | BC38: 1.1545072218819998 | BD38: =SUM(RC[-4]:RC[-1]) -> 1.1545072218819998 | BE38: 0 | BF38: 0.38 | BG38: 0 | BH38: 17.912333904727998 | BI38: =SUM(RC[-4]:RC[-1]) -> 18.292333904727997 | BJ38: 0 | BK38: 0 | BL38: 0 | BM38: 0.81573609986600004 | BN38: =SUM(RC[-4]:RC[-1]) -> 0.81573609986600004 | BO38: 0 | BP38: 0.38 | BQ38: 0 | BR38: 0.50348703380000015 | BS38: =SUM(RC[-4]:RC[-1]) -> 0.88348703380000015
A39: FLUORENE | B39: 0 | C39: 0 | D39: 0 | E39: 0 | F39: =SUM(RC[-4]:RC[-1]) -> 0 | G39: 0 | H39: 0 | I39: 0 | J39: 0 | K39: =SUM(RC[-4]:RC[-1]) -> 0 | L39: 0 | M39: 0 | N39: 0 | O39: 0 | P39: =SUM(RC[-4]:RC[-1]) -> 0 | Q39: 0 | R39: 0 | S39: 0 | T39: 0 | U39: =SUM(RC[-4]:RC[-1]) -> 0 | V39: 0 | W39: 0 | X39: 0 | Y39: 0 | Z39: =SUM(RC[-4]:RC[-1]) -> 0 | AA39: 0 | AB39: 0 | AC39: 0 | AD39: 0 | AE39: =SUM(RC[-4]:RC[-1]) -> 0 | AF39: 0 | AG39: 0 | AH39: 0 | AI39: 0 | AJ39: =SUM(RC[-4]:RC[-1]) -> 0 | AK39: 0 | AL39: 0 | AM39: 0 | AN39: 0 | AO39: =SUM(RC[-4]:RC[-1]) -> 0 | AP39: 0 | AQ39: 0 | AR39: 0 | AS39: 0 | AT39: =SUM(RC[-4]:RC[-1]) -> 0 | AU39: 0 | AV39: 0 | AW39: 0 | AX39: 0 | AY39: =SUM(RC[-4]:RC[-1]) -> 0 | AZ39: 0 | BA39: 0 | BB39: 0 | BC39: 0 | BD39: =SUM(RC[-4]:RC[-1]) -> 0 | BE39: 0 | BF39: 0 | BG39: 0 | BH39: 0 | BI39: =SUM(RC[-4]:RC[-1]) -> 0 | BJ39: 0 | BK39: 0 | BL39: 0 | BM39: 0 | BN39: =SUM(RC[-4]:RC[-1]) -> 0 | BO39: 0 | BP39: 0 | BQ39: 0 | BR39: 0 | BS39: =SUM(RC[-4]:RC[-1]) -> 0
A40: FORMALDEHYDE | B40: 34342 | C40: 4004.4 | D40: 93.79 | E40: 4999.2217442999981 | F40: =SUM(RC[-4]:RC[-1]) -> 43439.4117443 | G40: 75423 | H40: 2149.6999999999998 | I40: 8323.4 | J40: 12811.940331897 | K40: =SUM(RC[-4]:RC[-1]) -> 98708.040331896991 | L40: 114667 | M40: 10601.1 | N40: 1141.69 | O40: 47885.550439078004 | P40: =SUM(RC[-4]:RC[-1]) -> 174295.34043907802 | Q40: 982286 | R40: 6229.92 | S40: 151973.49 | T40: 434196.84081546002 | U40: =SUM(RC[-4]:RC[-1]) -> 1574686.2508154602 | V40: 57538 | W40: 8681.64 | X40: 128.59 | Y40: 26265.131548559009 | Z40: =SUM(RC[-4]:RC[-1]) -> 92613.361548559013 | AA40: 47844 | AB40: 4885.8 | AC40: 0 | AD40: 16069.507488608004 | AE40: =SUM(RC[-4]:RC[-1]) -> 68799.307488607999 | AF40: 53184 | AG40: 365.86 | AH40: 1142.0999999999999 | AI40: 29856.334075596002 | AJ40: =SUM(RC[-4]:RC[-1]) -> 84548.294075596001 | AK40: 132790 | AL40: 8464.36 | AM40: 706.58 | AN40: 53510.35508593799 | AO40: =SUM(RC[-4]:RC[-1]) -> 195471.29508593795 | AP40: 60958 | AQ40: 4245.58 | AR40: 11043.95 | AS40: 31793.508878626013 | AT40: =SUM(RC[-4]:RC[-1]) -> 108041.03887862602 | AU40: 41001 | AV40: 3918.87 | AW40: 8714.7000000000007 | AX40: 19322.307039845018 | AY40: =SUM(RC[-4]:RC[-1]) -> 72956.877039845029 | AZ40: 48136 | BA40: 225.89 | BB40: 2421.5100000000002 | BC40: 37770.548740114995 | BD40: =SUM(RC[-4]:RC[-1]) -> 88553.948740114996 | BE40: 689081 | BF40: 2842.95 | BG40: 2792.34 | BH40: 298867.13764177205 | BI40: =SUM(RC[-4]:RC[-1]) -> 993583.42764177197 | BJ40: 20807 | BK40: 117.75 | BL40: 3169.37 | BM40: 20850.205158774985 | BN40: =SUM(RC[-4]:RC[-1]) -> 44944.325158774984 | BO40: 15936 | BP40: 213.85 | BQ40: 0 | BR40: 10062.304734048001 | BS40: =SUM(RC[-4]:RC[-1]) -> 26212.154734048003
A41: GLYCOL ETHRS | B41: 0 | C41: 0 | D41: 0 | E41: 0 | F41: =SUM(RC[-4]:RC[-1]) -> 0 | G41: 0 | H41: 0 | I41: 0 | J41: 0 | K41: =SUM(RC[-4]:RC[-1]) -> 0 | L41: 0 | M41: 0 | N41: 0 | O41: 0 | P41: =SUM(RC[-4]:RC[-1]) -> 0 | Q41: 0 | R41: 0 | S41: 132 | T41: 0 | U41: =SUM(RC[-4]:RC[-1]) -> 132 | V41: 0 | W41: 0 | X41: 0 | Y41: 0 | Z41: =SUM(RC[-4]:RC[-1]) -> 0 | AA41: 0 | AB41: 0 | AC41: 0 | AD41: 0 | AE41: =SUM(RC[-4]:RC[-1]) -> 0 | AF41: 0 | AG41: 0 | AH41: 0 | AI41: 0 | AJ41: =SUM(RC[-4]:RC[-1]) -> 0 | AK41: 0 | AL41: 0 | AM41: 0 | AN41: 0 | AO41: =SUM(RC[-4]:RC[-1]) -> 0 | AP41: 0 | AQ41: 0 | AR41: 0 | AS41: 0 | AT41: =SUM(RC[-4]:RC[-1]) -> 0 | AU41: 0 | AV41: 0 | AW41: 0 | AX41: 0 | AY41: =SUM(RC[-4]:RC[-1]) -> 0 | AZ41: 0 | BA41: 0 | BB41: 0 | BC41: 0 | BD41: =SUM(RC[-4]:RC[-1]) -> 0 | BE41: 0 | BF41: 0 | BG41: 0 | BH41: 0 | BI41: =SUM(RC[-4]:RC[-1]) -> 0 | BJ41: 0 | BK41: 0 | BL41: 0 | BM41: 0 | BN41: =SUM(RC[-4]:RC[-1]) -> 0 | BO41: 0 | BP41: 0 | BQ41: 0 | BR41: 0 | BS41: =SUM(RC[-4]:RC[-1]) -> 0
A42: HEXCLBENZENE | B42: 0 | C42: 0 | D42: 0 | E42: 0 | F42: =SUM(RC[-4]:RC[-1]) -> 0 | G42: 0 | H42: 0 | I42: 0 | J42: 0 | K42: =SUM(RC[-4]:RC[-1]) -> 0 | L42: 0 | M42: 0 | N42: 0 | O42: 0 | P42: =SUM(RC[-4]:RC[-1]) -> 0 | Q42: 0 | R42: 0 | S42: 0 | T42: 0 | U42: =SUM(RC[-4]:RC[-1]) -> 0 | V42: 0 | W42: 0 | X42: 0 | Y42: 0 | Z42: =SUM(RC[-4]:RC[-1]) -> 0 | AA42: 0 | AB42: 0 | AC42: 0 | AD42: 0 | AE42: =SUM(RC[-4]:RC[-1]) -> 0 | AF42: 0 | AG42: 0 | AH42: 0 | AI42: 0 | AJ42: =SUM(RC[-4]:RC[-1]) -> 0 | AK42: 0 | AL42: 0 | AM42: 0 | AN42: 0 | AO42: =SUM(RC[-4]:RC[-1]) -> 0 | AP42: 0 | AQ42: 0 | AR42: 0 | AS42: 0 | AT42: =SUM(RC[-4]:RC[-1]) -> 0 | AU42: 0 | AV42: 0 | AW42: 0 | AX42: 0 | AY42: =SUM(RC[-4]:RC[-1]) -> 0 | AZ42: 0 | BA42: 0 | BB42: 0 | BC42: 0 | BD42: =SUM(RC[-4]:RC[-1]) -> 0 | BE42: 0 | BF42: 0 | BG42: 0 | BH42: 0 | BI42: =SUM(RC[-4]:RC[-1]) -> 0 | BJ42: 0 | BK42: 0 | BL42: 0 | BM42: 0 | BN42: =SUM(RC[-4]:RC[-1]) -> 0 | BO42: 0 | BP42: 0 | BQ42: 0 | BR42: 0 | BS42: =SUM(RC[-4]:RC[-1]) -> 0
A43: INDN(123CDPY | B43: 0 | C43: 0 | D43: 0 | E43: 1.7655396995199996E-2 | F43: =SUM(RC[-4]:RC[-1]) -> 1.7655396995199996E-2 | G43: 0 | H43: 0 | I43: 0 | J43: 4.4757799777399999E-2 | K43: =SUM(RC[-4]:RC[-1]) -> 4.4757799777399999E-2 | L43: 0 | M43: 0 | N43: 0 | O43: 0.20095828723920001 | P43: =SUM(RC[-4]:RC[-1]) -> 0.20095828723920001 | Q43: 0 | R43: 0 | S43: 0 | T43: 4.1131980801429995 | U43: =SUM(RC[-4]:RC[-1]) -> 4.1131980801429995 | V43: 0 | W43: 0 | X43: 0 | Y43: 0.60718137188180021 | Z43: =SUM(RC[-4]:RC[-1]) -> 0.60718137188180021 | AA43: 0 | AB43: 0 | AC43: 0 | AD43: 0.22219459756900006 | AE43: =SUM(RC[-4]:RC[-1]) -> 0.22219459756900006 | AF43: 0 | AG43: 0 | AH43: 0 | AI43: 0.1495902224638001 | AJ43: =SUM(RC[-4]:RC[-1]) -> 0.1495902224638001 | AK43: 0 | AL43: 0 | AM43: 0 | AN43: 0.52701626239800026 | AO43: =SUM(RC[-4]:RC[-1]) -> 0.52701626239800026 | AP43: 0 | AQ43: 0 | AR43: 0 | AS43: 0.52624921478260012 | AT43: =SUM(RC[-4]:RC[-1]) -> 0.52624921478260012 | AU43: 0 | AV43: 0 | AW43: 0 | AX43: 9.8046706517400037E-2 | AY43: =SUM(RC[-4]:RC[-1]) -> 9.8046706517400037E-2 | AZ43: 0 | BA43: 0 | BB43: 0 | BC43: 0.15468869550539996 | BD43: =SUM(RC[-4]:RC[-1]) -> 0.15468869550539996 | BE43: 0 | BF43: 0 | BG43: 0 | BH43: 2.7084868615139994 | BI43: =SUM(RC[-4]:RC[-1]) -> 2.7084868615139994 | BJ43: 0 | BK43: 0 | BL43: 0 | BM43: 0.10933955486519997 | BN43: =SUM(RC[-4]:RC[-1]) -> 0.10933955486519997 | BO43: 0 | BP43: 0 | BQ43: 0 | BR43: 7.216155487879998E-2 | BS43: =SUM(RC[-4]:RC[-1]) -> 7.216155487879998E-2
A44: LEAD | B44: 83 | C44: 0.01 | D44: 0.6 | E44: 0 | F44: =SUM(RC[-4]:RC[-1]) -> 83.61 | G44: 165 | H44: 0.03 | I44: 2453.25 | J44: 0 | K44: =SUM(RC[-4]:RC[-1]) -> 2618.2800000000002 | L44: 297 | M44: 2.5832999999999998E-2 | N44: 10738.19 | O44: 0 | P44: =SUM(RC[-4]:RC[-1]) -> 11035.215833 | Q44: 2012 | R44: 0.111 | S44: 234.92 | T44: 20.591999999999999 | U44: =SUM(RC[-4]:RC[-1]) -> 2267.623 | V44: 126 | W44: 0.02 | X44: 0.02 | Y44: 0 | Z44: =SUM(RC[-4]:RC[-1]) -> 126.03999999999999 | AA44: 127 | AB44: 0.04 | AC44: 0 | AD44: 0 | AE44: =SUM(RC[-4]:RC[-1]) -> 127.04 | AF44: 107 | AG44: 0 | AH44: 26.99 | AI44: 0 | AJ44: =SUM(RC[-4]:RC[-1]) -> 133.99 | AK44: 341 | AL44: 0.04 | AM44: 51.74 | AN44: 4.3999999999999997E-2 | AO44: =SUM(RC[-4]:RC[-1]) -> 392.82400000000001 | AP44: 147 | AQ44: 7.0000000000000001E-3 | AR44: 215.32 | AS44: 0 | AT44: =SUM(RC[-4]:RC[-1]) -> 362.327 | AU44: 89 | AV44: 0.02 | AW44: 76.87 | AX44: 0 | AY44: =SUM(RC[-4]:RC[-1]) -> 165.89 | AZ44: 110 | BA44: 0.02 | BB44: 346.86 | BC44: 4.8179999999999996 | BD44: =SUM(RC[-4]:RC[-1]) -> 461.69799999999998 | BE44: 1374 | BF44: 0.31 | BG44: 3903.8 | BH44: 2.1999999999999999E-2 | BI44: =SUM(RC[-4]:RC[-1]) -> 5278.1320000000005 | BJ44: 48 | BK44: 1.29E-2 | BL44: 4.84 | BM44: 0 | BN44: =SUM(RC[-4]:RC[-1]) -> 52.852900000000005 | BO44: 38 | BP44: 6.0000000000000001E-3 | BQ44: 0 | BR44: 0 | BS44: =SUM(RC[-4]:RC[-1]) -> 38.006
A45: MANGANESE | B45: 3 | C45: 0.14000000000000001 | D45: 0.6 | E45: 1.5549282000000011 | F45: =SUM(RC[-4]:RC[-1]) -> 5.2949282000000011 | G45: 6 | H45: 0.42 | I45: 946.59 | J45: 4.0443668999999982 | K45: =SUM(RC[-4]:RC[-1]) -> 957.05436689999999 | L45: 8 | M45: 0.34799999999999998 | N45: 340.09 | O45: 15.630288600000007 | P45: =SUM(RC[-4]:RC[-1]) -> 364.06828860000002 | Q45: 74 | R45: 1.5049999999999999 | S45: 114.9 | T45: 170.15927869999993 | U45: =SUM(RC[-4]:RC[-1]) -> 360.56427869999993 | V45: 5 | W45: 0.36 | X45: 0.01 | Y45: 9.7010589999999972 | Z45: =SUM(RC[-4]:RC[-1]) -> 15.071058999999998 | AA45: 4 | AB45: 0.18 | AC45: 0 | AD45: 7.8790945999999993 | AE45: =SUM(RC[-4]:RC[-1]) -> 12.059094599999998 | AF45: 4 | AG45: 0 | AH45: 3.2 | AI45: 9.9855840000000011 | AJ45: =SUM(RC[-4]:RC[-1]) -> 17.185584000000002 | AK45: 12 | AL45: 0.59 | AM45: 321.54000000000002 | AN45: 18.283672900000003 | AO45: =SUM(RC[-4]:RC[-1]) -> 352.41367289999999 | AP45: 5 | AQ45: 0.09 | AR45: 68.05 | AS45: 14.140001399999999 | AT45: =SUM(RC[-4]:RC[-1]) -> 87.280001400000003 | AU45: 3 | AV45: 0.35 | AW45: 43.7 | AX45: 6.0267405999999983 | AY45: =SUM(RC[-4]:RC[-1]) -> 53.076740600000001 | AZ45: 4 | BA45: 0.28999999999999998 | BB45: 49.18 | BC45: 11.900339199999998 | BD45: =SUM(RC[-4]:RC[-1]) -> 65.370339199999989 | BE45: 48 | BF45: 4.25 | BG45: 554.52 | BH45: 113.34167349999994 | BI45: =SUM(RC[-4]:RC[-1]) -> 720.11167349999994 | BJ45: 2 | BK45: 0.17 | BL45: 10.9 | BM45: 6.2649886000000024 | BN45: =SUM(RC[-4]:RC[-1]) -> 19.334988600000003 | BO45: 1 | BP45: 0.09 | BQ45: 0 | BR45: 2.9696705999999993 | BS45: =SUM(RC[-4]:RC[-1]) -> 4.0596705999999996
A46: MERCURY | B46: 2 | C46: 0.81 | D46: 0 | E46: 0.4176160000000001 | F46: =SUM(RC[-4]:RC[-1]) -> 3.2276160000000003 | G46: 3 | H46: 2.88 | I46: 6.44 | J46: 1.0782659999999999 | K46: =SUM(RC[-4]:RC[-1]) -> 13.398266 | L46: 7 | M46: 2.4900000000000002 | N46: 6.67 | O46: 4.2239453999999999 | P46: =SUM(RC[-4]:RC[-1]) -> 20.383945400000002 | Q46: 37 | R46: 35.47 | S46: 333.6 | T46: 36.938068799999989 | U46: =SUM(RC[-4]:RC[-1]) -> 443.00806880000005 | V46: 2 | W46: 1.76 | X46: 0 | Y46: 2.0262587999999999 | Z46: =SUM(RC[-4]:RC[-1]) -> 5.7862587999999997 | AA46: 3 | AB46: 1.32 | AC46: 0 | AD46: 1.4984006000000005 | AE46: =SUM(RC[-4]:RC[-1]) -> 5.8184006000000004 | AF46: 2 | AG46: 2.4900000000000002 | AH46: 23 | AI46: 2.658720800000002 | AJ46: =SUM(RC[-4]:RC[-1]) -> 30.148720800000003 | AK46: 7 | AL46: 4.2699999999999996 | AM46: 0.04 | AN46: 4.2385086000000021 | AO46: =SUM(RC[-4]:RC[-1]) -> 15.548508600000002 | AP46: 3 | AQ46: 1.56 | AR46: 1.02 | AS46: 2.8774981999999971 | AT46: =SUM(RC[-4]:RC[-1]) -> 8.4574981999999963 | AU46: 2 | AV46: 1.53 | AW46: 212.52 | AX46: 1.5799482000000002 | AY46: =SUM(RC[-4]:RC[-1]) -> 217.6299482 | AZ46: 2 | BA46: 2.44 | BB46: 1.91 | BC46: 2.6062336000000008 | BD46: =SUM(RC[-4]:RC[-1]) -> 8.9562336000000009 | BE46: 27 | BF46: 23.21 | BG46: 10.99 | BH46: 26.397701599999976 | BI46: =SUM(RC[-4]:RC[-1]) -> 87.597701599999979 | BJ46: 1 | BK46: 1.1279999999999999 | BL46: 0 | BM46: 1.7020095999999998 | BN46: =SUM(RC[-4]:RC[-1]) -> 3.8300095999999999 | BO46: 1 | BP46: 0.62 | BQ46: 0 | BR46: 0.80539640000000001 | BS46: =SUM(RC[-4]:RC[-1]) -> 2.4253964000000003
A47: METHENE(B)4- | B47: 0 | C47: 0 | D47: 0 | E47: 0 | F47: =SUM(RC[-4]:RC[-1]) -> 0 | G47: 0 | H47: 0 | I47: 36.200000000000003 | J47: 0 | K47: =SUM(RC[-4]:RC[-1]) -> 36.200000000000003 | L47: 0 | M47: 0 | N47: 0 | O47: 0 | P47: =SUM(RC[-4]:RC[-1]) -> 0 | Q47: 0 | R47: 0 | S47: 0 | T47: 0 | U47: =SUM(RC[-4]:RC[-1]) -> 0 | V47: 0 | W47: 0 | X47: 0 | Y47: 0 | Z47: =SUM(RC[-4]:RC[-1]) -> 0 | AA47: 0 | AB47: 0 | AC47: 0 | AD47: 0 | AE47: =SUM(RC[-4]:RC[-1]) -> 0 | AF47: 0 | AG47: 0 | AH47: 0 | AI47: 0 | AJ47: =SUM(RC[-4]:RC[-1]) -> 0 | AK47: 0 | AL47: 0 | AM47: 0 | AN47: 0 | AO47: =SUM(RC[-4]:RC[-1]) -> 0 | AP47: 0 | AQ47: 0 | AR47: 0 | AS47: 0 | AT47: =SUM(RC[-4]:RC[-1]) -> 0 | AU47: 0 | AV47: 0 | AW47: 0 | AX47: 0 | AY47: =SUM(RC[-4]:RC[-1]) -> 0 | AZ47: 0 | BA47: 0 | BB47: 0 | BC47: 0 | BD47: =SUM(RC[-4]:RC[-1]) -> 0 | BE47: 0 | BF47: 0 | BG47: 0 | BH47: 0 | BI47: =SUM(RC[-4]:RC[-1]) -> 0 | BJ47: 0 | BK47: 0 | BL47: 0.09 | BM47: 0 | BN47: =SUM(RC[-4]:RC[-1]) -> 0.09 | BO47: 0 | BP47: 0 | BQ47: 0 | BR47: 0 | BS47: =SUM(RC[-4]:RC[-1]) -> 0
A48: METHYLENE CL | B48: 0 | C48: 13024.42 | D48: 240.19 | E48: 0 | F48: =SUM(RC[-4]:RC[-1]) -> 13264.61 | G48: 0 | H48: 28047 | I48: 0 | J48: 0 | K48: =SUM(RC[-4]:RC[-1]) -> 28047 | L48: 0 | M48: 15729.06 | N48: 54.11 | O48: 0 | P48: =SUM(RC[-4]:RC[-1]) -> 15783.17 | Q48: 0 | R48: 509319.35 | S48: 25326 | T48: 0 | U48: =SUM(RC[-4]:RC[-1]) -> 534645.35 | V48: 0 | W48: 28707.49 | X48: 0 | Y48: 0 | Z48: =SUM(RC[-4]:RC[-1]) -> 28707.49 | AA48: 0 | AB48: 20496.169999999998 | AC48: 0 | AD48: 0 | AE48: =SUM(RC[-4]:RC[-1]) -> 20496.169999999998 | AF48: 0 | AG48: 37541.96 | AH48: 0 | AI48: 0 | AJ48: =SUM(RC[-4]:RC[-1]) -> 37541.96 | AK48: 0 | AL48: 46221.19 | AM48: 57.4 | AN48: 0 | AO48: =SUM(RC[-4]:RC[-1]) -> 46278.590000000004 | AP48: 0 | AQ48: 24830.1 | AR48: 374.21 | AS48: 0 | AT48: =SUM(RC[-4]:RC[-1]) -> 25204.309999999998 | AU48: 0 | AV48: 18030.61 | AW48: 0 | AX48: 0 | AY48: =SUM(RC[-4]:RC[-1]) -> 18030.61 | AZ48: 0 | BA48: 35158.699999999997 | BB48: 3709.26 | BC48: 0 | BD48: =SUM(RC[-4]:RC[-1]) -> 38867.96 | BE48: 0 | BF48: 342201.64 | BG48: 1056.99 | BH48: 0 | BI48: =SUM(RC[-4]:RC[-1]) -> 343258.63 | BJ48: 0 | BK48: 16619.77 | BL48: 0 | BM48: 0 | BN48: =SUM(RC[-4]:RC[-1]) -> 16619.77 | BO48: 0 | BP48: 9704.58 | BQ48: 0 | BR48: 0 | BS48: =SUM(RC[-4]:RC[-1]) -> 9704.58
A49: NAPHTHALENE | B49: 4964 | C49: 20380.55 | D49: 0.3 | E49: 0 | F49: =SUM(RC[-4]:RC[-1]) -> 25344.85 | G49: 11536 | H49: 26157 | I49: 75.430000000000007 | J49: 0 | K49: =SUM(RC[-4]:RC[-1]) -> 37768.43 | L49: 13481 | M49: 18586.61 | N49: 27 | O49: 0.1501489 | P49: =SUM(RC[-4]:RC[-1]) -> 32094.760148900001 | Q49: 138636 | R49: 188224.44 | S49: 2186 | T49: 71.506714000000002 | U49: =SUM(RC[-4]:RC[-1]) -> 329117.94671400002 | V49: 8460 | W49: 13369.58 | X49: 0 | Y49: 1.5829076200000001 | Z49: =SUM(RC[-4]:RC[-1]) -> 21831.162907620001 | AA49: 6760 | AB49: 10270 | AC49: 0 | AD49: 0 | AE49: =SUM(RC[-4]:RC[-1]) -> 17030 | AF49: 8780 | AG49: 20169.52 | AH49: 9.66 | AI49: 1.1941888999999999 | AJ49: =SUM(RC[-4]:RC[-1]) -> 28960.374188900001 | AK49: 18823 | AL49: 26232.46 | AM49: 0.41 | AN49: 2.0825000000000001E-3 | AO49: =SUM(RC[-4]:RC[-1]) -> 45055.872082500005 | AP49: 8600 | AQ49: 11021.95 | AR49: 572.73 | AS49: 1.48909973 | AT49: =SUM(RC[-4]:RC[-1]) -> 20196.169099729999 | AU49: 6317 | AV49: 7224.6 | AW49: 0 | AX49: 0 | AY49: =SUM(RC[-4]:RC[-1]) -> 13541.6 | AZ49: 7353 | BA49: 12033.1 | BB49: 14.94 | BC49: 0 | BD49: =SUM(RC[-4]:RC[-1]) -> 19401.039999999997 | BE49: 78837 | BF49: 134518.69 | BG49: 3.8 | BH49: 1.1204655400000001 | BI49: =SUM(RC[-4]:RC[-1]) -> 213360.61046554 | BJ49: 3165 | BK49: 5670.83 | BL49: 0 | BM49: 0 | BN49: =SUM(RC[-4]:RC[-1]) -> 8835.83 | BO49: 2049 | BP49: 4191.3 | BQ49: 0 | BR49: 0 | BS49: =SUM(RC[-4]:RC[-1]) -> 6240.3
A50: NICKEL | B50: 2 | C50: 0 | D50: 6.99 | E50: 0.68677660000000051 | F50: =SUM(RC[-4]:RC[-1]) -> 9.6767766000000002 | G50: 4 | H50: 0 | I50: 877.09 | J50: 1.7923869999999997 | K50: =SUM(RC[-4]:RC[-1]) -> 882.88238699999999 | L50: 6 | M50: 0 | N50: 193.67 | O50: 6.8836400000000006 | P50: =SUM(RC[-4]:RC[-1]) -> 206.55364 | Q50: 51 | R50: 0 | S50: 1477.26 | T50: 1079.6763516000003 | U50: =SUM(RC[-4]:RC[-1]) -> 2607.9363516000003 | V50: 3 | W50: 0 | X50: 0.88 | Y50: 4.727663800000002 | Z50: =SUM(RC[-4]:RC[-1]) -> 8.607663800000001 | AA50: 3 | AB50: 0 | AC50: 0 | AD50: 3.9524018000000019 | AE50: =SUM(RC[-4]:RC[-1]) -> 6.9524018000000023 | AF50: 3 | AG50: 0 | AH50: 22.94 | AI50: 4.4281207999999985 | AJ50: =SUM(RC[-4]:RC[-1]) -> 30.3681208 | AK50: 8 | AL50: 0 | AM50: 1480.44 | AN50: 10.721493600000004 | AO50: =SUM(RC[-4]:RC[-1]) -> 1499.1614936000001 | AP50: 4 | AQ50: 0 | AR50: 133.13999999999999 | AS50: 6.9489729000000011 | AT50: =SUM(RC[-4]:RC[-1]) -> 144.08897289999999 | AU50: 2 | AV50: 0 | AW50: 1089.1600000000001 | AX50: 2.6914599999999993 | AY50: =SUM(RC[-4]:RC[-1]) -> 1093.8514600000001 | AZ50: 3 | BA50: 0 | BB50: 16.84 | BC50: 239.1715232 | BD50: =SUM(RC[-4]:RC[-1]) -> 259.0115232 | BE50: 34 | BF50: 0 | BG50: 359.53 | BH50: 54.218299500000015 | BI50: =SUM(RC[-4]:RC[-1]) -> 447.74829949999997 | BJ50: 1 | BK50: 0 | BL50: 12.93 | BM50: 2.7522793999999986 | BN50: =SUM(RC[-4]:RC[-1]) -> 16.682279399999999 | BO50: 1 | BP50: 0 | BQ50: 0 | BR50: 1.3056601999999997 | BS50: =SUM(RC[-4]:RC[-1]) -> 2.3056601999999997
A51: PCDD | B51: 0 | C51: 0 | D51: 0 | E51: 0 | F51: =SUM(RC[-4]:RC[-1]) -> 0 | G51: 0 | H51: 0 | I51: 0 | J51: 0 | K51: =SUM(RC[-4]:RC[-1]) -> 0 | L51: 0 | M51: 0 | N51: 0 | O51: 0 | P51: =SUM(RC[-4]:RC[-1]) -> 0 | Q51: 0 | R51: 0 | S51: 0 | T51: 0 | U51: =SUM(RC[-4]:RC[-1]) -> 0 | V51: 0 | W51: 0 | X51: 0 | Y51: 0 | Z51: =SUM(RC[-4]:RC[-1]) -> 0 | AA51: 0 | AB51: 0 | AC51: 0 | AD51: 0 | AE51: =SUM(RC[-4]:RC[-1]) -> 0 | AF51: 0 | AG51: 0 | AH51: 0 | AI51: 0 | AJ51: =SUM(RC[-4]:RC[-1]) -> 0 | AK51: 0 | AL51: 0 | AM51: 0 | AN51: 0 | AO51: =SUM(RC[-4]:RC[-1]) -> 0 | AP51: 0 | AQ51: 0 | AR51: 0 | AS51: 0 | AT51: =SUM(RC[-4]:RC[-1]) -> 0 | AU51: 0 | AV51: 0 | AW51: 0 | AX51: 0 | AY51: =SUM(RC[-4]:RC[-1]) -> 0 | AZ51: 0 | BA51: 0 | BB51: 0 | BC51: 0 | BD51: =SUM(RC[-4]:RC[-1]) -> 0 | BE51: 0 | BF51: 0 | BG51: 0 | BH51: 0 | BI51: =SUM(RC[-4]:RC[-1]) -> 0 | BJ51: 0 | BK51: 0 | BL51: 0 | BM51: 0 | BN51: =SUM(RC[-4]:RC[-1]) -> 0 | BO51: 0 | BP51: 0 | BQ51: 0 | BR51: 0 | BS51: =SUM(RC[-4]:RC[-1]) -> 0
A52: PCDF | B52: 0 | C52: 0 | D52: 0 | E52: 0 | F52: =SUM(RC[-4]:RC[-1]) -> 0 | G52: 0 | H52: 0 | I52: 0 | J52: 0 | K52: =SUM(RC[-4]:RC[-1]) -> 0 | L52: 0 | M52: 0 | N52: 0 | O52: 0 | P52: =SUM(RC[-4]:RC[-1]) -> 0 | Q52: 0 | R52: 0 | S52: 0 | T52: 0 | U52: =SUM(RC[-4]:RC[-1]) -> 0 | V52: 0 | W52: 0 | X52: 0 | Y52: 0 | Z52: =SUM(RC[-4]:RC[-1]) -> 0 | AA52: 0 | AB52: 0 | AC52: 0 | AD52: 0 | AE52: =SUM(RC[-4]:RC[-1]) -> 0 | AF52: 0 | AG52: 0 | AH52: 0 | AI52: 0 | AJ52: =SUM(RC[-4]:RC[-1]) -> 0 | AK52: 0 | AL52: 0 | AM52: 0 | AN52: 0 | AO52: =SUM(RC[-4]:RC[-1]) -> 0 | AP52: 0 | AQ52: 0 | AR52: 0 | AS52: 0 | AT52: =SUM(RC[-4]:RC[-1]) -> 0 | AU52: 0 | AV52: 0 | AW52: 0 | AX52: 0 | AY52: =SUM(RC[-4]:RC[-1]) -> 0 | AZ52: 0 | BA52: 0 | BB52: 0 | BC52: 0 | BD52: =SUM(RC[-4]:RC[-1]) -> 0 | BE52: 0 | BF52: 0 | BG52: 0 | BH52: 0 | BI52: =SUM(RC[-4]:RC[-1]) -> 0 | BJ52: 0 | BK52: 0 | BL52: 0 | BM52: 0 | BN52: =SUM(RC[-4]:RC[-1]) -> 0 | BO52: 0 | BP52: 0 | BQ52: 0 | BR52: 0 | BS52: =SUM(RC[-4]:RC[-1]) -> 0
A53: PERC | B53: 0 | C53: 21336.34 | D53: 224 | E53: 0 | F53: =SUM(RC[-4]:RC[-1]) -> 21560.34 | G53: 0 | H53: 45175.93 | I53: 0 | J53: 0 | K53: =SUM(RC[-4]:RC[-1]) -> 45175.93 | L53: 0 | M53: 18505.669999999998 | N53: 97.68 | O53: 0 | P53: =SUM(RC[-4]:RC[-1]) -> 18603.349999999999 | Q53: 0 | R53: 1202183.8700000001 | S53: 6000 | T53: 0 | U53: =SUM(RC[-4]:RC[-1]) -> 1208183.8700000001 | V53: 0 | W53: 61087 | X53: 1.25 | Y53: 0 | Z53: =SUM(RC[-4]:RC[-1]) -> 61088.25 | AA53: 0 | AB53: 30718.22 | AC53: 0 | AD53: 0 | AE53: =SUM(RC[-4]:RC[-1]) -> 30718.22 | AF53: 0 | AG53: 64456.79 | AH53: 0 | AI53: 0 | AJ53: =SUM(RC[-4]:RC[-1]) -> 64456.79 | AK53: 0 | AL53: 85593.2 | AM53: 103.59 | AN53: 0 | AO53: =SUM(RC[-4]:RC[-1]) -> 85696.79 | AP53: 0 | AQ53: 59486.6 | AR53: 137.56 | AS53: 0 | AT53: =SUM(RC[-4]:RC[-1]) -> 59624.159999999996 | AU53: 0 | AV53: 23762.81 | AW53: 325 | AX53: 0 | AY53: =SUM(RC[-4]:RC[-1]) -> 24087.81 | AZ53: 0 | BA53: 55207.9 | BB53: 1544.27 | BC53: 0 | BD53: =SUM(RC[-4]:RC[-1]) -> 56752.17 | BE53: 0 | BF53: 915196.94 | BG53: 14.43 | BH53: 0 | BI53: =SUM(RC[-4]:RC[-1]) -> 915211.37 | BJ53: 0 | BK53: 23544.73 | BL53: 500 | BM53: 0 | BN53: =SUM(RC[-4]:RC[-1]) -> 24044.73 | BO53: 0 | BP53: 13927.76 | BQ53: 0 | BR53: 0 | BS53: =SUM(RC[-4]:RC[-1]) -> 13927.76
A54: PHENANTHRENE | B54: 0 | C54: 0 | D54: 0 | E54: 5.2301314599800017E-2 | F54: =SUM(RC[-4]:RC[-1]) -> 5.2301314599800017E-2 | G54: 0 | H54: 0 | I54: 0 | J54: 0.13430721614840002 | K54: =SUM(RC[-4]:RC[-1]) -> 0.13430721614840002 | L54: 0 | M54: 0 | N54: 0 | O54: 0.57584813248700029 | P54: =SUM(RC[-4]:RC[-1]) -> 0.57584813248700029 | Q54: 0 | R54: 0 | S54: 0 | T54: 10.16581581609301 | U54: =SUM(RC[-4]:RC[-1]) -> 10.16581581609301 | V54: 0 | W54: 0 | X54: 0 | Y54: 1.3138068649306005 | Z54: =SUM(RC[-4]:RC[-1]) -> 1.3138068649306005 | AA54: 0 | AB54: 0 | AC54: 0 | AD54: 0.50190852523339979 | AE54: =SUM(RC[-4]:RC[-1]) -> 0.50190852523339979 | AF54: 0 | AG54: 0 | AH54: 0 | AI54: 0.41997435037299991 | AJ54: =SUM(RC[-4]:RC[-1]) -> 0.41997435037299991 | AK54: 0 | AL54: 0 | AM54: 0 | AN54: 1.2227318754280001 | AO54: =SUM(RC[-4]:RC[-1]) -> 1.2227318754280001 | AP54: 0 | AQ54: 0 | AR54: 0 | AS54: 1.1740196223838006 | AT54: =SUM(RC[-4]:RC[-1]) -> 1.1740196223838006 | AU54: 0 | AV54: 0 | AW54: 0 | AX54: 0.26182071119119993 | AY54: =SUM(RC[-4]:RC[-1]) -> 0.26182071119119993 | AZ54: 0 | BA54: 0 | BB54: 0 | BC54: 0.4135223868956 | BD54: =SUM(RC[-4]:RC[-1]) -> 0.4135223868956 | BE54: 0 | BF54: 0 | BG54: 0 | BH54: 6.4169079402691969 | BI54: =SUM(RC[-4]:RC[-1]) -> 6.4169079402691969 | BJ54: 0 | BK54: 0 | BL54: 0 | BM54: 0.29218063517059983 | BN54: =SUM(RC[-4]:RC[-1]) -> 0.29218063517059983 | BO54: 0 | BP54: 0 | BQ54: 0 | BR54: 0.18033917218339998 | BS54: =SUM(RC[-4]:RC[-1]) -> 0.18033917218339998
A55: PHENOL | B55: 0 | C55: 0 | D55: 193.54 | E55: 0 | F55: =SUM(RC[-4]:RC[-1]) -> 193.54 | G55: 0 | H55: 0 | I55: 1141.56 | J55: 0 | K55: =SUM(RC[-4]:RC[-1]) -> 1141.56 | L55: 0 | M55: 0 | N55: 3848.6 | O55: 6.1120000000000001 | P55: =SUM(RC[-4]:RC[-1]) -> 3854.712 | Q55: 0 | R55: 0 | S55: 22.58 | T55: 230.14 | U55: =SUM(RC[-4]:RC[-1]) -> 252.71999999999997 | V55: 0 | W55: 0 | X55: 0 | Y55: 1.296 | Z55: =SUM(RC[-4]:RC[-1]) -> 1.296 | AA55: 0 | AB55: 0 | AC55: 0 | AD55: 0 | AE55: =SUM(RC[-4]:RC[-1]) -> 0 | AF55: 0 | AG55: 0 | AH55: 117.08 | AI55: 24.783999999999999 | AJ55: =SUM(RC[-4]:RC[-1]) -> 141.864 | AK55: 0 | AL55: 0 | AM55: 0 | AN55: 0.22 | AO55: =SUM(RC[-4]:RC[-1]) -> 0.22 | AP55: 0 | AQ55: 0 | AR55: 3629.7 | AS55: 7.6360000000000001 | AT55: =SUM(RC[-4]:RC[-1]) -> 3637.3359999999998 | AU55: 0 | AV55: 0 | AW55: 833 | AX55: 0 | AY55: =SUM(RC[-4]:RC[-1]) -> 833 | AZ55: 0 | BA55: 0 | BB55: 284.31 | BC55: 0 | BD55: =SUM(RC[-4]:RC[-1]) -> 284.31 | BE55: 0 | BF55: 0 | BG55: 675.05 | BH55: 1.032 | BI55: =SUM(RC[-4]:RC[-1]) -> 676.08199999999999 | BJ55: 0 | BK55: 0 | BL55: 0 | BM55: 0 | BN55: =SUM(RC[-4]:RC[-1]) -> 0 | BO55: 0 | BP55: 0 | BQ55: 0 | BR55: 0 | BS55: =SUM(RC[-4]:RC[-1]) -> 0
A56: PHOSGENE | B56: 0 | C56: 0 | D56: 0 | E56: 0 | F56: =SUM(RC[-4]:RC[-1]) -> 0 | G56: 0 | H56: 0 | I56: 0 | J56: 0 | K56: =SUM(RC[-4]:RC[-1]) -> 0 | L56: 0 | M56: 0 | N56: 0 | O56: 0 | P56: =SUM(RC[-4]:RC[-1]) -> 0 | Q56: 0 | R56: 0 | S56: 0 | T56: 0 | U56: =SUM(RC[-4]:RC[-1]) -> 0 | V56: 0 | W56: 0 | X56: 0 | Y56: 0 | Z56: =SUM(RC[-4]:RC[-1]) -> 0 | AA56: 0 | AB56: 0 | AC56: 0 | AD56: 0 | AE56: =SUM(RC[-4]:RC[-1]) -> 0 | AF56: 0 | AG56: 0 | AH56: 0 | AI56: 0 | AJ56: =SUM(RC[-4]:RC[-1]) -> 0 | AK56: 0 | AL56: 0 | AM56: 0 | AN56: 0 | AO56: =SUM(RC[-4]:RC[-1]) -> 0 | AP56: 0 | AQ56: 0 | AR56: 0 | AS56: 0 | AT56: =SUM(RC[-4]:RC[-1]) -> 0 | AU56: 0 | AV56: 0 | AW56: 0 | AX56: 0 | AY56: =SUM(RC[-4]:RC[-1]) -> 0 | AZ56: 0 | BA56: 0 | BB56: 0 | BC56: 0 | BD56: =SUM(RC[-4]:RC[-1]) -> 0 | BE56: 0 | BF56: 0 | BG56: 0 | BH56: 0 | BI56: =SUM(RC[-4]:RC[-1]) -> 0 | BJ56: 0 | BK56: 0 | BL56: 0 | BM56: 0 | BN56: =SUM(RC[-4]:RC[-1]) -> 0 | BO56: 0 | BP56: 0 | BQ56: 0 | BR56: 0 | BS56: =SUM(RC[-4]:RC[-1]) -> 0
A57: PYRENE | B57: 0 | C57: 0 | D57: 0 | E57: 9.3716612432199975E-2 | F57: =SUM(RC[-4]:RC[-1]) -> 9.3716612432199975E-2 | G57: 0 | H57: 0 | I57: 0 | J57: 0.24065974649259997 | K57: =SUM(RC[-4]:RC[-1]) -> 0.24065974649259997 | L57: 0 | M57: 0 | N57: 0 | O57: 1.0261558340645993 | P57: =SUM(RC[-4]:RC[-1]) -> 1.0261558340645993 | Q57: 0 | R57: 0 | S57: 0 | T57: 17.346695333016008 | U57: =SUM(RC[-4]:RC[-1]) -> 17.346695333016008 | V57: 0 | W57: 0 | X57: 0 | Y57: 2.3532682040355999 | Z57: =SUM(RC[-4]:RC[-1]) -> 2.3532682040355999 | AA57: 0 | AB57: 0 | AC57: 0 | AD57: 0.8993423792186005 | AE57: =SUM(RC[-4]:RC[-1]) -> 0.8993423792186005 | AF57: 0 | AG57: 0 | AH57: 0 | AI57: 0.72545112499399989 | AJ57: =SUM(RC[-4]:RC[-1]) -> 0.72545112499399989 | AK57: 0 | AL57: 0 | AM57: 0 | AN57: 2.190869439364 | AO57: =SUM(RC[-4]:RC[-1]) -> 2.190869439364 | AP57: 0 | AQ57: 0 | AR57: 0 | AS57: 2.0972612987687991 | AT57: =SUM(RC[-4]:RC[-1]) -> 2.0972612987687991 | AU57: 0 | AV57: 0 | AW57: 0 | AX57: 0.46914463301560005 | AY57: =SUM(RC[-4]:RC[-1]) -> 0.46914463301560005 | AZ57: 0 | BA57: 0 | BB57: 0 | BC57: 0.7409719865729999 | BD57: =SUM(RC[-4]:RC[-1]) -> 0.7409719865729999 | BE57: 0 | BF57: 0 | BG57: 0 | BH57: 11.496318262953205 | BI57: =SUM(RC[-4]:RC[-1]) -> 11.496318262953205 | BJ57: 0 | BK57: 0 | BL57: 0 | BM57: 0.52354518334979983 | BN57: =SUM(RC[-4]:RC[-1]) -> 0.52354518334979983 | BO57: 0 | BP57: 0 | BQ57: 0 | BR57: 0.32314092500000002 | BS57: =SUM(RC[-4]:RC[-1]) -> 0.32314092500000002
A58: STYRENE | B58: 11287 | C58: 472.74 | D58: 638.30999999999995 | E58: 71.08811704910002 | F58: =SUM(RC[-4]:RC[-1]) -> 12469.138117049099 | G58: 24168 | H58: 1360.34 | I58: 8362.7199999999993 | J58: 184.24644996410001 | K58: =SUM(RC[-4]:RC[-1]) -> 34075.306449964097 | L58: 29439 | M58: 1496.86 | N58: 25.49 | O58: 910.08246485410029 | P58: =SUM(RC[-4]:RC[-1]) -> 31871.432464854104 | Q58: 326843 | R58: 19384.7 | S58: 219.86 | T58: 15306.816263938803 | U58: =SUM(RC[-4]:RC[-1]) -> 361754.37626393879 | V58: 17852 | W58: 1169.44 | X58: 0 | Y58: 2560.1657640579015 | Z58: =SUM(RC[-4]:RC[-1]) -> 21581.605764057902 | AA58: 14331 | AB58: 629.6 | AC58: 0 | AD58: 933.00694850010007 | AE58: =SUM(RC[-4]:RC[-1]) -> 15893.606948500101 | AF58: 17897 | AG58: 1159.52 | AH58: 323.31 | AI58: 658.02338383610027 | AJ58: =SUM(RC[-4]:RC[-1]) -> 20037.853383836104 | AK58: 44289 | AL58: 2621.98 | AM58: 0 | AN58: 2151.3570576834004 | AO58: =SUM(RC[-4]:RC[-1]) -> 49062.337057683406 | AP58: 19137 | AQ58: 1143.68 | AR58: 10029.290000000001 | AS58: 2229.6917368818995 | AT58: =SUM(RC[-4]:RC[-1]) -> 32539.661736881899 | AU58: 13503 | AV58: 640.23 | AW58: 0 | AX58: 401.7270037629001 | AY58: =SUM(RC[-4]:RC[-1]) -> 14544.9570037629 | AZ58: 16401 | BA58: 1289.8699999999999 | BB58: 108.48 | BC58: 627.34622032969992 | BD58: =SUM(RC[-4]:RC[-1]) -> 18426.696220329697 | BE58: 195508 | BF58: 8940.32 | BG58: 69.489999999999995 | BH58: 10108.617050912306 | BI58: =SUM(RC[-4]:RC[-1]) -> 214626.42705091232 | BJ58: 7046 | BK58: 573.09 | BL58: 2486 | BM58: 478.03427822240002 | BN58: =SUM(RC[-4]:RC[-1]) -> 10583.1242782224 | BO58: 4381 | BP58: 284 | BQ58: 0 | BR58: 312.8407676336999 | BS58: =SUM(RC[-4]:RC[-1]) -> 4977.8407676337001
A59: TCDD,2378 | B59: 0 | C59: 0 | D59: 0 | E59: 0 | F59: =SUM(RC[-4]:RC[-1]) -> 0 | G59: 0 | H59: 0 | I59: 2 | J59: 0 | K59: =SUM(RC[-4]:RC[-1]) -> 2 | L59: 0 | M59: 0 | N59: 0 | O59: 0 | P59: =SUM(RC[-4]:RC[-1]) -> 0 | Q59: 0 | R59: 0 | S59: 0 | T59: 0 | U59: =SUM(RC[-4]:RC[-1]) -> 0 | V59: 0 | W59: 0 | X59: 0 | Y59: 0 | Z59: =SUM(RC[-4]:RC[-1]) -> 0 | AA59: 0 | AB59: 0 | AC59: 0 | AD59: 0 | AE59: =SUM(RC[-4]:RC[-1]) -> 0 | AF59: 0 | AG59: 0 | AH59: 0 | AI59: 0 | AJ59: =SUM(RC[-4]:RC[-1]) -> 0 | AK59: 0 | AL59: 0 | AM59: 0 | AN59: 0 | AO59: =SUM(RC[-4]:RC[-1]) -> 0 | AP59: 0 | AQ59: 0 | AR59: 0 | AS59: 0 | AT59: =SUM(RC[-4]:RC[-1]) -> 0 | AU59: 0 | AV59: 0 | AW59: 0 | AX59: 0 | AY59: =SUM(RC[-4]:RC[-1]) -> 0 | AZ59: 0 | BA59: 0 | BB59: 0 | BC59: 0 | BD59: =SUM(RC[-4]:RC[-1]) -> 0 | BE59: 0 | BF59: 0 | BG59: 0 | BH59: 0 | BI59: =SUM(RC[-4]:RC[-1]) -> 0 | BJ59: 0 | BK59: 0 | BL59: 0 | BM59: 0 | BN59: =SUM(RC[-4]:RC[-1]) -> 0 | BO59: 0 | BP59: 0 | BQ59: 0 | BR59: 0 | BS59: =SUM(RC[-4]:RC[-1]) -> 0
A60: TCDF,2378 | B60: 0 | C60: 0 | D60: 0 | E60: 0 | F60: =SUM(RC[-4]:RC[-1]) -> 0 | G60: 0 | H60: 0 | I60: 0 | J60: 0 | K60: =SUM(RC[-4]:RC[-1]) -> 0 | L60: 0 | M60: 0 | N60: 0 | O60: 0 | P60: =SUM(RC[-4]:RC[-1]) -> 0 | Q60: 0 | R60: 0 | S60: 0 | T60: 0 | U60: =SUM(RC[-4]:RC[-1]) -> 0 | V60: 0 | W60: 0 | X60: 0 | Y60: 0 | Z60: =SUM(RC[-4]:RC[-1]) -> 0 | AA60: 0 | AB60: 0 | AC60: 0 | AD60: 0 | AE60: =SUM(RC[-4]:RC[-1]) -> 0 | AF60: 0 | AG60: 0 | AH60: 0 | AI60: 0 | AJ60: =SUM(RC[-4]:RC[-1]) -> 0 | AK60: 0 | AL60: 0 | AM60: 0 | AN60: 0 | AO60: =SUM(RC[-4]:RC[-1]) -> 0 | AP60: 0 | AQ60: 0 | AR60: 0 | AS60: 0 | AT60: =SUM(RC[-4]:RC[-1]) -> 0 | AU60: 0 | AV60: 0 | AW60: 0 | AX60: 0 | AY60: =SUM(RC[-4]:RC[-1]) -> 0 | AZ60: 0 | BA60: 0 | BB60: 0 | BC60: 0 | BD60: =SUM(RC[-4]:RC[-1]) -> 0 | BE60: 0 | BF60: 0 | BG60: 0 | BH60: 0 | BI60: =SUM(RC[-4]:RC[-1]) -> 0 | BJ60: 0 | BK60: 0 | BL60: 0 | BM60: 0 | BN60: =SUM(RC[-4]:RC[-1]) -> 0 | BO60: 0 | BP60: 0 | BQ60: 0 | BR60: 0 | BS60: =SUM(RC[-4]:RC[-1]) -> 0
A61: TCE,111 | B61: 0 | C61: 35841.25 | D61: 2.4700000000000002 | E61: 0 | F61: =SUM(RC[-4]:RC[-1]) -> 35843.72 | G61: 0 | H61: 134578.79999999999 | I61: 0 | J61: 0 | K61: =SUM(RC[-4]:RC[-1]) -> 134578.79999999999 | L61: 0 | M61: 70795.87 | N61: 294.22000000000003 | O61: 0 | P61: =SUM(RC[-4]:RC[-1]) -> 71090.09 | Q61: 0 | R61: 2732412.9 | S61: 0 | T61: 0 | U61: =SUM(RC[-4]:RC[-1]) -> 2732412.9 | V61: 0 | W61: 144952.70000000001 | X61: 0 | Y61: 0 | Z61: =SUM(RC[-4]:RC[-1]) -> 144952.70000000001 | AA61: 0 | AB61: 103653.53 | AC61: 0 | AD61: 0 | AE61: =SUM(RC[-4]:RC[-1]) -> 103653.53 | AF61: 0 | AG61: 189123.7 | AH61: 0 | AI61: 0 | AJ61: =SUM(RC[-4]:RC[-1]) -> 189123.7 | AK61: 0 | AL61: 226341.77 | AM61: 312.05 | AN61: 0 | AO61: =SUM(RC[-4]:RC[-1]) -> 226653.81999999998 | AP61: 0 | AQ61: 125272.07 | AR61: 414.37 | AS61: 0 | AT61: =SUM(RC[-4]:RC[-1]) -> 125686.44 | AU61: 0 | AV61: 89177.87 | AW61: 0 | AX61: 0 | AY61: =SUM(RC[-4]:RC[-1]) -> 89177.87 | AZ61: 0 | BA61: 176826.84 | BB61: 6073.47 | BC61: 0 | BD61: =SUM(RC[-4]:RC[-1]) -> 182900.31 | BE61: 0 | BF61: 1826441.83 | BG61: 43.46 | BH61: 0 | BI61: =SUM(RC[-4]:RC[-1]) -> 1826485.29 | BJ61: 0 | BK61: 83839.8 | BL61: 0 | BM61: 0 | BN61: =SUM(RC[-4]:RC[-1]) -> 83839.8 | BO61: 0 | BP61: 49086.3 | BQ61: 0 | BR61: 0 | BS61: =SUM(RC[-4]:RC[-1]) -> 49086.3
A62: TOLUENE | B62: 223166 | C62: 56249.34 | D62: 6685.24 | E62: 5070.7970966799994 | F62: =SUM(RC[-4]:RC[-1]) -> 291171.37709667993 | G62: 517097 | H62: 155242.49 | I62: 6201.78 | J62: 13023.937482329999 | K62: =SUM(RC[-4]:RC[-1]) -> 691565.20748233004 | L62: 605412 | M62: 122805.66 | N62: 117924.8 | O62: 63423.432570899975 | P62: =SUM(RC[-4]:RC[-1]) -> 909565.89257090003 | Q62: 6241671 | R62: 2246295.36 | S62: 71373.8 | T62: 1175082.1348174505 | U62: =SUM(RC[-4]:RC[-1]) -> 9734422.2948174514 | V62: 379314 | W62: 126147.2 | X62: 0.55000000000000004 | Y62: 194750.14711070005 | Z62: =SUM(RC[-4]:RC[-1]) -> 700211.89711070003 | AA62: 303161 | AB62: 86809.600000000006 | AC62: 0 | AD62: 70429.922800140077 | AE62: =SUM(RC[-4]:RC[-1]) -> 460400.52280014008 | AF62: 393156 | AG62: 159467.1 | AH62: 239.16 | AI62: 45841.91224161999 | AJ62: =SUM(RC[-4]:RC[-1]) -> 598704.17224162002 | AK62: 847376 | AL62: 262459.42 | AM62: 129.66999999999999 | AN62: 162907.12783533981 | AO62: =SUM(RC[-4]:RC[-1]) -> 1272872.2178353397 | AP62: 386377 | AQ62: 111360.5 | AR62: 5682.9 | AS62: 168057.23896174994 | AT62: =SUM(RC[-4]:RC[-1]) -> 671477.63896174997 | AU62: 283336 | AV62: 82181.11 | AW62: 16224.29 | AX62: 29381.768552320005 | AY62: =SUM(RC[-4]:RC[-1]) -> 411123.16855231998 | AZ62: 330336 | BA62: 154714.42000000001 | BB62: 386093.4 | BC62: 46010.308280150013 | BD62: =SUM(RC[-4]:RC[-1]) -> 917154.12828015012 | BE62: 3557711 | BF62: 1427163.94 | BG62: 941.94 | BH62: 783951.96171559987 | BI62: =SUM(RC[-4]:RC[-1]) -> 5769768.8417155994 | BJ62: 142194 | BK62: 71655.05 | BL62: 280.83999999999997 | BM62: 34350.201160180026 | BN62: =SUM(RC[-4]:RC[-1]) -> 248480.09116018002 | BO62: 91924 | BP62: 40327.089999999997 | BQ62: 0 | BR62: 22893.017470539995 | BS62: =SUM(RC[-4]:RC[-1]) -> 155144.10747053998
A63: TOLUENE24DII | B63: 0 | C63: 12.45 | D63: 0 | E63: 0 | F63: =SUM(RC[-4]:RC[-1]) -> 12.45 | G63: 0 | H63: 44.01 | I63: 0 | J63: 0 | K63: =SUM(RC[-4]:RC[-1]) -> 44.01 | L63: 0 | M63: 38.101999999999997 | N63: 2.36 | O63: 0 | P63: =SUM(RC[-4]:RC[-1]) -> 40.461999999999996 | Q63: 0 | R63: 215.88 | S63: 0 | T63: 0 | U63: =SUM(RC[-4]:RC[-1]) -> 215.88 | V63: 0 | W63: 27.03 | X63: 0 | Y63: 0 | Z63: =SUM(RC[-4]:RC[-1]) -> 27.03 | AA63: 0 | AB63: 20.36 | AC63: 0 | AD63: 0 | AE63: =SUM(RC[-4]:RC[-1]) -> 20.36 | AF63: 0 | AG63: 38.08 | AH63: 0 | AI63: 0 | AJ63: =SUM(RC[-4]:RC[-1]) -> 38.08 | AK63: 0 | AL63: 65.244 | AM63: 8.8800000000000008 | AN63: 0 | AO63: =SUM(RC[-4]:RC[-1]) -> 74.123999999999995 | AP63: 0 | AQ63: 23.96 | AR63: 0 | AS63: 0 | AT63: =SUM(RC[-4]:RC[-1]) -> 23.96 | AU63: 0 | AV63: 23.45 | AW63: 0 | AX63: 0 | AY63: =SUM(RC[-4]:RC[-1]) -> 23.45 | AZ63: 0 | BA63: 37.200000000000003 | BB63: 0 | BC63: 0 | BD63: =SUM(RC[-4]:RC[-1]) -> 37.200000000000003 | BE63: 0 | BF63: 141.26 | BG63: 29.39 | BH63: 0 | BI63: =SUM(RC[-4]:RC[-1]) -> 170.64999999999998 | BJ63: 0 | BK63: 17.233000000000001 | BL63: 0 | BM63: 0 | BN63: =SUM(RC[-4]:RC[-1]) -> 17.233000000000001 | BO63: 0 | BP63: 9.57 | BQ63: 0 | BR63: 0 | BS63: =SUM(RC[-4]:RC[-1]) -> 9.57
A64: TRICHLORETHY | B64: 0 | C64: 50526.21 | D64: 104.87 | E64: 0 | F64: =SUM(RC[-4]:RC[-1]) -> 50631.08 | G64: 0 | H64: 85698.29 | I64: 0 | J64: 0 | K64: =SUM(RC[-4]:RC[-1]) -> 85698.29 | L64: 0 | M64: 31003.119999999999 | N64: 278.38 | O64: 0 | P64: =SUM(RC[-4]:RC[-1]) -> 31281.5 | Q64: 0 | R64: 2077276.4 | S64: 29820 | T64: 0 | U64: =SUM(RC[-4]:RC[-1]) -> 2107096.4 | V64: 0 | W64: 111560.7 | X64: 0 | Y64: 0 | Z64: =SUM(RC[-4]:RC[-1]) -> 111560.7 | AA64: 0 | AB64: 78850 | AC64: 0 | AD64: 0 | AE64: =SUM(RC[-4]:RC[-1]) -> 78850 | AF64: 0 | AG64: 142955.01999999999 | AH64: 0 | AI64: 0 | AJ64: =SUM(RC[-4]:RC[-1]) -> 142955.01999999999 | AK64: 0 | AL64: 152565.25 | AM64: 295.26 | AN64: 0 | AO64: =SUM(RC[-4]:RC[-1]) -> 152860.51 | AP64: 0 | AQ64: 95862.44 | AR64: 392 | AS64: 0 | AT64: =SUM(RC[-4]:RC[-1]) -> 96254.44 | AU64: 0 | AV64: 62244.94 | AW64: 0 | AX64: 0 | AY64: =SUM(RC[-4]:RC[-1]) -> 62244.94 | AZ64: 0 | BA64: 132133.79999999999 | BB64: 0 | BC64: 0 | BD64: =SUM(RC[-4]:RC[-1]) -> 132133.79999999999 | BE64: 0 | BF64: 1394849.2 | BG64: 103948.12 | BH64: 0 | BI64: =SUM(RC[-4]:RC[-1]) -> 1498797.3199999998 | BJ64: 0 | BK64: 63063.39 | BL64: 0 | BM64: 0 | BN64: =SUM(RC[-4]:RC[-1]) -> 63063.39 | BO64: 0 | BP64: 37402.1 | BQ64: 0 | BR64: 0 | BS64: =SUM(RC[-4]:RC[-1]) -> 37402.1
A65: TRIFLURALIN | B65: 0 | C65: 9.84 | D65: 0 | E65: 0 | F65: =SUM(RC[-4]:RC[-1]) -> 9.84 | G65: 0 | H65: 9.1 | I65: 0 | J65: 0 | K65: =SUM(RC[-4]:RC[-1]) -> 9.1 | L65: 0 | M65: 0.36 | N65: 0 | O65: 0 | P65: =SUM(RC[-4]:RC[-1]) -> 0.36 | Q65: 0 | R65: 954 | S65: 0 | T65: 0 | U65: =SUM(RC[-4]:RC[-1]) -> 954 | V65: 0 | W65: 0 | X65: 0 | Y65: 0 | Z65: =SUM(RC[-4]:RC[-1]) -> 0 | AA65: 0 | AB65: 0 | AC65: 0 | AD65: 0 | AE65: =SUM(RC[-4]:RC[-1]) -> 0 | AF65: 0 | AG65: 146.38 | AH65: 0 | AI65: 0 | AJ65: =SUM(RC[-4]:RC[-1]) -> 146.38 | AK65: 0 | AL65: 27.34 | AM65: 0 | AN65: 0 | AO65: =SUM(RC[-4]:RC[-1]) -> 27.34 | AP65: 0 | AQ65: 0 | AR65: 0 | AS65: 0 | AT65: =SUM(RC[-4]:RC[-1]) -> 0 | AU65: 0 | AV65: 0 | AW65: 0 | AX65: 0 | AY65: =SUM(RC[-4]:RC[-1]) -> 0 | AZ65: 0 | BA65: 519.66999999999996 | BB65: 0 | BC65: 0 | BD65: =SUM(RC[-4]:RC[-1]) -> 519.66999999999996 | BE65: 0 | BF65: 0 | BG65: 0 | BH65: 0 | BI65: =SUM(RC[-4]:RC[-1]) -> 0 | BJ65: 0 | BK65: 837.98 | BL65: 0 | BM65: 0 | BN65: =SUM(RC[-4]:RC[-1]) -> 837.98 | BO65: 0 | BP65: 857.95 | BQ65: 0 | BR65: 0 | BS65: =SUM(RC[-4]:RC[-1]) -> 857.95
A66: VINYL CHLOR | B66: 0 | C66: 372.18 | D66: 374.69 | E66: 0 | F66: =SUM(RC[-4]:RC[-1]) -> 746.87 | G66: 0 | H66: 1572.96 | I66: 434.65 | J66: 0 | K66: =SUM(RC[-4]:RC[-1]) -> 2007.6100000000001 | L66: 0 | M66: 773.92 | N66: 9.06 | O66: 0 | P66: =SUM(RC[-4]:RC[-1]) -> 782.9799999999999 | Q66: 0 | R66: 5388.3 | S66: 22.1 | T66: 0 | U66: =SUM(RC[-4]:RC[-1]) -> 5410.4000000000005 | V66: 0 | W66: 1057.04 | X66: 0 | Y66: 0 | Z66: =SUM(RC[-4]:RC[-1]) -> 1057.04 | AA66: 0 | AB66: 346.12 | AC66: 0 | AD66: 0 | AE66: =SUM(RC[-4]:RC[-1]) -> 346.12 | AF66: 0 | AG66: 973.95 | AH66: 114.93 | AI66: 0 | AJ66: =SUM(RC[-4]:RC[-1]) -> 1088.8800000000001 | AK66: 0 | AL66: 1131.98 | AM66: 0 | AN66: 0 | AO66: =SUM(RC[-4]:RC[-1]) -> 1131.98 | AP66: 0 | AQ66: 836.47 | AR66: 3563 | AS66: 0 | AT66: =SUM(RC[-4]:RC[-1]) -> 4399.47 | AU66: 0 | AV66: 316.45999999999998 | AW66: 0 | AX66: 0 | AY66: =SUM(RC[-4]:RC[-1]) -> 316.45999999999998 | AZ66: 0 | BA66: 702.58 | BB66: 11.55 | BC66: 0 | BD66: =SUM(RC[-4]:RC[-1]) -> 714.13 | BE66: 0 | BF66: 11095.26 | BG66: 24.59 | BH66: 0 | BI66: =SUM(RC[-4]:RC[-1]) -> 11119.85 | BJ66: 0 | BK66: 243.77 | BL66: 0 | BM66: 0 | BN66: =SUM(RC[-4]:RC[-1]) -> 243.77 | BO66: 0 | BP66: 175.7 | BQ66: 0 | BR66: 0 | BS66: =SUM(RC[-4]:RC[-1]) -> 175.7
A67: XYLENES ISO | B67: 125979 | C67: 33597.699999999997 | D67: 2100.96 | E67: 4982.6490686100005 | F67: =SUM(RC[-4]:RC[-1]) -> 166660.30906861002 | G67: 291826 | H67: 102892.69 | I67: 670.34 | J67: 12832.779972290013 | K67: =SUM(RC[-4]:RC[-1]) -> 408221.80997229007 | L67: 342110 | M67: 81104.998999999996 | N67: 19449.8 | O67: 65143.911327379981 | P67: =SUM(RC[-4]:RC[-1]) -> 507808.71032737999 | Q67: 3523900 | R67: 1429227.4 | S67: 19131.8 | T67: 1199020.0796199602 | U67: =SUM(RC[-4]:RC[-1]) -> 6171279.2796199601 | V67: 214105 | W67: 74957.05 | X67: 0.37 | Y67: 209763.34156732995 | Z67: =SUM(RC[-4]:RC[-1]) -> 498825.76156732993 | AA67: 171151 | AB67: 52414.23 | AC67: 0 | AD67: 75189.43716580997 | AE67: =SUM(RC[-4]:RC[-1]) -> 298754.66716581001 | AF67: 221807 | AG67: 98034.19 | AH67: 19.446000000000002 | AI67: 46542.951621360044 | AJ67: =SUM(RC[-4]:RC[-1]) -> 366403.58762136003 | AK67: 478399 | AL67: 178731.3 | AM67: 57.59 | AN67: 171744.56805557999 | AO67: =SUM(RC[-4]:RC[-1]) -> 828932.45805558003 | AP67: 218136 | AQ67: 65490.25 | AR67: 672.6 | AS67: 180020.30576668991 | AT67: =SUM(RC[-4]:RC[-1]) -> 464319.15576668992 | AU67: 159898 | AV67: 54909.53 | AW67: 14147.82 | AX67: 29959.08123892 | AY67: =SUM(RC[-4]:RC[-1]) -> 258914.43123892002 | AZ67: 186431 | BA67: 93915.86 | BB67: 27553.26 | BC67: 46758.355755639997 | BD67: =SUM(RC[-4]:RC[-1]) -> 354658.47575564001 | BE67: 2010795 | BF67: 932977.48 | BG67: 377.28 | BH67: 803637.54972450982 | BI67: =SUM(RC[-4]:RC[-1]) -> 3747787.3097245097 | BJ67: 80251 | BK67: 43279.64 | BL67: 1617 | BM67: 35658.145053010012 | BN67: =SUM(RC[-4]:RC[-1]) -> 160805.78505301001 | BO67: 51920 | BP67: 24528 | BQ67: 0 | BR67: 24099.088919660018 | BS67: =SUM(RC[-4]:RC[-1]) -> 100547.08891966002