Sheet: Timesheet
A1: 'CODE | B1: 'AUDIT DESCRIPTION | C1: 'Category | D1: 'Mon. | E1: 'Tue | F1: 'Wed | G1: 'Thu | H1: 'Fri | I1: 'Wknd | J1: 'Total
B2: 'Date | D2: 36647 | E2: =RC[-1]+1 -> 36648 | F2: =RC[-1]+1 -> 36649 | G2: =RC[-1]+1 -> 36650 | H2: =RC[-1]+1 -> 36651
A3: 1001 | B3: 'PURCHASING | C3: 'Mgmnt
A4: 1002 | B4: 'HUMAN RESOURCE | C4: 'Plan
A5: 1005 | B5: 'CORPORATE AUDIT RISK ANALYSIS | C5: 'Plan
A6: 1007 | B6: 'OFFICER'S TRAVEL & EXPENSE | C6: 'Plan
A7: 1008 | B7: 'RECORD RETENTION | C7: 'Mgmnt
A8: 1009 | B8: 'NASD AUDITS | C8: 'Plan
A9: 1011 | B9: 'SURPRISE CASH AUDIT - NEW YORK | C9: 'Plan
A10: 1012 | B10: 'INTERNATIONAL AUDIT - IBI | C10: 'Plan
A11: 1013 | B11: 'INTERNATIONAL AUDIT - CISL | C11: 'Plan
A12: 1014 | B12: 'MARKETING AND COMMUNICATION | C12: 'Mgmnt
A13: 3001 | B13: 'FIELD OFFICE CONTROL REVIEWS | C13: 'Field
A14: 3002 | B14: 'FIELD OFFICE ACCOUNTABILITY ANALYSIS | C14: 'Field
A15: 3010 | B15: 'FIELD OFFICE BANK RECONCILATIONS | C15: 'Field
A16: 3020 | B16: 'FIELD AUDIT PROGRAM DEVELOPMENT | C16: 'Field
A17: 3030 | B17: 'OPEN COMMITMENT ANALYSIS | C17: 'Field
A18: 3040 | B18: 'FIELD AUDIT RISK ASSESMENT | C18: 'Field
A19: 3050 | B19: 'NEW YORK FIELD AUDIT REVIEWS | C19: 'Field
A20: 4001 | B20: 'GRANT THORNTON | C20: 'Mgmnt
A21: 5001 | B21: 'MISCELLANEOUS AUDIT REQUESTS | C21: 'Mgmnt
A22: 5009 | B22: 'FORMS INVENTORY | C22: 'Plan
A23: 5010 | B23: 'SURPRISE CHECK VALIDATION | C23: 'Plan
A24: 7000 | B24: 'NON-PROJECT RELATED (MEETINGS) | C24: 'Non-Audit
A25: 7003 | B25: 'AUDIT COMMITTEE | C25: 'Non-Audit
A26: 8001 | B26: 'ADMINISTRATIVE - GENERAL | C26: 'Admin
A27: 8002 | B27: 'HOLIDAYS | C27: 'Admin
A28: 8004 | B28: 'SEMINARS & TRAINING | C28: 'Admin
A29: 8005 | B29: 'PERSONAL (VACATION/AT) | C29: 'Admin
A30: 8006 | B30: 'SICK | C30: 'Admin
A31: 8008 | B31: 'RESEARCH | C31: 'Non-Audit
A32: ' | B32: ' | C32: '
A33: ' | B33: ' | C33: '
A34: ' | B34: ' | C34: '
A35: ' | B35: ' | C35: '
A36: ' | B36: ' | C36: '
A37: ' | B37: ' | C37: '
A38: ' | B38: ' | C38: '
A39: ' | B39: ' | C39: '
A40: ' | B40: ' | C40: '
A41: ' | B41: ' | C41: '
A42: ' | B42: ' | C42: '
A43: ' | B43: ' | C43: '
A44: ' | B44: ' | C44: '
A45: ' | B45: ' | C45: '
A46: ' | B46: ' | C46: '
A47: ' | B47: ' | C47: '
A48: ' | B48: ' | C48: '
A49: ' | B49: ' | C49: '
A50: ' | B50: ' | C50: '
A51: ' | B51: ' | C51: '
A52: ' | B52: ' | C52: '
A53: ' | B53: ' | C53: '
A54: 'TOTAL

Sheet: AuditCommittee
A1: 'CODE | B1: 'AUDIT DESCRIPTION | C1: 'Category | D1: 'Total | E1: 'Category
E2: 'Admin | F2: 'Plan | G2: 'Non-Audit | H2: 'Mgmnt | I2: 'Field | J2: 'Open | K2: '% Time
A3: =IF(EQUAL(Timesheet!RC, ""), "", Timesheet!RC) -> 1001 | B3: =IF(EQUAL(Timesheet!RC, ""), "", Timesheet!RC) -> PURCHASING | C3: =IF(EQUAL(Timesheet!RC, ""), "", Timesheet!RC) -> Mgmnt | D3: =2000Total!RC -> 0 | E3: =IF(EQUAL(RC3, R2C), RC4, 0) -> 0 | F3: =IF(EQUAL(RC3, R2C), RC4, 0) -> 0 | G3: =IF(EQUAL(RC3, R2C), RC4, 0) -> 0 | H3: =IF(EQUAL(RC3, R2C), RC4, 0) -> 0 | I3: =IF(EQUAL(RC3, R2C), RC4, 0) -> 0 | J3: =IF(EQUAL(RC3, R2C), RC4, 0) -> 0 | K3: =SUM(RC[-6]:RC[-1])/R54C4 -> #NUM!
A4: =IF(EQUAL(Timesheet!RC, ""), "", Timesheet!RC) -> 1002 | B4: =IF(EQUAL(Timesheet!RC, ""), "", Timesheet!RC) -> HUMAN RESOURCE | C4: =IF(EQUAL(Timesheet!RC, ""), "", Timesheet!RC) -> Plan | D4: =2000Total!RC -> 0 | E4: =IF(EQUAL(RC3, R2C), RC4, 0) -> 0 | F4: =IF(EQUAL(RC3, R2C), RC4, 0) -> 0 | G4: =IF(EQUAL(RC3, R2C), RC4, 0) -> 0 | H4: =IF(EQUAL(RC3, R2C), RC4, 0) -> 0 | I4: =IF(EQUAL(RC3, R2C), RC4, 0) -> 0 | J4: =IF(EQUAL(RC3, R2C), RC4, 0) -> 0 | K4: =SUM(RC[-6]:RC[-1])/R54C4 -> #NUM!
A5: =IF(EQUAL(Timesheet!RC, ""), "", Timesheet!RC) -> 1005 | B5: =IF(EQUAL(Timesheet!RC, ""), "", Timesheet!RC) -> CORPORATE AUDIT RISK ANALYSIS | C5: =IF(EQUAL(Timesheet!RC, ""), "", Timesheet!RC) -> Plan | D5: =2000Total!RC -> 0 | E5: =IF(EQUAL(RC3, R2C), RC4, 0) -> 0 | F5: =IF(EQUAL(RC3, R2C), RC4, 0) -> 0 | G5: =IF(EQUAL(RC3, R2C), RC4, 0) -> 0 | H5: =IF(EQUAL(RC3, R2C), RC4, 0) -> 0 | I5: =IF(EQUAL(RC3, R2C), RC4, 0) -> 0 | J5: =IF(EQUAL(RC3, R2C), RC4, 0) -> 0 | K5: =SUM(RC[-6]:RC[-1])/R54C4 -> #NUM!
A6: =IF(EQUAL(Timesheet!RC, ""), "", Timesheet!RC) -> 1007 | B6: =IF(EQUAL(Timesheet!RC, ""), "", Timesheet!RC) -> OFFICER'S TRAVEL & EXPENSE | C6: =IF(EQUAL(Timesheet!RC, ""), "", Timesheet!RC) -> Plan | D6: =2000Total!RC -> 0 | E6: =IF(EQUAL(RC3, R2C), RC4, 0) -> 0 | F6: =IF(EQUAL(RC3, R2C), RC4, 0) -> 0 | G6: =IF(EQUAL(RC3, R2C), RC4, 0) -> 0 | H6: =IF(EQUAL(RC3, R2C), RC4, 0) -> 0 | I6: =IF(EQUAL(RC3, R2C), RC4, 0) -> 0 | J6: =IF(EQUAL(RC3, R2C), RC4, 0) -> 0 | K6: =SUM(RC[-6]:RC[-1])/R54C4 -> #NUM!
A7: =IF(EQUAL(Timesheet!RC, ""), "", Timesheet!RC) -> 1008 | B7: =IF(EQUAL(Timesheet!RC, ""), "", Timesheet!RC) -> RECORD RETENTION | C7: =IF(EQUAL(Timesheet!RC, ""), "", Timesheet!RC) -> Mgmnt | D7: =2000Total!RC -> 0 | E7: =IF(EQUAL(RC3, R2C), RC4, 0) -> 0 | F7: =IF(EQUAL(RC3, R2C), RC4, 0) -> 0 | G7: =IF(EQUAL(RC3, R2C), RC4, 0) -> 0 | H7: =IF(EQUAL(RC3, R2C), RC4, 0) -> 0 | I7: =IF(EQUAL(RC3, R2C), RC4, 0) -> 0 | J7: =IF(EQUAL(RC3, R2C), RC4, 0) -> 0 | K7: =SUM(RC[-6]:RC[-1])/R54C4 -> #NUM!
A8: =IF(EQUAL(Timesheet!RC, ""), "", Timesheet!RC) -> 1009 | B8: =IF(EQUAL(Timesheet!RC, ""), "", Timesheet!RC) -> NASD AUDITS | C8: =IF(EQUAL(Timesheet!RC, ""), "", Timesheet!RC) -> Plan | D8: =2000Total!RC -> 0 | E8: =IF(EQUAL(RC3, R2C), RC4, 0) -> 0 | F8: =IF(EQUAL(RC3, R2C), RC4, 0) -> 0 | G8: =IF(EQUAL(RC3, R2C), RC4, 0) -> 0 | H8: =IF(EQUAL(RC3, R2C), RC4, 0) -> 0 | I8: =IF(EQUAL(RC3, R2C), RC4, 0) -> 0 | J8: =IF(EQUAL(RC3, R2C), RC4, 0) -> 0 | K8: =SUM(RC[-6]:RC[-1])/R54C4 -> #NUM!
A9: =IF(EQUAL(Timesheet!RC, ""), "", Timesheet!RC) -> 1011 | B9: =IF(EQUAL(Timesheet!RC, ""), "", Timesheet!RC) -> SURPRISE CASH AUDIT - NEW YORK | C9: =IF(EQUAL(Timesheet!RC, ""), "", Timesheet!RC) -> Plan | D9: =2000Total!RC -> 0 | E9: =IF(EQUAL(RC3, R2C), RC4, 0) -> 0 | F9: =IF(EQUAL(RC3, R2C), RC4, 0) -> 0 | G9: =IF(EQUAL(RC3, R2C), RC4, 0) -> 0 | H9: =IF(EQUAL(RC3, R2C), RC4, 0) -> 0 | I9: =IF(EQUAL(RC3, R2C), RC4, 0) -> 0 | J9: =IF(EQUAL(RC3, R2C), RC4, 0) -> 0 | K9: =SUM(RC[-6]:RC[-1])/R54C4 -> #NUM!
A10: =IF(EQUAL(Timesheet!RC, ""), "", Timesheet!RC) -> 1012 | B10: =IF(EQUAL(Timesheet!RC, ""), "", Timesheet!RC) -> INTERNATIONAL AUDIT - IBI | C10: =IF(EQUAL(Timesheet!RC, ""), "", Timesheet!RC) -> Plan | D10: =2000Total!RC -> 0 | E10: =IF(EQUAL(RC3, R2C), RC4, 0) -> 0 | F10: =IF(EQUAL(RC3, R2C), RC4, 0) -> 0 | G10: =IF(EQUAL(RC3, R2C), RC4, 0) -> 0 | H10: =IF(EQUAL(RC3, R2C), RC4, 0) -> 0 | I10: =IF(EQUAL(RC3, R2C), RC4, 0) -> 0 | J10: =IF(EQUAL(RC3, R2C), RC4, 0) -> 0 | K10: =SUM(RC[-6]:RC[-1])/R54C4 -> #NUM!
A11: =IF(EQUAL(Timesheet!RC, ""), "", Timesheet!RC) -> 1013 | B11: =IF(EQUAL(Timesheet!RC, ""), "", Timesheet!RC) -> INTERNATIONAL AUDIT - CISL | C11: =IF(EQUAL(Timesheet!RC, ""), "", Timesheet!RC) -> Plan | D11: =2000Total!RC -> 0 | E11: =IF(EQUAL(RC3, R2C), RC4, 0) -> 0 | F11: =IF(EQUAL(RC3, R2C), RC4, 0) -> 0 | G11: =IF(EQUAL(RC3, R2C), RC4, 0) -> 0 | H11: =IF(EQUAL(RC3, R2C), RC4, 0) -> 0 | I11: =IF(EQUAL(RC3, R2C), RC4, 0) -> 0 | J11: =IF(EQUAL(RC3, R2C), RC4, 0) -> 0 | K11: =SUM(RC[-6]:RC[-1])/R54C4 -> #NUM!
A12: =IF(EQUAL(Timesheet!RC, ""), "", Timesheet!RC) -> 1014 | B12: =IF(EQUAL(Timesheet!RC, ""), "", Timesheet!RC) -> MARKETING AND COMMUNICATION | C12: =IF(EQUAL(Timesheet!RC, ""), "", Timesheet!RC) -> Mgmnt | D12: =2000Total!RC -> 0 | E12: =IF(EQUAL(RC3, R2C), RC4, 0) -> 0 | F12: =IF(EQUAL(RC3, R2C), RC4, 0) -> 0 | G12: =IF(EQUAL(RC3, R2C), RC4, 0) -> 0 | H12: =IF(EQUAL(RC3, R2C), RC4, 0) -> 0 | I12: =IF(EQUAL(RC3, R2C), RC4, 0) -> 0 | J12: =IF(EQUAL(RC3, R2C), RC4, 0) -> 0 | K12: =SUM(RC[-6]:RC[-1])/R54C4 -> #NUM!
A13: =IF(EQUAL(Timesheet!RC, ""), "", Timesheet!RC) -> 3001 | B13: =IF(EQUAL(Timesheet!RC, ""), "", Timesheet!RC) -> FIELD OFFICE CONTROL REVIEWS | C13: =IF(EQUAL(Timesheet!RC, ""), "", Timesheet!RC) -> Field | D13: =2000Total!RC -> 0 | E13: =IF(EQUAL(RC3, R2C), RC4, 0) -> 0 | F13: =IF(EQUAL(RC3, R2C), RC4, 0) -> 0 | G13: =IF(EQUAL(RC3, R2C), RC4, 0) -> 0 | H13: =IF(EQUAL(RC3, R2C), RC4, 0) -> 0 | I13: =IF(EQUAL(RC3, R2C), RC4, 0) -> 0 | J13: =IF(EQUAL(RC3, R2C), RC4, 0) -> 0 | K13: =SUM(RC[-6]:RC[-1])/R54C4 -> #NUM!
A14: =IF(EQUAL(Timesheet!RC, ""), "", Timesheet!RC) -> 3002 | B14: =IF(EQUAL(Timesheet!RC, ""), "", Timesheet!RC) -> FIELD OFFICE ACCOUNTABILITY ANALYSIS | C14: =IF(EQUAL(Timesheet!RC, ""), "", Timesheet!RC) -> Field | D14: =2000Total!RC -> 0 | E14: =IF(EQUAL(RC3, R2C), RC4, 0) -> 0 | F14: =IF(EQUAL(RC3, R2C), RC4, 0) -> 0 | G14: =IF(EQUAL(RC3, R2C), RC4, 0) -> 0 | H14: =IF(EQUAL(RC3, R2C), RC4, 0) -> 0 | I14: =IF(EQUAL(RC3, R2C), RC4, 0) -> 0 | J14: =IF(EQUAL(RC3, R2C), RC4, 0) -> 0 | K14: =SUM(RC[-6]:RC[-1])/R54C4 -> #NUM!
A15: =IF(EQUAL(Timesheet!RC, ""), "", Timesheet!RC) -> 3010 | B15: =IF(EQUAL(Timesheet!RC, ""), "", Timesheet!RC) -> FIELD OFFICE BANK RECONCILATIONS | C15: =IF(EQUAL(Timesheet!RC, ""), "", Timesheet!RC) -> Field | D15: =2000Total!RC -> 0 | E15: =IF(EQUAL(RC3, R2C), RC4, 0) -> 0 | F15: =IF(EQUAL(RC3, R2C), RC4, 0) -> 0 | G15: =IF(EQUAL(RC3, R2C), RC4, 0) -> 0 | H15: =IF(EQUAL(RC3, R2C), RC4, 0) -> 0 | I15: =IF(EQUAL(RC3, R2C), RC4, 0) -> 0 | J15: =IF(EQUAL(RC3, R2C), RC4, 0) -> 0 | K15: =SUM(RC[-6]:RC[-1])/R54C4 -> #NUM!
A16: =IF(EQUAL(Timesheet!RC, ""), "", Timesheet!RC) -> 3020 | B16: =IF(EQUAL(Timesheet!RC, ""), "", Timesheet!RC) -> FIELD AUDIT PROGRAM DEVELOPMENT | C16: =IF(EQUAL(Timesheet!RC, ""), "", Timesheet!RC) -> Field | D16: =2000Total!RC -> 0 | E16: =IF(EQUAL(RC3, R2C), RC4, 0) -> 0 | F16: =IF(EQUAL(RC3, R2C), RC4, 0) -> 0 | G16: =IF(EQUAL(RC3, R2C), RC4, 0) -> 0 | H16: =IF(EQUAL(RC3, R2C), RC4, 0) -> 0 | I16: =IF(EQUAL(RC3, R2C), RC4, 0) -> 0 | J16: =IF(EQUAL(RC3, R2C), RC4, 0) -> 0 | K16: =SUM(RC[-6]:RC[-1])/R54C4 -> #NUM!
A17: =IF(EQUAL(Timesheet!RC, ""), "", Timesheet!RC) -> 3030 | B17: =IF(EQUAL(Timesheet!RC, ""), "", Timesheet!RC) -> OPEN COMMITMENT ANALYSIS | C17: =IF(EQUAL(Timesheet!RC, ""), "", Timesheet!RC) -> Field | D17: =2000Total!RC -> 0 | E17: =IF(EQUAL(RC3, R2C), RC4, 0) -> 0 | F17: =IF(EQUAL(RC3, R2C), RC4, 0) -> 0 | G17: =IF(EQUAL(RC3, R2C), RC4, 0) -> 0 | H17: =IF(EQUAL(RC3, R2C), RC4, 0) -> 0 | I17: =IF(EQUAL(RC3, R2C), RC4, 0) -> 0 | J17: =IF(EQUAL(RC3, R2C), RC4, 0) -> 0 | K17: =SUM(RC[-6]:RC[-1])/R54C4 -> #NUM!
A18: =IF(EQUAL(Timesheet!RC, ""), "", Timesheet!RC) -> 3040 | B18: =IF(EQUAL(Timesheet!RC, ""), "", Timesheet!RC) -> FIELD AUDIT RISK ASSESMENT | C18: =IF(EQUAL(Timesheet!RC, ""), "", Timesheet!RC) -> Field | D18: =2000Total!RC -> 0 | E18: =IF(EQUAL(RC3, R2C), RC4, 0) -> 0 | F18: =IF(EQUAL(RC3, R2C), RC4, 0) -> 0 | G18: =IF(EQUAL(RC3, R2C), RC4, 0) -> 0 | H18: =IF(EQUAL(RC3, R2C), RC4, 0) -> 0 | I18: =IF(EQUAL(RC3, R2C), RC4, 0) -> 0 | J18: =IF(EQUAL(RC3, R2C), RC4, 0) -> 0 | K18: =SUM(RC[-6]:RC[-1])/R54C4 -> #NUM!
A19: =IF(EQUAL(Timesheet!RC, ""), "", Timesheet!RC) -> 3050 | B19: =IF(EQUAL(Timesheet!RC, ""), "", Timesheet!RC) -> NEW YORK FIELD AUDIT REVIEWS | C19: =IF(EQUAL(Timesheet!RC, ""), "", Timesheet!RC) -> Field | D19: =2000Total!RC -> 0 | E19: =IF(EQUAL(RC3, R2C), RC4, 0) -> 0 | F19: =IF(EQUAL(RC3, R2C), RC4, 0) -> 0 | G19: =IF(EQUAL(RC3, R2C), RC4, 0) -> 0 | H19: =IF(EQUAL(RC3, R2C), RC4, 0) -> 0 | I19: =IF(EQUAL(RC3, R2C), RC4, 0) -> 0 | J19: =IF(EQUAL(RC3, R2C), RC4, 0) -> 0 | K19: =SUM(RC[-6]:RC[-1])/R54C4 -> #NUM!
A20: =IF(EQUAL(Timesheet!RC, ""), "", Timesheet!RC) -> 4001 | B20: =IF(EQUAL(Timesheet!RC, ""), "", Timesheet!RC) -> GRANT THORNTON | C20: =IF(EQUAL(Timesheet!RC, ""), "", Timesheet!RC) -> Mgmnt | D20: =2000Total!RC -> 0 | E20: =IF(EQUAL(RC3, R2C), RC4, 0) -> 0 | F20: =IF(EQUAL(RC3, R2C), RC4, 0) -> 0 | G20: =IF(EQUAL(RC3, R2C), RC4, 0) -> 0 | H20: =IF(EQUAL(RC3, R2C), RC4, 0) -> 0 | I20: =IF(EQUAL(RC3, R2C), RC4, 0) -> 0 | J20: =IF(EQUAL(RC3, R2C), RC4, 0) -> 0 | K20: =SUM(RC[-6]:RC[-1])/R54C4 -> #NUM!
A21: =IF(EQUAL(Timesheet!RC, ""), "", Timesheet!RC) -> 5001 | B21: =IF(EQUAL(Timesheet!RC, ""), "", Timesheet!RC) -> MISCELLANEOUS AUDIT REQUESTS | C21: =IF(EQUAL(Timesheet!RC, ""), "", Timesheet!RC) -> Mgmnt | D21: =2000Total!RC -> 0 | E21: =IF(EQUAL(RC3, R2C), RC4, 0) -> 0 | F21: =IF(EQUAL(RC3, R2C), RC4, 0) -> 0 | G21: =IF(EQUAL(RC3, R2C), RC4, 0) -> 0 | H21: =IF(EQUAL(RC3, R2C), RC4, 0) -> 0 | I21: =IF(EQUAL(RC3, R2C), RC4, 0) -> 0 | J21: =IF(EQUAL(RC3, R2C), RC4, 0) -> 0 | K21: =SUM(RC[-6]:RC[-1])/R54C4 -> #NUM!
A22: =IF(EQUAL(Timesheet!RC, ""), "", Timesheet!RC) -> 5009 | B22: =IF(EQUAL(Timesheet!RC, ""), "", Timesheet!RC) -> FORMS INVENTORY | C22: =IF(EQUAL(Timesheet!RC, ""), "", Timesheet!RC) -> Plan | D22: =2000Total!RC -> 0 | E22: =IF(EQUAL(RC3, R2C), RC4, 0) -> 0 | F22: =IF(EQUAL(RC3, R2C), RC4, 0) -> 0 | G22: =IF(EQUAL(RC3, R2C), RC4, 0) -> 0 | H22: =IF(EQUAL(RC3, R2C), RC4, 0) -> 0 | I22: =IF(EQUAL(RC3, R2C), RC4, 0) -> 0 | J22: =IF(EQUAL(RC3, R2C), RC4, 0) -> 0 | K22: =SUM(RC[-6]:RC[-1])/R54C4 -> #NUM!
A23: =IF(EQUAL(Timesheet!RC, ""), "", Timesheet!RC) -> 5010 | B23: =IF(EQUAL(Timesheet!RC, ""), "", Timesheet!RC) -> SURPRISE CHECK VALIDATION | C23: =IF(EQUAL(Timesheet!RC, ""), "", Timesheet!RC) -> Plan | D23: =2000Total!RC -> 0 | E23: =IF(EQUAL(RC3, R2C), RC4, 0) -> 0 | F23: =IF(EQUAL(RC3, R2C), RC4, 0) -> 0 | G23: =IF(EQUAL(RC3, R2C), RC4, 0) -> 0 | H23: =IF(EQUAL(RC3, R2C), RC4, 0) -> 0 | I23: =IF(EQUAL(RC3, R2C), RC4, 0) -> 0 | J23: =IF(EQUAL(RC3, R2C), RC4, 0) -> 0 | K23: =SUM(RC[-6]:RC[-1])/R54C4 -> #NUM!
A24: =IF(EQUAL(Timesheet!RC, ""), "", Timesheet!RC) -> 7000 | B24: =IF(EQUAL(Timesheet!RC, ""), "", Timesheet!RC) -> NON-PROJECT RELATED (MEETINGS) | C24: =IF(EQUAL(Timesheet!RC, ""), "", Timesheet!RC) -> Non-Audit | D24: =2000Total!RC -> 0 | E24: =IF(EQUAL(RC3, R2C), RC4, 0) -> 0 | F24: =IF(EQUAL(RC3, R2C), RC4, 0) -> 0 | G24: =IF(EQUAL(RC3, R2C), RC4, 0) -> 0 | H24: =IF(EQUAL(RC3, R2C), RC4, 0) -> 0 | I24: =IF(EQUAL(RC3, R2C), RC4, 0) -> 0 | J24: =IF(EQUAL(RC3, R2C), RC4, 0) -> 0 | K24: =SUM(RC[-6]:RC[-1])/R54C4 -> #NUM!
A25: =IF(EQUAL(Timesheet!RC, ""), "", Timesheet!RC) -> 7003 | B25: =IF(EQUAL(Timesheet!RC, ""), "", Timesheet!RC) -> AUDIT COMMITTEE | C25: =IF(EQUAL(Timesheet!RC, ""), "", Timesheet!RC) -> Non-Audit | D25: =2000Total!RC -> 0 | E25: =IF(EQUAL(RC3, R2C), RC4, 0) -> 0 | F25: =IF(EQUAL(RC3, R2C), RC4, 0) -> 0 | G25: =IF(EQUAL(RC3, R2C), RC4, 0) -> 0 | H25: =IF(EQUAL(RC3, R2C), RC4, 0) -> 0 | I25: =IF(EQUAL(RC3, R2C), RC4, 0) -> 0 | J25: =IF(EQUAL(RC3, R2C), RC4, 0) -> 0 | K25: =SUM(RC[-6]:RC[-1])/R54C4 -> #NUM!
A26: =IF(EQUAL(Timesheet!RC, ""), "", Timesheet!RC) -> 8001 | B26: =IF(EQUAL(Timesheet!RC, ""), "", Timesheet!RC) -> ADMINISTRATIVE - GENERAL | C26: =IF(EQUAL(Timesheet!RC, ""), "", Timesheet!RC) -> Admin | D26: =2000Total!RC -> 0 | E26: =IF(EQUAL(RC3, R2C), RC4, 0) -> 0 | F26: =IF(EQUAL(RC3, R2C), RC4, 0) -> 0 | G26: =IF(EQUAL(RC3, R2C), RC4, 0) -> 0 | H26: =IF(EQUAL(RC3, R2C), RC4, 0) -> 0 | I26: =IF(EQUAL(RC3, R2C), RC4, 0) -> 0 | J26: =IF(EQUAL(RC3, R2C), RC4, 0) -> 0 | K26: =SUM(RC[-6]:RC[-1])/R54C4 -> #NUM!
A27: =IF(EQUAL(Timesheet!RC, ""), "", Timesheet!RC) -> 8002 | B27: =IF(EQUAL(Timesheet!RC, ""), "", Timesheet!RC) -> HOLIDAYS | C27: =IF(EQUAL(Timesheet!RC, ""), "", Timesheet!RC) -> Admin | D27: =2000Total!RC -> 0 | E27: =IF(EQUAL(RC3, R2C), RC4, 0) -> 0 | F27: =IF(EQUAL(RC3, R2C), RC4, 0) -> 0 | G27: =IF(EQUAL(RC3, R2C), RC4, 0) -> 0 | H27: =IF(EQUAL(RC3, R2C), RC4, 0) -> 0 | I27: =IF(EQUAL(RC3, R2C), RC4, 0) -> 0 | J27: =IF(EQUAL(RC3, R2C), RC4, 0) -> 0 | K27: =SUM(RC[-6]:RC[-1])/R54C4 -> #NUM!
A28: =IF(EQUAL(Timesheet!RC, ""), "", Timesheet!RC) -> 8004 | B28: =IF(EQUAL(Timesheet!RC, ""), "", Timesheet!RC) -> SEMINARS & TRAINING | C28: =IF(EQUAL(Timesheet!RC, ""), "", Timesheet!RC) -> Admin | D28: =2000Total!RC -> 0 | E28: =IF(EQUAL(RC3, R2C), RC4, 0) -> 0 | F28: =IF(EQUAL(RC3, R2C), RC4, 0) -> 0 | G28: =IF(EQUAL(RC3, R2C), RC4, 0) -> 0 | H28: =IF(EQUAL(RC3, R2C), RC4, 0) -> 0 | I28: =IF(EQUAL(RC3, R2C), RC4, 0) -> 0 | J28: =IF(EQUAL(RC3, R2C), RC4, 0) -> 0 | K28: =SUM(RC[-6]:RC[-1])/R54C4 -> #NUM!
A29: =IF(EQUAL(Timesheet!RC, ""), "", Timesheet!RC) -> 8005 | B29: =IF(EQUAL(Timesheet!RC, ""), "", Timesheet!RC) -> PERSONAL (VACATION/AT) | C29: =IF(EQUAL(Timesheet!RC, ""), "", Timesheet!RC) -> Admin | D29: =2000Total!RC -> 0 | E29: =IF(EQUAL(RC3, R2C), RC4, 0) -> 0 | F29: =IF(EQUAL(RC3, R2C), RC4, 0) -> 0 | G29: =IF(EQUAL(RC3, R2C), RC4, 0) -> 0 | H29: =IF(EQUAL(RC3, R2C), RC4, 0) -> 0 | I29: =IF(EQUAL(RC3, R2C), RC4, 0) -> 0 | J29: =IF(EQUAL(RC3, R2C), RC4, 0) -> 0 | K29: =SUM(RC[-6]:RC[-1])/R54C4 -> #NUM!
A30: =IF(EQUAL(Timesheet!RC, ""), "", Timesheet!RC) -> 8006 | B30: =IF(EQUAL(Timesheet!RC, ""), "", Timesheet!RC) -> SICK | C30: =IF(EQUAL(Timesheet!RC, ""), "", Timesheet!RC) -> Admin | D30: =2000Total!RC -> 0 | E30: =IF(EQUAL(RC3, R2C), RC4, 0) -> 0 | F30: =IF(EQUAL(RC3, R2C), RC4, 0) -> 0 | G30: =IF(EQUAL(RC3, R2C), RC4, 0) -> 0 | H30: =IF(EQUAL(RC3, R2C), RC4, 0) -> 0 | I30: =IF(EQUAL(RC3, R2C), RC4, 0) -> 0 | J30: =IF(EQUAL(RC3, R2C), RC4, 0) -> 0 | K30: =SUM(RC[-6]:RC[-1])/R54C4 -> #NUM!
A31: =IF(EQUAL(Timesheet!RC, ""), "", Timesheet!RC) -> 8008 | B31: =IF(EQUAL(Timesheet!RC, ""), "", Timesheet!RC) -> RESEARCH | C31: =IF(EQUAL(Timesheet!RC, ""), "", Timesheet!RC) -> Non-Audit | D31: =2000Total!RC -> 0 | E31: =IF(EQUAL(RC3, R2C), RC4, 0) -> 0 | F31: =IF(EQUAL(RC3, R2C), RC4, 0) -> 0 | G31: =IF(EQUAL(RC3, R2C), RC4, 0) -> 0 | H31: =IF(EQUAL(RC3, R2C), RC4, 0) -> 0 | I31: =IF(EQUAL(RC3, R2C), RC4, 0) -> 0 | J31: =IF(EQUAL(RC3, R2C), RC4, 0) -> 0 | K31: =SUM(RC[-6]:RC[-1])/R54C4 -> #NUM!
A32: =IF(EQUAL(Timesheet!RC, ""), "", Timesheet!RC) ->  | B32: =IF(EQUAL(Timesheet!RC, ""), "", Timesheet!RC) ->  | C32: =IF(EQUAL(Timesheet!RC, ""), "", Timesheet!RC) ->  | D32: =2000Total!RC -> 0 | E32: =IF(EQUAL(RC3, R2C), RC4, 0) -> 0 | F32: =IF(EQUAL(RC3, R2C), RC4, 0) -> 0 | G32: =IF(EQUAL(RC3, R2C), RC4, 0) -> 0 | H32: =IF(EQUAL(RC3, R2C), RC4, 0) -> 0 | I32: =IF(EQUAL(RC3, R2C), RC4, 0) -> 0 | J32: =IF(EQUAL(RC3, R2C), RC4, 0) -> 0 | K32: =SUM(RC[-6]:RC[-1])/R54C4 -> #NUM!
A33: =IF(EQUAL(Timesheet!RC, ""), "", Timesheet!RC) ->  | B33: =IF(EQUAL(Timesheet!RC, ""), "", Timesheet!RC) ->  | C33: =IF(EQUAL(Timesheet!RC, ""), "", Timesheet!RC) ->  | D33: =2000Total!RC -> 0 | E33: =IF(EQUAL(RC3, R2C), RC4, 0) -> 0 | F33: =IF(EQUAL(RC3, R2C), RC4, 0) -> 0 | G33: =IF(EQUAL(RC3, R2C), RC4, 0) -> 0 | H33: =IF(EQUAL(RC3, R2C), RC4, 0) -> 0 | I33: =IF(EQUAL(RC3, R2C), RC4, 0) -> 0 | J33: =IF(EQUAL(RC3, R2C), RC4, 0) -> 0 | K33: =SUM(RC[-6]:RC[-1])/R54C4 -> #NUM!
A34: =IF(EQUAL(Timesheet!RC, ""), "", Timesheet!RC) ->  | B34: =IF(EQUAL(Timesheet!RC, ""), "", Timesheet!RC) ->  | C34: =IF(EQUAL(Timesheet!RC, ""), "", Timesheet!RC) ->  | D34: =2000Total!RC -> 0 | E34: =IF(EQUAL(RC3, R2C), RC4, 0) -> 0 | F34: =IF(EQUAL(RC3, R2C), RC4, 0) -> 0 | G34: =IF(EQUAL(RC3, R2C), RC4, 0) -> 0 | H34: =IF(EQUAL(RC3, R2C), RC4, 0) -> 0 | I34: =IF(EQUAL(RC3, R2C), RC4, 0) -> 0 | J34: =IF(EQUAL(RC3, R2C), RC4, 0) -> 0 | K34: =SUM(RC[-6]:RC[-1])/R54C4 -> #NUM!
A35: =IF(EQUAL(Timesheet!RC, ""), "", Timesheet!RC) ->  | B35: =IF(EQUAL(Timesheet!RC, ""), "", Timesheet!RC) ->  | C35: =IF(EQUAL(Timesheet!RC, ""), "", Timesheet!RC) ->  | D35: =2000Total!RC -> 0 | E35: =IF(EQUAL(RC3, R2C), RC4, 0) -> 0 | F35: =IF(EQUAL(RC3, R2C), RC4, 0) -> 0 | G35: =IF(EQUAL(RC3, R2C), RC4, 0) -> 0 | H35: =IF(EQUAL(RC3, R2C), RC4, 0) -> 0 | I35: =IF(EQUAL(RC3, R2C), RC4, 0) -> 0 | J35: =IF(EQUAL(RC3, R2C), RC4, 0) -> 0 | K35: =SUM(RC[-6]:RC[-1])/R54C4 -> #NUM!
A36: =IF(EQUAL(Timesheet!RC, ""), "", Timesheet!RC) ->  | B36: =IF(EQUAL(Timesheet!RC, ""), "", Timesheet!RC) ->  | C36: =IF(EQUAL(Timesheet!RC, ""), "", Timesheet!RC) ->  | D36: =2000Total!RC -> 0 | E36: =IF(EQUAL(RC3, R2C), RC4, 0) -> 0 | F36: =IF(EQUAL(RC3, R2C), RC4, 0) -> 0 | G36: =IF(EQUAL(RC3, R2C), RC4, 0) -> 0 | H36: =IF(EQUAL(RC3, R2C), RC4, 0) -> 0 | I36: =IF(EQUAL(RC3, R2C), RC4, 0) -> 0 | J36: =IF(EQUAL(RC3, R2C), RC4, 0) -> 0 | K36: =SUM(RC[-6]:RC[-1])/R54C4 -> #NUM!
A37: =IF(EQUAL(Timesheet!RC, ""), "", Timesheet!RC) ->  | B37: =IF(EQUAL(Timesheet!RC, ""), "", Timesheet!RC) ->  | C37: =IF(EQUAL(Timesheet!RC, ""), "", Timesheet!RC) ->  | D37: =2000Total!RC -> 0 | E37: =IF(EQUAL(RC3, R2C), RC4, 0) -> 0 | F37: =IF(EQUAL(RC3, R2C), RC4, 0) -> 0 | G37: =IF(EQUAL(RC3, R2C), RC4, 0) -> 0 | H37: =IF(EQUAL(RC3, R2C), RC4, 0) -> 0 | I37: =IF(EQUAL(RC3, R2C), RC4, 0) -> 0 | J37: =IF(EQUAL(RC3, R2C), RC4, 0) -> 0 | K37: =SUM(RC[-6]:RC[-1])/R54C4 -> #NUM!
A38: =IF(EQUAL(Timesheet!RC, ""), "", Timesheet!RC) ->  | B38: =IF(EQUAL(Timesheet!RC, ""), "", Timesheet!RC) ->  | C38: =IF(EQUAL(Timesheet!RC, ""), "", Timesheet!RC) ->  | D38: =2000Total!RC -> 0 | E38: =IF(EQUAL(RC3, R2C), RC4, 0) -> 0 | F38: =IF(EQUAL(RC3, R2C), RC4, 0) -> 0 | G38: =IF(EQUAL(RC3, R2C), RC4, 0) -> 0 | H38: =IF(EQUAL(RC3, R2C), RC4, 0) -> 0 | I38: =IF(EQUAL(RC3, R2C), RC4, 0) -> 0 | J38: =IF(EQUAL(RC3, R2C), RC4, 0) -> 0 | K38: =SUM(RC[-6]:RC[-1])/R54C4 -> #NUM!
A39: =IF(EQUAL(Timesheet!RC, ""), "", Timesheet!RC) ->  | B39: =IF(EQUAL(Timesheet!RC, ""), "", Timesheet!RC) ->  | C39: =IF(EQUAL(Timesheet!RC, ""), "", Timesheet!RC) ->  | D39: =2000Total!RC -> 0 | E39: =IF(EQUAL(RC3, R2C), RC4, 0) -> 0 | F39: =IF(EQUAL(RC3, R2C), RC4, 0) -> 0 | G39: =IF(EQUAL(RC3, R2C), RC4, 0) -> 0 | H39: =IF(EQUAL(RC3, R2C), RC4, 0) -> 0 | I39: =IF(EQUAL(RC3, R2C), RC4, 0) -> 0 | J39: =IF(EQUAL(RC3, R2C), RC4, 0) -> 0 | K39: =SUM(RC[-6]:RC[-1])/R54C4 -> #NUM!
A40: =IF(EQUAL(Timesheet!RC, ""), "", Timesheet!RC) ->  | B40: =IF(EQUAL(Timesheet!RC, ""), "", Timesheet!RC) ->  | C40: =IF(EQUAL(Timesheet!RC, ""), "", Timesheet!RC) ->  | D40: =2000Total!RC -> 0 | E40: =IF(EQUAL(RC3, R2C), RC4, 0) -> 0 | F40: =IF(EQUAL(RC3, R2C), RC4, 0) -> 0 | G40: =IF(EQUAL(RC3, R2C), RC4, 0) -> 0 | H40: =IF(EQUAL(RC3, R2C), RC4, 0) -> 0 | I40: =IF(EQUAL(RC3, R2C), RC4, 0) -> 0 | J40: =IF(EQUAL(RC3, R2C), RC4, 0) -> 0 | K40: =SUM(RC[-6]:RC[-1])/R54C4 -> #NUM!
A41: =IF(EQUAL(Timesheet!RC, ""), "", Timesheet!RC) ->  | B41: =IF(EQUAL(Timesheet!RC, ""), "", Timesheet!RC) ->  | C41: =IF(EQUAL(Timesheet!RC, ""), "", Timesheet!RC) ->  | D41: =2000Total!RC -> 0 | E41: =IF(EQUAL(RC3, R2C), RC4, 0) -> 0 | F41: =IF(EQUAL(RC3, R2C), RC4, 0) -> 0 | G41: =IF(EQUAL(RC3, R2C), RC4, 0) -> 0 | H41: =IF(EQUAL(RC3, R2C), RC4, 0) -> 0 | I41: =IF(EQUAL(RC3, R2C), RC4, 0) -> 0 | J41: =IF(EQUAL(RC3, R2C), RC4, 0) -> 0 | K41: =SUM(RC[-6]:RC[-1])/R54C4 -> #NUM!
A42: =IF(EQUAL(Timesheet!RC, ""), "", Timesheet!RC) ->  | B42: =IF(EQUAL(Timesheet!RC, ""), "", Timesheet!RC) ->  | C42: =IF(EQUAL(Timesheet!RC, ""), "", Timesheet!RC) ->  | D42: =2000Total!RC -> 0 | E42: =IF(EQUAL(RC3, R2C), RC4, 0) -> 0 | F42: =IF(EQUAL(RC3, R2C), RC4, 0) -> 0 | G42: =IF(EQUAL(RC3, R2C), RC4, 0) -> 0 | H42: =IF(EQUAL(RC3, R2C), RC4, 0) -> 0 | I42: =IF(EQUAL(RC3, R2C), RC4, 0) -> 0 | J42: =IF(EQUAL(RC3, R2C), RC4, 0) -> 0 | K42: =SUM(RC[-6]:RC[-1])/R54C4 -> #NUM!
A43: =IF(EQUAL(Timesheet!RC, ""), "", Timesheet!RC) ->  | B43: =IF(EQUAL(Timesheet!RC, ""), "", Timesheet!RC) ->  | C43: =IF(EQUAL(Timesheet!RC, ""), "", Timesheet!RC) ->  | D43: =2000Total!RC -> 0 | E43: =IF(EQUAL(RC3, R2C), RC4, 0) -> 0 | F43: =IF(EQUAL(RC3, R2C), RC4, 0) -> 0 | G43: =IF(EQUAL(RC3, R2C), RC4, 0) -> 0 | H43: =IF(EQUAL(RC3, R2C), RC4, 0) -> 0 | I43: =IF(EQUAL(RC3, R2C), RC4, 0) -> 0 | J43: =IF(EQUAL(RC3, R2C), RC4, 0) -> 0 | K43: =SUM(RC[-6]:RC[-1])/R54C4 -> #NUM!
A44: =IF(EQUAL(Timesheet!RC, ""), "", Timesheet!RC) ->  | B44: =IF(EQUAL(Timesheet!RC, ""), "", Timesheet!RC) ->  | C44: =IF(EQUAL(Timesheet!RC, ""), "", Timesheet!RC) ->  | D44: =2000Total!RC -> 0 | E44: =IF(EQUAL(RC3, R2C), RC4, 0) -> 0 | F44: =IF(EQUAL(RC3, R2C), RC4, 0) -> 0 | G44: =IF(EQUAL(RC3, R2C), RC4, 0) -> 0 | H44: =IF(EQUAL(RC3, R2C), RC4, 0) -> 0 | I44: =IF(EQUAL(RC3, R2C), RC4, 0) -> 0 | J44: =IF(EQUAL(RC3, R2C), RC4, 0) -> 0 | K44: =SUM(RC[-6]:RC[-1])/R54C4 -> #NUM!
A45: =IF(EQUAL(Timesheet!RC, ""), "", Timesheet!RC) ->  | B45: =IF(EQUAL(Timesheet!RC, ""), "", Timesheet!RC) ->  | C45: =IF(EQUAL(Timesheet!RC, ""), "", Timesheet!RC) ->  | D45: =2000Total!RC -> 0 | E45: =IF(EQUAL(RC3, R2C), RC4, 0) -> 0 | F45: =IF(EQUAL(RC3, R2C), RC4, 0) -> 0 | G45: =IF(EQUAL(RC3, R2C), RC4, 0) -> 0 | H45: =IF(EQUAL(RC3, R2C), RC4, 0) -> 0 | I45: =IF(EQUAL(RC3, R2C), RC4, 0) -> 0 | J45: =IF(EQUAL(RC3, R2C), RC4, 0) -> 0 | K45: =SUM(RC[-6]:RC[-1])/R54C4 -> #NUM!
A46: =IF(EQUAL(Timesheet!RC, ""), "", Timesheet!RC) ->  | B46: =IF(EQUAL(Timesheet!RC, ""), "", Timesheet!RC) ->  | C46: =IF(EQUAL(Timesheet!RC, ""), "", Timesheet!RC) ->  | D46: =2000Total!RC -> 0 | E46: =IF(EQUAL(RC3, R2C), RC4, 0) -> 0 | F46: =IF(EQUAL(RC3, R2C), RC4, 0) -> 0 | G46: =IF(EQUAL(RC3, R2C), RC4, 0) -> 0 | H46: =IF(EQUAL(RC3, R2C), RC4, 0) -> 0 | I46: =IF(EQUAL(RC3, R2C), RC4, 0) -> 0 | J46: =IF(EQUAL(RC3, R2C), RC4, 0) -> 0 | K46: =SUM(RC[-6]:RC[-1])/R54C4 -> #NUM!
A47: =IF(EQUAL(Timesheet!RC, ""), "", Timesheet!RC) ->  | B47: =IF(EQUAL(Timesheet!RC, ""), "", Timesheet!RC) ->  | C47: =IF(EQUAL(Timesheet!RC, ""), "", Timesheet!RC) ->  | D47: =2000Total!RC -> 0 | E47: =IF(EQUAL(RC3, R2C), RC4, 0) -> 0 | F47: =IF(EQUAL(RC3, R2C), RC4, 0) -> 0 | G47: =IF(EQUAL(RC3, R2C), RC4, 0) -> 0 | H47: =IF(EQUAL(RC3, R2C), RC4, 0) -> 0 | I47: =IF(EQUAL(RC3, R2C), RC4, 0) -> 0 | J47: =IF(EQUAL(RC3, R2C), RC4, 0) -> 0 | K47: =SUM(RC[-6]:RC[-1])/R54C4 -> #NUM!
A48: =IF(EQUAL(Timesheet!RC, ""), "", Timesheet!RC) ->  | B48: =IF(EQUAL(Timesheet!RC, ""), "", Timesheet!RC) ->  | C48: =IF(EQUAL(Timesheet!RC, ""), "", Timesheet!RC) ->  | D48: =2000Total!RC -> 0 | E48: =IF(EQUAL(RC3, R2C), RC4, 0) -> 0 | F48: =IF(EQUAL(RC3, R2C), RC4, 0) -> 0 | G48: =IF(EQUAL(RC3, R2C), RC4, 0) -> 0 | H48: =IF(EQUAL(RC3, R2C), RC4, 0) -> 0 | I48: =IF(EQUAL(RC3, R2C), RC4, 0) -> 0 | J48: =IF(EQUAL(RC3, R2C), RC4, 0) -> 0 | K48: =SUM(RC[-6]:RC[-1])/R54C4 -> #NUM!
A49: =IF(EQUAL(Timesheet!RC, ""), "", Timesheet!RC) ->  | B49: =IF(EQUAL(Timesheet!RC, ""), "", Timesheet!RC) ->  | C49: =IF(EQUAL(Timesheet!RC, ""), "", Timesheet!RC) ->  | D49: =2000Total!RC -> 0 | E49: =IF(EQUAL(RC3, R2C), RC4, 0) -> 0 | F49: =IF(EQUAL(RC3, R2C), RC4, 0) -> 0 | G49: =IF(EQUAL(RC3, R2C), RC4, 0) -> 0 | H49: =IF(EQUAL(RC3, R2C), RC4, 0) -> 0 | I49: =IF(EQUAL(RC3, R2C), RC4, 0) -> 0 | J49: =IF(EQUAL(RC3, R2C), RC4, 0) -> 0 | K49: =SUM(RC[-6]:RC[-1])/R54C4 -> #NUM!
A50: =IF(EQUAL(Timesheet!RC, ""), "", Timesheet!RC) ->  | B50: =IF(EQUAL(Timesheet!RC, ""), "", Timesheet!RC) ->  | C50: =IF(EQUAL(Timesheet!RC, ""), "", Timesheet!RC) ->  | D50: =2000Total!RC -> 0 | E50: =IF(EQUAL(RC3, R2C), RC4, 0) -> 0 | F50: =IF(EQUAL(RC3, R2C), RC4, 0) -> 0 | G50: =IF(EQUAL(RC3, R2C), RC4, 0) -> 0 | H50: =IF(EQUAL(RC3, R2C), RC4, 0) -> 0 | I50: =IF(EQUAL(RC3, R2C), RC4, 0) -> 0 | J50: =IF(EQUAL(RC3, R2C), RC4, 0) -> 0 | K50: =SUM(RC[-6]:RC[-1])/R54C4 -> #NUM!
A51: =IF(EQUAL(Timesheet!RC, ""), "", Timesheet!RC) ->  | B51: =IF(EQUAL(Timesheet!RC, ""), "", Timesheet!RC) ->  | C51: =IF(EQUAL(Timesheet!RC, ""), "", Timesheet!RC) ->  | D51: =2000Total!RC -> 0 | E51: =IF(EQUAL(RC3, R2C), RC4, 0) -> 0 | F51: =IF(EQUAL(RC3, R2C), RC4, 0) -> 0 | G51: =IF(EQUAL(RC3, R2C), RC4, 0) -> 0 | H51: =IF(EQUAL(RC3, R2C), RC4, 0) -> 0 | I51: =IF(EQUAL(RC3, R2C), RC4, 0) -> 0 | J51: =IF(EQUAL(RC3, R2C), RC4, 0) -> 0 | K51: =SUM(RC[-6]:RC[-1])/R54C4 -> #NUM!
A52: =IF(EQUAL(Timesheet!RC, ""), "", Timesheet!RC) ->  | B52: =IF(EQUAL(Timesheet!RC, ""), "", Timesheet!RC) ->  | C52: =IF(EQUAL(Timesheet!RC, ""), "", Timesheet!RC) ->  | D52: =2000Total!RC -> 0 | E52: =IF(EQUAL(RC3, R2C), RC4, 0) -> 0 | F52: =IF(EQUAL(RC3, R2C), RC4, 0) -> 0 | G52: =IF(EQUAL(RC3, R2C), RC4, 0) -> 0 | H52: =IF(EQUAL(RC3, R2C), RC4, 0) -> 0 | I52: =IF(EQUAL(RC3, R2C), RC4, 0) -> 0 | J52: =IF(EQUAL(RC3, R2C), RC4, 0) -> 0 | K52: =SUM(RC[-6]:RC[-1])/R54C4 -> #NUM!
A53: =IF(EQUAL(Timesheet!RC, ""), "", Timesheet!RC) ->  | B53: =IF(EQUAL(Timesheet!RC, ""), "", Timesheet!RC) ->  | C53: =IF(EQUAL(Timesheet!RC, ""), "", Timesheet!RC) ->  | D53: =2000Total!RC -> 0 | E53: =IF(EQUAL(RC3, R2C), RC4, 0) -> 0 | F53: =IF(EQUAL(RC3, R2C), RC4, 0) -> 0 | G53: =IF(EQUAL(RC3, R2C), RC4, 0) -> 0 | H53: =IF(EQUAL(RC3, R2C), RC4, 0) -> 0 | I53: =IF(EQUAL(RC3, R2C), RC4, 0) -> 0 | J53: =IF(EQUAL(RC3, R2C), RC4, 0) -> 0 | K53: =SUM(RC[-6]:RC[-1])/R54C4 -> #NUM!
A54: 'TOTAL | D54: =SUM(R[-51]C:R[-1]C) -> 0 | E54: =SUM(R[-51]C:R[-1]C) -> 0 | F54: =SUM(R[-51]C:R[-1]C) -> 0 | G54: =SUM(R[-51]C:R[-1]C) -> 0 | H54: =SUM(R[-51]C:R[-1]C) -> 0 | I54: =SUM(R[-51]C:R[-1]C) -> 0 | J54: =SUM(R[-51]C:R[-1]C) -> 0 | K54: =SUM(R[-51]C:R[-1]C) -> #NUM!
D55: 'Percentage | E55: =R[-1]C/R54C4 -> #NUM! | F55: =R[-1]C/R54C4 -> #NUM! | G55: =R[-1]C/R54C4 -> #NUM! | H55: =R[-1]C/R54C4 -> #NUM! | I55: =R[-1]C/R54C4 -> #NUM! | J55: =R[-1]C/R54C4 -> #NUM!
D56: =SUM(R[-1]C[+1]:R[-1]C[+6]) -> #NUM!

Sheet: 2000Total
A1: 'CODE | B1: 'AUDIT DESCRIPTION | C1: 'Category | D1: 'Total | E1: 36526 | F1: 36557 | G1: 36586 | H1: 36617 | I1: 36647 | J1: 36678 | K1: 36708 | L1: 36739 | M1: 36770 | N1: 36800 | O1: 36831 | P1: 36861
A3: =IF(EQUAL(Timesheet!RC, ""), "", Timesheet!RC) -> 1001 | B3: =IF(EQUAL(Timesheet!RC, ""), "", Timesheet!RC) -> PURCHASING | C3: =IF(EQUAL(Timesheet!RC, ""), "", Timesheet!RC) -> Mgmnt | D3: =SUM(RC[+1]:RC[+12]) -> 0 | E3: =January2000!RC[+7] -> 0 | F3: =February2000!RC[+6] -> 0 | G3: =March2000!RC[+7] -> 0 | H3: =April2000!RC[+4] -> 0 | I3: =May2000!RC[+3] -> 0 | J3: =June2000!RC[+4] -> 0 | K3: =July2000!RC[+1] -> 0 | L3: =August2000!RC -> 0 | M3: =September2000!RC[+1] -> 0 | N3: =October2000!RC[-2] -> 0 | O3: =November2000!RC[-3] -> 0 | P3: =December2000!RC[-3] -> 0
A4: =IF(EQUAL(Timesheet!RC, ""), "", Timesheet!RC) -> 1002 | B4: =IF(EQUAL(Timesheet!RC, ""), "", Timesheet!RC) -> HUMAN RESOURCE | C4: =IF(EQUAL(Timesheet!RC, ""), "", Timesheet!RC) -> Plan | D4: =SUM(RC[+1]:RC[+12]) -> 0 | E4: =January2000!RC[+7] -> 0 | F4: =February2000!RC[+6] -> 0 | G4: =March2000!RC[+7] -> 0 | H4: =April2000!RC[+4] -> 0 | I4: =May2000!RC[+3] -> 0 | J4: =June2000!RC[+4] -> 0 | K4: =July2000!RC[+1] -> 0 | L4: =August2000!RC -> 0 | M4: =September2000!RC[+1] -> 0 | N4: =October2000!RC[-2] -> 0 | O4: =November2000!RC[-3] -> 0 | P4: =December2000!RC[-3] -> 0
A5: =IF(EQUAL(Timesheet!RC, ""), "", Timesheet!RC) -> 1005 | B5: =IF(EQUAL(Timesheet!RC, ""), "", Timesheet!RC) -> CORPORATE AUDIT RISK ANALYSIS | C5: =IF(EQUAL(Timesheet!RC, ""), "", Timesheet!RC) -> Plan | D5: =SUM(RC[+1]:RC[+12]) -> 0 | E5: =January2000!RC[+7] -> 0 | F5: =February2000!RC[+6] -> 0 | G5: =March2000!RC[+7] -> 0 | H5: =April2000!RC[+4] -> 0 | I5: =May2000!RC[+3] -> 0 | J5: =June2000!RC[+4] -> 0 | K5: =July2000!RC[+1] -> 0 | L5: =August2000!RC -> 0 | M5: =September2000!RC[+1] -> 0 | N5: =October2000!RC[-2] -> 0 | O5: =November2000!RC[-3] -> 0 | P5: =December2000!RC[-3] -> 0
A6: =IF(EQUAL(Timesheet!RC, ""), "", Timesheet!RC) -> 1007 | B6: =IF(EQUAL(Timesheet!RC, ""), "", Timesheet!RC) -> OFFICER'S TRAVEL & EXPENSE | C6: =IF(EQUAL(Timesheet!RC, ""), "", Timesheet!RC) -> Plan | D6: =SUM(RC[+1]:RC[+12]) -> 0 | E6: =January2000!RC[+7] -> 0 | F6: =February2000!RC[+6] -> 0 | G6: =March2000!RC[+7] -> 0 | H6: =April2000!RC[+4] -> 0 | I6: =May2000!RC[+3] -> 0 | J6: =June2000!RC[+4] -> 0 | K6: =July2000!RC[+1] -> 0 | L6: =August2000!RC -> 0 | M6: =September2000!RC[+1] -> 0 | N6: =October2000!RC[-2] -> 0 | O6: =November2000!RC[-3] -> 0 | P6: =December2000!RC[-3] -> 0
A7: =IF(EQUAL(Timesheet!RC, ""), "", Timesheet!RC) -> 1008 | B7: =IF(EQUAL(Timesheet!RC, ""), "", Timesheet!RC) -> RECORD RETENTION | C7: =IF(EQUAL(Timesheet!RC, ""), "", Timesheet!RC) -> Mgmnt | D7: =SUM(RC[+1]:RC[+12]) -> 0 | E7: =January2000!RC[+7] -> 0 | F7: =February2000!RC[+6] -> 0 | G7: =March2000!RC[+7] -> 0 | H7: =April2000!RC[+4] -> 0 | I7: =May2000!RC[+3] -> 0 | J7: =June2000!RC[+4] -> 0 | K7: =July2000!RC[+1] -> 0 | L7: =August2000!RC -> 0 | M7: =September2000!RC[+1] -> 0 | N7: =October2000!RC[-2] -> 0 | O7: =November2000!RC[-3] -> 0 | P7: =December2000!RC[-3] -> 0
A8: =IF(EQUAL(Timesheet!RC, ""), "", Timesheet!RC) -> 1009 | B8: =IF(EQUAL(Timesheet!RC, ""), "", Timesheet!RC) -> NASD AUDITS | C8: =IF(EQUAL(Timesheet!RC, ""), "", Timesheet!RC) -> Plan | D8: =SUM(RC[+1]:RC[+12]) -> 0 | E8: =January2000!RC[+7] -> 0 | F8: =February2000!RC[+6] -> 0 | G8: =March2000!RC[+7] -> 0 | H8: =April2000!RC[+4] -> 0 | I8: =May2000!RC[+3] -> 0 | J8: =June2000!RC[+4] -> 0 | K8: =July2000!RC[+1] -> 0 | L8: =August2000!RC -> 0 | M8: =September2000!RC[+1] -> 0 | N8: =October2000!RC[-2] -> 0 | O8: =November2000!RC[-3] -> 0 | P8: =December2000!RC[-3] -> 0
A9: =IF(EQUAL(Timesheet!RC, ""), "", Timesheet!RC) -> 1011 | B9: =IF(EQUAL(Timesheet!RC, ""), "", Timesheet!RC) -> SURPRISE CASH AUDIT - NEW YORK | C9: =IF(EQUAL(Timesheet!RC, ""), "", Timesheet!RC) -> Plan | D9: =SUM(RC[+1]:RC[+12]) -> 0 | E9: =January2000!RC[+7] -> 0 | F9: =February2000!RC[+6] -> 0 | G9: =March2000!RC[+7] -> 0 | H9: =April2000!RC[+4] -> 0 | I9: =May2000!RC[+3] -> 0 | J9: =June2000!RC[+4] -> 0 | K9: =July2000!RC[+1] -> 0 | L9: =August2000!RC -> 0 | M9: =September2000!RC[+1] -> 0 | N9: =October2000!RC[-2] -> 0 | O9: =November2000!RC[-3] -> 0 | P9: =December2000!RC[-3] -> 0
A10: =IF(EQUAL(Timesheet!RC, ""), "", Timesheet!RC) -> 1012 | B10: =IF(EQUAL(Timesheet!RC, ""), "", Timesheet!RC) -> INTERNATIONAL AUDIT - IBI | C10: =IF(EQUAL(Timesheet!RC, ""), "", Timesheet!RC) -> Plan | D10: =SUM(RC[+1]:RC[+12]) -> 0 | E10: =January2000!RC[+7] -> 0 | F10: =February2000!RC[+6] -> 0 | G10: =March2000!RC[+7] -> 0 | H10: =April2000!RC[+4] -> 0 | I10: =May2000!RC[+3] -> 0 | J10: =June2000!RC[+4] -> 0 | K10: =July2000!RC[+1] -> 0 | L10: =August2000!RC -> 0 | M10: =September2000!RC[+1] -> 0 | N10: =October2000!RC[-2] -> 0 | O10: =November2000!RC[-3] -> 0 | P10: =December2000!RC[-3] -> 0
A11: =IF(EQUAL(Timesheet!RC, ""), "", Timesheet!RC) -> 1013 | B11: =IF(EQUAL(Timesheet!RC, ""), "", Timesheet!RC) -> INTERNATIONAL AUDIT - CISL | C11: =IF(EQUAL(Timesheet!RC, ""), "", Timesheet!RC) -> Plan | D11: =SUM(RC[+1]:RC[+12]) -> 0 | E11: =January2000!RC[+7] -> 0 | F11: =February2000!RC[+6] -> 0 | G11: =March2000!RC[+7] -> 0 | H11: =April2000!RC[+4] -> 0 | I11: =May2000!RC[+3] -> 0 | J11: =June2000!RC[+4] -> 0 | K11: =July2000!RC[+1] -> 0 | L11: =August2000!RC -> 0 | M11: =September2000!RC[+1] -> 0 | N11: =October2000!RC[-2] -> 0 | O11: =November2000!RC[-3] -> 0 | P11: =December2000!RC[-3] -> 0
A12: =IF(EQUAL(Timesheet!RC, ""), "", Timesheet!RC) -> 1014 | B12: =IF(EQUAL(Timesheet!RC, ""), "", Timesheet!RC) -> MARKETING AND COMMUNICATION | C12: =IF(EQUAL(Timesheet!RC, ""), "", Timesheet!RC) -> Mgmnt | D12: =SUM(RC[+1]:RC[+12]) -> 0 | E12: =January2000!RC[+7] -> 0 | F12: =February2000!RC[+6] -> 0 | G12: =March2000!RC[+7] -> 0 | H12: =April2000!RC[+4] -> 0 | I12: =May2000!RC[+3] -> 0 | J12: =June2000!RC[+4] -> 0 | K12: =July2000!RC[+1] -> 0 | L12: =August2000!RC -> 0 | M12: =September2000!RC[+1] -> 0 | N12: =October2000!RC[-2] -> 0 | O12: =November2000!RC[-3] -> 0 | P12: =December2000!RC[-3] -> 0
A13: =IF(EQUAL(Timesheet!RC, ""), "", Timesheet!RC) -> 3001 | B13: =IF(EQUAL(Timesheet!RC, ""), "", Timesheet!RC) -> FIELD OFFICE CONTROL REVIEWS | C13: =IF(EQUAL(Timesheet!RC, ""), "", Timesheet!RC) -> Field | D13: =SUM(RC[+1]:RC[+12]) -> 0 | E13: =January2000!RC[+7] -> 0 | F13: =February2000!RC[+6] -> 0 | G13: =March2000!RC[+7] -> 0 | H13: =April2000!RC[+4] -> 0 | I13: =May2000!RC[+3] -> 0 | J13: =June2000!RC[+4] -> 0 | K13: =July2000!RC[+1] -> 0 | L13: =August2000!RC -> 0 | M13: =September2000!RC[+1] -> 0 | N13: =October2000!RC[-2] -> 0 | O13: =November2000!RC[-3] -> 0 | P13: =December2000!RC[-3] -> 0
A14: =IF(EQUAL(Timesheet!RC, ""), "", Timesheet!RC) -> 3002 | B14: =IF(EQUAL(Timesheet!RC, ""), "", Timesheet!RC) -> FIELD OFFICE ACCOUNTABILITY ANALYSIS | C14: =IF(EQUAL(Timesheet!RC, ""), "", Timesheet!RC) -> Field | D14: =SUM(RC[+1]:RC[+12]) -> 0 | E14: =January2000!RC[+7] -> 0 | F14: =February2000!RC[+6] -> 0 | G14: =March2000!RC[+7] -> 0 | H14: =April2000!RC[+4] -> 0 | I14: =May2000!RC[+3] -> 0 | J14: =June2000!RC[+4] -> 0 | K14: =July2000!RC[+1] -> 0 | L14: =August2000!RC -> 0 | M14: =September2000!RC[+1] -> 0 | N14: =October2000!RC[-2] -> 0 | O14: =November2000!RC[-3] -> 0 | P14: =December2000!RC[-3] -> 0
A15: =IF(EQUAL(Timesheet!RC, ""), "", Timesheet!RC) -> 3010 | B15: =IF(EQUAL(Timesheet!RC, ""), "", Timesheet!RC) -> FIELD OFFICE BANK RECONCILATIONS | C15: =IF(EQUAL(Timesheet!RC, ""), "", Timesheet!RC) -> Field | D15: =SUM(RC[+1]:RC[+12]) -> 0 | E15: =January2000!RC[+7] -> 0 | F15: =February2000!RC[+6] -> 0 | G15: =March2000!RC[+7] -> 0 | H15: =April2000!RC[+4] -> 0 | I15: =May2000!RC[+3] -> 0 | J15: =June2000!RC[+4] -> 0 | K15: =July2000!RC[+1] -> 0 | L15: =August2000!RC -> 0 | M15: =September2000!RC[+1] -> 0 | N15: =October2000!RC[-2] -> 0 | O15: =November2000!RC[-3] -> 0 | P15: =December2000!RC[-3] -> 0
A16: =IF(EQUAL(Timesheet!RC, ""), "", Timesheet!RC) -> 3020 | B16: =IF(EQUAL(Timesheet!RC, ""), "", Timesheet!RC) -> FIELD AUDIT PROGRAM DEVELOPMENT | C16: =IF(EQUAL(Timesheet!RC, ""), "", Timesheet!RC) -> Field | D16: =SUM(RC[+1]:RC[+12]) -> 0 | E16: =January2000!RC[+7] -> 0 | F16: =February2000!RC[+6] -> 0 | G16: =March2000!RC[+7] -> 0 | H16: =April2000!RC[+4] -> 0 | I16: =May2000!RC[+3] -> 0 | J16: =June2000!RC[+4] -> 0 | K16: =July2000!RC[+1] -> 0 | L16: =August2000!RC -> 0 | M16: =September2000!RC[+1] -> 0 | N16: =October2000!RC[-2] -> 0 | O16: =November2000!RC[-3] -> 0 | P16: =December2000!RC[-3] -> 0
A17: =IF(EQUAL(Timesheet!RC, ""), "", Timesheet!RC) -> 3030 | B17: =IF(EQUAL(Timesheet!RC, ""), "", Timesheet!RC) -> OPEN COMMITMENT ANALYSIS | C17: =IF(EQUAL(Timesheet!RC, ""), "", Timesheet!RC) -> Field | D17: =SUM(RC[+1]:RC[+12]) -> 0 | E17: =January2000!RC[+7] -> 0 | F17: =February2000!RC[+6] -> 0 | G17: =March2000!RC[+7] -> 0 | H17: =April2000!RC[+4] -> 0 | I17: =May2000!RC[+3] -> 0 | J17: =June2000!RC[+4] -> 0 | K17: =July2000!RC[+1] -> 0 | L17: =August2000!RC -> 0 | M17: =September2000!RC[+1] -> 0 | N17: =October2000!RC[-2] -> 0 | O17: =November2000!RC[-3] -> 0 | P17: =December2000!RC[-3] -> 0
A18: =IF(EQUAL(Timesheet!RC, ""), "", Timesheet!RC) -> 3040 | B18: =IF(EQUAL(Timesheet!RC, ""), "", Timesheet!RC) -> FIELD AUDIT RISK ASSESMENT | C18: =IF(EQUAL(Timesheet!RC, ""), "", Timesheet!RC) -> Field | D18: =SUM(RC[+1]:RC[+12]) -> 0 | E18: =January2000!RC[+7] -> 0 | F18: =February2000!RC[+6] -> 0 | G18: =March2000!RC[+7] -> 0 | H18: =April2000!RC[+4] -> 0 | I18: =May2000!RC[+3] -> 0 | J18: =June2000!RC[+4] -> 0 | K18: =July2000!RC[+1] -> 0 | L18: =August2000!RC -> 0 | M18: =September2000!RC[+1] -> 0 | N18: =October2000!RC[-2] -> 0 | O18: =November2000!RC[-3] -> 0 | P18: =December2000!RC[-3] -> 0
A19: =IF(EQUAL(Timesheet!RC, ""), "", Timesheet!RC) -> 3050 | B19: =IF(EQUAL(Timesheet!RC, ""), "", Timesheet!RC) -> NEW YORK FIELD AUDIT REVIEWS | C19: =IF(EQUAL(Timesheet!RC, ""), "", Timesheet!RC) -> Field | D19: =SUM(RC[+1]:RC[+12]) -> 0 | E19: =January2000!RC[+7] -> 0 | F19: =February2000!RC[+6] -> 0 | G19: =March2000!RC[+7] -> 0 | H19: =April2000!RC[+4] -> 0 | I19: =May2000!RC[+3] -> 0 | J19: =June2000!RC[+4] -> 0 | K19: =July2000!RC[+1] -> 0 | L19: =August2000!RC -> 0 | M19: =September2000!RC[+1] -> 0 | N19: =October2000!RC[-2] -> 0 | O19: =November2000!RC[-3] -> 0 | P19: =December2000!RC[-3] -> 0
A20: =IF(EQUAL(Timesheet!RC, ""), "", Timesheet!RC) -> 4001 | B20: =IF(EQUAL(Timesheet!RC, ""), "", Timesheet!RC) -> GRANT THORNTON | C20: 'Mgmnt | D20: =SUM(RC[+1]:RC[+12]) -> 0 | E20: =January2000!RC[+7] -> 0 | F20: =February2000!RC[+6] -> 0 | G20: =March2000!RC[+7] -> 0 | H20: =April2000!RC[+4] -> 0 | I20: =May2000!RC[+3] -> 0 | J20: =June2000!RC[+4] -> 0 | K20: =July2000!RC[+1] -> 0 | L20: =August2000!RC -> 0 | M20: =September2000!RC[+1] -> 0 | N20: =October2000!RC[-2] -> 0 | O20: =November2000!RC[-3] -> 0 | P20: =December2000!RC[-3] -> 0
A21: =IF(EQUAL(Timesheet!RC, ""), "", Timesheet!RC) -> 5001 | B21: =IF(EQUAL(Timesheet!RC, ""), "", Timesheet!RC) -> MISCELLANEOUS AUDIT REQUESTS | C21: =IF(EQUAL(Timesheet!RC, ""), "", Timesheet!RC) -> Mgmnt | D21: =SUM(RC[+1]:RC[+12]) -> 0 | E21: =January2000!RC[+7] -> 0 | F21: =February2000!RC[+6] -> 0 | G21: =March2000!RC[+7] -> 0 | H21: =April2000!RC[+4] -> 0 | I21: =May2000!RC[+3] -> 0 | J21: =June2000!RC[+4] -> 0 | K21: =July2000!RC[+1] -> 0 | L21: =August2000!RC -> 0 | M21: =September2000!RC[+1] -> 0 | N21: =October2000!RC[-2] -> 0 | O21: =November2000!RC[-3] -> 0 | P21: =December2000!RC[-3] -> 0
A22: =IF(EQUAL(Timesheet!RC, ""), "", Timesheet!RC) -> 5009 | B22: =IF(EQUAL(Timesheet!RC, ""), "", Timesheet!RC) -> FORMS INVENTORY | C22: =IF(EQUAL(Timesheet!RC, ""), "", Timesheet!RC) -> Plan | D22: =SUM(RC[+1]:RC[+12]) -> 0 | E22: =January2000!RC[+7] -> 0 | F22: =February2000!RC[+6] -> 0 | G22: =March2000!RC[+7] -> 0 | H22: =April2000!RC[+4] -> 0 | I22: =May2000!RC[+3] -> 0 | J22: =June2000!RC[+4] -> 0 | K22: =July2000!RC[+1] -> 0 | L22: =August2000!RC -> 0 | M22: =September2000!RC[+1] -> 0 | N22: =October2000!RC[-2] -> 0 | O22: =November2000!RC[-3] -> 0 | P22: =December2000!RC[-3] -> 0
A23: =IF(EQUAL(Timesheet!RC, ""), "", Timesheet!RC) -> 5010 | B23: =IF(EQUAL(Timesheet!RC, ""), "", Timesheet!RC) -> SURPRISE CHECK VALIDATION | C23: =IF(EQUAL(Timesheet!RC, ""), "", Timesheet!RC) -> Plan | D23: =SUM(RC[+1]:RC[+12]) -> 0 | E23: =January2000!RC[+7] -> 0 | F23: =February2000!RC[+6] -> 0 | G23: =March2000!RC[+7] -> 0 | H23: =April2000!RC[+4] -> 0 | I23: =May2000!RC[+3] -> 0 | J23: =June2000!RC[+4] -> 0 | K23: =July2000!RC[+1] -> 0 | L23: =August2000!RC -> 0 | M23: =September2000!RC[+1] -> 0 | N23: =October2000!RC[-2] -> 0 | O23: =November2000!RC[-3] -> 0 | P23: =December2000!RC[-3] -> 0
A24: =IF(EQUAL(Timesheet!RC, ""), "", Timesheet!RC) -> 7000 | B24: =IF(EQUAL(Timesheet!RC, ""), "", Timesheet!RC) -> NON-PROJECT RELATED (MEETINGS) | C24: =IF(EQUAL(Timesheet!RC, ""), "", Timesheet!RC) -> Non-Audit | D24: =SUM(RC[+1]:RC[+12]) -> 0 | E24: =January2000!RC[+7] -> 0 | F24: =February2000!RC[+6] -> 0 | G24: =March2000!RC[+7] -> 0 | H24: =April2000!RC[+4] -> 0 | I24: =May2000!RC[+3] -> 0 | J24: =June2000!RC[+4] -> 0 | K24: =July2000!RC[+1] -> 0 | L24: =August2000!RC -> 0 | M24: =September2000!RC[+1] -> 0 | N24: =October2000!RC[-2] -> 0 | O24: =November2000!RC[-3] -> 0 | P24: =December2000!RC[-3] -> 0
A25: =IF(EQUAL(Timesheet!RC, ""), "", Timesheet!RC) -> 7003 | B25: =IF(EQUAL(Timesheet!RC, ""), "", Timesheet!RC) -> AUDIT COMMITTEE | C25: =IF(EQUAL(Timesheet!RC, ""), "", Timesheet!RC) -> Non-Audit | D25: =SUM(RC[+1]:RC[+12]) -> 0 | E25: =January2000!RC[+7] -> 0 | F25: =February2000!RC[+6] -> 0 | G25: =March2000!RC[+7] -> 0 | H25: =April2000!RC[+4] -> 0 | I25: =May2000!RC[+3] -> 0 | J25: =June2000!RC[+4] -> 0 | K25: =July2000!RC[+1] -> 0 | L25: =August2000!RC -> 0 | M25: =September2000!RC[+1] -> 0 | N25: =October2000!RC[-2] -> 0 | O25: =November2000!RC[-3] -> 0 | P25: =December2000!RC[-3] -> 0
A26: =IF(EQUAL(Timesheet!RC, ""), "", Timesheet!RC) -> 8001 | B26: =IF(EQUAL(Timesheet!RC, ""), "", Timesheet!RC) -> ADMINISTRATIVE - GENERAL | C26: =IF(EQUAL(Timesheet!RC, ""), "", Timesheet!RC) -> Admin | D26: =SUM(RC[+1]:RC[+12]) -> 0 | E26: =January2000!RC[+7] -> 0 | F26: =February2000!RC[+6] -> 0 | G26: =March2000!RC[+7] -> 0 | H26: =April2000!RC[+4] -> 0 | I26: =May2000!RC[+3] -> 0 | J26: =June2000!RC[+4] -> 0 | K26: =July2000!RC[+1] -> 0 | L26: =August2000!RC -> 0 | M26: =September2000!RC[+1] -> 0 | N26: =October2000!RC[-2] -> 0 | O26: =November2000!RC[-3] -> 0 | P26: =December2000!RC[-3] -> 0
A27: =IF(EQUAL(Timesheet!RC, ""), "", Timesheet!RC) -> 8002 | B27: =IF(EQUAL(Timesheet!RC, ""), "", Timesheet!RC) -> HOLIDAYS | C27: =IF(EQUAL(Timesheet!RC, ""), "", Timesheet!RC) -> Admin | D27: =SUM(RC[+1]:RC[+12]) -> 0 | E27: =January2000!RC[+7] -> 0 | F27: =February2000!RC[+6] -> 0 | G27: =March2000!RC[+7] -> 0 | H27: =April2000!RC[+4] -> 0 | I27: =May2000!RC[+3] -> 0 | J27: =June2000!RC[+4] -> 0 | K27: =July2000!RC[+1] -> 0 | L27: =August2000!RC -> 0 | M27: =September2000!RC[+1] -> 0 | N27: =October2000!RC[-2] -> 0 | O27: =November2000!RC[-3] -> 0 | P27: =December2000!RC[-3] -> 0
A28: =IF(EQUAL(Timesheet!RC, ""), "", Timesheet!RC) -> 8004 | B28: =IF(EQUAL(Timesheet!RC, ""), "", Timesheet!RC) -> SEMINARS & TRAINING | C28: =IF(EQUAL(Timesheet!RC, ""), "", Timesheet!RC) -> Admin | D28: =SUM(RC[+1]:RC[+12]) -> 0 | E28: =January2000!RC[+7] -> 0 | F28: =February2000!RC[+6] -> 0 | G28: =March2000!RC[+7] -> 0 | H28: =April2000!RC[+4] -> 0 | I28: =May2000!RC[+3] -> 0 | J28: =June2000!RC[+4] -> 0 | K28: =July2000!RC[+1] -> 0 | L28: =August2000!RC -> 0 | M28: =September2000!RC[+1] -> 0 | N28: =October2000!RC[-2] -> 0 | O28: =November2000!RC[-3] -> 0 | P28: =December2000!RC[-3] -> 0
A29: =IF(EQUAL(Timesheet!RC, ""), "", Timesheet!RC) -> 8005 | B29: =IF(EQUAL(Timesheet!RC, ""), "", Timesheet!RC) -> PERSONAL (VACATION/AT) | C29: =IF(EQUAL(Timesheet!RC, ""), "", Timesheet!RC) -> Admin | D29: =SUM(RC[+1]:RC[+12]) -> 0 | E29: =January2000!RC[+7] -> 0 | F29: =February2000!RC[+6] -> 0 | G29: =March2000!RC[+7] -> 0 | H29: =April2000!RC[+4] -> 0 | I29: =May2000!RC[+3] -> 0 | J29: =June2000!RC[+4] -> 0 | K29: =July2000!RC[+1] -> 0 | L29: =August2000!RC -> 0 | M29: =September2000!RC[+1] -> 0 | N29: =October2000!RC[-2] -> 0 | O29: =November2000!RC[-3] -> 0 | P29: =December2000!RC[-3] -> 0
A30: =IF(EQUAL(Timesheet!RC, ""), "", Timesheet!RC) -> 8006 | B30: =IF(EQUAL(Timesheet!RC, ""), "", Timesheet!RC) -> SICK | C30: =IF(EQUAL(Timesheet!RC, ""), "", Timesheet!RC) -> Admin | D30: =SUM(RC[+1]:RC[+12]) -> 0 | E30: =January2000!RC[+7] -> 0 | F30: =February2000!RC[+6] -> 0 | G30: =March2000!RC[+7] -> 0 | H30: =April2000!RC[+4] -> 0 | I30: =May2000!RC[+3] -> 0 | J30: =June2000!RC[+4] -> 0 | K30: =July2000!RC[+1] -> 0 | L30: =August2000!RC -> 0 | M30: =September2000!RC[+1] -> 0 | N30: =October2000!RC[-2] -> 0 | O30: =November2000!RC[-3] -> 0 | P30: =December2000!RC[-3] -> 0
A31: =IF(EQUAL(Timesheet!RC, ""), "", Timesheet!RC) -> 8008 | B31: =IF(EQUAL(Timesheet!RC, ""), "", Timesheet!RC) -> RESEARCH | C31: =IF(EQUAL(Timesheet!RC, ""), "", Timesheet!RC) -> Non-Audit | D31: =SUM(RC[+1]:RC[+12]) -> 0 | E31: =January2000!RC[+7] -> 0 | F31: =February2000!RC[+6] -> 0 | G31: =March2000!RC[+7] -> 0 | H31: =April2000!RC[+4] -> 0 | I31: =May2000!RC[+3] -> 0 | J31: =June2000!RC[+4] -> 0 | K31: =July2000!RC[+1] -> 0 | L31: =August2000!RC -> 0 | M31: =September2000!RC[+1] -> 0 | N31: =October2000!RC[-2] -> 0 | O31: =November2000!RC[-3] -> 0 | P31: =December2000!RC[-3] -> 0
A32: =IF(EQUAL(Timesheet!RC, ""), "", Timesheet!RC) ->  | B32: =IF(EQUAL(Timesheet!RC, ""), "", Timesheet!RC) ->  | C32: =IF(EQUAL(Timesheet!RC, ""), "", Timesheet!RC) ->  | D32: =SUM(RC[+1]:RC[+12]) -> 0 | E32: =January2000!RC[+7] -> 0 | F32: =February2000!RC[+6] -> 0 | G32: =March2000!RC[+7] -> 0 | H32: =April2000!RC[+4] -> 0 | I32: =May2000!RC[+3] -> 0 | J32: =June2000!RC[+4] -> 0 | K32: =July2000!RC[+1] -> 0 | L32: =August2000!RC -> 0 | M32: =September2000!RC[+1] -> 0 | N32: =October2000!RC[-2] -> 0 | O32: =November2000!RC[-3] -> 0 | P32: =December2000!RC[-3] -> 0
A33: =IF(EQUAL(Timesheet!RC, ""), "", Timesheet!RC) ->  | B33: =IF(EQUAL(Timesheet!RC, ""), "", Timesheet!RC) ->  | C33: =IF(EQUAL(Timesheet!RC, ""), "", Timesheet!RC) ->  | D33: =SUM(RC[+1]:RC[+12]) -> 0 | E33: =January2000!RC[+7] -> 0 | F33: =February2000!RC[+6] -> 0 | G33: =March2000!RC[+7] -> 0 | H33: =April2000!RC[+4] -> 0 | I33: =May2000!RC[+3] -> 0 | J33: =June2000!RC[+4] -> 0 | K33: =July2000!RC[+1] -> 0 | L33: =August2000!RC -> 0 | M33: =September2000!RC[+1] -> 0 | N33: =October2000!RC[-2] -> 0 | O33: =November2000!RC[-3] -> 0 | P33: =December2000!RC[-3] -> 0
A34: =IF(EQUAL(Timesheet!RC, ""), "", Timesheet!RC) ->  | B34: =IF(EQUAL(Timesheet!RC, ""), "", Timesheet!RC) ->  | C34: =IF(EQUAL(Timesheet!RC, ""), "", Timesheet!RC) ->  | D34: =SUM(RC[+1]:RC[+12]) -> 0 | E34: =January2000!RC[+7] -> 0 | F34: =February2000!RC[+6] -> 0 | G34: =March2000!RC[+7] -> 0 | H34: =April2000!RC[+4] -> 0 | I34: =May2000!RC[+3] -> 0 | J34: =June2000!RC[+4] -> 0 | K34: =July2000!RC[+1] -> 0 | L34: =August2000!RC -> 0 | M34: =September2000!RC[+1] -> 0 | N34: =October2000!RC[-2] -> 0 | O34: =November2000!RC[-3] -> 0 | P34: =December2000!RC[-3] -> 0
A35: =IF(EQUAL(Timesheet!RC, ""), "", Timesheet!RC) ->  | B35: =IF(EQUAL(Timesheet!RC, ""), "", Timesheet!RC) ->  | C35: 'Mgmnt | D35: =SUM(RC[+1]:RC[+12]) -> 0 | E35: =January2000!RC[+7] -> 0 | F35: =February2000!RC[+6] -> 0 | G35: =March2000!RC[+7] -> 0 | H35: =April2000!RC[+4] -> 0 | I35: =May2000!RC[+3] -> 0 | J35: =June2000!RC[+4] -> 0 | K35: =July2000!RC[+1] -> 0 | L35: =August2000!RC -> 0 | M35: =September2000!RC[+1] -> 0 | N35: =October2000!RC[-2] -> 0 | O35: =November2000!RC[-3] -> 0 | P35: =December2000!RC[-3] -> 0
A36: =IF(EQUAL(Timesheet!RC, ""), "", Timesheet!RC) ->  | B36: =IF(EQUAL(Timesheet!RC, ""), "", Timesheet!RC) ->  | C36: =IF(EQUAL(Timesheet!RC, ""), "", Timesheet!RC) ->  | D36: =SUM(RC[+1]:RC[+12]) -> 0 | E36: =January2000!RC[+7] -> 0 | F36: =February2000!RC[+6] -> 0 | G36: =March2000!RC[+7] -> 0 | H36: =April2000!RC[+4] -> 0 | I36: =May2000!RC[+3] -> 0 | J36: =June2000!RC[+4] -> 0 | K36: =July2000!RC[+1] -> 0 | L36: =August2000!RC -> 0 | M36: =September2000!RC[+1] -> 0 | N36: =October2000!RC[-2] -> 0 | O36: =November2000!RC[-3] -> 0 | P36: =December2000!RC[-3] -> 0
A37: =IF(EQUAL(Timesheet!RC, ""), "", Timesheet!RC) ->  | B37: =IF(EQUAL(Timesheet!RC, ""), "", Timesheet!RC) ->  | C37: =IF(EQUAL(Timesheet!RC, ""), "", Timesheet!RC) ->  | D37: =SUM(RC[+1]:RC[+12]) -> 0 | E37: =January2000!RC[+7] -> 0 | F37: =February2000!RC[+6] -> 0 | G37: =March2000!RC[+7] -> 0 | H37: =April2000!RC[+4] -> 0 | I37: =May2000!RC[+3] -> 0 | J37: =June2000!RC[+4] -> 0 | K37: =July2000!RC[+1] -> 0 | L37: =August2000!RC -> 0 | M37: =September2000!RC[+1] -> 0 | N37: =October2000!RC[-2] -> 0 | O37: =November2000!RC[-3] -> 0 | P37: =December2000!RC[-3] -> 0
A38: =IF(EQUAL(Timesheet!RC, ""), "", Timesheet!RC) ->  | B38: =IF(EQUAL(Timesheet!RC, ""), "", Timesheet!RC) ->  | C38: =IF(EQUAL(Timesheet!RC, ""), "", Timesheet!RC) ->  | D38: =SUM(RC[+1]:RC[+12]) -> 0 | E38: =January2000!RC[+7] -> 0 | F38: =February2000!RC[+6] -> 0 | G38: =March2000!RC[+7] -> 0 | H38: =April2000!RC[+4] -> 0 | I38: =May2000!RC[+3] -> 0 | J38: =June2000!RC[+4] -> 0 | K38: =July2000!RC[+1] -> 0 | L38: =August2000!RC -> 0 | M38: =September2000!RC[+1] -> 0 | N38: =October2000!RC[-2] -> 0 | O38: =November2000!RC[-3] -> 0 | P38: =December2000!RC[-3] -> 0
A39: =IF(EQUAL(Timesheet!RC, ""), "", Timesheet!RC) ->  | B39: =IF(EQUAL(Timesheet!RC, ""), "", Timesheet!RC) ->  | C39: =IF(EQUAL(Timesheet!RC, ""), "", Timesheet!RC) ->  | D39: =SUM(RC[+1]:RC[+12]) -> 0 | E39: =January2000!RC[+7] -> 0 | F39: =February2000!RC[+6] -> 0 | G39: =March2000!RC[+7] -> 0 | H39: =April2000!RC[+4] -> 0 | I39: =May2000!RC[+3] -> 0 | J39: =June2000!RC[+4] -> 0 | K39: =July2000!RC[+1] -> 0 | L39: =August2000!RC -> 0 | M39: =September2000!RC[+1] -> 0 | N39: =October2000!RC[-2] -> 0 | O39: =November2000!RC[-3] -> 0 | P39: =December2000!RC[-3] -> 0
A40: =IF(EQUAL(Timesheet!RC, ""), "", Timesheet!RC) ->  | B40: =IF(EQUAL(Timesheet!RC, ""), "", Timesheet!RC) ->  | C40: =IF(EQUAL(Timesheet!RC, ""), "", Timesheet!RC) ->  | D40: =SUM(RC[+1]:RC[+12]) -> 0 | E40: =January2000!RC[+7] -> 0 | F40: =February2000!RC[+6] -> 0 | G40: =March2000!RC[+7] -> 0 | H40: =April2000!RC[+4] -> 0 | I40: =May2000!RC[+3] -> 0 | J40: =June2000!RC[+4] -> 0 | K40: =July2000!RC[+1] -> 0 | L40: =August2000!RC -> 0 | M40: =September2000!RC[+1] -> 0 | N40: =October2000!RC[-2] -> 0 | O40: =November2000!RC[-3] -> 0 | P40: =December2000!RC[-3] -> 0
A41: =IF(EQUAL(Timesheet!RC, ""), "", Timesheet!RC) ->  | B41: =IF(EQUAL(Timesheet!RC, ""), "", Timesheet!RC) ->  | C41: =IF(EQUAL(Timesheet!RC, ""), "", Timesheet!RC) ->  | D41: =SUM(RC[+1]:RC[+12]) -> 0 | E41: =January2000!RC[+7] -> 0 | F41: =February2000!RC[+6] -> 0 | G41: =March2000!RC[+7] -> 0 | H41: =April2000!RC[+4] -> 0 | I41: =May2000!RC[+3] -> 0 | J41: =June2000!RC[+4] -> 0 | K41: =July2000!RC[+1] -> 0 | L41: =August2000!RC -> 0 | M41: =September2000!RC[+1] -> 0 | N41: =October2000!RC[-2] -> 0 | O41: =November2000!RC[-3] -> 0 | P41: =December2000!RC[-3] -> 0
A42: =IF(EQUAL(Timesheet!RC, ""), "", Timesheet!RC) ->  | B42: =IF(EQUAL(Timesheet!RC, ""), "", Timesheet!RC) ->  | C42: =IF(EQUAL(Timesheet!RC, ""), "", Timesheet!RC) ->  | D42: =SUM(RC[+1]:RC[+12]) -> 0 | E42: =January2000!RC[+7] -> 0 | F42: =February2000!RC[+6] -> 0 | G42: =March2000!RC[+7] -> 0 | H42: =April2000!RC[+4] -> 0 | I42: =May2000!RC[+3] -> 0 | J42: =June2000!RC[+4] -> 0 | K42: =July2000!RC[+1] -> 0 | L42: =August2000!RC -> 0 | M42: =September2000!RC[+1] -> 0 | N42: =October2000!RC[-2] -> 0 | O42: =November2000!RC[-3] -> 0 | P42: =December2000!RC[-3] -> 0
A43: =IF(EQUAL(Timesheet!RC, ""), "", Timesheet!RC) ->  | B43: =IF(EQUAL(Timesheet!RC, ""), "", Timesheet!RC) ->  | C43: =IF(EQUAL(Timesheet!RC, ""), "", Timesheet!RC) ->  | D43: =SUM(RC[+1]:RC[+12]) -> 0 | E43: =January2000!RC[+7] -> 0 | F43: =February2000!RC[+6] -> 0 | G43: =March2000!RC[+7] -> 0 | H43: =April2000!RC[+4] -> 0 | I43: =May2000!RC[+3] -> 0 | J43: =June2000!RC[+4] -> 0 | K43: =July2000!RC[+1] -> 0 | L43: =August2000!RC -> 0 | M43: =September2000!RC[+1] -> 0 | N43: =October2000!RC[-2] -> 0 | O43: =November2000!RC[-3] -> 0 | P43: =December2000!RC[-3] -> 0
A44: =IF(EQUAL(Timesheet!RC, ""), "", Timesheet!RC) ->  | B44: =IF(EQUAL(Timesheet!RC, ""), "", Timesheet!RC) ->  | C44: =IF(EQUAL(Timesheet!RC, ""), "", Timesheet!RC) ->  | D44: =SUM(RC[+1]:RC[+12]) -> 0 | E44: =January2000!RC[+7] -> 0 | F44: =February2000!RC[+6] -> 0 | G44: =March2000!RC[+7] -> 0 | H44: =April2000!RC[+4] -> 0 | I44: =May2000!RC[+3] -> 0 | J44: =June2000!RC[+4] -> 0 | K44: =July2000!RC[+1] -> 0 | L44: =August2000!RC -> 0 | M44: =September2000!RC[+1] -> 0 | N44: =October2000!RC[-2] -> 0 | O44: =November2000!RC[-3] -> 0 | P44: =December2000!RC[-3] -> 0
A45: =IF(EQUAL(Timesheet!RC, ""), "", Timesheet!RC) ->  | B45: =IF(EQUAL(Timesheet!RC, ""), "", Timesheet!RC) ->  | C45: =IF(EQUAL(Timesheet!RC, ""), "", Timesheet!RC) ->  | D45: =SUM(RC[+1]:RC[+12]) -> 0 | E45: =January2000!RC[+7] -> 0 | F45: =February2000!RC[+6] -> 0 | G45: =March2000!RC[+7] -> 0 | H45: =April2000!RC[+4] -> 0 | I45: =May2000!RC[+3] -> 0 | J45: =June2000!RC[+4] -> 0 | K45: =July2000!RC[+1] -> 0 | L45: =August2000!RC -> 0 | M45: =September2000!RC[+1] -> 0 | N45: =October2000!RC[-2] -> 0 | O45: =November2000!RC[-3] -> 0 | P45: =December2000!RC[-3] -> 0
A46: =IF(EQUAL(Timesheet!RC, ""), "", Timesheet!RC) ->  | B46: =IF(EQUAL(Timesheet!RC, ""), "", Timesheet!RC) ->  | C46: =IF(EQUAL(Timesheet!RC, ""), "", Timesheet!RC) ->  | D46: =SUM(RC[+1]:RC[+12]) -> 0 | E46: =January2000!RC[+7] -> 0 | F46: =February2000!RC[+6] -> 0 | G46: =March2000!RC[+7] -> 0 | H46: =April2000!RC[+4] -> 0 | I46: =May2000!RC[+3] -> 0 | J46: =June2000!RC[+4] -> 0 | K46: =July2000!RC[+1] -> 0 | L46: =August2000!RC -> 0 | M46: =September2000!RC[+1] -> 0 | N46: =October2000!RC[-2] -> 0 | O46: =November2000!RC[-3] -> 0 | P46: =December2000!RC[-3] -> 0
A47: =IF(EQUAL(Timesheet!RC, ""), "", Timesheet!RC) ->  | B47: =IF(EQUAL(Timesheet!RC, ""), "", Timesheet!RC) ->  | C47: =IF(EQUAL(Timesheet!RC, ""), "", Timesheet!RC) ->  | D47: =SUM(RC[+1]:RC[+12]) -> 0 | E47: =January2000!RC[+7] -> 0 | F47: =February2000!RC[+6] -> 0 | G47: =March2000!RC[+7] -> 0 | H47: =April2000!RC[+4] -> 0 | I47: =May2000!RC[+3] -> 0 | J47: =June2000!RC[+4] -> 0 | K47: =July2000!RC[+1] -> 0 | L47: =August2000!RC -> 0 | M47: =September2000!RC[+1] -> 0 | N47: =October2000!RC[-2] -> 0 | O47: =November2000!RC[-3] -> 0 | P47: =December2000!RC[-3] -> 0
A48: =IF(EQUAL(Timesheet!RC, ""), "", Timesheet!RC) ->  | B48: =IF(EQUAL(Timesheet!RC, ""), "", Timesheet!RC) ->  | C48: =IF(EQUAL(Timesheet!RC, ""), "", Timesheet!RC) ->  | D48: =SUM(RC[+1]:RC[+12]) -> 0 | E48: =January2000!RC[+7] -> 0 | F48: =February2000!RC[+6] -> 0 | G48: =March2000!RC[+7] -> 0 | H48: =April2000!RC[+4] -> 0 | I48: =May2000!RC[+3] -> 0 | J48: =June2000!RC[+4] -> 0 | K48: =July2000!RC[+1] -> 0 | L48: =August2000!RC -> 0 | M48: =September2000!RC[+1] -> 0 | N48: =October2000!RC[-2] -> 0 | O48: =November2000!RC[-3] -> 0 | P48: =December2000!RC[-3] -> 0
A49: =IF(EQUAL(Timesheet!RC, ""), "", Timesheet!RC) ->  | B49: =IF(EQUAL(Timesheet!RC, ""), "", Timesheet!RC) ->  | C49: =IF(EQUAL(Timesheet!RC, ""), "", Timesheet!RC) ->  | D49: =SUM(RC[+1]:RC[+12]) -> 0 | E49: =January2000!RC[+7] -> 0 | F49: =February2000!RC[+6] -> 0 | G49: =March2000!RC[+7] -> 0 | H49: =April2000!RC[+4] -> 0 | I49: =May2000!RC[+3] -> 0 | J49: =June2000!RC[+4] -> 0 | K49: =July2000!RC[+1] -> 0 | L49: =August2000!RC -> 0 | M49: =September2000!RC[+1] -> 0 | N49: =October2000!RC[-2] -> 0 | O49: =November2000!RC[-3] -> 0 | P49: =December2000!RC[-3] -> 0
A50: =IF(EQUAL(Timesheet!RC, ""), "", Timesheet!RC) ->  | B50: =IF(EQUAL(Timesheet!RC, ""), "", Timesheet!RC) ->  | C50: =IF(EQUAL(Timesheet!RC, ""), "", Timesheet!RC) ->  | D50: =SUM(RC[+1]:RC[+12]) -> 0 | E50: =January2000!RC[+7] -> 0 | F50: =February2000!RC[+6] -> 0 | G50: =March2000!RC[+7] -> 0 | H50: =April2000!RC[+4] -> 0 | I50: =May2000!RC[+3] -> 0 | J50: =June2000!RC[+4] -> 0 | K50: =July2000!RC[+1] -> 0 | L50: =August2000!RC -> 0 | M50: =September2000!RC[+1] -> 0 | N50: =October2000!RC[-2] -> 0 | O50: =November2000!RC[-3] -> 0 | P50: =December2000!RC[-3] -> 0
A51: =IF(EQUAL(Timesheet!RC, ""), "", Timesheet!RC) ->  | B51: =IF(EQUAL(Timesheet!RC, ""), "", Timesheet!RC) ->  | C51: =IF(EQUAL(Timesheet!RC, ""), "", Timesheet!RC) ->  | D51: =SUM(RC[+1]:RC[+12]) -> 0 | E51: =January2000!RC[+7] -> 0 | F51: =February2000!RC[+6] -> 0 | G51: =March2000!RC[+7] -> 0 | H51: =April2000!RC[+4] -> 0 | I51: =May2000!RC[+3] -> 0 | J51: =June2000!RC[+4] -> 0 | K51: =July2000!RC[+1] -> 0 | L51: =August2000!RC -> 0 | M51: =September2000!RC[+1] -> 0 | N51: =October2000!RC[-2] -> 0 | O51: =November2000!RC[-3] -> 0 | P51: =December2000!RC[-3] -> 0
A52: =IF(EQUAL(Timesheet!RC, ""), "", Timesheet!RC) ->  | B52: =IF(EQUAL(Timesheet!RC, ""), "", Timesheet!RC) ->  | C52: =IF(EQUAL(Timesheet!RC, ""), "", Timesheet!RC) ->  | D52: =SUM(RC[+1]:RC[+12]) -> 0 | E52: =January2000!RC[+7] -> 0 | F52: =February2000!RC[+6] -> 0 | G52: =March2000!RC[+7] -> 0 | H52: =April2000!RC[+4] -> 0 | I52: =May2000!RC[+3] -> 0 | J52: =June2000!RC[+4] -> 0 | K52: =July2000!RC[+1] -> 0 | L52: =August2000!RC -> 0 | M52: =September2000!RC[+1] -> 0 | N52: =October2000!RC[-2] -> 0 | O52: =November2000!RC[-3] -> 0 | P52: =December2000!RC[-3] -> 0
A53: =IF(EQUAL(Timesheet!RC, ""), "", Timesheet!RC) ->  | B53: =IF(EQUAL(Timesheet!RC, ""), "", Timesheet!RC) ->  | C53: =IF(EQUAL(Timesheet!RC, ""), "", Timesheet!RC) ->  | D53: =SUM(RC[+1]:RC[+12]) -> 0 | E53: =January2000!RC[+7] -> 0 | F53: =February2000!RC[+6] -> 0 | G53: =March2000!RC[+7] -> 0 | H53: =April2000!RC[+4] -> 0 | I53: =May2000!RC[+3] -> 0 | J53: =June2000!RC[+4] -> 0 | K53: =July2000!RC[+1] -> 0 | L53: =August2000!RC -> 0 | M53: =September2000!RC[+1] -> 0 | N53: =October2000!RC[-2] -> 0 | O53: =November2000!RC[-3] -> 0 | P53: =December2000!RC[-3] -> 0
A54: 'TOTAL | D54: =SUM(R[-51]C:R[-1]C) -> 0 | E54: =SUM(R[-51]C:R[-1]C) -> 0 | F54: =SUM(R[-51]C:R[-1]C) -> 0 | G54: =SUM(R[-51]C:R[-1]C) -> 0 | H54: =SUM(R[-51]C:R[-1]C) -> 0 | I54: =SUM(R[-51]C:R[-1]C) -> 0 | J54: =SUM(R[-51]C:R[-1]C) -> 0 | K54: =SUM(R[-51]C:R[-1]C) -> 0 | L54: =SUM(R[-51]C:R[-1]C) -> 0 | M54: =SUM(R[-51]C:R[-1]C) -> 0 | N54: =SUM(R[-51]C:R[-1]C) -> 0 | O54: =SUM(R[-51]C:R[-1]C) -> 0 | P54: =SUM(R[-51]C:R[-1]C) -> 0

Sheet: January2000
A1: 'CODE | B1: 'AUDIT DESCRIPTION | C1: 'Category | D1: 'Week Ending
D2: 36533 | E2: 'Susan | F2: =RC[-2]+7 -> 36540 | G2: 'Susan | H2: =RC[-2]+7 -> 36547 | I2: 'Susan | J2: =RC[-2]+7 -> 36554 | K2: 'Susan | L2: 'Total
A3: =IF(EQUAL(Timesheet!RC, ""), "", Timesheet!RC) -> 1001 | B3: =IF(EQUAL(Timesheet!RC, ""), "", Timesheet!RC) -> PURCHASING | C3: =IF(EQUAL(Timesheet!RC, ""), "", Timesheet!RC) -> Mgmnt | D3: 0 | E3: 0 | F3: 0 | G3: 0 | H3: 0 | I3: 0 | J3: 0 | K3: 0 | L3: =SUM(RC[-8]:RC[-1]) -> 0
A4: =IF(EQUAL(Timesheet!RC, ""), "", Timesheet!RC) -> 1002 | B4: =IF(EQUAL(Timesheet!RC, ""), "", Timesheet!RC) -> HUMAN RESOURCE | C4: =IF(EQUAL(Timesheet!RC, ""), "", Timesheet!RC) -> Plan | D4: 0 | E4: 0 | F4: 0 | G4: 0 | H4: 0 | I4: 0 | J4: 0 | K4: 0 | L4: =SUM(RC[-8]:RC[-1]) -> 0
A5: =IF(EQUAL(Timesheet!RC, ""), "", Timesheet!RC) -> 1005 | B5: =IF(EQUAL(Timesheet!RC, ""), "", Timesheet!RC) -> CORPORATE AUDIT RISK ANALYSIS | C5: =IF(EQUAL(Timesheet!RC, ""), "", Timesheet!RC) -> Plan | D5: 0 | E5: 0 | F5: 0 | G5: 0 | H5: 0 | I5: 0 | J5: 0 | K5: 0 | L5: =SUM(RC[-8]:RC[-1]) -> 0
A6: =IF(EQUAL(Timesheet!RC, ""), "", Timesheet!RC) -> 1007 | B6: =IF(EQUAL(Timesheet!RC, ""), "", Timesheet!RC) -> OFFICER'S TRAVEL & EXPENSE | C6: =IF(EQUAL(Timesheet!RC, ""), "", Timesheet!RC) -> Plan | D6: 0 | E6: 0 | F6: 0 | G6: 0 | H6: 0 | I6: 0 | J6: 0 | K6: 0 | L6: =SUM(RC[-8]:RC[-1]) -> 0
A7: =IF(EQUAL(Timesheet!RC, ""), "", Timesheet!RC) -> 1008 | B7: =IF(EQUAL(Timesheet!RC, ""), "", Timesheet!RC) -> RECORD RETENTION | C7: =IF(EQUAL(Timesheet!RC, ""), "", Timesheet!RC) -> Mgmnt | D7: 0 | E7: 0 | F7: 0 | G7: 0 | H7: 0 | I7: 0 | J7: 0 | K7: 0 | L7: =SUM(RC[-8]:RC[-1]) -> 0
A8: =IF(EQUAL(Timesheet!RC, ""), "", Timesheet!RC) -> 1009 | B8: =IF(EQUAL(Timesheet!RC, ""), "", Timesheet!RC) -> NASD AUDITS | C8: =IF(EQUAL(Timesheet!RC, ""), "", Timesheet!RC) -> Plan | D8: 0 | E8: 0 | F8: 0 | G8: 0 | H8: 0 | I8: 0 | J8: 0 | K8: 0 | L8: =SUM(RC[-8]:RC[-1]) -> 0
A9: =IF(EQUAL(Timesheet!RC, ""), "", Timesheet!RC) -> 1011 | B9: =IF(EQUAL(Timesheet!RC, ""), "", Timesheet!RC) -> SURPRISE CASH AUDIT - NEW YORK | C9: =IF(EQUAL(Timesheet!RC, ""), "", Timesheet!RC) -> Plan | D9: 0 | E9: 0 | F9: 0 | G9: 0 | H9: 0 | I9: 0 | J9: 0 | K9: 0 | L9: =SUM(RC[-8]:RC[-1]) -> 0
A10: =IF(EQUAL(Timesheet!RC, ""), "", Timesheet!RC) -> 1012 | B10: =IF(EQUAL(Timesheet!RC, ""), "", Timesheet!RC) -> INTERNATIONAL AUDIT - IBI | C10: =IF(EQUAL(Timesheet!RC, ""), "", Timesheet!RC) -> Plan | D10: 0 | E10: 0 | F10: 0 | G10: 0 | H10: 0 | I10: 0 | J10: 0 | K10: 0 | L10: =SUM(RC[-8]:RC[-1]) -> 0
A11: =IF(EQUAL(Timesheet!RC, ""), "", Timesheet!RC) -> 1013 | B11: =IF(EQUAL(Timesheet!RC, ""), "", Timesheet!RC) -> INTERNATIONAL AUDIT - CISL | C11: =IF(EQUAL(Timesheet!RC, ""), "", Timesheet!RC) -> Plan | D11: 0 | E11: 0 | F11: 0 | G11: 0 | H11: 0 | I11: 0 | J11: 0 | K11: 0 | L11: =SUM(RC[-8]:RC[-1]) -> 0
A12: =IF(EQUAL(Timesheet!RC, ""), "", Timesheet!RC) -> 1014 | B12: =IF(EQUAL(Timesheet!RC, ""), "", Timesheet!RC) -> MARKETING AND COMMUNICATION | C12: =IF(EQUAL(Timesheet!RC, ""), "", Timesheet!RC) -> Mgmnt | D12: 0 | E12: 0 | F12: 0 | G12: 0 | H12: 0 | I12: 0 | J12: 0 | K12: 0 | L12: =SUM(RC[-8]:RC[-1]) -> 0
A13: =IF(EQUAL(Timesheet!RC, ""), "", Timesheet!RC) -> 3001 | B13: =IF(EQUAL(Timesheet!RC, ""), "", Timesheet!RC) -> FIELD OFFICE CONTROL REVIEWS | C13: =IF(EQUAL(Timesheet!RC, ""), "", Timesheet!RC) -> Field | D13: 0 | E13: 0 | F13: 0 | G13: 0 | H13: 0 | I13: 0 | J13: 0 | K13: 0 | L13: =SUM(RC[-8]:RC[-1]) -> 0
A14: =IF(EQUAL(Timesheet!RC, ""), "", Timesheet!RC) -> 3002 | B14: =IF(EQUAL(Timesheet!RC, ""), "", Timesheet!RC) -> FIELD OFFICE ACCOUNTABILITY ANALYSIS | C14: =IF(EQUAL(Timesheet!RC, ""), "", Timesheet!RC) -> Field | D14: 0 | E14: 0 | F14: 0 | G14: 0 | H14: 0 | I14: 0 | J14: 0 | K14: 0 | L14: =SUM(RC[-8]:RC[-1]) -> 0
A15: =IF(EQUAL(Timesheet!RC, ""), "", Timesheet!RC) -> 3010 | B15: =IF(EQUAL(Timesheet!RC, ""), "", Timesheet!RC) -> FIELD OFFICE BANK RECONCILATIONS | C15: =IF(EQUAL(Timesheet!RC, ""), "", Timesheet!RC) -> Field | D15: 0 | E15: 0 | F15: 0 | G15: 0 | H15: 0 | I15: 0 | J15: 0 | K15: 0 | L15: =SUM(RC[-8]:RC[-1]) -> 0
A16: =IF(EQUAL(Timesheet!RC, ""), "", Timesheet!RC) -> 3020 | B16: =IF(EQUAL(Timesheet!RC, ""), "", Timesheet!RC) -> FIELD AUDIT PROGRAM DEVELOPMENT | C16: =IF(EQUAL(Timesheet!RC, ""), "", Timesheet!RC) -> Field | D16: 0 | E16: 0 | F16: 0 | G16: 0 | H16: 0 | I16: 0 | J16: 0 | K16: 0 | L16: =SUM(RC[-8]:RC[-1]) -> 0
A17: =IF(EQUAL(Timesheet!RC, ""), "", Timesheet!RC) -> 3030 | B17: =IF(EQUAL(Timesheet!RC, ""), "", Timesheet!RC) -> OPEN COMMITMENT ANALYSIS | C17: =IF(EQUAL(Timesheet!RC, ""), "", Timesheet!RC) -> Field | D17: 0 | E17: 0 | F17: 0 | G17: 0 | H17: 0 | I17: 0 | J17: 0 | K17: 0 | L17: =SUM(RC[-8]:RC[-1]) -> 0
A18: =IF(EQUAL(Timesheet!RC, ""), "", Timesheet!RC) -> 3040 | B18: =IF(EQUAL(Timesheet!RC, ""), "", Timesheet!RC) -> FIELD AUDIT RISK ASSESMENT | C18: =IF(EQUAL(Timesheet!RC, ""), "", Timesheet!RC) -> Field | D18: 0 | E18: 0 | F18: 0 | G18: 0 | H18: 0 | I18: 0 | J18: 0 | K18: 0 | L18: =SUM(RC[-8]:RC[-1]) -> 0
A19: =IF(EQUAL(Timesheet!RC, ""), "", Timesheet!RC) -> 3050 | B19: =IF(EQUAL(Timesheet!RC, ""), "", Timesheet!RC) -> NEW YORK FIELD AUDIT REVIEWS | C19: =IF(EQUAL(Timesheet!RC, ""), "", Timesheet!RC) -> Field | D19: 0 | E19: 0 | F19: 0 | G19: 0 | H19: 0 | I19: 0 | J19: 0 | K19: 0 | L19: =SUM(RC[-8]:RC[-1]) -> 0
A20: =IF(EQUAL(Timesheet!RC, ""), "", Timesheet!RC) -> 4001 | B20: =IF(EQUAL(Timesheet!RC, ""), "", Timesheet!RC) -> GRANT THORNTON | C20: =IF(EQUAL(Timesheet!RC, ""), "", Timesheet!RC) -> Mgmnt | D20: 0 | E20: 0 | F20: 0 | G20: 0 | H20: 0 | I20: 0 | J20: 0 | K20: 0 | L20: =SUM(RC[-8]:RC[-1]) -> 0
A21: =IF(EQUAL(Timesheet!RC, ""), "", Timesheet!RC) -> 5001 | B21: =IF(EQUAL(Timesheet!RC, ""), "", Timesheet!RC) -> MISCELLANEOUS AUDIT REQUESTS | C21: =IF(EQUAL(Timesheet!RC, ""), "", Timesheet!RC) -> Mgmnt | D21: 0 | E21: 0 | F21: 0 | G21: 0 | H21: 0 | I21: 0 | J21: 0 | K21: 0 | L21: =SUM(RC[-8]:RC[-1]) -> 0
A22: =IF(EQUAL(Timesheet!RC, ""), "", Timesheet!RC) -> 5009 | B22: =IF(EQUAL(Timesheet!RC, ""), "", Timesheet!RC) -> FORMS INVENTORY | C22: =IF(EQUAL(Timesheet!RC, ""), "", Timesheet!RC) -> Plan | D22: 0 | E22: 0 | F22: 0 | G22: 0 | H22: 0 | I22: 0 | J22: 0 | K22: 0 | L22: =SUM(RC[-8]:RC[-1]) -> 0
A23: =IF(EQUAL(Timesheet!RC, ""), "", Timesheet!RC) -> 5010 | B23: =IF(EQUAL(Timesheet!RC, ""), "", Timesheet!RC) -> SURPRISE CHECK VALIDATION | C23: =IF(EQUAL(Timesheet!RC, ""), "", Timesheet!RC) -> Plan | D23: 0 | E23: 0 | F23: 0 | G23: 0 | H23: 0 | I23: 0 | J23: 0 | K23: 0 | L23: =SUM(RC[-8]:RC[-1]) -> 0
A24: =IF(EQUAL(Timesheet!RC, ""), "", Timesheet!RC) -> 7000 | B24: =IF(EQUAL(Timesheet!RC, ""), "", Timesheet!RC) -> NON-PROJECT RELATED (MEETINGS) | C24: =IF(EQUAL(Timesheet!RC, ""), "", Timesheet!RC) -> Non-Audit | D24: 0 | E24: 0 | F24: 0 | G24: 0 | H24: 0 | I24: 0 | J24: 0 | K24: 0 | L24: =SUM(RC[-8]:RC[-1]) -> 0
A25: =IF(EQUAL(Timesheet!RC, ""), "", Timesheet!RC) -> 7003 | B25: =IF(EQUAL(Timesheet!RC, ""), "", Timesheet!RC) -> AUDIT COMMITTEE | C25: =IF(EQUAL(Timesheet!RC, ""), "", Timesheet!RC) -> Non-Audit | D25: 0 | E25: 0 | F25: 0 | G25: 0 | H25: 0 | I25: 0 | J25: 0 | K25: 0 | L25: =SUM(RC[-8]:RC[-1]) -> 0
A26: =IF(EQUAL(Timesheet!RC, ""), "", Timesheet!RC) -> 8001 | B26: =IF(EQUAL(Timesheet!RC, ""), "", Timesheet!RC) -> ADMINISTRATIVE - GENERAL | C26: =IF(EQUAL(Timesheet!RC, ""), "", Timesheet!RC) -> Admin | D26: 0 | E26: 0 | F26: 0 | G26: 0 | H26: 0 | I26: 0 | J26: 0 | K26: 0 | L26: =SUM(RC[-8]:RC[-1]) -> 0
A27: =IF(EQUAL(Timesheet!RC, ""), "", Timesheet!RC) -> 8002 | B27: =IF(EQUAL(Timesheet!RC, ""), "", Timesheet!RC) -> HOLIDAYS | C27: =IF(EQUAL(Timesheet!RC, ""), "", Timesheet!RC) -> Admin | D27: 0 | E27: 0 | F27: 0 | G27: 0 | H27: 0 | I27: 0 | J27: 0 | K27: 0 | L27: =SUM(RC[-8]:RC[-1]) -> 0
A28: =IF(EQUAL(Timesheet!RC, ""), "", Timesheet!RC) -> 8004 | B28: =IF(EQUAL(Timesheet!RC, ""), "", Timesheet!RC) -> SEMINARS & TRAINING | C28: =IF(EQUAL(Timesheet!RC, ""), "", Timesheet!RC) -> Admin | D28: 0 | E28: 0 | F28: 0 | G28: 0 | H28: 0 | I28: 0 | J28: 0 | K28: 0 | L28: =SUM(RC[-8]:RC[-1]) -> 0
A29: =IF(EQUAL(Timesheet!RC, ""), "", Timesheet!RC) -> 8005 | B29: =IF(EQUAL(Timesheet!RC, ""), "", Timesheet!RC) -> PERSONAL (VACATION/AT) | C29: =IF(EQUAL(Timesheet!RC, ""), "", Timesheet!RC) -> Admin | D29: 0 | E29: 0 | F29: 0 | G29: 0 | H29: 0 | I29: 0 | J29: 0 | K29: 0 | L29: =SUM(RC[-8]:RC[-1]) -> 0
A30: =IF(EQUAL(Timesheet!RC, ""), "", Timesheet!RC) -> 8006 | B30: =IF(EQUAL(Timesheet!RC, ""), "", Timesheet!RC) -> SICK | C30: =IF(EQUAL(Timesheet!RC, ""), "", Timesheet!RC) -> Admin | D30: 0 | E30: 0 | F30: 0 | G30: 0 | H30: 0 | I30: 0 | J30: 0 | K30: 0 | L30: =SUM(RC[-8]:RC[-1]) -> 0
A31: =IF(EQUAL(Timesheet!RC, ""), "", Timesheet!RC) -> 8008 | B31: =IF(EQUAL(Timesheet!RC, ""), "", Timesheet!RC) -> RESEARCH | C31: =IF(EQUAL(Timesheet!RC, ""), "", Timesheet!RC) -> Non-Audit | D31: 0 | E31: 0 | F31: 0 | G31: 0 | H31: 0 | I31: 0 | J31: 0 | K31: 0 | L31: =SUM(RC[-8]:RC[-1]) -> 0
A32: =IF(EQUAL(Timesheet!RC, ""), "", Timesheet!RC) ->  | B32: =IF(EQUAL(Timesheet!RC, ""), "", Timesheet!RC) ->  | C32: =IF(EQUAL(Timesheet!RC, ""), "", Timesheet!RC) ->  | D32: 0 | E32: 0 | F32: 0 | G32: 0 | H32: 0 | I32: 0 | J32: 0 | K32: 0 | L32: =SUM(RC[-8]:RC[-1]) -> 0
A33: =IF(EQUAL(Timesheet!RC, ""), "", Timesheet!RC) ->  | B33: =IF(EQUAL(Timesheet!RC, ""), "", Timesheet!RC) ->  | C33: =IF(EQUAL(Timesheet!RC, ""), "", Timesheet!RC) ->  | D33: 0 | E33: 0 | F33: 0 | G33: 0 | H33: 0 | I33: 0 | J33: 0 | K33: 0 | L33: =SUM(RC[-8]:RC[-1]) -> 0
A34: =IF(EQUAL(Timesheet!RC, ""), "", Timesheet!RC) ->  | B34: =IF(EQUAL(Timesheet!RC, ""), "", Timesheet!RC) ->  | C34: =IF(EQUAL(Timesheet!RC, ""), "", Timesheet!RC) ->  | D34: 0 | E34: 0 | F34: 0 | G34: 0 | H34: 0 | I34: 0 | J34: 0 | K34: 0 | L34: =SUM(RC[-8]:RC[-1]) -> 0
A35: =IF(EQUAL(Timesheet!RC, ""), "", Timesheet!RC) ->  | B35: =IF(EQUAL(Timesheet!RC, ""), "", Timesheet!RC) ->  | C35: =IF(EQUAL(Timesheet!RC, ""), "", Timesheet!RC) ->  | D35: 0 | E35: 0 | F35: 0 | G35: 0 | H35: 0 | I35: 0 | J35: 0 | K35: 0 | L35: =SUM(RC[-8]:RC[-1]) -> 0
A36: =IF(EQUAL(Timesheet!RC, ""), "", Timesheet!RC) ->  | B36: =IF(EQUAL(Timesheet!RC, ""), "", Timesheet!RC) ->  | C36: =IF(EQUAL(Timesheet!RC, ""), "", Timesheet!RC) ->  | D36: 0 | E36: 0 | F36: 0 | G36: 0 | H36: 0 | I36: 0 | J36: 0 | K36: 0 | L36: =SUM(RC[-8]:RC[-1]) -> 0
A37: =IF(EQUAL(Timesheet!RC, ""), "", Timesheet!RC) ->  | B37: =IF(EQUAL(Timesheet!RC, ""), "", Timesheet!RC) ->  | C37: =IF(EQUAL(Timesheet!RC, ""), "", Timesheet!RC) ->  | D37: 0 | E37: 0 | F37: 0 | G37: 0 | H37: 0 | I37: 0 | J37: 0 | K37: 0 | L37: =SUM(RC[-8]:RC[-1]) -> 0
A38: =IF(EQUAL(Timesheet!RC, ""), "", Timesheet!RC) ->  | B38: =IF(EQUAL(Timesheet!RC, ""), "", Timesheet!RC) ->  | C38: =IF(EQUAL(Timesheet!RC, ""), "", Timesheet!RC) ->  | D38: 0 | E38: 0 | F38: 0 | G38: 0 | H38: 0 | I38: 0 | J38: 0 | K38: 0 | L38: =SUM(RC[-8]:RC[-1]) -> 0
A39: =IF(EQUAL(Timesheet!RC, ""), "", Timesheet!RC) ->  | B39: =IF(EQUAL(Timesheet!RC, ""), "", Timesheet!RC) ->  | C39: =IF(EQUAL(Timesheet!RC, ""), "", Timesheet!RC) ->  | D39: 0 | E39: 0 | F39: 0 | G39: 0 | H39: 0 | I39: 0 | J39: 0 | K39: 0 | L39: =SUM(RC[-8]:RC[-1]) -> 0
A40: =IF(EQUAL(Timesheet!RC, ""), "", Timesheet!RC) ->  | B40: =IF(EQUAL(Timesheet!RC, ""), "", Timesheet!RC) ->  | C40: =IF(EQUAL(Timesheet!RC, ""), "", Timesheet!RC) ->  | D40: 0 | E40: 0 | F40: 0 | G40: 0 | H40: 0 | I40: 0 | J40: 0 | K40: 0 | L40: =SUM(RC[-8]:RC[-1]) -> 0
A41: =IF(EQUAL(Timesheet!RC, ""), "", Timesheet!RC) ->  | B41: =IF(EQUAL(Timesheet!RC, ""), "", Timesheet!RC) ->  | C41: =IF(EQUAL(Timesheet!RC, ""), "", Timesheet!RC) ->  | D41: 0 | E41: 0 | F41: 0 | G41: 0 | H41: 0 | I41: 0 | J41: 0 | K41: 0 | L41: =SUM(RC[-8]:RC[-1]) -> 0
A42: =IF(EQUAL(Timesheet!RC, ""), "", Timesheet!RC) ->  | B42: =IF(EQUAL(Timesheet!RC, ""), "", Timesheet!RC) ->  | C42: =IF(EQUAL(Timesheet!RC, ""), "", Timesheet!RC) ->  | D42: 0 | E42: 0 | F42: 0 | G42: 0 | H42: 0 | I42: 0 | J42: 0 | K42: 0 | L42: =SUM(RC[-8]:RC[-1]) -> 0
A43: =IF(EQUAL(Timesheet!RC, ""), "", Timesheet!RC) ->  | B43: =IF(EQUAL(Timesheet!RC, ""), "", Timesheet!RC) ->  | C43: =IF(EQUAL(Timesheet!RC, ""), "", Timesheet!RC) ->  | D43: 0 | E43: 0 | F43: 0 | G43: 0 | H43: 0 | I43: 0 | J43: 0 | K43: 0 | L43: =SUM(RC[-8]:RC[-1]) -> 0
A44: =IF(EQUAL(Timesheet!RC, ""), "", Timesheet!RC) ->  | B44: =IF(EQUAL(Timesheet!RC, ""), "", Timesheet!RC) ->  | C44: =IF(EQUAL(Timesheet!RC, ""), "", Timesheet!RC) ->  | D44: 0 | E44: 0 | F44: 0 | G44: 0 | H44: 0 | I44: 0 | J44: 0 | K44: 0 | L44: =SUM(RC[-8]:RC[-1]) -> 0
A45: =IF(EQUAL(Timesheet!RC, ""), "", Timesheet!RC) ->  | B45: =IF(EQUAL(Timesheet!RC, ""), "", Timesheet!RC) ->  | C45: =IF(EQUAL(Timesheet!RC, ""), "", Timesheet!RC) ->  | D45: 0 | E45: 0 | F45: 0 | G45: 0 | H45: 0 | I45: 0 | J45: 0 | K45: 0 | L45: =SUM(RC[-8]:RC[-1]) -> 0
A46: =IF(EQUAL(Timesheet!RC, ""), "", Timesheet!RC) ->  | B46: =IF(EQUAL(Timesheet!RC, ""), "", Timesheet!RC) ->  | C46: =IF(EQUAL(Timesheet!RC, ""), "", Timesheet!RC) ->  | D46: 0 | E46: 0 | F46: 0 | G46: 0 | H46: 0 | I46: 0 | J46: 0 | K46: 0 | L46: =SUM(RC[-8]:RC[-1]) -> 0
A47: =IF(EQUAL(Timesheet!RC, ""), "", Timesheet!RC) ->  | B47: =IF(EQUAL(Timesheet!RC, ""), "", Timesheet!RC) ->  | C47: =IF(EQUAL(Timesheet!RC, ""), "", Timesheet!RC) ->  | D47: 0 | E47: 0 | F47: 0 | G47: 0 | H47: 0 | I47: 0 | J47: 0 | K47: 0 | L47: =SUM(RC[-8]:RC[-1]) -> 0
A48: =IF(EQUAL(Timesheet!RC, ""), "", Timesheet!RC) ->  | B48: =IF(EQUAL(Timesheet!RC, ""), "", Timesheet!RC) ->  | C48: =IF(EQUAL(Timesheet!RC, ""), "", Timesheet!RC) ->  | D48: 0 | E48: 0 | F48: 0 | G48: 0 | H48: 0 | I48: 0 | J48: 0 | K48: 0 | L48: =SUM(RC[-8]:RC[-1]) -> 0
A49: =IF(EQUAL(Timesheet!RC, ""), "", Timesheet!RC) ->  | B49: =IF(EQUAL(Timesheet!RC, ""), "", Timesheet!RC) ->  | C49: =IF(EQUAL(Timesheet!RC, ""), "", Timesheet!RC) ->  | D49: 0 | E49: 0 | F49: 0 | G49: 0 | H49: 0 | I49: 0 | J49: 0 | K49: 0 | L49: =SUM(RC[-8]:RC[-1]) -> 0
A50: =IF(EQUAL(Timesheet!RC, ""), "", Timesheet!RC) ->  | B50: =IF(EQUAL(Timesheet!RC, ""), "", Timesheet!RC) ->  | C50: =IF(EQUAL(Timesheet!RC, ""), "", Timesheet!RC) ->  | D50: 0 | E50: 0 | F50: 0 | G50: 0 | H50: 0 | I50: 0 | J50: 0 | K50: 0 | L50: =SUM(RC[-8]:RC[-1]) -> 0
A51: =IF(EQUAL(Timesheet!RC, ""), "", Timesheet!RC) ->  | B51: =IF(EQUAL(Timesheet!RC, ""), "", Timesheet!RC) ->  | C51: =IF(EQUAL(Timesheet!RC, ""), "", Timesheet!RC) ->  | D51: 0 | E51: 0 | F51: 0 | G51: 0 | H51: 0 | I51: 0 | J51: 0 | K51: 0 | L51: =SUM(RC[-8]:RC[-1]) -> 0
A52: =IF(EQUAL(Timesheet!RC, ""), "", Timesheet!RC) ->  | B52: =IF(EQUAL(Timesheet!RC, ""), "", Timesheet!RC) ->  | C52: =IF(EQUAL(Timesheet!RC, ""), "", Timesheet!RC) ->  | D52: 0 | E52: 0 | F52: 0 | G52: 0 | H52: 0 | I52: 0 | J52: 0 | K52: 0 | L52: =SUM(RC[-8]:RC[-1]) -> 0
A53: =IF(EQUAL(Timesheet!RC, ""), "", Timesheet!RC) ->  | B53: =IF(EQUAL(Timesheet!RC, ""), "", Timesheet!RC) ->  | C53: =IF(EQUAL(Timesheet!RC, ""), "", Timesheet!RC) ->  | D53: 0 | E53: 0 | F53: 0 | G53: 0 | H53: 0 | I53: 0 | J53: 0 | K53: 0 | L53: =SUM(RC[-8]:RC[-1]) -> 0
A54: 'TOTAL | D54: =SUM(R[-51]C:R[-1]C) -> 0 | E54: =SUM(R[-51]C:R[-1]C) -> 0 | F54: =SUM(R[-51]C:R[-1]C) -> 0 | G54: =SUM(R[-51]C:R[-1]C) -> 0 | H54: =SUM(R[-51]C:R[-1]C) -> 0 | I54: =SUM(R[-51]C:R[-1]C) -> 0 | J54: =SUM(R[-51]C:R[-1]C) -> 0 | K54: =SUM(R[-51]C:R[-1]C) -> 0 | L54: =SUM(R[-51]C:R[-1]C) -> 0

Sheet: February2000
A1: 'CODE | B1: 'AUDIT DESCRIPTION | C1: 'Category | D1: 'Week Ending
D2: =January2000!RC[+6]+7 -> 36561 | E2: 'Susan | F2: =RC[-2]+7 -> 36568 | G2: 'Susan | H2: =RC[-2]+7 -> 36575 | I2: 'Susan | J2: =RC[-2]+7 -> 36582 | K2: 'Susan | L2: 'Total
A3: =IF(EQUAL(Timesheet!RC, ""), "", Timesheet!RC) -> 1001 | B3: =IF(EQUAL(Timesheet!RC, ""), "", Timesheet!RC) -> PURCHASING | C3: =IF(EQUAL(Timesheet!RC, ""), "", Timesheet!RC) -> Mgmnt | D3: 0 | E3: 0 | F3: 0 | G3: 0 | H3: 0 | I3: 0 | J3: 0 | K3: 0 | L3: =SUM(RC[-8]:RC[-1]) -> 0
A4: =IF(EQUAL(Timesheet!RC, ""), "", Timesheet!RC) -> 1002 | B4: =IF(EQUAL(Timesheet!RC, ""), "", Timesheet!RC) -> HUMAN RESOURCE | C4: =IF(EQUAL(Timesheet!RC, ""), "", Timesheet!RC) -> Plan | D4: 0 | E4: 0 | F4: 0 | G4: 0 | H4: 0 | I4: 0 | J4: 0 | K4: 0 | L4: =SUM(RC[-8]:RC[-1]) -> 0
A5: =IF(EQUAL(Timesheet!RC, ""), "", Timesheet!RC) -> 1005 | B5: =IF(EQUAL(Timesheet!RC, ""), "", Timesheet!RC) -> CORPORATE AUDIT RISK ANALYSIS | C5: =IF(EQUAL(Timesheet!RC, ""), "", Timesheet!RC) -> Plan | D5: 0 | E5: 0 | F5: 0 | G5: 0 | H5: 0 | I5: 0 | J5: 0 | K5: 0 | L5: =SUM(RC[-8]:RC[-1]) -> 0
A6: =IF(EQUAL(Timesheet!RC, ""), "", Timesheet!RC) -> 1007 | B6: =IF(EQUAL(Timesheet!RC, ""), "", Timesheet!RC) -> OFFICER'S TRAVEL & EXPENSE | C6: =IF(EQUAL(Timesheet!RC, ""), "", Timesheet!RC) -> Plan | D6: 0 | E6: 0 | F6: 0 | G6: 0 | H6: 0 | I6: 0 | J6: 0 | K6: 0 | L6: =SUM(RC[-8]:RC[-1]) -> 0
A7: =IF(EQUAL(Timesheet!RC, ""), "", Timesheet!RC) -> 1008 | B7: =IF(EQUAL(Timesheet!RC, ""), "", Timesheet!RC) -> RECORD RETENTION | C7: =IF(EQUAL(Timesheet!RC, ""), "", Timesheet!RC) -> Mgmnt | D7: 0 | E7: 0 | F7: 0 | G7: 0 | H7: 0 | I7: 0 | J7: 0 | K7: 0 | L7: =SUM(RC[-8]:RC[-1]) -> 0
A8: =IF(EQUAL(Timesheet!RC, ""), "", Timesheet!RC) -> 1009 | B8: =IF(EQUAL(Timesheet!RC, ""), "", Timesheet!RC) -> NASD AUDITS | C8: =IF(EQUAL(Timesheet!RC, ""), "", Timesheet!RC) -> Plan | D8: 0 | E8: 0 | F8: 0 | G8: 0 | H8: 0 | I8: 0 | J8: 0 | K8: 0 | L8: =SUM(RC[-8]:RC[-1]) -> 0
A9: =IF(EQUAL(Timesheet!RC, ""), "", Timesheet!RC) -> 1011 | B9: =IF(EQUAL(Timesheet!RC, ""), "", Timesheet!RC) -> SURPRISE CASH AUDIT - NEW YORK | C9: =IF(EQUAL(Timesheet!RC, ""), "", Timesheet!RC) -> Plan | D9: 0 | E9: 0 | F9: 0 | G9: 0 | H9: 0 | I9: 0 | J9: 0 | K9: 0 | L9: =SUM(RC[-8]:RC[-1]) -> 0
A10: =IF(EQUAL(Timesheet!RC, ""), "", Timesheet!RC) -> 1012 | B10: =IF(EQUAL(Timesheet!RC, ""), "", Timesheet!RC) -> INTERNATIONAL AUDIT - IBI | C10: =IF(EQUAL(Timesheet!RC, ""), "", Timesheet!RC) -> Plan | D10: 0 | E10: 0 | F10: 0 | G10: 0 | H10: 0 | I10: 0 | J10: 0 | K10: 0 | L10: =SUM(RC[-8]:RC[-1]) -> 0
A11: =IF(EQUAL(Timesheet!RC, ""), "", Timesheet!RC) -> 1013 | B11: =IF(EQUAL(Timesheet!RC, ""), "", Timesheet!RC) -> INTERNATIONAL AUDIT - CISL | C11: =IF(EQUAL(Timesheet!RC, ""), "", Timesheet!RC) -> Plan | D11: 0 | E11: 0 | F11: 0 | G11: 0 | H11: 0 | I11: 0 | J11: 0 | K11: 0 | L11: =SUM(RC[-8]:RC[-1]) -> 0
A12: =IF(EQUAL(Timesheet!RC, ""), "", Timesheet!RC) -> 1014 | B12: =IF(EQUAL(Timesheet!RC, ""), "", Timesheet!RC) -> MARKETING AND COMMUNICATION | C12: =IF(EQUAL(Timesheet!RC, ""), "", Timesheet!RC) -> Mgmnt | D12: 0 | E12: 0 | F12: 0 | G12: 0 | H12: 0 | I12: 0 | J12: 0 | K12: 0 | L12: =SUM(RC[-8]:RC[-1]) -> 0
A13: =IF(EQUAL(Timesheet!RC, ""), "", Timesheet!RC) -> 3001 | B13: =IF(EQUAL(Timesheet!RC, ""), "", Timesheet!RC) -> FIELD OFFICE CONTROL REVIEWS | C13: =IF(EQUAL(Timesheet!RC, ""), "", Timesheet!RC) -> Field | D13: 0 | E13: 0 | F13: 0 | G13: 0 | H13: 0 | I13: 0 | J13: 0 | K13: 0 | L13: =SUM(RC[-8]:RC[-1]) -> 0
A14: =IF(EQUAL(Timesheet!RC, ""), "", Timesheet!RC) -> 3002 | B14: =IF(EQUAL(Timesheet!RC, ""), "", Timesheet!RC) -> FIELD OFFICE ACCOUNTABILITY ANALYSIS | C14: =IF(EQUAL(Timesheet!RC, ""), "", Timesheet!RC) -> Field | D14: 0 | E14: 0 | F14: 0 | G14: 0 | H14: 0 | I14: 0 | J14: 0 | K14: 0 | L14: =SUM(RC[-8]:RC[-1]) -> 0
A15: =IF(EQUAL(Timesheet!RC, ""), "", Timesheet!RC) -> 3010 | B15: =IF(EQUAL(Timesheet!RC, ""), "", Timesheet!RC) -> FIELD OFFICE BANK RECONCILATIONS | C15: =IF(EQUAL(Timesheet!RC, ""), "", Timesheet!RC) -> Field | D15: 0 | E15: 0 | F15: 0 | G15: 0 | H15: 0 | I15: 0 | J15: 0 | K15: 0 | L15: =SUM(RC[-8]:RC[-1]) -> 0
A16: =IF(EQUAL(Timesheet!RC, ""), "", Timesheet!RC) -> 3020 | B16: =IF(EQUAL(Timesheet!RC, ""), "", Timesheet!RC) -> FIELD AUDIT PROGRAM DEVELOPMENT | C16: =IF(EQUAL(Timesheet!RC, ""), "", Timesheet!RC) -> Field | D16: 0 | E16: 0 | F16: 0 | G16: 0 | H16: 0 | I16: 0 | J16: 0 | K16: 0 | L16: =SUM(RC[-8]:RC[-1]) -> 0
A17: =IF(EQUAL(Timesheet!RC, ""), "", Timesheet!RC) -> 3030 | B17: =IF(EQUAL(Timesheet!RC, ""), "", Timesheet!RC) -> OPEN COMMITMENT ANALYSIS | C17: =IF(EQUAL(Timesheet!RC, ""), "", Timesheet!RC) -> Field | D17: 0 | E17: 0 | F17: 0 | G17: 0 | H17: 0 | I17: 0 | J17: 0 | K17: 0 | L17: =SUM(RC[-8]:RC[-1]) -> 0
A18: =IF(EQUAL(Timesheet!RC, ""), "", Timesheet!RC) -> 3040 | B18: =IF(EQUAL(Timesheet!RC, ""), "", Timesheet!RC) -> FIELD AUDIT RISK ASSESMENT | C18: =IF(EQUAL(Timesheet!RC, ""), "", Timesheet!RC) -> Field | D18: 0 | E18: 0 | F18: 0 | G18: 0 | H18: 0 | I18: 0 | J18: 0 | K18: 0 | L18: =SUM(RC[-8]:RC[-1]) -> 0
A19: =IF(EQUAL(Timesheet!RC, ""), "", Timesheet!RC) -> 3050 | B19: =IF(EQUAL(Timesheet!RC, ""), "", Timesheet!RC) -> NEW YORK FIELD AUDIT REVIEWS | C19: =IF(EQUAL(Timesheet!RC, ""), "", Timesheet!RC) -> Field | D19: 0 | E19: 0 | F19: 0 | G19: 0 | H19: 0 | I19: 0 | J19: 0 | K19: 0 | L19: =SUM(RC[-8]:RC[-1]) -> 0
A20: =IF(EQUAL(Timesheet!RC, ""), "", Timesheet!RC) -> 4001 | B20: =IF(EQUAL(Timesheet!RC, ""), "", Timesheet!RC) -> GRANT THORNTON | C20: =IF(EQUAL(Timesheet!RC, ""), "", Timesheet!RC) -> Mgmnt | D20: 0 | E20: 0 | F20: 0 | G20: 0 | H20: 0 | I20: 0 | J20: 0 | K20: 0 | L20: =SUM(RC[-8]:RC[-1]) -> 0
A21: =IF(EQUAL(Timesheet!RC, ""), "", Timesheet!RC) -> 5001 | B21: =IF(EQUAL(Timesheet!RC, ""), "", Timesheet!RC) -> MISCELLANEOUS AUDIT REQUESTS | C21: =IF(EQUAL(Timesheet!RC, ""), "", Timesheet!RC) -> Mgmnt | D21: 0 | E21: 0 | F21: 0 | G21: 0 | H21: 0 | I21: 0 | J21: 0 | K21: 0 | L21: =SUM(RC[-8]:RC[-1]) -> 0
A22: =IF(EQUAL(Timesheet!RC, ""), "", Timesheet!RC) -> 5009 | B22: =IF(EQUAL(Timesheet!RC, ""), "", Timesheet!RC) -> FORMS INVENTORY | C22: =IF(EQUAL(Timesheet!RC, ""), "", Timesheet!RC) -> Plan | D22: 0 | E22: 0 | F22: 0 | G22: 0 | H22: 0 | I22: 0 | J22: 0 | K22: 0 | L22: =SUM(RC[-8]:RC[-1]) -> 0
A23: =IF(EQUAL(Timesheet!RC, ""), "", Timesheet!RC) -> 5010 | B23: =IF(EQUAL(Timesheet!RC, ""), "", Timesheet!RC) -> SURPRISE CHECK VALIDATION | C23: =IF(EQUAL(Timesheet!RC, ""), "", Timesheet!RC) -> Plan | D23: 0 | E23: 0 | F23: 0 | G23: 0 | H23: 0 | I23: 0 | J23: 0 | K23: 0 | L23: =SUM(RC[-8]:RC[-1]) -> 0
A24: =IF(EQUAL(Timesheet!RC, ""), "", Timesheet!RC) -> 7000 | B24: =IF(EQUAL(Timesheet!RC, ""), "", Timesheet!RC) -> NON-PROJECT RELATED (MEETINGS) | C24: =IF(EQUAL(Timesheet!RC, ""), "", Timesheet!RC) -> Non-Audit | D24: 0 | E24: 0 | F24: 0 | G24: 0 | H24: 0 | I24: 0 | J24: 0 | K24: 0 | L24: =SUM(RC[-8]:RC[-1]) -> 0
A25: =IF(EQUAL(Timesheet!RC, ""), "", Timesheet!RC) -> 7003 | B25: =IF(EQUAL(Timesheet!RC, ""), "", Timesheet!RC) -> AUDIT COMMITTEE | C25: =IF(EQUAL(Timesheet!RC, ""), "", Timesheet!RC) -> Non-Audit | D25: 0 | E25: 0 | F25: 0 | G25: 0 | H25: 0 | I25: 0 | J25: 0 | K25: 0 | L25: =SUM(RC[-8]:RC[-1]) -> 0
A26: =IF(EQUAL(Timesheet!RC, ""), "", Timesheet!RC) -> 8001 | B26: =IF(EQUAL(Timesheet!RC, ""), "", Timesheet!RC) -> ADMINISTRATIVE - GENERAL | C26: =IF(EQUAL(Timesheet!RC, ""), "", Timesheet!RC) -> Admin | D26: 0 | E26: 0 | F26: 0 | G26: 0 | H26: 0 | I26: 0 | J26: 0 | K26: 0 | L26: =SUM(RC[-8]:RC[-1]) -> 0
A27: =IF(EQUAL(Timesheet!RC, ""), "", Timesheet!RC) -> 8002 | B27: =IF(EQUAL(Timesheet!RC, ""), "", Timesheet!RC) -> HOLIDAYS | C27: =IF(EQUAL(Timesheet!RC, ""), "", Timesheet!RC) -> Admin | D27: 0 | E27: 0 | F27: 0 | G27: 0 | H27: 0 | I27: 0 | J27: 0 | K27: 0 | L27: =SUM(RC[-8]:RC[-1]) -> 0
A28: =IF(EQUAL(Timesheet!RC, ""), "", Timesheet!RC) -> 8004 | B28: =IF(EQUAL(Timesheet!RC, ""), "", Timesheet!RC) -> SEMINARS & TRAINING | C28: =IF(EQUAL(Timesheet!RC, ""), "", Timesheet!RC) -> Admin | D28: 0 | E28: 0 | F28: 0 | G28: 0 | H28: 0 | I28: 0 | J28: 0 | K28: 0 | L28: =SUM(RC[-8]:RC[-1]) -> 0
A29: =IF(EQUAL(Timesheet!RC, ""), "", Timesheet!RC) -> 8005 | B29: =IF(EQUAL(Timesheet!RC, ""), "", Timesheet!RC) -> PERSONAL (VACATION/AT) | C29: =IF(EQUAL(Timesheet!RC, ""), "", Timesheet!RC) -> Admin | D29: 0 | E29: 0 | F29: 0 | G29: 0 | H29: 0 | I29: 0 | J29: 0 | K29: 0 | L29: =SUM(RC[-8]:RC[-1]) -> 0
A30: =IF(EQUAL(Timesheet!RC, ""), "", Timesheet!RC) -> 8006 | B30: =IF(EQUAL(Timesheet!RC, ""), "", Timesheet!RC) -> SICK | C30: =IF(EQUAL(Timesheet!RC, ""), "", Timesheet!RC) -> Admin | D30: 0 | E30: 0 | F30: 0 | G30: 0 | H30: 0 | I30: 0 | J30: 0 | K30: 0 | L30: =SUM(RC[-8]:RC[-1]) -> 0
A31: =IF(EQUAL(Timesheet!RC, ""), "", Timesheet!RC) -> 8008 | B31: =IF(EQUAL(Timesheet!RC, ""), "", Timesheet!RC) -> RESEARCH | C31: =IF(EQUAL(Timesheet!RC, ""), "", Timesheet!RC) -> Non-Audit | D31: 0 | E31: 0 | F31: 0 | G31: 0 | H31: 0 | I31: 0 | J31: 0 | K31: 0 | L31: =SUM(RC[-8]:RC[-1]) -> 0
A32: =IF(EQUAL(Timesheet!RC, ""), "", Timesheet!RC) ->  | B32: =IF(EQUAL(Timesheet!RC, ""), "", Timesheet!RC) ->  | C32: =IF(EQUAL(Timesheet!RC, ""), "", Timesheet!RC) ->  | D32: 0 | E32: 0 | F32: 0 | G32: 0 | H32: 0 | I32: 0 | J32: 0 | K32: 0 | L32: =SUM(RC[-8]:RC[-1]) -> 0
A33: =IF(EQUAL(Timesheet!RC, ""), "", Timesheet!RC) ->  | B33: =IF(EQUAL(Timesheet!RC, ""), "", Timesheet!RC) ->  | C33: =IF(EQUAL(Timesheet!RC, ""), "", Timesheet!RC) ->  | D33: 0 | E33: 0 | F33: 0 | G33: 0 | H33: 0 | I33: 0 | J33: 0 | K33: 0 | L33: =SUM(RC[-8]:RC[-1]) -> 0
A34: =IF(EQUAL(Timesheet!RC, ""), "", Timesheet!RC) ->  | B34: =IF(EQUAL(Timesheet!RC, ""), "", Timesheet!RC) ->  | C34: =IF(EQUAL(Timesheet!RC, ""), "", Timesheet!RC) ->  | D34: 0 | E34: 0 | F34: 0 | G34: 0 | H34: 0 | I34: 0 | J34: 0 | K34: 0 | L34: =SUM(RC[-8]:RC[-1]) -> 0
A35: =IF(EQUAL(Timesheet!RC, ""), "", Timesheet!RC) ->  | B35: =IF(EQUAL(Timesheet!RC, ""), "", Timesheet!RC) ->  | C35: =IF(EQUAL(Timesheet!RC, ""), "", Timesheet!RC) ->  | D35: 0 | E35: 0 | F35: 0 | G35: 0 | H35: 0 | I35: 0 | J35: 0 | K35: 0 | L35: =SUM(RC[-8]:RC[-1]) -> 0
A36: =IF(EQUAL(Timesheet!RC, ""), "", Timesheet!RC) ->  | B36: =IF(EQUAL(Timesheet!RC, ""), "", Timesheet!RC) ->  | C36: =IF(EQUAL(Timesheet!RC, ""), "", Timesheet!RC) ->  | D36: 0 | E36: 0 | F36: 0 | G36: 0 | H36: 0 | I36: 0 | J36: 0 | K36: 0 | L36: =SUM(RC[-8]:RC[-1]) -> 0
A37: =IF(EQUAL(Timesheet!RC, ""), "", Timesheet!RC) ->  | B37: =IF(EQUAL(Timesheet!RC, ""), "", Timesheet!RC) ->  | C37: =IF(EQUAL(Timesheet!RC, ""), "", Timesheet!RC) ->  | D37: 0 | E37: 0 | F37: 0 | G37: 0 | H37: 0 | I37: 0 | J37: 0 | K37: 0 | L37: =SUM(RC[-8]:RC[-1]) -> 0
A38: =IF(EQUAL(Timesheet!RC, ""), "", Timesheet!RC) ->  | B38: =IF(EQUAL(Timesheet!RC, ""), "", Timesheet!RC) ->  | C38: =IF(EQUAL(Timesheet!RC, ""), "", Timesheet!RC) ->  | D38: 0 | E38: 0 | F38: 0 | G38: 0 | H38: 0 | I38: 0 | J38: 0 | K38: 0 | L38: =SUM(RC[-8]:RC[-1]) -> 0
A39: =IF(EQUAL(Timesheet!RC, ""), "", Timesheet!RC) ->  | B39: =IF(EQUAL(Timesheet!RC, ""), "", Timesheet!RC) ->  | C39: =IF(EQUAL(Timesheet!RC, ""), "", Timesheet!RC) ->  | D39: 0 | E39: 0 | F39: 0 | G39: 0 | H39: 0 | I39: 0 | J39: 0 | K39: 0 | L39: =SUM(RC[-8]:RC[-1]) -> 0
A40: =IF(EQUAL(Timesheet!RC, ""), "", Timesheet!RC) ->  | B40: =IF(EQUAL(Timesheet!RC, ""), "", Timesheet!RC) ->  | C40: =IF(EQUAL(Timesheet!RC, ""), "", Timesheet!RC) ->  | D40: 0 | E40: 0 | F40: 0 | G40: 0 | H40: 0 | I40: 0 | J40: 0 | K40: 0 | L40: =SUM(RC[-8]:RC[-1]) -> 0
A41: =IF(EQUAL(Timesheet!RC, ""), "", Timesheet!RC) ->  | B41: =IF(EQUAL(Timesheet!RC, ""), "", Timesheet!RC) ->  | C41: =IF(EQUAL(Timesheet!RC, ""), "", Timesheet!RC) ->  | D41: 0 | E41: 0 | F41: 0 | G41: 0 | H41: 0 | I41: 0 | J41: 0 | K41: 0 | L41: =SUM(RC[-8]:RC[-1]) -> 0
A42: =IF(EQUAL(Timesheet!RC, ""), "", Timesheet!RC) ->  | B42: =IF(EQUAL(Timesheet!RC, ""), "", Timesheet!RC) ->  | C42: =IF(EQUAL(Timesheet!RC, ""), "", Timesheet!RC) ->  | D42: 0 | E42: 0 | F42: 0 | G42: 0 | H42: 0 | I42: 0 | J42: 0 | K42: 0 | L42: =SUM(RC[-8]:RC[-1]) -> 0
A43: =IF(EQUAL(Timesheet!RC, ""), "", Timesheet!RC) ->  | B43: =IF(EQUAL(Timesheet!RC, ""), "", Timesheet!RC) ->  | C43: =IF(EQUAL(Timesheet!RC, ""), "", Timesheet!RC) ->  | D43: 0 | E43: 0 | F43: 0 | G43: 0 | H43: 0 | I43: 0 | J43: 0 | K43: 0 | L43: =SUM(RC[-8]:RC[-1]) -> 0
A44: =IF(EQUAL(Timesheet!RC, ""), "", Timesheet!RC) ->  | B44: =IF(EQUAL(Timesheet!RC, ""), "", Timesheet!RC) ->  | C44: =IF(EQUAL(Timesheet!RC, ""), "", Timesheet!RC) ->  | D44: 0 | E44: 0 | F44: 0 | G44: 0 | H44: 0 | I44: 0 | J44: 0 | K44: 0 | L44: =SUM(RC[-8]:RC[-1]) -> 0
A45: =IF(EQUAL(Timesheet!RC, ""), "", Timesheet!RC) ->  | B45: =IF(EQUAL(Timesheet!RC, ""), "", Timesheet!RC) ->  | C45: =IF(EQUAL(Timesheet!RC, ""), "", Timesheet!RC) ->  | D45: 0 | E45: 0 | F45: 0 | G45: 0 | H45: 0 | I45: 0 | J45: 0 | K45: 0 | L45: =SUM(RC[-8]:RC[-1]) -> 0
A46: =IF(EQUAL(Timesheet!RC, ""), "", Timesheet!RC) ->  | B46: =IF(EQUAL(Timesheet!RC, ""), "", Timesheet!RC) ->  | C46: =IF(EQUAL(Timesheet!RC, ""), "", Timesheet!RC) ->  | D46: 0 | E46: 0 | F46: 0 | G46: 0 | H46: 0 | I46: 0 | J46: 0 | K46: 0 | L46: =SUM(RC[-8]:RC[-1]) -> 0
A47: =IF(EQUAL(Timesheet!RC, ""), "", Timesheet!RC) ->  | B47: =IF(EQUAL(Timesheet!RC, ""), "", Timesheet!RC) ->  | C47: =IF(EQUAL(Timesheet!RC, ""), "", Timesheet!RC) ->  | D47: 0 | E47: 0 | F47: 0 | G47: 0 | H47: 0 | I47: 0 | J47: 0 | K47: 0 | L47: =SUM(RC[-8]:RC[-1]) -> 0
A48: =IF(EQUAL(Timesheet!RC, ""), "", Timesheet!RC) ->  | B48: =IF(EQUAL(Timesheet!RC, ""), "", Timesheet!RC) ->  | C48: =IF(EQUAL(Timesheet!RC, ""), "", Timesheet!RC) ->  | D48: 0 | E48: 0 | F48: 0 | G48: 0 | H48: 0 | I48: 0 | J48: 0 | K48: 0 | L48: =SUM(RC[-8]:RC[-1]) -> 0
A49: =IF(EQUAL(Timesheet!RC, ""), "", Timesheet!RC) ->  | B49: =IF(EQUAL(Timesheet!RC, ""), "", Timesheet!RC) ->  | C49: =IF(EQUAL(Timesheet!RC, ""), "", Timesheet!RC) ->  | D49: 0 | E49: 0 | F49: 0 | G49: 0 | H49: 0 | I49: 0 | J49: 0 | K49: 0 | L49: =SUM(RC[-8]:RC[-1]) -> 0
A50: =IF(EQUAL(Timesheet!RC, ""), "", Timesheet!RC) ->  | B50: =IF(EQUAL(Timesheet!RC, ""), "", Timesheet!RC) ->  | C50: =IF(EQUAL(Timesheet!RC, ""), "", Timesheet!RC) ->  | D50: 0 | E50: 0 | F50: 0 | G50: 0 | H50: 0 | I50: 0 | J50: 0 | K50: 0 | L50: =SUM(RC[-8]:RC[-1]) -> 0
A51: =IF(EQUAL(Timesheet!RC, ""), "", Timesheet!RC) ->  | B51: =IF(EQUAL(Timesheet!RC, ""), "", Timesheet!RC) ->  | C51: =IF(EQUAL(Timesheet!RC, ""), "", Timesheet!RC) ->  | D51: 0 | E51: 0 | F51: 0 | G51: 0 | H51: 0 | I51: 0 | J51: 0 | K51: 0 | L51: =SUM(RC[-8]:RC[-1]) -> 0
A52: =IF(EQUAL(Timesheet!RC, ""), "", Timesheet!RC) ->  | B52: =IF(EQUAL(Timesheet!RC, ""), "", Timesheet!RC) ->  | C52: =IF(EQUAL(Timesheet!RC, ""), "", Timesheet!RC) ->  | D52: 0 | E52: 0 | F52: 0 | G52: 0 | H52: 0 | I52: 0 | J52: 0 | K52: 0 | L52: =SUM(RC[-8]:RC[-1]) -> 0
A53: =IF(EQUAL(Timesheet!RC, ""), "", Timesheet!RC) ->  | B53: =IF(EQUAL(Timesheet!RC, ""), "", Timesheet!RC) ->  | C53: =IF(EQUAL(Timesheet!RC, ""), "", Timesheet!RC) ->  | D53: 0 | E53: 0 | F53: 0 | G53: 0 | H53: 0 | I53: 0 | J53: 0 | K53: 0 | L53: =SUM(RC[-8]:RC[-1]) -> 0
A54: 'TOTAL | D54: =SUM(R[-51]C:R[-1]C) -> 0 | E54: =SUM(R[-51]C:R[-1]C) -> 0 | F54: =SUM(R[-51]C:R[-1]C) -> 0 | G54: =SUM(R[-51]C:R[-1]C) -> 0 | H54: =SUM(R[-51]C:R[-1]C) -> 0 | I54: =SUM(R[-51]C:R[-1]C) -> 0 | J54: =SUM(R[-51]C:R[-1]C) -> 0 | K54: =SUM(R[-51]C:R[-1]C) -> 0 | L54: =SUM(R[-51]C:R[-1]C) -> 0

Sheet: March2000
A1: 'CODE | B1: 'AUDIT DESCRIPTION | C1: 'Category | D1: 'Week Ending
D2: =February2000!RC[+6]+7 -> 36589 | E2: 'Susan | F2: =RC[-2]+7 -> 36596 | G2: 'Susan | H2: =RC[-2]+7 -> 36603 | I2: 'Susan | J2: =RC[-2]+7 -> 36610 | K2: 'Susan | L2: =RC[-2]+7 -> 36617 | M2: 'OPEN | N2: 'Total
A3: =IF(EQUAL(Timesheet!RC, ""), "", Timesheet!RC) -> 1001 | B3: =IF(EQUAL(Timesheet!RC, ""), "", Timesheet!RC) -> PURCHASING | C3: =IF(EQUAL(Timesheet!RC, ""), "", Timesheet!RC) -> Mgmnt | D3: 0 | E3: 0 | F3: 0 | G3: 0 | H3: 0 | I3: 0 | J3: 0 | K3: 0 | L3: 0 | M3: 0 | N3: =SUM(RC[-10]:RC[-1]) -> 0
A4: =IF(EQUAL(Timesheet!RC, ""), "", Timesheet!RC) -> 1002 | B4: =IF(EQUAL(Timesheet!RC, ""), "", Timesheet!RC) -> HUMAN RESOURCE | C4: =IF(EQUAL(Timesheet!RC, ""), "", Timesheet!RC) -> Plan | D4: 0 | E4: 0 | F4: 0 | G4: 0 | H4: 0 | I4: 0 | J4: 0 | K4: 0 | L4: 0 | M4: 0 | N4: =SUM(RC[-10]:RC[-1]) -> 0
A5: =IF(EQUAL(Timesheet!RC, ""), "", Timesheet!RC) -> 1005 | B5: =IF(EQUAL(Timesheet!RC, ""), "", Timesheet!RC) -> CORPORATE AUDIT RISK ANALYSIS | C5: =IF(EQUAL(Timesheet!RC, ""), "", Timesheet!RC) -> Plan | D5: 0 | E5: 0 | F5: 0 | G5: 0 | H5: 0 | I5: 0 | J5: 0 | K5: 0 | L5: 0 | M5: 0 | N5: =SUM(RC[-10]:RC[-1]) -> 0
A6: =IF(EQUAL(Timesheet!RC, ""), "", Timesheet!RC) -> 1007 | B6: =IF(EQUAL(Timesheet!RC, ""), "", Timesheet!RC) -> OFFICER'S TRAVEL & EXPENSE | C6: =IF(EQUAL(Timesheet!RC, ""), "", Timesheet!RC) -> Plan | D6: 0 | E6: 0 | F6: 0 | G6: 0 | H6: 0 | I6: 0 | J6: 0 | K6: 0 | L6: 0 | M6: 0 | N6: =SUM(RC[-10]:RC[-1]) -> 0
A7: =IF(EQUAL(Timesheet!RC, ""), "", Timesheet!RC) -> 1008 | B7: =IF(EQUAL(Timesheet!RC, ""), "", Timesheet!RC) -> RECORD RETENTION | C7: =IF(EQUAL(Timesheet!RC, ""), "", Timesheet!RC) -> Mgmnt | D7: 0 | E7: 0 | F7: 0 | G7: 0 | H7: 0 | I7: 0 | J7: 0 | K7: 0 | L7: 0 | M7: 0 | N7: =SUM(RC[-10]:RC[-1]) -> 0
A8: =IF(EQUAL(Timesheet!RC, ""), "", Timesheet!RC) -> 1009 | B8: =IF(EQUAL(Timesheet!RC, ""), "", Timesheet!RC) -> NASD AUDITS | C8: =IF(EQUAL(Timesheet!RC, ""), "", Timesheet!RC) -> Plan | D8: 0 | E8: 0 | F8: 0 | G8: 0 | H8: 0 | I8: 0 | J8: 0 | K8: 0 | L8: 0 | M8: 0 | N8: =SUM(RC[-10]:RC[-1]) -> 0
A9: =IF(EQUAL(Timesheet!RC, ""), "", Timesheet!RC) -> 1011 | B9: =IF(EQUAL(Timesheet!RC, ""), "", Timesheet!RC) -> SURPRISE CASH AUDIT - NEW YORK | C9: =IF(EQUAL(Timesheet!RC, ""), "", Timesheet!RC) -> Plan | D9: 0 | E9: 0 | F9: 0 | G9: 0 | H9: 0 | I9: 0 | J9: 0 | K9: 0 | L9: 0 | M9: 0 | N9: =SUM(RC[-10]:RC[-1]) -> 0
A10: =IF(EQUAL(Timesheet!RC, ""), "", Timesheet!RC) -> 1012 | B10: =IF(EQUAL(Timesheet!RC, ""), "", Timesheet!RC) -> INTERNATIONAL AUDIT - IBI | C10: =IF(EQUAL(Timesheet!RC, ""), "", Timesheet!RC) -> Plan | D10: 0 | E10: 0 | F10: 0 | G10: 0 | H10: 0 | I10: 0 | J10: 0 | K10: 0 | L10: 0 | M10: 0 | N10: =SUM(RC[-10]:RC[-1]) -> 0
A11: =IF(EQUAL(Timesheet!RC, ""), "", Timesheet!RC) -> 1013 | B11: =IF(EQUAL(Timesheet!RC, ""), "", Timesheet!RC) -> INTERNATIONAL AUDIT - CISL | C11: =IF(EQUAL(Timesheet!RC, ""), "", Timesheet!RC) -> Plan | D11: 0 | E11: 0 | F11: 0 | G11: 0 | H11: 0 | I11: 0 | J11: 0 | K11: 0 | L11: 0 | M11: 0 | N11: =SUM(RC[-10]:RC[-1]) -> 0
A12: =IF(EQUAL(Timesheet!RC, ""), "", Timesheet!RC) -> 1014 | B12: =IF(EQUAL(Timesheet!RC, ""), "", Timesheet!RC) -> MARKETING AND COMMUNICATION | C12: =IF(EQUAL(Timesheet!RC, ""), "", Timesheet!RC) -> Mgmnt | D12: 0 | E12: 0 | F12: 0 | G12: 0 | H12: 0 | I12: 0 | J12: 0 | K12: 0 | L12: 0 | M12: 0 | N12: =SUM(RC[-10]:RC[-1]) -> 0
A13: =IF(EQUAL(Timesheet!RC, ""), "", Timesheet!RC) -> 3001 | B13: =IF(EQUAL(Timesheet!RC, ""), "", Timesheet!RC) -> FIELD OFFICE CONTROL REVIEWS | C13: =IF(EQUAL(Timesheet!RC, ""), "", Timesheet!RC) -> Field | D13: 0 | E13: 0 | F13: 0 | G13: 0 | H13: 0 | I13: 0 | J13: 0 | K13: 0 | L13: 0 | M13: 0 | N13: =SUM(RC[-10]:RC[-1]) -> 0
A14: =IF(EQUAL(Timesheet!RC, ""), "", Timesheet!RC) -> 3002 | B14: =IF(EQUAL(Timesheet!RC, ""), "", Timesheet!RC) -> FIELD OFFICE ACCOUNTABILITY ANALYSIS | C14: =IF(EQUAL(Timesheet!RC, ""), "", Timesheet!RC) -> Field | D14: 0 | E14: 0 | F14: 0 | G14: 0 | H14: 0 | I14: 0 | J14: 0 | K14: 0 | L14: 0 | M14: 0 | N14: =SUM(RC[-10]:RC[-1]) -> 0
A15: =IF(EQUAL(Timesheet!RC, ""), "", Timesheet!RC) -> 3010 | B15: =IF(EQUAL(Timesheet!RC, ""), "", Timesheet!RC) -> FIELD OFFICE BANK RECONCILATIONS | C15: =IF(EQUAL(Timesheet!RC, ""), "", Timesheet!RC) -> Field | D15: 0 | E15: 0 | F15: 0 | G15: 0 | H15: 0 | I15: 0 | J15: 0 | K15: 0 | L15: 0 | M15: 0 | N15: =SUM(RC[-10]:RC[-1]) -> 0
A16: =IF(EQUAL(Timesheet!RC, ""), "", Timesheet!RC) -> 3020 | B16: =IF(EQUAL(Timesheet!RC, ""), "", Timesheet!RC) -> FIELD AUDIT PROGRAM DEVELOPMENT | C16: =IF(EQUAL(Timesheet!RC, ""), "", Timesheet!RC) -> Field | D16: 0 | E16: 0 | F16: 0 | G16: 0 | H16: 0 | I16: 0 | J16: 0 | K16: 0 | L16: 0 | M16: 0 | N16: =SUM(RC[-10]:RC[-1]) -> 0
A17: =IF(EQUAL(Timesheet!RC, ""), "", Timesheet!RC) -> 3030 | B17: =IF(EQUAL(Timesheet!RC, ""), "", Timesheet!RC) -> OPEN COMMITMENT ANALYSIS | C17: =IF(EQUAL(Timesheet!RC, ""), "", Timesheet!RC) -> Field | D17: 0 | E17: 0 | F17: 0 | G17: 0 | H17: 0 | I17: 0 | J17: 0 | K17: 0 | L17: 0 | M17: 0 | N17: =SUM(RC[-10]:RC[-1]) -> 0
A18: =IF(EQUAL(Timesheet!RC, ""), "", Timesheet!RC) -> 3040 | B18: =IF(EQUAL(Timesheet!RC, ""), "", Timesheet!RC) -> FIELD AUDIT RISK ASSESMENT | C18: =IF(EQUAL(Timesheet!RC, ""), "", Timesheet!RC) -> Field | D18: 0 | E18: 0 | F18: 0 | G18: 0 | H18: 0 | I18: 0 | J18: 0 | K18: 0 | L18: 0 | M18: 0 | N18: =SUM(RC[-10]:RC[-1]) -> 0
A19: =IF(EQUAL(Timesheet!RC, ""), "", Timesheet!RC) -> 3050 | B19: =IF(EQUAL(Timesheet!RC, ""), "", Timesheet!RC) -> NEW YORK FIELD AUDIT REVIEWS | C19: =IF(EQUAL(Timesheet!RC, ""), "", Timesheet!RC) -> Field | D19: 0 | E19: 0 | F19: 0 | G19: 0 | H19: 0 | I19: 0 | J19: 0 | K19: 0 | L19: 0 | M19: 0 | N19: =SUM(RC[-10]:RC[-1]) -> 0
A20: =IF(EQUAL(Timesheet!RC, ""), "", Timesheet!RC) -> 4001 | B20: =IF(EQUAL(Timesheet!RC, ""), "", Timesheet!RC) -> GRANT THORNTON | C20: =IF(EQUAL(Timesheet!RC, ""), "", Timesheet!RC) -> Mgmnt | D20: 0 | E20: 0 | F20: 0 | G20: 0 | H20: 0 | I20: 0 | J20: 0 | K20: 0 | L20: 0 | M20: 0 | N20: =SUM(RC[-10]:RC[-1]) -> 0
A21: =IF(EQUAL(Timesheet!RC, ""), "", Timesheet!RC) -> 5001 | B21: =IF(EQUAL(Timesheet!RC, ""), "", Timesheet!RC) -> MISCELLANEOUS AUDIT REQUESTS | C21: =IF(EQUAL(Timesheet!RC, ""), "", Timesheet!RC) -> Mgmnt | D21: 0 | E21: 0 | F21: 0 | G21: 0 | H21: 0 | I21: 0 | J21: 0 | K21: 0 | L21: 0 | M21: 0 | N21: =SUM(RC[-10]:RC[-1]) -> 0
A22: =IF(EQUAL(Timesheet!RC, ""), "", Timesheet!RC) -> 5009 | B22: =IF(EQUAL(Timesheet!RC, ""), "", Timesheet!RC) -> FORMS INVENTORY | C22: =IF(EQUAL(Timesheet!RC, ""), "", Timesheet!RC) -> Plan | D22: 0 | E22: 0 | F22: 0 | G22: 0 | H22: 0 | I22: 0 | J22: 0 | K22: 0 | L22: 0 | M22: 0 | N22: =SUM(RC[-10]:RC[-1]) -> 0
A23: =IF(EQUAL(Timesheet!RC, ""), "", Timesheet!RC) -> 5010 | B23: =IF(EQUAL(Timesheet!RC, ""), "", Timesheet!RC) -> SURPRISE CHECK VALIDATION | C23: =IF(EQUAL(Timesheet!RC, ""), "", Timesheet!RC) -> Plan | D23: 0 | E23: 0 | F23: 0 | G23: 0 | H23: 0 | I23: 0 | J23: 0 | K23: 0 | L23: 0 | M23: 0 | N23: =SUM(RC[-10]:RC[-1]) -> 0
A24: =IF(EQUAL(Timesheet!RC, ""), "", Timesheet!RC) -> 7000 | B24: =IF(EQUAL(Timesheet!RC, ""), "", Timesheet!RC) -> NON-PROJECT RELATED (MEETINGS) | C24: =IF(EQUAL(Timesheet!RC, ""), "", Timesheet!RC) -> Non-Audit | D24: 0 | E24: 0 | F24: 0 | G24: 0 | H24: 0 | I24: 0 | J24: 0 | K24: 0 | L24: 0 | M24: 0 | N24: =SUM(RC[-10]:RC[-1]) -> 0
A25: =IF(EQUAL(Timesheet!RC, ""), "", Timesheet!RC) -> 7003 | B25: =IF(EQUAL(Timesheet!RC, ""), "", Timesheet!RC) -> AUDIT COMMITTEE | C25: =IF(EQUAL(Timesheet!RC, ""), "", Timesheet!RC) -> Non-Audit | D25: 0 | E25: 0 | F25: 0 | G25: 0 | H25: 0 | I25: 0 | J25: 0 | K25: 0 | L25: 0 | M25: 0 | N25: =SUM(RC[-10]:RC[-1]) -> 0
A26: =IF(EQUAL(Timesheet!RC, ""), "", Timesheet!RC) -> 8001 | B26: =IF(EQUAL(Timesheet!RC, ""), "", Timesheet!RC) -> ADMINISTRATIVE - GENERAL | C26: =IF(EQUAL(Timesheet!RC, ""), "", Timesheet!RC) -> Admin | D26: 0 | E26: 0 | F26: 0 | G26: 0 | H26: 0 | I26: 0 | J26: 0 | K26: 0 | L26: 0 | M26: 0 | N26: =SUM(RC[-10]:RC[-1]) -> 0
A27: =IF(EQUAL(Timesheet!RC, ""), "", Timesheet!RC) -> 8002 | B27: =IF(EQUAL(Timesheet!RC, ""), "", Timesheet!RC) -> HOLIDAYS | C27: =IF(EQUAL(Timesheet!RC, ""), "", Timesheet!RC) -> Admin | D27: 0 | E27: 0 | F27: 0 | G27: 0 | H27: 0 | I27: 0 | J27: 0 | K27: 0 | L27: 0 | M27: 0 | N27: =SUM(RC[-10]:RC[-1]) -> 0
A28: =IF(EQUAL(Timesheet!RC, ""), "", Timesheet!RC) -> 8004 | B28: =IF(EQUAL(Timesheet!RC, ""), "", Timesheet!RC) -> SEMINARS & TRAINING | C28: =IF(EQUAL(Timesheet!RC, ""), "", Timesheet!RC) -> Admin | D28: 0 | E28: 0 | F28: 0 | G28: 0 | H28: 0 | I28: 0 | J28: 0 | K28: 0 | L28: 0 | M28: 0 | N28: =SUM(RC[-10]:RC[-1]) -> 0
A29: =IF(EQUAL(Timesheet!RC, ""), "", Timesheet!RC) -> 8005 | B29: =IF(EQUAL(Timesheet!RC, ""), "", Timesheet!RC) -> PERSONAL (VACATION/AT) | C29: =IF(EQUAL(Timesheet!RC, ""), "", Timesheet!RC) -> Admin | D29: 0 | E29: 0 | F29: 0 | G29: 0 | H29: 0 | I29: 0 | J29: 0 | K29: 0 | L29: 0 | M29: 0 | N29: =SUM(RC[-10]:RC[-1]) -> 0
A30: =IF(EQUAL(Timesheet!RC, ""), "", Timesheet!RC) -> 8006 | B30: =IF(EQUAL(Timesheet!RC, ""), "", Timesheet!RC) -> SICK | C30: =IF(EQUAL(Timesheet!RC, ""), "", Timesheet!RC) -> Admin | D30: 0 | E30: 0 | F30: 0 | G30: 0 | H30: 0 | I30: 0 | J30: 0 | K30: 0 | L30: 0 | M30: 0 | N30: =SUM(RC[-10]:RC[-1]) -> 0
A31: =IF(EQUAL(Timesheet!RC, ""), "", Timesheet!RC) -> 8008 | B31: =IF(EQUAL(Timesheet!RC, ""), "", Timesheet!RC) -> RESEARCH | C31: =IF(EQUAL(Timesheet!RC, ""), "", Timesheet!RC) -> Non-Audit | D31: 0 | E31: 0 | F31: 0 | G31: 0 | H31: 0 | I31: 0 | J31: 0 | K31: 0 | L31: 0 | M31: 0 | N31: =SUM(RC[-10]:RC[-1]) -> 0
A32: =IF(EQUAL(Timesheet!RC, ""), "", Timesheet!RC) ->  | B32: =IF(EQUAL(Timesheet!RC, ""), "", Timesheet!RC) ->  | C32: =IF(EQUAL(Timesheet!RC, ""), "", Timesheet!RC) ->  | D32: 0 | E32: 0 | F32: 0 | G32: 0 | H32: 0 | I32: 0 | J32: 0 | K32: 0 | L32: 0 | M32: 0 | N32: =SUM(RC[-10]:RC[-1]) -> 0
A33: =IF(EQUAL(Timesheet!RC, ""), "", Timesheet!RC) ->  | B33: =IF(EQUAL(Timesheet!RC, ""), "", Timesheet!RC) ->  | C33: =IF(EQUAL(Timesheet!RC, ""), "", Timesheet!RC) ->  | D33: 0 | E33: 0 | F33: 0 | G33: 0 | H33: 0 | I33: 0 | J33: 0 | K33: 0 | L33: 0 | M33: 0 | N33: =SUM(RC[-10]:RC[-1]) -> 0
A34: =IF(EQUAL(Timesheet!RC, ""), "", Timesheet!RC) ->  | B34: =IF(EQUAL(Timesheet!RC, ""), "", Timesheet!RC) ->  | C34: =IF(EQUAL(Timesheet!RC, ""), "", Timesheet!RC) ->  | D34: 0 | E34: 0 | F34: 0 | G34: 0 | H34: 0 | I34: 0 | J34: 0 | K34: 0 | L34: 0 | M34: 0 | N34: =SUM(RC[-10]:RC[-1]) -> 0
A35: =IF(EQUAL(Timesheet!RC, ""), "", Timesheet!RC) ->  | B35: =IF(EQUAL(Timesheet!RC, ""), "", Timesheet!RC) ->  | C35: =IF(EQUAL(Timesheet!RC, ""), "", Timesheet!RC) ->  | D35: 0 | E35: 0 | F35: 0 | G35: 0 | H35: 0 | I35: 0 | J35: 0 | K35: 0 | L35: 0 | M35: 0 | N35: =SUM(RC[-10]:RC[-1]) -> 0
A36: =IF(EQUAL(Timesheet!RC, ""), "", Timesheet!RC) ->  | B36: =IF(EQUAL(Timesheet!RC, ""), "", Timesheet!RC) ->  | C36: =IF(EQUAL(Timesheet!RC, ""), "", Timesheet!RC) ->  | D36: 0 | E36: 0 | F36: 0 | G36: 0 | H36: 0 | I36: 0 | J36: 0 | K36: 0 | L36: 0 | M36: 0 | N36: =SUM(RC[-10]:RC[-1]) -> 0
A37: =IF(EQUAL(Timesheet!RC, ""), "", Timesheet!RC) ->  | B37: =IF(EQUAL(Timesheet!RC, ""), "", Timesheet!RC) ->  | C37: =IF(EQUAL(Timesheet!RC, ""), "", Timesheet!RC) ->  | D37: 0 | E37: 0 | F37: 0 | G37: 0 | H37: 0 | I37: 0 | J37: 0 | K37: 0 | L37: 0 | M37: 0 | N37: =SUM(RC[-10]:RC[-1]) -> 0
A38: =IF(EQUAL(Timesheet!RC, ""), "", Timesheet!RC) ->  | B38: =IF(EQUAL(Timesheet!RC, ""), "", Timesheet!RC) ->  | C38: =IF(EQUAL(Timesheet!RC, ""), "", Timesheet!RC) ->  | D38: 0 | E38: 0 | F38: 0 | G38: 0 | H38: 0 | I38: 0 | J38: 0 | K38: 0 | L38: 0 | M38: 0 | N38: =SUM(RC[-10]:RC[-1]) -> 0
A39: =IF(EQUAL(Timesheet!RC, ""), "", Timesheet!RC) ->  | B39: =IF(EQUAL(Timesheet!RC, ""), "", Timesheet!RC) ->  | C39: =IF(EQUAL(Timesheet!RC, ""), "", Timesheet!RC) ->  | D39: 0 | E39: 0 | F39: 0 | G39: 0 | H39: 0 | I39: 0 | J39: 0 | K39: 0 | L39: 0 | M39: 0 | N39: =SUM(RC[-10]:RC[-1]) -> 0
A40: =IF(EQUAL(Timesheet!RC, ""), "", Timesheet!RC) ->  | B40: =IF(EQUAL(Timesheet!RC, ""), "", Timesheet!RC) ->  | C40: =IF(EQUAL(Timesheet!RC, ""), "", Timesheet!RC) ->  | D40: 0 | E40: 0 | F40: 0 | G40: 0 | H40: 0 | I40: 0 | J40: 0 | K40: 0 | L40: 0 | M40: 0 | N40: =SUM(RC[-10]:RC[-1]) -> 0
A41: =IF(EQUAL(Timesheet!RC, ""), "", Timesheet!RC) ->  | B41: =IF(EQUAL(Timesheet!RC, ""), "", Timesheet!RC) ->  | C41: =IF(EQUAL(Timesheet!RC, ""), "", Timesheet!RC) ->  | D41: 0 | E41: 0 | F41: 0 | G41: 0 | H41: 0 | I41: 0 | J41: 0 | K41: 0 | L41: 0 | M41: 0 | N41: =SUM(RC[-10]:RC[-1]) -> 0
A42: =IF(EQUAL(Timesheet!RC, ""), "", Timesheet!RC) ->  | B42: =IF(EQUAL(Timesheet!RC, ""), "", Timesheet!RC) ->  | C42: =IF(EQUAL(Timesheet!RC, ""), "", Timesheet!RC) ->  | D42: 0 | E42: 0 | F42: 0 | G42: 0 | H42: 0 | I42: 0 | J42: 0 | K42: 0 | L42: 0 | M42: 0 | N42: =SUM(RC[-10]:RC[-1]) -> 0
A43: =IF(EQUAL(Timesheet!RC, ""), "", Timesheet!RC) ->  | B43: =IF(EQUAL(Timesheet!RC, ""), "", Timesheet!RC) ->  | C43: =IF(EQUAL(Timesheet!RC, ""), "", Timesheet!RC) ->  | D43: 0 | E43: 0 | F43: 0 | G43: 0 | H43: 0 | I43: 0 | J43: 0 | K43: 0 | L43: 0 | M43: 0 | N43: =SUM(RC[-10]:RC[-1]) -> 0
A44: =IF(EQUAL(Timesheet!RC, ""), "", Timesheet!RC) ->  | B44: =IF(EQUAL(Timesheet!RC, ""), "", Timesheet!RC) ->  | C44: =IF(EQUAL(Timesheet!RC, ""), "", Timesheet!RC) ->  | D44: 0 | E44: 0 | F44: 0 | G44: 0 | H44: 0 | I44: 0 | J44: 0 | K44: 0 | L44: 0 | M44: 0 | N44: =SUM(RC[-10]:RC[-1]) -> 0
A45: =IF(EQUAL(Timesheet!RC, ""), "", Timesheet!RC) ->  | B45: =IF(EQUAL(Timesheet!RC, ""), "", Timesheet!RC) ->  | C45: =IF(EQUAL(Timesheet!RC, ""), "", Timesheet!RC) ->  | D45: 0 | E45: 0 | F45: 0 | G45: 0 | H45: 0 | I45: 0 | J45: 0 | K45: 0 | L45: 0 | M45: 0 | N45: =SUM(RC[-10]:RC[-1]) -> 0
A46: =IF(EQUAL(Timesheet!RC, ""), "", Timesheet!RC) ->  | B46: =IF(EQUAL(Timesheet!RC, ""), "", Timesheet!RC) ->  | C46: =IF(EQUAL(Timesheet!RC, ""), "", Timesheet!RC) ->  | D46: 0 | E46: 0 | F46: 0 | G46: 0 | H46: 0 | I46: 0 | J46: 0 | K46: 0 | L46: 0 | M46: 0 | N46: =SUM(RC[-10]:RC[-1]) -> 0
A47: =IF(EQUAL(Timesheet!RC, ""), "", Timesheet!RC) ->  | B47: =IF(EQUAL(Timesheet!RC, ""), "", Timesheet!RC) ->  | C47: =IF(EQUAL(Timesheet!RC, ""), "", Timesheet!RC) ->  | D47: 0 | E47: 0 | F47: 0 | G47: 0 | H47: 0 | I47: 0 | J47: 0 | K47: 0 | L47: 0 | M47: 0 | N47: =SUM(RC[-10]:RC[-1]) -> 0
A48: =IF(EQUAL(Timesheet!RC, ""), "", Timesheet!RC) ->  | B48: =IF(EQUAL(Timesheet!RC, ""), "", Timesheet!RC) ->  | C48: =IF(EQUAL(Timesheet!RC, ""), "", Timesheet!RC) ->  | D48: 0 | E48: 0 | F48: 0 | G48: 0 | H48: 0 | I48: 0 | J48: 0 | K48: 0 | L48: 0 | M48: 0 | N48: =SUM(RC[-10]:RC[-1]) -> 0
A49: =IF(EQUAL(Timesheet!RC, ""), "", Timesheet!RC) ->  | B49: =IF(EQUAL(Timesheet!RC, ""), "", Timesheet!RC) ->  | C49: =IF(EQUAL(Timesheet!RC, ""), "", Timesheet!RC) ->  | D49: 0 | E49: 0 | F49: 0 | G49: 0 | H49: 0 | I49: 0 | J49: 0 | K49: 0 | L49: 0 | M49: 0 | N49: =SUM(RC[-10]:RC[-1]) -> 0
A50: =IF(EQUAL(Timesheet!RC, ""), "", Timesheet!RC) ->  | B50: =IF(EQUAL(Timesheet!RC, ""), "", Timesheet!RC) ->  | C50: =IF(EQUAL(Timesheet!RC, ""), "", Timesheet!RC) ->  | D50: 0 | E50: 0 | F50: 0 | G50: 0 | H50: 0 | I50: 0 | J50: 0 | K50: 0 | L50: 0 | M50: 0 | N50: =SUM(RC[-10]:RC[-1]) -> 0
A51: =IF(EQUAL(Timesheet!RC, ""), "", Timesheet!RC) ->  | B51: =IF(EQUAL(Timesheet!RC, ""), "", Timesheet!RC) ->  | C51: =IF(EQUAL(Timesheet!RC, ""), "", Timesheet!RC) ->  | D51: 0 | E51: 0 | F51: 0 | G51: 0 | H51: 0 | I51: 0 | J51: 0 | K51: 0 | L51: 0 | M51: 0 | N51: =SUM(RC[-10]:RC[-1]) -> 0
A52: =IF(EQUAL(Timesheet!RC, ""), "", Timesheet!RC) ->  | B52: =IF(EQUAL(Timesheet!RC, ""), "", Timesheet!RC) ->  | C52: =IF(EQUAL(Timesheet!RC, ""), "", Timesheet!RC) ->  | D52: 0 | E52: 0 | F52: 0 | G52: 0 | H52: 0 | I52: 0 | J52: 0 | K52: 0 | L52: 0 | M52: 0 | N52: =SUM(RC[-10]:RC[-1]) -> 0
A53: =IF(EQUAL(Timesheet!RC, ""), "", Timesheet!RC) ->  | B53: =IF(EQUAL(Timesheet!RC, ""), "", Timesheet!RC) ->  | C53: =IF(EQUAL(Timesheet!RC, ""), "", Timesheet!RC) ->  | D53: 0 | E53: 0 | F53: 0 | G53: 0 | H53: 0 | I53: 0 | J53: 0 | K53: 0 | L53: 0 | M53: 0 | N53: =SUM(RC[-10]:RC[-1]) -> 0
A54: 'TOTAL | D54: =SUM(R[-51]C:R[-1]C) -> 0 | E54: =SUM(R[-51]C:R[-1]C) -> 0 | F54: =SUM(R[-51]C:R[-1]C) -> 0 | G54: =SUM(R[-51]C:R[-1]C) -> 0 | H54: =SUM(R[-51]C:R[-1]C) -> 0 | I54: =SUM(R[-51]C:R[-1]C) -> 0 | J54: =SUM(R[-51]C:R[-1]C) -> 0 | K54: =SUM(R[-51]C:R[-1]C) -> 0 | L54: =SUM(R[-51]C:R[-1]C) -> 0 | M54: =SUM(R[-51]C:R[-1]C) -> 0 | N54: =SUM(R[-51]C:R[-1]C) -> 0

Sheet: April2000
A1: 'CODE | B1: 'AUDIT DESCRIPTION | C1: 'Category | D1: 'Week Ending
D2: =7+March2000!RC[+8] -> 36624 | F2: =RC[-2]+7 -> 36631 | H2: =RC[-2]+7 -> 36638 | J2: =RC[-2]+7 -> 36645 | L2: 'Total
A3: =IF(EQUAL(Timesheet!RC, ""), "", Timesheet!RC) -> 1001 | B3: =IF(EQUAL(Timesheet!RC, ""), "", Timesheet!RC) -> PURCHASING | C3: =IF(EQUAL(Timesheet!RC, ""), "", Timesheet!RC) -> Mgmnt | D3: 0 | E3: 0 | F3: 0 | G3: 0 | H3: 0 | I3: 0 | J3: 0 | K3: 0 | L3: =SUM(RC[-8]:RC[-1]) -> 0
A4: =IF(EQUAL(Timesheet!RC, ""), "", Timesheet!RC) -> 1002 | B4: =IF(EQUAL(Timesheet!RC, ""), "", Timesheet!RC) -> HUMAN RESOURCE | C4: =IF(EQUAL(Timesheet!RC, ""), "", Timesheet!RC) -> Plan | D4: 0 | E4: 0 | F4: 0 | G4: 0 | H4: 0 | I4: 0 | J4: 0 | K4: 0 | L4: =SUM(RC[-8]:RC[-1]) -> 0
A5: =IF(EQUAL(Timesheet!RC, ""), "", Timesheet!RC) -> 1005 | B5: =IF(EQUAL(Timesheet!RC, ""), "", Timesheet!RC) -> CORPORATE AUDIT RISK ANALYSIS | C5: =IF(EQUAL(Timesheet!RC, ""), "", Timesheet!RC) -> Plan | D5: 0 | E5: 0 | F5: 0 | G5: 0 | H5: 0 | I5: 0 | J5: 0 | K5: 0 | L5: =SUM(RC[-8]:RC[-1]) -> 0
A6: =IF(EQUAL(Timesheet!RC, ""), "", Timesheet!RC) -> 1007 | B6: =IF(EQUAL(Timesheet!RC, ""), "", Timesheet!RC) -> OFFICER'S TRAVEL & EXPENSE | C6: =IF(EQUAL(Timesheet!RC, ""), "", Timesheet!RC) -> Plan | D6: 0 | E6: 0 | F6: 0 | G6: 0 | H6: 0 | I6: 0 | J6: 0 | K6: 0 | L6: =SUM(RC[-8]:RC[-1]) -> 0
A7: =IF(EQUAL(Timesheet!RC, ""), "", Timesheet!RC) -> 1008 | B7: =IF(EQUAL(Timesheet!RC, ""), "", Timesheet!RC) -> RECORD RETENTION | C7: =IF(EQUAL(Timesheet!RC, ""), "", Timesheet!RC) -> Mgmnt | D7: 0 | E7: 0 | F7: 0 | G7: 0 | H7: 0 | I7: 0 | J7: 0 | K7: 0 | L7: =SUM(RC[-8]:RC[-1]) -> 0
A8: =IF(EQUAL(Timesheet!RC, ""), "", Timesheet!RC) -> 1009 | B8: =IF(EQUAL(Timesheet!RC, ""), "", Timesheet!RC) -> NASD AUDITS | C8: =IF(EQUAL(Timesheet!RC, ""), "", Timesheet!RC) -> Plan | D8: 0 | E8: 0 | F8: 0 | G8: 0 | H8: 0 | I8: 0 | J8: 0 | K8: 0 | L8: =SUM(RC[-8]:RC[-1]) -> 0
A9: =IF(EQUAL(Timesheet!RC, ""), "", Timesheet!RC) -> 1011 | B9: =IF(EQUAL(Timesheet!RC, ""), "", Timesheet!RC) -> SURPRISE CASH AUDIT - NEW YORK | C9: =IF(EQUAL(Timesheet!RC, ""), "", Timesheet!RC) -> Plan | D9: 0 | E9: 0 | F9: 0 | G9: 0 | H9: 0 | I9: 0 | J9: 0 | K9: 0 | L9: =SUM(RC[-8]:RC[-1]) -> 0
A10: =IF(EQUAL(Timesheet!RC, ""), "", Timesheet!RC) -> 1012 | B10: =IF(EQUAL(Timesheet!RC, ""), "", Timesheet!RC) -> INTERNATIONAL AUDIT - IBI | C10: =IF(EQUAL(Timesheet!RC, ""), "", Timesheet!RC) -> Plan | D10: 0 | E10: 0 | F10: 0 | G10: 0 | H10: 0 | I10: 0 | J10: 0 | K10: 0 | L10: =SUM(RC[-8]:RC[-1]) -> 0
A11: =IF(EQUAL(Timesheet!RC, ""), "", Timesheet!RC) -> 1013 | B11: =IF(EQUAL(Timesheet!RC, ""), "", Timesheet!RC) -> INTERNATIONAL AUDIT - CISL | C11: =IF(EQUAL(Timesheet!RC, ""), "", Timesheet!RC) -> Plan | D11: 0 | E11: 0 | F11: 0 | G11: 0 | H11: 0 | I11: 0 | J11: 0 | K11: 0 | L11: =SUM(RC[-8]:RC[-1]) -> 0
A12: =IF(EQUAL(Timesheet!RC, ""), "", Timesheet!RC) -> 1014 | B12: =IF(EQUAL(Timesheet!RC, ""), "", Timesheet!RC) -> MARKETING AND COMMUNICATION | C12: =IF(EQUAL(Timesheet!RC, ""), "", Timesheet!RC) -> Mgmnt | D12: 0 | E12: 0 | F12: 0 | G12: 0 | H12: 0 | I12: 0 | J12: 0 | K12: 0 | L12: =SUM(RC[-8]:RC[-1]) -> 0
A13: =IF(EQUAL(Timesheet!RC, ""), "", Timesheet!RC) -> 3001 | B13: =IF(EQUAL(Timesheet!RC, ""), "", Timesheet!RC) -> FIELD OFFICE CONTROL REVIEWS | C13: =IF(EQUAL(Timesheet!RC, ""), "", Timesheet!RC) -> Field | D13: 0 | E13: 0 | F13: 0 | G13: 0 | H13: 0 | I13: 0 | J13: 0 | K13: 0 | L13: =SUM(RC[-8]:RC[-1]) -> 0
A14: =IF(EQUAL(Timesheet!RC, ""), "", Timesheet!RC) -> 3002 | B14: =IF(EQUAL(Timesheet!RC, ""), "", Timesheet!RC) -> FIELD OFFICE ACCOUNTABILITY ANALYSIS | C14: =IF(EQUAL(Timesheet!RC, ""), "", Timesheet!RC) -> Field | D14: 0 | E14: 0 | F14: 0 | G14: 0 | H14: 0 | I14: 0 | J14: 0 | K14: 0 | L14: =SUM(RC[-8]:RC[-1]) -> 0
A15: =IF(EQUAL(Timesheet!RC, ""), "", Timesheet!RC) -> 3010 | B15: =IF(EQUAL(Timesheet!RC, ""), "", Timesheet!RC) -> FIELD OFFICE BANK RECONCILATIONS | C15: =IF(EQUAL(Timesheet!RC, ""), "", Timesheet!RC) -> Field | D15: 0 | E15: 0 | F15: 0 | G15: 0 | H15: 0 | I15: 0 | J15: 0 | K15: 0 | L15: =SUM(RC[-8]:RC[-1]) -> 0
A16: =IF(EQUAL(Timesheet!RC, ""), "", Timesheet!RC) -> 3020 | B16: =IF(EQUAL(Timesheet!RC, ""), "", Timesheet!RC) -> FIELD AUDIT PROGRAM DEVELOPMENT | C16: =IF(EQUAL(Timesheet!RC, ""), "", Timesheet!RC) -> Field | D16: 0 | E16: 0 | F16: 0 | G16: 0 | H16: 0 | I16: 0 | J16: 0 | K16: 0 | L16: =SUM(RC[-8]:RC[-1]) -> 0
A17: =IF(EQUAL(Timesheet!RC, ""), "", Timesheet!RC) -> 3030 | B17: =IF(EQUAL(Timesheet!RC, ""), "", Timesheet!RC) -> OPEN COMMITMENT ANALYSIS | C17: =IF(EQUAL(Timesheet!RC, ""), "", Timesheet!RC) -> Field | D17: 0 | E17: 0 | F17: 0 | G17: 0 | H17: 0 | I17: 0 | J17: 0 | K17: 0 | L17: =SUM(RC[-8]:RC[-1]) -> 0
A18: =IF(EQUAL(Timesheet!RC, ""), "", Timesheet!RC) -> 3040 | B18: =IF(EQUAL(Timesheet!RC, ""), "", Timesheet!RC) -> FIELD AUDIT RISK ASSESMENT | C18: =IF(EQUAL(Timesheet!RC, ""), "", Timesheet!RC) -> Field | D18: 0 | E18: 0 | F18: 0 | G18: 0 | H18: 0 | I18: 0 | J18: 0 | K18: 0 | L18: =SUM(RC[-8]:RC[-1]) -> 0
A19: =IF(EQUAL(Timesheet!RC, ""), "", Timesheet!RC) -> 3050 | B19: =IF(EQUAL(Timesheet!RC, ""), "", Timesheet!RC) -> NEW YORK FIELD AUDIT REVIEWS | C19: =IF(EQUAL(Timesheet!RC, ""), "", Timesheet!RC) -> Field | D19: 0 | E19: 0 | F19: 0 | G19: 0 | H19: 0 | I19: 0 | J19: 0 | K19: 0 | L19: =SUM(RC[-8]:RC[-1]) -> 0
A20: =IF(EQUAL(Timesheet!RC, ""), "", Timesheet!RC) -> 4001 | B20: =IF(EQUAL(Timesheet!RC, ""), "", Timesheet!RC) -> GRANT THORNTON | C20: =IF(EQUAL(Timesheet!RC, ""), "", Timesheet!RC) -> Mgmnt | D20: 0 | E20: 0 | F20: 0 | G20: 0 | H20: 0 | I20: 0 | J20: 0 | K20: 0 | L20: =SUM(RC[-8]:RC[-1]) -> 0
A21: =IF(EQUAL(Timesheet!RC, ""), "", Timesheet!RC) -> 5001 | B21: =IF(EQUAL(Timesheet!RC, ""), "", Timesheet!RC) -> MISCELLANEOUS AUDIT REQUESTS | C21: =IF(EQUAL(Timesheet!RC, ""), "", Timesheet!RC) -> Mgmnt | D21: 0 | E21: 0 | F21: 0 | G21: 0 | H21: 0 | I21: 0 | J21: 0 | K21: 0 | L21: =SUM(RC[-8]:RC[-1]) -> 0
A22: =IF(EQUAL(Timesheet!RC, ""), "", Timesheet!RC) -> 5009 | B22: =IF(EQUAL(Timesheet!RC, ""), "", Timesheet!RC) -> FORMS INVENTORY | C22: =IF(EQUAL(Timesheet!RC, ""), "", Timesheet!RC) -> Plan | D22: 0 | E22: 0 | F22: 0 | G22: 0 | H22: 0 | I22: 0 | J22: 0 | K22: 0 | L22: =SUM(RC[-8]:RC[-1]) -> 0
A23: =IF(EQUAL(Timesheet!RC, ""), "", Timesheet!RC) -> 5010 | B23: =IF(EQUAL(Timesheet!RC, ""), "", Timesheet!RC) -> SURPRISE CHECK VALIDATION | C23: =IF(EQUAL(Timesheet!RC, ""), "", Timesheet!RC) -> Plan | D23: 0 | E23: 0 | F23: 0 | G23: 0 | H23: 0 | I23: 0 | J23: 0 | K23: 0 | L23: =SUM(RC[-8]:RC[-1]) -> 0
A24: =IF(EQUAL(Timesheet!RC, ""), "", Timesheet!RC) -> 7000 | B24: =IF(EQUAL(Timesheet!RC, ""), "", Timesheet!RC) -> NON-PROJECT RELATED (MEETINGS) | C24: =IF(EQUAL(Timesheet!RC, ""), "", Timesheet!RC) -> Non-Audit | D24: 0 | E24: 0 | F24: 0 | G24: 0 | H24: 0 | I24: 0 | J24: 0 | K24: 0 | L24: =SUM(RC[-8]:RC[-1]) -> 0
A25: =IF(EQUAL(Timesheet!RC, ""), "", Timesheet!RC) -> 7003 | B25: =IF(EQUAL(Timesheet!RC, ""), "", Timesheet!RC) -> AUDIT COMMITTEE | C25: =IF(EQUAL(Timesheet!RC, ""), "", Timesheet!RC) -> Non-Audit | D25: 0 | E25: 0 | F25: 0 | G25: 0 | H25: 0 | I25: 0 | J25: 0 | K25: 0 | L25: =SUM(RC[-8]:RC[-1]) -> 0
A26: =IF(EQUAL(Timesheet!RC, ""), "", Timesheet!RC) -> 8001 | B26: =IF(EQUAL(Timesheet!RC, ""), "", Timesheet!RC) -> ADMINISTRATIVE - GENERAL | C26: =IF(EQUAL(Timesheet!RC, ""), "", Timesheet!RC) -> Admin | D26: 0 | E26: 0 | F26: 0 | G26: 0 | H26: 0 | I26: 0 | J26: 0 | K26: 0 | L26: =SUM(RC[-8]:RC[-1]) -> 0
A27: =IF(EQUAL(Timesheet!RC, ""), "", Timesheet!RC) -> 8002 | B27: =IF(EQUAL(Timesheet!RC, ""), "", Timesheet!RC) -> HOLIDAYS | C27: =IF(EQUAL(Timesheet!RC, ""), "", Timesheet!RC) -> Admin | D27: 0 | E27: 0 | F27: 0 | G27: 0 | H27: 0 | I27: 0 | J27: 0 | K27: 0 | L27: =SUM(RC[-8]:RC[-1]) -> 0
A28: =IF(EQUAL(Timesheet!RC, ""), "", Timesheet!RC) -> 8004 | B28: =IF(EQUAL(Timesheet!RC, ""), "", Timesheet!RC) -> SEMINARS & TRAINING | C28: =IF(EQUAL(Timesheet!RC, ""), "", Timesheet!RC) -> Admin | D28: 0 | E28: 0 | F28: 0 | G28: 0 | H28: 0 | I28: 0 | J28: 0 | K28: 0 | L28: =SUM(RC[-8]:RC[-1]) -> 0
A29: =IF(EQUAL(Timesheet!RC, ""), "", Timesheet!RC) -> 8005 | B29: =IF(EQUAL(Timesheet!RC, ""), "", Timesheet!RC) -> PERSONAL (VACATION/AT) | C29: =IF(EQUAL(Timesheet!RC, ""), "", Timesheet!RC) -> Admin | D29: 0 | E29: 0 | F29: 0 | G29: 0 | H29: 0 | I29: 0 | J29: 0 | K29: 0 | L29: =SUM(RC[-8]:RC[-1]) -> 0
A30: =IF(EQUAL(Timesheet!RC, ""), "", Timesheet!RC) -> 8006 | B30: =IF(EQUAL(Timesheet!RC, ""), "", Timesheet!RC) -> SICK | C30: =IF(EQUAL(Timesheet!RC, ""), "", Timesheet!RC) -> Admin | D30: 0 | E30: 0 | F30: 0 | G30: 0 | H30: 0 | I30: 0 | J30: 0 | K30: 0 | L30: =SUM(RC[-8]:RC[-1]) -> 0
A31: =IF(EQUAL(Timesheet!RC, ""), "", Timesheet!RC) -> 8008 | B31: =IF(EQUAL(Timesheet!RC, ""), "", Timesheet!RC) -> RESEARCH | C31: =IF(EQUAL(Timesheet!RC, ""), "", Timesheet!RC) -> Non-Audit | D31: 0 | E31: 0 | F31: 0 | G31: 0 | H31: 0 | I31: 0 | J31: 0 | K31: 0 | L31: =SUM(RC[-8]:RC[-1]) -> 0
A32: =IF(EQUAL(Timesheet!RC, ""), "", Timesheet!RC) ->  | B32: =IF(EQUAL(Timesheet!RC, ""), "", Timesheet!RC) ->  | C32: =IF(EQUAL(Timesheet!RC, ""), "", Timesheet!RC) ->  | D32: 0 | E32: 0 | F32: 0 | G32: 0 | H32: 0 | I32: 0 | J32: 0 | K32: 0 | L32: =SUM(RC[-8]:RC[-1]) -> 0
A33: =IF(EQUAL(Timesheet!RC, ""), "", Timesheet!RC) ->  | B33: =IF(EQUAL(Timesheet!RC, ""), "", Timesheet!RC) ->  | C33: =IF(EQUAL(Timesheet!RC, ""), "", Timesheet!RC) ->  | D33: 0 | E33: 0 | F33: 0 | G33: 0 | H33: 0 | I33: 0 | J33: 0 | K33: 0 | L33: =SUM(RC[-8]:RC[-1]) -> 0
A34: =IF(EQUAL(Timesheet!RC, ""), "", Timesheet!RC) ->  | B34: =IF(EQUAL(Timesheet!RC, ""), "", Timesheet!RC) ->  | C34: =IF(EQUAL(Timesheet!RC, ""), "", Timesheet!RC) ->  | D34: 0 | E34: 0 | F34: 0 | G34: 0 | H34: 0 | I34: 0 | J34: 0 | K34: 0 | L34: =SUM(RC[-8]:RC[-1]) -> 0
A35: =IF(EQUAL(Timesheet!RC, ""), "", Timesheet!RC) ->  | B35: =IF(EQUAL(Timesheet!RC, ""), "", Timesheet!RC) ->  | C35: =IF(EQUAL(Timesheet!RC, ""), "", Timesheet!RC) ->  | D35: 0 | E35: 0 | F35: 0 | G35: 0 | H35: 0 | I35: 0 | J35: 0 | K35: 0 | L35: =SUM(RC[-8]:RC[-1]) -> 0
A36: =IF(EQUAL(Timesheet!RC, ""), "", Timesheet!RC) ->  | B36: =IF(EQUAL(Timesheet!RC, ""), "", Timesheet!RC) ->  | C36: =IF(EQUAL(Timesheet!RC, ""), "", Timesheet!RC) ->  | D36: 0 | E36: 0 | F36: 0 | G36: 0 | H36: 0 | I36: 0 | J36: 0 | K36: 0 | L36: =SUM(RC[-8]:RC[-1]) -> 0
A37: =IF(EQUAL(Timesheet!RC, ""), "", Timesheet!RC) ->  | B37: =IF(EQUAL(Timesheet!RC, ""), "", Timesheet!RC) ->  | C37: =IF(EQUAL(Timesheet!RC, ""), "", Timesheet!RC) ->  | D37: 0 | E37: 0 | F37: 0 | G37: 0 | H37: 0 | I37: 0 | J37: 0 | K37: 0 | L37: =SUM(RC[-8]:RC[-1]) -> 0
A38: =IF(EQUAL(Timesheet!RC, ""), "", Timesheet!RC) ->  | B38: =IF(EQUAL(Timesheet!RC, ""), "", Timesheet!RC) ->  | C38: =IF(EQUAL(Timesheet!RC, ""), "", Timesheet!RC) ->  | D38: 0 | E38: 0 | F38: 0 | G38: 0 | H38: 0 | I38: 0 | J38: 0 | K38: 0 | L38: =SUM(RC[-8]:RC[-1]) -> 0
A39: =IF(EQUAL(Timesheet!RC, ""), "", Timesheet!RC) ->  | B39: =IF(EQUAL(Timesheet!RC, ""), "", Timesheet!RC) ->  | C39: =IF(EQUAL(Timesheet!RC, ""), "", Timesheet!RC) ->  | D39: 0 | E39: 0 | F39: 0 | G39: 0 | H39: 0 | I39: 0 | J39: 0 | K39: 0 | L39: =SUM(RC[-8]:RC[-1]) -> 0
A40: =IF(EQUAL(Timesheet!RC, ""), "", Timesheet!RC) ->  | B40: =IF(EQUAL(Timesheet!RC, ""), "", Timesheet!RC) ->  | C40: =IF(EQUAL(Timesheet!RC, ""), "", Timesheet!RC) ->  | D40: 0 | E40: 0 | F40: 0 | G40: 0 | H40: 0 | I40: 0 | J40: 0 | K40: 0 | L40: =SUM(RC[-8]:RC[-1]) -> 0
A41: =IF(EQUAL(Timesheet!RC, ""), "", Timesheet!RC) ->  | B41: =IF(EQUAL(Timesheet!RC, ""), "", Timesheet!RC) ->  | C41: =IF(EQUAL(Timesheet!RC, ""), "", Timesheet!RC) ->  | D41: 0 | E41: 0 | F41: 0 | G41: 0 | H41: 0 | I41: 0 | J41: 0 | K41: 0 | L41: =SUM(RC[-8]:RC[-1]) -> 0
A42: =IF(EQUAL(Timesheet!RC, ""), "", Timesheet!RC) ->  | B42: =IF(EQUAL(Timesheet!RC, ""), "", Timesheet!RC) ->  | C42: =IF(EQUAL(Timesheet!RC, ""), "", Timesheet!RC) ->  | D42: 0 | E42: 0 | F42: 0 | G42: 0 | H42: 0 | I42: 0 | J42: 0 | K42: 0 | L42: =SUM(RC[-8]:RC[-1]) -> 0
A43: =IF(EQUAL(Timesheet!RC, ""), "", Timesheet!RC) ->  | B43: =IF(EQUAL(Timesheet!RC, ""), "", Timesheet!RC) ->  | C43: =IF(EQUAL(Timesheet!RC, ""), "", Timesheet!RC) ->  | D43: 0 | E43: 0 | F43: 0 | G43: 0 | H43: 0 | I43: 0 | J43: 0 | K43: 0 | L43: =SUM(RC[-8]:RC[-1]) -> 0
A44: =IF(EQUAL(Timesheet!RC, ""), "", Timesheet!RC) ->  | B44: =IF(EQUAL(Timesheet!RC, ""), "", Timesheet!RC) ->  | C44: =IF(EQUAL(Timesheet!RC, ""), "", Timesheet!RC) ->  | D44: 0 | E44: 0 | F44: 0 | G44: 0 | H44: 0 | I44: 0 | J44: 0 | K44: 0 | L44: =SUM(RC[-8]:RC[-1]) -> 0
D45: 0 | E45: 0 | F45: 0 | G45: 0 | H45: 0 | I45: 0 | J45: 0 | K45: 0 | L45: =SUM(RC[-8]:RC[-1]) -> 0
D46: 0 | E46: 0 | F46: 0 | G46: 0 | H46: 0 | I46: 0 | J46: 0 | K46: 0 | L46: =SUM(RC[-8]:RC[-1]) -> 0
D47: 0 | E47: 0 | F47: 0 | G47: 0 | H47: 0 | I47: 0 | J47: 0 | K47: 0 | L47: =SUM(RC[-8]:RC[-1]) -> 0
D48: 0 | E48: 0 | F48: 0 | G48: 0 | H48: 0 | I48: 0 | J48: 0 | K48: 0 | L48: =SUM(RC[-8]:RC[-1]) -> 0
D49: 0 | E49: 0 | F49: 0 | G49: 0 | H49: 0 | I49: 0 | J49: 0 | K49: 0 | L49: =SUM(RC[-8]:RC[-1]) -> 0
D50: 0 | E50: 0 | F50: 0 | G50: 0 | H50: 0 | I50: 0 | J50: 0 | K50: 0 | L50: =SUM(RC[-8]:RC[-1]) -> 0
D51: 0 | E51: 0 | F51: 0 | G51: 0 | H51: 0 | I51: 0 | J51: 0 | K51: 0 | L51: =SUM(RC[-8]:RC[-1]) -> 0
D52: 0 | E52: 0 | F52: 0 | G52: 0 | H52: 0 | I52: 0 | J52: 0 | K52: 0 | L52: =SUM(RC[-8]:RC[-1]) -> 0
D53: 0 | E53: 0 | F53: 0 | G53: 0 | H53: 0 | I53: 0 | J53: 0 | K53: 0 | L53: =SUM(RC[-8]:RC[-1]) -> 0
A54: 'TOTAL | D54: =SUM(R[-51]C:R[-1]C) -> 0 | E54: =SUM(R[-51]C:R[-1]C) -> 0 | F54: =SUM(R[-51]C:R[-1]C) -> 0 | G54: =SUM(R[-51]C:R[-1]C) -> 0 | H54: =SUM(R[-51]C:R[-1]C) -> 0 | I54: =SUM(R[-51]C:R[-1]C) -> 0 | J54: =SUM(R[-51]C:R[-1]C) -> 0 | K54: =SUM(R[-51]C:R[-1]C) -> 0 | L54: =SUM(R[-51]C:R[-1]C) -> 0

Sheet: May2000
A1: 'CODE | B1: 'AUDIT DESCRIPTION | C1: 'Category | D1: 'Week Ending
D2: =7+April2000!RC[+6] -> 36652 | E2: 'Susan | F2: =RC[-2]+7 -> 36659 | G2: 'Susan | H2: =RC[-2]+7 -> 36666 | I2: 'Susan | J2: =RC[-2]+7 -> 36673 | K2: 'Susan | L2: 'Total
A3: =IF(EQUAL(Timesheet!RC, ""), "", Timesheet!RC) -> 1001 | B3: =IF(EQUAL(Timesheet!RC, ""), "", Timesheet!RC) -> PURCHASING | C3: =IF(EQUAL(Timesheet!RC, ""), "", Timesheet!RC) -> Mgmnt | D3: 0 | E3: 0 | F3: 0 | G3: 0 | H3: 0 | I3: 0 | J3: 0 | K3: 0 | L3: =SUM(RC[-8]:RC[-1]) -> 0
A4: =IF(EQUAL(Timesheet!RC, ""), "", Timesheet!RC) -> 1002 | B4: =IF(EQUAL(Timesheet!RC, ""), "", Timesheet!RC) -> HUMAN RESOURCE | C4: =IF(EQUAL(Timesheet!RC, ""), "", Timesheet!RC) -> Plan | D4: 0 | E4: 0 | F4: 0 | G4: 0 | H4: 0 | I4: 0 | J4: 0 | K4: 0 | L4: =SUM(RC[-8]:RC[-1]) -> 0
A5: =IF(EQUAL(Timesheet!RC, ""), "", Timesheet!RC) -> 1005 | B5: =IF(EQUAL(Timesheet!RC, ""), "", Timesheet!RC) -> CORPORATE AUDIT RISK ANALYSIS | C5: =IF(EQUAL(Timesheet!RC, ""), "", Timesheet!RC) -> Plan | D5: 0 | E5: 0 | F5: 0 | G5: 0 | H5: 0 | I5: 0 | J5: 0 | K5: 0 | L5: =SUM(RC[-8]:RC[-1]) -> 0
A6: =IF(EQUAL(Timesheet!RC, ""), "", Timesheet!RC) -> 1007 | B6: =IF(EQUAL(Timesheet!RC, ""), "", Timesheet!RC) -> OFFICER'S TRAVEL & EXPENSE | C6: =IF(EQUAL(Timesheet!RC, ""), "", Timesheet!RC) -> Plan | D6: 0 | E6: 0 | F6: 0 | G6: 0 | H6: 0 | I6: 0 | J6: 0 | K6: 0 | L6: =SUM(RC[-8]:RC[-1]) -> 0
A7: =IF(EQUAL(Timesheet!RC, ""), "", Timesheet!RC) -> 1008 | B7: =IF(EQUAL(Timesheet!RC, ""), "", Timesheet!RC) -> RECORD RETENTION | C7: =IF(EQUAL(Timesheet!RC, ""), "", Timesheet!RC) -> Mgmnt | D7: 0 | E7: 0 | F7: 0 | G7: 0 | H7: 0 | I7: 0 | J7: 0 | K7: 0 | L7: =SUM(RC[-8]:RC[-1]) -> 0
A8: =IF(EQUAL(Timesheet!RC, ""), "", Timesheet!RC) -> 1009 | B8: =IF(EQUAL(Timesheet!RC, ""), "", Timesheet!RC) -> NASD AUDITS | C8: =IF(EQUAL(Timesheet!RC, ""), "", Timesheet!RC) -> Plan | D8: 0 | E8: 0 | F8: 0 | G8: 0 | H8: 0 | I8: 0 | J8: 0 | K8: 0 | L8: =SUM(RC[-8]:RC[-1]) -> 0
A9: =IF(EQUAL(Timesheet!RC, ""), "", Timesheet!RC) -> 1011 | B9: =IF(EQUAL(Timesheet!RC, ""), "", Timesheet!RC) -> SURPRISE CASH AUDIT - NEW YORK | C9: =IF(EQUAL(Timesheet!RC, ""), "", Timesheet!RC) -> Plan | D9: 0 | E9: 0 | F9: 0 | G9: 0 | H9: 0 | I9: 0 | J9: 0 | K9: 0 | L9: =SUM(RC[-8]:RC[-1]) -> 0
A10: =IF(EQUAL(Timesheet!RC, ""), "", Timesheet!RC) -> 1012 | B10: =IF(EQUAL(Timesheet!RC, ""), "", Timesheet!RC) -> INTERNATIONAL AUDIT - IBI | C10: =IF(EQUAL(Timesheet!RC, ""), "", Timesheet!RC) -> Plan | D10: 0 | E10: 0 | F10: 0 | G10: 0 | H10: 0 | I10: 0 | J10: 0 | K10: 0 | L10: =SUM(RC[-8]:RC[-1]) -> 0
A11: =IF(EQUAL(Timesheet!RC, ""), "", Timesheet!RC) -> 1013 | B11: =IF(EQUAL(Timesheet!RC, ""), "", Timesheet!RC) -> INTERNATIONAL AUDIT - CISL | C11: =IF(EQUAL(Timesheet!RC, ""), "", Timesheet!RC) -> Plan | D11: 0 | E11: 0 | F11: 0 | G11: 0 | H11: 0 | I11: 0 | J11: 0 | K11: 0 | L11: =SUM(RC[-8]:RC[-1]) -> 0
A12: =IF(EQUAL(Timesheet!RC, ""), "", Timesheet!RC) -> 1014 | B12: =IF(EQUAL(Timesheet!RC, ""), "", Timesheet!RC) -> MARKETING AND COMMUNICATION | C12: =IF(EQUAL(Timesheet!RC, ""), "", Timesheet!RC) -> Mgmnt | D12: 0 | E12: 0 | F12: 0 | G12: 0 | H12: 0 | I12: 0 | J12: 0 | K12: 0 | L12: =SUM(RC[-8]:RC[-1]) -> 0
A13: =IF(EQUAL(Timesheet!RC, ""), "", Timesheet!RC) -> 3001 | B13: =IF(EQUAL(Timesheet!RC, ""), "", Timesheet!RC) -> FIELD OFFICE CONTROL REVIEWS | C13: =IF(EQUAL(Timesheet!RC, ""), "", Timesheet!RC) -> Field | D13: 0 | E13: 0 | F13: 0 | G13: 0 | H13: 0 | I13: 0 | J13: 0 | K13: 0 | L13: =SUM(RC[-8]:RC[-1]) -> 0
A14: =IF(EQUAL(Timesheet!RC, ""), "", Timesheet!RC) -> 3002 | B14: =IF(EQUAL(Timesheet!RC, ""), "", Timesheet!RC) -> FIELD OFFICE ACCOUNTABILITY ANALYSIS | C14: =IF(EQUAL(Timesheet!RC, ""), "", Timesheet!RC) -> Field | D14: 0 | E14: 0 | F14: 0 | G14: 0 | H14: 0 | I14: 0 | J14: 0 | K14: 0 | L14: =SUM(RC[-8]:RC[-1]) -> 0
A15: =IF(EQUAL(Timesheet!RC, ""), "", Timesheet!RC) -> 3010 | B15: =IF(EQUAL(Timesheet!RC, ""), "", Timesheet!RC) -> FIELD OFFICE BANK RECONCILATIONS | C15: =IF(EQUAL(Timesheet!RC, ""), "", Timesheet!RC) -> Field | D15: 0 | E15: 0 | F15: 0 | G15: 0 | H15: 0 | I15: 0 | J15: 0 | K15: 0 | L15: =SUM(RC[-8]:RC[-1]) -> 0
A16: =IF(EQUAL(Timesheet!RC, ""), "", Timesheet!RC) -> 3020 | B16: =IF(EQUAL(Timesheet!RC, ""), "", Timesheet!RC) -> FIELD AUDIT PROGRAM DEVELOPMENT | C16: =IF(EQUAL(Timesheet!RC, ""), "", Timesheet!RC) -> Field | D16: 0 | E16: 0 | F16: 0 | G16: 0 | H16: 0 | I16: 0 | J16: 0 | K16: 0 | L16: =SUM(RC[-8]:RC[-1]) -> 0
A17: =IF(EQUAL(Timesheet!RC, ""), "", Timesheet!RC) -> 3030 | B17: =IF(EQUAL(Timesheet!RC, ""), "", Timesheet!RC) -> OPEN COMMITMENT ANALYSIS | C17: =IF(EQUAL(Timesheet!RC, ""), "", Timesheet!RC) -> Field | D17: 0 | E17: 0 | F17: 0 | G17: 0 | H17: 0 | I17: 0 | J17: 0 | K17: 0 | L17: =SUM(RC[-8]:RC[-1]) -> 0
A18: =IF(EQUAL(Timesheet!RC, ""), "", Timesheet!RC) -> 3040 | B18: =IF(EQUAL(Timesheet!RC, ""), "", Timesheet!RC) -> FIELD AUDIT RISK ASSESMENT | C18: =IF(EQUAL(Timesheet!RC, ""), "", Timesheet!RC) -> Field | D18: 0 | E18: 0 | F18: 0 | G18: 0 | H18: 0 | I18: 0 | J18: 0 | K18: 0 | L18: =SUM(RC[-8]:RC[-1]) -> 0
A19: =IF(EQUAL(Timesheet!RC, ""), "", Timesheet!RC) -> 3050 | B19: =IF(EQUAL(Timesheet!RC, ""), "", Timesheet!RC) -> NEW YORK FIELD AUDIT REVIEWS | C19: =IF(EQUAL(Timesheet!RC, ""), "", Timesheet!RC) -> Field | D19: 0 | E19: 0 | F19: 0 | G19: 0 | H19: 0 | I19: 0 | J19: 0 | K19: 0 | L19: =SUM(RC[-8]:RC[-1]) -> 0
A20: =IF(EQUAL(Timesheet!RC, ""), "", Timesheet!RC) -> 4001 | B20: =IF(EQUAL(Timesheet!RC, ""), "", Timesheet!RC) -> GRANT THORNTON | C20: =IF(EQUAL(Timesheet!RC, ""), "", Timesheet!RC) -> Mgmnt | D20: 0 | E20: 0 | F20: 0 | G20: 0 | H20: 0 | I20: 0 | J20: 0 | K20: 0 | L20: =SUM(RC[-8]:RC[-1]) -> 0
A21: =IF(EQUAL(Timesheet!RC, ""), "", Timesheet!RC) -> 5001 | B21: =IF(EQUAL(Timesheet!RC, ""), "", Timesheet!RC) -> MISCELLANEOUS AUDIT REQUESTS | C21: =IF(EQUAL(Timesheet!RC, ""), "", Timesheet!RC) -> Mgmnt | D21: 0 | E21: 0 | F21: 0 | G21: 0 | H21: 0 | I21: 0 | J21: 0 | K21: 0 | L21: =SUM(RC[-8]:RC[-1]) -> 0
A22: =IF(EQUAL(Timesheet!RC, ""), "", Timesheet!RC) -> 5009 | B22: =IF(EQUAL(Timesheet!RC, ""), "", Timesheet!RC) -> FORMS INVENTORY | C22: =IF(EQUAL(Timesheet!RC, ""), "", Timesheet!RC) -> Plan | D22: 0 | E22: 0 | F22: 0 | G22: 0 | H22: 0 | I22: 0 | J22: 0 | K22: 0 | L22: =SUM(RC[-8]:RC[-1]) -> 0
A23: =IF(EQUAL(Timesheet!RC, ""), "", Timesheet!RC) -> 5010 | B23: =IF(EQUAL(Timesheet!RC, ""), "", Timesheet!RC) -> SURPRISE CHECK VALIDATION | C23: =IF(EQUAL(Timesheet!RC, ""), "", Timesheet!RC) -> Plan | D23: 0 | E23: 0 | F23: 0 | G23: 0 | H23: 0 | I23: 0 | J23: 0 | K23: 0 | L23: =SUM(RC[-8]:RC[-1]) -> 0
A24: =IF(EQUAL(Timesheet!RC, ""), "", Timesheet!RC) -> 7000 | B24: =IF(EQUAL(Timesheet!RC, ""), "", Timesheet!RC) -> NON-PROJECT RELATED (MEETINGS) | C24: =IF(EQUAL(Timesheet!RC, ""), "", Timesheet!RC) -> Non-Audit | D24: 0 | E24: 0 | F24: 0 | G24: 0 | H24: 0 | I24: 0 | J24: 0 | K24: 0 | L24: =SUM(RC[-8]:RC[-1]) -> 0
A25: =IF(EQUAL(Timesheet!RC, ""), "", Timesheet!RC) -> 7003 | B25: =IF(EQUAL(Timesheet!RC, ""), "", Timesheet!RC) -> AUDIT COMMITTEE | C25: =IF(EQUAL(Timesheet!RC, ""), "", Timesheet!RC) -> Non-Audit | D25: 0 | E25: 0 | F25: 0 | G25: 0 | H25: 0 | I25: 0 | J25: 0 | K25: 0 | L25: =SUM(RC[-8]:RC[-1]) -> 0
A26: =IF(EQUAL(Timesheet!RC, ""), "", Timesheet!RC) -> 8001 | B26: =IF(EQUAL(Timesheet!RC, ""), "", Timesheet!RC) -> ADMINISTRATIVE - GENERAL | C26: =IF(EQUAL(Timesheet!RC, ""), "", Timesheet!RC) -> Admin | D26: 0 | E26: 0 | F26: 0 | G26: 0 | H26: 0 | I26: 0 | J26: 0 | K26: 0 | L26: =SUM(RC[-8]:RC[-1]) -> 0
A27: =IF(EQUAL(Timesheet!RC, ""), "", Timesheet!RC) -> 8002 | B27: =IF(EQUAL(Timesheet!RC, ""), "", Timesheet!RC) -> HOLIDAYS | C27: =IF(EQUAL(Timesheet!RC, ""), "", Timesheet!RC) -> Admin | D27: 0 | E27: 0 | F27: 0 | G27: 0 | H27: 0 | I27: 0 | J27: 0 | K27: 0 | L27: =SUM(RC[-8]:RC[-1]) -> 0
A28: =IF(EQUAL(Timesheet!RC, ""), "", Timesheet!RC) -> 8004 | B28: =IF(EQUAL(Timesheet!RC, ""), "", Timesheet!RC) -> SEMINARS & TRAINING | C28: =IF(EQUAL(Timesheet!RC, ""), "", Timesheet!RC) -> Admin | D28: 0 | E28: 0 | F28: 0 | G28: 0 | H28: 0 | I28: 0 | J28: 0 | K28: 0 | L28: =SUM(RC[-8]:RC[-1]) -> 0
A29: =IF(EQUAL(Timesheet!RC, ""), "", Timesheet!RC) -> 8005 | B29: =IF(EQUAL(Timesheet!RC, ""), "", Timesheet!RC) -> PERSONAL (VACATION/AT) | C29: =IF(EQUAL(Timesheet!RC, ""), "", Timesheet!RC) -> Admin | D29: 0 | E29: 0 | F29: 0 | G29: 0 | H29: 0 | I29: 0 | J29: 0 | K29: 0 | L29: =SUM(RC[-8]:RC[-1]) -> 0
A30: =IF(EQUAL(Timesheet!RC, ""), "", Timesheet!RC) -> 8006 | B30: =IF(EQUAL(Timesheet!RC, ""), "", Timesheet!RC) -> SICK | C30: =IF(EQUAL(Timesheet!RC, ""), "", Timesheet!RC) -> Admin | D30: 0 | E30: 0 | F30: 0 | G30: 0 | H30: 0 | I30: 0 | J30: 0 | K30: 0 | L30: =SUM(RC[-8]:RC[-1]) -> 0
A31: =IF(EQUAL(Timesheet!RC, ""), "", Timesheet!RC) -> 8008 | B31: =IF(EQUAL(Timesheet!RC, ""), "", Timesheet!RC) -> RESEARCH | C31: =IF(EQUAL(Timesheet!RC, ""), "", Timesheet!RC) -> Non-Audit | D31: 0 | E31: 0 | F31: 0 | G31: 0 | H31: 0 | I31: 0 | J31: 0 | K31: 0 | L31: =SUM(RC[-8]:RC[-1]) -> 0
A32: =IF(EQUAL(Timesheet!RC, ""), "", Timesheet!RC) ->  | B32: =IF(EQUAL(Timesheet!RC, ""), "", Timesheet!RC) ->  | C32: =IF(EQUAL(Timesheet!RC, ""), "", Timesheet!RC) ->  | D32: 0 | E32: 0 | F32: 0 | G32: 0 | H32: 0 | I32: 0 | J32: 0 | K32: 0 | L32: =SUM(RC[-8]:RC[-1]) -> 0
A33: =IF(EQUAL(Timesheet!RC, ""), "", Timesheet!RC) ->  | B33: =IF(EQUAL(Timesheet!RC, ""), "", Timesheet!RC) ->  | C33: =IF(EQUAL(Timesheet!RC, ""), "", Timesheet!RC) ->  | D33: 0 | E33: 0 | F33: 0 | G33: 0 | H33: 0 | I33: 0 | J33: 0 | K33: 0 | L33: =SUM(RC[-8]:RC[-1]) -> 0
A34: =IF(EQUAL(Timesheet!RC, ""), "", Timesheet!RC) ->  | B34: =IF(EQUAL(Timesheet!RC, ""), "", Timesheet!RC) ->  | C34: =IF(EQUAL(Timesheet!RC, ""), "", Timesheet!RC) ->  | D34: 0 | E34: 0 | F34: 0 | G34: 0 | H34: 0 | I34: 0 | J34: 0 | K34: 0 | L34: =SUM(RC[-8]:RC[-1]) -> 0
A35: =IF(EQUAL(Timesheet!RC, ""), "", Timesheet!RC) ->  | B35: =IF(EQUAL(Timesheet!RC, ""), "", Timesheet!RC) ->  | C35: =IF(EQUAL(Timesheet!RC, ""), "", Timesheet!RC) ->  | D35: 0 | E35: 0 | F35: 0 | G35: 0 | H35: 0 | I35: 0 | J35: 0 | K35: 0 | L35: =SUM(RC[-8]:RC[-1]) -> 0
A36: =IF(EQUAL(Timesheet!RC, ""), "", Timesheet!RC) ->  | B36: =IF(EQUAL(Timesheet!RC, ""), "", Timesheet!RC) ->  | C36: =IF(EQUAL(Timesheet!RC, ""), "", Timesheet!RC) ->  | D36: 0 | E36: 0 | F36: 0 | G36: 0 | H36: 0 | I36: 0 | J36: 0 | K36: 0 | L36: =SUM(RC[-8]:RC[-1]) -> 0
A37: =IF(EQUAL(Timesheet!RC, ""), "", Timesheet!RC) ->  | B37: =IF(EQUAL(Timesheet!RC, ""), "", Timesheet!RC) ->  | C37: =IF(EQUAL(Timesheet!RC, ""), "", Timesheet!RC) ->  | D37: 0 | E37: 0 | F37: 0 | G37: 0 | H37: 0 | I37: 0 | J37: 0 | K37: 0 | L37: =SUM(RC[-8]:RC[-1]) -> 0
A38: =IF(EQUAL(Timesheet!RC, ""), "", Timesheet!RC) ->  | B38: =IF(EQUAL(Timesheet!RC, ""), "", Timesheet!RC) ->  | C38: =IF(EQUAL(Timesheet!RC, ""), "", Timesheet!RC) ->  | D38: 0 | E38: 0 | F38: 0 | G38: 0 | H38: 0 | I38: 0 | J38: 0 | K38: 0 | L38: =SUM(RC[-8]:RC[-1]) -> 0
A39: =IF(EQUAL(Timesheet!RC, ""), "", Timesheet!RC) ->  | B39: =IF(EQUAL(Timesheet!RC, ""), "", Timesheet!RC) ->  | C39: =IF(EQUAL(Timesheet!RC, ""), "", Timesheet!RC) ->  | D39: 0 | E39: 0 | F39: 0 | G39: 0 | H39: 0 | I39: 0 | J39: 0 | K39: 0 | L39: =SUM(RC[-8]:RC[-1]) -> 0
A40: =IF(EQUAL(Timesheet!RC, ""), "", Timesheet!RC) ->  | B40: =IF(EQUAL(Timesheet!RC, ""), "", Timesheet!RC) ->  | C40: =IF(EQUAL(Timesheet!RC, ""), "", Timesheet!RC) ->  | D40: 0 | E40: 0 | F40: 0 | G40: 0 | H40: 0 | I40: 0 | J40: 0 | K40: 0 | L40: =SUM(RC[-8]:RC[-1]) -> 0
A41: =IF(EQUAL(Timesheet!RC, ""), "", Timesheet!RC) ->  | B41: =IF(EQUAL(Timesheet!RC, ""), "", Timesheet!RC) ->  | C41: =IF(EQUAL(Timesheet!RC, ""), "", Timesheet!RC) ->  | D41: 0 | E41: 0 | F41: 0 | G41: 0 | H41: 0 | I41: 0 | J41: 0 | K41: 0 | L41: =SUM(RC[-8]:RC[-1]) -> 0
A42: =IF(EQUAL(Timesheet!RC, ""), "", Timesheet!RC) ->  | B42: =IF(EQUAL(Timesheet!RC, ""), "", Timesheet!RC) ->  | C42: =IF(EQUAL(Timesheet!RC, ""), "", Timesheet!RC) ->  | D42: 0 | E42: 0 | F42: 0 | G42: 0 | H42: 0 | I42: 0 | J42: 0 | K42: 0 | L42: =SUM(RC[-8]:RC[-1]) -> 0
A43: =IF(EQUAL(Timesheet!RC, ""), "", Timesheet!RC) ->  | B43: =IF(EQUAL(Timesheet!RC, ""), "", Timesheet!RC) ->  | C43: =IF(EQUAL(Timesheet!RC, ""), "", Timesheet!RC) ->  | D43: 0 | E43: 0 | F43: 0 | G43: 0 | H43: 0 | I43: 0 | J43: 0 | K43: 0 | L43: =SUM(RC[-8]:RC[-1]) -> 0
A44: =IF(EQUAL(Timesheet!RC, ""), "", Timesheet!RC) ->  | B44: =IF(EQUAL(Timesheet!RC, ""), "", Timesheet!RC) ->  | C44: =IF(EQUAL(Timesheet!RC, ""), "", Timesheet!RC) ->  | D44: 0 | E44: 0 | F44: 0 | G44: 0 | H44: 0 | I44: 0 | J44: 0 | K44: 0 | L44: =SUM(RC[-8]:RC[-1]) -> 0
A45: 9029 | B45: 'GIDEON PATT SPECIAL REQUEST - BONDS | C45: 'Mgmnt | D45: 0 | E45: 0 | F45: 0 | G45: 0 | H45: 0 | I45: 0 | J45: 0 | K45: 0 | L45: =SUM(RC[-8]:RC[-1]) -> 0
A46: =Timesheet!RC ->  | B46: =Timesheet!RC ->  | C46: =Timesheet!RC ->  | D46: 0 | E46: 0 | F46: 0 | G46: 0 | H46: 0 | I46: 0 | J46: 0 | K46: 0 | L46: =SUM(RC[-8]:RC[-1]) -> 0
A47: =Timesheet!RC ->  | B47: =Timesheet!RC ->  | C47: =Timesheet!RC ->  | D47: 0 | E47: 0 | F47: 0 | G47: 0 | H47: 0 | I47: 0 | J47: 0 | K47: 0 | L47: =SUM(RC[-8]:RC[-1]) -> 0
A48: =Timesheet!RC ->  | B48: =Timesheet!RC ->  | C48: =Timesheet!RC ->  | D48: 0 | E48: 0 | F48: 0 | G48: 0 | H48: 0 | I48: 0 | J48: 0 | K48: 0 | L48: =SUM(RC[-8]:RC[-1]) -> 0
A49: =Timesheet!RC ->  | B49: =Timesheet!RC ->  | C49: =Timesheet!RC ->  | D49: 0 | E49: 0 | F49: 0 | G49: 0 | H49: 0 | I49: 0 | J49: 0 | K49: 0 | L49: =SUM(RC[-8]:RC[-1]) -> 0
A50: =Timesheet!RC ->  | B50: =Timesheet!RC ->  | C50: =Timesheet!RC ->  | D50: 0 | E50: 0 | F50: 0 | G50: 0 | H50: 0 | I50: 0 | J50: 0 | K50: 0 | L50: =SUM(RC[-8]:RC[-1]) -> 0
A51: =Timesheet!RC ->  | B51: =Timesheet!RC ->  | C51: =Timesheet!RC ->  | D51: 0 | E51: 0 | F51: 0 | G51: 0 | H51: 0 | I51: 0 | J51: 0 | K51: 0 | L51: =SUM(RC[-8]:RC[-1]) -> 0
A52: =Timesheet!RC ->  | B52: =Timesheet!RC ->  | C52: =Timesheet!RC ->  | D52: 0 | E52: 0 | F52: 0 | G52: 0 | H52: 0 | I52: 0 | J52: 0 | K52: 0 | L52: =SUM(RC[-8]:RC[-1]) -> 0
A53: =Timesheet!RC ->  | B53: =Timesheet!RC ->  | C53: =Timesheet!RC ->  | D53: 0 | E53: 0 | F53: 0 | G53: 0 | H53: 0 | I53: 0 | J53: 0 | K53: 0 | L53: =SUM(RC[-8]:RC[-1]) -> 0
A54: 'TOTAL | D54: =SUM(R[-51]C:R[-1]C) -> 0 | E54: =SUM(R[-51]C:R[-1]C) -> 0 | F54: =SUM(R[-51]C:R[-1]C) -> 0 | G54: =SUM(R[-51]C:R[-1]C) -> 0 | H54: =SUM(R[-51]C:R[-1]C) -> 0 | I54: =SUM(R[-51]C:R[-1]C) -> 0 | J54: =SUM(R[-51]C:R[-1]C) -> 0 | K54: =SUM(R[-51]C:R[-1]C) -> 0 | L54: =SUM(R[-51]C:R[-1]C) -> 0

Sheet: June 2000
A1: 'CODE | B1: 'AUDIT DESCRIPTION | C1: 'Category | D1: 'Week Ending
D2: =7+May2000!RC[+6] -> 36680 | E2: 'Susan | F2: =RC[-2]+7 -> 36687 | G2: =RC[-2] -> Susan | H2: =RC[-2]+7 -> 36694 | I2: =RC[-2] -> Susan | J2: =RC[-2]+7 -> 36701 | K2: =RC[-2] -> Susan | L2: =RC[-2]+7 -> 36708 | M2: =RC[-2] -> Susan | N2: 'Total
A3: =IF(EQUAL(Timesheet!RC, ""), "", Timesheet!RC) -> 1001 | B3: =IF(EQUAL(Timesheet!RC, ""), "", Timesheet!RC) -> PURCHASING | C3: =IF(EQUAL(Timesheet!RC, ""), "", Timesheet!RC) -> Mgmnt | D3: 0 | E3: 0 | F3: 0 | G3: 0 | H3: 0 | I3: 0 | J3: 0 | K3: 0 | L3: 0 | M3: 0 | N3: =SUM(RC[-10]:RC[-1]) -> 0
A4: =IF(EQUAL(Timesheet!RC, ""), "", Timesheet!RC) -> 1002 | B4: =IF(EQUAL(Timesheet!RC, ""), "", Timesheet!RC) -> HUMAN RESOURCE | C4: =IF(EQUAL(Timesheet!RC, ""), "", Timesheet!RC) -> Plan | D4: 0 | E4: 0 | F4: 0 | G4: 0 | H4: 0 | I4: 0 | J4: 0 | K4: 0 | L4: 0 | M4: 0 | N4: =SUM(RC[-10]:RC[-1]) -> 0
A5: =IF(EQUAL(Timesheet!RC, ""), "", Timesheet!RC) -> 1005 | B5: =IF(EQUAL(Timesheet!RC, ""), "", Timesheet!RC) -> CORPORATE AUDIT RISK ANALYSIS | C5: =IF(EQUAL(Timesheet!RC, ""), "", Timesheet!RC) -> Plan | D5: 0 | E5: 0 | F5: 0 | G5: 0 | H5: 0 | I5: 0 | J5: 0 | K5: 0 | L5: 0 | M5: 0 | N5: =SUM(RC[-10]:RC[-1]) -> 0
A6: =IF(EQUAL(Timesheet!RC, ""), "", Timesheet!RC) -> 1007 | B6: =IF(EQUAL(Timesheet!RC, ""), "", Timesheet!RC) -> OFFICER'S TRAVEL & EXPENSE | C6: =IF(EQUAL(Timesheet!RC, ""), "", Timesheet!RC) -> Plan | D6: 0 | E6: 0 | F6: 0 | G6: 0 | H6: 0 | I6: 0 | J6: 0 | K6: 0 | L6: 0 | M6: 0 | N6: =SUM(RC[-10]:RC[-1]) -> 0
A7: =IF(EQUAL(Timesheet!RC, ""), "", Timesheet!RC) -> 1008 | B7: =IF(EQUAL(Timesheet!RC, ""), "", Timesheet!RC) -> RECORD RETENTION | C7: =IF(EQUAL(Timesheet!RC, ""), "", Timesheet!RC) -> Mgmnt | D7: 0 | E7: 0 | F7: 0 | G7: 0 | H7: 0 | I7: 0 | J7: 0 | K7: 0 | L7: 0 | M7: 0 | N7: =SUM(RC[-10]:RC[-1]) -> 0
A8: =IF(EQUAL(Timesheet!RC, ""), "", Timesheet!RC) -> 1009 | B8: =IF(EQUAL(Timesheet!RC, ""), "", Timesheet!RC) -> NASD AUDITS | C8: =IF(EQUAL(Timesheet!RC, ""), "", Timesheet!RC) -> Plan | D8: 0 | E8: 0 | F8: 0 | G8: 0 | H8: 0 | I8: 0 | J8: 0 | K8: 0 | L8: 0 | M8: 0 | N8: =SUM(RC[-10]:RC[-1]) -> 0
A9: =IF(EQUAL(Timesheet!RC, ""), "", Timesheet!RC) -> 1011 | B9: =IF(EQUAL(Timesheet!RC, ""), "", Timesheet!RC) -> SURPRISE CASH AUDIT - NEW YORK | C9: =IF(EQUAL(Timesheet!RC, ""), "", Timesheet!RC) -> Plan | D9: 0 | E9: 0 | F9: 0 | G9: 0 | H9: 0 | I9: 0 | J9: 0 | K9: 0 | L9: 0 | M9: 0 | N9: =SUM(RC[-10]:RC[-1]) -> 0
A10: =IF(EQUAL(Timesheet!RC, ""), "", Timesheet!RC) -> 1012 | B10: =IF(EQUAL(Timesheet!RC, ""), "", Timesheet!RC) -> INTERNATIONAL AUDIT - IBI | C10: =IF(EQUAL(Timesheet!RC, ""), "", Timesheet!RC) -> Plan | D10: 0 | E10: 0 | F10: 0 | G10: 0 | H10: 0 | I10: 0 | J10: 0 | K10: 0 | L10: 0 | M10: 0 | N10: =SUM(RC[-10]:RC[-1]) -> 0
A11: =IF(EQUAL(Timesheet!RC, ""), "", Timesheet!RC) -> 1013 | B11: =IF(EQUAL(Timesheet!RC, ""), "", Timesheet!RC) -> INTERNATIONAL AUDIT - CISL | C11: =IF(EQUAL(Timesheet!RC, ""), "", Timesheet!RC) -> Plan | D11: 0 | E11: 0 | F11: 0 | G11: 0 | H11: 0 | I11: 0 | J11: 0 | K11: 0 | L11: 0 | M11: 0 | N11: =SUM(RC[-10]:RC[-1]) -> 0
A12: =IF(EQUAL(Timesheet!RC, ""), "", Timesheet!RC) -> 1014 | B12: =IF(EQUAL(Timesheet!RC, ""), "", Timesheet!RC) -> MARKETING AND COMMUNICATION | C12: =IF(EQUAL(Timesheet!RC, ""), "", Timesheet!RC) -> Mgmnt | D12: 0 | E12: 0 | F12: 0 | G12: 0 | H12: 0 | I12: 0 | J12: 0 | K12: 0 | L12: 0 | M12: 0 | N12: =SUM(RC[-10]:RC[-1]) -> 0
A13: =IF(EQUAL(Timesheet!RC, ""), "", Timesheet!RC) -> 3001 | B13: =IF(EQUAL(Timesheet!RC, ""), "", Timesheet!RC) -> FIELD OFFICE CONTROL REVIEWS | C13: =IF(EQUAL(Timesheet!RC, ""), "", Timesheet!RC) -> Field | D13: 0 | E13: 0 | F13: 0 | G13: 0 | H13: 0 | I13: 0 | J13: 0 | K13: 0 | L13: 0 | M13: 0 | N13: =SUM(RC[-10]:RC[-1]) -> 0
A14: =IF(EQUAL(Timesheet!RC, ""), "", Timesheet!RC) -> 3002 | B14: =IF(EQUAL(Timesheet!RC, ""), "", Timesheet!RC) -> FIELD OFFICE ACCOUNTABILITY ANALYSIS | C14: =IF(EQUAL(Timesheet!RC, ""), "", Timesheet!RC) -> Field | D14: 0 | E14: 0 | F14: 0 | G14: 0 | H14: 0 | I14: 0 | J14: 0 | K14: 0 | L14: 0 | M14: 0 | N14: =SUM(RC[-10]:RC[-1]) -> 0
A15: =IF(EQUAL(Timesheet!RC, ""), "", Timesheet!RC) -> 3010 | B15: =IF(EQUAL(Timesheet!RC, ""), "", Timesheet!RC) -> FIELD OFFICE BANK RECONCILATIONS | C15: =IF(EQUAL(Timesheet!RC, ""), "", Timesheet!RC) -> Field | D15: 0 | E15: 0 | F15: 0 | G15: 0 | H15: 0 | I15: 0 | J15: 0 | K15: 0 | L15: 0 | M15: 0 | N15: =SUM(RC[-10]:RC[-1]) -> 0
A16: =IF(EQUAL(Timesheet!RC, ""), "", Timesheet!RC) -> 3020 | B16: =IF(EQUAL(Timesheet!RC, ""), "", Timesheet!RC) -> FIELD AUDIT PROGRAM DEVELOPMENT | C16: =IF(EQUAL(Timesheet!RC, ""), "", Timesheet!RC) -> Field | D16: 0 | E16: 0 | F16: 0 | G16: 0 | H16: 0 | I16: 0 | J16: 0 | K16: 0 | L16: 0 | M16: 0 | N16: =SUM(RC[-10]:RC[-1]) -> 0
A17: =IF(EQUAL(Timesheet!RC, ""), "", Timesheet!RC) -> 3030 | B17: =IF(EQUAL(Timesheet!RC, ""), "", Timesheet!RC) -> OPEN COMMITMENT ANALYSIS | C17: =IF(EQUAL(Timesheet!RC, ""), "", Timesheet!RC) -> Field | D17: 0 | E17: 0 | F17: 0 | G17: 0 | H17: 0 | I17: 0 | J17: 0 | K17: 0 | L17: 0 | M17: 0 | N17: =SUM(RC[-10]:RC[-1]) -> 0
A18: =IF(EQUAL(Timesheet!RC, ""), "", Timesheet!RC) -> 3040 | B18: =IF(EQUAL(Timesheet!RC, ""), "", Timesheet!RC) -> FIELD AUDIT RISK ASSESMENT | C18: =IF(EQUAL(Timesheet!RC, ""), "", Timesheet!RC) -> Field | D18: 0 | E18: 0 | F18: 0 | G18: 0 | H18: 0 | I18: 0 | J18: 0 | K18: 0 | L18: 0 | M18: 0 | N18: =SUM(RC[-10]:RC[-1]) -> 0
A19: =IF(EQUAL(Timesheet!RC, ""), "", Timesheet!RC) -> 3050 | B19: =IF(EQUAL(Timesheet!RC, ""), "", Timesheet!RC) -> NEW YORK FIELD AUDIT REVIEWS | C19: =IF(EQUAL(Timesheet!RC, ""), "", Timesheet!RC) -> Field | D19: 0 | E19: 0 | F19: 0 | G19: 0 | H19: 0 | I19: 0 | J19: 0 | K19: 0 | L19: 0 | M19: 0 | N19: =SUM(RC[-10]:RC[-1]) -> 0
A20: =IF(EQUAL(Timesheet!RC, ""), "", Timesheet!RC) -> 4001 | B20: =IF(EQUAL(Timesheet!RC, ""), "", Timesheet!RC) -> GRANT THORNTON | C20: =IF(EQUAL(Timesheet!RC, ""), "", Timesheet!RC) -> Mgmnt | D20: 0 | E20: 0 | F20: 0 | G20: 0 | H20: 0 | I20: 0 | J20: 0 | K20: 0 | L20: 0 | M20: 0 | N20: =SUM(RC[-10]:RC[-1]) -> 0
A21: =IF(EQUAL(Timesheet!RC, ""), "", Timesheet!RC) -> 5001 | B21: =IF(EQUAL(Timesheet!RC, ""), "", Timesheet!RC) -> MISCELLANEOUS AUDIT REQUESTS | C21: =IF(EQUAL(Timesheet!RC, ""), "", Timesheet!RC) -> Mgmnt | D21: 0 | E21: 0 | F21: 0 | G21: 0 | H21: 0 | I21: 0 | J21: 0 | K21: 0 | L21: 0 | M21: 0 | N21: =SUM(RC[-10]:RC[-1]) -> 0
A22: =IF(EQUAL(Timesheet!RC, ""), "", Timesheet!RC) -> 5009 | B22: =IF(EQUAL(Timesheet!RC, ""), "", Timesheet!RC) -> FORMS INVENTORY | C22: =IF(EQUAL(Timesheet!RC, ""), "", Timesheet!RC) -> Plan | D22: 0 | E22: 0 | F22: 0 | G22: 0 | H22: 0 | I22: 0 | J22: 0 | K22: 0 | L22: 0 | M22: 0 | N22: =SUM(RC[-10]:RC[-1]) -> 0
A23: =IF(EQUAL(Timesheet!RC, ""), "", Timesheet!RC) -> 5010 | B23: =IF(EQUAL(Timesheet!RC, ""), "", Timesheet!RC) -> SURPRISE CHECK VALIDATION | C23: =IF(EQUAL(Timesheet!RC, ""), "", Timesheet!RC) -> Plan | D23: 0 | E23: 0 | F23: 0 | G23: 0 | H23: 0 | I23: 0 | J23: 0 | K23: 0 | L23: 0 | M23: 0 | N23: =SUM(RC[-10]:RC[-1]) -> 0
A24: =IF(EQUAL(Timesheet!RC, ""), "", Timesheet!RC) -> 7000 | B24: =IF(EQUAL(Timesheet!RC, ""), "", Timesheet!RC) -> NON-PROJECT RELATED (MEETINGS) | C24: =IF(EQUAL(Timesheet!RC, ""), "", Timesheet!RC) -> Non-Audit | D24: 0 | E24: 0 | F24: 0 | G24: 0 | H24: 0 | I24: 0 | J24: 0 | K24: 0 | L24: 0 | M24: 0 | N24: =SUM(RC[-10]:RC[-1]) -> 0
A25: =IF(EQUAL(Timesheet!RC, ""), "", Timesheet!RC) -> 7003 | B25: =IF(EQUAL(Timesheet!RC, ""), "", Timesheet!RC) -> AUDIT COMMITTEE | C25: =IF(EQUAL(Timesheet!RC, ""), "", Timesheet!RC) -> Non-Audit | D25: 0 | E25: 0 | F25: 0 | G25: 0 | H25: 0 | I25: 0 | J25: 0 | K25: 0 | L25: 0 | M25: 0 | N25: =SUM(RC[-10]:RC[-1]) -> 0
A26: =IF(EQUAL(Timesheet!RC, ""), "", Timesheet!RC) -> 8001 | B26: =IF(EQUAL(Timesheet!RC, ""), "", Timesheet!RC) -> ADMINISTRATIVE - GENERAL | C26: =IF(EQUAL(Timesheet!RC, ""), "", Timesheet!RC) -> Admin | D26: 0 | E26: 0 | F26: 0 | G26: 0 | H26: 0 | I26: 0 | J26: 0 | K26: 0 | L26: 0 | M26: 0 | N26: =SUM(RC[-10]:RC[-1]) -> 0
A27: =IF(EQUAL(Timesheet!RC, ""), "", Timesheet!RC) -> 8002 | B27: =IF(EQUAL(Timesheet!RC, ""), "", Timesheet!RC) -> HOLIDAYS | C27: =IF(EQUAL(Timesheet!RC, ""), "", Timesheet!RC) -> Admin | D27: 0 | E27: 0 | F27: 0 | G27: 0 | H27: 0 | I27: 0 | J27: 0 | K27: 0 | L27: 0 | M27: 0 | N27: =SUM(RC[-10]:RC[-1]) -> 0
A28: =IF(EQUAL(Timesheet!RC, ""), "", Timesheet!RC) -> 8004 | B28: =IF(EQUAL(Timesheet!RC, ""), "", Timesheet!RC) -> SEMINARS & TRAINING | C28: =IF(EQUAL(Timesheet!RC, ""), "", Timesheet!RC) -> Admin | D28: 0 | E28: 0 | F28: 0 | G28: 0 | H28: 0 | I28: 0 | J28: 0 | K28: 0 | L28: 0 | M28: 0 | N28: =SUM(RC[-10]:RC[-1]) -> 0
A29: =IF(EQUAL(Timesheet!RC, ""), "", Timesheet!RC) -> 8005 | B29: =IF(EQUAL(Timesheet!RC, ""), "", Timesheet!RC) -> PERSONAL (VACATION/AT) | C29: =IF(EQUAL(Timesheet!RC, ""), "", Timesheet!RC) -> Admin | D29: 0 | E29: 0 | F29: 0 | G29: 0 | H29: 0 | I29: 0 | J29: 0 | K29: 0 | L29: 0 | M29: 0 | N29: =SUM(RC[-10]:RC[-1]) -> 0
A30: =IF(EQUAL(Timesheet!RC, ""), "", Timesheet!RC) -> 8006 | B30: =IF(EQUAL(Timesheet!RC, ""), "", Timesheet!RC) -> SICK | C30: =IF(EQUAL(Timesheet!RC, ""), "", Timesheet!RC) -> Admin | D30: 0 | E30: 0 | F30: 0 | G30: 0 | H30: 0 | I30: 0 | J30: 0 | K30: 0 | L30: 0 | M30: 0 | N30: =SUM(RC[-10]:RC[-1]) -> 0
A31: =IF(EQUAL(Timesheet!RC, ""), "", Timesheet!RC) -> 8008 | B31: =IF(EQUAL(Timesheet!RC, ""), "", Timesheet!RC) -> RESEARCH | C31: =IF(EQUAL(Timesheet!RC, ""), "", Timesheet!RC) -> Non-Audit | D31: 0 | E31: 0 | F31: 0 | G31: 0 | H31: 0 | I31: 0 | J31: 0 | K31: 0 | L31: 0 | M31: 0 | N31: =SUM(RC[-10]:RC[-1]) -> 0
A32: =IF(EQUAL(Timesheet!RC, ""), "", Timesheet!RC) ->  | B32: =IF(EQUAL(Timesheet!RC, ""), "", Timesheet!RC) ->  | C32: =IF(EQUAL(Timesheet!RC, ""), "", Timesheet!RC) ->  | D32: 0 | E32: 0 | F32: 0 | G32: 0 | H32: 0 | I32: 0 | J32: 0 | K32: 0 | L32: 0 | M32: 0 | N32: =SUM(RC[-10]:RC[-1]) -> 0
A33: =IF(EQUAL(Timesheet!RC, ""), "", Timesheet!RC) ->  | B33: =IF(EQUAL(Timesheet!RC, ""), "", Timesheet!RC) ->  | C33: =IF(EQUAL(Timesheet!RC, ""), "", Timesheet!RC) ->  | D33: 0 | E33: 0 | F33: 0 | G33: 0 | H33: 0 | I33: 0 | J33: 0 | K33: 0 | L33: 0 | M33: 0 | N33: =SUM(RC[-10]:RC[-1]) -> 0
A34: =IF(EQUAL(Timesheet!RC, ""), "", Timesheet!RC) ->  | B34: =IF(EQUAL(Timesheet!RC, ""), "", Timesheet!RC) ->  | C34: =IF(EQUAL(Timesheet!RC, ""), "", Timesheet!RC) ->  | D34: 0 | E34: 0 | F34: 0 | G34: 0 | H34: 0 | I34: 0 | J34: 0 | K34: 0 | L34: 0 | M34: 0 | N34: =SUM(RC[-10]:RC[-1]) -> 0
A35: =IF(EQUAL(Timesheet!RC, ""), "", Timesheet!RC) ->  | B35: =IF(EQUAL(Timesheet!RC, ""), "", Timesheet!RC) ->  | C35: =IF(EQUAL(Timesheet!RC, ""), "", Timesheet!RC) ->  | D35: 0 | E35: 0 | F35: 0 | G35: 0 | H35: 0 | I35: 0 | J35: 0 | K35: 0 | L35: 0 | M35: 0 | N35: =SUM(RC[-10]:RC[-1]) -> 0
A36: =IF(EQUAL(Timesheet!RC, ""), "", Timesheet!RC) ->  | B36: =IF(EQUAL(Timesheet!RC, ""), "", Timesheet!RC) ->  | C36: =IF(EQUAL(Timesheet!RC, ""), "", Timesheet!RC) ->  | D36: 0 | E36: 0 | F36: 0 | G36: 0 | H36: 0 | I36: 0 | J36: 0 | K36: 0 | L36: 0 | M36: 0 | N36: =SUM(RC[-10]:RC[-1]) -> 0
A37: =IF(EQUAL(Timesheet!RC, ""), "", Timesheet!RC) ->  | B37: =IF(EQUAL(Timesheet!RC, ""), "", Timesheet!RC) ->  | C37: =IF(EQUAL(Timesheet!RC, ""), "", Timesheet!RC) ->  | D37: 0 | E37: 0 | F37: 0 | G37: 0 | H37: 0 | I37: 0 | J37: 0 | K37: 0 | L37: 0 | M37: 0 | N37: =SUM(RC[-10]:RC[-1]) -> 0
A38: =IF(EQUAL(Timesheet!RC, ""), "", Timesheet!RC) ->  | B38: =IF(EQUAL(Timesheet!RC, ""), "", Timesheet!RC) ->  | C38: =IF(EQUAL(Timesheet!RC, ""), "", Timesheet!RC) ->  | D38: 0 | E38: 0 | F38: 0 | G38: 0 | H38: 0 | I38: 0 | J38: 0 | K38: 0 | L38: 0 | M38: 0 | N38: =SUM(RC[-10]:RC[-1]) -> 0
A39: =IF(EQUAL(Timesheet!RC, ""), "", Timesheet!RC) ->  | B39: =IF(EQUAL(Timesheet!RC, ""), "", Timesheet!RC) ->  | C39: =IF(EQUAL(Timesheet!RC, ""), "", Timesheet!RC) ->  | D39: 0 | E39: 0 | F39: 0 | G39: 0 | H39: 0 | I39: 0 | J39: 0 | K39: 0 | L39: 0 | M39: 0 | N39: =SUM(RC[-10]:RC[-1]) -> 0
A40: =IF(EQUAL(Timesheet!RC, ""), "", Timesheet!RC) ->  | B40: =IF(EQUAL(Timesheet!RC, ""), "", Timesheet!RC) ->  | C40: =IF(EQUAL(Timesheet!RC, ""), "", Timesheet!RC) ->  | D40: 0 | E40: 0 | F40: 0 | G40: 0 | H40: 0 | I40: 0 | J40: 0 | K40: 0 | L40: 0 | M40: 0 | N40: =SUM(RC[-10]:RC[-1]) -> 0
A41: =IF(EQUAL(Timesheet!RC, ""), "", Timesheet!RC) ->  | B41: =IF(EQUAL(Timesheet!RC, ""), "", Timesheet!RC) ->  | C41: =IF(EQUAL(Timesheet!RC, ""), "", Timesheet!RC) ->  | D41: 0 | E41: 0 | F41: 0 | G41: 0 | H41: 0 | I41: 0 | J41: 0 | K41: 0 | L41: 0 | M41: 0 | N41: =SUM(RC[-10]:RC[-1]) -> 0
A42: =IF(EQUAL(Timesheet!RC, ""), "", Timesheet!RC) ->  | B42: =IF(EQUAL(Timesheet!RC, ""), "", Timesheet!RC) ->  | C42: =IF(EQUAL(Timesheet!RC, ""), "", Timesheet!RC) ->  | D42: 0 | E42: 0 | F42: 0 | G42: 0 | H42: 0 | I42: 0 | J42: 0 | K42: 0 | L42: 0 | M42: 0 | N42: =SUM(RC[-10]:RC[-1]) -> 0
A43: =IF(EQUAL(Timesheet!RC, ""), "", Timesheet!RC) ->  | B43: =IF(EQUAL(Timesheet!RC, ""), "", Timesheet!RC) ->  | C43: =IF(EQUAL(Timesheet!RC, ""), "", Timesheet!RC) ->  | D43: 0 | E43: 0 | F43: 0 | G43: 0 | H43: 0 | I43: 0 | J43: 0 | K43: 0 | L43: 0 | M43: 0 | N43: =SUM(RC[-10]:RC[-1]) -> 0
A44: =IF(EQUAL(Timesheet!RC, ""), "", Timesheet!RC) ->  | B44: =IF(EQUAL(Timesheet!RC, ""), "", Timesheet!RC) ->  | C44: =IF(EQUAL(Timesheet!RC, ""), "", Timesheet!RC) ->  | D44: 0 | E44: 0 | F44: 0 | G44: 0 | H44: 0 | I44: 0 | J44: 0 | K44: 0 | L44: 0 | M44: 0 | N44: =SUM(RC[-10]:RC[-1]) -> 0
A45: 9029 | B45: 'GIDEON PATT SPECIAL REQUEST - BONDS | C45: 'Mgmnt | D45: 0 | E45: 0 | F45: 0 | G45: 0 | H45: 0 | I45: 0 | J45: 0 | K45: 0 | L45: 0 | M45: 0 | N45: =SUM(RC[-10]:RC[-1]) -> 0
A46: =Timesheet!RC ->  | B46: =Timesheet!RC ->  | C46: =Timesheet!RC ->  | D46: 0 | E46: 0 | F46: 0 | G46: 0 | H46: 0 | I46: 0 | J46: 0 | K46: 0 | L46: 0 | M46: 0 | N46: =SUM(RC[-10]:RC[-1]) -> 0
A47: =Timesheet!RC ->  | B47: =Timesheet!RC ->  | C47: =Timesheet!RC ->  | D47: 0 | E47: 0 | F47: 0 | G47: 0 | H47: 0 | I47: 0 | J47: 0 | K47: 0 | L47: 0 | M47: 0 | N47: =SUM(RC[-10]:RC[-1]) -> 0
A48: =Timesheet!RC ->  | B48: =Timesheet!RC ->  | C48: =Timesheet!RC ->  | D48: 0 | E48: 0 | F48: 0 | G48: 0 | H48: 0 | I48: 0 | J48: 0 | K48: 0 | L48: 0 | M48: 0 | N48: =SUM(RC[-10]:RC[-1]) -> 0
A49: =Timesheet!RC ->  | B49: =Timesheet!RC ->  | C49: =Timesheet!RC ->  | D49: 0 | E49: 0 | F49: 0 | G49: 0 | H49: 0 | I49: 0 | J49: 0 | K49: 0 | L49: 0 | M49: 0 | N49: =SUM(RC[-10]:RC[-1]) -> 0
A50: =Timesheet!RC ->  | B50: =Timesheet!RC ->  | C50: =Timesheet!RC ->  | D50: 0 | E50: 0 | F50: 0 | G50: 0 | H50: 0 | I50: 0 | J50: 0 | K50: 0 | L50: 0 | M50: 0 | N50: =SUM(RC[-10]:RC[-1]) -> 0
A51: =Timesheet!RC ->  | B51: =Timesheet!RC ->  | C51: =Timesheet!RC ->  | D51: 0 | E51: 0 | F51: 0 | G51: 0 | H51: 0 | I51: 0 | J51: 0 | K51: 0 | L51: 0 | M51: 0 | N51: =SUM(RC[-10]:RC[-1]) -> 0
A52: =Timesheet!RC ->  | B52: =Timesheet!RC ->  | C52: =Timesheet!RC ->  | D52: 0 | E52: 0 | F52: 0 | G52: 0 | H52: 0 | I52: 0 | J52: 0 | K52: 0 | L52: 0 | M52: 0 | N52: =SUM(RC[-10]:RC[-1]) -> 0
A53: =Timesheet!RC ->  | B53: =Timesheet!RC ->  | C53: =Timesheet!RC ->  | D53: 0 | E53: 0 | F53: 0 | G53: 0 | H53: 0 | I53: 0 | J53: 0 | K53: 0 | L53: 0 | M53: 0 | N53: =SUM(RC[-10]:RC[-1]) -> 0
A54: 'TOTAL | D54: =SUM(R[-51]C:R[-1]C) -> 0 | E54: =SUM(R[-51]C:R[-1]C) -> 0 | F54: =SUM(R[-51]C:R[-1]C) -> 0 | G54: =SUM(R[-51]C:R[-1]C) -> 0 | H54: =SUM(R[-51]C:R[-1]C) -> 0 | I54: =SUM(R[-51]C:R[-1]C) -> 0 | J54: =SUM(R[-51]C:R[-1]C) -> 0 | K54: =SUM(R[-51]C:R[-1]C) -> 0 | L54: =SUM(R[-51]C:R[-1]C) -> 0 | M54: =SUM(R[-51]C:R[-1]C) -> 0 | N54: =SUM(R[-51]C:R[-1]C) -> 0

Sheet: June2000
A1: 'CODE | B1: 'AUDIT DESCRIPTION | C1: 'Category | D1: 'Week Ending
D2: 36680 | E2: 'Susan | F2: 36687 | G2: 'Susan | H2: 36694 | I2: 'Susan | J2: 36701 | K2: 'Susan | L2: 36708 | M2: 'Susan | N2: 'Total
A3: =IF(EQUAL(Timesheet!RC, ""), "", Timesheet!RC) -> 1001 | B3: =IF(EQUAL(Timesheet!RC, ""), "", Timesheet!RC) -> PURCHASING | C3: =IF(EQUAL(Timesheet!RC, ""), "", Timesheet!RC) -> Mgmnt | D3: 0 | E3: 0 | F3: 0 | G3: 0 | H3: 0 | I3: 0 | J3: 0 | K3: 0 | L3: 0 | M3: 0 | N3: =SUM(RC[-10]:RC[-1]) -> 0
A4: =IF(EQUAL(Timesheet!RC, ""), "", Timesheet!RC) -> 1002 | B4: =IF(EQUAL(Timesheet!RC, ""), "", Timesheet!RC) -> HUMAN RESOURCE | C4: =IF(EQUAL(Timesheet!RC, ""), "", Timesheet!RC) -> Plan | D4: 0 | E4: 0 | F4: 0 | G4: 0 | H4: 0 | I4: 0 | J4: 0 | K4: 0 | L4: 0 | M4: 0 | N4: =SUM(RC[-10]:RC[-1]) -> 0
A5: =IF(EQUAL(Timesheet!RC, ""), "", Timesheet!RC) -> 1005 | B5: =IF(EQUAL(Timesheet!RC, ""), "", Timesheet!RC) -> CORPORATE AUDIT RISK ANALYSIS | C5: =IF(EQUAL(Timesheet!RC, ""), "", Timesheet!RC) -> Plan | D5: 0 | E5: 0 | F5: 0 | G5: 0 | H5: 0 | I5: 0 | J5: 0 | K5: 0 | L5: 0 | M5: 0 | N5: =SUM(RC[-10]:RC[-1]) -> 0
A6: =IF(EQUAL(Timesheet!RC, ""), "", Timesheet!RC) -> 1007 | B6: =IF(EQUAL(Timesheet!RC, ""), "", Timesheet!RC) -> OFFICER'S TRAVEL & EXPENSE | C6: =IF(EQUAL(Timesheet!RC, ""), "", Timesheet!RC) -> Plan | D6: 0 | E6: 0 | F6: 0 | G6: 0 | H6: 0 | I6: 0 | J6: 0 | K6: 0 | L6: 0 | M6: 0 | N6: =SUM(RC[-10]:RC[-1]) -> 0
A7: =IF(EQUAL(Timesheet!RC, ""), "", Timesheet!RC) -> 1008 | B7: =IF(EQUAL(Timesheet!RC, ""), "", Timesheet!RC) -> RECORD RETENTION | C7: =IF(EQUAL(Timesheet!RC, ""), "", Timesheet!RC) -> Mgmnt | D7: 0 | E7: 0 | F7: 0 | G7: 0 | H7: 0 | I7: 0 | J7: 0 | K7: 0 | L7: 0 | M7: 0 | N7: =SUM(RC[-10]:RC[-1]) -> 0
A8: =IF(EQUAL(Timesheet!RC, ""), "", Timesheet!RC) -> 1009 | B8: =IF(EQUAL(Timesheet!RC, ""), "", Timesheet!RC) -> NASD AUDITS | C8: =IF(EQUAL(Timesheet!RC, ""), "", Timesheet!RC) -> Plan | D8: 0 | E8: 0 | F8: 0 | G8: 0 | H8: 0 | I8: 0 | J8: 0 | K8: 0 | L8: 0 | M8: 0 | N8: =SUM(RC[-10]:RC[-1]) -> 0
A9: =IF(EQUAL(Timesheet!RC, ""), "", Timesheet!RC) -> 1011 | B9: =IF(EQUAL(Timesheet!RC, ""), "", Timesheet!RC) -> SURPRISE CASH AUDIT - NEW YORK | C9: =IF(EQUAL(Timesheet!RC, ""), "", Timesheet!RC) -> Plan | D9: 0 | E9: 0 | F9: 0 | G9: 0 | H9: 0 | I9: 0 | J9: 0 | K9: 0 | L9: 0 | M9: 0 | N9: =SUM(RC[-10]:RC[-1]) -> 0
A10: =IF(EQUAL(Timesheet!RC, ""), "", Timesheet!RC) -> 1012 | B10: =IF(EQUAL(Timesheet!RC, ""), "", Timesheet!RC) -> INTERNATIONAL AUDIT - IBI | C10: =IF(EQUAL(Timesheet!RC, ""), "", Timesheet!RC) -> Plan | D10: 0 | E10: 0 | F10: 0 | G10: 0 | H10: 0 | I10: 0 | J10: 0 | K10: 0 | L10: 0 | M10: 0 | N10: =SUM(RC[-10]:RC[-1]) -> 0
A11: =IF(EQUAL(Timesheet!RC, ""), "", Timesheet!RC) -> 1013 | B11: =IF(EQUAL(Timesheet!RC, ""), "", Timesheet!RC) -> INTERNATIONAL AUDIT - CISL | C11: =IF(EQUAL(Timesheet!RC, ""), "", Timesheet!RC) -> Plan | D11: 0 | E11: 0 | F11: 0 | G11: 0 | H11: 0 | I11: 0 | J11: 0 | K11: 0 | L11: 0 | M11: 0 | N11: =SUM(RC[-10]:RC[-1]) -> 0
A12: =IF(EQUAL(Timesheet!RC, ""), "", Timesheet!RC) -> 1014 | B12: =IF(EQUAL(Timesheet!RC, ""), "", Timesheet!RC) -> MARKETING AND COMMUNICATION | C12: =IF(EQUAL(Timesheet!RC, ""), "", Timesheet!RC) -> Mgmnt | D12: 0 | E12: 0 | F12: 0 | G12: 0 | H12: 0 | I12: 0 | J12: 0 | K12: 0 | L12: 0 | M12: 0 | N12: =SUM(RC[-10]:RC[-1]) -> 0
A13: =IF(EQUAL(Timesheet!RC, ""), "", Timesheet!RC) -> 3001 | B13: =IF(EQUAL(Timesheet!RC, ""), "", Timesheet!RC) -> FIELD OFFICE CONTROL REVIEWS | C13: =IF(EQUAL(Timesheet!RC, ""), "", Timesheet!RC) -> Field | D13: 0 | E13: 0 | F13: 0 | G13: 0 | H13: 0 | I13: 0 | J13: 0 | K13: 0 | L13: 0 | M13: 0 | N13: =SUM(RC[-10]:RC[-1]) -> 0
A14: =IF(EQUAL(Timesheet!RC, ""), "", Timesheet!RC) -> 3002 | B14: =IF(EQUAL(Timesheet!RC, ""), "", Timesheet!RC) -> FIELD OFFICE ACCOUNTABILITY ANALYSIS | C14: =IF(EQUAL(Timesheet!RC, ""), "", Timesheet!RC) -> Field | D14: 0 | E14: 0 | F14: 0 | G14: 0 | H14: 0 | I14: 0 | J14: 0 | K14: 0 | L14: 0 | M14: 0 | N14: =SUM(RC[-10]:RC[-1]) -> 0
A15: =IF(EQUAL(Timesheet!RC, ""), "", Timesheet!RC) -> 3010 | B15: =IF(EQUAL(Timesheet!RC, ""), "", Timesheet!RC) -> FIELD OFFICE BANK RECONCILATIONS | C15: =IF(EQUAL(Timesheet!RC, ""), "", Timesheet!RC) -> Field | D15: 0 | E15: 0 | F15: 0 | G15: 0 | H15: 0 | I15: 0 | J15: 0 | K15: 0 | L15: 0 | M15: 0 | N15: =SUM(RC[-10]:RC[-1]) -> 0
A16: =IF(EQUAL(Timesheet!RC, ""), "", Timesheet!RC) -> 3020 | B16: =IF(EQUAL(Timesheet!RC, ""), "", Timesheet!RC) -> FIELD AUDIT PROGRAM DEVELOPMENT | C16: =IF(EQUAL(Timesheet!RC, ""), "", Timesheet!RC) -> Field | D16: 0 | E16: 0 | F16: 0 | G16: 0 | H16: 0 | I16: 0 | J16: 0 | K16: 0 | L16: 0 | M16: 0 | N16: =SUM(RC[-10]:RC[-1]) -> 0
A17: =IF(EQUAL(Timesheet!RC, ""), "", Timesheet!RC) -> 3030 | B17: =IF(EQUAL(Timesheet!RC, ""), "", Timesheet!RC) -> OPEN COMMITMENT ANALYSIS | C17: =IF(EQUAL(Timesheet!RC, ""), "", Timesheet!RC) -> Field | D17: 0 | E17: 0 | F17: 0 | G17: 0 | H17: 0 | I17: 0 | J17: 0 | K17: 0 | L17: 0 | M17: 0 | N17: =SUM(RC[-10]:RC[-1]) -> 0
A18: =IF(EQUAL(Timesheet!RC, ""), "", Timesheet!RC) -> 3040 | B18: =IF(EQUAL(Timesheet!RC, ""), "", Timesheet!RC) -> FIELD AUDIT RISK ASSESMENT | C18: =IF(EQUAL(Timesheet!RC, ""), "", Timesheet!RC) -> Field | D18: 0 | E18: 0 | F18: 0 | G18: 0 | H18: 0 | I18: 0 | J18: 0 | K18: 0 | L18: 0 | M18: 0 | N18: =SUM(RC[-10]:RC[-1]) -> 0
A19: =IF(EQUAL(Timesheet!RC, ""), "", Timesheet!RC) -> 3050 | B19: =IF(EQUAL(Timesheet!RC, ""), "", Timesheet!RC) -> NEW YORK FIELD AUDIT REVIEWS | C19: =IF(EQUAL(Timesheet!RC, ""), "", Timesheet!RC) -> Field | D19: 0 | E19: 0 | F19: 0 | G19: 0 | H19: 0 | I19: 0 | J19: 0 | K19: 0 | L19: 0 | M19: 0 | N19: =SUM(RC[-10]:RC[-1]) -> 0
A20: =IF(EQUAL(Timesheet!RC, ""), "", Timesheet!RC) -> 4001 | B20: =IF(EQUAL(Timesheet!RC, ""), "", Timesheet!RC) -> GRANT THORNTON | C20: =IF(EQUAL(Timesheet!RC, ""), "", Timesheet!RC) -> Mgmnt | D20: 0 | E20: 0 | F20: 0 | G20: 0 | H20: 0 | I20: 0 | J20: 0 | K20: 0 | L20: 0 | M20: 0 | N20: =SUM(RC[-10]:RC[-1]) -> 0
A21: =IF(EQUAL(Timesheet!RC, ""), "", Timesheet!RC) -> 5001 | B21: =IF(EQUAL(Timesheet!RC, ""), "", Timesheet!RC) -> MISCELLANEOUS AUDIT REQUESTS | C21: =IF(EQUAL(Timesheet!RC, ""), "", Timesheet!RC) -> Mgmnt | D21: 0 | E21: 0 | F21: 0 | G21: 0 | H21: 0 | I21: 0 | J21: 0 | K21: 0 | L21: 0 | M21: 0 | N21: =SUM(RC[-10]:RC[-1]) -> 0
A22: =IF(EQUAL(Timesheet!RC, ""), "", Timesheet!RC) -> 5009 | B22: =IF(EQUAL(Timesheet!RC, ""), "", Timesheet!RC) -> FORMS INVENTORY | C22: =IF(EQUAL(Timesheet!RC, ""), "", Timesheet!RC) -> Plan | D22: 0 | E22: 0 | F22: 0 | G22: 0 | H22: 0 | I22: 0 | J22: 0 | K22: 0 | L22: 0 | M22: 0 | N22: =SUM(RC[-10]:RC[-1]) -> 0
A23: =IF(EQUAL(Timesheet!RC, ""), "", Timesheet!RC) -> 5010 | B23: =IF(EQUAL(Timesheet!RC, ""), "", Timesheet!RC) -> SURPRISE CHECK VALIDATION | C23: =IF(EQUAL(Timesheet!RC, ""), "", Timesheet!RC) -> Plan | D23: 0 | E23: 0 | F23: 0 | G23: 0 | H23: 0 | I23: 0 | J23: 0 | K23: 0 | L23: 0 | M23: 0 | N23: =SUM(RC[-10]:RC[-1]) -> 0
A24: =IF(EQUAL(Timesheet!RC, ""), "", Timesheet!RC) -> 7000 | B24: =IF(EQUAL(Timesheet!RC, ""), "", Timesheet!RC) -> NON-PROJECT RELATED (MEETINGS) | C24: =IF(EQUAL(Timesheet!RC, ""), "", Timesheet!RC) -> Non-Audit | D24: 0 | E24: 0 | F24: 0 | G24: 0 | H24: 0 | I24: 0 | J24: 0 | K24: 0 | L24: 0 | M24: 0 | N24: =SUM(RC[-10]:RC[-1]) -> 0
A25: =IF(EQUAL(Timesheet!RC, ""), "", Timesheet!RC) -> 7003 | B25: =IF(EQUAL(Timesheet!RC, ""), "", Timesheet!RC) -> AUDIT COMMITTEE | C25: =IF(EQUAL(Timesheet!RC, ""), "", Timesheet!RC) -> Non-Audit | D25: 0 | E25: 0 | F25: 0 | G25: 0 | H25: 0 | I25: 0 | J25: 0 | K25: 0 | L25: 0 | M25: 0 | N25: =SUM(RC[-10]:RC[-1]) -> 0
A26: =IF(EQUAL(Timesheet!RC, ""), "", Timesheet!RC) -> 8001 | B26: =IF(EQUAL(Timesheet!RC, ""), "", Timesheet!RC) -> ADMINISTRATIVE - GENERAL | C26: =IF(EQUAL(Timesheet!RC, ""), "", Timesheet!RC) -> Admin | D26: 0 | E26: 0 | F26: 0 | G26: 0 | H26: 0 | I26: 0 | J26: 0 | K26: 0 | L26: 0 | M26: 0 | N26: =SUM(RC[-10]:RC[-1]) -> 0
A27: =IF(EQUAL(Timesheet!RC, ""), "", Timesheet!RC) -> 8002 | B27: =IF(EQUAL(Timesheet!RC, ""), "", Timesheet!RC) -> HOLIDAYS | C27: =IF(EQUAL(Timesheet!RC, ""), "", Timesheet!RC) -> Admin | D27: 0 | E27: 0 | F27: 0 | G27: 0 | H27: 0 | I27: 0 | J27: 0 | K27: 0 | L27: 0 | M27: 0 | N27: =SUM(RC[-10]:RC[-1]) -> 0
A28: =IF(EQUAL(Timesheet!RC, ""), "", Timesheet!RC) -> 8004 | B28: =IF(EQUAL(Timesheet!RC, ""), "", Timesheet!RC) -> SEMINARS & TRAINING | C28: =IF(EQUAL(Timesheet!RC, ""), "", Timesheet!RC) -> Admin | D28: 0 | E28: 0 | F28: 0 | G28: 0 | H28: 0 | I28: 0 | J28: 0 | K28: 0 | L28: 0 | M28: 0 | N28: =SUM(RC[-10]:RC[-1]) -> 0
A29: =IF(EQUAL(Timesheet!RC, ""), "", Timesheet!RC) -> 8005 | B29: =IF(EQUAL(Timesheet!RC, ""), "", Timesheet!RC) -> PERSONAL (VACATION/AT) | C29: =IF(EQUAL(Timesheet!RC, ""), "", Timesheet!RC) -> Admin | D29: 0 | E29: 0 | F29: 0 | G29: 0 | H29: 0 | I29: 0 | J29: 0 | K29: 0 | L29: 0 | M29: 0 | N29: =SUM(RC[-10]:RC[-1]) -> 0
A30: =IF(EQUAL(Timesheet!RC, ""), "", Timesheet!RC) -> 8006 | B30: =IF(EQUAL(Timesheet!RC, ""), "", Timesheet!RC) -> SICK | C30: =IF(EQUAL(Timesheet!RC, ""), "", Timesheet!RC) -> Admin | D30: 0 | E30: 0 | F30: 0 | G30: 0 | H30: 0 | I30: 0 | J30: 0 | K30: 0 | L30: 0 | M30: 0 | N30: =SUM(RC[-10]:RC[-1]) -> 0
A31: =IF(EQUAL(Timesheet!RC, ""), "", Timesheet!RC) -> 8008 | B31: =IF(EQUAL(Timesheet!RC, ""), "", Timesheet!RC) -> RESEARCH | C31: =IF(EQUAL(Timesheet!RC, ""), "", Timesheet!RC) -> Non-Audit | D31: 0 | E31: 0 | F31: 0 | G31: 0 | H31: 0 | I31: 0 | J31: 0 | K31: 0 | L31: 0 | M31: 0 | N31: =SUM(RC[-10]:RC[-1]) -> 0
A32: =IF(EQUAL(Timesheet!RC, ""), "", Timesheet!RC) ->  | B32: =IF(EQUAL(Timesheet!RC, ""), "", Timesheet!RC) ->  | C32: =IF(EQUAL(Timesheet!RC, ""), "", Timesheet!RC) ->  | D32: 0 | E32: 0 | F32: 0 | G32: 0 | H32: 0 | I32: 0 | J32: 0 | K32: 0 | L32: 0 | M32: 0 | N32: =SUM(RC[-10]:RC[-1]) -> 0
A33: =IF(EQUAL(Timesheet!RC, ""), "", Timesheet!RC) ->  | B33: =IF(EQUAL(Timesheet!RC, ""), "", Timesheet!RC) ->  | C33: =IF(EQUAL(Timesheet!RC, ""), "", Timesheet!RC) ->  | D33: 0 | E33: 0 | F33: 0 | G33: 0 | H33: 0 | I33: 0 | J33: 0 | K33: 0 | L33: 0 | M33: 0 | N33: =SUM(RC[-10]:RC[-1]) -> 0
A34: =IF(EQUAL(Timesheet!RC, ""), "", Timesheet!RC) ->  | B34: =IF(EQUAL(Timesheet!RC, ""), "", Timesheet!RC) ->  | C34: =IF(EQUAL(Timesheet!RC, ""), "", Timesheet!RC) ->  | D34: 0 | E34: 0 | F34: 0 | G34: 0 | H34: 0 | I34: 0 | J34: 0 | K34: 0 | L34: 0 | M34: 0 | N34: =SUM(RC[-10]:RC[-1]) -> 0
A35: =IF(EQUAL(Timesheet!RC, ""), "", Timesheet!RC) ->  | B35: =IF(EQUAL(Timesheet!RC, ""), "", Timesheet!RC) ->  | C35: =IF(EQUAL(Timesheet!RC, ""), "", Timesheet!RC) ->  | D35: 0 | E35: 0 | F35: 0 | G35: 0 | H35: 0 | I35: 0 | J35: 0 | K35: 0 | L35: 0 | M35: 0 | N35: =SUM(RC[-10]:RC[-1]) -> 0
A36: =IF(EQUAL(Timesheet!RC, ""), "", Timesheet!RC) ->  | B36: =IF(EQUAL(Timesheet!RC, ""), "", Timesheet!RC) ->  | C36: =IF(EQUAL(Timesheet!RC, ""), "", Timesheet!RC) ->  | D36: 0 | E36: 0 | F36: 0 | G36: 0 | H36: 0 | I36: 0 | J36: 0 | K36: 0 | L36: 0 | M36: 0 | N36: =SUM(RC[-10]:RC[-1]) -> 0
A37: =IF(EQUAL(Timesheet!RC, ""), "", Timesheet!RC) ->  | B37: =IF(EQUAL(Timesheet!RC, ""), "", Timesheet!RC) ->  | C37: =IF(EQUAL(Timesheet!RC, ""), "", Timesheet!RC) ->  | D37: 0 | E37: 0 | F37: 0 | G37: 0 | H37: 0 | I37: 0 | J37: 0 | K37: 0 | L37: 0 | M37: 0 | N37: =SUM(RC[-10]:RC[-1]) -> 0
A38: =IF(EQUAL(Timesheet!RC, ""), "", Timesheet!RC) ->  | B38: =IF(EQUAL(Timesheet!RC, ""), "", Timesheet!RC) ->  | C38: =IF(EQUAL(Timesheet!RC, ""), "", Timesheet!RC) ->  | D38: 0 | E38: 0 | F38: 0 | G38: 0 | H38: 0 | I38: 0 | J38: 0 | K38: 0 | L38: 0 | M38: 0 | N38: =SUM(RC[-10]:RC[-1]) -> 0
A39: =IF(EQUAL(Timesheet!RC, ""), "", Timesheet!RC) ->  | B39: =IF(EQUAL(Timesheet!RC, ""), "", Timesheet!RC) ->  | C39: =IF(EQUAL(Timesheet!RC, ""), "", Timesheet!RC) ->  | D39: 0 | E39: 0 | F39: 0 | G39: 0 | H39: 0 | I39: 0 | J39: 0 | K39: 0 | L39: 0 | M39: 0 | N39: =SUM(RC[-10]:RC[-1]) -> 0
A40: =IF(EQUAL(Timesheet!RC, ""), "", Timesheet!RC) ->  | B40: =IF(EQUAL(Timesheet!RC, ""), "", Timesheet!RC) ->  | C40: =IF(EQUAL(Timesheet!RC, ""), "", Timesheet!RC) ->  | D40: 0 | E40: 0 | F40: 0 | G40: 0 | H40: 0 | I40: 0 | J40: 0 | K40: 0 | L40: 0 | M40: 0 | N40: =SUM(RC[-10]:RC[-1]) -> 0
A41: =IF(EQUAL(Timesheet!RC, ""), "", Timesheet!RC) ->  | B41: =IF(EQUAL(Timesheet!RC, ""), "", Timesheet!RC) ->  | C41: =IF(EQUAL(Timesheet!RC, ""), "", Timesheet!RC) ->  | D41: 0 | E41: 0 | F41: 0 | G41: 0 | H41: 0 | I41: 0 | J41: 0 | K41: 0 | L41: 0 | M41: 0 | N41: =SUM(RC[-10]:RC[-1]) -> 0
A42: =IF(EQUAL(Timesheet!RC, ""), "", Timesheet!RC) ->  | B42: =IF(EQUAL(Timesheet!RC, ""), "", Timesheet!RC) ->  | C42: =IF(EQUAL(Timesheet!RC, ""), "", Timesheet!RC) ->  | D42: 0 | E42: 0 | F42: 0 | G42: 0 | H42: 0 | I42: 0 | J42: 0 | K42: 0 | L42: 0 | M42: 0 | N42: =SUM(RC[-10]:RC[-1]) -> 0
A43: =IF(EQUAL(Timesheet!RC, ""), "", Timesheet!RC) ->  | B43: =IF(EQUAL(Timesheet!RC, ""), "", Timesheet!RC) ->  | C43: =IF(EQUAL(Timesheet!RC, ""), "", Timesheet!RC) ->  | D43: 0 | E43: 0 | F43: 0 | G43: 0 | H43: 0 | I43: 0 | J43: 0 | K43: 0 | L43: 0 | M43: 0 | N43: =SUM(RC[-10]:RC[-1]) -> 0
A44: =IF(EQUAL(Timesheet!RC, ""), "", Timesheet!RC) ->  | B44: =IF(EQUAL(Timesheet!RC, ""), "", Timesheet!RC) ->  | C44: =IF(EQUAL(Timesheet!RC, ""), "", Timesheet!RC) ->  | D44: 0 | E44: 0 | F44: 0 | G44: 0 | H44: 0 | I44: 0 | J44: 0 | K44: 0 | L44: 0 | M44: 0 | N44: =SUM(RC[-10]:RC[-1]) -> 0
A45: 9029 | B45: 'GIDEON PATT SPECIAL REQUEST - BONDS | C45: 'Mgmnt | D45: 0 | E45: 0 | F45: 0 | G45: 0 | H45: 0 | I45: 0 | J45: 0 | K45: 0 | L45: 0 | M45: 0 | N45: =SUM(RC[-10]:RC[-1]) -> 0
A46: =Timesheet!RC ->  | B46: =Timesheet!RC ->  | C46: =Timesheet!RC ->  | D46: 0 | E46: 0 | F46: 0 | G46: 0 | H46: 0 | I46: 0 | J46: 0 | K46: 0 | L46: 0 | M46: 0 | N46: =SUM(RC[-10]:RC[-1]) -> 0
A47: =Timesheet!RC ->  | B47: =Timesheet!RC ->  | C47: =Timesheet!RC ->  | D47: 0 | E47: 0 | F47: 0 | G47: 0 | H47: 0 | I47: 0 | J47: 0 | K47: 0 | L47: 0 | M47: 0 | N47: =SUM(RC[-10]:RC[-1]) -> 0
A48: =Timesheet!RC ->  | B48: =Timesheet!RC ->  | C48: =Timesheet!RC ->  | D48: 0 | E48: 0 | F48: 0 | G48: 0 | H48: 0 | I48: 0 | J48: 0 | K48: 0 | L48: 0 | M48: 0 | N48: =SUM(RC[-10]:RC[-1]) -> 0
A49: =Timesheet!RC ->  | B49: =Timesheet!RC ->  | C49: =Timesheet!RC ->  | D49: 0 | E49: 0 | F49: 0 | G49: 0 | H49: 0 | I49: 0 | J49: 0 | K49: 0 | L49: 0 | M49: 0 | N49: =SUM(RC[-10]:RC[-1]) -> 0
A50: =Timesheet!RC ->  | B50: =Timesheet!RC ->  | C50: =Timesheet!RC ->  | D50: 0 | E50: 0 | F50: 0 | G50: 0 | H50: 0 | I50: 0 | J50: 0 | K50: 0 | L50: 0 | M50: 0 | N50: =SUM(RC[-10]:RC[-1]) -> 0
A51: =Timesheet!RC ->  | B51: =Timesheet!RC ->  | C51: =Timesheet!RC ->  | D51: 0 | E51: 0 | F51: 0 | G51: 0 | H51: 0 | I51: 0 | J51: 0 | K51: 0 | L51: 0 | M51: 0 | N51: =SUM(RC[-10]:RC[-1]) -> 0
A52: =Timesheet!RC ->  | B52: =Timesheet!RC ->  | C52: =Timesheet!RC ->  | D52: 0 | E52: 0 | F52: 0 | G52: 0 | H52: 0 | I52: 0 | J52: 0 | K52: 0 | L52: 0 | M52: 0 | N52: =SUM(RC[-10]:RC[-1]) -> 0
A53: =Timesheet!RC ->  | B53: =Timesheet!RC ->  | C53: =Timesheet!RC ->  | D53: 0 | E53: 0 | F53: 0 | G53: 0 | H53: 0 | I53: 0 | J53: 0 | K53: 0 | L53: 0 | M53: 0 | N53: =SUM(RC[-10]:RC[-1]) -> 0
A54: 'TOTAL | D54: =SUM(R[-51]C:R[-1]C) -> 0 | E54: =SUM(R[-51]C:R[-1]C) -> 0 | F54: =SUM(R[-51]C:R[-1]C) -> 0 | G54: =SUM(R[-51]C:R[-1]C) -> 0 | H54: =SUM(R[-51]C:R[-1]C) -> 0 | I54: =SUM(R[-51]C:R[-1]C) -> 0 | J54: =SUM(R[-51]C:R[-1]C) -> 0 | K54: =SUM(R[-51]C:R[-1]C) -> 0 | L54: =SUM(R[-51]C:R[-1]C) -> 0 | M54: =SUM(R[-51]C:R[-1]C) -> 0 | N54: =SUM(R[-51]C:R[-1]C) -> 0

Sheet: July2000
A1: 'CODE | B1: 'AUDIT DESCRIPTION | C1: 'Category | D1: 'Week Ending
D2: =7+June2000!RC[+8] -> 36715 | E2: 'Susan | F2: =RC[-2]+7 -> 36722 | G2: =RC[-2] -> Susan | H2: =RC[-2]+7 -> 36729 | I2: =RC[-2] -> Susan | J2: =RC[-2]+7 -> 36736 | K2: =RC[-2] -> Susan | L2: 'Total
A3: =IF(EQUAL(Timesheet!RC, ""), "", Timesheet!RC) -> 1001 | B3: =IF(EQUAL(Timesheet!RC, ""), "", Timesheet!RC) -> PURCHASING | C3: =IF(EQUAL(Timesheet!RC, ""), "", Timesheet!RC) -> Mgmnt | D3: 0 | E3: 0 | F3: 0 | G3: 0 | H3: 0 | I3: 0 | J3: 0 | K3: 0 | L3: =SUM(RC[-8]:RC[-1]) -> 0
A4: =IF(EQUAL(Timesheet!RC, ""), "", Timesheet!RC) -> 1002 | B4: =IF(EQUAL(Timesheet!RC, ""), "", Timesheet!RC) -> HUMAN RESOURCE | C4: =IF(EQUAL(Timesheet!RC, ""), "", Timesheet!RC) -> Plan | D4: 0 | E4: 0 | F4: 0 | G4: 0 | H4: 0 | I4: 0 | J4: 0 | K4: 0 | L4: =SUM(RC[-8]:RC[-1]) -> 0
A5: =IF(EQUAL(Timesheet!RC, ""), "", Timesheet!RC) -> 1005 | B5: =IF(EQUAL(Timesheet!RC, ""), "", Timesheet!RC) -> CORPORATE AUDIT RISK ANALYSIS | C5: =IF(EQUAL(Timesheet!RC, ""), "", Timesheet!RC) -> Plan | D5: 0 | E5: 0 | F5: 0 | G5: 0 | H5: 0 | I5: 0 | J5: 0 | K5: 0 | L5: =SUM(RC[-8]:RC[-1]) -> 0
A6: =IF(EQUAL(Timesheet!RC, ""), "", Timesheet!RC) -> 1007 | B6: =IF(EQUAL(Timesheet!RC, ""), "", Timesheet!RC) -> OFFICER'S TRAVEL & EXPENSE | C6: =IF(EQUAL(Timesheet!RC, ""), "", Timesheet!RC) -> Plan | D6: 0 | E6: 0 | F6: 0 | G6: 0 | H6: 0 | I6: 0 | J6: 0 | K6: 0 | L6: =SUM(RC[-8]:RC[-1]) -> 0
A7: =IF(EQUAL(Timesheet!RC, ""), "", Timesheet!RC) -> 1008 | B7: =IF(EQUAL(Timesheet!RC, ""), "", Timesheet!RC) -> RECORD RETENTION | C7: =IF(EQUAL(Timesheet!RC, ""), "", Timesheet!RC) -> Mgmnt | D7: 0 | E7: 0 | F7: 0 | G7: 0 | H7: 0 | I7: 0 | J7: 0 | K7: 0 | L7: =SUM(RC[-8]:RC[-1]) -> 0
A8: =IF(EQUAL(Timesheet!RC, ""), "", Timesheet!RC) -> 1009 | B8: =IF(EQUAL(Timesheet!RC, ""), "", Timesheet!RC) -> NASD AUDITS | C8: =IF(EQUAL(Timesheet!RC, ""), "", Timesheet!RC) -> Plan | D8: 0 | E8: 0 | F8: 0 | G8: 0 | H8: 0 | I8: 0 | J8: 0 | K8: 0 | L8: =SUM(RC[-8]:RC[-1]) -> 0
A9: =IF(EQUAL(Timesheet!RC, ""), "", Timesheet!RC) -> 1011 | B9: =IF(EQUAL(Timesheet!RC, ""), "", Timesheet!RC) -> SURPRISE CASH AUDIT - NEW YORK | C9: =IF(EQUAL(Timesheet!RC, ""), "", Timesheet!RC) -> Plan | D9: 0 | E9: 0 | F9: 0 | G9: 0 | H9: 0 | I9: 0 | J9: 0 | K9: 0 | L9: =SUM(RC[-8]:RC[-1]) -> 0
A10: =IF(EQUAL(Timesheet!RC, ""), "", Timesheet!RC) -> 1012 | B10: =IF(EQUAL(Timesheet!RC, ""), "", Timesheet!RC) -> INTERNATIONAL AUDIT - IBI | C10: =IF(EQUAL(Timesheet!RC, ""), "", Timesheet!RC) -> Plan | D10: 0 | E10: 0 | F10: 0 | G10: 0 | H10: 0 | I10: 0 | J10: 0 | K10: 0 | L10: =SUM(RC[-8]:RC[-1]) -> 0
A11: =IF(EQUAL(Timesheet!RC, ""), "", Timesheet!RC) -> 1013 | B11: =IF(EQUAL(Timesheet!RC, ""), "", Timesheet!RC) -> INTERNATIONAL AUDIT - CISL | C11: =IF(EQUAL(Timesheet!RC, ""), "", Timesheet!RC) -> Plan | D11: 0 | E11: 0 | F11: 0 | G11: 0 | H11: 0 | I11: 0 | J11: 0 | K11: 0 | L11: =SUM(RC[-8]:RC[-1]) -> 0
A12: =IF(EQUAL(Timesheet!RC, ""), "", Timesheet!RC) -> 1014 | B12: =IF(EQUAL(Timesheet!RC, ""), "", Timesheet!RC) -> MARKETING AND COMMUNICATION | C12: =IF(EQUAL(Timesheet!RC, ""), "", Timesheet!RC) -> Mgmnt | D12: 0 | E12: 0 | F12: 0 | G12: 0 | H12: 0 | I12: 0 | J12: 0 | K12: 0 | L12: =SUM(RC[-8]:RC[-1]) -> 0
A13: =IF(EQUAL(Timesheet!RC, ""), "", Timesheet!RC) -> 3001 | B13: =IF(EQUAL(Timesheet!RC, ""), "", Timesheet!RC) -> FIELD OFFICE CONTROL REVIEWS | C13: =IF(EQUAL(Timesheet!RC, ""), "", Timesheet!RC) -> Field | D13: 0 | E13: 0 | F13: 0 | G13: 0 | H13: 0 | I13: 0 | J13: 0 | K13: 0 | L13: =SUM(RC[-8]:RC[-1]) -> 0
A14: =IF(EQUAL(Timesheet!RC, ""), "", Timesheet!RC) -> 3002 | B14: =IF(EQUAL(Timesheet!RC, ""), "", Timesheet!RC) -> FIELD OFFICE ACCOUNTABILITY ANALYSIS | C14: =IF(EQUAL(Timesheet!RC, ""), "", Timesheet!RC) -> Field | D14: 0 | E14: 0 | F14: 0 | G14: 0 | H14: 0 | I14: 0 | J14: 0 | K14: 0 | L14: =SUM(RC[-8]:RC[-1]) -> 0
A15: =IF(EQUAL(Timesheet!RC, ""), "", Timesheet!RC) -> 3010 | B15: =IF(EQUAL(Timesheet!RC, ""), "", Timesheet!RC) -> FIELD OFFICE BANK RECONCILATIONS | C15: =IF(EQUAL(Timesheet!RC, ""), "", Timesheet!RC) -> Field | D15: 0 | E15: 0 | F15: 0 | G15: 0 | H15: 0 | I15: 0 | J15: 0 | K15: 0 | L15: =SUM(RC[-8]:RC[-1]) -> 0
A16: =IF(EQUAL(Timesheet!RC, ""), "", Timesheet!RC) -> 3020 | B16: =IF(EQUAL(Timesheet!RC, ""), "", Timesheet!RC) -> FIELD AUDIT PROGRAM DEVELOPMENT | C16: =IF(EQUAL(Timesheet!RC, ""), "", Timesheet!RC) -> Field | D16: 0 | E16: 0 | F16: 0 | G16: 0 | H16: 0 | I16: 0 | J16: 0 | K16: 0 | L16: =SUM(RC[-8]:RC[-1]) -> 0
A17: =IF(EQUAL(Timesheet!RC, ""), "", Timesheet!RC) -> 3030 | B17: =IF(EQUAL(Timesheet!RC, ""), "", Timesheet!RC) -> OPEN COMMITMENT ANALYSIS | C17: =IF(EQUAL(Timesheet!RC, ""), "", Timesheet!RC) -> Field | D17: 0 | E17: 0 | F17: 0 | G17: 0 | H17: 0 | I17: 0 | J17: 0 | K17: 0 | L17: =SUM(RC[-8]:RC[-1]) -> 0
A18: =IF(EQUAL(Timesheet!RC, ""), "", Timesheet!RC) -> 3040 | B18: =IF(EQUAL(Timesheet!RC, ""), "", Timesheet!RC) -> FIELD AUDIT RISK ASSESMENT | C18: =IF(EQUAL(Timesheet!RC, ""), "", Timesheet!RC) -> Field | D18: 0 | E18: 0 | F18: 0 | G18: 0 | H18: 0 | I18: 0 | J18: 0 | K18: 0 | L18: =SUM(RC[-8]:RC[-1]) -> 0
A19: =IF(EQUAL(Timesheet!RC, ""), "", Timesheet!RC) -> 3050 | B19: =IF(EQUAL(Timesheet!RC, ""), "", Timesheet!RC) -> NEW YORK FIELD AUDIT REVIEWS | C19: =IF(EQUAL(Timesheet!RC, ""), "", Timesheet!RC) -> Field | D19: 0 | E19: 0 | F19: 0 | G19: 0 | H19: 0 | I19: 0 | J19: 0 | K19: 0 | L19: =SUM(RC[-8]:RC[-1]) -> 0
A20: =IF(EQUAL(Timesheet!RC, ""), "", Timesheet!RC) -> 4001 | B20: =IF(EQUAL(Timesheet!RC, ""), "", Timesheet!RC) -> GRANT THORNTON | C20: =IF(EQUAL(Timesheet!RC, ""), "", Timesheet!RC) -> Mgmnt | D20: 0 | E20: 0 | F20: 0 | G20: 0 | H20: 0 | I20: 0 | J20: 0 | K20: 0 | L20: =SUM(RC[-8]:RC[-1]) -> 0
A21: =IF(EQUAL(Timesheet!RC, ""), "", Timesheet!RC) -> 5001 | B21: =IF(EQUAL(Timesheet!RC, ""), "", Timesheet!RC) -> MISCELLANEOUS AUDIT REQUESTS | C21: =IF(EQUAL(Timesheet!RC, ""), "", Timesheet!RC) -> Mgmnt | D21: 0 | E21: 0 | F21: 0 | G21: 0 | H21: 0 | I21: 0 | J21: 0 | K21: 0 | L21: =SUM(RC[-8]:RC[-1]) -> 0
A22: =IF(EQUAL(Timesheet!RC, ""), "", Timesheet!RC) -> 5009 | B22: =IF(EQUAL(Timesheet!RC, ""), "", Timesheet!RC) -> FORMS INVENTORY | C22: =IF(EQUAL(Timesheet!RC, ""), "", Timesheet!RC) -> Plan | D22: 0 | E22: 0 | F22: 0 | G22: 0 | H22: 0 | I22: 0 | J22: 0 | K22: 0 | L22: =SUM(RC[-8]:RC[-1]) -> 0
A23: =IF(EQUAL(Timesheet!RC, ""), "", Timesheet!RC) -> 5010 | B23: =IF(EQUAL(Timesheet!RC, ""), "", Timesheet!RC) -> SURPRISE CHECK VALIDATION | C23: =IF(EQUAL(Timesheet!RC, ""), "", Timesheet!RC) -> Plan | D23: 0 | E23: 0 | F23: 0 | G23: 0 | H23: 0 | I23: 0 | J23: 0 | K23: 0 | L23: =SUM(RC[-8]:RC[-1]) -> 0
A24: =IF(EQUAL(Timesheet!RC, ""), "", Timesheet!RC) -> 7000 | B24: =IF(EQUAL(Timesheet!RC, ""), "", Timesheet!RC) -> NON-PROJECT RELATED (MEETINGS) | C24: =IF(EQUAL(Timesheet!RC, ""), "", Timesheet!RC) -> Non-Audit | D24: 0 | E24: 0 | F24: 0 | G24: 0 | H24: 0 | I24: 0 | J24: 0 | K24: 0 | L24: =SUM(RC[-8]:RC[-1]) -> 0
A25: =IF(EQUAL(Timesheet!RC, ""), "", Timesheet!RC) -> 7003 | B25: =IF(EQUAL(Timesheet!RC, ""), "", Timesheet!RC) -> AUDIT COMMITTEE | C25: =IF(EQUAL(Timesheet!RC, ""), "", Timesheet!RC) -> Non-Audit | D25: 0 | E25: 0 | F25: 0 | G25: 0 | H25: 0 | I25: 0 | J25: 0 | K25: 0 | L25: =SUM(RC[-8]:RC[-1]) -> 0
A26: =IF(EQUAL(Timesheet!RC, ""), "", Timesheet!RC) -> 8001 | B26: =IF(EQUAL(Timesheet!RC, ""), "", Timesheet!RC) -> ADMINISTRATIVE - GENERAL | C26: =IF(EQUAL(Timesheet!RC, ""), "", Timesheet!RC) -> Admin | D26: 0 | E26: 0 | F26: 0 | G26: 0 | H26: 0 | I26: 0 | J26: 0 | K26: 0 | L26: =SUM(RC[-8]:RC[-1]) -> 0
A27: =IF(EQUAL(Timesheet!RC, ""), "", Timesheet!RC) -> 8002 | B27: =IF(EQUAL(Timesheet!RC, ""), "", Timesheet!RC) -> HOLIDAYS | C27: =IF(EQUAL(Timesheet!RC, ""), "", Timesheet!RC) -> Admin | D27: 0 | E27: 0 | F27: 0 | G27: 0 | H27: 0 | I27: 0 | J27: 0 | K27: 0 | L27: =SUM(RC[-8]:RC[-1]) -> 0
A28: =IF(EQUAL(Timesheet!RC, ""), "", Timesheet!RC) -> 8004 | B28: =IF(EQUAL(Timesheet!RC, ""), "", Timesheet!RC) -> SEMINARS & TRAINING | C28: =IF(EQUAL(Timesheet!RC, ""), "", Timesheet!RC) -> Admin | D28: 0 | E28: 0 | F28: 0 | G28: 0 | H28: 0 | I28: 0 | J28: 0 | K28: 0 | L28: =SUM(RC[-8]:RC[-1]) -> 0
A29: =IF(EQUAL(Timesheet!RC, ""), "", Timesheet!RC) -> 8005 | B29: =IF(EQUAL(Timesheet!RC, ""), "", Timesheet!RC) -> PERSONAL (VACATION/AT) | C29: =IF(EQUAL(Timesheet!RC, ""), "", Timesheet!RC) -> Admin | D29: 0 | E29: 0 | F29: 0 | G29: 0 | H29: 0 | I29: 0 | J29: 0 | K29: 0 | L29: =SUM(RC[-8]:RC[-1]) -> 0
A30: =IF(EQUAL(Timesheet!RC, ""), "", Timesheet!RC) -> 8006 | B30: =IF(EQUAL(Timesheet!RC, ""), "", Timesheet!RC) -> SICK | C30: =IF(EQUAL(Timesheet!RC, ""), "", Timesheet!RC) -> Admin | D30: 0 | E30: 0 | F30: 0 | G30: 0 | H30: 0 | I30: 0 | J30: 0 | K30: 0 | L30: =SUM(RC[-8]:RC[-1]) -> 0
A31: =IF(EQUAL(Timesheet!RC, ""), "", Timesheet!RC) -> 8008 | B31: =IF(EQUAL(Timesheet!RC, ""), "", Timesheet!RC) -> RESEARCH | C31: =IF(EQUAL(Timesheet!RC, ""), "", Timesheet!RC) -> Non-Audit | D31: 0 | E31: 0 | F31: 0 | G31: 0 | H31: 0 | I31: 0 | J31: 0 | K31: 0 | L31: =SUM(RC[-8]:RC[-1]) -> 0
A32: =IF(EQUAL(Timesheet!RC, ""), "", Timesheet!RC) ->  | B32: =IF(EQUAL(Timesheet!RC, ""), "", Timesheet!RC) ->  | C32: =IF(EQUAL(Timesheet!RC, ""), "", Timesheet!RC) ->  | D32: 0 | E32: 0 | F32: 0 | G32: 0 | H32: 0 | I32: 0 | J32: 0 | K32: 0 | L32: =SUM(RC[-8]:RC[-1]) -> 0
A33: =IF(EQUAL(Timesheet!RC, ""), "", Timesheet!RC) ->  | B33: =IF(EQUAL(Timesheet!RC, ""), "", Timesheet!RC) ->  | C33: =IF(EQUAL(Timesheet!RC, ""), "", Timesheet!RC) ->  | D33: 0 | E33: 0 | F33: 0 | G33: 0 | H33: 0 | I33: 0 | J33: 0 | K33: 0 | L33: =SUM(RC[-8]:RC[-1]) -> 0
A34: =IF(EQUAL(Timesheet!RC, ""), "", Timesheet!RC) ->  | B34: =IF(EQUAL(Timesheet!RC, ""), "", Timesheet!RC) ->  | C34: =IF(EQUAL(Timesheet!RC, ""), "", Timesheet!RC) ->  | D34: 0 | E34: 0 | F34: 0 | G34: 0 | H34: 0 | I34: 0 | J34: 0 | K34: 0 | L34: =SUM(RC[-8]:RC[-1]) -> 0
A35: =IF(EQUAL(Timesheet!RC, ""), "", Timesheet!RC) ->  | B35: =IF(EQUAL(Timesheet!RC, ""), "", Timesheet!RC) ->  | C35: =IF(EQUAL(Timesheet!RC, ""), "", Timesheet!RC) ->  | D35: 0 | E35: 0 | F35: 0 | G35: 0 | H35: 0 | I35: 0 | J35: 0 | K35: 0 | L35: =SUM(RC[-8]:RC[-1]) -> 0
A36: =IF(EQUAL(Timesheet!RC, ""), "", Timesheet!RC) ->  | B36: =IF(EQUAL(Timesheet!RC, ""), "", Timesheet!RC) ->  | C36: =IF(EQUAL(Timesheet!RC, ""), "", Timesheet!RC) ->  | D36: 0 | E36: 0 | F36: 0 | G36: 0 | H36: 0 | I36: 0 | J36: 0 | K36: 0 | L36: =SUM(RC[-8]:RC[-1]) -> 0
A37: =IF(EQUAL(Timesheet!RC, ""), "", Timesheet!RC) ->  | B37: =IF(EQUAL(Timesheet!RC, ""), "", Timesheet!RC) ->  | C37: =IF(EQUAL(Timesheet!RC, ""), "", Timesheet!RC) ->  | D37: 0 | E37: 0 | F37: 0 | G37: 0 | H37: 0 | I37: 0 | J37: 0 | K37: 0 | L37: =SUM(RC[-8]:RC[-1]) -> 0
A38: =IF(EQUAL(Timesheet!RC, ""), "", Timesheet!RC) ->  | B38: =IF(EQUAL(Timesheet!RC, ""), "", Timesheet!RC) ->  | C38: =IF(EQUAL(Timesheet!RC, ""), "", Timesheet!RC) ->  | D38: 0 | E38: 0 | F38: 0 | G38: 0 | H38: 0 | I38: 0 | J38: 0 | K38: 0 | L38: =SUM(RC[-8]:RC[-1]) -> 0
A39: =IF(EQUAL(Timesheet!RC, ""), "", Timesheet!RC) ->  | B39: =IF(EQUAL(Timesheet!RC, ""), "", Timesheet!RC) ->  | C39: =IF(EQUAL(Timesheet!RC, ""), "", Timesheet!RC) ->  | D39: 0 | E39: 0 | F39: 0 | G39: 0 | H39: 0 | I39: 0 | J39: 0 | K39: 0 | L39: =SUM(RC[-8]:RC[-1]) -> 0
A40: =IF(EQUAL(Timesheet!RC, ""), "", Timesheet!RC) ->  | B40: =IF(EQUAL(Timesheet!RC, ""), "", Timesheet!RC) ->  | C40: =IF(EQUAL(Timesheet!RC, ""), "", Timesheet!RC) ->  | D40: 0 | E40: 0 | F40: 0 | G40: 0 | H40: 0 | I40: 0 | J40: 0 | K40: 0 | L40: =SUM(RC[-8]:RC[-1]) -> 0
A41: =IF(EQUAL(Timesheet!RC, ""), "", Timesheet!RC) ->  | B41: =IF(EQUAL(Timesheet!RC, ""), "", Timesheet!RC) ->  | C41: =IF(EQUAL(Timesheet!RC, ""), "", Timesheet!RC) ->  | D41: 0 | E41: 0 | F41: 0 | G41: 0 | H41: 0 | I41: 0 | J41: 0 | K41: 0 | L41: =SUM(RC[-8]:RC[-1]) -> 0
A42: =IF(EQUAL(Timesheet!RC, ""), "", Timesheet!RC) ->  | B42: =IF(EQUAL(Timesheet!RC, ""), "", Timesheet!RC) ->  | C42: =IF(EQUAL(Timesheet!RC, ""), "", Timesheet!RC) ->  | D42: 0 | E42: 0 | F42: 0 | G42: 0 | H42: 0 | I42: 0 | J42: 0 | K42: 0 | L42: =SUM(RC[-8]:RC[-1]) -> 0
A43: =IF(EQUAL(Timesheet!RC, ""), "", Timesheet!RC) ->  | B43: =IF(EQUAL(Timesheet!RC, ""), "", Timesheet!RC) ->  | C43: =IF(EQUAL(Timesheet!RC, ""), "", Timesheet!RC) ->  | D43: 0 | E43: 0 | F43: 0 | G43: 0 | H43: 0 | I43: 0 | J43: 0 | K43: 0 | L43: =SUM(RC[-8]:RC[-1]) -> 0
A44: =IF(EQUAL(Timesheet!RC, ""), "", Timesheet!RC) ->  | B44: =IF(EQUAL(Timesheet!RC, ""), "", Timesheet!RC) ->  | C44: =IF(EQUAL(Timesheet!RC, ""), "", Timesheet!RC) ->  | D44: 0 | E44: 0 | F44: 0 | G44: 0 | H44: 0 | I44: 0 | J44: 0 | K44: 0 | L44: =SUM(RC[-8]:RC[-1]) -> 0
A45: 9029 | B45: 'GIDEON PATT SPECIAL REQUEST - BONDS | C45: 'Mgmnt | D45: 0 | E45: 0 | F45: 0 | G45: 0 | H45: 0 | I45: 0 | J45: 0 | K45: 0 | L45: =SUM(RC[-8]:RC[-1]) -> 0
A46: =Timesheet!RC ->  | B46: =Timesheet!RC ->  | C46: =Timesheet!RC ->  | D46: 0 | E46: 0 | F46: 0 | G46: 0 | H46: 0 | I46: 0 | J46: 0 | K46: 0 | L46: =SUM(RC[-8]:RC[-1]) -> 0
A47: =Timesheet!RC ->  | B47: =Timesheet!RC ->  | C47: =Timesheet!RC ->  | D47: 0 | E47: 0 | F47: 0 | G47: 0 | H47: 0 | I47: 0 | J47: 0 | K47: 0 | L47: =SUM(RC[-8]:RC[-1]) -> 0
A48: =Timesheet!RC ->  | B48: =Timesheet!RC ->  | C48: =Timesheet!RC ->  | D48: 0 | E48: 0 | F48: 0 | G48: 0 | H48: 0 | I48: 0 | J48: 0 | K48: 0 | L48: =SUM(RC[-8]:RC[-1]) -> 0
A49: =Timesheet!RC ->  | B49: =Timesheet!RC ->  | C49: =Timesheet!RC ->  | D49: 0 | E49: 0 | F49: 0 | G49: 0 | H49: 0 | I49: 0 | J49: 0 | K49: 0 | L49: =SUM(RC[-8]:RC[-1]) -> 0
A50: =Timesheet!RC ->  | B50: =Timesheet!RC ->  | C50: =Timesheet!RC ->  | D50: 0 | E50: 0 | F50: 0 | G50: 0 | H50: 0 | I50: 0 | J50: 0 | K50: 0 | L50: =SUM(RC[-8]:RC[-1]) -> 0
A51: =Timesheet!RC ->  | B51: =Timesheet!RC ->  | C51: =Timesheet!RC ->  | D51: 0 | E51: 0 | F51: 0 | G51: 0 | H51: 0 | I51: 0 | J51: 0 | K51: 0 | L51: =SUM(RC[-8]:RC[-1]) -> 0
A52: =Timesheet!RC ->  | B52: =Timesheet!RC ->  | C52: =Timesheet!RC ->  | D52: 0 | E52: 0 | F52: 0 | G52: 0 | H52: 0 | I52: 0 | J52: 0 | K52: 0 | L52: =SUM(RC[-8]:RC[-1]) -> 0
A53: =Timesheet!RC ->  | B53: =Timesheet!RC ->  | C53: =Timesheet!RC ->  | D53: 0 | E53: 0 | F53: 0 | G53: 0 | H53: 0 | I53: 0 | J53: 0 | K53: 0 | L53: =SUM(RC[-8]:RC[-1]) -> 0
A54: 'TOTAL | D54: =SUM(R[-51]C:R[-1]C) -> 0 | E54: =SUM(R[-51]C:R[-1]C) -> 0 | F54: =SUM(R[-51]C:R[-1]C) -> 0 | G54: =SUM(R[-51]C:R[-1]C) -> 0 | H54: =SUM(R[-51]C:R[-1]C) -> 0 | I54: =SUM(R[-51]C:R[-1]C) -> 0 | J54: =SUM(R[-51]C:R[-1]C) -> 0 | K54: =SUM(R[-51]C:R[-1]C) -> 0 | L54: =SUM(RC[-8]:RC[-1]) -> 0

Sheet: August2000
A1: 'CODE | B1: 'AUDIT DESCRIPTION | C1: 'Category | D1: 'Week Ending
D2: =7+July2000!RC[+6] -> 36743 | E2: 'Susan | F2: =RC[-2]+7 -> 36750 | G2: =RC[-2] -> Susan | H2: =RC[-2]+7 -> 36757 | I2: =RC[-2] -> Susan | J2: =RC[-2]+7 -> 36764 | K2: =RC[-2] -> Susan | L2: 'Total
A3: =IF(EQUAL(Timesheet!RC, ""), "", Timesheet!RC) -> 1001 | B3: =IF(EQUAL(Timesheet!RC, ""), "", Timesheet!RC) -> PURCHASING | C3: =IF(EQUAL(Timesheet!RC, ""), "", Timesheet!RC) -> Mgmnt | D3: 0 | E3: 0 | F3: 0 | G3: 0 | H3: 0 | I3: 0 | J3: 0 | K3: 0 | L3: =SUM(RC[-8]:RC[-1]) -> 0
A4: =IF(EQUAL(Timesheet!RC, ""), "", Timesheet!RC) -> 1002 | B4: =IF(EQUAL(Timesheet!RC, ""), "", Timesheet!RC) -> HUMAN RESOURCE | C4: =IF(EQUAL(Timesheet!RC, ""), "", Timesheet!RC) -> Plan | D4: 0 | E4: 0 | F4: 0 | G4: 0 | H4: 0 | I4: 0 | J4: 0 | K4: 0 | L4: =SUM(RC[-8]:RC[-1]) -> 0
A5: =IF(EQUAL(Timesheet!RC, ""), "", Timesheet!RC) -> 1005 | B5: =IF(EQUAL(Timesheet!RC, ""), "", Timesheet!RC) -> CORPORATE AUDIT RISK ANALYSIS | C5: =IF(EQUAL(Timesheet!RC, ""), "", Timesheet!RC) -> Plan | D5: 0 | E5: 0 | F5: 0 | G5: 0 | H5: 0 | I5: 0 | J5: 0 | K5: 0 | L5: =SUM(RC[-8]:RC[-1]) -> 0
A6: =IF(EQUAL(Timesheet!RC, ""), "", Timesheet!RC) -> 1007 | B6: =IF(EQUAL(Timesheet!RC, ""), "", Timesheet!RC) -> OFFICER'S TRAVEL & EXPENSE | C6: =IF(EQUAL(Timesheet!RC, ""), "", Timesheet!RC) -> Plan | D6: 0 | E6: 0 | F6: 0 | G6: 0 | H6: 0 | I6: 0 | J6: 0 | K6: 0 | L6: =SUM(RC[-8]:RC[-1]) -> 0
A7: =IF(EQUAL(Timesheet!RC, ""), "", Timesheet!RC) -> 1008 | B7: =IF(EQUAL(Timesheet!RC, ""), "", Timesheet!RC) -> RECORD RETENTION | C7: =IF(EQUAL(Timesheet!RC, ""), "", Timesheet!RC) -> Mgmnt | D7: 0 | E7: 0 | F7: 0 | G7: 0 | H7: 0 | I7: 0 | J7: 0 | K7: 0 | L7: =SUM(RC[-8]:RC[-1]) -> 0
A8: =IF(EQUAL(Timesheet!RC, ""), "", Timesheet!RC) -> 1009 | B8: =IF(EQUAL(Timesheet!RC, ""), "", Timesheet!RC) -> NASD AUDITS | C8: =IF(EQUAL(Timesheet!RC, ""), "", Timesheet!RC) -> Plan | D8: 0 | E8: 0 | F8: 0 | G8: 0 | H8: 0 | I8: 0 | J8: 0 | K8: 0 | L8: =SUM(RC[-8]:RC[-1]) -> 0
A9: =IF(EQUAL(Timesheet!RC, ""), "", Timesheet!RC) -> 1011 | B9: =IF(EQUAL(Timesheet!RC, ""), "", Timesheet!RC) -> SURPRISE CASH AUDIT - NEW YORK | C9: =IF(EQUAL(Timesheet!RC, ""), "", Timesheet!RC) -> Plan | D9: 0 | E9: 0 | F9: 0 | G9: 0 | H9: 0 | I9: 0 | J9: 0 | K9: 0 | L9: =SUM(RC[-8]:RC[-1]) -> 0
A10: =IF(EQUAL(Timesheet!RC, ""), "", Timesheet!RC) -> 1012 | B10: =IF(EQUAL(Timesheet!RC, ""), "", Timesheet!RC) -> INTERNATIONAL AUDIT - IBI | C10: =IF(EQUAL(Timesheet!RC, ""), "", Timesheet!RC) -> Plan | D10: 0 | E10: 0 | F10: 0 | G10: 0 | H10: 0 | I10: 0 | J10: 0 | K10: 0 | L10: =SUM(RC[-8]:RC[-1]) -> 0
A11: =IF(EQUAL(Timesheet!RC, ""), "", Timesheet!RC) -> 1013 | B11: =IF(EQUAL(Timesheet!RC, ""), "", Timesheet!RC) -> INTERNATIONAL AUDIT - CISL | C11: =IF(EQUAL(Timesheet!RC, ""), "", Timesheet!RC) -> Plan | D11: 0 | E11: 0 | F11: 0 | G11: 0 | H11: 0 | I11: 0 | J11: 0 | K11: 0 | L11: =SUM(RC[-8]:RC[-1]) -> 0
A12: =IF(EQUAL(Timesheet!RC, ""), "", Timesheet!RC) -> 1014 | B12: =IF(EQUAL(Timesheet!RC, ""), "", Timesheet!RC) -> MARKETING AND COMMUNICATION | C12: =IF(EQUAL(Timesheet!RC, ""), "", Timesheet!RC) -> Mgmnt | D12: 0 | E12: 0 | F12: 0 | G12: 0 | H12: 0 | I12: 0 | J12: 0 | K12: 0 | L12: =SUM(RC[-8]:RC[-1]) -> 0
A13: =IF(EQUAL(Timesheet!RC, ""), "", Timesheet!RC) -> 3001 | B13: =IF(EQUAL(Timesheet!RC, ""), "", Timesheet!RC) -> FIELD OFFICE CONTROL REVIEWS | C13: =IF(EQUAL(Timesheet!RC, ""), "", Timesheet!RC) -> Field | D13: 0 | E13: 0 | F13: 0 | G13: 0 | H13: 0 | I13: 0 | J13: 0 | K13: 0 | L13: =SUM(RC[-8]:RC[-1]) -> 0
A14: =IF(EQUAL(Timesheet!RC, ""), "", Timesheet!RC) -> 3002 | B14: =IF(EQUAL(Timesheet!RC, ""), "", Timesheet!RC) -> FIELD OFFICE ACCOUNTABILITY ANALYSIS | C14: =IF(EQUAL(Timesheet!RC, ""), "", Timesheet!RC) -> Field | D14: 0 | E14: 0 | F14: 0 | G14: 0 | H14: 0 | I14: 0 | J14: 0 | K14: 0 | L14: =SUM(RC[-8]:RC[-1]) -> 0
A15: =IF(EQUAL(Timesheet!RC, ""), "", Timesheet!RC) -> 3010 | B15: =IF(EQUAL(Timesheet!RC, ""), "", Timesheet!RC) -> FIELD OFFICE BANK RECONCILATIONS | C15: =IF(EQUAL(Timesheet!RC, ""), "", Timesheet!RC) -> Field | D15: 0 | E15: 0 | F15: 0 | G15: 0 | H15: 0 | I15: 0 | J15: 0 | K15: 0 | L15: =SUM(RC[-8]:RC[-1]) -> 0
A16: =IF(EQUAL(Timesheet!RC, ""), "", Timesheet!RC) -> 3020 | B16: =IF(EQUAL(Timesheet!RC, ""), "", Timesheet!RC) -> FIELD AUDIT PROGRAM DEVELOPMENT | C16: =IF(EQUAL(Timesheet!RC, ""), "", Timesheet!RC) -> Field | D16: 0 | E16: 0 | F16: 0 | G16: 0 | H16: 0 | I16: 0 | J16: 0 | K16: 0 | L16: =SUM(RC[-8]:RC[-1]) -> 0
A17: =IF(EQUAL(Timesheet!RC, ""), "", Timesheet!RC) -> 3030 | B17: =IF(EQUAL(Timesheet!RC, ""), "", Timesheet!RC) -> OPEN COMMITMENT ANALYSIS | C17: =IF(EQUAL(Timesheet!RC, ""), "", Timesheet!RC) -> Field | D17: 0 | E17: 0 | F17: 0 | G17: 0 | H17: 0 | I17: 0 | J17: 0 | K17: 0 | L17: =SUM(RC[-8]:RC[-1]) -> 0
A18: =IF(EQUAL(Timesheet!RC, ""), "", Timesheet!RC) -> 3040 | B18: =IF(EQUAL(Timesheet!RC, ""), "", Timesheet!RC) -> FIELD AUDIT RISK ASSESMENT | C18: =IF(EQUAL(Timesheet!RC, ""), "", Timesheet!RC) -> Field | D18: 0 | E18: 0 | F18: 0 | G18: 0 | H18: 0 | I18: 0 | J18: 0 | K18: 0 | L18: =SUM(RC[-8]:RC[-1]) -> 0
A19: =IF(EQUAL(Timesheet!RC, ""), "", Timesheet!RC) -> 3050 | B19: =IF(EQUAL(Timesheet!RC, ""), "", Timesheet!RC) -> NEW YORK FIELD AUDIT REVIEWS | C19: =IF(EQUAL(Timesheet!RC, ""), "", Timesheet!RC) -> Field | D19: 0 | E19: 0 | F19: 0 | G19: 0 | H19: 0 | I19: 0 | J19: 0 | K19: 0 | L19: =SUM(RC[-8]:RC[-1]) -> 0
A20: =IF(EQUAL(Timesheet!RC, ""), "", Timesheet!RC) -> 4001 | B20: =IF(EQUAL(Timesheet!RC, ""), "", Timesheet!RC) -> GRANT THORNTON | C20: =IF(EQUAL(Timesheet!RC, ""), "", Timesheet!RC) -> Mgmnt | D20: 0 | E20: 0 | F20: 0 | G20: 0 | H20: 0 | I20: 0 | J20: 0 | K20: 0 | L20: =SUM(RC[-8]:RC[-1]) -> 0
A21: =IF(EQUAL(Timesheet!RC, ""), "", Timesheet!RC) -> 5001 | B21: =IF(EQUAL(Timesheet!RC, ""), "", Timesheet!RC) -> MISCELLANEOUS AUDIT REQUESTS | C21: =IF(EQUAL(Timesheet!RC, ""), "", Timesheet!RC) -> Mgmnt | D21: 0 | E21: 0 | F21: 0 | G21: 0 | H21: 0 | I21: 0 | J21: 0 | K21: 0 | L21: =SUM(RC[-8]:RC[-1]) -> 0
A22: =IF(EQUAL(Timesheet!RC, ""), "", Timesheet!RC) -> 5009 | B22: =IF(EQUAL(Timesheet!RC, ""), "", Timesheet!RC) -> FORMS INVENTORY | C22: =IF(EQUAL(Timesheet!RC, ""), "", Timesheet!RC) -> Plan | D22: 0 | E22: 0 | F22: 0 | G22: 0 | H22: 0 | I22: 0 | J22: 0 | K22: 0 | L22: =SUM(RC[-8]:RC[-1]) -> 0
A23: =IF(EQUAL(Timesheet!RC, ""), "", Timesheet!RC) -> 5010 | B23: =IF(EQUAL(Timesheet!RC, ""), "", Timesheet!RC) -> SURPRISE CHECK VALIDATION | C23: =IF(EQUAL(Timesheet!RC, ""), "", Timesheet!RC) -> Plan | D23: 0 | E23: 0 | F23: 0 | G23: 0 | H23: 0 | I23: 0 | J23: 0 | K23: 0 | L23: =SUM(RC[-8]:RC[-1]) -> 0
A24: =IF(EQUAL(Timesheet!RC, ""), "", Timesheet!RC) -> 7000 | B24: =IF(EQUAL(Timesheet!RC, ""), "", Timesheet!RC) -> NON-PROJECT RELATED (MEETINGS) | C24: =IF(EQUAL(Timesheet!RC, ""), "", Timesheet!RC) -> Non-Audit | D24: 0 | E24: 0 | F24: 0 | G24: 0 | H24: 0 | I24: 0 | J24: 0 | K24: 0 | L24: =SUM(RC[-8]:RC[-1]) -> 0
A25: =IF(EQUAL(Timesheet!RC, ""), "", Timesheet!RC) -> 7003 | B25: =IF(EQUAL(Timesheet!RC, ""), "", Timesheet!RC) -> AUDIT COMMITTEE | C25: =IF(EQUAL(Timesheet!RC, ""), "", Timesheet!RC) -> Non-Audit | D25: 0 | E25: 0 | F25: 0 | G25: 0 | H25: 0 | I25: 0 | J25: 0 | K25: 0 | L25: =SUM(RC[-8]:RC[-1]) -> 0
A26: =IF(EQUAL(Timesheet!RC, ""), "", Timesheet!RC) -> 8001 | B26: =IF(EQUAL(Timesheet!RC, ""), "", Timesheet!RC) -> ADMINISTRATIVE - GENERAL | C26: =IF(EQUAL(Timesheet!RC, ""), "", Timesheet!RC) -> Admin | D26: 0 | E26: 0 | F26: 0 | G26: 0 | H26: 0 | I26: 0 | J26: 0 | K26: 0 | L26: =SUM(RC[-8]:RC[-1]) -> 0
A27: =IF(EQUAL(Timesheet!RC, ""), "", Timesheet!RC) -> 8002 | B27: =IF(EQUAL(Timesheet!RC, ""), "", Timesheet!RC) -> HOLIDAYS | C27: =IF(EQUAL(Timesheet!RC, ""), "", Timesheet!RC) -> Admin | D27: 0 | E27: 0 | F27: 0 | G27: 0 | H27: 0 | I27: 0 | J27: 0 | K27: 0 | L27: =SUM(RC[-8]:RC[-1]) -> 0
A28: =IF(EQUAL(Timesheet!RC, ""), "", Timesheet!RC) -> 8004 | B28: =IF(EQUAL(Timesheet!RC, ""), "", Timesheet!RC) -> SEMINARS & TRAINING | C28: =IF(EQUAL(Timesheet!RC, ""), "", Timesheet!RC) -> Admin | D28: 0 | E28: 0 | F28: 0 | G28: 0 | H28: 0 | I28: 0 | J28: 0 | K28: 0 | L28: =SUM(RC[-8]:RC[-1]) -> 0
A29: =IF(EQUAL(Timesheet!RC, ""), "", Timesheet!RC) -> 8005 | B29: =IF(EQUAL(Timesheet!RC, ""), "", Timesheet!RC) -> PERSONAL (VACATION/AT) | C29: =IF(EQUAL(Timesheet!RC, ""), "", Timesheet!RC) -> Admin | D29: 0 | E29: 0 | F29: 0 | G29: 0 | H29: 0 | I29: 0 | J29: 0 | K29: 0 | L29: =SUM(RC[-8]:RC[-1]) -> 0
A30: =IF(EQUAL(Timesheet!RC, ""), "", Timesheet!RC) -> 8006 | B30: =IF(EQUAL(Timesheet!RC, ""), "", Timesheet!RC) -> SICK | C30: =IF(EQUAL(Timesheet!RC, ""), "", Timesheet!RC) -> Admin | D30: 0 | E30: 0 | F30: 0 | G30: 0 | H30: 0 | I30: 0 | J30: 0 | K30: 0 | L30: =SUM(RC[-8]:RC[-1]) -> 0
A31: =IF(EQUAL(Timesheet!RC, ""), "", Timesheet!RC) -> 8008 | B31: =IF(EQUAL(Timesheet!RC, ""), "", Timesheet!RC) -> RESEARCH | C31: =IF(EQUAL(Timesheet!RC, ""), "", Timesheet!RC) -> Non-Audit | D31: 0 | E31: 0 | F31: 0 | G31: 0 | H31: 0 | I31: 0 | J31: 0 | K31: 0 | L31: =SUM(RC[-8]:RC[-1]) -> 0
A32: =IF(EQUAL(Timesheet!RC, ""), "", Timesheet!RC) ->  | B32: =IF(EQUAL(Timesheet!RC, ""), "", Timesheet!RC) ->  | C32: =IF(EQUAL(Timesheet!RC, ""), "", Timesheet!RC) ->  | D32: 0 | E32: 0 | F32: 0 | G32: 0 | H32: 0 | I32: 0 | J32: 0 | K32: 0 | L32: =SUM(RC[-8]:RC[-1]) -> 0
A33: =IF(EQUAL(Timesheet!RC, ""), "", Timesheet!RC) ->  | B33: =IF(EQUAL(Timesheet!RC, ""), "", Timesheet!RC) ->  | C33: =IF(EQUAL(Timesheet!RC, ""), "", Timesheet!RC) ->  | D33: 0 | E33: 0 | F33: 0 | G33: 0 | H33: 0 | I33: 0 | J33: 0 | K33: 0 | L33: =SUM(RC[-8]:RC[-1]) -> 0
A34: =IF(EQUAL(Timesheet!RC, ""), "", Timesheet!RC) ->  | B34: =IF(EQUAL(Timesheet!RC, ""), "", Timesheet!RC) ->  | C34: =IF(EQUAL(Timesheet!RC, ""), "", Timesheet!RC) ->  | D34: 0 | E34: 0 | F34: 0 | G34: 0 | H34: 0 | I34: 0 | J34: 0 | K34: 0 | L34: =SUM(RC[-8]:RC[-1]) -> 0
A35: =IF(EQUAL(Timesheet!RC, ""), "", Timesheet!RC) ->  | B35: =IF(EQUAL(Timesheet!RC, ""), "", Timesheet!RC) ->  | C35: =IF(EQUAL(Timesheet!RC, ""), "", Timesheet!RC) ->  | D35: 0 | E35: 0 | F35: 0 | G35: 0 | H35: 0 | I35: 0 | J35: 0 | K35: 0 | L35: =SUM(RC[-8]:RC[-1]) -> 0
A36: =IF(EQUAL(Timesheet!RC, ""), "", Timesheet!RC) ->  | B36: =IF(EQUAL(Timesheet!RC, ""), "", Timesheet!RC) ->  | C36: =IF(EQUAL(Timesheet!RC, ""), "", Timesheet!RC) ->  | D36: 0 | E36: 0 | F36: 0 | G36: 0 | H36: 0 | I36: 0 | J36: 0 | K36: 0 | L36: =SUM(RC[-8]:RC[-1]) -> 0
A37: =IF(EQUAL(Timesheet!RC, ""), "", Timesheet!RC) ->  | B37: =IF(EQUAL(Timesheet!RC, ""), "", Timesheet!RC) ->  | C37: =IF(EQUAL(Timesheet!RC, ""), "", Timesheet!RC) ->  | D37: 0 | E37: 0 | F37: 0 | G37: 0 | H37: 0 | I37: 0 | J37: 0 | K37: 0 | L37: =SUM(RC[-8]:RC[-1]) -> 0
A38: =IF(EQUAL(Timesheet!RC, ""), "", Timesheet!RC) ->  | B38: =IF(EQUAL(Timesheet!RC, ""), "", Timesheet!RC) ->  | C38: =IF(EQUAL(Timesheet!RC, ""), "", Timesheet!RC) ->  | D38: 0 | E38: 0 | F38: 0 | G38: 0 | H38: 0 | I38: 0 | J38: 0 | K38: 0 | L38: =SUM(RC[-8]:RC[-1]) -> 0
A39: =IF(EQUAL(Timesheet!RC, ""), "", Timesheet!RC) ->  | B39: =IF(EQUAL(Timesheet!RC, ""), "", Timesheet!RC) ->  | C39: =IF(EQUAL(Timesheet!RC, ""), "", Timesheet!RC) ->  | D39: 0 | E39: 0 | F39: 0 | G39: 0 | H39: 0 | I39: 0 | J39: 0 | K39: 0 | L39: =SUM(RC[-8]:RC[-1]) -> 0
A40: =IF(EQUAL(Timesheet!RC, ""), "", Timesheet!RC) ->  | B40: =IF(EQUAL(Timesheet!RC, ""), "", Timesheet!RC) ->  | C40: =IF(EQUAL(Timesheet!RC, ""), "", Timesheet!RC) ->  | D40: 0 | E40: 0 | F40: 0 | G40: 0 | H40: 0 | I40: 0 | J40: 0 | K40: 0 | L40: =SUM(RC[-8]:RC[-1]) -> 0
A41: =IF(EQUAL(Timesheet!RC, ""), "", Timesheet!RC) ->  | B41: =IF(EQUAL(Timesheet!RC, ""), "", Timesheet!RC) ->  | C41: =IF(EQUAL(Timesheet!RC, ""), "", Timesheet!RC) ->  | D41: 0 | E41: 0 | F41: 0 | G41: 0 | H41: 0 | I41: 0 | J41: 0 | K41: 0 | L41: =SUM(RC[-8]:RC[-1]) -> 0
A42: =IF(EQUAL(Timesheet!RC, ""), "", Timesheet!RC) ->  | B42: =IF(EQUAL(Timesheet!RC, ""), "", Timesheet!RC) ->  | C42: =IF(EQUAL(Timesheet!RC, ""), "", Timesheet!RC) ->  | D42: 0 | E42: 0 | F42: 0 | G42: 0 | H42: 0 | I42: 0 | J42: 0 | K42: 0 | L42: =SUM(RC[-8]:RC[-1]) -> 0
A43: =IF(EQUAL(Timesheet!RC, ""), "", Timesheet!RC) ->  | B43: =IF(EQUAL(Timesheet!RC, ""), "", Timesheet!RC) ->  | C43: =IF(EQUAL(Timesheet!RC, ""), "", Timesheet!RC) ->  | D43: 0 | E43: 0 | F43: 0 | G43: 0 | H43: 0 | I43: 0 | J43: 0 | K43: 0 | L43: =SUM(RC[-8]:RC[-1]) -> 0
A44: =IF(EQUAL(Timesheet!RC, ""), "", Timesheet!RC) ->  | B44: =IF(EQUAL(Timesheet!RC, ""), "", Timesheet!RC) ->  | C44: =IF(EQUAL(Timesheet!RC, ""), "", Timesheet!RC) ->  | D44: 0 | E44: 0 | F44: 0 | G44: 0 | H44: 0 | I44: 0 | J44: 0 | K44: 0 | L44: =SUM(RC[-8]:RC[-1]) -> 0
A45: 9029 | B45: 'GIDEON PATT SPECIAL REQUEST - BONDS | C45: 'Mgmnt | D45: 0 | E45: 0 | F45: 0 | G45: 0 | H45: 0 | I45: 0 | J45: 0 | K45: 0 | L45: =SUM(RC[-8]:RC[-1]) -> 0
A46: =Timesheet!RC ->  | B46: =Timesheet!RC ->  | C46: =Timesheet!RC ->  | D46: 0 | E46: 0 | F46: 0 | G46: 0 | H46: 0 | I46: 0 | J46: 0 | K46: 0 | L46: =SUM(RC[-8]:RC[-1]) -> 0
A47: =Timesheet!RC ->  | B47: =Timesheet!RC ->  | C47: =Timesheet!RC ->  | D47: 0 | E47: 0 | F47: 0 | G47: 0 | H47: 0 | I47: 0 | J47: 0 | K47: 0 | L47: =SUM(RC[-8]:RC[-1]) -> 0
A48: =Timesheet!RC ->  | B48: =Timesheet!RC ->  | C48: =Timesheet!RC ->  | D48: 0 | E48: 0 | F48: 0 | G48: 0 | H48: 0 | I48: 0 | J48: 0 | K48: 0 | L48: =SUM(RC[-8]:RC[-1]) -> 0
A49: =Timesheet!RC ->  | B49: =Timesheet!RC ->  | C49: =Timesheet!RC ->  | D49: 0 | E49: 0 | F49: 0 | G49: 0 | H49: 0 | I49: 0 | J49: 0 | K49: 0 | L49: =SUM(RC[-8]:RC[-1]) -> 0
A50: =Timesheet!RC ->  | B50: =Timesheet!RC ->  | C50: =Timesheet!RC ->  | D50: 0 | E50: 0 | F50: 0 | G50: 0 | H50: 0 | I50: 0 | J50: 0 | K50: 0 | L50: =SUM(RC[-8]:RC[-1]) -> 0
A51: =Timesheet!RC ->  | B51: =Timesheet!RC ->  | C51: =Timesheet!RC ->  | D51: 0 | E51: 0 | F51: 0 | G51: 0 | H51: 0 | I51: 0 | J51: 0 | K51: 0 | L51: =SUM(RC[-8]:RC[-1]) -> 0
A52: =Timesheet!RC ->  | B52: =Timesheet!RC ->  | C52: =Timesheet!RC ->  | D52: 0 | E52: 0 | F52: 0 | G52: 0 | H52: 0 | I52: 0 | J52: 0 | K52: 0 | L52: =SUM(RC[-8]:RC[-1]) -> 0
A53: =Timesheet!RC ->  | B53: =Timesheet!RC ->  | C53: =Timesheet!RC ->  | D53: 0 | E53: 0 | F53: 0 | G53: 0 | H53: 0 | I53: 0 | J53: 0 | K53: 0 | L53: =SUM(RC[-8]:RC[-1]) -> 0
A54: 'TOTAL | D54: =SUM(R[-51]C:R[-1]C) -> 0 | E54: =SUM(R[-51]C:R[-1]C) -> 0 | F54: =SUM(R[-51]C:R[-1]C) -> 0 | G54: =SUM(R[-51]C:R[-1]C) -> 0 | H54: =SUM(R[-51]C:R[-1]C) -> 0 | I54: =SUM(R[-51]C:R[-1]C) -> 0 | J54: =SUM(R[-51]C:R[-1]C) -> 0 | K54: =SUM(R[-51]C:R[-1]C) -> 0 | L54: =SUM(R[-51]C:R[-1]C) -> 0

Sheet: September2000
A1: 'CODE | B1: 'AUDIT DESCRIPTION | C1: 'Category | D1: 'Week Ending
D2: =7+August2000!RC[+6] -> 36771 | F2: =RC[-2]+7 -> 36778 | H2: =RC[-2]+7 -> 36785 | J2: =RC[-2]+7 -> 36792 | L2: =RC[-2]+7 -> 36799 | N2: 'Total
A3: =IF(EQUAL(Timesheet!RC, ""), "", Timesheet!RC) -> 1001 | B3: =IF(EQUAL(Timesheet!RC, ""), "", Timesheet!RC) -> PURCHASING | C3: =IF(EQUAL(Timesheet!RC, ""), "", Timesheet!RC) -> Mgmnt | D3: 0 | E3: 0 | F3: 0 | G3: 0 | H3: 0 | I3: 0 | J3: 0 | K3: 0 | L3: 0 | M3: 0 | N3: =SUM(RC[-10]:RC[-2]) -> 0
A4: =IF(EQUAL(Timesheet!RC, ""), "", Timesheet!RC) -> 1002 | B4: =IF(EQUAL(Timesheet!RC, ""), "", Timesheet!RC) -> HUMAN RESOURCE | C4: =IF(EQUAL(Timesheet!RC, ""), "", Timesheet!RC) -> Plan | D4: 0 | E4: 0 | F4: 0 | G4: 0 | H4: 0 | I4: 0 | J4: 0 | K4: 0 | L4: 0 | M4: 0 | N4: =SUM(RC[-10]:RC[-2]) -> 0
A5: =IF(EQUAL(Timesheet!RC, ""), "", Timesheet!RC) -> 1005 | B5: =IF(EQUAL(Timesheet!RC, ""), "", Timesheet!RC) -> CORPORATE AUDIT RISK ANALYSIS | C5: =IF(EQUAL(Timesheet!RC, ""), "", Timesheet!RC) -> Plan | D5: 0 | E5: 0 | F5: 0 | G5: 0 | H5: 0 | I5: 0 | J5: 0 | K5: 0 | L5: 0 | M5: 0 | N5: =SUM(RC[-10]:RC[-2]) -> 0
A6: =IF(EQUAL(Timesheet!RC, ""), "", Timesheet!RC) -> 1007 | B6: =IF(EQUAL(Timesheet!RC, ""), "", Timesheet!RC) -> OFFICER'S TRAVEL & EXPENSE | C6: =IF(EQUAL(Timesheet!RC, ""), "", Timesheet!RC) -> Plan | D6: 0 | E6: 0 | F6: 0 | G6: 0 | H6: 0 | I6: 0 | J6: 0 | K6: 0 | L6: 0 | M6: 0 | N6: =SUM(RC[-10]:RC[-2]) -> 0
A7: =IF(EQUAL(Timesheet!RC, ""), "", Timesheet!RC) -> 1008 | B7: =IF(EQUAL(Timesheet!RC, ""), "", Timesheet!RC) -> RECORD RETENTION | C7: =IF(EQUAL(Timesheet!RC, ""), "", Timesheet!RC) -> Mgmnt | D7: 0 | E7: 0 | F7: 0 | G7: 0 | H7: 0 | I7: 0 | J7: 0 | K7: 0 | L7: 0 | M7: 0 | N7: =SUM(RC[-10]:RC[-2]) -> 0
A8: =IF(EQUAL(Timesheet!RC, ""), "", Timesheet!RC) -> 1009 | B8: =IF(EQUAL(Timesheet!RC, ""), "", Timesheet!RC) -> NASD AUDITS | C8: =IF(EQUAL(Timesheet!RC, ""), "", Timesheet!RC) -> Plan | D8: 0 | E8: 0 | F8: 0 | G8: 0 | H8: 0 | I8: 0 | J8: 0 | K8: 0 | L8: 0 | M8: 0 | N8: =SUM(RC[-10]:RC[-2]) -> 0
A9: =IF(EQUAL(Timesheet!RC, ""), "", Timesheet!RC) -> 1011 | B9: =IF(EQUAL(Timesheet!RC, ""), "", Timesheet!RC) -> SURPRISE CASH AUDIT - NEW YORK | C9: =IF(EQUAL(Timesheet!RC, ""), "", Timesheet!RC) -> Plan | D9: 0 | E9: 0 | F9: 0 | G9: 0 | H9: 0 | I9: 0 | J9: 0 | K9: 0 | L9: 0 | M9: 0 | N9: =SUM(RC[-10]:RC[-2]) -> 0
A10: =IF(EQUAL(Timesheet!RC, ""), "", Timesheet!RC) -> 1012 | B10: =IF(EQUAL(Timesheet!RC, ""), "", Timesheet!RC) -> INTERNATIONAL AUDIT - IBI | C10: =IF(EQUAL(Timesheet!RC, ""), "", Timesheet!RC) -> Plan | D10: 0 | E10: 0 | F10: 0 | G10: 0 | H10: 0 | I10: 0 | J10: 0 | K10: 0 | L10: 0 | M10: 0 | N10: =SUM(RC[-10]:RC[-2]) -> 0
A11: =IF(EQUAL(Timesheet!RC, ""), "", Timesheet!RC) -> 1013 | B11: =IF(EQUAL(Timesheet!RC, ""), "", Timesheet!RC) -> INTERNATIONAL AUDIT - CISL | C11: =IF(EQUAL(Timesheet!RC, ""), "", Timesheet!RC) -> Plan | D11: 0 | E11: 0 | F11: 0 | G11: 0 | H11: 0 | I11: 0 | J11: 0 | K11: 0 | L11: 0 | M11: 0 | N11: =SUM(RC[-10]:RC[-2]) -> 0
A12: =IF(EQUAL(Timesheet!RC, ""), "", Timesheet!RC) -> 1014 | B12: =IF(EQUAL(Timesheet!RC, ""), "", Timesheet!RC) -> MARKETING AND COMMUNICATION | C12: =IF(EQUAL(Timesheet!RC, ""), "", Timesheet!RC) -> Mgmnt | D12: 0 | E12: 0 | F12: 0 | G12: 0 | H12: 0 | I12: 0 | J12: 0 | K12: 0 | L12: 0 | M12: 0 | N12: =SUM(RC[-10]:RC[-2]) -> 0
A13: =IF(EQUAL(Timesheet!RC, ""), "", Timesheet!RC) -> 3001 | B13: =IF(EQUAL(Timesheet!RC, ""), "", Timesheet!RC) -> FIELD OFFICE CONTROL REVIEWS | C13: =IF(EQUAL(Timesheet!RC, ""), "", Timesheet!RC) -> Field | D13: 0 | E13: 0 | F13: 0 | G13: 0 | H13: 0 | I13: 0 | J13: 0 | K13: 0 | L13: 0 | M13: 0 | N13: =SUM(RC[-10]:RC[-2]) -> 0
A14: =IF(EQUAL(Timesheet!RC, ""), "", Timesheet!RC) -> 3002 | B14: =IF(EQUAL(Timesheet!RC, ""), "", Timesheet!RC) -> FIELD OFFICE ACCOUNTABILITY ANALYSIS | C14: =IF(EQUAL(Timesheet!RC, ""), "", Timesheet!RC) -> Field | D14: 0 | E14: 0 | F14: 0 | G14: 0 | H14: 0 | I14: 0 | J14: 0 | K14: 0 | L14: 0 | M14: 0 | N14: =SUM(RC[-10]:RC[-2]) -> 0
A15: =IF(EQUAL(Timesheet!RC, ""), "", Timesheet!RC) -> 3010 | B15: =IF(EQUAL(Timesheet!RC, ""), "", Timesheet!RC) -> FIELD OFFICE BANK RECONCILATIONS | C15: =IF(EQUAL(Timesheet!RC, ""), "", Timesheet!RC) -> Field | D15: 0 | E15: 0 | F15: 0 | G15: 0 | H15: 0 | I15: 0 | J15: 0 | K15: 0 | L15: 0 | M15: 0 | N15: =SUM(RC[-10]:RC[-2]) -> 0
A16: =IF(EQUAL(Timesheet!RC, ""), "", Timesheet!RC) -> 3020 | B16: =IF(EQUAL(Timesheet!RC, ""), "", Timesheet!RC) -> FIELD AUDIT PROGRAM DEVELOPMENT | C16: =IF(EQUAL(Timesheet!RC, ""), "", Timesheet!RC) -> Field | D16: 0 | E16: 0 | F16: 0 | G16: 0 | H16: 0 | I16: 0 | J16: 0 | K16: 0 | L16: 0 | M16: 0 | N16: =SUM(RC[-10]:RC[-2]) -> 0
A17: =IF(EQUAL(Timesheet!RC, ""), "", Timesheet!RC) -> 3030 | B17: =IF(EQUAL(Timesheet!RC, ""), "", Timesheet!RC) -> OPEN COMMITMENT ANALYSIS | C17: =IF(EQUAL(Timesheet!RC, ""), "", Timesheet!RC) -> Field | D17: 0 | E17: 0 | F17: 0 | G17: 0 | H17: 0 | I17: 0 | J17: 0 | K17: 0 | L17: 0 | M17: 0 | N17: =SUM(RC[-10]:RC[-2]) -> 0
A18: =IF(EQUAL(Timesheet!RC, ""), "", Timesheet!RC) -> 3040 | B18: =IF(EQUAL(Timesheet!RC, ""), "", Timesheet!RC) -> FIELD AUDIT RISK ASSESMENT | C18: =IF(EQUAL(Timesheet!RC, ""), "", Timesheet!RC) -> Field | D18: 0 | E18: 0 | F18: 0 | G18: 0 | H18: 0 | I18: 0 | J18: 0 | K18: 0 | L18: 0 | M18: 0 | N18: =SUM(RC[-10]:RC[-2]) -> 0
A19: =IF(EQUAL(Timesheet!RC, ""), "", Timesheet!RC) -> 3050 | B19: =IF(EQUAL(Timesheet!RC, ""), "", Timesheet!RC) -> NEW YORK FIELD AUDIT REVIEWS | C19: =IF(EQUAL(Timesheet!RC, ""), "", Timesheet!RC) -> Field | D19: 0 | E19: 0 | F19: 0 | G19: 0 | H19: 0 | I19: 0 | J19: 0 | K19: 0 | L19: 0 | M19: 0 | N19: =SUM(RC[-10]:RC[-2]) -> 0
A20: =IF(EQUAL(Timesheet!RC, ""), "", Timesheet!RC) -> 4001 | B20: =IF(EQUAL(Timesheet!RC, ""), "", Timesheet!RC) -> GRANT THORNTON | C20: =IF(EQUAL(Timesheet!RC, ""), "", Timesheet!RC) -> Mgmnt | D20: 0 | E20: 0 | F20: 0 | G20: 0 | H20: 0 | I20: 0 | J20: 0 | K20: 0 | L20: 0 | M20: 0 | N20: =SUM(RC[-10]:RC[-2]) -> 0
A21: =IF(EQUAL(Timesheet!RC, ""), "", Timesheet!RC) -> 5001 | B21: =IF(EQUAL(Timesheet!RC, ""), "", Timesheet!RC) -> MISCELLANEOUS AUDIT REQUESTS | C21: =IF(EQUAL(Timesheet!RC, ""), "", Timesheet!RC) -> Mgmnt | D21: 0 | E21: 0 | F21: 0 | G21: 0 | H21: 0 | I21: 0 | J21: 0 | K21: 0 | L21: 0 | M21: 0 | N21: =SUM(RC[-10]:RC[-2]) -> 0
A22: =IF(EQUAL(Timesheet!RC, ""), "", Timesheet!RC) -> 5009 | B22: =IF(EQUAL(Timesheet!RC, ""), "", Timesheet!RC) -> FORMS INVENTORY | C22: =IF(EQUAL(Timesheet!RC, ""), "", Timesheet!RC) -> Plan | D22: 0 | E22: 0 | F22: 0 | G22: 0 | H22: 0 | I22: 0 | J22: 0 | K22: 0 | L22: 0 | M22: 0 | N22: =SUM(RC[-10]:RC[-2]) -> 0
A23: =IF(EQUAL(Timesheet!RC, ""), "", Timesheet!RC) -> 5010 | B23: =IF(EQUAL(Timesheet!RC, ""), "", Timesheet!RC) -> SURPRISE CHECK VALIDATION | C23: =IF(EQUAL(Timesheet!RC, ""), "", Timesheet!RC) -> Plan | D23: 0 | E23: 0 | F23: 0 | G23: 0 | H23: 0 | I23: 0 | J23: 0 | K23: 0 | L23: 0 | M23: 0 | N23: =SUM(RC[-10]:RC[-2]) -> 0
A24: =IF(EQUAL(Timesheet!RC, ""), "", Timesheet!RC) -> 7000 | B24: =IF(EQUAL(Timesheet!RC, ""), "", Timesheet!RC) -> NON-PROJECT RELATED (MEETINGS) | C24: =IF(EQUAL(Timesheet!RC, ""), "", Timesheet!RC) -> Non-Audit | D24: 0 | E24: 0 | F24: 0 | G24: 0 | H24: 0 | I24: 0 | J24: 0 | K24: 0 | L24: 0 | M24: 0 | N24: =SUM(RC[-10]:RC[-2]) -> 0
A25: =IF(EQUAL(Timesheet!RC, ""), "", Timesheet!RC) -> 7003 | B25: =IF(EQUAL(Timesheet!RC, ""), "", Timesheet!RC) -> AUDIT COMMITTEE | C25: =IF(EQUAL(Timesheet!RC, ""), "", Timesheet!RC) -> Non-Audit | D25: 0 | E25: 0 | F25: 0 | G25: 0 | H25: 0 | I25: 0 | J25: 0 | K25: 0 | L25: 0 | M25: 0 | N25: =SUM(RC[-10]:RC[-2]) -> 0
A26: =IF(EQUAL(Timesheet!RC, ""), "", Timesheet!RC) -> 8001 | B26: =IF(EQUAL(Timesheet!RC, ""), "", Timesheet!RC) -> ADMINISTRATIVE - GENERAL | C26: =IF(EQUAL(Timesheet!RC, ""), "", Timesheet!RC) -> Admin | D26: 0 | E26: 0 | F26: 0 | G26: 0 | H26: 0 | I26: 0 | J26: 0 | K26: 0 | L26: 0 | M26: 0 | N26: =SUM(RC[-10]:RC[-2]) -> 0
A27: =IF(EQUAL(Timesheet!RC, ""), "", Timesheet!RC) -> 8002 | B27: =IF(EQUAL(Timesheet!RC, ""), "", Timesheet!RC) -> HOLIDAYS | C27: =IF(EQUAL(Timesheet!RC, ""), "", Timesheet!RC) -> Admin | D27: 0 | E27: 0 | F27: 0 | G27: 0 | H27: 0 | I27: 0 | J27: 0 | K27: 0 | L27: 0 | M27: 0 | N27: =SUM(RC[-10]:RC[-2]) -> 0
A28: =IF(EQUAL(Timesheet!RC, ""), "", Timesheet!RC) -> 8004 | B28: =IF(EQUAL(Timesheet!RC, ""), "", Timesheet!RC) -> SEMINARS & TRAINING | C28: =IF(EQUAL(Timesheet!RC, ""), "", Timesheet!RC) -> Admin | D28: 0 | E28: 0 | F28: 0 | G28: 0 | H28: 0 | I28: 0 | J28: 0 | K28: 0 | L28: 0 | M28: 0 | N28: =SUM(RC[-10]:RC[-2]) -> 0
A29: =IF(EQUAL(Timesheet!RC, ""), "", Timesheet!RC) -> 8005 | B29: =IF(EQUAL(Timesheet!RC, ""), "", Timesheet!RC) -> PERSONAL (VACATION/AT) | C29: =IF(EQUAL(Timesheet!RC, ""), "", Timesheet!RC) -> Admin | D29: 0 | E29: 0 | F29: 0 | G29: 0 | H29: 0 | I29: 0 | J29: 0 | K29: 0 | L29: 0 | M29: 0 | N29: =SUM(RC[-10]:RC[-2]) -> 0
A30: =IF(EQUAL(Timesheet!RC, ""), "", Timesheet!RC) -> 8006 | B30: =IF(EQUAL(Timesheet!RC, ""), "", Timesheet!RC) -> SICK | C30: =IF(EQUAL(Timesheet!RC, ""), "", Timesheet!RC) -> Admin | D30: 0 | E30: 0 | F30: 0 | G30: 0 | H30: 0 | I30: 0 | J30: 0 | K30: 0 | L30: 0 | M30: 0 | N30: =SUM(RC[-10]:RC[-2]) -> 0
A31: =IF(EQUAL(Timesheet!RC, ""), "", Timesheet!RC) -> 8008 | B31: =IF(EQUAL(Timesheet!RC, ""), "", Timesheet!RC) -> RESEARCH | C31: =IF(EQUAL(Timesheet!RC, ""), "", Timesheet!RC) -> Non-Audit | D31: 0 | E31: 0 | F31: 0 | G31: 0 | H31: 0 | I31: 0 | J31: 0 | K31: 0 | L31: 0 | M31: 0 | N31: =SUM(RC[-10]:RC[-2]) -> 0
A32: =IF(EQUAL(Timesheet!RC, ""), "", Timesheet!RC) ->  | B32: =IF(EQUAL(Timesheet!RC, ""), "", Timesheet!RC) ->  | C32: =IF(EQUAL(Timesheet!RC, ""), "", Timesheet!RC) ->  | D32: 0 | E32: 0 | F32: 0 | G32: 0 | H32: 0 | I32: 0 | J32: 0 | K32: 0 | L32: 0 | M32: 0 | N32: =SUM(RC[-10]:RC[-2]) -> 0
A33: =IF(EQUAL(Timesheet!RC, ""), "", Timesheet!RC) ->  | B33: =IF(EQUAL(Timesheet!RC, ""), "", Timesheet!RC) ->  | C33: =IF(EQUAL(Timesheet!RC, ""), "", Timesheet!RC) ->  | D33: 0 | E33: 0 | F33: 0 | G33: 0 | H33: 0 | I33: 0 | J33: 0 | K33: 0 | L33: 0 | M33: 0 | N33: =SUM(RC[-10]:RC[-2]) -> 0
A34: =IF(EQUAL(Timesheet!RC, ""), "", Timesheet!RC) ->  | B34: =IF(EQUAL(Timesheet!RC, ""), "", Timesheet!RC) ->  | C34: =IF(EQUAL(Timesheet!RC, ""), "", Timesheet!RC) ->  | D34: 0 | E34: 0 | F34: 0 | G34: 0 | H34: 0 | I34: 0 | J34: 0 | K34: 0 | L34: 0 | M34: 0 | N34: =SUM(RC[-10]:RC[-2]) -> 0
A35: =IF(EQUAL(Timesheet!RC, ""), "", Timesheet!RC) ->  | B35: =IF(EQUAL(Timesheet!RC, ""), "", Timesheet!RC) ->  | C35: =IF(EQUAL(Timesheet!RC, ""), "", Timesheet!RC) ->  | D35: 0 | E35: 0 | F35: 0 | G35: 0 | H35: 0 | I35: 0 | J35: 0 | K35: 0 | L35: 0 | M35: 0 | N35: =SUM(RC[-10]:RC[-2]) -> 0
A36: =IF(EQUAL(Timesheet!RC, ""), "", Timesheet!RC) ->  | B36: =IF(EQUAL(Timesheet!RC, ""), "", Timesheet!RC) ->  | C36: =IF(EQUAL(Timesheet!RC, ""), "", Timesheet!RC) ->  | D36: 0 | E36: 0 | F36: 0 | G36: 0 | H36: 0 | I36: 0 | J36: 0 | K36: 0 | L36: 0 | M36: 0 | N36: =SUM(RC[-10]:RC[-2]) -> 0
A37: =IF(EQUAL(Timesheet!RC, ""), "", Timesheet!RC) ->  | B37: =IF(EQUAL(Timesheet!RC, ""), "", Timesheet!RC) ->  | C37: =IF(EQUAL(Timesheet!RC, ""), "", Timesheet!RC) ->  | D37: 0 | E37: 0 | F37: 0 | G37: 0 | H37: 0 | I37: 0 | J37: 0 | K37: 0 | L37: 0 | M37: 0 | N37: =SUM(RC[-10]:RC[-2]) -> 0
A38: =IF(EQUAL(Timesheet!RC, ""), "", Timesheet!RC) ->  | B38: =IF(EQUAL(Timesheet!RC, ""), "", Timesheet!RC) ->  | C38: =IF(EQUAL(Timesheet!RC, ""), "", Timesheet!RC) ->  | D38: 0 | E38: 0 | F38: 0 | G38: 0 | H38: 0 | I38: 0 | J38: 0 | K38: 0 | L38: 0 | M38: 0 | N38: =SUM(RC[-10]:RC[-2]) -> 0
A39: =IF(EQUAL(Timesheet!RC, ""), "", Timesheet!RC) ->  | B39: =IF(EQUAL(Timesheet!RC, ""), "", Timesheet!RC) ->  | C39: =IF(EQUAL(Timesheet!RC, ""), "", Timesheet!RC) ->  | D39: 0 | E39: 0 | F39: 0 | G39: 0 | H39: 0 | I39: 0 | J39: 0 | K39: 0 | L39: 0 | M39: 0 | N39: =SUM(RC[-10]:RC[-2]) -> 0
A40: =IF(EQUAL(Timesheet!RC, ""), "", Timesheet!RC) ->  | B40: =IF(EQUAL(Timesheet!RC, ""), "", Timesheet!RC) ->  | C40: =IF(EQUAL(Timesheet!RC, ""), "", Timesheet!RC) ->  | D40: 0 | E40: 0 | F40: 0 | G40: 0 | H40: 0 | I40: 0 | J40: 0 | K40: 0 | L40: 0 | M40: 0 | N40: =SUM(RC[-10]:RC[-2]) -> 0
A41: =IF(EQUAL(Timesheet!RC, ""), "", Timesheet!RC) ->  | B41: =IF(EQUAL(Timesheet!RC, ""), "", Timesheet!RC) ->  | C41: =IF(EQUAL(Timesheet!RC, ""), "", Timesheet!RC) ->  | D41: 0 | E41: 0 | F41: 0 | G41: 0 | H41: 0 | I41: 0 | J41: 0 | K41: 0 | L41: 0 | M41: 0 | N41: =SUM(RC[-10]:RC[-2]) -> 0
A42: =IF(EQUAL(Timesheet!RC, ""), "", Timesheet!RC) ->  | B42: =IF(EQUAL(Timesheet!RC, ""), "", Timesheet!RC) ->  | C42: =IF(EQUAL(Timesheet!RC, ""), "", Timesheet!RC) ->  | D42: 0 | E42: 0 | F42: 0 | G42: 0 | H42: 0 | I42: 0 | J42: 0 | K42: 0 | L42: 0 | M42: 0 | N42: =SUM(RC[-10]:RC[-2]) -> 0
A43: =IF(EQUAL(Timesheet!RC, ""), "", Timesheet!RC) ->  | B43: =IF(EQUAL(Timesheet!RC, ""), "", Timesheet!RC) ->  | C43: =IF(EQUAL(Timesheet!RC, ""), "", Timesheet!RC) ->  | D43: 0 | E43: 0 | F43: 0 | G43: 0 | H43: 0 | I43: 0 | J43: 0 | K43: 0 | L43: 0 | M43: 0 | N43: =SUM(RC[-10]:RC[-2]) -> 0
A44: =IF(EQUAL(Timesheet!RC, ""), "", Timesheet!RC) ->  | B44: =IF(EQUAL(Timesheet!RC, ""), "", Timesheet!RC) ->  | C44: =IF(EQUAL(Timesheet!RC, ""), "", Timesheet!RC) ->  | D44: 0 | E44: 0 | F44: 0 | G44: 0 | H44: 0 | I44: 0 | J44: 0 | K44: 0 | L44: 0 | M44: 0 | N44: =SUM(RC[-10]:RC[-2]) -> 0
A45: 9029 | B45: 'GIDEON PATT SPECIAL REQUEST - BONDS | C45: 'Mgmnt | D45: 0 | E45: 0 | F45: 0 | G45: 0 | H45: 0 | I45: 0 | J45: 0 | K45: 0 | L45: 0 | M45: 0 | N45: =SUM(RC[-10]:RC[-2]) -> 0
A46: =Timesheet!RC ->  | B46: =Timesheet!RC ->  | C46: =Timesheet!RC ->  | D46: 0 | E46: 0 | F46: 0 | G46: 0 | H46: 0 | I46: 0 | J46: 0 | K46: 0 | L46: 0 | M46: 0 | N46: =SUM(RC[-10]:RC[-2]) -> 0
A47: =Timesheet!RC ->  | B47: =Timesheet!RC ->  | C47: =Timesheet!RC ->  | D47: 0 | E47: 0 | F47: 0 | G47: 0 | H47: 0 | I47: 0 | J47: 0 | K47: 0 | L47: 0 | M47: 0 | N47: =SUM(RC[-10]:RC[-2]) -> 0
A48: =Timesheet!RC ->  | B48: =Timesheet!RC ->  | C48: =Timesheet!RC ->  | D48: 0 | E48: 0 | F48: 0 | G48: 0 | H48: 0 | I48: 0 | J48: 0 | K48: 0 | L48: 0 | M48: 0 | N48: =SUM(RC[-10]:RC[-2]) -> 0
A49: =Timesheet!RC ->  | B49: =Timesheet!RC ->  | C49: =Timesheet!RC ->  | D49: 0 | E49: 0 | F49: 0 | G49: 0 | H49: 0 | I49: 0 | J49: 0 | K49: 0 | L49: 0 | M49: 0 | N49: =SUM(RC[-10]:RC[-2]) -> 0
A50: =Timesheet!RC ->  | B50: =Timesheet!RC ->  | C50: =Timesheet!RC ->  | D50: 0 | E50: 0 | F50: 0 | G50: 0 | H50: 0 | I50: 0 | J50: 0 | K50: 0 | L50: 0 | M50: 0 | N50: =SUM(RC[-10]:RC[-2]) -> 0
A51: =Timesheet!RC ->  | B51: =Timesheet!RC ->  | C51: =Timesheet!RC ->  | D51: 0 | E51: 0 | F51: 0 | G51: 0 | H51: 0 | I51: 0 | J51: 0 | K51: 0 | L51: 0 | M51: 0 | N51: =SUM(RC[-10]:RC[-2]) -> 0
A52: =Timesheet!RC ->  | B52: =Timesheet!RC ->  | C52: =Timesheet!RC ->  | D52: 0 | E52: 0 | F52: 0 | G52: 0 | H52: 0 | I52: 0 | J52: 0 | K52: 0 | L52: 0 | M52: 0 | N52: =SUM(RC[-10]:RC[-2]) -> 0
A53: =Timesheet!RC ->  | B53: =Timesheet!RC ->  | C53: =Timesheet!RC ->  | D53: 0 | E53: 0 | F53: 0 | G53: 0 | H53: 0 | I53: 0 | J53: 0 | K53: 0 | L53: 0 | M53: 0 | N53: =SUM(RC[-10]:RC[-2]) -> 0
A54: 'TOTAL | D54: =SUM(R[-51]C:R[-1]C) -> 0 | E54: =SUM(R[-51]C:R[-1]C) -> 0 | F54: =SUM(R[-51]C:R[-1]C) -> 0 | G54: =SUM(R[-51]C:R[-1]C) -> 0 | H54: =SUM(R[-51]C:R[-1]C) -> 0 | I54: =SUM(R[-51]C:R[-1]C) -> 0 | J54: =SUM(R[-51]C:R[-1]C) -> 0 | K54: =SUM(R[-51]C:R[-1]C) -> 0 | L54: =SUM(R[-51]C:R[-1]C) -> 0 | M54: =SUM(R[-51]C:R[-1]C) -> 0 | N54: =SUM(R[-51]C:R[-1]C) -> 0

Sheet: October2000
A1: 'CODE | B1: 'AUDIT DESCRIPTION | C1: 'Category | D1: 'Week Ending
D2: =7+September2000!RC[+8] -> 36806 | E2: 'Susan | F2: =RC[-2]+7 -> 36813 | G2: =RC[-2] -> Susan | H2: =RC[-2]+7 -> 36820 | I2: =RC[-2] -> Susan | J2: =RC[-2]+7 -> 36827 | K2: =RC[-2] -> Susan | L2: 'Total
A3: =IF(EQUAL(Timesheet!RC, ""), "", Timesheet!RC) -> 1001 | B3: =IF(EQUAL(Timesheet!RC, ""), "", Timesheet!RC) -> PURCHASING | C3: =IF(EQUAL(Timesheet!RC, ""), "", Timesheet!RC) -> Mgmnt | D3: 0 | E3: 0 | F3: 0 | G3: 0 | H3: 0 | I3: 0 | J3: 0 | K3: 0 | L3: =SUM(RC[-8]:RC[-1]) -> 0
A4: =IF(EQUAL(Timesheet!RC, ""), "", Timesheet!RC) -> 1002 | B4: =IF(EQUAL(Timesheet!RC, ""), "", Timesheet!RC) -> HUMAN RESOURCE | C4: =IF(EQUAL(Timesheet!RC, ""), "", Timesheet!RC) -> Plan | D4: 0 | E4: 0 | F4: 0 | G4: 0 | H4: 0 | I4: 0 | J4: 0 | K4: 0 | L4: =SUM(RC[-8]:RC[-1]) -> 0
A5: =IF(EQUAL(Timesheet!RC, ""), "", Timesheet!RC) -> 1005 | B5: =IF(EQUAL(Timesheet!RC, ""), "", Timesheet!RC) -> CORPORATE AUDIT RISK ANALYSIS | C5: =IF(EQUAL(Timesheet!RC, ""), "", Timesheet!RC) -> Plan | D5: 0 | E5: 0 | F5: 0 | G5: 0 | H5: 0 | I5: 0 | J5: 0 | K5: 0 | L5: =SUM(RC[-8]:RC[-1]) -> 0
A6: =IF(EQUAL(Timesheet!RC, ""), "", Timesheet!RC) -> 1007 | B6: =IF(EQUAL(Timesheet!RC, ""), "", Timesheet!RC) -> OFFICER'S TRAVEL & EXPENSE | C6: =IF(EQUAL(Timesheet!RC, ""), "", Timesheet!RC) -> Plan | D6: 0 | E6: 0 | F6: 0 | G6: 0 | H6: 0 | I6: 0 | J6: 0 | K6: 0 | L6: =SUM(RC[-8]:RC[-1]) -> 0
A7: =IF(EQUAL(Timesheet!RC, ""), "", Timesheet!RC) -> 1008 | B7: =IF(EQUAL(Timesheet!RC, ""), "", Timesheet!RC) -> RECORD RETENTION | C7: =IF(EQUAL(Timesheet!RC, ""), "", Timesheet!RC) -> Mgmnt | D7: 0 | E7: 0 | F7: 0 | G7: 0 | H7: 0 | I7: 0 | J7: 0 | K7: 0 | L7: =SUM(RC[-8]:RC[-1]) -> 0
A8: =IF(EQUAL(Timesheet!RC, ""), "", Timesheet!RC) -> 1009 | B8: =IF(EQUAL(Timesheet!RC, ""), "", Timesheet!RC) -> NASD AUDITS | C8: =IF(EQUAL(Timesheet!RC, ""), "", Timesheet!RC) -> Plan | D8: 0 | E8: 0 | F8: 0 | G8: 0 | H8: 0 | I8: 0 | J8: 0 | K8: 0 | L8: =SUM(RC[-8]:RC[-1]) -> 0
A9: =IF(EQUAL(Timesheet!RC, ""), "", Timesheet!RC) -> 1011 | B9: =IF(EQUAL(Timesheet!RC, ""), "", Timesheet!RC) -> SURPRISE CASH AUDIT - NEW YORK | C9: =IF(EQUAL(Timesheet!RC, ""), "", Timesheet!RC) -> Plan | D9: 0 | E9: 0 | F9: 0 | G9: 0 | H9: 0 | I9: 0 | J9: 0 | K9: 0 | L9: =SUM(RC[-8]:RC[-1]) -> 0
A10: =IF(EQUAL(Timesheet!RC, ""), "", Timesheet!RC) -> 1012 | B10: =IF(EQUAL(Timesheet!RC, ""), "", Timesheet!RC) -> INTERNATIONAL AUDIT - IBI | C10: =IF(EQUAL(Timesheet!RC, ""), "", Timesheet!RC) -> Plan | D10: 0 | E10: 0 | F10: 0 | G10: 0 | H10: 0 | I10: 0 | J10: 0 | K10: 0 | L10: =SUM(RC[-8]:RC[-1]) -> 0
A11: =IF(EQUAL(Timesheet!RC, ""), "", Timesheet!RC) -> 1013 | B11: =IF(EQUAL(Timesheet!RC, ""), "", Timesheet!RC) -> INTERNATIONAL AUDIT - CISL | C11: =IF(EQUAL(Timesheet!RC, ""), "", Timesheet!RC) -> Plan | D11: 0 | E11: 0 | F11: 0 | G11: 0 | H11: 0 | I11: 0 | J11: 0 | K11: 0 | L11: =SUM(RC[-8]:RC[-1]) -> 0
A12: =IF(EQUAL(Timesheet!RC, ""), "", Timesheet!RC) -> 1014 | B12: =IF(EQUAL(Timesheet!RC, ""), "", Timesheet!RC) -> MARKETING AND COMMUNICATION | C12: =IF(EQUAL(Timesheet!RC, ""), "", Timesheet!RC) -> Mgmnt | D12: 0 | E12: 0 | F12: 0 | G12: 0 | H12: 0 | I12: 0 | J12: 0 | K12: 0 | L12: =SUM(RC[-8]:RC[-1]) -> 0
A13: =IF(EQUAL(Timesheet!RC, ""), "", Timesheet!RC) -> 3001 | B13: =IF(EQUAL(Timesheet!RC, ""), "", Timesheet!RC) -> FIELD OFFICE CONTROL REVIEWS | C13: =IF(EQUAL(Timesheet!RC, ""), "", Timesheet!RC) -> Field | D13: 0 | E13: 0 | F13: 0 | G13: 0 | H13: 0 | I13: 0 | J13: 0 | K13: 0 | L13: =SUM(RC[-8]:RC[-1]) -> 0
A14: =IF(EQUAL(Timesheet!RC, ""), "", Timesheet!RC) -> 3002 | B14: =IF(EQUAL(Timesheet!RC, ""), "", Timesheet!RC) -> FIELD OFFICE ACCOUNTABILITY ANALYSIS | C14: =IF(EQUAL(Timesheet!RC, ""), "", Timesheet!RC) -> Field | D14: 0 | E14: 0 | F14: 0 | G14: 0 | H14: 0 | I14: 0 | J14: 0 | K14: 0 | L14: =SUM(RC[-8]:RC[-1]) -> 0
A15: =IF(EQUAL(Timesheet!RC, ""), "", Timesheet!RC) -> 3010 | B15: =IF(EQUAL(Timesheet!RC, ""), "", Timesheet!RC) -> FIELD OFFICE BANK RECONCILATIONS | C15: =IF(EQUAL(Timesheet!RC, ""), "", Timesheet!RC) -> Field | D15: 0 | E15: 0 | F15: 0 | G15: 0 | H15: 0 | I15: 0 | J15: 0 | K15: 0 | L15: =SUM(RC[-8]:RC[-1]) -> 0
A16: =IF(EQUAL(Timesheet!RC, ""), "", Timesheet!RC) -> 3020 | B16: =IF(EQUAL(Timesheet!RC, ""), "", Timesheet!RC) -> FIELD AUDIT PROGRAM DEVELOPMENT | C16: =IF(EQUAL(Timesheet!RC, ""), "", Timesheet!RC) -> Field | D16: 0 | E16: 0 | F16: 0 | G16: 0 | H16: 0 | I16: 0 | J16: 0 | K16: 0 | L16: =SUM(RC[-8]:RC[-1]) -> 0
A17: =IF(EQUAL(Timesheet!RC, ""), "", Timesheet!RC) -> 3030 | B17: =IF(EQUAL(Timesheet!RC, ""), "", Timesheet!RC) -> OPEN COMMITMENT ANALYSIS | C17: =IF(EQUAL(Timesheet!RC, ""), "", Timesheet!RC) -> Field | D17: 0 | E17: 0 | F17: 0 | G17: 0 | H17: 0 | I17: 0 | J17: 0 | K17: 0 | L17: =SUM(RC[-8]:RC[-1]) -> 0
A18: =IF(EQUAL(Timesheet!RC, ""), "", Timesheet!RC) -> 3040 | B18: =IF(EQUAL(Timesheet!RC, ""), "", Timesheet!RC) -> FIELD AUDIT RISK ASSESMENT | C18: =IF(EQUAL(Timesheet!RC, ""), "", Timesheet!RC) -> Field | D18: 0 | E18: 0 | F18: 0 | G18: 0 | H18: 0 | I18: 0 | J18: 0 | K18: 0 | L18: =SUM(RC[-8]:RC[-1]) -> 0
A19: =IF(EQUAL(Timesheet!RC, ""), "", Timesheet!RC) -> 3050 | B19: =IF(EQUAL(Timesheet!RC, ""), "", Timesheet!RC) -> NEW YORK FIELD AUDIT REVIEWS | C19: =IF(EQUAL(Timesheet!RC, ""), "", Timesheet!RC) -> Field | D19: 0 | E19: 0 | F19: 0 | G19: 0 | H19: 0 | I19: 0 | J19: 0 | K19: 0 | L19: =SUM(RC[-8]:RC[-1]) -> 0
A20: =IF(EQUAL(Timesheet!RC, ""), "", Timesheet!RC) -> 4001 | B20: =IF(EQUAL(Timesheet!RC, ""), "", Timesheet!RC) -> GRANT THORNTON | C20: =IF(EQUAL(Timesheet!RC, ""), "", Timesheet!RC) -> Mgmnt | D20: 0 | E20: 0 | F20: 0 | G20: 0 | H20: 0 | I20: 0 | J20: 0 | K20: 0 | L20: =SUM(RC[-8]:RC[-1]) -> 0
A21: =IF(EQUAL(Timesheet!RC, ""), "", Timesheet!RC) -> 5001 | B21: =IF(EQUAL(Timesheet!RC, ""), "", Timesheet!RC) -> MISCELLANEOUS AUDIT REQUESTS | C21: =IF(EQUAL(Timesheet!RC, ""), "", Timesheet!RC) -> Mgmnt | D21: 0 | E21: 0 | F21: 0 | G21: 0 | H21: 0 | I21: 0 | J21: 0 | K21: 0 | L21: =SUM(RC[-8]:RC[-1]) -> 0
A22: =IF(EQUAL(Timesheet!RC, ""), "", Timesheet!RC) -> 5009 | B22: =IF(EQUAL(Timesheet!RC, ""), "", Timesheet!RC) -> FORMS INVENTORY | C22: =IF(EQUAL(Timesheet!RC, ""), "", Timesheet!RC) -> Plan | D22: 0 | E22: 0 | F22: 0 | G22: 0 | H22: 0 | I22: 0 | J22: 0 | K22: 0 | L22: =SUM(RC[-8]:RC[-1]) -> 0
A23: =IF(EQUAL(Timesheet!RC, ""), "", Timesheet!RC) -> 5010 | B23: =IF(EQUAL(Timesheet!RC, ""), "", Timesheet!RC) -> SURPRISE CHECK VALIDATION | C23: =IF(EQUAL(Timesheet!RC, ""), "", Timesheet!RC) -> Plan | D23: 0 | E23: 0 | F23: 0 | G23: 0 | H23: 0 | I23: 0 | J23: 0 | K23: 0 | L23: =SUM(RC[-8]:RC[-1]) -> 0
A24: =IF(EQUAL(Timesheet!RC, ""), "", Timesheet!RC) -> 7000 | B24: =IF(EQUAL(Timesheet!RC, ""), "", Timesheet!RC) -> NON-PROJECT RELATED (MEETINGS) | C24: =IF(EQUAL(Timesheet!RC, ""), "", Timesheet!RC) -> Non-Audit | D24: 0 | E24: 0 | F24: 0 | G24: 0 | H24: 0 | I24: 0 | J24: 0 | K24: 0 | L24: =SUM(RC[-8]:RC[-1]) -> 0
A25: =IF(EQUAL(Timesheet!RC, ""), "", Timesheet!RC) -> 7003 | B25: =IF(EQUAL(Timesheet!RC, ""), "", Timesheet!RC) -> AUDIT COMMITTEE | C25: =IF(EQUAL(Timesheet!RC, ""), "", Timesheet!RC) -> Non-Audit | D25: 0 | E25: 0 | F25: 0 | G25: 0 | H25: 0 | I25: 0 | J25: 0 | K25: 0 | L25: =SUM(RC[-8]:RC[-1]) -> 0
A26: =IF(EQUAL(Timesheet!RC, ""), "", Timesheet!RC) -> 8001 | B26: =IF(EQUAL(Timesheet!RC, ""), "", Timesheet!RC) -> ADMINISTRATIVE - GENERAL | C26: =IF(EQUAL(Timesheet!RC, ""), "", Timesheet!RC) -> Admin | D26: 0 | E26: 0 | F26: 0 | G26: 0 | H26: 0 | I26: 0 | J26: 0 | K26: 0 | L26: =SUM(RC[-8]:RC[-1]) -> 0
A27: =IF(EQUAL(Timesheet!RC, ""), "", Timesheet!RC) -> 8002 | B27: =IF(EQUAL(Timesheet!RC, ""), "", Timesheet!RC) -> HOLIDAYS | C27: =IF(EQUAL(Timesheet!RC, ""), "", Timesheet!RC) -> Admin | D27: 0 | E27: 0 | F27: 0 | G27: 0 | H27: 0 | I27: 0 | J27: 0 | K27: 0 | L27: =SUM(RC[-8]:RC[-1]) -> 0
A28: =IF(EQUAL(Timesheet!RC, ""), "", Timesheet!RC) -> 8004 | B28: =IF(EQUAL(Timesheet!RC, ""), "", Timesheet!RC) -> SEMINARS & TRAINING | C28: =IF(EQUAL(Timesheet!RC, ""), "", Timesheet!RC) -> Admin | D28: 0 | E28: 0 | F28: 0 | G28: 0 | H28: 0 | I28: 0 | J28: 0 | K28: 0 | L28: =SUM(RC[-8]:RC[-1]) -> 0
A29: =IF(EQUAL(Timesheet!RC, ""), "", Timesheet!RC) -> 8005 | B29: =IF(EQUAL(Timesheet!RC, ""), "", Timesheet!RC) -> PERSONAL (VACATION/AT) | C29: =IF(EQUAL(Timesheet!RC, ""), "", Timesheet!RC) -> Admin | D29: 0 | E29: 0 | F29: 0 | G29: 0 | H29: 0 | I29: 0 | J29: 0 | K29: 0 | L29: =SUM(RC[-8]:RC[-1]) -> 0
A30: =IF(EQUAL(Timesheet!RC, ""), "", Timesheet!RC) -> 8006 | B30: =IF(EQUAL(Timesheet!RC, ""), "", Timesheet!RC) -> SICK | C30: =IF(EQUAL(Timesheet!RC, ""), "", Timesheet!RC) -> Admin | D30: 0 | E30: 0 | F30: 0 | G30: 0 | H30: 0 | I30: 0 | J30: 0 | K30: 0 | L30: =SUM(RC[-8]:RC[-1]) -> 0
A31: =IF(EQUAL(Timesheet!RC, ""), "", Timesheet!RC) -> 8008 | B31: =IF(EQUAL(Timesheet!RC, ""), "", Timesheet!RC) -> RESEARCH | C31: =IF(EQUAL(Timesheet!RC, ""), "", Timesheet!RC) -> Non-Audit | D31: 0 | E31: 0 | F31: 0 | G31: 0 | H31: 0 | I31: 0 | J31: 0 | K31: 0 | L31: =SUM(RC[-8]:RC[-1]) -> 0
A32: =IF(EQUAL(Timesheet!RC, ""), "", Timesheet!RC) ->  | B32: =IF(EQUAL(Timesheet!RC, ""), "", Timesheet!RC) ->  | C32: =IF(EQUAL(Timesheet!RC, ""), "", Timesheet!RC) ->  | D32: 0 | E32: 0 | F32: 0 | G32: 0 | H32: 0 | I32: 0 | J32: 0 | K32: 0 | L32: =SUM(RC[-8]:RC[-1]) -> 0
A33: =IF(EQUAL(Timesheet!RC, ""), "", Timesheet!RC) ->  | B33: =IF(EQUAL(Timesheet!RC, ""), "", Timesheet!RC) ->  | C33: =IF(EQUAL(Timesheet!RC, ""), "", Timesheet!RC) ->  | D33: 0 | E33: 0 | F33: 0 | G33: 0 | H33: 0 | I33: 0 | J33: 0 | K33: 0 | L33: =SUM(RC[-8]:RC[-1]) -> 0
A34: =IF(EQUAL(Timesheet!RC, ""), "", Timesheet!RC) ->  | B34: =IF(EQUAL(Timesheet!RC, ""), "", Timesheet!RC) ->  | C34: =IF(EQUAL(Timesheet!RC, ""), "", Timesheet!RC) ->  | D34: 0 | E34: 0 | F34: 0 | G34: 0 | H34: 0 | I34: 0 | J34: 0 | K34: 0 | L34: =SUM(RC[-8]:RC[-1]) -> 0
A35: =IF(EQUAL(Timesheet!RC, ""), "", Timesheet!RC) ->  | B35: =IF(EQUAL(Timesheet!RC, ""), "", Timesheet!RC) ->  | C35: =IF(EQUAL(Timesheet!RC, ""), "", Timesheet!RC) ->  | D35: 0 | E35: 0 | F35: 0 | G35: 0 | H35: 0 | I35: 0 | J35: 0 | K35: 0 | L35: =SUM(RC[-8]:RC[-1]) -> 0
A36: =IF(EQUAL(Timesheet!RC, ""), "", Timesheet!RC) ->  | B36: =IF(EQUAL(Timesheet!RC, ""), "", Timesheet!RC) ->  | C36: =IF(EQUAL(Timesheet!RC, ""), "", Timesheet!RC) ->  | D36: 0 | E36: 0 | F36: 0 | G36: 0 | H36: 0 | I36: 0 | J36: 0 | K36: 0 | L36: =SUM(RC[-8]:RC[-1]) -> 0
A37: =IF(EQUAL(Timesheet!RC, ""), "", Timesheet!RC) ->  | B37: =IF(EQUAL(Timesheet!RC, ""), "", Timesheet!RC) ->  | C37: =IF(EQUAL(Timesheet!RC, ""), "", Timesheet!RC) ->  | D37: 0 | E37: 0 | F37: 0 | G37: 0 | H37: 0 | I37: 0 | J37: 0 | K37: 0 | L37: =SUM(RC[-8]:RC[-1]) -> 0
A38: =IF(EQUAL(Timesheet!RC, ""), "", Timesheet!RC) ->  | B38: =IF(EQUAL(Timesheet!RC, ""), "", Timesheet!RC) ->  | C38: =IF(EQUAL(Timesheet!RC, ""), "", Timesheet!RC) ->  | D38: 0 | E38: 0 | F38: 0 | G38: 0 | H38: 0 | I38: 0 | J38: 0 | K38: 0 | L38: =SUM(RC[-8]:RC[-1]) -> 0
A39: =IF(EQUAL(Timesheet!RC, ""), "", Timesheet!RC) ->  | B39: =IF(EQUAL(Timesheet!RC, ""), "", Timesheet!RC) ->  | C39: =IF(EQUAL(Timesheet!RC, ""), "", Timesheet!RC) ->  | D39: 0 | E39: 0 | F39: 0 | G39: 0 | H39: 0 | I39: 0 | J39: 0 | K39: 0 | L39: =SUM(RC[-8]:RC[-1]) -> 0
A40: =IF(EQUAL(Timesheet!RC, ""), "", Timesheet!RC) ->  | B40: =IF(EQUAL(Timesheet!RC, ""), "", Timesheet!RC) ->  | C40: =IF(EQUAL(Timesheet!RC, ""), "", Timesheet!RC) ->  | D40: 0 | E40: 0 | F40: 0 | G40: 0 | H40: 0 | I40: 0 | J40: 0 | K40: 0 | L40: =SUM(RC[-8]:RC[-1]) -> 0
A41: =IF(EQUAL(Timesheet!RC, ""), "", Timesheet!RC) ->  | B41: =IF(EQUAL(Timesheet!RC, ""), "", Timesheet!RC) ->  | C41: =IF(EQUAL(Timesheet!RC, ""), "", Timesheet!RC) ->  | D41: 0 | E41: 0 | F41: 0 | G41: 0 | H41: 0 | I41: 0 | J41: 0 | K41: 0 | L41: =SUM(RC[-8]:RC[-1]) -> 0
A42: =IF(EQUAL(Timesheet!RC, ""), "", Timesheet!RC) ->  | B42: =IF(EQUAL(Timesheet!RC, ""), "", Timesheet!RC) ->  | C42: =IF(EQUAL(Timesheet!RC, ""), "", Timesheet!RC) ->  | D42: 0 | E42: 0 | F42: 0 | G42: 0 | H42: 0 | I42: 0 | J42: 0 | K42: 0 | L42: =SUM(RC[-8]:RC[-1]) -> 0
A43: =IF(EQUAL(Timesheet!RC, ""), "", Timesheet!RC) ->  | B43: =IF(EQUAL(Timesheet!RC, ""), "", Timesheet!RC) ->  | C43: =IF(EQUAL(Timesheet!RC, ""), "", Timesheet!RC) ->  | D43: 0 | E43: 0 | F43: 0 | G43: 0 | H43: 0 | I43: 0 | J43: 0 | K43: 0 | L43: =SUM(RC[-8]:RC[-1]) -> 0
A44: =IF(EQUAL(Timesheet!RC, ""), "", Timesheet!RC) ->  | B44: =IF(EQUAL(Timesheet!RC, ""), "", Timesheet!RC) ->  | C44: =IF(EQUAL(Timesheet!RC, ""), "", Timesheet!RC) ->  | D44: 0 | E44: 0 | F44: 0 | G44: 0 | H44: 0 | I44: 0 | J44: 0 | K44: 0 | L44: =SUM(RC[-8]:RC[-1]) -> 0
A45: 9029 | B45: 'GIDEON PATT SPECIAL REQUEST - BONDS | C45: 'Mgmnt | D45: 0 | E45: 0 | F45: 0 | G45: 0 | H45: 0 | I45: 0 | J45: 0 | K45: 0 | L45: =SUM(RC[-8]:RC[-1]) -> 0
A46: =Timesheet!RC ->  | B46: =Timesheet!RC ->  | C46: =Timesheet!RC ->  | D46: 0 | E46: 0 | F46: 0 | G46: 0 | H46: 0 | I46: 0 | J46: 0 | K46: 0 | L46: =SUM(RC[-8]:RC[-1]) -> 0
A47: =Timesheet!RC ->  | B47: =Timesheet!RC ->  | C47: =Timesheet!RC ->  | D47: 0 | E47: 0 | F47: 0 | G47: 0 | H47: 0 | I47: 0 | J47: 0 | K47: 0 | L47: =SUM(RC[-8]:RC[-1]) -> 0
A48: =Timesheet!RC ->  | B48: =Timesheet!RC ->  | C48: =Timesheet!RC ->  | D48: 0 | E48: 0 | F48: 0 | G48: 0 | H48: 0 | I48: 0 | J48: 0 | K48: 0 | L48: =SUM(RC[-8]:RC[-1]) -> 0
A49: =Timesheet!RC ->  | B49: =Timesheet!RC ->  | C49: =Timesheet!RC ->  | D49: 0 | E49: 0 | F49: 0 | G49: 0 | H49: 0 | I49: 0 | J49: 0 | K49: 0 | L49: =SUM(RC[-8]:RC[-1]) -> 0
A50: =Timesheet!RC ->  | B50: =Timesheet!RC ->  | C50: =Timesheet!RC ->  | D50: 0 | E50: 0 | F50: 0 | G50: 0 | H50: 0 | I50: 0 | J50: 0 | K50: 0 | L50: =SUM(RC[-8]:RC[-1]) -> 0
A51: =Timesheet!RC ->  | B51: =Timesheet!RC ->  | C51: =Timesheet!RC ->  | D51: 0 | E51: 0 | F51: 0 | G51: 0 | H51: 0 | I51: 0 | J51: 0 | K51: 0 | L51: =SUM(RC[-8]:RC[-1]) -> 0
A52: =Timesheet!RC ->  | B52: =Timesheet!RC ->  | C52: =Timesheet!RC ->  | D52: 0 | E52: 0 | F52: 0 | G52: 0 | H52: 0 | I52: 0 | J52: 0 | K52: 0 | L52: =SUM(RC[-8]:RC[-1]) -> 0
A53: =Timesheet!RC ->  | B53: =Timesheet!RC ->  | C53: =Timesheet!RC ->  | D53: 0 | E53: 0 | F53: 0 | G53: 0 | H53: 0 | I53: 0 | J53: 0 | K53: 0 | L53: =SUM(RC[-8]:RC[-1]) -> 0
A54: 'TOTAL | D54: =SUM(R[-51]C:R[-1]C) -> 0 | E54: =SUM(R[-51]C:R[-1]C) -> 0 | F54: =SUM(R[-51]C:R[-1]C) -> 0 | G54: =SUM(R[-51]C:R[-1]C) -> 0 | H54: =SUM(R[-51]C:R[-1]C) -> 0 | I54: =SUM(R[-51]C:R[-1]C) -> 0 | J54: =SUM(R[-51]C:R[-1]C) -> 0 | K54: =SUM(R[-51]C:R[-1]C) -> 0 | L54: =SUM(R[-51]C:R[-1]C) -> 0

Sheet: November2000
A1: 'CODE | B1: 'AUDIT DESCRIPTION | C1: 'Category | D1: 'Week Ending
D2: =7+October2000!RC[+6] -> 36834 | E2: 'Susan | F2: =RC[-2]+7 -> 36841 | G2: =RC[-2] -> Susan | H2: =RC[-2]+7 -> 36848 | I2: =RC[-2] -> Susan | J2: =RC[-2]+7 -> 36855 | K2: =RC[-2] -> Susan | L2: 'Total
A3: =IF(EQUAL(Timesheet!RC, ""), "", Timesheet!RC) -> 1001 | B3: =IF(EQUAL(Timesheet!RC, ""), "", Timesheet!RC) -> PURCHASING | C3: =IF(EQUAL(Timesheet!RC, ""), "", Timesheet!RC) -> Mgmnt | D3: 0 | E3: 0 | F3: 0 | G3: 0 | H3: 0 | I3: 0 | J3: 0 | K3: 0 | L3: =SUM(RC[-8]:RC[-1]) -> 0
A4: =IF(EQUAL(Timesheet!RC, ""), "", Timesheet!RC) -> 1002 | B4: =IF(EQUAL(Timesheet!RC, ""), "", Timesheet!RC) -> HUMAN RESOURCE | C4: =IF(EQUAL(Timesheet!RC, ""), "", Timesheet!RC) -> Plan | D4: 0 | E4: 0 | F4: 0 | G4: 0 | H4: 0 | I4: 0 | J4: 0 | K4: 0 | L4: =SUM(RC[-8]:RC[-1]) -> 0
A5: =IF(EQUAL(Timesheet!RC, ""), "", Timesheet!RC) -> 1005 | B5: =IF(EQUAL(Timesheet!RC, ""), "", Timesheet!RC) -> CORPORATE AUDIT RISK ANALYSIS | C5: =IF(EQUAL(Timesheet!RC, ""), "", Timesheet!RC) -> Plan | D5: 0 | E5: 0 | F5: 0 | G5: 0 | H5: 0 | I5: 0 | J5: 0 | K5: 0 | L5: =SUM(RC[-8]:RC[-1]) -> 0
A6: =IF(EQUAL(Timesheet!RC, ""), "", Timesheet!RC) -> 1007 | B6: =IF(EQUAL(Timesheet!RC, ""), "", Timesheet!RC) -> OFFICER'S TRAVEL & EXPENSE | C6: =IF(EQUAL(Timesheet!RC, ""), "", Timesheet!RC) -> Plan | D6: 0 | E6: 0 | F6: 0 | G6: 0 | H6: 0 | I6: 0 | J6: 0 | K6: 0 | L6: =SUM(RC[-8]:RC[-1]) -> 0
A7: =IF(EQUAL(Timesheet!RC, ""), "", Timesheet!RC) -> 1008 | B7: =IF(EQUAL(Timesheet!RC, ""), "", Timesheet!RC) -> RECORD RETENTION | C7: =IF(EQUAL(Timesheet!RC, ""), "", Timesheet!RC) -> Mgmnt | D7: 0 | E7: 0 | F7: 0 | G7: 0 | H7: 0 | I7: 0 | J7: 0 | K7: 0 | L7: =SUM(RC[-8]:RC[-1]) -> 0
A8: =IF(EQUAL(Timesheet!RC, ""), "", Timesheet!RC) -> 1009 | B8: =IF(EQUAL(Timesheet!RC, ""), "", Timesheet!RC) -> NASD AUDITS | C8: =IF(EQUAL(Timesheet!RC, ""), "", Timesheet!RC) -> Plan | D8: 0 | E8: 0 | F8: 0 | G8: 0 | H8: 0 | I8: 0 | J8: 0 | K8: 0 | L8: =SUM(RC[-8]:RC[-1]) -> 0
A9: =IF(EQUAL(Timesheet!RC, ""), "", Timesheet!RC) -> 1011 | B9: =IF(EQUAL(Timesheet!RC, ""), "", Timesheet!RC) -> SURPRISE CASH AUDIT - NEW YORK | C9: =IF(EQUAL(Timesheet!RC, ""), "", Timesheet!RC) -> Plan | D9: 0 | E9: 0 | F9: 0 | G9: 0 | H9: 0 | I9: 0 | J9: 0 | K9: 0 | L9: =SUM(RC[-8]:RC[-1]) -> 0
A10: =IF(EQUAL(Timesheet!RC, ""), "", Timesheet!RC) -> 1012 | B10: =IF(EQUAL(Timesheet!RC, ""), "", Timesheet!RC) -> INTERNATIONAL AUDIT - IBI | C10: =IF(EQUAL(Timesheet!RC, ""), "", Timesheet!RC) -> Plan | D10: 0 | E10: 0 | F10: 0 | G10: 0 | H10: 0 | I10: 0 | J10: 0 | K10: 0 | L10: =SUM(RC[-8]:RC[-1]) -> 0
A11: =IF(EQUAL(Timesheet!RC, ""), "", Timesheet!RC) -> 1013 | B11: =IF(EQUAL(Timesheet!RC, ""), "", Timesheet!RC) -> INTERNATIONAL AUDIT - CISL | C11: =IF(EQUAL(Timesheet!RC, ""), "", Timesheet!RC) -> Plan | D11: 0 | E11: 0 | F11: 0 | G11: 0 | H11: 0 | I11: 0 | J11: 0 | K11: 0 | L11: =SUM(RC[-8]:RC[-1]) -> 0
A12: =IF(EQUAL(Timesheet!RC, ""), "", Timesheet!RC) -> 1014 | B12: =IF(EQUAL(Timesheet!RC, ""), "", Timesheet!RC) -> MARKETING AND COMMUNICATION | C12: =IF(EQUAL(Timesheet!RC, ""), "", Timesheet!RC) -> Mgmnt | D12: 0 | E12: 0 | F12: 0 | G12: 0 | H12: 0 | I12: 0 | J12: 0 | K12: 0 | L12: =SUM(RC[-8]:RC[-1]) -> 0
A13: =IF(EQUAL(Timesheet!RC, ""), "", Timesheet!RC) -> 3001 | B13: =IF(EQUAL(Timesheet!RC, ""), "", Timesheet!RC) -> FIELD OFFICE CONTROL REVIEWS | C13: =IF(EQUAL(Timesheet!RC, ""), "", Timesheet!RC) -> Field | D13: 0 | E13: 0 | F13: 0 | G13: 0 | H13: 0 | I13: 0 | J13: 0 | K13: 0 | L13: =SUM(RC[-8]:RC[-1]) -> 0
A14: =IF(EQUAL(Timesheet!RC, ""), "", Timesheet!RC) -> 3002 | B14: =IF(EQUAL(Timesheet!RC, ""), "", Timesheet!RC) -> FIELD OFFICE ACCOUNTABILITY ANALYSIS | C14: =IF(EQUAL(Timesheet!RC, ""), "", Timesheet!RC) -> Field | D14: 0 | E14: 0 | F14: 0 | G14: 0 | H14: 0 | I14: 0 | J14: 0 | K14: 0 | L14: =SUM(RC[-8]:RC[-1]) -> 0
A15: =IF(EQUAL(Timesheet!RC, ""), "", Timesheet!RC) -> 3010 | B15: =IF(EQUAL(Timesheet!RC, ""), "", Timesheet!RC) -> FIELD OFFICE BANK RECONCILATIONS | C15: =IF(EQUAL(Timesheet!RC, ""), "", Timesheet!RC) -> Field | D15: 0 | E15: 0 | F15: 0 | G15: 0 | H15: 0 | I15: 0 | J15: 0 | K15: 0 | L15: =SUM(RC[-8]:RC[-1]) -> 0
A16: =IF(EQUAL(Timesheet!RC, ""), "", Timesheet!RC) -> 3020 | B16: =IF(EQUAL(Timesheet!RC, ""), "", Timesheet!RC) -> FIELD AUDIT PROGRAM DEVELOPMENT | C16: =IF(EQUAL(Timesheet!RC, ""), "", Timesheet!RC) -> Field | D16: 0 | E16: 0 | F16: 0 | G16: 0 | H16: 0 | I16: 0 | J16: 0 | K16: 0 | L16: =SUM(RC[-8]:RC[-1]) -> 0
A17: =IF(EQUAL(Timesheet!RC, ""), "", Timesheet!RC) -> 3030 | B17: =IF(EQUAL(Timesheet!RC, ""), "", Timesheet!RC) -> OPEN COMMITMENT ANALYSIS | C17: =IF(EQUAL(Timesheet!RC, ""), "", Timesheet!RC) -> Field | D17: 0 | E17: 0 | F17: 0 | G17: 0 | H17: 0 | I17: 0 | J17: 0 | K17: 0 | L17: =SUM(RC[-8]:RC[-1]) -> 0
A18: =IF(EQUAL(Timesheet!RC, ""), "", Timesheet!RC) -> 3040 | B18: =IF(EQUAL(Timesheet!RC, ""), "", Timesheet!RC) -> FIELD AUDIT RISK ASSESMENT | C18: =IF(EQUAL(Timesheet!RC, ""), "", Timesheet!RC) -> Field | D18: 0 | E18: 0 | F18: 0 | G18: 0 | H18: 0 | I18: 0 | J18: 0 | K18: 0 | L18: =SUM(RC[-8]:RC[-1]) -> 0
A19: =IF(EQUAL(Timesheet!RC, ""), "", Timesheet!RC) -> 3050 | B19: =IF(EQUAL(Timesheet!RC, ""), "", Timesheet!RC) -> NEW YORK FIELD AUDIT REVIEWS | C19: =IF(EQUAL(Timesheet!RC, ""), "", Timesheet!RC) -> Field | D19: 0 | E19: 0 | F19: 0 | G19: 0 | H19: 0 | I19: 0 | J19: 0 | K19: 0 | L19: =SUM(RC[-8]:RC[-1]) -> 0
A20: =IF(EQUAL(Timesheet!RC, ""), "", Timesheet!RC) -> 4001 | B20: =IF(EQUAL(Timesheet!RC, ""), "", Timesheet!RC) -> GRANT THORNTON | C20: =IF(EQUAL(Timesheet!RC, ""), "", Timesheet!RC) -> Mgmnt | D20: 0 | E20: 0 | F20: 0 | G20: 0 | H20: 0 | I20: 0 | J20: 0 | K20: 0 | L20: =SUM(RC[-8]:RC[-1]) -> 0
A21: =IF(EQUAL(Timesheet!RC, ""), "", Timesheet!RC) -> 5001 | B21: =IF(EQUAL(Timesheet!RC, ""), "", Timesheet!RC) -> MISCELLANEOUS AUDIT REQUESTS | C21: =IF(EQUAL(Timesheet!RC, ""), "", Timesheet!RC) -> Mgmnt | D21: 0 | E21: 0 | F21: 0 | G21: 0 | H21: 0 | I21: 0 | J21: 0 | K21: 0 | L21: =SUM(RC[-8]:RC[-1]) -> 0
A22: =IF(EQUAL(Timesheet!RC, ""), "", Timesheet!RC) -> 5009 | B22: =IF(EQUAL(Timesheet!RC, ""), "", Timesheet!RC) -> FORMS INVENTORY | C22: =IF(EQUAL(Timesheet!RC, ""), "", Timesheet!RC) -> Plan | D22: 0 | E22: 0 | F22: 0 | G22: 0 | H22: 0 | I22: 0 | J22: 0 | K22: 0 | L22: =SUM(RC[-8]:RC[-1]) -> 0
A23: =IF(EQUAL(Timesheet!RC, ""), "", Timesheet!RC) -> 5010 | B23: =IF(EQUAL(Timesheet!RC, ""), "", Timesheet!RC) -> SURPRISE CHECK VALIDATION | C23: =IF(EQUAL(Timesheet!RC, ""), "", Timesheet!RC) -> Plan | D23: 0 | E23: 0 | F23: 0 | G23: 0 | H23: 0 | I23: 0 | J23: 0 | K23: 0 | L23: =SUM(RC[-8]:RC[-1]) -> 0
A24: =IF(EQUAL(Timesheet!RC, ""), "", Timesheet!RC) -> 7000 | B24: =IF(EQUAL(Timesheet!RC, ""), "", Timesheet!RC) -> NON-PROJECT RELATED (MEETINGS) | C24: =IF(EQUAL(Timesheet!RC, ""), "", Timesheet!RC) -> Non-Audit | D24: 0 | E24: 0 | F24: 0 | G24: 0 | H24: 0 | I24: 0 | J24: 0 | K24: 0 | L24: =SUM(RC[-8]:RC[-1]) -> 0
A25: =IF(EQUAL(Timesheet!RC, ""), "", Timesheet!RC) -> 7003 | B25: =IF(EQUAL(Timesheet!RC, ""), "", Timesheet!RC) -> AUDIT COMMITTEE | C25: =IF(EQUAL(Timesheet!RC, ""), "", Timesheet!RC) -> Non-Audit | D25: 0 | E25: 0 | F25: 0 | G25: 0 | H25: 0 | I25: 0 | J25: 0 | K25: 0 | L25: =SUM(RC[-8]:RC[-1]) -> 0
A26: =IF(EQUAL(Timesheet!RC, ""), "", Timesheet!RC) -> 8001 | B26: =IF(EQUAL(Timesheet!RC, ""), "", Timesheet!RC) -> ADMINISTRATIVE - GENERAL | C26: =IF(EQUAL(Timesheet!RC, ""), "", Timesheet!RC) -> Admin | D26: 0 | E26: 0 | F26: 0 | G26: 0 | H26: 0 | I26: 0 | J26: 0 | K26: 0 | L26: =SUM(RC[-8]:RC[-1]) -> 0
A27: =IF(EQUAL(Timesheet!RC, ""), "", Timesheet!RC) -> 8002 | B27: =IF(EQUAL(Timesheet!RC, ""), "", Timesheet!RC) -> HOLIDAYS | C27: =IF(EQUAL(Timesheet!RC, ""), "", Timesheet!RC) -> Admin | D27: 0 | E27: 0 | F27: 0 | G27: 0 | H27: 0 | I27: 0 | J27: 0 | K27: 0 | L27: =SUM(RC[-8]:RC[-1]) -> 0
A28: =IF(EQUAL(Timesheet!RC, ""), "", Timesheet!RC) -> 8004 | B28: =IF(EQUAL(Timesheet!RC, ""), "", Timesheet!RC) -> SEMINARS & TRAINING | C28: =IF(EQUAL(Timesheet!RC, ""), "", Timesheet!RC) -> Admin | D28: 0 | E28: 0 | F28: 0 | G28: 0 | H28: 0 | I28: 0 | J28: 0 | K28: 0 | L28: =SUM(RC[-8]:RC[-1]) -> 0
A29: =IF(EQUAL(Timesheet!RC, ""), "", Timesheet!RC) -> 8005 | B29: =IF(EQUAL(Timesheet!RC, ""), "", Timesheet!RC) -> PERSONAL (VACATION/AT) | C29: =IF(EQUAL(Timesheet!RC, ""), "", Timesheet!RC) -> Admin | D29: 0 | E29: 0 | F29: 0 | G29: 0 | H29: 0 | I29: 0 | J29: 0 | K29: 0 | L29: =SUM(RC[-8]:RC[-1]) -> 0
A30: =IF(EQUAL(Timesheet!RC, ""), "", Timesheet!RC) -> 8006 | B30: =IF(EQUAL(Timesheet!RC, ""), "", Timesheet!RC) -> SICK | C30: =IF(EQUAL(Timesheet!RC, ""), "", Timesheet!RC) -> Admin | D30: 0 | E30: 0 | F30: 0 | G30: 0 | H30: 0 | I30: 0 | J30: 0 | K30: 0 | L30: =SUM(RC[-8]:RC[-1]) -> 0
A31: =IF(EQUAL(Timesheet!RC, ""), "", Timesheet!RC) -> 8008 | B31: =IF(EQUAL(Timesheet!RC, ""), "", Timesheet!RC) -> RESEARCH | C31: =IF(EQUAL(Timesheet!RC, ""), "", Timesheet!RC) -> Non-Audit | D31: 0 | E31: 0 | F31: 0 | G31: 0 | H31: 0 | I31: 0 | J31: 0 | K31: 0 | L31: =SUM(RC[-8]:RC[-1]) -> 0
A32: =IF(EQUAL(Timesheet!RC, ""), "", Timesheet!RC) ->  | B32: =IF(EQUAL(Timesheet!RC, ""), "", Timesheet!RC) ->  | C32: =IF(EQUAL(Timesheet!RC, ""), "", Timesheet!RC) ->  | D32: 0 | E32: 0 | F32: 0 | G32: 0 | H32: 0 | I32: 0 | J32: 0 | K32: 0 | L32: =SUM(RC[-8]:RC[-1]) -> 0
A33: =IF(EQUAL(Timesheet!RC, ""), "", Timesheet!RC) ->  | B33: =IF(EQUAL(Timesheet!RC, ""), "", Timesheet!RC) ->  | C33: =IF(EQUAL(Timesheet!RC, ""), "", Timesheet!RC) ->  | D33: 0 | E33: 0 | F33: 0 | G33: 0 | H33: 0 | I33: 0 | J33: 0 | K33: 0 | L33: =SUM(RC[-8]:RC[-1]) -> 0
A34: =IF(EQUAL(Timesheet!RC, ""), "", Timesheet!RC) ->  | B34: =IF(EQUAL(Timesheet!RC, ""), "", Timesheet!RC) ->  | C34: =IF(EQUAL(Timesheet!RC, ""), "", Timesheet!RC) ->  | D34: 0 | E34: 0 | F34: 0 | G34: 0 | H34: 0 | I34: 0 | J34: 0 | K34: 0 | L34: =SUM(RC[-8]:RC[-1]) -> 0
A35: =IF(EQUAL(Timesheet!RC, ""), "", Timesheet!RC) ->  | B35: =IF(EQUAL(Timesheet!RC, ""), "", Timesheet!RC) ->  | C35: =IF(EQUAL(Timesheet!RC, ""), "", Timesheet!RC) ->  | D35: 0 | E35: 0 | F35: 0 | G35: 0 | H35: 0 | I35: 0 | J35: 0 | K35: 0 | L35: =SUM(RC[-8]:RC[-1]) -> 0
A36: =IF(EQUAL(Timesheet!RC, ""), "", Timesheet!RC) ->  | B36: =IF(EQUAL(Timesheet!RC, ""), "", Timesheet!RC) ->  | C36: =IF(EQUAL(Timesheet!RC, ""), "", Timesheet!RC) ->  | D36: 0 | E36: 0 | F36: 0 | G36: 0 | H36: 0 | I36: 0 | J36: 0 | K36: 0 | L36: =SUM(RC[-8]:RC[-1]) -> 0
A37: =IF(EQUAL(Timesheet!RC, ""), "", Timesheet!RC) ->  | B37: =IF(EQUAL(Timesheet!RC, ""), "", Timesheet!RC) ->  | C37: =IF(EQUAL(Timesheet!RC, ""), "", Timesheet!RC) ->  | D37: 0 | E37: 0 | F37: 0 | G37: 0 | H37: 0 | I37: 0 | J37: 0 | K37: 0 | L37: =SUM(RC[-8]:RC[-1]) -> 0
A38: =IF(EQUAL(Timesheet!RC, ""), "", Timesheet!RC) ->  | B38: =IF(EQUAL(Timesheet!RC, ""), "", Timesheet!RC) ->  | C38: =IF(EQUAL(Timesheet!RC, ""), "", Timesheet!RC) ->  | D38: 0 | E38: 0 | F38: 0 | G38: 0 | H38: 0 | I38: 0 | J38: 0 | K38: 0 | L38: =SUM(RC[-8]:RC[-1]) -> 0
A39: =IF(EQUAL(Timesheet!RC, ""), "", Timesheet!RC) ->  | B39: =IF(EQUAL(Timesheet!RC, ""), "", Timesheet!RC) ->  | C39: =IF(EQUAL(Timesheet!RC, ""), "", Timesheet!RC) ->  | D39: 0 | E39: 0 | F39: 0 | G39: 0 | H39: 0 | I39: 0 | J39: 0 | K39: 0 | L39: =SUM(RC[-8]:RC[-1]) -> 0
A40: =IF(EQUAL(Timesheet!RC, ""), "", Timesheet!RC) ->  | B40: =IF(EQUAL(Timesheet!RC, ""), "", Timesheet!RC) ->  | C40: =IF(EQUAL(Timesheet!RC, ""), "", Timesheet!RC) ->  | D40: 0 | E40: 0 | F40: 0 | G40: 0 | H40: 0 | I40: 0 | J40: 0 | K40: 0 | L40: =SUM(RC[-8]:RC[-1]) -> 0
A41: =IF(EQUAL(Timesheet!RC, ""), "", Timesheet!RC) ->  | B41: =IF(EQUAL(Timesheet!RC, ""), "", Timesheet!RC) ->  | C41: =IF(EQUAL(Timesheet!RC, ""), "", Timesheet!RC) ->  | D41: 0 | E41: 0 | F41: 0 | G41: 0 | H41: 0 | I41: 0 | J41: 0 | K41: 0 | L41: =SUM(RC[-8]:RC[-1]) -> 0
A42: =IF(EQUAL(Timesheet!RC, ""), "", Timesheet!RC) ->  | B42: =IF(EQUAL(Timesheet!RC, ""), "", Timesheet!RC) ->  | C42: =IF(EQUAL(Timesheet!RC, ""), "", Timesheet!RC) ->  | D42: 0 | E42: 0 | F42: 0 | G42: 0 | H42: 0 | I42: 0 | J42: 0 | K42: 0 | L42: =SUM(RC[-8]:RC[-1]) -> 0
A43: =IF(EQUAL(Timesheet!RC, ""), "", Timesheet!RC) ->  | B43: =IF(EQUAL(Timesheet!RC, ""), "", Timesheet!RC) ->  | C43: =IF(EQUAL(Timesheet!RC, ""), "", Timesheet!RC) ->  | D43: 0 | E43: 0 | F43: 0 | G43: 0 | H43: 0 | I43: 0 | J43: 0 | K43: 0 | L43: =SUM(RC[-8]:RC[-1]) -> 0
A44: =IF(EQUAL(Timesheet!RC, ""), "", Timesheet!RC) ->  | B44: =IF(EQUAL(Timesheet!RC, ""), "", Timesheet!RC) ->  | C44: =IF(EQUAL(Timesheet!RC, ""), "", Timesheet!RC) ->  | D44: 0 | E44: 0 | F44: 0 | G44: 0 | H44: 0 | I44: 0 | J44: 0 | K44: 0 | L44: =SUM(RC[-8]:RC[-1]) -> 0
A45: 9029 | B45: 'GIDEON PATT SPECIAL REQUEST - BONDS | C45: 'Mgmnt | D45: 0 | E45: 0 | F45: 0 | G45: 0 | H45: 0 | I45: 0 | J45: 0 | K45: 0 | L45: =SUM(RC[-8]:RC[-1]) -> 0
A46: =Timesheet!RC ->  | B46: =Timesheet!RC ->  | C46: =Timesheet!RC ->  | D46: 0 | E46: 0 | F46: 0 | G46: 0 | H46: 0 | I46: 0 | J46: 0 | K46: 0 | L46: =SUM(RC[-8]:RC[-1]) -> 0
A47: =Timesheet!RC ->  | B47: =Timesheet!RC ->  | C47: =Timesheet!RC ->  | D47: 0 | E47: 0 | F47: 0 | G47: 0 | H47: 0 | I47: 0 | J47: 0 | K47: 0 | L47: =SUM(RC[-8]:RC[-1]) -> 0
A48: =Timesheet!RC ->  | B48: =Timesheet!RC ->  | C48: =Timesheet!RC ->  | D48: 0 | E48: 0 | F48: 0 | G48: 0 | H48: 0 | I48: 0 | J48: 0 | K48: 0 | L48: =SUM(RC[-8]:RC[-1]) -> 0
A49: =Timesheet!RC ->  | B49: =Timesheet!RC ->  | C49: =Timesheet!RC ->  | D49: 0 | E49: 0 | F49: 0 | G49: 0 | H49: 0 | I49: 0 | J49: 0 | K49: 0 | L49: =SUM(RC[-8]:RC[-1]) -> 0
A50: =Timesheet!RC ->  | B50: =Timesheet!RC ->  | C50: =Timesheet!RC ->  | D50: 0 | E50: 0 | F50: 0 | G50: 0 | H50: 0 | I50: 0 | J50: 0 | K50: 0 | L50: =SUM(RC[-8]:RC[-1]) -> 0
A51: =Timesheet!RC ->  | B51: =Timesheet!RC ->  | C51: =Timesheet!RC ->  | D51: 0 | E51: 0 | F51: 0 | G51: 0 | H51: 0 | I51: 0 | J51: 0 | K51: 0 | L51: =SUM(RC[-8]:RC[-1]) -> 0
A52: =Timesheet!RC ->  | B52: =Timesheet!RC ->  | C52: =Timesheet!RC ->  | D52: 0 | E52: 0 | F52: 0 | G52: 0 | H52: 0 | I52: 0 | J52: 0 | K52: 0 | L52: =SUM(RC[-8]:RC[-1]) -> 0
A53: =Timesheet!RC ->  | B53: =Timesheet!RC ->  | C53: =Timesheet!RC ->  | D53: 0 | E53: 0 | F53: 0 | G53: 0 | H53: 0 | I53: 0 | J53: 0 | K53: 0 | L53: =SUM(RC[-8]:RC[-1]) -> 0
A54: 'TOTAL | D54: =SUM(R[-51]C:R[-1]C) -> 0 | E54: =SUM(R[-51]C:R[-1]C) -> 0 | F54: =SUM(R[-51]C:R[-1]C) -> 0 | G54: =SUM(R[-51]C:R[-1]C) -> 0 | H54: =SUM(R[-51]C:R[-1]C) -> 0 | I54: =SUM(R[-51]C:R[-1]C) -> 0 | J54: =SUM(R[-51]C:R[-1]C) -> 0 | K54: =SUM(R[-51]C:R[-1]C) -> 0 | L54: =SUM(R[-51]C:R[-1]C) -> 0

Sheet: December2000
A1: 'CODE | B1: 'AUDIT DESCRIPTION | C1: 'Category | D1: 'Week Ending
D2: =7+November2000!RC[+6] -> 36862 | E2: 'Susan | F2: =RC[-2]+7 -> 36869 | G2: 'Susan | H2: =RC[-2]+7 -> 36876 | I2: 'Susan | J2: =RC[-2]+7 -> 36883 | K2: 'Susan | L2: =RC[-2]+7 -> 36890 | M2: 'Total
A3: =IF(EQUAL(Timesheet!RC, ""), "", Timesheet!RC) -> 1001 | B3: =IF(EQUAL(Timesheet!RC, ""), "", Timesheet!RC) -> PURCHASING | C3: =IF(EQUAL(Timesheet!RC, ""), "", Timesheet!RC) -> Mgmnt | D3: 0 | E3: 0 | F3: 0 | G3: 0 | H3: 0 | I3: 0 | J3: 0 | K3: 0 | L3: 0 | M3: =SUM(RC[-9]:RC[-1]) -> 0
A4: =IF(EQUAL(Timesheet!RC, ""), "", Timesheet!RC) -> 1002 | B4: =IF(EQUAL(Timesheet!RC, ""), "", Timesheet!RC) -> HUMAN RESOURCE | C4: =IF(EQUAL(Timesheet!RC, ""), "", Timesheet!RC) -> Plan | D4: 0 | E4: 0 | F4: 0 | G4: 0 | H4: 0 | I4: 0 | J4: 0 | K4: 0 | L4: 0 | M4: =SUM(RC[-9]:RC[-3]) -> 0
A5: =IF(EQUAL(Timesheet!RC, ""), "", Timesheet!RC) -> 1005 | B5: =IF(EQUAL(Timesheet!RC, ""), "", Timesheet!RC) -> CORPORATE AUDIT RISK ANALYSIS | C5: =IF(EQUAL(Timesheet!RC, ""), "", Timesheet!RC) -> Plan | D5: 0 | E5: 0 | F5: 0 | G5: 0 | H5: 0 | I5: 0 | J5: 0 | K5: 0 | L5: 0 | M5: =SUM(RC[-9]:RC[-3]) -> 0
A6: =IF(EQUAL(Timesheet!RC, ""), "", Timesheet!RC) -> 1007 | B6: =IF(EQUAL(Timesheet!RC, ""), "", Timesheet!RC) -> OFFICER'S TRAVEL & EXPENSE | C6: =IF(EQUAL(Timesheet!RC, ""), "", Timesheet!RC) -> Plan | D6: 0 | E6: 0 | F6: 0 | G6: 0 | H6: 0 | I6: 0 | J6: 0 | K6: 0 | L6: 0 | M6: =SUM(RC[-9]:RC[-3]) -> 0
A7: =IF(EQUAL(Timesheet!RC, ""), "", Timesheet!RC) -> 1008 | B7: =IF(EQUAL(Timesheet!RC, ""), "", Timesheet!RC) -> RECORD RETENTION | C7: =IF(EQUAL(Timesheet!RC, ""), "", Timesheet!RC) -> Mgmnt | D7: 0 | E7: 0 | F7: 0 | G7: 0 | H7: 0 | I7: 0 | J7: 0 | K7: 0 | L7: 0 | M7: =SUM(RC[-9]:RC[-3]) -> 0
A8: =IF(EQUAL(Timesheet!RC, ""), "", Timesheet!RC) -> 1009 | B8: =IF(EQUAL(Timesheet!RC, ""), "", Timesheet!RC) -> NASD AUDITS | C8: =IF(EQUAL(Timesheet!RC, ""), "", Timesheet!RC) -> Plan | D8: 0 | E8: 0 | F8: 0 | G8: 0 | H8: 0 | I8: 0 | J8: 0 | K8: 0 | L8: 0 | M8: =SUM(RC[-9]:RC[-3]) -> 0
A9: =IF(EQUAL(Timesheet!RC, ""), "", Timesheet!RC) -> 1011 | B9: =IF(EQUAL(Timesheet!RC, ""), "", Timesheet!RC) -> SURPRISE CASH AUDIT - NEW YORK | C9: =IF(EQUAL(Timesheet!RC, ""), "", Timesheet!RC) -> Plan | D9: 0 | E9: 0 | F9: 0 | G9: 0 | H9: 0 | I9: 0 | J9: 0 | K9: 0 | L9: 0 | M9: =SUM(RC[-9]:RC[-3]) -> 0
A10: =IF(EQUAL(Timesheet!RC, ""), "", Timesheet!RC) -> 1012 | B10: =IF(EQUAL(Timesheet!RC, ""), "", Timesheet!RC) -> INTERNATIONAL AUDIT - IBI | C10: =IF(EQUAL(Timesheet!RC, ""), "", Timesheet!RC) -> Plan | D10: 0 | E10: 0 | F10: 0 | G10: 0 | H10: 0 | I10: 0 | J10: 0 | K10: 0 | L10: 0 | M10: =SUM(RC[-9]:RC[-3]) -> 0
A11: =IF(EQUAL(Timesheet!RC, ""), "", Timesheet!RC) -> 1013 | B11: =IF(EQUAL(Timesheet!RC, ""), "", Timesheet!RC) -> INTERNATIONAL AUDIT - CISL | C11: =IF(EQUAL(Timesheet!RC, ""), "", Timesheet!RC) -> Plan | D11: 0 | E11: 0 | F11: 0 | G11: 0 | H11: 0 | I11: 0 | J11: 0 | K11: 0 | L11: 0 | M11: =SUM(RC[-9]:RC[-3]) -> 0
A12: =IF(EQUAL(Timesheet!RC, ""), "", Timesheet!RC) -> 1014 | B12: =IF(EQUAL(Timesheet!RC, ""), "", Timesheet!RC) -> MARKETING AND COMMUNICATION | C12: =IF(EQUAL(Timesheet!RC, ""), "", Timesheet!RC) -> Mgmnt | D12: 0 | E12: 0 | F12: 0 | G12: 0 | H12: 0 | I12: 0 | J12: 0 | K12: 0 | L12: 0 | M12: =SUM(RC[-9]:RC[-3]) -> 0
A13: =IF(EQUAL(Timesheet!RC, ""), "", Timesheet!RC) -> 3001 | B13: =IF(EQUAL(Timesheet!RC, ""), "", Timesheet!RC) -> FIELD OFFICE CONTROL REVIEWS | C13: =IF(EQUAL(Timesheet!RC, ""), "", Timesheet!RC) -> Field | D13: 0 | E13: 0 | F13: 0 | G13: 0 | H13: 0 | I13: 0 | J13: 0 | K13: 0 | L13: 0 | M13: =SUM(RC[-9]:RC[-3]) -> 0
A14: =IF(EQUAL(Timesheet!RC, ""), "", Timesheet!RC) -> 3002 | B14: =IF(EQUAL(Timesheet!RC, ""), "", Timesheet!RC) -> FIELD OFFICE ACCOUNTABILITY ANALYSIS | C14: =IF(EQUAL(Timesheet!RC, ""), "", Timesheet!RC) -> Field | D14: 0 | E14: 0 | F14: 0 | G14: 0 | H14: 0 | I14: 0 | J14: 0 | K14: 0 | L14: 0 | M14: =SUM(RC[-9]:RC[-3]) -> 0
A15: =IF(EQUAL(Timesheet!RC, ""), "", Timesheet!RC) -> 3010 | B15: =IF(EQUAL(Timesheet!RC, ""), "", Timesheet!RC) -> FIELD OFFICE BANK RECONCILATIONS | C15: =IF(EQUAL(Timesheet!RC, ""), "", Timesheet!RC) -> Field | D15: 0 | E15: 0 | F15: 0 | G15: 0 | H15: 0 | I15: 0 | J15: 0 | K15: 0 | L15: 0 | M15: =SUM(RC[-9]:RC[-3]) -> 0
A16: =IF(EQUAL(Timesheet!RC, ""), "", Timesheet!RC) -> 3020 | B16: =IF(EQUAL(Timesheet!RC, ""), "", Timesheet!RC) -> FIELD AUDIT PROGRAM DEVELOPMENT | C16: =IF(EQUAL(Timesheet!RC, ""), "", Timesheet!RC) -> Field | D16: 0 | E16: 0 | F16: 0 | G16: 0 | H16: 0 | I16: 0 | J16: 0 | K16: 0 | L16: 0 | M16: =SUM(RC[-9]:RC[-3]) -> 0
A17: =IF(EQUAL(Timesheet!RC, ""), "", Timesheet!RC) -> 3030 | B17: =IF(EQUAL(Timesheet!RC, ""), "", Timesheet!RC) -> OPEN COMMITMENT ANALYSIS | C17: =IF(EQUAL(Timesheet!RC, ""), "", Timesheet!RC) -> Field | D17: 0 | E17: 0 | F17: 0 | G17: 0 | H17: 0 | I17: 0 | J17: 0 | K17: 0 | L17: 0 | M17: =SUM(RC[-9]:RC[-3]) -> 0
A18: =IF(EQUAL(Timesheet!RC, ""), "", Timesheet!RC) -> 3040 | B18: =IF(EQUAL(Timesheet!RC, ""), "", Timesheet!RC) -> FIELD AUDIT RISK ASSESMENT | C18: =IF(EQUAL(Timesheet!RC, ""), "", Timesheet!RC) -> Field | D18: 0 | E18: 0 | F18: 0 | G18: 0 | H18: 0 | I18: 0 | J18: 0 | K18: 0 | L18: 0 | M18: =SUM(RC[-9]:RC[-3]) -> 0
A19: =IF(EQUAL(Timesheet!RC, ""), "", Timesheet!RC) -> 3050 | B19: =IF(EQUAL(Timesheet!RC, ""), "", Timesheet!RC) -> NEW YORK FIELD AUDIT REVIEWS | C19: =IF(EQUAL(Timesheet!RC, ""), "", Timesheet!RC) -> Field | D19: 0 | E19: 0 | F19: 0 | G19: 0 | H19: 0 | I19: 0 | J19: 0 | K19: 0 | L19: 0 | M19: =SUM(RC[-9]:RC[-3]) -> 0
A20: =IF(EQUAL(Timesheet!RC, ""), "", Timesheet!RC) -> 4001 | B20: =IF(EQUAL(Timesheet!RC, ""), "", Timesheet!RC) -> GRANT THORNTON | C20: =IF(EQUAL(Timesheet!RC, ""), "", Timesheet!RC) -> Mgmnt | D20: 0 | E20: 0 | F20: 0 | G20: 0 | H20: 0 | I20: 0 | J20: 0 | K20: 0 | L20: 0 | M20: =SUM(RC[-9]:RC[-3]) -> 0
A21: =IF(EQUAL(Timesheet!RC, ""), "", Timesheet!RC) -> 5001 | B21: =IF(EQUAL(Timesheet!RC, ""), "", Timesheet!RC) -> MISCELLANEOUS AUDIT REQUESTS | C21: =IF(EQUAL(Timesheet!RC, ""), "", Timesheet!RC) -> Mgmnt | D21: 0 | E21: 0 | F21: 0 | G21: 0 | H21: 0 | I21: 0 | J21: 0 | K21: 0 | L21: 0 | M21: =SUM(RC[-9]:RC[-3]) -> 0
A22: =IF(EQUAL(Timesheet!RC, ""), "", Timesheet!RC) -> 5009 | B22: =IF(EQUAL(Timesheet!RC, ""), "", Timesheet!RC) -> FORMS INVENTORY | C22: =IF(EQUAL(Timesheet!RC, ""), "", Timesheet!RC) -> Plan | D22: 0 | E22: 0 | F22: 0 | G22: 0 | H22: 0 | I22: 0 | J22: 0 | K22: 0 | L22: 0 | M22: =SUM(RC[-9]:RC[-3]) -> 0
A23: =IF(EQUAL(Timesheet!RC, ""), "", Timesheet!RC) -> 5010 | B23: =IF(EQUAL(Timesheet!RC, ""), "", Timesheet!RC) -> SURPRISE CHECK VALIDATION | C23: =IF(EQUAL(Timesheet!RC, ""), "", Timesheet!RC) -> Plan | D23: 0 | E23: 0 | F23: 0 | G23: 0 | H23: 0 | I23: 0 | J23: 0 | K23: 0 | L23: 0 | M23: =SUM(RC[-9]:RC[-3]) -> 0
A24: =IF(EQUAL(Timesheet!RC, ""), "", Timesheet!RC) -> 7000 | B24: =IF(EQUAL(Timesheet!RC, ""), "", Timesheet!RC) -> NON-PROJECT RELATED (MEETINGS) | C24: =IF(EQUAL(Timesheet!RC, ""), "", Timesheet!RC) -> Non-Audit | D24: 0 | E24: 0 | F24: 0 | G24: 0 | H24: 0 | I24: 0 | J24: 0 | K24: 0 | L24: 0 | M24: =SUM(RC[-9]:RC[-3]) -> 0
A25: =IF(EQUAL(Timesheet!RC, ""), "", Timesheet!RC) -> 7003 | B25: =IF(EQUAL(Timesheet!RC, ""), "", Timesheet!RC) -> AUDIT COMMITTEE | C25: =IF(EQUAL(Timesheet!RC, ""), "", Timesheet!RC) -> Non-Audit | D25: 0 | E25: 0 | F25: 0 | G25: 0 | H25: 0 | I25: 0 | J25: 0 | K25: 0 | L25: 0 | M25: =SUM(RC[-9]:RC[-3]) -> 0
A26: =IF(EQUAL(Timesheet!RC, ""), "", Timesheet!RC) -> 8001 | B26: =IF(EQUAL(Timesheet!RC, ""), "", Timesheet!RC) -> ADMINISTRATIVE - GENERAL | C26: =IF(EQUAL(Timesheet!RC, ""), "", Timesheet!RC) -> Admin | D26: 0 | E26: 0 | F26: 0 | G26: 0 | H26: 0 | I26: 0 | J26: 0 | K26: 0 | L26: 0 | M26: =SUM(RC[-9]:RC[-3]) -> 0
A27: =IF(EQUAL(Timesheet!RC, ""), "", Timesheet!RC) -> 8002 | B27: =IF(EQUAL(Timesheet!RC, ""), "", Timesheet!RC) -> HOLIDAYS | C27: =IF(EQUAL(Timesheet!RC, ""), "", Timesheet!RC) -> Admin | D27: 0 | E27: 0 | F27: 0 | G27: 0 | H27: 0 | I27: 0 | J27: 0 | K27: 0 | L27: 0 | M27: =SUM(RC[-9]:RC[-3]) -> 0
A28: =IF(EQUAL(Timesheet!RC, ""), "", Timesheet!RC) -> 8004 | B28: =IF(EQUAL(Timesheet!RC, ""), "", Timesheet!RC) -> SEMINARS & TRAINING | C28: =IF(EQUAL(Timesheet!RC, ""), "", Timesheet!RC) -> Admin | D28: 0 | E28: 0 | F28: 0 | G28: 0 | H28: 0 | I28: 0 | J28: 0 | K28: 0 | L28: 0 | M28: =SUM(RC[-9]:RC[-3]) -> 0
A29: =IF(EQUAL(Timesheet!RC, ""), "", Timesheet!RC) -> 8005 | B29: =IF(EQUAL(Timesheet!RC, ""), "", Timesheet!RC) -> PERSONAL (VACATION/AT) | C29: =IF(EQUAL(Timesheet!RC, ""), "", Timesheet!RC) -> Admin | D29: 0 | E29: 0 | F29: 0 | G29: 0 | H29: 0 | I29: 0 | J29: 0 | K29: 0 | L29: 0 | M29: =SUM(RC[-9]:RC[-3]) -> 0
A30: =IF(EQUAL(Timesheet!RC, ""), "", Timesheet!RC) -> 8006 | B30: =IF(EQUAL(Timesheet!RC, ""), "", Timesheet!RC) -> SICK | C30: =IF(EQUAL(Timesheet!RC, ""), "", Timesheet!RC) -> Admin | D30: 0 | E30: 0 | F30: 0 | G30: 0 | H30: 0 | I30: 0 | J30: 0 | K30: 0 | L30: 0 | M30: =SUM(RC[-9]:RC[-3]) -> 0
A31: =IF(EQUAL(Timesheet!RC, ""), "", Timesheet!RC) -> 8008 | B31: =IF(EQUAL(Timesheet!RC, ""), "", Timesheet!RC) -> RESEARCH | C31: =IF(EQUAL(Timesheet!RC, ""), "", Timesheet!RC) -> Non-Audit | D31: 0 | E31: 0 | F31: 0 | G31: 0 | H31: 0 | I31: 0 | J31: 0 | K31: 0 | L31: 0 | M31: =SUM(RC[-9]:RC[-3]) -> 0
A32: =IF(EQUAL(Timesheet!RC, ""), "", Timesheet!RC) ->  | B32: =IF(EQUAL(Timesheet!RC, ""), "", Timesheet!RC) ->  | C32: =IF(EQUAL(Timesheet!RC, ""), "", Timesheet!RC) ->  | D32: 0 | E32: 0 | F32: 0 | G32: 0 | H32: 0 | I32: 0 | J32: 0 | K32: 0 | L32: 0 | M32: =SUM(RC[-9]:RC[-3]) -> 0
A33: =IF(EQUAL(Timesheet!RC, ""), "", Timesheet!RC) ->  | B33: =IF(EQUAL(Timesheet!RC, ""), "", Timesheet!RC) ->  | C33: =IF(EQUAL(Timesheet!RC, ""), "", Timesheet!RC) ->  | D33: 0 | E33: 0 | F33: 0 | G33: 0 | H33: 0 | I33: 0 | J33: 0 | K33: 0 | L33: 0 | M33: =SUM(RC[-9]:RC[-3]) -> 0
A34: =IF(EQUAL(Timesheet!RC, ""), "", Timesheet!RC) ->  | B34: =IF(EQUAL(Timesheet!RC, ""), "", Timesheet!RC) ->  | C34: =IF(EQUAL(Timesheet!RC, ""), "", Timesheet!RC) ->  | D34: 0 | E34: 0 | F34: 0 | G34: 0 | H34: 0 | I34: 0 | J34: 0 | K34: 0 | L34: 0 | M34: =SUM(RC[-9]:RC[-3]) -> 0
A35: =IF(EQUAL(Timesheet!RC, ""), "", Timesheet!RC) ->  | B35: =IF(EQUAL(Timesheet!RC, ""), "", Timesheet!RC) ->  | C35: =IF(EQUAL(Timesheet!RC, ""), "", Timesheet!RC) ->  | D35: 0 | E35: 0 | F35: 0 | G35: 0 | H35: 0 | I35: 0 | J35: 0 | K35: 0 | L35: 0 | M35: =SUM(RC[-9]:RC[-3]) -> 0
A36: =IF(EQUAL(Timesheet!RC, ""), "", Timesheet!RC) ->  | B36: =IF(EQUAL(Timesheet!RC, ""), "", Timesheet!RC) ->  | C36: =IF(EQUAL(Timesheet!RC, ""), "", Timesheet!RC) ->  | D36: 0 | E36: 0 | F36: 0 | G36: 0 | H36: 0 | I36: 0 | J36: 0 | K36: 0 | L36: 0 | M36: =SUM(RC[-9]:RC[-3]) -> 0
A37: =IF(EQUAL(Timesheet!RC, ""), "", Timesheet!RC) ->  | B37: =IF(EQUAL(Timesheet!RC, ""), "", Timesheet!RC) ->  | C37: =IF(EQUAL(Timesheet!RC, ""), "", Timesheet!RC) ->  | D37: 0 | E37: 0 | F37: 0 | G37: 0 | H37: 0 | I37: 0 | J37: 0 | K37: 0 | L37: 0 | M37: =SUM(RC[-9]:RC[-3]) -> 0
A38: =IF(EQUAL(Timesheet!RC, ""), "", Timesheet!RC) ->  | B38: =IF(EQUAL(Timesheet!RC, ""), "", Timesheet!RC) ->  | C38: =IF(EQUAL(Timesheet!RC, ""), "", Timesheet!RC) ->  | D38: 0 | E38: 0 | F38: 0 | G38: 0 | H38: 0 | I38: 0 | J38: 0 | K38: 0 | L38: 0 | M38: =SUM(RC[-9]:RC[-3]) -> 0
A39: =IF(EQUAL(Timesheet!RC, ""), "", Timesheet!RC) ->  | B39: =IF(EQUAL(Timesheet!RC, ""), "", Timesheet!RC) ->  | C39: =IF(EQUAL(Timesheet!RC, ""), "", Timesheet!RC) ->  | D39: 0 | E39: 0 | F39: 0 | G39: 0 | H39: 0 | I39: 0 | J39: 0 | K39: 0 | L39: 0 | M39: =SUM(RC[-9]:RC[-3]) -> 0
A40: =IF(EQUAL(Timesheet!RC, ""), "", Timesheet!RC) ->  | B40: =IF(EQUAL(Timesheet!RC, ""), "", Timesheet!RC) ->  | C40: =IF(EQUAL(Timesheet!RC, ""), "", Timesheet!RC) ->  | D40: 0 | E40: 0 | F40: 0 | G40: 0 | H40: 0 | I40: 0 | J40: 0 | K40: 0 | L40: 0 | M40: =SUM(RC[-9]:RC[-3]) -> 0
A41: =IF(EQUAL(Timesheet!RC, ""), "", Timesheet!RC) ->  | B41: =IF(EQUAL(Timesheet!RC, ""), "", Timesheet!RC) ->  | C41: =IF(EQUAL(Timesheet!RC, ""), "", Timesheet!RC) ->  | D41: 0 | E41: 0 | F41: 0 | G41: 0 | H41: 0 | I41: 0 | J41: 0 | K41: 0 | L41: 0 | M41: =SUM(RC[-9]:RC[-3]) -> 0
A42: =IF(EQUAL(Timesheet!RC, ""), "", Timesheet!RC) ->  | B42: =IF(EQUAL(Timesheet!RC, ""), "", Timesheet!RC) ->  | C42: =IF(EQUAL(Timesheet!RC, ""), "", Timesheet!RC) ->  | D42: 0 | E42: 0 | F42: 0 | G42: 0 | H42: 0 | I42: 0 | J42: 0 | K42: 0 | L42: 0 | M42: =SUM(RC[-9]:RC[-3]) -> 0
A43: =IF(EQUAL(Timesheet!RC, ""), "", Timesheet!RC) ->  | B43: =IF(EQUAL(Timesheet!RC, ""), "", Timesheet!RC) ->  | C43: =IF(EQUAL(Timesheet!RC, ""), "", Timesheet!RC) ->  | D43: 0 | E43: 0 | F43: 0 | G43: 0 | H43: 0 | I43: 0 | J43: 0 | K43: 0 | L43: 0 | M43: =SUM(RC[-9]:RC[-3]) -> 0
A44: =IF(EQUAL(Timesheet!RC, ""), "", Timesheet!RC) ->  | B44: =IF(EQUAL(Timesheet!RC, ""), "", Timesheet!RC) ->  | C44: =IF(EQUAL(Timesheet!RC, ""), "", Timesheet!RC) ->  | D44: 0 | E44: 0 | F44: 0 | G44: 0 | H44: 0 | I44: 0 | J44: 0 | K44: 0 | L44: 0 | M44: =SUM(RC[-9]:RC[-3]) -> 0
A45: 9029 | B45: 'GIDEON PATT SPECIAL REQUEST - BONDS | C45: 'Mgmnt | D45: 0 | E45: 0 | F45: 0 | G45: 0 | H45: 0 | I45: 0 | J45: 0 | K45: 0 | L45: 0 | M45: =SUM(RC[-9]:RC[-3]) -> 0
A46: =Timesheet!RC ->  | B46: =Timesheet!RC ->  | C46: =Timesheet!RC ->  | D46: 0 | E46: 0 | F46: 0 | G46: 0 | H46: 0 | I46: 0 | J46: 0 | K46: 0 | L46: 0 | M46: =SUM(RC[-9]:RC[-3]) -> 0
A47: =Timesheet!RC ->  | B47: =Timesheet!RC ->  | C47: =Timesheet!RC ->  | D47: 0 | E47: 0 | F47: 0 | G47: 0 | H47: 0 | I47: 0 | J47: 0 | K47: 0 | L47: 0 | M47: =SUM(RC[-9]:RC[-3]) -> 0
A48: =Timesheet!RC ->  | B48: =Timesheet!RC ->  | C48: =Timesheet!RC ->  | D48: 0 | E48: 0 | F48: 0 | G48: 0 | H48: 0 | I48: 0 | J48: 0 | K48: 0 | L48: 0 | M48: =SUM(RC[-9]:RC[-3]) -> 0
A49: =Timesheet!RC ->  | B49: =Timesheet!RC ->  | C49: =Timesheet!RC ->  | D49: 0 | E49: 0 | F49: 0 | G49: 0 | H49: 0 | I49: 0 | J49: 0 | K49: 0 | L49: 0 | M49: =SUM(RC[-9]:RC[-3]) -> 0
A50: =Timesheet!RC ->  | B50: =Timesheet!RC ->  | C50: =Timesheet!RC ->  | D50: 0 | E50: 0 | F50: 0 | G50: 0 | H50: 0 | I50: 0 | J50: 0 | K50: 0 | L50: 0 | M50: =SUM(RC[-9]:RC[-3]) -> 0
A51: =Timesheet!RC ->  | B51: =Timesheet!RC ->  | C51: =Timesheet!RC ->  | D51: 0 | E51: 0 | F51: 0 | G51: 0 | H51: 0 | I51: 0 | J51: 0 | K51: 0 | L51: 0 | M51: =SUM(RC[-9]:RC[-3]) -> 0
A52: =Timesheet!RC ->  | B52: =Timesheet!RC ->  | C52: =Timesheet!RC ->  | D52: 0 | E52: 0 | F52: 0 | G52: 0 | H52: 0 | I52: 0 | J52: 0 | K52: 0 | L52: 0 | M52: =SUM(RC[-9]:RC[-3]) -> 0
A53: =Timesheet!RC ->  | B53: =Timesheet!RC ->  | C53: =Timesheet!RC ->  | D53: 0 | E53: 0 | F53: 0 | G53: 0 | H53: 0 | I53: 0 | J53: 0 | K53: 0 | L53: 0 | M53: =SUM(RC[-9]:RC[-3]) -> 0
A54: 'TOTAL | D54: =SUM(R[-51]C:R[-1]C) -> 0 | E54: =SUM(R[-51]C:R[-1]C) -> 0 | F54: =SUM(R[-51]C:R[-1]C) -> 0 | G54: =SUM(R[-51]C:R[-1]C) -> 0 | H54: =SUM(R[-51]C:R[-1]C) -> 0 | I54: =SUM(R[-51]C:R[-1]C) -> 0 | J54: =SUM(R[-51]C:R[-1]C) -> 0 | K54: =SUM(R[-51]C:R[-1]C) -> 0 | L54: =SUM(R[-51]C:R[-1]C) -> 0 | M54: =SUM(R[-51]C:R[-1]C) -> 0