Sheet: INSTRUCTIONS
A2: WASTE CALENDAR CALCULATOR INSTRUCTIONS
A4: 1) Fill in the "Calendar Year" and "Beginning Inventory".
A6: 2) Enter "Manure Added During the Year" in the appropriate month of clean out (tons).
A8: 3) Fill in the Tract, Field Number, Spreadable Acres, Crop, Planned Amount (Tons), and fill in the amount of waste applied to the field under the appropriate month column.
A10: 4) Do not exceed the "Planned Maximum" application per field by more than 10%.
A12: 5) Highlight by dragging mouse over area to be printed, then select print, click on selected

Sheet: CALENDAR CALCULATOR
A1: WASTE APPLICATION CALENDAR AND CALCULATOR
A3: CALENDAR YEAR= | F3: 2002
F4: Beginning Inventory (Tons)= | G4: 300 | H4: =R[4]C[-1] -> 300 | I4: =R[4]C[-1] -> 800 | J4: =R[4]C[-1] -> 472 | K4: =R[4]C[-1] -> 281 | L4: =R[4]C[-1] -> 281 | M4: =R[4]C[-1] -> 144 | N4: =R[4]C[-1] -> 44 | O4: =R[4]C[-1] -> 44 | P4: =R[4]C[-1] -> 44 | Q4: =R[4]C[-1] -> 44 | R4: =R[4]C[-1] -> 44 | S4: Total Volume During Year
F5: Manure Cleaned/Purchased (Tons)= | G5: 0 | H5: 500 | I5: 0 | J5: 0 | K5: 0 | L5: 0 | M5: 0 | N5: 0 | O5: 0 | P5: 0 | Q5: 0 | R5: 0 | S5: =SUM(RC[-12]:RC[-1]) -> 500
F6: Manure Sold (Tons)= | G6: 0 | H6: 0 | I6: 0 | J6: 0 | K6: 0 | L6: 0 | M6: 100 | N6: 0 | O6: 0 | P6: 0 | Q6: 0 | R6: 0 | S6: =SUM(RC[-12]:RC[-1]) -> 100
F7: Manure Used by Month (Tons) | G7: =SUM(R[3]C:R[203]C) -> 0 | H7: =SUM(R[3]C:R[203]C) -> 0 | I7: =SUM(R[3]C:R[203]C) -> 328 | J7: =SUM(R[3]C:R[203]C) -> 191 | K7: =SUM(R[3]C:R[203]C) -> 0 | L7: =SUM(R[3]C:R[203]C) -> 137 | M7: =SUM(R[3]C:R[203]C) -> 0 | N7: =SUM(R[3]C:R[203]C) -> 0 | O7: =SUM(R[3]C:R[203]C) -> 0 | P7: =SUM(R[3]C:R[203]C) -> 0 | Q7: =SUM(R[3]C:R[203]C) -> 0 | R7: =SUM(R[3]C:R[203]C) -> 0 | S7: =SUM(RC[-12]:RC[-1]) -> 656
F8: Month's Ending Inventory (Tons) | G8: =R[-4]C+R[-3]C-R[-2]C-R[-1]C -> 300 | H8: =R[-4]C+R[-3]C-R[-2]C-R[-1]C -> 800 | I8: =R[-4]C+R[-3]C-R[-2]C-R[-1]C -> 472 | J8: =R[-4]C+R[-3]C-R[-2]C-R[-1]C -> 281 | K8: =R[-4]C+R[-3]C-R[-2]C-R[-1]C -> 281 | L8: =R[-4]C+R[-3]C-R[-2]C-R[-1]C -> 144 | M8: =R[-4]C+R[-3]C-R[-2]C-R[-1]C -> 44 | N8: =R[-4]C+R[-3]C-R[-2]C-R[-1]C -> 44 | O8: =R[-4]C+R[-3]C-R[-2]C-R[-1]C -> 44 | P8: =R[-4]C+R[-3]C-R[-2]C-R[-1]C -> 44 | Q8: =R[-4]C+R[-3]C-R[-2]C-R[-1]C -> 44 | R8: =R[-4]C+R[-3]C-R[-2]C-R[-1]C -> 44 | S8: =R[-4]C[-12]+R[-3]C-R[-2]C-R[-1]C -> 44
A9: Tract | B9: Field No. | C9: Spreadable Acres | D9: Crop | E9: Plan Amt. Tons /Ac. | F9: Total Maximum Tons/Field | G9: January | H9: Feb. | I9: March | J9: April | K9: May | L9: June | M9: July | N9: August | O9: Sept. | P9: Oct. | Q9: Nov. | R9: Dec. | S9: Summed Quantity (Tons) | T9: Remaining Planned (Tons) | U9: Percent Excess
A10: 1111 | B10: 1 | C10: 23 | D10: Bahia Pasture | E10: 2 | F10: =RC[-1]*RC[-3] -> 46 | G10: 0 | H10: 0 | I10: 23 | J10: 0 | K10: 0 | L10: 25 | M10: 0 | N10: 0 | O10: 0 | P10: 0 | Q10: 0 | R10: 0 | S10: =SUM(RC[-12]:RC[-1]) -> 48 | T10: =RC[-14]-RC[-1] -> -2 | U10: =IF(RC[-1]>-1,0,IF(RC[-1]<1,(RC[-2]-RC[-15])/RC[-15],0)) -> 4.3478260869565216E-2
B11: 2 | C11: 12 | D11: Bahia Pasture | E11: 2 | F11: =RC[-1]*RC[-3] -> 24 | G11: 0 | H11: 0 | I11: 12 | J11: 0 | K11: 0 | L11: 12 | M11: 0 | N11: 0 | O11: 0 | P11: 0 | Q11: 0 | R11: 0 | S11: =SUM(RC[-12]:RC[-1]) -> 24 | T11: =RC[-14]-RC[-1] -> 0 | U11: =IF(RC[-1]>-1,0,IF(RC[-1]<1,(RC[-2]-RC[-15])/RC[-15],0)) -> 0
B12: 3 | C12: 15 | D12: Bahia Pasture | E12: 2 | F12: =RC[-1]*RC[-3] -> 30 | G12: 0 | H12: 0 | I12: 15 | J12: 0 | K12: 0 | L12: 15 | M12: 0 | N12: 0 | O12: 0 | P12: 0 | Q12: 0 | R12: 0 | S12: =SUM(RC[-12]:RC[-1]) -> 30 | T12: =RC[-14]-RC[-1] -> 0 | U12: =IF(RC[-1]>-1,0,IF(RC[-1]<1,(RC[-2]-RC[-15])/RC[-15],0)) -> 0
B13: 4 | C13: 10 | D13: Bahia Pasture | E13: 2 | F13: =RC[-1]*RC[-3] -> 20 | G13: 0 | H13: 0 | I13: 10 | J13: 0 | K13: 0 | L13: 10 | M13: 0 | N13: 0 | O13: 0 | P13: 0 | Q13: 0 | R13: 0 | S13: =SUM(RC[-12]:RC[-1]) -> 20 | T13: =RC[-14]-RC[-1] -> 0 | U13: =IF(RC[-1]>-1,0,IF(RC[-1]<1,(RC[-2]-RC[-15])/RC[-15],0)) -> 0
B14: 5 | C14: 25 | D14: Bahia Pasture | E14: 2 | F14: =RC[-1]*RC[-3] -> 50 | G14: 0 | H14: 0 | I14: 25 | J14: 0 | K14: 0 | L14: 30 | M14: 0 | N14: 0 | O14: 0 | P14: 0 | Q14: 0 | R14: 0 | S14: =SUM(RC[-12]:RC[-1]) -> 55 | T14: =RC[-14]-RC[-1] -> -5 | U14: =IF(RC[-1]>-1,0,IF(RC[-1]<1,(RC[-2]-RC[-15])/RC[-15],0)) -> 0.1
B15: 7 | C15: 9 | D15: Bahia Pasture | E15: 2 | F15: =RC[-1]*RC[-3] -> 18 | G15: 0 | H15: 0 | I15: 9 | J15: 0 | K15: 0 | L15: 9 | M15: 0 | N15: 0 | O15: 0 | P15: 0 | Q15: 0 | R15: 0 | S15: =SUM(RC[-12]:RC[-1]) -> 18 | T15: =RC[-14]-RC[-1] -> 0 | U15: =IF(RC[-1]>-1,0,IF(RC[-1]<1,(RC[-2]-RC[-15])/RC[-15],0)) -> 0
B16: 12 | C16: 24 | D16: Bahia Pasture | E16: 2 | F16: =RC[-1]*RC[-3] -> 48 | G16: 0 | H16: 0 | I16: 24 | J16: 0 | K16: 0 | L16: 24 | M16: 0 | N16: 0 | O16: 0 | P16: 0 | Q16: 0 | R16: 0 | S16: =SUM(RC[-12]:RC[-1]) -> 48 | T16: =RC[-14]-RC[-1] -> 0 | U16: =IF(RC[-1]>-1,0,IF(RC[-1]<1,(RC[-2]-RC[-15])/RC[-15],0)) -> 0
B17: 16 | C17: 12 | D17: Bahia Pasture | E17: 2 | F17: =RC[-1]*RC[-3] -> 24 | G17: 0 | H17: 0 | I17: 12 | J17: 0 | K17: 0 | L17: 12 | M17: 0 | N17: 0 | O17: 0 | P17: 0 | Q17: 0 | R17: 0 | S17: =SUM(RC[-12]:RC[-1]) -> 24 | T17: =RC[-14]-RC[-1] -> 0 | U17: =IF(RC[-1]>-1,0,IF(RC[-1]<1,(RC[-2]-RC[-15])/RC[-15],0)) -> 0
B18: 6 | C18: 14 | D18: Corn | E18: 3 | F18: =RC[-1]*RC[-3] -> 42 | G18: 0 | H18: 0 | I18: 42 | J18: 0 | K18: 0 | L18: 0 | M18: 0 | N18: 0 | O18: 0 | P18: 0 | Q18: 0 | R18: 0 | S18: =SUM(RC[-12]:RC[-1]) -> 42 | T18: =RC[-14]-RC[-1] -> 0 | U18: =IF(RC[-1]>-1,0,IF(RC[-1]<1,(RC[-2]-RC[-15])/RC[-15],0)) -> 0
B19: 8 | C19: 19 | D19: Corn | E19: 3 | F19: =RC[-1]*RC[-3] -> 57 | G19: 0 | H19: 0 | I19: 57 | J19: 0 | K19: 0 | L19: 0 | M19: 0 | N19: 0 | O19: 0 | P19: 0 | Q19: 0 | R19: 0 | S19: =SUM(RC[-12]:RC[-1]) -> 57 | T19: =RC[-14]-RC[-1] -> 0 | U19: =IF(RC[-1]>-1,0,IF(RC[-1]<1,(RC[-2]-RC[-15])/RC[-15],0)) -> 0
B20: 9 | C20: 33 | D20: Corn | E20: 3 | F20: =RC[-1]*RC[-3] -> 99 | G20: 0 | H20: 0 | I20: 99 | J20: 0 | K20: 0 | L20: 0 | M20: 0 | N20: 0 | O20: 0 | P20: 0 | Q20: 0 | R20: 0 | S20: =SUM(RC[-12]:RC[-1]) -> 99 | T20: =RC[-14]-RC[-1] -> 0 | U20: =IF(RC[-1]>-1,0,IF(RC[-1]<1,(RC[-2]-RC[-15])/RC[-15],0)) -> 0
B21: 10 | C21: 23 | D21: Cotton | E21: 2 | F21: =RC[-1]*RC[-3] -> 46 | G21: 0 | H21: 0 | I21: 0 | J21: 46 | K21: 0 | L21: 0 | M21: 0 | N21: 0 | O21: 0 | P21: 0 | Q21: 0 | R21: 0 | S21: =SUM(RC[-12]:RC[-1]) -> 46 | T21: =RC[-14]-RC[-1] -> 0 | U21: =IF(RC[-1]>-1,0,IF(RC[-1]<1,(RC[-2]-RC[-15])/RC[-15],0)) -> 0
B22: 11 | C22: 50 | D22: Cotton | E22: 2 | F22: =RC[-1]*RC[-3] -> 100 | G22: 0 | H22: 0 | I22: 0 | J22: 100 | K22: 0 | L22: 0 | M22: 0 | N22: 0 | O22: 0 | P22: 0 | Q22: 0 | R22: 0 | S22: =SUM(RC[-12]:RC[-1]) -> 100 | T22: =RC[-14]-RC[-1] -> 0 | U22: =IF(RC[-1]>-1,0,IF(RC[-1]<1,(RC[-2]-RC[-15])/RC[-15],0)) -> 0
B23: 13 | C23: 45 | D23: Cotton | E23: 2 | F23: =RC[-1]*RC[-3] -> 90 | G23: 0 | H23: 0 | I23: 0 | J23: 45 | K23: 0 | L23: 0 | M23: 0 | N23: 0 | O23: 0 | P23: 0 | Q23: 0 | R23: 0 | S23: =SUM(RC[-12]:RC[-1]) -> 45 | T23: =RC[-14]-RC[-1] -> 45 | U23: =IF(RC[-1]>-1,0,IF(RC[-1]<1,(RC[-2]-RC[-15])/RC[-15],0)) -> 0
C24: 0 | E24: 0 | F24: =RC[-1]*RC[-3] -> 0 | G24: 0 | H24: 0 | I24: 0 | J24: 0 | K24: 0 | L24: 0 | M24: 0 | N24: 0 | O24: 0 | P24: 0 | Q24: 0 | R24: 0 | S24: =SUM(RC[-12]:RC[-1]) -> 0 | T24: =RC[-14]-RC[-1] -> 0 | U24: =IF(RC[-1]>-1,0,IF(RC[-1]<1,(RC[-2]-RC[-15])/RC[-15],0)) -> 0
C25: 0 | E25: 0 | F25: =RC[-1]*RC[-3] -> 0 | G25: 0 | H25: 0 | I25: 0 | J25: 0 | K25: 0 | L25: 0 | M25: 0 | N25: 0 | O25: 0 | P25: 0 | Q25: 0 | R25: 0 | S25: =SUM(RC[-12]:RC[-1]) -> 0 | T25: =RC[-14]-RC[-1] -> 0 | U25: =IF(RC[-1]>-1,0,IF(RC[-1]<1,(RC[-2]-RC[-15])/RC[-15],0)) -> 0
C26: 0 | E26: 0 | F26: =RC[-1]*RC[-3] -> 0 | G26: 0 | H26: 0 | I26: 0 | J26: 0 | K26: 0 | L26: 0 | M26: 0 | N26: 0 | O26: 0 | P26: 0 | Q26: 0 | R26: 0 | S26: =SUM(RC[-12]:RC[-1]) -> 0 | T26: =RC[-14]-RC[-1] -> 0 | U26: =IF(RC[-1]>-1,0,IF(RC[-1]<1,(RC[-2]-RC[-15])/RC[-15],0)) -> 0
C27: 0 | E27: 0 | F27: =RC[-1]*RC[-3] -> 0 | G27: 0 | H27: 0 | I27: 0 | J27: 0 | K27: 0 | L27: 0 | M27: 0 | N27: 0 | O27: 0 | P27: 0 | Q27: 0 | R27: 0 | S27: =SUM(RC[-12]:RC[-1]) -> 0 | T27: =RC[-14]-RC[-1] -> 0 | U27: =IF(RC[-1]>-1,0,IF(RC[-1]<1,(RC[-2]-RC[-15])/RC[-15],0)) -> 0
C28: 0 | E28: 0 | F28: =RC[-1]*RC[-3] -> 0 | G28: 0 | H28: 0 | I28: 0 | J28: 0 | K28: 0 | L28: 0 | M28: 0 | N28: 0 | O28: 0 | P28: 0 | Q28: 0 | R28: 0 | S28: =SUM(RC[-12]:RC[-1]) -> 0 | T28: =RC[-14]-RC[-1] -> 0 | U28: =IF(RC[-1]>-1,0,IF(RC[-1]<1,(RC[-2]-RC[-15])/RC[-15],0)) -> 0
C29: 0 | E29: 0 | F29: =RC[-1]*RC[-3] -> 0 | G29: 0 | H29: 0 | I29: 0 | J29: 0 | K29: 0 | L29: 0 | M29: 0 | N29: 0 | O29: 0 | P29: 0 | Q29: 0 | R29: 0 | S29: =SUM(RC[-12]:RC[-1]) -> 0 | T29: =RC[-14]-RC[-1] -> 0 | U29: =IF(RC[-1]>-1,0,IF(RC[-1]<1,(RC[-2]-RC[-15])/RC[-15],0)) -> 0
C30: 0 | E30: 0 | F30: =RC[-1]*RC[-3] -> 0 | G30: 0 | H30: 0 | I30: 0 | J30: 0 | K30: 0 | L30: 0 | M30: 0 | N30: 0 | O30: 0 | P30: 0 | Q30: 0 | R30: 0 | S30: =SUM(RC[-12]:RC[-1]) -> 0 | T30: =RC[-14]-RC[-1] -> 0 | U30: =IF(RC[-1]>-1,0,IF(RC[-1]<1,(RC[-2]-RC[-15])/RC[-15],0)) -> 0
C31: 0 | E31: 0 | F31: =RC[-1]*RC[-3] -> 0 | G31: 0 | H31: 0 | I31: 0 | J31: 0 | K31: 0 | L31: 0 | M31: 0 | N31: 0 | O31: 0 | P31: 0 | Q31: 0 | R31: 0 | S31: =SUM(RC[-12]:RC[-1]) -> 0 | T31: =RC[-14]-RC[-1] -> 0 | U31: =IF(RC[-1]>-1,0,IF(RC[-1]<1,(RC[-2]-RC[-15])/RC[-15],0)) -> 0
C32: 0 | E32: 0 | F32: =RC[-1]*RC[-3] -> 0 | G32: 0 | H32: 0 | I32: 0 | J32: 0 | K32: 0 | L32: 0 | M32: 0 | N32: 0 | O32: 0 | P32: 0 | Q32: 0 | R32: 0 | S32: =SUM(RC[-12]:RC[-1]) -> 0 | T32: =RC[-14]-RC[-1] -> 0 | U32: =IF(RC[-1]>-1,0,IF(RC[-1]<1,(RC[-2]-RC[-15])/RC[-15],0)) -> 0
C33: 0 | E33: 0 | F33: =RC[-1]*RC[-3] -> 0 | G33: 0 | H33: 0 | I33: 0 | J33: 0 | K33: 0 | L33: 0 | M33: 0 | N33: 0 | O33: 0 | P33: 0 | Q33: 0 | R33: 0 | S33: =SUM(RC[-12]:RC[-1]) -> 0 | T33: =RC[-14]-RC[-1] -> 0 | U33: =IF(RC[-1]>-1,0,IF(RC[-1]<1,(RC[-2]-RC[-15])/RC[-15],0)) -> 0
C34: 0 | E34: 0 | F34: =RC[-1]*RC[-3] -> 0 | G34: 0 | H34: 0 | I34: 0 | J34: 0 | K34: 0 | L34: 0 | M34: 0 | N34: 0 | O34: 0 | P34: 0 | Q34: 0 | R34: 0 | S34: =SUM(RC[-12]:RC[-1]) -> 0 | T34: =RC[-14]-RC[-1] -> 0 | U34: =IF(RC[-1]>-1,0,IF(RC[-1]<1,(RC[-2]-RC[-15])/RC[-15],0)) -> 0
C35: 0 | E35: 0 | F35: =RC[-1]*RC[-3] -> 0 | G35: 0 | H35: 0 | I35: 0 | J35: 0 | K35: 0 | L35: 0 | M35: 0 | N35: 0 | O35: 0 | P35: 0 | Q35: 0 | R35: 0 | S35: =SUM(RC[-12]:RC[-1]) -> 0 | T35: =RC[-14]-RC[-1] -> 0 | U35: =IF(RC[-1]>-1,0,IF(RC[-1]<1,(RC[-2]-RC[-15])/RC[-15],0)) -> 0
C36: 0 | E36: 0 | F36: =RC[-1]*RC[-3] -> 0 | G36: 0 | H36: 0 | I36: 0 | J36: 0 | K36: 0 | L36: 0 | M36: 0 | N36: 0 | O36: 0 | P36: 0 | Q36: 0 | R36: 0 | S36: =SUM(RC[-12]:RC[-1]) -> 0 | T36: =RC[-14]-RC[-1] -> 0 | U36: =IF(RC[-1]>-1,0,IF(RC[-1]<1,(RC[-2]-RC[-15])/RC[-15],0)) -> 0
C37: 0 | E37: 0 | F37: =RC[-1]*RC[-3] -> 0 | G37: 0 | H37: 0 | I37: 0 | J37: 0 | K37: 0 | L37: 0 | M37: 0 | N37: 0 | O37: 0 | P37: 0 | Q37: 0 | R37: 0 | S37: =SUM(RC[-12]:RC[-1]) -> 0 | T37: =RC[-14]-RC[-1] -> 0 | U37: =IF(RC[-1]>-1,0,IF(RC[-1]<1,(RC[-2]-RC[-15])/RC[-15],0)) -> 0
C38: 0 | E38: 0 | F38: =RC[-1]*RC[-3] -> 0 | G38: 0 | H38: 0 | I38: 0 | J38: 0 | K38: 0 | L38: 0 | M38: 0 | N38: 0 | O38: 0 | P38: 0 | Q38: 0 | R38: 0 | S38: =SUM(RC[-12]:RC[-1]) -> 0 | T38: =RC[-14]-RC[-1] -> 0 | U38: =IF(RC[-1]>-1,0,IF(RC[-1]<1,(RC[-2]-RC[-15])/RC[-15],0)) -> 0
C39: 0 | E39: 0 | F39: =RC[-1]*RC[-3] -> 0 | G39: 0 | H39: 0 | I39: 0 | J39: 0 | K39: 0 | L39: 0 | M39: 0 | N39: 0 | O39: 0 | P39: 0 | Q39: 0 | R39: 0 | S39: =SUM(RC[-12]:RC[-1]) -> 0 | T39: =RC[-14]-RC[-1] -> 0 | U39: =IF(RC[-1]>-1,0,IF(RC[-1]<1,(RC[-2]-RC[-15])/RC[-15],0)) -> 0
C40: 0 | E40: 0 | F40: =RC[-1]*RC[-3] -> 0 | G40: 0 | H40: 0 | I40: 0 | J40: 0 | K40: 0 | L40: 0 | M40: 0 | N40: 0 | O40: 0 | P40: 0 | Q40: 0 | R40: 0 | S40: =SUM(RC[-12]:RC[-1]) -> 0 | T40: =RC[-14]-RC[-1] -> 0 | U40: =IF(RC[-1]>-1,0,IF(RC[-1]<1,(RC[-2]-RC[-15])/RC[-15],0)) -> 0
C41: 0 | E41: 0 | F41: =RC[-1]*RC[-3] -> 0 | G41: 0 | H41: 0 | I41: 0 | J41: 0 | K41: 0 | L41: 0 | M41: 0 | N41: 0 | O41: 0 | P41: 0 | Q41: 0 | R41: 0 | S41: =SUM(RC[-12]:RC[-1]) -> 0 | T41: =RC[-14]-RC[-1] -> 0 | U41: =IF(RC[-1]>-1,0,IF(RC[-1]<1,(RC[-2]-RC[-15])/RC[-15],0)) -> 0
C42: 0 | E42: 0 | F42: =RC[-1]*RC[-3] -> 0 | G42: 0 | H42: 0 | I42: 0 | J42: 0 | K42: 0 | L42: 0 | M42: 0 | N42: 0 | O42: 0 | P42: 0 | Q42: 0 | R42: 0 | S42: =SUM(RC[-12]:RC[-1]) -> 0 | T42: =RC[-14]-RC[-1] -> 0 | U42: =IF(RC[-1]>-1,0,IF(RC[-1]<1,(RC[-2]-RC[-15])/RC[-15],0)) -> 0
C43: 0 | E43: 0 | F43: =RC[-1]*RC[-3] -> 0 | G43: 0 | H43: 0 | I43: 0 | J43: 0 | K43: 0 | L43: 0 | M43: 0 | N43: 0 | O43: 0 | P43: 0 | Q43: 0 | R43: 0 | S43: =SUM(RC[-12]:RC[-1]) -> 0 | T43: =RC[-14]-RC[-1] -> 0 | U43: =IF(RC[-1]>-1,0,IF(RC[-1]<1,(RC[-2]-RC[-15])/RC[-15],0)) -> 0
C44: 0 | E44: 0 | F44: =RC[-1]*RC[-3] -> 0 | G44: 0 | H44: 0 | I44: 0 | J44: 0 | K44: 0 | L44: 0 | M44: 0 | N44: 0 | O44: 0 | P44: 0 | Q44: 0 | R44: 0 | S44: =SUM(RC[-12]:RC[-1]) -> 0 | T44: =RC[-14]-RC[-1] -> 0 | U44: =IF(RC[-1]>-1,0,IF(RC[-1]<1,(RC[-2]-RC[-15])/RC[-15],0)) -> 0
C45: 0 | E45: 0 | F45: =RC[-1]*RC[-3] -> 0 | G45: 0 | H45: 0 | I45: 0 | J45: 0 | K45: 0 | L45: 0 | M45: 0 | N45: 0 | O45: 0 | P45: 0 | Q45: 0 | R45: 0 | S45: =SUM(RC[-12]:RC[-1]) -> 0 | T45: =RC[-14]-RC[-1] -> 0 | U45: =IF(RC[-1]>-1,0,IF(RC[-1]<1,(RC[-2]-RC[-15])/RC[-15],0)) -> 0
C46: 0 | E46: 0 | F46: =RC[-1]*RC[-3] -> 0 | G46: 0 | H46: 0 | I46: 0 | J46: 0 | K46: 0 | L46: 0 | M46: 0 | N46: 0 | O46: 0 | P46: 0 | Q46: 0 | R46: 0 | S46: =SUM(RC[-12]:RC[-1]) -> 0 | T46: =RC[-14]-RC[-1] -> 0 | U46: =IF(RC[-1]>-1,0,IF(RC[-1]<1,(RC[-2]-RC[-15])/RC[-15],0)) -> 0
C47: 0 | E47: 0 | F47: =RC[-1]*RC[-3] -> 0 | G47: 0 | H47: 0 | I47: 0 | J47: 0 | K47: 0 | L47: 0 | M47: 0 | N47: 0 | O47: 0 | P47: 0 | Q47: 0 | R47: 0 | S47: =SUM(RC[-12]:RC[-1]) -> 0 | T47: =RC[-14]-RC[-1] -> 0 | U47: =IF(RC[-1]>-1,0,IF(RC[-1]<1,(RC[-2]-RC[-15])/RC[-15],0)) -> 0
C48: 0 | E48: 0 | F48: =RC[-1]*RC[-3] -> 0 | G48: 0 | H48: 0 | I48: 0 | J48: 0 | K48: 0 | L48: 0 | M48: 0 | N48: 0 | O48: 0 | P48: 0 | Q48: 0 | R48: 0 | S48: =SUM(RC[-12]:RC[-1]) -> 0 | T48: =RC[-14]-RC[-1] -> 0 | U48: =IF(RC[-1]>-1,0,IF(RC[-1]<1,(RC[-2]-RC[-15])/RC[-15],0)) -> 0
C49: 0 | E49: 0 | F49: =RC[-1]*RC[-3] -> 0 | G49: 0 | H49: 0 | I49: 0 | J49: 0 | K49: 0 | L49: 0 | M49: 0 | N49: 0 | O49: 0 | P49: 0 | Q49: 0 | R49: 0 | S49: =SUM(RC[-12]:RC[-1]) -> 0 | T49: =RC[-14]-RC[-1] -> 0 | U49: =IF(RC[-1]>-1,0,IF(RC[-1]<1,(RC[-2]-RC[-15])/RC[-15],0)) -> 0
C50: 0 | E50: 0 | F50: =RC[-1]*RC[-3] -> 0 | G50: 0 | H50: 0 | I50: 0 | J50: 0 | K50: 0 | L50: 0 | M50: 0 | N50: 0 | O50: 0 | P50: 0 | Q50: 0 | R50: 0 | S50: =SUM(RC[-12]:RC[-1]) -> 0 | T50: =RC[-14]-RC[-1] -> 0 | U50: =IF(RC[-1]>-1,0,IF(RC[-1]<1,(RC[-2]-RC[-15])/RC[-15],0)) -> 0
C51: 0 | E51: 0 | F51: =RC[-1]*RC[-3] -> 0 | G51: 0 | H51: 0 | I51: 0 | J51: 0 | K51: 0 | L51: 0 | M51: 0 | N51: 0 | O51: 0 | P51: 0 | Q51: 0 | R51: 0 | S51: =SUM(RC[-12]:RC[-1]) -> 0 | T51: =RC[-14]-RC[-1] -> 0 | U51: =IF(RC[-1]>-1,0,IF(RC[-1]<1,(RC[-2]-RC[-15])/RC[-15],0)) -> 0
C52: 0 | E52: 0 | F52: =RC[-1]*RC[-3] -> 0 | G52: 0 | H52: 0 | I52: 0 | J52: 0 | K52: 0 | L52: 0 | M52: 0 | N52: 0 | O52: 0 | P52: 0 | Q52: 0 | R52: 0 | S52: =SUM(RC[-12]:RC[-1]) -> 0 | T52: =RC[-14]-RC[-1] -> 0 | U52: =IF(RC[-1]>-1,0,IF(RC[-1]<1,(RC[-2]-RC[-15])/RC[-15],0)) -> 0
C53: 0 | E53: 0 | F53: =RC[-1]*RC[-3] -> 0 | G53: 0 | H53: 0 | I53: 0 | J53: 0 | K53: 0 | L53: 0 | M53: 0 | N53: 0 | O53: 0 | P53: 0 | Q53: 0 | R53: 0 | S53: =SUM(RC[-12]:RC[-1]) -> 0 | T53: =RC[-14]-RC[-1] -> 0 | U53: =IF(RC[-1]>-1,0,IF(RC[-1]<1,(RC[-2]-RC[-15])/RC[-15],0)) -> 0
C54: 0 | E54: 0 | F54: =RC[-1]*RC[-3] -> 0 | G54: 0 | H54: 0 | I54: 0 | J54: 0 | K54: 0 | L54: 0 | M54: 0 | N54: 0 | O54: 0 | P54: 0 | Q54: 0 | R54: 0 | S54: =SUM(RC[-12]:RC[-1]) -> 0 | T54: =RC[-14]-RC[-1] -> 0 | U54: =IF(RC[-1]>-1,0,IF(RC[-1]<1,(RC[-2]-RC[-15])/RC[-15],0)) -> 0
C55: 0 | E55: 0 | F55: =RC[-1]*RC[-3] -> 0 | G55: 0 | H55: 0 | I55: 0 | J55: 0 | K55: 0 | L55: 0 | M55: 0 | N55: 0 | O55: 0 | P55: 0 | Q55: 0 | R55: 0 | S55: =SUM(RC[-12]:RC[-1]) -> 0 | T55: =RC[-14]-RC[-1] -> 0 | U55: =IF(RC[-1]>-1,0,IF(RC[-1]<1,(RC[-2]-RC[-15])/RC[-15],0)) -> 0
C56: 0 | E56: 0 | F56: =RC[-1]*RC[-3] -> 0 | G56: 0 | H56: 0 | I56: 0 | J56: 0 | K56: 0 | L56: 0 | M56: 0 | N56: 0 | O56: 0 | P56: 0 | Q56: 0 | R56: 0 | S56: =SUM(RC[-12]:RC[-1]) -> 0 | T56: =RC[-14]-RC[-1] -> 0 | U56: =IF(RC[-1]>-1,0,IF(RC[-1]<1,(RC[-2]-RC[-15])/RC[-15],0)) -> 0
C57: 0 | E57: 0 | F57: =RC[-1]*RC[-3] -> 0 | G57: 0 | H57: 0 | I57: 0 | J57: 0 | K57: 0 | L57: 0 | M57: 0 | N57: 0 | O57: 0 | P57: 0 | Q57: 0 | R57: 0 | S57: =SUM(RC[-12]:RC[-1]) -> 0 | T57: =RC[-14]-RC[-1] -> 0 | U57: =IF(RC[-1]>-1,0,IF(RC[-1]<1,(RC[-2]-RC[-15])/RC[-15],0)) -> 0
C58: 0 | E58: 0 | F58: =RC[-1]*RC[-3] -> 0 | G58: 0 | H58: 0 | I58: 0 | J58: 0 | K58: 0 | L58: 0 | M58: 0 | N58: 0 | O58: 0 | P58: 0 | Q58: 0 | R58: 0 | S58: =SUM(RC[-12]:RC[-1]) -> 0 | T58: =RC[-14]-RC[-1] -> 0 | U58: =IF(RC[-1]>-1,0,IF(RC[-1]<1,(RC[-2]-RC[-15])/RC[-15],0)) -> 0
C59: 0 | E59: 0 | F59: =RC[-1]*RC[-3] -> 0 | G59: 0 | H59: 0 | I59: 0 | J59: 0 | K59: 0 | L59: 0 | M59: 0 | N59: 0 | O59: 0 | P59: 0 | Q59: 0 | R59: 0 | S59: =SUM(RC[-12]:RC[-1]) -> 0 | T59: =RC[-14]-RC[-1] -> 0 | U59: =IF(RC[-1]>-1,0,IF(RC[-1]<1,(RC[-2]-RC[-15])/RC[-15],0)) -> 0
C60: 0 | E60: 0 | F60: =RC[-1]*RC[-3] -> 0 | G60: 0 | H60: 0 | I60: 0 | J60: 0 | K60: 0 | L60: 0 | M60: 0 | N60: 0 | O60: 0 | P60: 0 | Q60: 0 | R60: 0 | S60: =SUM(RC[-12]:RC[-1]) -> 0 | T60: =RC[-14]-RC[-1] -> 0 | U60: =IF(RC[-1]>-1,0,IF(RC[-1]<1,(RC[-2]-RC[-15])/RC[-15],0)) -> 0
C61: 0 | E61: 0 | F61: =RC[-1]*RC[-3] -> 0 | G61: 0 | H61: 0 | I61: 0 | J61: 0 | K61: 0 | L61: 0 | M61: 0 | N61: 0 | O61: 0 | P61: 0 | Q61: 0 | R61: 0 | S61: =SUM(RC[-12]:RC[-1]) -> 0 | T61: =RC[-14]-RC[-1] -> 0 | U61: =IF(RC[-1]>-1,0,IF(RC[-1]<1,(RC[-2]-RC[-15])/RC[-15],0)) -> 0
C62: 0 | E62: 0 | F62: =RC[-1]*RC[-3] -> 0 | G62: 0 | H62: 0 | I62: 0 | J62: 0 | K62: 0 | L62: 0 | M62: 0 | N62: 0 | O62: 0 | P62: 0 | Q62: 0 | R62: 0 | S62: =SUM(RC[-12]:RC[-1]) -> 0 | T62: =RC[-14]-RC[-1] -> 0 | U62: =IF(RC[-1]>-1,0,IF(RC[-1]<1,(RC[-2]-RC[-15])/RC[-15],0)) -> 0
C63: 0 | E63: 0 | F63: =RC[-1]*RC[-3] -> 0 | G63: 0 | H63: 0 | I63: 0 | J63: 0 | K63: 0 | L63: 0 | M63: 0 | N63: 0 | O63: 0 | P63: 0 | Q63: 0 | R63: 0 | S63: =SUM(RC[-12]:RC[-1]) -> 0 | T63: =RC[-14]-RC[-1] -> 0 | U63: =IF(RC[-1]>-1,0,IF(RC[-1]<1,(RC[-2]-RC[-15])/RC[-15],0)) -> 0
C64: 0 | E64: 0 | F64: =RC[-1]*RC[-3] -> 0 | G64: 0 | H64: 0 | I64: 0 | J64: 0 | K64: 0 | L64: 0 | M64: 0 | N64: 0 | O64: 0 | P64: 0 | Q64: 0 | R64: 0 | S64: =SUM(RC[-12]:RC[-1]) -> 0 | T64: =RC[-14]-RC[-1] -> 0 | U64: =IF(RC[-1]>-1,0,IF(RC[-1]<1,(RC[-2]-RC[-15])/RC[-15],0)) -> 0
C65: 0 | E65: 0 | F65: =RC[-1]*RC[-3] -> 0 | G65: 0 | H65: 0 | I65: 0 | J65: 0 | K65: 0 | L65: 0 | M65: 0 | N65: 0 | O65: 0 | P65: 0 | Q65: 0 | R65: 0 | S65: =SUM(RC[-12]:RC[-1]) -> 0 | T65: =RC[-14]-RC[-1] -> 0 | U65: =IF(RC[-1]>-1,0,IF(RC[-1]<1,(RC[-2]-RC[-15])/RC[-15],0)) -> 0
C66: 0 | E66: 0 | F66: =RC[-1]*RC[-3] -> 0 | G66: 0 | H66: 0 | I66: 0 | J66: 0 | K66: 0 | L66: 0 | M66: 0 | N66: 0 | O66: 0 | P66: 0 | Q66: 0 | R66: 0 | S66: =SUM(RC[-12]:RC[-1]) -> 0 | T66: =RC[-14]-RC[-1] -> 0 | U66: =IF(RC[-1]>-1,0,IF(RC[-1]<1,(RC[-2]-RC[-15])/RC[-15],0)) -> 0
C67: 0 | E67: 0 | F67: =RC[-1]*RC[-3] -> 0 | G67: 0 | H67: 0 | I67: 0 | J67: 0 | K67: 0 | L67: 0 | M67: 0 | N67: 0 | O67: 0 | P67: 0 | Q67: 0 | R67: 0 | S67: =SUM(RC[-12]:RC[-1]) -> 0 | T67: =RC[-14]-RC[-1] -> 0 | U67: =IF(RC[-1]>-1,0,IF(RC[-1]<1,(RC[-2]-RC[-15])/RC[-15],0)) -> 0
C68: 0 | E68: 0 | F68: =RC[-1]*RC[-3] -> 0 | G68: 0 | H68: 0 | I68: 0 | J68: 0 | K68: 0 | L68: 0 | M68: 0 | N68: 0 | O68: 0 | P68: 0 | Q68: 0 | R68: 0 | S68: =SUM(RC[-12]:RC[-1]) -> 0 | T68: =RC[-14]-RC[-1] -> 0 | U68: =IF(RC[-1]>-1,0,IF(RC[-1]<1,(RC[-2]-RC[-15])/RC[-15],0)) -> 0
C69: 0 | E69: 0 | F69: =RC[-1]*RC[-3] -> 0 | G69: 0 | H69: 0 | I69: 0 | J69: 0 | K69: 0 | L69: 0 | M69: 0 | N69: 0 | O69: 0 | P69: 0 | Q69: 0 | R69: 0 | S69: =SUM(RC[-12]:RC[-1]) -> 0 | T69: =RC[-14]-RC[-1] -> 0 | U69: =IF(RC[-1]>-1,0,IF(RC[-1]<1,(RC[-2]-RC[-15])/RC[-15],0)) -> 0
C70: 0 | E70: 0 | F70: =RC[-1]*RC[-3] -> 0 | G70: 0 | H70: 0 | I70: 0 | J70: 0 | K70: 0 | L70: 0 | M70: 0 | N70: 0 | O70: 0 | P70: 0 | Q70: 0 | R70: 0 | S70: =SUM(RC[-12]:RC[-1]) -> 0 | T70: =RC[-14]-RC[-1] -> 0 | U70: =IF(RC[-1]>-1,0,IF(RC[-1]<1,(RC[-2]-RC[-15])/RC[-15],0)) -> 0
C71: 0 | E71: 0 | F71: =RC[-1]*RC[-3] -> 0 | G71: 0 | H71: 0 | I71: 0 | J71: 0 | K71: 0 | L71: 0 | M71: 0 | N71: 0 | O71: 0 | P71: 0 | Q71: 0 | R71: 0 | S71: =SUM(RC[-12]:RC[-1]) -> 0 | T71: =RC[-14]-RC[-1] -> 0 | U71: =IF(RC[-1]>-1,0,IF(RC[-1]<1,(RC[-2]-RC[-15])/RC[-15],0)) -> 0
C72: 0 | E72: 0 | F72: =RC[-1]*RC[-3] -> 0 | G72: 0 | H72: 0 | I72: 0 | J72: 0 | K72: 0 | L72: 0 | M72: 0 | N72: 0 | O72: 0 | P72: 0 | Q72: 0 | R72: 0 | S72: =SUM(RC[-12]:RC[-1]) -> 0 | T72: =RC[-14]-RC[-1] -> 0 | U72: =IF(RC[-1]>-1,0,IF(RC[-1]<1,(RC[-2]-RC[-15])/RC[-15],0)) -> 0
C73: 0 | E73: 0 | F73: =RC[-1]*RC[-3] -> 0 | G73: 0 | H73: 0 | I73: 0 | J73: 0 | K73: 0 | L73: 0 | M73: 0 | N73: 0 | O73: 0 | P73: 0 | Q73: 0 | R73: 0 | S73: =SUM(RC[-12]:RC[-1]) -> 0 | T73: =RC[-14]-RC[-1] -> 0 | U73: =IF(RC[-1]>-1,0,IF(RC[-1]<1,(RC[-2]-RC[-15])/RC[-15],0)) -> 0
C74: 0 | E74: 0 | F74: =RC[-1]*RC[-3] -> 0 | G74: 0 | H74: 0 | I74: 0 | J74: 0 | K74: 0 | L74: 0 | M74: 0 | N74: 0 | O74: 0 | P74: 0 | Q74: 0 | R74: 0 | S74: =SUM(RC[-12]:RC[-1]) -> 0 | T74: =RC[-14]-RC[-1] -> 0 | U74: =IF(RC[-1]>-1,0,IF(RC[-1]<1,(RC[-2]-RC[-15])/RC[-15],0)) -> 0
C75: 0 | E75: 0 | F75: =RC[-1]*RC[-3] -> 0 | G75: 0 | H75: 0 | I75: 0 | J75: 0 | K75: 0 | L75: 0 | M75: 0 | N75: 0 | O75: 0 | P75: 0 | Q75: 0 | R75: 0 | S75: =SUM(RC[-12]:RC[-1]) -> 0 | T75: =RC[-14]-RC[-1] -> 0 | U75: =IF(RC[-1]>-1,0,IF(RC[-1]<1,(RC[-2]-RC[-15])/RC[-15],0)) -> 0
C76: 0 | E76: 0 | F76: =RC[-1]*RC[-3] -> 0 | G76: 0 | H76: 0 | I76: 0 | J76: 0 | K76: 0 | L76: 0 | M76: 0 | N76: 0 | O76: 0 | P76: 0 | Q76: 0 | R76: 0 | S76: =SUM(RC[-12]:RC[-1]) -> 0 | T76: =RC[-14]-RC[-1] -> 0 | U76: =IF(RC[-1]>-1,0,IF(RC[-1]<1,(RC[-2]-RC[-15])/RC[-15],0)) -> 0
C77: 0 | E77: 0 | F77: =RC[-1]*RC[-3] -> 0 | G77: 0 | H77: 0 | I77: 0 | J77: 0 | K77: 0 | L77: 0 | M77: 0 | N77: 0 | O77: 0 | P77: 0 | Q77: 0 | R77: 0 | S77: =SUM(RC[-12]:RC[-1]) -> 0 | T77: =RC[-14]-RC[-1] -> 0 | U77: =IF(RC[-1]>-1,0,IF(RC[-1]<1,(RC[-2]-RC[-15])/RC[-15],0)) -> 0
C78: 0 | E78: 0 | F78: =RC[-1]*RC[-3] -> 0 | G78: 0 | H78: 0 | I78: 0 | J78: 0 | K78: 0 | L78: 0 | M78: 0 | N78: 0 | O78: 0 | P78: 0 | Q78: 0 | R78: 0 | S78: =SUM(RC[-12]:RC[-1]) -> 0 | T78: =RC[-14]-RC[-1] -> 0 | U78: =IF(RC[-1]>-1,0,IF(RC[-1]<1,(RC[-2]-RC[-15])/RC[-15],0)) -> 0
C79: 0 | E79: 0 | F79: =RC[-1]*RC[-3] -> 0 | G79: 0 | H79: 0 | I79: 0 | J79: 0 | K79: 0 | L79: 0 | M79: 0 | N79: 0 | O79: 0 | P79: 0 | Q79: 0 | R79: 0 | S79: =SUM(RC[-12]:RC[-1]) -> 0 | T79: =RC[-14]-RC[-1] -> 0 | U79: =IF(RC[-1]>-1,0,IF(RC[-1]<1,(RC[-2]-RC[-15])/RC[-15],0)) -> 0
C80: 0 | E80: 0 | F80: =RC[-1]*RC[-3] -> 0 | G80: 0 | H80: 0 | I80: 0 | J80: 0 | K80: 0 | L80: 0 | M80: 0 | N80: 0 | O80: 0 | P80: 0 | Q80: 0 | R80: 0 | S80: =SUM(RC[-12]:RC[-1]) -> 0 | T80: =RC[-14]-RC[-1] -> 0 | U80: =IF(RC[-1]>-1,0,IF(RC[-1]<1,(RC[-2]-RC[-15])/RC[-15],0)) -> 0
C81: 0 | E81: 0 | F81: =RC[-1]*RC[-3] -> 0 | G81: 0 | H81: 0 | I81: 0 | J81: 0 | K81: 0 | L81: 0 | M81: 0 | N81: 0 | O81: 0 | P81: 0 | Q81: 0 | R81: 0 | S81: =SUM(RC[-12]:RC[-1]) -> 0 | T81: =RC[-14]-RC[-1] -> 0 | U81: =IF(RC[-1]>-1,0,IF(RC[-1]<1,(RC[-2]-RC[-15])/RC[-15],0)) -> 0
C82: 0 | E82: 0 | F82: =RC[-1]*RC[-3] -> 0 | G82: 0 | H82: 0 | I82: 0 | J82: 0 | K82: 0 | L82: 0 | M82: 0 | N82: 0 | O82: 0 | P82: 0 | Q82: 0 | R82: 0 | S82: =SUM(RC[-12]:RC[-1]) -> 0 | T82: =RC[-14]-RC[-1] -> 0 | U82: =IF(RC[-1]>-1,0,IF(RC[-1]<1,(RC[-2]-RC[-15])/RC[-15],0)) -> 0
C83: 0 | E83: 0 | F83: =RC[-1]*RC[-3] -> 0 | G83: 0 | H83: 0 | I83: 0 | J83: 0 | K83: 0 | L83: 0 | M83: 0 | N83: 0 | O83: 0 | P83: 0 | Q83: 0 | R83: 0 | S83: =SUM(RC[-12]:RC[-1]) -> 0 | T83: =RC[-14]-RC[-1] -> 0 | U83: =IF(RC[-1]>-1,0,IF(RC[-1]<1,(RC[-2]-RC[-15])/RC[-15],0)) -> 0
C84: 0 | E84: 0 | F84: =RC[-1]*RC[-3] -> 0 | G84: 0 | H84: 0 | I84: 0 | J84: 0 | K84: 0 | L84: 0 | M84: 0 | N84: 0 | O84: 0 | P84: 0 | Q84: 0 | R84: 0 | S84: =SUM(RC[-12]:RC[-1]) -> 0 | T84: =RC[-14]-RC[-1] -> 0 | U84: =IF(RC[-1]>-1,0,IF(RC[-1]<1,(RC[-2]-RC[-15])/RC[-15],0)) -> 0
C85: 0 | E85: 0 | F85: =RC[-1]*RC[-3] -> 0 | G85: 0 | H85: 0 | I85: 0 | J85: 0 | K85: 0 | L85: 0 | M85: 0 | N85: 0 | O85: 0 | P85: 0 | Q85: 0 | R85: 0 | S85: =SUM(RC[-12]:RC[-1]) -> 0 | T85: =RC[-14]-RC[-1] -> 0 | U85: =IF(RC[-1]>-1,0,IF(RC[-1]<1,(RC[-2]-RC[-15])/RC[-15],0)) -> 0
C86: 0 | E86: 0 | F86: =RC[-1]*RC[-3] -> 0 | G86: 0 | H86: 0 | I86: 0 | J86: 0 | K86: 0 | L86: 0 | M86: 0 | N86: 0 | O86: 0 | P86: 0 | Q86: 0 | R86: 0 | S86: =SUM(RC[-12]:RC[-1]) -> 0 | T86: =RC[-14]-RC[-1] -> 0 | U86: =IF(RC[-1]>-1,0,IF(RC[-1]<1,(RC[-2]-RC[-15])/RC[-15],0)) -> 0
C87: 0 | E87: 0 | F87: =RC[-1]*RC[-3] -> 0 | G87: 0 | H87: 0 | I87: 0 | J87: 0 | K87: 0 | L87: 0 | M87: 0 | N87: 0 | O87: 0 | P87: 0 | Q87: 0 | R87: 0 | S87: =SUM(RC[-12]:RC[-1]) -> 0 | T87: =RC[-14]-RC[-1] -> 0 | U87: =IF(RC[-1]>-1,0,IF(RC[-1]<1,(RC[-2]-RC[-15])/RC[-15],0)) -> 0
C88: 0 | E88: 0 | F88: =RC[-1]*RC[-3] -> 0 | G88: 0 | H88: 0 | I88: 0 | J88: 0 | K88: 0 | L88: 0 | M88: 0 | N88: 0 | O88: 0 | P88: 0 | Q88: 0 | R88: 0 | S88: =SUM(RC[-12]:RC[-1]) -> 0 | T88: =RC[-14]-RC[-1] -> 0 | U88: =IF(RC[-1]>-1,0,IF(RC[-1]<1,(RC[-2]-RC[-15])/RC[-15],0)) -> 0
C89: 0 | E89: 0 | F89: =RC[-1]*RC[-3] -> 0 | G89: 0 | H89: 0 | I89: 0 | J89: 0 | K89: 0 | L89: 0 | M89: 0 | N89: 0 | O89: 0 | P89: 0 | Q89: 0 | R89: 0 | S89: =SUM(RC[-12]:RC[-1]) -> 0 | T89: =RC[-14]-RC[-1] -> 0 | U89: =IF(RC[-1]>-1,0,IF(RC[-1]<1,(RC[-2]-RC[-15])/RC[-15],0)) -> 0
C90: 0 | E90: 0 | F90: =RC[-1]*RC[-3] -> 0 | G90: 0 | H90: 0 | I90: 0 | J90: 0 | K90: 0 | L90: 0 | M90: 0 | N90: 0 | O90: 0 | P90: 0 | Q90: 0 | R90: 0 | S90: =SUM(RC[-12]:RC[-1]) -> 0 | T90: =RC[-14]-RC[-1] -> 0 | U90: =IF(RC[-1]>-1,0,IF(RC[-1]<1,(RC[-2]-RC[-15])/RC[-15],0)) -> 0
C91: 0 | E91: 0 | F91: =RC[-1]*RC[-3] -> 0 | G91: 0 | H91: 0 | I91: 0 | J91: 0 | K91: 0 | L91: 0 | M91: 0 | N91: 0 | O91: 0 | P91: 0 | Q91: 0 | R91: 0 | S91: =SUM(RC[-12]:RC[-1]) -> 0 | T91: =RC[-14]-RC[-1] -> 0 | U91: =IF(RC[-1]>-1,0,IF(RC[-1]<1,(RC[-2]-RC[-15])/RC[-15],0)) -> 0
C92: 0 | E92: 0 | F92: =RC[-1]*RC[-3] -> 0 | G92: 0 | H92: 0 | I92: 0 | J92: 0 | K92: 0 | L92: 0 | M92: 0 | N92: 0 | O92: 0 | P92: 0 | Q92: 0 | R92: 0 | S92: =SUM(RC[-12]:RC[-1]) -> 0 | T92: =RC[-14]-RC[-1] -> 0 | U92: =IF(RC[-1]>-1,0,IF(RC[-1]<1,(RC[-2]-RC[-15])/RC[-15],0)) -> 0
C93: 0 | E93: 0 | F93: =RC[-1]*RC[-3] -> 0 | G93: 0 | H93: 0 | I93: 0 | J93: 0 | K93: 0 | L93: 0 | M93: 0 | N93: 0 | O93: 0 | P93: 0 | Q93: 0 | R93: 0 | S93: =SUM(RC[-12]:RC[-1]) -> 0 | T93: =RC[-14]-RC[-1] -> 0 | U93: =IF(RC[-1]>-1,0,IF(RC[-1]<1,(RC[-2]-RC[-15])/RC[-15],0)) -> 0
C94: 0 | E94: 0 | F94: =RC[-1]*RC[-3] -> 0 | G94: 0 | H94: 0 | I94: 0 | J94: 0 | K94: 0 | L94: 0 | M94: 0 | N94: 0 | O94: 0 | P94: 0 | Q94: 0 | R94: 0 | S94: =SUM(RC[-12]:RC[-1]) -> 0 | T94: =RC[-14]-RC[-1] -> 0 | U94: =IF(RC[-1]>-1,0,IF(RC[-1]<1,(RC[-2]-RC[-15])/RC[-15],0)) -> 0
C95: 0 | E95: 0 | F95: =RC[-1]*RC[-3] -> 0 | G95: 0 | H95: 0 | I95: 0 | J95: 0 | K95: 0 | L95: 0 | M95: 0 | N95: 0 | O95: 0 | P95: 0 | Q95: 0 | R95: 0 | S95: =SUM(RC[-12]:RC[-1]) -> 0 | T95: =RC[-14]-RC[-1] -> 0 | U95: =IF(RC[-1]>-1,0,IF(RC[-1]<1,(RC[-2]-RC[-15])/RC[-15],0)) -> 0
C96: 0 | E96: 0 | F96: =RC[-1]*RC[-3] -> 0 | G96: 0 | H96: 0 | I96: 0 | J96: 0 | K96: 0 | L96: 0 | M96: 0 | N96: 0 | O96: 0 | P96: 0 | Q96: 0 | R96: 0 | S96: =SUM(RC[-12]:RC[-1]) -> 0 | T96: =RC[-14]-RC[-1] -> 0 | U96: =IF(RC[-1]>-1,0,IF(RC[-1]<1,(RC[-2]-RC[-15])/RC[-15],0)) -> 0
C97: 0 | E97: 0 | F97: =RC[-1]*RC[-3] -> 0 | G97: 0 | H97: 0 | I97: 0 | J97: 0 | K97: 0 | L97: 0 | M97: 0 | N97: 0 | O97: 0 | P97: 0 | Q97: 0 | R97: 0 | S97: =SUM(RC[-12]:RC[-1]) -> 0 | T97: =RC[-14]-RC[-1] -> 0 | U97: =IF(RC[-1]>-1,0,IF(RC[-1]<1,(RC[-2]-RC[-15])/RC[-15],0)) -> 0
C98: 0 | E98: 0 | F98: =RC[-1]*RC[-3] -> 0 | G98: 0 | H98: 0 | I98: 0 | J98: 0 | K98: 0 | L98: 0 | M98: 0 | N98: 0 | O98: 0 | P98: 0 | Q98: 0 | R98: 0 | S98: =SUM(RC[-12]:RC[-1]) -> 0 | T98: =RC[-14]-RC[-1] -> 0 | U98: =IF(RC[-1]>-1,0,IF(RC[-1]<1,(RC[-2]-RC[-15])/RC[-15],0)) -> 0
C99: 0 | E99: 0 | F99: =RC[-1]*RC[-3] -> 0 | G99: 0 | H99: 0 | I99: 0 | J99: 0 | K99: 0 | L99: 0 | M99: 0 | N99: 0 | O99: 0 | P99: 0 | Q99: 0 | R99: 0 | S99: =SUM(RC[-12]:RC[-1]) -> 0 | T99: =RC[-14]-RC[-1] -> 0 | U99: =IF(RC[-1]>-1,0,IF(RC[-1]<1,(RC[-2]-RC[-15])/RC[-15],0)) -> 0
C100: 0 | E100: 0 | F100: =RC[-1]*RC[-3] -> 0 | G100: 0 | H100: 0 | I100: 0 | J100: 0 | K100: 0 | L100: 0 | M100: 0 | N100: 0 | O100: 0 | P100: 0 | Q100: 0 | R100: 0 | S100: =SUM(RC[-12]:RC[-1]) -> 0 | T100: =RC[-14]-RC[-1] -> 0 | U100: =IF(RC[-1]>-1,0,IF(RC[-1]<1,(RC[-2]-RC[-15])/RC[-15],0)) -> 0
C101: 0 | E101: 0 | F101: =RC[-1]*RC[-3] -> 0 | G101: 0 | H101: 0 | I101: 0 | J101: 0 | K101: 0 | L101: 0 | M101: 0 | N101: 0 | O101: 0 | P101: 0 | Q101: 0 | R101: 0 | S101: =SUM(RC[-12]:RC[-1]) -> 0 | T101: =RC[-14]-RC[-1] -> 0 | U101: =IF(RC[-1]>-1,0,IF(RC[-1]<1,(RC[-2]-RC[-15])/RC[-15],0)) -> 0
C102: 0 | E102: 0 | F102: =RC[-1]*RC[-3] -> 0 | G102: 0 | H102: 0 | I102: 0 | J102: 0 | K102: 0 | L102: 0 | M102: 0 | N102: 0 | O102: 0 | P102: 0 | Q102: 0 | R102: 0 | S102: =SUM(RC[-12]:RC[-1]) -> 0 | T102: =RC[-14]-RC[-1] -> 0 | U102: =IF(RC[-1]>-1,0,IF(RC[-1]<1,(RC[-2]-RC[-15])/RC[-15],0)) -> 0
C103: 0 | E103: 0 | F103: =RC[-1]*RC[-3] -> 0 | G103: 0 | H103: 0 | I103: 0 | J103: 0 | K103: 0 | L103: 0 | M103: 0 | N103: 0 | O103: 0 | P103: 0 | Q103: 0 | R103: 0 | S103: =SUM(RC[-12]:RC[-1]) -> 0 | T103: =RC[-14]-RC[-1] -> 0 | U103: =IF(RC[-1]>-1,0,IF(RC[-1]<1,(RC[-2]-RC[-15])/RC[-15],0)) -> 0
C104: 0 | E104: 0 | F104: =RC[-1]*RC[-3] -> 0 | G104: 0 | H104: 0 | I104: 0 | J104: 0 | K104: 0 | L104: 0 | M104: 0 | N104: 0 | O104: 0 | P104: 0 | Q104: 0 | R104: 0 | S104: =SUM(RC[-12]:RC[-1]) -> 0 | T104: =RC[-14]-RC[-1] -> 0 | U104: =IF(RC[-1]>-1,0,IF(RC[-1]<1,(RC[-2]-RC[-15])/RC[-15],0)) -> 0
C105: 0 | E105: 0 | F105: =RC[-1]*RC[-3] -> 0 | G105: 0 | H105: 0 | I105: 0 | J105: 0 | K105: 0 | L105: 0 | M105: 0 | N105: 0 | O105: 0 | P105: 0 | Q105: 0 | R105: 0 | S105: =SUM(RC[-12]:RC[-1]) -> 0 | T105: =RC[-14]-RC[-1] -> 0 | U105: =IF(RC[-1]>-1,0,IF(RC[-1]<1,(RC[-2]-RC[-15])/RC[-15],0)) -> 0
C106: 0 | E106: 0 | F106: =RC[-1]*RC[-3] -> 0 | G106: 0 | H106: 0 | I106: 0 | J106: 0 | K106: 0 | L106: 0 | M106: 0 | N106: 0 | O106: 0 | P106: 0 | Q106: 0 | R106: 0 | S106: =SUM(RC[-12]:RC[-1]) -> 0 | T106: =RC[-14]-RC[-1] -> 0 | U106: =IF(RC[-1]>-1,0,IF(RC[-1]<1,(RC[-2]-RC[-15])/RC[-15],0)) -> 0
C107: 0 | E107: 0 | F107: =RC[-1]*RC[-3] -> 0 | G107: 0 | H107: 0 | I107: 0 | J107: 0 | K107: 0 | L107: 0 | M107: 0 | N107: 0 | O107: 0 | P107: 0 | Q107: 0 | R107: 0 | S107: =SUM(RC[-12]:RC[-1]) -> 0 | T107: =RC[-14]-RC[-1] -> 0 | U107: =IF(RC[-1]>-1,0,IF(RC[-1]<1,(RC[-2]-RC[-15])/RC[-15],0)) -> 0
C108: 0 | E108: 0 | F108: =RC[-1]*RC[-3] -> 0 | G108: 0 | H108: 0 | I108: 0 | J108: 0 | K108: 0 | L108: 0 | M108: 0 | N108: 0 | O108: 0 | P108: 0 | Q108: 0 | R108: 0 | S108: =SUM(RC[-12]:RC[-1]) -> 0 | T108: =RC[-14]-RC[-1] -> 0 | U108: =IF(RC[-1]>-1,0,IF(RC[-1]<1,(RC[-2]-RC[-15])/RC[-15],0)) -> 0
C109: 0 | E109: 0 | F109: =RC[-1]*RC[-3] -> 0 | G109: 0 | H109: 0 | I109: 0 | J109: 0 | K109: 0 | L109: 0 | M109: 0 | N109: 0 | O109: 0 | P109: 0 | Q109: 0 | R109: 0 | S109: =SUM(RC[-12]:RC[-1]) -> 0 | T109: =RC[-14]-RC[-1] -> 0 | U109: =IF(RC[-1]>-1,0,IF(RC[-1]<1,(RC[-2]-RC[-15])/RC[-15],0)) -> 0
C110: 0 | E110: 0 | F110: =RC[-1]*RC[-3] -> 0 | G110: 0 | H110: 0 | I110: 0 | J110: 0 | K110: 0 | L110: 0 | M110: 0 | N110: 0 | O110: 0 | P110: 0 | Q110: 0 | R110: 0 | S110: =SUM(RC[-12]:RC[-1]) -> 0 | T110: =RC[-14]-RC[-1] -> 0 | U110: =IF(RC[-1]>-1,0,IF(RC[-1]<1,(RC[-2]-RC[-15])/RC[-15],0)) -> 0
C111: 0 | E111: 0 | F111: =RC[-1]*RC[-3] -> 0 | G111: 0 | H111: 0 | I111: 0 | J111: 0 | K111: 0 | L111: 0 | M111: 0 | N111: 0 | O111: 0 | P111: 0 | Q111: 0 | R111: 0 | S111: =SUM(RC[-12]:RC[-1]) -> 0 | T111: =RC[-14]-RC[-1] -> 0 | U111: =IF(RC[-1]>-1,0,IF(RC[-1]<1,(RC[-2]-RC[-15])/RC[-15],0)) -> 0
C112: 0 | E112: 0 | F112: =RC[-1]*RC[-3] -> 0 | G112: 0 | H112: 0 | I112: 0 | J112: 0 | K112: 0 | L112: 0 | M112: 0 | N112: 0 | O112: 0 | P112: 0 | Q112: 0 | R112: 0 | S112: =SUM(RC[-12]:RC[-1]) -> 0 | T112: =RC[-14]-RC[-1] -> 0 | U112: =IF(RC[-1]>-1,0,IF(RC[-1]<1,(RC[-2]-RC[-15])/RC[-15],0)) -> 0
C113: 0 | E113: 0 | F113: =RC[-1]*RC[-3] -> 0 | G113: 0 | H113: 0 | I113: 0 | J113: 0 | K113: 0 | L113: 0 | M113: 0 | N113: 0 | O113: 0 | P113: 0 | Q113: 0 | R113: 0 | S113: =SUM(RC[-12]:RC[-1]) -> 0 | T113: =RC[-14]-RC[-1] -> 0 | U113: =IF(RC[-1]>-1,0,IF(RC[-1]<1,(RC[-2]-RC[-15])/RC[-15],0)) -> 0
C114: 0 | E114: 0 | F114: =RC[-1]*RC[-3] -> 0 | G114: 0 | H114: 0 | I114: 0 | J114: 0 | K114: 0 | L114: 0 | M114: 0 | N114: 0 | O114: 0 | P114: 0 | Q114: 0 | R114: 0 | S114: =SUM(RC[-12]:RC[-1]) -> 0 | T114: =RC[-14]-RC[-1] -> 0 | U114: =IF(RC[-1]>-1,0,IF(RC[-1]<1,(RC[-2]-RC[-15])/RC[-15],0)) -> 0
C115: 0 | E115: 0 | F115: =RC[-1]*RC[-3] -> 0 | G115: 0 | H115: 0 | I115: 0 | J115: 0 | K115: 0 | L115: 0 | M115: 0 | N115: 0 | O115: 0 | P115: 0 | Q115: 0 | R115: 0 | S115: =SUM(RC[-12]:RC[-1]) -> 0 | T115: =RC[-14]-RC[-1] -> 0 | U115: =IF(RC[-1]>-1,0,IF(RC[-1]<1,(RC[-2]-RC[-15])/RC[-15],0)) -> 0
C116: 0 | E116: 0 | F116: =RC[-1]*RC[-3] -> 0 | G116: 0 | H116: 0 | I116: 0 | J116: 0 | K116: 0 | L116: 0 | M116: 0 | N116: 0 | O116: 0 | P116: 0 | Q116: 0 | R116: 0 | S116: =SUM(RC[-12]:RC[-1]) -> 0 | T116: =RC[-14]-RC[-1] -> 0 | U116: =IF(RC[-1]>-1,0,IF(RC[-1]<1,(RC[-2]-RC[-15])/RC[-15],0)) -> 0
C117: 0 | E117: 0 | F117: =RC[-1]*RC[-3] -> 0 | G117: 0 | H117: 0 | I117: 0 | J117: 0 | K117: 0 | L117: 0 | M117: 0 | N117: 0 | O117: 0 | P117: 0 | Q117: 0 | R117: 0 | S117: =SUM(RC[-12]:RC[-1]) -> 0 | T117: =RC[-14]-RC[-1] -> 0 | U117: =IF(RC[-1]>-1,0,IF(RC[-1]<1,(RC[-2]-RC[-15])/RC[-15],0)) -> 0
C118: 0 | E118: 0 | F118: =RC[-1]*RC[-3] -> 0 | G118: 0 | H118: 0 | I118: 0 | J118: 0 | K118: 0 | L118: 0 | M118: 0 | N118: 0 | O118: 0 | P118: 0 | Q118: 0 | R118: 0 | S118: =SUM(RC[-12]:RC[-1]) -> 0 | T118: =RC[-14]-RC[-1] -> 0 | U118: =IF(RC[-1]>-1,0,IF(RC[-1]<1,(RC[-2]-RC[-15])/RC[-15],0)) -> 0
C119: 0 | E119: 0 | F119: =RC[-1]*RC[-3] -> 0 | G119: 0 | H119: 0 | I119: 0 | J119: 0 | K119: 0 | L119: 0 | M119: 0 | N119: 0 | O119: 0 | P119: 0 | Q119: 0 | R119: 0 | S119: =SUM(RC[-12]:RC[-1]) -> 0 | T119: =RC[-14]-RC[-1] -> 0 | U119: =IF(RC[-1]>-1,0,IF(RC[-1]<1,(RC[-2]-RC[-15])/RC[-15],0)) -> 0
C120: 0 | E120: 0 | F120: =RC[-1]*RC[-3] -> 0 | G120: 0 | H120: 0 | I120: 0 | J120: 0 | K120: 0 | L120: 0 | M120: 0 | N120: 0 | O120: 0 | P120: 0 | Q120: 0 | R120: 0 | S120: =SUM(RC[-12]:RC[-1]) -> 0 | T120: =RC[-14]-RC[-1] -> 0 | U120: =IF(RC[-1]>-1,0,IF(RC[-1]<1,(RC[-2]-RC[-15])/RC[-15],0)) -> 0
C121: 0 | E121: 0 | F121: =RC[-1]*RC[-3] -> 0 | G121: 0 | H121: 0 | I121: 0 | J121: 0 | K121: 0 | L121: 0 | M121: 0 | N121: 0 | O121: 0 | P121: 0 | Q121: 0 | R121: 0 | S121: =SUM(RC[-12]:RC[-1]) -> 0 | T121: =RC[-14]-RC[-1] -> 0 | U121: =IF(RC[-1]>-1,0,IF(RC[-1]<1,(RC[-2]-RC[-15])/RC[-15],0)) -> 0
C122: 0 | E122: 0 | F122: =RC[-1]*RC[-3] -> 0 | G122: 0 | H122: 0 | I122: 0 | J122: 0 | K122: 0 | L122: 0 | M122: 0 | N122: 0 | O122: 0 | P122: 0 | Q122: 0 | R122: 0 | S122: =SUM(RC[-12]:RC[-1]) -> 0 | T122: =RC[-14]-RC[-1] -> 0 | U122: =IF(RC[-1]>-1,0,IF(RC[-1]<1,(RC[-2]-RC[-15])/RC[-15],0)) -> 0
C123: 0 | E123: 0 | F123: =RC[-1]*RC[-3] -> 0 | G123: 0 | H123: 0 | I123: 0 | J123: 0 | K123: 0 | L123: 0 | M123: 0 | N123: 0 | O123: 0 | P123: 0 | Q123: 0 | R123: 0 | S123: =SUM(RC[-12]:RC[-1]) -> 0 | T123: =RC[-14]-RC[-1] -> 0 | U123: =IF(RC[-1]>-1,0,IF(RC[-1]<1,(RC[-2]-RC[-15])/RC[-15],0)) -> 0
C124: 0 | E124: 0 | F124: =RC[-1]*RC[-3] -> 0 | G124: 0 | H124: 0 | I124: 0 | J124: 0 | K124: 0 | L124: 0 | M124: 0 | N124: 0 | O124: 0 | P124: 0 | Q124: 0 | R124: 0 | S124: =SUM(RC[-12]:RC[-1]) -> 0 | T124: =RC[-14]-RC[-1] -> 0 | U124: =IF(RC[-1]>-1,0,IF(RC[-1]<1,(RC[-2]-RC[-15])/RC[-15],0)) -> 0
C125: 0 | E125: 0 | F125: =RC[-1]*RC[-3] -> 0 | G125: 0 | H125: 0 | I125: 0 | J125: 0 | K125: 0 | L125: 0 | M125: 0 | N125: 0 | O125: 0 | P125: 0 | Q125: 0 | R125: 0 | S125: =SUM(RC[-12]:RC[-1]) -> 0 | T125: =RC[-14]-RC[-1] -> 0 | U125: =IF(RC[-1]>-1,0,IF(RC[-1]<1,(RC[-2]-RC[-15])/RC[-15],0)) -> 0
C126: 0 | E126: 0 | F126: =RC[-1]*RC[-3] -> 0 | G126: 0 | H126: 0 | I126: 0 | J126: 0 | K126: 0 | L126: 0 | M126: 0 | N126: 0 | O126: 0 | P126: 0 | Q126: 0 | R126: 0 | S126: =SUM(RC[-12]:RC[-1]) -> 0 | T126: =RC[-14]-RC[-1] -> 0 | U126: =IF(RC[-1]>-1,0,IF(RC[-1]<1,(RC[-2]-RC[-15])/RC[-15],0)) -> 0
C127: 0 | E127: 0 | F127: =RC[-1]*RC[-3] -> 0 | G127: 0 | H127: 0 | I127: 0 | J127: 0 | K127: 0 | L127: 0 | M127: 0 | N127: 0 | O127: 0 | P127: 0 | Q127: 0 | R127: 0 | S127: =SUM(RC[-12]:RC[-1]) -> 0 | T127: =RC[-14]-RC[-1] -> 0 | U127: =IF(RC[-1]>-1,0,IF(RC[-1]<1,(RC[-2]-RC[-15])/RC[-15],0)) -> 0
C128: 0 | E128: 0 | F128: =RC[-1]*RC[-3] -> 0 | G128: 0 | H128: 0 | I128: 0 | J128: 0 | K128: 0 | L128: 0 | M128: 0 | N128: 0 | O128: 0 | P128: 0 | Q128: 0 | R128: 0 | S128: =SUM(RC[-12]:RC[-1]) -> 0 | T128: =RC[-14]-RC[-1] -> 0 | U128: =IF(RC[-1]>-1,0,IF(RC[-1]<1,(RC[-2]-RC[-15])/RC[-15],0)) -> 0
C129: 0 | E129: 0 | F129: =RC[-1]*RC[-3] -> 0 | G129: 0 | H129: 0 | I129: 0 | J129: 0 | K129: 0 | L129: 0 | M129: 0 | N129: 0 | O129: 0 | P129: 0 | Q129: 0 | R129: 0 | S129: =SUM(RC[-12]:RC[-1]) -> 0 | T129: =RC[-14]-RC[-1] -> 0 | U129: =IF(RC[-1]>-1,0,IF(RC[-1]<1,(RC[-2]-RC[-15])/RC[-15],0)) -> 0
C130: 0 | E130: 0 | F130: =RC[-1]*RC[-3] -> 0 | G130: 0 | H130: 0 | I130: 0 | J130: 0 | K130: 0 | L130: 0 | M130: 0 | N130: 0 | O130: 0 | P130: 0 | Q130: 0 | R130: 0 | S130: =SUM(RC[-12]:RC[-1]) -> 0 | T130: =RC[-14]-RC[-1] -> 0 | U130: =IF(RC[-1]>-1,0,IF(RC[-1]<1,(RC[-2]-RC[-15])/RC[-15],0)) -> 0
C131: 0 | E131: 0 | F131: =RC[-1]*RC[-3] -> 0 | G131: 0 | H131: 0 | I131: 0 | J131: 0 | K131: 0 | L131: 0 | M131: 0 | N131: 0 | O131: 0 | P131: 0 | Q131: 0 | R131: 0 | S131: =SUM(RC[-12]:RC[-1]) -> 0 | T131: =RC[-14]-RC[-1] -> 0 | U131: =IF(RC[-1]>-1,0,IF(RC[-1]<1,(RC[-2]-RC[-15])/RC[-15],0)) -> 0
C132: 0 | E132: 0 | F132: =RC[-1]*RC[-3] -> 0 | G132: 0 | H132: 0 | I132: 0 | J132: 0 | K132: 0 | L132: 0 | M132: 0 | N132: 0 | O132: 0 | P132: 0 | Q132: 0 | R132: 0 | S132: =SUM(RC[-12]:RC[-1]) -> 0 | T132: =RC[-14]-RC[-1] -> 0 | U132: =IF(RC[-1]>-1,0,IF(RC[-1]<1,(RC[-2]-RC[-15])/RC[-15],0)) -> 0
C133: 0 | E133: 0 | F133: =RC[-1]*RC[-3] -> 0 | G133: 0 | H133: 0 | I133: 0 | J133: 0 | K133: 0 | L133: 0 | M133: 0 | N133: 0 | O133: 0 | P133: 0 | Q133: 0 | R133: 0 | S133: =SUM(RC[-12]:RC[-1]) -> 0 | T133: =RC[-14]-RC[-1] -> 0 | U133: =IF(RC[-1]>-1,0,IF(RC[-1]<1,(RC[-2]-RC[-15])/RC[-15],0)) -> 0
C134: 0 | E134: 0 | F134: =RC[-1]*RC[-3] -> 0 | G134: 0 | H134: 0 | I134: 0 | J134: 0 | K134: 0 | L134: 0 | M134: 0 | N134: 0 | O134: 0 | P134: 0 | Q134: 0 | R134: 0 | S134: =SUM(RC[-12]:RC[-1]) -> 0 | T134: =RC[-14]-RC[-1] -> 0 | U134: =IF(RC[-1]>-1,0,IF(RC[-1]<1,(RC[-2]-RC[-15])/RC[-15],0)) -> 0
C135: 0 | E135: 0 | F135: =RC[-1]*RC[-3] -> 0 | G135: 0 | H135: 0 | I135: 0 | J135: 0 | K135: 0 | L135: 0 | M135: 0 | N135: 0 | O135: 0 | P135: 0 | Q135: 0 | R135: 0 | S135: =SUM(RC[-12]:RC[-1]) -> 0 | T135: =RC[-14]-RC[-1] -> 0 | U135: =IF(RC[-1]>-1,0,IF(RC[-1]<1,(RC[-2]-RC[-15])/RC[-15],0)) -> 0
C136: 0 | E136: 0 | F136: =RC[-1]*RC[-3] -> 0 | G136: 0 | H136: 0 | I136: 0 | J136: 0 | K136: 0 | L136: 0 | M136: 0 | N136: 0 | O136: 0 | P136: 0 | Q136: 0 | R136: 0 | S136: =SUM(RC[-12]:RC[-1]) -> 0 | T136: =RC[-14]-RC[-1] -> 0 | U136: =IF(RC[-1]>-1,0,IF(RC[-1]<1,(RC[-2]-RC[-15])/RC[-15],0)) -> 0
C137: 0 | E137: 0 | F137: =RC[-1]*RC[-3] -> 0 | G137: 0 | H137: 0 | I137: 0 | J137: 0 | K137: 0 | L137: 0 | M137: 0 | N137: 0 | O137: 0 | P137: 0 | Q137: 0 | R137: 0 | S137: =SUM(RC[-12]:RC[-1]) -> 0 | T137: =RC[-14]-RC[-1] -> 0 | U137: =IF(RC[-1]>-1,0,IF(RC[-1]<1,(RC[-2]-RC[-15])/RC[-15],0)) -> 0
C138: 0 | E138: 0 | F138: =RC[-1]*RC[-3] -> 0 | G138: 0 | H138: 0 | I138: 0 | J138: 0 | K138: 0 | L138: 0 | M138: 0 | N138: 0 | O138: 0 | P138: 0 | Q138: 0 | R138: 0 | S138: =SUM(RC[-12]:RC[-1]) -> 0 | T138: =RC[-14]-RC[-1] -> 0 | U138: =IF(RC[-1]>-1,0,IF(RC[-1]<1,(RC[-2]-RC[-15])/RC[-15],0)) -> 0
C139: 0 | E139: 0 | F139: =RC[-1]*RC[-3] -> 0 | G139: 0 | H139: 0 | I139: 0 | J139: 0 | K139: 0 | L139: 0 | M139: 0 | N139: 0 | O139: 0 | P139: 0 | Q139: 0 | R139: 0 | S139: =SUM(RC[-12]:RC[-1]) -> 0 | T139: =RC[-14]-RC[-1] -> 0 | U139: =IF(RC[-1]>-1,0,IF(RC[-1]<1,(RC[-2]-RC[-15])/RC[-15],0)) -> 0
C140: 0 | E140: 0 | F140: =RC[-1]*RC[-3] -> 0 | G140: 0 | H140: 0 | I140: 0 | J140: 0 | K140: 0 | L140: 0 | M140: 0 | N140: 0 | O140: 0 | P140: 0 | Q140: 0 | R140: 0 | S140: =SUM(RC[-12]:RC[-1]) -> 0 | T140: =RC[-14]-RC[-1] -> 0 | U140: =IF(RC[-1]>-1,0,IF(RC[-1]<1,(RC[-2]-RC[-15])/RC[-15],0)) -> 0
C141: 0 | E141: 0 | F141: =RC[-1]*RC[-3] -> 0 | G141: 0 | H141: 0 | I141: 0 | J141: 0 | K141: 0 | L141: 0 | M141: 0 | N141: 0 | O141: 0 | P141: 0 | Q141: 0 | R141: 0 | S141: =SUM(RC[-12]:RC[-1]) -> 0 | T141: =RC[-14]-RC[-1] -> 0 | U141: =IF(RC[-1]>-1,0,IF(RC[-1]<1,(RC[-2]-RC[-15])/RC[-15],0)) -> 0
C142: 0 | E142: 0 | F142: =RC[-1]*RC[-3] -> 0 | G142: 0 | H142: 0 | I142: 0 | J142: 0 | K142: 0 | L142: 0 | M142: 0 | N142: 0 | O142: 0 | P142: 0 | Q142: 0 | R142: 0 | S142: =SUM(RC[-12]:RC[-1]) -> 0 | T142: =RC[-14]-RC[-1] -> 0 | U142: =IF(RC[-1]>-1,0,IF(RC[-1]<1,(RC[-2]-RC[-15])/RC[-15],0)) -> 0
C143: 0 | E143: 0 | F143: =RC[-1]*RC[-3] -> 0 | G143: 0 | H143: 0 | I143: 0 | J143: 0 | K143: 0 | L143: 0 | M143: 0 | N143: 0 | O143: 0 | P143: 0 | Q143: 0 | R143: 0 | S143: =SUM(RC[-12]:RC[-1]) -> 0 | T143: =RC[-14]-RC[-1] -> 0 | U143: =IF(RC[-1]>-1,0,IF(RC[-1]<1,(RC[-2]-RC[-15])/RC[-15],0)) -> 0
C144: 0 | E144: 0 | F144: =RC[-1]*RC[-3] -> 0 | G144: 0 | H144: 0 | I144: 0 | J144: 0 | K144: 0 | L144: 0 | M144: 0 | N144: 0 | O144: 0 | P144: 0 | Q144: 0 | R144: 0 | S144: =SUM(RC[-12]:RC[-1]) -> 0 | T144: =RC[-14]-RC[-1] -> 0 | U144: =IF(RC[-1]>-1,0,IF(RC[-1]<1,(RC[-2]-RC[-15])/RC[-15],0)) -> 0
C145: 0 | E145: 0 | F145: =RC[-1]*RC[-3] -> 0 | G145: 0 | H145: 0 | I145: 0 | J145: 0 | K145: 0 | L145: 0 | M145: 0 | N145: 0 | O145: 0 | P145: 0 | Q145: 0 | R145: 0 | S145: =SUM(RC[-12]:RC[-1]) -> 0 | T145: =RC[-14]-RC[-1] -> 0 | U145: =IF(RC[-1]>-1,0,IF(RC[-1]<1,(RC[-2]-RC[-15])/RC[-15],0)) -> 0
C146: 0 | E146: 0 | F146: =RC[-1]*RC[-3] -> 0 | G146: 0 | H146: 0 | I146: 0 | J146: 0 | K146: 0 | L146: 0 | M146: 0 | N146: 0 | O146: 0 | P146: 0 | Q146: 0 | R146: 0 | S146: =SUM(RC[-12]:RC[-1]) -> 0 | T146: =RC[-14]-RC[-1] -> 0 | U146: =IF(RC[-1]>-1,0,IF(RC[-1]<1,(RC[-2]-RC[-15])/RC[-15],0)) -> 0
C147: 0 | E147: 0 | F147: =RC[-1]*RC[-3] -> 0 | G147: 0 | H147: 0 | I147: 0 | J147: 0 | K147: 0 | L147: 0 | M147: 0 | N147: 0 | O147: 0 | P147: 0 | Q147: 0 | R147: 0 | S147: =SUM(RC[-12]:RC[-1]) -> 0 | T147: =RC[-14]-RC[-1] -> 0 | U147: =IF(RC[-1]>-1,0,IF(RC[-1]<1,(RC[-2]-RC[-15])/RC[-15],0)) -> 0
C148: 0 | E148: 0 | F148: =RC[-1]*RC[-3] -> 0 | G148: 0 | H148: 0 | I148: 0 | J148: 0 | K148: 0 | L148: 0 | M148: 0 | N148: 0 | O148: 0 | P148: 0 | Q148: 0 | R148: 0 | S148: =SUM(RC[-12]:RC[-1]) -> 0 | T148: =RC[-14]-RC[-1] -> 0 | U148: =IF(RC[-1]>-1,0,IF(RC[-1]<1,(RC[-2]-RC[-15])/RC[-15],0)) -> 0
C149: 0 | E149: 0 | F149: =RC[-1]*RC[-3] -> 0 | G149: 0 | H149: 0 | I149: 0 | J149: 0 | K149: 0 | L149: 0 | M149: 0 | N149: 0 | O149: 0 | P149: 0 | Q149: 0 | R149: 0 | S149: =SUM(RC[-12]:RC[-1]) -> 0 | T149: =RC[-14]-RC[-1] -> 0 | U149: =IF(RC[-1]>-1,0,IF(RC[-1]<1,(RC[-2]-RC[-15])/RC[-15],0)) -> 0
C150: 0 | E150: 0 | F150: =RC[-1]*RC[-3] -> 0 | G150: 0 | H150: 0 | I150: 0 | J150: 0 | K150: 0 | L150: 0 | M150: 0 | N150: 0 | O150: 0 | P150: 0 | Q150: 0 | R150: 0 | S150: =SUM(RC[-12]:RC[-1]) -> 0 | T150: =RC[-14]-RC[-1] -> 0 | U150: =IF(RC[-1]>-1,0,IF(RC[-1]<1,(RC[-2]-RC[-15])/RC[-15],0)) -> 0
C151: 0 | E151: 0 | F151: =RC[-1]*RC[-3] -> 0 | G151: 0 | H151: 0 | I151: 0 | J151: 0 | K151: 0 | L151: 0 | M151: 0 | N151: 0 | O151: 0 | P151: 0 | Q151: 0 | R151: 0 | S151: =SUM(RC[-12]:RC[-1]) -> 0 | T151: =RC[-14]-RC[-1] -> 0 | U151: =IF(RC[-1]>-1,0,IF(RC[-1]<1,(RC[-2]-RC[-15])/RC[-15],0)) -> 0
C152: 0 | E152: 0 | F152: =RC[-1]*RC[-3] -> 0 | G152: 0 | H152: 0 | I152: 0 | J152: 0 | K152: 0 | L152: 0 | M152: 0 | N152: 0 | O152: 0 | P152: 0 | Q152: 0 | R152: 0 | S152: =SUM(RC[-12]:RC[-1]) -> 0 | T152: =RC[-14]-RC[-1] -> 0 | U152: =IF(RC[-1]>-1,0,IF(RC[-1]<1,(RC[-2]-RC[-15])/RC[-15],0)) -> 0
C153: 0 | E153: 0 | F153: =RC[-1]*RC[-3] -> 0 | G153: 0 | H153: 0 | I153: 0 | J153: 0 | K153: 0 | L153: 0 | M153: 0 | N153: 0 | O153: 0 | P153: 0 | Q153: 0 | R153: 0 | S153: =SUM(RC[-12]:RC[-1]) -> 0 | T153: =RC[-14]-RC[-1] -> 0 | U153: =IF(RC[-1]>-1,0,IF(RC[-1]<1,(RC[-2]-RC[-15])/RC[-15],0)) -> 0
C154: 0 | E154: 0 | F154: =RC[-1]*RC[-3] -> 0 | G154: 0 | H154: 0 | I154: 0 | J154: 0 | K154: 0 | L154: 0 | M154: 0 | N154: 0 | O154: 0 | P154: 0 | Q154: 0 | R154: 0 | S154: =SUM(RC[-12]:RC[-1]) -> 0 | T154: =RC[-14]-RC[-1] -> 0 | U154: =IF(RC[-1]>-1,0,IF(RC[-1]<1,(RC[-2]-RC[-15])/RC[-15],0)) -> 0
C155: 0 | E155: 0 | F155: =RC[-1]*RC[-3] -> 0 | G155: 0 | H155: 0 | I155: 0 | J155: 0 | K155: 0 | L155: 0 | M155: 0 | N155: 0 | O155: 0 | P155: 0 | Q155: 0 | R155: 0 | S155: =SUM(RC[-12]:RC[-1]) -> 0 | T155: =RC[-14]-RC[-1] -> 0 | U155: =IF(RC[-1]>-1,0,IF(RC[-1]<1,(RC[-2]-RC[-15])/RC[-15],0)) -> 0
C156: 0 | E156: 0 | F156: =RC[-1]*RC[-3] -> 0 | G156: 0 | H156: 0 | I156: 0 | J156: 0 | K156: 0 | L156: 0 | M156: 0 | N156: 0 | O156: 0 | P156: 0 | Q156: 0 | R156: 0 | S156: =SUM(RC[-12]:RC[-1]) -> 0 | T156: =RC[-14]-RC[-1] -> 0 | U156: =IF(RC[-1]>-1,0,IF(RC[-1]<1,(RC[-2]-RC[-15])/RC[-15],0)) -> 0
C157: 0 | E157: 0 | F157: =RC[-1]*RC[-3] -> 0 | G157: 0 | H157: 0 | I157: 0 | J157: 0 | K157: 0 | L157: 0 | M157: 0 | N157: 0 | O157: 0 | P157: 0 | Q157: 0 | R157: 0 | S157: =SUM(RC[-12]:RC[-1]) -> 0 | T157: =RC[-14]-RC[-1] -> 0 | U157: =IF(RC[-1]>-1,0,IF(RC[-1]<1,(RC[-2]-RC[-15])/RC[-15],0)) -> 0
C158: 0 | E158: 0 | F158: =RC[-1]*RC[-3] -> 0 | G158: 0 | H158: 0 | I158: 0 | J158: 0 | K158: 0 | L158: 0 | M158: 0 | N158: 0 | O158: 0 | P158: 0 | Q158: 0 | R158: 0 | S158: =SUM(RC[-12]:RC[-1]) -> 0 | T158: =RC[-14]-RC[-1] -> 0 | U158: =IF(RC[-1]>-1,0,IF(RC[-1]<1,(RC[-2]-RC[-15])/RC[-15],0)) -> 0
C159: 0 | E159: 0 | F159: =RC[-1]*RC[-3] -> 0 | G159: 0 | H159: 0 | I159: 0 | J159: 0 | K159: 0 | L159: 0 | M159: 0 | N159: 0 | O159: 0 | P159: 0 | Q159: 0 | R159: 0 | S159: =SUM(RC[-12]:RC[-1]) -> 0 | T159: =RC[-14]-RC[-1] -> 0 | U159: =IF(RC[-1]>-1,0,IF(RC[-1]<1,(RC[-2]-RC[-15])/RC[-15],0)) -> 0
C160: 0 | E160: 0 | F160: =RC[-1]*RC[-3] -> 0 | G160: 0 | H160: 0 | I160: 0 | J160: 0 | K160: 0 | L160: 0 | M160: 0 | N160: 0 | O160: 0 | P160: 0 | Q160: 0 | R160: 0 | S160: =SUM(RC[-12]:RC[-1]) -> 0 | T160: =RC[-14]-RC[-1] -> 0 | U160: =IF(RC[-1]>-1,0,IF(RC[-1]<1,(RC[-2]-RC[-15])/RC[-15],0)) -> 0
C161: 0 | E161: 0 | F161: =RC[-1]*RC[-3] -> 0 | G161: 0 | H161: 0 | I161: 0 | J161: 0 | K161: 0 | L161: 0 | M161: 0 | N161: 0 | O161: 0 | P161: 0 | Q161: 0 | R161: 0 | S161: =SUM(RC[-12]:RC[-1]) -> 0 | T161: =RC[-14]-RC[-1] -> 0 | U161: =IF(RC[-1]>-1,0,IF(RC[-1]<1,(RC[-2]-RC[-15])/RC[-15],0)) -> 0
C162: 0 | E162: 0 | F162: =RC[-1]*RC[-3] -> 0 | G162: 0 | H162: 0 | I162: 0 | J162: 0 | K162: 0 | L162: 0 | M162: 0 | N162: 0 | O162: 0 | P162: 0 | Q162: 0 | R162: 0 | S162: =SUM(RC[-12]:RC[-1]) -> 0 | T162: =RC[-14]-RC[-1] -> 0 | U162: =IF(RC[-1]>-1,0,IF(RC[-1]<1,(RC[-2]-RC[-15])/RC[-15],0)) -> 0
C163: 0 | E163: 0 | F163: =RC[-1]*RC[-3] -> 0 | G163: 0 | H163: 0 | I163: 0 | J163: 0 | K163: 0 | L163: 0 | M163: 0 | N163: 0 | O163: 0 | P163: 0 | Q163: 0 | R163: 0 | S163: =SUM(RC[-12]:RC[-1]) -> 0 | T163: =RC[-14]-RC[-1] -> 0 | U163: =IF(RC[-1]>-1,0,IF(RC[-1]<1,(RC[-2]-RC[-15])/RC[-15],0)) -> 0
C164: 0 | E164: 0 | F164: =RC[-1]*RC[-3] -> 0 | G164: 0 | H164: 0 | I164: 0 | J164: 0 | K164: 0 | L164: 0 | M164: 0 | N164: 0 | O164: 0 | P164: 0 | Q164: 0 | R164: 0 | S164: =SUM(RC[-12]:RC[-1]) -> 0 | T164: =RC[-14]-RC[-1] -> 0 | U164: =IF(RC[-1]>-1,0,IF(RC[-1]<1,(RC[-2]-RC[-15])/RC[-15],0)) -> 0
C165: 0 | E165: 0 | F165: =RC[-1]*RC[-3] -> 0 | G165: 0 | H165: 0 | I165: 0 | J165: 0 | K165: 0 | L165: 0 | M165: 0 | N165: 0 | O165: 0 | P165: 0 | Q165: 0 | R165: 0 | S165: =SUM(RC[-12]:RC[-1]) -> 0 | T165: =RC[-14]-RC[-1] -> 0 | U165: =IF(RC[-1]>-1,0,IF(RC[-1]<1,(RC[-2]-RC[-15])/RC[-15],0)) -> 0
C166: 0 | E166: 0 | F166: =RC[-1]*RC[-3] -> 0 | G166: 0 | H166: 0 | I166: 0 | J166: 0 | K166: 0 | L166: 0 | M166: 0 | N166: 0 | O166: 0 | P166: 0 | Q166: 0 | R166: 0 | S166: =SUM(RC[-12]:RC[-1]) -> 0 | T166: =RC[-14]-RC[-1] -> 0 | U166: =IF(RC[-1]>-1,0,IF(RC[-1]<1,(RC[-2]-RC[-15])/RC[-15],0)) -> 0
C167: 0 | E167: 0 | F167: =RC[-1]*RC[-3] -> 0 | G167: 0 | H167: 0 | I167: 0 | J167: 0 | K167: 0 | L167: 0 | M167: 0 | N167: 0 | O167: 0 | P167: 0 | Q167: 0 | R167: 0 | S167: =SUM(RC[-12]:RC[-1]) -> 0 | T167: =RC[-14]-RC[-1] -> 0 | U167: =IF(RC[-1]>-1,0,IF(RC[-1]<1,(RC[-2]-RC[-15])/RC[-15],0)) -> 0
C168: 0 | E168: 0 | F168: =RC[-1]*RC[-3] -> 0 | G168: 0 | H168: 0 | I168: 0 | J168: 0 | K168: 0 | L168: 0 | M168: 0 | N168: 0 | O168: 0 | P168: 0 | Q168: 0 | R168: 0 | S168: =SUM(RC[-12]:RC[-1]) -> 0 | T168: =RC[-14]-RC[-1] -> 0 | U168: =IF(RC[-1]>-1,0,IF(RC[-1]<1,(RC[-2]-RC[-15])/RC[-15],0)) -> 0
C169: 0 | E169: 0 | F169: =RC[-1]*RC[-3] -> 0 | G169: 0 | H169: 0 | I169: 0 | J169: 0 | K169: 0 | L169: 0 | M169: 0 | N169: 0 | O169: 0 | P169: 0 | Q169: 0 | R169: 0 | S169: =SUM(RC[-12]:RC[-1]) -> 0 | T169: =RC[-14]-RC[-1] -> 0 | U169: =IF(RC[-1]>-1,0,IF(RC[-1]<1,(RC[-2]-RC[-15])/RC[-15],0)) -> 0
C170: 0 | E170: 0 | F170: =RC[-1]*RC[-3] -> 0 | G170: 0 | H170: 0 | I170: 0 | J170: 0 | K170: 0 | L170: 0 | M170: 0 | N170: 0 | O170: 0 | P170: 0 | Q170: 0 | R170: 0 | S170: =SUM(RC[-12]:RC[-1]) -> 0 | T170: =RC[-14]-RC[-1] -> 0 | U170: =IF(RC[-1]>-1,0,IF(RC[-1]<1,(RC[-2]-RC[-15])/RC[-15],0)) -> 0
C171: 0 | E171: 0 | F171: =RC[-1]*RC[-3] -> 0 | G171: 0 | H171: 0 | I171: 0 | J171: 0 | K171: 0 | L171: 0 | M171: 0 | N171: 0 | O171: 0 | P171: 0 | Q171: 0 | R171: 0 | S171: =SUM(RC[-12]:RC[-1]) -> 0 | T171: =RC[-14]-RC[-1] -> 0 | U171: =IF(RC[-1]>-1,0,IF(RC[-1]<1,(RC[-2]-RC[-15])/RC[-15],0)) -> 0
C172: 0 | E172: 0 | F172: =RC[-1]*RC[-3] -> 0 | G172: 0 | H172: 0 | I172: 0 | J172: 0 | K172: 0 | L172: 0 | M172: 0 | N172: 0 | O172: 0 | P172: 0 | Q172: 0 | R172: 0 | S172: =SUM(RC[-12]:RC[-1]) -> 0 | T172: =RC[-14]-RC[-1] -> 0 | U172: =IF(RC[-1]>-1,0,IF(RC[-1]<1,(RC[-2]-RC[-15])/RC[-15],0)) -> 0
C173: 0 | E173: 0 | F173: =RC[-1]*RC[-3] -> 0 | G173: 0 | H173: 0 | I173: 0 | J173: 0 | K173: 0 | L173: 0 | M173: 0 | N173: 0 | O173: 0 | P173: 0 | Q173: 0 | R173: 0 | S173: =SUM(RC[-12]:RC[-1]) -> 0 | T173: =RC[-14]-RC[-1] -> 0 | U173: =IF(RC[-1]>-1,0,IF(RC[-1]<1,(RC[-2]-RC[-15])/RC[-15],0)) -> 0
C174: 0 | E174: 0 | F174: =RC[-1]*RC[-3] -> 0 | G174: 0 | H174: 0 | I174: 0 | J174: 0 | K174: 0 | L174: 0 | M174: 0 | N174: 0 | O174: 0 | P174: 0 | Q174: 0 | R174: 0 | S174: =SUM(RC[-12]:RC[-1]) -> 0 | T174: =RC[-14]-RC[-1] -> 0 | U174: =IF(RC[-1]>-1,0,IF(RC[-1]<1,(RC[-2]-RC[-15])/RC[-15],0)) -> 0
C175: 0 | E175: 0 | F175: =RC[-1]*RC[-3] -> 0 | G175: 0 | H175: 0 | I175: 0 | J175: 0 | K175: 0 | L175: 0 | M175: 0 | N175: 0 | O175: 0 | P175: 0 | Q175: 0 | R175: 0 | S175: =SUM(RC[-12]:RC[-1]) -> 0 | T175: =RC[-14]-RC[-1] -> 0 | U175: =IF(RC[-1]>-1,0,IF(RC[-1]<1,(RC[-2]-RC[-15])/RC[-15],0)) -> 0
C176: 0 | E176: 0 | F176: =RC[-1]*RC[-3] -> 0 | G176: 0 | H176: 0 | I176: 0 | J176: 0 | K176: 0 | L176: 0 | M176: 0 | N176: 0 | O176: 0 | P176: 0 | Q176: 0 | R176: 0 | S176: =SUM(RC[-12]:RC[-1]) -> 0 | T176: =RC[-14]-RC[-1] -> 0 | U176: =IF(RC[-1]>-1,0,IF(RC[-1]<1,(RC[-2]-RC[-15])/RC[-15],0)) -> 0
C177: 0 | E177: 0 | F177: =RC[-1]*RC[-3] -> 0 | G177: 0 | H177: 0 | I177: 0 | J177: 0 | K177: 0 | L177: 0 | M177: 0 | N177: 0 | O177: 0 | P177: 0 | Q177: 0 | R177: 0 | S177: =SUM(RC[-12]:RC[-1]) -> 0 | T177: =RC[-14]-RC[-1] -> 0 | U177: =IF(RC[-1]>-1,0,IF(RC[-1]<1,(RC[-2]-RC[-15])/RC[-15],0)) -> 0
C178: 0 | E178: 0 | F178: =RC[-1]*RC[-3] -> 0 | G178: 0 | H178: 0 | I178: 0 | J178: 0 | K178: 0 | L178: 0 | M178: 0 | N178: 0 | O178: 0 | P178: 0 | Q178: 0 | R178: 0 | S178: =SUM(RC[-12]:RC[-1]) -> 0 | T178: =RC[-14]-RC[-1] -> 0 | U178: =IF(RC[-1]>-1,0,IF(RC[-1]<1,(RC[-2]-RC[-15])/RC[-15],0)) -> 0
C179: 0 | E179: 0 | F179: =RC[-1]*RC[-3] -> 0 | G179: 0 | H179: 0 | I179: 0 | J179: 0 | K179: 0 | L179: 0 | M179: 0 | N179: 0 | O179: 0 | P179: 0 | Q179: 0 | R179: 0 | S179: =SUM(RC[-12]:RC[-1]) -> 0 | T179: =RC[-14]-RC[-1] -> 0 | U179: =IF(RC[-1]>-1,0,IF(RC[-1]<1,(RC[-2]-RC[-15])/RC[-15],0)) -> 0
C180: 0 | E180: 0 | F180: =RC[-1]*RC[-3] -> 0 | G180: 0 | H180: 0 | I180: 0 | J180: 0 | K180: 0 | L180: 0 | M180: 0 | N180: 0 | O180: 0 | P180: 0 | Q180: 0 | R180: 0 | S180: =SUM(RC[-12]:RC[-1]) -> 0 | T180: =RC[-14]-RC[-1] -> 0 | U180: =IF(RC[-1]>-1,0,IF(RC[-1]<1,(RC[-2]-RC[-15])/RC[-15],0)) -> 0
C181: 0 | E181: 0 | F181: =RC[-1]*RC[-3] -> 0 | G181: 0 | H181: 0 | I181: 0 | J181: 0 | K181: 0 | L181: 0 | M181: 0 | N181: 0 | O181: 0 | P181: 0 | Q181: 0 | R181: 0 | S181: =SUM(RC[-12]:RC[-1]) -> 0 | T181: =RC[-14]-RC[-1] -> 0 | U181: =IF(RC[-1]>-1,0,IF(RC[-1]<1,(RC[-2]-RC[-15])/RC[-15],0)) -> 0
C182: 0 | E182: 0 | F182: =RC[-1]*RC[-3] -> 0 | G182: 0 | H182: 0 | I182: 0 | J182: 0 | K182: 0 | L182: 0 | M182: 0 | N182: 0 | O182: 0 | P182: 0 | Q182: 0 | R182: 0 | S182: =SUM(RC[-12]:RC[-1]) -> 0 | T182: =RC[-14]-RC[-1] -> 0 | U182: =IF(RC[-1]>-1,0,IF(RC[-1]<1,(RC[-2]-RC[-15])/RC[-15],0)) -> 0
C183: 0 | E183: 0 | F183: =RC[-1]*RC[-3] -> 0 | G183: 0 | H183: 0 | I183: 0 | J183: 0 | K183: 0 | L183: 0 | M183: 0 | N183: 0 | O183: 0 | P183: 0 | Q183: 0 | R183: 0 | S183: =SUM(RC[-12]:RC[-1]) -> 0 | T183: =RC[-14]-RC[-1] -> 0 | U183: =IF(RC[-1]>-1,0,IF(RC[-1]<1,(RC[-2]-RC[-15])/RC[-15],0)) -> 0
C184: 0 | E184: 0 | F184: =RC[-1]*RC[-3] -> 0 | G184: 0 | H184: 0 | I184: 0 | J184: 0 | K184: 0 | L184: 0 | M184: 0 | N184: 0 | O184: 0 | P184: 0 | Q184: 0 | R184: 0 | S184: =SUM(RC[-12]:RC[-1]) -> 0 | T184: =RC[-14]-RC[-1] -> 0 | U184: =IF(RC[-1]>-1,0,IF(RC[-1]<1,(RC[-2]-RC[-15])/RC[-15],0)) -> 0
C185: 0 | E185: 0 | F185: =RC[-1]*RC[-3] -> 0 | G185: 0 | H185: 0 | I185: 0 | J185: 0 | K185: 0 | L185: 0 | M185: 0 | N185: 0 | O185: 0 | P185: 0 | Q185: 0 | R185: 0 | S185: =SUM(RC[-12]:RC[-1]) -> 0 | T185: =RC[-14]-RC[-1] -> 0 | U185: =IF(RC[-1]>-1,0,IF(RC[-1]<1,(RC[-2]-RC[-15])/RC[-15],0)) -> 0
C186: 0 | E186: 0 | F186: =RC[-1]*RC[-3] -> 0 | G186: 0 | H186: 0 | I186: 0 | J186: 0 | K186: 0 | L186: 0 | M186: 0 | N186: 0 | O186: 0 | P186: 0 | Q186: 0 | R186: 0 | S186: =SUM(RC[-12]:RC[-1]) -> 0 | T186: =RC[-14]-RC[-1] -> 0 | U186: =IF(RC[-1]>-1,0,IF(RC[-1]<1,(RC[-2]-RC[-15])/RC[-15],0)) -> 0
C187: 0 | E187: 0 | F187: =RC[-1]*RC[-3] -> 0 | G187: 0 | H187: 0 | I187: 0 | J187: 0 | K187: 0 | L187: 0 | M187: 0 | N187: 0 | O187: 0 | P187: 0 | Q187: 0 | R187: 0 | S187: =SUM(RC[-12]:RC[-1]) -> 0 | T187: =RC[-14]-RC[-1] -> 0 | U187: =IF(RC[-1]>-1,0,IF(RC[-1]<1,(RC[-2]-RC[-15])/RC[-15],0)) -> 0
C188: 0 | E188: 0 | F188: =RC[-1]*RC[-3] -> 0 | G188: 0 | H188: 0 | I188: 0 | J188: 0 | K188: 0 | L188: 0 | M188: 0 | N188: 0 | O188: 0 | P188: 0 | Q188: 0 | R188: 0 | S188: =SUM(RC[-12]:RC[-1]) -> 0 | T188: =RC[-14]-RC[-1] -> 0 | U188: =IF(RC[-1]>-1,0,IF(RC[-1]<1,(RC[-2]-RC[-15])/RC[-15],0)) -> 0
C189: 0 | E189: 0 | F189: =RC[-1]*RC[-3] -> 0 | G189: 0 | H189: 0 | I189: 0 | J189: 0 | K189: 0 | L189: 0 | M189: 0 | N189: 0 | O189: 0 | P189: 0 | Q189: 0 | R189: 0 | S189: =SUM(RC[-12]:RC[-1]) -> 0 | T189: =RC[-14]-RC[-1] -> 0 | U189: =IF(RC[-1]>-1,0,IF(RC[-1]<1,(RC[-2]-RC[-15])/RC[-15],0)) -> 0
C190: 0 | E190: 0 | F190: =RC[-1]*RC[-3] -> 0 | G190: 0 | H190: 0 | I190: 0 | J190: 0 | K190: 0 | L190: 0 | M190: 0 | N190: 0 | O190: 0 | P190: 0 | Q190: 0 | R190: 0 | S190: =SUM(RC[-12]:RC[-1]) -> 0 | T190: =RC[-14]-RC[-1] -> 0 | U190: =IF(RC[-1]>-1,0,IF(RC[-1]<1,(RC[-2]-RC[-15])/RC[-15],0)) -> 0
C191: 0 | E191: 0 | F191: =RC[-1]*RC[-3] -> 0 | G191: 0 | H191: 0 | I191: 0 | J191: 0 | K191: 0 | L191: 0 | M191: 0 | N191: 0 | O191: 0 | P191: 0 | Q191: 0 | R191: 0 | S191: =SUM(RC[-12]:RC[-1]) -> 0 | T191: =RC[-14]-RC[-1] -> 0 | U191: =IF(RC[-1]>-1,0,IF(RC[-1]<1,(RC[-2]-RC[-15])/RC[-15],0)) -> 0
C192: 0 | E192: 0 | F192: =RC[-1]*RC[-3] -> 0 | G192: 0 | H192: 0 | I192: 0 | J192: 0 | K192: 0 | L192: 0 | M192: 0 | N192: 0 | O192: 0 | P192: 0 | Q192: 0 | R192: 0 | S192: =SUM(RC[-12]:RC[-1]) -> 0 | T192: =RC[-14]-RC[-1] -> 0 | U192: =IF(RC[-1]>-1,0,IF(RC[-1]<1,(RC[-2]-RC[-15])/RC[-15],0)) -> 0
C193: 0 | E193: 0 | F193: =RC[-1]*RC[-3] -> 0 | G193: 0 | H193: 0 | I193: 0 | J193: 0 | K193: 0 | L193: 0 | M193: 0 | N193: 0 | O193: 0 | P193: 0 | Q193: 0 | R193: 0 | S193: =SUM(RC[-12]:RC[-1]) -> 0 | T193: =RC[-14]-RC[-1] -> 0 | U193: =IF(RC[-1]>-1,0,IF(RC[-1]<1,(RC[-2]-RC[-15])/RC[-15],0)) -> 0
C194: 0 | E194: 0 | F194: =RC[-1]*RC[-3] -> 0 | G194: 0 | H194: 0 | I194: 0 | J194: 0 | K194: 0 | L194: 0 | M194: 0 | N194: 0 | O194: 0 | P194: 0 | Q194: 0 | R194: 0 | S194: =SUM(RC[-12]:RC[-1]) -> 0 | T194: =RC[-14]-RC[-1] -> 0 | U194: =IF(RC[-1]>-1,0,IF(RC[-1]<1,(RC[-2]-RC[-15])/RC[-15],0)) -> 0
C195: 0 | E195: 0 | F195: =RC[-1]*RC[-3] -> 0 | G195: 0 | H195: 0 | I195: 0 | J195: 0 | K195: 0 | L195: 0 | M195: 0 | N195: 0 | O195: 0 | P195: 0 | Q195: 0 | R195: 0 | S195: =SUM(RC[-12]:RC[-1]) -> 0 | T195: =RC[-14]-RC[-1] -> 0 | U195: =IF(RC[-1]>-1,0,IF(RC[-1]<1,(RC[-2]-RC[-15])/RC[-15],0)) -> 0
C196: 0 | E196: 0 | F196: =RC[-1]*RC[-3] -> 0 | G196: 0 | H196: 0 | I196: 0 | J196: 0 | K196: 0 | L196: 0 | M196: 0 | N196: 0 | O196: 0 | P196: 0 | Q196: 0 | R196: 0 | S196: =SUM(RC[-12]:RC[-1]) -> 0 | T196: =RC[-14]-RC[-1] -> 0 | U196: =IF(RC[-1]>-1,0,IF(RC[-1]<1,(RC[-2]-RC[-15])/RC[-15],0)) -> 0
C197: 0 | E197: 0 | F197: =RC[-1]*RC[-3] -> 0 | G197: 0 | H197: 0 | I197: 0 | J197: 0 | K197: 0 | L197: 0 | M197: 0 | N197: 0 | O197: 0 | P197: 0 | Q197: 0 | R197: 0 | S197: =SUM(RC[-12]:RC[-1]) -> 0 | T197: =RC[-14]-RC[-1] -> 0 | U197: =IF(RC[-1]>-1,0,IF(RC[-1]<1,(RC[-2]-RC[-15])/RC[-15],0)) -> 0
C198: 0 | E198: 0 | F198: =RC[-1]*RC[-3] -> 0 | G198: 0 | H198: 0 | I198: 0 | J198: 0 | K198: 0 | L198: 0 | M198: 0 | N198: 0 | O198: 0 | P198: 0 | Q198: 0 | R198: 0 | S198: =SUM(RC[-12]:RC[-1]) -> 0 | T198: =RC[-14]-RC[-1] -> 0 | U198: =IF(RC[-1]>-1,0,IF(RC[-1]<1,(RC[-2]-RC[-15])/RC[-15],0)) -> 0
C199: 0 | E199: 0 | F199: =RC[-1]*RC[-3] -> 0 | G199: 0 | H199: 0 | I199: 0 | J199: 0 | K199: 0 | L199: 0 | M199: 0 | N199: 0 | O199: 0 | P199: 0 | Q199: 0 | R199: 0 | S199: =SUM(RC[-12]:RC[-1]) -> 0 | T199: =RC[-14]-RC[-1] -> 0 | U199: =IF(RC[-1]>-1,0,IF(RC[-1]<1,(RC[-2]-RC[-15])/RC[-15],0)) -> 0
C200: 0 | E200: 0 | F200: =RC[-1]*RC[-3] -> 0 | G200: 0 | H200: 0 | I200: 0 | J200: 0 | K200: 0 | L200: 0 | M200: 0 | N200: 0 | O200: 0 | P200: 0 | Q200: 0 | R200: 0 | S200: =SUM(RC[-12]:RC[-1]) -> 0 | T200: =RC[-14]-RC[-1] -> 0 | U200: =IF(RC[-1]>-1,0,IF(RC[-1]<1,(RC[-2]-RC[-15])/RC[-15],0)) -> 0
C201: 0 | E201: 0 | F201: =RC[-1]*RC[-3] -> 0 | G201: 0 | H201: 0 | I201: 0 | J201: 0 | K201: 0 | L201: 0 | M201: 0 | N201: 0 | O201: 0 | P201: 0 | Q201: 0 | R201: 0 | S201: =SUM(RC[-12]:RC[-1]) -> 0 | T201: =RC[-14]-RC[-1] -> 0 | U201: =IF(RC[-1]>-1,0,IF(RC[-1]<1,(RC[-2]-RC[-15])/RC[-15],0)) -> 0
C202: 0 | E202: 0 | F202: =RC[-1]*RC[-3] -> 0 | G202: 0 | H202: 0 | I202: 0 | J202: 0 | K202: 0 | L202: 0 | M202: 0 | N202: 0 | O202: 0 | P202: 0 | Q202: 0 | R202: 0 | S202: =SUM(RC[-12]:RC[-1]) -> 0 | T202: =RC[-14]-RC[-1] -> 0 | U202: =IF(RC[-1]>-1,0,IF(RC[-1]<1,(RC[-2]-RC[-15])/RC[-15],0)) -> 0
C203: 0 | E203: 0 | F203: =RC[-1]*RC[-3] -> 0 | G203: 0 | H203: 0 | I203: 0 | J203: 0 | K203: 0 | L203: 0 | M203: 0 | N203: 0 | O203: 0 | P203: 0 | Q203: 0 | R203: 0 | S203: =SUM(RC[-12]:RC[-1]) -> 0 | T203: =RC[-14]-RC[-1] -> 0 | U203: =IF(RC[-1]>-1,0,IF(RC[-1]<1,(RC[-2]-RC[-15])/RC[-15],0)) -> 0
C204: 0 | E204: 0 | F204: =RC[-1]*RC[-3] -> 0 | G204: 0 | H204: 0 | I204: 0 | J204: 0 | K204: 0 | L204: 0 | M204: 0 | N204: 0 | O204: 0 | P204: 0 | Q204: 0 | R204: 0 | S204: =SUM(RC[-12]:RC[-1]) -> 0 | T204: =RC[-14]-RC[-1] -> 0 | U204: =IF(RC[-1]>-1,0,IF(RC[-1]<1,(RC[-2]-RC[-15])/RC[-15],0)) -> 0
C205: 0 | E205: 0 | F205: =RC[-1]*RC[-3] -> 0 | G205: 0 | H205: 0 | I205: 0 | J205: 0 | K205: 0 | L205: 0 | M205: 0 | N205: 0 | O205: 0 | P205: 0 | Q205: 0 | R205: 0 | S205: =SUM(RC[-12]:RC[-1]) -> 0 | T205: =RC[-14]-RC[-1] -> 0 | U205: =IF(RC[-1]>-1,0,IF(RC[-1]<1,(RC[-2]-RC[-15])/RC[-15],0)) -> 0
C206: 0 | E206: 0 | F206: =RC[-1]*RC[-3] -> 0 | G206: 0 | H206: 0 | I206: 0 | J206: 0 | K206: 0 | L206: 0 | M206: 0 | N206: 0 | O206: 0 | P206: 0 | Q206: 0 | R206: 0 | S206: =SUM(RC[-12]:RC[-1]) -> 0 | T206: =RC[-14]-RC[-1] -> 0 | U206: =IF(RC[-1]>-1,0,IF(RC[-1]<1,(RC[-2]-RC[-15])/RC[-15],0)) -> 0
C207: 0 | E207: 0 | F207: =RC[-1]*RC[-3] -> 0 | G207: 0 | H207: 0 | I207: 0 | J207: 0 | K207: 0 | L207: 0 | M207: 0 | N207: 0 | O207: 0 | P207: 0 | Q207: 0 | R207: 0 | S207: =SUM(RC[-12]:RC[-1]) -> 0 | T207: =RC[-14]-RC[-1] -> 0 | U207: =IF(RC[-1]>-1,0,IF(RC[-1]<1,(RC[-2]-RC[-15])/RC[-15],0)) -> 0
C208: 0 | E208: 0 | F208: =RC[-1]*RC[-3] -> 0 | G208: 0 | H208: 0 | I208: 0 | J208: 0 | K208: 0 | L208: 0 | M208: 0 | N208: 0 | O208: 0 | P208: 0 | Q208: 0 | R208: 0 | S208: =SUM(RC[-12]:RC[-1]) -> 0 | T208: =RC[-14]-RC[-1] -> 0 | U208: =IF(RC[-1]>-1,0,IF(RC[-1]<1,(RC[-2]-RC[-15])/RC[-15],0)) -> 0
C209: 0 | E209: 0 | F209: =RC[-1]*RC[-3] -> 0 | G209: 0 | H209: 0 | I209: 0 | J209: 0 | K209: 0 | L209: 0 | M209: 0 | N209: 0 | O209: 0 | P209: 0 | Q209: 0 | R209: 0 | S209: =SUM(RC[-12]:RC[-1]) -> 0 | T209: =RC[-14]-RC[-1] -> 0 | U209: =IF(RC[-1]>-1,0,IF(RC[-1]<1,(RC[-2]-RC[-15])/RC[-15],0)) -> 0
C210: 0 | E210: 0 | F210: =RC[-1]*RC[-3] -> 0 | G210: 0 | H210: 0 | I210: 0 | J210: 0 | K210: 0 | L210: 0 | M210: 0 | N210: 0 | O210: 0 | P210: 0 | Q210: 0 | R210: 0 | S210: =SUM(RC[-12]:RC[-1]) -> 0 | T210: =RC[-14]-RC[-1] -> 0 | U210: =IF(RC[-1]>-1,0,IF(RC[-1]<1,(RC[-2]-RC[-15])/RC[-15],0)) -> 0