Sheet: Jan.-Dec. 2002
A1: RISE CLASSES (JAN.-DEC. 2002)
A2: CLASS TITLE | B2: CLASS DATE | C2: NUMBER OF CLASS DAYS | D2: PUBLIC COST | E2: RISE COST | F2: Capital One | G2: Philip Morris | H2: Isle of Wight Co. Schools | I2: RRHA | J2: VDOT | K2: Trigon | L2: VCU/MCV | M2: VEC | N2: GableHill Systems, LLC | O2: Tech Svcs. Corp. | P2: Meadow Farm | Q2: Self-Employed | R2: Dept. of Environmental Quality | S2: Danville Community College | T2: Venturi Tech. Partners | U2: Va. Dept. of Corrections | V2: Richard Bland | W2: VHDA | X2: DSCR | Y2: City of Richmond | Z2: Va. Game & Inland Fisheries | AA2: Colony Management | AB2: Paramount Kings Dominion | AC2: DGS | AD2: Dept of Info Technology | AE2: Dept of Taxation | AF2: Va. Retirement System | AG2: Southern States Coop. | AH2: Colonial Mechanical | AI2: Naptheon | AJ2: VDSS | AK2: Dept. of Conservation Recreation | AL2: Curtis Contracting | AM2: Merge Computer Corp | AN2: Covansys | AO2: Circuit City | AP2: ABC | AQ2: Metro Info. Systems | AR2: TRW | AS2: DMV | AT2: Dallas Co. Tax Office | AU2: JSRCC | AV2: VDH-Vital Statistics | AW2: Auditor Public Accounts | AX2: Pinkerton Computer Consultants | AY2: Va. Lottery | AZ2: City of Newport News | BA2: Supreme Court of Virginia | BB2: Westvaco | BC2: Dept. of Education | BD2: Supervalue | BE2: State Corp. Commission | BF2: Suntrust Bank | BG2: Dominion Resources | BK2: Number of Participants Per Class | BL2: Total Number of Student Days Trained | BM2: Total Public Cost | BN2: Total RISE Savings | BO2: Total Actual Costs and Savings Per Class
A3: Dreamweaver 4 - Level I | B3: 2002-01-08T00:00:00.000 | C3: 1 | D3: 450 | E3: 200 | F3: 0 | G3: 0 | H3: 0 | I3: 0 | J3: 2 | K3: 0 | L3: 0 | M3: 1 | N3: 0 | O3: 0 | P3: 0 | Q3: 0 | R3: 0 | S3: 0 | T3: 0 | U3: 0 | V3: 2 | W3: 0 | X3: 0 | Y3: 0 | Z3: 0 | AA3: 0 | AB3: 0 | AC3: 0 | AD3: 0 | AE3: 0 | AF3: 0 | AG3: 0 | AH3: 0 | AI3: 0 | AJ3: 0 | AK3: 0 | AL3: 0 | AM3: 0 | AN3: 0 | AO3: 0 | AP3: 0 | AQ3: 0 | AR3: 0 | AS3: 0 | AT3: 0 | AU3: 0 | AV3: 0 | AW3: 0 | AX3: 0 | AY3: 0 | AZ3: 0 | BA3: 0 | BB3: 0 | BC3: 0 | BD3: 0 | BE3: 0 | BF3: 0 | BG3: 0 | BK3: =SUM(RC[-57]:RC[-4]) -> 5 | BL3: =RC[-61]*RC[-1] -> 5
D4: Total | F4: =R[-1]C*R3C5 -> 0 | G4: =R[-1]C*R3C5 -> 0 | H4: =R[-1]C*R3C5 -> 0 | I4: =R[-1]C*R3C5 -> 0 | J4: =R[-1]C*R3C5 -> 400 | K4: =R[-1]C*R3C5 -> 0 | L4: =R[-1]C*R3C5 -> 0 | M4: =R[-1]C*R3C5 -> 200 | N4: =R[-1]C*R3C5 -> 0 | O4: =R[-1]C*R3C5 -> 0 | P4: =R[-1]C*R3C5 -> 0 | Q4: =R[-1]C*R3C5 -> 0 | R4: =R[-1]C*R3C5 -> 0 | S4: =R[-1]C*R3C5 -> 0 | T4: =R[-1]C*R3C5 -> 0 | U4: =R[-1]C*R3C5 -> 0 | V4: =R[-1]C*R3C5 -> 400 | W4: =R[-1]C*R3C5 -> 0 | X4: =R[-1]C*R3C5 -> 0 | Y4: =R[-1]C*R3C5 -> 0 | Z4: =R[-1]C*R3C5 -> 0 | AA4: =R[-1]C*R3C5 -> 0 | AB4: =R[-1]C*R3C5 -> 0 | AC4: =R[-1]C*R3C5 -> 0 | AD4: =R[-1]C*R3C5 -> 0 | AE4: =R[-1]C*R3C5 -> 0 | AF4: =R[-1]C*R3C5 -> 0 | AG4: =R[-1]C*R3C5 -> 0 | AH4: =R[-1]C*R3C5 -> 0 | AI4: =R[-1]C*R3C5 -> 0 | AJ4: =R[-1]C*R3C5 -> 0 | AK4: =R[-1]C*R3C5 -> 0 | AL4: =R[-1]C*R3C5 -> 0 | AM4: =R[-1]C*R3C5 -> 0 | AN4: =R[-1]C*R3C5 -> 0 | AO4: =R[-1]C*R3C5 -> 0 | AP4: =R[-1]C*R3C5 -> 0 | AQ4: =R[-1]C*R3C5 -> 0 | AR4: =R[-1]C*R3C5 -> 0 | AS4: =R[-1]C*R3C5 -> 0 | AT4: =R[-1]C*R3C5 -> 0 | AU4: =R[-1]C*R3C5 -> 0 | AV4: =R[-1]C*R3C5 -> 0 | AW4: =R[-1]C*R3C5 -> 0 | AX4: =R[-1]C*R3C5 -> 0 | AY4: =R[-1]C*R3C5 -> 0 | AZ4: =R[-1]C*R3C5 -> 0 | BA4: =R[-1]C*R3C5 -> 0 | BB4: =R[-1]C*R3C5 -> 0 | BC4: =R[-1]C*R3C5 -> 0 | BD4: =R[-1]C*R3C5 -> 0 | BE4: =R[-1]C*R3C5 -> 0 | BF4: =R[-1]C*R3C5 -> 0 | BG4: =R[-1]C*R3C5 -> 0 | BM4: =R[-1]C[-61]*R[-1]C[-2] -> 2250 | BN4: =RC[-1]-RC[1] -> 1250 | BO4: =SUM(RC[-61]:RC[-8]) -> 1000
D5: Total Savings | F5: =R[-1]C-R[-2]C4*R[-2]C -> 0 | G5: =R[-1]C-R[-2]C4*R[-2]C -> 0 | H5: =R[-1]C-R[-2]C4*R[-2]C -> 0 | I5: =R[-1]C-R[-2]C4*R[-2]C -> 0 | J5: =R[-1]C-R[-2]C4*R[-2]C -> -500 | K5: =R[-1]C-R[-2]C4*R[-2]C -> 0 | L5: =R[-1]C-R[-2]C4*R[-2]C -> 0 | M5: =R[-1]C-R[-2]C4*R[-2]C -> -250 | N5: =R[-1]C-R[-2]C4*R[-2]C -> 0 | O5: =R[-1]C-R[-2]C4*R[-2]C -> 0 | P5: =R[-1]C-R[-2]C4*R[-2]C -> 0 | Q5: =R[-1]C-R[-2]C4*R[-2]C -> 0 | R5: =R[-1]C-R[-2]C4*R[-2]C -> 0 | S5: =R[-1]C-R[-2]C4*R[-2]C -> 0 | T5: =R[-1]C-R[-2]C4*R[-2]C -> 0 | U5: =R[-1]C-R[-2]C4*R[-2]C -> 0 | V5: =R[-1]C-R[-2]C4*R[-2]C -> -500 | W5: =R[-1]C-R[-2]C4*R[-2]C -> 0 | X5: =R[-1]C-R[-2]C4*R[-2]C -> 0 | Y5: =R[-1]C-R[-2]C4*R[-2]C -> 0 | Z5: =R[-1]C-R[-2]C4*R[-2]C -> 0 | AA5: =R[-1]C-R[-2]C4*R[-2]C -> 0 | AB5: =R[-1]C-R[-2]C4*R[-2]C -> 0 | AC5: =R[-1]C-R[-2]C4*R[-2]C -> 0 | AD5: =R[-1]C-R[-2]C4*R[-2]C -> 0 | AE5: =R[-1]C-R[-2]C4*R[-2]C -> 0 | AF5: =R[-1]C-R[-2]C4*R[-2]C -> 0 | AG5: =R[-1]C-R[-2]C4*R[-2]C -> 0 | AH5: =R[-1]C-R[-2]C4*R[-2]C -> 0 | AI5: =R[-1]C-R[-2]C4*R[-2]C -> 0 | AJ5: =R[-1]C-R[-2]C4*R[-2]C -> 0 | AK5: =R[-1]C-R[-2]C4*R[-2]C -> 0 | AL5: =R[-1]C-R[-2]C4*R[-2]C -> 0 | AM5: =R[-1]C-R[-2]C4*R[-2]C -> 0 | AN5: =R[-1]C-R[-2]C4*R[-2]C -> 0 | AO5: =R[-1]C-R[-2]C4*R[-2]C -> 0 | AP5: =R[-1]C-R[-2]C4*R[-2]C -> 0 | AQ5: =R[-1]C-R[-2]C4*R[-2]C -> 0 | AR5: =R[-1]C-R[-2]C4*R[-2]C -> 0 | AS5: =R[-1]C-R[-2]C4*R[-2]C -> 0 | AT5: =R[-1]C-R[-2]C4*R[-2]C -> 0 | AU5: =R[-1]C-R[-2]C4*R[-2]C -> 0 | AV5: =R[-1]C-R[-2]C4*R[-2]C -> 0 | AW5: =R[-1]C-R[-2]C4*R[-2]C -> 0 | AX5: =R[-1]C-R[-2]C4*R[-2]C -> 0 | AY5: =R[-1]C-R[-2]C4*R[-2]C -> 0 | AZ5: =R[-1]C-R[-2]C4*R[-2]C -> 0 | BA5: =R[-1]C-R[-2]C4*R[-2]C -> 0 | BB5: =R[-1]C-R[-2]C4*R[-2]C -> 0 | BC5: =R[-1]C-R[-2]C4*R[-2]C -> 0 | BD5: =R[-1]C-R[-2]C4*R[-2]C -> 0 | BE5: =R[-1]C-R[-2]C4*R[-2]C -> 0 | BF5: =R[-1]C-R[-2]C4*R[-2]C -> 0 | BG5: =R[-1]C-R[-2]C4*R[-2]C -> 0 | BO5: =SUM(RC[-61]:RC[-8]) -> -1250
A6: Analysis Simulation | B6: 2002-01-09T00:00:00.000 | C6: 2 | D6: 1175 | E6: 525 | F6: 0 | G6: 0 | H6: 0 | I6: 0 | J6: 0 | K6: 0 | L6: 0 | M6: 0 | N6: 0 | O6: 0 | P6: 0 | Q6: 0 | R6: 0 | S6: 0 | T6: 0 | U6: 0 | V6: 0 | W6: 0 | X6: 0 | Y6: 0 | Z6: 0 | AA6: 0 | AB6: 0 | AC6: 0 | AD6: 0 | AE6: 0 | AF6: 0 | AG6: 0 | AH6: 0 | AI6: 0 | AJ6: 0 | AK6: 0 | AL6: 0 | AM6: 0 | AN6: 0 | AO6: 0 | AP6: 0 | AQ6: 0 | AR6: 0 | AS6: 0 | AT6: 0 | AU6: 0 | AV6: 0 | AW6: 0 | AX6: 0 | AY6: 0 | AZ6: 0 | BA6: 0 | BB6: 0 | BC6: 0 | BD6: 0 | BE6: 0 | BF6: 0 | BG6: 17 | BK6: =SUM(RC[-57]:RC[-4]) -> 17 | BL6: =RC[-61]*RC[-1] -> 34
D7: Total | F7: =R[-1]C*R6C5 -> 0 | G7: =R[-1]C*R6C5 -> 0 | H7: =R[-1]C*R6C5 -> 0 | I7: =R[-1]C*R6C5 -> 0 | J7: =R[-1]C*R6C5 -> 0 | K7: =R[-1]C*R6C5 -> 0 | L7: =R[-1]C*R6C5 -> 0 | M7: =R[-1]C*R6C5 -> 0 | N7: =R[-1]C*R6C5 -> 0 | O7: =R[-1]C*R6C5 -> 0 | P7: =R[-1]C*R6C5 -> 0 | Q7: =R[-1]C*R6C5 -> 0 | R7: =R[-1]C*R6C5 -> 0 | S7: =R[-1]C*R6C5 -> 0 | T7: =R[-1]C*R6C5 -> 0 | U7: =R[-1]C*R6C5 -> 0 | V7: =R[-1]C*R6C5 -> 0 | W7: =R[-1]C*R6C5 -> 0 | X7: =R[-1]C*R6C5 -> 0 | Y7: =R[-1]C*R6C5 -> 0 | Z7: =R[-1]C*R6C5 -> 0 | AA7: =R[-1]C*R6C5 -> 0 | AB7: =R[-1]C*R6C5 -> 0 | AC7: =R[-1]C*R6C5 -> 0 | AD7: =R[-1]C*R6C5 -> 0 | AE7: =R[-1]C*R6C5 -> 0 | AF7: =R[-1]C*R6C5 -> 0 | AG7: =R[-1]C*R6C5 -> 0 | AH7: =R[-1]C*R6C5 -> 0 | AI7: =R[-1]C*R6C5 -> 0 | AJ7: =R[-1]C*R6C5 -> 0 | AK7: =R[-1]C*R6C5 -> 0 | AL7: =R[-1]C*R6C5 -> 0 | AM7: =R[-1]C*R6C5 -> 0 | AN7: =R[-1]C*R6C5 -> 0 | AO7: =R[-1]C*R6C5 -> 0 | AP7: =R[-1]C*R6C5 -> 0 | AQ7: =R[-1]C*R6C5 -> 0 | AR7: =R[-1]C*R6C5 -> 0 | AS7: =R[-1]C*R6C5 -> 0 | AT7: =R[-1]C*R6C5 -> 0 | AU7: =R[-1]C*R6C5 -> 0 | AV7: =R[-1]C*R6C5 -> 0 | AW7: =R[-1]C*R6C5 -> 0 | AX7: =R[-1]C*R6C5 -> 0 | AY7: =R[-1]C*R6C5 -> 0 | AZ7: =R[-1]C*R6C5 -> 0 | BA7: =R[-1]C*R6C5 -> 0 | BB7: =R[-1]C*R6C5 -> 0 | BC7: =R[-1]C*R6C5 -> 0 | BD7: =R[-1]C*R6C5 -> 0 | BE7: =R[-1]C*R6C5 -> 0 | BF7: =R[-1]C*R6C5 -> 0 | BG7: =R[-1]C*R6C5 -> 8925 | BM7: =R[-1]C[-61]*R[-1]C[-2] -> 19975 | BN7: =RC[-1]-RC[1] -> 11050 | BO7: =SUM(RC[-61]:RC[-8]) -> 8925
D8: Total Savings | F8: =R[-1]C-R[-2]C4*R[-2]C -> 0 | G8: =R[-1]C-R[-2]C4*R[-2]C -> 0 | H8: =R[-1]C-R[-2]C4*R[-2]C -> 0 | I8: =R[-1]C-R[-2]C4*R[-2]C -> 0 | J8: =R[-1]C-R[-2]C4*R[-2]C -> 0 | K8: =R[-1]C-R[-2]C4*R[-2]C -> 0 | L8: =R[-1]C-R[-2]C4*R[-2]C -> 0 | M8: =R[-1]C-R[-2]C4*R[-2]C -> 0 | N8: =R[-1]C-R[-2]C4*R[-2]C -> 0 | O8: =R[-1]C-R[-2]C4*R[-2]C -> 0 | P8: =R[-1]C-R[-2]C4*R[-2]C -> 0 | Q8: =R[-1]C-R[-2]C4*R[-2]C -> 0 | R8: =R[-1]C-R[-2]C4*R[-2]C -> 0 | S8: =R[-1]C-R[-2]C4*R[-2]C -> 0 | T8: =R[-1]C-R[-2]C4*R[-2]C -> 0 | U8: =R[-1]C-R[-2]C4*R[-2]C -> 0 | V8: =R[-1]C-R[-2]C4*R[-2]C -> 0 | W8: =R[-1]C-R[-2]C4*R[-2]C -> 0 | X8: =R[-1]C-R[-2]C4*R[-2]C -> 0 | Y8: =R[-1]C-R[-2]C4*R[-2]C -> 0 | Z8: =R[-1]C-R[-2]C4*R[-2]C -> 0 | AA8: =R[-1]C-R[-2]C4*R[-2]C -> 0 | AB8: =R[-1]C-R[-2]C4*R[-2]C -> 0 | AC8: =R[-1]C-R[-2]C4*R[-2]C -> 0 | AD8: =R[-1]C-R[-2]C4*R[-2]C -> 0 | AE8: =R[-1]C-R[-2]C4*R[-2]C -> 0 | AF8: =R[-1]C-R[-2]C4*R[-2]C -> 0 | AG8: =R[-1]C-R[-2]C4*R[-2]C -> 0 | AH8: =R[-1]C-R[-2]C4*R[-2]C -> 0 | AI8: =R[-1]C-R[-2]C4*R[-2]C -> 0 | AJ8: =R[-1]C-R[-2]C4*R[-2]C -> 0 | AK8: =R[-1]C-R[-2]C4*R[-2]C -> 0 | AL8: =R[-1]C-R[-2]C4*R[-2]C -> 0 | AM8: =R[-1]C-R[-2]C4*R[-2]C -> 0 | AN8: =R[-1]C-R[-2]C4*R[-2]C -> 0 | AO8: =R[-1]C-R[-2]C4*R[-2]C -> 0 | AP8: =R[-1]C-R[-2]C4*R[-2]C -> 0 | AQ8: =R[-1]C-R[-2]C4*R[-2]C -> 0 | AR8: =R[-1]C-R[-2]C4*R[-2]C -> 0 | AS8: =R[-1]C-R[-2]C4*R[-2]C -> 0 | AT8: =R[-1]C-R[-2]C4*R[-2]C -> 0 | AU8: =R[-1]C-R[-2]C4*R[-2]C -> 0 | AV8: =R[-1]C-R[-2]C4*R[-2]C -> 0 | AW8: =R[-1]C-R[-2]C4*R[-2]C -> 0 | AX8: =R[-1]C-R[-2]C4*R[-2]C -> 0 | AY8: =R[-1]C-R[-2]C4*R[-2]C -> 0 | AZ8: =R[-1]C-R[-2]C4*R[-2]C -> 0 | BA8: =R[-1]C-R[-2]C4*R[-2]C -> 0 | BB8: =R[-1]C-R[-2]C4*R[-2]C -> 0 | BC8: =R[-1]C-R[-2]C4*R[-2]C -> 0 | BD8: =R[-1]C-R[-2]C4*R[-2]C -> 0 | BE8: =R[-1]C-R[-2]C4*R[-2]C -> 0 | BF8: =R[-1]C-R[-2]C4*R[-2]C -> 0 | BG8: =R[-1]C-R[-2]C4*R[-2]C -> -11050 | BO8: =SUM(RC[-61]:RC[-8]) -> -11050
A9: Mastering the Requirements Process | B9: 2002-01-14T00:00:00.000 | C9: 2 | D9: 1175 | E9: 525 | F9: 0 | G9: 0 | H9: 0 | I9: 0 | J9: 0 | K9: 2 | L9: 0 | M9: 0 | N9: 0 | O9: 0 | P9: 0 | Q9: 0 | R9: 0 | S9: 0 | T9: 0 | U9: 0 | V9: 0 | W9: 0 | X9: 0 | Y9: 0 | Z9: 0 | AA9: 0 | AB9: 0 | AC9: 0 | AD9: 0 | AE9: 0 | AF9: 0 | AG9: 0 | AH9: 0 | AI9: 0 | AJ9: 0 | AK9: 0 | AL9: 0 | AM9: 0 | AN9: 0 | AO9: 0 | AP9: 0 | AQ9: 1 | AR9: 0 | AS9: 0 | AT9: 0 | AU9: 0 | AV9: 0 | AW9: 0 | AX9: 0 | AY9: 0 | AZ9: 0 | BA9: 0 | BB9: 0 | BC9: 0 | BD9: 0 | BE9: 0 | BF9: 0 | BG9: 13 | BK9: =SUM(RC[-57]:RC[-4]) -> 16 | BL9: =RC[-61]*RC[-1] -> 32
D10: Total | F10: =R[-1]C*R9C5 -> 0 | G10: =R[-1]C*R9C5 -> 0 | H10: =R[-1]C*R9C5 -> 0 | I10: =R[-1]C*R9C5 -> 0 | J10: =R[-1]C*R9C5 -> 0 | K10: =R[-1]C*R9C5 -> 1050 | L10: =R[-1]C*R9C5 -> 0 | M10: =R[-1]C*R9C5 -> 0 | N10: =R[-1]C*R9C5 -> 0 | O10: =R[-1]C*R9C5 -> 0 | P10: =R[-1]C*R9C5 -> 0 | Q10: =R[-1]C*R9C5 -> 0 | R10: =R[-1]C*R9C5 -> 0 | S10: =R[-1]C*R9C5 -> 0 | T10: =R[-1]C*R9C5 -> 0 | U10: =R[-1]C*R9C5 -> 0 | V10: =R[-1]C*R9C5 -> 0 | W10: =R[-1]C*R9C5 -> 0 | X10: =R[-1]C*R9C5 -> 0 | Y10: =R[-1]C*R9C5 -> 0 | Z10: =R[-1]C*R9C5 -> 0 | AA10: =R[-1]C*R9C5 -> 0 | AB10: =R[-1]C*R9C5 -> 0 | AC10: =R[-1]C*R9C5 -> 0 | AD10: =R[-1]C*R9C5 -> 0 | AE10: =R[-1]C*R9C5 -> 0 | AF10: =R[-1]C*R9C5 -> 0 | AG10: =R[-1]C*R9C5 -> 0 | AH10: =R[-1]C*R9C5 -> 0 | AI10: =R[-1]C*R9C5 -> 0 | AJ10: =R[-1]C*R9C5 -> 0 | AK10: =R[-1]C*R9C5 -> 0 | AL10: =R[-1]C*R9C5 -> 0 | AM10: =R[-1]C*R9C5 -> 0 | AN10: =R[-1]C*R9C5 -> 0 | AO10: =R[-1]C*R9C5 -> 0 | AP10: =R[-1]C*R9C5 -> 0 | AQ10: =R[-1]C*R9C5 -> 525 | AR10: =R[-1]C*R9C5 -> 0 | AS10: =R[-1]C*R9C5 -> 0 | AT10: =R[-1]C*R9C5 -> 0 | AU10: =R[-1]C*R9C5 -> 0 | AV10: =R[-1]C*R9C5 -> 0 | AW10: =R[-1]C*R9C5 -> 0 | AX10: =R[-1]C*R9C5 -> 0 | AY10: =R[-1]C*R9C5 -> 0 | AZ10: =R[-1]C*R9C5 -> 0 | BA10: =R[-1]C*R9C5 -> 0 | BB10: =R[-1]C*R9C5 -> 0 | BC10: =R[-1]C*R9C5 -> 0 | BD10: =R[-1]C*R9C5 -> 0 | BE10: =R[-1]C*R9C5 -> 0 | BF10: =R[-1]C*R9C5 -> 0 | BG10: =R[-1]C*R9C5 -> 6825 | BM10: =R[-1]C[-61]*R[-1]C[-2] -> 18800 | BN10: =RC[-1]-RC[1] -> 10400 | BO10: =SUM(RC[-61]:RC[-8]) -> 8400
D11: Total Savings | F11: =R[-1]C-R[-2]C4*R[-2]C -> 0 | G11: =R[-1]C-R[-2]C4*R[-2]C -> 0 | H11: =R[-1]C-R[-2]C4*R[-2]C -> 0 | I11: =R[-1]C-R[-2]C4*R[-2]C -> 0 | J11: =R[-1]C-R[-2]C4*R[-2]C -> 0 | K11: =R[-1]C-R[-2]C4*R[-2]C -> -1300 | L11: =R[-1]C-R[-2]C4*R[-2]C -> 0 | M11: =R[-1]C-R[-2]C4*R[-2]C -> 0 | N11: =R[-1]C-R[-2]C4*R[-2]C -> 0 | O11: =R[-1]C-R[-2]C4*R[-2]C -> 0 | P11: =R[-1]C-R[-2]C4*R[-2]C -> 0 | Q11: =R[-1]C-R[-2]C4*R[-2]C -> 0 | R11: =R[-1]C-R[-2]C4*R[-2]C -> 0 | S11: =R[-1]C-R[-2]C4*R[-2]C -> 0 | T11: =R[-1]C-R[-2]C4*R[-2]C -> 0 | U11: =R[-1]C-R[-2]C4*R[-2]C -> 0 | V11: =R[-1]C-R[-2]C4*R[-2]C -> 0 | W11: =R[-1]C-R[-2]C4*R[-2]C -> 0 | X11: =R[-1]C-R[-2]C4*R[-2]C -> 0 | Y11: =R[-1]C-R[-2]C4*R[-2]C -> 0 | Z11: =R[-1]C-R[-2]C4*R[-2]C -> 0 | AA11: =R[-1]C-R[-2]C4*R[-2]C -> 0 | AB11: =R[-1]C-R[-2]C4*R[-2]C -> 0 | AC11: =R[-1]C-R[-2]C4*R[-2]C -> 0 | AD11: =R[-1]C-R[-2]C4*R[-2]C -> 0 | AE11: =R[-1]C-R[-2]C4*R[-2]C -> 0 | AF11: =R[-1]C-R[-2]C4*R[-2]C -> 0 | AG11: =R[-1]C-R[-2]C4*R[-2]C -> 0 | AH11: =R[-1]C-R[-2]C4*R[-2]C -> 0 | AI11: =R[-1]C-R[-2]C4*R[-2]C -> 0 | AJ11: =R[-1]C-R[-2]C4*R[-2]C -> 0 | AK11: =R[-1]C-R[-2]C4*R[-2]C -> 0 | AL11: =R[-1]C-R[-2]C4*R[-2]C -> 0 | AM11: =R[-1]C-R[-2]C4*R[-2]C -> 0 | AN11: =R[-1]C-R[-2]C4*R[-2]C -> 0 | AO11: =R[-1]C-R[-2]C4*R[-2]C -> 0 | AP11: =R[-1]C-R[-2]C4*R[-2]C -> 0 | AQ11: =R[-1]C-R[-2]C4*R[-2]C -> -650 | AR11: =R[-1]C-R[-2]C4*R[-2]C -> 0 | AS11: =R[-1]C-R[-2]C4*R[-2]C -> 0 | AT11: =R[-1]C-R[-2]C4*R[-2]C -> 0 | AU11: =R[-1]C-R[-2]C4*R[-2]C -> 0 | AV11: =R[-1]C-R[-2]C4*R[-2]C -> 0 | AW11: =R[-1]C-R[-2]C4*R[-2]C -> 0 | AX11: =R[-1]C-R[-2]C4*R[-2]C -> 0 | AY11: =R[-1]C-R[-2]C4*R[-2]C -> 0 | AZ11: =R[-1]C-R[-2]C4*R[-2]C -> 0 | BA11: =R[-1]C-R[-2]C4*R[-2]C -> 0 | BB11: =R[-1]C-R[-2]C4*R[-2]C -> 0 | BC11: =R[-1]C-R[-2]C4*R[-2]C -> 0 | BD11: =R[-1]C-R[-2]C4*R[-2]C -> 0 | BE11: =R[-1]C-R[-2]C4*R[-2]C -> 0 | BF11: =R[-1]C-R[-2]C4*R[-2]C -> 0 | BG11: =R[-1]C-R[-2]C4*R[-2]C -> -8450 | BO11: =SUM(RC[-61]:RC[-8]) -> -10400
A12: DB2 for OS/390 Application Performance and Tuning | B12: 2002-01-14T00:00:00.000 | C12: 5 | D12: 2725 | E12: 942 | F12: 0 | G12: 0 | H12: 0 | I12: 0 | J12: 0 | K12: 3 | L12: 0 | M12: 0 | N12: 0 | O12: 0 | P12: 0 | Q12: 0 | R12: 0 | S12: 0 | T12: 0 | U12: 0 | V12: 0 | W12: 0 | X12: 0 | Y12: 0 | Z12: 0 | AA12: 0 | AB12: 0 | AC12: 0 | AD12: 0 | AE12: 0 | AF12: 0 | AG12: 0 | AH12: 0 | AI12: 0 | AJ12: 1 | AK12: 0 | AL12: 0 | AM12: 0 | AN12: 0 | AO12: 0 | AP12: 0 | AQ12: 0 | AR12: 0 | AS12: 0 | AT12: 0 | AU12: 0 | AV12: 0 | AW12: 0 | AX12: 0 | AY12: 0 | AZ12: 0 | BA12: 0 | BB12: 2 | BC12: 0 | BD12: 0 | BE12: 0 | BF12: 0 | BG12: 8 | BK12: =SUM(RC[-57]:RC[-4]) -> 14 | BL12: =RC[-61]*RC[-1] -> 70
D13: Total | F13: =R[-1]C*R12C5 -> 0 | G13: =R[-1]C*R12C5 -> 0 | H13: =R[-1]C*R12C5 -> 0 | I13: =R[-1]C*R12C5 -> 0 | J13: =R[-1]C*R12C5 -> 0 | K13: =R[-1]C*R12C5 -> 2826 | L13: =R[-1]C*R12C5 -> 0 | M13: =R[-1]C*R12C5 -> 0 | N13: =R[-1]C*R12C5 -> 0 | O13: =R[-1]C*R12C5 -> 0 | P13: =R[-1]C*R12C5 -> 0 | Q13: =R[-1]C*R12C5 -> 0 | R13: =R[-1]C*R12C5 -> 0 | S13: =R[-1]C*R12C5 -> 0 | T13: =R[-1]C*R12C5 -> 0 | U13: =R[-1]C*R12C5 -> 0 | V13: =R[-1]C*R12C5 -> 0 | W13: =R[-1]C*R12C5 -> 0 | X13: =R[-1]C*R12C5 -> 0 | Y13: =R[-1]C*R12C5 -> 0 | Z13: =R[-1]C*R12C5 -> 0 | AA13: =R[-1]C*R12C5 -> 0 | AB13: =R[-1]C*R12C5 -> 0 | AC13: =R[-1]C*R12C5 -> 0 | AD13: =R[-1]C*R12C5 -> 0 | AE13: =R[-1]C*R12C5 -> 0 | AF13: =R[-1]C*R12C5 -> 0 | AG13: =R[-1]C*R12C5 -> 0 | AH13: =R[-1]C*R12C5 -> 0 | AI13: =R[-1]C*R12C5 -> 0 | AJ13: =R[-1]C*R12C5 -> 942 | AK13: =R[-1]C*R12C5 -> 0 | AL13: =R[-1]C*R12C5 -> 0 | AM13: =R[-1]C*R12C5 -> 0 | AN13: =R[-1]C*R12C5 -> 0 | AO13: =R[-1]C*R12C5 -> 0 | AP13: =R[-1]C*R12C5 -> 0 | AQ13: =R[-1]C*R12C5 -> 0 | AR13: =R[-1]C*R12C5 -> 0 | AS13: =R[-1]C*R12C5 -> 0 | AT13: =R[-1]C*R12C5 -> 0 | AU13: =R[-1]C*R12C5 -> 0 | AV13: =R[-1]C*R12C5 -> 0 | AW13: =R[-1]C*R12C5 -> 0 | AX13: =R[-1]C*R12C5 -> 0 | AY13: =R[-1]C*R12C5 -> 0 | AZ13: =R[-1]C*R12C5 -> 0 | BA13: =R[-1]C*R12C5 -> 0 | BB13: =R[-1]C*R12C5 -> 1884 | BC13: =R[-1]C*R12C5 -> 0 | BD13: =R[-1]C*R12C5 -> 0 | BE13: =R[-1]C*R12C5 -> 0 | BF13: =R[-1]C*R12C5 -> 0 | BG13: =R[-1]C*R12C5 -> 7536 | BM13: =R[-1]C[-61]*R[-1]C[-2] -> 38150 | BN13: =RC[-1]-RC[1] -> 24962 | BO13: =SUM(RC[-61]:RC[-8]) -> 13188
D14: Total Savings | F14: =R[-1]C-R[-2]C4*R[-2]C -> 0 | G14: =R[-1]C-R[-2]C4*R[-2]C -> 0 | H14: =R[-1]C-R[-2]C4*R[-2]C -> 0 | I14: =R[-1]C-R[-2]C4*R[-2]C -> 0 | J14: =R[-1]C-R[-2]C4*R[-2]C -> 0 | K14: =R[-1]C-R[-2]C4*R[-2]C -> -5349 | L14: =R[-1]C-R[-2]C4*R[-2]C -> 0 | M14: =R[-1]C-R[-2]C4*R[-2]C -> 0 | N14: =R[-1]C-R[-2]C4*R[-2]C -> 0 | O14: =R[-1]C-R[-2]C4*R[-2]C -> 0 | P14: =R[-1]C-R[-2]C4*R[-2]C -> 0 | Q14: =R[-1]C-R[-2]C4*R[-2]C -> 0 | R14: =R[-1]C-R[-2]C4*R[-2]C -> 0 | S14: =R[-1]C-R[-2]C4*R[-2]C -> 0 | T14: =R[-1]C-R[-2]C4*R[-2]C -> 0 | U14: =R[-1]C-R[-2]C4*R[-2]C -> 0 | V14: =R[-1]C-R[-2]C4*R[-2]C -> 0 | W14: =R[-1]C-R[-2]C4*R[-2]C -> 0 | X14: =R[-1]C-R[-2]C4*R[-2]C -> 0 | Y14: =R[-1]C-R[-2]C4*R[-2]C -> 0 | Z14: =R[-1]C-R[-2]C4*R[-2]C -> 0 | AA14: =R[-1]C-R[-2]C4*R[-2]C -> 0 | AB14: =R[-1]C-R[-2]C4*R[-2]C -> 0 | AC14: =R[-1]C-R[-2]C4*R[-2]C -> 0 | AD14: =R[-1]C-R[-2]C4*R[-2]C -> 0 | AE14: =R[-1]C-R[-2]C4*R[-2]C -> 0 | AF14: =R[-1]C-R[-2]C4*R[-2]C -> 0 | AG14: =R[-1]C-R[-2]C4*R[-2]C -> 0 | AH14: =R[-1]C-R[-2]C4*R[-2]C -> 0 | AI14: =R[-1]C-R[-2]C4*R[-2]C -> 0 | AJ14: =R[-1]C-R[-2]C4*R[-2]C -> -1783 | AK14: =R[-1]C-R[-2]C4*R[-2]C -> 0 | AL14: =R[-1]C-R[-2]C4*R[-2]C -> 0 | AM14: =R[-1]C-R[-2]C4*R[-2]C -> 0 | AN14: =R[-1]C-R[-2]C4*R[-2]C -> 0 | AO14: =R[-1]C-R[-2]C4*R[-2]C -> 0 | AP14: =R[-1]C-R[-2]C4*R[-2]C -> 0 | AQ14: =R[-1]C-R[-2]C4*R[-2]C -> 0 | AR14: =R[-1]C-R[-2]C4*R[-2]C -> 0 | AS14: =R[-1]C-R[-2]C4*R[-2]C -> 0 | AT14: =R[-1]C-R[-2]C4*R[-2]C -> 0 | AU14: =R[-1]C-R[-2]C4*R[-2]C -> 0 | AV14: =R[-1]C-R[-2]C4*R[-2]C -> 0 | AW14: =R[-1]C-R[-2]C4*R[-2]C -> 0 | AX14: =R[-1]C-R[-2]C4*R[-2]C -> 0 | AY14: =R[-1]C-R[-2]C4*R[-2]C -> 0 | AZ14: =R[-1]C-R[-2]C4*R[-2]C -> 0 | BA14: =R[-1]C-R[-2]C4*R[-2]C -> 0 | BB14: =R[-1]C-R[-2]C4*R[-2]C -> -3566 | BC14: =R[-1]C-R[-2]C4*R[-2]C -> 0 | BD14: =R[-1]C-R[-2]C4*R[-2]C -> 0 | BE14: =R[-1]C-R[-2]C4*R[-2]C -> 0 | BF14: =R[-1]C-R[-2]C4*R[-2]C -> 0 | BG14: =R[-1]C-R[-2]C4*R[-2]C -> -14264 | BO14: =SUM(RC[-61]:RC[-8]) -> -24962
A15: Survival Skills for Analysts | B15: 2002-01-16T00:00:00.000 | C15: 2 | D15: 1175 | E15: 525 | F15: 0 | G15: 0 | H15: 0 | I15: 0 | J15: 0 | K15: 1 | L15: 0 | M15: 0 | N15: 0 | O15: 0 | P15: 0 | Q15: 0 | R15: 0 | S15: 0 | T15: 0 | U15: 0 | V15: 0 | W15: 0 | X15: 0 | Y15: 0 | Z15: 0 | AA15: 0 | AB15: 0 | AC15: 0 | AD15: 1 | AE15: 0 | AF15: 0 | AG15: 0 | AH15: 0 | AI15: 0 | AJ15: 0 | AK15: 0 | AL15: 0 | AM15: 1 | AN15: 0 | AO15: 0 | AP15: 0 | AQ15: 1 | AR15: 0 | AS15: 0 | AT15: 0 | AU15: 0 | AV15: 0 | AW15: 0 | AX15: 0 | AY15: 0 | AZ15: 0 | BA15: 0 | BB15: 0 | BC15: 0 | BD15: 0 | BE15: 0 | BF15: 0 | BG15: 11 | BK15: =SUM(RC[-57]:RC[-4]) -> 15 | BL15: =RC[-61]*RC[-1] -> 30
D16: Total | F16: =R[-1]C*R15C5 -> 0 | G16: =R[-1]C*R15C5 -> 0 | H16: =R[-1]C*R15C5 -> 0 | I16: =R[-1]C*R15C5 -> 0 | J16: =R[-1]C*R15C5 -> 0 | K16: =R[-1]C*R15C5 -> 525 | L16: =R[-1]C*R15C5 -> 0 | M16: =R[-1]C*R15C5 -> 0 | N16: =R[-1]C*R15C5 -> 0 | O16: =R[-1]C*R15C5 -> 0 | P16: =R[-1]C*R15C5 -> 0 | Q16: =R[-1]C*R15C5 -> 0 | R16: =R[-1]C*R15C5 -> 0 | S16: =R[-1]C*R15C5 -> 0 | T16: =R[-1]C*R15C5 -> 0 | U16: =R[-1]C*R15C5 -> 0 | V16: =R[-1]C*R15C5 -> 0 | W16: =R[-1]C*R15C5 -> 0 | X16: =R[-1]C*R15C5 -> 0 | Y16: =R[-1]C*R15C5 -> 0 | Z16: =R[-1]C*R15C5 -> 0 | AA16: =R[-1]C*R15C5 -> 0 | AB16: =R[-1]C*R15C5 -> 0 | AC16: =R[-1]C*R15C5 -> 0 | AD16: =R[-1]C*R15C5 -> 525 | AE16: =R[-1]C*R15C5 -> 0 | AF16: =R[-1]C*R15C5 -> 0 | AG16: =R[-1]C*R15C5 -> 0 | AH16: =R[-1]C*R15C5 -> 0 | AI16: =R[-1]C*R15C5 -> 0 | AJ16: =R[-1]C*R15C5 -> 0 | AK16: =R[-1]C*R15C5 -> 0 | AL16: =R[-1]C*R15C5 -> 0 | AM16: =R[-1]C*R15C5 -> 525 | AN16: =R[-1]C*R15C5 -> 0 | AO16: =R[-1]C*R15C5 -> 0 | AP16: =R[-1]C*R15C5 -> 0 | AQ16: =R[-1]C*R15C5 -> 525 | AR16: =R[-1]C*R15C5 -> 0 | AS16: =R[-1]C*R15C5 -> 0 | AT16: =R[-1]C*R15C5 -> 0 | AU16: =R[-1]C*R15C5 -> 0 | AV16: =R[-1]C*R15C5 -> 0 | AW16: =R[-1]C*R15C5 -> 0 | AX16: =R[-1]C*R15C5 -> 0 | AY16: =R[-1]C*R15C5 -> 0 | AZ16: =R[-1]C*R15C5 -> 0 | BA16: =R[-1]C*R15C5 -> 0 | BB16: =R[-1]C*R15C5 -> 0 | BC16: =R[-1]C*R15C5 -> 0 | BD16: =R[-1]C*R15C5 -> 0 | BE16: =R[-1]C*R15C5 -> 0 | BF16: =R[-1]C*R15C5 -> 0 | BG16: =R[-1]C*R15C5 -> 5775 | BM16: =R[-1]C[-61]*R[-1]C[-2] -> 17625 | BN16: =RC[-1]-RC[1] -> 9750 | BO16: =SUM(RC[-61]:RC[-8]) -> 7875
D17: Total Savings | F17: =R[-1]C-R[-2]C4*R[-2]C -> 0 | G17: =R[-1]C-R[-2]C4*R[-2]C -> 0 | H17: =R[-1]C-R[-2]C4*R[-2]C -> 0 | I17: =R[-1]C-R[-2]C4*R[-2]C -> 0 | J17: =R[-1]C-R[-2]C4*R[-2]C -> 0 | K17: =R[-1]C-R[-2]C4*R[-2]C -> -650 | L17: =R[-1]C-R[-2]C4*R[-2]C -> 0 | M17: =R[-1]C-R[-2]C4*R[-2]C -> 0 | N17: =R[-1]C-R[-2]C4*R[-2]C -> 0 | O17: =R[-1]C-R[-2]C4*R[-2]C -> 0 | P17: =R[-1]C-R[-2]C4*R[-2]C -> 0 | Q17: =R[-1]C-R[-2]C4*R[-2]C -> 0 | R17: =R[-1]C-R[-2]C4*R[-2]C -> 0 | S17: =R[-1]C-R[-2]C4*R[-2]C -> 0 | T17: =R[-1]C-R[-2]C4*R[-2]C -> 0 | U17: =R[-1]C-R[-2]C4*R[-2]C -> 0 | V17: =R[-1]C-R[-2]C4*R[-2]C -> 0 | W17: =R[-1]C-R[-2]C4*R[-2]C -> 0 | X17: =R[-1]C-R[-2]C4*R[-2]C -> 0 | Y17: =R[-1]C-R[-2]C4*R[-2]C -> 0 | Z17: =R[-1]C-R[-2]C4*R[-2]C -> 0 | AA17: =R[-1]C-R[-2]C4*R[-2]C -> 0 | AB17: =R[-1]C-R[-2]C4*R[-2]C -> 0 | AC17: =R[-1]C-R[-2]C4*R[-2]C -> 0 | AD17: =R[-1]C-R[-2]C4*R[-2]C -> -650 | AE17: =R[-1]C-R[-2]C4*R[-2]C -> 0 | AF17: =R[-1]C-R[-2]C4*R[-2]C -> 0 | AG17: =R[-1]C-R[-2]C4*R[-2]C -> 0 | AH17: =R[-1]C-R[-2]C4*R[-2]C -> 0 | AI17: =R[-1]C-R[-2]C4*R[-2]C -> 0 | AJ17: =R[-1]C-R[-2]C4*R[-2]C -> 0 | AK17: =R[-1]C-R[-2]C4*R[-2]C -> 0 | AL17: =R[-1]C-R[-2]C4*R[-2]C -> 0 | AM17: =R[-1]C-R[-2]C4*R[-2]C -> -650 | AN17: =R[-1]C-R[-2]C4*R[-2]C -> 0 | AO17: =R[-1]C-R[-2]C4*R[-2]C -> 0 | AP17: =R[-1]C-R[-2]C4*R[-2]C -> 0 | AQ17: =R[-1]C-R[-2]C4*R[-2]C -> -650 | AR17: =R[-1]C-R[-2]C4*R[-2]C -> 0 | AS17: =R[-1]C-R[-2]C4*R[-2]C -> 0 | AT17: =R[-1]C-R[-2]C4*R[-2]C -> 0 | AU17: =R[-1]C-R[-2]C4*R[-2]C -> 0 | AV17: =R[-1]C-R[-2]C4*R[-2]C -> 0 | AW17: =R[-1]C-R[-2]C4*R[-2]C -> 0 | AX17: =R[-1]C-R[-2]C4*R[-2]C -> 0 | AY17: =R[-1]C-R[-2]C4*R[-2]C -> 0 | AZ17: =R[-1]C-R[-2]C4*R[-2]C -> 0 | BA17: =R[-1]C-R[-2]C4*R[-2]C -> 0 | BB17: =R[-1]C-R[-2]C4*R[-2]C -> 0 | BC17: =R[-1]C-R[-2]C4*R[-2]C -> 0 | BD17: =R[-1]C-R[-2]C4*R[-2]C -> 0 | BE17: =R[-1]C-R[-2]C4*R[-2]C -> 0 | BF17: =R[-1]C-R[-2]C4*R[-2]C -> 0 | BG17: =R[-1]C-R[-2]C4*R[-2]C -> -7150 | BO17: =SUM(RC[-61]:RC[-8]) -> -9750
A18: Mastering Requirements Process | B18: 2002-01-23T00:00:00.000 | C18: 2 | D18: 1150 | E18: 525 | F18: 0 | G18: 0 | H18: 0 | I18: 0 | J18: 0 | K18: 0 | L18: 0 | M18: 0 | N18: 0 | O18: 0 | P18: 0 | Q18: 0 | R18: 0 | S18: 0 | T18: 0 | U18: 0 | V18: 0 | W18: 0 | X18: 0 | Y18: 0 | Z18: 0 | AA18: 0 | AB18: 0 | AC18: 0 | AD18: 9 | AE18: 0 | AF18: 0 | AG18: 0 | AH18: 0 | AI18: 0 | AJ18: 0 | AK18: 0 | AL18: 0 | AM18: 0 | AN18: 0 | AO18: 0 | AP18: 0 | AQ18: 0 | AR18: 0 | AS18: 1 | AT18: 0 | AU18: 0 | AV18: 0 | AW18: 0 | AX18: 0 | AY18: 0 | AZ18: 0 | BA18: 0 | BB18: 0 | BC18: 0 | BD18: 0 | BE18: 1 | BF18: 0 | BG18: 0 | BK18: =SUM(RC[-57]:RC[-4]) -> 11 | BL18: =RC[-61]*RC[-1] -> 22
D19: Total | F19: =R[-1]C*R18C5 -> 0 | G19: =R[-1]C*R18C5 -> 0 | H19: =R[-1]C*R18C5 -> 0 | I19: =R[-1]C*R18C5 -> 0 | J19: =R[-1]C*R18C5 -> 0 | K19: =R[-1]C*R18C5 -> 0 | L19: =R[-1]C*R18C5 -> 0 | M19: =R[-1]C*R18C5 -> 0 | N19: =R[-1]C*R18C5 -> 0 | O19: =R[-1]C*R18C5 -> 0 | P19: =R[-1]C*R18C5 -> 0 | Q19: =R[-1]C*R18C5 -> 0 | R19: =R[-1]C*R18C5 -> 0 | S19: =R[-1]C*R18C5 -> 0 | T19: =R[-1]C*R18C5 -> 0 | U19: =R[-1]C*R18C5 -> 0 | V19: =R[-1]C*R18C5 -> 0 | W19: =R[-1]C*R18C5 -> 0 | X19: =R[-1]C*R18C5 -> 0 | Y19: =R[-1]C*R18C5 -> 0 | Z19: =R[-1]C*R18C5 -> 0 | AA19: =R[-1]C*R18C5 -> 0 | AB19: =R[-1]C*R18C5 -> 0 | AC19: =R[-1]C*R18C5 -> 0 | AD19: =R[-1]C*R18C5 -> 4725 | AE19: =R[-1]C*R18C5 -> 0 | AF19: =R[-1]C*R18C5 -> 0 | AG19: =R[-1]C*R18C5 -> 0 | AH19: =R[-1]C*R18C5 -> 0 | AI19: =R[-1]C*R18C5 -> 0 | AJ19: =R[-1]C*R18C5 -> 0 | AK19: =R[-1]C*R18C5 -> 0 | AL19: =R[-1]C*R18C5 -> 0 | AM19: =R[-1]C*R18C5 -> 0 | AN19: =R[-1]C*R18C5 -> 0 | AO19: =R[-1]C*R18C5 -> 0 | AP19: =R[-1]C*R18C5 -> 0 | AQ19: =R[-1]C*R18C5 -> 0 | AR19: =R[-1]C*R18C5 -> 0 | AS19: =R[-1]C*R18C5 -> 525 | AT19: =R[-1]C*R18C5 -> 0 | AU19: =R[-1]C*R18C5 -> 0 | AV19: =R[-1]C*R18C5 -> 0 | AW19: =R[-1]C*R18C5 -> 0 | AX19: =R[-1]C*R18C5 -> 0 | AY19: =R[-1]C*R18C5 -> 0 | AZ19: =R[-1]C*R18C5 -> 0 | BA19: =R[-1]C*R18C5 -> 0 | BB19: =R[-1]C*R18C5 -> 0 | BC19: =R[-1]C*R18C5 -> 0 | BD19: =R[-1]C*R18C5 -> 0 | BE19: =R[-1]C*R18C5 -> 525 | BF19: =R[-1]C*R18C5 -> 0 | BG19: =R[-1]C*R18C5 -> 0 | BM19: =R[-1]C[-61]*R[-1]C[-2] -> 12650 | BN19: =RC[-1]-RC[1] -> 6875 | BO19: =SUM(RC[-61]:RC[-8]) -> 5775
D20: Total Savings | F20: =R[-1]C-R[-2]C4*R[-2]C -> 0 | G20: =R[-1]C-R[-2]C4*R[-2]C -> 0 | H20: =R[-1]C-R[-2]C4*R[-2]C -> 0 | I20: =R[-1]C-R[-2]C4*R[-2]C -> 0 | J20: =R[-1]C-R[-2]C4*R[-2]C -> 0 | K20: =R[-1]C-R[-2]C4*R[-2]C -> 0 | L20: =R[-1]C-R[-2]C4*R[-2]C -> 0 | M20: =R[-1]C-R[-2]C4*R[-2]C -> 0 | N20: =R[-1]C-R[-2]C4*R[-2]C -> 0 | O20: =R[-1]C-R[-2]C4*R[-2]C -> 0 | P20: =R[-1]C-R[-2]C4*R[-2]C -> 0 | Q20: =R[-1]C-R[-2]C4*R[-2]C -> 0 | R20: =R[-1]C-R[-2]C4*R[-2]C -> 0 | S20: =R[-1]C-R[-2]C4*R[-2]C -> 0 | T20: =R[-1]C-R[-2]C4*R[-2]C -> 0 | U20: =R[-1]C-R[-2]C4*R[-2]C -> 0 | V20: =R[-1]C-R[-2]C4*R[-2]C -> 0 | W20: =R[-1]C-R[-2]C4*R[-2]C -> 0 | X20: =R[-1]C-R[-2]C4*R[-2]C -> 0 | Y20: =R[-1]C-R[-2]C4*R[-2]C -> 0 | Z20: =R[-1]C-R[-2]C4*R[-2]C -> 0 | AA20: =R[-1]C-R[-2]C4*R[-2]C -> 0 | AB20: =R[-1]C-R[-2]C4*R[-2]C -> 0 | AC20: =R[-1]C-R[-2]C4*R[-2]C -> 0 | AD20: =R[-1]C-R[-2]C4*R[-2]C -> -5625 | AE20: =R[-1]C-R[-2]C4*R[-2]C -> 0 | AF20: =R[-1]C-R[-2]C4*R[-2]C -> 0 | AG20: =R[-1]C-R[-2]C4*R[-2]C -> 0 | AH20: =R[-1]C-R[-2]C4*R[-2]C -> 0 | AI20: =R[-1]C-R[-2]C4*R[-2]C -> 0 | AJ20: =R[-1]C-R[-2]C4*R[-2]C -> 0 | AK20: =R[-1]C-R[-2]C4*R[-2]C -> 0 | AL20: =R[-1]C-R[-2]C4*R[-2]C -> 0 | AM20: =R[-1]C-R[-2]C4*R[-2]C -> 0 | AN20: =R[-1]C-R[-2]C4*R[-2]C -> 0 | AO20: =R[-1]C-R[-2]C4*R[-2]C -> 0 | AP20: =R[-1]C-R[-2]C4*R[-2]C -> 0 | AQ20: =R[-1]C-R[-2]C4*R[-2]C -> 0 | AR20: =R[-1]C-R[-2]C4*R[-2]C -> 0 | AS20: =R[-1]C-R[-2]C4*R[-2]C -> -625 | AT20: =R[-1]C-R[-2]C4*R[-2]C -> 0 | AU20: =R[-1]C-R[-2]C4*R[-2]C -> 0 | AV20: =R[-1]C-R[-2]C4*R[-2]C -> 0 | AW20: =R[-1]C-R[-2]C4*R[-2]C -> 0 | AX20: =R[-1]C-R[-2]C4*R[-2]C -> 0 | AY20: =R[-1]C-R[-2]C4*R[-2]C -> 0 | AZ20: =R[-1]C-R[-2]C4*R[-2]C -> 0 | BA20: =R[-1]C-R[-2]C4*R[-2]C -> 0 | BB20: =R[-1]C-R[-2]C4*R[-2]C -> 0 | BC20: =R[-1]C-R[-2]C4*R[-2]C -> 0 | BD20: =R[-1]C-R[-2]C4*R[-2]C -> 0 | BE20: =R[-1]C-R[-2]C4*R[-2]C -> -625 | BF20: =R[-1]C-R[-2]C4*R[-2]C -> 0 | BG20: =R[-1]C-R[-2]C4*R[-2]C -> 0 | BO20: =SUM(RC[-61]:RC[-8]) -> -6875
A21: VB 6.0 Introduction | B21: 2002-01-28T00:00:00.000 | C21: 3 | D21: 1500 | E21: 525 | F21: 1 | G21: 0 | H21: 2 | I21: 0 | J21: 1 | K21: 0 | L21: 0 | M21: 0 | N21: 0 | O21: 0 | P21: 0 | Q21: 0 | R21: 0 | S21: 0 | T21: 0 | U21: 0 | V21: 0 | W21: 0 | X21: 0 | Y21: 0 | Z21: 0 | AA21: 0 | AB21: 3 | AC21: 0 | AD21: 0 | AE21: 0 | AF21: 0 | AG21: 0 | AH21: 0 | AI21: 0 | AJ21: 0 | AK21: 0 | AL21: 0 | AM21: 0 | AN21: 0 | AO21: 0 | AP21: 0 | AQ21: 0 | AR21: 0 | AS21: 0 | AT21: 0 | AU21: 0 | AV21: 0 | AW21: 0 | AX21: 0 | AY21: 0 | AZ21: 0 | BA21: 0 | BB21: 0 | BC21: 0 | BD21: 0 | BE21: 0 | BF21: 0 | BG21: 0 | BK21: =SUM(RC[-57]:RC[-4]) -> 7 | BL21: =RC[-61]*RC[-1] -> 21
D22: Total | F22: =R[-1]C*R21C5 -> 525 | G22: =R[-1]C*R21C5 -> 0 | H22: =R[-1]C*R21C5 -> 1050 | I22: =R[-1]C*R21C5 -> 0 | J22: =R[-1]C*R21C5 -> 525 | K22: =R[-1]C*R21C5 -> 0 | L22: =R[-1]C*R21C5 -> 0 | M22: =R[-1]C*R21C5 -> 0 | N22: =R[-1]C*R21C5 -> 0 | O22: =R[-1]C*R21C5 -> 0 | P22: =R[-1]C*R21C5 -> 0 | Q22: =R[-1]C*R21C5 -> 0 | R22: =R[-1]C*R21C5 -> 0 | S22: =R[-1]C*R21C5 -> 0 | T22: =R[-1]C*R21C5 -> 0 | U22: =R[-1]C*R21C5 -> 0 | V22: =R[-1]C*R21C5 -> 0 | W22: =R[-1]C*R21C5 -> 0 | X22: =R[-1]C*R21C5 -> 0 | Y22: =R[-1]C*R21C5 -> 0 | Z22: =R[-1]C*R21C5 -> 0 | AA22: =R[-1]C*R21C5 -> 0 | AB22: =R[-1]C*R21C5 -> 1575 | AC22: =R[-1]C*R21C5 -> 0 | AD22: =R[-1]C*R21C5 -> 0 | AE22: =R[-1]C*R21C5 -> 0 | AF22: =R[-1]C*R21C5 -> 0 | AG22: =R[-1]C*R21C5 -> 0 | AH22: =R[-1]C*R21C5 -> 0 | AI22: =R[-1]C*R21C5 -> 0 | AJ22: =R[-1]C*R21C5 -> 0 | AK22: =R[-1]C*R21C5 -> 0 | AL22: =R[-1]C*R21C5 -> 0 | AM22: =R[-1]C*R21C5 -> 0 | AN22: =R[-1]C*R21C5 -> 0 | AO22: =R[-1]C*R21C5 -> 0 | AP22: =R[-1]C*R21C5 -> 0 | AQ22: =R[-1]C*R21C5 -> 0 | AR22: =R[-1]C*R21C5 -> 0 | AS22: =R[-1]C*R21C5 -> 0 | AT22: =R[-1]C*R21C5 -> 0 | AU22: =R[-1]C*R21C5 -> 0 | AV22: =R[-1]C*R21C5 -> 0 | AW22: =R[-1]C*R21C5 -> 0 | AX22: =R[-1]C*R21C5 -> 0 | AY22: =R[-1]C*R21C5 -> 0 | AZ22: =R[-1]C*R21C5 -> 0 | BA22: =R[-1]C*R21C5 -> 0 | BB22: =R[-1]C*R21C5 -> 0 | BC22: =R[-1]C*R21C5 -> 0 | BD22: =R[-1]C*R21C5 -> 0 | BE22: =R[-1]C*R21C5 -> 0 | BF22: =R[-1]C*R21C5 -> 0 | BG22: =R[-1]C*R21C5 -> 0 | BM22: =R[-1]C[-61]*R[-1]C[-2] -> 10500 | BN22: =RC[-1]-RC[1] -> 6825 | BO22: =SUM(RC[-61]:RC[-8]) -> 3675
D23: Total Savings | F23: =R[-1]C-R[-2]C4*R[-2]C -> -975 | G23: =R[-1]C-R[-2]C4*R[-2]C -> 0 | H23: =R[-1]C-R[-2]C4*R[-2]C -> -1950 | I23: =R[-1]C-R[-2]C4*R[-2]C -> 0 | J23: =R[-1]C-R[-2]C4*R[-2]C -> -975 | K23: =R[-1]C-R[-2]C4*R[-2]C -> 0 | L23: =R[-1]C-R[-2]C4*R[-2]C -> 0 | M23: =R[-1]C-R[-2]C4*R[-2]C -> 0 | N23: =R[-1]C-R[-2]C4*R[-2]C -> 0 | O23: =R[-1]C-R[-2]C4*R[-2]C -> 0 | P23: =R[-1]C-R[-2]C4*R[-2]C -> 0 | Q23: =R[-1]C-R[-2]C4*R[-2]C -> 0 | R23: =R[-1]C-R[-2]C4*R[-2]C -> 0 | S23: =R[-1]C-R[-2]C4*R[-2]C -> 0 | T23: =R[-1]C-R[-2]C4*R[-2]C -> 0 | U23: =R[-1]C-R[-2]C4*R[-2]C -> 0 | V23: =R[-1]C-R[-2]C4*R[-2]C -> 0 | W23: =R[-1]C-R[-2]C4*R[-2]C -> 0 | X23: =R[-1]C-R[-2]C4*R[-2]C -> 0 | Y23: =R[-1]C-R[-2]C4*R[-2]C -> 0 | Z23: =R[-1]C-R[-2]C4*R[-2]C -> 0 | AA23: =R[-1]C-R[-2]C4*R[-2]C -> 0 | AB23: =R[-1]C-R[-2]C4*R[-2]C -> -2925 | AC23: =R[-1]C-R[-2]C4*R[-2]C -> 0 | AD23: =R[-1]C-R[-2]C4*R[-2]C -> 0 | AE23: =R[-1]C-R[-2]C4*R[-2]C -> 0 | AF23: =R[-1]C-R[-2]C4*R[-2]C -> 0 | AG23: =R[-1]C-R[-2]C4*R[-2]C -> 0 | AH23: =R[-1]C-R[-2]C4*R[-2]C -> 0 | AI23: =R[-1]C-R[-2]C4*R[-2]C -> 0 | AJ23: =R[-1]C-R[-2]C4*R[-2]C -> 0 | AK23: =R[-1]C-R[-2]C4*R[-2]C -> 0 | AL23: =R[-1]C-R[-2]C4*R[-2]C -> 0 | AM23: =R[-1]C-R[-2]C4*R[-2]C -> 0 | AN23: =R[-1]C-R[-2]C4*R[-2]C -> 0 | AO23: =R[-1]C-R[-2]C4*R[-2]C -> 0 | AP23: =R[-1]C-R[-2]C4*R[-2]C -> 0 | AQ23: =R[-1]C-R[-2]C4*R[-2]C -> 0 | AR23: =R[-1]C-R[-2]C4*R[-2]C -> 0 | AS23: =R[-1]C-R[-2]C4*R[-2]C -> 0 | AT23: =R[-1]C-R[-2]C4*R[-2]C -> 0 | AU23: =R[-1]C-R[-2]C4*R[-2]C -> 0 | AV23: =R[-1]C-R[-2]C4*R[-2]C -> 0 | AW23: =R[-1]C-R[-2]C4*R[-2]C -> 0 | AX23: =R[-1]C-R[-2]C4*R[-2]C -> 0 | AY23: =R[-1]C-R[-2]C4*R[-2]C -> 0 | AZ23: =R[-1]C-R[-2]C4*R[-2]C -> 0 | BA23: =R[-1]C-R[-2]C4*R[-2]C -> 0 | BB23: =R[-1]C-R[-2]C4*R[-2]C -> 0 | BC23: =R[-1]C-R[-2]C4*R[-2]C -> 0 | BD23: =R[-1]C-R[-2]C4*R[-2]C -> 0 | BE23: =R[-1]C-R[-2]C4*R[-2]C -> 0 | BF23: =R[-1]C-R[-2]C4*R[-2]C -> 0 | BG23: =R[-1]C-R[-2]C4*R[-2]C -> 0 | BO23: =SUM(RC[-61]:RC[-8]) -> -6825
A24: Mastering the Requirements Process | B24: 2002-01-29T00:00:00.000 | C24: 2 | D24: 1175 | E24: 525 | F24: 0 | G24: 0 | H24: 0 | I24: 0 | J24: 0 | K24: 0 | L24: 0 | M24: 0 | N24: 0 | O24: 0 | P24: 0 | Q24: 0 | R24: 0 | S24: 0 | T24: 0 | U24: 0 | V24: 0 | W24: 0 | X24: 0 | Y24: 14 | Z24: 0 | AA24: 0 | AB24: 0 | AC24: 0 | AD24: 0 | AE24: 0 | AF24: 0 | AG24: 0 | AH24: 0 | AI24: 0 | AJ24: 0 | AK24: 0 | AL24: 0 | AM24: 0 | AN24: 0 | AO24: 0 | AP24: 0 | AQ24: 0 | AR24: 0 | AS24: 0 | AT24: 0 | AU24: 0 | AV24: 0 | AW24: 0 | AX24: 0 | AY24: 0 | AZ24: 0 | BA24: 0 | BB24: 0 | BC24: 0 | BD24: 0 | BE24: 0 | BF24: 0 | BG24: 0 | BK24: =SUM(RC[-57]:RC[-4]) -> 14 | BL24: =RC[-61]*RC[-1] -> 28
D25: Total | F25: =R[-1]C*R24C5 -> 0 | G25: =R[-1]C*R24C5 -> 0 | H25: =R[-1]C*R24C5 -> 0 | I25: =R[-1]C*R24C5 -> 0 | J25: =R[-1]C*R24C5 -> 0 | K25: =R[-1]C*R24C5 -> 0 | L25: =R[-1]C*R24C5 -> 0 | M25: =R[-1]C*R24C5 -> 0 | N25: =R[-1]C*R24C5 -> 0 | O25: =R[-1]C*R24C5 -> 0 | P25: =R[-1]C*R24C5 -> 0 | Q25: =R[-1]C*R24C5 -> 0 | R25: =R[-1]C*R24C5 -> 0 | S25: =R[-1]C*R24C5 -> 0 | T25: =R[-1]C*R24C5 -> 0 | U25: =R[-1]C*R24C5 -> 0 | V25: =R[-1]C*R24C5 -> 0 | W25: =R[-1]C*R24C5 -> 0 | X25: =R[-1]C*R24C5 -> 0 | Y25: =R[-1]C*R24C5 -> 7350 | Z25: =R[-1]C*R24C5 -> 0 | AA25: =R[-1]C*R24C5 -> 0 | AB25: =R[-1]C*R24C5 -> 0 | AC25: =R[-1]C*R24C5 -> 0 | AD25: =R[-1]C*R24C5 -> 0 | AE25: =R[-1]C*R24C5 -> 0 | AF25: =R[-1]C*R24C5 -> 0 | AG25: =R[-1]C*R24C5 -> 0 | AH25: =R[-1]C*R24C5 -> 0 | AI25: =R[-1]C*R24C5 -> 0 | AJ25: =R[-1]C*R24C5 -> 0 | AK25: =R[-1]C*R24C5 -> 0 | AL25: =R[-1]C*R24C5 -> 0 | AM25: =R[-1]C*R24C5 -> 0 | AN25: =R[-1]C*R24C5 -> 0 | AO25: =R[-1]C*R24C5 -> 0 | AP25: =R[-1]C*R24C5 -> 0 | AQ25: =R[-1]C*R24C5 -> 0 | AR25: =R[-1]C*R24C5 -> 0 | AS25: =R[-1]C*R24C5 -> 0 | AT25: =R[-1]C*R24C5 -> 0 | AU25: =R[-1]C*R24C5 -> 0 | AV25: =R[-1]C*R24C5 -> 0 | AW25: =R[-1]C*R24C5 -> 0 | AX25: =R[-1]C*R24C5 -> 0 | AY25: =R[-1]C*R24C5 -> 0 | AZ25: =R[-1]C*R24C5 -> 0 | BA25: =R[-1]C*R24C5 -> 0 | BB25: =R[-1]C*R24C5 -> 0 | BC25: =R[-1]C*R24C5 -> 0 | BD25: =R[-1]C*R24C5 -> 0 | BE25: =R[-1]C*R24C5 -> 0 | BF25: =R[-1]C*R24C5 -> 0 | BG25: =R[-1]C*R24C5 -> 0 | BM25: =R[-1]C[-61]*R[-1]C[-2] -> 16450 | BN25: =RC[-1]-RC[1] -> 9100 | BO25: =SUM(RC[-61]:RC[-8]) -> 7350
D26: Total Savings | F26: =R[-1]C-R[-2]C4*R[-2]C -> 0 | G26: =R[-1]C-R[-2]C4*R[-2]C -> 0 | H26: =R[-1]C-R[-2]C4*R[-2]C -> 0 | I26: =R[-1]C-R[-2]C4*R[-2]C -> 0 | J26: =R[-1]C-R[-2]C4*R[-2]C -> 0 | K26: =R[-1]C-R[-2]C4*R[-2]C -> 0 | L26: =R[-1]C-R[-2]C4*R[-2]C -> 0 | M26: =R[-1]C-R[-2]C4*R[-2]C -> 0 | N26: =R[-1]C-R[-2]C4*R[-2]C -> 0 | O26: =R[-1]C-R[-2]C4*R[-2]C -> 0 | P26: =R[-1]C-R[-2]C4*R[-2]C -> 0 | Q26: =R[-1]C-R[-2]C4*R[-2]C -> 0 | R26: =R[-1]C-R[-2]C4*R[-2]C -> 0 | S26: =R[-1]C-R[-2]C4*R[-2]C -> 0 | T26: =R[-1]C-R[-2]C4*R[-2]C -> 0 | U26: =R[-1]C-R[-2]C4*R[-2]C -> 0 | V26: =R[-1]C-R[-2]C4*R[-2]C -> 0 | W26: =R[-1]C-R[-2]C4*R[-2]C -> 0 | X26: =R[-1]C-R[-2]C4*R[-2]C -> 0 | Y26: =R[-1]C-R[-2]C4*R[-2]C -> -9100 | Z26: =R[-1]C-R[-2]C4*R[-2]C -> 0 | AA26: =R[-1]C-R[-2]C4*R[-2]C -> 0 | AB26: =R[-1]C-R[-2]C4*R[-2]C -> 0 | AC26: =R[-1]C-R[-2]C4*R[-2]C -> 0 | AD26: =R[-1]C-R[-2]C4*R[-2]C -> 0 | AE26: =R[-1]C-R[-2]C4*R[-2]C -> 0 | AF26: =R[-1]C-R[-2]C4*R[-2]C -> 0 | AG26: =R[-1]C-R[-2]C4*R[-2]C -> 0 | AH26: =R[-1]C-R[-2]C4*R[-2]C -> 0 | AI26: =R[-1]C-R[-2]C4*R[-2]C -> 0 | AJ26: =R[-1]C-R[-2]C4*R[-2]C -> 0 | AK26: =R[-1]C-R[-2]C4*R[-2]C -> 0 | AL26: =R[-1]C-R[-2]C4*R[-2]C -> 0 | AM26: =R[-1]C-R[-2]C4*R[-2]C -> 0 | AN26: =R[-1]C-R[-2]C4*R[-2]C -> 0 | AO26: =R[-1]C-R[-2]C4*R[-2]C -> 0 | AP26: =R[-1]C-R[-2]C4*R[-2]C -> 0 | AQ26: =R[-1]C-R[-2]C4*R[-2]C -> 0 | AR26: =R[-1]C-R[-2]C4*R[-2]C -> 0 | AS26: =R[-1]C-R[-2]C4*R[-2]C -> 0 | AT26: =R[-1]C-R[-2]C4*R[-2]C -> 0 | AU26: =R[-1]C-R[-2]C4*R[-2]C -> 0 | AV26: =R[-1]C-R[-2]C4*R[-2]C -> 0 | AW26: =R[-1]C-R[-2]C4*R[-2]C -> 0 | AX26: =R[-1]C-R[-2]C4*R[-2]C -> 0 | AY26: =R[-1]C-R[-2]C4*R[-2]C -> 0 | AZ26: =R[-1]C-R[-2]C4*R[-2]C -> 0 | BA26: =R[-1]C-R[-2]C4*R[-2]C -> 0 | BB26: =R[-1]C-R[-2]C4*R[-2]C -> 0 | BC26: =R[-1]C-R[-2]C4*R[-2]C -> 0 | BD26: =R[-1]C-R[-2]C4*R[-2]C -> 0 | BE26: =R[-1]C-R[-2]C4*R[-2]C -> 0 | BF26: =R[-1]C-R[-2]C4*R[-2]C -> 0 | BG26: =R[-1]C-R[-2]C4*R[-2]C -> 0 | BO26: =SUM(RC[-61]:RC[-8]) -> -9100
A27: Introduction to SQL | B27: 2002-01-29T00:00:00.000 | C27: 2 | D27: 1100 | E27: 450 | F27: 0 | G27: 0 | H27: 0 | I27: 0 | J27: 9 | K27: 2 | L27: 6 | M27: 0 | N27: 0 | O27: 0 | P27: 0 | Q27: 0 | R27: 0 | S27: 0 | T27: 0 | U27: 0 | V27: 0 | W27: 0 | X27: 0 | Y27: 0 | Z27: 0 | AA27: 0 | AB27: 0 | AC27: 0 | AD27: 0 | AE27: 0 | AF27: 0 | AG27: 0 | AH27: 0 | AI27: 0 | AJ27: 0 | AK27: 0 | AL27: 0 | AM27: 0 | AN27: 0 | AO27: 0 | AP27: 0 | AQ27: 0 | AR27: 0 | AS27: 0 | AT27: 0 | AU27: 0 | AV27: 0 | AW27: 0 | AX27: 0 | AY27: 0 | AZ27: 0 | BA27: 0 | BB27: 0 | BC27: 0 | BD27: 0 | BE27: 0 | BF27: 0 | BG27: 0 | BK27: =SUM(RC[-57]:RC[-4]) -> 17 | BL27: =RC[-61]*RC[-1] -> 34
D28: Total | F28: =R[-1]C*R27C5 -> 0 | G28: =R[-1]C*R27C5 -> 0 | H28: =R[-1]C*R27C5 -> 0 | I28: =R[-1]C*R27C5 -> 0 | J28: =R[-1]C*R27C5 -> 4050 | K28: =R[-1]C*R27C5 -> 900 | L28: =R[-1]C*R27C5 -> 2700 | M28: =R[-1]C*R27C5 -> 0 | N28: =R[-1]C*R27C5 -> 0 | O28: =R[-1]C*R27C5 -> 0 | P28: =R[-1]C*R27C5 -> 0 | Q28: =R[-1]C*R27C5 -> 0 | R28: =R[-1]C*R27C5 -> 0 | S28: =R[-1]C*R27C5 -> 0 | T28: =R[-1]C*R27C5 -> 0 | U28: =R[-1]C*R27C5 -> 0 | V28: =R[-1]C*R27C5 -> 0 | W28: =R[-1]C*R27C5 -> 0 | X28: =R[-1]C*R27C5 -> 0 | Y28: =R[-1]C*R27C5 -> 0 | Z28: =R[-1]C*R27C5 -> 0 | AA28: =R[-1]C*R27C5 -> 0 | AB28: =R[-1]C*R27C5 -> 0 | AC28: =R[-1]C*R27C5 -> 0 | AD28: =R[-1]C*R27C5 -> 0 | AE28: =R[-1]C*R27C5 -> 0 | AF28: =R[-1]C*R27C5 -> 0 | AG28: =R[-1]C*R27C5 -> 0 | AH28: =R[-1]C*R27C5 -> 0 | AI28: =R[-1]C*R27C5 -> 0 | AJ28: =R[-1]C*R27C5 -> 0 | AK28: =R[-1]C*R27C5 -> 0 | AL28: =R[-1]C*R27C5 -> 0 | AM28: =R[-1]C*R27C5 -> 0 | AN28: =R[-1]C*R27C5 -> 0 | AO28: =R[-1]C*R27C5 -> 0 | AP28: =R[-1]C*R27C5 -> 0 | AQ28: =R[-1]C*R27C5 -> 0 | AR28: =R[-1]C*R27C5 -> 0 | AS28: =R[-1]C*R27C5 -> 0 | AT28: =R[-1]C*R27C5 -> 0 | AU28: =R[-1]C*R27C5 -> 0 | AV28: =R[-1]C*R27C5 -> 0 | AW28: =R[-1]C*R27C5 -> 0 | AX28: =R[-1]C*R27C5 -> 0 | AY28: =R[-1]C*R27C5 -> 0 | AZ28: =R[-1]C*R27C5 -> 0 | BA28: =R[-1]C*R27C5 -> 0 | BB28: =R[-1]C*R27C5 -> 0 | BC28: =R[-1]C*R27C5 -> 0 | BD28: =R[-1]C*R27C5 -> 0 | BE28: =R[-1]C*R27C5 -> 0 | BF28: =R[-1]C*R27C5 -> 0 | BG28: =R[-1]C*R27C5 -> 0 | BM28: =R[-1]C[-61]*R[-1]C[-2] -> 18700 | BN28: =RC[-1]-RC[1] -> 11050 | BO28: =SUM(RC[-61]:RC[-8]) -> 7650
D29: Total Savings | F29: =R[-1]C-R[-2]C4*R[-2]C -> 0 | G29: =R[-1]C-R[-2]C4*R[-2]C -> 0 | H29: =R[-1]C-R[-2]C4*R[-2]C -> 0 | I29: =R[-1]C-R[-2]C4*R[-2]C -> 0 | J29: =R[-1]C-R[-2]C4*R[-2]C -> -5850 | K29: =R[-1]C-R[-2]C4*R[-2]C -> -1300 | L29: =R[-1]C-R[-2]C4*R[-2]C -> -3900 | M29: =R[-1]C-R[-2]C4*R[-2]C -> 0 | N29: =R[-1]C-R[-2]C4*R[-2]C -> 0 | O29: =R[-1]C-R[-2]C4*R[-2]C -> 0 | P29: =R[-1]C-R[-2]C4*R[-2]C -> 0 | Q29: =R[-1]C-R[-2]C4*R[-2]C -> 0 | R29: =R[-1]C-R[-2]C4*R[-2]C -> 0 | S29: =R[-1]C-R[-2]C4*R[-2]C -> 0 | T29: =R[-1]C-R[-2]C4*R[-2]C -> 0 | U29: =R[-1]C-R[-2]C4*R[-2]C -> 0 | V29: =R[-1]C-R[-2]C4*R[-2]C -> 0 | W29: =R[-1]C-R[-2]C4*R[-2]C -> 0 | X29: =R[-1]C-R[-2]C4*R[-2]C -> 0 | Y29: =R[-1]C-R[-2]C4*R[-2]C -> 0 | Z29: =R[-1]C-R[-2]C4*R[-2]C -> 0 | AA29: =R[-1]C-R[-2]C4*R[-2]C -> 0 | AB29: =R[-1]C-R[-2]C4*R[-2]C -> 0 | AC29: =R[-1]C-R[-2]C4*R[-2]C -> 0 | AD29: =R[-1]C-R[-2]C4*R[-2]C -> 0 | AE29: =R[-1]C-R[-2]C4*R[-2]C -> 0 | AF29: =R[-1]C-R[-2]C4*R[-2]C -> 0 | AG29: =R[-1]C-R[-2]C4*R[-2]C -> 0 | AH29: =R[-1]C-R[-2]C4*R[-2]C -> 0 | AI29: =R[-1]C-R[-2]C4*R[-2]C -> 0 | AJ29: =R[-1]C-R[-2]C4*R[-2]C -> 0 | AK29: =R[-1]C-R[-2]C4*R[-2]C -> 0 | AL29: =R[-1]C-R[-2]C4*R[-2]C -> 0 | AM29: =R[-1]C-R[-2]C4*R[-2]C -> 0 | AN29: =R[-1]C-R[-2]C4*R[-2]C -> 0 | AO29: =R[-1]C-R[-2]C4*R[-2]C -> 0 | AP29: =R[-1]C-R[-2]C4*R[-2]C -> 0 | AQ29: =R[-1]C-R[-2]C4*R[-2]C -> 0 | AR29: =R[-1]C-R[-2]C4*R[-2]C -> 0 | AS29: =R[-1]C-R[-2]C4*R[-2]C -> 0 | AT29: =R[-1]C-R[-2]C4*R[-2]C -> 0 | AU29: =R[-1]C-R[-2]C4*R[-2]C -> 0 | AV29: =R[-1]C-R[-2]C4*R[-2]C -> 0 | AW29: =R[-1]C-R[-2]C4*R[-2]C -> 0 | AX29: =R[-1]C-R[-2]C4*R[-2]C -> 0 | AY29: =R[-1]C-R[-2]C4*R[-2]C -> 0 | AZ29: =R[-1]C-R[-2]C4*R[-2]C -> 0 | BA29: =R[-1]C-R[-2]C4*R[-2]C -> 0 | BB29: =R[-1]C-R[-2]C4*R[-2]C -> 0 | BC29: =R[-1]C-R[-2]C4*R[-2]C -> 0 | BD29: =R[-1]C-R[-2]C4*R[-2]C -> 0 | BE29: =R[-1]C-R[-2]C4*R[-2]C -> 0 | BF29: =R[-1]C-R[-2]C4*R[-2]C -> 0 | BG29: =R[-1]C-R[-2]C4*R[-2]C -> 0 | BO29: =SUM(RC[-61]:RC[-8]) -> -11050
A30: Analysis Simulation | B30: 2002-02-04T00:00:00.000 | C30: 2 | D30: 1175 | E30: 525 | F30: 0 | G30: 0 | H30: 0 | I30: 0 | J30: 0 | K30: 2 | L30: 0 | M30: 0 | N30: 0 | O30: 0 | P30: 0 | Q30: 0 | R30: 0 | S30: 0 | T30: 0 | U30: 0 | V30: 0 | W30: 0 | X30: 0 | Y30: 0 | Z30: 0 | AA30: 0 | AB30: 0 | AC30: 0 | AD30: 0 | AE30: 0 | AF30: 0 | AG30: 0 | AH30: 0 | AI30: 0 | AJ30: 0 | AK30: 0 | AL30: 0 | AM30: 0 | AN30: 0 | AO30: 0 | AP30: 0 | AQ30: 1 | AR30: 0 | AS30: 0 | AT30: 0 | AU30: 0 | AV30: 0 | AW30: 0 | AX30: 0 | AY30: 0 | AZ30: 0 | BA30: 0 | BB30: 0 | BC30: 0 | BD30: 0 | BE30: 0 | BF30: 0 | BG30: 13 | BK30: =SUM(RC[-57]:RC[-4]) -> 16 | BL30: =RC[-61]*RC[-1] -> 32
D31: Total | F31: =R[-1]C*R30C5 -> 0 | G31: =R[-1]C*R30C5 -> 0 | H31: =R[-1]C*R30C5 -> 0 | I31: =R[-1]C*R30C5 -> 0 | J31: =R[-1]C*R30C5 -> 0 | K31: =R[-1]C*R30C5 -> 1050 | L31: =R[-1]C*R30C5 -> 0 | M31: =R[-1]C*R30C5 -> 0 | N31: =R[-1]C*R30C5 -> 0 | O31: =R[-1]C*R30C5 -> 0 | P31: =R[-1]C*R30C5 -> 0 | Q31: =R[-1]C*R30C5 -> 0 | R31: =R[-1]C*R30C5 -> 0 | S31: =R[-1]C*R30C5 -> 0 | T31: =R[-1]C*R30C5 -> 0 | U31: =R[-1]C*R30C5 -> 0 | V31: =R[-1]C*R30C5 -> 0 | W31: =R[-1]C*R30C5 -> 0 | X31: =R[-1]C*R30C5 -> 0 | Y31: =R[-1]C*R30C5 -> 0 | Z31: =R[-1]C*R30C5 -> 0 | AA31: =R[-1]C*R30C5 -> 0 | AB31: =R[-1]C*R30C5 -> 0 | AC31: =R[-1]C*R30C5 -> 0 | AD31: =R[-1]C*R30C5 -> 0 | AE31: =R[-1]C*R30C5 -> 0 | AF31: =R[-1]C*R30C5 -> 0 | AG31: =R[-1]C*R30C5 -> 0 | AH31: =R[-1]C*R30C5 -> 0 | AI31: =R[-1]C*R30C5 -> 0 | AJ31: =R[-1]C*R30C5 -> 0 | AK31: =R[-1]C*R30C5 -> 0 | AL31: =R[-1]C*R30C5 -> 0 | AM31: =R[-1]C*R30C5 -> 0 | AN31: =R[-1]C*R30C5 -> 0 | AO31: =R[-1]C*R30C5 -> 0 | AP31: =R[-1]C*R30C5 -> 0 | AQ31: =R[-1]C*R30C5 -> 525 | AR31: =R[-1]C*R30C5 -> 0 | AS31: =R[-1]C*R30C5 -> 0 | AT31: =R[-1]C*R30C5 -> 0 | AU31: =R[-1]C*R30C5 -> 0 | AV31: =R[-1]C*R30C5 -> 0 | AW31: =R[-1]C*R30C5 -> 0 | AX31: =R[-1]C*R30C5 -> 0 | AY31: =R[-1]C*R30C5 -> 0 | AZ31: =R[-1]C*R30C5 -> 0 | BA31: =R[-1]C*R30C5 -> 0 | BB31: =R[-1]C*R30C5 -> 0 | BC31: =R[-1]C*R30C5 -> 0 | BD31: =R[-1]C*R30C5 -> 0 | BE31: =R[-1]C*R30C5 -> 0 | BF31: =R[-1]C*R30C5 -> 0 | BG31: =R[-1]C*R30C5 -> 6825 | BM31: =R[-1]C[-61]*R[-1]C[-2] -> 18800 | BN31: =RC[-1]-RC[1] -> 10400 | BO31: =SUM(RC[-61]:RC[-8]) -> 8400
D32: Total Savings | F32: =R[-1]C-R[-2]C4*R[-2]C -> 0 | G32: =R[-1]C-R[-2]C4*R[-2]C -> 0 | H32: =R[-1]C-R[-2]C4*R[-2]C -> 0 | I32: =R[-1]C-R[-2]C4*R[-2]C -> 0 | J32: =R[-1]C-R[-2]C4*R[-2]C -> 0 | K32: =R[-1]C-R[-2]C4*R[-2]C -> -1300 | L32: =R[-1]C-R[-2]C4*R[-2]C -> 0 | M32: =R[-1]C-R[-2]C4*R[-2]C -> 0 | N32: =R[-1]C-R[-2]C4*R[-2]C -> 0 | O32: =R[-1]C-R[-2]C4*R[-2]C -> 0 | P32: =R[-1]C-R[-2]C4*R[-2]C -> 0 | Q32: =R[-1]C-R[-2]C4*R[-2]C -> 0 | R32: =R[-1]C-R[-2]C4*R[-2]C -> 0 | S32: =R[-1]C-R[-2]C4*R[-2]C -> 0 | T32: =R[-1]C-R[-2]C4*R[-2]C -> 0 | U32: =R[-1]C-R[-2]C4*R[-2]C -> 0 | V32: =R[-1]C-R[-2]C4*R[-2]C -> 0 | W32: =R[-1]C-R[-2]C4*R[-2]C -> 0 | X32: =R[-1]C-R[-2]C4*R[-2]C -> 0 | Y32: =R[-1]C-R[-2]C4*R[-2]C -> 0 | Z32: =R[-1]C-R[-2]C4*R[-2]C -> 0 | AA32: =R[-1]C-R[-2]C4*R[-2]C -> 0 | AB32: =R[-1]C-R[-2]C4*R[-2]C -> 0 | AC32: =R[-1]C-R[-2]C4*R[-2]C -> 0 | AD32: =R[-1]C-R[-2]C4*R[-2]C -> 0 | AE32: =R[-1]C-R[-2]C4*R[-2]C -> 0 | AF32: =R[-1]C-R[-2]C4*R[-2]C -> 0 | AG32: =R[-1]C-R[-2]C4*R[-2]C -> 0 | AH32: =R[-1]C-R[-2]C4*R[-2]C -> 0 | AI32: =R[-1]C-R[-2]C4*R[-2]C -> 0 | AJ32: =R[-1]C-R[-2]C4*R[-2]C -> 0 | AK32: =R[-1]C-R[-2]C4*R[-2]C -> 0 | AL32: =R[-1]C-R[-2]C4*R[-2]C -> 0 | AM32: =R[-1]C-R[-2]C4*R[-2]C -> 0 | AN32: =R[-1]C-R[-2]C4*R[-2]C -> 0 | AO32: =R[-1]C-R[-2]C4*R[-2]C -> 0 | AP32: =R[-1]C-R[-2]C4*R[-2]C -> 0 | AQ32: =R[-1]C-R[-2]C4*R[-2]C -> -650 | AR32: =R[-1]C-R[-2]C4*R[-2]C -> 0 | AS32: =R[-1]C-R[-2]C4*R[-2]C -> 0 | AT32: =R[-1]C-R[-2]C4*R[-2]C -> 0 | AU32: =R[-1]C-R[-2]C4*R[-2]C -> 0 | AV32: =R[-1]C-R[-2]C4*R[-2]C -> 0 | AW32: =R[-1]C-R[-2]C4*R[-2]C -> 0 | AX32: =R[-1]C-R[-2]C4*R[-2]C -> 0 | AY32: =R[-1]C-R[-2]C4*R[-2]C -> 0 | AZ32: =R[-1]C-R[-2]C4*R[-2]C -> 0 | BA32: =R[-1]C-R[-2]C4*R[-2]C -> 0 | BB32: =R[-1]C-R[-2]C4*R[-2]C -> 0 | BC32: =R[-1]C-R[-2]C4*R[-2]C -> 0 | BD32: =R[-1]C-R[-2]C4*R[-2]C -> 0 | BE32: =R[-1]C-R[-2]C4*R[-2]C -> 0 | BF32: =R[-1]C-R[-2]C4*R[-2]C -> 0 | BG32: =R[-1]C-R[-2]C4*R[-2]C -> -8450 | BO32: =SUM(RC[-61]:RC[-8]) -> -10400
A33: Intro to MS SQL Server 7 | B33: 2002-02-06T00:00:00.000 | C33: 2 | D33: 1100 | E33: 450 | F33: 0 | G33: 0 | H33: 0 | I33: 0 | J33: 0 | K33: 0 | L33: 6 | M33: 0 | N33: 0 | O33: 0 | P33: 0 | Q33: 0 | R33: 0 | S33: 0 | T33: 0 | U33: 0 | V33: 0 | W33: 0 | X33: 0 | Y33: 0 | Z33: 0 | AA33: 0 | AB33: 0 | AC33: 0 | AD33: 0 | AE33: 0 | AF33: 0 | AG33: 0 | AH33: 0 | AI33: 0 | AJ33: 0 | AK33: 0 | AL33: 0 | AM33: 0 | AN33: 0 | AO33: 0 | AP33: 0 | AQ33: 0 | AR33: 0 | AS33: 0 | AT33: 0 | AU33: 0 | AV33: 0 | AW33: 0 | AX33: 0 | AY33: 0 | AZ33: 0 | BA33: 0 | BB33: 0 | BC33: 0 | BD33: 0 | BE33: 0 | BF33: 0 | BG33: 0 | BK33: =SUM(RC[-57]:RC[-4]) -> 6 | BL33: =RC[-61]*RC[-1] -> 12
D34: Total | F34: =R[-1]C*R33C5 -> 0 | G34: =R[-1]C*R33C5 -> 0 | H34: =R[-1]C*R33C5 -> 0 | I34: =R[-1]C*R33C5 -> 0 | J34: =R[-1]C*R33C5 -> 0 | K34: =R[-1]C*R33C5 -> 0 | L34: =R[-1]C*R33C5 -> 2700 | M34: =R[-1]C*R33C5 -> 0 | N34: =R[-1]C*R33C5 -> 0 | O34: =R[-1]C*R33C5 -> 0 | P34: =R[-1]C*R33C5 -> 0 | Q34: =R[-1]C*R33C5 -> 0 | R34: =R[-1]C*R33C5 -> 0 | S34: =R[-1]C*R33C5 -> 0 | T34: =R[-1]C*R33C5 -> 0 | U34: =R[-1]C*R33C5 -> 0 | V34: =R[-1]C*R33C5 -> 0 | W34: =R[-1]C*R33C5 -> 0 | X34: =R[-1]C*R33C5 -> 0 | Y34: =R[-1]C*R33C5 -> 0 | Z34: =R[-1]C*R33C5 -> 0 | AA34: =R[-1]C*R33C5 -> 0 | AB34: =R[-1]C*R33C5 -> 0 | AC34: =R[-1]C*R33C5 -> 0 | AD34: =R[-1]C*R33C5 -> 0 | AE34: =R[-1]C*R33C5 -> 0 | AF34: =R[-1]C*R33C5 -> 0 | AG34: =R[-1]C*R33C5 -> 0 | AH34: =R[-1]C*R33C5 -> 0 | AI34: =R[-1]C*R33C5 -> 0 | AJ34: =R[-1]C*R33C5 -> 0 | AK34: =R[-1]C*R33C5 -> 0 | AL34: =R[-1]C*R33C5 -> 0 | AM34: =R[-1]C*R33C5 -> 0 | AN34: =R[-1]C*R33C5 -> 0 | AO34: =R[-1]C*R33C5 -> 0 | AP34: =R[-1]C*R33C5 -> 0 | AQ34: =R[-1]C*R33C5 -> 0 | AR34: =R[-1]C*R33C5 -> 0 | AS34: =R[-1]C*R33C5 -> 0 | AT34: =R[-1]C*R33C5 -> 0 | AU34: =R[-1]C*R33C5 -> 0 | AV34: =R[-1]C*R33C5 -> 0 | AW34: =R[-1]C*R33C5 -> 0 | AX34: =R[-1]C*R33C5 -> 0 | AY34: =R[-1]C*R33C5 -> 0 | AZ34: =R[-1]C*R33C5 -> 0 | BA34: =R[-1]C*R33C5 -> 0 | BB34: =R[-1]C*R33C5 -> 0 | BC34: =R[-1]C*R33C5 -> 0 | BD34: =R[-1]C*R33C5 -> 0 | BE34: =R[-1]C*R33C5 -> 0 | BF34: =R[-1]C*R33C5 -> 0 | BG34: =R[-1]C*R33C5 -> 0 | BM34: =R[-1]C[-61]*R[-1]C[-2] -> 6600 | BN34: =RC[-1]-RC[1] -> 3900 | BO34: =SUM(RC[-61]:RC[-8]) -> 2700
D35: Total Savings | F35: =R[-1]C-R[-2]C4*R[-2]C -> 0 | G35: =R[-1]C-R[-2]C4*R[-2]C -> 0 | H35: =R[-1]C-R[-2]C4*R[-2]C -> 0 | I35: =R[-1]C-R[-2]C4*R[-2]C -> 0 | J35: =R[-1]C-R[-2]C4*R[-2]C -> 0 | K35: =R[-1]C-R[-2]C4*R[-2]C -> 0 | L35: =R[-1]C-R[-2]C4*R[-2]C -> -3900 | M35: =R[-1]C-R[-2]C4*R[-2]C -> 0 | N35: =R[-1]C-R[-2]C4*R[-2]C -> 0 | O35: =R[-1]C-R[-2]C4*R[-2]C -> 0 | P35: =R[-1]C-R[-2]C4*R[-2]C -> 0 | Q35: =R[-1]C-R[-2]C4*R[-2]C -> 0 | R35: =R[-1]C-R[-2]C4*R[-2]C -> 0 | S35: =R[-1]C-R[-2]C4*R[-2]C -> 0 | T35: =R[-1]C-R[-2]C4*R[-2]C -> 0 | U35: =R[-1]C-R[-2]C4*R[-2]C -> 0 | V35: =R[-1]C-R[-2]C4*R[-2]C -> 0 | W35: =R[-1]C-R[-2]C4*R[-2]C -> 0 | X35: =R[-1]C-R[-2]C4*R[-2]C -> 0 | Y35: =R[-1]C-R[-2]C4*R[-2]C -> 0 | Z35: =R[-1]C-R[-2]C4*R[-2]C -> 0 | AA35: =R[-1]C-R[-2]C4*R[-2]C -> 0 | AB35: =R[-1]C-R[-2]C4*R[-2]C -> 0 | AC35: =R[-1]C-R[-2]C4*R[-2]C -> 0 | AD35: =R[-1]C-R[-2]C4*R[-2]C -> 0 | AE35: =R[-1]C-R[-2]C4*R[-2]C -> 0 | AF35: =R[-1]C-R[-2]C4*R[-2]C -> 0 | AG35: =R[-1]C-R[-2]C4*R[-2]C -> 0 | AH35: =R[-1]C-R[-2]C4*R[-2]C -> 0 | AI35: =R[-1]C-R[-2]C4*R[-2]C -> 0 | AJ35: =R[-1]C-R[-2]C4*R[-2]C -> 0 | AK35: =R[-1]C-R[-2]C4*R[-2]C -> 0 | AL35: =R[-1]C-R[-2]C4*R[-2]C -> 0 | AM35: =R[-1]C-R[-2]C4*R[-2]C -> 0 | AN35: =R[-1]C-R[-2]C4*R[-2]C -> 0 | AO35: =R[-1]C-R[-2]C4*R[-2]C -> 0 | AP35: =R[-1]C-R[-2]C4*R[-2]C -> 0 | AQ35: =R[-1]C-R[-2]C4*R[-2]C -> 0 | AR35: =R[-1]C-R[-2]C4*R[-2]C -> 0 | AS35: =R[-1]C-R[-2]C4*R[-2]C -> 0 | AT35: =R[-1]C-R[-2]C4*R[-2]C -> 0 | AU35: =R[-1]C-R[-2]C4*R[-2]C -> 0 | AV35: =R[-1]C-R[-2]C4*R[-2]C -> 0 | AW35: =R[-1]C-R[-2]C4*R[-2]C -> 0 | AX35: =R[-1]C-R[-2]C4*R[-2]C -> 0 | AY35: =R[-1]C-R[-2]C4*R[-2]C -> 0 | AZ35: =R[-1]C-R[-2]C4*R[-2]C -> 0 | BA35: =R[-1]C-R[-2]C4*R[-2]C -> 0 | BB35: =R[-1]C-R[-2]C4*R[-2]C -> 0 | BC35: =R[-1]C-R[-2]C4*R[-2]C -> 0 | BD35: =R[-1]C-R[-2]C4*R[-2]C -> 0 | BE35: =R[-1]C-R[-2]C4*R[-2]C -> 0 | BF35: =R[-1]C-R[-2]C4*R[-2]C -> 0 | BG35: =R[-1]C-R[-2]C4*R[-2]C -> 0 | BO35: =SUM(RC[-61]:RC[-8]) -> -3900
A36: Mastering the Requirements Process | B36: 2002-02-11T00:00:00.000 | C36: 2 | D36: 1175 | E36: 525 | F36: 0 | G36: 0 | H36: 0 | I36: 0 | J36: 0 | K36: 1 | L36: 0 | M36: 0 | N36: 0 | O36: 0 | P36: 0 | Q36: 0 | R36: 0 | S36: 0 | T36: 0 | U36: 0 | V36: 0 | W36: 0 | X36: 0 | Y36: 0 | Z36: 0 | AA36: 0 | AB36: 0 | AC36: 0 | AD36: 0 | AE36: 0 | AF36: 0 | AG36: 0 | AH36: 0 | AI36: 0 | AJ36: 0 | AK36: 0 | AL36: 0 | AM36: 1 | AN36: 0 | AO36: 0 | AP36: 0 | AQ36: 1 | AR36: 0 | AS36: 0 | AT36: 0 | AU36: 0 | AV36: 0 | AW36: 0 | AX36: 0 | AY36: 0 | AZ36: 0 | BA36: 0 | BB36: 0 | BC36: 0 | BD36: 0 | BE36: 0 | BF36: 0 | BG36: 12 | BK36: =SUM(RC[-57]:RC[-4]) -> 15 | BL36: =RC[-61]*RC[-1] -> 30
D37: Total | F37: =R[-1]C*R36C5 -> 0 | G37: =R[-1]C*R36C5 -> 0 | H37: =R[-1]C*R36C5 -> 0 | I37: =R[-1]C*R36C5 -> 0 | J37: =R[-1]C*R36C5 -> 0 | K37: =R[-1]C*R36C5 -> 525 | L37: =R[-1]C*R36C5 -> 0 | M37: =R[-1]C*R36C5 -> 0 | N37: =R[-1]C*R36C5 -> 0 | O37: =R[-1]C*R36C5 -> 0 | P37: =R[-1]C*R36C5 -> 0 | Q37: =R[-1]C*R36C5 -> 0 | R37: =R[-1]C*R36C5 -> 0 | S37: =R[-1]C*R36C5 -> 0 | T37: =R[-1]C*R36C5 -> 0 | U37: =R[-1]C*R36C5 -> 0 | V37: =R[-1]C*R36C5 -> 0 | W37: =R[-1]C*R36C5 -> 0 | X37: =R[-1]C*R36C5 -> 0 | Y37: =R[-1]C*R36C5 -> 0 | Z37: =R[-1]C*R36C5 -> 0 | AA37: =R[-1]C*R36C5 -> 0 | AB37: =R[-1]C*R36C5 -> 0 | AC37: =R[-1]C*R36C5 -> 0 | AD37: =R[-1]C*R36C5 -> 0 | AE37: =R[-1]C*R36C5 -> 0 | AF37: =R[-1]C*R36C5 -> 0 | AG37: =R[-1]C*R36C5 -> 0 | AH37: =R[-1]C*R36C5 -> 0 | AI37: =R[-1]C*R36C5 -> 0 | AJ37: =R[-1]C*R36C5 -> 0 | AK37: =R[-1]C*R36C5 -> 0 | AL37: =R[-1]C*R36C5 -> 0 | AM37: =R[-1]C*R36C5 -> 525 | AN37: =R[-1]C*R36C5 -> 0 | AO37: =R[-1]C*R36C5 -> 0 | AP37: =R[-1]C*R36C5 -> 0 | AQ37: =R[-1]C*R36C5 -> 525 | AR37: =R[-1]C*R36C5 -> 0 | AS37: =R[-1]C*R36C5 -> 0 | AT37: =R[-1]C*R36C5 -> 0 | AU37: =R[-1]C*R36C5 -> 0 | AV37: =R[-1]C*R36C5 -> 0 | AW37: =R[-1]C*R36C5 -> 0 | AX37: =R[-1]C*R36C5 -> 0 | AY37: =R[-1]C*R36C5 -> 0 | AZ37: =R[-1]C*R36C5 -> 0 | BA37: =R[-1]C*R36C5 -> 0 | BB37: =R[-1]C*R36C5 -> 0 | BC37: =R[-1]C*R36C5 -> 0 | BD37: =R[-1]C*R36C5 -> 0 | BE37: =R[-1]C*R36C5 -> 0 | BF37: =R[-1]C*R36C5 -> 0 | BG37: =R[-1]C*R36C5 -> 6300 | BM37: =R[-1]C[-61]*R[-1]C[-2] -> 17625 | BN37: =RC[-1]-RC[1] -> 9750 | BO37: =SUM(RC[-61]:RC[-8]) -> 7875
D38: Total Savings | F38: =R[-1]C-R[-2]C4*R[-2]C -> 0 | G38: =R[-1]C-R[-2]C4*R[-2]C -> 0 | H38: =R[-1]C-R[-2]C4*R[-2]C -> 0 | I38: =R[-1]C-R[-2]C4*R[-2]C -> 0 | J38: =R[-1]C-R[-2]C4*R[-2]C -> 0 | K38: =R[-1]C-R[-2]C4*R[-2]C -> -650 | L38: =R[-1]C-R[-2]C4*R[-2]C -> 0 | M38: =R[-1]C-R[-2]C4*R[-2]C -> 0 | N38: =R[-1]C-R[-2]C4*R[-2]C -> 0 | O38: =R[-1]C-R[-2]C4*R[-2]C -> 0 | P38: =R[-1]C-R[-2]C4*R[-2]C -> 0 | Q38: =R[-1]C-R[-2]C4*R[-2]C -> 0 | R38: =R[-1]C-R[-2]C4*R[-2]C -> 0 | S38: =R[-1]C-R[-2]C4*R[-2]C -> 0 | T38: =R[-1]C-R[-2]C4*R[-2]C -> 0 | U38: =R[-1]C-R[-2]C4*R[-2]C -> 0 | V38: =R[-1]C-R[-2]C4*R[-2]C -> 0 | W38: =R[-1]C-R[-2]C4*R[-2]C -> 0 | X38: =R[-1]C-R[-2]C4*R[-2]C -> 0 | Y38: =R[-1]C-R[-2]C4*R[-2]C -> 0 | Z38: =R[-1]C-R[-2]C4*R[-2]C -> 0 | AA38: =R[-1]C-R[-2]C4*R[-2]C -> 0 | AB38: =R[-1]C-R[-2]C4*R[-2]C -> 0 | AC38: =R[-1]C-R[-2]C4*R[-2]C -> 0 | AD38: =R[-1]C-R[-2]C4*R[-2]C -> 0 | AE38: =R[-1]C-R[-2]C4*R[-2]C -> 0 | AF38: =R[-1]C-R[-2]C4*R[-2]C -> 0 | AG38: =R[-1]C-R[-2]C4*R[-2]C -> 0 | AH38: =R[-1]C-R[-2]C4*R[-2]C -> 0 | AI38: =R[-1]C-R[-2]C4*R[-2]C -> 0 | AJ38: =R[-1]C-R[-2]C4*R[-2]C -> 0 | AK38: =R[-1]C-R[-2]C4*R[-2]C -> 0 | AL38: =R[-1]C-R[-2]C4*R[-2]C -> 0 | AM38: =R[-1]C-R[-2]C4*R[-2]C -> -650 | AN38: =R[-1]C-R[-2]C4*R[-2]C -> 0 | AO38: =R[-1]C-R[-2]C4*R[-2]C -> 0 | AP38: =R[-1]C-R[-2]C4*R[-2]C -> 0 | AQ38: =R[-1]C-R[-2]C4*R[-2]C -> -650 | AR38: =R[-1]C-R[-2]C4*R[-2]C -> 0 | AS38: =R[-1]C-R[-2]C4*R[-2]C -> 0 | AT38: =R[-1]C-R[-2]C4*R[-2]C -> 0 | AU38: =R[-1]C-R[-2]C4*R[-2]C -> 0 | AV38: =R[-1]C-R[-2]C4*R[-2]C -> 0 | AW38: =R[-1]C-R[-2]C4*R[-2]C -> 0 | AX38: =R[-1]C-R[-2]C4*R[-2]C -> 0 | AY38: =R[-1]C-R[-2]C4*R[-2]C -> 0 | AZ38: =R[-1]C-R[-2]C4*R[-2]C -> 0 | BA38: =R[-1]C-R[-2]C4*R[-2]C -> 0 | BB38: =R[-1]C-R[-2]C4*R[-2]C -> 0 | BC38: =R[-1]C-R[-2]C4*R[-2]C -> 0 | BD38: =R[-1]C-R[-2]C4*R[-2]C -> 0 | BE38: =R[-1]C-R[-2]C4*R[-2]C -> 0 | BF38: =R[-1]C-R[-2]C4*R[-2]C -> 0 | BG38: =R[-1]C-R[-2]C4*R[-2]C -> -7800 | BO38: =SUM(RC[-61]:RC[-8]) -> -9750
A39: Dreamweaver 4 - Level II | B39: 2002-02-12T00:00:00.000 | C39: 1 | D39: 450 | E39: 200 | F39: 0 | G39: 0 | H39: 0 | I39: 0 | J39: 1 | K39: 0 | L39: 2 | M39: 2 | N39: 0 | O39: 0 | P39: 0 | Q39: 0 | R39: 0 | S39: 0 | T39: 0 | U39: 0 | V39: 0 | W39: 0 | X39: 0 | Y39: 0 | Z39: 0 | AA39: 0 | AB39: 0 | AC39: 0 | AD39: 0 | AE39: 0 | AF39: 0 | AG39: 0 | AH39: 0 | AI39: 0 | AJ39: 0 | AK39: 0 | AL39: 0 | AM39: 0 | AN39: 0 | AO39: 0 | AP39: 0 | AQ39: 0 | AR39: 0 | AS39: 0 | AT39: 0 | AU39: 0 | AV39: 0 | AW39: 0 | AX39: 0 | AY39: 0 | AZ39: 0 | BA39: 0 | BB39: 0 | BC39: 0 | BD39: 0 | BE39: 0 | BF39: 0 | BG39: 0 | BK39: =SUM(RC[-57]:RC[-4]) -> 5 | BL39: =RC[-61]*RC[-1] -> 5
D40: Total | F40: =R[-1]C*R39C5 -> 0 | G40: =R[-1]C*R39C5 -> 0 | H40: =R[-1]C*R39C5 -> 0 | I40: =R[-1]C*R39C5 -> 0 | J40: =R[-1]C*R39C5 -> 200 | K40: =R[-1]C*R39C5 -> 0 | L40: =R[-1]C*R39C5 -> 400 | M40: =R[-1]C*R39C5 -> 400 | N40: =R[-1]C*R39C5 -> 0 | O40: =R[-1]C*R39C5 -> 0 | P40: =R[-1]C*R39C5 -> 0 | Q40: =R[-1]C*R39C5 -> 0 | R40: =R[-1]C*R39C5 -> 0 | S40: =R[-1]C*R39C5 -> 0 | T40: =R[-1]C*R39C5 -> 0 | U40: =R[-1]C*R39C5 -> 0 | V40: =R[-1]C*R39C5 -> 0 | W40: =R[-1]C*R39C5 -> 0 | X40: =R[-1]C*R39C5 -> 0 | Y40: =R[-1]C*R39C5 -> 0 | Z40: =R[-1]C*R39C5 -> 0 | AA40: =R[-1]C*R39C5 -> 0 | AB40: =R[-1]C*R39C5 -> 0 | AC40: =R[-1]C*R39C5 -> 0 | AD40: =R[-1]C*R39C5 -> 0 | AE40: =R[-1]C*R39C5 -> 0 | AF40: =R[-1]C*R39C5 -> 0 | AG40: =R[-1]C*R39C5 -> 0 | AH40: =R[-1]C*R39C5 -> 0 | AI40: =R[-1]C*R39C5 -> 0 | AJ40: =R[-1]C*R39C5 -> 0 | AK40: =R[-1]C*R39C5 -> 0 | AL40: =R[-1]C*R39C5 -> 0 | AM40: =R[-1]C*R39C5 -> 0 | AN40: =R[-1]C*R39C5 -> 0 | AO40: =R[-1]C*R39C5 -> 0 | AP40: =R[-1]C*R39C5 -> 0 | AQ40: =R[-1]C*R39C5 -> 0 | AR40: =R[-1]C*R39C5 -> 0 | AS40: =R[-1]C*R39C5 -> 0 | AT40: =R[-1]C*R39C5 -> 0 | AU40: =R[-1]C*R39C5 -> 0 | AV40: =R[-1]C*R39C5 -> 0 | AW40: =R[-1]C*R39C5 -> 0 | AX40: =R[-1]C*R39C5 -> 0 | AY40: =R[-1]C*R39C5 -> 0 | AZ40: =R[-1]C*R39C5 -> 0 | BA40: =R[-1]C*R39C5 -> 0 | BB40: =R[-1]C*R39C5 -> 0 | BC40: =R[-1]C*R39C5 -> 0 | BD40: =R[-1]C*R39C5 -> 0 | BE40: =R[-1]C*R39C5 -> 0 | BF40: =R[-1]C*R39C5 -> 0 | BG40: =R[-1]C*R39C5 -> 0 | BM40: =R[-1]C[-61]*R[-1]C[-2] -> 2250 | BN40: =RC[-1]-RC[1] -> 1250 | BO40: =SUM(RC[-61]:RC[-8]) -> 1000
D41: Total Savings | F41: =R[-1]C-R[-2]C4*R[-2]C -> 0 | G41: =R[-1]C-R[-2]C4*R[-2]C -> 0 | H41: =R[-1]C-R[-2]C4*R[-2]C -> 0 | I41: =R[-1]C-R[-2]C4*R[-2]C -> 0 | J41: =R[-1]C-R[-2]C4*R[-2]C -> -250 | K41: =R[-1]C-R[-2]C4*R[-2]C -> 0 | L41: =R[-1]C-R[-2]C4*R[-2]C -> -500 | M41: =R[-1]C-R[-2]C4*R[-2]C -> -500 | N41: =R[-1]C-R[-2]C4*R[-2]C -> 0 | O41: =R[-1]C-R[-2]C4*R[-2]C -> 0 | P41: =R[-1]C-R[-2]C4*R[-2]C -> 0 | Q41: =R[-1]C-R[-2]C4*R[-2]C -> 0 | R41: =R[-1]C-R[-2]C4*R[-2]C -> 0 | S41: =R[-1]C-R[-2]C4*R[-2]C -> 0 | T41: =R[-1]C-R[-2]C4*R[-2]C -> 0 | U41: =R[-1]C-R[-2]C4*R[-2]C -> 0 | V41: =R[-1]C-R[-2]C4*R[-2]C -> 0 | W41: =R[-1]C-R[-2]C4*R[-2]C -> 0 | X41: =R[-1]C-R[-2]C4*R[-2]C -> 0 | Y41: =R[-1]C-R[-2]C4*R[-2]C -> 0 | Z41: =R[-1]C-R[-2]C4*R[-2]C -> 0 | AA41: =R[-1]C-R[-2]C4*R[-2]C -> 0 | AB41: =R[-1]C-R[-2]C4*R[-2]C -> 0 | AC41: =R[-1]C-R[-2]C4*R[-2]C -> 0 | AD41: =R[-1]C-R[-2]C4*R[-2]C -> 0 | AE41: =R[-1]C-R[-2]C4*R[-2]C -> 0 | AF41: =R[-1]C-R[-2]C4*R[-2]C -> 0 | AG41: =R[-1]C-R[-2]C4*R[-2]C -> 0 | AH41: =R[-1]C-R[-2]C4*R[-2]C -> 0 | AI41: =R[-1]C-R[-2]C4*R[-2]C -> 0 | AJ41: =R[-1]C-R[-2]C4*R[-2]C -> 0 | AK41: =R[-1]C-R[-2]C4*R[-2]C -> 0 | AL41: =R[-1]C-R[-2]C4*R[-2]C -> 0 | AM41: =R[-1]C-R[-2]C4*R[-2]C -> 0 | AN41: =R[-1]C-R[-2]C4*R[-2]C -> 0 | AO41: =R[-1]C-R[-2]C4*R[-2]C -> 0 | AP41: =R[-1]C-R[-2]C4*R[-2]C -> 0 | AQ41: =R[-1]C-R[-2]C4*R[-2]C -> 0 | AR41: =R[-1]C-R[-2]C4*R[-2]C -> 0 | AS41: =R[-1]C-R[-2]C4*R[-2]C -> 0 | AT41: =R[-1]C-R[-2]C4*R[-2]C -> 0 | AU41: =R[-1]C-R[-2]C4*R[-2]C -> 0 | AV41: =R[-1]C-R[-2]C4*R[-2]C -> 0 | AW41: =R[-1]C-R[-2]C4*R[-2]C -> 0 | AX41: =R[-1]C-R[-2]C4*R[-2]C -> 0 | AY41: =R[-1]C-R[-2]C4*R[-2]C -> 0 | AZ41: =R[-1]C-R[-2]C4*R[-2]C -> 0 | BA41: =R[-1]C-R[-2]C4*R[-2]C -> 0 | BB41: =R[-1]C-R[-2]C4*R[-2]C -> 0 | BC41: =R[-1]C-R[-2]C4*R[-2]C -> 0 | BD41: =R[-1]C-R[-2]C4*R[-2]C -> 0 | BE41: =R[-1]C-R[-2]C4*R[-2]C -> 0 | BF41: =R[-1]C-R[-2]C4*R[-2]C -> 0 | BG41: =R[-1]C-R[-2]C4*R[-2]C -> 0 | BO41: =SUM(RC[-61]:RC[-8]) -> -1250
A42: Boot Camp for Software Testers | B42: 2002-02-13T00:00:00.000 | C42: 3 | D42: 1995 | E42: 688 | F42: 0 | G42: 0 | H42: 0 | I42: 0 | J42: 1 | K42: 2 | L42: 0 | M42: 0 | N42: 0 | O42: 0 | P42: 0 | Q42: 0 | R42: 0 | S42: 0 | T42: 0 | U42: 0 | V42: 0 | W42: 3 | X42: 0 | Y42: 0 | Z42: 0 | AA42: 0 | AB42: 0 | AC42: 0 | AD42: 0 | AE42: 4 | AF42: 0 | AG42: 0 | AH42: 0 | AI42: 0 | AJ42: 0 | AK42: 0 | AL42: 0 | AM42: 0 | AN42: 0 | AO42: 0 | AP42: 3 | AQ42: 0 | AR42: 3 | AS42: 0 | AT42: 0 | AU42: 0 | AV42: 0 | AW42: 0 | AX42: 0 | AY42: 0 | AZ42: 0 | BA42: 0 | BB42: 1 | BC42: 0 | BD42: 0 | BE42: 0 | BF42: 0 | BG42: 4 | BK42: =SUM(RC[-57]:RC[-4]) -> 21 | BL42: =RC[-61]*RC[-1] -> 63
D43: Total | F43: =R[-1]C*R42C5 -> 0 | G43: =R[-1]C*R42C5 -> 0 | H43: =R[-1]C*R42C5 -> 0 | I43: =R[-1]C*R42C5 -> 0 | J43: =R[-1]C*R42C5 -> 688 | K43: =R[-1]C*R42C5 -> 1376 | L43: =R[-1]C*R42C5 -> 0 | M43: =R[-1]C*R42C5 -> 0 | N43: =R[-1]C*R42C5 -> 0 | O43: =R[-1]C*R42C5 -> 0 | P43: =R[-1]C*R42C5 -> 0 | Q43: =R[-1]C*R42C5 -> 0 | R43: =R[-1]C*R42C5 -> 0 | S43: =R[-1]C*R42C5 -> 0 | T43: =R[-1]C*R42C5 -> 0 | U43: =R[-1]C*R42C5 -> 0 | V43: =R[-1]C*R42C5 -> 0 | W43: =R[-1]C*R42C5 -> 2064 | X43: =R[-1]C*R42C5 -> 0 | Y43: =R[-1]C*R42C5 -> 0 | Z43: =R[-1]C*R42C5 -> 0 | AA43: =R[-1]C*R42C5 -> 0 | AB43: =R[-1]C*R42C5 -> 0 | AC43: =R[-1]C*R42C5 -> 0 | AD43: =R[-1]C*R42C5 -> 0 | AE43: =R[-1]C*R42C5 -> 2752 | AF43: =R[-1]C*R42C5 -> 0 | AG43: =R[-1]C*R42C5 -> 0 | AH43: =R[-1]C*R42C5 -> 0 | AI43: =R[-1]C*R42C5 -> 0 | AJ43: =R[-1]C*R42C5 -> 0 | AK43: =R[-1]C*R42C5 -> 0 | AL43: =R[-1]C*R42C5 -> 0 | AM43: =R[-1]C*R42C5 -> 0 | AN43: =R[-1]C*R42C5 -> 0 | AO43: =R[-1]C*R42C5 -> 0 | AP43: =R[-1]C*R42C5 -> 2064 | AQ43: =R[-1]C*R42C5 -> 0 | AR43: =R[-1]C*R42C5 -> 2064 | AS43: =R[-1]C*R42C5 -> 0 | AT43: =R[-1]C*R42C5 -> 0 | AU43: =R[-1]C*R42C5 -> 0 | AV43: =R[-1]C*R42C5 -> 0 | AW43: =R[-1]C*R42C5 -> 0 | AX43: =R[-1]C*R42C5 -> 0 | AY43: =R[-1]C*R42C5 -> 0 | AZ43: =R[-1]C*R42C5 -> 0 | BA43: =R[-1]C*R42C5 -> 0 | BB43: =R[-1]C*R42C5 -> 688 | BC43: =R[-1]C*R42C5 -> 0 | BD43: =R[-1]C*R42C5 -> 0 | BE43: =R[-1]C*R42C5 -> 0 | BF43: =R[-1]C*R42C5 -> 0 | BG43: =R[-1]C*R42C5 -> 2752 | BM43: =R[-1]C[-61]*R[-1]C[-2] -> 41895 | BN43: =RC[-1]-RC[1] -> 27447 | BO43: =SUM(RC[-61]:RC[-8]) -> 14448
D44: Total Savings | F44: =R[-1]C-R[-2]C4*R[-2]C -> 0 | G44: =R[-1]C-R[-2]C4*R[-2]C -> 0 | H44: =R[-1]C-R[-2]C4*R[-2]C -> 0 | I44: =R[-1]C-R[-2]C4*R[-2]C -> 0 | J44: =R[-1]C-R[-2]C4*R[-2]C -> -1307 | K44: =R[-1]C-R[-2]C4*R[-2]C -> -2614 | L44: =R[-1]C-R[-2]C4*R[-2]C -> 0 | M44: =R[-1]C-R[-2]C4*R[-2]C -> 0 | N44: =R[-1]C-R[-2]C4*R[-2]C -> 0 | O44: =R[-1]C-R[-2]C4*R[-2]C -> 0 | P44: =R[-1]C-R[-2]C4*R[-2]C -> 0 | Q44: =R[-1]C-R[-2]C4*R[-2]C -> 0 | R44: =R[-1]C-R[-2]C4*R[-2]C -> 0 | S44: =R[-1]C-R[-2]C4*R[-2]C -> 0 | T44: =R[-1]C-R[-2]C4*R[-2]C -> 0 | U44: =R[-1]C-R[-2]C4*R[-2]C -> 0 | V44: =R[-1]C-R[-2]C4*R[-2]C -> 0 | W44: =R[-1]C-R[-2]C4*R[-2]C -> -3921 | X44: =R[-1]C-R[-2]C4*R[-2]C -> 0 | Y44: =R[-1]C-R[-2]C4*R[-2]C -> 0 | Z44: =R[-1]C-R[-2]C4*R[-2]C -> 0 | AA44: =R[-1]C-R[-2]C4*R[-2]C -> 0 | AB44: =R[-1]C-R[-2]C4*R[-2]C -> 0 | AC44: =R[-1]C-R[-2]C4*R[-2]C -> 0 | AD44: =R[-1]C-R[-2]C4*R[-2]C -> 0 | AE44: =R[-1]C-R[-2]C4*R[-2]C -> -5228 | AF44: =R[-1]C-R[-2]C4*R[-2]C -> 0 | AG44: =R[-1]C-R[-2]C4*R[-2]C -> 0 | AH44: =R[-1]C-R[-2]C4*R[-2]C -> 0 | AI44: =R[-1]C-R[-2]C4*R[-2]C -> 0 | AJ44: =R[-1]C-R[-2]C4*R[-2]C -> 0 | AK44: =R[-1]C-R[-2]C4*R[-2]C -> 0 | AL44: =R[-1]C-R[-2]C4*R[-2]C -> 0 | AM44: =R[-1]C-R[-2]C4*R[-2]C -> 0 | AN44: =R[-1]C-R[-2]C4*R[-2]C -> 0 | AO44: =R[-1]C-R[-2]C4*R[-2]C -> 0 | AP44: =R[-1]C-R[-2]C4*R[-2]C -> -3921 | AQ44: =R[-1]C-R[-2]C4*R[-2]C -> 0 | AR44: =R[-1]C-R[-2]C4*R[-2]C -> -3921 | AS44: =R[-1]C-R[-2]C4*R[-2]C -> 0 | AT44: =R[-1]C-R[-2]C4*R[-2]C -> 0 | AU44: =R[-1]C-R[-2]C4*R[-2]C -> 0 | AV44: =R[-1]C-R[-2]C4*R[-2]C -> 0 | AW44: =R[-1]C-R[-2]C4*R[-2]C -> 0 | AX44: =R[-1]C-R[-2]C4*R[-2]C -> 0 | AY44: =R[-1]C-R[-2]C4*R[-2]C -> 0 | AZ44: =R[-1]C-R[-2]C4*R[-2]C -> 0 | BA44: =R[-1]C-R[-2]C4*R[-2]C -> 0 | BB44: =R[-1]C-R[-2]C4*R[-2]C -> -1307 | BC44: =R[-1]C-R[-2]C4*R[-2]C -> 0 | BD44: =R[-1]C-R[-2]C4*R[-2]C -> 0 | BE44: =R[-1]C-R[-2]C4*R[-2]C -> 0 | BF44: =R[-1]C-R[-2]C4*R[-2]C -> 0 | BG44: =R[-1]C-R[-2]C4*R[-2]C -> -5228 | BO44: =SUM(RC[-61]:RC[-8]) -> -27447
A45: Introduction to Flash 5.0 | B45: 2002-02-25T00:00:00.000 | C45: 1 | D45: 500 | E45: 176 | F45: 0 | G45: 2 | H45: 0 | I45: 0 | J45: 3 | K45: 0 | L45: 0 | M45: 2 | N45: 0 | O45: 0 | P45: 0 | Q45: 0 | R45: 0 | S45: 0 | T45: 0 | U45: 0 | V45: 0 | W45: 0 | X45: 0 | Y45: 0 | Z45: 0 | AA45: 0 | AB45: 0 | AC45: 0 | AD45: 0 | AE45: 0 | AF45: 0 | AG45: 0 | AH45: 0 | AI45: 0 | AJ45: 0 | AK45: 0 | AL45: 0 | AM45: 0 | AN45: 0 | AO45: 0 | AP45: 0 | AQ45: 0 | AR45: 0 | AS45: 0 | AT45: 0 | AU45: 0 | AV45: 0 | AW45: 0 | AX45: 0 | AY45: 0 | AZ45: 0 | BA45: 0 | BB45: 0 | BC45: 0 | BD45: 0 | BE45: 0 | BF45: 0 | BG45: 0 | BK45: =SUM(RC[-57]:RC[-4]) -> 7 | BL45: =RC[-61]*RC[-1] -> 7
D46: Total | F46: =R[-1]C*R45C5 -> 0 | G46: =R[-1]C*R45C5 -> 352 | H46: =R[-1]C*R45C5 -> 0 | I46: =R[-1]C*R45C5 -> 0 | J46: =R[-1]C*R45C5 -> 528 | K46: =R[-1]C*R45C5 -> 0 | L46: =R[-1]C*R45C5 -> 0 | M46: =R[-1]C*R45C5 -> 352 | N46: =R[-1]C*R45C5 -> 0 | O46: =R[-1]C*R45C5 -> 0 | P46: =R[-1]C*R45C5 -> 0 | Q46: =R[-1]C*R45C5 -> 0 | R46: =R[-1]C*R45C5 -> 0 | S46: =R[-1]C*R45C5 -> 0 | T46: =R[-1]C*R45C5 -> 0 | U46: =R[-1]C*R45C5 -> 0 | V46: =R[-1]C*R45C5 -> 0 | W46: =R[-1]C*R45C5 -> 0 | X46: =R[-1]C*R45C5 -> 0 | Y46: =R[-1]C*R45C5 -> 0 | Z46: =R[-1]C*R45C5 -> 0 | AA46: =R[-1]C*R45C5 -> 0 | AB46: =R[-1]C*R45C5 -> 0 | AC46: =R[-1]C*R45C5 -> 0 | AD46: =R[-1]C*R45C5 -> 0 | AE46: =R[-1]C*R45C5 -> 0 | AF46: =R[-1]C*R45C5 -> 0 | AG46: =R[-1]C*R45C5 -> 0 | AH46: =R[-1]C*R45C5 -> 0 | AI46: =R[-1]C*R45C5 -> 0 | AJ46: =R[-1]C*R45C5 -> 0 | AK46: =R[-1]C*R45C5 -> 0 | AL46: =R[-1]C*R45C5 -> 0 | AM46: =R[-1]C*R45C5 -> 0 | AN46: =R[-1]C*R45C5 -> 0 | AO46: =R[-1]C*R45C5 -> 0 | AP46: =R[-1]C*R45C5 -> 0 | AQ46: =R[-1]C*R45C5 -> 0 | AR46: =R[-1]C*R45C5 -> 0 | AS46: =R[-1]C*R45C5 -> 0 | AT46: =R[-1]C*R45C5 -> 0 | AU46: =R[-1]C*R45C5 -> 0 | AV46: =R[-1]C*R45C5 -> 0 | AW46: =R[-1]C*R45C5 -> 0 | AX46: =R[-1]C*R45C5 -> 0 | AY46: =R[-1]C*R45C5 -> 0 | AZ46: =R[-1]C*R45C5 -> 0 | BA46: =R[-1]C*R45C5 -> 0 | BB46: =R[-1]C*R45C5 -> 0 | BC46: =R[-1]C*R45C5 -> 0 | BD46: =R[-1]C*R45C5 -> 0 | BE46: =R[-1]C*R45C5 -> 0 | BF46: =R[-1]C*R45C5 -> 0 | BG46: =R[-1]C*R45C5 -> 0 | BM46: =R[-1]C[-61]*R[-1]C[-2] -> 3500 | BN46: =RC[-1]-RC[1] -> 2268 | BO46: =SUM(RC[-61]:RC[-8]) -> 1232
D47: Total Savings | F47: =R[-1]C-R[-2]C4*R[-2]C -> 0 | G47: =R[-1]C-R[-2]C4*R[-2]C -> -648 | H47: =R[-1]C-R[-2]C4*R[-2]C -> 0 | I47: =R[-1]C-R[-2]C4*R[-2]C -> 0 | J47: =R[-1]C-R[-2]C4*R[-2]C -> -972 | K47: =R[-1]C-R[-2]C4*R[-2]C -> 0 | L47: =R[-1]C-R[-2]C4*R[-2]C -> 0 | M47: =R[-1]C-R[-2]C4*R[-2]C -> -648 | N47: =R[-1]C-R[-2]C4*R[-2]C -> 0 | O47: =R[-1]C-R[-2]C4*R[-2]C -> 0 | P47: =R[-1]C-R[-2]C4*R[-2]C -> 0 | Q47: =R[-1]C-R[-2]C4*R[-2]C -> 0 | R47: =R[-1]C-R[-2]C4*R[-2]C -> 0 | S47: =R[-1]C-R[-2]C4*R[-2]C -> 0 | T47: =R[-1]C-R[-2]C4*R[-2]C -> 0 | U47: =R[-1]C-R[-2]C4*R[-2]C -> 0 | V47: =R[-1]C-R[-2]C4*R[-2]C -> 0 | W47: =R[-1]C-R[-2]C4*R[-2]C -> 0 | X47: =R[-1]C-R[-2]C4*R[-2]C -> 0 | Y47: =R[-1]C-R[-2]C4*R[-2]C -> 0 | Z47: =R[-1]C-R[-2]C4*R[-2]C -> 0 | AA47: =R[-1]C-R[-2]C4*R[-2]C -> 0 | AB47: =R[-1]C-R[-2]C4*R[-2]C -> 0 | AC47: =R[-1]C-R[-2]C4*R[-2]C -> 0 | AD47: =R[-1]C-R[-2]C4*R[-2]C -> 0 | AE47: =R[-1]C-R[-2]C4*R[-2]C -> 0 | AF47: =R[-1]C-R[-2]C4*R[-2]C -> 0 | AG47: =R[-1]C-R[-2]C4*R[-2]C -> 0 | AH47: =R[-1]C-R[-2]C4*R[-2]C -> 0 | AI47: =R[-1]C-R[-2]C4*R[-2]C -> 0 | AJ47: =R[-1]C-R[-2]C4*R[-2]C -> 0 | AK47: =R[-1]C-R[-2]C4*R[-2]C -> 0 | AL47: =R[-1]C-R[-2]C4*R[-2]C -> 0 | AM47: =R[-1]C-R[-2]C4*R[-2]C -> 0 | AN47: =R[-1]C-R[-2]C4*R[-2]C -> 0 | AO47: =R[-1]C-R[-2]C4*R[-2]C -> 0 | AP47: =R[-1]C-R[-2]C4*R[-2]C -> 0 | AQ47: =R[-1]C-R[-2]C4*R[-2]C -> 0 | AR47: =R[-1]C-R[-2]C4*R[-2]C -> 0 | AS47: =R[-1]C-R[-2]C4*R[-2]C -> 0 | AT47: =R[-1]C-R[-2]C4*R[-2]C -> 0 | AU47: =R[-1]C-R[-2]C4*R[-2]C -> 0 | AV47: =R[-1]C-R[-2]C4*R[-2]C -> 0 | AW47: =R[-1]C-R[-2]C4*R[-2]C -> 0 | AX47: =R[-1]C-R[-2]C4*R[-2]C -> 0 | AY47: =R[-1]C-R[-2]C4*R[-2]C -> 0 | AZ47: =R[-1]C-R[-2]C4*R[-2]C -> 0 | BA47: =R[-1]C-R[-2]C4*R[-2]C -> 0 | BB47: =R[-1]C-R[-2]C4*R[-2]C -> 0 | BC47: =R[-1]C-R[-2]C4*R[-2]C -> 0 | BD47: =R[-1]C-R[-2]C4*R[-2]C -> 0 | BE47: =R[-1]C-R[-2]C4*R[-2]C -> 0 | BF47: =R[-1]C-R[-2]C4*R[-2]C -> 0 | BG47: =R[-1]C-R[-2]C4*R[-2]C -> 0 | BO47: =SUM(RC[-61]:RC[-8]) -> -2268
A48: MS Project 2000 | B48: 2002-02-25T00:00:00.000 | C48: 3 | D48: 950 | E48: 220 | F48: 0 | G48: 0 | H48: 0 | I48: 0 | J48: 2 | K48: 0 | L48: 0 | M48: 0 | N48: 0 | O48: 0 | P48: 0 | Q48: 0 | R48: 0 | S48: 0 | T48: 0 | U48: 0 | V48: 0 | W48: 9 | X48: 0 | Y48: 0 | Z48: 0 | AA48: 0 | AB48: 0 | AC48: 0 | AD48: 0 | AE48: 0 | AF48: 0 | AG48: 0 | AH48: 0 | AI48: 0 | AJ48: 0 | AK48: 0 | AL48: 0 | AM48: 0 | AN48: 0 | AO48: 0 | AP48: 0 | AQ48: 0 | AR48: 0 | AS48: 0 | AT48: 0 | AU48: 0 | AV48: 0 | AW48: 0 | AX48: 0 | AY48: 0 | AZ48: 0 | BA48: 0 | BB48: 0 | BC48: 0 | BD48: 0 | BE48: 0 | BF48: 0 | BG48: 0 | BK48: =SUM(RC[-57]:RC[-4]) -> 11 | BL48: =RC[-61]*RC[-1] -> 33
D49: Total | F49: =R[-1]C*R48C5 -> 0 | G49: =R[-1]C*R48C5 -> 0 | H49: =R[-1]C*R48C5 -> 0 | I49: =R[-1]C*R48C5 -> 0 | J49: =R[-1]C*R48C5 -> 440 | K49: =R[-1]C*R48C5 -> 0 | L49: =R[-1]C*R48C5 -> 0 | M49: =R[-1]C*R48C5 -> 0 | N49: =R[-1]C*R48C5 -> 0 | O49: =R[-1]C*R48C5 -> 0 | P49: =R[-1]C*R48C5 -> 0 | Q49: =R[-1]C*R48C5 -> 0 | R49: =R[-1]C*R48C5 -> 0 | S49: =R[-1]C*R48C5 -> 0 | T49: =R[-1]C*R48C5 -> 0 | U49: =R[-1]C*R48C5 -> 0 | V49: =R[-1]C*R48C5 -> 0 | W49: =R[-1]C*R48C5 -> 1980 | X49: =R[-1]C*R48C5 -> 0 | Y49: =R[-1]C*R48C5 -> 0 | Z49: =R[-1]C*R48C5 -> 0 | AA49: =R[-1]C*R48C5 -> 0 | AB49: =R[-1]C*R48C5 -> 0 | AC49: =R[-1]C*R48C5 -> 0 | AD49: =R[-1]C*R48C5 -> 0 | AE49: =R[-1]C*R48C5 -> 0 | AF49: =R[-1]C*R48C5 -> 0 | AG49: =R[-1]C*R48C5 -> 0 | AH49: =R[-1]C*R48C5 -> 0 | AI49: =R[-1]C*R48C5 -> 0 | AJ49: =R[-1]C*R48C5 -> 0 | AK49: =R[-1]C*R48C5 -> 0 | AL49: =R[-1]C*R48C5 -> 0 | AM49: =R[-1]C*R48C5 -> 0 | AN49: =R[-1]C*R48C5 -> 0 | AO49: =R[-1]C*R48C5 -> 0 | AP49: =R[-1]C*R48C5 -> 0 | AQ49: =R[-1]C*R48C5 -> 0 | AR49: =R[-1]C*R48C5 -> 0 | AS49: =R[-1]C*R48C5 -> 0 | AT49: =R[-1]C*R48C5 -> 0 | AU49: =R[-1]C*R48C5 -> 0 | AV49: =R[-1]C*R48C5 -> 0 | AW49: =R[-1]C*R48C5 -> 0 | AX49: =R[-1]C*R48C5 -> 0 | AY49: =R[-1]C*R48C5 -> 0 | AZ49: =R[-1]C*R48C5 -> 0 | BA49: =R[-1]C*R48C5 -> 0 | BB49: =R[-1]C*R48C5 -> 0 | BC49: =R[-1]C*R48C5 -> 0 | BD49: =R[-1]C*R48C5 -> 0 | BE49: =R[-1]C*R48C5 -> 0 | BF49: =R[-1]C*R48C5 -> 0 | BG49: =R[-1]C*R48C5 -> 0 | BM49: =R[-1]C[-61]*R[-1]C[-2] -> 10450 | BN49: =RC[-1]-RC[1] -> 8030 | BO49: =SUM(RC[-61]:RC[-8]) -> 2420
D50: Total Savings | F50: =R[-1]C-R[-2]C4*R[-2]C -> 0 | G50: =R[-1]C-R[-2]C4*R[-2]C -> 0 | H50: =R[-1]C-R[-2]C4*R[-2]C -> 0 | I50: =R[-1]C-R[-2]C4*R[-2]C -> 0 | J50: =R[-1]C-R[-2]C4*R[-2]C -> -1460 | K50: =R[-1]C-R[-2]C4*R[-2]C -> 0 | L50: =R[-1]C-R[-2]C4*R[-2]C -> 0 | M50: =R[-1]C-R[-2]C4*R[-2]C -> 0 | N50: =R[-1]C-R[-2]C4*R[-2]C -> 0 | O50: =R[-1]C-R[-2]C4*R[-2]C -> 0 | P50: =R[-1]C-R[-2]C4*R[-2]C -> 0 | Q50: =R[-1]C-R[-2]C4*R[-2]C -> 0 | R50: =R[-1]C-R[-2]C4*R[-2]C -> 0 | S50: =R[-1]C-R[-2]C4*R[-2]C -> 0 | T50: =R[-1]C-R[-2]C4*R[-2]C -> 0 | U50: =R[-1]C-R[-2]C4*R[-2]C -> 0 | V50: =R[-1]C-R[-2]C4*R[-2]C -> 0 | W50: =R[-1]C-R[-2]C4*R[-2]C -> -6570 | X50: =R[-1]C-R[-2]C4*R[-2]C -> 0 | Y50: =R[-1]C-R[-2]C4*R[-2]C -> 0 | Z50: =R[-1]C-R[-2]C4*R[-2]C -> 0 | AA50: =R[-1]C-R[-2]C4*R[-2]C -> 0 | AB50: =R[-1]C-R[-2]C4*R[-2]C -> 0 | AC50: =R[-1]C-R[-2]C4*R[-2]C -> 0 | AD50: =R[-1]C-R[-2]C4*R[-2]C -> 0 | AE50: =R[-1]C-R[-2]C4*R[-2]C -> 0 | AF50: =R[-1]C-R[-2]C4*R[-2]C -> 0 | AG50: =R[-1]C-R[-2]C4*R[-2]C -> 0 | AH50: =R[-1]C-R[-2]C4*R[-2]C -> 0 | AI50: =R[-1]C-R[-2]C4*R[-2]C -> 0 | AJ50: =R[-1]C-R[-2]C4*R[-2]C -> 0 | AK50: =R[-1]C-R[-2]C4*R[-2]C -> 0 | AL50: =R[-1]C-R[-2]C4*R[-2]C -> 0 | AM50: =R[-1]C-R[-2]C4*R[-2]C -> 0 | AN50: =R[-1]C-R[-2]C4*R[-2]C -> 0 | AO50: =R[-1]C-R[-2]C4*R[-2]C -> 0 | AP50: =R[-1]C-R[-2]C4*R[-2]C -> 0 | AQ50: =R[-1]C-R[-2]C4*R[-2]C -> 0 | AR50: =R[-1]C-R[-2]C4*R[-2]C -> 0 | AS50: =R[-1]C-R[-2]C4*R[-2]C -> 0 | AT50: =R[-1]C-R[-2]C4*R[-2]C -> 0 | AU50: =R[-1]C-R[-2]C4*R[-2]C -> 0 | AV50: =R[-1]C-R[-2]C4*R[-2]C -> 0 | AW50: =R[-1]C-R[-2]C4*R[-2]C -> 0 | AX50: =R[-1]C-R[-2]C4*R[-2]C -> 0 | AY50: =R[-1]C-R[-2]C4*R[-2]C -> 0 | AZ50: =R[-1]C-R[-2]C4*R[-2]C -> 0 | BA50: =R[-1]C-R[-2]C4*R[-2]C -> 0 | BB50: =R[-1]C-R[-2]C4*R[-2]C -> 0 | BC50: =R[-1]C-R[-2]C4*R[-2]C -> 0 | BD50: =R[-1]C-R[-2]C4*R[-2]C -> 0 | BE50: =R[-1]C-R[-2]C4*R[-2]C -> 0 | BF50: =R[-1]C-R[-2]C4*R[-2]C -> 0 | BG50: =R[-1]C-R[-2]C4*R[-2]C -> 0 | BO50: =SUM(RC[-61]:RC[-8]) -> -8030
A51: Analysis Simulation | B51: 2002-02-25T00:00:00.000 | C51: 2 | D51: 1150 | E51: 525 | F51: 0 | G51: 0 | H51: 0 | I51: 0 | J51: 0 | K51: 0 | L51: 0 | M51: 0 | N51: 0 | O51: 0 | P51: 0 | Q51: 0 | R51: 0 | S51: 0 | T51: 0 | U51: 0 | V51: 0 | W51: 0 | X51: 0 | Y51: 12 | Z51: 0 | AA51: 0 | AB51: 0 | AC51: 0 | AD51: 0 | AE51: 0 | AF51: 0 | AG51: 0 | AH51: 0 | AI51: 0 | AJ51: 0 | AK51: 0 | AL51: 0 | AM51: 0 | AN51: 0 | AO51: 0 | AP51: 0 | AQ51: 0 | AR51: 0 | AS51: 0 | AT51: 0 | AU51: 0 | AV51: 0 | AW51: 0 | AX51: 0 | AY51: 0 | AZ51: 0 | BA51: 0 | BB51: 0 | BC51: 0 | BD51: 0 | BE51: 1 | BF51: 0 | BG51: 0 | BK51: =SUM(RC[-57]:RC[-4]) -> 13 | BL51: =RC[-61]*RC[-1] -> 26
D52: Total | F52: =R[-1]C*R51C5 -> 0 | G52: =R[-1]C*R51C5 -> 0 | H52: =R[-1]C*R51C5 -> 0 | I52: =R[-1]C*R51C5 -> 0 | J52: =R[-1]C*R51C5 -> 0 | K52: =R[-1]C*R51C5 -> 0 | L52: =R[-1]C*R51C5 -> 0 | M52: =R[-1]C*R51C5 -> 0 | N52: =R[-1]C*R51C5 -> 0 | O52: =R[-1]C*R51C5 -> 0 | P52: =R[-1]C*R51C5 -> 0 | Q52: =R[-1]C*R51C5 -> 0 | R52: =R[-1]C*R51C5 -> 0 | S52: =R[-1]C*R51C5 -> 0 | T52: =R[-1]C*R51C5 -> 0 | U52: =R[-1]C*R51C5 -> 0 | V52: =R[-1]C*R51C5 -> 0 | W52: =R[-1]C*R51C5 -> 0 | X52: =R[-1]C*R51C5 -> 0 | Y52: =R[-1]C*R51C5 -> 6300 | Z52: =R[-1]C*R51C5 -> 0 | AA52: =R[-1]C*R51C5 -> 0 | AB52: =R[-1]C*R51C5 -> 0 | AC52: =R[-1]C*R51C5 -> 0 | AD52: =R[-1]C*R51C5 -> 0 | AE52: =R[-1]C*R51C5 -> 0 | AF52: =R[-1]C*R51C5 -> 0 | AG52: =R[-1]C*R51C5 -> 0 | AH52: =R[-1]C*R51C5 -> 0 | AI52: =R[-1]C*R51C5 -> 0 | AJ52: =R[-1]C*R51C5 -> 0 | AK52: =R[-1]C*R51C5 -> 0 | AL52: =R[-1]C*R51C5 -> 0 | AM52: =R[-1]C*R51C5 -> 0 | AN52: =R[-1]C*R51C5 -> 0 | AO52: =R[-1]C*R51C5 -> 0 | AP52: =R[-1]C*R51C5 -> 0 | AQ52: =R[-1]C*R51C5 -> 0 | AR52: =R[-1]C*R51C5 -> 0 | AS52: =R[-1]C*R51C5 -> 0 | AT52: =R[-1]C*R51C5 -> 0 | AU52: =R[-1]C*R51C5 -> 0 | AV52: =R[-1]C*R51C5 -> 0 | AW52: =R[-1]C*R51C5 -> 0 | AX52: =R[-1]C*R51C5 -> 0 | AY52: =R[-1]C*R51C5 -> 0 | AZ52: =R[-1]C*R51C5 -> 0 | BA52: =R[-1]C*R51C5 -> 0 | BB52: =R[-1]C*R51C5 -> 0 | BC52: =R[-1]C*R51C5 -> 0 | BD52: =R[-1]C*R51C5 -> 0 | BE52: =R[-1]C*R51C5 -> 525 | BF52: =R[-1]C*R51C5 -> 0 | BG52: =R[-1]C*R51C5 -> 0 | BM52: =R[-1]C[-61]*R[-1]C[-2] -> 14950 | BN52: =RC[-1]-RC[1] -> 8125 | BO52: =SUM(RC[-61]:RC[-8]) -> 6825
D53: Total Savings | F53: =R[-1]C-R[-2]C4*R[-2]C -> 0 | G53: =R[-1]C-R[-2]C4*R[-2]C -> 0 | H53: =R[-1]C-R[-2]C4*R[-2]C -> 0 | I53: =R[-1]C-R[-2]C4*R[-2]C -> 0 | J53: =R[-1]C-R[-2]C4*R[-2]C -> 0 | K53: =R[-1]C-R[-2]C4*R[-2]C -> 0 | L53: =R[-1]C-R[-2]C4*R[-2]C -> 0 | M53: =R[-1]C-R[-2]C4*R[-2]C -> 0 | N53: =R[-1]C-R[-2]C4*R[-2]C -> 0 | O53: =R[-1]C-R[-2]C4*R[-2]C -> 0 | P53: =R[-1]C-R[-2]C4*R[-2]C -> 0 | Q53: =R[-1]C-R[-2]C4*R[-2]C -> 0 | R53: =R[-1]C-R[-2]C4*R[-2]C -> 0 | S53: =R[-1]C-R[-2]C4*R[-2]C -> 0 | T53: =R[-1]C-R[-2]C4*R[-2]C -> 0 | U53: =R[-1]C-R[-2]C4*R[-2]C -> 0 | V53: =R[-1]C-R[-2]C4*R[-2]C -> 0 | W53: =R[-1]C-R[-2]C4*R[-2]C -> 0 | X53: =R[-1]C-R[-2]C4*R[-2]C -> 0 | Y53: =R[-1]C-R[-2]C4*R[-2]C -> -7500 | Z53: =R[-1]C-R[-2]C4*R[-2]C -> 0 | AA53: =R[-1]C-R[-2]C4*R[-2]C -> 0 | AB53: =R[-1]C-R[-2]C4*R[-2]C -> 0 | AC53: =R[-1]C-R[-2]C4*R[-2]C -> 0 | AD53: =R[-1]C-R[-2]C4*R[-2]C -> 0 | AE53: =R[-1]C-R[-2]C4*R[-2]C -> 0 | AF53: =R[-1]C-R[-2]C4*R[-2]C -> 0 | AG53: =R[-1]C-R[-2]C4*R[-2]C -> 0 | AH53: =R[-1]C-R[-2]C4*R[-2]C -> 0 | AI53: =R[-1]C-R[-2]C4*R[-2]C -> 0 | AJ53: =R[-1]C-R[-2]C4*R[-2]C -> 0 | AK53: =R[-1]C-R[-2]C4*R[-2]C -> 0 | AL53: =R[-1]C-R[-2]C4*R[-2]C -> 0 | AM53: =R[-1]C-R[-2]C4*R[-2]C -> 0 | AN53: =R[-1]C-R[-2]C4*R[-2]C -> 0 | AO53: =R[-1]C-R[-2]C4*R[-2]C -> 0 | AP53: =R[-1]C-R[-2]C4*R[-2]C -> 0 | AQ53: =R[-1]C-R[-2]C4*R[-2]C -> 0 | AR53: =R[-1]C-R[-2]C4*R[-2]C -> 0 | AS53: =R[-1]C-R[-2]C4*R[-2]C -> 0 | AT53: =R[-1]C-R[-2]C4*R[-2]C -> 0 | AU53: =R[-1]C-R[-2]C4*R[-2]C -> 0 | AV53: =R[-1]C-R[-2]C4*R[-2]C -> 0 | AW53: =R[-1]C-R[-2]C4*R[-2]C -> 0 | AX53: =R[-1]C-R[-2]C4*R[-2]C -> 0 | AY53: =R[-1]C-R[-2]C4*R[-2]C -> 0 | AZ53: =R[-1]C-R[-2]C4*R[-2]C -> 0 | BA53: =R[-1]C-R[-2]C4*R[-2]C -> 0 | BB53: =R[-1]C-R[-2]C4*R[-2]C -> 0 | BC53: =R[-1]C-R[-2]C4*R[-2]C -> 0 | BD53: =R[-1]C-R[-2]C4*R[-2]C -> 0 | BE53: =R[-1]C-R[-2]C4*R[-2]C -> -625 | BF53: =R[-1]C-R[-2]C4*R[-2]C -> 0 | BG53: =R[-1]C-R[-2]C4*R[-2]C -> 0 | BO53: =SUM(RC[-61]:RC[-8]) -> -8125
A54: Logical Data Modeling Using Erwin 4.0 | B54: 2002-02-26T00:00:00.000 | C54: 3 | D54: 2200 | E54: 999 | F54: 0 | G54: 0 | H54: 0 | I54: 0 | J54: 2 | K54: 0 | L54: 0 | M54: 0 | N54: 0 | O54: 0 | P54: 0 | Q54: 0 | R54: 0 | S54: 0 | T54: 0 | U54: 0 | V54: 0 | W54: 0 | X54: 0 | Y54: 0 | Z54: 0 | AA54: 0 | AB54: 0 | AC54: 0 | AD54: 0 | AE54: 3 | AF54: 0 | AG54: 0 | AH54: 0 | AI54: 0 | AJ54: 5 | AK54: 0 | AL54: 0 | AM54: 0 | AN54: 0 | AO54: 0 | AP54: 0 | AQ54: 0 | AR54: 0 | AS54: 0 | AT54: 0 | AU54: 0 | AV54: 0 | AW54: 0 | AX54: 0 | AY54: 0 | AZ54: 0 | BA54: 0 | BB54: 0 | BC54: 0 | BD54: 0 | BE54: 0 | BF54: 0 | BG54: 0 | BK54: =SUM(RC[-57]:RC[-4]) -> 10 | BL54: =RC[-61]*RC[-1] -> 30
D55: Total | F55: =R[-1]C*R54C5 -> 0 | G55: =R[-1]C*R54C5 -> 0 | H55: =R[-1]C*R54C5 -> 0 | I55: =R[-1]C*R54C5 -> 0 | J55: =R[-1]C*R54C5 -> 1998 | K55: =R[-1]C*R54C5 -> 0 | L55: =R[-1]C*R54C5 -> 0 | M55: =R[-1]C*R54C5 -> 0 | N55: =R[-1]C*R54C5 -> 0 | O55: =R[-1]C*R54C5 -> 0 | P55: =R[-1]C*R54C5 -> 0 | Q55: =R[-1]C*R54C5 -> 0 | R55: =R[-1]C*R54C5 -> 0 | S55: =R[-1]C*R54C5 -> 0 | T55: =R[-1]C*R54C5 -> 0 | U55: =R[-1]C*R54C5 -> 0 | V55: =R[-1]C*R54C5 -> 0 | W55: =R[-1]C*R54C5 -> 0 | X55: =R[-1]C*R54C5 -> 0 | Y55: =R[-1]C*R54C5 -> 0 | Z55: =R[-1]C*R54C5 -> 0 | AA55: =R[-1]C*R54C5 -> 0 | AB55: =R[-1]C*R54C5 -> 0 | AC55: =R[-1]C*R54C5 -> 0 | AD55: =R[-1]C*R54C5 -> 0 | AE55: =R[-1]C*R54C5 -> 2997 | AF55: =R[-1]C*R54C5 -> 0 | AG55: =R[-1]C*R54C5 -> 0 | AH55: =R[-1]C*R54C5 -> 0 | AI55: =R[-1]C*R54C5 -> 0 | AJ55: =R[-1]C*R54C5 -> 4995 | AK55: =R[-1]C*R54C5 -> 0 | AL55: =R[-1]C*R54C5 -> 0 | AM55: =R[-1]C*R54C5 -> 0 | AN55: =R[-1]C*R54C5 -> 0 | AO55: =R[-1]C*R54C5 -> 0 | AP55: =R[-1]C*R54C5 -> 0 | AQ55: =R[-1]C*R54C5 -> 0 | AR55: =R[-1]C*R54C5 -> 0 | AS55: =R[-1]C*R54C5 -> 0 | AT55: =R[-1]C*R54C5 -> 0 | AU55: =R[-1]C*R54C5 -> 0 | AV55: =R[-1]C*R54C5 -> 0 | AW55: =R[-1]C*R54C5 -> 0 | AX55: =R[-1]C*R54C5 -> 0 | AY55: =R[-1]C*R54C5 -> 0 | AZ55: =R[-1]C*R54C5 -> 0 | BA55: =R[-1]C*R54C5 -> 0 | BB55: =R[-1]C*R54C5 -> 0 | BC55: =R[-1]C*R54C5 -> 0 | BD55: =R[-1]C*R54C5 -> 0 | BE55: =R[-1]C*R54C5 -> 0 | BF55: =R[-1]C*R54C5 -> 0 | BG55: =R[-1]C*R54C5 -> 0 | BM55: =R[-1]C[-61]*R[-1]C[-2] -> 22000 | BN55: =RC[-1]-RC[1] -> 12010 | BO55: =SUM(RC[-61]:RC[-8]) -> 9990
D56: Total Savings | F56: =R[-1]C-R[-2]C4*R[-2]C -> 0 | G56: =R[-1]C-R[-2]C4*R[-2]C -> 0 | H56: =R[-1]C-R[-2]C4*R[-2]C -> 0 | I56: =R[-1]C-R[-2]C4*R[-2]C -> 0 | J56: =R[-1]C-R[-2]C4*R[-2]C -> -2402 | K56: =R[-1]C-R[-2]C4*R[-2]C -> 0 | L56: =R[-1]C-R[-2]C4*R[-2]C -> 0 | M56: =R[-1]C-R[-2]C4*R[-2]C -> 0 | N56: =R[-1]C-R[-2]C4*R[-2]C -> 0 | O56: =R[-1]C-R[-2]C4*R[-2]C -> 0 | P56: =R[-1]C-R[-2]C4*R[-2]C -> 0 | Q56: =R[-1]C-R[-2]C4*R[-2]C -> 0 | R56: =R[-1]C-R[-2]C4*R[-2]C -> 0 | S56: =R[-1]C-R[-2]C4*R[-2]C -> 0 | T56: =R[-1]C-R[-2]C4*R[-2]C -> 0 | U56: =R[-1]C-R[-2]C4*R[-2]C -> 0 | V56: =R[-1]C-R[-2]C4*R[-2]C -> 0 | W56: =R[-1]C-R[-2]C4*R[-2]C -> 0 | X56: =R[-1]C-R[-2]C4*R[-2]C -> 0 | Y56: =R[-1]C-R[-2]C4*R[-2]C -> 0 | Z56: =R[-1]C-R[-2]C4*R[-2]C -> 0 | AA56: =R[-1]C-R[-2]C4*R[-2]C -> 0 | AB56: =R[-1]C-R[-2]C4*R[-2]C -> 0 | AC56: =R[-1]C-R[-2]C4*R[-2]C -> 0 | AD56: =R[-1]C-R[-2]C4*R[-2]C -> 0 | AE56: =R[-1]C-R[-2]C4*R[-2]C -> -3603 | AF56: =R[-1]C-R[-2]C4*R[-2]C -> 0 | AG56: =R[-1]C-R[-2]C4*R[-2]C -> 0 | AH56: =R[-1]C-R[-2]C4*R[-2]C -> 0 | AI56: =R[-1]C-R[-2]C4*R[-2]C -> 0 | AJ56: =R[-1]C-R[-2]C4*R[-2]C -> -6005 | AK56: =R[-1]C-R[-2]C4*R[-2]C -> 0 | AL56: =R[-1]C-R[-2]C4*R[-2]C -> 0 | AM56: =R[-1]C-R[-2]C4*R[-2]C -> 0 | AN56: =R[-1]C-R[-2]C4*R[-2]C -> 0 | AO56: =R[-1]C-R[-2]C4*R[-2]C -> 0 | AP56: =R[-1]C-R[-2]C4*R[-2]C -> 0 | AQ56: =R[-1]C-R[-2]C4*R[-2]C -> 0 | AR56: =R[-1]C-R[-2]C4*R[-2]C -> 0 | AS56: =R[-1]C-R[-2]C4*R[-2]C -> 0 | AT56: =R[-1]C-R[-2]C4*R[-2]C -> 0 | AU56: =R[-1]C-R[-2]C4*R[-2]C -> 0 | AV56: =R[-1]C-R[-2]C4*R[-2]C -> 0 | AW56: =R[-1]C-R[-2]C4*R[-2]C -> 0 | AX56: =R[-1]C-R[-2]C4*R[-2]C -> 0 | AY56: =R[-1]C-R[-2]C4*R[-2]C -> 0 | AZ56: =R[-1]C-R[-2]C4*R[-2]C -> 0 | BA56: =R[-1]C-R[-2]C4*R[-2]C -> 0 | BB56: =R[-1]C-R[-2]C4*R[-2]C -> 0 | BC56: =R[-1]C-R[-2]C4*R[-2]C -> 0 | BD56: =R[-1]C-R[-2]C4*R[-2]C -> 0 | BE56: =R[-1]C-R[-2]C4*R[-2]C -> 0 | BF56: =R[-1]C-R[-2]C4*R[-2]C -> 0 | BG56: =R[-1]C-R[-2]C4*R[-2]C -> 0 | BO56: =SUM(RC[-61]:RC[-8]) -> -12010
A57: VB 6.0 Intermediate - Database Programming | B57: 2002-03-04T00:00:00.000 | C57: 2 | D57: 1195 | E57: 350 | F57: 0 | G57: 0 | H57: 0 | I57: 0 | J57: 9 | K57: 1 | L57: 0 | M57: 0 | N57: 0 | O57: 0 | P57: 0 | Q57: 0 | R57: 0 | S57: 0 | T57: 0 | U57: 0 | V57: 0 | W57: 0 | X57: 0 | Y57: 0 | Z57: 0 | AA57: 0 | AB57: 0 | AC57: 0 | AD57: 0 | AE57: 0 | AF57: 1 | AG57: 0 | AH57: 0 | AI57: 0 | AJ57: 0 | AK57: 0 | AL57: 0 | AM57: 0 | AN57: 0 | AO57: 0 | AP57: 0 | AQ57: 0 | AR57: 0 | AS57: 0 | AT57: 0 | AU57: 0 | AV57: 0 | AW57: 0 | AX57: 0 | AY57: 0 | AZ57: 0 | BA57: 0 | BB57: 0 | BC57: 0 | BD57: 0 | BE57: 0 | BF57: 0 | BG57: 0 | BK57: =SUM(RC[-57]:RC[-4]) -> 11 | BL57: =RC[-61]*RC[-1] -> 22
D58: Total | F58: =R[-1]C*R57C5 -> 0 | G58: =R[-1]C*R57C5 -> 0 | H58: =R[-1]C*R57C5 -> 0 | I58: =R[-1]C*R57C5 -> 0 | J58: =R[-1]C*R57C5 -> 3150 | K58: =R[-1]C*R57C5 -> 350 | L58: =R[-1]C*R57C5 -> 0 | M58: =R[-1]C*R57C5 -> 0 | N58: =R[-1]C*R57C5 -> 0 | O58: =R[-1]C*R57C5 -> 0 | P58: =R[-1]C*R57C5 -> 0 | Q58: =R[-1]C*R57C5 -> 0 | R58: =R[-1]C*R57C5 -> 0 | S58: =R[-1]C*R57C5 -> 0 | T58: =R[-1]C*R57C5 -> 0 | U58: =R[-1]C*R57C5 -> 0 | V58: =R[-1]C*R57C5 -> 0 | W58: =R[-1]C*R57C5 -> 0 | X58: =R[-1]C*R57C5 -> 0 | Y58: =R[-1]C*R57C5 -> 0 | Z58: =R[-1]C*R57C5 -> 0 | AA58: =R[-1]C*R57C5 -> 0 | AB58: =R[-1]C*R57C5 -> 0 | AC58: =R[-1]C*R57C5 -> 0 | AD58: =R[-1]C*R57C5 -> 0 | AE58: =R[-1]C*R57C5 -> 0 | AF58: =R[-1]C*R57C5 -> 350 | AG58: =R[-1]C*R57C5 -> 0 | AH58: =R[-1]C*R57C5 -> 0 | AI58: =R[-1]C*R57C5 -> 0 | AJ58: =R[-1]C*R57C5 -> 0 | AK58: =R[-1]C*R57C5 -> 0 | AL58: =R[-1]C*R57C5 -> 0 | AM58: =R[-1]C*R57C5 -> 0 | AN58: =R[-1]C*R57C5 -> 0 | AO58: =R[-1]C*R57C5 -> 0 | AP58: =R[-1]C*R57C5 -> 0 | AQ58: =R[-1]C*R57C5 -> 0 | AR58: =R[-1]C*R57C5 -> 0 | AS58: =R[-1]C*R57C5 -> 0 | AT58: =R[-1]C*R57C5 -> 0 | AU58: =R[-1]C*R57C5 -> 0 | AV58: =R[-1]C*R57C5 -> 0 | AW58: =R[-1]C*R57C5 -> 0 | AX58: =R[-1]C*R57C5 -> 0 | AY58: =R[-1]C*R57C5 -> 0 | AZ58: =R[-1]C*R57C5 -> 0 | BA58: =R[-1]C*R57C5 -> 0 | BB58: =R[-1]C*R57C5 -> 0 | BC58: =R[-1]C*R57C5 -> 0 | BD58: =R[-1]C*R57C5 -> 0 | BE58: =R[-1]C*R57C5 -> 0 | BF58: =R[-1]C*R57C5 -> 0 | BG58: =R[-1]C*R57C5 -> 0 | BM58: =R[-1]C[-61]*R[-1]C[-2] -> 13145 | BN58: =RC[-1]-RC[1] -> 9295 | BO58: =SUM(RC[-61]:RC[-8]) -> 3850
D59: Total Savings | F59: =R[-1]C-R[-2]C4*R[-2]C -> 0 | G59: =R[-1]C-R[-2]C4*R[-2]C -> 0 | H59: =R[-1]C-R[-2]C4*R[-2]C -> 0 | I59: =R[-1]C-R[-2]C4*R[-2]C -> 0 | J59: =R[-1]C-R[-2]C4*R[-2]C -> -7605 | K59: =R[-1]C-R[-2]C4*R[-2]C -> -845 | L59: =R[-1]C-R[-2]C4*R[-2]C -> 0 | M59: =R[-1]C-R[-2]C4*R[-2]C -> 0 | N59: =R[-1]C-R[-2]C4*R[-2]C -> 0 | O59: =R[-1]C-R[-2]C4*R[-2]C -> 0 | P59: =R[-1]C-R[-2]C4*R[-2]C -> 0 | Q59: =R[-1]C-R[-2]C4*R[-2]C -> 0 | R59: =R[-1]C-R[-2]C4*R[-2]C -> 0 | S59: =R[-1]C-R[-2]C4*R[-2]C -> 0 | T59: =R[-1]C-R[-2]C4*R[-2]C -> 0 | U59: =R[-1]C-R[-2]C4*R[-2]C -> 0 | V59: =R[-1]C-R[-2]C4*R[-2]C -> 0 | W59: =R[-1]C-R[-2]C4*R[-2]C -> 0 | X59: =R[-1]C-R[-2]C4*R[-2]C -> 0 | Y59: =R[-1]C-R[-2]C4*R[-2]C -> 0 | Z59: =R[-1]C-R[-2]C4*R[-2]C -> 0 | AA59: =R[-1]C-R[-2]C4*R[-2]C -> 0 | AB59: =R[-1]C-R[-2]C4*R[-2]C -> 0 | AC59: =R[-1]C-R[-2]C4*R[-2]C -> 0 | AD59: =R[-1]C-R[-2]C4*R[-2]C -> 0 | AE59: =R[-1]C-R[-2]C4*R[-2]C -> 0 | AF59: =R[-1]C-R[-2]C4*R[-2]C -> -845 | AG59: =R[-1]C-R[-2]C4*R[-2]C -> 0 | AH59: =R[-1]C-R[-2]C4*R[-2]C -> 0 | AI59: =R[-1]C-R[-2]C4*R[-2]C -> 0 | AJ59: =R[-1]C-R[-2]C4*R[-2]C -> 0 | AK59: =R[-1]C-R[-2]C4*R[-2]C -> 0 | AL59: =R[-1]C-R[-2]C4*R[-2]C -> 0 | AM59: =R[-1]C-R[-2]C4*R[-2]C -> 0 | AN59: =R[-1]C-R[-2]C4*R[-2]C -> 0 | AO59: =R[-1]C-R[-2]C4*R[-2]C -> 0 | AP59: =R[-1]C-R[-2]C4*R[-2]C -> 0 | AQ59: =R[-1]C-R[-2]C4*R[-2]C -> 0 | AR59: =R[-1]C-R[-2]C4*R[-2]C -> 0 | AS59: =R[-1]C-R[-2]C4*R[-2]C -> 0 | AT59: =R[-1]C-R[-2]C4*R[-2]C -> 0 | AU59: =R[-1]C-R[-2]C4*R[-2]C -> 0 | AV59: =R[-1]C-R[-2]C4*R[-2]C -> 0 | AW59: =R[-1]C-R[-2]C4*R[-2]C -> 0 | AX59: =R[-1]C-R[-2]C4*R[-2]C -> 0 | AY59: =R[-1]C-R[-2]C4*R[-2]C -> 0 | AZ59: =R[-1]C-R[-2]C4*R[-2]C -> 0 | BA59: =R[-1]C-R[-2]C4*R[-2]C -> 0 | BB59: =R[-1]C-R[-2]C4*R[-2]C -> 0 | BC59: =R[-1]C-R[-2]C4*R[-2]C -> 0 | BD59: =R[-1]C-R[-2]C4*R[-2]C -> 0 | BE59: =R[-1]C-R[-2]C4*R[-2]C -> 0 | BF59: =R[-1]C-R[-2]C4*R[-2]C -> 0 | BG59: =R[-1]C-R[-2]C4*R[-2]C -> 0 | BO59: =SUM(RC[-61]:RC[-8]) -> -9295
A60: PERL Fundamentals | B60: 2002-03-04T00:00:00.000 | C60: 3 | D60: 1500 | E60: 660 | F60: 1 | G60: 0 | H60: 0 | I60: 0 | J60: 0 | K60: 0 | L60: 0 | M60: 0 | N60: 0 | O60: 0 | P60: 0 | Q60: 0 | R60: 0 | S60: 0 | T60: 0 | U60: 0 | V60: 0 | W60: 0 | X60: 0 | Y60: 0 | Z60: 0 | AA60: 0 | AB60: 0 | AC60: 0 | AD60: 0 | AE60: 0 | AF60: 0 | AG60: 0 | AH60: 0 | AI60: 3 | AJ60: 0 | AK60: 0 | AL60: 0 | AM60: 0 | AN60: 0 | AO60: 0 | AP60: 0 | AQ60: 0 | AR60: 0 | AS60: 0 | AT60: 0 | AU60: 0 | AV60: 0 | AW60: 0 | AX60: 0 | AY60: 0 | AZ60: 0 | BA60: 0 | BB60: 0 | BC60: 0 | BD60: 0 | BE60: 0 | BF60: 0 | BG60: 2 | BK60: =SUM(RC[-57]:RC[-4]) -> 6 | BL60: =RC[-61]*RC[-1] -> 18
D61: Total | F61: =R[-1]C*R60C5 -> 660 | G61: =R[-1]C*R60C5 -> 0 | H61: =R[-1]C*R60C5 -> 0 | I61: =R[-1]C*R60C5 -> 0 | J61: =R[-1]C*R60C5 -> 0 | K61: =R[-1]C*R60C5 -> 0 | L61: =R[-1]C*R60C5 -> 0 | M61: =R[-1]C*R60C5 -> 0 | N61: =R[-1]C*R60C5 -> 0 | O61: =R[-1]C*R60C5 -> 0 | P61: =R[-1]C*R60C5 -> 0 | Q61: =R[-1]C*R60C5 -> 0 | R61: =R[-1]C*R60C5 -> 0 | S61: =R[-1]C*R60C5 -> 0 | T61: =R[-1]C*R60C5 -> 0 | U61: =R[-1]C*R60C5 -> 0 | V61: =R[-1]C*R60C5 -> 0 | W61: =R[-1]C*R60C5 -> 0 | X61: =R[-1]C*R60C5 -> 0 | Y61: =R[-1]C*R60C5 -> 0 | Z61: =R[-1]C*R60C5 -> 0 | AA61: =R[-1]C*R60C5 -> 0 | AB61: =R[-1]C*R60C5 -> 0 | AC61: =R[-1]C*R60C5 -> 0 | AD61: =R[-1]C*R60C5 -> 0 | AE61: =R[-1]C*R60C5 -> 0 | AF61: =R[-1]C*R60C5 -> 0 | AG61: =R[-1]C*R60C5 -> 0 | AH61: =R[-1]C*R60C5 -> 0 | AI61: =R[-1]C*R60C5 -> 1980 | AJ61: =R[-1]C*R60C5 -> 0 | AK61: =R[-1]C*R60C5 -> 0 | AL61: =R[-1]C*R60C5 -> 0 | AM61: =R[-1]C*R60C5 -> 0 | AN61: =R[-1]C*R60C5 -> 0 | AO61: =R[-1]C*R60C5 -> 0 | AP61: =R[-1]C*R60C5 -> 0 | AQ61: =R[-1]C*R60C5 -> 0 | AR61: =R[-1]C*R60C5 -> 0 | AS61: =R[-1]C*R60C5 -> 0 | AT61: =R[-1]C*R60C5 -> 0 | AU61: =R[-1]C*R60C5 -> 0 | AV61: =R[-1]C*R60C5 -> 0 | AW61: =R[-1]C*R60C5 -> 0 | AX61: =R[-1]C*R60C5 -> 0 | AY61: =R[-1]C*R60C5 -> 0 | AZ61: =R[-1]C*R60C5 -> 0 | BA61: =R[-1]C*R60C5 -> 0 | BB61: =R[-1]C*R60C5 -> 0 | BC61: =R[-1]C*R60C5 -> 0 | BD61: =R[-1]C*R60C5 -> 0 | BE61: =R[-1]C*R60C5 -> 0 | BF61: =R[-1]C*R60C5 -> 0 | BG61: =R[-1]C*R60C5 -> 1320 | BM61: =R[-1]C[-61]*R[-1]C[-2] -> 9000 | BN61: =RC[-1]-RC[1] -> 5040 | BO61: =SUM(RC[-61]:RC[-8]) -> 3960
D62: Total Savings | F62: =R[-1]C-R[-2]C4*R[-2]C -> -840 | G62: =R[-1]C-R[-2]C4*R[-2]C -> 0 | H62: =R[-1]C-R[-2]C4*R[-2]C -> 0 | I62: =R[-1]C-R[-2]C4*R[-2]C -> 0 | J62: =R[-1]C-R[-2]C4*R[-2]C -> 0 | K62: =R[-1]C-R[-2]C4*R[-2]C -> 0 | L62: =R[-1]C-R[-2]C4*R[-2]C -> 0 | M62: =R[-1]C-R[-2]C4*R[-2]C -> 0 | N62: =R[-1]C-R[-2]C4*R[-2]C -> 0 | O62: =R[-1]C-R[-2]C4*R[-2]C -> 0 | P62: =R[-1]C-R[-2]C4*R[-2]C -> 0 | Q62: =R[-1]C-R[-2]C4*R[-2]C -> 0 | R62: =R[-1]C-R[-2]C4*R[-2]C -> 0 | S62: =R[-1]C-R[-2]C4*R[-2]C -> 0 | T62: =R[-1]C-R[-2]C4*R[-2]C -> 0 | U62: =R[-1]C-R[-2]C4*R[-2]C -> 0 | V62: =R[-1]C-R[-2]C4*R[-2]C -> 0 | W62: =R[-1]C-R[-2]C4*R[-2]C -> 0 | X62: =R[-1]C-R[-2]C4*R[-2]C -> 0 | Y62: =R[-1]C-R[-2]C4*R[-2]C -> 0 | Z62: =R[-1]C-R[-2]C4*R[-2]C -> 0 | AA62: =R[-1]C-R[-2]C4*R[-2]C -> 0 | AB62: =R[-1]C-R[-2]C4*R[-2]C -> 0 | AC62: =R[-1]C-R[-2]C4*R[-2]C -> 0 | AD62: =R[-1]C-R[-2]C4*R[-2]C -> 0 | AE62: =R[-1]C-R[-2]C4*R[-2]C -> 0 | AF62: =R[-1]C-R[-2]C4*R[-2]C -> 0 | AG62: =R[-1]C-R[-2]C4*R[-2]C -> 0 | AH62: =R[-1]C-R[-2]C4*R[-2]C -> 0 | AI62: =R[-1]C-R[-2]C4*R[-2]C -> -2520 | AJ62: =R[-1]C-R[-2]C4*R[-2]C -> 0 | AK62: =R[-1]C-R[-2]C4*R[-2]C -> 0 | AL62: =R[-1]C-R[-2]C4*R[-2]C -> 0 | AM62: =R[-1]C-R[-2]C4*R[-2]C -> 0 | AN62: =R[-1]C-R[-2]C4*R[-2]C -> 0 | AO62: =R[-1]C-R[-2]C4*R[-2]C -> 0 | AP62: =R[-1]C-R[-2]C4*R[-2]C -> 0 | AQ62: =R[-1]C-R[-2]C4*R[-2]C -> 0 | AR62: =R[-1]C-R[-2]C4*R[-2]C -> 0 | AS62: =R[-1]C-R[-2]C4*R[-2]C -> 0 | AT62: =R[-1]C-R[-2]C4*R[-2]C -> 0 | AU62: =R[-1]C-R[-2]C4*R[-2]C -> 0 | AV62: =R[-1]C-R[-2]C4*R[-2]C -> 0 | AW62: =R[-1]C-R[-2]C4*R[-2]C -> 0 | AX62: =R[-1]C-R[-2]C4*R[-2]C -> 0 | AY62: =R[-1]C-R[-2]C4*R[-2]C -> 0 | AZ62: =R[-1]C-R[-2]C4*R[-2]C -> 0 | BA62: =R[-1]C-R[-2]C4*R[-2]C -> 0 | BB62: =R[-1]C-R[-2]C4*R[-2]C -> 0 | BC62: =R[-1]C-R[-2]C4*R[-2]C -> 0 | BD62: =R[-1]C-R[-2]C4*R[-2]C -> 0 | BE62: =R[-1]C-R[-2]C4*R[-2]C -> 0 | BF62: =R[-1]C-R[-2]C4*R[-2]C -> 0 | BG62: =R[-1]C-R[-2]C4*R[-2]C -> -1680 | BO62: =SUM(RC[-61]:RC[-8]) -> -5040
A63: Introduction to TSO/ISPF | B63: 2002-03-05T00:00:00.000 | C63: 1 | D63: 550 | E63: 225 | F63: 0 | G63: 0 | H63: 0 | I63: 0 | J63: 0 | K63: 3 | L63: 0 | M63: 0 | N63: 0 | O63: 0 | P63: 0 | Q63: 0 | R63: 0 | S63: 0 | T63: 0 | U63: 0 | V63: 0 | W63: 0 | X63: 4 | Y63: 0 | Z63: 0 | AA63: 0 | AB63: 0 | AC63: 0 | AD63: 0 | AE63: 0 | AF63: 2 | AG63: 0 | AH63: 0 | AI63: 0 | AJ63: 0 | AK63: 0 | AL63: 0 | AM63: 0 | AN63: 0 | AO63: 0 | AP63: 0 | AQ63: 0 | AR63: 0 | AS63: 0 | AT63: 0 | AU63: 0 | AV63: 0 | AW63: 0 | AX63: 0 | AY63: 0 | AZ63: 0 | BA63: 0 | BB63: 0 | BC63: 0 | BD63: 0 | BE63: 0 | BF63: 0 | BG63: 0 | BK63: =SUM(RC[-57]:RC[-4]) -> 9 | BL63: =RC[-61]*RC[-1] -> 9
D64: Total | F64: =R[-1]C*R63C5 -> 0 | G64: =R[-1]C*R63C5 -> 0 | H64: =R[-1]C*R63C5 -> 0 | I64: =R[-1]C*R63C5 -> 0 | J64: =R[-1]C*R63C5 -> 0 | K64: =R[-1]C*R63C5 -> 675 | L64: =R[-1]C*R63C5 -> 0 | M64: =R[-1]C*R63C5 -> 0 | N64: =R[-1]C*R63C5 -> 0 | O64: =R[-1]C*R63C5 -> 0 | P64: =R[-1]C*R63C5 -> 0 | Q64: =R[-1]C*R63C5 -> 0 | R64: =R[-1]C*R63C5 -> 0 | S64: =R[-1]C*R63C5 -> 0 | T64: =R[-1]C*R63C5 -> 0 | U64: =R[-1]C*R63C5 -> 0 | V64: =R[-1]C*R63C5 -> 0 | W64: =R[-1]C*R63C5 -> 0 | X64: =R[-1]C*R63C5 -> 900 | Y64: =R[-1]C*R63C5 -> 0 | Z64: =R[-1]C*R63C5 -> 0 | AA64: =R[-1]C*R63C5 -> 0 | AB64: =R[-1]C*R63C5 -> 0 | AC64: =R[-1]C*R63C5 -> 0 | AD64: =R[-1]C*R63C5 -> 0 | AE64: =R[-1]C*R63C5 -> 0 | AF64: =R[-1]C*R63C5 -> 450 | AG64: =R[-1]C*R63C5 -> 0 | AH64: =R[-1]C*R63C5 -> 0 | AI64: =R[-1]C*R63C5 -> 0 | AJ64: =R[-1]C*R63C5 -> 0 | AK64: =R[-1]C*R63C5 -> 0 | AL64: =R[-1]C*R63C5 -> 0 | AM64: =R[-1]C*R63C5 -> 0 | AN64: =R[-1]C*R63C5 -> 0 | AO64: =R[-1]C*R63C5 -> 0 | AP64: =R[-1]C*R63C5 -> 0 | AQ64: =R[-1]C*R63C5 -> 0 | AR64: =R[-1]C*R63C5 -> 0 | AS64: =R[-1]C*R63C5 -> 0 | AT64: =R[-1]C*R63C5 -> 0 | AU64: =R[-1]C*R63C5 -> 0 | AV64: =R[-1]C*R63C5 -> 0 | AW64: =R[-1]C*R63C5 -> 0 | AX64: =R[-1]C*R63C5 -> 0 | AY64: =R[-1]C*R63C5 -> 0 | AZ64: =R[-1]C*R63C5 -> 0 | BA64: =R[-1]C*R63C5 -> 0 | BB64: =R[-1]C*R63C5 -> 0 | BC64: =R[-1]C*R63C5 -> 0 | BD64: =R[-1]C*R63C5 -> 0 | BE64: =R[-1]C*R63C5 -> 0 | BF64: =R[-1]C*R63C5 -> 0 | BG64: =R[-1]C*R63C5 -> 0 | BM64: =R[-1]C[-61]*R[-1]C[-2] -> 4950 | BN64: =RC[-1]-RC[1] -> 2925 | BO64: =SUM(RC[-61]:RC[-8]) -> 2025
D65: Total Savings | F65: =R[-1]C-R[-2]C4*R[-2]C -> 0 | G65: =R[-1]C-R[-2]C4*R[-2]C -> 0 | H65: =R[-1]C-R[-2]C4*R[-2]C -> 0 | I65: =R[-1]C-R[-2]C4*R[-2]C -> 0 | J65: =R[-1]C-R[-2]C4*R[-2]C -> 0 | K65: =R[-1]C-R[-2]C4*R[-2]C -> -975 | L65: =R[-1]C-R[-2]C4*R[-2]C -> 0 | M65: =R[-1]C-R[-2]C4*R[-2]C -> 0 | N65: =R[-1]C-R[-2]C4*R[-2]C -> 0 | O65: =R[-1]C-R[-2]C4*R[-2]C -> 0 | P65: =R[-1]C-R[-2]C4*R[-2]C -> 0 | Q65: =R[-1]C-R[-2]C4*R[-2]C -> 0 | R65: =R[-1]C-R[-2]C4*R[-2]C -> 0 | S65: =R[-1]C-R[-2]C4*R[-2]C -> 0 | T65: =R[-1]C-R[-2]C4*R[-2]C -> 0 | U65: =R[-1]C-R[-2]C4*R[-2]C -> 0 | V65: =R[-1]C-R[-2]C4*R[-2]C -> 0 | W65: =R[-1]C-R[-2]C4*R[-2]C -> 0 | X65: =R[-1]C-R[-2]C4*R[-2]C -> -1300 | Y65: =R[-1]C-R[-2]C4*R[-2]C -> 0 | Z65: =R[-1]C-R[-2]C4*R[-2]C -> 0 | AA65: =R[-1]C-R[-2]C4*R[-2]C -> 0 | AB65: =R[-1]C-R[-2]C4*R[-2]C -> 0 | AC65: =R[-1]C-R[-2]C4*R[-2]C -> 0 | AD65: =R[-1]C-R[-2]C4*R[-2]C -> 0 | AE65: =R[-1]C-R[-2]C4*R[-2]C -> 0 | AF65: =R[-1]C-R[-2]C4*R[-2]C -> -650 | AG65: =R[-1]C-R[-2]C4*R[-2]C -> 0 | AH65: =R[-1]C-R[-2]C4*R[-2]C -> 0 | AI65: =R[-1]C-R[-2]C4*R[-2]C -> 0 | AJ65: =R[-1]C-R[-2]C4*R[-2]C -> 0 | AK65: =R[-1]C-R[-2]C4*R[-2]C -> 0 | AL65: =R[-1]C-R[-2]C4*R[-2]C -> 0 | AM65: =R[-1]C-R[-2]C4*R[-2]C -> 0 | AN65: =R[-1]C-R[-2]C4*R[-2]C -> 0 | AO65: =R[-1]C-R[-2]C4*R[-2]C -> 0 | AP65: =R[-1]C-R[-2]C4*R[-2]C -> 0 | AQ65: =R[-1]C-R[-2]C4*R[-2]C -> 0 | AR65: =R[-1]C-R[-2]C4*R[-2]C -> 0 | AS65: =R[-1]C-R[-2]C4*R[-2]C -> 0 | AT65: =R[-1]C-R[-2]C4*R[-2]C -> 0 | AU65: =R[-1]C-R[-2]C4*R[-2]C -> 0 | AV65: =R[-1]C-R[-2]C4*R[-2]C -> 0 | AW65: =R[-1]C-R[-2]C4*R[-2]C -> 0 | AX65: =R[-1]C-R[-2]C4*R[-2]C -> 0 | AY65: =R[-1]C-R[-2]C4*R[-2]C -> 0 | AZ65: =R[-1]C-R[-2]C4*R[-2]C -> 0 | BA65: =R[-1]C-R[-2]C4*R[-2]C -> 0 | BB65: =R[-1]C-R[-2]C4*R[-2]C -> 0 | BC65: =R[-1]C-R[-2]C4*R[-2]C -> 0 | BD65: =R[-1]C-R[-2]C4*R[-2]C -> 0 | BE65: =R[-1]C-R[-2]C4*R[-2]C -> 0 | BF65: =R[-1]C-R[-2]C4*R[-2]C -> 0 | BG65: =R[-1]C-R[-2]C4*R[-2]C -> 0 | BO65: =SUM(RC[-61]:RC[-8]) -> -2925
A66: Basic MVS/JCL | B66: 2002-03-06T00:00:00.000 | C66: 2 | D66: 1100 | E66: 450 | F66: 0 | G66: 0 | H66: 0 | I66: 0 | J66: 0 | K66: 5 | L66: 0 | M66: 0 | N66: 0 | O66: 0 | P66: 0 | Q66: 0 | R66: 0 | S66: 0 | T66: 0 | U66: 0 | V66: 0 | W66: 0 | X66: 1 | Y66: 0 | Z66: 0 | AA66: 0 | AB66: 0 | AC66: 0 | AD66: 1 | AE66: 0 | AF66: 3 | AG66: 0 | AH66: 0 | AI66: 0 | AJ66: 0 | AK66: 0 | AL66: 0 | AM66: 0 | AN66: 0 | AO66: 0 | AP66: 0 | AQ66: 0 | AR66: 0 | AS66: 0 | AT66: 0 | AU66: 0 | AV66: 0 | AW66: 0 | AX66: 0 | AY66: 0 | AZ66: 0 | BA66: 0 | BB66: 0 | BC66: 0 | BD66: 0 | BE66: 0 | BF66: 0 | BG66: 0 | BK66: =SUM(RC[-57]:RC[-4]) -> 10 | BL66: =RC[-61]*RC[-1] -> 20
D67: Total | F67: =R[-1]C*R66C5 -> 0 | G67: =R[-1]C*R66C5 -> 0 | H67: =R[-1]C*R66C5 -> 0 | I67: =R[-1]C*R66C5 -> 0 | J67: =R[-1]C*R66C5 -> 0 | K67: =R[-1]C*R66C5 -> 2250 | L67: =R[-1]C*R66C5 -> 0 | M67: =R[-1]C*R66C5 -> 0 | N67: =R[-1]C*R66C5 -> 0 | O67: =R[-1]C*R66C5 -> 0 | P67: =R[-1]C*R66C5 -> 0 | Q67: =R[-1]C*R66C5 -> 0 | R67: =R[-1]C*R66C5 -> 0 | S67: =R[-1]C*R66C5 -> 0 | T67: =R[-1]C*R66C5 -> 0 | U67: =R[-1]C*R66C5 -> 0 | V67: =R[-1]C*R66C5 -> 0 | W67: =R[-1]C*R66C5 -> 0 | X67: =R[-1]C*R66C5 -> 450 | Y67: =R[-1]C*R66C5 -> 0 | Z67: =R[-1]C*R66C5 -> 0 | AA67: =R[-1]C*R66C5 -> 0 | AB67: =R[-1]C*R66C5 -> 0 | AC67: =R[-1]C*R66C5 -> 0 | AD67: =R[-1]C*R66C5 -> 450 | AE67: =R[-1]C*R66C5 -> 0 | AF67: =R[-1]C*R66C5 -> 1350 | AG67: =R[-1]C*R66C5 -> 0 | AH67: =R[-1]C*R66C5 -> 0 | AI67: =R[-1]C*R66C5 -> 0 | AJ67: =R[-1]C*R66C5 -> 0 | AK67: =R[-1]C*R66C5 -> 0 | AL67: =R[-1]C*R66C5 -> 0 | AM67: =R[-1]C*R66C5 -> 0 | AN67: =R[-1]C*R66C5 -> 0 | AO67: =R[-1]C*R66C5 -> 0 | AP67: =R[-1]C*R66C5 -> 0 | AQ67: =R[-1]C*R66C5 -> 0 | AR67: =R[-1]C*R66C5 -> 0 | AS67: =R[-1]C*R66C5 -> 0 | AT67: =R[-1]C*R66C5 -> 0 | AU67: =R[-1]C*R66C5 -> 0 | AV67: =R[-1]C*R66C5 -> 0 | AW67: =R[-1]C*R66C5 -> 0 | AX67: =R[-1]C*R66C5 -> 0 | AY67: =R[-1]C*R66C5 -> 0 | AZ67: =R[-1]C*R66C5 -> 0 | BA67: =R[-1]C*R66C5 -> 0 | BB67: =R[-1]C*R66C5 -> 0 | BC67: =R[-1]C*R66C5 -> 0 | BD67: =R[-1]C*R66C5 -> 0 | BE67: =R[-1]C*R66C5 -> 0 | BF67: =R[-1]C*R66C5 -> 0 | BG67: =R[-1]C*R66C5 -> 0 | BM67: =R[-1]C[-61]*R[-1]C[-2] -> 11000 | BN67: =RC[-1]-RC[1] -> 6500 | BO67: =SUM(RC[-61]:RC[-8]) -> 4500
D68: Total Savings | F68: =R[-1]C-R[-2]C4*R[-2]C -> 0 | G68: =R[-1]C-R[-2]C4*R[-2]C -> 0 | H68: =R[-1]C-R[-2]C4*R[-2]C -> 0 | I68: =R[-1]C-R[-2]C4*R[-2]C -> 0 | J68: =R[-1]C-R[-2]C4*R[-2]C -> 0 | K68: =R[-1]C-R[-2]C4*R[-2]C -> -3250 | L68: =R[-1]C-R[-2]C4*R[-2]C -> 0 | M68: =R[-1]C-R[-2]C4*R[-2]C -> 0 | N68: =R[-1]C-R[-2]C4*R[-2]C -> 0 | O68: =R[-1]C-R[-2]C4*R[-2]C -> 0 | P68: =R[-1]C-R[-2]C4*R[-2]C -> 0 | Q68: =R[-1]C-R[-2]C4*R[-2]C -> 0 | R68: =R[-1]C-R[-2]C4*R[-2]C -> 0 | S68: =R[-1]C-R[-2]C4*R[-2]C -> 0 | T68: =R[-1]C-R[-2]C4*R[-2]C -> 0 | U68: =R[-1]C-R[-2]C4*R[-2]C -> 0 | V68: =R[-1]C-R[-2]C4*R[-2]C -> 0 | W68: =R[-1]C-R[-2]C4*R[-2]C -> 0 | X68: =R[-1]C-R[-2]C4*R[-2]C -> -650 | Y68: =R[-1]C-R[-2]C4*R[-2]C -> 0 | Z68: =R[-1]C-R[-2]C4*R[-2]C -> 0 | AA68: =R[-1]C-R[-2]C4*R[-2]C -> 0 | AB68: =R[-1]C-R[-2]C4*R[-2]C -> 0 | AC68: =R[-1]C-R[-2]C4*R[-2]C -> 0 | AD68: =R[-1]C-R[-2]C4*R[-2]C -> -650 | AE68: =R[-1]C-R[-2]C4*R[-2]C -> 0 | AF68: =R[-1]C-R[-2]C4*R[-2]C -> -1950 | AG68: =R[-1]C-R[-2]C4*R[-2]C -> 0 | AH68: =R[-1]C-R[-2]C4*R[-2]C -> 0 | AI68: =R[-1]C-R[-2]C4*R[-2]C -> 0 | AJ68: =R[-1]C-R[-2]C4*R[-2]C -> 0 | AK68: =R[-1]C-R[-2]C4*R[-2]C -> 0 | AL68: =R[-1]C-R[-2]C4*R[-2]C -> 0 | AM68: =R[-1]C-R[-2]C4*R[-2]C -> 0 | AN68: =R[-1]C-R[-2]C4*R[-2]C -> 0 | AO68: =R[-1]C-R[-2]C4*R[-2]C -> 0 | AP68: =R[-1]C-R[-2]C4*R[-2]C -> 0 | AQ68: =R[-1]C-R[-2]C4*R[-2]C -> 0 | AR68: =R[-1]C-R[-2]C4*R[-2]C -> 0 | AS68: =R[-1]C-R[-2]C4*R[-2]C -> 0 | AT68: =R[-1]C-R[-2]C4*R[-2]C -> 0 | AU68: =R[-1]C-R[-2]C4*R[-2]C -> 0 | AV68: =R[-1]C-R[-2]C4*R[-2]C -> 0 | AW68: =R[-1]C-R[-2]C4*R[-2]C -> 0 | AX68: =R[-1]C-R[-2]C4*R[-2]C -> 0 | AY68: =R[-1]C-R[-2]C4*R[-2]C -> 0 | AZ68: =R[-1]C-R[-2]C4*R[-2]C -> 0 | BA68: =R[-1]C-R[-2]C4*R[-2]C -> 0 | BB68: =R[-1]C-R[-2]C4*R[-2]C -> 0 | BC68: =R[-1]C-R[-2]C4*R[-2]C -> 0 | BD68: =R[-1]C-R[-2]C4*R[-2]C -> 0 | BE68: =R[-1]C-R[-2]C4*R[-2]C -> 0 | BF68: =R[-1]C-R[-2]C4*R[-2]C -> 0 | BG68: =R[-1]C-R[-2]C4*R[-2]C -> 0 | BO68: =SUM(RC[-61]:RC[-8]) -> -6500
A69: MS 2203 Deploying/Managing MS Application | B69: 2002-03-07T00:00:00.000 | C69: 2 | D69: 1400 | E69: 800 | F69: 0 | G69: 0 | H69: 0 | I69: 0 | J69: 0 | K69: 0 | L69: 0 | M69: 5 | N69: 0 | O69: 0 | P69: 0 | Q69: 0 | R69: 0 | S69: 0 | T69: 0 | U69: 0 | V69: 0 | W69: 1 | X69: 0 | Y69: 0 | Z69: 0 | AA69: 0 | AB69: 0 | AC69: 0 | AD69: 0 | AE69: 0 | AF69: 0 | AG69: 0 | AH69: 0 | AI69: 0 | AJ69: 0 | AK69: 0 | AL69: 0 | AM69: 0 | AN69: 1 | AO69: 0 | AP69: 0 | AQ69: 0 | AR69: 0 | AS69: 0 | AT69: 0 | AU69: 0 | AV69: 0 | AW69: 0 | AX69: 0 | AY69: 0 | AZ69: 0 | BA69: 0 | BB69: 0 | BC69: 0 | BD69: 0 | BE69: 0 | BF69: 0 | BG69: 0 | BK69: =SUM(RC[-57]:RC[-4]) -> 7 | BL69: =RC[-61]*RC[-1] -> 14
D70: Total | F70: =R[-1]C*R69C5 -> 0 | G70: =R[-1]C*R69C5 -> 0 | H70: =R[-1]C*R69C5 -> 0 | I70: =R[-1]C*R69C5 -> 0 | J70: =R[-1]C*R69C5 -> 0 | K70: =R[-1]C*R69C5 -> 0 | L70: =R[-1]C*R69C5 -> 0 | M70: =R[-1]C*R69C5 -> 4000 | N70: =R[-1]C*R69C5 -> 0 | O70: =R[-1]C*R69C5 -> 0 | P70: =R[-1]C*R69C5 -> 0 | Q70: =R[-1]C*R69C5 -> 0 | R70: =R[-1]C*R69C5 -> 0 | S70: =R[-1]C*R69C5 -> 0 | T70: =R[-1]C*R69C5 -> 0 | U70: =R[-1]C*R69C5 -> 0 | V70: =R[-1]C*R69C5 -> 0 | W70: =R[-1]C*R69C5 -> 800 | X70: =R[-1]C*R69C5 -> 0 | Y70: =R[-1]C*R69C5 -> 0 | Z70: =R[-1]C*R69C5 -> 0 | AA70: =R[-1]C*R69C5 -> 0 | AB70: =R[-1]C*R69C5 -> 0 | AC70: =R[-1]C*R69C5 -> 0 | AD70: =R[-1]C*R69C5 -> 0 | AE70: =R[-1]C*R69C5 -> 0 | AF70: =R[-1]C*R69C5 -> 0 | AG70: =R[-1]C*R69C5 -> 0 | AH70: =R[-1]C*R69C5 -> 0 | AI70: =R[-1]C*R69C5 -> 0 | AJ70: =R[-1]C*R69C5 -> 0 | AK70: =R[-1]C*R69C5 -> 0 | AL70: =R[-1]C*R69C5 -> 0 | AM70: =R[-1]C*R69C5 -> 0 | AN70: =R[-1]C*R69C5 -> 800 | AO70: =R[-1]C*R69C5 -> 0 | AP70: =R[-1]C*R69C5 -> 0 | AQ70: =R[-1]C*R69C5 -> 0 | AR70: =R[-1]C*R69C5 -> 0 | AS70: =R[-1]C*R69C5 -> 0 | AT70: =R[-1]C*R69C5 -> 0 | AU70: =R[-1]C*R69C5 -> 0 | AV70: =R[-1]C*R69C5 -> 0 | AW70: =R[-1]C*R69C5 -> 0 | AX70: =R[-1]C*R69C5 -> 0 | AY70: =R[-1]C*R69C5 -> 0 | AZ70: =R[-1]C*R69C5 -> 0 | BA70: =R[-1]C*R69C5 -> 0 | BB70: =R[-1]C*R69C5 -> 0 | BC70: =R[-1]C*R69C5 -> 0 | BD70: =R[-1]C*R69C5 -> 0 | BE70: =R[-1]C*R69C5 -> 0 | BF70: =R[-1]C*R69C5 -> 0 | BG70: =R[-1]C*R69C5 -> 0 | BM70: =R[-1]C[-61]*R[-1]C[-2] -> 9800 | BN70: =RC[-1]-RC[1] -> 4200 | BO70: =SUM(RC[-61]:RC[-8]) -> 5600
D71: Total Savings | F71: =R[-1]C-R[-2]C4*R[-2]C -> 0 | G71: =R[-1]C-R[-2]C4*R[-2]C -> 0 | H71: =R[-1]C-R[-2]C4*R[-2]C -> 0 | I71: =R[-1]C-R[-2]C4*R[-2]C -> 0 | J71: =R[-1]C-R[-2]C4*R[-2]C -> 0 | K71: =R[-1]C-R[-2]C4*R[-2]C -> 0 | L71: =R[-1]C-R[-2]C4*R[-2]C -> 0 | M71: =R[-1]C-R[-2]C4*R[-2]C -> -3000 | N71: =R[-1]C-R[-2]C4*R[-2]C -> 0 | O71: =R[-1]C-R[-2]C4*R[-2]C -> 0 | P71: =R[-1]C-R[-2]C4*R[-2]C -> 0 | Q71: =R[-1]C-R[-2]C4*R[-2]C -> 0 | R71: =R[-1]C-R[-2]C4*R[-2]C -> 0 | S71: =R[-1]C-R[-2]C4*R[-2]C -> 0 | T71: =R[-1]C-R[-2]C4*R[-2]C -> 0 | U71: =R[-1]C-R[-2]C4*R[-2]C -> 0 | V71: =R[-1]C-R[-2]C4*R[-2]C -> 0 | W71: =R[-1]C-R[-2]C4*R[-2]C -> -600 | X71: =R[-1]C-R[-2]C4*R[-2]C -> 0 | Y71: =R[-1]C-R[-2]C4*R[-2]C -> 0 | Z71: =R[-1]C-R[-2]C4*R[-2]C -> 0 | AA71: =R[-1]C-R[-2]C4*R[-2]C -> 0 | AB71: =R[-1]C-R[-2]C4*R[-2]C -> 0 | AC71: =R[-1]C-R[-2]C4*R[-2]C -> 0 | AD71: =R[-1]C-R[-2]C4*R[-2]C -> 0 | AE71: =R[-1]C-R[-2]C4*R[-2]C -> 0 | AF71: =R[-1]C-R[-2]C4*R[-2]C -> 0 | AG71: =R[-1]C-R[-2]C4*R[-2]C -> 0 | AH71: =R[-1]C-R[-2]C4*R[-2]C -> 0 | AI71: =R[-1]C-R[-2]C4*R[-2]C -> 0 | AJ71: =R[-1]C-R[-2]C4*R[-2]C -> 0 | AK71: =R[-1]C-R[-2]C4*R[-2]C -> 0 | AL71: =R[-1]C-R[-2]C4*R[-2]C -> 0 | AM71: =R[-1]C-R[-2]C4*R[-2]C -> 0 | AN71: =R[-1]C-R[-2]C4*R[-2]C -> -600 | AO71: =R[-1]C-R[-2]C4*R[-2]C -> 0 | AP71: =R[-1]C-R[-2]C4*R[-2]C -> 0 | AQ71: =R[-1]C-R[-2]C4*R[-2]C -> 0 | AR71: =R[-1]C-R[-2]C4*R[-2]C -> 0 | AS71: =R[-1]C-R[-2]C4*R[-2]C -> 0 | AT71: =R[-1]C-R[-2]C4*R[-2]C -> 0 | AU71: =R[-1]C-R[-2]C4*R[-2]C -> 0 | AV71: =R[-1]C-R[-2]C4*R[-2]C -> 0 | AW71: =R[-1]C-R[-2]C4*R[-2]C -> 0 | AX71: =R[-1]C-R[-2]C4*R[-2]C -> 0 | AY71: =R[-1]C-R[-2]C4*R[-2]C -> 0 | AZ71: =R[-1]C-R[-2]C4*R[-2]C -> 0 | BA71: =R[-1]C-R[-2]C4*R[-2]C -> 0 | BB71: =R[-1]C-R[-2]C4*R[-2]C -> 0 | BC71: =R[-1]C-R[-2]C4*R[-2]C -> 0 | BD71: =R[-1]C-R[-2]C4*R[-2]C -> 0 | BE71: =R[-1]C-R[-2]C4*R[-2]C -> 0 | BF71: =R[-1]C-R[-2]C4*R[-2]C -> 0 | BG71: =R[-1]C-R[-2]C4*R[-2]C -> 0 | BO71: =SUM(RC[-61]:RC[-8]) -> -4200
A72: Introduction to Easytrieve Plus | B72: 2002-03-12T00:00:00.000 | C72: 3 | D72: 1295 | E72: 327 | F72: 0 | G72: 0 | H72: 0 | I72: 0 | J72: 0 | K72: 1 | L72: 0 | M72: 0 | N72: 0 | O72: 0 | P72: 0 | Q72: 0 | R72: 0 | S72: 0 | T72: 0 | U72: 0 | V72: 0 | W72: 0 | X72: 0 | Y72: 0 | Z72: 0 | AA72: 0 | AB72: 0 | AC72: 0 | AD72: 0 | AE72: 0 | AF72: 1 | AG72: 0 | AH72: 0 | AI72: 0 | AJ72: 0 | AK72: 0 | AL72: 0 | AM72: 0 | AN72: 0 | AO72: 0 | AP72: 0 | AQ72: 0 | AR72: 0 | AS72: 0 | AT72: 0 | AU72: 0 | AV72: 3 | AW72: 1 | AX72: 0 | AY72: 0 | AZ72: 0 | BA72: 0 | BB72: 0 | BC72: 0 | BD72: 0 | BE72: 0 | BF72: 0 | BG72: 5 | BK72: =SUM(RC[-57]:RC[-4]) -> 11 | BL72: =RC[-61]*RC[-1] -> 33
D73: Total | F73: =R[-1]C*R72C5 -> 0 | G73: =R[-1]C*R72C5 -> 0 | H73: =R[-1]C*R72C5 -> 0 | I73: =R[-1]C*R72C5 -> 0 | J73: =R[-1]C*R72C5 -> 0 | K73: =R[-1]C*R72C5 -> 327 | L73: =R[-1]C*R72C5 -> 0 | M73: =R[-1]C*R72C5 -> 0 | N73: =R[-1]C*R72C5 -> 0 | O73: =R[-1]C*R72C5 -> 0 | P73: =R[-1]C*R72C5 -> 0 | Q73: =R[-1]C*R72C5 -> 0 | R73: =R[-1]C*R72C5 -> 0 | S73: =R[-1]C*R72C5 -> 0 | T73: =R[-1]C*R72C5 -> 0 | U73: =R[-1]C*R72C5 -> 0 | V73: =R[-1]C*R72C5 -> 0 | W73: =R[-1]C*R72C5 -> 0 | X73: =R[-1]C*R72C5 -> 0 | Y73: =R[-1]C*R72C5 -> 0 | Z73: =R[-1]C*R72C5 -> 0 | AA73: =R[-1]C*R72C5 -> 0 | AB73: =R[-1]C*R72C5 -> 0 | AC73: =R[-1]C*R72C5 -> 0 | AD73: =R[-1]C*R72C5 -> 0 | AE73: =R[-1]C*R72C5 -> 0 | AF73: =R[-1]C*R72C5 -> 327 | AG73: =R[-1]C*R72C5 -> 0 | AH73: =R[-1]C*R72C5 -> 0 | AI73: =R[-1]C*R72C5 -> 0 | AJ73: =R[-1]C*R72C5 -> 0 | AK73: =R[-1]C*R72C5 -> 0 | AL73: =R[-1]C*R72C5 -> 0 | AM73: =R[-1]C*R72C5 -> 0 | AN73: =R[-1]C*R72C5 -> 0 | AO73: =R[-1]C*R72C5 -> 0 | AP73: =R[-1]C*R72C5 -> 0 | AQ73: =R[-1]C*R72C5 -> 0 | AR73: =R[-1]C*R72C5 -> 0 | AS73: =R[-1]C*R72C5 -> 0 | AT73: =R[-1]C*R72C5 -> 0 | AU73: =R[-1]C*R72C5 -> 0 | AV73: =R[-1]C*R72C5 -> 981 | AW73: =R[-1]C*R72C5 -> 327 | AX73: =R[-1]C*R72C5 -> 0 | AY73: =R[-1]C*R72C5 -> 0 | AZ73: =R[-1]C*R72C5 -> 0 | BA73: =R[-1]C*R72C5 -> 0 | BB73: =R[-1]C*R72C5 -> 0 | BC73: =R[-1]C*R72C5 -> 0 | BD73: =R[-1]C*R72C5 -> 0 | BE73: =R[-1]C*R72C5 -> 0 | BF73: =R[-1]C*R72C5 -> 0 | BG73: =R[-1]C*R72C5 -> 1635 | BM73: =R[-1]C[-61]*R[-1]C[-2] -> 14245 | BN73: =RC[-1]-RC[1] -> 10648 | BO73: =SUM(RC[-61]:RC[-8]) -> 3597
D74: Total Savings | F74: =R[-1]C-R[-2]C4*R[-2]C -> 0 | G74: =R[-1]C-R[-2]C4*R[-2]C -> 0 | H74: =R[-1]C-R[-2]C4*R[-2]C -> 0 | I74: =R[-1]C-R[-2]C4*R[-2]C -> 0 | J74: =R[-1]C-R[-2]C4*R[-2]C -> 0 | K74: =R[-1]C-R[-2]C4*R[-2]C -> -968 | L74: =R[-1]C-R[-2]C4*R[-2]C -> 0 | M74: =R[-1]C-R[-2]C4*R[-2]C -> 0 | N74: =R[-1]C-R[-2]C4*R[-2]C -> 0 | O74: =R[-1]C-R[-2]C4*R[-2]C -> 0 | P74: =R[-1]C-R[-2]C4*R[-2]C -> 0 | Q74: =R[-1]C-R[-2]C4*R[-2]C -> 0 | R74: =R[-1]C-R[-2]C4*R[-2]C -> 0 | S74: =R[-1]C-R[-2]C4*R[-2]C -> 0 | T74: =R[-1]C-R[-2]C4*R[-2]C -> 0 | U74: =R[-1]C-R[-2]C4*R[-2]C -> 0 | V74: =R[-1]C-R[-2]C4*R[-2]C -> 0 | W74: =R[-1]C-R[-2]C4*R[-2]C -> 0 | X74: =R[-1]C-R[-2]C4*R[-2]C -> 0 | Y74: =R[-1]C-R[-2]C4*R[-2]C -> 0 | Z74: =R[-1]C-R[-2]C4*R[-2]C -> 0 | AA74: =R[-1]C-R[-2]C4*R[-2]C -> 0 | AB74: =R[-1]C-R[-2]C4*R[-2]C -> 0 | AC74: =R[-1]C-R[-2]C4*R[-2]C -> 0 | AD74: =R[-1]C-R[-2]C4*R[-2]C -> 0 | AE74: =R[-1]C-R[-2]C4*R[-2]C -> 0 | AF74: =R[-1]C-R[-2]C4*R[-2]C -> -968 | AG74: =R[-1]C-R[-2]C4*R[-2]C -> 0 | AH74: =R[-1]C-R[-2]C4*R[-2]C -> 0 | AI74: =R[-1]C-R[-2]C4*R[-2]C -> 0 | AJ74: =R[-1]C-R[-2]C4*R[-2]C -> 0 | AK74: =R[-1]C-R[-2]C4*R[-2]C -> 0 | AL74: =R[-1]C-R[-2]C4*R[-2]C -> 0 | AM74: =R[-1]C-R[-2]C4*R[-2]C -> 0 | AN74: =R[-1]C-R[-2]C4*R[-2]C -> 0 | AO74: =R[-1]C-R[-2]C4*R[-2]C -> 0 | AP74: =R[-1]C-R[-2]C4*R[-2]C -> 0 | AQ74: =R[-1]C-R[-2]C4*R[-2]C -> 0 | AR74: =R[-1]C-R[-2]C4*R[-2]C -> 0 | AS74: =R[-1]C-R[-2]C4*R[-2]C -> 0 | AT74: =R[-1]C-R[-2]C4*R[-2]C -> 0 | AU74: =R[-1]C-R[-2]C4*R[-2]C -> 0 | AV74: =R[-1]C-R[-2]C4*R[-2]C -> -2904 | AW74: =R[-1]C-R[-2]C4*R[-2]C -> -968 | AX74: =R[-1]C-R[-2]C4*R[-2]C -> 0 | AY74: =R[-1]C-R[-2]C4*R[-2]C -> 0 | AZ74: =R[-1]C-R[-2]C4*R[-2]C -> 0 | BA74: =R[-1]C-R[-2]C4*R[-2]C -> 0 | BB74: =R[-1]C-R[-2]C4*R[-2]C -> 0 | BC74: =R[-1]C-R[-2]C4*R[-2]C -> 0 | BD74: =R[-1]C-R[-2]C4*R[-2]C -> 0 | BE74: =R[-1]C-R[-2]C4*R[-2]C -> 0 | BF74: =R[-1]C-R[-2]C4*R[-2]C -> 0 | BG74: =R[-1]C-R[-2]C4*R[-2]C -> -4840 | BO74: =SUM(RC[-61]:RC[-8]) -> -10648
A75: Project Management Fundamentals | B75: 2002-03-12T00:00:00.000 | C75: 3 | D75: 2095 | E75: 550 | F75: 0 | G75: 0 | H75: 0 | I75: 0 | J75: 5 | K75: 1 | L75: 3 | M75: 0 | N75: 0 | O75: 0 | P75: 0 | Q75: 0 | R75: 0 | S75: 0 | T75: 0 | U75: 0 | V75: 0 | W75: 0 | X75: 0 | Y75: 0 | Z75: 0 | AA75: 0 | AB75: 0 | AC75: 0 | AD75: 0 | AE75: 0 | AF75: 0 | AG75: 0 | AH75: 0 | AI75: 0 | AJ75: 0 | AK75: 0 | AL75: 0 | AM75: 0 | AN75: 0 | AO75: 0 | AP75: 0 | AQ75: 0 | AR75: 0 | AS75: 0 | AT75: 0 | AU75: 0 | AV75: 0 | AW75: 0 | AX75: 0 | AY75: 0 | AZ75: 0 | BA75: 0 | BB75: 0 | BC75: 0 | BD75: 0 | BE75: 4 | BF75: 5 | BG75: 0 | BK75: =SUM(RC[-57]:RC[-4]) -> 18 | BL75: =RC[-61]*RC[-1] -> 54
D76: Total | F76: =R[-1]C*R75C5 -> 0 | G76: =R[-1]C*R75C5 -> 0 | H76: =R[-1]C*R75C5 -> 0 | I76: =R[-1]C*R75C5 -> 0 | J76: =R[-1]C*R75C5 -> 2750 | K76: =R[-1]C*R75C5 -> 550 | L76: =R[-1]C*R75C5 -> 1650 | M76: =R[-1]C*R75C5 -> 0 | N76: =R[-1]C*R75C5 -> 0 | O76: =R[-1]C*R75C5 -> 0 | P76: =R[-1]C*R75C5 -> 0 | Q76: =R[-1]C*R75C5 -> 0 | R76: =R[-1]C*R75C5 -> 0 | S76: =R[-1]C*R75C5 -> 0 | T76: =R[-1]C*R75C5 -> 0 | U76: =R[-1]C*R75C5 -> 0 | V76: =R[-1]C*R75C5 -> 0 | W76: =R[-1]C*R75C5 -> 0 | X76: =R[-1]C*R75C5 -> 0 | Y76: =R[-1]C*R75C5 -> 0 | Z76: =R[-1]C*R75C5 -> 0 | AA76: =R[-1]C*R75C5 -> 0 | AB76: =R[-1]C*R75C5 -> 0 | AC76: =R[-1]C*R75C5 -> 0 | AD76: =R[-1]C*R75C5 -> 0 | AE76: =R[-1]C*R75C5 -> 0 | AF76: =R[-1]C*R75C5 -> 0 | AG76: =R[-1]C*R75C5 -> 0 | AH76: =R[-1]C*R75C5 -> 0 | AI76: =R[-1]C*R75C5 -> 0 | AJ76: =R[-1]C*R75C5 -> 0 | AK76: =R[-1]C*R75C5 -> 0 | AL76: =R[-1]C*R75C5 -> 0 | AM76: =R[-1]C*R75C5 -> 0 | AN76: =R[-1]C*R75C5 -> 0 | AO76: =R[-1]C*R75C5 -> 0 | AP76: =R[-1]C*R75C5 -> 0 | AQ76: =R[-1]C*R75C5 -> 0 | AR76: =R[-1]C*R75C5 -> 0 | AS76: =R[-1]C*R75C5 -> 0 | AT76: =R[-1]C*R75C5 -> 0 | AU76: =R[-1]C*R75C5 -> 0 | AV76: =R[-1]C*R75C5 -> 0 | AW76: =R[-1]C*R75C5 -> 0 | AX76: =R[-1]C*R75C5 -> 0 | AY76: =R[-1]C*R75C5 -> 0 | AZ76: =R[-1]C*R75C5 -> 0 | BA76: =R[-1]C*R75C5 -> 0 | BB76: =R[-1]C*R75C5 -> 0 | BC76: =R[-1]C*R75C5 -> 0 | BD76: =R[-1]C*R75C5 -> 0 | BE76: =R[-1]C*R75C5 -> 2200 | BF76: =R[-1]C*R75C5 -> 2750 | BG76: =R[-1]C*R75C5 -> 0 | BM76: =R[-1]C[-61]*R[-1]C[-2] -> 37710 | BN76: =RC[-1]-RC[1] -> 27810 | BO76: =SUM(RC[-61]:RC[-8]) -> 9900
D77: Total Savings | F77: =R[-1]C-R[-2]C4*R[-2]C -> 0 | G77: =R[-1]C-R[-2]C4*R[-2]C -> 0 | H77: =R[-1]C-R[-2]C4*R[-2]C -> 0 | I77: =R[-1]C-R[-2]C4*R[-2]C -> 0 | J77: =R[-1]C-R[-2]C4*R[-2]C -> -7725 | K77: =R[-1]C-R[-2]C4*R[-2]C -> -1545 | L77: =R[-1]C-R[-2]C4*R[-2]C -> -4635 | M77: =R[-1]C-R[-2]C4*R[-2]C -> 0 | N77: =R[-1]C-R[-2]C4*R[-2]C -> 0 | O77: =R[-1]C-R[-2]C4*R[-2]C -> 0 | P77: =R[-1]C-R[-2]C4*R[-2]C -> 0 | Q77: =R[-1]C-R[-2]C4*R[-2]C -> 0 | R77: =R[-1]C-R[-2]C4*R[-2]C -> 0 | S77: =R[-1]C-R[-2]C4*R[-2]C -> 0 | T77: =R[-1]C-R[-2]C4*R[-2]C -> 0 | U77: =R[-1]C-R[-2]C4*R[-2]C -> 0 | V77: =R[-1]C-R[-2]C4*R[-2]C -> 0 | W77: =R[-1]C-R[-2]C4*R[-2]C -> 0 | X77: =R[-1]C-R[-2]C4*R[-2]C -> 0 | Y77: =R[-1]C-R[-2]C4*R[-2]C -> 0 | Z77: =R[-1]C-R[-2]C4*R[-2]C -> 0 | AA77: =R[-1]C-R[-2]C4*R[-2]C -> 0 | AB77: =R[-1]C-R[-2]C4*R[-2]C -> 0 | AC77: =R[-1]C-R[-2]C4*R[-2]C -> 0 | AD77: =R[-1]C-R[-2]C4*R[-2]C -> 0 | AE77: =R[-1]C-R[-2]C4*R[-2]C -> 0 | AF77: =R[-1]C-R[-2]C4*R[-2]C -> 0 | AG77: =R[-1]C-R[-2]C4*R[-2]C -> 0 | AH77: =R[-1]C-R[-2]C4*R[-2]C -> 0 | AI77: =R[-1]C-R[-2]C4*R[-2]C -> 0 | AJ77: =R[-1]C-R[-2]C4*R[-2]C -> 0 | AK77: =R[-1]C-R[-2]C4*R[-2]C -> 0 | AL77: =R[-1]C-R[-2]C4*R[-2]C -> 0 | AM77: =R[-1]C-R[-2]C4*R[-2]C -> 0 | AN77: =R[-1]C-R[-2]C4*R[-2]C -> 0 | AO77: =R[-1]C-R[-2]C4*R[-2]C -> 0 | AP77: =R[-1]C-R[-2]C4*R[-2]C -> 0 | AQ77: =R[-1]C-R[-2]C4*R[-2]C -> 0 | AR77: =R[-1]C-R[-2]C4*R[-2]C -> 0 | AS77: =R[-1]C-R[-2]C4*R[-2]C -> 0 | AT77: =R[-1]C-R[-2]C4*R[-2]C -> 0 | AU77: =R[-1]C-R[-2]C4*R[-2]C -> 0 | AV77: =R[-1]C-R[-2]C4*R[-2]C -> 0 | AW77: =R[-1]C-R[-2]C4*R[-2]C -> 0 | AX77: =R[-1]C-R[-2]C4*R[-2]C -> 0 | AY77: =R[-1]C-R[-2]C4*R[-2]C -> 0 | AZ77: =R[-1]C-R[-2]C4*R[-2]C -> 0 | BA77: =R[-1]C-R[-2]C4*R[-2]C -> 0 | BB77: =R[-1]C-R[-2]C4*R[-2]C -> 0 | BC77: =R[-1]C-R[-2]C4*R[-2]C -> 0 | BD77: =R[-1]C-R[-2]C4*R[-2]C -> 0 | BE77: =R[-1]C-R[-2]C4*R[-2]C -> -6180 | BF77: =R[-1]C-R[-2]C4*R[-2]C -> -7725 | BG77: =R[-1]C-R[-2]C4*R[-2]C -> 0 | BO77: =SUM(RC[-61]:RC[-8]) -> -27810
A78: Analysis Simulation | B78: 2002-03-12T00:00:00.000 | C78: 2 | D78: 1175 | E78: 525 | F78: 0 | G78: 0 | H78: 0 | I78: 0 | J78: 0 | K78: 0 | L78: 0 | M78: 0 | N78: 0 | O78: 0 | P78: 0 | Q78: 0 | R78: 0 | S78: 0 | T78: 0 | U78: 0 | V78: 0 | W78: 0 | X78: 0 | Y78: 11 | Z78: 0 | AA78: 0 | AB78: 0 | AC78: 0 | AD78: 0 | AE78: 0 | AF78: 0 | AG78: 0 | AH78: 0 | AI78: 0 | AJ78: 0 | AK78: 0 | AL78: 0 | AM78: 0 | AN78: 0 | AO78: 0 | AP78: 0 | AQ78: 0 | AR78: 0 | AS78: 0 | AT78: 0 | AU78: 0 | AV78: 0 | AW78: 0 | AX78: 0 | AY78: 0 | AZ78: 0 | BA78: 0 | BB78: 0 | BC78: 0 | BD78: 0 | BE78: 0 | BF78: 0 | BG78: 0 | BK78: =SUM(RC[-57]:RC[-4]) -> 11 | BL78: =RC[-61]*RC[-1] -> 22
D79: Total | F79: =R[-1]C*R78C5 -> 0 | G79: =R[-1]C*R78C5 -> 0 | H79: =R[-1]C*R78C5 -> 0 | I79: =R[-1]C*R78C5 -> 0 | J79: =R[-1]C*R78C5 -> 0 | K79: =R[-1]C*R78C5 -> 0 | L79: =R[-1]C*R78C5 -> 0 | M79: =R[-1]C*R78C5 -> 0 | N79: =R[-1]C*R78C5 -> 0 | O79: =R[-1]C*R78C5 -> 0 | P79: =R[-1]C*R78C5 -> 0 | Q79: =R[-1]C*R78C5 -> 0 | R79: =R[-1]C*R78C5 -> 0 | S79: =R[-1]C*R78C5 -> 0 | T79: =R[-1]C*R78C5 -> 0 | U79: =R[-1]C*R78C5 -> 0 | V79: =R[-1]C*R78C5 -> 0 | W79: =R[-1]C*R78C5 -> 0 | X79: =R[-1]C*R78C5 -> 0 | Y79: =R[-1]C*R78C5 -> 5775 | Z79: =R[-1]C*R78C5 -> 0 | AA79: =R[-1]C*R78C5 -> 0 | AB79: =R[-1]C*R78C5 -> 0 | AC79: =R[-1]C*R78C5 -> 0 | AD79: =R[-1]C*R78C5 -> 0 | AE79: =R[-1]C*R78C5 -> 0 | AF79: =R[-1]C*R78C5 -> 0 | AG79: =R[-1]C*R78C5 -> 0 | AH79: =R[-1]C*R78C5 -> 0 | AI79: =R[-1]C*R78C5 -> 0 | AJ79: =R[-1]C*R78C5 -> 0 | AK79: =R[-1]C*R78C5 -> 0 | AL79: =R[-1]C*R78C5 -> 0 | AM79: =R[-1]C*R78C5 -> 0 | AN79: =R[-1]C*R78C5 -> 0 | AO79: =R[-1]C*R78C5 -> 0 | AP79: =R[-1]C*R78C5 -> 0 | AQ79: =R[-1]C*R78C5 -> 0 | AR79: =R[-1]C*R78C5 -> 0 | AS79: =R[-1]C*R78C5 -> 0 | AT79: =R[-1]C*R78C5 -> 0 | AU79: =R[-1]C*R78C5 -> 0 | AV79: =R[-1]C*R78C5 -> 0 | AW79: =R[-1]C*R78C5 -> 0 | AX79: =R[-1]C*R78C5 -> 0 | AY79: =R[-1]C*R78C5 -> 0 | AZ79: =R[-1]C*R78C5 -> 0 | BA79: =R[-1]C*R78C5 -> 0 | BB79: =R[-1]C*R78C5 -> 0 | BC79: =R[-1]C*R78C5 -> 0 | BD79: =R[-1]C*R78C5 -> 0 | BE79: =R[-1]C*R78C5 -> 0 | BF79: =R[-1]C*R78C5 -> 0 | BG79: =R[-1]C*R78C5 -> 0 | BM79: =R[-1]C[-61]*R[-1]C[-2] -> 12925 | BN79: =RC[-1]-RC[1] -> 7150 | BO79: =SUM(RC[-61]:RC[-8]) -> 5775
D80: Total Savings | F80: =R[-1]C-R[-2]C4*R[-2]C -> 0 | G80: =R[-1]C-R[-2]C4*R[-2]C -> 0 | H80: =R[-1]C-R[-2]C4*R[-2]C -> 0 | I80: =R[-1]C-R[-2]C4*R[-2]C -> 0 | J80: =R[-1]C-R[-2]C4*R[-2]C -> 0 | K80: =R[-1]C-R[-2]C4*R[-2]C -> 0 | L80: =R[-1]C-R[-2]C4*R[-2]C -> 0 | M80: =R[-1]C-R[-2]C4*R[-2]C -> 0 | N80: =R[-1]C-R[-2]C4*R[-2]C -> 0 | O80: =R[-1]C-R[-2]C4*R[-2]C -> 0 | P80: =R[-1]C-R[-2]C4*R[-2]C -> 0 | Q80: =R[-1]C-R[-2]C4*R[-2]C -> 0 | R80: =R[-1]C-R[-2]C4*R[-2]C -> 0 | S80: =R[-1]C-R[-2]C4*R[-2]C -> 0 | T80: =R[-1]C-R[-2]C4*R[-2]C -> 0 | U80: =R[-1]C-R[-2]C4*R[-2]C -> 0 | V80: =R[-1]C-R[-2]C4*R[-2]C -> 0 | W80: =R[-1]C-R[-2]C4*R[-2]C -> 0 | X80: =R[-1]C-R[-2]C4*R[-2]C -> 0 | Y80: =R[-1]C-R[-2]C4*R[-2]C -> -7150 | Z80: =R[-1]C-R[-2]C4*R[-2]C -> 0 | AA80: =R[-1]C-R[-2]C4*R[-2]C -> 0 | AB80: =R[-1]C-R[-2]C4*R[-2]C -> 0 | AC80: =R[-1]C-R[-2]C4*R[-2]C -> 0 | AD80: =R[-1]C-R[-2]C4*R[-2]C -> 0 | AE80: =R[-1]C-R[-2]C4*R[-2]C -> 0 | AF80: =R[-1]C-R[-2]C4*R[-2]C -> 0 | AG80: =R[-1]C-R[-2]C4*R[-2]C -> 0 | AH80: =R[-1]C-R[-2]C4*R[-2]C -> 0 | AI80: =R[-1]C-R[-2]C4*R[-2]C -> 0 | AJ80: =R[-1]C-R[-2]C4*R[-2]C -> 0 | AK80: =R[-1]C-R[-2]C4*R[-2]C -> 0 | AL80: =R[-1]C-R[-2]C4*R[-2]C -> 0 | AM80: =R[-1]C-R[-2]C4*R[-2]C -> 0 | AN80: =R[-1]C-R[-2]C4*R[-2]C -> 0 | AO80: =R[-1]C-R[-2]C4*R[-2]C -> 0 | AP80: =R[-1]C-R[-2]C4*R[-2]C -> 0 | AQ80: =R[-1]C-R[-2]C4*R[-2]C -> 0 | AR80: =R[-1]C-R[-2]C4*R[-2]C -> 0 | AS80: =R[-1]C-R[-2]C4*R[-2]C -> 0 | AT80: =R[-1]C-R[-2]C4*R[-2]C -> 0 | AU80: =R[-1]C-R[-2]C4*R[-2]C -> 0 | AV80: =R[-1]C-R[-2]C4*R[-2]C -> 0 | AW80: =R[-1]C-R[-2]C4*R[-2]C -> 0 | AX80: =R[-1]C-R[-2]C4*R[-2]C -> 0 | AY80: =R[-1]C-R[-2]C4*R[-2]C -> 0 | AZ80: =R[-1]C-R[-2]C4*R[-2]C -> 0 | BA80: =R[-1]C-R[-2]C4*R[-2]C -> 0 | BB80: =R[-1]C-R[-2]C4*R[-2]C -> 0 | BC80: =R[-1]C-R[-2]C4*R[-2]C -> 0 | BD80: =R[-1]C-R[-2]C4*R[-2]C -> 0 | BE80: =R[-1]C-R[-2]C4*R[-2]C -> 0 | BF80: =R[-1]C-R[-2]C4*R[-2]C -> 0 | BG80: =R[-1]C-R[-2]C4*R[-2]C -> 0 | BO80: =SUM(RC[-61]:RC[-8]) -> -7150
A81: Advanced SQL | B81: 2002-03-13T00:00:00.000 | C81: 2 | D81: 1100 | E81: 450 | F81: 1 | G81: 0 | H81: 0 | I81: 0 | J81: 3 | K81: 0 | L81: 0 | M81: 0 | N81: 0 | O81: 0 | P81: 0 | Q81: 0 | R81: 0 | S81: 0 | T81: 0 | U81: 0 | V81: 0 | W81: 4 | X81: 0 | Y81: 0 | Z81: 0 | AA81: 0 | AB81: 0 | AC81: 0 | AD81: 0 | AE81: 0 | AF81: 0 | AG81: 0 | AH81: 0 | AI81: 0 | AJ81: 0 | AK81: 0 | AL81: 0 | AM81: 0 | AN81: 0 | AO81: 0 | AP81: 0 | AQ81: 0 | AR81: 0 | AS81: 0 | AT81: 0 | AU81: 0 | AV81: 0 | AW81: 0 | AX81: 0 | AY81: 0 | AZ81: 0 | BA81: 0 | BB81: 0 | BC81: 0 | BD81: 0 | BE81: 0 | BF81: 0 | BG81: 0 | BK81: =SUM(RC[-57]:RC[-4]) -> 8 | BL81: =RC[-61]*RC[-1] -> 16
D82: Total | F82: =R[-1]C*R81C5 -> 450 | G82: =R[-1]C*R81C5 -> 0 | H82: =R[-1]C*R81C5 -> 0 | I82: =R[-1]C*R81C5 -> 0 | J82: =R[-1]C*R81C5 -> 1350 | K82: =R[-1]C*R81C5 -> 0 | L82: =R[-1]C*R81C5 -> 0 | M82: =R[-1]C*R81C5 -> 0 | N82: =R[-1]C*R81C5 -> 0 | O82: =R[-1]C*R81C5 -> 0 | P82: =R[-1]C*R81C5 -> 0 | Q82: =R[-1]C*R81C5 -> 0 | R82: =R[-1]C*R81C5 -> 0 | S82: =R[-1]C*R81C5 -> 0 | T82: =R[-1]C*R81C5 -> 0 | U82: =R[-1]C*R81C5 -> 0 | V82: =R[-1]C*R81C5 -> 0 | W82: =R[-1]C*R81C5 -> 1800 | X82: =R[-1]C*R81C5 -> 0 | Y82: =R[-1]C*R81C5 -> 0 | Z82: =R[-1]C*R81C5 -> 0 | AA82: =R[-1]C*R81C5 -> 0 | AB82: =R[-1]C*R81C5 -> 0 | AC82: =R[-1]C*R81C5 -> 0 | AD82: =R[-1]C*R81C5 -> 0 | AE82: =R[-1]C*R81C5 -> 0 | AF82: =R[-1]C*R81C5 -> 0 | AG82: =R[-1]C*R81C5 -> 0 | AH82: =R[-1]C*R81C5 -> 0 | AI82: =R[-1]C*R81C5 -> 0 | AJ82: =R[-1]C*R81C5 -> 0 | AK82: =R[-1]C*R81C5 -> 0 | AL82: =R[-1]C*R81C5 -> 0 | AM82: =R[-1]C*R81C5 -> 0 | AN82: =R[-1]C*R81C5 -> 0 | AO82: =R[-1]C*R81C5 -> 0 | AP82: =R[-1]C*R81C5 -> 0 | AQ82: =R[-1]C*R81C5 -> 0 | AR82: =R[-1]C*R81C5 -> 0 | AS82: =R[-1]C*R81C5 -> 0 | AT82: =R[-1]C*R81C5 -> 0 | AU82: =R[-1]C*R81C5 -> 0 | AV82: =R[-1]C*R81C5 -> 0 | AW82: =R[-1]C*R81C5 -> 0 | AX82: =R[-1]C*R81C5 -> 0 | AY82: =R[-1]C*R81C5 -> 0 | AZ82: =R[-1]C*R81C5 -> 0 | BA82: =R[-1]C*R81C5 -> 0 | BB82: =R[-1]C*R81C5 -> 0 | BC82: =R[-1]C*R81C5 -> 0 | BD82: =R[-1]C*R81C5 -> 0 | BE82: =R[-1]C*R81C5 -> 0 | BF82: =R[-1]C*R81C5 -> 0 | BG82: =R[-1]C*R81C5 -> 0 | BM82: =R[-1]C[-61]*R[-1]C[-2] -> 8800 | BN82: =RC[-1]-RC[1] -> 5200 | BO82: =SUM(RC[-61]:RC[-8]) -> 3600
D83: Total Savings | F83: =R[-1]C-R[-2]C4*R[-2]C -> -650 | G83: =R[-1]C-R[-2]C4*R[-2]C -> 0 | H83: =R[-1]C-R[-2]C4*R[-2]C -> 0 | I83: =R[-1]C-R[-2]C4*R[-2]C -> 0 | J83: =R[-1]C-R[-2]C4*R[-2]C -> -1950 | K83: =R[-1]C-R[-2]C4*R[-2]C -> 0 | L83: =R[-1]C-R[-2]C4*R[-2]C -> 0 | M83: =R[-1]C-R[-2]C4*R[-2]C -> 0 | N83: =R[-1]C-R[-2]C4*R[-2]C -> 0 | O83: =R[-1]C-R[-2]C4*R[-2]C -> 0 | P83: =R[-1]C-R[-2]C4*R[-2]C -> 0 | Q83: =R[-1]C-R[-2]C4*R[-2]C -> 0 | R83: =R[-1]C-R[-2]C4*R[-2]C -> 0 | S83: =R[-1]C-R[-2]C4*R[-2]C -> 0 | T83: =R[-1]C-R[-2]C4*R[-2]C -> 0 | U83: =R[-1]C-R[-2]C4*R[-2]C -> 0 | V83: =R[-1]C-R[-2]C4*R[-2]C -> 0 | W83: =R[-1]C-R[-2]C4*R[-2]C -> -2600 | X83: =R[-1]C-R[-2]C4*R[-2]C -> 0 | Y83: =R[-1]C-R[-2]C4*R[-2]C -> 0 | Z83: =R[-1]C-R[-2]C4*R[-2]C -> 0 | AA83: =R[-1]C-R[-2]C4*R[-2]C -> 0 | AB83: =R[-1]C-R[-2]C4*R[-2]C -> 0 | AC83: =R[-1]C-R[-2]C4*R[-2]C -> 0 | AD83: =R[-1]C-R[-2]C4*R[-2]C -> 0 | AE83: =R[-1]C-R[-2]C4*R[-2]C -> 0 | AF83: =R[-1]C-R[-2]C4*R[-2]C -> 0 | AG83: =R[-1]C-R[-2]C4*R[-2]C -> 0 | AH83: =R[-1]C-R[-2]C4*R[-2]C -> 0 | AI83: =R[-1]C-R[-2]C4*R[-2]C -> 0 | AJ83: =R[-1]C-R[-2]C4*R[-2]C -> 0 | AK83: =R[-1]C-R[-2]C4*R[-2]C -> 0 | AL83: =R[-1]C-R[-2]C4*R[-2]C -> 0 | AM83: =R[-1]C-R[-2]C4*R[-2]C -> 0 | AN83: =R[-1]C-R[-2]C4*R[-2]C -> 0 | AO83: =R[-1]C-R[-2]C4*R[-2]C -> 0 | AP83: =R[-1]C-R[-2]C4*R[-2]C -> 0 | AQ83: =R[-1]C-R[-2]C4*R[-2]C -> 0 | AR83: =R[-1]C-R[-2]C4*R[-2]C -> 0 | AS83: =R[-1]C-R[-2]C4*R[-2]C -> 0 | AT83: =R[-1]C-R[-2]C4*R[-2]C -> 0 | AU83: =R[-1]C-R[-2]C4*R[-2]C -> 0 | AV83: =R[-1]C-R[-2]C4*R[-2]C -> 0 | AW83: =R[-1]C-R[-2]C4*R[-2]C -> 0 | AX83: =R[-1]C-R[-2]C4*R[-2]C -> 0 | AY83: =R[-1]C-R[-2]C4*R[-2]C -> 0 | AZ83: =R[-1]C-R[-2]C4*R[-2]C -> 0 | BA83: =R[-1]C-R[-2]C4*R[-2]C -> 0 | BB83: =R[-1]C-R[-2]C4*R[-2]C -> 0 | BC83: =R[-1]C-R[-2]C4*R[-2]C -> 0 | BD83: =R[-1]C-R[-2]C4*R[-2]C -> 0 | BE83: =R[-1]C-R[-2]C4*R[-2]C -> 0 | BF83: =R[-1]C-R[-2]C4*R[-2]C -> 0 | BG83: =R[-1]C-R[-2]C4*R[-2]C -> 0 | BO83: =SUM(RC[-61]:RC[-8]) -> -5200
A84: Analysis Simulation | B84: 2002-03-18T00:00:00.000 | C84: 2 | D84: 1175 | E84: 525 | F84: 0 | G84: 0 | H84: 0 | I84: 0 | J84: 0 | K84: 1 | L84: 0 | M84: 0 | N84: 0 | O84: 0 | P84: 0 | Q84: 0 | R84: 0 | S84: 0 | T84: 0 | U84: 0 | V84: 0 | W84: 0 | X84: 0 | Y84: 0 | Z84: 0 | AA84: 0 | AB84: 0 | AC84: 0 | AD84: 0 | AE84: 0 | AF84: 0 | AG84: 0 | AH84: 0 | AI84: 0 | AJ84: 0 | AK84: 0 | AL84: 0 | AM84: 1 | AN84: 0 | AO84: 0 | AP84: 0 | AQ84: 1 | AR84: 0 | AS84: 0 | AT84: 0 | AU84: 0 | AV84: 0 | AW84: 0 | AX84: 0 | AY84: 0 | AZ84: 0 | BA84: 0 | BB84: 0 | BC84: 0 | BD84: 0 | BE84: 0 | BF84: 0 | BG84: 11 | BK84: =SUM(RC[-57]:RC[-4]) -> 14 | BL84: =RC[-61]*RC[-1] -> 28
D85: Total | F85: =R[-1]C*R84C5 -> 0 | G85: =R[-1]C*R84C5 -> 0 | H85: =R[-1]C*R84C5 -> 0 | I85: =R[-1]C*R84C5 -> 0 | J85: =R[-1]C*R84C5 -> 0 | K85: =R[-1]C*R84C5 -> 525 | L85: =R[-1]C*R84C5 -> 0 | M85: =R[-1]C*R84C5 -> 0 | N85: =R[-1]C*R84C5 -> 0 | O85: =R[-1]C*R84C5 -> 0 | P85: =R[-1]C*R84C5 -> 0 | Q85: =R[-1]C*R84C5 -> 0 | R85: =R[-1]C*R84C5 -> 0 | S85: =R[-1]C*R84C5 -> 0 | T85: =R[-1]C*R84C5 -> 0 | U85: =R[-1]C*R84C5 -> 0 | V85: =R[-1]C*R84C5 -> 0 | W85: =R[-1]C*R84C5 -> 0 | X85: =R[-1]C*R84C5 -> 0 | Y85: =R[-1]C*R84C5 -> 0 | Z85: =R[-1]C*R84C5 -> 0 | AA85: =R[-1]C*R84C5 -> 0 | AB85: =R[-1]C*R84C5 -> 0 | AC85: =R[-1]C*R84C5 -> 0 | AD85: =R[-1]C*R84C5 -> 0 | AE85: =R[-1]C*R84C5 -> 0 | AF85: =R[-1]C*R84C5 -> 0 | AG85: =R[-1]C*R84C5 -> 0 | AH85: =R[-1]C*R84C5 -> 0 | AI85: =R[-1]C*R84C5 -> 0 | AJ85: =R[-1]C*R84C5 -> 0 | AK85: =R[-1]C*R84C5 -> 0 | AL85: =R[-1]C*R84C5 -> 0 | AM85: =R[-1]C*R84C5 -> 525 | AN85: =R[-1]C*R84C5 -> 0 | AO85: =R[-1]C*R84C5 -> 0 | AP85: =R[-1]C*R84C5 -> 0 | AQ85: =R[-1]C*R84C5 -> 525 | AR85: =R[-1]C*R84C5 -> 0 | AS85: =R[-1]C*R84C5 -> 0 | AT85: =R[-1]C*R84C5 -> 0 | AU85: =R[-1]C*R84C5 -> 0 | AV85: =R[-1]C*R84C5 -> 0 | AW85: =R[-1]C*R84C5 -> 0 | AX85: =R[-1]C*R84C5 -> 0 | AY85: =R[-1]C*R84C5 -> 0 | AZ85: =R[-1]C*R84C5 -> 0 | BA85: =R[-1]C*R84C5 -> 0 | BB85: =R[-1]C*R84C5 -> 0 | BC85: =R[-1]C*R84C5 -> 0 | BD85: =R[-1]C*R84C5 -> 0 | BE85: =R[-1]C*R84C5 -> 0 | BF85: =R[-1]C*R84C5 -> 0 | BG85: =R[-1]C*R84C5 -> 5775 | BM85: =R[-1]C[-61]*R[-1]C[-2] -> 16450 | BN85: =RC[-1]-RC[1] -> 9100 | BO85: =SUM(RC[-61]:RC[-8]) -> 7350
D86: Total Savings | F86: =R[-1]C-R[-2]C4*R[-2]C -> 0 | G86: =R[-1]C-R[-2]C4*R[-2]C -> 0 | H86: =R[-1]C-R[-2]C4*R[-2]C -> 0 | I86: =R[-1]C-R[-2]C4*R[-2]C -> 0 | J86: =R[-1]C-R[-2]C4*R[-2]C -> 0 | K86: =R[-1]C-R[-2]C4*R[-2]C -> -650 | L86: =R[-1]C-R[-2]C4*R[-2]C -> 0 | M86: =R[-1]C-R[-2]C4*R[-2]C -> 0 | N86: =R[-1]C-R[-2]C4*R[-2]C -> 0 | O86: =R[-1]C-R[-2]C4*R[-2]C -> 0 | P86: =R[-1]C-R[-2]C4*R[-2]C -> 0 | Q86: =R[-1]C-R[-2]C4*R[-2]C -> 0 | R86: =R[-1]C-R[-2]C4*R[-2]C -> 0 | S86: =R[-1]C-R[-2]C4*R[-2]C -> 0 | T86: =R[-1]C-R[-2]C4*R[-2]C -> 0 | U86: =R[-1]C-R[-2]C4*R[-2]C -> 0 | V86: =R[-1]C-R[-2]C4*R[-2]C -> 0 | W86: =R[-1]C-R[-2]C4*R[-2]C -> 0 | X86: =R[-1]C-R[-2]C4*R[-2]C -> 0 | Y86: =R[-1]C-R[-2]C4*R[-2]C -> 0 | Z86: =R[-1]C-R[-2]C4*R[-2]C -> 0 | AA86: =R[-1]C-R[-2]C4*R[-2]C -> 0 | AB86: =R[-1]C-R[-2]C4*R[-2]C -> 0 | AC86: =R[-1]C-R[-2]C4*R[-2]C -> 0 | AD86: =R[-1]C-R[-2]C4*R[-2]C -> 0 | AE86: =R[-1]C-R[-2]C4*R[-2]C -> 0 | AF86: =R[-1]C-R[-2]C4*R[-2]C -> 0 | AG86: =R[-1]C-R[-2]C4*R[-2]C -> 0 | AH86: =R[-1]C-R[-2]C4*R[-2]C -> 0 | AI86: =R[-1]C-R[-2]C4*R[-2]C -> 0 | AJ86: =R[-1]C-R[-2]C4*R[-2]C -> 0 | AK86: =R[-1]C-R[-2]C4*R[-2]C -> 0 | AL86: =R[-1]C-R[-2]C4*R[-2]C -> 0 | AM86: =R[-1]C-R[-2]C4*R[-2]C -> -650 | AN86: =R[-1]C-R[-2]C4*R[-2]C -> 0 | AO86: =R[-1]C-R[-2]C4*R[-2]C -> 0 | AP86: =R[-1]C-R[-2]C4*R[-2]C -> 0 | AQ86: =R[-1]C-R[-2]C4*R[-2]C -> -650 | AR86: =R[-1]C-R[-2]C4*R[-2]C -> 0 | AS86: =R[-1]C-R[-2]C4*R[-2]C -> 0 | AT86: =R[-1]C-R[-2]C4*R[-2]C -> 0 | AU86: =R[-1]C-R[-2]C4*R[-2]C -> 0 | AV86: =R[-1]C-R[-2]C4*R[-2]C -> 0 | AW86: =R[-1]C-R[-2]C4*R[-2]C -> 0 | AX86: =R[-1]C-R[-2]C4*R[-2]C -> 0 | AY86: =R[-1]C-R[-2]C4*R[-2]C -> 0 | AZ86: =R[-1]C-R[-2]C4*R[-2]C -> 0 | BA86: =R[-1]C-R[-2]C4*R[-2]C -> 0 | BB86: =R[-1]C-R[-2]C4*R[-2]C -> 0 | BC86: =R[-1]C-R[-2]C4*R[-2]C -> 0 | BD86: =R[-1]C-R[-2]C4*R[-2]C -> 0 | BE86: =R[-1]C-R[-2]C4*R[-2]C -> 0 | BF86: =R[-1]C-R[-2]C4*R[-2]C -> 0 | BG86: =R[-1]C-R[-2]C4*R[-2]C -> -7150 | BO86: =SUM(RC[-61]:RC[-8]) -> -9100
A87: Usins OS/390 Unix System Services | B87: 2002-03-19T00:00:00.000 | C87: 3 | D87: 1595 | E87: 500 | F87: 0 | G87: 0 | H87: 0 | I87: 0 | J87: 0 | K87: 0 | L87: 0 | M87: 0 | N87: 0 | O87: 0 | P87: 0 | Q87: 0 | R87: 0 | S87: 0 | T87: 0 | U87: 0 | V87: 0 | W87: 0 | X87: 0 | Y87: 0 | Z87: 0 | AA87: 0 | AB87: 0 | AC87: 0 | AD87: 16 | AE87: 0 | AF87: 0 | AG87: 0 | AH87: 0 | AI87: 0 | AJ87: 0 | AK87: 0 | AL87: 0 | AM87: 0 | AN87: 0 | AO87: 0 | AP87: 0 | AQ87: 0 | AR87: 0 | AS87: 0 | AT87: 0 | AU87: 0 | AV87: 0 | AW87: 0 | AX87: 0 | AY87: 0 | AZ87: 0 | BA87: 0 | BB87: 0 | BC87: 0 | BD87: 0 | BE87: 0 | BF87: 0 | BG87: 0 | BK87: =SUM(RC[-57]:RC[-4]) -> 16 | BL87: =RC[-61]*RC[-1] -> 48
D88: Total | F88: =R[-1]C*R87C5 -> 0 | G88: =R[-1]C*R87C5 -> 0 | H88: =R[-1]C*R87C5 -> 0 | I88: =R[-1]C*R87C5 -> 0 | J88: =R[-1]C*R87C5 -> 0 | K88: =R[-1]C*R87C5 -> 0 | L88: =R[-1]C*R87C5 -> 0 | M88: =R[-1]C*R87C5 -> 0 | N88: =R[-1]C*R87C5 -> 0 | O88: =R[-1]C*R87C5 -> 0 | P88: =R[-1]C*R87C5 -> 0 | Q88: =R[-1]C*R87C5 -> 0 | R88: =R[-1]C*R87C5 -> 0 | S88: =R[-1]C*R87C5 -> 0 | T88: =R[-1]C*R87C5 -> 0 | U88: =R[-1]C*R87C5 -> 0 | V88: =R[-1]C*R87C5 -> 0 | W88: =R[-1]C*R87C5 -> 0 | X88: =R[-1]C*R87C5 -> 0 | Y88: =R[-1]C*R87C5 -> 0 | Z88: =R[-1]C*R87C5 -> 0 | AA88: =R[-1]C*R87C5 -> 0 | AB88: =R[-1]C*R87C5 -> 0 | AC88: =R[-1]C*R87C5 -> 0 | AD88: =R[-1]C*R87C5 -> 8000 | AE88: =R[-1]C*R87C5 -> 0 | AF88: =R[-1]C*R87C5 -> 0 | AG88: =R[-1]C*R87C5 -> 0 | AH88: =R[-1]C*R87C5 -> 0 | AI88: =R[-1]C*R87C5 -> 0 | AJ88: =R[-1]C*R87C5 -> 0 | AK88: =R[-1]C*R87C5 -> 0 | AL88: =R[-1]C*R87C5 -> 0 | AM88: =R[-1]C*R87C5 -> 0 | AN88: =R[-1]C*R87C5 -> 0 | AO88: =R[-1]C*R87C5 -> 0 | AP88: =R[-1]C*R87C5 -> 0 | AQ88: =R[-1]C*R87C5 -> 0 | AR88: =R[-1]C*R87C5 -> 0 | AS88: =R[-1]C*R87C5 -> 0 | AT88: =R[-1]C*R87C5 -> 0 | AU88: =R[-1]C*R87C5 -> 0 | AV88: =R[-1]C*R87C5 -> 0 | AW88: =R[-1]C*R87C5 -> 0 | AX88: =R[-1]C*R87C5 -> 0 | AY88: =R[-1]C*R87C5 -> 0 | AZ88: =R[-1]C*R87C5 -> 0 | BA88: =R[-1]C*R87C5 -> 0 | BB88: =R[-1]C*R87C5 -> 0 | BC88: =R[-1]C*R87C5 -> 0 | BD88: =R[-1]C*R87C5 -> 0 | BE88: =R[-1]C*R87C5 -> 0 | BF88: =R[-1]C*R87C5 -> 0 | BG88: =R[-1]C*R87C5 -> 0 | BM88: =R[-1]C[-61]*R[-1]C[-2] -> 25520 | BN88: =RC[-1]-RC[1] -> 17520 | BO88: =SUM(RC[-61]:RC[-8]) -> 8000
D89: Total Savings | F89: =R[-1]C-R[-2]C4*R[-2]C -> 0 | G89: =R[-1]C-R[-2]C4*R[-2]C -> 0 | H89: =R[-1]C-R[-2]C4*R[-2]C -> 0 | I89: =R[-1]C-R[-2]C4*R[-2]C -> 0 | J89: =R[-1]C-R[-2]C4*R[-2]C -> 0 | K89: =R[-1]C-R[-2]C4*R[-2]C -> 0 | L89: =R[-1]C-R[-2]C4*R[-2]C -> 0 | M89: =R[-1]C-R[-2]C4*R[-2]C -> 0 | N89: =R[-1]C-R[-2]C4*R[-2]C -> 0 | O89: =R[-1]C-R[-2]C4*R[-2]C -> 0 | P89: =R[-1]C-R[-2]C4*R[-2]C -> 0 | Q89: =R[-1]C-R[-2]C4*R[-2]C -> 0 | R89: =R[-1]C-R[-2]C4*R[-2]C -> 0 | S89: =R[-1]C-R[-2]C4*R[-2]C -> 0 | T89: =R[-1]C-R[-2]C4*R[-2]C -> 0 | U89: =R[-1]C-R[-2]C4*R[-2]C -> 0 | V89: =R[-1]C-R[-2]C4*R[-2]C -> 0 | W89: =R[-1]C-R[-2]C4*R[-2]C -> 0 | X89: =R[-1]C-R[-2]C4*R[-2]C -> 0 | Y89: =R[-1]C-R[-2]C4*R[-2]C -> 0 | Z89: =R[-1]C-R[-2]C4*R[-2]C -> 0 | AA89: =R[-1]C-R[-2]C4*R[-2]C -> 0 | AB89: =R[-1]C-R[-2]C4*R[-2]C -> 0 | AC89: =R[-1]C-R[-2]C4*R[-2]C -> 0 | AD89: =R[-1]C-R[-2]C4*R[-2]C -> -17520 | AE89: =R[-1]C-R[-2]C4*R[-2]C -> 0 | AF89: =R[-1]C-R[-2]C4*R[-2]C -> 0 | AG89: =R[-1]C-R[-2]C4*R[-2]C -> 0 | AH89: =R[-1]C-R[-2]C4*R[-2]C -> 0 | AI89: =R[-1]C-R[-2]C4*R[-2]C -> 0 | AJ89: =R[-1]C-R[-2]C4*R[-2]C -> 0 | AK89: =R[-1]C-R[-2]C4*R[-2]C -> 0 | AL89: =R[-1]C-R[-2]C4*R[-2]C -> 0 | AM89: =R[-1]C-R[-2]C4*R[-2]C -> 0 | AN89: =R[-1]C-R[-2]C4*R[-2]C -> 0 | AO89: =R[-1]C-R[-2]C4*R[-2]C -> 0 | AP89: =R[-1]C-R[-2]C4*R[-2]C -> 0 | AQ89: =R[-1]C-R[-2]C4*R[-2]C -> 0 | AR89: =R[-1]C-R[-2]C4*R[-2]C -> 0 | AS89: =R[-1]C-R[-2]C4*R[-2]C -> 0 | AT89: =R[-1]C-R[-2]C4*R[-2]C -> 0 | AU89: =R[-1]C-R[-2]C4*R[-2]C -> 0 | AV89: =R[-1]C-R[-2]C4*R[-2]C -> 0 | AW89: =R[-1]C-R[-2]C4*R[-2]C -> 0 | AX89: =R[-1]C-R[-2]C4*R[-2]C -> 0 | AY89: =R[-1]C-R[-2]C4*R[-2]C -> 0 | AZ89: =R[-1]C-R[-2]C4*R[-2]C -> 0 | BA89: =R[-1]C-R[-2]C4*R[-2]C -> 0 | BB89: =R[-1]C-R[-2]C4*R[-2]C -> 0 | BC89: =R[-1]C-R[-2]C4*R[-2]C -> 0 | BD89: =R[-1]C-R[-2]C4*R[-2]C -> 0 | BE89: =R[-1]C-R[-2]C4*R[-2]C -> 0 | BF89: =R[-1]C-R[-2]C4*R[-2]C -> 0 | BG89: =R[-1]C-R[-2]C4*R[-2]C -> 0 | BO89: =SUM(RC[-61]:RC[-8]) -> -17520
A90: Introduction to SAS | B90: 2002-03-20T00:00:00.000 | C90: 3 | D90: 1595 | E90: 525 | F90: 0 | G90: 0 | H90: 0 | I90: 0 | J90: 0 | K90: 3 | L90: 0 | M90: 0 | N90: 0 | O90: 0 | P90: 0 | Q90: 0 | R90: 0 | S90: 0 | T90: 0 | U90: 0 | V90: 0 | W90: 0 | X90: 5 | Y90: 0 | Z90: 0 | AA90: 0 | AB90: 0 | AC90: 0 | AD90: 0 | AE90: 0 | AF90: 0 | AG90: 0 | AH90: 0 | AI90: 0 | AJ90: 0 | AK90: 0 | AL90: 0 | AM90: 0 | AN90: 0 | AO90: 0 | AP90: 0 | AQ90: 0 | AR90: 0 | AS90: 0 | AT90: 0 | AU90: 0 | AV90: 0 | AW90: 0 | AX90: 1 | AY90: 0 | AZ90: 0 | BA90: 0 | BB90: 0 | BC90: 3 | BD90: 0 | BE90: 0 | BF90: 0 | BG90: 0 | BK90: =SUM(RC[-57]:RC[-4]) -> 12 | BL90: =RC[-61]*RC[-1] -> 36
D91: Total | F91: =R[-1]C*R90C5 -> 0 | G91: =R[-1]C*R90C5 -> 0 | H91: =R[-1]C*R90C5 -> 0 | I91: =R[-1]C*R90C5 -> 0 | J91: =R[-1]C*R90C5 -> 0 | K91: =R[-1]C*R90C5 -> 1575 | L91: =R[-1]C*R90C5 -> 0 | M91: =R[-1]C*R90C5 -> 0 | N91: =R[-1]C*R90C5 -> 0 | O91: =R[-1]C*R90C5 -> 0 | P91: =R[-1]C*R90C5 -> 0 | Q91: =R[-1]C*R90C5 -> 0 | R91: =R[-1]C*R90C5 -> 0 | S91: =R[-1]C*R90C5 -> 0 | T91: =R[-1]C*R90C5 -> 0 | U91: =R[-1]C*R90C5 -> 0 | V91: =R[-1]C*R90C5 -> 0 | W91: =R[-1]C*R90C5 -> 0 | X91: =R[-1]C*R90C5 -> 2625 | Y91: =R[-1]C*R90C5 -> 0 | Z91: =R[-1]C*R90C5 -> 0 | AA91: =R[-1]C*R90C5 -> 0 | AB91: =R[-1]C*R90C5 -> 0 | AC91: =R[-1]C*R90C5 -> 0 | AD91: =R[-1]C*R90C5 -> 0 | AE91: =R[-1]C*R90C5 -> 0 | AF91: =R[-1]C*R90C5 -> 0 | AG91: =R[-1]C*R90C5 -> 0 | AH91: =R[-1]C*R90C5 -> 0 | AI91: =R[-1]C*R90C5 -> 0 | AJ91: =R[-1]C*R90C5 -> 0 | AK91: =R[-1]C*R90C5 -> 0 | AL91: =R[-1]C*R90C5 -> 0 | AM91: =R[-1]C*R90C5 -> 0 | AN91: =R[-1]C*R90C5 -> 0 | AO91: =R[-1]C*R90C5 -> 0 | AP91: =R[-1]C*R90C5 -> 0 | AQ91: =R[-1]C*R90C5 -> 0 | AR91: =R[-1]C*R90C5 -> 0 | AS91: =R[-1]C*R90C5 -> 0 | AT91: =R[-1]C*R90C5 -> 0 | AU91: =R[-1]C*R90C5 -> 0 | AV91: =R[-1]C*R90C5 -> 0 | AW91: =R[-1]C*R90C5 -> 0 | AX91: =R[-1]C*R90C5 -> 525 | AY91: =R[-1]C*R90C5 -> 0 | AZ91: =R[-1]C*R90C5 -> 0 | BA91: =R[-1]C*R90C5 -> 0 | BB91: =R[-1]C*R90C5 -> 0 | BC91: =R[-1]C*R90C5 -> 1575 | BD91: =R[-1]C*R90C5 -> 0 | BE91: =R[-1]C*R90C5 -> 0 | BF91: =R[-1]C*R90C5 -> 0 | BG91: =R[-1]C*R90C5 -> 0 | BM91: =R[-1]C[-61]*R[-1]C[-2] -> 19140 | BN91: =RC[-1]-RC[1] -> 12840 | BO91: =SUM(RC[-61]:RC[-8]) -> 6300
D92: Total Savings | F92: =R[-1]C-R[-2]C4*R[-2]C -> 0 | G92: =R[-1]C-R[-2]C4*R[-2]C -> 0 | H92: =R[-1]C-R[-2]C4*R[-2]C -> 0 | I92: =R[-1]C-R[-2]C4*R[-2]C -> 0 | J92: =R[-1]C-R[-2]C4*R[-2]C -> 0 | K92: =R[-1]C-R[-2]C4*R[-2]C -> -3210 | L92: =R[-1]C-R[-2]C4*R[-2]C -> 0 | M92: =R[-1]C-R[-2]C4*R[-2]C -> 0 | N92: =R[-1]C-R[-2]C4*R[-2]C -> 0 | O92: =R[-1]C-R[-2]C4*R[-2]C -> 0 | P92: =R[-1]C-R[-2]C4*R[-2]C -> 0 | Q92: =R[-1]C-R[-2]C4*R[-2]C -> 0 | R92: =R[-1]C-R[-2]C4*R[-2]C -> 0 | S92: =R[-1]C-R[-2]C4*R[-2]C -> 0 | T92: =R[-1]C-R[-2]C4*R[-2]C -> 0 | U92: =R[-1]C-R[-2]C4*R[-2]C -> 0 | V92: =R[-1]C-R[-2]C4*R[-2]C -> 0 | W92: =R[-1]C-R[-2]C4*R[-2]C -> 0 | X92: =R[-1]C-R[-2]C4*R[-2]C -> -5350 | Y92: =R[-1]C-R[-2]C4*R[-2]C -> 0 | Z92: =R[-1]C-R[-2]C4*R[-2]C -> 0 | AA92: =R[-1]C-R[-2]C4*R[-2]C -> 0 | AB92: =R[-1]C-R[-2]C4*R[-2]C -> 0 | AC92: =R[-1]C-R[-2]C4*R[-2]C -> 0 | AD92: =R[-1]C-R[-2]C4*R[-2]C -> 0 | AE92: =R[-1]C-R[-2]C4*R[-2]C -> 0 | AF92: =R[-1]C-R[-2]C4*R[-2]C -> 0 | AG92: =R[-1]C-R[-2]C4*R[-2]C -> 0 | AH92: =R[-1]C-R[-2]C4*R[-2]C -> 0 | AI92: =R[-1]C-R[-2]C4*R[-2]C -> 0 | AJ92: =R[-1]C-R[-2]C4*R[-2]C -> 0 | AK92: =R[-1]C-R[-2]C4*R[-2]C -> 0 | AL92: =R[-1]C-R[-2]C4*R[-2]C -> 0 | AM92: =R[-1]C-R[-2]C4*R[-2]C -> 0 | AN92: =R[-1]C-R[-2]C4*R[-2]C -> 0 | AO92: =R[-1]C-R[-2]C4*R[-2]C -> 0 | AP92: =R[-1]C-R[-2]C4*R[-2]C -> 0 | AQ92: =R[-1]C-R[-2]C4*R[-2]C -> 0 | AR92: =R[-1]C-R[-2]C4*R[-2]C -> 0 | AS92: =R[-1]C-R[-2]C4*R[-2]C -> 0 | AT92: =R[-1]C-R[-2]C4*R[-2]C -> 0 | AU92: =R[-1]C-R[-2]C4*R[-2]C -> 0 | AV92: =R[-1]C-R[-2]C4*R[-2]C -> 0 | AW92: =R[-1]C-R[-2]C4*R[-2]C -> 0 | AX92: =R[-1]C-R[-2]C4*R[-2]C -> -1070 | AY92: =R[-1]C-R[-2]C4*R[-2]C -> 0 | AZ92: =R[-1]C-R[-2]C4*R[-2]C -> 0 | BA92: =R[-1]C-R[-2]C4*R[-2]C -> 0 | BB92: =R[-1]C-R[-2]C4*R[-2]C -> 0 | BC92: =R[-1]C-R[-2]C4*R[-2]C -> -3210 | BD92: =R[-1]C-R[-2]C4*R[-2]C -> 0 | BE92: =R[-1]C-R[-2]C4*R[-2]C -> 0 | BF92: =R[-1]C-R[-2]C4*R[-2]C -> 0 | BG92: =R[-1]C-R[-2]C4*R[-2]C -> 0 | BO92: =SUM(RC[-61]:RC[-8]) -> -12840
A93: Introduction to JAVA Programming | B93: 2002-04-01T00:00:00.000 | C93: 5 | D93: 2595 | E93: 1000 | F93: 0 | G93: 0 | H93: 0 | I93: 0 | J93: 0 | K93: 1 | L93: 0 | M93: 0 | N93: 0 | O93: 0 | P93: 0 | Q93: 0 | R93: 0 | S93: 0 | T93: 0 | U93: 0 | V93: 0 | W93: 0 | X93: 0 | Y93: 0 | Z93: 0 | AA93: 0 | AB93: 0 | AC93: 0 | AD93: 1 | AE93: 0 | AF93: 4 | AG93: 0 | AH93: 0 | AI93: 0 | AJ93: 0 | AK93: 0 | AL93: 0 | AM93: 0 | AN93: 0 | AO93: 0 | AP93: 0 | AQ93: 0 | AR93: 0 | AS93: 0 | AT93: 0 | AU93: 0 | AV93: 0 | AW93: 0 | AX93: 0 | AY93: 2 | AZ93: 0 | BA93: 0 | BB93: 0 | BC93: 0 | BD93: 0 | BE93: 0 | BF93: 0 | BG93: 1 | BK93: =SUM(RC[-57]:RC[-4]) -> 9 | BL93: =RC[-61]*RC[-1] -> 45
D94: Total | F94: =R[-1]C*R93C5 -> 0 | G94: =R[-1]C*R93C5 -> 0 | H94: =R[-1]C*R93C5 -> 0 | I94: =R[-1]C*R93C5 -> 0 | J94: =R[-1]C*R93C5 -> 0 | K94: =R[-1]C*R93C5 -> 1000 | L94: =R[-1]C*R93C5 -> 0 | M94: =R[-1]C*R93C5 -> 0 | N94: =R[-1]C*R93C5 -> 0 | O94: =R[-1]C*R93C5 -> 0 | P94: =R[-1]C*R93C5 -> 0 | Q94: =R[-1]C*R93C5 -> 0 | R94: =R[-1]C*R93C5 -> 0 | S94: =R[-1]C*R93C5 -> 0 | T94: =R[-1]C*R93C5 -> 0 | U94: =R[-1]C*R93C5 -> 0 | V94: =R[-1]C*R93C5 -> 0 | W94: =R[-1]C*R93C5 -> 0 | X94: =R[-1]C*R93C5 -> 0 | Y94: =R[-1]C*R93C5 -> 0 | Z94: =R[-1]C*R93C5 -> 0 | AA94: =R[-1]C*R93C5 -> 0 | AB94: =R[-1]C*R93C5 -> 0 | AC94: =R[-1]C*R93C5 -> 0 | AD94: =R[-1]C*R93C5 -> 1000 | AE94: =R[-1]C*R93C5 -> 0 | AF94: =R[-1]C*R93C5 -> 4000 | AG94: =R[-1]C*R93C5 -> 0 | AH94: =R[-1]C*R93C5 -> 0 | AI94: =R[-1]C*R93C5 -> 0 | AJ94: =R[-1]C*R93C5 -> 0 | AK94: =R[-1]C*R93C5 -> 0 | AL94: =R[-1]C*R93C5 -> 0 | AM94: =R[-1]C*R93C5 -> 0 | AN94: =R[-1]C*R93C5 -> 0 | AO94: =R[-1]C*R93C5 -> 0 | AP94: =R[-1]C*R93C5 -> 0 | AQ94: =R[-1]C*R93C5 -> 0 | AR94: =R[-1]C*R93C5 -> 0 | AS94: =R[-1]C*R93C5 -> 0 | AT94: =R[-1]C*R93C5 -> 0 | AU94: =R[-1]C*R93C5 -> 0 | AV94: =R[-1]C*R93C5 -> 0 | AW94: =R[-1]C*R93C5 -> 0 | AX94: =R[-1]C*R93C5 -> 0 | AY94: =R[-1]C*R93C5 -> 2000 | AZ94: =R[-1]C*R93C5 -> 0 | BA94: =R[-1]C*R93C5 -> 0 | BB94: =R[-1]C*R93C5 -> 0 | BC94: =R[-1]C*R93C5 -> 0 | BD94: =R[-1]C*R93C5 -> 0 | BE94: =R[-1]C*R93C5 -> 0 | BF94: =R[-1]C*R93C5 -> 0 | BG94: =R[-1]C*R93C5 -> 1000 | BM94: =R[-1]C[-61]*R[-1]C[-2] -> 23355 | BN94: =RC[-1]-RC[1] -> 14355 | BO94: =SUM(RC[-61]:RC[-8]) -> 9000
D95: Total Savings | F95: =R[-1]C-R[-2]C4*R[-2]C -> 0 | G95: =R[-1]C-R[-2]C4*R[-2]C -> 0 | H95: =R[-1]C-R[-2]C4*R[-2]C -> 0 | I95: =R[-1]C-R[-2]C4*R[-2]C -> 0 | J95: =R[-1]C-R[-2]C4*R[-2]C -> 0 | K95: =R[-1]C-R[-2]C4*R[-2]C -> -1595 | L95: =R[-1]C-R[-2]C4*R[-2]C -> 0 | M95: =R[-1]C-R[-2]C4*R[-2]C -> 0 | N95: =R[-1]C-R[-2]C4*R[-2]C -> 0 | O95: =R[-1]C-R[-2]C4*R[-2]C -> 0 | P95: =R[-1]C-R[-2]C4*R[-2]C -> 0 | Q95: =R[-1]C-R[-2]C4*R[-2]C -> 0 | R95: =R[-1]C-R[-2]C4*R[-2]C -> 0 | S95: =R[-1]C-R[-2]C4*R[-2]C -> 0 | T95: =R[-1]C-R[-2]C4*R[-2]C -> 0 | U95: =R[-1]C-R[-2]C4*R[-2]C -> 0 | V95: =R[-1]C-R[-2]C4*R[-2]C -> 0 | W95: =R[-1]C-R[-2]C4*R[-2]C -> 0 | X95: =R[-1]C-R[-2]C4*R[-2]C -> 0 | Y95: =R[-1]C-R[-2]C4*R[-2]C -> 0 | Z95: =R[-1]C-R[-2]C4*R[-2]C -> 0 | AA95: =R[-1]C-R[-2]C4*R[-2]C -> 0 | AB95: =R[-1]C-R[-2]C4*R[-2]C -> 0 | AC95: =R[-1]C-R[-2]C4*R[-2]C -> 0 | AD95: =R[-1]C-R[-2]C4*R[-2]C -> -1595 | AE95: =R[-1]C-R[-2]C4*R[-2]C -> 0 | AF95: =R[-1]C-R[-2]C4*R[-2]C -> -6380 | AG95: =R[-1]C-R[-2]C4*R[-2]C -> 0 | AH95: =R[-1]C-R[-2]C4*R[-2]C -> 0 | AI95: =R[-1]C-R[-2]C4*R[-2]C -> 0 | AJ95: =R[-1]C-R[-2]C4*R[-2]C -> 0 | AK95: =R[-1]C-R[-2]C4*R[-2]C -> 0 | AL95: =R[-1]C-R[-2]C4*R[-2]C -> 0 | AM95: =R[-1]C-R[-2]C4*R[-2]C -> 0 | AN95: =R[-1]C-R[-2]C4*R[-2]C -> 0 | AO95: =R[-1]C-R[-2]C4*R[-2]C -> 0 | AP95: =R[-1]C-R[-2]C4*R[-2]C -> 0 | AQ95: =R[-1]C-R[-2]C4*R[-2]C -> 0 | AR95: =R[-1]C-R[-2]C4*R[-2]C -> 0 | AS95: =R[-1]C-R[-2]C4*R[-2]C -> 0 | AT95: =R[-1]C-R[-2]C4*R[-2]C -> 0 | AU95: =R[-1]C-R[-2]C4*R[-2]C -> 0 | AV95: =R[-1]C-R[-2]C4*R[-2]C -> 0 | AW95: =R[-1]C-R[-2]C4*R[-2]C -> 0 | AX95: =R[-1]C-R[-2]C4*R[-2]C -> 0 | AY95: =R[-1]C-R[-2]C4*R[-2]C -> -3190 | AZ95: =R[-1]C-R[-2]C4*R[-2]C -> 0 | BA95: =R[-1]C-R[-2]C4*R[-2]C -> 0 | BB95: =R[-1]C-R[-2]C4*R[-2]C -> 0 | BC95: =R[-1]C-R[-2]C4*R[-2]C -> 0 | BD95: =R[-1]C-R[-2]C4*R[-2]C -> 0 | BE95: =R[-1]C-R[-2]C4*R[-2]C -> 0 | BF95: =R[-1]C-R[-2]C4*R[-2]C -> 0 | BG95: =R[-1]C-R[-2]C4*R[-2]C -> -1595 | BO95: =SUM(RC[-61]:RC[-8]) -> -14355
A96: VB 6.0 Advanced - Dev. COM/DCOM w/ VB | B96: 2002-04-01T00:00:00.000 | C96: 3 | D96: 1500 | E96: 525 | F96: 0 | G96: 0 | H96: 0 | I96: 1 | J96: 1 | K96: 1 | L96: 0 | M96: 0 | N96: 0 | O96: 0 | P96: 0 | Q96: 0 | R96: 0 | S96: 0 | T96: 0 | U96: 0 | V96: 0 | W96: 0 | X96: 0 | Y96: 0 | Z96: 0 | AA96: 0 | AB96: 0 | AC96: 0 | AD96: 0 | AE96: 0 | AF96: 1 | AG96: 3 | AH96: 0 | AI96: 0 | AJ96: 0 | AK96: 0 | AL96: 0 | AM96: 0 | AN96: 0 | AO96: 0 | AP96: 0 | AQ96: 0 | AR96: 0 | AS96: 0 | AT96: 0 | AU96: 0 | AV96: 0 | AW96: 0 | AX96: 0 | AY96: 0 | AZ96: 0 | BA96: 0 | BB96: 0 | BC96: 0 | BD96: 0 | BE96: 0 | BF96: 0 | BG96: 0 | BK96: =SUM(RC[-57]:RC[-4]) -> 7 | BL96: =RC[-61]*RC[-1] -> 21
D97: Total | F97: =R[-1]C*R96C5 -> 0 | G97: =R[-1]C*R96C5 -> 0 | H97: =R[-1]C*R96C5 -> 0 | I97: =R[-1]C*R96C5 -> 525 | J97: =R[-1]C*R96C5 -> 525 | K97: =R[-1]C*R96C5 -> 525 | L97: =R[-1]C*R96C5 -> 0 | M97: =R[-1]C*R96C5 -> 0 | N97: =R[-1]C*R96C5 -> 0 | O97: =R[-1]C*R96C5 -> 0 | P97: =R[-1]C*R96C5 -> 0 | Q97: =R[-1]C*R96C5 -> 0 | R97: =R[-1]C*R96C5 -> 0 | S97: =R[-1]C*R96C5 -> 0 | T97: =R[-1]C*R96C5 -> 0 | U97: =R[-1]C*R96C5 -> 0 | V97: =R[-1]C*R96C5 -> 0 | W97: =R[-1]C*R96C5 -> 0 | X97: =R[-1]C*R96C5 -> 0 | Y97: =R[-1]C*R96C5 -> 0 | Z97: =R[-1]C*R96C5 -> 0 | AA97: =R[-1]C*R96C5 -> 0 | AB97: =R[-1]C*R96C5 -> 0 | AC97: =R[-1]C*R96C5 -> 0 | AD97: =R[-1]C*R96C5 -> 0 | AE97: =R[-1]C*R96C5 -> 0 | AF97: =R[-1]C*R96C5 -> 525 | AG97: =R[-1]C*R96C5 -> 1575 | AH97: =R[-1]C*R96C5 -> 0 | AI97: =R[-1]C*R96C5 -> 0 | AJ97: =R[-1]C*R96C5 -> 0 | AK97: =R[-1]C*R96C5 -> 0 | AL97: =R[-1]C*R96C5 -> 0 | AM97: =R[-1]C*R96C5 -> 0 | AN97: =R[-1]C*R96C5 -> 0 | AO97: =R[-1]C*R96C5 -> 0 | AP97: =R[-1]C*R96C5 -> 0 | AQ97: =R[-1]C*R96C5 -> 0 | AR97: =R[-1]C*R96C5 -> 0 | AS97: =R[-1]C*R96C5 -> 0 | AT97: =R[-1]C*R96C5 -> 0 | AU97: =R[-1]C*R96C5 -> 0 | AV97: =R[-1]C*R96C5 -> 0 | AW97: =R[-1]C*R96C5 -> 0 | AX97: =R[-1]C*R96C5 -> 0 | AY97: =R[-1]C*R96C5 -> 0 | AZ97: =R[-1]C*R96C5 -> 0 | BA97: =R[-1]C*R96C5 -> 0 | BB97: =R[-1]C*R96C5 -> 0 | BC97: =R[-1]C*R96C5 -> 0 | BD97: =R[-1]C*R96C5 -> 0 | BE97: =R[-1]C*R96C5 -> 0 | BF97: =R[-1]C*R96C5 -> 0 | BG97: =R[-1]C*R96C5 -> 0 | BM97: =R[-1]C[-61]*R[-1]C[-2] -> 10500 | BN97: =RC[-1]-RC[1] -> 6825 | BO97: =SUM(RC[-61]:RC[-8]) -> 3675
D98: Total Savings | F98: =R[-1]C-R[-2]C4*R[-2]C -> 0 | G98: =R[-1]C-R[-2]C4*R[-2]C -> 0 | H98: =R[-1]C-R[-2]C4*R[-2]C -> 0 | I98: =R[-1]C-R[-2]C4*R[-2]C -> -975 | J98: =R[-1]C-R[-2]C4*R[-2]C -> -975 | K98: =R[-1]C-R[-2]C4*R[-2]C -> -975 | L98: =R[-1]C-R[-2]C4*R[-2]C -> 0 | M98: =R[-1]C-R[-2]C4*R[-2]C -> 0 | N98: =R[-1]C-R[-2]C4*R[-2]C -> 0 | O98: =R[-1]C-R[-2]C4*R[-2]C -> 0 | P98: =R[-1]C-R[-2]C4*R[-2]C -> 0 | Q98: =R[-1]C-R[-2]C4*R[-2]C -> 0 | R98: =R[-1]C-R[-2]C4*R[-2]C -> 0 | S98: =R[-1]C-R[-2]C4*R[-2]C -> 0 | T98: =R[-1]C-R[-2]C4*R[-2]C -> 0 | U98: =R[-1]C-R[-2]C4*R[-2]C -> 0 | V98: =R[-1]C-R[-2]C4*R[-2]C -> 0 | W98: =R[-1]C-R[-2]C4*R[-2]C -> 0 | X98: =R[-1]C-R[-2]C4*R[-2]C -> 0 | Y98: =R[-1]C-R[-2]C4*R[-2]C -> 0 | Z98: =R[-1]C-R[-2]C4*R[-2]C -> 0 | AA98: =R[-1]C-R[-2]C4*R[-2]C -> 0 | AB98: =R[-1]C-R[-2]C4*R[-2]C -> 0 | AC98: =R[-1]C-R[-2]C4*R[-2]C -> 0 | AD98: =R[-1]C-R[-2]C4*R[-2]C -> 0 | AE98: =R[-1]C-R[-2]C4*R[-2]C -> 0 | AF98: =R[-1]C-R[-2]C4*R[-2]C -> -975 | AG98: =R[-1]C-R[-2]C4*R[-2]C -> -2925 | AH98: =R[-1]C-R[-2]C4*R[-2]C -> 0 | AI98: =R[-1]C-R[-2]C4*R[-2]C -> 0 | AJ98: =R[-1]C-R[-2]C4*R[-2]C -> 0 | AK98: =R[-1]C-R[-2]C4*R[-2]C -> 0 | AL98: =R[-1]C-R[-2]C4*R[-2]C -> 0 | AM98: =R[-1]C-R[-2]C4*R[-2]C -> 0 | AN98: =R[-1]C-R[-2]C4*R[-2]C -> 0 | AO98: =R[-1]C-R[-2]C4*R[-2]C -> 0 | AP98: =R[-1]C-R[-2]C4*R[-2]C -> 0 | AQ98: =R[-1]C-R[-2]C4*R[-2]C -> 0 | AR98: =R[-1]C-R[-2]C4*R[-2]C -> 0 | AS98: =R[-1]C-R[-2]C4*R[-2]C -> 0 | AT98: =R[-1]C-R[-2]C4*R[-2]C -> 0 | AU98: =R[-1]C-R[-2]C4*R[-2]C -> 0 | AV98: =R[-1]C-R[-2]C4*R[-2]C -> 0 | AW98: =R[-1]C-R[-2]C4*R[-2]C -> 0 | AX98: =R[-1]C-R[-2]C4*R[-2]C -> 0 | AY98: =R[-1]C-R[-2]C4*R[-2]C -> 0 | AZ98: =R[-1]C-R[-2]C4*R[-2]C -> 0 | BA98: =R[-1]C-R[-2]C4*R[-2]C -> 0 | BB98: =R[-1]C-R[-2]C4*R[-2]C -> 0 | BC98: =R[-1]C-R[-2]C4*R[-2]C -> 0 | BD98: =R[-1]C-R[-2]C4*R[-2]C -> 0 | BE98: =R[-1]C-R[-2]C4*R[-2]C -> 0 | BF98: =R[-1]C-R[-2]C4*R[-2]C -> 0 | BG98: =R[-1]C-R[-2]C4*R[-2]C -> 0 | BO98: =SUM(RC[-61]:RC[-8]) -> -6825
A99: Fast Start in Business Systems Analysis | B99: 2002-04-01T00:00:00.000 | C99: 3 | D99: 1800 | E99: 550 | F99: 0 | G99: 0 | H99: 0 | I99: 0 | J99: 0 | K99: 1 | L99: 0 | M99: 0 | N99: 0 | O99: 0 | P99: 0 | Q99: 0 | R99: 0 | S99: 0 | T99: 0 | U99: 0 | V99: 0 | W99: 5 | X99: 0 | Y99: 0 | Z99: 0 | AA99: 0 | AB99: 0 | AC99: 0 | AD99: 0 | AE99: 0 | AF99: 0 | AG99: 0 | AH99: 0 | AI99: 0 | AJ99: 0 | AK99: 0 | AL99: 0 | AM99: 0 | AN99: 0 | AO99: 0 | AP99: 0 | AQ99: 0 | AR99: 0 | AS99: 0 | AT99: 0 | AU99: 0 | AV99: 0 | AW99: 0 | AX99: 0 | AY99: 0 | AZ99: 0 | BA99: 0 | BB99: 0 | BC99: 0 | BD99: 0 | BE99: 0 | BF99: 0 | BG99: 14 | BK99: =SUM(RC[-57]:RC[-4]) -> 20 | BL99: =RC[-61]*RC[-1] -> 60
D100: Total | F100: =R[-1]C*R99C5 -> 0 | G100: =R[-1]C*R99C5 -> 0 | H100: =R[-1]C*R99C5 -> 0 | I100: =R[-1]C*R99C5 -> 0 | J100: =R[-1]C*R99C5 -> 0 | K100: =R[-1]C*R99C5 -> 550 | L100: =R[-1]C*R99C5 -> 0 | M100: =R[-1]C*R99C5 -> 0 | N100: =R[-1]C*R99C5 -> 0 | O100: =R[-1]C*R99C5 -> 0 | P100: =R[-1]C*R99C5 -> 0 | Q100: =R[-1]C*R99C5 -> 0 | R100: =R[-1]C*R99C5 -> 0 | S100: =R[-1]C*R99C5 -> 0 | T100: =R[-1]C*R99C5 -> 0 | U100: =R[-1]C*R99C5 -> 0 | V100: =R[-1]C*R99C5 -> 0 | W100: =R[-1]C*R99C5 -> 2750 | X100: =R[-1]C*R99C5 -> 0 | Y100: =R[-1]C*R99C5 -> 0 | Z100: =R[-1]C*R99C5 -> 0 | AA100: =R[-1]C*R99C5 -> 0 | AB100: =R[-1]C*R99C5 -> 0 | AC100: =R[-1]C*R99C5 -> 0 | AD100: =R[-1]C*R99C5 -> 0 | AE100: =R[-1]C*R99C5 -> 0 | AF100: =R[-1]C*R99C5 -> 0 | AG100: =R[-1]C*R99C5 -> 0 | AH100: =R[-1]C*R99C5 -> 0 | AI100: =R[-1]C*R99C5 -> 0 | AJ100: =R[-1]C*R99C5 -> 0 | AK100: =R[-1]C*R99C5 -> 0 | AL100: =R[-1]C*R99C5 -> 0 | AM100: =R[-1]C*R99C5 -> 0 | AN100: =R[-1]C*R99C5 -> 0 | AO100: =R[-1]C*R99C5 -> 0 | AP100: =R[-1]C*R99C5 -> 0 | AQ100: =R[-1]C*R99C5 -> 0 | AR100: =R[-1]C*R99C5 -> 0 | AS100: =R[-1]C*R99C5 -> 0 | AT100: =R[-1]C*R99C5 -> 0 | AU100: =R[-1]C*R99C5 -> 0 | AV100: =R[-1]C*R99C5 -> 0 | AW100: =R[-1]C*R99C5 -> 0 | AX100: =R[-1]C*R99C5 -> 0 | AY100: =R[-1]C*R99C5 -> 0 | AZ100: =R[-1]C*R99C5 -> 0 | BA100: =R[-1]C*R99C5 -> 0 | BB100: =R[-1]C*R99C5 -> 0 | BC100: =R[-1]C*R99C5 -> 0 | BD100: =R[-1]C*R99C5 -> 0 | BE100: =R[-1]C*R99C5 -> 0 | BF100: =R[-1]C*R99C5 -> 0 | BG100: =R[-1]C*R99C5 -> 7700 | BM100: =R[-1]C[-61]*R[-1]C[-2] -> 36000 | BN100: =RC[-1]-RC[1] -> 25000 | BO100: =SUM(RC[-61]:RC[-8]) -> 11000
D101: Total Savings | F101: =R[-1]C-R[-2]C4*R[-2]C -> 0 | G101: =R[-1]C-R[-2]C4*R[-2]C -> 0 | H101: =R[-1]C-R[-2]C4*R[-2]C -> 0 | I101: =R[-1]C-R[-2]C4*R[-2]C -> 0 | J101: =R[-1]C-R[-2]C4*R[-2]C -> 0 | K101: =R[-1]C-R[-2]C4*R[-2]C -> -1250 | L101: =R[-1]C-R[-2]C4*R[-2]C -> 0 | M101: =R[-1]C-R[-2]C4*R[-2]C -> 0 | N101: =R[-1]C-R[-2]C4*R[-2]C -> 0 | O101: =R[-1]C-R[-2]C4*R[-2]C -> 0 | P101: =R[-1]C-R[-2]C4*R[-2]C -> 0 | Q101: =R[-1]C-R[-2]C4*R[-2]C -> 0 | R101: =R[-1]C-R[-2]C4*R[-2]C -> 0 | S101: =R[-1]C-R[-2]C4*R[-2]C -> 0 | T101: =R[-1]C-R[-2]C4*R[-2]C -> 0 | U101: =R[-1]C-R[-2]C4*R[-2]C -> 0 | V101: =R[-1]C-R[-2]C4*R[-2]C -> 0 | W101: =R[-1]C-R[-2]C4*R[-2]C -> -6250 | X101: =R[-1]C-R[-2]C4*R[-2]C -> 0 | Y101: =R[-1]C-R[-2]C4*R[-2]C -> 0 | Z101: =R[-1]C-R[-2]C4*R[-2]C -> 0 | AA101: =R[-1]C-R[-2]C4*R[-2]C -> 0 | AB101: =R[-1]C-R[-2]C4*R[-2]C -> 0 | AC101: =R[-1]C-R[-2]C4*R[-2]C -> 0 | AD101: =R[-1]C-R[-2]C4*R[-2]C -> 0 | AE101: =R[-1]C-R[-2]C4*R[-2]C -> 0 | AF101: =R[-1]C-R[-2]C4*R[-2]C -> 0 | AG101: =R[-1]C-R[-2]C4*R[-2]C -> 0 | AH101: =R[-1]C-R[-2]C4*R[-2]C -> 0 | AI101: =R[-1]C-R[-2]C4*R[-2]C -> 0 | AJ101: =R[-1]C-R[-2]C4*R[-2]C -> 0 | AK101: =R[-1]C-R[-2]C4*R[-2]C -> 0 | AL101: =R[-1]C-R[-2]C4*R[-2]C -> 0 | AM101: =R[-1]C-R[-2]C4*R[-2]C -> 0 | AN101: =R[-1]C-R[-2]C4*R[-2]C -> 0 | AO101: =R[-1]C-R[-2]C4*R[-2]C -> 0 | AP101: =R[-1]C-R[-2]C4*R[-2]C -> 0 | AQ101: =R[-1]C-R[-2]C4*R[-2]C -> 0 | AR101: =R[-1]C-R[-2]C4*R[-2]C -> 0 | AS101: =R[-1]C-R[-2]C4*R[-2]C -> 0 | AT101: =R[-1]C-R[-2]C4*R[-2]C -> 0 | AU101: =R[-1]C-R[-2]C4*R[-2]C -> 0 | AV101: =R[-1]C-R[-2]C4*R[-2]C -> 0 | AW101: =R[-1]C-R[-2]C4*R[-2]C -> 0 | AX101: =R[-1]C-R[-2]C4*R[-2]C -> 0 | AY101: =R[-1]C-R[-2]C4*R[-2]C -> 0 | AZ101: =R[-1]C-R[-2]C4*R[-2]C -> 0 | BA101: =R[-1]C-R[-2]C4*R[-2]C -> 0 | BB101: =R[-1]C-R[-2]C4*R[-2]C -> 0 | BC101: =R[-1]C-R[-2]C4*R[-2]C -> 0 | BD101: =R[-1]C-R[-2]C4*R[-2]C -> 0 | BE101: =R[-1]C-R[-2]C4*R[-2]C -> 0 | BF101: =R[-1]C-R[-2]C4*R[-2]C -> 0 | BG101: =R[-1]C-R[-2]C4*R[-2]C -> -17500 | BO101: =SUM(RC[-61]:RC[-8]) -> -25000
A102: ASP - Active Server Pages | B102: 2002-04-22T00:00:00.000 | C102: 4 | D102: 1800 | E102: 700 | F102: 0 | G102: 0 | H102: 0 | I102: 0 | J102: 2 | K102: 0 | L102: 1 | M102: 5 | N102: 0 | O102: 0 | P102: 0 | Q102: 0 | R102: 0 | S102: 0 | T102: 0 | U102: 0 | V102: 0 | W102: 2 | X102: 0 | Y102: 0 | Z102: 0 | AA102: 0 | AB102: 0 | AC102: 0 | AD102: 0 | AE102: 0 | AF102: 0 | AG102: 0 | AH102: 0 | AI102: 0 | AJ102: 0 | AK102: 0 | AL102: 0 | AM102: 0 | AN102: 0 | AO102: 0 | AP102: 0 | AQ102: 0 | AR102: 0 | AS102: 0 | AT102: 0 | AU102: 0 | AV102: 0 | AW102: 0 | AX102: 0 | AY102: 0 | AZ102: 0 | BA102: 0 | BB102: 0 | BC102: 0 | BD102: 0 | BE102: 0 | BF102: 0 | BG102: 0 | BK102: =SUM(RC[-57]:RC[-4]) -> 10 | BL102: =RC[-61]*RC[-1] -> 40
D103: Total | F103: =R[-1]C*R102C5 -> 0 | G103: =R[-1]C*R102C5 -> 0 | H103: =R[-1]C*R102C5 -> 0 | I103: =R[-1]C*R102C5 -> 0 | J103: =R[-1]C*R102C5 -> 1400 | K103: =R[-1]C*R102C5 -> 0 | L103: =R[-1]C*R102C5 -> 700 | M103: =R[-1]C*R102C5 -> 3500 | N103: =R[-1]C*R102C5 -> 0 | O103: =R[-1]C*R102C5 -> 0 | P103: =R[-1]C*R102C5 -> 0 | Q103: =R[-1]C*R102C5 -> 0 | R103: =R[-1]C*R102C5 -> 0 | S103: =R[-1]C*R102C5 -> 0 | T103: =R[-1]C*R102C5 -> 0 | U103: =R[-1]C*R102C5 -> 0 | V103: =R[-1]C*R102C5 -> 0 | W103: =R[-1]C*R102C5 -> 1400 | X103: =R[-1]C*R102C5 -> 0 | Y103: =R[-1]C*R102C5 -> 0 | Z103: =R[-1]C*R102C5 -> 0 | AA103: =R[-1]C*R102C5 -> 0 | AB103: =R[-1]C*R102C5 -> 0 | AC103: =R[-1]C*R102C5 -> 0 | AD103: =R[-1]C*R102C5 -> 0 | AE103: =R[-1]C*R102C5 -> 0 | AF103: =R[-1]C*R102C5 -> 0 | AG103: =R[-1]C*R102C5 -> 0 | AH103: =R[-1]C*R102C5 -> 0 | AI103: =R[-1]C*R102C5 -> 0 | AJ103: =R[-1]C*R102C5 -> 0 | AK103: =R[-1]C*R102C5 -> 0 | AL103: =R[-1]C*R102C5 -> 0 | AM103: =R[-1]C*R102C5 -> 0 | AN103: =R[-1]C*R102C5 -> 0 | AO103: =R[-1]C*R102C5 -> 0 | AP103: =R[-1]C*R102C5 -> 0 | AQ103: =R[-1]C*R102C5 -> 0 | AR103: =R[-1]C*R102C5 -> 0 | AS103: =R[-1]C*R102C5 -> 0 | AT103: =R[-1]C*R102C5 -> 0 | AU103: =R[-1]C*R102C5 -> 0 | AV103: =R[-1]C*R102C5 -> 0 | AW103: =R[-1]C*R102C5 -> 0 | AX103: =R[-1]C*R102C5 -> 0 | AY103: =R[-1]C*R102C5 -> 0 | AZ103: =R[-1]C*R102C5 -> 0 | BA103: =R[-1]C*R102C5 -> 0 | BB103: =R[-1]C*R102C5 -> 0 | BC103: =R[-1]C*R102C5 -> 0 | BD103: =R[-1]C*R102C5 -> 0 | BE103: =R[-1]C*R102C5 -> 0 | BF103: =R[-1]C*R102C5 -> 0 | BG103: =R[-1]C*R102C5 -> 0 | BM103: =R[-1]C[-61]*R[-1]C[-2] -> 18000 | BN103: =RC[-1]-RC[1] -> 11000 | BO103: =SUM(RC[-61]:RC[-8]) -> 7000
D104: Total Savings | F104: =R[-1]C-R[-2]C4*R[-2]C -> 0 | G104: =R[-1]C-R[-2]C4*R[-2]C -> 0 | H104: =R[-1]C-R[-2]C4*R[-2]C -> 0 | I104: =R[-1]C-R[-2]C4*R[-2]C -> 0 | J104: =R[-1]C-R[-2]C4*R[-2]C -> -2200 | K104: =R[-1]C-R[-2]C4*R[-2]C -> 0 | L104: =R[-1]C-R[-2]C4*R[-2]C -> -1100 | M104: =R[-1]C-R[-2]C4*R[-2]C -> -5500 | N104: =R[-1]C-R[-2]C4*R[-2]C -> 0 | O104: =R[-1]C-R[-2]C4*R[-2]C -> 0 | P104: =R[-1]C-R[-2]C4*R[-2]C -> 0 | Q104: =R[-1]C-R[-2]C4*R[-2]C -> 0 | R104: =R[-1]C-R[-2]C4*R[-2]C -> 0 | S104: =R[-1]C-R[-2]C4*R[-2]C -> 0 | T104: =R[-1]C-R[-2]C4*R[-2]C -> 0 | U104: =R[-1]C-R[-2]C4*R[-2]C -> 0 | V104: =R[-1]C-R[-2]C4*R[-2]C -> 0 | W104: =R[-1]C-R[-2]C4*R[-2]C -> -2200 | X104: =R[-1]C-R[-2]C4*R[-2]C -> 0 | Y104: =R[-1]C-R[-2]C4*R[-2]C -> 0 | Z104: =R[-1]C-R[-2]C4*R[-2]C -> 0 | AA104: =R[-1]C-R[-2]C4*R[-2]C -> 0 | AB104: =R[-1]C-R[-2]C4*R[-2]C -> 0 | AC104: =R[-1]C-R[-2]C4*R[-2]C -> 0 | AD104: =R[-1]C-R[-2]C4*R[-2]C -> 0 | AE104: =R[-1]C-R[-2]C4*R[-2]C -> 0 | AF104: =R[-1]C-R[-2]C4*R[-2]C -> 0 | AG104: =R[-1]C-R[-2]C4*R[-2]C -> 0 | AH104: =R[-1]C-R[-2]C4*R[-2]C -> 0 | AI104: =R[-1]C-R[-2]C4*R[-2]C -> 0 | AJ104: =R[-1]C-R[-2]C4*R[-2]C -> 0 | AK104: =R[-1]C-R[-2]C4*R[-2]C -> 0 | AL104: =R[-1]C-R[-2]C4*R[-2]C -> 0 | AM104: =R[-1]C-R[-2]C4*R[-2]C -> 0 | AN104: =R[-1]C-R[-2]C4*R[-2]C -> 0 | AO104: =R[-1]C-R[-2]C4*R[-2]C -> 0 | AP104: =R[-1]C-R[-2]C4*R[-2]C -> 0 | AQ104: =R[-1]C-R[-2]C4*R[-2]C -> 0 | AR104: =R[-1]C-R[-2]C4*R[-2]C -> 0 | AS104: =R[-1]C-R[-2]C4*R[-2]C -> 0 | AT104: =R[-1]C-R[-2]C4*R[-2]C -> 0 | AU104: =R[-1]C-R[-2]C4*R[-2]C -> 0 | AV104: =R[-1]C-R[-2]C4*R[-2]C -> 0 | AW104: =R[-1]C-R[-2]C4*R[-2]C -> 0 | AX104: =R[-1]C-R[-2]C4*R[-2]C -> 0 | AY104: =R[-1]C-R[-2]C4*R[-2]C -> 0 | AZ104: =R[-1]C-R[-2]C4*R[-2]C -> 0 | BA104: =R[-1]C-R[-2]C4*R[-2]C -> 0 | BB104: =R[-1]C-R[-2]C4*R[-2]C -> 0 | BC104: =R[-1]C-R[-2]C4*R[-2]C -> 0 | BD104: =R[-1]C-R[-2]C4*R[-2]C -> 0 | BE104: =R[-1]C-R[-2]C4*R[-2]C -> 0 | BF104: =R[-1]C-R[-2]C4*R[-2]C -> 0 | BG104: =R[-1]C-R[-2]C4*R[-2]C -> 0 | BO104: =SUM(RC[-61]:RC[-8]) -> -11000
A105: Relational Database Design | B105: 2002-04-22T00:00:00.000 | C105: 2 | D105: 1300 | E105: 450 | F105: 0 | G105: 6 | H105: 0 | I105: 0 | J105: 3 | K105: 0 | L105: 0 | M105: 0 | N105: 0 | O105: 0 | P105: 0 | Q105: 0 | R105: 0 | S105: 0 | T105: 0 | U105: 0 | V105: 0 | W105: 0 | X105: 0 | Y105: 0 | Z105: 0 | AA105: 0 | AB105: 0 | AC105: 0 | AD105: 0 | AE105: 0 | AF105: 0 | AG105: 0 | AH105: 0 | AI105: 0 | AJ105: 0 | AK105: 0 | AL105: 0 | AM105: 0 | AN105: 0 | AO105: 0 | AP105: 0 | AQ105: 0 | AR105: 0 | AS105: 0 | AT105: 0 | AU105: 0 | AV105: 0 | AW105: 0 | AX105: 0 | AY105: 0 | AZ105: 0 | BA105: 0 | BB105: 0 | BC105: 0 | BD105: 0 | BE105: 0 | BF105: 0 | BG105: 0 | BK105: =SUM(RC[-57]:RC[-4]) -> 9 | BL105: =RC[-61]*RC[-1] -> 18
D106: Total | F106: =R[-1]C*R105C5 -> 0 | G106: =R[-1]C*R105C5 -> 2700 | H106: =R[-1]C*R105C5 -> 0 | I106: =R[-1]C*R105C5 -> 0 | J106: =R[-1]C*R105C5 -> 1350 | K106: =R[-1]C*R105C5 -> 0 | L106: =R[-1]C*R105C5 -> 0 | M106: =R[-1]C*R105C5 -> 0 | N106: =R[-1]C*R105C5 -> 0 | O106: =R[-1]C*R105C5 -> 0 | P106: =R[-1]C*R105C5 -> 0 | Q106: =R[-1]C*R105C5 -> 0 | R106: =R[-1]C*R105C5 -> 0 | S106: =R[-1]C*R105C5 -> 0 | T106: =R[-1]C*R105C5 -> 0 | U106: =R[-1]C*R105C5 -> 0 | V106: =R[-1]C*R105C5 -> 0 | W106: =R[-1]C*R105C5 -> 0 | X106: =R[-1]C*R105C5 -> 0 | Y106: =R[-1]C*R105C5 -> 0 | Z106: =R[-1]C*R105C5 -> 0 | AA106: =R[-1]C*R105C5 -> 0 | AB106: =R[-1]C*R105C5 -> 0 | AC106: =R[-1]C*R105C5 -> 0 | AD106: =R[-1]C*R105C5 -> 0 | AE106: =R[-1]C*R105C5 -> 0 | AF106: =R[-1]C*R105C5 -> 0 | AG106: =R[-1]C*R105C5 -> 0 | AH106: =R[-1]C*R105C5 -> 0 | AI106: =R[-1]C*R105C5 -> 0 | AJ106: =R[-1]C*R105C5 -> 0 | AK106: =R[-1]C*R105C5 -> 0 | AL106: =R[-1]C*R105C5 -> 0 | AM106: =R[-1]C*R105C5 -> 0 | AN106: =R[-1]C*R105C5 -> 0 | AO106: =R[-1]C*R105C5 -> 0 | AP106: =R[-1]C*R105C5 -> 0 | AQ106: =R[-1]C*R105C5 -> 0 | AR106: =R[-1]C*R105C5 -> 0 | AS106: =R[-1]C*R105C5 -> 0 | AT106: =R[-1]C*R105C5 -> 0 | AU106: =R[-1]C*R105C5 -> 0 | AV106: =R[-1]C*R105C5 -> 0 | AW106: =R[-1]C*R105C5 -> 0 | AX106: =R[-1]C*R105C5 -> 0 | AY106: =R[-1]C*R105C5 -> 0 | AZ106: =R[-1]C*R105C5 -> 0 | BA106: =R[-1]C*R105C5 -> 0 | BB106: =R[-1]C*R105C5 -> 0 | BC106: =R[-1]C*R105C5 -> 0 | BD106: =R[-1]C*R105C5 -> 0 | BE106: =R[-1]C*R105C5 -> 0 | BF106: =R[-1]C*R105C5 -> 0 | BG106: =R[-1]C*R105C5 -> 0 | BM106: =R[-1]C[-61]*R[-1]C[-2] -> 11700 | BN106: =RC[-1]-RC[1] -> 7650 | BO106: =SUM(RC[-61]:RC[-8]) -> 4050
D107: Total Savings | F107: =R[-1]C-R[-2]C4*R[-2]C -> 0 | G107: =R[-1]C-R[-2]C4*R[-2]C -> -5100 | H107: =R[-1]C-R[-2]C4*R[-2]C -> 0 | I107: =R[-1]C-R[-2]C4*R[-2]C -> 0 | J107: =R[-1]C-R[-2]C4*R[-2]C -> -2550 | K107: =R[-1]C-R[-2]C4*R[-2]C -> 0 | L107: =R[-1]C-R[-2]C4*R[-2]C -> 0 | M107: =R[-1]C-R[-2]C4*R[-2]C -> 0 | N107: =R[-1]C-R[-2]C4*R[-2]C -> 0 | O107: =R[-1]C-R[-2]C4*R[-2]C -> 0 | P107: =R[-1]C-R[-2]C4*R[-2]C -> 0 | Q107: =R[-1]C-R[-2]C4*R[-2]C -> 0 | R107: =R[-1]C-R[-2]C4*R[-2]C -> 0 | S107: =R[-1]C-R[-2]C4*R[-2]C -> 0 | T107: =R[-1]C-R[-2]C4*R[-2]C -> 0 | U107: =R[-1]C-R[-2]C4*R[-2]C -> 0 | V107: =R[-1]C-R[-2]C4*R[-2]C -> 0 | W107: =R[-1]C-R[-2]C4*R[-2]C -> 0 | X107: =R[-1]C-R[-2]C4*R[-2]C -> 0 | Y107: =R[-1]C-R[-2]C4*R[-2]C -> 0 | Z107: =R[-1]C-R[-2]C4*R[-2]C -> 0 | AA107: =R[-1]C-R[-2]C4*R[-2]C -> 0 | AB107: =R[-1]C-R[-2]C4*R[-2]C -> 0 | AC107: =R[-1]C-R[-2]C4*R[-2]C -> 0 | AD107: =R[-1]C-R[-2]C4*R[-2]C -> 0 | AE107: =R[-1]C-R[-2]C4*R[-2]C -> 0 | AF107: =R[-1]C-R[-2]C4*R[-2]C -> 0 | AG107: =R[-1]C-R[-2]C4*R[-2]C -> 0 | AH107: =R[-1]C-R[-2]C4*R[-2]C -> 0 | AI107: =R[-1]C-R[-2]C4*R[-2]C -> 0 | AJ107: =R[-1]C-R[-2]C4*R[-2]C -> 0 | AK107: =R[-1]C-R[-2]C4*R[-2]C -> 0 | AL107: =R[-1]C-R[-2]C4*R[-2]C -> 0 | AM107: =R[-1]C-R[-2]C4*R[-2]C -> 0 | AN107: =R[-1]C-R[-2]C4*R[-2]C -> 0 | AO107: =R[-1]C-R[-2]C4*R[-2]C -> 0 | AP107: =R[-1]C-R[-2]C4*R[-2]C -> 0 | AQ107: =R[-1]C-R[-2]C4*R[-2]C -> 0 | AR107: =R[-1]C-R[-2]C4*R[-2]C -> 0 | AS107: =R[-1]C-R[-2]C4*R[-2]C -> 0 | AT107: =R[-1]C-R[-2]C4*R[-2]C -> 0 | AU107: =R[-1]C-R[-2]C4*R[-2]C -> 0 | AV107: =R[-1]C-R[-2]C4*R[-2]C -> 0 | AW107: =R[-1]C-R[-2]C4*R[-2]C -> 0 | AX107: =R[-1]C-R[-2]C4*R[-2]C -> 0 | AY107: =R[-1]C-R[-2]C4*R[-2]C -> 0 | AZ107: =R[-1]C-R[-2]C4*R[-2]C -> 0 | BA107: =R[-1]C-R[-2]C4*R[-2]C -> 0 | BB107: =R[-1]C-R[-2]C4*R[-2]C -> 0 | BC107: =R[-1]C-R[-2]C4*R[-2]C -> 0 | BD107: =R[-1]C-R[-2]C4*R[-2]C -> 0 | BE107: =R[-1]C-R[-2]C4*R[-2]C -> 0 | BF107: =R[-1]C-R[-2]C4*R[-2]C -> 0 | BG107: =R[-1]C-R[-2]C4*R[-2]C -> 0 | BO107: =SUM(RC[-61]:RC[-8]) -> -7650
A108: Oracle DBA I | B108: 2002-05-06T00:00:00.000 | C108: 5 | D108: 2595 | E108: 1350 | F108: 0 | G108: 0 | H108: 0 | I108: 0 | J108: 2 | K108: 0 | L108: 0 | M108: 0 | N108: 0 | O108: 0 | P108: 0 | Q108: 0 | R108: 0 | S108: 0 | T108: 0 | U108: 0 | V108: 0 | W108: 0 | X108: 0 | Y108: 0 | Z108: 0 | AA108: 0 | AB108: 0 | AC108: 0 | AD108: 0 | AE108: 0 | AF108: 0 | AG108: 0 | AH108: 0 | AI108: 0 | AJ108: 1 | AK108: 1 | AL108: 0 | AM108: 0 | AN108: 0 | AO108: 0 | AP108: 0 | AQ108: 0 | AR108: 0 | AS108: 0 | AT108: 0 | AU108: 0 | AV108: 0 | AW108: 0 | AX108: 0 | AY108: 0 | AZ108: 0 | BA108: 0 | BB108: 0 | BC108: 0 | BD108: 0 | BE108: 0 | BF108: 0 | BG108: 0 | BK108: =SUM(RC[-57]:RC[-4]) -> 4 | BL108: =RC[-61]*RC[-1] -> 20
D109: Total | F109: =R[-1]C*R108C5 -> 0 | G109: =R[-1]C*R108C5 -> 0 | H109: =R[-1]C*R108C5 -> 0 | I109: =R[-1]C*R108C5 -> 0 | J109: =R[-1]C*R108C5 -> 2700 | K109: =R[-1]C*R108C5 -> 0 | L109: =R[-1]C*R108C5 -> 0 | M109: =R[-1]C*R108C5 -> 0 | N109: =R[-1]C*R108C5 -> 0 | O109: =R[-1]C*R108C5 -> 0 | P109: =R[-1]C*R108C5 -> 0 | Q109: =R[-1]C*R108C5 -> 0 | R109: =R[-1]C*R108C5 -> 0 | S109: =R[-1]C*R108C5 -> 0 | T109: =R[-1]C*R108C5 -> 0 | U109: =R[-1]C*R108C5 -> 0 | V109: =R[-1]C*R108C5 -> 0 | W109: =R[-1]C*R108C5 -> 0 | X109: =R[-1]C*R108C5 -> 0 | Y109: =R[-1]C*R108C5 -> 0 | Z109: =R[-1]C*R108C5 -> 0 | AA109: =R[-1]C*R108C5 -> 0 | AB109: =R[-1]C*R108C5 -> 0 | AC109: =R[-1]C*R108C5 -> 0 | AD109: =R[-1]C*R108C5 -> 0 | AE109: =R[-1]C*R108C5 -> 0 | AF109: =R[-1]C*R108C5 -> 0 | AG109: =R[-1]C*R108C5 -> 0 | AH109: =R[-1]C*R108C5 -> 0 | AI109: =R[-1]C*R108C5 -> 0 | AJ109: =R[-1]C*R108C5 -> 1350 | AK109: =R[-1]C*R108C5 -> 1350 | AL109: =R[-1]C*R108C5 -> 0 | AM109: =R[-1]C*R108C5 -> 0 | AN109: =R[-1]C*R108C5 -> 0 | AO109: =R[-1]C*R108C5 -> 0 | AP109: =R[-1]C*R108C5 -> 0 | AQ109: =R[-1]C*R108C5 -> 0 | AR109: =R[-1]C*R108C5 -> 0 | AS109: =R[-1]C*R108C5 -> 0 | AT109: =R[-1]C*R108C5 -> 0 | AU109: =R[-1]C*R108C5 -> 0 | AV109: =R[-1]C*R108C5 -> 0 | AW109: =R[-1]C*R108C5 -> 0 | AX109: =R[-1]C*R108C5 -> 0 | AY109: =R[-1]C*R108C5 -> 0 | AZ109: =R[-1]C*R108C5 -> 0 | BA109: =R[-1]C*R108C5 -> 0 | BB109: =R[-1]C*R108C5 -> 0 | BC109: =R[-1]C*R108C5 -> 0 | BD109: =R[-1]C*R108C5 -> 0 | BE109: =R[-1]C*R108C5 -> 0 | BF109: =R[-1]C*R108C5 -> 0 | BG109: =R[-1]C*R108C5 -> 0 | BM109: =R[-1]C[-61]*R[-1]C[-2] -> 10380 | BN109: =RC[-1]-RC[1] -> 4980 | BO109: =SUM(RC[-61]:RC[-8]) -> 5400
D110: Total Savings | F110: =R[-1]C-R[-2]C4*R[-2]C -> 0 | G110: =R[-1]C-R[-2]C4*R[-2]C -> 0 | H110: =R[-1]C-R[-2]C4*R[-2]C -> 0 | I110: =R[-1]C-R[-2]C4*R[-2]C -> 0 | J110: =R[-1]C-R[-2]C4*R[-2]C -> -2490 | K110: =R[-1]C-R[-2]C4*R[-2]C -> 0 | L110: =R[-1]C-R[-2]C4*R[-2]C -> 0 | M110: =R[-1]C-R[-2]C4*R[-2]C -> 0 | N110: =R[-1]C-R[-2]C4*R[-2]C -> 0 | O110: =R[-1]C-R[-2]C4*R[-2]C -> 0 | P110: =R[-1]C-R[-2]C4*R[-2]C -> 0 | Q110: =R[-1]C-R[-2]C4*R[-2]C -> 0 | R110: =R[-1]C-R[-2]C4*R[-2]C -> 0 | S110: =R[-1]C-R[-2]C4*R[-2]C -> 0 | T110: =R[-1]C-R[-2]C4*R[-2]C -> 0 | U110: =R[-1]C-R[-2]C4*R[-2]C -> 0 | V110: =R[-1]C-R[-2]C4*R[-2]C -> 0 | W110: =R[-1]C-R[-2]C4*R[-2]C -> 0 | X110: =R[-1]C-R[-2]C4*R[-2]C -> 0 | Y110: =R[-1]C-R[-2]C4*R[-2]C -> 0 | Z110: =R[-1]C-R[-2]C4*R[-2]C -> 0 | AA110: =R[-1]C-R[-2]C4*R[-2]C -> 0 | AB110: =R[-1]C-R[-2]C4*R[-2]C -> 0 | AC110: =R[-1]C-R[-2]C4*R[-2]C -> 0 | AD110: =R[-1]C-R[-2]C4*R[-2]C -> 0 | AE110: =R[-1]C-R[-2]C4*R[-2]C -> 0 | AF110: =R[-1]C-R[-2]C4*R[-2]C -> 0 | AG110: =R[-1]C-R[-2]C4*R[-2]C -> 0 | AH110: =R[-1]C-R[-2]C4*R[-2]C -> 0 | AI110: =R[-1]C-R[-2]C4*R[-2]C -> 0 | AJ110: =R[-1]C-R[-2]C4*R[-2]C -> -1245 | AK110: =R[-1]C-R[-2]C4*R[-2]C -> -1245 | AL110: =R[-1]C-R[-2]C4*R[-2]C -> 0 | AM110: =R[-1]C-R[-2]C4*R[-2]C -> 0 | AN110: =R[-1]C-R[-2]C4*R[-2]C -> 0 | AO110: =R[-1]C-R[-2]C4*R[-2]C -> 0 | AP110: =R[-1]C-R[-2]C4*R[-2]C -> 0 | AQ110: =R[-1]C-R[-2]C4*R[-2]C -> 0 | AR110: =R[-1]C-R[-2]C4*R[-2]C -> 0 | AS110: =R[-1]C-R[-2]C4*R[-2]C -> 0 | AT110: =R[-1]C-R[-2]C4*R[-2]C -> 0 | AU110: =R[-1]C-R[-2]C4*R[-2]C -> 0 | AV110: =R[-1]C-R[-2]C4*R[-2]C -> 0 | AW110: =R[-1]C-R[-2]C4*R[-2]C -> 0 | AX110: =R[-1]C-R[-2]C4*R[-2]C -> 0 | AY110: =R[-1]C-R[-2]C4*R[-2]C -> 0 | AZ110: =R[-1]C-R[-2]C4*R[-2]C -> 0 | BA110: =R[-1]C-R[-2]C4*R[-2]C -> 0 | BB110: =R[-1]C-R[-2]C4*R[-2]C -> 0 | BC110: =R[-1]C-R[-2]C4*R[-2]C -> 0 | BD110: =R[-1]C-R[-2]C4*R[-2]C -> 0 | BE110: =R[-1]C-R[-2]C4*R[-2]C -> 0 | BF110: =R[-1]C-R[-2]C4*R[-2]C -> 0 | BG110: =R[-1]C-R[-2]C4*R[-2]C -> 0 | BO110: =SUM(RC[-61]:RC[-8]) -> -4980
A111: Survival Skills for Analyst | B111: 2002-05-06T00:00:00.000 | C111: 2 | D111: 1175 | E111: 525 | F111: 0 | G111: 0 | H111: 0 | I111: 0 | J111: 0 | K111: 1 | L111: 0 | M111: 0 | N111: 0 | O111: 0 | P111: 0 | Q111: 0 | R111: 0 | S111: 0 | T111: 0 | U111: 0 | V111: 0 | W111: 3 | X111: 0 | Y111: 0 | Z111: 0 | AA111: 0 | AB111: 0 | AC111: 0 | AD111: 0 | AE111: 0 | AF111: 0 | AG111: 0 | AH111: 0 | AI111: 0 | AJ111: 0 | AK111: 0 | AL111: 0 | AM111: 0 | AN111: 0 | AO111: 0 | AP111: 0 | AQ111: 0 | AR111: 0 | AS111: 0 | AT111: 0 | AU111: 0 | AV111: 0 | AW111: 0 | AX111: 0 | AY111: 0 | AZ111: 0 | BA111: 0 | BB111: 0 | BC111: 0 | BD111: 0 | BE111: 0 | BF111: 0 | BG111: 16 | BK111: =SUM(RC[-57]:RC[-4]) -> 20 | BL111: =RC[-61]*RC[-1] -> 40
D112: Total | F112: =R[-1]C*R111C5 -> 0 | G112: =R[-1]C*R111C5 -> 0 | H112: =R[-1]C*R111C5 -> 0 | I112: =R[-1]C*R111C5 -> 0 | J112: =R[-1]C*R111C5 -> 0 | K112: =R[-1]C*R111C5 -> 525 | L112: =R[-1]C*R111C5 -> 0 | M112: =R[-1]C*R111C5 -> 0 | N112: =R[-1]C*R111C5 -> 0 | O112: =R[-1]C*R111C5 -> 0 | P112: =R[-1]C*R111C5 -> 0 | Q112: =R[-1]C*R111C5 -> 0 | R112: =R[-1]C*R111C5 -> 0 | S112: =R[-1]C*R111C5 -> 0 | T112: =R[-1]C*R111C5 -> 0 | U112: =R[-1]C*R111C5 -> 0 | V112: =R[-1]C*R111C5 -> 0 | W112: =R[-1]C*R111C5 -> 1575 | X112: =R[-1]C*R111C5 -> 0 | Y112: =R[-1]C*R111C5 -> 0 | Z112: =R[-1]C*R111C5 -> 0 | AA112: =R[-1]C*R111C5 -> 0 | AB112: =R[-1]C*R111C5 -> 0 | AC112: =R[-1]C*R111C5 -> 0 | AD112: =R[-1]C*R111C5 -> 0 | AE112: =R[-1]C*R111C5 -> 0 | AF112: =R[-1]C*R111C5 -> 0 | AG112: =R[-1]C*R111C5 -> 0 | AH112: =R[-1]C*R111C5 -> 0 | AI112: =R[-1]C*R111C5 -> 0 | AJ112: =R[-1]C*R111C5 -> 0 | AK112: =R[-1]C*R111C5 -> 0 | AL112: =R[-1]C*R111C5 -> 0 | AM112: =R[-1]C*R111C5 -> 0 | AN112: =R[-1]C*R111C5 -> 0 | AO112: =R[-1]C*R111C5 -> 0 | AP112: =R[-1]C*R111C5 -> 0 | AQ112: =R[-1]C*R111C5 -> 0 | AR112: =R[-1]C*R111C5 -> 0 | AS112: =R[-1]C*R111C5 -> 0 | AT112: =R[-1]C*R111C5 -> 0 | AU112: =R[-1]C*R111C5 -> 0 | AV112: =R[-1]C*R111C5 -> 0 | AW112: =R[-1]C*R111C5 -> 0 | AX112: =R[-1]C*R111C5 -> 0 | AY112: =R[-1]C*R111C5 -> 0 | AZ112: =R[-1]C*R111C5 -> 0 | BA112: =R[-1]C*R111C5 -> 0 | BB112: =R[-1]C*R111C5 -> 0 | BC112: =R[-1]C*R111C5 -> 0 | BD112: =R[-1]C*R111C5 -> 0 | BE112: =R[-1]C*R111C5 -> 0 | BF112: =R[-1]C*R111C5 -> 0 | BG112: =R[-1]C*R111C5 -> 8400 | BM112: =R[-1]C[-61]*R[-1]C[-2] -> 23500 | BN112: =RC[-1]-RC[1] -> 13000 | BO112: =SUM(RC[-61]:RC[-8]) -> 10500
D113: Total Savings | F113: =R[-1]C-R[-2]C4*R[-2]C -> 0 | G113: =R[-1]C-R[-2]C4*R[-2]C -> 0 | H113: =R[-1]C-R[-2]C4*R[-2]C -> 0 | I113: =R[-1]C-R[-2]C4*R[-2]C -> 0 | J113: =R[-1]C-R[-2]C4*R[-2]C -> 0 | K113: =R[-1]C-R[-2]C4*R[-2]C -> -650 | L113: =R[-1]C-R[-2]C4*R[-2]C -> 0 | M113: =R[-1]C-R[-2]C4*R[-2]C -> 0 | N113: =R[-1]C-R[-2]C4*R[-2]C -> 0 | O113: =R[-1]C-R[-2]C4*R[-2]C -> 0 | P113: =R[-1]C-R[-2]C4*R[-2]C -> 0 | Q113: =R[-1]C-R[-2]C4*R[-2]C -> 0 | R113: =R[-1]C-R[-2]C4*R[-2]C -> 0 | S113: =R[-1]C-R[-2]C4*R[-2]C -> 0 | T113: =R[-1]C-R[-2]C4*R[-2]C -> 0 | U113: =R[-1]C-R[-2]C4*R[-2]C -> 0 | V113: =R[-1]C-R[-2]C4*R[-2]C -> 0 | W113: =R[-1]C-R[-2]C4*R[-2]C -> -1950 | X113: =R[-1]C-R[-2]C4*R[-2]C -> 0 | Y113: =R[-1]C-R[-2]C4*R[-2]C -> 0 | Z113: =R[-1]C-R[-2]C4*R[-2]C -> 0 | AA113: =R[-1]C-R[-2]C4*R[-2]C -> 0 | AB113: =R[-1]C-R[-2]C4*R[-2]C -> 0 | AC113: =R[-1]C-R[-2]C4*R[-2]C -> 0 | AD113: =R[-1]C-R[-2]C4*R[-2]C -> 0 | AE113: =R[-1]C-R[-2]C4*R[-2]C -> 0 | AF113: =R[-1]C-R[-2]C4*R[-2]C -> 0 | AG113: =R[-1]C-R[-2]C4*R[-2]C -> 0 | AH113: =R[-1]C-R[-2]C4*R[-2]C -> 0 | AI113: =R[-1]C-R[-2]C4*R[-2]C -> 0 | AJ113: =R[-1]C-R[-2]C4*R[-2]C -> 0 | AK113: =R[-1]C-R[-2]C4*R[-2]C -> 0 | AL113: =R[-1]C-R[-2]C4*R[-2]C -> 0 | AM113: =R[-1]C-R[-2]C4*R[-2]C -> 0 | AN113: =R[-1]C-R[-2]C4*R[-2]C -> 0 | AO113: =R[-1]C-R[-2]C4*R[-2]C -> 0 | AP113: =R[-1]C-R[-2]C4*R[-2]C -> 0 | AQ113: =R[-1]C-R[-2]C4*R[-2]C -> 0 | AR113: =R[-1]C-R[-2]C4*R[-2]C -> 0 | AS113: =R[-1]C-R[-2]C4*R[-2]C -> 0 | AT113: =R[-1]C-R[-2]C4*R[-2]C -> 0 | AU113: =R[-1]C-R[-2]C4*R[-2]C -> 0 | AV113: =R[-1]C-R[-2]C4*R[-2]C -> 0 | AW113: =R[-1]C-R[-2]C4*R[-2]C -> 0 | AX113: =R[-1]C-R[-2]C4*R[-2]C -> 0 | AY113: =R[-1]C-R[-2]C4*R[-2]C -> 0 | AZ113: =R[-1]C-R[-2]C4*R[-2]C -> 0 | BA113: =R[-1]C-R[-2]C4*R[-2]C -> 0 | BB113: =R[-1]C-R[-2]C4*R[-2]C -> 0 | BC113: =R[-1]C-R[-2]C4*R[-2]C -> 0 | BD113: =R[-1]C-R[-2]C4*R[-2]C -> 0 | BE113: =R[-1]C-R[-2]C4*R[-2]C -> 0 | BF113: =R[-1]C-R[-2]C4*R[-2]C -> 0 | BG113: =R[-1]C-R[-2]C4*R[-2]C -> -10400 | BO113: =SUM(RC[-61]:RC[-8]) -> -13000
A114: MS Project 2000 | B114: 2002-05-06T00:00:00.000 | C114: 3 | D114: 1200 | E114: 367 | F114: 0 | G114: 0 | H114: 0 | I114: 0 | J114: 2 | K114: 0 | L114: 0 | M114: 0 | N114: 0 | O114: 0 | P114: 0 | Q114: 0 | R114: 0 | S114: 0 | T114: 0 | U114: 0 | V114: 0 | W114: 0 | X114: 0 | Y114: 0 | Z114: 0 | AA114: 0 | AB114: 0 | AC114: 0 | AD114: 0 | AE114: 0 | AF114: 0 | AG114: 0 | AH114: 0 | AI114: 0 | AJ114: 0 | AK114: 0 | AL114: 1 | AM114: 0 | AN114: 0 | AO114: 0 | AP114: 0 | AQ114: 0 | AR114: 0 | AS114: 0 | AT114: 0 | AU114: 0 | AV114: 0 | AW114: 0 | AX114: 0 | AY114: 0 | AZ114: 0 | BA114: 0 | BB114: 0 | BC114: 2 | BD114: 0 | BE114: 0 | BF114: 0 | BG114: 0 | BK114: =SUM(RC[-57]:RC[-4]) -> 5 | BL114: =RC[-61]*RC[-1] -> 15
D115: Total | F115: =R[-1]C*R114C5 -> 0 | G115: =R[-1]C*R114C5 -> 0 | H115: =R[-1]C*R114C5 -> 0 | I115: =R[-1]C*R114C5 -> 0 | J115: =R[-1]C*R114C5 -> 734 | K115: =R[-1]C*R114C5 -> 0 | L115: =R[-1]C*R114C5 -> 0 | M115: =R[-1]C*R114C5 -> 0 | N115: =R[-1]C*R114C5 -> 0 | O115: =R[-1]C*R114C5 -> 0 | P115: =R[-1]C*R114C5 -> 0 | Q115: =R[-1]C*R114C5 -> 0 | R115: =R[-1]C*R114C5 -> 0 | S115: =R[-1]C*R114C5 -> 0 | T115: =R[-1]C*R114C5 -> 0 | U115: =R[-1]C*R114C5 -> 0 | V115: =R[-1]C*R114C5 -> 0 | W115: =R[-1]C*R114C5 -> 0 | X115: =R[-1]C*R114C5 -> 0 | Y115: =R[-1]C*R114C5 -> 0 | Z115: =R[-1]C*R114C5 -> 0 | AA115: =R[-1]C*R114C5 -> 0 | AB115: =R[-1]C*R114C5 -> 0 | AC115: =R[-1]C*R114C5 -> 0 | AD115: =R[-1]C*R114C5 -> 0 | AE115: =R[-1]C*R114C5 -> 0 | AF115: =R[-1]C*R114C5 -> 0 | AG115: =R[-1]C*R114C5 -> 0 | AH115: =R[-1]C*R114C5 -> 0 | AI115: =R[-1]C*R114C5 -> 0 | AJ115: =R[-1]C*R114C5 -> 0 | AK115: =R[-1]C*R114C5 -> 0 | AL115: =R[-1]C*R114C5 -> 367 | AM115: =R[-1]C*R114C5 -> 0 | AN115: =R[-1]C*R114C5 -> 0 | AO115: =R[-1]C*R114C5 -> 0 | AP115: =R[-1]C*R114C5 -> 0 | AQ115: =R[-1]C*R114C5 -> 0 | AR115: =R[-1]C*R114C5 -> 0 | AS115: =R[-1]C*R114C5 -> 0 | AT115: =R[-1]C*R114C5 -> 0 | AU115: =R[-1]C*R114C5 -> 0 | AV115: =R[-1]C*R114C5 -> 0 | AW115: =R[-1]C*R114C5 -> 0 | AX115: =R[-1]C*R114C5 -> 0 | AY115: =R[-1]C*R114C5 -> 0 | AZ115: =R[-1]C*R114C5 -> 0 | BA115: =R[-1]C*R114C5 -> 0 | BB115: =R[-1]C*R114C5 -> 0 | BC115: =R[-1]C*R114C5 -> 734 | BD115: =R[-1]C*R114C5 -> 0 | BE115: =R[-1]C*R114C5 -> 0 | BF115: =R[-1]C*R114C5 -> 0 | BG115: =R[-1]C*R114C5 -> 0 | BM115: =R[-1]C[-61]*R[-1]C[-2] -> 6000 | BN115: =RC[-1]-RC[1] -> 4165 | BO115: =SUM(RC[-61]:RC[-8]) -> 1835
D116: Total Savings | F116: =R[-1]C-R[-2]C4*R[-2]C -> 0 | G116: =R[-1]C-R[-2]C4*R[-2]C -> 0 | H116: =R[-1]C-R[-2]C4*R[-2]C -> 0 | I116: =R[-1]C-R[-2]C4*R[-2]C -> 0 | J116: =R[-1]C-R[-2]C4*R[-2]C -> -1666 | K116: =R[-1]C-R[-2]C4*R[-2]C -> 0 | L116: =R[-1]C-R[-2]C4*R[-2]C -> 0 | M116: =R[-1]C-R[-2]C4*R[-2]C -> 0 | N116: =R[-1]C-R[-2]C4*R[-2]C -> 0 | O116: =R[-1]C-R[-2]C4*R[-2]C -> 0 | P116: =R[-1]C-R[-2]C4*R[-2]C -> 0 | Q116: =R[-1]C-R[-2]C4*R[-2]C -> 0 | R116: =R[-1]C-R[-2]C4*R[-2]C -> 0 | S116: =R[-1]C-R[-2]C4*R[-2]C -> 0 | T116: =R[-1]C-R[-2]C4*R[-2]C -> 0 | U116: =R[-1]C-R[-2]C4*R[-2]C -> 0 | V116: =R[-1]C-R[-2]C4*R[-2]C -> 0 | W116: =R[-1]C-R[-2]C4*R[-2]C -> 0 | X116: =R[-1]C-R[-2]C4*R[-2]C -> 0 | Y116: =R[-1]C-R[-2]C4*R[-2]C -> 0 | Z116: =R[-1]C-R[-2]C4*R[-2]C -> 0 | AA116: =R[-1]C-R[-2]C4*R[-2]C -> 0 | AB116: =R[-1]C-R[-2]C4*R[-2]C -> 0 | AC116: =R[-1]C-R[-2]C4*R[-2]C -> 0 | AD116: =R[-1]C-R[-2]C4*R[-2]C -> 0 | AE116: =R[-1]C-R[-2]C4*R[-2]C -> 0 | AF116: =R[-1]C-R[-2]C4*R[-2]C -> 0 | AG116: =R[-1]C-R[-2]C4*R[-2]C -> 0 | AH116: =R[-1]C-R[-2]C4*R[-2]C -> 0 | AI116: =R[-1]C-R[-2]C4*R[-2]C -> 0 | AJ116: =R[-1]C-R[-2]C4*R[-2]C -> 0 | AK116: =R[-1]C-R[-2]C4*R[-2]C -> 0 | AL116: =R[-1]C-R[-2]C4*R[-2]C -> -833 | AM116: =R[-1]C-R[-2]C4*R[-2]C -> 0 | AN116: =R[-1]C-R[-2]C4*R[-2]C -> 0 | AO116: =R[-1]C-R[-2]C4*R[-2]C -> 0 | AP116: =R[-1]C-R[-2]C4*R[-2]C -> 0 | AQ116: =R[-1]C-R[-2]C4*R[-2]C -> 0 | AR116: =R[-1]C-R[-2]C4*R[-2]C -> 0 | AS116: =R[-1]C-R[-2]C4*R[-2]C -> 0 | AT116: =R[-1]C-R[-2]C4*R[-2]C -> 0 | AU116: =R[-1]C-R[-2]C4*R[-2]C -> 0 | AV116: =R[-1]C-R[-2]C4*R[-2]C -> 0 | AW116: =R[-1]C-R[-2]C4*R[-2]C -> 0 | AX116: =R[-1]C-R[-2]C4*R[-2]C -> 0 | AY116: =R[-1]C-R[-2]C4*R[-2]C -> 0 | AZ116: =R[-1]C-R[-2]C4*R[-2]C -> 0 | BA116: =R[-1]C-R[-2]C4*R[-2]C -> 0 | BB116: =R[-1]C-R[-2]C4*R[-2]C -> 0 | BC116: =R[-1]C-R[-2]C4*R[-2]C -> -1666 | BD116: =R[-1]C-R[-2]C4*R[-2]C -> 0 | BE116: =R[-1]C-R[-2]C4*R[-2]C -> 0 | BF116: =R[-1]C-R[-2]C4*R[-2]C -> 0 | BG116: =R[-1]C-R[-2]C4*R[-2]C -> 0 | BO116: =SUM(RC[-61]:RC[-8]) -> -4165
A117: ASP - Active Server Pages | B117: 2002-05-13T00:00:00.000 | C117: 4 | D117: 1800 | E117: 700 | F117: 0 | G117: 0 | H117: 0 | I117: 0 | J117: 5 | K117: 0 | L117: 0 | M117: 0 | N117: 0 | O117: 0 | P117: 0 | Q117: 0 | R117: 0 | S117: 0 | T117: 0 | U117: 0 | V117: 0 | W117: 0 | X117: 0 | Y117: 0 | Z117: 0 | AA117: 0 | AB117: 0 | AC117: 0 | AD117: 0 | AE117: 0 | AF117: 0 | AG117: 0 | AH117: 0 | AI117: 0 | AJ117: 0 | AK117: 0 | AL117: 0 | AM117: 0 | AN117: 0 | AO117: 0 | AP117: 0 | AQ117: 0 | AR117: 0 | AS117: 0 | AT117: 0 | AU117: 0 | AV117: 0 | AW117: 0 | AX117: 0 | AY117: 0 | AZ117: 0 | BA117: 0 | BB117: 0 | BC117: 0 | BD117: 2 | BE117: 0 | BF117: 0 | BG117: 0 | BK117: =SUM(RC[-57]:RC[-4]) -> 7 | BL117: =RC[-61]*RC[-1] -> 28
D118: Total | F118: =R[-1]C*R117C5 -> 0 | G118: =R[-1]C*R117C5 -> 0 | H118: =R[-1]C*R117C5 -> 0 | I118: =R[-1]C*R117C5 -> 0 | J118: =R[-1]C*R117C5 -> 3500 | K118: =R[-1]C*R117C5 -> 0 | L118: =R[-1]C*R117C5 -> 0 | M118: =R[-1]C*R117C5 -> 0 | N118: =R[-1]C*R117C5 -> 0 | O118: =R[-1]C*R117C5 -> 0 | P118: =R[-1]C*R117C5 -> 0 | Q118: =R[-1]C*R117C5 -> 0 | R118: =R[-1]C*R117C5 -> 0 | S118: =R[-1]C*R117C5 -> 0 | T118: =R[-1]C*R117C5 -> 0 | U118: =R[-1]C*R117C5 -> 0 | V118: =R[-1]C*R117C5 -> 0 | W118: =R[-1]C*R117C5 -> 0 | X118: =R[-1]C*R117C5 -> 0 | Y118: =R[-1]C*R117C5 -> 0 | Z118: =R[-1]C*R117C5 -> 0 | AA118: =R[-1]C*R117C5 -> 0 | AB118: =R[-1]C*R117C5 -> 0 | AC118: =R[-1]C*R117C5 -> 0 | AD118: =R[-1]C*R117C5 -> 0 | AE118: =R[-1]C*R117C5 -> 0 | AF118: =R[-1]C*R117C5 -> 0 | AG118: =R[-1]C*R117C5 -> 0 | AH118: =R[-1]C*R117C5 -> 0 | AI118: =R[-1]C*R117C5 -> 0 | AJ118: =R[-1]C*R117C5 -> 0 | AK118: =R[-1]C*R117C5 -> 0 | AL118: =R[-1]C*R117C5 -> 0 | AM118: =R[-1]C*R117C5 -> 0 | AN118: =R[-1]C*R117C5 -> 0 | AO118: =R[-1]C*R117C5 -> 0 | AP118: =R[-1]C*R117C5 -> 0 | AQ118: =R[-1]C*R117C5 -> 0 | AR118: =R[-1]C*R117C5 -> 0 | AS118: =R[-1]C*R117C5 -> 0 | AT118: =R[-1]C*R117C5 -> 0 | AU118: =R[-1]C*R117C5 -> 0 | AV118: =R[-1]C*R117C5 -> 0 | AW118: =R[-1]C*R117C5 -> 0 | AX118: =R[-1]C*R117C5 -> 0 | AY118: =R[-1]C*R117C5 -> 0 | AZ118: =R[-1]C*R117C5 -> 0 | BA118: =R[-1]C*R117C5 -> 0 | BB118: =R[-1]C*R117C5 -> 0 | BC118: =R[-1]C*R117C5 -> 0 | BD118: =R[-1]C*R117C5 -> 1400 | BE118: =R[-1]C*R117C5 -> 0 | BF118: =R[-1]C*R117C5 -> 0 | BG118: =R[-1]C*R117C5 -> 0 | BM118: =R[-1]C[-61]*R[-1]C[-2] -> 12600 | BN118: =RC[-1]-RC[1] -> 7700 | BO118: =SUM(RC[-61]:RC[-8]) -> 4900
D119: Total Savings | F119: =R[-1]C-R[-2]C4*R[-2]C -> 0 | G119: =R[-1]C-R[-2]C4*R[-2]C -> 0 | H119: =R[-1]C-R[-2]C4*R[-2]C -> 0 | I119: =R[-1]C-R[-2]C4*R[-2]C -> 0 | J119: =R[-1]C-R[-2]C4*R[-2]C -> -5500 | K119: =R[-1]C-R[-2]C4*R[-2]C -> 0 | L119: =R[-1]C-R[-2]C4*R[-2]C -> 0 | M119: =R[-1]C-R[-2]C4*R[-2]C -> 0 | N119: =R[-1]C-R[-2]C4*R[-2]C -> 0 | O119: =R[-1]C-R[-2]C4*R[-2]C -> 0 | P119: =R[-1]C-R[-2]C4*R[-2]C -> 0 | Q119: =R[-1]C-R[-2]C4*R[-2]C -> 0 | R119: =R[-1]C-R[-2]C4*R[-2]C -> 0 | S119: =R[-1]C-R[-2]C4*R[-2]C -> 0 | T119: =R[-1]C-R[-2]C4*R[-2]C -> 0 | U119: =R[-1]C-R[-2]C4*R[-2]C -> 0 | V119: =R[-1]C-R[-2]C4*R[-2]C -> 0 | W119: =R[-1]C-R[-2]C4*R[-2]C -> 0 | X119: =R[-1]C-R[-2]C4*R[-2]C -> 0 | Y119: =R[-1]C-R[-2]C4*R[-2]C -> 0 | Z119: =R[-1]C-R[-2]C4*R[-2]C -> 0 | AA119: =R[-1]C-R[-2]C4*R[-2]C -> 0 | AB119: =R[-1]C-R[-2]C4*R[-2]C -> 0 | AC119: =R[-1]C-R[-2]C4*R[-2]C -> 0 | AD119: =R[-1]C-R[-2]C4*R[-2]C -> 0 | AE119: =R[-1]C-R[-2]C4*R[-2]C -> 0 | AF119: =R[-1]C-R[-2]C4*R[-2]C -> 0 | AG119: =R[-1]C-R[-2]C4*R[-2]C -> 0 | AH119: =R[-1]C-R[-2]C4*R[-2]C -> 0 | AI119: =R[-1]C-R[-2]C4*R[-2]C -> 0 | AJ119: =R[-1]C-R[-2]C4*R[-2]C -> 0 | AK119: =R[-1]C-R[-2]C4*R[-2]C -> 0 | AL119: =R[-1]C-R[-2]C4*R[-2]C -> 0 | AM119: =R[-1]C-R[-2]C4*R[-2]C -> 0 | AN119: =R[-1]C-R[-2]C4*R[-2]C -> 0 | AO119: =R[-1]C-R[-2]C4*R[-2]C -> 0 | AP119: =R[-1]C-R[-2]C4*R[-2]C -> 0 | AQ119: =R[-1]C-R[-2]C4*R[-2]C -> 0 | AR119: =R[-1]C-R[-2]C4*R[-2]C -> 0 | AS119: =R[-1]C-R[-2]C4*R[-2]C -> 0 | AT119: =R[-1]C-R[-2]C4*R[-2]C -> 0 | AU119: =R[-1]C-R[-2]C4*R[-2]C -> 0 | AV119: =R[-1]C-R[-2]C4*R[-2]C -> 0 | AW119: =R[-1]C-R[-2]C4*R[-2]C -> 0 | AX119: =R[-1]C-R[-2]C4*R[-2]C -> 0 | AY119: =R[-1]C-R[-2]C4*R[-2]C -> 0 | AZ119: =R[-1]C-R[-2]C4*R[-2]C -> 0 | BA119: =R[-1]C-R[-2]C4*R[-2]C -> 0 | BB119: =R[-1]C-R[-2]C4*R[-2]C -> 0 | BC119: =R[-1]C-R[-2]C4*R[-2]C -> 0 | BD119: =R[-1]C-R[-2]C4*R[-2]C -> -2200 | BE119: =R[-1]C-R[-2]C4*R[-2]C -> 0 | BF119: =R[-1]C-R[-2]C4*R[-2]C -> 0 | BG119: =R[-1]C-R[-2]C4*R[-2]C -> 0 | BO119: =SUM(RC[-61]:RC[-8]) -> -7700
A120: Introduction to SQL | B120: 2002-05-14T00:00:00.000 | C120: 2 | D120: 1100 | E120: 450 | F120: 0 | G120: 0 | H120: 0 | I120: 2 | J120: 1 | K120: 1 | L120: 0 | M120: 0 | N120: 0 | O120: 0 | P120: 0 | Q120: 0 | R120: 0 | S120: 0 | T120: 0 | U120: 0 | V120: 0 | W120: 0 | X120: 0 | Y120: 0 | Z120: 0 | AA120: 0 | AB120: 0 | AC120: 0 | AD120: 1 | AE120: 0 | AF120: 0 | AG120: 0 | AH120: 0 | AI120: 0 | AJ120: 0 | AK120: 0 | AL120: 0 | AM120: 0 | AN120: 0 | AO120: 0 | AP120: 0 | AQ120: 0 | AR120: 0 | AS120: 0 | AT120: 0 | AU120: 0 | AV120: 0 | AW120: 0 | AX120: 0 | AY120: 0 | AZ120: 0 | BA120: 2 | BB120: 0 | BC120: 0 | BD120: 0 | BE120: 0 | BF120: 0 | BG120: 0 | BK120: =SUM(RC[-57]:RC[-4]) -> 7 | BL120: =RC[-61]*RC[-1] -> 14
D121: Total | F121: =R[-1]C*R120C5 -> 0 | G121: =R[-1]C*R120C5 -> 0 | H121: =R[-1]C*R120C5 -> 0 | I121: =R[-1]C*R120C5 -> 900 | J121: =R[-1]C*R120C5 -> 450 | K121: =R[-1]C*R120C5 -> 450 | L121: =R[-1]C*R120C5 -> 0 | M121: =R[-1]C*R120C5 -> 0 | N121: =R[-1]C*R120C5 -> 0 | O121: =R[-1]C*R120C5 -> 0 | P121: =R[-1]C*R120C5 -> 0 | Q121: =R[-1]C*R120C5 -> 0 | R121: =R[-1]C*R120C5 -> 0 | S121: =R[-1]C*R120C5 -> 0 | T121: =R[-1]C*R120C5 -> 0 | U121: =R[-1]C*R120C5 -> 0 | V121: =R[-1]C*R120C5 -> 0 | W121: =R[-1]C*R120C5 -> 0 | X121: =R[-1]C*R120C5 -> 0 | Y121: =R[-1]C*R120C5 -> 0 | Z121: =R[-1]C*R120C5 -> 0 | AA121: =R[-1]C*R120C5 -> 0 | AB121: =R[-1]C*R120C5 -> 0 | AC121: =R[-1]C*R120C5 -> 0 | AD121: =R[-1]C*R120C5 -> 450 | AE121: =R[-1]C*R120C5 -> 0 | AF121: =R[-1]C*R120C5 -> 0 | AG121: =R[-1]C*R120C5 -> 0 | AH121: =R[-1]C*R120C5 -> 0 | AI121: =R[-1]C*R120C5 -> 0 | AJ121: =R[-1]C*R120C5 -> 0 | AK121: =R[-1]C*R120C5 -> 0 | AL121: =R[-1]C*R120C5 -> 0 | AM121: =R[-1]C*R120C5 -> 0 | AN121: =R[-1]C*R120C5 -> 0 | AO121: =R[-1]C*R120C5 -> 0 | AP121: =R[-1]C*R120C5 -> 0 | AQ121: =R[-1]C*R120C5 -> 0 | AR121: =R[-1]C*R120C5 -> 0 | AS121: =R[-1]C*R120C5 -> 0 | AT121: =R[-1]C*R120C5 -> 0 | AU121: =R[-1]C*R120C5 -> 0 | AV121: =R[-1]C*R120C5 -> 0 | AW121: =R[-1]C*R120C5 -> 0 | AX121: =R[-1]C*R120C5 -> 0 | AY121: =R[-1]C*R120C5 -> 0 | AZ121: =R[-1]C*R120C5 -> 0 | BA121: =R[-1]C*R120C5 -> 900 | BB121: =R[-1]C*R120C5 -> 0 | BC121: =R[-1]C*R120C5 -> 0 | BD121: =R[-1]C*R120C5 -> 0 | BE121: =R[-1]C*R120C5 -> 0 | BF121: =R[-1]C*R120C5 -> 0 | BG121: =R[-1]C*R120C5 -> 0 | BM121: =R[-1]C[-61]*R[-1]C[-2] -> 7700 | BN121: =RC[-1]-RC[1] -> 4550 | BO121: =SUM(RC[-61]:RC[-8]) -> 3150
D122: Total Savings | F122: =R[-1]C-R[-2]C4*R[-2]C -> 0 | G122: =R[-1]C-R[-2]C4*R[-2]C -> 0 | H122: =R[-1]C-R[-2]C4*R[-2]C -> 0 | I122: =R[-1]C-R[-2]C4*R[-2]C -> -1300 | J122: =R[-1]C-R[-2]C4*R[-2]C -> -650 | K122: =R[-1]C-R[-2]C4*R[-2]C -> -650 | L122: =R[-1]C-R[-2]C4*R[-2]C -> 0 | M122: =R[-1]C-R[-2]C4*R[-2]C -> 0 | N122: =R[-1]C-R[-2]C4*R[-2]C -> 0 | O122: =R[-1]C-R[-2]C4*R[-2]C -> 0 | P122: =R[-1]C-R[-2]C4*R[-2]C -> 0 | Q122: =R[-1]C-R[-2]C4*R[-2]C -> 0 | R122: =R[-1]C-R[-2]C4*R[-2]C -> 0 | S122: =R[-1]C-R[-2]C4*R[-2]C -> 0 | T122: =R[-1]C-R[-2]C4*R[-2]C -> 0 | U122: =R[-1]C-R[-2]C4*R[-2]C -> 0 | V122: =R[-1]C-R[-2]C4*R[-2]C -> 0 | W122: =R[-1]C-R[-2]C4*R[-2]C -> 0 | X122: =R[-1]C-R[-2]C4*R[-2]C -> 0 | Y122: =R[-1]C-R[-2]C4*R[-2]C -> 0 | Z122: =R[-1]C-R[-2]C4*R[-2]C -> 0 | AA122: =R[-1]C-R[-2]C4*R[-2]C -> 0 | AB122: =R[-1]C-R[-2]C4*R[-2]C -> 0 | AC122: =R[-1]C-R[-2]C4*R[-2]C -> 0 | AD122: =R[-1]C-R[-2]C4*R[-2]C -> -650 | AE122: =R[-1]C-R[-2]C4*R[-2]C -> 0 | AF122: =R[-1]C-R[-2]C4*R[-2]C -> 0 | AG122: =R[-1]C-R[-2]C4*R[-2]C -> 0 | AH122: =R[-1]C-R[-2]C4*R[-2]C -> 0 | AI122: =R[-1]C-R[-2]C4*R[-2]C -> 0 | AJ122: =R[-1]C-R[-2]C4*R[-2]C -> 0 | AK122: =R[-1]C-R[-2]C4*R[-2]C -> 0 | AL122: =R[-1]C-R[-2]C4*R[-2]C -> 0 | AM122: =R[-1]C-R[-2]C4*R[-2]C -> 0 | AN122: =R[-1]C-R[-2]C4*R[-2]C -> 0 | AO122: =R[-1]C-R[-2]C4*R[-2]C -> 0 | AP122: =R[-1]C-R[-2]C4*R[-2]C -> 0 | AQ122: =R[-1]C-R[-2]C4*R[-2]C -> 0 | AR122: =R[-1]C-R[-2]C4*R[-2]C -> 0 | AS122: =R[-1]C-R[-2]C4*R[-2]C -> 0 | AT122: =R[-1]C-R[-2]C4*R[-2]C -> 0 | AU122: =R[-1]C-R[-2]C4*R[-2]C -> 0 | AV122: =R[-1]C-R[-2]C4*R[-2]C -> 0 | AW122: =R[-1]C-R[-2]C4*R[-2]C -> 0 | AX122: =R[-1]C-R[-2]C4*R[-2]C -> 0 | AY122: =R[-1]C-R[-2]C4*R[-2]C -> 0 | AZ122: =R[-1]C-R[-2]C4*R[-2]C -> 0 | BA122: =R[-1]C-R[-2]C4*R[-2]C -> -1300 | BB122: =R[-1]C-R[-2]C4*R[-2]C -> 0 | BC122: =R[-1]C-R[-2]C4*R[-2]C -> 0 | BD122: =R[-1]C-R[-2]C4*R[-2]C -> 0 | BE122: =R[-1]C-R[-2]C4*R[-2]C -> 0 | BF122: =R[-1]C-R[-2]C4*R[-2]C -> 0 | BG122: =R[-1]C-R[-2]C4*R[-2]C -> 0 | BO122: =SUM(RC[-61]:RC[-8]) -> -4550
A123: VB 6.0 Introduction | B123: 2002-05-22T00:00:00.000 | C123: 3 | D123: 1500 | E123: 525 | F123: 0 | G123: 0 | H123: 0 | I123: 2 | J123: 1 | K123: 0 | L123: 0 | M123: 0 | N123: 0 | O123: 0 | P123: 0 | Q123: 0 | R123: 0 | S123: 0 | T123: 0 | U123: 0 | V123: 0 | W123: 0 | X123: 0 | Y123: 0 | Z123: 0 | AA123: 0 | AB123: 0 | AC123: 0 | AD123: 0 | AE123: 0 | AF123: 1 | AG123: 1 | AH123: 1 | AI123: 0 | AJ123: 0 | AK123: 0 | AL123: 0 | AM123: 0 | AN123: 0 | AO123: 0 | AP123: 0 | AQ123: 0 | AR123: 0 | AS123: 0 | AT123: 0 | AU123: 0 | AV123: 0 | AW123: 0 | AX123: 0 | AY123: 0 | AZ123: 0 | BA123: 0 | BB123: 0 | BC123: 0 | BD123: 1 | BE123: 0 | BF123: 0 | BG123: 1 | BK123: =SUM(RC[-57]:RC[-4]) -> 8 | BL123: =RC[-61]*RC[-1] -> 24
D124: Total | F124: =R[-1]C*R123C5 -> 0 | G124: =R[-1]C*R123C5 -> 0 | H124: =R[-1]C*R123C5 -> 0 | I124: =R[-1]C*R123C5 -> 1050 | J124: =R[-1]C*R123C5 -> 525 | K124: =R[-1]C*R123C5 -> 0 | L124: =R[-1]C*R123C5 -> 0 | M124: =R[-1]C*R123C5 -> 0 | N124: =R[-1]C*R123C5 -> 0 | O124: =R[-1]C*R123C5 -> 0 | P124: =R[-1]C*R123C5 -> 0 | Q124: =R[-1]C*R123C5 -> 0 | R124: =R[-1]C*R123C5 -> 0 | S124: =R[-1]C*R123C5 -> 0 | T124: =R[-1]C*R123C5 -> 0 | U124: =R[-1]C*R123C5 -> 0 | V124: =R[-1]C*R123C5 -> 0 | W124: =R[-1]C*R123C5 -> 0 | X124: =R[-1]C*R123C5 -> 0 | Y124: =R[-1]C*R123C5 -> 0 | Z124: =R[-1]C*R123C5 -> 0 | AA124: =R[-1]C*R123C5 -> 0 | AB124: =R[-1]C*R123C5 -> 0 | AC124: =R[-1]C*R123C5 -> 0 | AD124: =R[-1]C*R123C5 -> 0 | AE124: =R[-1]C*R123C5 -> 0 | AF124: =R[-1]C*R123C5 -> 525 | AG124: =R[-1]C*R123C5 -> 525 | AH124: =R[-1]C*R123C5 -> 525 | AI124: =R[-1]C*R123C5 -> 0 | AJ124: =R[-1]C*R123C5 -> 0 | AK124: =R[-1]C*R123C5 -> 0 | AL124: =R[-1]C*R123C5 -> 0 | AM124: =R[-1]C*R123C5 -> 0 | AN124: =R[-1]C*R123C5 -> 0 | AO124: =R[-1]C*R123C5 -> 0 | AP124: =R[-1]C*R123C5 -> 0 | AQ124: =R[-1]C*R123C5 -> 0 | AR124: =R[-1]C*R123C5 -> 0 | AS124: =R[-1]C*R123C5 -> 0 | AT124: =R[-1]C*R123C5 -> 0 | AU124: =R[-1]C*R123C5 -> 0 | AV124: =R[-1]C*R123C5 -> 0 | AW124: =R[-1]C*R123C5 -> 0 | AX124: =R[-1]C*R123C5 -> 0 | AY124: =R[-1]C*R123C5 -> 0 | AZ124: =R[-1]C*R123C5 -> 0 | BA124: =R[-1]C*R123C5 -> 0 | BB124: =R[-1]C*R123C5 -> 0 | BC124: =R[-1]C*R123C5 -> 0 | BD124: =R[-1]C*R123C5 -> 525 | BE124: =R[-1]C*R123C5 -> 0 | BF124: =R[-1]C*R123C5 -> 0 | BG124: =R[-1]C*R123C5 -> 525 | BM124: =R[-1]C[-61]*R[-1]C[-2] -> 12000 | BN124: =RC[-1]-RC[1] -> 7800 | BO124: =SUM(RC[-61]:RC[-8]) -> 4200
D125: Total Savings | F125: =R[-1]C-R[-2]C4*R[-2]C -> 0 | G125: =R[-1]C-R[-2]C4*R[-2]C -> 0 | H125: =R[-1]C-R[-2]C4*R[-2]C -> 0 | I125: =R[-1]C-R[-2]C4*R[-2]C -> -1950 | J125: =R[-1]C-R[-2]C4*R[-2]C -> -975 | K125: =R[-1]C-R[-2]C4*R[-2]C -> 0 | L125: =R[-1]C-R[-2]C4*R[-2]C -> 0 | M125: =R[-1]C-R[-2]C4*R[-2]C -> 0 | N125: =R[-1]C-R[-2]C4*R[-2]C -> 0 | O125: =R[-1]C-R[-2]C4*R[-2]C -> 0 | P125: =R[-1]C-R[-2]C4*R[-2]C -> 0 | Q125: =R[-1]C-R[-2]C4*R[-2]C -> 0 | R125: =R[-1]C-R[-2]C4*R[-2]C -> 0 | S125: =R[-1]C-R[-2]C4*R[-2]C -> 0 | T125: =R[-1]C-R[-2]C4*R[-2]C -> 0 | U125: =R[-1]C-R[-2]C4*R[-2]C -> 0 | V125: =R[-1]C-R[-2]C4*R[-2]C -> 0 | W125: =R[-1]C-R[-2]C4*R[-2]C -> 0 | X125: =R[-1]C-R[-2]C4*R[-2]C -> 0 | Y125: =R[-1]C-R[-2]C4*R[-2]C -> 0 | Z125: =R[-1]C-R[-2]C4*R[-2]C -> 0 | AA125: =R[-1]C-R[-2]C4*R[-2]C -> 0 | AB125: =R[-1]C-R[-2]C4*R[-2]C -> 0 | AC125: =R[-1]C-R[-2]C4*R[-2]C -> 0 | AD125: =R[-1]C-R[-2]C4*R[-2]C -> 0 | AE125: =R[-1]C-R[-2]C4*R[-2]C -> 0 | AF125: =R[-1]C-R[-2]C4*R[-2]C -> -975 | AG125: =R[-1]C-R[-2]C4*R[-2]C -> -975 | AH125: =R[-1]C-R[-2]C4*R[-2]C -> -975 | AI125: =R[-1]C-R[-2]C4*R[-2]C -> 0 | AJ125: =R[-1]C-R[-2]C4*R[-2]C -> 0 | AK125: =R[-1]C-R[-2]C4*R[-2]C -> 0 | AL125: =R[-1]C-R[-2]C4*R[-2]C -> 0 | AM125: =R[-1]C-R[-2]C4*R[-2]C -> 0 | AN125: =R[-1]C-R[-2]C4*R[-2]C -> 0 | AO125: =R[-1]C-R[-2]C4*R[-2]C -> 0 | AP125: =R[-1]C-R[-2]C4*R[-2]C -> 0 | AQ125: =R[-1]C-R[-2]C4*R[-2]C -> 0 | AR125: =R[-1]C-R[-2]C4*R[-2]C -> 0 | AS125: =R[-1]C-R[-2]C4*R[-2]C -> 0 | AT125: =R[-1]C-R[-2]C4*R[-2]C -> 0 | AU125: =R[-1]C-R[-2]C4*R[-2]C -> 0 | AV125: =R[-1]C-R[-2]C4*R[-2]C -> 0 | AW125: =R[-1]C-R[-2]C4*R[-2]C -> 0 | AX125: =R[-1]C-R[-2]C4*R[-2]C -> 0 | AY125: =R[-1]C-R[-2]C4*R[-2]C -> 0 | AZ125: =R[-1]C-R[-2]C4*R[-2]C -> 0 | BA125: =R[-1]C-R[-2]C4*R[-2]C -> 0 | BB125: =R[-1]C-R[-2]C4*R[-2]C -> 0 | BC125: =R[-1]C-R[-2]C4*R[-2]C -> 0 | BD125: =R[-1]C-R[-2]C4*R[-2]C -> -975 | BE125: =R[-1]C-R[-2]C4*R[-2]C -> 0 | BF125: =R[-1]C-R[-2]C4*R[-2]C -> 0 | BG125: =R[-1]C-R[-2]C4*R[-2]C -> -975 | BO125: =SUM(RC[-61]:RC[-8]) -> -7800
A126: Fast Start in Business Systems Analysis | B126: 2002-06-03T00:00:00.000 | C126: 3 | D126: 1800 | E126: 550 | F126: 1 | G126: 0 | H126: 0 | I126: 0 | J126: 0 | K126: 0 | L126: 0 | M126: 0 | N126: 0 | O126: 0 | P126: 0 | Q126: 0 | R126: 0 | S126: 0 | T126: 0 | U126: 0 | V126: 0 | W126: 0 | X126: 1 | Y126: 3 | Z126: 0 | AA126: 1 | AB126: 0 | AC126: 0 | AD126: 0 | AE126: 0 | AF126: 0 | AG126: 0 | AH126: 0 | AI126: 0 | AJ126: 0 | AK126: 0 | AL126: 0 | AM126: 0 | AN126: 0 | AO126: 0 | AP126: 0 | AQ126: 0 | AR126: 0 | AS126: 0 | AT126: 0 | AU126: 0 | AV126: 0 | AW126: 0 | AX126: 0 | AY126: 0 | AZ126: 0 | BA126: 0 | BB126: 0 | BC126: 0 | BD126: 0 | BE126: 0 | BF126: 0 | BG126: 16 | BK126: =SUM(RC[-57]:RC[-4]) -> 22 | BL126: =RC[-61]*RC[-1] -> 66
D127: Total | F127: =R[-1]C*R126C5 -> 550 | G127: =R[-1]C*R126C5 -> 0 | H127: =R[-1]C*R126C5 -> 0 | I127: =R[-1]C*R126C5 -> 0 | J127: =R[-1]C*R126C5 -> 0 | K127: =R[-1]C*R126C5 -> 0 | L127: =R[-1]C*R126C5 -> 0 | M127: =R[-1]C*R126C5 -> 0 | N127: =R[-1]C*R126C5 -> 0 | O127: =R[-1]C*R126C5 -> 0 | P127: =R[-1]C*R126C5 -> 0 | Q127: =R[-1]C*R126C5 -> 0 | R127: =R[-1]C*R126C5 -> 0 | S127: =R[-1]C*R126C5 -> 0 | T127: =R[-1]C*R126C5 -> 0 | U127: =R[-1]C*R126C5 -> 0 | V127: =R[-1]C*R126C5 -> 0 | W127: =R[-1]C*R126C5 -> 0 | X127: =R[-1]C*R126C5 -> 550 | Y127: =R[-1]C*R126C5 -> 1650 | Z127: =R[-1]C*R126C5 -> 0 | AA127: =R[-1]C*R126C5 -> 550 | AB127: =R[-1]C*R126C5 -> 0 | AC127: =R[-1]C*R126C5 -> 0 | AD127: =R[-1]C*R126C5 -> 0 | AE127: =R[-1]C*R126C5 -> 0 | AF127: =R[-1]C*R126C5 -> 0 | AG127: =R[-1]C*R126C5 -> 0 | AH127: =R[-1]C*R126C5 -> 0 | AI127: =R[-1]C*R126C5 -> 0 | AJ127: =R[-1]C*R126C5 -> 0 | AK127: =R[-1]C*R126C5 -> 0 | AL127: =R[-1]C*R126C5 -> 0 | AM127: =R[-1]C*R126C5 -> 0 | AN127: =R[-1]C*R126C5 -> 0 | AO127: =R[-1]C*R126C5 -> 0 | AP127: =R[-1]C*R126C5 -> 0 | AQ127: =R[-1]C*R126C5 -> 0 | AR127: =R[-1]C*R126C5 -> 0 | AS127: =R[-1]C*R126C5 -> 0 | AT127: =R[-1]C*R126C5 -> 0 | AU127: =R[-1]C*R126C5 -> 0 | AV127: =R[-1]C*R126C5 -> 0 | AW127: =R[-1]C*R126C5 -> 0 | AX127: =R[-1]C*R126C5 -> 0 | AY127: =R[-1]C*R126C5 -> 0 | AZ127: =R[-1]C*R126C5 -> 0 | BA127: =R[-1]C*R126C5 -> 0 | BB127: =R[-1]C*R126C5 -> 0 | BC127: =R[-1]C*R126C5 -> 0 | BD127: =R[-1]C*R126C5 -> 0 | BE127: =R[-1]C*R126C5 -> 0 | BF127: =R[-1]C*R126C5 -> 0 | BG127: =R[-1]C*R126C5 -> 8800 | BM127: =R[-1]C[-61]*R[-1]C[-2] -> 39600 | BN127: =RC[-1]-RC[1] -> 27500 | BO127: =SUM(RC[-61]:RC[-8]) -> 12100
D128: Total Savings | F128: =R[-1]C-R[-2]C4*R[-2]C -> -1250 | G128: =R[-1]C-R[-2]C4*R[-2]C -> 0 | H128: =R[-1]C-R[-2]C4*R[-2]C -> 0 | I128: =R[-1]C-R[-2]C4*R[-2]C -> 0 | J128: =R[-1]C-R[-2]C4*R[-2]C -> 0 | K128: =R[-1]C-R[-2]C4*R[-2]C -> 0 | L128: =R[-1]C-R[-2]C4*R[-2]C -> 0 | M128: =R[-1]C-R[-2]C4*R[-2]C -> 0 | N128: =R[-1]C-R[-2]C4*R[-2]C -> 0 | O128: =R[-1]C-R[-2]C4*R[-2]C -> 0 | P128: =R[-1]C-R[-2]C4*R[-2]C -> 0 | Q128: =R[-1]C-R[-2]C4*R[-2]C -> 0 | R128: =R[-1]C-R[-2]C4*R[-2]C -> 0 | S128: =R[-1]C-R[-2]C4*R[-2]C -> 0 | T128: =R[-1]C-R[-2]C4*R[-2]C -> 0 | U128: =R[-1]C-R[-2]C4*R[-2]C -> 0 | V128: =R[-1]C-R[-2]C4*R[-2]C -> 0 | W128: =R[-1]C-R[-2]C4*R[-2]C -> 0 | X128: =R[-1]C-R[-2]C4*R[-2]C -> -1250 | Y128: =R[-1]C-R[-2]C4*R[-2]C -> -3750 | Z128: =R[-1]C-R[-2]C4*R[-2]C -> 0 | AA128: =R[-1]C-R[-2]C4*R[-2]C -> -1250 | AB128: =R[-1]C-R[-2]C4*R[-2]C -> 0 | AC128: =R[-1]C-R[-2]C4*R[-2]C -> 0 | AD128: =R[-1]C-R[-2]C4*R[-2]C -> 0 | AE128: =R[-1]C-R[-2]C4*R[-2]C -> 0 | AF128: =R[-1]C-R[-2]C4*R[-2]C -> 0 | AG128: =R[-1]C-R[-2]C4*R[-2]C -> 0 | AH128: =R[-1]C-R[-2]C4*R[-2]C -> 0 | AI128: =R[-1]C-R[-2]C4*R[-2]C -> 0 | AJ128: =R[-1]C-R[-2]C4*R[-2]C -> 0 | AK128: =R[-1]C-R[-2]C4*R[-2]C -> 0 | AL128: =R[-1]C-R[-2]C4*R[-2]C -> 0 | AM128: =R[-1]C-R[-2]C4*R[-2]C -> 0 | AN128: =R[-1]C-R[-2]C4*R[-2]C -> 0 | AO128: =R[-1]C-R[-2]C4*R[-2]C -> 0 | AP128: =R[-1]C-R[-2]C4*R[-2]C -> 0 | AQ128: =R[-1]C-R[-2]C4*R[-2]C -> 0 | AR128: =R[-1]C-R[-2]C4*R[-2]C -> 0 | AS128: =R[-1]C-R[-2]C4*R[-2]C -> 0 | AT128: =R[-1]C-R[-2]C4*R[-2]C -> 0 | AU128: =R[-1]C-R[-2]C4*R[-2]C -> 0 | AV128: =R[-1]C-R[-2]C4*R[-2]C -> 0 | AW128: =R[-1]C-R[-2]C4*R[-2]C -> 0 | AX128: =R[-1]C-R[-2]C4*R[-2]C -> 0 | AY128: =R[-1]C-R[-2]C4*R[-2]C -> 0 | AZ128: =R[-1]C-R[-2]C4*R[-2]C -> 0 | BA128: =R[-1]C-R[-2]C4*R[-2]C -> 0 | BB128: =R[-1]C-R[-2]C4*R[-2]C -> 0 | BC128: =R[-1]C-R[-2]C4*R[-2]C -> 0 | BD128: =R[-1]C-R[-2]C4*R[-2]C -> 0 | BE128: =R[-1]C-R[-2]C4*R[-2]C -> 0 | BF128: =R[-1]C-R[-2]C4*R[-2]C -> 0 | BG128: =R[-1]C-R[-2]C4*R[-2]C -> -20000 | BO128: =SUM(RC[-61]:RC[-8]) -> -27500
A129: Introduction to VISIO 2000 | B129: 2002-06-04T00:00:00.000 | C129: 1 | D129: 375 | E129: 150 | F129: 0 | G129: 0 | H129: 0 | I129: 2 | J129: 8 | K129: 0 | L129: 0 | M129: 0 | N129: 0 | O129: 0 | P129: 0 | Q129: 0 | R129: 0 | S129: 0 | T129: 0 | U129: 0 | V129: 0 | W129: 0 | X129: 0 | Y129: 0 | Z129: 0 | AA129: 0 | AB129: 0 | AC129: 0 | AD129: 0 | AE129: 0 | AF129: 0 | AG129: 0 | AH129: 0 | AI129: 0 | AJ129: 0 | AK129: 0 | AL129: 0 | AM129: 0 | AN129: 0 | AO129: 0 | AP129: 0 | AQ129: 0 | AR129: 0 | AS129: 0 | AT129: 0 | AU129: 0 | AV129: 0 | AW129: 0 | AX129: 0 | AY129: 0 | AZ129: 0 | BA129: 0 | BB129: 0 | BC129: 0 | BD129: 0 | BE129: 0 | BF129: 0 | BG129: 0 | BK129: =SUM(RC[-57]:RC[-4]) -> 10 | BL129: =RC[-61]*RC[-1] -> 10
D130: Total | F130: =R[-1]C*R129C5 -> 0 | G130: =R[-1]C*R129C5 -> 0 | H130: =R[-1]C*R129C5 -> 0 | I130: =R[-1]C*R129C5 -> 300 | J130: =R[-1]C*R129C5 -> 1200 | K130: =R[-1]C*R129C5 -> 0 | L130: =R[-1]C*R129C5 -> 0 | M130: =R[-1]C*R129C5 -> 0 | N130: =R[-1]C*R129C5 -> 0 | O130: =R[-1]C*R129C5 -> 0 | P130: =R[-1]C*R129C5 -> 0 | Q130: =R[-1]C*R129C5 -> 0 | R130: =R[-1]C*R129C5 -> 0 | S130: =R[-1]C*R129C5 -> 0 | T130: =R[-1]C*R129C5 -> 0 | U130: =R[-1]C*R129C5 -> 0 | V130: =R[-1]C*R129C5 -> 0 | W130: =R[-1]C*R129C5 -> 0 | X130: =R[-1]C*R129C5 -> 0 | Y130: =R[-1]C*R129C5 -> 0 | Z130: =R[-1]C*R129C5 -> 0 | AA130: =R[-1]C*R129C5 -> 0 | AB130: =R[-1]C*R129C5 -> 0 | AC130: =R[-1]C*R129C5 -> 0 | AD130: =R[-1]C*R129C5 -> 0 | AE130: =R[-1]C*R129C5 -> 0 | AF130: =R[-1]C*R129C5 -> 0 | AG130: =R[-1]C*R129C5 -> 0 | AH130: =R[-1]C*R129C5 -> 0 | AI130: =R[-1]C*R129C5 -> 0 | AJ130: =R[-1]C*R129C5 -> 0 | AK130: =R[-1]C*R129C5 -> 0 | AL130: =R[-1]C*R129C5 -> 0 | AM130: =R[-1]C*R129C5 -> 0 | AN130: =R[-1]C*R129C5 -> 0 | AO130: =R[-1]C*R129C5 -> 0 | AP130: =R[-1]C*R129C5 -> 0 | AQ130: =R[-1]C*R129C5 -> 0 | AR130: =R[-1]C*R129C5 -> 0 | AS130: =R[-1]C*R129C5 -> 0 | AT130: =R[-1]C*R129C5 -> 0 | AU130: =R[-1]C*R129C5 -> 0 | AV130: =R[-1]C*R129C5 -> 0 | AW130: =R[-1]C*R129C5 -> 0 | AX130: =R[-1]C*R129C5 -> 0 | AY130: =R[-1]C*R129C5 -> 0 | AZ130: =R[-1]C*R129C5 -> 0 | BA130: =R[-1]C*R129C5 -> 0 | BB130: =R[-1]C*R129C5 -> 0 | BC130: =R[-1]C*R129C5 -> 0 | BD130: =R[-1]C*R129C5 -> 0 | BE130: =R[-1]C*R129C5 -> 0 | BF130: =R[-1]C*R129C5 -> 0 | BG130: =R[-1]C*R129C5 -> 0 | BM130: =R[-1]C[-61]*R[-1]C[-2] -> 3750 | BN130: =RC[-1]-RC[1] -> 2250 | BO130: =SUM(RC[-61]:RC[-8]) -> 1500
D131: Total Savings | F131: =R[-1]C-R[-2]C4*R[-2]C -> 0 | G131: =R[-1]C-R[-2]C4*R[-2]C -> 0 | H131: =R[-1]C-R[-2]C4*R[-2]C -> 0 | I131: =R[-1]C-R[-2]C4*R[-2]C -> -450 | J131: =R[-1]C-R[-2]C4*R[-2]C -> -1800 | K131: =R[-1]C-R[-2]C4*R[-2]C -> 0 | L131: =R[-1]C-R[-2]C4*R[-2]C -> 0 | M131: =R[-1]C-R[-2]C4*R[-2]C -> 0 | N131: =R[-1]C-R[-2]C4*R[-2]C -> 0 | O131: =R[-1]C-R[-2]C4*R[-2]C -> 0 | P131: =R[-1]C-R[-2]C4*R[-2]C -> 0 | Q131: =R[-1]C-R[-2]C4*R[-2]C -> 0 | R131: =R[-1]C-R[-2]C4*R[-2]C -> 0 | S131: =R[-1]C-R[-2]C4*R[-2]C -> 0 | T131: =R[-1]C-R[-2]C4*R[-2]C -> 0 | U131: =R[-1]C-R[-2]C4*R[-2]C -> 0 | V131: =R[-1]C-R[-2]C4*R[-2]C -> 0 | W131: =R[-1]C-R[-2]C4*R[-2]C -> 0 | X131: =R[-1]C-R[-2]C4*R[-2]C -> 0 | Y131: =R[-1]C-R[-2]C4*R[-2]C -> 0 | Z131: =R[-1]C-R[-2]C4*R[-2]C -> 0 | AA131: =R[-1]C-R[-2]C4*R[-2]C -> 0 | AB131: =R[-1]C-R[-2]C4*R[-2]C -> 0 | AC131: =R[-1]C-R[-2]C4*R[-2]C -> 0 | AD131: =R[-1]C-R[-2]C4*R[-2]C -> 0 | AE131: =R[-1]C-R[-2]C4*R[-2]C -> 0 | AF131: =R[-1]C-R[-2]C4*R[-2]C -> 0 | AG131: =R[-1]C-R[-2]C4*R[-2]C -> 0 | AH131: =R[-1]C-R[-2]C4*R[-2]C -> 0 | AI131: =R[-1]C-R[-2]C4*R[-2]C -> 0 | AJ131: =R[-1]C-R[-2]C4*R[-2]C -> 0 | AK131: =R[-1]C-R[-2]C4*R[-2]C -> 0 | AL131: =R[-1]C-R[-2]C4*R[-2]C -> 0 | AM131: =R[-1]C-R[-2]C4*R[-2]C -> 0 | AN131: =R[-1]C-R[-2]C4*R[-2]C -> 0 | AO131: =R[-1]C-R[-2]C4*R[-2]C -> 0 | AP131: =R[-1]C-R[-2]C4*R[-2]C -> 0 | AQ131: =R[-1]C-R[-2]C4*R[-2]C -> 0 | AR131: =R[-1]C-R[-2]C4*R[-2]C -> 0 | AS131: =R[-1]C-R[-2]C4*R[-2]C -> 0 | AT131: =R[-1]C-R[-2]C4*R[-2]C -> 0 | AU131: =R[-1]C-R[-2]C4*R[-2]C -> 0 | AV131: =R[-1]C-R[-2]C4*R[-2]C -> 0 | AW131: =R[-1]C-R[-2]C4*R[-2]C -> 0 | AX131: =R[-1]C-R[-2]C4*R[-2]C -> 0 | AY131: =R[-1]C-R[-2]C4*R[-2]C -> 0 | AZ131: =R[-1]C-R[-2]C4*R[-2]C -> 0 | BA131: =R[-1]C-R[-2]C4*R[-2]C -> 0 | BB131: =R[-1]C-R[-2]C4*R[-2]C -> 0 | BC131: =R[-1]C-R[-2]C4*R[-2]C -> 0 | BD131: =R[-1]C-R[-2]C4*R[-2]C -> 0 | BE131: =R[-1]C-R[-2]C4*R[-2]C -> 0 | BF131: =R[-1]C-R[-2]C4*R[-2]C -> 0 | BG131: =R[-1]C-R[-2]C4*R[-2]C -> 0 | BO131: =SUM(RC[-61]:RC[-8]) -> -2250
A132: Introduction to TSO/ISPF | B132: 2002-06-04T00:00:00.000 | C132: 1 | D132: 550 | E132: 225 | F132: 0 | G132: 0 | H132: 0 | I132: 0 | J132: 0 | K132: 9 | L132: 0 | M132: 0 | N132: 0 | O132: 0 | P132: 0 | Q132: 0 | R132: 0 | S132: 0 | T132: 0 | U132: 0 | V132: 0 | W132: 0 | X132: 3 | Y132: 0 | Z132: 0 | AA132: 0 | AB132: 0 | AC132: 0 | AD132: 3 | AE132: 0 | AF132: 0 | AG132: 0 | AH132: 0 | AI132: 0 | AJ132: 0 | AK132: 0 | AL132: 0 | AM132: 0 | AN132: 0 | AO132: 0 | AP132: 0 | AQ132: 0 | AR132: 0 | AS132: 0 | AT132: 0 | AU132: 0 | AV132: 0 | AW132: 0 | AX132: 0 | AY132: 0 | AZ132: 0 | BA132: 0 | BB132: 0 | BC132: 0 | BD132: 0 | BE132: 0 | BF132: 0 | BG132: 0 | BK132: =SUM(RC[-57]:RC[-4]) -> 15 | BL132: =RC[-61]*RC[-1] -> 15
D133: Total | F133: =R[-1]C*R132C5 -> 0 | G133: =R[-1]C*R132C5 -> 0 | H133: =R[-1]C*R132C5 -> 0 | I133: =R[-1]C*R132C5 -> 0 | J133: =R[-1]C*R132C5 -> 0 | K133: =R[-1]C*R132C5 -> 2025 | L133: =R[-1]C*R132C5 -> 0 | M133: =R[-1]C*R132C5 -> 0 | N133: =R[-1]C*R132C5 -> 0 | O133: =R[-1]C*R132C5 -> 0 | P133: =R[-1]C*R132C5 -> 0 | Q133: =R[-1]C*R132C5 -> 0 | R133: =R[-1]C*R132C5 -> 0 | S133: =R[-1]C*R132C5 -> 0 | T133: =R[-1]C*R132C5 -> 0 | U133: =R[-1]C*R132C5 -> 0 | V133: =R[-1]C*R132C5 -> 0 | W133: =R[-1]C*R132C5 -> 0 | X133: =R[-1]C*R132C5 -> 675 | Y133: =R[-1]C*R132C5 -> 0 | Z133: =R[-1]C*R132C5 -> 0 | AA133: =R[-1]C*R132C5 -> 0 | AB133: =R[-1]C*R132C5 -> 0 | AC133: =R[-1]C*R132C5 -> 0 | AD133: =R[-1]C*R132C5 -> 675 | AE133: =R[-1]C*R132C5 -> 0 | AF133: =R[-1]C*R132C5 -> 0 | AG133: =R[-1]C*R132C5 -> 0 | AH133: =R[-1]C*R132C5 -> 0 | AI133: =R[-1]C*R132C5 -> 0 | AJ133: =R[-1]C*R132C5 -> 0 | AK133: =R[-1]C*R132C5 -> 0 | AL133: =R[-1]C*R132C5 -> 0 | AM133: =R[-1]C*R132C5 -> 0 | AN133: =R[-1]C*R132C5 -> 0 | AO133: =R[-1]C*R132C5 -> 0 | AP133: =R[-1]C*R132C5 -> 0 | AQ133: =R[-1]C*R132C5 -> 0 | AR133: =R[-1]C*R132C5 -> 0 | AS133: =R[-1]C*R132C5 -> 0 | AT133: =R[-1]C*R132C5 -> 0 | AU133: =R[-1]C*R132C5 -> 0 | AV133: =R[-1]C*R132C5 -> 0 | AW133: =R[-1]C*R132C5 -> 0 | AX133: =R[-1]C*R132C5 -> 0 | AY133: =R[-1]C*R132C5 -> 0 | AZ133: =R[-1]C*R132C5 -> 0 | BA133: =R[-1]C*R132C5 -> 0 | BB133: =R[-1]C*R132C5 -> 0 | BC133: =R[-1]C*R132C5 -> 0 | BD133: =R[-1]C*R132C5 -> 0 | BE133: =R[-1]C*R132C5 -> 0 | BF133: =R[-1]C*R132C5 -> 0 | BG133: =R[-1]C*R132C5 -> 0 | BM133: =R[-1]C[-61]*R[-1]C[-2] -> 8250 | BN133: =RC[-1]-RC[1] -> 4875 | BO133: =SUM(RC[-61]:RC[-8]) -> 3375
D134: Total Savings | F134: =R[-1]C-R[-2]C4*R[-2]C -> 0 | G134: =R[-1]C-R[-2]C4*R[-2]C -> 0 | H134: =R[-1]C-R[-2]C4*R[-2]C -> 0 | I134: =R[-1]C-R[-2]C4*R[-2]C -> 0 | J134: =R[-1]C-R[-2]C4*R[-2]C -> 0 | K134: =R[-1]C-R[-2]C4*R[-2]C -> -2925 | L134: =R[-1]C-R[-2]C4*R[-2]C -> 0 | M134: =R[-1]C-R[-2]C4*R[-2]C -> 0 | N134: =R[-1]C-R[-2]C4*R[-2]C -> 0 | O134: =R[-1]C-R[-2]C4*R[-2]C -> 0 | P134: =R[-1]C-R[-2]C4*R[-2]C -> 0 | Q134: =R[-1]C-R[-2]C4*R[-2]C -> 0 | R134: =R[-1]C-R[-2]C4*R[-2]C -> 0 | S134: =R[-1]C-R[-2]C4*R[-2]C -> 0 | T134: =R[-1]C-R[-2]C4*R[-2]C -> 0 | U134: =R[-1]C-R[-2]C4*R[-2]C -> 0 | V134: =R[-1]C-R[-2]C4*R[-2]C -> 0 | W134: =R[-1]C-R[-2]C4*R[-2]C -> 0 | X134: =R[-1]C-R[-2]C4*R[-2]C -> -975 | Y134: =R[-1]C-R[-2]C4*R[-2]C -> 0 | Z134: =R[-1]C-R[-2]C4*R[-2]C -> 0 | AA134: =R[-1]C-R[-2]C4*R[-2]C -> 0 | AB134: =R[-1]C-R[-2]C4*R[-2]C -> 0 | AC134: =R[-1]C-R[-2]C4*R[-2]C -> 0 | AD134: =R[-1]C-R[-2]C4*R[-2]C -> -975 | AE134: =R[-1]C-R[-2]C4*R[-2]C -> 0 | AF134: =R[-1]C-R[-2]C4*R[-2]C -> 0 | AG134: =R[-1]C-R[-2]C4*R[-2]C -> 0 | AH134: =R[-1]C-R[-2]C4*R[-2]C -> 0 | AI134: =R[-1]C-R[-2]C4*R[-2]C -> 0 | AJ134: =R[-1]C-R[-2]C4*R[-2]C -> 0 | AK134: =R[-1]C-R[-2]C4*R[-2]C -> 0 | AL134: =R[-1]C-R[-2]C4*R[-2]C -> 0 | AM134: =R[-1]C-R[-2]C4*R[-2]C -> 0 | AN134: =R[-1]C-R[-2]C4*R[-2]C -> 0 | AO134: =R[-1]C-R[-2]C4*R[-2]C -> 0 | AP134: =R[-1]C-R[-2]C4*R[-2]C -> 0 | AQ134: =R[-1]C-R[-2]C4*R[-2]C -> 0 | AR134: =R[-1]C-R[-2]C4*R[-2]C -> 0 | AS134: =R[-1]C-R[-2]C4*R[-2]C -> 0 | AT134: =R[-1]C-R[-2]C4*R[-2]C -> 0 | AU134: =R[-1]C-R[-2]C4*R[-2]C -> 0 | AV134: =R[-1]C-R[-2]C4*R[-2]C -> 0 | AW134: =R[-1]C-R[-2]C4*R[-2]C -> 0 | AX134: =R[-1]C-R[-2]C4*R[-2]C -> 0 | AY134: =R[-1]C-R[-2]C4*R[-2]C -> 0 | AZ134: =R[-1]C-R[-2]C4*R[-2]C -> 0 | BA134: =R[-1]C-R[-2]C4*R[-2]C -> 0 | BB134: =R[-1]C-R[-2]C4*R[-2]C -> 0 | BC134: =R[-1]C-R[-2]C4*R[-2]C -> 0 | BD134: =R[-1]C-R[-2]C4*R[-2]C -> 0 | BE134: =R[-1]C-R[-2]C4*R[-2]C -> 0 | BF134: =R[-1]C-R[-2]C4*R[-2]C -> 0 | BG134: =R[-1]C-R[-2]C4*R[-2]C -> 0 | BO134: =SUM(RC[-61]:RC[-8]) -> -4875
A135: Basic MVS/JCL | B135: 2002-06-05T00:00:00.000 | C135: 2 | D135: 1100 | E135: 450 | F135: 0 | G135: 0 | H135: 0 | I135: 0 | J135: 0 | K135: 6 | L135: 0 | M135: 0 | N135: 0 | O135: 0 | P135: 0 | Q135: 0 | R135: 0 | S135: 0 | T135: 0 | U135: 0 | V135: 0 | W135: 0 | X135: 2 | Y135: 0 | Z135: 0 | AA135: 0 | AB135: 0 | AC135: 0 | AD135: 1 | AE135: 0 | AF135: 0 | AG135: 0 | AH135: 0 | AI135: 0 | AJ135: 0 | AK135: 0 | AL135: 0 | AM135: 0 | AN135: 0 | AO135: 0 | AP135: 0 | AQ135: 0 | AR135: 0 | AS135: 0 | AT135: 0 | AU135: 0 | AV135: 0 | AW135: 0 | AX135: 0 | AY135: 0 | AZ135: 0 | BA135: 0 | BB135: 0 | BC135: 0 | BD135: 0 | BE135: 1 | BF135: 0 | BG135: 0 | BK135: =SUM(RC[-57]:RC[-4]) -> 10 | BL135: =RC[-61]*RC[-1] -> 20
D136: Total | F136: =R[-1]C*R135C5 -> 0 | G136: =R[-1]C*R135C5 -> 0 | H136: =R[-1]C*R135C5 -> 0 | I136: =R[-1]C*R135C5 -> 0 | J136: =R[-1]C*R135C5 -> 0 | K136: =R[-1]C*R135C5 -> 2700 | L136: =R[-1]C*R135C5 -> 0 | M136: =R[-1]C*R135C5 -> 0 | N136: =R[-1]C*R135C5 -> 0 | O136: =R[-1]C*R135C5 -> 0 | P136: =R[-1]C*R135C5 -> 0 | Q136: =R[-1]C*R135C5 -> 0 | R136: =R[-1]C*R135C5 -> 0 | S136: =R[-1]C*R135C5 -> 0 | T136: =R[-1]C*R135C5 -> 0 | U136: =R[-1]C*R135C5 -> 0 | V136: =R[-1]C*R135C5 -> 0 | W136: =R[-1]C*R135C5 -> 0 | X136: =R[-1]C*R135C5 -> 900 | Y136: =R[-1]C*R135C5 -> 0 | Z136: =R[-1]C*R135C5 -> 0 | AA136: =R[-1]C*R135C5 -> 0 | AB136: =R[-1]C*R135C5 -> 0 | AC136: =R[-1]C*R135C5 -> 0 | AD136: =R[-1]C*R135C5 -> 450 | AE136: =R[-1]C*R135C5 -> 0 | AF136: =R[-1]C*R135C5 -> 0 | AG136: =R[-1]C*R135C5 -> 0 | AH136: =R[-1]C*R135C5 -> 0 | AI136: =R[-1]C*R135C5 -> 0 | AJ136: =R[-1]C*R135C5 -> 0 | AK136: =R[-1]C*R135C5 -> 0 | AL136: =R[-1]C*R135C5 -> 0 | AM136: =R[-1]C*R135C5 -> 0 | AN136: =R[-1]C*R135C5 -> 0 | AO136: =R[-1]C*R135C5 -> 0 | AP136: =R[-1]C*R135C5 -> 0 | AQ136: =R[-1]C*R135C5 -> 0 | AR136: =R[-1]C*R135C5 -> 0 | AS136: =R[-1]C*R135C5 -> 0 | AT136: =R[-1]C*R135C5 -> 0 | AU136: =R[-1]C*R135C5 -> 0 | AV136: =R[-1]C*R135C5 -> 0 | AW136: =R[-1]C*R135C5 -> 0 | AX136: =R[-1]C*R135C5 -> 0 | AY136: =R[-1]C*R135C5 -> 0 | AZ136: =R[-1]C*R135C5 -> 0 | BA136: =R[-1]C*R135C5 -> 0 | BB136: =R[-1]C*R135C5 -> 0 | BC136: =R[-1]C*R135C5 -> 0 | BD136: =R[-1]C*R135C5 -> 0 | BE136: =R[-1]C*R135C5 -> 450 | BF136: =R[-1]C*R135C5 -> 0 | BG136: =R[-1]C*R135C5 -> 0 | BM136: =R[-1]C[-61]*R[-1]C[-2] -> 11000 | BN136: =RC[-1]-RC[1] -> 6500 | BO136: =SUM(RC[-61]:RC[-8]) -> 4500
D137: Total Savings | F137: =R[-1]C-R[-2]C4*R[-2]C -> 0 | G137: =R[-1]C-R[-2]C4*R[-2]C -> 0 | H137: =R[-1]C-R[-2]C4*R[-2]C -> 0 | I137: =R[-1]C-R[-2]C4*R[-2]C -> 0 | J137: =R[-1]C-R[-2]C4*R[-2]C -> 0 | K137: =R[-1]C-R[-2]C4*R[-2]C -> -3900 | L137: =R[-1]C-R[-2]C4*R[-2]C -> 0 | M137: =R[-1]C-R[-2]C4*R[-2]C -> 0 | N137: =R[-1]C-R[-2]C4*R[-2]C -> 0 | O137: =R[-1]C-R[-2]C4*R[-2]C -> 0 | P137: =R[-1]C-R[-2]C4*R[-2]C -> 0 | Q137: =R[-1]C-R[-2]C4*R[-2]C -> 0 | R137: =R[-1]C-R[-2]C4*R[-2]C -> 0 | S137: =R[-1]C-R[-2]C4*R[-2]C -> 0 | T137: =R[-1]C-R[-2]C4*R[-2]C -> 0 | U137: =R[-1]C-R[-2]C4*R[-2]C -> 0 | V137: =R[-1]C-R[-2]C4*R[-2]C -> 0 | W137: =R[-1]C-R[-2]C4*R[-2]C -> 0 | X137: =R[-1]C-R[-2]C4*R[-2]C -> -1300 | Y137: =R[-1]C-R[-2]C4*R[-2]C -> 0 | Z137: =R[-1]C-R[-2]C4*R[-2]C -> 0 | AA137: =R[-1]C-R[-2]C4*R[-2]C -> 0 | AB137: =R[-1]C-R[-2]C4*R[-2]C -> 0 | AC137: =R[-1]C-R[-2]C4*R[-2]C -> 0 | AD137: =R[-1]C-R[-2]C4*R[-2]C -> -650 | AE137: =R[-1]C-R[-2]C4*R[-2]C -> 0 | AF137: =R[-1]C-R[-2]C4*R[-2]C -> 0 | AG137: =R[-1]C-R[-2]C4*R[-2]C -> 0 | AH137: =R[-1]C-R[-2]C4*R[-2]C -> 0 | AI137: =R[-1]C-R[-2]C4*R[-2]C -> 0 | AJ137: =R[-1]C-R[-2]C4*R[-2]C -> 0 | AK137: =R[-1]C-R[-2]C4*R[-2]C -> 0 | AL137: =R[-1]C-R[-2]C4*R[-2]C -> 0 | AM137: =R[-1]C-R[-2]C4*R[-2]C -> 0 | AN137: =R[-1]C-R[-2]C4*R[-2]C -> 0 | AO137: =R[-1]C-R[-2]C4*R[-2]C -> 0 | AP137: =R[-1]C-R[-2]C4*R[-2]C -> 0 | AQ137: =R[-1]C-R[-2]C4*R[-2]C -> 0 | AR137: =R[-1]C-R[-2]C4*R[-2]C -> 0 | AS137: =R[-1]C-R[-2]C4*R[-2]C -> 0 | AT137: =R[-1]C-R[-2]C4*R[-2]C -> 0 | AU137: =R[-1]C-R[-2]C4*R[-2]C -> 0 | AV137: =R[-1]C-R[-2]C4*R[-2]C -> 0 | AW137: =R[-1]C-R[-2]C4*R[-2]C -> 0 | AX137: =R[-1]C-R[-2]C4*R[-2]C -> 0 | AY137: =R[-1]C-R[-2]C4*R[-2]C -> 0 | AZ137: =R[-1]C-R[-2]C4*R[-2]C -> 0 | BA137: =R[-1]C-R[-2]C4*R[-2]C -> 0 | BB137: =R[-1]C-R[-2]C4*R[-2]C -> 0 | BC137: =R[-1]C-R[-2]C4*R[-2]C -> 0 | BD137: =R[-1]C-R[-2]C4*R[-2]C -> 0 | BE137: =R[-1]C-R[-2]C4*R[-2]C -> -650 | BF137: =R[-1]C-R[-2]C4*R[-2]C -> 0 | BG137: =R[-1]C-R[-2]C4*R[-2]C -> 0 | BO137: =SUM(RC[-61]:RC[-8]) -> -6500
A138: Mastering the Requirements Process | B138: 2002-06-10T00:00:00.000 | C138: 2 | D138: 1175 | E138: 525 | F138: 0 | G138: 0 | H138: 0 | I138: 0 | J138: 0 | K138: 0 | L138: 0 | M138: 0 | N138: 0 | O138: 0 | P138: 0 | Q138: 0 | R138: 0 | S138: 0 | T138: 0 | U138: 0 | V138: 0 | W138: 3 | X138: 0 | Y138: 0 | Z138: 0 | AA138: 0 | AB138: 0 | AC138: 0 | AD138: 0 | AE138: 0 | AF138: 0 | AG138: 0 | AH138: 0 | AI138: 0 | AJ138: 0 | AK138: 0 | AL138: 0 | AM138: 0 | AN138: 0 | AO138: 0 | AP138: 0 | AQ138: 0 | AR138: 0 | AS138: 0 | AT138: 0 | AU138: 0 | AV138: 0 | AW138: 0 | AX138: 0 | AY138: 0 | AZ138: 0 | BA138: 0 | BB138: 0 | BC138: 0 | BD138: 0 | BE138: 0 | BF138: 0 | BG138: 15 | BK138: =SUM(RC[-57]:RC[-4]) -> 18 | BL138: =RC[-61]*RC[-1] -> 36
D139: Total | F139: =R[-1]C*R138C5 -> 0 | G139: =R[-1]C*R138C5 -> 0 | H139: =R[-1]C*R138C5 -> 0 | I139: =R[-1]C*R138C5 -> 0 | J139: =R[-1]C*R138C5 -> 0 | K139: =R[-1]C*R138C5 -> 0 | L139: =R[-1]C*R138C5 -> 0 | M139: =R[-1]C*R138C5 -> 0 | N139: =R[-1]C*R138C5 -> 0 | O139: =R[-1]C*R138C5 -> 0 | P139: =R[-1]C*R138C5 -> 0 | Q139: =R[-1]C*R138C5 -> 0 | R139: =R[-1]C*R138C5 -> 0 | S139: =R[-1]C*R138C5 -> 0 | T139: =R[-1]C*R138C5 -> 0 | U139: =R[-1]C*R138C5 -> 0 | V139: =R[-1]C*R138C5 -> 0 | W139: =R[-1]C*R138C5 -> 1575 | X139: =R[-1]C*R138C5 -> 0 | Y139: =R[-1]C*R138C5 -> 0 | Z139: =R[-1]C*R138C5 -> 0 | AA139: =R[-1]C*R138C5 -> 0 | AB139: =R[-1]C*R138C5 -> 0 | AC139: =R[-1]C*R138C5 -> 0 | AD139: =R[-1]C*R138C5 -> 0 | AE139: =R[-1]C*R138C5 -> 0 | AF139: =R[-1]C*R138C5 -> 0 | AG139: =R[-1]C*R138C5 -> 0 | AH139: =R[-1]C*R138C5 -> 0 | AI139: =R[-1]C*R138C5 -> 0 | AJ139: =R[-1]C*R138C5 -> 0 | AK139: =R[-1]C*R138C5 -> 0 | AL139: =R[-1]C*R138C5 -> 0 | AM139: =R[-1]C*R138C5 -> 0 | AN139: =R[-1]C*R138C5 -> 0 | AO139: =R[-1]C*R138C5 -> 0 | AP139: =R[-1]C*R138C5 -> 0 | AQ139: =R[-1]C*R138C5 -> 0 | AR139: =R[-1]C*R138C5 -> 0 | AS139: =R[-1]C*R138C5 -> 0 | AT139: =R[-1]C*R138C5 -> 0 | AU139: =R[-1]C*R138C5 -> 0 | AV139: =R[-1]C*R138C5 -> 0 | AW139: =R[-1]C*R138C5 -> 0 | AX139: =R[-1]C*R138C5 -> 0 | AY139: =R[-1]C*R138C5 -> 0 | AZ139: =R[-1]C*R138C5 -> 0 | BA139: =R[-1]C*R138C5 -> 0 | BB139: =R[-1]C*R138C5 -> 0 | BC139: =R[-1]C*R138C5 -> 0 | BD139: =R[-1]C*R138C5 -> 0 | BE139: =R[-1]C*R138C5 -> 0 | BF139: =R[-1]C*R138C5 -> 0 | BG139: =R[-1]C*R138C5 -> 7875 | BM139: =R[-1]C[-61]*R[-1]C[-2] -> 21150 | BN139: =RC[-1]-RC[1] -> 11700 | BO139: =SUM(RC[-61]:RC[-8]) -> 9450
D140: Total Savings | F140: =R[-1]C-R[-2]C4*R[-2]C -> 0 | G140: =R[-1]C-R[-2]C4*R[-2]C -> 0 | H140: =R[-1]C-R[-2]C4*R[-2]C -> 0 | I140: =R[-1]C-R[-2]C4*R[-2]C -> 0 | J140: =R[-1]C-R[-2]C4*R[-2]C -> 0 | K140: =R[-1]C-R[-2]C4*R[-2]C -> 0 | L140: =R[-1]C-R[-2]C4*R[-2]C -> 0 | M140: =R[-1]C-R[-2]C4*R[-2]C -> 0 | N140: =R[-1]C-R[-2]C4*R[-2]C -> 0 | O140: =R[-1]C-R[-2]C4*R[-2]C -> 0 | P140: =R[-1]C-R[-2]C4*R[-2]C -> 0 | Q140: =R[-1]C-R[-2]C4*R[-2]C -> 0 | R140: =R[-1]C-R[-2]C4*R[-2]C -> 0 | S140: =R[-1]C-R[-2]C4*R[-2]C -> 0 | T140: =R[-1]C-R[-2]C4*R[-2]C -> 0 | U140: =R[-1]C-R[-2]C4*R[-2]C -> 0 | V140: =R[-1]C-R[-2]C4*R[-2]C -> 0 | W140: =R[-1]C-R[-2]C4*R[-2]C -> -1950 | X140: =R[-1]C-R[-2]C4*R[-2]C -> 0 | Y140: =R[-1]C-R[-2]C4*R[-2]C -> 0 | Z140: =R[-1]C-R[-2]C4*R[-2]C -> 0 | AA140: =R[-1]C-R[-2]C4*R[-2]C -> 0 | AB140: =R[-1]C-R[-2]C4*R[-2]C -> 0 | AC140: =R[-1]C-R[-2]C4*R[-2]C -> 0 | AD140: =R[-1]C-R[-2]C4*R[-2]C -> 0 | AE140: =R[-1]C-R[-2]C4*R[-2]C -> 0 | AF140: =R[-1]C-R[-2]C4*R[-2]C -> 0 | AG140: =R[-1]C-R[-2]C4*R[-2]C -> 0 | AH140: =R[-1]C-R[-2]C4*R[-2]C -> 0 | AI140: =R[-1]C-R[-2]C4*R[-2]C -> 0 | AJ140: =R[-1]C-R[-2]C4*R[-2]C -> 0 | AK140: =R[-1]C-R[-2]C4*R[-2]C -> 0 | AL140: =R[-1]C-R[-2]C4*R[-2]C -> 0 | AM140: =R[-1]C-R[-2]C4*R[-2]C -> 0 | AN140: =R[-1]C-R[-2]C4*R[-2]C -> 0 | AO140: =R[-1]C-R[-2]C4*R[-2]C -> 0 | AP140: =R[-1]C-R[-2]C4*R[-2]C -> 0 | AQ140: =R[-1]C-R[-2]C4*R[-2]C -> 0 | AR140: =R[-1]C-R[-2]C4*R[-2]C -> 0 | AS140: =R[-1]C-R[-2]C4*R[-2]C -> 0 | AT140: =R[-1]C-R[-2]C4*R[-2]C -> 0 | AU140: =R[-1]C-R[-2]C4*R[-2]C -> 0 | AV140: =R[-1]C-R[-2]C4*R[-2]C -> 0 | AW140: =R[-1]C-R[-2]C4*R[-2]C -> 0 | AX140: =R[-1]C-R[-2]C4*R[-2]C -> 0 | AY140: =R[-1]C-R[-2]C4*R[-2]C -> 0 | AZ140: =R[-1]C-R[-2]C4*R[-2]C -> 0 | BA140: =R[-1]C-R[-2]C4*R[-2]C -> 0 | BB140: =R[-1]C-R[-2]C4*R[-2]C -> 0 | BC140: =R[-1]C-R[-2]C4*R[-2]C -> 0 | BD140: =R[-1]C-R[-2]C4*R[-2]C -> 0 | BE140: =R[-1]C-R[-2]C4*R[-2]C -> 0 | BF140: =R[-1]C-R[-2]C4*R[-2]C -> 0 | BG140: =R[-1]C-R[-2]C4*R[-2]C -> -9750 | BO140: =SUM(RC[-61]:RC[-8]) -> -11700
A141: Using OS/390 Unix System Services | B141: 2002-06-11T00:00:00.000 | C141: 3 | D141: 1650 | E141: 500 | F141: 0 | G141: 0 | H141: 0 | I141: 0 | J141: 0 | K141: 0 | L141: 0 | M141: 0 | N141: 0 | O141: 0 | P141: 0 | Q141: 0 | R141: 0 | S141: 0 | T141: 0 | U141: 0 | V141: 0 | W141: 0 | X141: 0 | Y141: 0 | Z141: 0 | AA141: 0 | AB141: 0 | AC141: 0 | AD141: 11 | AE141: 0 | AF141: 0 | AG141: 0 | AH141: 0 | AI141: 0 | AJ141: 0 | AK141: 0 | AL141: 0 | AM141: 0 | AN141: 0 | AO141: 0 | AP141: 0 | AQ141: 0 | AR141: 0 | AS141: 0 | AT141: 0 | AU141: 0 | AV141: 0 | AW141: 0 | AX141: 0 | AY141: 0 | AZ141: 0 | BA141: 0 | BB141: 0 | BC141: 0 | BD141: 0 | BE141: 0 | BF141: 0 | BG141: 0 | BK141: =SUM(RC[-57]:RC[-4]) -> 11 | BL141: =RC[-61]*RC[-1] -> 33
D142: Total | F142: =R[-1]C*R141C5 -> 0 | G142: =R[-1]C*R141C5 -> 0 | H142: =R[-1]C*R141C5 -> 0 | I142: =R[-1]C*R141C5 -> 0 | J142: =R[-1]C*R141C5 -> 0 | K142: =R[-1]C*R141C5 -> 0 | L142: =R[-1]C*R141C5 -> 0 | M142: =R[-1]C*R141C5 -> 0 | N142: =R[-1]C*R141C5 -> 0 | O142: =R[-1]C*R141C5 -> 0 | P142: =R[-1]C*R141C5 -> 0 | Q142: =R[-1]C*R141C5 -> 0 | R142: =R[-1]C*R141C5 -> 0 | S142: =R[-1]C*R141C5 -> 0 | T142: =R[-1]C*R141C5 -> 0 | U142: =R[-1]C*R141C5 -> 0 | V142: =R[-1]C*R141C5 -> 0 | W142: =R[-1]C*R141C5 -> 0 | X142: =R[-1]C*R141C5 -> 0 | Y142: =R[-1]C*R141C5 -> 0 | Z142: =R[-1]C*R141C5 -> 0 | AA142: =R[-1]C*R141C5 -> 0 | AB142: =R[-1]C*R141C5 -> 0 | AC142: =R[-1]C*R141C5 -> 0 | AD142: =R[-1]C*R141C5 -> 5500 | AE142: =R[-1]C*R141C5 -> 0 | AF142: =R[-1]C*R141C5 -> 0 | AG142: =R[-1]C*R141C5 -> 0 | AH142: =R[-1]C*R141C5 -> 0 | AI142: =R[-1]C*R141C5 -> 0 | AJ142: =R[-1]C*R141C5 -> 0 | AK142: =R[-1]C*R141C5 -> 0 | AL142: =R[-1]C*R141C5 -> 0 | AM142: =R[-1]C*R141C5 -> 0 | AN142: =R[-1]C*R141C5 -> 0 | AO142: =R[-1]C*R141C5 -> 0 | AP142: =R[-1]C*R141C5 -> 0 | AQ142: =R[-1]C*R141C5 -> 0 | AR142: =R[-1]C*R141C5 -> 0 | AS142: =R[-1]C*R141C5 -> 0 | AT142: =R[-1]C*R141C5 -> 0 | AU142: =R[-1]C*R141C5 -> 0 | AV142: =R[-1]C*R141C5 -> 0 | AW142: =R[-1]C*R141C5 -> 0 | AX142: =R[-1]C*R141C5 -> 0 | AY142: =R[-1]C*R141C5 -> 0 | AZ142: =R[-1]C*R141C5 -> 0 | BA142: =R[-1]C*R141C5 -> 0 | BB142: =R[-1]C*R141C5 -> 0 | BC142: =R[-1]C*R141C5 -> 0 | BD142: =R[-1]C*R141C5 -> 0 | BE142: =R[-1]C*R141C5 -> 0 | BF142: =R[-1]C*R141C5 -> 0 | BG142: =R[-1]C*R141C5 -> 0 | BM142: =R[-1]C[-61]*R[-1]C[-2] -> 18150 | BN142: =RC[-1]-RC[1] -> 12650 | BO142: =SUM(RC[-61]:RC[-8]) -> 5500
D143: Total Savings | F143: =R[-1]C-R[-2]C4*R[-2]C -> 0 | G143: =R[-1]C-R[-2]C4*R[-2]C -> 0 | H143: =R[-1]C-R[-2]C4*R[-2]C -> 0 | I143: =R[-1]C-R[-2]C4*R[-2]C -> 0 | J143: =R[-1]C-R[-2]C4*R[-2]C -> 0 | K143: =R[-1]C-R[-2]C4*R[-2]C -> 0 | L143: =R[-1]C-R[-2]C4*R[-2]C -> 0 | M143: =R[-1]C-R[-2]C4*R[-2]C -> 0 | N143: =R[-1]C-R[-2]C4*R[-2]C -> 0 | O143: =R[-1]C-R[-2]C4*R[-2]C -> 0 | P143: =R[-1]C-R[-2]C4*R[-2]C -> 0 | Q143: =R[-1]C-R[-2]C4*R[-2]C -> 0 | R143: =R[-1]C-R[-2]C4*R[-2]C -> 0 | S143: =R[-1]C-R[-2]C4*R[-2]C -> 0 | T143: =R[-1]C-R[-2]C4*R[-2]C -> 0 | U143: =R[-1]C-R[-2]C4*R[-2]C -> 0 | V143: =R[-1]C-R[-2]C4*R[-2]C -> 0 | W143: =R[-1]C-R[-2]C4*R[-2]C -> 0 | X143: =R[-1]C-R[-2]C4*R[-2]C -> 0 | Y143: =R[-1]C-R[-2]C4*R[-2]C -> 0 | Z143: =R[-1]C-R[-2]C4*R[-2]C -> 0 | AA143: =R[-1]C-R[-2]C4*R[-2]C -> 0 | AB143: =R[-1]C-R[-2]C4*R[-2]C -> 0 | AC143: =R[-1]C-R[-2]C4*R[-2]C -> 0 | AD143: =R[-1]C-R[-2]C4*R[-2]C -> -12650 | AE143: =R[-1]C-R[-2]C4*R[-2]C -> 0 | AF143: =R[-1]C-R[-2]C4*R[-2]C -> 0 | AG143: =R[-1]C-R[-2]C4*R[-2]C -> 0 | AH143: =R[-1]C-R[-2]C4*R[-2]C -> 0 | AI143: =R[-1]C-R[-2]C4*R[-2]C -> 0 | AJ143: =R[-1]C-R[-2]C4*R[-2]C -> 0 | AK143: =R[-1]C-R[-2]C4*R[-2]C -> 0 | AL143: =R[-1]C-R[-2]C4*R[-2]C -> 0 | AM143: =R[-1]C-R[-2]C4*R[-2]C -> 0 | AN143: =R[-1]C-R[-2]C4*R[-2]C -> 0 | AO143: =R[-1]C-R[-2]C4*R[-2]C -> 0 | AP143: =R[-1]C-R[-2]C4*R[-2]C -> 0 | AQ143: =R[-1]C-R[-2]C4*R[-2]C -> 0 | AR143: =R[-1]C-R[-2]C4*R[-2]C -> 0 | AS143: =R[-1]C-R[-2]C4*R[-2]C -> 0 | AT143: =R[-1]C-R[-2]C4*R[-2]C -> 0 | AU143: =R[-1]C-R[-2]C4*R[-2]C -> 0 | AV143: =R[-1]C-R[-2]C4*R[-2]C -> 0 | AW143: =R[-1]C-R[-2]C4*R[-2]C -> 0 | AX143: =R[-1]C-R[-2]C4*R[-2]C -> 0 | AY143: =R[-1]C-R[-2]C4*R[-2]C -> 0 | AZ143: =R[-1]C-R[-2]C4*R[-2]C -> 0 | BA143: =R[-1]C-R[-2]C4*R[-2]C -> 0 | BB143: =R[-1]C-R[-2]C4*R[-2]C -> 0 | BC143: =R[-1]C-R[-2]C4*R[-2]C -> 0 | BD143: =R[-1]C-R[-2]C4*R[-2]C -> 0 | BE143: =R[-1]C-R[-2]C4*R[-2]C -> 0 | BF143: =R[-1]C-R[-2]C4*R[-2]C -> 0 | BG143: =R[-1]C-R[-2]C4*R[-2]C -> 0 | BO143: =SUM(RC[-61]:RC[-8]) -> -12650
A144: Introduction to VISIO 2000 | B144: 2002-06-12T00:00:00.000 | C144: 1 | D144: 375 | E144: 150 | F144: 0 | G144: 0 | H144: 0 | I144: 0 | J144: 14 | K144: 0 | L144: 0 | M144: 0 | N144: 0 | O144: 0 | P144: 0 | Q144: 0 | R144: 0 | S144: 0 | T144: 0 | U144: 0 | V144: 0 | W144: 0 | X144: 0 | Y144: 0 | Z144: 0 | AA144: 0 | AB144: 0 | AC144: 0 | AD144: 0 | AE144: 0 | AF144: 0 | AG144: 0 | AH144: 0 | AI144: 0 | AJ144: 0 | AK144: 0 | AL144: 0 | AM144: 0 | AN144: 0 | AO144: 0 | AP144: 0 | AQ144: 0 | AR144: 0 | AS144: 0 | AT144: 0 | AU144: 0 | AV144: 0 | AW144: 0 | AX144: 0 | AY144: 0 | AZ144: 0 | BA144: 0 | BB144: 0 | BC144: 0 | BD144: 0 | BE144: 0 | BF144: 0 | BG144: 0 | BK144: =SUM(RC[-57]:RC[-4]) -> 14 | BL144: =RC[-61]*RC[-1] -> 14
D145: Total | F145: =R[-1]C*R144C5 -> 0 | G145: =R[-1]C*R144C5 -> 0 | H145: =R[-1]C*R144C5 -> 0 | I145: =R[-1]C*R144C5 -> 0 | J145: =R[-1]C*R144C5 -> 2100 | K145: =R[-1]C*R144C5 -> 0 | L145: =R[-1]C*R144C5 -> 0 | M145: =R[-1]C*R144C5 -> 0 | N145: =R[-1]C*R144C5 -> 0 | O145: =R[-1]C*R144C5 -> 0 | P145: =R[-1]C*R144C5 -> 0 | Q145: =R[-1]C*R144C5 -> 0 | R145: =R[-1]C*R144C5 -> 0 | S145: =R[-1]C*R144C5 -> 0 | T145: =R[-1]C*R144C5 -> 0 | U145: =R[-1]C*R144C5 -> 0 | V145: =R[-1]C*R144C5 -> 0 | W145: =R[-1]C*R144C5 -> 0 | X145: =R[-1]C*R144C5 -> 0 | Y145: =R[-1]C*R144C5 -> 0 | Z145: =R[-1]C*R144C5 -> 0 | AA145: =R[-1]C*R144C5 -> 0 | AB145: =R[-1]C*R144C5 -> 0 | AC145: =R[-1]C*R144C5 -> 0 | AD145: =R[-1]C*R144C5 -> 0 | AE145: =R[-1]C*R144C5 -> 0 | AF145: =R[-1]C*R144C5 -> 0 | AG145: =R[-1]C*R144C5 -> 0 | AH145: =R[-1]C*R144C5 -> 0 | AI145: =R[-1]C*R144C5 -> 0 | AJ145: =R[-1]C*R144C5 -> 0 | AK145: =R[-1]C*R144C5 -> 0 | AL145: =R[-1]C*R144C5 -> 0 | AM145: =R[-1]C*R144C5 -> 0 | AN145: =R[-1]C*R144C5 -> 0 | AO145: =R[-1]C*R144C5 -> 0 | AP145: =R[-1]C*R144C5 -> 0 | AQ145: =R[-1]C*R144C5 -> 0 | AR145: =R[-1]C*R144C5 -> 0 | AS145: =R[-1]C*R144C5 -> 0 | AT145: =R[-1]C*R144C5 -> 0 | AU145: =R[-1]C*R144C5 -> 0 | AV145: =R[-1]C*R144C5 -> 0 | AW145: =R[-1]C*R144C5 -> 0 | AX145: =R[-1]C*R144C5 -> 0 | AY145: =R[-1]C*R144C5 -> 0 | AZ145: =R[-1]C*R144C5 -> 0 | BA145: =R[-1]C*R144C5 -> 0 | BB145: =R[-1]C*R144C5 -> 0 | BC145: =R[-1]C*R144C5 -> 0 | BD145: =R[-1]C*R144C5 -> 0 | BE145: =R[-1]C*R144C5 -> 0 | BF145: =R[-1]C*R144C5 -> 0 | BG145: =R[-1]C*R144C5 -> 0 | BM145: =R[-1]C[-61]*R[-1]C[-2] -> 5250 | BN145: =RC[-1]-RC[1] -> 3150 | BO145: =SUM(RC[-61]:RC[-8]) -> 2100
D146: Total Savings | F146: =R[-1]C-R[-2]C4*R[-2]C -> 0 | G146: =R[-1]C-R[-2]C4*R[-2]C -> 0 | H146: =R[-1]C-R[-2]C4*R[-2]C -> 0 | I146: =R[-1]C-R[-2]C4*R[-2]C -> 0 | J146: =R[-1]C-R[-2]C4*R[-2]C -> -3150 | K146: =R[-1]C-R[-2]C4*R[-2]C -> 0 | L146: =R[-1]C-R[-2]C4*R[-2]C -> 0 | M146: =R[-1]C-R[-2]C4*R[-2]C -> 0 | N146: =R[-1]C-R[-2]C4*R[-2]C -> 0 | O146: =R[-1]C-R[-2]C4*R[-2]C -> 0 | P146: =R[-1]C-R[-2]C4*R[-2]C -> 0 | Q146: =R[-1]C-R[-2]C4*R[-2]C -> 0 | R146: =R[-1]C-R[-2]C4*R[-2]C -> 0 | S146: =R[-1]C-R[-2]C4*R[-2]C -> 0 | T146: =R[-1]C-R[-2]C4*R[-2]C -> 0 | U146: =R[-1]C-R[-2]C4*R[-2]C -> 0 | V146: =R[-1]C-R[-2]C4*R[-2]C -> 0 | W146: =R[-1]C-R[-2]C4*R[-2]C -> 0 | X146: =R[-1]C-R[-2]C4*R[-2]C -> 0 | Y146: =R[-1]C-R[-2]C4*R[-2]C -> 0 | Z146: =R[-1]C-R[-2]C4*R[-2]C -> 0 | AA146: =R[-1]C-R[-2]C4*R[-2]C -> 0 | AB146: =R[-1]C-R[-2]C4*R[-2]C -> 0 | AC146: =R[-1]C-R[-2]C4*R[-2]C -> 0 | AD146: =R[-1]C-R[-2]C4*R[-2]C -> 0 | AE146: =R[-1]C-R[-2]C4*R[-2]C -> 0 | AF146: =R[-1]C-R[-2]C4*R[-2]C -> 0 | AG146: =R[-1]C-R[-2]C4*R[-2]C -> 0 | AH146: =R[-1]C-R[-2]C4*R[-2]C -> 0 | AI146: =R[-1]C-R[-2]C4*R[-2]C -> 0 | AJ146: =R[-1]C-R[-2]C4*R[-2]C -> 0 | AK146: =R[-1]C-R[-2]C4*R[-2]C -> 0 | AL146: =R[-1]C-R[-2]C4*R[-2]C -> 0 | AM146: =R[-1]C-R[-2]C4*R[-2]C -> 0 | AN146: =R[-1]C-R[-2]C4*R[-2]C -> 0 | AO146: =R[-1]C-R[-2]C4*R[-2]C -> 0 | AP146: =R[-1]C-R[-2]C4*R[-2]C -> 0 | AQ146: =R[-1]C-R[-2]C4*R[-2]C -> 0 | AR146: =R[-1]C-R[-2]C4*R[-2]C -> 0 | AS146: =R[-1]C-R[-2]C4*R[-2]C -> 0 | AT146: =R[-1]C-R[-2]C4*R[-2]C -> 0 | AU146: =R[-1]C-R[-2]C4*R[-2]C -> 0 | AV146: =R[-1]C-R[-2]C4*R[-2]C -> 0 | AW146: =R[-1]C-R[-2]C4*R[-2]C -> 0 | AX146: =R[-1]C-R[-2]C4*R[-2]C -> 0 | AY146: =R[-1]C-R[-2]C4*R[-2]C -> 0 | AZ146: =R[-1]C-R[-2]C4*R[-2]C -> 0 | BA146: =R[-1]C-R[-2]C4*R[-2]C -> 0 | BB146: =R[-1]C-R[-2]C4*R[-2]C -> 0 | BC146: =R[-1]C-R[-2]C4*R[-2]C -> 0 | BD146: =R[-1]C-R[-2]C4*R[-2]C -> 0 | BE146: =R[-1]C-R[-2]C4*R[-2]C -> 0 | BF146: =R[-1]C-R[-2]C4*R[-2]C -> 0 | BG146: =R[-1]C-R[-2]C4*R[-2]C -> 0 | BO146: =SUM(RC[-61]:RC[-8]) -> -3150
A147: VB 6.0 Coding | B147: 2002-06-17T00:00:00.000 | C147: 2 | D147: 900 | E147: 350 | F147: 0 | G147: 0 | H147: 0 | I147: 0 | J147: 0 | K147: 3 | L147: 0 | M147: 0 | N147: 0 | O147: 0 | P147: 0 | Q147: 0 | R147: 0 | S147: 0 | T147: 0 | U147: 0 | V147: 0 | W147: 0 | X147: 0 | Y147: 0 | Z147: 0 | AA147: 0 | AB147: 0 | AC147: 0 | AD147: 0 | AE147: 0 | AF147: 0 | AG147: 0 | AH147: 1 | AI147: 0 | AJ147: 0 | AK147: 0 | AL147: 0 | AM147: 0 | AN147: 0 | AO147: 0 | AP147: 0 | AQ147: 0 | AR147: 0 | AS147: 0 | AT147: 0 | AU147: 0 | AV147: 0 | AW147: 0 | AX147: 0 | AY147: 0 | AZ147: 0 | BA147: 0 | BB147: 0 | BC147: 0 | BD147: 1 | BE147: 0 | BF147: 0 | BG147: 0 | BK147: =SUM(RC[-57]:RC[-4]) -> 5 | BL147: =RC[-61]*RC[-1] -> 10
D148: Total | F148: =R[-1]C*R147C5 -> 0 | G148: =R[-1]C*R147C5 -> 0 | H148: =R[-1]C*R147C5 -> 0 | I148: =R[-1]C*R147C5 -> 0 | J148: =R[-1]C*R147C5 -> 0 | K148: =R[-1]C*R147C5 -> 1050 | L148: =R[-1]C*R147C5 -> 0 | M148: =R[-1]C*R147C5 -> 0 | N148: =R[-1]C*R147C5 -> 0 | O148: =R[-1]C*R147C5 -> 0 | P148: =R[-1]C*R147C5 -> 0 | Q148: =R[-1]C*R147C5 -> 0 | R148: =R[-1]C*R147C5 -> 0 | S148: =R[-1]C*R147C5 -> 0 | T148: =R[-1]C*R147C5 -> 0 | U148: =R[-1]C*R147C5 -> 0 | V148: =R[-1]C*R147C5 -> 0 | W148: =R[-1]C*R147C5 -> 0 | X148: =R[-1]C*R147C5 -> 0 | Y148: =R[-1]C*R147C5 -> 0 | Z148: =R[-1]C*R147C5 -> 0 | AA148: =R[-1]C*R147C5 -> 0 | AB148: =R[-1]C*R147C5 -> 0 | AC148: =R[-1]C*R147C5 -> 0 | AD148: =R[-1]C*R147C5 -> 0 | AE148: =R[-1]C*R147C5 -> 0 | AF148: =R[-1]C*R147C5 -> 0 | AG148: =R[-1]C*R147C5 -> 0 | AH148: =R[-1]C*R147C5 -> 350 | AI148: =R[-1]C*R147C5 -> 0 | AJ148: =R[-1]C*R147C5 -> 0 | AK148: =R[-1]C*R147C5 -> 0 | AL148: =R[-1]C*R147C5 -> 0 | AM148: =R[-1]C*R147C5 -> 0 | AN148: =R[-1]C*R147C5 -> 0 | AO148: =R[-1]C*R147C5 -> 0 | AP148: =R[-1]C*R147C5 -> 0 | AQ148: =R[-1]C*R147C5 -> 0 | AR148: =R[-1]C*R147C5 -> 0 | AS148: =R[-1]C*R147C5 -> 0 | AT148: =R[-1]C*R147C5 -> 0 | AU148: =R[-1]C*R147C5 -> 0 | AV148: =R[-1]C*R147C5 -> 0 | AW148: =R[-1]C*R147C5 -> 0 | AX148: =R[-1]C*R147C5 -> 0 | AY148: =R[-1]C*R147C5 -> 0 | AZ148: =R[-1]C*R147C5 -> 0 | BA148: =R[-1]C*R147C5 -> 0 | BB148: =R[-1]C*R147C5 -> 0 | BC148: =R[-1]C*R147C5 -> 0 | BD148: =R[-1]C*R147C5 -> 350 | BE148: =R[-1]C*R147C5 -> 0 | BF148: =R[-1]C*R147C5 -> 0 | BG148: =R[-1]C*R147C5 -> 0 | BM148: =R[-1]C[-61]*R[-1]C[-2] -> 4500 | BN148: =RC[-1]-RC[1] -> 2750 | BO148: =SUM(RC[-61]:RC[-8]) -> 1750
D149: Total Savings | F149: =R[-1]C-R[-2]C4*R[-2]C -> 0 | G149: =R[-1]C-R[-2]C4*R[-2]C -> 0 | H149: =R[-1]C-R[-2]C4*R[-2]C -> 0 | I149: =R[-1]C-R[-2]C4*R[-2]C -> 0 | J149: =R[-1]C-R[-2]C4*R[-2]C -> 0 | K149: =R[-1]C-R[-2]C4*R[-2]C -> -1650 | L149: =R[-1]C-R[-2]C4*R[-2]C -> 0 | M149: =R[-1]C-R[-2]C4*R[-2]C -> 0 | N149: =R[-1]C-R[-2]C4*R[-2]C -> 0 | O149: =R[-1]C-R[-2]C4*R[-2]C -> 0 | P149: =R[-1]C-R[-2]C4*R[-2]C -> 0 | Q149: =R[-1]C-R[-2]C4*R[-2]C -> 0 | R149: =R[-1]C-R[-2]C4*R[-2]C -> 0 | S149: =R[-1]C-R[-2]C4*R[-2]C -> 0 | T149: =R[-1]C-R[-2]C4*R[-2]C -> 0 | U149: =R[-1]C-R[-2]C4*R[-2]C -> 0 | V149: =R[-1]C-R[-2]C4*R[-2]C -> 0 | W149: =R[-1]C-R[-2]C4*R[-2]C -> 0 | X149: =R[-1]C-R[-2]C4*R[-2]C -> 0 | Y149: =R[-1]C-R[-2]C4*R[-2]C -> 0 | Z149: =R[-1]C-R[-2]C4*R[-2]C -> 0 | AA149: =R[-1]C-R[-2]C4*R[-2]C -> 0 | AB149: =R[-1]C-R[-2]C4*R[-2]C -> 0 | AC149: =R[-1]C-R[-2]C4*R[-2]C -> 0 | AD149: =R[-1]C-R[-2]C4*R[-2]C -> 0 | AE149: =R[-1]C-R[-2]C4*R[-2]C -> 0 | AF149: =R[-1]C-R[-2]C4*R[-2]C -> 0 | AG149: =R[-1]C-R[-2]C4*R[-2]C -> 0 | AH149: =R[-1]C-R[-2]C4*R[-2]C -> -550 | AI149: =R[-1]C-R[-2]C4*R[-2]C -> 0 | AJ149: =R[-1]C-R[-2]C4*R[-2]C -> 0 | AK149: =R[-1]C-R[-2]C4*R[-2]C -> 0 | AL149: =R[-1]C-R[-2]C4*R[-2]C -> 0 | AM149: =R[-1]C-R[-2]C4*R[-2]C -> 0 | AN149: =R[-1]C-R[-2]C4*R[-2]C -> 0 | AO149: =R[-1]C-R[-2]C4*R[-2]C -> 0 | AP149: =R[-1]C-R[-2]C4*R[-2]C -> 0 | AQ149: =R[-1]C-R[-2]C4*R[-2]C -> 0 | AR149: =R[-1]C-R[-2]C4*R[-2]C -> 0 | AS149: =R[-1]C-R[-2]C4*R[-2]C -> 0 | AT149: =R[-1]C-R[-2]C4*R[-2]C -> 0 | AU149: =R[-1]C-R[-2]C4*R[-2]C -> 0 | AV149: =R[-1]C-R[-2]C4*R[-2]C -> 0 | AW149: =R[-1]C-R[-2]C4*R[-2]C -> 0 | AX149: =R[-1]C-R[-2]C4*R[-2]C -> 0 | AY149: =R[-1]C-R[-2]C4*R[-2]C -> 0 | AZ149: =R[-1]C-R[-2]C4*R[-2]C -> 0 | BA149: =R[-1]C-R[-2]C4*R[-2]C -> 0 | BB149: =R[-1]C-R[-2]C4*R[-2]C -> 0 | BC149: =R[-1]C-R[-2]C4*R[-2]C -> 0 | BD149: =R[-1]C-R[-2]C4*R[-2]C -> -550 | BE149: =R[-1]C-R[-2]C4*R[-2]C -> 0 | BF149: =R[-1]C-R[-2]C4*R[-2]C -> 0 | BG149: =R[-1]C-R[-2]C4*R[-2]C -> 0 | BO149: =SUM(RC[-61]:RC[-8]) -> -2750
A150: Introduction to Easytrieve Plus | B150: 2002-06-18T00:00:00.000 | C150: 3 | D150: 1295 | E150: 450 | F150: 0 | G150: 0 | H150: 0 | I150: 0 | J150: 0 | K150: 5 | L150: 0 | M150: 1 | N150: 0 | O150: 0 | P150: 0 | Q150: 0 | R150: 0 | S150: 0 | T150: 0 | U150: 0 | V150: 0 | W150: 0 | X150: 0 | Y150: 0 | Z150: 0 | AA150: 0 | AB150: 0 | AC150: 0 | AD150: 0 | AE150: 0 | AF150: 1 | AG150: 0 | AH150: 0 | AI150: 0 | AJ150: 0 | AK150: 0 | AL150: 0 | AM150: 0 | AN150: 0 | AO150: 0 | AP150: 0 | AQ150: 0 | AR150: 0 | AS150: 0 | AT150: 1 | AU150: 0 | AV150: 0 | AW150: 0 | AX150: 0 | AY150: 0 | AZ150: 0 | BA150: 0 | BB150: 0 | BC150: 0 | BD150: 0 | BE150: 0 | BF150: 0 | BG150: 0 | BK150: =SUM(RC[-57]:RC[-4]) -> 8 | BL150: =RC[-61]*RC[-1] -> 24
D151: Total | F151: =R[-1]C*R150C5 -> 0 | G151: =R[-1]C*R150C5 -> 0 | H151: =R[-1]C*R150C5 -> 0 | I151: =R[-1]C*R150C5 -> 0 | J151: =R[-1]C*R150C5 -> 0 | K151: =R[-1]C*R150C5 -> 2250 | L151: =R[-1]C*R150C5 -> 0 | M151: =R[-1]C*R150C5 -> 450 | N151: =R[-1]C*R150C5 -> 0 | O151: =R[-1]C*R150C5 -> 0 | P151: =R[-1]C*R150C5 -> 0 | Q151: =R[-1]C*R150C5 -> 0 | R151: =R[-1]C*R150C5 -> 0 | S151: =R[-1]C*R150C5 -> 0 | T151: =R[-1]C*R150C5 -> 0 | U151: =R[-1]C*R150C5 -> 0 | V151: =R[-1]C*R150C5 -> 0 | W151: =R[-1]C*R150C5 -> 0 | X151: =R[-1]C*R150C5 -> 0 | Y151: =R[-1]C*R150C5 -> 0 | Z151: =R[-1]C*R150C5 -> 0 | AA151: =R[-1]C*R150C5 -> 0 | AB151: =R[-1]C*R150C5 -> 0 | AC151: =R[-1]C*R150C5 -> 0 | AD151: =R[-1]C*R150C5 -> 0 | AE151: =R[-1]C*R150C5 -> 0 | AF151: =R[-1]C*R150C5 -> 450 | AG151: =R[-1]C*R150C5 -> 0 | AH151: =R[-1]C*R150C5 -> 0 | AI151: =R[-1]C*R150C5 -> 0 | AJ151: =R[-1]C*R150C5 -> 0 | AK151: =R[-1]C*R150C5 -> 0 | AL151: =R[-1]C*R150C5 -> 0 | AM151: =R[-1]C*R150C5 -> 0 | AN151: =R[-1]C*R150C5 -> 0 | AO151: =R[-1]C*R150C5 -> 0 | AP151: =R[-1]C*R150C5 -> 0 | AQ151: =R[-1]C*R150C5 -> 0 | AR151: =R[-1]C*R150C5 -> 0 | AS151: =R[-1]C*R150C5 -> 0 | AT151: =R[-1]C*R150C5 -> 450 | AU151: =R[-1]C*R150C5 -> 0 | AV151: =R[-1]C*R150C5 -> 0 | AW151: =R[-1]C*R150C5 -> 0 | AX151: =R[-1]C*R150C5 -> 0 | AY151: =R[-1]C*R150C5 -> 0 | AZ151: =R[-1]C*R150C5 -> 0 | BA151: =R[-1]C*R150C5 -> 0 | BB151: =R[-1]C*R150C5 -> 0 | BC151: =R[-1]C*R150C5 -> 0 | BD151: =R[-1]C*R150C5 -> 0 | BE151: =R[-1]C*R150C5 -> 0 | BF151: =R[-1]C*R150C5 -> 0 | BG151: =R[-1]C*R150C5 -> 0 | BM151: =R[-1]C[-61]*R[-1]C[-2] -> 10360 | BN151: =RC[-1]-RC[1] -> 6760 | BO151: =SUM(RC[-61]:RC[-8]) -> 3600
D152: Total Savings | F152: =R[-1]C-R[-2]C4*R[-2]C -> 0 | G152: =R[-1]C-R[-2]C4*R[-2]C -> 0 | H152: =R[-1]C-R[-2]C4*R[-2]C -> 0 | I152: =R[-1]C-R[-2]C4*R[-2]C -> 0 | J152: =R[-1]C-R[-2]C4*R[-2]C -> 0 | K152: =R[-1]C-R[-2]C4*R[-2]C -> -4225 | L152: =R[-1]C-R[-2]C4*R[-2]C -> 0 | M152: =R[-1]C-R[-2]C4*R[-2]C -> -845 | N152: =R[-1]C-R[-2]C4*R[-2]C -> 0 | O152: =R[-1]C-R[-2]C4*R[-2]C -> 0 | P152: =R[-1]C-R[-2]C4*R[-2]C -> 0 | Q152: =R[-1]C-R[-2]C4*R[-2]C -> 0 | R152: =R[-1]C-R[-2]C4*R[-2]C -> 0 | S152: =R[-1]C-R[-2]C4*R[-2]C -> 0 | T152: =R[-1]C-R[-2]C4*R[-2]C -> 0 | U152: =R[-1]C-R[-2]C4*R[-2]C -> 0 | V152: =R[-1]C-R[-2]C4*R[-2]C -> 0 | W152: =R[-1]C-R[-2]C4*R[-2]C -> 0 | X152: =R[-1]C-R[-2]C4*R[-2]C -> 0 | Y152: =R[-1]C-R[-2]C4*R[-2]C -> 0 | Z152: =R[-1]C-R[-2]C4*R[-2]C -> 0 | AA152: =R[-1]C-R[-2]C4*R[-2]C -> 0 | AB152: =R[-1]C-R[-2]C4*R[-2]C -> 0 | AC152: =R[-1]C-R[-2]C4*R[-2]C -> 0 | AD152: =R[-1]C-R[-2]C4*R[-2]C -> 0 | AE152: =R[-1]C-R[-2]C4*R[-2]C -> 0 | AF152: =R[-1]C-R[-2]C4*R[-2]C -> -845 | AG152: =R[-1]C-R[-2]C4*R[-2]C -> 0 | AH152: =R[-1]C-R[-2]C4*R[-2]C -> 0 | AI152: =R[-1]C-R[-2]C4*R[-2]C -> 0 | AJ152: =R[-1]C-R[-2]C4*R[-2]C -> 0 | AK152: =R[-1]C-R[-2]C4*R[-2]C -> 0 | AL152: =R[-1]C-R[-2]C4*R[-2]C -> 0 | AM152: =R[-1]C-R[-2]C4*R[-2]C -> 0 | AN152: =R[-1]C-R[-2]C4*R[-2]C -> 0 | AO152: =R[-1]C-R[-2]C4*R[-2]C -> 0 | AP152: =R[-1]C-R[-2]C4*R[-2]C -> 0 | AQ152: =R[-1]C-R[-2]C4*R[-2]C -> 0 | AR152: =R[-1]C-R[-2]C4*R[-2]C -> 0 | AS152: =R[-1]C-R[-2]C4*R[-2]C -> 0 | AT152: =R[-1]C-R[-2]C4*R[-2]C -> -845 | AU152: =R[-1]C-R[-2]C4*R[-2]C -> 0 | AV152: =R[-1]C-R[-2]C4*R[-2]C -> 0 | AW152: =R[-1]C-R[-2]C4*R[-2]C -> 0 | AX152: =R[-1]C-R[-2]C4*R[-2]C -> 0 | AY152: =R[-1]C-R[-2]C4*R[-2]C -> 0 | AZ152: =R[-1]C-R[-2]C4*R[-2]C -> 0 | BA152: =R[-1]C-R[-2]C4*R[-2]C -> 0 | BB152: =R[-1]C-R[-2]C4*R[-2]C -> 0 | BC152: =R[-1]C-R[-2]C4*R[-2]C -> 0 | BD152: =R[-1]C-R[-2]C4*R[-2]C -> 0 | BE152: =R[-1]C-R[-2]C4*R[-2]C -> 0 | BF152: =R[-1]C-R[-2]C4*R[-2]C -> 0 | BG152: =R[-1]C-R[-2]C4*R[-2]C -> 0 | BO152: =SUM(RC[-61]:RC[-8]) -> -6760
A153: Survival Skills for Analysts | B153: 2002-07-08T00:00:00.000 | C153: 2 | D153: 1175 | E153: 525 | F153: 0 | G153: 0 | H153: 0 | I153: 0 | J153: 0 | K153: 0 | L153: 0 | M153: 0 | N153: 0 | O153: 0 | P153: 0 | Q153: 0 | R153: 0 | S153: 0 | T153: 0 | U153: 0 | V153: 0 | W153: 0 | X153: 0 | Y153: 3 | Z153: 0 | AA153: 1 | AB153: 0 | AC153: 0 | AD153: 0 | AE153: 0 | AF153: 0 | AG153: 0 | AH153: 0 | AI153: 0 | AJ153: 0 | AK153: 0 | AL153: 0 | AM153: 0 | AN153: 0 | AO153: 0 | AP153: 0 | AQ153: 0 | AR153: 0 | AS153: 0 | AT153: 0 | AU153: 0 | AV153: 0 | AW153: 0 | AX153: 0 | AY153: 0 | AZ153: 0 | BA153: 0 | BB153: 0 | BC153: 0 | BD153: 0 | BE153: 0 | BF153: 0 | BG153: 16 | BK153: =SUM(RC[-57]:RC[-4]) -> 20 | BL153: =RC[-61]*RC[-1] -> 40
D154: Total | F154: =R[-1]C*R153C5 -> 0 | G154: =R[-1]C*R153C5 -> 0 | H154: =R[-1]C*R153C5 -> 0 | I154: =R[-1]C*R153C5 -> 0 | J154: =R[-1]C*R153C5 -> 0 | K154: =R[-1]C*R153C5 -> 0 | L154: =R[-1]C*R153C5 -> 0 | M154: =R[-1]C*R153C5 -> 0 | N154: =R[-1]C*R153C5 -> 0 | O154: =R[-1]C*R153C5 -> 0 | P154: =R[-1]C*R153C5 -> 0 | Q154: =R[-1]C*R153C5 -> 0 | R154: =R[-1]C*R153C5 -> 0 | S154: =R[-1]C*R153C5 -> 0 | T154: =R[-1]C*R153C5 -> 0 | U154: =R[-1]C*R153C5 -> 0 | V154: =R[-1]C*R153C5 -> 0 | W154: =R[-1]C*R153C5 -> 0 | X154: =R[-1]C*R153C5 -> 0 | Y154: =R[-1]C*R153C5 -> 1575 | Z154: =R[-1]C*R153C5 -> 0 | AA154: =R[-1]C*R153C5 -> 525 | AB154: =R[-1]C*R153C5 -> 0 | AC154: =R[-1]C*R153C5 -> 0 | AD154: =R[-1]C*R153C5 -> 0 | AE154: =R[-1]C*R153C5 -> 0 | AF154: =R[-1]C*R153C5 -> 0 | AG154: =R[-1]C*R153C5 -> 0 | AH154: =R[-1]C*R153C5 -> 0 | AI154: =R[-1]C*R153C5 -> 0 | AJ154: =R[-1]C*R153C5 -> 0 | AK154: =R[-1]C*R153C5 -> 0 | AL154: =R[-1]C*R153C5 -> 0 | AM154: =R[-1]C*R153C5 -> 0 | AN154: =R[-1]C*R153C5 -> 0 | AO154: =R[-1]C*R153C5 -> 0 | AP154: =R[-1]C*R153C5 -> 0 | AQ154: =R[-1]C*R153C5 -> 0 | AR154: =R[-1]C*R153C5 -> 0 | AS154: =R[-1]C*R153C5 -> 0 | AT154: =R[-1]C*R153C5 -> 0 | AU154: =R[-1]C*R153C5 -> 0 | AV154: =R[-1]C*R153C5 -> 0 | AW154: =R[-1]C*R153C5 -> 0 | AX154: =R[-1]C*R153C5 -> 0 | AY154: =R[-1]C*R153C5 -> 0 | AZ154: =R[-1]C*R153C5 -> 0 | BA154: =R[-1]C*R153C5 -> 0 | BB154: =R[-1]C*R153C5 -> 0 | BC154: =R[-1]C*R153C5 -> 0 | BD154: =R[-1]C*R153C5 -> 0 | BE154: =R[-1]C*R153C5 -> 0 | BF154: =R[-1]C*R153C5 -> 0 | BG154: =R[-1]C*R153C5 -> 8400 | BM154: =R[-1]C[-61]*R[-1]C[-2] -> 23500 | BN154: =RC[-1]-RC[1] -> 13000 | BO154: =SUM(RC[-61]:RC[-8]) -> 10500
D155: Total Savings | F155: =R[-1]C-R[-2]C4*R[-2]C -> 0 | G155: =R[-1]C-R[-2]C4*R[-2]C -> 0 | H155: =R[-1]C-R[-2]C4*R[-2]C -> 0 | I155: =R[-1]C-R[-2]C4*R[-2]C -> 0 | J155: =R[-1]C-R[-2]C4*R[-2]C -> 0 | K155: =R[-1]C-R[-2]C4*R[-2]C -> 0 | L155: =R[-1]C-R[-2]C4*R[-2]C -> 0 | M155: =R[-1]C-R[-2]C4*R[-2]C -> 0 | N155: =R[-1]C-R[-2]C4*R[-2]C -> 0 | O155: =R[-1]C-R[-2]C4*R[-2]C -> 0 | P155: =R[-1]C-R[-2]C4*R[-2]C -> 0 | Q155: =R[-1]C-R[-2]C4*R[-2]C -> 0 | R155: =R[-1]C-R[-2]C4*R[-2]C -> 0 | S155: =R[-1]C-R[-2]C4*R[-2]C -> 0 | T155: =R[-1]C-R[-2]C4*R[-2]C -> 0 | U155: =R[-1]C-R[-2]C4*R[-2]C -> 0 | V155: =R[-1]C-R[-2]C4*R[-2]C -> 0 | W155: =R[-1]C-R[-2]C4*R[-2]C -> 0 | X155: =R[-1]C-R[-2]C4*R[-2]C -> 0 | Y155: =R[-1]C-R[-2]C4*R[-2]C -> -1950 | Z155: =R[-1]C-R[-2]C4*R[-2]C -> 0 | AA155: =R[-1]C-R[-2]C4*R[-2]C -> -650 | AB155: =R[-1]C-R[-2]C4*R[-2]C -> 0 | AC155: =R[-1]C-R[-2]C4*R[-2]C -> 0 | AD155: =R[-1]C-R[-2]C4*R[-2]C -> 0 | AE155: =R[-1]C-R[-2]C4*R[-2]C -> 0 | AF155: =R[-1]C-R[-2]C4*R[-2]C -> 0 | AG155: =R[-1]C-R[-2]C4*R[-2]C -> 0 | AH155: =R[-1]C-R[-2]C4*R[-2]C -> 0 | AI155: =R[-1]C-R[-2]C4*R[-2]C -> 0 | AJ155: =R[-1]C-R[-2]C4*R[-2]C -> 0 | AK155: =R[-1]C-R[-2]C4*R[-2]C -> 0 | AL155: =R[-1]C-R[-2]C4*R[-2]C -> 0 | AM155: =R[-1]C-R[-2]C4*R[-2]C -> 0 | AN155: =R[-1]C-R[-2]C4*R[-2]C -> 0 | AO155: =R[-1]C-R[-2]C4*R[-2]C -> 0 | AP155: =R[-1]C-R[-2]C4*R[-2]C -> 0 | AQ155: =R[-1]C-R[-2]C4*R[-2]C -> 0 | AR155: =R[-1]C-R[-2]C4*R[-2]C -> 0 | AS155: =R[-1]C-R[-2]C4*R[-2]C -> 0 | AT155: =R[-1]C-R[-2]C4*R[-2]C -> 0 | AU155: =R[-1]C-R[-2]C4*R[-2]C -> 0 | AV155: =R[-1]C-R[-2]C4*R[-2]C -> 0 | AW155: =R[-1]C-R[-2]C4*R[-2]C -> 0 | AX155: =R[-1]C-R[-2]C4*R[-2]C -> 0 | AY155: =R[-1]C-R[-2]C4*R[-2]C -> 0 | AZ155: =R[-1]C-R[-2]C4*R[-2]C -> 0 | BA155: =R[-1]C-R[-2]C4*R[-2]C -> 0 | BB155: =R[-1]C-R[-2]C4*R[-2]C -> 0 | BC155: =R[-1]C-R[-2]C4*R[-2]C -> 0 | BD155: =R[-1]C-R[-2]C4*R[-2]C -> 0 | BE155: =R[-1]C-R[-2]C4*R[-2]C -> 0 | BF155: =R[-1]C-R[-2]C4*R[-2]C -> 0 | BG155: =R[-1]C-R[-2]C4*R[-2]C -> -10400 | BO155: =SUM(RC[-61]:RC[-8]) -> -13000
A156: MS Project 2000 | B156: 2002-07-15T00:00:00.000 | C156: 3 | D156: 1200 | E156: 184 | F156: 0 | G156: 0 | H156: 0 | I156: 0 | J156: 9 | K156: 0 | L156: 0 | M156: 0 | N156: 0 | O156: 0 | P156: 0 | Q156: 0 | R156: 1 | S156: 0 | T156: 0 | U156: 0 | V156: 0 | W156: 0 | X156: 0 | Y156: 0 | Z156: 0 | AA156: 0 | AB156: 0 | AC156: 0 | AD156: 0 | AE156: 0 | AF156: 1 | AG156: 0 | AH156: 0 | AI156: 0 | AJ156: 0 | AK156: 0 | AL156: 0 | AM156: 0 | AN156: 0 | AO156: 0 | AP156: 0 | AQ156: 0 | AR156: 0 | AS156: 0 | AT156: 0 | AU156: 0 | AV156: 0 | AW156: 0 | AX156: 0 | AY156: 0 | AZ156: 0 | BA156: 0 | BB156: 0 | BC156: 0 | BD156: 0 | BE156: 0 | BF156: 0 | BG156: 0 | BK156: =SUM(RC[-57]:RC[-4]) -> 11 | BL156: =RC[-61]*RC[-1] -> 33
D157: Total | F157: =R[-1]C*R156C5 -> 0 | G157: =R[-1]C*R156C5 -> 0 | H157: =R[-1]C*R156C5 -> 0 | I157: =R[-1]C*R156C5 -> 0 | J157: =R[-1]C*R156C5 -> 1656 | K157: =R[-1]C*R156C5 -> 0 | L157: =R[-1]C*R156C5 -> 0 | M157: =R[-1]C*R156C5 -> 0 | N157: =R[-1]C*R156C5 -> 0 | O157: =R[-1]C*R156C5 -> 0 | P157: =R[-1]C*R156C5 -> 0 | Q157: =R[-1]C*R156C5 -> 0 | R157: =R[-1]C*R156C5 -> 184 | S157: =R[-1]C*R156C5 -> 0 | T157: =R[-1]C*R156C5 -> 0 | U157: =R[-1]C*R156C5 -> 0 | V157: =R[-1]C*R156C5 -> 0 | W157: =R[-1]C*R156C5 -> 0 | X157: =R[-1]C*R156C5 -> 0 | Y157: =R[-1]C*R156C5 -> 0 | Z157: =R[-1]C*R156C5 -> 0 | AA157: =R[-1]C*R156C5 -> 0 | AB157: =R[-1]C*R156C5 -> 0 | AC157: =R[-1]C*R156C5 -> 0 | AD157: =R[-1]C*R156C5 -> 0 | AE157: =R[-1]C*R156C5 -> 0 | AF157: =R[-1]C*R156C5 -> 184 | AG157: =R[-1]C*R156C5 -> 0 | AH157: =R[-1]C*R156C5 -> 0 | AI157: =R[-1]C*R156C5 -> 0 | AJ157: =R[-1]C*R156C5 -> 0 | AK157: =R[-1]C*R156C5 -> 0 | AL157: =R[-1]C*R156C5 -> 0 | AM157: =R[-1]C*R156C5 -> 0 | AN157: =R[-1]C*R156C5 -> 0 | AO157: =R[-1]C*R156C5 -> 0 | AP157: =R[-1]C*R156C5 -> 0 | AQ157: =R[-1]C*R156C5 -> 0 | AR157: =R[-1]C*R156C5 -> 0 | AS157: =R[-1]C*R156C5 -> 0 | AT157: =R[-1]C*R156C5 -> 0 | AU157: =R[-1]C*R156C5 -> 0 | AV157: =R[-1]C*R156C5 -> 0 | AW157: =R[-1]C*R156C5 -> 0 | AX157: =R[-1]C*R156C5 -> 0 | AY157: =R[-1]C*R156C5 -> 0 | AZ157: =R[-1]C*R156C5 -> 0 | BA157: =R[-1]C*R156C5 -> 0 | BB157: =R[-1]C*R156C5 -> 0 | BC157: =R[-1]C*R156C5 -> 0 | BD157: =R[-1]C*R156C5 -> 0 | BE157: =R[-1]C*R156C5 -> 0 | BF157: =R[-1]C*R156C5 -> 0 | BG157: =R[-1]C*R156C5 -> 0 | BM157: =R[-1]C[-61]*R[-1]C[-2] -> 13200 | BN157: =RC[-1]-RC[1] -> 11176 | BO157: =SUM(RC[-61]:RC[-8]) -> 2024
D158: Total Savings | F158: =R[-1]C-R[-2]C4*R[-2]C -> 0 | G158: =R[-1]C-R[-2]C4*R[-2]C -> 0 | H158: =R[-1]C-R[-2]C4*R[-2]C -> 0 | I158: =R[-1]C-R[-2]C4*R[-2]C -> 0 | J158: =R[-1]C-R[-2]C4*R[-2]C -> -9144 | K158: =R[-1]C-R[-2]C4*R[-2]C -> 0 | L158: =R[-1]C-R[-2]C4*R[-2]C -> 0 | M158: =R[-1]C-R[-2]C4*R[-2]C -> 0 | N158: =R[-1]C-R[-2]C4*R[-2]C -> 0 | O158: =R[-1]C-R[-2]C4*R[-2]C -> 0 | P158: =R[-1]C-R[-2]C4*R[-2]C -> 0 | Q158: =R[-1]C-R[-2]C4*R[-2]C -> 0 | R158: =R[-1]C-R[-2]C4*R[-2]C -> -1016 | S158: =R[-1]C-R[-2]C4*R[-2]C -> 0 | T158: =R[-1]C-R[-2]C4*R[-2]C -> 0 | U158: =R[-1]C-R[-2]C4*R[-2]C -> 0 | V158: =R[-1]C-R[-2]C4*R[-2]C -> 0 | W158: =R[-1]C-R[-2]C4*R[-2]C -> 0 | X158: =R[-1]C-R[-2]C4*R[-2]C -> 0 | Y158: =R[-1]C-R[-2]C4*R[-2]C -> 0 | Z158: =R[-1]C-R[-2]C4*R[-2]C -> 0 | AA158: =R[-1]C-R[-2]C4*R[-2]C -> 0 | AB158: =R[-1]C-R[-2]C4*R[-2]C -> 0 | AC158: =R[-1]C-R[-2]C4*R[-2]C -> 0 | AD158: =R[-1]C-R[-2]C4*R[-2]C -> 0 | AE158: =R[-1]C-R[-2]C4*R[-2]C -> 0 | AF158: =R[-1]C-R[-2]C4*R[-2]C -> -1016 | AG158: =R[-1]C-R[-2]C4*R[-2]C -> 0 | AH158: =R[-1]C-R[-2]C4*R[-2]C -> 0 | AI158: =R[-1]C-R[-2]C4*R[-2]C -> 0 | AJ158: =R[-1]C-R[-2]C4*R[-2]C -> 0 | AK158: =R[-1]C-R[-2]C4*R[-2]C -> 0 | AL158: =R[-1]C-R[-2]C4*R[-2]C -> 0 | AM158: =R[-1]C-R[-2]C4*R[-2]C -> 0 | AN158: =R[-1]C-R[-2]C4*R[-2]C -> 0 | AO158: =R[-1]C-R[-2]C4*R[-2]C -> 0 | AP158: =R[-1]C-R[-2]C4*R[-2]C -> 0 | AQ158: =R[-1]C-R[-2]C4*R[-2]C -> 0 | AR158: =R[-1]C-R[-2]C4*R[-2]C -> 0 | AS158: =R[-1]C-R[-2]C4*R[-2]C -> 0 | AT158: =R[-1]C-R[-2]C4*R[-2]C -> 0 | AU158: =R[-1]C-R[-2]C4*R[-2]C -> 0 | AV158: =R[-1]C-R[-2]C4*R[-2]C -> 0 | AW158: =R[-1]C-R[-2]C4*R[-2]C -> 0 | AX158: =R[-1]C-R[-2]C4*R[-2]C -> 0 | AY158: =R[-1]C-R[-2]C4*R[-2]C -> 0 | AZ158: =R[-1]C-R[-2]C4*R[-2]C -> 0 | BA158: =R[-1]C-R[-2]C4*R[-2]C -> 0 | BB158: =R[-1]C-R[-2]C4*R[-2]C -> 0 | BC158: =R[-1]C-R[-2]C4*R[-2]C -> 0 | BD158: =R[-1]C-R[-2]C4*R[-2]C -> 0 | BE158: =R[-1]C-R[-2]C4*R[-2]C -> 0 | BF158: =R[-1]C-R[-2]C4*R[-2]C -> 0 | BG158: =R[-1]C-R[-2]C4*R[-2]C -> 0 | BO158: =SUM(RC[-61]:RC[-8]) -> -11176
A159: Analysis Simulation | B159: 2002-07-15T00:00:00.000 | C159: 2 | D159: 1175 | E159: 525 | F159: 0 | G159: 0 | H159: 0 | I159: 0 | J159: 0 | K159: 0 | L159: 0 | M159: 0 | N159: 0 | O159: 0 | P159: 0 | Q159: 0 | R159: 0 | S159: 0 | T159: 0 | U159: 0 | V159: 0 | W159: 3 | X159: 0 | Y159: 0 | Z159: 0 | AA159: 0 | AB159: 0 | AC159: 0 | AD159: 0 | AE159: 0 | AF159: 0 | AG159: 0 | AH159: 0 | AI159: 0 | AJ159: 0 | AK159: 0 | AL159: 0 | AM159: 0 | AN159: 0 | AO159: 0 | AP159: 0 | AQ159: 0 | AR159: 0 | AS159: 0 | AT159: 0 | AU159: 0 | AV159: 0 | AW159: 0 | AX159: 0 | AY159: 0 | AZ159: 0 | BA159: 0 | BB159: 0 | BC159: 0 | BD159: 0 | BE159: 0 | BF159: 0 | BG159: 14 | BK159: =SUM(RC[-57]:RC[-4]) -> 17 | BL159: =RC[-61]*RC[-1] -> 34
D160: Total | F160: =R[-1]C*R159C5 -> 0 | G160: =R[-1]C*R159C5 -> 0 | H160: =R[-1]C*R159C5 -> 0 | I160: =R[-1]C*R159C5 -> 0 | J160: =R[-1]C*R159C5 -> 0 | K160: =R[-1]C*R159C5 -> 0 | L160: =R[-1]C*R159C5 -> 0 | M160: =R[-1]C*R159C5 -> 0 | N160: =R[-1]C*R159C5 -> 0 | O160: =R[-1]C*R159C5 -> 0 | P160: =R[-1]C*R159C5 -> 0 | Q160: =R[-1]C*R159C5 -> 0 | R160: =R[-1]C*R159C5 -> 0 | S160: =R[-1]C*R159C5 -> 0 | T160: =R[-1]C*R159C5 -> 0 | U160: =R[-1]C*R159C5 -> 0 | V160: =R[-1]C*R159C5 -> 0 | W160: =R[-1]C*R159C5 -> 1575 | X160: =R[-1]C*R159C5 -> 0 | Y160: =R[-1]C*R159C5 -> 0 | Z160: =R[-1]C*R159C5 -> 0 | AA160: =R[-1]C*R159C5 -> 0 | AB160: =R[-1]C*R159C5 -> 0 | AC160: =R[-1]C*R159C5 -> 0 | AD160: =R[-1]C*R159C5 -> 0 | AE160: =R[-1]C*R159C5 -> 0 | AF160: =R[-1]C*R159C5 -> 0 | AG160: =R[-1]C*R159C5 -> 0 | AH160: =R[-1]C*R159C5 -> 0 | AI160: =R[-1]C*R159C5 -> 0 | AJ160: =R[-1]C*R159C5 -> 0 | AK160: =R[-1]C*R159C5 -> 0 | AL160: =R[-1]C*R159C5 -> 0 | AM160: =R[-1]C*R159C5 -> 0 | AN160: =R[-1]C*R159C5 -> 0 | AO160: =R[-1]C*R159C5 -> 0 | AP160: =R[-1]C*R159C5 -> 0 | AQ160: =R[-1]C*R159C5 -> 0 | AR160: =R[-1]C*R159C5 -> 0 | AS160: =R[-1]C*R159C5 -> 0 | AT160: =R[-1]C*R159C5 -> 0 | AU160: =R[-1]C*R159C5 -> 0 | AV160: =R[-1]C*R159C5 -> 0 | AW160: =R[-1]C*R159C5 -> 0 | AX160: =R[-1]C*R159C5 -> 0 | AY160: =R[-1]C*R159C5 -> 0 | AZ160: =R[-1]C*R159C5 -> 0 | BA160: =R[-1]C*R159C5 -> 0 | BB160: =R[-1]C*R159C5 -> 0 | BC160: =R[-1]C*R159C5 -> 0 | BD160: =R[-1]C*R159C5 -> 0 | BE160: =R[-1]C*R159C5 -> 0 | BF160: =R[-1]C*R159C5 -> 0 | BG160: =R[-1]C*R159C5 -> 7350 | BM160: =R[-1]C[-61]*R[-1]C[-2] -> 19975 | BN160: =RC[-1]-RC[1] -> 11050 | BO160: =SUM(RC[-61]:RC[-8]) -> 8925
D161: Total Savings | F161: =R[-1]C-R[-2]C4*R[-2]C -> 0 | G161: =R[-1]C-R[-2]C4*R[-2]C -> 0 | H161: =R[-1]C-R[-2]C4*R[-2]C -> 0 | I161: =R[-1]C-R[-2]C4*R[-2]C -> 0 | J161: =R[-1]C-R[-2]C4*R[-2]C -> 0 | K161: =R[-1]C-R[-2]C4*R[-2]C -> 0 | L161: =R[-1]C-R[-2]C4*R[-2]C -> 0 | M161: =R[-1]C-R[-2]C4*R[-2]C -> 0 | N161: =R[-1]C-R[-2]C4*R[-2]C -> 0 | O161: =R[-1]C-R[-2]C4*R[-2]C -> 0 | P161: =R[-1]C-R[-2]C4*R[-2]C -> 0 | Q161: =R[-1]C-R[-2]C4*R[-2]C -> 0 | R161: =R[-1]C-R[-2]C4*R[-2]C -> 0 | S161: =R[-1]C-R[-2]C4*R[-2]C -> 0 | T161: =R[-1]C-R[-2]C4*R[-2]C -> 0 | U161: =R[-1]C-R[-2]C4*R[-2]C -> 0 | V161: =R[-1]C-R[-2]C4*R[-2]C -> 0 | W161: =R[-1]C-R[-2]C4*R[-2]C -> -1950 | X161: =R[-1]C-R[-2]C4*R[-2]C -> 0 | Y161: =R[-1]C-R[-2]C4*R[-2]C -> 0 | Z161: =R[-1]C-R[-2]C4*R[-2]C -> 0 | AA161: =R[-1]C-R[-2]C4*R[-2]C -> 0 | AB161: =R[-1]C-R[-2]C4*R[-2]C -> 0 | AC161: =R[-1]C-R[-2]C4*R[-2]C -> 0 | AD161: =R[-1]C-R[-2]C4*R[-2]C -> 0 | AE161: =R[-1]C-R[-2]C4*R[-2]C -> 0 | AF161: =R[-1]C-R[-2]C4*R[-2]C -> 0 | AG161: =R[-1]C-R[-2]C4*R[-2]C -> 0 | AH161: =R[-1]C-R[-2]C4*R[-2]C -> 0 | AI161: =R[-1]C-R[-2]C4*R[-2]C -> 0 | AJ161: =R[-1]C-R[-2]C4*R[-2]C -> 0 | AK161: =R[-1]C-R[-2]C4*R[-2]C -> 0 | AL161: =R[-1]C-R[-2]C4*R[-2]C -> 0 | AM161: =R[-1]C-R[-2]C4*R[-2]C -> 0 | AN161: =R[-1]C-R[-2]C4*R[-2]C -> 0 | AO161: =R[-1]C-R[-2]C4*R[-2]C -> 0 | AP161: =R[-1]C-R[-2]C4*R[-2]C -> 0 | AQ161: =R[-1]C-R[-2]C4*R[-2]C -> 0 | AR161: =R[-1]C-R[-2]C4*R[-2]C -> 0 | AS161: =R[-1]C-R[-2]C4*R[-2]C -> 0 | AT161: =R[-1]C-R[-2]C4*R[-2]C -> 0 | AU161: =R[-1]C-R[-2]C4*R[-2]C -> 0 | AV161: =R[-1]C-R[-2]C4*R[-2]C -> 0 | AW161: =R[-1]C-R[-2]C4*R[-2]C -> 0 | AX161: =R[-1]C-R[-2]C4*R[-2]C -> 0 | AY161: =R[-1]C-R[-2]C4*R[-2]C -> 0 | AZ161: =R[-1]C-R[-2]C4*R[-2]C -> 0 | BA161: =R[-1]C-R[-2]C4*R[-2]C -> 0 | BB161: =R[-1]C-R[-2]C4*R[-2]C -> 0 | BC161: =R[-1]C-R[-2]C4*R[-2]C -> 0 | BD161: =R[-1]C-R[-2]C4*R[-2]C -> 0 | BE161: =R[-1]C-R[-2]C4*R[-2]C -> 0 | BF161: =R[-1]C-R[-2]C4*R[-2]C -> 0 | BG161: =R[-1]C-R[-2]C4*R[-2]C -> -9100 | BO161: =SUM(RC[-61]:RC[-8]) -> -11050
A162: Introduction to JAVA Programming | B162: 2002-07-22T00:00:00.000 | C162: 5 | D162: 2595 | E162: 1000 | F162: 1 | G162: 0 | H162: 0 | I162: 0 | J162: 0 | K162: 0 | L162: 0 | M162: 2 | N162: 0 | O162: 0 | P162: 0 | Q162: 0 | R162: 0 | S162: 0 | T162: 0 | U162: 0 | V162: 0 | W162: 0 | X162: 0 | Y162: 0 | Z162: 0 | AA162: 0 | AB162: 0 | AC162: 0 | AD162: 0 | AE162: 0 | AF162: 2 | AG162: 0 | AH162: 0 | AI162: 0 | AJ162: 0 | AK162: 0 | AL162: 0 | AM162: 0 | AN162: 0 | AO162: 0 | AP162: 0 | AQ162: 0 | AR162: 0 | AS162: 0 | AT162: 0 | AU162: 0 | AV162: 0 | AW162: 0 | AX162: 0 | AY162: 0 | AZ162: 0 | BA162: 0 | BB162: 0 | BC162: 0 | BD162: 0 | BE162: 0 | BF162: 0 | BG162: 0 | BK162: =SUM(RC[-57]:RC[-4]) -> 5 | BL162: =RC[-61]*RC[-1] -> 25
D163: Total | F163: =R[-1]C*R162C5 -> 1000 | G163: =R[-1]C*R162C5 -> 0 | H163: =R[-1]C*R162C5 -> 0 | I163: =R[-1]C*R162C5 -> 0 | J163: =R[-1]C*R162C5 -> 0 | K163: =R[-1]C*R162C5 -> 0 | L163: =R[-1]C*R162C5 -> 0 | M163: =R[-1]C*R162C5 -> 2000 | N163: =R[-1]C*R162C5 -> 0 | O163: =R[-1]C*R162C5 -> 0 | P163: =R[-1]C*R162C5 -> 0 | Q163: =R[-1]C*R162C5 -> 0 | R163: =R[-1]C*R162C5 -> 0 | S163: =R[-1]C*R162C5 -> 0 | T163: =R[-1]C*R162C5 -> 0 | U163: =R[-1]C*R162C5 -> 0 | V163: =R[-1]C*R162C5 -> 0 | W163: =R[-1]C*R162C5 -> 0 | X163: =R[-1]C*R162C5 -> 0 | Y163: =R[-1]C*R162C5 -> 0 | Z163: =R[-1]C*R162C5 -> 0 | AA163: =R[-1]C*R162C5 -> 0 | AB163: =R[-1]C*R162C5 -> 0 | AC163: =R[-1]C*R162C5 -> 0 | AD163: =R[-1]C*R162C5 -> 0 | AE163: =R[-1]C*R162C5 -> 0 | AF163: =R[-1]C*R162C5 -> 2000 | AG163: =R[-1]C*R162C5 -> 0 | AH163: =R[-1]C*R162C5 -> 0 | AI163: =R[-1]C*R162C5 -> 0 | AJ163: =R[-1]C*R162C5 -> 0 | AK163: =R[-1]C*R162C5 -> 0 | AL163: =R[-1]C*R162C5 -> 0 | AM163: =R[-1]C*R162C5 -> 0 | AN163: =R[-1]C*R162C5 -> 0 | AO163: =R[-1]C*R162C5 -> 0 | AP163: =R[-1]C*R162C5 -> 0 | AQ163: =R[-1]C*R162C5 -> 0 | AR163: =R[-1]C*R162C5 -> 0 | AS163: =R[-1]C*R162C5 -> 0 | AT163: =R[-1]C*R162C5 -> 0 | AU163: =R[-1]C*R162C5 -> 0 | AV163: =R[-1]C*R162C5 -> 0 | AW163: =R[-1]C*R162C5 -> 0 | AX163: =R[-1]C*R162C5 -> 0 | AY163: =R[-1]C*R162C5 -> 0 | AZ163: =R[-1]C*R162C5 -> 0 | BA163: =R[-1]C*R162C5 -> 0 | BB163: =R[-1]C*R162C5 -> 0 | BC163: =R[-1]C*R162C5 -> 0 | BD163: =R[-1]C*R162C5 -> 0 | BE163: =R[-1]C*R162C5 -> 0 | BF163: =R[-1]C*R162C5 -> 0 | BG163: =R[-1]C*R162C5 -> 0 | BM163: =R[-1]C[-61]*R[-1]C[-2] -> 12975 | BN163: =RC[-1]-RC[1] -> 7975 | BO163: =SUM(RC[-61]:RC[-8]) -> 5000
D164: Total Savings | F164: =R[-1]C-R[-2]C4*R[-2]C -> -1595 | G164: =R[-1]C-R[-2]C4*R[-2]C -> 0 | H164: =R[-1]C-R[-2]C4*R[-2]C -> 0 | I164: =R[-1]C-R[-2]C4*R[-2]C -> 0 | J164: =R[-1]C-R[-2]C4*R[-2]C -> 0 | K164: =R[-1]C-R[-2]C4*R[-2]C -> 0 | L164: =R[-1]C-R[-2]C4*R[-2]C -> 0 | M164: =R[-1]C-R[-2]C4*R[-2]C -> -3190 | N164: =R[-1]C-R[-2]C4*R[-2]C -> 0 | O164: =R[-1]C-R[-2]C4*R[-2]C -> 0 | P164: =R[-1]C-R[-2]C4*R[-2]C -> 0 | Q164: =R[-1]C-R[-2]C4*R[-2]C -> 0 | R164: =R[-1]C-R[-2]C4*R[-2]C -> 0 | S164: =R[-1]C-R[-2]C4*R[-2]C -> 0 | T164: =R[-1]C-R[-2]C4*R[-2]C -> 0 | U164: =R[-1]C-R[-2]C4*R[-2]C -> 0 | V164: =R[-1]C-R[-2]C4*R[-2]C -> 0 | W164: =R[-1]C-R[-2]C4*R[-2]C -> 0 | X164: =R[-1]C-R[-2]C4*R[-2]C -> 0 | Y164: =R[-1]C-R[-2]C4*R[-2]C -> 0 | Z164: =R[-1]C-R[-2]C4*R[-2]C -> 0 | AA164: =R[-1]C-R[-2]C4*R[-2]C -> 0 | AB164: =R[-1]C-R[-2]C4*R[-2]C -> 0 | AC164: =R[-1]C-R[-2]C4*R[-2]C -> 0 | AD164: =R[-1]C-R[-2]C4*R[-2]C -> 0 | AE164: =R[-1]C-R[-2]C4*R[-2]C -> 0 | AF164: =R[-1]C-R[-2]C4*R[-2]C -> -3190 | AG164: =R[-1]C-R[-2]C4*R[-2]C -> 0 | AH164: =R[-1]C-R[-2]C4*R[-2]C -> 0 | AI164: =R[-1]C-R[-2]C4*R[-2]C -> 0 | AJ164: =R[-1]C-R[-2]C4*R[-2]C -> 0 | AK164: =R[-1]C-R[-2]C4*R[-2]C -> 0 | AL164: =R[-1]C-R[-2]C4*R[-2]C -> 0 | AM164: =R[-1]C-R[-2]C4*R[-2]C -> 0 | AN164: =R[-1]C-R[-2]C4*R[-2]C -> 0 | AO164: =R[-1]C-R[-2]C4*R[-2]C -> 0 | AP164: =R[-1]C-R[-2]C4*R[-2]C -> 0 | AQ164: =R[-1]C-R[-2]C4*R[-2]C -> 0 | AR164: =R[-1]C-R[-2]C4*R[-2]C -> 0 | AS164: =R[-1]C-R[-2]C4*R[-2]C -> 0 | AT164: =R[-1]C-R[-2]C4*R[-2]C -> 0 | AU164: =R[-1]C-R[-2]C4*R[-2]C -> 0 | AV164: =R[-1]C-R[-2]C4*R[-2]C -> 0 | AW164: =R[-1]C-R[-2]C4*R[-2]C -> 0 | AX164: =R[-1]C-R[-2]C4*R[-2]C -> 0 | AY164: =R[-1]C-R[-2]C4*R[-2]C -> 0 | AZ164: =R[-1]C-R[-2]C4*R[-2]C -> 0 | BA164: =R[-1]C-R[-2]C4*R[-2]C -> 0 | BB164: =R[-1]C-R[-2]C4*R[-2]C -> 0 | BC164: =R[-1]C-R[-2]C4*R[-2]C -> 0 | BD164: =R[-1]C-R[-2]C4*R[-2]C -> 0 | BE164: =R[-1]C-R[-2]C4*R[-2]C -> 0 | BF164: =R[-1]C-R[-2]C4*R[-2]C -> 0 | BG164: =R[-1]C-R[-2]C4*R[-2]C -> 0 | BO164: =SUM(RC[-61]:RC[-8]) -> -7975
A165: Mastering the Requirements Process | B165: 2002-08-05T00:00:00.000 | C165: 2 | D165: 1175 | E165: 525 | F165: 0 | G165: 0 | H165: 0 | I165: 0 | J165: 0 | K165: 0 | L165: 0 | M165: 0 | N165: 0 | O165: 0 | P165: 0 | Q165: 0 | R165: 0 | S165: 0 | T165: 0 | U165: 0 | V165: 0 | W165: 0 | X165: 0 | Y165: 4 | Z165: 0 | AA165: 0 | AB165: 0 | AC165: 0 | AD165: 0 | AE165: 0 | AF165: 0 | AG165: 0 | AH165: 0 | AI165: 0 | AJ165: 0 | AK165: 0 | AL165: 0 | AM165: 0 | AN165: 0 | AO165: 0 | AP165: 0 | AQ165: 0 | AR165: 0 | AS165: 0 | AT165: 0 | AU165: 0 | AV165: 0 | AW165: 0 | AX165: 0 | AY165: 0 | AZ165: 0 | BA165: 0 | BB165: 0 | BC165: 0 | BD165: 0 | BE165: 0 | BF165: 0 | BG165: 12 | BK165: =SUM(RC[-57]:RC[-4]) -> 16 | BL165: =RC[-61]*RC[-1] -> 32
D166: Total | F166: =R[-1]C*R165C5 -> 0 | G166: =R[-1]C*R165C5 -> 0 | H166: =R[-1]C*R165C5 -> 0 | I166: =R[-1]C*R165C5 -> 0 | J166: =R[-1]C*R165C5 -> 0 | K166: =R[-1]C*R165C5 -> 0 | L166: =R[-1]C*R165C5 -> 0 | M166: =R[-1]C*R165C5 -> 0 | N166: =R[-1]C*R165C5 -> 0 | O166: =R[-1]C*R165C5 -> 0 | P166: =R[-1]C*R165C5 -> 0 | Q166: =R[-1]C*R165C5 -> 0 | R166: =R[-1]C*R165C5 -> 0 | S166: =R[-1]C*R165C5 -> 0 | T166: =R[-1]C*R165C5 -> 0 | U166: =R[-1]C*R165C5 -> 0 | V166: =R[-1]C*R165C5 -> 0 | W166: =R[-1]C*R165C5 -> 0 | X166: =R[-1]C*R165C5 -> 0 | Y166: =R[-1]C*R165C5 -> 2100 | Z166: =R[-1]C*R165C5 -> 0 | AA166: =R[-1]C*R165C5 -> 0 | AB166: =R[-1]C*R165C5 -> 0 | AC166: =R[-1]C*R165C5 -> 0 | AD166: =R[-1]C*R165C5 -> 0 | AE166: =R[-1]C*R165C5 -> 0 | AF166: =R[-1]C*R165C5 -> 0 | AG166: =R[-1]C*R165C5 -> 0 | AH166: =R[-1]C*R165C5 -> 0 | AI166: =R[-1]C*R165C5 -> 0 | AJ166: =R[-1]C*R165C5 -> 0 | AK166: =R[-1]C*R165C5 -> 0 | AL166: =R[-1]C*R165C5 -> 0 | AM166: =R[-1]C*R165C5 -> 0 | AN166: =R[-1]C*R165C5 -> 0 | AO166: =R[-1]C*R165C5 -> 0 | AP166: =R[-1]C*R165C5 -> 0 | AQ166: =R[-1]C*R165C5 -> 0 | AR166: =R[-1]C*R165C5 -> 0 | AS166: =R[-1]C*R165C5 -> 0 | AT166: =R[-1]C*R165C5 -> 0 | AU166: =R[-1]C*R165C5 -> 0 | AV166: =R[-1]C*R165C5 -> 0 | AW166: =R[-1]C*R165C5 -> 0 | AX166: =R[-1]C*R165C5 -> 0 | AY166: =R[-1]C*R165C5 -> 0 | AZ166: =R[-1]C*R165C5 -> 0 | BA166: =R[-1]C*R165C5 -> 0 | BB166: =R[-1]C*R165C5 -> 0 | BC166: =R[-1]C*R165C5 -> 0 | BD166: =R[-1]C*R165C5 -> 0 | BE166: =R[-1]C*R165C5 -> 0 | BF166: =R[-1]C*R165C5 -> 0 | BG166: =R[-1]C*R165C5 -> 6300 | BM166: =R[-1]C[-61]*R[-1]C[-2] -> 18800 | BN166: =RC[-1]-RC[1] -> 10400 | BO166: =SUM(RC[-61]:RC[-8]) -> 8400
D167: Total Savings | F167: =R[-1]C-R[-2]C4*R[-2]C -> 0 | G167: =R[-1]C-R[-2]C4*R[-2]C -> 0 | H167: =R[-1]C-R[-2]C4*R[-2]C -> 0 | I167: =R[-1]C-R[-2]C4*R[-2]C -> 0 | J167: =R[-1]C-R[-2]C4*R[-2]C -> 0 | K167: =R[-1]C-R[-2]C4*R[-2]C -> 0 | L167: =R[-1]C-R[-2]C4*R[-2]C -> 0 | M167: =R[-1]C-R[-2]C4*R[-2]C -> 0 | N167: =R[-1]C-R[-2]C4*R[-2]C -> 0 | O167: =R[-1]C-R[-2]C4*R[-2]C -> 0 | P167: =R[-1]C-R[-2]C4*R[-2]C -> 0 | Q167: =R[-1]C-R[-2]C4*R[-2]C -> 0 | R167: =R[-1]C-R[-2]C4*R[-2]C -> 0 | S167: =R[-1]C-R[-2]C4*R[-2]C -> 0 | T167: =R[-1]C-R[-2]C4*R[-2]C -> 0 | U167: =R[-1]C-R[-2]C4*R[-2]C -> 0 | V167: =R[-1]C-R[-2]C4*R[-2]C -> 0 | W167: =R[-1]C-R[-2]C4*R[-2]C -> 0 | X167: =R[-1]C-R[-2]C4*R[-2]C -> 0 | Y167: =R[-1]C-R[-2]C4*R[-2]C -> -2600 | Z167: =R[-1]C-R[-2]C4*R[-2]C -> 0 | AA167: =R[-1]C-R[-2]C4*R[-2]C -> 0 | AB167: =R[-1]C-R[-2]C4*R[-2]C -> 0 | AC167: =R[-1]C-R[-2]C4*R[-2]C -> 0 | AD167: =R[-1]C-R[-2]C4*R[-2]C -> 0 | AE167: =R[-1]C-R[-2]C4*R[-2]C -> 0 | AF167: =R[-1]C-R[-2]C4*R[-2]C -> 0 | AG167: =R[-1]C-R[-2]C4*R[-2]C -> 0 | AH167: =R[-1]C-R[-2]C4*R[-2]C -> 0 | AI167: =R[-1]C-R[-2]C4*R[-2]C -> 0 | AJ167: =R[-1]C-R[-2]C4*R[-2]C -> 0 | AK167: =R[-1]C-R[-2]C4*R[-2]C -> 0 | AL167: =R[-1]C-R[-2]C4*R[-2]C -> 0 | AM167: =R[-1]C-R[-2]C4*R[-2]C -> 0 | AN167: =R[-1]C-R[-2]C4*R[-2]C -> 0 | AO167: =R[-1]C-R[-2]C4*R[-2]C -> 0 | AP167: =R[-1]C-R[-2]C4*R[-2]C -> 0 | AQ167: =R[-1]C-R[-2]C4*R[-2]C -> 0 | AR167: =R[-1]C-R[-2]C4*R[-2]C -> 0 | AS167: =R[-1]C-R[-2]C4*R[-2]C -> 0 | AT167: =R[-1]C-R[-2]C4*R[-2]C -> 0 | AU167: =R[-1]C-R[-2]C4*R[-2]C -> 0 | AV167: =R[-1]C-R[-2]C4*R[-2]C -> 0 | AW167: =R[-1]C-R[-2]C4*R[-2]C -> 0 | AX167: =R[-1]C-R[-2]C4*R[-2]C -> 0 | AY167: =R[-1]C-R[-2]C4*R[-2]C -> 0 | AZ167: =R[-1]C-R[-2]C4*R[-2]C -> 0 | BA167: =R[-1]C-R[-2]C4*R[-2]C -> 0 | BB167: =R[-1]C-R[-2]C4*R[-2]C -> 0 | BC167: =R[-1]C-R[-2]C4*R[-2]C -> 0 | BD167: =R[-1]C-R[-2]C4*R[-2]C -> 0 | BE167: =R[-1]C-R[-2]C4*R[-2]C -> 0 | BF167: =R[-1]C-R[-2]C4*R[-2]C -> 0 | BG167: =R[-1]C-R[-2]C4*R[-2]C -> -7800 | BO167: =SUM(RC[-61]:RC[-8]) -> -10400
A168: Introduction to SQL | B168: 2002-08-06T00:00:00.000 | C168: 2 | D168: 1100 | E168: 450 | F168: 0 | G168: 0 | H168: 0 | I168: 0 | J168: 0 | K168: 2 | L168: 0 | M168: 0 | N168: 0 | O168: 0 | P168: 0 | Q168: 0 | R168: 0 | S168: 0 | T168: 0 | U168: 0 | V168: 0 | W168: 3 | X168: 1 | Y168: 0 | Z168: 0 | AA168: 0 | AB168: 0 | AC168: 0 | AD168: 0 | AE168: 0 | AF168: 0 | AG168: 0 | AH168: 0 | AI168: 0 | AJ168: 0 | AK168: 0 | AL168: 0 | AM168: 0 | AN168: 0 | AO168: 0 | AP168: 0 | AQ168: 0 | AR168: 0 | AS168: 0 | AT168: 0 | AU168: 0 | AV168: 0 | AW168: 0 | AX168: 0 | AY168: 0 | AZ168: 0 | BA168: 1 | BB168: 0 | BC168: 0 | BD168: 0 | BE168: 0 | BF168: 0 | BG168: 0 | BK168: =SUM(RC[-57]:RC[-4]) -> 7 | BL168: =RC[-61]*RC[-1] -> 14
D169: Total | F169: =R[-1]C*R168C5 -> 0 | G169: =R[-1]C*R168C5 -> 0 | H169: =R[-1]C*R168C5 -> 0 | I169: =R[-1]C*R168C5 -> 0 | J169: =R[-1]C*R168C5 -> 0 | K169: =R[-1]C*R168C5 -> 900 | L169: =R[-1]C*R168C5 -> 0 | M169: =R[-1]C*R168C5 -> 0 | N169: =R[-1]C*R168C5 -> 0 | O169: =R[-1]C*R168C5 -> 0 | P169: =R[-1]C*R168C5 -> 0 | Q169: =R[-1]C*R168C5 -> 0 | R169: =R[-1]C*R168C5 -> 0 | S169: =R[-1]C*R168C5 -> 0 | T169: =R[-1]C*R168C5 -> 0 | U169: =R[-1]C*R168C5 -> 0 | V169: =R[-1]C*R168C5 -> 0 | W169: =R[-1]C*R168C5 -> 1350 | X169: =R[-1]C*R168C5 -> 450 | Y169: =R[-1]C*R168C5 -> 0 | Z169: =R[-1]C*R168C5 -> 0 | AA169: =R[-1]C*R168C5 -> 0 | AB169: =R[-1]C*R168C5 -> 0 | AC169: =R[-1]C*R168C5 -> 0 | AD169: =R[-1]C*R168C5 -> 0 | AE169: =R[-1]C*R168C5 -> 0 | AF169: =R[-1]C*R168C5 -> 0 | AG169: =R[-1]C*R168C5 -> 0 | AH169: =R[-1]C*R168C5 -> 0 | AI169: =R[-1]C*R168C5 -> 0 | AJ169: =R[-1]C*R168C5 -> 0 | AK169: =R[-1]C*R168C5 -> 0 | AL169: =R[-1]C*R168C5 -> 0 | AM169: =R[-1]C*R168C5 -> 0 | AN169: =R[-1]C*R168C5 -> 0 | AO169: =R[-1]C*R168C5 -> 0 | AP169: =R[-1]C*R168C5 -> 0 | AQ169: =R[-1]C*R168C5 -> 0 | AR169: =R[-1]C*R168C5 -> 0 | AS169: =R[-1]C*R168C5 -> 0 | AT169: =R[-1]C*R168C5 -> 0 | AU169: =R[-1]C*R168C5 -> 0 | AV169: =R[-1]C*R168C5 -> 0 | AW169: =R[-1]C*R168C5 -> 0 | AX169: =R[-1]C*R168C5 -> 0 | AY169: =R[-1]C*R168C5 -> 0 | AZ169: =R[-1]C*R168C5 -> 0 | BA169: =R[-1]C*R168C5 -> 450 | BB169: =R[-1]C*R168C5 -> 0 | BC169: =R[-1]C*R168C5 -> 0 | BD169: =R[-1]C*R168C5 -> 0 | BE169: =R[-1]C*R168C5 -> 0 | BF169: =R[-1]C*R168C5 -> 0 | BG169: =R[-1]C*R168C5 -> 0 | BM169: =R[-1]C[-61]*R[-1]C[-2] -> 7700 | BN169: =RC[-1]-RC[1] -> 4550 | BO169: =SUM(RC[-61]:RC[-8]) -> 3150
D170: Total Savings | F170: =R[-1]C-R[-2]C4*R[-2]C -> 0 | G170: =R[-1]C-R[-2]C4*R[-2]C -> 0 | H170: =R[-1]C-R[-2]C4*R[-2]C -> 0 | I170: =R[-1]C-R[-2]C4*R[-2]C -> 0 | J170: =R[-1]C-R[-2]C4*R[-2]C -> 0 | K170: =R[-1]C-R[-2]C4*R[-2]C -> -1300 | L170: =R[-1]C-R[-2]C4*R[-2]C -> 0 | M170: =R[-1]C-R[-2]C4*R[-2]C -> 0 | N170: =R[-1]C-R[-2]C4*R[-2]C -> 0 | O170: =R[-1]C-R[-2]C4*R[-2]C -> 0 | P170: =R[-1]C-R[-2]C4*R[-2]C -> 0 | Q170: =R[-1]C-R[-2]C4*R[-2]C -> 0 | R170: =R[-1]C-R[-2]C4*R[-2]C -> 0 | S170: =R[-1]C-R[-2]C4*R[-2]C -> 0 | T170: =R[-1]C-R[-2]C4*R[-2]C -> 0 | U170: =R[-1]C-R[-2]C4*R[-2]C -> 0 | V170: =R[-1]C-R[-2]C4*R[-2]C -> 0 | W170: =R[-1]C-R[-2]C4*R[-2]C -> -1950 | X170: =R[-1]C-R[-2]C4*R[-2]C -> -650 | Y170: =R[-1]C-R[-2]C4*R[-2]C -> 0 | Z170: =R[-1]C-R[-2]C4*R[-2]C -> 0 | AA170: =R[-1]C-R[-2]C4*R[-2]C -> 0 | AB170: =R[-1]C-R[-2]C4*R[-2]C -> 0 | AC170: =R[-1]C-R[-2]C4*R[-2]C -> 0 | AD170: =R[-1]C-R[-2]C4*R[-2]C -> 0 | AE170: =R[-1]C-R[-2]C4*R[-2]C -> 0 | AF170: =R[-1]C-R[-2]C4*R[-2]C -> 0 | AG170: =R[-1]C-R[-2]C4*R[-2]C -> 0 | AH170: =R[-1]C-R[-2]C4*R[-2]C -> 0 | AI170: =R[-1]C-R[-2]C4*R[-2]C -> 0 | AJ170: =R[-1]C-R[-2]C4*R[-2]C -> 0 | AK170: =R[-1]C-R[-2]C4*R[-2]C -> 0 | AL170: =R[-1]C-R[-2]C4*R[-2]C -> 0 | AM170: =R[-1]C-R[-2]C4*R[-2]C -> 0 | AN170: =R[-1]C-R[-2]C4*R[-2]C -> 0 | AO170: =R[-1]C-R[-2]C4*R[-2]C -> 0 | AP170: =R[-1]C-R[-2]C4*R[-2]C -> 0 | AQ170: =R[-1]C-R[-2]C4*R[-2]C -> 0 | AR170: =R[-1]C-R[-2]C4*R[-2]C -> 0 | AS170: =R[-1]C-R[-2]C4*R[-2]C -> 0 | AT170: =R[-1]C-R[-2]C4*R[-2]C -> 0 | AU170: =R[-1]C-R[-2]C4*R[-2]C -> 0 | AV170: =R[-1]C-R[-2]C4*R[-2]C -> 0 | AW170: =R[-1]C-R[-2]C4*R[-2]C -> 0 | AX170: =R[-1]C-R[-2]C4*R[-2]C -> 0 | AY170: =R[-1]C-R[-2]C4*R[-2]C -> 0 | AZ170: =R[-1]C-R[-2]C4*R[-2]C -> 0 | BA170: =R[-1]C-R[-2]C4*R[-2]C -> -650 | BB170: =R[-1]C-R[-2]C4*R[-2]C -> 0 | BC170: =R[-1]C-R[-2]C4*R[-2]C -> 0 | BD170: =R[-1]C-R[-2]C4*R[-2]C -> 0 | BE170: =R[-1]C-R[-2]C4*R[-2]C -> 0 | BF170: =R[-1]C-R[-2]C4*R[-2]C -> 0 | BG170: =R[-1]C-R[-2]C4*R[-2]C -> 0 | BO170: =SUM(RC[-61]:RC[-8]) -> -4550
A171: Fast Start in Business Systems Analysis | B171: 2002-08-12T00:00:00.000 | C171: 3 | D171: 1800 | E171: 550 | F171: 0 | G171: 0 | H171: 0 | I171: 0 | J171: 1 | K171: 2 | L171: 0 | M171: 0 | N171: 0 | O171: 0 | P171: 1 | Q171: 1 | R171: 0 | S171: 0 | T171: 0 | U171: 0 | V171: 0 | W171: 0 | X171: 0 | Y171: 0 | Z171: 0 | AA171: 0 | AB171: 0 | AC171: 0 | AD171: 0 | AE171: 0 | AF171: 0 | AG171: 1 | AH171: 0 | AI171: 0 | AJ171: 0 | AK171: 0 | AL171: 0 | AM171: 0 | AN171: 0 | AO171: 0 | AP171: 0 | AQ171: 0 | AR171: 0 | AS171: 0 | AT171: 0 | AU171: 0 | AV171: 0 | AW171: 0 | AX171: 0 | AY171: 0 | AZ171: 0 | BA171: 0 | BB171: 0 | BC171: 0 | BD171: 0 | BE171: 0 | BF171: 0 | BG171: 12 | BK171: =SUM(RC[-57]:RC[-4]) -> 18 | BL171: =RC[-61]*RC[-1] -> 54
D172: Total | F172: =R[-1]C*R171C5 -> 0 | G172: =R[-1]C*R171C5 -> 0 | H172: =R[-1]C*R171C5 -> 0 | I172: =R[-1]C*R171C5 -> 0 | J172: =R[-1]C*R171C5 -> 550 | K172: =R[-1]C*R171C5 -> 1100 | L172: =R[-1]C*R171C5 -> 0 | M172: =R[-1]C*R171C5 -> 0 | N172: =R[-1]C*R171C5 -> 0 | O172: =R[-1]C*R171C5 -> 0 | P172: =R[-1]C*R171C5 -> 550 | Q172: =R[-1]C*R171C5 -> 550 | R172: =R[-1]C*R171C5 -> 0 | S172: =R[-1]C*R171C5 -> 0 | T172: =R[-1]C*R171C5 -> 0 | U172: =R[-1]C*R171C5 -> 0 | V172: =R[-1]C*R171C5 -> 0 | W172: =R[-1]C*R171C5 -> 0 | X172: =R[-1]C*R171C5 -> 0 | Y172: =R[-1]C*R171C5 -> 0 | Z172: =R[-1]C*R171C5 -> 0 | AA172: =R[-1]C*R171C5 -> 0 | AB172: =R[-1]C*R171C5 -> 0 | AC172: =R[-1]C*R171C5 -> 0 | AD172: =R[-1]C*R171C5 -> 0 | AE172: =R[-1]C*R171C5 -> 0 | AF172: =R[-1]C*R171C5 -> 0 | AG172: =R[-1]C*R171C5 -> 550 | AH172: =R[-1]C*R171C5 -> 0 | AI172: =R[-1]C*R171C5 -> 0 | AJ172: =R[-1]C*R171C5 -> 0 | AK172: =R[-1]C*R171C5 -> 0 | AL172: =R[-1]C*R171C5 -> 0 | AM172: =R[-1]C*R171C5 -> 0 | AN172: =R[-1]C*R171C5 -> 0 | AO172: =R[-1]C*R171C5 -> 0 | AP172: =R[-1]C*R171C5 -> 0 | AQ172: =R[-1]C*R171C5 -> 0 | AR172: =R[-1]C*R171C5 -> 0 | AS172: =R[-1]C*R171C5 -> 0 | AT172: =R[-1]C*R171C5 -> 0 | AU172: =R[-1]C*R171C5 -> 0 | AV172: =R[-1]C*R171C5 -> 0 | AW172: =R[-1]C*R171C5 -> 0 | AX172: =R[-1]C*R171C5 -> 0 | AY172: =R[-1]C*R171C5 -> 0 | AZ172: =R[-1]C*R171C5 -> 0 | BA172: =R[-1]C*R171C5 -> 0 | BB172: =R[-1]C*R171C5 -> 0 | BC172: =R[-1]C*R171C5 -> 0 | BD172: =R[-1]C*R171C5 -> 0 | BE172: =R[-1]C*R171C5 -> 0 | BF172: =R[-1]C*R171C5 -> 0 | BG172: =R[-1]C*R171C5 -> 6600 | BM172: =R[-1]C[-61]*R[-1]C[-2] -> 32400 | BN172: =RC[-1]-RC[1] -> 22500 | BO172: =SUM(RC[-61]:RC[-8]) -> 9900
D173: Total Savings | F173: =R[-1]C-R[-2]C4*R[-2]C -> 0 | G173: =R[-1]C-R[-2]C4*R[-2]C -> 0 | H173: =R[-1]C-R[-2]C4*R[-2]C -> 0 | I173: =R[-1]C-R[-2]C4*R[-2]C -> 0 | J173: =R[-1]C-R[-2]C4*R[-2]C -> -1250 | K173: =R[-1]C-R[-2]C4*R[-2]C -> -2500 | L173: =R[-1]C-R[-2]C4*R[-2]C -> 0 | M173: =R[-1]C-R[-2]C4*R[-2]C -> 0 | N173: =R[-1]C-R[-2]C4*R[-2]C -> 0 | O173: =R[-1]C-R[-2]C4*R[-2]C -> 0 | P173: =R[-1]C-R[-2]C4*R[-2]C -> -1250 | Q173: =R[-1]C-R[-2]C4*R[-2]C -> -1250 | R173: =R[-1]C-R[-2]C4*R[-2]C -> 0 | S173: =R[-1]C-R[-2]C4*R[-2]C -> 0 | T173: =R[-1]C-R[-2]C4*R[-2]C -> 0 | U173: =R[-1]C-R[-2]C4*R[-2]C -> 0 | V173: =R[-1]C-R[-2]C4*R[-2]C -> 0 | W173: =R[-1]C-R[-2]C4*R[-2]C -> 0 | X173: =R[-1]C-R[-2]C4*R[-2]C -> 0 | Y173: =R[-1]C-R[-2]C4*R[-2]C -> 0 | Z173: =R[-1]C-R[-2]C4*R[-2]C -> 0 | AA173: =R[-1]C-R[-2]C4*R[-2]C -> 0 | AB173: =R[-1]C-R[-2]C4*R[-2]C -> 0 | AC173: =R[-1]C-R[-2]C4*R[-2]C -> 0 | AD173: =R[-1]C-R[-2]C4*R[-2]C -> 0 | AE173: =R[-1]C-R[-2]C4*R[-2]C -> 0 | AF173: =R[-1]C-R[-2]C4*R[-2]C -> 0 | AG173: =R[-1]C-R[-2]C4*R[-2]C -> -1250 | AH173: =R[-1]C-R[-2]C4*R[-2]C -> 0 | AI173: =R[-1]C-R[-2]C4*R[-2]C -> 0 | AJ173: =R[-1]C-R[-2]C4*R[-2]C -> 0 | AK173: =R[-1]C-R[-2]C4*R[-2]C -> 0 | AL173: =R[-1]C-R[-2]C4*R[-2]C -> 0 | AM173: =R[-1]C-R[-2]C4*R[-2]C -> 0 | AN173: =R[-1]C-R[-2]C4*R[-2]C -> 0 | AO173: =R[-1]C-R[-2]C4*R[-2]C -> 0 | AP173: =R[-1]C-R[-2]C4*R[-2]C -> 0 | AQ173: =R[-1]C-R[-2]C4*R[-2]C -> 0 | AR173: =R[-1]C-R[-2]C4*R[-2]C -> 0 | AS173: =R[-1]C-R[-2]C4*R[-2]C -> 0 | AT173: =R[-1]C-R[-2]C4*R[-2]C -> 0 | AU173: =R[-1]C-R[-2]C4*R[-2]C -> 0 | AV173: =R[-1]C-R[-2]C4*R[-2]C -> 0 | AW173: =R[-1]C-R[-2]C4*R[-2]C -> 0 | AX173: =R[-1]C-R[-2]C4*R[-2]C -> 0 | AY173: =R[-1]C-R[-2]C4*R[-2]C -> 0 | AZ173: =R[-1]C-R[-2]C4*R[-2]C -> 0 | BA173: =R[-1]C-R[-2]C4*R[-2]C -> 0 | BB173: =R[-1]C-R[-2]C4*R[-2]C -> 0 | BC173: =R[-1]C-R[-2]C4*R[-2]C -> 0 | BD173: =R[-1]C-R[-2]C4*R[-2]C -> 0 | BE173: =R[-1]C-R[-2]C4*R[-2]C -> 0 | BF173: =R[-1]C-R[-2]C4*R[-2]C -> 0 | BG173: =R[-1]C-R[-2]C4*R[-2]C -> -15000 | BO173: =SUM(RC[-61]:RC[-8]) -> -22500
A174: Introduction to SAS | B174: 2002-08-12T00:00:00.000 | C174: 3 | D174: 1595 | E174: 550 | F174: 0 | G174: 0 | H174: 0 | I174: 0 | J174: 0 | K174: 0 | L174: 0 | M174: 0 | N174: 0 | O174: 0 | P174: 0 | Q174: 1 | R174: 0 | S174: 1 | T174: 1 | U174: 0 | V174: 0 | W174: 0 | X174: 5 | Y174: 0 | Z174: 0 | AA174: 0 | AB174: 0 | AC174: 0 | AD174: 0 | AE174: 0 | AF174: 0 | AG174: 0 | AH174: 0 | AI174: 0 | AJ174: 0 | AK174: 0 | AL174: 0 | AM174: 0 | AN174: 0 | AO174: 0 | AP174: 0 | AQ174: 0 | AR174: 0 | AS174: 0 | AT174: 0 | AU174: 1 | AV174: 0 | AW174: 0 | AX174: 0 | AY174: 0 | AZ174: 0 | BA174: 0 | BB174: 0 | BC174: 0 | BD174: 0 | BE174: 0 | BF174: 0 | BG174: 1 | BK174: =SUM(RC[-57]:RC[-4]) -> 10 | BL174: =RC[-61]*RC[-1] -> 30
D175: Total | F175: =R[-1]C*R174C5 -> 0 | G175: =R[-1]C*R174C5 -> 0 | H175: =R[-1]C*R174C5 -> 0 | I175: =R[-1]C*R174C5 -> 0 | J175: =R[-1]C*R174C5 -> 0 | K175: =R[-1]C*R174C5 -> 0 | L175: =R[-1]C*R174C5 -> 0 | M175: =R[-1]C*R174C5 -> 0 | N175: =R[-1]C*R174C5 -> 0 | O175: =R[-1]C*R174C5 -> 0 | P175: =R[-1]C*R174C5 -> 0 | Q175: =R[-1]C*R174C5 -> 550 | R175: =R[-1]C*R174C5 -> 0 | S175: =R[-1]C*R174C5 -> 550 | T175: =R[-1]C*R174C5 -> 550 | U175: =R[-1]C*R174C5 -> 0 | V175: =R[-1]C*R174C5 -> 0 | W175: =R[-1]C*R174C5 -> 0 | X175: =R[-1]C*R174C5 -> 2750 | Y175: =R[-1]C*R174C5 -> 0 | Z175: =R[-1]C*R174C5 -> 0 | AA175: =R[-1]C*R174C5 -> 0 | AB175: =R[-1]C*R174C5 -> 0 | AC175: =R[-1]C*R174C5 -> 0 | AD175: =R[-1]C*R174C5 -> 0 | AE175: =R[-1]C*R174C5 -> 0 | AF175: =R[-1]C*R174C5 -> 0 | AG175: =R[-1]C*R174C5 -> 0 | AH175: =R[-1]C*R174C5 -> 0 | AI175: =R[-1]C*R174C5 -> 0 | AJ175: =R[-1]C*R174C5 -> 0 | AK175: =R[-1]C*R174C5 -> 0 | AL175: =R[-1]C*R174C5 -> 0 | AM175: =R[-1]C*R174C5 -> 0 | AN175: =R[-1]C*R174C5 -> 0 | AO175: =R[-1]C*R174C5 -> 0 | AP175: =R[-1]C*R174C5 -> 0 | AQ175: =R[-1]C*R174C5 -> 0 | AR175: =R[-1]C*R174C5 -> 0 | AS175: =R[-1]C*R174C5 -> 0 | AT175: =R[-1]C*R174C5 -> 0 | AU175: =R[-1]C*R174C5 -> 550 | AV175: =R[-1]C*R174C5 -> 0 | AW175: =R[-1]C*R174C5 -> 0 | AX175: =R[-1]C*R174C5 -> 0 | AY175: =R[-1]C*R174C5 -> 0 | AZ175: =R[-1]C*R174C5 -> 0 | BA175: =R[-1]C*R174C5 -> 0 | BB175: =R[-1]C*R174C5 -> 0 | BC175: =R[-1]C*R174C5 -> 0 | BD175: =R[-1]C*R174C5 -> 0 | BE175: =R[-1]C*R174C5 -> 0 | BF175: =R[-1]C*R174C5 -> 0 | BG175: =R[-1]C*R174C5 -> 550 | BM175: =R[-1]C[-61]*R[-1]C[-2] -> 15950 | BN175: =RC[-1]-RC[1] -> 10450 | BO175: =SUM(RC[-61]:RC[-8]) -> 5500
D176: Total Savings | F176: =R[-1]C-R[-2]C4*R[-2]C -> 0 | G176: =R[-1]C-R[-2]C4*R[-2]C -> 0 | H176: =R[-1]C-R[-2]C4*R[-2]C -> 0 | I176: =R[-1]C-R[-2]C4*R[-2]C -> 0 | J176: =R[-1]C-R[-2]C4*R[-2]C -> 0 | K176: =R[-1]C-R[-2]C4*R[-2]C -> 0 | L176: =R[-1]C-R[-2]C4*R[-2]C -> 0 | M176: =R[-1]C-R[-2]C4*R[-2]C -> 0 | N176: =R[-1]C-R[-2]C4*R[-2]C -> 0 | O176: =R[-1]C-R[-2]C4*R[-2]C -> 0 | P176: =R[-1]C-R[-2]C4*R[-2]C -> 0 | Q176: =R[-1]C-R[-2]C4*R[-2]C -> -1045 | R176: =R[-1]C-R[-2]C4*R[-2]C -> 0 | S176: =R[-1]C-R[-2]C4*R[-2]C -> -1045 | T176: =R[-1]C-R[-2]C4*R[-2]C -> -1045 | U176: =R[-1]C-R[-2]C4*R[-2]C -> 0 | V176: =R[-1]C-R[-2]C4*R[-2]C -> 0 | W176: =R[-1]C-R[-2]C4*R[-2]C -> 0 | X176: =R[-1]C-R[-2]C4*R[-2]C -> -5225 | Y176: =R[-1]C-R[-2]C4*R[-2]C -> 0 | Z176: =R[-1]C-R[-2]C4*R[-2]C -> 0 | AA176: =R[-1]C-R[-2]C4*R[-2]C -> 0 | AB176: =R[-1]C-R[-2]C4*R[-2]C -> 0 | AC176: =R[-1]C-R[-2]C4*R[-2]C -> 0 | AD176: =R[-1]C-R[-2]C4*R[-2]C -> 0 | AE176: =R[-1]C-R[-2]C4*R[-2]C -> 0 | AF176: =R[-1]C-R[-2]C4*R[-2]C -> 0 | AG176: =R[-1]C-R[-2]C4*R[-2]C -> 0 | AH176: =R[-1]C-R[-2]C4*R[-2]C -> 0 | AI176: =R[-1]C-R[-2]C4*R[-2]C -> 0 | AJ176: =R[-1]C-R[-2]C4*R[-2]C -> 0 | AK176: =R[-1]C-R[-2]C4*R[-2]C -> 0 | AL176: =R[-1]C-R[-2]C4*R[-2]C -> 0 | AM176: =R[-1]C-R[-2]C4*R[-2]C -> 0 | AN176: =R[-1]C-R[-2]C4*R[-2]C -> 0 | AO176: =R[-1]C-R[-2]C4*R[-2]C -> 0 | AP176: =R[-1]C-R[-2]C4*R[-2]C -> 0 | AQ176: =R[-1]C-R[-2]C4*R[-2]C -> 0 | AR176: =R[-1]C-R[-2]C4*R[-2]C -> 0 | AS176: =R[-1]C-R[-2]C4*R[-2]C -> 0 | AT176: =R[-1]C-R[-2]C4*R[-2]C -> 0 | AU176: =R[-1]C-R[-2]C4*R[-2]C -> -1045 | AV176: =R[-1]C-R[-2]C4*R[-2]C -> 0 | AW176: =R[-1]C-R[-2]C4*R[-2]C -> 0 | AX176: =R[-1]C-R[-2]C4*R[-2]C -> 0 | AY176: =R[-1]C-R[-2]C4*R[-2]C -> 0 | AZ176: =R[-1]C-R[-2]C4*R[-2]C -> 0 | BA176: =R[-1]C-R[-2]C4*R[-2]C -> 0 | BB176: =R[-1]C-R[-2]C4*R[-2]C -> 0 | BC176: =R[-1]C-R[-2]C4*R[-2]C -> 0 | BD176: =R[-1]C-R[-2]C4*R[-2]C -> 0 | BE176: =R[-1]C-R[-2]C4*R[-2]C -> 0 | BF176: =R[-1]C-R[-2]C4*R[-2]C -> 0 | BG176: =R[-1]C-R[-2]C4*R[-2]C -> -1045 | BO176: =SUM(RC[-61]:RC[-8]) -> -10450
A177: Advanced Project Management | B177: 2002-08-13T00:00:00.000 | C177: 3 | D177: 2250 | E177: 1031 | F177: 0 | G177: 0 | H177: 0 | I177: 0 | J177: 1 | K177: 0 | L177: 0 | M177: 0 | N177: 0 | O177: 0 | P177: 0 | Q177: 0 | R177: 0 | S177: 0 | T177: 0 | U177: 0 | V177: 0 | W177: 0 | X177: 0 | Y177: 0 | Z177: 2 | AA177: 0 | AB177: 0 | AC177: 0 | AD177: 0 | AE177: 0 | AF177: 0 | AG177: 0 | AH177: 0 | AI177: 3 | AJ177: 0 | AK177: 0 | AL177: 0 | AM177: 0 | AN177: 0 | AO177: 0 | AP177: 0 | AQ177: 0 | AR177: 0 | AS177: 0 | AT177: 0 | AU177: 0 | AV177: 0 | AW177: 0 | AX177: 0 | AY177: 0 | AZ177: 0 | BA177: 0 | BB177: 0 | BC177: 0 | BD177: 0 | BE177: 2 | BF177: 0 | BG177: 0 | BK177: =SUM(RC[-57]:RC[-4]) -> 8 | BL177: =RC[-61]*RC[-1] -> 24
D178: Total | F178: =R[-1]C*R177C5 -> 0 | G178: =R[-1]C*R177C5 -> 0 | H178: =R[-1]C*R177C5 -> 0 | I178: =R[-1]C*R177C5 -> 0 | J178: =R[-1]C*R177C5 -> 1031 | K178: =R[-1]C*R177C5 -> 0 | L178: =R[-1]C*R177C5 -> 0 | M178: =R[-1]C*R177C5 -> 0 | N178: =R[-1]C*R177C5 -> 0 | O178: =R[-1]C*R177C5 -> 0 | P178: =R[-1]C*R177C5 -> 0 | Q178: =R[-1]C*R177C5 -> 0 | R178: =R[-1]C*R177C5 -> 0 | S178: =R[-1]C*R177C5 -> 0 | T178: =R[-1]C*R177C5 -> 0 | U178: =R[-1]C*R177C5 -> 0 | V178: =R[-1]C*R177C5 -> 0 | W178: =R[-1]C*R177C5 -> 0 | X178: =R[-1]C*R177C5 -> 0 | Y178: =R[-1]C*R177C5 -> 0 | Z178: =R[-1]C*R177C5 -> 2062 | AA178: =R[-1]C*R177C5 -> 0 | AB178: =R[-1]C*R177C5 -> 0 | AC178: =R[-1]C*R177C5 -> 0 | AD178: =R[-1]C*R177C5 -> 0 | AE178: =R[-1]C*R177C5 -> 0 | AF178: =R[-1]C*R177C5 -> 0 | AG178: =R[-1]C*R177C5 -> 0 | AH178: =R[-1]C*R177C5 -> 0 | AI178: =R[-1]C*R177C5 -> 3093 | AJ178: =R[-1]C*R177C5 -> 0 | AK178: =R[-1]C*R177C5 -> 0 | AL178: =R[-1]C*R177C5 -> 0 | AM178: =R[-1]C*R177C5 -> 0 | AN178: =R[-1]C*R177C5 -> 0 | AO178: =R[-1]C*R177C5 -> 0 | AP178: =R[-1]C*R177C5 -> 0 | AQ178: =R[-1]C*R177C5 -> 0 | AR178: =R[-1]C*R177C5 -> 0 | AS178: =R[-1]C*R177C5 -> 0 | AT178: =R[-1]C*R177C5 -> 0 | AU178: =R[-1]C*R177C5 -> 0 | AV178: =R[-1]C*R177C5 -> 0 | AW178: =R[-1]C*R177C5 -> 0 | AX178: =R[-1]C*R177C5 -> 0 | AY178: =R[-1]C*R177C5 -> 0 | AZ178: =R[-1]C*R177C5 -> 0 | BA178: =R[-1]C*R177C5 -> 0 | BB178: =R[-1]C*R177C5 -> 0 | BC178: =R[-1]C*R177C5 -> 0 | BD178: =R[-1]C*R177C5 -> 0 | BE178: =R[-1]C*R177C5 -> 2062 | BF178: =R[-1]C*R177C5 -> 0 | BG178: =R[-1]C*R177C5 -> 0 | BM178: =R[-1]C[-61]*R[-1]C[-2] -> 18000 | BN178: =RC[-1]-RC[1] -> 9752 | BO178: =SUM(RC[-61]:RC[-8]) -> 8248
D179: Total Savings | F179: =R[-1]C-R[-2]C4*R[-2]C -> 0 | G179: =R[-1]C-R[-2]C4*R[-2]C -> 0 | H179: =R[-1]C-R[-2]C4*R[-2]C -> 0 | I179: =R[-1]C-R[-2]C4*R[-2]C -> 0 | J179: =R[-1]C-R[-2]C4*R[-2]C -> -1219 | K179: =R[-1]C-R[-2]C4*R[-2]C -> 0 | L179: =R[-1]C-R[-2]C4*R[-2]C -> 0 | M179: =R[-1]C-R[-2]C4*R[-2]C -> 0 | N179: =R[-1]C-R[-2]C4*R[-2]C -> 0 | O179: =R[-1]C-R[-2]C4*R[-2]C -> 0 | P179: =R[-1]C-R[-2]C4*R[-2]C -> 0 | Q179: =R[-1]C-R[-2]C4*R[-2]C -> 0 | R179: =R[-1]C-R[-2]C4*R[-2]C -> 0 | S179: =R[-1]C-R[-2]C4*R[-2]C -> 0 | T179: =R[-1]C-R[-2]C4*R[-2]C -> 0 | U179: =R[-1]C-R[-2]C4*R[-2]C -> 0 | V179: =R[-1]C-R[-2]C4*R[-2]C -> 0 | W179: =R[-1]C-R[-2]C4*R[-2]C -> 0 | X179: =R[-1]C-R[-2]C4*R[-2]C -> 0 | Y179: =R[-1]C-R[-2]C4*R[-2]C -> 0 | Z179: =R[-1]C-R[-2]C4*R[-2]C -> -2438 | AA179: =R[-1]C-R[-2]C4*R[-2]C -> 0 | AB179: =R[-1]C-R[-2]C4*R[-2]C -> 0 | AC179: =R[-1]C-R[-2]C4*R[-2]C -> 0 | AD179: =R[-1]C-R[-2]C4*R[-2]C -> 0 | AE179: =R[-1]C-R[-2]C4*R[-2]C -> 0 | AF179: =R[-1]C-R[-2]C4*R[-2]C -> 0 | AG179: =R[-1]C-R[-2]C4*R[-2]C -> 0 | AH179: =R[-1]C-R[-2]C4*R[-2]C -> 0 | AI179: =R[-1]C-R[-2]C4*R[-2]C -> -3657 | AJ179: =R[-1]C-R[-2]C4*R[-2]C -> 0 | AK179: =R[-1]C-R[-2]C4*R[-2]C -> 0 | AL179: =R[-1]C-R[-2]C4*R[-2]C -> 0 | AM179: =R[-1]C-R[-2]C4*R[-2]C -> 0 | AN179: =R[-1]C-R[-2]C4*R[-2]C -> 0 | AO179: =R[-1]C-R[-2]C4*R[-2]C -> 0 | AP179: =R[-1]C-R[-2]C4*R[-2]C -> 0 | AQ179: =R[-1]C-R[-2]C4*R[-2]C -> 0 | AR179: =R[-1]C-R[-2]C4*R[-2]C -> 0 | AS179: =R[-1]C-R[-2]C4*R[-2]C -> 0 | AT179: =R[-1]C-R[-2]C4*R[-2]C -> 0 | AU179: =R[-1]C-R[-2]C4*R[-2]C -> 0 | AV179: =R[-1]C-R[-2]C4*R[-2]C -> 0 | AW179: =R[-1]C-R[-2]C4*R[-2]C -> 0 | AX179: =R[-1]C-R[-2]C4*R[-2]C -> 0 | AY179: =R[-1]C-R[-2]C4*R[-2]C -> 0 | AZ179: =R[-1]C-R[-2]C4*R[-2]C -> 0 | BA179: =R[-1]C-R[-2]C4*R[-2]C -> 0 | BB179: =R[-1]C-R[-2]C4*R[-2]C -> 0 | BC179: =R[-1]C-R[-2]C4*R[-2]C -> 0 | BD179: =R[-1]C-R[-2]C4*R[-2]C -> 0 | BE179: =R[-1]C-R[-2]C4*R[-2]C -> -2438 | BF179: =R[-1]C-R[-2]C4*R[-2]C -> 0 | BG179: =R[-1]C-R[-2]C4*R[-2]C -> 0 | BO179: =SUM(RC[-61]:RC[-8]) -> -9752
A180: Essential Training for Decentralized Security | B180: 2002-08-13T00:00:00.000 | C180: 1 | D180: 650 | E180: 325 | F180: 0 | G180: 0 | H180: 0 | I180: 0 | J180: 0 | K180: 3 | L180: 4 | M180: 0 | N180: 0 | O180: 0 | P180: 0 | Q180: 0 | R180: 1 | S180: 0 | T180: 0 | U180: 1 | V180: 0 | W180: 0 | X180: 0 | Y180: 0 | Z180: 0 | AA180: 0 | AB180: 0 | AC180: 0 | AD180: 0 | AE180: 0 | AF180: 0 | AG180: 0 | AH180: 0 | AI180: 0 | AJ180: 0 | AK180: 0 | AL180: 0 | AM180: 0 | AN180: 0 | AO180: 0 | AP180: 0 | AQ180: 0 | AR180: 0 | AS180: 0 | AT180: 0 | AU180: 0 | AV180: 0 | AW180: 0 | AX180: 0 | AY180: 0 | AZ180: 0 | BA180: 0 | BB180: 0 | BC180: 0 | BD180: 0 | BE180: 2 | BF180: 0 | BG180: 11 | BK180: =SUM(RC[-57]:RC[-4]) -> 22 | BL180: =RC[-61]*RC[-1] -> 22
D181: Total | F181: =R[-1]C*R180C5 -> 0 | G181: =R[-1]C*R180C5 -> 0 | H181: =R[-1]C*R180C5 -> 0 | I181: =R[-1]C*R180C5 -> 0 | J181: =R[-1]C*R180C5 -> 0 | K181: =R[-1]C*R180C5 -> 975 | L181: =R[-1]C*R180C5 -> 1300 | M181: =R[-1]C*R180C5 -> 0 | N181: =R[-1]C*R180C5 -> 0 | O181: =R[-1]C*R180C5 -> 0 | P181: =R[-1]C*R180C5 -> 0 | Q181: =R[-1]C*R180C5 -> 0 | R181: =R[-1]C*R180C5 -> 325 | S181: =R[-1]C*R180C5 -> 0 | T181: =R[-1]C*R180C5 -> 0 | U181: =R[-1]C*R180C5 -> 325 | V181: =R[-1]C*R180C5 -> 0 | W181: =R[-1]C*R180C5 -> 0 | X181: =R[-1]C*R180C5 -> 0 | Y181: =R[-1]C*R180C5 -> 0 | Z181: =R[-1]C*R180C5 -> 0 | AA181: =R[-1]C*R180C5 -> 0 | AB181: =R[-1]C*R180C5 -> 0 | AC181: =R[-1]C*R180C5 -> 0 | AD181: =R[-1]C*R180C5 -> 0 | AE181: =R[-1]C*R180C5 -> 0 | AF181: =R[-1]C*R180C5 -> 0 | AG181: =R[-1]C*R180C5 -> 0 | AH181: =R[-1]C*R180C5 -> 0 | AI181: =R[-1]C*R180C5 -> 0 | AJ181: =R[-1]C*R180C5 -> 0 | AK181: =R[-1]C*R180C5 -> 0 | AL181: =R[-1]C*R180C5 -> 0 | AM181: =R[-1]C*R180C5 -> 0 | AN181: =R[-1]C*R180C5 -> 0 | AO181: =R[-1]C*R180C5 -> 0 | AP181: =R[-1]C*R180C5 -> 0 | AQ181: =R[-1]C*R180C5 -> 0 | AR181: =R[-1]C*R180C5 -> 0 | AS181: =R[-1]C*R180C5 -> 0 | AT181: =R[-1]C*R180C5 -> 0 | AU181: =R[-1]C*R180C5 -> 0 | AV181: =R[-1]C*R180C5 -> 0 | AW181: =R[-1]C*R180C5 -> 0 | AX181: =R[-1]C*R180C5 -> 0 | AY181: =R[-1]C*R180C5 -> 0 | AZ181: =R[-1]C*R180C5 -> 0 | BA181: =R[-1]C*R180C5 -> 0 | BB181: =R[-1]C*R180C5 -> 0 | BC181: =R[-1]C*R180C5 -> 0 | BD181: =R[-1]C*R180C5 -> 0 | BE181: =R[-1]C*R180C5 -> 650 | BF181: =R[-1]C*R180C5 -> 0 | BG181: =R[-1]C*R180C5 -> 3575 | BM181: =R[-1]C[-61]*R[-1]C[-2] -> 14300 | BN181: =RC[-1]-RC[1] -> 7150 | BO181: =SUM(RC[-61]:RC[-8]) -> 7150
D182: Total Savings | F182: =R[-1]C-R[-2]C4*R[-2]C -> 0 | G182: =R[-1]C-R[-2]C4*R[-2]C -> 0 | H182: =R[-1]C-R[-2]C4*R[-2]C -> 0 | I182: =R[-1]C-R[-2]C4*R[-2]C -> 0 | J182: =R[-1]C-R[-2]C4*R[-2]C -> 0 | K182: =R[-1]C-R[-2]C4*R[-2]C -> -975 | L182: =R[-1]C-R[-2]C4*R[-2]C -> -1300 | M182: =R[-1]C-R[-2]C4*R[-2]C -> 0 | N182: =R[-1]C-R[-2]C4*R[-2]C -> 0 | O182: =R[-1]C-R[-2]C4*R[-2]C -> 0 | P182: =R[-1]C-R[-2]C4*R[-2]C -> 0 | Q182: =R[-1]C-R[-2]C4*R[-2]C -> 0 | R182: =R[-1]C-R[-2]C4*R[-2]C -> -325 | S182: =R[-1]C-R[-2]C4*R[-2]C -> 0 | T182: =R[-1]C-R[-2]C4*R[-2]C -> 0 | U182: =R[-1]C-R[-2]C4*R[-2]C -> -325 | V182: =R[-1]C-R[-2]C4*R[-2]C -> 0 | W182: =R[-1]C-R[-2]C4*R[-2]C -> 0 | X182: =R[-1]C-R[-2]C4*R[-2]C -> 0 | Y182: =R[-1]C-R[-2]C4*R[-2]C -> 0 | Z182: =R[-1]C-R[-2]C4*R[-2]C -> 0 | AA182: =R[-1]C-R[-2]C4*R[-2]C -> 0 | AB182: =R[-1]C-R[-2]C4*R[-2]C -> 0 | AC182: =R[-1]C-R[-2]C4*R[-2]C -> 0 | AD182: =R[-1]C-R[-2]C4*R[-2]C -> 0 | AE182: =R[-1]C-R[-2]C4*R[-2]C -> 0 | AF182: =R[-1]C-R[-2]C4*R[-2]C -> 0 | AG182: =R[-1]C-R[-2]C4*R[-2]C -> 0 | AH182: =R[-1]C-R[-2]C4*R[-2]C -> 0 | AI182: =R[-1]C-R[-2]C4*R[-2]C -> 0 | AJ182: =R[-1]C-R[-2]C4*R[-2]C -> 0 | AK182: =R[-1]C-R[-2]C4*R[-2]C -> 0 | AL182: =R[-1]C-R[-2]C4*R[-2]C -> 0 | AM182: =R[-1]C-R[-2]C4*R[-2]C -> 0 | AN182: =R[-1]C-R[-2]C4*R[-2]C -> 0 | AO182: =R[-1]C-R[-2]C4*R[-2]C -> 0 | AP182: =R[-1]C-R[-2]C4*R[-2]C -> 0 | AQ182: =R[-1]C-R[-2]C4*R[-2]C -> 0 | AR182: =R[-1]C-R[-2]C4*R[-2]C -> 0 | AS182: =R[-1]C-R[-2]C4*R[-2]C -> 0 | AT182: =R[-1]C-R[-2]C4*R[-2]C -> 0 | AU182: =R[-1]C-R[-2]C4*R[-2]C -> 0 | AV182: =R[-1]C-R[-2]C4*R[-2]C -> 0 | AW182: =R[-1]C-R[-2]C4*R[-2]C -> 0 | AX182: =R[-1]C-R[-2]C4*R[-2]C -> 0 | AY182: =R[-1]C-R[-2]C4*R[-2]C -> 0 | AZ182: =R[-1]C-R[-2]C4*R[-2]C -> 0 | BA182: =R[-1]C-R[-2]C4*R[-2]C -> 0 | BB182: =R[-1]C-R[-2]C4*R[-2]C -> 0 | BC182: =R[-1]C-R[-2]C4*R[-2]C -> 0 | BD182: =R[-1]C-R[-2]C4*R[-2]C -> 0 | BE182: =R[-1]C-R[-2]C4*R[-2]C -> -650 | BF182: =R[-1]C-R[-2]C4*R[-2]C -> 0 | BG182: =R[-1]C-R[-2]C4*R[-2]C -> -3575 | BO182: =SUM(RC[-61]:RC[-8]) -> -7150
A183: VB 6.0 Database | B183: 2002-08-19T00:00:00.000 | C183: 2 | D183: 900 | E183: 350 | F183: 0 | G183: 0 | H183: 0 | I183: 0 | J183: 2 | K183: 1 | L183: 0 | M183: 0 | N183: 0 | O183: 0 | P183: 0 | Q183: 0 | R183: 0 | S183: 0 | T183: 0 | U183: 0 | V183: 0 | W183: 0 | X183: 0 | Y183: 0 | Z183: 0 | AA183: 0 | AB183: 0 | AC183: 0 | AD183: 0 | AE183: 0 | AF183: 0 | AG183: 0 | AH183: 1 | AI183: 0 | AJ183: 0 | AK183: 0 | AL183: 0 | AM183: 0 | AN183: 0 | AO183: 0 | AP183: 0 | AQ183: 0 | AR183: 0 | AS183: 0 | AT183: 0 | AU183: 0 | AV183: 0 | AW183: 0 | AX183: 0 | AY183: 0 | AZ183: 0 | BA183: 0 | BB183: 0 | BC183: 0 | BD183: 1 | BE183: 0 | BF183: 0 | BG183: 0 | BK183: =SUM(RC[-57]:RC[-4]) -> 5 | BL183: =RC[-61]*RC[-1] -> 10
D184: Total | F184: =R[-1]C*R183C5 -> 0 | G184: =R[-1]C*R183C5 -> 0 | H184: =R[-1]C*R183C5 -> 0 | I184: =R[-1]C*R183C5 -> 0 | J184: =R[-1]C*R183C5 -> 700 | K184: =R[-1]C*R183C5 -> 350 | L184: =R[-1]C*R183C5 -> 0 | M184: =R[-1]C*R183C5 -> 0 | N184: =R[-1]C*R183C5 -> 0 | O184: =R[-1]C*R183C5 -> 0 | P184: =R[-1]C*R183C5 -> 0 | Q184: =R[-1]C*R183C5 -> 0 | R184: =R[-1]C*R183C5 -> 0 | S184: =R[-1]C*R183C5 -> 0 | T184: =R[-1]C*R183C5 -> 0 | U184: =R[-1]C*R183C5 -> 0 | V184: =R[-1]C*R183C5 -> 0 | W184: =R[-1]C*R183C5 -> 0 | X184: =R[-1]C*R183C5 -> 0 | Y184: =R[-1]C*R183C5 -> 0 | Z184: =R[-1]C*R183C5 -> 0 | AA184: =R[-1]C*R183C5 -> 0 | AB184: =R[-1]C*R183C5 -> 0 | AC184: =R[-1]C*R183C5 -> 0 | AD184: =R[-1]C*R183C5 -> 0 | AE184: =R[-1]C*R183C5 -> 0 | AF184: =R[-1]C*R183C5 -> 0 | AG184: =R[-1]C*R183C5 -> 0 | AH184: =R[-1]C*R183C5 -> 350 | AI184: =R[-1]C*R183C5 -> 0 | AJ184: =R[-1]C*R183C5 -> 0 | AK184: =R[-1]C*R183C5 -> 0 | AL184: =R[-1]C*R183C5 -> 0 | AM184: =R[-1]C*R183C5 -> 0 | AN184: =R[-1]C*R183C5 -> 0 | AO184: =R[-1]C*R183C5 -> 0 | AP184: =R[-1]C*R183C5 -> 0 | AQ184: =R[-1]C*R183C5 -> 0 | AR184: =R[-1]C*R183C5 -> 0 | AS184: =R[-1]C*R183C5 -> 0 | AT184: =R[-1]C*R183C5 -> 0 | AU184: =R[-1]C*R183C5 -> 0 | AV184: =R[-1]C*R183C5 -> 0 | AW184: =R[-1]C*R183C5 -> 0 | AX184: =R[-1]C*R183C5 -> 0 | AY184: =R[-1]C*R183C5 -> 0 | AZ184: =R[-1]C*R183C5 -> 0 | BA184: =R[-1]C*R183C5 -> 0 | BB184: =R[-1]C*R183C5 -> 0 | BC184: =R[-1]C*R183C5 -> 0 | BD184: =R[-1]C*R183C5 -> 350 | BE184: =R[-1]C*R183C5 -> 0 | BF184: =R[-1]C*R183C5 -> 0 | BG184: =R[-1]C*R183C5 -> 0 | BM184: =R[-1]C[-61]*R[-1]C[-2] -> 4500 | BN184: =RC[-1]-RC[1] -> 2750 | BO184: =SUM(RC[-61]:RC[-8]) -> 1750
D185: Total Savings | F185: =R[-1]C-R[-2]C4*R[-2]C -> 0 | G185: =R[-1]C-R[-2]C4*R[-2]C -> 0 | H185: =R[-1]C-R[-2]C4*R[-2]C -> 0 | I185: =R[-1]C-R[-2]C4*R[-2]C -> 0 | J185: =R[-1]C-R[-2]C4*R[-2]C -> -1100 | K185: =R[-1]C-R[-2]C4*R[-2]C -> -550 | L185: =R[-1]C-R[-2]C4*R[-2]C -> 0 | M185: =R[-1]C-R[-2]C4*R[-2]C -> 0 | N185: =R[-1]C-R[-2]C4*R[-2]C -> 0 | O185: =R[-1]C-R[-2]C4*R[-2]C -> 0 | P185: =R[-1]C-R[-2]C4*R[-2]C -> 0 | Q185: =R[-1]C-R[-2]C4*R[-2]C -> 0 | R185: =R[-1]C-R[-2]C4*R[-2]C -> 0 | S185: =R[-1]C-R[-2]C4*R[-2]C -> 0 | T185: =R[-1]C-R[-2]C4*R[-2]C -> 0 | U185: =R[-1]C-R[-2]C4*R[-2]C -> 0 | V185: =R[-1]C-R[-2]C4*R[-2]C -> 0 | W185: =R[-1]C-R[-2]C4*R[-2]C -> 0 | X185: =R[-1]C-R[-2]C4*R[-2]C -> 0 | Y185: =R[-1]C-R[-2]C4*R[-2]C -> 0 | Z185: =R[-1]C-R[-2]C4*R[-2]C -> 0 | AA185: =R[-1]C-R[-2]C4*R[-2]C -> 0 | AB185: =R[-1]C-R[-2]C4*R[-2]C -> 0 | AC185: =R[-1]C-R[-2]C4*R[-2]C -> 0 | AD185: =R[-1]C-R[-2]C4*R[-2]C -> 0 | AE185: =R[-1]C-R[-2]C4*R[-2]C -> 0 | AF185: =R[-1]C-R[-2]C4*R[-2]C -> 0 | AG185: =R[-1]C-R[-2]C4*R[-2]C -> 0 | AH185: =R[-1]C-R[-2]C4*R[-2]C -> -550 | AI185: =R[-1]C-R[-2]C4*R[-2]C -> 0 | AJ185: =R[-1]C-R[-2]C4*R[-2]C -> 0 | AK185: =R[-1]C-R[-2]C4*R[-2]C -> 0 | AL185: =R[-1]C-R[-2]C4*R[-2]C -> 0 | AM185: =R[-1]C-R[-2]C4*R[-2]C -> 0 | AN185: =R[-1]C-R[-2]C4*R[-2]C -> 0 | AO185: =R[-1]C-R[-2]C4*R[-2]C -> 0 | AP185: =R[-1]C-R[-2]C4*R[-2]C -> 0 | AQ185: =R[-1]C-R[-2]C4*R[-2]C -> 0 | AR185: =R[-1]C-R[-2]C4*R[-2]C -> 0 | AS185: =R[-1]C-R[-2]C4*R[-2]C -> 0 | AT185: =R[-1]C-R[-2]C4*R[-2]C -> 0 | AU185: =R[-1]C-R[-2]C4*R[-2]C -> 0 | AV185: =R[-1]C-R[-2]C4*R[-2]C -> 0 | AW185: =R[-1]C-R[-2]C4*R[-2]C -> 0 | AX185: =R[-1]C-R[-2]C4*R[-2]C -> 0 | AY185: =R[-1]C-R[-2]C4*R[-2]C -> 0 | AZ185: =R[-1]C-R[-2]C4*R[-2]C -> 0 | BA185: =R[-1]C-R[-2]C4*R[-2]C -> 0 | BB185: =R[-1]C-R[-2]C4*R[-2]C -> 0 | BC185: =R[-1]C-R[-2]C4*R[-2]C -> 0 | BD185: =R[-1]C-R[-2]C4*R[-2]C -> -550 | BE185: =R[-1]C-R[-2]C4*R[-2]C -> 0 | BF185: =R[-1]C-R[-2]C4*R[-2]C -> 0 | BG185: =R[-1]C-R[-2]C4*R[-2]C -> 0 | BO185: =SUM(RC[-61]:RC[-8]) -> -2750
A186: Advanced VISIO 2000 | B186: 2002-08-20T00:00:00.000 | C186: 1 | D186: 375 | E186: 150 | F186: 0 | G186: 0 | H186: 0 | I186: 0 | J186: 4 | K186: 0 | L186: 0 | M186: 0 | N186: 0 | O186: 0 | P186: 0 | Q186: 0 | R186: 0 | S186: 0 | T186: 0 | U186: 0 | V186: 0 | W186: 0 | X186: 0 | Y186: 0 | Z186: 0 | AA186: 0 | AB186: 0 | AC186: 0 | AD186: 0 | AE186: 0 | AF186: 0 | AG186: 0 | AH186: 0 | AI186: 0 | AJ186: 0 | AK186: 0 | AL186: 0 | AM186: 0 | AN186: 0 | AO186: 0 | AP186: 0 | AQ186: 0 | AR186: 0 | AS186: 0 | AT186: 0 | AU186: 0 | AV186: 0 | AW186: 0 | AX186: 0 | AY186: 0 | AZ186: 0 | BA186: 0 | BB186: 0 | BC186: 0 | BD186: 0 | BE186: 0 | BF186: 0 | BG186: 0 | BK186: =SUM(RC[-57]:RC[-4]) -> 4 | BL186: =RC[-61]*RC[-1] -> 4
D187: Total | F187: =R[-1]C*R186C5 -> 0 | G187: =R[-1]C*R186C5 -> 0 | H187: =R[-1]C*R186C5 -> 0 | I187: =R[-1]C*R186C5 -> 0 | J187: =R[-1]C*R186C5 -> 600 | K187: =R[-1]C*R186C5 -> 0 | L187: =R[-1]C*R186C5 -> 0 | M187: =R[-1]C*R186C5 -> 0 | N187: =R[-1]C*R186C5 -> 0 | O187: =R[-1]C*R186C5 -> 0 | P187: =R[-1]C*R186C5 -> 0 | Q187: =R[-1]C*R186C5 -> 0 | R187: =R[-1]C*R186C5 -> 0 | S187: =R[-1]C*R186C5 -> 0 | T187: =R[-1]C*R186C5 -> 0 | U187: =R[-1]C*R186C5 -> 0 | V187: =R[-1]C*R186C5 -> 0 | W187: =R[-1]C*R186C5 -> 0 | X187: =R[-1]C*R186C5 -> 0 | Y187: =R[-1]C*R186C5 -> 0 | Z187: =R[-1]C*R186C5 -> 0 | AA187: =R[-1]C*R186C5 -> 0 | AB187: =R[-1]C*R186C5 -> 0 | AC187: =R[-1]C*R186C5 -> 0 | AD187: =R[-1]C*R186C5 -> 0 | AE187: =R[-1]C*R186C5 -> 0 | AF187: =R[-1]C*R186C5 -> 0 | AG187: =R[-1]C*R186C5 -> 0 | AH187: =R[-1]C*R186C5 -> 0 | AI187: =R[-1]C*R186C5 -> 0 | AJ187: =R[-1]C*R186C5 -> 0 | AK187: =R[-1]C*R186C5 -> 0 | AL187: =R[-1]C*R186C5 -> 0 | AM187: =R[-1]C*R186C5 -> 0 | AN187: =R[-1]C*R186C5 -> 0 | AO187: =R[-1]C*R186C5 -> 0 | AP187: =R[-1]C*R186C5 -> 0 | AQ187: =R[-1]C*R186C5 -> 0 | AR187: =R[-1]C*R186C5 -> 0 | AS187: =R[-1]C*R186C5 -> 0 | AT187: =R[-1]C*R186C5 -> 0 | AU187: =R[-1]C*R186C5 -> 0 | AV187: =R[-1]C*R186C5 -> 0 | AW187: =R[-1]C*R186C5 -> 0 | AX187: =R[-1]C*R186C5 -> 0 | AY187: =R[-1]C*R186C5 -> 0 | AZ187: =R[-1]C*R186C5 -> 0 | BA187: =R[-1]C*R186C5 -> 0 | BB187: =R[-1]C*R186C5 -> 0 | BC187: =R[-1]C*R186C5 -> 0 | BD187: =R[-1]C*R186C5 -> 0 | BE187: =R[-1]C*R186C5 -> 0 | BF187: =R[-1]C*R186C5 -> 0 | BG187: =R[-1]C*R186C5 -> 0 | BM187: =R[-1]C[-61]*R[-1]C[-2] -> 1500 | BN187: =RC[-1]-RC[1] -> 900 | BO187: =SUM(RC[-61]:RC[-8]) -> 600
D188: Total Savings | F188: =R[-1]C-R[-2]C4*R[-2]C -> 0 | G188: =R[-1]C-R[-2]C4*R[-2]C -> 0 | H188: =R[-1]C-R[-2]C4*R[-2]C -> 0 | I188: =R[-1]C-R[-2]C4*R[-2]C -> 0 | J188: =R[-1]C-R[-2]C4*R[-2]C -> -900 | K188: =R[-1]C-R[-2]C4*R[-2]C -> 0 | L188: =R[-1]C-R[-2]C4*R[-2]C -> 0 | M188: =R[-1]C-R[-2]C4*R[-2]C -> 0 | N188: =R[-1]C-R[-2]C4*R[-2]C -> 0 | O188: =R[-1]C-R[-2]C4*R[-2]C -> 0 | P188: =R[-1]C-R[-2]C4*R[-2]C -> 0 | Q188: =R[-1]C-R[-2]C4*R[-2]C -> 0 | R188: =R[-1]C-R[-2]C4*R[-2]C -> 0 | S188: =R[-1]C-R[-2]C4*R[-2]C -> 0 | T188: =R[-1]C-R[-2]C4*R[-2]C -> 0 | U188: =R[-1]C-R[-2]C4*R[-2]C -> 0 | V188: =R[-1]C-R[-2]C4*R[-2]C -> 0 | W188: =R[-1]C-R[-2]C4*R[-2]C -> 0 | X188: =R[-1]C-R[-2]C4*R[-2]C -> 0 | Y188: =R[-1]C-R[-2]C4*R[-2]C -> 0 | Z188: =R[-1]C-R[-2]C4*R[-2]C -> 0 | AA188: =R[-1]C-R[-2]C4*R[-2]C -> 0 | AB188: =R[-1]C-R[-2]C4*R[-2]C -> 0 | AC188: =R[-1]C-R[-2]C4*R[-2]C -> 0 | AD188: =R[-1]C-R[-2]C4*R[-2]C -> 0 | AE188: =R[-1]C-R[-2]C4*R[-2]C -> 0 | AF188: =R[-1]C-R[-2]C4*R[-2]C -> 0 | AG188: =R[-1]C-R[-2]C4*R[-2]C -> 0 | AH188: =R[-1]C-R[-2]C4*R[-2]C -> 0 | AI188: =R[-1]C-R[-2]C4*R[-2]C -> 0 | AJ188: =R[-1]C-R[-2]C4*R[-2]C -> 0 | AK188: =R[-1]C-R[-2]C4*R[-2]C -> 0 | AL188: =R[-1]C-R[-2]C4*R[-2]C -> 0 | AM188: =R[-1]C-R[-2]C4*R[-2]C -> 0 | AN188: =R[-1]C-R[-2]C4*R[-2]C -> 0 | AO188: =R[-1]C-R[-2]C4*R[-2]C -> 0 | AP188: =R[-1]C-R[-2]C4*R[-2]C -> 0 | AQ188: =R[-1]C-R[-2]C4*R[-2]C -> 0 | AR188: =R[-1]C-R[-2]C4*R[-2]C -> 0 | AS188: =R[-1]C-R[-2]C4*R[-2]C -> 0 | AT188: =R[-1]C-R[-2]C4*R[-2]C -> 0 | AU188: =R[-1]C-R[-2]C4*R[-2]C -> 0 | AV188: =R[-1]C-R[-2]C4*R[-2]C -> 0 | AW188: =R[-1]C-R[-2]C4*R[-2]C -> 0 | AX188: =R[-1]C-R[-2]C4*R[-2]C -> 0 | AY188: =R[-1]C-R[-2]C4*R[-2]C -> 0 | AZ188: =R[-1]C-R[-2]C4*R[-2]C -> 0 | BA188: =R[-1]C-R[-2]C4*R[-2]C -> 0 | BB188: =R[-1]C-R[-2]C4*R[-2]C -> 0 | BC188: =R[-1]C-R[-2]C4*R[-2]C -> 0 | BD188: =R[-1]C-R[-2]C4*R[-2]C -> 0 | BE188: =R[-1]C-R[-2]C4*R[-2]C -> 0 | BF188: =R[-1]C-R[-2]C4*R[-2]C -> 0 | BG188: =R[-1]C-R[-2]C4*R[-2]C -> 0 | BO188: =SUM(RC[-61]:RC[-8]) -> -900
A189: Boot Camp for Software Testers | B189: 2002-08-26T00:00:00.000 | C189: 3 | D189: 1995 | E189: 850 | F189: 0 | G189: 0 | H189: 0 | I189: 0 | J189: 0 | K189: 0 | L189: 0 | M189: 0 | N189: 1 | O189: 0 | P189: 0 | Q189: 0 | R189: 0 | S189: 0 | T189: 0 | U189: 0 | V189: 0 | W189: 0 | X189: 5 | Y189: 0 | Z189: 0 | AA189: 0 | AB189: 0 | AC189: 0 | AD189: 0 | AE189: 4 | AF189: 0 | AG189: 0 | AH189: 0 | AI189: 0 | AJ189: 2 | AK189: 0 | AL189: 0 | AM189: 0 | AN189: 0 | AO189: 0 | AP189: 0 | AQ189: 0 | AR189: 0 | AS189: 0 | AT189: 0 | AU189: 0 | AV189: 0 | AW189: 0 | AX189: 0 | AY189: 0 | AZ189: 0 | BA189: 0 | BB189: 0 | BC189: 0 | BD189: 0 | BE189: 0 | BF189: 0 | BG189: 0 | BK189: =SUM(RC[-57]:RC[-4]) -> 12 | BL189: =RC[-61]*RC[-1] -> 36
D190: Total | F190: =R[-1]C*R189C5 -> 0 | G190: =R[-1]C*R189C5 -> 0 | H190: =R[-1]C*R189C5 -> 0 | I190: =R[-1]C*R189C5 -> 0 | J190: =R[-1]C*R189C5 -> 0 | K190: =R[-1]C*R189C5 -> 0 | L190: =R[-1]C*R189C5 -> 0 | M190: =R[-1]C*R189C5 -> 0 | N190: =R[-1]C*R189C5 -> 850 | O190: =R[-1]C*R189C5 -> 0 | P190: =R[-1]C*R189C5 -> 0 | Q190: =R[-1]C*R189C5 -> 0 | R190: =R[-1]C*R189C5 -> 0 | S190: =R[-1]C*R189C5 -> 0 | T190: =R[-1]C*R189C5 -> 0 | U190: =R[-1]C*R189C5 -> 0 | V190: =R[-1]C*R189C5 -> 0 | W190: =R[-1]C*R189C5 -> 0 | X190: =R[-1]C*R189C5 -> 4250 | Y190: =R[-1]C*R189C5 -> 0 | Z190: =R[-1]C*R189C5 -> 0 | AA190: =R[-1]C*R189C5 -> 0 | AB190: =R[-1]C*R189C5 -> 0 | AC190: =R[-1]C*R189C5 -> 0 | AD190: =R[-1]C*R189C5 -> 0 | AE190: =R[-1]C*R189C5 -> 3400 | AF190: =R[-1]C*R189C5 -> 0 | AG190: =R[-1]C*R189C5 -> 0 | AH190: =R[-1]C*R189C5 -> 0 | AI190: =R[-1]C*R189C5 -> 0 | AJ190: =R[-1]C*R189C5 -> 1700 | AK190: =R[-1]C*R189C5 -> 0 | AL190: =R[-1]C*R189C5 -> 0 | AM190: =R[-1]C*R189C5 -> 0 | AN190: =R[-1]C*R189C5 -> 0 | AO190: =R[-1]C*R189C5 -> 0 | AP190: =R[-1]C*R189C5 -> 0 | AQ190: =R[-1]C*R189C5 -> 0 | AR190: =R[-1]C*R189C5 -> 0 | AS190: =R[-1]C*R189C5 -> 0 | AT190: =R[-1]C*R189C5 -> 0 | AU190: =R[-1]C*R189C5 -> 0 | AV190: =R[-1]C*R189C5 -> 0 | AW190: =R[-1]C*R189C5 -> 0 | AX190: =R[-1]C*R189C5 -> 0 | AY190: =R[-1]C*R189C5 -> 0 | AZ190: =R[-1]C*R189C5 -> 0 | BA190: =R[-1]C*R189C5 -> 0 | BB190: =R[-1]C*R189C5 -> 0 | BC190: =R[-1]C*R189C5 -> 0 | BD190: =R[-1]C*R189C5 -> 0 | BE190: =R[-1]C*R189C5 -> 0 | BF190: =R[-1]C*R189C5 -> 0 | BG190: =R[-1]C*R189C5 -> 0 | BM190: =R[-1]C[-61]*R[-1]C[-2] -> 23940 | BN190: =RC[-1]-RC[1] -> 13740 | BO190: =SUM(RC[-61]:RC[-8]) -> 10200
D191: Total Savings | F191: =R[-1]C-R[-2]C4*R[-2]C -> 0 | G191: =R[-1]C-R[-2]C4*R[-2]C -> 0 | H191: =R[-1]C-R[-2]C4*R[-2]C -> 0 | I191: =R[-1]C-R[-2]C4*R[-2]C -> 0 | J191: =R[-1]C-R[-2]C4*R[-2]C -> 0 | K191: =R[-1]C-R[-2]C4*R[-2]C -> 0 | L191: =R[-1]C-R[-2]C4*R[-2]C -> 0 | M191: =R[-1]C-R[-2]C4*R[-2]C -> 0 | N191: =R[-1]C-R[-2]C4*R[-2]C -> -1145 | O191: =R[-1]C-R[-2]C4*R[-2]C -> 0 | P191: =R[-1]C-R[-2]C4*R[-2]C -> 0 | Q191: =R[-1]C-R[-2]C4*R[-2]C -> 0 | R191: =R[-1]C-R[-2]C4*R[-2]C -> 0 | S191: =R[-1]C-R[-2]C4*R[-2]C -> 0 | T191: =R[-1]C-R[-2]C4*R[-2]C -> 0 | U191: =R[-1]C-R[-2]C4*R[-2]C -> 0 | V191: =R[-1]C-R[-2]C4*R[-2]C -> 0 | W191: =R[-1]C-R[-2]C4*R[-2]C -> 0 | X191: =R[-1]C-R[-2]C4*R[-2]C -> -5725 | Y191: =R[-1]C-R[-2]C4*R[-2]C -> 0 | Z191: =R[-1]C-R[-2]C4*R[-2]C -> 0 | AA191: =R[-1]C-R[-2]C4*R[-2]C -> 0 | AB191: =R[-1]C-R[-2]C4*R[-2]C -> 0 | AC191: =R[-1]C-R[-2]C4*R[-2]C -> 0 | AD191: =R[-1]C-R[-2]C4*R[-2]C -> 0 | AE191: =R[-1]C-R[-2]C4*R[-2]C -> -4580 | AF191: =R[-1]C-R[-2]C4*R[-2]C -> 0 | AG191: =R[-1]C-R[-2]C4*R[-2]C -> 0 | AH191: =R[-1]C-R[-2]C4*R[-2]C -> 0 | AI191: =R[-1]C-R[-2]C4*R[-2]C -> 0 | AJ191: =R[-1]C-R[-2]C4*R[-2]C -> -2290 | AK191: =R[-1]C-R[-2]C4*R[-2]C -> 0 | AL191: =R[-1]C-R[-2]C4*R[-2]C -> 0 | AM191: =R[-1]C-R[-2]C4*R[-2]C -> 0 | AN191: =R[-1]C-R[-2]C4*R[-2]C -> 0 | AO191: =R[-1]C-R[-2]C4*R[-2]C -> 0 | AP191: =R[-1]C-R[-2]C4*R[-2]C -> 0 | AQ191: =R[-1]C-R[-2]C4*R[-2]C -> 0 | AR191: =R[-1]C-R[-2]C4*R[-2]C -> 0 | AS191: =R[-1]C-R[-2]C4*R[-2]C -> 0 | AT191: =R[-1]C-R[-2]C4*R[-2]C -> 0 | AU191: =R[-1]C-R[-2]C4*R[-2]C -> 0 | AV191: =R[-1]C-R[-2]C4*R[-2]C -> 0 | AW191: =R[-1]C-R[-2]C4*R[-2]C -> 0 | AX191: =R[-1]C-R[-2]C4*R[-2]C -> 0 | AY191: =R[-1]C-R[-2]C4*R[-2]C -> 0 | AZ191: =R[-1]C-R[-2]C4*R[-2]C -> 0 | BA191: =R[-1]C-R[-2]C4*R[-2]C -> 0 | BB191: =R[-1]C-R[-2]C4*R[-2]C -> 0 | BC191: =R[-1]C-R[-2]C4*R[-2]C -> 0 | BD191: =R[-1]C-R[-2]C4*R[-2]C -> 0 | BE191: =R[-1]C-R[-2]C4*R[-2]C -> 0 | BF191: =R[-1]C-R[-2]C4*R[-2]C -> 0 | BG191: =R[-1]C-R[-2]C4*R[-2]C -> 0 | BO191: =SUM(RC[-61]:RC[-8]) -> -13740
A192: Using File Aid Effectively | B192: 2002-08-27T00:00:00.000 | C192: 1 | D192: 550 | E192: 225 | F192: 6 | G192: 0 | H192: 0 | I192: 0 | J192: 0 | K192: 2 | L192: 0 | M192: 0 | N192: 0 | O192: 0 | P192: 0 | Q192: 0 | R192: 0 | S192: 0 | T192: 0 | U192: 0 | V192: 0 | W192: 0 | X192: 0 | Y192: 0 | Z192: 0 | AA192: 0 | AB192: 0 | AC192: 0 | AD192: 0 | AE192: 0 | AF192: 0 | AG192: 0 | AH192: 0 | AI192: 0 | AJ192: 0 | AK192: 0 | AL192: 0 | AM192: 0 | AN192: 0 | AO192: 0 | AP192: 0 | AQ192: 0 | AR192: 0 | AS192: 0 | AT192: 0 | AU192: 0 | AV192: 0 | AW192: 0 | AX192: 0 | AY192: 0 | AZ192: 0 | BA192: 0 | BB192: 0 | BC192: 0 | BD192: 0 | BE192: 0 | BF192: 0 | BG192: 0 | BK192: =SUM(RC[-57]:RC[-4]) -> 8 | BL192: =RC[-61]*RC[-1] -> 8
D193: Total | F193: =R[-1]C*R192C5 -> 1350 | G193: =R[-1]C*R192C5 -> 0 | H193: =R[-1]C*R192C5 -> 0 | I193: =R[-1]C*R192C5 -> 0 | J193: =R[-1]C*R192C5 -> 0 | K193: =R[-1]C*R192C5 -> 450 | L193: =R[-1]C*R192C5 -> 0 | M193: =R[-1]C*R192C5 -> 0 | N193: =R[-1]C*R192C5 -> 0 | O193: =R[-1]C*R192C5 -> 0 | P193: =R[-1]C*R192C5 -> 0 | Q193: =R[-1]C*R192C5 -> 0 | R193: =R[-1]C*R192C5 -> 0 | S193: =R[-1]C*R192C5 -> 0 | T193: =R[-1]C*R192C5 -> 0 | U193: =R[-1]C*R192C5 -> 0 | V193: =R[-1]C*R192C5 -> 0 | W193: =R[-1]C*R192C5 -> 0 | X193: =R[-1]C*R192C5 -> 0 | Y193: =R[-1]C*R192C5 -> 0 | Z193: =R[-1]C*R192C5 -> 0 | AA193: =R[-1]C*R192C5 -> 0 | AB193: =R[-1]C*R192C5 -> 0 | AC193: =R[-1]C*R192C5 -> 0 | AD193: =R[-1]C*R192C5 -> 0 | AE193: =R[-1]C*R192C5 -> 0 | AF193: =R[-1]C*R192C5 -> 0 | AG193: =R[-1]C*R192C5 -> 0 | AH193: =R[-1]C*R192C5 -> 0 | AI193: =R[-1]C*R192C5 -> 0 | AJ193: =R[-1]C*R192C5 -> 0 | AK193: =R[-1]C*R192C5 -> 0 | AL193: =R[-1]C*R192C5 -> 0 | AM193: =R[-1]C*R192C5 -> 0 | AN193: =R[-1]C*R192C5 -> 0 | AO193: =R[-1]C*R192C5 -> 0 | AP193: =R[-1]C*R192C5 -> 0 | AQ193: =R[-1]C*R192C5 -> 0 | AR193: =R[-1]C*R192C5 -> 0 | AS193: =R[-1]C*R192C5 -> 0 | AT193: =R[-1]C*R192C5 -> 0 | AU193: =R[-1]C*R192C5 -> 0 | AV193: =R[-1]C*R192C5 -> 0 | AW193: =R[-1]C*R192C5 -> 0 | AX193: =R[-1]C*R192C5 -> 0 | AY193: =R[-1]C*R192C5 -> 0 | AZ193: =R[-1]C*R192C5 -> 0 | BA193: =R[-1]C*R192C5 -> 0 | BB193: =R[-1]C*R192C5 -> 0 | BC193: =R[-1]C*R192C5 -> 0 | BD193: =R[-1]C*R192C5 -> 0 | BE193: =R[-1]C*R192C5 -> 0 | BF193: =R[-1]C*R192C5 -> 0 | BG193: =R[-1]C*R192C5 -> 0 | BM193: =R[-1]C[-61]*R[-1]C[-2] -> 4400 | BN193: =RC[-1]-RC[1] -> 2600 | BO193: =SUM(RC[-61]:RC[-8]) -> 1800
D194: Total Savings | F194: =R[-1]C-R[-2]C4*R[-2]C -> -1950 | G194: =R[-1]C-R[-2]C4*R[-2]C -> 0 | H194: =R[-1]C-R[-2]C4*R[-2]C -> 0 | I194: =R[-1]C-R[-2]C4*R[-2]C -> 0 | J194: =R[-1]C-R[-2]C4*R[-2]C -> 0 | K194: =R[-1]C-R[-2]C4*R[-2]C -> -650 | L194: =R[-1]C-R[-2]C4*R[-2]C -> 0 | M194: =R[-1]C-R[-2]C4*R[-2]C -> 0 | N194: =R[-1]C-R[-2]C4*R[-2]C -> 0 | O194: =R[-1]C-R[-2]C4*R[-2]C -> 0 | P194: =R[-1]C-R[-2]C4*R[-2]C -> 0 | Q194: =R[-1]C-R[-2]C4*R[-2]C -> 0 | R194: =R[-1]C-R[-2]C4*R[-2]C -> 0 | S194: =R[-1]C-R[-2]C4*R[-2]C -> 0 | T194: =R[-1]C-R[-2]C4*R[-2]C -> 0 | U194: =R[-1]C-R[-2]C4*R[-2]C -> 0 | V194: =R[-1]C-R[-2]C4*R[-2]C -> 0 | W194: =R[-1]C-R[-2]C4*R[-2]C -> 0 | X194: =R[-1]C-R[-2]C4*R[-2]C -> 0 | Y194: =R[-1]C-R[-2]C4*R[-2]C -> 0 | Z194: =R[-1]C-R[-2]C4*R[-2]C -> 0 | AA194: =R[-1]C-R[-2]C4*R[-2]C -> 0 | AB194: =R[-1]C-R[-2]C4*R[-2]C -> 0 | AC194: =R[-1]C-R[-2]C4*R[-2]C -> 0 | AD194: =R[-1]C-R[-2]C4*R[-2]C -> 0 | AE194: =R[-1]C-R[-2]C4*R[-2]C -> 0 | AF194: =R[-1]C-R[-2]C4*R[-2]C -> 0 | AG194: =R[-1]C-R[-2]C4*R[-2]C -> 0 | AH194: =R[-1]C-R[-2]C4*R[-2]C -> 0 | AI194: =R[-1]C-R[-2]C4*R[-2]C -> 0 | AJ194: =R[-1]C-R[-2]C4*R[-2]C -> 0 | AK194: =R[-1]C-R[-2]C4*R[-2]C -> 0 | AL194: =R[-1]C-R[-2]C4*R[-2]C -> 0 | AM194: =R[-1]C-R[-2]C4*R[-2]C -> 0 | AN194: =R[-1]C-R[-2]C4*R[-2]C -> 0 | AO194: =R[-1]C-R[-2]C4*R[-2]C -> 0 | AP194: =R[-1]C-R[-2]C4*R[-2]C -> 0 | AQ194: =R[-1]C-R[-2]C4*R[-2]C -> 0 | AR194: =R[-1]C-R[-2]C4*R[-2]C -> 0 | AS194: =R[-1]C-R[-2]C4*R[-2]C -> 0 | AT194: =R[-1]C-R[-2]C4*R[-2]C -> 0 | AU194: =R[-1]C-R[-2]C4*R[-2]C -> 0 | AV194: =R[-1]C-R[-2]C4*R[-2]C -> 0 | AW194: =R[-1]C-R[-2]C4*R[-2]C -> 0 | AX194: =R[-1]C-R[-2]C4*R[-2]C -> 0 | AY194: =R[-1]C-R[-2]C4*R[-2]C -> 0 | AZ194: =R[-1]C-R[-2]C4*R[-2]C -> 0 | BA194: =R[-1]C-R[-2]C4*R[-2]C -> 0 | BB194: =R[-1]C-R[-2]C4*R[-2]C -> 0 | BC194: =R[-1]C-R[-2]C4*R[-2]C -> 0 | BD194: =R[-1]C-R[-2]C4*R[-2]C -> 0 | BE194: =R[-1]C-R[-2]C4*R[-2]C -> 0 | BF194: =R[-1]C-R[-2]C4*R[-2]C -> 0 | BG194: =R[-1]C-R[-2]C4*R[-2]C -> 0 | BO194: =SUM(RC[-61]:RC[-8]) -> -2600
A195: CICS Application, Programming, and Design | B195: 2002-09-04T00:00:00.000 | C195: 3 | D195: 1650 | E195: 675 | F195: 8 | G195: 0 | H195: 0 | I195: 0 | J195: 0 | K195: 1 | L195: 0 | M195: 0 | N195: 0 | O195: 1 | P195: 0 | Q195: 1 | R195: 0 | S195: 0 | T195: 0 | U195: 0 | V195: 0 | W195: 0 | X195: 0 | Y195: 0 | Z195: 0 | AA195: 0 | AB195: 0 | AC195: 0 | AD195: 0 | AE195: 0 | AF195: 0 | AG195: 0 | AH195: 0 | AI195: 0 | AJ195: 0 | AK195: 0 | AL195: 0 | AM195: 0 | AN195: 0 | AO195: 0 | AP195: 0 | AQ195: 0 | AR195: 0 | AS195: 0 | AT195: 0 | AU195: 0 | AV195: 0 | AW195: 0 | AX195: 0 | AY195: 0 | AZ195: 0 | BA195: 0 | BB195: 0 | BC195: 0 | BD195: 0 | BE195: 0 | BF195: 0 | BG195: 0 | BK195: =SUM(RC[-57]:RC[-4]) -> 11 | BL195: =RC[-61]*RC[-1] -> 33
D196: Total | F196: =R[-1]C*R195C5 -> 5400 | G196: =R[-1]C*R195C5 -> 0 | H196: =R[-1]C*R195C5 -> 0 | I196: =R[-1]C*R195C5 -> 0 | J196: =R[-1]C*R195C5 -> 0 | K196: =R[-1]C*R195C5 -> 675 | L196: =R[-1]C*R195C5 -> 0 | M196: =R[-1]C*R195C5 -> 0 | N196: =R[-1]C*R195C5 -> 0 | O196: =R[-1]C*R195C5 -> 675 | P196: =R[-1]C*R195C5 -> 0 | Q196: =R[-1]C*R195C5 -> 675 | R196: =R[-1]C*R195C5 -> 0 | S196: =R[-1]C*R195C5 -> 0 | T196: =R[-1]C*R195C5 -> 0 | U196: =R[-1]C*R195C5 -> 0 | V196: =R[-1]C*R195C5 -> 0 | W196: =R[-1]C*R195C5 -> 0 | X196: =R[-1]C*R195C5 -> 0 | Y196: =R[-1]C*R195C5 -> 0 | Z196: =R[-1]C*R195C5 -> 0 | AA196: =R[-1]C*R195C5 -> 0 | AB196: =R[-1]C*R195C5 -> 0 | AC196: =R[-1]C*R195C5 -> 0 | AD196: =R[-1]C*R195C5 -> 0 | AE196: =R[-1]C*R195C5 -> 0 | AF196: =R[-1]C*R195C5 -> 0 | AG196: =R[-1]C*R195C5 -> 0 | AH196: =R[-1]C*R195C5 -> 0 | AI196: =R[-1]C*R195C5 -> 0 | AJ196: =R[-1]C*R195C5 -> 0 | AK196: =R[-1]C*R195C5 -> 0 | AL196: =R[-1]C*R195C5 -> 0 | AM196: =R[-1]C*R195C5 -> 0 | AN196: =R[-1]C*R195C5 -> 0 | AO196: =R[-1]C*R195C5 -> 0 | AP196: =R[-1]C*R195C5 -> 0 | AQ196: =R[-1]C*R195C5 -> 0 | AR196: =R[-1]C*R195C5 -> 0 | AS196: =R[-1]C*R195C5 -> 0 | AT196: =R[-1]C*R195C5 -> 0 | AU196: =R[-1]C*R195C5 -> 0 | AV196: =R[-1]C*R195C5 -> 0 | AW196: =R[-1]C*R195C5 -> 0 | AX196: =R[-1]C*R195C5 -> 0 | AY196: =R[-1]C*R195C5 -> 0 | AZ196: =R[-1]C*R195C5 -> 0 | BA196: =R[-1]C*R195C5 -> 0 | BB196: =R[-1]C*R195C5 -> 0 | BC196: =R[-1]C*R195C5 -> 0 | BD196: =R[-1]C*R195C5 -> 0 | BE196: =R[-1]C*R195C5 -> 0 | BF196: =R[-1]C*R195C5 -> 0 | BG196: =R[-1]C*R195C5 -> 0 | BM196: =R[-1]C[-61]*R[-1]C[-2] -> 18150 | BN196: =RC[-1]-RC[1] -> 10725 | BO196: =SUM(RC[-61]:RC[-8]) -> 7425
D197: Total Savings | F197: =R[-1]C-R[-2]C4*R[-2]C -> -7800 | G197: =R[-1]C-R[-2]C4*R[-2]C -> 0 | H197: =R[-1]C-R[-2]C4*R[-2]C -> 0 | I197: =R[-1]C-R[-2]C4*R[-2]C -> 0 | J197: =R[-1]C-R[-2]C4*R[-2]C -> 0 | K197: =R[-1]C-R[-2]C4*R[-2]C -> -975 | L197: =R[-1]C-R[-2]C4*R[-2]C -> 0 | M197: =R[-1]C-R[-2]C4*R[-2]C -> 0 | N197: =R[-1]C-R[-2]C4*R[-2]C -> 0 | O197: =R[-1]C-R[-2]C4*R[-2]C -> -975 | P197: =R[-1]C-R[-2]C4*R[-2]C -> 0 | Q197: =R[-1]C-R[-2]C4*R[-2]C -> -975 | R197: =R[-1]C-R[-2]C4*R[-2]C -> 0 | S197: =R[-1]C-R[-2]C4*R[-2]C -> 0 | T197: =R[-1]C-R[-2]C4*R[-2]C -> 0 | U197: =R[-1]C-R[-2]C4*R[-2]C -> 0 | V197: =R[-1]C-R[-2]C4*R[-2]C -> 0 | W197: =R[-1]C-R[-2]C4*R[-2]C -> 0 | X197: =R[-1]C-R[-2]C4*R[-2]C -> 0 | Y197: =R[-1]C-R[-2]C4*R[-2]C -> 0 | Z197: =R[-1]C-R[-2]C4*R[-2]C -> 0 | AA197: =R[-1]C-R[-2]C4*R[-2]C -> 0 | AB197: =R[-1]C-R[-2]C4*R[-2]C -> 0 | AC197: =R[-1]C-R[-2]C4*R[-2]C -> 0 | AD197: =R[-1]C-R[-2]C4*R[-2]C -> 0 | AE197: =R[-1]C-R[-2]C4*R[-2]C -> 0 | AF197: =R[-1]C-R[-2]C4*R[-2]C -> 0 | AG197: =R[-1]C-R[-2]C4*R[-2]C -> 0 | AH197: =R[-1]C-R[-2]C4*R[-2]C -> 0 | AI197: =R[-1]C-R[-2]C4*R[-2]C -> 0 | AJ197: =R[-1]C-R[-2]C4*R[-2]C -> 0 | AK197: =R[-1]C-R[-2]C4*R[-2]C -> 0 | AL197: =R[-1]C-R[-2]C4*R[-2]C -> 0 | AM197: =R[-1]C-R[-2]C4*R[-2]C -> 0 | AN197: =R[-1]C-R[-2]C4*R[-2]C -> 0 | AO197: =R[-1]C-R[-2]C4*R[-2]C -> 0 | AP197: =R[-1]C-R[-2]C4*R[-2]C -> 0 | AQ197: =R[-1]C-R[-2]C4*R[-2]C -> 0 | AR197: =R[-1]C-R[-2]C4*R[-2]C -> 0 | AS197: =R[-1]C-R[-2]C4*R[-2]C -> 0 | AT197: =R[-1]C-R[-2]C4*R[-2]C -> 0 | AU197: =R[-1]C-R[-2]C4*R[-2]C -> 0 | AV197: =R[-1]C-R[-2]C4*R[-2]C -> 0 | AW197: =R[-1]C-R[-2]C4*R[-2]C -> 0 | AX197: =R[-1]C-R[-2]C4*R[-2]C -> 0 | AY197: =R[-1]C-R[-2]C4*R[-2]C -> 0 | AZ197: =R[-1]C-R[-2]C4*R[-2]C -> 0 | BA197: =R[-1]C-R[-2]C4*R[-2]C -> 0 | BB197: =R[-1]C-R[-2]C4*R[-2]C -> 0 | BC197: =R[-1]C-R[-2]C4*R[-2]C -> 0 | BD197: =R[-1]C-R[-2]C4*R[-2]C -> 0 | BE197: =R[-1]C-R[-2]C4*R[-2]C -> 0 | BF197: =R[-1]C-R[-2]C4*R[-2]C -> 0 | BG197: =R[-1]C-R[-2]C4*R[-2]C -> 0 | BO197: =SUM(RC[-61]:RC[-8]) -> -10725
A198: Adobe Acrobat 5.0 | B198: 2002-09-09T00:00:00.000 | C198: 2 | D198: 1000 | E198: 350 | F198: 0 | G198: 0 | H198: 0 | I198: 0 | J198: 7 | K198: 0 | L198: 0 | M198: 0 | N198: 0 | O198: 0 | P198: 0 | Q198: 0 | R198: 0 | S198: 0 | T198: 0 | U198: 0 | V198: 0 | W198: 0 | X198: 0 | Y198: 0 | Z198: 0 | AA198: 0 | AB198: 0 | AC198: 1 | AD198: 0 | AE198: 0 | AF198: 0 | AG198: 1 | AH198: 0 | AI198: 0 | AJ198: 0 | AK198: 0 | AL198: 0 | AM198: 0 | AN198: 0 | AO198: 0 | AP198: 0 | AQ198: 0 | AR198: 0 | AS198: 0 | AT198: 0 | AU198: 0 | AV198: 0 | AW198: 0 | AX198: 0 | AY198: 0 | AZ198: 0 | BA198: 0 | BB198: 0 | BC198: 0 | BD198: 0 | BE198: 0 | BF198: 0 | BG198: 0 | BK198: =SUM(RC[-57]:RC[-4]) -> 9 | BL198: =RC[-61]*RC[-1] -> 18
D199: Total | F199: =R[-1]C*R198C5 -> 0 | G199: =R[-1]C*R198C5 -> 0 | H199: =R[-1]C*R198C5 -> 0 | I199: =R[-1]C*R198C5 -> 0 | J199: =R[-1]C*R198C5 -> 2450 | K199: =R[-1]C*R198C5 -> 0 | L199: =R[-1]C*R198C5 -> 0 | M199: =R[-1]C*R198C5 -> 0 | N199: =R[-1]C*R198C5 -> 0 | O199: =R[-1]C*R198C5 -> 0 | P199: =R[-1]C*R198C5 -> 0 | Q199: =R[-1]C*R198C5 -> 0 | R199: =R[-1]C*R198C5 -> 0 | S199: =R[-1]C*R198C5 -> 0 | T199: =R[-1]C*R198C5 -> 0 | U199: =R[-1]C*R198C5 -> 0 | V199: =R[-1]C*R198C5 -> 0 | W199: =R[-1]C*R198C5 -> 0 | X199: =R[-1]C*R198C5 -> 0 | Y199: =R[-1]C*R198C5 -> 0 | Z199: =R[-1]C*R198C5 -> 0 | AA199: =R[-1]C*R198C5 -> 0 | AB199: =R[-1]C*R198C5 -> 0 | AC199: =R[-1]C*R198C5 -> 350 | AD199: =R[-1]C*R198C5 -> 0 | AE199: =R[-1]C*R198C5 -> 0 | AF199: =R[-1]C*R198C5 -> 0 | AG199: =R[-1]C*R198C5 -> 350 | AH199: =R[-1]C*R198C5 -> 0 | AI199: =R[-1]C*R198C5 -> 0 | AJ199: =R[-1]C*R198C5 -> 0 | AK199: =R[-1]C*R198C5 -> 0 | AL199: =R[-1]C*R198C5 -> 0 | AM199: =R[-1]C*R198C5 -> 0 | AN199: =R[-1]C*R198C5 -> 0 | AO199: =R[-1]C*R198C5 -> 0 | AP199: =R[-1]C*R198C5 -> 0 | AQ199: =R[-1]C*R198C5 -> 0 | AR199: =R[-1]C*R198C5 -> 0 | AS199: =R[-1]C*R198C5 -> 0 | AT199: =R[-1]C*R198C5 -> 0 | AU199: =R[-1]C*R198C5 -> 0 | AV199: =R[-1]C*R198C5 -> 0 | AW199: =R[-1]C*R198C5 -> 0 | AX199: =R[-1]C*R198C5 -> 0 | AY199: =R[-1]C*R198C5 -> 0 | AZ199: =R[-1]C*R198C5 -> 0 | BA199: =R[-1]C*R198C5 -> 0 | BB199: =R[-1]C*R198C5 -> 0 | BC199: =R[-1]C*R198C5 -> 0 | BD199: =R[-1]C*R198C5 -> 0 | BE199: =R[-1]C*R198C5 -> 0 | BF199: =R[-1]C*R198C5 -> 0 | BG199: =R[-1]C*R198C5 -> 0 | BM199: =R[-1]C[-61]*R[-1]C[-2] -> 9000 | BN199: =RC[-1]-RC[1] -> 5850 | BO199: =SUM(RC[-61]:RC[-8]) -> 3150
D200: Total Savings | F200: =R[-1]C-R[-2]C4*R[-2]C -> 0 | G200: =R[-1]C-R[-2]C4*R[-2]C -> 0 | H200: =R[-1]C-R[-2]C4*R[-2]C -> 0 | I200: =R[-1]C-R[-2]C4*R[-2]C -> 0 | J200: =R[-1]C-R[-2]C4*R[-2]C -> -4550 | K200: =R[-1]C-R[-2]C4*R[-2]C -> 0 | L200: =R[-1]C-R[-2]C4*R[-2]C -> 0 | M200: =R[-1]C-R[-2]C4*R[-2]C -> 0 | N200: =R[-1]C-R[-2]C4*R[-2]C -> 0 | O200: =R[-1]C-R[-2]C4*R[-2]C -> 0 | P200: =R[-1]C-R[-2]C4*R[-2]C -> 0 | Q200: =R[-1]C-R[-2]C4*R[-2]C -> 0 | R200: =R[-1]C-R[-2]C4*R[-2]C -> 0 | S200: =R[-1]C-R[-2]C4*R[-2]C -> 0 | T200: =R[-1]C-R[-2]C4*R[-2]C -> 0 | U200: =R[-1]C-R[-2]C4*R[-2]C -> 0 | V200: =R[-1]C-R[-2]C4*R[-2]C -> 0 | W200: =R[-1]C-R[-2]C4*R[-2]C -> 0 | X200: =R[-1]C-R[-2]C4*R[-2]C -> 0 | Y200: =R[-1]C-R[-2]C4*R[-2]C -> 0 | Z200: =R[-1]C-R[-2]C4*R[-2]C -> 0 | AA200: =R[-1]C-R[-2]C4*R[-2]C -> 0 | AB200: =R[-1]C-R[-2]C4*R[-2]C -> 0 | AC200: =R[-1]C-R[-2]C4*R[-2]C -> -650 | AD200: =R[-1]C-R[-2]C4*R[-2]C -> 0 | AE200: =R[-1]C-R[-2]C4*R[-2]C -> 0 | AF200: =R[-1]C-R[-2]C4*R[-2]C -> 0 | AG200: =R[-1]C-R[-2]C4*R[-2]C -> -650 | AH200: =R[-1]C-R[-2]C4*R[-2]C -> 0 | AI200: =R[-1]C-R[-2]C4*R[-2]C -> 0 | AJ200: =R[-1]C-R[-2]C4*R[-2]C -> 0 | AK200: =R[-1]C-R[-2]C4*R[-2]C -> 0 | AL200: =R[-1]C-R[-2]C4*R[-2]C -> 0 | AM200: =R[-1]C-R[-2]C4*R[-2]C -> 0 | AN200: =R[-1]C-R[-2]C4*R[-2]C -> 0 | AO200: =R[-1]C-R[-2]C4*R[-2]C -> 0 | AP200: =R[-1]C-R[-2]C4*R[-2]C -> 0 | AQ200: =R[-1]C-R[-2]C4*R[-2]C -> 0 | AR200: =R[-1]C-R[-2]C4*R[-2]C -> 0 | AS200: =R[-1]C-R[-2]C4*R[-2]C -> 0 | AT200: =R[-1]C-R[-2]C4*R[-2]C -> 0 | AU200: =R[-1]C-R[-2]C4*R[-2]C -> 0 | AV200: =R[-1]C-R[-2]C4*R[-2]C -> 0 | AW200: =R[-1]C-R[-2]C4*R[-2]C -> 0 | AX200: =R[-1]C-R[-2]C4*R[-2]C -> 0 | AY200: =R[-1]C-R[-2]C4*R[-2]C -> 0 | AZ200: =R[-1]C-R[-2]C4*R[-2]C -> 0 | BA200: =R[-1]C-R[-2]C4*R[-2]C -> 0 | BB200: =R[-1]C-R[-2]C4*R[-2]C -> 0 | BC200: =R[-1]C-R[-2]C4*R[-2]C -> 0 | BD200: =R[-1]C-R[-2]C4*R[-2]C -> 0 | BE200: =R[-1]C-R[-2]C4*R[-2]C -> 0 | BF200: =R[-1]C-R[-2]C4*R[-2]C -> 0 | BG200: =R[-1]C-R[-2]C4*R[-2]C -> 0 | BO200: =SUM(RC[-61]:RC[-8]) -> -5850
A201: Analysis Simulation | B201: 2002-09-09T00:00:00.000 | C201: 2 | D201: 1175 | E201: 525 | F201: 0 | G201: 0 | H201: 0 | I201: 0 | J201: 0 | K201: 0 | L201: 0 | M201: 0 | N201: 0 | O201: 0 | P201: 0 | Q201: 0 | R201: 0 | S201: 0 | T201: 0 | U201: 0 | V201: 0 | W201: 0 | X201: 0 | Y201: 3 | Z201: 0 | AA201: 0 | AB201: 0 | AC201: 0 | AD201: 0 | AE201: 0 | AF201: 0 | AG201: 0 | AH201: 0 | AI201: 0 | AJ201: 0 | AK201: 0 | AL201: 0 | AM201: 0 | AN201: 0 | AO201: 0 | AP201: 0 | AQ201: 0 | AR201: 0 | AS201: 0 | AT201: 0 | AU201: 0 | AV201: 0 | AW201: 0 | AX201: 0 | AY201: 0 | AZ201: 0 | BA201: 0 | BB201: 0 | BC201: 0 | BD201: 0 | BE201: 0 | BF201: 0 | BG201: 13 | BK201: =SUM(RC[-57]:RC[-4]) -> 16 | BL201: =RC[-61]*RC[-1] -> 32
D202: Total | F202: =R[-1]C*R201C5 -> 0 | G202: =R[-1]C*R201C5 -> 0 | H202: =R[-1]C*R201C5 -> 0 | I202: =R[-1]C*R201C5 -> 0 | J202: =R[-1]C*R201C5 -> 0 | K202: =R[-1]C*R201C5 -> 0 | L202: =R[-1]C*R201C5 -> 0 | M202: =R[-1]C*R201C5 -> 0 | N202: =R[-1]C*R201C5 -> 0 | O202: =R[-1]C*R201C5 -> 0 | P202: =R[-1]C*R201C5 -> 0 | Q202: =R[-1]C*R201C5 -> 0 | R202: =R[-1]C*R201C5 -> 0 | S202: =R[-1]C*R201C5 -> 0 | T202: =R[-1]C*R201C5 -> 0 | U202: =R[-1]C*R201C5 -> 0 | V202: =R[-1]C*R201C5 -> 0 | W202: =R[-1]C*R201C5 -> 0 | X202: =R[-1]C*R201C5 -> 0 | Y202: =R[-1]C*R201C5 -> 1575 | Z202: =R[-1]C*R201C5 -> 0 | AA202: =R[-1]C*R201C5 -> 0 | AB202: =R[-1]C*R201C5 -> 0 | AC202: =R[-1]C*R201C5 -> 0 | AD202: =R[-1]C*R201C5 -> 0 | AE202: =R[-1]C*R201C5 -> 0 | AF202: =R[-1]C*R201C5 -> 0 | AG202: =R[-1]C*R201C5 -> 0 | AH202: =R[-1]C*R201C5 -> 0 | AI202: =R[-1]C*R201C5 -> 0 | AJ202: =R[-1]C*R201C5 -> 0 | AK202: =R[-1]C*R201C5 -> 0 | AL202: =R[-1]C*R201C5 -> 0 | AM202: =R[-1]C*R201C5 -> 0 | AN202: =R[-1]C*R201C5 -> 0 | AO202: =R[-1]C*R201C5 -> 0 | AP202: =R[-1]C*R201C5 -> 0 | AQ202: =R[-1]C*R201C5 -> 0 | AR202: =R[-1]C*R201C5 -> 0 | AS202: =R[-1]C*R201C5 -> 0 | AT202: =R[-1]C*R201C5 -> 0 | AU202: =R[-1]C*R201C5 -> 0 | AV202: =R[-1]C*R201C5 -> 0 | AW202: =R[-1]C*R201C5 -> 0 | AX202: =R[-1]C*R201C5 -> 0 | AY202: =R[-1]C*R201C5 -> 0 | AZ202: =R[-1]C*R201C5 -> 0 | BA202: =R[-1]C*R201C5 -> 0 | BB202: =R[-1]C*R201C5 -> 0 | BC202: =R[-1]C*R201C5 -> 0 | BD202: =R[-1]C*R201C5 -> 0 | BE202: =R[-1]C*R201C5 -> 0 | BF202: =R[-1]C*R201C5 -> 0 | BG202: =R[-1]C*R201C5 -> 6825 | BM202: =R[-1]C[-61]*R[-1]C[-2] -> 18800 | BN202: =RC[-1]-RC[1] -> 10400 | BO202: =SUM(RC[-61]:RC[-8]) -> 8400
D203: Total Savings | F203: =R[-1]C-R[-2]C4*R[-2]C -> 0 | G203: =R[-1]C-R[-2]C4*R[-2]C -> 0 | H203: =R[-1]C-R[-2]C4*R[-2]C -> 0 | I203: =R[-1]C-R[-2]C4*R[-2]C -> 0 | J203: =R[-1]C-R[-2]C4*R[-2]C -> 0 | K203: =R[-1]C-R[-2]C4*R[-2]C -> 0 | L203: =R[-1]C-R[-2]C4*R[-2]C -> 0 | M203: =R[-1]C-R[-2]C4*R[-2]C -> 0 | N203: =R[-1]C-R[-2]C4*R[-2]C -> 0 | O203: =R[-1]C-R[-2]C4*R[-2]C -> 0 | P203: =R[-1]C-R[-2]C4*R[-2]C -> 0 | Q203: =R[-1]C-R[-2]C4*R[-2]C -> 0 | R203: =R[-1]C-R[-2]C4*R[-2]C -> 0 | S203: =R[-1]C-R[-2]C4*R[-2]C -> 0 | T203: =R[-1]C-R[-2]C4*R[-2]C -> 0 | U203: =R[-1]C-R[-2]C4*R[-2]C -> 0 | V203: =R[-1]C-R[-2]C4*R[-2]C -> 0 | W203: =R[-1]C-R[-2]C4*R[-2]C -> 0 | X203: =R[-1]C-R[-2]C4*R[-2]C -> 0 | Y203: =R[-1]C-R[-2]C4*R[-2]C -> -1950 | Z203: =R[-1]C-R[-2]C4*R[-2]C -> 0 | AA203: =R[-1]C-R[-2]C4*R[-2]C -> 0 | AB203: =R[-1]C-R[-2]C4*R[-2]C -> 0 | AC203: =R[-1]C-R[-2]C4*R[-2]C -> 0 | AD203: =R[-1]C-R[-2]C4*R[-2]C -> 0 | AE203: =R[-1]C-R[-2]C4*R[-2]C -> 0 | AF203: =R[-1]C-R[-2]C4*R[-2]C -> 0 | AG203: =R[-1]C-R[-2]C4*R[-2]C -> 0 | AH203: =R[-1]C-R[-2]C4*R[-2]C -> 0 | AI203: =R[-1]C-R[-2]C4*R[-2]C -> 0 | AJ203: =R[-1]C-R[-2]C4*R[-2]C -> 0 | AK203: =R[-1]C-R[-2]C4*R[-2]C -> 0 | AL203: =R[-1]C-R[-2]C4*R[-2]C -> 0 | AM203: =R[-1]C-R[-2]C4*R[-2]C -> 0 | AN203: =R[-1]C-R[-2]C4*R[-2]C -> 0 | AO203: =R[-1]C-R[-2]C4*R[-2]C -> 0 | AP203: =R[-1]C-R[-2]C4*R[-2]C -> 0 | AQ203: =R[-1]C-R[-2]C4*R[-2]C -> 0 | AR203: =R[-1]C-R[-2]C4*R[-2]C -> 0 | AS203: =R[-1]C-R[-2]C4*R[-2]C -> 0 | AT203: =R[-1]C-R[-2]C4*R[-2]C -> 0 | AU203: =R[-1]C-R[-2]C4*R[-2]C -> 0 | AV203: =R[-1]C-R[-2]C4*R[-2]C -> 0 | AW203: =R[-1]C-R[-2]C4*R[-2]C -> 0 | AX203: =R[-1]C-R[-2]C4*R[-2]C -> 0 | AY203: =R[-1]C-R[-2]C4*R[-2]C -> 0 | AZ203: =R[-1]C-R[-2]C4*R[-2]C -> 0 | BA203: =R[-1]C-R[-2]C4*R[-2]C -> 0 | BB203: =R[-1]C-R[-2]C4*R[-2]C -> 0 | BC203: =R[-1]C-R[-2]C4*R[-2]C -> 0 | BD203: =R[-1]C-R[-2]C4*R[-2]C -> 0 | BE203: =R[-1]C-R[-2]C4*R[-2]C -> 0 | BF203: =R[-1]C-R[-2]C4*R[-2]C -> 0 | BG203: =R[-1]C-R[-2]C4*R[-2]C -> -8450 | BO203: =SUM(RC[-61]:RC[-8]) -> -10400
A204: Oracle 8/8i Foundations: SQL Basics & PL/SQL Work | B204: 2002-09-09T00:00:00.000 | C204: 5 | D204: 2595 | E204: 1350 | F204: 0 | G204: 0 | H204: 0 | I204: 0 | J204: 3 | K204: 0 | L204: 0 | M204: 0 | N204: 0 | O204: 0 | P204: 0 | Q204: 0 | R204: 0 | S204: 0 | T204: 0 | U204: 0 | V204: 0 | W204: 0 | X204: 1 | Y204: 0 | Z204: 0 | AA204: 0 | AB204: 0 | AC204: 0 | AD204: 1 | AE204: 0 | AF204: 0 | AG204: 0 | AH204: 0 | AI204: 0 | AJ204: 0 | AK204: 0 | AL204: 0 | AM204: 0 | AN204: 0 | AO204: 0 | AP204: 0 | AQ204: 0 | AR204: 0 | AS204: 0 | AT204: 0 | AU204: 0 | AV204: 0 | AW204: 0 | AX204: 0 | AY204: 0 | AZ204: 0 | BA204: 0 | BB204: 0 | BC204: 0 | BD204: 0 | BE204: 0 | BF204: 0 | BG204: 0 | BK204: =SUM(RC[-57]:RC[-4]) -> 5 | BL204: =RC[-61]*RC[-1] -> 25
D205: Total | F205: =R[-1]C*R204C5 -> 0 | G205: =R[-1]C*R204C5 -> 0 | H205: =R[-1]C*R204C5 -> 0 | I205: =R[-1]C*R204C5 -> 0 | J205: =R[-1]C*R204C5 -> 4050 | K205: =R[-1]C*R204C5 -> 0 | L205: =R[-1]C*R204C5 -> 0 | M205: =R[-1]C*R204C5 -> 0 | N205: =R[-1]C*R204C5 -> 0 | O205: =R[-1]C*R204C5 -> 0 | P205: =R[-1]C*R204C5 -> 0 | Q205: =R[-1]C*R204C5 -> 0 | R205: =R[-1]C*R204C5 -> 0 | S205: =R[-1]C*R204C5 -> 0 | T205: =R[-1]C*R204C5 -> 0 | U205: =R[-1]C*R204C5 -> 0 | V205: =R[-1]C*R204C5 -> 0 | W205: =R[-1]C*R204C5 -> 0 | X205: =R[-1]C*R204C5 -> 1350 | Y205: =R[-1]C*R204C5 -> 0 | Z205: =R[-1]C*R204C5 -> 0 | AA205: =R[-1]C*R204C5 -> 0 | AB205: =R[-1]C*R204C5 -> 0 | AC205: =R[-1]C*R204C5 -> 0 | AD205: =R[-1]C*R204C5 -> 1350 | AE205: =R[-1]C*R204C5 -> 0 | AF205: =R[-1]C*R204C5 -> 0 | AG205: =R[-1]C*R204C5 -> 0 | AH205: =R[-1]C*R204C5 -> 0 | AI205: =R[-1]C*R204C5 -> 0 | AJ205: =R[-1]C*R204C5 -> 0 | AK205: =R[-1]C*R204C5 -> 0 | AL205: =R[-1]C*R204C5 -> 0 | AM205: =R[-1]C*R204C5 -> 0 | AN205: =R[-1]C*R204C5 -> 0 | AO205: =R[-1]C*R204C5 -> 0 | AP205: =R[-1]C*R204C5 -> 0 | AQ205: =R[-1]C*R204C5 -> 0 | AR205: =R[-1]C*R204C5 -> 0 | AS205: =R[-1]C*R204C5 -> 0 | AT205: =R[-1]C*R204C5 -> 0 | AU205: =R[-1]C*R204C5 -> 0 | AV205: =R[-1]C*R204C5 -> 0 | AW205: =R[-1]C*R204C5 -> 0 | AX205: =R[-1]C*R204C5 -> 0 | AY205: =R[-1]C*R204C5 -> 0 | AZ205: =R[-1]C*R204C5 -> 0 | BA205: =R[-1]C*R204C5 -> 0 | BB205: =R[-1]C*R204C5 -> 0 | BC205: =R[-1]C*R204C5 -> 0 | BD205: =R[-1]C*R204C5 -> 0 | BE205: =R[-1]C*R204C5 -> 0 | BF205: =R[-1]C*R204C5 -> 0 | BG205: =R[-1]C*R204C5 -> 0 | BM205: =R[-1]C[-61]*R[-1]C[-2] -> 12975 | BN205: =RC[-1]-RC[1] -> 6225 | BO205: =SUM(RC[-61]:RC[-8]) -> 6750
D206: Total Savings | F206: =R[-1]C-R[-2]C4*R[-2]C -> 0 | G206: =R[-1]C-R[-2]C4*R[-2]C -> 0 | H206: =R[-1]C-R[-2]C4*R[-2]C -> 0 | I206: =R[-1]C-R[-2]C4*R[-2]C -> 0 | J206: =R[-1]C-R[-2]C4*R[-2]C -> -3735 | K206: =R[-1]C-R[-2]C4*R[-2]C -> 0 | L206: =R[-1]C-R[-2]C4*R[-2]C -> 0 | M206: =R[-1]C-R[-2]C4*R[-2]C -> 0 | N206: =R[-1]C-R[-2]C4*R[-2]C -> 0 | O206: =R[-1]C-R[-2]C4*R[-2]C -> 0 | P206: =R[-1]C-R[-2]C4*R[-2]C -> 0 | Q206: =R[-1]C-R[-2]C4*R[-2]C -> 0 | R206: =R[-1]C-R[-2]C4*R[-2]C -> 0 | S206: =R[-1]C-R[-2]C4*R[-2]C -> 0 | T206: =R[-1]C-R[-2]C4*R[-2]C -> 0 | U206: =R[-1]C-R[-2]C4*R[-2]C -> 0 | V206: =R[-1]C-R[-2]C4*R[-2]C -> 0 | W206: =R[-1]C-R[-2]C4*R[-2]C -> 0 | X206: =R[-1]C-R[-2]C4*R[-2]C -> -1245 | Y206: =R[-1]C-R[-2]C4*R[-2]C -> 0 | Z206: =R[-1]C-R[-2]C4*R[-2]C -> 0 | AA206: =R[-1]C-R[-2]C4*R[-2]C -> 0 | AB206: =R[-1]C-R[-2]C4*R[-2]C -> 0 | AC206: =R[-1]C-R[-2]C4*R[-2]C -> 0 | AD206: =R[-1]C-R[-2]C4*R[-2]C -> -1245 | AE206: =R[-1]C-R[-2]C4*R[-2]C -> 0 | AF206: =R[-1]C-R[-2]C4*R[-2]C -> 0 | AG206: =R[-1]C-R[-2]C4*R[-2]C -> 0 | AH206: =R[-1]C-R[-2]C4*R[-2]C -> 0 | AI206: =R[-1]C-R[-2]C4*R[-2]C -> 0 | AJ206: =R[-1]C-R[-2]C4*R[-2]C -> 0 | AK206: =R[-1]C-R[-2]C4*R[-2]C -> 0 | AL206: =R[-1]C-R[-2]C4*R[-2]C -> 0 | AM206: =R[-1]C-R[-2]C4*R[-2]C -> 0 | AN206: =R[-1]C-R[-2]C4*R[-2]C -> 0 | AO206: =R[-1]C-R[-2]C4*R[-2]C -> 0 | AP206: =R[-1]C-R[-2]C4*R[-2]C -> 0 | AQ206: =R[-1]C-R[-2]C4*R[-2]C -> 0 | AR206: =R[-1]C-R[-2]C4*R[-2]C -> 0 | AS206: =R[-1]C-R[-2]C4*R[-2]C -> 0 | AT206: =R[-1]C-R[-2]C4*R[-2]C -> 0 | AU206: =R[-1]C-R[-2]C4*R[-2]C -> 0 | AV206: =R[-1]C-R[-2]C4*R[-2]C -> 0 | AW206: =R[-1]C-R[-2]C4*R[-2]C -> 0 | AX206: =R[-1]C-R[-2]C4*R[-2]C -> 0 | AY206: =R[-1]C-R[-2]C4*R[-2]C -> 0 | AZ206: =R[-1]C-R[-2]C4*R[-2]C -> 0 | BA206: =R[-1]C-R[-2]C4*R[-2]C -> 0 | BB206: =R[-1]C-R[-2]C4*R[-2]C -> 0 | BC206: =R[-1]C-R[-2]C4*R[-2]C -> 0 | BD206: =R[-1]C-R[-2]C4*R[-2]C -> 0 | BE206: =R[-1]C-R[-2]C4*R[-2]C -> 0 | BF206: =R[-1]C-R[-2]C4*R[-2]C -> 0 | BG206: =R[-1]C-R[-2]C4*R[-2]C -> 0 | BO206: =SUM(RC[-61]:RC[-8]) -> -6225
A207: Survival Skills for Analysis | B207: 2002-09-16T00:00:00.000 | C207: 2 | D207: 1175 | E207: 525 | F207: 0 | G207: 0 | H207: 0 | I207: 0 | J207: 1 | K207: 1 | L207: 0 | M207: 0 | N207: 0 | O207: 0 | P207: 0 | Q207: 0 | R207: 0 | S207: 0 | T207: 0 | U207: 0 | V207: 0 | W207: 3 | X207: 0 | Y207: 0 | Z207: 0 | AA207: 0 | AB207: 0 | AC207: 0 | AD207: 0 | AE207: 0 | AF207: 0 | AG207: 0 | AH207: 0 | AI207: 0 | AJ207: 0 | AK207: 0 | AL207: 0 | AM207: 0 | AN207: 0 | AO207: 0 | AP207: 0 | AQ207: 0 | AR207: 0 | AS207: 0 | AT207: 0 | AU207: 0 | AV207: 0 | AW207: 0 | AX207: 0 | AY207: 0 | AZ207: 0 | BA207: 0 | BB207: 0 | BC207: 0 | BD207: 0 | BE207: 1 | BF207: 0 | BG207: 11 | BK207: =SUM(RC[-57]:RC[-4]) -> 17 | BL207: =RC[-61]*RC[-1] -> 34
D208: Total | F208: =R[-1]C*R207C5 -> 0 | G208: =R[-1]C*R207C5 -> 0 | H208: =R[-1]C*R207C5 -> 0 | I208: =R[-1]C*R207C5 -> 0 | J208: =R[-1]C*R207C5 -> 525 | K208: =R[-1]C*R207C5 -> 525 | L208: =R[-1]C*R207C5 -> 0 | M208: =R[-1]C*R207C5 -> 0 | N208: =R[-1]C*R207C5 -> 0 | O208: =R[-1]C*R207C5 -> 0 | P208: =R[-1]C*R207C5 -> 0 | Q208: =R[-1]C*R207C5 -> 0 | R208: =R[-1]C*R207C5 -> 0 | S208: =R[-1]C*R207C5 -> 0 | T208: =R[-1]C*R207C5 -> 0 | U208: =R[-1]C*R207C5 -> 0 | V208: =R[-1]C*R207C5 -> 0 | W208: =R[-1]C*R207C5 -> 1575 | X208: =R[-1]C*R207C5 -> 0 | Y208: =R[-1]C*R207C5 -> 0 | Z208: =R[-1]C*R207C5 -> 0 | AA208: =R[-1]C*R207C5 -> 0 | AB208: =R[-1]C*R207C5 -> 0 | AC208: =R[-1]C*R207C5 -> 0 | AD208: =R[-1]C*R207C5 -> 0 | AE208: =R[-1]C*R207C5 -> 0 | AF208: =R[-1]C*R207C5 -> 0 | AG208: =R[-1]C*R207C5 -> 0 | AH208: =R[-1]C*R207C5 -> 0 | AI208: =R[-1]C*R207C5 -> 0 | AJ208: =R[-1]C*R207C5 -> 0 | AK208: =R[-1]C*R207C5 -> 0 | AL208: =R[-1]C*R207C5 -> 0 | AM208: =R[-1]C*R207C5 -> 0 | AN208: =R[-1]C*R207C5 -> 0 | AO208: =R[-1]C*R207C5 -> 0 | AP208: =R[-1]C*R207C5 -> 0 | AQ208: =R[-1]C*R207C5 -> 0 | AR208: =R[-1]C*R207C5 -> 0 | AS208: =R[-1]C*R207C5 -> 0 | AT208: =R[-1]C*R207C5 -> 0 | AU208: =R[-1]C*R207C5 -> 0 | AV208: =R[-1]C*R207C5 -> 0 | AW208: =R[-1]C*R207C5 -> 0 | AX208: =R[-1]C*R207C5 -> 0 | AY208: =R[-1]C*R207C5 -> 0 | AZ208: =R[-1]C*R207C5 -> 0 | BA208: =R[-1]C*R207C5 -> 0 | BB208: =R[-1]C*R207C5 -> 0 | BC208: =R[-1]C*R207C5 -> 0 | BD208: =R[-1]C*R207C5 -> 0 | BE208: =R[-1]C*R207C5 -> 525 | BF208: =R[-1]C*R207C5 -> 0 | BG208: =R[-1]C*R207C5 -> 5775 | BM208: =R[-1]C[-61]*R[-1]C[-2] -> 19975 | BN208: =RC[-1]-RC[1] -> 11050 | BO208: =SUM(RC[-61]:RC[-8]) -> 8925
D209: Total Savings | F209: =R[-1]C-R[-2]C4*R[-2]C -> 0 | G209: =R[-1]C-R[-2]C4*R[-2]C -> 0 | H209: =R[-1]C-R[-2]C4*R[-2]C -> 0 | I209: =R[-1]C-R[-2]C4*R[-2]C -> 0 | J209: =R[-1]C-R[-2]C4*R[-2]C -> -650 | K209: =R[-1]C-R[-2]C4*R[-2]C -> -650 | L209: =R[-1]C-R[-2]C4*R[-2]C -> 0 | M209: =R[-1]C-R[-2]C4*R[-2]C -> 0 | N209: =R[-1]C-R[-2]C4*R[-2]C -> 0 | O209: =R[-1]C-R[-2]C4*R[-2]C -> 0 | P209: =R[-1]C-R[-2]C4*R[-2]C -> 0 | Q209: =R[-1]C-R[-2]C4*R[-2]C -> 0 | R209: =R[-1]C-R[-2]C4*R[-2]C -> 0 | S209: =R[-1]C-R[-2]C4*R[-2]C -> 0 | T209: =R[-1]C-R[-2]C4*R[-2]C -> 0 | U209: =R[-1]C-R[-2]C4*R[-2]C -> 0 | V209: =R[-1]C-R[-2]C4*R[-2]C -> 0 | W209: =R[-1]C-R[-2]C4*R[-2]C -> -1950 | X209: =R[-1]C-R[-2]C4*R[-2]C -> 0 | Y209: =R[-1]C-R[-2]C4*R[-2]C -> 0 | Z209: =R[-1]C-R[-2]C4*R[-2]C -> 0 | AA209: =R[-1]C-R[-2]C4*R[-2]C -> 0 | AB209: =R[-1]C-R[-2]C4*R[-2]C -> 0 | AC209: =R[-1]C-R[-2]C4*R[-2]C -> 0 | AD209: =R[-1]C-R[-2]C4*R[-2]C -> 0 | AE209: =R[-1]C-R[-2]C4*R[-2]C -> 0 | AF209: =R[-1]C-R[-2]C4*R[-2]C -> 0 | AG209: =R[-1]C-R[-2]C4*R[-2]C -> 0 | AH209: =R[-1]C-R[-2]C4*R[-2]C -> 0 | AI209: =R[-1]C-R[-2]C4*R[-2]C -> 0 | AJ209: =R[-1]C-R[-2]C4*R[-2]C -> 0 | AK209: =R[-1]C-R[-2]C4*R[-2]C -> 0 | AL209: =R[-1]C-R[-2]C4*R[-2]C -> 0 | AM209: =R[-1]C-R[-2]C4*R[-2]C -> 0 | AN209: =R[-1]C-R[-2]C4*R[-2]C -> 0 | AO209: =R[-1]C-R[-2]C4*R[-2]C -> 0 | AP209: =R[-1]C-R[-2]C4*R[-2]C -> 0 | AQ209: =R[-1]C-R[-2]C4*R[-2]C -> 0 | AR209: =R[-1]C-R[-2]C4*R[-2]C -> 0 | AS209: =R[-1]C-R[-2]C4*R[-2]C -> 0 | AT209: =R[-1]C-R[-2]C4*R[-2]C -> 0 | AU209: =R[-1]C-R[-2]C4*R[-2]C -> 0 | AV209: =R[-1]C-R[-2]C4*R[-2]C -> 0 | AW209: =R[-1]C-R[-2]C4*R[-2]C -> 0 | AX209: =R[-1]C-R[-2]C4*R[-2]C -> 0 | AY209: =R[-1]C-R[-2]C4*R[-2]C -> 0 | AZ209: =R[-1]C-R[-2]C4*R[-2]C -> 0 | BA209: =R[-1]C-R[-2]C4*R[-2]C -> 0 | BB209: =R[-1]C-R[-2]C4*R[-2]C -> 0 | BC209: =R[-1]C-R[-2]C4*R[-2]C -> 0 | BD209: =R[-1]C-R[-2]C4*R[-2]C -> 0 | BE209: =R[-1]C-R[-2]C4*R[-2]C -> -650 | BF209: =R[-1]C-R[-2]C4*R[-2]C -> 0 | BG209: =R[-1]C-R[-2]C4*R[-2]C -> -7150 | BO209: =SUM(RC[-61]:RC[-8]) -> -11050
A210: Intro to MS SQL Server 2000 | B210: 2002-09-17T00:00:00.000 | C210: 2 | D210: 1150 | E210: 500 | F210: 0 | G210: 0 | H210: 0 | I210: 0 | J210: 0 | K210: 4 | L210: 0 | M210: 1 | N210: 0 | O210: 0 | P210: 0 | Q210: 0 | R210: 0 | S210: 0 | T210: 0 | U210: 0 | V210: 0 | W210: 0 | X210: 0 | Y210: 0 | Z210: 0 | AA210: 0 | AB210: 0 | AC210: 0 | AD210: 0 | AE210: 0 | AF210: 0 | AG210: 0 | AH210: 0 | AI210: 0 | AJ210: 0 | AK210: 0 | AL210: 0 | AM210: 0 | AN210: 0 | AO210: 0 | AP210: 0 | AQ210: 0 | AR210: 0 | AS210: 0 | AT210: 0 | AU210: 0 | AV210: 0 | AW210: 0 | AX210: 0 | AY210: 0 | AZ210: 0 | BA210: 0 | BB210: 0 | BC210: 0 | BD210: 0 | BE210: 0 | BF210: 0 | BG210: 0 | BK210: =SUM(RC[-57]:RC[-4]) -> 5 | BL210: =RC[-61]*RC[-1] -> 10
D211: Total | F211: =R[-1]C*R210C5 -> 0 | G211: =R[-1]C*R210C5 -> 0 | H211: =R[-1]C*R210C5 -> 0 | I211: =R[-1]C*R210C5 -> 0 | J211: =R[-1]C*R210C5 -> 0 | K211: =R[-1]C*R210C5 -> 2000 | L211: =R[-1]C*R210C5 -> 0 | M211: =R[-1]C*R210C5 -> 500 | N211: =R[-1]C*R210C5 -> 0 | O211: =R[-1]C*R210C5 -> 0 | P211: =R[-1]C*R210C5 -> 0 | Q211: =R[-1]C*R210C5 -> 0 | R211: =R[-1]C*R210C5 -> 0 | S211: =R[-1]C*R210C5 -> 0 | T211: =R[-1]C*R210C5 -> 0 | U211: =R[-1]C*R210C5 -> 0 | V211: =R[-1]C*R210C5 -> 0 | W211: =R[-1]C*R210C5 -> 0 | X211: =R[-1]C*R210C5 -> 0 | Y211: =R[-1]C*R210C5 -> 0 | Z211: =R[-1]C*R210C5 -> 0 | AA211: =R[-1]C*R210C5 -> 0 | AB211: =R[-1]C*R210C5 -> 0 | AC211: =R[-1]C*R210C5 -> 0 | AD211: =R[-1]C*R210C5 -> 0 | AE211: =R[-1]C*R210C5 -> 0 | AF211: =R[-1]C*R210C5 -> 0 | AG211: =R[-1]C*R210C5 -> 0 | AH211: =R[-1]C*R210C5 -> 0 | AI211: =R[-1]C*R210C5 -> 0 | AJ211: =R[-1]C*R210C5 -> 0 | AK211: =R[-1]C*R210C5 -> 0 | AL211: =R[-1]C*R210C5 -> 0 | AM211: =R[-1]C*R210C5 -> 0 | AN211: =R[-1]C*R210C5 -> 0 | AO211: =R[-1]C*R210C5 -> 0 | AP211: =R[-1]C*R210C5 -> 0 | AQ211: =R[-1]C*R210C5 -> 0 | AR211: =R[-1]C*R210C5 -> 0 | AS211: =R[-1]C*R210C5 -> 0 | AT211: =R[-1]C*R210C5 -> 0 | AU211: =R[-1]C*R210C5 -> 0 | AV211: =R[-1]C*R210C5 -> 0 | AW211: =R[-1]C*R210C5 -> 0 | AX211: =R[-1]C*R210C5 -> 0 | AY211: =R[-1]C*R210C5 -> 0 | AZ211: =R[-1]C*R210C5 -> 0 | BA211: =R[-1]C*R210C5 -> 0 | BB211: =R[-1]C*R210C5 -> 0 | BC211: =R[-1]C*R210C5 -> 0 | BD211: =R[-1]C*R210C5 -> 0 | BE211: =R[-1]C*R210C5 -> 0 | BF211: =R[-1]C*R210C5 -> 0 | BG211: =R[-1]C*R210C5 -> 0 | BM211: =R[-1]C[-61]*R[-1]C[-2] -> 5750 | BN211: =RC[-1]-RC[1] -> 3250 | BO211: =SUM(RC[-61]:RC[-8]) -> 2500
D212: Total Savings | F212: =R[-1]C-R[-2]C4*R[-2]C -> 0 | G212: =R[-1]C-R[-2]C4*R[-2]C -> 0 | H212: =R[-1]C-R[-2]C4*R[-2]C -> 0 | I212: =R[-1]C-R[-2]C4*R[-2]C -> 0 | J212: =R[-1]C-R[-2]C4*R[-2]C -> 0 | K212: =R[-1]C-R[-2]C4*R[-2]C -> -2600 | L212: =R[-1]C-R[-2]C4*R[-2]C -> 0 | M212: =R[-1]C-R[-2]C4*R[-2]C -> -650 | N212: =R[-1]C-R[-2]C4*R[-2]C -> 0 | O212: =R[-1]C-R[-2]C4*R[-2]C -> 0 | P212: =R[-1]C-R[-2]C4*R[-2]C -> 0 | Q212: =R[-1]C-R[-2]C4*R[-2]C -> 0 | R212: =R[-1]C-R[-2]C4*R[-2]C -> 0 | S212: =R[-1]C-R[-2]C4*R[-2]C -> 0 | T212: =R[-1]C-R[-2]C4*R[-2]C -> 0 | U212: =R[-1]C-R[-2]C4*R[-2]C -> 0 | V212: =R[-1]C-R[-2]C4*R[-2]C -> 0 | W212: =R[-1]C-R[-2]C4*R[-2]C -> 0 | X212: =R[-1]C-R[-2]C4*R[-2]C -> 0 | Y212: =R[-1]C-R[-2]C4*R[-2]C -> 0 | Z212: =R[-1]C-R[-2]C4*R[-2]C -> 0 | AA212: =R[-1]C-R[-2]C4*R[-2]C -> 0 | AB212: =R[-1]C-R[-2]C4*R[-2]C -> 0 | AC212: =R[-1]C-R[-2]C4*R[-2]C -> 0 | AD212: =R[-1]C-R[-2]C4*R[-2]C -> 0 | AE212: =R[-1]C-R[-2]C4*R[-2]C -> 0 | AF212: =R[-1]C-R[-2]C4*R[-2]C -> 0 | AG212: =R[-1]C-R[-2]C4*R[-2]C -> 0 | AH212: =R[-1]C-R[-2]C4*R[-2]C -> 0 | AI212: =R[-1]C-R[-2]C4*R[-2]C -> 0 | AJ212: =R[-1]C-R[-2]C4*R[-2]C -> 0 | AK212: =R[-1]C-R[-2]C4*R[-2]C -> 0 | AL212: =R[-1]C-R[-2]C4*R[-2]C -> 0 | AM212: =R[-1]C-R[-2]C4*R[-2]C -> 0 | AN212: =R[-1]C-R[-2]C4*R[-2]C -> 0 | AO212: =R[-1]C-R[-2]C4*R[-2]C -> 0 | AP212: =R[-1]C-R[-2]C4*R[-2]C -> 0 | AQ212: =R[-1]C-R[-2]C4*R[-2]C -> 0 | AR212: =R[-1]C-R[-2]C4*R[-2]C -> 0 | AS212: =R[-1]C-R[-2]C4*R[-2]C -> 0 | AT212: =R[-1]C-R[-2]C4*R[-2]C -> 0 | AU212: =R[-1]C-R[-2]C4*R[-2]C -> 0 | AV212: =R[-1]C-R[-2]C4*R[-2]C -> 0 | AW212: =R[-1]C-R[-2]C4*R[-2]C -> 0 | AX212: =R[-1]C-R[-2]C4*R[-2]C -> 0 | AY212: =R[-1]C-R[-2]C4*R[-2]C -> 0 | AZ212: =R[-1]C-R[-2]C4*R[-2]C -> 0 | BA212: =R[-1]C-R[-2]C4*R[-2]C -> 0 | BB212: =R[-1]C-R[-2]C4*R[-2]C -> 0 | BC212: =R[-1]C-R[-2]C4*R[-2]C -> 0 | BD212: =R[-1]C-R[-2]C4*R[-2]C -> 0 | BE212: =R[-1]C-R[-2]C4*R[-2]C -> 0 | BF212: =R[-1]C-R[-2]C4*R[-2]C -> 0 | BG212: =R[-1]C-R[-2]C4*R[-2]C -> 0 | BO212: =SUM(RC[-61]:RC[-8]) -> -3250
A213: Fast Start in Business Systems Analysis | B213: 2002-10-01T00:00:00.000 | C213: 3 | D213: 1800 | E213: 550 | F213: 0 | G213: 0 | H213: 0 | I213: 0 | J213: 0 | K213: 7 | L213: 0 | M213: 0 | N213: 0 | O213: 1 | P213: 0 | Q213: 0 | R213: 0 | S213: 0 | T213: 0 | U213: 0 | V213: 0 | W213: 0 | X213: 0 | Y213: 0 | Z213: 0 | AA213: 0 | AB213: 0 | AC213: 0 | AD213: 0 | AE213: 0 | AF213: 0 | AG213: 0 | AH213: 0 | AI213: 0 | AJ213: 0 | AK213: 0 | AL213: 0 | AM213: 0 | AN213: 0 | AO213: 0 | AP213: 0 | AQ213: 0 | AR213: 0 | AS213: 0 | AT213: 0 | AU213: 0 | AV213: 0 | AW213: 0 | AX213: 0 | AY213: 0 | AZ213: 0 | BA213: 0 | BB213: 0 | BC213: 0 | BD213: 0 | BE213: 0 | BF213: 0 | BG213: 13 | BK213: =SUM(RC[-57]:RC[-4]) -> 21 | BL213: =RC[-61]*RC[-1] -> 63
D214: Total | F214: =R[-1]C*R213C5 -> 0 | G214: =R[-1]C*R213C5 -> 0 | H214: =R[-1]C*R213C5 -> 0 | I214: =R[-1]C*R213C5 -> 0 | J214: =R[-1]C*R213C5 -> 0 | K214: =R[-1]C*R213C5 -> 3850 | L214: =R[-1]C*R213C5 -> 0 | M214: =R[-1]C*R213C5 -> 0 | N214: =R[-1]C*R213C5 -> 0 | O214: =R[-1]C*R213C5 -> 550 | P214: =R[-1]C*R213C5 -> 0 | Q214: =R[-1]C*R213C5 -> 0 | R214: =R[-1]C*R213C5 -> 0 | S214: =R[-1]C*R213C5 -> 0 | T214: =R[-1]C*R213C5 -> 0 | U214: =R[-1]C*R213C5 -> 0 | V214: =R[-1]C*R213C5 -> 0 | W214: =R[-1]C*R213C5 -> 0 | X214: =R[-1]C*R213C5 -> 0 | Y214: =R[-1]C*R213C5 -> 0 | Z214: =R[-1]C*R213C5 -> 0 | AA214: =R[-1]C*R213C5 -> 0 | AB214: =R[-1]C*R213C5 -> 0 | AC214: =R[-1]C*R213C5 -> 0 | AD214: =R[-1]C*R213C5 -> 0 | AE214: =R[-1]C*R213C5 -> 0 | AF214: =R[-1]C*R213C5 -> 0 | AG214: =R[-1]C*R213C5 -> 0 | AH214: =R[-1]C*R213C5 -> 0 | AI214: =R[-1]C*R213C5 -> 0 | AJ214: =R[-1]C*R213C5 -> 0 | AK214: =R[-1]C*R213C5 -> 0 | AL214: =R[-1]C*R213C5 -> 0 | AM214: =R[-1]C*R213C5 -> 0 | AN214: =R[-1]C*R213C5 -> 0 | AO214: =R[-1]C*R213C5 -> 0 | AP214: =R[-1]C*R213C5 -> 0 | AQ214: =R[-1]C*R213C5 -> 0 | AR214: =R[-1]C*R213C5 -> 0 | AS214: =R[-1]C*R213C5 -> 0 | AT214: =R[-1]C*R213C5 -> 0 | AU214: =R[-1]C*R213C5 -> 0 | AV214: =R[-1]C*R213C5 -> 0 | AW214: =R[-1]C*R213C5 -> 0 | AX214: =R[-1]C*R213C5 -> 0 | AY214: =R[-1]C*R213C5 -> 0 | AZ214: =R[-1]C*R213C5 -> 0 | BA214: =R[-1]C*R213C5 -> 0 | BB214: =R[-1]C*R213C5 -> 0 | BC214: =R[-1]C*R213C5 -> 0 | BD214: =R[-1]C*R213C5 -> 0 | BE214: =R[-1]C*R213C5 -> 0 | BF214: =R[-1]C*R213C5 -> 0 | BG214: =R[-1]C*R213C5 -> 7150 | BM214: =R[-1]C[-61]*R[-1]C[-2] -> 37800 | BN214: =RC[-1]-RC[1] -> 26250 | BO214: =SUM(RC[-61]:RC[-8]) -> 11550
D215: Total Savings | F215: =R[-1]C-R[-2]C4*R[-2]C -> 0 | G215: =R[-1]C-R[-2]C4*R[-2]C -> 0 | H215: =R[-1]C-R[-2]C4*R[-2]C -> 0 | I215: =R[-1]C-R[-2]C4*R[-2]C -> 0 | J215: =R[-1]C-R[-2]C4*R[-2]C -> 0 | K215: =R[-1]C-R[-2]C4*R[-2]C -> -8750 | L215: =R[-1]C-R[-2]C4*R[-2]C -> 0 | M215: =R[-1]C-R[-2]C4*R[-2]C -> 0 | N215: =R[-1]C-R[-2]C4*R[-2]C -> 0 | O215: =R[-1]C-R[-2]C4*R[-2]C -> -1250 | P215: =R[-1]C-R[-2]C4*R[-2]C -> 0 | Q215: =R[-1]C-R[-2]C4*R[-2]C -> 0 | R215: =R[-1]C-R[-2]C4*R[-2]C -> 0 | S215: =R[-1]C-R[-2]C4*R[-2]C -> 0 | T215: =R[-1]C-R[-2]C4*R[-2]C -> 0 | U215: =R[-1]C-R[-2]C4*R[-2]C -> 0 | V215: =R[-1]C-R[-2]C4*R[-2]C -> 0 | W215: =R[-1]C-R[-2]C4*R[-2]C -> 0 | X215: =R[-1]C-R[-2]C4*R[-2]C -> 0 | Y215: =R[-1]C-R[-2]C4*R[-2]C -> 0 | Z215: =R[-1]C-R[-2]C4*R[-2]C -> 0 | AA215: =R[-1]C-R[-2]C4*R[-2]C -> 0 | AB215: =R[-1]C-R[-2]C4*R[-2]C -> 0 | AC215: =R[-1]C-R[-2]C4*R[-2]C -> 0 | AD215: =R[-1]C-R[-2]C4*R[-2]C -> 0 | AE215: =R[-1]C-R[-2]C4*R[-2]C -> 0 | AF215: =R[-1]C-R[-2]C4*R[-2]C -> 0 | AG215: =R[-1]C-R[-2]C4*R[-2]C -> 0 | AH215: =R[-1]C-R[-2]C4*R[-2]C -> 0 | AI215: =R[-1]C-R[-2]C4*R[-2]C -> 0 | AJ215: =R[-1]C-R[-2]C4*R[-2]C -> 0 | AK215: =R[-1]C-R[-2]C4*R[-2]C -> 0 | AL215: =R[-1]C-R[-2]C4*R[-2]C -> 0 | AM215: =R[-1]C-R[-2]C4*R[-2]C -> 0 | AN215: =R[-1]C-R[-2]C4*R[-2]C -> 0 | AO215: =R[-1]C-R[-2]C4*R[-2]C -> 0 | AP215: =R[-1]C-R[-2]C4*R[-2]C -> 0 | AQ215: =R[-1]C-R[-2]C4*R[-2]C -> 0 | AR215: =R[-1]C-R[-2]C4*R[-2]C -> 0 | AS215: =R[-1]C-R[-2]C4*R[-2]C -> 0 | AT215: =R[-1]C-R[-2]C4*R[-2]C -> 0 | AU215: =R[-1]C-R[-2]C4*R[-2]C -> 0 | AV215: =R[-1]C-R[-2]C4*R[-2]C -> 0 | AW215: =R[-1]C-R[-2]C4*R[-2]C -> 0 | AX215: =R[-1]C-R[-2]C4*R[-2]C -> 0 | AY215: =R[-1]C-R[-2]C4*R[-2]C -> 0 | AZ215: =R[-1]C-R[-2]C4*R[-2]C -> 0 | BA215: =R[-1]C-R[-2]C4*R[-2]C -> 0 | BB215: =R[-1]C-R[-2]C4*R[-2]C -> 0 | BC215: =R[-1]C-R[-2]C4*R[-2]C -> 0 | BD215: =R[-1]C-R[-2]C4*R[-2]C -> 0 | BE215: =R[-1]C-R[-2]C4*R[-2]C -> 0 | BF215: =R[-1]C-R[-2]C4*R[-2]C -> 0 | BG215: =R[-1]C-R[-2]C4*R[-2]C -> -16250 | BO215: =SUM(RC[-61]:RC[-8]) -> -26250
A216: Relational Database Design | B216: 2002-10-15T00:00:00.000 | C216: 2 | D216: 1100 | E216: 450 | F216: 0 | G216: 0 | H216: 0 | I216: 0 | J216: 1 | K216: 0 | L216: 0 | M216: 0 | N216: 0 | O216: 0 | P216: 0 | Q216: 0 | R216: 0 | S216: 0 | T216: 0 | U216: 0 | V216: 0 | W216: 0 | X216: 0 | Y216: 0 | Z216: 0 | AA216: 0 | AB216: 0 | AC216: 0 | AD216: 0 | AE216: 0 | AF216: 0 | AG216: 0 | AH216: 0 | AI216: 0 | AJ216: 0 | AK216: 0 | AL216: 0 | AM216: 0 | AN216: 0 | AO216: 0 | AP216: 0 | AQ216: 0 | AR216: 0 | AS216: 0 | AT216: 0 | AU216: 0 | AV216: 0 | AW216: 0 | AX216: 0 | AY216: 0 | AZ216: 0 | BA216: 1 | BB216: 0 | BC216: 0 | BD216: 0 | BE216: 0 | BF216: 0 | BG216: 0 | BK216: =SUM(RC[-57]:RC[-4]) -> 2 | BL216: =RC[-61]*RC[-1] -> 4
D217: Total | F217: =R[-1]C*R216C5 -> 0 | G217: =R[-1]C*R216C5 -> 0 | H217: =R[-1]C*R216C5 -> 0 | I217: =R[-1]C*R216C5 -> 0 | J217: =R[-1]C*R216C5 -> 450 | K217: =R[-1]C*R216C5 -> 0 | L217: =R[-1]C*R216C5 -> 0 | M217: =R[-1]C*R216C5 -> 0 | N217: =R[-1]C*R216C5 -> 0 | O217: =R[-1]C*R216C5 -> 0 | P217: =R[-1]C*R216C5 -> 0 | Q217: =R[-1]C*R216C5 -> 0 | R217: =R[-1]C*R216C5 -> 0 | S217: =R[-1]C*R216C5 -> 0 | T217: =R[-1]C*R216C5 -> 0 | U217: =R[-1]C*R216C5 -> 0 | V217: =R[-1]C*R216C5 -> 0 | W217: =R[-1]C*R216C5 -> 0 | X217: =R[-1]C*R216C5 -> 0 | Y217: =R[-1]C*R216C5 -> 0 | Z217: =R[-1]C*R216C5 -> 0 | AA217: =R[-1]C*R216C5 -> 0 | AB217: =R[-1]C*R216C5 -> 0 | AC217: =R[-1]C*R216C5 -> 0 | AD217: =R[-1]C*R216C5 -> 0 | AE217: =R[-1]C*R216C5 -> 0 | AF217: =R[-1]C*R216C5 -> 0 | AG217: =R[-1]C*R216C5 -> 0 | AH217: =R[-1]C*R216C5 -> 0 | AI217: =R[-1]C*R216C5 -> 0 | AJ217: =R[-1]C*R216C5 -> 0 | AK217: =R[-1]C*R216C5 -> 0 | AL217: =R[-1]C*R216C5 -> 0 | AM217: =R[-1]C*R216C5 -> 0 | AN217: =R[-1]C*R216C5 -> 0 | AO217: =R[-1]C*R216C5 -> 0 | AP217: =R[-1]C*R216C5 -> 0 | AQ217: =R[-1]C*R216C5 -> 0 | AR217: =R[-1]C*R216C5 -> 0 | AS217: =R[-1]C*R216C5 -> 0 | AT217: =R[-1]C*R216C5 -> 0 | AU217: =R[-1]C*R216C5 -> 0 | AV217: =R[-1]C*R216C5 -> 0 | AW217: =R[-1]C*R216C5 -> 0 | AX217: =R[-1]C*R216C5 -> 0 | AY217: =R[-1]C*R216C5 -> 0 | AZ217: =R[-1]C*R216C5 -> 0 | BA217: =R[-1]C*R216C5 -> 450 | BB217: =R[-1]C*R216C5 -> 0 | BC217: =R[-1]C*R216C5 -> 0 | BD217: =R[-1]C*R216C5 -> 0 | BE217: =R[-1]C*R216C5 -> 0 | BF217: =R[-1]C*R216C5 -> 0 | BG217: =R[-1]C*R216C5 -> 0 | BM217: =R[-1]C[-61]*R[-1]C[-2] -> 2200 | BN217: =RC[-1]-RC[1] -> 1300 | BO217: =SUM(RC[-61]:RC[-8]) -> 900
D218: Total Savings | F218: =R[-1]C-R[-2]C4*R[-2]C -> 0 | G218: =R[-1]C-R[-2]C4*R[-2]C -> 0 | H218: =R[-1]C-R[-2]C4*R[-2]C -> 0 | I218: =R[-1]C-R[-2]C4*R[-2]C -> 0 | J218: =R[-1]C-R[-2]C4*R[-2]C -> -650 | K218: =R[-1]C-R[-2]C4*R[-2]C -> 0 | L218: =R[-1]C-R[-2]C4*R[-2]C -> 0 | M218: =R[-1]C-R[-2]C4*R[-2]C -> 0 | N218: =R[-1]C-R[-2]C4*R[-2]C -> 0 | O218: =R[-1]C-R[-2]C4*R[-2]C -> 0 | P218: =R[-1]C-R[-2]C4*R[-2]C -> 0 | Q218: =R[-1]C-R[-2]C4*R[-2]C -> 0 | R218: =R[-1]C-R[-2]C4*R[-2]C -> 0 | S218: =R[-1]C-R[-2]C4*R[-2]C -> 0 | T218: =R[-1]C-R[-2]C4*R[-2]C -> 0 | U218: =R[-1]C-R[-2]C4*R[-2]C -> 0 | V218: =R[-1]C-R[-2]C4*R[-2]C -> 0 | W218: =R[-1]C-R[-2]C4*R[-2]C -> 0 | X218: =R[-1]C-R[-2]C4*R[-2]C -> 0 | Y218: =R[-1]C-R[-2]C4*R[-2]C -> 0 | Z218: =R[-1]C-R[-2]C4*R[-2]C -> 0 | AA218: =R[-1]C-R[-2]C4*R[-2]C -> 0 | AB218: =R[-1]C-R[-2]C4*R[-2]C -> 0 | AC218: =R[-1]C-R[-2]C4*R[-2]C -> 0 | AD218: =R[-1]C-R[-2]C4*R[-2]C -> 0 | AE218: =R[-1]C-R[-2]C4*R[-2]C -> 0 | AF218: =R[-1]C-R[-2]C4*R[-2]C -> 0 | AG218: =R[-1]C-R[-2]C4*R[-2]C -> 0 | AH218: =R[-1]C-R[-2]C4*R[-2]C -> 0 | AI218: =R[-1]C-R[-2]C4*R[-2]C -> 0 | AJ218: =R[-1]C-R[-2]C4*R[-2]C -> 0 | AK218: =R[-1]C-R[-2]C4*R[-2]C -> 0 | AL218: =R[-1]C-R[-2]C4*R[-2]C -> 0 | AM218: =R[-1]C-R[-2]C4*R[-2]C -> 0 | AN218: =R[-1]C-R[-2]C4*R[-2]C -> 0 | AO218: =R[-1]C-R[-2]C4*R[-2]C -> 0 | AP218: =R[-1]C-R[-2]C4*R[-2]C -> 0 | AQ218: =R[-1]C-R[-2]C4*R[-2]C -> 0 | AR218: =R[-1]C-R[-2]C4*R[-2]C -> 0 | AS218: =R[-1]C-R[-2]C4*R[-2]C -> 0 | AT218: =R[-1]C-R[-2]C4*R[-2]C -> 0 | AU218: =R[-1]C-R[-2]C4*R[-2]C -> 0 | AV218: =R[-1]C-R[-2]C4*R[-2]C -> 0 | AW218: =R[-1]C-R[-2]C4*R[-2]C -> 0 | AX218: =R[-1]C-R[-2]C4*R[-2]C -> 0 | AY218: =R[-1]C-R[-2]C4*R[-2]C -> 0 | AZ218: =R[-1]C-R[-2]C4*R[-2]C -> 0 | BA218: =R[-1]C-R[-2]C4*R[-2]C -> -650 | BB218: =R[-1]C-R[-2]C4*R[-2]C -> 0 | BC218: =R[-1]C-R[-2]C4*R[-2]C -> 0 | BD218: =R[-1]C-R[-2]C4*R[-2]C -> 0 | BE218: =R[-1]C-R[-2]C4*R[-2]C -> 0 | BF218: =R[-1]C-R[-2]C4*R[-2]C -> 0 | BG218: =R[-1]C-R[-2]C4*R[-2]C -> 0 | BO218: =SUM(RC[-61]:RC[-8]) -> -1300
A219: Mastering the Requirements Process | B219: 2002-10-16T00:00:00.000 | C219: 2 | D219: 1175 | E219: 525 | F219: 0 | G219: 0 | H219: 0 | I219: 0 | J219: 1 | K219: 4 | L219: 0 | M219: 0 | N219: 0 | O219: 0 | P219: 0 | Q219: 0 | R219: 0 | S219: 0 | T219: 0 | U219: 0 | V219: 0 | W219: 2 | X219: 0 | Y219: 0 | Z219: 0 | AA219: 0 | AB219: 0 | AC219: 0 | AD219: 0 | AE219: 0 | AF219: 0 | AG219: 0 | AH219: 0 | AI219: 0 | AJ219: 0 | AK219: 0 | AL219: 0 | AM219: 0 | AN219: 0 | AO219: 0 | AP219: 0 | AQ219: 0 | AR219: 0 | AS219: 0 | AT219: 0 | AU219: 0 | AV219: 0 | AW219: 0 | AX219: 0 | AY219: 0 | AZ219: 0 | BA219: 0 | BB219: 0 | BC219: 0 | BD219: 0 | BE219: 1 | BF219: 0 | BG219: 15 | BK219: =SUM(RC[-57]:RC[-4]) -> 23 | BL219: =RC[-61]*RC[-1] -> 46
D220: Total | F220: =R[-1]C*R219C5 -> 0 | G220: =R[-1]C*R219C5 -> 0 | H220: =R[-1]C*R219C5 -> 0 | I220: =R[-1]C*R219C5 -> 0 | J220: =R[-1]C*R219C5 -> 525 | K220: =R[-1]C*R219C5 -> 2100 | L220: =R[-1]C*R219C5 -> 0 | M220: =R[-1]C*R219C5 -> 0 | N220: =R[-1]C*R219C5 -> 0 | O220: =R[-1]C*R219C5 -> 0 | P220: =R[-1]C*R219C5 -> 0 | Q220: =R[-1]C*R219C5 -> 0 | R220: =R[-1]C*R219C5 -> 0 | S220: =R[-1]C*R219C5 -> 0 | T220: =R[-1]C*R219C5 -> 0 | U220: =R[-1]C*R219C5 -> 0 | V220: =R[-1]C*R219C5 -> 0 | W220: =R[-1]C*R219C5 -> 1050 | X220: =R[-1]C*R219C5 -> 0 | Y220: =R[-1]C*R219C5 -> 0 | Z220: =R[-1]C*R219C5 -> 0 | AA220: =R[-1]C*R219C5 -> 0 | AB220: =R[-1]C*R219C5 -> 0 | AC220: =R[-1]C*R219C5 -> 0 | AD220: =R[-1]C*R219C5 -> 0 | AE220: =R[-1]C*R219C5 -> 0 | AF220: =R[-1]C*R219C5 -> 0 | AG220: =R[-1]C*R219C5 -> 0 | AH220: =R[-1]C*R219C5 -> 0 | AI220: =R[-1]C*R219C5 -> 0 | AJ220: =R[-1]C*R219C5 -> 0 | AK220: =R[-1]C*R219C5 -> 0 | AL220: =R[-1]C*R219C5 -> 0 | AM220: =R[-1]C*R219C5 -> 0 | AN220: =R[-1]C*R219C5 -> 0 | AO220: =R[-1]C*R219C5 -> 0 | AP220: =R[-1]C*R219C5 -> 0 | AQ220: =R[-1]C*R219C5 -> 0 | AR220: =R[-1]C*R219C5 -> 0 | AS220: =R[-1]C*R219C5 -> 0 | AT220: =R[-1]C*R219C5 -> 0 | AU220: =R[-1]C*R219C5 -> 0 | AV220: =R[-1]C*R219C5 -> 0 | AW220: =R[-1]C*R219C5 -> 0 | AX220: =R[-1]C*R219C5 -> 0 | AY220: =R[-1]C*R219C5 -> 0 | AZ220: =R[-1]C*R219C5 -> 0 | BA220: =R[-1]C*R219C5 -> 0 | BB220: =R[-1]C*R219C5 -> 0 | BC220: =R[-1]C*R219C5 -> 0 | BD220: =R[-1]C*R219C5 -> 0 | BE220: =R[-1]C*R219C5 -> 525 | BF220: =R[-1]C*R219C5 -> 0 | BG220: =R[-1]C*R219C5 -> 7875 | BM220: =R[-1]C[-61]*R[-1]C[-2] -> 27025 | BN220: =RC[-1]-RC[1] -> 14950 | BO220: =SUM(RC[-61]:RC[-8]) -> 12075
D221: Total Savings | F221: =R[-1]C-R[-2]C4*R[-2]C -> 0 | G221: =R[-1]C-R[-2]C4*R[-2]C -> 0 | H221: =R[-1]C-R[-2]C4*R[-2]C -> 0 | I221: =R[-1]C-R[-2]C4*R[-2]C -> 0 | J221: =R[-1]C-R[-2]C4*R[-2]C -> -650 | K221: =R[-1]C-R[-2]C4*R[-2]C -> -2600 | L221: =R[-1]C-R[-2]C4*R[-2]C -> 0 | M221: =R[-1]C-R[-2]C4*R[-2]C -> 0 | N221: =R[-1]C-R[-2]C4*R[-2]C -> 0 | O221: =R[-1]C-R[-2]C4*R[-2]C -> 0 | P221: =R[-1]C-R[-2]C4*R[-2]C -> 0 | Q221: =R[-1]C-R[-2]C4*R[-2]C -> 0 | R221: =R[-1]C-R[-2]C4*R[-2]C -> 0 | S221: =R[-1]C-R[-2]C4*R[-2]C -> 0 | T221: =R[-1]C-R[-2]C4*R[-2]C -> 0 | U221: =R[-1]C-R[-2]C4*R[-2]C -> 0 | V221: =R[-1]C-R[-2]C4*R[-2]C -> 0 | W221: =R[-1]C-R[-2]C4*R[-2]C -> -1300 | X221: =R[-1]C-R[-2]C4*R[-2]C -> 0 | Y221: =R[-1]C-R[-2]C4*R[-2]C -> 0 | Z221: =R[-1]C-R[-2]C4*R[-2]C -> 0 | AA221: =R[-1]C-R[-2]C4*R[-2]C -> 0 | AB221: =R[-1]C-R[-2]C4*R[-2]C -> 0 | AC221: =R[-1]C-R[-2]C4*R[-2]C -> 0 | AD221: =R[-1]C-R[-2]C4*R[-2]C -> 0 | AE221: =R[-1]C-R[-2]C4*R[-2]C -> 0 | AF221: =R[-1]C-R[-2]C4*R[-2]C -> 0 | AG221: =R[-1]C-R[-2]C4*R[-2]C -> 0 | AH221: =R[-1]C-R[-2]C4*R[-2]C -> 0 | AI221: =R[-1]C-R[-2]C4*R[-2]C -> 0 | AJ221: =R[-1]C-R[-2]C4*R[-2]C -> 0 | AK221: =R[-1]C-R[-2]C4*R[-2]C -> 0 | AL221: =R[-1]C-R[-2]C4*R[-2]C -> 0 | AM221: =R[-1]C-R[-2]C4*R[-2]C -> 0 | AN221: =R[-1]C-R[-2]C4*R[-2]C -> 0 | AO221: =R[-1]C-R[-2]C4*R[-2]C -> 0 | AP221: =R[-1]C-R[-2]C4*R[-2]C -> 0 | AQ221: =R[-1]C-R[-2]C4*R[-2]C -> 0 | AR221: =R[-1]C-R[-2]C4*R[-2]C -> 0 | AS221: =R[-1]C-R[-2]C4*R[-2]C -> 0 | AT221: =R[-1]C-R[-2]C4*R[-2]C -> 0 | AU221: =R[-1]C-R[-2]C4*R[-2]C -> 0 | AV221: =R[-1]C-R[-2]C4*R[-2]C -> 0 | AW221: =R[-1]C-R[-2]C4*R[-2]C -> 0 | AX221: =R[-1]C-R[-2]C4*R[-2]C -> 0 | AY221: =R[-1]C-R[-2]C4*R[-2]C -> 0 | AZ221: =R[-1]C-R[-2]C4*R[-2]C -> 0 | BA221: =R[-1]C-R[-2]C4*R[-2]C -> 0 | BB221: =R[-1]C-R[-2]C4*R[-2]C -> 0 | BC221: =R[-1]C-R[-2]C4*R[-2]C -> 0 | BD221: =R[-1]C-R[-2]C4*R[-2]C -> 0 | BE221: =R[-1]C-R[-2]C4*R[-2]C -> -650 | BF221: =R[-1]C-R[-2]C4*R[-2]C -> 0 | BG221: =R[-1]C-R[-2]C4*R[-2]C -> -9750 | BO221: =SUM(RC[-61]:RC[-8]) -> -14950
A222: Project Management Fundamentals | B222: 2002-10-21T00:00:00.000 | C222: 3 | D222: 2250 | E222: 550 | F222: 0 | G222: 0 | H222: 0 | I222: 0 | J222: 0 | K222: 0 | L222: 0 | M222: 0 | N222: 0 | O222: 0 | P222: 0 | Q222: 0 | R222: 0 | S222: 0 | T222: 0 | U222: 0 | V222: 0 | W222: 0 | X222: 0 | Y222: 0 | Z222: 0 | AA222: 0 | AB222: 0 | AC222: 0 | AD222: 5 | AE222: 0 | AF222: 0 | AG222: 0 | AH222: 0 | AI222: 0 | AJ222: 0 | AK222: 0 | AL222: 0 | AM222: 0 | AN222: 0 | AO222: 0 | AP222: 0 | AQ222: 0 | AR222: 0 | AS222: 0 | AT222: 0 | AU222: 0 | AV222: 0 | AW222: 0 | AX222: 0 | AY222: 0 | AZ222: 0 | BA222: 0 | BB222: 0 | BC222: 0 | BD222: 0 | BE222: 7 | BF222: 0 | BG222: 0 | BK222: =SUM(RC[-57]:RC[-4]) -> 12 | BL222: =RC[-61]*RC[-1] -> 36
D223: Total | F223: =R[-1]C*R222C5 -> 0 | G223: =R[-1]C*R222C5 -> 0 | H223: =R[-1]C*R222C5 -> 0 | I223: =R[-1]C*R222C5 -> 0 | J223: =R[-1]C*R222C5 -> 0 | K223: =R[-1]C*R222C5 -> 0 | L223: =R[-1]C*R222C5 -> 0 | M223: =R[-1]C*R222C5 -> 0 | N223: =R[-1]C*R222C5 -> 0 | O223: =R[-1]C*R222C5 -> 0 | P223: =R[-1]C*R222C5 -> 0 | Q223: =R[-1]C*R222C5 -> 0 | R223: =R[-1]C*R222C5 -> 0 | S223: =R[-1]C*R222C5 -> 0 | T223: =R[-1]C*R222C5 -> 0 | U223: =R[-1]C*R222C5 -> 0 | V223: =R[-1]C*R222C5 -> 0 | W223: =R[-1]C*R222C5 -> 0 | X223: =R[-1]C*R222C5 -> 0 | Y223: =R[-1]C*R222C5 -> 0 | Z223: =R[-1]C*R222C5 -> 0 | AA223: =R[-1]C*R222C5 -> 0 | AB223: =R[-1]C*R222C5 -> 0 | AC223: =R[-1]C*R222C5 -> 0 | AD223: =R[-1]C*R222C5 -> 2750 | AE223: =R[-1]C*R222C5 -> 0 | AF223: =R[-1]C*R222C5 -> 0 | AG223: =R[-1]C*R222C5 -> 0 | AH223: =R[-1]C*R222C5 -> 0 | AI223: =R[-1]C*R222C5 -> 0 | AJ223: =R[-1]C*R222C5 -> 0 | AK223: =R[-1]C*R222C5 -> 0 | AL223: =R[-1]C*R222C5 -> 0 | AM223: =R[-1]C*R222C5 -> 0 | AN223: =R[-1]C*R222C5 -> 0 | AO223: =R[-1]C*R222C5 -> 0 | AP223: =R[-1]C*R222C5 -> 0 | AQ223: =R[-1]C*R222C5 -> 0 | AR223: =R[-1]C*R222C5 -> 0 | AS223: =R[-1]C*R222C5 -> 0 | AT223: =R[-1]C*R222C5 -> 0 | AU223: =R[-1]C*R222C5 -> 0 | AV223: =R[-1]C*R222C5 -> 0 | AW223: =R[-1]C*R222C5 -> 0 | AX223: =R[-1]C*R222C5 -> 0 | AY223: =R[-1]C*R222C5 -> 0 | AZ223: =R[-1]C*R222C5 -> 0 | BA223: =R[-1]C*R222C5 -> 0 | BB223: =R[-1]C*R222C5 -> 0 | BC223: =R[-1]C*R222C5 -> 0 | BD223: =R[-1]C*R222C5 -> 0 | BE223: =R[-1]C*R222C5 -> 3850 | BF223: =R[-1]C*R222C5 -> 0 | BG223: =R[-1]C*R222C5 -> 0 | BM223: =R[-1]C[-61]*R[-1]C[-2] -> 27000 | BN223: =RC[-1]-RC[1] -> 20400 | BO223: =SUM(RC[-61]:RC[-8]) -> 6600
D224: Total Savings | F224: =R[-1]C-R[-2]C4*R[-2]C -> 0 | G224: =R[-1]C-R[-2]C4*R[-2]C -> 0 | H224: =R[-1]C-R[-2]C4*R[-2]C -> 0 | I224: =R[-1]C-R[-2]C4*R[-2]C -> 0 | J224: =R[-1]C-R[-2]C4*R[-2]C -> 0 | K224: =R[-1]C-R[-2]C4*R[-2]C -> 0 | L224: =R[-1]C-R[-2]C4*R[-2]C -> 0 | M224: =R[-1]C-R[-2]C4*R[-2]C -> 0 | N224: =R[-1]C-R[-2]C4*R[-2]C -> 0 | O224: =R[-1]C-R[-2]C4*R[-2]C -> 0 | P224: =R[-1]C-R[-2]C4*R[-2]C -> 0 | Q224: =R[-1]C-R[-2]C4*R[-2]C -> 0 | R224: =R[-1]C-R[-2]C4*R[-2]C -> 0 | S224: =R[-1]C-R[-2]C4*R[-2]C -> 0 | T224: =R[-1]C-R[-2]C4*R[-2]C -> 0 | U224: =R[-1]C-R[-2]C4*R[-2]C -> 0 | V224: =R[-1]C-R[-2]C4*R[-2]C -> 0 | W224: =R[-1]C-R[-2]C4*R[-2]C -> 0 | X224: =R[-1]C-R[-2]C4*R[-2]C -> 0 | Y224: =R[-1]C-R[-2]C4*R[-2]C -> 0 | Z224: =R[-1]C-R[-2]C4*R[-2]C -> 0 | AA224: =R[-1]C-R[-2]C4*R[-2]C -> 0 | AB224: =R[-1]C-R[-2]C4*R[-2]C -> 0 | AC224: =R[-1]C-R[-2]C4*R[-2]C -> 0 | AD224: =R[-1]C-R[-2]C4*R[-2]C -> -8500 | AE224: =R[-1]C-R[-2]C4*R[-2]C -> 0 | AF224: =R[-1]C-R[-2]C4*R[-2]C -> 0 | AG224: =R[-1]C-R[-2]C4*R[-2]C -> 0 | AH224: =R[-1]C-R[-2]C4*R[-2]C -> 0 | AI224: =R[-1]C-R[-2]C4*R[-2]C -> 0 | AJ224: =R[-1]C-R[-2]C4*R[-2]C -> 0 | AK224: =R[-1]C-R[-2]C4*R[-2]C -> 0 | AL224: =R[-1]C-R[-2]C4*R[-2]C -> 0 | AM224: =R[-1]C-R[-2]C4*R[-2]C -> 0 | AN224: =R[-1]C-R[-2]C4*R[-2]C -> 0 | AO224: =R[-1]C-R[-2]C4*R[-2]C -> 0 | AP224: =R[-1]C-R[-2]C4*R[-2]C -> 0 | AQ224: =R[-1]C-R[-2]C4*R[-2]C -> 0 | AR224: =R[-1]C-R[-2]C4*R[-2]C -> 0 | AS224: =R[-1]C-R[-2]C4*R[-2]C -> 0 | AT224: =R[-1]C-R[-2]C4*R[-2]C -> 0 | AU224: =R[-1]C-R[-2]C4*R[-2]C -> 0 | AV224: =R[-1]C-R[-2]C4*R[-2]C -> 0 | AW224: =R[-1]C-R[-2]C4*R[-2]C -> 0 | AX224: =R[-1]C-R[-2]C4*R[-2]C -> 0 | AY224: =R[-1]C-R[-2]C4*R[-2]C -> 0 | AZ224: =R[-1]C-R[-2]C4*R[-2]C -> 0 | BA224: =R[-1]C-R[-2]C4*R[-2]C -> 0 | BB224: =R[-1]C-R[-2]C4*R[-2]C -> 0 | BC224: =R[-1]C-R[-2]C4*R[-2]C -> 0 | BD224: =R[-1]C-R[-2]C4*R[-2]C -> 0 | BE224: =R[-1]C-R[-2]C4*R[-2]C -> -11900 | BF224: =R[-1]C-R[-2]C4*R[-2]C -> 0 | BG224: =R[-1]C-R[-2]C4*R[-2]C -> 0 | BO224: =SUM(RC[-61]:RC[-8]) -> -20400
A225: Visual Studio.Net for VB 6 Developers | B225: 2002-10-28T00:00:00.000 | C225: 2 | D225: 900 | E225: 350 | F225: 0 | G225: 0 | H225: 0 | I225: 0 | J225: 8 | K225: 0 | L225: 0 | M225: 0 | N225: 0 | O225: 0 | P225: 0 | Q225: 0 | R225: 0 | S225: 0 | T225: 0 | U225: 0 | V225: 0 | W225: 0 | X225: 0 | Y225: 0 | Z225: 0 | AA225: 0 | AB225: 0 | AC225: 0 | AD225: 0 | AE225: 0 | AF225: 0 | AG225: 0 | AH225: 0 | AI225: 0 | AJ225: 0 | AK225: 0 | AL225: 0 | AM225: 0 | AN225: 0 | AO225: 0 | AP225: 0 | AQ225: 0 | AR225: 0 | AS225: 0 | AT225: 0 | AU225: 0 | AV225: 0 | AW225: 0 | AX225: 0 | AY225: 0 | AZ225: 0 | BA225: 0 | BB225: 0 | BC225: 0 | BD225: 0 | BE225: 0 | BF225: 0 | BG225: 0 | BK225: =SUM(RC[-57]:RC[-4]) -> 8 | BL225: =RC[-61]*RC[-1] -> 16
D226: Total | F226: =R[-1]C*R225C5 -> 0 | G226: =R[-1]C*R225C5 -> 0 | H226: =R[-1]C*R225C5 -> 0 | I226: =R[-1]C*R225C5 -> 0 | J226: =R[-1]C*R225C5 -> 2800 | K226: =R[-1]C*R225C5 -> 0 | L226: =R[-1]C*R225C5 -> 0 | M226: =R[-1]C*R225C5 -> 0 | N226: =R[-1]C*R225C5 -> 0 | O226: =R[-1]C*R225C5 -> 0 | P226: =R[-1]C*R225C5 -> 0 | Q226: =R[-1]C*R225C5 -> 0 | R226: =R[-1]C*R225C5 -> 0 | S226: =R[-1]C*R225C5 -> 0 | T226: =R[-1]C*R225C5 -> 0 | U226: =R[-1]C*R225C5 -> 0 | V226: =R[-1]C*R225C5 -> 0 | W226: =R[-1]C*R225C5 -> 0 | X226: =R[-1]C*R225C5 -> 0 | Y226: =R[-1]C*R225C5 -> 0 | Z226: =R[-1]C*R225C5 -> 0 | AA226: =R[-1]C*R225C5 -> 0 | AB226: =R[-1]C*R225C5 -> 0 | AC226: =R[-1]C*R225C5 -> 0 | AD226: =R[-1]C*R225C5 -> 0 | AE226: =R[-1]C*R225C5 -> 0 | AF226: =R[-1]C*R225C5 -> 0 | AG226: =R[-1]C*R225C5 -> 0 | AH226: =R[-1]C*R225C5 -> 0 | AI226: =R[-1]C*R225C5 -> 0 | AJ226: =R[-1]C*R225C5 -> 0 | AK226: =R[-1]C*R225C5 -> 0 | AL226: =R[-1]C*R225C5 -> 0 | AM226: =R[-1]C*R225C5 -> 0 | AN226: =R[-1]C*R225C5 -> 0 | AO226: =R[-1]C*R225C5 -> 0 | AP226: =R[-1]C*R225C5 -> 0 | AQ226: =R[-1]C*R225C5 -> 0 | AR226: =R[-1]C*R225C5 -> 0 | AS226: =R[-1]C*R225C5 -> 0 | AT226: =R[-1]C*R225C5 -> 0 | AU226: =R[-1]C*R225C5 -> 0 | AV226: =R[-1]C*R225C5 -> 0 | AW226: =R[-1]C*R225C5 -> 0 | AX226: =R[-1]C*R225C5 -> 0 | AY226: =R[-1]C*R225C5 -> 0 | AZ226: =R[-1]C*R225C5 -> 0 | BA226: =R[-1]C*R225C5 -> 0 | BB226: =R[-1]C*R225C5 -> 0 | BC226: =R[-1]C*R225C5 -> 0 | BD226: =R[-1]C*R225C5 -> 0 | BE226: =R[-1]C*R225C5 -> 0 | BF226: =R[-1]C*R225C5 -> 0 | BG226: =R[-1]C*R225C5 -> 0 | BM226: =R[-1]C[-61]*R[-1]C[-2] -> 7200 | BN226: =RC[-1]-RC[1] -> 4400 | BO226: =SUM(RC[-61]:RC[-8]) -> 2800
D227: Total Savings | F227: =R[-1]C-R[-2]C4*R[-2]C -> 0 | G227: =R[-1]C-R[-2]C4*R[-2]C -> 0 | H227: =R[-1]C-R[-2]C4*R[-2]C -> 0 | I227: =R[-1]C-R[-2]C4*R[-2]C -> 0 | J227: =R[-1]C-R[-2]C4*R[-2]C -> -4400 | K227: =R[-1]C-R[-2]C4*R[-2]C -> 0 | L227: =R[-1]C-R[-2]C4*R[-2]C -> 0 | M227: =R[-1]C-R[-2]C4*R[-2]C -> 0 | N227: =R[-1]C-R[-2]C4*R[-2]C -> 0 | O227: =R[-1]C-R[-2]C4*R[-2]C -> 0 | P227: =R[-1]C-R[-2]C4*R[-2]C -> 0 | Q227: =R[-1]C-R[-2]C4*R[-2]C -> 0 | R227: =R[-1]C-R[-2]C4*R[-2]C -> 0 | S227: =R[-1]C-R[-2]C4*R[-2]C -> 0 | T227: =R[-1]C-R[-2]C4*R[-2]C -> 0 | U227: =R[-1]C-R[-2]C4*R[-2]C -> 0 | V227: =R[-1]C-R[-2]C4*R[-2]C -> 0 | W227: =R[-1]C-R[-2]C4*R[-2]C -> 0 | X227: =R[-1]C-R[-2]C4*R[-2]C -> 0 | Y227: =R[-1]C-R[-2]C4*R[-2]C -> 0 | Z227: =R[-1]C-R[-2]C4*R[-2]C -> 0 | AA227: =R[-1]C-R[-2]C4*R[-2]C -> 0 | AB227: =R[-1]C-R[-2]C4*R[-2]C -> 0 | AC227: =R[-1]C-R[-2]C4*R[-2]C -> 0 | AD227: =R[-1]C-R[-2]C4*R[-2]C -> 0 | AE227: =R[-1]C-R[-2]C4*R[-2]C -> 0 | AF227: =R[-1]C-R[-2]C4*R[-2]C -> 0 | AG227: =R[-1]C-R[-2]C4*R[-2]C -> 0 | AH227: =R[-1]C-R[-2]C4*R[-2]C -> 0 | AI227: =R[-1]C-R[-2]C4*R[-2]C -> 0 | AJ227: =R[-1]C-R[-2]C4*R[-2]C -> 0 | AK227: =R[-1]C-R[-2]C4*R[-2]C -> 0 | AL227: =R[-1]C-R[-2]C4*R[-2]C -> 0 | AM227: =R[-1]C-R[-2]C4*R[-2]C -> 0 | AN227: =R[-1]C-R[-2]C4*R[-2]C -> 0 | AO227: =R[-1]C-R[-2]C4*R[-2]C -> 0 | AP227: =R[-1]C-R[-2]C4*R[-2]C -> 0 | AQ227: =R[-1]C-R[-2]C4*R[-2]C -> 0 | AR227: =R[-1]C-R[-2]C4*R[-2]C -> 0 | AS227: =R[-1]C-R[-2]C4*R[-2]C -> 0 | AT227: =R[-1]C-R[-2]C4*R[-2]C -> 0 | AU227: =R[-1]C-R[-2]C4*R[-2]C -> 0 | AV227: =R[-1]C-R[-2]C4*R[-2]C -> 0 | AW227: =R[-1]C-R[-2]C4*R[-2]C -> 0 | AX227: =R[-1]C-R[-2]C4*R[-2]C -> 0 | AY227: =R[-1]C-R[-2]C4*R[-2]C -> 0 | AZ227: =R[-1]C-R[-2]C4*R[-2]C -> 0 | BA227: =R[-1]C-R[-2]C4*R[-2]C -> 0 | BB227: =R[-1]C-R[-2]C4*R[-2]C -> 0 | BC227: =R[-1]C-R[-2]C4*R[-2]C -> 0 | BD227: =R[-1]C-R[-2]C4*R[-2]C -> 0 | BE227: =R[-1]C-R[-2]C4*R[-2]C -> 0 | BF227: =R[-1]C-R[-2]C4*R[-2]C -> 0 | BG227: =R[-1]C-R[-2]C4*R[-2]C -> 0 | BO227: =SUM(RC[-61]:RC[-8]) -> -4400
A228: DB2 UDB for OS/390 V5 to V7 SQL & Appl. Enhance. | B228: 2002-10-29T00:00:00.000 | C228: 2 | D228: 1250 | E228: 700 | F228: 0 | G228: 0 | H228: 0 | I228: 0 | J228: 0 | K228: 0 | L228: 0 | M228: 0 | N228: 0 | O228: 0 | P228: 0 | Q228: 0 | R228: 0 | S228: 0 | T228: 0 | U228: 0 | V228: 0 | W228: 0 | X228: 0 | Y228: 0 | Z228: 0 | AA228: 0 | AB228: 0 | AC228: 0 | AD228: 0 | AE228: 0 | AF228: 0 | AG228: 0 | AH228: 0 | AI228: 0 | AJ228: 0 | AK228: 0 | AL228: 0 | AM228: 0 | AN228: 0 | AO228: 0 | AP228: 0 | AQ228: 0 | AR228: 0 | AS228: 0 | AT228: 0 | AU228: 0 | AV228: 0 | AW228: 0 | AX228: 0 | AY228: 0 | AZ228: 0 | BA228: 0 | BB228: 0 | BC228: 0 | BD228: 1 | BE228: 0 | BF228: 0 | BG228: 7 | BK228: =SUM(RC[-57]:RC[-4]) -> 8 | BL228: =RC[-61]*RC[-1] -> 16
D229: Total | F229: =R[-1]C*R228C5 -> 0 | G229: =R[-1]C*R228C5 -> 0 | H229: =R[-1]C*R228C5 -> 0 | I229: =R[-1]C*R228C5 -> 0 | J229: =R[-1]C*R228C5 -> 0 | K229: =R[-1]C*R228C5 -> 0 | L229: =R[-1]C*R228C5 -> 0 | M229: =R[-1]C*R228C5 -> 0 | N229: =R[-1]C*R228C5 -> 0 | O229: =R[-1]C*R228C5 -> 0 | P229: =R[-1]C*R228C5 -> 0 | Q229: =R[-1]C*R228C5 -> 0 | R229: =R[-1]C*R228C5 -> 0 | S229: =R[-1]C*R228C5 -> 0 | T229: =R[-1]C*R228C5 -> 0 | U229: =R[-1]C*R228C5 -> 0 | V229: =R[-1]C*R228C5 -> 0 | W229: =R[-1]C*R228C5 -> 0 | X229: =R[-1]C*R228C5 -> 0 | Y229: =R[-1]C*R228C5 -> 0 | Z229: =R[-1]C*R228C5 -> 0 | AA229: =R[-1]C*R228C5 -> 0 | AB229: =R[-1]C*R228C5 -> 0 | AC229: =R[-1]C*R228C5 -> 0 | AD229: =R[-1]C*R228C5 -> 0 | AE229: =R[-1]C*R228C5 -> 0 | AF229: =R[-1]C*R228C5 -> 0 | AG229: =R[-1]C*R228C5 -> 0 | AH229: =R[-1]C*R228C5 -> 0 | AI229: =R[-1]C*R228C5 -> 0 | AJ229: =R[-1]C*R228C5 -> 0 | AK229: =R[-1]C*R228C5 -> 0 | AL229: =R[-1]C*R228C5 -> 0 | AM229: =R[-1]C*R228C5 -> 0 | AN229: =R[-1]C*R228C5 -> 0 | AO229: =R[-1]C*R228C5 -> 0 | AP229: =R[-1]C*R228C5 -> 0 | AQ229: =R[-1]C*R228C5 -> 0 | AR229: =R[-1]C*R228C5 -> 0 | AS229: =R[-1]C*R228C5 -> 0 | AT229: =R[-1]C*R228C5 -> 0 | AU229: =R[-1]C*R228C5 -> 0 | AV229: =R[-1]C*R228C5 -> 0 | AW229: =R[-1]C*R228C5 -> 0 | AX229: =R[-1]C*R228C5 -> 0 | AY229: =R[-1]C*R228C5 -> 0 | AZ229: =R[-1]C*R228C5 -> 0 | BA229: =R[-1]C*R228C5 -> 0 | BB229: =R[-1]C*R228C5 -> 0 | BC229: =R[-1]C*R228C5 -> 0 | BD229: =R[-1]C*R228C5 -> 700 | BE229: =R[-1]C*R228C5 -> 0 | BF229: =R[-1]C*R228C5 -> 0 | BG229: =R[-1]C*R228C5 -> 4900 | BM229: =R[-1]C[-61]*R[-1]C[-2] -> 10000 | BN229: =RC[-1]-RC[1] -> 4400 | BO229: =SUM(RC[-61]:RC[-8]) -> 5600
D230: Total Savings | F230: =R[-1]C-R[-2]C4*R[-2]C -> 0 | G230: =R[-1]C-R[-2]C4*R[-2]C -> 0 | H230: =R[-1]C-R[-2]C4*R[-2]C -> 0 | I230: =R[-1]C-R[-2]C4*R[-2]C -> 0 | J230: =R[-1]C-R[-2]C4*R[-2]C -> 0 | K230: =R[-1]C-R[-2]C4*R[-2]C -> 0 | L230: =R[-1]C-R[-2]C4*R[-2]C -> 0 | M230: =R[-1]C-R[-2]C4*R[-2]C -> 0 | N230: =R[-1]C-R[-2]C4*R[-2]C -> 0 | O230: =R[-1]C-R[-2]C4*R[-2]C -> 0 | P230: =R[-1]C-R[-2]C4*R[-2]C -> 0 | Q230: =R[-1]C-R[-2]C4*R[-2]C -> 0 | R230: =R[-1]C-R[-2]C4*R[-2]C -> 0 | S230: =R[-1]C-R[-2]C4*R[-2]C -> 0 | T230: =R[-1]C-R[-2]C4*R[-2]C -> 0 | U230: =R[-1]C-R[-2]C4*R[-2]C -> 0 | V230: =R[-1]C-R[-2]C4*R[-2]C -> 0 | W230: =R[-1]C-R[-2]C4*R[-2]C -> 0 | X230: =R[-1]C-R[-2]C4*R[-2]C -> 0 | Y230: =R[-1]C-R[-2]C4*R[-2]C -> 0 | Z230: =R[-1]C-R[-2]C4*R[-2]C -> 0 | AA230: =R[-1]C-R[-2]C4*R[-2]C -> 0 | AB230: =R[-1]C-R[-2]C4*R[-2]C -> 0 | AC230: =R[-1]C-R[-2]C4*R[-2]C -> 0 | AD230: =R[-1]C-R[-2]C4*R[-2]C -> 0 | AE230: =R[-1]C-R[-2]C4*R[-2]C -> 0 | AF230: =R[-1]C-R[-2]C4*R[-2]C -> 0 | AG230: =R[-1]C-R[-2]C4*R[-2]C -> 0 | AH230: =R[-1]C-R[-2]C4*R[-2]C -> 0 | AI230: =R[-1]C-R[-2]C4*R[-2]C -> 0 | AJ230: =R[-1]C-R[-2]C4*R[-2]C -> 0 | AK230: =R[-1]C-R[-2]C4*R[-2]C -> 0 | AL230: =R[-1]C-R[-2]C4*R[-2]C -> 0 | AM230: =R[-1]C-R[-2]C4*R[-2]C -> 0 | AN230: =R[-1]C-R[-2]C4*R[-2]C -> 0 | AO230: =R[-1]C-R[-2]C4*R[-2]C -> 0 | AP230: =R[-1]C-R[-2]C4*R[-2]C -> 0 | AQ230: =R[-1]C-R[-2]C4*R[-2]C -> 0 | AR230: =R[-1]C-R[-2]C4*R[-2]C -> 0 | AS230: =R[-1]C-R[-2]C4*R[-2]C -> 0 | AT230: =R[-1]C-R[-2]C4*R[-2]C -> 0 | AU230: =R[-1]C-R[-2]C4*R[-2]C -> 0 | AV230: =R[-1]C-R[-2]C4*R[-2]C -> 0 | AW230: =R[-1]C-R[-2]C4*R[-2]C -> 0 | AX230: =R[-1]C-R[-2]C4*R[-2]C -> 0 | AY230: =R[-1]C-R[-2]C4*R[-2]C -> 0 | AZ230: =R[-1]C-R[-2]C4*R[-2]C -> 0 | BA230: =R[-1]C-R[-2]C4*R[-2]C -> 0 | BB230: =R[-1]C-R[-2]C4*R[-2]C -> 0 | BC230: =R[-1]C-R[-2]C4*R[-2]C -> 0 | BD230: =R[-1]C-R[-2]C4*R[-2]C -> -550 | BE230: =R[-1]C-R[-2]C4*R[-2]C -> 0 | BF230: =R[-1]C-R[-2]C4*R[-2]C -> 0 | BG230: =R[-1]C-R[-2]C4*R[-2]C -> -3850 | BO230: =SUM(RC[-61]:RC[-8]) -> -4400
A231: MS Project 2000 | B231: 2002-10-30T00:00:00.000 | C231: 3 | D231: 1200 | E231: 184 | F231: 0 | G231: 0 | H231: 0 | I231: 0 | J231: 4 | K231: 2 | L231: 0 | M231: 0 | N231: 0 | O231: 0 | P231: 0 | Q231: 0 | R231: 0 | S231: 0 | T231: 0 | U231: 0 | V231: 0 | W231: 0 | X231: 0 | Y231: 0 | Z231: 0 | AA231: 0 | AB231: 0 | AC231: 0 | AD231: 7 | AE231: 0 | AF231: 0 | AG231: 0 | AH231: 0 | AI231: 0 | AJ231: 0 | AK231: 0 | AL231: 0 | AM231: 0 | AN231: 0 | AO231: 0 | AP231: 0 | AQ231: 0 | AR231: 0 | AS231: 0 | AT231: 0 | AU231: 0 | AV231: 0 | AW231: 0 | AX231: 0 | AY231: 0 | AZ231: 0 | BA231: 0 | BB231: 0 | BC231: 0 | BD231: 0 | BE231: 0 | BF231: 0 | BG231: 0 | BK231: =SUM(RC[-57]:RC[-4]) -> 13 | BL231: =RC[-61]*RC[-1] -> 39
D232: Total | F232: =R[-1]C*R231C5 -> 0 | G232: =R[-1]C*R231C5 -> 0 | H232: =R[-1]C*R231C5 -> 0 | I232: =R[-1]C*R231C5 -> 0 | J232: =R[-1]C*R231C5 -> 736 | K232: =R[-1]C*R231C5 -> 368 | L232: =R[-1]C*R231C5 -> 0 | M232: =R[-1]C*R231C5 -> 0 | N232: =R[-1]C*R231C5 -> 0 | O232: =R[-1]C*R231C5 -> 0 | P232: =R[-1]C*R231C5 -> 0 | Q232: =R[-1]C*R231C5 -> 0 | R232: =R[-1]C*R231C5 -> 0 | S232: =R[-1]C*R231C5 -> 0 | T232: =R[-1]C*R231C5 -> 0 | U232: =R[-1]C*R231C5 -> 0 | V232: =R[-1]C*R231C5 -> 0 | W232: =R[-1]C*R231C5 -> 0 | X232: =R[-1]C*R231C5 -> 0 | Y232: =R[-1]C*R231C5 -> 0 | Z232: =R[-1]C*R231C5 -> 0 | AA232: =R[-1]C*R231C5 -> 0 | AB232: =R[-1]C*R231C5 -> 0 | AC232: =R[-1]C*R231C5 -> 0 | AD232: =R[-1]C*R231C5 -> 1288 | AE232: =R[-1]C*R231C5 -> 0 | AF232: =R[-1]C*R231C5 -> 0 | AG232: =R[-1]C*R231C5 -> 0 | AH232: =R[-1]C*R231C5 -> 0 | AI232: =R[-1]C*R231C5 -> 0 | AJ232: =R[-1]C*R231C5 -> 0 | AK232: =R[-1]C*R231C5 -> 0 | AL232: =R[-1]C*R231C5 -> 0 | AM232: =R[-1]C*R231C5 -> 0 | AN232: =R[-1]C*R231C5 -> 0 | AO232: =R[-1]C*R231C5 -> 0 | AP232: =R[-1]C*R231C5 -> 0 | AQ232: =R[-1]C*R231C5 -> 0 | AR232: =R[-1]C*R231C5 -> 0 | AS232: =R[-1]C*R231C5 -> 0 | AT232: =R[-1]C*R231C5 -> 0 | AU232: =R[-1]C*R231C5 -> 0 | AV232: =R[-1]C*R231C5 -> 0 | AW232: =R[-1]C*R231C5 -> 0 | AX232: =R[-1]C*R231C5 -> 0 | AY232: =R[-1]C*R231C5 -> 0 | AZ232: =R[-1]C*R231C5 -> 0 | BA232: =R[-1]C*R231C5 -> 0 | BB232: =R[-1]C*R231C5 -> 0 | BC232: =R[-1]C*R231C5 -> 0 | BD232: =R[-1]C*R231C5 -> 0 | BE232: =R[-1]C*R231C5 -> 0 | BF232: =R[-1]C*R231C5 -> 0 | BG232: =R[-1]C*R231C5 -> 0 | BM232: =R[-1]C[-61]*R[-1]C[-2] -> 15600 | BN232: =RC[-1]-RC[1] -> 13208 | BO232: =SUM(RC[-61]:RC[-8]) -> 2392
D233: Total Savings | F233: =R[-1]C-R[-2]C4*R[-2]C -> 0 | G233: =R[-1]C-R[-2]C4*R[-2]C -> 0 | H233: =R[-1]C-R[-2]C4*R[-2]C -> 0 | I233: =R[-1]C-R[-2]C4*R[-2]C -> 0 | J233: =R[-1]C-R[-2]C4*R[-2]C -> -4064 | K233: =R[-1]C-R[-2]C4*R[-2]C -> -2032 | L233: =R[-1]C-R[-2]C4*R[-2]C -> 0 | M233: =R[-1]C-R[-2]C4*R[-2]C -> 0 | N233: =R[-1]C-R[-2]C4*R[-2]C -> 0 | O233: =R[-1]C-R[-2]C4*R[-2]C -> 0 | P233: =R[-1]C-R[-2]C4*R[-2]C -> 0 | Q233: =R[-1]C-R[-2]C4*R[-2]C -> 0 | R233: =R[-1]C-R[-2]C4*R[-2]C -> 0 | S233: =R[-1]C-R[-2]C4*R[-2]C -> 0 | T233: =R[-1]C-R[-2]C4*R[-2]C -> 0 | U233: =R[-1]C-R[-2]C4*R[-2]C -> 0 | V233: =R[-1]C-R[-2]C4*R[-2]C -> 0 | W233: =R[-1]C-R[-2]C4*R[-2]C -> 0 | X233: =R[-1]C-R[-2]C4*R[-2]C -> 0 | Y233: =R[-1]C-R[-2]C4*R[-2]C -> 0 | Z233: =R[-1]C-R[-2]C4*R[-2]C -> 0 | AA233: =R[-1]C-R[-2]C4*R[-2]C -> 0 | AB233: =R[-1]C-R[-2]C4*R[-2]C -> 0 | AC233: =R[-1]C-R[-2]C4*R[-2]C -> 0 | AD233: =R[-1]C-R[-2]C4*R[-2]C -> -7112 | AE233: =R[-1]C-R[-2]C4*R[-2]C -> 0 | AF233: =R[-1]C-R[-2]C4*R[-2]C -> 0 | AG233: =R[-1]C-R[-2]C4*R[-2]C -> 0 | AH233: =R[-1]C-R[-2]C4*R[-2]C -> 0 | AI233: =R[-1]C-R[-2]C4*R[-2]C -> 0 | AJ233: =R[-1]C-R[-2]C4*R[-2]C -> 0 | AK233: =R[-1]C-R[-2]C4*R[-2]C -> 0 | AL233: =R[-1]C-R[-2]C4*R[-2]C -> 0 | AM233: =R[-1]C-R[-2]C4*R[-2]C -> 0 | AN233: =R[-1]C-R[-2]C4*R[-2]C -> 0 | AO233: =R[-1]C-R[-2]C4*R[-2]C -> 0 | AP233: =R[-1]C-R[-2]C4*R[-2]C -> 0 | AQ233: =R[-1]C-R[-2]C4*R[-2]C -> 0 | AR233: =R[-1]C-R[-2]C4*R[-2]C -> 0 | AS233: =R[-1]C-R[-2]C4*R[-2]C -> 0 | AT233: =R[-1]C-R[-2]C4*R[-2]C -> 0 | AU233: =R[-1]C-R[-2]C4*R[-2]C -> 0 | AV233: =R[-1]C-R[-2]C4*R[-2]C -> 0 | AW233: =R[-1]C-R[-2]C4*R[-2]C -> 0 | AX233: =R[-1]C-R[-2]C4*R[-2]C -> 0 | AY233: =R[-1]C-R[-2]C4*R[-2]C -> 0 | AZ233: =R[-1]C-R[-2]C4*R[-2]C -> 0 | BA233: =R[-1]C-R[-2]C4*R[-2]C -> 0 | BB233: =R[-1]C-R[-2]C4*R[-2]C -> 0 | BC233: =R[-1]C-R[-2]C4*R[-2]C -> 0 | BD233: =R[-1]C-R[-2]C4*R[-2]C -> 0 | BE233: =R[-1]C-R[-2]C4*R[-2]C -> 0 | BF233: =R[-1]C-R[-2]C4*R[-2]C -> 0 | BG233: =R[-1]C-R[-2]C4*R[-2]C -> 0 | BO233: =SUM(RC[-61]:RC[-8]) -> -13208
A234: DB2 UDB Stored Procedures (lecture) | B234: 2002-10-31T00:00:00.000 | C234: 2 | D234: 1250 | E234: 650 | F234: 8 | G234: 0 | H234: 0 | I234: 0 | J234: 0 | K234: 0 | L234: 0 | M234: 0 | N234: 0 | O234: 0 | P234: 0 | Q234: 0 | R234: 0 | S234: 0 | T234: 0 | U234: 0 | V234: 0 | W234: 0 | X234: 0 | Y234: 0 | Z234: 0 | AA234: 0 | AB234: 0 | AC234: 0 | AD234: 0 | AE234: 0 | AF234: 0 | AG234: 0 | AH234: 0 | AI234: 0 | AJ234: 0 | AK234: 0 | AL234: 0 | AM234: 0 | AN234: 0 | AO234: 0 | AP234: 0 | AQ234: 0 | AR234: 0 | AS234: 0 | AT234: 0 | AU234: 0 | AV234: 0 | AW234: 0 | AX234: 0 | AY234: 0 | AZ234: 2 | BA234: 0 | BB234: 0 | BC234: 0 | BD234: 0 | BE234: 0 | BF234: 1 | BG234: 0 | BK234: =SUM(RC[-57]:RC[-4]) -> 11 | BL234: =RC[-61]*RC[-1] -> 22
D235: Total | F235: =R[-1]C*R234C5 -> 5200 | G235: =R[-1]C*R234C5 -> 0 | H235: =R[-1]C*R234C5 -> 0 | I235: =R[-1]C*R234C5 -> 0 | J235: =R[-1]C*R234C5 -> 0 | K235: =R[-1]C*R234C5 -> 0 | L235: =R[-1]C*R234C5 -> 0 | M235: =R[-1]C*R234C5 -> 0 | N235: =R[-1]C*R234C5 -> 0 | O235: =R[-1]C*R234C5 -> 0 | P235: =R[-1]C*R234C5 -> 0 | Q235: =R[-1]C*R234C5 -> 0 | R235: =R[-1]C*R234C5 -> 0 | S235: =R[-1]C*R234C5 -> 0 | T235: =R[-1]C*R234C5 -> 0 | U235: =R[-1]C*R234C5 -> 0 | V235: =R[-1]C*R234C5 -> 0 | W235: =R[-1]C*R234C5 -> 0 | X235: =R[-1]C*R234C5 -> 0 | Y235: =R[-1]C*R234C5 -> 0 | Z235: =R[-1]C*R234C5 -> 0 | AA235: =R[-1]C*R234C5 -> 0 | AB235: =R[-1]C*R234C5 -> 0 | AC235: =R[-1]C*R234C5 -> 0 | AD235: =R[-1]C*R234C5 -> 0 | AE235: =R[-1]C*R234C5 -> 0 | AF235: =R[-1]C*R234C5 -> 0 | AG235: =R[-1]C*R234C5 -> 0 | AH235: =R[-1]C*R234C5 -> 0 | AI235: =R[-1]C*R234C5 -> 0 | AJ235: =R[-1]C*R234C5 -> 0 | AK235: =R[-1]C*R234C5 -> 0 | AL235: =R[-1]C*R234C5 -> 0 | AM235: =R[-1]C*R234C5 -> 0 | AN235: =R[-1]C*R234C5 -> 0 | AO235: =R[-1]C*R234C5 -> 0 | AP235: =R[-1]C*R234C5 -> 0 | AQ235: =R[-1]C*R234C5 -> 0 | AR235: =R[-1]C*R234C5 -> 0 | AS235: =R[-1]C*R234C5 -> 0 | AT235: =R[-1]C*R234C5 -> 0 | AU235: =R[-1]C*R234C5 -> 0 | AV235: =R[-1]C*R234C5 -> 0 | AW235: =R[-1]C*R234C5 -> 0 | AX235: =R[-1]C*R234C5 -> 0 | AY235: =R[-1]C*R234C5 -> 0 | AZ235: =R[-1]C*R234C5 -> 1300 | BA235: =R[-1]C*R234C5 -> 0 | BB235: =R[-1]C*R234C5 -> 0 | BC235: =R[-1]C*R234C5 -> 0 | BD235: =R[-1]C*R234C5 -> 0 | BE235: =R[-1]C*R234C5 -> 0 | BF235: =R[-1]C*R234C5 -> 650 | BG235: =R[-1]C*R234C5 -> 0 | BM235: =R[-1]C[-61]*R[-1]C[-2] -> 13750 | BN235: =RC[-1]-RC[1] -> 6600 | BO235: =SUM(RC[-61]:RC[-8]) -> 7150
D236: Total Savings | F236: =R[-1]C-R[-2]C4*R[-2]C -> -4800 | G236: =R[-1]C-R[-2]C4*R[-2]C -> 0 | H236: =R[-1]C-R[-2]C4*R[-2]C -> 0 | I236: =R[-1]C-R[-2]C4*R[-2]C -> 0 | J236: =R[-1]C-R[-2]C4*R[-2]C -> 0 | K236: =R[-1]C-R[-2]C4*R[-2]C -> 0 | L236: =R[-1]C-R[-2]C4*R[-2]C -> 0 | M236: =R[-1]C-R[-2]C4*R[-2]C -> 0 | N236: =R[-1]C-R[-2]C4*R[-2]C -> 0 | O236: =R[-1]C-R[-2]C4*R[-2]C -> 0 | P236: =R[-1]C-R[-2]C4*R[-2]C -> 0 | Q236: =R[-1]C-R[-2]C4*R[-2]C -> 0 | R236: =R[-1]C-R[-2]C4*R[-2]C -> 0 | S236: =R[-1]C-R[-2]C4*R[-2]C -> 0 | T236: =R[-1]C-R[-2]C4*R[-2]C -> 0 | U236: =R[-1]C-R[-2]C4*R[-2]C -> 0 | V236: =R[-1]C-R[-2]C4*R[-2]C -> 0 | W236: =R[-1]C-R[-2]C4*R[-2]C -> 0 | X236: =R[-1]C-R[-2]C4*R[-2]C -> 0 | Y236: =R[-1]C-R[-2]C4*R[-2]C -> 0 | Z236: =R[-1]C-R[-2]C4*R[-2]C -> 0 | AA236: =R[-1]C-R[-2]C4*R[-2]C -> 0 | AB236: =R[-1]C-R[-2]C4*R[-2]C -> 0 | AC236: =R[-1]C-R[-2]C4*R[-2]C -> 0 | AD236: =R[-1]C-R[-2]C4*R[-2]C -> 0 | AE236: =R[-1]C-R[-2]C4*R[-2]C -> 0 | AF236: =R[-1]C-R[-2]C4*R[-2]C -> 0 | AG236: =R[-1]C-R[-2]C4*R[-2]C -> 0 | AH236: =R[-1]C-R[-2]C4*R[-2]C -> 0 | AI236: =R[-1]C-R[-2]C4*R[-2]C -> 0 | AJ236: =R[-1]C-R[-2]C4*R[-2]C -> 0 | AK236: =R[-1]C-R[-2]C4*R[-2]C -> 0 | AL236: =R[-1]C-R[-2]C4*R[-2]C -> 0 | AM236: =R[-1]C-R[-2]C4*R[-2]C -> 0 | AN236: =R[-1]C-R[-2]C4*R[-2]C -> 0 | AO236: =R[-1]C-R[-2]C4*R[-2]C -> 0 | AP236: =R[-1]C-R[-2]C4*R[-2]C -> 0 | AQ236: =R[-1]C-R[-2]C4*R[-2]C -> 0 | AR236: =R[-1]C-R[-2]C4*R[-2]C -> 0 | AS236: =R[-1]C-R[-2]C4*R[-2]C -> 0 | AT236: =R[-1]C-R[-2]C4*R[-2]C -> 0 | AU236: =R[-1]C-R[-2]C4*R[-2]C -> 0 | AV236: =R[-1]C-R[-2]C4*R[-2]C -> 0 | AW236: =R[-1]C-R[-2]C4*R[-2]C -> 0 | AX236: =R[-1]C-R[-2]C4*R[-2]C -> 0 | AY236: =R[-1]C-R[-2]C4*R[-2]C -> 0 | AZ236: =R[-1]C-R[-2]C4*R[-2]C -> -1200 | BA236: =R[-1]C-R[-2]C4*R[-2]C -> 0 | BB236: =R[-1]C-R[-2]C4*R[-2]C -> 0 | BC236: =R[-1]C-R[-2]C4*R[-2]C -> 0 | BD236: =R[-1]C-R[-2]C4*R[-2]C -> 0 | BE236: =R[-1]C-R[-2]C4*R[-2]C -> 0 | BF236: =R[-1]C-R[-2]C4*R[-2]C -> -600 | BG236: =R[-1]C-R[-2]C4*R[-2]C -> 0 | BO236: =SUM(RC[-61]:RC[-8]) -> -6600
A237: Survival Skills for Analysts | B237: 2002-11-04T00:00:00.000 | C237: 2 | D237: 1175 | E237: 525 | F237: 0 | G237: 0 | H237: 0 | I237: 0 | J237: 0 | K237: 7 | L237: 0 | M237: 0 | N237: 0 | O237: 0 | P237: 0 | Q237: 0 | R237: 0 | S237: 0 | T237: 0 | U237: 0 | V237: 0 | W237: 0 | X237: 0 | Y237: 0 | Z237: 0 | AA237: 0 | AB237: 0 | AC237: 0 | AD237: 0 | AE237: 0 | AF237: 0 | AG237: 0 | AH237: 0 | AI237: 0 | AJ237: 0 | AK237: 0 | AL237: 0 | AM237: 0 | AN237: 0 | AO237: 0 | AP237: 0 | AQ237: 0 | AR237: 0 | AS237: 0 | AT237: 0 | AU237: 0 | AV237: 0 | AW237: 0 | AX237: 0 | AY237: 0 | AZ237: 0 | BA237: 0 | BB237: 0 | BC237: 0 | BD237: 0 | BE237: 0 | BF237: 0 | BG237: 13 | BK237: =SUM(RC[-57]:RC[-4]) -> 20 | BL237: =RC[-61]*RC[-1] -> 40
D238: Total | F238: =R[-1]C*R237C5 -> 0 | G238: =R[-1]C*R237C5 -> 0 | H238: =R[-1]C*R237C5 -> 0 | I238: =R[-1]C*R237C5 -> 0 | J238: =R[-1]C*R237C5 -> 0 | K238: =R[-1]C*R237C5 -> 3675 | L238: =R[-1]C*R237C5 -> 0 | M238: =R[-1]C*R237C5 -> 0 | N238: =R[-1]C*R237C5 -> 0 | O238: =R[-1]C*R237C5 -> 0 | P238: =R[-1]C*R237C5 -> 0 | Q238: =R[-1]C*R237C5 -> 0 | R238: =R[-1]C*R237C5 -> 0 | S238: =R[-1]C*R237C5 -> 0 | T238: =R[-1]C*R237C5 -> 0 | U238: =R[-1]C*R237C5 -> 0 | V238: =R[-1]C*R237C5 -> 0 | W238: =R[-1]C*R237C5 -> 0 | X238: =R[-1]C*R237C5 -> 0 | Y238: =R[-1]C*R237C5 -> 0 | Z238: =R[-1]C*R237C5 -> 0 | AA238: =R[-1]C*R237C5 -> 0 | AB238: =R[-1]C*R237C5 -> 0 | AC238: =R[-1]C*R237C5 -> 0 | AD238: =R[-1]C*R237C5 -> 0 | AE238: =R[-1]C*R237C5 -> 0 | AF238: =R[-1]C*R237C5 -> 0 | AG238: =R[-1]C*R237C5 -> 0 | AH238: =R[-1]C*R237C5 -> 0 | AI238: =R[-1]C*R237C5 -> 0 | AJ238: =R[-1]C*R237C5 -> 0 | AK238: =R[-1]C*R237C5 -> 0 | AL238: =R[-1]C*R237C5 -> 0 | AM238: =R[-1]C*R237C5 -> 0 | AN238: =R[-1]C*R237C5 -> 0 | AO238: =R[-1]C*R237C5 -> 0 | AP238: =R[-1]C*R237C5 -> 0 | AQ238: =R[-1]C*R237C5 -> 0 | AR238: =R[-1]C*R237C5 -> 0 | AS238: =R[-1]C*R237C5 -> 0 | AT238: =R[-1]C*R237C5 -> 0 | AU238: =R[-1]C*R237C5 -> 0 | AV238: =R[-1]C*R237C5 -> 0 | AW238: =R[-1]C*R237C5 -> 0 | AX238: =R[-1]C*R237C5 -> 0 | AY238: =R[-1]C*R237C5 -> 0 | AZ238: =R[-1]C*R237C5 -> 0 | BA238: =R[-1]C*R237C5 -> 0 | BB238: =R[-1]C*R237C5 -> 0 | BC238: =R[-1]C*R237C5 -> 0 | BD238: =R[-1]C*R237C5 -> 0 | BE238: =R[-1]C*R237C5 -> 0 | BF238: =R[-1]C*R237C5 -> 0 | BG238: =R[-1]C*R237C5 -> 6825 | BM238: =R[-1]C[-61]*R[-1]C[-2] -> 23500 | BN238: =RC[-1]-RC[1] -> 13000 | BO238: =SUM(RC[-61]:RC[-8]) -> 10500
D239: Total Savings | F239: =R[-1]C-R[-2]C4*R[-2]C -> 0 | G239: =R[-1]C-R[-2]C4*R[-2]C -> 0 | H239: =R[-1]C-R[-2]C4*R[-2]C -> 0 | I239: =R[-1]C-R[-2]C4*R[-2]C -> 0 | J239: =R[-1]C-R[-2]C4*R[-2]C -> 0 | K239: =R[-1]C-R[-2]C4*R[-2]C -> -4550 | L239: =R[-1]C-R[-2]C4*R[-2]C -> 0 | M239: =R[-1]C-R[-2]C4*R[-2]C -> 0 | N239: =R[-1]C-R[-2]C4*R[-2]C -> 0 | O239: =R[-1]C-R[-2]C4*R[-2]C -> 0 | P239: =R[-1]C-R[-2]C4*R[-2]C -> 0 | Q239: =R[-1]C-R[-2]C4*R[-2]C -> 0 | R239: =R[-1]C-R[-2]C4*R[-2]C -> 0 | S239: =R[-1]C-R[-2]C4*R[-2]C -> 0 | T239: =R[-1]C-R[-2]C4*R[-2]C -> 0 | U239: =R[-1]C-R[-2]C4*R[-2]C -> 0 | V239: =R[-1]C-R[-2]C4*R[-2]C -> 0 | W239: =R[-1]C-R[-2]C4*R[-2]C -> 0 | X239: =R[-1]C-R[-2]C4*R[-2]C -> 0 | Y239: =R[-1]C-R[-2]C4*R[-2]C -> 0 | Z239: =R[-1]C-R[-2]C4*R[-2]C -> 0 | AA239: =R[-1]C-R[-2]C4*R[-2]C -> 0 | AB239: =R[-1]C-R[-2]C4*R[-2]C -> 0 | AC239: =R[-1]C-R[-2]C4*R[-2]C -> 0 | AD239: =R[-1]C-R[-2]C4*R[-2]C -> 0 | AE239: =R[-1]C-R[-2]C4*R[-2]C -> 0 | AF239: =R[-1]C-R[-2]C4*R[-2]C -> 0 | AG239: =R[-1]C-R[-2]C4*R[-2]C -> 0 | AH239: =R[-1]C-R[-2]C4*R[-2]C -> 0 | AI239: =R[-1]C-R[-2]C4*R[-2]C -> 0 | AJ239: =R[-1]C-R[-2]C4*R[-2]C -> 0 | AK239: =R[-1]C-R[-2]C4*R[-2]C -> 0 | AL239: =R[-1]C-R[-2]C4*R[-2]C -> 0 | AM239: =R[-1]C-R[-2]C4*R[-2]C -> 0 | AN239: =R[-1]C-R[-2]C4*R[-2]C -> 0 | AO239: =R[-1]C-R[-2]C4*R[-2]C -> 0 | AP239: =R[-1]C-R[-2]C4*R[-2]C -> 0 | AQ239: =R[-1]C-R[-2]C4*R[-2]C -> 0 | AR239: =R[-1]C-R[-2]C4*R[-2]C -> 0 | AS239: =R[-1]C-R[-2]C4*R[-2]C -> 0 | AT239: =R[-1]C-R[-2]C4*R[-2]C -> 0 | AU239: =R[-1]C-R[-2]C4*R[-2]C -> 0 | AV239: =R[-1]C-R[-2]C4*R[-2]C -> 0 | AW239: =R[-1]C-R[-2]C4*R[-2]C -> 0 | AX239: =R[-1]C-R[-2]C4*R[-2]C -> 0 | AY239: =R[-1]C-R[-2]C4*R[-2]C -> 0 | AZ239: =R[-1]C-R[-2]C4*R[-2]C -> 0 | BA239: =R[-1]C-R[-2]C4*R[-2]C -> 0 | BB239: =R[-1]C-R[-2]C4*R[-2]C -> 0 | BC239: =R[-1]C-R[-2]C4*R[-2]C -> 0 | BD239: =R[-1]C-R[-2]C4*R[-2]C -> 0 | BE239: =R[-1]C-R[-2]C4*R[-2]C -> 0 | BF239: =R[-1]C-R[-2]C4*R[-2]C -> 0 | BG239: =R[-1]C-R[-2]C4*R[-2]C -> -8450 | BO239: =SUM(RC[-61]:RC[-8]) -> -13000
A240: Consulting Skills for the IS Professional | B240: 2002-11-05T00:00:00.000 | C240: 2 | D240: 1395 | E240: 744 | F240: 0 | G240: 0 | H240: 0 | I240: 0 | J240: 0 | K240: 0 | L240: 0 | M240: 0 | N240: 0 | O240: 0 | P240: 0 | Q240: 0 | R240: 0 | S240: 0 | T240: 0 | U240: 0 | V240: 0 | W240: 0 | X240: 0 | Y240: 0 | Z240: 0 | AA240: 0 | AB240: 0 | AC240: 0 | AD240: 0 | AE240: 0 | AF240: 0 | AG240: 0 | AH240: 0 | AI240: 0 | AJ240: 0 | AK240: 0 | AL240: 0 | AM240: 0 | AN240: 0 | AO240: 7 | AP240: 0 | AQ240: 0 | AR240: 0 | AS240: 0 | AT240: 0 | AU240: 0 | AV240: 0 | AW240: 0 | AX240: 0 | AY240: 0 | AZ240: 0 | BA240: 0 | BB240: 0 | BC240: 0 | BD240: 0 | BE240: 0 | BF240: 0 | BG240: 0 | BK240: =SUM(RC[-57]:RC[-4]) -> 7 | BL240: =RC[-61]*RC[-1] -> 14
D241: Total | F241: =R[-1]C*R240C5 -> 0 | G241: =R[-1]C*R240C5 -> 0 | H241: =R[-1]C*R240C5 -> 0 | I241: =R[-1]C*R240C5 -> 0 | J241: =R[-1]C*R240C5 -> 0 | K241: =R[-1]C*R240C5 -> 0 | L241: =R[-1]C*R240C5 -> 0 | M241: =R[-1]C*R240C5 -> 0 | N241: =R[-1]C*R240C5 -> 0 | O241: =R[-1]C*R240C5 -> 0 | P241: =R[-1]C*R240C5 -> 0 | Q241: =R[-1]C*R240C5 -> 0 | R241: =R[-1]C*R240C5 -> 0 | S241: =R[-1]C*R240C5 -> 0 | T241: =R[-1]C*R240C5 -> 0 | U241: =R[-1]C*R240C5 -> 0 | V241: =R[-1]C*R240C5 -> 0 | W241: =R[-1]C*R240C5 -> 0 | X241: =R[-1]C*R240C5 -> 0 | Y241: =R[-1]C*R240C5 -> 0 | Z241: =R[-1]C*R240C5 -> 0 | AA241: =R[-1]C*R240C5 -> 0 | AB241: =R[-1]C*R240C5 -> 0 | AC241: =R[-1]C*R240C5 -> 0 | AD241: =R[-1]C*R240C5 -> 0 | AE241: =R[-1]C*R240C5 -> 0 | AF241: =R[-1]C*R240C5 -> 0 | AG241: =R[-1]C*R240C5 -> 0 | AH241: =R[-1]C*R240C5 -> 0 | AI241: =R[-1]C*R240C5 -> 0 | AJ241: =R[-1]C*R240C5 -> 0 | AK241: =R[-1]C*R240C5 -> 0 | AL241: =R[-1]C*R240C5 -> 0 | AM241: =R[-1]C*R240C5 -> 0 | AN241: =R[-1]C*R240C5 -> 0 | AO241: =R[-1]C*R240C5 -> 5208 | AP241: =R[-1]C*R240C5 -> 0 | AQ241: =R[-1]C*R240C5 -> 0 | AR241: =R[-1]C*R240C5 -> 0 | AS241: =R[-1]C*R240C5 -> 0 | AT241: =R[-1]C*R240C5 -> 0 | AU241: =R[-1]C*R240C5 -> 0 | AV241: =R[-1]C*R240C5 -> 0 | AW241: =R[-1]C*R240C5 -> 0 | AX241: =R[-1]C*R240C5 -> 0 | AY241: =R[-1]C*R240C5 -> 0 | AZ241: =R[-1]C*R240C5 -> 0 | BA241: =R[-1]C*R240C5 -> 0 | BB241: =R[-1]C*R240C5 -> 0 | BC241: =R[-1]C*R240C5 -> 0 | BD241: =R[-1]C*R240C5 -> 0 | BE241: =R[-1]C*R240C5 -> 0 | BF241: =R[-1]C*R240C5 -> 0 | BG241: =R[-1]C*R240C5 -> 0 | BM241: =R[-1]C[-61]*R[-1]C[-2] -> 9765 | BN241: =RC[-1]-RC[1] -> 4557 | BO241: =SUM(RC[-61]:RC[-8]) -> 5208
D242: Total Savings | F242: =R[-1]C-R[-2]C4*R[-2]C -> 0 | G242: =R[-1]C-R[-2]C4*R[-2]C -> 0 | H242: =R[-1]C-R[-2]C4*R[-2]C -> 0 | I242: =R[-1]C-R[-2]C4*R[-2]C -> 0 | J242: =R[-1]C-R[-2]C4*R[-2]C -> 0 | K242: =R[-1]C-R[-2]C4*R[-2]C -> 0 | L242: =R[-1]C-R[-2]C4*R[-2]C -> 0 | M242: =R[-1]C-R[-2]C4*R[-2]C -> 0 | N242: =R[-1]C-R[-2]C4*R[-2]C -> 0 | O242: =R[-1]C-R[-2]C4*R[-2]C -> 0 | P242: =R[-1]C-R[-2]C4*R[-2]C -> 0 | Q242: =R[-1]C-R[-2]C4*R[-2]C -> 0 | R242: =R[-1]C-R[-2]C4*R[-2]C -> 0 | S242: =R[-1]C-R[-2]C4*R[-2]C -> 0 | T242: =R[-1]C-R[-2]C4*R[-2]C -> 0 | U242: =R[-1]C-R[-2]C4*R[-2]C -> 0 | V242: =R[-1]C-R[-2]C4*R[-2]C -> 0 | W242: =R[-1]C-R[-2]C4*R[-2]C -> 0 | X242: =R[-1]C-R[-2]C4*R[-2]C -> 0 | Y242: =R[-1]C-R[-2]C4*R[-2]C -> 0 | Z242: =R[-1]C-R[-2]C4*R[-2]C -> 0 | AA242: =R[-1]C-R[-2]C4*R[-2]C -> 0 | AB242: =R[-1]C-R[-2]C4*R[-2]C -> 0 | AC242: =R[-1]C-R[-2]C4*R[-2]C -> 0 | AD242: =R[-1]C-R[-2]C4*R[-2]C -> 0 | AE242: =R[-1]C-R[-2]C4*R[-2]C -> 0 | AF242: =R[-1]C-R[-2]C4*R[-2]C -> 0 | AG242: =R[-1]C-R[-2]C4*R[-2]C -> 0 | AH242: =R[-1]C-R[-2]C4*R[-2]C -> 0 | AI242: =R[-1]C-R[-2]C4*R[-2]C -> 0 | AJ242: =R[-1]C-R[-2]C4*R[-2]C -> 0 | AK242: =R[-1]C-R[-2]C4*R[-2]C -> 0 | AL242: =R[-1]C-R[-2]C4*R[-2]C -> 0 | AM242: =R[-1]C-R[-2]C4*R[-2]C -> 0 | AN242: =R[-1]C-R[-2]C4*R[-2]C -> 0 | AO242: =R[-1]C-R[-2]C4*R[-2]C -> -4557 | AP242: =R[-1]C-R[-2]C4*R[-2]C -> 0 | AQ242: =R[-1]C-R[-2]C4*R[-2]C -> 0 | AR242: =R[-1]C-R[-2]C4*R[-2]C -> 0 | AS242: =R[-1]C-R[-2]C4*R[-2]C -> 0 | AT242: =R[-1]C-R[-2]C4*R[-2]C -> 0 | AU242: =R[-1]C-R[-2]C4*R[-2]C -> 0 | AV242: =R[-1]C-R[-2]C4*R[-2]C -> 0 | AW242: =R[-1]C-R[-2]C4*R[-2]C -> 0 | AX242: =R[-1]C-R[-2]C4*R[-2]C -> 0 | AY242: =R[-1]C-R[-2]C4*R[-2]C -> 0 | AZ242: =R[-1]C-R[-2]C4*R[-2]C -> 0 | BA242: =R[-1]C-R[-2]C4*R[-2]C -> 0 | BB242: =R[-1]C-R[-2]C4*R[-2]C -> 0 | BC242: =R[-1]C-R[-2]C4*R[-2]C -> 0 | BD242: =R[-1]C-R[-2]C4*R[-2]C -> 0 | BE242: =R[-1]C-R[-2]C4*R[-2]C -> 0 | BF242: =R[-1]C-R[-2]C4*R[-2]C -> 0 | BG242: =R[-1]C-R[-2]C4*R[-2]C -> 0 | BO242: =SUM(RC[-61]:RC[-8]) -> -4557
A243: Making Projects Work in Project Management | B243: 2002-11-13T00:00:00.000 | C243: 2 | D243: 1395 | E243: 525 | F243: 0 | G243: 0 | H243: 0 | I243: 1 | J243: 1 | K243: 0 | L243: 0 | M243: 0 | N243: 0 | O243: 0 | P243: 0 | Q243: 0 | R243: 0 | S243: 0 | T243: 0 | U243: 0 | V243: 0 | W243: 0 | X243: 0 | Y243: 0 | Z243: 1 | AA243: 0 | AB243: 0 | AC243: 0 | AD243: 5 | AE243: 0 | AF243: 0 | AG243: 0 | AH243: 0 | AI243: 0 | AJ243: 0 | AK243: 0 | AL243: 0 | AM243: 0 | AN243: 0 | AO243: 0 | AP243: 0 | AQ243: 0 | AR243: 0 | AS243: 0 | AT243: 0 | AU243: 0 | AV243: 0 | AW243: 0 | AX243: 0 | AY243: 0 | AZ243: 0 | BA243: 0 | BB243: 0 | BC243: 0 | BD243: 0 | BE243: 5 | BF243: 0 | BG243: 0 | BK243: =SUM(RC[-57]:RC[-4]) -> 13 | BL243: =RC[-61]*RC[-1] -> 26
D244: Total | F244: =R[-1]C*R243C5 -> 0 | G244: =R[-1]C*R243C5 -> 0 | H244: =R[-1]C*R243C5 -> 0 | I244: =R[-1]C*R243C5 -> 525 | J244: =R[-1]C*R243C5 -> 525 | K244: =R[-1]C*R243C5 -> 0 | L244: =R[-1]C*R243C5 -> 0 | M244: =R[-1]C*R243C5 -> 0 | N244: =R[-1]C*R243C5 -> 0 | O244: =R[-1]C*R243C5 -> 0 | P244: =R[-1]C*R243C5 -> 0 | Q244: =R[-1]C*R243C5 -> 0 | R244: =R[-1]C*R243C5 -> 0 | S244: =R[-1]C*R243C5 -> 0 | T244: =R[-1]C*R243C5 -> 0 | U244: =R[-1]C*R243C5 -> 0 | V244: =R[-1]C*R243C5 -> 0 | W244: =R[-1]C*R243C5 -> 0 | X244: =R[-1]C*R243C5 -> 0 | Y244: =R[-1]C*R243C5 -> 0 | Z244: =R[-1]C*R243C5 -> 525 | AA244: =R[-1]C*R243C5 -> 0 | AB244: =R[-1]C*R243C5 -> 0 | AC244: =R[-1]C*R243C5 -> 0 | AD244: =R[-1]C*R243C5 -> 2625 | AE244: =R[-1]C*R243C5 -> 0 | AF244: =R[-1]C*R243C5 -> 0 | AG244: =R[-1]C*R243C5 -> 0 | AH244: =R[-1]C*R243C5 -> 0 | AI244: =R[-1]C*R243C5 -> 0 | AJ244: =R[-1]C*R243C5 -> 0 | AK244: =R[-1]C*R243C5 -> 0 | AL244: =R[-1]C*R243C5 -> 0 | AM244: =R[-1]C*R243C5 -> 0 | AN244: =R[-1]C*R243C5 -> 0 | AO244: =R[-1]C*R243C5 -> 0 | AP244: =R[-1]C*R243C5 -> 0 | AQ244: =R[-1]C*R243C5 -> 0 | AR244: =R[-1]C*R243C5 -> 0 | AS244: =R[-1]C*R243C5 -> 0 | AT244: =R[-1]C*R243C5 -> 0 | AU244: =R[-1]C*R243C5 -> 0 | AV244: =R[-1]C*R243C5 -> 0 | AW244: =R[-1]C*R243C5 -> 0 | AX244: =R[-1]C*R243C5 -> 0 | AY244: =R[-1]C*R243C5 -> 0 | AZ244: =R[-1]C*R243C5 -> 0 | BA244: =R[-1]C*R243C5 -> 0 | BB244: =R[-1]C*R243C5 -> 0 | BC244: =R[-1]C*R243C5 -> 0 | BD244: =R[-1]C*R243C5 -> 0 | BE244: =R[-1]C*R243C5 -> 2625 | BF244: =R[-1]C*R243C5 -> 0 | BG244: =R[-1]C*R243C5 -> 0 | BM244: =R[-1]C[-61]*R[-1]C[-2] -> 18135 | BN244: =RC[-1]-RC[1] -> 11310 | BO244: =SUM(RC[-61]:RC[-8]) -> 6825
D245: Total Savings | F245: =R[-1]C-R[-2]C4*R[-2]C -> 0 | G245: =R[-1]C-R[-2]C4*R[-2]C -> 0 | H245: =R[-1]C-R[-2]C4*R[-2]C -> 0 | I245: =R[-1]C-R[-2]C4*R[-2]C -> -870 | J245: =R[-1]C-R[-2]C4*R[-2]C -> -870 | K245: =R[-1]C-R[-2]C4*R[-2]C -> 0 | L245: =R[-1]C-R[-2]C4*R[-2]C -> 0 | M245: =R[-1]C-R[-2]C4*R[-2]C -> 0 | N245: =R[-1]C-R[-2]C4*R[-2]C -> 0 | O245: =R[-1]C-R[-2]C4*R[-2]C -> 0 | P245: =R[-1]C-R[-2]C4*R[-2]C -> 0 | Q245: =R[-1]C-R[-2]C4*R[-2]C -> 0 | R245: =R[-1]C-R[-2]C4*R[-2]C -> 0 | S245: =R[-1]C-R[-2]C4*R[-2]C -> 0 | T245: =R[-1]C-R[-2]C4*R[-2]C -> 0 | U245: =R[-1]C-R[-2]C4*R[-2]C -> 0 | V245: =R[-1]C-R[-2]C4*R[-2]C -> 0 | W245: =R[-1]C-R[-2]C4*R[-2]C -> 0 | X245: =R[-1]C-R[-2]C4*R[-2]C -> 0 | Y245: =R[-1]C-R[-2]C4*R[-2]C -> 0 | Z245: =R[-1]C-R[-2]C4*R[-2]C -> -870 | AA245: =R[-1]C-R[-2]C4*R[-2]C -> 0 | AB245: =R[-1]C-R[-2]C4*R[-2]C -> 0 | AC245: =R[-1]C-R[-2]C4*R[-2]C -> 0 | AD245: =R[-1]C-R[-2]C4*R[-2]C -> -4350 | AE245: =R[-1]C-R[-2]C4*R[-2]C -> 0 | AF245: =R[-1]C-R[-2]C4*R[-2]C -> 0 | AG245: =R[-1]C-R[-2]C4*R[-2]C -> 0 | AH245: =R[-1]C-R[-2]C4*R[-2]C -> 0 | AI245: =R[-1]C-R[-2]C4*R[-2]C -> 0 | AJ245: =R[-1]C-R[-2]C4*R[-2]C -> 0 | AK245: =R[-1]C-R[-2]C4*R[-2]C -> 0 | AL245: =R[-1]C-R[-2]C4*R[-2]C -> 0 | AM245: =R[-1]C-R[-2]C4*R[-2]C -> 0 | AN245: =R[-1]C-R[-2]C4*R[-2]C -> 0 | AO245: =R[-1]C-R[-2]C4*R[-2]C -> 0 | AP245: =R[-1]C-R[-2]C4*R[-2]C -> 0 | AQ245: =R[-1]C-R[-2]C4*R[-2]C -> 0 | AR245: =R[-1]C-R[-2]C4*R[-2]C -> 0 | AS245: =R[-1]C-R[-2]C4*R[-2]C -> 0 | AT245: =R[-1]C-R[-2]C4*R[-2]C -> 0 | AU245: =R[-1]C-R[-2]C4*R[-2]C -> 0 | AV245: =R[-1]C-R[-2]C4*R[-2]C -> 0 | AW245: =R[-1]C-R[-2]C4*R[-2]C -> 0 | AX245: =R[-1]C-R[-2]C4*R[-2]C -> 0 | AY245: =R[-1]C-R[-2]C4*R[-2]C -> 0 | AZ245: =R[-1]C-R[-2]C4*R[-2]C -> 0 | BA245: =R[-1]C-R[-2]C4*R[-2]C -> 0 | BB245: =R[-1]C-R[-2]C4*R[-2]C -> 0 | BC245: =R[-1]C-R[-2]C4*R[-2]C -> 0 | BD245: =R[-1]C-R[-2]C4*R[-2]C -> 0 | BE245: =R[-1]C-R[-2]C4*R[-2]C -> -4350 | BF245: =R[-1]C-R[-2]C4*R[-2]C -> 0 | BG245: =R[-1]C-R[-2]C4*R[-2]C -> 0 | BO245: =SUM(RC[-61]:RC[-8]) -> -11310
A246: Introduction to TSO/ISPF | B246: 2002-11-13T00:00:00.000 | C246: 1 | D246: 550 | E246: 225 | F246: 2 | G246: 0 | H246: 0 | I246: 0 | J246: 0 | K246: 2 | L246: 0 | M246: 0 | N246: 0 | O246: 0 | P246: 0 | Q246: 0 | R246: 0 | S246: 0 | T246: 0 | U246: 0 | V246: 0 | W246: 0 | X246: 1 | Y246: 0 | Z246: 0 | AA246: 0 | AB246: 0 | AC246: 0 | AD246: 0 | AE246: 0 | AF246: 0 | AG246: 0 | AH246: 0 | AI246: 0 | AJ246: 0 | AK246: 0 | AL246: 0 | AM246: 0 | AN246: 0 | AO246: 0 | AP246: 0 | AQ246: 0 | AR246: 0 | AS246: 0 | AT246: 0 | AU246: 0 | AV246: 0 | AW246: 0 | AX246: 0 | AY246: 0 | AZ246: 0 | BA246: 0 | BB246: 0 | BC246: 0 | BD246: 0 | BE246: 0 | BF246: 0 | BG246: 0 | BK246: =SUM(RC[-57]:RC[-4]) -> 5 | BL246: =RC[-61]*RC[-1] -> 5
D247: Total | F247: =R[-1]C*R246C5 -> 450 | G247: =R[-1]C*R246C5 -> 0 | H247: =R[-1]C*R246C5 -> 0 | I247: =R[-1]C*R246C5 -> 0 | J247: =R[-1]C*R246C5 -> 0 | K247: =R[-1]C*R246C5 -> 450 | L247: =R[-1]C*R246C5 -> 0 | M247: =R[-1]C*R246C5 -> 0 | N247: =R[-1]C*R246C5 -> 0 | O247: =R[-1]C*R246C5 -> 0 | P247: =R[-1]C*R246C5 -> 0 | Q247: =R[-1]C*R246C5 -> 0 | R247: =R[-1]C*R246C5 -> 0 | S247: =R[-1]C*R246C5 -> 0 | T247: =R[-1]C*R246C5 -> 0 | U247: =R[-1]C*R246C5 -> 0 | V247: =R[-1]C*R246C5 -> 0 | W247: =R[-1]C*R246C5 -> 0 | X247: =R[-1]C*R246C5 -> 225 | Y247: =R[-1]C*R246C5 -> 0 | Z247: =R[-1]C*R246C5 -> 0 | AA247: =R[-1]C*R246C5 -> 0 | AB247: =R[-1]C*R246C5 -> 0 | AC247: =R[-1]C*R246C5 -> 0 | AD247: =R[-1]C*R246C5 -> 0 | AE247: =R[-1]C*R246C5 -> 0 | AF247: =R[-1]C*R246C5 -> 0 | AG247: =R[-1]C*R246C5 -> 0 | AH247: =R[-1]C*R246C5 -> 0 | AI247: =R[-1]C*R246C5 -> 0 | AJ247: =R[-1]C*R246C5 -> 0 | AK247: =R[-1]C*R246C5 -> 0 | AL247: =R[-1]C*R246C5 -> 0 | AM247: =R[-1]C*R246C5 -> 0 | AN247: =R[-1]C*R246C5 -> 0 | AO247: =R[-1]C*R246C5 -> 0 | AP247: =R[-1]C*R246C5 -> 0 | AQ247: =R[-1]C*R246C5 -> 0 | AR247: =R[-1]C*R246C5 -> 0 | AS247: =R[-1]C*R246C5 -> 0 | AT247: =R[-1]C*R246C5 -> 0 | AU247: =R[-1]C*R246C5 -> 0 | AV247: =R[-1]C*R246C5 -> 0 | AW247: =R[-1]C*R246C5 -> 0 | AX247: =R[-1]C*R246C5 -> 0 | AY247: =R[-1]C*R246C5 -> 0 | AZ247: =R[-1]C*R246C5 -> 0 | BA247: =R[-1]C*R246C5 -> 0 | BB247: =R[-1]C*R246C5 -> 0 | BC247: =R[-1]C*R246C5 -> 0 | BD247: =R[-1]C*R246C5 -> 0 | BE247: =R[-1]C*R246C5 -> 0 | BF247: =R[-1]C*R246C5 -> 0 | BG247: =R[-1]C*R246C5 -> 0 | BM247: =R[-1]C[-61]*R[-1]C[-2] -> 2750 | BN247: =RC[-1]-RC[1] -> 1625 | BO247: =SUM(RC[-61]:RC[-8]) -> 1125
D248: Total Savings | F248: =R[-1]C-R[-2]C4*R[-2]C -> -650 | G248: =R[-1]C-R[-2]C4*R[-2]C -> 0 | H248: =R[-1]C-R[-2]C4*R[-2]C -> 0 | I248: =R[-1]C-R[-2]C4*R[-2]C -> 0 | J248: =R[-1]C-R[-2]C4*R[-2]C -> 0 | K248: =R[-1]C-R[-2]C4*R[-2]C -> -650 | L248: =R[-1]C-R[-2]C4*R[-2]C -> 0 | M248: =R[-1]C-R[-2]C4*R[-2]C -> 0 | N248: =R[-1]C-R[-2]C4*R[-2]C -> 0 | O248: =R[-1]C-R[-2]C4*R[-2]C -> 0 | P248: =R[-1]C-R[-2]C4*R[-2]C -> 0 | Q248: =R[-1]C-R[-2]C4*R[-2]C -> 0 | R248: =R[-1]C-R[-2]C4*R[-2]C -> 0 | S248: =R[-1]C-R[-2]C4*R[-2]C -> 0 | T248: =R[-1]C-R[-2]C4*R[-2]C -> 0 | U248: =R[-1]C-R[-2]C4*R[-2]C -> 0 | V248: =R[-1]C-R[-2]C4*R[-2]C -> 0 | W248: =R[-1]C-R[-2]C4*R[-2]C -> 0 | X248: =R[-1]C-R[-2]C4*R[-2]C -> -325 | Y248: =R[-1]C-R[-2]C4*R[-2]C -> 0 | Z248: =R[-1]C-R[-2]C4*R[-2]C -> 0 | AA248: =R[-1]C-R[-2]C4*R[-2]C -> 0 | AB248: =R[-1]C-R[-2]C4*R[-2]C -> 0 | AC248: =R[-1]C-R[-2]C4*R[-2]C -> 0 | AD248: =R[-1]C-R[-2]C4*R[-2]C -> 0 | AE248: =R[-1]C-R[-2]C4*R[-2]C -> 0 | AF248: =R[-1]C-R[-2]C4*R[-2]C -> 0 | AG248: =R[-1]C-R[-2]C4*R[-2]C -> 0 | AH248: =R[-1]C-R[-2]C4*R[-2]C -> 0 | AI248: =R[-1]C-R[-2]C4*R[-2]C -> 0 | AJ248: =R[-1]C-R[-2]C4*R[-2]C -> 0 | AK248: =R[-1]C-R[-2]C4*R[-2]C -> 0 | AL248: =R[-1]C-R[-2]C4*R[-2]C -> 0 | AM248: =R[-1]C-R[-2]C4*R[-2]C -> 0 | AN248: =R[-1]C-R[-2]C4*R[-2]C -> 0 | AO248: =R[-1]C-R[-2]C4*R[-2]C -> 0 | AP248: =R[-1]C-R[-2]C4*R[-2]C -> 0 | AQ248: =R[-1]C-R[-2]C4*R[-2]C -> 0 | AR248: =R[-1]C-R[-2]C4*R[-2]C -> 0 | AS248: =R[-1]C-R[-2]C4*R[-2]C -> 0 | AT248: =R[-1]C-R[-2]C4*R[-2]C -> 0 | AU248: =R[-1]C-R[-2]C4*R[-2]C -> 0 | AV248: =R[-1]C-R[-2]C4*R[-2]C -> 0 | AW248: =R[-1]C-R[-2]C4*R[-2]C -> 0 | AX248: =R[-1]C-R[-2]C4*R[-2]C -> 0 | AY248: =R[-1]C-R[-2]C4*R[-2]C -> 0 | AZ248: =R[-1]C-R[-2]C4*R[-2]C -> 0 | BA248: =R[-1]C-R[-2]C4*R[-2]C -> 0 | BB248: =R[-1]C-R[-2]C4*R[-2]C -> 0 | BC248: =R[-1]C-R[-2]C4*R[-2]C -> 0 | BD248: =R[-1]C-R[-2]C4*R[-2]C -> 0 | BE248: =R[-1]C-R[-2]C4*R[-2]C -> 0 | BF248: =R[-1]C-R[-2]C4*R[-2]C -> 0 | BG248: =R[-1]C-R[-2]C4*R[-2]C -> 0 | BO248: =SUM(RC[-61]:RC[-8]) -> -1625
A249: Analysis Simulation | B249: 2002-11-14T00:00:00.000 | C249: 2 | D249: 1175 | E249: 525 | F249: 0 | G249: 0 | H249: 0 | I249: 0 | J249: 1 | K249: 2 | L249: 0 | M249: 0 | N249: 0 | O249: 0 | P249: 0 | Q249: 0 | R249: 0 | S249: 0 | T249: 0 | U249: 0 | V249: 0 | W249: 0 | X249: 0 | Y249: 0 | Z249: 0 | AA249: 0 | AB249: 0 | AC249: 0 | AD249: 0 | AE249: 0 | AF249: 0 | AG249: 0 | AH249: 0 | AI249: 0 | AJ249: 0 | AK249: 0 | AL249: 0 | AM249: 0 | AN249: 0 | AO249: 0 | AP249: 0 | AQ249: 0 | AR249: 0 | AS249: 0 | AT249: 0 | AU249: 0 | AV249: 0 | AW249: 0 | AX249: 0 | AY249: 0 | AZ249: 0 | BA249: 0 | BB249: 0 | BC249: 0 | BD249: 0 | BE249: 1 | BF249: 0 | BG249: 16 | BK249: =SUM(RC[-57]:RC[-4]) -> 20 | BL249: =RC[-61]*RC[-1] -> 40
D250: Total | F250: =R[-1]C*R249C5 -> 0 | G250: =R[-1]C*R249C5 -> 0 | H250: =R[-1]C*R249C5 -> 0 | I250: =R[-1]C*R249C5 -> 0 | J250: =R[-1]C*R249C5 -> 525 | K250: =R[-1]C*R249C5 -> 1050 | L250: =R[-1]C*R249C5 -> 0 | M250: =R[-1]C*R249C5 -> 0 | N250: =R[-1]C*R249C5 -> 0 | O250: =R[-1]C*R249C5 -> 0 | P250: =R[-1]C*R249C5 -> 0 | Q250: =R[-1]C*R249C5 -> 0 | R250: =R[-1]C*R249C5 -> 0 | S250: =R[-1]C*R249C5 -> 0 | T250: =R[-1]C*R249C5 -> 0 | U250: =R[-1]C*R249C5 -> 0 | V250: =R[-1]C*R249C5 -> 0 | W250: =R[-1]C*R249C5 -> 0 | X250: =R[-1]C*R249C5 -> 0 | Y250: =R[-1]C*R249C5 -> 0 | Z250: =R[-1]C*R249C5 -> 0 | AA250: =R[-1]C*R249C5 -> 0 | AB250: =R[-1]C*R249C5 -> 0 | AC250: =R[-1]C*R249C5 -> 0 | AD250: =R[-1]C*R249C5 -> 0 | AE250: =R[-1]C*R249C5 -> 0 | AF250: =R[-1]C*R249C5 -> 0 | AG250: =R[-1]C*R249C5 -> 0 | AH250: =R[-1]C*R249C5 -> 0 | AI250: =R[-1]C*R249C5 -> 0 | AJ250: =R[-1]C*R249C5 -> 0 | AK250: =R[-1]C*R249C5 -> 0 | AL250: =R[-1]C*R249C5 -> 0 | AM250: =R[-1]C*R249C5 -> 0 | AN250: =R[-1]C*R249C5 -> 0 | AO250: =R[-1]C*R249C5 -> 0 | AP250: =R[-1]C*R249C5 -> 0 | AQ250: =R[-1]C*R249C5 -> 0 | AR250: =R[-1]C*R249C5 -> 0 | AS250: =R[-1]C*R249C5 -> 0 | AT250: =R[-1]C*R249C5 -> 0 | AU250: =R[-1]C*R249C5 -> 0 | AV250: =R[-1]C*R249C5 -> 0 | AW250: =R[-1]C*R249C5 -> 0 | AX250: =R[-1]C*R249C5 -> 0 | AY250: =R[-1]C*R249C5 -> 0 | AZ250: =R[-1]C*R249C5 -> 0 | BA250: =R[-1]C*R249C5 -> 0 | BB250: =R[-1]C*R249C5 -> 0 | BC250: =R[-1]C*R249C5 -> 0 | BD250: =R[-1]C*R249C5 -> 0 | BE250: =R[-1]C*R249C5 -> 525 | BF250: =R[-1]C*R249C5 -> 0 | BG250: =R[-1]C*R249C5 -> 8400 | BM250: =R[-1]C[-61]*R[-1]C[-2] -> 23500 | BN250: =RC[-1]-RC[1] -> 13000 | BO250: =SUM(RC[-61]:RC[-8]) -> 10500
D251: Total Savings | F251: =R[-1]C-R[-2]C4*R[-2]C -> 0 | G251: =R[-1]C-R[-2]C4*R[-2]C -> 0 | H251: =R[-1]C-R[-2]C4*R[-2]C -> 0 | I251: =R[-1]C-R[-2]C4*R[-2]C -> 0 | J251: =R[-1]C-R[-2]C4*R[-2]C -> -650 | K251: =R[-1]C-R[-2]C4*R[-2]C -> -1300 | L251: =R[-1]C-R[-2]C4*R[-2]C -> 0 | M251: =R[-1]C-R[-2]C4*R[-2]C -> 0 | N251: =R[-1]C-R[-2]C4*R[-2]C -> 0 | O251: =R[-1]C-R[-2]C4*R[-2]C -> 0 | P251: =R[-1]C-R[-2]C4*R[-2]C -> 0 | Q251: =R[-1]C-R[-2]C4*R[-2]C -> 0 | R251: =R[-1]C-R[-2]C4*R[-2]C -> 0 | S251: =R[-1]C-R[-2]C4*R[-2]C -> 0 | T251: =R[-1]C-R[-2]C4*R[-2]C -> 0 | U251: =R[-1]C-R[-2]C4*R[-2]C -> 0 | V251: =R[-1]C-R[-2]C4*R[-2]C -> 0 | W251: =R[-1]C-R[-2]C4*R[-2]C -> 0 | X251: =R[-1]C-R[-2]C4*R[-2]C -> 0 | Y251: =R[-1]C-R[-2]C4*R[-2]C -> 0 | Z251: =R[-1]C-R[-2]C4*R[-2]C -> 0 | AA251: =R[-1]C-R[-2]C4*R[-2]C -> 0 | AB251: =R[-1]C-R[-2]C4*R[-2]C -> 0 | AC251: =R[-1]C-R[-2]C4*R[-2]C -> 0 | AD251: =R[-1]C-R[-2]C4*R[-2]C -> 0 | AE251: =R[-1]C-R[-2]C4*R[-2]C -> 0 | AF251: =R[-1]C-R[-2]C4*R[-2]C -> 0 | AG251: =R[-1]C-R[-2]C4*R[-2]C -> 0 | AH251: =R[-1]C-R[-2]C4*R[-2]C -> 0 | AI251: =R[-1]C-R[-2]C4*R[-2]C -> 0 | AJ251: =R[-1]C-R[-2]C4*R[-2]C -> 0 | AK251: =R[-1]C-R[-2]C4*R[-2]C -> 0 | AL251: =R[-1]C-R[-2]C4*R[-2]C -> 0 | AM251: =R[-1]C-R[-2]C4*R[-2]C -> 0 | AN251: =R[-1]C-R[-2]C4*R[-2]C -> 0 | AO251: =R[-1]C-R[-2]C4*R[-2]C -> 0 | AP251: =R[-1]C-R[-2]C4*R[-2]C -> 0 | AQ251: =R[-1]C-R[-2]C4*R[-2]C -> 0 | AR251: =R[-1]C-R[-2]C4*R[-2]C -> 0 | AS251: =R[-1]C-R[-2]C4*R[-2]C -> 0 | AT251: =R[-1]C-R[-2]C4*R[-2]C -> 0 | AU251: =R[-1]C-R[-2]C4*R[-2]C -> 0 | AV251: =R[-1]C-R[-2]C4*R[-2]C -> 0 | AW251: =R[-1]C-R[-2]C4*R[-2]C -> 0 | AX251: =R[-1]C-R[-2]C4*R[-2]C -> 0 | AY251: =R[-1]C-R[-2]C4*R[-2]C -> 0 | AZ251: =R[-1]C-R[-2]C4*R[-2]C -> 0 | BA251: =R[-1]C-R[-2]C4*R[-2]C -> 0 | BB251: =R[-1]C-R[-2]C4*R[-2]C -> 0 | BC251: =R[-1]C-R[-2]C4*R[-2]C -> 0 | BD251: =R[-1]C-R[-2]C4*R[-2]C -> 0 | BE251: =R[-1]C-R[-2]C4*R[-2]C -> -650 | BF251: =R[-1]C-R[-2]C4*R[-2]C -> 0 | BG251: =R[-1]C-R[-2]C4*R[-2]C -> -10400 | BO251: =SUM(RC[-61]:RC[-8]) -> -13000
A252: Moving from an Operational Manager to Strategic Leader | B252: 2002-11-18T00:00:00.000 | C252: 3 | D252: 2395 | E252: 764 | F252: 10 | G252: 0 | H252: 0 | I252: 0 | J252: 0 | K252: 0 | L252: 0 | M252: 0 | N252: 0 | O252: 0 | P252: 0 | Q252: 0 | R252: 0 | S252: 0 | T252: 0 | U252: 0 | V252: 0 | W252: 0 | X252: 0 | Y252: 0 | Z252: 0 | AA252: 0 | AB252: 0 | AC252: 0 | AD252: 0 | AE252: 0 | AF252: 0 | AG252: 0 | AH252: 0 | AI252: 0 | AJ252: 0 | AK252: 0 | AL252: 0 | AM252: 0 | AN252: 0 | AO252: 0 | AP252: 0 | AQ252: 0 | AR252: 0 | AS252: 0 | AT252: 0 | AU252: 0 | AV252: 0 | AW252: 0 | AX252: 0 | AY252: 0 | AZ252: 0 | BA252: 0 | BB252: 0 | BC252: 0 | BD252: 0 | BE252: 0 | BF252: 0 | BG252: 0 | BK252: =SUM(RC[-57]:RC[-4]) -> 10 | BL252: =RC[-61]*RC[-1] -> 30
D253: Total | F253: =R[-1]C*R252C5 -> 7640 | G253: =R[-1]C*R252C5 -> 0 | H253: =R[-1]C*R252C5 -> 0 | I253: =R[-1]C*R252C5 -> 0 | J253: =R[-1]C*R252C5 -> 0 | K253: =R[-1]C*R252C5 -> 0 | L253: =R[-1]C*R252C5 -> 0 | M253: =R[-1]C*R252C5 -> 0 | N253: =R[-1]C*R252C5 -> 0 | O253: =R[-1]C*R252C5 -> 0 | P253: =R[-1]C*R252C5 -> 0 | Q253: =R[-1]C*R252C5 -> 0 | R253: =R[-1]C*R252C5 -> 0 | S253: =R[-1]C*R252C5 -> 0 | T253: =R[-1]C*R252C5 -> 0 | U253: =R[-1]C*R252C5 -> 0 | V253: =R[-1]C*R252C5 -> 0 | W253: =R[-1]C*R252C5 -> 0 | X253: =R[-1]C*R252C5 -> 0 | Y253: =R[-1]C*R252C5 -> 0 | Z253: =R[-1]C*R252C5 -> 0 | AA253: =R[-1]C*R252C5 -> 0 | AB253: =R[-1]C*R252C5 -> 0 | AC253: =R[-1]C*R252C5 -> 0 | AD253: =R[-1]C*R252C5 -> 0 | AE253: =R[-1]C*R252C5 -> 0 | AF253: =R[-1]C*R252C5 -> 0 | AG253: =R[-1]C*R252C5 -> 0 | AH253: =R[-1]C*R252C5 -> 0 | AI253: =R[-1]C*R252C5 -> 0 | AJ253: =R[-1]C*R252C5 -> 0 | AK253: =R[-1]C*R252C5 -> 0 | AL253: =R[-1]C*R252C5 -> 0 | AM253: =R[-1]C*R252C5 -> 0 | AN253: =R[-1]C*R252C5 -> 0 | AO253: =R[-1]C*R252C5 -> 0 | AP253: =R[-1]C*R252C5 -> 0 | AQ253: =R[-1]C*R252C5 -> 0 | AR253: =R[-1]C*R252C5 -> 0 | AS253: =R[-1]C*R252C5 -> 0 | AT253: =R[-1]C*R252C5 -> 0 | AU253: =R[-1]C*R252C5 -> 0 | AV253: =R[-1]C*R252C5 -> 0 | AW253: =R[-1]C*R252C5 -> 0 | AX253: =R[-1]C*R252C5 -> 0 | AY253: =R[-1]C*R252C5 -> 0 | AZ253: =R[-1]C*R252C5 -> 0 | BA253: =R[-1]C*R252C5 -> 0 | BB253: =R[-1]C*R252C5 -> 0 | BC253: =R[-1]C*R252C5 -> 0 | BD253: =R[-1]C*R252C5 -> 0 | BE253: =R[-1]C*R252C5 -> 0 | BF253: =R[-1]C*R252C5 -> 0 | BG253: =R[-1]C*R252C5 -> 0 | BM253: =R[-1]C[-61]*R[-1]C[-2] -> 23950 | BN253: =RC[-1]-RC[1] -> 16310 | BO253: =SUM(RC[-61]:RC[-8]) -> 7640
D254: Total Savings | F254: =R[-1]C-R[-2]C4*R[-2]C -> -16310 | G254: =R[-1]C-R[-2]C4*R[-2]C -> 0 | H254: =R[-1]C-R[-2]C4*R[-2]C -> 0 | I254: =R[-1]C-R[-2]C4*R[-2]C -> 0 | J254: =R[-1]C-R[-2]C4*R[-2]C -> 0 | K254: =R[-1]C-R[-2]C4*R[-2]C -> 0 | L254: =R[-1]C-R[-2]C4*R[-2]C -> 0 | M254: =R[-1]C-R[-2]C4*R[-2]C -> 0 | N254: =R[-1]C-R[-2]C4*R[-2]C -> 0 | O254: =R[-1]C-R[-2]C4*R[-2]C -> 0 | P254: =R[-1]C-R[-2]C4*R[-2]C -> 0 | Q254: =R[-1]C-R[-2]C4*R[-2]C -> 0 | R254: =R[-1]C-R[-2]C4*R[-2]C -> 0 | S254: =R[-1]C-R[-2]C4*R[-2]C -> 0 | T254: =R[-1]C-R[-2]C4*R[-2]C -> 0 | U254: =R[-1]C-R[-2]C4*R[-2]C -> 0 | V254: =R[-1]C-R[-2]C4*R[-2]C -> 0 | W254: =R[-1]C-R[-2]C4*R[-2]C -> 0 | X254: =R[-1]C-R[-2]C4*R[-2]C -> 0 | Y254: =R[-1]C-R[-2]C4*R[-2]C -> 0 | Z254: =R[-1]C-R[-2]C4*R[-2]C -> 0 | AA254: =R[-1]C-R[-2]C4*R[-2]C -> 0 | AB254: =R[-1]C-R[-2]C4*R[-2]C -> 0 | AC254: =R[-1]C-R[-2]C4*R[-2]C -> 0 | AD254: =R[-1]C-R[-2]C4*R[-2]C -> 0 | AE254: =R[-1]C-R[-2]C4*R[-2]C -> 0 | AF254: =R[-1]C-R[-2]C4*R[-2]C -> 0 | AG254: =R[-1]C-R[-2]C4*R[-2]C -> 0 | AH254: =R[-1]C-R[-2]C4*R[-2]C -> 0 | AI254: =R[-1]C-R[-2]C4*R[-2]C -> 0 | AJ254: =R[-1]C-R[-2]C4*R[-2]C -> 0 | AK254: =R[-1]C-R[-2]C4*R[-2]C -> 0 | AL254: =R[-1]C-R[-2]C4*R[-2]C -> 0 | AM254: =R[-1]C-R[-2]C4*R[-2]C -> 0 | AN254: =R[-1]C-R[-2]C4*R[-2]C -> 0 | AO254: =R[-1]C-R[-2]C4*R[-2]C -> 0 | AP254: =R[-1]C-R[-2]C4*R[-2]C -> 0 | AQ254: =R[-1]C-R[-2]C4*R[-2]C -> 0 | AR254: =R[-1]C-R[-2]C4*R[-2]C -> 0 | AS254: =R[-1]C-R[-2]C4*R[-2]C -> 0 | AT254: =R[-1]C-R[-2]C4*R[-2]C -> 0 | AU254: =R[-1]C-R[-2]C4*R[-2]C -> 0 | AV254: =R[-1]C-R[-2]C4*R[-2]C -> 0 | AW254: =R[-1]C-R[-2]C4*R[-2]C -> 0 | AX254: =R[-1]C-R[-2]C4*R[-2]C -> 0 | AY254: =R[-1]C-R[-2]C4*R[-2]C -> 0 | AZ254: =R[-1]C-R[-2]C4*R[-2]C -> 0 | BA254: =R[-1]C-R[-2]C4*R[-2]C -> 0 | BB254: =R[-1]C-R[-2]C4*R[-2]C -> 0 | BC254: =R[-1]C-R[-2]C4*R[-2]C -> 0 | BD254: =R[-1]C-R[-2]C4*R[-2]C -> 0 | BE254: =R[-1]C-R[-2]C4*R[-2]C -> 0 | BF254: =R[-1]C-R[-2]C4*R[-2]C -> 0 | BG254: =R[-1]C-R[-2]C4*R[-2]C -> 0 | BO254: =SUM(RC[-61]:RC[-8]) -> -16310
A255: Mastering the Requirements Process | B255: 2002-12-02T00:00:00.000 | C255: 2 | D255: 1175 | E255: 525 | F255: 0 | G255: 0 | H255: 0 | I255: 0 | J255: 0 | K255: 5 | L255: 0 | M255: 0 | N255: 0 | O255: 0 | P255: 0 | Q255: 0 | R255: 0 | S255: 0 | T255: 0 | U255: 0 | V255: 0 | W255: 0 | X255: 0 | Y255: 0 | Z255: 0 | AA255: 1 | AB255: 0 | AC255: 0 | AD255: 0 | AE255: 0 | AF255: 0 | AG255: 0 | AH255: 0 | AI255: 0 | AJ255: 0 | AK255: 0 | AL255: 0 | AM255: 0 | AN255: 0 | AO255: 0 | AP255: 0 | AQ255: 0 | AR255: 0 | AS255: 0 | AT255: 0 | AU255: 0 | AV255: 0 | AW255: 0 | AX255: 0 | AY255: 0 | AZ255: 0 | BA255: 0 | BB255: 0 | BC255: 0 | BD255: 0 | BE255: 0 | BF255: 0 | BG255: 14 | BK255: =SUM(RC[-57]:RC[-4]) -> 20 | BL255: =RC[-61]*RC[-1] -> 40
D256: Total | F256: =R[-1]C*R255C5 -> 0 | G256: =R[-1]C*R255C5 -> 0 | H256: =R[-1]C*R255C5 -> 0 | I256: =R[-1]C*R255C5 -> 0 | J256: =R[-1]C*R255C5 -> 0 | K256: =R[-1]C*R255C5 -> 2625 | L256: =R[-1]C*R255C5 -> 0 | M256: =R[-1]C*R255C5 -> 0 | N256: =R[-1]C*R255C5 -> 0 | O256: =R[-1]C*R255C5 -> 0 | P256: =R[-1]C*R255C5 -> 0 | Q256: =R[-1]C*R255C5 -> 0 | R256: =R[-1]C*R255C5 -> 0 | S256: =R[-1]C*R255C5 -> 0 | T256: =R[-1]C*R255C5 -> 0 | U256: =R[-1]C*R255C5 -> 0 | V256: =R[-1]C*R255C5 -> 0 | W256: =R[-1]C*R255C5 -> 0 | X256: =R[-1]C*R255C5 -> 0 | Y256: =R[-1]C*R255C5 -> 0 | Z256: =R[-1]C*R255C5 -> 0 | AA256: =R[-1]C*R255C5 -> 525 | AB256: =R[-1]C*R255C5 -> 0 | AC256: =R[-1]C*R255C5 -> 0 | AD256: =R[-1]C*R255C5 -> 0 | AE256: =R[-1]C*R255C5 -> 0 | AF256: =R[-1]C*R255C5 -> 0 | AG256: =R[-1]C*R255C5 -> 0 | AH256: =R[-1]C*R255C5 -> 0 | AI256: =R[-1]C*R255C5 -> 0 | AJ256: =R[-1]C*R255C5 -> 0 | AK256: =R[-1]C*R255C5 -> 0 | AL256: =R[-1]C*R255C5 -> 0 | AM256: =R[-1]C*R255C5 -> 0 | AN256: =R[-1]C*R255C5 -> 0 | AO256: =R[-1]C*R255C5 -> 0 | AP256: =R[-1]C*R255C5 -> 0 | AQ256: =R[-1]C*R255C5 -> 0 | AR256: =R[-1]C*R255C5 -> 0 | AS256: =R[-1]C*R255C5 -> 0 | AT256: =R[-1]C*R255C5 -> 0 | AU256: =R[-1]C*R255C5 -> 0 | AV256: =R[-1]C*R255C5 -> 0 | AW256: =R[-1]C*R255C5 -> 0 | AX256: =R[-1]C*R255C5 -> 0 | AY256: =R[-1]C*R255C5 -> 0 | AZ256: =R[-1]C*R255C5 -> 0 | BA256: =R[-1]C*R255C5 -> 0 | BB256: =R[-1]C*R255C5 -> 0 | BC256: =R[-1]C*R255C5 -> 0 | BD256: =R[-1]C*R255C5 -> 0 | BE256: =R[-1]C*R255C5 -> 0 | BF256: =R[-1]C*R255C5 -> 0 | BG256: =R[-1]C*R255C5 -> 7350 | BM256: =R[-1]C[-61]*R[-1]C[-2] -> 23500 | BN256: =RC[-1]-RC[1] -> 13000 | BO256: =SUM(RC[-61]:RC[-8]) -> 10500
D257: Total Savings | F257: =R[-1]C-R[-2]C4*R[-2]C -> 0 | G257: =R[-1]C-R[-2]C4*R[-2]C -> 0 | H257: =R[-1]C-R[-2]C4*R[-2]C -> 0 | I257: =R[-1]C-R[-2]C4*R[-2]C -> 0 | J257: =R[-1]C-R[-2]C4*R[-2]C -> 0 | K257: =R[-1]C-R[-2]C4*R[-2]C -> -3250 | L257: =R[-1]C-R[-2]C4*R[-2]C -> 0 | M257: =R[-1]C-R[-2]C4*R[-2]C -> 0 | N257: =R[-1]C-R[-2]C4*R[-2]C -> 0 | O257: =R[-1]C-R[-2]C4*R[-2]C -> 0 | P257: =R[-1]C-R[-2]C4*R[-2]C -> 0 | Q257: =R[-1]C-R[-2]C4*R[-2]C -> 0 | R257: =R[-1]C-R[-2]C4*R[-2]C -> 0 | S257: =R[-1]C-R[-2]C4*R[-2]C -> 0 | T257: =R[-1]C-R[-2]C4*R[-2]C -> 0 | U257: =R[-1]C-R[-2]C4*R[-2]C -> 0 | V257: =R[-1]C-R[-2]C4*R[-2]C -> 0 | W257: =R[-1]C-R[-2]C4*R[-2]C -> 0 | X257: =R[-1]C-R[-2]C4*R[-2]C -> 0 | Y257: =R[-1]C-R[-2]C4*R[-2]C -> 0 | Z257: =R[-1]C-R[-2]C4*R[-2]C -> 0 | AA257: =R[-1]C-R[-2]C4*R[-2]C -> -650 | AB257: =R[-1]C-R[-2]C4*R[-2]C -> 0 | AC257: =R[-1]C-R[-2]C4*R[-2]C -> 0 | AD257: =R[-1]C-R[-2]C4*R[-2]C -> 0 | AE257: =R[-1]C-R[-2]C4*R[-2]C -> 0 | AF257: =R[-1]C-R[-2]C4*R[-2]C -> 0 | AG257: =R[-1]C-R[-2]C4*R[-2]C -> 0 | AH257: =R[-1]C-R[-2]C4*R[-2]C -> 0 | AI257: =R[-1]C-R[-2]C4*R[-2]C -> 0 | AJ257: =R[-1]C-R[-2]C4*R[-2]C -> 0 | AK257: =R[-1]C-R[-2]C4*R[-2]C -> 0 | AL257: =R[-1]C-R[-2]C4*R[-2]C -> 0 | AM257: =R[-1]C-R[-2]C4*R[-2]C -> 0 | AN257: =R[-1]C-R[-2]C4*R[-2]C -> 0 | AO257: =R[-1]C-R[-2]C4*R[-2]C -> 0 | AP257: =R[-1]C-R[-2]C4*R[-2]C -> 0 | AQ257: =R[-1]C-R[-2]C4*R[-2]C -> 0 | AR257: =R[-1]C-R[-2]C4*R[-2]C -> 0 | AS257: =R[-1]C-R[-2]C4*R[-2]C -> 0 | AT257: =R[-1]C-R[-2]C4*R[-2]C -> 0 | AU257: =R[-1]C-R[-2]C4*R[-2]C -> 0 | AV257: =R[-1]C-R[-2]C4*R[-2]C -> 0 | AW257: =R[-1]C-R[-2]C4*R[-2]C -> 0 | AX257: =R[-1]C-R[-2]C4*R[-2]C -> 0 | AY257: =R[-1]C-R[-2]C4*R[-2]C -> 0 | AZ257: =R[-1]C-R[-2]C4*R[-2]C -> 0 | BA257: =R[-1]C-R[-2]C4*R[-2]C -> 0 | BB257: =R[-1]C-R[-2]C4*R[-2]C -> 0 | BC257: =R[-1]C-R[-2]C4*R[-2]C -> 0 | BD257: =R[-1]C-R[-2]C4*R[-2]C -> 0 | BE257: =R[-1]C-R[-2]C4*R[-2]C -> 0 | BF257: =R[-1]C-R[-2]C4*R[-2]C -> 0 | BG257: =R[-1]C-R[-2]C4*R[-2]C -> -9100 | BO257: =SUM(RC[-61]:RC[-8]) -> -13000
A258: Visual Studio.Net for VB 6.0 Developers | B258: 2002-12-02T00:00:00.000 | C258: 2 | D258: 900 | E258: 350 | F258: 0 | G258: 0 | H258: 0 | I258: 0 | J258: 3 | K258: 0 | L258: 0 | M258: 0 | N258: 0 | O258: 0 | P258: 0 | Q258: 0 | R258: 0 | S258: 0 | T258: 0 | U258: 0 | V258: 0 | W258: 0 | X258: 0 | Y258: 0 | Z258: 2 | AA258: 0 | AB258: 0 | AC258: 0 | AD258: 0 | AE258: 0 | AF258: 0 | AG258: 0 | AH258: 0 | AI258: 0 | AJ258: 0 | AK258: 0 | AL258: 0 | AM258: 0 | AN258: 0 | AO258: 0 | AP258: 0 | AQ258: 0 | AR258: 0 | AS258: 0 | AT258: 0 | AU258: 0 | AV258: 0 | AW258: 0 | AX258: 0 | AY258: 0 | AZ258: 0 | BA258: 0 | BB258: 0 | BC258: 0 | BD258: 0 | BE258: 0 | BF258: 0 | BG258: 0 | BK258: =SUM(RC[-57]:RC[-4]) -> 5 | BL258: =RC[-61]*RC[-1] -> 10
D259: Total | F259: =R[-1]C*R258C5 -> 0 | G259: =R[-1]C*R258C5 -> 0 | H259: =R[-1]C*R258C5 -> 0 | I259: =R[-1]C*R258C5 -> 0 | J259: =R[-1]C*R258C5 -> 1050 | K259: =R[-1]C*R258C5 -> 0 | L259: =R[-1]C*R258C5 -> 0 | M259: =R[-1]C*R258C5 -> 0 | N259: =R[-1]C*R258C5 -> 0 | O259: =R[-1]C*R258C5 -> 0 | P259: =R[-1]C*R258C5 -> 0 | Q259: =R[-1]C*R258C5 -> 0 | R259: =R[-1]C*R258C5 -> 0 | S259: =R[-1]C*R258C5 -> 0 | T259: =R[-1]C*R258C5 -> 0 | U259: =R[-1]C*R258C5 -> 0 | V259: =R[-1]C*R258C5 -> 0 | W259: =R[-1]C*R258C5 -> 0 | X259: =R[-1]C*R258C5 -> 0 | Y259: =R[-1]C*R258C5 -> 0 | Z259: =R[-1]C*R258C5 -> 700 | AA259: =R[-1]C*R258C5 -> 0 | AB259: =R[-1]C*R258C5 -> 0 | AC259: =R[-1]C*R258C5 -> 0 | AD259: =R[-1]C*R258C5 -> 0 | AE259: =R[-1]C*R258C5 -> 0 | AF259: =R[-1]C*R258C5 -> 0 | AG259: =R[-1]C*R258C5 -> 0 | AH259: =R[-1]C*R258C5 -> 0 | AI259: =R[-1]C*R258C5 -> 0 | AJ259: =R[-1]C*R258C5 -> 0 | AK259: =R[-1]C*R258C5 -> 0 | AL259: =R[-1]C*R258C5 -> 0 | AM259: =R[-1]C*R258C5 -> 0 | AN259: =R[-1]C*R258C5 -> 0 | AO259: =R[-1]C*R258C5 -> 0 | AP259: =R[-1]C*R258C5 -> 0 | AQ259: =R[-1]C*R258C5 -> 0 | AR259: =R[-1]C*R258C5 -> 0 | AS259: =R[-1]C*R258C5 -> 0 | AT259: =R[-1]C*R258C5 -> 0 | AU259: =R[-1]C*R258C5 -> 0 | AV259: =R[-1]C*R258C5 -> 0 | AW259: =R[-1]C*R258C5 -> 0 | AX259: =R[-1]C*R258C5 -> 0 | AY259: =R[-1]C*R258C5 -> 0 | AZ259: =R[-1]C*R258C5 -> 0 | BA259: =R[-1]C*R258C5 -> 0 | BB259: =R[-1]C*R258C5 -> 0 | BC259: =R[-1]C*R258C5 -> 0 | BD259: =R[-1]C*R258C5 -> 0 | BE259: =R[-1]C*R258C5 -> 0 | BF259: =R[-1]C*R258C5 -> 0 | BG259: =R[-1]C*R258C5 -> 0 | BM259: =R[-1]C[-61]*R[-1]C[-2] -> 4500 | BN259: =RC[-1]-RC[1] -> 2750 | BO259: =SUM(RC[-61]:RC[-8]) -> 1750
D260: Total Savings | F260: =R[-1]C-R[-2]C4*R[-2]C -> 0 | G260: =R[-1]C-R[-2]C4*R[-2]C -> 0 | H260: =R[-1]C-R[-2]C4*R[-2]C -> 0 | I260: =R[-1]C-R[-2]C4*R[-2]C -> 0 | J260: =R[-1]C-R[-2]C4*R[-2]C -> -1650 | K260: =R[-1]C-R[-2]C4*R[-2]C -> 0 | L260: =R[-1]C-R[-2]C4*R[-2]C -> 0 | M260: =R[-1]C-R[-2]C4*R[-2]C -> 0 | N260: =R[-1]C-R[-2]C4*R[-2]C -> 0 | O260: =R[-1]C-R[-2]C4*R[-2]C -> 0 | P260: =R[-1]C-R[-2]C4*R[-2]C -> 0 | Q260: =R[-1]C-R[-2]C4*R[-2]C -> 0 | R260: =R[-1]C-R[-2]C4*R[-2]C -> 0 | S260: =R[-1]C-R[-2]C4*R[-2]C -> 0 | T260: =R[-1]C-R[-2]C4*R[-2]C -> 0 | U260: =R[-1]C-R[-2]C4*R[-2]C -> 0 | V260: =R[-1]C-R[-2]C4*R[-2]C -> 0 | W260: =R[-1]C-R[-2]C4*R[-2]C -> 0 | X260: =R[-1]C-R[-2]C4*R[-2]C -> 0 | Y260: =R[-1]C-R[-2]C4*R[-2]C -> 0 | Z260: =R[-1]C-R[-2]C4*R[-2]C -> -1100 | AA260: =R[-1]C-R[-2]C4*R[-2]C -> 0 | AB260: =R[-1]C-R[-2]C4*R[-2]C -> 0 | AC260: =R[-1]C-R[-2]C4*R[-2]C -> 0 | AD260: =R[-1]C-R[-2]C4*R[-2]C -> 0 | AE260: =R[-1]C-R[-2]C4*R[-2]C -> 0 | AF260: =R[-1]C-R[-2]C4*R[-2]C -> 0 | AG260: =R[-1]C-R[-2]C4*R[-2]C -> 0 | AH260: =R[-1]C-R[-2]C4*R[-2]C -> 0 | AI260: =R[-1]C-R[-2]C4*R[-2]C -> 0 | AJ260: =R[-1]C-R[-2]C4*R[-2]C -> 0 | AK260: =R[-1]C-R[-2]C4*R[-2]C -> 0 | AL260: =R[-1]C-R[-2]C4*R[-2]C -> 0 | AM260: =R[-1]C-R[-2]C4*R[-2]C -> 0 | AN260: =R[-1]C-R[-2]C4*R[-2]C -> 0 | AO260: =R[-1]C-R[-2]C4*R[-2]C -> 0 | AP260: =R[-1]C-R[-2]C4*R[-2]C -> 0 | AQ260: =R[-1]C-R[-2]C4*R[-2]C -> 0 | AR260: =R[-1]C-R[-2]C4*R[-2]C -> 0 | AS260: =R[-1]C-R[-2]C4*R[-2]C -> 0 | AT260: =R[-1]C-R[-2]C4*R[-2]C -> 0 | AU260: =R[-1]C-R[-2]C4*R[-2]C -> 0 | AV260: =R[-1]C-R[-2]C4*R[-2]C -> 0 | AW260: =R[-1]C-R[-2]C4*R[-2]C -> 0 | AX260: =R[-1]C-R[-2]C4*R[-2]C -> 0 | AY260: =R[-1]C-R[-2]C4*R[-2]C -> 0 | AZ260: =R[-1]C-R[-2]C4*R[-2]C -> 0 | BA260: =R[-1]C-R[-2]C4*R[-2]C -> 0 | BB260: =R[-1]C-R[-2]C4*R[-2]C -> 0 | BC260: =R[-1]C-R[-2]C4*R[-2]C -> 0 | BD260: =R[-1]C-R[-2]C4*R[-2]C -> 0 | BE260: =R[-1]C-R[-2]C4*R[-2]C -> 0 | BF260: =R[-1]C-R[-2]C4*R[-2]C -> 0 | BG260: =R[-1]C-R[-2]C4*R[-2]C -> 0 | BO260: =SUM(RC[-61]:RC[-8]) -> -2750
A261: Creating High Performance Project Teams | B261: 2002-12-04T00:00:00.000 | C261: 2 | D261: 1395 | E261: 575 | F261: 0 | G261: 0 | H261: 0 | I261: 1 | J261: 1 | K261: 0 | L261: 0 | M261: 0 | N261: 0 | O261: 0 | P261: 0 | Q261: 0 | R261: 0 | S261: 0 | T261: 0 | U261: 0 | V261: 0 | W261: 0 | X261: 0 | Y261: 0 | Z261: 1 | AA261: 0 | AB261: 0 | AC261: 0 | AD261: 5 | AE261: 0 | AF261: 0 | AG261: 0 | AH261: 0 | AI261: 0 | AJ261: 0 | AK261: 0 | AL261: 0 | AM261: 0 | AN261: 0 | AO261: 0 | AP261: 0 | AQ261: 0 | AR261: 0 | AS261: 0 | AT261: 0 | AU261: 0 | AV261: 0 | AW261: 0 | AX261: 0 | AY261: 0 | AZ261: 0 | BA261: 0 | BB261: 0 | BC261: 0 | BD261: 0 | BE261: 4 | BF261: 0 | BG261: 0 | BK261: 12 | BL261: =RC[-61]*RC[-1] -> 24
D262: Total | F262: =R[-1]C*R261C5 -> 0 | G262: =R[-1]C*R261C5 -> 0 | H262: =R[-1]C*R261C5 -> 0 | I262: =R[-1]C*R261C5 -> 575 | J262: =R[-1]C*R261C5 -> 575 | K262: =R[-1]C*R261C5 -> 0 | L262: =R[-1]C*R261C5 -> 0 | M262: =R[-1]C*R261C5 -> 0 | N262: =R[-1]C*R261C5 -> 0 | O262: =R[-1]C*R261C5 -> 0 | P262: =R[-1]C*R261C5 -> 0 | Q262: =R[-1]C*R261C5 -> 0 | R262: =R[-1]C*R261C5 -> 0 | S262: =R[-1]C*R261C5 -> 0 | T262: =R[-1]C*R261C5 -> 0 | U262: =R[-1]C*R261C5 -> 0 | V262: =R[-1]C*R261C5 -> 0 | W262: =R[-1]C*R261C5 -> 0 | X262: =R[-1]C*R261C5 -> 0 | Y262: =R[-1]C*R261C5 -> 0 | Z262: =R[-1]C*R261C5 -> 575 | AA262: =R[-1]C*R261C5 -> 0 | AB262: =R[-1]C*R261C5 -> 0 | AC262: =R[-1]C*R261C5 -> 0 | AD262: =R[-1]C*R261C5 -> 2875 | AE262: =R[-1]C*R261C5 -> 0 | AF262: =R[-1]C*R261C5 -> 0 | AG262: =R[-1]C*R261C5 -> 0 | AH262: =R[-1]C*R261C5 -> 0 | AI262: =R[-1]C*R261C5 -> 0 | AJ262: =R[-1]C*R261C5 -> 0 | AK262: =R[-1]C*R261C5 -> 0 | AL262: =R[-1]C*R261C5 -> 0 | AM262: =R[-1]C*R261C5 -> 0 | AN262: =R[-1]C*R261C5 -> 0 | AO262: =R[-1]C*R261C5 -> 0 | AP262: =R[-1]C*R261C5 -> 0 | AQ262: =R[-1]C*R261C5 -> 0 | AR262: =R[-1]C*R261C5 -> 0 | AS262: =R[-1]C*R261C5 -> 0 | AT262: =R[-1]C*R261C5 -> 0 | AU262: =R[-1]C*R261C5 -> 0 | AV262: =R[-1]C*R261C5 -> 0 | AW262: =R[-1]C*R261C5 -> 0 | AX262: =R[-1]C*R261C5 -> 0 | AY262: =R[-1]C*R261C5 -> 0 | AZ262: =R[-1]C*R261C5 -> 0 | BA262: =R[-1]C*R261C5 -> 0 | BB262: =R[-1]C*R261C5 -> 0 | BC262: =R[-1]C*R261C5 -> 0 | BD262: =R[-1]C*R261C5 -> 0 | BE262: =R[-1]C*R261C5 -> 2300 | BF262: =R[-1]C*R261C5 -> 0 | BG262: =R[-1]C*R261C5 -> 0 | BM262: =R[-1]C[-61]*R[-1]C[-2] -> 16740 | BN262: =RC[-1]-RC[1] -> 9840 | BO262: =SUM(RC[-61]:RC[-8]) -> 6900
D263: Total Savings | F263: =R[-1]C-R[-2]C4*R[-2]C -> 0 | G263: =R[-1]C-R[-2]C4*R[-2]C -> 0 | H263: =R[-1]C-R[-2]C4*R[-2]C -> 0 | I263: =R[-1]C-R[-2]C4*R[-2]C -> -820 | J263: =R[-1]C-R[-2]C4*R[-2]C -> -820 | K263: =R[-1]C-R[-2]C4*R[-2]C -> 0 | L263: =R[-1]C-R[-2]C4*R[-2]C -> 0 | M263: =R[-1]C-R[-2]C4*R[-2]C -> 0 | N263: =R[-1]C-R[-2]C4*R[-2]C -> 0 | O263: =R[-1]C-R[-2]C4*R[-2]C -> 0 | P263: =R[-1]C-R[-2]C4*R[-2]C -> 0 | Q263: =R[-1]C-R[-2]C4*R[-2]C -> 0 | R263: =R[-1]C-R[-2]C4*R[-2]C -> 0 | S263: =R[-1]C-R[-2]C4*R[-2]C -> 0 | T263: =R[-1]C-R[-2]C4*R[-2]C -> 0 | U263: =R[-1]C-R[-2]C4*R[-2]C -> 0 | V263: =R[-1]C-R[-2]C4*R[-2]C -> 0 | W263: =R[-1]C-R[-2]C4*R[-2]C -> 0 | X263: =R[-1]C-R[-2]C4*R[-2]C -> 0 | Y263: =R[-1]C-R[-2]C4*R[-2]C -> 0 | Z263: =R[-1]C-R[-2]C4*R[-2]C -> -820 | AA263: =R[-1]C-R[-2]C4*R[-2]C -> 0 | AB263: =R[-1]C-R[-2]C4*R[-2]C -> 0 | AC263: =R[-1]C-R[-2]C4*R[-2]C -> 0 | AD263: =R[-1]C-R[-2]C4*R[-2]C -> -4100 | AE263: =R[-1]C-R[-2]C4*R[-2]C -> 0 | AF263: =R[-1]C-R[-2]C4*R[-2]C -> 0 | AG263: =R[-1]C-R[-2]C4*R[-2]C -> 0 | AH263: =R[-1]C-R[-2]C4*R[-2]C -> 0 | AI263: =R[-1]C-R[-2]C4*R[-2]C -> 0 | AJ263: =R[-1]C-R[-2]C4*R[-2]C -> 0 | AK263: =R[-1]C-R[-2]C4*R[-2]C -> 0 | AL263: =R[-1]C-R[-2]C4*R[-2]C -> 0 | AM263: =R[-1]C-R[-2]C4*R[-2]C -> 0 | AN263: =R[-1]C-R[-2]C4*R[-2]C -> 0 | AO263: =R[-1]C-R[-2]C4*R[-2]C -> 0 | AP263: =R[-1]C-R[-2]C4*R[-2]C -> 0 | AQ263: =R[-1]C-R[-2]C4*R[-2]C -> 0 | AR263: =R[-1]C-R[-2]C4*R[-2]C -> 0 | AS263: =R[-1]C-R[-2]C4*R[-2]C -> 0 | AT263: =R[-1]C-R[-2]C4*R[-2]C -> 0 | AU263: =R[-1]C-R[-2]C4*R[-2]C -> 0 | AV263: =R[-1]C-R[-2]C4*R[-2]C -> 0 | AW263: =R[-1]C-R[-2]C4*R[-2]C -> 0 | AX263: =R[-1]C-R[-2]C4*R[-2]C -> 0 | AY263: =R[-1]C-R[-2]C4*R[-2]C -> 0 | AZ263: =R[-1]C-R[-2]C4*R[-2]C -> 0 | BA263: =R[-1]C-R[-2]C4*R[-2]C -> 0 | BB263: =R[-1]C-R[-2]C4*R[-2]C -> 0 | BC263: =R[-1]C-R[-2]C4*R[-2]C -> 0 | BD263: =R[-1]C-R[-2]C4*R[-2]C -> 0 | BE263: =R[-1]C-R[-2]C4*R[-2]C -> -3280 | BF263: =R[-1]C-R[-2]C4*R[-2]C -> 0 | BG263: =R[-1]C-R[-2]C4*R[-2]C -> 0 | BO263: =SUM(RC[-61]:RC[-8]) -> -9840
A264: Crystal Reports 8.5 | B264: 2002-12-16T00:00:00.000 | C264: 2 | D264: 800 | E264: 232 | F264: 0 | G264: 0 | H264: 0 | I264: 0 | J264: 13 | K264: 0 | L264: 0 | M264: 0 | N264: 0 | O264: 0 | P264: 0 | Q264: 0 | R264: 0 | S264: 0 | T264: 0 | U264: 0 | V264: 0 | W264: 0 | X264: 0 | Y264: 0 | Z264: 0 | AA264: 0 | AB264: 0 | AC264: 0 | AD264: 0 | AE264: 0 | AF264: 2 | AG264: 0 | AH264: 0 | AI264: 0 | AJ264: 0 | AK264: 0 | AL264: 0 | AM264: 0 | AN264: 0 | AO264: 0 | AP264: 0 | AQ264: 0 | AR264: 0 | AS264: 0 | AT264: 0 | AU264: 0 | AV264: 0 | AW264: 0 | AX264: 0 | AY264: 0 | AZ264: 0 | BA264: 0 | BB264: 0 | BC264: 0 | BD264: 0 | BE264: 0 | BF264: 0 | BG264: 0 | BK264: =SUM(RC[-57]:RC[-4]) -> 15 | BL264: =RC[-61]*RC[-1] -> 30
D265: Total | F265: =R[-1]C*R264C5 -> 0 | G265: =R[-1]C*R264C5 -> 0 | H265: =R[-1]C*R264C5 -> 0 | I265: =R[-1]C*R264C5 -> 0 | J265: =R[-1]C*R264C5 -> 3016 | K265: =R[-1]C*R264C5 -> 0 | L265: =R[-1]C*R264C5 -> 0 | M265: =R[-1]C*R264C5 -> 0 | N265: =R[-1]C*R264C5 -> 0 | O265: =R[-1]C*R264C5 -> 0 | P265: =R[-1]C*R264C5 -> 0 | Q265: =R[-1]C*R264C5 -> 0 | R265: =R[-1]C*R264C5 -> 0 | S265: =R[-1]C*R264C5 -> 0 | T265: =R[-1]C*R264C5 -> 0 | U265: =R[-1]C*R264C5 -> 0 | V265: =R[-1]C*R264C5 -> 0 | W265: =R[-1]C*R264C5 -> 0 | X265: =R[-1]C*R264C5 -> 0 | Y265: =R[-1]C*R264C5 -> 0 | Z265: =R[-1]C*R264C5 -> 0 | AA265: =R[-1]C*R264C5 -> 0 | AB265: =R[-1]C*R264C5 -> 0 | AC265: =R[-1]C*R264C5 -> 0 | AD265: =R[-1]C*R264C5 -> 0 | AE265: =R[-1]C*R264C5 -> 0 | AF265: =R[-1]C*R264C5 -> 464 | AG265: =R[-1]C*R264C5 -> 0 | AH265: =R[-1]C*R264C5 -> 0 | AI265: =R[-1]C*R264C5 -> 0 | AJ265: =R[-1]C*R264C5 -> 0 | AK265: =R[-1]C*R264C5 -> 0 | AL265: =R[-1]C*R264C5 -> 0 | AM265: =R[-1]C*R264C5 -> 0 | AN265: =R[-1]C*R264C5 -> 0 | AO265: =R[-1]C*R264C5 -> 0 | AP265: =R[-1]C*R264C5 -> 0 | AQ265: =R[-1]C*R264C5 -> 0 | AR265: =R[-1]C*R264C5 -> 0 | AS265: =R[-1]C*R264C5 -> 0 | AT265: =R[-1]C*R264C5 -> 0 | AU265: =R[-1]C*R264C5 -> 0 | AV265: =R[-1]C*R264C5 -> 0 | AW265: =R[-1]C*R264C5 -> 0 | AX265: =R[-1]C*R264C5 -> 0 | AY265: =R[-1]C*R264C5 -> 0 | AZ265: =R[-1]C*R264C5 -> 0 | BA265: =R[-1]C*R264C5 -> 0 | BB265: =R[-1]C*R264C5 -> 0 | BC265: =R[-1]C*R264C5 -> 0 | BD265: =R[-1]C*R264C5 -> 0 | BE265: =R[-1]C*R264C5 -> 0 | BF265: =R[-1]C*R264C5 -> 0 | BG265: =R[-1]C*R264C5 -> 0 | BM265: =R[-1]C[-61]*R[-1]C[-2] -> 12000 | BN265: =RC[-1]-RC[1] -> 8520 | BO265: =SUM(RC[-61]:RC[-8]) -> 3480
D266: Total Savings | F266: =R[-1]C-R[-2]C4*R[-2]C -> 0 | G266: =R[-1]C-R[-2]C4*R[-2]C -> 0 | H266: =R[-1]C-R[-2]C4*R[-2]C -> 0 | I266: =R[-1]C-R[-2]C4*R[-2]C -> 0 | J266: =R[-1]C-R[-2]C4*R[-2]C -> -7384 | K266: =R[-1]C-R[-2]C4*R[-2]C -> 0 | L266: =R[-1]C-R[-2]C4*R[-2]C -> 0 | M266: =R[-1]C-R[-2]C4*R[-2]C -> 0 | N266: =R[-1]C-R[-2]C4*R[-2]C -> 0 | O266: =R[-1]C-R[-2]C4*R[-2]C -> 0 | P266: =R[-1]C-R[-2]C4*R[-2]C -> 0 | Q266: =R[-1]C-R[-2]C4*R[-2]C -> 0 | R266: =R[-1]C-R[-2]C4*R[-2]C -> 0 | S266: =R[-1]C-R[-2]C4*R[-2]C -> 0 | T266: =R[-1]C-R[-2]C4*R[-2]C -> 0 | U266: =R[-1]C-R[-2]C4*R[-2]C -> 0 | V266: =R[-1]C-R[-2]C4*R[-2]C -> 0 | W266: =R[-1]C-R[-2]C4*R[-2]C -> 0 | X266: =R[-1]C-R[-2]C4*R[-2]C -> 0 | Y266: =R[-1]C-R[-2]C4*R[-2]C -> 0 | Z266: =R[-1]C-R[-2]C4*R[-2]C -> 0 | AA266: =R[-1]C-R[-2]C4*R[-2]C -> 0 | AB266: =R[-1]C-R[-2]C4*R[-2]C -> 0 | AC266: =R[-1]C-R[-2]C4*R[-2]C -> 0 | AD266: =R[-1]C-R[-2]C4*R[-2]C -> 0 | AE266: =R[-1]C-R[-2]C4*R[-2]C -> 0 | AF266: =R[-1]C-R[-2]C4*R[-2]C -> -1136 | AG266: =R[-1]C-R[-2]C4*R[-2]C -> 0 | AH266: =R[-1]C-R[-2]C4*R[-2]C -> 0 | AI266: =R[-1]C-R[-2]C4*R[-2]C -> 0 | AJ266: =R[-1]C-R[-2]C4*R[-2]C -> 0 | AK266: =R[-1]C-R[-2]C4*R[-2]C -> 0 | AL266: =R[-1]C-R[-2]C4*R[-2]C -> 0 | AM266: =R[-1]C-R[-2]C4*R[-2]C -> 0 | AN266: =R[-1]C-R[-2]C4*R[-2]C -> 0 | AO266: =R[-1]C-R[-2]C4*R[-2]C -> 0 | AP266: =R[-1]C-R[-2]C4*R[-2]C -> 0 | AQ266: =R[-1]C-R[-2]C4*R[-2]C -> 0 | AR266: =R[-1]C-R[-2]C4*R[-2]C -> 0 | AS266: =R[-1]C-R[-2]C4*R[-2]C -> 0 | AT266: =R[-1]C-R[-2]C4*R[-2]C -> 0 | AU266: =R[-1]C-R[-2]C4*R[-2]C -> 0 | AV266: =R[-1]C-R[-2]C4*R[-2]C -> 0 | AW266: =R[-1]C-R[-2]C4*R[-2]C -> 0 | AX266: =R[-1]C-R[-2]C4*R[-2]C -> 0 | AY266: =R[-1]C-R[-2]C4*R[-2]C -> 0 | AZ266: =R[-1]C-R[-2]C4*R[-2]C -> 0 | BA266: =R[-1]C-R[-2]C4*R[-2]C -> 0 | BB266: =R[-1]C-R[-2]C4*R[-2]C -> 0 | BC266: =R[-1]C-R[-2]C4*R[-2]C -> 0 | BD266: =R[-1]C-R[-2]C4*R[-2]C -> 0 | BE266: =R[-1]C-R[-2]C4*R[-2]C -> 0 | BF266: =R[-1]C-R[-2]C4*R[-2]C -> 0 | BG266: =R[-1]C-R[-2]C4*R[-2]C -> 0 | BO266: =SUM(RC[-61]:RC[-8]) -> -8520
C268: =SUM(R[-265]C:R[-4]C) -> 210 | E268: Public Cost | F268: =R[1]C-R[2]C -> 60045 | G268: =R[1]C-R[2]C -> 8800 | H268: =R[1]C-R[2]C -> 3000 | I268: =R[1]C-R[2]C -> 10240 | J268: =R[1]C-R[2]C -> 148965 | K268: =R[1]C-R[2]C -> 122430 | L268: =R[1]C-R[2]C -> 24785 | M268: =R[1]C-R[2]C -> 25985 | N268: =R[1]C-R[2]C -> 1995 | O268: =R[1]C-R[2]C -> 3450 | P268: =R[1]C-R[2]C -> 1800 | Q268: =R[1]C-R[2]C -> 5045 | R268: =R[1]C-R[2]C -> 1850 | S268: =R[1]C-R[2]C -> 1595 | T268: =R[1]C-R[2]C -> 1595 | U268: =R[1]C-R[2]C -> 650 | V268: =R[1]C-R[2]C -> 900 | W268: =R[1]C-R[2]C -> 52685 | X268: =R[1]C-R[2]C -> 39120 | Y268: =R[1]C-R[2]C -> 60325 | Z268: =R[1]C-R[2]C -> 9090 | AA268: =R[1]C-R[2]C -> 4150 | AB268: =R[1]C-R[2]C -> 4500 | AC268: =R[1]C-R[2]C -> 1000 | AD268: =R[1]C-R[2]C -> 98935 | AE268: =R[1]C-R[2]C -> 22560 | AF268: =R[1]C-R[2]C -> 29555 | AG268: =R[1]C-R[2]C -> 8800 | AH268: =R[1]C-R[2]C -> 3300 | AI268: =R[1]C-R[2]C -> 11250 | AJ268: =R[1]C-R[2]C -> 20310 | AK268: =R[1]C-R[2]C -> 2595 | AL268: =R[1]C-R[2]C -> 1200 | AM268: =R[1]C-R[2]C -> 3525 | AN268: =R[1]C-R[2]C -> 1400 | AO268: =R[1]C-R[2]C -> 9765 | AP268: =R[1]C-R[2]C -> 5985 | AQ268: =R[1]C-R[2]C -> 5875 | AR268: =R[1]C-R[2]C -> 5985 | AS268: =R[1]C-R[2]C -> 1150 | AT268: =R[1]C-R[2]C -> 1295 | AU268: =R[1]C-R[2]C -> 1595 | AV268: =R[1]C-R[2]C -> 3885 | AW268: =R[1]C-R[2]C -> 1295 | AX268: =R[1]C-R[2]C -> 1595 | AY268: =R[1]C-R[2]C -> 5190 | AZ268: =R[1]C-R[2]C -> 2500 | BA268: =R[1]C-R[2]C -> 4400 | BB268: =R[1]C-R[2]C -> 7445 | BC268: =R[1]C-R[2]C -> 7185 | BD268: =R[1]C-R[2]C -> 8150 | BE268: =R[1]C-R[2]C -> 49410 | BF268: =R[1]C-R[2]C -> 11725 | BG268: =R[1]C-R[2]C -> 432445 | BH268: Public Cost Grand Total | BI268: =SUM(RC[-55]:RC[-2]) -> 1364305 | BK268: =SUM(R[-265]C:R[-4]C) -> 1023 | BL268: =SUM(R[-265]C:R[-4]C) -> 2406 | BM268: =SUM(R[-264]C:R[-3]C) -> 1364305 | BN268: =SUM(R[-264]C:R[-3]C) -> 838743 | BO268: =R[-264]C+R[-261]C+R[-258]C+R[-255]C+R[-252]C+R[-249]C+R[-246]C+R[-243]C+R[-240]C+R[-237]C+R[-234]C+R[-231]C+R[-228]C+R[-225]C+R[-222]C+R[-219]C+R[-216]C+R[-213]C+R[-210]C+R[-207]C+R[-204]C+R[-201]C+R[-198]C+R[-195]C+R[-192]C+R[-189]C+R[-186]C+R[-183]C+R[-180]C+R[-177]C+R[-174]C+R[-171]C+R[-168]C+R[-165]C+R[-162]C+R[-159]C+R[-156]C+R[-153]C+R[-150]C+R[-147]C+R[-144]C+R[-141]C+R[-138]C+R[-135]C+R[-132]C+R[-129]C+R[-126]C+R[-123]C+R[-120]C+R[-117]C+R[-114]C+R[-111]C+R[-108]C+R[-105]C+R[-102]C+R[-99]C+R[-96]C+R[-93]C+R[-90]C+R[-87]C+R[-84]C+R[-81]C+R[-78]C+R[-75]C+R[-72]C+R[-69]C+R[-66]C+R[-63]C+R[-60]C+R[-57]C+R[-54]C+R[-51]C+R[-48]C+R[-45]C+R[-42]C+R[-39]C+R[-36]C+R[-33]C+R[-30]C+R[-27]C+R[-24]C+R[-21]C+R[-18]C+R[-15]C+R[-12]C+R[-9]C+R[-6]C+R[-3]C -> 525562
E269: RISE Cost | F269: =R[-265]C+R[-262]C+R[-259]C+R[-256]C+R[-253]C+R[-250]C+R[-247]C+R[-244]C+R[-241]C+R[-238]C+R[-235]C+R[-232]C+R[-229]C+R[-226]C+R[-223]C+R[-220]C+R[-217]C+R[-214]C+R[-211]C+R[-208]C+R[-205]C+R[-202]C+R[-199]C+R[-196]C+R[-193]C+R[-190]C+R[-187]C+R[-184]C+R[-181]C+R[-178]C+R[-175]C+R[-172]C+R[-169]C+R[-166]C+R[-163]C+R[-160]C+R[-157]C+R[-154]C+R[-151]C+R[-148]C+R[-145]C+R[-142]C+R[-139]C+R[-136]C+R[-133]C+R[-130]C+R[-127]C+R[-124]C+R[-121]C+R[-118]C+R[-115]C+R[-112]C+R[-109]C+R[-106]C+R[-103]C+R[-100]C+R[-97]C+R[-94]C+R[-91]C+R[-88]C+R[-85]C+R[-82]C+R[-79]C+R[-76]C+R[-73]C+R[-70]C+R[-67]C+R[-64]C+R[-61]C+R[-58]C+R[-55]C+R[-52]C+R[-49]C+R[-46]C+R[-43]C+R[-40]C+R[-37]C+R[-34]C+R[-31]C+R[-28]C+R[-25]C+R[-22]C+R[-19]C+R[-16]C+R[-13]C+R[-10]C+R[-7]C+R[-4]C -> 23225 | G269: =R[-265]C+R[-262]C+R[-259]C+R[-256]C+R[-253]C+R[-250]C+R[-247]C+R[-244]C+R[-241]C+R[-238]C+R[-235]C+R[-232]C+R[-229]C+R[-226]C+R[-223]C+R[-220]C+R[-217]C+R[-214]C+R[-211]C+R[-208]C+R[-205]C+R[-202]C+R[-199]C+R[-196]C+R[-193]C+R[-190]C+R[-187]C+R[-184]C+R[-181]C+R[-178]C+R[-175]C+R[-172]C+R[-169]C+R[-166]C+R[-163]C+R[-160]C+R[-157]C+R[-154]C+R[-151]C+R[-148]C+R[-145]C+R[-142]C+R[-139]C+R[-136]C+R[-133]C+R[-130]C+R[-127]C+R[-124]C+R[-121]C+R[-118]C+R[-115]C+R[-112]C+R[-109]C+R[-106]C+R[-103]C+R[-100]C+R[-97]C+R[-94]C+R[-91]C+R[-88]C+R[-85]C+R[-82]C+R[-79]C+R[-76]C+R[-73]C+R[-70]C+R[-67]C+R[-64]C+R[-61]C+R[-58]C+R[-55]C+R[-52]C+R[-49]C+R[-46]C+R[-43]C+R[-40]C+R[-37]C+R[-34]C+R[-31]C+R[-28]C+R[-25]C+R[-22]C+R[-19]C+R[-16]C+R[-13]C+R[-10]C+R[-7]C+R[-4]C -> 3052 | H269: =R[-265]C+R[-262]C+R[-259]C+R[-256]C+R[-253]C+R[-250]C+R[-247]C+R[-244]C+R[-241]C+R[-238]C+R[-235]C+R[-232]C+R[-229]C+R[-226]C+R[-223]C+R[-220]C+R[-217]C+R[-214]C+R[-211]C+R[-208]C+R[-205]C+R[-202]C+R[-199]C+R[-196]C+R[-193]C+R[-190]C+R[-187]C+R[-184]C+R[-181]C+R[-178]C+R[-175]C+R[-172]C+R[-169]C+R[-166]C+R[-163]C+R[-160]C+R[-157]C+R[-154]C+R[-151]C+R[-148]C+R[-145]C+R[-142]C+R[-139]C+R[-136]C+R[-133]C+R[-130]C+R[-127]C+R[-124]C+R[-121]C+R[-118]C+R[-115]C+R[-112]C+R[-109]C+R[-106]C+R[-103]C+R[-100]C+R[-97]C+R[-94]C+R[-91]C+R[-88]C+R[-85]C+R[-82]C+R[-79]C+R[-76]C+R[-73]C+R[-70]C+R[-67]C+R[-64]C+R[-61]C+R[-58]C+R[-55]C+R[-52]C+R[-49]C+R[-46]C+R[-43]C+R[-40]C+R[-37]C+R[-34]C+R[-31]C+R[-28]C+R[-25]C+R[-22]C+R[-19]C+R[-16]C+R[-13]C+R[-10]C+R[-7]C+R[-4]C -> 1050 | I269: =R[-265]C+R[-262]C+R[-259]C+R[-256]C+R[-253]C+R[-250]C+R[-247]C+R[-244]C+R[-241]C+R[-238]C+R[-235]C+R[-232]C+R[-229]C+R[-226]C+R[-223]C+R[-220]C+R[-217]C+R[-214]C+R[-211]C+R[-208]C+R[-205]C+R[-202]C+R[-199]C+R[-196]C+R[-193]C+R[-190]C+R[-187]C+R[-184]C+R[-181]C+R[-178]C+R[-175]C+R[-172]C+R[-169]C+R[-166]C+R[-163]C+R[-160]C+R[-157]C+R[-154]C+R[-151]C+R[-148]C+R[-145]C+R[-142]C+R[-139]C+R[-136]C+R[-133]C+R[-130]C+R[-127]C+R[-124]C+R[-121]C+R[-118]C+R[-115]C+R[-112]C+R[-109]C+R[-106]C+R[-103]C+R[-100]C+R[-97]C+R[-94]C+R[-91]C+R[-88]C+R[-85]C+R[-82]C+R[-79]C+R[-76]C+R[-73]C+R[-70]C+R[-67]C+R[-64]C+R[-61]C+R[-58]C+R[-55]C+R[-52]C+R[-49]C+R[-46]C+R[-43]C+R[-40]C+R[-37]C+R[-34]C+R[-31]C+R[-28]C+R[-25]C+R[-22]C+R[-19]C+R[-16]C+R[-13]C+R[-10]C+R[-7]C+R[-4]C -> 3875 | J269: =R[-265]C+R[-262]C+R[-259]C+R[-256]C+R[-253]C+R[-250]C+R[-247]C+R[-244]C+R[-241]C+R[-238]C+R[-235]C+R[-232]C+R[-229]C+R[-226]C+R[-223]C+R[-220]C+R[-217]C+R[-214]C+R[-211]C+R[-208]C+R[-205]C+R[-202]C+R[-199]C+R[-196]C+R[-193]C+R[-190]C+R[-187]C+R[-184]C+R[-181]C+R[-178]C+R[-175]C+R[-172]C+R[-169]C+R[-166]C+R[-163]C+R[-160]C+R[-157]C+R[-154]C+R[-151]C+R[-148]C+R[-145]C+R[-142]C+R[-139]C+R[-136]C+R[-133]C+R[-130]C+R[-127]C+R[-124]C+R[-121]C+R[-118]C+R[-115]C+R[-112]C+R[-109]C+R[-106]C+R[-103]C+R[-100]C+R[-97]C+R[-94]C+R[-91]C+R[-88]C+R[-85]C+R[-82]C+R[-79]C+R[-76]C+R[-73]C+R[-70]C+R[-67]C+R[-64]C+R[-61]C+R[-58]C+R[-55]C+R[-52]C+R[-49]C+R[-46]C+R[-43]C+R[-40]C+R[-37]C+R[-34]C+R[-31]C+R[-28]C+R[-25]C+R[-22]C+R[-19]C+R[-16]C+R[-13]C+R[-10]C+R[-7]C+R[-4]C -> 52327 | K269: =R[-265]C+R[-262]C+R[-259]C+R[-256]C+R[-253]C+R[-250]C+R[-247]C+R[-244]C+R[-241]C+R[-238]C+R[-235]C+R[-232]C+R[-229]C+R[-226]C+R[-223]C+R[-220]C+R[-217]C+R[-214]C+R[-211]C+R[-208]C+R[-205]C+R[-202]C+R[-199]C+R[-196]C+R[-193]C+R[-190]C+R[-187]C+R[-184]C+R[-181]C+R[-178]C+R[-175]C+R[-172]C+R[-169]C+R[-166]C+R[-163]C+R[-160]C+R[-157]C+R[-154]C+R[-151]C+R[-148]C+R[-145]C+R[-142]C+R[-139]C+R[-136]C+R[-133]C+R[-130]C+R[-127]C+R[-124]C+R[-121]C+R[-118]C+R[-115]C+R[-112]C+R[-109]C+R[-106]C+R[-103]C+R[-100]C+R[-97]C+R[-94]C+R[-91]C+R[-88]C+R[-85]C+R[-82]C+R[-79]C+R[-76]C+R[-73]C+R[-70]C+R[-67]C+R[-64]C+R[-61]C+R[-58]C+R[-55]C+R[-52]C+R[-49]C+R[-46]C+R[-43]C+R[-40]C+R[-37]C+R[-34]C+R[-31]C+R[-28]C+R[-25]C+R[-22]C+R[-19]C+R[-16]C+R[-13]C+R[-10]C+R[-7]C+R[-4]C -> 46672 | L269: =R[-265]C+R[-262]C+R[-259]C+R[-256]C+R[-253]C+R[-250]C+R[-247]C+R[-244]C+R[-241]C+R[-238]C+R[-235]C+R[-232]C+R[-229]C+R[-226]C+R[-223]C+R[-220]C+R[-217]C+R[-214]C+R[-211]C+R[-208]C+R[-205]C+R[-202]C+R[-199]C+R[-196]C+R[-193]C+R[-190]C+R[-187]C+R[-184]C+R[-181]C+R[-178]C+R[-175]C+R[-172]C+R[-169]C+R[-166]C+R[-163]C+R[-160]C+R[-157]C+R[-154]C+R[-151]C+R[-148]C+R[-145]C+R[-142]C+R[-139]C+R[-136]C+R[-133]C+R[-130]C+R[-127]C+R[-124]C+R[-121]C+R[-118]C+R[-115]C+R[-112]C+R[-109]C+R[-106]C+R[-103]C+R[-100]C+R[-97]C+R[-94]C+R[-91]C+R[-88]C+R[-85]C+R[-82]C+R[-79]C+R[-76]C+R[-73]C+R[-70]C+R[-67]C+R[-64]C+R[-61]C+R[-58]C+R[-55]C+R[-52]C+R[-49]C+R[-46]C+R[-43]C+R[-40]C+R[-37]C+R[-34]C+R[-31]C+R[-28]C+R[-25]C+R[-22]C+R[-19]C+R[-16]C+R[-13]C+R[-10]C+R[-7]C+R[-4]C -> 9450 | M269: =R[-265]C+R[-262]C+R[-259]C+R[-256]C+R[-253]C+R[-250]C+R[-247]C+R[-244]C+R[-241]C+R[-238]C+R[-235]C+R[-232]C+R[-229]C+R[-226]C+R[-223]C+R[-220]C+R[-217]C+R[-214]C+R[-211]C+R[-208]C+R[-205]C+R[-202]C+R[-199]C+R[-196]C+R[-193]C+R[-190]C+R[-187]C+R[-184]C+R[-181]C+R[-178]C+R[-175]C+R[-172]C+R[-169]C+R[-166]C+R[-163]C+R[-160]C+R[-157]C+R[-154]C+R[-151]C+R[-148]C+R[-145]C+R[-142]C+R[-139]C+R[-136]C+R[-133]C+R[-130]C+R[-127]C+R[-124]C+R[-121]C+R[-118]C+R[-115]C+R[-112]C+R[-109]C+R[-106]C+R[-103]C+R[-100]C+R[-97]C+R[-94]C+R[-91]C+R[-88]C+R[-85]C+R[-82]C+R[-79]C+R[-76]C+R[-73]C+R[-70]C+R[-67]C+R[-64]C+R[-61]C+R[-58]C+R[-55]C+R[-52]C+R[-49]C+R[-46]C+R[-43]C+R[-40]C+R[-37]C+R[-34]C+R[-31]C+R[-28]C+R[-25]C+R[-22]C+R[-19]C+R[-16]C+R[-13]C+R[-10]C+R[-7]C+R[-4]C -> 11402 | N269: =R[-265]C+R[-262]C+R[-259]C+R[-256]C+R[-253]C+R[-250]C+R[-247]C+R[-244]C+R[-241]C+R[-238]C+R[-235]C+R[-232]C+R[-229]C+R[-226]C+R[-223]C+R[-220]C+R[-217]C+R[-214]C+R[-211]C+R[-208]C+R[-205]C+R[-202]C+R[-199]C+R[-196]C+R[-193]C+R[-190]C+R[-187]C+R[-184]C+R[-181]C+R[-178]C+R[-175]C+R[-172]C+R[-169]C+R[-166]C+R[-163]C+R[-160]C+R[-157]C+R[-154]C+R[-151]C+R[-148]C+R[-145]C+R[-142]C+R[-139]C+R[-136]C+R[-133]C+R[-130]C+R[-127]C+R[-124]C+R[-121]C+R[-118]C+R[-115]C+R[-112]C+R[-109]C+R[-106]C+R[-103]C+R[-100]C+R[-97]C+R[-94]C+R[-91]C+R[-88]C+R[-85]C+R[-82]C+R[-79]C+R[-76]C+R[-73]C+R[-70]C+R[-67]C+R[-64]C+R[-61]C+R[-58]C+R[-55]C+R[-52]C+R[-49]C+R[-46]C+R[-43]C+R[-40]C+R[-37]C+R[-34]C+R[-31]C+R[-28]C+R[-25]C+R[-22]C+R[-19]C+R[-16]C+R[-13]C+R[-10]C+R[-7]C+R[-4]C -> 850 | O269: =R[-265]C+R[-262]C+R[-259]C+R[-256]C+R[-253]C+R[-250]C+R[-247]C+R[-244]C+R[-241]C+R[-238]C+R[-235]C+R[-232]C+R[-229]C+R[-226]C+R[-223]C+R[-220]C+R[-217]C+R[-214]C+R[-211]C+R[-208]C+R[-205]C+R[-202]C+R[-199]C+R[-196]C+R[-193]C+R[-190]C+R[-187]C+R[-184]C+R[-181]C+R[-178]C+R[-175]C+R[-172]C+R[-169]C+R[-166]C+R[-163]C+R[-160]C+R[-157]C+R[-154]C+R[-151]C+R[-148]C+R[-145]C+R[-142]C+R[-139]C+R[-136]C+R[-133]C+R[-130]C+R[-127]C+R[-124]C+R[-121]C+R[-118]C+R[-115]C+R[-112]C+R[-109]C+R[-106]C+R[-103]C+R[-100]C+R[-97]C+R[-94]C+R[-91]C+R[-88]C+R[-85]C+R[-82]C+R[-79]C+R[-76]C+R[-73]C+R[-70]C+R[-67]C+R[-64]C+R[-61]C+R[-58]C+R[-55]C+R[-52]C+R[-49]C+R[-46]C+R[-43]C+R[-40]C+R[-37]C+R[-34]C+R[-31]C+R[-28]C+R[-25]C+R[-22]C+R[-19]C+R[-16]C+R[-13]C+R[-10]C+R[-7]C+R[-4]C -> 1225 | P269: =R[-265]C+R[-262]C+R[-259]C+R[-256]C+R[-253]C+R[-250]C+R[-247]C+R[-244]C+R[-241]C+R[-238]C+R[-235]C+R[-232]C+R[-229]C+R[-226]C+R[-223]C+R[-220]C+R[-217]C+R[-214]C+R[-211]C+R[-208]C+R[-205]C+R[-202]C+R[-199]C+R[-196]C+R[-193]C+R[-190]C+R[-187]C+R[-184]C+R[-181]C+R[-178]C+R[-175]C+R[-172]C+R[-169]C+R[-166]C+R[-163]C+R[-160]C+R[-157]C+R[-154]C+R[-151]C+R[-148]C+R[-145]C+R[-142]C+R[-139]C+R[-136]C+R[-133]C+R[-130]C+R[-127]C+R[-124]C+R[-121]C+R[-118]C+R[-115]C+R[-112]C+R[-109]C+R[-106]C+R[-103]C+R[-100]C+R[-97]C+R[-94]C+R[-91]C+R[-88]C+R[-85]C+R[-82]C+R[-79]C+R[-76]C+R[-73]C+R[-70]C+R[-67]C+R[-64]C+R[-61]C+R[-58]C+R[-55]C+R[-52]C+R[-49]C+R[-46]C+R[-43]C+R[-40]C+R[-37]C+R[-34]C+R[-31]C+R[-28]C+R[-25]C+R[-22]C+R[-19]C+R[-16]C+R[-13]C+R[-10]C+R[-7]C+R[-4]C -> 550 | Q269: =R[-265]C+R[-262]C+R[-259]C+R[-256]C+R[-253]C+R[-250]C+R[-247]C+R[-244]C+R[-241]C+R[-238]C+R[-235]C+R[-232]C+R[-229]C+R[-226]C+R[-223]C+R[-220]C+R[-217]C+R[-214]C+R[-211]C+R[-208]C+R[-205]C+R[-202]C+R[-199]C+R[-196]C+R[-193]C+R[-190]C+R[-187]C+R[-184]C+R[-181]C+R[-178]C+R[-175]C+R[-172]C+R[-169]C+R[-166]C+R[-163]C+R[-160]C+R[-157]C+R[-154]C+R[-151]C+R[-148]C+R[-145]C+R[-142]C+R[-139]C+R[-136]C+R[-133]C+R[-130]C+R[-127]C+R[-124]C+R[-121]C+R[-118]C+R[-115]C+R[-112]C+R[-109]C+R[-106]C+R[-103]C+R[-100]C+R[-97]C+R[-94]C+R[-91]C+R[-88]C+R[-85]C+R[-82]C+R[-79]C+R[-76]C+R[-73]C+R[-70]C+R[-67]C+R[-64]C+R[-61]C+R[-58]C+R[-55]C+R[-52]C+R[-49]C+R[-46]C+R[-43]C+R[-40]C+R[-37]C+R[-34]C+R[-31]C+R[-28]C+R[-25]C+R[-22]C+R[-19]C+R[-16]C+R[-13]C+R[-10]C+R[-7]C+R[-4]C -> 1775 | R269: =R[-265]C+R[-262]C+R[-259]C+R[-256]C+R[-253]C+R[-250]C+R[-247]C+R[-244]C+R[-241]C+R[-238]C+R[-235]C+R[-232]C+R[-229]C+R[-226]C+R[-223]C+R[-220]C+R[-217]C+R[-214]C+R[-211]C+R[-208]C+R[-205]C+R[-202]C+R[-199]C+R[-196]C+R[-193]C+R[-190]C+R[-187]C+R[-184]C+R[-181]C+R[-178]C+R[-175]C+R[-172]C+R[-169]C+R[-166]C+R[-163]C+R[-160]C+R[-157]C+R[-154]C+R[-151]C+R[-148]C+R[-145]C+R[-142]C+R[-139]C+R[-136]C+R[-133]C+R[-130]C+R[-127]C+R[-124]C+R[-121]C+R[-118]C+R[-115]C+R[-112]C+R[-109]C+R[-106]C+R[-103]C+R[-100]C+R[-97]C+R[-94]C+R[-91]C+R[-88]C+R[-85]C+R[-82]C+R[-79]C+R[-76]C+R[-73]C+R[-70]C+R[-67]C+R[-64]C+R[-61]C+R[-58]C+R[-55]C+R[-52]C+R[-49]C+R[-46]C+R[-43]C+R[-40]C+R[-37]C+R[-34]C+R[-31]C+R[-28]C+R[-25]C+R[-22]C+R[-19]C+R[-16]C+R[-13]C+R[-10]C+R[-7]C+R[-4]C -> 509 | S269: =R[-265]C+R[-262]C+R[-259]C+R[-256]C+R[-253]C+R[-250]C+R[-247]C+R[-244]C+R[-241]C+R[-238]C+R[-235]C+R[-232]C+R[-229]C+R[-226]C+R[-223]C+R[-220]C+R[-217]C+R[-214]C+R[-211]C+R[-208]C+R[-205]C+R[-202]C+R[-199]C+R[-196]C+R[-193]C+R[-190]C+R[-187]C+R[-184]C+R[-181]C+R[-178]C+R[-175]C+R[-172]C+R[-169]C+R[-166]C+R[-163]C+R[-160]C+R[-157]C+R[-154]C+R[-151]C+R[-148]C+R[-145]C+R[-142]C+R[-139]C+R[-136]C+R[-133]C+R[-130]C+R[-127]C+R[-124]C+R[-121]C+R[-118]C+R[-115]C+R[-112]C+R[-109]C+R[-106]C+R[-103]C+R[-100]C+R[-97]C+R[-94]C+R[-91]C+R[-88]C+R[-85]C+R[-82]C+R[-79]C+R[-76]C+R[-73]C+R[-70]C+R[-67]C+R[-64]C+R[-61]C+R[-58]C+R[-55]C+R[-52]C+R[-49]C+R[-46]C+R[-43]C+R[-40]C+R[-37]C+R[-34]C+R[-31]C+R[-28]C+R[-25]C+R[-22]C+R[-19]C+R[-16]C+R[-13]C+R[-10]C+R[-7]C+R[-4]C -> 550 | T269: =R[-265]C+R[-262]C+R[-259]C+R[-256]C+R[-253]C+R[-250]C+R[-247]C+R[-244]C+R[-241]C+R[-238]C+R[-235]C+R[-232]C+R[-229]C+R[-226]C+R[-223]C+R[-220]C+R[-217]C+R[-214]C+R[-211]C+R[-208]C+R[-205]C+R[-202]C+R[-199]C+R[-196]C+R[-193]C+R[-190]C+R[-187]C+R[-184]C+R[-181]C+R[-178]C+R[-175]C+R[-172]C+R[-169]C+R[-166]C+R[-163]C+R[-160]C+R[-157]C+R[-154]C+R[-151]C+R[-148]C+R[-145]C+R[-142]C+R[-139]C+R[-136]C+R[-133]C+R[-130]C+R[-127]C+R[-124]C+R[-121]C+R[-118]C+R[-115]C+R[-112]C+R[-109]C+R[-106]C+R[-103]C+R[-100]C+R[-97]C+R[-94]C+R[-91]C+R[-88]C+R[-85]C+R[-82]C+R[-79]C+R[-76]C+R[-73]C+R[-70]C+R[-67]C+R[-64]C+R[-61]C+R[-58]C+R[-55]C+R[-52]C+R[-49]C+R[-46]C+R[-43]C+R[-40]C+R[-37]C+R[-34]C+R[-31]C+R[-28]C+R[-25]C+R[-22]C+R[-19]C+R[-16]C+R[-13]C+R[-10]C+R[-7]C+R[-4]C -> 550 | U269: =R[-265]C+R[-262]C+R[-259]C+R[-256]C+R[-253]C+R[-250]C+R[-247]C+R[-244]C+R[-241]C+R[-238]C+R[-235]C+R[-232]C+R[-229]C+R[-226]C+R[-223]C+R[-220]C+R[-217]C+R[-214]C+R[-211]C+R[-208]C+R[-205]C+R[-202]C+R[-199]C+R[-196]C+R[-193]C+R[-190]C+R[-187]C+R[-184]C+R[-181]C+R[-178]C+R[-175]C+R[-172]C+R[-169]C+R[-166]C+R[-163]C+R[-160]C+R[-157]C+R[-154]C+R[-151]C+R[-148]C+R[-145]C+R[-142]C+R[-139]C+R[-136]C+R[-133]C+R[-130]C+R[-127]C+R[-124]C+R[-121]C+R[-118]C+R[-115]C+R[-112]C+R[-109]C+R[-106]C+R[-103]C+R[-100]C+R[-97]C+R[-94]C+R[-91]C+R[-88]C+R[-85]C+R[-82]C+R[-79]C+R[-76]C+R[-73]C+R[-70]C+R[-67]C+R[-64]C+R[-61]C+R[-58]C+R[-55]C+R[-52]C+R[-49]C+R[-46]C+R[-43]C+R[-40]C+R[-37]C+R[-34]C+R[-31]C+R[-28]C+R[-25]C+R[-22]C+R[-19]C+R[-16]C+R[-13]C+R[-10]C+R[-7]C+R[-4]C -> 325 | V269: =R[-265]C+R[-262]C+R[-259]C+R[-256]C+R[-253]C+R[-250]C+R[-247]C+R[-244]C+R[-241]C+R[-238]C+R[-235]C+R[-232]C+R[-229]C+R[-226]C+R[-223]C+R[-220]C+R[-217]C+R[-214]C+R[-211]C+R[-208]C+R[-205]C+R[-202]C+R[-199]C+R[-196]C+R[-193]C+R[-190]C+R[-187]C+R[-184]C+R[-181]C+R[-178]C+R[-175]C+R[-172]C+R[-169]C+R[-166]C+R[-163]C+R[-160]C+R[-157]C+R[-154]C+R[-151]C+R[-148]C+R[-145]C+R[-142]C+R[-139]C+R[-136]C+R[-133]C+R[-130]C+R[-127]C+R[-124]C+R[-121]C+R[-118]C+R[-115]C+R[-112]C+R[-109]C+R[-106]C+R[-103]C+R[-100]C+R[-97]C+R[-94]C+R[-91]C+R[-88]C+R[-85]C+R[-82]C+R[-79]C+R[-76]C+R[-73]C+R[-70]C+R[-67]C+R[-64]C+R[-61]C+R[-58]C+R[-55]C+R[-52]C+R[-49]C+R[-46]C+R[-43]C+R[-40]C+R[-37]C+R[-34]C+R[-31]C+R[-28]C+R[-25]C+R[-22]C+R[-19]C+R[-16]C+R[-13]C+R[-10]C+R[-7]C+R[-4]C -> 400 | W269: =R[-265]C+R[-262]C+R[-259]C+R[-256]C+R[-253]C+R[-250]C+R[-247]C+R[-244]C+R[-241]C+R[-238]C+R[-235]C+R[-232]C+R[-229]C+R[-226]C+R[-223]C+R[-220]C+R[-217]C+R[-214]C+R[-211]C+R[-208]C+R[-205]C+R[-202]C+R[-199]C+R[-196]C+R[-193]C+R[-190]C+R[-187]C+R[-184]C+R[-181]C+R[-178]C+R[-175]C+R[-172]C+R[-169]C+R[-166]C+R[-163]C+R[-160]C+R[-157]C+R[-154]C+R[-151]C+R[-148]C+R[-145]C+R[-142]C+R[-139]C+R[-136]C+R[-133]C+R[-130]C+R[-127]C+R[-124]C+R[-121]C+R[-118]C+R[-115]C+R[-112]C+R[-109]C+R[-106]C+R[-103]C+R[-100]C+R[-97]C+R[-94]C+R[-91]C+R[-88]C+R[-85]C+R[-82]C+R[-79]C+R[-76]C+R[-73]C+R[-70]C+R[-67]C+R[-64]C+R[-61]C+R[-58]C+R[-55]C+R[-52]C+R[-49]C+R[-46]C+R[-43]C+R[-40]C+R[-37]C+R[-34]C+R[-31]C+R[-28]C+R[-25]C+R[-22]C+R[-19]C+R[-16]C+R[-13]C+R[-10]C+R[-7]C+R[-4]C -> 19494 | X269: =R[-265]C+R[-262]C+R[-259]C+R[-256]C+R[-253]C+R[-250]C+R[-247]C+R[-244]C+R[-241]C+R[-238]C+R[-235]C+R[-232]C+R[-229]C+R[-226]C+R[-223]C+R[-220]C+R[-217]C+R[-214]C+R[-211]C+R[-208]C+R[-205]C+R[-202]C+R[-199]C+R[-196]C+R[-193]C+R[-190]C+R[-187]C+R[-184]C+R[-181]C+R[-178]C+R[-175]C+R[-172]C+R[-169]C+R[-166]C+R[-163]C+R[-160]C+R[-157]C+R[-154]C+R[-151]C+R[-148]C+R[-145]C+R[-142]C+R[-139]C+R[-136]C+R[-133]C+R[-130]C+R[-127]C+R[-124]C+R[-121]C+R[-118]C+R[-115]C+R[-112]C+R[-109]C+R[-106]C+R[-103]C+R[-100]C+R[-97]C+R[-94]C+R[-91]C+R[-88]C+R[-85]C+R[-82]C+R[-79]C+R[-76]C+R[-73]C+R[-70]C+R[-67]C+R[-64]C+R[-61]C+R[-58]C+R[-55]C+R[-52]C+R[-49]C+R[-46]C+R[-43]C+R[-40]C+R[-37]C+R[-34]C+R[-31]C+R[-28]C+R[-25]C+R[-22]C+R[-19]C+R[-16]C+R[-13]C+R[-10]C+R[-7]C+R[-4]C -> 15125 | Y269: =R[-265]C+R[-262]C+R[-259]C+R[-256]C+R[-253]C+R[-250]C+R[-247]C+R[-244]C+R[-241]C+R[-238]C+R[-235]C+R[-232]C+R[-229]C+R[-226]C+R[-223]C+R[-220]C+R[-217]C+R[-214]C+R[-211]C+R[-208]C+R[-205]C+R[-202]C+R[-199]C+R[-196]C+R[-193]C+R[-190]C+R[-187]C+R[-184]C+R[-181]C+R[-178]C+R[-175]C+R[-172]C+R[-169]C+R[-166]C+R[-163]C+R[-160]C+R[-157]C+R[-154]C+R[-151]C+R[-148]C+R[-145]C+R[-142]C+R[-139]C+R[-136]C+R[-133]C+R[-130]C+R[-127]C+R[-124]C+R[-121]C+R[-118]C+R[-115]C+R[-112]C+R[-109]C+R[-106]C+R[-103]C+R[-100]C+R[-97]C+R[-94]C+R[-91]C+R[-88]C+R[-85]C+R[-82]C+R[-79]C+R[-76]C+R[-73]C+R[-70]C+R[-67]C+R[-64]C+R[-61]C+R[-58]C+R[-55]C+R[-52]C+R[-49]C+R[-46]C+R[-43]C+R[-40]C+R[-37]C+R[-34]C+R[-31]C+R[-28]C+R[-25]C+R[-22]C+R[-19]C+R[-16]C+R[-13]C+R[-10]C+R[-7]C+R[-4]C -> 26325 | Z269: =R[-265]C+R[-262]C+R[-259]C+R[-256]C+R[-253]C+R[-250]C+R[-247]C+R[-244]C+R[-241]C+R[-238]C+R[-235]C+R[-232]C+R[-229]C+R[-226]C+R[-223]C+R[-220]C+R[-217]C+R[-214]C+R[-211]C+R[-208]C+R[-205]C+R[-202]C+R[-199]C+R[-196]C+R[-193]C+R[-190]C+R[-187]C+R[-184]C+R[-181]C+R[-178]C+R[-175]C+R[-172]C+R[-169]C+R[-166]C+R[-163]C+R[-160]C+R[-157]C+R[-154]C+R[-151]C+R[-148]C+R[-145]C+R[-142]C+R[-139]C+R[-136]C+R[-133]C+R[-130]C+R[-127]C+R[-124]C+R[-121]C+R[-118]C+R[-115]C+R[-112]C+R[-109]C+R[-106]C+R[-103]C+R[-100]C+R[-97]C+R[-94]C+R[-91]C+R[-88]C+R[-85]C+R[-82]C+R[-79]C+R[-76]C+R[-73]C+R[-70]C+R[-67]C+R[-64]C+R[-61]C+R[-58]C+R[-55]C+R[-52]C+R[-49]C+R[-46]C+R[-43]C+R[-40]C+R[-37]C+R[-34]C+R[-31]C+R[-28]C+R[-25]C+R[-22]C+R[-19]C+R[-16]C+R[-13]C+R[-10]C+R[-7]C+R[-4]C -> 3862 | AA269: =R[-265]C+R[-262]C+R[-259]C+R[-256]C+R[-253]C+R[-250]C+R[-247]C+R[-244]C+R[-241]C+R[-238]C+R[-235]C+R[-232]C+R[-229]C+R[-226]C+R[-223]C+R[-220]C+R[-217]C+R[-214]C+R[-211]C+R[-208]C+R[-205]C+R[-202]C+R[-199]C+R[-196]C+R[-193]C+R[-190]C+R[-187]C+R[-184]C+R[-181]C+R[-178]C+R[-175]C+R[-172]C+R[-169]C+R[-166]C+R[-163]C+R[-160]C+R[-157]C+R[-154]C+R[-151]C+R[-148]C+R[-145]C+R[-142]C+R[-139]C+R[-136]C+R[-133]C+R[-130]C+R[-127]C+R[-124]C+R[-121]C+R[-118]C+R[-115]C+R[-112]C+R[-109]C+R[-106]C+R[-103]C+R[-100]C+R[-97]C+R[-94]C+R[-91]C+R[-88]C+R[-85]C+R[-82]C+R[-79]C+R[-76]C+R[-73]C+R[-70]C+R[-67]C+R[-64]C+R[-61]C+R[-58]C+R[-55]C+R[-52]C+R[-49]C+R[-46]C+R[-43]C+R[-40]C+R[-37]C+R[-34]C+R[-31]C+R[-28]C+R[-25]C+R[-22]C+R[-19]C+R[-16]C+R[-13]C+R[-10]C+R[-7]C+R[-4]C -> 1600 | AB269: =R[-265]C+R[-262]C+R[-259]C+R[-256]C+R[-253]C+R[-250]C+R[-247]C+R[-244]C+R[-241]C+R[-238]C+R[-235]C+R[-232]C+R[-229]C+R[-226]C+R[-223]C+R[-220]C+R[-217]C+R[-214]C+R[-211]C+R[-208]C+R[-205]C+R[-202]C+R[-199]C+R[-196]C+R[-193]C+R[-190]C+R[-187]C+R[-184]C+R[-181]C+R[-178]C+R[-175]C+R[-172]C+R[-169]C+R[-166]C+R[-163]C+R[-160]C+R[-157]C+R[-154]C+R[-151]C+R[-148]C+R[-145]C+R[-142]C+R[-139]C+R[-136]C+R[-133]C+R[-130]C+R[-127]C+R[-124]C+R[-121]C+R[-118]C+R[-115]C+R[-112]C+R[-109]C+R[-106]C+R[-103]C+R[-100]C+R[-97]C+R[-94]C+R[-91]C+R[-88]C+R[-85]C+R[-82]C+R[-79]C+R[-76]C+R[-73]C+R[-70]C+R[-67]C+R[-64]C+R[-61]C+R[-58]C+R[-55]C+R[-52]C+R[-49]C+R[-46]C+R[-43]C+R[-40]C+R[-37]C+R[-34]C+R[-31]C+R[-28]C+R[-25]C+R[-22]C+R[-19]C+R[-16]C+R[-13]C+R[-10]C+R[-7]C+R[-4]C -> 1575 | AC269: =R[-265]C+R[-262]C+R[-259]C+R[-256]C+R[-253]C+R[-250]C+R[-247]C+R[-244]C+R[-241]C+R[-238]C+R[-235]C+R[-232]C+R[-229]C+R[-226]C+R[-223]C+R[-220]C+R[-217]C+R[-214]C+R[-211]C+R[-208]C+R[-205]C+R[-202]C+R[-199]C+R[-196]C+R[-193]C+R[-190]C+R[-187]C+R[-184]C+R[-181]C+R[-178]C+R[-175]C+R[-172]C+R[-169]C+R[-166]C+R[-163]C+R[-160]C+R[-157]C+R[-154]C+R[-151]C+R[-148]C+R[-145]C+R[-142]C+R[-139]C+R[-136]C+R[-133]C+R[-130]C+R[-127]C+R[-124]C+R[-121]C+R[-118]C+R[-115]C+R[-112]C+R[-109]C+R[-106]C+R[-103]C+R[-100]C+R[-97]C+R[-94]C+R[-91]C+R[-88]C+R[-85]C+R[-82]C+R[-79]C+R[-76]C+R[-73]C+R[-70]C+R[-67]C+R[-64]C+R[-61]C+R[-58]C+R[-55]C+R[-52]C+R[-49]C+R[-46]C+R[-43]C+R[-40]C+R[-37]C+R[-34]C+R[-31]C+R[-28]C+R[-25]C+R[-22]C+R[-19]C+R[-16]C+R[-13]C+R[-10]C+R[-7]C+R[-4]C -> 350 | AD269: =R[-265]C+R[-262]C+R[-259]C+R[-256]C+R[-253]C+R[-250]C+R[-247]C+R[-244]C+R[-241]C+R[-238]C+R[-235]C+R[-232]C+R[-229]C+R[-226]C+R[-223]C+R[-220]C+R[-217]C+R[-214]C+R[-211]C+R[-208]C+R[-205]C+R[-202]C+R[-199]C+R[-196]C+R[-193]C+R[-190]C+R[-187]C+R[-184]C+R[-181]C+R[-178]C+R[-175]C+R[-172]C+R[-169]C+R[-166]C+R[-163]C+R[-160]C+R[-157]C+R[-154]C+R[-151]C+R[-148]C+R[-145]C+R[-142]C+R[-139]C+R[-136]C+R[-133]C+R[-130]C+R[-127]C+R[-124]C+R[-121]C+R[-118]C+R[-115]C+R[-112]C+R[-109]C+R[-106]C+R[-103]C+R[-100]C+R[-97]C+R[-94]C+R[-91]C+R[-88]C+R[-85]C+R[-82]C+R[-79]C+R[-76]C+R[-73]C+R[-70]C+R[-67]C+R[-64]C+R[-61]C+R[-58]C+R[-55]C+R[-52]C+R[-49]C+R[-46]C+R[-43]C+R[-40]C+R[-37]C+R[-34]C+R[-31]C+R[-28]C+R[-25]C+R[-22]C+R[-19]C+R[-16]C+R[-13]C+R[-10]C+R[-7]C+R[-4]C -> 32663 | AE269: =R[-265]C+R[-262]C+R[-259]C+R[-256]C+R[-253]C+R[-250]C+R[-247]C+R[-244]C+R[-241]C+R[-238]C+R[-235]C+R[-232]C+R[-229]C+R[-226]C+R[-223]C+R[-220]C+R[-217]C+R[-214]C+R[-211]C+R[-208]C+R[-205]C+R[-202]C+R[-199]C+R[-196]C+R[-193]C+R[-190]C+R[-187]C+R[-184]C+R[-181]C+R[-178]C+R[-175]C+R[-172]C+R[-169]C+R[-166]C+R[-163]C+R[-160]C+R[-157]C+R[-154]C+R[-151]C+R[-148]C+R[-145]C+R[-142]C+R[-139]C+R[-136]C+R[-133]C+R[-130]C+R[-127]C+R[-124]C+R[-121]C+R[-118]C+R[-115]C+R[-112]C+R[-109]C+R[-106]C+R[-103]C+R[-100]C+R[-97]C+R[-94]C+R[-91]C+R[-88]C+R[-85]C+R[-82]C+R[-79]C+R[-76]C+R[-73]C+R[-70]C+R[-67]C+R[-64]C+R[-61]C+R[-58]C+R[-55]C+R[-52]C+R[-49]C+R[-46]C+R[-43]C+R[-40]C+R[-37]C+R[-34]C+R[-31]C+R[-28]C+R[-25]C+R[-22]C+R[-19]C+R[-16]C+R[-13]C+R[-10]C+R[-7]C+R[-4]C -> 9149 | AF269: =R[-265]C+R[-262]C+R[-259]C+R[-256]C+R[-253]C+R[-250]C+R[-247]C+R[-244]C+R[-241]C+R[-238]C+R[-235]C+R[-232]C+R[-229]C+R[-226]C+R[-223]C+R[-220]C+R[-217]C+R[-214]C+R[-211]C+R[-208]C+R[-205]C+R[-202]C+R[-199]C+R[-196]C+R[-193]C+R[-190]C+R[-187]C+R[-184]C+R[-181]C+R[-178]C+R[-175]C+R[-172]C+R[-169]C+R[-166]C+R[-163]C+R[-160]C+R[-157]C+R[-154]C+R[-151]C+R[-148]C+R[-145]C+R[-142]C+R[-139]C+R[-136]C+R[-133]C+R[-130]C+R[-127]C+R[-124]C+R[-121]C+R[-118]C+R[-115]C+R[-112]C+R[-109]C+R[-106]C+R[-103]C+R[-100]C+R[-97]C+R[-94]C+R[-91]C+R[-88]C+R[-85]C+R[-82]C+R[-79]C+R[-76]C+R[-73]C+R[-70]C+R[-67]C+R[-64]C+R[-61]C+R[-58]C+R[-55]C+R[-52]C+R[-49]C+R[-46]C+R[-43]C+R[-40]C+R[-37]C+R[-34]C+R[-31]C+R[-28]C+R[-25]C+R[-22]C+R[-19]C+R[-16]C+R[-13]C+R[-10]C+R[-7]C+R[-4]C -> 10625 | AG269: =R[-265]C+R[-262]C+R[-259]C+R[-256]C+R[-253]C+R[-250]C+R[-247]C+R[-244]C+R[-241]C+R[-238]C+R[-235]C+R[-232]C+R[-229]C+R[-226]C+R[-223]C+R[-220]C+R[-217]C+R[-214]C+R[-211]C+R[-208]C+R[-205]C+R[-202]C+R[-199]C+R[-196]C+R[-193]C+R[-190]C+R[-187]C+R[-184]C+R[-181]C+R[-178]C+R[-175]C+R[-172]C+R[-169]C+R[-166]C+R[-163]C+R[-160]C+R[-157]C+R[-154]C+R[-151]C+R[-148]C+R[-145]C+R[-142]C+R[-139]C+R[-136]C+R[-133]C+R[-130]C+R[-127]C+R[-124]C+R[-121]C+R[-118]C+R[-115]C+R[-112]C+R[-109]C+R[-106]C+R[-103]C+R[-100]C+R[-97]C+R[-94]C+R[-91]C+R[-88]C+R[-85]C+R[-82]C+R[-79]C+R[-76]C+R[-73]C+R[-70]C+R[-67]C+R[-64]C+R[-61]C+R[-58]C+R[-55]C+R[-52]C+R[-49]C+R[-46]C+R[-43]C+R[-40]C+R[-37]C+R[-34]C+R[-31]C+R[-28]C+R[-25]C+R[-22]C+R[-19]C+R[-16]C+R[-13]C+R[-10]C+R[-7]C+R[-4]C -> 3000 | AH269: =R[-265]C+R[-262]C+R[-259]C+R[-256]C+R[-253]C+R[-250]C+R[-247]C+R[-244]C+R[-241]C+R[-238]C+R[-235]C+R[-232]C+R[-229]C+R[-226]C+R[-223]C+R[-220]C+R[-217]C+R[-214]C+R[-211]C+R[-208]C+R[-205]C+R[-202]C+R[-199]C+R[-196]C+R[-193]C+R[-190]C+R[-187]C+R[-184]C+R[-181]C+R[-178]C+R[-175]C+R[-172]C+R[-169]C+R[-166]C+R[-163]C+R[-160]C+R[-157]C+R[-154]C+R[-151]C+R[-148]C+R[-145]C+R[-142]C+R[-139]C+R[-136]C+R[-133]C+R[-130]C+R[-127]C+R[-124]C+R[-121]C+R[-118]C+R[-115]C+R[-112]C+R[-109]C+R[-106]C+R[-103]C+R[-100]C+R[-97]C+R[-94]C+R[-91]C+R[-88]C+R[-85]C+R[-82]C+R[-79]C+R[-76]C+R[-73]C+R[-70]C+R[-67]C+R[-64]C+R[-61]C+R[-58]C+R[-55]C+R[-52]C+R[-49]C+R[-46]C+R[-43]C+R[-40]C+R[-37]C+R[-34]C+R[-31]C+R[-28]C+R[-25]C+R[-22]C+R[-19]C+R[-16]C+R[-13]C+R[-10]C+R[-7]C+R[-4]C -> 1225 | AI269: =R[-265]C+R[-262]C+R[-259]C+R[-256]C+R[-253]C+R[-250]C+R[-247]C+R[-244]C+R[-241]C+R[-238]C+R[-235]C+R[-232]C+R[-229]C+R[-226]C+R[-223]C+R[-220]C+R[-217]C+R[-214]C+R[-211]C+R[-208]C+R[-205]C+R[-202]C+R[-199]C+R[-196]C+R[-193]C+R[-190]C+R[-187]C+R[-184]C+R[-181]C+R[-178]C+R[-175]C+R[-172]C+R[-169]C+R[-166]C+R[-163]C+R[-160]C+R[-157]C+R[-154]C+R[-151]C+R[-148]C+R[-145]C+R[-142]C+R[-139]C+R[-136]C+R[-133]C+R[-130]C+R[-127]C+R[-124]C+R[-121]C+R[-118]C+R[-115]C+R[-112]C+R[-109]C+R[-106]C+R[-103]C+R[-100]C+R[-97]C+R[-94]C+R[-91]C+R[-88]C+R[-85]C+R[-82]C+R[-79]C+R[-76]C+R[-73]C+R[-70]C+R[-67]C+R[-64]C+R[-61]C+R[-58]C+R[-55]C+R[-52]C+R[-49]C+R[-46]C+R[-43]C+R[-40]C+R[-37]C+R[-34]C+R[-31]C+R[-28]C+R[-25]C+R[-22]C+R[-19]C+R[-16]C+R[-13]C+R[-10]C+R[-7]C+R[-4]C -> 5073 | AJ269: =R[-265]C+R[-262]C+R[-259]C+R[-256]C+R[-253]C+R[-250]C+R[-247]C+R[-244]C+R[-241]C+R[-238]C+R[-235]C+R[-232]C+R[-229]C+R[-226]C+R[-223]C+R[-220]C+R[-217]C+R[-214]C+R[-211]C+R[-208]C+R[-205]C+R[-202]C+R[-199]C+R[-196]C+R[-193]C+R[-190]C+R[-187]C+R[-184]C+R[-181]C+R[-178]C+R[-175]C+R[-172]C+R[-169]C+R[-166]C+R[-163]C+R[-160]C+R[-157]C+R[-154]C+R[-151]C+R[-148]C+R[-145]C+R[-142]C+R[-139]C+R[-136]C+R[-133]C+R[-130]C+R[-127]C+R[-124]C+R[-121]C+R[-118]C+R[-115]C+R[-112]C+R[-109]C+R[-106]C+R[-103]C+R[-100]C+R[-97]C+R[-94]C+R[-91]C+R[-88]C+R[-85]C+R[-82]C+R[-79]C+R[-76]C+R[-73]C+R[-70]C+R[-67]C+R[-64]C+R[-61]C+R[-58]C+R[-55]C+R[-52]C+R[-49]C+R[-46]C+R[-43]C+R[-40]C+R[-37]C+R[-34]C+R[-31]C+R[-28]C+R[-25]C+R[-22]C+R[-19]C+R[-16]C+R[-13]C+R[-10]C+R[-7]C+R[-4]C -> 8987 | AK269: =R[-265]C+R[-262]C+R[-259]C+R[-256]C+R[-253]C+R[-250]C+R[-247]C+R[-244]C+R[-241]C+R[-238]C+R[-235]C+R[-232]C+R[-229]C+R[-226]C+R[-223]C+R[-220]C+R[-217]C+R[-214]C+R[-211]C+R[-208]C+R[-205]C+R[-202]C+R[-199]C+R[-196]C+R[-193]C+R[-190]C+R[-187]C+R[-184]C+R[-181]C+R[-178]C+R[-175]C+R[-172]C+R[-169]C+R[-166]C+R[-163]C+R[-160]C+R[-157]C+R[-154]C+R[-151]C+R[-148]C+R[-145]C+R[-142]C+R[-139]C+R[-136]C+R[-133]C+R[-130]C+R[-127]C+R[-124]C+R[-121]C+R[-118]C+R[-115]C+R[-112]C+R[-109]C+R[-106]C+R[-103]C+R[-100]C+R[-97]C+R[-94]C+R[-91]C+R[-88]C+R[-85]C+R[-82]C+R[-79]C+R[-76]C+R[-73]C+R[-70]C+R[-67]C+R[-64]C+R[-61]C+R[-58]C+R[-55]C+R[-52]C+R[-49]C+R[-46]C+R[-43]C+R[-40]C+R[-37]C+R[-34]C+R[-31]C+R[-28]C+R[-25]C+R[-22]C+R[-19]C+R[-16]C+R[-13]C+R[-10]C+R[-7]C+R[-4]C -> 1350 | AL269: =R[-265]C+R[-262]C+R[-259]C+R[-256]C+R[-253]C+R[-250]C+R[-247]C+R[-244]C+R[-241]C+R[-238]C+R[-235]C+R[-232]C+R[-229]C+R[-226]C+R[-223]C+R[-220]C+R[-217]C+R[-214]C+R[-211]C+R[-208]C+R[-205]C+R[-202]C+R[-199]C+R[-196]C+R[-193]C+R[-190]C+R[-187]C+R[-184]C+R[-181]C+R[-178]C+R[-175]C+R[-172]C+R[-169]C+R[-166]C+R[-163]C+R[-160]C+R[-157]C+R[-154]C+R[-151]C+R[-148]C+R[-145]C+R[-142]C+R[-139]C+R[-136]C+R[-133]C+R[-130]C+R[-127]C+R[-124]C+R[-121]C+R[-118]C+R[-115]C+R[-112]C+R[-109]C+R[-106]C+R[-103]C+R[-100]C+R[-97]C+R[-94]C+R[-91]C+R[-88]C+R[-85]C+R[-82]C+R[-79]C+R[-76]C+R[-73]C+R[-70]C+R[-67]C+R[-64]C+R[-61]C+R[-58]C+R[-55]C+R[-52]C+R[-49]C+R[-46]C+R[-43]C+R[-40]C+R[-37]C+R[-34]C+R[-31]C+R[-28]C+R[-25]C+R[-22]C+R[-19]C+R[-16]C+R[-13]C+R[-10]C+R[-7]C+R[-4]C -> 367 | AM269: =R[-265]C+R[-262]C+R[-259]C+R[-256]C+R[-253]C+R[-250]C+R[-247]C+R[-244]C+R[-241]C+R[-238]C+R[-235]C+R[-232]C+R[-229]C+R[-226]C+R[-223]C+R[-220]C+R[-217]C+R[-214]C+R[-211]C+R[-208]C+R[-205]C+R[-202]C+R[-199]C+R[-196]C+R[-193]C+R[-190]C+R[-187]C+R[-184]C+R[-181]C+R[-178]C+R[-175]C+R[-172]C+R[-169]C+R[-166]C+R[-163]C+R[-160]C+R[-157]C+R[-154]C+R[-151]C+R[-148]C+R[-145]C+R[-142]C+R[-139]C+R[-136]C+R[-133]C+R[-130]C+R[-127]C+R[-124]C+R[-121]C+R[-118]C+R[-115]C+R[-112]C+R[-109]C+R[-106]C+R[-103]C+R[-100]C+R[-97]C+R[-94]C+R[-91]C+R[-88]C+R[-85]C+R[-82]C+R[-79]C+R[-76]C+R[-73]C+R[-70]C+R[-67]C+R[-64]C+R[-61]C+R[-58]C+R[-55]C+R[-52]C+R[-49]C+R[-46]C+R[-43]C+R[-40]C+R[-37]C+R[-34]C+R[-31]C+R[-28]C+R[-25]C+R[-22]C+R[-19]C+R[-16]C+R[-13]C+R[-10]C+R[-7]C+R[-4]C -> 1575 | AN269: =R[-265]C+R[-262]C+R[-259]C+R[-256]C+R[-253]C+R[-250]C+R[-247]C+R[-244]C+R[-241]C+R[-238]C+R[-235]C+R[-232]C+R[-229]C+R[-226]C+R[-223]C+R[-220]C+R[-217]C+R[-214]C+R[-211]C+R[-208]C+R[-205]C+R[-202]C+R[-199]C+R[-196]C+R[-193]C+R[-190]C+R[-187]C+R[-184]C+R[-181]C+R[-178]C+R[-175]C+R[-172]C+R[-169]C+R[-166]C+R[-163]C+R[-160]C+R[-157]C+R[-154]C+R[-151]C+R[-148]C+R[-145]C+R[-142]C+R[-139]C+R[-136]C+R[-133]C+R[-130]C+R[-127]C+R[-124]C+R[-121]C+R[-118]C+R[-115]C+R[-112]C+R[-109]C+R[-106]C+R[-103]C+R[-100]C+R[-97]C+R[-94]C+R[-91]C+R[-88]C+R[-85]C+R[-82]C+R[-79]C+R[-76]C+R[-73]C+R[-70]C+R[-67]C+R[-64]C+R[-61]C+R[-58]C+R[-55]C+R[-52]C+R[-49]C+R[-46]C+R[-43]C+R[-40]C+R[-37]C+R[-34]C+R[-31]C+R[-28]C+R[-25]C+R[-22]C+R[-19]C+R[-16]C+R[-13]C+R[-10]C+R[-7]C+R[-4]C -> 800 | AO269: =R[-265]C+R[-262]C+R[-259]C+R[-256]C+R[-253]C+R[-250]C+R[-247]C+R[-244]C+R[-241]C+R[-238]C+R[-235]C+R[-232]C+R[-229]C+R[-226]C+R[-223]C+R[-220]C+R[-217]C+R[-214]C+R[-211]C+R[-208]C+R[-205]C+R[-202]C+R[-199]C+R[-196]C+R[-193]C+R[-190]C+R[-187]C+R[-184]C+R[-181]C+R[-178]C+R[-175]C+R[-172]C+R[-169]C+R[-166]C+R[-163]C+R[-160]C+R[-157]C+R[-154]C+R[-151]C+R[-148]C+R[-145]C+R[-142]C+R[-139]C+R[-136]C+R[-133]C+R[-130]C+R[-127]C+R[-124]C+R[-121]C+R[-118]C+R[-115]C+R[-112]C+R[-109]C+R[-106]C+R[-103]C+R[-100]C+R[-97]C+R[-94]C+R[-91]C+R[-88]C+R[-85]C+R[-82]C+R[-79]C+R[-76]C+R[-73]C+R[-70]C+R[-67]C+R[-64]C+R[-61]C+R[-58]C+R[-55]C+R[-52]C+R[-49]C+R[-46]C+R[-43]C+R[-40]C+R[-37]C+R[-34]C+R[-31]C+R[-28]C+R[-25]C+R[-22]C+R[-19]C+R[-16]C+R[-13]C+R[-10]C+R[-7]C+R[-4]C -> 5208 | AP269: =R[-265]C+R[-262]C+R[-259]C+R[-256]C+R[-253]C+R[-250]C+R[-247]C+R[-244]C+R[-241]C+R[-238]C+R[-235]C+R[-232]C+R[-229]C+R[-226]C+R[-223]C+R[-220]C+R[-217]C+R[-214]C+R[-211]C+R[-208]C+R[-205]C+R[-202]C+R[-199]C+R[-196]C+R[-193]C+R[-190]C+R[-187]C+R[-184]C+R[-181]C+R[-178]C+R[-175]C+R[-172]C+R[-169]C+R[-166]C+R[-163]C+R[-160]C+R[-157]C+R[-154]C+R[-151]C+R[-148]C+R[-145]C+R[-142]C+R[-139]C+R[-136]C+R[-133]C+R[-130]C+R[-127]C+R[-124]C+R[-121]C+R[-118]C+R[-115]C+R[-112]C+R[-109]C+R[-106]C+R[-103]C+R[-100]C+R[-97]C+R[-94]C+R[-91]C+R[-88]C+R[-85]C+R[-82]C+R[-79]C+R[-76]C+R[-73]C+R[-70]C+R[-67]C+R[-64]C+R[-61]C+R[-58]C+R[-55]C+R[-52]C+R[-49]C+R[-46]C+R[-43]C+R[-40]C+R[-37]C+R[-34]C+R[-31]C+R[-28]C+R[-25]C+R[-22]C+R[-19]C+R[-16]C+R[-13]C+R[-10]C+R[-7]C+R[-4]C -> 2064 | AQ269: =R[-265]C+R[-262]C+R[-259]C+R[-256]C+R[-253]C+R[-250]C+R[-247]C+R[-244]C+R[-241]C+R[-238]C+R[-235]C+R[-232]C+R[-229]C+R[-226]C+R[-223]C+R[-220]C+R[-217]C+R[-214]C+R[-211]C+R[-208]C+R[-205]C+R[-202]C+R[-199]C+R[-196]C+R[-193]C+R[-190]C+R[-187]C+R[-184]C+R[-181]C+R[-178]C+R[-175]C+R[-172]C+R[-169]C+R[-166]C+R[-163]C+R[-160]C+R[-157]C+R[-154]C+R[-151]C+R[-148]C+R[-145]C+R[-142]C+R[-139]C+R[-136]C+R[-133]C+R[-130]C+R[-127]C+R[-124]C+R[-121]C+R[-118]C+R[-115]C+R[-112]C+R[-109]C+R[-106]C+R[-103]C+R[-100]C+R[-97]C+R[-94]C+R[-91]C+R[-88]C+R[-85]C+R[-82]C+R[-79]C+R[-76]C+R[-73]C+R[-70]C+R[-67]C+R[-64]C+R[-61]C+R[-58]C+R[-55]C+R[-52]C+R[-49]C+R[-46]C+R[-43]C+R[-40]C+R[-37]C+R[-34]C+R[-31]C+R[-28]C+R[-25]C+R[-22]C+R[-19]C+R[-16]C+R[-13]C+R[-10]C+R[-7]C+R[-4]C -> 2625 | AR269: =R[-265]C+R[-262]C+R[-259]C+R[-256]C+R[-253]C+R[-250]C+R[-247]C+R[-244]C+R[-241]C+R[-238]C+R[-235]C+R[-232]C+R[-229]C+R[-226]C+R[-223]C+R[-220]C+R[-217]C+R[-214]C+R[-211]C+R[-208]C+R[-205]C+R[-202]C+R[-199]C+R[-196]C+R[-193]C+R[-190]C+R[-187]C+R[-184]C+R[-181]C+R[-178]C+R[-175]C+R[-172]C+R[-169]C+R[-166]C+R[-163]C+R[-160]C+R[-157]C+R[-154]C+R[-151]C+R[-148]C+R[-145]C+R[-142]C+R[-139]C+R[-136]C+R[-133]C+R[-130]C+R[-127]C+R[-124]C+R[-121]C+R[-118]C+R[-115]C+R[-112]C+R[-109]C+R[-106]C+R[-103]C+R[-100]C+R[-97]C+R[-94]C+R[-91]C+R[-88]C+R[-85]C+R[-82]C+R[-79]C+R[-76]C+R[-73]C+R[-70]C+R[-67]C+R[-64]C+R[-61]C+R[-58]C+R[-55]C+R[-52]C+R[-49]C+R[-46]C+R[-43]C+R[-40]C+R[-37]C+R[-34]C+R[-31]C+R[-28]C+R[-25]C+R[-22]C+R[-19]C+R[-16]C+R[-13]C+R[-10]C+R[-7]C+R[-4]C -> 2064 | AS269: =R[-265]C+R[-262]C+R[-259]C+R[-256]C+R[-253]C+R[-250]C+R[-247]C+R[-244]C+R[-241]C+R[-238]C+R[-235]C+R[-232]C+R[-229]C+R[-226]C+R[-223]C+R[-220]C+R[-217]C+R[-214]C+R[-211]C+R[-208]C+R[-205]C+R[-202]C+R[-199]C+R[-196]C+R[-193]C+R[-190]C+R[-187]C+R[-184]C+R[-181]C+R[-178]C+R[-175]C+R[-172]C+R[-169]C+R[-166]C+R[-163]C+R[-160]C+R[-157]C+R[-154]C+R[-151]C+R[-148]C+R[-145]C+R[-142]C+R[-139]C+R[-136]C+R[-133]C+R[-130]C+R[-127]C+R[-124]C+R[-121]C+R[-118]C+R[-115]C+R[-112]C+R[-109]C+R[-106]C+R[-103]C+R[-100]C+R[-97]C+R[-94]C+R[-91]C+R[-88]C+R[-85]C+R[-82]C+R[-79]C+R[-76]C+R[-73]C+R[-70]C+R[-67]C+R[-64]C+R[-61]C+R[-58]C+R[-55]C+R[-52]C+R[-49]C+R[-46]C+R[-43]C+R[-40]C+R[-37]C+R[-34]C+R[-31]C+R[-28]C+R[-25]C+R[-22]C+R[-19]C+R[-16]C+R[-13]C+R[-10]C+R[-7]C+R[-4]C -> 525 | AT269: =R[-265]C+R[-262]C+R[-259]C+R[-256]C+R[-253]C+R[-250]C+R[-247]C+R[-244]C+R[-241]C+R[-238]C+R[-235]C+R[-232]C+R[-229]C+R[-226]C+R[-223]C+R[-220]C+R[-217]C+R[-214]C+R[-211]C+R[-208]C+R[-205]C+R[-202]C+R[-199]C+R[-196]C+R[-193]C+R[-190]C+R[-187]C+R[-184]C+R[-181]C+R[-178]C+R[-175]C+R[-172]C+R[-169]C+R[-166]C+R[-163]C+R[-160]C+R[-157]C+R[-154]C+R[-151]C+R[-148]C+R[-145]C+R[-142]C+R[-139]C+R[-136]C+R[-133]C+R[-130]C+R[-127]C+R[-124]C+R[-121]C+R[-118]C+R[-115]C+R[-112]C+R[-109]C+R[-106]C+R[-103]C+R[-100]C+R[-97]C+R[-94]C+R[-91]C+R[-88]C+R[-85]C+R[-82]C+R[-79]C+R[-76]C+R[-73]C+R[-70]C+R[-67]C+R[-64]C+R[-61]C+R[-58]C+R[-55]C+R[-52]C+R[-49]C+R[-46]C+R[-43]C+R[-40]C+R[-37]C+R[-34]C+R[-31]C+R[-28]C+R[-25]C+R[-22]C+R[-19]C+R[-16]C+R[-13]C+R[-10]C+R[-7]C+R[-4]C -> 450 | AU269: =R[-265]C+R[-262]C+R[-259]C+R[-256]C+R[-253]C+R[-250]C+R[-247]C+R[-244]C+R[-241]C+R[-238]C+R[-235]C+R[-232]C+R[-229]C+R[-226]C+R[-223]C+R[-220]C+R[-217]C+R[-214]C+R[-211]C+R[-208]C+R[-205]C+R[-202]C+R[-199]C+R[-196]C+R[-193]C+R[-190]C+R[-187]C+R[-184]C+R[-181]C+R[-178]C+R[-175]C+R[-172]C+R[-169]C+R[-166]C+R[-163]C+R[-160]C+R[-157]C+R[-154]C+R[-151]C+R[-148]C+R[-145]C+R[-142]C+R[-139]C+R[-136]C+R[-133]C+R[-130]C+R[-127]C+R[-124]C+R[-121]C+R[-118]C+R[-115]C+R[-112]C+R[-109]C+R[-106]C+R[-103]C+R[-100]C+R[-97]C+R[-94]C+R[-91]C+R[-88]C+R[-85]C+R[-82]C+R[-79]C+R[-76]C+R[-73]C+R[-70]C+R[-67]C+R[-64]C+R[-61]C+R[-58]C+R[-55]C+R[-52]C+R[-49]C+R[-46]C+R[-43]C+R[-40]C+R[-37]C+R[-34]C+R[-31]C+R[-28]C+R[-25]C+R[-22]C+R[-19]C+R[-16]C+R[-13]C+R[-10]C+R[-7]C+R[-4]C -> 550 | AV269: =R[-265]C+R[-262]C+R[-259]C+R[-256]C+R[-253]C+R[-250]C+R[-247]C+R[-244]C+R[-241]C+R[-238]C+R[-235]C+R[-232]C+R[-229]C+R[-226]C+R[-223]C+R[-220]C+R[-217]C+R[-214]C+R[-211]C+R[-208]C+R[-205]C+R[-202]C+R[-199]C+R[-196]C+R[-193]C+R[-190]C+R[-187]C+R[-184]C+R[-181]C+R[-178]C+R[-175]C+R[-172]C+R[-169]C+R[-166]C+R[-163]C+R[-160]C+R[-157]C+R[-154]C+R[-151]C+R[-148]C+R[-145]C+R[-142]C+R[-139]C+R[-136]C+R[-133]C+R[-130]C+R[-127]C+R[-124]C+R[-121]C+R[-118]C+R[-115]C+R[-112]C+R[-109]C+R[-106]C+R[-103]C+R[-100]C+R[-97]C+R[-94]C+R[-91]C+R[-88]C+R[-85]C+R[-82]C+R[-79]C+R[-76]C+R[-73]C+R[-70]C+R[-67]C+R[-64]C+R[-61]C+R[-58]C+R[-55]C+R[-52]C+R[-49]C+R[-46]C+R[-43]C+R[-40]C+R[-37]C+R[-34]C+R[-31]C+R[-28]C+R[-25]C+R[-22]C+R[-19]C+R[-16]C+R[-13]C+R[-10]C+R[-7]C+R[-4]C -> 981 | AW269: =R[-265]C+R[-262]C+R[-259]C+R[-256]C+R[-253]C+R[-250]C+R[-247]C+R[-244]C+R[-241]C+R[-238]C+R[-235]C+R[-232]C+R[-229]C+R[-226]C+R[-223]C+R[-220]C+R[-217]C+R[-214]C+R[-211]C+R[-208]C+R[-205]C+R[-202]C+R[-199]C+R[-196]C+R[-193]C+R[-190]C+R[-187]C+R[-184]C+R[-181]C+R[-178]C+R[-175]C+R[-172]C+R[-169]C+R[-166]C+R[-163]C+R[-160]C+R[-157]C+R[-154]C+R[-151]C+R[-148]C+R[-145]C+R[-142]C+R[-139]C+R[-136]C+R[-133]C+R[-130]C+R[-127]C+R[-124]C+R[-121]C+R[-118]C+R[-115]C+R[-112]C+R[-109]C+R[-106]C+R[-103]C+R[-100]C+R[-97]C+R[-94]C+R[-91]C+R[-88]C+R[-85]C+R[-82]C+R[-79]C+R[-76]C+R[-73]C+R[-70]C+R[-67]C+R[-64]C+R[-61]C+R[-58]C+R[-55]C+R[-52]C+R[-49]C+R[-46]C+R[-43]C+R[-40]C+R[-37]C+R[-34]C+R[-31]C+R[-28]C+R[-25]C+R[-22]C+R[-19]C+R[-16]C+R[-13]C+R[-10]C+R[-7]C+R[-4]C -> 327 | AX269: =R[-265]C+R[-262]C+R[-259]C+R[-256]C+R[-253]C+R[-250]C+R[-247]C+R[-244]C+R[-241]C+R[-238]C+R[-235]C+R[-232]C+R[-229]C+R[-226]C+R[-223]C+R[-220]C+R[-217]C+R[-214]C+R[-211]C+R[-208]C+R[-205]C+R[-202]C+R[-199]C+R[-196]C+R[-193]C+R[-190]C+R[-187]C+R[-184]C+R[-181]C+R[-178]C+R[-175]C+R[-172]C+R[-169]C+R[-166]C+R[-163]C+R[-160]C+R[-157]C+R[-154]C+R[-151]C+R[-148]C+R[-145]C+R[-142]C+R[-139]C+R[-136]C+R[-133]C+R[-130]C+R[-127]C+R[-124]C+R[-121]C+R[-118]C+R[-115]C+R[-112]C+R[-109]C+R[-106]C+R[-103]C+R[-100]C+R[-97]C+R[-94]C+R[-91]C+R[-88]C+R[-85]C+R[-82]C+R[-79]C+R[-76]C+R[-73]C+R[-70]C+R[-67]C+R[-64]C+R[-61]C+R[-58]C+R[-55]C+R[-52]C+R[-49]C+R[-46]C+R[-43]C+R[-40]C+R[-37]C+R[-34]C+R[-31]C+R[-28]C+R[-25]C+R[-22]C+R[-19]C+R[-16]C+R[-13]C+R[-10]C+R[-7]C+R[-4]C -> 525 | AY269: =R[-265]C+R[-262]C+R[-259]C+R[-256]C+R[-253]C+R[-250]C+R[-247]C+R[-244]C+R[-241]C+R[-238]C+R[-235]C+R[-232]C+R[-229]C+R[-226]C+R[-223]C+R[-220]C+R[-217]C+R[-214]C+R[-211]C+R[-208]C+R[-205]C+R[-202]C+R[-199]C+R[-196]C+R[-193]C+R[-190]C+R[-187]C+R[-184]C+R[-181]C+R[-178]C+R[-175]C+R[-172]C+R[-169]C+R[-166]C+R[-163]C+R[-160]C+R[-157]C+R[-154]C+R[-151]C+R[-148]C+R[-145]C+R[-142]C+R[-139]C+R[-136]C+R[-133]C+R[-130]C+R[-127]C+R[-124]C+R[-121]C+R[-118]C+R[-115]C+R[-112]C+R[-109]C+R[-106]C+R[-103]C+R[-100]C+R[-97]C+R[-94]C+R[-91]C+R[-88]C+R[-85]C+R[-82]C+R[-79]C+R[-76]C+R[-73]C+R[-70]C+R[-67]C+R[-64]C+R[-61]C+R[-58]C+R[-55]C+R[-52]C+R[-49]C+R[-46]C+R[-43]C+R[-40]C+R[-37]C+R[-34]C+R[-31]C+R[-28]C+R[-25]C+R[-22]C+R[-19]C+R[-16]C+R[-13]C+R[-10]C+R[-7]C+R[-4]C -> 2000 | AZ269: =R[-265]C+R[-262]C+R[-259]C+R[-256]C+R[-253]C+R[-250]C+R[-247]C+R[-244]C+R[-241]C+R[-238]C+R[-235]C+R[-232]C+R[-229]C+R[-226]C+R[-223]C+R[-220]C+R[-217]C+R[-214]C+R[-211]C+R[-208]C+R[-205]C+R[-202]C+R[-199]C+R[-196]C+R[-193]C+R[-190]C+R[-187]C+R[-184]C+R[-181]C+R[-178]C+R[-175]C+R[-172]C+R[-169]C+R[-166]C+R[-163]C+R[-160]C+R[-157]C+R[-154]C+R[-151]C+R[-148]C+R[-145]C+R[-142]C+R[-139]C+R[-136]C+R[-133]C+R[-130]C+R[-127]C+R[-124]C+R[-121]C+R[-118]C+R[-115]C+R[-112]C+R[-109]C+R[-106]C+R[-103]C+R[-100]C+R[-97]C+R[-94]C+R[-91]C+R[-88]C+R[-85]C+R[-82]C+R[-79]C+R[-76]C+R[-73]C+R[-70]C+R[-67]C+R[-64]C+R[-61]C+R[-58]C+R[-55]C+R[-52]C+R[-49]C+R[-46]C+R[-43]C+R[-40]C+R[-37]C+R[-34]C+R[-31]C+R[-28]C+R[-25]C+R[-22]C+R[-19]C+R[-16]C+R[-13]C+R[-10]C+R[-7]C+R[-4]C -> 1300 | BA269: =R[-265]C+R[-262]C+R[-259]C+R[-256]C+R[-253]C+R[-250]C+R[-247]C+R[-244]C+R[-241]C+R[-238]C+R[-235]C+R[-232]C+R[-229]C+R[-226]C+R[-223]C+R[-220]C+R[-217]C+R[-214]C+R[-211]C+R[-208]C+R[-205]C+R[-202]C+R[-199]C+R[-196]C+R[-193]C+R[-190]C+R[-187]C+R[-184]C+R[-181]C+R[-178]C+R[-175]C+R[-172]C+R[-169]C+R[-166]C+R[-163]C+R[-160]C+R[-157]C+R[-154]C+R[-151]C+R[-148]C+R[-145]C+R[-142]C+R[-139]C+R[-136]C+R[-133]C+R[-130]C+R[-127]C+R[-124]C+R[-121]C+R[-118]C+R[-115]C+R[-112]C+R[-109]C+R[-106]C+R[-103]C+R[-100]C+R[-97]C+R[-94]C+R[-91]C+R[-88]C+R[-85]C+R[-82]C+R[-79]C+R[-76]C+R[-73]C+R[-70]C+R[-67]C+R[-64]C+R[-61]C+R[-58]C+R[-55]C+R[-52]C+R[-49]C+R[-46]C+R[-43]C+R[-40]C+R[-37]C+R[-34]C+R[-31]C+R[-28]C+R[-25]C+R[-22]C+R[-19]C+R[-16]C+R[-13]C+R[-10]C+R[-7]C+R[-4]C -> 1800 | BB269: =R[-265]C+R[-262]C+R[-259]C+R[-256]C+R[-253]C+R[-250]C+R[-247]C+R[-244]C+R[-241]C+R[-238]C+R[-235]C+R[-232]C+R[-229]C+R[-226]C+R[-223]C+R[-220]C+R[-217]C+R[-214]C+R[-211]C+R[-208]C+R[-205]C+R[-202]C+R[-199]C+R[-196]C+R[-193]C+R[-190]C+R[-187]C+R[-184]C+R[-181]C+R[-178]C+R[-175]C+R[-172]C+R[-169]C+R[-166]C+R[-163]C+R[-160]C+R[-157]C+R[-154]C+R[-151]C+R[-148]C+R[-145]C+R[-142]C+R[-139]C+R[-136]C+R[-133]C+R[-130]C+R[-127]C+R[-124]C+R[-121]C+R[-118]C+R[-115]C+R[-112]C+R[-109]C+R[-106]C+R[-103]C+R[-100]C+R[-97]C+R[-94]C+R[-91]C+R[-88]C+R[-85]C+R[-82]C+R[-79]C+R[-76]C+R[-73]C+R[-70]C+R[-67]C+R[-64]C+R[-61]C+R[-58]C+R[-55]C+R[-52]C+R[-49]C+R[-46]C+R[-43]C+R[-40]C+R[-37]C+R[-34]C+R[-31]C+R[-28]C+R[-25]C+R[-22]C+R[-19]C+R[-16]C+R[-13]C+R[-10]C+R[-7]C+R[-4]C -> 2572 | BC269: =R[-265]C+R[-262]C+R[-259]C+R[-256]C+R[-253]C+R[-250]C+R[-247]C+R[-244]C+R[-241]C+R[-238]C+R[-235]C+R[-232]C+R[-229]C+R[-226]C+R[-223]C+R[-220]C+R[-217]C+R[-214]C+R[-211]C+R[-208]C+R[-205]C+R[-202]C+R[-199]C+R[-196]C+R[-193]C+R[-190]C+R[-187]C+R[-184]C+R[-181]C+R[-178]C+R[-175]C+R[-172]C+R[-169]C+R[-166]C+R[-163]C+R[-160]C+R[-157]C+R[-154]C+R[-151]C+R[-148]C+R[-145]C+R[-142]C+R[-139]C+R[-136]C+R[-133]C+R[-130]C+R[-127]C+R[-124]C+R[-121]C+R[-118]C+R[-115]C+R[-112]C+R[-109]C+R[-106]C+R[-103]C+R[-100]C+R[-97]C+R[-94]C+R[-91]C+R[-88]C+R[-85]C+R[-82]C+R[-79]C+R[-76]C+R[-73]C+R[-70]C+R[-67]C+R[-64]C+R[-61]C+R[-58]C+R[-55]C+R[-52]C+R[-49]C+R[-46]C+R[-43]C+R[-40]C+R[-37]C+R[-34]C+R[-31]C+R[-28]C+R[-25]C+R[-22]C+R[-19]C+R[-16]C+R[-13]C+R[-10]C+R[-7]C+R[-4]C -> 2309 | BD269: =R[-265]C+R[-262]C+R[-259]C+R[-256]C+R[-253]C+R[-250]C+R[-247]C+R[-244]C+R[-241]C+R[-238]C+R[-235]C+R[-232]C+R[-229]C+R[-226]C+R[-223]C+R[-220]C+R[-217]C+R[-214]C+R[-211]C+R[-208]C+R[-205]C+R[-202]C+R[-199]C+R[-196]C+R[-193]C+R[-190]C+R[-187]C+R[-184]C+R[-181]C+R[-178]C+R[-175]C+R[-172]C+R[-169]C+R[-166]C+R[-163]C+R[-160]C+R[-157]C+R[-154]C+R[-151]C+R[-148]C+R[-145]C+R[-142]C+R[-139]C+R[-136]C+R[-133]C+R[-130]C+R[-127]C+R[-124]C+R[-121]C+R[-118]C+R[-115]C+R[-112]C+R[-109]C+R[-106]C+R[-103]C+R[-100]C+R[-97]C+R[-94]C+R[-91]C+R[-88]C+R[-85]C+R[-82]C+R[-79]C+R[-76]C+R[-73]C+R[-70]C+R[-67]C+R[-64]C+R[-61]C+R[-58]C+R[-55]C+R[-52]C+R[-49]C+R[-46]C+R[-43]C+R[-40]C+R[-37]C+R[-34]C+R[-31]C+R[-28]C+R[-25]C+R[-22]C+R[-19]C+R[-16]C+R[-13]C+R[-10]C+R[-7]C+R[-4]C -> 3325 | BE269: =R[-265]C+R[-262]C+R[-259]C+R[-256]C+R[-253]C+R[-250]C+R[-247]C+R[-244]C+R[-241]C+R[-238]C+R[-235]C+R[-232]C+R[-229]C+R[-226]C+R[-223]C+R[-220]C+R[-217]C+R[-214]C+R[-211]C+R[-208]C+R[-205]C+R[-202]C+R[-199]C+R[-196]C+R[-193]C+R[-190]C+R[-187]C+R[-184]C+R[-181]C+R[-178]C+R[-175]C+R[-172]C+R[-169]C+R[-166]C+R[-163]C+R[-160]C+R[-157]C+R[-154]C+R[-151]C+R[-148]C+R[-145]C+R[-142]C+R[-139]C+R[-136]C+R[-133]C+R[-130]C+R[-127]C+R[-124]C+R[-121]C+R[-118]C+R[-115]C+R[-112]C+R[-109]C+R[-106]C+R[-103]C+R[-100]C+R[-97]C+R[-94]C+R[-91]C+R[-88]C+R[-85]C+R[-82]C+R[-79]C+R[-76]C+R[-73]C+R[-70]C+R[-67]C+R[-64]C+R[-61]C+R[-58]C+R[-55]C+R[-52]C+R[-49]C+R[-46]C+R[-43]C+R[-40]C+R[-37]C+R[-34]C+R[-31]C+R[-28]C+R[-25]C+R[-22]C+R[-19]C+R[-16]C+R[-13]C+R[-10]C+R[-7]C+R[-4]C -> 16762 | BF269: =R[-265]C+R[-262]C+R[-259]C+R[-256]C+R[-253]C+R[-250]C+R[-247]C+R[-244]C+R[-241]C+R[-238]C+R[-235]C+R[-232]C+R[-229]C+R[-226]C+R[-223]C+R[-220]C+R[-217]C+R[-214]C+R[-211]C+R[-208]C+R[-205]C+R[-202]C+R[-199]C+R[-196]C+R[-193]C+R[-190]C+R[-187]C+R[-184]C+R[-181]C+R[-178]C+R[-175]C+R[-172]C+R[-169]C+R[-166]C+R[-163]C+R[-160]C+R[-157]C+R[-154]C+R[-151]C+R[-148]C+R[-145]C+R[-142]C+R[-139]C+R[-136]C+R[-133]C+R[-130]C+R[-127]C+R[-124]C+R[-121]C+R[-118]C+R[-115]C+R[-112]C+R[-109]C+R[-106]C+R[-103]C+R[-100]C+R[-97]C+R[-94]C+R[-91]C+R[-88]C+R[-85]C+R[-82]C+R[-79]C+R[-76]C+R[-73]C+R[-70]C+R[-67]C+R[-64]C+R[-61]C+R[-58]C+R[-55]C+R[-52]C+R[-49]C+R[-46]C+R[-43]C+R[-40]C+R[-37]C+R[-34]C+R[-31]C+R[-28]C+R[-25]C+R[-22]C+R[-19]C+R[-16]C+R[-13]C+R[-10]C+R[-7]C+R[-4]C -> 3400 | BG269: =R[-265]C+R[-262]C+R[-259]C+R[-256]C+R[-253]C+R[-250]C+R[-247]C+R[-244]C+R[-241]C+R[-238]C+R[-235]C+R[-232]C+R[-229]C+R[-226]C+R[-223]C+R[-220]C+R[-217]C+R[-214]C+R[-211]C+R[-208]C+R[-205]C+R[-202]C+R[-199]C+R[-196]C+R[-193]C+R[-190]C+R[-187]C+R[-184]C+R[-181]C+R[-178]C+R[-175]C+R[-172]C+R[-169]C+R[-166]C+R[-163]C+R[-160]C+R[-157]C+R[-154]C+R[-151]C+R[-148]C+R[-145]C+R[-142]C+R[-139]C+R[-136]C+R[-133]C+R[-130]C+R[-127]C+R[-124]C+R[-121]C+R[-118]C+R[-115]C+R[-112]C+R[-109]C+R[-106]C+R[-103]C+R[-100]C+R[-97]C+R[-94]C+R[-91]C+R[-88]C+R[-85]C+R[-82]C+R[-79]C+R[-76]C+R[-73]C+R[-70]C+R[-67]C+R[-64]C+R[-61]C+R[-58]C+R[-55]C+R[-52]C+R[-49]C+R[-46]C+R[-43]C+R[-40]C+R[-37]C+R[-34]C+R[-31]C+R[-28]C+R[-25]C+R[-22]C+R[-19]C+R[-16]C+R[-13]C+R[-10]C+R[-7]C+R[-4]C -> 175843 | BH269: RISE Cost Grand Total | BI269: =SUM(RC[-55]:RC[-2]) -> 525562 | BO269: =R[-264]C+R[-261]C+R[-258]C+R[-255]C+R[-252]C+R[-249]C+R[-246]C+R[-243]C+R[-240]C+R[-237]C+R[-234]C+R[-231]C+R[-228]C+R[-225]C+R[-222]C+R[-219]C+R[-216]C+R[-213]C+R[-210]C+R[-207]C+R[-204]C+R[-201]C+R[-198]C+R[-195]C+R[-192]C+R[-189]C+R[-186]C+R[-183]C+R[-180]C+R[-177]C+R[-174]C+R[-171]C+R[-168]C+R[-165]C+R[-162]C+R[-159]C+R[-156]C+R[-153]C+R[-150]C+R[-147]C+R[-144]C+R[-141]C+R[-138]C+R[-135]C+R[-132]C+R[-129]C+R[-126]C+R[-123]C+R[-120]C+R[-117]C+R[-114]C+R[-111]C+R[-108]C+R[-105]C+R[-102]C+R[-99]C+R[-96]C+R[-93]C+R[-90]C+R[-87]C+R[-84]C+R[-81]C+R[-78]C+R[-75]C+R[-72]C+R[-69]C+R[-66]C+R[-63]C+R[-60]C+R[-57]C+R[-54]C+R[-51]C+R[-48]C+R[-45]C+R[-42]C+R[-39]C+R[-36]C+R[-33]C+R[-30]C+R[-27]C+R[-24]C+R[-21]C+R[-18]C+R[-15]C+R[-12]C+R[-9]C+R[-6]C+R[-3]C -> -838743
E270: RISE Savings | F270: =R[-265]C+R[-262]C+R[-259]C+R[-256]C+R[-253]C+R[-250]C+R[-247]C+R[-244]C+R[-241]C+R[-238]C+R[-235]C+R[-232]C+R[-229]C+R[-226]C+R[-223]C+R[-220]C+R[-217]C+R[-214]C+R[-211]C+R[-208]C+R[-205]C+R[-202]C+R[-199]C+R[-196]C+R[-193]C+R[-190]C+R[-187]C+R[-184]C+R[-181]C+R[-178]C+R[-175]C+R[-172]C+R[-169]C+R[-166]C+R[-163]C+R[-160]C+R[-157]C+R[-154]C+R[-151]C+R[-148]C+R[-145]C+R[-142]C+R[-139]C+R[-136]C+R[-133]C+R[-130]C+R[-127]C+R[-124]C+R[-121]C+R[-118]C+R[-115]C+R[-112]C+R[-109]C+R[-106]C+R[-103]C+R[-100]C+R[-97]C+R[-94]C+R[-91]C+R[-88]C+R[-85]C+R[-82]C+R[-79]C+R[-76]C+R[-73]C+R[-70]C+R[-67]C+R[-64]C+R[-61]C+R[-58]C+R[-55]C+R[-52]C+R[-49]C+R[-46]C+R[-43]C+R[-40]C+R[-37]C+R[-34]C+R[-31]C+R[-28]C+R[-25]C+R[-22]C+R[-19]C+R[-16]C+R[-13]C+R[-10]C+R[-7]C+R[-4]C -> -36820 | G270: =R[-265]C+R[-262]C+R[-259]C+R[-256]C+R[-253]C+R[-250]C+R[-247]C+R[-244]C+R[-241]C+R[-238]C+R[-235]C+R[-232]C+R[-229]C+R[-226]C+R[-223]C+R[-220]C+R[-217]C+R[-214]C+R[-211]C+R[-208]C+R[-205]C+R[-202]C+R[-199]C+R[-196]C+R[-193]C+R[-190]C+R[-187]C+R[-184]C+R[-181]C+R[-178]C+R[-175]C+R[-172]C+R[-169]C+R[-166]C+R[-163]C+R[-160]C+R[-157]C+R[-154]C+R[-151]C+R[-148]C+R[-145]C+R[-142]C+R[-139]C+R[-136]C+R[-133]C+R[-130]C+R[-127]C+R[-124]C+R[-121]C+R[-118]C+R[-115]C+R[-112]C+R[-109]C+R[-106]C+R[-103]C+R[-100]C+R[-97]C+R[-94]C+R[-91]C+R[-88]C+R[-85]C+R[-82]C+R[-79]C+R[-76]C+R[-73]C+R[-70]C+R[-67]C+R[-64]C+R[-61]C+R[-58]C+R[-55]C+R[-52]C+R[-49]C+R[-46]C+R[-43]C+R[-40]C+R[-37]C+R[-34]C+R[-31]C+R[-28]C+R[-25]C+R[-22]C+R[-19]C+R[-16]C+R[-13]C+R[-10]C+R[-7]C+R[-4]C -> -5748 | H270: =R[-265]C+R[-262]C+R[-259]C+R[-256]C+R[-253]C+R[-250]C+R[-247]C+R[-244]C+R[-241]C+R[-238]C+R[-235]C+R[-232]C+R[-229]C+R[-226]C+R[-223]C+R[-220]C+R[-217]C+R[-214]C+R[-211]C+R[-208]C+R[-205]C+R[-202]C+R[-199]C+R[-196]C+R[-193]C+R[-190]C+R[-187]C+R[-184]C+R[-181]C+R[-178]C+R[-175]C+R[-172]C+R[-169]C+R[-166]C+R[-163]C+R[-160]C+R[-157]C+R[-154]C+R[-151]C+R[-148]C+R[-145]C+R[-142]C+R[-139]C+R[-136]C+R[-133]C+R[-130]C+R[-127]C+R[-124]C+R[-121]C+R[-118]C+R[-115]C+R[-112]C+R[-109]C+R[-106]C+R[-103]C+R[-100]C+R[-97]C+R[-94]C+R[-91]C+R[-88]C+R[-85]C+R[-82]C+R[-79]C+R[-76]C+R[-73]C+R[-70]C+R[-67]C+R[-64]C+R[-61]C+R[-58]C+R[-55]C+R[-52]C+R[-49]C+R[-46]C+R[-43]C+R[-40]C+R[-37]C+R[-34]C+R[-31]C+R[-28]C+R[-25]C+R[-22]C+R[-19]C+R[-16]C+R[-13]C+R[-10]C+R[-7]C+R[-4]C -> -1950 | I270: =R[-265]C+R[-262]C+R[-259]C+R[-256]C+R[-253]C+R[-250]C+R[-247]C+R[-244]C+R[-241]C+R[-238]C+R[-235]C+R[-232]C+R[-229]C+R[-226]C+R[-223]C+R[-220]C+R[-217]C+R[-214]C+R[-211]C+R[-208]C+R[-205]C+R[-202]C+R[-199]C+R[-196]C+R[-193]C+R[-190]C+R[-187]C+R[-184]C+R[-181]C+R[-178]C+R[-175]C+R[-172]C+R[-169]C+R[-166]C+R[-163]C+R[-160]C+R[-157]C+R[-154]C+R[-151]C+R[-148]C+R[-145]C+R[-142]C+R[-139]C+R[-136]C+R[-133]C+R[-130]C+R[-127]C+R[-124]C+R[-121]C+R[-118]C+R[-115]C+R[-112]C+R[-109]C+R[-106]C+R[-103]C+R[-100]C+R[-97]C+R[-94]C+R[-91]C+R[-88]C+R[-85]C+R[-82]C+R[-79]C+R[-76]C+R[-73]C+R[-70]C+R[-67]C+R[-64]C+R[-61]C+R[-58]C+R[-55]C+R[-52]C+R[-49]C+R[-46]C+R[-43]C+R[-40]C+R[-37]C+R[-34]C+R[-31]C+R[-28]C+R[-25]C+R[-22]C+R[-19]C+R[-16]C+R[-13]C+R[-10]C+R[-7]C+R[-4]C -> -6365 | J270: =R[-265]C+R[-262]C+R[-259]C+R[-256]C+R[-253]C+R[-250]C+R[-247]C+R[-244]C+R[-241]C+R[-238]C+R[-235]C+R[-232]C+R[-229]C+R[-226]C+R[-223]C+R[-220]C+R[-217]C+R[-214]C+R[-211]C+R[-208]C+R[-205]C+R[-202]C+R[-199]C+R[-196]C+R[-193]C+R[-190]C+R[-187]C+R[-184]C+R[-181]C+R[-178]C+R[-175]C+R[-172]C+R[-169]C+R[-166]C+R[-163]C+R[-160]C+R[-157]C+R[-154]C+R[-151]C+R[-148]C+R[-145]C+R[-142]C+R[-139]C+R[-136]C+R[-133]C+R[-130]C+R[-127]C+R[-124]C+R[-121]C+R[-118]C+R[-115]C+R[-112]C+R[-109]C+R[-106]C+R[-103]C+R[-100]C+R[-97]C+R[-94]C+R[-91]C+R[-88]C+R[-85]C+R[-82]C+R[-79]C+R[-76]C+R[-73]C+R[-70]C+R[-67]C+R[-64]C+R[-61]C+R[-58]C+R[-55]C+R[-52]C+R[-49]C+R[-46]C+R[-43]C+R[-40]C+R[-37]C+R[-34]C+R[-31]C+R[-28]C+R[-25]C+R[-22]C+R[-19]C+R[-16]C+R[-13]C+R[-10]C+R[-7]C+R[-4]C -> -96638 | K270: =R[-265]C+R[-262]C+R[-259]C+R[-256]C+R[-253]C+R[-250]C+R[-247]C+R[-244]C+R[-241]C+R[-238]C+R[-235]C+R[-232]C+R[-229]C+R[-226]C+R[-223]C+R[-220]C+R[-217]C+R[-214]C+R[-211]C+R[-208]C+R[-205]C+R[-202]C+R[-199]C+R[-196]C+R[-193]C+R[-190]C+R[-187]C+R[-184]C+R[-181]C+R[-178]C+R[-175]C+R[-172]C+R[-169]C+R[-166]C+R[-163]C+R[-160]C+R[-157]C+R[-154]C+R[-151]C+R[-148]C+R[-145]C+R[-142]C+R[-139]C+R[-136]C+R[-133]C+R[-130]C+R[-127]C+R[-124]C+R[-121]C+R[-118]C+R[-115]C+R[-112]C+R[-109]C+R[-106]C+R[-103]C+R[-100]C+R[-97]C+R[-94]C+R[-91]C+R[-88]C+R[-85]C+R[-82]C+R[-79]C+R[-76]C+R[-73]C+R[-70]C+R[-67]C+R[-64]C+R[-61]C+R[-58]C+R[-55]C+R[-52]C+R[-49]C+R[-46]C+R[-43]C+R[-40]C+R[-37]C+R[-34]C+R[-31]C+R[-28]C+R[-25]C+R[-22]C+R[-19]C+R[-16]C+R[-13]C+R[-10]C+R[-7]C+R[-4]C -> -75758 | L270: =R[-265]C+R[-262]C+R[-259]C+R[-256]C+R[-253]C+R[-250]C+R[-247]C+R[-244]C+R[-241]C+R[-238]C+R[-235]C+R[-232]C+R[-229]C+R[-226]C+R[-223]C+R[-220]C+R[-217]C+R[-214]C+R[-211]C+R[-208]C+R[-205]C+R[-202]C+R[-199]C+R[-196]C+R[-193]C+R[-190]C+R[-187]C+R[-184]C+R[-181]C+R[-178]C+R[-175]C+R[-172]C+R[-169]C+R[-166]C+R[-163]C+R[-160]C+R[-157]C+R[-154]C+R[-151]C+R[-148]C+R[-145]C+R[-142]C+R[-139]C+R[-136]C+R[-133]C+R[-130]C+R[-127]C+R[-124]C+R[-121]C+R[-118]C+R[-115]C+R[-112]C+R[-109]C+R[-106]C+R[-103]C+R[-100]C+R[-97]C+R[-94]C+R[-91]C+R[-88]C+R[-85]C+R[-82]C+R[-79]C+R[-76]C+R[-73]C+R[-70]C+R[-67]C+R[-64]C+R[-61]C+R[-58]C+R[-55]C+R[-52]C+R[-49]C+R[-46]C+R[-43]C+R[-40]C+R[-37]C+R[-34]C+R[-31]C+R[-28]C+R[-25]C+R[-22]C+R[-19]C+R[-16]C+R[-13]C+R[-10]C+R[-7]C+R[-4]C -> -15335 | M270: =R[-265]C+R[-262]C+R[-259]C+R[-256]C+R[-253]C+R[-250]C+R[-247]C+R[-244]C+R[-241]C+R[-238]C+R[-235]C+R[-232]C+R[-229]C+R[-226]C+R[-223]C+R[-220]C+R[-217]C+R[-214]C+R[-211]C+R[-208]C+R[-205]C+R[-202]C+R[-199]C+R[-196]C+R[-193]C+R[-190]C+R[-187]C+R[-184]C+R[-181]C+R[-178]C+R[-175]C+R[-172]C+R[-169]C+R[-166]C+R[-163]C+R[-160]C+R[-157]C+R[-154]C+R[-151]C+R[-148]C+R[-145]C+R[-142]C+R[-139]C+R[-136]C+R[-133]C+R[-130]C+R[-127]C+R[-124]C+R[-121]C+R[-118]C+R[-115]C+R[-112]C+R[-109]C+R[-106]C+R[-103]C+R[-100]C+R[-97]C+R[-94]C+R[-91]C+R[-88]C+R[-85]C+R[-82]C+R[-79]C+R[-76]C+R[-73]C+R[-70]C+R[-67]C+R[-64]C+R[-61]C+R[-58]C+R[-55]C+R[-52]C+R[-49]C+R[-46]C+R[-43]C+R[-40]C+R[-37]C+R[-34]C+R[-31]C+R[-28]C+R[-25]C+R[-22]C+R[-19]C+R[-16]C+R[-13]C+R[-10]C+R[-7]C+R[-4]C -> -14583 | N270: =R[-265]C+R[-262]C+R[-259]C+R[-256]C+R[-253]C+R[-250]C+R[-247]C+R[-244]C+R[-241]C+R[-238]C+R[-235]C+R[-232]C+R[-229]C+R[-226]C+R[-223]C+R[-220]C+R[-217]C+R[-214]C+R[-211]C+R[-208]C+R[-205]C+R[-202]C+R[-199]C+R[-196]C+R[-193]C+R[-190]C+R[-187]C+R[-184]C+R[-181]C+R[-178]C+R[-175]C+R[-172]C+R[-169]C+R[-166]C+R[-163]C+R[-160]C+R[-157]C+R[-154]C+R[-151]C+R[-148]C+R[-145]C+R[-142]C+R[-139]C+R[-136]C+R[-133]C+R[-130]C+R[-127]C+R[-124]C+R[-121]C+R[-118]C+R[-115]C+R[-112]C+R[-109]C+R[-106]C+R[-103]C+R[-100]C+R[-97]C+R[-94]C+R[-91]C+R[-88]C+R[-85]C+R[-82]C+R[-79]C+R[-76]C+R[-73]C+R[-70]C+R[-67]C+R[-64]C+R[-61]C+R[-58]C+R[-55]C+R[-52]C+R[-49]C+R[-46]C+R[-43]C+R[-40]C+R[-37]C+R[-34]C+R[-31]C+R[-28]C+R[-25]C+R[-22]C+R[-19]C+R[-16]C+R[-13]C+R[-10]C+R[-7]C+R[-4]C -> -1145 | O270: =R[-265]C+R[-262]C+R[-259]C+R[-256]C+R[-253]C+R[-250]C+R[-247]C+R[-244]C+R[-241]C+R[-238]C+R[-235]C+R[-232]C+R[-229]C+R[-226]C+R[-223]C+R[-220]C+R[-217]C+R[-214]C+R[-211]C+R[-208]C+R[-205]C+R[-202]C+R[-199]C+R[-196]C+R[-193]C+R[-190]C+R[-187]C+R[-184]C+R[-181]C+R[-178]C+R[-175]C+R[-172]C+R[-169]C+R[-166]C+R[-163]C+R[-160]C+R[-157]C+R[-154]C+R[-151]C+R[-148]C+R[-145]C+R[-142]C+R[-139]C+R[-136]C+R[-133]C+R[-130]C+R[-127]C+R[-124]C+R[-121]C+R[-118]C+R[-115]C+R[-112]C+R[-109]C+R[-106]C+R[-103]C+R[-100]C+R[-97]C+R[-94]C+R[-91]C+R[-88]C+R[-85]C+R[-82]C+R[-79]C+R[-76]C+R[-73]C+R[-70]C+R[-67]C+R[-64]C+R[-61]C+R[-58]C+R[-55]C+R[-52]C+R[-49]C+R[-46]C+R[-43]C+R[-40]C+R[-37]C+R[-34]C+R[-31]C+R[-28]C+R[-25]C+R[-22]C+R[-19]C+R[-16]C+R[-13]C+R[-10]C+R[-7]C+R[-4]C -> -2225 | P270: =R[-265]C+R[-262]C+R[-259]C+R[-256]C+R[-253]C+R[-250]C+R[-247]C+R[-244]C+R[-241]C+R[-238]C+R[-235]C+R[-232]C+R[-229]C+R[-226]C+R[-223]C+R[-220]C+R[-217]C+R[-214]C+R[-211]C+R[-208]C+R[-205]C+R[-202]C+R[-199]C+R[-196]C+R[-193]C+R[-190]C+R[-187]C+R[-184]C+R[-181]C+R[-178]C+R[-175]C+R[-172]C+R[-169]C+R[-166]C+R[-163]C+R[-160]C+R[-157]C+R[-154]C+R[-151]C+R[-148]C+R[-145]C+R[-142]C+R[-139]C+R[-136]C+R[-133]C+R[-130]C+R[-127]C+R[-124]C+R[-121]C+R[-118]C+R[-115]C+R[-112]C+R[-109]C+R[-106]C+R[-103]C+R[-100]C+R[-97]C+R[-94]C+R[-91]C+R[-88]C+R[-85]C+R[-82]C+R[-79]C+R[-76]C+R[-73]C+R[-70]C+R[-67]C+R[-64]C+R[-61]C+R[-58]C+R[-55]C+R[-52]C+R[-49]C+R[-46]C+R[-43]C+R[-40]C+R[-37]C+R[-34]C+R[-31]C+R[-28]C+R[-25]C+R[-22]C+R[-19]C+R[-16]C+R[-13]C+R[-10]C+R[-7]C+R[-4]C -> -1250 | Q270: =R[-265]C+R[-262]C+R[-259]C+R[-256]C+R[-253]C+R[-250]C+R[-247]C+R[-244]C+R[-241]C+R[-238]C+R[-235]C+R[-232]C+R[-229]C+R[-226]C+R[-223]C+R[-220]C+R[-217]C+R[-214]C+R[-211]C+R[-208]C+R[-205]C+R[-202]C+R[-199]C+R[-196]C+R[-193]C+R[-190]C+R[-187]C+R[-184]C+R[-181]C+R[-178]C+R[-175]C+R[-172]C+R[-169]C+R[-166]C+R[-163]C+R[-160]C+R[-157]C+R[-154]C+R[-151]C+R[-148]C+R[-145]C+R[-142]C+R[-139]C+R[-136]C+R[-133]C+R[-130]C+R[-127]C+R[-124]C+R[-121]C+R[-118]C+R[-115]C+R[-112]C+R[-109]C+R[-106]C+R[-103]C+R[-100]C+R[-97]C+R[-94]C+R[-91]C+R[-88]C+R[-85]C+R[-82]C+R[-79]C+R[-76]C+R[-73]C+R[-70]C+R[-67]C+R[-64]C+R[-61]C+R[-58]C+R[-55]C+R[-52]C+R[-49]C+R[-46]C+R[-43]C+R[-40]C+R[-37]C+R[-34]C+R[-31]C+R[-28]C+R[-25]C+R[-22]C+R[-19]C+R[-16]C+R[-13]C+R[-10]C+R[-7]C+R[-4]C -> -3270 | R270: =R[-265]C+R[-262]C+R[-259]C+R[-256]C+R[-253]C+R[-250]C+R[-247]C+R[-244]C+R[-241]C+R[-238]C+R[-235]C+R[-232]C+R[-229]C+R[-226]C+R[-223]C+R[-220]C+R[-217]C+R[-214]C+R[-211]C+R[-208]C+R[-205]C+R[-202]C+R[-199]C+R[-196]C+R[-193]C+R[-190]C+R[-187]C+R[-184]C+R[-181]C+R[-178]C+R[-175]C+R[-172]C+R[-169]C+R[-166]C+R[-163]C+R[-160]C+R[-157]C+R[-154]C+R[-151]C+R[-148]C+R[-145]C+R[-142]C+R[-139]C+R[-136]C+R[-133]C+R[-130]C+R[-127]C+R[-124]C+R[-121]C+R[-118]C+R[-115]C+R[-112]C+R[-109]C+R[-106]C+R[-103]C+R[-100]C+R[-97]C+R[-94]C+R[-91]C+R[-88]C+R[-85]C+R[-82]C+R[-79]C+R[-76]C+R[-73]C+R[-70]C+R[-67]C+R[-64]C+R[-61]C+R[-58]C+R[-55]C+R[-52]C+R[-49]C+R[-46]C+R[-43]C+R[-40]C+R[-37]C+R[-34]C+R[-31]C+R[-28]C+R[-25]C+R[-22]C+R[-19]C+R[-16]C+R[-13]C+R[-10]C+R[-7]C+R[-4]C -> -1341 | S270: =R[-265]C+R[-262]C+R[-259]C+R[-256]C+R[-253]C+R[-250]C+R[-247]C+R[-244]C+R[-241]C+R[-238]C+R[-235]C+R[-232]C+R[-229]C+R[-226]C+R[-223]C+R[-220]C+R[-217]C+R[-214]C+R[-211]C+R[-208]C+R[-205]C+R[-202]C+R[-199]C+R[-196]C+R[-193]C+R[-190]C+R[-187]C+R[-184]C+R[-181]C+R[-178]C+R[-175]C+R[-172]C+R[-169]C+R[-166]C+R[-163]C+R[-160]C+R[-157]C+R[-154]C+R[-151]C+R[-148]C+R[-145]C+R[-142]C+R[-139]C+R[-136]C+R[-133]C+R[-130]C+R[-127]C+R[-124]C+R[-121]C+R[-118]C+R[-115]C+R[-112]C+R[-109]C+R[-106]C+R[-103]C+R[-100]C+R[-97]C+R[-94]C+R[-91]C+R[-88]C+R[-85]C+R[-82]C+R[-79]C+R[-76]C+R[-73]C+R[-70]C+R[-67]C+R[-64]C+R[-61]C+R[-58]C+R[-55]C+R[-52]C+R[-49]C+R[-46]C+R[-43]C+R[-40]C+R[-37]C+R[-34]C+R[-31]C+R[-28]C+R[-25]C+R[-22]C+R[-19]C+R[-16]C+R[-13]C+R[-10]C+R[-7]C+R[-4]C -> -1045 | T270: =R[-265]C+R[-262]C+R[-259]C+R[-256]C+R[-253]C+R[-250]C+R[-247]C+R[-244]C+R[-241]C+R[-238]C+R[-235]C+R[-232]C+R[-229]C+R[-226]C+R[-223]C+R[-220]C+R[-217]C+R[-214]C+R[-211]C+R[-208]C+R[-205]C+R[-202]C+R[-199]C+R[-196]C+R[-193]C+R[-190]C+R[-187]C+R[-184]C+R[-181]C+R[-178]C+R[-175]C+R[-172]C+R[-169]C+R[-166]C+R[-163]C+R[-160]C+R[-157]C+R[-154]C+R[-151]C+R[-148]C+R[-145]C+R[-142]C+R[-139]C+R[-136]C+R[-133]C+R[-130]C+R[-127]C+R[-124]C+R[-121]C+R[-118]C+R[-115]C+R[-112]C+R[-109]C+R[-106]C+R[-103]C+R[-100]C+R[-97]C+R[-94]C+R[-91]C+R[-88]C+R[-85]C+R[-82]C+R[-79]C+R[-76]C+R[-73]C+R[-70]C+R[-67]C+R[-64]C+R[-61]C+R[-58]C+R[-55]C+R[-52]C+R[-49]C+R[-46]C+R[-43]C+R[-40]C+R[-37]C+R[-34]C+R[-31]C+R[-28]C+R[-25]C+R[-22]C+R[-19]C+R[-16]C+R[-13]C+R[-10]C+R[-7]C+R[-4]C -> -1045 | U270: =R[-265]C+R[-262]C+R[-259]C+R[-256]C+R[-253]C+R[-250]C+R[-247]C+R[-244]C+R[-241]C+R[-238]C+R[-235]C+R[-232]C+R[-229]C+R[-226]C+R[-223]C+R[-220]C+R[-217]C+R[-214]C+R[-211]C+R[-208]C+R[-205]C+R[-202]C+R[-199]C+R[-196]C+R[-193]C+R[-190]C+R[-187]C+R[-184]C+R[-181]C+R[-178]C+R[-175]C+R[-172]C+R[-169]C+R[-166]C+R[-163]C+R[-160]C+R[-157]C+R[-154]C+R[-151]C+R[-148]C+R[-145]C+R[-142]C+R[-139]C+R[-136]C+R[-133]C+R[-130]C+R[-127]C+R[-124]C+R[-121]C+R[-118]C+R[-115]C+R[-112]C+R[-109]C+R[-106]C+R[-103]C+R[-100]C+R[-97]C+R[-94]C+R[-91]C+R[-88]C+R[-85]C+R[-82]C+R[-79]C+R[-76]C+R[-73]C+R[-70]C+R[-67]C+R[-64]C+R[-61]C+R[-58]C+R[-55]C+R[-52]C+R[-49]C+R[-46]C+R[-43]C+R[-40]C+R[-37]C+R[-34]C+R[-31]C+R[-28]C+R[-25]C+R[-22]C+R[-19]C+R[-16]C+R[-13]C+R[-10]C+R[-7]C+R[-4]C -> -325 | V270: =R[-265]C+R[-262]C+R[-259]C+R[-256]C+R[-253]C+R[-250]C+R[-247]C+R[-244]C+R[-241]C+R[-238]C+R[-235]C+R[-232]C+R[-229]C+R[-226]C+R[-223]C+R[-220]C+R[-217]C+R[-214]C+R[-211]C+R[-208]C+R[-205]C+R[-202]C+R[-199]C+R[-196]C+R[-193]C+R[-190]C+R[-187]C+R[-184]C+R[-181]C+R[-178]C+R[-175]C+R[-172]C+R[-169]C+R[-166]C+R[-163]C+R[-160]C+R[-157]C+R[-154]C+R[-151]C+R[-148]C+R[-145]C+R[-142]C+R[-139]C+R[-136]C+R[-133]C+R[-130]C+R[-127]C+R[-124]C+R[-121]C+R[-118]C+R[-115]C+R[-112]C+R[-109]C+R[-106]C+R[-103]C+R[-100]C+R[-97]C+R[-94]C+R[-91]C+R[-88]C+R[-85]C+R[-82]C+R[-79]C+R[-76]C+R[-73]C+R[-70]C+R[-67]C+R[-64]C+R[-61]C+R[-58]C+R[-55]C+R[-52]C+R[-49]C+R[-46]C+R[-43]C+R[-40]C+R[-37]C+R[-34]C+R[-31]C+R[-28]C+R[-25]C+R[-22]C+R[-19]C+R[-16]C+R[-13]C+R[-10]C+R[-7]C+R[-4]C -> -500 | W270: =R[-265]C+R[-262]C+R[-259]C+R[-256]C+R[-253]C+R[-250]C+R[-247]C+R[-244]C+R[-241]C+R[-238]C+R[-235]C+R[-232]C+R[-229]C+R[-226]C+R[-223]C+R[-220]C+R[-217]C+R[-214]C+R[-211]C+R[-208]C+R[-205]C+R[-202]C+R[-199]C+R[-196]C+R[-193]C+R[-190]C+R[-187]C+R[-184]C+R[-181]C+R[-178]C+R[-175]C+R[-172]C+R[-169]C+R[-166]C+R[-163]C+R[-160]C+R[-157]C+R[-154]C+R[-151]C+R[-148]C+R[-145]C+R[-142]C+R[-139]C+R[-136]C+R[-133]C+R[-130]C+R[-127]C+R[-124]C+R[-121]C+R[-118]C+R[-115]C+R[-112]C+R[-109]C+R[-106]C+R[-103]C+R[-100]C+R[-97]C+R[-94]C+R[-91]C+R[-88]C+R[-85]C+R[-82]C+R[-79]C+R[-76]C+R[-73]C+R[-70]C+R[-67]C+R[-64]C+R[-61]C+R[-58]C+R[-55]C+R[-52]C+R[-49]C+R[-46]C+R[-43]C+R[-40]C+R[-37]C+R[-34]C+R[-31]C+R[-28]C+R[-25]C+R[-22]C+R[-19]C+R[-16]C+R[-13]C+R[-10]C+R[-7]C+R[-4]C -> -33191 | X270: =R[-265]C+R[-262]C+R[-259]C+R[-256]C+R[-253]C+R[-250]C+R[-247]C+R[-244]C+R[-241]C+R[-238]C+R[-235]C+R[-232]C+R[-229]C+R[-226]C+R[-223]C+R[-220]C+R[-217]C+R[-214]C+R[-211]C+R[-208]C+R[-205]C+R[-202]C+R[-199]C+R[-196]C+R[-193]C+R[-190]C+R[-187]C+R[-184]C+R[-181]C+R[-178]C+R[-175]C+R[-172]C+R[-169]C+R[-166]C+R[-163]C+R[-160]C+R[-157]C+R[-154]C+R[-151]C+R[-148]C+R[-145]C+R[-142]C+R[-139]C+R[-136]C+R[-133]C+R[-130]C+R[-127]C+R[-124]C+R[-121]C+R[-118]C+R[-115]C+R[-112]C+R[-109]C+R[-106]C+R[-103]C+R[-100]C+R[-97]C+R[-94]C+R[-91]C+R[-88]C+R[-85]C+R[-82]C+R[-79]C+R[-76]C+R[-73]C+R[-70]C+R[-67]C+R[-64]C+R[-61]C+R[-58]C+R[-55]C+R[-52]C+R[-49]C+R[-46]C+R[-43]C+R[-40]C+R[-37]C+R[-34]C+R[-31]C+R[-28]C+R[-25]C+R[-22]C+R[-19]C+R[-16]C+R[-13]C+R[-10]C+R[-7]C+R[-4]C -> -23995 | Y270: =R[-265]C+R[-262]C+R[-259]C+R[-256]C+R[-253]C+R[-250]C+R[-247]C+R[-244]C+R[-241]C+R[-238]C+R[-235]C+R[-232]C+R[-229]C+R[-226]C+R[-223]C+R[-220]C+R[-217]C+R[-214]C+R[-211]C+R[-208]C+R[-205]C+R[-202]C+R[-199]C+R[-196]C+R[-193]C+R[-190]C+R[-187]C+R[-184]C+R[-181]C+R[-178]C+R[-175]C+R[-172]C+R[-169]C+R[-166]C+R[-163]C+R[-160]C+R[-157]C+R[-154]C+R[-151]C+R[-148]C+R[-145]C+R[-142]C+R[-139]C+R[-136]C+R[-133]C+R[-130]C+R[-127]C+R[-124]C+R[-121]C+R[-118]C+R[-115]C+R[-112]C+R[-109]C+R[-106]C+R[-103]C+R[-100]C+R[-97]C+R[-94]C+R[-91]C+R[-88]C+R[-85]C+R[-82]C+R[-79]C+R[-76]C+R[-73]C+R[-70]C+R[-67]C+R[-64]C+R[-61]C+R[-58]C+R[-55]C+R[-52]C+R[-49]C+R[-46]C+R[-43]C+R[-40]C+R[-37]C+R[-34]C+R[-31]C+R[-28]C+R[-25]C+R[-22]C+R[-19]C+R[-16]C+R[-13]C+R[-10]C+R[-7]C+R[-4]C -> -34000 | Z270: =R[-265]C+R[-262]C+R[-259]C+R[-256]C+R[-253]C+R[-250]C+R[-247]C+R[-244]C+R[-241]C+R[-238]C+R[-235]C+R[-232]C+R[-229]C+R[-226]C+R[-223]C+R[-220]C+R[-217]C+R[-214]C+R[-211]C+R[-208]C+R[-205]C+R[-202]C+R[-199]C+R[-196]C+R[-193]C+R[-190]C+R[-187]C+R[-184]C+R[-181]C+R[-178]C+R[-175]C+R[-172]C+R[-169]C+R[-166]C+R[-163]C+R[-160]C+R[-157]C+R[-154]C+R[-151]C+R[-148]C+R[-145]C+R[-142]C+R[-139]C+R[-136]C+R[-133]C+R[-130]C+R[-127]C+R[-124]C+R[-121]C+R[-118]C+R[-115]C+R[-112]C+R[-109]C+R[-106]C+R[-103]C+R[-100]C+R[-97]C+R[-94]C+R[-91]C+R[-88]C+R[-85]C+R[-82]C+R[-79]C+R[-76]C+R[-73]C+R[-70]C+R[-67]C+R[-64]C+R[-61]C+R[-58]C+R[-55]C+R[-52]C+R[-49]C+R[-46]C+R[-43]C+R[-40]C+R[-37]C+R[-34]C+R[-31]C+R[-28]C+R[-25]C+R[-22]C+R[-19]C+R[-16]C+R[-13]C+R[-10]C+R[-7]C+R[-4]C -> -5228 | AA270: =R[-265]C+R[-262]C+R[-259]C+R[-256]C+R[-253]C+R[-250]C+R[-247]C+R[-244]C+R[-241]C+R[-238]C+R[-235]C+R[-232]C+R[-229]C+R[-226]C+R[-223]C+R[-220]C+R[-217]C+R[-214]C+R[-211]C+R[-208]C+R[-205]C+R[-202]C+R[-199]C+R[-196]C+R[-193]C+R[-190]C+R[-187]C+R[-184]C+R[-181]C+R[-178]C+R[-175]C+R[-172]C+R[-169]C+R[-166]C+R[-163]C+R[-160]C+R[-157]C+R[-154]C+R[-151]C+R[-148]C+R[-145]C+R[-142]C+R[-139]C+R[-136]C+R[-133]C+R[-130]C+R[-127]C+R[-124]C+R[-121]C+R[-118]C+R[-115]C+R[-112]C+R[-109]C+R[-106]C+R[-103]C+R[-100]C+R[-97]C+R[-94]C+R[-91]C+R[-88]C+R[-85]C+R[-82]C+R[-79]C+R[-76]C+R[-73]C+R[-70]C+R[-67]C+R[-64]C+R[-61]C+R[-58]C+R[-55]C+R[-52]C+R[-49]C+R[-46]C+R[-43]C+R[-40]C+R[-37]C+R[-34]C+R[-31]C+R[-28]C+R[-25]C+R[-22]C+R[-19]C+R[-16]C+R[-13]C+R[-10]C+R[-7]C+R[-4]C -> -2550 | AB270: =R[-265]C+R[-262]C+R[-259]C+R[-256]C+R[-253]C+R[-250]C+R[-247]C+R[-244]C+R[-241]C+R[-238]C+R[-235]C+R[-232]C+R[-229]C+R[-226]C+R[-223]C+R[-220]C+R[-217]C+R[-214]C+R[-211]C+R[-208]C+R[-205]C+R[-202]C+R[-199]C+R[-196]C+R[-193]C+R[-190]C+R[-187]C+R[-184]C+R[-181]C+R[-178]C+R[-175]C+R[-172]C+R[-169]C+R[-166]C+R[-163]C+R[-160]C+R[-157]C+R[-154]C+R[-151]C+R[-148]C+R[-145]C+R[-142]C+R[-139]C+R[-136]C+R[-133]C+R[-130]C+R[-127]C+R[-124]C+R[-121]C+R[-118]C+R[-115]C+R[-112]C+R[-109]C+R[-106]C+R[-103]C+R[-100]C+R[-97]C+R[-94]C+R[-91]C+R[-88]C+R[-85]C+R[-82]C+R[-79]C+R[-76]C+R[-73]C+R[-70]C+R[-67]C+R[-64]C+R[-61]C+R[-58]C+R[-55]C+R[-52]C+R[-49]C+R[-46]C+R[-43]C+R[-40]C+R[-37]C+R[-34]C+R[-31]C+R[-28]C+R[-25]C+R[-22]C+R[-19]C+R[-16]C+R[-13]C+R[-10]C+R[-7]C+R[-4]C -> -2925 | AC270: =R[-265]C+R[-262]C+R[-259]C+R[-256]C+R[-253]C+R[-250]C+R[-247]C+R[-244]C+R[-241]C+R[-238]C+R[-235]C+R[-232]C+R[-229]C+R[-226]C+R[-223]C+R[-220]C+R[-217]C+R[-214]C+R[-211]C+R[-208]C+R[-205]C+R[-202]C+R[-199]C+R[-196]C+R[-193]C+R[-190]C+R[-187]C+R[-184]C+R[-181]C+R[-178]C+R[-175]C+R[-172]C+R[-169]C+R[-166]C+R[-163]C+R[-160]C+R[-157]C+R[-154]C+R[-151]C+R[-148]C+R[-145]C+R[-142]C+R[-139]C+R[-136]C+R[-133]C+R[-130]C+R[-127]C+R[-124]C+R[-121]C+R[-118]C+R[-115]C+R[-112]C+R[-109]C+R[-106]C+R[-103]C+R[-100]C+R[-97]C+R[-94]C+R[-91]C+R[-88]C+R[-85]C+R[-82]C+R[-79]C+R[-76]C+R[-73]C+R[-70]C+R[-67]C+R[-64]C+R[-61]C+R[-58]C+R[-55]C+R[-52]C+R[-49]C+R[-46]C+R[-43]C+R[-40]C+R[-37]C+R[-34]C+R[-31]C+R[-28]C+R[-25]C+R[-22]C+R[-19]C+R[-16]C+R[-13]C+R[-10]C+R[-7]C+R[-4]C -> -650 | AD270: =R[-265]C+R[-262]C+R[-259]C+R[-256]C+R[-253]C+R[-250]C+R[-247]C+R[-244]C+R[-241]C+R[-238]C+R[-235]C+R[-232]C+R[-229]C+R[-226]C+R[-223]C+R[-220]C+R[-217]C+R[-214]C+R[-211]C+R[-208]C+R[-205]C+R[-202]C+R[-199]C+R[-196]C+R[-193]C+R[-190]C+R[-187]C+R[-184]C+R[-181]C+R[-178]C+R[-175]C+R[-172]C+R[-169]C+R[-166]C+R[-163]C+R[-160]C+R[-157]C+R[-154]C+R[-151]C+R[-148]C+R[-145]C+R[-142]C+R[-139]C+R[-136]C+R[-133]C+R[-130]C+R[-127]C+R[-124]C+R[-121]C+R[-118]C+R[-115]C+R[-112]C+R[-109]C+R[-106]C+R[-103]C+R[-100]C+R[-97]C+R[-94]C+R[-91]C+R[-88]C+R[-85]C+R[-82]C+R[-79]C+R[-76]C+R[-73]C+R[-70]C+R[-67]C+R[-64]C+R[-61]C+R[-58]C+R[-55]C+R[-52]C+R[-49]C+R[-46]C+R[-43]C+R[-40]C+R[-37]C+R[-34]C+R[-31]C+R[-28]C+R[-25]C+R[-22]C+R[-19]C+R[-16]C+R[-13]C+R[-10]C+R[-7]C+R[-4]C -> -66272 | AE270: =R[-265]C+R[-262]C+R[-259]C+R[-256]C+R[-253]C+R[-250]C+R[-247]C+R[-244]C+R[-241]C+R[-238]C+R[-235]C+R[-232]C+R[-229]C+R[-226]C+R[-223]C+R[-220]C+R[-217]C+R[-214]C+R[-211]C+R[-208]C+R[-205]C+R[-202]C+R[-199]C+R[-196]C+R[-193]C+R[-190]C+R[-187]C+R[-184]C+R[-181]C+R[-178]C+R[-175]C+R[-172]C+R[-169]C+R[-166]C+R[-163]C+R[-160]C+R[-157]C+R[-154]C+R[-151]C+R[-148]C+R[-145]C+R[-142]C+R[-139]C+R[-136]C+R[-133]C+R[-130]C+R[-127]C+R[-124]C+R[-121]C+R[-118]C+R[-115]C+R[-112]C+R[-109]C+R[-106]C+R[-103]C+R[-100]C+R[-97]C+R[-94]C+R[-91]C+R[-88]C+R[-85]C+R[-82]C+R[-79]C+R[-76]C+R[-73]C+R[-70]C+R[-67]C+R[-64]C+R[-61]C+R[-58]C+R[-55]C+R[-52]C+R[-49]C+R[-46]C+R[-43]C+R[-40]C+R[-37]C+R[-34]C+R[-31]C+R[-28]C+R[-25]C+R[-22]C+R[-19]C+R[-16]C+R[-13]C+R[-10]C+R[-7]C+R[-4]C -> -13411 | AF270: =R[-265]C+R[-262]C+R[-259]C+R[-256]C+R[-253]C+R[-250]C+R[-247]C+R[-244]C+R[-241]C+R[-238]C+R[-235]C+R[-232]C+R[-229]C+R[-226]C+R[-223]C+R[-220]C+R[-217]C+R[-214]C+R[-211]C+R[-208]C+R[-205]C+R[-202]C+R[-199]C+R[-196]C+R[-193]C+R[-190]C+R[-187]C+R[-184]C+R[-181]C+R[-178]C+R[-175]C+R[-172]C+R[-169]C+R[-166]C+R[-163]C+R[-160]C+R[-157]C+R[-154]C+R[-151]C+R[-148]C+R[-145]C+R[-142]C+R[-139]C+R[-136]C+R[-133]C+R[-130]C+R[-127]C+R[-124]C+R[-121]C+R[-118]C+R[-115]C+R[-112]C+R[-109]C+R[-106]C+R[-103]C+R[-100]C+R[-97]C+R[-94]C+R[-91]C+R[-88]C+R[-85]C+R[-82]C+R[-79]C+R[-76]C+R[-73]C+R[-70]C+R[-67]C+R[-64]C+R[-61]C+R[-58]C+R[-55]C+R[-52]C+R[-49]C+R[-46]C+R[-43]C+R[-40]C+R[-37]C+R[-34]C+R[-31]C+R[-28]C+R[-25]C+R[-22]C+R[-19]C+R[-16]C+R[-13]C+R[-10]C+R[-7]C+R[-4]C -> -18930 | AG270: =R[-265]C+R[-262]C+R[-259]C+R[-256]C+R[-253]C+R[-250]C+R[-247]C+R[-244]C+R[-241]C+R[-238]C+R[-235]C+R[-232]C+R[-229]C+R[-226]C+R[-223]C+R[-220]C+R[-217]C+R[-214]C+R[-211]C+R[-208]C+R[-205]C+R[-202]C+R[-199]C+R[-196]C+R[-193]C+R[-190]C+R[-187]C+R[-184]C+R[-181]C+R[-178]C+R[-175]C+R[-172]C+R[-169]C+R[-166]C+R[-163]C+R[-160]C+R[-157]C+R[-154]C+R[-151]C+R[-148]C+R[-145]C+R[-142]C+R[-139]C+R[-136]C+R[-133]C+R[-130]C+R[-127]C+R[-124]C+R[-121]C+R[-118]C+R[-115]C+R[-112]C+R[-109]C+R[-106]C+R[-103]C+R[-100]C+R[-97]C+R[-94]C+R[-91]C+R[-88]C+R[-85]C+R[-82]C+R[-79]C+R[-76]C+R[-73]C+R[-70]C+R[-67]C+R[-64]C+R[-61]C+R[-58]C+R[-55]C+R[-52]C+R[-49]C+R[-46]C+R[-43]C+R[-40]C+R[-37]C+R[-34]C+R[-31]C+R[-28]C+R[-25]C+R[-22]C+R[-19]C+R[-16]C+R[-13]C+R[-10]C+R[-7]C+R[-4]C -> -5800 | AH270: =R[-265]C+R[-262]C+R[-259]C+R[-256]C+R[-253]C+R[-250]C+R[-247]C+R[-244]C+R[-241]C+R[-238]C+R[-235]C+R[-232]C+R[-229]C+R[-226]C+R[-223]C+R[-220]C+R[-217]C+R[-214]C+R[-211]C+R[-208]C+R[-205]C+R[-202]C+R[-199]C+R[-196]C+R[-193]C+R[-190]C+R[-187]C+R[-184]C+R[-181]C+R[-178]C+R[-175]C+R[-172]C+R[-169]C+R[-166]C+R[-163]C+R[-160]C+R[-157]C+R[-154]C+R[-151]C+R[-148]C+R[-145]C+R[-142]C+R[-139]C+R[-136]C+R[-133]C+R[-130]C+R[-127]C+R[-124]C+R[-121]C+R[-118]C+R[-115]C+R[-112]C+R[-109]C+R[-106]C+R[-103]C+R[-100]C+R[-97]C+R[-94]C+R[-91]C+R[-88]C+R[-85]C+R[-82]C+R[-79]C+R[-76]C+R[-73]C+R[-70]C+R[-67]C+R[-64]C+R[-61]C+R[-58]C+R[-55]C+R[-52]C+R[-49]C+R[-46]C+R[-43]C+R[-40]C+R[-37]C+R[-34]C+R[-31]C+R[-28]C+R[-25]C+R[-22]C+R[-19]C+R[-16]C+R[-13]C+R[-10]C+R[-7]C+R[-4]C -> -2075 | AI270: =R[-265]C+R[-262]C+R[-259]C+R[-256]C+R[-253]C+R[-250]C+R[-247]C+R[-244]C+R[-241]C+R[-238]C+R[-235]C+R[-232]C+R[-229]C+R[-226]C+R[-223]C+R[-220]C+R[-217]C+R[-214]C+R[-211]C+R[-208]C+R[-205]C+R[-202]C+R[-199]C+R[-196]C+R[-193]C+R[-190]C+R[-187]C+R[-184]C+R[-181]C+R[-178]C+R[-175]C+R[-172]C+R[-169]C+R[-166]C+R[-163]C+R[-160]C+R[-157]C+R[-154]C+R[-151]C+R[-148]C+R[-145]C+R[-142]C+R[-139]C+R[-136]C+R[-133]C+R[-130]C+R[-127]C+R[-124]C+R[-121]C+R[-118]C+R[-115]C+R[-112]C+R[-109]C+R[-106]C+R[-103]C+R[-100]C+R[-97]C+R[-94]C+R[-91]C+R[-88]C+R[-85]C+R[-82]C+R[-79]C+R[-76]C+R[-73]C+R[-70]C+R[-67]C+R[-64]C+R[-61]C+R[-58]C+R[-55]C+R[-52]C+R[-49]C+R[-46]C+R[-43]C+R[-40]C+R[-37]C+R[-34]C+R[-31]C+R[-28]C+R[-25]C+R[-22]C+R[-19]C+R[-16]C+R[-13]C+R[-10]C+R[-7]C+R[-4]C -> -6177 | AJ270: =R[-265]C+R[-262]C+R[-259]C+R[-256]C+R[-253]C+R[-250]C+R[-247]C+R[-244]C+R[-241]C+R[-238]C+R[-235]C+R[-232]C+R[-229]C+R[-226]C+R[-223]C+R[-220]C+R[-217]C+R[-214]C+R[-211]C+R[-208]C+R[-205]C+R[-202]C+R[-199]C+R[-196]C+R[-193]C+R[-190]C+R[-187]C+R[-184]C+R[-181]C+R[-178]C+R[-175]C+R[-172]C+R[-169]C+R[-166]C+R[-163]C+R[-160]C+R[-157]C+R[-154]C+R[-151]C+R[-148]C+R[-145]C+R[-142]C+R[-139]C+R[-136]C+R[-133]C+R[-130]C+R[-127]C+R[-124]C+R[-121]C+R[-118]C+R[-115]C+R[-112]C+R[-109]C+R[-106]C+R[-103]C+R[-100]C+R[-97]C+R[-94]C+R[-91]C+R[-88]C+R[-85]C+R[-82]C+R[-79]C+R[-76]C+R[-73]C+R[-70]C+R[-67]C+R[-64]C+R[-61]C+R[-58]C+R[-55]C+R[-52]C+R[-49]C+R[-46]C+R[-43]C+R[-40]C+R[-37]C+R[-34]C+R[-31]C+R[-28]C+R[-25]C+R[-22]C+R[-19]C+R[-16]C+R[-13]C+R[-10]C+R[-7]C+R[-4]C -> -11323 | AK270: =R[-265]C+R[-262]C+R[-259]C+R[-256]C+R[-253]C+R[-250]C+R[-247]C+R[-244]C+R[-241]C+R[-238]C+R[-235]C+R[-232]C+R[-229]C+R[-226]C+R[-223]C+R[-220]C+R[-217]C+R[-214]C+R[-211]C+R[-208]C+R[-205]C+R[-202]C+R[-199]C+R[-196]C+R[-193]C+R[-190]C+R[-187]C+R[-184]C+R[-181]C+R[-178]C+R[-175]C+R[-172]C+R[-169]C+R[-166]C+R[-163]C+R[-160]C+R[-157]C+R[-154]C+R[-151]C+R[-148]C+R[-145]C+R[-142]C+R[-139]C+R[-136]C+R[-133]C+R[-130]C+R[-127]C+R[-124]C+R[-121]C+R[-118]C+R[-115]C+R[-112]C+R[-109]C+R[-106]C+R[-103]C+R[-100]C+R[-97]C+R[-94]C+R[-91]C+R[-88]C+R[-85]C+R[-82]C+R[-79]C+R[-76]C+R[-73]C+R[-70]C+R[-67]C+R[-64]C+R[-61]C+R[-58]C+R[-55]C+R[-52]C+R[-49]C+R[-46]C+R[-43]C+R[-40]C+R[-37]C+R[-34]C+R[-31]C+R[-28]C+R[-25]C+R[-22]C+R[-19]C+R[-16]C+R[-13]C+R[-10]C+R[-7]C+R[-4]C -> -1245 | AL270: =R[-265]C+R[-262]C+R[-259]C+R[-256]C+R[-253]C+R[-250]C+R[-247]C+R[-244]C+R[-241]C+R[-238]C+R[-235]C+R[-232]C+R[-229]C+R[-226]C+R[-223]C+R[-220]C+R[-217]C+R[-214]C+R[-211]C+R[-208]C+R[-205]C+R[-202]C+R[-199]C+R[-196]C+R[-193]C+R[-190]C+R[-187]C+R[-184]C+R[-181]C+R[-178]C+R[-175]C+R[-172]C+R[-169]C+R[-166]C+R[-163]C+R[-160]C+R[-157]C+R[-154]C+R[-151]C+R[-148]C+R[-145]C+R[-142]C+R[-139]C+R[-136]C+R[-133]C+R[-130]C+R[-127]C+R[-124]C+R[-121]C+R[-118]C+R[-115]C+R[-112]C+R[-109]C+R[-106]C+R[-103]C+R[-100]C+R[-97]C+R[-94]C+R[-91]C+R[-88]C+R[-85]C+R[-82]C+R[-79]C+R[-76]C+R[-73]C+R[-70]C+R[-67]C+R[-64]C+R[-61]C+R[-58]C+R[-55]C+R[-52]C+R[-49]C+R[-46]C+R[-43]C+R[-40]C+R[-37]C+R[-34]C+R[-31]C+R[-28]C+R[-25]C+R[-22]C+R[-19]C+R[-16]C+R[-13]C+R[-10]C+R[-7]C+R[-4]C -> -833 | AM270: =R[-265]C+R[-262]C+R[-259]C+R[-256]C+R[-253]C+R[-250]C+R[-247]C+R[-244]C+R[-241]C+R[-238]C+R[-235]C+R[-232]C+R[-229]C+R[-226]C+R[-223]C+R[-220]C+R[-217]C+R[-214]C+R[-211]C+R[-208]C+R[-205]C+R[-202]C+R[-199]C+R[-196]C+R[-193]C+R[-190]C+R[-187]C+R[-184]C+R[-181]C+R[-178]C+R[-175]C+R[-172]C+R[-169]C+R[-166]C+R[-163]C+R[-160]C+R[-157]C+R[-154]C+R[-151]C+R[-148]C+R[-145]C+R[-142]C+R[-139]C+R[-136]C+R[-133]C+R[-130]C+R[-127]C+R[-124]C+R[-121]C+R[-118]C+R[-115]C+R[-112]C+R[-109]C+R[-106]C+R[-103]C+R[-100]C+R[-97]C+R[-94]C+R[-91]C+R[-88]C+R[-85]C+R[-82]C+R[-79]C+R[-76]C+R[-73]C+R[-70]C+R[-67]C+R[-64]C+R[-61]C+R[-58]C+R[-55]C+R[-52]C+R[-49]C+R[-46]C+R[-43]C+R[-40]C+R[-37]C+R[-34]C+R[-31]C+R[-28]C+R[-25]C+R[-22]C+R[-19]C+R[-16]C+R[-13]C+R[-10]C+R[-7]C+R[-4]C -> -1950 | AN270: =R[-265]C+R[-262]C+R[-259]C+R[-256]C+R[-253]C+R[-250]C+R[-247]C+R[-244]C+R[-241]C+R[-238]C+R[-235]C+R[-232]C+R[-229]C+R[-226]C+R[-223]C+R[-220]C+R[-217]C+R[-214]C+R[-211]C+R[-208]C+R[-205]C+R[-202]C+R[-199]C+R[-196]C+R[-193]C+R[-190]C+R[-187]C+R[-184]C+R[-181]C+R[-178]C+R[-175]C+R[-172]C+R[-169]C+R[-166]C+R[-163]C+R[-160]C+R[-157]C+R[-154]C+R[-151]C+R[-148]C+R[-145]C+R[-142]C+R[-139]C+R[-136]C+R[-133]C+R[-130]C+R[-127]C+R[-124]C+R[-121]C+R[-118]C+R[-115]C+R[-112]C+R[-109]C+R[-106]C+R[-103]C+R[-100]C+R[-97]C+R[-94]C+R[-91]C+R[-88]C+R[-85]C+R[-82]C+R[-79]C+R[-76]C+R[-73]C+R[-70]C+R[-67]C+R[-64]C+R[-61]C+R[-58]C+R[-55]C+R[-52]C+R[-49]C+R[-46]C+R[-43]C+R[-40]C+R[-37]C+R[-34]C+R[-31]C+R[-28]C+R[-25]C+R[-22]C+R[-19]C+R[-16]C+R[-13]C+R[-10]C+R[-7]C+R[-4]C -> -600 | AO270: =R[-265]C+R[-262]C+R[-259]C+R[-256]C+R[-253]C+R[-250]C+R[-247]C+R[-244]C+R[-241]C+R[-238]C+R[-235]C+R[-232]C+R[-229]C+R[-226]C+R[-223]C+R[-220]C+R[-217]C+R[-214]C+R[-211]C+R[-208]C+R[-205]C+R[-202]C+R[-199]C+R[-196]C+R[-193]C+R[-190]C+R[-187]C+R[-184]C+R[-181]C+R[-178]C+R[-175]C+R[-172]C+R[-169]C+R[-166]C+R[-163]C+R[-160]C+R[-157]C+R[-154]C+R[-151]C+R[-148]C+R[-145]C+R[-142]C+R[-139]C+R[-136]C+R[-133]C+R[-130]C+R[-127]C+R[-124]C+R[-121]C+R[-118]C+R[-115]C+R[-112]C+R[-109]C+R[-106]C+R[-103]C+R[-100]C+R[-97]C+R[-94]C+R[-91]C+R[-88]C+R[-85]C+R[-82]C+R[-79]C+R[-76]C+R[-73]C+R[-70]C+R[-67]C+R[-64]C+R[-61]C+R[-58]C+R[-55]C+R[-52]C+R[-49]C+R[-46]C+R[-43]C+R[-40]C+R[-37]C+R[-34]C+R[-31]C+R[-28]C+R[-25]C+R[-22]C+R[-19]C+R[-16]C+R[-13]C+R[-10]C+R[-7]C+R[-4]C -> -4557 | AP270: =R[-265]C+R[-262]C+R[-259]C+R[-256]C+R[-253]C+R[-250]C+R[-247]C+R[-244]C+R[-241]C+R[-238]C+R[-235]C+R[-232]C+R[-229]C+R[-226]C+R[-223]C+R[-220]C+R[-217]C+R[-214]C+R[-211]C+R[-208]C+R[-205]C+R[-202]C+R[-199]C+R[-196]C+R[-193]C+R[-190]C+R[-187]C+R[-184]C+R[-181]C+R[-178]C+R[-175]C+R[-172]C+R[-169]C+R[-166]C+R[-163]C+R[-160]C+R[-157]C+R[-154]C+R[-151]C+R[-148]C+R[-145]C+R[-142]C+R[-139]C+R[-136]C+R[-133]C+R[-130]C+R[-127]C+R[-124]C+R[-121]C+R[-118]C+R[-115]C+R[-112]C+R[-109]C+R[-106]C+R[-103]C+R[-100]C+R[-97]C+R[-94]C+R[-91]C+R[-88]C+R[-85]C+R[-82]C+R[-79]C+R[-76]C+R[-73]C+R[-70]C+R[-67]C+R[-64]C+R[-61]C+R[-58]C+R[-55]C+R[-52]C+R[-49]C+R[-46]C+R[-43]C+R[-40]C+R[-37]C+R[-34]C+R[-31]C+R[-28]C+R[-25]C+R[-22]C+R[-19]C+R[-16]C+R[-13]C+R[-10]C+R[-7]C+R[-4]C -> -3921 | AQ270: =R[-265]C+R[-262]C+R[-259]C+R[-256]C+R[-253]C+R[-250]C+R[-247]C+R[-244]C+R[-241]C+R[-238]C+R[-235]C+R[-232]C+R[-229]C+R[-226]C+R[-223]C+R[-220]C+R[-217]C+R[-214]C+R[-211]C+R[-208]C+R[-205]C+R[-202]C+R[-199]C+R[-196]C+R[-193]C+R[-190]C+R[-187]C+R[-184]C+R[-181]C+R[-178]C+R[-175]C+R[-172]C+R[-169]C+R[-166]C+R[-163]C+R[-160]C+R[-157]C+R[-154]C+R[-151]C+R[-148]C+R[-145]C+R[-142]C+R[-139]C+R[-136]C+R[-133]C+R[-130]C+R[-127]C+R[-124]C+R[-121]C+R[-118]C+R[-115]C+R[-112]C+R[-109]C+R[-106]C+R[-103]C+R[-100]C+R[-97]C+R[-94]C+R[-91]C+R[-88]C+R[-85]C+R[-82]C+R[-79]C+R[-76]C+R[-73]C+R[-70]C+R[-67]C+R[-64]C+R[-61]C+R[-58]C+R[-55]C+R[-52]C+R[-49]C+R[-46]C+R[-43]C+R[-40]C+R[-37]C+R[-34]C+R[-31]C+R[-28]C+R[-25]C+R[-22]C+R[-19]C+R[-16]C+R[-13]C+R[-10]C+R[-7]C+R[-4]C -> -3250 | AR270: =R[-265]C+R[-262]C+R[-259]C+R[-256]C+R[-253]C+R[-250]C+R[-247]C+R[-244]C+R[-241]C+R[-238]C+R[-235]C+R[-232]C+R[-229]C+R[-226]C+R[-223]C+R[-220]C+R[-217]C+R[-214]C+R[-211]C+R[-208]C+R[-205]C+R[-202]C+R[-199]C+R[-196]C+R[-193]C+R[-190]C+R[-187]C+R[-184]C+R[-181]C+R[-178]C+R[-175]C+R[-172]C+R[-169]C+R[-166]C+R[-163]C+R[-160]C+R[-157]C+R[-154]C+R[-151]C+R[-148]C+R[-145]C+R[-142]C+R[-139]C+R[-136]C+R[-133]C+R[-130]C+R[-127]C+R[-124]C+R[-121]C+R[-118]C+R[-115]C+R[-112]C+R[-109]C+R[-106]C+R[-103]C+R[-100]C+R[-97]C+R[-94]C+R[-91]C+R[-88]C+R[-85]C+R[-82]C+R[-79]C+R[-76]C+R[-73]C+R[-70]C+R[-67]C+R[-64]C+R[-61]C+R[-58]C+R[-55]C+R[-52]C+R[-49]C+R[-46]C+R[-43]C+R[-40]C+R[-37]C+R[-34]C+R[-31]C+R[-28]C+R[-25]C+R[-22]C+R[-19]C+R[-16]C+R[-13]C+R[-10]C+R[-7]C+R[-4]C -> -3921 | AS270: =R[-265]C+R[-262]C+R[-259]C+R[-256]C+R[-253]C+R[-250]C+R[-247]C+R[-244]C+R[-241]C+R[-238]C+R[-235]C+R[-232]C+R[-229]C+R[-226]C+R[-223]C+R[-220]C+R[-217]C+R[-214]C+R[-211]C+R[-208]C+R[-205]C+R[-202]C+R[-199]C+R[-196]C+R[-193]C+R[-190]C+R[-187]C+R[-184]C+R[-181]C+R[-178]C+R[-175]C+R[-172]C+R[-169]C+R[-166]C+R[-163]C+R[-160]C+R[-157]C+R[-154]C+R[-151]C+R[-148]C+R[-145]C+R[-142]C+R[-139]C+R[-136]C+R[-133]C+R[-130]C+R[-127]C+R[-124]C+R[-121]C+R[-118]C+R[-115]C+R[-112]C+R[-109]C+R[-106]C+R[-103]C+R[-100]C+R[-97]C+R[-94]C+R[-91]C+R[-88]C+R[-85]C+R[-82]C+R[-79]C+R[-76]C+R[-73]C+R[-70]C+R[-67]C+R[-64]C+R[-61]C+R[-58]C+R[-55]C+R[-52]C+R[-49]C+R[-46]C+R[-43]C+R[-40]C+R[-37]C+R[-34]C+R[-31]C+R[-28]C+R[-25]C+R[-22]C+R[-19]C+R[-16]C+R[-13]C+R[-10]C+R[-7]C+R[-4]C -> -625 | AT270: =R[-265]C+R[-262]C+R[-259]C+R[-256]C+R[-253]C+R[-250]C+R[-247]C+R[-244]C+R[-241]C+R[-238]C+R[-235]C+R[-232]C+R[-229]C+R[-226]C+R[-223]C+R[-220]C+R[-217]C+R[-214]C+R[-211]C+R[-208]C+R[-205]C+R[-202]C+R[-199]C+R[-196]C+R[-193]C+R[-190]C+R[-187]C+R[-184]C+R[-181]C+R[-178]C+R[-175]C+R[-172]C+R[-169]C+R[-166]C+R[-163]C+R[-160]C+R[-157]C+R[-154]C+R[-151]C+R[-148]C+R[-145]C+R[-142]C+R[-139]C+R[-136]C+R[-133]C+R[-130]C+R[-127]C+R[-124]C+R[-121]C+R[-118]C+R[-115]C+R[-112]C+R[-109]C+R[-106]C+R[-103]C+R[-100]C+R[-97]C+R[-94]C+R[-91]C+R[-88]C+R[-85]C+R[-82]C+R[-79]C+R[-76]C+R[-73]C+R[-70]C+R[-67]C+R[-64]C+R[-61]C+R[-58]C+R[-55]C+R[-52]C+R[-49]C+R[-46]C+R[-43]C+R[-40]C+R[-37]C+R[-34]C+R[-31]C+R[-28]C+R[-25]C+R[-22]C+R[-19]C+R[-16]C+R[-13]C+R[-10]C+R[-7]C+R[-4]C -> -845 | AU270: =R[-265]C+R[-262]C+R[-259]C+R[-256]C+R[-253]C+R[-250]C+R[-247]C+R[-244]C+R[-241]C+R[-238]C+R[-235]C+R[-232]C+R[-229]C+R[-226]C+R[-223]C+R[-220]C+R[-217]C+R[-214]C+R[-211]C+R[-208]C+R[-205]C+R[-202]C+R[-199]C+R[-196]C+R[-193]C+R[-190]C+R[-187]C+R[-184]C+R[-181]C+R[-178]C+R[-175]C+R[-172]C+R[-169]C+R[-166]C+R[-163]C+R[-160]C+R[-157]C+R[-154]C+R[-151]C+R[-148]C+R[-145]C+R[-142]C+R[-139]C+R[-136]C+R[-133]C+R[-130]C+R[-127]C+R[-124]C+R[-121]C+R[-118]C+R[-115]C+R[-112]C+R[-109]C+R[-106]C+R[-103]C+R[-100]C+R[-97]C+R[-94]C+R[-91]C+R[-88]C+R[-85]C+R[-82]C+R[-79]C+R[-76]C+R[-73]C+R[-70]C+R[-67]C+R[-64]C+R[-61]C+R[-58]C+R[-55]C+R[-52]C+R[-49]C+R[-46]C+R[-43]C+R[-40]C+R[-37]C+R[-34]C+R[-31]C+R[-28]C+R[-25]C+R[-22]C+R[-19]C+R[-16]C+R[-13]C+R[-10]C+R[-7]C+R[-4]C -> -1045 | AV270: =R[-265]C+R[-262]C+R[-259]C+R[-256]C+R[-253]C+R[-250]C+R[-247]C+R[-244]C+R[-241]C+R[-238]C+R[-235]C+R[-232]C+R[-229]C+R[-226]C+R[-223]C+R[-220]C+R[-217]C+R[-214]C+R[-211]C+R[-208]C+R[-205]C+R[-202]C+R[-199]C+R[-196]C+R[-193]C+R[-190]C+R[-187]C+R[-184]C+R[-181]C+R[-178]C+R[-175]C+R[-172]C+R[-169]C+R[-166]C+R[-163]C+R[-160]C+R[-157]C+R[-154]C+R[-151]C+R[-148]C+R[-145]C+R[-142]C+R[-139]C+R[-136]C+R[-133]C+R[-130]C+R[-127]C+R[-124]C+R[-121]C+R[-118]C+R[-115]C+R[-112]C+R[-109]C+R[-106]C+R[-103]C+R[-100]C+R[-97]C+R[-94]C+R[-91]C+R[-88]C+R[-85]C+R[-82]C+R[-79]C+R[-76]C+R[-73]C+R[-70]C+R[-67]C+R[-64]C+R[-61]C+R[-58]C+R[-55]C+R[-52]C+R[-49]C+R[-46]C+R[-43]C+R[-40]C+R[-37]C+R[-34]C+R[-31]C+R[-28]C+R[-25]C+R[-22]C+R[-19]C+R[-16]C+R[-13]C+R[-10]C+R[-7]C+R[-4]C -> -2904 | AW270: =R[-265]C+R[-262]C+R[-259]C+R[-256]C+R[-253]C+R[-250]C+R[-247]C+R[-244]C+R[-241]C+R[-238]C+R[-235]C+R[-232]C+R[-229]C+R[-226]C+R[-223]C+R[-220]C+R[-217]C+R[-214]C+R[-211]C+R[-208]C+R[-205]C+R[-202]C+R[-199]C+R[-196]C+R[-193]C+R[-190]C+R[-187]C+R[-184]C+R[-181]C+R[-178]C+R[-175]C+R[-172]C+R[-169]C+R[-166]C+R[-163]C+R[-160]C+R[-157]C+R[-154]C+R[-151]C+R[-148]C+R[-145]C+R[-142]C+R[-139]C+R[-136]C+R[-133]C+R[-130]C+R[-127]C+R[-124]C+R[-121]C+R[-118]C+R[-115]C+R[-112]C+R[-109]C+R[-106]C+R[-103]C+R[-100]C+R[-97]C+R[-94]C+R[-91]C+R[-88]C+R[-85]C+R[-82]C+R[-79]C+R[-76]C+R[-73]C+R[-70]C+R[-67]C+R[-64]C+R[-61]C+R[-58]C+R[-55]C+R[-52]C+R[-49]C+R[-46]C+R[-43]C+R[-40]C+R[-37]C+R[-34]C+R[-31]C+R[-28]C+R[-25]C+R[-22]C+R[-19]C+R[-16]C+R[-13]C+R[-10]C+R[-7]C+R[-4]C -> -968 | AX270: =R[-265]C+R[-262]C+R[-259]C+R[-256]C+R[-253]C+R[-250]C+R[-247]C+R[-244]C+R[-241]C+R[-238]C+R[-235]C+R[-232]C+R[-229]C+R[-226]C+R[-223]C+R[-220]C+R[-217]C+R[-214]C+R[-211]C+R[-208]C+R[-205]C+R[-202]C+R[-199]C+R[-196]C+R[-193]C+R[-190]C+R[-187]C+R[-184]C+R[-181]C+R[-178]C+R[-175]C+R[-172]C+R[-169]C+R[-166]C+R[-163]C+R[-160]C+R[-157]C+R[-154]C+R[-151]C+R[-148]C+R[-145]C+R[-142]C+R[-139]C+R[-136]C+R[-133]C+R[-130]C+R[-127]C+R[-124]C+R[-121]C+R[-118]C+R[-115]C+R[-112]C+R[-109]C+R[-106]C+R[-103]C+R[-100]C+R[-97]C+R[-94]C+R[-91]C+R[-88]C+R[-85]C+R[-82]C+R[-79]C+R[-76]C+R[-73]C+R[-70]C+R[-67]C+R[-64]C+R[-61]C+R[-58]C+R[-55]C+R[-52]C+R[-49]C+R[-46]C+R[-43]C+R[-40]C+R[-37]C+R[-34]C+R[-31]C+R[-28]C+R[-25]C+R[-22]C+R[-19]C+R[-16]C+R[-13]C+R[-10]C+R[-7]C+R[-4]C -> -1070 | AY270: =R[-265]C+R[-262]C+R[-259]C+R[-256]C+R[-253]C+R[-250]C+R[-247]C+R[-244]C+R[-241]C+R[-238]C+R[-235]C+R[-232]C+R[-229]C+R[-226]C+R[-223]C+R[-220]C+R[-217]C+R[-214]C+R[-211]C+R[-208]C+R[-205]C+R[-202]C+R[-199]C+R[-196]C+R[-193]C+R[-190]C+R[-187]C+R[-184]C+R[-181]C+R[-178]C+R[-175]C+R[-172]C+R[-169]C+R[-166]C+R[-163]C+R[-160]C+R[-157]C+R[-154]C+R[-151]C+R[-148]C+R[-145]C+R[-142]C+R[-139]C+R[-136]C+R[-133]C+R[-130]C+R[-127]C+R[-124]C+R[-121]C+R[-118]C+R[-115]C+R[-112]C+R[-109]C+R[-106]C+R[-103]C+R[-100]C+R[-97]C+R[-94]C+R[-91]C+R[-88]C+R[-85]C+R[-82]C+R[-79]C+R[-76]C+R[-73]C+R[-70]C+R[-67]C+R[-64]C+R[-61]C+R[-58]C+R[-55]C+R[-52]C+R[-49]C+R[-46]C+R[-43]C+R[-40]C+R[-37]C+R[-34]C+R[-31]C+R[-28]C+R[-25]C+R[-22]C+R[-19]C+R[-16]C+R[-13]C+R[-10]C+R[-7]C+R[-4]C -> -3190 | AZ270: =R[-265]C+R[-262]C+R[-259]C+R[-256]C+R[-253]C+R[-250]C+R[-247]C+R[-244]C+R[-241]C+R[-238]C+R[-235]C+R[-232]C+R[-229]C+R[-226]C+R[-223]C+R[-220]C+R[-217]C+R[-214]C+R[-211]C+R[-208]C+R[-205]C+R[-202]C+R[-199]C+R[-196]C+R[-193]C+R[-190]C+R[-187]C+R[-184]C+R[-181]C+R[-178]C+R[-175]C+R[-172]C+R[-169]C+R[-166]C+R[-163]C+R[-160]C+R[-157]C+R[-154]C+R[-151]C+R[-148]C+R[-145]C+R[-142]C+R[-139]C+R[-136]C+R[-133]C+R[-130]C+R[-127]C+R[-124]C+R[-121]C+R[-118]C+R[-115]C+R[-112]C+R[-109]C+R[-106]C+R[-103]C+R[-100]C+R[-97]C+R[-94]C+R[-91]C+R[-88]C+R[-85]C+R[-82]C+R[-79]C+R[-76]C+R[-73]C+R[-70]C+R[-67]C+R[-64]C+R[-61]C+R[-58]C+R[-55]C+R[-52]C+R[-49]C+R[-46]C+R[-43]C+R[-40]C+R[-37]C+R[-34]C+R[-31]C+R[-28]C+R[-25]C+R[-22]C+R[-19]C+R[-16]C+R[-13]C+R[-10]C+R[-7]C+R[-4]C -> -1200 | BA270: =R[-265]C+R[-262]C+R[-259]C+R[-256]C+R[-253]C+R[-250]C+R[-247]C+R[-244]C+R[-241]C+R[-238]C+R[-235]C+R[-232]C+R[-229]C+R[-226]C+R[-223]C+R[-220]C+R[-217]C+R[-214]C+R[-211]C+R[-208]C+R[-205]C+R[-202]C+R[-199]C+R[-196]C+R[-193]C+R[-190]C+R[-187]C+R[-184]C+R[-181]C+R[-178]C+R[-175]C+R[-172]C+R[-169]C+R[-166]C+R[-163]C+R[-160]C+R[-157]C+R[-154]C+R[-151]C+R[-148]C+R[-145]C+R[-142]C+R[-139]C+R[-136]C+R[-133]C+R[-130]C+R[-127]C+R[-124]C+R[-121]C+R[-118]C+R[-115]C+R[-112]C+R[-109]C+R[-106]C+R[-103]C+R[-100]C+R[-97]C+R[-94]C+R[-91]C+R[-88]C+R[-85]C+R[-82]C+R[-79]C+R[-76]C+R[-73]C+R[-70]C+R[-67]C+R[-64]C+R[-61]C+R[-58]C+R[-55]C+R[-52]C+R[-49]C+R[-46]C+R[-43]C+R[-40]C+R[-37]C+R[-34]C+R[-31]C+R[-28]C+R[-25]C+R[-22]C+R[-19]C+R[-16]C+R[-13]C+R[-10]C+R[-7]C+R[-4]C -> -2600 | BB270: =R[-265]C+R[-262]C+R[-259]C+R[-256]C+R[-253]C+R[-250]C+R[-247]C+R[-244]C+R[-241]C+R[-238]C+R[-235]C+R[-232]C+R[-229]C+R[-226]C+R[-223]C+R[-220]C+R[-217]C+R[-214]C+R[-211]C+R[-208]C+R[-205]C+R[-202]C+R[-199]C+R[-196]C+R[-193]C+R[-190]C+R[-187]C+R[-184]C+R[-181]C+R[-178]C+R[-175]C+R[-172]C+R[-169]C+R[-166]C+R[-163]C+R[-160]C+R[-157]C+R[-154]C+R[-151]C+R[-148]C+R[-145]C+R[-142]C+R[-139]C+R[-136]C+R[-133]C+R[-130]C+R[-127]C+R[-124]C+R[-121]C+R[-118]C+R[-115]C+R[-112]C+R[-109]C+R[-106]C+R[-103]C+R[-100]C+R[-97]C+R[-94]C+R[-91]C+R[-88]C+R[-85]C+R[-82]C+R[-79]C+R[-76]C+R[-73]C+R[-70]C+R[-67]C+R[-64]C+R[-61]C+R[-58]C+R[-55]C+R[-52]C+R[-49]C+R[-46]C+R[-43]C+R[-40]C+R[-37]C+R[-34]C+R[-31]C+R[-28]C+R[-25]C+R[-22]C+R[-19]C+R[-16]C+R[-13]C+R[-10]C+R[-7]C+R[-4]C -> -4873 | BC270: =R[-265]C+R[-262]C+R[-259]C+R[-256]C+R[-253]C+R[-250]C+R[-247]C+R[-244]C+R[-241]C+R[-238]C+R[-235]C+R[-232]C+R[-229]C+R[-226]C+R[-223]C+R[-220]C+R[-217]C+R[-214]C+R[-211]C+R[-208]C+R[-205]C+R[-202]C+R[-199]C+R[-196]C+R[-193]C+R[-190]C+R[-187]C+R[-184]C+R[-181]C+R[-178]C+R[-175]C+R[-172]C+R[-169]C+R[-166]C+R[-163]C+R[-160]C+R[-157]C+R[-154]C+R[-151]C+R[-148]C+R[-145]C+R[-142]C+R[-139]C+R[-136]C+R[-133]C+R[-130]C+R[-127]C+R[-124]C+R[-121]C+R[-118]C+R[-115]C+R[-112]C+R[-109]C+R[-106]C+R[-103]C+R[-100]C+R[-97]C+R[-94]C+R[-91]C+R[-88]C+R[-85]C+R[-82]C+R[-79]C+R[-76]C+R[-73]C+R[-70]C+R[-67]C+R[-64]C+R[-61]C+R[-58]C+R[-55]C+R[-52]C+R[-49]C+R[-46]C+R[-43]C+R[-40]C+R[-37]C+R[-34]C+R[-31]C+R[-28]C+R[-25]C+R[-22]C+R[-19]C+R[-16]C+R[-13]C+R[-10]C+R[-7]C+R[-4]C -> -4876 | BD270: =R[-265]C+R[-262]C+R[-259]C+R[-256]C+R[-253]C+R[-250]C+R[-247]C+R[-244]C+R[-241]C+R[-238]C+R[-235]C+R[-232]C+R[-229]C+R[-226]C+R[-223]C+R[-220]C+R[-217]C+R[-214]C+R[-211]C+R[-208]C+R[-205]C+R[-202]C+R[-199]C+R[-196]C+R[-193]C+R[-190]C+R[-187]C+R[-184]C+R[-181]C+R[-178]C+R[-175]C+R[-172]C+R[-169]C+R[-166]C+R[-163]C+R[-160]C+R[-157]C+R[-154]C+R[-151]C+R[-148]C+R[-145]C+R[-142]C+R[-139]C+R[-136]C+R[-133]C+R[-130]C+R[-127]C+R[-124]C+R[-121]C+R[-118]C+R[-115]C+R[-112]C+R[-109]C+R[-106]C+R[-103]C+R[-100]C+R[-97]C+R[-94]C+R[-91]C+R[-88]C+R[-85]C+R[-82]C+R[-79]C+R[-76]C+R[-73]C+R[-70]C+R[-67]C+R[-64]C+R[-61]C+R[-58]C+R[-55]C+R[-52]C+R[-49]C+R[-46]C+R[-43]C+R[-40]C+R[-37]C+R[-34]C+R[-31]C+R[-28]C+R[-25]C+R[-22]C+R[-19]C+R[-16]C+R[-13]C+R[-10]C+R[-7]C+R[-4]C -> -4825 | BE270: =R[-265]C+R[-262]C+R[-259]C+R[-256]C+R[-253]C+R[-250]C+R[-247]C+R[-244]C+R[-241]C+R[-238]C+R[-235]C+R[-232]C+R[-229]C+R[-226]C+R[-223]C+R[-220]C+R[-217]C+R[-214]C+R[-211]C+R[-208]C+R[-205]C+R[-202]C+R[-199]C+R[-196]C+R[-193]C+R[-190]C+R[-187]C+R[-184]C+R[-181]C+R[-178]C+R[-175]C+R[-172]C+R[-169]C+R[-166]C+R[-163]C+R[-160]C+R[-157]C+R[-154]C+R[-151]C+R[-148]C+R[-145]C+R[-142]C+R[-139]C+R[-136]C+R[-133]C+R[-130]C+R[-127]C+R[-124]C+R[-121]C+R[-118]C+R[-115]C+R[-112]C+R[-109]C+R[-106]C+R[-103]C+R[-100]C+R[-97]C+R[-94]C+R[-91]C+R[-88]C+R[-85]C+R[-82]C+R[-79]C+R[-76]C+R[-73]C+R[-70]C+R[-67]C+R[-64]C+R[-61]C+R[-58]C+R[-55]C+R[-52]C+R[-49]C+R[-46]C+R[-43]C+R[-40]C+R[-37]C+R[-34]C+R[-31]C+R[-28]C+R[-25]C+R[-22]C+R[-19]C+R[-16]C+R[-13]C+R[-10]C+R[-7]C+R[-4]C -> -32648 | BF270: =R[-265]C+R[-262]C+R[-259]C+R[-256]C+R[-253]C+R[-250]C+R[-247]C+R[-244]C+R[-241]C+R[-238]C+R[-235]C+R[-232]C+R[-229]C+R[-226]C+R[-223]C+R[-220]C+R[-217]C+R[-214]C+R[-211]C+R[-208]C+R[-205]C+R[-202]C+R[-199]C+R[-196]C+R[-193]C+R[-190]C+R[-187]C+R[-184]C+R[-181]C+R[-178]C+R[-175]C+R[-172]C+R[-169]C+R[-166]C+R[-163]C+R[-160]C+R[-157]C+R[-154]C+R[-151]C+R[-148]C+R[-145]C+R[-142]C+R[-139]C+R[-136]C+R[-133]C+R[-130]C+R[-127]C+R[-124]C+R[-121]C+R[-118]C+R[-115]C+R[-112]C+R[-109]C+R[-106]C+R[-103]C+R[-100]C+R[-97]C+R[-94]C+R[-91]C+R[-88]C+R[-85]C+R[-82]C+R[-79]C+R[-76]C+R[-73]C+R[-70]C+R[-67]C+R[-64]C+R[-61]C+R[-58]C+R[-55]C+R[-52]C+R[-49]C+R[-46]C+R[-43]C+R[-40]C+R[-37]C+R[-34]C+R[-31]C+R[-28]C+R[-25]C+R[-22]C+R[-19]C+R[-16]C+R[-13]C+R[-10]C+R[-7]C+R[-4]C -> -8325 | BG270: =R[-265]C+R[-262]C+R[-259]C+R[-256]C+R[-253]C+R[-250]C+R[-247]C+R[-244]C+R[-241]C+R[-238]C+R[-235]C+R[-232]C+R[-229]C+R[-226]C+R[-223]C+R[-220]C+R[-217]C+R[-214]C+R[-211]C+R[-208]C+R[-205]C+R[-202]C+R[-199]C+R[-196]C+R[-193]C+R[-190]C+R[-187]C+R[-184]C+R[-181]C+R[-178]C+R[-175]C+R[-172]C+R[-169]C+R[-166]C+R[-163]C+R[-160]C+R[-157]C+R[-154]C+R[-151]C+R[-148]C+R[-145]C+R[-142]C+R[-139]C+R[-136]C+R[-133]C+R[-130]C+R[-127]C+R[-124]C+R[-121]C+R[-118]C+R[-115]C+R[-112]C+R[-109]C+R[-106]C+R[-103]C+R[-100]C+R[-97]C+R[-94]C+R[-91]C+R[-88]C+R[-85]C+R[-82]C+R[-79]C+R[-76]C+R[-73]C+R[-70]C+R[-67]C+R[-64]C+R[-61]C+R[-58]C+R[-55]C+R[-52]C+R[-49]C+R[-46]C+R[-43]C+R[-40]C+R[-37]C+R[-34]C+R[-31]C+R[-28]C+R[-25]C+R[-22]C+R[-19]C+R[-16]C+R[-13]C+R[-10]C+R[-7]C+R[-4]C -> -256602 | BH270: RISE Savings Grand Total | BI270: =SUM(RC[-55]:RC[-2]) -> -838743
E271: Total Participants | F271: =R[-268]C+R[-265]C+R[-262]C+R[-259]C+R[-256]C+R[-253]C+R[-250]C+R[-247]C+R[-244]C+R[-241]C+R[-238]C+R[-235]C+R[-232]C+R[-229]C+R[-226]C+R[-223]C+R[-220]C+R[-217]C+R[-214]C+R[-211]C+R[-208]C+R[-205]C+R[-202]C+R[-199]C+R[-196]C+R[-193]C+R[-190]C+R[-187]C+R[-184]C+R[-181]C+R[-178]C+R[-175]C+R[-172]C+R[-169]C+R[-166]C+R[-163]C+R[-160]C+R[-157]C+R[-154]C+R[-151]C+R[-148]C+R[-145]C+R[-142]C+R[-139]C+R[-136]C+R[-133]C+R[-130]C+R[-127]C+R[-124]C+R[-121]C+R[-118]C+R[-115]C+R[-112]C+R[-109]C+R[-106]C+R[-103]C+R[-100]C+R[-97]C+R[-94]C+R[-91]C+R[-88]C+R[-85]C+R[-82]C+R[-79]C+R[-76]C+R[-73]C+R[-70]C+R[-67]C+R[-64]C+R[-61]C+R[-58]C+R[-55]C+R[-52]C+R[-49]C+R[-46]C+R[-43]C+R[-40]C+R[-37]C+R[-34]C+R[-31]C+R[-28]C+R[-25]C+R[-22]C+R[-19]C+R[-16]C+R[-13]C+R[-10]C+R[-7]C -> 39 | G271: =R[-268]C+R[-265]C+R[-262]C+R[-259]C+R[-256]C+R[-253]C+R[-250]C+R[-247]C+R[-244]C+R[-241]C+R[-238]C+R[-235]C+R[-232]C+R[-229]C+R[-226]C+R[-223]C+R[-220]C+R[-217]C+R[-214]C+R[-211]C+R[-208]C+R[-205]C+R[-202]C+R[-199]C+R[-196]C+R[-193]C+R[-190]C+R[-187]C+R[-184]C+R[-181]C+R[-178]C+R[-175]C+R[-172]C+R[-169]C+R[-166]C+R[-163]C+R[-160]C+R[-157]C+R[-154]C+R[-151]C+R[-148]C+R[-145]C+R[-142]C+R[-139]C+R[-136]C+R[-133]C+R[-130]C+R[-127]C+R[-124]C+R[-121]C+R[-118]C+R[-115]C+R[-112]C+R[-109]C+R[-106]C+R[-103]C+R[-100]C+R[-97]C+R[-94]C+R[-91]C+R[-88]C+R[-85]C+R[-82]C+R[-79]C+R[-76]C+R[-73]C+R[-70]C+R[-67]C+R[-64]C+R[-61]C+R[-58]C+R[-55]C+R[-52]C+R[-49]C+R[-46]C+R[-43]C+R[-40]C+R[-37]C+R[-34]C+R[-31]C+R[-28]C+R[-25]C+R[-22]C+R[-19]C+R[-16]C+R[-13]C+R[-10]C+R[-7]C -> 8 | H271: =R[-268]C+R[-265]C+R[-262]C+R[-259]C+R[-256]C+R[-253]C+R[-250]C+R[-247]C+R[-244]C+R[-241]C+R[-238]C+R[-235]C+R[-232]C+R[-229]C+R[-226]C+R[-223]C+R[-220]C+R[-217]C+R[-214]C+R[-211]C+R[-208]C+R[-205]C+R[-202]C+R[-199]C+R[-196]C+R[-193]C+R[-190]C+R[-187]C+R[-184]C+R[-181]C+R[-178]C+R[-175]C+R[-172]C+R[-169]C+R[-166]C+R[-163]C+R[-160]C+R[-157]C+R[-154]C+R[-151]C+R[-148]C+R[-145]C+R[-142]C+R[-139]C+R[-136]C+R[-133]C+R[-130]C+R[-127]C+R[-124]C+R[-121]C+R[-118]C+R[-115]C+R[-112]C+R[-109]C+R[-106]C+R[-103]C+R[-100]C+R[-97]C+R[-94]C+R[-91]C+R[-88]C+R[-85]C+R[-82]C+R[-79]C+R[-76]C+R[-73]C+R[-70]C+R[-67]C+R[-64]C+R[-61]C+R[-58]C+R[-55]C+R[-52]C+R[-49]C+R[-46]C+R[-43]C+R[-40]C+R[-37]C+R[-34]C+R[-31]C+R[-28]C+R[-25]C+R[-22]C+R[-19]C+R[-16]C+R[-13]C+R[-10]C+R[-7]C -> 2 | I271: =R[-268]C+R[-265]C+R[-262]C+R[-259]C+R[-256]C+R[-253]C+R[-250]C+R[-247]C+R[-244]C+R[-241]C+R[-238]C+R[-235]C+R[-232]C+R[-229]C+R[-226]C+R[-223]C+R[-220]C+R[-217]C+R[-214]C+R[-211]C+R[-208]C+R[-205]C+R[-202]C+R[-199]C+R[-196]C+R[-193]C+R[-190]C+R[-187]C+R[-184]C+R[-181]C+R[-178]C+R[-175]C+R[-172]C+R[-169]C+R[-166]C+R[-163]C+R[-160]C+R[-157]C+R[-154]C+R[-151]C+R[-148]C+R[-145]C+R[-142]C+R[-139]C+R[-136]C+R[-133]C+R[-130]C+R[-127]C+R[-124]C+R[-121]C+R[-118]C+R[-115]C+R[-112]C+R[-109]C+R[-106]C+R[-103]C+R[-100]C+R[-97]C+R[-94]C+R[-91]C+R[-88]C+R[-85]C+R[-82]C+R[-79]C+R[-76]C+R[-73]C+R[-70]C+R[-67]C+R[-64]C+R[-61]C+R[-58]C+R[-55]C+R[-52]C+R[-49]C+R[-46]C+R[-43]C+R[-40]C+R[-37]C+R[-34]C+R[-31]C+R[-28]C+R[-25]C+R[-22]C+R[-19]C+R[-16]C+R[-13]C+R[-10]C+R[-7]C -> 9 | J271: =R[-268]C+R[-265]C+R[-262]C+R[-259]C+R[-256]C+R[-253]C+R[-250]C+R[-247]C+R[-244]C+R[-241]C+R[-238]C+R[-235]C+R[-232]C+R[-229]C+R[-226]C+R[-223]C+R[-220]C+R[-217]C+R[-214]C+R[-211]C+R[-208]C+R[-205]C+R[-202]C+R[-199]C+R[-196]C+R[-193]C+R[-190]C+R[-187]C+R[-184]C+R[-181]C+R[-178]C+R[-175]C+R[-172]C+R[-169]C+R[-166]C+R[-163]C+R[-160]C+R[-157]C+R[-154]C+R[-151]C+R[-148]C+R[-145]C+R[-142]C+R[-139]C+R[-136]C+R[-133]C+R[-130]C+R[-127]C+R[-124]C+R[-121]C+R[-118]C+R[-115]C+R[-112]C+R[-109]C+R[-106]C+R[-103]C+R[-100]C+R[-97]C+R[-94]C+R[-91]C+R[-88]C+R[-85]C+R[-82]C+R[-79]C+R[-76]C+R[-73]C+R[-70]C+R[-67]C+R[-64]C+R[-61]C+R[-58]C+R[-55]C+R[-52]C+R[-49]C+R[-46]C+R[-43]C+R[-40]C+R[-37]C+R[-34]C+R[-31]C+R[-28]C+R[-25]C+R[-22]C+R[-19]C+R[-16]C+R[-13]C+R[-10]C+R[-7]C -> 138 | K271: =R[-268]C+R[-265]C+R[-262]C+R[-259]C+R[-256]C+R[-253]C+R[-250]C+R[-247]C+R[-244]C+R[-241]C+R[-238]C+R[-235]C+R[-232]C+R[-229]C+R[-226]C+R[-223]C+R[-220]C+R[-217]C+R[-214]C+R[-211]C+R[-208]C+R[-205]C+R[-202]C+R[-199]C+R[-196]C+R[-193]C+R[-190]C+R[-187]C+R[-184]C+R[-181]C+R[-178]C+R[-175]C+R[-172]C+R[-169]C+R[-166]C+R[-163]C+R[-160]C+R[-157]C+R[-154]C+R[-151]C+R[-148]C+R[-145]C+R[-142]C+R[-139]C+R[-136]C+R[-133]C+R[-130]C+R[-127]C+R[-124]C+R[-121]C+R[-118]C+R[-115]C+R[-112]C+R[-109]C+R[-106]C+R[-103]C+R[-100]C+R[-97]C+R[-94]C+R[-91]C+R[-88]C+R[-85]C+R[-82]C+R[-79]C+R[-76]C+R[-73]C+R[-70]C+R[-67]C+R[-64]C+R[-61]C+R[-58]C+R[-55]C+R[-52]C+R[-49]C+R[-46]C+R[-43]C+R[-40]C+R[-37]C+R[-34]C+R[-31]C+R[-28]C+R[-25]C+R[-22]C+R[-19]C+R[-16]C+R[-13]C+R[-10]C+R[-7]C -> 101 | L271: =R[-268]C+R[-265]C+R[-262]C+R[-259]C+R[-256]C+R[-253]C+R[-250]C+R[-247]C+R[-244]C+R[-241]C+R[-238]C+R[-235]C+R[-232]C+R[-229]C+R[-226]C+R[-223]C+R[-220]C+R[-217]C+R[-214]C+R[-211]C+R[-208]C+R[-205]C+R[-202]C+R[-199]C+R[-196]C+R[-193]C+R[-190]C+R[-187]C+R[-184]C+R[-181]C+R[-178]C+R[-175]C+R[-172]C+R[-169]C+R[-166]C+R[-163]C+R[-160]C+R[-157]C+R[-154]C+R[-151]C+R[-148]C+R[-145]C+R[-142]C+R[-139]C+R[-136]C+R[-133]C+R[-130]C+R[-127]C+R[-124]C+R[-121]C+R[-118]C+R[-115]C+R[-112]C+R[-109]C+R[-106]C+R[-103]C+R[-100]C+R[-97]C+R[-94]C+R[-91]C+R[-88]C+R[-85]C+R[-82]C+R[-79]C+R[-76]C+R[-73]C+R[-70]C+R[-67]C+R[-64]C+R[-61]C+R[-58]C+R[-55]C+R[-52]C+R[-49]C+R[-46]C+R[-43]C+R[-40]C+R[-37]C+R[-34]C+R[-31]C+R[-28]C+R[-25]C+R[-22]C+R[-19]C+R[-16]C+R[-13]C+R[-10]C+R[-7]C -> 22 | M271: =R[-268]C+R[-265]C+R[-262]C+R[-259]C+R[-256]C+R[-253]C+R[-250]C+R[-247]C+R[-244]C+R[-241]C+R[-238]C+R[-235]C+R[-232]C+R[-229]C+R[-226]C+R[-223]C+R[-220]C+R[-217]C+R[-214]C+R[-211]C+R[-208]C+R[-205]C+R[-202]C+R[-199]C+R[-196]C+R[-193]C+R[-190]C+R[-187]C+R[-184]C+R[-181]C+R[-178]C+R[-175]C+R[-172]C+R[-169]C+R[-166]C+R[-163]C+R[-160]C+R[-157]C+R[-154]C+R[-151]C+R[-148]C+R[-145]C+R[-142]C+R[-139]C+R[-136]C+R[-133]C+R[-130]C+R[-127]C+R[-124]C+R[-121]C+R[-118]C+R[-115]C+R[-112]C+R[-109]C+R[-106]C+R[-103]C+R[-100]C+R[-97]C+R[-94]C+R[-91]C+R[-88]C+R[-85]C+R[-82]C+R[-79]C+R[-76]C+R[-73]C+R[-70]C+R[-67]C+R[-64]C+R[-61]C+R[-58]C+R[-55]C+R[-52]C+R[-49]C+R[-46]C+R[-43]C+R[-40]C+R[-37]C+R[-34]C+R[-31]C+R[-28]C+R[-25]C+R[-22]C+R[-19]C+R[-16]C+R[-13]C+R[-10]C+R[-7]C -> 19 | N271: =R[-268]C+R[-265]C+R[-262]C+R[-259]C+R[-256]C+R[-253]C+R[-250]C+R[-247]C+R[-244]C+R[-241]C+R[-238]C+R[-235]C+R[-232]C+R[-229]C+R[-226]C+R[-223]C+R[-220]C+R[-217]C+R[-214]C+R[-211]C+R[-208]C+R[-205]C+R[-202]C+R[-199]C+R[-196]C+R[-193]C+R[-190]C+R[-187]C+R[-184]C+R[-181]C+R[-178]C+R[-175]C+R[-172]C+R[-169]C+R[-166]C+R[-163]C+R[-160]C+R[-157]C+R[-154]C+R[-151]C+R[-148]C+R[-145]C+R[-142]C+R[-139]C+R[-136]C+R[-133]C+R[-130]C+R[-127]C+R[-124]C+R[-121]C+R[-118]C+R[-115]C+R[-112]C+R[-109]C+R[-106]C+R[-103]C+R[-100]C+R[-97]C+R[-94]C+R[-91]C+R[-88]C+R[-85]C+R[-82]C+R[-79]C+R[-76]C+R[-73]C+R[-70]C+R[-67]C+R[-64]C+R[-61]C+R[-58]C+R[-55]C+R[-52]C+R[-49]C+R[-46]C+R[-43]C+R[-40]C+R[-37]C+R[-34]C+R[-31]C+R[-28]C+R[-25]C+R[-22]C+R[-19]C+R[-16]C+R[-13]C+R[-10]C+R[-7]C -> 1 | O271: =R[-268]C+R[-265]C+R[-262]C+R[-259]C+R[-256]C+R[-253]C+R[-250]C+R[-247]C+R[-244]C+R[-241]C+R[-238]C+R[-235]C+R[-232]C+R[-229]C+R[-226]C+R[-223]C+R[-220]C+R[-217]C+R[-214]C+R[-211]C+R[-208]C+R[-205]C+R[-202]C+R[-199]C+R[-196]C+R[-193]C+R[-190]C+R[-187]C+R[-184]C+R[-181]C+R[-178]C+R[-175]C+R[-172]C+R[-169]C+R[-166]C+R[-163]C+R[-160]C+R[-157]C+R[-154]C+R[-151]C+R[-148]C+R[-145]C+R[-142]C+R[-139]C+R[-136]C+R[-133]C+R[-130]C+R[-127]C+R[-124]C+R[-121]C+R[-118]C+R[-115]C+R[-112]C+R[-109]C+R[-106]C+R[-103]C+R[-100]C+R[-97]C+R[-94]C+R[-91]C+R[-88]C+R[-85]C+R[-82]C+R[-79]C+R[-76]C+R[-73]C+R[-70]C+R[-67]C+R[-64]C+R[-61]C+R[-58]C+R[-55]C+R[-52]C+R[-49]C+R[-46]C+R[-43]C+R[-40]C+R[-37]C+R[-34]C+R[-31]C+R[-28]C+R[-25]C+R[-22]C+R[-19]C+R[-16]C+R[-13]C+R[-10]C+R[-7]C -> 2 | P271: =R[-268]C+R[-265]C+R[-262]C+R[-259]C+R[-256]C+R[-253]C+R[-250]C+R[-247]C+R[-244]C+R[-241]C+R[-238]C+R[-235]C+R[-232]C+R[-229]C+R[-226]C+R[-223]C+R[-220]C+R[-217]C+R[-214]C+R[-211]C+R[-208]C+R[-205]C+R[-202]C+R[-199]C+R[-196]C+R[-193]C+R[-190]C+R[-187]C+R[-184]C+R[-181]C+R[-178]C+R[-175]C+R[-172]C+R[-169]C+R[-166]C+R[-163]C+R[-160]C+R[-157]C+R[-154]C+R[-151]C+R[-148]C+R[-145]C+R[-142]C+R[-139]C+R[-136]C+R[-133]C+R[-130]C+R[-127]C+R[-124]C+R[-121]C+R[-118]C+R[-115]C+R[-112]C+R[-109]C+R[-106]C+R[-103]C+R[-100]C+R[-97]C+R[-94]C+R[-91]C+R[-88]C+R[-85]C+R[-82]C+R[-79]C+R[-76]C+R[-73]C+R[-70]C+R[-67]C+R[-64]C+R[-61]C+R[-58]C+R[-55]C+R[-52]C+R[-49]C+R[-46]C+R[-43]C+R[-40]C+R[-37]C+R[-34]C+R[-31]C+R[-28]C+R[-25]C+R[-22]C+R[-19]C+R[-16]C+R[-13]C+R[-10]C+R[-7]C -> 1 | Q271: =R[-268]C+R[-265]C+R[-262]C+R[-259]C+R[-256]C+R[-253]C+R[-250]C+R[-247]C+R[-244]C+R[-241]C+R[-238]C+R[-235]C+R[-232]C+R[-229]C+R[-226]C+R[-223]C+R[-220]C+R[-217]C+R[-214]C+R[-211]C+R[-208]C+R[-205]C+R[-202]C+R[-199]C+R[-196]C+R[-193]C+R[-190]C+R[-187]C+R[-184]C+R[-181]C+R[-178]C+R[-175]C+R[-172]C+R[-169]C+R[-166]C+R[-163]C+R[-160]C+R[-157]C+R[-154]C+R[-151]C+R[-148]C+R[-145]C+R[-142]C+R[-139]C+R[-136]C+R[-133]C+R[-130]C+R[-127]C+R[-124]C+R[-121]C+R[-118]C+R[-115]C+R[-112]C+R[-109]C+R[-106]C+R[-103]C+R[-100]C+R[-97]C+R[-94]C+R[-91]C+R[-88]C+R[-85]C+R[-82]C+R[-79]C+R[-76]C+R[-73]C+R[-70]C+R[-67]C+R[-64]C+R[-61]C+R[-58]C+R[-55]C+R[-52]C+R[-49]C+R[-46]C+R[-43]C+R[-40]C+R[-37]C+R[-34]C+R[-31]C+R[-28]C+R[-25]C+R[-22]C+R[-19]C+R[-16]C+R[-13]C+R[-10]C+R[-7]C -> 3 | R271: =R[-268]C+R[-265]C+R[-262]C+R[-259]C+R[-256]C+R[-253]C+R[-250]C+R[-247]C+R[-244]C+R[-241]C+R[-238]C+R[-235]C+R[-232]C+R[-229]C+R[-226]C+R[-223]C+R[-220]C+R[-217]C+R[-214]C+R[-211]C+R[-208]C+R[-205]C+R[-202]C+R[-199]C+R[-196]C+R[-193]C+R[-190]C+R[-187]C+R[-184]C+R[-181]C+R[-178]C+R[-175]C+R[-172]C+R[-169]C+R[-166]C+R[-163]C+R[-160]C+R[-157]C+R[-154]C+R[-151]C+R[-148]C+R[-145]C+R[-142]C+R[-139]C+R[-136]C+R[-133]C+R[-130]C+R[-127]C+R[-124]C+R[-121]C+R[-118]C+R[-115]C+R[-112]C+R[-109]C+R[-106]C+R[-103]C+R[-100]C+R[-97]C+R[-94]C+R[-91]C+R[-88]C+R[-85]C+R[-82]C+R[-79]C+R[-76]C+R[-73]C+R[-70]C+R[-67]C+R[-64]C+R[-61]C+R[-58]C+R[-55]C+R[-52]C+R[-49]C+R[-46]C+R[-43]C+R[-40]C+R[-37]C+R[-34]C+R[-31]C+R[-28]C+R[-25]C+R[-22]C+R[-19]C+R[-16]C+R[-13]C+R[-10]C+R[-7]C -> 2 | S271: =R[-268]C+R[-265]C+R[-262]C+R[-259]C+R[-256]C+R[-253]C+R[-250]C+R[-247]C+R[-244]C+R[-241]C+R[-238]C+R[-235]C+R[-232]C+R[-229]C+R[-226]C+R[-223]C+R[-220]C+R[-217]C+R[-214]C+R[-211]C+R[-208]C+R[-205]C+R[-202]C+R[-199]C+R[-196]C+R[-193]C+R[-190]C+R[-187]C+R[-184]C+R[-181]C+R[-178]C+R[-175]C+R[-172]C+R[-169]C+R[-166]C+R[-163]C+R[-160]C+R[-157]C+R[-154]C+R[-151]C+R[-148]C+R[-145]C+R[-142]C+R[-139]C+R[-136]C+R[-133]C+R[-130]C+R[-127]C+R[-124]C+R[-121]C+R[-118]C+R[-115]C+R[-112]C+R[-109]C+R[-106]C+R[-103]C+R[-100]C+R[-97]C+R[-94]C+R[-91]C+R[-88]C+R[-85]C+R[-82]C+R[-79]C+R[-76]C+R[-73]C+R[-70]C+R[-67]C+R[-64]C+R[-61]C+R[-58]C+R[-55]C+R[-52]C+R[-49]C+R[-46]C+R[-43]C+R[-40]C+R[-37]C+R[-34]C+R[-31]C+R[-28]C+R[-25]C+R[-22]C+R[-19]C+R[-16]C+R[-13]C+R[-10]C+R[-7]C -> 1 | T271: =R[-268]C+R[-265]C+R[-262]C+R[-259]C+R[-256]C+R[-253]C+R[-250]C+R[-247]C+R[-244]C+R[-241]C+R[-238]C+R[-235]C+R[-232]C+R[-229]C+R[-226]C+R[-223]C+R[-220]C+R[-217]C+R[-214]C+R[-211]C+R[-208]C+R[-205]C+R[-202]C+R[-199]C+R[-196]C+R[-193]C+R[-190]C+R[-187]C+R[-184]C+R[-181]C+R[-178]C+R[-175]C+R[-172]C+R[-169]C+R[-166]C+R[-163]C+R[-160]C+R[-157]C+R[-154]C+R[-151]C+R[-148]C+R[-145]C+R[-142]C+R[-139]C+R[-136]C+R[-133]C+R[-130]C+R[-127]C+R[-124]C+R[-121]C+R[-118]C+R[-115]C+R[-112]C+R[-109]C+R[-106]C+R[-103]C+R[-100]C+R[-97]C+R[-94]C+R[-91]C+R[-88]C+R[-85]C+R[-82]C+R[-79]C+R[-76]C+R[-73]C+R[-70]C+R[-67]C+R[-64]C+R[-61]C+R[-58]C+R[-55]C+R[-52]C+R[-49]C+R[-46]C+R[-43]C+R[-40]C+R[-37]C+R[-34]C+R[-31]C+R[-28]C+R[-25]C+R[-22]C+R[-19]C+R[-16]C+R[-13]C+R[-10]C+R[-7]C -> 1 | U271: =R[-268]C+R[-265]C+R[-262]C+R[-259]C+R[-256]C+R[-253]C+R[-250]C+R[-247]C+R[-244]C+R[-241]C+R[-238]C+R[-235]C+R[-232]C+R[-229]C+R[-226]C+R[-223]C+R[-220]C+R[-217]C+R[-214]C+R[-211]C+R[-208]C+R[-205]C+R[-202]C+R[-199]C+R[-196]C+R[-193]C+R[-190]C+R[-187]C+R[-184]C+R[-181]C+R[-178]C+R[-175]C+R[-172]C+R[-169]C+R[-166]C+R[-163]C+R[-160]C+R[-157]C+R[-154]C+R[-151]C+R[-148]C+R[-145]C+R[-142]C+R[-139]C+R[-136]C+R[-133]C+R[-130]C+R[-127]C+R[-124]C+R[-121]C+R[-118]C+R[-115]C+R[-112]C+R[-109]C+R[-106]C+R[-103]C+R[-100]C+R[-97]C+R[-94]C+R[-91]C+R[-88]C+R[-85]C+R[-82]C+R[-79]C+R[-76]C+R[-73]C+R[-70]C+R[-67]C+R[-64]C+R[-61]C+R[-58]C+R[-55]C+R[-52]C+R[-49]C+R[-46]C+R[-43]C+R[-40]C+R[-37]C+R[-34]C+R[-31]C+R[-28]C+R[-25]C+R[-22]C+R[-19]C+R[-16]C+R[-13]C+R[-10]C+R[-7]C -> 1 | V271: =R[-268]C+R[-265]C+R[-262]C+R[-259]C+R[-256]C+R[-253]C+R[-250]C+R[-247]C+R[-244]C+R[-241]C+R[-238]C+R[-235]C+R[-232]C+R[-229]C+R[-226]C+R[-223]C+R[-220]C+R[-217]C+R[-214]C+R[-211]C+R[-208]C+R[-205]C+R[-202]C+R[-199]C+R[-196]C+R[-193]C+R[-190]C+R[-187]C+R[-184]C+R[-181]C+R[-178]C+R[-175]C+R[-172]C+R[-169]C+R[-166]C+R[-163]C+R[-160]C+R[-157]C+R[-154]C+R[-151]C+R[-148]C+R[-145]C+R[-142]C+R[-139]C+R[-136]C+R[-133]C+R[-130]C+R[-127]C+R[-124]C+R[-121]C+R[-118]C+R[-115]C+R[-112]C+R[-109]C+R[-106]C+R[-103]C+R[-100]C+R[-97]C+R[-94]C+R[-91]C+R[-88]C+R[-85]C+R[-82]C+R[-79]C+R[-76]C+R[-73]C+R[-70]C+R[-67]C+R[-64]C+R[-61]C+R[-58]C+R[-55]C+R[-52]C+R[-49]C+R[-46]C+R[-43]C+R[-40]C+R[-37]C+R[-34]C+R[-31]C+R[-28]C+R[-25]C+R[-22]C+R[-19]C+R[-16]C+R[-13]C+R[-10]C+R[-7]C -> 2 | W271: =R[-268]C+R[-265]C+R[-262]C+R[-259]C+R[-256]C+R[-253]C+R[-250]C+R[-247]C+R[-244]C+R[-241]C+R[-238]C+R[-235]C+R[-232]C+R[-229]C+R[-226]C+R[-223]C+R[-220]C+R[-217]C+R[-214]C+R[-211]C+R[-208]C+R[-205]C+R[-202]C+R[-199]C+R[-196]C+R[-193]C+R[-190]C+R[-187]C+R[-184]C+R[-181]C+R[-178]C+R[-175]C+R[-172]C+R[-169]C+R[-166]C+R[-163]C+R[-160]C+R[-157]C+R[-154]C+R[-151]C+R[-148]C+R[-145]C+R[-142]C+R[-139]C+R[-136]C+R[-133]C+R[-130]C+R[-127]C+R[-124]C+R[-121]C+R[-118]C+R[-115]C+R[-112]C+R[-109]C+R[-106]C+R[-103]C+R[-100]C+R[-97]C+R[-94]C+R[-91]C+R[-88]C+R[-85]C+R[-82]C+R[-79]C+R[-76]C+R[-73]C+R[-70]C+R[-67]C+R[-64]C+R[-61]C+R[-58]C+R[-55]C+R[-52]C+R[-49]C+R[-46]C+R[-43]C+R[-40]C+R[-37]C+R[-34]C+R[-31]C+R[-28]C+R[-25]C+R[-22]C+R[-19]C+R[-16]C+R[-13]C+R[-10]C+R[-7]C -> 41 | X271: =R[-268]C+R[-265]C+R[-262]C+R[-259]C+R[-256]C+R[-253]C+R[-250]C+R[-247]C+R[-244]C+R[-241]C+R[-238]C+R[-235]C+R[-232]C+R[-229]C+R[-226]C+R[-223]C+R[-220]C+R[-217]C+R[-214]C+R[-211]C+R[-208]C+R[-205]C+R[-202]C+R[-199]C+R[-196]C+R[-193]C+R[-190]C+R[-187]C+R[-184]C+R[-181]C+R[-178]C+R[-175]C+R[-172]C+R[-169]C+R[-166]C+R[-163]C+R[-160]C+R[-157]C+R[-154]C+R[-151]C+R[-148]C+R[-145]C+R[-142]C+R[-139]C+R[-136]C+R[-133]C+R[-130]C+R[-127]C+R[-124]C+R[-121]C+R[-118]C+R[-115]C+R[-112]C+R[-109]C+R[-106]C+R[-103]C+R[-100]C+R[-97]C+R[-94]C+R[-91]C+R[-88]C+R[-85]C+R[-82]C+R[-79]C+R[-76]C+R[-73]C+R[-70]C+R[-67]C+R[-64]C+R[-61]C+R[-58]C+R[-55]C+R[-52]C+R[-49]C+R[-46]C+R[-43]C+R[-40]C+R[-37]C+R[-34]C+R[-31]C+R[-28]C+R[-25]C+R[-22]C+R[-19]C+R[-16]C+R[-13]C+R[-10]C+R[-7]C -> 29 | Y271: =R[-268]C+R[-265]C+R[-262]C+R[-259]C+R[-256]C+R[-253]C+R[-250]C+R[-247]C+R[-244]C+R[-241]C+R[-238]C+R[-235]C+R[-232]C+R[-229]C+R[-226]C+R[-223]C+R[-220]C+R[-217]C+R[-214]C+R[-211]C+R[-208]C+R[-205]C+R[-202]C+R[-199]C+R[-196]C+R[-193]C+R[-190]C+R[-187]C+R[-184]C+R[-181]C+R[-178]C+R[-175]C+R[-172]C+R[-169]C+R[-166]C+R[-163]C+R[-160]C+R[-157]C+R[-154]C+R[-151]C+R[-148]C+R[-145]C+R[-142]C+R[-139]C+R[-136]C+R[-133]C+R[-130]C+R[-127]C+R[-124]C+R[-121]C+R[-118]C+R[-115]C+R[-112]C+R[-109]C+R[-106]C+R[-103]C+R[-100]C+R[-97]C+R[-94]C+R[-91]C+R[-88]C+R[-85]C+R[-82]C+R[-79]C+R[-76]C+R[-73]C+R[-70]C+R[-67]C+R[-64]C+R[-61]C+R[-58]C+R[-55]C+R[-52]C+R[-49]C+R[-46]C+R[-43]C+R[-40]C+R[-37]C+R[-34]C+R[-31]C+R[-28]C+R[-25]C+R[-22]C+R[-19]C+R[-16]C+R[-13]C+R[-10]C+R[-7]C -> 50 | Z271: =R[-268]C+R[-265]C+R[-262]C+R[-259]C+R[-256]C+R[-253]C+R[-250]C+R[-247]C+R[-244]C+R[-241]C+R[-238]C+R[-235]C+R[-232]C+R[-229]C+R[-226]C+R[-223]C+R[-220]C+R[-217]C+R[-214]C+R[-211]C+R[-208]C+R[-205]C+R[-202]C+R[-199]C+R[-196]C+R[-193]C+R[-190]C+R[-187]C+R[-184]C+R[-181]C+R[-178]C+R[-175]C+R[-172]C+R[-169]C+R[-166]C+R[-163]C+R[-160]C+R[-157]C+R[-154]C+R[-151]C+R[-148]C+R[-145]C+R[-142]C+R[-139]C+R[-136]C+R[-133]C+R[-130]C+R[-127]C+R[-124]C+R[-121]C+R[-118]C+R[-115]C+R[-112]C+R[-109]C+R[-106]C+R[-103]C+R[-100]C+R[-97]C+R[-94]C+R[-91]C+R[-88]C+R[-85]C+R[-82]C+R[-79]C+R[-76]C+R[-73]C+R[-70]C+R[-67]C+R[-64]C+R[-61]C+R[-58]C+R[-55]C+R[-52]C+R[-49]C+R[-46]C+R[-43]C+R[-40]C+R[-37]C+R[-34]C+R[-31]C+R[-28]C+R[-25]C+R[-22]C+R[-19]C+R[-16]C+R[-13]C+R[-10]C+R[-7]C -> 6 | AA271: =R[-268]C+R[-265]C+R[-262]C+R[-259]C+R[-256]C+R[-253]C+R[-250]C+R[-247]C+R[-244]C+R[-241]C+R[-238]C+R[-235]C+R[-232]C+R[-229]C+R[-226]C+R[-223]C+R[-220]C+R[-217]C+R[-214]C+R[-211]C+R[-208]C+R[-205]C+R[-202]C+R[-199]C+R[-196]C+R[-193]C+R[-190]C+R[-187]C+R[-184]C+R[-181]C+R[-178]C+R[-175]C+R[-172]C+R[-169]C+R[-166]C+R[-163]C+R[-160]C+R[-157]C+R[-154]C+R[-151]C+R[-148]C+R[-145]C+R[-142]C+R[-139]C+R[-136]C+R[-133]C+R[-130]C+R[-127]C+R[-124]C+R[-121]C+R[-118]C+R[-115]C+R[-112]C+R[-109]C+R[-106]C+R[-103]C+R[-100]C+R[-97]C+R[-94]C+R[-91]C+R[-88]C+R[-85]C+R[-82]C+R[-79]C+R[-76]C+R[-73]C+R[-70]C+R[-67]C+R[-64]C+R[-61]C+R[-58]C+R[-55]C+R[-52]C+R[-49]C+R[-46]C+R[-43]C+R[-40]C+R[-37]C+R[-34]C+R[-31]C+R[-28]C+R[-25]C+R[-22]C+R[-19]C+R[-16]C+R[-13]C+R[-10]C+R[-7]C -> 3 | AB271: =R[-268]C+R[-265]C+R[-262]C+R[-259]C+R[-256]C+R[-253]C+R[-250]C+R[-247]C+R[-244]C+R[-241]C+R[-238]C+R[-235]C+R[-232]C+R[-229]C+R[-226]C+R[-223]C+R[-220]C+R[-217]C+R[-214]C+R[-211]C+R[-208]C+R[-205]C+R[-202]C+R[-199]C+R[-196]C+R[-193]C+R[-190]C+R[-187]C+R[-184]C+R[-181]C+R[-178]C+R[-175]C+R[-172]C+R[-169]C+R[-166]C+R[-163]C+R[-160]C+R[-157]C+R[-154]C+R[-151]C+R[-148]C+R[-145]C+R[-142]C+R[-139]C+R[-136]C+R[-133]C+R[-130]C+R[-127]C+R[-124]C+R[-121]C+R[-118]C+R[-115]C+R[-112]C+R[-109]C+R[-106]C+R[-103]C+R[-100]C+R[-97]C+R[-94]C+R[-91]C+R[-88]C+R[-85]C+R[-82]C+R[-79]C+R[-76]C+R[-73]C+R[-70]C+R[-67]C+R[-64]C+R[-61]C+R[-58]C+R[-55]C+R[-52]C+R[-49]C+R[-46]C+R[-43]C+R[-40]C+R[-37]C+R[-34]C+R[-31]C+R[-28]C+R[-25]C+R[-22]C+R[-19]C+R[-16]C+R[-13]C+R[-10]C+R[-7]C -> 3 | AC271: =R[-268]C+R[-265]C+R[-262]C+R[-259]C+R[-256]C+R[-253]C+R[-250]C+R[-247]C+R[-244]C+R[-241]C+R[-238]C+R[-235]C+R[-232]C+R[-229]C+R[-226]C+R[-223]C+R[-220]C+R[-217]C+R[-214]C+R[-211]C+R[-208]C+R[-205]C+R[-202]C+R[-199]C+R[-196]C+R[-193]C+R[-190]C+R[-187]C+R[-184]C+R[-181]C+R[-178]C+R[-175]C+R[-172]C+R[-169]C+R[-166]C+R[-163]C+R[-160]C+R[-157]C+R[-154]C+R[-151]C+R[-148]C+R[-145]C+R[-142]C+R[-139]C+R[-136]C+R[-133]C+R[-130]C+R[-127]C+R[-124]C+R[-121]C+R[-118]C+R[-115]C+R[-112]C+R[-109]C+R[-106]C+R[-103]C+R[-100]C+R[-97]C+R[-94]C+R[-91]C+R[-88]C+R[-85]C+R[-82]C+R[-79]C+R[-76]C+R[-73]C+R[-70]C+R[-67]C+R[-64]C+R[-61]C+R[-58]C+R[-55]C+R[-52]C+R[-49]C+R[-46]C+R[-43]C+R[-40]C+R[-37]C+R[-34]C+R[-31]C+R[-28]C+R[-25]C+R[-22]C+R[-19]C+R[-16]C+R[-13]C+R[-10]C+R[-7]C -> 1 | AD271: =R[-268]C+R[-265]C+R[-262]C+R[-259]C+R[-256]C+R[-253]C+R[-250]C+R[-247]C+R[-244]C+R[-241]C+R[-238]C+R[-235]C+R[-232]C+R[-229]C+R[-226]C+R[-223]C+R[-220]C+R[-217]C+R[-214]C+R[-211]C+R[-208]C+R[-205]C+R[-202]C+R[-199]C+R[-196]C+R[-193]C+R[-190]C+R[-187]C+R[-184]C+R[-181]C+R[-178]C+R[-175]C+R[-172]C+R[-169]C+R[-166]C+R[-163]C+R[-160]C+R[-157]C+R[-154]C+R[-151]C+R[-148]C+R[-145]C+R[-142]C+R[-139]C+R[-136]C+R[-133]C+R[-130]C+R[-127]C+R[-124]C+R[-121]C+R[-118]C+R[-115]C+R[-112]C+R[-109]C+R[-106]C+R[-103]C+R[-100]C+R[-97]C+R[-94]C+R[-91]C+R[-88]C+R[-85]C+R[-82]C+R[-79]C+R[-76]C+R[-73]C+R[-70]C+R[-67]C+R[-64]C+R[-61]C+R[-58]C+R[-55]C+R[-52]C+R[-49]C+R[-46]C+R[-43]C+R[-40]C+R[-37]C+R[-34]C+R[-31]C+R[-28]C+R[-25]C+R[-22]C+R[-19]C+R[-16]C+R[-13]C+R[-10]C+R[-7]C -> 67 | AE271: =R[-268]C+R[-265]C+R[-262]C+R[-259]C+R[-256]C+R[-253]C+R[-250]C+R[-247]C+R[-244]C+R[-241]C+R[-238]C+R[-235]C+R[-232]C+R[-229]C+R[-226]C+R[-223]C+R[-220]C+R[-217]C+R[-214]C+R[-211]C+R[-208]C+R[-205]C+R[-202]C+R[-199]C+R[-196]C+R[-193]C+R[-190]C+R[-187]C+R[-184]C+R[-181]C+R[-178]C+R[-175]C+R[-172]C+R[-169]C+R[-166]C+R[-163]C+R[-160]C+R[-157]C+R[-154]C+R[-151]C+R[-148]C+R[-145]C+R[-142]C+R[-139]C+R[-136]C+R[-133]C+R[-130]C+R[-127]C+R[-124]C+R[-121]C+R[-118]C+R[-115]C+R[-112]C+R[-109]C+R[-106]C+R[-103]C+R[-100]C+R[-97]C+R[-94]C+R[-91]C+R[-88]C+R[-85]C+R[-82]C+R[-79]C+R[-76]C+R[-73]C+R[-70]C+R[-67]C+R[-64]C+R[-61]C+R[-58]C+R[-55]C+R[-52]C+R[-49]C+R[-46]C+R[-43]C+R[-40]C+R[-37]C+R[-34]C+R[-31]C+R[-28]C+R[-25]C+R[-22]C+R[-19]C+R[-16]C+R[-13]C+R[-10]C+R[-7]C -> 11 | AF271: =R[-268]C+R[-265]C+R[-262]C+R[-259]C+R[-256]C+R[-253]C+R[-250]C+R[-247]C+R[-244]C+R[-241]C+R[-238]C+R[-235]C+R[-232]C+R[-229]C+R[-226]C+R[-223]C+R[-220]C+R[-217]C+R[-214]C+R[-211]C+R[-208]C+R[-205]C+R[-202]C+R[-199]C+R[-196]C+R[-193]C+R[-190]C+R[-187]C+R[-184]C+R[-181]C+R[-178]C+R[-175]C+R[-172]C+R[-169]C+R[-166]C+R[-163]C+R[-160]C+R[-157]C+R[-154]C+R[-151]C+R[-148]C+R[-145]C+R[-142]C+R[-139]C+R[-136]C+R[-133]C+R[-130]C+R[-127]C+R[-124]C+R[-121]C+R[-118]C+R[-115]C+R[-112]C+R[-109]C+R[-106]C+R[-103]C+R[-100]C+R[-97]C+R[-94]C+R[-91]C+R[-88]C+R[-85]C+R[-82]C+R[-79]C+R[-76]C+R[-73]C+R[-70]C+R[-67]C+R[-64]C+R[-61]C+R[-58]C+R[-55]C+R[-52]C+R[-49]C+R[-46]C+R[-43]C+R[-40]C+R[-37]C+R[-34]C+R[-31]C+R[-28]C+R[-25]C+R[-22]C+R[-19]C+R[-16]C+R[-13]C+R[-10]C+R[-7]C -> 19 | AG271: =R[-268]C+R[-265]C+R[-262]C+R[-259]C+R[-256]C+R[-253]C+R[-250]C+R[-247]C+R[-244]C+R[-241]C+R[-238]C+R[-235]C+R[-232]C+R[-229]C+R[-226]C+R[-223]C+R[-220]C+R[-217]C+R[-214]C+R[-211]C+R[-208]C+R[-205]C+R[-202]C+R[-199]C+R[-196]C+R[-193]C+R[-190]C+R[-187]C+R[-184]C+R[-181]C+R[-178]C+R[-175]C+R[-172]C+R[-169]C+R[-166]C+R[-163]C+R[-160]C+R[-157]C+R[-154]C+R[-151]C+R[-148]C+R[-145]C+R[-142]C+R[-139]C+R[-136]C+R[-133]C+R[-130]C+R[-127]C+R[-124]C+R[-121]C+R[-118]C+R[-115]C+R[-112]C+R[-109]C+R[-106]C+R[-103]C+R[-100]C+R[-97]C+R[-94]C+R[-91]C+R[-88]C+R[-85]C+R[-82]C+R[-79]C+R[-76]C+R[-73]C+R[-70]C+R[-67]C+R[-64]C+R[-61]C+R[-58]C+R[-55]C+R[-52]C+R[-49]C+R[-46]C+R[-43]C+R[-40]C+R[-37]C+R[-34]C+R[-31]C+R[-28]C+R[-25]C+R[-22]C+R[-19]C+R[-16]C+R[-13]C+R[-10]C+R[-7]C -> 6 | AH271: =R[-268]C+R[-265]C+R[-262]C+R[-259]C+R[-256]C+R[-253]C+R[-250]C+R[-247]C+R[-244]C+R[-241]C+R[-238]C+R[-235]C+R[-232]C+R[-229]C+R[-226]C+R[-223]C+R[-220]C+R[-217]C+R[-214]C+R[-211]C+R[-208]C+R[-205]C+R[-202]C+R[-199]C+R[-196]C+R[-193]C+R[-190]C+R[-187]C+R[-184]C+R[-181]C+R[-178]C+R[-175]C+R[-172]C+R[-169]C+R[-166]C+R[-163]C+R[-160]C+R[-157]C+R[-154]C+R[-151]C+R[-148]C+R[-145]C+R[-142]C+R[-139]C+R[-136]C+R[-133]C+R[-130]C+R[-127]C+R[-124]C+R[-121]C+R[-118]C+R[-115]C+R[-112]C+R[-109]C+R[-106]C+R[-103]C+R[-100]C+R[-97]C+R[-94]C+R[-91]C+R[-88]C+R[-85]C+R[-82]C+R[-79]C+R[-76]C+R[-73]C+R[-70]C+R[-67]C+R[-64]C+R[-61]C+R[-58]C+R[-55]C+R[-52]C+R[-49]C+R[-46]C+R[-43]C+R[-40]C+R[-37]C+R[-34]C+R[-31]C+R[-28]C+R[-25]C+R[-22]C+R[-19]C+R[-16]C+R[-13]C+R[-10]C+R[-7]C -> 3 | AI271: =R[-268]C+R[-265]C+R[-262]C+R[-259]C+R[-256]C+R[-253]C+R[-250]C+R[-247]C+R[-244]C+R[-241]C+R[-238]C+R[-235]C+R[-232]C+R[-229]C+R[-226]C+R[-223]C+R[-220]C+R[-217]C+R[-214]C+R[-211]C+R[-208]C+R[-205]C+R[-202]C+R[-199]C+R[-196]C+R[-193]C+R[-190]C+R[-187]C+R[-184]C+R[-181]C+R[-178]C+R[-175]C+R[-172]C+R[-169]C+R[-166]C+R[-163]C+R[-160]C+R[-157]C+R[-154]C+R[-151]C+R[-148]C+R[-145]C+R[-142]C+R[-139]C+R[-136]C+R[-133]C+R[-130]C+R[-127]C+R[-124]C+R[-121]C+R[-118]C+R[-115]C+R[-112]C+R[-109]C+R[-106]C+R[-103]C+R[-100]C+R[-97]C+R[-94]C+R[-91]C+R[-88]C+R[-85]C+R[-82]C+R[-79]C+R[-76]C+R[-73]C+R[-70]C+R[-67]C+R[-64]C+R[-61]C+R[-58]C+R[-55]C+R[-52]C+R[-49]C+R[-46]C+R[-43]C+R[-40]C+R[-37]C+R[-34]C+R[-31]C+R[-28]C+R[-25]C+R[-22]C+R[-19]C+R[-16]C+R[-13]C+R[-10]C+R[-7]C -> 6 | AJ271: =R[-268]C+R[-265]C+R[-262]C+R[-259]C+R[-256]C+R[-253]C+R[-250]C+R[-247]C+R[-244]C+R[-241]C+R[-238]C+R[-235]C+R[-232]C+R[-229]C+R[-226]C+R[-223]C+R[-220]C+R[-217]C+R[-214]C+R[-211]C+R[-208]C+R[-205]C+R[-202]C+R[-199]C+R[-196]C+R[-193]C+R[-190]C+R[-187]C+R[-184]C+R[-181]C+R[-178]C+R[-175]C+R[-172]C+R[-169]C+R[-166]C+R[-163]C+R[-160]C+R[-157]C+R[-154]C+R[-151]C+R[-148]C+R[-145]C+R[-142]C+R[-139]C+R[-136]C+R[-133]C+R[-130]C+R[-127]C+R[-124]C+R[-121]C+R[-118]C+R[-115]C+R[-112]C+R[-109]C+R[-106]C+R[-103]C+R[-100]C+R[-97]C+R[-94]C+R[-91]C+R[-88]C+R[-85]C+R[-82]C+R[-79]C+R[-76]C+R[-73]C+R[-70]C+R[-67]C+R[-64]C+R[-61]C+R[-58]C+R[-55]C+R[-52]C+R[-49]C+R[-46]C+R[-43]C+R[-40]C+R[-37]C+R[-34]C+R[-31]C+R[-28]C+R[-25]C+R[-22]C+R[-19]C+R[-16]C+R[-13]C+R[-10]C+R[-7]C -> 9 | AK271: =R[-268]C+R[-265]C+R[-262]C+R[-259]C+R[-256]C+R[-253]C+R[-250]C+R[-247]C+R[-244]C+R[-241]C+R[-238]C+R[-235]C+R[-232]C+R[-229]C+R[-226]C+R[-223]C+R[-220]C+R[-217]C+R[-214]C+R[-211]C+R[-208]C+R[-205]C+R[-202]C+R[-199]C+R[-196]C+R[-193]C+R[-190]C+R[-187]C+R[-184]C+R[-181]C+R[-178]C+R[-175]C+R[-172]C+R[-169]C+R[-166]C+R[-163]C+R[-160]C+R[-157]C+R[-154]C+R[-151]C+R[-148]C+R[-145]C+R[-142]C+R[-139]C+R[-136]C+R[-133]C+R[-130]C+R[-127]C+R[-124]C+R[-121]C+R[-118]C+R[-115]C+R[-112]C+R[-109]C+R[-106]C+R[-103]C+R[-100]C+R[-97]C+R[-94]C+R[-91]C+R[-88]C+R[-85]C+R[-82]C+R[-79]C+R[-76]C+R[-73]C+R[-70]C+R[-67]C+R[-64]C+R[-61]C+R[-58]C+R[-55]C+R[-52]C+R[-49]C+R[-46]C+R[-43]C+R[-40]C+R[-37]C+R[-34]C+R[-31]C+R[-28]C+R[-25]C+R[-22]C+R[-19]C+R[-16]C+R[-13]C+R[-10]C+R[-7]C -> 1 | AL271: =R[-268]C+R[-265]C+R[-262]C+R[-259]C+R[-256]C+R[-253]C+R[-250]C+R[-247]C+R[-244]C+R[-241]C+R[-238]C+R[-235]C+R[-232]C+R[-229]C+R[-226]C+R[-223]C+R[-220]C+R[-217]C+R[-214]C+R[-211]C+R[-208]C+R[-205]C+R[-202]C+R[-199]C+R[-196]C+R[-193]C+R[-190]C+R[-187]C+R[-184]C+R[-181]C+R[-178]C+R[-175]C+R[-172]C+R[-169]C+R[-166]C+R[-163]C+R[-160]C+R[-157]C+R[-154]C+R[-151]C+R[-148]C+R[-145]C+R[-142]C+R[-139]C+R[-136]C+R[-133]C+R[-130]C+R[-127]C+R[-124]C+R[-121]C+R[-118]C+R[-115]C+R[-112]C+R[-109]C+R[-106]C+R[-103]C+R[-100]C+R[-97]C+R[-94]C+R[-91]C+R[-88]C+R[-85]C+R[-82]C+R[-79]C+R[-76]C+R[-73]C+R[-70]C+R[-67]C+R[-64]C+R[-61]C+R[-58]C+R[-55]C+R[-52]C+R[-49]C+R[-46]C+R[-43]C+R[-40]C+R[-37]C+R[-34]C+R[-31]C+R[-28]C+R[-25]C+R[-22]C+R[-19]C+R[-16]C+R[-13]C+R[-10]C+R[-7]C -> 1 | AM271: =R[-268]C+R[-265]C+R[-262]C+R[-259]C+R[-256]C+R[-253]C+R[-250]C+R[-247]C+R[-244]C+R[-241]C+R[-238]C+R[-235]C+R[-232]C+R[-229]C+R[-226]C+R[-223]C+R[-220]C+R[-217]C+R[-214]C+R[-211]C+R[-208]C+R[-205]C+R[-202]C+R[-199]C+R[-196]C+R[-193]C+R[-190]C+R[-187]C+R[-184]C+R[-181]C+R[-178]C+R[-175]C+R[-172]C+R[-169]C+R[-166]C+R[-163]C+R[-160]C+R[-157]C+R[-154]C+R[-151]C+R[-148]C+R[-145]C+R[-142]C+R[-139]C+R[-136]C+R[-133]C+R[-130]C+R[-127]C+R[-124]C+R[-121]C+R[-118]C+R[-115]C+R[-112]C+R[-109]C+R[-106]C+R[-103]C+R[-100]C+R[-97]C+R[-94]C+R[-91]C+R[-88]C+R[-85]C+R[-82]C+R[-79]C+R[-76]C+R[-73]C+R[-70]C+R[-67]C+R[-64]C+R[-61]C+R[-58]C+R[-55]C+R[-52]C+R[-49]C+R[-46]C+R[-43]C+R[-40]C+R[-37]C+R[-34]C+R[-31]C+R[-28]C+R[-25]C+R[-22]C+R[-19]C+R[-16]C+R[-13]C+R[-10]C+R[-7]C -> 3 | AN271: =R[-268]C+R[-265]C+R[-262]C+R[-259]C+R[-256]C+R[-253]C+R[-250]C+R[-247]C+R[-244]C+R[-241]C+R[-238]C+R[-235]C+R[-232]C+R[-229]C+R[-226]C+R[-223]C+R[-220]C+R[-217]C+R[-214]C+R[-211]C+R[-208]C+R[-205]C+R[-202]C+R[-199]C+R[-196]C+R[-193]C+R[-190]C+R[-187]C+R[-184]C+R[-181]C+R[-178]C+R[-175]C+R[-172]C+R[-169]C+R[-166]C+R[-163]C+R[-160]C+R[-157]C+R[-154]C+R[-151]C+R[-148]C+R[-145]C+R[-142]C+R[-139]C+R[-136]C+R[-133]C+R[-130]C+R[-127]C+R[-124]C+R[-121]C+R[-118]C+R[-115]C+R[-112]C+R[-109]C+R[-106]C+R[-103]C+R[-100]C+R[-97]C+R[-94]C+R[-91]C+R[-88]C+R[-85]C+R[-82]C+R[-79]C+R[-76]C+R[-73]C+R[-70]C+R[-67]C+R[-64]C+R[-61]C+R[-58]C+R[-55]C+R[-52]C+R[-49]C+R[-46]C+R[-43]C+R[-40]C+R[-37]C+R[-34]C+R[-31]C+R[-28]C+R[-25]C+R[-22]C+R[-19]C+R[-16]C+R[-13]C+R[-10]C+R[-7]C -> 1 | AO271: =R[-268]C+R[-265]C+R[-262]C+R[-259]C+R[-256]C+R[-253]C+R[-250]C+R[-247]C+R[-244]C+R[-241]C+R[-238]C+R[-235]C+R[-232]C+R[-229]C+R[-226]C+R[-223]C+R[-220]C+R[-217]C+R[-214]C+R[-211]C+R[-208]C+R[-205]C+R[-202]C+R[-199]C+R[-196]C+R[-193]C+R[-190]C+R[-187]C+R[-184]C+R[-181]C+R[-178]C+R[-175]C+R[-172]C+R[-169]C+R[-166]C+R[-163]C+R[-160]C+R[-157]C+R[-154]C+R[-151]C+R[-148]C+R[-145]C+R[-142]C+R[-139]C+R[-136]C+R[-133]C+R[-130]C+R[-127]C+R[-124]C+R[-121]C+R[-118]C+R[-115]C+R[-112]C+R[-109]C+R[-106]C+R[-103]C+R[-100]C+R[-97]C+R[-94]C+R[-91]C+R[-88]C+R[-85]C+R[-82]C+R[-79]C+R[-76]C+R[-73]C+R[-70]C+R[-67]C+R[-64]C+R[-61]C+R[-58]C+R[-55]C+R[-52]C+R[-49]C+R[-46]C+R[-43]C+R[-40]C+R[-37]C+R[-34]C+R[-31]C+R[-28]C+R[-25]C+R[-22]C+R[-19]C+R[-16]C+R[-13]C+R[-10]C+R[-7]C -> 7 | AP271: =R[-268]C+R[-265]C+R[-262]C+R[-259]C+R[-256]C+R[-253]C+R[-250]C+R[-247]C+R[-244]C+R[-241]C+R[-238]C+R[-235]C+R[-232]C+R[-229]C+R[-226]C+R[-223]C+R[-220]C+R[-217]C+R[-214]C+R[-211]C+R[-208]C+R[-205]C+R[-202]C+R[-199]C+R[-196]C+R[-193]C+R[-190]C+R[-187]C+R[-184]C+R[-181]C+R[-178]C+R[-175]C+R[-172]C+R[-169]C+R[-166]C+R[-163]C+R[-160]C+R[-157]C+R[-154]C+R[-151]C+R[-148]C+R[-145]C+R[-142]C+R[-139]C+R[-136]C+R[-133]C+R[-130]C+R[-127]C+R[-124]C+R[-121]C+R[-118]C+R[-115]C+R[-112]C+R[-109]C+R[-106]C+R[-103]C+R[-100]C+R[-97]C+R[-94]C+R[-91]C+R[-88]C+R[-85]C+R[-82]C+R[-79]C+R[-76]C+R[-73]C+R[-70]C+R[-67]C+R[-64]C+R[-61]C+R[-58]C+R[-55]C+R[-52]C+R[-49]C+R[-46]C+R[-43]C+R[-40]C+R[-37]C+R[-34]C+R[-31]C+R[-28]C+R[-25]C+R[-22]C+R[-19]C+R[-16]C+R[-13]C+R[-10]C+R[-7]C -> 3 | AQ271: =R[-268]C+R[-265]C+R[-262]C+R[-259]C+R[-256]C+R[-253]C+R[-250]C+R[-247]C+R[-244]C+R[-241]C+R[-238]C+R[-235]C+R[-232]C+R[-229]C+R[-226]C+R[-223]C+R[-220]C+R[-217]C+R[-214]C+R[-211]C+R[-208]C+R[-205]C+R[-202]C+R[-199]C+R[-196]C+R[-193]C+R[-190]C+R[-187]C+R[-184]C+R[-181]C+R[-178]C+R[-175]C+R[-172]C+R[-169]C+R[-166]C+R[-163]C+R[-160]C+R[-157]C+R[-154]C+R[-151]C+R[-148]C+R[-145]C+R[-142]C+R[-139]C+R[-136]C+R[-133]C+R[-130]C+R[-127]C+R[-124]C+R[-121]C+R[-118]C+R[-115]C+R[-112]C+R[-109]C+R[-106]C+R[-103]C+R[-100]C+R[-97]C+R[-94]C+R[-91]C+R[-88]C+R[-85]C+R[-82]C+R[-79]C+R[-76]C+R[-73]C+R[-70]C+R[-67]C+R[-64]C+R[-61]C+R[-58]C+R[-55]C+R[-52]C+R[-49]C+R[-46]C+R[-43]C+R[-40]C+R[-37]C+R[-34]C+R[-31]C+R[-28]C+R[-25]C+R[-22]C+R[-19]C+R[-16]C+R[-13]C+R[-10]C+R[-7]C -> 5 | AR271: =R[-268]C+R[-265]C+R[-262]C+R[-259]C+R[-256]C+R[-253]C+R[-250]C+R[-247]C+R[-244]C+R[-241]C+R[-238]C+R[-235]C+R[-232]C+R[-229]C+R[-226]C+R[-223]C+R[-220]C+R[-217]C+R[-214]C+R[-211]C+R[-208]C+R[-205]C+R[-202]C+R[-199]C+R[-196]C+R[-193]C+R[-190]C+R[-187]C+R[-184]C+R[-181]C+R[-178]C+R[-175]C+R[-172]C+R[-169]C+R[-166]C+R[-163]C+R[-160]C+R[-157]C+R[-154]C+R[-151]C+R[-148]C+R[-145]C+R[-142]C+R[-139]C+R[-136]C+R[-133]C+R[-130]C+R[-127]C+R[-124]C+R[-121]C+R[-118]C+R[-115]C+R[-112]C+R[-109]C+R[-106]C+R[-103]C+R[-100]C+R[-97]C+R[-94]C+R[-91]C+R[-88]C+R[-85]C+R[-82]C+R[-79]C+R[-76]C+R[-73]C+R[-70]C+R[-67]C+R[-64]C+R[-61]C+R[-58]C+R[-55]C+R[-52]C+R[-49]C+R[-46]C+R[-43]C+R[-40]C+R[-37]C+R[-34]C+R[-31]C+R[-28]C+R[-25]C+R[-22]C+R[-19]C+R[-16]C+R[-13]C+R[-10]C+R[-7]C -> 3 | AS271: =R[-268]C+R[-265]C+R[-262]C+R[-259]C+R[-256]C+R[-253]C+R[-250]C+R[-247]C+R[-244]C+R[-241]C+R[-238]C+R[-235]C+R[-232]C+R[-229]C+R[-226]C+R[-223]C+R[-220]C+R[-217]C+R[-214]C+R[-211]C+R[-208]C+R[-205]C+R[-202]C+R[-199]C+R[-196]C+R[-193]C+R[-190]C+R[-187]C+R[-184]C+R[-181]C+R[-178]C+R[-175]C+R[-172]C+R[-169]C+R[-166]C+R[-163]C+R[-160]C+R[-157]C+R[-154]C+R[-151]C+R[-148]C+R[-145]C+R[-142]C+R[-139]C+R[-136]C+R[-133]C+R[-130]C+R[-127]C+R[-124]C+R[-121]C+R[-118]C+R[-115]C+R[-112]C+R[-109]C+R[-106]C+R[-103]C+R[-100]C+R[-97]C+R[-94]C+R[-91]C+R[-88]C+R[-85]C+R[-82]C+R[-79]C+R[-76]C+R[-73]C+R[-70]C+R[-67]C+R[-64]C+R[-61]C+R[-58]C+R[-55]C+R[-52]C+R[-49]C+R[-46]C+R[-43]C+R[-40]C+R[-37]C+R[-34]C+R[-31]C+R[-28]C+R[-25]C+R[-22]C+R[-19]C+R[-16]C+R[-13]C+R[-10]C+R[-7]C -> 1 | AT271: =R[-268]C+R[-265]C+R[-262]C+R[-259]C+R[-256]C+R[-253]C+R[-250]C+R[-247]C+R[-244]C+R[-241]C+R[-238]C+R[-235]C+R[-232]C+R[-229]C+R[-226]C+R[-223]C+R[-220]C+R[-217]C+R[-214]C+R[-211]C+R[-208]C+R[-205]C+R[-202]C+R[-199]C+R[-196]C+R[-193]C+R[-190]C+R[-187]C+R[-184]C+R[-181]C+R[-178]C+R[-175]C+R[-172]C+R[-169]C+R[-166]C+R[-163]C+R[-160]C+R[-157]C+R[-154]C+R[-151]C+R[-148]C+R[-145]C+R[-142]C+R[-139]C+R[-136]C+R[-133]C+R[-130]C+R[-127]C+R[-124]C+R[-121]C+R[-118]C+R[-115]C+R[-112]C+R[-109]C+R[-106]C+R[-103]C+R[-100]C+R[-97]C+R[-94]C+R[-91]C+R[-88]C+R[-85]C+R[-82]C+R[-79]C+R[-76]C+R[-73]C+R[-70]C+R[-67]C+R[-64]C+R[-61]C+R[-58]C+R[-55]C+R[-52]C+R[-49]C+R[-46]C+R[-43]C+R[-40]C+R[-37]C+R[-34]C+R[-31]C+R[-28]C+R[-25]C+R[-22]C+R[-19]C+R[-16]C+R[-13]C+R[-10]C+R[-7]C -> 1 | AU271: =R[-268]C+R[-265]C+R[-262]C+R[-259]C+R[-256]C+R[-253]C+R[-250]C+R[-247]C+R[-244]C+R[-241]C+R[-238]C+R[-235]C+R[-232]C+R[-229]C+R[-226]C+R[-223]C+R[-220]C+R[-217]C+R[-214]C+R[-211]C+R[-208]C+R[-205]C+R[-202]C+R[-199]C+R[-196]C+R[-193]C+R[-190]C+R[-187]C+R[-184]C+R[-181]C+R[-178]C+R[-175]C+R[-172]C+R[-169]C+R[-166]C+R[-163]C+R[-160]C+R[-157]C+R[-154]C+R[-151]C+R[-148]C+R[-145]C+R[-142]C+R[-139]C+R[-136]C+R[-133]C+R[-130]C+R[-127]C+R[-124]C+R[-121]C+R[-118]C+R[-115]C+R[-112]C+R[-109]C+R[-106]C+R[-103]C+R[-100]C+R[-97]C+R[-94]C+R[-91]C+R[-88]C+R[-85]C+R[-82]C+R[-79]C+R[-76]C+R[-73]C+R[-70]C+R[-67]C+R[-64]C+R[-61]C+R[-58]C+R[-55]C+R[-52]C+R[-49]C+R[-46]C+R[-43]C+R[-40]C+R[-37]C+R[-34]C+R[-31]C+R[-28]C+R[-25]C+R[-22]C+R[-19]C+R[-16]C+R[-13]C+R[-10]C+R[-7]C -> 1 | AV271: =R[-268]C+R[-265]C+R[-262]C+R[-259]C+R[-256]C+R[-253]C+R[-250]C+R[-247]C+R[-244]C+R[-241]C+R[-238]C+R[-235]C+R[-232]C+R[-229]C+R[-226]C+R[-223]C+R[-220]C+R[-217]C+R[-214]C+R[-211]C+R[-208]C+R[-205]C+R[-202]C+R[-199]C+R[-196]C+R[-193]C+R[-190]C+R[-187]C+R[-184]C+R[-181]C+R[-178]C+R[-175]C+R[-172]C+R[-169]C+R[-166]C+R[-163]C+R[-160]C+R[-157]C+R[-154]C+R[-151]C+R[-148]C+R[-145]C+R[-142]C+R[-139]C+R[-136]C+R[-133]C+R[-130]C+R[-127]C+R[-124]C+R[-121]C+R[-118]C+R[-115]C+R[-112]C+R[-109]C+R[-106]C+R[-103]C+R[-100]C+R[-97]C+R[-94]C+R[-91]C+R[-88]C+R[-85]C+R[-82]C+R[-79]C+R[-76]C+R[-73]C+R[-70]C+R[-67]C+R[-64]C+R[-61]C+R[-58]C+R[-55]C+R[-52]C+R[-49]C+R[-46]C+R[-43]C+R[-40]C+R[-37]C+R[-34]C+R[-31]C+R[-28]C+R[-25]C+R[-22]C+R[-19]C+R[-16]C+R[-13]C+R[-10]C+R[-7]C -> 3 | AW271: =R[-268]C+R[-265]C+R[-262]C+R[-259]C+R[-256]C+R[-253]C+R[-250]C+R[-247]C+R[-244]C+R[-241]C+R[-238]C+R[-235]C+R[-232]C+R[-229]C+R[-226]C+R[-223]C+R[-220]C+R[-217]C+R[-214]C+R[-211]C+R[-208]C+R[-205]C+R[-202]C+R[-199]C+R[-196]C+R[-193]C+R[-190]C+R[-187]C+R[-184]C+R[-181]C+R[-178]C+R[-175]C+R[-172]C+R[-169]C+R[-166]C+R[-163]C+R[-160]C+R[-157]C+R[-154]C+R[-151]C+R[-148]C+R[-145]C+R[-142]C+R[-139]C+R[-136]C+R[-133]C+R[-130]C+R[-127]C+R[-124]C+R[-121]C+R[-118]C+R[-115]C+R[-112]C+R[-109]C+R[-106]C+R[-103]C+R[-100]C+R[-97]C+R[-94]C+R[-91]C+R[-88]C+R[-85]C+R[-82]C+R[-79]C+R[-76]C+R[-73]C+R[-70]C+R[-67]C+R[-64]C+R[-61]C+R[-58]C+R[-55]C+R[-52]C+R[-49]C+R[-46]C+R[-43]C+R[-40]C+R[-37]C+R[-34]C+R[-31]C+R[-28]C+R[-25]C+R[-22]C+R[-19]C+R[-16]C+R[-13]C+R[-10]C+R[-7]C -> 1 | AX271: =R[-268]C+R[-265]C+R[-262]C+R[-259]C+R[-256]C+R[-253]C+R[-250]C+R[-247]C+R[-244]C+R[-241]C+R[-238]C+R[-235]C+R[-232]C+R[-229]C+R[-226]C+R[-223]C+R[-220]C+R[-217]C+R[-214]C+R[-211]C+R[-208]C+R[-205]C+R[-202]C+R[-199]C+R[-196]C+R[-193]C+R[-190]C+R[-187]C+R[-184]C+R[-181]C+R[-178]C+R[-175]C+R[-172]C+R[-169]C+R[-166]C+R[-163]C+R[-160]C+R[-157]C+R[-154]C+R[-151]C+R[-148]C+R[-145]C+R[-142]C+R[-139]C+R[-136]C+R[-133]C+R[-130]C+R[-127]C+R[-124]C+R[-121]C+R[-118]C+R[-115]C+R[-112]C+R[-109]C+R[-106]C+R[-103]C+R[-100]C+R[-97]C+R[-94]C+R[-91]C+R[-88]C+R[-85]C+R[-82]C+R[-79]C+R[-76]C+R[-73]C+R[-70]C+R[-67]C+R[-64]C+R[-61]C+R[-58]C+R[-55]C+R[-52]C+R[-49]C+R[-46]C+R[-43]C+R[-40]C+R[-37]C+R[-34]C+R[-31]C+R[-28]C+R[-25]C+R[-22]C+R[-19]C+R[-16]C+R[-13]C+R[-10]C+R[-7]C -> 1 | AY271: =R[-268]C+R[-265]C+R[-262]C+R[-259]C+R[-256]C+R[-253]C+R[-250]C+R[-247]C+R[-244]C+R[-241]C+R[-238]C+R[-235]C+R[-232]C+R[-229]C+R[-226]C+R[-223]C+R[-220]C+R[-217]C+R[-214]C+R[-211]C+R[-208]C+R[-205]C+R[-202]C+R[-199]C+R[-196]C+R[-193]C+R[-190]C+R[-187]C+R[-184]C+R[-181]C+R[-178]C+R[-175]C+R[-172]C+R[-169]C+R[-166]C+R[-163]C+R[-160]C+R[-157]C+R[-154]C+R[-151]C+R[-148]C+R[-145]C+R[-142]C+R[-139]C+R[-136]C+R[-133]C+R[-130]C+R[-127]C+R[-124]C+R[-121]C+R[-118]C+R[-115]C+R[-112]C+R[-109]C+R[-106]C+R[-103]C+R[-100]C+R[-97]C+R[-94]C+R[-91]C+R[-88]C+R[-85]C+R[-82]C+R[-79]C+R[-76]C+R[-73]C+R[-70]C+R[-67]C+R[-64]C+R[-61]C+R[-58]C+R[-55]C+R[-52]C+R[-49]C+R[-46]C+R[-43]C+R[-40]C+R[-37]C+R[-34]C+R[-31]C+R[-28]C+R[-25]C+R[-22]C+R[-19]C+R[-16]C+R[-13]C+R[-10]C+R[-7]C -> 2 | AZ271: =R[-268]C+R[-265]C+R[-262]C+R[-259]C+R[-256]C+R[-253]C+R[-250]C+R[-247]C+R[-244]C+R[-241]C+R[-238]C+R[-235]C+R[-232]C+R[-229]C+R[-226]C+R[-223]C+R[-220]C+R[-217]C+R[-214]C+R[-211]C+R[-208]C+R[-205]C+R[-202]C+R[-199]C+R[-196]C+R[-193]C+R[-190]C+R[-187]C+R[-184]C+R[-181]C+R[-178]C+R[-175]C+R[-172]C+R[-169]C+R[-166]C+R[-163]C+R[-160]C+R[-157]C+R[-154]C+R[-151]C+R[-148]C+R[-145]C+R[-142]C+R[-139]C+R[-136]C+R[-133]C+R[-130]C+R[-127]C+R[-124]C+R[-121]C+R[-118]C+R[-115]C+R[-112]C+R[-109]C+R[-106]C+R[-103]C+R[-100]C+R[-97]C+R[-94]C+R[-91]C+R[-88]C+R[-85]C+R[-82]C+R[-79]C+R[-76]C+R[-73]C+R[-70]C+R[-67]C+R[-64]C+R[-61]C+R[-58]C+R[-55]C+R[-52]C+R[-49]C+R[-46]C+R[-43]C+R[-40]C+R[-37]C+R[-34]C+R[-31]C+R[-28]C+R[-25]C+R[-22]C+R[-19]C+R[-16]C+R[-13]C+R[-10]C+R[-7]C -> 2 | BA271: =R[-268]C+R[-265]C+R[-262]C+R[-259]C+R[-256]C+R[-253]C+R[-250]C+R[-247]C+R[-244]C+R[-241]C+R[-238]C+R[-235]C+R[-232]C+R[-229]C+R[-226]C+R[-223]C+R[-220]C+R[-217]C+R[-214]C+R[-211]C+R[-208]C+R[-205]C+R[-202]C+R[-199]C+R[-196]C+R[-193]C+R[-190]C+R[-187]C+R[-184]C+R[-181]C+R[-178]C+R[-175]C+R[-172]C+R[-169]C+R[-166]C+R[-163]C+R[-160]C+R[-157]C+R[-154]C+R[-151]C+R[-148]C+R[-145]C+R[-142]C+R[-139]C+R[-136]C+R[-133]C+R[-130]C+R[-127]C+R[-124]C+R[-121]C+R[-118]C+R[-115]C+R[-112]C+R[-109]C+R[-106]C+R[-103]C+R[-100]C+R[-97]C+R[-94]C+R[-91]C+R[-88]C+R[-85]C+R[-82]C+R[-79]C+R[-76]C+R[-73]C+R[-70]C+R[-67]C+R[-64]C+R[-61]C+R[-58]C+R[-55]C+R[-52]C+R[-49]C+R[-46]C+R[-43]C+R[-40]C+R[-37]C+R[-34]C+R[-31]C+R[-28]C+R[-25]C+R[-22]C+R[-19]C+R[-16]C+R[-13]C+R[-10]C+R[-7]C -> 4 | BB271: =R[-268]C+R[-265]C+R[-262]C+R[-259]C+R[-256]C+R[-253]C+R[-250]C+R[-247]C+R[-244]C+R[-241]C+R[-238]C+R[-235]C+R[-232]C+R[-229]C+R[-226]C+R[-223]C+R[-220]C+R[-217]C+R[-214]C+R[-211]C+R[-208]C+R[-205]C+R[-202]C+R[-199]C+R[-196]C+R[-193]C+R[-190]C+R[-187]C+R[-184]C+R[-181]C+R[-178]C+R[-175]C+R[-172]C+R[-169]C+R[-166]C+R[-163]C+R[-160]C+R[-157]C+R[-154]C+R[-151]C+R[-148]C+R[-145]C+R[-142]C+R[-139]C+R[-136]C+R[-133]C+R[-130]C+R[-127]C+R[-124]C+R[-121]C+R[-118]C+R[-115]C+R[-112]C+R[-109]C+R[-106]C+R[-103]C+R[-100]C+R[-97]C+R[-94]C+R[-91]C+R[-88]C+R[-85]C+R[-82]C+R[-79]C+R[-76]C+R[-73]C+R[-70]C+R[-67]C+R[-64]C+R[-61]C+R[-58]C+R[-55]C+R[-52]C+R[-49]C+R[-46]C+R[-43]C+R[-40]C+R[-37]C+R[-34]C+R[-31]C+R[-28]C+R[-25]C+R[-22]C+R[-19]C+R[-16]C+R[-13]C+R[-10]C+R[-7]C -> 3 | BC271: =R[-268]C+R[-265]C+R[-262]C+R[-259]C+R[-256]C+R[-253]C+R[-250]C+R[-247]C+R[-244]C+R[-241]C+R[-238]C+R[-235]C+R[-232]C+R[-229]C+R[-226]C+R[-223]C+R[-220]C+R[-217]C+R[-214]C+R[-211]C+R[-208]C+R[-205]C+R[-202]C+R[-199]C+R[-196]C+R[-193]C+R[-190]C+R[-187]C+R[-184]C+R[-181]C+R[-178]C+R[-175]C+R[-172]C+R[-169]C+R[-166]C+R[-163]C+R[-160]C+R[-157]C+R[-154]C+R[-151]C+R[-148]C+R[-145]C+R[-142]C+R[-139]C+R[-136]C+R[-133]C+R[-130]C+R[-127]C+R[-124]C+R[-121]C+R[-118]C+R[-115]C+R[-112]C+R[-109]C+R[-106]C+R[-103]C+R[-100]C+R[-97]C+R[-94]C+R[-91]C+R[-88]C+R[-85]C+R[-82]C+R[-79]C+R[-76]C+R[-73]C+R[-70]C+R[-67]C+R[-64]C+R[-61]C+R[-58]C+R[-55]C+R[-52]C+R[-49]C+R[-46]C+R[-43]C+R[-40]C+R[-37]C+R[-34]C+R[-31]C+R[-28]C+R[-25]C+R[-22]C+R[-19]C+R[-16]C+R[-13]C+R[-10]C+R[-7]C -> 5 | BD271: =R[-268]C+R[-265]C+R[-262]C+R[-259]C+R[-256]C+R[-253]C+R[-250]C+R[-247]C+R[-244]C+R[-241]C+R[-238]C+R[-235]C+R[-232]C+R[-229]C+R[-226]C+R[-223]C+R[-220]C+R[-217]C+R[-214]C+R[-211]C+R[-208]C+R[-205]C+R[-202]C+R[-199]C+R[-196]C+R[-193]C+R[-190]C+R[-187]C+R[-184]C+R[-181]C+R[-178]C+R[-175]C+R[-172]C+R[-169]C+R[-166]C+R[-163]C+R[-160]C+R[-157]C+R[-154]C+R[-151]C+R[-148]C+R[-145]C+R[-142]C+R[-139]C+R[-136]C+R[-133]C+R[-130]C+R[-127]C+R[-124]C+R[-121]C+R[-118]C+R[-115]C+R[-112]C+R[-109]C+R[-106]C+R[-103]C+R[-100]C+R[-97]C+R[-94]C+R[-91]C+R[-88]C+R[-85]C+R[-82]C+R[-79]C+R[-76]C+R[-73]C+R[-70]C+R[-67]C+R[-64]C+R[-61]C+R[-58]C+R[-55]C+R[-52]C+R[-49]C+R[-46]C+R[-43]C+R[-40]C+R[-37]C+R[-34]C+R[-31]C+R[-28]C+R[-25]C+R[-22]C+R[-19]C+R[-16]C+R[-13]C+R[-10]C+R[-7]C -> 6 | BE271: =R[-268]C+R[-265]C+R[-262]C+R[-259]C+R[-256]C+R[-253]C+R[-250]C+R[-247]C+R[-244]C+R[-241]C+R[-238]C+R[-235]C+R[-232]C+R[-229]C+R[-226]C+R[-223]C+R[-220]C+R[-217]C+R[-214]C+R[-211]C+R[-208]C+R[-205]C+R[-202]C+R[-199]C+R[-196]C+R[-193]C+R[-190]C+R[-187]C+R[-184]C+R[-181]C+R[-178]C+R[-175]C+R[-172]C+R[-169]C+R[-166]C+R[-163]C+R[-160]C+R[-157]C+R[-154]C+R[-151]C+R[-148]C+R[-145]C+R[-142]C+R[-139]C+R[-136]C+R[-133]C+R[-130]C+R[-127]C+R[-124]C+R[-121]C+R[-118]C+R[-115]C+R[-112]C+R[-109]C+R[-106]C+R[-103]C+R[-100]C+R[-97]C+R[-94]C+R[-91]C+R[-88]C+R[-85]C+R[-82]C+R[-79]C+R[-76]C+R[-73]C+R[-70]C+R[-67]C+R[-64]C+R[-61]C+R[-58]C+R[-55]C+R[-52]C+R[-49]C+R[-46]C+R[-43]C+R[-40]C+R[-37]C+R[-34]C+R[-31]C+R[-28]C+R[-25]C+R[-22]C+R[-19]C+R[-16]C+R[-13]C+R[-10]C+R[-7]C -> 30 | BF271: =R[-268]C+R[-265]C+R[-262]C+R[-259]C+R[-256]C+R[-253]C+R[-250]C+R[-247]C+R[-244]C+R[-241]C+R[-238]C+R[-235]C+R[-232]C+R[-229]C+R[-226]C+R[-223]C+R[-220]C+R[-217]C+R[-214]C+R[-211]C+R[-208]C+R[-205]C+R[-202]C+R[-199]C+R[-196]C+R[-193]C+R[-190]C+R[-187]C+R[-184]C+R[-181]C+R[-178]C+R[-175]C+R[-172]C+R[-169]C+R[-166]C+R[-163]C+R[-160]C+R[-157]C+R[-154]C+R[-151]C+R[-148]C+R[-145]C+R[-142]C+R[-139]C+R[-136]C+R[-133]C+R[-130]C+R[-127]C+R[-124]C+R[-121]C+R[-118]C+R[-115]C+R[-112]C+R[-109]C+R[-106]C+R[-103]C+R[-100]C+R[-97]C+R[-94]C+R[-91]C+R[-88]C+R[-85]C+R[-82]C+R[-79]C+R[-76]C+R[-73]C+R[-70]C+R[-67]C+R[-64]C+R[-61]C+R[-58]C+R[-55]C+R[-52]C+R[-49]C+R[-46]C+R[-43]C+R[-40]C+R[-37]C+R[-34]C+R[-31]C+R[-28]C+R[-25]C+R[-22]C+R[-19]C+R[-16]C+R[-13]C+R[-10]C+R[-7]C -> 6 | BG271: =R[-268]C+R[-265]C+R[-262]C+R[-259]C+R[-256]C+R[-253]C+R[-250]C+R[-247]C+R[-244]C+R[-241]C+R[-238]C+R[-235]C+R[-232]C+R[-229]C+R[-226]C+R[-223]C+R[-220]C+R[-217]C+R[-214]C+R[-211]C+R[-208]C+R[-205]C+R[-202]C+R[-199]C+R[-196]C+R[-193]C+R[-190]C+R[-187]C+R[-184]C+R[-181]C+R[-178]C+R[-175]C+R[-172]C+R[-169]C+R[-166]C+R[-163]C+R[-160]C+R[-157]C+R[-154]C+R[-151]C+R[-148]C+R[-145]C+R[-142]C+R[-139]C+R[-136]C+R[-133]C+R[-130]C+R[-127]C+R[-124]C+R[-121]C+R[-118]C+R[-115]C+R[-112]C+R[-109]C+R[-106]C+R[-103]C+R[-100]C+R[-97]C+R[-94]C+R[-91]C+R[-88]C+R[-85]C+R[-82]C+R[-79]C+R[-76]C+R[-73]C+R[-70]C+R[-67]C+R[-64]C+R[-61]C+R[-58]C+R[-55]C+R[-52]C+R[-49]C+R[-46]C+R[-43]C+R[-40]C+R[-37]C+R[-34]C+R[-31]C+R[-28]C+R[-25]C+R[-22]C+R[-19]C+R[-16]C+R[-13]C+R[-10]C+R[-7]C -> 327 | BH271: Participant Grand Total | BI271: =SUM(RC[-55]:RC[-2]) -> 1023

Sheet: Companies
A1: COMPANIES PARTICIPATING IN RISE CLASSES - 2002
A2: Company Name | B2: Class Participants | C2: Total Public Cost | D2: Total RISE Cost | E2: Total RISE Savings
A3: ABC | B3: 3 | C3: 5985 | D3: 2064 | E3: =RC[-2]-RC[-1] -> 3921
A4: Auditor Public Accounts | B4: 1 | C4: 1295 | D4: 327 | E4: =RC[-2]-RC[-1] -> 968
A5: Capital One | B5: 39 | C5: 60045 | D5: 23225 | E5: =RC[-2]-RC[-1] -> 36820
A6: Circuit City | B6: 7 | C6: 9765 | D6: 5208 | E6: =RC[-2]-RC[-1] -> 4557
A7: City of Newport News | B7: 2 | C7: 2500 | D7: 1300 | E7: =RC[-2]-RC[-1] -> 1200
A8: City of Richmond | B8: 50 | C8: 60325 | D8: 26325 | E8: =RC[-2]-RC[-1] -> 34000
A9: Colonial Mechanical | B9: 3 | C9: 3300 | D9: 1225 | E9: =RC[-2]-RC[-1] -> 2075
A10: Colony Management | B10: 3 | C10: 4150 | D10: 1600 | E10: =RC[-2]-RC[-1] -> 2550
A11: Covansys | B11: 1 | C11: 1400 | D11: 800 | E11: =RC[-2]-RC[-1] -> 600
A12: Curtis Contracting | B12: 1 | C12: 1200 | D12: 367 | E12: =RC[-2]-RC[-1] -> 833
A13: Dallas Co. Tax Office | B13: 1 | C13: 1295 | D13: 450 | E13: =RC[-2]-RC[-1] -> 845
A14: Danville Community College | B14: 1 | C14: 1595 | D14: 550 | E14: =RC[-2]-RC[-1] -> 1045
A15: Dept of Info Technology | B15: 67 | C15: 98935 | D15: 32663 | E15: =RC[-2]-RC[-1] -> 66272
A16: Dept of Taxation | B16: 11 | C16: 22560 | D16: 9149 | E16: =RC[-2]-RC[-1] -> 13411
A17: Dept. of Conservation Recreation | B17: 1 | C17: 2595 | D17: 1350 | E17: =RC[-2]-RC[-1] -> 1245
A18: Dept. of Education | B18: 5 | C18: 7185 | D18: 2309 | E18: =RC[-2]-RC[-1] -> 4876
A19: Dept. of Environmental Quality | B19: 2 | C19: 1850 | D19: 509 | E19: =RC[-2]-RC[-1] -> 1341
A20: DGS | B20: 1 | C20: 1000 | D20: 350 | E20: =RC[-2]-RC[-1] -> 650
A21: DMV | B21: 1 | C21: 1150 | D21: 525 | E21: =RC[-2]-RC[-1] -> 625
A22: Dominion Resources | B22: 327 | C22: 432445 | D22: 175843 | E22: =RC[-2]-RC[-1] -> 256602
A23: DSCR | B23: 29 | C23: 39120 | D23: 15125 | E23: =RC[-2]-RC[-1] -> 23995
A24: GableHill Systems, LLC | B24: 1 | C24: 1995 | D24: 850 | E24: =RC[-2]-RC[-1] -> 1145
A25: Isle of Wight Co. Schools | B25: 2 | C25: 3000 | D25: 1050 | E25: =RC[-2]-RC[-1] -> 1950
A26: JSRCC | B26: 1 | C26: 1595 | D26: 550 | E26: =RC[-2]-RC[-1] -> 1045
A27: Meadow Farm | B27: 1 | C27: 1800 | D27: 550 | E27: =RC[-2]-RC[-1] -> 1250
A28: Merge Computer Corp | B28: 3 | C28: 3525 | D28: 1575 | E28: =RC[-2]-RC[-1] -> 1950
A29: Metro Info. Systems | B29: 5 | C29: 5875 | D29: 2625 | E29: =RC[-2]-RC[-1] -> 3250
A30: Naptheon | B30: 6 | C30: 11250 | D30: 5073 | E30: =RC[-2]-RC[-1] -> 6177
A31: Paramount Kings Dominion | B31: 3 | C31: 4500 | D31: 1575 | E31: =RC[-2]-RC[-1] -> 2925
A32: Philip Morris | B32: 8 | C32: 8800 | D32: 3052 | E32: =RC[-2]-RC[-1] -> 5748
A33: Pinkerton Computer Consultants | B33: 1 | C33: 1595 | D33: 525 | E33: =RC[-2]-RC[-1] -> 1070
A34: Richard Bland | B34: 2 | C34: 900 | D34: 400 | E34: =RC[-2]-RC[-1] -> 500
A35: RRHA | B35: 9 | C35: 10240 | D35: 3875 | E35: =RC[-2]-RC[-1] -> 6365
A36: Self-Employed | B36: 3 | C36: 5045 | D36: 1775 | E36: =RC[-2]-RC[-1] -> 3270
A37: Southern States Coop. | B37: 6 | C37: 8800 | D37: 3000 | E37: =RC[-2]-RC[-1] -> 5800
A38: State Corp. Commission | B38: 30 | C38: 49410 | D38: 16762 | E38: =RC[-2]-RC[-1] -> 32648
A39: Suntrust Bank | B39: 6 | C39: 11725 | D39: 3400 | E39: =RC[-2]-RC[-1] -> 8325
A40: Supervalue | B40: 6 | C40: 8150 | D40: 3325 | E40: =RC[-2]-RC[-1] -> 4825
A41: Supreme Court of Virginia | B41: 4 | C41: 4400 | D41: 1800 | E41: =RC[-2]-RC[-1] -> 2600
A42: Tech Svcs. Corp. | B42: 2 | C42: 3450 | D42: 1225 | E42: =RC[-2]-RC[-1] -> 2225
A43: Trigon | B43: 101 | C43: 122430 | D43: 46672 | E43: =RC[-2]-RC[-1] -> 75758
A44: TRW | B44: 3 | C44: 5985 | D44: 2064 | E44: =RC[-2]-RC[-1] -> 3921
A45: Va. Dept. of Corrections | B45: 1 | C45: 650 | D45: 325 | E45: =RC[-2]-RC[-1] -> 325
A46: Va. Game & Inland Fisheries | B46: 6 | C46: 9090 | D46: 3862 | E46: =RC[-2]-RC[-1] -> 5228
A47: Va. Lottery | B47: 2 | C47: 5190 | D47: 2000 | E47: =RC[-2]-RC[-1] -> 3190
A48: Va. Retirement System | B48: 19 | C48: 29555 | D48: 10625 | E48: =RC[-2]-RC[-1] -> 18930
A49: VCU/MCV | B49: 22 | C49: 24785 | D49: 9450 | E49: =RC[-2]-RC[-1] -> 15335
A50: VDH-Vital Statistics | B50: 3 | C50: 3885 | D50: 981 | E50: =RC[-2]-RC[-1] -> 2904
A51: VDOT | B51: 138 | C51: 148965 | D51: 52327 | E51: =RC[-2]-RC[-1] -> 96638
A52: VDSS | B52: 9 | C52: 20310 | D52: 8987 | E52: =RC[-2]-RC[-1] -> 11323
A53: VEC | B53: 19 | C53: 25985 | D53: 11402 | E53: =RC[-2]-RC[-1] -> 14583
A54: Venturi Tech. Partners | B54: 1 | C54: 1595 | D54: 550 | E54: =RC[-2]-RC[-1] -> 1045
A55: VHDA | B55: 41 | C55: 52685 | D55: 19494 | E55: =RC[-2]-RC[-1] -> 33191
A56: Westvaco | B56: 3 | C56: 7445 | D56: 2572 | E56: =RC[-2]-RC[-1] -> 4873
A58: Grand Totals | B58: =SUM(R[-55]C:R[-2]C) -> 1023 | C58: =SUM(R[-55]C:R[-2]C) -> 1364305 | D58: =SUM(R[-55]C:R[-2]C) -> 525562 | E58: =SUM(R[-55]C:R[-2]C) -> 838743

Sheet: Financial Info
A1: 2002 RISE Financial Information
A4: Past Years Data Comparison | B4: 1997 | C4: 1998 | D4: 1999 | E4: 2000 | F4: 2001 | G4: 2002
A5: Number of classes held | B5: 144 | C5: 90 | D5: 86 | E5: 106 | F5: 82 | G5: 88
A6: Number of classes canceled | B6: 43 | C6: 26 | D6: 20 | E6: 30 | F6: 45 | G6: 53
A7: Number of classes rescheduled | B7: 18 | C7: 20 | D7: 18 | E7: 13 | F7: 27 | G7: 22
A8: Number of students trained | B8: 1655 | C8: 1091 | D8: 1122 | E8: 1265 | F8: 892 | G8: 1023
A9: Number of student days | B9: 4952.5 | C9: 3273 | D9: 3078 | E9: 3285 | F9: 2202 | G9: 2406
A10: Average class length | B10: 2.99 | C10: 3.08 | D10: 2.74 | E10: 2.6 | F10: 2.4700000000000002 | G10: 2.35
A11: Average cost per day | B11: 211.03 | C11: 202 | D11: 200.02 | E11: 195.48 | F11: 208.32 | G11: 218.44
A12: Average cost per class | B12: 630.96 | C12: 605 | D12: 548.04999999999995 | E12: 508.25 | F12: 514.54999999999995 | G12: 513.33000000000004
A13: Total RISE tuition dollars | B13: 1044104 | C13: 648605 | D13: 615682 | E13: 642167 | F13: 458714 | G13: 525562
A14: Total RISE savings | B14: 1418406 | C14: 1093531 | D14: 1006588 | E14: 1118234 | F14: 762531 | G14: 838743
A15: Total Public cost* | B15: 2462510 | C15: 1742136 | D15: 1622270 | E15: 1760401 | F15: 1221245 | G15: 1364305
A16: *Assumes $200 per day per diem
A19: Average class length = number of student days divided (/) by number of students trained
A21: Average cost per day = total RISE tuition dollars divided (/) by number of student days
A23: Average cost per class = average class length multiplied (x) by average cost per day
A25: Total public cost = total RISE tuition dollars plus (+) total RISE savings