Sheet: Overview
A1: VenturePresentation.com
A2: This model is representative of our fictional company: MobileCord Inc.
A3: You may use this model as the basis for your own, or just use it as a point of reference.
A5: Our Model is made up of the following worksheets:
A7: Employees
A8: Equipment Expense
A9: Cap Lease
A10: Service Expense
A11: Pipeline assumptions
A12: Pipeline
A13: Closed Sales
A14: Quota
A15: Revenue
A16: Monthly P&L
A17: Annual P&L
A18: Quarterly P&L
A19: Balance Sheet
A20: Stmt of CF
A21: Cap Table
A26: Worksheets from "Employees" to "Service Expenses" define the expense side of the business.
A28: Worksheets From "Pipeline Assumptions" to "Revenue" define the Revenue side of the business
A30: Worksheets "Monthly P&L" to "Cap Table" are the financial statements that VCs and investors will want to see.
A32: Investors will probably also want to see the pipeline.
A34: Worksheets "Bal Sheet for Offer Memo" through "P&L summ for Offer Memo" are copies of the Balance Sheet and Quarterly P&L sheets in order to format these statements for the presentation in the offering memorandum.

Sheet: Employees
A1: Employee Expenses
A3: Note: Employee Expenses feed into the Monthly P&L
A5: all costs on a per month basis
B6: Pre-Capital Raise | F6: Post-Capital Raise
F7: Incremental Hires
A8: General Assumptions:
A9: Insurance & Tax true up | B9: 0.3
A11: Bonus Payment per month (Non sales team) | B11: 350
A13: Bonus (Non sales team) | B13: Yes
A15: Bonuses are divided by 12 months since they are annual payments
B17: Monthly Expense | G17: Monthly Expense
A18: General & Administrative
A20: CEO | B20: 6700 | F20: CFO | G20: 6000
A21: Bonus | B21: =IF(R13C2="Yes",R11C2,0) -> 350 | F21: Bonus | G21: =IF(R13C2="Yes",R11C2,0) -> 350
A23: Controller | B23: 4250
A24: Bonus | B24: =IF(R13C2="Yes",R11C2,0) -> 350
A26: LAN Help Desk | B26: 3300
A27: Bonus | B27: =IF(R13C2="Yes",R11C2,0) -> 350
A29: Administrative Assistant | B29: 2100
A30: Bonus | B30: =IF(R13C2="Yes",R11C2,0) -> 350
A32: Subtotal | B32: =SUM(R[-12]C:R[-2]C) -> 17750 | F32: Incremental Subtotal | G32: =SUM(R[-12]C:R[-1]C) -> 6350
A33: Insurance & Payroll Tax | B33: =(R9C2*R[-1]C) -> 5325 | F33: Insurance & Payroll Tax | G33: =(R9C2*R[-1]C) -> 1905
A34: G&A Total | B34: =SUM(R[-2]C:R[-1]C) -> 23075 | F34: G&A Incremental Total | G34: =SUM(R[-2]C:R[-1]C) -> 8255
F36: Total G&A Post Capital Raise | G36: =SUM(R[-2]C[-5],R[-2]C) -> 31330
A38: Sales & Marketing
A39: *Note: Sale Commisions paid on a quarterly basis, see Quota worksheet
A41: VP of Sales and Marketing | B41: 5500 | F41: Head of Business Development | G41: 5200
A43: Sales Associate | B43: 4500
F44: Sales Associate | G44: 4600
A45: Sales Associate | B45: 4500
A47: Inside Sales Associate | B47: 4000 | F47: Sales Associate | G47: 4350
A49: Sales Engineer | B49: 4300
F50: Sales Engineer | G50: 4000
A51: Sales Engineer | B51: 4000
F53: Director of Marketing | G53: 5000
A54: Marketing Associate | B54: 4000
F56: Subtotal | G56: =SUM(R[-15]C:R[-2]C) -> 23150
F57: Insurance & Payroll Tax | G57: =(R9C2*R[-1]C) -> 6945
A58: Subtotal | B58: =SUM(R[-17]C:R[-3]C) -> 30800 | F58: Sales & Mkting Incremental Total | G58: =SUM(R[-2]C:R[-1]C) -> 30095
A59: Insurance & Payroll Tax | B59: =(R9C2*R[-1]C) -> 9240
A60: Sales and Marketing Total | B60: =SUM(R[-2]C:R[-1]C) -> 40040 | F60: Total Sales & Mkting Post Raise | G60: =SUM(RC[-5],R[-2]C) -> 70135
A64: Research & Development
A66: CTO | B66: 6800
A67: Bonus | B67: =IF(R13C2="Yes",R11C2,0) -> 350
A69: Senior Developer | B69: 6000
A70: Bonus | B70: =IF(R13C2="Yes",R11C2,0) -> 350
A72: Senior Developer | B72: 6000
A73: Bonus | B73: =IF(R13C2="Yes",R11C2,0) -> 350 | F73: Developer | G73: 5000
F74: Bonus | G74: =IF(R13C2="Yes",R11C2,0) -> 350
A75: Developer | B75: 5000
A76: Bonus | B76: =IF(R13C2="Yes",R11C2,0) -> 350 | F76: Developer | G76: 4750
F77: Bonus | G77: =IF(R13C2="Yes",R11C2,0) -> 350
A78: Developer | B78: 4750
A79: Bonus | B79: =IF(R13C2="Yes",R11C2,0) -> 350
A81: Developer | B81: 4100
A82: Bonus | B82: =IF(R13C2="Yes",R11C2,0) -> 350
A84: Senior Q&A Analyst | B84: 5250
A85: Bonus | B85: =IF(R13C2="Yes",R11C2,0) -> 350
A87: Q&A Analyst | B87: 4000
A88: Bonus | B88: =IF(R13C2="Yes",R11C2,0) -> 350 | F88: Q&A Analyst/ Documentation | G88: 3700
F89: Bonus | G89: =IF(R13C2="Yes",R11C2,0) -> 350
A90: Q&A Analyst/ Documentation | B90: 3550
A91: Bonus | B91: =IF(R13C2="Yes",R11C2,0) -> 350 | F91: Subtotal | G91: =SUM(R[-27]C:R[-2]C) -> 14500
F92: Insurance & Payroll Tax | G92: =(R9C2*R[-1]C) -> 4350
A93: Subtotal | B93: =SUM(R[-27]C:R[-2]C) -> 48600 | F93: Total Incremental R&D | G93: =SUM(R[-2]C:R[-1]C) -> 18850
A94: Insurance & Payroll Tax | B94: =(R9C2*R[-1]C) -> 14580
A95: Total R&D | B95: =SUM(R[-2]C:R[-1]C) -> 63180 | F95: Total R&D Post Raise | G95: =RC[-5]+R[-2]C -> 82030
A98: Director of Professional Services | B98: 6300
A99: Bonus | B99: =IF(R13C2="Yes",R11C2,0) -> 350
F100: Consultant | G100: 5000
A101: Consultant | B101: 5100 | F101: Bonus | G101: =IF(R13C2="Yes",R11C2,0) -> 350
A102: Bonus | B102: =IF(R13C2="Yes",R11C2,0) -> 350
F103: Customer Support Specialist | G103: 3800
A104: Consultant | B104: 4000 | F104: Bonus | G104: =IF(R13C2="Yes",R11C2,0) -> 350
A105: Bonus | B105: =IF(R13C2="Yes",R11C2,0) -> 350
F107: Subtotal | G107: =SUM(R[-10]C:R[-3]C) -> 9500
A108: Subtotal | B108: =SUM(R[-10]C:R[-3]C) -> 16450 | F108: Insurance & Payroll Tax | G108: =(R9C2*R[-1]C) -> 2850
A109: Insurance & Payroll Tax | B109: =(R9C2*R[-1]C) -> 4935 | F109: Total Incremental Prof Services | G109: =SUM(R[-2]C:R[-1]C) -> 12350
A110: Total Professional Services (COGS) | B110: =SUM(R[-2]C:R[-1]C) -> 21385 | F110: Total Prof Services (post raise) | G110: =RC[-5]+R[-1]C -> 33735
A117: Total Employee Costs | B117: =SUM(R[-83]C,R[-57]C,R[-22]C,R[-5]C) -> 126295 | F117: Total Employee Costs Post Raise | G117: =SUM(R[-83]C,R[-59]C,R[-24]C,R[-8]C)+RC[-5] -> 195845
A120: Total Employees | B120: 23 | F120: Total Employees Post Raise | G120: 34

Sheet: EquipmentExpense
A1: Equipment & Software Expenses | G1: New Equipment Post-Raise
A3: Note: Equipment Expenses feed into the Monthly P&L
D5: Pre-Capital Raise
A6: Assumptions:
A7: Operating Leases
A9: Life of Assets (in months) | D9: 45
A10: Term of Operating Lease | D10: 30
A11: Interest Rate (monthly) | D11: 0.01
B13: Quantity | C13: Cost per unit | H13: Quantity | I13: Cost per unit
A14: Cisco Router | B14: 1 | C14: 15000 | D14: =RC[-2]*RC[-1] -> 15000
A15: Workstations | B15: 25 | C15: 3000 | D15: =RC[-2]*RC[-1] -> 75000 | G15: Workstations | H15: 7 | I15: 3000 | J15: =RC[-2]*RC[-1] -> 21000
A16: Laptops | B16: 5 | C16: 3200 | D16: =RC[-2]*RC[-1] -> 16000 | G16: Laptops | H16: 5 | I16: 3200 | J16: =RC[-2]*RC[-1] -> 16000
A17: PDAs | B17: 20 | C17: 300 | D17: =RC[-2]*RC[-1] -> 6000 | G17: PDAs | H17: 12 | I17: 270 | J17: =RC[-2]*RC[-1] -> 3240
A18: Printers | B18: 3 | C18: 4000 | D18: =RC[-2]*RC[-1] -> 12000
A19: Copier/Scanners | B19: 2 | C19: 5000 | D19: =RC[-2]*RC[-1] -> 10000
A20: Desk Chairs | B20: 30 | C20: 250 | D20: =RC[-2]*RC[-1] -> 7500 | G20: Desk Chairs | H20: 10 | I20: 250 | J20: =RC[-2]*RC[-1] -> 2500
A22: Total | D22: =SUM(R[-8]C:R[-2]C) -> 141500 | J22: =SUM(R[-8]C:R[-2]C) -> 42740
G24: Incremental Monthly Payment | J24: =-PMT(R11C4,R9C4,R[-2]C,0) -> 1184.1136462888157
A25: Monthly Payment | D25: =-PMT(R11C4,R10C4,R[-3]C,0) -> 5482.8580200423712 | G25: Total Monthly Payment | J25: =SUM(RC[-6],R[-1]C) -> 6666.9716663311865
A26: Total obligation over term | D26: =R[-16]C*R[-1]C -> 164485.74060127113
A28: Percent Allocation to Sales | G28: Percent Allocation to Sales
A29: 0.15 | D29: =RC[-3]*R[-4]C -> 822.4287030063557 | G29: 0.15 | J29: =RC[-3]*R[-4]C -> 1000.0457499496779
A31: Percent Allocation to R&D | G31: Percent Allocation to R&D
A32: 0.6 | D32: =RC[-3]*R[-7]C -> 3289.7148120254228 | G32: 0.6 | J32: =RC[-3]*R[-7]C -> 4000.1829997987115
A34: Percent Allocation to G&A | G34: Percent Allocation to G&A
A35: 0.25 | D35: =RC[-3]*R[-10]C -> 1370.7145050105928 | G35: 0.25 | J35: =RC[-3]*R[-10]C -> 1666.7429165827966
A37: Capital Leases
A39: Term of Capital Lease | D39: 36
A40: Interest Rate (monthly) | D40: 0.01
B42: Quantity | C42: Cost per Unit
A44: Sun Servers | B44: 7 | C44: 25000 | D44: =RC[-2]*RC[-1] -> 175000 | G44: Sun Servers | H44: 2 | I44: 25000 | J44: =RC[-2]*RC[-1] -> 50000
A45: Monthly Payment | D45: =-PMT(R40C4,R39C4,R[-1]C,0) -> 5812.5042172489584 | J45: =-PMT(R40C4,R39C4,R[-1]C,0) -> 1660.7154906425596
A46: Total obligation over term | D46: =R[-1]C*R[-7]C -> 209250.15182096249

Sheet: CapLease
D1: 1st Set of Servers | L1: 2nd Set of Servers | R1: Combined Schedule for Servers
D3: Present Value | E3: =EquipmentExpense!R44C4 -> 175000 | G3: Depreciation | L3: Present Value | M3: =EquipmentExpense!R[41]C[-3] -> 50000 | O3: Depreciation
D4: Term (months) | E4: =EquipmentExpense!R39C4 -> 36 | G4: Term (months) | H4: 36 | L4: Term (months) | M4: =EquipmentExpense!R39C4 -> 36 | O4: Term (months) | P4: 36
D5: Rate (month) | E5: =EquipmentExpense!R40C4 -> 0.01 | G5: Depreciation | H5: =-PMT(0,R[-1]C,R[-2]C[-3]) -> 4861.1111111111113 | L5: Rate (month) | M5: =EquipmentExpense!R40C4 -> 0.01 | O5: Depreciation | P5: =-PMT(0,R[-1]C,R[-2]C[-3]) -> 1388.8888888888889
D6: Payment | E6: =EquipmentExpense!R45C4 -> 5812.5042172489584 | L6: Payment | M6: =EquipmentExpense!R[39]C[-3] -> 1660.7154906425596
D8: Amortization Schedule | L8: Amortization Schedule | R8: Combined Amortization Schedule
B10: Month | D10: Beginning Balance | E10: Interest | F10: Principal | G10: Ending Balance | K10: Month | L10: Beginning Bal | M10: Interest | N10: Principal | O10: Ending Balance | R10: Total Principal | S10: Total Interest | T10: Ending Bal | U10: Total Depreciation
B11: 1 | D11: =R[-8]C[1] -> 175000 | E11: =RC[-1]*R5C5 -> 1750 | F11: =R6C5-RC[-1] -> 4062.5042172489584 | G11: =RC[-3]-RC[-1] -> 170937.49578275104 | I11: 1 | R11: =RC[-12]+RC[-4] -> 4062.5042172489584 | S11: =RC[-14]+RC[-6] -> 1750 | T11: =RC[-13]+RC[-5] -> 170937.49578275104 | U11: =R5C8 -> 4861.1111111111113
B12: 2 | D12: =R[-1]C[3] -> 170937.49578275104 | E12: =RC[-1]*R5C5 -> 1709.3749578275103 | F12: =R6C5-RC[-1] -> 4103.1292594214483 | G12: =RC[-3]-RC[-1] -> 166834.36652332958 | I12: 2 | R12: =RC[-12]+RC[-4] -> 4103.1292594214483 | S12: =RC[-14]+RC[-6] -> 1709.3749578275103 | T12: =RC[-13]+RC[-5] -> 166834.36652332958 | U12: =R5C8 -> 4861.1111111111113
B13: 3 | D13: =R[-1]C[3] -> 166834.36652332958 | E13: =RC[-1]*R5C5 -> 1668.3436652332957 | F13: =R6C5-RC[-1] -> 4144.1605520156627 | G13: =RC[-3]-RC[-1] -> 162690.2059713139 | I13: 3 | R13: =RC[-12]+RC[-4] -> 4144.1605520156627 | S13: =RC[-14]+RC[-6] -> 1668.3436652332957 | T13: =RC[-13]+RC[-5] -> 162690.2059713139 | U13: =R5C8 -> 4861.1111111111113
B14: 4 | D14: =R[-1]C[3] -> 162690.2059713139 | E14: =RC[-1]*R5C5 -> 1626.9020597131391 | F14: =R6C5-RC[-1] -> 4185.6021575358191 | G14: =RC[-3]-RC[-1] -> 158504.60381377809 | I14: 4 | R14: =RC[-12]+RC[-4] -> 4185.6021575358191 | S14: =RC[-14]+RC[-6] -> 1626.9020597131391 | T14: =RC[-13]+RC[-5] -> 158504.60381377809 | U14: =R5C8 -> 4861.1111111111113
B15: 5 | D15: =R[-1]C[3] -> 158504.60381377809 | E15: =RC[-1]*R5C5 -> 1585.0460381377809 | F15: =R6C5-RC[-1] -> 4227.4581791111777 | G15: =RC[-3]-RC[-1] -> 154277.1456346669 | I15: 5 | R15: =RC[-12]+RC[-4] -> 4227.4581791111777 | S15: =RC[-14]+RC[-6] -> 1585.0460381377809 | T15: =RC[-13]+RC[-5] -> 154277.1456346669 | U15: =R5C8 -> 4861.1111111111113
B16: 6 | D16: =R[-1]C[3] -> 154277.1456346669 | E16: =RC[-1]*R5C5 -> 1542.7714563466691 | F16: =R6C5-RC[-1] -> 4269.7327609022896 | G16: =RC[-3]-RC[-1] -> 150007.41287376461 | I16: 6 | R16: =RC[-12]+RC[-4] -> 4269.7327609022896 | S16: =RC[-14]+RC[-6] -> 1542.7714563466691 | T16: =RC[-13]+RC[-5] -> 150007.41287376461 | U16: =R5C8 -> 4861.1111111111113
B17: 7 | D17: =R[-1]C[3] -> 150007.41287376461 | E17: =RC[-1]*R5C5 -> 1500.0741287376461 | F17: =R6C5-RC[-1] -> 4312.4300885113125 | G17: =RC[-3]-RC[-1] -> 145694.98278525329 | I17: 7 | R17: =RC[-12]+RC[-4] -> 4312.4300885113125 | S17: =RC[-14]+RC[-6] -> 1500.0741287376461 | T17: =RC[-13]+RC[-5] -> 145694.98278525329 | U17: =R5C8 -> 4861.1111111111113
B18: 8 | D18: =R[-1]C[3] -> 145694.98278525329 | E18: =RC[-1]*R5C5 -> 1456.949827852533 | F18: =R6C5-RC[-1] -> 4355.5543893964259 | G18: =RC[-3]-RC[-1] -> 141339.42839585687 | I18: 8 | R18: =RC[-12]+RC[-4] -> 4355.5543893964259 | S18: =RC[-14]+RC[-6] -> 1456.949827852533 | T18: =RC[-13]+RC[-5] -> 141339.42839585687 | U18: =R5C8 -> 4861.1111111111113
B19: 9 | D19: =R[-1]C[3] -> 141339.42839585687 | E19: =RC[-1]*R5C5 -> 1413.3942839585686 | F19: =R6C5-RC[-1] -> 4399.1099332903896 | G19: =RC[-3]-RC[-1] -> 136940.31846256647 | I19: 9 | R19: =RC[-12]+RC[-4] -> 4399.1099332903896 | S19: =RC[-14]+RC[-6] -> 1413.3942839585686 | T19: =RC[-13]+RC[-5] -> 136940.31846256647 | U19: =R5C8 -> 4861.1111111111113
B20: 10 | D20: =R[-1]C[3] -> 136940.31846256647 | E20: =RC[-1]*R5C5 -> 1369.4031846256648 | F20: =R6C5-RC[-1] -> 4443.1010326232936 | G20: =RC[-3]-RC[-1] -> 132497.21742994318 | I20: 10 | R20: =RC[-12]+RC[-4] -> 4443.1010326232936 | S20: =RC[-14]+RC[-6] -> 1369.4031846256648 | T20: =RC[-13]+RC[-5] -> 132497.21742994318 | U20: =R5C8 -> 4861.1111111111113
B21: 11 | D21: =R[-1]C[3] -> 132497.21742994318 | E21: =RC[-1]*R5C5 -> 1324.9721742994318 | F21: =R6C5-RC[-1] -> 4487.5320429495268 | G21: =RC[-3]-RC[-1] -> 128009.68538699365 | I21: 11 | R21: =RC[-12]+RC[-4] -> 4487.5320429495268 | S21: =RC[-14]+RC[-6] -> 1324.9721742994318 | T21: =RC[-13]+RC[-5] -> 128009.68538699365 | U21: =R5C8 -> 4861.1111111111113
B22: 12 | D22: =R[-1]C[3] -> 128009.68538699365 | E22: =RC[-1]*R5C5 -> 1280.0968538699365 | F22: =R6C5-RC[-1] -> 4532.4073633790222 | G22: =RC[-3]-RC[-1] -> 123477.27802361462 | I22: 12 | R22: =RC[-12]+RC[-4] -> 4532.4073633790222 | S22: =RC[-14]+RC[-6] -> 1280.0968538699365 | T22: =RC[-13]+RC[-5] -> 123477.27802361462 | U22: =R5C8 -> 4861.1111111111113
B23: 13 | D23: =R[-1]C[3] -> 123477.27802361462 | E23: =RC[-1]*R5C5 -> 1234.7727802361462 | F23: =R6C5-RC[-1] -> 4577.7314370128124 | G23: =RC[-3]-RC[-1] -> 118899.54658660181 | I23: 13 | K23: 1 | L23: =R[-20]C[1] -> 50000 | M23: =RC[-1]*R5C13 -> 500 | N23: =R6C13-RC[-1] -> 1160.7154906425596 | O23: =RC[-3]-RC[-1] -> 48839.284509357443 | R23: =RC[-12]+RC[-4] -> 5738.4469276553718 | S23: =RC[-14]+RC[-6] -> 1734.7727802361462 | T23: =RC[-13]+RC[-5] -> 167738.83109595923 | U23: =R5C8+R5C16 -> 6250
B24: 14 | D24: =R[-1]C[3] -> 118899.54658660181 | E24: =RC[-1]*R5C5 -> 1188.9954658660181 | F24: =R6C5-RC[-1] -> 4623.5087513829403 | G24: =RC[-3]-RC[-1] -> 114276.03783521887 | I24: 14 | K24: 2 | L24: =R[-1]C[3] -> 48839.284509357443 | M24: =RC[-1]*R5C13 -> 488.39284509357446 | N24: =R6C13-RC[-1] -> 1172.3226455489853 | O24: =RC[-3]-RC[-1] -> 47666.961863808458 | R24: =RC[-12]+RC[-4] -> 5795.8313969319261 | S24: =RC[-14]+RC[-6] -> 1677.3883109595927 | T24: =RC[-13]+RC[-5] -> 161942.99969902734 | U24: =R5C8+R5C16 -> 6250
B25: 15 | D25: =R[-1]C[3] -> 114276.03783521887 | E25: =RC[-1]*R5C5 -> 1142.7603783521888 | F25: =R6C5-RC[-1] -> 4669.7438388967694 | G25: =RC[-3]-RC[-1] -> 109606.2939963221 | I25: 15 | K25: 3 | L25: =R[-1]C[3] -> 47666.961863808458 | M25: =RC[-1]*R5C13 -> 476.66961863808456 | N25: =R6C13-RC[-1] -> 1184.0458720044751 | O25: =RC[-3]-RC[-1] -> 46482.91599180398 | R25: =RC[-12]+RC[-4] -> 5853.7897109012447 | S25: =RC[-14]+RC[-6] -> 1619.4299969902734 | T25: =RC[-13]+RC[-5] -> 156089.20998812607 | U25: =R5C8+R5C16 -> 6250
B26: 16 | D26: =R[-1]C[3] -> 109606.2939963221 | E26: =RC[-1]*R5C5 -> 1096.062939963221 | F26: =R6C5-RC[-1] -> 4716.4412772857377 | G26: =RC[-3]-RC[-1] -> 104889.85271903637 | I26: 16 | K26: 4 | L26: =R[-1]C[3] -> 46482.91599180398 | M26: =RC[-1]*R5C13 -> 464.82915991803981 | N26: =R6C13-RC[-1] -> 1195.8863307245199 | O26: =RC[-3]-RC[-1] -> 45287.029661079461 | R26: =RC[-12]+RC[-4] -> 5912.3276080102578 | S26: =RC[-14]+RC[-6] -> 1560.8920998812607 | T26: =RC[-13]+RC[-5] -> 150176.88238011583 | U26: =R5C8+R5C16 -> 6250
B27: 17 | D27: =R[-1]C[3] -> 104889.85271903637 | E27: =RC[-1]*R5C5 -> 1048.8985271903637 | F27: =R6C5-RC[-1] -> 4763.6056900585945 | G27: =RC[-3]-RC[-1] -> 100126.24702897777 | I27: 17 | K27: 5 | L27: =R[-1]C[3] -> 45287.029661079461 | M27: =RC[-1]*R5C13 -> 452.87029661079464 | N27: =R6C13-RC[-1] -> 1207.845194031765 | O27: =RC[-3]-RC[-1] -> 44079.184467047693 | R27: =RC[-12]+RC[-4] -> 5971.45088409036 | S27: =RC[-14]+RC[-6] -> 1501.7688238011583 | T27: =RC[-13]+RC[-5] -> 144205.43149602547 | U27: =R5C8+R5C16 -> 6250
B28: 18 | D28: =R[-1]C[3] -> 100126.24702897777 | E28: =RC[-1]*R5C5 -> 1001.2624702897778 | F28: =R6C5-RC[-1] -> 4811.241746959181 | G28: =RC[-3]-RC[-1] -> 95315.005282018596 | I28: 18 | K28: 6 | L28: =R[-1]C[3] -> 44079.184467047693 | M28: =RC[-1]*R5C13 -> 440.79184467047696 | N28: =R6C13-RC[-1] -> 1219.9236459720828 | O28: =RC[-3]-RC[-1] -> 42859.260821075608 | R28: =RC[-12]+RC[-4] -> 6031.1653929312633 | S28: =RC[-14]+RC[-6] -> 1442.0543149602547 | T28: =RC[-13]+RC[-5] -> 138174.26610309421 | U28: =R5C8+R5C16 -> 6250
B29: 19 | D29: =R[-1]C[3] -> 95315.005282018596 | E29: =RC[-1]*R5C5 -> 953.15005282018592 | F29: =R6C5-RC[-1] -> 4859.3541644287725 | G29: =RC[-3]-RC[-1] -> 90455.651117589819 | I29: 19 | K29: 7 | L29: =R[-1]C[3] -> 42859.260821075608 | M29: =RC[-1]*R5C13 -> 428.59260821075611 | N29: =R6C13-RC[-1] -> 1232.1228824318036 | O29: =RC[-3]-RC[-1] -> 41627.137938643806 | R29: =RC[-12]+RC[-4] -> 6091.4770468605766 | S29: =RC[-14]+RC[-6] -> 1381.7426610309421 | T29: =RC[-13]+RC[-5] -> 132082.78905623363 | U29: =R5C8+R5C16 -> 6250
B30: 20 | D30: =R[-1]C[3] -> 90455.651117589819 | E30: =RC[-1]*R5C5 -> 904.55651117589821 | F30: =R6C5-RC[-1] -> 4907.9477060730605 | G30: =RC[-3]-RC[-1] -> 85547.703411516763 | I30: 20 | K30: 8 | L30: =R[-1]C[3] -> 41627.137938643806 | M30: =RC[-1]*R5C13 -> 416.27137938643807 | N30: =R6C13-RC[-1] -> 1244.4441112561217 | O30: =RC[-3]-RC[-1] -> 40382.693827387688 | R30: =RC[-12]+RC[-4] -> 6152.3918173291822 | S30: =RC[-14]+RC[-6] -> 1320.8278905623363 | T30: =RC[-13]+RC[-5] -> 125930.39723890445 | U30: =R5C8+R5C16 -> 6250
B31: 21 | D31: =R[-1]C[3] -> 85547.703411516763 | E31: =RC[-1]*R5C5 -> 855.47703411516761 | F31: =R6C5-RC[-1] -> 4957.0271831337905 | G31: =RC[-3]-RC[-1] -> 80590.676228382974 | I31: 21 | K31: 9 | L31: =R[-1]C[3] -> 40382.693827387688 | M31: =RC[-1]*R5C13 -> 403.82693827387686 | N31: =R6C13-RC[-1] -> 1256.8885523686827 | O31: =RC[-3]-RC[-1] -> 39125.805275019004 | R31: =RC[-12]+RC[-4] -> 6213.9157355024727 | S31: =RC[-14]+RC[-6] -> 1259.3039723890445 | T31: =RC[-13]+RC[-5] -> 119716.48150340197 | U31: =R5C8+R5C16 -> 6250
B32: 22 | D32: =R[-1]C[3] -> 80590.676228382974 | E32: =RC[-1]*R5C5 -> 805.90676228382972 | F32: =R6C5-RC[-1] -> 5006.5974549651291 | G32: =RC[-3]-RC[-1] -> 75584.078773417845 | I32: 22 | K32: 10 | L32: =R[-1]C[3] -> 39125.805275019004 | M32: =RC[-1]*R5C13 -> 391.25805275019002 | N32: =R6C13-RC[-1] -> 1269.4574378923696 | O32: =RC[-3]-RC[-1] -> 37856.347837126632 | R32: =RC[-12]+RC[-4] -> 6276.054892857499 | S32: =RC[-14]+RC[-6] -> 1197.1648150340197 | T32: =RC[-13]+RC[-5] -> 113440.42661054447 | U32: =R5C8+R5C16 -> 6250
B33: 23 | D33: =R[-1]C[3] -> 75584.078773417845 | E33: =RC[-1]*R5C5 -> 755.84078773417843 | F33: =R6C5-RC[-1] -> 5056.6634295147796 | G33: =RC[-3]-RC[-1] -> 70527.415343903063 | I33: 23 | K33: 11 | L33: =R[-1]C[3] -> 37856.347837126632 | M33: =RC[-1]*R5C13 -> 378.56347837126634 | N33: =R6C13-RC[-1] -> 1282.1520122712932 | O33: =RC[-3]-RC[-1] -> 36574.195824855342 | R33: =RC[-12]+RC[-4] -> 6338.8154417860733 | S33: =RC[-14]+RC[-6] -> 1134.4042661054448 | T33: =RC[-13]+RC[-5] -> 107101.61116875841 | U33: =R5C8+R5C16 -> 6250
B34: 24 | D34: =R[-1]C[3] -> 70527.415343903063 | E34: =RC[-1]*R5C5 -> 705.27415343903067 | F34: =R6C5-RC[-1] -> 5107.2300638099277 | G34: =RC[-3]-RC[-1] -> 65420.185280093137 | I34: 24 | K34: 12 | L34: =R[-1]C[3] -> 36574.195824855342 | M34: =RC[-1]*R5C13 -> 365.74195824855343 | N34: =R6C13-RC[-1] -> 1294.9735323940063 | O34: =RC[-3]-RC[-1] -> 35279.222292461338 | R34: =RC[-12]+RC[-4] -> 6402.2035962039336 | S34: =RC[-14]+RC[-6] -> 1071.016111687584 | T34: =RC[-13]+RC[-5] -> 100699.40757255448 | U34: =R5C8+R5C16 -> 6250
B35: 25 | D35: =R[-1]C[3] -> 65420.185280093137 | E35: =RC[-1]*R5C5 -> 654.20185280093142 | F35: =R6C5-RC[-1] -> 5158.3023644480272 | G35: =RC[-3]-RC[-1] -> 60261.88291564511 | I35: 25 | K35: 13 | L35: =R[-1]C[3] -> 35279.222292461338 | M35: =RC[-1]*R5C13 -> 352.79222292461338 | N35: =R6C13-RC[-1] -> 1307.9232677179461 | O35: =RC[-3]-RC[-1] -> 33971.299024743392 | R35: =RC[-12]+RC[-4] -> 6466.2256321659734 | S35: =RC[-14]+RC[-6] -> 1006.9940757255448 | T35: =RC[-13]+RC[-5] -> 94233.181940388502 | U35: =R5C8+R5C16 -> 6250
B36: 26 | D36: =R[-1]C[3] -> 60261.88291564511 | E36: =RC[-1]*R5C5 -> 602.61882915645117 | F36: =R6C5-RC[-1] -> 5209.8853880925071 | G36: =RC[-3]-RC[-1] -> 55051.997527552601 | I36: 26 | K36: 14 | L36: =R[-1]C[3] -> 33971.299024743392 | M36: =RC[-1]*R5C13 -> 339.71299024743394 | N36: =R6C13-RC[-1] -> 1321.0025003951257 | O36: =RC[-3]-RC[-1] -> 32650.296524348265 | R36: =RC[-12]+RC[-4] -> 6530.8878884876331 | S36: =RC[-14]+RC[-6] -> 942.33181940388511 | T36: =RC[-13]+RC[-5] -> 87702.29405190087 | U36: =R5C8+R5C16 -> 6250
B37: 27 | D37: =R[-1]C[3] -> 55051.997527552601 | E37: =RC[-1]*R5C5 -> 550.51997527552601 | F37: =R6C5-RC[-1] -> 5261.9842419734323 | G37: =RC[-3]-RC[-1] -> 49790.013285579167 | I37: 27 | K37: 15 | L37: =R[-1]C[3] -> 32650.296524348265 | M37: =RC[-1]*R5C13 -> 326.50296524348266 | N37: =R6C13-RC[-1] -> 1334.2125253990771 | O37: =RC[-3]-RC[-1] -> 31316.083998949187 | R37: =RC[-12]+RC[-4] -> 6596.1967673725094 | S37: =RC[-14]+RC[-6] -> 877.02294051900867 | T37: =RC[-13]+RC[-5] -> 81106.097284528354 | U37: =R5C8+R5C16 -> 6250
B38: 28 | D38: =R[-1]C[3] -> 49790.013285579167 | E38: =RC[-1]*R5C5 -> 497.9001328557917 | F38: =R6C5-RC[-1] -> 5314.6040843931669 | G38: =RC[-3]-RC[-1] -> 44475.409201185998 | I38: 28 | K38: 16 | L38: =R[-1]C[3] -> 31316.083998949187 | M38: =RC[-1]*R5C13 -> 313.16083998949188 | N38: =R6C13-RC[-1] -> 1347.5546506530677 | O38: =RC[-3]-RC[-1] -> 29968.529348296121 | R38: =RC[-12]+RC[-4] -> 6662.1587350462341 | S38: =RC[-14]+RC[-6] -> 811.06097284528357 | T38: =RC[-13]+RC[-5] -> 74443.938549482118 | U38: =R5C8+R5C16 -> 6250
B39: 29 | D39: =R[-1]C[3] -> 44475.409201185998 | E39: =RC[-1]*R5C5 -> 444.75409201186 | F39: =R6C5-RC[-1] -> 5367.7501252370985 | G39: =RC[-3]-RC[-1] -> 39107.659075948897 | I39: 29 | K39: 17 | L39: =R[-1]C[3] -> 29968.529348296121 | M39: =RC[-1]*R5C13 -> 299.68529348296119 | N39: =R6C13-RC[-1] -> 1361.0301971595984 | O39: =RC[-3]-RC[-1] -> 28607.499151136522 | R39: =RC[-12]+RC[-4] -> 6728.7803223966966 | S39: =RC[-14]+RC[-6] -> 744.43938549482118 | T39: =RC[-13]+RC[-5] -> 67715.158227085427 | U39: =R5C8+R5C16 -> 6250
B40: 30 | D40: =R[-1]C[3] -> 39107.659075948897 | E40: =RC[-1]*R5C5 -> 391.07659075948897 | F40: =R6C5-RC[-1] -> 5421.4276264894697 | G40: =RC[-3]-RC[-1] -> 33686.231449459425 | I40: 30 | K40: 18 | L40: =R[-1]C[3] -> 28607.499151136522 | M40: =RC[-1]*R5C13 -> 286.07499151136523 | N40: =R6C13-RC[-1] -> 1374.6404991311945 | O40: =RC[-3]-RC[-1] -> 27232.858652005329 | R40: =RC[-12]+RC[-4] -> 6796.0681256206644 | S40: =RC[-14]+RC[-6] -> 677.15158227085419 | T40: =RC[-13]+RC[-5] -> 60919.090101464753 | U40: =R5C8+R5C16 -> 6250
B41: 31 | D41: =R[-1]C[3] -> 33686.231449459425 | E41: =RC[-1]*R5C5 -> 336.86231449459427 | F41: =R6C5-RC[-1] -> 5475.6419027543643 | G41: =RC[-3]-RC[-1] -> 28210.589546705061 | I41: 31 | K41: 19 | L41: =R[-1]C[3] -> 27232.858652005329 | M41: =RC[-1]*R5C13 -> 272.32858652005331 | N41: =R6C13-RC[-1] -> 1388.3869041225064 | O41: =RC[-3]-RC[-1] -> 25844.471747882821 | R41: =RC[-12]+RC[-4] -> 6864.0288068768705 | S41: =RC[-14]+RC[-6] -> 609.19090101464758 | T41: =RC[-13]+RC[-5] -> 54055.061294587882 | U41: =R5C8+R5C16 -> 6250
B42: 32 | D42: =R[-1]C[3] -> 28210.589546705061 | E42: =RC[-1]*R5C5 -> 282.10589546705063 | F42: =R6C5-RC[-1] -> 5530.3983217819077 | G42: =RC[-3]-RC[-1] -> 22680.191224923154 | I42: 32 | K42: 20 | L42: =R[-1]C[3] -> 25844.471747882821 | M42: =RC[-1]*R5C13 -> 258.44471747882824 | N42: =R6C13-RC[-1] -> 1402.2707731637315 | O42: =RC[-3]-RC[-1] -> 24442.20097471909 | R42: =RC[-12]+RC[-4] -> 6932.6690949456388 | S42: =RC[-14]+RC[-6] -> 540.55061294587881 | T42: =RC[-13]+RC[-5] -> 47122.392199642243 | U42: =R5C8+R5C16 -> 6250
B43: 33 | D43: =R[-1]C[3] -> 22680.191224923154 | E43: =RC[-1]*R5C5 -> 226.80191224923155 | F43: =R6C5-RC[-1] -> 5585.7023049997269 | G43: =RC[-3]-RC[-1] -> 17094.488919923428 | I43: 33 | K43: 21 | L43: =R[-1]C[3] -> 24442.20097471909 | M43: =RC[-1]*R5C13 -> 244.42200974719091 | N43: =R6C13-RC[-1] -> 1416.2934808953687 | O43: =RC[-3]-RC[-1] -> 23025.907493823721 | R43: =RC[-12]+RC[-4] -> 7001.9957858950957 | S43: =RC[-14]+RC[-6] -> 471.22392199642246 | T43: =RC[-13]+RC[-5] -> 40120.396413747148 | U43: =R5C8+R5C16 -> 6250
B44: 34 | D44: =R[-1]C[3] -> 17094.488919923428 | E44: =RC[-1]*R5C5 -> 170.94488919923427 | F44: =R6C5-RC[-1] -> 5641.5593280497242 | G44: =RC[-3]-RC[-1] -> 11452.929591873704 | I44: 34 | K44: 22 | L44: =R[-1]C[3] -> 23025.907493823721 | M44: =RC[-1]*R5C13 -> 230.25907493823721 | N44: =R6C13-RC[-1] -> 1430.4564157043224 | O44: =RC[-3]-RC[-1] -> 21595.451078119397 | R44: =RC[-12]+RC[-4] -> 7072.0157437540465 | S44: =RC[-14]+RC[-6] -> 401.20396413747147 | T44: =RC[-13]+RC[-5] -> 33048.380669993101 | U44: =R5C8+R5C16 -> 6250
B45: 35 | D45: =R[-1]C[3] -> 11452.929591873704 | E45: =RC[-1]*R5C5 -> 114.52929591873705 | F45: =R6C5-RC[-1] -> 5697.9749213302212 | G45: =RC[-3]-RC[-1] -> 5754.9546705434832 | I45: 35 | K45: 23 | L45: =R[-1]C[3] -> 21595.451078119397 | M45: =RC[-1]*R5C13 -> 215.95451078119396 | N45: =R6C13-RC[-1] -> 1444.7609798613657 | O45: =RC[-3]-RC[-1] -> 20150.69009825803 | R45: =RC[-12]+RC[-4] -> 7142.7359011915869 | S45: =RC[-14]+RC[-6] -> 330.48380669993099 | T45: =RC[-13]+RC[-5] -> 25905.644768801514 | U45: =R5C8+R5C16 -> 6250
B46: 36 | D46: =R[-1]C[3] -> 5754.9546705434832 | E46: =RC[-1]*R5C5 -> 57.549546705434835 | F46: =R6C5-RC[-1] -> 5754.9546705435232 | G46: =RC[-3]-RC[-1] -> -4.0017766878008842E-11 | I46: 36 | K46: 24 | L46: =R[-1]C[3] -> 20150.69009825803 | M46: =RC[-1]*R5C13 -> 201.50690098258031 | N46: =R6C13-RC[-1] -> 1459.2085896599792 | O46: =RC[-3]-RC[-1] -> 18691.481508598052 | R46: =RC[-12]+RC[-4] -> 7214.1632602035024 | S46: =RC[-14]+RC[-6] -> 259.05644768801517 | T46: =RC[-13]+RC[-5] -> 18691.481508598012 | U46: =R5C8+R5C16 -> 6250
I47: 37 | K47: 25 | L47: =R[-1]C[3] -> 18691.481508598052 | M47: =RC[-1]*R5C13 -> 186.91481508598051 | N47: =R6C13-RC[-1] -> 1473.8006755565791 | O47: =RC[-3]-RC[-1] -> 17217.680833041471 | R47: =RC[-12]+RC[-4] -> 1473.8006755565791 | S47: =RC[-14]+RC[-6] -> 186.91481508598051 | T47: =RC[-13]+RC[-5] -> 17217.680833041471 | U47: =R5C16 -> 1388.8888888888889
I48: 38 | K48: 26 | L48: =R[-1]C[3] -> 17217.680833041471 | M48: =RC[-1]*R5C13 -> 172.17680833041473 | N48: =R6C13-RC[-1] -> 1488.5386823121448 | O48: =RC[-3]-RC[-1] -> 15729.142150729327 | R48: =RC[-12]+RC[-4] -> 1488.5386823121448 | S48: =RC[-14]+RC[-6] -> 172.17680833041473 | T48: =RC[-13]+RC[-5] -> 15729.142150729327 | U48: =R5C16 -> 1388.8888888888889
K49: 27 | L49: =R[-1]C[3] -> 15729.142150729327 | M49: =RC[-1]*R5C13 -> 157.29142150729328 | N49: =R6C13-RC[-1] -> 1503.4240691352663 | O49: =RC[-3]-RC[-1] -> 14225.718081594061 | R49: =RC[-12]+RC[-4] -> 1503.4240691352663 | S49: =RC[-14]+RC[-6] -> 157.29142150729328 | T49: =RC[-13]+RC[-5] -> 14225.718081594061 | U49: =R5C16 -> 1388.8888888888889
K50: 28 | L50: =R[-1]C[3] -> 14225.718081594061 | M50: =RC[-1]*R5C13 -> 142.25718081594061 | N50: =R6C13-RC[-1] -> 1518.4583098266189 | O50: =RC[-3]-RC[-1] -> 12707.259771767442 | R50: =RC[-12]+RC[-4] -> 1518.4583098266189 | S50: =RC[-14]+RC[-6] -> 142.25718081594061 | T50: =RC[-13]+RC[-5] -> 12707.259771767442 | U50: =R5C16 -> 1388.8888888888889
K51: 29 | L51: =R[-1]C[3] -> 12707.259771767442 | M51: =RC[-1]*R5C13 -> 127.07259771767441 | N51: =R6C13-RC[-1] -> 1533.6428929248852 | O51: =RC[-3]-RC[-1] -> 11173.616878842557 | R51: =RC[-12]+RC[-4] -> 1533.6428929248852 | S51: =RC[-14]+RC[-6] -> 127.07259771767441 | T51: =RC[-13]+RC[-5] -> 11173.616878842557 | U51: =R5C16 -> 1388.8888888888889
K52: 30 | L52: =R[-1]C[3] -> 11173.616878842557 | M52: =RC[-1]*R5C13 -> 111.73616878842557 | N52: =R6C13-RC[-1] -> 1548.979321854134 | O52: =RC[-3]-RC[-1] -> 9624.6375569884221 | R52: =RC[-12]+RC[-4] -> 1548.979321854134 | S52: =RC[-14]+RC[-6] -> 111.73616878842557 | T52: =RC[-13]+RC[-5] -> 9624.6375569884221 | U52: =R5C16 -> 1388.8888888888889
K53: 31 | L53: =R[-1]C[3] -> 9624.6375569884221 | M53: =RC[-1]*R5C13 -> 96.246375569884222 | N53: =R6C13-RC[-1] -> 1564.4691150726753 | O53: =RC[-3]-RC[-1] -> 8060.1684419157464 | R53: =RC[-12]+RC[-4] -> 1564.4691150726753 | S53: =RC[-14]+RC[-6] -> 96.246375569884222 | T53: =RC[-13]+RC[-5] -> 8060.1684419157464 | U53: =R5C16 -> 1388.8888888888889
K54: 32 | L54: =R[-1]C[3] -> 8060.1684419157464 | M54: =RC[-1]*R5C13 -> 80.601684419157465 | N54: =R6C13-RC[-1] -> 1580.1138062234022 | O54: =RC[-3]-RC[-1] -> 6480.0546356923442 | R54: =RC[-12]+RC[-4] -> 1580.1138062234022 | S54: =RC[-14]+RC[-6] -> 80.601684419157465 | T54: =RC[-13]+RC[-5] -> 6480.0546356923442 | U54: =R5C16 -> 1388.8888888888889
K55: 33 | L55: =R[-1]C[3] -> 6480.0546356923442 | M55: =RC[-1]*R5C13 -> 64.800546356923448 | N55: =R6C13-RC[-1] -> 1595.9149442856362 | O55: =RC[-3]-RC[-1] -> 4884.1396914067082 | R55: =RC[-12]+RC[-4] -> 1595.9149442856362 | S55: =RC[-14]+RC[-6] -> 64.800546356923448 | T55: =RC[-13]+RC[-5] -> 4884.1396914067082 | U55: =R5C16 -> 1388.8888888888889
K56: 34 | L56: =R[-1]C[3] -> 4884.1396914067082 | M56: =RC[-1]*R5C13 -> 48.841396914067083 | N56: =R6C13-RC[-1] -> 1611.8740937284927 | O56: =RC[-3]-RC[-1] -> 3272.2655976782153 | R56: =RC[-12]+RC[-4] -> 1611.8740937284927 | S56: =RC[-14]+RC[-6] -> 48.841396914067083 | T56: =RC[-13]+RC[-5] -> 3272.2655976782153 | U56: =R5C16 -> 1388.8888888888889
K57: 35 | L57: =R[-1]C[3] -> 3272.2655976782153 | M57: =RC[-1]*R5C13 -> 32.72265597678215 | N57: =R6C13-RC[-1] -> 1627.9928346657775 | O57: =RC[-3]-RC[-1] -> 1644.2727630124377 | R57: =RC[-12]+RC[-4] -> 1627.9928346657775 | S57: =RC[-14]+RC[-6] -> 32.72265597678215 | T57: =RC[-13]+RC[-5] -> 1644.2727630124377 | U57: =R5C16 -> 1388.8888888888889
K58: 36 | L58: =R[-1]C[3] -> 1644.2727630124377 | M58: =RC[-1]*R5C13 -> 16.442727630124377 | N58: =R6C13-RC[-1] -> 1644.2727630124352 | O58: =RC[-3]-RC[-1] -> 2.5011104298755527E-12 | R58: =RC[-12]+RC[-4] -> 1644.2727630124352 | S58: =RC[-14]+RC[-6] -> 16.442727630124377 | T58: =RC[-13]+RC[-5] -> 2.5011104298755527E-12 | U58: =R5C16 -> 1388.8888888888889

Sheet: ServiceExpense
A1: Service Expenses per Month | B1: Pre-Raise | E1: Service Expenses per month | F1: Post-Raise
A3: Note: Service Expenses feed into the Monthly P&L
B5: Monthly Expense | F5: Monthly Expense
A6: Office Space | B6: 20000 | E6: Office Space | F6: 25000
A7: Utilities | B7: 4000 | E7: Utilities | F7: 4400
A8: Insurance | B8: 12000 | E8: Insurance | F8: 14000
A9: Telecom & Internet Expenses | B9: 5000 | E9: Telecom & Internet Expenses | F9: 6000
A10: Office Supplies | B10: 450 | E10: Office Supplies | F10: 500
A11: Overhead Total | B11: =SUM(R[-5]C:R[-1]C) -> 41450 | E11: Overhead Total | F11: =SUM(R[-5]C:R[-1]C) -> 49900
A13: Group Specific Expenses | E13: Group Specific Expenses
A15: Sales & Marketing Expenses | E15: Sales & Marketing Expenses
A16: Percent of Overhead Above | E16: Percent of Overhead Above
A17: 0.3 | B17: =RC[-1]*R11C2 -> 12435 | E17: 0.3 | F17: =RC[-1]*R11C6 -> 14970
A18: Travel | B18: 25000 | E18: Travel | F18: 40000
A19: Mail & email campaigns | B19: 5000 | E19: Mail & email campaigns | F19: 10000
A20: Conference Expenses | B20: 5000 | E20: Conference Expenses | F20: 10000
A21: Web Marketing and Advertising | B21: 2000 | E21: Web Marketing and Advertising | F21: 3500
A22: Print Advertising | B22: - | E22: Print Advertising | F22: 3000
A23: RIMM Pager Services | B23: 750 | E23: RIMM Pager Services | F23: 850
A24: Wireless Charges | B24: 600 | E24: Wireless Charges | F24: 750
A25: Group Total | B25: =SUM(R[-8]C:R[-1]C) -> 50785 | E25: Group Total | F25: =SUM(R[-8]C:R[-1]C) -> 83070
A27: Research & Development Expenses | E27: Research & Development Expenses
A28: Percent of Overhead Above | E28: Percent of Overhead Above
A29: 0.4 | B29: =RC[-1]*R11C2 -> 16580 | E29: 0.4 | F29: =RC[-1]*R11C6 -> 19960
A30: Travel | B30: 3000 | E30: Travel | F30: 5000
A31: OEM Software Licenses | B31: 20000 | E31: OEM Software Licenses | F31: 25000
A32: Training | B32: 4000 | E32: Training | F32: 6000
A33: Group Total | B33: =SUM(R[-4]C:R[-1]C) -> 43580 | E33: Group Total | F33: =SUM(R[-4]C:R[-1]C) -> 55960
A35: General & Administrative | E35: General & Administrative
A36: Percent of Overhead Above | E36: Percent of Overhead Above
A37: 0.3 | B37: =RC[-1]*R11C2 -> 12435 | E37: 0.3 | F37: =RC[-1]*R11C6 -> 14970
A38: Installation and Maintenance | B38: 15000 | E38: Installation and Maintenance | F38: 15000
A39: Travel | B39: 4000 | E39: Travel | F39: 5000
A40: Legal Expenses | B40: 3000 | E40: Legal | F40: 3500
A41: Accounting | B41: 2500 | E41: Accounting | F41: 3000
A42: Recruiting | B42: 1500 | E42: Recruiting | F42: 1500
A43: Mail | B43: 400 | E43: Mail | F43: 500
A44: Group Total | B44: =SUM(R[-7]C:R[-1]C) -> 38835 | E44: Group Total | F44: =SUM(R[-7]C:R[-1]C) -> 43470
A46: Total | B46: =SUM(R[-21]C,R[-13]C,R[-2]C) -> 133200 | E46: Total | F46: =SUM(R[-21]C,R[-13]C,R[-2]C) -> 182500

Sheet: PipelineAssumptions
A1: Enterprise Pipeline Assumptions
A6: Status | B6: Description | D6: Liklihood deal closes this Quarter | E6: Liklihood deal closes next Quarter
A7: Closed | B7: Deal signed | D7: 1 | E7: 0
A8: Contract | B8: Contract Negotiation | D8: 0.7 | E8: 0.8
A9: Eval | B9: Evaluating and piloting software | D9: 0.3 | E9: 0.65
A10: Proposal | B10: Reviewing responses to RFPs | D10: 0.2 | E10: 0.4
A11: Require | B11: Establishing requirements | D11: 0.05 | E11: 0.25
A12: Response | B12: Response to email or sales call | D12: 0.02 | E12: 0.05
A15: License Fee | B15: Description
A16: 40000 | B16: Up front License
A17: 50 | B17: Up front charge per user
A18: 10 | B18: Monthly Recurring Charge per user

Sheet: Pipeline
A1: Enterprise Pipeline
A2: Q1 2002
A3: As of: | B3: 2003-01-31T00:00:00.000
A6: Prospect | B6: Status | C6: Potential Users | D6: Sales Contact | E6: Potential Contract Size | F6: Discount (needs CEO approval) | G6: Recurring Rev per month | H6: Potential Rev this Quarter | I6: Potential Rev Next Quarter | J6: Description | K6: Lead Generation
A7: SE Financial Institution | B7: Closed | C7: 400 | D7: VP Sales | E7: =PipelineAssumptions!R16C1+(PipelineAssumptions!R17C1*Pipeline!RC[-2]) -> 60000 | F7: 0.1 | G7: =IF(RC[-5]="Closed",PipelineAssumptions!R18C1*Pipeline!RC[-4],"-") -> 4000 | H7: =IF(RC2="Closed",RC5*(1-RC6),IF(RC2="Contract",((PipelineAssumptions!R16C1+PipelineAssumptions!R17C1*Pipeline!RC3)*PipelineAssumptions!R8C4),IF(RC2="Eval",((PipelineAssumptions!R16C1+PipelineAssumptions!R17C1*Pipeline!RC3)*PipelineAssumptions!R9C4),IF(RC2="Proposal",((PipelineAssumptions!R16C1+PipelineAssumptions!R17C1*Pipeline!RC3)*PipelineAssumptions!R10C4),IF(RC2="Require",((PipelineAssumptions!R16C1+PipelineAssumptions!R17C1*Pipeline!RC3)*PipelineAssumptions!R11C4),IF(RC2="Response",((PipelineAssumptions!R16C1+PipelineAssumptions!R17C1*Pipeline!RC3)*PipelineAssumptions!R12C4),0)))))) -> 54000 | I7: =IF(RC2="Closed",RC[-2]*3,IF(RC2="Contract",((RC[-4]-RC[-1])*PipelineAssumptions!R8C5),IF(RC2="Eval",((RC[-4]-RC[-1])*PipelineAssumptions!R9C5),IF(RC2="Proposal",((RC[-4]-RC[-1])*PipelineAssumptions!R10C5),IF(RC2="Require",((RC[-4]-RC[-1])*PipelineAssumptions!R11C5),IF(RC2="Response",((RC[-4]-RC[-1])*PipelineAssumptions!R12C5),0)))))) -> 12000 | J7: Sales cycle 5 months | K7: CEO contact
A8: Retail firm | B8: Contract | C8: 100 | D8: Sales Assoc2 | E8: =PipelineAssumptions!R16C1+(PipelineAssumptions!R17C1*Pipeline!RC[-2]) -> 45000 | G8: =IF(RC[-5]="Closed",PipelineAssumptions!R18C1*Pipeline!RC[-4],"-") -> - | H8: =IF(RC2="Closed",RC5*(1-RC6),IF(RC2="Contract",((PipelineAssumptions!R16C1+PipelineAssumptions!R17C1*Pipeline!RC3)*PipelineAssumptions!R8C4),IF(RC2="Eval",((PipelineAssumptions!R16C1+PipelineAssumptions!R17C1*Pipeline!RC3)*PipelineAssumptions!R9C4),IF(RC2="Proposal",((PipelineAssumptions!R16C1+PipelineAssumptions!R17C1*Pipeline!RC3)*PipelineAssumptions!R10C4),IF(RC2="Require",((PipelineAssumptions!R16C1+PipelineAssumptions!R17C1*Pipeline!RC3)*PipelineAssumptions!R11C4),IF(RC2="Response",((PipelineAssumptions!R16C1+PipelineAssumptions!R17C1*Pipeline!RC3)*PipelineAssumptions!R12C4),0)))))) -> 31499.999999999996 | I8: =IF(RC2="Closed",RC[-2]*3,IF(RC2="Contract",((RC[-4]-RC[-1])*PipelineAssumptions!R8C5),IF(RC2="Eval",((RC[-4]-RC[-1])*PipelineAssumptions!R9C5),IF(RC2="Proposal",((RC[-4]-RC[-1])*PipelineAssumptions!R10C5),IF(RC2="Require",((RC[-4]-RC[-1])*PipelineAssumptions!R11C5),IF(RC2="Response",((RC[-4]-RC[-1])*PipelineAssumptions!R12C5),0)))))) -> 10800.000000000004 | J8: Finalizing details | K8: email
A9: Software sales force | B9: Contract | C9: 200 | D9: Sales Assoc1 | E9: =PipelineAssumptions!R16C1+(PipelineAssumptions!R17C1*Pipeline!RC[-2]) -> 50000 | G9: =IF(RC[-5]="Closed",PipelineAssumptions!R18C1*Pipeline!RC[-4],"-") -> - | H9: =IF(RC2="Closed",RC5*(1-RC6),IF(RC2="Contract",((PipelineAssumptions!R16C1+PipelineAssumptions!R17C1*Pipeline!RC3)*PipelineAssumptions!R8C4),IF(RC2="Eval",((PipelineAssumptions!R16C1+PipelineAssumptions!R17C1*Pipeline!RC3)*PipelineAssumptions!R9C4),IF(RC2="Proposal",((PipelineAssumptions!R16C1+PipelineAssumptions!R17C1*Pipeline!RC3)*PipelineAssumptions!R10C4),IF(RC2="Require",((PipelineAssumptions!R16C1+PipelineAssumptions!R17C1*Pipeline!RC3)*PipelineAssumptions!R11C4),IF(RC2="Response",((PipelineAssumptions!R16C1+PipelineAssumptions!R17C1*Pipeline!RC3)*PipelineAssumptions!R12C4),0)))))) -> 35000 | I9: =IF(RC2="Closed",RC[-2]*3,IF(RC2="Contract",((RC[-4]-RC[-1])*PipelineAssumptions!R8C5),IF(RC2="Eval",((RC[-4]-RC[-1])*PipelineAssumptions!R9C5),IF(RC2="Proposal",((RC[-4]-RC[-1])*PipelineAssumptions!R10C5),IF(RC2="Require",((RC[-4]-RC[-1])*PipelineAssumptions!R11C5),IF(RC2="Response",((RC[-4]-RC[-1])*PipelineAssumptions!R12C5),0)))))) -> 12000 | J9: Need C-level approval | K9: Sales call
A10: Manufact firm sales force | B10: Contract | C10: 400 | D10: VP Sales | E10: =PipelineAssumptions!R16C1+(PipelineAssumptions!R17C1*Pipeline!RC[-2]) -> 60000 | G10: =IF(RC[-5]="Closed",PipelineAssumptions!R18C1*Pipeline!RC[-4],"-") -> - | H10: =IF(RC2="Closed",RC5*(1-RC6),IF(RC2="Contract",((PipelineAssumptions!R16C1+PipelineAssumptions!R17C1*Pipeline!RC3)*PipelineAssumptions!R8C4),IF(RC2="Eval",((PipelineAssumptions!R16C1+PipelineAssumptions!R17C1*Pipeline!RC3)*PipelineAssumptions!R9C4),IF(RC2="Proposal",((PipelineAssumptions!R16C1+PipelineAssumptions!R17C1*Pipeline!RC3)*PipelineAssumptions!R10C4),IF(RC2="Require",((PipelineAssumptions!R16C1+PipelineAssumptions!R17C1*Pipeline!RC3)*PipelineAssumptions!R11C4),IF(RC2="Response",((PipelineAssumptions!R16C1+PipelineAssumptions!R17C1*Pipeline!RC3)*PipelineAssumptions!R12C4),0)))))) -> 42000 | I10: =IF(RC2="Closed",RC[-2]*3,IF(RC2="Contract",((RC[-4]-RC[-1])*PipelineAssumptions!R8C5),IF(RC2="Eval",((RC[-4]-RC[-1])*PipelineAssumptions!R9C5),IF(RC2="Proposal",((RC[-4]-RC[-1])*PipelineAssumptions!R10C5),IF(RC2="Require",((RC[-4]-RC[-1])*PipelineAssumptions!R11C5),IF(RC2="Response",((RC[-4]-RC[-1])*PipelineAssumptions!R12C5),0)))))) -> 14400 | J10: Working out logistics | K10: Conference contact
A11: Law enforcement group | B11: Contract | C11: 500 | D11: Sales Assoc1 | E11: =PipelineAssumptions!R16C1+(PipelineAssumptions!R17C1*Pipeline!RC[-2]) -> 65000 | G11: =IF(RC[-5]="Closed",PipelineAssumptions!R18C1*Pipeline!RC[-4],"-") -> - | H11: =IF(RC2="Closed",RC5*(1-RC6),IF(RC2="Contract",((PipelineAssumptions!R16C1+PipelineAssumptions!R17C1*Pipeline!RC3)*PipelineAssumptions!R8C4),IF(RC2="Eval",((PipelineAssumptions!R16C1+PipelineAssumptions!R17C1*Pipeline!RC3)*PipelineAssumptions!R9C4),IF(RC2="Proposal",((PipelineAssumptions!R16C1+PipelineAssumptions!R17C1*Pipeline!RC3)*PipelineAssumptions!R10C4),IF(RC2="Require",((PipelineAssumptions!R16C1+PipelineAssumptions!R17C1*Pipeline!RC3)*PipelineAssumptions!R11C4),IF(RC2="Response",((PipelineAssumptions!R16C1+PipelineAssumptions!R17C1*Pipeline!RC3)*PipelineAssumptions!R12C4),0)))))) -> 45500 | I11: =IF(RC2="Closed",RC[-2]*3,IF(RC2="Contract",((RC[-4]-RC[-1])*PipelineAssumptions!R8C5),IF(RC2="Eval",((RC[-4]-RC[-1])*PipelineAssumptions!R9C5),IF(RC2="Proposal",((RC[-4]-RC[-1])*PipelineAssumptions!R10C5),IF(RC2="Require",((RC[-4]-RC[-1])*PipelineAssumptions!R11C5),IF(RC2="Response",((RC[-4]-RC[-1])*PipelineAssumptions!R12C5),0)))))) -> 15600 | J11: Fast tracking though approval | K11: Sales contact
A12: Conglomerate Mgmt team | B12: Eval | C12: 200 | D12: VP Sales | E12: =PipelineAssumptions!R16C1+(PipelineAssumptions!R17C1*Pipeline!RC[-2]) -> 50000 | G12: =IF(RC[-5]="Closed",PipelineAssumptions!R18C1*Pipeline!RC[-4],"-") -> - | H12: =IF(RC2="Closed",RC5*(1-RC6),IF(RC2="Contract",((PipelineAssumptions!R16C1+PipelineAssumptions!R17C1*Pipeline!RC3)*PipelineAssumptions!R8C4),IF(RC2="Eval",((PipelineAssumptions!R16C1+PipelineAssumptions!R17C1*Pipeline!RC3)*PipelineAssumptions!R9C4),IF(RC2="Proposal",((PipelineAssumptions!R16C1+PipelineAssumptions!R17C1*Pipeline!RC3)*PipelineAssumptions!R10C4),IF(RC2="Require",((PipelineAssumptions!R16C1+PipelineAssumptions!R17C1*Pipeline!RC3)*PipelineAssumptions!R11C4),IF(RC2="Response",((PipelineAssumptions!R16C1+PipelineAssumptions!R17C1*Pipeline!RC3)*PipelineAssumptions!R12C4),0)))))) -> 15000 | I12: =IF(RC2="Closed",RC[-2]*3,IF(RC2="Contract",((RC[-4]-RC[-1])*PipelineAssumptions!R8C5),IF(RC2="Eval",((RC[-4]-RC[-1])*PipelineAssumptions!R9C5),IF(RC2="Proposal",((RC[-4]-RC[-1])*PipelineAssumptions!R10C5),IF(RC2="Require",((RC[-4]-RC[-1])*PipelineAssumptions!R11C5),IF(RC2="Response",((RC[-4]-RC[-1])*PipelineAssumptions!R12C5),0)))))) -> 22750 | J12: Pilot in place | K12: Sales contact
A13: Pharma Sales | B13: Eval | C13: 400 | D13: VP Sales | E13: =PipelineAssumptions!R16C1+(PipelineAssumptions!R17C1*Pipeline!RC[-2]) -> 60000 | G13: =IF(RC[-5]="Closed",PipelineAssumptions!R18C1*Pipeline!RC[-4],"-") -> - | H13: =IF(RC2="Closed",RC5*(1-RC6),IF(RC2="Contract",((PipelineAssumptions!R16C1+PipelineAssumptions!R17C1*Pipeline!RC3)*PipelineAssumptions!R8C4),IF(RC2="Eval",((PipelineAssumptions!R16C1+PipelineAssumptions!R17C1*Pipeline!RC3)*PipelineAssumptions!R9C4),IF(RC2="Proposal",((PipelineAssumptions!R16C1+PipelineAssumptions!R17C1*Pipeline!RC3)*PipelineAssumptions!R10C4),IF(RC2="Require",((PipelineAssumptions!R16C1+PipelineAssumptions!R17C1*Pipeline!RC3)*PipelineAssumptions!R11C4),IF(RC2="Response",((PipelineAssumptions!R16C1+PipelineAssumptions!R17C1*Pipeline!RC3)*PipelineAssumptions!R12C4),0)))))) -> 18000 | I13: =IF(RC2="Closed",RC[-2]*3,IF(RC2="Contract",((RC[-4]-RC[-1])*PipelineAssumptions!R8C5),IF(RC2="Eval",((RC[-4]-RC[-1])*PipelineAssumptions!R9C5),IF(RC2="Proposal",((RC[-4]-RC[-1])*PipelineAssumptions!R10C5),IF(RC2="Require",((RC[-4]-RC[-1])*PipelineAssumptions!R11C5),IF(RC2="Response",((RC[-4]-RC[-1])*PipelineAssumptions!R12C5),0)))))) -> 27300 | J13: Testing integration | K13: Cold call
A14: Southern Fin Institution | B14: Proposal | C14: 500 | D14: Sales Assoc2 | E14: =PipelineAssumptions!R16C1+(PipelineAssumptions!R17C1*Pipeline!RC[-2]) -> 65000 | G14: =IF(RC[-5]="Closed",PipelineAssumptions!R18C1*Pipeline!RC[-4],"-") -> - | H14: =IF(RC2="Closed",RC5*(1-RC6),IF(RC2="Contract",((PipelineAssumptions!R16C1+PipelineAssumptions!R17C1*Pipeline!RC3)*PipelineAssumptions!R8C4),IF(RC2="Eval",((PipelineAssumptions!R16C1+PipelineAssumptions!R17C1*Pipeline!RC3)*PipelineAssumptions!R9C4),IF(RC2="Proposal",((PipelineAssumptions!R16C1+PipelineAssumptions!R17C1*Pipeline!RC3)*PipelineAssumptions!R10C4),IF(RC2="Require",((PipelineAssumptions!R16C1+PipelineAssumptions!R17C1*Pipeline!RC3)*PipelineAssumptions!R11C4),IF(RC2="Response",((PipelineAssumptions!R16C1+PipelineAssumptions!R17C1*Pipeline!RC3)*PipelineAssumptions!R12C4),0)))))) -> 13000 | I14: =IF(RC2="Closed",RC[-2]*3,IF(RC2="Contract",((RC[-4]-RC[-1])*PipelineAssumptions!R8C5),IF(RC2="Eval",((RC[-4]-RC[-1])*PipelineAssumptions!R9C5),IF(RC2="Proposal",((RC[-4]-RC[-1])*PipelineAssumptions!R10C5),IF(RC2="Require",((RC[-4]-RC[-1])*PipelineAssumptions!R11C5),IF(RC2="Response",((RC[-4]-RC[-1])*PipelineAssumptions!R12C5),0)))))) -> 20800 | J14: In bake off w/ wireless asp | K14: mailing
A15: Hardware install team | B15: Proposal | C15: 200 | D15: Sales Assoc2 | E15: =PipelineAssumptions!R16C1+(PipelineAssumptions!R17C1*Pipeline!RC[-2]) -> 50000 | G15: =IF(RC[-5]="Closed",PipelineAssumptions!R18C1*Pipeline!RC[-4],"-") -> - | H15: =IF(RC2="Closed",RC5*(1-RC6),IF(RC2="Contract",((PipelineAssumptions!R16C1+PipelineAssumptions!R17C1*Pipeline!RC3)*PipelineAssumptions!R8C4),IF(RC2="Eval",((PipelineAssumptions!R16C1+PipelineAssumptions!R17C1*Pipeline!RC3)*PipelineAssumptions!R9C4),IF(RC2="Proposal",((PipelineAssumptions!R16C1+PipelineAssumptions!R17C1*Pipeline!RC3)*PipelineAssumptions!R10C4),IF(RC2="Require",((PipelineAssumptions!R16C1+PipelineAssumptions!R17C1*Pipeline!RC3)*PipelineAssumptions!R11C4),IF(RC2="Response",((PipelineAssumptions!R16C1+PipelineAssumptions!R17C1*Pipeline!RC3)*PipelineAssumptions!R12C4),0)))))) -> 10000 | I15: =IF(RC2="Closed",RC[-2]*3,IF(RC2="Contract",((RC[-4]-RC[-1])*PipelineAssumptions!R8C5),IF(RC2="Eval",((RC[-4]-RC[-1])*PipelineAssumptions!R9C5),IF(RC2="Proposal",((RC[-4]-RC[-1])*PipelineAssumptions!R10C5),IF(RC2="Require",((RC[-4]-RC[-1])*PipelineAssumptions!R11C5),IF(RC2="Response",((RC[-4]-RC[-1])*PipelineAssumptions!R12C5),0)))))) -> 16000 | J15: Looking at ROI | K15: sales call
A16: Logistics & Moving | B16: Proposal | C16: 350 | D16: Sales Assoc1 | E16: =PipelineAssumptions!R16C1+(PipelineAssumptions!R17C1*Pipeline!RC[-2]) -> 57500 | G16: =IF(RC[-5]="Closed",PipelineAssumptions!R18C1*Pipeline!RC[-4],"-") -> - | H16: =IF(RC2="Closed",RC5*(1-RC6),IF(RC2="Contract",((PipelineAssumptions!R16C1+PipelineAssumptions!R17C1*Pipeline!RC3)*PipelineAssumptions!R8C4),IF(RC2="Eval",((PipelineAssumptions!R16C1+PipelineAssumptions!R17C1*Pipeline!RC3)*PipelineAssumptions!R9C4),IF(RC2="Proposal",((PipelineAssumptions!R16C1+PipelineAssumptions!R17C1*Pipeline!RC3)*PipelineAssumptions!R10C4),IF(RC2="Require",((PipelineAssumptions!R16C1+PipelineAssumptions!R17C1*Pipeline!RC3)*PipelineAssumptions!R11C4),IF(RC2="Response",((PipelineAssumptions!R16C1+PipelineAssumptions!R17C1*Pipeline!RC3)*PipelineAssumptions!R12C4),0)))))) -> 11500 | I16: =IF(RC2="Closed",RC[-2]*3,IF(RC2="Contract",((RC[-4]-RC[-1])*PipelineAssumptions!R8C5),IF(RC2="Eval",((RC[-4]-RC[-1])*PipelineAssumptions!R9C5),IF(RC2="Proposal",((RC[-4]-RC[-1])*PipelineAssumptions!R10C5),IF(RC2="Require",((RC[-4]-RC[-1])*PipelineAssumptions!R11C5),IF(RC2="Response",((RC[-4]-RC[-1])*PipelineAssumptions!R12C5),0)))))) -> 18400 | J16: Going in with integration partner | K16: Conference contact
A17: Law firm | B17: Proposal | C17: 200 | D17: Sales Assoc2 | E17: =PipelineAssumptions!R16C1+(PipelineAssumptions!R17C1*Pipeline!RC[-2]) -> 50000 | G17: =IF(RC[-5]="Closed",PipelineAssumptions!R18C1*Pipeline!RC[-4],"-") -> - | H17: =IF(RC2="Closed",RC5*(1-RC6),IF(RC2="Contract",((PipelineAssumptions!R16C1+PipelineAssumptions!R17C1*Pipeline!RC3)*PipelineAssumptions!R8C4),IF(RC2="Eval",((PipelineAssumptions!R16C1+PipelineAssumptions!R17C1*Pipeline!RC3)*PipelineAssumptions!R9C4),IF(RC2="Proposal",((PipelineAssumptions!R16C1+PipelineAssumptions!R17C1*Pipeline!RC3)*PipelineAssumptions!R10C4),IF(RC2="Require",((PipelineAssumptions!R16C1+PipelineAssumptions!R17C1*Pipeline!RC3)*PipelineAssumptions!R11C4),IF(RC2="Response",((PipelineAssumptions!R16C1+PipelineAssumptions!R17C1*Pipeline!RC3)*PipelineAssumptions!R12C4),0)))))) -> 10000 | I17: =IF(RC2="Closed",RC[-2]*3,IF(RC2="Contract",((RC[-4]-RC[-1])*PipelineAssumptions!R8C5),IF(RC2="Eval",((RC[-4]-RC[-1])*PipelineAssumptions!R9C5),IF(RC2="Proposal",((RC[-4]-RC[-1])*PipelineAssumptions!R10C5),IF(RC2="Require",((RC[-4]-RC[-1])*PipelineAssumptions!R11C5),IF(RC2="Response",((RC[-4]-RC[-1])*PipelineAssumptions!R12C5),0)))))) -> 16000 | J17: Need solution to help IT group | K17: Referral
A18: Wireless Provider | B18: Require | C18: 10000 | D18: VP Sales | E18: =PipelineAssumptions!R16C1+(PipelineAssumptions!R17C1*Pipeline!RC[-2]) -> 540000 | G18: =IF(RC[-5]="Closed",PipelineAssumptions!R18C1*Pipeline!RC[-4],"-") -> - | H18: =IF(RC2="Closed",RC5*(1-RC6),IF(RC2="Contract",((PipelineAssumptions!R16C1+PipelineAssumptions!R17C1*Pipeline!RC3)*PipelineAssumptions!R8C4),IF(RC2="Eval",((PipelineAssumptions!R16C1+PipelineAssumptions!R17C1*Pipeline!RC3)*PipelineAssumptions!R9C4),IF(RC2="Proposal",((PipelineAssumptions!R16C1+PipelineAssumptions!R17C1*Pipeline!RC3)*PipelineAssumptions!R10C4),IF(RC2="Require",((PipelineAssumptions!R16C1+PipelineAssumptions!R17C1*Pipeline!RC3)*PipelineAssumptions!R11C4),IF(RC2="Response",((PipelineAssumptions!R16C1+PipelineAssumptions!R17C1*Pipeline!RC3)*PipelineAssumptions!R12C4),0)))))) -> 27000 | I18: =IF(RC2="Closed",RC[-2]*3,IF(RC2="Contract",((RC[-4]-RC[-1])*PipelineAssumptions!R8C5),IF(RC2="Eval",((RC[-4]-RC[-1])*PipelineAssumptions!R9C5),IF(RC2="Proposal",((RC[-4]-RC[-1])*PipelineAssumptions!R10C5),IF(RC2="Require",((RC[-4]-RC[-1])*PipelineAssumptions!R11C5),IF(RC2="Response",((RC[-4]-RC[-1])*PipelineAssumptions!R12C5),0)))))) -> 128250 | J18: Value add service for consumers | K18: Sales call
A19: Insurance firm | B19: Require | C19: 500 | D19: Sales Assoc1 | E19: =PipelineAssumptions!R16C1+(PipelineAssumptions!R17C1*Pipeline!RC[-2]) -> 65000 | G19: =IF(RC[-5]="Closed",PipelineAssumptions!R18C1*Pipeline!RC[-4],"-") -> - | H19: =IF(RC2="Closed",RC5*(1-RC6),IF(RC2="Contract",((PipelineAssumptions!R16C1+PipelineAssumptions!R17C1*Pipeline!RC3)*PipelineAssumptions!R8C4),IF(RC2="Eval",((PipelineAssumptions!R16C1+PipelineAssumptions!R17C1*Pipeline!RC3)*PipelineAssumptions!R9C4),IF(RC2="Proposal",((PipelineAssumptions!R16C1+PipelineAssumptions!R17C1*Pipeline!RC3)*PipelineAssumptions!R10C4),IF(RC2="Require",((PipelineAssumptions!R16C1+PipelineAssumptions!R17C1*Pipeline!RC3)*PipelineAssumptions!R11C4),IF(RC2="Response",((PipelineAssumptions!R16C1+PipelineAssumptions!R17C1*Pipeline!RC3)*PipelineAssumptions!R12C4),0)))))) -> 3250 | I19: =IF(RC2="Closed",RC[-2]*3,IF(RC2="Contract",((RC[-4]-RC[-1])*PipelineAssumptions!R8C5),IF(RC2="Eval",((RC[-4]-RC[-1])*PipelineAssumptions!R9C5),IF(RC2="Proposal",((RC[-4]-RC[-1])*PipelineAssumptions!R10C5),IF(RC2="Require",((RC[-4]-RC[-1])*PipelineAssumptions!R11C5),IF(RC2="Response",((RC[-4]-RC[-1])*PipelineAssumptions!R12C5),0)))))) -> 15437.5 | J19: Looking at solution | K19: Cold call
A20: Western Fin Institution | B20: Require | C20: 400 | D20: VP Sales | E20: =PipelineAssumptions!R16C1+(PipelineAssumptions!R17C1*Pipeline!RC[-2]) -> 60000 | G20: =IF(RC[-5]="Closed",PipelineAssumptions!R18C1*Pipeline!RC[-4],"-") -> - | H20: =IF(RC2="Closed",RC5*(1-RC6),IF(RC2="Contract",((PipelineAssumptions!R16C1+PipelineAssumptions!R17C1*Pipeline!RC3)*PipelineAssumptions!R8C4),IF(RC2="Eval",((PipelineAssumptions!R16C1+PipelineAssumptions!R17C1*Pipeline!RC3)*PipelineAssumptions!R9C4),IF(RC2="Proposal",((PipelineAssumptions!R16C1+PipelineAssumptions!R17C1*Pipeline!RC3)*PipelineAssumptions!R10C4),IF(RC2="Require",((PipelineAssumptions!R16C1+PipelineAssumptions!R17C1*Pipeline!RC3)*PipelineAssumptions!R11C4),IF(RC2="Response",((PipelineAssumptions!R16C1+PipelineAssumptions!R17C1*Pipeline!RC3)*PipelineAssumptions!R12C4),0)))))) -> 3000 | I20: =IF(RC2="Closed",RC[-2]*3,IF(RC2="Contract",((RC[-4]-RC[-1])*PipelineAssumptions!R8C5),IF(RC2="Eval",((RC[-4]-RC[-1])*PipelineAssumptions!R9C5),IF(RC2="Proposal",((RC[-4]-RC[-1])*PipelineAssumptions!R10C5),IF(RC2="Require",((RC[-4]-RC[-1])*PipelineAssumptions!R11C5),IF(RC2="Response",((RC[-4]-RC[-1])*PipelineAssumptions!R12C5),0)))))) -> 14250 | J20: In talks with R&D team | K20: Sales contact
A21: Healthcare provider | B21: Response | C21: 200 | D21: VP Sales | E21: =PipelineAssumptions!R16C1+(PipelineAssumptions!R17C1*Pipeline!RC[-2]) -> 50000 | G21: =IF(RC[-5]="Closed",PipelineAssumptions!R18C1*Pipeline!RC[-4],"-") -> - | H21: =IF(RC2="Closed",RC5*(1-RC6),IF(RC2="Contract",((PipelineAssumptions!R16C1+PipelineAssumptions!R17C1*Pipeline!RC3)*PipelineAssumptions!R8C4),IF(RC2="Eval",((PipelineAssumptions!R16C1+PipelineAssumptions!R17C1*Pipeline!RC3)*PipelineAssumptions!R9C4),IF(RC2="Proposal",((PipelineAssumptions!R16C1+PipelineAssumptions!R17C1*Pipeline!RC3)*PipelineAssumptions!R10C4),IF(RC2="Require",((PipelineAssumptions!R16C1+PipelineAssumptions!R17C1*Pipeline!RC3)*PipelineAssumptions!R11C4),IF(RC2="Response",((PipelineAssumptions!R16C1+PipelineAssumptions!R17C1*Pipeline!RC3)*PipelineAssumptions!R12C4),0)))))) -> 1000 | I21: =IF(RC2="Closed",RC[-2]*3,IF(RC2="Contract",((RC[-4]-RC[-1])*PipelineAssumptions!R8C5),IF(RC2="Eval",((RC[-4]-RC[-1])*PipelineAssumptions!R9C5),IF(RC2="Proposal",((RC[-4]-RC[-1])*PipelineAssumptions!R10C5),IF(RC2="Require",((RC[-4]-RC[-1])*PipelineAssumptions!R11C5),IF(RC2="Response",((RC[-4]-RC[-1])*PipelineAssumptions!R12C5),0)))))) -> 2450 | J21: Partner bringing us in | K21: Partner
A22: News Media | B22: Response | C22: 300 | D22: VP Sales | E22: =PipelineAssumptions!R16C1+(PipelineAssumptions!R17C1*Pipeline!RC[-2]) -> 55000 | G22: =IF(RC[-5]="Closed",PipelineAssumptions!R18C1*Pipeline!RC[-4],"-") -> - | H22: =IF(RC2="Closed",RC5*(1-RC6),IF(RC2="Contract",((PipelineAssumptions!R16C1+PipelineAssumptions!R17C1*Pipeline!RC3)*PipelineAssumptions!R8C4),IF(RC2="Eval",((PipelineAssumptions!R16C1+PipelineAssumptions!R17C1*Pipeline!RC3)*PipelineAssumptions!R9C4),IF(RC2="Proposal",((PipelineAssumptions!R16C1+PipelineAssumptions!R17C1*Pipeline!RC3)*PipelineAssumptions!R10C4),IF(RC2="Require",((PipelineAssumptions!R16C1+PipelineAssumptions!R17C1*Pipeline!RC3)*PipelineAssumptions!R11C4),IF(RC2="Response",((PipelineAssumptions!R16C1+PipelineAssumptions!R17C1*Pipeline!RC3)*PipelineAssumptions!R12C4),0)))))) -> 1100 | I22: =IF(RC2="Closed",RC[-2]*3,IF(RC2="Contract",((RC[-4]-RC[-1])*PipelineAssumptions!R8C5),IF(RC2="Eval",((RC[-4]-RC[-1])*PipelineAssumptions!R9C5),IF(RC2="Proposal",((RC[-4]-RC[-1])*PipelineAssumptions!R10C5),IF(RC2="Require",((RC[-4]-RC[-1])*PipelineAssumptions!R11C5),IF(RC2="Response",((RC[-4]-RC[-1])*PipelineAssumptions!R12C5),0)))))) -> 2695 | J22: Looking for solution | K22: Sales call
A23: Appliance Field Service | B23: Response | C23: 400 | D23: Inside Sales | E23: =PipelineAssumptions!R16C1+(PipelineAssumptions!R17C1*Pipeline!RC[-2]) -> 60000 | G23: =IF(RC[-5]="Closed",PipelineAssumptions!R18C1*Pipeline!RC[-4],"-") -> - | H23: =IF(RC2="Closed",RC5*(1-RC6),IF(RC2="Contract",((PipelineAssumptions!R16C1+PipelineAssumptions!R17C1*Pipeline!RC3)*PipelineAssumptions!R8C4),IF(RC2="Eval",((PipelineAssumptions!R16C1+PipelineAssumptions!R17C1*Pipeline!RC3)*PipelineAssumptions!R9C4),IF(RC2="Proposal",((PipelineAssumptions!R16C1+PipelineAssumptions!R17C1*Pipeline!RC3)*PipelineAssumptions!R10C4),IF(RC2="Require",((PipelineAssumptions!R16C1+PipelineAssumptions!R17C1*Pipeline!RC3)*PipelineAssumptions!R11C4),IF(RC2="Response",((PipelineAssumptions!R16C1+PipelineAssumptions!R17C1*Pipeline!RC3)*PipelineAssumptions!R12C4),0)))))) -> 1200 | I23: =IF(RC2="Closed",RC[-2]*3,IF(RC2="Contract",((RC[-4]-RC[-1])*PipelineAssumptions!R8C5),IF(RC2="Eval",((RC[-4]-RC[-1])*PipelineAssumptions!R9C5),IF(RC2="Proposal",((RC[-4]-RC[-1])*PipelineAssumptions!R10C5),IF(RC2="Require",((RC[-4]-RC[-1])*PipelineAssumptions!R11C5),IF(RC2="Response",((RC[-4]-RC[-1])*PipelineAssumptions!R12C5),0)))))) -> 2940 | J23: Looking at multiple solutions | K23: Cold call
A24: Gov inspection | B24: Response | C24: 350 | D24: Sales Assoc2 | E24: =PipelineAssumptions!R16C1+(PipelineAssumptions!R17C1*Pipeline!RC[-2]) -> 57500 | G24: =IF(RC[-5]="Closed",PipelineAssumptions!R18C1*Pipeline!RC[-4],"-") -> - | H24: =IF(RC2="Closed",RC5*(1-RC6),IF(RC2="Contract",((PipelineAssumptions!R16C1+PipelineAssumptions!R17C1*Pipeline!RC3)*PipelineAssumptions!R8C4),IF(RC2="Eval",((PipelineAssumptions!R16C1+PipelineAssumptions!R17C1*Pipeline!RC3)*PipelineAssumptions!R9C4),IF(RC2="Proposal",((PipelineAssumptions!R16C1+PipelineAssumptions!R17C1*Pipeline!RC3)*PipelineAssumptions!R10C4),IF(RC2="Require",((PipelineAssumptions!R16C1+PipelineAssumptions!R17C1*Pipeline!RC3)*PipelineAssumptions!R11C4),IF(RC2="Response",((PipelineAssumptions!R16C1+PipelineAssumptions!R17C1*Pipeline!RC3)*PipelineAssumptions!R12C4),0)))))) -> 1150 | I24: =IF(RC2="Closed",RC[-2]*3,IF(RC2="Contract",((RC[-4]-RC[-1])*PipelineAssumptions!R8C5),IF(RC2="Eval",((RC[-4]-RC[-1])*PipelineAssumptions!R9C5),IF(RC2="Proposal",((RC[-4]-RC[-1])*PipelineAssumptions!R10C5),IF(RC2="Require",((RC[-4]-RC[-1])*PipelineAssumptions!R11C5),IF(RC2="Response",((RC[-4]-RC[-1])*PipelineAssumptions!R12C5),0)))))) -> 2817.5 | J24: Talking with IT manager | K24: Conference contact
A25: Insurance firm | B25: Response | C25: 600 | D25: Inside Sales | E25: =PipelineAssumptions!R16C1+(PipelineAssumptions!R17C1*Pipeline!RC[-2]) -> 70000 | G25: =IF(RC[-5]="Closed",PipelineAssumptions!R18C1*Pipeline!RC[-4],"-") -> - | H25: =IF(RC2="Closed",RC5*(1-RC6),IF(RC2="Contract",((PipelineAssumptions!R16C1+PipelineAssumptions!R17C1*Pipeline!RC3)*PipelineAssumptions!R8C4),IF(RC2="Eval",((PipelineAssumptions!R16C1+PipelineAssumptions!R17C1*Pipeline!RC3)*PipelineAssumptions!R9C4),IF(RC2="Proposal",((PipelineAssumptions!R16C1+PipelineAssumptions!R17C1*Pipeline!RC3)*PipelineAssumptions!R10C4),IF(RC2="Require",((PipelineAssumptions!R16C1+PipelineAssumptions!R17C1*Pipeline!RC3)*PipelineAssumptions!R11C4),IF(RC2="Response",((PipelineAssumptions!R16C1+PipelineAssumptions!R17C1*Pipeline!RC3)*PipelineAssumptions!R12C4),0)))))) -> 1400 | I25: =IF(RC2="Closed",RC[-2]*3,IF(RC2="Contract",((RC[-4]-RC[-1])*PipelineAssumptions!R8C5),IF(RC2="Eval",((RC[-4]-RC[-1])*PipelineAssumptions!R9C5),IF(RC2="Proposal",((RC[-4]-RC[-1])*PipelineAssumptions!R10C5),IF(RC2="Require",((RC[-4]-RC[-1])*PipelineAssumptions!R11C5),IF(RC2="Response",((RC[-4]-RC[-1])*PipelineAssumptions!R12C5),0)))))) -> 3430 | J25: Going in with integration partner | K25: Partner
A26: Regional Airline | B26: Response | C26: 500 | D26: Inside Sales | E26: =PipelineAssumptions!R16C1+(PipelineAssumptions!R17C1*Pipeline!RC[-2]) -> 65000 | G26: =IF(RC[-5]="Closed",PipelineAssumptions!R18C1*Pipeline!RC[-4],"-") -> - | H26: =IF(RC2="Closed",RC5*(1-RC6),IF(RC2="Contract",((PipelineAssumptions!R16C1+PipelineAssumptions!R17C1*Pipeline!RC3)*PipelineAssumptions!R8C4),IF(RC2="Eval",((PipelineAssumptions!R16C1+PipelineAssumptions!R17C1*Pipeline!RC3)*PipelineAssumptions!R9C4),IF(RC2="Proposal",((PipelineAssumptions!R16C1+PipelineAssumptions!R17C1*Pipeline!RC3)*PipelineAssumptions!R10C4),IF(RC2="Require",((PipelineAssumptions!R16C1+PipelineAssumptions!R17C1*Pipeline!RC3)*PipelineAssumptions!R11C4),IF(RC2="Response",((PipelineAssumptions!R16C1+PipelineAssumptions!R17C1*Pipeline!RC3)*PipelineAssumptions!R12C4),0)))))) -> 1300 | I26: =IF(RC2="Closed",RC[-2]*3,IF(RC2="Contract",((RC[-4]-RC[-1])*PipelineAssumptions!R8C5),IF(RC2="Eval",((RC[-4]-RC[-1])*PipelineAssumptions!R9C5),IF(RC2="Proposal",((RC[-4]-RC[-1])*PipelineAssumptions!R10C5),IF(RC2="Require",((RC[-4]-RC[-1])*PipelineAssumptions!R11C5),IF(RC2="Response",((RC[-4]-RC[-1])*PipelineAssumptions!R12C5),0)))))) -> 3185 | J26: In early stages of looking | K26: Cold call
A27: Tech Software | B27: Response | C27: 120 | D27: Inside Sales | E27: =PipelineAssumptions!R16C1+(PipelineAssumptions!R17C1*Pipeline!RC[-2]) -> 46000 | G27: =IF(RC[-5]="Closed",PipelineAssumptions!R18C1*Pipeline!RC[-4],"-") -> - | H27: =IF(RC2="Closed",RC5*(1-RC6),IF(RC2="Contract",((PipelineAssumptions!R16C1+PipelineAssumptions!R17C1*Pipeline!RC3)*PipelineAssumptions!R8C4),IF(RC2="Eval",((PipelineAssumptions!R16C1+PipelineAssumptions!R17C1*Pipeline!RC3)*PipelineAssumptions!R9C4),IF(RC2="Proposal",((PipelineAssumptions!R16C1+PipelineAssumptions!R17C1*Pipeline!RC3)*PipelineAssumptions!R10C4),IF(RC2="Require",((PipelineAssumptions!R16C1+PipelineAssumptions!R17C1*Pipeline!RC3)*PipelineAssumptions!R11C4),IF(RC2="Response",((PipelineAssumptions!R16C1+PipelineAssumptions!R17C1*Pipeline!RC3)*PipelineAssumptions!R12C4),0)))))) -> 920 | I27: =IF(RC2="Closed",RC[-2]*3,IF(RC2="Contract",((RC[-4]-RC[-1])*PipelineAssumptions!R8C5),IF(RC2="Eval",((RC[-4]-RC[-1])*PipelineAssumptions!R9C5),IF(RC2="Proposal",((RC[-4]-RC[-1])*PipelineAssumptions!R10C5),IF(RC2="Require",((RC[-4]-RC[-1])*PipelineAssumptions!R11C5),IF(RC2="Response",((RC[-4]-RC[-1])*PipelineAssumptions!R12C5),0)))))) -> 2254 | J27: Looking for short impl time | K27: email
A28: Manufacturer sales force | B28: Response | C28: 200 | D28: Sales Assoc2 | E28: =PipelineAssumptions!R16C1+(PipelineAssumptions!R17C1*Pipeline!RC[-2]) -> 50000 | G28: =IF(RC[-5]="Closed",PipelineAssumptions!R18C1*Pipeline!RC[-4],"-") -> - | H28: =IF(RC2="Closed",RC5*(1-RC6),IF(RC2="Contract",((PipelineAssumptions!R16C1+PipelineAssumptions!R17C1*Pipeline!RC3)*PipelineAssumptions!R8C4),IF(RC2="Eval",((PipelineAssumptions!R16C1+PipelineAssumptions!R17C1*Pipeline!RC3)*PipelineAssumptions!R9C4),IF(RC2="Proposal",((PipelineAssumptions!R16C1+PipelineAssumptions!R17C1*Pipeline!RC3)*PipelineAssumptions!R10C4),IF(RC2="Require",((PipelineAssumptions!R16C1+PipelineAssumptions!R17C1*Pipeline!RC3)*PipelineAssumptions!R11C4),IF(RC2="Response",((PipelineAssumptions!R16C1+PipelineAssumptions!R17C1*Pipeline!RC3)*PipelineAssumptions!R12C4),0)))))) -> 1000 | I28: =IF(RC2="Closed",RC[-2]*3,IF(RC2="Contract",((RC[-4]-RC[-1])*PipelineAssumptions!R8C5),IF(RC2="Eval",((RC[-4]-RC[-1])*PipelineAssumptions!R9C5),IF(RC2="Proposal",((RC[-4]-RC[-1])*PipelineAssumptions!R10C5),IF(RC2="Require",((RC[-4]-RC[-1])*PipelineAssumptions!R11C5),IF(RC2="Response",((RC[-4]-RC[-1])*PipelineAssumptions!R12C5),0)))))) -> 2450 | J28: Educating them on solutions | K28: Sales call
A29: New Eng Fin Institution | B29: Response | C29: 200 | D29: Inside Sales | E29: =PipelineAssumptions!R16C1+(PipelineAssumptions!R17C1*Pipeline!RC[-2]) -> 50000 | G29: =IF(RC[-5]="Closed",PipelineAssumptions!R18C1*Pipeline!RC[-4],"-") -> - | H29: =IF(RC2="Closed",RC5*(1-RC6),IF(RC2="Contract",((PipelineAssumptions!R16C1+PipelineAssumptions!R17C1*Pipeline!RC3)*PipelineAssumptions!R8C4),IF(RC2="Eval",((PipelineAssumptions!R16C1+PipelineAssumptions!R17C1*Pipeline!RC3)*PipelineAssumptions!R9C4),IF(RC2="Proposal",((PipelineAssumptions!R16C1+PipelineAssumptions!R17C1*Pipeline!RC3)*PipelineAssumptions!R10C4),IF(RC2="Require",((PipelineAssumptions!R16C1+PipelineAssumptions!R17C1*Pipeline!RC3)*PipelineAssumptions!R11C4),IF(RC2="Response",((PipelineAssumptions!R16C1+PipelineAssumptions!R17C1*Pipeline!RC3)*PipelineAssumptions!R12C4),0)))))) -> 1000 | I29: =IF(RC2="Closed",RC[-2]*3,IF(RC2="Contract",((RC[-4]-RC[-1])*PipelineAssumptions!R8C5),IF(RC2="Eval",((RC[-4]-RC[-1])*PipelineAssumptions!R9C5),IF(RC2="Proposal",((RC[-4]-RC[-1])*PipelineAssumptions!R10C5),IF(RC2="Require",((RC[-4]-RC[-1])*PipelineAssumptions!R11C5),IF(RC2="Response",((RC[-4]-RC[-1])*PipelineAssumptions!R12C5),0)))))) -> 2450 | J29: Beginning talks | K29: Referral
A30: Energy Services | B30: Response | C30: 125 | D30: Inside Sales | E30: =PipelineAssumptions!R16C1+(PipelineAssumptions!R17C1*Pipeline!RC[-2]) -> 46250 | G30: =IF(RC[-5]="Closed",PipelineAssumptions!R18C1*Pipeline!RC[-4],"-") -> - | H30: =IF(RC2="Closed",RC5*(1-RC6),IF(RC2="Contract",((PipelineAssumptions!R16C1+PipelineAssumptions!R17C1*Pipeline!RC3)*PipelineAssumptions!R8C4),IF(RC2="Eval",((PipelineAssumptions!R16C1+PipelineAssumptions!R17C1*Pipeline!RC3)*PipelineAssumptions!R9C4),IF(RC2="Proposal",((PipelineAssumptions!R16C1+PipelineAssumptions!R17C1*Pipeline!RC3)*PipelineAssumptions!R10C4),IF(RC2="Require",((PipelineAssumptions!R16C1+PipelineAssumptions!R17C1*Pipeline!RC3)*PipelineAssumptions!R11C4),IF(RC2="Response",((PipelineAssumptions!R16C1+PipelineAssumptions!R17C1*Pipeline!RC3)*PipelineAssumptions!R12C4),0)))))) -> 925 | I30: =IF(RC2="Closed",RC[-2]*3,IF(RC2="Contract",((RC[-4]-RC[-1])*PipelineAssumptions!R8C5),IF(RC2="Eval",((RC[-4]-RC[-1])*PipelineAssumptions!R9C5),IF(RC2="Proposal",((RC[-4]-RC[-1])*PipelineAssumptions!R10C5),IF(RC2="Require",((RC[-4]-RC[-1])*PipelineAssumptions!R11C5),IF(RC2="Response",((RC[-4]-RC[-1])*PipelineAssumptions!R12C5),0)))))) -> 2266.25 | J30: Going through organization | K30: Sales Call
A31: Utility field service | B31: Response | C31: 200 | D31: Inside Sales | E31: =PipelineAssumptions!R16C1+(PipelineAssumptions!R17C1*Pipeline!RC[-2]) -> 50000 | G31: =IF(RC[-5]="Closed",PipelineAssumptions!R18C1*Pipeline!RC[-4],"-") -> - | H31: =IF(RC2="Closed",RC5*(1-RC6),IF(RC2="Contract",((PipelineAssumptions!R16C1+PipelineAssumptions!R17C1*Pipeline!RC3)*PipelineAssumptions!R8C4),IF(RC2="Eval",((PipelineAssumptions!R16C1+PipelineAssumptions!R17C1*Pipeline!RC3)*PipelineAssumptions!R9C4),IF(RC2="Proposal",((PipelineAssumptions!R16C1+PipelineAssumptions!R17C1*Pipeline!RC3)*PipelineAssumptions!R10C4),IF(RC2="Require",((PipelineAssumptions!R16C1+PipelineAssumptions!R17C1*Pipeline!RC3)*PipelineAssumptions!R11C4),IF(RC2="Response",((PipelineAssumptions!R16C1+PipelineAssumptions!R17C1*Pipeline!RC3)*PipelineAssumptions!R12C4),0)))))) -> 1000 | I31: =IF(RC2="Closed",RC[-2]*3,IF(RC2="Contract",((RC[-4]-RC[-1])*PipelineAssumptions!R8C5),IF(RC2="Eval",((RC[-4]-RC[-1])*PipelineAssumptions!R9C5),IF(RC2="Proposal",((RC[-4]-RC[-1])*PipelineAssumptions!R10C5),IF(RC2="Require",((RC[-4]-RC[-1])*PipelineAssumptions!R11C5),IF(RC2="Response",((RC[-4]-RC[-1])*PipelineAssumptions!R12C5),0)))))) -> 2450 | J31: Unhappy with current solution | K31: email
H33: Total | I33: Total
H34: =SUM(R[-27]C:R[-3]C) -> 330745 | I34: =SUM(R[-27]C:R[-3]C) -> 373375.25

Sheet: ClosedSales
A1: Enterprise Sales
A2: *closed sales feed into revenue, closed sales are in 2002, 2003 revs based on pipeline projections.
A4: Sales | B4: Status | C4: Users | D4: Sales Contact | E4: Potential Contract Size | F4: Discount (needs CEO approval) | G4: Recurring Rev per month | H4: Revenue | I4: Recurring Rev Next Quarter | J4: Description | K4: Lead Generation | M4: Sales Assoc1 | N4: Sales Assoc2
A6: 2002
A7: Q1 Sales
A8: Tech Hardware Sales | B8: Closed | C8: 120 | D8: VP Sales | E8: =PipelineAssumptions!R16C1+(PipelineAssumptions!R17C1*RC[-2]) -> 46000 | F8: 0.1 | G8: =RC[-4]*PipelineAssumptions!R18C1 -> 1200 | H8: =RC[-3]*(1-RC[-2]) -> 41400 | I8: =3*RC[-2] -> 3600 | J8: Sales Cycle 3 months | K8: CEO contact | M8: =IF(RC4="Sales Assoc1",RC5,"-") -> - | N8: =IF(RC4="Sales Assoc2",RC5,"-") -> -
A9: Mgmt team of Tech firm | B9: Closed | C9: 20 | D9: Sales Assoc1 | E9: =PipelineAssumptions!R16C1+(PipelineAssumptions!R17C1*RC[-2]) -> 41000 | F9: 0.35 | G9: =RC[-4]*PipelineAssumptions!R18C1 -> 200 | H9: =RC[-3]*(1-RC[-2]) -> 26650 | I9: =3*RC[-2] -> 600 | J9: Sales Cycle 2 months | K9: CEO contact | M9: =IF(RC[-9]="Sales Assoc1",RC[-8],"-") -> 41000 | N9: =IF(RC4="Sales Assoc2",RC5,"-") -> -
A10: Q1 Total | H10: =SUM(R[-2]C:R[-1]C) -> 68050 | M10: =SUM(R[-2]C:R[-1]C) -> 41000
A12: Q2 Sales | M12: =IF(RC[-9]="Sales Assoc1",RC[-8],"-") -> -
A13: New Eng Fin Instit | B13: Closed | C13: 350 | D13: VP Sales | E13: =PipelineAssumptions!R16C1+(PipelineAssumptions!R17C1*RC[-2]) -> 57500 | F13: 0.2 | G13: =RC[-4]*PipelineAssumptions!R18C1 -> 3500 | H13: =RC[-3]*(1-RC[-2]) -> 46000 | I13: =3*RC[-2] -> 10500 | J13: Sales Cycle 5 months | K13: Sales Contact | M13: =IF(RC[-9]="Sales Assoc1",RC[-8],"-") -> - | N13: =IF(RC4="Sales Assoc2",RC5,"-") -> -
A14: Equipment Sales | B14: Closed | C14: 75 | D14: Sales Assoc2 | E14: =PipelineAssumptions!R16C1+(PipelineAssumptions!R17C1*RC[-2]) -> 43750 | F14: 0.1 | G14: =RC[-4]*PipelineAssumptions!R18C1 -> 750 | H14: =RC[-3]*(1-RC[-2]) -> 39375 | I14: =3*RC[-2] -> 2250 | J14: Sales Cycle 4 months | K14: Sales Contact | M14: =IF(RC[-9]="Sales Assoc1",RC[-8],"-") -> - | N14: =IF(RC4="Sales Assoc2",RC5,"-") -> 43750
A15: Insurance Firm | B15: Closed | C15: 350 | D15: Sales Assoc1 | E15: =PipelineAssumptions!R16C1+(PipelineAssumptions!R17C1*RC[-2]) -> 57500 | F15: 0.1 | G15: =RC[-4]*PipelineAssumptions!R18C1 -> 3500 | H15: =RC[-3]*(1-RC[-2]) -> 51750 | I15: =3*RC[-2] -> 10500 | J15: Sales Cycle 5 months | K15: Sales Call | M15: =IF(RC[-9]="Sales Assoc1",RC[-8],"-") -> 57500 | N15: =IF(RC4="Sales Assoc2",RC5,"-") -> -
A16: Q2 Total | H16: =SUM(R[-3]C:R[-1]C) -> 137125 | M16: =SUM(R[-3]C:R[-1]C) -> 57500 | N16: =SUM(R[-3]C:R[-1]C) -> 43750
M17: =IF(RC[-9]="Sales Assoc1",RC[-8],"-") -> - | N17: =IF(RC4="Sales Assoc2",RC5,"-") -> -
A18: Q3 Sales | M18: =IF(RC[-9]="Sales Assoc1",RC[-8],"-") -> - | N18: =IF(RC4="Sales Assoc2",RC5,"-") -> -
A19: IT Services firm | B19: Closed | C19: 1000 | D19: VP Sales | E19: =PipelineAssumptions!R16C1+(PipelineAssumptions!R17C1*RC[-2]) -> 90000 | F19: 0.15 | G19: =RC[-4]*PipelineAssumptions!R18C1 -> 10000 | H19: =RC[-3]*(1-RC[-2]) -> 76500 | I19: =3*RC[-2] -> 30000 | J19: Sales cycle 4 months | K19: Sales contact | M19: =IF(RC[-9]="Sales Assoc1",RC[-8],"-") -> - | N19: =IF(RC4="Sales Assoc2",RC5,"-") -> -
A20: Manufacturer sales force | B20: Closed | C20: 130 | D20: VP Sales | E20: =PipelineAssumptions!R16C1+(PipelineAssumptions!R17C1*RC[-2]) -> 46500 | F20: 0.2 | G20: =RC[-4]*PipelineAssumptions!R18C1 -> 1300 | H20: =RC[-3]*(1-RC[-2]) -> 37200 | I20: =3*RC[-2] -> 3900 | J20: Sales cycle 3 months | K20: Sales contact | M20: =IF(RC[-9]="Sales Assoc1",RC[-8],"-") -> - | N20: =IF(RC4="Sales Assoc2",RC5,"-") -> -
A21: Q3 Total | H21: =SUM(R[-2]C:R[-1]C) -> 113700
M23: =IF(RC[-9]="Sales Assoc1",RC[-8],"-") -> - | N23: =IF(RC4="Sales Assoc2",RC5,"-") -> -
A24: Q4 Sales | M24: =IF(RC[-9]="Sales Assoc1",RC[-8],"-") -> - | N24: =IF(RC4="Sales Assoc2",RC5,"-") -> -
A25: NY Financial Institution | B25: Closed | C25: 600 | D25: VP Sales | E25: 70000 | F25: 0.1 | G25: 6000 | H25: 63000 | I25: 18000 | J25: Sales cycle 5 months | K25: CEO contact | M25: =IF(RC[-9]="Sales Assoc1",RC[-8],"-") -> - | N25: =IF(RC4="Sales Assoc2",RC5,"-") -> -
A26: Software firm | B26: Closed | C26: 150 | D26: Sales Assoc2 | E26: 47500 | F26: 0.15 | G26: 1500 | H26: 40375 | I26: 4500 | J26: Sales cycle 6 months | K26: Sales call | M26: =IF(RC[-9]="Sales Assoc1",RC[-8],"-") -> - | N26: =IF(RC4="Sales Assoc2",RC5,"-") -> 47500
A27: Hardware sales force | B27: Closed | C27: 200 | D27: Sales Assoc1 | E27: 50000 | F27: 0.05 | G27: 2000 | H27: 47500 | I27: 6000 | J27: Sales cycle 4 months | K27: email | M27: =IF(RC[-9]="Sales Assoc1",RC[-8],"-") -> 50000 | N27: =IF(RC4="Sales Assoc2",RC5,"-") -> -
A28: Manufact firm sales force | B28: Closed | C28: 400 | D28: VP Sales | E28: 60000 | F28: 0 | G28: 4000 | H28: 60000 | I28: 12000 | J28: Sales cycle 6 months | K28: Conference contact | M28: =IF(RC[-9]="Sales Assoc1",RC[-8],"-") -> - | N28: =IF(RC4="Sales Assoc2",RC5,"-") -> -
A29: Law enforcement group | B29: Closed | C29: 250 | D29: Sales Assoc1 | E29: 52500 | F29: 0 | G29: 2500 | H29: 52500 | I29: 7500 | J29: Sales cycle 5 months | K29: Sales contact | M29: =IF(RC[-9]="Sales Assoc1",RC[-8],"-") -> 52500 | N29: =IF(RC4="Sales Assoc2",RC5,"-") -> -
A30: Q4 Total | H30: =SUM(R[-5]C:R[-1]C) -> 263375 | M30: =SUM(R[-5]C:R[-1]C) -> 102500 | N30: =SUM(R[-5]C:R[-1]C) -> 47500
A33: Yearly Total | H33: =SUM(R[-23]C,R[-17]C,R[-12]C) -> 318875
A36: 2003
A37: Q1 Sales
A38: =Pipeline!R[-31]C -> SE Financial Institution | B38: =Pipeline!R[-31]C -> Closed | C38: =Pipeline!R[-31]C -> 400 | D38: =Pipeline!R[-31]C -> VP Sales | E38: =Pipeline!R[-31]C -> 60000 | F38: =Pipeline!R[-31]C -> 0.1 | G38: =Pipeline!R[-31]C -> 4000 | H38: =Pipeline!R[-31]C -> 54000 | I38: =Pipeline!R[-31]C -> 12000 | J38: =Pipeline!R[-31]C -> Sales cycle 5 months | K38: =Pipeline!R[-31]C -> CEO contact

Sheet: Quota
A1: Quotas for 2002
A3: Assumptions
A4: Quotas based on Quarterly Sales
A6: VP of Sales Quota based on Firm wide sales
A7: Sales team Quota per Quarter | B7: 250000
A8: VP Sales Commision:
A9: For all Sales | B9: 0.02
A10: Incremental % increase for sales above quota | B10: 0.02
A12: Sales Associates Sales Based on Individual Sales and Team Sales Quota
A13: Sales Associate Commision:
A14: Quota | B14: 60000
A15: For Individual Sales Below Quota | B15: 2.5000000000000001E-2
A16: Incremental % increase for individual sales above quota | B16: 3.5000000000000003E-2
A17: Bonus for Firm Wide Sales | B17: 2500
A19: Inside Sales, Sales Engineers, and Marketing receive bonus for Firm Wide Sales Quota | B19: 2500
A20: Commision on Firm wide Sales | B20: 2.5000000000000001E-3
A22: Quotas for Fiscal 2002
B23: Q1 | C23: Q2 | D23: Q3 | E23: Q4
A24: VP of Sales and Marketing
A25: Commision on sales below Quota | B25: =R9C2*ClosedSales!R[-15]C8 -> 1361 | C25: =R9C2*ClosedSales!R[-9]C8 -> 2742.5 | D25: =R9C2*ClosedSales!R[-4]C8 -> 2274 | E25: =R9C2*ClosedSales!R[5]C8 -> 5267.5
A26: Commision on sales above Quota | B26: =IF(ClosedSales!R[-16]C8>Quota!R7C2,R10C2*ClosedSales!R[-16]C8,"-") -> - | C26: =IF(ClosedSales!R[-10]C8>Quota!R7C2,R10C2*(ClosedSales!R[-10]C8-R7C2),"-") -> - | D26: =IF(ClosedSales!R[-5]C8>Quota!R7C2,R10C2*(ClosedSales!R[-5]C8-R7C2),"-") -> -
A28: Sales Associate 1
A29: Commision on sales below Quota | B29: =R15C2*ClosedSales!R[-19]C13 -> 1025 | C29: =R15C2*ClosedSales!R[-13]C13 -> 1437.5 | D29: =R15C2*ClosedSales!R[-8]C13 -> 0 | E29: =R15C2*ClosedSales!R[1]C13 -> 2562.5
A30: Commision on sales above Quota | B30: =IF(ClosedSales!R[-20]C13>Quota!R14C2,R16C2*(ClosedSales!R[-20]C13-R14C2),"-") -> - | C30: =IF(ClosedSales!R[-14]C13>Quota!R14C2,R16C2*(ClosedSales!R[-14]C13-R14C2),"-") -> -
A31: Bonus | B31: =IF(ClosedSales!R10C8>Quota!R7C2,R17C2,"-") -> - | C31: =IF(ClosedSales!R16C8>Quota!R7C2,R17C2,"-") -> - | D31: =IF(ClosedSales!R21C8>Quota!R7C2,R17C2,"-") -> -
A33: Sales Associate 2
A34: Commision on sales below Quota | B34: =R15C2*ClosedSales!R[-24]C14 -> 0 | C34: =R15C2*ClosedSales!R[-18]C14 -> 1093.75 | D34: =R15C2*ClosedSales!R[-13]C14 -> 0 | E34: =R15C2*ClosedSales!R[-4]C14 -> 1187.5
A35: Commision on sales above Quota | B35: =IF(ClosedSales!R[-25]C14>Quota!R14C2,R16C2*(ClosedSales!R[-25]C13-R14C2),"-") -> - | C35: =IF(ClosedSales!R[-19]C14>Quota!R14C2,R16C2*(ClosedSales!R[-19]C14-R14C2),"-") -> -
A36: Bonus | B36: =IF(ClosedSales!R10C8>Quota!R7C2,R17C2,"-") -> - | C36: =IF(ClosedSales!R16C8>Quota!R7C2,R17C2,"-") -> - | D36: =IF(ClosedSales!R21C8>Quota!R7C2,R17C2,"-") -> -
A38: Inside Sales Associate
A39: Commision | B39: =ClosedSales!R10C8*R20C2 -> 170.125 | C39: =ClosedSales!R16C8*R20C2 -> 342.8125 | D39: =ClosedSales!R21C8*R20C2 -> 284.25 | E39: =ClosedSales!R21C8*R20C2 -> 284.25
A40: Bonus | B40: =IF(ClosedSales!R10C8>Quota!R7C2,R17C2,"-") -> - | C40: =IF(ClosedSales!R16C8>Quota!R7C2,R17C2,"-") -> - | D40: =IF(ClosedSales!R21C8>Quota!R7C2,R17C2,"-") -> -
A42: Sales Engineer
A43: Commision | B43: =ClosedSales!R10C8*R20C2 -> 170.125 | C43: =ClosedSales!R16C8*R20C2 -> 342.8125 | D43: =ClosedSales!R21C8*R20C2 -> 284.25 | E43: =ClosedSales!R21C8*R20C2 -> 284.25
A44: Bonus | B44: =IF(ClosedSales!R10C8>Quota!R7C2,R17C2,"-") -> - | C44: =IF(ClosedSales!R16C8>Quota!R7C2,R17C2,"-") -> - | D44: =IF(ClosedSales!R21C8>Quota!R7C2,R17C2,"-") -> -
A46: Sales Engineer
A47: Commision | B47: =ClosedSales!R10C8*R20C2 -> 170.125 | C47: =ClosedSales!R16C8*R20C2 -> 342.8125 | D47: =ClosedSales!R21C8*R20C2 -> 284.25 | E47: =ClosedSales!R21C8*R20C2 -> 284.25
A48: Bonus | B48: =IF(ClosedSales!R10C8>Quota!R7C2,R17C2,"-") -> - | C48: =IF(ClosedSales!R16C8>Quota!R7C2,R17C2,"-") -> - | D48: =IF(ClosedSales!R21C8>Quota!R7C2,R17C2,"-") -> -
A50: Marketing Associate
A51: Bonus | B51: =ClosedSales!R10C8*R20C2 -> 170.125 | C51: =ClosedSales!R16C8*R20C2 -> 342.8125 | D51: =ClosedSales!R21C8*R20C2 -> 284.25 | E51: =ClosedSales!R21C8*R20C2 -> 284.25
A53: Total | B53: =SUM(R[-28]C:R[-2]C) -> 3066.5 | C53: =SUM(R[-28]C:R[-2]C) -> 6645 | D53: =SUM(R[-28]C:R[-2]C) -> 3411 | E53: =SUM(R[-28]C:R[-2]C) -> 10154.5

Sheet: Revenue
C2: Revenue feeds into monthly P&L | F2: Revenue for 2002 represents closed sales, revenue for 2003 represents projected sales.
C4: Assumptions:
C5: Prof Services Rev as % of License Rev | D5: 0.1
C6: Quarter over Quarter growth from Q102* | D6: 0.15
C7: * Assumes Capital Raise
C10: Quarterly | F10: 2002-03-31T00:00:00.000 | G10: 2002-06-30T00:00:00.000 | H10: 2002-09-30T00:00:00.000 | I10: 2002-12-31T00:00:00.000 | J10: Fiscal 2002 | K10: 2003-03-31T00:00:00.000 | L10: 2003-06-30T00:00:00.000 | M10: 2003-09-30T00:00:00.000 | N10: 2003-12-31T00:00:00.000 | O10: Fiscal 2003
F11: Q1-2001 | G11: Q2-2001 | H11: Q3-2001 | I11: Q4-2001 | J11: FY 2001 | K11: Q1-2002 | L11: Q2-2002 | M11: Q3-2002 | N11: Q4-2002 | O11: FY 2002
A13: Revenues
B14: License Revenues | F14: =ClosedSales!R[-6]C[-1]+ClosedSales!R[-5]C[-1] -> 87000 | G14: =ClosedSales!R[2]C[1]+SUM(ClosedSales!R[-6]C[2]:R[-5]C[2]) -> 141325 | H14: =ClosedSales!R[7]C+SUM(ClosedSales!R[-6]C[1]:R[1]C[1]) -> 141150 | I14: =ClosedSales!R[16]C[-1]+SUM(ClosedSales!R[-6]C:R[15]C) -> 372725 | J14: =SUM(RC[-4]:RC[-1]) -> 742200 | K14: =Pipeline!R[20]C[-3]+SUM(ClosedSales!R[-6]C[-2]:R[15]C[-2]) -> 440095 | L14: =Revenue!RC[-1]*(1+R[-8]C[-8]) -> 506109.24999999994 | M14: =Revenue!RC[-1]*(1+R[-8]C[-9]) -> 582025.63749999984 | N14: =Revenue!RC[-1]*(1+R[-8]C[-10]) -> 669329.4831249998 | O14: =SUM(RC[-4]:RC[-1]) -> 2197559.3706249995
B15: Prof Services | F15: 12000 | G15: =20000 -> 20000 | H15: =R[-1]C*R[-10]C[-4] -> 14115 | I15: =R[-1]C*R[-10]C[-5] -> 37272.5 | J15: =SUM(RC[-4]:RC[-1]) -> 83387.5 | K15: =R[-1]C*R5C4 -> 44009.5 | L15: =R[-1]C*R5C4 -> 50610.924999999996 | M15: =R[-1]C*R5C4 -> 58202.563749999987 | N15: =R[-1]C*R5C4 -> 66932.948312499982 | O15: =SUM(RC[-4]:RC[-1]) -> 219755.93706249993
C16: Total Revenue | F16: =SUM(R[-2]C:R[-1]C) -> 99000 | G16: =SUM(R[-2]C:R[-1]C) -> 161325 | H16: =SUM(R[-2]C:R[-1]C) -> 155265 | I16: =SUM(R[-2]C:R[-1]C) -> 409997.5 | J16: =SUM(R[-2]C:R[-1]C) -> 825587.5 | K16: =SUM(R[-2]C:R[-1]C) -> 484104.5 | L16: =SUM(R[-2]C:R[-1]C) -> 556720.17499999993 | M16: =SUM(R[-2]C:R[-1]C) -> 640228.20124999981 | N16: =SUM(R[-2]C:R[-1]C) -> 736262.43143749982 | O16: =SUM(R[-2]C:R[-1]C) -> 2417315.3076874996
C20: Monthly | F20: 2002-01-01T00:00:00.000 | G20: 2002-02-01T00:00:00.000 | H20: 2002-03-01T00:00:00.000 | I20: 2002-04-01T00:00:00.000 | J20: 2002-05-01T00:00:00.000 | K20: 2002-06-01T00:00:00.000 | L20: 2002-07-01T00:00:00.000 | M20: 2002-08-01T00:00:00.000 | N20: 2002-09-01T00:00:00.000 | O20: 2002-10-01T00:00:00.000 | P20: 2002-11-01T00:00:00.000 | Q20: 2002-12-01T00:00:00.000
A22: Revenues
B23: License Revenues | F23: =R[-9]C6*0.2 -> 17400 | G23: =R[-9]C6*0.3 -> 26100 | H23: =R[-9]C6*0.5 -> 43500 | I23: =R[-9]C7*0.2 -> 28265 | J23: =R[-9]C7*0.3 -> 42397.5 | K23: =R[-9]C7*0.5 -> 70662.5 | L23: =R[-9]C8*0.2 -> 28230 | M23: =R[-9]C8*0.3 -> 42345 | N23: =R[-9]C8*0.5 -> 70575 | O23: =R[-9]C9*0.2 -> 74545 | P23: =R[-9]C9*0.3 -> 111817.5 | Q23: =R[-9]C9*0.5 -> 186362.5
B24: Prof Services | F24: =R[-9]C6*0.2 -> 2400 | G24: =R[-9]C6*0.3 -> 3600 | H24: =R[-9]C6*0.5 -> 6000 | I24: =R[-9]C7*0.2 -> 4000 | J24: =R[-9]C7*0.3 -> 6000 | K24: =R[-9]C7*0.5 -> 10000 | L24: =R[-9]C8*0.2 -> 2823 | M24: =R[-9]C8*0.3 -> 4234.5 | N24: =R[-9]C8*0.5 -> 7057.5 | O24: =R[-9]C9*0.2 -> 7454.5 | P24: =R[-9]C9*0.3 -> 11181.75 | Q24: =R[-9]C9*0.5 -> 18636.25
C25: Total Revenue | F25: =SUM(R[-2]C:R[-1]C) -> 19800 | G25: =SUM(R[-2]C:R[-1]C) -> 29700 | H25: =SUM(R[-2]C:R[-1]C) -> 49500 | I25: =SUM(R[-2]C:R[-1]C) -> 32265 | J25: =SUM(R[-2]C:R[-1]C) -> 48397.5 | K25: =SUM(R[-2]C:R[-1]C) -> 80662.5 | L25: =SUM(R[-2]C:R[-1]C) -> 31053 | M25: =SUM(R[-2]C:R[-1]C) -> 46579.5 | N25: =SUM(R[-2]C:R[-1]C) -> 77632.5 | O25: =SUM(R[-2]C:R[-1]C) -> 81999.5 | P25: =SUM(R[-2]C:R[-1]C) -> 122999.25 | Q25: =SUM(R[-2]C:R[-1]C) -> 204998.75
C29: Monthly | F29: 2003-01-01T00:00:00.000 | G29: 2003-02-01T00:00:00.000 | H29: 2003-03-01T00:00:00.000 | I29: 2003-04-01T00:00:00.000 | J29: 2003-05-01T00:00:00.000 | K29: 2003-06-01T00:00:00.000 | L29: 2003-07-01T00:00:00.000 | M29: 2003-08-01T00:00:00.000 | N29: 2003-09-01T00:00:00.000 | O29: 2003-10-01T00:00:00.000 | P29: 2003-11-01T00:00:00.000 | Q29: 2003-12-01T00:00:00.000
A31: Revenues
B32: License Revenues | F32: =R[-18]C11*0.2 -> 88019 | G32: =R[-18]C11*0.3 -> 132028.5 | H32: =R[-18]C11*0.5 -> 220047.5 | I32: =R[-18]C12*0.2 -> 101221.84999999999 | J32: =R[-18]C12*0.3 -> 151832.77499999997 | K32: =R[-18]C12*0.5 -> 253054.62499999997 | L32: =R[-18]C13*0.2 -> 116405.12749999997 | M32: =R[-18]C13*0.3 -> 174607.69124999995 | N32: =R[-18]C13*0.5 -> 291012.81874999992 | O32: =R[-18]C14*0.2 -> 133865.89662499996 | P32: =R[-18]C14*0.3 -> 200798.84493749993 | Q32: =R[-18]C14*0.5 -> 334664.7415624999
B33: Prof Services | F33: =R[-18]C11*0.2 -> 8801.9 | G33: =R[-18]C11*0.3 -> 13202.85 | H33: =R[-18]C11*0.5 -> 22004.75 | I33: =R[-18]C12*0.2 -> 10122.184999999999 | J33: =R[-18]C12*0.3 -> 15183.277499999998 | K33: =R[-18]C12*0.5 -> 25305.462499999998 | L33: =R[-18]C13*0.2 -> 11640.512749999998 | M33: =R[-18]C13*0.3 -> 17460.769124999995 | N33: =R[-18]C13*0.5 -> 29101.281874999993 | O33: =R[-18]C14*0.2 -> 13386.589662499997 | P33: =R[-18]C14*0.3 -> 20079.884493749993 | Q33: =R[-18]C14*0.5 -> 33466.474156249991
C34: Total Revenue | F34: =SUM(R[-2]C:R[-1]C) -> 96820.9 | G34: =SUM(R[-2]C:R[-1]C) -> 145231.35 | H34: =SUM(R[-2]C:R[-1]C) -> 242052.25 | I34: =SUM(R[-2]C:R[-1]C) -> 111344.03499999999 | J34: =SUM(R[-2]C:R[-1]C) -> 167016.05249999996 | K34: =SUM(R[-2]C:R[-1]C) -> 278360.08749999997 | L34: =SUM(R[-2]C:R[-1]C) -> 128045.64024999997 | M34: =SUM(R[-2]C:R[-1]C) -> 192068.46037499994 | N34: =SUM(R[-2]C:R[-1]C) -> 320114.1006249999 | O34: =SUM(R[-2]C:R[-1]C) -> 147252.48628749995 | P34: =SUM(R[-2]C:R[-1]C) -> 220878.72943124993 | Q34: =SUM(R[-2]C:R[-1]C) -> 368131.21571874991

Sheet: MonthlyPAndL
D3: Actual | E3: Actual | F3: Actual | G3: Actual | H3: Actual | I3: Actual | J3: Actual | K3: Actual | L3: Actual | M3: Actual | N3: Actual | O3: Actual | P3: Estimate | Q3: Estimate | R3: Estimate | S3: Estimate | T3: Estimate | U3: Estimate | V3: Estimate | W3: Estimate | X3: Estimate | Y3: Estimate | Z3: Estimate | AA3: Estimate
D4: 2002-01-01T00:00:00.000 | E4: 2002-02-01T00:00:00.000 | F4: 2002-03-01T00:00:00.000 | G4: 2002-04-01T00:00:00.000 | H4: 2002-05-01T00:00:00.000 | I4: 2002-06-01T00:00:00.000 | J4: 2002-07-01T00:00:00.000 | K4: 2002-08-01T00:00:00.000 | L4: 2002-09-01T00:00:00.000 | M4: 2002-10-01T00:00:00.000 | N4: 2002-11-01T00:00:00.000 | O4: 2002-12-01T00:00:00.000 | P4: 2003-01-01T00:00:00.000 | Q4: 2003-02-01T00:00:00.000 | R4: 2003-03-01T00:00:00.000 | S4: 2003-04-01T00:00:00.000 | T4: 2003-05-01T00:00:00.000 | U4: 2003-06-01T00:00:00.000 | V4: 2003-07-01T00:00:00.000 | W4: 2003-08-01T00:00:00.000 | X4: 2003-09-01T00:00:00.000 | Y4: 2003-10-01T00:00:00.000 | Z4: 2003-11-01T00:00:00.000 | AA4: 2003-12-01T00:00:00.000
A5: Revenues
B6: License Revenue | D6: =Revenue!R[17]C[2] -> 17400 | E6: =Revenue!R[17]C[2] -> 26100 | F6: =Revenue!R[17]C[2] -> 43500 | G6: =Revenue!R[17]C[2] -> 28265 | H6: =Revenue!R[17]C[2] -> 42397.5 | I6: =Revenue!R[17]C[2] -> 70662.5 | J6: =Revenue!R[17]C[2] -> 28230 | K6: =Revenue!R[17]C[2] -> 42345 | L6: =Revenue!R[17]C[2] -> 70575 | M6: =Revenue!R[17]C[2] -> 74545 | N6: =Revenue!R[17]C[2] -> 111817.5 | O6: =Revenue!R[17]C[2] -> 186362.5 | P6: =Revenue!R[26]C[-10] -> 88019 | Q6: =Revenue!R[26]C[-10] -> 132028.5 | R6: =Revenue!R[26]C[-10] -> 220047.5 | S6: =Revenue!R[26]C[-10] -> 101221.84999999999 | T6: =Revenue!R[26]C[-10] -> 151832.77499999997 | U6: =Revenue!R[26]C[-10] -> 253054.62499999997 | V6: =Revenue!R[26]C[-10] -> 116405.12749999997 | W6: =Revenue!R[26]C[-10] -> 174607.69124999995 | X6: =Revenue!R[26]C[-10] -> 291012.81874999992 | Y6: =Revenue!R[26]C[-10] -> 133865.89662499996 | Z6: =Revenue!R[26]C[-10] -> 200798.84493749993 | AA6: =Revenue!R[26]C[-10] -> 334664.7415624999
B7: Professional Services | D7: =Revenue!R[17]C[2] -> 2400 | E7: =Revenue!R[17]C[2] -> 3600 | F7: =Revenue!R[17]C[2] -> 6000 | G7: =Revenue!R[17]C[2] -> 4000 | H7: =Revenue!R[17]C[2] -> 6000 | I7: =Revenue!R[17]C[2] -> 10000 | J7: =Revenue!R[17]C[2] -> 2823 | K7: =Revenue!R[17]C[2] -> 4234.5 | L7: =Revenue!R[17]C[2] -> 7057.5 | M7: =Revenue!R[17]C[2] -> 7454.5 | N7: =Revenue!R[17]C[2] -> 11181.75 | O7: =Revenue!R[17]C[2] -> 18636.25 | P7: =Revenue!R[26]C[-10] -> 8801.9 | Q7: =Revenue!R[26]C[-10] -> 13202.85 | R7: =Revenue!R[26]C[-10] -> 22004.75 | S7: =Revenue!R[26]C[-10] -> 10122.184999999999 | T7: =Revenue!R[26]C[-10] -> 15183.277499999998 | U7: =Revenue!R[26]C[-10] -> 25305.462499999998 | V7: =Revenue!R[26]C[-10] -> 11640.512749999998 | W7: =Revenue!R[26]C[-10] -> 17460.769124999995 | X7: =Revenue!R[26]C[-10] -> 29101.281874999993 | Y7: =Revenue!R[26]C[-10] -> 13386.589662499997 | Z7: =Revenue!R[26]C[-10] -> 20079.884493749993 | AA7: =Revenue!R[26]C[-10] -> 33466.474156249991
C8: Total Revenue | D8: =SUM(R[-2]C:R[-1]C) -> 19800 | E8: =SUM(R[-2]C:R[-1]C) -> 29700 | F8: =SUM(R[-2]C:R[-1]C) -> 49500 | G8: =SUM(R[-2]C:R[-1]C) -> 32265 | H8: =SUM(R[-2]C:R[-1]C) -> 48397.5 | I8: =SUM(R[-2]C:R[-1]C) -> 80662.5 | J8: =SUM(R[-2]C:R[-1]C) -> 31053 | K8: =SUM(R[-2]C:R[-1]C) -> 46579.5 | L8: =SUM(R[-2]C:R[-1]C) -> 77632.5 | M8: =SUM(R[-2]C:R[-1]C) -> 81999.5 | N8: =SUM(R[-2]C:R[-1]C) -> 122999.25 | O8: =SUM(R[-2]C:R[-1]C) -> 204998.75 | P8: =SUM(R[-2]C:R[-1]C) -> 96820.9 | Q8: =SUM(R[-2]C:R[-1]C) -> 145231.35 | R8: =SUM(R[-2]C:R[-1]C) -> 242052.25 | S8: =SUM(R[-2]C:R[-1]C) -> 111344.03499999999 | T8: =SUM(R[-2]C:R[-1]C) -> 167016.05249999996 | U8: =SUM(R[-2]C:R[-1]C) -> 278360.08749999997 | V8: =SUM(R[-2]C:R[-1]C) -> 128045.64024999997 | W8: =SUM(R[-2]C:R[-1]C) -> 192068.46037499994 | X8: =SUM(R[-2]C:R[-1]C) -> 320114.1006249999 | Y8: =SUM(R[-2]C:R[-1]C) -> 147252.48628749995 | Z8: =SUM(R[-2]C:R[-1]C) -> 220878.72943124993 | AA8: =SUM(R[-2]C:R[-1]C) -> 368131.21571874991
A10: Cost of Revenue
B11: Cost of Licenses | D11: =0.01*R[-5]C -> 174 | E11: =0.01*R[-5]C -> 261 | F11: =0.01*R[-5]C -> 435 | G11: =0.01*R[-5]C -> 282.65000000000003 | H11: =0.01*R[-5]C -> 423.97500000000002 | I11: =0.01*R[-5]C -> 706.625 | J11: =0.01*R[-5]C -> 282.3 | K11: =0.01*R[-5]C -> 423.45 | L11: =0.01*R[-5]C -> 705.75 | M11: =0.01*R[-5]C -> 745.45 | N11: =0.01*R[-5]C -> 1118.175 | O11: =0.01*R[-5]C -> 1863.625 | P11: =0.01*R[-5]C -> 880.19 | Q11: =0.01*R[-5]C -> 1320.2850000000001 | R11: =0.01*R[-5]C -> 2200.4749999999999 | S11: =0.01*R[-5]C -> 1012.2184999999999 | T11: =0.01*R[-5]C -> 1518.3277499999997 | U11: =0.01*R[-5]C -> 2530.5462499999999 | V11: =0.01*R[-5]C -> 1164.0512749999998 | W11: =0.01*R[-5]C -> 1746.0769124999995 | X11: =0.01*R[-5]C -> 2910.1281874999991 | Y11: =0.01*R[-5]C -> 1338.6589662499996 | Z11: =0.01*R[-5]C -> 2007.9884493749994 | AA11: =0.01*R[-5]C -> 3346.6474156249992
B12: Cost of Services | D12: =Employees!R110C2 -> 21385 | E12: =Employees!R110C2 -> 21385 | F12: =Employees!R110C2 -> 21385 | G12: =Employees!R110C2 -> 21385 | H12: =Employees!R110C2 -> 21385 | I12: =Employees!R110C2 -> 21385 | J12: =Employees!R110C2 -> 21385 | K12: =Employees!R110C2 -> 21385 | L12: =Employees!R110C2 -> 21385 | M12: =Employees!R110C2 -> 21385 | N12: =Employees!R110C2 -> 21385 | O12: =Employees!R110C2 -> 21385 | P12: =Employees!R110C2 -> 21385 | Q12: =Employees!R110C2 -> 21385 | R12: =Employees!R110C2 -> 21385 | S12: =Employees!R110C7 -> 33735 | T12: =Employees!R110C7 -> 33735 | U12: =Employees!R110C7 -> 33735 | V12: =Employees!R110C7 -> 33735 | W12: =Employees!R110C7 -> 33735 | X12: =Employees!R110C7 -> 33735 | Y12: =Employees!R110C7 -> 33735 | Z12: =Employees!R110C7 -> 33735 | AA12: =Employees!R110C7 -> 33735
C13: Total Cost of Revenue | D13: =SUM(R[-2]C:R[-1]C) -> 21559 | E13: =SUM(R[-2]C:R[-1]C) -> 21646 | F13: =SUM(R[-2]C:R[-1]C) -> 21820 | G13: =SUM(R[-2]C:R[-1]C) -> 21667.65 | H13: =SUM(R[-2]C:R[-1]C) -> 21808.974999999999 | I13: =SUM(R[-2]C:R[-1]C) -> 22091.625 | J13: =SUM(R[-2]C:R[-1]C) -> 21667.3 | K13: =SUM(R[-2]C:R[-1]C) -> 21808.45 | L13: =SUM(R[-2]C:R[-1]C) -> 22090.75 | M13: =SUM(R[-2]C:R[-1]C) -> 22130.45 | N13: =SUM(R[-2]C:R[-1]C) -> 22503.174999999999 | O13: =SUM(R[-2]C:R[-1]C) -> 23248.625 | P13: =SUM(R[-2]C:R[-1]C) -> 22265.19 | Q13: =SUM(R[-2]C:R[-1]C) -> 22705.285 | R13: =SUM(R[-2]C:R[-1]C) -> 23585.474999999999 | S13: =SUM(R[-2]C:R[-1]C) -> 34747.218500000003 | T13: =SUM(R[-2]C:R[-1]C) -> 35253.327749999997 | U13: =SUM(R[-2]C:R[-1]C) -> 36265.546249999999 | V13: =SUM(R[-2]C:R[-1]C) -> 34899.051274999998 | W13: =SUM(R[-2]C:R[-1]C) -> 35481.076912500001 | X13: =SUM(R[-2]C:R[-1]C) -> 36645.128187499999 | Y13: =SUM(R[-2]C:R[-1]C) -> 35073.658966249997 | Z13: =SUM(R[-2]C:R[-1]C) -> 35742.988449375 | AA13: =SUM(R[-2]C:R[-1]C) -> 37081.647415624997
A15: Gross Profit | D15: =R[-7]C-R[-2]C -> -1759 | E15: =R[-7]C-R[-2]C -> 8054 | F15: =R[-7]C-R[-2]C -> 27680 | G15: =R[-7]C-R[-2]C -> 10597.349999999999 | H15: =R[-7]C-R[-2]C -> 26588.525000000001 | I15: =R[-7]C-R[-2]C -> 58570.875 | J15: =R[-7]C-R[-2]C -> 9385.7000000000007 | K15: =R[-7]C-R[-2]C -> 24771.05 | L15: =R[-7]C-R[-2]C -> 55541.75 | M15: =R[-7]C-R[-2]C -> 59869.05 | N15: =R[-7]C-R[-2]C -> 100496.075 | O15: =R[-7]C-R[-2]C -> 181750.125 | P15: =R[-7]C-R[-2]C -> 74555.709999999992 | Q15: =R[-7]C-R[-2]C -> 122526.065 | R15: =R[-7]C-R[-2]C -> 218466.77499999999 | S15: =R[-7]C-R[-2]C -> 76596.816499999986 | T15: =R[-7]C-R[-2]C -> 131762.72474999996 | U15: =R[-7]C-R[-2]C -> 242094.54124999995 | V15: =R[-7]C-R[-2]C -> 93146.588974999962 | W15: =R[-7]C-R[-2]C -> 156587.38346249994 | X15: =R[-7]C-R[-2]C -> 283468.97243749991 | Y15: =R[-7]C-R[-2]C -> 112178.82732124996 | Z15: =R[-7]C-R[-2]C -> 185135.74098187493 | AA15: =R[-7]C-R[-2]C -> 331049.56830312492
A17: Operating Expenses
B18: Sales and Marketing | D18: =((Employees!R60C2+ServiceExpense!R25C2+EquipmentExpense!R29C4)+Quota!R53C2/3)*0.5 -> 46334.797684836514 | E18: =((Employees!R60C2+ServiceExpense!R25C2+EquipmentExpense!R29C4)+Quota!R53C2/3)*0.75 -> 69502.196527254768 | F18: =(Employees!R60C2+ServiceExpense!R25C2+EquipmentExpense!R29C4)+Quota!R53C2/3 -> 92669.595369673028 | G18: =(Employees!R60C2+ServiceExpense!R25C2+EquipmentExpense!R29C4)+Quota!R53C3/3 -> 93862.428703006357 | H18: =(Employees!R60C2+ServiceExpense!R25C2+EquipmentExpense!R29C4)+Quota!R53C3/3 -> 93862.428703006357 | I18: =(Employees!R60C2+ServiceExpense!R25C2+EquipmentExpense!R29C4)+Quota!R53C3/3 -> 93862.428703006357 | J18: =(Employees!R60C2+ServiceExpense!R25C2+EquipmentExpense!R29C4)+Quota!R53C4/3 -> 92784.428703006357 | K18: =(Employees!R60C2+ServiceExpense!R25C2+EquipmentExpense!R29C4)+Quota!R53C4/3 -> 92784.428703006357 | L18: =(Employees!R60C2+ServiceExpense!R25C2+EquipmentExpense!R29C4)+Quota!R53C4/3 -> 92784.428703006357 | M18: =(Employees!R60C2+ServiceExpense!R25C2+EquipmentExpense!R29C4)+Quota!R53C5/3 -> 95032.262036339685 | N18: =(Employees!R60C2+ServiceExpense!R25C2+EquipmentExpense!R29C4)+Quota!R53C5/3 -> 95032.262036339685 | O18: =(Employees!R60C2+ServiceExpense!R25C2+EquipmentExpense!R29C4)+Quota!R53C5/3 -> 95032.262036339685 | P18: =(Employees!R60C2+ServiceExpense!R25C2+EquipmentExpense!R29C4)+R[-12]C*0.05 -> 96048.378703006354 | Q18: =(Employees!R60C2+ServiceExpense!R25C2+EquipmentExpense!R29C4)+R[-12]C*0.05 -> 98248.85370300636 | R18: =(Employees!R60C2+ServiceExpense!R25C2+EquipmentExpense!R29C4)+R[-12]C*0.05 -> 102649.80370300636 | S18: =(Employees!R60C2+ServiceExpense!R25C2+EquipmentExpense!R29C4)+R[-12]C*0.05 -> 96708.521203006356 | T18: =(Employees!R60C7+EquipmentExpense!R29C10+ServiceExpense!R25C6)+R[-12]C*0.05 -> 161796.68449994968 | U18: =(Employees!R60C7+EquipmentExpense!R29C10+ServiceExpense!R25C6)+R[-12]C*0.05 -> 166857.77699994971 | V18: =(Employees!R60C7+EquipmentExpense!R29C10+ServiceExpense!R25C6)+R[-12]C*0.05 -> 160025.3021249497 | W18: =(Employees!R60C7+EquipmentExpense!R29C10+ServiceExpense!R25C6)+R[-12]C*0.05 -> 162935.43031244969 | X18: =(Employees!R60C7+EquipmentExpense!R29C10+ServiceExpense!R25C6)+R[-12]C*0.05 -> 168755.68668744969 | Y18: =(Employees!R60C7+EquipmentExpense!R29C10+ServiceExpense!R25C6)+R[-12]C*0.05 -> 160898.34058119971 | Z18: =(Employees!R60C7+EquipmentExpense!R29C10+ServiceExpense!R25C6)+R[-12]C*0.05 -> 164244.9879968247 | AA18: =(Employees!R60C7+EquipmentExpense!R29C10+ServiceExpense!R25C6)+R[-12]C*0.05 -> 170938.28282807471
B19: Research and Development | D19: =((Employees!R95C2+EquipmentExpense!R32C4+ServiceExpense!R33C2))*0.5 -> 55024.857406012714 | E19: =((Employees!R95C2+EquipmentExpense!R32C4+ServiceExpense!R33C2))*0.75 -> 82537.286109019071 | F19: =(Employees!R95C2+EquipmentExpense!R32C4+ServiceExpense!R33C2) -> 110049.71481202543 | G19: =(Employees!R95C2+EquipmentExpense!R32C4+ServiceExpense!R33C2) -> 110049.71481202543 | H19: =(Employees!R95C2+EquipmentExpense!R32C4+ServiceExpense!R33C2) -> 110049.71481202543 | I19: =(Employees!R95C2+EquipmentExpense!R32C4+ServiceExpense!R33C2) -> 110049.71481202543 | J19: =(Employees!R95C2+EquipmentExpense!R32C4+ServiceExpense!R33C2) -> 110049.71481202543 | K19: =(Employees!R95C2+EquipmentExpense!R32C4+ServiceExpense!R33C2) -> 110049.71481202543 | L19: =(Employees!R95C2+EquipmentExpense!R32C4+ServiceExpense!R33C2) -> 110049.71481202543 | M19: =(Employees!R95C2+EquipmentExpense!R32C4+ServiceExpense!R33C2) -> 110049.71481202543 | N19: =(Employees!R95C2+EquipmentExpense!R32C4+ServiceExpense!R33C2) -> 110049.71481202543 | O19: =(Employees!R95C2+EquipmentExpense!R32C4+ServiceExpense!R33C2) -> 110049.71481202543 | P19: =(Employees!R95C2+EquipmentExpense!R32C4+ServiceExpense!R33C2) -> 110049.71481202543 | Q19: =(Employees!R95C2+EquipmentExpense!R32C4+ServiceExpense!R33C2) -> 110049.71481202543 | R19: =(Employees!R95C2+EquipmentExpense!R32C4+ServiceExpense!R33C2) -> 110049.71481202543 | S19: =(Employees!R95C2+EquipmentExpense!R32C4+ServiceExpense!R33C2) -> 110049.71481202543 | T19: =Employees!R95C7+EquipmentExpense!R25C10+ServiceExpense!R33C6 -> 144656.97166633117 | U19: =Employees!R95C7+EquipmentExpense!R25C10+ServiceExpense!R33C6 -> 144656.97166633117 | V19: =Employees!R95C7+EquipmentExpense!R25C10+ServiceExpense!R33C6 -> 144656.97166633117 | W19: =Employees!R95C7+EquipmentExpense!R25C10+ServiceExpense!R33C6 -> 144656.97166633117 | X19: =Employees!R95C7+EquipmentExpense!R25C10+ServiceExpense!R33C6 -> 144656.97166633117 | Y19: =Employees!R95C7+EquipmentExpense!R25C10+ServiceExpense!R33C6 -> 144656.97166633117 | Z19: =Employees!R95C7+EquipmentExpense!R25C10+ServiceExpense!R33C6 -> 144656.97166633117 | AA19: =Employees!R95C7+EquipmentExpense!R25C10+ServiceExpense!R33C6 -> 144656.97166633117
B20: General and Administrative | D20: =((Employees!R34C2+EquipmentExpense!R35C4+ServiceExpense!R44C2))*0.5 -> 31640.357252505295 | E20: =(Employees!R34C2+EquipmentExpense!R35C4+ServiceExpense!R44C2)*0.75 -> 47460.535878757946 | F20: =(Employees!R34C2+EquipmentExpense!R35C4+ServiceExpense!R44C2) -> 63280.71450501059 | G20: =(Employees!R34C2+EquipmentExpense!R35C4+ServiceExpense!R44C2) -> 63280.71450501059 | H20: =(Employees!R34C2+EquipmentExpense!R35C4+ServiceExpense!R44C2) -> 63280.71450501059 | I20: =(Employees!R34C2+EquipmentExpense!R35C4+ServiceExpense!R44C2) -> 63280.71450501059 | J20: =(Employees!R34C2+EquipmentExpense!R35C4+ServiceExpense!R44C2) -> 63280.71450501059 | K20: =(Employees!R34C2+EquipmentExpense!R35C4+ServiceExpense!R44C2) -> 63280.71450501059 | L20: =(Employees!R34C2+EquipmentExpense!R35C4+ServiceExpense!R44C2) -> 63280.71450501059 | M20: =(Employees!R34C2+EquipmentExpense!R35C4+ServiceExpense!R44C2) -> 63280.71450501059 | N20: =(Employees!R34C2+EquipmentExpense!R35C4+ServiceExpense!R44C2) -> 63280.71450501059 | O20: =(Employees!R34C2+EquipmentExpense!R35C4+ServiceExpense!R44C2) -> 63280.71450501059 | P20: =(Employees!R34C2+EquipmentExpense!R35C4+ServiceExpense!R44C2) -> 63280.71450501059 | Q20: =(Employees!R34C2+EquipmentExpense!R35C4+ServiceExpense!R44C2) -> 63280.71450501059 | R20: =(Employees!R34C2+EquipmentExpense!R35C4+ServiceExpense!R44C2) -> 63280.71450501059 | S20: =(Employees!R34C2+EquipmentExpense!R35C4+ServiceExpense!R44C2) -> 63280.71450501059 | T20: =Employees!R36C7+EquipmentExpense!R35C10+ServiceExpense!R44C6 -> 76466.742916582793 | U20: =Employees!R36C7+EquipmentExpense!R35C10+ServiceExpense!R44C6 -> 76466.742916582793 | V20: =Employees!R36C7+EquipmentExpense!R35C10+ServiceExpense!R44C6 -> 76466.742916582793 | W20: =Employees!R36C7+EquipmentExpense!R35C10+ServiceExpense!R44C6 -> 76466.742916582793 | X20: =Employees!R36C7+EquipmentExpense!R35C10+ServiceExpense!R44C6 -> 76466.742916582793 | Y20: =Employees!R36C7+EquipmentExpense!R35C10+ServiceExpense!R44C6 -> 76466.742916582793 | Z20: =Employees!R36C7+EquipmentExpense!R35C10+ServiceExpense!R44C6 -> 76466.742916582793 | AA20: =Employees!R36C7+EquipmentExpense!R35C10+ServiceExpense!R44C6 -> 76466.742916582793
B21: Depreciation | D21: =CapLease!R[-10]C[17] -> 4861.1111111111113 | E21: =CapLease!R[-9]C[16] -> 4861.1111111111113 | F21: =CapLease!R[-8]C[15] -> 4861.1111111111113 | G21: =CapLease!R[-7]C[14] -> 4861.1111111111113 | H21: =CapLease!R[-6]C[13] -> 4861.1111111111113 | I21: =CapLease!R[-5]C[12] -> 4861.1111111111113 | J21: =CapLease!R[-4]C[11] -> 4861.1111111111113 | K21: =CapLease!R[-3]C[10] -> 4861.1111111111113 | L21: =CapLease!R[-2]C[9] -> 4861.1111111111113 | M21: =CapLease!R[-1]C[8] -> 4861.1111111111113 | N21: =CapLease!RC[7] -> 4861.1111111111113 | O21: =CapLease!R[1]C[6] -> 4861.1111111111113 | P21: =CapLease!R[2]C[5] -> 6250 | Q21: =CapLease!R[3]C[4] -> 6250 | R21: =CapLease!R[4]C[3] -> 6250 | S21: =CapLease!R[5]C[2] -> 6250 | T21: =CapLease!R[6]C[1] -> 6250 | U21: =CapLease!R[7]C -> 6250 | V21: =CapLease!R[8]C[-1] -> 6250 | W21: =CapLease!R[9]C[-2] -> 6250 | X21: =CapLease!R[10]C[-3] -> 6250 | Y21: =CapLease!R[11]C[-4] -> 6250 | Z21: =CapLease!R[12]C[-5] -> 6250 | AA21: =CapLease!R[13]C[-6] -> 6250
C22: Total Operating Expenses | D22: =SUM(R[-4]C:R[-1]C) -> 137861.12345446565 | E22: =SUM(R[-4]C:R[-1]C) -> 204361.12962614291 | F22: =SUM(R[-4]C:R[-1]C) -> 270861.13579782017 | G22: =SUM(R[-4]C:R[-1]C) -> 272053.96913115348 | H22: =SUM(R[-4]C:R[-1]C) -> 272053.96913115348 | I22: =SUM(R[-4]C:R[-1]C) -> 272053.96913115348 | J22: =SUM(R[-4]C:R[-1]C) -> 270975.96913115348 | K22: =SUM(R[-4]C:R[-1]C) -> 270975.96913115348 | L22: =SUM(R[-4]C:R[-1]C) -> 270975.96913115348 | M22: =SUM(R[-4]C:R[-1]C) -> 273223.8024644868 | N22: =SUM(R[-4]C:R[-1]C) -> 273223.8024644868 | O22: =SUM(R[-4]C:R[-1]C) -> 273223.8024644868 | P22: =SUM(R[-4]C:R[-1]C) -> 275628.80802004237 | Q22: =SUM(R[-4]C:R[-1]C) -> 277829.28302004235 | R22: =SUM(R[-4]C:R[-1]C) -> 282230.23302004236 | S22: =SUM(R[-4]C:R[-1]C) -> 276288.95052004239 | T22: =SUM(R[-4]C:R[-1]C) -> 389170.39908286365 | U22: =SUM(R[-4]C:R[-1]C) -> 394231.49158286367 | V22: =SUM(R[-4]C:R[-1]C) -> 387399.01670786366 | W22: =SUM(R[-4]C:R[-1]C) -> 390309.14489536366 | X22: =SUM(R[-4]C:R[-1]C) -> 396129.40127036365 | Y22: =SUM(R[-4]C:R[-1]C) -> 388272.0551641137 | Z22: =SUM(R[-4]C:R[-1]C) -> 391618.70257973863 | AA22: =SUM(R[-4]C:R[-1]C) -> 398311.99741098867
A23: Operating Income | D23: =R[-8]C-R[-1]C -> -139620.12345446565 | E23: =R[-8]C-R[-1]C -> -196307.12962614291 | F23: =R[-8]C-R[-1]C -> -243181.13579782017 | G23: =R[-8]C-R[-1]C -> -261456.61913115348 | H23: =R[-8]C-R[-1]C -> -245465.44413115349 | I23: =R[-8]C-R[-1]C -> -213483.09413115348 | J23: =R[-8]C-R[-1]C -> -261590.26913115347 | K23: =R[-8]C-R[-1]C -> -246204.9191311535 | L23: =R[-8]C-R[-1]C -> -215434.21913115348 | M23: =R[-8]C-R[-1]C -> -213354.75246448681 | N23: =R[-8]C-R[-1]C -> -172727.72746448679 | O23: =R[-8]C-R[-1]C -> -91473.677464486798 | P23: =R[-8]C-R[-1]C -> -201073.09802004238 | Q23: =R[-8]C-R[-1]C -> -155303.21802004235 | R23: =R[-8]C-R[-1]C -> -63763.458020042366 | S23: =R[-8]C-R[-1]C -> -199692.1340200424 | T23: =R[-8]C-R[-1]C -> -257407.67433286368 | U23: =R[-8]C-R[-1]C -> -152136.95033286372 | V23: =R[-8]C-R[-1]C -> -294252.4277328637 | W23: =R[-8]C-R[-1]C -> -233721.76143286371 | X23: =R[-8]C-R[-1]C -> -112660.42883286375 | Y23: =R[-8]C-R[-1]C -> -276093.22784286377 | Z23: =R[-8]C-R[-1]C -> -206482.9615978637 | AA23: =R[-8]C-R[-1]C -> -67262.429107863747
B24: Other income, net | D24: =(3000000*0.0025)-CapLease!R[-13]C[15] -> 5750 | E24: =(BalanceSheet!R[-18]C*0.0025)-CapLease!R12C19 -> 5544.2087507709812 | F24: =(BalanceSheet!R[-18]C*0.0025)-CapLease!R13C19 -> 5109.6089458059896 | G24: =(BalanceSheet!R[-18]C*0.0025)-CapLease!R14C19 -> 4556.4266105938505 | H24: =(BalanceSheet!R[-18]C*0.0025)-CapLease!R15C19 -> 3958.798110751748 | I24: =(BalanceSheet!R[-18]C*0.0025)-CapLease!R16C19 -> 3397.8819285718555 | J24: =(BalanceSheet!R[-18]C*0.0025)-CapLease!R17C19 -> 2914.8281090499459 | K24: =(BalanceSheet!R[-18]C*0.0025)-CapLease!R18C19 -> 2315.7361036862994 | L24: =(BalanceSheet!R[-18]C*0.0025)-CapLease!R19C19 -> 1749.8621755658826 | M24: =(BalanceSheet!R[-18]C*0.0025)-CapLease!R20C19 -> 1258.8565729543689 | N24: =(BalanceSheet!R[-18]C*0.0025)-CapLease!R21C19 -> 773.81993124799033 | O24: =(BalanceSheet!R[-18]C*0.0025)-CapLease!R22C19 -> 387.18194613979244 | P24: =(BalanceSheet!R[-18]C*0.0025)-CapLease!R22C19 -> 155.16249796325496 | Q24: =(BalanceSheet!R[-18]C*0.0025)-CapLease!R22C19 -> -339.09234253608111 | R24: =(BalanceSheet!R[-18]C*0.0025)-CapLease!R22C19 -> -730.08835005985691 | S24: =(BalanceSheet!R[-18]C*0.0025)-CapLease!R22C19 -> -896.38299651236571 | T24: =(BalanceSheet!R[-18]C*0.0025)-CapLease!R22C19 -> 11111.159155363723 | U24: =(BalanceSheet!R[-18]C*0.0025)-CapLease!R22C19 -> 10492.634739115998 | V24: =(BalanceSheet!R[-18]C*0.0025)-CapLease!R22C19 -> 10132.112034461799 | W24: =(BalanceSheet!R[-18]C*0.0025)-CapLease!R22C19 -> 9431.6022055517678 | X24: =(BalanceSheet!R[-18]C*0.0025)-CapLease!R22C19 -> 8867.1194016823538 | Y24: =(BalanceSheet!R[-18]C*0.0025)-CapLease!R22C19 -> 8599.7234862500191 | Z24: =(BalanceSheet!R[-18]C*0.0025)-CapLease!R22C19 -> 7941.728439022434 | AA24: =(BalanceSheet!R[-18]C*0.0025)-CapLease!R22C19 -> 7440.5516773243817
A25: Income Before Taxes | D25: =R[-2]C+R[-1]C -> -133870.12345446565 | E25: =R[-2]C+R[-1]C -> -190762.92087537193 | F25: =R[-2]C+R[-1]C -> -238071.52685201418 | G25: =R[-2]C+R[-1]C -> -256900.19252055962 | H25: =R[-2]C+R[-1]C -> -241506.64602040173 | I25: =R[-2]C+R[-1]C -> -210085.21220258164 | J25: =R[-2]C+R[-1]C -> -258675.44102210354 | K25: =R[-2]C+R[-1]C -> -243889.1830274672 | L25: =R[-2]C+R[-1]C -> -213684.3569555876 | M25: =R[-2]C+R[-1]C -> -212095.89589153245 | N25: =R[-2]C+R[-1]C -> -171953.90753323879 | O25: =R[-2]C+R[-1]C -> -91086.495518347001 | P25: =R[-2]C+R[-1]C -> -200917.93552207912 | Q25: =R[-2]C+R[-1]C -> -155642.31036257843 | R25: =R[-2]C+R[-1]C -> -64493.546370102224 | S25: =R[-2]C+R[-1]C -> -200588.51701655478 | T25: =R[-2]C+R[-1]C -> -246296.51517749997 | U25: =R[-2]C+R[-1]C -> -141644.31559374771 | V25: =R[-2]C+R[-1]C -> -284120.31569840189 | W25: =R[-2]C+R[-1]C -> -224290.15922731196 | X25: =R[-2]C+R[-1]C -> -103793.30943118139 | Y25: =R[-2]C+R[-1]C -> -267493.50435661373 | Z25: =R[-2]C+R[-1]C -> -198541.23315884126 | AA25: =R[-2]C+R[-1]C -> -59821.877430539367
B26: Income Tax Provision | D26: 0 | E26: 0 | F26: 0 | G26: 0 | H26: 0 | I26: 0 | J26: 0 | K26: 0 | L26: 0 | M26: 0 | N26: 0 | O26: 0 | P26: 0 | Q26: 0 | R26: 0 | S26: 0 | T26: 0 | U26: 0 | V26: 0 | W26: 0 | X26: 0 | Y26: 0 | Z26: 0 | AA26: 0
A27: Net Income | D27: =R[-2]C -> -133870.12345446565 | E27: =R[-2]C -> -190762.92087537193 | F27: =R[-2]C -> -238071.52685201418 | G27: =R[-2]C -> -256900.19252055962 | H27: =R[-2]C -> -241506.64602040173 | I27: =R[-2]C -> -210085.21220258164 | J27: =R[-2]C -> -258675.44102210354 | K27: =R[-2]C -> -243889.1830274672 | L27: =R[-2]C -> -213684.3569555876 | M27: =R[-2]C -> -212095.89589153245 | N27: =R[-2]C -> -171953.90753323879 | O27: =R[-2]C -> -91086.495518347001 | P27: =R[-2]C -> -200917.93552207912 | Q27: =R[-2]C -> -155642.31036257843 | R27: =R[-2]C -> -64493.546370102224 | S27: =R[-2]C -> -200588.51701655478 | T27: =R[-2]C -> -246296.51517749997 | U27: =R[-2]C -> -141644.31559374771 | V27: =R[-2]C -> -284120.31569840189 | W27: =R[-2]C -> -224290.15922731196 | X27: =R[-2]C -> -103793.30943118139 | Y27: =R[-2]C -> -267493.50435661373 | Z27: =R[-2]C -> -198541.23315884126 | AA27: =R[-2]C -> -59821.877430539367

Sheet: QuarterlyPAndL
A1: Historical and Projected Income Statement as of December 31, 2002 (unaudited)
D3: Actual | E3: Actual | F3: Actual | G3: Actual | H3: Actual | J3: Estimate | K3: Estimate | L3: Estimate | M3: Estimate | N3: Estimate
D4: Q1-2002 | E4: Q2-2002 | F4: Q3-2002 | G4: Q4-2002 | H4: FY 2002 | J4: Q1-2003 | K4: Q2-2003 | L4: Q3-2003 | M4: Q4-2003 | N4: FY 2003
A5: Revenues
B6: License Revenue | D6: =SUM(MonthlyPAndL!RC:RC[2]) -> 87000 | E6: =SUM(MonthlyPAndL!RC[2]:RC[4]) -> 141325 | F6: =SUM(MonthlyPAndL!RC[4]:RC[6]) -> 141150 | G6: =SUM(MonthlyPAndL!RC[6]:RC[8]) -> 372725 | H6: =SUM(RC[-4]:RC[-1]) -> 742200 | J6: =SUM(MonthlyPAndL!RC[6]:RC[8]) -> 440095 | K6: =SUM(MonthlyPAndL!RC[8]:RC[10]) -> 506109.24999999988 | L6: =SUM(MonthlyPAndL!RC[10]:RC[12]) -> 582025.63749999984 | M6: =SUM(MonthlyPAndL!RC[12]:RC[14]) -> 669329.4831249998 | N6: =SUM(RC[-4]:RC[-1]) -> 2197559.3706249995
B7: Professional Services | D7: =SUM(MonthlyPAndL!RC:RC[2]) -> 12000 | E7: =SUM(MonthlyPAndL!RC[2]:RC[4]) -> 20000 | F7: =SUM(MonthlyPAndL!RC[4]:RC[6]) -> 14115 | G7: =SUM(MonthlyPAndL!RC[6]:RC[8]) -> 37272.5 | H7: =SUM(RC[-4]:RC[-1]) -> 83387.5 | J7: =SUM(MonthlyPAndL!RC[6]:RC[8]) -> 44009.5 | K7: =SUM(MonthlyPAndL!RC[8]:RC[10]) -> 50610.924999999996 | L7: =SUM(MonthlyPAndL!RC[10]:RC[12]) -> 58202.563749999987 | M7: =SUM(MonthlyPAndL!RC[12]:RC[14]) -> 66932.948312499982 | N7: =SUM(RC[-4]:RC[-1]) -> 219755.93706249993
C8: Total Revenue | D8: =SUM(R[-2]C:R[-1]C) -> 99000 | E8: =SUM(MonthlyPAndL!RC[2]:RC[4]) -> 161325 | F8: =SUM(R[-2]C:R[-1]C) -> 155265 | G8: =SUM(MonthlyPAndL!RC[6]:RC[8]) -> 409997.5 | H8: =SUM(RC[-4]:RC[-1]) -> 825587.5 | J8: =SUM(R[-2]C:R[-1]C) -> 484104.5 | K8: =SUM(MonthlyPAndL!RC[8]:RC[10]) -> 556720.17499999993 | L8: =SUM(MonthlyPAndL!RC[10]:RC[12]) -> 640228.20124999981 | M8: =SUM(MonthlyPAndL!RC[12]:RC[14]) -> 736262.43143749982 | N8: =SUM(RC[-4]:RC[-1]) -> 2417315.3076874996
A10: Cost of Revenue
B11: Cost of Licenses | D11: =SUM(MonthlyPAndL!RC:RC[2]) -> 870 | E11: =SUM(MonthlyPAndL!RC[2]:RC[4]) -> 1413.25 | F11: =SUM(MonthlyPAndL!RC[4]:RC[6]) -> 1411.5 | G11: =SUM(MonthlyPAndL!RC[6]:RC[8]) -> 3727.25 | H11: =SUM(RC[-4]:RC[-1]) -> 7422 | J11: =SUM(MonthlyPAndL!RC[6]:RC[8]) -> 4400.9500000000007 | K11: =SUM(MonthlyPAndL!RC[8]:RC[10]) -> 5061.0924999999988 | L11: =SUM(MonthlyPAndL!RC[10]:RC[12]) -> 5820.256374999999 | M11: =SUM(MonthlyPAndL!RC[12]:RC[14]) -> 6693.2948312499975 | N11: =SUM(RC[-4]:RC[-1]) -> 21975.593706249994
B12: Cost of Services | D12: =SUM(MonthlyPAndL!RC:RC[2]) -> 64155 | E12: =SUM(MonthlyPAndL!RC[2]:RC[4]) -> 64155 | F12: =SUM(MonthlyPAndL!RC[4]:RC[6]) -> 64155 | G12: =SUM(MonthlyPAndL!RC[6]:RC[8]) -> 64155 | H12: =SUM(RC[-4]:RC[-1]) -> 256620 | J12: =SUM(MonthlyPAndL!RC[6]:RC[8]) -> 64155 | K12: =SUM(MonthlyPAndL!RC[8]:RC[10]) -> 101205 | L12: =SUM(MonthlyPAndL!RC[10]:RC[12]) -> 101205 | M12: =SUM(MonthlyPAndL!RC[12]:RC[14]) -> 101205 | N12: =SUM(RC[-4]:RC[-1]) -> 367770
C13: Total Cost of Revenue | D13: =SUM(R[-2]C:R[-1]C) -> 65025 | E13: =SUM(R[-2]C:R[-1]C) -> 65568.25 | F13: =SUM(MonthlyPAndL!RC[4]:RC[6]) -> 65566.5 | G13: =SUM(MonthlyPAndL!RC[6]:RC[8]) -> 67882.25 | H13: =SUM(RC[-4]:RC[-1]) -> 264042 | J13: =SUM(MonthlyPAndL!RC[6]:RC[8]) -> 68555.95 | K13: =SUM(MonthlyPAndL!RC[8]:RC[10]) -> 106266.0925 | L13: =SUM(MonthlyPAndL!RC[10]:RC[12]) -> 107025.256375 | M13: =SUM(MonthlyPAndL!RC[12]:RC[14]) -> 107898.29483124998 | N13: =SUM(RC[-4]:RC[-1]) -> 389745.59370624996
A15: Gross Profit | D15: =R[-7]C-R[-2]C -> 33975 | E15: =SUM(MonthlyPAndL!RC[2]:RC[4]) -> 95756.75 | F15: =SUM(MonthlyPAndL!RC[4]:RC[6]) -> 89698.5 | G15: =SUM(MonthlyPAndL!RC[6]:RC[8]) -> 342115.25 | H15: =SUM(RC[-4]:RC[-1]) -> 561545.5 | J15: =SUM(MonthlyPAndL!RC[6]:RC[8]) -> 415548.55 | K15: =SUM(MonthlyPAndL!RC[8]:RC[10]) -> 450454.0824999999 | L15: =SUM(MonthlyPAndL!RC[10]:RC[12]) -> 533202.94487499981 | M15: =SUM(MonthlyPAndL!RC[12]:RC[14]) -> 628364.13660624973 | N15: =SUM(RC[-4]:RC[-1]) -> 2027569.7139812494
A17: Operating Expenses
B18: Sales and Marketing | D18: =SUM(MonthlyPAndL!RC:RC[2]) -> 208506.5895817643 | E18: =SUM(MonthlyPAndL!RC[2]:RC[4]) -> 281587.28610901907 | F18: =SUM(MonthlyPAndL!RC[4]:RC[6]) -> 278353.28610901907 | G18: =SUM(MonthlyPAndL!RC[6]:RC[8]) -> 285096.78610901907 | H18: =SUM(RC[-4]:RC[-1]) -> 1053543.9479088215 | J18: =SUM(MonthlyPAndL!RC[6]:RC[8]) -> 296947.03610901907 | K18: =SUM(MonthlyPAndL!RC[8]:RC[10]) -> 425362.98270290578 | L18: =SUM(MonthlyPAndL!RC[10]:RC[12]) -> 491716.41912484908 | M18: =SUM(MonthlyPAndL!RC[12]:RC[14]) -> 496081.61140609911 | N18: =SUM(RC[-4]:RC[-1]) -> 1710108.049342873
B19: Research & Development | D19: =SUM(MonthlyPAndL!RC:RC[2]) -> 247611.85832705721 | E19: =SUM(MonthlyPAndL!RC[2]:RC[4]) -> 330149.14443607628 | F19: =SUM(MonthlyPAndL!RC[4]:RC[6]) -> 330149.14443607628 | G19: =SUM(MonthlyPAndL!RC[6]:RC[8]) -> 330149.14443607628 | H19: =SUM(RC[-4]:RC[-1]) -> 1238059.2916352861 | J19: =SUM(MonthlyPAndL!RC[6]:RC[8]) -> 330149.14443607628 | K19: =SUM(MonthlyPAndL!RC[8]:RC[10]) -> 399363.65814468777 | L19: =SUM(MonthlyPAndL!RC[10]:RC[12]) -> 433970.91499899351 | M19: =SUM(MonthlyPAndL!RC[12]:RC[14]) -> 433970.91499899351 | N19: =SUM(RC[-4]:RC[-1]) -> 1597454.6325787511
B20: General & Administrative | D20: =SUM(MonthlyPAndL!RC:RC[2]) -> 142381.60763627384 | E20: =SUM(MonthlyPAndL!RC[2]:RC[4]) -> 189842.14351503178 | F20: =SUM(MonthlyPAndL!RC[4]:RC[6]) -> 189842.14351503178 | G20: =SUM(MonthlyPAndL!RC[6]:RC[8]) -> 189842.14351503178 | H20: =SUM(RC[-4]:RC[-1]) -> 711908.03818136919 | J20: =SUM(MonthlyPAndL!RC[6]:RC[8]) -> 189842.14351503178 | K20: =SUM(MonthlyPAndL!RC[8]:RC[10]) -> 216214.20033817616 | L20: =SUM(MonthlyPAndL!RC[10]:RC[12]) -> 229400.22874974838 | M20: =SUM(MonthlyPAndL!RC[12]:RC[14]) -> 229400.22874974838 | N20: =SUM(RC[-4]:RC[-1]) -> 864856.80135270464
B21: Depreciation | D21: =SUM(MonthlyPAndL!RC:RC[2]) -> 14583.333333333334 | E21: =SUM(MonthlyPAndL!RC[2]:RC[4]) -> 14583.333333333334 | F21: =SUM(MonthlyPAndL!RC[4]:RC[6]) -> 14583.333333333334 | G21: =SUM(MonthlyPAndL!RC[6]:RC[8]) -> 14583.333333333334 | H21: =SUM(RC[-4]:RC[-1]) -> 58333.333333333336 | J21: =SUM(MonthlyPAndL!RC[6]:RC[8]) -> 18750 | K21: =SUM(MonthlyPAndL!RC[8]:RC[10]) -> 18750 | L21: =SUM(MonthlyPAndL!RC[10]:RC[12]) -> 18750 | M21: =SUM(MonthlyPAndL!RC[12]:RC[14]) -> 18750 | N21: =SUM(RC[-4]:RC[-1]) -> 75000
C22: Total Oper Expenses | D22: =SUM(MonthlyPAndL!RC:RC[2]) -> 613083.38887842873 | E22: =SUM(MonthlyPAndL!RC[2]:RC[4]) -> 816161.90739346039 | F22: =SUM(MonthlyPAndL!RC[4]:RC[6]) -> 812927.90739346039 | G22: =SUM(MonthlyPAndL!RC[6]:RC[8]) -> 819671.40739346039 | H22: =SUM(RC[-4]:RC[-1]) -> 3061844.6110588098 | J22: =SUM(MonthlyPAndL!RC[6]:RC[8]) -> 835688.32406012714 | K22: =SUM(MonthlyPAndL!RC[8]:RC[10]) -> 1059690.8411857698 | L22: =SUM(MonthlyPAndL!RC[10]:RC[12]) -> 1173837.562873591 | M22: =SUM(MonthlyPAndL!RC[12]:RC[14]) -> 1178202.7551548411 | N22: =SUM(RC[-4]:RC[-1]) -> 4247419.4832743295
A23: Operating Income | D23: =SUM(MonthlyPAndL!RC:RC[2]) -> -579108.38887842873 | E23: =SUM(MonthlyPAndL!RC[2]:RC[4]) -> -720405.15739346039 | F23: =SUM(MonthlyPAndL!RC[4]:RC[6]) -> -723229.40739346039 | G23: =SUM(MonthlyPAndL!RC[6]:RC[8]) -> -477556.15739346039 | H23: =SUM(RC[-4]:RC[-1]) -> -2500299.1110588098 | J23: =SUM(MonthlyPAndL!RC[6]:RC[8]) -> -420139.77406012709 | K23: =SUM(MonthlyPAndL!RC[8]:RC[10]) -> -609236.75868576975 | L23: =SUM(MonthlyPAndL!RC[10]:RC[12]) -> -640634.61799859116 | M23: =SUM(MonthlyPAndL!RC[12]:RC[14]) -> -549838.61854859116 | N23: =SUM(RC[-4]:RC[-1]) -> -2219849.7692930792
B24: Other income, net | D24: =SUM(MonthlyPAndL!RC:RC[2]) -> 16403.817696576971 | E24: =SUM(MonthlyPAndL!RC[2]:RC[4]) -> 11913.106649917456 | F24: =SUM(MonthlyPAndL!RC[4]:RC[6]) -> 6980.4263883021276 | G24: =SUM(MonthlyPAndL!RC[6]:RC[8]) -> 2419.8584503421516 | H24: =SUM(RC[-4]:RC[-1]) -> 37717.209185138709 | J24: =SUM(MonthlyPAndL!RC[6]:RC[8]) -> -914.01819463268305 | K24: =SUM(MonthlyPAndL!RC[8]:RC[10]) -> 20707.410897967355 | L24: =SUM(MonthlyPAndL!RC[10]:RC[12]) -> 28430.833641695921 | M24: =SUM(MonthlyPAndL!RC[12]:RC[14]) -> 23982.003602596837 | N24: =SUM(RC[-4]:RC[-1]) -> 72206.229947627435
A25: Income Before Taxes | D25: =SUM(MonthlyPAndL!RC:RC[2]) -> -562704.57118185167 | E25: =SUM(MonthlyPAndL!RC[2]:RC[4]) -> -708492.05074354308 | F25: =SUM(MonthlyPAndL!RC[4]:RC[6]) -> -716248.98100515839 | G25: =SUM(MonthlyPAndL!RC[6]:RC[8]) -> -475136.29894311825 | H25: =SUM(RC[-4]:RC[-1]) -> -2462581.9018736714 | J25: =SUM(MonthlyPAndL!RC[6]:RC[8]) -> -421053.79225475976 | K25: =SUM(MonthlyPAndL!RC[8]:RC[10]) -> -588529.34778780246 | L25: =SUM(MonthlyPAndL!RC[10]:RC[12]) -> -612203.78435689525 | M25: =SUM(MonthlyPAndL!RC[12]:RC[14]) -> -525856.61494599434 | N25: =SUM(RC[-4]:RC[-1]) -> -2147643.5393454516
B26: Income Tax Provision | D26: =SUM(MonthlyPAndL!RC:RC[2]) -> 0 | E26: =SUM(MonthlyPAndL!RC[2]:RC[4]) -> 0 | F26: =SUM(MonthlyPAndL!RC[4]:RC[6]) -> 0 | G26: =SUM(MonthlyPAndL!RC[6]:RC[8]) -> 0 | H26: =SUM(RC[-4]:RC[-1]) -> 0 | J26: =SUM(MonthlyPAndL!RC[6]:RC[8]) -> 0 | K26: 0 | L26: =SUM(MonthlyPAndL!RC[10]:RC[12]) -> 0 | M26: =SUM(MonthlyPAndL!RC[12]:RC[14]) -> 0 | N26: =SUM(RC[-4]:RC[-1]) -> 0
A27: Net Income | D27: =SUM(MonthlyPAndL!RC:RC[2]) -> -562704.57118185167 | E27: =SUM(MonthlyPAndL!RC[2]:RC[4]) -> -708492.05074354308 | F27: =SUM(MonthlyPAndL!RC[4]:RC[6]) -> -716248.98100515839 | G27: =SUM(MonthlyPAndL!RC[6]:RC[8]) -> -475136.29894311825 | H27: =SUM(RC[-4]:RC[-1]) -> -2462581.9018736714 | J27: =SUM(MonthlyPAndL!RC[6]:RC[8]) -> -421053.79225475976 | K27: =SUM(MonthlyPAndL!RC[8]:RC[10]) -> -588529.34778780246 | L27: =SUM(MonthlyPAndL!RC[10]:RC[12]) -> -612203.78435689525 | M27: =SUM(MonthlyPAndL!RC[12]:RC[14]) -> -525856.61494599434 | N27: =SUM(RC[-4]:RC[-1]) -> -2147643.5393454516

Sheet: Annual P&L 
A1: Historical and Projected Income Statement as of December 31, 2002 (unaudited)
D3: =QuarterlyPAndL!RC[4] -> Actual | F3: =QuarterlyPAndL!RC[8]:R[24]C[8] -> Estimate | H3: Estimate | J3: Estimate | L3: Estimate
D4: =QuarterlyPAndL!RC[4] -> FY 2002 | F4: =QuarterlyPAndL!RC[8] -> FY 2003 | H4: FY 2004 | J4: FY 2005 | L4: FY 2006 | N4: Assumptions | O4: 2004 | Q4: 2005 & 06
A5: Revenues | N5: License Rev Growth | O5: 0.85 | Q5: 0.5
B6: License Revenue | D6: =QuarterlyPAndL!RC[4] -> 742200 | F6: =QuarterlyPAndL!RC[8] -> 2197559.3706249995 | H6: =RC[-2]*(1+R5C15) -> 4065484.8356562494 | J6: =RC[-2]*(1+R5C17) -> 6098227.2534843739 | L6: =RC[-2]*(1+R5C17) -> 9147340.8802265599 | N6: Prof Service Growth | O6: 0.25 | Q6: 0.15
B7: Professional Services | D7: =QuarterlyPAndL!RC[4] -> 83387.5 | F7: =QuarterlyPAndL!RC[8] -> 219755.93706249993 | H7: =RC[-2]*(1+R6C15) -> 274694.92132812494 | J7: =RC[-2]*(1+R6C17) -> 315899.15952734364 | L7: =RC[-2]*(1+R6C17) -> 363284.03345644515
C8: Total Revenue | D8: =QuarterlyPAndL!RC[4] -> 825587.5 | F8: =QuarterlyPAndL!RC[8] -> 2417315.3076874996 | H8: =SUM(R[-2]C:R[-1]C) -> 4340179.7569843745 | J8: =SUM(R[-2]C:R[-1]C) -> 6414126.4130117176 | L8: =SUM(R[-2]C:R[-1]C) -> 9510624.9136830047 | N8: Costs as % of sales
N9: Licenses | O9: 0.01 | Q9: 0.02
A10: Cost of Revenue | N10: Services | O10: 0.06 | Q10: 0.05
B11: Cost of Licenses | D11: =QuarterlyPAndL!RC[4] -> 7422 | F11: =QuarterlyPAndL!RC[8] -> 21975.593706249994 | H11: =R[-3]C*R9C15 -> 43401.797569843744 | J11: =R[-3]C*R9C17 -> 128282.52826023435 | L11: =R[-3]C*R9C17 -> 190212.49827366011 | N11: Sales and Marketing | O11: 0.45 | Q11: 0.35
B12: Cost of Services | D12: =QuarterlyPAndL!RC[4] -> 256620 | F12: =QuarterlyPAndL!RC[8] -> 367770 | H12: =R[-4]C*R10C15 -> 260410.78541906245 | J12: =R[-4]C*R10C17 -> 320706.32065058593 | L12: =R[-4]C*R10C17 -> 475531.24568415026 | N12: R&D | O12: 0.35 | Q12: 0.26
C13: Total Cost of Revenue | D13: =QuarterlyPAndL!RC[4] -> 264042 | F13: =QuarterlyPAndL!RC[8] -> 389745.59370624996 | H13: =SUM(R[-2]C:R[-1]C) -> 303812.58298890619 | J13: =SUM(R[-2]C:R[-1]C) -> 448988.84891082026 | L13: =SUM(R[-2]C:R[-1]C) -> 665743.74395781034 | N13: G&A | O13: 0.18 | Q13: 0.15
N14: Tax Rate | O14: 0 | Q14: 0.25
A15: Gross Profit | D15: =QuarterlyPAndL!RC[4] -> 561545.5 | F15: =QuarterlyPAndL!RC[8] -> 2027569.7139812494 | H15: =R[-7]C-R[-2]C -> 4036367.1739954683 | J15: =R[-7]C-R[-2]C -> 5965137.5641008969 | L15: =R[-7]C-R[-2]C -> 8844881.1697251946
A17: Operating Expenses
B18: Sales and Marketing | D18: =QuarterlyPAndL!RC[4] -> 1053543.9479088215 | F18: =QuarterlyPAndL!RC[8] -> 1710108.049342873 | H18: =R[-10]C*R[-7]C[7] -> 1953080.8906429685 | J18: =R[-10]C*R11C17 -> 2244944.244554101 | L18: =R[-10]C*R11C17 -> 3328718.7197890515
B19: Research and Development | D19: =QuarterlyPAndL!RC[4] -> 1238059.2916352861 | F19: =QuarterlyPAndL!RC[8] -> 1597454.6325787511 | H19: =R[-11]C*R[-7]C[7] -> 1519062.9149445309 | J19: =R[-11]C*R12C17 -> 1667672.8673830465 | L19: =R[-11]C*R12C17 -> 2472762.4775575814
B20: General and Administrative | D20: =QuarterlyPAndL!RC[4] -> 711908.03818136919 | F20: =QuarterlyPAndL!RC[8] -> 864856.80135270464 | H20: =R[-12]C*R[-7]C[7] -> 781232.35625718744 | J20: =R[-12]C*R13C17 -> 962118.96195175755 | L20: =R[-12]C*R13C17 -> 1426593.7370524507
B21: Depreciation | D21: =QuarterlyPAndL!RC[4] -> 58333.333333333336 | F21: =QuarterlyPAndL!RC[8] -> 75000 | H21: 75000 | J21: 75000 | L21: 75000
C22: Total Operating Expenses | D22: =QuarterlyPAndL!RC[4] -> 3061844.6110588098 | F22: =QuarterlyPAndL!RC[8] -> 4247419.4832743295 | H22: =SUM(R[-4]C:R[-1]C) -> 4328376.1618446866 | J22: =SUM(R[-4]C:R[-1]C) -> 4949736.0738889053 | L22: =SUM(R[-4]C:R[-1]C) -> 7303074.9343990842
A23: Operating Income | D23: =QuarterlyPAndL!RC[4] -> -2500299.1110588098 | F23: =QuarterlyPAndL!RC[8] -> -2219849.7692930792 | H23: =R[-8]C-R[-1]C -> -292008.98784921831 | J23: =R[-8]C-R[-1]C -> 1015401.4902119916 | L23: =R[-8]C-R[-1]C -> 1541806.2353261104
B24: Other income, net | D24: =QuarterlyPAndL!RC[4] -> 37717.209185138709 | F24: =QuarterlyPAndL!RC[8] -> 72206.229947627435 | H24: 100000 | J24: 100000 | L24: 100000
A25: Income Before Taxes | D25: =QuarterlyPAndL!RC[4] -> -2462581.9018736714 | F25: =QuarterlyPAndL!RC[8] -> -2147643.5393454516 | H25: =R[-2]C+R[-1]C -> -192008.98784921831 | J25: =R[-2]C+R[-1]C -> 1115401.4902119916 | L25: =R[-2]C+R[-1]C -> 1641806.2353261104
B26: Income Tax Provision | D26: =QuarterlyPAndL!RC[4] -> 0 | F26: =QuarterlyPAndL!RC[8] -> 0 | H26: =R[-1]C*(R[-12]C[7]) -> 0 | J26: =R[-1]C*(R14C17) -> 278850.3725529979 | L26: =R[-1]C*(R14C17) -> 410451.5588315276
A27: Net Income | D27: =QuarterlyPAndL!RC[4] -> -2462581.9018736714 | F27: =QuarterlyPAndL!RC[8] -> -2147643.5393454516 | H27: =R[-2]C-R[-1]C -> -192008.98784921831 | J27: =R[-2]C-R[-1]C -> 836551.11765899369 | L27: =R[-2]C-R[-1]C -> 1231354.6764945828

Sheet: BalanceSheet
A1: Balance Sheet as of 12/31/02 (unaudited)
D3: 2001-12-01T00:00:00.000 | E3: 2002-01-01T00:00:00.000 | F3: 2002-02-01T00:00:00.000 | G3: 2002-03-01T00:00:00.000 | H3: 2002-04-01T00:00:00.000 | I3: 2002-05-01T00:00:00.000 | J3: 2002-06-01T00:00:00.000 | K3: 2002-07-01T00:00:00.000 | L3: 2002-08-01T00:00:00.000 | M3: 2002-09-01T00:00:00.000 | N3: 2002-10-01T00:00:00.000 | O3: 2002-11-01T00:00:00.000 | P3: 2002-12-01T00:00:00.000 | Q3: 2003-01-01T00:00:00.000 | R3: 2003-02-01T00:00:00.000 | S3: 2003-03-01T00:00:00.000 | T3: 2003-04-01T00:00:00.000 | U3: 2003-05-01T00:00:00.000 | V3: 2003-06-01T00:00:00.000 | W3: 2003-07-01T00:00:00.000 | X3: 2003-08-01T00:00:00.000 | Y3: 2003-09-01T00:00:00.000 | Z3: 2003-10-01T00:00:00.000 | AA3: 2003-11-01T00:00:00.000 | AB3: 2003-12-01T00:00:00.000
A4: Assets
A5: Current Assets
A6: Cash and Cash Equivalents | D6: 3060000 | E6: =StmtOfCF!R[23]C -> 2901433.4834393966 | F6: =StmtOfCF!R[23]C -> 2711181.0444157142 | G6: =StmtOfCF!R[23]C -> 2473331.4681227957 | H6: =StmtOfCF!R[23]C -> 2217537.6595558114 | I6: =StmtOfCF!R[23]C -> 1976261.3539674096 | J6: =StmtOfCF!R[23]C -> 1765960.8951150368 | K6: =StmtOfCF!R[23]C -> 1509074.3726155329 | L6: =StmtOfCF!R[23]C -> 1265302.5838097804 | M6: =StmtOfCF!R[23]C -> 1051303.9030320134 | N6: =StmtOfCF!R[23]C -> 839516.84221896878 | O6: =StmtOfCF!R[23]C -> 666911.52000389155 | P6: =StmtOfCF!R[23]C -> 574103.74073327659 | Q6: =StmtOfCF!R[23]C -> 376401.80453354213 | R6: =StmtOfCF!R[23]C -> 220003.4015240318 | S6: =StmtOfCF!R[23]C -> 153485.54294302833 | T6: =StmtOfCF!R[23]C -> 4956502.4036934637 | U6: =StmtOfCF!R[23]C -> 4709092.6371943736 | V6: =StmtOfCF!R[23]C -> 4564883.5553326942 | W6: =StmtOfCF!R[23]C -> 4284679.6237686817 | X6: =StmtOfCF!R[23]C -> 4058886.5022209156 | Y6: =StmtOfCF!R[23]C -> 3951928.1360479817 | Z6: =StmtOfCF!R[23]C -> 3688730.117156948 | AA6: =StmtOfCF!R[23]C -> 3488259.412477727 | AB6: =StmtOfCF!R[23]C -> 3424604.0192937963
A7: Accounts Receivable | D7: 0 | E7: =0.2*MonthlyPAndL!R8C[-1] -> 3960 | F7: =0.2*MonthlyPAndL!R8C[-1] -> 5940 | G7: =0.2*MonthlyPAndL!R8C[-1] -> 9900 | H7: =0.2*MonthlyPAndL!R8C[-1] -> 6453 | I7: =0.2*MonthlyPAndL!R8C[-1] -> 9679.5 | J7: =0.2*MonthlyPAndL!R8C[-1] -> 16132.5 | K7: =0.2*MonthlyPAndL!R8C[-1] -> 6210.6 | L7: =0.2*MonthlyPAndL!R8C[-1] -> 9315.9 | M7: =0.2*MonthlyPAndL!R8C[-1] -> 15526.5 | N7: =0.2*MonthlyPAndL!R8C[-1] -> 16399.900000000001 | O7: =0.2*MonthlyPAndL!R8C[-1] -> 24599.850000000002 | P7: =0.2*MonthlyPAndL!R8C[-1] -> 40999.75 | Q7: =0.2*MonthlyPAndL!R8C[-1] -> 19364.18 | R7: =0.2*MonthlyPAndL!R8C[-1] -> 29046.270000000004 | S7: =0.2*MonthlyPAndL!R8C[-1] -> 48410.450000000004 | T7: =0.2*MonthlyPAndL!R8C[-1] -> 22268.807000000001 | U7: =0.2*MonthlyPAndL!R8C[-1] -> 33403.210499999994 | V7: =0.2*MonthlyPAndL!R8C[-1] -> 55672.017499999994 | W7: =0.2*MonthlyPAndL!R8C[-1] -> 25609.128049999996 | X7: =0.2*MonthlyPAndL!R8C[-1] -> 38413.692074999992 | Y7: =0.2*MonthlyPAndL!R8C[-1] -> 64022.820124999984 | Z7: =0.2*MonthlyPAndL!R8C[-1] -> 29450.497257499992 | AA7: =0.2*MonthlyPAndL!R8C[-1] -> 44175.745886249992 | AB7: =0.2*MonthlyPAndL!R8C[-1] -> 73626.243143749991
A8: Other Assets | D8: 0 | E8: 25000 | F8: =RC[-1] -> 25000 | G8: =RC[-1] -> 25000 | H8: =RC[-1] -> 25000 | I8: =RC[-1] -> 25000 | J8: =RC[-1] -> 25000 | K8: =RC[-1] -> 25000 | L8: =RC[-1] -> 25000 | M8: =RC[-1] -> 25000 | N8: =RC[-1] -> 25000 | O8: =RC[-1] -> 25000 | P8: =RC[-1] -> 25000 | Q8: =RC[-1] -> 25000 | R8: =RC[-1] -> 25000 | S8: =RC[-1] -> 25000 | T8: =RC[-1] -> 25000 | U8: =RC[-1] -> 25000 | V8: =RC[-1] -> 25000 | W8: =RC[-1] -> 25000 | X8: =RC[-1] -> 25000 | Y8: =RC[-1] -> 25000 | Z8: =RC[-1] -> 25000 | AA8: =RC[-1] -> 25000 | AB8: =RC[-1] -> 25000
A9: Total Current Assets | D9: =SUM(R[-3]C:R[-1]C) -> 3060000 | E9: =SUM(R[-3]C:R[-1]C) -> 2930393.4834393966 | F9: =SUM(R[-3]C:R[-1]C) -> 2742121.0444157142 | G9: =SUM(R[-3]C:R[-1]C) -> 2508231.4681227957 | H9: =SUM(R[-3]C:R[-1]C) -> 2248990.6595558114 | I9: =SUM(R[-3]C:R[-1]C) -> 2010940.8539674096 | J9: =SUM(R[-3]C:R[-1]C) -> 1807093.3951150368 | K9: =SUM(R[-3]C:R[-1]C) -> 1540284.972615533 | L9: =SUM(R[-3]C:R[-1]C) -> 1299618.4838097803 | M9: =SUM(R[-3]C:R[-1]C) -> 1091830.4030320134 | N9: =SUM(R[-3]C:R[-1]C) -> 880916.74221896881 | O9: =SUM(R[-3]C:R[-1]C) -> 716511.37000389153 | P9: =SUM(R[-3]C:R[-1]C) -> 640103.49073327659 | Q9: =SUM(R[-3]C:R[-1]C) -> 420765.98453354213 | R9: =SUM(R[-3]C:R[-1]C) -> 274049.67152403179 | S9: =SUM(R[-3]C:R[-1]C) -> 226895.99294302834 | T9: =SUM(R[-3]C:R[-1]C) -> 5003771.2106934637 | U9: =SUM(R[-3]C:R[-1]C) -> 4767495.8476943737 | V9: =SUM(R[-3]C:R[-1]C) -> 4645555.5728326943 | W9: =SUM(R[-3]C:R[-1]C) -> 4335288.7518186821 | X9: =SUM(R[-3]C:R[-1]C) -> 4122300.1942959158 | Y9: =SUM(R[-3]C:R[-1]C) -> 4040950.9561729818 | Z9: =SUM(R[-3]C:R[-1]C) -> 3743180.6144144479 | AA9: =SUM(R[-3]C:R[-1]C) -> 3557435.158363977 | AB9: =SUM(R[-3]C:R[-1]C) -> 3523230.2624375462
A11: Property and Equipment | D11: =CapLease!R[-8]C[1] -> 175000 | E11: =RC[-1] -> 175000 | F11: =RC[-1] -> 175000 | G11: =RC[-1] -> 175000 | H11: =RC[-1] -> 175000 | I11: =RC[-1] -> 175000 | J11: =RC[-1] -> 175000 | K11: =RC[-1] -> 175000 | L11: =RC[-1] -> 175000 | M11: =RC[-1] -> 175000 | N11: =RC[-1] -> 175000 | O11: =RC[-1] -> 175000 | P11: =RC[-1] -> 175000 | Q11: =RC[-1] -> 175000 | R11: =RC[-1] -> 175000 | S11: =RC[-1] -> 175000 | T11: =RC[-1] -> 175000 | U11: =RC[-1] -> 175000 | V11: =RC[-1] -> 175000 | W11: =RC[-1] -> 175000 | X11: =RC[-1] -> 175000 | Y11: =RC[-1] -> 175000 | Z11: =RC[-1] -> 175000 | AA11: =RC[-1] -> 175000 | AB11: =RC[-1] -> 175000
A12: Less: Accumulated Depreciation | D12: 0 | E12: =CapLease!R5C8*CapLease!R[-1]C9 -> 4861.1111111111113 | F12: =CapLease!R5C8*CapLease!RC9 -> 9722.2222222222226 | G12: =CapLease!R5C8*CapLease!R[1]C9 -> 14583.333333333334 | H12: =CapLease!R5C8*CapLease!R[2]C9 -> 19444.444444444445 | I12: =CapLease!R5C8*CapLease!R[3]C9 -> 24305.555555555555 | J12: =CapLease!R5C8*CapLease!R[4]C9 -> 29166.666666666668 | K12: =CapLease!R5C8*CapLease!R[5]C9 -> 34027.777777777781 | L12: =CapLease!R5C8*CapLease!R[6]C9 -> 38888.888888888891 | M12: =CapLease!R5C8*CapLease!R[7]C9 -> 43750 | N12: =CapLease!R5C8*CapLease!R[8]C9 -> 48611.111111111109 | O12: =CapLease!R5C8*CapLease!R[9]C9 -> 53472.222222222226 | P12: =CapLease!R5C8*CapLease!R[10]C9 -> 58333.333333333336 | Q12: =CapLease!R5C8*CapLease!R[11]C9 -> 63194.444444444445 | R12: =CapLease!R5C8*CapLease!R[12]C9 -> 68055.555555555562 | S12: =CapLease!R5C8*CapLease!R[13]C9 -> 72916.666666666672 | T12: =CapLease!R5C8*CapLease!R[14]C9 -> 77777.777777777781 | U12: =CapLease!R5C8*CapLease!R[15]C9 -> 82638.888888888891 | V12: =CapLease!R5C8*CapLease!R[16]C9 -> 87500 | W12: =CapLease!R5C8*CapLease!R[17]C9 -> 92361.111111111109 | X12: =CapLease!R5C8*CapLease!R[18]C9 -> 97222.222222222219 | Y12: =CapLease!R5C8*CapLease!R[19]C9 -> 102083.33333333334 | Z12: =CapLease!R5C8*CapLease!R[20]C9 -> 106944.44444444445 | AA12: =CapLease!R5C8*CapLease!R[21]C9 -> 111805.55555555556 | AB12: =CapLease!R5C8*CapLease!R[22]C9 -> 116666.66666666667
A13: Net Property and Equipment | D13: =SUM(R[-2]C:R[-1]C) -> 175000 | E13: =R[-2]C-R[-1]C -> 170138.88888888888 | F13: =R[-2]C-R[-1]C -> 165277.77777777778 | G13: =R[-2]C-R[-1]C -> 160416.66666666666 | H13: =R[-2]C-R[-1]C -> 155555.55555555556 | I13: =R[-2]C-R[-1]C -> 150694.44444444444 | J13: =R[-2]C-R[-1]C -> 145833.33333333334 | K13: =R[-2]C-R[-1]C -> 140972.22222222222 | L13: =R[-2]C-R[-1]C -> 136111.11111111112 | M13: =R[-2]C-R[-1]C -> 131250 | N13: =R[-2]C-R[-1]C -> 126388.88888888889 | O13: =R[-2]C-R[-1]C -> 121527.77777777778 | P13: =R[-2]C-R[-1]C -> 116666.66666666666 | Q13: =R[-2]C-R[-1]C -> 111805.55555555556 | R13: =R[-2]C-R[-1]C -> 106944.44444444444 | S13: =R[-2]C-R[-1]C -> 102083.33333333333 | T13: =R[-2]C-R[-1]C -> 97222.222222222219 | U13: =R[-2]C-R[-1]C -> 92361.111111111109 | V13: =R[-2]C-R[-1]C -> 87500 | W13: =R[-2]C-R[-1]C -> 82638.888888888891 | X13: =R[-2]C-R[-1]C -> 77777.777777777781 | Y13: =R[-2]C-R[-1]C -> 72916.666666666657 | Z13: =R[-2]C-R[-1]C -> 68055.555555555547 | AA13: =R[-2]C-R[-1]C -> 63194.444444444438 | AB13: =R[-2]C-R[-1]C -> 58333.333333333328
A14: Total Assets | D14: =SUM(R[-5]C,R[-1]C) -> 3235000 | E14: =SUM(R[-5]C,R[-1]C) -> 3100532.3723282856 | F14: =SUM(R[-5]C,R[-1]C) -> 2907398.8221934922 | G14: =SUM(R[-5]C,R[-1]C) -> 2668648.1347894622 | H14: =SUM(R[-5]C,R[-1]C) -> 2404546.2151113669 | I14: =SUM(R[-5]C,R[-1]C) -> 2161635.2984118541 | J14: =SUM(R[-5]C,R[-1]C) -> 1952926.72844837 | K14: =SUM(R[-5]C,R[-1]C) -> 1681257.1948377553 | L14: =SUM(R[-5]C,R[-1]C) -> 1435729.5949208913 | M14: =SUM(R[-5]C,R[-1]C) -> 1223080.4030320134 | N14: =SUM(R[-5]C,R[-1]C) -> 1007305.6311078577 | O14: =SUM(R[-5]C,R[-1]C) -> 838039.14778166928 | P14: =SUM(R[-5]C,R[-1]C) -> 756770.15739994321 | Q14: =SUM(R[-5]C,R[-1]C) -> 532571.54008909769 | R14: =SUM(R[-5]C,R[-1]C) -> 380994.11596847622 | S14: =SUM(R[-5]C,R[-1]C) -> 328979.32627636165 | T14: =SUM(R[-5]C,R[-1]C) -> 5100993.4329156857 | U14: =SUM(R[-5]C,R[-1]C) -> 4859856.9588054847 | V14: =SUM(R[-5]C,R[-1]C) -> 4733055.5728326943 | W14: =SUM(R[-5]C,R[-1]C) -> 4417927.6407075711 | X14: =SUM(R[-5]C,R[-1]C) -> 4200077.9720736938 | Y14: =SUM(R[-5]C,R[-1]C) -> 4113867.6228396483 | Z14: =SUM(R[-5]C,R[-1]C) -> 3811236.1699700034 | AA14: =SUM(R[-5]C,R[-1]C) -> 3620629.6028084215 | AB14: =SUM(R[-5]C,R[-1]C) -> 3581563.5957708796
A16: Liabilities & Shareholders' Equity
A17: Current Liabilities
A18: Accounts Payable | D18: 0 | E18: =0.15*MonthlyPAndL!R8C[-1] -> 2970 | F18: =0.15*MonthlyPAndL!R8C[-1] -> 4455 | G18: =0.15*MonthlyPAndL!R8C[-1] -> 7425 | H18: =0.15*MonthlyPAndL!R8C[-1] -> 4839.75 | I18: =0.15*MonthlyPAndL!R8C[-1] -> 7259.625 | J18: =0.15*MonthlyPAndL!R8C[-1] -> 12099.375 | K18: =0.15*MonthlyPAndL!R8C[-1] -> 4657.95 | L18: =0.15*MonthlyPAndL!R8C[-1] -> 6986.9250000000002 | M18: =0.15*MonthlyPAndL!R8C[-1] -> 11644.875 | N18: =0.15*MonthlyPAndL!R8C[-1] -> 12299.924999999999 | O18: =0.15*MonthlyPAndL!R8C[-1] -> 18449.887500000001 | P18: =0.15*MonthlyPAndL!R8C[-1] -> 30749.8125 | Q18: =0.15*MonthlyPAndL!R8C[-1] -> 14523.134999999998 | R18: =0.15*MonthlyPAndL!R8C[-1] -> 21784.702499999999 | S18: =0.15*MonthlyPAndL!R8C[-1] -> 36307.837500000001 | T18: =0.15*MonthlyPAndL!R8C[-1] -> 16701.605249999997 | U18: =0.15*MonthlyPAndL!R8C[-1] -> 25052.407874999994 | V18: =0.15*MonthlyPAndL!R8C[-1] -> 41754.01312499999 | W18: =0.15*MonthlyPAndL!R8C[-1] -> 19206.846037499996 | X18: =0.15*MonthlyPAndL!R8C[-1] -> 28810.269056249988 | Y18: =0.15*MonthlyPAndL!R8C[-1] -> 48017.115093749984 | Z18: =0.15*MonthlyPAndL!R8C[-1] -> 22087.872943124992 | AA18: =0.15*MonthlyPAndL!R8C[-1] -> 33131.809414687486 | AB18: =0.15*MonthlyPAndL!R8C[-1] -> 55219.682357812482
A19: Accrued Liabilities | D19: 0 | E19: =0.025*MonthlyPAndL!R[-11]C[-1] -> 495 | F19: =0.025*MonthlyPAndL!R[-11]C[-1] -> 742.5 | G19: =0.025*MonthlyPAndL!R[-11]C[-1] -> 1237.5 | H19: =0.025*MonthlyPAndL!R[-11]C[-1] -> 806.625 | I19: =0.025*MonthlyPAndL!R[-11]C[-1] -> 1209.9375 | J19: =0.025*MonthlyPAndL!R[-11]C[-1] -> 2016.5625 | K19: =0.025*MonthlyPAndL!R[-11]C[-1] -> 776.32500000000005 | L19: =0.025*MonthlyPAndL!R[-11]C[-1] -> 1164.4875 | M19: =0.025*MonthlyPAndL!R[-11]C[-1] -> 1940.8125 | N19: =0.025*MonthlyPAndL!R[-11]C[-1] -> 2049.9875000000002 | O19: =0.025*MonthlyPAndL!R[-11]C[-1] -> 3074.9812500000003 | P19: =0.025*MonthlyPAndL!R[-11]C[-1] -> 5124.96875 | Q19: =0.025*MonthlyPAndL!R[-11]C[-1] -> 2420.5225 | R19: =0.025*MonthlyPAndL!R[-11]C[-1] -> 3630.7837500000005 | S19: =0.025*MonthlyPAndL!R[-11]C[-1] -> 6051.3062500000005 | T19: =0.025*MonthlyPAndL!R[-11]C[-1] -> 2783.6008750000001 | U19: =0.025*MonthlyPAndL!R[-11]C[-1] -> 4175.4013124999992 | V19: =0.025*MonthlyPAndL!R[-11]C[-1] -> 6959.0021874999993 | W19: =0.025*MonthlyPAndL!R[-11]C[-1] -> 3201.1410062499995 | X19: =0.025*MonthlyPAndL!R[-11]C[-1] -> 4801.711509374999 | Y19: =0.025*MonthlyPAndL!R[-11]C[-1] -> 8002.852515624998 | Z19: =0.025*MonthlyPAndL!R[-11]C[-1] -> 3681.312157187499 | AA19: =0.025*MonthlyPAndL!R[-11]C[-1] -> 5521.9682357812489 | AB19: =0.025*MonthlyPAndL!R[-11]C[-1] -> 9203.2803929687489
A20: Deferred Revenue | D20: 0 | E20: =RC[-1] -> 0 | F20: =RC[-1] -> 0 | G20: =RC[-1] -> 0 | H20: =RC[-1] -> 0 | I20: =RC[-1] -> 0 | J20: =RC[-1] -> 0 | K20: =RC[-1] -> 0 | L20: =RC[-1] -> 0 | M20: =RC[-1] -> 0 | N20: =RC[-1] -> 0 | O20: =RC[-1] -> 0 | P20: =RC[-1] -> 0 | Q20: =RC[-1] -> 0 | R20: =RC[-1] -> 0 | S20: =RC[-1] -> 0 | T20: =RC[-1] -> 0 | U20: =RC[-1] -> 0 | V20: =RC[-1] -> 0 | W20: =RC[-1] -> 0 | X20: =RC[-1] -> 0 | Y20: =RC[-1] -> 0 | Z20: =RC[-1] -> 0 | AA20: =RC[-1] -> 0 | AB20: =RC[-1] -> 0
A21: Current Portion of Capital lease | D21: 0 | E21: =CapLease!R11C18 -> 4062.5042172489584 | F21: =CapLease!R12C18 -> 4103.1292594214483 | G21: =CapLease!R13C18 -> 4144.1605520156627 | H21: =CapLease!R14C18 -> 4185.6021575358191 | I21: =CapLease!R15C18 -> 4227.4581791111777 | J21: =CapLease!R16C18 -> 4269.7327609022896 | K21: =CapLease!R17C18 -> 4312.4300885113125 | L21: =CapLease!R18C18 -> 4355.5543893964259 | M21: =CapLease!R19C18 -> 4399.1099332903896 | N21: =CapLease!R20C18 -> 4443.1010326232936 | O21: =CapLease!R21C18 -> 4487.5320429495268 | P21: =CapLease!R22C18 -> 4532.4073633790222 | Q21: =CapLease!R23C18 -> 5738.4469276553718 | R21: =CapLease!R24C18 -> 5795.8313969319261 | S21: =CapLease!R25C18 -> 5853.7897109012447 | T21: =CapLease!R26C18 -> 5912.3276080102578 | U21: =CapLease!R27C18 -> 5971.45088409036 | V21: =CapLease!R28C18 -> 6031.1653929312633 | W21: =CapLease!R29C18 -> 6091.4770468605766 | X21: =CapLease!R30C18 -> 6152.3918173291822 | Y21: =CapLease!R31C18 -> 6213.9157355024727 | Z21: =CapLease!R32C18 -> 6276.054892857499 | AA21: =CapLease!R33C18 -> 6338.8154417860733 | AB21: =CapLease!R34C18 -> 6402.2035962039336
A22: Total Current Liabilities | D22: =SUM(R[-4]C:R[-1]C) -> 0 | E22: =SUM(R[-4]C:R[-1]C) -> 7527.5042172489584 | F22: =SUM(R[-4]C:R[-1]C) -> 9300.6292594214483 | G22: =SUM(R[-4]C:R[-1]C) -> 12806.660552015663 | H22: =SUM(R[-4]C:R[-1]C) -> 9831.9771575358191 | I22: =SUM(R[-4]C:R[-1]C) -> 12697.020679111178 | J22: =SUM(R[-4]C:R[-1]C) -> 18385.67026090229 | K22: =SUM(R[-4]C:R[-1]C) -> 9746.7050885113131 | L22: =SUM(R[-4]C:R[-1]C) -> 12506.966889396426 | M22: =SUM(R[-4]C:R[-1]C) -> 17984.79743329039 | N22: =SUM(R[-4]C:R[-1]C) -> 18793.013532623292 | O22: =SUM(R[-4]C:R[-1]C) -> 26012.400792949527 | P22: =SUM(R[-4]C:R[-1]C) -> 40407.188613379025 | Q22: =SUM(R[-4]C:R[-1]C) -> 22682.104427655369 | R22: =SUM(R[-4]C:R[-1]C) -> 31211.31764693193 | S22: =SUM(R[-4]C:R[-1]C) -> 48212.933460901244 | T22: =SUM(R[-4]C:R[-1]C) -> 25397.533733010256 | U22: =SUM(R[-4]C:R[-1]C) -> 35199.260071590354 | V22: =SUM(R[-4]C:R[-1]C) -> 54744.180705431252 | W22: =SUM(R[-4]C:R[-1]C) -> 28499.464090610571 | X22: =SUM(R[-4]C:R[-1]C) -> 39764.37238295417 | Y22: =SUM(R[-4]C:R[-1]C) -> 62233.883344877453 | Z22: =SUM(R[-4]C:R[-1]C) -> 32045.239993169991 | AA22: =SUM(R[-4]C:R[-1]C) -> 44992.593092254807 | AB22: =SUM(R[-4]C:R[-1]C) -> 70825.166346985163
A24: Long Term Liabilities
A25: Long Term Portion of Capital Lease | D25: =CapLease!R[-14]C[16] -> 170937.49578275104 | E25: =CapLease!R12C20 -> 166834.36652332958 | F25: =CapLease!R13C20 -> 162690.2059713139 | G25: =CapLease!R14C20 -> 158504.60381377809 | H25: =CapLease!R15C20 -> 154277.1456346669 | I25: =CapLease!R16C20 -> 150007.41287376461 | J25: =CapLease!R17C20 -> 145694.98278525329 | K25: =CapLease!R18C20 -> 141339.42839585687 | L25: =CapLease!R19C20 -> 136940.31846256647 | M25: =CapLease!R20C20 -> 132497.21742994318 | N25: =CapLease!R21C20 -> 128009.68538699365 | O25: =CapLease!R22C20 -> 123477.27802361462 | P25: =CapLease!R23C20 -> 167738.83109595923 | Q25: =CapLease!R24C20 -> 161942.99969902734 | R25: =CapLease!R25C20 -> 156089.20998812607 | S25: =CapLease!R26C20 -> 150176.88238011583 | T25: =CapLease!R27C20 -> 144205.43149602547 | U25: =CapLease!R28C20 -> 138174.26610309421 | V25: =CapLease!R29C20 -> 132082.78905623363 | W25: =CapLease!R30C20 -> 125930.39723890445 | X25: =CapLease!R31C20 -> 119716.48150340197 | Y25: =CapLease!R32C20 -> 113440.42661054447 | Z25: =CapLease!R33C20 -> 107101.61116875841 | AA25: =CapLease!R34C20 -> 100699.40757255448 | AB25: =CapLease!R35C20 -> 94233.181940388502
A26: Total Long Term Liabilities | D26: =R[-1]C -> 170937.49578275104 | E26: =R[-1]C -> 166834.36652332958 | F26: =R[-1]C -> 162690.2059713139 | G26: =R[-1]C -> 158504.60381377809 | H26: =R[-1]C -> 154277.1456346669 | I26: =R[-1]C -> 150007.41287376461 | J26: =R[-1]C -> 145694.98278525329 | K26: =R[-1]C -> 141339.42839585687 | L26: =R[-1]C -> 136940.31846256647 | M26: =R[-1]C -> 132497.21742994318 | N26: =R[-1]C -> 128009.68538699365 | O26: =R[-1]C -> 123477.27802361462 | P26: =R[-1]C -> 167738.83109595923 | Q26: =R[-1]C -> 161942.99969902734 | R26: =R[-1]C -> 156089.20998812607 | S26: =R[-1]C -> 150176.88238011583 | T26: =R[-1]C -> 144205.43149602547 | U26: =R[-1]C -> 138174.26610309421 | V26: =R[-1]C -> 132082.78905623363 | W26: =R[-1]C -> 125930.39723890445 | X26: =R[-1]C -> 119716.48150340197 | Y26: =R[-1]C -> 113440.42661054447 | Z26: =R[-1]C -> 107101.61116875841 | AA26: =R[-1]C -> 100699.40757255448 | AB26: =R[-1]C -> 94233.181940388502
A27: Total Liabilities | D27: =R[-1]C+R[-5]C -> 170937.49578275104 | E27: =R[-1]C+R[-5]C -> 174361.87074057854 | F27: =R[-1]C+R[-5]C -> 171990.83523073536 | G27: =R[-1]C+R[-5]C -> 171311.26436579376 | H27: =R[-1]C+R[-5]C -> 164109.12279220272 | I27: =R[-1]C+R[-5]C -> 162704.43355287579 | J27: =R[-1]C+R[-5]C -> 164080.65304615558 | K27: =R[-1]C+R[-5]C -> 151086.13348436818 | L27: =R[-1]C+R[-5]C -> 149447.2853519629 | M27: =R[-1]C+R[-5]C -> 150482.01486323358 | N27: =R[-1]C+R[-5]C -> 146802.69891961693 | O27: =R[-1]C+R[-5]C -> 149489.67881656415 | P27: =R[-1]C+R[-5]C -> 208146.01970933826 | Q27: =R[-1]C+R[-5]C -> 184625.10412668271 | R27: =R[-1]C+R[-5]C -> 187300.52763505798 | S27: =R[-1]C+R[-5]C -> 198389.81584101706 | T27: =R[-1]C+R[-5]C -> 169602.96522903573 | U27: =R[-1]C+R[-5]C -> 173373.52617468458 | V27: =R[-1]C+R[-5]C -> 186826.96976166486 | W27: =R[-1]C+R[-5]C -> 154429.86132951503 | X27: =R[-1]C+R[-5]C -> 159480.85388635614 | Y27: =R[-1]C+R[-5]C -> 175674.30995542192 | Z27: =R[-1]C+R[-5]C -> 139146.85116192838 | AA27: =R[-1]C+R[-5]C -> 145692.00066480928 | AB27: =R[-1]C+R[-5]C -> 165058.34828737366
A30: Shareholders' Equity
A31: Series A Preferred | D31: 3000000 | E31: =RC[-1] -> 3000000 | F31: =RC[-1] -> 3000000 | G31: =RC[-1] -> 3000000 | H31: =RC[-1] -> 3000000 | I31: =RC[-1] -> 3000000 | J31: =RC[-1] -> 3000000 | K31: =RC[-1] -> 3000000 | L31: =RC[-1] -> 3000000 | M31: =RC[-1] -> 3000000 | N31: =RC[-1] -> 3000000 | O31: =RC[-1] -> 3000000 | P31: =RC[-1] -> 3000000 | Q31: =RC[-1] -> 3000000 | R31: =RC[-1] -> 3000000 | S31: =RC[-1] -> 3000000 | T31: =RC[-1] -> 3000000 | U31: =RC[-1] -> 3000000 | V31: =RC[-1] -> 3000000 | W31: =RC[-1] -> 3000000 | X31: =RC[-1] -> 3000000 | Y31: =RC[-1] -> 3000000 | Z31: =RC[-1] -> 3000000 | AA31: =RC[-1] -> 3000000 | AB31: =RC[-1] -> 3000000
A32: Series B Preferred | Q32: 5000000 | R32: 5000000 | S32: 5000000 | T32: 5000000 | U32: 5000000 | V32: 5000000 | W32: 5000000 | X32: 5000000 | Y32: 5000000 | Z32: 5000000 | AA32: 5000000 | AB32: 5000000
A33: Common Stock | D33: 60000 | E33: 60000 | F33: 60000 | G33: 60000 | H33: 60000 | I33: 60000 | J33: 60000 | K33: 60000 | L33: 60000 | M33: 60000 | N33: 60000 | O33: 60000 | P33: 60000 | Q33: 60000 | R33: 60000 | S33: 60000 | T33: 60000 | U33: 60000 | V33: 60000 | W33: 60000 | X33: 60000 | Y33: 60000 | Z33: 60000 | AA33: 60000 | AB33: 60000
A34: Retained Earnings
A35: Accumulated Deficit | D35: 0 | E35: =(R[-21]C-(R[-8]C+R[-2]C+R[-4]C)) -> -133829.49841229292 | F35: =(R[-21]C-(R[-8]C+R[-2]C+R[-4]C)) -> -324592.01303724293 | G35: =(R[-21]C-(R[-8]C+R[-2]C+R[-4]C)) -> -562663.12957633147 | H35: =(R[-21]C-(R[-8]C+R[-2]C+R[-4]C)) -> -819562.90768083557 | I35: =(R[-21]C-(R[-8]C+R[-2]C+R[-4]C)) -> -1061069.1351410216 | J35: =(R[-21]C-(R[-8]C+R[-2]C+R[-4]C)) -> -1271153.9245977853 | K35: =(R[-21]C-(R[-8]C+R[-2]C+R[-4]C)) -> -1529828.9386466129 | L35: =(R[-21]C-(R[-8]C+R[-2]C+R[-4]C)) -> -1773717.6904310714 | M35: =(R[-21]C-(R[-8]C+R[-2]C+R[-4]C)) -> -1987401.6118312201 | N35: =(R[-21]C-(R[-8]C+R[-2]C+R[-4]C)) -> -2199497.0678117592 | O35: =(R[-21]C-(R[-8]C+R[-2]C+R[-4]C)) -> -2371450.5310348952 | P35: =(R[-21]C-(R[-8]C+R[-2]C+R[-4]C)) -> -2511375.8623093953 | Q35: =(R[-21]C-(R[-8]C+R[-2]C+R[-3]C+R[-4]C)) -> -7712053.5640375847 | R35: =(R[-21]C-(R[-8]C+R[-2]C+R[-3]C+R[-4]C)) -> -7866306.4116665823 | S35: =(R[-21]C-(R[-8]C+R[-2]C+R[-3]C+R[-4]C)) -> -7929410.4895646553 | T35: =(R[-21]C-(R[-8]C+R[-2]C+R[-3]C+R[-4]C)) -> -3128609.5323133497 | U35: =(R[-21]C-(R[-8]C+R[-2]C+R[-3]C+R[-4]C)) -> -3373516.5673692003 | V35: =(R[-21]C-(R[-8]C+R[-2]C+R[-3]C+R[-4]C)) -> -3513771.3969289707 | W35: =(R[-21]C-(R[-8]C+R[-2]C+R[-3]C+R[-4]C)) -> -3796502.2206219444 | X35: =(R[-21]C-(R[-8]C+R[-2]C+R[-3]C+R[-4]C)) -> -4019402.8818126628 | Y35: =(R[-21]C-(R[-8]C+R[-2]C+R[-3]C+R[-4]C)) -> -4121806.6871157736 | Z35: =(R[-21]C-(R[-8]C+R[-2]C+R[-3]C+R[-4]C)) -> -4387910.681191925 | AA35: =(R[-21]C-(R[-8]C+R[-2]C+R[-3]C+R[-4]C)) -> -4585062.3978563882 | AB35: =(R[-21]C-(R[-8]C+R[-2]C+R[-3]C+R[-4]C)) -> -4643494.7525164941
A36: Total Shareholders' Equity | D36: =SUM(R[-5]C:R[-1]C) -> 3060000 | E36: =SUM(R[-5]C:R[-1]C) -> 2926170.5015877071 | F36: =SUM(R[-5]C:R[-1]C) -> 2735407.9869627571 | G36: =SUM(R[-5]C:R[-1]C) -> 2497336.8704236685 | H36: =SUM(R[-5]C:R[-1]C) -> 2240437.0923191644 | I36: =SUM(R[-5]C:R[-1]C) -> 1998930.8648589784 | J36: =SUM(R[-5]C:R[-1]C) -> 1788846.0754022147 | K36: =SUM(R[-5]C:R[-1]C) -> 1530171.0613533871 | L36: =SUM(R[-5]C:R[-1]C) -> 1286282.3095689286 | M36: =SUM(R[-5]C:R[-1]C) -> 1072598.3881687799 | N36: =SUM(R[-5]C:R[-1]C) -> 860502.93218824081 | O36: =SUM(R[-5]C:R[-1]C) -> 688549.46896510478 | P36: =SUM(R[-5]C:R[-1]C) -> 548624.13769060466 | Q36: =SUM(R[-5]C:R[-1]C) -> 347946.4359624153 | R36: =SUM(R[-5]C:R[-1]C) -> 193693.58833341766 | S36: =SUM(R[-5]C:R[-1]C) -> 130589.51043534465 | T36: =SUM(R[-5]C:R[-1]C) -> 4931390.4676866503 | U36: =SUM(R[-5]C:R[-1]C) -> 4686483.4326307997 | V36: =SUM(R[-5]C:R[-1]C) -> 4546228.6030710293 | W36: =SUM(R[-5]C:R[-1]C) -> 4263497.7793780556 | X36: =SUM(R[-5]C:R[-1]C) -> 4040597.1181873372 | Y36: =SUM(R[-5]C:R[-1]C) -> 3938193.3128842264 | Z36: =SUM(R[-5]C:R[-1]C) -> 3672089.318808075 | AA36: =SUM(R[-5]C:R[-1]C) -> 3474937.6021436118 | AB36: =SUM(R[-5]C:R[-1]C) -> 3416505.2474835059
A37: Total Liab & Shareholders' Equity | D37: =SUM(R[-10]C+R[-1]C) -> 3230937.4957827511 | E37: =SUM(R[-10]C+R[-1]C) -> 3100532.3723282856 | F37: =SUM(R[-10]C+R[-1]C) -> 2907398.8221934922 | G37: =SUM(R[-10]C+R[-1]C) -> 2668648.1347894622 | H37: =SUM(R[-10]C+R[-1]C) -> 2404546.2151113669 | I37: =SUM(R[-10]C+R[-1]C) -> 2161635.2984118541 | J37: =SUM(R[-10]C+R[-1]C) -> 1952926.7284483702 | K37: =SUM(R[-10]C+R[-1]C) -> 1681257.1948377553 | L37: =SUM(R[-10]C+R[-1]C) -> 1435729.5949208913 | M37: =SUM(R[-10]C+R[-1]C) -> 1223080.4030320134 | N37: =SUM(R[-10]C+R[-1]C) -> 1007305.6311078577 | O37: =SUM(R[-10]C+R[-1]C) -> 838039.14778166893 | P37: =SUM(R[-10]C+R[-1]C) -> 756770.15739994287 | Q37: =SUM(R[-10]C+R[-1]C) -> 532571.54008909804 | R37: =SUM(R[-10]C+R[-1]C) -> 380994.11596847564 | S37: =SUM(R[-10]C+R[-1]C) -> 328979.32627636171 | T37: =SUM(R[-10]C+R[-1]C) -> 5100993.4329156857 | U37: =SUM(R[-10]C+R[-1]C) -> 4859856.9588054847 | V37: =SUM(R[-10]C+R[-1]C) -> 4733055.5728326943 | W37: =SUM(R[-10]C+R[-1]C) -> 4417927.6407075711 | X37: =SUM(R[-10]C+R[-1]C) -> 4200077.9720736938 | Y37: =SUM(R[-10]C+R[-1]C) -> 4113867.6228396483 | Z37: =SUM(R[-10]C+R[-1]C) -> 3811236.1699700034 | AA37: =SUM(R[-10]C+R[-1]C) -> 3620629.602808421 | AB37: =SUM(R[-10]C+R[-1]C) -> 3581563.5957708796

Sheet: StmtOfCF
A3: Forecast Statements of Cashflows
A5: Cashflows from operating activities | D5: 2001-12-01T00:00:00.000 | E5: 2002-01-01T00:00:00.000 | F5: 2002-02-01T00:00:00.000 | G5: 2002-03-01T00:00:00.000 | H5: 2002-04-01T00:00:00.000 | I5: 2002-05-01T00:00:00.000 | J5: 2002-06-01T00:00:00.000 | K5: 2002-07-01T00:00:00.000 | L5: 2002-08-01T00:00:00.000 | M5: 2002-09-01T00:00:00.000 | N5: 2002-10-01T00:00:00.000 | O5: 2002-11-01T00:00:00.000 | P5: 2002-12-01T00:00:00.000 | Q5: 2003-01-01T00:00:00.000 | R5: 2003-02-01T00:00:00.000 | S5: 2003-03-01T00:00:00.000 | T5: 2003-04-01T00:00:00.000 | U5: 2003-05-01T00:00:00.000 | V5: 2003-06-01T00:00:00.000 | W5: 2003-07-01T00:00:00.000 | X5: 2003-08-01T00:00:00.000 | Y5: 2003-09-01T00:00:00.000 | Z5: 2003-10-01T00:00:00.000 | AA5: 2003-11-01T00:00:00.000 | AB5: 2003-12-01T00:00:00.000
A6: Net income (loss) | D6: 0 | E6: =MonthlyPAndL!R[21]C[-1] -> -133870.12345446565 | F6: =MonthlyPAndL!R[21]C[-1] -> -190762.92087537193 | G6: =MonthlyPAndL!R[21]C[-1] -> -238071.52685201418 | H6: =MonthlyPAndL!R[21]C[-1] -> -256900.19252055962 | I6: =MonthlyPAndL!R[21]C[-1] -> -241506.64602040173 | J6: =MonthlyPAndL!R[21]C[-1] -> -210085.21220258164 | K6: =MonthlyPAndL!R[21]C[-1] -> -258675.44102210354 | L6: =MonthlyPAndL!R[21]C[-1] -> -243889.1830274672 | M6: =MonthlyPAndL!R[21]C[-1] -> -213684.3569555876 | N6: =MonthlyPAndL!R[21]C[-1] -> -212095.89589153245 | O6: =MonthlyPAndL!R[21]C[-1] -> -171953.90753323879 | P6: =MonthlyPAndL!R[21]C[-1] -> -91086.495518347001 | Q6: =MonthlyPAndL!R[21]C[-1] -> -200917.93552207912 | R6: =MonthlyPAndL!R[21]C[-1] -> -155642.31036257843 | S6: =MonthlyPAndL!R[21]C[-1] -> -64493.546370102224 | T6: =MonthlyPAndL!R[21]C[-1] -> -200588.51701655478 | U6: =MonthlyPAndL!R[21]C[-1] -> -246296.51517749997 | V6: =MonthlyPAndL!R[21]C[-1] -> -141644.31559374771 | W6: =MonthlyPAndL!R[21]C[-1] -> -284120.31569840189 | X6: =MonthlyPAndL!R[21]C[-1] -> -224290.15922731196 | Y6: =MonthlyPAndL!R[21]C[-1] -> -103793.30943118139 | Z6: =MonthlyPAndL!R[21]C[-1] -> -267493.50435661373 | AA6: =MonthlyPAndL!R[21]C[-1] -> -198541.23315884126 | AB6: =MonthlyPAndL!R[21]C[-1] -> -59821.877430539367
A7: Non-cash income & expenses
B8: Depreciation | D8: 0 | E8: =MonthlyPAndL!R[13]C[-1] -> 4861.1111111111113 | F8: =MonthlyPAndL!R[13]C[-1] -> 4861.1111111111113 | G8: =MonthlyPAndL!R[13]C[-1] -> 4861.1111111111113 | H8: =MonthlyPAndL!R[13]C[-1] -> 4861.1111111111113 | I8: =MonthlyPAndL!R[13]C[-1] -> 4861.1111111111113 | J8: =MonthlyPAndL!R[13]C[-1] -> 4861.1111111111113 | K8: =MonthlyPAndL!R[13]C[-1] -> 4861.1111111111113 | L8: =MonthlyPAndL!R[13]C[-1] -> 4861.1111111111113 | M8: =MonthlyPAndL!R[13]C[-1] -> 4861.1111111111113 | N8: =MonthlyPAndL!R[13]C[-1] -> 4861.1111111111113 | O8: =MonthlyPAndL!R[13]C[-1] -> 4861.1111111111113 | P8: =MonthlyPAndL!R[13]C[-1] -> 4861.1111111111113 | Q8: =MonthlyPAndL!R[13]C[-1] -> 6250 | R8: =MonthlyPAndL!R[13]C[-1] -> 6250 | S8: =MonthlyPAndL!R[13]C[-1] -> 6250 | T8: =MonthlyPAndL!R[13]C[-1] -> 6250 | U8: =MonthlyPAndL!R[13]C[-1] -> 6250 | V8: =MonthlyPAndL!R[13]C[-1] -> 6250 | W8: =MonthlyPAndL!R[13]C[-1] -> 6250 | X8: =MonthlyPAndL!R[13]C[-1] -> 6250 | Y8: =MonthlyPAndL!R[13]C[-1] -> 6250 | Z8: =MonthlyPAndL!R[13]C[-1] -> 6250 | AA8: =MonthlyPAndL!R[13]C[-1] -> 6250 | AB8: =MonthlyPAndL!R[13]C[-1] -> 6250
B9: Deferred revenues | D9: 0 | E9: =BalanceSheet!R[11]C[-1] -> 0 | F9: =BalanceSheet!R[11]C[-1] -> 0 | G9: =BalanceSheet!R[11]C[-1] -> 0 | H9: =BalanceSheet!R[11]C[-1] -> 0 | I9: =BalanceSheet!R[11]C[-1] -> 0 | J9: =BalanceSheet!R[11]C[-1] -> 0 | K9: =BalanceSheet!R[11]C[-1] -> 0 | L9: =BalanceSheet!R[11]C[-1] -> 0 | M9: =BalanceSheet!R[11]C[-1] -> 0 | N9: =BalanceSheet!R[11]C[-1] -> 0 | O9: =BalanceSheet!R[11]C[-1] -> 0 | P9: =BalanceSheet!R[11]C[-1] -> 0
A10: Changes in non-cash assets & liabilities
B11: Decrease (increase) in accounts receivable | D11: 0 | E11: =BalanceSheet!R[-4]C[-1]-BalanceSheet!R[-4]C -> -3960 | F11: =BalanceSheet!R[-4]C[-1]-BalanceSheet!R[-4]C -> -1980 | G11: =BalanceSheet!R[-4]C[-1]-BalanceSheet!R[-4]C -> -3960 | H11: =BalanceSheet!R[-4]C[-1]-BalanceSheet!R[-4]C -> 3447 | I11: =BalanceSheet!R[-4]C[-1]-BalanceSheet!R[-4]C -> -3226.5 | J11: =BalanceSheet!R[-4]C[-1]-BalanceSheet!R[-4]C -> -6453 | K11: =BalanceSheet!R[-4]C[-1]-BalanceSheet!R[-4]C -> 9921.9 | L11: =BalanceSheet!R[-4]C[-1]-BalanceSheet!R[-4]C -> -3105.2999999999993 | M11: =BalanceSheet!R[-4]C[-1]-BalanceSheet!R[-4]C -> -6210.6 | N11: =BalanceSheet!R[-4]C[-1]-BalanceSheet!R[-4]C -> -873.40000000000146 | O11: =BalanceSheet!R[-4]C[-1]-BalanceSheet!R[-4]C -> -8199.9500000000007 | P11: =BalanceSheet!R[-4]C[-1]-BalanceSheet!R[-4]C -> -16399.899999999998 | Q11: =BalanceSheet!R[-4]C[-1]-BalanceSheet!R[-4]C -> 21635.57 | R11: =BalanceSheet!R[-4]C[-1]-BalanceSheet!R[-4]C -> -9682.0900000000038 | S11: =BalanceSheet!R[-4]C[-1]-BalanceSheet!R[-4]C -> -19364.18 | T11: =BalanceSheet!R[-4]C[-1]-BalanceSheet!R[-4]C -> 26141.643000000004 | U11: =BalanceSheet!R[-4]C[-1]-BalanceSheet!R[-4]C -> -11134.403499999993 | V11: =BalanceSheet!R[-4]C[-1]-BalanceSheet!R[-4]C -> -22268.807000000001 | W11: =BalanceSheet!R[-4]C[-1]-BalanceSheet!R[-4]C -> 30062.889449999999 | X11: =BalanceSheet!R[-4]C[-1]-BalanceSheet!R[-4]C -> -12804.564024999996 | Y11: =BalanceSheet!R[-4]C[-1]-BalanceSheet!R[-4]C -> -25609.128049999992 | Z11: =BalanceSheet!R[-4]C[-1]-BalanceSheet!R[-4]C -> 34572.322867499992 | AA11: =BalanceSheet!R[-4]C[-1]-BalanceSheet!R[-4]C -> -14725.24862875 | AB11: =BalanceSheet!R[-4]C[-1]-BalanceSheet!R[-4]C -> -29450.497257499999
B12: Decrease (increase) in other current assets | D12: 0 | E12: =BalanceSheet!R[-4]C[-1]-BalanceSheet!R[-4]C -> -25000 | F12: =BalanceSheet!R[-4]C[-1]-BalanceSheet!R[-4]C -> 0 | G12: =BalanceSheet!R[-4]C[-1]-BalanceSheet!R[-4]C -> 0 | H12: =BalanceSheet!R[-4]C[-1]-BalanceSheet!R[-4]C -> 0 | I12: =BalanceSheet!R[-4]C[-1]-BalanceSheet!R[-4]C -> 0 | J12: =BalanceSheet!R[-4]C[-1]-BalanceSheet!R[-4]C -> 0 | K12: =BalanceSheet!R[-4]C[-1]-BalanceSheet!R[-4]C -> 0 | L12: =BalanceSheet!R[-4]C[-1]-BalanceSheet!R[-4]C -> 0 | M12: =BalanceSheet!R[-4]C[-1]-BalanceSheet!R[-4]C -> 0 | N12: =BalanceSheet!R[-4]C[-1]-BalanceSheet!R[-4]C -> 0 | O12: =BalanceSheet!R[-4]C[-1]-BalanceSheet!R[-4]C -> 0 | P12: =BalanceSheet!R[-4]C[-1]-BalanceSheet!R[-4]C -> 0 | Q12: =BalanceSheet!R[-4]C[-1]-BalanceSheet!R[-4]C -> 0 | R12: =BalanceSheet!R[-4]C[-1]-BalanceSheet!R[-4]C -> 0 | S12: =BalanceSheet!R[-4]C[-1]-BalanceSheet!R[-4]C -> 0 | T12: =BalanceSheet!R[-4]C[-1]-BalanceSheet!R[-4]C -> 0 | U12: =BalanceSheet!R[-4]C[-1]-BalanceSheet!R[-4]C -> 0 | V12: =BalanceSheet!R[-4]C[-1]-BalanceSheet!R[-4]C -> 0 | W12: =BalanceSheet!R[-4]C[-1]-BalanceSheet!R[-4]C -> 0 | X12: =BalanceSheet!R[-4]C[-1]-BalanceSheet!R[-4]C -> 0 | Y12: =BalanceSheet!R[-4]C[-1]-BalanceSheet!R[-4]C -> 0 | Z12: =BalanceSheet!R[-4]C[-1]-BalanceSheet!R[-4]C -> 0 | AA12: =BalanceSheet!R[-4]C[-1]-BalanceSheet!R[-4]C -> 0 | AB12: =BalanceSheet!R[-4]C[-1]-BalanceSheet!R[-4]C -> 0
B13: Increase (decrease) in current liabilities | D13: 0 | E13: =-((BalanceSheet!R[5]C[-1]+BalanceSheet!R[6]C[-1])-(BalanceSheet!R[5]C+BalanceSheet!R[6]C)) -> 3465 | F13: =-((BalanceSheet!R[5]C[-1]+BalanceSheet!R[6]C[-1])-(BalanceSheet!R[5]C+BalanceSheet!R[6]C)) -> 1732.5 | G13: =-((BalanceSheet!R[5]C[-1]+BalanceSheet!R[6]C[-1])-(BalanceSheet!R[5]C+BalanceSheet!R[6]C)) -> 3465 | H13: =-((BalanceSheet!R[5]C[-1]+BalanceSheet!R[6]C[-1])-(BalanceSheet!R[5]C+BalanceSheet!R[6]C)) -> -3016.125 | I13: =-((BalanceSheet!R[5]C[-1]+BalanceSheet!R[6]C[-1])-(BalanceSheet!R[5]C+BalanceSheet!R[6]C)) -> 2823.1875 | J13: =-((BalanceSheet!R[5]C[-1]+BalanceSheet!R[6]C[-1])-(BalanceSheet!R[5]C+BalanceSheet!R[6]C)) -> 5646.375 | K13: =-((BalanceSheet!R[5]C[-1]+BalanceSheet!R[6]C[-1])-(BalanceSheet!R[5]C+BalanceSheet!R[6]C)) -> -8681.6625000000004 | L13: =-((BalanceSheet!R[5]C[-1]+BalanceSheet!R[6]C[-1])-(BalanceSheet!R[5]C+BalanceSheet!R[6]C)) -> 2717.1375000000007 | M13: =-((BalanceSheet!R[5]C[-1]+BalanceSheet!R[6]C[-1])-(BalanceSheet!R[5]C+BalanceSheet!R[6]C)) -> 5434.2749999999996 | N13: =-((BalanceSheet!R[5]C[-1]+BalanceSheet!R[6]C[-1])-(BalanceSheet!R[5]C+BalanceSheet!R[6]C)) -> 764.22499999999854 | O13: =-((BalanceSheet!R[5]C[-1]+BalanceSheet!R[6]C[-1])-(BalanceSheet!R[5]C+BalanceSheet!R[6]C)) -> 7174.9562500000029 | P13: =-((BalanceSheet!R[5]C[-1]+BalanceSheet!R[6]C[-1])-(BalanceSheet!R[5]C+BalanceSheet!R[6]C)) -> 14349.912499999999 | Q13: =-((BalanceSheet!R[5]C[-1]+BalanceSheet!R[6]C[-1])-(BalanceSheet!R[5]C+BalanceSheet!R[6]C)) -> -18931.123750000002 | R13: =-((BalanceSheet!R[5]C[-1]+BalanceSheet!R[6]C[-1])-(BalanceSheet!R[5]C+BalanceSheet!R[6]C)) -> 8471.8287500000042 | S13: =-((BalanceSheet!R[5]C[-1]+BalanceSheet!R[6]C[-1])-(BalanceSheet!R[5]C+BalanceSheet!R[6]C)) -> 16943.657500000001 | T13: =-((BalanceSheet!R[5]C[-1]+BalanceSheet!R[6]C[-1])-(BalanceSheet!R[5]C+BalanceSheet!R[6]C)) -> -22873.937625000006 | U13: =-((BalanceSheet!R[5]C[-1]+BalanceSheet!R[6]C[-1])-(BalanceSheet!R[5]C+BalanceSheet!R[6]C)) -> 9742.6030624999948 | V13: =-((BalanceSheet!R[5]C[-1]+BalanceSheet!R[6]C[-1])-(BalanceSheet!R[5]C+BalanceSheet!R[6]C)) -> 19485.206125000001 | W13: =-((BalanceSheet!R[5]C[-1]+BalanceSheet!R[6]C[-1])-(BalanceSheet!R[5]C+BalanceSheet!R[6]C)) -> -26305.028268749997 | X13: =-((BalanceSheet!R[5]C[-1]+BalanceSheet!R[6]C[-1])-(BalanceSheet!R[5]C+BalanceSheet!R[6]C)) -> 11203.993521874992 | Y13: =-((BalanceSheet!R[5]C[-1]+BalanceSheet!R[6]C[-1])-(BalanceSheet!R[5]C+BalanceSheet!R[6]C)) -> 22407.987043749992 | Z13: =-((BalanceSheet!R[5]C[-1]+BalanceSheet!R[6]C[-1])-(BalanceSheet!R[5]C+BalanceSheet!R[6]C)) -> -30250.78250906249 | AA13: =-((BalanceSheet!R[5]C[-1]+BalanceSheet!R[6]C[-1])-(BalanceSheet!R[5]C+BalanceSheet!R[6]C)) -> 12884.592550156245 | AB13: =-((BalanceSheet!R[5]C[-1]+BalanceSheet!R[6]C[-1])-(BalanceSheet!R[5]C+BalanceSheet!R[6]C)) -> 25769.185100312498
B14: Net Cash provided by (used in) operations | D14: =SUM(R[-8]C:R[-1]C) -> 0 | E14: =SUM(R[-8]C:R[-1]C) -> -154504.01234335452 | F14: =SUM(R[-8]C:R[-1]C) -> -186149.3097642608 | G14: =SUM(R[-8]C:R[-1]C) -> -233705.41574090306 | H14: =SUM(R[-8]C:R[-1]C) -> -251608.2064094485 | I14: =SUM(R[-8]C:R[-1]C) -> -237048.84740929061 | J14: =SUM(R[-8]C:R[-1]C) -> -206030.72609147051 | K14: =SUM(R[-8]C:R[-1]C) -> -252574.09241099242 | L14: =SUM(R[-8]C:R[-1]C) -> -239416.23441635605 | M14: =SUM(R[-8]C:R[-1]C) -> -209599.57084447649 | N14: =SUM(R[-8]C:R[-1]C) -> -207343.95978042131 | O14: =SUM(R[-8]C:R[-1]C) -> -168117.79017212766 | P14: =SUM(R[-8]C:R[-1]C) -> -88275.37190723588 | Q14: =SUM(R[-8]C:R[-1]C) -> -191963.48927207911 | R14: =SUM(R[-8]C:R[-1]C) -> -150602.57161257841 | S14: =SUM(R[-8]C:R[-1]C) -> -60664.06887010223 | T14: =SUM(R[-8]C:R[-1]C) -> -191070.81164155476 | U14: =SUM(R[-8]C:R[-1]C) -> -241438.31561499997 | V14: =SUM(R[-8]C:R[-1]C) -> -138177.91646874772 | W14: =SUM(R[-8]C:R[-1]C) -> -274112.45451715187 | X14: =SUM(R[-8]C:R[-1]C) -> -219640.72973043696 | Y14: =SUM(R[-8]C:R[-1]C) -> -100744.45043743138 | Z14: =SUM(R[-8]C:R[-1]C) -> -256921.96399817624 | AA14: =SUM(R[-8]C:R[-1]C) -> -194131.88923743501 | AB14: =SUM(R[-8]C:R[-1]C) -> -57253.189587726862
A17: Cashflows from investing activities
B18: Capital expenditures | D18: 0 | E18: =BalanceSheet!R[3]C -> 4062.5042172489584 | F18: =BalanceSheet!R[3]C -> 4103.1292594214483 | G18: =BalanceSheet!R[3]C -> 4144.1605520156627 | H18: =BalanceSheet!R[3]C -> 4185.6021575358191 | I18: =BalanceSheet!R[3]C -> 4227.4581791111777 | J18: =BalanceSheet!R[3]C -> 4269.7327609022896 | K18: =BalanceSheet!R[3]C -> 4312.4300885113125 | L18: =BalanceSheet!R[3]C -> 4355.5543893964259 | M18: =BalanceSheet!R[3]C -> 4399.1099332903896 | N18: =BalanceSheet!R[3]C -> 4443.1010326232936 | O18: =BalanceSheet!R[3]C -> 4487.5320429495268 | P18: =BalanceSheet!R[3]C -> 4532.4073633790222 | Q18: =BalanceSheet!R[3]C -> 5738.4469276553718 | R18: =BalanceSheet!R[3]C -> 5795.8313969319261 | S18: =BalanceSheet!R[3]C -> 5853.7897109012447 | T18: =BalanceSheet!R[3]C -> 5912.3276080102578 | U18: =BalanceSheet!R[3]C -> 5971.45088409036 | V18: =BalanceSheet!R[3]C -> 6031.1653929312633 | W18: =BalanceSheet!R[3]C -> 6091.4770468605766 | X18: =BalanceSheet!R[3]C -> 6152.3918173291822 | Y18: =BalanceSheet!R[3]C -> 6213.9157355024727 | Z18: =BalanceSheet!R[3]C -> 6276.054892857499 | AA18: =BalanceSheet!R[3]C -> 6338.8154417860733 | AB18: =BalanceSheet!R[3]C -> 6402.2035962039336
B19: Net Cash used in investing activities | D19: 0 | E19: =R[-1]C -> 4062.5042172489584 | F19: =R[-1]C -> 4103.1292594214483 | G19: =R[-1]C -> 4144.1605520156627 | H19: =R[-1]C -> 4185.6021575358191 | I19: =R[-1]C -> 4227.4581791111777 | J19: =R[-1]C -> 4269.7327609022896 | K19: =R[-1]C -> 4312.4300885113125 | L19: =R[-1]C -> 4355.5543893964259 | M19: =R[-1]C -> 4399.1099332903896 | N19: =R[-1]C -> 4443.1010326232936 | O19: =R[-1]C -> 4487.5320429495268 | P19: =R[-1]C -> 4532.4073633790222 | Q19: =R[-1]C -> 5738.4469276553718 | R19: =R[-1]C -> 5795.8313969319261 | S19: =R[-1]C -> 5853.7897109012447 | T19: =R[-1]C -> 5912.3276080102578 | U19: =R[-1]C -> 5971.45088409036 | V19: =R[-1]C -> 6031.1653929312633 | W19: =R[-1]C -> 6091.4770468605766 | X19: =R[-1]C -> 6152.3918173291822 | Y19: =R[-1]C -> 6213.9157355024727 | Z19: =R[-1]C -> 6276.054892857499 | AA19: =R[-1]C -> 6338.8154417860733 | AB19: =R[-1]C -> 6402.2035962039336
A22: Cashflows from financing activities
B23: Proceeds from issuance of preferred stock, net | D23: 3060000 | E23: 0 | F23: =RC[-1] -> 0 | G23: =RC[-1] -> 0 | H23: =RC[-1] -> 0 | I23: =RC[-1] -> 0 | J23: =RC[-1] -> 0 | K23: =RC[-1] -> 0 | L23: =RC[-1] -> 0 | M23: =RC[-1] -> 0 | N23: =RC[-1] -> 0 | O23: =RC[-1] -> 0 | P23: =RC[-1] -> 0 | Q23: 0 | R23: 0 | S23: 0 | T23: 5000000 | U23: 0 | V23: 0 | W23: 0 | X23: 0 | Y23: 0 | Z23: 0 | AA23: 0 | AB23: 0
B24: Net Cash provided by financing activities | D24: =R[-1]C -> 3060000 | E24: =R[-1]C -> 0 | F24: =R[-1]C -> 0 | G24: =R[-1]C -> 0 | H24: =R[-1]C -> 0 | I24: =R[-1]C -> 0 | J24: =R[-1]C -> 0 | K24: =R[-1]C -> 0 | L24: =R[-1]C -> 0 | M24: =R[-1]C -> 0 | N24: =R[-1]C -> 0 | O24: =R[-1]C -> 0 | P24: =R[-1]C -> 0 | Q24: =R[-1]C -> 0 | R24: =R[-1]C -> 0 | S24: =R[-1]C -> 0 | T24: =R[-1]C -> 5000000 | U24: =R[-1]C -> 0 | V24: =R[-1]C -> 0 | W24: =R[-1]C -> 0 | X24: =R[-1]C -> 0 | Y24: =R[-1]C -> 0 | Z24: =R[-1]C -> 0 | AA24: =R[-1]C -> 0 | AB24: =R[-1]C -> 0
A27: Increase (decrease) in cash and cash equivalents | D27: 0 | E27: =R[-13]C-R[-8]C+R[-3]C -> -158566.51656060349 | F27: =R[-13]C-R[-8]C+R[-3]C -> -190252.43902368227 | G27: =R[-13]C-R[-8]C+R[-3]C -> -237849.57629291873 | H27: =R[-13]C-R[-8]C+R[-3]C -> -255793.80856698431 | I27: =R[-13]C-R[-8]C+R[-3]C -> -241276.3055884018 | J27: =R[-13]C-R[-8]C+R[-3]C -> -210300.4588523728 | K27: =R[-13]C-R[-8]C+R[-3]C -> -256886.52249950374 | L27: =R[-13]C-R[-8]C+R[-3]C -> -243771.78880575247 | M27: =R[-13]C-R[-8]C+R[-3]C -> -213998.68077776689 | N27: =R[-13]C-R[-8]C+R[-3]C -> -211787.06081304461 | O27: =R[-13]C-R[-8]C+R[-3]C -> -172605.32221507718 | P27: =R[-13]C-R[-8]C+R[-3]C -> -92807.779270614905 | Q27: =R[-13]C-R[-8]C+R[-3]C -> -197701.93619973448 | R27: =R[-13]C-R[-8]C+R[-3]C -> -156398.40300951034 | S27: =R[-13]C-R[-8]C+R[-3]C -> -66517.858581003471 | T27: =R[-13]C-R[-8]C+R[-3]C -> 4803016.8607504349 | U27: =R[-13]C-R[-8]C+R[-3]C -> -247409.76649909033 | V27: =R[-13]C-R[-8]C+R[-3]C -> -144209.08186167898 | W27: =R[-13]C-R[-8]C+R[-3]C -> -280203.93156401243 | X27: =R[-13]C-R[-8]C+R[-3]C -> -225793.12154776615 | Y27: =R[-13]C-R[-8]C+R[-3]C -> -106958.36617293386 | Z27: =R[-13]C-R[-8]C+R[-3]C -> -263198.01889103372 | AA27: =R[-13]C-R[-8]C+R[-3]C -> -200470.70467922109 | AB27: =R[-13]C-R[-8]C+R[-3]C -> -63655.393183930792
A28: Beginning balance, cash and cash equivalents | D28: 3060000 | E28: =R[1]C[-1] -> 3060000 | F28: =R[1]C[-1] -> 2901433.4834393966 | G28: =R[1]C[-1] -> 2711181.0444157142 | H28: =R[1]C[-1] -> 2473331.4681227957 | I28: =R[1]C[-1] -> 2217537.6595558114 | J28: =R[1]C[-1] -> 1976261.3539674096 | K28: =R[1]C[-1] -> 1765960.8951150368 | L28: =R[1]C[-1] -> 1509074.3726155329 | M28: =R[1]C[-1] -> 1265302.5838097804 | N28: =R[1]C[-1] -> 1051303.9030320134 | O28: =R[1]C[-1] -> 839516.84221896878 | P28: =R[1]C[-1] -> 666911.52000389155 | Q28: =R[1]C[-1] -> 574103.74073327659 | R28: =R[1]C[-1] -> 376401.80453354213 | S28: =R[1]C[-1] -> 220003.4015240318 | T28: =R[1]C[-1] -> 153485.54294302833 | U28: =R[1]C[-1] -> 4956502.4036934637 | V28: =R[1]C[-1] -> 4709092.6371943736 | W28: =R[1]C[-1] -> 4564883.5553326942 | X28: =R[1]C[-1] -> 4284679.6237686817 | Y28: =R[1]C[-1] -> 4058886.5022209156 | Z28: =R[1]C[-1] -> 3951928.1360479817 | AA28: =R[1]C[-1] -> 3688730.117156948 | AB28: =R[1]C[-1] -> 3488259.412477727
B29: Ending balance, cash and cash equivalents | D29: =SUM(R[-2]C:R[-1]C) -> 3060000 | E29: =SUM(R[-2]C:R[-1]C) -> 2901433.4834393966 | F29: =SUM(R[-2]C:R[-1]C) -> 2711181.0444157142 | G29: =SUM(R[-2]C:R[-1]C) -> 2473331.4681227957 | H29: =SUM(R[-2]C:R[-1]C) -> 2217537.6595558114 | I29: =SUM(R[-2]C:R[-1]C) -> 1976261.3539674096 | J29: =SUM(R[-2]C:R[-1]C) -> 1765960.8951150368 | K29: =SUM(R[-2]C:R[-1]C) -> 1509074.3726155329 | L29: =SUM(R[-2]C:R[-1]C) -> 1265302.5838097804 | M29: =SUM(R[-2]C:R[-1]C) -> 1051303.9030320134 | N29: =SUM(R[-2]C:R[-1]C) -> 839516.84221896878 | O29: =SUM(R[-2]C:R[-1]C) -> 666911.52000389155 | P29: =SUM(R[-2]C:R[-1]C) -> 574103.74073327659 | Q29: =SUM(R[-2]C:R[-1]C) -> 376401.80453354213 | R29: =SUM(R[-2]C:R[-1]C) -> 220003.4015240318 | S29: =SUM(R[-2]C:R[-1]C) -> 153485.54294302833 | T29: =SUM(R[-2]C:R[-1]C) -> 4956502.4036934637 | U29: =SUM(R[-2]C:R[-1]C) -> 4709092.6371943736 | V29: =SUM(R[-2]C:R[-1]C) -> 4564883.5553326942 | W29: =SUM(R[-2]C:R[-1]C) -> 4284679.6237686817 | X29: =SUM(R[-2]C:R[-1]C) -> 4058886.5022209156 | Y29: =SUM(R[-2]C:R[-1]C) -> 3951928.1360479817 | Z29: =SUM(R[-2]C:R[-1]C) -> 3688730.117156948 | AA29: =SUM(R[-2]C:R[-1]C) -> 3488259.412477727 | AB29: =SUM(R[-2]C:R[-1]C) -> 3424604.0192937963

Sheet: Cap Table
A1: Capitalization Structure
C2: Common Stock | D2: Series A | E2: Series B
A3: Raise Amount in Round | C3: 60000 | D3: 3000000 | E3: 5000000
A4: Offering Price per share | C4: 0.01 | D4: 1 | E4: 1.6
A5: Shares in Offering | C5: =R[-2]C/R[-1]C -> 6000000 | D5: =R[-2]C/R[-1]C -> 3000000 | E5: =R[-2]C/R[-1]C -> 3125000
A8: Capitalization Table | C8: Shares of Stock
A10: Holdings | C10: After Series A | D10: % after Series A Offering | E10: After Series B | F10: % After Series B Offering
A12: Series A Senior Convertible Preferred Stock | C12: =R[-7]C[1] -> 3000000 | D12: =RC[-1]/R17C3 -> 0.27272727272727271 | E12: 3000000 | F12: =RC[-1]/R17C5 -> 0.21238938053097345
A13: Series B Senior Convertible Preferred Stock | C13: - | D13: - | E13: =R[-8]C -> 3125000 | F13: =RC[-1]/R17C5 -> 0.22123893805309736
A14: Common Stock | C14: 6000000 | D14: =RC[-1]/R17C3 -> 0.54545454545454541 | E14: 6000000 | F14: =RC[-1]/R17C5 -> 0.4247787610619469
A15: Common Stock reserved for Stock Option Plan | C15: 2000000 | D15: =RC[-1]/R17C3 -> 0.18181818181818182 | E15: 2000000 | F15: =RC[-1]/R17C5 -> 0.1415929203539823
A17: Total Shares Outstanding (Fully Diluted) | C17: =SUM(R[-5]C:R[-2]C) -> 11000000 | D17: =SUM(R[-5]C:R[-2]C) -> 1 | E17: =SUM(R[-5]C:R[-1]C) -> 14125000 | F17: =SUM(R[-5]C:R[-2]C) -> 1
A20: Post Money Value | C20: =R[-16]C[1]*R[-3]C -> 11000000 | E20: =R[-3]C*R[-16]C -> 22600000

Sheet: BalSheetForOfferMemo
A1: Balance Sheet as of 12/31/01 (unaudited)
D3: 2000-12-01T00:00:00.000 | E3: 2001-01-01T00:00:00.000 | F3: 2001-02-01T00:00:00.000 | G3: 2001-03-01T00:00:00.000 | H3: 2001-04-01T00:00:00.000 | I3: 2001-05-01T00:00:00.000 | J3: 2001-06-01T00:00:00.000 | K3: 2001-07-01T00:00:00.000 | L3: 2001-08-01T00:00:00.000 | M3: 2001-09-01T00:00:00.000 | N3: 2001-10-01T00:00:00.000 | O3: 2001-11-01T00:00:00.000 | P3: 2002-12-01T00:00:00.000 | Q3: 2003-01-01T00:00:00.000 | R3: 2003-02-01T00:00:00.000 | S3: 2003-03-01T00:00:00.000 | T3: 2003-04-01T00:00:00.000 | U3: 2003-05-01T00:00:00.000 | V3: 2003-06-01T00:00:00.000 | W3: 2003-07-01T00:00:00.000 | X3: 2003-08-01T00:00:00.000 | Y3: 2003-09-01T00:00:00.000 | Z3: 2003-10-01T00:00:00.000 | AA3: 2003-11-01T00:00:00.000 | AB3: 2003-12-01T00:00:00.000
A4: Assets
A5: Current Assets
A6: Cash and Cash Equivalents | D6: 3060000 | E6: =StmtOfCF!R[23]C -> 2901433.4834393966 | F6: =StmtOfCF!R[23]C -> 2711181.0444157142 | G6: =StmtOfCF!R[23]C -> 2473331.4681227957 | H6: =StmtOfCF!R[23]C -> 2217537.6595558114 | I6: =StmtOfCF!R[23]C -> 1976261.3539674096 | J6: =StmtOfCF!R[23]C -> 1765960.8951150368 | K6: =StmtOfCF!R[23]C -> 1509074.3726155329 | L6: =StmtOfCF!R[23]C -> 1265302.5838097804 | M6: =StmtOfCF!R[23]C -> 1051303.9030320134 | N6: =StmtOfCF!R[23]C -> 839516.84221896878 | O6: =StmtOfCF!R[23]C -> 666911.52000389155 | P6: =StmtOfCF!R[23]C -> 574103.74073327659 | Q6: =StmtOfCF!R[23]C -> 376401.80453354213 | R6: =StmtOfCF!R[23]C -> 220003.4015240318 | S6: =StmtOfCF!R[23]C -> 153485.54294302833 | T6: =StmtOfCF!R[23]C -> 4956502.4036934637 | U6: =StmtOfCF!R[23]C -> 4709092.6371943736 | V6: =StmtOfCF!R[23]C -> 4564883.5553326942 | W6: =StmtOfCF!R[23]C -> 4284679.6237686817 | X6: =StmtOfCF!R[23]C -> 4058886.5022209156 | Y6: =StmtOfCF!R[23]C -> 3951928.1360479817 | Z6: =StmtOfCF!R[23]C -> 3688730.117156948 | AA6: =StmtOfCF!R[23]C -> 3488259.412477727 | AB6: =StmtOfCF!R[23]C -> 3424604.0192937963
A7: Accounts Receivable | D7: 0 | E7: =0.2*MonthlyPAndL!R8C[-1] -> 3960 | F7: =0.2*MonthlyPAndL!R8C[-1] -> 5940 | G7: =0.2*MonthlyPAndL!R8C[-1] -> 9900 | H7: =0.2*MonthlyPAndL!R8C[-1] -> 6453 | I7: =0.2*MonthlyPAndL!R8C[-1] -> 9679.5 | J7: =0.2*MonthlyPAndL!R8C[-1] -> 16132.5 | K7: =0.2*MonthlyPAndL!R8C[-1] -> 6210.6 | L7: =0.2*MonthlyPAndL!R8C[-1] -> 9315.9 | M7: =0.2*MonthlyPAndL!R8C[-1] -> 15526.5 | N7: =0.2*MonthlyPAndL!R8C[-1] -> 16399.900000000001 | O7: =0.2*MonthlyPAndL!R8C[-1] -> 24599.850000000002 | P7: =0.2*MonthlyPAndL!R8C[-1] -> 40999.75 | Q7: =0.2*MonthlyPAndL!R8C[-1] -> 19364.18 | R7: =0.2*MonthlyPAndL!R8C[-1] -> 29046.270000000004 | S7: =0.2*MonthlyPAndL!R8C[-1] -> 48410.450000000004 | T7: =0.2*MonthlyPAndL!R8C[-1] -> 22268.807000000001 | U7: =0.2*MonthlyPAndL!R8C[-1] -> 33403.210499999994 | V7: =0.2*MonthlyPAndL!R8C[-1] -> 55672.017499999994 | W7: =0.2*MonthlyPAndL!R8C[-1] -> 25609.128049999996 | X7: =0.2*MonthlyPAndL!R8C[-1] -> 38413.692074999992 | Y7: =0.2*MonthlyPAndL!R8C[-1] -> 64022.820124999984 | Z7: =0.2*MonthlyPAndL!R8C[-1] -> 29450.497257499992 | AA7: =0.2*MonthlyPAndL!R8C[-1] -> 44175.745886249992 | AB7: =0.2*MonthlyPAndL!R8C[-1] -> 73626.243143749991
A8: Other Assets | D8: 0 | E8: 25000 | F8: =RC[-1] -> 25000 | G8: =RC[-1] -> 25000 | H8: =RC[-1] -> 25000 | I8: =RC[-1] -> 25000 | J8: =RC[-1] -> 25000 | K8: =RC[-1] -> 25000 | L8: =RC[-1] -> 25000 | M8: =RC[-1] -> 25000 | N8: =RC[-1] -> 25000 | O8: =RC[-1] -> 25000 | P8: =RC[-1] -> 25000 | Q8: =RC[-1] -> 25000 | R8: =RC[-1] -> 25000 | S8: =RC[-1] -> 25000 | T8: =RC[-1] -> 25000 | U8: =RC[-1] -> 25000 | V8: =RC[-1] -> 25000 | W8: =RC[-1] -> 25000 | X8: =RC[-1] -> 25000 | Y8: =RC[-1] -> 25000 | Z8: =RC[-1] -> 25000 | AA8: =RC[-1] -> 25000 | AB8: =RC[-1] -> 25000
A9: Total Current Assets | D9: =SUM(R[-3]C:R[-1]C) -> 3060000 | E9: =SUM(R[-3]C:R[-1]C) -> 2930393.4834393966 | F9: =SUM(R[-3]C:R[-1]C) -> 2742121.0444157142 | G9: =SUM(R[-3]C:R[-1]C) -> 2508231.4681227957 | H9: =SUM(R[-3]C:R[-1]C) -> 2248990.6595558114 | I9: =SUM(R[-3]C:R[-1]C) -> 2010940.8539674096 | J9: =SUM(R[-3]C:R[-1]C) -> 1807093.3951150368 | K9: =SUM(R[-3]C:R[-1]C) -> 1540284.972615533 | L9: =SUM(R[-3]C:R[-1]C) -> 1299618.4838097803 | M9: =SUM(R[-3]C:R[-1]C) -> 1091830.4030320134 | N9: =SUM(R[-3]C:R[-1]C) -> 880916.74221896881 | O9: =SUM(R[-3]C:R[-1]C) -> 716511.37000389153 | P9: =SUM(R[-3]C:R[-1]C) -> 640103.49073327659 | Q9: =SUM(R[-3]C:R[-1]C) -> 420765.98453354213 | R9: =SUM(R[-3]C:R[-1]C) -> 274049.67152403179 | S9: =SUM(R[-3]C:R[-1]C) -> 226895.99294302834 | T9: =SUM(R[-3]C:R[-1]C) -> 5003771.2106934637 | U9: =SUM(R[-3]C:R[-1]C) -> 4767495.8476943737 | V9: =SUM(R[-3]C:R[-1]C) -> 4645555.5728326943 | W9: =SUM(R[-3]C:R[-1]C) -> 4335288.7518186821 | X9: =SUM(R[-3]C:R[-1]C) -> 4122300.1942959158 | Y9: =SUM(R[-3]C:R[-1]C) -> 4040950.9561729818 | Z9: =SUM(R[-3]C:R[-1]C) -> 3743180.6144144479 | AA9: =SUM(R[-3]C:R[-1]C) -> 3557435.158363977 | AB9: =SUM(R[-3]C:R[-1]C) -> 3523230.2624375462
A11: Property and Equipment | D11: =CapLease!R[-8]C[1] -> 175000 | E11: =RC[-1] -> 175000 | F11: =RC[-1] -> 175000 | G11: =RC[-1] -> 175000 | H11: =RC[-1] -> 175000 | I11: =RC[-1] -> 175000 | J11: =RC[-1] -> 175000 | K11: =RC[-1] -> 175000 | L11: =RC[-1] -> 175000 | M11: =RC[-1] -> 175000 | N11: =RC[-1] -> 175000 | O11: =RC[-1] -> 175000 | P11: =RC[-1] -> 175000 | Q11: =RC[-1] -> 175000 | R11: =RC[-1] -> 175000 | S11: =RC[-1] -> 175000 | T11: =RC[-1] -> 175000 | U11: =RC[-1] -> 175000 | V11: =RC[-1] -> 175000 | W11: =RC[-1] -> 175000 | X11: =RC[-1] -> 175000 | Y11: =RC[-1] -> 175000 | Z11: =RC[-1] -> 175000 | AA11: =RC[-1] -> 175000 | AB11: =RC[-1] -> 175000
A12: Less: Accumulated Depreciation | D12: 0 | E12: =CapLease!R5C8*CapLease!R[-1]C9 -> 4861.1111111111113 | F12: =CapLease!R5C8*CapLease!RC9 -> 9722.2222222222226 | G12: =CapLease!R5C8*CapLease!R[1]C9 -> 14583.333333333334 | H12: =CapLease!R5C8*CapLease!R[2]C9 -> 19444.444444444445 | I12: =CapLease!R5C8*CapLease!R[3]C9 -> 24305.555555555555 | J12: =CapLease!R5C8*CapLease!R[4]C9 -> 29166.666666666668 | K12: =CapLease!R5C8*CapLease!R[5]C9 -> 34027.777777777781 | L12: =CapLease!R5C8*CapLease!R[6]C9 -> 38888.888888888891 | M12: =CapLease!R5C8*CapLease!R[7]C9 -> 43750 | N12: =CapLease!R5C8*CapLease!R[8]C9 -> 48611.111111111109 | O12: =CapLease!R5C8*CapLease!R[9]C9 -> 53472.222222222226 | P12: =CapLease!R5C8*CapLease!R[10]C9 -> 58333.333333333336 | Q12: =CapLease!R5C8*CapLease!R[11]C9 -> 63194.444444444445 | R12: =CapLease!R5C8*CapLease!R[12]C9 -> 68055.555555555562 | S12: =CapLease!R5C8*CapLease!R[13]C9 -> 72916.666666666672 | T12: =CapLease!R5C8*CapLease!R[14]C9 -> 77777.777777777781 | U12: =CapLease!R5C8*CapLease!R[15]C9 -> 82638.888888888891 | V12: =CapLease!R5C8*CapLease!R[16]C9 -> 87500 | W12: =CapLease!R5C8*CapLease!R[17]C9 -> 92361.111111111109 | X12: =CapLease!R5C8*CapLease!R[18]C9 -> 97222.222222222219 | Y12: =CapLease!R5C8*CapLease!R[19]C9 -> 102083.33333333334 | Z12: =CapLease!R5C8*CapLease!R[20]C9 -> 106944.44444444445 | AA12: =CapLease!R5C8*CapLease!R[21]C9 -> 111805.55555555556 | AB12: =CapLease!R5C8*CapLease!R[22]C9 -> 116666.66666666667
A13: Net Property and Equipment | D13: =SUM(R[-2]C:R[-1]C) -> 175000 | E13: =R[-2]C-R[-1]C -> 170138.88888888888 | F13: =R[-2]C-R[-1]C -> 165277.77777777778 | G13: =R[-2]C-R[-1]C -> 160416.66666666666 | H13: =R[-2]C-R[-1]C -> 155555.55555555556 | I13: =R[-2]C-R[-1]C -> 150694.44444444444 | J13: =R[-2]C-R[-1]C -> 145833.33333333334 | K13: =R[-2]C-R[-1]C -> 140972.22222222222 | L13: =R[-2]C-R[-1]C -> 136111.11111111112 | M13: =R[-2]C-R[-1]C -> 131250 | N13: =R[-2]C-R[-1]C -> 126388.88888888889 | O13: =R[-2]C-R[-1]C -> 121527.77777777778 | P13: =R[-2]C-R[-1]C -> 116666.66666666666 | Q13: =R[-2]C-R[-1]C -> 111805.55555555556 | R13: =R[-2]C-R[-1]C -> 106944.44444444444 | S13: =R[-2]C-R[-1]C -> 102083.33333333333 | T13: =R[-2]C-R[-1]C -> 97222.222222222219 | U13: =R[-2]C-R[-1]C -> 92361.111111111109 | V13: =R[-2]C-R[-1]C -> 87500 | W13: =R[-2]C-R[-1]C -> 82638.888888888891 | X13: =R[-2]C-R[-1]C -> 77777.777777777781 | Y13: =R[-2]C-R[-1]C -> 72916.666666666657 | Z13: =R[-2]C-R[-1]C -> 68055.555555555547 | AA13: =R[-2]C-R[-1]C -> 63194.444444444438 | AB13: =R[-2]C-R[-1]C -> 58333.333333333328
A14: Total Assets | D14: =SUM(R[-5]C,R[-1]C) -> 3235000 | E14: =SUM(R[-5]C,R[-1]C) -> 3100532.3723282856 | F14: =SUM(R[-5]C,R[-1]C) -> 2907398.8221934922 | G14: =SUM(R[-5]C,R[-1]C) -> 2668648.1347894622 | H14: =SUM(R[-5]C,R[-1]C) -> 2404546.2151113669 | I14: =SUM(R[-5]C,R[-1]C) -> 2161635.2984118541 | J14: =SUM(R[-5]C,R[-1]C) -> 1952926.72844837 | K14: =SUM(R[-5]C,R[-1]C) -> 1681257.1948377553 | L14: =SUM(R[-5]C,R[-1]C) -> 1435729.5949208913 | M14: =SUM(R[-5]C,R[-1]C) -> 1223080.4030320134 | N14: =SUM(R[-5]C,R[-1]C) -> 1007305.6311078577 | O14: =SUM(R[-5]C,R[-1]C) -> 838039.14778166928 | P14: =SUM(R[-5]C,R[-1]C) -> 756770.15739994321 | Q14: =SUM(R[-5]C,R[-1]C) -> 532571.54008909769 | R14: =SUM(R[-5]C,R[-1]C) -> 380994.11596847622 | S14: =SUM(R[-5]C,R[-1]C) -> 328979.32627636165 | T14: =SUM(R[-5]C,R[-1]C) -> 5100993.4329156857 | U14: =SUM(R[-5]C,R[-1]C) -> 4859856.9588054847 | V14: =SUM(R[-5]C,R[-1]C) -> 4733055.5728326943 | W14: =SUM(R[-5]C,R[-1]C) -> 4417927.6407075711 | X14: =SUM(R[-5]C,R[-1]C) -> 4200077.9720736938 | Y14: =SUM(R[-5]C,R[-1]C) -> 4113867.6228396483 | Z14: =SUM(R[-5]C,R[-1]C) -> 3811236.1699700034 | AA14: =SUM(R[-5]C,R[-1]C) -> 3620629.6028084215 | AB14: =SUM(R[-5]C,R[-1]C) -> 3581563.5957708796
A16: Liabilities & Shareholders' Equity
A17: Current Liabilities
A18: Accounts Payable | D18: 0 | E18: =0.15*MonthlyPAndL!R8C[-1] -> 2970 | F18: =0.15*MonthlyPAndL!R8C[-1] -> 4455 | G18: =0.15*MonthlyPAndL!R8C[-1] -> 7425 | H18: =0.15*MonthlyPAndL!R8C[-1] -> 4839.75 | I18: =0.15*MonthlyPAndL!R8C[-1] -> 7259.625 | J18: =0.15*MonthlyPAndL!R8C[-1] -> 12099.375 | K18: =0.15*MonthlyPAndL!R8C[-1] -> 4657.95 | L18: =0.15*MonthlyPAndL!R8C[-1] -> 6986.9250000000002 | M18: =0.15*MonthlyPAndL!R8C[-1] -> 11644.875 | N18: =0.15*MonthlyPAndL!R8C[-1] -> 12299.924999999999 | O18: =0.15*MonthlyPAndL!R8C[-1] -> 18449.887500000001 | P18: =0.15*MonthlyPAndL!R8C[-1] -> 30749.8125 | Q18: =0.15*MonthlyPAndL!R8C[-1] -> 14523.134999999998 | R18: =0.15*MonthlyPAndL!R8C[-1] -> 21784.702499999999 | S18: =0.15*MonthlyPAndL!R8C[-1] -> 36307.837500000001 | T18: =0.15*MonthlyPAndL!R8C[-1] -> 16701.605249999997 | U18: =0.15*MonthlyPAndL!R8C[-1] -> 25052.407874999994 | V18: =0.15*MonthlyPAndL!R8C[-1] -> 41754.01312499999 | W18: =0.15*MonthlyPAndL!R8C[-1] -> 19206.846037499996 | X18: =0.15*MonthlyPAndL!R8C[-1] -> 28810.269056249988 | Y18: =0.15*MonthlyPAndL!R8C[-1] -> 48017.115093749984 | Z18: =0.15*MonthlyPAndL!R8C[-1] -> 22087.872943124992 | AA18: =0.15*MonthlyPAndL!R8C[-1] -> 33131.809414687486 | AB18: =0.15*MonthlyPAndL!R8C[-1] -> 55219.682357812482
A19: Accrued Liabilities | D19: 0 | E19: =0.025*MonthlyPAndL!R[-11]C[-1] -> 495 | F19: =0.025*MonthlyPAndL!R[-11]C[-1] -> 742.5 | G19: =0.025*MonthlyPAndL!R[-11]C[-1] -> 1237.5 | H19: =0.025*MonthlyPAndL!R[-11]C[-1] -> 806.625 | I19: =0.025*MonthlyPAndL!R[-11]C[-1] -> 1209.9375 | J19: =0.025*MonthlyPAndL!R[-11]C[-1] -> 2016.5625 | K19: =0.025*MonthlyPAndL!R[-11]C[-1] -> 776.32500000000005 | L19: =0.025*MonthlyPAndL!R[-11]C[-1] -> 1164.4875 | M19: =0.025*MonthlyPAndL!R[-11]C[-1] -> 1940.8125 | N19: =0.025*MonthlyPAndL!R[-11]C[-1] -> 2049.9875000000002 | O19: =0.025*MonthlyPAndL!R[-11]C[-1] -> 3074.9812500000003 | P19: =0.025*MonthlyPAndL!R[-11]C[-1] -> 5124.96875 | Q19: =0.025*MonthlyPAndL!R[-11]C[-1] -> 2420.5225 | R19: =0.025*MonthlyPAndL!R[-11]C[-1] -> 3630.7837500000005 | S19: =0.025*MonthlyPAndL!R[-11]C[-1] -> 6051.3062500000005 | T19: =0.025*MonthlyPAndL!R[-11]C[-1] -> 2783.6008750000001 | U19: =0.025*MonthlyPAndL!R[-11]C[-1] -> 4175.4013124999992 | V19: =0.025*MonthlyPAndL!R[-11]C[-1] -> 6959.0021874999993 | W19: =0.025*MonthlyPAndL!R[-11]C[-1] -> 3201.1410062499995 | X19: =0.025*MonthlyPAndL!R[-11]C[-1] -> 4801.711509374999 | Y19: =0.025*MonthlyPAndL!R[-11]C[-1] -> 8002.852515624998 | Z19: =0.025*MonthlyPAndL!R[-11]C[-1] -> 3681.312157187499 | AA19: =0.025*MonthlyPAndL!R[-11]C[-1] -> 5521.9682357812489 | AB19: =0.025*MonthlyPAndL!R[-11]C[-1] -> 9203.2803929687489
A20: Deferred Revenue | D20: 0 | E20: =RC[-1] -> 0 | F20: =RC[-1] -> 0 | G20: =RC[-1] -> 0 | H20: =RC[-1] -> 0 | I20: =RC[-1] -> 0 | J20: =RC[-1] -> 0 | K20: =RC[-1] -> 0 | L20: =RC[-1] -> 0 | M20: =RC[-1] -> 0 | N20: =RC[-1] -> 0 | O20: =RC[-1] -> 0 | P20: =RC[-1] -> 0 | Q20: =RC[-1] -> 0 | R20: =RC[-1] -> 0 | S20: =RC[-1] -> 0 | T20: =RC[-1] -> 0 | U20: =RC[-1] -> 0 | V20: =RC[-1] -> 0 | W20: =RC[-1] -> 0 | X20: =RC[-1] -> 0 | Y20: =RC[-1] -> 0 | Z20: =RC[-1] -> 0 | AA20: =RC[-1] -> 0 | AB20: =RC[-1] -> 0
A21: Current Portion of Capital lease | D21: 0 | E21: =CapLease!R11C18 -> 4062.5042172489584 | F21: =CapLease!R12C18 -> 4103.1292594214483 | G21: =CapLease!R13C18 -> 4144.1605520156627 | H21: =CapLease!R14C18 -> 4185.6021575358191 | I21: =CapLease!R15C18 -> 4227.4581791111777 | J21: =CapLease!R16C18 -> 4269.7327609022896 | K21: =CapLease!R17C18 -> 4312.4300885113125 | L21: =CapLease!R18C18 -> 4355.5543893964259 | M21: =CapLease!R19C18 -> 4399.1099332903896 | N21: =CapLease!R20C18 -> 4443.1010326232936 | O21: =CapLease!R21C18 -> 4487.5320429495268 | P21: =CapLease!R22C18 -> 4532.4073633790222 | Q21: =CapLease!R23C18 -> 5738.4469276553718 | R21: =CapLease!R24C18 -> 5795.8313969319261 | S21: =CapLease!R25C18 -> 5853.7897109012447 | T21: =CapLease!R26C18 -> 5912.3276080102578 | U21: =CapLease!R27C18 -> 5971.45088409036 | V21: =CapLease!R28C18 -> 6031.1653929312633 | W21: =CapLease!R29C18 -> 6091.4770468605766 | X21: =CapLease!R30C18 -> 6152.3918173291822 | Y21: =CapLease!R31C18 -> 6213.9157355024727 | Z21: =CapLease!R32C18 -> 6276.054892857499 | AA21: =CapLease!R33C18 -> 6338.8154417860733 | AB21: =CapLease!R34C18 -> 6402.2035962039336
A22: Total Current Liabilities | D22: =SUM(R[-4]C:R[-1]C) -> 0 | E22: =SUM(R[-4]C:R[-1]C) -> 7527.5042172489584 | F22: =SUM(R[-4]C:R[-1]C) -> 9300.6292594214483 | G22: =SUM(R[-4]C:R[-1]C) -> 12806.660552015663 | H22: =SUM(R[-4]C:R[-1]C) -> 9831.9771575358191 | I22: =SUM(R[-4]C:R[-1]C) -> 12697.020679111178 | J22: =SUM(R[-4]C:R[-1]C) -> 18385.67026090229 | K22: =SUM(R[-4]C:R[-1]C) -> 9746.7050885113131 | L22: =SUM(R[-4]C:R[-1]C) -> 12506.966889396426 | M22: =SUM(R[-4]C:R[-1]C) -> 17984.79743329039 | N22: =SUM(R[-4]C:R[-1]C) -> 18793.013532623292 | O22: =SUM(R[-4]C:R[-1]C) -> 26012.400792949527 | P22: =SUM(R[-4]C:R[-1]C) -> 40407.188613379025 | Q22: =SUM(R[-4]C:R[-1]C) -> 22682.104427655369 | R22: =SUM(R[-4]C:R[-1]C) -> 31211.31764693193 | S22: =SUM(R[-4]C:R[-1]C) -> 48212.933460901244 | T22: =SUM(R[-4]C:R[-1]C) -> 25397.533733010256 | U22: =SUM(R[-4]C:R[-1]C) -> 35199.260071590354 | V22: =SUM(R[-4]C:R[-1]C) -> 54744.180705431252 | W22: =SUM(R[-4]C:R[-1]C) -> 28499.464090610571 | X22: =SUM(R[-4]C:R[-1]C) -> 39764.37238295417 | Y22: =SUM(R[-4]C:R[-1]C) -> 62233.883344877453 | Z22: =SUM(R[-4]C:R[-1]C) -> 32045.239993169991 | AA22: =SUM(R[-4]C:R[-1]C) -> 44992.593092254807 | AB22: =SUM(R[-4]C:R[-1]C) -> 70825.166346985163
A24: Long Term Liabilities
A25: Long Term Portion of Capital Lease | D25: =CapLease!R[-14]C[16] -> 170937.49578275104 | E25: =CapLease!R12C20 -> 166834.36652332958 | F25: =CapLease!R13C20 -> 162690.2059713139 | G25: =CapLease!R14C20 -> 158504.60381377809 | H25: =CapLease!R15C20 -> 154277.1456346669 | I25: =CapLease!R16C20 -> 150007.41287376461 | J25: =CapLease!R17C20 -> 145694.98278525329 | K25: =CapLease!R18C20 -> 141339.42839585687 | L25: =CapLease!R19C20 -> 136940.31846256647 | M25: =CapLease!R20C20 -> 132497.21742994318 | N25: =CapLease!R21C20 -> 128009.68538699365 | O25: =CapLease!R22C20 -> 123477.27802361462 | P25: =CapLease!R23C20 -> 167738.83109595923 | Q25: =CapLease!R24C20 -> 161942.99969902734 | R25: =CapLease!R25C20 -> 156089.20998812607 | S25: =CapLease!R26C20 -> 150176.88238011583 | T25: =CapLease!R27C20 -> 144205.43149602547 | U25: =CapLease!R28C20 -> 138174.26610309421 | V25: =CapLease!R29C20 -> 132082.78905623363 | W25: =CapLease!R30C20 -> 125930.39723890445 | X25: =CapLease!R31C20 -> 119716.48150340197 | Y25: =CapLease!R32C20 -> 113440.42661054447 | Z25: =CapLease!R33C20 -> 107101.61116875841 | AA25: =CapLease!R34C20 -> 100699.40757255448 | AB25: =CapLease!R35C20 -> 94233.181940388502
A26: Total Long Term Liabilities | D26: =R[-1]C -> 170937.49578275104 | E26: =R[-1]C -> 166834.36652332958 | F26: =R[-1]C -> 162690.2059713139 | G26: =R[-1]C -> 158504.60381377809 | H26: =R[-1]C -> 154277.1456346669 | I26: =R[-1]C -> 150007.41287376461 | J26: =R[-1]C -> 145694.98278525329 | K26: =R[-1]C -> 141339.42839585687 | L26: =R[-1]C -> 136940.31846256647 | M26: =R[-1]C -> 132497.21742994318 | N26: =R[-1]C -> 128009.68538699365 | O26: =R[-1]C -> 123477.27802361462 | P26: =R[-1]C -> 167738.83109595923 | Q26: =R[-1]C -> 161942.99969902734 | R26: =R[-1]C -> 156089.20998812607 | S26: =R[-1]C -> 150176.88238011583 | T26: =R[-1]C -> 144205.43149602547 | U26: =R[-1]C -> 138174.26610309421 | V26: =R[-1]C -> 132082.78905623363 | W26: =R[-1]C -> 125930.39723890445 | X26: =R[-1]C -> 119716.48150340197 | Y26: =R[-1]C -> 113440.42661054447 | Z26: =R[-1]C -> 107101.61116875841 | AA26: =R[-1]C -> 100699.40757255448 | AB26: =R[-1]C -> 94233.181940388502
A27: Total Liabilities | D27: =R[-1]C+R[-5]C -> 170937.49578275104 | E27: =R[-1]C+R[-5]C -> 174361.87074057854 | F27: =R[-1]C+R[-5]C -> 171990.83523073536 | G27: =R[-1]C+R[-5]C -> 171311.26436579376 | H27: =R[-1]C+R[-5]C -> 164109.12279220272 | I27: =R[-1]C+R[-5]C -> 162704.43355287579 | J27: =R[-1]C+R[-5]C -> 164080.65304615558 | K27: =R[-1]C+R[-5]C -> 151086.13348436818 | L27: =R[-1]C+R[-5]C -> 149447.2853519629 | M27: =R[-1]C+R[-5]C -> 150482.01486323358 | N27: =R[-1]C+R[-5]C -> 146802.69891961693 | O27: =R[-1]C+R[-5]C -> 149489.67881656415 | P27: =R[-1]C+R[-5]C -> 208146.01970933826 | Q27: =R[-1]C+R[-5]C -> 184625.10412668271 | R27: =R[-1]C+R[-5]C -> 187300.52763505798 | S27: =R[-1]C+R[-5]C -> 198389.81584101706 | T27: =R[-1]C+R[-5]C -> 169602.96522903573 | U27: =R[-1]C+R[-5]C -> 173373.52617468458 | V27: =R[-1]C+R[-5]C -> 186826.96976166486 | W27: =R[-1]C+R[-5]C -> 154429.86132951503 | X27: =R[-1]C+R[-5]C -> 159480.85388635614 | Y27: =R[-1]C+R[-5]C -> 175674.30995542192 | Z27: =R[-1]C+R[-5]C -> 139146.85116192838 | AA27: =R[-1]C+R[-5]C -> 145692.00066480928 | AB27: =R[-1]C+R[-5]C -> 165058.34828737366
A29: Shareholders' Equity
A30: Series A Preferred | D30: 3000000 | E30: =RC[-1] -> 3000000 | F30: =RC[-1] -> 3000000 | G30: =RC[-1] -> 3000000 | H30: =RC[-1] -> 3000000 | I30: =RC[-1] -> 3000000 | J30: =RC[-1] -> 3000000 | K30: =RC[-1] -> 3000000 | L30: =RC[-1] -> 3000000 | M30: =RC[-1] -> 3000000 | N30: =RC[-1] -> 3000000 | O30: =RC[-1] -> 3000000 | P30: =RC[-1] -> 3000000 | Q30: =RC[-1] -> 3000000 | R30: =RC[-1] -> 3000000 | S30: =RC[-1] -> 3000000 | T30: =RC[-1] -> 3000000 | U30: =RC[-1] -> 3000000 | V30: =RC[-1] -> 3000000 | W30: =RC[-1] -> 3000000 | X30: =RC[-1] -> 3000000 | Y30: =RC[-1] -> 3000000 | Z30: =RC[-1] -> 3000000 | AA30: =RC[-1] -> 3000000 | AB30: =RC[-1] -> 3000000
A31: Series B Preferred | Q31: 5000000 | R31: 5000000 | S31: 5000000 | T31: 5000000 | U31: 5000000 | V31: 5000000 | W31: 5000000 | X31: 5000000 | Y31: 5000000 | Z31: 5000000 | AA31: 5000000 | AB31: 5000000
A32: Common Stock | D32: 60000 | E32: 60000 | F32: 60000 | G32: 60000 | H32: 60000 | I32: 60000 | J32: 60000 | K32: 60000 | L32: 60000 | M32: 60000 | N32: 60000 | O32: 60000 | P32: 60000 | Q32: 60000 | R32: 60000 | S32: 60000 | T32: 60000 | U32: 60000 | V32: 60000 | W32: 60000 | X32: 60000 | Y32: 60000 | Z32: 60000 | AA32: 60000 | AB32: 60000
A33: Retained Earnings
A34: Accumulated Deficit | D34: 0 | E34: =(R[-20]C-(R[-7]C+R[-2]C+R[-4]C)) -> -133829.49841229292 | F34: =(R[-20]C-(R[-7]C+R[-2]C+R[-4]C)) -> -324592.01303724293 | G34: =(R[-20]C-(R[-7]C+R[-2]C+R[-4]C)) -> -562663.12957633147 | H34: =(R[-20]C-(R[-7]C+R[-2]C+R[-4]C)) -> -819562.90768083557 | I34: =(R[-20]C-(R[-7]C+R[-2]C+R[-4]C)) -> -1061069.1351410216 | J34: =(R[-20]C-(R[-7]C+R[-2]C+R[-4]C)) -> -1271153.9245977853 | K34: =(R[-20]C-(R[-7]C+R[-2]C+R[-4]C)) -> -1529828.9386466129 | L34: =(R[-20]C-(R[-7]C+R[-2]C+R[-4]C)) -> -1773717.6904310714 | M34: =(R[-20]C-(R[-7]C+R[-2]C+R[-4]C)) -> -1987401.6118312201 | N34: =(R[-20]C-(R[-7]C+R[-2]C+R[-4]C)) -> -2199497.0678117592 | O34: =(R[-20]C-(R[-7]C+R[-2]C+R[-4]C)) -> -2371450.5310348952 | P34: =(R[-20]C-(R[-7]C+R[-2]C+R[-4]C)) -> -2511375.8623093953 | Q34: =(R[-20]C-(R[-7]C+R[-2]C+R[-3]C+R[-4]C)) -> -7712053.5640375847 | R34: =(R[-20]C-(R[-7]C+R[-2]C+R[-3]C+R[-4]C)) -> -7866306.4116665823 | S34: =(R[-20]C-(R[-7]C+R[-2]C+R[-3]C+R[-4]C)) -> -7929410.4895646553 | T34: =(R[-20]C-(R[-7]C+R[-2]C+R[-3]C+R[-4]C)) -> -3128609.5323133497 | U34: =(R[-20]C-(R[-7]C+R[-2]C+R[-3]C+R[-4]C)) -> -3373516.5673692003 | V34: =(R[-20]C-(R[-7]C+R[-2]C+R[-3]C+R[-4]C)) -> -3513771.3969289707 | W34: =(R[-20]C-(R[-7]C+R[-2]C+R[-3]C+R[-4]C)) -> -3796502.2206219444 | X34: =(R[-20]C-(R[-7]C+R[-2]C+R[-3]C+R[-4]C)) -> -4019402.8818126628 | Y34: =(R[-20]C-(R[-7]C+R[-2]C+R[-3]C+R[-4]C)) -> -4121806.6871157736 | Z34: =(R[-20]C-(R[-7]C+R[-2]C+R[-3]C+R[-4]C)) -> -4387910.681191925 | AA34: =(R[-20]C-(R[-7]C+R[-2]C+R[-3]C+R[-4]C)) -> -4585062.3978563882 | AB34: =(R[-20]C-(R[-7]C+R[-2]C+R[-3]C+R[-4]C)) -> -4643494.7525164941
A35: Total Shareholders' Equity | D35: =SUM(R[-5]C:R[-1]C) -> 3060000 | E35: =SUM(R[-5]C:R[-1]C) -> 2926170.5015877071 | F35: =SUM(R[-5]C:R[-1]C) -> 2735407.9869627571 | G35: =SUM(R[-5]C:R[-1]C) -> 2497336.8704236685 | H35: =SUM(R[-5]C:R[-1]C) -> 2240437.0923191644 | I35: =SUM(R[-5]C:R[-1]C) -> 1998930.8648589784 | J35: =SUM(R[-5]C:R[-1]C) -> 1788846.0754022147 | K35: =SUM(R[-5]C:R[-1]C) -> 1530171.0613533871 | L35: =SUM(R[-5]C:R[-1]C) -> 1286282.3095689286 | M35: =SUM(R[-5]C:R[-1]C) -> 1072598.3881687799 | N35: =SUM(R[-5]C:R[-1]C) -> 860502.93218824081 | O35: =SUM(R[-5]C:R[-1]C) -> 688549.46896510478 | P35: =SUM(R[-5]C:R[-1]C) -> 548624.13769060466 | Q35: =SUM(R[-5]C:R[-1]C) -> 347946.4359624153 | R35: =SUM(R[-5]C:R[-1]C) -> 193693.58833341766 | S35: =SUM(R[-5]C:R[-1]C) -> 130589.51043534465 | T35: =SUM(R[-5]C:R[-1]C) -> 4931390.4676866503 | U35: =SUM(R[-5]C:R[-1]C) -> 4686483.4326307997 | V35: =SUM(R[-5]C:R[-1]C) -> 4546228.6030710293 | W35: =SUM(R[-5]C:R[-1]C) -> 4263497.7793780556 | X35: =SUM(R[-5]C:R[-1]C) -> 4040597.1181873372 | Y35: =SUM(R[-5]C:R[-1]C) -> 3938193.3128842264 | Z35: =SUM(R[-5]C:R[-1]C) -> 3672089.318808075 | AA35: =SUM(R[-5]C:R[-1]C) -> 3474937.6021436118 | AB35: =SUM(R[-5]C:R[-1]C) -> 3416505.2474835059
A36: Total Liab & Shareholders' Equity | D36: =SUM(R[-9]C+R[-1]C) -> 3230937.4957827511 | E36: =SUM(R[-9]C+R[-1]C) -> 3100532.3723282856 | F36: =SUM(R[-9]C+R[-1]C) -> 2907398.8221934922 | G36: =SUM(R[-9]C+R[-1]C) -> 2668648.1347894622 | H36: =SUM(R[-9]C+R[-1]C) -> 2404546.2151113669 | I36: =SUM(R[-9]C+R[-1]C) -> 2161635.2984118541 | J36: =SUM(R[-9]C+R[-1]C) -> 1952926.7284483702 | K36: =SUM(R[-9]C+R[-1]C) -> 1681257.1948377553 | L36: =SUM(R[-9]C+R[-1]C) -> 1435729.5949208913 | M36: =SUM(R[-9]C+R[-1]C) -> 1223080.4030320134 | N36: =SUM(R[-9]C+R[-1]C) -> 1007305.6311078577 | O36: =SUM(R[-9]C+R[-1]C) -> 838039.14778166893 | P36: =SUM(R[-9]C+R[-1]C) -> 756770.15739994287 | Q36: =SUM(R[-9]C+R[-1]C) -> 532571.54008909804 | R36: =SUM(R[-9]C+R[-1]C) -> 380994.11596847564 | S36: =SUM(R[-9]C+R[-1]C) -> 328979.32627636171 | T36: =SUM(R[-9]C+R[-1]C) -> 5100993.4329156857 | U36: =SUM(R[-9]C+R[-1]C) -> 4859856.9588054847 | V36: =SUM(R[-9]C+R[-1]C) -> 4733055.5728326943 | W36: =SUM(R[-9]C+R[-1]C) -> 4417927.6407075711 | X36: =SUM(R[-9]C+R[-1]C) -> 4200077.9720736938 | Y36: =SUM(R[-9]C+R[-1]C) -> 4113867.6228396483 | Z36: =SUM(R[-9]C+R[-1]C) -> 3811236.1699700034 | AA36: =SUM(R[-9]C+R[-1]C) -> 3620629.602808421 | AB36: =SUM(R[-9]C+R[-1]C) -> 3581563.5957708796