Sheet: Payroll
A1: Payroll | C1: Start Date | D1: 2001-01-01T00:00:00.000
A3: Individuals Needed | B3: Hire Month | C3: Hire Date | D3: Salary | E3: =R[-2]C[-1] -> 2001-01-01T00:00:00.000 | F3: =RC[-1]+31 -> 2001-02-01T00:00:00.000 | G3: =RC[-1]+31 -> 2001-03-04T00:00:00.000 | H3: =RC[-1]+31 -> 2001-04-04T00:00:00.000 | I3: =RC[-1]+31 -> 2001-05-05T00:00:00.000 | J3: =RC[-1]+31 -> 2001-06-05T00:00:00.000 | K3: =RC[-1]+31 -> 2001-07-06T00:00:00.000 | L3: =RC[-1]+31 -> 2001-08-06T00:00:00.000 | M3: =RC[-1]+31 -> 2001-09-06T00:00:00.000 | N3: =RC[-1]+31 -> 2001-10-07T00:00:00.000 | O3: =RC[-1]+31 -> 2001-11-07T00:00:00.000 | P3: =RC[-1]+31 -> 2001-12-08T00:00:00.000 | Q3: =RC[-1]+31 -> 2002-01-08T00:00:00.000 | R3: =RC[-1]+31 -> 2002-02-08T00:00:00.000 | S3: =RC[-1]+31 -> 2002-03-11T00:00:00.000 | T3: =RC[-1]+31 -> 2002-04-11T00:00:00.000 | U3: =RC[-1]+31 -> 2002-05-12T00:00:00.000 | V3: =RC[-1]+31 -> 2002-06-12T00:00:00.000 | W3: =RC[-1]+31 -> 2002-07-13T00:00:00.000 | X3: =RC[-1]+31 -> 2002-08-13T00:00:00.000 | Y3: =RC[-1]+31 -> 2002-09-13T00:00:00.000 | Z3: =RC[-1]+31 -> 2002-10-14T00:00:00.000 | AA3: =RC[-1]+31 -> 2002-11-14T00:00:00.000 | AB3: =RC[-1]+31 -> 2002-12-15T00:00:00.000 | AC3: =RC[-1]+31 -> 2003-01-15T00:00:00.000 | AD3: =RC[-1]+31 -> 2003-02-15T00:00:00.000 | AE3: =RC[-1]+31 -> 2003-03-18T00:00:00.000 | AF3: =RC[-1]+31 -> 2003-04-18T00:00:00.000 | AG3: =RC[-1]+31 -> 2003-05-19T00:00:00.000 | AH3: =RC[-1]+31 -> 2003-06-19T00:00:00.000 | AI3: =RC[-1]+31 -> 2003-07-20T00:00:00.000 | AJ3: =RC[-1]+31 -> 2003-08-20T00:00:00.000 | AK3: =RC[-1]+31 -> 2003-09-20T00:00:00.000 | AL3: =RC[-1]+31 -> 2003-10-21T00:00:00.000 | AM3: =RC[-1]+31 -> 2003-11-21T00:00:00.000 | AN3: =RC[-1]+31 -> 2003-12-22T00:00:00.000
A5: Technology
A6: CTO | B6: 0 | C6: =R1C4+RC[-1]*31 -> 2001-01-01T00:00:00.000 | D6: 140000 | E6: =IF(R3C>=RC3,RC4/12,0) -> 11666.666666666666 | F6: =IF(R3C>=RC3,RC4/12,0) -> 11666.666666666666 | G6: =IF(R3C>=RC3,RC4/12,0) -> 11666.666666666666 | H6: =IF(R3C>=RC3,RC4/12,0) -> 11666.666666666666 | I6: =IF(R3C>=RC3,RC4/12,0) -> 11666.666666666666 | J6: =IF(R3C>=RC3,RC4/12,0) -> 11666.666666666666 | K6: =IF(R3C>=RC3,RC4/12,0) -> 11666.666666666666 | L6: =IF(R3C>=RC3,RC4/12,0) -> 11666.666666666666 | M6: =IF(R3C>=RC3,RC4/12,0) -> 11666.666666666666 | N6: =IF(R3C>=RC3,RC4/12,0) -> 11666.666666666666 | O6: =IF(R3C>=RC3,RC4/12,0) -> 11666.666666666666 | P6: =IF(R3C>=RC3,RC4/12,0) -> 11666.666666666666 | Q6: =IF(R3C>=RC3,RC4/12,0) -> 11666.666666666666 | R6: =IF(R3C>=RC3,RC4/12,0) -> 11666.666666666666 | S6: =IF(R3C>=RC3,RC4/12,0) -> 11666.666666666666 | T6: =IF(R3C>=RC3,RC4/12,0) -> 11666.666666666666 | U6: =IF(R3C>=RC3,RC4/12,0) -> 11666.666666666666 | V6: =IF(R3C>=RC3,RC4/12,0) -> 11666.666666666666 | W6: =IF(R3C>=RC3,RC4/12,0) -> 11666.666666666666 | X6: =IF(R3C>=RC3,RC4/12,0) -> 11666.666666666666 | Y6: =IF(R3C>=RC3,RC4/12,0) -> 11666.666666666666 | Z6: =IF(R3C>=RC3,RC4/12,0) -> 11666.666666666666 | AA6: =IF(R3C>=RC3,RC4/12,0) -> 11666.666666666666 | AB6: =IF(R3C>=RC3,RC4/12,0) -> 11666.666666666666 | AC6: =IF(R3C>=RC3,RC4/12,0) -> 11666.666666666666 | AD6: =IF(R3C>=RC3,RC4/12,0) -> 11666.666666666666 | AE6: =IF(R3C>=RC3,RC4/12,0) -> 11666.666666666666 | AF6: =IF(R3C>=RC3,RC4/12,0) -> 11666.666666666666 | AG6: =IF(R3C>=RC3,RC4/12,0) -> 11666.666666666666 | AH6: =IF(R3C>=RC3,RC4/12,0) -> 11666.666666666666 | AI6: =IF(R3C>=RC3,RC4/12,0) -> 11666.666666666666 | AJ6: =IF(R3C>=RC3,RC4/12,0) -> 11666.666666666666 | AK6: =IF(R3C>=RC3,RC4/12,0) -> 11666.666666666666 | AL6: =IF(R3C>=RC3,RC4/12,0) -> 11666.666666666666 | AM6: =IF(R3C>=RC3,RC4/12,0) -> 11666.666666666666 | AN6: =IF(R3C>=RC3,RC4/12,0) -> 11666.666666666666
A7: VP / Dir. of Engineering | B7: 2 | C7: =R1C4+RC[-1]*31 -> 2001-03-04T00:00:00.000 | D7: 90000 | E7: =IF(R3C>=RC3,RC4/12,0) -> 0 | F7: =IF(R3C>=RC3,RC4/12,0) -> 0 | G7: =IF(R3C>=RC3,RC4/12,0) -> 7500 | H7: =IF(R3C>=RC3,RC4/12,0) -> 7500 | I7: =IF(R3C>=RC3,RC4/12,0) -> 7500 | J7: =IF(R3C>=RC3,RC4/12,0) -> 7500 | K7: =IF(R3C>=RC3,RC4/12,0) -> 7500 | L7: =IF(R3C>=RC3,RC4/12,0) -> 7500 | M7: =IF(R3C>=RC3,RC4/12,0) -> 7500 | N7: =IF(R3C>=RC3,RC4/12,0) -> 7500 | O7: =IF(R3C>=RC3,RC4/12,0) -> 7500 | P7: =IF(R3C>=RC3,RC4/12,0) -> 7500 | Q7: =IF(R3C>=RC3,RC4/12,0) -> 7500 | R7: =IF(R3C>=RC3,RC4/12,0) -> 7500 | S7: =IF(R3C>=RC3,RC4/12,0) -> 7500 | T7: =IF(R3C>=RC3,RC4/12,0) -> 7500 | U7: =IF(R3C>=RC3,RC4/12,0) -> 7500 | V7: =IF(R3C>=RC3,RC4/12,0) -> 7500 | W7: =IF(R3C>=RC3,RC4/12,0) -> 7500 | X7: =IF(R3C>=RC3,RC4/12,0) -> 7500 | Y7: =IF(R3C>=RC3,RC4/12,0) -> 7500 | Z7: =IF(R3C>=RC3,RC4/12,0) -> 7500 | AA7: =IF(R3C>=RC3,RC4/12,0) -> 7500 | AB7: =IF(R3C>=RC3,RC4/12,0) -> 7500 | AC7: =IF(R3C>=RC3,RC4/12,0) -> 7500 | AD7: =IF(R3C>=RC3,RC4/12,0) -> 7500 | AE7: =IF(R3C>=RC3,RC4/12,0) -> 7500 | AF7: =IF(R3C>=RC3,RC4/12,0) -> 7500 | AG7: =IF(R3C>=RC3,RC4/12,0) -> 7500 | AH7: =IF(R3C>=RC3,RC4/12,0) -> 7500 | AI7: =IF(R3C>=RC3,RC4/12,0) -> 7500 | AJ7: =IF(R3C>=RC3,RC4/12,0) -> 7500 | AK7: =IF(R3C>=RC3,RC4/12,0) -> 7500 | AL7: =IF(R3C>=RC3,RC4/12,0) -> 7500 | AM7: =IF(R3C>=RC3,RC4/12,0) -> 7500 | AN7: =IF(R3C>=RC3,RC4/12,0) -> 7500
A8: Domain Expert | B8: 0 | C8: =R1C4+RC[-1]*31 -> 2001-01-01T00:00:00.000 | D8: 100000 | E8: =IF(R3C>=RC3,RC4/12,0) -> 8333.3333333333339 | F8: =IF(R3C>=RC3,RC4/12,0) -> 8333.3333333333339 | G8: =IF(R3C>=RC3,RC4/12,0) -> 8333.3333333333339 | H8: =IF(R3C>=RC3,RC4/12,0) -> 8333.3333333333339 | I8: =IF(R3C>=RC3,RC4/12,0) -> 8333.3333333333339 | J8: =IF(R3C>=RC3,RC4/12,0) -> 8333.3333333333339 | K8: =IF(R3C>=RC3,RC4/12,0) -> 8333.3333333333339 | L8: =IF(R3C>=RC3,RC4/12,0) -> 8333.3333333333339 | M8: =IF(R3C>=RC3,RC4/12,0) -> 8333.3333333333339 | N8: =IF(R3C>=RC3,RC4/12,0) -> 8333.3333333333339 | O8: =IF(R3C>=RC3,RC4/12,0) -> 8333.3333333333339 | P8: =IF(R3C>=RC3,RC4/12,0) -> 8333.3333333333339 | Q8: =IF(R3C>=RC3,RC4/12,0) -> 8333.3333333333339 | R8: =IF(R3C>=RC3,RC4/12,0) -> 8333.3333333333339 | S8: =IF(R3C>=RC3,RC4/12,0) -> 8333.3333333333339 | T8: =IF(R3C>=RC3,RC4/12,0) -> 8333.3333333333339 | U8: =IF(R3C>=RC3,RC4/12,0) -> 8333.3333333333339 | V8: =IF(R3C>=RC3,RC4/12,0) -> 8333.3333333333339 | W8: =IF(R3C>=RC3,RC4/12,0) -> 8333.3333333333339 | X8: =IF(R3C>=RC3,RC4/12,0) -> 8333.3333333333339 | Y8: =IF(R3C>=RC3,RC4/12,0) -> 8333.3333333333339 | Z8: =IF(R3C>=RC3,RC4/12,0) -> 8333.3333333333339 | AA8: =IF(R3C>=RC3,RC4/12,0) -> 8333.3333333333339 | AB8: =IF(R3C>=RC3,RC4/12,0) -> 8333.3333333333339 | AC8: =IF(R3C>=RC3,RC4/12,0) -> 8333.3333333333339 | AD8: =IF(R3C>=RC3,RC4/12,0) -> 8333.3333333333339 | AE8: =IF(R3C>=RC3,RC4/12,0) -> 8333.3333333333339 | AF8: =IF(R3C>=RC3,RC4/12,0) -> 8333.3333333333339 | AG8: =IF(R3C>=RC3,RC4/12,0) -> 8333.3333333333339 | AH8: =IF(R3C>=RC3,RC4/12,0) -> 8333.3333333333339 | AI8: =IF(R3C>=RC3,RC4/12,0) -> 8333.3333333333339 | AJ8: =IF(R3C>=RC3,RC4/12,0) -> 8333.3333333333339 | AK8: =IF(R3C>=RC3,RC4/12,0) -> 8333.3333333333339 | AL8: =IF(R3C>=RC3,RC4/12,0) -> 8333.3333333333339 | AM8: =IF(R3C>=RC3,RC4/12,0) -> 8333.3333333333339 | AN8: =IF(R3C>=RC3,RC4/12,0) -> 8333.3333333333339
A9: Product Manager | B9: 0 | C9: =R1C4+RC[-1]*31 -> 2001-01-01T00:00:00.000 | D9: 75000 | E9: =IF(R3C>=RC3,RC4/12,0) -> 6250 | F9: =IF(R3C>=RC3,RC4/12,0) -> 6250 | G9: =IF(R3C>=RC3,RC4/12,0) -> 6250 | H9: =IF(R3C>=RC3,RC4/12,0) -> 6250 | I9: =IF(R3C>=RC3,RC4/12,0) -> 6250 | J9: =IF(R3C>=RC3,RC4/12,0) -> 6250 | K9: =IF(R3C>=RC3,RC4/12,0) -> 6250 | L9: =IF(R3C>=RC3,RC4/12,0) -> 6250 | M9: =IF(R3C>=RC3,RC4/12,0) -> 6250 | N9: =IF(R3C>=RC3,RC4/12,0) -> 6250 | O9: =IF(R3C>=RC3,RC4/12,0) -> 6250 | P9: =IF(R3C>=RC3,RC4/12,0) -> 6250 | Q9: =IF(R3C>=RC3,RC4/12,0) -> 6250 | R9: =IF(R3C>=RC3,RC4/12,0) -> 6250 | S9: =IF(R3C>=RC3,RC4/12,0) -> 6250 | T9: =IF(R3C>=RC3,RC4/12,0) -> 6250 | U9: =IF(R3C>=RC3,RC4/12,0) -> 6250 | V9: =IF(R3C>=RC3,RC4/12,0) -> 6250 | W9: =IF(R3C>=RC3,RC4/12,0) -> 6250 | X9: =IF(R3C>=RC3,RC4/12,0) -> 6250 | Y9: =IF(R3C>=RC3,RC4/12,0) -> 6250 | Z9: =IF(R3C>=RC3,RC4/12,0) -> 6250 | AA9: =IF(R3C>=RC3,RC4/12,0) -> 6250 | AB9: =IF(R3C>=RC3,RC4/12,0) -> 6250 | AC9: =IF(R3C>=RC3,RC4/12,0) -> 6250 | AD9: =IF(R3C>=RC3,RC4/12,0) -> 6250 | AE9: =IF(R3C>=RC3,RC4/12,0) -> 6250 | AF9: =IF(R3C>=RC3,RC4/12,0) -> 6250 | AG9: =IF(R3C>=RC3,RC4/12,0) -> 6250 | AH9: =IF(R3C>=RC3,RC4/12,0) -> 6250 | AI9: =IF(R3C>=RC3,RC4/12,0) -> 6250 | AJ9: =IF(R3C>=RC3,RC4/12,0) -> 6250 | AK9: =IF(R3C>=RC3,RC4/12,0) -> 6250 | AL9: =IF(R3C>=RC3,RC4/12,0) -> 6250 | AM9: =IF(R3C>=RC3,RC4/12,0) -> 6250 | AN9: =IF(R3C>=RC3,RC4/12,0) -> 6250
A10: Program Manager | B10: 6 | C10: =R1C4+RC[-1]*31 -> 2001-07-06T00:00:00.000 | D10: 75000 | E10: =IF(R3C>=RC3,RC4/12,0) -> 0 | F10: =IF(R3C>=RC3,RC4/12,0) -> 0 | G10: =IF(R3C>=RC3,RC4/12,0) -> 0 | H10: =IF(R3C>=RC3,RC4/12,0) -> 0 | I10: =IF(R3C>=RC3,RC4/12,0) -> 0 | J10: =IF(R3C>=RC3,RC4/12,0) -> 0 | K10: =IF(R3C>=RC3,RC4/12,0) -> 6250 | L10: =IF(R3C>=RC3,RC4/12,0) -> 6250 | M10: =IF(R3C>=RC3,RC4/12,0) -> 6250 | N10: =IF(R3C>=RC3,RC4/12,0) -> 6250 | O10: =IF(R3C>=RC3,RC4/12,0) -> 6250 | P10: =IF(R3C>=RC3,RC4/12,0) -> 6250 | Q10: =IF(R3C>=RC3,RC4/12,0) -> 6250 | R10: =IF(R3C>=RC3,RC4/12,0) -> 6250 | S10: =IF(R3C>=RC3,RC4/12,0) -> 6250 | T10: =IF(R3C>=RC3,RC4/12,0) -> 6250 | U10: =IF(R3C>=RC3,RC4/12,0) -> 6250 | V10: =IF(R3C>=RC3,RC4/12,0) -> 6250 | W10: =IF(R3C>=RC3,RC4/12,0) -> 6250 | X10: =IF(R3C>=RC3,RC4/12,0) -> 6250 | Y10: =IF(R3C>=RC3,RC4/12,0) -> 6250 | Z10: =IF(R3C>=RC3,RC4/12,0) -> 6250 | AA10: =IF(R3C>=RC3,RC4/12,0) -> 6250 | AB10: =IF(R3C>=RC3,RC4/12,0) -> 6250 | AC10: =IF(R3C>=RC3,RC4/12,0) -> 6250 | AD10: =IF(R3C>=RC3,RC4/12,0) -> 6250 | AE10: =IF(R3C>=RC3,RC4/12,0) -> 6250 | AF10: =IF(R3C>=RC3,RC4/12,0) -> 6250 | AG10: =IF(R3C>=RC3,RC4/12,0) -> 6250 | AH10: =IF(R3C>=RC3,RC4/12,0) -> 6250 | AI10: =IF(R3C>=RC3,RC4/12,0) -> 6250 | AJ10: =IF(R3C>=RC3,RC4/12,0) -> 6250 | AK10: =IF(R3C>=RC3,RC4/12,0) -> 6250 | AL10: =IF(R3C>=RC3,RC4/12,0) -> 6250 | AM10: =IF(R3C>=RC3,RC4/12,0) -> 6250 | AN10: =IF(R3C>=RC3,RC4/12,0) -> 6250
A11: Operations Manager | B11: 4 | C11: =R1C4+RC[-1]*31 -> 2001-05-05T00:00:00.000 | D11: 85000 | E11: =IF(R3C>=RC3,RC4/12,0) -> 0 | F11: =IF(R3C>=RC3,RC4/12,0) -> 0 | G11: =IF(R3C>=RC3,RC4/12,0) -> 0 | H11: =IF(R3C>=RC3,RC4/12,0) -> 0 | I11: =IF(R3C>=RC3,RC4/12,0) -> 7083.333333333333 | J11: =IF(R3C>=RC3,RC4/12,0) -> 7083.333333333333 | K11: =IF(R3C>=RC3,RC4/12,0) -> 7083.333333333333 | L11: =IF(R3C>=RC3,RC4/12,0) -> 7083.333333333333 | M11: =IF(R3C>=RC3,RC4/12,0) -> 7083.333333333333 | N11: =IF(R3C>=RC3,RC4/12,0) -> 7083.333333333333 | O11: =IF(R3C>=RC3,RC4/12,0) -> 7083.333333333333 | P11: =IF(R3C>=RC3,RC4/12,0) -> 7083.333333333333 | Q11: =IF(R3C>=RC3,RC4/12,0) -> 7083.333333333333 | R11: =IF(R3C>=RC3,RC4/12,0) -> 7083.333333333333 | S11: =IF(R3C>=RC3,RC4/12,0) -> 7083.333333333333 | T11: =IF(R3C>=RC3,RC4/12,0) -> 7083.333333333333 | U11: =IF(R3C>=RC3,RC4/12,0) -> 7083.333333333333 | V11: =IF(R3C>=RC3,RC4/12,0) -> 7083.333333333333 | W11: =IF(R3C>=RC3,RC4/12,0) -> 7083.333333333333 | X11: =IF(R3C>=RC3,RC4/12,0) -> 7083.333333333333 | Y11: =IF(R3C>=RC3,RC4/12,0) -> 7083.333333333333 | Z11: =IF(R3C>=RC3,RC4/12,0) -> 7083.333333333333 | AA11: =IF(R3C>=RC3,RC4/12,0) -> 7083.333333333333 | AB11: =IF(R3C>=RC3,RC4/12,0) -> 7083.333333333333 | AC11: =IF(R3C>=RC3,RC4/12,0) -> 7083.333333333333 | AD11: =IF(R3C>=RC3,RC4/12,0) -> 7083.333333333333 | AE11: =IF(R3C>=RC3,RC4/12,0) -> 7083.333333333333 | AF11: =IF(R3C>=RC3,RC4/12,0) -> 7083.333333333333 | AG11: =IF(R3C>=RC3,RC4/12,0) -> 7083.333333333333 | AH11: =IF(R3C>=RC3,RC4/12,0) -> 7083.333333333333 | AI11: =IF(R3C>=RC3,RC4/12,0) -> 7083.333333333333 | AJ11: =IF(R3C>=RC3,RC4/12,0) -> 7083.333333333333 | AK11: =IF(R3C>=RC3,RC4/12,0) -> 7083.333333333333 | AL11: =IF(R3C>=RC3,RC4/12,0) -> 7083.333333333333 | AM11: =IF(R3C>=RC3,RC4/12,0) -> 7083.333333333333 | AN11: =IF(R3C>=RC3,RC4/12,0) -> 7083.333333333333
A12: IT administrator | B12: 0 | C12: =R1C4+RC[-1]*31 -> 2001-01-01T00:00:00.000 | D12: 70000 | E12: =IF(R3C>=RC3,RC4/12,0) -> 5833.333333333333 | F12: =IF(R3C>=RC3,RC4/12,0) -> 5833.333333333333 | G12: =IF(R3C>=RC3,RC4/12,0) -> 5833.333333333333 | H12: =IF(R3C>=RC3,RC4/12,0) -> 5833.333333333333 | I12: =IF(R3C>=RC3,RC4/12,0) -> 5833.333333333333 | J12: =IF(R3C>=RC3,RC4/12,0) -> 5833.333333333333 | K12: =IF(R3C>=RC3,RC4/12,0) -> 5833.333333333333 | L12: =IF(R3C>=RC3,RC4/12,0) -> 5833.333333333333 | M12: =IF(R3C>=RC3,RC4/12,0) -> 5833.333333333333 | N12: =IF(R3C>=RC3,RC4/12,0) -> 5833.333333333333 | O12: =IF(R3C>=RC3,RC4/12,0) -> 5833.333333333333 | P12: =IF(R3C>=RC3,RC4/12,0) -> 5833.333333333333 | Q12: =IF(R3C>=RC3,RC4/12,0) -> 5833.333333333333 | R12: =IF(R3C>=RC3,RC4/12,0) -> 5833.333333333333 | S12: =IF(R3C>=RC3,RC4/12,0) -> 5833.333333333333 | T12: =IF(R3C>=RC3,RC4/12,0) -> 5833.333333333333 | U12: =IF(R3C>=RC3,RC4/12,0) -> 5833.333333333333 | V12: =IF(R3C>=RC3,RC4/12,0) -> 5833.333333333333 | W12: =IF(R3C>=RC3,RC4/12,0) -> 5833.333333333333 | X12: =IF(R3C>=RC3,RC4/12,0) -> 5833.333333333333 | Y12: =IF(R3C>=RC3,RC4/12,0) -> 5833.333333333333 | Z12: =IF(R3C>=RC3,RC4/12,0) -> 5833.333333333333 | AA12: =IF(R3C>=RC3,RC4/12,0) -> 5833.333333333333 | AB12: =IF(R3C>=RC3,RC4/12,0) -> 5833.333333333333 | AC12: =IF(R3C>=RC3,RC4/12,0) -> 5833.333333333333 | AD12: =IF(R3C>=RC3,RC4/12,0) -> 5833.333333333333 | AE12: =IF(R3C>=RC3,RC4/12,0) -> 5833.333333333333 | AF12: =IF(R3C>=RC3,RC4/12,0) -> 5833.333333333333 | AG12: =IF(R3C>=RC3,RC4/12,0) -> 5833.333333333333 | AH12: =IF(R3C>=RC3,RC4/12,0) -> 5833.333333333333 | AI12: =IF(R3C>=RC3,RC4/12,0) -> 5833.333333333333 | AJ12: =IF(R3C>=RC3,RC4/12,0) -> 5833.333333333333 | AK12: =IF(R3C>=RC3,RC4/12,0) -> 5833.333333333333 | AL12: =IF(R3C>=RC3,RC4/12,0) -> 5833.333333333333 | AM12: =IF(R3C>=RC3,RC4/12,0) -> 5833.333333333333 | AN12: =IF(R3C>=RC3,RC4/12,0) -> 5833.333333333333
A13: IT administrator | B13: 2 | C13: =R1C4+RC[-1]*31 -> 2001-03-04T00:00:00.000 | D13: 55000 | E13: =IF(R3C>=RC3,RC4/12,0) -> 0 | F13: =IF(R3C>=RC3,RC4/12,0) -> 0 | G13: =IF(R3C>=RC3,RC4/12,0) -> 4583.333333333333 | H13: =IF(R3C>=RC3,RC4/12,0) -> 4583.333333333333 | I13: =IF(R3C>=RC3,RC4/12,0) -> 4583.333333333333 | J13: =IF(R3C>=RC3,RC4/12,0) -> 4583.333333333333 | K13: =IF(R3C>=RC3,RC4/12,0) -> 4583.333333333333 | L13: =IF(R3C>=RC3,RC4/12,0) -> 4583.333333333333 | M13: =IF(R3C>=RC3,RC4/12,0) -> 4583.333333333333 | N13: =IF(R3C>=RC3,RC4/12,0) -> 4583.333333333333 | O13: =IF(R3C>=RC3,RC4/12,0) -> 4583.333333333333 | P13: =IF(R3C>=RC3,RC4/12,0) -> 4583.333333333333 | Q13: =IF(R3C>=RC3,RC4/12,0) -> 4583.333333333333 | R13: =IF(R3C>=RC3,RC4/12,0) -> 4583.333333333333 | S13: =IF(R3C>=RC3,RC4/12,0) -> 4583.333333333333 | T13: =IF(R3C>=RC3,RC4/12,0) -> 4583.333333333333 | U13: =IF(R3C>=RC3,RC4/12,0) -> 4583.333333333333 | V13: =IF(R3C>=RC3,RC4/12,0) -> 4583.333333333333 | W13: =IF(R3C>=RC3,RC4/12,0) -> 4583.333333333333 | X13: =IF(R3C>=RC3,RC4/12,0) -> 4583.333333333333 | Y13: =IF(R3C>=RC3,RC4/12,0) -> 4583.333333333333 | Z13: =IF(R3C>=RC3,RC4/12,0) -> 4583.333333333333 | AA13: =IF(R3C>=RC3,RC4/12,0) -> 4583.333333333333 | AB13: =IF(R3C>=RC3,RC4/12,0) -> 4583.333333333333 | AC13: =IF(R3C>=RC3,RC4/12,0) -> 4583.333333333333 | AD13: =IF(R3C>=RC3,RC4/12,0) -> 4583.333333333333 | AE13: =IF(R3C>=RC3,RC4/12,0) -> 4583.333333333333 | AF13: =IF(R3C>=RC3,RC4/12,0) -> 4583.333333333333 | AG13: =IF(R3C>=RC3,RC4/12,0) -> 4583.333333333333 | AH13: =IF(R3C>=RC3,RC4/12,0) -> 4583.333333333333 | AI13: =IF(R3C>=RC3,RC4/12,0) -> 4583.333333333333 | AJ13: =IF(R3C>=RC3,RC4/12,0) -> 4583.333333333333 | AK13: =IF(R3C>=RC3,RC4/12,0) -> 4583.333333333333 | AL13: =IF(R3C>=RC3,RC4/12,0) -> 4583.333333333333 | AM13: =IF(R3C>=RC3,RC4/12,0) -> 4583.333333333333 | AN13: =IF(R3C>=RC3,RC4/12,0) -> 4583.333333333333
A14: IT administrator | B14: 4 | C14: =R1C4+RC[-1]*31 -> 2001-05-05T00:00:00.000 | D14: 50000 | E14: =IF(R3C>=RC3,RC4/12,0) -> 0 | F14: =IF(R3C>=RC3,RC4/12,0) -> 0 | G14: =IF(R3C>=RC3,RC4/12,0) -> 0 | H14: =IF(R3C>=RC3,RC4/12,0) -> 0 | I14: =IF(R3C>=RC3,RC4/12,0) -> 4166.666666666667 | J14: =IF(R3C>=RC3,RC4/12,0) -> 4166.666666666667 | K14: =IF(R3C>=RC3,RC4/12,0) -> 4166.666666666667 | L14: =IF(R3C>=RC3,RC4/12,0) -> 4166.666666666667 | M14: =IF(R3C>=RC3,RC4/12,0) -> 4166.666666666667 | N14: =IF(R3C>=RC3,RC4/12,0) -> 4166.666666666667 | O14: =IF(R3C>=RC3,RC4/12,0) -> 4166.666666666667 | P14: =IF(R3C>=RC3,RC4/12,0) -> 4166.666666666667 | Q14: =IF(R3C>=RC3,RC4/12,0) -> 4166.666666666667 | R14: =IF(R3C>=RC3,RC4/12,0) -> 4166.666666666667 | S14: =IF(R3C>=RC3,RC4/12,0) -> 4166.666666666667 | T14: =IF(R3C>=RC3,RC4/12,0) -> 4166.666666666667 | U14: =IF(R3C>=RC3,RC4/12,0) -> 4166.666666666667 | V14: =IF(R3C>=RC3,RC4/12,0) -> 4166.666666666667 | W14: =IF(R3C>=RC3,RC4/12,0) -> 4166.666666666667 | X14: =IF(R3C>=RC3,RC4/12,0) -> 4166.666666666667 | Y14: =IF(R3C>=RC3,RC4/12,0) -> 4166.666666666667 | Z14: =IF(R3C>=RC3,RC4/12,0) -> 4166.666666666667 | AA14: =IF(R3C>=RC3,RC4/12,0) -> 4166.666666666667 | AB14: =IF(R3C>=RC3,RC4/12,0) -> 4166.666666666667 | AC14: =IF(R3C>=RC3,RC4/12,0) -> 4166.666666666667 | AD14: =IF(R3C>=RC3,RC4/12,0) -> 4166.666666666667 | AE14: =IF(R3C>=RC3,RC4/12,0) -> 4166.666666666667 | AF14: =IF(R3C>=RC3,RC4/12,0) -> 4166.666666666667 | AG14: =IF(R3C>=RC3,RC4/12,0) -> 4166.666666666667 | AH14: =IF(R3C>=RC3,RC4/12,0) -> 4166.666666666667 | AI14: =IF(R3C>=RC3,RC4/12,0) -> 4166.666666666667 | AJ14: =IF(R3C>=RC3,RC4/12,0) -> 4166.666666666667 | AK14: =IF(R3C>=RC3,RC4/12,0) -> 4166.666666666667 | AL14: =IF(R3C>=RC3,RC4/12,0) -> 4166.666666666667 | AM14: =IF(R3C>=RC3,RC4/12,0) -> 4166.666666666667 | AN14: =IF(R3C>=RC3,RC4/12,0) -> 4166.666666666667
A15: IT administrator | B15: 7 | C15: =R1C4+RC[-1]*31 -> 2001-08-06T00:00:00.000 | D15: 60000 | E15: =IF(R3C>=RC3,RC4/12,0) -> 0 | F15: =IF(R3C>=RC3,RC4/12,0) -> 0 | G15: =IF(R3C>=RC3,RC4/12,0) -> 0 | H15: =IF(R3C>=RC3,RC4/12,0) -> 0 | I15: =IF(R3C>=RC3,RC4/12,0) -> 0 | J15: =IF(R3C>=RC3,RC4/12,0) -> 0 | K15: =IF(R3C>=RC3,RC4/12,0) -> 0 | L15: =IF(R3C>=RC3,RC4/12,0) -> 5000 | M15: =IF(R3C>=RC3,RC4/12,0) -> 5000 | N15: =IF(R3C>=RC3,RC4/12,0) -> 5000 | O15: =IF(R3C>=RC3,RC4/12,0) -> 5000 | P15: =IF(R3C>=RC3,RC4/12,0) -> 5000 | Q15: =IF(R3C>=RC3,RC4/12,0) -> 5000 | R15: =IF(R3C>=RC3,RC4/12,0) -> 5000 | S15: =IF(R3C>=RC3,RC4/12,0) -> 5000 | T15: =IF(R3C>=RC3,RC4/12,0) -> 5000 | U15: =IF(R3C>=RC3,RC4/12,0) -> 5000 | V15: =IF(R3C>=RC3,RC4/12,0) -> 5000 | W15: =IF(R3C>=RC3,RC4/12,0) -> 5000 | X15: =IF(R3C>=RC3,RC4/12,0) -> 5000 | Y15: =IF(R3C>=RC3,RC4/12,0) -> 5000 | Z15: =IF(R3C>=RC3,RC4/12,0) -> 5000 | AA15: =IF(R3C>=RC3,RC4/12,0) -> 5000 | AB15: =IF(R3C>=RC3,RC4/12,0) -> 5000 | AC15: =IF(R3C>=RC3,RC4/12,0) -> 5000 | AD15: =IF(R3C>=RC3,RC4/12,0) -> 5000 | AE15: =IF(R3C>=RC3,RC4/12,0) -> 5000 | AF15: =IF(R3C>=RC3,RC4/12,0) -> 5000 | AG15: =IF(R3C>=RC3,RC4/12,0) -> 5000 | AH15: =IF(R3C>=RC3,RC4/12,0) -> 5000 | AI15: =IF(R3C>=RC3,RC4/12,0) -> 5000 | AJ15: =IF(R3C>=RC3,RC4/12,0) -> 5000 | AK15: =IF(R3C>=RC3,RC4/12,0) -> 5000 | AL15: =IF(R3C>=RC3,RC4/12,0) -> 5000 | AM15: =IF(R3C>=RC3,RC4/12,0) -> 5000 | AN15: =IF(R3C>=RC3,RC4/12,0) -> 5000
A16: Developer | B16: 2 | C16: =R1C4+RC[-1]*31 -> 2001-03-04T00:00:00.000 | D16: 80000 | E16: =IF(R3C>=RC3,RC4/12,0) -> 0 | F16: =IF(R3C>=RC3,RC4/12,0) -> 0 | G16: =IF(R3C>=RC3,RC4/12,0) -> 6666.666666666667 | H16: =IF(R3C>=RC3,RC4/12,0) -> 6666.666666666667 | I16: =IF(R3C>=RC3,RC4/12,0) -> 6666.666666666667 | J16: =IF(R3C>=RC3,RC4/12,0) -> 6666.666666666667 | K16: =IF(R3C>=RC3,RC4/12,0) -> 6666.666666666667 | L16: =IF(R3C>=RC3,RC4/12,0) -> 6666.666666666667 | M16: =IF(R3C>=RC3,RC4/12,0) -> 6666.666666666667 | N16: =IF(R3C>=RC3,RC4/12,0) -> 6666.666666666667 | O16: =IF(R3C>=RC3,RC4/12,0) -> 6666.666666666667 | P16: =IF(R3C>=RC3,RC4/12,0) -> 6666.666666666667 | Q16: =IF(R3C>=RC3,RC4/12,0) -> 6666.666666666667 | R16: =IF(R3C>=RC3,RC4/12,0) -> 6666.666666666667 | S16: =IF(R3C>=RC3,RC4/12,0) -> 6666.666666666667 | T16: =IF(R3C>=RC3,RC4/12,0) -> 6666.666666666667 | U16: =IF(R3C>=RC3,RC4/12,0) -> 6666.666666666667 | V16: =IF(R3C>=RC3,RC4/12,0) -> 6666.666666666667 | W16: =IF(R3C>=RC3,RC4/12,0) -> 6666.666666666667 | X16: =IF(R3C>=RC3,RC4/12,0) -> 6666.666666666667 | Y16: =IF(R3C>=RC3,RC4/12,0) -> 6666.666666666667 | Z16: =IF(R3C>=RC3,RC4/12,0) -> 6666.666666666667 | AA16: =IF(R3C>=RC3,RC4/12,0) -> 6666.666666666667 | AB16: =IF(R3C>=RC3,RC4/12,0) -> 6666.666666666667 | AC16: =IF(R3C>=RC3,RC4/12,0) -> 6666.666666666667 | AD16: =IF(R3C>=RC3,RC4/12,0) -> 6666.666666666667 | AE16: =IF(R3C>=RC3,RC4/12,0) -> 6666.666666666667 | AF16: =IF(R3C>=RC3,RC4/12,0) -> 6666.666666666667 | AG16: =IF(R3C>=RC3,RC4/12,0) -> 6666.666666666667 | AH16: =IF(R3C>=RC3,RC4/12,0) -> 6666.666666666667 | AI16: =IF(R3C>=RC3,RC4/12,0) -> 6666.666666666667 | AJ16: =IF(R3C>=RC3,RC4/12,0) -> 6666.666666666667 | AK16: =IF(R3C>=RC3,RC4/12,0) -> 6666.666666666667 | AL16: =IF(R3C>=RC3,RC4/12,0) -> 6666.666666666667 | AM16: =IF(R3C>=RC3,RC4/12,0) -> 6666.666666666667 | AN16: =IF(R3C>=RC3,RC4/12,0) -> 6666.666666666667
A17: Developer | B17: 3 | C17: =R1C4+RC[-1]*31 -> 2001-04-04T00:00:00.000 | D17: 80000 | E17: =IF(R3C>=RC3,RC4/12,0) -> 0 | F17: =IF(R3C>=RC3,RC4/12,0) -> 0 | G17: =IF(R3C>=RC3,RC4/12,0) -> 0 | H17: =IF(R3C>=RC3,RC4/12,0) -> 6666.666666666667 | I17: =IF(R3C>=RC3,RC4/12,0) -> 6666.666666666667 | J17: =IF(R3C>=RC3,RC4/12,0) -> 6666.666666666667 | K17: =IF(R3C>=RC3,RC4/12,0) -> 6666.666666666667 | L17: =IF(R3C>=RC3,RC4/12,0) -> 6666.666666666667 | M17: =IF(R3C>=RC3,RC4/12,0) -> 6666.666666666667 | N17: =IF(R3C>=RC3,RC4/12,0) -> 6666.666666666667 | O17: =IF(R3C>=RC3,RC4/12,0) -> 6666.666666666667 | P17: =IF(R3C>=RC3,RC4/12,0) -> 6666.666666666667 | Q17: =IF(R3C>=RC3,RC4/12,0) -> 6666.666666666667 | R17: =IF(R3C>=RC3,RC4/12,0) -> 6666.666666666667 | S17: =IF(R3C>=RC3,RC4/12,0) -> 6666.666666666667 | T17: =IF(R3C>=RC3,RC4/12,0) -> 6666.666666666667 | U17: =IF(R3C>=RC3,RC4/12,0) -> 6666.666666666667 | V17: =IF(R3C>=RC3,RC4/12,0) -> 6666.666666666667 | W17: =IF(R3C>=RC3,RC4/12,0) -> 6666.666666666667 | X17: =IF(R3C>=RC3,RC4/12,0) -> 6666.666666666667 | Y17: =IF(R3C>=RC3,RC4/12,0) -> 6666.666666666667 | Z17: =IF(R3C>=RC3,RC4/12,0) -> 6666.666666666667 | AA17: =IF(R3C>=RC3,RC4/12,0) -> 6666.666666666667 | AB17: =IF(R3C>=RC3,RC4/12,0) -> 6666.666666666667 | AC17: =IF(R3C>=RC3,RC4/12,0) -> 6666.666666666667 | AD17: =IF(R3C>=RC3,RC4/12,0) -> 6666.666666666667 | AE17: =IF(R3C>=RC3,RC4/12,0) -> 6666.666666666667 | AF17: =IF(R3C>=RC3,RC4/12,0) -> 6666.666666666667 | AG17: =IF(R3C>=RC3,RC4/12,0) -> 6666.666666666667 | AH17: =IF(R3C>=RC3,RC4/12,0) -> 6666.666666666667 | AI17: =IF(R3C>=RC3,RC4/12,0) -> 6666.666666666667 | AJ17: =IF(R3C>=RC3,RC4/12,0) -> 6666.666666666667 | AK17: =IF(R3C>=RC3,RC4/12,0) -> 6666.666666666667 | AL17: =IF(R3C>=RC3,RC4/12,0) -> 6666.666666666667 | AM17: =IF(R3C>=RC3,RC4/12,0) -> 6666.666666666667 | AN17: =IF(R3C>=RC3,RC4/12,0) -> 6666.666666666667
A18: Developer | B18: 6 | C18: =R1C4+RC[-1]*31 -> 2001-07-06T00:00:00.000 | D18: 80000 | E18: =IF(R3C>=RC3,RC4/12,0) -> 0 | F18: =IF(R3C>=RC3,RC4/12,0) -> 0 | G18: =IF(R3C>=RC3,RC4/12,0) -> 0 | H18: =IF(R3C>=RC3,RC4/12,0) -> 0 | I18: =IF(R3C>=RC3,RC4/12,0) -> 0 | J18: =IF(R3C>=RC3,RC4/12,0) -> 0 | K18: =IF(R3C>=RC3,RC4/12,0) -> 6666.666666666667 | L18: =IF(R3C>=RC3,RC4/12,0) -> 6666.666666666667 | M18: =IF(R3C>=RC3,RC4/12,0) -> 6666.666666666667 | N18: =IF(R3C>=RC3,RC4/12,0) -> 6666.666666666667 | O18: =IF(R3C>=RC3,RC4/12,0) -> 6666.666666666667 | P18: =IF(R3C>=RC3,RC4/12,0) -> 6666.666666666667 | Q18: =IF(R3C>=RC3,RC4/12,0) -> 6666.666666666667 | R18: =IF(R3C>=RC3,RC4/12,0) -> 6666.666666666667 | S18: =IF(R3C>=RC3,RC4/12,0) -> 6666.666666666667 | T18: =IF(R3C>=RC3,RC4/12,0) -> 6666.666666666667 | U18: =IF(R3C>=RC3,RC4/12,0) -> 6666.666666666667 | V18: =IF(R3C>=RC3,RC4/12,0) -> 6666.666666666667 | W18: =IF(R3C>=RC3,RC4/12,0) -> 6666.666666666667 | X18: =IF(R3C>=RC3,RC4/12,0) -> 6666.666666666667 | Y18: =IF(R3C>=RC3,RC4/12,0) -> 6666.666666666667 | Z18: =IF(R3C>=RC3,RC4/12,0) -> 6666.666666666667 | AA18: =IF(R3C>=RC3,RC4/12,0) -> 6666.666666666667 | AB18: =IF(R3C>=RC3,RC4/12,0) -> 6666.666666666667 | AC18: =IF(R3C>=RC3,RC4/12,0) -> 6666.666666666667 | AD18: =IF(R3C>=RC3,RC4/12,0) -> 6666.666666666667 | AE18: =IF(R3C>=RC3,RC4/12,0) -> 6666.666666666667 | AF18: =IF(R3C>=RC3,RC4/12,0) -> 6666.666666666667 | AG18: =IF(R3C>=RC3,RC4/12,0) -> 6666.666666666667 | AH18: =IF(R3C>=RC3,RC4/12,0) -> 6666.666666666667 | AI18: =IF(R3C>=RC3,RC4/12,0) -> 6666.666666666667 | AJ18: =IF(R3C>=RC3,RC4/12,0) -> 6666.666666666667 | AK18: =IF(R3C>=RC3,RC4/12,0) -> 6666.666666666667 | AL18: =IF(R3C>=RC3,RC4/12,0) -> 6666.666666666667 | AM18: =IF(R3C>=RC3,RC4/12,0) -> 6666.666666666667 | AN18: =IF(R3C>=RC3,RC4/12,0) -> 6666.666666666667
A19: Developer | B19: 8 | C19: =R1C4+RC[-1]*31 -> 2001-09-06T00:00:00.000 | D19: 80000 | E19: =IF(R3C>=RC3,RC4/12,0) -> 0 | F19: =IF(R3C>=RC3,RC4/12,0) -> 0 | G19: =IF(R3C>=RC3,RC4/12,0) -> 0 | H19: =IF(R3C>=RC3,RC4/12,0) -> 0 | I19: =IF(R3C>=RC3,RC4/12,0) -> 0 | J19: =IF(R3C>=RC3,RC4/12,0) -> 0 | K19: =IF(R3C>=RC3,RC4/12,0) -> 0 | L19: =IF(R3C>=RC3,RC4/12,0) -> 0 | M19: =IF(R3C>=RC3,RC4/12,0) -> 6666.666666666667 | N19: =IF(R3C>=RC3,RC4/12,0) -> 6666.666666666667 | O19: =IF(R3C>=RC3,RC4/12,0) -> 6666.666666666667 | P19: =IF(R3C>=RC3,RC4/12,0) -> 6666.666666666667 | Q19: =IF(R3C>=RC3,RC4/12,0) -> 6666.666666666667 | R19: =IF(R3C>=RC3,RC4/12,0) -> 6666.666666666667 | S19: =IF(R3C>=RC3,RC4/12,0) -> 6666.666666666667 | T19: =IF(R3C>=RC3,RC4/12,0) -> 6666.666666666667 | U19: =IF(R3C>=RC3,RC4/12,0) -> 6666.666666666667 | V19: =IF(R3C>=RC3,RC4/12,0) -> 6666.666666666667 | W19: =IF(R3C>=RC3,RC4/12,0) -> 6666.666666666667 | X19: =IF(R3C>=RC3,RC4/12,0) -> 6666.666666666667 | Y19: =IF(R3C>=RC3,RC4/12,0) -> 6666.666666666667 | Z19: =IF(R3C>=RC3,RC4/12,0) -> 6666.666666666667 | AA19: =IF(R3C>=RC3,RC4/12,0) -> 6666.666666666667 | AB19: =IF(R3C>=RC3,RC4/12,0) -> 6666.666666666667 | AC19: =IF(R3C>=RC3,RC4/12,0) -> 6666.666666666667 | AD19: =IF(R3C>=RC3,RC4/12,0) -> 6666.666666666667 | AE19: =IF(R3C>=RC3,RC4/12,0) -> 6666.666666666667 | AF19: =IF(R3C>=RC3,RC4/12,0) -> 6666.666666666667 | AG19: =IF(R3C>=RC3,RC4/12,0) -> 6666.666666666667 | AH19: =IF(R3C>=RC3,RC4/12,0) -> 6666.666666666667 | AI19: =IF(R3C>=RC3,RC4/12,0) -> 6666.666666666667 | AJ19: =IF(R3C>=RC3,RC4/12,0) -> 6666.666666666667 | AK19: =IF(R3C>=RC3,RC4/12,0) -> 6666.666666666667 | AL19: =IF(R3C>=RC3,RC4/12,0) -> 6666.666666666667 | AM19: =IF(R3C>=RC3,RC4/12,0) -> 6666.666666666667 | AN19: =IF(R3C>=RC3,RC4/12,0) -> 6666.666666666667
A20: Developer | B20: 10 | C20: =R1C4+RC[-1]*31 -> 2001-11-07T00:00:00.000 | D20: 80000 | E20: =IF(R3C>=RC3,RC4/12,0) -> 0 | F20: =IF(R3C>=RC3,RC4/12,0) -> 0 | G20: =IF(R3C>=RC3,RC4/12,0) -> 0 | H20: =IF(R3C>=RC3,RC4/12,0) -> 0 | I20: =IF(R3C>=RC3,RC4/12,0) -> 0 | J20: =IF(R3C>=RC3,RC4/12,0) -> 0 | K20: =IF(R3C>=RC3,RC4/12,0) -> 0 | L20: =IF(R3C>=RC3,RC4/12,0) -> 0 | M20: =IF(R3C>=RC3,RC4/12,0) -> 0 | N20: =IF(R3C>=RC3,RC4/12,0) -> 0 | O20: =IF(R3C>=RC3,RC4/12,0) -> 6666.666666666667 | P20: =IF(R3C>=RC3,RC4/12,0) -> 6666.666666666667 | Q20: =IF(R3C>=RC3,RC4/12,0) -> 6666.666666666667 | R20: =IF(R3C>=RC3,RC4/12,0) -> 6666.666666666667 | S20: =IF(R3C>=RC3,RC4/12,0) -> 6666.666666666667 | T20: =IF(R3C>=RC3,RC4/12,0) -> 6666.666666666667 | U20: =IF(R3C>=RC3,RC4/12,0) -> 6666.666666666667 | V20: =IF(R3C>=RC3,RC4/12,0) -> 6666.666666666667 | W20: =IF(R3C>=RC3,RC4/12,0) -> 6666.666666666667 | X20: =IF(R3C>=RC3,RC4/12,0) -> 6666.666666666667 | Y20: =IF(R3C>=RC3,RC4/12,0) -> 6666.666666666667 | Z20: =IF(R3C>=RC3,RC4/12,0) -> 6666.666666666667 | AA20: =IF(R3C>=RC3,RC4/12,0) -> 6666.666666666667 | AB20: =IF(R3C>=RC3,RC4/12,0) -> 6666.666666666667 | AC20: =IF(R3C>=RC3,RC4/12,0) -> 6666.666666666667 | AD20: =IF(R3C>=RC3,RC4/12,0) -> 6666.666666666667 | AE20: =IF(R3C>=RC3,RC4/12,0) -> 6666.666666666667 | AF20: =IF(R3C>=RC3,RC4/12,0) -> 6666.666666666667 | AG20: =IF(R3C>=RC3,RC4/12,0) -> 6666.666666666667 | AH20: =IF(R3C>=RC3,RC4/12,0) -> 6666.666666666667 | AI20: =IF(R3C>=RC3,RC4/12,0) -> 6666.666666666667 | AJ20: =IF(R3C>=RC3,RC4/12,0) -> 6666.666666666667 | AK20: =IF(R3C>=RC3,RC4/12,0) -> 6666.666666666667 | AL20: =IF(R3C>=RC3,RC4/12,0) -> 6666.666666666667 | AM20: =IF(R3C>=RC3,RC4/12,0) -> 6666.666666666667 | AN20: =IF(R3C>=RC3,RC4/12,0) -> 6666.666666666667
A21: Developer | B21: 12 | C21: =R1C4+RC[-1]*31 -> 2002-01-08T00:00:00.000 | D21: 80000 | E21: =IF(R3C>=RC3,RC4/12,0) -> 0 | F21: =IF(R3C>=RC3,RC4/12,0) -> 0 | G21: =IF(R3C>=RC3,RC4/12,0) -> 0 | H21: =IF(R3C>=RC3,RC4/12,0) -> 0 | I21: =IF(R3C>=RC3,RC4/12,0) -> 0 | J21: =IF(R3C>=RC3,RC4/12,0) -> 0 | K21: =IF(R3C>=RC3,RC4/12,0) -> 0 | L21: =IF(R3C>=RC3,RC4/12,0) -> 0 | M21: =IF(R3C>=RC3,RC4/12,0) -> 0 | N21: =IF(R3C>=RC3,RC4/12,0) -> 0 | O21: =IF(R3C>=RC3,RC4/12,0) -> 0 | P21: =IF(R3C>=RC3,RC4/12,0) -> 0 | Q21: =IF(R3C>=RC3,RC4/12,0) -> 6666.666666666667 | R21: =IF(R3C>=RC3,RC4/12,0) -> 6666.666666666667 | S21: =IF(R3C>=RC3,RC4/12,0) -> 6666.666666666667 | T21: =IF(R3C>=RC3,RC4/12,0) -> 6666.666666666667 | U21: =IF(R3C>=RC3,RC4/12,0) -> 6666.666666666667 | V21: =IF(R3C>=RC3,RC4/12,0) -> 6666.666666666667 | W21: =IF(R3C>=RC3,RC4/12,0) -> 6666.666666666667 | X21: =IF(R3C>=RC3,RC4/12,0) -> 6666.666666666667 | Y21: =IF(R3C>=RC3,RC4/12,0) -> 6666.666666666667 | Z21: =IF(R3C>=RC3,RC4/12,0) -> 6666.666666666667 | AA21: =IF(R3C>=RC3,RC4/12,0) -> 6666.666666666667 | AB21: =IF(R3C>=RC3,RC4/12,0) -> 6666.666666666667 | AC21: =IF(R3C>=RC3,RC4/12,0) -> 6666.666666666667 | AD21: =IF(R3C>=RC3,RC4/12,0) -> 6666.666666666667 | AE21: =IF(R3C>=RC3,RC4/12,0) -> 6666.666666666667 | AF21: =IF(R3C>=RC3,RC4/12,0) -> 6666.666666666667 | AG21: =IF(R3C>=RC3,RC4/12,0) -> 6666.666666666667 | AH21: =IF(R3C>=RC3,RC4/12,0) -> 6666.666666666667 | AI21: =IF(R3C>=RC3,RC4/12,0) -> 6666.666666666667 | AJ21: =IF(R3C>=RC3,RC4/12,0) -> 6666.666666666667 | AK21: =IF(R3C>=RC3,RC4/12,0) -> 6666.666666666667 | AL21: =IF(R3C>=RC3,RC4/12,0) -> 6666.666666666667 | AM21: =IF(R3C>=RC3,RC4/12,0) -> 6666.666666666667 | AN21: =IF(R3C>=RC3,RC4/12,0) -> 6666.666666666667
A22: Developer | B22: 14 | C22: =R1C4+RC[-1]*31 -> 2002-03-11T00:00:00.000 | D22: 80000 | E22: =IF(R3C>=RC3,RC4/12,0) -> 0 | F22: =IF(R3C>=RC3,RC4/12,0) -> 0 | G22: =IF(R3C>=RC3,RC4/12,0) -> 0 | H22: =IF(R3C>=RC3,RC4/12,0) -> 0 | I22: =IF(R3C>=RC3,RC4/12,0) -> 0 | J22: =IF(R3C>=RC3,RC4/12,0) -> 0 | K22: =IF(R3C>=RC3,RC4/12,0) -> 0 | L22: =IF(R3C>=RC3,RC4/12,0) -> 0 | M22: =IF(R3C>=RC3,RC4/12,0) -> 0 | N22: =IF(R3C>=RC3,RC4/12,0) -> 0 | O22: =IF(R3C>=RC3,RC4/12,0) -> 0 | P22: =IF(R3C>=RC3,RC4/12,0) -> 0 | Q22: =IF(R3C>=RC3,RC4/12,0) -> 0 | R22: =IF(R3C>=RC3,RC4/12,0) -> 0 | S22: =IF(R3C>=RC3,RC4/12,0) -> 6666.666666666667 | T22: =IF(R3C>=RC3,RC4/12,0) -> 6666.666666666667 | U22: =IF(R3C>=RC3,RC4/12,0) -> 6666.666666666667 | V22: =IF(R3C>=RC3,RC4/12,0) -> 6666.666666666667 | W22: =IF(R3C>=RC3,RC4/12,0) -> 6666.666666666667 | X22: =IF(R3C>=RC3,RC4/12,0) -> 6666.666666666667 | Y22: =IF(R3C>=RC3,RC4/12,0) -> 6666.666666666667 | Z22: =IF(R3C>=RC3,RC4/12,0) -> 6666.666666666667 | AA22: =IF(R3C>=RC3,RC4/12,0) -> 6666.666666666667 | AB22: =IF(R3C>=RC3,RC4/12,0) -> 6666.666666666667 | AC22: =IF(R3C>=RC3,RC4/12,0) -> 6666.666666666667 | AD22: =IF(R3C>=RC3,RC4/12,0) -> 6666.666666666667 | AE22: =IF(R3C>=RC3,RC4/12,0) -> 6666.666666666667 | AF22: =IF(R3C>=RC3,RC4/12,0) -> 6666.666666666667 | AG22: =IF(R3C>=RC3,RC4/12,0) -> 6666.666666666667 | AH22: =IF(R3C>=RC3,RC4/12,0) -> 6666.666666666667 | AI22: =IF(R3C>=RC3,RC4/12,0) -> 6666.666666666667 | AJ22: =IF(R3C>=RC3,RC4/12,0) -> 6666.666666666667 | AK22: =IF(R3C>=RC3,RC4/12,0) -> 6666.666666666667 | AL22: =IF(R3C>=RC3,RC4/12,0) -> 6666.666666666667 | AM22: =IF(R3C>=RC3,RC4/12,0) -> 6666.666666666667 | AN22: =IF(R3C>=RC3,RC4/12,0) -> 6666.666666666667
A23: Developer | B23: 16 | C23: =R1C4+RC[-1]*31 -> 2002-05-12T00:00:00.000 | D23: 80000 | E23: =IF(R3C>=RC3,RC4/12,0) -> 0 | F23: =IF(R3C>=RC3,RC4/12,0) -> 0 | G23: =IF(R3C>=RC3,RC4/12,0) -> 0 | H23: =IF(R3C>=RC3,RC4/12,0) -> 0 | I23: =IF(R3C>=RC3,RC4/12,0) -> 0 | J23: =IF(R3C>=RC3,RC4/12,0) -> 0 | K23: =IF(R3C>=RC3,RC4/12,0) -> 0 | L23: =IF(R3C>=RC3,RC4/12,0) -> 0 | M23: =IF(R3C>=RC3,RC4/12,0) -> 0 | N23: =IF(R3C>=RC3,RC4/12,0) -> 0 | O23: =IF(R3C>=RC3,RC4/12,0) -> 0 | P23: =IF(R3C>=RC3,RC4/12,0) -> 0 | Q23: =IF(R3C>=RC3,RC4/12,0) -> 0 | R23: =IF(R3C>=RC3,RC4/12,0) -> 0 | S23: =IF(R3C>=RC3,RC4/12,0) -> 0 | T23: =IF(R3C>=RC3,RC4/12,0) -> 0 | U23: =IF(R3C>=RC3,RC4/12,0) -> 6666.666666666667 | V23: =IF(R3C>=RC3,RC4/12,0) -> 6666.666666666667 | W23: =IF(R3C>=RC3,RC4/12,0) -> 6666.666666666667 | X23: =IF(R3C>=RC3,RC4/12,0) -> 6666.666666666667 | Y23: =IF(R3C>=RC3,RC4/12,0) -> 6666.666666666667 | Z23: =IF(R3C>=RC3,RC4/12,0) -> 6666.666666666667 | AA23: =IF(R3C>=RC3,RC4/12,0) -> 6666.666666666667 | AB23: =IF(R3C>=RC3,RC4/12,0) -> 6666.666666666667 | AC23: =IF(R3C>=RC3,RC4/12,0) -> 6666.666666666667 | AD23: =IF(R3C>=RC3,RC4/12,0) -> 6666.666666666667 | AE23: =IF(R3C>=RC3,RC4/12,0) -> 6666.666666666667 | AF23: =IF(R3C>=RC3,RC4/12,0) -> 6666.666666666667 | AG23: =IF(R3C>=RC3,RC4/12,0) -> 6666.666666666667 | AH23: =IF(R3C>=RC3,RC4/12,0) -> 6666.666666666667 | AI23: =IF(R3C>=RC3,RC4/12,0) -> 6666.666666666667 | AJ23: =IF(R3C>=RC3,RC4/12,0) -> 6666.666666666667 | AK23: =IF(R3C>=RC3,RC4/12,0) -> 6666.666666666667 | AL23: =IF(R3C>=RC3,RC4/12,0) -> 6666.666666666667 | AM23: =IF(R3C>=RC3,RC4/12,0) -> 6666.666666666667 | AN23: =IF(R3C>=RC3,RC4/12,0) -> 6666.666666666667
A24: DBA | B24: 3 | C24: =R1C4+RC[-1]*31 -> 2001-04-04T00:00:00.000 | D24: 100000 | E24: =IF(R3C>=RC3,RC4/12,0) -> 0 | F24: =IF(R3C>=RC3,RC4/12,0) -> 0 | G24: =IF(R3C>=RC3,RC4/12,0) -> 0 | H24: =IF(R3C>=RC3,RC4/12,0) -> 8333.3333333333339 | I24: =IF(R3C>=RC3,RC4/12,0) -> 8333.3333333333339 | J24: =IF(R3C>=RC3,RC4/12,0) -> 8333.3333333333339 | K24: =IF(R3C>=RC3,RC4/12,0) -> 8333.3333333333339 | L24: =IF(R3C>=RC3,RC4/12,0) -> 8333.3333333333339 | M24: =IF(R3C>=RC3,RC4/12,0) -> 8333.3333333333339 | N24: =IF(R3C>=RC3,RC4/12,0) -> 8333.3333333333339 | O24: =IF(R3C>=RC3,RC4/12,0) -> 8333.3333333333339 | P24: =IF(R3C>=RC3,RC4/12,0) -> 8333.3333333333339 | Q24: =IF(R3C>=RC3,RC4/12,0) -> 8333.3333333333339 | R24: =IF(R3C>=RC3,RC4/12,0) -> 8333.3333333333339 | S24: =IF(R3C>=RC3,RC4/12,0) -> 8333.3333333333339 | T24: =IF(R3C>=RC3,RC4/12,0) -> 8333.3333333333339 | U24: =IF(R3C>=RC3,RC4/12,0) -> 8333.3333333333339 | V24: =IF(R3C>=RC3,RC4/12,0) -> 8333.3333333333339 | W24: =IF(R3C>=RC3,RC4/12,0) -> 8333.3333333333339 | X24: =IF(R3C>=RC3,RC4/12,0) -> 8333.3333333333339 | Y24: =IF(R3C>=RC3,RC4/12,0) -> 8333.3333333333339 | Z24: =IF(R3C>=RC3,RC4/12,0) -> 8333.3333333333339 | AA24: =IF(R3C>=RC3,RC4/12,0) -> 8333.3333333333339 | AB24: =IF(R3C>=RC3,RC4/12,0) -> 8333.3333333333339 | AC24: =IF(R3C>=RC3,RC4/12,0) -> 8333.3333333333339 | AD24: =IF(R3C>=RC3,RC4/12,0) -> 8333.3333333333339 | AE24: =IF(R3C>=RC3,RC4/12,0) -> 8333.3333333333339 | AF24: =IF(R3C>=RC3,RC4/12,0) -> 8333.3333333333339 | AG24: =IF(R3C>=RC3,RC4/12,0) -> 8333.3333333333339 | AH24: =IF(R3C>=RC3,RC4/12,0) -> 8333.3333333333339 | AI24: =IF(R3C>=RC3,RC4/12,0) -> 8333.3333333333339 | AJ24: =IF(R3C>=RC3,RC4/12,0) -> 8333.3333333333339 | AK24: =IF(R3C>=RC3,RC4/12,0) -> 8333.3333333333339 | AL24: =IF(R3C>=RC3,RC4/12,0) -> 8333.3333333333339 | AM24: =IF(R3C>=RC3,RC4/12,0) -> 8333.3333333333339 | AN24: =IF(R3C>=RC3,RC4/12,0) -> 8333.3333333333339
A25: DBA | B25: 6 | C25: =R1C4+RC[-1]*31 -> 2001-07-06T00:00:00.000 | D25: 80000 | E25: =IF(R3C>=RC3,RC4/12,0) -> 0 | F25: =IF(R3C>=RC3,RC4/12,0) -> 0 | G25: =IF(R3C>=RC3,RC4/12,0) -> 0 | H25: =IF(R3C>=RC3,RC4/12,0) -> 0 | I25: =IF(R3C>=RC3,RC4/12,0) -> 0 | J25: =IF(R3C>=RC3,RC4/12,0) -> 0 | K25: =IF(R3C>=RC3,RC4/12,0) -> 6666.666666666667 | L25: =IF(R3C>=RC3,RC4/12,0) -> 6666.666666666667 | M25: =IF(R3C>=RC3,RC4/12,0) -> 6666.666666666667 | N25: =IF(R3C>=RC3,RC4/12,0) -> 6666.666666666667 | O25: =IF(R3C>=RC3,RC4/12,0) -> 6666.666666666667 | P25: =IF(R3C>=RC3,RC4/12,0) -> 6666.666666666667 | Q25: =IF(R3C>=RC3,RC4/12,0) -> 6666.666666666667 | R25: =IF(R3C>=RC3,RC4/12,0) -> 6666.666666666667 | S25: =IF(R3C>=RC3,RC4/12,0) -> 6666.666666666667 | T25: =IF(R3C>=RC3,RC4/12,0) -> 6666.666666666667 | U25: =IF(R3C>=RC3,RC4/12,0) -> 6666.666666666667 | V25: =IF(R3C>=RC3,RC4/12,0) -> 6666.666666666667 | W25: =IF(R3C>=RC3,RC4/12,0) -> 6666.666666666667 | X25: =IF(R3C>=RC3,RC4/12,0) -> 6666.666666666667 | Y25: =IF(R3C>=RC3,RC4/12,0) -> 6666.666666666667 | Z25: =IF(R3C>=RC3,RC4/12,0) -> 6666.666666666667 | AA25: =IF(R3C>=RC3,RC4/12,0) -> 6666.666666666667 | AB25: =IF(R3C>=RC3,RC4/12,0) -> 6666.666666666667 | AC25: =IF(R3C>=RC3,RC4/12,0) -> 6666.666666666667 | AD25: =IF(R3C>=RC3,RC4/12,0) -> 6666.666666666667 | AE25: =IF(R3C>=RC3,RC4/12,0) -> 6666.666666666667 | AF25: =IF(R3C>=RC3,RC4/12,0) -> 6666.666666666667 | AG25: =IF(R3C>=RC3,RC4/12,0) -> 6666.666666666667 | AH25: =IF(R3C>=RC3,RC4/12,0) -> 6666.666666666667 | AI25: =IF(R3C>=RC3,RC4/12,0) -> 6666.666666666667 | AJ25: =IF(R3C>=RC3,RC4/12,0) -> 6666.666666666667 | AK25: =IF(R3C>=RC3,RC4/12,0) -> 6666.666666666667 | AL25: =IF(R3C>=RC3,RC4/12,0) -> 6666.666666666667 | AM25: =IF(R3C>=RC3,RC4/12,0) -> 6666.666666666667 | AN25: =IF(R3C>=RC3,RC4/12,0) -> 6666.666666666667
A26: QA Manager | B26: 5 | C26: =R1C4+RC[-1]*31 -> 2001-06-05T00:00:00.000 | D26: 85000 | E26: =IF(R3C>=RC3,RC4/12,0) -> 0 | F26: =IF(R3C>=RC3,RC4/12,0) -> 0 | G26: =IF(R3C>=RC3,RC4/12,0) -> 0 | H26: =IF(R3C>=RC3,RC4/12,0) -> 0 | I26: =IF(R3C>=RC3,RC4/12,0) -> 0 | J26: =IF(R3C>=RC3,RC4/12,0) -> 7083.333333333333 | K26: =IF(R3C>=RC3,RC4/12,0) -> 7083.333333333333 | L26: =IF(R3C>=RC3,RC4/12,0) -> 7083.333333333333 | M26: =IF(R3C>=RC3,RC4/12,0) -> 7083.333333333333 | N26: =IF(R3C>=RC3,RC4/12,0) -> 7083.333333333333 | O26: =IF(R3C>=RC3,RC4/12,0) -> 7083.333333333333 | P26: =IF(R3C>=RC3,RC4/12,0) -> 7083.333333333333 | Q26: =IF(R3C>=RC3,RC4/12,0) -> 7083.333333333333 | R26: =IF(R3C>=RC3,RC4/12,0) -> 7083.333333333333 | S26: =IF(R3C>=RC3,RC4/12,0) -> 7083.333333333333 | T26: =IF(R3C>=RC3,RC4/12,0) -> 7083.333333333333 | U26: =IF(R3C>=RC3,RC4/12,0) -> 7083.333333333333 | V26: =IF(R3C>=RC3,RC4/12,0) -> 7083.333333333333 | W26: =IF(R3C>=RC3,RC4/12,0) -> 7083.333333333333 | X26: =IF(R3C>=RC3,RC4/12,0) -> 7083.333333333333 | Y26: =IF(R3C>=RC3,RC4/12,0) -> 7083.333333333333 | Z26: =IF(R3C>=RC3,RC4/12,0) -> 7083.333333333333 | AA26: =IF(R3C>=RC3,RC4/12,0) -> 7083.333333333333 | AB26: =IF(R3C>=RC3,RC4/12,0) -> 7083.333333333333 | AC26: =IF(R3C>=RC3,RC4/12,0) -> 7083.333333333333 | AD26: =IF(R3C>=RC3,RC4/12,0) -> 7083.333333333333 | AE26: =IF(R3C>=RC3,RC4/12,0) -> 7083.333333333333 | AF26: =IF(R3C>=RC3,RC4/12,0) -> 7083.333333333333 | AG26: =IF(R3C>=RC3,RC4/12,0) -> 7083.333333333333 | AH26: =IF(R3C>=RC3,RC4/12,0) -> 7083.333333333333 | AI26: =IF(R3C>=RC3,RC4/12,0) -> 7083.333333333333 | AJ26: =IF(R3C>=RC3,RC4/12,0) -> 7083.333333333333 | AK26: =IF(R3C>=RC3,RC4/12,0) -> 7083.333333333333 | AL26: =IF(R3C>=RC3,RC4/12,0) -> 7083.333333333333 | AM26: =IF(R3C>=RC3,RC4/12,0) -> 7083.333333333333 | AN26: =IF(R3C>=RC3,RC4/12,0) -> 7083.333333333333
A27: QA Person | B27: 6 | C27: =R1C4+RC[-1]*31 -> 2001-07-06T00:00:00.000 | D27: 65000 | E27: =IF(R3C>=RC3,RC4/12,0) -> 0 | F27: =IF(R3C>=RC3,RC4/12,0) -> 0 | G27: =IF(R3C>=RC3,RC4/12,0) -> 0 | H27: =IF(R3C>=RC3,RC4/12,0) -> 0 | I27: =IF(R3C>=RC3,RC4/12,0) -> 0 | J27: =IF(R3C>=RC3,RC4/12,0) -> 0 | K27: =IF(R3C>=RC3,RC4/12,0) -> 5416.666666666667 | L27: =IF(R3C>=RC3,RC4/12,0) -> 5416.666666666667 | M27: =IF(R3C>=RC3,RC4/12,0) -> 5416.666666666667 | N27: =IF(R3C>=RC3,RC4/12,0) -> 5416.666666666667 | O27: =IF(R3C>=RC3,RC4/12,0) -> 5416.666666666667 | P27: =IF(R3C>=RC3,RC4/12,0) -> 5416.666666666667 | Q27: =IF(R3C>=RC3,RC4/12,0) -> 5416.666666666667 | R27: =IF(R3C>=RC3,RC4/12,0) -> 5416.666666666667 | S27: =IF(R3C>=RC3,RC4/12,0) -> 5416.666666666667 | T27: =IF(R3C>=RC3,RC4/12,0) -> 5416.666666666667 | U27: =IF(R3C>=RC3,RC4/12,0) -> 5416.666666666667 | V27: =IF(R3C>=RC3,RC4/12,0) -> 5416.666666666667 | W27: =IF(R3C>=RC3,RC4/12,0) -> 5416.666666666667 | X27: =IF(R3C>=RC3,RC4/12,0) -> 5416.666666666667 | Y27: =IF(R3C>=RC3,RC4/12,0) -> 5416.666666666667 | Z27: =IF(R3C>=RC3,RC4/12,0) -> 5416.666666666667 | AA27: =IF(R3C>=RC3,RC4/12,0) -> 5416.666666666667 | AB27: =IF(R3C>=RC3,RC4/12,0) -> 5416.666666666667 | AC27: =IF(R3C>=RC3,RC4/12,0) -> 5416.666666666667 | AD27: =IF(R3C>=RC3,RC4/12,0) -> 5416.666666666667 | AE27: =IF(R3C>=RC3,RC4/12,0) -> 5416.666666666667 | AF27: =IF(R3C>=RC3,RC4/12,0) -> 5416.666666666667 | AG27: =IF(R3C>=RC3,RC4/12,0) -> 5416.666666666667 | AH27: =IF(R3C>=RC3,RC4/12,0) -> 5416.666666666667 | AI27: =IF(R3C>=RC3,RC4/12,0) -> 5416.666666666667 | AJ27: =IF(R3C>=RC3,RC4/12,0) -> 5416.666666666667 | AK27: =IF(R3C>=RC3,RC4/12,0) -> 5416.666666666667 | AL27: =IF(R3C>=RC3,RC4/12,0) -> 5416.666666666667 | AM27: =IF(R3C>=RC3,RC4/12,0) -> 5416.666666666667 | AN27: =IF(R3C>=RC3,RC4/12,0) -> 5416.666666666667
A28: QA Person | B28: 7 | C28: =R1C4+RC[-1]*31 -> 2001-08-06T00:00:00.000 | D28: 65000 | E28: =IF(R3C>=RC3,RC4/12,0) -> 0 | F28: =IF(R3C>=RC3,RC4/12,0) -> 0 | G28: =IF(R3C>=RC3,RC4/12,0) -> 0 | H28: =IF(R3C>=RC3,RC4/12,0) -> 0 | I28: =IF(R3C>=RC3,RC4/12,0) -> 0 | J28: =IF(R3C>=RC3,RC4/12,0) -> 0 | K28: =IF(R3C>=RC3,RC4/12,0) -> 0 | L28: =IF(R3C>=RC3,RC4/12,0) -> 5416.666666666667 | M28: =IF(R3C>=RC3,RC4/12,0) -> 5416.666666666667 | N28: =IF(R3C>=RC3,RC4/12,0) -> 5416.666666666667 | O28: =IF(R3C>=RC3,RC4/12,0) -> 5416.666666666667 | P28: =IF(R3C>=RC3,RC4/12,0) -> 5416.666666666667 | Q28: =IF(R3C>=RC3,RC4/12,0) -> 5416.666666666667 | R28: =IF(R3C>=RC3,RC4/12,0) -> 5416.666666666667 | S28: =IF(R3C>=RC3,RC4/12,0) -> 5416.666666666667 | T28: =IF(R3C>=RC3,RC4/12,0) -> 5416.666666666667 | U28: =IF(R3C>=RC3,RC4/12,0) -> 5416.666666666667 | V28: =IF(R3C>=RC3,RC4/12,0) -> 5416.666666666667 | W28: =IF(R3C>=RC3,RC4/12,0) -> 5416.666666666667 | X28: =IF(R3C>=RC3,RC4/12,0) -> 5416.666666666667 | Y28: =IF(R3C>=RC3,RC4/12,0) -> 5416.666666666667 | Z28: =IF(R3C>=RC3,RC4/12,0) -> 5416.666666666667 | AA28: =IF(R3C>=RC3,RC4/12,0) -> 5416.666666666667 | AB28: =IF(R3C>=RC3,RC4/12,0) -> 5416.666666666667 | AC28: =IF(R3C>=RC3,RC4/12,0) -> 5416.666666666667 | AD28: =IF(R3C>=RC3,RC4/12,0) -> 5416.666666666667 | AE28: =IF(R3C>=RC3,RC4/12,0) -> 5416.666666666667 | AF28: =IF(R3C>=RC3,RC4/12,0) -> 5416.666666666667 | AG28: =IF(R3C>=RC3,RC4/12,0) -> 5416.666666666667 | AH28: =IF(R3C>=RC3,RC4/12,0) -> 5416.666666666667 | AI28: =IF(R3C>=RC3,RC4/12,0) -> 5416.666666666667 | AJ28: =IF(R3C>=RC3,RC4/12,0) -> 5416.666666666667 | AK28: =IF(R3C>=RC3,RC4/12,0) -> 5416.666666666667 | AL28: =IF(R3C>=RC3,RC4/12,0) -> 5416.666666666667 | AM28: =IF(R3C>=RC3,RC4/12,0) -> 5416.666666666667 | AN28: =IF(R3C>=RC3,RC4/12,0) -> 5416.666666666667
A29: QA Person | B29: 8 | C29: =R1C4+RC[-1]*31 -> 2001-09-06T00:00:00.000 | D29: 60000 | E29: =IF(R3C>=RC3,RC4/12,0) -> 0 | F29: =IF(R3C>=RC3,RC4/12,0) -> 0 | G29: =IF(R3C>=RC3,RC4/12,0) -> 0 | H29: =IF(R3C>=RC3,RC4/12,0) -> 0 | I29: =IF(R3C>=RC3,RC4/12,0) -> 0 | J29: =IF(R3C>=RC3,RC4/12,0) -> 0 | K29: =IF(R3C>=RC3,RC4/12,0) -> 0 | L29: =IF(R3C>=RC3,RC4/12,0) -> 0 | M29: =IF(R3C>=RC3,RC4/12,0) -> 5000 | N29: =IF(R3C>=RC3,RC4/12,0) -> 5000 | O29: =IF(R3C>=RC3,RC4/12,0) -> 5000 | P29: =IF(R3C>=RC3,RC4/12,0) -> 5000 | Q29: =IF(R3C>=RC3,RC4/12,0) -> 5000 | R29: =IF(R3C>=RC3,RC4/12,0) -> 5000 | S29: =IF(R3C>=RC3,RC4/12,0) -> 5000 | T29: =IF(R3C>=RC3,RC4/12,0) -> 5000 | U29: =IF(R3C>=RC3,RC4/12,0) -> 5000 | V29: =IF(R3C>=RC3,RC4/12,0) -> 5000 | W29: =IF(R3C>=RC3,RC4/12,0) -> 5000 | X29: =IF(R3C>=RC3,RC4/12,0) -> 5000 | Y29: =IF(R3C>=RC3,RC4/12,0) -> 5000 | Z29: =IF(R3C>=RC3,RC4/12,0) -> 5000 | AA29: =IF(R3C>=RC3,RC4/12,0) -> 5000 | AB29: =IF(R3C>=RC3,RC4/12,0) -> 5000 | AC29: =IF(R3C>=RC3,RC4/12,0) -> 5000 | AD29: =IF(R3C>=RC3,RC4/12,0) -> 5000 | AE29: =IF(R3C>=RC3,RC4/12,0) -> 5000 | AF29: =IF(R3C>=RC3,RC4/12,0) -> 5000 | AG29: =IF(R3C>=RC3,RC4/12,0) -> 5000 | AH29: =IF(R3C>=RC3,RC4/12,0) -> 5000 | AI29: =IF(R3C>=RC3,RC4/12,0) -> 5000 | AJ29: =IF(R3C>=RC3,RC4/12,0) -> 5000 | AK29: =IF(R3C>=RC3,RC4/12,0) -> 5000 | AL29: =IF(R3C>=RC3,RC4/12,0) -> 5000 | AM29: =IF(R3C>=RC3,RC4/12,0) -> 5000 | AN29: =IF(R3C>=RC3,RC4/12,0) -> 5000
A30: Information Architect | C30: =R1C4+RC[-1]*31 -> 2001-01-01T00:00:00.000 | D30: 0 | E30: =IF(R3C>=RC3,RC4/12,0) -> 0 | F30: =IF(R3C>=RC3,RC4/12,0) -> 0 | G30: =IF(R3C>=RC3,RC4/12,0) -> 0 | H30: =IF(R3C>=RC3,RC4/12,0) -> 0 | I30: =IF(R3C>=RC3,RC4/12,0) -> 0 | J30: =IF(R3C>=RC3,RC4/12,0) -> 0 | K30: =IF(R3C>=RC3,RC4/12,0) -> 0 | L30: =IF(R3C>=RC3,RC4/12,0) -> 0 | M30: =IF(R3C>=RC3,RC4/12,0) -> 0 | N30: =IF(R3C>=RC3,RC4/12,0) -> 0 | O30: =IF(R3C>=RC3,RC4/12,0) -> 0 | P30: =IF(R3C>=RC3,RC4/12,0) -> 0 | Q30: =IF(R3C>=RC3,RC4/12,0) -> 0 | R30: =IF(R3C>=RC3,RC4/12,0) -> 0 | S30: =IF(R3C>=RC3,RC4/12,0) -> 0 | T30: =IF(R3C>=RC3,RC4/12,0) -> 0 | U30: =IF(R3C>=RC3,RC4/12,0) -> 0 | V30: =IF(R3C>=RC3,RC4/12,0) -> 0 | W30: =IF(R3C>=RC3,RC4/12,0) -> 0 | X30: =IF(R3C>=RC3,RC4/12,0) -> 0 | Y30: =IF(R3C>=RC3,RC4/12,0) -> 0 | Z30: =IF(R3C>=RC3,RC4/12,0) -> 0 | AA30: =IF(R3C>=RC3,RC4/12,0) -> 0 | AB30: =IF(R3C>=RC3,RC4/12,0) -> 0 | AC30: =IF(R3C>=RC3,RC4/12,0) -> 0 | AD30: =IF(R3C>=RC3,RC4/12,0) -> 0 | AE30: =IF(R3C>=RC3,RC4/12,0) -> 0 | AF30: =IF(R3C>=RC3,RC4/12,0) -> 0 | AG30: =IF(R3C>=RC3,RC4/12,0) -> 0 | AH30: =IF(R3C>=RC3,RC4/12,0) -> 0 | AI30: =IF(R3C>=RC3,RC4/12,0) -> 0 | AJ30: =IF(R3C>=RC3,RC4/12,0) -> 0 | AK30: =IF(R3C>=RC3,RC4/12,0) -> 0 | AL30: =IF(R3C>=RC3,RC4/12,0) -> 0 | AM30: =IF(R3C>=RC3,RC4/12,0) -> 0 | AN30: =IF(R3C>=RC3,RC4/12,0) -> 0
A31: HTML developer | B31: 3 | C31: =R1C4+RC[-1]*31 -> 2001-04-04T00:00:00.000 | D31: 60000 | E31: =IF(R3C>=RC3,RC4/12,0) -> 0 | F31: =IF(R3C>=RC3,RC4/12,0) -> 0 | G31: =IF(R3C>=RC3,RC4/12,0) -> 0 | H31: =IF(R3C>=RC3,RC4/12,0) -> 5000 | I31: =IF(R3C>=RC3,RC4/12,0) -> 5000 | J31: =IF(R3C>=RC3,RC4/12,0) -> 5000 | K31: =IF(R3C>=RC3,RC4/12,0) -> 5000 | L31: =IF(R3C>=RC3,RC4/12,0) -> 5000 | M31: =IF(R3C>=RC3,RC4/12,0) -> 5000 | N31: =IF(R3C>=RC3,RC4/12,0) -> 5000 | O31: =IF(R3C>=RC3,RC4/12,0) -> 5000 | P31: =IF(R3C>=RC3,RC4/12,0) -> 5000 | Q31: =IF(R3C>=RC3,RC4/12,0) -> 5000 | R31: =IF(R3C>=RC3,RC4/12,0) -> 5000 | S31: =IF(R3C>=RC3,RC4/12,0) -> 5000 | T31: =IF(R3C>=RC3,RC4/12,0) -> 5000 | U31: =IF(R3C>=RC3,RC4/12,0) -> 5000 | V31: =IF(R3C>=RC3,RC4/12,0) -> 5000 | W31: =IF(R3C>=RC3,RC4/12,0) -> 5000 | X31: =IF(R3C>=RC3,RC4/12,0) -> 5000 | Y31: =IF(R3C>=RC3,RC4/12,0) -> 5000 | Z31: =IF(R3C>=RC3,RC4/12,0) -> 5000 | AA31: =IF(R3C>=RC3,RC4/12,0) -> 5000 | AB31: =IF(R3C>=RC3,RC4/12,0) -> 5000 | AC31: =IF(R3C>=RC3,RC4/12,0) -> 5000 | AD31: =IF(R3C>=RC3,RC4/12,0) -> 5000 | AE31: =IF(R3C>=RC3,RC4/12,0) -> 5000 | AF31: =IF(R3C>=RC3,RC4/12,0) -> 5000 | AG31: =IF(R3C>=RC3,RC4/12,0) -> 5000 | AH31: =IF(R3C>=RC3,RC4/12,0) -> 5000 | AI31: =IF(R3C>=RC3,RC4/12,0) -> 5000 | AJ31: =IF(R3C>=RC3,RC4/12,0) -> 5000 | AK31: =IF(R3C>=RC3,RC4/12,0) -> 5000 | AL31: =IF(R3C>=RC3,RC4/12,0) -> 5000 | AM31: =IF(R3C>=RC3,RC4/12,0) -> 5000 | AN31: =IF(R3C>=RC3,RC4/12,0) -> 5000
A32: WebMaster | B32: 6 | C32: =R1C4+RC[-1]*31 -> 2001-07-06T00:00:00.000 | D32: 60000 | E32: =IF(R3C>=RC3,RC4/12,0) -> 0 | F32: =IF(R3C>=RC3,RC4/12,0) -> 0 | G32: =IF(R3C>=RC3,RC4/12,0) -> 0 | H32: =IF(R3C>=RC3,RC4/12,0) -> 0 | I32: =IF(R3C>=RC3,RC4/12,0) -> 0 | J32: =IF(R3C>=RC3,RC4/12,0) -> 0 | K32: =IF(R3C>=RC3,RC4/12,0) -> 5000 | L32: =IF(R3C>=RC3,RC4/12,0) -> 5000 | M32: =IF(R3C>=RC3,RC4/12,0) -> 5000 | N32: =IF(R3C>=RC3,RC4/12,0) -> 5000 | O32: =IF(R3C>=RC3,RC4/12,0) -> 5000 | P32: =IF(R3C>=RC3,RC4/12,0) -> 5000 | Q32: =IF(R3C>=RC3,RC4/12,0) -> 5000 | R32: =IF(R3C>=RC3,RC4/12,0) -> 5000 | S32: =IF(R3C>=RC3,RC4/12,0) -> 5000 | T32: =IF(R3C>=RC3,RC4/12,0) -> 5000 | U32: =IF(R3C>=RC3,RC4/12,0) -> 5000 | V32: =IF(R3C>=RC3,RC4/12,0) -> 5000 | W32: =IF(R3C>=RC3,RC4/12,0) -> 5000 | X32: =IF(R3C>=RC3,RC4/12,0) -> 5000 | Y32: =IF(R3C>=RC3,RC4/12,0) -> 5000 | Z32: =IF(R3C>=RC3,RC4/12,0) -> 5000 | AA32: =IF(R3C>=RC3,RC4/12,0) -> 5000 | AB32: =IF(R3C>=RC3,RC4/12,0) -> 5000 | AC32: =IF(R3C>=RC3,RC4/12,0) -> 5000 | AD32: =IF(R3C>=RC3,RC4/12,0) -> 5000 | AE32: =IF(R3C>=RC3,RC4/12,0) -> 5000 | AF32: =IF(R3C>=RC3,RC4/12,0) -> 5000 | AG32: =IF(R3C>=RC3,RC4/12,0) -> 5000 | AH32: =IF(R3C>=RC3,RC4/12,0) -> 5000 | AI32: =IF(R3C>=RC3,RC4/12,0) -> 5000 | AJ32: =IF(R3C>=RC3,RC4/12,0) -> 5000 | AK32: =IF(R3C>=RC3,RC4/12,0) -> 5000 | AL32: =IF(R3C>=RC3,RC4/12,0) -> 5000 | AM32: =IF(R3C>=RC3,RC4/12,0) -> 5000 | AN32: =IF(R3C>=RC3,RC4/12,0) -> 5000
A33: Subtotal | D33: =SUM(R[-27]C:R[-1]C) -> 2015000 | E33: =SUM(R[-27]C:R[-1]C) -> 32083.333333333332 | F33: =SUM(R[-27]C:R[-1]C) -> 32083.333333333332 | G33: =SUM(R[-27]C:R[-1]C) -> 50833.333333333336 | H33: =SUM(R[-27]C:R[-1]C) -> 70833.333333333328 | I33: =SUM(R[-27]C:R[-1]C) -> 82083.333333333328 | J33: =SUM(R[-27]C:R[-1]C) -> 89166.666666666657 | K33: =SUM(R[-27]C:R[-1]C) -> 119166.66666666669 | L33: =SUM(R[-27]C:R[-1]C) -> 129583.33333333336 | M33: =SUM(R[-27]C:R[-1]C) -> 141250.00000000003 | N33: =SUM(R[-27]C:R[-1]C) -> 141250.00000000003 | O33: =SUM(R[-27]C:R[-1]C) -> 147916.66666666669 | P33: =SUM(R[-27]C:R[-1]C) -> 147916.66666666669 | Q33: =SUM(R[-27]C:R[-1]C) -> 154583.33333333334 | R33: =SUM(R[-27]C:R[-1]C) -> 154583.33333333334 | S33: =SUM(R[-27]C:R[-1]C) -> 161250.00000000003 | T33: =SUM(R[-27]C:R[-1]C) -> 161250.00000000003 | U33: =SUM(R[-27]C:R[-1]C) -> 167916.66666666669 | V33: =SUM(R[-27]C:R[-1]C) -> 167916.66666666669 | W33: =SUM(R[-27]C:R[-1]C) -> 167916.66666666669 | X33: =SUM(R[-27]C:R[-1]C) -> 167916.66666666669 | Y33: =SUM(R[-27]C:R[-1]C) -> 167916.66666666669 | Z33: =SUM(R[-27]C:R[-1]C) -> 167916.66666666669 | AA33: =SUM(R[-27]C:R[-1]C) -> 167916.66666666669 | AB33: =SUM(R[-27]C:R[-1]C) -> 167916.66666666669 | AC33: =SUM(R[-27]C:R[-1]C) -> 167916.66666666669 | AD33: =SUM(R[-27]C:R[-1]C) -> 167916.66666666669 | AE33: =SUM(R[-27]C:R[-1]C) -> 167916.66666666669 | AF33: =SUM(R[-27]C:R[-1]C) -> 167916.66666666669 | AG33: =SUM(R[-27]C:R[-1]C) -> 167916.66666666669 | AH33: =SUM(R[-27]C:R[-1]C) -> 167916.66666666669 | AI33: =SUM(R[-27]C:R[-1]C) -> 167916.66666666669 | AJ33: =SUM(R[-27]C:R[-1]C) -> 167916.66666666669 | AK33: =SUM(R[-27]C:R[-1]C) -> 167916.66666666669 | AL33: =SUM(R[-27]C:R[-1]C) -> 167916.66666666669 | AM33: =SUM(R[-27]C:R[-1]C) -> 167916.66666666669 | AN33: =SUM(R[-27]C:R[-1]C) -> 167916.66666666669
A34: Head Count Subtotal | E34: =COUNTIF(R[-28]C:R[-2]C, ">0") -> 4 | F34: =COUNTIF(R[-28]C:R[-2]C, ">0") -> 4 | G34: =COUNTIF(R[-28]C:R[-2]C, ">0") -> 7 | H34: =COUNTIF(R[-28]C:R[-2]C, ">0") -> 10 | I34: =COUNTIF(R[-28]C:R[-2]C, ">0") -> 12 | J34: =COUNTIF(R[-28]C:R[-2]C, ">0") -> 13 | K34: =COUNTIF(R[-28]C:R[-2]C, ">0") -> 18 | L34: =COUNTIF(R[-28]C:R[-2]C, ">0") -> 20 | M34: =COUNTIF(R[-28]C:R[-2]C, ">0") -> 22 | N34: =COUNTIF(R[-28]C:R[-2]C, ">0") -> 22 | O34: =COUNTIF(R[-28]C:R[-2]C, ">0") -> 23 | P34: =COUNTIF(R[-28]C:R[-2]C, ">0") -> 23 | Q34: =COUNTIF(R[-28]C:R[-2]C, ">0") -> 24 | R34: =COUNTIF(R[-28]C:R[-2]C, ">0") -> 24 | S34: =COUNTIF(R[-28]C:R[-2]C, ">0") -> 25 | T34: =COUNTIF(R[-28]C:R[-2]C, ">0") -> 25 | U34: =COUNTIF(R[-28]C:R[-2]C, ">0") -> 26 | V34: =COUNTIF(R[-28]C:R[-2]C, ">0") -> 26 | W34: =COUNTIF(R[-28]C:R[-2]C, ">0") -> 26 | X34: =COUNTIF(R[-28]C:R[-2]C, ">0") -> 26 | Y34: =COUNTIF(R[-28]C:R[-2]C, ">0") -> 26 | Z34: =COUNTIF(R[-28]C:R[-2]C, ">0") -> 26 | AA34: =COUNTIF(R[-28]C:R[-2]C, ">0") -> 26 | AB34: =COUNTIF(R[-28]C:R[-2]C, ">0") -> 26 | AC34: =COUNTIF(R[-28]C:R[-2]C, ">0") -> 26 | AD34: =COUNTIF(R[-28]C:R[-2]C, ">0") -> 26 | AE34: =COUNTIF(R[-28]C:R[-2]C, ">0") -> 26 | AF34: =COUNTIF(R[-28]C:R[-2]C, ">0") -> 26 | AG34: =COUNTIF(R[-28]C:R[-2]C, ">0") -> 26 | AH34: =COUNTIF(R[-28]C:R[-2]C, ">0") -> 26 | AI34: =COUNTIF(R[-28]C:R[-2]C, ">0") -> 26 | AJ34: =COUNTIF(R[-28]C:R[-2]C, ">0") -> 26 | AK34: =COUNTIF(R[-28]C:R[-2]C, ">0") -> 26 | AL34: =COUNTIF(R[-28]C:R[-2]C, ">0") -> 26 | AM34: =COUNTIF(R[-28]C:R[-2]C, ">0") -> 26 | AN34: =COUNTIF(R[-28]C:R[-2]C, ">0") -> 26
A36: BD & Marketing
A37: VP / Dir Marketing | B37: 3 | C37: =R1C4+RC[-1]*31 -> 2001-04-04T00:00:00.000 | D37: 125000 | E37: =IF(R3C>=RC3,RC4/12,0) -> 0 | F37: =IF(R3C>=RC3,RC4/12,0) -> 0 | G37: =IF(R3C>=RC3,RC4/12,0) -> 0 | H37: =IF(R3C>=RC3,RC4/12,0) -> 10416.666666666666 | I37: =IF(R3C>=RC3,RC4/12,0) -> 10416.666666666666 | J37: =IF(R3C>=RC3,RC4/12,0) -> 10416.666666666666 | K37: =IF(R3C>=RC3,RC4/12,0) -> 10416.666666666666 | L37: =IF(R3C>=RC3,RC4/12,0) -> 10416.666666666666 | M37: =IF(R3C>=RC3,RC4/12,0) -> 10416.666666666666 | N37: =IF(R3C>=RC3,RC4/12,0) -> 10416.666666666666 | O37: =IF(R3C>=RC3,RC4/12,0) -> 10416.666666666666 | P37: =IF(R3C>=RC3,RC4/12,0) -> 10416.666666666666 | Q37: =IF(R3C>=RC3,RC4/12,0) -> 10416.666666666666 | R37: =IF(R3C>=RC3,RC4/12,0) -> 10416.666666666666 | S37: =IF(R3C>=RC3,RC4/12,0) -> 10416.666666666666 | T37: =IF(R3C>=RC3,RC4/12,0) -> 10416.666666666666 | U37: =IF(R3C>=RC3,RC4/12,0) -> 10416.666666666666 | V37: =IF(R3C>=RC3,RC4/12,0) -> 10416.666666666666 | W37: =IF(R3C>=RC3,RC4/12,0) -> 10416.666666666666 | X37: =IF(R3C>=RC3,RC4/12,0) -> 10416.666666666666 | Y37: =IF(R3C>=RC3,RC4/12,0) -> 10416.666666666666 | Z37: =IF(R3C>=RC3,RC4/12,0) -> 10416.666666666666 | AA37: =IF(R3C>=RC3,RC4/12,0) -> 10416.666666666666 | AB37: =IF(R3C>=RC3,RC4/12,0) -> 10416.666666666666 | AC37: =IF(R3C>=RC3,RC4/12,0) -> 10416.666666666666 | AD37: =IF(R3C>=RC3,RC4/12,0) -> 10416.666666666666 | AE37: =IF(R3C>=RC3,RC4/12,0) -> 10416.666666666666 | AF37: =IF(R3C>=RC3,RC4/12,0) -> 10416.666666666666 | AG37: =IF(R3C>=RC3,RC4/12,0) -> 10416.666666666666 | AH37: =IF(R3C>=RC3,RC4/12,0) -> 10416.666666666666 | AI37: =IF(R3C>=RC3,RC4/12,0) -> 10416.666666666666 | AJ37: =IF(R3C>=RC3,RC4/12,0) -> 10416.666666666666 | AK37: =IF(R3C>=RC3,RC4/12,0) -> 10416.666666666666 | AL37: =IF(R3C>=RC3,RC4/12,0) -> 10416.666666666666 | AM37: =IF(R3C>=RC3,RC4/12,0) -> 10416.666666666666 | AN37: =IF(R3C>=RC3,RC4/12,0) -> 10416.666666666666
A38: VP / Dir Sales | B38: 4 | C38: =R1C4+RC[-1]*31 -> 2001-05-05T00:00:00.000 | D38: 100000 | E38: =IF(R3C>=RC3,RC4/12,0) -> 0 | F38: =IF(R3C>=RC3,RC4/12,0) -> 0 | G38: =IF(R3C>=RC3,RC4/12,0) -> 0 | H38: =IF(R3C>=RC3,RC4/12,0) -> 0 | I38: =IF(R3C>=RC3,RC4/12,0) -> 8333.3333333333339 | J38: =IF(R3C>=RC3,RC4/12,0) -> 8333.3333333333339 | K38: =IF(R3C>=RC3,RC4/12,0) -> 8333.3333333333339 | L38: =IF(R3C>=RC3,RC4/12,0) -> 8333.3333333333339 | M38: =IF(R3C>=RC3,RC4/12,0) -> 8333.3333333333339 | N38: =IF(R3C>=RC3,RC4/12,0) -> 8333.3333333333339 | O38: =IF(R3C>=RC3,RC4/12,0) -> 8333.3333333333339 | P38: =IF(R3C>=RC3,RC4/12,0) -> 8333.3333333333339 | Q38: =IF(R3C>=RC3,RC4/12,0) -> 8333.3333333333339 | R38: =IF(R3C>=RC3,RC4/12,0) -> 8333.3333333333339 | S38: =IF(R3C>=RC3,RC4/12,0) -> 8333.3333333333339 | T38: =IF(R3C>=RC3,RC4/12,0) -> 8333.3333333333339 | U38: =IF(R3C>=RC3,RC4/12,0) -> 8333.3333333333339 | V38: =IF(R3C>=RC3,RC4/12,0) -> 8333.3333333333339 | W38: =IF(R3C>=RC3,RC4/12,0) -> 8333.3333333333339 | X38: =IF(R3C>=RC3,RC4/12,0) -> 8333.3333333333339 | Y38: =IF(R3C>=RC3,RC4/12,0) -> 8333.3333333333339 | Z38: =IF(R3C>=RC3,RC4/12,0) -> 8333.3333333333339 | AA38: =IF(R3C>=RC3,RC4/12,0) -> 8333.3333333333339 | AB38: =IF(R3C>=RC3,RC4/12,0) -> 8333.3333333333339 | AC38: =IF(R3C>=RC3,RC4/12,0) -> 8333.3333333333339 | AD38: =IF(R3C>=RC3,RC4/12,0) -> 8333.3333333333339 | AE38: =IF(R3C>=RC3,RC4/12,0) -> 8333.3333333333339 | AF38: =IF(R3C>=RC3,RC4/12,0) -> 8333.3333333333339 | AG38: =IF(R3C>=RC3,RC4/12,0) -> 8333.3333333333339 | AH38: =IF(R3C>=RC3,RC4/12,0) -> 8333.3333333333339 | AI38: =IF(R3C>=RC3,RC4/12,0) -> 8333.3333333333339 | AJ38: =IF(R3C>=RC3,RC4/12,0) -> 8333.3333333333339 | AK38: =IF(R3C>=RC3,RC4/12,0) -> 8333.3333333333339 | AL38: =IF(R3C>=RC3,RC4/12,0) -> 8333.3333333333339 | AM38: =IF(R3C>=RC3,RC4/12,0) -> 8333.3333333333339 | AN38: =IF(R3C>=RC3,RC4/12,0) -> 8333.3333333333339
A39: Biz Dev | B39: 1 | C39: =R1C4+RC[-1]*31 -> 2001-02-01T00:00:00.000 | D39: 75000 | E39: =IF(R3C>=RC3,RC4/12,0) -> 0 | F39: =IF(R3C>=RC3,RC4/12,0) -> 6250 | G39: =IF(R3C>=RC3,RC4/12,0) -> 6250 | H39: =IF(R3C>=RC3,RC4/12,0) -> 6250 | I39: =IF(R3C>=RC3,RC4/12,0) -> 6250 | J39: =IF(R3C>=RC3,RC4/12,0) -> 6250 | K39: =IF(R3C>=RC3,RC4/12,0) -> 6250 | L39: =IF(R3C>=RC3,RC4/12,0) -> 6250 | M39: =IF(R3C>=RC3,RC4/12,0) -> 6250 | N39: =IF(R3C>=RC3,RC4/12,0) -> 6250 | O39: =IF(R3C>=RC3,RC4/12,0) -> 6250 | P39: =IF(R3C>=RC3,RC4/12,0) -> 6250 | Q39: =IF(R3C>=RC3,RC4/12,0) -> 6250 | R39: =IF(R3C>=RC3,RC4/12,0) -> 6250 | S39: =IF(R3C>=RC3,RC4/12,0) -> 6250 | T39: =IF(R3C>=RC3,RC4/12,0) -> 6250 | U39: =IF(R3C>=RC3,RC4/12,0) -> 6250 | V39: =IF(R3C>=RC3,RC4/12,0) -> 6250 | W39: =IF(R3C>=RC3,RC4/12,0) -> 6250 | X39: =IF(R3C>=RC3,RC4/12,0) -> 6250 | Y39: =IF(R3C>=RC3,RC4/12,0) -> 6250 | Z39: =IF(R3C>=RC3,RC4/12,0) -> 6250 | AA39: =IF(R3C>=RC3,RC4/12,0) -> 6250 | AB39: =IF(R3C>=RC3,RC4/12,0) -> 6250 | AC39: =IF(R3C>=RC3,RC4/12,0) -> 6250 | AD39: =IF(R3C>=RC3,RC4/12,0) -> 6250 | AE39: =IF(R3C>=RC3,RC4/12,0) -> 6250 | AF39: =IF(R3C>=RC3,RC4/12,0) -> 6250 | AG39: =IF(R3C>=RC3,RC4/12,0) -> 6250 | AH39: =IF(R3C>=RC3,RC4/12,0) -> 6250 | AI39: =IF(R3C>=RC3,RC4/12,0) -> 6250 | AJ39: =IF(R3C>=RC3,RC4/12,0) -> 6250 | AK39: =IF(R3C>=RC3,RC4/12,0) -> 6250 | AL39: =IF(R3C>=RC3,RC4/12,0) -> 6250 | AM39: =IF(R3C>=RC3,RC4/12,0) -> 6250 | AN39: =IF(R3C>=RC3,RC4/12,0) -> 6250
A40: Sales | B40: 6 | C40: =R1C4+RC[-1]*31 -> 2001-07-06T00:00:00.000 | D40: 75000 | E40: =IF(R3C>=RC3,RC4/12,0) -> 0 | F40: =IF(R3C>=RC3,RC4/12,0) -> 0 | G40: =IF(R3C>=RC3,RC4/12,0) -> 0 | H40: =IF(R3C>=RC3,RC4/12,0) -> 0 | I40: =IF(R3C>=RC3,RC4/12,0) -> 0 | J40: =IF(R3C>=RC3,RC4/12,0) -> 0 | K40: =IF(R3C>=RC3,RC4/12,0) -> 6250 | L40: =IF(R3C>=RC3,RC4/12,0) -> 6250 | M40: =IF(R3C>=RC3,RC4/12,0) -> 6250 | N40: =IF(R3C>=RC3,RC4/12,0) -> 6250 | O40: =IF(R3C>=RC3,RC4/12,0) -> 6250 | P40: =IF(R3C>=RC3,RC4/12,0) -> 6250 | Q40: =IF(R3C>=RC3,RC4/12,0) -> 6250 | R40: =IF(R3C>=RC3,RC4/12,0) -> 6250 | S40: =IF(R3C>=RC3,RC4/12,0) -> 6250 | T40: =IF(R3C>=RC3,RC4/12,0) -> 6250 | U40: =IF(R3C>=RC3,RC4/12,0) -> 6250 | V40: =IF(R3C>=RC3,RC4/12,0) -> 6250 | W40: =IF(R3C>=RC3,RC4/12,0) -> 6250 | X40: =IF(R3C>=RC3,RC4/12,0) -> 6250 | Y40: =IF(R3C>=RC3,RC4/12,0) -> 6250 | Z40: =IF(R3C>=RC3,RC4/12,0) -> 6250 | AA40: =IF(R3C>=RC3,RC4/12,0) -> 6250 | AB40: =IF(R3C>=RC3,RC4/12,0) -> 6250 | AC40: =IF(R3C>=RC3,RC4/12,0) -> 6250 | AD40: =IF(R3C>=RC3,RC4/12,0) -> 6250 | AE40: =IF(R3C>=RC3,RC4/12,0) -> 6250 | AF40: =IF(R3C>=RC3,RC4/12,0) -> 6250 | AG40: =IF(R3C>=RC3,RC4/12,0) -> 6250 | AH40: =IF(R3C>=RC3,RC4/12,0) -> 6250 | AI40: =IF(R3C>=RC3,RC4/12,0) -> 6250 | AJ40: =IF(R3C>=RC3,RC4/12,0) -> 6250 | AK40: =IF(R3C>=RC3,RC4/12,0) -> 6250 | AL40: =IF(R3C>=RC3,RC4/12,0) -> 6250 | AM40: =IF(R3C>=RC3,RC4/12,0) -> 6250 | AN40: =IF(R3C>=RC3,RC4/12,0) -> 6250
A41: Sales | B41: 7 | C41: =R1C4+RC[-1]*31 -> 2001-08-06T00:00:00.000 | D41: 75000 | E41: =IF(R3C>=RC3,RC4/12,0) -> 0 | F41: =IF(R3C>=RC3,RC4/12,0) -> 0 | G41: =IF(R3C>=RC3,RC4/12,0) -> 0 | H41: =IF(R3C>=RC3,RC4/12,0) -> 0 | I41: =IF(R3C>=RC3,RC4/12,0) -> 0 | J41: =IF(R3C>=RC3,RC4/12,0) -> 0 | K41: =IF(R3C>=RC3,RC4/12,0) -> 0 | L41: =IF(R3C>=RC3,RC4/12,0) -> 6250 | M41: =IF(R3C>=RC3,RC4/12,0) -> 6250 | N41: =IF(R3C>=RC3,RC4/12,0) -> 6250 | O41: =IF(R3C>=RC3,RC4/12,0) -> 6250 | P41: =IF(R3C>=RC3,RC4/12,0) -> 6250 | Q41: =IF(R3C>=RC3,RC4/12,0) -> 6250 | R41: =IF(R3C>=RC3,RC4/12,0) -> 6250 | S41: =IF(R3C>=RC3,RC4/12,0) -> 6250 | T41: =IF(R3C>=RC3,RC4/12,0) -> 6250 | U41: =IF(R3C>=RC3,RC4/12,0) -> 6250 | V41: =IF(R3C>=RC3,RC4/12,0) -> 6250 | W41: =IF(R3C>=RC3,RC4/12,0) -> 6250 | X41: =IF(R3C>=RC3,RC4/12,0) -> 6250 | Y41: =IF(R3C>=RC3,RC4/12,0) -> 6250 | Z41: =IF(R3C>=RC3,RC4/12,0) -> 6250 | AA41: =IF(R3C>=RC3,RC4/12,0) -> 6250 | AB41: =IF(R3C>=RC3,RC4/12,0) -> 6250 | AC41: =IF(R3C>=RC3,RC4/12,0) -> 6250 | AD41: =IF(R3C>=RC3,RC4/12,0) -> 6250 | AE41: =IF(R3C>=RC3,RC4/12,0) -> 6250 | AF41: =IF(R3C>=RC3,RC4/12,0) -> 6250 | AG41: =IF(R3C>=RC3,RC4/12,0) -> 6250 | AH41: =IF(R3C>=RC3,RC4/12,0) -> 6250 | AI41: =IF(R3C>=RC3,RC4/12,0) -> 6250 | AJ41: =IF(R3C>=RC3,RC4/12,0) -> 6250 | AK41: =IF(R3C>=RC3,RC4/12,0) -> 6250 | AL41: =IF(R3C>=RC3,RC4/12,0) -> 6250 | AM41: =IF(R3C>=RC3,RC4/12,0) -> 6250 | AN41: =IF(R3C>=RC3,RC4/12,0) -> 6250
A42: Sales | B42: 8 | C42: =R1C4+RC[-1]*31 -> 2001-09-06T00:00:00.000 | D42: 75000 | E42: =IF(R3C>=RC3,RC4/12,0) -> 0 | F42: =IF(R3C>=RC3,RC4/12,0) -> 0 | G42: =IF(R3C>=RC3,RC4/12,0) -> 0 | H42: =IF(R3C>=RC3,RC4/12,0) -> 0 | I42: =IF(R3C>=RC3,RC4/12,0) -> 0 | J42: =IF(R3C>=RC3,RC4/12,0) -> 0 | K42: =IF(R3C>=RC3,RC4/12,0) -> 0 | L42: =IF(R3C>=RC3,RC4/12,0) -> 0 | M42: =IF(R3C>=RC3,RC4/12,0) -> 6250 | N42: =IF(R3C>=RC3,RC4/12,0) -> 6250 | O42: =IF(R3C>=RC3,RC4/12,0) -> 6250 | P42: =IF(R3C>=RC3,RC4/12,0) -> 6250 | Q42: =IF(R3C>=RC3,RC4/12,0) -> 6250 | R42: =IF(R3C>=RC3,RC4/12,0) -> 6250 | S42: =IF(R3C>=RC3,RC4/12,0) -> 6250 | T42: =IF(R3C>=RC3,RC4/12,0) -> 6250 | U42: =IF(R3C>=RC3,RC4/12,0) -> 6250 | V42: =IF(R3C>=RC3,RC4/12,0) -> 6250 | W42: =IF(R3C>=RC3,RC4/12,0) -> 6250 | X42: =IF(R3C>=RC3,RC4/12,0) -> 6250 | Y42: =IF(R3C>=RC3,RC4/12,0) -> 6250 | Z42: =IF(R3C>=RC3,RC4/12,0) -> 6250 | AA42: =IF(R3C>=RC3,RC4/12,0) -> 6250 | AB42: =IF(R3C>=RC3,RC4/12,0) -> 6250 | AC42: =IF(R3C>=RC3,RC4/12,0) -> 6250 | AD42: =IF(R3C>=RC3,RC4/12,0) -> 6250 | AE42: =IF(R3C>=RC3,RC4/12,0) -> 6250 | AF42: =IF(R3C>=RC3,RC4/12,0) -> 6250 | AG42: =IF(R3C>=RC3,RC4/12,0) -> 6250 | AH42: =IF(R3C>=RC3,RC4/12,0) -> 6250 | AI42: =IF(R3C>=RC3,RC4/12,0) -> 6250 | AJ42: =IF(R3C>=RC3,RC4/12,0) -> 6250 | AK42: =IF(R3C>=RC3,RC4/12,0) -> 6250 | AL42: =IF(R3C>=RC3,RC4/12,0) -> 6250 | AM42: =IF(R3C>=RC3,RC4/12,0) -> 6250 | AN42: =IF(R3C>=RC3,RC4/12,0) -> 6250
A43: Marketing | B43: 4 | C43: =R1C4+RC[-1]*31 -> 2001-05-05T00:00:00.000 | D43: 70000 | E43: =IF(R3C>=RC3,RC4/12,0) -> 0 | F43: =IF(R3C>=RC3,RC4/12,0) -> 0 | G43: =IF(R3C>=RC3,RC4/12,0) -> 0 | H43: =IF(R3C>=RC3,RC4/12,0) -> 0 | I43: =IF(R3C>=RC3,RC4/12,0) -> 5833.333333333333 | J43: =IF(R3C>=RC3,RC4/12,0) -> 5833.333333333333 | K43: =IF(R3C>=RC3,RC4/12,0) -> 5833.333333333333 | L43: =IF(R3C>=RC3,RC4/12,0) -> 5833.333333333333 | M43: =IF(R3C>=RC3,RC4/12,0) -> 5833.333333333333 | N43: =IF(R3C>=RC3,RC4/12,0) -> 5833.333333333333 | O43: =IF(R3C>=RC3,RC4/12,0) -> 5833.333333333333 | P43: =IF(R3C>=RC3,RC4/12,0) -> 5833.333333333333 | Q43: =IF(R3C>=RC3,RC4/12,0) -> 5833.333333333333 | R43: =IF(R3C>=RC3,RC4/12,0) -> 5833.333333333333 | S43: =IF(R3C>=RC3,RC4/12,0) -> 5833.333333333333 | T43: =IF(R3C>=RC3,RC4/12,0) -> 5833.333333333333 | U43: =IF(R3C>=RC3,RC4/12,0) -> 5833.333333333333 | V43: =IF(R3C>=RC3,RC4/12,0) -> 5833.333333333333 | W43: =IF(R3C>=RC3,RC4/12,0) -> 5833.333333333333 | X43: =IF(R3C>=RC3,RC4/12,0) -> 5833.333333333333 | Y43: =IF(R3C>=RC3,RC4/12,0) -> 5833.333333333333 | Z43: =IF(R3C>=RC3,RC4/12,0) -> 5833.333333333333 | AA43: =IF(R3C>=RC3,RC4/12,0) -> 5833.333333333333 | AB43: =IF(R3C>=RC3,RC4/12,0) -> 5833.333333333333 | AC43: =IF(R3C>=RC3,RC4/12,0) -> 5833.333333333333 | AD43: =IF(R3C>=RC3,RC4/12,0) -> 5833.333333333333 | AE43: =IF(R3C>=RC3,RC4/12,0) -> 5833.333333333333 | AF43: =IF(R3C>=RC3,RC4/12,0) -> 5833.333333333333 | AG43: =IF(R3C>=RC3,RC4/12,0) -> 5833.333333333333 | AH43: =IF(R3C>=RC3,RC4/12,0) -> 5833.333333333333 | AI43: =IF(R3C>=RC3,RC4/12,0) -> 5833.333333333333 | AJ43: =IF(R3C>=RC3,RC4/12,0) -> 5833.333333333333 | AK43: =IF(R3C>=RC3,RC4/12,0) -> 5833.333333333333 | AL43: =IF(R3C>=RC3,RC4/12,0) -> 5833.333333333333 | AM43: =IF(R3C>=RC3,RC4/12,0) -> 5833.333333333333 | AN43: =IF(R3C>=RC3,RC4/12,0) -> 5833.333333333333
A44: Subtotal | D44: =SUM(R[-7]C:R[-1]C) -> 595000 | E44: =SUM(R[-7]C:R[-1]C) -> 0 | F44: =SUM(R[-7]C:R[-1]C) -> 6250 | G44: =SUM(R[-7]C:R[-1]C) -> 6250 | H44: =SUM(R[-7]C:R[-1]C) -> 16666.666666666664 | I44: =SUM(R[-7]C:R[-1]C) -> 30833.333333333332 | J44: =SUM(R[-7]C:R[-1]C) -> 30833.333333333332 | K44: =SUM(R[-7]C:R[-1]C) -> 37083.333333333336 | L44: =SUM(R[-7]C:R[-1]C) -> 43333.333333333336 | M44: =SUM(R[-7]C:R[-1]C) -> 49583.333333333336 | N44: =SUM(R[-7]C:R[-1]C) -> 49583.333333333336 | O44: =SUM(R[-7]C:R[-1]C) -> 49583.333333333336 | P44: =SUM(R[-7]C:R[-1]C) -> 49583.333333333336 | Q44: =SUM(R[-7]C:R[-1]C) -> 49583.333333333336 | R44: =SUM(R[-7]C:R[-1]C) -> 49583.333333333336 | S44: =SUM(R[-7]C:R[-1]C) -> 49583.333333333336 | T44: =SUM(R[-7]C:R[-1]C) -> 49583.333333333336 | U44: =SUM(R[-7]C:R[-1]C) -> 49583.333333333336 | V44: =SUM(R[-7]C:R[-1]C) -> 49583.333333333336 | W44: =SUM(R[-7]C:R[-1]C) -> 49583.333333333336 | X44: =SUM(R[-7]C:R[-1]C) -> 49583.333333333336 | Y44: =SUM(R[-7]C:R[-1]C) -> 49583.333333333336 | Z44: =SUM(R[-7]C:R[-1]C) -> 49583.333333333336 | AA44: =SUM(R[-7]C:R[-1]C) -> 49583.333333333336 | AB44: =SUM(R[-7]C:R[-1]C) -> 49583.333333333336 | AC44: =SUM(R[-7]C:R[-1]C) -> 49583.333333333336 | AD44: =SUM(R[-7]C:R[-1]C) -> 49583.333333333336 | AE44: =SUM(R[-7]C:R[-1]C) -> 49583.333333333336 | AF44: =SUM(R[-7]C:R[-1]C) -> 49583.333333333336 | AG44: =SUM(R[-7]C:R[-1]C) -> 49583.333333333336 | AH44: =SUM(R[-7]C:R[-1]C) -> 49583.333333333336 | AI44: =SUM(R[-7]C:R[-1]C) -> 49583.333333333336 | AJ44: =SUM(R[-7]C:R[-1]C) -> 49583.333333333336 | AK44: =SUM(R[-7]C:R[-1]C) -> 49583.333333333336 | AL44: =SUM(R[-7]C:R[-1]C) -> 49583.333333333336 | AM44: =SUM(R[-7]C:R[-1]C) -> 49583.333333333336 | AN44: =SUM(R[-7]C:R[-1]C) -> 49583.333333333336
A45: Head Count Subtotal | E45: =COUNTIF(R[-8]C:R[-2]C, ">0") -> 0 | F45: =COUNTIF(R[-8]C:R[-2]C, ">0") -> 1 | G45: =COUNTIF(R[-8]C:R[-2]C, ">0") -> 1 | H45: =COUNTIF(R[-8]C:R[-2]C, ">0") -> 2 | I45: =COUNTIF(R[-8]C:R[-2]C, ">0") -> 4 | J45: =COUNTIF(R[-8]C:R[-2]C, ">0") -> 4 | K45: =COUNTIF(R[-8]C:R[-2]C, ">0") -> 5 | L45: =COUNTIF(R[-8]C:R[-2]C, ">0") -> 6 | M45: =COUNTIF(R[-8]C:R[-2]C, ">0") -> 7 | N45: =COUNTIF(R[-8]C:R[-2]C, ">0") -> 7 | O45: =COUNTIF(R[-8]C:R[-2]C, ">0") -> 7 | P45: =COUNTIF(R[-8]C:R[-2]C, ">0") -> 7 | Q45: =COUNTIF(R[-8]C:R[-2]C, ">0") -> 7 | R45: =COUNTIF(R[-8]C:R[-2]C, ">0") -> 7 | S45: =COUNTIF(R[-8]C:R[-2]C, ">0") -> 7 | T45: =COUNTIF(R[-8]C:R[-2]C, ">0") -> 7 | U45: =COUNTIF(R[-8]C:R[-2]C, ">0") -> 7 | V45: =COUNTIF(R[-8]C:R[-2]C, ">0") -> 7 | W45: =COUNTIF(R[-8]C:R[-2]C, ">0") -> 7 | X45: =COUNTIF(R[-8]C:R[-2]C, ">0") -> 7 | Y45: =COUNTIF(R[-8]C:R[-2]C, ">0") -> 7 | Z45: =COUNTIF(R[-8]C:R[-2]C, ">0") -> 7 | AA45: =COUNTIF(R[-8]C:R[-2]C, ">0") -> 7 | AB45: =COUNTIF(R[-8]C:R[-2]C, ">0") -> 7 | AC45: =COUNTIF(R[-8]C:R[-2]C, ">0") -> 7 | AD45: =COUNTIF(R[-8]C:R[-2]C, ">0") -> 7 | AE45: =COUNTIF(R[-8]C:R[-2]C, ">0") -> 7 | AF45: =COUNTIF(R[-8]C:R[-2]C, ">0") -> 7 | AG45: =COUNTIF(R[-8]C:R[-2]C, ">0") -> 7 | AH45: =COUNTIF(R[-8]C:R[-2]C, ">0") -> 7 | AI45: =COUNTIF(R[-8]C:R[-2]C, ">0") -> 7 | AJ45: =COUNTIF(R[-8]C:R[-2]C, ">0") -> 7 | AK45: =COUNTIF(R[-8]C:R[-2]C, ">0") -> 7 | AL45: =COUNTIF(R[-8]C:R[-2]C, ">0") -> 7 | AM45: =COUNTIF(R[-8]C:R[-2]C, ">0") -> 7 | AN45: =COUNTIF(R[-8]C:R[-2]C, ">0") -> 7
A47: Finance & Admin
A48: CEO | B48: 0 | C48: =R1C4+RC[-1]*31 -> 2001-01-01T00:00:00.000 | D48: 150000 | E48: =IF(R3C>=RC3,RC4/12,0) -> 12500 | F48: =IF(R3C>=RC3,RC4/12,0) -> 12500 | G48: =IF(R3C>=RC3,RC4/12,0) -> 12500 | H48: =IF(R3C>=RC3,RC4/12,0) -> 12500 | I48: =IF(R3C>=RC3,RC4/12,0) -> 12500 | J48: =IF(R3C>=RC3,RC4/12,0) -> 12500 | K48: =IF(R3C>=RC3,RC4/12,0) -> 12500 | L48: =IF(R3C>=RC3,RC4/12,0) -> 12500 | M48: =IF(R3C>=RC3,RC4/12,0) -> 12500 | N48: =IF(R3C>=RC3,RC4/12,0) -> 12500 | O48: =IF(R3C>=RC3,RC4/12,0) -> 12500 | P48: =IF(R3C>=RC3,RC4/12,0) -> 12500 | Q48: =IF(R3C>=RC3,RC4/12,0) -> 12500 | R48: =IF(R3C>=RC3,RC4/12,0) -> 12500 | S48: =IF(R3C>=RC3,RC4/12,0) -> 12500 | T48: =IF(R3C>=RC3,RC4/12,0) -> 12500 | U48: =IF(R3C>=RC3,RC4/12,0) -> 12500 | V48: =IF(R3C>=RC3,RC4/12,0) -> 12500 | W48: =IF(R3C>=RC3,RC4/12,0) -> 12500 | X48: =IF(R3C>=RC3,RC4/12,0) -> 12500 | Y48: =IF(R3C>=RC3,RC4/12,0) -> 12500 | Z48: =IF(R3C>=RC3,RC4/12,0) -> 12500 | AA48: =IF(R3C>=RC3,RC4/12,0) -> 12500 | AB48: =IF(R3C>=RC3,RC4/12,0) -> 12500 | AC48: =IF(R3C>=RC3,RC4/12,0) -> 12500 | AD48: =IF(R3C>=RC3,RC4/12,0) -> 12500 | AE48: =IF(R3C>=RC3,RC4/12,0) -> 12500 | AF48: =IF(R3C>=RC3,RC4/12,0) -> 12500 | AG48: =IF(R3C>=RC3,RC4/12,0) -> 12500 | AH48: =IF(R3C>=RC3,RC4/12,0) -> 12500 | AI48: =IF(R3C>=RC3,RC4/12,0) -> 12500 | AJ48: =IF(R3C>=RC3,RC4/12,0) -> 12500 | AK48: =IF(R3C>=RC3,RC4/12,0) -> 12500 | AL48: =IF(R3C>=RC3,RC4/12,0) -> 12500 | AM48: =IF(R3C>=RC3,RC4/12,0) -> 12500 | AN48: =IF(R3C>=RC3,RC4/12,0) -> 12500
A49: CFO | B49: 12 | C49: =R1C4+RC[-1]*31 -> 2002-01-08T00:00:00.000 | D49: 125000 | E49: =IF(R3C>=RC3,RC4/12,0) -> 0 | F49: =IF(R3C>=RC3,RC4/12,0) -> 0 | G49: =IF(R3C>=RC3,RC4/12,0) -> 0 | H49: =IF(R3C>=RC3,RC4/12,0) -> 0 | I49: =IF(R3C>=RC3,RC4/12,0) -> 0 | J49: =IF(R3C>=RC3,RC4/12,0) -> 0 | K49: =IF(R3C>=RC3,RC4/12,0) -> 0 | L49: =IF(R3C>=RC3,RC4/12,0) -> 0 | M49: =IF(R3C>=RC3,RC4/12,0) -> 0 | N49: =IF(R3C>=RC3,RC4/12,0) -> 0 | O49: =IF(R3C>=RC3,RC4/12,0) -> 0 | P49: =IF(R3C>=RC3,RC4/12,0) -> 0 | Q49: =IF(R3C>=RC3,RC4/12,0) -> 10416.666666666666 | R49: =IF(R3C>=RC3,RC4/12,0) -> 10416.666666666666 | S49: =IF(R3C>=RC3,RC4/12,0) -> 10416.666666666666 | T49: =IF(R3C>=RC3,RC4/12,0) -> 10416.666666666666 | U49: =IF(R3C>=RC3,RC4/12,0) -> 10416.666666666666 | V49: =IF(R3C>=RC3,RC4/12,0) -> 10416.666666666666 | W49: =IF(R3C>=RC3,RC4/12,0) -> 10416.666666666666 | X49: =IF(R3C>=RC3,RC4/12,0) -> 10416.666666666666 | Y49: =IF(R3C>=RC3,RC4/12,0) -> 10416.666666666666 | Z49: =IF(R3C>=RC3,RC4/12,0) -> 10416.666666666666 | AA49: =IF(R3C>=RC3,RC4/12,0) -> 10416.666666666666 | AB49: =IF(R3C>=RC3,RC4/12,0) -> 10416.666666666666 | AC49: =IF(R3C>=RC3,RC4/12,0) -> 10416.666666666666 | AD49: =IF(R3C>=RC3,RC4/12,0) -> 10416.666666666666 | AE49: =IF(R3C>=RC3,RC4/12,0) -> 10416.666666666666 | AF49: =IF(R3C>=RC3,RC4/12,0) -> 10416.666666666666 | AG49: =IF(R3C>=RC3,RC4/12,0) -> 10416.666666666666 | AH49: =IF(R3C>=RC3,RC4/12,0) -> 10416.666666666666 | AI49: =IF(R3C>=RC3,RC4/12,0) -> 10416.666666666666 | AJ49: =IF(R3C>=RC3,RC4/12,0) -> 10416.666666666666 | AK49: =IF(R3C>=RC3,RC4/12,0) -> 10416.666666666666 | AL49: =IF(R3C>=RC3,RC4/12,0) -> 10416.666666666666 | AM49: =IF(R3C>=RC3,RC4/12,0) -> 10416.666666666666 | AN49: =IF(R3C>=RC3,RC4/12,0) -> 10416.666666666666
A50: Controller | B50: 6 | C50: =R1C4+RC[-1]*31 -> 2001-07-06T00:00:00.000 | D50: 70000 | E50: =IF(R3C>=RC3,RC4/12,0) -> 0 | F50: =IF(R3C>=RC3,RC4/12,0) -> 0 | G50: =IF(R3C>=RC3,RC4/12,0) -> 0 | H50: =IF(R3C>=RC3,RC4/12,0) -> 0 | I50: =IF(R3C>=RC3,RC4/12,0) -> 0 | J50: =IF(R3C>=RC3,RC4/12,0) -> 0 | K50: =IF(R3C>=RC3,RC4/12,0) -> 5833.333333333333 | L50: =IF(R3C>=RC3,RC4/12,0) -> 5833.333333333333 | M50: =IF(R3C>=RC3,RC4/12,0) -> 5833.333333333333 | N50: =IF(R3C>=RC3,RC4/12,0) -> 5833.333333333333 | O50: =IF(R3C>=RC3,RC4/12,0) -> 5833.333333333333 | P50: =IF(R3C>=RC3,RC4/12,0) -> 5833.333333333333 | Q50: =IF(R3C>=RC3,RC4/12,0) -> 5833.333333333333 | R50: =IF(R3C>=RC3,RC4/12,0) -> 5833.333333333333 | S50: =IF(R3C>=RC3,RC4/12,0) -> 5833.333333333333 | T50: =IF(R3C>=RC3,RC4/12,0) -> 5833.333333333333 | U50: =IF(R3C>=RC3,RC4/12,0) -> 5833.333333333333 | V50: =IF(R3C>=RC3,RC4/12,0) -> 5833.333333333333 | W50: =IF(R3C>=RC3,RC4/12,0) -> 5833.333333333333 | X50: =IF(R3C>=RC3,RC4/12,0) -> 5833.333333333333 | Y50: =IF(R3C>=RC3,RC4/12,0) -> 5833.333333333333 | Z50: =IF(R3C>=RC3,RC4/12,0) -> 5833.333333333333 | AA50: =IF(R3C>=RC3,RC4/12,0) -> 5833.333333333333 | AB50: =IF(R3C>=RC3,RC4/12,0) -> 5833.333333333333 | AC50: =IF(R3C>=RC3,RC4/12,0) -> 5833.333333333333 | AD50: =IF(R3C>=RC3,RC4/12,0) -> 5833.333333333333 | AE50: =IF(R3C>=RC3,RC4/12,0) -> 5833.333333333333 | AF50: =IF(R3C>=RC3,RC4/12,0) -> 5833.333333333333 | AG50: =IF(R3C>=RC3,RC4/12,0) -> 5833.333333333333 | AH50: =IF(R3C>=RC3,RC4/12,0) -> 5833.333333333333 | AI50: =IF(R3C>=RC3,RC4/12,0) -> 5833.333333333333 | AJ50: =IF(R3C>=RC3,RC4/12,0) -> 5833.333333333333 | AK50: =IF(R3C>=RC3,RC4/12,0) -> 5833.333333333333 | AL50: =IF(R3C>=RC3,RC4/12,0) -> 5833.333333333333 | AM50: =IF(R3C>=RC3,RC4/12,0) -> 5833.333333333333 | AN50: =IF(R3C>=RC3,RC4/12,0) -> 5833.333333333333
A51: Clerk | B51: 12 | C51: =R1C4+RC[-1]*31 -> 2002-01-08T00:00:00.000 | D51: 40000 | E51: =IF(R3C>=RC3,RC4/12,0) -> 0 | F51: =IF(R3C>=RC3,RC4/12,0) -> 0 | G51: =IF(R3C>=RC3,RC4/12,0) -> 0 | H51: =IF(R3C>=RC3,RC4/12,0) -> 0 | I51: =IF(R3C>=RC3,RC4/12,0) -> 0 | J51: =IF(R3C>=RC3,RC4/12,0) -> 0 | K51: =IF(R3C>=RC3,RC4/12,0) -> 0 | L51: =IF(R3C>=RC3,RC4/12,0) -> 0 | M51: =IF(R3C>=RC3,RC4/12,0) -> 0 | N51: =IF(R3C>=RC3,RC4/12,0) -> 0 | O51: =IF(R3C>=RC3,RC4/12,0) -> 0 | P51: =IF(R3C>=RC3,RC4/12,0) -> 0 | Q51: =IF(R3C>=RC3,RC4/12,0) -> 3333.3333333333335 | R51: =IF(R3C>=RC3,RC4/12,0) -> 3333.3333333333335 | S51: =IF(R3C>=RC3,RC4/12,0) -> 3333.3333333333335 | T51: =IF(R3C>=RC3,RC4/12,0) -> 3333.3333333333335 | U51: =IF(R3C>=RC3,RC4/12,0) -> 3333.3333333333335 | V51: =IF(R3C>=RC3,RC4/12,0) -> 3333.3333333333335 | W51: =IF(R3C>=RC3,RC4/12,0) -> 3333.3333333333335 | X51: =IF(R3C>=RC3,RC4/12,0) -> 3333.3333333333335 | Y51: =IF(R3C>=RC3,RC4/12,0) -> 3333.3333333333335 | Z51: =IF(R3C>=RC3,RC4/12,0) -> 3333.3333333333335 | AA51: =IF(R3C>=RC3,RC4/12,0) -> 3333.3333333333335 | AB51: =IF(R3C>=RC3,RC4/12,0) -> 3333.3333333333335 | AC51: =IF(R3C>=RC3,RC4/12,0) -> 3333.3333333333335 | AD51: =IF(R3C>=RC3,RC4/12,0) -> 3333.3333333333335 | AE51: =IF(R3C>=RC3,RC4/12,0) -> 3333.3333333333335 | AF51: =IF(R3C>=RC3,RC4/12,0) -> 3333.3333333333335 | AG51: =IF(R3C>=RC3,RC4/12,0) -> 3333.3333333333335 | AH51: =IF(R3C>=RC3,RC4/12,0) -> 3333.3333333333335 | AI51: =IF(R3C>=RC3,RC4/12,0) -> 3333.3333333333335 | AJ51: =IF(R3C>=RC3,RC4/12,0) -> 3333.3333333333335 | AK51: =IF(R3C>=RC3,RC4/12,0) -> 3333.3333333333335 | AL51: =IF(R3C>=RC3,RC4/12,0) -> 3333.3333333333335 | AM51: =IF(R3C>=RC3,RC4/12,0) -> 3333.3333333333335 | AN51: =IF(R3C>=RC3,RC4/12,0) -> 3333.3333333333335
A52: Admin | B52: 0 | C52: =R1C4+RC[-1]*31 -> 2001-01-01T00:00:00.000 | D52: 40000 | E52: =IF(R3C>=RC3,RC4/12,0) -> 3333.3333333333335 | F52: =IF(R3C>=RC3,RC4/12,0) -> 3333.3333333333335 | G52: =IF(R3C>=RC3,RC4/12,0) -> 3333.3333333333335 | H52: =IF(R3C>=RC3,RC4/12,0) -> 3333.3333333333335 | I52: =IF(R3C>=RC3,RC4/12,0) -> 3333.3333333333335 | J52: =IF(R3C>=RC3,RC4/12,0) -> 3333.3333333333335 | K52: =IF(R3C>=RC3,RC4/12,0) -> 3333.3333333333335 | L52: =IF(R3C>=RC3,RC4/12,0) -> 3333.3333333333335 | M52: =IF(R3C>=RC3,RC4/12,0) -> 3333.3333333333335 | N52: =IF(R3C>=RC3,RC4/12,0) -> 3333.3333333333335 | O52: =IF(R3C>=RC3,RC4/12,0) -> 3333.3333333333335 | P52: =IF(R3C>=RC3,RC4/12,0) -> 3333.3333333333335 | Q52: =IF(R3C>=RC3,RC4/12,0) -> 3333.3333333333335 | R52: =IF(R3C>=RC3,RC4/12,0) -> 3333.3333333333335 | S52: =IF(R3C>=RC3,RC4/12,0) -> 3333.3333333333335 | T52: =IF(R3C>=RC3,RC4/12,0) -> 3333.3333333333335 | U52: =IF(R3C>=RC3,RC4/12,0) -> 3333.3333333333335 | V52: =IF(R3C>=RC3,RC4/12,0) -> 3333.3333333333335 | W52: =IF(R3C>=RC3,RC4/12,0) -> 3333.3333333333335 | X52: =IF(R3C>=RC3,RC4/12,0) -> 3333.3333333333335 | Y52: =IF(R3C>=RC3,RC4/12,0) -> 3333.3333333333335 | Z52: =IF(R3C>=RC3,RC4/12,0) -> 3333.3333333333335 | AA52: =IF(R3C>=RC3,RC4/12,0) -> 3333.3333333333335 | AB52: =IF(R3C>=RC3,RC4/12,0) -> 3333.3333333333335 | AC52: =IF(R3C>=RC3,RC4/12,0) -> 3333.3333333333335 | AD52: =IF(R3C>=RC3,RC4/12,0) -> 3333.3333333333335 | AE52: =IF(R3C>=RC3,RC4/12,0) -> 3333.3333333333335 | AF52: =IF(R3C>=RC3,RC4/12,0) -> 3333.3333333333335 | AG52: =IF(R3C>=RC3,RC4/12,0) -> 3333.3333333333335 | AH52: =IF(R3C>=RC3,RC4/12,0) -> 3333.3333333333335 | AI52: =IF(R3C>=RC3,RC4/12,0) -> 3333.3333333333335 | AJ52: =IF(R3C>=RC3,RC4/12,0) -> 3333.3333333333335 | AK52: =IF(R3C>=RC3,RC4/12,0) -> 3333.3333333333335 | AL52: =IF(R3C>=RC3,RC4/12,0) -> 3333.3333333333335 | AM52: =IF(R3C>=RC3,RC4/12,0) -> 3333.3333333333335 | AN52: =IF(R3C>=RC3,RC4/12,0) -> 3333.3333333333335
A53: Admin | B53: 5 | C53: =R1C4+RC[-1]*31 -> 2001-06-05T00:00:00.000 | D53: 40000 | E53: =IF(R3C>=RC3,RC4/12,0) -> 0 | F53: =IF(R3C>=RC3,RC4/12,0) -> 0 | G53: =IF(R3C>=RC3,RC4/12,0) -> 0 | H53: =IF(R3C>=RC3,RC4/12,0) -> 0 | I53: =IF(R3C>=RC3,RC4/12,0) -> 0 | J53: =IF(R3C>=RC3,RC4/12,0) -> 3333.3333333333335 | K53: =IF(R3C>=RC3,RC4/12,0) -> 3333.3333333333335 | L53: =IF(R3C>=RC3,RC4/12,0) -> 3333.3333333333335 | M53: =IF(R3C>=RC3,RC4/12,0) -> 3333.3333333333335 | N53: =IF(R3C>=RC3,RC4/12,0) -> 3333.3333333333335 | O53: =IF(R3C>=RC3,RC4/12,0) -> 3333.3333333333335 | P53: =IF(R3C>=RC3,RC4/12,0) -> 3333.3333333333335 | Q53: =IF(R3C>=RC3,RC4/12,0) -> 3333.3333333333335 | R53: =IF(R3C>=RC3,RC4/12,0) -> 3333.3333333333335 | S53: =IF(R3C>=RC3,RC4/12,0) -> 3333.3333333333335 | T53: =IF(R3C>=RC3,RC4/12,0) -> 3333.3333333333335 | U53: =IF(R3C>=RC3,RC4/12,0) -> 3333.3333333333335 | V53: =IF(R3C>=RC3,RC4/12,0) -> 3333.3333333333335 | W53: =IF(R3C>=RC3,RC4/12,0) -> 3333.3333333333335 | X53: =IF(R3C>=RC3,RC4/12,0) -> 3333.3333333333335 | Y53: =IF(R3C>=RC3,RC4/12,0) -> 3333.3333333333335 | Z53: =IF(R3C>=RC3,RC4/12,0) -> 3333.3333333333335 | AA53: =IF(R3C>=RC3,RC4/12,0) -> 3333.3333333333335 | AB53: =IF(R3C>=RC3,RC4/12,0) -> 3333.3333333333335 | AC53: =IF(R3C>=RC3,RC4/12,0) -> 3333.3333333333335 | AD53: =IF(R3C>=RC3,RC4/12,0) -> 3333.3333333333335 | AE53: =IF(R3C>=RC3,RC4/12,0) -> 3333.3333333333335 | AF53: =IF(R3C>=RC3,RC4/12,0) -> 3333.3333333333335 | AG53: =IF(R3C>=RC3,RC4/12,0) -> 3333.3333333333335 | AH53: =IF(R3C>=RC3,RC4/12,0) -> 3333.3333333333335 | AI53: =IF(R3C>=RC3,RC4/12,0) -> 3333.3333333333335 | AJ53: =IF(R3C>=RC3,RC4/12,0) -> 3333.3333333333335 | AK53: =IF(R3C>=RC3,RC4/12,0) -> 3333.3333333333335 | AL53: =IF(R3C>=RC3,RC4/12,0) -> 3333.3333333333335 | AM53: =IF(R3C>=RC3,RC4/12,0) -> 3333.3333333333335 | AN53: =IF(R3C>=RC3,RC4/12,0) -> 3333.3333333333335
A54: Receptionist | B54: 12 | C54: =R1C4+RC[-1]*31 -> 2002-01-08T00:00:00.000 | D54: 40000 | E54: =IF(R3C>=RC3,RC4/12,0) -> 0 | F54: =IF(R3C>=RC3,RC4/12,0) -> 0 | G54: =IF(R3C>=RC3,RC4/12,0) -> 0 | H54: =IF(R3C>=RC3,RC4/12,0) -> 0 | I54: =IF(R3C>=RC3,RC4/12,0) -> 0 | J54: =IF(R3C>=RC3,RC4/12,0) -> 0 | K54: =IF(R3C>=RC3,RC4/12,0) -> 0 | L54: =IF(R3C>=RC3,RC4/12,0) -> 0 | M54: =IF(R3C>=RC3,RC4/12,0) -> 0 | N54: =IF(R3C>=RC3,RC4/12,0) -> 0 | O54: =IF(R3C>=RC3,RC4/12,0) -> 0 | P54: =IF(R3C>=RC3,RC4/12,0) -> 0 | Q54: =IF(R3C>=RC3,RC4/12,0) -> 3333.3333333333335 | R54: =IF(R3C>=RC3,RC4/12,0) -> 3333.3333333333335 | S54: =IF(R3C>=RC3,RC4/12,0) -> 3333.3333333333335 | T54: =IF(R3C>=RC3,RC4/12,0) -> 3333.3333333333335 | U54: =IF(R3C>=RC3,RC4/12,0) -> 3333.3333333333335 | V54: =IF(R3C>=RC3,RC4/12,0) -> 3333.3333333333335 | W54: =IF(R3C>=RC3,RC4/12,0) -> 3333.3333333333335 | X54: =IF(R3C>=RC3,RC4/12,0) -> 3333.3333333333335 | Y54: =IF(R3C>=RC3,RC4/12,0) -> 3333.3333333333335 | Z54: =IF(R3C>=RC3,RC4/12,0) -> 3333.3333333333335 | AA54: =IF(R3C>=RC3,RC4/12,0) -> 3333.3333333333335 | AB54: =IF(R3C>=RC3,RC4/12,0) -> 3333.3333333333335 | AC54: =IF(R3C>=RC3,RC4/12,0) -> 3333.3333333333335 | AD54: =IF(R3C>=RC3,RC4/12,0) -> 3333.3333333333335 | AE54: =IF(R3C>=RC3,RC4/12,0) -> 3333.3333333333335 | AF54: =IF(R3C>=RC3,RC4/12,0) -> 3333.3333333333335 | AG54: =IF(R3C>=RC3,RC4/12,0) -> 3333.3333333333335 | AH54: =IF(R3C>=RC3,RC4/12,0) -> 3333.3333333333335 | AI54: =IF(R3C>=RC3,RC4/12,0) -> 3333.3333333333335 | AJ54: =IF(R3C>=RC3,RC4/12,0) -> 3333.3333333333335 | AK54: =IF(R3C>=RC3,RC4/12,0) -> 3333.3333333333335 | AL54: =IF(R3C>=RC3,RC4/12,0) -> 3333.3333333333335 | AM54: =IF(R3C>=RC3,RC4/12,0) -> 3333.3333333333335 | AN54: =IF(R3C>=RC3,RC4/12,0) -> 3333.3333333333335
A55: Subtotal | D55: =SUM(R[-7]C:R[-1]C) -> 505000 | E55: =SUM(R[-7]C:R[-1]C) -> 15833.333333333334 | F55: =SUM(R[-7]C:R[-1]C) -> 15833.333333333334 | G55: =SUM(R[-7]C:R[-1]C) -> 15833.333333333334 | H55: =SUM(R[-7]C:R[-1]C) -> 15833.333333333334 | I55: =SUM(R[-7]C:R[-1]C) -> 15833.333333333334 | J55: =SUM(R[-7]C:R[-1]C) -> 19166.666666666668 | K55: =SUM(R[-7]C:R[-1]C) -> 24999.999999999996 | L55: =SUM(R[-7]C:R[-1]C) -> 24999.999999999996 | M55: =SUM(R[-7]C:R[-1]C) -> 24999.999999999996 | N55: =SUM(R[-7]C:R[-1]C) -> 24999.999999999996 | O55: =SUM(R[-7]C:R[-1]C) -> 24999.999999999996 | P55: =SUM(R[-7]C:R[-1]C) -> 24999.999999999996 | Q55: =SUM(R[-7]C:R[-1]C) -> 42083.333333333336 | R55: =SUM(R[-7]C:R[-1]C) -> 42083.333333333336 | S55: =SUM(R[-7]C:R[-1]C) -> 42083.333333333336 | T55: =SUM(R[-7]C:R[-1]C) -> 42083.333333333336 | U55: =SUM(R[-7]C:R[-1]C) -> 42083.333333333336 | V55: =SUM(R[-7]C:R[-1]C) -> 42083.333333333336 | W55: =SUM(R[-7]C:R[-1]C) -> 42083.333333333336 | X55: =SUM(R[-7]C:R[-1]C) -> 42083.333333333336 | Y55: =SUM(R[-7]C:R[-1]C) -> 42083.333333333336 | Z55: =SUM(R[-7]C:R[-1]C) -> 42083.333333333336 | AA55: =SUM(R[-7]C:R[-1]C) -> 42083.333333333336 | AB55: =SUM(R[-7]C:R[-1]C) -> 42083.333333333336 | AC55: =SUM(R[-7]C:R[-1]C) -> 42083.333333333336 | AD55: =SUM(R[-7]C:R[-1]C) -> 42083.333333333336 | AE55: =SUM(R[-7]C:R[-1]C) -> 42083.333333333336 | AF55: =SUM(R[-7]C:R[-1]C) -> 42083.333333333336 | AG55: =SUM(R[-7]C:R[-1]C) -> 42083.333333333336 | AH55: =SUM(R[-7]C:R[-1]C) -> 42083.333333333336 | AI55: =SUM(R[-7]C:R[-1]C) -> 42083.333333333336 | AJ55: =SUM(R[-7]C:R[-1]C) -> 42083.333333333336 | AK55: =SUM(R[-7]C:R[-1]C) -> 42083.333333333336 | AL55: =SUM(R[-7]C:R[-1]C) -> 42083.333333333336 | AM55: =SUM(R[-7]C:R[-1]C) -> 42083.333333333336 | AN55: =SUM(R[-7]C:R[-1]C) -> 42083.333333333336
A56: Head Count Subtotal | E56: =COUNTIF(R[-8]C:R[-2]C, ">0") -> 2 | F56: =COUNTIF(R[-8]C:R[-2]C, ">0") -> 2 | G56: =COUNTIF(R[-8]C:R[-2]C, ">0") -> 2 | H56: =COUNTIF(R[-8]C:R[-2]C, ">0") -> 2 | I56: =COUNTIF(R[-8]C:R[-2]C, ">0") -> 2 | J56: =COUNTIF(R[-8]C:R[-2]C, ">0") -> 3 | K56: =COUNTIF(R[-8]C:R[-2]C, ">0") -> 4 | L56: =COUNTIF(R[-8]C:R[-2]C, ">0") -> 4 | M56: =COUNTIF(R[-8]C:R[-2]C, ">0") -> 4 | N56: =COUNTIF(R[-8]C:R[-2]C, ">0") -> 4 | O56: =COUNTIF(R[-8]C:R[-2]C, ">0") -> 4 | P56: =COUNTIF(R[-8]C:R[-2]C, ">0") -> 4 | Q56: =COUNTIF(R[-8]C:R[-2]C, ">0") -> 7 | R56: =COUNTIF(R[-8]C:R[-2]C, ">0") -> 7 | S56: =COUNTIF(R[-8]C:R[-2]C, ">0") -> 7 | T56: =COUNTIF(R[-8]C:R[-2]C, ">0") -> 7 | U56: =COUNTIF(R[-8]C:R[-2]C, ">0") -> 7 | V56: =COUNTIF(R[-8]C:R[-2]C, ">0") -> 7 | W56: =COUNTIF(R[-8]C:R[-2]C, ">0") -> 7 | X56: =COUNTIF(R[-8]C:R[-2]C, ">0") -> 7 | Y56: =COUNTIF(R[-8]C:R[-2]C, ">0") -> 7 | Z56: =COUNTIF(R[-8]C:R[-2]C, ">0") -> 7 | AA56: =COUNTIF(R[-8]C:R[-2]C, ">0") -> 7 | AB56: =COUNTIF(R[-8]C:R[-2]C, ">0") -> 7 | AC56: =COUNTIF(R[-8]C:R[-2]C, ">0") -> 7 | AD56: =COUNTIF(R[-8]C:R[-2]C, ">0") -> 7 | AE56: =COUNTIF(R[-8]C:R[-2]C, ">0") -> 7 | AF56: =COUNTIF(R[-8]C:R[-2]C, ">0") -> 7 | AG56: =COUNTIF(R[-8]C:R[-2]C, ">0") -> 7 | AH56: =COUNTIF(R[-8]C:R[-2]C, ">0") -> 7 | AI56: =COUNTIF(R[-8]C:R[-2]C, ">0") -> 7 | AJ56: =COUNTIF(R[-8]C:R[-2]C, ">0") -> 7 | AK56: =COUNTIF(R[-8]C:R[-2]C, ">0") -> 7 | AL56: =COUNTIF(R[-8]C:R[-2]C, ">0") -> 7 | AM56: =COUNTIF(R[-8]C:R[-2]C, ">0") -> 7 | AN56: =COUNTIF(R[-8]C:R[-2]C, ">0") -> 7
A58: Customer Service/Tech
A59: Support Manager | B59: 5 | C59: =R1C4+RC[-1]*31 -> 2001-06-05T00:00:00.000 | D59: 55000 | E59: =IF(R3C>=RC3,RC4/12,0) -> 0 | F59: =IF(R3C>=RC3,RC4/12,0) -> 0 | G59: =IF(R3C>=RC3,RC4/12,0) -> 0 | H59: =IF(R3C>=RC3,RC4/12,0) -> 0 | I59: =IF(R3C>=RC3,RC4/12,0) -> 0 | J59: =IF(R3C>=RC3,RC4/12,0) -> 4583.333333333333 | K59: =IF(R3C>=RC3,RC4/12,0) -> 4583.333333333333 | L59: =IF(R3C>=RC3,RC4/12,0) -> 4583.333333333333 | M59: =IF(R3C>=RC3,RC4/12,0) -> 4583.333333333333 | N59: =IF(R3C>=RC3,RC4/12,0) -> 4583.333333333333 | O59: =IF(R3C>=RC3,RC4/12,0) -> 4583.333333333333 | P59: =IF(R3C>=RC3,RC4/12,0) -> 4583.333333333333 | Q59: =IF(R3C>=RC3,RC4/12,0) -> 4583.333333333333 | R59: =IF(R3C>=RC3,RC4/12,0) -> 4583.333333333333 | S59: =IF(R3C>=RC3,RC4/12,0) -> 4583.333333333333 | T59: =IF(R3C>=RC3,RC4/12,0) -> 4583.333333333333 | U59: =IF(R3C>=RC3,RC4/12,0) -> 4583.333333333333 | V59: =IF(R3C>=RC3,RC4/12,0) -> 4583.333333333333 | W59: =IF(R3C>=RC3,RC4/12,0) -> 4583.333333333333 | X59: =IF(R3C>=RC3,RC4/12,0) -> 4583.333333333333 | Y59: =IF(R3C>=RC3,RC4/12,0) -> 4583.333333333333 | Z59: =IF(R3C>=RC3,RC4/12,0) -> 4583.333333333333 | AA59: =IF(R3C>=RC3,RC4/12,0) -> 4583.333333333333 | AB59: =IF(R3C>=RC3,RC4/12,0) -> 4583.333333333333 | AC59: =IF(R3C>=RC3,RC4/12,0) -> 4583.333333333333 | AD59: =IF(R3C>=RC3,RC4/12,0) -> 4583.333333333333 | AE59: =IF(R3C>=RC3,RC4/12,0) -> 4583.333333333333 | AF59: =IF(R3C>=RC3,RC4/12,0) -> 4583.333333333333 | AG59: =IF(R3C>=RC3,RC4/12,0) -> 4583.333333333333 | AH59: =IF(R3C>=RC3,RC4/12,0) -> 4583.333333333333 | AI59: =IF(R3C>=RC3,RC4/12,0) -> 4583.333333333333 | AJ59: =IF(R3C>=RC3,RC4/12,0) -> 4583.333333333333 | AK59: =IF(R3C>=RC3,RC4/12,0) -> 4583.333333333333 | AL59: =IF(R3C>=RC3,RC4/12,0) -> 4583.333333333333 | AM59: =IF(R3C>=RC3,RC4/12,0) -> 4583.333333333333 | AN59: =IF(R3C>=RC3,RC4/12,0) -> 4583.333333333333
A60: Representative | B60: 6 | C60: =R1C4+RC[-1]*31 -> 2001-07-06T00:00:00.000 | D60: 40000 | E60: =IF(R3C>=RC3,RC4/12,0) -> 0 | F60: =IF(R3C>=RC3,RC4/12,0) -> 0 | G60: =IF(R3C>=RC3,RC4/12,0) -> 0 | H60: =IF(R3C>=RC3,RC4/12,0) -> 0 | I60: =IF(R3C>=RC3,RC4/12,0) -> 0 | J60: =IF(R3C>=RC3,RC4/12,0) -> 0 | K60: =IF(R3C>=RC3,RC4/12,0) -> 3333.3333333333335 | L60: =IF(R3C>=RC3,RC4/12,0) -> 3333.3333333333335 | M60: =IF(R3C>=RC3,RC4/12,0) -> 3333.3333333333335 | N60: =IF(R3C>=RC3,RC4/12,0) -> 3333.3333333333335 | O60: =IF(R3C>=RC3,RC4/12,0) -> 3333.3333333333335 | P60: =IF(R3C>=RC3,RC4/12,0) -> 3333.3333333333335 | Q60: =IF(R3C>=RC3,RC4/12,0) -> 3333.3333333333335 | R60: =IF(R3C>=RC3,RC4/12,0) -> 3333.3333333333335 | S60: =IF(R3C>=RC3,RC4/12,0) -> 3333.3333333333335 | T60: =IF(R3C>=RC3,RC4/12,0) -> 3333.3333333333335 | U60: =IF(R3C>=RC3,RC4/12,0) -> 3333.3333333333335 | V60: =IF(R3C>=RC3,RC4/12,0) -> 3333.3333333333335 | W60: =IF(R3C>=RC3,RC4/12,0) -> 3333.3333333333335 | X60: =IF(R3C>=RC3,RC4/12,0) -> 3333.3333333333335 | Y60: =IF(R3C>=RC3,RC4/12,0) -> 3333.3333333333335 | Z60: =IF(R3C>=RC3,RC4/12,0) -> 3333.3333333333335 | AA60: =IF(R3C>=RC3,RC4/12,0) -> 3333.3333333333335 | AB60: =IF(R3C>=RC3,RC4/12,0) -> 3333.3333333333335 | AC60: =IF(R3C>=RC3,RC4/12,0) -> 3333.3333333333335 | AD60: =IF(R3C>=RC3,RC4/12,0) -> 3333.3333333333335 | AE60: =IF(R3C>=RC3,RC4/12,0) -> 3333.3333333333335 | AF60: =IF(R3C>=RC3,RC4/12,0) -> 3333.3333333333335 | AG60: =IF(R3C>=RC3,RC4/12,0) -> 3333.3333333333335 | AH60: =IF(R3C>=RC3,RC4/12,0) -> 3333.3333333333335 | AI60: =IF(R3C>=RC3,RC4/12,0) -> 3333.3333333333335 | AJ60: =IF(R3C>=RC3,RC4/12,0) -> 3333.3333333333335 | AK60: =IF(R3C>=RC3,RC4/12,0) -> 3333.3333333333335 | AL60: =IF(R3C>=RC3,RC4/12,0) -> 3333.3333333333335 | AM60: =IF(R3C>=RC3,RC4/12,0) -> 3333.3333333333335 | AN60: =IF(R3C>=RC3,RC4/12,0) -> 3333.3333333333335
A61: Representative | B61: 7 | C61: =R1C4+RC[-1]*31 -> 2001-08-06T00:00:00.000 | D61: 45000 | E61: =IF(R3C>=RC3,RC4/12,0) -> 0 | F61: =IF(R3C>=RC3,RC4/12,0) -> 0 | G61: =IF(R3C>=RC3,RC4/12,0) -> 0 | H61: =IF(R3C>=RC3,RC4/12,0) -> 0 | I61: =IF(R3C>=RC3,RC4/12,0) -> 0 | J61: =IF(R3C>=RC3,RC4/12,0) -> 0 | K61: =IF(R3C>=RC3,RC4/12,0) -> 0 | L61: =IF(R3C>=RC3,RC4/12,0) -> 3750 | M61: =IF(R3C>=RC3,RC4/12,0) -> 3750 | N61: =IF(R3C>=RC3,RC4/12,0) -> 3750 | O61: =IF(R3C>=RC3,RC4/12,0) -> 3750 | P61: =IF(R3C>=RC3,RC4/12,0) -> 3750 | Q61: =IF(R3C>=RC3,RC4/12,0) -> 3750 | R61: =IF(R3C>=RC3,RC4/12,0) -> 3750 | S61: =IF(R3C>=RC3,RC4/12,0) -> 3750 | T61: =IF(R3C>=RC3,RC4/12,0) -> 3750 | U61: =IF(R3C>=RC3,RC4/12,0) -> 3750 | V61: =IF(R3C>=RC3,RC4/12,0) -> 3750 | W61: =IF(R3C>=RC3,RC4/12,0) -> 3750 | X61: =IF(R3C>=RC3,RC4/12,0) -> 3750 | Y61: =IF(R3C>=RC3,RC4/12,0) -> 3750 | Z61: =IF(R3C>=RC3,RC4/12,0) -> 3750 | AA61: =IF(R3C>=RC3,RC4/12,0) -> 3750 | AB61: =IF(R3C>=RC3,RC4/12,0) -> 3750 | AC61: =IF(R3C>=RC3,RC4/12,0) -> 3750 | AD61: =IF(R3C>=RC3,RC4/12,0) -> 3750 | AE61: =IF(R3C>=RC3,RC4/12,0) -> 3750 | AF61: =IF(R3C>=RC3,RC4/12,0) -> 3750 | AG61: =IF(R3C>=RC3,RC4/12,0) -> 3750 | AH61: =IF(R3C>=RC3,RC4/12,0) -> 3750 | AI61: =IF(R3C>=RC3,RC4/12,0) -> 3750 | AJ61: =IF(R3C>=RC3,RC4/12,0) -> 3750 | AK61: =IF(R3C>=RC3,RC4/12,0) -> 3750 | AL61: =IF(R3C>=RC3,RC4/12,0) -> 3750 | AM61: =IF(R3C>=RC3,RC4/12,0) -> 3750 | AN61: =IF(R3C>=RC3,RC4/12,0) -> 3750
A62: Representative | B62: 8 | C62: =R1C4+RC[-1]*31 -> 2001-09-06T00:00:00.000 | D62: 40000 | E62: =IF(R3C>=RC3,RC4/12,0) -> 0 | F62: =IF(R3C>=RC3,RC4/12,0) -> 0 | G62: =IF(R3C>=RC3,RC4/12,0) -> 0 | H62: =IF(R3C>=RC3,RC4/12,0) -> 0 | I62: =IF(R3C>=RC3,RC4/12,0) -> 0 | J62: =IF(R3C>=RC3,RC4/12,0) -> 0 | K62: =IF(R3C>=RC3,RC4/12,0) -> 0 | L62: =IF(R3C>=RC3,RC4/12,0) -> 0 | M62: =IF(R3C>=RC3,RC4/12,0) -> 3333.3333333333335 | N62: =IF(R3C>=RC3,RC4/12,0) -> 3333.3333333333335 | O62: =IF(R3C>=RC3,RC4/12,0) -> 3333.3333333333335 | P62: =IF(R3C>=RC3,RC4/12,0) -> 3333.3333333333335 | Q62: =IF(R3C>=RC3,RC4/12,0) -> 3333.3333333333335 | R62: =IF(R3C>=RC3,RC4/12,0) -> 3333.3333333333335 | S62: =IF(R3C>=RC3,RC4/12,0) -> 3333.3333333333335 | T62: =IF(R3C>=RC3,RC4/12,0) -> 3333.3333333333335 | U62: =IF(R3C>=RC3,RC4/12,0) -> 3333.3333333333335 | V62: =IF(R3C>=RC3,RC4/12,0) -> 3333.3333333333335 | W62: =IF(R3C>=RC3,RC4/12,0) -> 3333.3333333333335 | X62: =IF(R3C>=RC3,RC4/12,0) -> 3333.3333333333335 | Y62: =IF(R3C>=RC3,RC4/12,0) -> 3333.3333333333335 | Z62: =IF(R3C>=RC3,RC4/12,0) -> 3333.3333333333335 | AA62: =IF(R3C>=RC3,RC4/12,0) -> 3333.3333333333335 | AB62: =IF(R3C>=RC3,RC4/12,0) -> 3333.3333333333335 | AC62: =IF(R3C>=RC3,RC4/12,0) -> 3333.3333333333335 | AD62: =IF(R3C>=RC3,RC4/12,0) -> 3333.3333333333335 | AE62: =IF(R3C>=RC3,RC4/12,0) -> 3333.3333333333335 | AF62: =IF(R3C>=RC3,RC4/12,0) -> 3333.3333333333335 | AG62: =IF(R3C>=RC3,RC4/12,0) -> 3333.3333333333335 | AH62: =IF(R3C>=RC3,RC4/12,0) -> 3333.3333333333335 | AI62: =IF(R3C>=RC3,RC4/12,0) -> 3333.3333333333335 | AJ62: =IF(R3C>=RC3,RC4/12,0) -> 3333.3333333333335 | AK62: =IF(R3C>=RC3,RC4/12,0) -> 3333.3333333333335 | AL62: =IF(R3C>=RC3,RC4/12,0) -> 3333.3333333333335 | AM62: =IF(R3C>=RC3,RC4/12,0) -> 3333.3333333333335 | AN62: =IF(R3C>=RC3,RC4/12,0) -> 3333.3333333333335
A63: Representative | B63: 10 | C63: =R1C4+RC[-1]*31 -> 2001-11-07T00:00:00.000 | D63: 45000 | E63: =IF(R3C>=RC3,RC4/12,0) -> 0 | F63: =IF(R3C>=RC3,RC4/12,0) -> 0 | G63: =IF(R3C>=RC3,RC4/12,0) -> 0 | H63: =IF(R3C>=RC3,RC4/12,0) -> 0 | I63: =IF(R3C>=RC3,RC4/12,0) -> 0 | J63: =IF(R3C>=RC3,RC4/12,0) -> 0 | K63: =IF(R3C>=RC3,RC4/12,0) -> 0 | L63: =IF(R3C>=RC3,RC4/12,0) -> 0 | M63: =IF(R3C>=RC3,RC4/12,0) -> 0 | N63: =IF(R3C>=RC3,RC4/12,0) -> 0 | O63: =IF(R3C>=RC3,RC4/12,0) -> 3750 | P63: =IF(R3C>=RC3,RC4/12,0) -> 3750 | Q63: =IF(R3C>=RC3,RC4/12,0) -> 3750 | R63: =IF(R3C>=RC3,RC4/12,0) -> 3750 | S63: =IF(R3C>=RC3,RC4/12,0) -> 3750 | T63: =IF(R3C>=RC3,RC4/12,0) -> 3750 | U63: =IF(R3C>=RC3,RC4/12,0) -> 3750 | V63: =IF(R3C>=RC3,RC4/12,0) -> 3750 | W63: =IF(R3C>=RC3,RC4/12,0) -> 3750 | X63: =IF(R3C>=RC3,RC4/12,0) -> 3750 | Y63: =IF(R3C>=RC3,RC4/12,0) -> 3750 | Z63: =IF(R3C>=RC3,RC4/12,0) -> 3750 | AA63: =IF(R3C>=RC3,RC4/12,0) -> 3750 | AB63: =IF(R3C>=RC3,RC4/12,0) -> 3750 | AC63: =IF(R3C>=RC3,RC4/12,0) -> 3750 | AD63: =IF(R3C>=RC3,RC4/12,0) -> 3750 | AE63: =IF(R3C>=RC3,RC4/12,0) -> 3750 | AF63: =IF(R3C>=RC3,RC4/12,0) -> 3750 | AG63: =IF(R3C>=RC3,RC4/12,0) -> 3750 | AH63: =IF(R3C>=RC3,RC4/12,0) -> 3750 | AI63: =IF(R3C>=RC3,RC4/12,0) -> 3750 | AJ63: =IF(R3C>=RC3,RC4/12,0) -> 3750 | AK63: =IF(R3C>=RC3,RC4/12,0) -> 3750 | AL63: =IF(R3C>=RC3,RC4/12,0) -> 3750 | AM63: =IF(R3C>=RC3,RC4/12,0) -> 3750 | AN63: =IF(R3C>=RC3,RC4/12,0) -> 3750
A64: Representative | B64: 13 | C64: =R1C4+RC[-1]*31 -> 2002-02-08T00:00:00.000 | D64: 40000 | E64: =IF(R3C>=RC3,RC4/12,0) -> 0 | F64: =IF(R3C>=RC3,RC4/12,0) -> 0 | G64: =IF(R3C>=RC3,RC4/12,0) -> 0 | H64: =IF(R3C>=RC3,RC4/12,0) -> 0 | I64: =IF(R3C>=RC3,RC4/12,0) -> 0 | J64: =IF(R3C>=RC3,RC4/12,0) -> 0 | K64: =IF(R3C>=RC3,RC4/12,0) -> 0 | L64: =IF(R3C>=RC3,RC4/12,0) -> 0 | M64: =IF(R3C>=RC3,RC4/12,0) -> 0 | N64: =IF(R3C>=RC3,RC4/12,0) -> 0 | O64: =IF(R3C>=RC3,RC4/12,0) -> 0 | P64: =IF(R3C>=RC3,RC4/12,0) -> 0 | Q64: =IF(R3C>=RC3,RC4/12,0) -> 0 | R64: =IF(R3C>=RC3,RC4/12,0) -> 3333.3333333333335 | S64: =IF(R3C>=RC3,RC4/12,0) -> 3333.3333333333335 | T64: =IF(R3C>=RC3,RC4/12,0) -> 3333.3333333333335 | U64: =IF(R3C>=RC3,RC4/12,0) -> 3333.3333333333335 | V64: =IF(R3C>=RC3,RC4/12,0) -> 3333.3333333333335 | W64: =IF(R3C>=RC3,RC4/12,0) -> 3333.3333333333335 | X64: =IF(R3C>=RC3,RC4/12,0) -> 3333.3333333333335 | Y64: =IF(R3C>=RC3,RC4/12,0) -> 3333.3333333333335 | Z64: =IF(R3C>=RC3,RC4/12,0) -> 3333.3333333333335 | AA64: =IF(R3C>=RC3,RC4/12,0) -> 3333.3333333333335 | AB64: =IF(R3C>=RC3,RC4/12,0) -> 3333.3333333333335 | AC64: =IF(R3C>=RC3,RC4/12,0) -> 3333.3333333333335 | AD64: =IF(R3C>=RC3,RC4/12,0) -> 3333.3333333333335 | AE64: =IF(R3C>=RC3,RC4/12,0) -> 3333.3333333333335 | AF64: =IF(R3C>=RC3,RC4/12,0) -> 3333.3333333333335 | AG64: =IF(R3C>=RC3,RC4/12,0) -> 3333.3333333333335 | AH64: =IF(R3C>=RC3,RC4/12,0) -> 3333.3333333333335 | AI64: =IF(R3C>=RC3,RC4/12,0) -> 3333.3333333333335 | AJ64: =IF(R3C>=RC3,RC4/12,0) -> 3333.3333333333335 | AK64: =IF(R3C>=RC3,RC4/12,0) -> 3333.3333333333335 | AL64: =IF(R3C>=RC3,RC4/12,0) -> 3333.3333333333335 | AM64: =IF(R3C>=RC3,RC4/12,0) -> 3333.3333333333335 | AN64: =IF(R3C>=RC3,RC4/12,0) -> 3333.3333333333335
A65: Trainer | B65: 5 | C65: =R1C4+RC[-1]*31 -> 2001-06-05T00:00:00.000 | D65: 70000 | E65: =IF(R3C>=RC3,RC4/12,0) -> 0 | F65: =IF(R3C>=RC3,RC4/12,0) -> 0 | G65: =IF(R3C>=RC3,RC4/12,0) -> 0 | H65: =IF(R3C>=RC3,RC4/12,0) -> 0 | I65: =IF(R3C>=RC3,RC4/12,0) -> 0 | J65: =IF(R3C>=RC3,RC4/12,0) -> 5833.333333333333 | K65: =IF(R3C>=RC3,RC4/12,0) -> 5833.333333333333 | L65: =IF(R3C>=RC3,RC4/12,0) -> 5833.333333333333 | M65: =IF(R3C>=RC3,RC4/12,0) -> 5833.333333333333 | N65: =IF(R3C>=RC3,RC4/12,0) -> 5833.333333333333 | O65: =IF(R3C>=RC3,RC4/12,0) -> 5833.333333333333 | P65: =IF(R3C>=RC3,RC4/12,0) -> 5833.333333333333 | Q65: =IF(R3C>=RC3,RC4/12,0) -> 5833.333333333333 | R65: =IF(R3C>=RC3,RC4/12,0) -> 5833.333333333333 | S65: =IF(R3C>=RC3,RC4/12,0) -> 5833.333333333333 | T65: =IF(R3C>=RC3,RC4/12,0) -> 5833.333333333333 | U65: =IF(R3C>=RC3,RC4/12,0) -> 5833.333333333333 | V65: =IF(R3C>=RC3,RC4/12,0) -> 5833.333333333333 | W65: =IF(R3C>=RC3,RC4/12,0) -> 5833.333333333333 | X65: =IF(R3C>=RC3,RC4/12,0) -> 5833.333333333333 | Y65: =IF(R3C>=RC3,RC4/12,0) -> 5833.333333333333 | Z65: =IF(R3C>=RC3,RC4/12,0) -> 5833.333333333333 | AA65: =IF(R3C>=RC3,RC4/12,0) -> 5833.333333333333 | AB65: =IF(R3C>=RC3,RC4/12,0) -> 5833.333333333333 | AC65: =IF(R3C>=RC3,RC4/12,0) -> 5833.333333333333 | AD65: =IF(R3C>=RC3,RC4/12,0) -> 5833.333333333333 | AE65: =IF(R3C>=RC3,RC4/12,0) -> 5833.333333333333 | AF65: =IF(R3C>=RC3,RC4/12,0) -> 5833.333333333333 | AG65: =IF(R3C>=RC3,RC4/12,0) -> 5833.333333333333 | AH65: =IF(R3C>=RC3,RC4/12,0) -> 5833.333333333333 | AI65: =IF(R3C>=RC3,RC4/12,0) -> 5833.333333333333 | AJ65: =IF(R3C>=RC3,RC4/12,0) -> 5833.333333333333 | AK65: =IF(R3C>=RC3,RC4/12,0) -> 5833.333333333333 | AL65: =IF(R3C>=RC3,RC4/12,0) -> 5833.333333333333 | AM65: =IF(R3C>=RC3,RC4/12,0) -> 5833.333333333333 | AN65: =IF(R3C>=RC3,RC4/12,0) -> 5833.333333333333
A66: Trainer | B66: 12 | C66: =R1C4+RC[-1]*31 -> 2002-01-08T00:00:00.000 | D66: 60000 | E66: =IF(R3C>=RC3,RC4/12,0) -> 0 | F66: =IF(R3C>=RC3,RC4/12,0) -> 0 | G66: =IF(R3C>=RC3,RC4/12,0) -> 0 | H66: =IF(R3C>=RC3,RC4/12,0) -> 0 | I66: =IF(R3C>=RC3,RC4/12,0) -> 0 | J66: =IF(R3C>=RC3,RC4/12,0) -> 0 | K66: =IF(R3C>=RC3,RC4/12,0) -> 0 | L66: =IF(R3C>=RC3,RC4/12,0) -> 0 | M66: =IF(R3C>=RC3,RC4/12,0) -> 0 | N66: =IF(R3C>=RC3,RC4/12,0) -> 0 | O66: =IF(R3C>=RC3,RC4/12,0) -> 0 | P66: =IF(R3C>=RC3,RC4/12,0) -> 0 | Q66: =IF(R3C>=RC3,RC4/12,0) -> 5000 | R66: =IF(R3C>=RC3,RC4/12,0) -> 5000 | S66: =IF(R3C>=RC3,RC4/12,0) -> 5000 | T66: =IF(R3C>=RC3,RC4/12,0) -> 5000 | U66: =IF(R3C>=RC3,RC4/12,0) -> 5000 | V66: =IF(R3C>=RC3,RC4/12,0) -> 5000 | W66: =IF(R3C>=RC3,RC4/12,0) -> 5000 | X66: =IF(R3C>=RC3,RC4/12,0) -> 5000 | Y66: =IF(R3C>=RC3,RC4/12,0) -> 5000 | Z66: =IF(R3C>=RC3,RC4/12,0) -> 5000 | AA66: =IF(R3C>=RC3,RC4/12,0) -> 5000 | AB66: =IF(R3C>=RC3,RC4/12,0) -> 5000 | AC66: =IF(R3C>=RC3,RC4/12,0) -> 5000 | AD66: =IF(R3C>=RC3,RC4/12,0) -> 5000 | AE66: =IF(R3C>=RC3,RC4/12,0) -> 5000 | AF66: =IF(R3C>=RC3,RC4/12,0) -> 5000 | AG66: =IF(R3C>=RC3,RC4/12,0) -> 5000 | AH66: =IF(R3C>=RC3,RC4/12,0) -> 5000 | AI66: =IF(R3C>=RC3,RC4/12,0) -> 5000 | AJ66: =IF(R3C>=RC3,RC4/12,0) -> 5000 | AK66: =IF(R3C>=RC3,RC4/12,0) -> 5000 | AL66: =IF(R3C>=RC3,RC4/12,0) -> 5000 | AM66: =IF(R3C>=RC3,RC4/12,0) -> 5000 | AN66: =IF(R3C>=RC3,RC4/12,0) -> 5000
A67: Subtotal | D67: =SUM(R[-8]C:R[-1]C) -> 395000 | E67: =SUM(R[-8]C:R[-1]C) -> 0 | F67: =SUM(R[-8]C:R[-1]C) -> 0 | G67: =SUM(R[-8]C:R[-1]C) -> 0 | H67: =SUM(R[-8]C:R[-1]C) -> 0 | I67: =SUM(R[-8]C:R[-1]C) -> 0 | J67: =SUM(R[-8]C:R[-1]C) -> 10416.666666666666 | K67: =SUM(R[-8]C:R[-1]C) -> 13750 | L67: =SUM(R[-8]C:R[-1]C) -> 17500 | M67: =SUM(R[-8]C:R[-1]C) -> 20833.333333333332 | N67: =SUM(R[-8]C:R[-1]C) -> 20833.333333333332 | O67: =SUM(R[-8]C:R[-1]C) -> 24583.333333333332 | P67: =SUM(R[-8]C:R[-1]C) -> 24583.333333333332 | Q67: =SUM(R[-8]C:R[-1]C) -> 29583.333333333332 | R67: =SUM(R[-8]C:R[-1]C) -> 32916.666666666664 | S67: =SUM(R[-8]C:R[-1]C) -> 32916.666666666664 | T67: =SUM(R[-8]C:R[-1]C) -> 32916.666666666664 | U67: =SUM(R[-8]C:R[-1]C) -> 32916.666666666664 | V67: =SUM(R[-8]C:R[-1]C) -> 32916.666666666664 | W67: =SUM(R[-8]C:R[-1]C) -> 32916.666666666664 | X67: =SUM(R[-8]C:R[-1]C) -> 32916.666666666664 | Y67: =SUM(R[-8]C:R[-1]C) -> 32916.666666666664 | Z67: =SUM(R[-8]C:R[-1]C) -> 32916.666666666664 | AA67: =SUM(R[-8]C:R[-1]C) -> 32916.666666666664 | AB67: =SUM(R[-8]C:R[-1]C) -> 32916.666666666664 | AC67: =SUM(R[-8]C:R[-1]C) -> 32916.666666666664 | AD67: =SUM(R[-8]C:R[-1]C) -> 32916.666666666664 | AE67: =SUM(R[-8]C:R[-1]C) -> 32916.666666666664 | AF67: =SUM(R[-8]C:R[-1]C) -> 32916.666666666664 | AG67: =SUM(R[-8]C:R[-1]C) -> 32916.666666666664 | AH67: =SUM(R[-8]C:R[-1]C) -> 32916.666666666664 | AI67: =SUM(R[-8]C:R[-1]C) -> 32916.666666666664 | AJ67: =SUM(R[-8]C:R[-1]C) -> 32916.666666666664 | AK67: =SUM(R[-8]C:R[-1]C) -> 32916.666666666664 | AL67: =SUM(R[-8]C:R[-1]C) -> 32916.666666666664 | AM67: =SUM(R[-8]C:R[-1]C) -> 32916.666666666664 | AN67: =SUM(R[-8]C:R[-1]C) -> 32916.666666666664
A68: Head Count Subtotal | E68: =COUNTIF(R[-9]C:R[-2]C, ">0") -> 0 | F68: =COUNTIF(R[-9]C:R[-2]C, ">0") -> 0 | G68: =COUNTIF(R[-9]C:R[-2]C, ">0") -> 0 | H68: =COUNTIF(R[-9]C:R[-2]C, ">0") -> 0 | I68: =COUNTIF(R[-9]C:R[-2]C, ">0") -> 0 | J68: =COUNTIF(R[-9]C:R[-2]C, ">0") -> 2 | K68: =COUNTIF(R[-9]C:R[-2]C, ">0") -> 3 | L68: =COUNTIF(R[-9]C:R[-2]C, ">0") -> 4 | M68: =COUNTIF(R[-9]C:R[-2]C, ">0") -> 5 | N68: =COUNTIF(R[-9]C:R[-2]C, ">0") -> 5 | O68: =COUNTIF(R[-9]C:R[-2]C, ">0") -> 6 | P68: =COUNTIF(R[-9]C:R[-2]C, ">0") -> 6 | Q68: =COUNTIF(R[-9]C:R[-2]C, ">0") -> 7 | R68: =COUNTIF(R[-9]C:R[-2]C, ">0") -> 8 | S68: =COUNTIF(R[-9]C:R[-2]C, ">0") -> 8 | T68: =COUNTIF(R[-9]C:R[-2]C, ">0") -> 8 | U68: =COUNTIF(R[-9]C:R[-2]C, ">0") -> 8 | V68: =COUNTIF(R[-9]C:R[-2]C, ">0") -> 8 | W68: =COUNTIF(R[-9]C:R[-2]C, ">0") -> 8 | X68: =COUNTIF(R[-9]C:R[-2]C, ">0") -> 8 | Y68: =COUNTIF(R[-9]C:R[-2]C, ">0") -> 8 | Z68: =COUNTIF(R[-9]C:R[-2]C, ">0") -> 8 | AA68: =COUNTIF(R[-9]C:R[-2]C, ">0") -> 8 | AB68: =COUNTIF(R[-9]C:R[-2]C, ">0") -> 8 | AC68: =COUNTIF(R[-9]C:R[-2]C, ">0") -> 8 | AD68: =COUNTIF(R[-9]C:R[-2]C, ">0") -> 8 | AE68: =COUNTIF(R[-9]C:R[-2]C, ">0") -> 8 | AF68: =COUNTIF(R[-9]C:R[-2]C, ">0") -> 8 | AG68: =COUNTIF(R[-9]C:R[-2]C, ">0") -> 8 | AH68: =COUNTIF(R[-9]C:R[-2]C, ">0") -> 8 | AI68: =COUNTIF(R[-9]C:R[-2]C, ">0") -> 8 | AJ68: =COUNTIF(R[-9]C:R[-2]C, ">0") -> 8 | AK68: =COUNTIF(R[-9]C:R[-2]C, ">0") -> 8 | AL68: =COUNTIF(R[-9]C:R[-2]C, ">0") -> 8 | AM68: =COUNTIF(R[-9]C:R[-2]C, ">0") -> 8 | AN68: =COUNTIF(R[-9]C:R[-2]C, ">0") -> 8
A71: Payroll Monthly Totals | D71: =SUM(R[-4]C+R[-16]C+R[-27]C+R[-38]C) -> 3510000 | E71: =SUM(R[-4]C+R[-16]C+R[-27]C+R[-38]C) -> 47916.666666666664 | F71: =SUM(R[-4]C+R[-16]C+R[-27]C+R[-38]C) -> 54166.666666666672 | G71: =SUM(R[-4]C+R[-16]C+R[-27]C+R[-38]C) -> 72916.666666666672 | H71: =SUM(R[-4]C+R[-16]C+R[-27]C+R[-38]C) -> 103333.33333333333 | I71: =SUM(R[-4]C+R[-16]C+R[-27]C+R[-38]C) -> 128750 | J71: =SUM(R[-4]C+R[-16]C+R[-27]C+R[-38]C) -> 149583.33333333331 | K71: =SUM(R[-4]C+R[-16]C+R[-27]C+R[-38]C) -> 195000.00000000003 | L71: =SUM(R[-4]C+R[-16]C+R[-27]C+R[-38]C) -> 215416.66666666669 | M71: =SUM(R[-4]C+R[-16]C+R[-27]C+R[-38]C) -> 236666.66666666669 | N71: =SUM(R[-4]C+R[-16]C+R[-27]C+R[-38]C) -> 236666.66666666669 | O71: =SUM(R[-4]C+R[-16]C+R[-27]C+R[-38]C) -> 247083.33333333334 | P71: =SUM(R[-4]C+R[-16]C+R[-27]C+R[-38]C) -> 247083.33333333334 | Q71: =SUM(R[-4]C+R[-16]C+R[-27]C+R[-38]C) -> 275833.33333333337 | R71: =SUM(R[-4]C+R[-16]C+R[-27]C+R[-38]C) -> 279166.66666666669 | S71: =SUM(R[-4]C+R[-16]C+R[-27]C+R[-38]C) -> 285833.33333333337 | T71: =SUM(R[-4]C+R[-16]C+R[-27]C+R[-38]C) -> 285833.33333333337 | U71: =SUM(R[-4]C+R[-16]C+R[-27]C+R[-38]C) -> 292500 | V71: =SUM(R[-4]C+R[-16]C+R[-27]C+R[-38]C) -> 292500 | W71: =SUM(R[-4]C+R[-16]C+R[-27]C+R[-38]C) -> 292500 | X71: =SUM(R[-4]C+R[-16]C+R[-27]C+R[-38]C) -> 292500 | Y71: =SUM(R[-4]C+R[-16]C+R[-27]C+R[-38]C) -> 292500 | Z71: =SUM(R[-4]C+R[-16]C+R[-27]C+R[-38]C) -> 292500 | AA71: =SUM(R[-4]C+R[-16]C+R[-27]C+R[-38]C) -> 292500 | AB71: =SUM(R[-4]C+R[-16]C+R[-27]C+R[-38]C) -> 292500 | AC71: =SUM(R[-4]C+R[-16]C+R[-27]C+R[-38]C) -> 292500 | AD71: =SUM(R[-4]C+R[-16]C+R[-27]C+R[-38]C) -> 292500 | AE71: =SUM(R[-4]C+R[-16]C+R[-27]C+R[-38]C) -> 292500 | AF71: =SUM(R[-4]C+R[-16]C+R[-27]C+R[-38]C) -> 292500 | AG71: =SUM(R[-4]C+R[-16]C+R[-27]C+R[-38]C) -> 292500 | AH71: =SUM(R[-4]C+R[-16]C+R[-27]C+R[-38]C) -> 292500 | AI71: =SUM(R[-4]C+R[-16]C+R[-27]C+R[-38]C) -> 292500 | AJ71: =SUM(R[-4]C+R[-16]C+R[-27]C+R[-38]C) -> 292500 | AK71: =SUM(R[-4]C+R[-16]C+R[-27]C+R[-38]C) -> 292500 | AL71: =SUM(R[-4]C+R[-16]C+R[-27]C+R[-38]C) -> 292500 | AM71: =SUM(R[-4]C+R[-16]C+R[-27]C+R[-38]C) -> 292500 | AN71: =SUM(R[-4]C+R[-16]C+R[-27]C+R[-38]C) -> 292500
A72: Head Count Totals | E72: =SUM(R[-4]C+R[-16]C+R[-27]C+R[-38]C) -> 6 | F72: =SUM(R[-4]C+R[-16]C+R[-27]C+R[-38]C) -> 7 | G72: =SUM(R[-4]C+R[-16]C+R[-27]C+R[-38]C) -> 10 | H72: =SUM(R[-4]C+R[-16]C+R[-27]C+R[-38]C) -> 14 | I72: =SUM(R[-4]C+R[-16]C+R[-27]C+R[-38]C) -> 18 | J72: =SUM(R[-4]C+R[-16]C+R[-27]C+R[-38]C) -> 22 | K72: =SUM(R[-4]C+R[-16]C+R[-27]C+R[-38]C) -> 30 | L72: =SUM(R[-4]C+R[-16]C+R[-27]C+R[-38]C) -> 34 | M72: =SUM(R[-4]C+R[-16]C+R[-27]C+R[-38]C) -> 38 | N72: =SUM(R[-4]C+R[-16]C+R[-27]C+R[-38]C) -> 38 | O72: =SUM(R[-4]C+R[-16]C+R[-27]C+R[-38]C) -> 40 | P72: =SUM(R[-4]C+R[-16]C+R[-27]C+R[-38]C) -> 40 | Q72: =SUM(R[-4]C+R[-16]C+R[-27]C+R[-38]C) -> 45 | R72: =SUM(R[-4]C+R[-16]C+R[-27]C+R[-38]C) -> 46 | S72: =SUM(R[-4]C+R[-16]C+R[-27]C+R[-38]C) -> 47 | T72: =SUM(R[-4]C+R[-16]C+R[-27]C+R[-38]C) -> 47 | U72: =SUM(R[-4]C+R[-16]C+R[-27]C+R[-38]C) -> 48 | V72: =SUM(R[-4]C+R[-16]C+R[-27]C+R[-38]C) -> 48 | W72: =SUM(R[-4]C+R[-16]C+R[-27]C+R[-38]C) -> 48 | X72: =SUM(R[-4]C+R[-16]C+R[-27]C+R[-38]C) -> 48 | Y72: =SUM(R[-4]C+R[-16]C+R[-27]C+R[-38]C) -> 48 | Z72: =SUM(R[-4]C+R[-16]C+R[-27]C+R[-38]C) -> 48 | AA72: =SUM(R[-4]C+R[-16]C+R[-27]C+R[-38]C) -> 48 | AB72: =SUM(R[-4]C+R[-16]C+R[-27]C+R[-38]C) -> 48 | AC72: =SUM(R[-4]C+R[-16]C+R[-27]C+R[-38]C) -> 48 | AD72: =SUM(R[-4]C+R[-16]C+R[-27]C+R[-38]C) -> 48 | AE72: =SUM(R[-4]C+R[-16]C+R[-27]C+R[-38]C) -> 48 | AF72: =SUM(R[-4]C+R[-16]C+R[-27]C+R[-38]C) -> 48 | AG72: =SUM(R[-4]C+R[-16]C+R[-27]C+R[-38]C) -> 48 | AH72: =SUM(R[-4]C+R[-16]C+R[-27]C+R[-38]C) -> 48 | AI72: =SUM(R[-4]C+R[-16]C+R[-27]C+R[-38]C) -> 48 | AJ72: =SUM(R[-4]C+R[-16]C+R[-27]C+R[-38]C) -> 48 | AK72: =SUM(R[-4]C+R[-16]C+R[-27]C+R[-38]C) -> 48 | AL72: =SUM(R[-4]C+R[-16]C+R[-27]C+R[-38]C) -> 48 | AM72: =SUM(R[-4]C+R[-16]C+R[-27]C+R[-38]C) -> 48 | AN72: =SUM(R[-4]C+R[-16]C+R[-27]C+R[-38]C) -> 48
A74: Quarterly Totals | G74: Q1 2001 | J74: Q2 2001 | M74: Q3 2001 | P74: Q4 2001 | S74: Q1 2002 | V74: Q2 2002 | Y74: Q3 2002 | AB74: Q4 2002 | AE74: Q1 2003 | AH74: Q2 2003 | AK74: Q13 2003 | AN74: Q4 2003
G75: =SUM(R[-4]C[-2]:R[-4]C) -> 175000 | J75: =SUM(R[-4]C[-2]:R[-4]C) -> 381666.66666666663 | M75: =SUM(R[-4]C[-2]:R[-4]C) -> 647083.33333333349 | P75: =SUM(R[-4]C[-2]:R[-4]C) -> 730833.33333333337 | S75: =SUM(R[-4]C[-2]:R[-4]C) -> 840833.33333333337 | V75: =SUM(R[-4]C[-2]:R[-4]C) -> 870833.33333333337 | Y75: =SUM(R[-4]C[-2]:R[-4]C) -> 877500 | AB75: =SUM(R[-4]C[-2]:R[-4]C) -> 877500 | AE75: =SUM(R[-4]C[-2]:R[-4]C) -> 877500 | AH75: =SUM(R[-4]C[-2]:R[-4]C) -> 877500 | AK75: =SUM(R[-4]C[-2]:R[-4]C) -> 877500 | AN75: =SUM(R[-4]C[-2]:R[-4]C) -> 877500

Sheet: CapitalExp
A1: CapitalExpenditures | D1: Start date | E1: =Payroll!RC[-1] -> 2001-01-01T00:00:00.000
A3: Items | B3: Cost | C3: Qty | D3: Total | E3: =R[-2]C -> 2001-01-01T00:00:00.000 | F3: =RC[-1]+31 -> 2001-02-01T00:00:00.000 | G3: =RC[-1]+31 -> 2001-03-04T00:00:00.000 | H3: =RC[-1]+31 -> 2001-04-04T00:00:00.000 | I3: =RC[-1]+31 -> 2001-05-05T00:00:00.000 | J3: =RC[-1]+31 -> 2001-06-05T00:00:00.000 | K3: =RC[-1]+31 -> 2001-07-06T00:00:00.000 | L3: =RC[-1]+31 -> 2001-08-06T00:00:00.000 | M3: =RC[-1]+31 -> 2001-09-06T00:00:00.000 | N3: =RC[-1]+31 -> 2001-10-07T00:00:00.000 | O3: =RC[-1]+31 -> 2001-11-07T00:00:00.000 | P3: =RC[-1]+31 -> 2001-12-08T00:00:00.000 | Q3: =RC[-1]+31 -> 2002-01-08T00:00:00.000 | R3: =RC[-1]+31 -> 2002-02-08T00:00:00.000 | S3: =RC[-1]+31 -> 2002-03-11T00:00:00.000 | T3: =RC[-1]+31 -> 2002-04-11T00:00:00.000 | U3: =RC[-1]+31 -> 2002-05-12T00:00:00.000 | V3: =RC[-1]+31 -> 2002-06-12T00:00:00.000 | W3: =RC[-1]+31 -> 2002-07-13T00:00:00.000 | X3: =RC[-1]+31 -> 2002-08-13T00:00:00.000 | Y3: =RC[-1]+31 -> 2002-09-13T00:00:00.000 | Z3: =RC[-1]+31 -> 2002-10-14T00:00:00.000 | AA3: =RC[-1]+31 -> 2002-11-14T00:00:00.000 | AB3: =RC[-1]+31 -> 2002-12-15T00:00:00.000 | AC3: =RC[-1]+31 -> 2003-01-15T00:00:00.000 | AD3: =RC[-1]+31 -> 2003-02-15T00:00:00.000 | AE3: =RC[-1]+31 -> 2003-03-18T00:00:00.000 | AF3: =RC[-1]+31 -> 2003-04-18T00:00:00.000 | AG3: =RC[-1]+31 -> 2003-05-19T00:00:00.000 | AH3: =RC[-1]+31 -> 2003-06-19T00:00:00.000 | AI3: =RC[-1]+31 -> 2003-07-20T00:00:00.000 | AJ3: =RC[-1]+31 -> 2003-08-20T00:00:00.000 | AK3: =RC[-1]+31 -> 2003-09-20T00:00:00.000 | AL3: =RC[-1]+31 -> 2003-10-21T00:00:00.000 | AM3: =RC[-1]+31 -> 2003-11-21T00:00:00.000 | AN3: =RC[-1]+31 -> 2003-12-22T00:00:00.000
A4: Hardware
A5: Laptops | B5: 2500 | C5: =SUM(RC[1])/RC[-1] -> 10 | D5: =SUM(RC[1]:RC[36]) -> 25000 | E5: =2*R5C2 -> 5000 | F5: =2*R5C2 -> 5000 | G5: =2*R5C2 -> 5000 | H5: =1*R5C2 -> 2500 | J5: =1*R5C2 -> 2500 | L5: =1*R5C2 -> 2500 | M5: =1*R5C2 -> 2500
A6: Desktops | B6: 1500 | C6: =SUM(RC[1])/RC[-1] -> 50 | D6: =SUM(RC[1]:RC[36]) -> 75000 | E6: =3*R6C2 -> 4500 | F6: =3*R6C2 -> 4500 | G6: =3*R6C2 -> 4500 | H6: =3*R6C2 -> 4500 | I6: =3*R6C2 -> 4500 | J6: =3*R6C2 -> 4500 | K6: =8*R6C2 -> 12000 | L6: =3*R6C2 -> 4500 | M6: =3*R6C2 -> 4500 | N6: =3*R6C2 -> 4500 | O6: =3*R6C2 -> 4500 | P6: =3*R6C2 -> 4500 | Q6: =3*R6C2 -> 4500 | R6: =3*R6C2 -> 4500 | S6: =3*R6C2 -> 4500
A7: Office Furniture | B7: 1000 | C7: =SUM(RC[1])/RC[-1] -> 54 | D7: =SUM(RC[1]:RC[36]) -> 54000 | E7: =3*R7C2 -> 3000 | F7: =3*R7C2 -> 3000 | G7: =3*R7C2 -> 3000 | H7: =3*R7C2 -> 3000 | I7: =3*R7C2 -> 3000 | J7: =3*R7C2 -> 3000 | K7: =8*R6C2 -> 12000 | L7: =3*R7C2 -> 3000 | M7: =3*R7C2 -> 3000 | N7: =3*R7C2 -> 3000 | O7: =3*R7C2 -> 3000 | P7: =3*R7C2 -> 3000 | Q7: =3*R7C2 -> 3000 | R7: =3*R7C2 -> 3000 | S7: =3*R7C2 -> 3000
A8: Other Furniture | B8: 500 | C8: =SUM(RC[1])/RC[-1] -> 5 | D8: =SUM(RC[1]:RC[36]) -> 2500 | E8: 500 | F8: 500 | I8: 500 | K8: 500 | N8: 500
A9: LAN Equipment, Printers | B9: 1000 | C9: =SUM(RC[1])/RC[-1] -> 17 | D9: =SUM(RC[1]:RC[36]) -> 17000 | E9: 5000 | F9: 1000 | G9: 1000 | H9: 1000 | I9: 1000 | J9: 1000 | L9: 1000 | N9: 1000 | P9: 5000
A10: Dev & QA Servers/Equip | B10: 1000 | C10: =SUM(RC[1])/RC[-1] -> 12 | D10: =SUM(RC[1]:RC[36]) -> 12000 | F10: 1000 | G10: 1000 | H10: 1000 | I10: 1000 | J10: 1000 | K10: 1000 | L10: 1000 | M10: 1000 | N10: 1000 | O10: 1000 | P10: 1000 | Q10: 1000
A11: Internal Internet gear | B11: 1000 | C11: =SUM(RC[1])/RC[-1] -> 5 | D11: =SUM(RC[1]:RC[36]) -> 5000 | E11: 1000 | F11: 1000 | J11: 1000 | K11: 1000 | L11: 1000
A12: Wiring/Provisioning | B12: 1000 | C12: =SUM(RC[1])/RC[-1] -> 0.8 | D12: =SUM(RC[1]:RC[36]) -> 800 | F12: 200 | G12: 200 | H12: 200 | I12: 200
A13: Phone System | B13: 15000 | C13: =SUM(RC[1])/RC[-1] -> 1 | D13: =SUM(RC[1]:RC[36]) -> 15000 | H13: 15000
A14: Fax machines | B14: 400 | C14: =SUM(RC[1])/RC[-1] -> 2 | D14: =SUM(RC[1]:RC[36]) -> 800 | F14: 400 | I14: 400
A15: Office Supplies | B15: 250 | C15: =SUM(RC[1])/RC[-1] -> 36 | D15: =SUM(RC[1]:RC[36]) -> 9000 | E15: 250 | F15: 250 | G15: 250 | H15: 250 | I15: 250 | J15: 250 | K15: 250 | L15: 250 | M15: 250 | N15: 250 | O15: 250 | P15: 250 | Q15: 250 | R15: 250 | S15: 250 | T15: 250 | U15: 250 | V15: 250 | W15: 250 | X15: 250 | Y15: 250 | Z15: 250 | AA15: 250 | AB15: 250 | AC15: 250 | AD15: 250 | AE15: 250 | AF15: 250 | AG15: 250 | AH15: 250 | AI15: 250 | AJ15: 250 | AK15: 250 | AL15: 250 | AM15: 250 | AN15: 250
B16: 150 | C16: =SUM(RC[1])/RC[-1] -> 17.666666666666668 | D16: =SUM(RC[1]:RC[36]) -> 2650 | F16: 450 | G16: 450 | H16: 450 | I16: 450 | J16: 450 | L16: 400
A17: Production Hardware | J17: 0 | K17: 300 | L17: 300
A18: Miscellaneous/Parts | B18: 1000 | C18: =SUM(RC[1])/RC[-1] -> 36 | D18: =SUM(RC[1]:RC[36]) -> 36000 | E18: 1000 | F18: 1000 | G18: 1000 | H18: 1000 | I18: 1000 | J18: 1000 | K18: 1000 | L18: 1000 | M18: 1000 | N18: 1000 | O18: 1000 | P18: 1000 | Q18: 1000 | R18: 1000 | S18: 1000 | T18: 1000 | U18: 1000 | V18: 1000 | W18: 1000 | X18: 1000 | Y18: 1000 | Z18: 1000 | AA18: 1000 | AB18: 1000 | AC18: 1000 | AD18: 1000 | AE18: 1000 | AF18: 1000 | AG18: 1000 | AH18: 1000 | AI18: 1000 | AJ18: 1000 | AK18: 1000 | AL18: 1000 | AM18: 1000 | AN18: 1000
A19: Total Hardware | D19: =SUM(R[-13]C:R[-2]C) -> 193750 | E19: =SUM(R[-13]C:R[-2]C) -> 14250 | F19: =SUM(R[-13]C:R[-1]C) -> 13300 | G19: =SUM(R[-13]C:R[-1]C) -> 11400 | H19: =SUM(R[-13]C:R[-1]C) -> 26400 | I19: =SUM(R[-13]C:R[-1]C) -> 12300 | J19: =SUM(R[-13]C:R[-1]C) -> 12200 | K19: =SUM(R[-13]C:R[-1]C) -> 28050 | L19: =SUM(R[-13]C:R[-1]C) -> 12450 | M19: =SUM(R[-13]C:R[-1]C) -> 9750 | N19: =SUM(R[-13]C:R[-1]C) -> 11250 | O19: =SUM(R[-13]C:R[-1]C) -> 9750 | P19: =SUM(R[-13]C:R[-1]C) -> 14750 | Q19: =SUM(R[-13]C:R[-1]C) -> 9750 | R19: =SUM(R[-13]C:R[-1]C) -> 8750 | S19: =SUM(R[-13]C:R[-1]C) -> 8750 | T19: =SUM(R[-13]C:R[-1]C) -> 1250 | U19: =SUM(R[-13]C:R[-1]C) -> 1250 | V19: =SUM(R[-13]C:R[-1]C) -> 1250 | W19: =SUM(R[-13]C:R[-1]C) -> 1250 | X19: =SUM(R[-13]C:R[-1]C) -> 1250 | Y19: =SUM(R[-13]C:R[-1]C) -> 1250 | Z19: =SUM(R[-13]C:R[-1]C) -> 1250 | AA19: =SUM(R[-13]C:R[-1]C) -> 1250 | AB19: =SUM(R[-13]C:R[-1]C) -> 1250 | AC19: =SUM(R[-13]C:R[-1]C) -> 1250 | AD19: =SUM(R[-13]C:R[-1]C) -> 1250 | AE19: =SUM(R[-13]C:R[-1]C) -> 1250 | AF19: =SUM(R[-13]C:R[-1]C) -> 1250 | AG19: =SUM(R[-13]C:R[-1]C) -> 1250 | AH19: =SUM(R[-13]C:R[-1]C) -> 1250 | AI19: =SUM(R[-13]C:R[-1]C) -> 1250 | AJ19: =SUM(R[-13]C:R[-1]C) -> 1250 | AK19: =SUM(R[-13]C:R[-1]C) -> 1250 | AL19: =SUM(R[-13]C:R[-1]C) -> 1250 | AM19: =SUM(R[-13]C:R[-1]C) -> 1250 | AN19: =SUM(R[-13]C:R[-1]C) -> 1250
A21: Software
A22: General Use Apps | B22: 500 | C22: =SUM(RC[1])/RC[-1] -> 15 | D22: =SUM(RC[1]:RC[36]) -> 7500 | E22: 500 | G22: 500 | H22: 500 | J22: 500 | K22: 500 | M22: 500 | N22: 500 | P22: 500 | Q22: 500 | U22: 500 | V22: 500 | Z22: 500 | AA22: 500 | AH22: 500 | AI22: 500
A23: Databases | B23: 2500 | C23: =SUM(RC[1])/RC[-1] -> 3 | D23: =SUM(RC[1]:RC[36]) -> 7500 | E23: 2500 | G23: 2500 | I23: 2500
A24: Tools | B24: 1000 | C24: =SUM(RC[1])/RC[-1] -> 36 | D24: =SUM(RC[1]:RC[36]) -> 36000 | E24: 1000 | F24: 1000 | G24: 1000 | H24: 1000 | I24: 1000 | J24: 1000 | K24: 1000 | L24: 1000 | M24: 1000 | N24: 1000 | O24: 1000 | P24: 1000 | Q24: 1000 | R24: 1000 | S24: 1000 | T24: 1000 | U24: 1000 | V24: 1000 | W24: 1000 | X24: 1000 | Y24: 1000 | Z24: 1000 | AA24: 1000 | AB24: 1000 | AC24: 1000 | AD24: 1000 | AE24: 1000 | AF24: 1000 | AG24: 1000 | AH24: 1000 | AI24: 1000 | AJ24: 1000 | AK24: 1000 | AL24: 1000 | AM24: 1000 | AN24: 1000
A25: Server Software | B25: 2500 | C25: =SUM(RC[1])/RC[-1] -> 10 | D25: =SUM(RC[1]:RC[36]) -> 25000 | E25: 2500 | F25: 2500 | G25: 2500 | H25: 2500 | I25: 2500 | L25: 2500 | N25: 2500 | P25: 2500 | S25: 2500 | V25: 2500
A26: Miscellaneous | B26: 500 | C26: =SUM(RC[1])/RC[-1] -> 36 | D26: =SUM(RC[1]:RC[36]) -> 18000 | E26: 500 | F26: 500 | G26: 500 | H26: 500 | I26: 500 | J26: 500 | K26: 500 | L26: 500 | M26: 500 | N26: 500 | O26: 500 | P26: 500 | Q26: 500 | R26: 500 | S26: 500 | T26: 500 | U26: 500 | V26: 500 | W26: 500 | X26: 500 | Y26: 500 | Z26: 500 | AA26: 500 | AB26: 500 | AC26: 500 | AD26: 500 | AE26: 500 | AF26: 500 | AG26: 500 | AH26: 500 | AI26: 500 | AJ26: 500 | AK26: 500 | AL26: 500 | AM26: 500 | AN26: 500
A27: Total Software | D27: =SUM(R[-4]C:R[-2]C) -> 68500 | E27: =SUM(R[-4]C:R[-2]C) -> 6000 | F27: =SUM(R[-4]C:R[-1]C) -> 4000 | G27: =SUM(R[-4]C:R[-1]C) -> 6500 | H27: =SUM(R[-4]C:R[-1]C) -> 4000 | I27: =SUM(R[-4]C:R[-1]C) -> 6500 | J27: =SUM(R[-4]C:R[-1]C) -> 1500 | K27: =SUM(R[-4]C:R[-1]C) -> 1500 | L27: =SUM(R[-4]C:R[-1]C) -> 4000 | M27: =SUM(R[-4]C:R[-1]C) -> 1500 | N27: =SUM(R[-4]C:R[-1]C) -> 4000 | O27: =SUM(R[-4]C:R[-1]C) -> 1500 | P27: =SUM(R[-4]C:R[-1]C) -> 4000 | Q27: =SUM(R[-4]C:R[-1]C) -> 1500 | R27: =SUM(R[-4]C:R[-1]C) -> 1500 | S27: =SUM(R[-4]C:R[-1]C) -> 4000 | T27: =SUM(R[-4]C:R[-1]C) -> 1500 | U27: =SUM(R[-4]C:R[-1]C) -> 1500 | V27: =SUM(R[-4]C:R[-1]C) -> 4000 | W27: =SUM(R[-4]C:R[-1]C) -> 1500 | X27: =SUM(R[-4]C:R[-1]C) -> 1500 | Y27: =SUM(R[-4]C:R[-1]C) -> 1500 | Z27: =SUM(R[-4]C:R[-1]C) -> 1500 | AA27: =SUM(R[-4]C:R[-1]C) -> 1500 | AB27: =SUM(R[-4]C:R[-1]C) -> 1500 | AC27: =SUM(R[-4]C:R[-1]C) -> 1500 | AD27: =SUM(R[-4]C:R[-1]C) -> 1500 | AE27: =SUM(R[-4]C:R[-1]C) -> 1500 | AF27: =SUM(R[-4]C:R[-1]C) -> 1500 | AG27: =SUM(R[-4]C:R[-1]C) -> 1500 | AH27: =SUM(R[-4]C:R[-1]C) -> 1500 | AI27: =SUM(R[-4]C:R[-1]C) -> 1500 | AJ27: =SUM(R[-4]C:R[-1]C) -> 1500 | AK27: =SUM(R[-4]C:R[-1]C) -> 1500 | AL27: =SUM(R[-4]C:R[-1]C) -> 1500 | AM27: =SUM(R[-4]C:R[-1]C) -> 1500 | AN27: =SUM(R[-4]C:R[-1]C) -> 1500
A29: Capital Monthly Total | E29: =SUM(R[-10]C+R[-2]C) -> 20250 | F29: =SUM(R[-10]C+R[-2]C) -> 17300 | G29: =SUM(R[-10]C+R[-2]C) -> 17900 | H29: =SUM(R[-10]C+R[-2]C) -> 30400 | I29: =SUM(R[-10]C+R[-2]C) -> 18800 | J29: =SUM(R[-10]C+R[-2]C) -> 13700 | K29: =SUM(R[-10]C+R[-2]C) -> 29550 | L29: =SUM(R[-10]C+R[-2]C) -> 16450 | M29: =SUM(R[-10]C+R[-2]C) -> 11250 | N29: =SUM(R[-10]C+R[-2]C) -> 15250 | O29: =SUM(R[-10]C+R[-2]C) -> 11250 | P29: =SUM(R[-10]C+R[-2]C) -> 18750 | Q29: =SUM(R[-10]C+R[-2]C) -> 11250 | R29: =SUM(R[-10]C+R[-2]C) -> 10250 | S29: =SUM(R[-10]C+R[-2]C) -> 12750 | T29: =SUM(R[-10]C+R[-2]C) -> 2750 | U29: =SUM(R[-10]C+R[-2]C) -> 2750 | V29: =SUM(R[-10]C+R[-2]C) -> 5250 | W29: =SUM(R[-10]C+R[-2]C) -> 2750 | X29: =SUM(R[-10]C+R[-2]C) -> 2750 | Y29: =SUM(R[-10]C+R[-2]C) -> 2750 | Z29: =SUM(R[-10]C+R[-2]C) -> 2750 | AA29: =SUM(R[-10]C+R[-2]C) -> 2750 | AB29: =SUM(R[-10]C+R[-2]C) -> 2750 | AC29: =SUM(R[-10]C+R[-2]C) -> 2750 | AD29: =SUM(R[-10]C+R[-2]C) -> 2750 | AE29: =SUM(R[-10]C+R[-2]C) -> 2750 | AF29: =SUM(R[-10]C+R[-2]C) -> 2750 | AG29: =SUM(R[-10]C+R[-2]C) -> 2750 | AH29: =SUM(R[-10]C+R[-2]C) -> 2750 | AI29: =SUM(R[-10]C+R[-2]C) -> 2750 | AJ29: =SUM(R[-10]C+R[-2]C) -> 2750 | AK29: =SUM(R[-10]C+R[-2]C) -> 2750 | AL29: =SUM(R[-10]C+R[-2]C) -> 2750 | AM29: =SUM(R[-10]C+R[-2]C) -> 2750 | AN29: =SUM(R[-10]C+R[-2]C) -> 2750
A30: Head Count Totals | E30: =Payroll!R[42]C -> 6 | F30: =Payroll!R[42]C -> 7 | G30: =Payroll!R[42]C -> 10 | H30: =Payroll!R[42]C -> 14 | I30: =Payroll!R[42]C -> 18 | J30: =Payroll!R[42]C -> 22 | K30: =Payroll!R[42]C -> 30 | L30: =Payroll!R[42]C -> 34 | M30: =Payroll!R[42]C -> 38 | N30: =Payroll!R[42]C -> 38 | O30: =Payroll!R[42]C -> 40 | P30: =Payroll!R[42]C -> 40 | Q30: =Payroll!R[42]C -> 45 | R30: =Payroll!R[42]C -> 46 | S30: =Payroll!R[42]C -> 47 | T30: =Payroll!R[42]C -> 47 | U30: =Payroll!R[42]C -> 48 | V30: =Payroll!R[42]C -> 48 | W30: =Payroll!R[42]C -> 48 | X30: =Payroll!R[42]C -> 48 | Y30: =Payroll!R[42]C -> 48 | Z30: =Payroll!R[42]C -> 48 | AA30: =Payroll!R[42]C -> 48 | AB30: =Payroll!R[42]C -> 48 | AC30: =Payroll!R[42]C -> 48 | AD30: =Payroll!R[42]C -> 48 | AE30: =Payroll!R[42]C -> 48 | AF30: =Payroll!R[42]C -> 48 | AG30: =Payroll!R[42]C -> 48 | AH30: =Payroll!R[42]C -> 48 | AI30: =Payroll!R[42]C -> 48 | AJ30: =Payroll!R[42]C -> 48 | AK30: =Payroll!R[42]C -> 48 | AL30: =Payroll!R[42]C -> 48 | AM30: =Payroll!R[42]C -> 48 | AN30: =Payroll!R[42]C -> 48
A32: Quarterly Totals | G32: Q1 2001 | J32: Q2 2001 | M32: Q3 2001 | P32: Q4 2001 | S32: Q1 2002 | V32: Q2 2002 | Y32: Q3 2002 | AB32: Q4 2002 | AE32: Q1 2003 | AH32: Q2 2003 | AK32: Q13 2003 | AN32: Q4 2003
G33: =SUM(R[-6]C[-2]:R[-6]C) -> 16500 | J33: =SUM(R[-6]C[-2]:R[-6]C) -> 12000 | M33: =SUM(R[-6]C[-2]:R[-6]C) -> 7000 | P33: =SUM(R[-6]C[-2]:R[-6]C) -> 9500 | S33: =SUM(R[-6]C[-2]:R[-6]C) -> 7000 | V33: =SUM(R[-6]C[-2]:R[-6]C) -> 7000 | Y33: =SUM(R[-6]C[-2]:R[-6]C) -> 4500 | AB33: =SUM(R[-6]C[-2]:R[-6]C) -> 4500 | AE33: =SUM(R[-6]C[-2]:R[-6]C) -> 4500 | AH33: =SUM(R[-6]C[-2]:R[-6]C) -> 4500 | AK33: =SUM(R[-6]C[-2]:R[-6]C) -> 4500 | AN33: =SUM(R[-6]C[-2]:R[-6]C) -> 4500

Sheet: Expenses
A1: Monthly Services | B1: start date | C1: =Payroll!RC[1] -> 2001-01-01T00:00:00.000
B3: Cost | C3: Total | D3: =R[-2]C[-1] -> 2001-01-01T00:00:00.000 | E3: =RC[-1]+31 -> 2001-02-01T00:00:00.000 | F3: =RC[-1]+31 -> 2001-03-04T00:00:00.000 | G3: =RC[-1]+31 -> 2001-04-04T00:00:00.000 | H3: =RC[-1]+31 -> 2001-05-05T00:00:00.000 | I3: =RC[-1]+31 -> 2001-06-05T00:00:00.000 | J3: =RC[-1]+31 -> 2001-07-06T00:00:00.000 | K3: =RC[-1]+31 -> 2001-08-06T00:00:00.000 | L3: =RC[-1]+31 -> 2001-09-06T00:00:00.000 | M3: =RC[-1]+31 -> 2001-10-07T00:00:00.000 | N3: =RC[-1]+31 -> 2001-11-07T00:00:00.000 | O3: =RC[-1]+31 -> 2001-12-08T00:00:00.000 | P3: =RC[-1]+31 -> 2002-01-08T00:00:00.000 | Q3: =RC[-1]+31 -> 2002-02-08T00:00:00.000 | R3: =RC[-1]+31 -> 2002-03-11T00:00:00.000 | S3: =RC[-1]+31 -> 2002-04-11T00:00:00.000 | T3: =RC[-1]+31 -> 2002-05-12T00:00:00.000 | U3: =RC[-1]+31 -> 2002-06-12T00:00:00.000 | V3: =RC[-1]+31 -> 2002-07-13T00:00:00.000 | W3: =RC[-1]+31 -> 2002-08-13T00:00:00.000 | X3: =RC[-1]+31 -> 2002-09-13T00:00:00.000 | Y3: =RC[-1]+31 -> 2002-10-14T00:00:00.000 | Z3: =RC[-1]+31 -> 2002-11-14T00:00:00.000 | AA3: =RC[-1]+31 -> 2002-12-15T00:00:00.000 | AB3: =RC[-1]+31 -> 2003-01-15T00:00:00.000 | AC3: =RC[-1]+31 -> 2003-02-15T00:00:00.000 | AD3: =RC[-1]+31 -> 2003-03-18T00:00:00.000 | AE3: =RC[-1]+31 -> 2003-04-18T00:00:00.000 | AF3: =RC[-1]+31 -> 2003-05-19T00:00:00.000 | AG3: =RC[-1]+31 -> 2003-06-19T00:00:00.000 | AH3: =RC[-1]+31 -> 2003-07-20T00:00:00.000 | AI3: =RC[-1]+31 -> 2003-08-20T00:00:00.000 | AJ3: =RC[-1]+31 -> 2003-09-20T00:00:00.000 | AK3: =RC[-1]+31 -> 2003-10-21T00:00:00.000 | AL3: =RC[-1]+31 -> 2003-11-21T00:00:00.000 | AM3: =RC[-1]+31 -> 2003-12-22T00:00:00.000
A4: Rent | C4: =SUM(RC[1]:RC[36]) -> 770000 | D4: 5000 | E4: 10000 | F4: 10000 | G4: 10000 | H4: 10000 | I4: 15000 | J4: 15000 | K4: 15000 | L4: 15000 | M4: 15000 | N4: 25000 | O4: 25000 | P4: 25000 | Q4: 25000 | R4: 25000 | S4: 25000 | T4: 25000 | U4: 25000 | V4: 25000 | W4: 25000 | X4: 25000 | Y4: 25000 | Z4: 25000 | AA4: 25000 | AB4: 25000 | AC4: 25000 | AD4: 25000 | AE4: 25000 | AF4: 25000 | AG4: 25000 | AH4: 25000 | AI4: 25000 | AJ4: 25000 | AK4: 25000 | AL4: 25000 | AM4: 25000
A5: Office internet service | B5: 500 | C5: =SUM(RC[1]:RC[36]) -> 18000 | D5: =RC2 -> 500 | E5: =RC2 -> 500 | F5: =RC2 -> 500 | G5: =RC2 -> 500 | H5: =RC2 -> 500 | I5: =RC2 -> 500 | J5: =RC2 -> 500 | K5: =RC2 -> 500 | L5: =RC2 -> 500 | M5: =RC2 -> 500 | N5: =RC2 -> 500 | O5: =RC2 -> 500 | P5: =RC2 -> 500 | Q5: =RC2 -> 500 | R5: =RC2 -> 500 | S5: =RC2 -> 500 | T5: =RC2 -> 500 | U5: =RC2 -> 500 | V5: =RC2 -> 500 | W5: =RC2 -> 500 | X5: =RC2 -> 500 | Y5: =RC2 -> 500 | Z5: =RC2 -> 500 | AA5: =RC2 -> 500 | AB5: =RC2 -> 500 | AC5: =RC2 -> 500 | AD5: =RC2 -> 500 | AE5: =RC2 -> 500 | AF5: =RC2 -> 500 | AG5: =RC2 -> 500 | AH5: =RC2 -> 500 | AI5: =RC2 -> 500 | AJ5: =RC2 -> 500 | AK5: =RC2 -> 500 | AL5: =RC2 -> 500 | AM5: =RC2 -> 500
A6: CoLocation service | C6: =SUM(RC[1]:RC[36]) -> 1900000 | I6: 10000 | J6: 15000 | K6: 25000 | L6: 35000 | M6: 45000 | N6: 45000 | O6: 45000 | P6: 55000 | Q6: 55000 | R6: 55000 | S6: 55000 | T6: 55000 | U6: 55000 | V6: 75000 | W6: 75000 | X6: 75000 | Y6: 75000 | Z6: 75000 | AA6: 75000 | AB6: 75000 | AC6: 75000 | AD6: 75000 | AE6: 75000 | AF6: 75000 | AG6: 75000 | AH6: 75000 | AI6: 75000 | AJ6: 75000 | AK6: 75000 | AL6: 75000 | AM6: 75000
A7: Phone service | B7: 1000 | C7: =SUM(RC[1]:RC[36]) -> 36000 | D7: =RC2 -> 1000 | E7: =RC2 -> 1000 | F7: =RC2 -> 1000 | G7: =RC2 -> 1000 | H7: =RC2 -> 1000 | I7: =RC2 -> 1000 | J7: =RC2 -> 1000 | K7: =RC2 -> 1000 | L7: =RC2 -> 1000 | M7: =RC2 -> 1000 | N7: =RC2 -> 1000 | O7: =RC2 -> 1000 | P7: =RC2 -> 1000 | Q7: =RC2 -> 1000 | R7: =RC2 -> 1000 | S7: =RC2 -> 1000 | T7: =RC2 -> 1000 | U7: =RC2 -> 1000 | V7: =RC2 -> 1000 | W7: =RC2 -> 1000 | X7: =RC2 -> 1000 | Y7: =RC2 -> 1000 | Z7: =RC2 -> 1000 | AA7: =RC2 -> 1000 | AB7: =RC2 -> 1000 | AC7: =RC2 -> 1000 | AD7: =RC2 -> 1000 | AE7: =RC2 -> 1000 | AF7: =RC2 -> 1000 | AG7: =RC2 -> 1000 | AH7: =RC2 -> 1000 | AI7: =RC2 -> 1000 | AJ7: =RC2 -> 1000 | AK7: =RC2 -> 1000 | AL7: =RC2 -> 1000 | AM7: =RC2 -> 1000
A8: Copier/Office Equipment | B8: 1000 | C8: =SUM(RC[1]:RC[36]) -> 36000 | D8: =RC2 -> 1000 | E8: =RC2 -> 1000 | F8: =RC2 -> 1000 | G8: =RC2 -> 1000 | H8: =RC2 -> 1000 | I8: =RC2 -> 1000 | J8: =RC2 -> 1000 | K8: =RC2 -> 1000 | L8: =RC2 -> 1000 | M8: =RC2 -> 1000 | N8: =RC2 -> 1000 | O8: =RC2 -> 1000 | P8: =RC2 -> 1000 | Q8: =RC2 -> 1000 | R8: =RC2 -> 1000 | S8: =RC2 -> 1000 | T8: =RC2 -> 1000 | U8: =RC2 -> 1000 | V8: =RC2 -> 1000 | W8: =RC2 -> 1000 | X8: =RC2 -> 1000 | Y8: =RC2 -> 1000 | Z8: =RC2 -> 1000 | AA8: =RC2 -> 1000 | AB8: =RC2 -> 1000 | AC8: =RC2 -> 1000 | AD8: =RC2 -> 1000 | AE8: =RC2 -> 1000 | AF8: =RC2 -> 1000 | AG8: =RC2 -> 1000 | AH8: =RC2 -> 1000 | AI8: =RC2 -> 1000 | AJ8: =RC2 -> 1000 | AK8: =RC2 -> 1000 | AL8: =RC2 -> 1000 | AM8: =RC2 -> 1000
A10: Service Firm Full App V1 | C10: =SUM(RC[1]:RC[36]) -> 600000 | D10: 100000 | E10: 100000 | F10: 100000 | G10: 100000 | H10: 100000 | I10: 50000 | J10: 50000
A11: Service Firm App Upgrades | C11: =SUM(RC[1]:RC[36]) -> 1150000 | J11: 50000 | K11: 50000 | L11: 50000 | M11: 50000 | N11: 50000 | O11: 50000 | Q11: 50000 | S11: 50000 | U11: 50000 | V11: 100000 | W11: 100000 | X11: 100000 | Y11: 50000 | AA11: 50000 | AC11: 50000 | AE11: 50000 | AG11: 50000 | AI11: 50000 | AK11: 50000 | AM11: 50000
A12: Service Firm Interfaces | C12: =SUM(RC[1]:RC[36]) -> 550000 | E12: 75000 | F12: 75000 | G12: 75000 | H12: 50000 | I12: 75000 | J12: 50000 | K12: 75000 | M12: 75000
A13: Service Firm Interface Upgrades | C13: =SUM(RC[1]:RC[36]) -> 700000 | K13: 35000 | L13: 35000 | M13: 35000 | N13: 35000 | O13: 35000 | P13: 35000 | Q13: 35000 | S13: 35000 | U13: 35000 | W13: 35000 | X13: 35000 | Y13: 35000 | Z13: 35000 | AA13: 35000 | AC13: 35000 | AE13: 35000 | AG13: 35000 | AI13: 35000 | AK13: 35000 | AM13: 35000
A15: Commissions | C15: =SUM(RC[1]:RC[36]) -> 550000 | I15: 5000 | J15: 5000 | K15: 5000 | L15: 10000 | M15: 10000 | N15: 10000 | O15: 10000 | P15: 10000 | Q15: 10000 | R15: 10000 | S15: 10000 | T15: 10000 | U15: 10000 | V15: 10000 | W15: 25000 | X15: 25000 | Y15: 25000 | Z15: 25000 | AA15: 25000 | AB15: 25000 | AC15: 25000 | AD15: 25000 | AE15: 25000 | AF15: 25000 | AG15: 25000 | AH15: 25000 | AI15: 25000 | AJ15: 25000 | AK15: 25000 | AL15: 25000 | AM15: 25000
A16: Recruiting and Placement | C16: =SUM(RC[1]:RC[36]) -> 120000 | D16: 10000 | E16: 10000 | F16: 10000 | G16: 10000 | H16: 10000 | I16: 10000 | J16: 10000 | K16: 10000 | L16: 10000 | M16: 10000 | N16: 10000 | O16: 10000
A17: Legal Fees | C17: =SUM(RC[1]:RC[36]) -> 180000 | D17: 5000 | E17: 5000 | F17: 5000 | G17: 5000 | H17: 5000 | I17: 5000 | J17: 5000 | K17: 5000 | L17: 5000 | M17: 5000 | N17: 5000 | O17: 5000 | P17: 5000 | Q17: 5000 | R17: 5000 | S17: 5000 | T17: 5000 | U17: 5000 | V17: 5000 | W17: 5000 | X17: 5000 | Y17: 5000 | Z17: 5000 | AA17: 5000 | AB17: 5000 | AC17: 5000 | AD17: 5000 | AE17: 5000 | AF17: 5000 | AG17: 5000 | AH17: 5000 | AI17: 5000 | AJ17: 5000 | AK17: 5000 | AL17: 5000 | AM17: 5000
A18: Promotional Materials | C18: =SUM(RC[1]:RC[36]) -> 10000 | F18: 2500 | I18: 2500 | M18: 2500 | P18: 2500
A19: Outsourced Accounting | C19: =SUM(RC[1]:RC[36]) -> 4500 | D19: 500 | E19: 500 | F19: 500 | G19: 1000 | H19: 1000 | I19: 1000
A20: Outsourced HR | B20: 1000 | D20: =R20C2 -> 1000 | E20: =R20C2 -> 1000 | F20: =R20C2 -> 1000 | G20: =R20C2 -> 1000 | H20: =R20C2 -> 1000 | I20: =R20C2 -> 1000 | J20: =R20C2 -> 1000 | K20: =R20C2 -> 1000 | L20: =R20C2 -> 1000 | M20: =R20C2 -> 1000 | N20: =R20C2 -> 1000 | O20: =R20C2 -> 1000 | P20: =R20C2 -> 1000 | Q20: =R20C2 -> 1000 | R20: =R20C2 -> 1000 | S20: =R20C2 -> 1000 | T20: =R20C2 -> 1000 | U20: =R20C2 -> 1000 | V20: =R20C2 -> 1000 | W20: =R20C2 -> 1000 | X20: =R20C2 -> 1000 | Y20: =R20C2 -> 1000 | Z20: =R20C2 -> 1000 | AA20: =R20C2 -> 1000 | AB20: =R20C2 -> 1000 | AC20: =R20C2 -> 1000 | AD20: =R20C2 -> 1000 | AE20: =R20C2 -> 1000 | AF20: =R20C2 -> 1000 | AG20: =R20C2 -> 1000 | AH20: =R20C2 -> 1000 | AI20: =R20C2 -> 1000 | AJ20: =R20C2 -> 1000 | AK20: =R20C2 -> 1000 | AL20: =R20C2 -> 1000 | AM20: =R20C2 -> 1000
A21: Field Sales Office Costs | C21: =SUM(RC[1]:RC[36]) -> 79000 | I21: 1000 | J21: 1000 | K21: 1000 | L21: 1000 | M21: 2000 | N21: 2000 | O21: 2000 | P21: 2000 | Q21: 2000 | R21: 2000 | S21: 3000 | T21: 3000 | U21: 3000 | V21: 3000 | W21: 3000 | X21: 3000 | Y21: 3000 | Z21: 3000 | AA21: 3000 | AB21: 3000 | AC21: 3000 | AD21: 3000 | AE21: 3000 | AF21: 3000 | AG21: 3000 | AH21: 3000 | AI21: 3000 | AJ21: 3000 | AK21: 3000 | AL21: 3000 | AM21: 3000
A22: Printing | C22: =SUM(RC[1]:RC[36]) -> 16100 | E22: 2500 | F22: 400 | G22: 400 | H22: 400 | I22: 400 | J22: 400 | K22: 400 | L22: 400 | M22: 400 | N22: 400 | O22: 400 | P22: 400 | Q22: 400 | R22: 400 | S22: 400 | T22: 400 | U22: 400 | V22: 400 | W22: 400 | X22: 400 | Y22: 400 | Z22: 400 | AA22: 400 | AB22: 400 | AC22: 400 | AD22: 400 | AE22: 400 | AF22: 400 | AG22: 400 | AH22: 400 | AI22: 400 | AJ22: 400 | AK22: 400 | AL22: 400 | AM22: 400
A23: Postage & Delivery | C23: =SUM(RC[1]:RC[36]) -> 10500 | E23: 300 | F23: 300 | G23: 300 | H23: 300 | I23: 300 | J23: 300 | K23: 300 | L23: 300 | M23: 300 | N23: 300 | O23: 300 | P23: 300 | Q23: 300 | R23: 300 | S23: 300 | T23: 300 | U23: 300 | V23: 300 | W23: 300 | X23: 300 | Y23: 300 | Z23: 300 | AA23: 300 | AB23: 300 | AC23: 300 | AD23: 300 | AE23: 300 | AF23: 300 | AG23: 300 | AH23: 300 | AI23: 300 | AJ23: 300 | AK23: 300 | AL23: 300 | AM23: 300
A24: Trade Shows | C24: =SUM(RC[1]:RC[36]) -> 142000 | J24: 10000 | M24: 10000 | P24: 10000 | S24: 10000 | V24: 10000 | Y24: 10000 | AB24: 10000 | AC24: 2000 | AE24: 10000 | AH24: 10000 | AI24: 10000 | AJ24: 10000 | AK24: 10000 | AL24: 10000 | AM24: 10000
A25: Travel Expenses | C25: =SUM(RC[1]:RC[36]) -> 300000 | D25: 3000 | E25: 3000 | F25: 3000 | G25: 3000 | H25: 5000 | I25: 5000 | J25: 5000 | K25: 5000 | L25: 7000 | M25: 7000 | N25: 7000 | O25: 7000 | P25: 10000 | Q25: 10000 | R25: 10000 | S25: 10000 | T25: 10000 | U25: 10000 | V25: 10000 | W25: 10000 | X25: 10000 | Y25: 10000 | Z25: 10000 | AA25: 10000 | AB25: 10000 | AC25: 10000 | AD25: 10000 | AE25: 10000 | AF25: 10000 | AG25: 10000 | AH25: 10000 | AI25: 10000 | AJ25: 10000 | AK25: 10000 | AL25: 10000 | AM25: 10000
A26: Other | C26: =SUM(RC[1]:RC[36]) -> 360000 | D26: 10000 | E26: 10000 | F26: 10000 | G26: 10000 | H26: 10000 | I26: 10000 | J26: 10000 | K26: 10000 | L26: 10000 | M26: 10000 | N26: 10000 | O26: 10000 | P26: 10000 | Q26: 10000 | R26: 10000 | S26: 10000 | T26: 10000 | U26: 10000 | V26: 10000 | W26: 10000 | X26: 10000 | Y26: 10000 | Z26: 10000 | AA26: 10000 | AB26: 10000 | AC26: 10000 | AD26: 10000 | AE26: 10000 | AF26: 10000 | AG26: 10000 | AH26: 10000 | AI26: 10000 | AJ26: 10000 | AK26: 10000 | AL26: 10000 | AM26: 10000
A27: Total | C27: =SUM(R[-23]C:R[-1]C) -> 7532100 | D27: =SUM(R[-23]C:R[-17]C) -> 107500 | E27: =SUM(R[-23]C:R[-17]C) -> 112500 | F27: =SUM(R[-23]C:R[-17]C) -> 112500 | G27: =SUM(R[-23]C:R[-17]C) -> 112500 | H27: =SUM(R[-23]C:R[-17]C) -> 112500 | I27: =SUM(R[-23]C:R[-17]C) -> 77500 | J27: =SUM(R[-23]C:R[-17]C) -> 82500 | K27: =SUM(R[-23]C:R[-17]C) -> 42500 | L27: =SUM(R[-23]C:R[-17]C) -> 52500 | M27: =SUM(R[-23]C:R[-17]C) -> 62500 | N27: =SUM(R[-23]C:R[-17]C) -> 72500 | O27: =SUM(R[-23]C:R[-17]C) -> 72500 | P27: =SUM(R[-23]C:R[-17]C) -> 82500 | Q27: =SUM(R[-23]C:R[-17]C) -> 82500 | R27: =SUM(R[-23]C:R[-17]C) -> 82500 | S27: =SUM(R[-23]C:R[-17]C) -> 82500 | T27: =SUM(R[-23]C:R[-17]C) -> 82500 | U27: =SUM(R[-23]C:R[-17]C) -> 82500 | V27: =SUM(R[-23]C:R[-17]C) -> 102500 | W27: =SUM(R[-23]C:R[-17]C) -> 102500 | X27: =SUM(R[-23]C:R[-17]C) -> 102500 | Y27: =SUM(R[-23]C:R[-17]C) -> 102500 | Z27: =SUM(R[-23]C:R[-17]C) -> 102500 | AA27: =SUM(R[-23]C:R[-17]C) -> 102500 | AB27: =SUM(R[-23]C:R[-17]C) -> 102500 | AC27: =SUM(R[-23]C:R[-17]C) -> 102500 | AD27: =SUM(R[-23]C:R[-17]C) -> 102500 | AE27: =SUM(R[-23]C:R[-17]C) -> 102500 | AF27: =SUM(R[-23]C:R[-17]C) -> 102500 | AG27: =SUM(R[-23]C:R[-17]C) -> 102500 | AH27: =SUM(R[-23]C:R[-17]C) -> 102500 | AI27: =SUM(R[-23]C:R[-17]C) -> 102500 | AJ27: =SUM(R[-23]C:R[-17]C) -> 102500 | AK27: =SUM(R[-23]C:R[-17]C) -> 102500 | AL27: =SUM(R[-23]C:R[-17]C) -> 102500 | AM27: =SUM(R[-23]C:R[-17]C) -> 102500
A29: Monthly Total | D29: =SUM(R[-25]C:R[-3]C) -> 137000 | E29: =SUM(R[-25]C:R[-3]C) -> 219800 | F29: =SUM(R[-25]C:R[-3]C) -> 220200 | G29: =SUM(R[-25]C:R[-3]C) -> 218200 | H29: =SUM(R[-25]C:R[-3]C) -> 195200 | I29: =SUM(R[-25]C:R[-3]C) -> 193700 | J29: =SUM(R[-25]C:R[-3]C) -> 230200 | K29: =SUM(R[-25]C:R[-3]C) -> 240200 | L29: =SUM(R[-25]C:R[-3]C) -> 182200 | M29: =SUM(R[-25]C:R[-3]C) -> 280700 | N29: =SUM(R[-25]C:R[-3]C) -> 203200 | O29: =SUM(R[-25]C:R[-3]C) -> 203200 | P29: =SUM(R[-25]C:R[-3]C) -> 168700 | Q29: =SUM(R[-25]C:R[-3]C) -> 206200 | R29: =SUM(R[-25]C:R[-3]C) -> 121200 | S29: =SUM(R[-25]C:R[-3]C) -> 217200 | T29: =SUM(R[-25]C:R[-3]C) -> 122200 | U29: =SUM(R[-25]C:R[-3]C) -> 207200 | V29: =SUM(R[-25]C:R[-3]C) -> 252200 | W29: =SUM(R[-25]C:R[-3]C) -> 292200 | X29: =SUM(R[-25]C:R[-3]C) -> 292200 | Y29: =SUM(R[-25]C:R[-3]C) -> 252200 | Z29: =SUM(R[-25]C:R[-3]C) -> 192200 | AA29: =SUM(R[-25]C:R[-3]C) -> 242200 | AB29: =SUM(R[-25]C:R[-3]C) -> 167200 | AC29: =SUM(R[-25]C:R[-3]C) -> 244200 | AD29: =SUM(R[-25]C:R[-3]C) -> 157200 | AE29: =SUM(R[-25]C:R[-3]C) -> 252200 | AF29: =SUM(R[-25]C:R[-3]C) -> 157200 | AG29: =SUM(R[-25]C:R[-3]C) -> 242200 | AH29: =SUM(R[-25]C:R[-3]C) -> 167200 | AI29: =SUM(R[-25]C:R[-3]C) -> 252200 | AJ29: =SUM(R[-25]C:R[-3]C) -> 167200 | AK29: =SUM(R[-25]C:R[-3]C) -> 252200 | AL29: =SUM(R[-25]C:R[-3]C) -> 167200 | AM29: =SUM(R[-25]C:R[-3]C) -> 252200
A30: Head Count Totals | D30: =Payroll!R[42]C[1] -> 6 | E30: =Payroll!R[42]C[1] -> 7 | F30: =Payroll!R[42]C[1] -> 10 | G30: =Payroll!R[42]C[1] -> 14 | H30: =Payroll!R[42]C[1] -> 18 | I30: =Payroll!R[42]C[1] -> 22 | J30: =Payroll!R[42]C[1] -> 30 | K30: =Payroll!R[42]C[1] -> 34 | L30: =Payroll!R[42]C[1] -> 38 | M30: =Payroll!R[42]C[1] -> 38 | N30: =Payroll!R[42]C[1] -> 40 | O30: =Payroll!R[42]C[1] -> 40 | P30: =Payroll!R[42]C[1] -> 45 | Q30: =Payroll!R[42]C[1] -> 46 | R30: =Payroll!R[42]C[1] -> 47 | S30: =Payroll!R[42]C[1] -> 47 | T30: =Payroll!R[42]C[1] -> 48 | U30: =Payroll!R[42]C[1] -> 48 | V30: =Payroll!R[42]C[1] -> 48 | W30: =Payroll!R[42]C[1] -> 48 | X30: =Payroll!R[42]C[1] -> 48 | Y30: =Payroll!R[42]C[1] -> 48 | Z30: =Payroll!R[42]C[1] -> 48 | AA30: =Payroll!R[42]C[1] -> 48 | AB30: =Payroll!R[42]C[1] -> 48 | AC30: =Payroll!R[42]C[1] -> 48 | AD30: =Payroll!R[42]C[1] -> 48 | AE30: =Payroll!R[42]C[1] -> 48 | AF30: =Payroll!R[42]C[1] -> 48 | AG30: =Payroll!R[42]C[1] -> 48 | AH30: =Payroll!R[42]C[1] -> 48 | AI30: =Payroll!R[42]C[1] -> 48 | AJ30: =Payroll!R[42]C[1] -> 48 | AK30: =Payroll!R[42]C[1] -> 48 | AL30: =Payroll!R[42]C[1] -> 48 | AM30: =Payroll!R[42]C[1] -> 48
A32: Quarterly Totals | F32: Q1 2001 | I32: Q1 2001 | L32: Q3 2001 | O32: Q4 2001 | R32: Q1 2002 | U32: Q2 2002 | X32: Q3 2002 | AA32: Q4 2002 | AD32: Q1 2003 | AG32: Q2 2003 | AJ32: Q3 2003 | AM32: Q4 2003
F33: =SUM(R[-4]C[-2]:R[-4]C) -> 577000 | I33: =SUM(R[-4]C[-2]:R[-4]C) -> 607100 | L33: =SUM(R[-4]C[-2]:R[-4]C) -> 652600 | O33: =SUM(R[-4]C[-2]:R[-4]C) -> 687100 | R33: =SUM(R[-4]C[-2]:R[-4]C) -> 496100 | U33: =SUM(R[-4]C[-2]:R[-4]C) -> 546600 | X33: =SUM(R[-4]C[-2]:R[-4]C) -> 836600 | AA33: =SUM(R[-4]C[-2]:R[-4]C) -> 686600 | AD33: =SUM(R[-4]C[-2]:R[-4]C) -> 568600 | AG33: =SUM(R[-4]C[-2]:R[-4]C) -> 651600 | AJ33: =SUM(R[-4]C[-2]:R[-4]C) -> 586600 | AM33: =SUM(R[-4]C[-2]:R[-4]C) -> 671600

Sheet: RevProjections
A1: Revenue | B1: start date | C1: =Payroll!RC[1] -> 2001-01-01T00:00:00.000
C3: Total | D3: =R[-2]C[-1] -> 2001-01-01T00:00:00.000 | E3: =RC[-1]+31 -> 2001-02-01T00:00:00.000 | F3: =RC[-1]+31 -> 2001-03-04T00:00:00.000 | G3: =RC[-1]+31 -> 2001-04-04T00:00:00.000 | H3: =RC[-1]+31 -> 2001-05-05T00:00:00.000 | I3: =RC[-1]+31 -> 2001-06-05T00:00:00.000 | J3: =RC[-1]+31 -> 2001-07-06T00:00:00.000 | K3: =RC[-1]+31 -> 2001-08-06T00:00:00.000 | L3: =RC[-1]+31 -> 2001-09-06T00:00:00.000 | M3: =RC[-1]+31 -> 2001-10-07T00:00:00.000 | N3: =RC[-1]+31 -> 2001-11-07T00:00:00.000 | O3: =RC[-1]+31 -> 2001-12-08T00:00:00.000 | P3: =RC[-1]+31 -> 2002-01-08T00:00:00.000 | Q3: =RC[-1]+31 -> 2002-02-08T00:00:00.000 | R3: =RC[-1]+31 -> 2002-03-11T00:00:00.000 | S3: =RC[-1]+31 -> 2002-04-11T00:00:00.000 | T3: =RC[-1]+31 -> 2002-05-12T00:00:00.000 | U3: =RC[-1]+31 -> 2002-06-12T00:00:00.000 | V3: =RC[-1]+31 -> 2002-07-13T00:00:00.000 | W3: =RC[-1]+31 -> 2002-08-13T00:00:00.000 | X3: =RC[-1]+31 -> 2002-09-13T00:00:00.000 | Y3: =RC[-1]+31 -> 2002-10-14T00:00:00.000 | Z3: =RC[-1]+31 -> 2002-11-14T00:00:00.000 | AA3: =RC[-1]+31 -> 2002-12-15T00:00:00.000 | AB3: =RC[-1]+31 -> 2003-01-15T00:00:00.000 | AC3: =RC[-1]+31 -> 2003-02-15T00:00:00.000 | AD3: =RC[-1]+31 -> 2003-03-18T00:00:00.000 | AE3: =RC[-1]+31 -> 2003-04-18T00:00:00.000 | AF3: =RC[-1]+31 -> 2003-05-19T00:00:00.000 | AG3: =RC[-1]+31 -> 2003-06-19T00:00:00.000 | AH3: =RC[-1]+31 -> 2003-07-20T00:00:00.000 | AI3: =RC[-1]+31 -> 2003-08-20T00:00:00.000 | AJ3: =RC[-1]+31 -> 2003-09-20T00:00:00.000 | AK3: =RC[-1]+31 -> 2003-10-21T00:00:00.000 | AL3: =RC[-1]+31 -> 2003-11-21T00:00:00.000 | AM3: =RC[-1]+31 -> 2003-12-22T00:00:00.000
A4: Large Companies
A5: Total # of Companies | B5: 5
A6: Total # of Transactions/Month | B6: 1000000
A7: Avg # of Transactions/Mon/Company | B7: =R[-1]C/R[-2]C -> 200000
A9: Portion of Company #1 | M9: 0 | N9: 0.1 | O9: 0.1 | P9: 0.1 | Q9: 0.2 | R9: 0.2 | S9: 0.2 | T9: 0.3 | U9: 0.4 | V9: 0.5 | W9: 0.6 | X9: 0.7 | Y9: 0.8 | Z9: 0.9 | AA9: 1 | AB9: 1 | AC9: 1 | AD9: 1 | AE9: 1 | AF9: 1 | AG9: 1 | AH9: 1 | AI9: 1 | AJ9: 1 | AK9: 1 | AL9: 1 | AM9: 1
A10: Portion of Company #2 | M10: 0 | N10: 0 | O10: 0 | P10: 0 | Q10: 0 | R10: 0.1 | S10: 0.1 | T10: 0.1 | U10: 0.2 | V10: 0.3 | W10: 0.4 | X10: 0.5 | Y10: 0.6 | Z10: 0.7 | AA10: 0.8 | AB10: 0.9 | AC10: 1 | AD10: 1 | AE10: 1 | AF10: 1 | AG10: 1 | AH10: 1 | AI10: 1 | AJ10: 1 | AK10: 1 | AL10: 1 | AM10: 1
A11: Portion of Company #3 | M11: 0 | N11: 0 | O11: 0 | P11: 0 | Q11: 0 | R11: 0 | S11: 0 | T11: 0 | U11: 0.1 | V11: 0.1 | W11: 0.1 | X11: 0.2 | Y11: 0.3 | Z11: 0.4 | AA11: 0.5 | AB11: 0.6 | AC11: 0.7 | AD11: 0.8 | AE11: 0.9 | AF11: 1 | AG11: 1 | AH11: 1 | AI11: 1 | AJ11: 1 | AK11: 1 | AL11: 1 | AM11: 1
A12: Portion of Company #4 | M12: 0 | N12: 0 | O12: 0 | P12: 0 | Q12: 0 | R12: 0 | S12: 0 | T12: 0 | U12: 0 | V12: 0 | W12: 0 | X12: 0 | Y12: 0 | Z12: 0 | AA12: 0 | AB12: 0 | AC12: 0 | AD12: 0 | AE12: 0 | AF12: 0 | AG12: 0 | AH12: 0 | AI12: 0 | AJ12: 0 | AK12: 0 | AL12: 0 | AM12: 0
A13: Portion of Company #5 | M13: 0 | N13: 0 | O13: 0 | P13: 0 | Q13: 0 | R13: 0 | S13: 0 | T13: 0 | U13: 0 | V13: 0 | W13: 0 | X13: 0 | Y13: 0 | Z13: 0 | AA13: 0 | AB13: 0 | AC13: 0 | AD13: 0 | AE13: 0 | AF13: 0 | AG13: 0 | AH13: 0 | AI13: 0 | AJ13: 0 | AK13: 0 | AL13: 0 | AM13: 0
A14: Total portion of Large Companies | M14: =SUM(R[-5]C:R[-2]C) -> 0 | N14: =SUM(R[-5]C:R[-2]C) -> 0.1 | O14: =SUM(R[-5]C:R[-2]C) -> 0.1 | P14: =SUM(R[-5]C:R[-2]C) -> 0.1 | Q14: =SUM(R[-5]C:R[-2]C) -> 0.2 | R14: =SUM(R[-5]C:R[-2]C) -> 0.30000000000000004 | S14: =SUM(R[-5]C:R[-2]C) -> 0.30000000000000004 | T14: =SUM(R[-5]C:R[-2]C) -> 0.4 | U14: =SUM(R[-5]C:R[-2]C) -> 0.70000000000000007 | V14: =SUM(R[-5]C:R[-2]C) -> 0.9 | W14: =SUM(R[-5]C:R[-2]C) -> 1.1000000000000001 | X14: =SUM(R[-5]C:R[-2]C) -> 1.4 | Y14: =SUM(R[-5]C:R[-2]C) -> 1.7 | Z14: =SUM(R[-5]C:R[-2]C) -> 2 | AA14: =SUM(R[-5]C:R[-2]C) -> 2.2999999999999998 | AB14: =SUM(R[-5]C:R[-2]C) -> 2.5 | AC14: =SUM(R[-5]C:R[-2]C) -> 2.7 | AD14: =SUM(R[-5]C:R[-2]C) -> 2.8 | AE14: =SUM(R[-5]C:R[-2]C) -> 2.9 | AF14: =SUM(R[-5]C:R[-2]C) -> 3 | AG14: =SUM(R[-5]C:R[-2]C) -> 3 | AH14: =SUM(R[-5]C:R[-2]C) -> 3 | AI14: =SUM(R[-5]C:R[-2]C) -> 3 | AJ14: =SUM(R[-5]C:R[-2]C) -> 3 | AK14: =SUM(R[-5]C:R[-2]C) -> 3 | AL14: =SUM(R[-5]C:R[-2]C) -> 3 | AM14: =SUM(R[-5]C:R[-2]C) -> 3
A15: # of Transactions/Month | M15: =R[-1]C*R7C2 -> 0 | N15: =R[-1]C*R7C2 -> 20000 | O15: =R[-1]C*R7C2 -> 20000 | P15: =R[-1]C*R7C2 -> 20000 | Q15: =R[-1]C*R7C2 -> 40000 | R15: =R[-1]C*R7C2 -> 60000.000000000007 | S15: =R[-1]C*R7C2 -> 60000.000000000007 | T15: =R[-1]C*R7C2 -> 80000 | U15: =R[-1]C*R7C2 -> 140000 | V15: =R[-1]C*R7C2 -> 180000 | W15: =R[-1]C*R7C2 -> 220000.00000000003 | X15: =R[-1]C*R7C2 -> 280000 | Y15: =R[-1]C*R7C2 -> 340000 | Z15: =R[-1]C*R7C2 -> 400000 | AA15: =R[-1]C*R7C2 -> 459999.99999999994 | AB15: =R[-1]C*R7C2 -> 500000 | AC15: =R[-1]C*R7C2 -> 540000 | AD15: =R[-1]C*R7C2 -> 560000 | AE15: =R[-1]C*R7C2 -> 580000 | AF15: =R[-1]C*R7C2 -> 600000 | AG15: =R[-1]C*R7C2 -> 600000 | AH15: =R[-1]C*R7C2 -> 600000 | AI15: =R[-1]C*R7C2 -> 600000 | AJ15: =R[-1]C*R7C2 -> 600000 | AK15: =R[-1]C*R7C2 -> 600000 | AL15: =R[-1]C*R7C2 -> 600000 | AM15: =R[-1]C*R7C2 -> 600000
A16: Market Share | C16: =R[-1]C/R6C2 -> 0 | D16: =R[-1]C/R6C2 -> 0 | E16: =R[-1]C/R6C2 -> 0 | F16: =R[-1]C/R6C2 -> 0 | G16: =R[-1]C/R6C2 -> 0 | H16: =R[-1]C/R6C2 -> 0 | I16: =R[-1]C/R6C2 -> 0 | J16: =R[-1]C/R6C2 -> 0 | K16: =R[-1]C/R6C2 -> 0 | L16: =R[-1]C/R6C2 -> 0 | M16: =R[-1]C/R6C2 -> 0 | N16: =R[-1]C/R6C2 -> 0.02 | O16: =R[-1]C/R6C2 -> 0.02 | P16: =R[-1]C/R6C2 -> 0.02 | Q16: =R[-1]C/R6C2 -> 0.04 | R16: =R[-1]C/R6C2 -> 6.0000000000000005E-2 | S16: =R[-1]C/R6C2 -> 6.0000000000000005E-2 | T16: =R[-1]C/R6C2 -> 0.08 | U16: =R[-1]C/R6C2 -> 0.14000000000000001 | V16: =R[-1]C/R6C2 -> 0.18 | W16: =R[-1]C/R6C2 -> 0.22000000000000003 | X16: =R[-1]C/R6C2 -> 0.28000000000000003 | Y16: =R[-1]C/R6C2 -> 0.34 | Z16: =R[-1]C/R6C2 -> 0.4 | AA16: =R[-1]C/R6C2 -> 0.45999999999999996 | AB16: =R[-1]C/R6C2 -> 0.5 | AC16: =R[-1]C/R6C2 -> 0.54 | AD16: =R[-1]C/R6C2 -> 0.56000000000000005 | AE16: =R[-1]C/R6C2 -> 0.57999999999999996 | AF16: =R[-1]C/R6C2 -> 0.6 | AG16: =R[-1]C/R6C2 -> 0.6 | AH16: =R[-1]C/R6C2 -> 0.6 | AI16: =R[-1]C/R6C2 -> 0.6 | AJ16: =R[-1]C/R6C2 -> 0.6 | AK16: =R[-1]C/R6C2 -> 0.6 | AL16: =R[-1]C/R6C2 -> 0.6 | AM16: =R[-1]C/R6C2 -> 0.6
A18: Price / Transaction | B18: 1 | N18: =R18C2 -> 1 | O18: =R18C2 -> 1 | P18: =R18C2 -> 1 | Q18: =R18C2 -> 1 | R18: =R18C2 -> 1 | S18: =R18C2 -> 1 | T18: =R18C2 -> 1 | U18: =R18C2 -> 1 | V18: =R18C2 -> 1 | W18: =R18C2 -> 1 | X18: =R18C2 -> 1 | Y18: =R18C2 -> 1 | Z18: =R18C2 -> 1 | AA18: =R18C2 -> 1 | AB18: =R18C2 -> 1 | AC18: =R18C2 -> 1 | AD18: =R18C2 -> 1 | AE18: =R18C2 -> 1 | AF18: =R18C2 -> 1 | AG18: =R18C2 -> 1 | AH18: =R18C2 -> 1 | AI18: =R18C2 -> 1 | AJ18: =R18C2 -> 1 | AK18: =R18C2 -> 1 | AL18: =R18C2 -> 1 | AM18: =R18C2 -> 1
A19: Revenue from Transactions | M19: =R[-4]C*R[-1]C -> 0 | N19: =R[-4]C*R[-1]C -> 20000 | O19: =R[-4]C*R[-1]C -> 20000 | P19: =R[-4]C*R[-1]C -> 20000 | Q19: =R[-4]C*R[-1]C -> 40000 | R19: =R[-4]C*R[-1]C -> 60000.000000000007 | S19: =R[-4]C*R[-1]C -> 60000.000000000007 | T19: =R[-4]C*R[-1]C -> 80000 | U19: =R[-4]C*R[-1]C -> 140000 | V19: =R[-4]C*R[-1]C -> 180000 | W19: =R[-4]C*R[-1]C -> 220000.00000000003 | X19: =R[-4]C*R[-1]C -> 280000 | Y19: =R[-4]C*R[-1]C -> 340000 | Z19: =R[-4]C*R[-1]C -> 400000 | AA19: =R[-4]C*R[-1]C -> 459999.99999999994 | AB19: =R[-4]C*R[-1]C -> 500000 | AC19: =R[-4]C*R[-1]C -> 540000 | AD19: =R[-4]C*R[-1]C -> 560000 | AE19: =R[-4]C*R[-1]C -> 580000 | AF19: =R[-4]C*R[-1]C -> 600000 | AG19: =R[-4]C*R[-1]C -> 600000 | AH19: =R[-4]C*R[-1]C -> 600000 | AI19: =R[-4]C*R[-1]C -> 600000 | AJ19: =R[-4]C*R[-1]C -> 600000 | AK19: =R[-4]C*R[-1]C -> 600000 | AL19: =R[-4]C*R[-1]C -> 600000 | AM19: =R[-4]C*R[-1]C -> 600000
A22: Total Market Size - This Segment | B22: =R[-16]C*R[-4]C*12 -> 12000000
A23: Revenue / Customer/Year | C23: =IF(R[-14]C>0,R[-4]C/R[-14]C, 0) -> 0 | D23: =IF(R[-14]C>0,R[-4]C/R[-14]C, 0) -> 0 | E23: =IF(R[-14]C>0,R[-4]C/R[-14]C, 0) -> 0 | F23: =IF(R[-14]C>0,R[-4]C/R[-14]C, 0) -> 0 | G23: =IF(R[-14]C>0,R[-4]C/R[-14]C, 0) -> 0 | H23: =IF(R[-14]C>0,R[-4]C/R[-14]C, 0) -> 0 | I23: =IF(R[-14]C>0,R[-4]C/R[-14]C, 0) -> 0 | J23: =IF(R[-14]C>0,R[-4]C/R[-14]C, 0) -> 0 | K23: =IF(R[-14]C>0,R[-4]C/R[-14]C, 0) -> 0 | L23: =IF(R[-14]C>0,R[-4]C/R[-14]C, 0) -> 0 | M23: =IF(R[-14]C>0,R[-4]C/R[-14]C, 0) -> 0 | N23: =R[-4]C/COUNTIF(R[-14]C:R[-10]C,">0")*12 -> 240000 | O23: =R[-4]C/COUNTIF(R[-14]C:R[-10]C,">0")*12 -> 240000 | P23: =R[-4]C/COUNTIF(R[-14]C:R[-10]C,">0")*12 -> 240000 | Q23: =R[-4]C/COUNTIF(R[-14]C:R[-10]C,">0")*12 -> 480000 | R23: =R[-4]C/COUNTIF(R[-14]C:R[-10]C,">0")*12 -> 360000.00000000006 | S23: =R[-4]C/COUNTIF(R[-14]C:R[-10]C,">0")*12 -> 360000.00000000006 | T23: =R[-4]C/COUNTIF(R[-14]C:R[-10]C,">0")*12 -> 480000 | U23: =R[-4]C/COUNTIF(R[-14]C:R[-10]C,">0")*12 -> 560000 | V23: =R[-4]C/COUNTIF(R[-14]C:R[-10]C,">0")*12 -> 720000 | W23: =R[-4]C/COUNTIF(R[-14]C:R[-10]C,">0")*12 -> 880000.00000000012 | X23: =R[-4]C/COUNTIF(R[-14]C:R[-10]C,">0")*12 -> 1120000 | Y23: =R[-4]C/COUNTIF(R[-14]C:R[-10]C,">0")*12 -> 1360000 | Z23: =R[-4]C/COUNTIF(R[-14]C:R[-10]C,">0")*12 -> 1600000 | AA23: =R[-4]C/COUNTIF(R[-14]C:R[-10]C,">0")*12 -> 1839999.9999999998 | AB23: =R[-4]C/COUNTIF(R[-14]C:R[-10]C,">0")*12 -> 2000000 | AC23: =R[-4]C/COUNTIF(R[-14]C:R[-10]C,">0")*12 -> 2160000 | AD23: =R[-4]C/COUNTIF(R[-14]C:R[-10]C,">0")*12 -> 2240000 | AE23: =R[-4]C/COUNTIF(R[-14]C:R[-10]C,">0")*12 -> 2320000 | AF23: =R[-4]C/COUNTIF(R[-14]C:R[-10]C,">0")*12 -> 2400000 | AG23: =R[-4]C/COUNTIF(R[-14]C:R[-10]C,">0")*12 -> 2400000 | AH23: =R[-4]C/COUNTIF(R[-14]C:R[-10]C,">0")*12 -> 2400000 | AI23: =R[-4]C/COUNTIF(R[-14]C:R[-10]C,">0")*12 -> 2400000 | AJ23: =R[-4]C/COUNTIF(R[-14]C:R[-10]C,">0")*12 -> 2400000 | AK23: =R[-4]C/COUNTIF(R[-14]C:R[-10]C,">0")*12 -> 2400000 | AL23: =R[-4]C/COUNTIF(R[-14]C:R[-10]C,">0")*12 -> 2400000 | AM23: =R[-4]C/COUNTIF(R[-14]C:R[-10]C,">0")*12 -> 2400000
A25: Mid-Sized Companies
A26: Total # of Companies | B26: 150
A27: Total # of Transactions/Month | B27: 250000
A28: Avg # of Transactions/Mon/Company | B28: =R[-1]C/R[-2]C -> 1666.6666666666667
A30: # of Title Company Customers | M30: 1 | N30: 2 | O30: 3 | P30: 5 | Q30: 6 | R30: 8 | S30: 10 | T30: 12 | U30: 15 | V30: 17 | W30: 19 | X30: 22 | Y30: 24 | Z30: 26 | AA30: 28 | AB30: 31 | AC30: 33 | AD30: 35 | AE30: 38 | AF30: 40 | AG30: 42 | AH30: 45 | AI30: 47 | AJ30: 49 | AK30: 51 | AL30: 53 | AM30: 55
A31: # of Transactions/Month | M31: =R[-1]C*R[-3]C2 -> 1666.6666666666667 | N31: =R[-1]C*R[-3]C2 -> 3333.3333333333335 | O31: =R[-1]C*R[-3]C2 -> 5000 | P31: =R[-1]C*R[-3]C2 -> 8333.3333333333339 | Q31: =R[-1]C*R[-3]C2 -> 10000 | R31: =R[-1]C*R[-3]C2 -> 13333.333333333334 | S31: =R[-1]C*R[-3]C2 -> 16666.666666666668 | T31: =R[-1]C*R[-3]C2 -> 20000 | U31: =R[-1]C*R[-3]C2 -> 25000 | V31: =R[-1]C*R[-3]C2 -> 28333.333333333336 | W31: =R[-1]C*R[-3]C2 -> 31666.666666666668 | X31: =R[-1]C*R[-3]C2 -> 36666.666666666672 | Y31: =R[-1]C*R[-3]C2 -> 40000 | Z31: =R[-1]C*R[-3]C2 -> 43333.333333333336 | AA31: =R[-1]C*R[-3]C2 -> 46666.666666666672 | AB31: =R[-1]C*R[-3]C2 -> 51666.666666666672 | AC31: =R[-1]C*R[-3]C2 -> 55000 | AD31: =R[-1]C*R[-3]C2 -> 58333.333333333336 | AE31: =R[-1]C*R[-3]C2 -> 63333.333333333336 | AF31: =R[-1]C*R[-3]C2 -> 66666.666666666672 | AG31: =R[-1]C*R[-3]C2 -> 70000 | AH31: =R[-1]C*R[-3]C2 -> 75000 | AI31: =R[-1]C*R[-3]C2 -> 78333.333333333343 | AJ31: =R[-1]C*R[-3]C2 -> 81666.666666666672 | AK31: =R[-1]C*R[-3]C2 -> 85000 | AL31: =R[-1]C*R[-3]C2 -> 88333.333333333343 | AM31: =R[-1]C*R[-3]C2 -> 91666.666666666672
A32: # of Title Coordinators | M32: =R[-1]C/#REF! -> #REF! | N32: =R[-1]C/#REF! -> #REF! | O32: =R[-1]C/#REF! -> #REF! | P32: =R[-1]C/#REF! -> #REF! | Q32: =R[-1]C/#REF! -> #REF! | R32: =R[-1]C/#REF! -> #REF! | S32: =R[-1]C/#REF! -> #REF! | T32: =R[-1]C/#REF! -> #REF! | U32: =R[-1]C/#REF! -> #REF! | V32: =R[-1]C/#REF! -> #REF! | W32: =R[-1]C/#REF! -> #REF! | X32: =R[-1]C/#REF! -> #REF! | Y32: =R[-1]C/#REF! -> #REF! | Z32: =R[-1]C/#REF! -> #REF! | AA32: =R[-1]C/#REF! -> #REF! | AB32: =R[-1]C/#REF! -> #REF! | AC32: =R[-1]C/#REF! -> #REF! | AD32: =R[-1]C/#REF! -> #REF! | AE32: =R[-1]C/#REF! -> #REF! | AF32: =R[-1]C/#REF! -> #REF! | AG32: =R[-1]C/#REF! -> #REF! | AH32: =R[-1]C/#REF! -> #REF! | AI32: =R[-1]C/#REF! -> #REF! | AJ32: =R[-1]C/#REF! -> #REF! | AK32: =R[-1]C/#REF! -> #REF! | AL32: =R[-1]C/#REF! -> #REF! | AM32: =R[-1]C/#REF! -> #REF!
A33: Market Share | M33: =R[-2]C/R[-6]C2 -> 6.6666666666666671E-3 | N33: =R[-2]C/R[-6]C2 -> 1.3333333333333334E-2 | O33: =R[-2]C/R[-6]C2 -> 0.02 | P33: =R[-2]C/R[-6]C2 -> 3.3333333333333333E-2 | Q33: =R[-2]C/R[-6]C2 -> 0.04 | R33: =R[-2]C/R[-6]C2 -> 5.3333333333333337E-2 | S33: =R[-2]C/R[-6]C2 -> 6.6666666666666666E-2 | T33: =R[-2]C/R[-6]C2 -> 0.08 | U33: =R[-2]C/R[-6]C2 -> 0.1 | V33: =R[-2]C/R[-6]C2 -> 0.11333333333333334 | W33: =R[-2]C/R[-6]C2 -> 0.12666666666666668 | X33: =R[-2]C/R[-6]C2 -> 0.1466666666666667 | Y33: =R[-2]C/R[-6]C2 -> 0.16 | Z33: =R[-2]C/R[-6]C2 -> 0.17333333333333334 | AA33: =R[-2]C/R[-6]C2 -> 0.18666666666666668 | AB33: =R[-2]C/R[-6]C2 -> 0.20666666666666669 | AC33: =R[-2]C/R[-6]C2 -> 0.22 | AD33: =R[-2]C/R[-6]C2 -> 0.23333333333333334 | AE33: =R[-2]C/R[-6]C2 -> 0.25333333333333335 | AF33: =R[-2]C/R[-6]C2 -> 0.26666666666666666 | AG33: =R[-2]C/R[-6]C2 -> 0.28000000000000003 | AH33: =R[-2]C/R[-6]C2 -> 0.3 | AI33: =R[-2]C/R[-6]C2 -> 0.31333333333333335 | AJ33: =R[-2]C/R[-6]C2 -> 0.32666666666666666 | AK33: =R[-2]C/R[-6]C2 -> 0.34 | AL33: =R[-2]C/R[-6]C2 -> 0.35333333333333339 | AM33: =R[-2]C/R[-6]C2 -> 0.3666666666666667
A35: Price / Transaction | B35: 5 | M35: =RC2 -> 5 | N35: =RC2 -> 5 | O35: =RC2 -> 5 | P35: =RC2 -> 5 | Q35: =RC2 -> 5 | R35: =RC2 -> 5 | S35: =RC2 -> 5 | T35: =RC2 -> 5 | U35: =RC2 -> 5 | V35: =RC2 -> 5 | W35: =RC2 -> 5 | X35: =RC2 -> 5 | Y35: =RC2 -> 5 | Z35: =RC2 -> 5 | AA35: =RC2 -> 5 | AB35: =RC2 -> 5 | AC35: =RC2 -> 5 | AD35: =RC2 -> 5 | AE35: =RC2 -> 5 | AF35: =RC2 -> 5 | AG35: =RC2 -> 5 | AH35: =RC2 -> 5 | AI35: =RC2 -> 5 | AJ35: =RC2 -> 5 | AK35: =RC2 -> 5 | AL35: =RC2 -> 5 | AM35: =RC2 -> 5
A36: Revenue from Transactions | M36: =R[-5]C*R[-1]C -> 8333.3333333333339 | N36: =R[-5]C*R[-1]C -> 16666.666666666668 | O36: =R[-5]C*R[-1]C -> 25000 | P36: =R[-5]C*R[-1]C -> 41666.666666666672 | Q36: =R[-5]C*R[-1]C -> 50000 | R36: =R[-5]C*R[-1]C -> 66666.666666666672 | S36: =R[-5]C*R[-1]C -> 83333.333333333343 | T36: =R[-5]C*R[-1]C -> 100000 | U36: =R[-5]C*R[-1]C -> 125000 | V36: =R[-5]C*R[-1]C -> 141666.66666666669 | W36: =R[-5]C*R[-1]C -> 158333.33333333334 | X36: =R[-5]C*R[-1]C -> 183333.33333333337 | Y36: =R[-5]C*R[-1]C -> 200000 | Z36: =R[-5]C*R[-1]C -> 216666.66666666669 | AA36: =R[-5]C*R[-1]C -> 233333.33333333337 | AB36: =R[-5]C*R[-1]C -> 258333.33333333337 | AC36: =R[-5]C*R[-1]C -> 275000 | AD36: =R[-5]C*R[-1]C -> 291666.66666666669 | AE36: =R[-5]C*R[-1]C -> 316666.66666666669 | AF36: =R[-5]C*R[-1]C -> 333333.33333333337 | AG36: =R[-5]C*R[-1]C -> 350000 | AH36: =R[-5]C*R[-1]C -> 375000 | AI36: =R[-5]C*R[-1]C -> 391666.66666666674 | AJ36: =R[-5]C*R[-1]C -> 408333.33333333337 | AK36: =R[-5]C*R[-1]C -> 425000 | AL36: =R[-5]C*R[-1]C -> 441666.66666666674 | AM36: =R[-5]C*R[-1]C -> 458333.33333333337
A39: Total Market Size - This Segment | B39: =R[-12]C*R[-4]C*12 -> 15000000
A40: Revenue / Customer/Year | B40: =R[-12]C*R[-5]C*12 -> 100000 | M40: =R[-4]C/R[-10]C*12 -> 100000 | N40: =R[-4]C/R[-10]C*12 -> 100000 | O40: =R[-4]C/R[-10]C*12 -> 100000 | P40: =R[-4]C/R[-10]C*12 -> 100000 | Q40: =R[-4]C/R[-10]C*12 -> 100000 | R40: =R[-4]C/R[-10]C*12 -> 100000 | S40: =R[-4]C/R[-10]C*12 -> 100000 | T40: =R[-4]C/R[-10]C*12 -> 100000 | U40: =R[-4]C/R[-10]C*12 -> 100000 | V40: =R[-4]C/R[-10]C*12 -> 100000 | W40: =R[-4]C/R[-10]C*12 -> 100000 | X40: =R[-4]C/R[-10]C*12 -> 100000.00000000003 | Y40: =R[-4]C/R[-10]C*12 -> 100000 | Z40: =R[-4]C/R[-10]C*12 -> 100000 | AA40: =R[-4]C/R[-10]C*12 -> 100000 | AB40: =R[-4]C/R[-10]C*12 -> 100000 | AC40: =R[-4]C/R[-10]C*12 -> 100000 | AD40: =R[-4]C/R[-10]C*12 -> 100000 | AE40: =R[-4]C/R[-10]C*12 -> 100000 | AF40: =R[-4]C/R[-10]C*12 -> 100000 | AG40: =R[-4]C/R[-10]C*12 -> 100000 | AH40: =R[-4]C/R[-10]C*12 -> 100000 | AI40: =R[-4]C/R[-10]C*12 -> 100000.00000000003 | AJ40: =R[-4]C/R[-10]C*12 -> 100000 | AK40: =R[-4]C/R[-10]C*12 -> 100000 | AL40: =R[-4]C/R[-10]C*12 -> 100000 | AM40: =R[-4]C/R[-10]C*12 -> 100000
A42: Small-Sized Companies
A43: Total # of Companies | B43: 500
A44: Total # of Transactions/Month | B44: 50000
A45: Avg # of Transactions/Mon/Company | B45: =R[-1]C/R[-2]C -> 100
A47: # of Title Company Customers | M47: 1 | N47: 2 | O47: 3 | P47: 5 | Q47: 6 | R47: 8 | S47: 10 | T47: 12 | U47: 15 | V47: 17 | W47: 19 | X47: 22 | Y47: 24 | Z47: 26 | AA47: 28 | AB47: 31 | AC47: 33 | AD47: 35 | AE47: 38 | AF47: 40 | AG47: 42 | AH47: 45 | AI47: 47 | AJ47: 49 | AK47: 51 | AL47: 53 | AM47: 55
A48: # of Transactions/Month | M48: =R[-1]C*R[-3]C2 -> 100 | N48: =R[-1]C*R[-3]C2 -> 200 | O48: =R[-1]C*R[-3]C2 -> 300 | P48: =R[-1]C*R[-3]C2 -> 500 | Q48: =R[-1]C*R[-3]C2 -> 600 | R48: =R[-1]C*R[-3]C2 -> 800 | S48: =R[-1]C*R[-3]C2 -> 1000 | T48: =R[-1]C*R[-3]C2 -> 1200 | U48: =R[-1]C*R[-3]C2 -> 1500 | V48: =R[-1]C*R[-3]C2 -> 1700 | W48: =R[-1]C*R[-3]C2 -> 1900 | X48: =R[-1]C*R[-3]C2 -> 2200 | Y48: =R[-1]C*R[-3]C2 -> 2400 | Z48: =R[-1]C*R[-3]C2 -> 2600 | AA48: =R[-1]C*R[-3]C2 -> 2800 | AB48: =R[-1]C*R[-3]C2 -> 3100 | AC48: =R[-1]C*R[-3]C2 -> 3300 | AD48: =R[-1]C*R[-3]C2 -> 3500 | AE48: =R[-1]C*R[-3]C2 -> 3800 | AF48: =R[-1]C*R[-3]C2 -> 4000 | AG48: =R[-1]C*R[-3]C2 -> 4200 | AH48: =R[-1]C*R[-3]C2 -> 4500 | AI48: =R[-1]C*R[-3]C2 -> 4700 | AJ48: =R[-1]C*R[-3]C2 -> 4900 | AK48: =R[-1]C*R[-3]C2 -> 5100 | AL48: =R[-1]C*R[-3]C2 -> 5300 | AM48: =R[-1]C*R[-3]C2 -> 5500
A49: Market Share | M49: =R[-1]C/R[-5]C2 -> 2E-3 | N49: =R[-1]C/R[-5]C2 -> 4.0000000000000001E-3 | O49: =R[-1]C/R[-5]C2 -> 6.0000000000000001E-3 | P49: =R[-1]C/R[-5]C2 -> 0.01 | Q49: =R[-1]C/R[-5]C2 -> 1.2E-2 | R49: =R[-1]C/R[-5]C2 -> 1.6E-2 | S49: =R[-1]C/R[-5]C2 -> 0.02 | T49: =R[-1]C/R[-5]C2 -> 2.4E-2 | U49: =R[-1]C/R[-5]C2 -> 0.03 | V49: =R[-1]C/R[-5]C2 -> 3.4000000000000002E-2 | W49: =R[-1]C/R[-5]C2 -> 3.7999999999999999E-2 | X49: =R[-1]C/R[-5]C2 -> 4.3999999999999997E-2 | Y49: =R[-1]C/R[-5]C2 -> 4.8000000000000001E-2 | Z49: =R[-1]C/R[-5]C2 -> 5.1999999999999998E-2 | AA49: =R[-1]C/R[-5]C2 -> 5.6000000000000001E-2 | AB49: =R[-1]C/R[-5]C2 -> 6.2E-2 | AC49: =R[-1]C/R[-5]C2 -> 6.6000000000000003E-2 | AD49: =R[-1]C/R[-5]C2 -> 7.0000000000000007E-2 | AE49: =R[-1]C/R[-5]C2 -> 7.5999999999999998E-2 | AF49: =R[-1]C/R[-5]C2 -> 0.08 | AG49: =R[-1]C/R[-5]C2 -> 8.4000000000000005E-2 | AH49: =R[-1]C/R[-5]C2 -> 0.09 | AI49: =R[-1]C/R[-5]C2 -> 9.4E-2 | AJ49: =R[-1]C/R[-5]C2 -> 9.8000000000000004E-2 | AK49: =R[-1]C/R[-5]C2 -> 0.10199999999999999 | AL49: =R[-1]C/R[-5]C2 -> 0.106 | AM49: =R[-1]C/R[-5]C2 -> 0.11
A51: Price / Transaction | B51: 10 | M51: =RC2 -> 10 | N51: =RC2 -> 10 | O51: =RC2 -> 10 | P51: =RC2 -> 10 | Q51: =RC2 -> 10 | R51: =RC2 -> 10 | S51: =RC2 -> 10 | T51: =RC2 -> 10 | U51: =RC2 -> 10 | V51: =RC2 -> 10 | W51: =RC2 -> 10 | X51: =RC2 -> 10 | Y51: =RC2 -> 10 | Z51: =RC2 -> 10 | AA51: =RC2 -> 10 | AB51: =RC2 -> 10 | AC51: =RC2 -> 10 | AD51: =RC2 -> 10 | AE51: =RC2 -> 10 | AF51: =RC2 -> 10 | AG51: =RC2 -> 10 | AH51: =RC2 -> 10 | AI51: =RC2 -> 10 | AJ51: =RC2 -> 10 | AK51: =RC2 -> 10 | AL51: =RC2 -> 10 | AM51: =RC2 -> 10
A52: Revenue from Transactions | M52: =R[-4]C*R[-1]C -> 1000 | N52: =R[-4]C*R[-1]C -> 2000 | O52: =R[-4]C*R[-1]C -> 3000 | P52: =R[-4]C*R[-1]C -> 5000 | Q52: =R[-4]C*R[-1]C -> 6000 | R52: =R[-4]C*R[-1]C -> 8000 | S52: =R[-4]C*R[-1]C -> 10000 | T52: =R[-4]C*R[-1]C -> 12000 | U52: =R[-4]C*R[-1]C -> 15000 | V52: =R[-4]C*R[-1]C -> 17000 | W52: =R[-4]C*R[-1]C -> 19000 | X52: =R[-4]C*R[-1]C -> 22000 | Y52: =R[-4]C*R[-1]C -> 24000 | Z52: =R[-4]C*R[-1]C -> 26000 | AA52: =R[-4]C*R[-1]C -> 28000 | AB52: =R[-4]C*R[-1]C -> 31000 | AC52: =R[-4]C*R[-1]C -> 33000 | AD52: =R[-4]C*R[-1]C -> 35000 | AE52: =R[-4]C*R[-1]C -> 38000 | AF52: =R[-4]C*R[-1]C -> 40000 | AG52: =R[-4]C*R[-1]C -> 42000 | AH52: =R[-4]C*R[-1]C -> 45000 | AI52: =R[-4]C*R[-1]C -> 47000 | AJ52: =R[-4]C*R[-1]C -> 49000 | AK52: =R[-4]C*R[-1]C -> 51000 | AL52: =R[-4]C*R[-1]C -> 53000 | AM52: =R[-4]C*R[-1]C -> 55000
A55: Total Market Size - This Segment | B55: =R[-11]C*R[-4]C*12 -> 6000000
A56: Revenue / Customer/Year | B56: =R[-11]C*R[-5]C*12 -> 12000 | M56: =R[-4]C/R[-9]C*12 -> 12000 | N56: =R[-4]C/R[-9]C*12 -> 12000 | O56: =R[-4]C/R[-9]C*12 -> 12000 | P56: =R[-4]C/R[-9]C*12 -> 12000 | Q56: =R[-4]C/R[-9]C*12 -> 12000 | R56: =R[-4]C/R[-9]C*12 -> 12000 | S56: =R[-4]C/R[-9]C*12 -> 12000 | T56: =R[-4]C/R[-9]C*12 -> 12000 | U56: =R[-4]C/R[-9]C*12 -> 12000 | V56: =R[-4]C/R[-9]C*12 -> 12000 | W56: =R[-4]C/R[-9]C*12 -> 12000 | X56: =R[-4]C/R[-9]C*12 -> 12000 | Y56: =R[-4]C/R[-9]C*12 -> 12000 | Z56: =R[-4]C/R[-9]C*12 -> 12000 | AA56: =R[-4]C/R[-9]C*12 -> 12000 | AB56: =R[-4]C/R[-9]C*12 -> 12000 | AC56: =R[-4]C/R[-9]C*12 -> 12000 | AD56: =R[-4]C/R[-9]C*12 -> 12000 | AE56: =R[-4]C/R[-9]C*12 -> 12000 | AF56: =R[-4]C/R[-9]C*12 -> 12000 | AG56: =R[-4]C/R[-9]C*12 -> 12000 | AH56: =R[-4]C/R[-9]C*12 -> 12000 | AI56: =R[-4]C/R[-9]C*12 -> 12000 | AJ56: =R[-4]C/R[-9]C*12 -> 12000 | AK56: =R[-4]C/R[-9]C*12 -> 12000 | AL56: =R[-4]C/R[-9]C*12 -> 12000 | AM56: =R[-4]C/R[-9]C*12 -> 12000
A58: Metrics
A59: Revenue / Employee | M59: =R[5]C/Payroll!R[13]C[1] -> 245.61403508771932 | N59: =R[5]C/Payroll!R[13]C[1] -> 966.66666666666674 | O59: =R[-40]C/Payroll!R[13]C[1] -> 500 | P59: =R[-40]C/Payroll!R[13]C[1] -> 444.44444444444446 | Q59: =R[-40]C/Payroll!R[13]C[1] -> 869.56521739130437 | R59: =R[-40]C/Payroll!R[13]C[1] -> 1276.5957446808511 | S59: =R[-40]C/Payroll!R[13]C[1] -> 1276.5957446808511 | T59: =R[-40]C/Payroll!R[13]C[1] -> 1666.6666666666667 | U59: =R[-40]C/Payroll!R[13]C[1] -> 2916.6666666666665 | V59: =R[-40]C/Payroll!R[13]C[1] -> 3750 | W59: =R[-40]C/Payroll!R[13]C[1] -> 4583.3333333333339 | X59: =R[-40]C/Payroll!R[13]C[1] -> 5833.333333333333 | Y59: =R[-40]C/Payroll!R[13]C[1] -> 7083.333333333333 | Z59: =R[-40]C/Payroll!R[13]C[1] -> 8333.3333333333339 | AA59: =R[-40]C/Payroll!R[13]C[1] -> 9583.3333333333321 | AB59: =R[-40]C/Payroll!R[13]C[1] -> 10416.666666666666 | AC59: =R[-40]C/Payroll!R[13]C[1] -> 11250 | AD59: =R[-40]C/Payroll!R[13]C[1] -> 11666.666666666666 | AE59: =R[-40]C/Payroll!R[13]C[1] -> 12083.333333333334 | AF59: =R[-40]C/Payroll!R[13]C[1] -> 12500 | AG59: =R[-40]C/Payroll!R[13]C[1] -> 12500 | AH59: =R[-40]C/Payroll!R[13]C[1] -> 12500 | AI59: =R[-40]C/Payroll!R[13]C[1] -> 12500 | AJ59: =R[-40]C/Payroll!R[13]C[1] -> 12500 | AK59: =R[-40]C/Payroll!R[13]C[1] -> 12500 | AL59: =R[-40]C/Payroll!R[13]C[1] -> 12500 | AM59: =R[-40]C/Payroll!R[13]C[1] -> 12500
A60: Total Cost / Transaction | M60: =IF(R[2]C>0,(CapitalExp!R[-31]C[1]+Expenses!R[-31]C)/R[2]C,0) -> 167.51886792452831 | N60: =IF(R[2]C>0,(CapitalExp!R[-31]C[1]+Expenses!R[-31]C)/R[2]C,0) -> 9.1126062322946186 | O60: =IF(R[2]C>0,(CapitalExp!R[-31]C[1]+Expenses!R[-31]C)/R[2]C,0) -> 8.7727272727272734 | P60: =IF(R[2]C>0,(CapitalExp!R[-31]C[1]+Expenses!R[-31]C)/R[2]C,0) -> 6.2410404624277449 | Q60: =IF(R[2]C>0,(CapitalExp!R[-31]C[1]+Expenses!R[-31]C)/R[2]C,0) -> 4.2776679841897236 | R60: =IF(R[2]C>0,(CapitalExp!R[-31]C[1]+Expenses!R[-31]C)/R[2]C,0) -> 1.8068794964028774 | S60: =IF(R[2]C>0,(CapitalExp!R[-31]C[1]+Expenses!R[-31]C)/R[2]C,0) -> 2.8319742489270383 | T60: =IF(R[2]C>0,(CapitalExp!R[-31]C[1]+Expenses!R[-31]C)/R[2]C,0) -> 1.2346837944664031 | U60: =IF(R[2]C>0,(CapitalExp!R[-31]C[1]+Expenses!R[-31]C)/R[2]C,0) -> 1.2759759759759759 | V60: =IF(R[2]C>0,(CapitalExp!R[-31]C[1]+Expenses!R[-31]C)/R[2]C,0) -> 1.2138549436597366 | W60: =IF(R[2]C>0,(CapitalExp!R[-31]C[1]+Expenses!R[-31]C)/R[2]C,0) -> 1.1632049428158275 | X60: =IF(R[2]C>0,(CapitalExp!R[-31]C[1]+Expenses!R[-31]C)/R[2]C,0) -> 0.92499477315492362 | Y60: =IF(R[2]C>0,(CapitalExp!R[-31]C[1]+Expenses!R[-31]C)/R[2]C,0) -> 0.6667102510460251 | Z60: =IF(R[2]C>0,(CapitalExp!R[-31]C[1]+Expenses!R[-31]C)/R[2]C,0) -> 0.437172970548662 | AA60: =IF(R[2]C>0,(CapitalExp!R[-31]C[1]+Expenses!R[-31]C)/R[2]C,0) -> 0.48079691180319289 | AB60: =IF(R[2]C>0,(CapitalExp!R[-31]C[1]+Expenses!R[-31]C)/R[2]C,0) -> 0.30634500991407804 | AC60: =IF(R[2]C>0,(CapitalExp!R[-31]C[1]+Expenses!R[-31]C)/R[2]C,0) -> 0.41275279959886346 | AD60: =IF(R[2]C>0,(CapitalExp!R[-31]C[1]+Expenses!R[-31]C)/R[2]C,0) -> 0.25722326454033767 | AE60: =IF(R[2]C>0,(CapitalExp!R[-31]C[1]+Expenses!R[-31]C)/R[2]C,0) -> 0.39396827032038734 | AF60: =IF(R[2]C>0,(CapitalExp!R[-31]C[1]+Expenses!R[-31]C)/R[2]C,0) -> 0.23849403578528827 | AG60: =IF(R[2]C>0,(CapitalExp!R[-31]C[1]+Expenses!R[-31]C)/R[2]C,0) -> 0.36331948976564815 | AH60: =IF(R[2]C>0,(CapitalExp!R[-31]C[1]+Expenses!R[-31]C)/R[2]C,0) -> 0.25011037527593821 | AI60: =IF(R[2]C>0,(CapitalExp!R[-31]C[1]+Expenses!R[-31]C)/R[2]C,0) -> 0.37326143184812843 | AJ60: =IF(R[2]C>0,(CapitalExp!R[-31]C[1]+Expenses!R[-31]C)/R[2]C,0) -> 0.24753604893916592 | AK60: =IF(R[2]C>0,(CapitalExp!R[-31]C[1]+Expenses!R[-31]C)/R[2]C,0) -> 0.36943921170844807 | AL60: =IF(R[2]C>0,(CapitalExp!R[-31]C[1]+Expenses!R[-31]C)/R[2]C,0) -> 0.24501417655822 | AM60: =IF(R[2]C>0,(CapitalExp!R[-31]C[1]+Expenses!R[-31]C)/R[2]C,0) -> 0.36569447764762136
A62: Total Transactions/Month | M62: =R[-47]C+R[-31]C+R[-14]C -> 1766.6666666666667 | N62: =R[-47]C+R[-31]C+R[-14]C -> 23533.333333333332 | O62: =R[-47]C+R[-31]C+R[-14]C -> 25300 | P62: =R[-47]C+R[-31]C+R[-14]C -> 28833.333333333336 | Q62: =R[-47]C+R[-31]C+R[-14]C -> 50600 | R62: =R[-47]C+R[-31]C+R[-14]C -> 74133.333333333343 | S62: =R[-47]C+R[-31]C+R[-14]C -> 77666.666666666672 | T62: =R[-47]C+R[-31]C+R[-14]C -> 101200 | U62: =R[-47]C+R[-31]C+R[-14]C -> 166500 | V62: =R[-47]C+R[-31]C+R[-14]C -> 210033.33333333334 | W62: =R[-47]C+R[-31]C+R[-14]C -> 253566.66666666669 | X62: =R[-47]C+R[-31]C+R[-14]C -> 318866.66666666669 | Y62: =R[-47]C+R[-31]C+R[-14]C -> 382400 | Z62: =R[-47]C+R[-31]C+R[-14]C -> 445933.33333333331 | AA62: =R[-47]C+R[-31]C+R[-14]C -> 509466.66666666663 | AB62: =R[-47]C+R[-31]C+R[-14]C -> 554766.66666666663 | AC62: =R[-47]C+R[-31]C+R[-14]C -> 598300 | AD62: =R[-47]C+R[-31]C+R[-14]C -> 621833.33333333337 | AE62: =R[-47]C+R[-31]C+R[-14]C -> 647133.33333333337 | AF62: =R[-47]C+R[-31]C+R[-14]C -> 670666.66666666663 | AG62: =R[-47]C+R[-31]C+R[-14]C -> 674200 | AH62: =R[-47]C+R[-31]C+R[-14]C -> 679500 | AI62: =R[-47]C+R[-31]C+R[-14]C -> 683033.33333333337 | AJ62: =R[-47]C+R[-31]C+R[-14]C -> 686566.66666666663 | AK62: =R[-47]C+R[-31]C+R[-14]C -> 690100 | AL62: =R[-47]C+R[-31]C+R[-14]C -> 693633.33333333337 | AM62: =R[-47]C+R[-31]C+R[-14]C -> 697166.66666666663
A63: Total Market Share in Transactions | M63: =R[-1]C/(R6C2+R27C2+R44C2) -> 1.3589743589743591E-3 | N63: =R[-1]C/(R6C2+R27C2+R44C2) -> 1.8102564102564101E-2 | O63: =R[-1]C/(R6C2+R27C2+R44C2) -> 1.9461538461538461E-2 | P63: =R[-1]C/(R6C2+R27C2+R44C2) -> 2.217948717948718E-2 | Q63: =R[-1]C/(R6C2+R27C2+R44C2) -> 3.8923076923076921E-2 | R63: =R[-1]C/(R6C2+R27C2+R44C2) -> 5.7025641025641033E-2 | S63: =R[-1]C/(R6C2+R27C2+R44C2) -> 5.9743589743589745E-2 | T63: =R[-1]C/(R6C2+R27C2+R44C2) -> 7.7846153846153843E-2 | U63: =R[-1]C/(R6C2+R27C2+R44C2) -> 0.12807692307692309 | V63: =R[-1]C/(R6C2+R27C2+R44C2) -> 0.16156410256410259 | W63: =R[-1]C/(R6C2+R27C2+R44C2) -> 0.19505128205128205 | X63: =R[-1]C/(R6C2+R27C2+R44C2) -> 0.2452820512820513 | Y63: =R[-1]C/(R6C2+R27C2+R44C2) -> 0.29415384615384615 | Z63: =R[-1]C/(R6C2+R27C2+R44C2) -> 0.34302564102564104 | AA63: =R[-1]C/(R6C2+R27C2+R44C2) -> 0.39189743589743586 | AB63: =R[-1]C/(R6C2+R27C2+R44C2) -> 0.42674358974358972 | AC63: =R[-1]C/(R6C2+R27C2+R44C2) -> 0.46023076923076922 | AD63: =R[-1]C/(R6C2+R27C2+R44C2) -> 0.47833333333333339 | AE63: =R[-1]C/(R6C2+R27C2+R44C2) -> 0.49779487179487181 | AF63: =R[-1]C/(R6C2+R27C2+R44C2) -> 0.51589743589743586 | AG63: =R[-1]C/(R6C2+R27C2+R44C2) -> 0.51861538461538459 | AH63: =R[-1]C/(R6C2+R27C2+R44C2) -> 0.52269230769230768 | AI63: =R[-1]C/(R6C2+R27C2+R44C2) -> 0.5254102564102564 | AJ63: =R[-1]C/(R6C2+R27C2+R44C2) -> 0.52812820512820513 | AK63: =R[-1]C/(R6C2+R27C2+R44C2) -> 0.53084615384615386 | AL63: =R[-1]C/(R6C2+R27C2+R44C2) -> 0.53356410256410258 | AM63: =R[-1]C/(R6C2+R27C2+R44C2) -> 0.5362820512820512
A64: Total Revenue | C64: =SUM(R[-59]C:R[-2]C) -> 0 | D64: =R[-45]C+R[-28]C+R[-12]C -> 0 | E64: =R[-45]C+R[-28]C+R[-12]C -> 0 | F64: =R[-45]C+R[-28]C+R[-12]C -> 0 | G64: =R[-45]C+R[-28]C+R[-12]C -> 0 | H64: =R[-45]C+R[-28]C+R[-12]C -> 0 | I64: =R[-45]C+R[-28]C+R[-12]C -> 0 | J64: =R[-45]C+R[-28]C+R[-12]C -> 0 | K64: =R[-45]C+R[-28]C+R[-12]C -> 0 | L64: =R[-45]C+R[-28]C+R[-12]C -> 0 | M64: =R[-45]C+R[-28]C+R[-12]C -> 9333.3333333333339 | N64: =R[-45]C+R[-28]C+R[-12]C -> 38666.666666666672 | O64: =R[-45]C+R[-28]C+R[-12]C -> 48000 | P64: =R[-45]C+R[-28]C+R[-12]C -> 66666.666666666672 | Q64: =R[-45]C+R[-28]C+R[-12]C -> 96000 | R64: =R[-45]C+R[-28]C+R[-12]C -> 134666.66666666669 | S64: =R[-45]C+R[-28]C+R[-12]C -> 153333.33333333334 | T64: =R[-45]C+R[-28]C+R[-12]C -> 192000 | U64: =R[-45]C+R[-28]C+R[-12]C -> 280000 | V64: =R[-45]C+R[-28]C+R[-12]C -> 338666.66666666669 | W64: =R[-45]C+R[-28]C+R[-12]C -> 397333.33333333337 | X64: =R[-45]C+R[-28]C+R[-12]C -> 485333.33333333337 | Y64: =R[-45]C+R[-28]C+R[-12]C -> 564000 | Z64: =R[-45]C+R[-28]C+R[-12]C -> 642666.66666666674 | AA64: =R[-45]C+R[-28]C+R[-12]C -> 721333.33333333326 | AB64: =R[-45]C+R[-28]C+R[-12]C -> 789333.33333333337 | AC64: =R[-45]C+R[-28]C+R[-12]C -> 848000 | AD64: =R[-45]C+R[-28]C+R[-12]C -> 886666.66666666674 | AE64: =R[-45]C+R[-28]C+R[-12]C -> 934666.66666666674 | AF64: =R[-45]C+R[-28]C+R[-12]C -> 973333.33333333337 | AG64: =R[-45]C+R[-28]C+R[-12]C -> 992000 | AH64: =R[-45]C+R[-28]C+R[-12]C -> 1020000 | AI64: =R[-45]C+R[-28]C+R[-12]C -> 1038666.6666666667 | AJ64: =R[-45]C+R[-28]C+R[-12]C -> 1057333.3333333335 | AK64: =R[-45]C+R[-28]C+R[-12]C -> 1076000 | AL64: =R[-45]C+R[-28]C+R[-12]C -> 1094666.6666666667 | AM64: =R[-45]C+R[-28]C+R[-12]C -> 1113333.3333333335
A66: Monthly Total | D66: =R[-2]C -> 0 | E66: =R[-2]C -> 0 | F66: =R[-2]C -> 0 | G66: =R[-2]C -> 0 | H66: =R[-2]C -> 0 | I66: =R[-2]C -> 0 | J66: =R[-2]C -> 0 | K66: =R[-2]C -> 0 | L66: =R[-2]C -> 0 | M66: =R[-2]C -> 9333.3333333333339 | N66: =R[-2]C -> 38666.666666666672 | O66: =R[-2]C -> 48000 | P66: =R[-2]C -> 66666.666666666672 | Q66: =R[-2]C -> 96000 | R66: =R[-2]C -> 134666.66666666669 | S66: =R[-2]C -> 153333.33333333334 | T66: =R[-2]C -> 192000 | U66: =R[-2]C -> 280000 | V66: =R[-2]C -> 338666.66666666669 | W66: =R[-2]C -> 397333.33333333337 | X66: =R[-2]C -> 485333.33333333337 | Y66: =R[-2]C -> 564000 | Z66: =R[-2]C -> 642666.66666666674 | AA66: =R[-2]C -> 721333.33333333326 | AB66: =R[-2]C -> 789333.33333333337 | AC66: =R[-2]C -> 848000 | AD66: =R[-2]C -> 886666.66666666674 | AE66: =R[-2]C -> 934666.66666666674 | AF66: =R[-2]C -> 973333.33333333337 | AG66: =R[-2]C -> 992000 | AH66: =R[-2]C -> 1020000 | AI66: =R[-2]C -> 1038666.6666666667 | AJ66: =R[-2]C -> 1057333.3333333335 | AK66: =R[-2]C -> 1076000 | AL66: =R[-2]C -> 1094666.6666666667 | AM66: =R[-2]C -> 1113333.3333333335
A67: Head Count Totals | D67: =Payroll!R[5]C[1] -> 6 | E67: =Payroll!R[5]C[1] -> 7 | F67: =Payroll!R[5]C[1] -> 10 | G67: =Payroll!R[5]C[1] -> 14 | H67: =Payroll!R[5]C[1] -> 18 | I67: =Payroll!R[5]C[1] -> 22 | J67: =Payroll!R[5]C[1] -> 30 | K67: =Payroll!R[5]C[1] -> 34 | L67: =Payroll!R[5]C[1] -> 38 | M67: =Payroll!R[5]C[1] -> 38 | N67: =Payroll!R[5]C[1] -> 40 | O67: =Payroll!R[5]C[1] -> 40 | P67: =Payroll!R[5]C[1] -> 45 | Q67: =Payroll!R[5]C[1] -> 46 | R67: =Payroll!R[5]C[1] -> 47 | S67: =Payroll!R[5]C[1] -> 47 | T67: =Payroll!R[5]C[1] -> 48 | U67: =Payroll!R[5]C[1] -> 48 | V67: =Payroll!R[5]C[1] -> 48 | W67: =Payroll!R[5]C[1] -> 48 | X67: =Payroll!R[5]C[1] -> 48 | Y67: =Payroll!R[5]C[1] -> 48 | Z67: =Payroll!R[5]C[1] -> 48 | AA67: =Payroll!R[5]C[1] -> 48 | AB67: =Payroll!R[5]C[1] -> 48 | AC67: =Payroll!R[5]C[1] -> 48 | AD67: =Payroll!R[5]C[1] -> 48 | AE67: =Payroll!R[5]C[1] -> 48 | AF67: =Payroll!R[5]C[1] -> 48 | AG67: =Payroll!R[5]C[1] -> 48 | AH67: =Payroll!R[5]C[1] -> 48 | AI67: =Payroll!R[5]C[1] -> 48 | AJ67: =Payroll!R[5]C[1] -> 48 | AK67: =Payroll!R[5]C[1] -> 48 | AL67: =Payroll!R[5]C[1] -> 48 | AM67: =Payroll!R[5]C[1] -> 48
A69: Quarterly Totals | F69: Q1 2001 | I69: Q1 2001 | L69: Q3 2001 | O69: Q4 2001 | R69: Q1 2002 | U69: Q2 2002 | X69: Q3 2002 | AA69: Q4 2002 | AD69: Q1 2003 | AG69: Q2 2003 | AJ69: Q3 2003 | AM69: Q4 2003
F70: =SUM(R[-4]C[-2]:R[-4]C) -> 0 | I70: =SUM(R[-4]C[-2]:R[-4]C) -> 0 | L70: =SUM(R[-4]C[-2]:R[-4]C) -> 0 | O70: =SUM(R[-4]C[-2]:R[-4]C) -> 96000 | R70: =SUM(R[-4]C[-2]:R[-4]C) -> 297333.33333333337 | U70: =SUM(R[-4]C[-2]:R[-4]C) -> 625333.33333333337 | X70: =SUM(R[-4]C[-2]:R[-4]C) -> 1221333.3333333335 | AA70: =SUM(R[-4]C[-2]:R[-4]C) -> 1928000 | AD70: =SUM(R[-4]C[-2]:R[-4]C) -> 2524000 | AG70: =SUM(R[-4]C[-2]:R[-4]C) -> 2900000 | AJ70: =SUM(R[-4]C[-2]:R[-4]C) -> 3116000 | AM70: =SUM(R[-4]C[-2]:R[-4]C) -> 3284000.0000000005
A71: Yearly Totals | O71: =R[-1]C[-9]+R[-1]C[-6]+R[-1]C[-3]+R[-1]C -> 96000 | AA71: =R[-1]C[-9]+R[-1]C[-6]+R[-1]C[-3]+R[-1]C -> 4072000 | AM71: =R[-1]C[-9]+R[-1]C[-6]+R[-1]C[-3]+R[-1]C -> 11824000

Sheet: RevQuarterly
B2: Quarter | C2: Revenue
B3: Q1 2001 | C3: =RevProjections!R[67]C[3] -> 0
B4: Q2 2001 | C4: =RevProjections!R[66]C[6] -> 0
B5: Q3 2001 | C5: =RevProjections!R[75]C[9] -> 0
B6: Q4 2001 | C6: =RevProjections!R[64]C[12] -> 96000
B7: Q1 2002 | C7: =RevProjections!R[63]C[15] -> 297333.33333333337
B8: Q2 2002 | C8: =RevProjections!R[62]C[18] -> 625333.33333333337
B9: Q3 2002 | C9: =RevProjections!R[61]C[21] -> 1221333.3333333335
B10: Q4 2002 | C10: =RevProjections!R[60]C[24] -> 1928000
B11: Q1 2003 | C11: =RevProjections!R[59]C[27] -> 2524000
B12: Q2 2003 | C12: =RevProjections!R[58]C[30] -> 2900000
B13: Q3 2003 | C13: =RevProjections!R[57]C[33] -> 3116000
B14: Q4 2003 | C14: =RevProjections!R[56]C[36] -> 3284000.0000000005

Sheet: CostQuarterly
B2: Quarter | C2: Payroll | D2: Capital | E2: Expenses | F2: Total | G2: Annual Spend
B3: Q1 2001 | C3: =Payroll!R[72]C[4] -> 175000 | D3: =CapitalExp!R[30]C[3] -> 16500 | E3: =SUM(Expenses!R[30]C[1]) -> 577000 | F3: =SUM(RC[-3]:RC[-1]) -> 768500
B4: Q2 2001 | C4: =Payroll!R[71]C[7] -> 381666.66666666663 | D4: =CapitalExp!R[29]C[6] -> 12000 | E4: =SUM(Expenses!R[29]C[4]) -> 607100 | F4: =SUM(RC[-3]:RC[-1]) -> 1000766.6666666666
B5: Q3 2001 | C5: =SUM(Payroll!R[70]C[10]) -> 647083.33333333349 | D5: =CapitalExp!R[28]C[9] -> 7000 | E5: =SUM(Expenses!R[28]C[7]) -> 652600 | F5: =SUM(RC[-3]:RC[-1]) -> 1306683.3333333335
B6: Q4 2001 | C6: =SUM(Payroll!R[69]C[13]) -> 730833.33333333337 | D6: =CapitalExp!R[27]C[15] -> 7000 | E6: =SUM(Expenses!R[27]C[10]) -> 687100 | F6: =SUM(RC[-3]:RC[-1]) -> 1424933.3333333335 | G6: =SUM(R[-3]C[-1]:RC[-1]) -> 4500883.333333334
B7: Q1 2002 | C7: =SUM(Payroll!R[68]C[16]) -> 840833.33333333337 | D7: =CapitalExp!R[26]C[15] -> 7000 | E7: =SUM(Expenses!R[26]C[13]) -> 496100 | F7: =SUM(RC[-3]:RC[-1]) -> 1343933.3333333335
B8: Q2 2002 | C8: =SUM(Payroll!R[67]C[19]) -> 870833.33333333337 | D8: =CapitalExp!R[25]C[18] -> 7000 | E8: =SUM(Expenses!R[25]C[16]) -> 546600 | F8: =SUM(RC[-3]:RC[-1]) -> 1424433.3333333335
B9: Q3 2002 | C9: =Payroll!R[66]C[22] -> 877500 | D9: =CapitalExp!R[24]C[21] -> 4500 | E9: =SUM(Expenses!R[24]C[19]) -> 836600 | F9: =SUM(RC[-3]:RC[-1]) -> 1718600
B10: Q4 2002 | C10: =SUM(Payroll!R[65]C[25]) -> 877500 | D10: =CapitalExp!R[23]C[24] -> 4500 | E10: =SUM(Expenses!R[23]C[22]) -> 686600 | F10: =SUM(RC[-3]:RC[-1]) -> 1568600 | G10: =SUM(R[-3]C[-1]:RC[-1]) -> 6055566.666666667
B11: Q1 2003 | C11: =SUM(Payroll!R[64]C[28]) -> 877500 | D11: =CapitalExp!R[22]C[27] -> 4500 | E11: =SUM(Expenses!R[22]C[25]) -> 568600 | F11: =SUM(RC[-3]:RC[-1]) -> 1450600
B12: Q2 2003 | C12: =SUM(Payroll!R[63]C[31]) -> 877500 | D12: =CapitalExp!R[21]C[30] -> 4500 | E12: =SUM(Expenses!R[21]C[28]) -> 651600 | F12: =SUM(RC[-3]:RC[-1]) -> 1533600
B13: Q3 2003 | C13: =SUM(Payroll!R[62]C[34]) -> 877500 | D13: =CapitalExp!R[20]C[33] -> 4500 | E13: =SUM(Expenses!R[20]C[31]) -> 586600 | F13: =SUM(RC[-3]:RC[-1]) -> 1468600
B14: Q4 2003 | C14: =SUM(Payroll!R[61]C[37]) -> 877500 | D14: =CapitalExp!R[19]C[36] -> 4500 | E14: =SUM(Expenses!R[19]C[34]) -> 671600 | F14: =SUM(RC[-3]:RC[-1]) -> 1553600 | G14: =SUM(R[-3]C[-1]:RC[-1]) -> 6006400

Sheet: CostVsRev
B2: Time | C2: Total Cost | D2: Total Revenue | E2: Marketing | F2: Annual Revenue | G2: Net Income | H2: Annual Income
A3: 2000-01-01T00:00:00.000 | B3: Q1 2001 | C3: =CostQuarterly!RC[3] -> 768500 | D3: =RevQuarterly!RC[-1] -> 0 | E3: 1250000 | G3: =RC[-3]-RC[-4] -> -768500
A4: 2000-04-01T00:00:00.000 | B4: Q2 2001 | C4: =CostQuarterly!RC[3] -> 1000766.6666666666 | D4: =RevQuarterly!RC[-1] -> 0 | E4: 2250000 | G4: =RC[-3]-RC[-4] -> -1000766.6666666666
A5: 2000-07-01T00:00:00.000 | B5: Q3 2001 | C5: =CostQuarterly!RC[3] -> 1306683.3333333335 | D5: =RevQuarterly!RC[-1] -> 0 | E5: 2500000 | G5: =RC[-3]-RC[-4] -> -1306683.3333333335
A6: 2000-12-01T00:00:00.000 | B6: Q4 2001 | C6: =CostQuarterly!RC[3] -> 1424933.3333333335 | D6: =RevQuarterly!RC[-1] -> 96000 | E6: 2000000 | F6: =SUM(R[-3]C[-2]:RC[-2]) -> 96000 | G6: =RC[-3]-RC[-4] -> -1328933.3333333335 | H6: =SUM(R[-3]C[-1]:RC[-1]) -> -4404883.333333334
A7: 2000-01-01T00:00:00.000 | B7: Q1 2002 | C7: =CostQuarterly!RC[3] -> 1343933.3333333335 | D7: =RevQuarterly!RC[-1] -> 297333.33333333337 | E7: 2000000 | G7: =RC[-3]-RC[-4] -> -1046600.0000000001
A8: 2000-04-01T00:00:00.000 | B8: Q2 2002 | C8: =CostQuarterly!RC[3] -> 1424433.3333333335 | D8: =RevQuarterly!RC[-1] -> 625333.33333333337 | E8: 2000000 | G8: =RC[-3]-RC[-4] -> -799100.00000000012
A9: 2000-07-01T00:00:00.000 | B9: Q3 2002 | C9: =CostQuarterly!RC[3] -> 1718600 | D9: =RevQuarterly!RC[-1] -> 1221333.3333333335 | E9: 2000000 | G9: =RC[-3]-RC[-4] -> -497266.66666666651
A10: 2000-12-01T00:00:00.000 | B10: Q4 2002 | C10: =CostQuarterly!RC[3] -> 1568600 | D10: =RevQuarterly!RC[-1] -> 1928000 | E10: 2000000 | F10: =SUM(R[-3]C[-2]:RC[-2]) -> 4072000 | G10: =RC[-3]-RC[-4] -> 359400 | H10: =SUM(R[-3]C[-1]:RC[-1]) -> -1983566.666666667
A11: 2000-01-01T00:00:00.000 | B11: Q1 2003 | C11: =CostQuarterly!RC[3] -> 1450600 | D11: =RevQuarterly!RC[-1] -> 2524000 | E11: 2000000 | G11: =RC[-3]-RC[-4] -> 1073400
A12: 2000-04-01T00:00:00.000 | B12: Q2 2003 | C12: =CostQuarterly!RC[3] -> 1533600 | D12: =RevQuarterly!RC[-1] -> 2900000 | G12: =RC[-3]-RC[-4] -> 1366400
A13: 2000-07-01T00:00:00.000 | B13: Q3 2003 | C13: =CostQuarterly!RC[3] -> 1468600 | D13: =RevQuarterly!RC[-1] -> 3116000 | G13: =RC[-3]-RC[-4] -> 1647400
A14: 2000-12-01T00:00:00.000 | B14: Q4 2003 | C14: =CostQuarterly!RC[3] -> 1553600 | D14: =RevQuarterly!RC[-1] -> 3284000.0000000005 | F14: =SUM(R[-3]C[-2]:RC[-2]) -> 11824000 | G14: =RC[-3]-RC[-4] -> 1730400.0000000005 | H14: =SUM(R[-3]C[-1]:RC[-1]) -> 5817600