Sheet: SummaryReport
A1: 'Name | B1: 'HOMEWORK 2 GRADING GUIDELINE | E1: 'Email
A2: 'lfmNNNN | E2: 'Phone Number | F2: '( ) -
B3: 'Homework 2
D5: 'You must use database formulas to answer all questions where possible
B7: 'Answer the Following Questions
A9: =COUNTIF(CLOSURE(">", NA(), 0), CustomerData!R[-7]C[+10]:R[+492]C[+10]) -> 207
A11: =SUM(CustomerData!R[-9]C[+13]:R[+490]C[+13]) -> 385123.4425 | B11: '2 What is the total value of all the orders in the CustomerData Spreadsheet?
C12: 'use DSUM, with "null" criteria
B13: =SUM(CustomerData!R[-11]C[+10]:R[+488]C[+10]) -> 414236.86 | C13: 'IF STUDENTS USE TOTAL INSTEAD OF NET SALE - EITHER IS FINE
A14: =SUM(CustomerData!R[-12]C[+12]:R[+487]C[+12]) -> 29113.4175 | B14: '3 What is the total value of all the discounts in the CustomerData Spreadhseet?
A16: =AVGIF2(CLOSURE("EQUAL", "Beverages", NA()), HCAT(CustomerData!R[-14]C[+5]:R[+485]C[+5], CustomerData!R[-14]C[+12]:R[+485]C[+12])) -> 84.0824257425743 | B16: '4 What is the average discount on beverage orders in the CustomerData Spreadsheet?
A18: =MAX(CustomerData!R[-16]C[+13]:R[+483]C[+13]) -> 15019.5 | B18: '5.a | C18: 'What is the largest order, after discount, in CustomerData?
D19: 'use DMAX, with "null" criteria
A20: =VLOOKUP(Criteria!R[-5]C[+1], HCAT(CustomerData!R[-19]C[+13]:R[+481]C[+13], CustomerData!R[-19]C[+5]:R[+481]C[+5]), 2) -> Beverages | B20: '5.b | C20: 'Using the above answer, what category has the largest single order?
C21: '5.a SHOULD USE THE DGET COMMAND
B22: 'Complete the Following Summary Tables
C23: 'Total Number | D23: 'Total Value of | E23: 'Total Value of | F23: 'Average Order
B24: 'Category Name | C24: 'of Orders | D24: 'of Orders | E24: 'Discounts | F24: 'After Discount
B25: 'Beverages & Dairy | C25: =COUNTIF(CLOSURE("IS_BEVERAGE_OR_DAIRY"), CustomerData!R[-23]C[+3]:R[+476]C[+3]) -> 197 | D25: =SUMIF2(CLOSURE("IS_BEVERAGE_OR_DAIRY"), HCAT(CustomerData!R[-23]C[+2]:R[+476]C[+2], CustomerData!R[-23]C[+8]:R[+476]C[+8])) -> 184058.95 | E25: =SUMIF2(CLOSURE("IS_BEVERAGE_OR_DAIRY"), HCAT(CustomerData!R[-23]C[+1]:R[+476]C[+1], CustomerData!R[-23]C[+8]:R[+476]C[+8])) -> 14382.14 | F25: =AVGIF2(CLOSURE("IS_BEVERAGE_OR_DAIRY"), HCAT(CustomerData!R[-23]C:R[+476]C, CustomerData!R[-23]C[+8]:R[+476]C[+8])) -> 861.303604060914
B26: 'Seafood | C26: =COUNTIF(CLOSURE("IS_SEAFOOD"), CustomerData!R[-24]C[+3]:R[+475]C[+3]) -> 71 | D26: =SUMIF2(CLOSURE("IS_SEAFOOD"), HCAT(CustomerData!R[-24]C[+2]:R[+475]C[+2], CustomerData!R[-24]C[+8]:R[+475]C[+8])) -> 35342.85 | E26: =SUMIF2(CLOSURE("IS_SEAFOOD"), HCAT(CustomerData!R[-24]C[+1]:R[+475]C[+1], CustomerData!R[-24]C[+8]:R[+475]C[+8])) -> 3616.7675 | F26: =AVGIF2(CLOSURE("IS_SEAFOOD"), HCAT(CustomerData!R[-24]C:R[+475]C, CustomerData!R[-24]C[+8]:R[+475]C[+8])) -> 446.846232394366
B27: 'Produce | C27: =COUNTIF(CLOSURE("IS_PRODUCE"), CustomerData!R[-25]C[+3]:R[+474]C[+3]) -> 31 | D27: =SUMIF2(CLOSURE("IS_PRODUCE"), HCAT(CustomerData!R[-25]C[+2]:R[+474]C[+2], CustomerData!R[-25]C[+8]:R[+474]C[+8])) -> 26968.8 | E27: =SUMIF2(CLOSURE("IS_PRODUCE"), HCAT(CustomerData!R[-25]C[+1]:R[+474]C[+1], CustomerData!R[-25]C[+8]:R[+474]C[+8])) -> 719.08 | F27: =AVGIF2(CLOSURE("IS_PRODUCE"), HCAT(CustomerData!R[-25]C:R[+474]C, CustomerData!R[-25]C[+8]:R[+474]C[+8])) -> 846.765161290323
B28: 'All Other | C28: =ROWS(CustomerData!R[-26]C[+3]:R[+473]C[+3])-SUM(R[-3]C:R[-1]C) -> 201 | D28: =SUM(CustomerData!R[-26]C[+8]:R[+473]C[+8])-SUM(R[-3]C:R[-1]C) -> 167866.26 | E28: =SUM(CustomerData!R[-26]C[+8]:R[+473]C[+8])-SUM(R[-3]C:R[-1]C) -> 10395.43 | F28: =(RC[-2]-RC[-1])/RC[-3] -> 783.436965174129
D30: 'Order Analysis by Category: Number of Orders:
D31: 'GE $1,000 &
C32: 'LT $1,000 | D32: 'LT $5,000 | E32: 'GE $5,000
B33: 'Beverages | C33: =COUNTIF2(CLOSURE("EQUAL", "Beverages", NA()), CLOSURE("<", NA(), 1000), HCAT(CustomerData!R[-31]C[+3]:R[+468]C[+3], CustomerData!R[-31]C[+9]:R[+468]C[+9])) -> 87 | D33: =COUNTIF3(CLOSURE("EQUAL", "Beverages", NA()), CLOSURE(">=", NA(), 1000), CLOSURE("<", NA(), 5000), HCAT(CustomerData!R[-31]C[+2]:R[+468]C[+2], CustomerData!R[-31]C[+8]:R[+468]C[+8], CustomerData!R[-31]C[+8]:R[+468]C[+8])) -> 10 | E33: =COUNTIF2(CLOSURE("EQUAL", "Beverages", NA()), CLOSURE(">", NA(), 5000), HCAT(CustomerData!R[-31]C[+1]:R[+468]C[+1], CustomerData!R[-31]C[+7]:R[+468]C[+7])) -> 4
B34: 'Dairy Products | C34: =COUNTIF2(CLOSURE("EQUAL", "Dairy Products", NA()), CLOSURE("<", NA(), 1000), HCAT(CustomerData!R[-32]C[+3]:R[+467]C[+3], CustomerData!R[-32]C[+9]:R[+467]C[+9])) -> 63 | D34: =COUNTIF3(CLOSURE("EQUAL", "Dairy Products", NA()), CLOSURE(">=", NA(), 1000), CLOSURE("<", NA(), 5000), HCAT(CustomerData!R[-32]C[+2]:R[+467]C[+2], CustomerData!R[-32]C[+8]:R[+467]C[+8], CustomerData!R[-32]C[+8]:R[+467]C[+8])) -> 32 | E34: =COUNTIF2(CLOSURE("EQUAL", "Dairy Products", NA()), CLOSURE(">", NA(), 5000), HCAT(CustomerData!R[-32]C[+1]:R[+467]C[+1], CustomerData!R[-32]C[+7]:R[+467]C[+7])) -> 1

Sheet: Criteria
A1: 'Name | I1: 'Email
A2: 'lfmNNNN | I2: 'Phone Number | J2: '( ) -
B3: 'Homework 2
B5: 'You must use this page to define your criteria for
B6: 'the database functions in the Summary Report Tab
B8: 'You must print this criteria page out and included
B9: 'the printed copy with your homework.
C11: 'Discount | E11: 'Category Name
C12: '>0 | E12: 'Beverages
B14: 'NetSale | C14: 'Category Name | D14: 'Category Name | E14: 'Category Name
B15: =SummaryReport!R[+3]C[-1] -> 15019.5 | C15: 'Beverages | D15: 'Seafood | E15: 'Produce
C16: 'Dairy Products
B19: 'Category Name | C19: 'TotalSale
B20: 'Beverages | C20: '<1000
B21: 'Category Name | C21: 'TotalSale | D21: 'TotalSale
B22: 'Beverages | C22: '>=1000 | D22: '<5000
B23: 'Category Name | C23: 'TotalSale
B24: 'Beverages | C24: '>5000
B26: 'Category Name | C26: 'TotalSale
B27: 'Dairy Products | C27: '<1000
B28: 'Category Name | C28: 'TotalSale | D28: 'TotalSale
B29: 'Dairy Products | C29: '>=1000 | D29: '<5000
B30: 'Category Name | C30: 'TotalSale
B31: 'Dairy Products | C31: '>5000

Sheet: CustomerData
A1: 'Customer ID | B1: 'Customer Name | C1: 'Supplier ID | D1: 'Supplier Name | E1: 'Category ID | F1: 'Category Name | G1: 'Product ID | H1: 'Order ID | I1: 'Unit Price | J1: 'Quantity | K1: 'Discount | L1: 'TotalSale | M1: 'TotalDiscount | N1: 'NetSale
A2: 'QUEEN | B2: 'Queen Cozinha | C2: 10 | D2: 'Refrescos Americanas LTDA | E2: 1 | F2: 'Beverages | G2: 24 | H2: 10704 | I2: 4.5 | J2: 35 | K2: 0 | L2: =RC[-2]*RC[-3] -> 157.5 | M2: =RC[-2]*RC[-1] -> 0 | N2: =RC[-2]-RC[-1] -> 157.5
A3: 'SAVEA | B3: 'Save-a-lot Markets | C3: 8 | D3: 'Specialty Biscuits, Ltd. | E3: 3 | F3: 'Confections | G3: 68 | H3: 11064 | I3: 12.5 | J3: 55 | K3: 0 | L3: =RC[-2]*RC[-3] -> 687.5 | M3: =RC[-2]*RC[-1] -> 0 | N3: =RC[-2]-RC[-1] -> 687.5
A4: 'BLONP | B4: 'Blondel père et fils | C4: 18 | D4: 'Aux joyeux ecclésiastiques | E4: 1 | F4: 'Beverages | G4: 39 | H4: 10297 | I4: 14.4 | J4: 60 | K4: 0 | L4: =RC[-2]*RC[-3] -> 864 | M4: =RC[-2]*RC[-1] -> 0 | N4: =RC[-2]-RC[-1] -> 864
A5: 'BOTTM | B5: 'Bottom-Dollar Markets | C5: 28 | D5: 'Gai pâturage | E5: 4 | F5: 'Dairy Products | G5: 59 | H5: 10410 | I5: 44 | J5: 16 | K5: 0 | L5: =RC[-2]*RC[-3] -> 704 | M5: =RC[-2]*RC[-1] -> 0 | N5: =RC[-2]-RC[-1] -> 704
A6: 'FURIB | B6: 'Furia Bacalhau e Frutos do Mar | C6: 28 | D6: 'Gai pâturage | E6: 4 | F6: 'Dairy Products | G6: 60 | H6: 10464 | I6: 27.2 | J6: 20 | K6: 0 | L6: =RC[-2]*RC[-3] -> 544 | M6: =RC[-2]*RC[-1] -> 0 | N6: =RC[-2]-RC[-1] -> 544
A7: 'BOTTM | B7: 'Bottom-Dollar Markets | C7: 20 | D7: 'Leka Trading | E7: 1 | F7: 'Beverages | G7: 43 | H7: 10982 | I7: 46 | J7: 9 | K7: 0 | L7: =RC[-2]*RC[-3] -> 414 | M7: =RC[-2]*RC[-1] -> 0 | N7: =RC[-2]-RC[-1] -> 414
A8: 'RATTC | B8: 'Rattlesnake Canyon Grocery | C8: 24 | D8: 'G'day, Mate | E8: 5 | F8: 'Grains/Cereals | G8: 52 | H8: 11077 | I8: 7 | J8: 2 | K8: 0 | L8: =RC[-2]*RC[-3] -> 14 | M8: =RC[-2]*RC[-1] -> 0 | N8: =RC[-2]-RC[-1] -> 14
A9: 'REGGC | B9: 'Reggiani Caseifici | C9: 21 | D9: 'Lyngbysild | E9: 8 | F9: 'Seafood | G9: 46 | H9: 10428 | I9: 9.6 | J9: 20 | K9: 0 | L9: =RC[-2]*RC[-3] -> 192 | M9: =RC[-2]*RC[-1] -> 0 | N9: =RC[-2]-RC[-1] -> 192
A10: 'WILMK | B10: 'Wilman Kala | C10: 29 | D10: 'Forêts d'érables | E10: 2 | F10: 'Condiments | G10: 61 | H10: 10910 | I10: 28.5 | J10: 5 | K10: 0 | L10: =RC[-2]*RC[-3] -> 142.5 | M10: =RC[-2]*RC[-1] -> 0 | N10: =RC[-2]-RC[-1] -> 142.5
A11: 'LEHMS | B11: 'Lehmanns Marktstand | C11: 8 | D11: 'Specialty Biscuits, Ltd. | E11: 3 | F11: 'Confections | G11: 20 | H11: 10593 | I11: 81 | J11: 21 | K11: 0.2 | L11: =RC[-2]*RC[-3] -> 1701 | M11: =RC[-2]*RC[-1] -> 340.2 | N11: =RC[-2]-RC[-1] -> 1360.8
A12: 'LEHMS | B12: 'Lehmanns Marktstand | C12: 13 | D12: 'Nord-Ost-Fisch Handelsgesellschaft mbH | E12: 8 | F12: 'Seafood | G12: 30 | H12: 10891 | I12: 25.89 | J12: 15 | K12: 0.05 | L12: =RC[-2]*RC[-3] -> 388.35 | M12: =RC[-2]*RC[-1] -> 19.4175 | N12: =RC[-2]-RC[-1] -> 368.9325
A13: 'ANTON | B13: 'Antonio Moreno Taquería | C13: 12 | D13: 'Plutzer Lebensmittelgroßmärkte AG | E13: 1 | F13: 'Beverages | G13: 75 | H13: 10682 | I13: 7.75 | J13: 30 | K13: 0 | L13: =RC[-2]*RC[-3] -> 232.5 | M13: =RC[-2]*RC[-1] -> 0 | N13: =RC[-2]-RC[-1] -> 232.5
A14: 'TORTU | B14: 'Tortuga Restaurante | C14: 28 | D14: 'Gai pâturage | E14: 4 | F14: 'Dairy Products | G14: 59 | H14: 10304 | I14: 44 | J14: 10 | K14: 0 | L14: =RC[-2]*RC[-3] -> 440 | M14: =RC[-2]*RC[-1] -> 0 | N14: =RC[-2]-RC[-1] -> 440
A15: 'RATTC | B15: 'Rattlesnake Canyon Grocery | C15: 2 | D15: 'New Orleans Cajun Delights | E15: 2 | F15: 'Condiments | G15: 66 | H15: 11077 | I15: 17 | J15: 1 | K15: 0 | L15: =RC[-2]*RC[-3] -> 17 | M15: =RC[-2]*RC[-1] -> 0 | N15: =RC[-2]-RC[-1] -> 17
A16: 'VICTE | B16: 'Victuailles en stock | C16: 14 | D16: 'Formaggi Fortini s.r.l. | E16: 4 | F16: 'Dairy Products | G16: 72 | H16: 10459 | I16: 27.8 | J16: 40 | K16: 0 | L16: =RC[-2]*RC[-3] -> 1112 | M16: =RC[-2]*RC[-1] -> 0 | N16: =RC[-2]-RC[-1] -> 1112
A17: 'BERGS | B17: 'Berglunds snabbköp | C17: 13 | D17: 'Nord-Ost-Fisch Handelsgesellschaft mbH | E17: 8 | F17: 'Seafood | G17: 30 | H17: 10524 | I17: 25.89 | J17: 10 | K17: 0 | L17: =RC[-2]*RC[-3] -> 258.9 | M17: =RC[-2]*RC[-1] -> 0 | N17: =RC[-2]-RC[-1] -> 258.9
A18: 'VICTE | B18: 'Victuailles en stock | C18: 3 | D18: 'Grandma Kelly's Homestead | E18: 7 | F18: 'Produce | G18: 7 | H18: 10546 | I18: 30 | J18: 10 | K18: 0 | L18: =RC[-2]*RC[-3] -> 300 | M18: =RC[-2]*RC[-1] -> 0 | N18: =RC[-2]-RC[-1] -> 300
A19: 'BLONP | B19: 'Blondel père et fils | C19: 23 | D19: 'Karkki Oy | E19: 1 | F19: 'Beverages | G19: 76 | H19: 10566 | I19: 18 | J19: 10 | K19: 0 | L19: =RC[-2]*RC[-3] -> 180 | M19: =RC[-2]*RC[-1] -> 0 | N19: =RC[-2]-RC[-1] -> 180
A20: 'SAVEA | B20: 'Save-a-lot Markets | C20: 23 | D20: 'Karkki Oy | E20: 3 | F20: 'Confections | G20: 49 | H20: 10612 | I20: 20 | J20: 18 | K20: 0 | L20: =RC[-2]*RC[-3] -> 360 | M20: =RC[-2]*RC[-1] -> 0 | N20: =RC[-2]-RC[-1] -> 360
A21: 'QUEEN | B21: 'Queen Cozinha | C21: 15 | D21: 'Norske Meierier | E21: 4 | F21: 'Dairy Products | G21: 33 | H21: 10913 | I21: 2.5 | J21: 40 | K21: 0.25 | L21: =RC[-2]*RC[-3] -> 100 | M21: =RC[-2]*RC[-1] -> 25 | N21: =RC[-2]-RC[-1] -> 75
A22: 'LINOD | B22: 'LINO-Delicateses | C22: 17 | D22: 'Svensk Sjöföda AB | E22: 8 | F22: 'Seafood | G22: 36 | H22: 10838 | I22: 19 | J22: 50 | K22: 0.25 | L22: =RC[-2]*RC[-3] -> 950 | M22: =RC[-2]*RC[-1] -> 237.5 | N22: =RC[-2]-RC[-1] -> 712.5
A23: 'ERNSH | B23: 'Ernst Handel | C23: 16 | D23: 'Bigfoot Breweries | E23: 1 | F23: 'Beverages | G23: 35 | H23: 10390 | I23: 14.4 | J23: 40 | K23: 0.1 | L23: =RC[-2]*RC[-3] -> 576 | M23: =RC[-2]*RC[-1] -> 57.6 | N23: =RC[-2]-RC[-1] -> 518.4
A24: 'HUNGO | B24: 'Hungry Owl All-Night Grocers | C24: 7 | D24: 'Pavlova, Ltd. | E24: 8 | F24: 'Seafood | G24: 18 | H24: 10516 | I24: 62.5 | J24: 25 | K24: 0.1 | L24: =RC[-2]*RC[-3] -> 1562.5 | M24: =RC[-2]*RC[-1] -> 156.25 | N24: =RC[-2]-RC[-1] -> 1406.25
A25: 'RICSU | B25: 'Richter Supermarkt | C25: 28 | D25: 'Gai pâturage | E25: 4 | F25: 'Dairy Products | G25: 59 | H25: 10255 | I25: 44 | J25: 30 | K25: 0 | L25: =RC[-2]*RC[-3] -> 1320 | M25: =RC[-2]*RC[-1] -> 0 | N25: =RC[-2]-RC[-1] -> 1320
A26: 'SUPRD | B26: 'Suprêmes délices | C26: 25 | D26: 'Ma Maison | E26: 6 | F26: 'Meat/Poultry | G26: 54 | H26: 11035 | I26: 7.45 | J26: 10 | K26: 0 | L26: =RC[-2]*RC[-3] -> 74.5 | M26: =RC[-2]*RC[-1] -> 0 | N26: =RC[-2]-RC[-1] -> 74.5
A27: 'FRANK | B27: 'Frankenversand | C27: 6 | D27: 'Mayumi's | E27: 7 | F27: 'Produce | G27: 14 | H27: 10623 | I27: 23.25 | J27: 21 | K27: 0 | L27: =RC[-2]*RC[-3] -> 488.25 | M27: =RC[-2]*RC[-1] -> 0 | N27: =RC[-2]-RC[-1] -> 488.25
A28: 'LACOR | B28: 'La corne d'abondance | C28: 3 | D28: 'Grandma Kelly's Homestead | E28: 7 | F28: 'Produce | G28: 7 | H28: 10858 | I28: 30 | J28: 5 | K28: 0 | L28: =RC[-2]*RC[-3] -> 150 | M28: =RC[-2]*RC[-1] -> 0 | N28: =RC[-2]-RC[-1] -> 150
A29: 'ERNSH | B29: 'Ernst Handel | C29: 18 | D29: 'Aux joyeux ecclésiastiques | E29: 1 | F29: 'Beverages | G29: 39 | H29: 10895 | I29: 18 | J29: 45 | K29: 0 | L29: =RC[-2]*RC[-3] -> 810 | M29: =RC[-2]*RC[-1] -> 0 | N29: =RC[-2]-RC[-1] -> 810
A30: 'FURIB | B30: 'Furia Bacalhau e Frutos do Mar | C30: 26 | D30: 'Pasta Buttini s.r.l. | E30: 5 | F30: 'Grains/Cereals | G30: 56 | H30: 10664 | I30: 38 | J30: 12 | K30: 0.15 | L30: =RC[-2]*RC[-3] -> 456 | M30: =RC[-2]*RC[-1] -> 68.4 | N30: =RC[-2]-RC[-1] -> 387.6
A31: 'ISLAT | B31: 'Island Trading | C31: 1 | D31: 'Exotic Liquids | E31: 1 | F31: 'Beverages | G31: 2 | H31: 10829 | I31: 19 | J31: 10 | K31: 0 | L31: =RC[-2]*RC[-3] -> 190 | M31: =RC[-2]*RC[-1] -> 0 | N31: =RC[-2]-RC[-1] -> 190
A32: 'RICSU | B32: 'Richter Supermarkt | C32: 21 | D32: 'Lyngbysild | E32: 8 | F32: 'Seafood | G32: 46 | H32: 11075 | I32: 12 | J32: 30 | K32: 0.15 | L32: =RC[-2]*RC[-3] -> 360 | M32: =RC[-2]*RC[-1] -> 54 | N32: =RC[-2]-RC[-1] -> 306
A33: 'SPLIR | B33: 'Split Rail Beer & Ale | C33: 25 | D33: 'Ma Maison | E33: 6 | F33: 'Meat/Poultry | G33: 54 | H33: 10349 | I33: 5.9 | J33: 24 | K33: 0 | L33: =RC[-2]*RC[-3] -> 141.6 | M33: =RC[-2]*RC[-1] -> 0 | N33: =RC[-2]-RC[-1] -> 141.6
A34: 'PICCO | B34: 'Piccolo und mehr | C34: 5 | D34: 'Cooperativa de Quesos 'Las Cabras' | E34: 4 | F34: 'Dairy Products | G34: 11 | H34: 10489 | I34: 16.8 | J34: 15 | K34: 0.25 | L34: =RC[-2]*RC[-3] -> 252 | M34: =RC[-2]*RC[-1] -> 63 | N34: =RC[-2]-RC[-1] -> 189
A35: 'BONAP | B35: 'Bon app' | C35: 19 | D35: 'New England Seafood Cannery | E35: 8 | F35: 'Seafood | G35: 40 | H35: 10525 | I35: 18.4 | J35: 15 | K35: 0.1 | L35: =RC[-2]*RC[-3] -> 276 | M35: =RC[-2]*RC[-1] -> 27.6 | N35: =RC[-2]-RC[-1] -> 248.4
A36: 'QUEDE | B36: 'Que Delícia | C36: 16 | D36: 'Bigfoot Breweries | E36: 1 | F36: 'Beverages | G36: 35 | H36: 10261 | I36: 14.4 | J36: 20 | K36: 0 | L36: =RC[-2]*RC[-3] -> 288 | M36: =RC[-2]*RC[-1] -> 0 | N36: =RC[-2]-RC[-1] -> 288
A37: 'MEREP | B37: 'Mère Paillarde | C37: 8 | D37: 'Specialty Biscuits, Ltd. | E37: 3 | F37: 'Confections | G37: 68 | H37: 10424 | I37: 10 | J37: 30 | K37: 0.2 | L37: =RC[-2]*RC[-3] -> 300 | M37: =RC[-2]*RC[-1] -> 60 | N37: =RC[-2]-RC[-1] -> 240
A38: 'GREAL | B38: 'Great Lakes Food Market | C38: 1 | D38: 'Exotic Liquids | E38: 1 | F38: 'Beverages | G38: 1 | H38: 11006 | I38: 18 | J38: 8 | K38: 0 | L38: =RC[-2]*RC[-3] -> 144 | M38: =RC[-2]*RC[-1] -> 0 | N38: =RC[-2]-RC[-1] -> 144
A39: 'FOLKO | B39: 'Folk och fä HB | C39: 29 | D39: 'Forêts d'érables | E39: 3 | F39: 'Confections | G39: 62 | H39: 10902 | I39: 49.3 | J39: 6 | K39: 0.15 | L39: =RC[-2]*RC[-3] -> 295.8 | M39: =RC[-2]*RC[-1] -> 44.37 | N39: =RC[-2]-RC[-1] -> 251.43
A40: 'RICSU | B40: 'Richter Supermarkt | C40: 15 | D40: 'Norske Meierier | E40: 4 | F40: 'Dairy Products | G40: 33 | H40: 10951 | I40: 2.5 | J40: 15 | K40: 0.05 | L40: =RC[-2]*RC[-3] -> 37.5 | M40: =RC[-2]*RC[-1] -> 1.875 | N40: =RC[-2]-RC[-1] -> 35.625
A41: 'ISLAT | B41: 'Island Trading | C41: 28 | D41: 'Gai pâturage | E41: 4 | F41: 'Dairy Products | G41: 60 | H41: 10829 | I41: 34 | J41: 21 | K41: 0 | L41: =RC[-2]*RC[-3] -> 714 | M41: =RC[-2]*RC[-1] -> 0 | N41: =RC[-2]-RC[-1] -> 714
A42: 'BOTTM | B42: 'Bottom-Dollar Markets | C42: 29 | D42: 'Forêts d'érables | E42: 3 | F42: 'Confections | G42: 62 | H42: 11027 | I42: 49.3 | J42: 21 | K42: 0.25 | L42: =RC[-2]*RC[-3] -> 1035.3 | M42: =RC[-2]*RC[-1] -> 258.825 | N42: =RC[-2]-RC[-1] -> 776.475
A43: 'BLAUS | B43: 'Blauer See Delikatessen | C43: 24 | D43: 'G'day, Mate | E43: 7 | F43: 'Produce | G43: 51 | H43: 10956 | I43: 53 | J43: 8 | K43: 0 | L43: =RC[-2]*RC[-3] -> 424 | M43: =RC[-2]*RC[-1] -> 0 | N43: =RC[-2]-RC[-1] -> 424
A44: 'PICCO | B44: 'Piccolo und mehr | C44: 18 | D44: 'Aux joyeux ecclésiastiques | E44: 1 | F44: 'Beverages | G44: 38 | H44: 10353 | I44: 210.8 | J44: 50 | K44: 0.2 | L44: =RC[-2]*RC[-3] -> 10540 | M44: =RC[-2]*RC[-1] -> 2108 | N44: =RC[-2]-RC[-1] -> 8432
A45: 'FURIB | B45: 'Furia Bacalhau e Frutos do Mar | C45: 16 | D45: 'Bigfoot Breweries | E45: 1 | F45: 'Beverages | G45: 35 | H45: 10551 | I45: 18 | J45: 20 | K45: 0.15 | L45: =RC[-2]*RC[-3] -> 360 | M45: =RC[-2]*RC[-1] -> 54 | N45: =RC[-2]-RC[-1] -> 306
A46: 'LILAS | B46: 'LILA-Supermercado | C46: 12 | D46: 'Plutzer Lebensmittelgroßmärkte AG | E46: 2 | F46: 'Condiments | G46: 77 | H46: 10780 | I46: 13 | J46: 15 | K46: 0 | L46: =RC[-2]*RC[-3] -> 195 | M46: =RC[-2]*RC[-1] -> 0 | N46: =RC[-2]-RC[-1] -> 195
A47: 'MAGAA | B47: 'Magazzini Alimentari Riuniti | C47: 19 | D47: 'New England Seafood Cannery | E47: 8 | F47: 'Seafood | G47: 41 | H47: 10818 | I47: 9.65 | J47: 20 | K47: 0 | L47: =RC[-2]*RC[-3] -> 193 | M47: =RC[-2]*RC[-1] -> 0 | N47: =RC[-2]-RC[-1] -> 193
A48: 'RATTC | B48: 'Rattlesnake Canyon Grocery | C48: 10 | D48: 'Refrescos Americanas LTDA | E48: 1 | F48: 'Beverages | G48: 24 | H48: 11000 | I48: 4.5 | J48: 30 | K48: 0.25 | L48: =RC[-2]*RC[-3] -> 135 | M48: =RC[-2]*RC[-1] -> 33.75 | N48: =RC[-2]-RC[-1] -> 101.25
A49: 'BONAP | B49: 'Bon app' | C49: 8 | D49: 'Specialty Biscuits, Ltd. | E49: 3 | F49: 'Confections | G49: 19 | H49: 11076 | I49: 9.2 | J49: 10 | K49: 0.25 | L49: =RC[-2]*RC[-3] -> 92 | M49: =RC[-2]*RC[-1] -> 23 | N49: =RC[-2]-RC[-1] -> 69
A50: 'TRADH | B50: 'Tradição Hipermercados | C50: 18 | D50: 'Aux joyeux ecclésiastiques | E50: 1 | F50: 'Beverages | G50: 39 | H50: 10830 | I50: 18 | J50: 28 | K50: 0 | L50: =RC[-2]*RC[-3] -> 504 | M50: =RC[-2]*RC[-1] -> 0 | N50: =RC[-2]-RC[-1] -> 504
A51: 'FURIB | B51: 'Furia Bacalhau e Frutos do Mar | C51: 28 | D51: 'Gai pâturage | E51: 4 | F51: 'Dairy Products | G51: 59 | H51: 10328 | I51: 44 | J51: 9 | K51: 0 | L51: =RC[-2]*RC[-3] -> 396 | M51: =RC[-2]*RC[-1] -> 0 | N51: =RC[-2]-RC[-1] -> 396
A52: 'NORTS | B52: 'North/South | C52: 1 | D52: 'Exotic Liquids | E52: 1 | F52: 'Beverages | G52: 1 | H52: 10752 | I52: 18 | J52: 8 | K52: 0 | L52: =RC[-2]*RC[-3] -> 144 | M52: =RC[-2]*RC[-1] -> 0 | N52: =RC[-2]-RC[-1] -> 144
A53: 'TRAIH | B53: 'Trail's Head Gourmet Provisioners | C53: 15 | D53: 'Norske Meierier | E53: 4 | F53: 'Dairy Products | G53: 33 | H53: 10574 | I53: 2.5 | J53: 14 | K53: 0 | L53: =RC[-2]*RC[-3] -> 35 | M53: =RC[-2]*RC[-1] -> 0 | N53: =RC[-2]-RC[-1] -> 35
A54: 'FRANK | B54: 'Frankenversand | C54: 8 | D54: 'Specialty Biscuits, Ltd. | E54: 3 | F54: 'Confections | G54: 19 | H54: 11012 | I54: 9.2 | J54: 50 | K54: 0.05 | L54: =RC[-2]*RC[-3] -> 460 | M54: =RC[-2]*RC[-1] -> 23 | N54: =RC[-2]-RC[-1] -> 437
A55: 'LINOD | B55: 'LINO-Delicateses | C55: 7 | D55: 'Pavlova, Ltd. | E55: 1 | F55: 'Beverages | G55: 70 | H55: 10485 | I55: 12 | J55: 60 | K55: 0.1 | L55: =RC[-2]*RC[-3] -> 720 | M55: =RC[-2]*RC[-1] -> 72 | N55: =RC[-2]-RC[-1] -> 648
A56: 'SAVEA | B56: 'Save-a-lot Markets | C56: 11 | D56: 'Heli Süßwaren GmbH & Co. KG | E56: 3 | F56: 'Confections | G56: 25 | H56: 10393 | I56: 11.2 | J56: 7 | K56: 0.25 | L56: =RC[-2]*RC[-3] -> 78.4 | M56: =RC[-2]*RC[-1] -> 19.6 | N56: =RC[-2]-RC[-1] -> 58.8
A57: 'HILAA | B57: 'HILARIÓN-Abastos | C57: 28 | D57: 'Gai pâturage | E57: 4 | F57: 'Dairy Products | G57: 59 | H57: 10601 | I57: 55 | J57: 35 | K57: 0 | L57: =RC[-2]*RC[-3] -> 1925 | M57: =RC[-2]*RC[-1] -> 0 | N57: =RC[-2]-RC[-1] -> 1925
A58: 'LAUGB | B58: 'Laughing Bacchus Wine Cellars | C58: 10 | D58: 'Refrescos Americanas LTDA | E58: 1 | F58: 'Beverages | G58: 24 | H58: 10620 | I58: 4.5 | J58: 5 | K58: 0 | L58: =RC[-2]*RC[-3] -> 22.5 | M58: =RC[-2]*RC[-1] -> 0 | N58: =RC[-2]-RC[-1] -> 22.5
A59: 'DRACD | B59: 'Drachenblut Delikatessen | C59: 6 | D59: 'Mayumi's | E59: 8 | F59: 'Seafood | G59: 13 | H59: 11036 | I59: 6 | J59: 7 | K59: 0 | L59: =RC[-2]*RC[-3] -> 42 | M59: =RC[-2]*RC[-1] -> 0 | N59: =RC[-2]-RC[-1] -> 42
A60: 'ERNSH | B60: 'Ernst Handel | C60: 16 | D60: 'Bigfoot Breweries | E60: 1 | F60: 'Beverages | G60: 35 | H60: 10836 | I60: 18 | J60: 6 | K60: 0 | L60: =RC[-2]*RC[-3] -> 108 | M60: =RC[-2]*RC[-1] -> 0 | N60: =RC[-2]-RC[-1] -> 108
A61: 'RATTC | B61: 'Rattlesnake Canyon Grocery | C61: 25 | D61: 'Ma Maison | E61: 6 | F61: 'Meat/Poultry | G61: 55 | H61: 10564 | I61: 24 | J61: 25 | K61: 0.05 | L61: =RC[-2]*RC[-3] -> 600 | M61: =RC[-2]*RC[-1] -> 30 | N61: =RC[-2]-RC[-1] -> 570
A62: 'LILAS | B62: 'LILA-Supermercado | C62: 12 | D62: 'Plutzer Lebensmittelgroßmärkte AG | E62: 7 | F62: 'Produce | G62: 28 | H62: 10499 | I62: 45.6 | J62: 20 | K62: 0 | L62: =RC[-2]*RC[-3] -> 912 | M62: =RC[-2]*RC[-1] -> 0 | N62: =RC[-2]-RC[-1] -> 912
A63: 'HILAA | B63: 'HILARIÓN-Abastos | C63: 12 | D63: 'Plutzer Lebensmittelgroßmärkte AG | E63: 1 | F63: 'Beverages | G63: 75 | H63: 10613 | I63: 7.75 | J63: 40 | K63: 0 | L63: =RC[-2]*RC[-3] -> 310 | M63: =RC[-2]*RC[-1] -> 0 | N63: =RC[-2]-RC[-1] -> 310
A64: 'OLDWO | B64: 'Old World Delicatessen | C64: 20 | D64: 'Leka Trading | E64: 2 | F64: 'Condiments | G64: 44 | H64: 11034 | I64: 19.45 | J64: 12 | K64: 0 | L64: =RC[-2]*RC[-3] -> 233.4 | M64: =RC[-2]*RC[-1] -> 0 | N64: =RC[-2]-RC[-1] -> 233.4
A65: 'ERNSH | B65: 'Ernst Handel | C65: 12 | D65: 'Plutzer Lebensmittelgroßmärkte AG | E65: 5 | F65: 'Grains/Cereals | G65: 64 | H65: 10836 | I65: 33.25 | J65: 30 | K65: 0 | L65: =RC[-2]*RC[-3] -> 997.5 | M65: =RC[-2]*RC[-1] -> 0 | N65: =RC[-2]-RC[-1] -> 997.5
A66: 'WILMK | B66: 'Wilman Kala | C66: 3 | D66: 'Grandma Kelly's Homestead | E66: 2 | F66: 'Condiments | G66: 8 | H66: 10695 | I66: 40 | J66: 10 | K66: 0 | L66: =RC[-2]*RC[-3] -> 400 | M66: =RC[-2]*RC[-1] -> 0 | N66: =RC[-2]-RC[-1] -> 400
A67: 'BSBEV | B67: 'B's Beverages | C67: 23 | D67: 'Karkki Oy | E67: 3 | F67: 'Confections | G67: 49 | H67: 10539 | I67: 20 | J67: 6 | K67: 0 | L67: =RC[-2]*RC[-3] -> 120 | M67: =RC[-2]*RC[-1] -> 0 | N67: =RC[-2]-RC[-1] -> 120
A68: 'BLAUS | B68: 'Blauer See Delikatessen | C68: 25 | D68: 'Ma Maison | E68: 6 | F68: 'Meat/Poultry | G68: 54 | H68: 10501 | I68: 7.45 | J68: 20 | K68: 0 | L68: =RC[-2]*RC[-3] -> 149 | M68: =RC[-2]*RC[-1] -> 0 | N68: =RC[-2]-RC[-1] -> 149
A69: 'VICTE | B69: 'Victuailles en stock | C69: 4 | D69: 'Tokyo Traders | E69: 7 | F69: 'Produce | G69: 74 | H69: 10806 | I69: 10 | J69: 15 | K69: 0.25 | L69: =RC[-2]*RC[-3] -> 150 | M69: =RC[-2]*RC[-1] -> 37.5 | N69: =RC[-2]-RC[-1] -> 112.5
A70: 'ERNSH | B70: 'Ernst Handel | C70: 19 | D70: 'New England Seafood Cannery | E70: 8 | F70: 'Seafood | G70: 41 | H70: 11072 | I70: 9.65 | J70: 40 | K70: 0 | L70: =RC[-2]*RC[-3] -> 386 | M70: =RC[-2]*RC[-1] -> 0 | N70: =RC[-2]-RC[-1] -> 386
A71: 'KOENE | B71: 'Königlich Essen | C71: 5 | D71: 'Cooperativa de Quesos 'Las Cabras' | E71: 4 | F71: 'Dairy Products | G71: 12 | H71: 10718 | I71: 38 | J71: 36 | K71: 0 | L71: =RC[-2]*RC[-3] -> 1368 | M71: =RC[-2]*RC[-1] -> 0 | N71: =RC[-2]-RC[-1] -> 1368
A72: 'HUNGO | B72: 'Hungry Owl All-Night Grocers | C72: 12 | D72: 'Plutzer Lebensmittelgroßmärkte AG | E72: 6 | F72: 'Meat/Poultry | G72: 29 | H72: 10897 | I72: 123.79 | J72: 80 | K72: 0 | L72: =RC[-2]*RC[-3] -> 9903.2 | M72: =RC[-2]*RC[-1] -> 0 | N72: =RC[-2]-RC[-1] -> 9903.2
A73: 'SUPRD | B73: 'Suprêmes délices | C73: 8 | D73: 'Specialty Biscuits, Ltd. | E73: 3 | F73: 'Confections | G73: 20 | H73: 10252 | I73: 64.8 | J73: 40 | K73: 0.05 | L73: =RC[-2]*RC[-3] -> 2592 | M73: =RC[-2]*RC[-1] -> 129.6 | N73: =RC[-2]-RC[-1] -> 2462.4
A74: 'FRANK | B74: 'Frankenversand | C74: 25 | D74: 'Ma Maison | E74: 6 | F74: 'Meat/Poultry | G74: 54 | H74: 10859 | I74: 7.45 | J74: 35 | K74: 0.25 | L74: =RC[-2]*RC[-3] -> 260.75 | M74: =RC[-2]*RC[-1] -> 65.1875 | N74: =RC[-2]-RC[-1] -> 195.5625
A75: 'SPLIR | B75: 'Split Rail Beer & Ale | C75: 11 | D75: 'Heli Süßwaren GmbH & Co. KG | E75: 3 | F75: 'Confections | G75: 26 | H75: 10432 | I75: 24.9 | J75: 10 | K75: 0 | L75: =RC[-2]*RC[-3] -> 249 | M75: =RC[-2]*RC[-1] -> 0 | N75: =RC[-2]-RC[-1] -> 249
A76: 'OLDWO | B76: 'Old World Delicatessen | C76: 14 | D76: 'Formaggi Fortini s.r.l. | E76: 4 | F76: 'Dairy Products | G76: 31 | H76: 10855 | I76: 12.5 | J76: 14 | K76: 0 | L76: =RC[-2]*RC[-3] -> 175 | M76: =RC[-2]*RC[-1] -> 0 | N76: =RC[-2]-RC[-1] -> 175
A77: 'VAFFE | B77: 'Vaffeljernet | C77: 16 | D77: 'Bigfoot Breweries | E77: 1 | F77: 'Beverages | G77: 35 | H77: 10921 | I77: 18 | J77: 10 | K77: 0 | L77: =RC[-2]*RC[-3] -> 180 | M77: =RC[-2]*RC[-1] -> 0 | N77: =RC[-2]-RC[-1] -> 180
A78: 'ERNSH | B78: 'Ernst Handel | C78: 7 | D78: 'Pavlova, Ltd. | E78: 1 | F78: 'Beverages | G78: 70 | H78: 10698 | I78: 15 | J78: 8 | K78: 0.05 | L78: =RC[-2]*RC[-3] -> 120 | M78: =RC[-2]*RC[-1] -> 6 | N78: =RC[-2]-RC[-1] -> 114
A79: 'RATTC | B79: 'Rattlesnake Canyon Grocery | C79: 25 | D79: 'Ma Maison | E79: 6 | F79: 'Meat/Poultry | G79: 55 | H79: 11077 | I79: 24 | J79: 2 | K79: 0 | L79: =RC[-2]*RC[-3] -> 48 | M79: =RC[-2]*RC[-1] -> 0 | N79: =RC[-2]-RC[-1] -> 48
A80: 'TRADH | B80: 'Tradição Hipermercados | C80: 8 | D80: 'Specialty Biscuits, Ltd. | E80: 3 | F80: 'Confections | G80: 20 | H80: 10292 | I80: 64.8 | J80: 20 | K80: 0 | L80: =RC[-2]*RC[-3] -> 1296 | M80: =RC[-2]*RC[-1] -> 0 | N80: =RC[-2]-RC[-1] -> 1296
A81: 'MAGAA | B81: 'Magazzini Alimentari Riuniti | C81: 18 | D81: 'Aux joyeux ecclésiastiques | E81: 1 | F81: 'Beverages | G81: 39 | H81: 10784 | I81: 18 | J81: 2 | K81: 0.15 | L81: =RC[-2]*RC[-3] -> 36 | M81: =RC[-2]*RC[-1] -> 5.4 | N81: =RC[-2]-RC[-1] -> 30.6
A82: 'AROUT | B82: 'Around the Horn | C82: 26 | D82: 'Pasta Buttini s.r.l. | E82: 5 | F82: 'Grains/Cereals | G82: 57 | H82: 10707 | I82: 19.5 | J82: 40 | K82: 0 | L82: =RC[-2]*RC[-3] -> 780 | M82: =RC[-2]*RC[-1] -> 0 | N82: =RC[-2]-RC[-1] -> 780
A83: 'QUEEN | B83: 'Queen Cozinha | C83: 20 | D83: 'Leka Trading | E83: 1 | F83: 'Beverages | G83: 43 | H83: 11068 | I83: 46 | J83: 36 | K83: 0.15 | L83: =RC[-2]*RC[-3] -> 1656 | M83: =RC[-2]*RC[-1] -> 248.4 | N83: =RC[-2]-RC[-1] -> 1407.6
A84: 'QUICK | B84: 'QUICK-Stop | C84: 14 | D84: 'Formaggi Fortini s.r.l. | E84: 4 | F84: 'Dairy Products | G84: 31 | H84: 10273 | I84: 10 | J84: 15 | K84: 0.05 | L84: =RC[-2]*RC[-3] -> 150 | M84: =RC[-2]*RC[-1] -> 7.5 | N84: =RC[-2]-RC[-1] -> 142.5
A85: 'EASTC | B85: 'Eastern Connection | C85: 15 | D85: 'Norske Meierier | E85: 4 | F85: 'Dairy Products | G85: 33 | H85: 11024 | I85: 2.5 | J85: 30 | K85: 0 | L85: =RC[-2]*RC[-3] -> 75 | M85: =RC[-2]*RC[-1] -> 0 | N85: =RC[-2]-RC[-1] -> 75
A86: 'CHOPS | B86: 'Chop-suey Chinese | C86: 29 | D86: 'Forêts d'érables | E86: 3 | F86: 'Confections | G86: 62 | H86: 10746 | I86: 49.3 | J86: 9 | K86: 0 | L86: =RC[-2]*RC[-3] -> 443.7 | M86: =RC[-2]*RC[-1] -> 0 | N86: =RC[-2]-RC[-1] -> 443.7
A87: 'FAMIA | B87: 'Familia Arquibaldo | C87: 21 | D87: 'Lyngbysild | E87: 8 | F87: 'Seafood | G87: 46 | H87: 10512 | I87: 12 | J87: 9 | K87: 0.15 | L87: =RC[-2]*RC[-3] -> 108 | M87: =RC[-2]*RC[-1] -> 16.2 | N87: =RC[-2]-RC[-1] -> 91.8
A88: 'BERGS | B88: 'Berglunds snabbköp | C88: 17 | D88: 'Svensk Sjöföda AB | E88: 8 | F88: 'Seafood | G88: 73 | H88: 10278 | I88: 12 | J88: 25 | K88: 0 | L88: =RC[-2]*RC[-3] -> 300 | M88: =RC[-2]*RC[-1] -> 0 | N88: =RC[-2]-RC[-1] -> 300
A89: 'FRANK | B89: 'Frankenversand | C89: 8 | D89: 'Specialty Biscuits, Ltd. | E89: 3 | F89: 'Confections | G89: 21 | H89: 10623 | I89: 10 | J89: 25 | K89: 0.1 | L89: =RC[-2]*RC[-3] -> 250 | M89: =RC[-2]*RC[-1] -> 25 | N89: =RC[-2]-RC[-1] -> 225
A90: 'SAVEA | B90: 'Save-a-lot Markets | C90: 1 | D90: 'Exotic Liquids | E90: 1 | F90: 'Beverages | G90: 2 | H90: 10714 | I90: 19 | J90: 30 | K90: 0.25 | L90: =RC[-2]*RC[-3] -> 570 | M90: =RC[-2]*RC[-1] -> 142.5 | N90: =RC[-2]-RC[-1] -> 427.5
A91: 'BOLID | B91: 'Bólido Comidas preparadas | C91: 12 | D91: 'Plutzer Lebensmittelgroßmärkte AG | E91: 1 | F91: 'Beverages | G91: 75 | H91: 10326 | I91: 6.2 | J91: 50 | K91: 0 | L91: =RC[-2]*RC[-3] -> 310 | M91: =RC[-2]*RC[-1] -> 0 | N91: =RC[-2]-RC[-1] -> 310
A92: 'FOLKO | B92: 'Folk och fä HB | C92: 1 | D92: 'Exotic Liquids | E92: 1 | F92: 'Beverages | G92: 2 | H92: 10327 | I92: 15.2 | J92: 25 | K92: 0.2 | L92: =RC[-2]*RC[-3] -> 380 | M92: =RC[-2]*RC[-1] -> 76 | N92: =RC[-2]-RC[-1] -> 304
A93: 'QUICK | B93: 'QUICK-Stop | C93: 20 | D93: 'Leka Trading | E93: 5 | F93: 'Grains/Cereals | G93: 42 | H93: 10845 | I93: 14 | J93: 42 | K93: 0.1 | L93: =RC[-2]*RC[-3] -> 588 | M93: =RC[-2]*RC[-1] -> 58.8 | N93: =RC[-2]-RC[-1] -> 529.2
A94: 'BLONP | B94: 'Blondel père et fils | C94: 26 | D94: 'Pasta Buttini s.r.l. | E94: 5 | F94: 'Grains/Cereals | G94: 57 | H94: 10826 | I94: 19.5 | J94: 15 | K94: 0 | L94: =RC[-2]*RC[-3] -> 292.5 | M94: =RC[-2]*RC[-1] -> 0 | N94: =RC[-2]-RC[-1] -> 292.5
A95: 'OLDWO | B95: 'Old World Delicatessen | C95: 7 | D95: 'Pavlova, Ltd. | E95: 8 | F95: 'Seafood | G95: 18 | H95: 10305 | I95: 50 | J95: 25 | K95: 0.1 | L95: =RC[-2]*RC[-3] -> 1250 | M95: =RC[-2]*RC[-1] -> 125 | N95: =RC[-2]-RC[-1] -> 1125
A96: 'ERNSH | B96: 'Ernst Handel | C96: 13 | D96: 'Nord-Ost-Fisch Handelsgesellschaft mbH | E96: 8 | F96: 'Seafood | G96: 30 | H96: 10263 | I96: 20.7 | J96: 60 | K96: 0.25 | L96: =RC[-2]*RC[-3] -> 1242 | M96: =RC[-2]*RC[-1] -> 310.5 | N96: =RC[-2]-RC[-1] -> 931.5
A97: 'SPLIR | B97: 'Split Rail Beer & Ale | C97: 18 | D97: 'Aux joyeux ecclésiastiques | E97: 1 | F97: 'Beverages | G97: 38 | H97: 10329 | I97: 210.8 | J97: 20 | K97: 0.05 | L97: =RC[-2]*RC[-3] -> 4216 | M97: =RC[-2]*RC[-1] -> 210.8 | N97: =RC[-2]-RC[-1] -> 4005.2
A98: 'SAVEA | B98: 'Save-a-lot Markets | C98: 7 | D98: 'Pavlova, Ltd. | E98: 3 | F98: 'Confections | G98: 16 | H98: 10984 | I98: 17.45 | J98: 55 | K98: 0 | L98: =RC[-2]*RC[-3] -> 959.75 | M98: =RC[-2]*RC[-1] -> 0 | N98: =RC[-2]-RC[-1] -> 959.75
A99: 'FRANS | B99: 'Franchi S.p.A. | C99: 19 | D99: 'New England Seafood Cannery | E99: 8 | F99: 'Seafood | G99: 40 | H99: 10807 | I99: 18.4 | J99: 1 | K99: 0 | L99: =RC[-2]*RC[-3] -> 18.4 | M99: =RC[-2]*RC[-1] -> 0 | N99: =RC[-2]-RC[-1] -> 18.4
A100: 'FRANK | B100: 'Frankenversand | C100: 8 | D100: 'Specialty Biscuits, Ltd. | E100: 3 | F100: 'Confections | G100: 21 | H100: 10929 | I100: 10 | J100: 60 | K100: 0 | L100: =RC[-2]*RC[-3] -> 600 | M100: =RC[-2]*RC[-1] -> 0 | N100: =RC[-2]-RC[-1] -> 600
A101: 'GREAL | B101: 'Great Lakes Food Market | C101: 8 | D101: 'Specialty Biscuits, Ltd. | E101: 3 | F101: 'Confections | G101: 21 | H101: 10681 | I101: 10 | J101: 12 | K101: 0.1 | L101: =RC[-2]*RC[-3] -> 120 | M101: =RC[-2]*RC[-1] -> 12 | N101: =RC[-2]-RC[-1] -> 108
A102: 'PRINI | B102: 'Princesa Isabel Vinhos | C102: 2 | D102: 'New Orleans Cajun Delights | E102: 2 | F102: 'Condiments | G102: 4 | H102: 10336 | I102: 17.6 | J102: 18 | K102: 0.1 | L102: =RC[-2]*RC[-3] -> 316.8 | M102: =RC[-2]*RC[-1] -> 31.68 | N102: =RC[-2]-RC[-1] -> 285.12
A103: 'RICAR | B103: 'Ricardo Adocicados | C103: 1 | D103: 'Exotic Liquids | E103: 1 | F103: 'Beverages | G103: 2 | H103: 10622 | I103: 19 | J103: 20 | K103: 0 | L103: =RC[-2]*RC[-3] -> 380 | M103: =RC[-2]*RC[-1] -> 0 | N103: =RC[-2]-RC[-1] -> 380
A104: 'FOLKO | B104: 'Folk och fä HB | C104: 1 | D104: 'Exotic Liquids | E104: 1 | F104: 'Beverages | G104: 2 | H104: 10264 | I104: 15.2 | J104: 35 | K104: 0 | L104: =RC[-2]*RC[-3] -> 532 | M104: =RC[-2]*RC[-1] -> 0 | N104: =RC[-2]-RC[-1] -> 532
A105: 'HUNGC | B105: 'Hungry Coyote Import Store | C105: 7 | D105: 'Pavlova, Ltd. | E105: 6 | F105: 'Meat/Poultry | G105: 17 | H105: 10415 | I105: 31.2 | J105: 2 | K105: 0 | L105: =RC[-2]*RC[-3] -> 62.4 | M105: =RC[-2]*RC[-1] -> 0 | N105: =RC[-2]-RC[-1] -> 62.4
A106: 'QUICK | B106: 'QUICK-Stop | C106: 1 | D106: 'Exotic Liquids | E106: 1 | F106: 'Beverages | G106: 2 | H106: 10418 | I106: 15.2 | J106: 60 | K106: 0 | L106: =RC[-2]*RC[-3] -> 912 | M106: =RC[-2]*RC[-1] -> 0 | N106: =RC[-2]-RC[-1] -> 912
A107: 'FRANK | B107: 'Frankenversand | C107: 29 | D107: 'Forêts d'érables | E107: 3 | F107: 'Confections | G107: 62 | H107: 10560 | I107: 49.3 | J107: 15 | K107: 0.25 | L107: =RC[-2]*RC[-3] -> 739.5 | M107: =RC[-2]*RC[-1] -> 184.875 | N107: =RC[-2]-RC[-1] -> 554.625
A108: 'VAFFE | B108: 'Vaffeljernet | C108: 3 | D108: 'Grandma Kelly's Homestead | E108: 7 | F108: 'Produce | G108: 7 | H108: 10591 | I108: 30 | J108: 10 | K108: 0 | L108: =RC[-2]*RC[-3] -> 300 | M108: =RC[-2]*RC[-1] -> 0 | N108: =RC[-2]-RC[-1] -> 300
A109: 'SIMOB | B109: 'Simons bistro | C109: 13 | D109: 'Nord-Ost-Fisch Handelsgesellschaft mbH | E109: 8 | F109: 'Seafood | G109: 30 | H109: 10802 | I109: 25.89 | J109: 25 | K109: 0.25 | L109: =RC[-2]*RC[-3] -> 647.25 | M109: =RC[-2]*RC[-1] -> 161.8125 | N109: =RC[-2]-RC[-1] -> 485.4375
A110: 'FOLKO | B110: 'Folk och fä HB | C110: 28 | D110: 'Gai pâturage | E110: 4 | F110: 'Dairy Products | G110: 59 | H110: 10703 | I110: 55 | J110: 35 | K110: 0 | L110: =RC[-2]*RC[-3] -> 1925 | M110: =RC[-2]*RC[-1] -> 0 | N110: =RC[-2]-RC[-1] -> 1925
A111: 'HUNGC | B111: 'Hungry Coyote Import Store | C111: 15 | D111: 'Norske Meierier | E111: 4 | F111: 'Dairy Products | G111: 33 | H111: 10415 | I111: 2 | J111: 20 | K111: 0 | L111: =RC[-2]*RC[-3] -> 40 | M111: =RC[-2]*RC[-1] -> 0 | N111: =RC[-2]-RC[-1] -> 40
A112: 'ERNSH | B112: 'Ernst Handel | C112: 12 | D112: 'Plutzer Lebensmittelgroßmärkte AG | E112: 7 | F112: 'Produce | G112: 28 | H112: 11008 | I112: 45.6 | J112: 70 | K112: 0.05 | L112: =RC[-2]*RC[-3] -> 3192 | M112: =RC[-2]*RC[-1] -> 159.6 | N112: =RC[-2]-RC[-1] -> 3032.4
A113: 'SANTG | B113: 'Santé Gourmet | C113: 7 | D113: 'Pavlova, Ltd. | E113: 3 | F113: 'Confections | G113: 16 | H113: 10909 | I113: 17.45 | J113: 15 | K113: 0 | L113: =RC[-2]*RC[-3] -> 261.75 | M113: =RC[-2]*RC[-1] -> 0 | N113: =RC[-2]-RC[-1] -> 261.75
A114: 'MEREP | B114: 'Mère Paillarde | C114: 12 | D114: 'Plutzer Lebensmittelgroßmärkte AG | E114: 2 | F114: 'Condiments | G114: 77 | H114: 10590 | I114: 13 | J114: 60 | K114: 0.05 | L114: =RC[-2]*RC[-3] -> 780 | M114: =RC[-2]*RC[-1] -> 39 | N114: =RC[-2]-RC[-1] -> 741
A115: 'FRANS | B115: 'Franchi S.p.A. | C115: 21 | D115: 'Lyngbysild | E115: 8 | F115: 'Seafood | G115: 45 | H115: 10753 | I115: 9.5 | J115: 4 | K115: 0 | L115: =RC[-2]*RC[-3] -> 38 | M115: =RC[-2]*RC[-1] -> 0 | N115: =RC[-2]-RC[-1] -> 38
A116: 'OTTIK | B116: 'Ottilies Käseladen | C116: 1 | D116: 'Exotic Liquids | E116: 1 | F116: 'Beverages | G116: 2 | H116: 10766 | I116: 19 | J116: 40 | K116: 0 | L116: =RC[-2]*RC[-3] -> 760 | M116: =RC[-2]*RC[-1] -> 0 | N116: =RC[-2]-RC[-1] -> 760
A117: 'RICAR | B117: 'Ricardo Adocicados | C117: 10 | D117: 'Refrescos Americanas LTDA | E117: 1 | F117: 'Beverages | G117: 24 | H117: 10648 | I117: 4.5 | J117: 15 | K117: 0.15 | L117: =RC[-2]*RC[-3] -> 67.5 | M117: =RC[-2]*RC[-1] -> 10.125 | N117: =RC[-2]-RC[-1] -> 57.375
A118: 'SAVEA | B118: 'Save-a-lot Markets | C118: 7 | D118: 'Pavlova, Ltd. | E118: 3 | F118: 'Confections | G118: 16 | H118: 10440 | I118: 13.9 | J118: 49 | K118: 0.15 | L118: =RC[-2]*RC[-3] -> 681.1 | M118: =RC[-2]*RC[-1] -> 102.165 | N118: =RC[-2]-RC[-1] -> 578.935
A119: 'FAMIA | B119: 'Familia Arquibaldo | C119: 15 | D119: 'Norske Meierier | E119: 4 | F119: 'Dairy Products | G119: 33 | H119: 10414 | I119: 2 | J119: 50 | K119: 0 | L119: =RC[-2]*RC[-3] -> 100 | M119: =RC[-2]*RC[-1] -> 0 | N119: =RC[-2]-RC[-1] -> 100
A120: 'KOENE | B120: 'Königlich Essen | C120: 18 | D120: 'Aux joyeux ecclésiastiques | E120: 1 | F120: 'Beverages | G120: 39 | H120: 10323 | I120: 14.4 | J120: 4 | K120: 0 | L120: =RC[-2]*RC[-3] -> 57.6 | M120: =RC[-2]*RC[-1] -> 0 | N120: =RC[-2]-RC[-1] -> 57.6
A121: 'QUICK | B121: 'QUICK-Stop | C121: 9 | D121: 'PB Knäckebröd AB | E121: 5 | F121: 'Grains/Cereals | G121: 23 | H121: 10845 | I121: 9 | J121: 70 | K121: 0.1 | L121: =RC[-2]*RC[-3] -> 630 | M121: =RC[-2]*RC[-1] -> 63 | N121: =RC[-2]-RC[-1] -> 567
A122: 'BOTTM | B122: 'Bottom-Dollar Markets | C122: 19 | D122: 'New England Seafood Cannery | E122: 8 | F122: 'Seafood | G122: 40 | H122: 10431 | I122: 14.7 | J122: 50 | K122: 0.25 | L122: =RC[-2]*RC[-3] -> 735 | M122: =RC[-2]*RC[-1] -> 183.75 | N122: =RC[-2]-RC[-1] -> 551.25
A123: 'RATTC | B123: 'Rattlesnake Canyon Grocery | C123: 29 | D123: 'Forêts d'érables | E123: 3 | F123: 'Confections | G123: 62 | H123: 10316 | I123: 39.4 | J123: 70 | K123: 0 | L123: =RC[-2]*RC[-3] -> 2758 | M123: =RC[-2]*RC[-1] -> 0 | N123: =RC[-2]-RC[-1] -> 2758
A124: 'FRANK | B124: 'Frankenversand | C124: 15 | D124: 'Norske Meierier | E124: 4 | F124: 'Dairy Products | G124: 71 | H124: 11012 | I124: 21.5 | J124: 60 | K124: 0.05 | L124: =RC[-2]*RC[-3] -> 1290 | M124: =RC[-2]*RC[-1] -> 64.5 | N124: =RC[-2]-RC[-1] -> 1225.5
A125: 'SAVEA | B125: 'Save-a-lot Markets | C125: 15 | D125: 'Norske Meierier | E125: 4 | F125: 'Dairy Products | G125: 71 | H125: 10700 | I125: 21.5 | J125: 60 | K125: 0.2 | L125: =RC[-2]*RC[-3] -> 1290 | M125: =RC[-2]*RC[-1] -> 258 | N125: =RC[-2]-RC[-1] -> 1032
A126: 'TRADH | B126: 'Tradição Hipermercados | C126: 14 | D126: 'Formaggi Fortini s.r.l. | E126: 4 | F126: 'Dairy Products | G126: 72 | H126: 10839 | I126: 34.8 | J126: 15 | K126: 0.1 | L126: =RC[-2]*RC[-3] -> 522 | M126: =RC[-2]*RC[-1] -> 52.2 | N126: =RC[-2]-RC[-1] -> 469.8
A127: 'LACOR | B127: 'La corne d'abondance | C127: 24 | D127: 'G'day, Mate | E127: 5 | F127: 'Grains/Cereals | G127: 52 | H127: 10927 | I127: 7 | J127: 5 | K127: 0 | L127: =RC[-2]*RC[-3] -> 35 | M127: =RC[-2]*RC[-1] -> 0 | N127: =RC[-2]-RC[-1] -> 35
A128: 'WILMK | B128: 'Wilman Kala | C128: 8 | D128: 'Specialty Biscuits, Ltd. | E128: 3 | F128: 'Confections | G128: 19 | H128: 10910 | I128: 9.2 | J128: 12 | K128: 0 | L128: =RC[-2]*RC[-3] -> 110.4 | M128: =RC[-2]*RC[-1] -> 0 | N128: =RC[-2]-RC[-1] -> 110.4
A129: 'QUICK | B129: 'QUICK-Stop | C129: 11 | D129: 'Heli Süßwaren GmbH & Co. KG | E129: 3 | F129: 'Confections | G129: 27 | H129: 10515 | I129: 43.9 | J129: 120 | K129: 0 | L129: =RC[-2]*RC[-3] -> 5268 | M129: =RC[-2]*RC[-1] -> 0 | N129: =RC[-2]-RC[-1] -> 5268
A130: 'FRANK | B130: 'Frankenversand | C130: 12 | D130: 'Plutzer Lebensmittelgroßmärkte AG | E130: 1 | F130: 'Beverages | G130: 75 | H130: 10670 | I130: 7.75 | J130: 25 | K130: 0 | L130: =RC[-2]*RC[-3] -> 193.75 | M130: =RC[-2]*RC[-1] -> 0 | N130: =RC[-2]-RC[-1] -> 193.75
A131: 'KOENE | B131: 'Königlich Essen | C131: 25 | D131: 'Ma Maison | E131: 6 | F131: 'Meat/Poultry | G131: 54 | H131: 10542 | I131: 7.45 | J131: 24 | K131: 0.05 | L131: =RC[-2]*RC[-3] -> 178.8 | M131: =RC[-2]*RC[-1] -> 8.94 | N131: =RC[-2]-RC[-1] -> 169.86
A132: 'QUICK | B132: 'QUICK-Stop | C132: 8 | D132: 'Specialty Biscuits, Ltd. | E132: 3 | F132: 'Confections | G132: 19 | H132: 10345 | I132: 7.3 | J132: 80 | K132: 0 | L132: =RC[-2]*RC[-3] -> 584 | M132: =RC[-2]*RC[-1] -> 0 | N132: =RC[-2]-RC[-1] -> 584
A133: 'RANCH | B133: 'Rancho grande | C133: 23 | D133: 'Karkki Oy | E133: 3 | F133: 'Confections | G133: 49 | H133: 11019 | I133: 20 | J133: 2 | K133: 0 | L133: =RC[-2]*RC[-3] -> 40 | M133: =RC[-2]*RC[-1] -> 0 | N133: =RC[-2]-RC[-1] -> 40
A134: 'HUNGO | B134: 'Hungry Owl All-Night Grocers | C134: 14 | D134: 'Formaggi Fortini s.r.l. | E134: 4 | F134: 'Dairy Products | G134: 31 | H134: 10335 | I134: 10 | J134: 25 | K134: 0.2 | L134: =RC[-2]*RC[-3] -> 250 | M134: =RC[-2]*RC[-1] -> 50 | N134: =RC[-2]-RC[-1] -> 200
A135: 'HANAR | B135: 'Hanari Carnes | C135: 5 | D135: 'Cooperativa de Quesos 'Las Cabras' | E135: 4 | F135: 'Dairy Products | G135: 11 | H135: 10770 | I135: 21 | J135: 15 | K135: 0.25 | L135: =RC[-2]*RC[-3] -> 315 | M135: =RC[-2]*RC[-1] -> 78.75 | N135: =RC[-2]-RC[-1] -> 236.25
A136: 'MAGAA | B136: 'Magazzini Alimentari Riuniti | C136: 2 | D136: 'New Orleans Cajun Delights | E136: 2 | F136: 'Condiments | G136: 66 | H136: 10300 | I136: 13.6 | J136: 30 | K136: 0 | L136: =RC[-2]*RC[-3] -> 408 | M136: =RC[-2]*RC[-1] -> 0 | N136: =RC[-2]-RC[-1] -> 408
A137: 'ERNSH | B137: 'Ernst Handel | C137: 12 | D137: 'Plutzer Lebensmittelgroßmärkte AG | E137: 7 | F137: 'Produce | G137: 28 | H137: 10514 | I137: 45.6 | J137: 35 | K137: 0 | L137: =RC[-2]*RC[-3] -> 1596 | M137: =RC[-2]*RC[-1] -> 0 | N137: =RC[-2]-RC[-1] -> 1596
A138: 'HUNGO | B138: 'Hungry Owl All-Night Grocers | C138: 16 | D138: 'Bigfoot Breweries | E138: 1 | F138: 'Beverages | G138: 34 | H138: 11063 | I138: 14 | J138: 30 | K138: 0 | L138: =RC[-2]*RC[-3] -> 420 | M138: =RC[-2]*RC[-1] -> 0 | N138: =RC[-2]-RC[-1] -> 420
A139: 'FOLKO | B139: 'Folk och fä HB | C139: 18 | D139: 'Aux joyeux ecclésiastiques | E139: 1 | F139: 'Beverages | G139: 39 | H139: 10977 | I139: 18 | J139: 30 | K139: 0 | L139: =RC[-2]*RC[-3] -> 540 | M139: =RC[-2]*RC[-1] -> 0 | N139: =RC[-2]-RC[-1] -> 540
A140: 'BERGS | B140: 'Berglunds snabbköp | C140: 19 | D140: 'New England Seafood Cannery | E140: 8 | F140: 'Seafood | G140: 40 | H140: 10572 | I140: 18.4 | J140: 50 | K140: 0 | L140: =RC[-2]*RC[-3] -> 920 | M140: =RC[-2]*RC[-1] -> 0 | N140: =RC[-2]-RC[-1] -> 920
A141: 'EASTC | B141: 'Eastern Connection | C141: 13 | D141: 'Nord-Ost-Fisch Handelsgesellschaft mbH | E141: 8 | F141: 'Seafood | G141: 30 | H141: 10532 | I141: 25.89 | J141: 15 | K141: 0 | L141: =RC[-2]*RC[-3] -> 388.35 | M141: =RC[-2]*RC[-1] -> 0 | N141: =RC[-2]-RC[-1] -> 388.35
A142: 'FOLKO | B142: 'Folk och fä HB | C142: 5 | D142: 'Cooperativa de Quesos 'Las Cabras' | E142: 4 | F142: 'Dairy Products | G142: 11 | H142: 10327 | I142: 16.8 | J142: 50 | K142: 0.2 | L142: =RC[-2]*RC[-3] -> 840 | M142: =RC[-2]*RC[-1] -> 168 | N142: =RC[-2]-RC[-1] -> 672
A143: 'ERNSH | B143: 'Ernst Handel | C143: 1 | D143: 'Exotic Liquids | E143: 1 | F143: 'Beverages | G143: 2 | H143: 10258 | I143: 15.2 | J143: 50 | K143: 0.2 | L143: =RC[-2]*RC[-3] -> 760 | M143: =RC[-2]*RC[-1] -> 152 | N143: =RC[-2]-RC[-1] -> 608
A144: 'MAISD | B144: 'Maison Dewey | C144: 23 | D144: 'Karkki Oy | E144: 1 | F144: 'Beverages | G144: 76 | H144: 11004 | I144: 18 | J144: 6 | K144: 0 | L144: =RC[-2]*RC[-3] -> 108 | M144: =RC[-2]*RC[-1] -> 0 | N144: =RC[-2]-RC[-1] -> 108
A145: 'HILAA | B145: 'HILARIÓN-Abastos | C145: 24 | D145: 'G'day, Mate | E145: 7 | F145: 'Produce | G145: 51 | H145: 10486 | I145: 42.4 | J145: 25 | K145: 0 | L145: =RC[-2]*RC[-3] -> 1060 | M145: =RC[-2]*RC[-1] -> 0 | N145: =RC[-2]-RC[-1] -> 1060
A146: 'RATTC | B146: 'Rattlesnake Canyon Grocery | C146: 6 | D146: 'Mayumi's | E146: 7 | F146: 'Produce | G146: 14 | H146: 11077 | I146: 23.25 | J146: 1 | K146: 0.03 | L146: =RC[-2]*RC[-3] -> 23.25 | M146: =RC[-2]*RC[-1] -> 0.6975 | N146: =RC[-2]-RC[-1] -> 22.5525
A147: 'ERNSH | B147: 'Ernst Handel | C147: 7 | D147: 'Pavlova, Ltd. | E147: 6 | F147: 'Meat/Poultry | G147: 17 | H147: 10430 | I147: 31.2 | J147: 45 | K147: 0.2 | L147: =RC[-2]*RC[-3] -> 1404 | M147: =RC[-2]*RC[-1] -> 280.8 | N147: =RC[-2]-RC[-1] -> 1123.2
A148: 'OCEAN | B148: 'Océano Atlántico Ltda. | C148: 3 | D148: 'Grandma Kelly's Homestead | E148: 7 | F148: 'Produce | G148: 7 | H148: 10958 | I148: 30 | J148: 6 | K148: 0 | L148: =RC[-2]*RC[-3] -> 180 | M148: =RC[-2]*RC[-1] -> 0 | N148: =RC[-2]-RC[-1] -> 180
A149: 'ALFKI | B149: 'Alfreds Futterkiste | C149: 21 | D149: 'Lyngbysild | E149: 8 | F149: 'Seafood | G149: 46 | H149: 10643 | I149: 12 | J149: 2 | K149: 0.25 | L149: =RC[-2]*RC[-3] -> 24 | M149: =RC[-2]*RC[-1] -> 6 | N149: =RC[-2]-RC[-1] -> 18
A150: 'RICAR | B150: 'Ricardo Adocicados | C150: 7 | D150: 'Pavlova, Ltd. | E150: 3 | F150: 'Confections | G150: 16 | H150: 10287 | I150: 13.9 | J150: 40 | K150: 0.15 | L150: =RC[-2]*RC[-3] -> 556 | M150: =RC[-2]*RC[-1] -> 83.4 | N150: =RC[-2]-RC[-1] -> 472.6
A151: 'QUEDE | B151: 'Que Delícia | C151: 5 | D151: 'Cooperativa de Quesos 'Las Cabras' | E151: 4 | F151: 'Dairy Products | G151: 11 | H151: 10989 | I151: 21 | J151: 15 | K151: 0 | L151: =RC[-2]*RC[-3] -> 315 | M151: =RC[-2]*RC[-1] -> 0 | N151: =RC[-2]-RC[-1] -> 315
A152: 'ISLAT | B152: 'Island Trading | C152: 29 | D152: 'Forêts d'érables | E152: 2 | F152: 'Condiments | G152: 61 | H152: 10933 | I152: 28.5 | J152: 30 | K152: 0 | L152: =RC[-2]*RC[-3] -> 855 | M152: =RC[-2]*RC[-1] -> 0 | N152: =RC[-2]-RC[-1] -> 855
A153: 'SUPRD | B153: 'Suprêmes délices | C153: 25 | D153: 'Ma Maison | E153: 6 | F153: 'Meat/Poultry | G153: 55 | H153: 10930 | I153: 24 | J153: 25 | K153: 0.2 | L153: =RC[-2]*RC[-3] -> 600 | M153: =RC[-2]*RC[-1] -> 120 | N153: =RC[-2]-RC[-1] -> 480
A154: 'QUICK | B154: 'QUICK-Stop | C154: 18 | D154: 'Aux joyeux ecclésiastiques | E154: 1 | F154: 'Beverages | G154: 38 | H154: 10865 | I154: 263.5 | J154: 60 | K154: 0.05 | L154: =RC[-2]*RC[-3] -> 15810 | M154: =RC[-2]*RC[-1] -> 790.5 | N154: =RC[-2]-RC[-1] -> 15019.5
A155: 'WARTH | B155: 'Wartian Herkku | C155: 28 | D155: 'Gai pâturage | E155: 4 | F155: 'Dairy Products | G155: 59 | H155: 10750 | I155: 55 | J155: 25 | K155: 0.15 | L155: =RC[-2]*RC[-3] -> 1375 | M155: =RC[-2]*RC[-1] -> 206.25 | N155: =RC[-2]-RC[-1] -> 1168.75
A156: 'WOLZA | B156: 'Wolski Zajazd | C156: 4 | D156: 'Tokyo Traders | E156: 7 | F156: 'Produce | G156: 74 | H156: 10998 | I156: 10 | J156: 20 | K156: 0 | L156: =RC[-2]*RC[-3] -> 200 | M156: =RC[-2]*RC[-1] -> 0 | N156: =RC[-2]-RC[-1] -> 200
A157: 'HILAA | B157: 'HILARIÓN-Abastos | C157: 28 | D157: 'Gai pâturage | E157: 4 | F157: 'Dairy Products | G157: 59 | H157: 10490 | I157: 44 | J157: 60 | K157: 0 | L157: =RC[-2]*RC[-3] -> 2640 | M157: =RC[-2]*RC[-1] -> 0 | N157: =RC[-2]-RC[-1] -> 2640
A158: 'BERGS | B158: 'Berglunds snabbköp | C158: 28 | D158: 'Gai pâturage | E158: 4 | F158: 'Dairy Products | G158: 60 | H158: 10626 | I158: 34 | J158: 20 | K158: 0 | L158: =RC[-2]*RC[-3] -> 680 | M158: =RC[-2]*RC[-1] -> 0 | N158: =RC[-2]-RC[-1] -> 680
A159: 'RICSU | B159: 'Richter Supermarkt | C159: 13 | D159: 'Nord-Ost-Fisch Handelsgesellschaft mbH | E159: 8 | F159: 'Seafood | G159: 30 | H159: 10751 | I159: 25.89 | J159: 30 | K159: 0 | L159: =RC[-2]*RC[-3] -> 776.7 | M159: =RC[-2]*RC[-1] -> 0 | N159: =RC[-2]-RC[-1] -> 776.7
A160: 'BONAP | B160: 'Bon app' | C160: 14 | D160: 'Formaggi Fortini s.r.l. | E160: 4 | F160: 'Dairy Products | G160: 72 | H160: 10932 | I160: 34.8 | J160: 16 | K160: 0 | L160: =RC[-2]*RC[-3] -> 556.8 | M160: =RC[-2]*RC[-1] -> 0 | N160: =RC[-2]-RC[-1] -> 556.8
A161: 'WHITC | B161: 'White Clover Markets | C161: 12 | D161: 'Plutzer Lebensmittelgroßmärkte AG | E161: 7 | F161: 'Produce | G161: 28 | H161: 10740 | I161: 45.6 | J161: 5 | K161: 0.2 | L161: =RC[-2]*RC[-3] -> 228 | M161: =RC[-2]*RC[-1] -> 45.6 | N161: =RC[-2]-RC[-1] -> 182.4
A162: 'MEREP | B162: 'Mère Paillarde | C162: 18 | D162: 'Aux joyeux ecclésiastiques | E162: 1 | F162: 'Beverages | G162: 38 | H162: 10424 | I162: 210.8 | J162: 49 | K162: 0.2 | L162: =RC[-2]*RC[-3] -> 10329.2 | M162: =RC[-2]*RC[-1] -> 2065.84 | N162: =RC[-2]-RC[-1] -> 8263.36
A163: 'NORTS | B163: 'North/South | C163: 7 | D163: 'Pavlova, Ltd. | E163: 1 | F163: 'Beverages | G163: 70 | H163: 10517 | I163: 15 | J163: 6 | K163: 0 | L163: =RC[-2]*RC[-3] -> 90 | M163: =RC[-2]*RC[-1] -> 0 | N163: =RC[-2]-RC[-1] -> 90
A164: 'CACTU | B164: 'Cactus Comidas para llevar | C164: 14 | D164: 'Formaggi Fortini s.r.l. | E164: 4 | F164: 'Dairy Products | G164: 31 | H164: 10782 | I164: 12.5 | J164: 1 | K164: 0 | L164: =RC[-2]*RC[-3] -> 12.5 | M164: =RC[-2]*RC[-1] -> 0 | N164: =RC[-2]-RC[-1] -> 12.5
A165: 'TORTU | B165: 'Tortuga Restaurante | C165: 8 | D165: 'Specialty Biscuits, Ltd. | E165: 3 | F165: 'Confections | G165: 19 | H165: 10676 | I165: 9.2 | J165: 7 | K165: 0 | L165: =RC[-2]*RC[-3] -> 64.4 | M165: =RC[-2]*RC[-1] -> 0 | N165: =RC[-2]-RC[-1] -> 64.4
A166: 'LAMAI | B166: 'La maison d'Asie | C166: 23 | D166: 'Karkki Oy | E166: 1 | F166: 'Beverages | G166: 76 | H166: 10413 | I166: 14.4 | J166: 14 | K166: 0 | L166: =RC[-2]*RC[-3] -> 201.6 | M166: =RC[-2]*RC[-1] -> 0 | N166: =RC[-2]-RC[-1] -> 201.6
A167: 'RICSU | B167: 'Richter Supermarkt | C167: 7 | D167: 'Pavlova, Ltd. | E167: 3 | F167: 'Confections | G167: 16 | H167: 10255 | I167: 13.9 | J167: 35 | K167: 0 | L167: =RC[-2]*RC[-3] -> 486.5 | M167: =RC[-2]*RC[-1] -> 0 | N167: =RC[-2]-RC[-1] -> 486.5
A168: 'RATTC | B168: 'Rattlesnake Canyon Grocery | C168: 12 | D168: 'Plutzer Lebensmittelgroßmärkte AG | E168: 2 | F168: 'Condiments | G168: 77 | H168: 11077 | I168: 13 | J168: 2 | K168: 0 | L168: =RC[-2]*RC[-3] -> 26 | M168: =RC[-2]*RC[-1] -> 0 | N168: =RC[-2]-RC[-1] -> 26
A169: 'LONEP | B169: 'Lonesome Pine Restaurant | C169: 1 | D169: 'Exotic Liquids | E169: 1 | F169: 'Beverages | G169: 1 | H169: 10317 | I169: 14.4 | J169: 20 | K169: 0 | L169: =RC[-2]*RC[-3] -> 288 | M169: =RC[-2]*RC[-1] -> 0 | N169: =RC[-2]-RC[-1] -> 288
A170: 'WARTH | B170: 'Wartian Herkku | C170: 28 | D170: 'Gai pâturage | E170: 4 | F170: 'Dairy Products | G170: 60 | H170: 10583 | I170: 34 | J170: 24 | K170: 0.15 | L170: =RC[-2]*RC[-3] -> 816 | M170: =RC[-2]*RC[-1] -> 122.4 | N170: =RC[-2]-RC[-1] -> 693.6
A171: 'ERNSH | B171: 'Ernst Handel | C171: 23 | D171: 'Karkki Oy | E171: 3 | F171: 'Confections | G171: 50 | H171: 11072 | I171: 16.25 | J171: 22 | K171: 0 | L171: =RC[-2]*RC[-3] -> 357.5 | M171: =RC[-2]*RC[-1] -> 0 | N171: =RC[-2]-RC[-1] -> 357.5
A172: 'GREAL | B172: 'Great Lakes Food Market | C172: 12 | D172: 'Plutzer Lebensmittelgroßmärkte AG | E172: 5 | F172: 'Grains/Cereals | G172: 64 | H172: 10681 | I172: 33.25 | J172: 28 | K172: 0 | L172: =RC[-2]*RC[-3] -> 931 | M172: =RC[-2]*RC[-1] -> 0 | N172: =RC[-2]-RC[-1] -> 931
A173: 'KOENE | B173: 'Königlich Essen | C173: 6 | D173: 'Mayumi's | E173: 7 | F173: 'Produce | G173: 14 | H173: 10325 | I173: 18.6 | J173: 9 | K173: 0 | L173: =RC[-2]*RC[-3] -> 167.4 | M173: =RC[-2]*RC[-1] -> 0 | N173: =RC[-2]-RC[-1] -> 167.4
A174: 'GODOS | B174: 'Godos Cocina Típica | C174: 28 | D174: 'Gai pâturage | E174: 4 | F174: 'Dairy Products | G174: 60 | H174: 11009 | I174: 34 | J174: 9 | K174: 0 | L174: =RC[-2]*RC[-3] -> 306 | M174: =RC[-2]*RC[-1] -> 0 | N174: =RC[-2]-RC[-1] -> 306
A175: 'LEHMS | B175: 'Lehmanns Marktstand | C175: 11 | D175: 'Heli Süßwaren GmbH & Co. KG | E175: 3 | F175: 'Confections | G175: 26 | H175: 10592 | I175: 31.23 | J175: 5 | K175: 0.05 | L175: =RC[-2]*RC[-3] -> 156.15 | M175: =RC[-2]*RC[-1] -> 7.8075 | N175: =RC[-2]-RC[-1] -> 148.3425
A176: 'OTTIK | B176: 'Ottilies Käseladen | C176: 12 | D176: 'Plutzer Lebensmittelgroßmärkte AG | E176: 2 | F176: 'Condiments | G176: 77 | H176: 10999 | I176: 13 | J176: 21 | K176: 0.05 | L176: =RC[-2]*RC[-3] -> 273 | M176: =RC[-2]*RC[-1] -> 13.65 | N176: =RC[-2]-RC[-1] -> 259.35
A177: 'KOENE | B177: 'Königlich Essen | C177: 11 | D177: 'Heli Süßwaren GmbH & Co. KG | E177: 3 | F177: 'Confections | G177: 26 | H177: 10849 | I177: 31.23 | J177: 18 | K177: 0.15 | L177: =RC[-2]*RC[-3] -> 562.14 | M177: =RC[-2]*RC[-1] -> 84.321 | N177: =RC[-2]-RC[-1] -> 477.819
A178: 'WELLI | B178: 'Wellington Importadora | C178: 20 | D178: 'Leka Trading | E178: 1 | F178: 'Beverages | G178: 43 | H178: 10644 | I178: 46 | J178: 20 | K178: 0 | L178: =RC[-2]*RC[-3] -> 920 | M178: =RC[-2]*RC[-1] -> 0 | N178: =RC[-2]-RC[-1] -> 920
A179: 'BERGS | B179: 'Berglunds snabbköp | C179: 6 | D179: 'Mayumi's | E179: 7 | F179: 'Produce | G179: 14 | H179: 10733 | I179: 23.25 | J179: 16 | K179: 0 | L179: =RC[-2]*RC[-3] -> 372 | M179: =RC[-2]*RC[-1] -> 0 | N179: =RC[-2]-RC[-1] -> 372
A180: 'CHOPS | B180: 'Chop-suey Chinese | C180: 26 | D180: 'Pasta Buttini s.r.l. | E180: 5 | F180: 'Grains/Cereals | G180: 56 | H180: 10966 | I180: 38 | J180: 12 | K180: 0.15 | L180: =RC[-2]*RC[-3] -> 456 | M180: =RC[-2]*RC[-1] -> 68.4 | N180: =RC[-2]-RC[-1] -> 387.6
A181: 'SUPRD | B181: 'Suprêmes délices | C181: 4 | D181: 'Tokyo Traders | E181: 8 | F181: 'Seafood | G181: 10 | H181: 10841 | I181: 31 | J181: 16 | K181: 0 | L181: =RC[-2]*RC[-3] -> 496 | M181: =RC[-2]*RC[-1] -> 0 | N181: =RC[-2]-RC[-1] -> 496
A182: 'ERNSH | B182: 'Ernst Handel | C182: 19 | D182: 'New England Seafood Cannery | E182: 8 | F182: 'Seafood | G182: 40 | H182: 10895 | I182: 18.4 | J182: 91 | K182: 0 | L182: =RC[-2]*RC[-3] -> 1674.4 | M182: =RC[-2]*RC[-1] -> 0 | N182: =RC[-2]-RC[-1] -> 1674.4
A183: 'CONSH | B183: 'Consolidated Holdings | C183: 14 | D183: 'Formaggi Fortini s.r.l. | E183: 4 | F183: 'Dairy Products | G183: 72 | H183: 10435 | I183: 27.8 | J183: 10 | K183: 0 | L183: =RC[-2]*RC[-3] -> 278 | M183: =RC[-2]*RC[-1] -> 0 | N183: =RC[-2]-RC[-1] -> 278
A184: 'SEVES | B184: 'Seven Seas Imports | C184: 9 | D184: 'PB Knäckebröd AB | E184: 5 | F184: 'Grains/Cereals | G184: 23 | H184: 10869 | I184: 9 | J184: 50 | K184: 0 | L184: =RC[-2]*RC[-3] -> 450 | M184: =RC[-2]*RC[-1] -> 0 | N184: =RC[-2]-RC[-1] -> 450
A185: 'HILAA | B185: 'HILARIÓN-Abastos | C185: 27 | D185: 'Escargots Nouveaux | E185: 8 | F185: 'Seafood | G185: 58 | H185: 10863 | I185: 13.25 | J185: 12 | K185: 0.15 | L185: =RC[-2]*RC[-3] -> 159 | M185: =RC[-2]*RC[-1] -> 23.85 | N185: =RC[-2]-RC[-1] -> 135.15
A186: 'BSBEV | B186: 'B's Beverages | C186: 8 | D186: 'Specialty Biscuits, Ltd. | E186: 3 | F186: 'Confections | G186: 21 | H186: 10484 | I186: 8 | J186: 14 | K186: 0 | L186: =RC[-2]*RC[-3] -> 112 | M186: =RC[-2]*RC[-1] -> 0 | N186: =RC[-2]-RC[-1] -> 112
A187: 'CACTU | B187: 'Cactus Comidas para llevar | C187: 19 | D187: 'New England Seafood Cannery | E187: 8 | F187: 'Seafood | G187: 41 | H187: 10521 | I187: 9.65 | J187: 10 | K187: 0 | L187: =RC[-2]*RC[-3] -> 96.5 | M187: =RC[-2]*RC[-1] -> 0 | N187: =RC[-2]-RC[-1] -> 96.5
A188: 'AROUT | B188: 'Around the Horn | C188: 17 | D188: 'Svensk Sjöföda AB | E188: 8 | F188: 'Seafood | G188: 73 | H188: 10558 | I188: 15 | J188: 3 | K188: 0 | L188: =RC[-2]*RC[-3] -> 45 | M188: =RC[-2]*RC[-1] -> 0 | N188: =RC[-2]-RC[-1] -> 45
A189: 'TORTU | B189: 'Tortuga Restaurante | C189: 18 | D189: 'Aux joyeux ecclésiastiques | E189: 1 | F189: 'Beverages | G189: 38 | H189: 10518 | I189: 263.5 | J189: 15 | K189: 0 | L189: =RC[-2]*RC[-3] -> 3952.5 | M189: =RC[-2]*RC[-1] -> 0 | N189: =RC[-2]-RC[-1] -> 3952.5
A190: 'ISLAT | B190: 'Island Trading | C190: 7 | D190: 'Pavlova, Ltd. | E190: 1 | F190: 'Beverages | G190: 70 | H190: 10315 | I190: 12 | J190: 30 | K190: 0 | L190: =RC[-2]*RC[-3] -> 360 | M190: =RC[-2]*RC[-1] -> 0 | N190: =RC[-2]-RC[-1] -> 360
A191: 'FRANK | B191: 'Frankenversand | C191: 10 | D191: 'Refrescos Americanas LTDA | E191: 1 | F191: 'Beverages | G191: 24 | H191: 10859 | I191: 4.5 | J191: 40 | K191: 0.25 | L191: =RC[-2]*RC[-3] -> 180 | M191: =RC[-2]*RC[-1] -> 45 | N191: =RC[-2]-RC[-1] -> 135
A192: 'SUPRD | B192: 'Suprêmes délices | C192: 15 | D192: 'Norske Meierier | E192: 4 | F192: 'Dairy Products | G192: 71 | H192: 10458 | I192: 17.2 | J192: 50 | K192: 0 | L192: =RC[-2]*RC[-3] -> 860 | M192: =RC[-2]*RC[-1] -> 0 | N192: =RC[-2]-RC[-1] -> 860
A193: 'LAUGB | B193: 'Laughing Bacchus Wine Cellars | C193: 19 | D193: 'New England Seafood Cannery | E193: 8 | F193: 'Seafood | G193: 41 | H193: 10495 | I193: 7.7 | J193: 20 | K193: 0 | L193: =RC[-2]*RC[-3] -> 154 | M193: =RC[-2]*RC[-1] -> 0 | N193: =RC[-2]-RC[-1] -> 154
A194: 'QUEDE | B194: 'Que Delícia | C194: 8 | D194: 'Specialty Biscuits, Ltd. | E194: 3 | F194: 'Confections | G194: 19 | H194: 10647 | I194: 9.2 | J194: 30 | K194: 0 | L194: =RC[-2]*RC[-3] -> 276 | M194: =RC[-2]*RC[-1] -> 0 | N194: =RC[-2]-RC[-1] -> 276
A195: 'BLONP | B195: 'Blondel père et fils | C195: 21 | D195: 'Lyngbysild | E195: 8 | F195: 'Seafood | G195: 46 | H195: 10436 | I195: 9.6 | J195: 5 | K195: 0 | L195: =RC[-2]*RC[-3] -> 48 | M195: =RC[-2]*RC[-1] -> 0 | N195: =RC[-2]-RC[-1] -> 48
A196: 'SUPRD | B196: 'Suprêmes délices | C196: 28 | D196: 'Gai pâturage | E196: 4 | F196: 'Dairy Products | G196: 60 | H196: 10252 | I196: 27.2 | J196: 40 | K196: 0 | L196: =RC[-2]*RC[-3] -> 1088 | M196: =RC[-2]*RC[-1] -> 0 | N196: =RC[-2]-RC[-1] -> 1088
A197: 'BOLID | B197: 'Bólido Comidas preparadas | C197: 26 | D197: 'Pasta Buttini s.r.l. | E197: 5 | F197: 'Grains/Cereals | G197: 57 | H197: 10326 | I197: 15.6 | J197: 16 | K197: 0 | L197: =RC[-2]*RC[-3] -> 249.6 | M197: =RC[-2]*RC[-1] -> 0 | N197: =RC[-2]-RC[-1] -> 249.6
A198: 'LILAS | B198: 'LILA-Supermercado | C198: 23 | D198: 'Karkki Oy | E198: 3 | F198: 'Confections | G198: 49 | H198: 10499 | I198: 20 | J198: 25 | K198: 0 | L198: =RC[-2]*RC[-3] -> 500 | M198: =RC[-2]*RC[-1] -> 0 | N198: =RC[-2]-RC[-1] -> 500
A199: 'DRACD | B199: 'Drachenblut Delikatessen | C199: 12 | D199: 'Plutzer Lebensmittelgroßmärkte AG | E199: 1 | F199: 'Beverages | G199: 75 | H199: 10363 | I199: 6.2 | J199: 12 | K199: 0 | L199: =RC[-2]*RC[-3] -> 74.4 | M199: =RC[-2]*RC[-1] -> 0 | N199: =RC[-2]-RC[-1] -> 74.4
A200: 'WELLI | B200: 'Wellington Importadora | C200: 7 | D200: 'Pavlova, Ltd. | E200: 8 | F200: 'Seafood | G200: 18 | H200: 10935 | I200: 62.5 | J200: 4 | K200: 0.25 | L200: =RC[-2]*RC[-3] -> 250 | M200: =RC[-2]*RC[-1] -> 62.5 | N200: =RC[-2]-RC[-1] -> 187.5
A201: 'REGGC | B201: 'Reggiani Caseifici | C201: 24 | D201: 'G'day, Mate | E201: 5 | F201: 'Grains/Cereals | G201: 52 | H201: 10908 | I201: 7 | J201: 14 | K201: 0.05 | L201: =RC[-2]*RC[-3] -> 98 | M201: =RC[-2]*RC[-1] -> 4.9 | N201: =RC[-2]-RC[-1] -> 93.1
A202: 'RICSU | B202: 'Richter Supermarkt | C202: 14 | D202: 'Formaggi Fortini s.r.l. | E202: 4 | F202: 'Dairy Products | G202: 31 | H202: 10537 | I202: 12.5 | J202: 30 | K202: 0 | L202: =RC[-2]*RC[-3] -> 375 | M202: =RC[-2]*RC[-1] -> 0 | N202: =RC[-2]-RC[-1] -> 375
A203: 'QUEDE | B203: 'Que Delícia | C203: 11 | D203: 'Heli Süßwaren GmbH & Co. KG | E203: 3 | F203: 'Confections | G203: 26 | H203: 10421 | I203: 24.9 | J203: 30 | K203: 0 | L203: =RC[-2]*RC[-3] -> 747 | M203: =RC[-2]*RC[-1] -> 0 | N203: =RC[-2]-RC[-1] -> 747
A204: 'VICTE | B204: 'Victuailles en stock | C204: 9 | D204: 'PB Knäckebröd AB | E204: 5 | F204: 'Grains/Cereals | G204: 22 | H204: 10251 | I204: 16.8 | J204: 6 | K204: 0.05 | L204: =RC[-2]*RC[-3] -> 100.8 | M204: =RC[-2]*RC[-1] -> 5.04 | N204: =RC[-2]-RC[-1] -> 95.76
A205: 'MAGAA | B205: 'Magazzini Alimentari Riuniti | C205: 14 | D205: 'Formaggi Fortini s.r.l. | E205: 4 | F205: 'Dairy Products | G205: 72 | H205: 10784 | I205: 34.8 | J205: 30 | K205: 0.15 | L205: =RC[-2]*RC[-3] -> 1044 | M205: =RC[-2]*RC[-1] -> 156.6 | N205: =RC[-2]-RC[-1] -> 887.4
A206: 'MEREP | B206: 'Mère Paillarde | C206: 7 | D206: 'Pavlova, Ltd. | E206: 6 | F206: 'Meat/Poultry | G206: 17 | H206: 10339 | I206: 31.2 | J206: 70 | K206: 0.05 | L206: =RC[-2]*RC[-3] -> 2184 | M206: =RC[-2]*RC[-1] -> 109.2 | N206: =RC[-2]-RC[-1] -> 2074.8
A207: 'MORGK | B207: 'Morgenstern Gesundkost | C207: 23 | D207: 'Karkki Oy | E207: 1 | F207: 'Beverages | G207: 76 | H207: 10575 | I207: 18 | J207: 10 | K207: 0 | L207: =RC[-2]*RC[-3] -> 180 | M207: =RC[-2]*RC[-1] -> 0 | N207: =RC[-2]-RC[-1] -> 180
A208: 'OLDWO | B208: 'Old World Delicatessen | C208: 20 | D208: 'Leka Trading | E208: 5 | F208: 'Grains/Cereals | G208: 42 | H208: 10680 | I208: 14 | J208: 40 | K208: 0.25 | L208: =RC[-2]*RC[-3] -> 560 | M208: =RC[-2]*RC[-1] -> 140 | N208: =RC[-2]-RC[-1] -> 420
A209: 'RICSU | B209: 'Richter Supermarkt | C209: 15 | D209: 'Norske Meierier | E209: 4 | F209: 'Dairy Products | G209: 69 | H209: 11033 | I209: 36 | J209: 36 | K209: 0.1 | L209: =RC[-2]*RC[-3] -> 1296 | M209: =RC[-2]*RC[-1] -> 129.6 | N209: =RC[-2]-RC[-1] -> 1166.4
A210: 'RICSU | B210: 'Richter Supermarkt | C210: 7 | D210: 'Pavlova, Ltd. | E210: 1 | F210: 'Beverages | G210: 70 | H210: 10758 | I210: 15 | J210: 40 | K210: 0 | L210: =RC[-2]*RC[-3] -> 600 | M210: =RC[-2]*RC[-1] -> 0 | N210: =RC[-2]-RC[-1] -> 600
A211: 'BLONP | B211: 'Blondel père et fils | C211: 19 | D211: 'New England Seafood Cannery | E211: 8 | F211: 'Seafood | G211: 41 | H211: 10559 | I211: 9.65 | J211: 12 | K211: 0.05 | L211: =RC[-2]*RC[-3] -> 115.8 | M211: =RC[-2]*RC[-1] -> 5.79 | N211: =RC[-2]-RC[-1] -> 110.01
A212: 'ISLAT | B212: 'Island Trading | C212: 15 | D212: 'Norske Meierier | E212: 4 | F212: 'Dairy Products | G212: 71 | H212: 10473 | I212: 17.2 | J212: 12 | K212: 0 | L212: =RC[-2]*RC[-3] -> 206.4 | M212: =RC[-2]*RC[-1] -> 0 | N212: =RC[-2]-RC[-1] -> 206.4
A213: 'SUPRD | B213: 'Suprêmes délices | C213: 4 | D213: 'Tokyo Traders | E213: 7 | F213: 'Produce | G213: 74 | H213: 10846 | I213: 10 | J213: 20 | K213: 0 | L213: =RC[-2]*RC[-3] -> 200 | M213: =RC[-2]*RC[-1] -> 0 | N213: =RC[-2]-RC[-1] -> 200
A214: 'LINOD | B214: 'LINO-Delicateses | C214: 7 | D214: 'Pavlova, Ltd. | E214: 8 | F214: 'Seafood | G214: 18 | H214: 10838 | I214: 62.5 | J214: 25 | K214: 0.25 | L214: =RC[-2]*RC[-3] -> 1562.5 | M214: =RC[-2]*RC[-1] -> 390.625 | N214: =RC[-2]-RC[-1] -> 1171.875
A215: 'GREAL | B215: 'Great Lakes Food Market | C215: 22 | D215: 'Zaanse Snoepfabriek | E215: 3 | F215: 'Confections | G215: 47 | H215: 10656 | I215: 9.5 | J215: 6 | K215: 0.1 | L215: =RC[-2]*RC[-3] -> 57 | M215: =RC[-2]*RC[-1] -> 5.7 | N215: =RC[-2]-RC[-1] -> 51.3
A216: 'GOURL | B216: 'Gourmet Lanchonetes | C216: 23 | D216: 'Karkki Oy | E216: 1 | F216: 'Beverages | G216: 76 | H216: 10734 | I216: 18 | J216: 20 | K216: 0 | L216: =RC[-2]*RC[-3] -> 360 | M216: =RC[-2]*RC[-1] -> 0 | N216: =RC[-2]-RC[-1] -> 360
A217: 'FRANR | B217: 'France restauration | C217: 29 | D217: 'Forêts d'érables | E217: 3 | F217: 'Confections | G217: 62 | H217: 10671 | I217: 49.3 | J217: 10 | K217: 0 | L217: =RC[-2]*RC[-3] -> 493 | M217: =RC[-2]*RC[-1] -> 0 | N217: =RC[-2]-RC[-1] -> 493
A218: 'RATTC | B218: 'Rattlesnake Canyon Grocery | C218: 2 | D218: 'New Orleans Cajun Delights | E218: 2 | F218: 'Condiments | G218: 65 | H218: 10401 | I218: 16.8 | J218: 20 | K218: 0 | L218: =RC[-2]*RC[-3] -> 336 | M218: =RC[-2]*RC[-1] -> 0 | N218: =RC[-2]-RC[-1] -> 336
A219: 'SUPRD | B219: 'Suprêmes délices | C219: 2 | D219: 'New Orleans Cajun Delights | E219: 2 | F219: 'Condiments | G219: 66 | H219: 10475 | I219: 13.6 | J219: 60 | K219: 0.15 | L219: =RC[-2]*RC[-3] -> 816 | M219: =RC[-2]*RC[-1] -> 122.4 | N219: =RC[-2]-RC[-1] -> 693.6
A220: 'MEREP | B220: 'Mère Paillarde | C220: 22 | D220: 'Zaanse Snoepfabriek | E220: 3 | F220: 'Confections | G220: 47 | H220: 10332 | I220: 7.6 | J220: 16 | K220: 0.2 | L220: =RC[-2]*RC[-3] -> 121.6 | M220: =RC[-2]*RC[-1] -> 24.32 | N220: =RC[-2]-RC[-1] -> 97.28
A221: 'LAMAI | B221: 'La maison d'Asie | C221: 2 | D221: 'New Orleans Cajun Delights | E221: 2 | F221: 'Condiments | G221: 65 | H221: 10493 | I221: 16.8 | J221: 15 | K221: 0.1 | L221: =RC[-2]*RC[-3] -> 252 | M221: =RC[-2]*RC[-1] -> 25.2 | N221: =RC[-2]-RC[-1] -> 226.8
A222: 'RICAR | B222: 'Ricardo Adocicados | C222: 8 | D222: 'Specialty Biscuits, Ltd. | E222: 3 | F222: 'Confections | G222: 19 | H222: 10299 | I222: 7.3 | J222: 15 | K222: 0 | L222: =RC[-2]*RC[-3] -> 109.5 | M222: =RC[-2]*RC[-1] -> 0 | N222: =RC[-2]-RC[-1] -> 109.5
A223: 'SAVEA | B223: 'Save-a-lot Markets | C223: 21 | D223: 'Lyngbysild | E223: 8 | F223: 'Seafood | G223: 46 | H223: 10657 | I223: 12 | J223: 45 | K223: 0 | L223: =RC[-2]*RC[-3] -> 540 | M223: =RC[-2]*RC[-1] -> 0 | N223: =RC[-2]-RC[-1] -> 540
A224: 'VAFFE | B224: 'Vaffeljernet | C224: 19 | D224: 'New England Seafood Cannery | E224: 8 | F224: 'Seafood | G224: 40 | H224: 10744 | I224: 18.4 | J224: 50 | K224: 0.2 | L224: =RC[-2]*RC[-3] -> 920 | M224: =RC[-2]*RC[-1] -> 184 | N224: =RC[-2]-RC[-1] -> 736
A225: 'BSBEV | B225: 'B's Beverages | C225: 16 | D225: 'Bigfoot Breweries | E225: 1 | F225: 'Beverages | G225: 35 | H225: 10578 | I225: 18 | J225: 20 | K225: 0 | L225: =RC[-2]*RC[-3] -> 360 | M225: =RC[-2]*RC[-1] -> 0 | N225: =RC[-2]-RC[-1] -> 360
A226: 'BERGS | B226: 'Berglunds snabbköp | C226: 18 | D226: 'Aux joyeux ecclésiastiques | E226: 1 | F226: 'Beverages | G226: 39 | H226: 10654 | I226: 18 | J226: 20 | K226: 0.1 | L226: =RC[-2]*RC[-3] -> 360 | M226: =RC[-2]*RC[-1] -> 36 | N226: =RC[-2]-RC[-1] -> 324
A227: 'QUICK | B227: 'QUICK-Stop | C227: 16 | D227: 'Bigfoot Breweries | E227: 1 | F227: 'Beverages | G227: 35 | H227: 10845 | I227: 18 | J227: 25 | K227: 0.1 | L227: =RC[-2]*RC[-3] -> 450 | M227: =RC[-2]*RC[-1] -> 45 | N227: =RC[-2]-RC[-1] -> 405
A228: 'MORGK | B228: 'Morgenstern Gesundkost | C228: 28 | D228: 'Gai pâturage | E228: 4 | F228: 'Dairy Products | G228: 59 | H228: 10575 | I228: 55 | J228: 12 | K228: 0 | L228: =RC[-2]*RC[-3] -> 660 | M228: =RC[-2]*RC[-1] -> 0 | N228: =RC[-2]-RC[-1] -> 660
A229: 'RATTC | B229: 'Rattlesnake Canyon Grocery | C229: 12 | D229: 'Plutzer Lebensmittelgroßmärkte AG | E229: 5 | F229: 'Grains/Cereals | G229: 64 | H229: 10479 | I229: 26.6 | J229: 30 | K229: 0 | L229: =RC[-2]*RC[-3] -> 798 | M229: =RC[-2]*RC[-1] -> 0 | N229: =RC[-2]-RC[-1] -> 798
A230: 'ERNSH | B230: 'Ernst Handel | C230: 8 | D230: 'Specialty Biscuits, Ltd. | E230: 3 | F230: 'Confections | G230: 21 | H230: 10368 | I230: 8 | J230: 5 | K230: 0.1 | L230: =RC[-2]*RC[-3] -> 40 | M230: =RC[-2]*RC[-1] -> 4 | N230: =RC[-2]-RC[-1] -> 36
A231: 'HUNGO | B231: 'Hungry Owl All-Night Grocers | C231: 26 | D231: 'Pasta Buttini s.r.l. | E231: 5 | F231: 'Grains/Cereals | G231: 56 | H231: 10712 | I231: 38 | J231: 30 | K231: 0 | L231: =RC[-2]*RC[-3] -> 1140 | M231: =RC[-2]*RC[-1] -> 0 | N231: =RC[-2]-RC[-1] -> 1140
A232: 'THECR | B232: 'The Cracker Box | C232: 19 | D232: 'New England Seafood Cannery | E232: 8 | F232: 'Seafood | G232: 40 | H232: 11003 | I232: 18.4 | J232: 10 | K232: 0 | L232: =RC[-2]*RC[-3] -> 184 | M232: =RC[-2]*RC[-1] -> 0 | N232: =RC[-2]-RC[-1] -> 184
A233: 'ERNSH | B233: 'Ernst Handel | C233: 3 | D233: 'Grandma Kelly's Homestead | E233: 7 | F233: 'Produce | G233: 7 | H233: 10979 | I233: 30 | J233: 18 | K233: 0 | L233: =RC[-2]*RC[-3] -> 540 | M233: =RC[-2]*RC[-1] -> 0 | N233: =RC[-2]-RC[-1] -> 540
A234: 'BLONP | B234: 'Blondel père et fils | C234: 18 | D234: 'Aux joyeux ecclésiastiques | E234: 1 | F234: 'Beverages | G234: 38 | H234: 10360 | I234: 210.8 | J234: 10 | K234: 0 | L234: =RC[-2]*RC[-3] -> 2108 | M234: =RC[-2]*RC[-1] -> 0 | N234: =RC[-2]-RC[-1] -> 2108
A235: 'WARTH | B235: 'Wartian Herkku | C235: 2 | D235: 'New Orleans Cajun Delights | E235: 2 | F235: 'Condiments | G235: 4 | H235: 10636 | I235: 22 | J235: 25 | K235: 0 | L235: =RC[-2]*RC[-3] -> 550 | M235: =RC[-2]*RC[-1] -> 0 | N235: =RC[-2]-RC[-1] -> 550
A236: 'SEVES | B236: 'Seven Seas Imports | C236: 28 | D236: 'Gai pâturage | E236: 4 | F236: 'Dairy Products | G236: 60 | H236: 10359 | I236: 27.2 | J236: 80 | K236: 0.05 | L236: =RC[-2]*RC[-3] -> 2176 | M236: =RC[-2]*RC[-1] -> 108.8 | N236: =RC[-2]-RC[-1] -> 2067.2
A237: 'RICAR | B237: 'Ricardo Adocicados | C237: 21 | D237: 'Lyngbysild | E237: 8 | F237: 'Seafood | G237: 46 | H237: 10287 | I237: 9.6 | J237: 15 | K237: 0.15 | L237: =RC[-2]*RC[-3] -> 144 | M237: =RC[-2]*RC[-1] -> 21.6 | N237: =RC[-2]-RC[-1] -> 122.4
A238: 'BOTTM | B238: 'Bottom-Dollar Markets | C238: 4 | D238: 'Tokyo Traders | E238: 8 | F238: 'Seafood | G238: 10 | H238: 10389 | I238: 24.8 | J238: 16 | K238: 0 | L238: =RC[-2]*RC[-3] -> 396.8 | M238: =RC[-2]*RC[-1] -> 0 | N238: =RC[-2]-RC[-1] -> 396.8
A239: 'LEHMS | B239: 'Lehmanns Marktstand | C239: 3 | D239: 'Grandma Kelly's Homestead | E239: 2 | F239: 'Condiments | G239: 8 | H239: 10522 | I239: 40 | J239: 24 | K239: 0 | L239: =RC[-2]*RC[-3] -> 960 | M239: =RC[-2]*RC[-1] -> 0 | N239: =RC[-2]-RC[-1] -> 960
A240: 'LEHMS | B240: 'Lehmanns Marktstand | C240: 5 | D240: 'Cooperativa de Quesos 'Las Cabras' | E240: 4 | F240: 'Dairy Products | G240: 12 | H240: 10536 | I240: 38 | J240: 15 | K240: 0.25 | L240: =RC[-2]*RC[-3] -> 570 | M240: =RC[-2]*RC[-1] -> 142.5 | N240: =RC[-2]-RC[-1] -> 427.5
A241: 'LINOD | B241: 'LINO-Delicateses | C241: 23 | D241: 'Karkki Oy | E241: 3 | F241: 'Confections | G241: 50 | H241: 10729 | I241: 16.25 | J241: 40 | K241: 0 | L241: =RC[-2]*RC[-3] -> 650 | M241: =RC[-2]*RC[-1] -> 0 | N241: =RC[-2]-RC[-1] -> 650
A242: 'WANDK | B242: 'Die Wandernde Kuh | C242: 24 | D242: 'G'day, Mate | E242: 6 | F242: 'Meat/Poultry | G242: 53 | H242: 10312 | I242: 26.2 | J242: 20 | K242: 0 | L242: =RC[-2]*RC[-3] -> 524 | M242: =RC[-2]*RC[-1] -> 0 | N242: =RC[-2]-RC[-1] -> 524
A243: 'BOTTM | B243: 'Bottom-Dollar Markets | C243: 7 | D243: 'Pavlova, Ltd. | E243: 1 | F243: 'Beverages | G243: 70 | H243: 10389 | I243: 12 | J243: 30 | K243: 0 | L243: =RC[-2]*RC[-3] -> 360 | M243: =RC[-2]*RC[-1] -> 0 | N243: =RC[-2]-RC[-1] -> 360
A244: 'ERNSH | B244: 'Ernst Handel | C244: 24 | D244: 'G'day, Mate | E244: 7 | F244: 'Produce | G244: 51 | H244: 10776 | I244: 53 | J244: 120 | K244: 0.05 | L244: =RC[-2]*RC[-3] -> 6360 | M244: =RC[-2]*RC[-1] -> 318 | N244: =RC[-2]-RC[-1] -> 6042
A245: 'LAUGB | B245: 'Laughing Bacchus Wine Cellars | C245: 24 | D245: 'G'day, Mate | E245: 5 | F245: 'Grains/Cereals | G245: 52 | H245: 10620 | I245: 7 | J245: 5 | K245: 0 | L245: =RC[-2]*RC[-3] -> 35 | M245: =RC[-2]*RC[-1] -> 0 | N245: =RC[-2]-RC[-1] -> 35
A246: 'WANDK | B246: 'Die Wandernde Kuh | C246: 14 | D246: 'Formaggi Fortini s.r.l. | E246: 4 | F246: 'Dairy Products | G246: 32 | H246: 10513 | I246: 32 | J246: 50 | K246: 0.2 | L246: =RC[-2]*RC[-3] -> 1600 | M246: =RC[-2]*RC[-1] -> 320 | N246: =RC[-2]-RC[-1] -> 1280
A247: 'ERNSH | B247: 'Ernst Handel | C247: 15 | D247: 'Norske Meierier | E247: 4 | F247: 'Dairy Products | G247: 71 | H247: 10771 | I247: 21.5 | J247: 16 | K247: 0 | L247: =RC[-2]*RC[-3] -> 344 | M247: =RC[-2]*RC[-1] -> 0 | N247: =RC[-2]-RC[-1] -> 344
A248: 'DUMON | B248: 'Du monde entier | C248: 4 | D248: 'Tokyo Traders | E248: 8 | F248: 'Seafood | G248: 10 | H248: 10609 | I248: 31 | J248: 10 | K248: 0 | L248: =RC[-2]*RC[-3] -> 310 | M248: =RC[-2]*RC[-1] -> 0 | N248: =RC[-2]-RC[-1] -> 310
A249: 'BONAP | B249: 'Bon app' | C249: 29 | D249: 'Forêts d'érables | E249: 3 | F249: 'Confections | G249: 62 | H249: 10932 | I249: 49.3 | J249: 14 | K249: 0.1 | L249: =RC[-2]*RC[-3] -> 690.2 | M249: =RC[-2]*RC[-1] -> 69.02 | N249: =RC[-2]-RC[-1] -> 621.18
A250: 'FAMIA | B250: 'Familia Arquibaldo | C250: 25 | D250: 'Ma Maison | E250: 6 | F250: 'Meat/Poultry | G250: 55 | H250: 10725 | I250: 24 | J250: 6 | K250: 0 | L250: =RC[-2]*RC[-3] -> 144 | M250: =RC[-2]*RC[-1] -> 0 | N250: =RC[-2]-RC[-1] -> 144
A251: 'ERNSH | B251: 'Ernst Handel | C251: 2 | D251: 'New Orleans Cajun Delights | E251: 2 | F251: 'Condiments | G251: 5 | H251: 10382 | I251: 17 | J251: 32 | K251: 0 | L251: =RC[-2]*RC[-3] -> 544 | M251: =RC[-2]*RC[-1] -> 0 | N251: =RC[-2]-RC[-1] -> 544
A252: 'HUNGO | B252: 'Hungry Owl All-Night Grocers | C252: 12 | D252: 'Plutzer Lebensmittelgroßmärkte AG | E252: 6 | F252: 'Meat/Poultry | G252: 29 | H252: 10687 | I252: 123.79 | J252: 10 | K252: 0 | L252: =RC[-2]*RC[-3] -> 1237.9 | M252: =RC[-2]*RC[-1] -> 0 | N252: =RC[-2]-RC[-1] -> 1237.9
A253: 'GOURL | B253: 'Gourmet Lanchonetes | C253: 3 | D253: 'Grandma Kelly's Homestead | E253: 2 | F253: 'Condiments | G253: 6 | H253: 10734 | I253: 25 | J253: 30 | K253: 0 | L253: =RC[-2]*RC[-3] -> 750 | M253: =RC[-2]*RC[-1] -> 0 | N253: =RC[-2]-RC[-1] -> 750
A254: 'FRANK | B254: 'Frankenversand | C254: 14 | D254: 'Formaggi Fortini s.r.l. | E254: 4 | F254: 'Dairy Products | G254: 72 | H254: 10396 | I254: 27.8 | J254: 21 | K254: 0 | L254: =RC[-2]*RC[-3] -> 583.8 | M254: =RC[-2]*RC[-1] -> 0 | N254: =RC[-2]-RC[-1] -> 583.8
A255: 'QUEDE | B255: 'Que Delícia | C255: 19 | D255: 'New England Seafood Cannery | E255: 8 | F255: 'Seafood | G255: 41 | H255: 10379 | I255: 7.7 | J255: 8 | K255: 0.1 | L255: =RC[-2]*RC[-3] -> 61.6 | M255: =RC[-2]*RC[-1] -> 6.16 | N255: =RC[-2]-RC[-1] -> 55.44
A256: 'HANAR | B256: 'Hanari Carnes | C256: 15 | D256: 'Norske Meierier | E256: 4 | F256: 'Dairy Products | G256: 71 | H256: 10541 | I256: 21.5 | J256: 9 | K256: 0.1 | L256: =RC[-2]*RC[-3] -> 193.5 | M256: =RC[-2]*RC[-1] -> 19.35 | N256: =RC[-2]-RC[-1] -> 174.15
A257: 'SAVEA | B257: 'Save-a-lot Markets | C257: 20 | D257: 'Leka Trading | E257: 5 | F257: 'Grains/Cereals | G257: 42 | H257: 11002 | I257: 14 | J257: 24 | K257: 0.15 | L257: =RC[-2]*RC[-3] -> 336 | M257: =RC[-2]*RC[-1] -> 50.4 | N257: =RC[-2]-RC[-1] -> 285.6
A258: 'HANAR | B258: 'Hanari Carnes | C258: 14 | D258: 'Formaggi Fortini s.r.l. | E258: 4 | F258: 'Dairy Products | G258: 31 | H258: 10886 | I258: 12.5 | J258: 35 | K258: 0 | L258: =RC[-2]*RC[-3] -> 437.5 | M258: =RC[-2]*RC[-1] -> 0 | N258: =RC[-2]-RC[-1] -> 437.5
A259: 'LEHMS | B259: 'Lehmanns Marktstand | C259: 28 | D259: 'Gai pâturage | E259: 4 | F259: 'Dairy Products | G259: 59 | H259: 10772 | I259: 55 | J259: 25 | K259: 0 | L259: =RC[-2]*RC[-3] -> 1375 | M259: =RC[-2]*RC[-1] -> 0 | N259: =RC[-2]-RC[-1] -> 1375
A260: 'FURIB | B260: 'Furia Bacalhau e Frutos do Mar | C260: 25 | D260: 'Ma Maison | E260: 6 | F260: 'Meat/Poultry | G260: 54 | H260: 10352 | I260: 5.9 | J260: 20 | K260: 0.15 | L260: =RC[-2]*RC[-3] -> 118 | M260: =RC[-2]*RC[-1] -> 17.7 | N260: =RC[-2]-RC[-1] -> 100.3
A261: 'QUEEN | B261: 'Queen Cozinha | C261: 12 | D261: 'Plutzer Lebensmittelgroßmärkte AG | E261: 2 | F261: 'Condiments | G261: 77 | H261: 11068 | I261: 13 | J261: 28 | K261: 0.15 | L261: =RC[-2]*RC[-3] -> 364 | M261: =RC[-2]*RC[-1] -> 54.6 | N261: =RC[-2]-RC[-1] -> 309.4
A262: 'WELLI | B262: 'Wellington Importadora | C262: 7 | D262: 'Pavlova, Ltd. | E262: 1 | F262: 'Beverages | G262: 70 | H262: 10420 | I262: 12 | J262: 8 | K262: 0.1 | L262: =RC[-2]*RC[-3] -> 96 | M262: =RC[-2]*RC[-1] -> 9.6 | N262: =RC[-2]-RC[-1] -> 86.4
A263: 'LILAS | B263: 'LILA-Supermercado | C263: 11 | D263: 'Heli Süßwaren GmbH & Co. KG | E263: 3 | F263: 'Confections | G263: 26 | H263: 10330 | I263: 24.9 | J263: 50 | K263: 0.15 | L263: =RC[-2]*RC[-3] -> 1245 | M263: =RC[-2]*RC[-1] -> 186.75 | N263: =RC[-2]-RC[-1] -> 1058.25
A264: 'FOLKO | B264: 'Folk och fä HB | C264: 25 | D264: 'Ma Maison | E264: 6 | F264: 'Meat/Poultry | G264: 55 | H264: 11001 | I264: 24 | J264: 6 | K264: 0 | L264: =RC[-2]*RC[-3] -> 144 | M264: =RC[-2]*RC[-1] -> 0 | N264: =RC[-2]-RC[-1] -> 144
A265: 'RICAR | B265: 'Ricardo Adocicados | C265: 2 | D265: 'New Orleans Cajun Delights | E265: 2 | F265: 'Condiments | G265: 65 | H265: 10447 | I265: 16.8 | J265: 35 | K265: 0 | L265: =RC[-2]*RC[-3] -> 588 | M265: =RC[-2]*RC[-1] -> 0 | N265: =RC[-2]-RC[-1] -> 588
A266: 'SPLIR | B266: 'Split Rail Beer & Ale | C266: 16 | D266: 'Bigfoot Breweries | E266: 1 | F266: 'Beverages | G266: 35 | H266: 10821 | I266: 18 | J266: 20 | K266: 0 | L266: =RC[-2]*RC[-3] -> 360 | M266: =RC[-2]*RC[-1] -> 0 | N266: =RC[-2]-RC[-1] -> 360
A267: 'ERNSH | B267: 'Ernst Handel | C267: 28 | D267: 'Gai pâturage | E267: 4 | F267: 'Dairy Products | G267: 59 | H267: 10430 | I267: 44 | J267: 70 | K267: 0.2 | L267: =RC[-2]*RC[-3] -> 3080 | M267: =RC[-2]*RC[-1] -> 616 | N267: =RC[-2]-RC[-1] -> 2464
A268: 'CHOPS | B268: 'Chop-suey Chinese | C268: 28 | D268: 'Gai pâturage | E268: 4 | F268: 'Dairy Products | G268: 60 | H268: 10519 | I268: 34 | J268: 10 | K268: 0.05 | L268: =RC[-2]*RC[-3] -> 340 | M268: =RC[-2]*RC[-1] -> 17 | N268: =RC[-2]-RC[-1] -> 323
A269: 'OTTIK | B269: 'Ottilies Käseladen | C269: 29 | D269: 'Forêts d'érables | E269: 3 | F269: 'Confections | G269: 62 | H269: 10554 | I269: 49.3 | J269: 20 | K269: 0.05 | L269: =RC[-2]*RC[-3] -> 986 | M269: =RC[-2]*RC[-1] -> 49.3 | N269: =RC[-2]-RC[-1] -> 936.7
A270: 'LAMAI | B270: 'La maison d'Asie | C270: 1 | D270: 'Exotic Liquids | E270: 1 | F270: 'Beverages | G270: 2 | H270: 10787 | I270: 19 | J270: 15 | K270: 0.05 | L270: =RC[-2]*RC[-3] -> 285 | M270: =RC[-2]*RC[-1] -> 14.25 | N270: =RC[-2]-RC[-1] -> 270.75
A271: 'WARTH | B271: 'Wartian Herkku | C271: 1 | D271: 'Exotic Liquids | E271: 1 | F271: 'Beverages | G271: 1 | H271: 11025 | I271: 18 | J271: 10 | K271: 0.1 | L271: =RC[-2]*RC[-3] -> 180 | M271: =RC[-2]*RC[-1] -> 18 | N271: =RC[-2]-RC[-1] -> 162
A272: 'QUICK | B272: 'QUICK-Stop | C272: 29 | D272: 'Forêts d'érables | E272: 3 | F272: 'Confections | G272: 62 | H272: 10691 | I272: 49.3 | J272: 48 | K272: 0 | L272: =RC[-2]*RC[-3] -> 2366.4 | M272: =RC[-2]*RC[-1] -> 0 | N272: =RC[-2]-RC[-1] -> 2366.4
A273: 'QUICK | B273: 'QUICK-Stop | C273: 1 | D273: 'Exotic Liquids | E273: 1 | F273: 'Beverages | G273: 2 | H273: 10991 | I273: 19 | J273: 50 | K273: 0.2 | L273: =RC[-2]*RC[-3] -> 950 | M273: =RC[-2]*RC[-1] -> 190 | N273: =RC[-2]-RC[-1] -> 760
A274: 'FAMIA | B274: 'Familia Arquibaldo | C274: 25 | D274: 'Ma Maison | E274: 6 | F274: 'Meat/Poultry | G274: 54 | H274: 10650 | I274: 7.45 | J274: 30 | K274: 0 | L274: =RC[-2]*RC[-3] -> 223.5 | M274: =RC[-2]*RC[-1] -> 0 | N274: =RC[-2]-RC[-1] -> 223.5
A275: 'PERIC | B275: 'Pericles Comidas clásicas | C275: 12 | D275: 'Plutzer Lebensmittelgroßmärkte AG | E275: 7 | F275: 'Produce | G275: 28 | H275: 10474 | I275: 36.4 | J275: 18 | K275: 0 | L275: =RC[-2]*RC[-3] -> 655.2 | M275: =RC[-2]*RC[-1] -> 0 | N275: =RC[-2]-RC[-1] -> 655.2
A276: 'WHITC | B276: 'White Clover Markets | C276: 20 | D276: 'Leka Trading | E276: 2 | F276: 'Condiments | G276: 44 | H276: 10469 | I276: 15.5 | J276: 2 | K276: 0.15 | L276: =RC[-2]*RC[-3] -> 31 | M276: =RC[-2]*RC[-1] -> 4.65 | N276: =RC[-2]-RC[-1] -> 26.35
A277: 'SANTG | B277: 'Santé Gourmet | C277: 28 | D277: 'Gai pâturage | E277: 4 | F277: 'Dairy Products | G277: 59 | H277: 10387 | I277: 44 | J277: 12 | K277: 0 | L277: =RC[-2]*RC[-3] -> 528 | M277: =RC[-2]*RC[-1] -> 0 | N277: =RC[-2]-RC[-1] -> 528
A278: 'SPLIR | B278: 'Split Rail Beer & Ale | C278: 26 | D278: 'Pasta Buttini s.r.l. | E278: 5 | F278: 'Grains/Cereals | G278: 56 | H278: 10369 | I278: 30.4 | J278: 18 | K278: 0.25 | L278: =RC[-2]*RC[-3] -> 547.2 | M278: =RC[-2]*RC[-1] -> 136.8 | N278: =RC[-2]-RC[-1] -> 410.4
A279: 'VAFFE | B279: 'Vaffeljernet | C279: 16 | D279: 'Bigfoot Breweries | E279: 1 | F279: 'Beverages | G279: 34 | H279: 10367 | I279: 11.2 | J279: 36 | K279: 0 | L279: =RC[-2]*RC[-3] -> 403.2 | M279: =RC[-2]*RC[-1] -> 0 | N279: =RC[-2]-RC[-1] -> 403.2
A280: 'TORTU | B280: 'Tortuga Restaurante | C280: 7 | D280: 'Pavlova, Ltd. | E280: 6 | F280: 'Meat/Poultry | G280: 17 | H280: 10915 | I280: 39 | J280: 10 | K280: 0 | L280: =RC[-2]*RC[-3] -> 390 | M280: =RC[-2]*RC[-1] -> 0 | N280: =RC[-2]-RC[-1] -> 390
A281: 'PERIC | B281: 'Pericles Comidas clásicas | C281: 5 | D281: 'Cooperativa de Quesos 'Las Cabras' | E281: 4 | F281: 'Dairy Products | G281: 11 | H281: 11073 | I281: 21 | J281: 10 | K281: 0 | L281: =RC[-2]*RC[-3] -> 210 | M281: =RC[-2]*RC[-1] -> 0 | N281: =RC[-2]-RC[-1] -> 210
A282: 'ERNSH | B282: 'Ernst Handel | C282: 6 | D282: 'Mayumi's | E282: 8 | F282: 'Seafood | G282: 13 | H282: 10633 | I282: 6 | J282: 13 | K282: 0.15 | L282: =RC[-2]*RC[-3] -> 78 | M282: =RC[-2]*RC[-1] -> 11.7 | N282: =RC[-2]-RC[-1] -> 66.3
A283: 'OTTIK | B283: 'Ottilies Käseladen | C283: 24 | D283: 'G'day, Mate | E283: 6 | F283: 'Meat/Poultry | G283: 53 | H283: 10833 | I283: 32.8 | J283: 9 | K283: 0.1 | L283: =RC[-2]*RC[-3] -> 295.2 | M283: =RC[-2]*RC[-1] -> 29.52 | N283: =RC[-2]-RC[-1] -> 265.68
A284: 'AROUT | B284: 'Around the Horn | C284: 23 | D284: 'Karkki Oy | E284: 3 | F284: 'Confections | G284: 50 | H284: 10920 | I284: 16.25 | J284: 24 | K284: 0 | L284: =RC[-2]*RC[-3] -> 390 | M284: =RC[-2]*RC[-1] -> 0 | N284: =RC[-2]-RC[-1] -> 390
A285: 'ROMEY | B285: 'Romero y tomillo | C285: 9 | D285: 'PB Knäckebröd AB | E285: 5 | F285: 'Grains/Cereals | G285: 23 | H285: 11013 | I285: 9 | J285: 10 | K285: 0 | L285: =RC[-2]*RC[-3] -> 90 | M285: =RC[-2]*RC[-1] -> 0 | N285: =RC[-2]-RC[-1] -> 90
A286: 'ERNSH | B286: 'Ernst Handel | C286: 7 | D286: 'Pavlova, Ltd. | E286: 2 | F286: 'Condiments | G286: 63 | H286: 10979 | I286: 43.9 | J286: 35 | K286: 0 | L286: =RC[-2]*RC[-3] -> 1536.5 | M286: =RC[-2]*RC[-1] -> 0 | N286: =RC[-2]-RC[-1] -> 1536.5
A287: 'ANTON | B287: 'Antonio Moreno Taquería | C287: 24 | D287: 'G'day, Mate | E287: 6 | F287: 'Meat/Poultry | G287: 53 | H287: 10573 | I287: 32.8 | J287: 25 | K287: 0 | L287: =RC[-2]*RC[-3] -> 820 | M287: =RC[-2]*RC[-1] -> 0 | N287: =RC[-2]-RC[-1] -> 820
A288: 'FAMIA | B288: 'Familia Arquibaldo | C288: 13 | D288: 'Nord-Ost-Fisch Handelsgesellschaft mbH | E288: 8 | F288: 'Seafood | G288: 30 | H288: 10650 | I288: 25.89 | J288: 30 | K288: 0 | L288: =RC[-2]*RC[-3] -> 776.7 | M288: =RC[-2]*RC[-1] -> 0 | N288: =RC[-2]-RC[-1] -> 776.7
A289: 'RATTC | B289: 'Rattlesnake Canyon Grocery | C289: 11 | D289: 'Heli Süßwaren GmbH & Co. KG | E289: 3 | F289: 'Confections | G289: 27 | H289: 10598 | I289: 43.9 | J289: 50 | K289: 0 | L289: =RC[-2]*RC[-3] -> 2195 | M289: =RC[-2]*RC[-1] -> 0 | N289: =RC[-2]-RC[-1] -> 2195
A290: 'LEHMS | B290: 'Lehmanns Marktstand | C290: 7 | D290: 'Pavlova, Ltd. | E290: 3 | F290: 'Confections | G290: 16 | H290: 11070 | I290: 17.45 | J290: 30 | K290: 0.15 | L290: =RC[-2]*RC[-3] -> 523.5 | M290: =RC[-2]*RC[-1] -> 78.525 | N290: =RC[-2]-RC[-1] -> 444.975
A291: 'CENTC | B291: 'Centro comercial Moctezuma | C291: 8 | D291: 'Specialty Biscuits, Ltd. | E291: 3 | F291: 'Confections | G291: 21 | H291: 10259 | I291: 8 | J291: 10 | K291: 0 | L291: =RC[-2]*RC[-3] -> 80 | M291: =RC[-2]*RC[-1] -> 0 | N291: =RC[-2]-RC[-1] -> 80
A292: 'BOTTM | B292: 'Bottom-Dollar Markets | C292: 3 | D292: 'Grandma Kelly's Homestead | E292: 2 | F292: 'Condiments | G292: 6 | H292: 10949 | I292: 25 | J292: 12 | K292: 0 | L292: =RC[-2]*RC[-3] -> 300 | M292: =RC[-2]*RC[-1] -> 0 | N292: =RC[-2]-RC[-1] -> 300
A293: 'MORGK | B293: 'Morgenstern Gesundkost | C293: 14 | D293: 'Formaggi Fortini s.r.l. | E293: 4 | F293: 'Dairy Products | G293: 72 | H293: 10575 | I293: 34.8 | J293: 30 | K293: 0 | L293: =RC[-2]*RC[-3] -> 1044 | M293: =RC[-2]*RC[-1] -> 0 | N293: =RC[-2]-RC[-1] -> 1044
A294: 'SAVEA | B294: 'Save-a-lot Markets | C294: 15 | D294: 'Norske Meierier | E294: 4 | F294: 'Dairy Products | G294: 33 | H294: 10607 | I294: 2.5 | J294: 14 | K294: 0 | L294: =RC[-2]*RC[-3] -> 35 | M294: =RC[-2]*RC[-1] -> 0 | N294: =RC[-2]-RC[-1] -> 35
A295: 'AROUT | B295: 'Around the Horn | C295: 23 | D295: 'Karkki Oy | E295: 3 | F295: 'Confections | G295: 50 | H295: 10383 | I295: 13 | J295: 15 | K295: 0 | L295: =RC[-2]*RC[-3] -> 195 | M295: =RC[-2]*RC[-1] -> 0 | N295: =RC[-2]-RC[-1] -> 195
A296: 'RATTC | B296: 'Rattlesnake Canyon Grocery | C296: 12 | D296: 'Plutzer Lebensmittelgroßmärkte AG | E296: 1 | F296: 'Beverages | G296: 75 | H296: 10294 | I296: 6.2 | J296: 6 | K296: 0 | L296: =RC[-2]*RC[-3] -> 37.2 | M296: =RC[-2]*RC[-1] -> 0 | N296: =RC[-2]-RC[-1] -> 37.2
A297: 'SEVES | B297: 'Seven Seas Imports | C297: 21 | D297: 'Lyngbysild | E297: 8 | F297: 'Seafood | G297: 45 | H297: 10388 | I297: 7.6 | J297: 15 | K297: 0.2 | L297: =RC[-2]*RC[-3] -> 114 | M297: =RC[-2]*RC[-1] -> 22.8 | N297: =RC[-2]-RC[-1] -> 91.2
A298: 'THECR | B298: 'The Cracker Box | C298: 4 | D298: 'Tokyo Traders | E298: 8 | F298: 'Seafood | G298: 10 | H298: 10775 | I298: 31 | J298: 6 | K298: 0 | L298: =RC[-2]*RC[-3] -> 186 | M298: =RC[-2]*RC[-1] -> 0 | N298: =RC[-2]-RC[-1] -> 186
A299: 'HUNGO | B299: 'Hungry Owl All-Night Grocers | C299: 27 | D299: 'Escargots Nouveaux | E299: 8 | F299: 'Seafood | G299: 58 | H299: 10661 | I299: 13.25 | J299: 49 | K299: 0.2 | L299: =RC[-2]*RC[-3] -> 649.25 | M299: =RC[-2]*RC[-1] -> 129.85 | N299: =RC[-2]-RC[-1] -> 519.4
A300: 'TOMSP | B300: 'Toms Spezialitäten | C300: 8 | D300: 'Specialty Biscuits, Ltd. | E300: 3 | F300: 'Confections | G300: 19 | H300: 10967 | I300: 9.2 | J300: 12 | K300: 0 | L300: =RC[-2]*RC[-3] -> 110.4 | M300: =RC[-2]*RC[-1] -> 0 | N300: =RC[-2]-RC[-1] -> 110.4
A301: 'ANATR | B301: 'Ana Trujillo Emparedados y helados | C301: 6 | D301: 'Mayumi's | E301: 7 | F301: 'Produce | G301: 14 | H301: 10625 | I301: 23.25 | J301: 3 | K301: 0 | L301: =RC[-2]*RC[-3] -> 69.75 | M301: =RC[-2]*RC[-1] -> 0 | N301: =RC[-2]-RC[-1] -> 69.75
A302: 'ANATR | B302: 'Ana Trujillo Emparedados y helados | C302: 8 | D302: 'Specialty Biscuits, Ltd. | E302: 3 | F302: 'Confections | G302: 19 | H302: 10926 | I302: 9.2 | J302: 7 | K302: 0 | L302: =RC[-2]*RC[-3] -> 64.4 | M302: =RC[-2]*RC[-1] -> 0 | N302: =RC[-2]-RC[-1] -> 64.4
A303: 'ANATR | B303: 'Ana Trujillo Emparedados y helados | C303: 15 | D303: 'Norske Meierier | E303: 4 | F303: 'Dairy Products | G303: 69 | H303: 10308 | I303: 28.8 | J303: 1 | K303: 0 | L303: =RC[-2]*RC[-3] -> 28.8 | M303: =RC[-2]*RC[-1] -> 0 | N303: =RC[-2]-RC[-1] -> 28.8
A304: 'ANATR | B304: 'Ana Trujillo Emparedados y helados | C304: 20 | D304: 'Leka Trading | E304: 5 | F304: 'Grains/Cereals | G304: 42 | H304: 10625 | I304: 14 | J304: 5 | K304: 0 | L304: =RC[-2]*RC[-3] -> 70 | M304: =RC[-2]*RC[-1] -> 0 | N304: =RC[-2]-RC[-1] -> 70
A305: 'ANATR | B305: 'Ana Trujillo Emparedados y helados | C305: 14 | D305: 'Formaggi Fortini s.r.l. | E305: 4 | F305: 'Dairy Products | G305: 32 | H305: 10759 | I305: 32 | J305: 10 | K305: 0 | L305: =RC[-2]*RC[-3] -> 320 | M305: =RC[-2]*RC[-1] -> 0 | N305: =RC[-2]-RC[-1] -> 320
A306: 'ANATR | B306: 'Ana Trujillo Emparedados y helados | C306: 5 | D306: 'Cooperativa de Quesos 'Las Cabras' | E306: 4 | F306: 'Dairy Products | G306: 11 | H306: 10926 | I306: 21 | J306: 2 | K306: 0 | L306: =RC[-2]*RC[-3] -> 42 | M306: =RC[-2]*RC[-1] -> 0 | N306: =RC[-2]-RC[-1] -> 42
A307: 'ANATR | B307: 'Ana Trujillo Emparedados y helados | C307: 28 | D307: 'Gai pâturage | E307: 4 | F307: 'Dairy Products | G307: 60 | H307: 10625 | I307: 34 | J307: 10 | K307: 0 | L307: =RC[-2]*RC[-3] -> 340 | M307: =RC[-2]*RC[-1] -> 0 | N307: =RC[-2]-RC[-1] -> 340
A308: 'ANATR | B308: 'Ana Trujillo Emparedados y helados | C308: 7 | D308: 'Pavlova, Ltd. | E308: 1 | F308: 'Beverages | G308: 70 | H308: 10308 | I308: 12 | J308: 5 | K308: 0 | L308: =RC[-2]*RC[-3] -> 60 | M308: =RC[-2]*RC[-1] -> 0 | N308: =RC[-2]-RC[-1] -> 60
A309: 'ANATR | B309: 'Ana Trujillo Emparedados y helados | C309: 14 | D309: 'Formaggi Fortini s.r.l. | E309: 4 | F309: 'Dairy Products | G309: 72 | H309: 10926 | I309: 34.8 | J309: 10 | K309: 0 | L309: =RC[-2]*RC[-3] -> 348 | M309: =RC[-2]*RC[-1] -> 0 | N309: =RC[-2]-RC[-1] -> 348
A310: 'ANATR | B310: 'Ana Trujillo Emparedados y helados | C310: 6 | D310: 'Mayumi's | E310: 8 | F310: 'Seafood | G310: 13 | H310: 10926 | I310: 6 | J310: 10 | K310: 0 | L310: =RC[-2]*RC[-3] -> 60 | M310: =RC[-2]*RC[-1] -> 0 | N310: =RC[-2]-RC[-1] -> 60
A311: 'ERNSH | B311: 'Ernst Handel | C311: 7 | D311: 'Pavlova, Ltd. | E311: 3 | F311: 'Confections | G311: 16 | H311: 10263 | I311: 13.9 | J311: 60 | K311: 0.25 | L311: =RC[-2]*RC[-3] -> 834 | M311: =RC[-2]*RC[-1] -> 208.5 | N311: =RC[-2]-RC[-1] -> 625.5
A312: 'ERNSH | B312: 'Ernst Handel | C312: 28 | D312: 'Gai pâturage | E312: 4 | F312: 'Dairy Products | G312: 60 | H312: 10895 | I312: 34 | J312: 100 | K312: 0 | L312: =RC[-2]*RC[-3] -> 3400 | M312: =RC[-2]*RC[-1] -> 0 | N312: =RC[-2]-RC[-1] -> 3400
A313: 'ERNSH | B313: 'Ernst Handel | C313: 6 | D313: 'Mayumi's | E313: 8 | F313: 'Seafood | G313: 13 | H313: 10854 | I313: 6 | J313: 65 | K313: 0.15 | L313: =RC[-2]*RC[-3] -> 390 | M313: =RC[-2]*RC[-1] -> 58.5 | N313: =RC[-2]-RC[-1] -> 331.5
A314: 'ERNSH | B314: 'Ernst Handel | C314: 20 | D314: 'Leka Trading | E314: 2 | F314: 'Condiments | G314: 44 | H314: 10351 | I314: 15.5 | J314: 77 | K314: 0.05 | L314: =RC[-2]*RC[-3] -> 1193.5 | M314: =RC[-2]*RC[-1] -> 59.675 | N314: =RC[-2]-RC[-1] -> 1133.825
A315: 'ERNSH | B315: 'Ernst Handel | C315: 14 | D315: 'Formaggi Fortini s.r.l. | E315: 4 | F315: 'Dairy Products | G315: 31 | H315: 10979 | I315: 12.5 | J315: 24 | K315: 0 | L315: =RC[-2]*RC[-3] -> 300 | M315: =RC[-2]*RC[-1] -> 0 | N315: =RC[-2]-RC[-1] -> 300
A316: 'ERNSH | B316: 'Ernst Handel | C316: 1 | D316: 'Exotic Liquids | E316: 2 | F316: 'Condiments | G316: 3 | H316: 11017 | I316: 10 | J316: 25 | K316: 0 | L316: =RC[-2]*RC[-3] -> 250 | M316: =RC[-2]*RC[-1] -> 0 | N316: =RC[-2]-RC[-1] -> 250
A317: 'ERNSH | B317: 'Ernst Handel | C317: 22 | D317: 'Zaanse Snoepfabriek | E317: 3 | F317: 'Confections | G317: 48 | H317: 10403 | I317: 10.2 | J317: 70 | K317: 0.15 | L317: =RC[-2]*RC[-3] -> 714 | M317: =RC[-2]*RC[-1] -> 107.1 | N317: =RC[-2]-RC[-1] -> 606.9
A318: 'ERNSH | B318: 'Ernst Handel | C318: 5 | D318: 'Cooperativa de Quesos 'Las Cabras' | E318: 4 | F318: 'Dairy Products | G318: 12 | H318: 10633 | I318: 38 | J318: 36 | K318: 0.15 | L318: =RC[-2]*RC[-3] -> 1368 | M318: =RC[-2]*RC[-1] -> 205.2 | N318: =RC[-2]-RC[-1] -> 1162.8
A319: 'ERNSH | B319: 'Ernst Handel | C319: 8 | D319: 'Specialty Biscuits, Ltd. | E319: 3 | F319: 'Confections | G319: 21 | H319: 10430 | I319: 8 | J319: 50 | K319: 0 | L319: =RC[-2]*RC[-3] -> 400 | M319: =RC[-2]*RC[-1] -> 0 | N319: =RC[-2]-RC[-1] -> 400
A320: 'ERNSH | B320: 'Ernst Handel | C320: 20 | D320: 'Leka Trading | E320: 5 | F320: 'Grains/Cereals | G320: 42 | H320: 10776 | I320: 14 | J320: 12 | K320: 0.05 | L320: =RC[-2]*RC[-3] -> 168 | M320: =RC[-2]*RC[-1] -> 8.4 | N320: =RC[-2]-RC[-1] -> 159.6
A321: 'ERNSH | B321: 'Ernst Handel | C321: 12 | D321: 'Plutzer Lebensmittelgroßmärkte AG | E321: 5 | F321: 'Grains/Cereals | G321: 64 | H321: 10968 | I321: 33.25 | J321: 4 | K321: 0 | L321: =RC[-2]*RC[-3] -> 133 | M321: =RC[-2]*RC[-1] -> 0 | N321: =RC[-2]-RC[-1] -> 133
A322: 'ERNSH | B322: 'Ernst Handel | C322: 7 | D322: 'Pavlova, Ltd. | E322: 1 | F322: 'Beverages | G322: 70 | H322: 11017 | I322: 15 | J322: 30 | K322: 0 | L322: =RC[-2]*RC[-3] -> 450 | M322: =RC[-2]*RC[-1] -> 0 | N322: =RC[-2]-RC[-1] -> 450
A323: 'ERNSH | B323: 'Ernst Handel | C323: 18 | D323: 'Aux joyeux ecclésiastiques | E323: 1 | F323: 'Beverages | G323: 38 | H323: 10351 | I323: 210.8 | J323: 20 | K323: 0.05 | L323: =RC[-2]*RC[-3] -> 4216 | M323: =RC[-2]*RC[-1] -> 210.8 | N323: =RC[-2]-RC[-1] -> 4005.2
A324: 'ERNSH | B324: 'Ernst Handel | C324: 12 | D324: 'Plutzer Lebensmittelgroßmärkte AG | E324: 5 | F324: 'Grains/Cereals | G324: 64 | H324: 11072 | I324: 33.25 | J324: 130 | K324: 0 | L324: =RC[-2]*RC[-3] -> 4322.5 | M324: =RC[-2]*RC[-1] -> 0 | N324: =RC[-2]-RC[-1] -> 4322.5
A325: 'ERNSH | B325: 'Ernst Handel | C325: 2 | D325: 'New Orleans Cajun Delights | E325: 2 | F325: 'Condiments | G325: 66 | H325: 10442 | I325: 13.6 | J325: 60 | K325: 0 | L325: =RC[-2]*RC[-3] -> 816 | M325: =RC[-2]*RC[-1] -> 0 | N325: =RC[-2]-RC[-1] -> 816
A326: 'ERNSH | B326: 'Ernst Handel | C326: 2 | D326: 'New Orleans Cajun Delights | E326: 2 | F326: 'Condiments | G326: 65 | H326: 10698 | I326: 21.05 | J326: 65 | K326: 0.05 | L326: =RC[-2]*RC[-3] -> 1368.25 | M326: =RC[-2]*RC[-1] -> 68.4125 | N326: =RC[-2]-RC[-1] -> 1299.8375
A327: 'ERNSH | B327: 'Ernst Handel | C327: 10 | D327: 'Refrescos Americanas LTDA | E327: 1 | F327: 'Beverages | G327: 24 | H327: 10263 | I327: 3.6 | J327: 28 | K327: 0 | L327: =RC[-2]*RC[-3] -> 100.8 | M327: =RC[-2]*RC[-1] -> 0 | N327: =RC[-2]-RC[-1] -> 100.8
A328: 'ERNSH | B328: 'Ernst Handel | C328: 7 | D328: 'Pavlova, Ltd. | E328: 3 | F328: 'Confections | G328: 16 | H328: 10403 | I328: 13.9 | J328: 21 | K328: 0.15 | L328: =RC[-2]*RC[-3] -> 291.9 | M328: =RC[-2]*RC[-1] -> 43.785 | N328: =RC[-2]-RC[-1] -> 248.115
A329: 'ERNSH | B329: 'Ernst Handel | C329: 14 | D329: 'Formaggi Fortini s.r.l. | E329: 4 | F329: 'Dairy Products | G329: 31 | H329: 10773 | I329: 12.5 | J329: 70 | K329: 0.2 | L329: =RC[-2]*RC[-3] -> 875 | M329: =RC[-2]*RC[-1] -> 175 | N329: =RC[-2]-RC[-1] -> 700
A330: 'ERNSH | B330: 'Ernst Handel | C330: 15 | D330: 'Norske Meierier | E330: 4 | F330: 'Dairy Products | G330: 69 | H330: 10595 | I330: 36 | J330: 65 | K330: 0.25 | L330: =RC[-2]*RC[-3] -> 2340 | M330: =RC[-2]*RC[-1] -> 585 | N330: =RC[-2]-RC[-1] -> 1755
A331: 'ERNSH | B331: 'Ernst Handel | C331: 14 | D331: 'Formaggi Fortini s.r.l. | E331: 4 | F331: 'Dairy Products | G331: 32 | H331: 10258 | I331: 25.6 | J331: 6 | K331: 0.2 | L331: =RC[-2]*RC[-3] -> 153.6 | M331: =RC[-2]*RC[-1] -> 30.72 | N331: =RC[-2]-RC[-1] -> 122.88
A332: 'ERNSH | B332: 'Ernst Handel | C332: 4 | D332: 'Tokyo Traders | E332: 7 | F332: 'Produce | G332: 74 | H332: 10263 | I332: 8 | J332: 36 | K332: 0.25 | L332: =RC[-2]*RC[-3] -> 288 | M332: =RC[-2]*RC[-1] -> 72 | N332: =RC[-2]-RC[-1] -> 216
A333: 'ERNSH | B333: 'Ernst Handel | C333: 26 | D333: 'Pasta Buttini s.r.l. | E333: 5 | F333: 'Grains/Cereals | G333: 57 | H333: 10836 | I333: 19.5 | J333: 24 | K333: 0 | L333: =RC[-2]*RC[-3] -> 468 | M333: =RC[-2]*RC[-1] -> 0 | N333: =RC[-2]-RC[-1] -> 468
A334: 'ERNSH | B334: 'Ernst Handel | C334: 16 | D334: 'Bigfoot Breweries | E334: 1 | F334: 'Beverages | G334: 34 | H334: 11008 | I334: 14 | J334: 90 | K334: 0.05 | L334: =RC[-2]*RC[-3] -> 1260 | M334: =RC[-2]*RC[-1] -> 63 | N334: =RC[-2]-RC[-1] -> 1197
A335: 'ERNSH | B335: 'Ernst Handel | C335: 14 | D335: 'Formaggi Fortini s.r.l. | E335: 4 | F335: 'Dairy Products | G335: 31 | H335: 10390 | I335: 10 | J335: 60 | K335: 0.1 | L335: =RC[-2]*RC[-3] -> 600 | M335: =RC[-2]*RC[-1] -> 60 | N335: =RC[-2]-RC[-1] -> 540
A336: 'ERNSH | B336: 'Ernst Handel | C336: 18 | D336: 'Aux joyeux ecclésiastiques | E336: 1 | F336: 'Beverages | G336: 39 | H336: 10764 | I336: 18 | J336: 130 | K336: 0.1 | L336: =RC[-2]*RC[-3] -> 2340 | M336: =RC[-2]*RC[-1] -> 234 | N336: =RC[-2]-RC[-1] -> 2106
A337: 'ERNSH | B337: 'Ernst Handel | C337: 1 | D337: 'Exotic Liquids | E337: 2 | F337: 'Condiments | G337: 3 | H337: 10764 | I337: 10 | J337: 20 | K337: 0.1 | L337: =RC[-2]*RC[-3] -> 200 | M337: =RC[-2]*RC[-1] -> 20 | N337: =RC[-2]-RC[-1] -> 180
A338: 'ERNSH | B338: 'Ernst Handel | C338: 19 | D338: 'New England Seafood Cannery | E338: 8 | F338: 'Seafood | G338: 41 | H338: 10351 | I338: 7.7 | J338: 13 | K338: 0 | L338: =RC[-2]*RC[-3] -> 100.1 | M338: =RC[-2]*RC[-1] -> 0 | N338: =RC[-2]-RC[-1] -> 100.1
A339: 'ERNSH | B339: 'Ernst Handel | C339: 7 | D339: 'Pavlova, Ltd. | E339: 6 | F339: 'Meat/Poultry | G339: 17 | H339: 10773 | I339: 39 | J339: 33 | K339: 0 | L339: =RC[-2]*RC[-3] -> 1287 | M339: =RC[-2]*RC[-1] -> 0 | N339: =RC[-2]-RC[-1] -> 1287
A340: 'ERNSH | B340: 'Ernst Handel | C340: 29 | D340: 'Forêts d'érables | E340: 3 | F340: 'Confections | G340: 62 | H340: 10633 | I340: 49.3 | J340: 80 | K340: 0.15 | L340: =RC[-2]*RC[-3] -> 3944 | M340: =RC[-2]*RC[-1] -> 591.6 | N340: =RC[-2]-RC[-1] -> 3352.4
A341: 'ERNSH | B341: 'Ernst Handel | C341: 9 | D341: 'PB Knäckebröd AB | E341: 5 | F341: 'Grains/Cereals | G341: 23 | H341: 10402 | I341: 7.2 | J341: 60 | K341: 0 | L341: =RC[-2]*RC[-3] -> 432 | M341: =RC[-2]*RC[-1] -> 0 | N341: =RC[-2]-RC[-1] -> 432
A342: 'ERNSH | B342: 'Ernst Handel | C342: 7 | D342: 'Pavlova, Ltd. | E342: 6 | F342: 'Meat/Poultry | G342: 17 | H342: 10795 | I342: 39 | J342: 35 | K342: 0.25 | L342: =RC[-2]*RC[-3] -> 1365 | M342: =RC[-2]*RC[-1] -> 341.25 | N342: =RC[-2]-RC[-1] -> 1023.75
A343: 'ERNSH | B343: 'Ernst Handel | C343: 10 | D343: 'Refrescos Americanas LTDA | E343: 1 | F343: 'Beverages | G343: 24 | H343: 10968 | I343: 4.5 | J343: 30 | K343: 0 | L343: =RC[-2]*RC[-3] -> 135 | M343: =RC[-2]*RC[-1] -> 0 | N343: =RC[-2]-RC[-1] -> 135
A344: 'ERNSH | B344: 'Ernst Handel | C344: 1 | D344: 'Exotic Liquids | E344: 1 | F344: 'Beverages | G344: 2 | H344: 11072 | I344: 19 | J344: 8 | K344: 0 | L344: =RC[-2]*RC[-3] -> 152 | M344: =RC[-2]*RC[-1] -> 0 | N344: =RC[-2]-RC[-1] -> 152
A345: 'ERNSH | B345: 'Ernst Handel | C345: 12 | D345: 'Plutzer Lebensmittelgroßmärkte AG | E345: 1 | F345: 'Beverages | G345: 75 | H345: 10773 | I345: 7.75 | J345: 7 | K345: 0.2 | L345: =RC[-2]*RC[-3] -> 54.25 | M345: =RC[-2]*RC[-1] -> 10.85 | N345: =RC[-2]-RC[-1] -> 43.4
A346: 'ERNSH | B346: 'Ernst Handel | C346: 10 | D346: 'Refrescos Americanas LTDA | E346: 1 | F346: 'Beverages | G346: 24 | H346: 10895 | I346: 4.5 | J346: 110 | K346: 0 | L346: =RC[-2]*RC[-3] -> 495 | M346: =RC[-2]*RC[-1] -> 0 | N346: =RC[-2]-RC[-1] -> 495
A347: 'ERNSH | B347: 'Ernst Handel | C347: 8 | D347: 'Specialty Biscuits, Ltd. | E347: 3 | F347: 'Confections | G347: 21 | H347: 10990 | I347: 10 | J347: 65 | K347: 0 | L347: =RC[-2]*RC[-3] -> 650 | M347: =RC[-2]*RC[-1] -> 0 | N347: =RC[-2]-RC[-1] -> 650
A348: 'ERNSH | B348: 'Ernst Handel | C348: 2 | D348: 'New Orleans Cajun Delights | E348: 2 | F348: 'Condiments | G348: 5 | H348: 10258 | I348: 17 | J348: 65 | K348: 0.2 | L348: =RC[-2]*RC[-3] -> 1105 | M348: =RC[-2]*RC[-1] -> 221 | N348: =RC[-2]-RC[-1] -> 884
A349: 'ERNSH | B349: 'Ernst Handel | C349: 5 | D349: 'Cooperativa de Quesos 'Las Cabras' | E349: 4 | F349: 'Dairy Products | G349: 11 | H349: 10698 | I349: 21 | J349: 15 | K349: 0 | L349: =RC[-2]*RC[-3] -> 315 | M349: =RC[-2]*RC[-1] -> 0 | N349: =RC[-2]-RC[-1] -> 315
A350: 'ERNSH | B350: 'Ernst Handel | C350: 28 | D350: 'Gai pâturage | E350: 4 | F350: 'Dairy Products | G350: 60 | H350: 10836 | I350: 34 | J350: 60 | K350: 0 | L350: =RC[-2]*RC[-3] -> 2040 | M350: =RC[-2]*RC[-1] -> 0 | N350: =RC[-2]-RC[-1] -> 2040
A351: 'ERNSH | B351: 'Ernst Handel | C351: 29 | D351: 'Forêts d'érables | E351: 2 | F351: 'Condiments | G351: 61 | H351: 10990 | I351: 28.5 | J351: 66 | K351: 0.15 | L351: =RC[-2]*RC[-3] -> 1881 | M351: =RC[-2]*RC[-1] -> 282.15 | N351: =RC[-2]-RC[-1] -> 1598.85
A352: 'ERNSH | B352: 'Ernst Handel | C352: 12 | D352: 'Plutzer Lebensmittelgroßmärkte AG | E352: 1 | F352: 'Beverages | G352: 75 | H352: 10514 | I352: 7.75 | J352: 50 | K352: 0 | L352: =RC[-2]*RC[-3] -> 387.5 | M352: =RC[-2]*RC[-1] -> 0 | N352: =RC[-2]-RC[-1] -> 387.5
A353: 'ERNSH | B353: 'Ernst Handel | C353: 4 | D353: 'Tokyo Traders | E353: 8 | F353: 'Seafood | G353: 10 | H353: 10854 | I353: 31 | J353: 100 | K353: 0.15 | L353: =RC[-2]*RC[-3] -> 3100 | M353: =RC[-2]*RC[-1] -> 465 | N353: =RC[-2]-RC[-1] -> 2635
A354: 'ERNSH | B354: 'Ernst Handel | C354: 5 | D354: 'Cooperativa de Quesos 'Las Cabras' | E354: 4 | F354: 'Dairy Products | G354: 12 | H354: 10979 | I354: 38 | J354: 20 | K354: 0 | L354: =RC[-2]*RC[-3] -> 760 | M354: =RC[-2]*RC[-1] -> 0 | N354: =RC[-2]-RC[-1] -> 760
A355: 'ERNSH | B355: 'Ernst Handel | C355: 12 | D355: 'Plutzer Lebensmittelgroßmärkte AG | E355: 6 | F355: 'Meat/Poultry | G355: 29 | H355: 10382 | I355: 99 | J355: 14 | K355: 0 | L355: =RC[-2]*RC[-3] -> 1386 | M355: =RC[-2]*RC[-1] -> 0 | N355: =RC[-2]-RC[-1] -> 1386
A356: 'ERNSH | B356: 'Ernst Handel | C356: 7 | D356: 'Pavlova, Ltd. | E356: 6 | F356: 'Meat/Poultry | G356: 17 | H356: 10698 | I356: 39 | J356: 8 | K356: 0.05 | L356: =RC[-2]*RC[-3] -> 312 | M356: =RC[-2]*RC[-1] -> 15.6 | N356: =RC[-2]-RC[-1] -> 296.4
A357: 'ERNSH | B357: 'Ernst Handel | C357: 15 | D357: 'Norske Meierier | E357: 4 | F357: 'Dairy Products | G357: 71 | H357: 11008 | I357: 21.5 | J357: 21 | K357: 0 | L357: =RC[-2]*RC[-3] -> 451.5 | M357: =RC[-2]*RC[-1] -> 0 | N357: =RC[-2]-RC[-1] -> 451.5
A358: 'ERNSH | B358: 'Ernst Handel | C358: 15 | D358: 'Norske Meierier | E358: 4 | F358: 'Dairy Products | G358: 69 | H358: 10667 | I358: 36 | J358: 45 | K358: 0.2 | L358: =RC[-2]*RC[-3] -> 1620 | M358: =RC[-2]*RC[-1] -> 324 | N358: =RC[-2]-RC[-1] -> 1296
A359: 'ERNSH | B359: 'Ernst Handel | C359: 16 | D359: 'Bigfoot Breweries | E359: 1 | F359: 'Beverages | G359: 35 | H359: 10595 | I359: 18 | J359: 30 | K359: 0.25 | L359: =RC[-2]*RC[-3] -> 540 | M359: =RC[-2]*RC[-1] -> 135 | N359: =RC[-2]-RC[-1] -> 405
A360: 'ERNSH | B360: 'Ernst Handel | C360: 14 | D360: 'Formaggi Fortini s.r.l. | E360: 4 | F360: 'Dairy Products | G360: 72 | H360: 10390 | I360: 27.8 | J360: 24 | K360: 0.1 | L360: =RC[-2]*RC[-3] -> 667.2 | M360: =RC[-2]*RC[-1] -> 66.72 | N360: =RC[-2]-RC[-1] -> 600.48
A361: 'ERNSH | B361: 'Ernst Handel | C361: 25 | D361: 'Ma Maison | E361: 6 | F361: 'Meat/Poultry | G361: 54 | H361: 10442 | I361: 5.9 | J361: 80 | K361: 0 | L361: =RC[-2]*RC[-3] -> 472 | M361: =RC[-2]*RC[-1] -> 0 | N361: =RC[-2]-RC[-1] -> 472
A362: 'ERNSH | B362: 'Ernst Handel | C362: 10 | D362: 'Refrescos Americanas LTDA | E362: 1 | F362: 'Beverages | G362: 24 | H362: 10979 | I362: 4.5 | J362: 80 | K362: 0 | L362: =RC[-2]*RC[-3] -> 360 | M362: =RC[-2]*RC[-1] -> 0 | N362: =RC[-2]-RC[-1] -> 360
A363: 'ERNSH | B363: 'Ernst Handel | C363: 15 | D363: 'Norske Meierier | E363: 4 | F363: 'Dairy Products | G363: 71 | H363: 10667 | I363: 21.5 | J363: 14 | K363: 0.2 | L363: =RC[-2]*RC[-3] -> 301 | M363: =RC[-2]*RC[-1] -> 60.2 | N363: =RC[-2]-RC[-1] -> 240.8
A364: 'ERNSH | B364: 'Ernst Handel | C364: 4 | D364: 'Tokyo Traders | E364: 7 | F364: 'Produce | G364: 74 | H364: 10382 | I364: 8 | J364: 50 | K364: 0 | L364: =RC[-2]*RC[-3] -> 400 | M364: =RC[-2]*RC[-1] -> 0 | N364: =RC[-2]-RC[-1] -> 400
A365: 'ERNSH | B365: 'Ernst Handel | C365: 2 | D365: 'New Orleans Cajun Delights | E365: 2 | F365: 'Condiments | G365: 65 | H365: 10351 | I365: 16.8 | J365: 10 | K365: 0.05 | L365: =RC[-2]*RC[-3] -> 168 | M365: =RC[-2]*RC[-1] -> 8.4 | N365: =RC[-2]-RC[-1] -> 159.6
A366: 'ERNSH | B366: 'Ernst Handel | C366: 26 | D366: 'Pasta Buttini s.r.l. | E366: 5 | F366: 'Grains/Cereals | G366: 56 | H366: 10430 | I366: 30.4 | J366: 30 | K366: 0 | L366: =RC[-2]*RC[-3] -> 912 | M366: =RC[-2]*RC[-1] -> 0 | N366: =RC[-2]-RC[-1] -> 912
A367: 'ERNSH | B367: 'Ernst Handel | C367: 6 | D367: 'Mayumi's | E367: 7 | F367: 'Produce | G367: 14 | H367: 10571 | I367: 23.25 | J367: 11 | K367: 0.15 | L367: =RC[-2]*RC[-3] -> 255.75 | M367: =RC[-2]*RC[-1] -> 38.3625 | N367: =RC[-2]-RC[-1] -> 217.3875
A368: 'ERNSH | B368: 'Ernst Handel | C368: 8 | D368: 'Specialty Biscuits, Ltd. | E368: 3 | F368: 'Confections | G368: 20 | H368: 10514 | I368: 81 | J368: 39 | K368: 0 | L368: =RC[-2]*RC[-3] -> 3159 | M368: =RC[-2]*RC[-1] -> 0 | N368: =RC[-2]-RC[-1] -> 3159
A369: 'ERNSH | B369: 'Ernst Handel | C369: 26 | D369: 'Pasta Buttini s.r.l. | E369: 5 | F369: 'Grains/Cereals | G369: 56 | H369: 10514 | I369: 38 | J369: 70 | K369: 0 | L369: =RC[-2]*RC[-3] -> 2660 | M369: =RC[-2]*RC[-1] -> 0 | N369: =RC[-2]-RC[-1] -> 2660
A370: 'ERNSH | B370: 'Ernst Handel | C370: 7 | D370: 'Pavlova, Ltd. | E370: 8 | F370: 'Seafood | G370: 18 | H370: 10382 | I370: 50 | J370: 9 | K370: 0 | L370: =RC[-2]*RC[-3] -> 450 | M370: =RC[-2]*RC[-1] -> 0 | N370: =RC[-2]-RC[-1] -> 450
A371: 'ERNSH | B371: 'Ernst Handel | C371: 21 | D371: 'Lyngbysild | E371: 8 | F371: 'Seafood | G371: 46 | H371: 10390 | I371: 9.6 | J371: 45 | K371: 0 | L371: =RC[-2]*RC[-3] -> 432 | M371: =RC[-2]*RC[-1] -> 0 | N371: =RC[-2]-RC[-1] -> 432
A372: 'ERNSH | B372: 'Ernst Handel | C372: 20 | D372: 'Leka Trading | E372: 5 | F372: 'Grains/Cereals | G372: 42 | H372: 10571 | I372: 14 | J372: 28 | K372: 0.15 | L372: =RC[-2]*RC[-3] -> 392 | M372: =RC[-2]*RC[-1] -> 58.8 | N372: =RC[-2]-RC[-1] -> 333.2
A373: 'ERNSH | B373: 'Ernst Handel | C373: 7 | D373: 'Pavlova, Ltd. | E373: 2 | F373: 'Condiments | G373: 63 | H373: 10402 | I373: 35.1 | J373: 65 | K373: 0 | L373: =RC[-2]*RC[-3] -> 2281.5 | M373: =RC[-2]*RC[-1] -> 0 | N373: =RC[-2]-RC[-1] -> 2281.5
A374: 'ERNSH | B374: 'Ernst Handel | C374: 28 | D374: 'Gai pâturage | E374: 4 | F374: 'Dairy Products | G374: 59 | H374: 11017 | I374: 55 | J374: 110 | K374: 0 | L374: =RC[-2]*RC[-3] -> 6050 | M374: =RC[-2]*RC[-1] -> 0 | N374: =RC[-2]-RC[-1] -> 6050
A375: 'ERNSH | B375: 'Ernst Handel | C375: 26 | D375: 'Pasta Buttini s.r.l. | E375: 5 | F375: 'Grains/Cereals | G375: 57 | H375: 10368 | I375: 15.6 | J375: 25 | K375: 0 | L375: =RC[-2]*RC[-3] -> 390 | M375: =RC[-2]*RC[-1] -> 0 | N375: =RC[-2]-RC[-1] -> 390
A376: 'ERNSH | B376: 'Ernst Handel | C376: 29 | D376: 'Forêts d'érables | E376: 2 | F376: 'Condiments | G376: 61 | H376: 10595 | I376: 28.5 | J376: 120 | K376: 0.25 | L376: =RC[-2]*RC[-3] -> 3420 | M376: =RC[-2]*RC[-1] -> 855 | N376: =RC[-2]-RC[-1] -> 2565
A377: 'ERNSH | B377: 'Ernst Handel | C377: 14 | D377: 'Formaggi Fortini s.r.l. | E377: 4 | F377: 'Dairy Products | G377: 31 | H377: 10776 | I377: 12.5 | J377: 16 | K377: 0.05 | L377: =RC[-2]*RC[-3] -> 200 | M377: =RC[-2]*RC[-1] -> 10 | N377: =RC[-2]-RC[-1] -> 190
A378: 'ERNSH | B378: 'Ernst Handel | C378: 25 | D378: 'Ma Maison | E378: 6 | F378: 'Meat/Poultry | G378: 55 | H378: 10990 | I378: 24 | J378: 65 | K378: 0.15 | L378: =RC[-2]*RC[-3] -> 1560 | M378: =RC[-2]*RC[-1] -> 234 | N378: =RC[-2]-RC[-1] -> 1326
A379: 'ERNSH | B379: 'Ernst Handel | C379: 12 | D379: 'Plutzer Lebensmittelgroßmärkte AG | E379: 6 | F379: 'Meat/Poultry | G379: 29 | H379: 10698 | I379: 123.79 | J379: 12 | K379: 0.05 | L379: =RC[-2]*RC[-3] -> 1485.48 | M379: =RC[-2]*RC[-1] -> 74.274 | N379: =RC[-2]-RC[-1] -> 1411.206
A380: 'ERNSH | B380: 'Ernst Handel | C380: 11 | D380: 'Heli Süßwaren GmbH & Co. KG | E380: 3 | F380: 'Confections | G380: 26 | H380: 10633 | I380: 31.23 | J380: 35 | K380: 0.15 | L380: =RC[-2]*RC[-3] -> 1093.05 | M380: =RC[-2]*RC[-1] -> 163.9575 | N380: =RC[-2]-RC[-1] -> 929.0925
A381: 'ERNSH | B381: 'Ernst Handel | C381: 16 | D381: 'Bigfoot Breweries | E381: 1 | F381: 'Beverages | G381: 34 | H381: 10990 | I381: 14 | J381: 60 | K381: 0.15 | L381: =RC[-2]*RC[-3] -> 840 | M381: =RC[-2]*RC[-1] -> 126 | N381: =RC[-2]-RC[-1] -> 714
A382: 'ERNSH | B382: 'Ernst Handel | C382: 2 | D382: 'New Orleans Cajun Delights | E382: 2 | F382: 'Condiments | G382: 65 | H382: 10514 | I382: 21.05 | J382: 39 | K382: 0 | L382: =RC[-2]*RC[-3] -> 820.95 | M382: =RC[-2]*RC[-1] -> 0 | N382: =RC[-2]-RC[-1] -> 820.95
A383: 'ERNSH | B383: 'Ernst Handel | C383: 5 | D383: 'Cooperativa de Quesos 'Las Cabras' | E383: 4 | F383: 'Dairy Products | G383: 11 | H383: 10442 | I383: 16.8 | J383: 30 | K383: 0 | L383: =RC[-2]*RC[-3] -> 504 | M383: =RC[-2]*RC[-1] -> 0 | N383: =RC[-2]-RC[-1] -> 504
A384: 'ERNSH | B384: 'Ernst Handel | C384: 21 | D384: 'Lyngbysild | E384: 8 | F384: 'Seafood | G384: 45 | H384: 10776 | I384: 9.5 | J384: 27 | K384: 0.05 | L384: =RC[-2]*RC[-3] -> 256.5 | M384: =RC[-2]*RC[-1] -> 12.825 | N384: =RC[-2]-RC[-1] -> 243.675
A385: 'ERNSH | B385: 'Ernst Handel | C385: 15 | D385: 'Norske Meierier | E385: 4 | F385: 'Dairy Products | G385: 33 | H385: 10382 | I385: 2 | J385: 60 | K385: 0 | L385: =RC[-2]*RC[-3] -> 120 | M385: =RC[-2]*RC[-1] -> 0 | N385: =RC[-2]-RC[-1] -> 120
A386: 'ERNSH | B386: 'Ernst Handel | C386: 7 | D386: 'Pavlova, Ltd. | E386: 3 | F386: 'Confections | G386: 16 | H386: 10795 | I386: 17.45 | J386: 65 | K386: 0 | L386: =RC[-2]*RC[-3] -> 1134.25 | M386: =RC[-2]*RC[-1] -> 0 | N386: =RC[-2]-RC[-1] -> 1134.25
A387: 'ERNSH | B387: 'Ernst Handel | C387: 11 | D387: 'Heli Süßwaren GmbH & Co. KG | E387: 3 | F387: 'Confections | G387: 27 | H387: 10979 | I387: 43.9 | J387: 30 | K387: 0 | L387: =RC[-2]*RC[-3] -> 1317 | M387: =RC[-2]*RC[-1] -> 0 | N387: =RC[-2]-RC[-1] -> 1317
A388: 'ERNSH | B388: 'Ernst Handel | C388: 12 | D388: 'Plutzer Lebensmittelgroßmärkte AG | E388: 5 | F388: 'Grains/Cereals | G388: 64 | H388: 10368 | I388: 26.6 | J388: 35 | K388: 0.1 | L388: =RC[-2]*RC[-3] -> 931 | M388: =RC[-2]*RC[-1] -> 93.1 | N388: =RC[-2]-RC[-1] -> 837.9
A389: 'ERNSH | B389: 'Ernst Handel | C389: 12 | D389: 'Plutzer Lebensmittelgroßmärkte AG | E389: 7 | F389: 'Produce | G389: 28 | H389: 10368 | I389: 36.4 | J389: 13 | K389: 0.1 | L389: =RC[-2]*RC[-3] -> 473.2 | M389: =RC[-2]*RC[-1] -> 47.32 | N389: =RC[-2]-RC[-1] -> 425.88
A390: 'ERNSH | B390: 'Ernst Handel | C390: 5 | D390: 'Cooperativa de Quesos 'Las Cabras' | E390: 4 | F390: 'Dairy Products | G390: 12 | H390: 10968 | I390: 38 | J390: 30 | K390: 0 | L390: =RC[-2]*RC[-3] -> 1140 | M390: =RC[-2]*RC[-1] -> 0 | N390: =RC[-2]-RC[-1] -> 1140
A391: 'ERNSH | B391: 'Ernst Handel | C391: 9 | D391: 'PB Knäckebröd AB | E391: 5 | F391: 'Grains/Cereals | G391: 22 | H391: 10836 | I391: 21 | J391: 52 | K391: 0 | L391: =RC[-2]*RC[-3] -> 1092 | M391: =RC[-2]*RC[-1] -> 0 | N391: =RC[-2]-RC[-1] -> 1092
A392: 'FOLKO | B392: 'Folk och fä HB | C392: 21 | D392: 'Lyngbysild | E392: 8 | F392: 'Seafood | G392: 46 | H392: 11001 | I392: 12 | J392: 25 | K392: 0 | L392: =RC[-2]*RC[-3] -> 300 | M392: =RC[-2]*RC[-1] -> 0 | N392: =RC[-2]-RC[-1] -> 300
A393: 'FOLKO | B393: 'Folk och fä HB | C393: 17 | D393: 'Svensk Sjöföda AB | E393: 8 | F393: 'Seafood | G393: 73 | H393: 10703 | I393: 15 | J393: 35 | K393: 0 | L393: =RC[-2]*RC[-3] -> 525 | M393: =RC[-2]*RC[-1] -> 0 | N393: =RC[-2]-RC[-1] -> 525
A394: 'FOLKO | B394: 'Folk och fä HB | C394: 9 | D394: 'PB Knäckebröd AB | E394: 5 | F394: 'Grains/Cereals | G394: 23 | H394: 10880 | I394: 9 | J394: 30 | K394: 0.2 | L394: =RC[-2]*RC[-3] -> 270 | M394: =RC[-2]*RC[-1] -> 54 | N394: =RC[-2]-RC[-1] -> 216
A395: 'FOLKO | B395: 'Folk och fä HB | C395: 12 | D395: 'Plutzer Lebensmittelgroßmärkte AG | E395: 6 | F395: 'Meat/Poultry | G395: 29 | H395: 10993 | I395: 123.79 | J395: 50 | K395: 0.25 | L395: =RC[-2]*RC[-3] -> 6189.5 | M395: =RC[-2]*RC[-1] -> 1547.375 | N395: =RC[-2]-RC[-1] -> 4642.125
A396: 'FOLKO | B396: 'Folk och fä HB | C396: 12 | D396: 'Plutzer Lebensmittelgroßmärkte AG | E396: 1 | F396: 'Beverages | G396: 75 | H396: 10980 | I396: 7.75 | J396: 40 | K396: 0.2 | L396: =RC[-2]*RC[-3] -> 310 | M396: =RC[-2]*RC[-1] -> 62 | N396: =RC[-2]-RC[-1] -> 248
A397: 'FOLKO | B397: 'Folk och fä HB | C397: 17 | D397: 'Svensk Sjöföda AB | E397: 8 | F397: 'Seafood | G397: 73 | H397: 10533 | I397: 15 | J397: 24 | K397: 0.05 | L397: =RC[-2]*RC[-3] -> 360 | M397: =RC[-2]*RC[-1] -> 18 | N397: =RC[-2]-RC[-1] -> 342
A398: 'FOLKO | B398: 'Folk och fä HB | C398: 1 | D398: 'Exotic Liquids | E398: 1 | F398: 'Beverages | G398: 2 | H398: 10703 | I398: 19 | J398: 5 | K398: 0 | L398: =RC[-2]*RC[-3] -> 95 | M398: =RC[-2]*RC[-1] -> 0 | N398: =RC[-2]-RC[-1] -> 95
A399: 'FOLKO | B399: 'Folk och fä HB | C399: 5 | D399: 'Cooperativa de Quesos 'Las Cabras' | E399: 4 | F399: 'Dairy Products | G399: 11 | H399: 10434 | I399: 16.8 | J399: 6 | K399: 0 | L399: =RC[-2]*RC[-3] -> 100.8 | M399: =RC[-2]*RC[-1] -> 0 | N399: =RC[-2]-RC[-1] -> 100.8
A400: 'FOLKO | B400: 'Folk och fä HB | C400: 26 | D400: 'Pasta Buttini s.r.l. | E400: 5 | F400: 'Grains/Cereals | G400: 56 | H400: 10762 | I400: 38 | J400: 60 | K400: 0 | L400: =RC[-2]*RC[-3] -> 2280 | M400: =RC[-2]*RC[-1] -> 0 | N400: =RC[-2]-RC[-1] -> 2280
A401: 'FOLKO | B401: 'Folk och fä HB | C401: 20 | D401: 'Leka Trading | E401: 2 | F401: 'Condiments | G401: 44 | H401: 10561 | I401: 19.45 | J401: 10 | K401: 0 | L401: =RC[-2]*RC[-3] -> 194.5 | M401: =RC[-2]*RC[-1] -> 0 | N401: =RC[-2]-RC[-1] -> 194.5
A402: 'FOLKO | B402: 'Folk och fä HB | C402: 3 | D402: 'Grandma Kelly's Homestead | E402: 7 | F402: 'Produce | G402: 7 | H402: 11001 | I402: 30 | J402: 60 | K402: 0 | L402: =RC[-2]*RC[-3] -> 1800 | M402: =RC[-2]*RC[-1] -> 0 | N402: =RC[-2]-RC[-1] -> 1800
A403: 'FOLKO | B403: 'Folk och fä HB | C403: 7 | D403: 'Pavlova, Ltd. | E403: 1 | F403: 'Beverages | G403: 70 | H403: 10824 | I403: 15 | J403: 9 | K403: 0 | L403: =RC[-2]*RC[-3] -> 135 | M403: =RC[-2]*RC[-1] -> 0 | N403: =RC[-2]-RC[-1] -> 135
A404: 'FOLKO | B404: 'Folk och fä HB | C404: 7 | D404: 'Pavlova, Ltd. | E404: 1 | F404: 'Beverages | G404: 70 | H404: 10880 | I404: 15 | J404: 50 | K404: 0.2 | L404: =RC[-2]*RC[-3] -> 750 | M404: =RC[-2]*RC[-1] -> 150 | N404: =RC[-2]-RC[-1] -> 600
A405: 'FOLKO | B405: 'Folk och fä HB | C405: 23 | D405: 'Karkki Oy | E405: 1 | F405: 'Beverages | G405: 76 | H405: 11050 | I405: 18 | J405: 50 | K405: 0.1 | L405: =RC[-2]*RC[-3] -> 900 | M405: =RC[-2]*RC[-1] -> 90 | N405: =RC[-2]-RC[-1] -> 810
A406: 'FOLKO | B406: 'Folk och fä HB | C406: 18 | D406: 'Aux joyeux ecclésiastiques | E406: 1 | F406: 'Beverages | G406: 39 | H406: 10762 | I406: 18 | J406: 16 | K406: 0 | L406: =RC[-2]*RC[-3] -> 288 | M406: =RC[-2]*RC[-1] -> 0 | N406: =RC[-2]-RC[-1] -> 288
A407: 'FOLKO | B407: 'Folk och fä HB | C407: 25 | D407: 'Ma Maison | E407: 6 | F407: 'Meat/Poultry | G407: 55 | H407: 10902 | I407: 24 | J407: 30 | K407: 0.15 | L407: =RC[-2]*RC[-3] -> 720 | M407: =RC[-2]*RC[-1] -> 108 | N407: =RC[-2]-RC[-1] -> 612
A408: 'FOLKO | B408: 'Folk och fä HB | C408: 22 | D408: 'Zaanse Snoepfabriek | E408: 3 | F408: 'Confections | G408: 47 | H408: 10977 | I408: 9.5 | J408: 30 | K408: 0 | L408: =RC[-2]*RC[-3] -> 285 | M408: =RC[-2]*RC[-1] -> 0 | N408: =RC[-2]-RC[-1] -> 285
A409: 'FOLKO | B409: 'Folk och fä HB | C409: 27 | D409: 'Escargots Nouveaux | E409: 8 | F409: 'Seafood | G409: 58 | H409: 10327 | I409: 10.6 | J409: 30 | K409: 0.2 | L409: =RC[-2]*RC[-3] -> 318 | M409: =RC[-2]*RC[-1] -> 63.6 | N409: =RC[-2]-RC[-1] -> 254.4
A410: 'FOLKO | B410: 'Folk och fä HB | C410: 12 | D410: 'Plutzer Lebensmittelgroßmärkte AG | E410: 1 | F410: 'Beverages | G410: 75 | H410: 10460 | I410: 6.2 | J410: 4 | K410: 0.25 | L410: =RC[-2]*RC[-3] -> 24.8 | M410: =RC[-2]*RC[-1] -> 6.2 | N410: =RC[-2]-RC[-1] -> 18.6
A411: 'FOLKO | B411: 'Folk och fä HB | C411: 13 | D411: 'Nord-Ost-Fisch Handelsgesellschaft mbH | E411: 8 | F411: 'Seafood | G411: 30 | H411: 10327 | I411: 20.7 | J411: 35 | K411: 0.2 | L411: =RC[-2]*RC[-3] -> 724.5 | M411: =RC[-2]*RC[-1] -> 144.9 | N411: =RC[-2]-RC[-1] -> 579.6
A412: 'FOLKO | B412: 'Folk och fä HB | C412: 24 | D412: 'G'day, Mate | E412: 7 | F412: 'Produce | G412: 51 | H412: 10977 | I412: 53 | J412: 10 | K412: 0 | L412: =RC[-2]*RC[-3] -> 530 | M412: =RC[-2]*RC[-1] -> 0 | N412: =RC[-2]-RC[-1] -> 530
A413: 'FOLKO | B413: 'Folk och fä HB | C413: 2 | D413: 'New Orleans Cajun Delights | E413: 2 | F413: 'Condiments | G413: 66 | H413: 10774 | I413: 17 | J413: 50 | K413: 0 | L413: =RC[-2]*RC[-3] -> 850 | M413: =RC[-2]*RC[-1] -> 0 | N413: =RC[-2]-RC[-1] -> 850
A414: 'FOLKO | B414: 'Folk och fä HB | C414: 7 | D414: 'Pavlova, Ltd. | E414: 2 | F414: 'Condiments | G414: 63 | H414: 10977 | I414: 43.9 | J414: 20 | K414: 0 | L414: =RC[-2]*RC[-3] -> 878 | M414: =RC[-2]*RC[-1] -> 0 | N414: =RC[-2]-RC[-1] -> 878
A415: 'FOLKO | B415: 'Folk och fä HB | C415: 23 | D415: 'Karkki Oy | E415: 1 | F415: 'Beverages | G415: 76 | H415: 10434 | I415: 14.4 | J415: 18 | K415: 0.15 | L415: =RC[-2]*RC[-3] -> 259.2 | M415: =RC[-2]*RC[-1] -> 38.88 | N415: =RC[-2]-RC[-1] -> 220.32
A416: 'FOLKO | B416: 'Folk och fä HB | C416: 19 | D416: 'New England Seafood Cannery | E416: 8 | F416: 'Seafood | G416: 41 | H416: 10824 | I416: 9.65 | J416: 12 | K416: 0 | L416: =RC[-2]*RC[-3] -> 115.8 | M416: =RC[-2]*RC[-1] -> 0 | N416: =RC[-2]-RC[-1] -> 115.8
A417: 'FOLKO | B417: 'Folk och fä HB | C417: 12 | D417: 'Plutzer Lebensmittelgroßmärkte AG | E417: 1 | F417: 'Beverages | G417: 75 | H417: 10955 | I417: 7.75 | J417: 12 | K417: 0.2 | L417: =RC[-2]*RC[-3] -> 93 | M417: =RC[-2]*RC[-1] -> 18.6 | N417: =RC[-2]-RC[-1] -> 74.4
A418: 'FOLKO | B418: 'Folk och fä HB | C418: 29 | D418: 'Forêts d'érables | E418: 2 | F418: 'Condiments | G418: 61 | H418: 10880 | I418: 28.5 | J418: 30 | K418: 0.2 | L418: =RC[-2]*RC[-3] -> 855 | M418: =RC[-2]*RC[-1] -> 171 | N418: =RC[-2]-RC[-1] -> 684
A419: 'FOLKO | B419: 'Folk och fä HB | C419: 24 | D419: 'G'day, Mate | E419: 7 | F419: 'Produce | G419: 51 | H419: 10762 | I419: 53 | J419: 28 | K419: 0 | L419: =RC[-2]*RC[-3] -> 1484 | M419: =RC[-2]*RC[-1] -> 0 | N419: =RC[-2]-RC[-1] -> 1484
A420: 'FOLKO | B420: 'Folk och fä HB | C420: 15 | D420: 'Norske Meierier | E420: 4 | F420: 'Dairy Products | G420: 71 | H420: 10378 | I420: 17.2 | J420: 6 | K420: 0 | L420: =RC[-2]*RC[-3] -> 103.2 | M420: =RC[-2]*RC[-1] -> 0 | N420: =RC[-2]-RC[-1] -> 103.2
A421: 'FOLKO | B421: 'Folk och fä HB | C421: 22 | D421: 'Zaanse Snoepfabriek | E421: 3 | F421: 'Confections | G421: 47 | H421: 10762 | I421: 9.5 | J421: 30 | K421: 0 | L421: =RC[-2]*RC[-3] -> 285 | M421: =RC[-2]*RC[-1] -> 0 | N421: =RC[-2]-RC[-1] -> 285
A422: 'FOLKO | B422: 'Folk och fä HB | C422: 19 | D422: 'New England Seafood Cannery | E422: 8 | F422: 'Seafood | G422: 41 | H422: 10993 | I422: 9.65 | J422: 35 | K422: 0.25 | L422: =RC[-2]*RC[-3] -> 337.75 | M422: =RC[-2]*RC[-1] -> 84.4375 | N422: =RC[-2]-RC[-1] -> 253.3125
A423: 'FRANK | B423: 'Frankenversand | C423: 12 | D423: 'Plutzer Lebensmittelgroßmärkte AG | E423: 1 | F423: 'Beverages | G423: 75 | H423: 10929 | I423: 7.75 | J423: 49 | K423: 0 | L423: =RC[-2]*RC[-3] -> 379.75 | M423: =RC[-2]*RC[-1] -> 0 | N423: =RC[-2]-RC[-1] -> 379.75
A424: 'FRANK | B424: 'Frankenversand | C424: 8 | D424: 'Specialty Biscuits, Ltd. | E424: 3 | F424: 'Confections | G424: 19 | H424: 10623 | I424: 9.2 | J424: 15 | K424: 0.1 | L424: =RC[-2]*RC[-3] -> 138 | M424: =RC[-2]*RC[-1] -> 13.8 | N424: =RC[-2]-RC[-1] -> 124.2
A425: 'FRANK | B425: 'Frankenversand | C425: 28 | D425: 'Gai pâturage | E425: 4 | F425: 'Dairy Products | G425: 59 | H425: 10488 | I425: 44 | J425: 30 | K425: 0 | L425: =RC[-2]*RC[-3] -> 1320 | M425: =RC[-2]*RC[-1] -> 0 | N425: =RC[-2]-RC[-1] -> 1320
A426: 'FRANK | B426: 'Frankenversand | C426: 11 | D426: 'Heli Süßwaren GmbH & Co. KG | E426: 3 | F426: 'Confections | G426: 26 | H426: 10337 | I426: 24.9 | J426: 24 | K426: 0 | L426: =RC[-2]*RC[-3] -> 597.6 | M426: =RC[-2]*RC[-1] -> 0 | N426: =RC[-2]-RC[-1] -> 597.6
A427: 'FRANK | B427: 'Frankenversand | C427: 13 | D427: 'Nord-Ost-Fisch Handelsgesellschaft mbH | E427: 8 | F427: 'Seafood | G427: 30 | H427: 10560 | I427: 25.89 | J427: 20 | K427: 0 | L427: =RC[-2]*RC[-3] -> 517.8 | M427: =RC[-2]*RC[-1] -> 0 | N427: =RC[-2]-RC[-1] -> 517.8
A428: 'FRANK | B428: 'Frankenversand | C428: 9 | D428: 'PB Knäckebröd AB | E428: 5 | F428: 'Grains/Cereals | G428: 23 | H428: 10396 | I428: 7.2 | J428: 40 | K428: 0 | L428: =RC[-2]*RC[-3] -> 288 | M428: =RC[-2]*RC[-1] -> 0 | N428: =RC[-2]-RC[-1] -> 288
A429: 'FRANK | B429: 'Frankenversand | C429: 10 | D429: 'Refrescos Americanas LTDA | E429: 1 | F429: 'Beverages | G429: 24 | H429: 10623 | I429: 4.5 | J429: 3 | K429: 0 | L429: =RC[-2]*RC[-3] -> 13.5 | M429: =RC[-2]*RC[-1] -> 0 | N429: =RC[-2]-RC[-1] -> 13.5
A430: 'FRANK | B430: 'Frankenversand | C430: 28 | D430: 'Gai pâturage | E430: 4 | F430: 'Dairy Products | G430: 59 | H430: 10267 | I430: 44 | J430: 70 | K430: 0.15 | L430: =RC[-2]*RC[-3] -> 3080 | M430: =RC[-2]*RC[-1] -> 462 | N430: =RC[-2]-RC[-1] -> 2618
A431: 'FRANK | B431: 'Frankenversand | C431: 17 | D431: 'Svensk Sjöföda AB | E431: 8 | F431: 'Seafood | G431: 36 | H431: 10337 | I431: 15.2 | J431: 20 | K431: 0 | L431: =RC[-2]*RC[-3] -> 304 | M431: =RC[-2]*RC[-1] -> 0 | N431: =RC[-2]-RC[-1] -> 304
A432: 'FRANK | B432: 'Frankenversand | C432: 16 | D432: 'Bigfoot Breweries | E432: 1 | F432: 'Beverages | G432: 35 | H432: 10623 | I432: 18 | J432: 30 | K432: 0.1 | L432: =RC[-2]*RC[-3] -> 540 | M432: =RC[-2]*RC[-1] -> 54 | N432: =RC[-2]-RC[-1] -> 486
A433: 'FRANK | B433: 'Frankenversand | C433: 1 | D433: 'Exotic Liquids | E433: 1 | F433: 'Beverages | G433: 2 | H433: 10342 | I433: 15.2 | J433: 24 | K433: 0.2 | L433: =RC[-2]*RC[-3] -> 364.8 | M433: =RC[-2]*RC[-1] -> 72.96 | N433: =RC[-2]-RC[-1] -> 291.84
A434: 'FRANK | B434: 'Frankenversand | C434: 17 | D434: 'Svensk Sjöföda AB | E434: 8 | F434: 'Seafood | G434: 73 | H434: 10670 | I434: 15 | J434: 50 | K434: 0 | L434: =RC[-2]*RC[-3] -> 750 | M434: =RC[-2]*RC[-1] -> 0 | N434: =RC[-2]-RC[-1] -> 750
A435: 'FRANK | B435: 'Frankenversand | C435: 21 | D435: 'Lyngbysild | E435: 8 | F435: 'Seafood | G435: 46 | H435: 10670 | I435: 12 | J435: 60 | K435: 0 | L435: =RC[-2]*RC[-3] -> 720 | M435: =RC[-2]*RC[-1] -> 0 | N435: =RC[-2]-RC[-1] -> 720
A436: 'FRANK | B436: 'Frankenversand | C436: 9 | D436: 'PB Knäckebröd AB | E436: 5 | F436: 'Grains/Cereals | G436: 23 | H436: 10337 | I436: 7.2 | J436: 40 | K436: 0 | L436: =RC[-2]*RC[-3] -> 288 | M436: =RC[-2]*RC[-1] -> 0 | N436: =RC[-2]-RC[-1] -> 288
A437: 'FRANK | B437: 'Frankenversand | C437: 28 | D437: 'Gai pâturage | E437: 4 | F437: 'Dairy Products | G437: 60 | H437: 10653 | I437: 34 | J437: 20 | K437: 0.1 | L437: =RC[-2]*RC[-3] -> 680 | M437: =RC[-2]*RC[-1] -> 68 | N437: =RC[-2]-RC[-1] -> 612
A438: 'FRANK | B438: 'Frankenversand | C438: 8 | D438: 'Specialty Biscuits, Ltd. | E438: 3 | F438: 'Confections | G438: 21 | H438: 10717 | I438: 10 | J438: 32 | K438: 0.05 | L438: =RC[-2]*RC[-3] -> 320 | M438: =RC[-2]*RC[-1] -> 16 | N438: =RC[-2]-RC[-1] -> 304
A439: 'FRANK | B439: 'Frankenversand | C439: 17 | D439: 'Svensk Sjöföda AB | E439: 8 | F439: 'Seafood | G439: 36 | H439: 10342 | I439: 15.2 | J439: 40 | K439: 0.2 | L439: =RC[-2]*RC[-3] -> 608 | M439: =RC[-2]*RC[-1] -> 121.6 | N439: =RC[-2]-RC[-1] -> 486.4
A440: 'FRANK | B440: 'Frankenversand | C440: 15 | D440: 'Norske Meierier | E440: 4 | F440: 'Dairy Products | G440: 71 | H440: 10396 | I440: 17.2 | J440: 60 | K440: 0 | L440: =RC[-2]*RC[-3] -> 1032 | M440: =RC[-2]*RC[-1] -> 0 | N440: =RC[-2]-RC[-1] -> 1032
A441: 'FRANK | B441: 'Frankenversand | C441: 25 | D441: 'Ma Maison | E441: 6 | F441: 'Meat/Poultry | G441: 54 | H441: 10717 | I441: 7.45 | J441: 15 | K441: 0 | L441: =RC[-2]*RC[-3] -> 111.75 | M441: =RC[-2]*RC[-1] -> 0 | N441: =RC[-2]-RC[-1] -> 111.75
A442: 'FRANK | B442: 'Frankenversand | C442: 25 | D442: 'Ma Maison | E442: 6 | F442: 'Meat/Poultry | G442: 55 | H442: 10342 | I442: 19.2 | J442: 40 | K442: 0.2 | L442: =RC[-2]*RC[-3] -> 768 | M442: =RC[-2]*RC[-1] -> 153.6 | N442: =RC[-2]-RC[-1] -> 614.4
A443: 'QUICK | B443: 'QUICK-Stop | C443: 21 | D443: 'Lyngbysild | E443: 8 | F443: 'Seafood | G443: 45 | H443: 10549 | I443: 9.5 | J443: 100 | K443: 0.15 | L443: =RC[-2]*RC[-3] -> 950 | M443: =RC[-2]*RC[-1] -> 142.5 | N443: =RC[-2]-RC[-1] -> 807.5
A444: 'QUICK | B444: 'QUICK-Stop | C444: 6 | D444: 'Mayumi's | E444: 8 | F444: 'Seafood | G444: 13 | H444: 10938 | I444: 6 | J444: 20 | K444: 0.25 | L444: =RC[-2]*RC[-3] -> 120 | M444: =RC[-2]*RC[-1] -> 30 | N444: =RC[-2]-RC[-1] -> 90
A445: 'QUICK | B445: 'QUICK-Stop | C445: 12 | D445: 'Plutzer Lebensmittelgroßmärkte AG | E445: 6 | F445: 'Meat/Poultry | G445: 29 | H445: 10691 | I445: 123.79 | J445: 40 | K445: 0 | L445: =RC[-2]*RC[-3] -> 4951.6 | M445: =RC[-2]*RC[-1] -> 0 | N445: =RC[-2]-RC[-1] -> 4951.6
A446: 'QUICK | B446: 'QUICK-Stop | C446: 2 | D446: 'New Orleans Cajun Delights | E446: 2 | F446: 'Condiments | G446: 4 | H446: 10527 | I446: 22 | J446: 50 | K446: 0.1 | L446: =RC[-2]*RC[-3] -> 1100 | M446: =RC[-2]*RC[-1] -> 110 | N446: =RC[-2]-RC[-1] -> 990
A447: 'QUICK | B447: 'QUICK-Stop | C447: 2 | D447: 'New Orleans Cajun Delights | E447: 2 | F447: 'Condiments | G447: 65 | H447: 10451 | I447: 16.8 | J447: 28 | K447: 0.1 | L447: =RC[-2]*RC[-3] -> 470.4 | M447: =RC[-2]*RC[-1] -> 47.04 | N447: =RC[-2]-RC[-1] -> 423.36
A448: 'QUICK | B448: 'QUICK-Stop | C448: 8 | D448: 'Specialty Biscuits, Ltd. | E448: 3 | F448: 'Confections | G448: 20 | H448: 10878 | I448: 81 | J448: 20 | K448: 0.05 | L448: =RC[-2]*RC[-3] -> 1620 | M448: =RC[-2]*RC[-1] -> 81 | N448: =RC[-2]-RC[-1] -> 1539
A449: 'QUICK | B449: 'QUICK-Stop | C449: 27 | D449: 'Escargots Nouveaux | E449: 8 | F449: 'Seafood | G449: 58 | H449: 10845 | I449: 13.25 | J449: 60 | K449: 0.1 | L449: =RC[-2]*RC[-3] -> 795 | M449: =RC[-2]*RC[-1] -> 79.5 | N449: =RC[-2]-RC[-1] -> 715.5
A450: 'QUICK | B450: 'QUICK-Stop | C450: 20 | D450: 'Leka Trading | E450: 2 | F450: 'Condiments | G450: 44 | H450: 10691 | I450: 19.45 | J450: 24 | K450: 0 | L450: =RC[-2]*RC[-3] -> 466.8 | M450: =RC[-2]*RC[-1] -> 0 | N450: =RC[-2]-RC[-1] -> 466.8
A451: 'QUICK | B451: 'QUICK-Stop | C451: 14 | D451: 'Formaggi Fortini s.r.l. | E451: 4 | F451: 'Dairy Products | G451: 31 | H451: 10549 | I451: 12.5 | J451: 55 | K451: 0.15 | L451: =RC[-2]*RC[-3] -> 687.5 | M451: =RC[-2]*RC[-1] -> 103.125 | N451: =RC[-2]-RC[-1] -> 584.375
A452: 'QUICK | B452: 'QUICK-Stop | C452: 15 | D452: 'Norske Meierier | E452: 4 | F452: 'Dairy Products | G452: 33 | H452: 10273 | I452: 2 | J452: 20 | K452: 0 | L452: =RC[-2]*RC[-3] -> 40 | M452: =RC[-2]*RC[-1] -> 0 | N452: =RC[-2]-RC[-1] -> 40
A453: 'QUICK | B453: 'QUICK-Stop | C453: 12 | D453: 'Plutzer Lebensmittelgroßmärkte AG | E453: 2 | F453: 'Condiments | G453: 77 | H453: 10658 | I453: 13 | J453: 70 | K453: 0.05 | L453: =RC[-2]*RC[-3] -> 910 | M453: =RC[-2]*RC[-1] -> 45.5 | N453: =RC[-2]-RC[-1] -> 864.5
A454: 'QUICK | B454: 'QUICK-Stop | C454: 15 | D454: 'Norske Meierier | E454: 4 | F454: 'Dairy Products | G454: 33 | H454: 10515 | I454: 2.5 | J454: 16 | K454: 0.15 | L454: =RC[-2]*RC[-3] -> 40 | M454: =RC[-2]*RC[-1] -> 6 | N454: =RC[-2]-RC[-1] -> 34
A455: 'QUICK | B455: 'QUICK-Stop | C455: 17 | D455: 'Svensk Sjöföda AB | E455: 8 | F455: 'Seafood | G455: 36 | H455: 10527 | I455: 19 | J455: 30 | K455: 0.1 | L455: =RC[-2]*RC[-3] -> 570 | M455: =RC[-2]*RC[-1] -> 57 | N455: =RC[-2]-RC[-1] -> 513
A456: 'QUICK | B456: 'QUICK-Stop | C456: 20 | D456: 'Leka Trading | E456: 5 | F456: 'Grains/Cereals | G456: 42 | H456: 10588 | I456: 14 | J456: 100 | K456: 0.2 | L456: =RC[-2]*RC[-3] -> 1400 | M456: =RC[-2]*RC[-1] -> 280 | N456: =RC[-2]-RC[-1] -> 1120
A457: 'QUICK | B457: 'QUICK-Stop | C457: 8 | D457: 'Specialty Biscuits, Ltd. | E457: 3 | F457: 'Confections | G457: 19 | H457: 10788 | I457: 9.2 | J457: 50 | K457: 0.05 | L457: =RC[-2]*RC[-3] -> 460 | M457: =RC[-2]*RC[-1] -> 23 | N457: =RC[-2]-RC[-1] -> 437
A458: 'QUICK | B458: 'QUICK-Stop | C458: 16 | D458: 'Bigfoot Breweries | E458: 1 | F458: 'Beverages | G458: 35 | H458: 10286 | I458: 14.4 | J458: 100 | K458: 0 | L458: =RC[-2]*RC[-3] -> 1440 | M458: =RC[-2]*RC[-1] -> 0 | N458: =RC[-2]-RC[-1] -> 1440
A459: 'QUICK | B459: 'QUICK-Stop | C459: 11 | D459: 'Heli Süßwaren GmbH & Co. KG | E459: 3 | F459: 'Confections | G459: 26 | H459: 10540 | I459: 31.23 | J459: 40 | K459: 0 | L459: =RC[-2]*RC[-3] -> 1249.2 | M459: =RC[-2]*RC[-1] -> 0 | N459: =RC[-2]-RC[-1] -> 1249.2
A460: 'QUICK | B460: 'QUICK-Stop | C460: 4 | D460: 'Tokyo Traders | E460: 6 | F460: 'Meat/Poultry | G460: 9 | H460: 10515 | I460: 97 | J460: 16 | K460: 0.15 | L460: =RC[-2]*RC[-3] -> 1552 | M460: =RC[-2]*RC[-1] -> 232.8 | N460: =RC[-2]-RC[-1] -> 1319.2
A461: 'QUICK | B461: 'QUICK-Stop | C461: 8 | D461: 'Specialty Biscuits, Ltd. | E461: 3 | F461: 'Confections | G461: 20 | H461: 11021 | I461: 81 | J461: 15 | K461: 0 | L461: =RC[-2]*RC[-3] -> 1215 | M461: =RC[-2]*RC[-1] -> 0 | N461: =RC[-2]-RC[-1] -> 1215
A462: 'QUICK | B462: 'QUICK-Stop | C462: 11 | D462: 'Heli Süßwaren GmbH & Co. KG | E462: 3 | F462: 'Confections | G462: 26 | H462: 11021 | I462: 31.23 | J462: 63 | K462: 0 | L462: =RC[-2]*RC[-3] -> 1967.49 | M462: =RC[-2]*RC[-1] -> 0 | N462: =RC[-2]-RC[-1] -> 1967.49
A463: 'QUICK | B463: 'QUICK-Stop | C463: 20 | D463: 'Leka Trading | E463: 2 | F463: 'Condiments | G463: 44 | H463: 10721 | I463: 19.45 | J463: 50 | K463: 0.05 | L463: =RC[-2]*RC[-3] -> 972.5 | M463: =RC[-2]*RC[-1] -> 48.625 | N463: =RC[-2]-RC[-1] -> 923.875
A464: 'QUICK | B464: 'QUICK-Stop | C464: 28 | D464: 'Gai pâturage | E464: 4 | F464: 'Dairy Products | G464: 60 | H464: 10515 | I464: 34 | J464: 84 | K464: 0.15 | L464: =RC[-2]*RC[-3] -> 2856 | M464: =RC[-2]*RC[-1] -> 428.4 | N464: =RC[-2]-RC[-1] -> 2427.6
A465: 'QUICK | B465: 'QUICK-Stop | C465: 6 | D465: 'Mayumi's | E465: 8 | F465: 'Seafood | G465: 13 | H465: 10962 | I465: 6 | J465: 77 | K465: 0 | L465: =RC[-2]*RC[-3] -> 462 | M465: =RC[-2]*RC[-1] -> 0 | N465: =RC[-2]-RC[-1] -> 462
A466: 'QUICK | B466: 'QUICK-Stop | C466: 14 | D466: 'Formaggi Fortini s.r.l. | E466: 4 | F466: 'Dairy Products | G466: 72 | H466: 11021 | I466: 34.8 | J466: 35 | K466: 0 | L466: =RC[-2]*RC[-3] -> 1218 | M466: =RC[-2]*RC[-1] -> 0 | N466: =RC[-2]-RC[-1] -> 1218
A467: 'QUICK | B467: 'QUICK-Stop | C467: 7 | D467: 'Pavlova, Ltd. | E467: 1 | F467: 'Beverages | G467: 70 | H467: 10991 | I467: 15 | J467: 20 | K467: 0.2 | L467: =RC[-2]*RC[-3] -> 300 | M467: =RC[-2]*RC[-1] -> 60 | N467: =RC[-2]-RC[-1] -> 240
A468: 'QUICK | B468: 'QUICK-Stop | C468: 4 | D468: 'Tokyo Traders | E468: 7 | F468: 'Produce | G468: 74 | H468: 10418 | I468: 8 | J468: 15 | K468: 0 | L468: =RC[-2]*RC[-3] -> 120 | M468: =RC[-2]*RC[-1] -> 0 | N468: =RC[-2]-RC[-1] -> 120
A469: 'QUICK | B469: 'QUICK-Stop | C469: 20 | D469: 'Leka Trading | E469: 1 | F469: 'Beverages | G469: 43 | H469: 10938 | I469: 46 | J469: 24 | K469: 0.25 | L469: =RC[-2]*RC[-3] -> 1104 | M469: =RC[-2]*RC[-1] -> 276 | N469: =RC[-2]-RC[-1] -> 828
A470: 'QUICK | B470: 'QUICK-Stop | C470: 20 | D470: 'Leka Trading | E470: 2 | F470: 'Condiments | G470: 44 | H470: 10745 | I470: 19.45 | J470: 16 | K470: 0 | L470: =RC[-2]*RC[-3] -> 311.2 | M470: =RC[-2]*RC[-1] -> 0 | N470: =RC[-2]-RC[-1] -> 311.2
A471: 'QUICK | B471: 'QUICK-Stop | C471: 2 | D471: 'New Orleans Cajun Delights | E471: 2 | F471: 'Condiments | G471: 65 | H471: 10765 | I471: 21.05 | J471: 80 | K471: 0.1 | L471: =RC[-2]*RC[-3] -> 1684 | M471: =RC[-2]*RC[-1] -> 168.4 | N471: =RC[-2]-RC[-1] -> 1515.6
A472: 'QUICK | B472: 'QUICK-Stop | C472: 19 | D472: 'New England Seafood Cannery | E472: 8 | F472: 'Seafood | G472: 40 | H472: 10285 | I472: 14.7 | J472: 40 | K472: 0.2 | L472: =RC[-2]*RC[-3] -> 588 | M472: =RC[-2]*RC[-1] -> 117.6 | N472: =RC[-2]-RC[-1] -> 470.4
A473: 'QUICK | B473: 'QUICK-Stop | C473: 24 | D473: 'G'day, Mate | E473: 6 | F473: 'Meat/Poultry | G473: 53 | H473: 10962 | I473: 32.8 | J473: 20 | K473: 0 | L473: =RC[-2]*RC[-3] -> 656 | M473: =RC[-2]*RC[-1] -> 0 | N473: =RC[-2]-RC[-1] -> 656
A474: 'QUICK | B474: 'QUICK-Stop | C474: 3 | D474: 'Grandma Kelly's Homestead | E474: 7 | F474: 'Produce | G474: 7 | H474: 10694 | I474: 30 | J474: 90 | K474: 0 | L474: =RC[-2]*RC[-3] -> 2700 | M474: =RC[-2]*RC[-1] -> 0 | N474: =RC[-2]-RC[-1] -> 2700
A475: 'QUICK | B475: 'QUICK-Stop | C475: 28 | D475: 'Gai pâturage | E475: 4 | F475: 'Dairy Products | G475: 60 | H475: 10658 | I475: 34 | J475: 55 | K475: 0.05 | L475: =RC[-2]*RC[-3] -> 1870 | M475: =RC[-2]*RC[-1] -> 93.5 | N475: =RC[-2]-RC[-1] -> 1776.5
A476: 'QUICK | B476: 'QUICK-Stop | C476: 20 | D476: 'Leka Trading | E476: 5 | F476: 'Grains/Cereals | G476: 42 | H476: 10996 | I476: 14 | J476: 40 | K476: 0 | L476: =RC[-2]*RC[-3] -> 560 | M476: =RC[-2]*RC[-1] -> 0 | N476: =RC[-2]-RC[-1] -> 560
A477: 'QUICK | B477: 'QUICK-Stop | C477: 17 | D477: 'Svensk Sjöföda AB | E477: 8 | F477: 'Seafood | G477: 36 | H477: 10313 | I477: 15.2 | J477: 12 | K477: 0 | L477: =RC[-2]*RC[-3] -> 182.4 | M477: =RC[-2]*RC[-1] -> 0 | N477: =RC[-2]-RC[-1] -> 182.4
A478: 'QUICK | B478: 'QUICK-Stop | C478: 3 | D478: 'Grandma Kelly's Homestead | E478: 2 | F478: 'Condiments | G478: 8 | H478: 10345 | I478: 32 | J478: 70 | K478: 0 | L478: =RC[-2]*RC[-3] -> 2240 | M478: =RC[-2]*RC[-1] -> 0 | N478: =RC[-2]-RC[-1] -> 2240
A479: 'QUICK | B479: 'QUICK-Stop | C479: 28 | D479: 'Gai pâturage | E479: 4 | F479: 'Dairy Products | G479: 60 | H479: 10938 | I479: 34 | J479: 49 | K479: 0.25 | L479: =RC[-2]*RC[-3] -> 1666 | M479: =RC[-2]*RC[-1] -> 416.5 | N479: =RC[-2]-RC[-1] -> 1249.5
A480: 'QUICK | B480: 'QUICK-Stop | C480: 20 | D480: 'Leka Trading | E480: 5 | F480: 'Grains/Cereals | G480: 42 | H480: 10345 | I480: 11.2 | J480: 9 | K480: 0 | L480: =RC[-2]*RC[-3] -> 100.8 | M480: =RC[-2]*RC[-1] -> 0 | N480: =RC[-2]-RC[-1] -> 100.8
A481: 'QUICK | B481: 'QUICK-Stop | C481: 15 | D481: 'Norske Meierier | E481: 4 | F481: 'Dairy Products | G481: 69 | H481: 10962 | I481: 36 | J481: 9 | K481: 0 | L481: =RC[-2]*RC[-3] -> 324 | M481: =RC[-2]*RC[-1] -> 0 | N481: =RC[-2]-RC[-1] -> 324
A482: 'QUICK | B482: 'QUICK-Stop | C482: 29 | D482: 'Forêts d'érables | E482: 2 | F482: 'Condiments | G482: 61 | H482: 10418 | I482: 22.8 | J482: 16 | K482: 0 | L482: =RC[-2]*RC[-3] -> 364.8 | M482: =RC[-2]*RC[-1] -> 0 | N482: =RC[-2]-RC[-1] -> 364.8
A483: 'QUICK | B483: 'QUICK-Stop | C483: 12 | D483: 'Plutzer Lebensmittelgroßmärkte AG | E483: 1 | F483: 'Beverages | G483: 75 | H483: 10788 | I483: 7.75 | J483: 40 | K483: 0.05 | L483: =RC[-2]*RC[-3] -> 310 | M483: =RC[-2]*RC[-1] -> 15.5 | N483: =RC[-2]-RC[-1] -> 294.5
A484: 'QUICK | B484: 'QUICK-Stop | C484: 3 | D484: 'Grandma Kelly's Homestead | E484: 7 | F484: 'Produce | G484: 7 | H484: 10962 | I484: 30 | J484: 45 | K484: 0 | L484: =RC[-2]*RC[-3] -> 1350 | M484: =RC[-2]*RC[-1] -> 0 | N484: =RC[-2]-RC[-1] -> 1350
A485: 'QUICK | B485: 'QUICK-Stop | C485: 23 | D485: 'Karkki Oy | E485: 1 | F485: 'Beverages | G485: 76 | H485: 10962 | I485: 18 | J485: 44 | K485: 0 | L485: =RC[-2]*RC[-3] -> 792 | M485: =RC[-2]*RC[-1] -> 0 | N485: =RC[-2]-RC[-1] -> 792
A486: 'QUICK | B486: 'QUICK-Stop | C486: 22 | D486: 'Zaanse Snoepfabriek | E486: 3 | F486: 'Confections | G486: 47 | H486: 10418 | I486: 7.6 | J486: 55 | K486: 0 | L486: =RC[-2]*RC[-3] -> 418 | M486: =RC[-2]*RC[-1] -> 0 | N486: =RC[-2]-RC[-1] -> 418
A487: 'QUICK | B487: 'QUICK-Stop | C487: 28 | D487: 'Gai pâturage | E487: 4 | F487: 'Dairy Products | G487: 59 | H487: 10694 | I487: 55 | J487: 25 | K487: 0 | L487: =RC[-2]*RC[-3] -> 1375 | M487: =RC[-2]*RC[-1] -> 0 | N487: =RC[-2]-RC[-1] -> 1375
A488: 'QUICK | B488: 'QUICK-Stop | C488: 15 | D488: 'Norske Meierier | E488: 4 | F488: 'Dairy Products | G488: 71 | H488: 10938 | I488: 21.5 | J488: 35 | K488: 0.25 | L488: =RC[-2]*RC[-3] -> 752.5 | M488: =RC[-2]*RC[-1] -> 188.125 | N488: =RC[-2]-RC[-1] -> 564.375
A489: 'QUICK | B489: 'QUICK-Stop | C489: 12 | D489: 'Plutzer Lebensmittelgroßmärkte AG | E489: 2 | F489: 'Condiments | G489: 77 | H489: 10451 | I489: 10.4 | J489: 55 | K489: 0.1 | L489: =RC[-2]*RC[-3] -> 572 | M489: =RC[-2]*RC[-1] -> 57.2 | N489: =RC[-2]-RC[-1] -> 514.8
A490: 'QUICK | B490: 'QUICK-Stop | C490: 1 | D490: 'Exotic Liquids | E490: 1 | F490: 'Beverages | G490: 1 | H490: 10691 | I490: 18 | J490: 30 | K490: 0 | L490: =RC[-2]*RC[-3] -> 540 | M490: =RC[-2]*RC[-1] -> 0 | N490: =RC[-2]-RC[-1] -> 540
A491: 'QUICK | B491: 'QUICK-Stop | C491: 28 | D491: 'Gai pâturage | E491: 4 | F491: 'Dairy Products | G491: 59 | H491: 10745 | I491: 55 | J491: 45 | K491: 0 | L491: =RC[-2]*RC[-3] -> 2475 | M491: =RC[-2]*RC[-1] -> 0 | N491: =RC[-2]-RC[-1] -> 2475
A492: 'QUICK | B492: 'QUICK-Stop | C492: 19 | D492: 'New England Seafood Cannery | E492: 8 | F492: 'Seafood | G492: 40 | H492: 10658 | I492: 18.4 | J492: 70 | K492: 0.05 | L492: =RC[-2]*RC[-3] -> 1288 | M492: =RC[-2]*RC[-1] -> 64.4 | N492: =RC[-2]-RC[-1] -> 1223.6
A493: 'QUICK | B493: 'QUICK-Stop | C493: 18 | D493: 'Aux joyeux ecclésiastiques | E493: 1 | F493: 'Beverages | G493: 39 | H493: 10361 | I493: 14.4 | J493: 54 | K493: 0.1 | L493: =RC[-2]*RC[-3] -> 777.6 | M493: =RC[-2]*RC[-1] -> 77.76 | N493: =RC[-2]-RC[-1] -> 699.84
A494: 'QUICK | B494: 'QUICK-Stop | C494: 1 | D494: 'Exotic Liquids | E494: 1 | F494: 'Beverages | G494: 2 | H494: 11021 | I494: 19 | J494: 11 | K494: 0.25 | L494: =RC[-2]*RC[-3] -> 209 | M494: =RC[-2]*RC[-1] -> 52.25 | N494: =RC[-2]-RC[-1] -> 156.75
A495: 'QUICK | B495: 'QUICK-Stop | C495: 23 | D495: 'Karkki Oy | E495: 1 | F495: 'Beverages | G495: 76 | H495: 10273 | I495: 14.4 | J495: 33 | K495: 0.05 | L495: =RC[-2]*RC[-3] -> 475.2 | M495: =RC[-2]*RC[-1] -> 23.76 | N495: =RC[-2]-RC[-1] -> 451.44
A496: 'QUICK | B496: 'QUICK-Stop | C496: 18 | D496: 'Aux joyeux ecclésiastiques | E496: 1 | F496: 'Beverages | G496: 38 | H496: 10540 | I496: 263.5 | J496: 30 | K496: 0 | L496: =RC[-2]*RC[-3] -> 7905 | M496: =RC[-2]*RC[-1] -> 0 | N496: =RC[-2]-RC[-1] -> 7905
A497: 'QUICK | B497: 'QUICK-Stop | C497: 24 | D497: 'G'day, Mate | E497: 6 | F497: 'Meat/Poultry | G497: 53 | H497: 10285 | I497: 26.2 | J497: 36 | K497: 0.2 | L497: =RC[-2]*RC[-3] -> 943.2 | M497: =RC[-2]*RC[-1] -> 188.64 | N497: =RC[-2]-RC[-1] -> 754.56
A498: 'QUICK | B498: 'QUICK-Stop | C498: 23 | D498: 'Karkki Oy | E498: 1 | F498: 'Beverages | G498: 76 | H498: 10991 | I498: 18 | J498: 90 | K498: 0.2 | L498: =RC[-2]*RC[-3] -> 1620 | M498: =RC[-2]*RC[-1] -> 324 | N498: =RC[-2]-RC[-1] -> 1296
A499: 'QUICK | B499: 'QUICK-Stop | C499: 8 | D499: 'Specialty Biscuits, Ltd. | E499: 3 | F499: 'Confections | G499: 21 | H499: 10658 | I499: 10 | J499: 60 | K499: 0 | L499: =RC[-2]*RC[-3] -> 600 | M499: =RC[-2]*RC[-1] -> 0 | N499: =RC[-2]-RC[-1] -> 600
A500: 'QUICK | B500: 'QUICK-Stop | C500: 1 | D500: 'Exotic Liquids | E500: 2 | F500: 'Condiments | G500: 3 | H500: 10540 | I500: 10 | J500: 60 | K500: 0 | L500: =RC[-2]*RC[-3] -> 600 | M500: =RC[-2]*RC[-1] -> 0 | N500: =RC[-2]-RC[-1] -> 600
A501: 'QUICK | B501: 'QUICK-Stop | C501: 25 | D501: 'Ma Maison | E501: 6 | F501: 'Meat/Poultry | G501: 55 | H501: 10451 | I501: 19.2 | J501: 120 | K501: 0.1 | L501: =RC[-2]*RC[-3] -> 2304 | M501: =RC[-2]*RC[-1] -> 230.4 | N501: =RC[-2]-RC[-1] -> 2073.6

Sheet: ProductTable
A1: 'Product ID | B1: 'Product Name | C1: 'Supplier | D1: 'Category | E1: 'Quantity Per Unit | F1: 'Unit Price | G1: 'Units In Stock | H1: 'Units On Order | I1: 'Reorder Level
A2: 1 | B2: 'Chai | C2: 'Exotic Liquids | D2: 'Beverages | E2: '10 boxes x 20 bags | F2: 18 | G2: 39 | H2: 0 | I2: 10
A3: 2 | B3: 'Chang | C3: 'Exotic Liquids | D3: 'Beverages | E3: '24 - 12 oz bottles | F3: 19 | G3: 17 | H3: 40 | I3: 25
A4: 3 | B4: 'Aniseed Syrup | C4: 'Exotic Liquids | D4: 'Condiments | E4: '12 - 550 ml bottles | F4: 10 | G4: 13 | H4: 70 | I4: 25
A5: 4 | B5: 'Chef Anton's Cajun Seasoning | C5: 'New Orleans Cajun Delights | D5: 'Condiments | E5: '48 - 6 oz jars | F5: 22 | G5: 53 | H5: 0 | I5: 0
A6: 5 | B6: 'Chef Anton's Gumbo Mix | C6: 'New Orleans Cajun Delights | D6: 'Condiments | E6: '36 boxes | F6: 21.35 | G6: 0 | H6: 0 | I6: 0
A7: 6 | B7: 'Grandma's Boysenberry Spread | C7: 'Grandma Kelly's Homestead | D7: 'Condiments | E7: '12 - 8 oz jars | F7: 25 | G7: 120 | H7: 0 | I7: 25
A8: 7 | B8: 'Uncle Bob's Organic Dried Pears | C8: 'Grandma Kelly's Homestead | D8: 'Produce | E8: '12 - 1 lb pkgs. | F8: 30 | G8: 15 | H8: 0 | I8: 10
A9: 8 | B9: 'Northwoods Cranberry Sauce | C9: 'Grandma Kelly's Homestead | D9: 'Condiments | E9: '12 - 12 oz jars | F9: 40 | G9: 6 | H9: 0 | I9: 0
A10: 9 | B10: 'Mishi Kobe Niku | C10: 'Tokyo Traders | D10: 'Meat/Poultry | E10: '18 - 500 g pkgs. | F10: 97 | G10: 29 | H10: 0 | I10: 0
A11: 10 | B11: 'Ikura | C11: 'Tokyo Traders | D11: 'Seafood | E11: '12 - 200 ml jars | F11: 31 | G11: 31 | H11: 0 | I11: 0
A12: 11 | B12: 'Queso Cabrales | C12: 'Cooperativa de Quesos 'Las Cabras' | D12: 'Dairy Products | E12: '1 kg pkg. | F12: 21 | G12: 22 | H12: 30 | I12: 30
A13: 12 | B13: 'Queso Manchego La Pastora | C13: 'Cooperativa de Quesos 'Las Cabras' | D13: 'Dairy Products | E13: '10 - 500 g pkgs. | F13: 38 | G13: 86 | H13: 0 | I13: 0
A14: 13 | B14: 'Konbu | C14: 'Mayumi's | D14: 'Seafood | E14: '2 kg box | F14: 6 | G14: 24 | H14: 0 | I14: 5
A15: 14 | B15: 'Tofu | C15: 'Mayumi's | D15: 'Produce | E15: '40 - 100 g pkgs. | F15: 23.25 | G15: 35 | H15: 0 | I15: 0
A16: 15 | B16: 'Genen Shouyu | C16: 'Mayumi's | D16: 'Condiments | E16: '24 - 250 ml bottles | F16: 15.5 | G16: 39 | H16: 0 | I16: 5
A17: 16 | B17: 'Pavlova | C17: 'Pavlova, Ltd. | D17: 'Confections | E17: '32 - 500 g boxes | F17: 17.45 | G17: 29 | H17: 0 | I17: 10
A18: 17 | B18: 'Alice Mutton | C18: 'Pavlova, Ltd. | D18: 'Meat/Poultry | E18: '20 - 1 kg tins | F18: 39 | G18: 0 | H18: 0 | I18: 0
A19: 18 | B19: 'Carnarvon Tigers | C19: 'Pavlova, Ltd. | D19: 'Seafood | E19: '16 kg pkg. | F19: 62.5 | G19: 42 | H19: 0 | I19: 0
A20: 19 | B20: 'Teatime Chocolate Biscuits | C20: 'Specialty Biscuits, Ltd. | D20: 'Confections | E20: '10 boxes x 12 pieces | F20: 9.2 | G20: 25 | H20: 0 | I20: 5
A21: 20 | B21: 'Sir Rodney's Marmalade | C21: 'Specialty Biscuits, Ltd. | D21: 'Confections | E21: '30 gift boxes | F21: 81 | G21: 40 | H21: 0 | I21: 0
A22: 21 | B22: 'Sir Rodney's Scones | C22: 'Specialty Biscuits, Ltd. | D22: 'Confections | E22: '24 pkgs. x 4 pieces | F22: 10 | G22: 3 | H22: 40 | I22: 5
A23: 22 | B23: 'Gustaf's Knäckebröd | C23: 'PB Knäckebröd AB | D23: 'Grains/Cereals | E23: '24 - 500 g pkgs. | F23: 21 | G23: 104 | H23: 0 | I23: 25
A24: 23 | B24: 'Tunnbröd | C24: 'PB Knäckebröd AB | D24: 'Grains/Cereals | E24: '12 - 250 g pkgs. | F24: 9 | G24: 61 | H24: 0 | I24: 25
A25: 24 | B25: 'Guaraná Fantástica | C25: 'Refrescos Americanas LTDA | D25: 'Beverages | E25: '12 - 355 ml cans | F25: 4.5 | G25: 20 | H25: 0 | I25: 0
A26: 25 | B26: 'NuNuCa Nuß-Nougat-Creme | C26: 'Heli Süßwaren GmbH & Co. KG | D26: 'Confections | E26: '20 - 450 g glasses | F26: 14 | G26: 76 | H26: 0 | I26: 30
A27: 26 | B27: 'Gumbär Gummibärchen | C27: 'Heli Süßwaren GmbH & Co. KG | D27: 'Confections | E27: '100 - 250 g bags | F27: 31.23 | G27: 15 | H27: 0 | I27: 0
A28: 27 | B28: 'Schoggi Schokolade | C28: 'Heli Süßwaren GmbH & Co. KG | D28: 'Confections | E28: '100 - 100 g pieces | F28: 43.9 | G28: 49 | H28: 0 | I28: 30
A29: 28 | B29: 'Rössle Sauerkraut | C29: 'Plutzer Lebensmittelgroßmärkte AG | D29: 'Produce | E29: '25 - 825 g cans | F29: 45.6 | G29: 26 | H29: 0 | I29: 0
A30: 29 | B30: 'Thüringer Rostbratwurst | C30: 'Plutzer Lebensmittelgroßmärkte AG | D30: 'Meat/Poultry | E30: '50 bags x 30 sausgs. | F30: 123.79 | G30: 0 | H30: 0 | I30: 0
A31: 30 | B31: 'Nord-Ost Matjeshering | C31: 'Nord-Ost-Fisch Handelsgesellschaft mbH | D31: 'Seafood | E31: '10 - 200 g glasses | F31: 25.89 | G31: 10 | H31: 0 | I31: 15
A32: 31 | B32: 'Gorgonzola Telino | C32: 'Formaggi Fortini s.r.l. | D32: 'Dairy Products | E32: '12 - 100 g pkgs | F32: 12.5 | G32: 0 | H32: 70 | I32: 20
A33: 32 | B33: 'Mascarpone Fabioli | C33: 'Formaggi Fortini s.r.l. | D33: 'Dairy Products | E33: '24 - 200 g pkgs. | F33: 32 | G33: 9 | H33: 40 | I33: 25
A34: 33 | B34: 'Geitost | C34: 'Norske Meierier | D34: 'Dairy Products | E34: '500 g | F34: 2.5 | G34: 112 | H34: 0 | I34: 20
A35: 34 | B35: 'Sasquatch Ale | C35: 'Bigfoot Breweries | D35: 'Beverages | E35: '24 - 12 oz bottles | F35: 14 | G35: 111 | H35: 0 | I35: 15
A36: 35 | B36: 'Steeleye Stout | C36: 'Bigfoot Breweries | D36: 'Beverages | E36: '24 - 12 oz bottles | F36: 18 | G36: 20 | H36: 0 | I36: 15
A37: 36 | B37: 'Inlagd Sill | C37: 'Svensk Sjöföda AB | D37: 'Seafood | E37: '24 - 250 g jars | F37: 19 | G37: 112 | H37: 0 | I37: 20
A38: 37 | B38: 'Gravad lax | C38: 'Svensk Sjöföda AB | D38: 'Seafood | E38: '12 - 500 g pkgs. | F38: 26 | G38: 11 | H38: 50 | I38: 25
A39: 38 | B39: 'Côte de Blaye | C39: 'Aux joyeux ecclésiastiques | D39: 'Beverages | E39: '12 - 75 cl bottles | F39: 263.5 | G39: 17 | H39: 0 | I39: 15
A40: 39 | B40: 'Chartreuse verte | C40: 'Aux joyeux ecclésiastiques | D40: 'Beverages | E40: '750 cc per bottle | F40: 18 | G40: 69 | H40: 0 | I40: 5
A41: 40 | B41: 'Boston Crab Meat | C41: 'New England Seafood Cannery | D41: 'Seafood | E41: '24 - 4 oz tins | F41: 18.4 | G41: 123 | H41: 0 | I41: 30
A42: 41 | B42: 'Jack's New England Clam Chowder | C42: 'New England Seafood Cannery | D42: 'Seafood | E42: '12 - 12 oz cans | F42: 9.65 | G42: 85 | H42: 0 | I42: 10
A43: 42 | B43: 'Singaporean Hokkien Fried Mee | C43: 'Leka Trading | D43: 'Grains/Cereals | E43: '32 - 1 kg pkgs. | F43: 14 | G43: 26 | H43: 0 | I43: 0
A44: 43 | B44: 'Ipoh Coffee | C44: 'Leka Trading | D44: 'Beverages | E44: '16 - 500 g tins | F44: 46 | G44: 17 | H44: 10 | I44: 25
A45: 44 | B45: 'Gula Malacca | C45: 'Leka Trading | D45: 'Condiments | E45: '20 - 2 kg bags | F45: 19.45 | G45: 27 | H45: 0 | I45: 15
A46: 45 | B46: 'Røgede sild | C46: 'Lyngbysild | D46: 'Seafood | E46: '1k pkg. | F46: 9.5 | G46: 5 | H46: 70 | I46: 15
A47: 46 | B47: 'Spegesild | C47: 'Lyngbysild | D47: 'Seafood | E47: '4 - 450 g glasses | F47: 12 | G47: 95 | H47: 0 | I47: 0
A48: 47 | B48: 'Zaanse koeken | C48: 'Zaanse Snoepfabriek | D48: 'Confections | E48: '10 - 4 oz boxes | F48: 9.5 | G48: 36 | H48: 0 | I48: 0
A49: 48 | B49: 'Chocolade | C49: 'Zaanse Snoepfabriek | D49: 'Confections | E49: '10 pkgs. | F49: 12.75 | G49: 15 | H49: 70 | I49: 25
A50: 49 | B50: 'Maxilaku | C50: 'Karkki Oy | D50: 'Confections | E50: '24 - 50 g pkgs. | F50: 20 | G50: 10 | H50: 60 | I50: 15
A51: 50 | B51: 'Valkoinen suklaa | C51: 'Karkki Oy | D51: 'Confections | E51: '12 - 100 g bars | F51: 16.25 | G51: 65 | H51: 0 | I51: 30
A52: 51 | B52: 'Manjimup Dried Apples | C52: 'G'day, Mate | D52: 'Produce | E52: '50 - 300 g pkgs. | F52: 53 | G52: 20 | H52: 0 | I52: 10
A53: 52 | B53: 'Filo Mix | C53: 'G'day, Mate | D53: 'Grains/Cereals | E53: '16 - 2 kg boxes | F53: 7 | G53: 38 | H53: 0 | I53: 25
A54: 53 | B54: 'Perth Pasties | C54: 'G'day, Mate | D54: 'Meat/Poultry | E54: '48 pieces | F54: 32.8 | G54: 0 | H54: 0 | I54: 0
A55: 54 | B55: 'Tourtière | C55: 'Ma Maison | D55: 'Meat/Poultry | E55: '16 pies | F55: 7.45 | G55: 21 | H55: 0 | I55: 10
A56: 55 | B56: 'Pâté chinois | C56: 'Ma Maison | D56: 'Meat/Poultry | E56: '24 boxes x 2 pies | F56: 24 | G56: 115 | H56: 0 | I56: 20
A57: 56 | B57: 'Gnocchi di nonna Alice | C57: 'Pasta Buttini s.r.l. | D57: 'Grains/Cereals | E57: '24 - 250 g pkgs. | F57: 38 | G57: 21 | H57: 10 | I57: 30
A58: 57 | B58: 'Ravioli Angelo | C58: 'Pasta Buttini s.r.l. | D58: 'Grains/Cereals | E58: '24 - 250 g pkgs. | F58: 19.5 | G58: 36 | H58: 0 | I58: 20
A59: 58 | B59: 'Escargots de Bourgogne | C59: 'Escargots Nouveaux | D59: 'Seafood | E59: '24 pieces | F59: 13.25 | G59: 62 | H59: 0 | I59: 20
A60: 59 | B60: 'Raclette Courdavault | C60: 'Gai pâturage | D60: 'Dairy Products | E60: '5 kg pkg. | F60: 55 | G60: 79 | H60: 0 | I60: 0
A61: 60 | B61: 'Camembert Pierrot | C61: 'Gai pâturage | D61: 'Dairy Products | E61: '15 - 300 g rounds | F61: 34 | G61: 19 | H61: 0 | I61: 0
A62: 61 | B62: 'Sirop d'érable | C62: 'Forêts d'érables | D62: 'Condiments | E62: '24 - 500 ml bottles | F62: 28.5 | G62: 113 | H62: 0 | I62: 25
A63: 62 | B63: 'Tarte au sucre | C63: 'Forêts d'érables | D63: 'Confections | E63: '48 pies | F63: 49.3 | G63: 17 | H63: 0 | I63: 0
A64: 63 | B64: 'Vegie-spread | C64: 'Pavlova, Ltd. | D64: 'Condiments | E64: '15 - 625 g jars | F64: 43.9 | G64: 24 | H64: 0 | I64: 5
A65: 64 | B65: 'Wimmers gute Semmelknödel | C65: 'Plutzer Lebensmittelgroßmärkte AG | D65: 'Grains/Cereals | E65: '20 bags x 4 pieces | F65: 33.25 | G65: 22 | H65: 80 | I65: 30
A66: 65 | B66: 'Louisiana Fiery Hot Pepper Sauce | C66: 'New Orleans Cajun Delights | D66: 'Condiments | E66: '32 - 8 oz bottles | F66: 21.05 | G66: 76 | H66: 0 | I66: 0
A67: 66 | B67: 'Louisiana Hot Spiced Okra | C67: 'New Orleans Cajun Delights | D67: 'Condiments | E67: '24 - 8 oz jars | F67: 17 | G67: 4 | H67: 100 | I67: 20
A68: 67 | B68: 'Laughing Lumberjack Lager | C68: 'Bigfoot Breweries | D68: 'Beverages | E68: '24 - 12 oz bottles | F68: 14 | G68: 52 | H68: 0 | I68: 10
A69: 68 | B69: 'Scottish Longbreads | C69: 'Specialty Biscuits, Ltd. | D69: 'Confections | E69: '10 boxes x 8 pieces | F69: 12.5 | G69: 6 | H69: 10 | I69: 15
A70: 69 | B70: 'Gudbrandsdalsost | C70: 'Norske Meierier | D70: 'Dairy Products | E70: '10 kg pkg. | F70: 36 | G70: 26 | H70: 0 | I70: 15
A71: 70 | B71: 'Outback Lager | C71: 'Pavlova, Ltd. | D71: 'Beverages | E71: '24 - 355 ml bottles | F71: 15 | G71: 15 | H71: 10 | I71: 30
A72: 71 | B72: 'Fløtemysost | C72: 'Norske Meierier | D72: 'Dairy Products | E72: '10 - 500 g pkgs. | F72: 21.5 | G72: 26 | H72: 0 | I72: 0
A73: 72 | B73: 'Mozzarella di Giovanni | C73: 'Formaggi Fortini s.r.l. | D73: 'Dairy Products | E73: '24 - 200 g pkgs. | F73: 34.8 | G73: 14 | H73: 0 | I73: 0
A74: 73 | B74: 'Röd Kaviar | C74: 'Svensk Sjöföda AB | D74: 'Seafood | E74: '24 - 150 g jars | F74: 15 | G74: 101 | H74: 0 | I74: 5
A75: 74 | B75: 'Longlife Tofu | C75: 'Tokyo Traders | D75: 'Produce | E75: '5 kg pkg. | F75: 10 | G75: 4 | H75: 20 | I75: 5
A76: 75 | B76: 'Rhönbräu Klosterbier | C76: 'Plutzer Lebensmittelgroßmärkte AG | D76: 'Beverages | E76: '24 - 0.5 l bottles | F76: 7.75 | G76: 125 | H76: 0 | I76: 25
A77: 76 | B77: 'Lakkalikööri | C77: 'Karkki Oy | D77: 'Beverages | E77: '500 ml | F77: 18 | G77: 57 | H77: 0 | I77: 20
A78: 77 | B78: 'Original Frankfurter grüne Soße | C78: 'Plutzer Lebensmittelgroßmärkte AG | D78: 'Condiments | E78: '12 boxes | F78: 13 | G78: 32 | H78: 0 | I78: 15

Sheet: @SDF
A1: =DEFINE("IS_BEVERAGE_OR_DAIRY", RC[+1], RC[+2]) -> FUN IS_BEVERAGE_OR_DAIRY AT #4 | B1: =OR(EQUAL(RC[+1], Criteria!R[+14]C[+1]), EQUAL(RC[+1], Criteria!R[+15]C[+1])) -> #EMPTY!
A2: =DEFINE("IS_SEAFOOD", RC[+1], RC[+2]) -> FUN IS_SEAFOOD AT #5 | B2: =EQUAL(Criteria!R[+13]C[+2], RC[+1]) -> #EMPTY!
A3: =DEFINE("IS_PRODUCE", RC[+1], RC[+2]) -> FUN IS_PRODUCE AT #6 | B3: =EQUAL(Criteria!R[+12]C[+3], RC[+1]) -> #EMPTY!
A5: =DEFINE("SUMIF2_HELPER", RC[+1], RC[+2], RC[+3], RC[+4]) -> FUN SUMIF2_HELPER AT #7 | B5: =IF(APPLY(RC[+1], RC[+2]), RC[+3], 0) -> #EMPTY!
A6: =DEFINE("SUMIF2", RC[+1], RC[+2], RC[+3]) -> FUN SUMIF2 AT #8 | B6: =SUM(ROWMAP(CLOSURE("SUMIF2_HELPER", RC[+1], NA(), NA()), RC[+2])) -> #EMPTY!
A8: =DEFINE("AVGIF2", RC[+1], RC[+2], RC[+3]) -> FUN AVGIF2 AT #9 | B8: =SUMIF2(RC[+1], RC[+2])/COUNTIF(RC[+1], SLICE(RC[+2], 1, 1, ROWS(RC[+2]), 1)) -> #EMPTY!
A10: =DEFINE("COUNTIF2_HELPER", RC[+1], RC[+2], RC[+3], RC[+4], RC[+5]) -> FUN COUNTIF2_HELPER AT #10 | B10: =AND(APPLY(RC[+1], RC[+3]), APPLY(RC[+2], RC[+4])) -> #EMPTY!
A11: =DEFINE("COUNTIF2", RC[+1], RC[+2], RC[+3], RC[+4]) -> FUN COUNTIF2 AT #11 | B11: =SUM(ROWMAP(CLOSURE("COUNTIF2_HELPER", RC[+1], RC[+2], NA(), NA()), RC[+3])) -> #EMPTY!
A13: =DEFINE("COUNTIF3_HELPER", RC[+1], RC[+2], RC[+3], RC[+4], RC[+5], RC[+6], RC[+7]) -> FUN COUNTIF3_HELPER AT #12 | B13: =AND(APPLY(RC[+1], RC[+4]), APPLY(RC[+2], RC[+5]), APPLY(RC[+3], RC[+6])) -> #EMPTY!
A14: =DEFINE("COUNTIF3", RC[+1], RC[+2], RC[+3], RC[+4], RC[+5]) -> FUN COUNTIF3 AT #13 | B14: =SUM(ROWMAP(CLOSURE("COUNTIF3_HELPER", RC[+1], RC[+2], RC[+3], NA(), NA(), NA()), RC[+4])) -> #EMPTY!

Sheet: @Lookup
A1: Excel-style lookup functions implemented as sheet-defined functions
A3: =DEFINE("matchcolaux",R[8]C[1],R[1]C[1],R[2]C[1],R[3]C[1],R[4]C[1]) -> #NAME? | B3: MATCHCOLAUX(x, arr, a, b)
A4: x =
A5: arr =
A6: a =
A7: b =
A8: m = | B8: =CEILING((R[-2]C+R[-1]C)/2, 1) -> 0
B9: =matchcolaux(R[-5]C,R[-4]C,R[-1]C,R[-2]C) -> #NAME?
B10: =matchcolaux(R[-6]C,R[-5]C,R[-4]C,R[-2]C-1) -> #NAME?
A11: result = | B11: =IF(R[-5]C>R[-4]C,NA(), IF(INDEX(R[-6]C,1,R[-4]C)<=R[-7]C, R[-4]C, IF(INDEX(R[-6]C,1, R[-3]C)<=R[-7]C, R[-2]C,R[-1]C))) -> 0
A13: =DEFINE("matchrowaux",R[6]C[1],R[1]C[1],R[2]C[1],R[3]C[1],R[4]C[1]) -> #NAME? | B13: MATCHROWAUX(x, arr, a, b)
A14: x =
A15: arr =
A16: a =
A17: b =
A18: m = | B18: =CEILING((R[-2]C+R[-1]C)/2, 1) -> 0
A19: result = | B19: =IF(R[-3]C>R[-2]C,NA(), IF(INDEX(R[-4]C,R[-2]C,1)<=R[-5]C, R[-2]C, IF(INDEX(R[-4]C,R[-1]C,1)<=R[-5]C, matchrowaux(R[-5]C,R[-4]C,R[-1]C,R[-2]C),matchrowaux(R[-5]C,R[-4]C,R[-3]C,R[-1]C-1)))) -> 0
A21: =DEFINE("match",R[3]C[1],R[1]C[1],R[2]C[1]) -> #NAME? | B21: MATCH(x,arr)
A22: x =
A23: arr =
A24: result = | B24: =IF(ROWS(R[-1]C)=1,matchcolaux(R[-2]C,R[-1]C,1,COLUMNS(R[-1]C)), matchrowaux(R[-2]C,R[-1]C,1,ROWS(R[-1]C))) -> #NAME?
A26: =DEFINE("hlookup",R[4]C[1],R[1]C[1],R[2]C[1],R[3]C[1]) -> #NAME? | B26: HLOOKUP(x, arr, r)
A27: x =
A28: arr =
A29: r =
A30: result = | B30: =INDEX(R[-2]C, R[-1]C, matchcolaux(R[-3]C, R[-2]C, 1, COLUMNS(R[-2]C))) -> #NAME?
A32: =DEFINE("vlookup",R[4]C[1],R[1]C[1],R[2]C[1],R[3]C[1]) -> #NAME? | B32: VLOOKUP(x, arr, r)
A33: x =
A34: arr =
A35: c =
A36: result = | B36: =INDEX(R[-2]C, matchrowaux(R[-3]C, R[-2]C, 1, ROWS(R[-2]C)), R[-1]C) -> #NAME?
A38: =DEFINE("interpolaterow",R[8]C[1],R[1]C[1],R[2]C[1],R[3]C[1]) -> #NAME? | B38: INTERPOLATEROW(ts,xs,t) | D38: Linear interpolation in two row vectors
A39: ts = | B39: =hcat(1,10,100) -> #NAME?
A40: xs = | B40: =hcat(3,30,300) -> #NAME?
A41: t = | B41: 5
A42: max i st ts(i)<=t | B42: =MATCH(R[-1]C,R[-3]C) -> #N/A
A43: ts(i+1) = | B43: =INDEX(R[-4]C,1,R[-1]C+1) -> #N/A
A44: ts(i) = | B44: =INDEX(R[-5]C,1,R[-2]C) -> #N/A
A45: interpolate | B45: =(INDEX(R[-5]C,1,R[-3]C)*(R[-2]C-R[-4]C)+INDEX(R[-5]C,1,R[-3]C+1)*(R[-4]C-R[-1]C))/(R[-2]C-R[-1]C) -> #N/A
B46: =IF(R[-5]C<=INDEX(R[-7]C,1,1), INDEX(R[-6]C,1,1), IF(R[-4]C=COLUMNS(R[-7]C),INDEX(R[-6]C,1,R[-4]C),R[-1]C)) -> #NAME?