Sheet: Pulse width data
A1: 'Lens | B1: 'pot | C1: 'width (cm) | D1: 'bdot (V) | E1: 'scale factor | F1: 'width (us) | H1: 'calculated primary effective resistance | I1: 'bins | O1: 'bins | P1: 'output
A2: 27 | B2: 6.35 | C2: 12.75 | D2: 4.8 | E2: =500/16.92 -> 29.5508274231678 | F2: =RC[-1]*RC[-3] -> 376.77304964539 | G2: =RC[-4] -> 12.75 | H2: =-0.0043*RC[-2]^2+3.7742*RC[-2]-807.78 -> 3.81774093355466 | I2: 12.5 | J2: 'Bin | K2: 'Frequency | L2: 'Bin | M2: 'Frequency | O2: 370 | P2: 'Bin | Q2: 'Frequency | R2: 'Bin | S2: 'Frequency
A3: 27 | B3: 6.35 | C3: 12.75 | D3: 4.76 | E3: =500/16.92 -> 29.5508274231678 | F3: =RC[-1]*RC[-3] -> 376.77304964539 | G3: =RC[-4] -> 12.75 | H3: =-0.0043*RC[-2]^2+3.7742*RC[-2]-807.78 -> 3.81774093355466 | I3: 12.55 | J3: 12.5 | K3: 0 | L3: 12.65 | M3: 1 | O3: 371 | P3: 370 | Q3: 0 | R3: 374 | S3: 1
A4: 27 | B4: 6.35 | C4: 12.7 | D4: 4.76 | E4: =500/16.92 -> 29.5508274231678 | F4: =RC[-1]*RC[-3] -> 375.295508274232 | G4: =RC[-4] -> 12.7 | H4: =-0.0043*RC[-2]^2+3.7742*RC[-2]-807.78 -> 3.01941764610558 | I4: 12.6 | J4: 12.55 | K4: 0 | L4: 12.7 | M4: 10 | O4: 372 | P4: 371 | Q4: 0 | R4: 376 | S4: 11
A5: 27 | B5: 6.38 | C5: 12.8 | D5: 4.8 | E5: =500/16.92 -> 29.5508274231678 | F5: =RC[-1]*RC[-3] -> 378.250591016548 | G5: =RC[-4] -> 12.8 | H5: =-0.0043*RC[-2]^2+3.7742*RC[-2]-807.78 -> 4.59728931587392 | I5: 12.65 | J5: 12.6 | K5: 0 | L5: 12.75 | M5: 9 | O5: 373 | P5: 372 | Q5: 0 | R5: 377 | S5: 8
A6: 27 | B6: 6.4 | C6: 12.8 | D6: 4.76 | E6: =500/16.92 -> 29.5508274231678 | F6: =RC[-1]*RC[-3] -> 378.250591016548 | G6: =RC[-4] -> 12.8 | H6: =-0.0043*RC[-2]^2+3.7742*RC[-2]-807.78 -> 4.59728931587392 | I6: 12.7 | J6: 12.65 | K6: 1 | L6: 12.8 | M6: 18 | O6: 374 | P6: 373 | Q6: 0 | R6: 379 | S6: 19
A7: 27 | B7: 6.4 | C7: 12.72 | D7: 4.76 | E7: =500/16.92 -> 29.5508274231678 | F7: =RC[-1]*RC[-3] -> 375.886524822695 | G7: =RC[-4] -> 12.72 | H7: =-0.0043*RC[-2]^2+3.7742*RC[-2]-807.78 -> 3.34099994970063 | I7: 12.75 | J7: 12.7 | K7: 10 | L7: 12.85 | M7: 1 | O7: 375 | P7: 374 | Q7: 1 | R7: 382 | S7: 2
A8: 27 | B8: 6 | C8: 12.7 | D8: 4.64 | E8: =500/16.92 -> 29.5508274231678 | F8: =RC[-1]*RC[-3] -> 375.295508274232 | G8: =RC[-4] -> 12.7 | H8: =-0.0043*RC[-2]^2+3.7742*RC[-2]-807.78 -> 3.01941764610558 | I8: 12.8 | J8: 12.75 | K8: 9 | L8: 12.9 | M8: 2 | O8: 376 | P8: 375 | Q8: 0 | R8: 370 | S8: 0
A9: 27 | B9: 5 | C9: 12.75 | D9: 4.28 | E9: =500/16.92 -> 29.5508274231678 | F9: =RC[-1]*RC[-3] -> 376.77304964539 | G9: =RC[-4] -> 12.75 | H9: =-0.0043*RC[-2]^2+3.7742*RC[-2]-807.78 -> 3.81774093355466 | I9: 12.85 | J9: 12.8 | K9: 18 | L9: 12.5 | M9: 0 | O9: 377 | P9: 376 | Q9: 11 | R9: 371 | S9: 0
A10: 27 | B10: 4 | C10: 12.7 | D10: 3.88 | E10: =500/16.92 -> 29.5508274231678 | F10: =RC[-1]*RC[-3] -> 375.295508274232 | G10: =RC[-4] -> 12.7 | H10: =-0.0043*RC[-2]^2+3.7742*RC[-2]-807.78 -> 3.01941764610558 | I10: 12.9 | J10: 12.85 | K10: 1 | L10: 12.55 | M10: 0 | O10: 378 | P10: 377 | Q10: 8 | R10: 372 | S10: 0
A11: 27 | B11: 3 | C11: 12.7 | D11: 3.52 | E11: =500/16.92 -> 29.5508274231678 | F11: =RC[-1]*RC[-3] -> 375.295508274232 | G11: =RC[-4] -> 12.7 | H11: =-0.0043*RC[-2]^2+3.7742*RC[-2]-807.78 -> 3.01941764610558 | I11: 12.95 | J11: 12.9 | K11: 2 | L11: 12.6 | M11: 0 | O11: 379 | P11: 378 | Q11: 0 | R11: 373 | S11: 0
A12: 27 | B12: 2 | C12: 12.65 | D12: 3.04 | E12: =500/16.92 -> 29.5508274231678 | F12: =RC[-1]*RC[-3] -> 373.817966903073 | G12: =RC[-4] -> 12.65 | H12: =-0.0043*RC[-2]^2+3.7742*RC[-2]-807.78 -> 2.20231945352623 | I12: 13 | J12: 12.95 | K12: 0 | L12: 12.95 | M12: 0 | O12: 380 | P12: 379 | Q12: 19 | R12: 375 | S12: 0
A13: 27 | B13: 1 | C13: 12.7 | D13: 2.67 | E13: =500/16.92 -> 29.5508274231678 | F13: =RC[-1]*RC[-3] -> 375.295508274232 | G13: =RC[-4] -> 12.7 | H13: =-0.0043*RC[-2]^2+3.7742*RC[-2]-807.78 -> 3.01941764610558 | J13: 13 | K13: 0 | L13: 13 | M13: 0 | O13: 381 | P13: 380 | Q13: 0 | R13: 378 | S13: 0
A14: 27 | B14: 0 | C14: 12.8 | D14: 2.24 | E14: =500/16.92 -> 29.5508274231678 | F14: =RC[-1]*RC[-3] -> 378.250591016548 | G14: =RC[-4] -> 12.8 | H14: =-0.0043*RC[-2]^2+3.7742*RC[-2]-807.78 -> 4.59728931587392 | J14: 'More | K14: 0 | L14: 'More | M14: 0 | O14: 382 | P14: 381 | Q14: 0 | R14: 380 | S14: 0
A15: 27 | B15: 5.65 | C15: 12.8 | D15: 4.36 | E15: =500/16.92 -> 29.5508274231678 | F15: =RC[-1]*RC[-3] -> 378.250591016548 | G15: =RC[-4] -> 12.8 | H15: =-0.0043*RC[-2]^2+3.7742*RC[-2]-807.78 -> 4.59728931587392 | O15: 383 | P15: 382 | Q15: 2 | R15: 381 | S15: 0
A16: 27 | B16: 5.65 | C16: 12.7 | D16: 4.4 | E16: =500/16.92 -> 29.5508274231678 | F16: =RC[-1]*RC[-3] -> 375.295508274232 | G16: =RC[-4] -> 12.7 | H16: =-0.0043*RC[-2]^2+3.7742*RC[-2]-807.78 -> 3.01941764610558 | O16: 384 | P16: 383 | Q16: 0 | R16: 383 | S16: 0
A17: 27 | B17: 5.5 | C17: 12.75 | D17: 4.32 | E17: =500/16.92 -> 29.5508274231678 | F17: =RC[-1]*RC[-3] -> 376.77304964539 | G17: =RC[-4] -> 12.75 | H17: =-0.0043*RC[-2]^2+3.7742*RC[-2]-807.78 -> 3.81774093355466 | O17: 385 | P17: 384 | Q17: 0 | R17: 384 | S17: 0
A18: 27 | B18: 5.5 | C18: 12.82 | D18: 4.28 | E18: =500/16.92 -> 29.5508274231678 | F18: =RC[-1]*RC[-3] -> 378.841607565012 | G18: =RC[-4] -> 12.82 | H18: =-0.0043*RC[-2]^2+3.7742*RC[-2]-807.78 -> 4.90385169536523 | P18: 385 | Q18: 0 | R18: 385 | S18: 0
A19: 27 | B19: 5.5 | C19: 12.8 | D19: 4.36 | E19: =500/16.92 -> 29.5508274231678 | F19: =RC[-1]*RC[-3] -> 378.250591016548 | G19: =RC[-4] -> 12.8 | H19: =-0.0043*RC[-2]^2+3.7742*RC[-2]-807.78 -> 4.59728931587392 | P19: 'More | Q19: 0 | R19: 'More | S19: 0
A20: 27 | B20: 0 | C20: 12.8 | D20: 2.28 | E20: =500/16.92 -> 29.5508274231678 | F20: =RC[-1]*RC[-3] -> 378.250591016548 | G20: =RC[-4] -> 12.8 | H20: =-0.0043*RC[-2]^2+3.7742*RC[-2]-807.78 -> 4.59728931587392 | Q20: =SUM(R[-17]C:R[-1]C) -> 41
A21: 27 | C21: 6.4 | D21: 4.32 | E21: =1000/16.9 -> 59.1715976331361 | F21: =RC[-1]*RC[-3] -> 378.698224852071 | G21: =2*RC[-4] -> 12.8 | H21: =-0.0043*RC[-2]^2+3.7742*RC[-2]-807.78 -> 4.82975456041459
A22: 27 | B22: 5.5 | C22: 6.4 | D22: 4.28 | E22: =1000/16.9 -> 59.1715976331361 | F22: =RC[-1]*RC[-3] -> 378.698224852071 | G22: =2*RC[-4] -> 12.8 | H22: =-0.0043*RC[-2]^2+3.7742*RC[-2]-807.78 -> 4.82975456041459 | Q22: 'From spice analysis come the following values
A23: 27 | B23: 5.5 | C23: 6.4 | D23: 4.32 | E23: =1000/16.9 -> 59.1715976331361 | F23: =RC[-1]*RC[-3] -> 378.698224852071 | G23: =2*RC[-4] -> 12.8 | H23: =-0.0043*RC[-2]^2+3.7742*RC[-2]-807.78 -> 4.82975456041459 | P23: 'milliohms | Q23: 13.5 | R23: 27 | S23: 6.75 | T23: 9 | U23: 15 | V23: 20 | W23: 5
A24: 27 | B24: 5 | C24: 6.35 | D24: 4.16 | E24: =1000/16.9 -> 59.1715976331361 | F24: =RC[-1]*RC[-3] -> 375.739644970414 | G24: =2*RC[-4] -> 12.7 | H24: =-0.0043*RC[-2]^2+3.7742*RC[-2]-807.78 -> 3.26136059661781 | P24: 'period | Q24: 384.9 | R24: 440.4 | S24: 374 | T24: 376.7 | U24: 388.58 | V24: 404.7 | W24: 371.8
A25: 27 | B25: 4 | C25: 6.45 | D25: 3.84 | E25: =1000/16.9 -> 59.1715976331361 | F25: =RC[-1]*RC[-3] -> 381.656804733728 | G25: =2*RC[-4] -> 12.9 | H25: =-0.0043*RC[-2]^2+3.7742*RC[-2]-807.78 -> 6.32287104793249
A26: 27 | C26: 6.45 | D26: 4.36 | E26: =1000/16.9 -> 59.1715976331361 | F26: =RC[-1]*RC[-3] -> 381.656804733728 | G26: =2*RC[-4] -> 12.9 | H26: =-0.0043*RC[-2]^2+3.7742*RC[-2]-807.78 -> 6.32287104793249
A27: 27 | B27: 5.7 | C27: 6.4 | D27: 4.52 | E27: =1000/16.9 -> 59.1715976331361 | F27: =RC[-1]*RC[-3] -> 378.698224852071 | G27: =2*RC[-4] -> 12.8 | H27: =-0.0043*RC[-2]^2+3.7742*RC[-2]-807.78 -> 4.82975456041459
A28: 27 | B28: 5.5 | C28: 6.4 | D28: 4.4 | E28: =1000/16.9 -> 59.1715976331361 | F28: =RC[-1]*RC[-3] -> 378.698224852071 | G28: =2*RC[-4] -> 12.8 | H28: =-0.0043*RC[-2]^2+3.7742*RC[-2]-807.78 -> 4.82975456041459
A29: 27 | B29: 5 | C29: 6.35 | D29: 4.24 | E29: =1000/16.9 -> 59.1715976331361 | F29: =RC[-1]*RC[-3] -> 375.739644970414 | G29: =2*RC[-4] -> 12.7 | H29: =-0.0043*RC[-2]^2+3.7742*RC[-2]-807.78 -> 3.26136059661781
A30: 27 | B30: 4 | C30: 6.4 | D30: 3.88 | E30: =1000/16.9 -> 59.1715976331361 | F30: =RC[-1]*RC[-3] -> 378.698224852071 | G30: =2*RC[-4] -> 12.8 | H30: =-0.0043*RC[-2]^2+3.7742*RC[-2]-807.78 -> 4.82975456041459
A31: 27 | B31: 3 | C31: 6.35 | D31: 3.48 | E31: =1000/16.9 -> 59.1715976331361 | F31: =RC[-1]*RC[-3] -> 375.739644970414 | G31: =2*RC[-4] -> 12.7 | H31: =-0.0043*RC[-2]^2+3.7742*RC[-2]-807.78 -> 3.26136059661781
A32: 27 | B32: 2 | C32: 6.4 | D32: 3.12 | E32: =1000/16.9 -> 59.1715976331361 | F32: =RC[-1]*RC[-3] -> 378.698224852071 | G32: =2*RC[-4] -> 12.8 | H32: =-0.0043*RC[-2]^2+3.7742*RC[-2]-807.78 -> 4.82975456041459
A33: 27 | B33: 1 | C33: 6.4 | D33: 2.64 | E33: =1000/16.9 -> 59.1715976331361 | F33: =RC[-1]*RC[-3] -> 378.698224852071 | G33: =2*RC[-4] -> 12.8 | H33: =-0.0043*RC[-2]^2+3.7742*RC[-2]-807.78 -> 4.82975456041459
A34: 27 | B34: 0 | C34: 6.4 | D34: 2.16 | E34: =1000/16.9 -> 59.1715976331361 | F34: =RC[-1]*RC[-3] -> 378.698224852071 | G34: =2*RC[-4] -> 12.8 | H34: =-0.0043*RC[-2]^2+3.7742*RC[-2]-807.78 -> 4.82975456041459
A35: 27 | B35: 5.8 | C35: 6.4 | D35: 4.52 | E35: =1000/16.9 -> 59.1715976331361 | F35: =RC[-1]*RC[-3] -> 378.698224852071 | G35: =2*RC[-4] -> 12.8 | H35: =-0.0043*RC[-2]^2+3.7742*RC[-2]-807.78 -> 4.82975456041459
A36: 27 | B36: 5 | C36: 6.4 | D36: 4.16 | E36: =1000/16.9 -> 59.1715976331361 | F36: =RC[-1]*RC[-3] -> 378.698224852071 | G36: =2*RC[-4] -> 12.8 | H36: =-0.0043*RC[-2]^2+3.7742*RC[-2]-807.78 -> 4.82975456041459
A37: 27 | B37: 4.5 | C37: 6.4 | D37: 4 | E37: =1000/16.9 -> 59.1715976331361 | F37: =RC[-1]*RC[-3] -> 378.698224852071 | G37: =2*RC[-4] -> 12.8 | H37: =-0.0043*RC[-2]^2+3.7742*RC[-2]-807.78 -> 4.82975456041459
A38: 27 | B38: 4 | C38: 12.75 | D38: 3.8 | E38: =500/16.91 -> 29.5683027794205 | F38: =RC[-1]*RC[-3] -> 376.995860437611 | G38: =RC[-4] -> 12.75 | H38: =-0.0043*RC[-2]^2+3.7742*RC[-2]-807.78 -> 3.93649767912427
A39: 27 | B39: 3 | C39: 12.75 | D39: 3.44 | E39: =500/16.91 -> 29.5683027794205 | F39: =RC[-1]*RC[-3] -> 376.995860437611 | G39: =RC[-4] -> 12.75 | H39: =-0.0043*RC[-2]^2+3.7742*RC[-2]-807.78 -> 3.93649767912427
A40: 27 | B40: 2 | C40: 12.75 | D40: 3.04 | E40: =500/16.91 -> 29.5683027794205 | F40: =RC[-1]*RC[-3] -> 376.995860437611 | G40: =RC[-4] -> 12.75 | H40: =-0.0043*RC[-2]^2+3.7742*RC[-2]-807.78 -> 3.93649767912427
A41: 27 | B41: 1 | C41: 12.7 | D41: 2.64 | E41: =500/16.91 -> 29.5683027794205 | F41: =RC[-1]*RC[-3] -> 375.51744529864 | G41: =RC[-4] -> 12.7 | H41: =-0.0043*RC[-2]^2+3.7742*RC[-2]-807.78 -> 3.14052963457345
A42: 27 | B42: 0 | C42: 12.75 | D42: 2.2 | E42: =500/16.91 -> 29.5683027794205 | F42: =RC[-1]*RC[-3] -> 376.995860437611 | G42: =RC[-4] -> 12.75 | H42: =-0.0043*RC[-2]^2+3.7742*RC[-2]-807.78 -> 3.93649767912427
E43: 'average | F43: =AVERAGE(R[-41]C:R[-1]C) -> 377.447000567553
E44: 'min | F44: =MIN(R[-42]C:R[-2]C) -> 373.817966903073
E45: 'max | F45: =MAX(R[-43]C:R[-3]C) -> 381.656804733728
E46: 'deviation | F46: =STDEV(R[-44]C:R[-4]C) -> 1.72140153291332
A48: 24 | B48: 0 | C48: 12.8 | D48: 1.92 | E48: =500/16.91 -> 29.5683027794205 | F48: =RC[-1]*RC[-3] -> 378.474275576582
A49: 24 | B49: 1 | C49: 12.55 | D49: 2.28 | E49: =500/16.91 -> 29.5683027794205 | F49: =RC[-1]*RC[-3] -> 371.082199881727
A50: 24 | C50: 12.75 | E50: =500/16.91 -> 29.5683027794205 | F50: =RC[-1]*RC[-3] -> 376.995860437611
A51: 24 | B51: 3.5 | C51: 12.6 | D51: 3.08 | E51: =500/16.91 -> 29.5683027794205 | F51: =RC[-1]*RC[-3] -> 372.560615020698
A52: 24 | B52: 4 | C52: 12.8 | D52: 3.28 | E52: =500/16.91 -> 29.5683027794205 | F52: =RC[-1]*RC[-3] -> 378.474275576582
A53: 24 | B53: 4.2 | C53: 12.85 | D53: 3.32 | E53: =500/16.91 -> 29.5683027794205 | F53: =RC[-1]*RC[-3] -> 379.952690715553
A54: 24 | C54: 12.8 | D54: 2.04 | E54: =500/16.91 -> 29.5683027794205 | F54: =RC[-1]*RC[-3] -> 378.474275576582
A55: 24 | B55: 4.2 | C55: 12.85 | D55: 3.32 | E55: =500/16.91 -> 29.5683027794205 | F55: =RC[-1]*RC[-3] -> 379.952690715553
E56: 'average | F56: =AVERAGE(R[-8]C:R[-1]C) -> 376.995860437611
E57: 'min | F57: =MIN(R[-9]C:R[-2]C) -> 371.082199881727
E58: 'max | F58: =MAX(R[-10]C:R[-3]C) -> 379.952690715553
E59: 'deviation | F59: =STDEV(R[-11]C:R[-4]C) -> 3.35273039334027
A61: 23 | C61: 12.7 | E61: =500/16.91 -> 29.5683027794205 | F61: =RC[-1]*RC[-3] -> 375.51744529864
A62: 23 | C62: 4.82 | E62: =500/6.48 -> 77.1604938271605 | F62: =RC[-1]*RC[-3] -> 371.913580246914
A63: 23 | C63: 4.85 | E63: =500/6.45 -> 77.5193798449612 | F63: =RC[-1]*RC[-3] -> 375.968992248062
E64: 'average | F64: =AVERAGE(R[-3]C:R[-1]C) -> 374.466672597872
A66: 24 | C66: 12.6 | E66: =500/16.91 -> 29.5683027794205 | F66: =RC[-1]*RC[-3] -> 372.560615020698
A68: 25 | C68: 12.75 | D68: 2.56 | E68: =500/16.9 -> 29.5857988165681 | F68: =RC[-1]*RC[-3] -> 377.218934911243
A69: 25 | C69: 6.4 | D69: 2.6 | E69: =1000/16.85 -> 59.3471810089021 | F69: =RC[-1]*RC[-3] -> 379.821958456973
A71: 26 | C71: 7 | D71: 1.92 | E71: =1000/16.9 -> 59.1715976331361 | F71: =RC[-1]*RC[-3] -> 414.201183431953
A73: 24 | C73: 12.75 | D73: 4.2 | E73: =500/16.9 -> 29.5857988165681 | F73: =RC[-1]*RC[-3] -> 377.218934911243
A75: 28 | B75: 5.8 | C75: 13 | D75: 4.32 | E75: =500/16.92 -> 29.5508274231678 | F75: =RC[-1]*RC[-3] -> 384.160756501182
B76: 5.9 | C76: 12.95 | D76: 4.4 | E76: =500/16.92 -> 29.5508274231678 | F76: =RC[-1]*RC[-3] -> 382.683215130024
B77: 5.6 | C77: 12.95 | D77: 4.32 | E77: =500/16.92 -> 29.5508274231678 | F77: =RC[-1]*RC[-3] -> 382.683215130024
B78: 5 | C78: 12.95 | D78: 4.16 | E78: =500/16.92 -> 29.5508274231678 | F78: =RC[-1]*RC[-3] -> 382.683215130024
B79: 4 | C79: 12.9 | D79: 3.68 | E79: =500/16.92 -> 29.5508274231678 | F79: =RC[-1]*RC[-3] -> 381.205673758865
B80: 3 | C80: 12.85 | D80: 3.4 | E80: =500/16.92 -> 29.5508274231678 | F80: =RC[-1]*RC[-3] -> 379.728132387707
B81: 2 | C81: 12.9 | D81: 3 | E81: =500/16.92 -> 29.5508274231678 | F81: =RC[-1]*RC[-3] -> 381.205673758865
B82: 0 | C82: 12.75 | D82: 0 | E82: =500/16.92 -> 29.5508274231678 | F82: =RC[-1]*RC[-3] -> 376.77304964539
E83: 'average | F83: =AVERAGE(R[-8]C:R[-2]C) -> 382.049983113813
E84: 'min | F84: =MIN(R[-9]C:R[-2]C) -> 376.77304964539
E85: 'max | F85: =MAX(R[-10]C:R[-3]C) -> 384.160756501182
E86: 'deviation | F86: =STDEV(R[-11]C:R[-4]C) -> 2.29410092866475
A88: 3 | C88: 4.85 | D88: 4.4 | E88: =500/6.45 -> 77.5193798449612 | F88: =RC[-1]*RC[-3] -> 375.968992248062
A90: 6 | B90: 0 | C90: 4.1 | D90: 1.9 | E90: =500/6.5 -> 76.9230769230769 | F90: =RC[-1]*RC[-3] -> 315.384615384615
A91: 6 | B91: 2 | C91: 4.8 | E91: =500/6.45 -> 77.5193798449612 | F91: =RC[-1]*RC[-3] -> 372.093023255814
A92: 6 | B92: 6.25 | C92: 4.8 | E92: =500/6.45 -> 77.5193798449612 | F92: =RC[-1]*RC[-3] -> 372.093023255814
A93: 6 | B93: 6.25 | C93: 4.85 | E93: =500/6.45 -> 77.5193798449612 | F93: =RC[-1]*RC[-3] -> 375.968992248062
A95: 8 | C95: 4.85 | E95: =500/6.45 -> 77.5193798449612 | F95: =RC[-1]*RC[-3] -> 375.968992248062
A97: 15 | B97: 2.3 | C97: 5.15 | E97: =500/6.65 -> 75.187969924812 | F97: =RC[-1]*RC[-3] -> 387.218045112782
A99: 16 | C99: 2.55 | D99: 4.2 | E99: =1000/6.65 -> 150.375939849624 | F99: =RC[-1]*RC[-3] -> 383.458646616541
A101: 13 | B101: 1.9 | C101: 2.55 | D101: 4.2 | E101: =1000/6.55 -> 152.671755725191 | F101: =RC[-1]*RC[-3] -> 389.312977099237
A103: 17 | B103: 2.75 | C103: 2.4 | D103: 4.57 | E103: =1000/6.45 -> 155.038759689922 | F103: =RC[-1]*RC[-3] -> 372.093023255814
A104: 17 | B104: 6.3 | C104: 2.4 | D104: 5.72 | E104: =1000/6.45 -> 155.038759689922 | F104: =RC[-1]*RC[-3] -> 372.093023255814
A106: 13 | B106: 3.75 | C106: 2.4 | D106: 5.03 | E106: =1000/6.45 -> 155.038759689922 | F106: =RC[-1]*RC[-3] -> 372.093023255814
A108: 17 | B108: 6.3 | C108: 2.4 | D108: 5.28 | E108: =500/3.2 -> 156.25 | F108: =RC[-1]*RC[-3] -> 375
A110: 16 | B110: 6.1 | C110: 2.48 | D110: 5.6 | E110: =1000/6.45 -> 155.038759689922 | F110: =RC[-1]*RC[-3] -> 384.496124031008
A111: 16 | C111: 2.45 | E111: =1000/6.45 -> 155.038759689922 | F111: =RC[-1]*RC[-3] -> 379.84496124031
A113: 18 | C113: 2.5 | E113: =1000/6.5 -> 153.846153846154 | F113: =RC[-1]*RC[-3] -> 384.615384615385
A114: 18 | C114: 2.43 | E114: =1000/6.45 -> 155.038759689922 | F114: =RC[-1]*RC[-3] -> 376.744186046512
A115: 18 | C115: 2.45 | E115: =1000/6.45 -> 155.038759689922 | F115: =RC[-1]*RC[-3] -> 379.84496124031
A116: 18 | C116: 2.4 | E116: =1000/6.3 -> 158.730158730159 | F116: =RC[-1]*RC[-3] -> 380.952380952381
A117: '18b | C117: 2.5 | E117: =1000/6.45 -> 155.038759689922 | F117: =RC[-1]*RC[-3] -> 387.596899224806
A118: '18b | C118: 2.5 | E118: =1000/6.45 -> 155.038759689922 | F118: =RC[-1]*RC[-3] -> 387.596899224806
A120: 'Lens | B120: 'width (us) | D120: 'calculated primary resistance (mohms) | N120: 'Lens | O120: 'pot | P120: 'width (cm) | Q120: 'bdot (V) | R120: 'scale factor | S120: 'width (us) | U120: 'calculated primary effective resistance | V120: 'y = 0.2027x + 1.2055
A121: 3 | B121: 375.968992248062 | C121: =RC[-1] -> 375.968992248062 | D121: =-0.0043*RC[-2]^2+3.7742*RC[-2]-807.78 -> 3.38563307493541 | N121: 27 | O121: 6.35 | P121: 12.75 | Q121: 4.8 | R121: =500/16.92 -> 29.5508274231678 | S121: =RC[-1]*RC[-3] -> 376.77304964539 | T121: =RC[-4] -> 12.75 | U121: =-0.0043*RC[-2]^2+3.7742*RC[-2]-807.78 -> 3.81774093355466 | V121: =(0.2027*RC[-7]+1.2055)*1000 -> 2492.645
A122: 6 | B122: 372.093023255814 | D122: =-0.0043*RC[-2]^2+3.7742*RC[-2]-807.78 -> 1.22465116279079 | N122: 27 | O122: 6.35 | P122: 12.75 | Q122: 4.76 | R122: =500/16.92 -> 29.5508274231678 | S122: =RC[-1]*RC[-3] -> 376.77304964539 | T122: =RC[-4] -> 12.75 | U122: =-0.0043*RC[-2]^2+3.7742*RC[-2]-807.78 -> 3.81774093355466 | V122: =(0.2027*RC[-7]+1.2055)*1000 -> 2492.645
A123: 6 | B123: 372.093023255814 | D123: =-0.0043*RC[-2]^2+3.7742*RC[-2]-807.78 -> 1.22465116279079 | N123: 27 | O123: 6.35 | P123: 12.7 | Q123: 4.76 | R123: =500/16.92 -> 29.5508274231678 | S123: =RC[-1]*RC[-3] -> 375.295508274232 | T123: =RC[-4] -> 12.7 | U123: =-0.0043*RC[-2]^2+3.7742*RC[-2]-807.78 -> 3.01941764610558 | V123: =(0.2027*RC[-7]+1.2055)*1000 -> 2492.645
A124: 6 | B124: 375.968992248062 | C124: =AVERAGE(R[-2]C[-1]:RC[-1]) -> 373.385012919897 | D124: =-0.0043*RC[-2]^2+3.7742*RC[-2]-807.78 -> 3.38563307493541 | N124: 27 | O124: 6.38 | P124: 12.8 | Q124: 4.8 | R124: =500/16.92 -> 29.5508274231678 | S124: =RC[-1]*RC[-3] -> 378.250591016548 | T124: =RC[-4] -> 12.8 | U124: =-0.0043*RC[-2]^2+3.7742*RC[-2]-807.78 -> 4.59728931587392 | V124: =(0.2027*RC[-7]+1.2055)*1000 -> 2498.726
A125: 8 | B125: 375.968992248062 | C125: =AVERAGE(RC[-1]) -> 375.968992248062 | D125: =-0.0043*RC[-2]^2+3.7742*RC[-2]-807.78 -> 3.38563307493541 | N125: 27 | O125: 6.4 | P125: 12.8 | Q125: 4.76 | R125: =500/16.92 -> 29.5508274231678 | S125: =RC[-1]*RC[-3] -> 378.250591016548 | T125: =RC[-4] -> 12.8 | U125: =-0.0043*RC[-2]^2+3.7742*RC[-2]-807.78 -> 4.59728931587392 | V125: =(0.2027*RC[-7]+1.2055)*1000 -> 2502.78
A126: 13 | B126: 389.312977099237 | D126: =-0.0043*RC[-2]^2+3.7742*RC[-2]-807.78 -> 9.83728337509501 | N126: 27 | O126: 6.4 | P126: 12.72 | Q126: 4.76 | R126: =500/16.92 -> 29.5508274231678 | S126: =RC[-1]*RC[-3] -> 375.886524822695 | T126: =RC[-4] -> 12.72 | U126: =-0.0043*RC[-2]^2+3.7742*RC[-2]-807.78 -> 3.34099994970063 | V126: =(0.2027*RC[-7]+1.2055)*1000 -> 2502.78
A127: 13 | B127: 372.093023255814 | C127: =AVERAGE(R[-1]C[-1]:RC[-1]) -> 380.703000177526 | D127: =-0.0043*RC[-2]^2+3.7742*RC[-2]-807.78 -> 1.22465116279079 | N127: 27 | O127: 6 | P127: 12.7 | Q127: 4.64 | R127: =500/16.92 -> 29.5508274231678 | S127: =RC[-1]*RC[-3] -> 375.295508274232 | T127: =RC[-4] -> 12.7 | U127: =-0.0043*RC[-2]^2+3.7742*RC[-2]-807.78 -> 3.01941764610558 | V127: =(0.2027*RC[-7]+1.2055)*1000 -> 2421.7
A128: 15 | B128: 387.218045112782 | C128: =RC[-1] -> 387.218045112782 | D128: =-0.0043*RC[-2]^2+3.7742*RC[-2]-807.78 -> 8.92574368251462 | N128: 27 | O128: 5 | P128: 12.75 | Q128: 4.28 | R128: =500/16.92 -> 29.5508274231678 | S128: =RC[-1]*RC[-3] -> 376.77304964539 | T128: =RC[-4] -> 12.75 | U128: =-0.0043*RC[-2]^2+3.7742*RC[-2]-807.78 -> 3.81774093355466 | V128: =(0.2027*RC[-7]+1.2055)*1000 -> 2219
A129: 16 | B129: 383.458646616541 | D129: =-0.0043*RC[-2]^2+3.7742*RC[-2]-807.78 -> 7.19532930069522 | N129: 27 | O129: 4 | P129: 12.7 | Q129: 3.88 | R129: =500/16.92 -> 29.5508274231678 | S129: =RC[-1]*RC[-3] -> 375.295508274232 | T129: =RC[-4] -> 12.7 | U129: =-0.0043*RC[-2]^2+3.7742*RC[-2]-807.78 -> 3.01941764610558 | V129: =(0.2027*RC[-7]+1.2055)*1000 -> 2016.3
A130: 16 | B130: 384.496124031008 | D130: =-0.0043*RC[-2]^2+3.7742*RC[-2]-807.78 -> 7.68501291989662 | N130: 27 | O130: 3 | P130: 12.7 | Q130: 3.52 | R130: =500/16.92 -> 29.5508274231678 | S130: =RC[-1]*RC[-3] -> 375.295508274232 | T130: =RC[-4] -> 12.7 | U130: =-0.0043*RC[-2]^2+3.7742*RC[-2]-807.78 -> 3.01941764610558 | V130: =(0.2027*RC[-7]+1.2055)*1000 -> 1813.6
A131: 16 | B131: 379.84496124031 | C131: =AVERAGE(R[-2]C[-1]:RC[-1]) -> 382.599910629286 | D131: =-0.0043*RC[-2]^2+3.7742*RC[-2]-807.78 -> 5.41741602067191 | N131: 27 | O131: 2 | P131: 12.65 | Q131: 3.04 | R131: =500/16.92 -> 29.5508274231678 | S131: =RC[-1]*RC[-3] -> 373.817966903073 | T131: =RC[-4] -> 12.65 | U131: =-0.0043*RC[-2]^2+3.7742*RC[-2]-807.78 -> 2.20231945352623 | V131: =(0.2027*RC[-7]+1.2055)*1000 -> 1610.9
A132: 17 | B132: 372.093023255814 | D132: =-0.0043*RC[-2]^2+3.7742*RC[-2]-807.78 -> 1.22465116279079 | N132: 27 | O132: 1 | P132: 12.7 | Q132: 2.67 | R132: =500/16.92 -> 29.5508274231678 | S132: =RC[-1]*RC[-3] -> 375.295508274232 | T132: =RC[-4] -> 12.7 | U132: =-0.0043*RC[-2]^2+3.7742*RC[-2]-807.78 -> 3.01941764610558 | V132: =(0.2027*RC[-7]+1.2055)*1000 -> 1408.2
A133: 17 | B133: 372.093023255814 | D133: =-0.0043*RC[-2]^2+3.7742*RC[-2]-807.78 -> 1.22465116279079 | N133: 27 | O133: 0 | P133: 12.8 | Q133: 2.24 | R133: =500/16.92 -> 29.5508274231678 | S133: =RC[-1]*RC[-3] -> 378.250591016548 | T133: =RC[-4] -> 12.8 | U133: =-0.0043*RC[-2]^2+3.7742*RC[-2]-807.78 -> 4.59728931587392 | V133: =(0.2027*RC[-7]+1.2055)*1000 -> 1205.5
A134: 17 | B134: 375 | C134: =AVERAGE(R[-2]C[-1]:RC[-1]) -> 373.062015503876 | D134: =-0.0043*RC[-2]^2+3.7742*RC[-2]-807.78 -> 2.85750000000007 | N134: 27 | O134: 5.65 | P134: 12.8 | Q134: 4.36 | R134: =500/16.92 -> 29.5508274231678 | S134: =RC[-1]*RC[-3] -> 378.250591016548 | T134: =RC[-4] -> 12.8 | U134: =-0.0043*RC[-2]^2+3.7742*RC[-2]-807.78 -> 4.59728931587392 | V134: =(0.2027*RC[-7]+1.2055)*1000 -> 2350.755
A135: 18 | B135: 384.615384615385 | D135: =-0.0043*RC[-2]^2+3.7742*RC[-2]-807.78 -> 7.74071005917176 | N135: 27 | O135: 5.65 | P135: 12.7 | Q135: 4.4 | R135: =500/16.92 -> 29.5508274231678 | S135: =RC[-1]*RC[-3] -> 375.295508274232 | T135: =RC[-4] -> 12.7 | U135: =-0.0043*RC[-2]^2+3.7742*RC[-2]-807.78 -> 3.01941764610558 | V135: =(0.2027*RC[-7]+1.2055)*1000 -> 2350.755
A136: 18 | B136: 376.744186046512 | D136: =-0.0043*RC[-2]^2+3.7742*RC[-2]-807.78 -> 3.80232558139551 | N136: 27 | O136: 5.5 | P136: 12.75 | Q136: 4.32 | R136: =500/16.92 -> 29.5508274231678 | S136: =RC[-1]*RC[-3] -> 376.77304964539 | T136: =RC[-4] -> 12.75 | U136: =-0.0043*RC[-2]^2+3.7742*RC[-2]-807.78 -> 3.81774093355466 | V136: =(0.2027*RC[-7]+1.2055)*1000 -> 2320.35
A137: 18 | B137: 379.84496124031 | D137: =-0.0043*RC[-2]^2+3.7742*RC[-2]-807.78 -> 5.41741602067191 | N137: 27 | O137: 5.5 | P137: 12.82 | Q137: 4.28 | R137: =500/16.92 -> 29.5508274231678 | S137: =RC[-1]*RC[-3] -> 378.841607565012 | T137: =RC[-4] -> 12.82 | U137: =-0.0043*RC[-2]^2+3.7742*RC[-2]-807.78 -> 4.90385169536523 | V137: =(0.2027*RC[-7]+1.2055)*1000 -> 2320.35
A138: 18 | B138: 380.952380952381 | D138: =-0.0043*RC[-2]^2+3.7742*RC[-2]-807.78 -> 5.97419501133788 | N138: 27 | O138: 5.5 | P138: 12.8 | Q138: 4.36 | R138: =500/16.92 -> 29.5508274231678 | S138: =RC[-1]*RC[-3] -> 378.250591016548 | T138: =RC[-4] -> 12.8 | U138: =-0.0043*RC[-2]^2+3.7742*RC[-2]-807.78 -> 4.59728931587392 | V138: =(0.2027*RC[-7]+1.2055)*1000 -> 2320.35
A139: 18 | B139: 387.596899224806 | D139: =-0.0043*RC[-2]^2+3.7742*RC[-2]-807.78 -> 9.09338501291995 | N139: 27 | O139: 0 | P139: 12.8 | Q139: 2.28 | R139: =500/16.92 -> 29.5508274231678 | S139: =RC[-1]*RC[-3] -> 378.250591016548 | T139: =RC[-4] -> 12.8 | U139: =-0.0043*RC[-2]^2+3.7742*RC[-2]-807.78 -> 4.59728931587392 | V139: =(0.2027*RC[-7]+1.2055)*1000 -> 1205.5
A140: 18 | B140: 387.596899224806 | C140: =AVERAGE(R[-5]C[-1]:RC[-1]) -> 382.891785217367 | D140: =-0.0043*RC[-2]^2+3.7742*RC[-2]-807.78 -> 9.09338501291995 | N140: 27 | O140: 0 | P140: 6.4 | Q140: 4.32 | R140: =1000/16.9 -> 59.1715976331361 | S140: =RC[-1]*RC[-3] -> 378.698224852071 | T140: =2*RC[-4] -> 12.8 | U140: =-0.0043*RC[-2]^2+3.7742*RC[-2]-807.78 -> 4.82975456041459 | V140: =(0.2027*RC[-7]+1.2055)*1000 -> 1205.5
A141: 23 | B141: 375.51744529864 | D141: =-0.0043*RC[-2]^2+3.7742*RC[-2]-807.78 -> 3.14052963457368 | N141: 27 | O141: 5.5 | P141: 6.4 | Q141: 4.28 | R141: =1000/16.9 -> 59.1715976331361 | S141: =RC[-1]*RC[-3] -> 378.698224852071 | T141: =2*RC[-4] -> 12.8 | U141: =-0.0043*RC[-2]^2+3.7742*RC[-2]-807.78 -> 4.82975456041459 | V141: =(0.2027*RC[-7]+1.2055)*1000 -> 2320.35
A142: 23 | B142: 371.913580246914 | D142: =-0.0043*RC[-2]^2+3.7742*RC[-2]-807.78 -> 1.12147652796853 | N142: 27 | O142: 5.5 | P142: 6.4 | Q142: 4.32 | R142: =1000/16.9 -> 59.1715976331361 | S142: =RC[-1]*RC[-3] -> 378.698224852071 | T142: =2*RC[-4] -> 12.8 | U142: =-0.0043*RC[-2]^2+3.7742*RC[-2]-807.78 -> 4.82975456041459 | V142: =(0.2027*RC[-7]+1.2055)*1000 -> 2320.35
A143: 23 | B143: 375.968992248062 | C143: =AVERAGE(R[-2]C[-1]:RC[-1]) -> 374.466672597872 | D143: =-0.0043*RC[-2]^2+3.7742*RC[-2]-807.78 -> 3.38563307493541 | N143: 27 | O143: 5 | P143: 6.35 | Q143: 4.16 | R143: =1000/16.9 -> 59.1715976331361 | S143: =RC[-1]*RC[-3] -> 375.739644970414 | T143: =2*RC[-4] -> 12.7 | U143: =-0.0043*RC[-2]^2+3.7742*RC[-2]-807.78 -> 3.26136059661781 | V143: =(0.2027*RC[-7]+1.2055)*1000 -> 2219
A144: 24 | B144: 378.474275576582 | D144: =-0.0043*RC[-2]^2+3.7742*RC[-2]-807.78 -> 4.7136686062961 | N144: 27 | O144: 4 | P144: 6.45 | Q144: 3.84 | R144: =1000/16.9 -> 59.1715976331361 | S144: =RC[-1]*RC[-3] -> 381.656804733728 | T144: =2*RC[-4] -> 12.9 | U144: =-0.0043*RC[-2]^2+3.7742*RC[-2]-807.78 -> 6.32287104793249 | V144: =(0.2027*RC[-7]+1.2055)*1000 -> 2016.3
A145: 24 | B145: 371.082199881727 | D145: =-0.0043*RC[-2]^2+3.7742*RC[-2]-807.78 -> 0.639842796647486 | N145: 27 | O145: 0 | P145: 6.45 | Q145: 4.36 | R145: =1000/16.9 -> 59.1715976331361 | S145: =RC[-1]*RC[-3] -> 381.656804733728 | T145: =2*RC[-4] -> 12.9 | U145: =-0.0043*RC[-2]^2+3.7742*RC[-2]-807.78 -> 6.32287104793249 | V145: =(0.2027*RC[-7]+1.2055)*1000 -> 1205.5
A146: 24 | B146: 376.995860437611 | D146: =-0.0043*RC[-2]^2+3.7742*RC[-2]-807.78 -> 3.93649767912427 | N146: 27 | O146: 5.7 | P146: 6.4 | Q146: 4.52 | R146: =1000/16.9 -> 59.1715976331361 | S146: =RC[-1]*RC[-3] -> 378.698224852071 | T146: =2*RC[-4] -> 12.8 | U146: =-0.0043*RC[-2]^2+3.7742*RC[-2]-807.78 -> 4.82975456041459 | V146: =(0.2027*RC[-7]+1.2055)*1000 -> 2360.89
A147: 24 | B147: 372.560615020698 | D147: =-0.0043*RC[-2]^2+3.7742*RC[-2]-807.78 -> 1.49220219333517 | N147: 27 | O147: 5.5 | P147: 6.4 | Q147: 4.4 | R147: =1000/16.9 -> 59.1715976331361 | S147: =RC[-1]*RC[-3] -> 378.698224852071 | T147: =2*RC[-4] -> 12.8 | U147: =-0.0043*RC[-2]^2+3.7742*RC[-2]-807.78 -> 4.82975456041459 | V147: =(0.2027*RC[-7]+1.2055)*1000 -> 2320.35
A148: 24 | B148: 378.474275576582 | D148: =-0.0043*RC[-2]^2+3.7742*RC[-2]-807.78 -> 4.7136686062961 | N148: 27 | O148: 5 | P148: 6.35 | Q148: 4.24 | R148: =1000/16.9 -> 59.1715976331361 | S148: =RC[-1]*RC[-3] -> 375.739644970414 | T148: =2*RC[-4] -> 12.7 | U148: =-0.0043*RC[-2]^2+3.7742*RC[-2]-807.78 -> 3.26136059661781 | V148: =(0.2027*RC[-7]+1.2055)*1000 -> 2219
A149: 24 | B149: 379.952690715553 | D149: =-0.0043*RC[-2]^2+3.7742*RC[-2]-807.78 -> 5.47204241608881 | N149: 27 | O149: 4 | P149: 6.4 | Q149: 3.88 | R149: =1000/16.9 -> 59.1715976331361 | S149: =RC[-1]*RC[-3] -> 378.698224852071 | T149: =2*RC[-4] -> 12.8 | U149: =-0.0043*RC[-2]^2+3.7742*RC[-2]-807.78 -> 4.82975456041459 | V149: =(0.2027*RC[-7]+1.2055)*1000 -> 2016.3
A150: 24 | B150: 378.474275576582 | D150: =-0.0043*RC[-2]^2+3.7742*RC[-2]-807.78 -> 4.7136686062961 | N150: 27 | O150: 3 | P150: 6.35 | Q150: 3.48 | R150: =1000/16.9 -> 59.1715976331361 | S150: =RC[-1]*RC[-3] -> 375.739644970414 | T150: =2*RC[-4] -> 12.7 | U150: =-0.0043*RC[-2]^2+3.7742*RC[-2]-807.78 -> 3.26136059661781 | V150: =(0.2027*RC[-7]+1.2055)*1000 -> 1813.6
A151: 24 | B151: 379.952690715553 | D151: =-0.0043*RC[-2]^2+3.7742*RC[-2]-807.78 -> 5.47204241608881 | N151: 27 | O151: 2 | P151: 6.4 | Q151: 3.12 | R151: =1000/16.9 -> 59.1715976331361 | S151: =RC[-1]*RC[-3] -> 378.698224852071 | T151: =2*RC[-4] -> 12.8 | U151: =-0.0043*RC[-2]^2+3.7742*RC[-2]-807.78 -> 4.82975456041459 | V151: =(0.2027*RC[-7]+1.2055)*1000 -> 1610.9
A152: 24 | B152: 372.560615020698 | D152: =-0.0043*RC[-2]^2+3.7742*RC[-2]-807.78 -> 1.49220219333517 | N152: 27 | O152: 1 | P152: 6.4 | Q152: 2.64 | R152: =1000/16.9 -> 59.1715976331361 | S152: =RC[-1]*RC[-3] -> 378.698224852071 | T152: =2*RC[-4] -> 12.8 | U152: =-0.0043*RC[-2]^2+3.7742*RC[-2]-807.78 -> 4.82975456041459 | V152: =(0.2027*RC[-7]+1.2055)*1000 -> 1408.2
A153: 24 | B153: 377.218934911243 | C153: =AVERAGE(R[-9]C[-1]:RC[-1]) -> 376.574643343283 | D153: =-0.0043*RC[-2]^2+3.7742*RC[-2]-807.78 -> 4.05496726305125 | N153: 27 | O153: 0 | P153: 6.4 | Q153: 2.16 | R153: =1000/16.9 -> 59.1715976331361 | S153: =RC[-1]*RC[-3] -> 378.698224852071 | T153: =2*RC[-4] -> 12.8 | U153: =-0.0043*RC[-2]^2+3.7742*RC[-2]-807.78 -> 4.82975456041459 | V153: =(0.2027*RC[-7]+1.2055)*1000 -> 1205.5
A154: 25 | B154: 377.218934911243 | D154: =-0.0043*RC[-2]^2+3.7742*RC[-2]-807.78 -> 4.05496726305125 | N154: 27 | O154: 5.8 | P154: 6.4 | Q154: 4.52 | R154: =1000/16.9 -> 59.1715976331361 | S154: =RC[-1]*RC[-3] -> 378.698224852071 | T154: =2*RC[-4] -> 12.8 | U154: =-0.0043*RC[-2]^2+3.7742*RC[-2]-807.78 -> 4.82975456041459 | V154: =(0.2027*RC[-7]+1.2055)*1000 -> 2381.16
A155: 25 | B155: 379.821958456973 | C155: =AVERAGE(R[-1]C[-1]:RC[-1]) -> 378.520446684108 | D155: =-0.0043*RC[-2]^2+3.7742*RC[-2]-807.78 -> 5.40573906611826 | N155: 27 | O155: 5 | P155: 6.4 | Q155: 4.16 | R155: =1000/16.9 -> 59.1715976331361 | S155: =RC[-1]*RC[-3] -> 378.698224852071 | T155: =2*RC[-4] -> 12.8 | U155: =-0.0043*RC[-2]^2+3.7742*RC[-2]-807.78 -> 4.82975456041459 | V155: =(0.2027*RC[-7]+1.2055)*1000 -> 2219
A156: 26 | B156: 414.201183431953 | C156: =AVERAGE(RC[-1]) -> 414.201183431953 | D156: =-0.0043*RC[-2]^2+3.7742*RC[-2]-807.78 -> 17.7788389762266 | N156: 27 | O156: 4.5 | P156: 6.4 | Q156: 4 | R156: =1000/16.9 -> 59.1715976331361 | S156: =RC[-1]*RC[-3] -> 378.698224852071 | T156: =2*RC[-4] -> 12.8 | U156: =-0.0043*RC[-2]^2+3.7742*RC[-2]-807.78 -> 4.82975456041459 | V156: =(0.2027*RC[-7]+1.2055)*1000 -> 2117.65
A157: 27 | B157: 376.77304964539 | D157: =-0.0043*RC[-2]^2+3.7742*RC[-2]-807.78 -> 3.81774093355466 | N157: 27 | O157: 4 | P157: 12.75 | Q157: 3.8 | R157: =500/16.91 -> 29.5683027794205 | S157: =RC[-1]*RC[-3] -> 376.995860437611 | T157: =RC[-4] -> 12.75 | U157: =-0.0043*RC[-2]^2+3.7742*RC[-2]-807.78 -> 3.93649767912427 | V157: =(0.2027*RC[-7]+1.2055)*1000 -> 2016.3
A158: 27 | B158: 376.77304964539 | D158: =-0.0043*RC[-2]^2+3.7742*RC[-2]-807.78 -> 3.81774093355466 | N158: 27 | O158: 3 | P158: 12.75 | Q158: 3.44 | R158: =500/16.91 -> 29.5683027794205 | S158: =RC[-1]*RC[-3] -> 376.995860437611 | T158: =RC[-4] -> 12.75 | U158: =-0.0043*RC[-2]^2+3.7742*RC[-2]-807.78 -> 3.93649767912427 | V158: =(0.2027*RC[-7]+1.2055)*1000 -> 1813.6
A159: 27 | B159: 375.295508274232 | D159: =-0.0043*RC[-2]^2+3.7742*RC[-2]-807.78 -> 3.01941764610558 | N159: 27 | O159: 2 | P159: 12.75 | Q159: 3.04 | R159: =500/16.91 -> 29.5683027794205 | S159: =RC[-1]*RC[-3] -> 376.995860437611 | T159: =RC[-4] -> 12.75 | U159: =-0.0043*RC[-2]^2+3.7742*RC[-2]-807.78 -> 3.93649767912427 | V159: =(0.2027*RC[-7]+1.2055)*1000 -> 1610.9
A160: 27 | B160: 378.250591016548 | D160: =-0.0043*RC[-2]^2+3.7742*RC[-2]-807.78 -> 4.59728931587358 | N160: 27 | O160: 1 | P160: 12.7 | Q160: 2.64 | R160: =500/16.91 -> 29.5683027794205 | S160: =RC[-1]*RC[-3] -> 375.51744529864 | T160: =RC[-4] -> 12.7 | U160: =-0.0043*RC[-2]^2+3.7742*RC[-2]-807.78 -> 3.14052963457345 | V160: =(0.2027*RC[-7]+1.2055)*1000 -> 1408.2
A161: 27 | B161: 378.250591016548 | D161: =-0.0043*RC[-2]^2+3.7742*RC[-2]-807.78 -> 4.59728931587358 | N161: 27 | O161: 0 | P161: 12.75 | Q161: 2.2 | R161: =500/16.91 -> 29.5683027794205 | S161: =RC[-1]*RC[-3] -> 376.995860437611 | T161: =RC[-4] -> 12.75 | U161: =-0.0043*RC[-2]^2+3.7742*RC[-2]-807.78 -> 3.93649767912427 | V161: =(0.2027*RC[-7]+1.2055)*1000 -> 1205.5
A162: 27 | B162: 375.886524822695 | D162: =-0.0043*RC[-2]^2+3.7742*RC[-2]-807.78 -> 3.34099994970063 | R162: 'average | S162: =AVERAGE(R[-41]C:R[-1]C) -> 377.447000567553 | V162: =MAX(R[-41]C:R[-1]C) -> 2502.78
A163: 27 | B163: 375.295508274232 | D163: =-0.0043*RC[-2]^2+3.7742*RC[-2]-807.78 -> 3.01941764610558 | R163: 'min | S163: =MIN(R[-42]C:R[-2]C) -> 373.817966903073
A164: 27 | B164: 376.77304964539 | D164: =-0.0043*RC[-2]^2+3.7742*RC[-2]-807.78 -> 3.81774093355466 | R164: 'max | S164: =MAX(R[-43]C:R[-3]C) -> 381.656804733728
A165: 27 | B165: 375.295508274232 | D165: =-0.0043*RC[-2]^2+3.7742*RC[-2]-807.78 -> 3.01941764610558 | R165: 'deviation | S165: =STDEV(R[-44]C:R[-4]C) -> 1.72140153291332
A166: 27 | B166: 375.295508274232 | D166: =-0.0043*RC[-2]^2+3.7742*RC[-2]-807.78 -> 3.01941764610558
A167: 27 | B167: 373.817966903073 | D167: =-0.0043*RC[-2]^2+3.7742*RC[-2]-807.78 -> 2.20231945352612 | N167: 24 | O167: 0 | P167: 12.8 | Q167: 1.92 | R167: =500/16.91 -> 29.5683027794205 | S167: =RC[-1]*RC[-3] -> 378.474275576582 | T167: =RC[-4] -> 12.8 | U167: =-0.0043*RC[-2]^2+3.7742*RC[-2]-807.78 -> 4.7136686062961 | V167: =(0.2027*RC[-7]+1.2055)*1000 -> 1205.5
A168: 27 | B168: 375.295508274232 | D168: =-0.0043*RC[-2]^2+3.7742*RC[-2]-807.78 -> 3.01941764610558 | N168: 24 | O168: 1 | P168: 12.55 | Q168: 2.28 | R168: =500/16.91 -> 29.5683027794205 | S168: =RC[-1]*RC[-3] -> 371.082199881727 | T168: =RC[-4] -> 12.55 | U168: =-0.0043*RC[-2]^2+3.7742*RC[-2]-807.78 -> 0.639842796647372 | V168: =(0.2027*RC[-7]+1.2055)*1000 -> 1408.2
A169: 27 | B169: 378.250591016548 | D169: =-0.0043*RC[-2]^2+3.7742*RC[-2]-807.78 -> 4.59728931587358 | N169: 24 | O169: 0 | P169: 12.75 | R169: =500/16.91 -> 29.5683027794205 | S169: =RC[-1]*RC[-3] -> 376.995860437611 | T169: =RC[-4] -> 12.75 | U169: =-0.0043*RC[-2]^2+3.7742*RC[-2]-807.78 -> 3.93649767912427 | V169: =(0.2027*RC[-7]+1.2055)*1000 -> 1205.5
A170: 27 | B170: 378.250591016548 | D170: =-0.0043*RC[-2]^2+3.7742*RC[-2]-807.78 -> 4.59728931587358 | N170: 24 | O170: 3.5 | P170: 12.6 | Q170: 3.08 | R170: =500/16.91 -> 29.5683027794205 | S170: =RC[-1]*RC[-3] -> 372.560615020698 | T170: =RC[-4] -> 12.6 | U170: =-0.0043*RC[-2]^2+3.7742*RC[-2]-807.78 -> 1.49220219333506 | V170: =(0.2027*RC[-7]+1.2055)*1000 -> 1914.95
A171: 27 | B171: 375.295508274232 | D171: =-0.0043*RC[-2]^2+3.7742*RC[-2]-807.78 -> 3.01941764610558 | N171: 24 | O171: 4 | P171: 12.8 | Q171: 3.28 | R171: =500/16.91 -> 29.5683027794205 | S171: =RC[-1]*RC[-3] -> 378.474275576582 | T171: =RC[-4] -> 12.8 | U171: =-0.0043*RC[-2]^2+3.7742*RC[-2]-807.78 -> 4.7136686062961 | V171: =(0.2027*RC[-7]+1.2055)*1000 -> 2016.3
A172: 27 | B172: 376.77304964539 | D172: =-0.0043*RC[-2]^2+3.7742*RC[-2]-807.78 -> 3.81774093355466 | N172: 24 | O172: 4.2 | P172: 12.85 | Q172: 3.32 | R172: =500/16.91 -> 29.5683027794205 | S172: =RC[-1]*RC[-3] -> 379.952690715553 | T172: =RC[-4] -> 12.85 | U172: =-0.0043*RC[-2]^2+3.7742*RC[-2]-807.78 -> 5.47204241608881 | V172: =(0.2027*RC[-7]+1.2055)*1000 -> 2056.84
A173: 27 | B173: 378.841607565012 | D173: =-0.0043*RC[-2]^2+3.7742*RC[-2]-807.78 -> 4.90385169536512 | N173: 24 | O173: 0 | P173: 12.8 | Q173: 2.04 | R173: =500/16.91 -> 29.5683027794205 | S173: =RC[-1]*RC[-3] -> 378.474275576582 | T173: =RC[-4] -> 12.8 | U173: =-0.0043*RC[-2]^2+3.7742*RC[-2]-807.78 -> 4.7136686062961 | V173: =(0.2027*RC[-7]+1.2055)*1000 -> 1205.5
A174: 27 | B174: 378.250591016548 | D174: =-0.0043*RC[-2]^2+3.7742*RC[-2]-807.78 -> 4.59728931587358 | N174: 24 | O174: 4.2 | P174: 12.85 | Q174: 3.32 | R174: =500/16.91 -> 29.5683027794205 | S174: =RC[-1]*RC[-3] -> 379.952690715553 | T174: =RC[-4] -> 12.85 | U174: =-0.0043*RC[-2]^2+3.7742*RC[-2]-807.78 -> 5.47204241608881 | V174: =(0.2027*RC[-7]+1.2055)*1000 -> 2056.84
A175: 27 | B175: 378.250591016548 | D175: =-0.0043*RC[-2]^2+3.7742*RC[-2]-807.78 -> 4.59728931587358 | R175: 'average | S175: =AVERAGE(R[-8]C:R[-1]C) -> 376.995860437611
A176: 27 | B176: 378.698224852071 | D176: =-0.0043*RC[-2]^2+3.7742*RC[-2]-807.78 -> 4.82975456041447 | R176: 'min | S176: =MIN(R[-9]C:R[-2]C) -> 371.082199881727
A177: 27 | B177: 378.698224852071 | D177: =-0.0043*RC[-2]^2+3.7742*RC[-2]-807.78 -> 4.82975456041447 | R177: 'max | S177: =MAX(R[-10]C:R[-3]C) -> 379.952690715553
A178: 27 | B178: 378.698224852071 | D178: =-0.0043*RC[-2]^2+3.7742*RC[-2]-807.78 -> 4.82975456041447 | R178: 'deviation | S178: =STDEV(R[-11]C:R[-4]C) -> 3.35273039334027
A179: 27 | B179: 375.739644970414 | D179: =-0.0043*RC[-2]^2+3.7742*RC[-2]-807.78 -> 3.26136059661769
A180: 27 | B180: 381.656804733728 | D180: =-0.0043*RC[-2]^2+3.7742*RC[-2]-807.78 -> 6.32287104793261 | N180: 23 | O180: 0 | P180: 12.7 | R180: =500/16.91 -> 29.5683027794205 | S180: =RC[-1]*RC[-3] -> 375.51744529864 | T180: =RC[-4] -> 12.7 | U180: =-0.0043*RC[-2]^2+3.7742*RC[-2]-807.78 -> 3.14052963457345 | V180: =(0.2027*RC[-7]+1.2055)*1000 -> 1205.5
A181: 27 | B181: 381.656804733728 | D181: =-0.0043*RC[-2]^2+3.7742*RC[-2]-807.78 -> 6.32287104793261 | N181: 23 | O181: 0 | P181: 4.82 | R181: =500/6.48 -> 77.1604938271605 | S181: =RC[-1]*RC[-3] -> 371.913580246914 | T181: =RC[-4] -> 4.82 | U181: =-0.0043*RC[-2]^2+3.7742*RC[-2]-807.78 -> 1.12147652796841 | V181: =(0.2027*RC[-7]+1.2055)*1000 -> 1205.5
A182: 27 | B182: 378.698224852071 | D182: =-0.0043*RC[-2]^2+3.7742*RC[-2]-807.78 -> 4.82975456041447 | N182: 23 | O182: 0 | P182: 4.85 | R182: =500/6.45 -> 77.5193798449612 | S182: =RC[-1]*RC[-3] -> 375.968992248062 | T182: =RC[-4] -> 4.85 | U182: =-0.0043*RC[-2]^2+3.7742*RC[-2]-807.78 -> 3.3856330749353 | V182: =(0.2027*RC[-7]+1.2055)*1000 -> 1205.5
A183: 27 | B183: 378.698224852071 | D183: =-0.0043*RC[-2]^2+3.7742*RC[-2]-807.78 -> 4.82975456041447 | R183: 'average | S183: =AVERAGE(R[-3]C:R[-1]C) -> 374.466672597872
A184: 27 | B184: 375.739644970414 | D184: =-0.0043*RC[-2]^2+3.7742*RC[-2]-807.78 -> 3.26136059661769
A185: 27 | B185: 378.698224852071 | D185: =-0.0043*RC[-2]^2+3.7742*RC[-2]-807.78 -> 4.82975456041447 | N185: 24 | O185: 0 | P185: 12.6 | R185: =500/16.91 -> 29.5683027794205 | S185: =RC[-1]*RC[-3] -> 372.560615020698 | T185: =RC[-4] -> 12.6 | U185: =-0.0043*RC[-2]^2+3.7742*RC[-2]-807.78 -> 1.49220219333506 | V185: =(0.2027*RC[-7]+1.2055)*1000 -> 1205.5
A186: 27 | B186: 375.739644970414 | D186: =-0.0043*RC[-2]^2+3.7742*RC[-2]-807.78 -> 3.26136059661769
A187: 27 | B187: 378.698224852071 | D187: =-0.0043*RC[-2]^2+3.7742*RC[-2]-807.78 -> 4.82975456041447 | N187: 25 | O187: 0 | P187: 12.75 | Q187: 2.56 | R187: =500/16.9 -> 29.5857988165681 | S187: =RC[-1]*RC[-3] -> 377.218934911243 | T187: =RC[-4] -> 12.75 | U187: =-0.0043*RC[-2]^2+3.7742*RC[-2]-807.78 -> 4.05496726305114 | V187: =(0.2027*RC[-7]+1.2055)*1000 -> 1205.5
A188: 27 | B188: 378.698224852071 | D188: =-0.0043*RC[-2]^2+3.7742*RC[-2]-807.78 -> 4.82975456041447 | N188: 25 | O188: 0 | P188: 6.4 | Q188: 2.6 | R188: =1000/16.85 -> 59.3471810089021 | S188: =RC[-1]*RC[-3] -> 379.821958456973 | T188: =RC[-4] -> 6.4 | U188: =-0.0043*RC[-2]^2+3.7742*RC[-2]-807.78 -> 5.40573906611849 | V188: =(0.2027*RC[-7]+1.2055)*1000 -> 1205.5
A189: 27 | B189: 378.698224852071 | D189: =-0.0043*RC[-2]^2+3.7742*RC[-2]-807.78 -> 4.82975456041447
A190: 27 | B190: 378.698224852071 | D190: =-0.0043*RC[-2]^2+3.7742*RC[-2]-807.78 -> 4.82975456041447 | N190: 26 | O190: 0 | P190: 7 | Q190: 1.92 | R190: =1000/16.9 -> 59.1715976331361 | S190: =RC[-1]*RC[-3] -> 414.201183431953 | T190: =RC[-4] -> 7 | U190: =-0.0043*RC[-2]^2+3.7742*RC[-2]-807.78 -> 17.7788389762264 | V190: =(0.2027*RC[-7]+1.2055)*1000 -> 1205.5
A191: 27 | B191: 378.698224852071 | D191: =-0.0043*RC[-2]^2+3.7742*RC[-2]-807.78 -> 4.82975456041447
A192: 27 | B192: 378.698224852071 | D192: =-0.0043*RC[-2]^2+3.7742*RC[-2]-807.78 -> 4.82975456041447 | N192: 24 | O192: 0 | P192: 12.75 | Q192: 4.2 | R192: =500/16.9 -> 29.5857988165681 | S192: =RC[-1]*RC[-3] -> 377.218934911243 | T192: =RC[-4] -> 12.75 | U192: =-0.0043*RC[-2]^2+3.7742*RC[-2]-807.78 -> 4.05496726305114 | V192: =(0.2027*RC[-7]+1.2055)*1000 -> 1205.5
A193: 27 | B193: 376.995860437611 | D193: =-0.0043*RC[-2]^2+3.7742*RC[-2]-807.78 -> 3.93649767912427
A194: 27 | B194: 376.995860437611 | D194: =-0.0043*RC[-2]^2+3.7742*RC[-2]-807.78 -> 3.93649767912427 | N194: 28 | O194: 5.8 | P194: 13 | Q194: 4.32 | R194: =500/16.92 -> 29.5508274231678 | S194: =RC[-1]*RC[-3] -> 384.160756501182 | T194: =RC[-4] -> 13 | U194: =-0.0043*RC[-2]^2+3.7742*RC[-2]-807.78 -> 7.52773379385121 | V194: =(0.2027*RC[-7]+1.2055)*1000 -> 2381.16
A195: 27 | B195: 376.995860437611 | D195: =-0.0043*RC[-2]^2+3.7742*RC[-2]-807.78 -> 3.93649767912427 | O195: 5.9 | P195: 12.95 | Q195: 4.4 | R195: =500/16.92 -> 29.5508274231678 | S195: =RC[-1]*RC[-3] -> 382.683215130024 | T195: =RC[-4] -> 12.95 | U195: =-0.0043*RC[-2]^2+3.7742*RC[-2]-807.78 -> 6.8232850320519 | V195: =(0.2027*RC[-7]+1.2055)*1000 -> 2401.43
A196: 27 | B196: 375.51744529864 | D196: =-0.0043*RC[-2]^2+3.7742*RC[-2]-807.78 -> 3.14052963457368 | O196: 5.6 | P196: 12.95 | Q196: 4.32 | R196: =500/16.92 -> 29.5508274231678 | S196: =RC[-1]*RC[-3] -> 382.683215130024 | T196: =RC[-4] -> 12.95 | U196: =-0.0043*RC[-2]^2+3.7742*RC[-2]-807.78 -> 6.8232850320519 | V196: =(0.2027*RC[-7]+1.2055)*1000 -> 2340.62
A197: 27 | B197: 376.995860437611 | C197: =AVERAGE(R[-40]C[-1]:RC[-1]) -> 377.447000567553 | D197: =-0.0043*RC[-2]^2+3.7742*RC[-2]-807.78 -> 3.93649767912427 | O197: 5 | P197: 12.95 | Q197: 4.16 | R197: =500/16.92 -> 29.5508274231678 | S197: =RC[-1]*RC[-3] -> 382.683215130024 | T197: =RC[-4] -> 12.95 | U197: =-0.0043*RC[-2]^2+3.7742*RC[-2]-807.78 -> 6.8232850320519 | V197: =(0.2027*RC[-7]+1.2055)*1000 -> 2219
A198: 28 | B198: 384.160756501182 | D198: =-0.0043*RC[-2]^2+3.7742*RC[-2]-807.78 -> 7.52773379385121 | O198: 4 | P198: 12.9 | Q198: 3.68 | R198: =500/16.92 -> 29.5508274231678 | S198: =RC[-1]*RC[-3] -> 381.205673758865 | T198: =RC[-4] -> 12.9 | U198: =-0.0043*RC[-2]^2+3.7742*RC[-2]-807.78 -> 6.10006136512231 | V198: =(0.2027*RC[-7]+1.2055)*1000 -> 2016.3
A199: 28 | B199: 382.683215130024 | D199: =-0.0043*RC[-2]^2+3.7742*RC[-2]-807.78 -> 6.82328503205201 | O199: 3 | P199: 12.85 | Q199: 3.4 | R199: =500/16.92 -> 29.5508274231678 | S199: =RC[-1]*RC[-3] -> 379.728132387707 | T199: =RC[-4] -> 12.85 | U199: =-0.0043*RC[-2]^2+3.7742*RC[-2]-807.78 -> 5.35806279306314 | V199: =(0.2027*RC[-7]+1.2055)*1000 -> 1813.6
A200: 28 | B200: 382.683215130024 | D200: =-0.0043*RC[-2]^2+3.7742*RC[-2]-807.78 -> 6.82328503205201 | O200: 2 | P200: 12.9 | Q200: 3 | R200: =500/16.92 -> 29.5508274231678 | S200: =RC[-1]*RC[-3] -> 381.205673758865 | T200: =RC[-4] -> 12.9 | U200: =-0.0043*RC[-2]^2+3.7742*RC[-2]-807.78 -> 6.10006136512231 | V200: =(0.2027*RC[-7]+1.2055)*1000 -> 1610.9
A201: 28 | B201: 382.683215130024 | D201: =-0.0043*RC[-2]^2+3.7742*RC[-2]-807.78 -> 6.82328503205201 | O201: 0 | P201: 12.75 | Q201: 0 | R201: =500/16.92 -> 29.5508274231678 | S201: =RC[-1]*RC[-3] -> 376.77304964539 | T201: =RC[-4] -> 12.75 | U201: =-0.0043*RC[-2]^2+3.7742*RC[-2]-807.78 -> 3.81774093355466 | V201: =(0.2027*RC[-7]+1.2055)*1000 -> 1205.5
A202: 28 | B202: 381.205673758865 | D202: =-0.0043*RC[-2]^2+3.7742*RC[-2]-807.78 -> 6.10006136512243 | R202: 'average | S202: =AVERAGE(R[-8]C:R[-1]C) -> 381.39036643026
A203: 28 | B203: 379.728132387707 | D203: =-0.0043*RC[-2]^2+3.7742*RC[-2]-807.78 -> 5.35806279306314 | R203: 'min | S203: =MIN(R[-9]C:R[-2]C) -> 376.77304964539
A204: 28 | B204: 381.205673758865 | D204: =-0.0043*RC[-2]^2+3.7742*RC[-2]-807.78 -> 6.10006136512243 | R204: 'max | S204: =MAX(R[-10]C:R[-3]C) -> 384.160756501182
A205: 28 | B205: 376.77304964539 | C205: =AVERAGE(R[-7]C[-1]:RC[-1]) -> 381.39036643026 | D205: =-0.0043*RC[-2]^2+3.7742*RC[-2]-807.78 -> 3.81774093355466 | R205: 'deviation | S205: =STDEV(R[-11]C:R[-4]C) -> 2.29410092866475
B207: =MIN(R[-86]C:R[-2]C) -> 371.082199881727 | N207: 3 | O207: 0 | P207: 4.85 | Q207: 4.4 | R207: =500/6.45 -> 77.5193798449612 | S207: =RC[-1]*RC[-3] -> 375.968992248062 | T207: =RC[-4] -> 4.85 | U207: =-0.0043*RC[-2]^2+3.7742*RC[-2]-807.78 -> 3.3856330749353 | V207: =(0.2027*RC[-7]+1.2055)*1000 -> 1205.5
N209: 6 | O209: 0 | P209: 4.1 | Q209: 1.9 | R209: =500/6.5 -> 76.9230769230769 | S209: =RC[-1]*RC[-3] -> 315.384615384615 | T209: =RC[-4] -> 4.1 | U209: =-0.0043*RC[-2]^2+3.7742*RC[-2]-807.78 -> -45.1654437869822 | V209: =(0.2027*RC[-7]+1.2055)*1000 -> 1205.5
N210: 6 | O210: 2 | P210: 4.8 | R210: =500/6.45 -> 77.5193798449612 | S210: =RC[-1]*RC[-3] -> 372.093023255814 | T210: =RC[-4] -> 4.8 | U210: =-0.0043*RC[-2]^2+3.7742*RC[-2]-807.78 -> 1.22465116279068 | V210: =(0.2027*RC[-7]+1.2055)*1000 -> 1610.9
N211: 6 | O211: 6.25 | P211: 4.8 | R211: =500/6.45 -> 77.5193798449612 | S211: =RC[-1]*RC[-3] -> 372.093023255814 | T211: =RC[-4] -> 4.8 | U211: =-0.0043*RC[-2]^2+3.7742*RC[-2]-807.78 -> 1.22465116279068 | V211: =(0.2027*RC[-7]+1.2055)*1000 -> 2472.375
N212: 6 | O212: 6.25 | P212: 4.85 | R212: =500/6.45 -> 77.5193798449612 | S212: =RC[-1]*RC[-3] -> 375.968992248062 | T212: =RC[-4] -> 4.85 | U212: =-0.0043*RC[-2]^2+3.7742*RC[-2]-807.78 -> 3.3856330749353 | V212: =(0.2027*RC[-7]+1.2055)*1000 -> 2472.375
N214: 8 | O214: 0 | P214: 4.85 | R214: =500/6.45 -> 77.5193798449612 | S214: =RC[-1]*RC[-3] -> 375.968992248062 | T214: =RC[-4] -> 4.85 | U214: =-0.0043*RC[-2]^2+3.7742*RC[-2]-807.78 -> 3.3856330749353 | V214: =(0.2027*RC[-7]+1.2055)*1000 -> 1205.5
N216: 15 | O216: 2.3 | P216: 5.15 | R216: =500/6.65 -> 75.187969924812 | S216: =RC[-1]*RC[-3] -> 387.218045112782 | T216: =RC[-4] -> 5.15 | U216: =-0.0043*RC[-2]^2+3.7742*RC[-2]-807.78 -> 8.92574368251462 | V216: =(0.2027*RC[-7]+1.2055)*1000 -> 1671.71
N218: 16 | O218: 0 | P218: 2.55 | Q218: 4.2 | R218: =1000/6.65 -> 150.375939849624 | S218: =RC[-1]*RC[-3] -> 383.458646616541 | T218: =RC[-4] -> 2.55 | U218: =-0.0043*RC[-2]^2+3.7742*RC[-2]-807.78 -> 7.19532930069533 | V218: =(0.2027*RC[-7]+1.2055)*1000 -> 1205.5
N220: 13 | O220: 1.9 | P220: 2.55 | Q220: 4.2 | R220: =1000/6.55 -> 152.671755725191 | S220: =RC[-1]*RC[-3] -> 389.312977099237 | T220: =RC[-4] -> 2.55 | U220: =-0.0043*RC[-2]^2+3.7742*RC[-2]-807.78 -> 9.83728337509478 | V220: =(0.2027*RC[-7]+1.2055)*1000 -> 1590.63
N222: 17 | O222: 2.75 | P222: 2.4 | Q222: 4.57 | R222: =1000/6.45 -> 155.038759689922 | S222: =RC[-1]*RC[-3] -> 372.093023255814 | T222: =RC[-4] -> 2.4 | U222: =-0.0043*RC[-2]^2+3.7742*RC[-2]-807.78 -> 1.22465116279068 | V222: =(0.2027*RC[-7]+1.2055)*1000 -> 1762.925
N223: 17 | O223: 6.3 | P223: 2.4 | Q223: 5.72 | R223: =1000/6.45 -> 155.038759689922 | S223: =RC[-1]*RC[-3] -> 372.093023255814 | T223: =RC[-4] -> 2.4 | U223: =-0.0043*RC[-2]^2+3.7742*RC[-2]-807.78 -> 1.22465116279068 | V223: =(0.2027*RC[-7]+1.2055)*1000 -> 2482.51
N225: 13 | O225: 3.75 | P225: 2.4 | Q225: 5.03 | R225: =1000/6.45 -> 155.038759689922 | S225: =RC[-1]*RC[-3] -> 372.093023255814 | T225: =RC[-4] -> 2.4 | U225: =-0.0043*RC[-2]^2+3.7742*RC[-2]-807.78 -> 1.22465116279068 | V225: =(0.2027*RC[-7]+1.2055)*1000 -> 1965.625
N227: 17 | O227: 6.3 | P227: 2.4 | Q227: 5.28 | R227: =500/3.2 -> 156.25 | S227: =RC[-1]*RC[-3] -> 375 | T227: =RC[-4] -> 2.4 | U227: =-0.0043*RC[-2]^2+3.7742*RC[-2]-807.78 -> 2.85750000000007 | V227: =(0.2027*RC[-7]+1.2055)*1000 -> 2482.51
N229: 16 | O229: 6.1 | P229: 2.48 | Q229: 5.6 | R229: =1000/6.45 -> 155.038759689922 | S229: =RC[-1]*RC[-3] -> 384.496124031008 | T229: =RC[-4] -> 2.48 | U229: =-0.0043*RC[-2]^2+3.7742*RC[-2]-807.78 -> 7.68501291989651 | V229: =(0.2027*RC[-7]+1.2055)*1000 -> 2441.97
N230: 16 | O230: 0 | P230: 2.45 | R230: =1000/6.45 -> 155.038759689922 | S230: =RC[-1]*RC[-3] -> 379.84496124031 | T230: =RC[-4] -> 2.45 | U230: =-0.0043*RC[-2]^2+3.7742*RC[-2]-807.78 -> 5.41741602067191 | V230: =(0.2027*RC[-7]+1.2055)*1000 -> 1205.5
N232: 18 | O232: 0 | P232: 2.5 | R232: =1000/6.5 -> 153.846153846154 | S232: =RC[-1]*RC[-3] -> 384.615384615385 | T232: =RC[-4] -> 2.5 | U232: =-0.0043*RC[-2]^2+3.7742*RC[-2]-807.78 -> 7.74071005917165 | V232: =(0.2027*RC[-7]+1.2055)*1000 -> 1205.5
N233: 18 | O233: 0 | P233: 2.43 | R233: =1000/6.45 -> 155.038759689922 | S233: =RC[-1]*RC[-3] -> 376.744186046512 | T233: =RC[-4] -> 2.43 | U233: =-0.0043*RC[-2]^2+3.7742*RC[-2]-807.78 -> 3.80232558139539 | V233: =(0.2027*RC[-7]+1.2055)*1000 -> 1205.5
N234: 18 | O234: 0 | P234: 2.45 | R234: =1000/6.45 -> 155.038759689922 | S234: =RC[-1]*RC[-3] -> 379.84496124031 | T234: =RC[-4] -> 2.45 | U234: =-0.0043*RC[-2]^2+3.7742*RC[-2]-807.78 -> 5.41741602067191 | V234: =(0.2027*RC[-7]+1.2055)*1000 -> 1205.5
N235: 18 | O235: 0 | P235: 2.4 | R235: =1000/6.3 -> 158.730158730159 | S235: =RC[-1]*RC[-3] -> 380.952380952381 | T235: =RC[-4] -> 2.4 | U235: =-0.0043*RC[-2]^2+3.7742*RC[-2]-807.78 -> 5.974195011338 | V235: =(0.2027*RC[-7]+1.2055)*1000 -> 1205.5
N236: '18b | O236: 0 | P236: 2.5 | R236: =1000/6.45 -> 155.038759689922 | S236: =RC[-1]*RC[-3] -> 387.596899224806 | T236: =RC[-4] -> 2.5 | U236: =-0.0043*RC[-2]^2+3.7742*RC[-2]-807.78 -> 9.09338501292007 | V236: =(0.2027*RC[-7]+1.2055)*1000 -> 1205.5
N237: '18b | O237: 0 | P237: 2.5 | R237: =1000/6.45 -> 155.038759689922 | S237: =RC[-1]*RC[-3] -> 387.596899224806 | T237: =RC[-4] -> 2.5 | U237: =-0.0043*RC[-2]^2+3.7742*RC[-2]-807.78 -> 9.09338501292007 | V237: =(0.2027*RC[-7]+1.2055)*1000 -> 1205.5

Sheet: Dummy Load
A1: 'Pot setting | B1: 'Pearson | C1: 'Bdot | D1: 'BNC mV | E1: 'capvolts | G1: 'pot setting | H1: 'dummy load | I1: 'lens 28 | J1: 'delta | K1: '% difference
A2: 0 | B2: 20 | C2: 880 | D2: 2160 | E2: =RC[-1]/1000*527.5 -> 1139.4 | F2: 37613 | G2: 0 | H2: =212.23*RC[-1]+1145.3 -> 1145.3 | I2: =RC[-2]*2027+1205.5 -> 1205.5 | J2: =RC[-1]-RC[-2] -> 60.2 | K2: =RC[-1]/RC[-2] -> 0.0499377851513895
A3: 0 | B3: 18.8 | C3: 820 | D3: 2185 | E3: =RC[-1]/1000*527.5 -> 1152.5875 | G3: 1 | H3: =212.23*RC[-1]+1145.3 -> 1357.53 | I3: =RC[-2]*202.7+1205.5 -> 1408.2 | J3: =RC[-1]-RC[-2] -> 50.6700000000001 | K3: =RC[-1]/RC[-2] -> 0.0359821048146571
A4: 0 | B4: 17.2 | C4: 1060 | D4: 2185 | E4: =RC[-1]/1000*527.5 -> 1152.5875 | G4: 2 | H4: =212.23*RC[-1]+1145.3 -> 1569.76 | I4: =RC[-2]*202.7+1205.5 -> 1610.9 | J4: =RC[-1]-RC[-2] -> 41.1400000000001 | K4: =RC[-1]/RC[-2] -> 0.0255385188403998
A5: 0 | B5: 16.8 | C5: 1380 | D5: 2185 | E5: =RC[-1]/1000*527.5 -> 1152.5875 | G5: 3 | H5: =212.23*RC[-1]+1145.3 -> 1781.99 | I5: =RC[-2]*202.7+1205.5 -> 1813.6 | J5: =RC[-1]-RC[-2] -> 31.6100000000001 | K5: =RC[-1]/RC[-2] -> 0.0174294221438025
A6: 0 | B6: 19.6 | C6: 1440 | D6: 2185 | E6: =RC[-1]/1000*527.5 -> 1152.5875 | G6: 4 | H6: =212.23*RC[-1]+1145.3 -> 1994.22 | I6: =RC[-2]*202.7+1205.5 -> 2016.3 | J6: =RC[-1]-RC[-2] -> 22.0800000000002 | K6: =RC[-1]/RC[-2] -> 0.0109507513762834
A7: 0 | B7: 18.4 | C7: 1400 | D7: 2185 | E7: =RC[-1]/1000*527.5 -> 1152.5875 | G7: 5 | H7: =212.23*RC[-1]+1145.3 -> 2206.45 | I7: =RC[-2]*202.7+1205.5 -> 2219 | J7: =RC[-1]-RC[-2] -> 12.5500000000002 | K7: =RC[-1]/RC[-2] -> 0.00565570076611094
A8: 0 | B8: 16.4 | C8: 1280 | D8: 2185 | E8: =RC[-1]/1000*527.5 -> 1152.5875 | G8: 6 | H8: =212.23*RC[-1]+1145.3 -> 2418.68 | I8: =RC[-2]*202.7+1205.5 -> 2421.7 | J8: =RC[-1]-RC[-2] -> 3.01999999999998 | K8: =RC[-1]/RC[-2] -> 0.0012470578519222
A9: 0 | B9: 19.6 | C9: 1222 | D9: 2185 | E9: =RC[-1]/1000*527.5 -> 1152.5875 | G9: 'Selected data
A10: 0 | B10: 17.6 | C10: 1280 | D10: 2185 | E10: =RC[-1]/1000*527.5 -> 1152.5875 | G10: 'Pot setting | H10: 'Pearson | I10: 'Bdot | J10: 'BNC mV | K10: 'capvolts
A11: 0 | B11: 18.8 | C11: 1400 | D11: 2185 | E11: =RC[-1]/1000*527.5 -> 1152.5875 | G11: 0 | H11: 19.6 | I11: 1440 | J11: 2185 | K11: 1152.5875 | L11: =RC[-2]/1000*527.5/1000 -> 1.1525875
A12: 0 | B12: 12.8 | C12: 940 | D12: 2185 | E12: =RC[-1]/1000*527.5 -> 1152.5875 | G12: 0.5 | H12: 22.4 | I12: 1640 | J12: 2380 | K12: 1255.45 | L12: =RC[-2]/1000*527.5/1000 -> 1.25545
A13: 0 | B13: 20 | C13: 1280 | D13: 2185 | E13: =RC[-1]/1000*527.5 -> 1152.5875 | G13: 1 | H13: 24.4 | I13: 1800 | J13: 2560 | K13: 1350.4 | L13: =RC[-2]/1000*527.5/1000 -> 1.3504
A14: 0 | B14: 19.2 | C14: 1540 | D14: 2185 | E14: =RC[-1]/1000*527.5 -> 1152.5875 | G14: 1.5 | H14: 26.8 | I14: 2060 | J14: 2750 | K14: 1450.625 | L14: =RC[-2]/1000*527.5/1000 -> 1.450625
A15: 0.5 | B15: 12.4 | C15: 1600 | D15: 2340 | E15: =RC[-1]/1000*527.5 -> 1234.35 | G15: 2 | H15: 28.8 | I15: 2080 | J15: 2925 | K15: 1542.9375 | L15: =RC[-2]/1000*527.5/1000 -> 1.5429375
A16: 0.5 | B16: 20.4 | C16: 1260 | D16: 2340 | E16: =RC[-1]/1000*527.5 -> 1234.35 | G16: 2.5 | H16: 30.4 | I16: 2200 | J16: 3200 | K16: 1688 | L16: =RC[-2]/1000*527.5/1000 -> 1.688
A17: 0.5 | B17: 14 | C17: 1660 | D17: 2380 | E17: =RC[-1]/1000*527.5 -> 1255.45 | G17: 3 | H17: 32.4 | I17: 2360 | J17: 3.42 | K17: 1804.05 | L17: =RC[-2]/1000*527.5 -> 1.80405
A18: 0.5 | B18: 15.6 | C18: 1420 | D18: 2380 | E18: =RC[-1]/1000*527.5 -> 1255.45 | G18: 3.5 | H18: 34.4 | I18: 2400 | J18: 3.59 | K18: 1893.725 | L18: =RC[-2]/1000*527.5 -> 1.893725
A19: 0.5 | B19: 22.4 | C19: 1640 | D19: 2380 | E19: =RC[-1]/1000*527.5 -> 1255.45 | J19: 0 | L19: =RC[-2]/1000*527.5 -> 0
A20: 1 | B20: 23.2 | C20: 1780 | D20: 2560 | E20: =RC[-1]/1000*527.5 -> 1350.4 | G20: 4.5 | H20: 38.8 | I20: 2640 | J20: 4 | K20: 2110 | L20: =RC[-2]/1000*527.5 -> 2.11
A21: 1 | B21: 22.8 | C21: 1100 | D21: 2560 | E21: =RC[-1]/1000*527.5 -> 1350.4 | G21: 5 | H21: 39.6 | I21: 2800 | J21: 4.17 | K21: 2199.675 | L21: =RC[-2]/1000*527.5 -> 2.199675
A22: 1 | B22: 20.4 | C22: 1780 | D22: 2560 | E22: =RC[-1]/1000*527.5 -> 1350.4 | G22: 5.5 | H22: 41.6 | I22: 2920 | J22: 4.29 | K22: 2262.975 | L22: =RC[-2]/1000*527.5 -> 2.262975
A23: 1 | B23: 24.8 | C23: 1680 | D23: 2560 | E23: =RC[-1]/1000*527.5 -> 1350.4 | G23: 6 | H23: 44 | I23: 3080 | J23: 4.48 | K23: 2363.2 | L23: =RC[-2]/1000*527.5 -> 2.3632
A24: 1 | B24: 24.4 | C24: 1800 | D24: 2560 | E24: =RC[-1]/1000*527.5 -> 1350.4 | G24: 6.5 | H24: 46.4 | I24: 3200 | J24: 4.65 | K24: 2452.875 | L24: =RC[-2]/1000*527.5 -> 2.452875
A25: 1 | B25: 18.4 | C25: 1760 | D25: 2560 | E25: =RC[-1]/1000*527.5 -> 1350.4 | G25: 0 | I25: 2120 | L25: 36404
A26: 1.5 | B26: 26.8 | C26: 1920 | D26: 2750 | E26: =RC[-1]/1000*527.5 -> 1450.625 | G26: 1 | I26: 2520
A27: 1.5 | B27: 26.8 | C27: 2060 | D27: 2750 | E27: =RC[-1]/1000*527.5 -> 1450.625 | G27: 1.5 | I27: 2640
A28: 1.5 | B28: 18 | C28: 1060 | D28: 2750 | E28: =RC[-1]/1000*527.5 -> 1450.625 | G28: 0 | I28: 2080
A29: 1.5 | B29: 20.4 | C29: 1920 | D29: 2750 | E29: =RC[-1]/1000*527.5 -> 1450.625 | G29: 1 | I29: 2480
A30: 2 | B30: 28.8 | C30: 2080 | D30: 2925 | E30: =RC[-1]/1000*527.5 -> 1542.9375 | G30: 1.5 | I30: 2640
A31: 2 | B31: 28.8 | C31: 2000 | D31: 2935 | E31: =RC[-1]/1000*527.5 -> 1548.2125 | H31: 27.6 | I31: 2520 | K31: 1800 | L31: 36434
A32: 2 | B32: 28.8 | C32: 2080 | D32: 2935 | E32: =RC[-1]/1000*527.5 -> 1548.2125 | G32: 3 | I32: 4640
A33: 2 | B33: 28.8 | C33: 2000 | D33: 2935 | E33: =RC[-1]/1000*527.5 -> 1548.2125 | H33: 62.4 | I33: 6400 | K33: 2330
A34: 2 | B34: 28.8 | C34: 2080 | D34: 2935 | E34: =RC[-1]/1000*527.5 -> 1548.2125 | H34: 54 | I34: 4880 | N34: 13.8 | O34: =2*RC[-1] -> 27.6 | Q34: 19.6 | R34: =2*RC[-1] -> 39.2
A35: 2.5 | B35: 30.4 | C35: 2200 | D35: 3200 | E35: =RC[-1]/1000*527.5 -> 1688 | H35: 48.4 | I35: 4760 | Q35: 22.4 | R35: =2*RC[-1] -> 44.8
A36: 2.5 | B36: 30.8 | C36: 2200 | D36: 3200 | E36: =RC[-1]/1000*527.5 -> 1688 | N36: 31.2 | O36: =2*RC[-1] -> 62.4 | Q36: 24.4 | R36: =2*RC[-1] -> 48.8
A37: 2.5 | B37: 30.4 | C37: 2200 | D37: 3200 | E37: =RC[-1]/1000*527.5 -> 1688 | H37: 59.99 | I37: 5280 | L37: 33055 | N37: 27 | O37: =2*RC[-1] -> 54 | Q37: 26.8 | R37: =2*RC[-1] -> 53.6
A38: 2.5 | B38: 30.8 | C38: 2200 | D38: 3200 | E38: =RC[-1]/1000*527.5 -> 1688 | H38: 57.15 | I38: 5030 | N38: 24.2 | O38: =2*RC[-1] -> 48.4 | Q38: 28.8 | R38: =2*RC[-1] -> 57.6
A39: 3 | B39: 32.4 | C39: 2320 | D39: 3.43 | E39: =RC[-1]*527.5 -> 1809.325 | H39: 57.26 | I39: 5040 | Q39: 30.4 | R39: =2*RC[-1] -> 60.8
A40: 3 | B40: 32.8 | C40: 2320 | D40: 3.42 | E40: =RC[-1]*527.5 -> 1804.05 | H40: 64.76 | I40: 5700 | Q40: 32.4 | R40: =2*RC[-1] -> 64.8
A41: 3 | B41: 32.4 | C41: 2360 | D41: 3.42 | E41: =RC[-1]*527.5 -> 1804.05 | Q41: 34.4 | R41: =2*RC[-1] -> 68.8
A42: 3.5 | B42: 34.8 | C42: 2400 | D42: 3.59 | E42: =RC[-1]*527.5 -> 1893.725
A43: 3.5 | B43: 34 | C43: 2440 | D43: 3.59 | E43: =RC[-1]*527.5 -> 1893.725 | Q43: 38.8 | R43: =2*RC[-1] -> 77.6
A44: 3.5 | B44: 34.4 | C44: 2400 | D44: 3.59 | E44: =RC[-1]*527.5 -> 1893.725 | Q44: 39.6 | R44: =2*RC[-1] -> 79.2
A45: 4 | B45: 35.6 | C45: 2520 | D45: 3.78 | E45: =RC[-1]*527.5 -> 1993.95 | Q45: 41.6 | R45: =2*RC[-1] -> 83.2
A46: 4 | B46: 35.6 | C46: 2520 | D46: 3.78 | E46: =RC[-1]*527.5 -> 1993.95 | Q46: 44 | R46: =2*RC[-1] -> 88
A47: 4 | B47: 36 | C47: 2520 | D47: 3.81 | E47: =RC[-1]*527.5 -> 2009.775 | Q47: 46.4 | R47: =2*RC[-1] -> 92.8
A48: 4 | B48: 36 | C48: 2520 | D48: 3.81 | E48: =RC[-1]*527.5 -> 2009.775
A49: 4 | B49: 36 | C49: 2200 | D49: 3.81 | E49: =RC[-1]*527.5 -> 2009.775
A50: 4 | B50: 36.4 | C50: 2480 | D50: 3.81 | E50: =RC[-1]*527.5 -> 2009.775
A51: 4.5 | B51: 38.4 | C51: 1720 | D51: 4 | E51: =RC[-1]*527.5 -> 2110
A52: 4.5 | B52: 38 | C52: 2600 | D52: 4 | E52: =RC[-1]*527.5 -> 2110
A53: 4.5 | B53: 38.8 | C53: 2640 | D53: 4 | E53: =RC[-1]*527.5 -> 2110
A54: 5 | B54: 40 | C54: 2800 | D54: 4.15 | E54: =RC[-1]*527.5 -> 2189.125
A55: 5 | B55: 39.6 | C55: 2800 | D55: 4.17 | E55: =RC[-1]*527.5 -> 2199.675
A56: 5 | B56: 39.6 | C56: 2800 | D56: 4.17 | E56: =RC[-1]*527.5 -> 2199.675
A57: 5.5 | B57: 42.4 | C57: 2880 | D57: 4.34 | E57: =RC[-1]*527.5 -> 2289.35
A58: 5.5 | B58: 41.6 | C58: 2880 | D58: 4.34 | E58: =RC[-1]*527.5 -> 2289.35
A59: 5.5 | B59: 41.6 | C59: 2920 | D59: 4.29 | E59: =RC[-1]*527.5 -> 2262.975 | F59: 37614
A60: 6 | B60: 24.4 | C60: 3080 | D60: 4.48 | E60: =RC[-1]*527.5 -> 2363.2
B61: 44.4 | C61: 3080 | D61: 4.48 | E61: =RC[-1]*527.5 -> 2363.2
B62: 44 | C62: 3080 | D62: 4.48 | E62: =RC[-1]*527.5 -> 2363.2
A63: 6.5 | B63: 46.4 | C63: 3200 | D63: 4.65 | E63: =RC[-1]*527.5 -> 2452.875
A64: 6.5 | B64: 44.4 | C64: 3240 | D64: 4.65 | E64: =RC[-1]*527.5 -> 2452.875
A65: 7 | B65: 38.8 | C65: 1640 | D65: 4.85 | E65: =RC[-1]*527.5 -> 2558.375
A66: 7 | B66: 37.6 | C66: 2320 | D66: 4.85 | E66: =RC[-1]*527.5 -> 2558.375
A67: 7 | D67: 4.85 | E67: =RC[-1]*527.5 -> 2558.375
A69: 'DUMMY LOAD RETEST 1/10/03 | D69: 'pulse width 454 usec
A70: 'Pot setting | B70: 'Pearson | C70: 'Bdot | D70: 'BNC mV | E70: 'capvolts
A71: 0 | B71: 27.8 | C71: 2700 | D71: 2.04 | E71: 1076
A72: 1 | B72: 33 | C72: 3200 | D72: 2.38 | E72: 1255
A73: 2 | B73: 37.8 | C73: 3700 | D73: 2.78 | E73: 1466
A75: 4 | B75: 47.8 | C75: 4640 | D75: 3.54 | E75: 1867
A76: 5 | B76: 52.6 | C76: 5040 | D76: 4.04 | E76: 2131
A77: 6 | B77: 58.8 | C77: 5640 | D77: 4.44 | E77: 2342
A78: 6.5 | B78: 61 | C78: 5880 | D78: 4.64 | E78: 2448
A79: 6.75 | B79: 61.4 | C79: 5880 | D79: 4.72 | E79: 2490
A81: 'DUMMY LOAD RETEST 1/17/03 | D81: 'pulse width 454 usec
A82: 'Pot setting | B82: 'BNC V | C82: 'BDOT (V) | D82: 'Pearson (KA) | E82: '1000:1 capvolts
A83: 0 | B83: 2.92 | C83: 2.44 | D83: 27 | E83: 1.24
A84: 1 | B84: 2.44 | C84: 2.88 | D84: 32.4 | E84: 1.36
A85: 2 | B85: 2.84 | C85: 3.24 | D85: 37.4 | E85: 1.54
A86: 3 | B86: 3.2 | C86: 3.4 | D86: 42.2 | E86: 1.86
A87: 4 | B87: 3.56 | C87: 4 | D87: 47 | E87: 1.96
A88: 5 | B88: 3.96 | C88: 4.4 | D88: 51.8 | E88: 2.14
A90: 0 | B90: =R[-7]C*527.5 -> 1540.3 | C90: =R[-7]C*1000 -> 2440 | D90: 27 | E90: =R[-7]C*1000 -> 1240
A91: 1 | B91: =R[-7]C*527.5 -> 1287.1 | C91: =R[-7]C*1000 -> 2880 | D91: 32.4 | E91: =R[-7]C*1000 -> 1360
A92: 2 | B92: =R[-7]C*527.5 -> 1498.1 | C92: =R[-7]C*1000 -> 3240 | D92: 37.4 | E92: =R[-7]C*1000 -> 1540
A93: 3 | B93: =R[-7]C*527.5 -> 1688 | C93: =R[-7]C*1000 -> 3400 | D93: 42.2 | E93: =R[-7]C*1000 -> 1860
A94: 4 | B94: =R[-7]C*527.5 -> 1877.9 | C94: =R[-7]C*1000 -> 4000 | D94: 47 | E94: =R[-7]C*1000 -> 1960
A95: 5 | B95: =R[-7]C*527.5 -> 2088.9 | C95: =R[-7]C*1000 -> 4400 | D95: 51.8 | E95: =R[-7]C*1000 -> 2140
A96: '1/17/03 afternoon with chill water | D96: 'pulse width 478 us
A97: 'Pot setting | B97: 'BNC V | C97: 'BDOT (V) | D97: 'Pearson (KA) | E97: '1000:1 capvolts
A98: 0 | B98: 2.04 | C98: 2.4 | D98: 27.2 | E98: 1.12
A99: 1 | B99: 2.44 | C99: 2.84 | D99: 32.4 | E99: 1.32
A100: 2 | B100: 2.84 | C100: 3.24 | D100: 37.6 | E100: 1.54
A101: 3 | B101: 3.16 | C101: 3.6 | D101: 42.4 | E101: 1.74
A102: 4 | B102: 3.56 | C102: 4.04 | D102: 47 | E102: 1.94
A103: 5 | B103: 3.96 | C103: 4.44 | D103: 52 | E103: 2.12
A105: 0 | B105: =R[-7]C*527.5/1000 -> 1.0761 | C105: =1000*R[-7]C -> 2400 | D105: 27.2 | E105: 1.12
A106: 1 | B106: =R[-7]C*527.5/1000 -> 1.2871 | C106: =1000*R[-7]C -> 2840 | D106: 32.4 | E106: 1.32
A107: 2 | B107: =R[-7]C*527.5/1000 -> 1.4981 | C107: =1000*R[-7]C -> 3240 | D107: 37.6 | E107: 1.54
A108: 3 | B108: =R[-7]C*527.5/1000 -> 1.6669 | C108: =1000*R[-7]C -> 3600 | D108: 42.4 | E108: 1.74
A109: 4 | B109: =R[-7]C*527.5/1000 -> 1.8779 | C109: =1000*R[-7]C -> 4040 | D109: 47 | E109: 1.94
A110: 5 | B110: =R[-7]C*527.5/1000 -> 2.0889 | C110: =1000*R[-7]C -> 4440 | D110: 52 | E110: 2.12
A115: 'psi | B115: 'flowrate
A116: 8.6 | B116: 26.5
A117: 17.2 | B117: 25.5
A118: 26 | B118: 24.6
A119: 43.3 | B119: 23
A120: 54.1 | B120: 22
A121: 64.9 | B121: 21.3
A122: 75.8 | B122: 20.5
A123: 86.6 | B123: 19.8
A124: 97.4 | B124: 19.2
A125: 108.3 | B125: 18.5
A126: 119.1 | B126: 18
A127: 130 | B127: 17.4
A128: 140.1 | B128: 16.8
A129: 151.6 | B129: 16.3
A132: 37644 | B132: 'Dummy Load
A133: 'POT | B133: 'BDOT raw | C133: 'BDOT | D133: 'Pearson | E133: 'Capvolts
A134: 0 | B134: 1.217 | C134: 3.88 | D134: 27.4 | E134: 1140 | F134: =RC[-1]/1000 -> 1.14 | G134: =RC[-4]/RC[-5] -> 3.18816762530813
A135: 1 | B135: 1.372 | C135: 4.4 | D135: 32.6 | E135: 1350 | F135: =RC[-1]/1000 -> 1.35 | G135: =RC[-4]/RC[-5] -> 3.2069970845481
A136: 2 | B136: 1.794 | C136: 5.04 | D136: 37.6 | E136: 1560 | F136: =RC[-1]/1000 -> 1.56 | G136: =RC[-4]/RC[-5] -> 2.80936454849498
A137: 3 | B137: 2.199 | C137: 5.76 | D137: 42.6 | E137: 1760 | F137: =RC[-1]/1000 -> 1.76 | G137: =RC[-4]/RC[-5] -> 2.6193724420191
A138: 4 | B138: 2.608 | C138: 6.4 | D138: 47.4 | E138: 1950 | F138: =RC[-1]/1000 -> 1.95 | G138: =RC[-4]/RC[-5] -> 2.45398773006135
B139: =MAX(R[-5]C:R[-1]C) -> 2.608 | C139: =MAX(R[-5]C:R[-1]C) -> 6.4
A141: 0 | B141: =R[-7]C/R139C2 -> 0.466641104294479 | C141: =R[-7]C/R139C3 -> 0.60625
A142: 1 | B142: =R[-7]C/R139C2 -> 0.526073619631902 | C142: =R[-7]C/R139C3 -> 0.6875
A143: 2 | B143: =R[-7]C/R139C2 -> 0.687883435582822 | C143: =R[-7]C/R139C3 -> 0.7875
A144: 3 | B144: =R[-7]C/R139C2 -> 0.843174846625767 | C144: =R[-7]C/R139C3 -> 0.9
A145: 4 | B145: =R[-7]C/R139C2 -> 1 | C145: =R[-7]C/R139C3 -> 1
A147: 'New BDOT coil 01-24-03
A148: 'POT | B148: 'BDOT raw | C148: 'BDOT | D148: 'Pearson | E148: 'Capvolts
A149: 0 | B149: 1.09 | C149: 4.12 | D149: 27.4 | E149: 1150 | F149: =RC[-1]/1000 -> 1.15
A150: 1 | B150: 1.4 | C150: 4.84 | D150: 32.6 | E150: 1360 | F150: =RC[-1]/1000 -> 1.36
A151: 2 | B151: 2.206 | C151: 5.76 | D151: 37.6 | E151: 1560 | F151: =RC[-1]/1000 -> 1.56
A152: 3 | B152: 2.033 | C152: 6.28 | D152: 42.6 | E152: 1760 | F152: =RC[-1]/1000 -> 1.76
A153: 4 | B153: 2.362 | C153: 6.92 | D153: 47.4 | E153: 1960 | F153: =RC[-1]/1000 -> 1.96
B154: =MAX(R[-5]C:R[-1]C) -> 2.362 | C154: =MAX(R[-5]C:R[-1]C) -> 6.92
A156: 0 | B156: =R[-7]C/R154C2 -> 0.4614733276884 | C156: =R[-7]C/R154C3 -> 0.595375722543353
A157: 1 | B157: =R[-7]C/R154C2 -> 0.592718035563082 | C157: =R[-7]C/R154C3 -> 0.699421965317919
A158: 2 | B158: =R[-7]C/R154C2 -> 0.933954276037257 | C158: =R[-7]C/R154C3 -> 0.832369942196532
A159: 3 | B159: =R[-7]C/R154C2 -> 0.860711261642676 | C159: =R[-7]C/R154C3 -> 0.907514450867052
A160: 4 | B160: =R[-7]C/R154C2 -> 1 | C160: =R[-7]C/R154C3 -> 1

Sheet: Spice analysis
A2: 'Pulse wave form as function of capacitance
B3: 'cap volts 2050 | D3: 4.8 | E3: 9.6 | F3: 7.2 | G3: 2.4 | H3: 3.6 | I3: 6
B4: 'pulse width | D4: 385 | E4: 570 | F4: 482 | G4: 266 | H4: 330 | I4: 435
B5: 'peak current | D5: 56.14 | E5: 69.68 | F5: 63.94 | G5: 43.95 | H5: 50.87 | I5: 60.4
A23: 'pulse width and peak current vs lens primary inductance
B24: 'Inductance | D24: 2.54 | E24: 5.08 | F24: 1.27 | G24: 3 | H24: 4 | I24: 1
B25: 'pulse width | D25: 384 | E25: 514 | F25: 300 | G25: 411 | H25: 463 | I25: 280
B26: 'peak current | D26: 56.14 | E26: 44.9 | F26: 67.4 | G26: 53.4 | H26: 48.7 | I26: 71
A44: 'Peak current vs capacitor voltage
B45: 1700 | C45: 46.6
B46: 1800 | C46: 49.3
B47: 1900 | C47: 52
B48: 2000 | C48: 54.7
B49: 2100 | C49: 57.5
B50: 2200 | C50: 60
B51: 2300 | C51: 63
B52: 2400 | C52: 65.7
B53: 2500 | C53: 68.5
B54: 2600 | C54: 71.2
B55: 2700 | C55: 73.95
B56: 2800 | C56: 76.7
B57: 2900 | C57: 79.4
B58: 3000 | C58: 82.15
B59: 3100 | C59: 84.9
B60: 3200 | C60: 87.6
A62: 'peak current and pulse width vs primary resistance
B63: 'primary resistance | D63: 13.5 | E63: 27 | F63: 6.75 | G63: 9 | H63: 15 | I63: 20 | J63: 5
B64: 'period | D64: 384.9 | E64: 440.4 | F64: 374 | G64: 376.7 | H64: 388.58 | I64: 404.7 | J64: 371.8
B65: 'peak current | D65: 56.14 | E65: 42.62 | F65: 66.32 | G65: 62.57 | H65: 54.25 | I65: 48.75 | J65: 69.5
M83: 'R
C84: 'C | D84: 'L | E84: 'R | M84: 12 | N84: =0.0249*RC[-1]^2-2.0087*RC[-1]+78.783 -> 58.2642
A85: 'C1 | C85: 0.0048 | D85: 0 | E85: 0
A86: 'Lps | C86: 0 | D86: 5E-08 | E86: 0
A87: 'Lcoax | C87: 0 | D87: 4.3E-08 | E87: 0
A88: 'Rcoax | C88: 0 | D88: 0 | E88: 0.000362
A89: 'Lpot | C89: 0 | D89: 2E-08 | E89: 0
A90: 'Lsla | C90: 0 | D90: 7.23E-08 | E90: 0
A91: 'Rsla | C91: 0 | D91: 0 | E91: 0.0002
A92: 'Lslb | C92: 0 | D92: 1.21E-07 | E92: 0
A93: 'Rslb | C93: 0 | D93: 0 | E93: 0.000244
A94: 'Lslc | C94: 0 | D94: 5.85E-08 | E94: 0
A95: 'Rslc | C95: 0 | D95: 0 | E95: 0.000162
A96: 'Lpri | C96: 0 | D96: 2.7E-06 | E96: 0
A97: 'Rpri | C97: 0 | D97: 0 | E97: 0.00814
B98: 'Total | C98: =SUM(R[-13]C:R[-1]C) -> 0.0048 | D98: =SUM(R[-13]C:R[-1]C) -> 3.0648E-06 | E98: =SUM(R[-13]C:R[-1]C) -> 0.009108

Sheet: Data
A1: 'POT | B1: 'ROG | C1: 'Bdot | D1: 'Lens # | E1: 'date | F1: 'Grad(Bdot) | G1: 'Grad(Rog) | H1: 'grad(Bdot)/grad(Rog) | I1: 'y = 0.2027x + 1.2055 | L1: 'POT | M1: 'ROG | N1: 'Bdot | O1: 'Lens # | P1: 'date | Q1: 'Grad(Bdot) | R1: 'Grad(Rog) | S1: 'grad(Bdot)/grad(Rog) | T1: 'y = 0.2027x + 1.2055
A2: 2 | B2: 0.3 | C2: 2.6 | D2: 23 | E2: 35400 | F2: =RC[-3]*157.4 -> 409.24 | G2: =RC[-5]*7.751*157.4 -> 366.00222 | H2: =RC[-1]/RC[-2] -> 0.894346153846154 | I2: =(0.2027*RC[-8]+1.2055)*1000 -> 1610.9 | L2: 0 | M2: 0 | N2: 2 | O2: 4 | P2: 31017 | Q2: =RC[-3]*157.4 -> 314.8 | R2: =RC[-5]*7.751*157.4 -> 0 | S2: =RC[-1]/RC[-2] -> 0 | T2: =(0.2027*RC[-8]+1.2055)*1000 -> 1205.5
A3: 3.75 | B3: 0.49 | C3: 4.3 | D3: 23 | E3: 35400 | F3: =RC[-3]*157.4 -> 676.82 | G3: =RC[-5]*7.751*157.4 -> 597.803626 | H3: =RC[-1]/RC[-2] -> 0.883253488372093 | I3: =(0.2027*RC[-8]+1.2055)*1000 -> 1965.625 | L3: 2 | M3: 0 | N3: 2.8 | O3: 4 | P3: 31017 | Q3: =RC[-3]*157.4 -> 440.72 | R3: =RC[-5]*7.751*157.4 -> 0 | S3: =RC[-1]/RC[-2] -> 0 | T3: =(0.2027*RC[-8]+1.2055)*1000 -> 1610.9
A4: 3.75 | B4: 0.48 | C4: 4.3 | D4: 23 | E4: 35400 | F4: =RC[-3]*157.4 -> 676.82 | G4: =RC[-5]*7.751*157.4 -> 585.603552 | H4: =RC[-1]/RC[-2] -> 0.865227906976744 | I4: =(0.2027*RC[-8]+1.2055)*1000 -> 1965.625 | L4: 4 | M4: 0 | N4: 3.6 | O4: 4 | P4: 31017 | Q4: =RC[-3]*157.4 -> 566.64 | R4: =RC[-5]*7.751*157.4 -> 0 | S4: =RC[-1]/RC[-2] -> 0 | T4: =(0.2027*RC[-8]+1.2055)*1000 -> 2016.3
A5: 4.5 | B5: 0.53 | C5: 4.7 | D5: 23 | E5: 35400 | F5: =RC[-3]*157.4 -> 739.78 | G5: =RC[-5]*7.751*157.4 -> 646.603922 | H5: =RC[-1]/RC[-2] -> 0.874048936170213 | I5: =(0.2027*RC[-8]+1.2055)*1000 -> 2117.65 | L5: 6 | M5: 0 | N5: 4.3 | O5: 4 | P5: 31017 | Q5: =RC[-3]*157.4 -> 676.82 | R5: =RC[-5]*7.751*157.4 -> 0 | S5: =RC[-1]/RC[-2] -> 0 | T5: =(0.2027*RC[-8]+1.2055)*1000 -> 2421.7
A6: 4.5 | B6: 0.52 | C6: 4.65 | D6: 23 | E6: 35400 | F6: =RC[-3]*157.4 -> 731.91 | G6: =RC[-5]*7.751*157.4 -> 634.403848 | H6: =RC[-1]/RC[-2] -> 0.866778494623656 | I6: =(0.2027*RC[-8]+1.2055)*1000 -> 2117.65 | L6: 0 | M6: 0.58 | N6: 2 | O6: 4 | Q6: =RC[-3]*157.4 -> 314.8 | R6: =RC[-5]*7.751*157.4 -> 707.604292 | S6: =RC[-1]/RC[-2] -> 2.24779 | T6: =(0.2027*RC[-8]+1.2055)*1000 -> 1205.5
A7: 2.8 | B7: 0.528 | C7: 3.9 | D7: 24 | E7: 35765 | F7: =RC[-3]*157.4 -> 613.86 | G7: =RC[-5]*7.751*157.4 -> 644.1639072 | H7: =RC[-1]/RC[-2] -> 1.04936615384615 | I7: =(0.2027*RC[-8]+1.2055)*1000 -> 1773.06 | L7: 0 | M7: 0.6 | N7: 2 | O7: 4 | P7: 31079 | Q7: =RC[-3]*157.4 -> 314.8 | R7: =RC[-5]*7.751*157.4 -> 732.00444 | S7: =RC[-1]/RC[-2] -> 2.3253 | T7: =(0.2027*RC[-8]+1.2055)*1000 -> 1205.5
A8: 2.8 | B8: 0.52 | C8: 3.84 | D8: 24 | E8: 35765 | F8: =RC[-3]*157.4 -> 604.416 | G8: =RC[-5]*7.751*157.4 -> 634.403848 | H8: =RC[-1]/RC[-2] -> 1.04961458333333 | I8: =(0.2027*RC[-8]+1.2055)*1000 -> 1773.06 | L8: 0 | M8: 0.58 | N8: 2 | O8: 4 | P8: 31079 | Q8: =RC[-3]*157.4 -> 314.8 | R8: =RC[-5]*7.751*157.4 -> 707.604292 | S8: =RC[-1]/RC[-2] -> 2.24779 | T8: =(0.2027*RC[-8]+1.2055)*1000 -> 1205.5
A9: 2.8 | B9: 0.512 | C9: 3.84 | D9: 24 | E9: 35765 | F9: =RC[-3]*157.4 -> 604.416 | G9: =RC[-5]*7.751*157.4 -> 624.6437888 | H9: =RC[-1]/RC[-2] -> 1.03346666666667 | I9: =(0.2027*RC[-8]+1.2055)*1000 -> 1773.06 | L9: 6.25 | M9: 0.82 | N9: 4.4 | O9: 6 | P9: 31229 | Q9: =RC[-3]*157.4 -> 692.56 | R9: =RC[-5]*7.751*157.4 -> 1000.406068 | S9: =RC[-1]/RC[-2] -> 1.44450454545455 | T9: =(0.2027*RC[-8]+1.2055)*1000 -> 2472.375
A10: 2.8 | B10: 0.52 | C10: 3.92 | D10: 24 | E10: 35765 | F10: =RC[-3]*157.4 -> 617.008 | G10: =RC[-5]*7.751*157.4 -> 634.403848 | H10: =RC[-1]/RC[-2] -> 1.02819387755102 | I10: =(0.2027*RC[-8]+1.2055)*1000 -> 1773.06 | L10: 0 | M10: 0.308 | N10: 2.03 | O10: 8 | P10: 31444 | Q10: =RC[-3]*157.4 -> 319.522 | R10: =RC[-5]*7.751*157.4 -> 375.7622792 | S10: =RC[-1]/RC[-2] -> 1.17601379310345 | T10: =(0.2027*RC[-8]+1.2055)*1000 -> 1205.5
A11: 5.15 | B11: 0.66 | C11: 4.96 | D11: 24 | E11: 35765 | F11: =RC[-3]*157.4 -> 780.704 | G11: =RC[-5]*7.751*157.4 -> 805.204884 | H11: =RC[-1]/RC[-2] -> 1.03138306451613 | I11: =(0.2027*RC[-8]+1.2055)*1000 -> 2249.405 | L11: 2 | M11: 0.39 | N11: 2.89 | O11: 8 | P11: 31444 | Q11: =RC[-3]*157.4 -> 454.886 | R11: =RC[-5]*7.751*157.4 -> 475.802886 | S11: =RC[-1]/RC[-2] -> 1.04598269896194 | T11: =(0.2027*RC[-8]+1.2055)*1000 -> 1610.9
A12: 0 | B12: 0.336 | C12: 3.64 | D12: 24 | E12: 35765 | F12: =RC[-3]*157.4 -> 572.936 | G12: =RC[-5]*7.751*157.4 -> 409.9224864 | H12: =RC[-1]/RC[-2] -> 0.715476923076923 | I12: =(0.2027*RC[-8]+1.2055)*1000 -> 1205.5 | L12: 4 | M12: 0.48 | N12: 3.6 | O12: 8 | P12: 31444 | Q12: =RC[-3]*157.4 -> 566.64 | R12: =RC[-5]*7.751*157.4 -> 585.603552 | S12: =RC[-1]/RC[-2] -> 1.03346666666667 | T12: =(0.2027*RC[-8]+1.2055)*1000 -> 2016.3
A13: 2.8 | B13: 0.52 | C13: 3.92 | D13: 24 | E13: 35765 | F13: =RC[-3]*157.4 -> 617.008 | G13: =RC[-5]*7.751*157.4 -> 634.403848 | H13: =RC[-1]/RC[-2] -> 1.02819387755102 | I13: =(0.2027*RC[-8]+1.2055)*1000 -> 1773.06 | L13: 5 | M13: 0.53 | N13: 3.9 | O13: 8 | P13: 31444 | Q13: =RC[-3]*157.4 -> 613.86 | R13: =RC[-5]*7.751*157.4 -> 646.603922 | S13: =RC[-1]/RC[-2] -> 1.05334102564103 | T13: =(0.2027*RC[-8]+1.2055)*1000 -> 2219
A14: 2.8 | B14: 0.51 | C14: 3.92 | D14: 24 | E14: 35765 | F14: =RC[-3]*157.4 -> 617.008 | G14: =RC[-5]*7.751*157.4 -> 622.203774 | H14: =RC[-1]/RC[-2] -> 1.00842091836735 | I14: =(0.2027*RC[-8]+1.2055)*1000 -> 1773.06 | L14: 6.25 | M14: 0.59 | N14: 4.4 | O14: 8 | P14: 31444 | Q14: =RC[-3]*157.4 -> 692.56 | R14: =RC[-5]*7.751*157.4 -> 719.804366 | S14: =RC[-1]/RC[-2] -> 1.03933863636364 | T14: =(0.2027*RC[-8]+1.2055)*1000 -> 2472.375
A15: 5.15 | B15: 0.656 | C15: 4.96 | D15: 24 | E15: 35765 | F15: =RC[-3]*157.4 -> 780.704 | G15: =RC[-5]*7.751*157.4 -> 800.3248544 | H15: =RC[-1]/RC[-2] -> 1.02513225806452 | I15: =(0.2027*RC[-8]+1.2055)*1000 -> 2249.405 | L15: 0 | M15: 0.1 | N15: 0.5 | O15: 9 | P15: 31625 | Q15: =RC[-3]*157.4 -> 78.7 | R15: =RC[-5]*7.751*157.4 -> 122.00074 | S15: =RC[-1]/RC[-2] -> 1.5502 | T15: =(0.2027*RC[-8]+1.2055)*1000 -> 1205.5
A16: 5.15 | B16: 0.648 | C16: 5.04 | D16: 24 | E16: 35765 | F16: =RC[-3]*157.4 -> 793.296 | G16: =RC[-5]*7.751*157.4 -> 790.5647952 | H16: =RC[-1]/RC[-2] -> 0.996557142857143 | I16: =(0.2027*RC[-8]+1.2055)*1000 -> 2249.405 | L16: 3 | M16: 0.1 | N16: 1 | O16: 9 | P16: 31625 | Q16: =RC[-3]*157.4 -> 157.4 | R16: =RC[-5]*7.751*157.4 -> 122.00074 | S16: =RC[-1]/RC[-2] -> 0.7751 | T16: =(0.2027*RC[-8]+1.2055)*1000 -> 1813.6
A17: 2.8 | B17: 0.52 | C17: 3.92 | D17: 24 | E17: 35765 | F17: =RC[-3]*157.4 -> 617.008 | G17: =RC[-5]*7.751*157.4 -> 634.403848 | H17: =RC[-1]/RC[-2] -> 1.02819387755102 | I17: =(0.2027*RC[-8]+1.2055)*1000 -> 1773.06 | L17: 6.25 | M17: 0.61 | N17: 4.2 | O17: 9 | P17: 31625 | Q17: =RC[-3]*157.4 -> 661.08 | R17: =RC[-5]*7.751*157.4 -> 744.204514 | S17: =RC[-1]/RC[-2] -> 1.12574047619048 | T17: =(0.2027*RC[-8]+1.2055)*1000 -> 2472.375
A18: 5.15 | B18: 0.648 | C18: 5.04 | D18: 24 | E18: 35765 | F18: =RC[-3]*157.4 -> 793.296 | G18: =RC[-5]*7.751*157.4 -> 790.5647952 | H18: =RC[-1]/RC[-2] -> 0.996557142857143 | I18: =(0.2027*RC[-8]+1.2055)*1000 -> 2249.405 | L18: 3 | M18: 0.52 | N18: 0 | O18: 11 | P18: 32295 | Q18: =RC[-3]*157.4 -> 0 | R18: =RC[-5]*7.751*157.4 -> 634.403848 | S18: =RC[-1]/RC[-2] -> #NUM! | T18: =(0.2027*RC[-8]+1.2055)*1000 -> 1813.6
A19: 4.2 | B19: 0.448 | C19: 3.32 | D19: 24 | E19: 35765 | F19: =RC[-3]*157.4 -> 522.568 | G19: =RC[-5]*7.751*157.4 -> 546.5633152 | H19: =RC[-1]/RC[-2] -> 1.04591807228916 | I19: =(0.2027*RC[-8]+1.2055)*1000 -> 2056.84 | L19: 3.75 | M19: 0.612 | N19: 5.28 | O19: 13 | P19: 33055 | Q19: =RC[-3]*157.4 -> 831.072 | R19: =RC[-5]*7.751*157.4 -> 746.6445288 | S19: =RC[-1]/RC[-2] -> 0.898411363636364 | T19: =(0.2027*RC[-8]+1.2055)*1000 -> 1965.625
A20: 2.8 | B20: 0.52 | C20: 3.92 | D20: 24 | E20: 35765 | F20: =RC[-3]*157.4 -> 617.008 | G20: =RC[-5]*7.751*157.4 -> 634.403848 | H20: =RC[-1]/RC[-2] -> 1.02819387755102 | I20: =(0.2027*RC[-8]+1.2055)*1000 -> 1773.06 | L20: 4.5 | M20: 0.654 | N20: 5.7 | O20: 13 | P20: 33086 | Q20: =RC[-3]*157.4 -> 897.18 | R20: =RC[-5]*7.751*157.4 -> 797.8848396 | S20: =RC[-1]/RC[-2] -> 0.889325263157895 | T20: =(0.2027*RC[-8]+1.2055)*1000 -> 2117.65
A21: 5.15 | B21: 0.648 | C21: 4.96 | D21: 24 | E21: 35765 | F21: =RC[-3]*157.4 -> 780.704 | G21: =RC[-5]*7.751*157.4 -> 790.5647952 | H21: =RC[-1]/RC[-2] -> 1.01263064516129 | I21: =(0.2027*RC[-8]+1.2055)*1000 -> 2249.405 | L21: 2 | M21: 0.5 | N21: 0 | O21: 13 | P21: 32994 | Q21: =RC[-3]*157.4 -> 0 | R21: =RC[-5]*7.751*157.4 -> 610.0037 | S21: =RC[-1]/RC[-2] -> #NUM! | T21: =(0.2027*RC[-8]+1.2055)*1000 -> 1610.9
A22: 0 | B22: 0.332 | C22: 2.5 | D22: 25 | E22: 36281 | F22: =RC[-3]*157.4 -> 393.5 | G22: =RC[-5]*7.751*157.4 -> 405.0424568 | H22: =RC[-1]/RC[-2] -> 1.0293328 | I22: =(0.2027*RC[-8]+1.2055)*1000 -> 1205.5 | L22: 2.9 | M22: 0.55 | N22: 4.85 | O22: 13 | P22: 32994 | Q22: =RC[-3]*157.4 -> 763.39 | R22: =RC[-5]*7.751*157.4 -> 671.00407 | S22: =RC[-1]/RC[-2] -> 0.878979381443299 | T22: =(0.2027*RC[-8]+1.2055)*1000 -> 1793.33
A23: 0 | B23: 0.328 | C23: 2.6 | D23: 25 | E23: 36281 | F23: =RC[-3]*157.4 -> 409.24 | G23: =RC[-5]*7.751*157.4 -> 400.1624272 | H23: =RC[-1]/RC[-2] -> 0.977818461538462 | I23: =(0.2027*RC[-8]+1.2055)*1000 -> 1205.5 | L23: 1.95 | M23: 0.48 | N23: 4.2 | O23: 15 | P23: 32874 | Q23: =RC[-3]*157.4 -> 661.08 | R23: =RC[-5]*7.751*157.4 -> 585.603552 | S23: =RC[-1]/RC[-2] -> 0.885828571428571 | T23: =(0.2027*RC[-8]+1.2055)*1000 -> 1600.765
A24: 1 | B24: 0.4 | C24: 3.08 | D24: 25 | E24: 36281 | F24: =RC[-3]*157.4 -> 484.792 | G24: =RC[-5]*7.751*157.4 -> 488.00296 | H24: =RC[-1]/RC[-2] -> 1.00662337662338 | I24: =(0.2027*RC[-8]+1.2055)*1000 -> 1408.2 | L24: 6.1 | M24: 0.68 | N24: 5.6 | O24: 16 | P24: 33329 | Q24: =RC[-3]*157.4 -> 881.44 | R24: =RC[-5]*7.751*157.4 -> 829.605032 | S24: =RC[-1]/RC[-2] -> 0.941192857142857 | T24: =(0.2027*RC[-8]+1.2055)*1000 -> 2441.97
A25: 1.5 | B25: 0.424 | C25: 3.28 | D25: 25 | E25: 36281 | F25: =RC[-3]*157.4 -> 516.272 | G25: =RC[-5]*7.751*157.4 -> 517.2831376 | H25: =RC[-1]/RC[-2] -> 1.00195853658537 | I25: =(0.2027*RC[-8]+1.2055)*1000 -> 1509.55 | L25: 2.9 | M25: 0.501 | N25: 4.1 | O25: 16 | P25: 33178 | Q25: =RC[-3]*157.4 -> 645.34 | R25: =RC[-5]*7.751*157.4 -> 611.2237074 | S25: =RC[-1]/RC[-2] -> 0.947134390243903 | T25: =(0.2027*RC[-8]+1.2055)*1000 -> 1793.33
A26: 2 | B26: 0.448 | C26: 3.56 | D26: 25 | E26: 36281 | F26: =RC[-3]*157.4 -> 560.344 | G26: =RC[-5]*7.751*157.4 -> 546.5633152 | H26: =RC[-1]/RC[-2] -> 0.975406741573034 | I26: =(0.2027*RC[-8]+1.2055)*1000 -> 1610.9 | L26: 2.9 | M26: 0.504 | N26: 4.15 | O26: 16 | P26: 33208 | Q26: =RC[-3]*157.4 -> 653.21 | R26: =RC[-5]*7.751*157.4 -> 614.8837296 | S26: =RC[-1]/RC[-2] -> 0.941326265060241 | T26: =(0.2027*RC[-8]+1.2055)*1000 -> 1793.33
A27: 2.5 | B27: 0.48 | C27: 3.76 | D27: 25 | E27: 36281 | F27: =RC[-3]*157.4 -> 591.824 | G27: =RC[-5]*7.751*157.4 -> 585.603552 | H27: =RC[-1]/RC[-2] -> 0.989489361702128 | I27: =(0.2027*RC[-8]+1.2055)*1000 -> 1712.25 | L27: 3.6 | M27: 0.55 | N27: 4.48 | O27: 16 | P27: 33208 | Q27: =RC[-3]*157.4 -> 705.152 | R27: =RC[-5]*7.751*157.4 -> 671.00407 | S27: =RC[-1]/RC[-2] -> 0.951573660714286 | T27: =(0.2027*RC[-8]+1.2055)*1000 -> 1935.22
A28: 3 | B28: 0.504 | C28: 3.92 | D28: 25 | E28: 36281 | F28: =RC[-3]*157.4 -> 617.008 | G28: =RC[-5]*7.751*157.4 -> 614.8837296 | H28: =RC[-1]/RC[-2] -> 0.996557142857143 | I28: =(0.2027*RC[-8]+1.2055)*1000 -> 1813.6 | L28: 4.5 | M28: 0.6 | N28: 4.85 | O28: 16 | P28: 33208 | Q28: =RC[-3]*157.4 -> 763.39 | R28: =RC[-5]*7.751*157.4 -> 732.00444 | S28: =RC[-1]/RC[-2] -> 0.958886597938144 | T28: =(0.2027*RC[-8]+1.2055)*1000 -> 2117.65
A29: 3.5 | B29: 0.528 | C29: 4.16 | D29: 25 | E29: 36281 | F29: =RC[-3]*157.4 -> 654.784 | G29: =RC[-5]*7.751*157.4 -> 644.1639072 | H29: =RC[-1]/RC[-2] -> 0.98378076923077 | I29: =(0.2027*RC[-8]+1.2055)*1000 -> 1914.95 | L29: 5.35 | M29: 0.65 | N29: 5.25 | O29: 16 | P29: 33208 | Q29: =RC[-3]*157.4 -> 826.35 | R29: =RC[-5]*7.751*157.4 -> 793.00481 | S29: =RC[-1]/RC[-2] -> 0.959647619047619 | T29: =(0.2027*RC[-8]+1.2055)*1000 -> 2289.945
A30: 4.65 | B30: 0.6 | C30: 4.72 | D30: 25 | E30: 36281 | F30: =RC[-3]*157.4 -> 742.928 | G30: =RC[-5]*7.751*157.4 -> 732.00444 | H30: =RC[-1]/RC[-2] -> 0.985296610169492 | I30: =(0.2027*RC[-8]+1.2055)*1000 -> 2148.055 | L30: 6.1 | M30: 0.692 | N30: 5.59 | O30: 16 | P30: 33208 | Q30: =RC[-3]*157.4 -> 879.866 | R30: =RC[-5]*7.751*157.4 -> 844.2451208 | S30: =RC[-1]/RC[-2] -> 0.959515563506261 | T30: =(0.2027*RC[-8]+1.2055)*1000 -> 2441.97
A31: 0 | B31: 0.252 | C31: 1.92 | D31: 26 | E31: 36404 | F31: =RC[-3]*157.4 -> 302.208 | G31: =RC[-5]*7.751*157.4 -> 307.4418648 | H31: =RC[-1]/RC[-2] -> 1.01731875 | I31: =(0.2027*RC[-8]+1.2055)*1000 -> 1205.5 | L31: 3.5 | M31: 0.62 | N31: 5.03 | O31: 16 | P31: 37461 | Q31: =RC[-3]*157.4 -> 791.722 | R31: =RC[-5]*7.751*157.4 -> 756.404588 | S31: =RC[-1]/RC[-2] -> 0.955391650099404 | T31: =(0.2027*RC[-8]+1.2055)*1000 -> 1914.95
A32: 0 | B32: 0.328 | C32: 2.48 | D32: 26 | E32: 36404 | F32: =RC[-3]*157.4 -> 390.352 | G32: =RC[-5]*7.751*157.4 -> 400.1624272 | H32: =RC[-1]/RC[-2] -> 1.02513225806452 | I32: =(0.2027*RC[-8]+1.2055)*1000 -> 1205.5 | L32: 2 | M32: 0.5 | N32: 4.2 | O32: 16 | P32: 32933 | Q32: =RC[-3]*157.4 -> 661.08 | R32: =RC[-5]*7.751*157.4 -> 610.0037 | S32: =RC[-1]/RC[-2] -> 0.922738095238095 | T32: =(0.2027*RC[-8]+1.2055)*1000 -> 1610.9
A33: 0 | B33: 0.332 | C33: 2.52 | D33: 26 | E33: 36404 | F33: =RC[-3]*157.4 -> 396.648 | G33: =RC[-5]*7.751*157.4 -> 405.0424568 | H33: =RC[-1]/RC[-2] -> 1.02116349206349 | I33: =(0.2027*RC[-8]+1.2055)*1000 -> 1205.5 | L33: 2.75 | M33: 0.48 | N33: 4.02 | O33: 17 | P33: 33878 | Q33: =RC[-3]*157.4 -> 632.748 | R33: =RC[-5]*7.751*157.4 -> 585.603552 | S33: =RC[-1]/RC[-2] -> 0.925492537313433 | T33: =(0.2027*RC[-8]+1.2055)*1000 -> 1762.925
A34: 0 | B34: 0.26 | C34: 1.92 | D34: 24 | E34: 37165 | F34: =RC[-3]*157.4 -> 302.208 | G34: =RC[-5]*7.751*157.4 -> 317.201924 | H34: =RC[-1]/RC[-2] -> 1.04961458333333 | I34: =(0.2027*RC[-8]+1.2055)*1000 -> 1205.5 | L34: 3.75 | M34: 0.544 | N34: 4.42 | O34: 17 | P34: 33878 | Q34: =RC[-3]*157.4 -> 695.708 | R34: =RC[-5]*7.751*157.4 -> 663.6840256 | S34: =RC[-1]/RC[-2] -> 0.953969230769231 | T34: =(0.2027*RC[-8]+1.2055)*1000 -> 1965.625
A35: 1 | B35: 0.304 | C35: 2.28 | D35: 24 | E35: 37165 | F35: =RC[-3]*157.4 -> 358.872 | G35: =RC[-5]*7.751*157.4 -> 370.8822496 | H35: =RC[-1]/RC[-2] -> 1.03346666666667 | I35: =(0.2027*RC[-8]+1.2055)*1000 -> 1408.2 | L35: 4.5 | M35: 0.578 | N35: 4.75 | O35: 17 | P35: 33878 | Q35: =RC[-3]*157.4 -> 747.65 | R35: =RC[-5]*7.751*157.4 -> 705.1642772 | S35: =RC[-1]/RC[-2] -> 0.943174315789474 | T35: =(0.2027*RC[-8]+1.2055)*1000 -> 2117.65
A36: 2 | B36: 0.356 | C36: 2.64 | D36: 24 | E36: 37165 | F36: =RC[-3]*157.4 -> 415.536 | G36: =RC[-5]*7.751*157.4 -> 434.3226344 | H36: =RC[-1]/RC[-2] -> 1.04521060606061 | I36: =(0.2027*RC[-8]+1.2055)*1000 -> 1610.9 | L36: 2.75 | M36: 0.489 | N36: 4.065 | O36: 17 | P36: 33298 | Q36: =RC[-3]*157.4 -> 639.831 | R36: =RC[-5]*7.751*157.4 -> 596.5836186 | S36: =RC[-1]/RC[-2] -> 0.932408118081181 | T36: =(0.2027*RC[-8]+1.2055)*1000 -> 1762.925
A37: 3 | B37: 0.4 | C37: 2.96 | D37: 24 | E37: 37165 | F37: =RC[-3]*157.4 -> 465.904 | G37: =RC[-5]*7.751*157.4 -> 488.00296 | H37: =RC[-1]/RC[-2] -> 1.04743243243243 | I37: =(0.2027*RC[-8]+1.2055)*1000 -> 1813.6 | L37: 5.5 | M37: 0.635 | N37: 5.34 | O37: 17 | P37: 33298 | Q37: =RC[-3]*157.4 -> 840.516 | R37: =RC[-5]*7.751*157.4 -> 774.704699 | S37: =RC[-1]/RC[-2] -> 0.921701310861423 | T37: =(0.2027*RC[-8]+1.2055)*1000 -> 2320.35
A38: 3.5 | B38: 0.424 | C38: 3.12 | D38: 24 | E38: 37165 | F38: =RC[-3]*157.4 -> 491.088 | G38: =RC[-5]*7.751*157.4 -> 517.2831376 | H38: =RC[-1]/RC[-2] -> 1.05334102564103 | I38: =(0.2027*RC[-8]+1.2055)*1000 -> 1914.95 | L38: 6.3 | M38: 0.679 | N38: 5.72 | O38: 17 | P38: 33298 | Q38: =RC[-3]*157.4 -> 900.328 | R38: =RC[-5]*7.751*157.4 -> 828.3850246 | S38: =RC[-1]/RC[-2] -> 0.920092482517483 | T38: =(0.2027*RC[-8]+1.2055)*1000 -> 2482.51
A39: 4 | B39: 0.44 | C39: 3.28 | D39: 24 | E39: 37165 | F39: =RC[-3]*157.4 -> 516.272 | G39: =RC[-5]*7.751*157.4 -> 536.803256 | H39: =RC[-1]/RC[-2] -> 1.03976829268293 | I39: =(0.2027*RC[-8]+1.2055)*1000 -> 2016.3 | L39: 1.9 | M39: 0.52 | N39: 4.2 | O39: 17 | P39: 33055 | Q39: =RC[-3]*157.4 -> 661.08 | R39: =RC[-5]*7.751*157.4 -> 634.403848 | S39: =RC[-1]/RC[-2] -> 0.959647619047619 | T39: =(0.2027*RC[-8]+1.2055)*1000 -> 1590.63
A40: 4.2 | B40: 0.448 | C40: 3.32 | D40: 24 | E40: 37165 | F40: =RC[-3]*157.4 -> 522.568 | G40: =RC[-5]*7.751*157.4 -> 546.5633152 | H40: =RC[-1]/RC[-2] -> 1.04591807228916 | I40: =(0.2027*RC[-8]+1.2055)*1000 -> 2056.84 | L40: 2.75 | M40: 0.564 | N40: 4.57 | O40: 17 | P40: 33055 | Q40: =RC[-3]*157.4 -> 719.318 | R40: =RC[-5]*7.751*157.4 -> 688.0841736 | S40: =RC[-1]/RC[-2] -> 0.956578555798687 | T40: =(0.2027*RC[-8]+1.2055)*1000 -> 1762.925
A41: 0 | B41: 0.292 | C41: 2.24 | D41: 27 | E41: 37317 | F41: =RC[-3]*157.4 -> 352.576 | G41: =RC[-5]*7.751*157.4 -> 356.2421608 | H41: =RC[-1]/RC[-2] -> 1.01039821428571 | I41: =(0.2027*RC[-8]+1.2055)*1000 -> 1205.5 | L41: 3.5 | M41: 0.61 | N41: 5.04 | O41: 17 | P41: 33055 | Q41: =RC[-3]*157.4 -> 793.296 | R41: =RC[-5]*7.751*157.4 -> 744.204514 | S41: =RC[-1]/RC[-2] -> 0.938117063492063 | T41: =(0.2027*RC[-8]+1.2055)*1000 -> 1914.95
A42: 1 | B42: 0.344 | C42: 2.64 | D42: 27 | E42: 37317 | F42: =RC[-3]*157.4 -> 415.536 | G42: =RC[-5]*7.751*157.4 -> 419.6825456 | H42: =RC[-1]/RC[-2] -> 1.00997878787879 | I42: =(0.2027*RC[-8]+1.2055)*1000 -> 1408.2 | L42: 3.75 | M42: 0.5 | N42: 4.6 | O42: 18 | P42: 33635 | Q42: =RC[-3]*157.4 -> 724.04 | R42: =RC[-5]*7.751*157.4 -> 610.0037 | S42: =RC[-1]/RC[-2] -> 0.8425 | T42: =(0.2027*RC[-8]+1.2055)*1000 -> 1965.625
A43: 2 | B43: 0.4 | C43: 3.04 | D43: 27 | E43: 37317 | F43: =RC[-3]*157.4 -> 478.496 | G43: =RC[-5]*7.751*157.4 -> 488.00296 | H43: =RC[-1]/RC[-2] -> 1.01986842105263 | I43: =(0.2027*RC[-8]+1.2055)*1000 -> 1610.9 | L43: 4.6 | M43: 0 | N43: 0 | O43: 18 | P43: 33635 | Q43: =RC[-3]*157.4 -> 0 | R43: =RC[-5]*7.751*157.4 -> 0 | S43: =RC[-1]/RC[-2] -> #NUM! | T43: =(0.2027*RC[-8]+1.2055)*1000 -> 2137.92
A44: 4 | B44: 0.504 | C44: 3.8 | D44: 27 | E44: 37317 | F44: =RC[-3]*157.4 -> 598.12 | G44: =RC[-5]*7.751*157.4 -> 614.8837296 | H44: =RC[-1]/RC[-2] -> 1.02802736842105 | I44: =(0.2027*RC[-8]+1.2055)*1000 -> 2016.3 | L44: 6.25 | M44: 0.64 | N44: 5.7 | O44: 18 | P44: 33635 | Q44: =RC[-3]*157.4 -> 897.18 | R44: =RC[-5]*7.751*157.4 -> 780.804736 | S44: =RC[-1]/RC[-2] -> 0.870287719298246 | T44: =(0.2027*RC[-8]+1.2055)*1000 -> 2472.375
A45: 4.5 | B45: 0.52 | C45: 4.04 | D45: 27 | E45: 37317 | F45: =RC[-3]*157.4 -> 635.896 | G45: =RC[-5]*7.751*157.4 -> 634.403848 | H45: =RC[-1]/RC[-2] -> 0.997653465346535 | I45: =(0.2027*RC[-8]+1.2055)*1000 -> 2117.65 | L45: 4.65 | M45: 0.55 | N45: 5 | O45: 18 | P45: 33635 | Q45: =RC[-3]*157.4 -> 787 | R45: =RC[-5]*7.751*157.4 -> 671.00407 | S45: =RC[-1]/RC[-2] -> 0.85261 | T45: =(0.2027*RC[-8]+1.2055)*1000 -> 2148.055
A46: 5.8 | B46: 0.584 | C46: 4.52 | D46: 27 | E46: 37317 | F46: =RC[-3]*157.4 -> 711.448 | G46: =RC[-5]*7.751*157.4 -> 712.4843216 | H46: =RC[-1]/RC[-2] -> 1.00145663716814 | I46: =(0.2027*RC[-8]+1.2055)*1000 -> 2381.16 | L46: 0 | M46: 0.28 | N46: 2.6 | O46: 20 | P46: 37530 | Q46: =RC[-3]*157.4 -> 409.24 | R46: =RC[-5]*7.751*157.4 -> 341.602072 | S46: =RC[-1]/RC[-2] -> 0.834723076923077 | T46: =(0.2027*RC[-8]+1.2055)*1000 -> 1205.5
A47: 0 | B47: 0.296 | C47: 2.2 | D47: 27 | E47: 37317 | F47: =RC[-3]*157.4 -> 346.28 | G47: =RC[-5]*7.751*157.4 -> 361.1221904 | H47: =RC[-1]/RC[-2] -> 1.04286181818182 | I47: =(0.2027*RC[-8]+1.2055)*1000 -> 1205.5 | L47: 2.8 | M47: 0.43 | N47: 4 | O47: 20 | P47: 37531 | Q47: =RC[-3]*157.4 -> 629.6 | R47: =RC[-5]*7.751*157.4 -> 524.603182 | S47: =RC[-1]/RC[-2] -> 0.8332325 | T47: =(0.2027*RC[-8]+1.2055)*1000 -> 1773.06
A48: 1 | B48: 0.336 | C48: 2.68 | D48: 27 | E48: 37317 | F48: =RC[-3]*157.4 -> 421.832 | G48: =RC[-5]*7.751*157.4 -> 409.9224864 | H48: =RC[-1]/RC[-2] -> 0.971767164179105 | I48: =(0.2027*RC[-8]+1.2055)*1000 -> 1408.2 | L48: 3.05 | M48: 0.44 | N48: 4.2 | O48: 20 | P48: 37531 | Q48: =RC[-3]*157.4 -> 661.08 | R48: =RC[-5]*7.751*157.4 -> 536.803256 | S48: =RC[-1]/RC[-2] -> 0.812009523809524 | T48: =(0.2027*RC[-8]+1.2055)*1000 -> 1823.735
A49: 2 | B49: 0.408 | C49: 3.08 | D49: 27 | E49: 37317 | F49: =RC[-3]*157.4 -> 484.792 | G49: =RC[-5]*7.751*157.4 -> 497.7630192 | H49: =RC[-1]/RC[-2] -> 1.02675584415584 | I49: =(0.2027*RC[-8]+1.2055)*1000 -> 1610.9 | L49: 3.65 | M49: 0.47 | N49: 4.4 | O49: 20 | P49: 37532 | Q49: =RC[-3]*157.4 -> 692.56 | R49: =RC[-5]*7.751*157.4 -> 573.403478 | S49: =RC[-1]/RC[-2] -> 0.827947727272727 | T49: =(0.2027*RC[-8]+1.2055)*1000 -> 1945.355
A50: 3 | B50: 0.456 | C50: 3.44 | D50: 27 | E50: 37317 | F50: =RC[-3]*157.4 -> 541.456 | G50: =RC[-5]*7.751*157.4 -> 556.3233744 | H50: =RC[-1]/RC[-2] -> 1.02745813953488 | I50: =(0.2027*RC[-8]+1.2055)*1000 -> 1813.6 | L50: 4.1 | M50: 0.49 | N50: 4.6 | O50: 20 | P50: 37533 | Q50: =RC[-3]*157.4 -> 724.04 | R50: =RC[-5]*7.751*157.4 -> 597.803626 | S50: =RC[-1]/RC[-2] -> 0.82565 | T50: =(0.2027*RC[-8]+1.2055)*1000 -> 2036.57
A51: 4 | B51: 0.504 | C51: 3.88 | D51: 27 | E51: 37317 | F51: =RC[-3]*157.4 -> 610.712 | G51: =RC[-5]*7.751*157.4 -> 614.8837296 | H51: =RC[-1]/RC[-2] -> 1.00683092783505 | I51: =(0.2027*RC[-8]+1.2055)*1000 -> 2016.3 | L51: 4.55 | M51: 0.515 | N51: 4.8 | O51: 20 | P51: 37535 | Q51: =RC[-3]*157.4 -> 755.52 | R51: =RC[-5]*7.751*157.4 -> 628.303811 | S51: =RC[-1]/RC[-2] -> 0.831617708333333 | T51: =(0.2027*RC[-8]+1.2055)*1000 -> 2127.785
A52: 5 | B52: 0.56 | C52: 4.24 | D52: 27 | E52: 37317 | F52: =RC[-3]*157.4 -> 667.376 | G52: =RC[-5]*7.751*157.4 -> 683.204144 | H52: =RC[-1]/RC[-2] -> 1.02371698113208 | I52: =(0.2027*RC[-8]+1.2055)*1000 -> 2219 | L52: 5.05 | M52: 0.54 | N52: 5 | O52: 20 | P52: 37535 | Q52: =RC[-3]*157.4 -> 787 | R52: =RC[-5]*7.751*157.4 -> 658.803996 | S52: =RC[-1]/RC[-2] -> 0.837108 | T52: =(0.2027*RC[-8]+1.2055)*1000 -> 2229.135
A53: 5.7 | B53: 0.592 | C53: 4.48 | D53: 27 | E53: 37317 | F53: =RC[-3]*157.4 -> 705.152 | G53: =RC[-5]*7.751*157.4 -> 722.2443808 | H53: =RC[-1]/RC[-2] -> 1.02423928571429 | I53: =(0.2027*RC[-8]+1.2055)*1000 -> 2360.89 | L53: 5.45 | M53: 0.555 | N53: 5.2 | O53: 20 | P53: 37538 | Q53: =RC[-3]*157.4 -> 818.48 | R53: =RC[-5]*7.751*157.4 -> 677.104107 | S53: =RC[-1]/RC[-2] -> 0.827270192307692 | T53: =(0.2027*RC[-8]+1.2055)*1000 -> 2310.215
A54: 5.5 | B54: 0.584 | C54: 4.4 | D54: 27 | E54: 37317 | F54: =RC[-3]*157.4 -> 692.56 | G54: =RC[-5]*7.751*157.4 -> 712.4843216 | H54: =RC[-1]/RC[-2] -> 1.02876909090909 | I54: =(0.2027*RC[-8]+1.2055)*1000 -> 2320.35 | L54: 6 | M54: 0.58 | N54: 5.4 | O54: 20 | P54: 37539 | Q54: =RC[-3]*157.4 -> 849.96 | R54: =RC[-5]*7.751*157.4 -> 707.604292 | S54: =RC[-1]/RC[-2] -> 0.832514814814815 | T54: =(0.2027*RC[-8]+1.2055)*1000 -> 2421.7
A55: 5.5 | B55: 0.584 | C55: 4.4 | D55: 27 | E55: 37317 | F55: =RC[-3]*157.4 -> 692.56 | G55: =RC[-5]*7.751*157.4 -> 712.4843216 | H55: =RC[-1]/RC[-2] -> 1.02876909090909 | I55: =(0.2027*RC[-8]+1.2055)*1000 -> 2320.35 | L55: 6.4 | M55: 0.6 | N55: 5.6 | O55: 20 | P55: 37540 | Q55: =RC[-3]*157.4 -> 881.44 | R55: =RC[-5]*7.751*157.4 -> 732.00444 | S55: =RC[-1]/RC[-2] -> 0.830464285714286 | T55: =(0.2027*RC[-8]+1.2055)*1000 -> 2502.78
A56: 5.5 | B56: 0.576 | C56: 4.4 | D56: 27 | E56: 37317 | F56: =RC[-3]*157.4 -> 692.56 | G56: =RC[-5]*7.751*157.4 -> 702.7242624 | H56: =RC[-1]/RC[-2] -> 1.01467636363636 | I56: =(0.2027*RC[-8]+1.2055)*1000 -> 2320.35 | L56: 6.65 | M56: 0.61 | N56: 5.7 | O56: 20 | P56: 37541 | Q56: =RC[-3]*157.4 -> 897.18 | R56: =RC[-5]*7.751*157.4 -> 744.204514 | S56: =RC[-1]/RC[-2] -> 0.82949298245614 | T56: =(0.2027*RC[-8]+1.2055)*1000 -> 2553.455
A57: 6 | B57: 0.604 | C57: 4.64 | D57: 27 | E57: 37317 | F57: =RC[-3]*157.4 -> 730.336 | G57: =RC[-5]*7.751*157.4 -> 736.8844696 | H57: =RC[-1]/RC[-2] -> 1.00896637931034 | I57: =(0.2027*RC[-8]+1.2055)*1000 -> 2421.7 | L57: 0 | M57: 0.3 | N57: 2.7 | O57: 21 | P57: 34182 | Q57: =RC[-3]*157.4 -> 424.98 | R57: =RC[-5]*7.751*157.4 -> 366.00222 | S57: =RC[-1]/RC[-2] -> 0.861222222222222 | T57: =(0.2027*RC[-8]+1.2055)*1000 -> 1205.5
A58: 6.35 | B58: 0.62 | C58: 4.72 | D58: 27 | E58: 37317 | F58: =RC[-3]*157.4 -> 742.928 | G58: =RC[-5]*7.751*157.4 -> 756.404588 | H58: =RC[-1]/RC[-2] -> 1.01813983050847 | I58: =(0.2027*RC[-8]+1.2055)*1000 -> 2492.645 | L58: 2.75 | M58: 0.42 | N58: 4 | O58: 21 | P58: 34182 | Q58: =RC[-3]*157.4 -> 629.6 | R58: =RC[-5]*7.751*157.4 -> 512.403108 | S58: =RC[-1]/RC[-2] -> 0.813855 | T58: =(0.2027*RC[-8]+1.2055)*1000 -> 1762.925
A59: 6.4 | B59: 0.628 | C59: 4.76 | D59: 27 | E59: 37317 | F59: =RC[-3]*157.4 -> 749.224 | G59: =RC[-5]*7.751*157.4 -> 766.1646472 | H59: =RC[-1]/RC[-2] -> 1.02261092436975 | I59: =(0.2027*RC[-8]+1.2055)*1000 -> 2502.78 | L59: 3.2 | M59: 0.45 | N59: 4.2 | O59: 21 | P59: 34182 | Q59: =RC[-3]*157.4 -> 661.08 | R59: =RC[-5]*7.751*157.4 -> 549.00333 | S59: =RC[-1]/RC[-2] -> 0.830464285714286 | T59: =(0.2027*RC[-8]+1.2055)*1000 -> 1854.14
A60: 5.5 | B60: 0.632 | C60: 4.24 | D60: 28 | E60: 37553 | F60: =RC[-3]*157.4 -> 667.376 | G60: =RC[-5]*7.751*157.4 -> 771.0446768 | H60: =RC[-1]/RC[-2] -> 1.15533773584906 | I60: =(0.2027*RC[-8]+1.2055)*1000 -> 2320.35 | L60: 3.6 | M60: 0.465 | N60: 4.4 | O60: 21 | P60: 34182 | Q60: =RC[-3]*157.4 -> 692.56 | R60: =RC[-5]*7.751*157.4 -> 567.303441 | S60: =RC[-1]/RC[-2] -> 0.819139772727273 | T60: =(0.2027*RC[-8]+1.2055)*1000 -> 1935.22
A61: 1 | B61: 0.432 | C61: 2.88 | D61: 28 | E61: 37553 | F61: =RC[-3]*157.4 -> 453.312 | G61: =RC[-5]*7.751*157.4 -> 527.0431968 | H61: =RC[-1]/RC[-2] -> 1.16265 | I61: =(0.2027*RC[-8]+1.2055)*1000 -> 1408.2 | L61: 4.2 | M61: 0.49 | N61: 4.6 | O61: 21 | P61: 34182 | Q61: =RC[-3]*157.4 -> 724.04 | R61: =RC[-5]*7.751*157.4 -> 597.803626 | S61: =RC[-1]/RC[-2] -> 0.82565 | T61: =(0.2027*RC[-8]+1.2055)*1000 -> 2056.84
A62: 2 | B62: 0.488 | C62: 3.2 | D62: 28 | E62: 37553 | F62: =RC[-3]*157.4 -> 503.68 | G62: =RC[-5]*7.751*157.4 -> 595.3636112 | H62: =RC[-1]/RC[-2] -> 1.1820275 | I62: =(0.2027*RC[-8]+1.2055)*1000 -> 1610.9 | L62: 4.6 | M62: 0.52 | N62: 4.8 | O62: 21 | P62: 34182 | Q62: =RC[-3]*157.4 -> 755.52 | R62: =RC[-5]*7.751*157.4 -> 634.403848 | S62: =RC[-1]/RC[-2] -> 0.839691666666667 | T62: =(0.2027*RC[-8]+1.2055)*1000 -> 2137.92
A63: 3 | B63: 0.544 | C63: 3.6 | D63: 28 | E63: 37553 | F63: =RC[-3]*157.4 -> 566.64 | G63: =RC[-5]*7.751*157.4 -> 663.6840256 | H63: =RC[-1]/RC[-2] -> 1.17126222222222 | I63: =(0.2027*RC[-8]+1.2055)*1000 -> 1813.6 | L63: 5.15 | M63: 0.54 | N63: 5 | O63: 21 | P63: 34182 | Q63: =RC[-3]*157.4 -> 787 | R63: =RC[-5]*7.751*157.4 -> 658.803996 | S63: =RC[-1]/RC[-2] -> 0.837108 | T63: =(0.2027*RC[-8]+1.2055)*1000 -> 2249.405
A64: 4 | B64: 0.6 | C64: 4 | D64: 28 | E64: 37553 | F64: =RC[-3]*157.4 -> 629.6 | G64: =RC[-5]*7.751*157.4 -> 732.00444 | H64: =RC[-1]/RC[-2] -> 1.16265 | I64: =(0.2027*RC[-8]+1.2055)*1000 -> 2016.3 | L64: 5.5 | M64: 0.56 | N64: 5.2 | O64: 21 | P64: 34182 | Q64: =RC[-3]*157.4 -> 818.48 | R64: =RC[-5]*7.751*157.4 -> 683.204144 | S64: =RC[-1]/RC[-2] -> 0.834723076923077 | T64: =(0.2027*RC[-8]+1.2055)*1000 -> 2320.35
A65: 5 | B65: 0.664 | C65: 4.4 | D65: 28 | E65: 37553 | F65: =RC[-3]*157.4 -> 692.56 | G65: =RC[-5]*7.751*157.4 -> 810.0849136 | H65: =RC[-1]/RC[-2] -> 1.16969636363636 | I65: =(0.2027*RC[-8]+1.2055)*1000 -> 2219 | L65: 6 | M65: 0.59 | N65: 5.4 | O65: 21 | P65: 34182 | Q65: =RC[-3]*157.4 -> 849.96 | R65: =RC[-5]*7.751*157.4 -> 719.804366 | S65: =RC[-1]/RC[-2] -> 0.846868518518518 | T65: =(0.2027*RC[-8]+1.2055)*1000 -> 2421.7
A66: 5.45 | B66: 0.632 | C66: 4.24 | D66: 28 | E66: 37553 | F66: =RC[-3]*157.4 -> 667.376 | G66: =RC[-5]*7.751*157.4 -> 771.0446768 | H66: =RC[-1]/RC[-2] -> 1.15533773584906 | I66: =(0.2027*RC[-8]+1.2055)*1000 -> 2310.215 | L66: 6.4 | M66: 0.61 | N66: 5.6 | O66: 21 | P66: 34182 | Q66: =RC[-3]*157.4 -> 881.44 | R66: =RC[-5]*7.751*157.4 -> 744.204514 | S66: =RC[-1]/RC[-2] -> 0.844305357142857 | T66: =(0.2027*RC[-8]+1.2055)*1000 -> 2502.78
A67: 5.3 | B67: 0.62 | C67: 4.16 | D67: 28 | E67: 37553 | F67: =RC[-3]*157.4 -> 654.784 | G67: =RC[-5]*7.751*157.4 -> 756.404588 | H67: =RC[-1]/RC[-2] -> 1.15519711538462 | I67: =(0.2027*RC[-8]+1.2055)*1000 -> 2279.81 | L67: 6.65 | M67: 0.62 | N67: 5.7 | O67: 21 | P67: 34182 | Q67: =RC[-3]*157.4 -> 897.18 | R67: =RC[-5]*7.751*157.4 -> 756.404588 | S67: =RC[-1]/RC[-2] -> 0.843091228070175 | T67: =(0.2027*RC[-8]+1.2055)*1000 -> 2553.455
A68: 0 | B68: 0.328 | C68: 2.08 | D68: 28 | E68: 37554 | F68: =RC[-3]*157.4 -> 327.392 | G68: =RC[-5]*7.751*157.4 -> 400.1624272 | H68: =RC[-1]/RC[-2] -> 1.22227307692308 | I68: =(0.2027*RC[-8]+1.2055)*1000 -> 1205.5 | L68: 0 | M68: 0.48 | N68: 3.8 | O68: 22 | P68: 35013 | Q68: =RC[-3]*157.4 -> 598.12 | R68: =RC[-5]*7.751*157.4 -> 585.603552 | S68: =RC[-1]/RC[-2] -> 0.979073684210526 | T68: =(0.2027*RC[-8]+1.2055)*1000 -> 1205.5
A69: 1 | B69: 0.392 | C69: 2.64 | D69: 28 | E69: 37554 | F69: =RC[-3]*157.4 -> 415.536 | G69: =RC[-5]*7.751*157.4 -> 478.2429008 | H69: =RC[-1]/RC[-2] -> 1.15090606060606 | I69: =(0.2027*RC[-8]+1.2055)*1000 -> 1408.2 | L69: 1.1 | M69: 0.35 | N69: 3 | O69: 22 | P69: 35014 | Q69: =RC[-3]*157.4 -> 472.2 | R69: =RC[-5]*7.751*157.4 -> 427.00259 | S69: =RC[-1]/RC[-2] -> 0.904283333333333 | T69: =(0.2027*RC[-8]+1.2055)*1000 -> 1428.47
A70: 2 | B70: 0.452 | C70: 3.04 | D70: 28 | E70: 37554 | F70: =RC[-3]*157.4 -> 478.496 | G70: =RC[-5]*7.751*157.4 -> 551.4433448 | H70: =RC[-1]/RC[-2] -> 1.15245131578947 | I70: =(0.2027*RC[-8]+1.2055)*1000 -> 1610.9 | L70: 4.2 | M70: 0.51 | N70: 4.6 | O70: 22 | P70: 35015 | Q70: =RC[-3]*157.4 -> 724.04 | R70: =RC[-5]*7.751*157.4 -> 622.203774 | S70: =RC[-1]/RC[-2] -> 0.85935 | T70: =(0.2027*RC[-8]+1.2055)*1000 -> 2056.84
A71: 3 | B71: 0.512 | C71: 3.36 | D71: 28 | E71: 37554 | F71: =RC[-3]*157.4 -> 528.864 | G71: =RC[-5]*7.751*157.4 -> 624.6437888 | H71: =RC[-1]/RC[-2] -> 1.18110476190476 | I71: =(0.2027*RC[-8]+1.2055)*1000 -> 1813.6 | L71: 5.2 | M71: 0.58 | N71: 5.1 | O71: 22 | P71: 35015 | Q71: =RC[-3]*157.4 -> 802.74 | R71: =RC[-5]*7.751*157.4 -> 707.604292 | S71: =RC[-1]/RC[-2] -> 0.881486274509804 | T71: =(0.2027*RC[-8]+1.2055)*1000 -> 2259.54
A72: 4 | B72: 0.564 | C72: 3.8 | D72: 28 | E72: 37554 | F72: =RC[-3]*157.4 -> 598.12 | G72: =RC[-5]*7.751*157.4 -> 688.0841736 | H72: =RC[-1]/RC[-2] -> 1.15041157894737 | I72: =(0.2027*RC[-8]+1.2055)*1000 -> 2016.3 | L72: 2 | M72: 0.3 | N72: 2.6 | O72: 23 | P72: 35400 | Q72: =RC[-3]*157.4 -> 409.24 | R72: =RC[-5]*7.751*157.4 -> 366.00222 | S72: =RC[-1]/RC[-2] -> 0.894346153846154 | T72: =(0.2027*RC[-8]+1.2055)*1000 -> 1610.9
A73: 5 | B73: 0.62 | C73: 4.12 | D73: 28 | E73: 37554 | F73: =RC[-3]*157.4 -> 648.488 | G73: =RC[-5]*7.751*157.4 -> 756.404588 | H73: =RC[-1]/RC[-2] -> 1.16641262135922 | I73: =(0.2027*RC[-8]+1.2055)*1000 -> 2219 | L73: 3.75 | M73: 0.49 | N73: 4.3 | O73: 23 | P73: 35400 | Q73: =RC[-3]*157.4 -> 676.82 | R73: =RC[-5]*7.751*157.4 -> 597.803626 | S73: =RC[-1]/RC[-2] -> 0.883253488372093 | T73: =(0.2027*RC[-8]+1.2055)*1000 -> 1965.625
A74: 5.28 | B74: 0.628 | C74: 4.24 | D74: 28 | E74: 37554 | F74: =RC[-3]*157.4 -> 667.376 | G74: =RC[-5]*7.751*157.4 -> 766.1646472 | H74: =RC[-1]/RC[-2] -> 1.14802547169811 | I74: =(0.2027*RC[-8]+1.2055)*1000 -> 2275.756 | L74: 3.75 | M74: 0.48 | N74: 4.3 | O74: 23 | P74: 35400 | Q74: =RC[-3]*157.4 -> 676.82 | R74: =RC[-5]*7.751*157.4 -> 585.603552 | S74: =RC[-1]/RC[-2] -> 0.865227906976744 | T74: =(0.2027*RC[-8]+1.2055)*1000 -> 1965.625
A75: 0 | B75: 0.48 | C75: 3.8 | D75: 22 | E75: 35013 | F75: =RC[-3]*157.4 -> 598.12 | G75: =RC[-5]*7.751*157.4 -> 585.603552 | H75: =RC[-1]/RC[-2] -> 0.979073684210526 | I75: =(0.2027*RC[-8]+1.2055)*1000 -> 1205.5 | L75: 4.5 | M75: 0.53 | N75: 4.7 | O75: 23 | P75: 35400 | Q75: =RC[-3]*157.4 -> 739.78 | R75: =RC[-5]*7.751*157.4 -> 646.603922 | S75: =RC[-1]/RC[-2] -> 0.874048936170213 | T75: =(0.2027*RC[-8]+1.2055)*1000 -> 2117.65
A76: 1.1 | B76: 0.35 | C76: 3 | D76: 22 | E76: 35014 | F76: =RC[-3]*157.4 -> 472.2 | G76: =RC[-5]*7.751*157.4 -> 427.00259 | H76: =RC[-1]/RC[-2] -> 0.904283333333333 | I76: =(0.2027*RC[-8]+1.2055)*1000 -> 1428.47 | L76: 4.5 | M76: 0.52 | N76: 4.65 | O76: 23 | P76: 35400 | Q76: =RC[-3]*157.4 -> 731.91 | R76: =RC[-5]*7.751*157.4 -> 634.403848 | S76: =RC[-1]/RC[-2] -> 0.866778494623656 | T76: =(0.2027*RC[-8]+1.2055)*1000 -> 2117.65
A77: 4.2 | B77: 0.51 | C77: 4.6 | D77: 22 | E77: 35015 | F77: =RC[-3]*157.4 -> 724.04 | G77: =RC[-5]*7.751*157.4 -> 622.203774 | H77: =RC[-1]/RC[-2] -> 0.85935 | I77: =(0.2027*RC[-8]+1.2055)*1000 -> 2056.84 | L77: 2.8 | M77: 0.528 | N77: 3.9 | O77: 24 | P77: 35765 | Q77: =RC[-3]*157.4 -> 613.86 | R77: =RC[-5]*7.751*157.4 -> 644.1639072 | S77: =RC[-1]/RC[-2] -> 1.04936615384615 | T77: =(0.2027*RC[-8]+1.2055)*1000 -> 1773.06
A78: 5.2 | B78: 0.58 | C78: 5.1 | D78: 22 | E78: 35015 | F78: =RC[-3]*157.4 -> 802.74 | G78: =RC[-5]*7.751*157.4 -> 707.604292 | H78: =RC[-1]/RC[-2] -> 0.881486274509804 | I78: =(0.2027*RC[-8]+1.2055)*1000 -> 2259.54 | L78: 2.8 | M78: 0.52 | N78: 3.84 | O78: 24 | P78: 35765 | Q78: =RC[-3]*157.4 -> 604.416 | R78: =RC[-5]*7.751*157.4 -> 634.403848 | S78: =RC[-1]/RC[-2] -> 1.04961458333333 | T78: =(0.2027*RC[-8]+1.2055)*1000 -> 1773.06
A79: 0 | B79: 0.28 | C79: 2.6 | D79: 20 | E79: 37530 | F79: =RC[-3]*157.4 -> 409.24 | G79: =RC[-5]*7.751*157.4 -> 341.602072 | H79: =RC[-1]/RC[-2] -> 0.834723076923077 | I79: =(0.2027*RC[-8]+1.2055)*1000 -> 1205.5 | L79: 2.8 | M79: 0.512 | N79: 3.84 | O79: 24 | P79: 35765 | Q79: =RC[-3]*157.4 -> 604.416 | R79: =RC[-5]*7.751*157.4 -> 624.6437888 | S79: =RC[-1]/RC[-2] -> 1.03346666666667 | T79: =(0.2027*RC[-8]+1.2055)*1000 -> 1773.06
A80: 2.8 | B80: 0.43 | C80: 4 | D80: 20 | E80: 37531 | F80: =RC[-3]*157.4 -> 629.6 | G80: =RC[-5]*7.751*157.4 -> 524.603182 | H80: =RC[-1]/RC[-2] -> 0.8332325 | I80: =(0.2027*RC[-8]+1.2055)*1000 -> 1773.06 | L80: 2.8 | M80: 0.52 | N80: 3.92 | O80: 24 | P80: 35765 | Q80: =RC[-3]*157.4 -> 617.008 | R80: =RC[-5]*7.751*157.4 -> 634.403848 | S80: =RC[-1]/RC[-2] -> 1.02819387755102 | T80: =(0.2027*RC[-8]+1.2055)*1000 -> 1773.06
A81: 3.05 | B81: 0.44 | C81: 4.2 | D81: 20 | E81: 37531 | F81: =RC[-3]*157.4 -> 661.08 | G81: =RC[-5]*7.751*157.4 -> 536.803256 | H81: =RC[-1]/RC[-2] -> 0.812009523809524 | I81: =(0.2027*RC[-8]+1.2055)*1000 -> 1823.735 | L81: 5.15 | M81: 0.66 | N81: 4.96 | O81: 24 | P81: 35765 | Q81: =RC[-3]*157.4 -> 780.704 | R81: =RC[-5]*7.751*157.4 -> 805.204884 | S81: =RC[-1]/RC[-2] -> 1.03138306451613 | T81: =(0.2027*RC[-8]+1.2055)*1000 -> 2249.405
A82: 3.65 | B82: 0.47 | C82: 4.4 | D82: 20 | E82: 37532 | F82: =RC[-3]*157.4 -> 692.56 | G82: =RC[-5]*7.751*157.4 -> 573.403478 | H82: =RC[-1]/RC[-2] -> 0.827947727272727 | I82: =(0.2027*RC[-8]+1.2055)*1000 -> 1945.355 | L82: 0 | M82: 0.336 | N82: 3.64 | O82: 24 | P82: 35765 | Q82: =RC[-3]*157.4 -> 572.936 | R82: =RC[-5]*7.751*157.4 -> 409.9224864 | S82: =RC[-1]/RC[-2] -> 0.715476923076923 | T82: =(0.2027*RC[-8]+1.2055)*1000 -> 1205.5
A83: 4.1 | B83: 0.49 | C83: 4.6 | D83: 20 | E83: 37533 | F83: =RC[-3]*157.4 -> 724.04 | G83: =RC[-5]*7.751*157.4 -> 597.803626 | H83: =RC[-1]/RC[-2] -> 0.82565 | I83: =(0.2027*RC[-8]+1.2055)*1000 -> 2036.57 | L83: 2.8 | M83: 0.52 | N83: 3.92 | O83: 24 | P83: 35765 | Q83: =RC[-3]*157.4 -> 617.008 | R83: =RC[-5]*7.751*157.4 -> 634.403848 | S83: =RC[-1]/RC[-2] -> 1.02819387755102 | T83: =(0.2027*RC[-8]+1.2055)*1000 -> 1773.06
A84: 4.55 | B84: 0.515 | C84: 4.8 | D84: 20 | E84: 37535 | F84: =RC[-3]*157.4 -> 755.52 | G84: =RC[-5]*7.751*157.4 -> 628.303811 | H84: =RC[-1]/RC[-2] -> 0.831617708333333 | I84: =(0.2027*RC[-8]+1.2055)*1000 -> 2127.785 | L84: 2.8 | M84: 0.51 | N84: 3.92 | O84: 24 | P84: 35765 | Q84: =RC[-3]*157.4 -> 617.008 | R84: =RC[-5]*7.751*157.4 -> 622.203774 | S84: =RC[-1]/RC[-2] -> 1.00842091836735 | T84: =(0.2027*RC[-8]+1.2055)*1000 -> 1773.06
A85: 5.05 | B85: 0.54 | C85: 5 | D85: 20 | E85: 37535 | F85: =RC[-3]*157.4 -> 787 | G85: =RC[-5]*7.751*157.4 -> 658.803996 | H85: =RC[-1]/RC[-2] -> 0.837108 | I85: =(0.2027*RC[-8]+1.2055)*1000 -> 2229.135 | L85: 5.15 | M85: 0.656 | N85: 4.96 | O85: 24 | P85: 35765 | Q85: =RC[-3]*157.4 -> 780.704 | R85: =RC[-5]*7.751*157.4 -> 800.3248544 | S85: =RC[-1]/RC[-2] -> 1.02513225806452 | T85: =(0.2027*RC[-8]+1.2055)*1000 -> 2249.405
A86: 5.45 | B86: 0.555 | C86: 5.2 | D86: 20 | E86: 37538 | F86: =RC[-3]*157.4 -> 818.48 | G86: =RC[-5]*7.751*157.4 -> 677.104107 | H86: =RC[-1]/RC[-2] -> 0.827270192307692 | I86: =(0.2027*RC[-8]+1.2055)*1000 -> 2310.215 | L86: 5.15 | M86: 0.648 | N86: 5.04 | O86: 24 | P86: 35765 | Q86: =RC[-3]*157.4 -> 793.296 | R86: =RC[-5]*7.751*157.4 -> 790.5647952 | S86: =RC[-1]/RC[-2] -> 0.996557142857143 | T86: =(0.2027*RC[-8]+1.2055)*1000 -> 2249.405
A87: 6 | B87: 0.58 | C87: 5.4 | D87: 20 | E87: 37539 | F87: =RC[-3]*157.4 -> 849.96 | G87: =RC[-5]*7.751*157.4 -> 707.604292 | H87: =RC[-1]/RC[-2] -> 0.832514814814815 | I87: =(0.2027*RC[-8]+1.2055)*1000 -> 2421.7 | L87: 2.8 | M87: 0.52 | N87: 3.92 | O87: 24 | P87: 35765 | Q87: =RC[-3]*157.4 -> 617.008 | R87: =RC[-5]*7.751*157.4 -> 634.403848 | S87: =RC[-1]/RC[-2] -> 1.02819387755102 | T87: =(0.2027*RC[-8]+1.2055)*1000 -> 1773.06
A88: 6.4 | B88: 0.6 | C88: 5.6 | D88: 20 | E88: 37540 | F88: =RC[-3]*157.4 -> 881.44 | G88: =RC[-5]*7.751*157.4 -> 732.00444 | H88: =RC[-1]/RC[-2] -> 0.830464285714286 | I88: =(0.2027*RC[-8]+1.2055)*1000 -> 2502.78 | L88: 5.15 | M88: 0.648 | N88: 5.04 | O88: 24 | P88: 35765 | Q88: =RC[-3]*157.4 -> 793.296 | R88: =RC[-5]*7.751*157.4 -> 790.5647952 | S88: =RC[-1]/RC[-2] -> 0.996557142857143 | T88: =(0.2027*RC[-8]+1.2055)*1000 -> 2249.405
A89: 6.65 | B89: 0.61 | C89: 5.7 | D89: 20 | E89: 37541 | F89: =RC[-3]*157.4 -> 897.18 | G89: =RC[-5]*7.751*157.4 -> 744.204514 | H89: =RC[-1]/RC[-2] -> 0.82949298245614 | I89: =(0.2027*RC[-8]+1.2055)*1000 -> 2553.455 | L89: 4.2 | M89: 0.448 | N89: 3.32 | O89: 24 | P89: 35765 | Q89: =RC[-3]*157.4 -> 522.568 | R89: =RC[-5]*7.751*157.4 -> 546.5633152 | S89: =RC[-1]/RC[-2] -> 1.04591807228916 | T89: =(0.2027*RC[-8]+1.2055)*1000 -> 2056.84
A90: 0 | B90: 0.3 | C90: 2.7 | D90: 21 | E90: 34182 | F90: =RC[-3]*157.4 -> 424.98 | G90: =RC[-5]*7.751*157.4 -> 366.00222 | H90: =RC[-1]/RC[-2] -> 0.861222222222222 | I90: =(0.2027*RC[-8]+1.2055)*1000 -> 1205.5 | L90: 2.8 | M90: 0.52 | N90: 3.92 | O90: 24 | P90: 35765 | Q90: =RC[-3]*157.4 -> 617.008 | R90: =RC[-5]*7.751*157.4 -> 634.403848 | S90: =RC[-1]/RC[-2] -> 1.02819387755102 | T90: =(0.2027*RC[-8]+1.2055)*1000 -> 1773.06
A91: 2.75 | B91: 0.42 | C91: 4 | D91: 21 | E91: 34182 | F91: =RC[-3]*157.4 -> 629.6 | G91: =RC[-5]*7.751*157.4 -> 512.403108 | H91: =RC[-1]/RC[-2] -> 0.813855 | I91: =(0.2027*RC[-8]+1.2055)*1000 -> 1762.925 | L91: 5.15 | M91: 0.648 | N91: 4.96 | O91: 24 | P91: 35765 | Q91: =RC[-3]*157.4 -> 780.704 | R91: =RC[-5]*7.751*157.4 -> 790.5647952 | S91: =RC[-1]/RC[-2] -> 1.01263064516129 | T91: =(0.2027*RC[-8]+1.2055)*1000 -> 2249.405
A92: 3.2 | B92: 0.45 | C92: 4.2 | D92: 21 | E92: 34182 | F92: =RC[-3]*157.4 -> 661.08 | G92: =RC[-5]*7.751*157.4 -> 549.00333 | H92: =RC[-1]/RC[-2] -> 0.830464285714286 | I92: =(0.2027*RC[-8]+1.2055)*1000 -> 1854.14 | L92: 0 | M92: 0.26 | N92: 1.92 | O92: 24 | P92: 37165 | Q92: =RC[-3]*157.4 -> 302.208 | R92: =RC[-5]*7.751*157.4 -> 317.201924 | S92: =RC[-1]/RC[-2] -> 1.04961458333333 | T92: =(0.2027*RC[-8]+1.2055)*1000 -> 1205.5
A93: 3.6 | B93: 0.465 | C93: 4.4 | D93: 21 | E93: 34182 | F93: =RC[-3]*157.4 -> 692.56 | G93: =RC[-5]*7.751*157.4 -> 567.303441 | H93: =RC[-1]/RC[-2] -> 0.819139772727273 | I93: =(0.2027*RC[-8]+1.2055)*1000 -> 1935.22 | L93: 1 | M93: 0.304 | N93: 2.28 | O93: 24 | P93: 37165 | Q93: =RC[-3]*157.4 -> 358.872 | R93: =RC[-5]*7.751*157.4 -> 370.8822496 | S93: =RC[-1]/RC[-2] -> 1.03346666666667 | T93: =(0.2027*RC[-8]+1.2055)*1000 -> 1408.2
A94: 4.2 | B94: 0.49 | C94: 4.6 | D94: 21 | E94: 34182 | F94: =RC[-3]*157.4 -> 724.04 | G94: =RC[-5]*7.751*157.4 -> 597.803626 | H94: =RC[-1]/RC[-2] -> 0.82565 | I94: =(0.2027*RC[-8]+1.2055)*1000 -> 2056.84 | L94: 2 | M94: 0.356 | N94: 2.64 | O94: 24 | P94: 37165 | Q94: =RC[-3]*157.4 -> 415.536 | R94: =RC[-5]*7.751*157.4 -> 434.3226344 | S94: =RC[-1]/RC[-2] -> 1.04521060606061 | T94: =(0.2027*RC[-8]+1.2055)*1000 -> 1610.9
A95: 4.6 | B95: 0.52 | C95: 4.8 | D95: 21 | E95: 34182 | F95: =RC[-3]*157.4 -> 755.52 | G95: =RC[-5]*7.751*157.4 -> 634.403848 | H95: =RC[-1]/RC[-2] -> 0.839691666666667 | I95: =(0.2027*RC[-8]+1.2055)*1000 -> 2137.92 | L95: 3 | M95: 0.4 | N95: 2.96 | O95: 24 | P95: 37165 | Q95: =RC[-3]*157.4 -> 465.904 | R95: =RC[-5]*7.751*157.4 -> 488.00296 | S95: =RC[-1]/RC[-2] -> 1.04743243243243 | T95: =(0.2027*RC[-8]+1.2055)*1000 -> 1813.6
A96: 5.15 | B96: 0.54 | C96: 5 | D96: 21 | E96: 34182 | F96: =RC[-3]*157.4 -> 787 | G96: =RC[-5]*7.751*157.4 -> 658.803996 | H96: =RC[-1]/RC[-2] -> 0.837108 | I96: =(0.2027*RC[-8]+1.2055)*1000 -> 2249.405 | L96: 3.5 | M96: 0.424 | N96: 3.12 | O96: 24 | P96: 37165 | Q96: =RC[-3]*157.4 -> 491.088 | R96: =RC[-5]*7.751*157.4 -> 517.2831376 | S96: =RC[-1]/RC[-2] -> 1.05334102564103 | T96: =(0.2027*RC[-8]+1.2055)*1000 -> 1914.95
A97: 5.5 | B97: 0.56 | C97: 5.2 | D97: 21 | E97: 34182 | F97: =RC[-3]*157.4 -> 818.48 | G97: =RC[-5]*7.751*157.4 -> 683.204144 | H97: =RC[-1]/RC[-2] -> 0.834723076923077 | I97: =(0.2027*RC[-8]+1.2055)*1000 -> 2320.35 | L97: 4 | M97: 0.44 | N97: 3.28 | O97: 24 | P97: 37165 | Q97: =RC[-3]*157.4 -> 516.272 | R97: =RC[-5]*7.751*157.4 -> 536.803256 | S97: =RC[-1]/RC[-2] -> 1.03976829268293 | T97: =(0.2027*RC[-8]+1.2055)*1000 -> 2016.3
A98: 6 | B98: 0.59 | C98: 5.4 | D98: 21 | E98: 34182 | F98: =RC[-3]*157.4 -> 849.96 | G98: =RC[-5]*7.751*157.4 -> 719.804366 | H98: =RC[-1]/RC[-2] -> 0.846868518518518 | I98: =(0.2027*RC[-8]+1.2055)*1000 -> 2421.7 | L98: 4.2 | M98: 0.448 | N98: 3.32 | O98: 24 | P98: 37165 | Q98: =RC[-3]*157.4 -> 522.568 | R98: =RC[-5]*7.751*157.4 -> 546.5633152 | S98: =RC[-1]/RC[-2] -> 1.04591807228916 | T98: =(0.2027*RC[-8]+1.2055)*1000 -> 2056.84
A99: 6.4 | B99: 0.61 | C99: 5.6 | D99: 21 | E99: 34182 | F99: =RC[-3]*157.4 -> 881.44 | G99: =RC[-5]*7.751*157.4 -> 744.204514 | H99: =RC[-1]/RC[-2] -> 0.844305357142857 | I99: =(0.2027*RC[-8]+1.2055)*1000 -> 2502.78 | L99: 0 | M99: 0.332 | N99: 2.5 | O99: 25 | P99: 36281 | Q99: =RC[-3]*157.4 -> 393.5 | R99: =RC[-5]*7.751*157.4 -> 405.0424568 | S99: =RC[-1]/RC[-2] -> 1.0293328 | T99: =(0.2027*RC[-8]+1.2055)*1000 -> 1205.5
A100: 6.65 | B100: 0.62 | C100: 5.7 | D100: 21 | E100: 34182 | F100: =RC[-3]*157.4 -> 897.18 | G100: =RC[-5]*7.751*157.4 -> 756.404588 | H100: =RC[-1]/RC[-2] -> 0.843091228070175 | I100: =(0.2027*RC[-8]+1.2055)*1000 -> 2553.455 | L100: 0 | M100: 0.328 | N100: 2.6 | O100: 25 | P100: 36281 | Q100: =RC[-3]*157.4 -> 409.24 | R100: =RC[-5]*7.751*157.4 -> 400.1624272 | S100: =RC[-1]/RC[-2] -> 0.977818461538462 | T100: =(0.2027*RC[-8]+1.2055)*1000 -> 1205.5
A101: 0 | B101: 0 | C101: 2 | D101: 4 | E101: 31017 | F101: =RC[-3]*157.4 -> 314.8 | G101: =RC[-5]*7.751*157.4 -> 0 | H101: =RC[-1]/RC[-2] -> 0 | I101: =(0.2027*RC[-8]+1.2055)*1000 -> 1205.5 | L101: 1 | M101: 0.4 | N101: 3.08 | O101: 25 | P101: 36281 | Q101: =RC[-3]*157.4 -> 484.792 | R101: =RC[-5]*7.751*157.4 -> 488.00296 | S101: =RC[-1]/RC[-2] -> 1.00662337662338 | T101: =(0.2027*RC[-8]+1.2055)*1000 -> 1408.2
A102: 2 | B102: 0 | C102: 2.8 | D102: 4 | E102: 31017 | F102: =RC[-3]*157.4 -> 440.72 | G102: =RC[-5]*7.751*157.4 -> 0 | H102: =RC[-1]/RC[-2] -> 0 | I102: =(0.2027*RC[-8]+1.2055)*1000 -> 1610.9 | L102: 1.5 | M102: 0.424 | N102: 3.28 | O102: 25 | P102: 36281 | Q102: =RC[-3]*157.4 -> 516.272 | R102: =RC[-5]*7.751*157.4 -> 517.2831376 | S102: =RC[-1]/RC[-2] -> 1.00195853658537 | T102: =(0.2027*RC[-8]+1.2055)*1000 -> 1509.55
A103: 4 | B103: 0 | C103: 3.6 | D103: 4 | E103: 31017 | F103: =RC[-3]*157.4 -> 566.64 | G103: =RC[-5]*7.751*157.4 -> 0 | H103: =RC[-1]/RC[-2] -> 0 | I103: =(0.2027*RC[-8]+1.2055)*1000 -> 2016.3 | L103: 2 | M103: 0.448 | N103: 3.56 | O103: 25 | P103: 36281 | Q103: =RC[-3]*157.4 -> 560.344 | R103: =RC[-5]*7.751*157.4 -> 546.5633152 | S103: =RC[-1]/RC[-2] -> 0.975406741573034 | T103: =(0.2027*RC[-8]+1.2055)*1000 -> 1610.9
A104: 6 | B104: 0 | C104: 4.3 | D104: 4 | E104: 31017 | F104: =RC[-3]*157.4 -> 676.82 | G104: =RC[-5]*7.751*157.4 -> 0 | H104: =RC[-1]/RC[-2] -> 0 | I104: =(0.2027*RC[-8]+1.2055)*1000 -> 2421.7 | L104: 2.5 | M104: 0.48 | N104: 3.76 | O104: 25 | P104: 36281 | Q104: =RC[-3]*157.4 -> 591.824 | R104: =RC[-5]*7.751*157.4 -> 585.603552 | S104: =RC[-1]/RC[-2] -> 0.989489361702128 | T104: =(0.2027*RC[-8]+1.2055)*1000 -> 1712.25
A105: 0 | B105: 0.58 | C105: 2 | D105: 4 | F105: =RC[-3]*157.4 -> 314.8 | G105: =RC[-5]*7.751*157.4 -> 707.604292 | H105: =RC[-1]/RC[-2] -> 2.24779 | I105: =(0.2027*RC[-8]+1.2055)*1000 -> 1205.5 | L105: 3 | M105: 0.504 | N105: 3.92 | O105: 25 | P105: 36281 | Q105: =RC[-3]*157.4 -> 617.008 | R105: =RC[-5]*7.751*157.4 -> 614.8837296 | S105: =RC[-1]/RC[-2] -> 0.996557142857143 | T105: =(0.2027*RC[-8]+1.2055)*1000 -> 1813.6
A106: 0 | B106: 0.6 | C106: 2 | D106: 4 | E106: 31079 | F106: =RC[-3]*157.4 -> 314.8 | G106: =RC[-5]*7.751*157.4 -> 732.00444 | H106: =RC[-1]/RC[-2] -> 2.3253 | I106: =(0.2027*RC[-8]+1.2055)*1000 -> 1205.5 | L106: 3.5 | M106: 0.528 | N106: 4.16 | O106: 25 | P106: 36281 | Q106: =RC[-3]*157.4 -> 654.784 | R106: =RC[-5]*7.751*157.4 -> 644.1639072 | S106: =RC[-1]/RC[-2] -> 0.98378076923077 | T106: =(0.2027*RC[-8]+1.2055)*1000 -> 1914.95
A107: 0 | B107: 0.58 | C107: 2 | D107: 4 | E107: 31079 | F107: =RC[-3]*157.4 -> 314.8 | G107: =RC[-5]*7.751*157.4 -> 707.604292 | H107: =RC[-1]/RC[-2] -> 2.24779 | I107: =(0.2027*RC[-8]+1.2055)*1000 -> 1205.5 | L107: 4.65 | M107: 0.6 | N107: 4.72 | O107: 25 | P107: 36281 | Q107: =RC[-3]*157.4 -> 742.928 | R107: =RC[-5]*7.751*157.4 -> 732.00444 | S107: =RC[-1]/RC[-2] -> 0.985296610169492 | T107: =(0.2027*RC[-8]+1.2055)*1000 -> 2148.055
A108: 6.25 | B108: 0.82 | C108: 4.4 | D108: 6 | E108: 31229 | F108: =RC[-3]*157.4 -> 692.56 | G108: =RC[-5]*7.751*157.4 -> 1000.406068 | H108: =RC[-1]/RC[-2] -> 1.44450454545455 | I108: =(0.2027*RC[-8]+1.2055)*1000 -> 2472.375 | L108: 0 | M108: 0.252 | N108: 1.92 | O108: 26 | P108: 36404 | Q108: =RC[-3]*157.4 -> 302.208 | R108: =RC[-5]*7.751*157.4 -> 307.4418648 | S108: =RC[-1]/RC[-2] -> 1.01731875 | T108: =(0.2027*RC[-8]+1.2055)*1000 -> 1205.5
A109: 0 | B109: 0.308 | C109: 2.03 | D109: 8 | E109: 31444 | F109: =RC[-3]*157.4 -> 319.522 | G109: =RC[-5]*7.751*157.4 -> 375.7622792 | H109: =RC[-1]/RC[-2] -> 1.17601379310345 | I109: =(0.2027*RC[-8]+1.2055)*1000 -> 1205.5 | L109: 0 | M109: 0.328 | N109: 2.48 | O109: 26 | P109: 36404 | Q109: =RC[-3]*157.4 -> 390.352 | R109: =RC[-5]*7.751*157.4 -> 400.1624272 | S109: =RC[-1]/RC[-2] -> 1.02513225806452 | T109: =(0.2027*RC[-8]+1.2055)*1000 -> 1205.5
A110: 2 | B110: 0.39 | C110: 2.89 | D110: 8 | E110: 31444 | F110: =RC[-3]*157.4 -> 454.886 | G110: =RC[-5]*7.751*157.4 -> 475.802886 | H110: =RC[-1]/RC[-2] -> 1.04598269896194 | I110: =(0.2027*RC[-8]+1.2055)*1000 -> 1610.9 | L110: 0 | M110: 0.332 | N110: 2.52 | O110: 26 | P110: 36404 | Q110: =RC[-3]*157.4 -> 396.648 | R110: =RC[-5]*7.751*157.4 -> 405.0424568 | S110: =RC[-1]/RC[-2] -> 1.02116349206349 | T110: =(0.2027*RC[-8]+1.2055)*1000 -> 1205.5
A111: 4 | B111: 0.48 | C111: 3.6 | D111: 8 | E111: 31444 | F111: =RC[-3]*157.4 -> 566.64 | G111: =RC[-5]*7.751*157.4 -> 585.603552 | H111: =RC[-1]/RC[-2] -> 1.03346666666667 | I111: =(0.2027*RC[-8]+1.2055)*1000 -> 2016.3 | L111: 0 | M111: 0.292 | N111: 2.24 | O111: 27 | P111: 37317 | Q111: =RC[-3]*157.4 -> 352.576 | R111: =RC[-5]*7.751*157.4 -> 356.2421608 | S111: =RC[-1]/RC[-2] -> 1.01039821428571 | T111: =(0.2027*RC[-8]+1.2055)*1000 -> 1205.5
A112: 5 | B112: 0.53 | C112: 3.9 | D112: 8 | E112: 31444 | F112: =RC[-3]*157.4 -> 613.86 | G112: =RC[-5]*7.751*157.4 -> 646.603922 | H112: =RC[-1]/RC[-2] -> 1.05334102564103 | I112: =(0.2027*RC[-8]+1.2055)*1000 -> 2219 | L112: 1 | M112: 0.344 | N112: 2.64 | O112: 27 | P112: 37317 | Q112: =RC[-3]*157.4 -> 415.536 | R112: =RC[-5]*7.751*157.4 -> 419.6825456 | S112: =RC[-1]/RC[-2] -> 1.00997878787879 | T112: =(0.2027*RC[-8]+1.2055)*1000 -> 1408.2
A113: 6.25 | B113: 0.59 | C113: 4.4 | D113: 8 | E113: 31444 | F113: =RC[-3]*157.4 -> 692.56 | G113: =RC[-5]*7.751*157.4 -> 719.804366 | H113: =RC[-1]/RC[-2] -> 1.03933863636364 | I113: =(0.2027*RC[-8]+1.2055)*1000 -> 2472.375 | L113: 2 | M113: 0.4 | N113: 3.04 | O113: 27 | P113: 37317 | Q113: =RC[-3]*157.4 -> 478.496 | R113: =RC[-5]*7.751*157.4 -> 488.00296 | S113: =RC[-1]/RC[-2] -> 1.01986842105263 | T113: =(0.2027*RC[-8]+1.2055)*1000 -> 1610.9
A114: 0 | B114: 0.1 | C114: 0.5 | D114: 9 | E114: 31625 | F114: =RC[-3]*157.4 -> 78.7 | G114: =RC[-5]*7.751*157.4 -> 122.00074 | H114: =RC[-1]/RC[-2] -> 1.5502 | I114: =(0.2027*RC[-8]+1.2055)*1000 -> 1205.5 | L114: 4 | M114: 0.504 | N114: 3.8 | O114: 27 | P114: 37317 | Q114: =RC[-3]*157.4 -> 598.12 | R114: =RC[-5]*7.751*157.4 -> 614.8837296 | S114: =RC[-1]/RC[-2] -> 1.02802736842105 | T114: =(0.2027*RC[-8]+1.2055)*1000 -> 2016.3
A115: 3 | B115: 0.1 | C115: 1 | D115: 9 | E115: 31625 | F115: =RC[-3]*157.4 -> 157.4 | G115: =RC[-5]*7.751*157.4 -> 122.00074 | H115: =RC[-1]/RC[-2] -> 0.7751 | I115: =(0.2027*RC[-8]+1.2055)*1000 -> 1813.6 | L115: 4.5 | M115: 0.52 | N115: 4.04 | O115: 27 | P115: 37317 | Q115: =RC[-3]*157.4 -> 635.896 | R115: =RC[-5]*7.751*157.4 -> 634.403848 | S115: =RC[-1]/RC[-2] -> 0.997653465346535 | T115: =(0.2027*RC[-8]+1.2055)*1000 -> 2117.65
A116: 6.25 | B116: 0.61 | C116: 4.2 | D116: 9 | E116: 31625 | F116: =RC[-3]*157.4 -> 661.08 | G116: =RC[-5]*7.751*157.4 -> 744.204514 | H116: =RC[-1]/RC[-2] -> 1.12574047619048 | I116: =(0.2027*RC[-8]+1.2055)*1000 -> 2472.375 | L116: 5.8 | M116: 0.584 | N116: 4.52 | O116: 27 | P116: 37317 | Q116: =RC[-3]*157.4 -> 711.448 | R116: =RC[-5]*7.751*157.4 -> 712.4843216 | S116: =RC[-1]/RC[-2] -> 1.00145663716814 | T116: =(0.2027*RC[-8]+1.2055)*1000 -> 2381.16
A117: 3 | B117: 0.52 | C117: 0 | D117: 11 | E117: 32295 | F117: =RC[-3]*157.4 -> 0 | G117: =RC[-5]*7.751*157.4 -> 634.403848 | H117: =RC[-1]/RC[-2] -> #NUM! | I117: =(0.2027*RC[-8]+1.2055)*1000 -> 1813.6 | L117: 0 | M117: 0.296 | N117: 2.2 | O117: 27 | P117: 37317 | Q117: =RC[-3]*157.4 -> 346.28 | R117: =RC[-5]*7.751*157.4 -> 361.1221904 | S117: =RC[-1]/RC[-2] -> 1.04286181818182 | T117: =(0.2027*RC[-8]+1.2055)*1000 -> 1205.5
A118: 3.75 | B118: 0.612 | C118: 5.28 | D118: 13 | E118: 33055 | F118: =RC[-3]*157.4 -> 831.072 | G118: =RC[-5]*7.751*157.4 -> 746.6445288 | H118: =RC[-1]/RC[-2] -> 0.898411363636364 | I118: =(0.2027*RC[-8]+1.2055)*1000 -> 1965.625 | L118: 1 | M118: 0.336 | N118: 2.68 | O118: 27 | P118: 37317 | Q118: =RC[-3]*157.4 -> 421.832 | R118: =RC[-5]*7.751*157.4 -> 409.9224864 | S118: =RC[-1]/RC[-2] -> 0.971767164179105 | T118: =(0.2027*RC[-8]+1.2055)*1000 -> 1408.2
A119: 4.5 | B119: 0.654 | C119: 5.7 | D119: 13 | E119: 33086 | F119: =RC[-3]*157.4 -> 897.18 | G119: =RC[-5]*7.751*157.4 -> 797.8848396 | H119: =RC[-1]/RC[-2] -> 0.889325263157895 | I119: =(0.2027*RC[-8]+1.2055)*1000 -> 2117.65 | L119: 2 | M119: 0.408 | N119: 3.08 | O119: 27 | P119: 37317 | Q119: =RC[-3]*157.4 -> 484.792 | R119: =RC[-5]*7.751*157.4 -> 497.7630192 | S119: =RC[-1]/RC[-2] -> 1.02675584415584 | T119: =(0.2027*RC[-8]+1.2055)*1000 -> 1610.9
A120: 2 | B120: 0.5 | C120: 0 | D120: 13 | E120: 32994 | F120: =RC[-3]*157.4 -> 0 | G120: =RC[-5]*7.751*157.4 -> 610.0037 | H120: =RC[-1]/RC[-2] -> #NUM! | I120: =(0.2027*RC[-8]+1.2055)*1000 -> 1610.9 | L120: 3 | M120: 0.456 | N120: 3.44 | O120: 27 | P120: 37317 | Q120: =RC[-3]*157.4 -> 541.456 | R120: =RC[-5]*7.751*157.4 -> 556.3233744 | S120: =RC[-1]/RC[-2] -> 1.02745813953488 | T120: =(0.2027*RC[-8]+1.2055)*1000 -> 1813.6
A121: 2.9 | B121: 0.55 | C121: 4.85 | D121: 13 | E121: 32994 | F121: =RC[-3]*157.4 -> 763.39 | G121: =RC[-5]*7.751*157.4 -> 671.00407 | H121: =RC[-1]/RC[-2] -> 0.878979381443299 | I121: =(0.2027*RC[-8]+1.2055)*1000 -> 1793.33 | L121: 4 | M121: 0.504 | N121: 3.88 | O121: 27 | P121: 37317 | Q121: =RC[-3]*157.4 -> 610.712 | R121: =RC[-5]*7.751*157.4 -> 614.8837296 | S121: =RC[-1]/RC[-2] -> 1.00683092783505 | T121: =(0.2027*RC[-8]+1.2055)*1000 -> 2016.3
A122: 1.95 | B122: 0.48 | C122: 4.2 | D122: 15 | E122: 32874 | F122: =RC[-3]*157.4 -> 661.08 | G122: =RC[-5]*7.751*157.4 -> 585.603552 | H122: =RC[-1]/RC[-2] -> 0.885828571428571 | I122: =(0.2027*RC[-8]+1.2055)*1000 -> 1600.765 | L122: 5 | M122: 0.56 | N122: 4.24 | O122: 27 | P122: 37317 | Q122: =RC[-3]*157.4 -> 667.376 | R122: =RC[-5]*7.751*157.4 -> 683.204144 | S122: =RC[-1]/RC[-2] -> 1.02371698113208 | T122: =(0.2027*RC[-8]+1.2055)*1000 -> 2219
A123: 6.1 | B123: 0.68 | C123: 5.6 | D123: 16 | E123: 33329 | F123: =RC[-3]*157.4 -> 881.44 | G123: =RC[-5]*7.751*157.4 -> 829.605032 | H123: =RC[-1]/RC[-2] -> 0.941192857142857 | I123: =(0.2027*RC[-8]+1.2055)*1000 -> 2441.97 | L123: 5.7 | M123: 0.592 | N123: 4.48 | O123: 27 | P123: 37317 | Q123: =RC[-3]*157.4 -> 705.152 | R123: =RC[-5]*7.751*157.4 -> 722.2443808 | S123: =RC[-1]/RC[-2] -> 1.02423928571429 | T123: =(0.2027*RC[-8]+1.2055)*1000 -> 2360.89
A124: 2.9 | B124: 0.501 | C124: 4.1 | D124: 16 | E124: 33178 | F124: =RC[-3]*157.4 -> 645.34 | G124: =RC[-5]*7.751*157.4 -> 611.2237074 | H124: =RC[-1]/RC[-2] -> 0.947134390243903 | I124: =(0.2027*RC[-8]+1.2055)*1000 -> 1793.33 | L124: 5.5 | M124: 0.584 | N124: 4.4 | O124: 27 | P124: 37317 | Q124: =RC[-3]*157.4 -> 692.56 | R124: =RC[-5]*7.751*157.4 -> 712.4843216 | S124: =RC[-1]/RC[-2] -> 1.02876909090909 | T124: =(0.2027*RC[-8]+1.2055)*1000 -> 2320.35
A125: 2.9 | B125: 0.504 | C125: 4.15 | D125: 16 | E125: 33208 | F125: =RC[-3]*157.4 -> 653.21 | G125: =RC[-5]*7.751*157.4 -> 614.8837296 | H125: =RC[-1]/RC[-2] -> 0.941326265060241 | I125: =(0.2027*RC[-8]+1.2055)*1000 -> 1793.33 | L125: 5.5 | M125: 0.584 | N125: 4.4 | O125: 27 | P125: 37317 | Q125: =RC[-3]*157.4 -> 692.56 | R125: =RC[-5]*7.751*157.4 -> 712.4843216 | S125: =RC[-1]/RC[-2] -> 1.02876909090909 | T125: =(0.2027*RC[-8]+1.2055)*1000 -> 2320.35
A126: 3.6 | B126: 0.55 | C126: 4.48 | D126: 16 | E126: 33208 | F126: =RC[-3]*157.4 -> 705.152 | G126: =RC[-5]*7.751*157.4 -> 671.00407 | H126: =RC[-1]/RC[-2] -> 0.951573660714286 | I126: =(0.2027*RC[-8]+1.2055)*1000 -> 1935.22 | L126: 5.5 | M126: 0.576 | N126: 4.4 | O126: 27 | P126: 37317 | Q126: =RC[-3]*157.4 -> 692.56 | R126: =RC[-5]*7.751*157.4 -> 702.7242624 | S126: =RC[-1]/RC[-2] -> 1.01467636363636 | T126: =(0.2027*RC[-8]+1.2055)*1000 -> 2320.35
A127: 4.5 | B127: 0.6 | C127: 4.85 | D127: 16 | E127: 33208 | F127: =RC[-3]*157.4 -> 763.39 | G127: =RC[-5]*7.751*157.4 -> 732.00444 | H127: =RC[-1]/RC[-2] -> 0.958886597938144 | I127: =(0.2027*RC[-8]+1.2055)*1000 -> 2117.65 | L127: 6 | M127: 0.604 | N127: 4.64 | O127: 27 | P127: 37317 | Q127: =RC[-3]*157.4 -> 730.336 | R127: =RC[-5]*7.751*157.4 -> 736.8844696 | S127: =RC[-1]/RC[-2] -> 1.00896637931034 | T127: =(0.2027*RC[-8]+1.2055)*1000 -> 2421.7
A128: 5.35 | B128: 0.65 | C128: 5.25 | D128: 16 | E128: 33208 | F128: =RC[-3]*157.4 -> 826.35 | G128: =RC[-5]*7.751*157.4 -> 793.00481 | H128: =RC[-1]/RC[-2] -> 0.959647619047619 | I128: =(0.2027*RC[-8]+1.2055)*1000 -> 2289.945 | L128: 6.35 | M128: 0.62 | N128: 4.72 | O128: 27 | P128: 37317 | Q128: =RC[-3]*157.4 -> 742.928 | R128: =RC[-5]*7.751*157.4 -> 756.404588 | S128: =RC[-1]/RC[-2] -> 1.01813983050847 | T128: =(0.2027*RC[-8]+1.2055)*1000 -> 2492.645
A129: 6.1 | B129: 0.692 | C129: 5.59 | D129: 16 | E129: 33208 | F129: =RC[-3]*157.4 -> 879.866 | G129: =RC[-5]*7.751*157.4 -> 844.2451208 | H129: =RC[-1]/RC[-2] -> 0.959515563506261 | I129: =(0.2027*RC[-8]+1.2055)*1000 -> 2441.97 | L129: 6.4 | M129: 0.628 | N129: 4.76 | O129: 27 | P129: 37317 | Q129: =RC[-3]*157.4 -> 749.224 | R129: =RC[-5]*7.751*157.4 -> 766.1646472 | S129: =RC[-1]/RC[-2] -> 1.02261092436975 | T129: =(0.2027*RC[-8]+1.2055)*1000 -> 2502.78
A130: 3.5 | B130: 0.62 | C130: 5.03 | D130: 16 | E130: 37461 | F130: =RC[-3]*157.4 -> 791.722 | G130: =RC[-5]*7.751*157.4 -> 756.404588 | H130: =RC[-1]/RC[-2] -> 0.955391650099404 | I130: =(0.2027*RC[-8]+1.2055)*1000 -> 1914.95 | L130: 5.5 | M130: 0.632 | N130: 4.24 | O130: 28 | P130: 37553 | Q130: =RC[-3]*157.4 -> 667.376 | R130: =RC[-5]*7.751*157.4 -> 771.0446768 | S130: =RC[-1]/RC[-2] -> 1.15533773584906 | T130: =(0.2027*RC[-8]+1.2055)*1000 -> 2320.35
A131: 2 | B131: 0.5 | C131: 4.2 | D131: 16 | E131: 32933 | F131: =RC[-3]*157.4 -> 661.08 | G131: =RC[-5]*7.751*157.4 -> 610.0037 | H131: =RC[-1]/RC[-2] -> 0.922738095238095 | I131: =(0.2027*RC[-8]+1.2055)*1000 -> 1610.9 | L131: 1 | M131: 0.432 | N131: 2.88 | O131: 28 | P131: 37553 | Q131: =RC[-3]*157.4 -> 453.312 | R131: =RC[-5]*7.751*157.4 -> 527.0431968 | S131: =RC[-1]/RC[-2] -> 1.16265 | T131: =(0.2027*RC[-8]+1.2055)*1000 -> 1408.2
A132: 2.75 | B132: 0.48 | C132: 4.02 | D132: 17 | E132: 33878 | F132: =RC[-3]*157.4 -> 632.748 | G132: =RC[-5]*7.751*157.4 -> 585.603552 | H132: =RC[-1]/RC[-2] -> 0.925492537313433 | I132: =(0.2027*RC[-8]+1.2055)*1000 -> 1762.925 | L132: 2 | M132: 0.488 | N132: 3.2 | O132: 28 | P132: 37553 | Q132: =RC[-3]*157.4 -> 503.68 | R132: =RC[-5]*7.751*157.4 -> 595.3636112 | S132: =RC[-1]/RC[-2] -> 1.1820275 | T132: =(0.2027*RC[-8]+1.2055)*1000 -> 1610.9
A133: 3.75 | B133: 0.544 | C133: 4.42 | D133: 17 | E133: 33878 | F133: =RC[-3]*157.4 -> 695.708 | G133: =RC[-5]*7.751*157.4 -> 663.6840256 | H133: =RC[-1]/RC[-2] -> 0.953969230769231 | I133: =(0.2027*RC[-8]+1.2055)*1000 -> 1965.625 | L133: 3 | M133: 0.544 | N133: 3.6 | O133: 28 | P133: 37553 | Q133: =RC[-3]*157.4 -> 566.64 | R133: =RC[-5]*7.751*157.4 -> 663.6840256 | S133: =RC[-1]/RC[-2] -> 1.17126222222222 | T133: =(0.2027*RC[-8]+1.2055)*1000 -> 1813.6
A134: 4.5 | B134: 0.578 | C134: 4.75 | D134: 17 | E134: 33878 | F134: =RC[-3]*157.4 -> 747.65 | G134: =RC[-5]*7.751*157.4 -> 705.1642772 | H134: =RC[-1]/RC[-2] -> 0.943174315789474 | I134: =(0.2027*RC[-8]+1.2055)*1000 -> 2117.65 | L134: 4 | M134: 0.6 | N134: 4 | O134: 28 | P134: 37553 | Q134: =RC[-3]*157.4 -> 629.6 | R134: =RC[-5]*7.751*157.4 -> 732.00444 | S134: =RC[-1]/RC[-2] -> 1.16265 | T134: =(0.2027*RC[-8]+1.2055)*1000 -> 2016.3
A135: 2.75 | B135: 0.489 | C135: 4.065 | D135: 17 | E135: 33298 | F135: =RC[-3]*157.4 -> 639.831 | G135: =RC[-5]*7.751*157.4 -> 596.5836186 | H135: =RC[-1]/RC[-2] -> 0.932408118081181 | I135: =(0.2027*RC[-8]+1.2055)*1000 -> 1762.925 | L135: 5 | M135: 0.664 | N135: 4.4 | O135: 28 | P135: 37553 | Q135: =RC[-3]*157.4 -> 692.56 | R135: =RC[-5]*7.751*157.4 -> 810.0849136 | S135: =RC[-1]/RC[-2] -> 1.16969636363636 | T135: =(0.2027*RC[-8]+1.2055)*1000 -> 2219
A136: 5.5 | B136: 0.635 | C136: 5.34 | D136: 17 | E136: 33298 | F136: =RC[-3]*157.4 -> 840.516 | G136: =RC[-5]*7.751*157.4 -> 774.704699 | H136: =RC[-1]/RC[-2] -> 0.921701310861423 | I136: =(0.2027*RC[-8]+1.2055)*1000 -> 2320.35 | L136: 5.45 | M136: 0.632 | N136: 4.24 | O136: 28 | P136: 37553 | Q136: =RC[-3]*157.4 -> 667.376 | R136: =RC[-5]*7.751*157.4 -> 771.0446768 | S136: =RC[-1]/RC[-2] -> 1.15533773584906 | T136: =(0.2027*RC[-8]+1.2055)*1000 -> 2310.215
A137: 6.3 | B137: 0.679 | C137: 5.72 | D137: 17 | E137: 33298 | F137: =RC[-3]*157.4 -> 900.328 | G137: =RC[-5]*7.751*157.4 -> 828.3850246 | H137: =RC[-1]/RC[-2] -> 0.920092482517483 | I137: =(0.2027*RC[-8]+1.2055)*1000 -> 2482.51 | L137: 5.3 | M137: 0.62 | N137: 4.16 | O137: 28 | P137: 37553 | Q137: =RC[-3]*157.4 -> 654.784 | R137: =RC[-5]*7.751*157.4 -> 756.404588 | S137: =RC[-1]/RC[-2] -> 1.15519711538462 | T137: =(0.2027*RC[-8]+1.2055)*1000 -> 2279.81
A138: 1.9 | B138: 0.52 | C138: 4.2 | D138: 17 | E138: 33055 | F138: =RC[-3]*157.4 -> 661.08 | G138: =RC[-5]*7.751*157.4 -> 634.403848 | H138: =RC[-1]/RC[-2] -> 0.959647619047619 | I138: =(0.2027*RC[-8]+1.2055)*1000 -> 1590.63 | L138: 0 | M138: 0.328 | N138: 2.08 | O138: 28 | P138: 37554 | Q138: =RC[-3]*157.4 -> 327.392 | R138: =RC[-5]*7.751*157.4 -> 400.1624272 | S138: =RC[-1]/RC[-2] -> 1.22227307692308 | T138: =(0.2027*RC[-8]+1.2055)*1000 -> 1205.5
A139: 2.75 | B139: 0.564 | C139: 4.57 | D139: 17 | E139: 33055 | F139: =RC[-3]*157.4 -> 719.318 | G139: =RC[-5]*7.751*157.4 -> 688.0841736 | H139: =RC[-1]/RC[-2] -> 0.956578555798687 | I139: =(0.2027*RC[-8]+1.2055)*1000 -> 1762.925 | L139: 1 | M139: 0.392 | N139: 2.64 | O139: 28 | P139: 37554 | Q139: =RC[-3]*157.4 -> 415.536 | R139: =RC[-5]*7.751*157.4 -> 478.2429008 | S139: =RC[-1]/RC[-2] -> 1.15090606060606 | T139: =(0.2027*RC[-8]+1.2055)*1000 -> 1408.2
A140: 3.5 | B140: 0.61 | C140: 5.04 | D140: 17 | E140: 33055 | F140: =RC[-3]*157.4 -> 793.296 | G140: =RC[-5]*7.751*157.4 -> 744.204514 | H140: =RC[-1]/RC[-2] -> 0.938117063492063 | I140: =(0.2027*RC[-8]+1.2055)*1000 -> 1914.95 | L140: 2 | M140: 0.452 | N140: 3.04 | O140: 28 | P140: 37554 | Q140: =RC[-3]*157.4 -> 478.496 | R140: =RC[-5]*7.751*157.4 -> 551.4433448 | S140: =RC[-1]/RC[-2] -> 1.15245131578947 | T140: =(0.2027*RC[-8]+1.2055)*1000 -> 1610.9
A141: 3.75 | B141: 0.5 | C141: 4.6 | D141: 18 | E141: 33635 | F141: =RC[-3]*157.4 -> 724.04 | G141: =RC[-5]*7.751*157.4 -> 610.0037 | H141: =RC[-1]/RC[-2] -> 0.8425 | I141: =(0.2027*RC[-8]+1.2055)*1000 -> 1965.625 | L141: 3 | M141: 0.512 | N141: 3.36 | O141: 28 | P141: 37554 | Q141: =RC[-3]*157.4 -> 528.864 | R141: =RC[-5]*7.751*157.4 -> 624.6437888 | S141: =RC[-1]/RC[-2] -> 1.18110476190476 | T141: =(0.2027*RC[-8]+1.2055)*1000 -> 1813.6
A142: 4.6 | B142: 0 | C142: 0 | D142: 18 | E142: 33635 | F142: =RC[-3]*157.4 -> 0 | G142: =RC[-5]*7.751*157.4 -> 0 | H142: =RC[-1]/RC[-2] -> #NUM! | I142: =(0.2027*RC[-8]+1.2055)*1000 -> 2137.92 | L142: 4 | M142: 0.564 | N142: 3.8 | O142: 28 | P142: 37554 | Q142: =RC[-3]*157.4 -> 598.12 | R142: =RC[-5]*7.751*157.4 -> 688.0841736 | S142: =RC[-1]/RC[-2] -> 1.15041157894737 | T142: =(0.2027*RC[-8]+1.2055)*1000 -> 2016.3
A143: 6.25 | B143: 0.64 | C143: 5.7 | D143: 18 | E143: 33635 | F143: =RC[-3]*157.4 -> 897.18 | G143: =RC[-5]*7.751*157.4 -> 780.804736 | H143: =RC[-1]/RC[-2] -> 0.870287719298246 | I143: =(0.2027*RC[-8]+1.2055)*1000 -> 2472.375 | L143: 5 | M143: 0.62 | N143: 4.12 | O143: 28 | P143: 37554 | Q143: =RC[-3]*157.4 -> 648.488 | R143: =RC[-5]*7.751*157.4 -> 756.404588 | S143: =RC[-1]/RC[-2] -> 1.16641262135922 | T143: =(0.2027*RC[-8]+1.2055)*1000 -> 2219
A144: 4.65 | B144: 0.55 | C144: 5 | D144: 18 | E144: 33635 | F144: =RC[-3]*157.4 -> 787 | G144: =RC[-5]*7.751*157.4 -> 671.00407 | H144: =RC[-1]/RC[-2] -> 0.85261 | I144: =(0.2027*RC[-8]+1.2055)*1000 -> 2148.055 | L144: 5.28 | M144: 0.628 | N144: 4.24 | O144: 28 | P144: 37554 | Q144: =RC[-3]*157.4 -> 667.376 | R144: =RC[-5]*7.751*157.4 -> 766.1646472 | S144: =RC[-1]/RC[-2] -> 1.14802547169811 | T144: =(0.2027*RC[-8]+1.2055)*1000 -> 2275.756
I145: =MIN(R[-143]C:R[-1]C) -> 1205.5 | T145: =MIN(R[-143]C:R[-1]C) -> 1205.5
I146: =MAX(R[-144]C:R[-2]C) -> 2553.455 | T146: =MAX(R[-144]C:R[-2]C) -> 2553.455

Sheet: HV measurements 10-02
A2: 'data from 10/24 | B2: 'Pot | C2: '1000:1 probe (KV) | D2: 'Panel (KV) | E2: 'Rog (V) | F2: 'Bdot (V)
B3: 5.5 | C3: 2.31 | D3: 2 | E3: 0.632 | F3: 4.24
B4: 1 | C4: 1.59 | D4: 1.32 | E4: 0.432 | F4: 2.88
B5: 2 | C5: 1.76 | D5: 1.47 | E5: 0.488 | F5: 3.2
B6: 3 | C6: 1.96 | D6: 1.64 | E6: 0.544 | F6: 3.6
B7: 4 | C7: 2.17 | D7: 1.81 | E7: 0.6 | F7: 4
B8: 5 | C8: 2.37 | D8: 2.02 | E8: 0.664 | F8: 4.4
B9: 5.45 | C9: 2.26 | D9: 1.95 | E9: 0.632 | F9: 4.24
B10: 5.3 | C10: 2.25 | D10: 1.92 | E10: 0.62 | F10: 4.16
A12: 'data from 10/25 | B12: 'Pot | C12: '1000:1 probe (KV) | D12: 'Panel (KV) | E12: 'Rog (V) | F12: 'Bdot (V)
B13: 0 | C13: 1.18 | D13: 1.05 | E13: 0.328 | F13: 2.08
B14: 1 | C14: 1.4 | D14: 1.17 | E14: 0.392 | F14: 2.64
B15: 2 | C15: 1.64 | D15: 1.32 | E15: 0.452 | F15: 3.04
B16: 3 | C16: 1.84 | D16: 1.5 | E16: 0.512 | F16: 3.36
B17: 4 | C17: 2.03 | D17: 1.7 | E17: 0.564 | F17: 3.8
B18: 5 | C18: 2.21 | D18: 1.85 | E18: 0.62 | F18: 4.12
B19: 5.28 | C19: 2.25 | D19: 1.92 | E19: 0.628 | F19: 4.24

Sheet: @SDF
A1: =DEFINE("SQUARE", RC[+1], RC[+2]) -> FUN SQUARE AT #1 | B1: =RC[+1]*RC[+1] -> #EMPTY!
A2: =DEFINE("STDEV", RC[+1], RC[+2]) -> FUN STDEV AT #2 | B2: =SQRT(SUM(MAP(CLOSURE("SQUARE"), MAP(CLOSURE("-", NA(), RC[+3]), RC[+1])))/RC[+2]) -> #EMPTY! | D2: =ROWS(RC[-1])*COLUMNS(RC[-1])-1 -> #EMPTY! | E2: =AVERAGE(RC[-2]) -> #EMPTY!