Sheet: Comments
A1: Comments on Math Connections Excel Workbook of Volume 1 Templates
B2: (copyright 2003, Bruce Pollack-Johnson and Audrey Borchardt; please acknowledge)
A4: This file is referred to in our Technology Supplement as "V1Tmp". If you downloaded it off of the Web site given below, and it had a
B5: different name, we suggest you rename your orignal copy "V1Tmp".
A7: Before using any of the worksheets, make a copy of the full workbook (this Excel file) and rename it (use File, Save As…).
B8: For example, you could name it "V1TmpS15HW" for "Section 1.5 Homework".
A10: If you want to work on different examples, make a copy and rename a new worksheet (use Edit, Move or
B11: Copy Sheet…) for each example, before you start on each example. (Remember to click on the Copy box so that the
B12: sheet doesn't just get moved.) To rename a sheet, double-click on its index tab and type in the new name
B13: (for example, "Section 1.5, Exercise 3"). On the "Slope & Concavity" sheet, doing an example will add a lot of yellow cells,
B14: so if you want later examples to start looking like the original, copy the sheet before doing the first example (and do it on the copy)
B15: to keep the original sheet intact. To remove a dotted-line cell/block outline, hit "Esc".
A17: If the size of the display on your screen does not seem ideal, change it, such as to 75% or 60% (edit the value on the toolbar); or use View, Zoom if necessary.
A19: Cells that are colored yellow are for you to enter information; blue cells show results. Sometimes, you enter a formula in one cell, but it's likely to spill onto
B20: later cells - we've colored them yellow too. To enter or change a formula, click on the leftmost cell where it starts. Remember to always use an
B21: asterisk ( * ) for multiplication in formulas. Excel evaluates "=-3^2-3" as 9 (not the standard -12), so "-x2-x" in a formula must be, e.g., "=-1*a13^2-a13"
B22: (a leading minus sign in front of an even power should be written as "-1*").
A24: When making entries (such as the data for the Basic Logistic Regression sheet), be sure that nothing unwanted remains
B25: from what was there before (delete the old one, or double-check your entries).
A27: All three template worksheets are unprotected. Always make a copy before using them.
A29: For the latest (updated) version of this file (or a new clean copy), go to www.math.villanova.edu/connections , click on the link to
B30: "Excel Files: Calculus Demos, Templates, and Samples", and click on "V1Tmp.xls" .
A32: For more information, contact the authors at (610) 519-6926 or Bruce.Pollack-Johnson@villanova.edu (or see www.math.villanova.edu/connections)
A34: Math Connections: Real world Problem Solving Using Math Models, Calculus, and Technology for Business and Everyday Life (Volume 1: Single Variable Problem Solving)
B35: by Bruce Pollack-Johnson and Audrey Borchardt
B36: is published by Pearson Custom Publishing (Second Edition, copyright 2003). For desk copies or orders,
B37: call (800) 922-0579 and mention the ISBN: 0536-73594-8 .

Sheet: Basic Logistic Regression
A1: Fitting a Logistic Model to Data: Basic Version [Make a copy first! Highlight the old data & hit Delete before entering a new data set]
A2: 1. Enter the independent variable values (up to 33 data points) in Column A (start in row 9). 2. Enter the dependent variable values in Column B (also start in row 9).
A3: 3. Enter a guess for the upper limit L in E9, then hit Enter. Possible model parameters (L,A,B) will be given in L9:N9 . You can try different
A4: L values by trial and error to minimze the SSE in K9. 4. If you know how, use Solver (under Tools) to Minimize the Target Cell K9 using
A5: the Changing Cell E9 (Click on Solve and OK). 5. If the Solver solution makes sense, use it. If not, try initial L values on either side of
A6: your guess and trial and error to see if you can obtain a lower SSE. Your model parameters (L,A,B) will again be given in L9:N9 .
A8: Data (x) | B8: Data (y) | C8: x | D8: 1's | E8: L | F8: L-y | G8: ln((L-y)/y) | H8: Model | I8: y-Model | J8: Error2 | K8: SSE | L8: L | M8: A | N8: B
A9: 0 | B9: 2 | C9: =IF(ISERROR(RC[-2])," ",RC[-2]) -> 0 | D9: =IF(ISERROR(RC[-2])," ",1) -> 1 | E9: 20 | F9: =IF(ISERROR(RC[-4])," ",R9C5-RC[-4]) -> 18 | G9: =IF(ISERROR(RC[-5])," ",LN(ABS(RC[-1]/RC[-5]))) -> 2.1972245773362196 | H9: =IF(ISERROR(RC[-7])," ",R9C5/(1+R48C3*EXP(-R46C3*RC[-7]))) -> 1.5954800887928351 | I9: =IF(ISERROR(RC[-7])," ",RC[-7]-RC[-1]) -> 0.40451991120716491 | J9: =IF(ISERROR(RC[-8])," ",RC[-1]^2) -> 0.16363635856305259 | K9: =SUM(RC[-1]:INDEX(RC[-1]:R[32]C[-1],R[34]C[-9])) -> 2.9972335267739565 | L9: =RC[-7] -> 20 | M9: =R[39]C[-10] -> 11.535411842796679 | N9: =R[37]C[-11] -> 0.5657613213011311
A10: 1 | B10: 3 | C10: =IF(ISERROR(RC[-2])," ",RC[-2]) -> 1 | D10: =IF(ISERROR(RC[-2])," ",1) -> 1 | F10: =IF(ISERROR(RC[-4])," ",R9C5-RC[-4]) -> 17 | G10: =IF(ISERROR(RC[-5])," ",LN(ABS(RC[-1]/RC[-5]))) -> 1.7346010553881064 | H10: =IF(ISERROR(RC[-7])," ",R9C5/(1+R48C3*EXP(-R46C3*RC[-7]))) -> 2.6485580021589081 | I10: =IF(ISERROR(RC[-7])," ",RC[-7]-RC[-1]) -> 0.35144199784109187 | J10: =IF(ISERROR(RC[-8])," ",RC[-1]^2) -> 0.12351147784653803
A11: 2 | B11: 4 | C11: =IF(ISERROR(RC[-2])," ",RC[-2]) -> 2 | D11: =IF(ISERROR(RC[-2])," ",1) -> 1 | E11: max |y| | F11: =IF(ISERROR(RC[-4])," ",R9C5-RC[-4]) -> 16 | G11: =IF(ISERROR(RC[-5])," ",LN(ABS(RC[-1]/RC[-5]))) -> 1.3862943611198906 | H11: =IF(ISERROR(RC[-7])," ",R9C5/(1+R48C3*EXP(-R46C3*RC[-7]))) -> 4.2367027946293607 | I11: =IF(ISERROR(RC[-7])," ",RC[-7]-RC[-1]) -> -0.23670279462936072 | J11: =IF(ISERROR(RC[-8])," ",RC[-1]^2) -> 5.6028212985349317E-2
A12: 3 | B12: 6 | C12: =IF(ISERROR(RC[-2])," ",RC[-2]) -> 3 | D12: =IF(ISERROR(RC[-2])," ",1) -> 1 | E12: =MAX(R[17]C[9]:R[39]C[9]) -> 19 | F12: =IF(ISERROR(RC[-4])," ",R9C5-RC[-4]) -> 14 | G12: =IF(ISERROR(RC[-5])," ",LN(ABS(RC[-1]/RC[-5]))) -> 0.84729786038720367 | H12: =IF(ISERROR(RC[-7])," ",R9C5/(1+R48C3*EXP(-R46C3*RC[-7]))) -> 6.4245447416755379 | I12: =IF(ISERROR(RC[-7])," ",RC[-7]-RC[-1]) -> -0.42454474167553791 | J12: =IF(ISERROR(RC[-8])," ",RC[-1]^2) -> 0.18023823768434921
A13: 4 | B13: 8 | C13: =IF(ISERROR(RC[-2])," ",RC[-2]) -> 4 | D13: =IF(ISERROR(RC[-2])," ",1) -> 1 | F13: =IF(ISERROR(RC[-4])," ",R9C5-RC[-4]) -> 12 | G13: =IF(ISERROR(RC[-5])," ",LN(ABS(RC[-1]/RC[-5]))) -> 0.40546510810816438 | H13: =IF(ISERROR(RC[-7])," ",R9C5/(1+R48C3*EXP(-R46C3*RC[-7]))) -> 9.0906375903780212 | I13: =IF(ISERROR(RC[-7])," ",RC[-7]-RC[-1]) -> -1.0906375903780212 | J13: =IF(ISERROR(RC[-8])," ",RC[-1]^2) -> 1.1894903535455763
A14: 5 | B14: 11 | C14: =IF(ISERROR(RC[-2])," ",RC[-2]) -> 5 | D14: =IF(ISERROR(RC[-2])," ",1) -> 1 | E14: 1.0001*(max |y|) | F14: =IF(ISERROR(RC[-4])," ",R9C5-RC[-4]) -> 9 | G14: =IF(ISERROR(RC[-5])," ",LN(ABS(RC[-1]/RC[-5]))) -> -0.20067069546215111 | H14: =IF(ISERROR(RC[-7])," ",R9C5/(1+R48C3*EXP(-R46C3*RC[-7]))) -> 11.893785329739032 | I14: =IF(ISERROR(RC[-7])," ",RC[-7]-RC[-1]) -> -0.89378532973903191 | J14: =IF(ISERROR(RC[-8])," ",RC[-1]^2) -> 0.79885221565671005
A15: 6 | B15: 14 | C15: =IF(ISERROR(RC[-2])," ",RC[-2]) -> 6 | D15: =IF(ISERROR(RC[-2])," ",1) -> 1 | E15: =1.0001*R[-3]C -> 19.001899999999999 | F15: =IF(ISERROR(RC[-4])," ",R9C5-RC[-4]) -> 6 | G15: =IF(ISERROR(RC[-5])," ",LN(ABS(RC[-1]/RC[-5]))) -> -0.84729786038720367 | H15: =IF(ISERROR(RC[-7])," ",R9C5/(1+R48C3*EXP(-R46C3*RC[-7]))) -> 14.418869326092041 | I15: =IF(ISERROR(RC[-7])," ",RC[-7]-RC[-1]) -> -0.41886932609204131 | J15: =IF(ISERROR(RC[-8])," ",RC[-1]^2) -> 0.17545151234080084
A16: 7 | B16: 16 | C16: =IF(ISERROR(RC[-2])," ",RC[-2]) -> 7 | D16: =IF(ISERROR(RC[-2])," ",1) -> 1 | F16: =IF(ISERROR(RC[-4])," ",R9C5-RC[-4]) -> 4 | G16: =IF(ISERROR(RC[-5])," ",LN(ABS(RC[-1]/RC[-5]))) -> -1.3862943611198906 | H16: =IF(ISERROR(RC[-7])," ",R9C5/(1+R48C3*EXP(-R46C3*RC[-7]))) -> 16.395747648549619 | I16: =IF(ISERROR(RC[-7])," ",RC[-7]-RC[-1]) -> -0.39574764854961941 | J16: =IF(ISERROR(RC[-8])," ",RC[-1]^2) -> 0.15661620133255308
A17: 8 | B17: 18 | C17: =IF(ISERROR(RC[-2])," ",RC[-2]) -> 8 | D17: =IF(ISERROR(RC[-2])," ",1) -> 1 | E17: (to keep | F17: =IF(ISERROR(RC[-4])," ",R9C5-RC[-4]) -> 2 | G17: =IF(ISERROR(RC[-5])," ",LN(ABS(RC[-1]/RC[-5]))) -> -2.1972245773362196 | H17: =IF(ISERROR(RC[-7])," ",R9C5/(1+R48C3*EXP(-R46C3*RC[-7]))) -> 17.780201181659642 | I17: =IF(ISERROR(RC[-7])," ",RC[-7]-RC[-1]) -> 0.21979881834035808 | J17: =IF(ISERROR(RC[-8])," ",RC[-1]^2) -> 4.8311520543817731E-2 | M17: =IF(ISERROR(RC[-11])," ",RC[-11]) -> 18
A18: 9 | B18: 19 | C18: =IF(ISERROR(RC[-2])," ",RC[-2]) -> 9 | D18: =IF(ISERROR(RC[-2])," ",1) -> 1 | E18: |L| > max |y| , | F18: =IF(ISERROR(RC[-4])," ",R9C5-RC[-4]) -> 1 | G18: =IF(ISERROR(RC[-5])," ",LN(ABS(RC[-1]/RC[-5]))) -> -2.9444389791664407 | H18: =IF(ISERROR(RC[-7])," ",R9C5/(1+R48C3*EXP(-R46C3*RC[-7]))) -> 18.675812652505979 | I18: =IF(ISERROR(RC[-7])," ",RC[-7]-RC[-1]) -> 0.32418734749402134 | J18: =IF(ISERROR(RC[-8])," ",RC[-1]^2) -> 0.10509743627520934 | M18: =IF(ISERROR(RC[-11])," ",RC[-11]) -> 19
C19: =IF(ISERROR(RC[-2])," ",RC[-2]) -> 0 | D19: =IF(ISERROR(RC[-2])," ",1) -> 1 | E19: use the | F19: =IF(ISERROR(RC[-4])," ",R9C5-RC[-4]) -> 20 | G19: =IF(ISERROR(RC[-5])," ",LN(ABS(RC[-1]/RC[-5]))) -> #DIV/0! | H19: =IF(ISERROR(RC[-7])," ",R9C5/(1+R48C3*EXP(-R46C3*RC[-7]))) -> 1.5954800887928351 | I19: =IF(ISERROR(RC[-7])," ",RC[-7]-RC[-1]) -> -1.5954800887928351 | J19: =IF(ISERROR(RC[-8])," ",RC[-1]^2) -> 2.5455567137343929 | M19: =IF(ISERROR(RC[-11])," ",RC[-11]) -> 0
C20: =IF(ISERROR(RC[-2])," ",RC[-2]) -> 0 | D20: =IF(ISERROR(RC[-2])," ",1) -> 1 | E20: constraint | F20: =IF(ISERROR(RC[-4])," ",R9C5-RC[-4]) -> 20 | G20: =IF(ISERROR(RC[-5])," ",LN(ABS(RC[-1]/RC[-5]))) -> #DIV/0! | H20: =IF(ISERROR(RC[-7])," ",R9C5/(1+R48C3*EXP(-R46C3*RC[-7]))) -> 1.5954800887928351 | I20: =IF(ISERROR(RC[-7])," ",RC[-7]-RC[-1]) -> -1.5954800887928351 | J20: =IF(ISERROR(RC[-8])," ",RC[-1]^2) -> 2.5455567137343929 | M20: =IF(ISERROR(RC[-11])," ",RC[-11]) -> 0
C21: =IF(ISERROR(RC[-2])," ",RC[-2]) -> 0 | D21: =IF(ISERROR(RC[-2])," ",1) -> 1 | E21: N26 >= E15 | F21: =IF(ISERROR(RC[-4])," ",R9C5-RC[-4]) -> 20 | G21: =IF(ISERROR(RC[-5])," ",LN(ABS(RC[-1]/RC[-5]))) -> #DIV/0! | H21: =IF(ISERROR(RC[-7])," ",R9C5/(1+R48C3*EXP(-R46C3*RC[-7]))) -> 1.5954800887928351 | I21: =IF(ISERROR(RC[-7])," ",RC[-7]-RC[-1]) -> -1.5954800887928351 | J21: =IF(ISERROR(RC[-8])," ",RC[-1]^2) -> 2.5455567137343929 | M21: =IF(ISERROR(RC[-11])," ",RC[-11]) -> 0
C22: =IF(ISERROR(RC[-2])," ",RC[-2]) -> 0 | D22: =IF(ISERROR(RC[-2])," ",1) -> 1 | E22: in Solver) | F22: =IF(ISERROR(RC[-4])," ",R9C5-RC[-4]) -> 20 | G22: =IF(ISERROR(RC[-5])," ",LN(ABS(RC[-1]/RC[-5]))) -> #DIV/0! | H22: =IF(ISERROR(RC[-7])," ",R9C5/(1+R48C3*EXP(-R46C3*RC[-7]))) -> 1.5954800887928351 | I22: =IF(ISERROR(RC[-7])," ",RC[-7]-RC[-1]) -> -1.5954800887928351 | J22: =IF(ISERROR(RC[-8])," ",RC[-1]^2) -> 2.5455567137343929
C23: =IF(ISERROR(RC[-2])," ",RC[-2]) -> 0 | D23: =IF(ISERROR(RC[-2])," ",1) -> 1 | F23: =IF(ISERROR(RC[-4])," ",R9C5-RC[-4]) -> 20 | G23: =IF(ISERROR(RC[-5])," ",LN(ABS(RC[-1]/RC[-5]))) -> #DIV/0! | H23: =IF(ISERROR(RC[-7])," ",R9C5/(1+R48C3*EXP(-R46C3*RC[-7]))) -> 1.5954800887928351 | I23: =IF(ISERROR(RC[-7])," ",RC[-7]-RC[-1]) -> -1.5954800887928351 | J23: =IF(ISERROR(RC[-8])," ",RC[-1]^2) -> 2.5455567137343929
C24: =IF(ISERROR(RC[-2])," ",RC[-2]) -> 0 | D24: =IF(ISERROR(RC[-2])," ",1) -> 1 | F24: =IF(ISERROR(RC[-4])," ",R9C5-RC[-4]) -> 20 | G24: =IF(ISERROR(RC[-5])," ",LN(ABS(RC[-1]/RC[-5]))) -> #DIV/0! | H24: =IF(ISERROR(RC[-7])," ",R9C5/(1+R48C3*EXP(-R46C3*RC[-7]))) -> 1.5954800887928351 | I24: =IF(ISERROR(RC[-7])," ",RC[-7]-RC[-1]) -> -1.5954800887928351 | J24: =IF(ISERROR(RC[-8])," ",RC[-1]^2) -> 2.5455567137343929 | M24: NOTE: This works | N24: (L can be -ve)
C25: =IF(ISERROR(RC[-2])," ",RC[-2]) -> 0 | D25: =IF(ISERROR(RC[-2])," ",1) -> 1 | E25: Min x | F25: =IF(ISERROR(RC[-4])," ",R9C5-RC[-4]) -> 20 | G25: =IF(ISERROR(RC[-5])," ",LN(ABS(RC[-1]/RC[-5]))) -> #DIV/0! | H25: =IF(ISERROR(RC[-7])," ",R9C5/(1+R48C3*EXP(-R46C3*RC[-7]))) -> 1.5954800887928351 | I25: =IF(ISERROR(RC[-7])," ",RC[-7]-RC[-1]) -> -1.5954800887928351 | J25: =IF(ISERROR(RC[-8])," ",RC[-1]^2) -> 2.5455567137343929 | K25: x | L25: Model y | M25: best when all y | N25: |L|
C26: =IF(ISERROR(RC[-2])," ",RC[-2]) -> 0 | D26: =IF(ISERROR(RC[-2])," ",1) -> 1 | E26: =MIN(R[-17]C[-4]:R[15]C[-4]) -> 0 | F26: =IF(ISERROR(RC[-4])," ",R9C5-RC[-4]) -> 20 | G26: =IF(ISERROR(RC[-5])," ",LN(ABS(RC[-1]/RC[-5]))) -> #DIV/0! | H26: =IF(ISERROR(RC[-7])," ",R9C5/(1+R48C3*EXP(-R46C3*RC[-7]))) -> 1.5954800887928351 | I26: =IF(ISERROR(RC[-7])," ",RC[-7]-RC[-1]) -> -1.5954800887928351 | J26: =IF(ISERROR(RC[-8])," ",RC[-1]^2) -> 2.5455567137343929 | K26: =RC[-6] -> 0 | L26: =R9C5/(1+R48C3*EXP(-R46C3*RC[-1])) -> 1.5954800887928351 | M26: values are between | N26: =ABS(R[-17]C[-9]) -> 20
C27: =IF(ISERROR(RC[-2])," ",RC[-2]) -> 0 | D27: =IF(ISERROR(RC[-2])," ",1) -> 1 | F27: =IF(ISERROR(RC[-4])," ",R9C5-RC[-4]) -> 20 | G27: =IF(ISERROR(RC[-5])," ",LN(ABS(RC[-1]/RC[-5]))) -> #DIV/0! | H27: =IF(ISERROR(RC[-7])," ",R9C5/(1+R48C3*EXP(-R46C3*RC[-7]))) -> 1.5954800887928351 | I27: =IF(ISERROR(RC[-7])," ",RC[-7]-RC[-1]) -> -1.5954800887928351 | J27: =IF(ISERROR(RC[-8])," ",RC[-1]^2) -> 2.5455567137343929 | K27: =R[-1]C+R33C5 -> 0.45 | L27: =R9C5/(1+R48C3*EXP(-R46C3*RC[-1])) -> 2.0115415254699167 | M27: 0 and L. For other
C28: =IF(ISERROR(RC[-2])," ",RC[-2]) -> 0 | D28: =IF(ISERROR(RC[-2])," ",1) -> 1 | E28: Max x | F28: =IF(ISERROR(RC[-4])," ",R9C5-RC[-4]) -> 20 | G28: =IF(ISERROR(RC[-5])," ",LN(ABS(RC[-1]/RC[-5]))) -> #DIV/0! | H28: =IF(ISERROR(RC[-7])," ",R9C5/(1+R48C3*EXP(-R46C3*RC[-7]))) -> 1.5954800887928351 | I28: =IF(ISERROR(RC[-7])," ",RC[-7]-RC[-1]) -> -1.5954800887928351 | J28: =IF(ISERROR(RC[-8])," ",RC[-1]^2) -> 2.5455567137343929 | K28: =R[-1]C+R33C5 -> 0.9 | L28: =R9C5/(1+R48C3*EXP(-R46C3*RC[-1])) -> 2.5212381930596104 | M28: cases, you may get | N28: |y|
C29: =IF(ISERROR(RC[-2])," ",RC[-2]) -> 0 | D29: =IF(ISERROR(RC[-2])," ",1) -> 1 | E29: =MAX(R[-20]C[-4]:R[12]C[-4]) -> 9 | F29: =IF(ISERROR(RC[-4])," ",R9C5-RC[-4]) -> 20 | G29: =IF(ISERROR(RC[-5])," ",LN(ABS(RC[-1]/RC[-5]))) -> #DIV/0! | H29: =IF(ISERROR(RC[-7])," ",R9C5/(1+R48C3*EXP(-R46C3*RC[-7]))) -> 1.5954800887928351 | I29: =IF(ISERROR(RC[-7])," ",RC[-7]-RC[-1]) -> -1.5954800887928351 | J29: =IF(ISERROR(RC[-8])," ",RC[-1]^2) -> 2.5455567137343929 | K29: =R[-1]C+R33C5 -> 1.35 | L29: =R9C5/(1+R48C3*EXP(-R46C3*RC[-1])) -> 3.1375584777887555 | M29: useable answers, | N29: =ABS(R[-20]C[-12]:R[12]C[-12]) -> 2
C30: =IF(ISERROR(RC[-2])," ",RC[-2]) -> 0 | D30: =IF(ISERROR(RC[-2])," ",1) -> 1 | F30: =IF(ISERROR(RC[-4])," ",R9C5-RC[-4]) -> 20 | G30: =IF(ISERROR(RC[-5])," ",LN(ABS(RC[-1]/RC[-5]))) -> #DIV/0! | H30: =IF(ISERROR(RC[-7])," ",R9C5/(1+R48C3*EXP(-R46C3*RC[-7]))) -> 1.5954800887928351 | I30: =IF(ISERROR(RC[-7])," ",RC[-7]-RC[-1]) -> -1.5954800887928351 | J30: =IF(ISERROR(RC[-8])," ",RC[-1]^2) -> 2.5455567137343929 | K30: =R[-1]C+R33C5 -> 1.8 | L30: =R9C5/(1+R48C3*EXP(-R46C3*RC[-1])) -> 3.8711710942995969 | M30: but the mathematical | N30: 3
C31: =IF(ISERROR(RC[-2])," ",RC[-2]) -> 0 | D31: =IF(ISERROR(RC[-2])," ",1) -> 1 | F31: =IF(ISERROR(RC[-4])," ",R9C5-RC[-4]) -> 20 | G31: =IF(ISERROR(RC[-5])," ",LN(ABS(RC[-1]/RC[-5]))) -> #DIV/0! | H31: =IF(ISERROR(RC[-7])," ",R9C5/(1+R48C3*EXP(-R46C3*RC[-7]))) -> 1.5954800887928351 | I31: =IF(ISERROR(RC[-7])," ",RC[-7]-RC[-1]) -> -1.5954800887928351 | J31: =IF(ISERROR(RC[-8])," ",RC[-1]^2) -> 2.5455567137343929 | K31: =R[-1]C+R33C5 -> 2.25 | L31: =R9C5/(1+R48C3*EXP(-R46C3*RC[-1])) -> 4.7282172876148865 | M31: rigor is not assured. | N31: 4
C32: =IF(ISERROR(RC[-2])," ",RC[-2]) -> 0 | D32: =IF(ISERROR(RC[-2])," ",1) -> 1 | E32: Increment | F32: =IF(ISERROR(RC[-4])," ",R9C5-RC[-4]) -> 20 | G32: =IF(ISERROR(RC[-5])," ",LN(ABS(RC[-1]/RC[-5]))) -> #DIV/0! | H32: =IF(ISERROR(RC[-7])," ",R9C5/(1+R48C3*EXP(-R46C3*RC[-7]))) -> 1.5954800887928351 | I32: =IF(ISERROR(RC[-7])," ",RC[-7]-RC[-1]) -> -1.5954800887928351 | J32: =IF(ISERROR(RC[-8])," ",RC[-1]^2) -> 2.5455567137343929 | K32: =R[-1]C+R33C5 -> 2.7 | L32: =R9C5/(1+R48C3*EXP(-R46C3*RC[-1])) -> 5.7078581083809663 | N32: 6
C33: =IF(ISERROR(RC[-2])," ",RC[-2]) -> 0 | D33: =IF(ISERROR(RC[-2])," ",1) -> 1 | E33: =(R[-4]C-R[-7]C)/20 -> 0.45 | F33: =IF(ISERROR(RC[-4])," ",R9C5-RC[-4]) -> 20 | G33: =IF(ISERROR(RC[-5])," ",LN(ABS(RC[-1]/RC[-5]))) -> #DIV/0! | H33: =IF(ISERROR(RC[-7])," ",R9C5/(1+R48C3*EXP(-R46C3*RC[-7]))) -> 1.5954800887928351 | I33: =IF(ISERROR(RC[-7])," ",RC[-7]-RC[-1]) -> -1.5954800887928351 | J33: =IF(ISERROR(RC[-8])," ",RC[-1]^2) -> 2.5455567137343929 | K33: =R[-1]C+R33C5 -> 3.1500000000000004 | L33: =R9C5/(1+R48C3*EXP(-R46C3*RC[-1])) -> 6.8000932823443714 | N33: 8
C34: =IF(ISERROR(RC[-2])," ",RC[-2]) -> 0 | D34: =IF(ISERROR(RC[-2])," ",1) -> 1 | F34: =IF(ISERROR(RC[-4])," ",R9C5-RC[-4]) -> 20 | G34: =IF(ISERROR(RC[-5])," ",LN(ABS(RC[-1]/RC[-5]))) -> #DIV/0! | H34: =IF(ISERROR(RC[-7])," ",R9C5/(1+R48C3*EXP(-R46C3*RC[-7]))) -> 1.5954800887928351 | I34: =IF(ISERROR(RC[-7])," ",RC[-7]-RC[-1]) -> -1.5954800887928351 | J34: =IF(ISERROR(RC[-8])," ",RC[-1]^2) -> 2.5455567137343929 | K34: =R[-1]C+R33C5 -> 3.6000000000000005 | L34: =R9C5/(1+R48C3*EXP(-R46C3*RC[-1])) -> 7.9845694715802082 | N34: 11
C35: =IF(ISERROR(RC[-2])," ",RC[-2]) -> 0 | D35: =IF(ISERROR(RC[-2])," ",1) -> 1 | F35: =IF(ISERROR(RC[-4])," ",R9C5-RC[-4]) -> 20 | G35: =IF(ISERROR(RC[-5])," ",LN(ABS(RC[-1]/RC[-5]))) -> #DIV/0! | H35: =IF(ISERROR(RC[-7])," ",R9C5/(1+R48C3*EXP(-R46C3*RC[-7]))) -> 1.5954800887928351 | I35: =IF(ISERROR(RC[-7])," ",RC[-7]-RC[-1]) -> -1.5954800887928351 | J35: =IF(ISERROR(RC[-8])," ",RC[-1]^2) -> 2.5455567137343929 | K35: =R[-1]C+R33C5 -> 4.0500000000000007 | L35: =R9C5/(1+R48C3*EXP(-R46C3*RC[-1])) -> 9.2310795660598384 | N35: 14
C36: =IF(ISERROR(RC[-2])," ",RC[-2]) -> 0 | D36: =IF(ISERROR(RC[-2])," ",1) -> 1 | F36: =IF(ISERROR(RC[-4])," ",R9C5-RC[-4]) -> 20 | G36: =IF(ISERROR(RC[-5])," ",LN(ABS(RC[-1]/RC[-5]))) -> #DIV/0! | H36: =IF(ISERROR(RC[-7])," ",R9C5/(1+R48C3*EXP(-R46C3*RC[-7]))) -> 1.5954800887928351 | I36: =IF(ISERROR(RC[-7])," ",RC[-7]-RC[-1]) -> -1.5954800887928351 | J36: =IF(ISERROR(RC[-8])," ",RC[-1]^2) -> 2.5455567137343929 | K36: =R[-1]C+R33C5 -> 4.5000000000000009 | L36: =R9C5/(1+R48C3*EXP(-R46C3*RC[-1])) -> 10.502099179505082 | N36: 16
C37: =IF(ISERROR(RC[-2])," ",RC[-2]) -> 0 | D37: =IF(ISERROR(RC[-2])," ",1) -> 1 | F37: =IF(ISERROR(RC[-4])," ",R9C5-RC[-4]) -> 20 | G37: =IF(ISERROR(RC[-5])," ",LN(ABS(RC[-1]/RC[-5]))) -> #DIV/0! | H37: =IF(ISERROR(RC[-7])," ",R9C5/(1+R48C3*EXP(-R46C3*RC[-7]))) -> 1.5954800887928351 | I37: =IF(ISERROR(RC[-7])," ",RC[-7]-RC[-1]) -> -1.5954800887928351 | J37: =IF(ISERROR(RC[-8])," ",RC[-1]^2) -> 2.5455567137343929 | K37: =R[-1]C+R33C5 -> 4.9500000000000011 | L37: =R9C5/(1+R48C3*EXP(-R46C3*RC[-1])) -> 11.757060537307279 | N37: 18
C38: =IF(ISERROR(RC[-2])," ",RC[-2]) -> 0 | D38: =IF(ISERROR(RC[-2])," ",1) -> 1 | F38: =IF(ISERROR(RC[-4])," ",R9C5-RC[-4]) -> 20 | G38: =IF(ISERROR(RC[-5])," ",LN(ABS(RC[-1]/RC[-5]))) -> #DIV/0! | H38: =IF(ISERROR(RC[-7])," ",R9C5/(1+R48C3*EXP(-R46C3*RC[-7]))) -> 1.5954800887928351 | I38: =IF(ISERROR(RC[-7])," ",RC[-7]-RC[-1]) -> -1.5954800887928351 | J38: =IF(ISERROR(RC[-8])," ",RC[-1]^2) -> 2.5455567137343929 | K38: =R[-1]C+R33C5 -> 5.4000000000000012 | L38: =R9C5/(1+R48C3*EXP(-R46C3*RC[-1])) -> 12.957399575400729 | N38: 19
C39: =IF(ISERROR(RC[-2])," ",RC[-2]) -> 0 | D39: =IF(ISERROR(RC[-2])," ",1) -> 1 | F39: =IF(ISERROR(RC[-4])," ",R9C5-RC[-4]) -> 20 | G39: =IF(ISERROR(RC[-5])," ",LN(ABS(RC[-1]/RC[-5]))) -> #DIV/0! | H39: =IF(ISERROR(RC[-7])," ",R9C5/(1+R48C3*EXP(-R46C3*RC[-7]))) -> 1.5954800887928351 | I39: =IF(ISERROR(RC[-7])," ",RC[-7]-RC[-1]) -> -1.5954800887928351 | J39: =IF(ISERROR(RC[-8])," ",RC[-1]^2) -> 2.5455567137343929 | K39: =R[-1]C+R33C5 -> 5.8500000000000014 | L39: =R9C5/(1+R48C3*EXP(-R46C3*RC[-1])) -> 14.071090758906051 | N39: 0
C40: =IF(ISERROR(RC[-2])," ",RC[-2]) -> 0 | D40: =IF(ISERROR(RC[-2])," ",1) -> 1 | F40: =IF(ISERROR(RC[-4])," ",R9C5-RC[-4]) -> 20 | G40: =IF(ISERROR(RC[-5])," ",LN(ABS(RC[-1]/RC[-5]))) -> #DIV/0! | H40: =IF(ISERROR(RC[-7])," ",R9C5/(1+R48C3*EXP(-R46C3*RC[-7]))) -> 1.5954800887928351 | I40: =IF(ISERROR(RC[-7])," ",RC[-7]-RC[-1]) -> -1.5954800887928351 | J40: =IF(ISERROR(RC[-8])," ",RC[-1]^2) -> 2.5455567137343929 | K40: =R[-1]C+R33C5 -> 6.3000000000000016 | L40: =R9C5/(1+R48C3*EXP(-R46C3*RC[-1])) -> 15.075598613341391 | N40: 0
C41: =IF(ISERROR(RC[-2])," ",RC[-2]) -> 0 | D41: =IF(ISERROR(RC[-2])," ",1) -> 1 | F41: =IF(ISERROR(RC[-4])," ",R9C5-RC[-4]) -> 20 | G41: =IF(ISERROR(RC[-5])," ",LN(ABS(RC[-1]/RC[-5]))) -> #DIV/0! | H41: =IF(ISERROR(RC[-7])," ",R9C5/(1+R48C3*EXP(-R46C3*RC[-7]))) -> 1.5954800887928351 | I41: =IF(ISERROR(RC[-7])," ",RC[-7]-RC[-1]) -> -1.5954800887928351 | J41: =IF(ISERROR(RC[-8])," ",RC[-1]^2) -> 2.5455567137343929 | K41: =R[-1]C+R33C5 -> 6.7500000000000018 | L41: =R9C5/(1+R48C3*EXP(-R46C3*RC[-1])) -> 15.958795486757639 | N41: 0
K42: =R[-1]C+R33C5 -> 7.200000000000002 | L42: =R9C5/(1+R48C3*EXP(-R46C3*RC[-1])) -> 16.718073874295129 | N42: 0
B43: =COUNT(R[-34]C:R[-2]C) -> 10 | D43: =MMULT(MINVERSE(MMULT(TRANSPOSE(R[-34]C[-1]:INDEX(R[-34]C:R[-2]C,RC[-2])),R[-34]C[-1]:INDEX(R[-34]C:R[-2]C,RC[-2]))),MMULT(TRANSPOSE(R[-34]C[-1]:INDEX(R[-34]C:R[-2]C,RC[-2])),R[-34]C[3]:INDEX(R[-34]C[3]:R[-2]C[3],RC[-2]))) -> -0.5657613213011311 | K43: =R[-1]C+R33C5 -> 7.6500000000000021 | L43: =R9C5/(1+R48C3*EXP(-R46C3*RC[-1])) -> 17.358310052304002 | N43: 0
D44: 2.4454215947418581 | K44: =R[-1]C+R33C5 -> 8.1000000000000014 | L44: =R9C5/(1+R48C3*EXP(-R46C3*RC[-1])) -> 17.889417021684785 | N44: 0
K45: =R[-1]C+R33C5 -> 8.5500000000000007 | L45: =R9C5/(1+R48C3*EXP(-R46C3*RC[-1])) -> 18.32405532265124 | N45: 0
B46: B= | C46: =-R[-3]C[1] -> 0.5657613213011311 | K46: =R[-1]C+R33C5 -> 9 | L46: =R9C5/(1+R48C3*EXP(-R46C3*RC[-1])) -> 18.675812652505979 | N46: 0
B47: C=y-int= | C47: =R[-3]C[1] -> 2.4454215947418581 | N47: 0
B48: A=e^C= | C48: =EXP(R[-1]C) -> 11.535411842796679 | N48: 0
B49: L= | C49: =R[-40]C[2] -> 20 | N49: 0
N50: 0
N51: 0
B52: SUMMARY OUTPUT
B54: Regression Statistics
B55: Multiple R | C55: 0.98724665720724492
B56: R Square | C56: 0.97465596216687944
B57: Adjusted R Square | C57: 0.97043195586135933
B58: Standard Error | C58: 0.25070629603814837
B59: Observations | C59: 8
B61: ANOVA
C62: df | D62: SS | E62: MS | F62: F | G62: Significance F
B63: Regression | C63: 1 | D63: 14.502980639211334 | E63: 14.502980639211334 | F63: 230.74207083762195 | G63: 5.1362810727793603E-6
B64: Residual | C64: 6 | D64: 0.37712188123900614 | E64: 6.285364687316769E-2
B65: Total | C65: 7 | D65: 14.88010252045034
C67: Coefficients | D67: Standard Error | E67: t Stat | F67: P-value | G67: Lower 95% | H67: Upper 95% | I67: Lower 95.0% | J67: Upper 95.0%
B68: Intercept | C68: 2.1773402488128544 | D68: 0.16183021822418253 | E68: 13.454472673308743 | F68: 1.0445161288062828E-5 | G68: 1.7813556803793285 | H68: 2.5733248172463803 | I68: 1.7813556803793285 | J68: 2.5733248172463803
B69: X Variable 1 | C69: -0.58763003908783029 | D69: 3.8684821335274226E-2 | E69: -15.190196537162441 | F69: 5.1362810727793696E-6 | G69: -0.68228845609716693 | H69: -0.49297162207849365 | I69: -0.68228845609716693 | J69: -0.49297162207849365

Sheet: Secant Limit
A1: The Limit of the Slopes of Secant Lines through a Point for a Given Curve 1. In cell C6, enter "D11=" and then the formula
A2: for your function, using c11 for the variable, then hit Enter. 2. Copy C6 to D11, and then in D11 delete everything to the left of the "=" sign
A3: and hit Enter. 3. Copy cell D11 to D12:D23 . 4. Enter the point (the value of a) in E8, then hit Enter. 5. If desired, change the increment in H6,
A4: then hit Enter. 6. Adjust the width of column B (drag the vertical line between B & C) to see the effects of different levels of rounding.
B6: Function: | C6: D11=1*c11^2 | G6: Initial Increment Magnitude: | H6: 1
G7: (the other increments are obtained by successive
A8: Quick View: | D8: Point (a): | E8: 10 | G8: division by 10; H6 can be changed if you want)
A9: Rounded Slope
A10: x Value | B10: Slope | C10: x=a+h | D10: f(x) | E10: a | F10: f(a) | G10: slope=(f(x)-f(a))/(x-a) | H10: increment=x-a=h
A11: =RC[2] -> 9 | B11: =RC[5] -> 19 | C11: =R17C3+RC[5] -> 9 | D11: =RC[-1]^2 -> 81 | E11: =R8C5 -> 10 | F11: =R17C4 -> 100 | G11: =(RC[-1]-RC[-3])/(RC[-2]-RC[-4]) -> 19 | H11: =-R[-5]C -> -1
A12: =RC[2] -> 9.9 | B12: =RC[5] -> 19.90000000000002 | C12: =R17C3+RC[5] -> 9.9 | D12: =RC[-1]^2 -> 98.01 | E12: =R8C5 -> 10 | F12: =R17C4 -> 100 | G12: =(RC[-1]-RC[-3])/(RC[-2]-RC[-4]) -> 19.90000000000002 | H12: =R[-1]C*0.1 -> -0.1
A13: =RC[2] -> 9.99 | B13: =RC[5] -> 19.990000000000379 | C13: =R17C3+RC[5] -> 9.99 | D13: =RC[-1]^2 -> 99.8001 | E13: =R8C5 -> 10 | F13: =R17C4 -> 100 | G13: =(RC[-1]-RC[-3])/(RC[-2]-RC[-4]) -> 19.990000000000379 | H13: =R[-1]C*0.1 -> -1.0000000000000002E-2
A14: =RC[2] -> 9.9990000000000006 | B14: =RC[5] -> 19.998999999995419 | C14: =R17C3+RC[5] -> 9.9990000000000006 | D14: =RC[-1]^2 -> 99.980001000000016 | E14: =R8C5 -> 10 | F14: =R17C4 -> 100 | G14: =(RC[-1]-RC[-3])/(RC[-2]-RC[-4]) -> 19.998999999995419 | H14: =R[-1]C*0.1 -> -1.0000000000000002E-3
A15: =RC[2] -> 9.9999000000000002 | B15: =RC[5] -> 19.99990000006278 | C15: =R17C3+RC[5] -> 9.9999000000000002 | D15: =RC[-1]^2 -> 99.998000009999998 | E15: =R8C5 -> 10 | F15: =R17C4 -> 100 | G15: =(RC[-1]-RC[-3])/(RC[-2]-RC[-4]) -> 19.99990000006278 | H15: =R[-1]C*0.1 -> -1.0000000000000003E-4
A16: =RC[2] -> 9.9999900000000004 | B16: =RC[5] -> 19.999989999821537 | C16: =R17C3+RC[5] -> 9.9999900000000004 | D16: =RC[-1]^2 -> 99.999800000100009 | E16: =R8C5 -> 10 | F16: =R17C4 -> 100 | G16: =(RC[-1]-RC[-3])/(RC[-2]-RC[-4]) -> 19.999989999821537 | H16: =R[-1]C*0.1 -> -1.0000000000000004E-5
A17: =RC[2] -> 10 | B17: =RC[5] -> #DIV/0! | C17: =R[-9]C[2] -> 10 | D17: =RC[-1]^2 -> 100 | E17: =R8C5 -> 10 | F17: =R17C4 -> 100 | G17: =(RC[-1]-RC[-3])/(RC[-2]-RC[-4]) -> #DIV/0! | H17: 0
A18: =RC[2] -> 10.00001 | B18: =RC[5] -> 20.000010000178463 | C18: =R17C3+RC[5] -> 10.00001 | D18: =RC[-1]^2 -> 100.00020000009999 | E18: =R8C5 -> 10 | F18: =R17C4 -> 100 | G18: =(RC[-1]-RC[-3])/(RC[-2]-RC[-4]) -> 20.000010000178463 | H18: =R[1]C*0.1 -> 1.0000000000000004E-5
A19: =RC[2] -> 10.0001 | B19: =RC[5] -> 20.00009999993722 | C19: =R17C3+RC[5] -> 10.0001 | D19: =RC[-1]^2 -> 100.00200000999999 | E19: =R8C5 -> 10 | F19: =R17C4 -> 100 | G19: =(RC[-1]-RC[-3])/(RC[-2]-RC[-4]) -> 20.00009999993722 | H19: =R[1]C*0.1 -> 1.0000000000000003E-4
A20: =RC[2] -> 10.000999999999999 | B20: =RC[5] -> 20.001000000004581 | C20: =R17C3+RC[5] -> 10.000999999999999 | D20: =RC[-1]^2 -> 100.02000099999999 | E20: =R8C5 -> 10 | F20: =R17C4 -> 100 | G20: =(RC[-1]-RC[-3])/(RC[-2]-RC[-4]) -> 20.001000000004581 | H20: =R[1]C*0.1 -> 1.0000000000000002E-3
A21: =RC[2] -> 10.01 | B21: =RC[5] -> 20.009999999999621 | C21: =R17C3+RC[5] -> 10.01 | D21: =RC[-1]^2 -> 100.20009999999999 | E21: =R8C5 -> 10 | F21: =R17C4 -> 100 | G21: =(RC[-1]-RC[-3])/(RC[-2]-RC[-4]) -> 20.009999999999621 | H21: =R[1]C*0.1 -> 1.0000000000000002E-2
A22: =RC[2] -> 10.1 | B22: =RC[5] -> 20.09999999999998 | C22: =R17C3+RC[5] -> 10.1 | D22: =RC[-1]^2 -> 102.00999999999999 | E22: =R8C5 -> 10 | F22: =R17C4 -> 100 | G22: =(RC[-1]-RC[-3])/(RC[-2]-RC[-4]) -> 20.09999999999998 | H22: =R[1]C*0.1 -> 0.1
A23: =RC[2] -> 11 | B23: =RC[5] -> 21 | C23: =R17C3+RC[5] -> 11 | D23: =RC[-1]^2 -> 121 | E23: =R8C5 -> 10 | F23: =R17C4 -> 100 | G23: =(RC[-1]-RC[-3])/(RC[-2]-RC[-4]) -> 21 | H23: =R[-17]C -> 1
A25: [After copying your formula into the yellow block, numbers will become left-justified. To make them right-justified again, you can highlight
A26: the yellow block (D11:D23), and click on the Right-Justify ("Align Right") button or click on Format, Cells…, Alignment, Horizontal, Right.]

Sheet: Slope & Concavity Graphs 
A1: Approximate Slope and Concavity Graphs (make a copy first!) | L1: Note: You can drag
A2: 1. Enter the domain: the lower bound in A8 & the upper bound in C8. | L2: the black vertical
A3: 2. In cell A10, enter "B13=" followed by the function, using a13 for x, & hit Enter. | L3: line (initially lined
A4: 3. Copy A10 to B13 and in B13, delete everything before the "=" sign, & hit Enter. | L4: up at the point of
A5: 4. Press Ctrl+D. 5. The original, slope, and concavity graphs should appear | L5: inflection of the
A6: at the right. See the note below the concavity graph about possible distortions. | L6: original curve in
L7: the example) to
A8: 0 | B8: <= x <= | C8: 6 | D8: increment= | E8: =(RC[-2]-RC[-4])/50 -> 0.12 | F8: [Domain automatically split | L8: line up at any point
F9: into 50 equal subintervals] | L9: of any curve to see
A10: B13=a13^3-9*a13^2+24*a13 | L10: the relationships
L11: between the
A12: x | B12: f(x) | C12: x | D12: est slope | E12: x | F12: est concav | L12: different curves
A13: =R[-5]C -> 0 | B13: =RC[-1]^3-9*RC[-1]^2+24*RC[-1] -> 0 | C13: =RC[-2] -> 0 | D13: =R[54]C[3] -> 24.000000010000001 | L13: at different points.
A14: =R[-1]C+R8C5 -> 0.12 | B14: =RC[-1]^3-9*RC[-1]^2+24*RC[-1] -> 2.7521279999999999 | C14: =RC[-2] -> 0.12 | D14: =R[54]C[3] -> 21.883200010002213 | E14: =RC[-2] -> 0.12 | F14: =R[54]C[3] -> -17.639999999981569 | L14: If part of the line
A15: =R[-1]C+R8C5 -> 0.24 | B15: =RC[-1]^3-9*RC[-1]^2+24*RC[-1] -> 5.2554239999999997 | C15: =RC[-2] -> 0.24 | D15: =R[54]C[3] -> 19.85280000999623 | E15: =RC[-2] -> 0.24 | F15: =R[54]C[3] -> -16.92000000004986 | L15: disappears, just
A16: =R[-1]C+R8C5 -> 0.36 | B16: =RC[-1]^3-9*RC[-1]^2+24*RC[-1] -> 7.5202560000000007 | C16: =RC[-2] -> 0.36 | D16: =R[54]C[3] -> 17.90880000999806 | E16: =RC[-2] -> 0.36 | F16: =R[54]C[3] -> -16.199999999984747 | L16: click on it, and it
A17: =R[-1]C+R8C5 -> 0.48 | B17: =RC[-1]^3-9*RC[-1]^2+24*RC[-1] -> 9.5569919999999993 | C17: =RC[-2] -> 0.48 | D17: =R[54]C[3] -> 16.051200009998823 | E17: =RC[-2] -> 0.48 | F17: =R[54]C[3] -> -15.479999999993648 | L17: should re-appear.
A18: =R[-1]C+R8C5 -> 0.6 | B18: =RC[-1]^3-9*RC[-1]^2+24*RC[-1] -> 11.375999999999999 | C18: =RC[-2] -> 0.6 | D18: =R[54]C[3] -> 14.280000010007399 | E18: =RC[-2] -> 0.6 | F18: =R[54]C[3] -> -14.759999999928535 | L18: "Ctrl+D" means to
A19: =R[-1]C+R8C5 -> 0.72 | B19: =RC[-1]^3-9*RC[-1]^2+24*RC[-1] -> 12.987648000000002 | C19: =RC[-2] -> 0.72 | D19: =R[54]C[3] -> 12.595200009997143 | E19: =RC[-2] -> 0.72 | F19: =R[54]C[3] -> -14.040000000085467 | L19: hold down the Ctrl
A20: =R[-1]C+R8C5 -> 0.84 | B20: =RC[-1]^3-9*RC[-1]^2+24*RC[-1] -> 14.402304000000001 | C20: =RC[-2] -> 0.84 | D20: =R[54]C[3] -> 10.996800010003582 | E20: =RC[-2] -> 0.84 | F20: =R[54]C[3] -> -13.319999999946338 | L20: key and press the
A21: =R[-1]C+R8C5 -> 0.96 | B21: =RC[-1]^3-9*RC[-1]^2+24*RC[-1] -> 15.630336 | C21: =RC[-2] -> 0.96 | D21: =R[54]C[3] -> 9.4848000100178353 | E21: =RC[-2] -> 0.96 | F21: =R[54]C[3] -> -12.599999999881225 | L21: D key (don't use
A22: =R[-1]C+R8C5 -> 1.08 | B22: =RC[-1]^3-9*RC[-1]^2+24*RC[-1] -> 16.682112000000004 | C22: =RC[-2] -> 1.08 | D22: =R[54]C[3] -> 8.0592000100132566 | E22: =RC[-2] -> 1.08 | F22: =R[54]C[3] -> -11.880000000038157 | L22: the Shift key).
A23: =R[-1]C+R8C5 -> 1.2000000000000002 | B23: =RC[-1]^3-9*RC[-1]^2+24*RC[-1] -> 17.568000000000001 | C23: =RC[-2] -> 1.2000000000000002 | D23: =R[54]C[3] -> 6.720000010034255 | E23: =RC[-2] -> 1.2000000000000002 | F23: =R[54]C[3] -> -11.159999999825015 | L23: To remove a
A24: =R[-1]C+R8C5 -> 1.3200000000000003 | B24: =RC[-1]^3-9*RC[-1]^2+24*RC[-1] -> 18.298368000000004 | C24: =RC[-2] -> 1.3200000000000003 | D24: =R[54]C[3] -> 5.4672000100097762 | E24: =RC[-2] -> 1.3200000000000003 | F24: =R[54]C[3] -> -10.440000000203991 | L24: dotted line
A25: =R[-1]C+R8C5 -> 1.4400000000000004 | B25: =RC[-1]^3-9*RC[-1]^2+24*RC[-1] -> 18.883583999999999 | C25: =RC[-2] -> 1.4400000000000004 | D25: =R[54]C[3] -> 4.3008000100286381 | E25: =RC[-2] -> 1.4400000000000004 | F25: =R[54]C[3] -> -9.7199999998428179 | L25: cell border,
A26: =R[-1]C+R8C5 -> 1.5600000000000005 | B26: =RC[-1]^3-9*RC[-1]^2+24*RC[-1] -> 19.334016000000002 | C26: =RC[-2] -> 1.5600000000000005 | D26: =R[54]C[3] -> 3.2208000100197864 | E26: =RC[-2] -> 1.5600000000000005 | F26: =R[54]C[3] -> -9.000000000073765 | L26: hit Esc.
A27: =R[-1]C+R8C5 -> 1.6800000000000006 | B27: =RC[-1]^3-9*RC[-1]^2+24*RC[-1] -> 19.660032000000001 | C27: =RC[-2] -> 1.6800000000000006 | D27: =R[54]C[3] -> 2.2272000100187483 | E27: =RC[-2] -> 1.6800000000000006 | F27: =R[54]C[3] -> -8.280000000008652
A28: =R[-1]C+R8C5 -> 1.8000000000000007 | B28: =RC[-1]^3-9*RC[-1]^2+24*RC[-1] -> 19.872000000000003 | C28: =RC[-2] -> 1.8000000000000007 | D28: =R[54]C[3] -> 1.3200000100255238 | E28: =RC[-2] -> 1.8000000000000007 | F28: =R[54]C[3] -> -7.5599999999435381
A29: =R[-1]C+R8C5 -> 1.9200000000000008 | B29: =RC[-1]^3-9*RC[-1]^2+24*RC[-1] -> 19.980288000000002 | C29: =RC[-2] -> 1.9200000000000008 | D29: =R[54]C[3] -> 0.49920001000458569 | E29: =RC[-2] -> 1.9200000000000008 | F29: =R[54]C[3] -> -6.8400000001744843 | H29: Note: If the either the slope or concavity graph is a
A30: =R[-1]C+R8C5 -> 2.0400000000000009 | B30: =RC[-1]^3-9*RC[-1]^2+24*RC[-1] -> 19.995263999999999 | C30: =RC[-2] -> 2.0400000000000009 | D30: =R[54]C[3] -> -0.23519998999077529 | E30: =RC[-2] -> 2.0400000000000009 | F30: =R[54]C[3] -> -6.1199999999613421 | H30: horizontal line (that is, if the original function is
A31: =R[-1]C+R8C5 -> 2.160000000000001 | B31: =RC[-1]^3-9*RC[-1]^2+24*RC[-1] -> 19.927295999999998 | C31: =RC[-2] -> 2.160000000000001 | D31: =R[54]C[3] -> -0.88319999006714056 | E31: =RC[-2] -> 2.160000000000001 | F31: =R[54]C[3] -> -5.4000000006363775 | H31: linear or quadratic), they may look irregular due to
A32: =R[-1]C+R8C5 -> 2.2800000000000011 | B32: =RC[-1]^3-9*RC[-1]^2+24*RC[-1] -> 19.786752 | C32: =RC[-2] -> 2.2800000000000011 | D32: =R[54]C[3] -> -1.4447999900113473 | E32: =RC[-2] -> 2.2800000000000011 | F32: =R[54]C[3] -> -4.6799999995350561 | H32: roundoff error and a tiny scale for the y-axis.
A33: =R[-1]C+R8C5 -> 2.4000000000000012 | B33: =RC[-1]^3-9*RC[-1]^2+24*RC[-1] -> 19.583999999999996 | C33: =RC[-2] -> 2.4000000000000012 | D33: =R[54]C[3] -> -1.9199999900720854 | E33: =RC[-2] -> 2.4000000000000012 | F33: =R[54]C[3] -> -3.9600000005061515 | H33: In such cases, the slope and concavity graphs should be able to
A34: =R[-1]C+R8C5 -> 2.5200000000000014 | B34: =RC[-1]^3-9*RC[-1]^2+24*RC[-1] -> 19.329408000000001 | C34: =RC[-2] -> 2.5200000000000014 | D34: =R[54]C[3] -> -2.3087999899473743 | E34: =RC[-2] -> 2.5200000000000014 | F34: =R[54]C[3] -> -3.2399999989607409 | H34: be graphed by hand easily. To make the slope and concavity
A35: =R[-1]C+R8C5 -> 2.6400000000000015 | B35: =RC[-1]^3-9*RC[-1]^2+24*RC[-1] -> 19.033343999999992 | C35: =RC[-2] -> 2.6400000000000015 | D35: =R[54]C[3] -> -2.6111999900280125 | E35: =RC[-2] -> 2.6400000000000015 | F35: =R[54]C[3] -> -2.5200000006719847 | H35: graphs look better here, you can click on the vertical axis
A36: =R[-1]C+R8C5 -> 2.7600000000000016 | B36: =RC[-1]^3-9*RC[-1]^2+24*RC[-1] -> 18.706175999999999 | C36: =RC[-2] -> 2.7600000000000016 | D36: =R[54]C[3] -> -2.8271999899942557 | E36: =RC[-2] -> 2.7600000000000016 | F36: =R[54]C[3] -> -1.7999999997186933 | H36: (so it gets highlighted), then click on Format, Selected Axis,
A37: =R[-1]C+R8C5 -> 2.8800000000000017 | B37: =RC[-1]^3-9*RC[-1]^2+24*RC[-1] -> 18.358271999999985 | C37: =RC[-2] -> 2.8800000000000017 | D37: =R[54]C[3] -> -2.9567999900947939 | E37: =RC[-2] -> 2.8800000000000017 | F37: =R[54]C[3] -> -1.0800000008378183 | H37: and Scale, and enter a wider interval (Minimum and Maximum).
A38: =R[-1]C+R8C5 -> 3.0000000000000018 | B38: =RC[-1]^3-9*RC[-1]^2+24*RC[-1] -> 17.999999999999993 | C38: =RC[-2] -> 3.0000000000000018 | D38: =R[54]C[3] -> -2.9999999899388285 | E38: =RC[-2] -> 3.0000000000000018 | F38: =R[54]C[3] -> -0.35999999870028887
A39: =R[-1]C+R8C5 -> 3.1200000000000019 | B39: =RC[-1]^3-9*RC[-1]^2+24*RC[-1] -> 17.641728000000008 | C39: =RC[-2] -> 3.1200000000000019 | D39: =R[54]C[3] -> -2.9567999900237396 | E39: =RC[-2] -> 3.1200000000000019 | F39: =R[54]C[3] -> 0.35999999929240784
A40: =R[-1]C+R8C5 -> 3.240000000000002 | B40: =RC[-1]^3-9*RC[-1]^2+24*RC[-1] -> 17.293824000000001 | C40: =RC[-2] -> 3.240000000000002 | D40: =R[54]C[3] -> -2.8271999899232014 | E40: =RC[-2] -> 3.240000000000002 | F40: =R[54]C[3] -> 1.0800000008378183
A41: =R[-1]C+R8C5 -> 3.3600000000000021 | B41: =RC[-1]^3-9*RC[-1]^2+24*RC[-1] -> 16.966655999999993 | C41: =RC[-2] -> 3.3600000000000021 | D41: =R[54]C[3] -> -2.6111999900635396 | E41: =RC[-2] -> 3.3600000000000021 | F41: =R[54]C[3] -> 1.7999999988305149
A42: =R[-1]C+R8C5 -> 3.4800000000000022 | B42: =RC[-1]^3-9*RC[-1]^2+24*RC[-1] -> 16.670591999999999 | C42: =RC[-2] -> 3.4800000000000022 | D42: =R[54]C[3] -> -2.3087999898763201 | E42: =RC[-2] -> 3.4800000000000022 | F42: =R[54]C[3] -> 2.5200000015601631
A43: =R[-1]C+R8C5 -> 3.6000000000000023 | B43: =RC[-1]^3-9*RC[-1]^2+24*RC[-1] -> 16.415999999999997 | C43: =RC[-2] -> 3.6000000000000023 | D43: =R[54]C[3] -> -1.9199999900365583 | E43: =RC[-2] -> 3.6000000000000023 | F43: =R[54]C[3] -> 3.2399999986646817
A44: =R[-1]C+R8C5 -> 3.7200000000000024 | B44: =RC[-1]^3-9*RC[-1]^2+24*RC[-1] -> 16.213247999999993 | C44: =RC[-2] -> 3.7200000000000024 | D44: =R[54]C[3] -> -1.444799989940293 | E44: =RC[-2] -> 3.7200000000000024 | F44: =R[54]C[3] -> 3.9600000008022107
A45: =R[-1]C+R8C5 -> 3.8400000000000025 | B45: =RC[-1]^3-9*RC[-1]^2+24*RC[-1] -> 16.072704000000002 | C45: =RC[-2] -> 3.8400000000000025 | D45: =R[54]C[3] -> -0.88319999008490413 | E45: =RC[-2] -> 3.8400000000000025 | F45: =R[54]C[3] -> 4.6799999987949077
A46: =R[-1]C+R8C5 -> 3.9600000000000026 | B46: =RC[-1]^3-9*RC[-1]^2+24*RC[-1] -> 16.004735999999994 | C46: =RC[-2] -> 3.9600000000000026 | D46: =R[54]C[3] -> -0.235199990044066 | E46: =RC[-2] -> 3.9600000000000026 | F46: =R[54]C[3] -> 5.4000000003403184
A47: =R[-1]C+R8C5 -> 4.0800000000000027 | B47: =RC[-1]^3-9*RC[-1]^2+24*RC[-1] -> 16.019712000000013 | C47: =RC[-2] -> 4.0800000000000027 | D47: =R[54]C[3] -> 0.49920001004011283 | E47: =RC[-2] -> 4.0800000000000027 | F47: =R[54]C[3] -> 6.1200000007014905
A48: =R[-1]C+R8C5 -> 4.2000000000000028 | B48: =RC[-1]^3-9*RC[-1]^2+24*RC[-1] -> 16.128 | C48: =RC[-2] -> 4.2000000000000028 | D48: =R[54]C[3] -> 1.3200000098834153 | E48: =RC[-2] -> 4.2000000000000028 | F48: =R[54]C[3] -> 6.8399999986941875
A49: =R[-1]C+R8C5 -> 4.3200000000000029 | B49: =RC[-1]^3-9*RC[-1]^2+24*RC[-1] -> 16.339967999999999 | C49: =RC[-2] -> 4.3200000000000029 | D49: =R[54]C[3] -> 2.2272000099121669 | E49: =RC[-2] -> 4.3200000000000029 | F49: =R[54]C[3] -> 7.5600000002395973
A50: =R[-1]C+R8C5 -> 4.4400000000000031 | B50: =RC[-1]^3-9*RC[-1]^2+24*RC[-1] -> 16.665983999999995 | C50: =RC[-2] -> 4.4400000000000031 | D50: =R[54]C[3] -> 3.220800009913205 | E50: =RC[-2] -> 4.4400000000000031 | F50: =R[54]C[3] -> 8.280000000008652
A51: =R[-1]C+R8C5 -> 4.5600000000000032 | B51: =RC[-1]^3-9*RC[-1]^2+24*RC[-1] -> 17.116416000000015 | C51: =RC[-2] -> 4.5600000000000032 | D51: =R[54]C[3] -> 4.3008000099575838 | E51: =RC[-2] -> 4.5600000000000032 | F51: =R[54]C[3] -> 9.0000000003698233
A52: =R[-1]C+R8C5 -> 4.6800000000000033 | B52: =RC[-1]^3-9*RC[-1]^2+24*RC[-1] -> 17.701632000000018 | C52: =RC[-2] -> 4.6800000000000033 | D52: =R[54]C[3] -> 5.467200009974249 | E52: =RC[-2] -> 4.6800000000000033 | F52: =R[54]C[3] -> 9.720000000138878
A53: =R[-1]C+R8C5 -> 4.8000000000000034 | B53: =RC[-1]^3-9*RC[-1]^2+24*RC[-1] -> 18.432000000000031 | C53: =RC[-2] -> 4.8000000000000034 | D53: =R[54]C[3] -> 6.720000010034255 | E53: =RC[-2] -> 4.8000000000000034 | F53: =R[54]C[3] -> 10.440000000500049
A54: =R[-1]C+R8C5 -> 4.9200000000000035 | B54: =RC[-1]^3-9*RC[-1]^2+24*RC[-1] -> 19.317888000000039 | C54: =RC[-2] -> 4.9200000000000035 | D54: =R[54]C[3] -> 8.059200009995493 | E54: =RC[-2] -> 4.9200000000000035 | F54: =R[54]C[3] -> 11.159999999676984
A55: =R[-1]C+R8C5 -> 5.0400000000000036 | B55: =RC[-1]^3-9*RC[-1]^2+24*RC[-1] -> 20.369664000000057 | C55: =RC[-2] -> 5.0400000000000036 | D55: =R[54]C[3] -> 9.4848000100000718 | E55: =RC[-2] -> 5.0400000000000036 | F55: =R[54]C[3] -> 11.880000000038157
A56: =R[-1]C+R8C5 -> 5.1600000000000037 | B56: =RC[-1]^3-9*RC[-1]^2+24*RC[-1] -> 21.597696000000042 | C56: =RC[-2] -> 5.1600000000000037 | D56: =R[54]C[3] -> 10.996800010047991 | E56: =RC[-2] -> 5.1600000000000037 | F56: =R[54]C[3] -> 12.60000000039933
A57: =R[-1]C+R8C5 -> 5.2800000000000038 | B57: =RC[-1]^3-9*RC[-1]^2+24*RC[-1] -> 23.012352000000021 | C57: =RC[-2] -> 5.2800000000000038 | D57: =R[54]C[3] -> 12.595200009997143 | E57: =RC[-2] -> 5.2800000000000038 | F57: =R[54]C[3] -> 13.319999999576265
A58: =R[-1]C+R8C5 -> 5.4000000000000039 | B58: =RC[-1]^3-9*RC[-1]^2+24*RC[-1] -> 24.624000000000024 | C58: =RC[-2] -> 5.4000000000000039 | D58: =R[54]C[3] -> 14.280000009847527 | E58: =RC[-2] -> 5.4000000000000039 | F58: =R[54]C[3] -> 14.039999998753199
A59: =R[-1]C+R8C5 -> 5.520000000000004 | B59: =RC[-1]^3-9*RC[-1]^2+24*RC[-1] -> 26.443008000000049 | C59: =RC[-2] -> 5.520000000000004 | D59: =R[54]C[3] -> 16.05120000988336 | E59: =RC[-2] -> 5.520000000000004 | F59: =R[54]C[3] -> 14.760000000298609
A60: =R[-1]C+R8C5 -> 5.6400000000000041 | B60: =RC[-1]^3-9*RC[-1]^2+24*RC[-1] -> 28.479744000000068 | C60: =RC[-2] -> 5.6400000000000041 | D60: =R[54]C[3] -> 17.908800009962533 | E60: =RC[-2] -> 5.6400000000000041 | F60: =R[54]C[3] -> 15.480000000659782
A61: =R[-1]C+R8C5 -> 5.7600000000000042 | B61: =RC[-1]^3-9*RC[-1]^2+24*RC[-1] -> 30.74457600000008 | C61: =RC[-2] -> 5.7600000000000042 | D61: =R[54]C[3] -> 19.852800010085048 | E61: =RC[-2] -> 5.7600000000000042 | F61: =R[54]C[3] -> 16.200000001020953
A62: =R[-1]C+R8C5 -> 5.8800000000000043 | B62: =RC[-1]^3-9*RC[-1]^2+24*RC[-1] -> 33.247872000000058 | C62: =RC[-2] -> 5.8800000000000043 | D62: =R[54]C[3] -> 21.883200009824577 | E62: =RC[-2] -> 5.8800000000000043 | F62: =R[54]C[3] -> 16.919999997829414
A63: =R[-1]C+R8C5 -> 6.0000000000000044 | B63: =RC[-1]^3-9*RC[-1]^2+24*RC[-1] -> 36.000000000000114 | C63: =RC[-2] -> 6.0000000000000044 | D63: =R[54]C[3] -> 24.000000010033773
A65: Estimated slope calculations: | I65: Estimated concavity calculations:
A66: x-.0001 | B66: f(x-0.0001) | C66: slope | D66: x+0.0001 | E66: f(x+.0001) | F66: slope | G66: avgslope
A67: =R[-54]C-0.0001 -> -1E-4 | B67: =RC[-1]^3-9*RC[-1]^2+24*RC[-1] -> -2.4000900010000001E-3 | C67: =(R[-54]C[-1]-RC[-1])/0.0001 -> 24.000900009999999 | D67: =R[-54]C[-3]+0.0001 -> 1E-4 | E67: =RC[-1]^3-9*RC[-1]^2+24*RC[-1] -> 2.3999100010000003E-3 | F67: =(RC[-1]-R[-54]C[-4])/0.0001 -> 23.999100010000003 | G67: =(RC[-4]+RC[-1])/2 -> 24.000000010000001
A68: =R[-54]C-0.0001 -> 0.11989999999999999 | B68: =RC[-1]^3-9*RC[-1]^2+24*RC[-1] -> 2.7499395935989996 | C68: =(R[-54]C[-1]-RC[-1])/0.0001 -> 21.884064010002646 | D68: =R[-54]C[-3]+0.0001 -> 0.1201 | E68: =RC[-1]^3-9*RC[-1]^2+24*RC[-1] -> 2.7543162336010001 | F68: =(RC[-1]-R[-54]C[-4])/0.0001 -> 21.882336010001779 | G68: =(RC[-4]+RC[-1])/2 -> 21.883200010002213 | I68: =(RC[-2]-R[-1]C[-2])/R8C5 -> -17.639999999981569
A69: =R[-54]C-0.0001 -> 0.2399 | B69: =RC[-1]^3-9*RC[-1]^2+24*RC[-1] -> 5.2534386371990003 | C69: =(R[-54]C[-1]-RC[-1])/0.0001 -> 19.853628009993685 | D69: =R[-54]C[-3]+0.0001 -> 0.24009999999999998 | E69: =RC[-1]^3-9*RC[-1]^2+24*RC[-1] -> 5.2574091972009995 | F69: =(RC[-1]-R[-54]C[-4])/0.0001 -> 19.851972009998775 | G69: =(RC[-4]+RC[-1])/2 -> 19.85280000999623 | I69: =(RC[-2]-R[-1]C[-2])/R8C5 -> -16.92000000004986
A70: =R[-54]C-0.0001 -> 0.3599 | B70: =RC[-1]^3-9*RC[-1]^2+24*RC[-1] -> 7.5184650407989988 | C70: =(R[-54]C[-1]-RC[-1])/0.0001 -> 17.909592010019182 | D70: =R[-54]C[-3]+0.0001 -> 0.36009999999999998 | E70: =RC[-1]^3-9*RC[-1]^2+24*RC[-1] -> 7.5220468008009984 | F70: =(RC[-1]-R[-54]C[-4])/0.0001 -> 17.908008009976939 | G70: =(RC[-4]+RC[-1])/2 -> 17.90880000999806 | I70: =(RC[-2]-R[-1]C[-2])/R8C5 -> -16.199999999984747
A71: =R[-54]C-0.0001 -> 0.47989999999999999 | B71: =RC[-1]^3-9*RC[-1]^2+24*RC[-1] -> 9.5553868043989993 | C71: =(R[-54]C[-1]-RC[-1])/0.0001 -> 16.051956009999202 | D71: =R[-54]C[-3]+0.0001 -> 0.48009999999999997 | E71: =RC[-1]^3-9*RC[-1]^2+24*RC[-1] -> 9.5585970444009991 | F71: =(RC[-1]-R[-54]C[-4])/0.0001 -> 16.050444009998444 | G71: =(RC[-4]+RC[-1])/2 -> 16.051200009998823 | I71: =(RC[-2]-R[-1]C[-2])/R8C5 -> -15.479999999993648
A72: =R[-54]C-0.0001 -> 0.59989999999999999 | B72: =RC[-1]^3-9*RC[-1]^2+24*RC[-1] -> 11.374571927999 | C72: =(R[-54]C[-1]-RC[-1])/0.0001 -> 14.280720009995918 | D72: =R[-54]C[-3]+0.0001 -> 0.60009999999999997 | E72: =RC[-1]^3-9*RC[-1]^2+24*RC[-1] -> 11.377427928001001 | F72: =(RC[-1]-R[-54]C[-4])/0.0001 -> 14.27928001001888 | G72: =(RC[-4]+RC[-1])/2 -> 14.280000010007399 | I72: =(RC[-2]-R[-1]C[-2])/R8C5 -> -14.759999999928535
A73: =R[-54]C-0.0001 -> 0.71989999999999998 | B73: =RC[-1]^3-9*RC[-1]^2+24*RC[-1] -> 12.986388411599 | C73: =(R[-54]C[-1]-RC[-1])/0.0001 -> 12.59588401001821 | D73: =R[-54]C[-3]+0.0001 -> 0.72009999999999996 | E73: =RC[-1]^3-9*RC[-1]^2+24*RC[-1] -> 12.988907451600999 | F73: =(RC[-1]-R[-54]C[-4])/0.0001 -> 12.594516009976076 | G73: =(RC[-4]+RC[-1])/2 -> 12.595200009997143 | I73: =(RC[-2]-R[-1]C[-2])/R8C5 -> -14.040000000085467
A74: =R[-54]C-0.0001 -> 0.83989999999999998 | B74: =RC[-1]^3-9*RC[-1]^2+24*RC[-1] -> 14.401204255198998 | C74: =(R[-54]C[-1]-RC[-1])/0.0001 -> 10.997448010030553 | D74: =R[-54]C[-3]+0.0001 -> 0.84009999999999996 | E74: =RC[-1]^3-9*RC[-1]^2+24*RC[-1] -> 14.403403615200999 | F74: =(RC[-1]-R[-54]C[-4])/0.0001 -> 10.996152009976612 | G74: =(RC[-4]+RC[-1])/2 -> 10.996800010003582 | I74: =(RC[-2]-R[-1]C[-2])/R8C5 -> -13.319999999946338
A75: =R[-54]C-0.0001 -> 0.95989999999999998 | B75: =RC[-1]^3-9*RC[-1]^2+24*RC[-1] -> 15.629387458798998 | C75: =(R[-54]C[-1]-RC[-1])/0.0001 -> 9.4854120100151817 | D75: =R[-54]C[-3]+0.0001 -> 0.96009999999999995 | E75: =RC[-1]^3-9*RC[-1]^2+24*RC[-1] -> 15.631284418801002 | F75: =(RC[-1]-R[-54]C[-4])/0.0001 -> 9.4841880100204889 | G75: =(RC[-4]+RC[-1])/2 -> 9.4848000100178353 | I75: =(RC[-2]-R[-1]C[-2])/R8C5 -> -12.599999999881225
A76: =R[-54]C-0.0001 -> 1.0799000000000001 | B76: =RC[-1]^3-9*RC[-1]^2+24*RC[-1] -> 16.681306022398999 | C76: =(R[-54]C[-1]-RC[-1])/0.0001 -> 8.0597760100431515 | D76: =R[-54]C[-3]+0.0001 -> 1.0801000000000001 | E76: =RC[-1]^3-9*RC[-1]^2+24*RC[-1] -> 16.682917862401002 | F76: =(RC[-1]-R[-54]C[-4])/0.0001 -> 8.0586240099833617 | G76: =(RC[-4]+RC[-1])/2 -> 8.0592000100132566 | I76: =(RC[-2]-R[-1]C[-2])/R8C5 -> -11.880000000038157
A77: =R[-54]C-0.0001 -> 1.1999000000000002 | B77: =RC[-1]^3-9*RC[-1]^2+24*RC[-1] -> 17.567327945998997 | C77: =(R[-54]C[-1]-RC[-1])/0.0001 -> 6.7205400100434076 | D77: =R[-54]C[-3]+0.0001 -> 1.2001000000000002 | E77: =RC[-1]^3-9*RC[-1]^2+24*RC[-1] -> 17.568671946001004 | F77: =(RC[-1]-R[-54]C[-4])/0.0001 -> 6.7194600100251023 | G77: =(RC[-4]+RC[-1])/2 -> 6.720000010034255 | I77: =(RC[-2]-R[-1]C[-2])/R8C5 -> -11.159999999825015
A78: =R[-54]C-0.0001 -> 1.3199000000000003 | B78: =RC[-1]^3-9*RC[-1]^2+24*RC[-1] -> 18.297821229599002 | C78: =(R[-54]C[-1]-RC[-1])/0.0001 -> 5.4677040100159502 | D78: =R[-54]C[-3]+0.0001 -> 1.3201000000000003 | E78: =RC[-1]^3-9*RC[-1]^2+24*RC[-1] -> 18.298914669601004 | F78: =(RC[-1]-R[-54]C[-4])/0.0001 -> 5.4666960100036022 | G78: =(RC[-4]+RC[-1])/2 -> 5.4672000100097762 | I78: =(RC[-2]-R[-1]C[-2])/R8C5 -> -10.440000000203991
A79: =R[-54]C-0.0001 -> 1.4399000000000004 | B79: =RC[-1]^3-9*RC[-1]^2+24*RC[-1] -> 18.883153873198999 | C79: =(R[-54]C[-1]-RC[-1])/0.0001 -> 4.3012680099963063 | D79: =R[-54]C[-3]+0.0001 -> 1.4401000000000004 | E79: =RC[-1]^3-9*RC[-1]^2+24*RC[-1] -> 18.884014033201005 | F79: =(RC[-1]-R[-54]C[-4])/0.0001 -> 4.3003320100609699 | G79: =(RC[-4]+RC[-1])/2 -> 4.3008000100286381 | I79: =(RC[-2]-R[-1]C[-2])/R8C5 -> -9.7199999998428179
A80: =R[-54]C-0.0001 -> 1.5599000000000005 | B80: =RC[-1]^3-9*RC[-1]^2+24*RC[-1] -> 19.333693876799 | C80: =(R[-54]C[-1]-RC[-1])/0.0001 -> 3.2212320100200031 | D80: =R[-54]C[-3]+0.0001 -> 1.5601000000000005 | E80: =RC[-1]^3-9*RC[-1]^2+24*RC[-1] -> 19.334338036801004 | F80: =(RC[-1]-R[-54]C[-4])/0.0001 -> 3.2203680100195697 | G80: =(RC[-4]+RC[-1])/2 -> 3.2208000100197864 | I80: =(RC[-2]-R[-1]C[-2])/R8C5 -> -9.000000000073765
A81: =R[-54]C-0.0001 -> 1.6799000000000006 | B81: =RC[-1]^3-9*RC[-1]^2+24*RC[-1] -> 19.659809240398999 | C81: =(R[-54]C[-1]-RC[-1])/0.0001 -> 2.2275960100159864 | D81: =R[-54]C[-3]+0.0001 -> 1.6801000000000006 | E81: =RC[-1]^3-9*RC[-1]^2+24*RC[-1] -> 19.660254680401003 | F81: =(RC[-1]-R[-54]C[-4])/0.0001 -> 2.2268040100215103 | G81: =(RC[-4]+RC[-1])/2 -> 2.2272000100187483 | I81: =(RC[-2]-R[-1]C[-2])/R8C5 -> -8.280000000008652
A82: =R[-54]C-0.0001 -> 1.7999000000000007 | B82: =RC[-1]^3-9*RC[-1]^2+24*RC[-1] -> 19.871867963998998 | C82: =(R[-54]C[-1]-RC[-1])/0.0001 -> 1.3203600100553103 | D82: =R[-54]C[-3]+0.0001 -> 1.8001000000000007 | E82: =RC[-1]^3-9*RC[-1]^2+24*RC[-1] -> 19.872131964001003 | F82: =(RC[-1]-R[-54]C[-4])/0.0001 -> 1.3196400099957373 | G82: =(RC[-4]+RC[-1])/2 -> 1.3200000100255238 | I82: =(RC[-2]-R[-1]C[-2])/R8C5 -> -7.5599999999435381
A83: =R[-54]C-0.0001 -> 1.9199000000000008 | B83: =RC[-1]^3-9*RC[-1]^2+24*RC[-1] -> 19.980238047599002 | C83: =(R[-54]C[-1]-RC[-1])/0.0001 -> 0.49952400999586644 | D83: =R[-54]C[-3]+0.0001 -> 1.9201000000000008 | E83: =RC[-1]^3-9*RC[-1]^2+24*RC[-1] -> 19.980337887601003 | F83: =(RC[-1]-R[-54]C[-4])/0.0001 -> 0.49887601001330495 | G83: =(RC[-4]+RC[-1])/2 -> 0.49920001000458569 | I83: =(RC[-2]-R[-1]C[-2])/R8C5 -> -6.8400000001744843
A84: =R[-54]C-0.0001 -> 2.0399000000000007 | B84: =RC[-1]^3-9*RC[-1]^2+24*RC[-1] -> 19.995287491198997 | C84: =(R[-54]C[-1]-RC[-1])/0.0001 -> -0.23491198998470963 | D84: =R[-54]C[-3]+0.0001 -> 2.0401000000000011 | E84: =RC[-1]^3-9*RC[-1]^2+24*RC[-1] -> 19.995240451200999 | F84: =(RC[-1]-R[-54]C[-4])/0.0001 -> -0.23548798999684095 | G84: =(RC[-4]+RC[-1])/2 -> -0.23519998999077529 | I84: =(RC[-2]-R[-1]C[-2])/R8C5 -> -6.1199999999613421
A85: =R[-54]C-0.0001 -> 2.1599000000000008 | B85: =RC[-1]^3-9*RC[-1]^2+24*RC[-1] -> 19.927384294799001 | C85: =(R[-54]C[-1]-RC[-1])/0.0001 -> -0.88294799002852642 | D85: =R[-54]C[-3]+0.0001 -> 2.1601000000000012 | E85: =RC[-1]^3-9*RC[-1]^2+24*RC[-1] -> 19.927207654800988 | F85: =(RC[-1]-R[-54]C[-4])/0.0001 -> -0.8834519901057547 | G85: =(RC[-4]+RC[-1])/2 -> -0.88319999006714056 | I85: =(RC[-2]-R[-1]C[-2])/R8C5 -> -5.4000000006363775
A86: =R[-54]C-0.0001 -> 2.2799000000000009 | B86: =RC[-1]^3-9*RC[-1]^2+24*RC[-1] -> 19.786896458398999 | C86: =(R[-54]C[-1]-RC[-1])/0.0001 -> -1.4445839899934754 | D86: =R[-54]C[-3]+0.0001 -> 2.2801000000000013 | E86: =RC[-1]^3-9*RC[-1]^2+24*RC[-1] -> 19.786607498400997 | F86: =(RC[-1]-R[-54]C[-4])/0.0001 -> -1.4450159900292192 | G86: =(RC[-4]+RC[-1])/2 -> -1.4447999900113473 | I86: =(RC[-2]-R[-1]C[-2])/R8C5 -> -4.6799999995350561
A87: =R[-54]C-0.0001 -> 2.399900000000001 | B87: =RC[-1]^3-9*RC[-1]^2+24*RC[-1] -> 19.584191981999005 | C87: =(R[-54]C[-1]-RC[-1])/0.0001 -> -1.9198199900927193 | D87: =R[-54]C[-3]+0.0001 -> 2.4001000000000015 | E87: =RC[-1]^3-9*RC[-1]^2+24*RC[-1] -> 19.583807982000991 | F87: =(RC[-1]-R[-54]C[-4])/0.0001 -> -1.9201799900514516 | G87: =(RC[-4]+RC[-1])/2 -> -1.9199999900720854 | I87: =(RC[-2]-R[-1]C[-2])/R8C5 -> -3.9600000005061515
A88: =R[-54]C-0.0001 -> 2.5199000000000011 | B88: =RC[-1]^3-9*RC[-1]^2+24*RC[-1] -> 19.329638865598994 | C88: =(R[-54]C[-1]-RC[-1])/0.0001 -> -2.3086559899354597 | D88: =R[-54]C[-3]+0.0001 -> 2.5201000000000016 | E88: =RC[-1]^3-9*RC[-1]^2+24*RC[-1] -> 19.329177105601005 | F88: =(RC[-1]-R[-54]C[-4])/0.0001 -> -2.308943989959289 | G88: =(RC[-4]+RC[-1])/2 -> -2.3087999899473743 | I88: =(RC[-2]-R[-1]C[-2])/R8C5 -> -3.2399999989607409
A89: =R[-54]C-0.0001 -> 2.6399000000000012 | B89: =RC[-1]^3-9*RC[-1]^2+24*RC[-1] -> 19.033605109199002 | C89: =(R[-54]C[-1]-RC[-1])/0.0001 -> -2.6110919900901308 | D89: =R[-54]C[-3]+0.0001 -> 2.6401000000000017 | E89: =RC[-1]^3-9*RC[-1]^2+24*RC[-1] -> 19.033082869200996 | F89: =(RC[-1]-R[-54]C[-4])/0.0001 -> -2.6113079899658942 | G89: =(RC[-4]+RC[-1])/2 -> -2.6111999900280125 | I89: =(RC[-2]-R[-1]C[-2])/R8C5 -> -2.5200000006719847
A90: =R[-54]C-0.0001 -> 2.7599000000000014 | B90: =RC[-1]^3-9*RC[-1]^2+24*RC[-1] -> 18.706458712798991 | C90: =(R[-54]C[-1]-RC[-1])/0.0001 -> -2.8271279899172441 | D90: =R[-54]C[-3]+0.0001 -> 2.7601000000000018 | E90: =RC[-1]^3-9*RC[-1]^2+24*RC[-1] -> 18.705893272800992 | F90: =(RC[-1]-R[-54]C[-4])/0.0001 -> -2.8272719900712673 | G90: =(RC[-4]+RC[-1])/2 -> -2.8271999899942557 | I90: =(RC[-2]-R[-1]C[-2])/R8C5 -> -1.7999999997186933
A91: =R[-54]C-0.0001 -> 2.8799000000000015 | B91: =RC[-1]^3-9*RC[-1]^2+24*RC[-1] -> 18.358567676398998 | C91: =(R[-54]C[-1]-RC[-1])/0.0001 -> -2.9567639901273424 | D91: =R[-54]C[-3]+0.0001 -> 2.8801000000000019 | E91: =RC[-1]^3-9*RC[-1]^2+24*RC[-1] -> 18.357976316400979 | F91: =(RC[-1]-R[-54]C[-4])/0.0001 -> -2.9568359900622454 | G91: =(RC[-4]+RC[-1])/2 -> -2.9567999900947939 | I91: =(RC[-2]-R[-1]C[-2])/R8C5 -> -1.0800000008378183
A92: =R[-54]C-0.0001 -> 2.9999000000000016 | B92: =RC[-1]^3-9*RC[-1]^2+24*RC[-1] -> 18.000299999998987 | C92: =(R[-54]C[-1]-RC[-1])/0.0001 -> -2.9999999899388285 | D92: =R[-54]C[-3]+0.0001 -> 3.000100000000002 | E92: =RC[-1]^3-9*RC[-1]^2+24*RC[-1] -> 17.999700000000999 | F92: =(RC[-1]-R[-54]C[-4])/0.0001 -> -2.9999999899388285 | G92: =(RC[-4]+RC[-1])/2 -> -2.9999999899388285 | I92: =(RC[-2]-R[-1]C[-2])/R8C5 -> -0.35999999870028887
A93: =R[-54]C-0.0001 -> 3.1199000000000017 | B93: =RC[-1]^3-9*RC[-1]^2+24*RC[-1] -> 17.642023683598993 | C93: =(R[-54]C[-1]-RC[-1])/0.0001 -> -2.9568359898490826 | D93: =R[-54]C[-3]+0.0001 -> 3.1201000000000021 | E93: =RC[-1]^3-9*RC[-1]^2+24*RC[-1] -> 17.641432323600988 | F93: =(RC[-1]-R[-54]C[-4])/0.0001 -> -2.9567639901983966 | G93: =(RC[-4]+RC[-1])/2 -> -2.9567999900237396 | I93: =(RC[-2]-R[-1]C[-2])/R8C5 -> 0.35999999929240784
A94: =R[-54]C-0.0001 -> 3.2399000000000018 | B94: =RC[-1]^3-9*RC[-1]^2+24*RC[-1] -> 17.294106727198987 | C94: =(R[-54]C[-1]-RC[-1])/0.0001 -> -2.8272719898581045 | D94: =R[-54]C[-3]+0.0001 -> 3.2401000000000022 | E94: =RC[-1]^3-9*RC[-1]^2+24*RC[-1] -> 17.293541287201002 | F94: =(RC[-1]-R[-54]C[-4])/0.0001 -> -2.8271279899882984 | G94: =(RC[-4]+RC[-1])/2 -> -2.8271999899232014 | I94: =(RC[-2]-R[-1]C[-2])/R8C5 -> 1.0800000008378183
A95: =R[-54]C-0.0001 -> 3.3599000000000019 | B95: =RC[-1]^3-9*RC[-1]^2+24*RC[-1] -> 16.966917130799011 | C95: =(R[-54]C[-1]-RC[-1])/0.0001 -> -2.611307990179057 | D95: =R[-54]C[-3]+0.0001 -> 3.3601000000000023 | E95: =RC[-1]^3-9*RC[-1]^2+24*RC[-1] -> 16.966394890800998 | F95: =(RC[-1]-R[-54]C[-4])/0.0001 -> -2.6110919899480223 | G95: =(RC[-4]+RC[-1])/2 -> -2.6111999900635396 | I95: =(RC[-2]-R[-1]C[-2])/R8C5 -> 1.7999999988305149
A96: =R[-54]C-0.0001 -> 3.479900000000002 | B96: =RC[-1]^3-9*RC[-1]^2+24*RC[-1] -> 16.670822894398981 | C96: =(R[-54]C[-1]-RC[-1])/0.0001 -> -2.3089439898171804 | D96: =R[-54]C[-3]+0.0001 -> 3.4801000000000024 | E96: =RC[-1]^3-9*RC[-1]^2+24*RC[-1] -> 16.670361134401006 | F96: =(RC[-1]-R[-54]C[-4])/0.0001 -> -2.3086559899354597 | G96: =(RC[-4]+RC[-1])/2 -> -2.3087999898763201 | I96: =(RC[-2]-R[-1]C[-2])/R8C5 -> 2.5200000015601631
A97: =R[-54]C-0.0001 -> 3.5999000000000021 | B97: =RC[-1]^3-9*RC[-1]^2+24*RC[-1] -> 16.416192017998995 | C97: =(R[-54]C[-1]-RC[-1])/0.0001 -> -1.9201799899803973 | D97: =R[-54]C[-3]+0.0001 -> 3.6001000000000025 | E97: =RC[-1]^3-9*RC[-1]^2+24*RC[-1] -> 16.415808018000988 | F97: =(RC[-1]-R[-54]C[-4])/0.0001 -> -1.9198199900927193 | G97: =(RC[-4]+RC[-1])/2 -> -1.9199999900365583 | I97: =(RC[-2]-R[-1]C[-2])/R8C5 -> 3.2399999986646817
A98: =R[-54]C-0.0001 -> 3.7199000000000022 | B98: =RC[-1]^3-9*RC[-1]^2+24*RC[-1] -> 16.213392501598989 | C98: =(R[-54]C[-1]-RC[-1])/0.0001 -> -1.4450159899581649 | D98: =R[-54]C[-3]+0.0001 -> 3.7201000000000026 | E98: =RC[-1]^3-9*RC[-1]^2+24*RC[-1] -> 16.213103541601001 | F98: =(RC[-1]-R[-54]C[-4])/0.0001 -> -1.4445839899224211 | G98: =(RC[-4]+RC[-1])/2 -> -1.444799989940293 | I98: =(RC[-2]-R[-1]C[-2])/R8C5 -> 3.9600000008022107
A99: =R[-54]C-0.0001 -> 3.8399000000000023 | B99: =RC[-1]^3-9*RC[-1]^2+24*RC[-1] -> 16.072792345199019 | C99: =(R[-54]C[-1]-RC[-1])/0.0001 -> -0.88345199017680898 | D99: =R[-54]C[-3]+0.0001 -> 3.8401000000000027 | E99: =RC[-1]^3-9*RC[-1]^2+24*RC[-1] -> 16.072615705201002 | F99: =(RC[-1]-R[-54]C[-4])/0.0001 -> -0.88294798999299928 | G99: =(RC[-4]+RC[-1])/2 -> -0.88319999008490413 | I99: =(RC[-2]-R[-1]C[-2])/R8C5 -> 4.6799999987949077
A100: =R[-54]C-0.0001 -> 3.9599000000000024 | B100: =RC[-1]^3-9*RC[-1]^2+24*RC[-1] -> 16.004759548799001 | C100: =(R[-54]C[-1]-RC[-1])/0.0001 -> -0.23548799006789523 | D100: =R[-54]C[-3]+0.0001 -> 3.9601000000000028 | E100: =RC[-1]^3-9*RC[-1]^2+24*RC[-1] -> 16.004712508800992 | F100: =(RC[-1]-R[-54]C[-4])/0.0001 -> -0.23491199002023677 | G100: =(RC[-4]+RC[-1])/2 -> -0.235199990044066 | I100: =(RC[-2]-R[-1]C[-2])/R8C5 -> 5.4000000003403184
A101: =R[-54]C-0.0001 -> 4.079900000000003 | B101: =RC[-1]^3-9*RC[-1]^2+24*RC[-1] -> 16.019662112399004 | C101: =(R[-54]C[-1]-RC[-1])/0.0001 -> 0.49887601008435922 | D101: =R[-54]C[-3]+0.0001 -> 4.0801000000000025 | E101: =RC[-1]^3-9*RC[-1]^2+24*RC[-1] -> 16.019761952401012 | F101: =(RC[-1]-R[-54]C[-4])/0.0001 -> 0.49952400999586644 | G101: =(RC[-4]+RC[-1])/2 -> 0.49920001004011283 | I101: =(RC[-2]-R[-1]C[-2])/R8C5 -> 6.1200000007014905
A102: =R[-54]C-0.0001 -> 4.1999000000000031 | B102: =RC[-1]^3-9*RC[-1]^2+24*RC[-1] -> 16.127868035999015 | C102: =(R[-54]C[-1]-RC[-1])/0.0001 -> 1.3196400098536287 | D102: =R[-54]C[-3]+0.0001 -> 4.2001000000000026 | E102: =RC[-1]^3-9*RC[-1]^2+24*RC[-1] -> 16.128132036000991 | F102: =(RC[-1]-R[-54]C[-4])/0.0001 -> 1.3203600099132018 | G102: =(RC[-4]+RC[-1])/2 -> 1.3200000098834153 | I102: =(RC[-2]-R[-1]C[-2])/R8C5 -> 6.8399999986941875
A103: =R[-54]C-0.0001 -> 4.3199000000000032 | B103: =RC[-1]^3-9*RC[-1]^2+24*RC[-1] -> 16.339745319599004 | C103: =(R[-54]C[-1]-RC[-1])/0.0001 -> 2.226804009950456 | D103: =R[-54]C[-3]+0.0001 -> 4.3201000000000027 | E103: =RC[-1]^3-9*RC[-1]^2+24*RC[-1] -> 16.340190759600986 | F103: =(RC[-1]-R[-54]C[-4])/0.0001 -> 2.2275960098738778 | G103: =(RC[-4]+RC[-1])/2 -> 2.2272000099121669 | I103: =(RC[-2]-R[-1]C[-2])/R8C5 -> 7.5600000002395973
A104: =R[-54]C-0.0001 -> 4.4399000000000033 | B104: =RC[-1]^3-9*RC[-1]^2+24*RC[-1] -> 16.665661963199028 | C104: =(R[-54]C[-1]-RC[-1])/0.0001 -> 3.2203680096642984 | D104: =R[-54]C[-3]+0.0001 -> 4.4401000000000028 | E104: =RC[-1]^3-9*RC[-1]^2+24*RC[-1] -> 16.666306123201011 | F104: =(RC[-1]-R[-54]C[-4])/0.0001 -> 3.2212320101621117 | G104: =(RC[-4]+RC[-1])/2 -> 3.220800009913205 | I104: =(RC[-2]-R[-1]C[-2])/R8C5 -> 8.280000000008652
A105: =R[-54]C-0.0001 -> 4.5599000000000034 | B105: =RC[-1]^3-9*RC[-1]^2+24*RC[-1] -> 17.115985966799016 | C105: =(R[-54]C[-1]-RC[-1])/0.0001 -> 4.3003320099899156 | D105: =R[-54]C[-3]+0.0001 -> 4.5601000000000029 | E105: =RC[-1]^3-9*RC[-1]^2+24*RC[-1] -> 17.116846126801008 | F105: =(RC[-1]-R[-54]C[-4])/0.0001 -> 4.301268009925252 | G105: =(RC[-4]+RC[-1])/2 -> 4.3008000099575838 | I105: =(RC[-2]-R[-1]C[-2])/R8C5 -> 9.0000000003698233
A106: =R[-54]C-0.0001 -> 4.6799000000000035 | B106: =RC[-1]^3-9*RC[-1]^2+24*RC[-1] -> 17.70108533039901 | C106: =(R[-54]C[-1]-RC[-1])/0.0001 -> 5.4666960100746564 | D106: =R[-54]C[-3]+0.0001 -> 4.680100000000003 | E106: =RC[-1]^3-9*RC[-1]^2+24*RC[-1] -> 17.702178770401005 | F106: =(RC[-1]-R[-54]C[-4])/0.0001 -> 5.4677040098738416 | G106: =(RC[-4]+RC[-1])/2 -> 5.467200009974249 | I106: =(RC[-2]-R[-1]C[-2])/R8C5 -> 9.720000000138878
A107: =R[-54]C-0.0001 -> 4.7999000000000036 | B107: =RC[-1]^3-9*RC[-1]^2+24*RC[-1] -> 18.43132805399901 | C107: =(R[-54]C[-1]-RC[-1])/0.0001 -> 6.719460010202738 | D107: =R[-54]C[-3]+0.0001 -> 4.8001000000000031 | E107: =RC[-1]^3-9*RC[-1]^2+24*RC[-1] -> 18.432672054001017 | F107: =(RC[-1]-R[-54]C[-4])/0.0001 -> 6.7205400098657719 | G107: =(RC[-4]+RC[-1])/2 -> 6.720000010034255 | I107: =(RC[-2]-R[-1]C[-2])/R8C5 -> 10.440000000500049
A108: =R[-54]C-0.0001 -> 4.9199000000000037 | B108: =RC[-1]^3-9*RC[-1]^2+24*RC[-1] -> 19.317082137599044 | C108: =(R[-54]C[-1]-RC[-1])/0.0001 -> 8.0586240099478346 | D108: =R[-54]C[-3]+0.0001 -> 4.9201000000000032 | E108: =RC[-1]^3-9*RC[-1]^2+24*RC[-1] -> 19.318693977601043 | F108: =(RC[-1]-R[-54]C[-4])/0.0001 -> 8.0597760100431515 | G108: =(RC[-4]+RC[-1])/2 -> 8.059200009995493 | I108: =(RC[-2]-R[-1]C[-2])/R8C5 -> 11.159999999676984
A109: =R[-54]C-0.0001 -> 5.0399000000000038 | B109: =RC[-1]^3-9*RC[-1]^2+24*RC[-1] -> 20.368715581199041 | C109: =(R[-54]C[-1]-RC[-1])/0.0001 -> 9.4841880101625975 | D109: =R[-54]C[-3]+0.0001 -> 5.0401000000000034 | E109: =RC[-1]^3-9*RC[-1]^2+24*RC[-1] -> 20.370612541201041 | F109: =(RC[-1]-R[-54]C[-4])/0.0001 -> 9.4854120098375461 | G109: =(RC[-4]+RC[-1])/2 -> 9.4848000100000718 | I109: =(RC[-2]-R[-1]C[-2])/R8C5 -> 11.880000000038157
A110: =R[-54]C-0.0001 -> 5.1599000000000039 | B110: =RC[-1]^3-9*RC[-1]^2+24*RC[-1] -> 21.596596384799028 | C110: =(R[-54]C[-1]-RC[-1])/0.0001 -> 10.996152010136484 | D110: =R[-54]C[-3]+0.0001 -> 5.1601000000000035 | E110: =RC[-1]^3-9*RC[-1]^2+24*RC[-1] -> 21.598795744801038 | F110: =(RC[-1]-R[-54]C[-4])/0.0001 -> 10.997448009959498 | G110: =(RC[-4]+RC[-1])/2 -> 10.996800010047991 | I110: =(RC[-2]-R[-1]C[-2])/R8C5 -> 12.60000000039933
A111: =R[-54]C-0.0001 -> 5.279900000000004 | B111: =RC[-1]^3-9*RC[-1]^2+24*RC[-1] -> 23.011092548399034 | C111: =(R[-54]C[-1]-RC[-1])/0.0001 -> 12.594516009869494 | D111: =R[-54]C[-3]+0.0001 -> 5.2801000000000036 | E111: =RC[-1]^3-9*RC[-1]^2+24*RC[-1] -> 23.013611588401034 | F111: =(RC[-1]-R[-54]C[-4])/0.0001 -> 12.595884010124792 | G111: =(RC[-4]+RC[-1])/2 -> 12.595200009997143 | I111: =(RC[-2]-R[-1]C[-2])/R8C5 -> 13.319999999576265
A112: =R[-54]C-0.0001 -> 5.3999000000000041 | B112: =RC[-1]^3-9*RC[-1]^2+24*RC[-1] -> 24.622572071999087 | C112: =(R[-54]C[-1]-RC[-1])/0.0001 -> 14.279280009361628 | D112: =R[-54]C[-3]+0.0001 -> 5.4001000000000037 | E112: =RC[-1]^3-9*RC[-1]^2+24*RC[-1] -> 24.625428072001057 | F112: =(RC[-1]-R[-54]C[-4])/0.0001 -> 14.280720010333425 | G112: =(RC[-4]+RC[-1])/2 -> 14.280000009847527 | I112: =(RC[-2]-R[-1]C[-2])/R8C5 -> 14.039999998753199
A113: =R[-54]C-0.0001 -> 5.5199000000000042 | B113: =RC[-1]^3-9*RC[-1]^2+24*RC[-1] -> 26.441402955599102 | C113: =(R[-54]C[-1]-RC[-1])/0.0001 -> 16.050444009465537 | D113: =R[-54]C[-3]+0.0001 -> 5.5201000000000038 | E113: =RC[-1]^3-9*RC[-1]^2+24*RC[-1] -> 26.444613195601079 | F113: =(RC[-1]-R[-54]C[-4])/0.0001 -> 16.051956010301183 | G113: =(RC[-4]+RC[-1])/2 -> 16.05120000988336 | I113: =(RC[-2]-R[-1]C[-2])/R8C5 -> 14.760000000298609
A114: =R[-54]C-0.0001 -> 5.6399000000000044 | B114: =RC[-1]^3-9*RC[-1]^2+24*RC[-1] -> 28.477953199199106 | C114: =(R[-54]C[-1]-RC[-1])/0.0001 -> 17.908008009612786 | D114: =R[-54]C[-3]+0.0001 -> 5.6401000000000039 | E114: =RC[-1]^3-9*RC[-1]^2+24*RC[-1] -> 28.481534959201099 | F114: =(RC[-1]-R[-54]C[-4])/0.0001 -> 17.909592010312281 | G114: =(RC[-4]+RC[-1])/2 -> 17.908800009962533 | I114: =(RC[-2]-R[-1]C[-2])/R8C5 -> 15.480000000659782
A115: =R[-54]C-0.0001 -> 5.7599000000000045 | B115: =RC[-1]^3-9*RC[-1]^2+24*RC[-1] -> 30.742590802799072 | C115: =(R[-54]C[-1]-RC[-1])/0.0001 -> 19.851972010087593 | D115: =R[-54]C[-3]+0.0001 -> 5.760100000000004 | E115: =RC[-1]^3-9*RC[-1]^2+24*RC[-1] -> 30.746561362801089 | F115: =(RC[-1]-R[-54]C[-4])/0.0001 -> 19.853628010082502 | G115: =(RC[-4]+RC[-1])/2 -> 19.852800010085048 | I115: =(RC[-2]-R[-1]C[-2])/R8C5 -> 16.200000001020953
A116: =R[-54]C-0.0001 -> 5.8799000000000046 | B116: =RC[-1]^3-9*RC[-1]^2+24*RC[-1] -> 33.245683766399083 | C116: =(R[-54]C[-1]-RC[-1])/0.0001 -> 21.882336009753089 | D116: =R[-54]C[-3]+0.0001 -> 5.8801000000000041 | E116: =RC[-1]^3-9*RC[-1]^2+24*RC[-1] -> 33.250060406401047 | F116: =(RC[-1]-R[-54]C[-4])/0.0001 -> 21.884064009896065 | G116: =(RC[-4]+RC[-1])/2 -> 21.883200009824577 | I116: =(RC[-2]-R[-1]C[-2])/R8C5 -> 16.919999997829414
A117: =R[-54]C-0.0001 -> 5.9999000000000047 | B117: =RC[-1]^3-9*RC[-1]^2+24*RC[-1] -> 35.997600089999111 | C117: =(R[-54]C[-1]-RC[-1])/0.0001 -> 23.999100010030361 | D117: =R[-54]C[-3]+0.0001 -> 6.0001000000000042 | E117: =RC[-1]^3-9*RC[-1]^2+24*RC[-1] -> 36.002400090001117 | F117: =(RC[-1]-R[-54]C[-4])/0.0001 -> 24.000900010037185 | G117: =(RC[-4]+RC[-1])/2 -> 24.000000010033773 | L117: =(RC[-5]-R[-1]C[-5])/R8C5 -> 17.640000001743299