Sheet: Table1
A1: 'Table 1: University Ministry of Education EFTS funding and EFTS numbers | B1: 'UPI deflated expencditure | F1: 'CPI deflated expencditure
A2: 'Calendar year | C2: 'Nominal expenditure inclusive of GST | D2: 'Nominal expenditure exclusive of GST | F2: 'Nominal expenditure exclusive of GSTper EFTS | H2: 'UPI Deflated expenditure exclusive of GST per EFTS | J2: 'CPI Deflated expenditure inclusive of GST per EFTS | K2: 'n | L2: 'Annual average change 1980 -current period | M2: 'n | N2: 'Annual average change 1991 -current period | O2: 'n | P2: 'Annual average change 1980 -current period | Q2: 'n | R2: 'Annual average change 1991 -current period
C3: '$(million) | D3: '$(million) | E3: '(000) | F3: '$ | G3: '1980 = 1000 | H3: '1999 $ | I3: 'Change | J3: '1980 = 1000 | K3: '1999 $ | L3: 'Change | M3: '# | N3: '% | O3: '# | P3: '% | Q3: '# | R3: '% | S3: '# | T3: '%
A4: 1980 | C4: =Fundingto1989!R[+1]C[+1] -> 146.76 | D4: '(4,5) | E4: =RC[-2] -> 146.76 | G4: 37.847 | H4: '(7a) | I4: =RC[-4]/RC[-2]*1000 -> 3877.71818109758 | K4: =AppendixPriceIndex!R[+4]C[-3] -> 1000 | M4: =RC[-4]/RC[-2]*R23C[-2] -> 10735.9450012835 | O4: 1000 | P4: =RC[-13]/RC[-9]/RC[-1]*R23C[-1]*1000 -> 12393.1873067879
A5: =1+R[-1]C -> 1981 | C5: =Fundingto1989!R[+1]C[+1] -> 175.06825 | D5: '(4,5) | E5: =RC[-2] -> 175.06825 | G5: 38.641 | H5: '(7a) | I5: =RC[-4]/RC[-2]*1000 -> 4530.63455914702 | K5: =AppendixPriceIndex!R[+7]C[-3] -> 1198.47934969335 | M5: =RC[-4]/RC[-2]*R23C[-2] -> 10466.2839548214 | N5: =(RC[-1]-R[-1]C[-1])/R[-1]C[-1] -> -0.02511758829147 | O5: 1153 | P5: =RC[-13]/RC[-9]/RC[-1]*R23C[-1]*1000 -> 12558.4631838976 | Q5: =(RC[-1]-R[-1]C[-1])/R[-1]C[-1] -> 0.0133360267232607 | R5: 1 | S5: =RATE(RC[-1], 0, -R4C[-6], RC[-6]) -> #NUM! | V5: 1 | W5: =RATE(RC[-1], 0, -R4C[-7], RC[-7]) -> #NUM!
A6: =1+R[-1]C -> 1982 | C6: =Fundingto1989!R[+1]C[+1] -> 192.71425 | D6: '(4,5) | E6: =RC[-2] -> 192.71425 | G6: 38.934 | H6: '(7a) | I6: =RC[-4]/RC[-2]*1000 -> 4949.76755535008 | K6: =AppendixPriceIndex!R[+10]C[-3] -> 1340.7437086247 | M6: =RC[-4]/RC[-2]*R23C[-2] -> 10221.2279060872 | N6: =(RC[-1]-R[-1]C[-1])/R[-1]C[-1] -> -0.0234138544102204 | O6: 1340 | P6: =RC[-13]/RC[-9]/RC[-1]*R23C[-1]*1000 -> 11805.5650051484 | Q6: =(RC[-1]-R[-1]C[-1])/R[-1]C[-1] -> -0.0599514580505772 | R6: 2 | S6: =RATE(RC[-1], 0, -R4C[-6], RC[-6]) -> #NUM! | V6: 2 | W6: =RATE(RC[-1], 0, -R4C[-7], RC[-7]) -> #NUM!
A7: =1+R[-1]C -> 1983 | C7: =Fundingto1989!R[+1]C[+1] -> 200.586 | D7: '(4,5) | E7: =RC[-2] -> 200.586 | G7: 40.563 | H7: '(7a) | I7: =RC[-4]/RC[-2]*1000 -> 4945.04844316249 | K7: =AppendixPriceIndex!R[+13]C[-3] -> 1349.95874387779 | M7: =RC[-4]/RC[-2]*R23C[-2] -> 10141.7777562872 | N7: =(RC[-1]-R[-1]C[-1])/R[-1]C[-1] -> -0.00777305334838412 | O7: 1439 | P7: =RC[-13]/RC[-9]/RC[-1]*R23C[-1]*1000 -> 10982.8872997549 | Q7: =(RC[-1]-R[-1]C[-1])/R[-1]C[-1] -> -0.069685585148591 | R7: 3 | S7: =RATE(RC[-1], 0, -R4C[-6], RC[-6]) -> #NUM! | V7: 3 | W7: =RATE(RC[-1], 0, -R4C[-7], RC[-7]) -> #NUM!
A8: =1+R[-1]C -> 1984 | C8: =Fundingto1989!R[+1]C[+1] -> 208.19275 | D8: '(4,5) | E8: =RC[-2] -> 208.19275 | G8: 41.606 | H8: '(7a) | I8: =RC[-4]/RC[-2]*1000 -> 5003.91169542854 | K8: =AppendixPriceIndex!R[+16]C[-3] -> 1382.25145814276 | M8: =RC[-4]/RC[-2]*R23C[-2] -> 10022.7434833512 | N8: =(RC[-1]-R[-1]C[-1])/R[-1]C[-1] -> -0.0117370224231291 | O8: 1526 | P8: =RC[-13]/RC[-9]/RC[-1]*R23C[-1]*1000 -> 10480.0142716839 | Q8: =(RC[-1]-R[-1]C[-1])/R[-1]C[-1] -> -0.0457869606002633 | R8: 4 | S8: =RATE(RC[-1], 0, -R4C[-6], RC[-6]) -> #NUM! | V8: 4 | W8: =RATE(RC[-1], 0, -R4C[-7], RC[-7]) -> #NUM!
A9: =1+R[-1]C -> 1985 | C9: =Fundingto1989!R[+1]C[+1] -> 260.91725 | D9: '(4,5) | E9: =RC[-2] -> 260.91725 | G9: 42.219 | H9: '(7a) | I9: =RC[-4]/RC[-2]*1000 -> 6180.09071744949 | K9: =AppendixPriceIndex!R[+19]C[-3] -> 1541.64920839255 | M9: =RC[-4]/RC[-2]*R23C[-2] -> 11098.7308841114 | N9: =(RC[-1]-R[-1]C[-1])/R[-1]C[-1] -> 0.107354578369435 | O9: 1762 | P9: =RC[-13]/RC[-9]/RC[-1]*R23C[-1]*1000 -> 11209.7445703567 | Q9: =(RC[-1]-R[-1]C[-1])/R[-1]C[-1] -> 0.0696306588669931 | R9: 5 | S9: =RATE(RC[-1], 0, -R4C[-6], RC[-6]) -> #NUM! | V9: 5 | W9: =RATE(RC[-1], 0, -R4C[-7], RC[-7]) -> #NUM!
A10: =1+R[-1]C -> 1986 | C10: =Fundingto1989!R[+1]C[+1] -> 313.234 | D10: '(4,5) | E10: =RC[-2]/102.5*100 -> 305.594146341463 | F10: '(8) | G10: 43.573 | H10: '(7a) | I10: =RC[-4]/RC[-2]*1000 -> 7013.38320385247 | K10: =AppendixPriceIndex!R[+22]C[-3] -> 1804.13878028226 | M10: =RC[-4]/RC[-2]*R23C[-2] -> 10762.7105892658 | N10: =(RC[-1]-R[-1]C[-1])/R[-1]C[-1] -> -0.0302755601837948 | O10: 1994 | P10: =RC[-13]/RC[-9]/RC[-1]*R23C[-1]*1000 -> 11522.1374310433 | Q10: =(RC[-1]-R[-1]C[-1])/R[-1]C[-1] -> 0.0278679731483477 | R10: 6 | S10: =RATE(RC[-1], 0, -R4C[-6], RC[-6]) -> #NUM! | V10: 6 | W10: =RATE(RC[-1], 0, -R4C[-7], RC[-7]) -> #NUM!
A11: =1+R[-1]C -> 1987 | C11: =Fundingto1989!R[+1]C[+1] -> 374.7095 | D11: '(4,5) | E11: =RC[-2]/110*100 -> 340.645 | G11: 45.865 | H11: '(7a) | I11: =RC[-4]/RC[-2]*1000 -> 7427.12307860024 | K11: =AppendixPriceIndex!R[+25]C[-3] -> 1955.78652356504 | M11: =RC[-4]/RC[-2]*R23C[-2] -> 10513.884619563 | N11: =(RC[-1]-R[-1]C[-1])/R[-1]C[-1] -> -0.0231192660658251 | O11: 2309 | P11: =RC[-13]/RC[-9]/RC[-1]*R23C[-1]*1000 -> 11308.2693352651 | Q11: =(RC[-1]-R[-1]C[-1])/R[-1]C[-1] -> -0.0185614949533594 | R11: 7 | S11: =RATE(RC[-1], 0, -R4C[-6], RC[-6]) -> #NUM! | V11: 7 | W11: =RATE(RC[-1], 0, -R4C[-7], RC[-7]) -> #NUM!
A12: =1+R[-1]C -> 1988 | C12: =Fundingto1989!R[+1]C[+1] -> 440.6548 | D12: '(6) | E12: =RC[-2]/110*100 -> 400.595272727273 | G12: 50.786 | H12: '(7a) | I12: =RC[-4]/RC[-2]*1000 -> 7887.90754789258 | K12: =AppendixPriceIndex!R[+28]C[-3] -> 2098.84080319306 | M12: =RC[-4]/RC[-2]*R23C[-2] -> 10405.102149964 | N12: =(RC[-1]-R[-1]C[-1])/R[-1]C[-1] -> -0.0103465534895258 | O12: 2457 | P12: =RC[-13]/RC[-9]/RC[-1]*R23C[-1]*1000 -> 11286.4174909936 | Q12: =(RC[-1]-R[-1]C[-1])/R[-1]C[-1] -> -0.00193237741546802 | R12: 8 | S12: =RATE(RC[-1], 0, -R4C[-6], RC[-6]) -> #NUM! | V12: 8 | W12: =RATE(RC[-1], 0, -R4C[-7], RC[-7]) -> #NUM!
A13: =1+R[-1]C -> 1989 | C13: =Fundingto1989!R[+1]C[+1] -> 489.30436 | D13: '(6) | E13: =RC[-2]/111.25*100 -> 439.824143820225 | F13: '(9) | G13: 56.989 | H13: '(7a) | I13: =RC[-4]/RC[-2]*1000 -> 7717.70243064845 | K13: =AppendixPriceIndex!R[+31]C[-3] -> 2184.86890363994 | M13: =RC[-4]/RC[-2]*R23C[-2] -> 9779.7258613766 | N13: =(RC[-1]-R[-1]C[-1])/R[-1]C[-1] -> -0.0601028495034623 | O13: 2596 | P13: =RC[-13]/RC[-9]/RC[-1]*R23C[-1]*1000 -> 10570.3685967997 | Q13: =(RC[-1]-R[-1]C[-1])/R[-1]C[-1] -> -0.0634434172548749 | R13: 9 | S13: =RATE(RC[-1], 0, -R4C[-6], RC[-6]) -> #NUM! | V13: 9 | W13: =RATE(RC[-1], 0, -R4C[-7], RC[-7]) -> #NUM!
A14: =1+R[-1]C -> 1990 | C14: 516.243132 | D14: '(7b) | E14: =RC[-2]/9*8 -> 458.882784 | G14: 60.606 | H14: '(7a) | I14: =RC[-4]/RC[-2]*1000 -> 7571.57350757351 | K14: =AppendixPriceIndex!R[+34]C[-3] -> 2275.32158670573 | M14: =RC[-4]/RC[-2]*R23C[-2] -> 9213.13406755707 | N14: =(RC[-1]-R[-1]C[-1])/R[-1]C[-1] -> -0.0579353452081089 | O14: 2755 | P14: =RC[-13]/RC[-9]/RC[-1]*R23C[-1]*1000 -> 9881.52179545573 | Q14: =(RC[-1]-R[-1]C[-1])/R[-1]C[-1] -> -0.0651677181392287 | R14: 10 | S14: =RATE(RC[-1], 0, -R4C[-6], RC[-6]) -> #NUM! | V14: 10 | W14: =RATE(RC[-1], 0, -R4C[-7], RC[-7]) -> #NUM!
A15: =1+R[-1]C -> 1991 | B15: '(3) | C15: 571.810864 | D15: '(7c) | E15: =RC[-2]/9*8 -> 508.276323555556 | G15: 67.058 | H15: '(7c) | I15: =RC[-4]/RC[-2]*1000 -> 7579.65229436541 | K15: =AppendixPriceIndex!R[+37]C[-3] -> 2410.07017195088 | M15: =RC[-4]/RC[-2]*R23C[-2] -> 8707.30246581053 | N15: =(RC[-1]-R[-1]C[-1])/R[-1]C[-1] -> -0.0549033149889537 | O15: 2826 | P15: =RC[-13]/RC[-9]/RC[-1]*R23C[-1]*1000 -> 9643.53850827701 | Q15: =(RC[-1]-R[-1]C[-1])/R[-1]C[-1] -> -0.0240836676885302 | R15: 11 | S15: =RATE(RC[-1], 0, -R4C[-6], RC[-6]) -> #NUM! | V15: 11 | W15: =RATE(RC[-1], 0, -R4C[-7], RC[-7]) -> #NUM!
A16: =1+R[-1]C -> 1992 | B16: '(3) | C16: 615.238898 | D16: '(7c) | E16: =RC[-2]/9*8 -> 546.879020444444 | G16: 69.434 | H16: '(7c) | I16: =RC[-4]/RC[-2]*1000 -> 7876.24248126918 | K16: =AppendixPriceIndex!R[+40]C[-3] -> 2425.47078607847 | M16: =RC[-4]/RC[-2]*R23C[-2] -> 8990.56665259905 | N16: =(RC[-1]-R[-1]C[-1])/R[-1]C[-1] -> 0.0325317959150694 | O16: 2856 | P16: =RC[-13]/RC[-9]/RC[-1]*R23C[-1]*1000 -> 9915.62669516924 | Q16: =(RC[-1]-R[-1]C[-1])/R[-1]C[-1] -> 0.0282145590706873 | R16: 12 | S16: =RATE(RC[-1], 0, -R4C[-6], RC[-6]) -> #NUM! | T16: 1 | U16: =RATE(RC[-1], 0, -R15C[-8], RC[-8]) -> #NUM! | V16: 12 | W16: =RATE(RC[-1], 0, -R4C[-7], RC[-7]) -> #NUM! | X16: 1 | Y16: =RATE(RC[-1], 0, -R15C[-9], RC[-9]) -> #NUM!
A17: =1+R[-1]C -> 1993 | B17: '(3) | C17: 637.262885 | D17: '(7c) | E17: =RC[-2]/9*8 -> 566.455897777778 | G17: 73.782 | H17: '(7c) | I17: =RC[-4]/RC[-2]*1000 -> 7677.42671353145 | K17: =AppendixPriceIndex!R[+43]C[-3] -> 2449.51630900851 | M17: =RC[-4]/RC[-2]*R23C[-2] -> 8677.59504646434 | N17: =(RC[-1]-R[-1]C[-1])/R[-1]C[-1] -> -0.0348111101589168 | O17: 2892 | P17: =RC[-13]/RC[-9]/RC[-1]*R23C[-1]*1000 -> 9545.01651054714 | Q17: =(RC[-1]-R[-1]C[-1])/R[-1]C[-1] -> -0.0373763752928145 | R17: 13 | S17: =RATE(RC[-1], 0, -R4C[-6], RC[-6]) -> #NUM! | T17: 2 | U17: =RATE(RC[-1], 0, -R15C[-8], RC[-8]) -> #NUM! | V17: 13 | W17: =RATE(RC[-1], 0, -R4C[-7], RC[-7]) -> #NUM! | X17: 2 | Y17: =RATE(RC[-1], 0, -R15C[-9], RC[-9]) -> #NUM!
A18: =1+R[-1]C -> 1994 | B18: '(3) | C18: 641.987668 | D18: '(7c) | E18: =RC[-2]/9*8 -> 570.655704888889 | G18: 77.239 | H18: '(7c) | I18: =RC[-4]/RC[-2]*1000 -> 7388.18090458044 | K18: =AppendixPriceIndex!R[+46]C[-3] -> 2459.19757043506 | M18: =RC[-4]/RC[-2]*R23C[-2] -> 8317.79351269438 | N18: =(RC[-1]-R[-1]C[-1])/R[-1]C[-1] -> -0.0414632777680219 | O18: 2943 | P18: =RC[-13]/RC[-9]/RC[-1]*R23C[-1]*1000 -> 9026.23324581005 | Q18: =(RC[-1]-R[-1]C[-1])/R[-1]C[-1] -> -0.0543512171156375 | R18: 14 | S18: =RATE(RC[-1], 0, -R4C[-6], RC[-6]) -> #NUM! | T18: 3 | U18: =RATE(RC[-1], 0, -R15C[-8], RC[-8]) -> #NUM! | V18: 14 | W18: =RATE(RC[-1], 0, -R4C[-7], RC[-7]) -> #NUM! | X18: 3 | Y18: =RATE(RC[-1], 0, -R15C[-9], RC[-9]) -> #NUM!
A19: =1+R[-1]C -> 1995 | B19: '(3) | C19: 655.49018 | D19: '(7c) | E19: =RC[-2]/9*8 -> 582.657937777778 | G19: 79.335 | H19: '(7c) | I19: =RC[-4]/RC[-2]*1000 -> 7344.27349565485 | K19: =AppendixPriceIndex!R[+49]C[-3] -> 2481.90377955823 | M19: =RC[-4]/RC[-2]*R23C[-2] -> 8192.71667319206 | N19: =(RC[-1]-R[-1]C[-1])/R[-1]C[-1] -> -0.0150372619026224 | O19: 3053 | P19: =RC[-13]/RC[-9]/RC[-1]*R23C[-1]*1000 -> 8649.30735461088 | Q19: =(RC[-1]-R[-1]C[-1])/R[-1]C[-1] -> -0.0417589354201695 | R19: 15 | S19: =RATE(RC[-1], 0, -R4C[-6], RC[-6]) -> #NUM! | T19: 4 | U19: =RATE(RC[-1], 0, -R15C[-8], RC[-8]) -> #NUM! | V19: 15 | W19: =RATE(RC[-1], 0, -R4C[-7], RC[-7]) -> #NUM! | X19: 4 | Y19: =RATE(RC[-1], 0, -R15C[-9], RC[-9]) -> #NUM!
A20: =1+R[-1]C -> 1996 | B20: '(3) | C20: 658.413008 | D20: '(7c) | E20: =RC[-2]/9*8 -> 585.256007111111 | G20: 80.704 | H20: '(7c) | I20: =RC[-4]/RC[-2]*1000 -> 7251.88351396599 | K20: =AppendixPriceIndex!R[+52]C[-3] -> 2545.37462015088 | M20: =RC[-4]/RC[-2]*R23C[-2] -> 7887.93176593993 | N20: =(RC[-1]-R[-1]C[-1])/R[-1]C[-1] -> -0.0372019342801691 | O20: 3123 | P20: =RC[-13]/RC[-9]/RC[-1]*R23C[-1]*1000 -> 8349.07050094932 | Q20: =(RC[-1]-R[-1]C[-1])/R[-1]C[-1] -> -0.0347122424203729 | R20: 16 | S20: =RATE(RC[-1], 0, -R4C[-6], RC[-6]) -> #NUM! | T20: 5 | U20: =RATE(RC[-1], 0, -R15C[-8], RC[-8]) -> #NUM! | V20: 16 | W20: =RATE(RC[-1], 0, -R4C[-7], RC[-7]) -> #NUM! | X20: 5 | Y20: =RATE(RC[-1], 0, -R15C[-9], RC[-9]) -> #NUM!
A21: =1+R[-1]C -> 1997 | B21: '(3) | C21: 672.736551 | D21: '(7c) | E21: =RC[-2]/9*8 -> 597.988045333333 | G21: 84.063 | H21: '(7c) | I21: =RC[-4]/RC[-2]*1000 -> 7113.5701239943 | K21: =AppendixPriceIndex!R[+55]C[-3] -> 2634.8441243027 | M21: =RC[-4]/RC[-2]*R23C[-2] -> 7474.75090485768 | N21: =(RC[-1]-R[-1]C[-1])/R[-1]C[-1] -> -0.0523813939246225 | O21: 3159 | P21: =RC[-13]/RC[-9]/RC[-1]*R23C[-1]*1000 -> 8096.49932916161 | Q21: =(RC[-1]-R[-1]C[-1])/R[-1]C[-1] -> -0.0302514120295174 | R21: 17 | S21: =RATE(RC[-1], 0, -R4C[-6], RC[-6]) -> #NUM! | T21: 6 | U21: =RATE(RC[-1], 0, -R15C[-8], RC[-8]) -> #NUM! | V21: 17 | W21: =RATE(RC[-1], 0, -R4C[-7], RC[-7]) -> #NUM! | X21: 6 | Y21: =RATE(RC[-1], 0, -R15C[-9], RC[-9]) -> #NUM!
A22: =1+R[-1]C -> 1998 | B22: '(3) | C22: 684.758187 | D22: '(7c) | E22: =RC[-2]/9*8 -> 608.673944 | G22: 86.162 | H22: '(10) | I22: =RC[-4]/RC[-2]*1000 -> 7064.29683619229 | K22: =AppendixPriceIndex!R[+58]C[-3] -> 2715.52695233885 | M22: =RC[-4]/RC[-2]*R23C[-2] -> 7202.42686626402 | N22: =(RC[-1]-R[-1]C[-1])/R[-1]C[-1] -> -0.0364325235797073 | O22: 3200 | P22: =RC[-13]/RC[-9]/RC[-1]*R23C[-1]*1000 -> 7937.39977329043 | Q22: =(RC[-1]-R[-1]C[-1])/R[-1]C[-1] -> -0.01965041302457 | R22: 18 | S22: =RATE(RC[-1], 0, -R4C[-6], RC[-6]) -> #NUM! | T22: 7 | U22: =RATE(RC[-1], 0, -R15C[-8], RC[-8]) -> #NUM! | V22: 18 | W22: =RATE(RC[-1], 0, -R4C[-7], RC[-7]) -> #NUM! | X22: 7 | Y22: =RATE(RC[-1], 0, -R15C[-9], RC[-9]) -> #NUM!
A23: =1+R[-1]C -> 1999 | B23: '(3) | C23: 693.247519 | D23: '(7c) | E23: =RC[-2]/9*8 -> 616.220016888889 | G23: 89.115 | H23: '(7c) | I23: =RC[-4]/RC[-2]*1000 -> 6914.88545013622 | K23: =AppendixPriceIndex!R[+61]C[-3] -> 2768.62435584339 | M23: =RC[-4]/RC[-2]*R23C[-2] -> 6914.88545013622 | N23: =(RC[-1]-R[-1]C[-1])/R[-1]C[-1] -> -0.039922851209311 | O23: 3196 | P23: =RC[-13]/RC[-9]/RC[-1]*R23C[-1]*1000 -> 7779.24613140324 | Q23: =(RC[-1]-R[-1]C[-1])/R[-1]C[-1] -> -0.019925119863482 | R23: 19 | S23: =RATE(RC[-1], 0, -R4C[-6], RC[-6]) -> #NUM! | T23: 8 | U23: =RATE(RC[-1], 0, -R15C[-8], RC[-8]) -> #NUM! | V23: 19 | W23: =RATE(RC[-1], 0, -R4C[-7], RC[-7]) -> #NUM! | X23: 8 | Y23: =RATE(RC[-1], 0, -R15C[-9], RC[-9]) -> #NUM!
A24: 'Changes
A25: 'Ann avg 1980 - 1990 | C25: =RATE(COUNTIF(@SDF!R[-16]C[+1], R[-21]C:R[-11]C)-1, 0, -R[-21]C, R[-11]C) -> #NUM! | E25: =RATE(COUNTIF(@SDF!R9C4, R[-21]C:R[-11]C)-1, 0, -R[-21]C, R[-11]C) -> #NUM! | G25: =RATE(COUNTIF(@SDF!R9C4, R[-21]C:R[-11]C)-1, 0, -R[-21]C, R[-11]C) -> #NUM! | I25: =RATE(COUNTIF(@SDF!R9C4, R[-21]C:R[-11]C)-1, 0, -R[-21]C, R[-11]C) -> #NUM! | K25: =RATE(COUNTIF(@SDF!R9C4, R[-21]C:R[-11]C)-1, 0, -R[-21]C, R[-11]C) -> #NUM! | M25: =RATE(COUNTIF(@SDF!R9C4, R[-21]C:R[-11]C)-1, 0, -R[-21]C, R[-11]C) -> #NUM! | O25: =RATE(COUNTIF(@SDF!R9C4, R[-21]C:R[-11]C)-1, 0, -R[-21]C, R[-11]C) -> #NUM! | P25: =RATE(COUNTIF(@SDF!R9C4, R[-21]C:R[-11]C)-1, 0, -R[-21]C, R[-11]C) -> #NUM!
A26: '1980 - 1999 | C26: =(R[-3]C-R[-22]C)/R[-22]C -> 3.72368165031344 | E26: =(R[-3]C-R[-22]C)/R[-22]C -> 3.19882813361194 | G26: =(R[-3]C-R[-22]C)/R[-22]C -> 1.35461199038233 | I26: =(R[-3]C-R[-22]C)/R[-22]C -> 0.78323568841173 | K26: =(R[-3]C-R[-22]C)/R[-22]C -> 1.76862435584339 | M26: =(R[-3]C-R[-22]C)/R[-22]C -> -0.355912735272998 | O26: =(R[-3]C-R[-22]C)/R[-22]C -> 2.196 | P26: =(R[-3]C-R[-22]C)/R[-22]C -> -0.372296574010264
A27: 'Ann avg 1980 - 1999 | C27: =RATE(COUNTIF(@SDF!R[-18]C[+1], R[-23]C:R[-4]C)-1, 0, -R[-23]C, R[-4]C) -> #NUM! | E27: =RATE(COUNTIF(@SDF!R9C4, R[-23]C:R[-4]C)-1, 0, -R[-23]C, R[-4]C) -> #NUM! | G27: =RATE(COUNTIF(@SDF!R9C4, R[-23]C:R[-4]C)-1, 0, -R[-23]C, R[-4]C) -> #NUM! | I27: =RATE(COUNTIF(@SDF!R9C4, R[-23]C:R[-4]C)-1, 0, -R[-23]C, R[-4]C) -> #NUM! | K27: =RATE(COUNTIF(@SDF!R9C4, R[-23]C:R[-4]C)-1, 0, -R[-23]C, R[-4]C) -> #NUM! | M27: =RATE(COUNTIF(@SDF!R9C4, R[-23]C:R[-4]C)-1, 0, -R[-23]C, R[-4]C) -> #NUM! | O27: =RATE(COUNTIF(@SDF!R9C4, R[-23]C:R[-4]C)-1, 0, -R[-23]C, R[-4]C) -> #NUM! | P27: =RATE(COUNTIF(@SDF!R9C4, R[-23]C:R[-4]C)-1, 0, -R[-23]C, R[-4]C) -> #NUM!
A28: 'Ann avg 1995 - 1999 | C28: =RATE(COUNTIF(@SDF!R9C4, R[-9]C:R[-5]C)-1, 0, -R[-9]C, R[-5]C) -> #NUM! | E28: =RATE(COUNTIF(@SDF!R9C4, R[-9]C:R[-5]C)-1, 0, -R[-9]C, R[-5]C) -> #NUM! | G28: =RATE(COUNTIF(@SDF!R9C4, R[-9]C:R[-5]C)-1, 0, -R[-9]C, R[-5]C) -> #NUM! | I28: =RATE(COUNTIF(@SDF!R9C4, R[-9]C:R[-5]C)-1, 0, -R[-9]C, R[-5]C) -> #NUM! | K28: =RATE(COUNTIF(@SDF!R9C4, R[-9]C:R[-5]C)-1, 0, -R[-9]C, R[-5]C) -> #NUM! | M28: =RATE(COUNTIF(@SDF!R9C4, R[-9]C:R[-5]C)-1, 0, -R[-9]C, R[-5]C) -> #NUM! | O28: =RATE(COUNTIF(@SDF!R9C4, R[-9]C:R[-5]C)-1, 0, -R[-9]C, R[-5]C) -> #NUM! | P28: =RATE(COUNTIF(@SDF!R9C4, R[-9]C:R[-5]C)-1, 0, -R[-9]C, R[-5]C) -> #NUM!
A29: 'Ann avg 1991 - 1999 | C29: =RATE(COUNTIF(@SDF!R9C4, R[-14]C:R[-6]C)-1, 0, -R[-14]C, R[-6]C) -> #NUM! | E29: =RATE(COUNTIF(@SDF!R9C4, R[-14]C:R[-6]C)-1, 0, -R[-14]C, R[-6]C) -> #NUM! | G29: =RATE(COUNTIF(@SDF!R9C4, R[-14]C:R[-6]C)-1, 0, -R[-14]C, R[-6]C) -> #NUM! | I29: =RATE(COUNTIF(@SDF!R9C4, R[-14]C:R[-6]C)-1, 0, -R[-14]C, R[-6]C) -> #NUM! | K29: =RATE(COUNTIF(@SDF!R9C4, R[-14]C:R[-6]C)-1, 0, -R[-14]C, R[-6]C) -> #NUM! | M29: =RATE(COUNTIF(@SDF!R9C4, R[-14]C:R[-6]C)-1, 0, -R[-14]C, R[-6]C) -> #NUM! | O29: =RATE(COUNTIF(@SDF!R9C4, R[-14]C:R[-6]C)-1, 0, -R[-14]C, R[-6]C) -> #NUM! | P29: =RATE(COUNTIF(@SDF!R9C4, R[-14]C:R[-6]C)-1, 0, -R[-14]C, R[-6]C) -> #NUM!
A30: 'Notes
A31: '1) Actual equivalent full time students (government funded and unfunded).
A32: '2) Deflators: UPI reflects wages and non-labour input unit costs facing universities; CPI reflects prices facing the average household.
A33: '3) EFTS funding system in operation
A34: '4) Calendar years 1980 - 1987 expenditure = weighted mean of relevant years ending March, for example, calendar 1980 = 1979/80 @ 0.25 plus 1980/81 @ 0.75
A35: '5) Operations of universities, operating funding. Estimates of the expenditure of the government of New Zealand.
A36: '6) Deloitte Ross Tohmatsu. Appendix to the report to the Taskforce on PSET Institutional Costing: Cost analysis of institutions & modeling of bulk funding proposals - Stage 2 (1989 data analysis). April1990.
A37: '7) Ministry of Education, Tertiary Charters and Funding Section.
A38: '7a) ... (1990). Spreadsheet. EFTS enrolments in tertiary institutions: 1980 - 1990.
A39: '7b) ... (1993). Spreadsheet: EFTS funding for universities 1990 - 1993.
A40: '7c) & (2000). Spreadsheet. Universities bulk and wholly research EFTS funding (GST inclusive) 1991 - 1999.
A41: '8) GST of 10% introduced 1 October 1986 GST. Rate for the calendar year 1986 = 9 months @ 0% and 3 months @ 10% = 2.5%
A42: '9) GST increased to 12.5% 1 July 1989. Rate for calendar year 1989 = 6 months @ 10% and 6 months @ 12.5% = 11.25%
A43: '10) Education Statistics News Sheet. 1999; 9 (2): 3
A44: 'Because of rounding individual items may not add exactly to the totals shown

Sheet: Table2
A1: 'Table 2: Real funding per EFTS, staff ratios and the proportion of university operating revenue derived from different sources
A2: 'Calendar year | B2: 'Deflated revenue exclusive of GST per EFTS in 1999 $ | C2: 'Proportion of operating revenue from | D2: 'Ratio of total EFTS per staff member
F3: 3 | G3: 3
F4: 'Ministry or Education EFTS funding % | G4: 'Fees % | H4: 'Other % | I4: 'Academic staff | J4: 'General staff | K4: 'All staff
A5: 1980 | B5: =Table1!R[-1]C[+11] -> 10735.9450012835 | C5: 'NA | D5: 'NA | E5: 'NA | F5: 'NA | G5: 'NA | H5: 'NA | I5: 12.4825440718977 | J5: 'NA | K5: 'NA
A6: =1+R[-1]C -> 1981 | B6: =Table1!R[-1]C[+11] -> 10466.2839548214 | C6: 'NA | D6: 'NA | E6: 'NA | F6: 'NA | G6: 'NA | H6: 'NA | I6: 12.3452100840336 | J6: 'NA | K6: 'NA
A7: =1+R[-1]C -> 1982 | B7: =Table1!R[-1]C[+11] -> 10221.2279060872 | C7: 'NA | D7: 'NA | E7: 'NA | F7: 'NA | G7: 'NA | H7: 'NA | I7: 12.7110675808031 | J7: 'NA | K7: 'NA
A8: =1+R[-1]C -> 1983 | B8: =Table1!R[-1]C[+11] -> 10141.7777562872 | C8: 'NA | D8: 'NA | E8: 'NA | F8: 'NA | G8: 'NA | H8: 'NA | I8: 13.3871287128713 | J8: 'NA | K8: 'NA
A9: =1+R[-1]C -> 1984 | B9: =Table1!R[-1]C[+11] -> 10022.7434833512 | C9: 'NA | D9: 'NA | E9: 'NA | F9: 'NA | G9: 'NA | H9: 'NA | I9: 13.7996683250415 | J9: 'NA | K9: 'NA
A10: =1+R[-1]C -> 1985 | B10: =Table1!R[-1]C[+11] -> 11098.7308841114 | C10: 'NA | D10: 'NA | E10: 'NA | F10: 'NA | G10: 'NA | H10: 'NA | I10: 13.3224992111076 | J10: 'NA | K10: 'NA
A11: =1+R[-1]C -> 1986 | B11: =Table1!R[-1]C[+11] -> 10762.7105892658 | C11: 'NA | D11: 'NA | E11: 'NA | F11: 'NA | G11: 'NA | H11: 'NA | I11: 13.5235878336437 | J11: 'NA | K11: 'NA
A12: =1+R[-1]C -> 1987 | B12: =Table1!R[-1]C[+11] -> 10513.884619563 | C12: 'NA | D12: 'NA | E12: 'NA | F12: 'NA | G12: 'NA | H12: 'NA | I12: 14.075494859598 | J12: 'NA | K12: 'NA
A13: =1+R[-1]C -> 1988 | B13: =Table1!R[-1]C[+11] -> 10405.102149964 | C13: 'NA | D13: 'NA | E13: 'NA | F13: 'NA | G13: 'NA | H13: 'NA | I13: 15.7147192716237 | J13: 'NA | K13: 'NA
A14: =1+R[-1]C -> 1989 | B14: =Table1!R[-1]C[+11] -> 9779.7258613766 | C14: 'NA | D14: 'NA | E14: 'NA | F14: 'NA | G14: 'NA | H14: 'NA | I14: 15.7124345188861 | J14: 'NA | K14: 'NA
A15: =1+R[-1]C -> 1990 | B15: =Table1!R[-1]C[+11] -> 9213.13406755707 | C15: 'NA | D15: 'NA | E15: 'NA | F15: 'NA | G15: 'NA | H15: 'NA | I15: 16.1597979260835 | J15: 13.12734891356 | K15: 7.24329027029604
A16: =1+R[-1]C -> 1991 | B16: =Table1!R[-1]C[+11] -> 8707.30246581053 | C16: =RC[+2]*RC[+4] -> 1621.28292482856 | D16: =RC[+1]*RC[+4] -> 1529.69036443908 | E16: =RC[-3]/RC[+1] -> 11858.2757550782 | F16: 0.734280653077386 | G16: 0.136721641351127 | H16: =1-RC[-1]-RC[-2] -> 0.128997705571487 | I16: 17.9659802568729 | J16: 14.765550030533 | K16: 8.10503759038452
A17: =1+R[-1]C -> 1992 | B17: =Table1!R[-1]C[+11] -> 8990.56665259905 | C17: =RC[+2]*RC[+4] -> 1400.98245255143 | D17: =RC[+1]*RC[+4] -> 1474.93279669222 | E17: =RC[-3]/RC[+1] -> 11866.4819018427 | F17: 0.757643817853288 | G17: 0.118062157271219 | H17: =1-RC[-1]-RC[-2] -> 0.124294024875493 | I17: 18.4123652570481 | J17: 15.2571232259034 | K17: 8.3427652280092
A18: =1+R[-1]C -> 1993 | B18: =Table1!R[-1]C[+11] -> 8677.59504646434 | C18: =RC[+2]*RC[+4] -> 1833.42220202908 | D18: =RC[+1]*RC[+4] -> 1823.14642503457 | E18: =RC[-3]/RC[+1] -> 12334.163673528 | F18: 0.703541421708916 | G18: 0.148645846654689 | H18: =1-RC[-1]-RC[-2] -> 0.147812731636395 | I18: 18.5610137978276 | J18: 15.6536271354296 | K18: 8.49151631821641
A19: =1+R[-1]C -> 1994 | B19: =Table1!R[-1]C[+11] -> 8317.79351269438 | C19: =RC[+2]*RC[+4] -> 2245.00468609992 | D19: =RC[+1]*RC[+4] -> 2484.1251885597 | E19: =RC[-3]/RC[+1] -> 13046.923387354 | F19: 0.637529114393097 | G19: 0.172071577294302 | H19: =1-RC[-1]-RC[-2] -> 0.190399308312601 | I19: 18.0855983496928 | J19: 12.4589677520106 | K19: 7.37722502196126
A20: =1+R[-1]C -> 1995 | B20: =Table1!R[-1]C[+11] -> 8192.71667319206 | C20: =RC[+2]*RC[+4] -> 2475.76170576213 | D20: =RC[+1]*RC[+4] -> 3260.85557121368 | E20: =RC[-3]/RC[+1] -> 13929.3339501679 | F20: 0.588162844146136 | G20: 0.177737264008398 | H20: =1-RC[-1]-RC[-2] -> 0.234099891845466 | I20: 17.8726850371886 | J20: 12.3998639717298 | K20: 7.3209780625562
A21: =1+R[-1]C -> 1996 | B21: =Table1!R[-1]C[+11] -> 7887.93176593993 | C21: =RC[+2]*RC[+4] -> 2807.31383281752 | D21: =RC[+1]*RC[+4] -> 2099.17840331631 | E21: =RC[-3]/RC[+1] -> 12794.4240020738 | F21: 0.616513237693344 | G21: 0.219416976673784 | H21: =1-RC[-1]-RC[-2] -> 0.164069785632872 | I21: 17.9106305259225 | J21: 12.4150481945044 | K21: 7.33256861245645
A22: =1+R[-1]C -> 1997 | B22: =Table1!R[-1]C[+11] -> 7474.75090485768 | C22: =RC[+2]*RC[+4] -> 3052.07621003458 | D22: =RC[+1]*RC[+4] -> 3874.95725162868 | E22: =RC[-3]/RC[+1] -> 14401.7843665209 | F22: 0.51901561047073 | G22: 0.211923476449875 | H22: =1-RC[-1]-RC[-2] -> 0.269060913079395 | I22: 18.5013663166978 | J22: 12.6905026988176 | K22: 7.52739766106314
A23: =1+R[-1]C -> 1998 | B23: =Table1!R[-1]C[+11] -> 7202.42686626402 | C23: =RC[+2]*RC[+4] -> 3116.1654112585 | D23: =RC[+1]*RC[+4] -> 4200.67861598951 | E23: =RC[-3]/RC[+1] -> 14519.270893512 | F23: 0.49605981726551 | G23: 0.214622719977693 | H23: =1-RC[-1]-RC[-2] -> 0.289317462756797 | I23: 18.4346724574738 | J23: 12.1613232699731 | K23: 7.32742980906788
A24: =1+R[-1]C -> 1999 | B24: =Table1!R[-1]C[+11] -> 6914.88545013622
A25: 'Change 1980 to 1998 | B25: =R[-2]C-R[-20]C -> -3533.51813501948 | I25: =R[-2]C-R[-20]C -> 5.9521283855761
B26: =(R[-3]C-R[-21]C)/R[-21]C -> -0.329129679278074 | I26: =R[-1]C/R[-21]C -> 0.4768361602645
A27: 'Change 1991 to 1998 | B27: =R[-4]C-R[-11]C -> -1504.87559954651 | C27: =R[-4]C-R[-11]C -> 1494.88248642994 | D27: =R[-4]C-R[-11]C -> 2670.98825155044 | E27: =R[-4]C-R[-11]C -> 2660.99513843387 | F27: =R[-4]C*100-R[-11]C*100 -> -23.8220835811876 | G27: =R[-4]C*100-R[-11]C*100 -> 7.7901078626566 | H27: =R[-4]C*100-R[-11]C*100 -> 16.031975718531 | I27: =R[-4]C-R[-11]C -> 0.468692200600898 | J27: =R[-4]C-R[-11]C -> -2.6042267605599 | K27: =R[-4]C-R[-11]C -> -0.77760778131664
B28: =R[-1]C/R[-12]C -> -0.172829140305559 | C28: =R[-1]C/R[-12]C -> 0.922036779353618 | D28: =R[-1]C/R[-12]C -> 1.74609732377432 | E28: =R[-1]C/R[-12]C -> 0.224399836316366
A29: 'Notes
A30: '1) Table 1
A31: '2) Calculated from the deflated Ministry of Education funding per EFTS and the proportion of operating revenue from each source
A32: '3) New Zealand Vice-Chancellors' Committee Statistical Collection 1999
A33: 'Because of rounding individual items may not add exactly to the totals shown

Sheet: Table3OECD
A1: 'Table 3: OECD COUNTRIES: Expenditure (public and private) per student at universities in US$ and purchasing power parities (ppp)
A2: 'Country
A3: 'Australia | B3: 19519 | C3: 11572
A4: 'Austria | B4: 20612 | C4: 7687
A5: 'Canada | B5: 20991 | C5: 12217
A6: 'Czech Republic | B6: 10313 | C6: 7656
A7: 'Finland | B7: 17921 | C7: 7412
A8: 'Germany | B8: 20509 | C8: 9001
A9: 'Greece | B9: 12173 | C9: 3169
A10: 'Hungary | B10: 6845 | C10: 4792
A11: 'Italy | B11: 19460 | C11: 4932
A12: 'Japan | B12: 21916 | C12: 9337
A13: 'Korea | B13: 12518 | C13: 5733
A14: 'Mexico | B14: 7366 | C14: 5071
A15: 'Netherlands | B15: 19874 | C15: 9026
A16: 'New Zealand | B16: 16962 | C16: 8380
A17: 'Spain | B17: 14317 | C17: 4966
A18: 'Switzerland | B18: 24983 | C18: 18365
A19: 'United States | B19: 26711 | C19: 19965
A20: 'Mean (unweighted) | B20: =AVERAGE(R[-17]C:R[-1]C) -> 17234.7058823529 | C20: =AVERAGE(R[-17]C:R[-1]C) -> 8781.23529411765
A21: 'Notes
A22: 'OECD. (1998). Education at a glance OECD indicators 1998. OECD: Paris.
A23: '1) OECD Table X2.1 p373
A24: '2) OECCD Table B4.1 p118
A25: 'The expenditure may not be exactly comparable for all countries
A26: 'Because of rounding individual items may not add exactly to the totals shown
A27: 'Germany (FTFR) | B27: 8101

Sheet: AppendixPriceIndex
A1: 'Appendix: University price index
A2: 'Quarter | D2: 'University cost = weighted mean
B3: 'Quarterly index | D3: 'Quarterly index | F3: 'Quarterly index | G3: 'Annual average index | H3: 'Annual average index | I3: 'Annual change
B4: 'Index base: Mar-80 quarter = 1000 | C4: 'Index base: 1980 = 1000
A5: 29281 | B5: =INFOSWages!R[+9]C[+4] -> 1000 | C5: 0.87 | D5: =INFOSinputs!R[+8]C[+3] -> 1000 | E5: 0.13 | F5: =RC[-4]*RC[-3]+RC[-2]*RC[-1] -> 1000
A6: 29373 | B6: =INFOSWages!R[+9]C[+4] -> 1000 | C6: 0.87 | D6: =INFOSinputs!R[+8]C[+3] -> 1059.6546310832 | E6: 0.13 | F6: =RC[-4]*RC[-3]+RC[-2]*RC[-1] -> 1007.75510204082
A7: 29465 | B7: =INFOSWages!R[+9]C[+4] -> 1039.04923599321 | C7: 0.87 | D7: =INFOSinputs!R[+8]C[+3] -> 1109.89010989011 | E7: 0.13 | F7: =RC[-4]*RC[-3]+RC[-2]*RC[-1] -> 1048.25854959981
A8: 29556 | B8: =INFOSWages!R[+9]C[+4] -> 1200.33955857385 | C8: 0.87 | D8: =INFOSinputs!R[+8]C[+3] -> 1167.9748822606 | E8: 0.13 | F8: =RC[-4]*RC[-3]+RC[-2]*RC[-1] -> 1196.13215065313 | G8: =SUM(R[-3]C[-1]:RC[-1])/4 -> 1063.03645057344 | H8: =RC[-1]/R8C[-1]*1000 -> 1000
A9: 29646 | B9: =INFOSWages!R[+9]C[+4] -> 1203.73514431239 | C9: 0.87 | D9: =INFOSinputs!R[+8]C[+3] -> 1210.36106750392 | E9: 0.13 | F9: =RC[-4]*RC[-3]+RC[-2]*RC[-1] -> 1204.59651432729 | G9: =SUM(R[-3]C[-1]:RC[-1])/4 -> 1114.18557915526 | H9: =RC[-1]/R8C[-1]*1000 -> 1048.11606276928
A10: 29738 | B10: =INFOSWages!R[+9]C[+4] -> 1203.73514431239 | C10: 0.87 | D10: =INFOSinputs!R[+8]C[+3] -> 1279.43485086342 | E10: 0.13 | F10: =RC[-4]*RC[-3]+RC[-2]*RC[-1] -> 1213.57610616403 | G10: =SUM(R[-3]C[-1]:RC[-1])/4 -> 1165.64083018606 | H10: =RC[-1]/R8C[-1]*1000 -> 1096.52009539022
A11: 29830 | B11: =INFOSWages!R[+9]C[+4] -> 1263.15789473684 | C11: 0.87 | D11: =INFOSinputs!R[+8]C[+3] -> 1345.36891679749 | E11: 0.13 | F11: =RC[-4]*RC[-3]+RC[-2]*RC[-1] -> 1273.84532760473 | G11: =SUM(R[-3]C[-1]:RC[-1])/4 -> 1222.03752468729 | H11: =RC[-1]/R8C[-1]*1000 -> 1149.57255137214
A12: 29921 | B12: =INFOSWages!R[+9]C[+4] -> 1407.47028862479 | C12: 0.87 | D12: =INFOSinputs!R[+8]C[+3] -> 1381.47566718995 | E12: 0.13 | F12: =RC[-4]*RC[-3]+RC[-2]*RC[-1] -> 1404.09098783826 | G12: =SUM(R[-3]C[-1]:RC[-1])/4 -> 1274.02723398358 | H12: =RC[-1]/R8C[-1]*1000 -> 1198.47934969335 | I12: =(RC[-1]-R[-4]C[-1])/R[-4]C[-1] -> 0.198479349693346
A13: 30011 | B13: =INFOSWages!R[+9]C[+4] -> 1410.86587436333 | C13: 0.87 | D13: =INFOSinputs!R[+8]C[+3] -> 1447.40973312402 | E13: 0.13 | F13: =RC[-4]*RC[-3]+RC[-2]*RC[-1] -> 1415.61657600222 | G13: =SUM(R[-3]C[-1]:RC[-1])/4 -> 1326.78224940231 | H13: =RC[-1]/R8C[-1]*1000 -> 1248.10607264369 | I13: =(RC[-1]-R[-4]C[-1])/R[-4]C[-1] -> 0.190809030581988
A14: 30103 | B14: =INFOSWages!R[+9]C[+4] -> 1410.86587436333 | C14: 0.87 | D14: =INFOSinputs!R[+8]C[+3] -> 1516.48351648352 | E14: 0.13 | F14: =RC[-4]*RC[-3]+RC[-2]*RC[-1] -> 1424.59616783895 | G14: =SUM(R[-3]C[-1]:RC[-1])/4 -> 1379.53726482104 | H14: =RC[-1]/R8C[-1]*1000 -> 1297.73279559404 | I14: =(RC[-1]-R[-4]C[-1])/R[-4]C[-1] -> 0.18350115155183
A15: 30195 | B15: =INFOSWages!R[+9]C[+4] -> 1410.86587436333 | C15: 0.87 | D15: =INFOSinputs!R[+8]C[+3] -> 1552.59026687598 | E15: 0.13 | F15: =RC[-4]*RC[-3]+RC[-2]*RC[-1] -> 1429.29004538997 | G15: =SUM(R[-3]C[-1]:RC[-1])/4 -> 1418.39844426735 | H15: =RC[-1]/R8C[-1]*1000 -> 1334.28956599016 | I15: =(RC[-1]-R[-4]C[-1])/R[-4]C[-1] -> 0.160683216033241
A16: 30286 | B16: =INFOSWages!R[+9]C[+4] -> 1410.86587436333 | C16: 0.87 | D16: =INFOSinputs!R[+8]C[+3] -> 1569.85871271586 | E16: 0.13 | F16: =RC[-4]*RC[-3]+RC[-2]*RC[-1] -> 1431.53494334916 | G16: =SUM(R[-3]C[-1]:RC[-1])/4 -> 1425.25943314507 | H16: =RC[-1]/R8C[-1]*1000 -> 1340.7437086247 | I16: =(RC[-1]-R[-4]C[-1])/R[-4]C[-1] -> 0.118704055241136
A17: 30376 | B17: =INFOSWages!R[+9]C[+4] -> 1410.86587436333 | C17: 0.87 | D17: =INFOSinputs!R[+8]C[+3] -> 1577.70800627944 | E17: 0.13 | F17: =RC[-4]*RC[-3]+RC[-2]*RC[-1] -> 1432.55535151242 | G17: =SUM(R[-3]C[-1]:RC[-1])/4 -> 1429.49412702263 | H17: =RC[-1]/R8C[-1]*1000 -> 1344.72729157265 | I17: =(RC[-1]-R[-4]C[-1])/R[-4]C[-1] -> 0.0774142687442406
A18: 30468 | B18: =INFOSWages!R[+9]C[+4] -> 1410.86587436333 | C18: 0.87 | D18: =INFOSinputs!R[+8]C[+3] -> 1593.40659340659 | E18: 0.13 | F18: =RC[-4]*RC[-3]+RC[-2]*RC[-1] -> 1434.59616783895 | G18: =SUM(R[-3]C[-1]:RC[-1])/4 -> 1431.99412702263 | H18: =RC[-1]/R8C[-1]*1000 -> 1347.0790453612 | I18: =(RC[-1]-R[-4]C[-1])/R[-4]C[-1] -> 0.0380249693424497
A19: 30560 | B19: =INFOSWages!R[+9]C[+4] -> 1410.86587436333 | C19: 0.87 | D19: =INFOSinputs!R[+8]C[+3] -> 1604.3956043956 | E19: 0.13 | F19: =RC[-4]*RC[-3]+RC[-2]*RC[-1] -> 1436.02473926752 | G19: =SUM(R[-3]C[-1]:RC[-1])/4 -> 1433.67780049201 | H19: =RC[-1]/R8C[-1]*1000 -> 1348.66287954532 | I19: =(RC[-1]-R[-4]C[-1])/R[-4]C[-1] -> 0.0107722595765785
A20: 30651 | B20: =INFOSWages!R[+9]C[+4] -> 1410.86587436333 | C20: 0.87 | D20: =INFOSinputs!R[+8]C[+3] -> 1612.24489795918 | E20: 0.13 | F20: =RC[-4]*RC[-3]+RC[-2]*RC[-1] -> 1437.04514743079 | G20: =SUM(R[-3]C[-1]:RC[-1])/4 -> 1435.05535151242 | H20: =RC[-1]/R8C[-1]*1000 -> 1349.95874387779 | I20: =(RC[-1]-R[-4]C[-1])/R[-4]C[-1] -> 0.00687307737773087
A21: 30742 | B21: =INFOSWages!R[+9]C[+4] -> 1410.86587436333 | C21: 0.87 | D21: =INFOSinputs!R[+8]C[+3] -> 1626.37362637363 | E21: 0.13 | F21: =RC[-4]*RC[-3]+RC[-2]*RC[-1] -> 1438.88188212467 | G21: =SUM(R[-3]C[-1]:RC[-1])/4 -> 1436.63698416548 | H21: =RC[-1]/R8C[-1]*1000 -> 1351.44658811136 | I21: =(RC[-1]-R[-4]C[-1])/R[-4]C[-1] -> 0.00499677263993688
A22: 30834 | B22: =INFOSWages!R[+9]C[+4] -> 1441.42614601019 | C22: 0.87 | D22: =INFOSinputs!R[+8]C[+3] -> 1668.75981161695 | E22: 0.13 | F22: =RC[-4]*RC[-3]+RC[-2]*RC[-1] -> 1470.97952253907 | G22: =SUM(R[-3]C[-1]:RC[-1])/4 -> 1445.73282284051 | H22: =RC[-1]/R8C[-1]*1000 -> 1360.00305733696 | I22: =(RC[-1]-R[-4]C[-1])/R[-4]C[-1] -> 0.00959410067305997
A23: 30926 | B23: =INFOSWages!R[+9]C[+4] -> 1441.42614601019 | C23: 0.87 | D23: =INFOSinputs!R[+8]C[+3] -> 1748.82260596546 | E23: 0.13 | F23: =RC[-4]*RC[-3]+RC[-2]*RC[-1] -> 1481.38768580437 | G23: =SUM(R[-3]C[-1]:RC[-1])/4 -> 1457.07355947472 | H23: =RC[-1]/R8C[-1]*1000 -> 1370.67130547474 | I23: =(RC[-1]-R[-4]C[-1])/R[-4]C[-1] -> 0.0163187007392325
A24: 31017 | B24: =INFOSWages!R[+9]C[+4] -> 1441.42614601019 | C24: 0.87 | D24: =INFOSinputs!R[+8]C[+3] -> 1786.49921507064 | E24: 0.13 | F24: =RC[-4]*RC[-3]+RC[-2]*RC[-1] -> 1486.28564498805 | G24: =SUM(R[-3]C[-1]:RC[-1])/4 -> 1469.38368386404 | H24: =RC[-1]/R8C[-1]*1000 -> 1382.25145814276 | I24: =(RC[-1]-R[-4]C[-1])/R[-4]C[-1] -> 0.0239212601210382
A25: 31107 | B25: =INFOSWages!R[+9]C[+4] -> 1539.89813242784 | C25: 0.87 | D25: =INFOSinputs!R[+8]C[+3] -> 1847.72370486656 | E25: 0.13 | F25: =RC[-4]*RC[-3]+RC[-2]*RC[-1] -> 1579.91545684488 | G25: =SUM(R[-3]C[-1]:RC[-1])/4 -> 1504.64207754409 | H25: =RC[-1]/R8C[-1]*1000 -> 1415.41908250882 | I25: =(RC[-1]-R[-4]C[-1])/R[-4]C[-1] -> 0.0473363098181067
A26: 31199 | B26: =INFOSWages!R[+9]C[+4] -> 1567.06281833616 | C26: 0.87 | D26: =INFOSinputs!R[+8]C[+3] -> 1945.05494505494 | E26: 0.13 | F26: =RC[-4]*RC[-3]+RC[-2]*RC[-1] -> 1616.2017948096 | G26: =SUM(R[-3]C[-1]:RC[-1])/4 -> 1540.94764561172 | H26: =RC[-1]/R8C[-1]*1000 -> 1449.57178540819 | I26: =(RC[-1]-R[-4]C[-1])/R[-4]C[-1] -> 0.0658592108216371
A27: 31291 | B27: =INFOSWages!R[+9]C[+4] -> 1567.06281833616 | C27: 0.87 | D27: =INFOSinputs!R[+8]C[+3] -> 1984.30141287284 | E27: 0.13 | F27: =RC[-4]*RC[-3]+RC[-2]*RC[-1] -> 1621.30383562593 | G27: =SUM(R[-3]C[-1]:RC[-1])/4 -> 1575.92668306711 | H27: =RC[-1]/R8C[-1]*1000 -> 1482.47661895037 | I27: =(RC[-1]-R[-4]C[-1])/R[-4]C[-1] -> 0.081569748362765
A28: 31382 | B28: =INFOSWages!R[+9]C[+4] -> 1697.79286926995 | C28: 0.87 | D28: =INFOSinputs!R[+8]C[+3] -> 2006.27943485086 | E28: 0.13 | F28: =RC[-4]*RC[-3]+RC[-2]*RC[-1] -> 1737.89612279547 | G28: =SUM(R[-3]C[-1]:RC[-1])/4 -> 1638.82930251897 | H28: =RC[-1]/R8C[-1]*1000 -> 1541.64920839255 | I28: =(RC[-1]-R[-4]C[-1])/R[-4]C[-1] -> 0.115317476650715
A29: 31472 | B29: =INFOSWages!R[+9]C[+4] -> 1767.40237691002 | C29: 0.87 | D29: =INFOSinputs!R[+8]C[+3] -> 2065.93406593407 | E29: 0.13 | F29: =RC[-4]*RC[-3]+RC[-2]*RC[-1] -> 1806.21149648314 | G29: =SUM(R[-3]C[-1]:RC[-1])/4 -> 1695.40331242854 | H29: =RC[-1]/R8C[-1]*1000 -> 1594.86846524781 | I29: =(RC[-1]-R[-4]C[-1])/R[-4]C[-1] -> 0.126781802617012
A30: 31564 | B30: =INFOSWages!R[+9]C[+4] -> 1857.38539898132 | C30: 0.87 | D30: =INFOSinputs!R[+8]C[+3] -> 2141.28728414443 | E30: 0.13 | F30: =RC[-4]*RC[-3]+RC[-2]*RC[-1] -> 1894.29264405253 | G30: =SUM(R[-3]C[-1]:RC[-1])/4 -> 1764.92602473927 | H30: =RC[-1]/R8C[-1]*1000 -> 1660.26858607455 | I30: =(RC[-1]-R[-4]C[-1])/R[-4]C[-1] -> 0.145351063525995
A31: 31656 | B31: =INFOSWages!R[+9]C[+4] -> 1950.76400679117 | C31: 0.87 | D31: =INFOSinputs!R[+8]C[+3] -> 2196.23233908948 | E31: 0.13 | F31: =RC[-4]*RC[-3]+RC[-2]*RC[-1] -> 1982.67488998995 | G31: =SUM(R[-3]C[-1]:RC[-1])/4 -> 1855.26878833027 | H31: =RC[-1]/R8C[-1]*1000 -> 1745.25416069174 | I31: =(RC[-1]-R[-4]C[-1])/R[-4]C[-1] -> 0.177255774817832
A32: 31747 | B32: =INFOSWages!R[+9]C[+4] -> 1954.15959252971 | C32: 0.87 | D32: =INFOSinputs!R[+8]C[+3] -> 2216.64050235479 | E32: 0.13 | F32: =RC[-4]*RC[-3]+RC[-2]*RC[-1] -> 1988.28211080697 | G32: =SUM(R[-3]C[-1]:RC[-1])/4 -> 1917.86528533315 | H32: =RC[-1]/R8C[-1]*1000 -> 1804.13878028226 | I32: =(RC[-1]-R[-4]C[-1])/R[-4]C[-1] -> 0.170265434225081
A33: 31837 | B33: =INFOSWages!R[+9]C[+4] -> 1954.15959252971 | C33: 0.87 | D33: =INFOSinputs!R[+8]C[+3] -> 2287.284144427 | E33: 0.13 | F33: =RC[-4]*RC[-3]+RC[-2]*RC[-1] -> 1997.46578427636 | G33: =SUM(R[-3]C[-1]:RC[-1])/4 -> 1965.67885728145 | H33: =RC[-1]/R8C[-1]*1000 -> 1849.11707987162 | I33: =(RC[-1]-R[-4]C[-1])/R[-4]C[-1] -> 0.159416666743305
A34: 31929 | B34: =INFOSWages!R[+9]C[+4] -> 2008.48896434635 | C34: 0.87 | D34: =INFOSinputs!R[+8]C[+3] -> 2324.96075353218 | E34: 0.13 | F34: =RC[-4]*RC[-3]+RC[-2]*RC[-1] -> 2049.63029694051 | G34: =SUM(R[-3]C[-1]:RC[-1])/4 -> 2004.51327050345 | H34: =RC[-1]/R8C[-1]*1000 -> 1885.64867123996 | I34: =(RC[-1]-R[-4]C[-1])/R[-4]C[-1] -> 0.13574917158331
A35: 32021 | B35: =INFOSWages!R[+9]C[+4] -> 2100.16977928693 | C35: 0.87 | D35: =INFOSinputs!R[+8]C[+3] -> 2350.07849293564 | E35: 0.13 | F35: =RC[-4]*RC[-3]+RC[-2]*RC[-1] -> 2132.65791206126 | G35: =SUM(R[-3]C[-1]:RC[-1])/4 -> 2042.00902602127 | H35: =RC[-1]/R8C[-1]*1000 -> 1920.92098527736 | I35: =(RC[-1]-R[-4]C[-1])/R[-4]C[-1] -> 0.10065400704502
A36: 32112 | B36: =INFOSWages!R[+9]C[+4] -> 2100.16977928693 | C36: 0.87 | D36: =INFOSinputs!R[+8]C[+3] -> 2379.90580847724 | E36: 0.13 | F36: =RC[-4]*RC[-3]+RC[-2]*RC[-1] -> 2136.53546308167 | G36: =SUM(R[-3]C[-1]:RC[-1])/4 -> 2079.07236408995 | H36: =RC[-1]/R8C[-1]*1000 -> 1955.78652356504 | I36: =(RC[-1]-R[-4]C[-1])/R[-4]C[-1] -> 0.0840554756320107
A37: 32203 | B37: =INFOSWages!R[+9]C[+4] -> 2115.44991511036 | C37: 0.87 | D37: =INFOSinputs!R[+8]C[+3] -> 2398.74411302983 | E37: 0.13 | F37: =RC[-4]*RC[-3]+RC[-2]*RC[-1] -> 2152.27816083989 | G37: =SUM(R[-3]C[-1]:RC[-1])/4 -> 2117.77545823083 | H37: =RC[-1]/R8C[-1]*1000 -> 1992.19458287477 | I37: =(RC[-1]-R[-4]C[-1])/R[-4]C[-1] -> 0.0773761188843071
A38: 32295 | B38: =INFOSWages!R[+9]C[+4] -> 2173.17487266553 | C38: 0.87 | D38: =INFOSinputs!R[+8]C[+3] -> 2422.29199372056 | E38: 0.13 | F38: =RC[-4]*RC[-3]+RC[-2]*RC[-1] -> 2205.56009840269 | G38: =SUM(R[-3]C[-1]:RC[-1])/4 -> 2156.75790859638 | H38: =RC[-1]/R8C[-1]*1000 -> 2028.86543300839 | I38: =(RC[-1]-R[-4]C[-1])/R[-4]C[-1] -> 0.0759509255105559
A39: 32387 | B39: =INFOSWages!R[+9]C[+4] -> 2256.36672325976 | C39: 0.87 | D39: =INFOSinputs!R[+8]C[+3] -> 2448.97959183673 | E39: 0.13 | F39: =RC[-4]*RC[-3]+RC[-2]*RC[-1] -> 2281.40639617477 | G39: =SUM(R[-3]C[-1]:RC[-1])/4 -> 2193.94502962475 | H39: =RC[-1]/R8C[-1]*1000 -> 2063.84741411385 | I39: =(RC[-1]-R[-4]C[-1])/R[-4]C[-1] -> 0.0744051576987966
A40: 32478 | B40: =INFOSWages!R[+9]C[+4] -> 2258.06451612903 | C40: 0.87 | D40: =INFOSinputs!R[+8]C[+3] -> 2467.81789638932 | E40: 0.13 | F40: =RC[-4]*RC[-3]+RC[-2]*RC[-1] -> 2285.33245556287 | G40: =SUM(R[-3]C[-1]:RC[-1])/4 -> 2231.14427774505 | H40: =RC[-1]/R8C[-1]*1000 -> 2098.84080319306 | I40: =(RC[-1]-R[-4]C[-1])/R[-4]C[-1] -> 0.0731441176756111
A41: 32568 | B41: =INFOSWages!R[+9]C[+4] -> 2259.7623089983 | C41: 0.87 | D41: =INFOSinputs!R[+8]C[+3] -> 2502.35478806907 | E41: 0.13 | F41: =RC[-4]*RC[-3]+RC[-2]*RC[-1] -> 2291.2993312775 | G41: =SUM(R[-3]C[-1]:RC[-1])/4 -> 2265.89957035446 | H41: =RC[-1]/R8C[-1]*1000 -> 2131.53515961955 | I41: =(RC[-1]-R[-4]C[-1])/R[-4]C[-1] -> 0.0699432565185018
A42: 32660 | B42: =INFOSWages!R[+9]C[+4] -> 2280.13582342954 | C42: 0.87 | D42: =INFOSinputs!R[+8]C[+3] -> 2525.90266875981 | E42: 0.13 | F42: =RC[-4]*RC[-3]+RC[-2]*RC[-1] -> 2312.08551332248 | G42: =SUM(R[-3]C[-1]:RC[-1])/4 -> 2292.5309240844 | H42: =RC[-1]/R8C[-1]*1000 -> 2156.58731443097 | I42: =(RC[-1]-R[-4]C[-1])/R[-4]C[-1] -> 0.0629523670444729
A43: 32752 | B43: =INFOSWages!R[+9]C[+4] -> 2298.81154499151 | C43: 0.87 | D43: =INFOSinputs!R[+8]C[+3] -> 2568.28885400314 | E43: 0.13 | F43: =RC[-4]*RC[-3]+RC[-2]*RC[-1] -> 2333.84359516302 | G43: =SUM(R[-3]C[-1]:RC[-1])/4 -> 2305.64022383147 | H43: =RC[-1]/R8C[-1]*1000 -> 2168.91925256912 | I43: =(RC[-1]-R[-4]C[-1])/R[-4]C[-1] -> 0.0509106621626788
A44: 32843 | B44: =INFOSWages!R[+9]C[+4] -> 2317.48726655348 | C44: 0.87 | D44: =INFOSinputs!R[+8]C[+3] -> 2591.83673469388 | E44: 0.13 | F44: =RC[-4]*RC[-3]+RC[-2]*RC[-1] -> 2353.15269741173 | G44: =SUM(R[-3]C[-1]:RC[-1])/4 -> 2322.59528429368 | H44: =RC[-1]/R8C[-1]*1000 -> 2184.86890363994 | I44: =(RC[-1]-R[-4]C[-1])/R[-4]C[-1] -> 0.0409883876452202
A45: 32933 | B45: =INFOSWages!R[+9]C[+4] -> 2337.86078098472 | C45: 0.87 | D45: =INFOSinputs!R[+8]C[+3] -> 2620.09419152276 | E45: 0.13 | F45: =RC[-4]*RC[-3]+RC[-2]*RC[-1] -> 2374.55112435467 | G45: =SUM(R[-3]C[-1]:RC[-1])/4 -> 2343.40823256297 | H45: =RC[-1]/R8C[-1]*1000 -> 2204.4476756172 | I45: =(RC[-1]-R[-4]C[-1])/R[-4]C[-1] -> 0.0342065743877567
A46: 33025 | B46: =INFOSWages!R[+9]C[+4] -> 2351.44312393888 | C46: 0.87 | D46: =INFOSinputs!R[+8]C[+3] -> 2678.17896389325 | E46: 0.13 | F46: =RC[-4]*RC[-3]+RC[-2]*RC[-1] -> 2393.91878313295 | G46: =SUM(R[-3]C[-1]:RC[-1])/4 -> 2363.86655001559 | H46: =RC[-1]/R8C[-1]*1000 -> 2223.6928458478 | I46: =(RC[-1]-R[-4]C[-1])/R[-4]C[-1] -> 0.0311165381377254
A47: 33482 | B47: =INFOSWages!R[+9]C[+4] -> 2402.37691001698 | C47: 0.87 | D47: =INFOSinputs!R[+8]C[+3] -> 2681.31868131868 | E47: 0.13 | F47: =RC[-4]*RC[-3]+RC[-2]*RC[-1] -> 2438.6393402862 | G47: =SUM(R[-3]C[-1]:RC[-1])/4 -> 2390.06548629639 | H47: =RC[-1]/R8C[-1]*1000 -> 2248.33822490951 | I47: =(RC[-1]-R[-4]C[-1])/R[-4]C[-1] -> 0.0366168414275069
A48: 33208 | B48: =INFOSWages!R[+9]C[+4] -> 2426.14601018676 | C48: 0.87 | D48: =INFOSinputs!R[+8]C[+3] -> 2747.25274725275 | E48: 0.13 | F48: =RC[-4]*RC[-3]+RC[-2]*RC[-1] -> 2467.88988600534 | G48: =SUM(R[-3]C[-1]:RC[-1])/4 -> 2418.74978344479 | H48: =RC[-1]/R8C[-1]*1000 -> 2275.32158670573 | I48: =(RC[-1]-R[-4]C[-1])/R[-4]C[-1] -> 0.0413995928612009
A49: 33298 | B49: =INFOSWages!R[+9]C[+4] -> 2444.82173174873 | C49: 0.66 | D49: =INFOSinputs!R[+8]C[+3] -> 2767.66091051805 | E49: 0.34 | F49: =RC[-4]*RC[-3]+RC[-2]*RC[-1] -> 2554.5870525303 | G49: =SUM(R[-3]C[-1]:RC[-1])/4 -> 2463.75876548869 | H49: =RC[-1]/R8C[-1]*1000 -> 2317.6616043219 | I49: =(RC[-1]-R[-4]C[-1])/R[-4]C[-1] -> 0.0513570496396586
A50: 33390 | B50: =INFOSWages!R[+9]C[+4] -> 2446.519524618 | C50: 0.66 | D50: =INFOSinputs!R[+8]C[+3] -> 2789.63893249608 | E50: 0.34 | F50: =RC[-4]*RC[-3]+RC[-2]*RC[-1] -> 2563.18012329654 | G50: =SUM(R[-3]C[-1]:RC[-1])/4 -> 2506.07410052959 | H50: =RC[-1]/R8C[-1]*1000 -> 2357.46770412034 | I50: =(RC[-1]-R[-4]C[-1])/R[-4]C[-1] -> 0.0601588742448528
A51: 33482 | B51: =INFOSWages!R[+9]C[+4] -> 2448.21731748727 | C51: 0.66 | D51: =INFOSinputs!R[+8]C[+3] -> 2797.48822605965 | E51: 0.34 | F51: =RC[-4]*RC[-3]+RC[-2]*RC[-1] -> 2566.96942640188 | G51: =SUM(R[-3]C[-1]:RC[-1])/4 -> 2538.15662205851 | H51: =RC[-1]/R8C[-1]*1000 -> 2387.64778074105 | I51: =(RC[-1]-R[-4]C[-1])/R[-4]C[-1] -> 0.0619611205681263
A52: 33573 | B52: =INFOSWages!R[+9]C[+4] -> 2448.21731748727 | C52: 0.66 | D52: =INFOSinputs!R[+8]C[+3] -> 2786.49921507064 | E52: 0.34 | F52: =RC[-4]*RC[-3]+RC[-2]*RC[-1] -> 2563.23316266562 | G52: =SUM(R[-3]C[-1]:RC[-1])/4 -> 2561.99244122358 | H52: =RC[-1]/R8C[-1]*1000 -> 2410.07017195088 | I52: =(RC[-1]-R[-4]C[-1])/R[-4]C[-1] -> 0.0592217759601368
A53: 33664 | B53: =INFOSWages!R[+9]C[+4] -> 2449.91511035654 | C53: 0.66 | D53: =INFOSinputs!R[+8]C[+3] -> 2800.62794348509 | E53: 0.34 | F53: =RC[-4]*RC[-3]+RC[-2]*RC[-1] -> 2569.15747362024 | G53: =SUM(R[-3]C[-1]:RC[-1])/4 -> 2565.63504649607 | H53: =RC[-1]/R8C[-1]*1000 -> 2413.49677625078 | I53: =(RC[-1]-R[-4]C[-1])/R[-4]C[-1] -> 0.0413499415748067
A54: 33756 | B54: =INFOSWages!R[+9]C[+4] -> 2451.61290322581 | C54: 0.66 | D54: =INFOSinputs!R[+8]C[+3] -> 2813.18681318681 | E54: 0.34 | F54: =RC[-4]*RC[-3]+RC[-2]*RC[-1] -> 2574.54803261255 | G54: =SUM(R[-3]C[-1]:RC[-1])/4 -> 2568.47702382507 | H54: =RC[-1]/R8C[-1]*1000 -> 2416.17022863096 | I54: =(RC[-1]-R[-4]C[-1])/R[-4]C[-1] -> 0.0249006696499078
A55: 33848 | B55: =INFOSWages!R[+9]C[+4] -> 2455.00848896435 | C55: 0.66 | D55: =INFOSinputs!R[+8]C[+3] -> 2822.60596546311 | E55: 0.34 | F55: =RC[-4]*RC[-3]+RC[-2]*RC[-1] -> 2579.99163097393 | G55: =SUM(R[-3]C[-1]:RC[-1])/4 -> 2571.73257496808 | H55: =RC[-1]/R8C[-1]*1000 -> 2419.23273052472 | I55: =(RC[-1]-R[-4]C[-1])/R[-4]C[-1] -> 0.0132284795263496
A56: 33939 | B56: =INFOSWages!R[+9]C[+4] -> 2460.10186757216 | C56: 0.66 | D56: =INFOSinputs!R[+8]C[+3] -> 2841.4442700157 | E56: 0.34 | F56: =RC[-4]*RC[-3]+RC[-2]*RC[-1] -> 2589.75828440296 | G56: =SUM(R[-3]C[-1]:RC[-1])/4 -> 2578.36385540242 | H56: =RC[-1]/R8C[-1]*1000 -> 2425.47078607847 | I56: =(RC[-1]-R[-4]C[-1])/R[-4]C[-1] -> 0.00639011025770897
A57: 34029 | B57: =INFOSWages!R[+9]C[+4] -> 2462.56196943973 | C57: 0.66 | D57: =INFOSinputs!R[+8]C[+3] -> 2858.71271585557 | E57: 0.34 | F57: =RC[-4]*RC[-3]+RC[-2]*RC[-1] -> 2597.25322322112 | G57: =SUM(R[-3]C[-1]:RC[-1])/4 -> 2585.38779280264 | H57: =RC[-1]/R8C[-1]*1000 -> 2432.07821463506 | I57: =(RC[-1]-R[-4]C[-1])/R[-4]C[-1] -> 0.00769896963075254
A58: 34121 | B58: =INFOSWages!R[+9]C[+4] -> 2462.56196943973 | C58: 0.66 | D58: =INFOSinputs!R[+8]C[+3] -> 2874.41130298273 | E58: 0.34 | F58: =RC[-4]*RC[-3]+RC[-2]*RC[-1] -> 2602.59074284435 | G58: =SUM(R[-3]C[-1]:RC[-1])/4 -> 2592.39847036059 | H58: =RC[-1]/R8C[-1]*1000 -> 2438.67316963794 | I58: =(RC[-1]-R[-4]C[-1])/R[-4]C[-1] -> 0.00931347499456785
A59: 34213 | B59: =INFOSWages!R[+9]C[+4] -> 2462.56196943973 | C59: 0.66 | D59: =INFOSinputs!R[+8]C[+3] -> 2877.55102040816 | E59: 0.34 | F59: =RC[-4]*RC[-3]+RC[-2]*RC[-1] -> 2603.658246769 | G59: =SUM(R[-3]C[-1]:RC[-1])/4 -> 2598.31512430936 | H59: =RC[-1]/R8C[-1]*1000 -> 2444.23897497375 | I59: =(RC[-1]-R[-4]C[-1])/R[-4]C[-1] -> 0.0103364360664918
A60: 34304 | B60: =INFOSWages!R[+9]C[+4] -> 2462.56196943973 | C60: 0.66 | D60: =INFOSinputs!R[+8]C[+3] -> 2902.66875981162 | E60: 0.34 | F60: =RC[-4]*RC[-3]+RC[-2]*RC[-1] -> 2612.19827816617 | G60: =SUM(R[-3]C[-1]:RC[-1])/4 -> 2603.92512275016 | H60: =RC[-1]/R8C[-1]*1000 -> 2449.51630900851 | I60: =(RC[-1]-R[-4]C[-1])/R[-4]C[-1] -> 0.0099137549163903
A61: 34394 | B61: =INFOSWages!R[+9]C[+4] -> 2462.56196943973 | C61: 0.66 | D61: =INFOSinputs!R[+8]C[+3] -> 2893.24960753532 | E61: 0.34 | F61: =RC[-4]*RC[-3]+RC[-2]*RC[-1] -> 2608.99576639223 | G61: =SUM(R[-3]C[-1]:RC[-1])/4 -> 2606.86075854294 | H61: =RC[-1]/R8C[-1]*1000 -> 2452.2778660475 | I61: =(RC[-1]-R[-4]C[-1])/R[-4]C[-1] -> 0.00830551060853468
A62: 34486 | B62: =INFOSWages!R[+9]C[+4] -> 2465.0220713073 | C62: 0.66 | D62: =INFOSinputs!R[+8]C[+3] -> 2905.80847723705 | E62: 0.34 | F62: =RC[-4]*RC[-3]+RC[-2]*RC[-1] -> 2614.88944932341 | G62: =SUM(R[-3]C[-1]:RC[-1])/4 -> 2609.9354351627 | H62: =RC[-1]/R8C[-1]*1000 -> 2455.17021900313 | I62: =(RC[-1]-R[-4]C[-1])/R[-4]C[-1] -> 0.00676476436883378
A63: 34578 | B63: =INFOSWages!R[+9]C[+4] -> 2465.0220713073 | C63: 0.66 | D63: =INFOSinputs!R[+8]C[+3] -> 2908.94819466248 | E63: 0.34 | F63: =RC[-4]*RC[-3]+RC[-2]*RC[-1] -> 2615.95695324806 | G63: =SUM(R[-3]C[-1]:RC[-1])/4 -> 2613.01011178247 | H63: =RC[-1]/R8C[-1]*1000 -> 2458.06257195877 | I63: =(RC[-1]-R[-4]C[-1])/R[-4]C[-1] -> 0.00565558324147464
A64: 34669 | B64: =INFOSWages!R[+9]C[+4] -> 2465.0220713073 | C64: 0.66 | D64: =INFOSinputs!R[+8]C[+3] -> 2912.08791208791 | E64: 0.34 | F64: =RC[-4]*RC[-3]+RC[-2]*RC[-1] -> 2617.02445717271 | G64: =SUM(R[-3]C[-1]:RC[-1])/4 -> 2614.2166565341 | H64: =RC[-1]/R8C[-1]*1000 -> 2459.19757043506 | I64: =(RC[-1]-R[-4]C[-1])/R[-4]C[-1] -> 0.0039523155616228
A65: 34759 | B65: =INFOSWages!R[+9]C[+4] -> 2465.0220713073 | C65: 0.66 | D65: =INFOSinputs!R[+8]C[+3] -> 2912.08791208791 | E65: 0.34 | F65: =RC[-4]*RC[-3]+RC[-2]*RC[-1] -> 2617.02445717271 | G65: =SUM(R[-3]C[-1]:RC[-1])/4 -> 2616.22382922922 | H65: =RC[-1]/R8C[-1]*1000 -> 2461.08572083106 | I65: =(RC[-1]-R[-4]C[-1])/R[-4]C[-1] -> 0.00359170341400221
A66: 34851 | B66: =INFOSWages!R[+9]C[+4] -> 2482.24278438031 | C66: 0.66 | D66: =INFOSinputs!R[+8]C[+3] -> 2915.22762951334 | E66: 0.34 | F66: =RC[-4]*RC[-3]+RC[-2]*RC[-1] -> 2629.45763172554 | G66: =SUM(R[-3]C[-1]:RC[-1])/4 -> 2619.86587482975 | H66: =RC[-1]/R8C[-1]*1000 -> 2464.51179864671 | I66: =(RC[-1]-R[-4]C[-1])/R[-4]C[-1] -> 0.00380486027863494
A67: 34943 | B67: =INFOSWages!R[+9]C[+4] -> 2487.16298811545 | C67: 0.66 | D67: =INFOSinputs!R[+8]C[+3] -> 2924.64678178964 | E67: 0.34 | F67: =RC[-4]*RC[-3]+RC[-2]*RC[-1] -> 2635.90747796467 | G67: =SUM(R[-3]C[-1]:RC[-1])/4 -> 2624.85350600891 | H67: =RC[-1]/R8C[-1]*1000 -> 2469.20367085529 | I67: =(RC[-1]-R[-4]C[-1])/R[-4]C[-1] -> 0.00453247163990456
A68: 35034 | B68: =INFOSWages!R[+9]C[+4] -> 2533.90492359932 | C68: 0.66 | D68: =INFOSinputs!R[+8]C[+3] -> 2937.20565149137 | E68: 0.34 | F68: =RC[-4]*RC[-3]+RC[-2]*RC[-1] -> 2671.02717108262 | G68: =SUM(R[-3]C[-1]:RC[-1])/4 -> 2638.35418448638 | H68: =RC[-1]/R8C[-1]*1000 -> 2481.90377955823 | I68: =(RC[-1]-R[-4]C[-1])/R[-4]C[-1] -> 0.00923317808872101
A69: 35125 | B69: =INFOSWages!R[+9]C[+4] -> 2541.28522920204 | C69: 0.66 | D69: =INFOSinputs!R[+8]C[+3] -> 2960.7535321821 | E69: 0.34 | F69: =RC[-4]*RC[-3]+RC[-2]*RC[-1] -> 2683.90445221526 | G69: =SUM(R[-3]C[-1]:RC[-1])/4 -> 2655.07418324702 | H69: =RC[-1]/R8C[-1]*1000 -> 2497.63230773017 | I69: =(RC[-1]-R[-4]C[-1])/R[-4]C[-1] -> 0.0148497821874991
A70: 35217 | B70: =INFOSWages!R[+9]C[+4] -> 2541.28522920204 | C70: 0.66 | D70: =INFOSinputs!R[+8]C[+3] -> 2968.60282574568 | E70: 0.34 | F70: =RC[-4]*RC[-3]+RC[-2]*RC[-1] -> 2686.57321202688 | G70: =SUM(R[-3]C[-1]:RC[-1])/4 -> 2669.35307832236 | H70: =RC[-1]/R8C[-1]*1000 -> 2511.06448596604 | I70: =(RC[-1]-R[-4]C[-1])/R[-4]C[-1] -> 0.0188892125997931
A71: 35309 | B71: =INFOSWages!R[+9]C[+4] -> 2580.64685908319 | C71: 0.66 | D71: =INFOSinputs!R[+8]C[+3] -> 2948.19466248038 | E71: 0.34 | F71: =RC[-4]*RC[-3]+RC[-2]*RC[-1] -> 2705.61311223823 | G71: =SUM(R[-3]C[-1]:RC[-1])/4 -> 2686.77948689075 | H71: =RC[-1]/R8C[-1]*1000 -> 2527.45753491464 | I71: =(RC[-1]-R[-4]C[-1])/R[-4]C[-1] -> 0.02359216647332
A72: 35400 | B72: =INFOSWages!R[+9]C[+4] -> 2642.1494057725 | C72: 0.66 | D72: =INFOSinputs!R[+8]C[+3] -> 2951.16065308649 | E72: 0.34 | F72: =RC[-4]*RC[-3]+RC[-2]*RC[-1] -> 2747.21322985926 | G72: =SUM(R[-3]C[-1]:RC[-1])/4 -> 2705.82600158491 | H72: =RC[-1]/R8C[-1]*1000 -> 2545.37462015088 | I72: =(RC[-1]-R[-4]C[-1])/R[-4]C[-1] -> 0.0255734493478013
A73: 35490 | B73: =INFOSWages!R[+9]C[+4] -> 2698.73174872666 | C73: 0.66 | D73: =INFOSinputs!R[+8]C[+3] -> 2945.22867187426 | E73: 0.34 | F73: =RC[-4]*RC[-3]+RC[-2]*RC[-1] -> 2782.54070259684 | G73: =SUM(R[-3]C[-1]:RC[-1])/4 -> 2730.4850641803 | H73: =RC[-1]/R8C[-1]*1000 -> 2568.57143770318 | I73: =(RC[-1]-R[-4]C[-1])/R[-4]C[-1] -> 0.0284025513897529
A74: 35582 | B74: =INFOSWages!R[+9]C[+4] -> 2706.11205432937 | C74: 0.66 | D74: =INFOSinputs!R[+8]C[+3] -> 2951.16065308649 | E74: 0.34 | F74: =RC[-4]*RC[-3]+RC[-2]*RC[-1] -> 2789.42857790679 | G74: =SUM(R[-3]C[-1]:RC[-1])/4 -> 2756.19890565028 | H74: =RC[-1]/R8C[-1]*1000 -> 2592.76048734123 | I74: =(RC[-1]-R[-4]C[-1])/R[-4]C[-1] -> 0.0325344099411927
A75: 35674 | B75: =INFOSWages!R[+9]C[+4] -> 2738.09337860781 | C75: 0.66 | D75: =INFOSinputs!R[+8]C[+3] -> 2963.02461551096 | E75: 0.34 | F75: =RC[-4]*RC[-3]+RC[-2]*RC[-1] -> 2814.56999915488 | G75: =SUM(R[-3]C[-1]:RC[-1])/4 -> 2783.43812737944 | H75: =RC[-1]/R8C[-1]*1000 -> 2618.38446450069 | I75: =(RC[-1]-R[-4]C[-1])/R[-4]C[-1] -> 0.0359756507596957
A76: 35765 | B76: =INFOSWages!R[+9]C[+4] -> 2740.55348047538 | C76: 0.66 | D76: =INFOSinputs!R[+8]C[+3] -> 2965.99060611708 | E76: 0.34 | F76: =RC[-4]*RC[-3]+RC[-2]*RC[-1] -> 2817.20210319356 | G76: =SUM(R[-3]C[-1]:RC[-1])/4 -> 2800.93534571302 | H76: =RC[-1]/R8C[-1]*1000 -> 2634.8441243027 | I76: =(RC[-1]-R[-4]C[-1])/R[-4]C[-1] -> 0.0351498374516332
A77: 35855 | B77: =INFOSWages!R[+9]C[+4] -> 2747.9337860781 | C77: 0.66 | D77: =INFOSinputs!R[+8]C[+3] -> 2963.02461551096 | E77: 0.34 | F77: =RC[-4]*RC[-3]+RC[-2]*RC[-1] -> 2821.06466808527 | G77: =SUM(R[-3]C[-1]:RC[-1])/4 -> 2810.56633708513 | H77: =RC[-1]/R8C[-1]*1000 -> 2643.90401248143 | I77: =(RC[-1]-R[-4]C[-1])/R[-4]C[-1] -> 0.0293285885190752
A78: 35947 | B78: =INFOSWages!R[+9]C[+4] -> 2856.17826825127 | C78: 0.66 | D78: =INFOSinputs!R[+8]C[+3] -> 2995.65051217825 | E78: 0.34 | F78: =RC[-4]*RC[-3]+RC[-2]*RC[-1] -> 2903.59883118645 | G78: =SUM(R[-3]C[-1]:RC[-1])/4 -> 2839.10890040504 | H78: =RC[-1]/R8C[-1]*1000 -> 2670.75404505041 | I78: =(RC[-1]-R[-4]C[-1])/R[-4]C[-1] -> 0.0300812813562879
A79: 36039 | B79: =INFOSWages!R[+9]C[+4] -> 2858.63837011885 | C79: 0.66 | D79: =INFOSinputs!R[+8]C[+3] -> 3007.51447460272 | E79: 0.34 | F79: =RC[-4]*RC[-3]+RC[-2]*RC[-1] -> 2909.25624564336 | G79: =SUM(R[-3]C[-1]:RC[-1])/4 -> 2862.78046202716 | H79: =RC[-1]/R8C[-1]*1000 -> 2693.02191894067 | I79: =(RC[-1]-R[-4]C[-1])/R[-4]C[-1] -> 0.0285051547822322
A80: 36130 | B80: =INFOSWages!R[+9]C[+4] -> 2861.09847198642 | C80: 0.66 | D80: =INFOSinputs!R[+8]C[+3] -> 3013.44645581495 | E80: 0.34 | F80: =RC[-4]*RC[-3]+RC[-2]*RC[-1] -> 2912.89678648812 | G80: =SUM(R[-3]C[-1]:RC[-1])/4 -> 2886.7041328508 | H80: =RC[-1]/R8C[-1]*1000 -> 2715.52695233885 | I80: =(RC[-1]-R[-4]C[-1])/R[-4]C[-1] -> 0.0306214805240168
A81: 36220 | B81: =INFOSWages!R[+9]C[+4] -> 2866.01867572156 | C81: 0.66 | D81: =INFOSinputs!R[+8]C[+3] -> 3016.41244642107 | E81: 0.34 | F81: =RC[-4]*RC[-3]+RC[-2]*RC[-1] -> 2917.15255775939 | G81: =SUM(R[-3]C[-1]:RC[-1])/4 -> 2910.72610526933 | H81: =RC[-1]/R8C[-1]*1000 -> 2738.12445819632 | I81: =(RC[-1]-R[-4]C[-1])/R[-4]C[-1] -> 0.0356368632409086
A82: 36312 | B82: =INFOSWages!R[+9]C[+4] -> 2868.47877758913 | C82: 0.66 | D82: =INFOSinputs!R[+8]C[+3] -> 3025.31041823942 | E82: 0.34 | F82: =RC[-4]*RC[-3]+RC[-2]*RC[-1] -> 2921.80153541023 | G82: =SUM(R[-3]C[-1]:RC[-1])/4 -> 2915.27678132528 | H82: =RC[-1]/R8C[-1]*1000 -> 2742.40528605833 | I82: =(RC[-1]-R[-4]C[-1])/R[-4]C[-1] -> 0.0268280941634082
A83: 36404 | B83: =INFOSWages!R[+9]C[+4] -> 2907.84040747029 | C83: 0.66 | D83: =INFOSinputs!R[+8]C[+3] -> 3037.17438066389 | E83: 0.34 | F83: =RC[-4]*RC[-3]+RC[-2]*RC[-1] -> 2951.81395835611 | G83: =SUM(R[-3]C[-1]:RC[-1])/4 -> 2925.91620950346 | H83: =RC[-1]/R8C[-1]*1000 -> 2752.41381226874 | I83: =(RC[-1]-R[-4]C[-1])/R[-4]C[-1] -> 0.0220539955172104
A84: 36495 | B84: =INFOSWages!R[+9]C[+4] -> 2947.20203735144 | C84: 0.66 | D84: =INFOSinputs!R[+8]C[+3] -> 3049.03834308836 | E84: 0.34 | F84: =RC[-4]*RC[-3]+RC[-2]*RC[-1] -> 2981.82638130199 | G84: =SUM(R[-3]C[-1]:RC[-1])/4 -> 2943.14860820693 | H84: =RC[-1]/R8C[-1]*1000 -> 2768.62435584339 | I84: =(RC[-1]-R[-4]C[-1])/R[-4]C[-1] -> 0.0195532596201298
A85: 'Notes
A86: '1) Wages
A87: 'Mar 1980 - Dec 1992: Prevailing weekly wage rate index, central government sector, professional technical and related occupation group, series identifier PWIQ.S1211
A88: 'Dec 1992 - Dec 1999: Labour cost index, all sectors combined, salaries and wage rates, teaching professions, series identifier LCIQ.SB53B3
A89: '2) Non-wage costs, exclusive of GST
A90: 'Mar 1980 - Sept 1996: Producers price index, inputs, central government group, series identifier PPIQ.SIV
A91: 'Sept 1996 - Dec 1999: Producers price index, inputs, education industry, series identifier PPIQ.SNN01
A92: '3) Weights represent the respective proportions of operating expenses accounted for by wages and by other costs
A93: 'Because of rounding individual items may not add exactly to the totals shown

Sheet: Regression
A1: 'SUMMARY OUTPUT
A3: 'Regression Statistics
A4: 'Multiple R | B4: 0.772462657450134
A5: 'R Square | B5: 0.596698557154923
A6: 'Adjusted R Square | B6: 0.569811794298584
A7: 'Standard Error | B7: 3029.15840086411
A8: 'Observations | B8: 17
A10: 'ANOVA
B11: 'df | C11: 'SS | D11: 'MS | E11: 'F | F11: 'Significance F
A12: 'Regression | B12: 1 | C12: 203638757.79594 | D12: 203638757.79594 | E12: 22.1930233975435 | F12: 0.000278641847179424
A13: 'Residual | B13: 15 | C13: 137637009.262884 | D13: 9175800.6175256
A14: 'Total | B14: 16 | C14: 341275767.058824
B16: 'Coefficients | C16: 'Standard Error | D16: 't Stat | E16: 'P-value | F16: 'Lower 95% | G16: 'Upper 95% | H16: 'Lower 95.0% | I16: 'Upper 95.0%
A17: 'Intercept | B17: -1848.8455068955 | C17: 2373.05307777436 | D17: -0.779099938476513 | E17: 0.448038724479357 | F17: -6906.89152040842 | G17: 3209.20050661741 | H17: -6906.89152040842 | I17: 3209.20050661741
A18: 'GDP per capita (ppp) 1995 | B18: 0.616783417922877 | C18: 0.13092556410758 | D18: 4.71094718687691 | E18: 0.000278641847179426 | F18: 0.337722012257916 | G18: 0.895844823587837 | H18: 0.337722012257916 | I18: 0.895844823587837
A22: 'RESIDUAL OUTPUT
A24: 'Observation | B24: 'Predicted Expenditure per EFTS (ppp) 1995 | C24: 'Residuals
A25: 1 | B25: 10190.1500275411 | C25: 1381.84997245888
A26: 2 | B26: 10864.2943033308 | C26: -3177.29430333083
A27: 3 | B27: 11098.0552187236 | C27: 1118.9447812764
A28: 4 | B28: 4512.04188214312 | C28: 3143.95811785688
A29: 5 | B29: 9204.53012570036 | C29: -1792.53012570036
A30: 6 | B30: 10800.7656112848 | C30: -1799.76561128477
A31: 7 | B31: 5659.25903947967 | C31: -2490.25903947967
A32: 8 | B32: 2373.03698878659 | C32: 2418.96301121341
A33: 9 | B33: 10153.7598058837 | C33: -5221.75980588367
A34: 10 | B34: 11668.5798803023 | C34: -2331.57988030226
A35: 11 | B35: 5872.04931866306 | C35: -139.049318663064
A36: 12 | B36: 2694.3811495244 | C36: 2376.6188504756
A37: 13 | B37: 10409.1081409037 | C37: -1383.10814090374
A38: 14 | B38: 8613.03482791233 | C38: -233.034827912326
A39: 15 | B39: 6981.64268750632 | C39: -2015.64268750632
A40: 16 | B40: 13560.2546230717 | C40: 4804.74537692828
A41: 17 | B41: 14626.0563692425 | C41: 5338.94363075755
A43: 'Table 3: OECD COUNTRIES: Expenditure (public and private) per student at universities in US$ and purchasing power parities (ppp)
A44: 'Country | D44: 'Regression estimates | E44: 'Difference observed - estimated
A45: 'Australia | B45: 19519 | C45: 11572 | D45: 10190.1500275411 | E45: =RC[-2]-RC[-1] -> 1381.8499724589
A46: 'Austria | B46: 20612 | C46: 7687 | D46: 10864.2943033308 | E46: =RC[-2]-RC[-1] -> -3177.2943033308
A47: 'Canada | B47: 20991 | C47: 12217 | D47: 11098.0552187236 | E47: =RC[-2]-RC[-1] -> 1118.9447812764
A48: 'Czech Republic | B48: 10313 | C48: 7656 | D48: 4512.04188214312 | E48: =RC[-2]-RC[-1] -> 3143.95811785688
A49: 'Finland | B49: 17921 | C49: 7412 | D49: 9204.53012570036 | E49: =RC[-2]-RC[-1] -> -1792.53012570036
A50: 'Germany | B50: 20509 | C50: 9001 | D50: 10800.7656112848 | E50: =RC[-2]-RC[-1] -> -1799.7656112848
A51: 'Greece | B51: 12173 | C51: 3169 | D51: 5659.25903947967 | E51: =RC[-2]-RC[-1] -> -2490.25903947967
A52: 'Hungary | B52: 6845 | C52: 4792 | D52: 2373.03698878659 | E52: =RC[-2]-RC[-1] -> 2418.96301121341
A53: 'Italy | B53: 19460 | C53: 4932 | D53: 10153.7598058837 | E53: =RC[-2]-RC[-1] -> -5221.7598058837
A54: 'Japan | B54: 21916 | C54: 9337 | D54: 11668.5798803023 | E54: =RC[-2]-RC[-1] -> -2331.5798803023
A55: 'Korea | B55: 12518 | C55: 5733 | D55: 5872.04931866306 | E55: =RC[-2]-RC[-1] -> -139.04931866306
A56: 'Mexico | B56: 7366 | C56: 5071 | D56: 2694.3811495244 | E56: =RC[-2]-RC[-1] -> 2376.6188504756
A57: 'Netherlands | B57: 19874 | C57: 9026 | D57: 10409.1081409037 | E57: =RC[-2]-RC[-1] -> -1383.1081409037
A58: 'New Zealand | B58: 16962 | C58: 8380 | D58: 8613.03482791233 | E58: =RC[-2]-RC[-1] -> -233.03482791233
A59: 'Spain | B59: 14317 | C59: 4966 | D59: 6981.64268750632 | E59: =RC[-2]-RC[-1] -> -2015.64268750632
A60: 'Switzerland | B60: 24983 | C60: 18365 | D60: 13560.2546230717 | E60: =RC[-2]-RC[-1] -> 4804.7453769283
A61: 'United States | B61: 26711 | C61: 19965 | D61: 14626.0563692425 | E61: =RC[-2]-RC[-1] -> 5338.9436307575
A62: 'Mean (unweighted) | B62: =AVERAGE(R[-17]C:R[-1]C) -> 17234.7058823529 | C62: =AVERAGE(R[-17]C:R[-1]C) -> 8781.23529411765 | D62: =AVERAGE(R[-17]C:R[-1]C) -> 8781.23529411765
A63: 'Notes
A64: 'OECD. (1998). Education at a glance OECD indicators 1998. OECD: Paris.
A65: '1) OECD Table X2.1 p373
A66: '2) OECCD Table B4.1 p118
A67: 'Linear regression estimates:
A68: 'Expenditure per EFTS = -1849 +0.6168 x GDP per capita
A69: 'R Square = 0.60, p-value < 0.001
A70: 'Because of rounding individual items may not add exactly to the totals shown

Sheet: Weightings
A1: 'UNIVERSITY FUNDING: University Actual 1998 $(000) from financial statements
A2: 'University | B2: 'Staff a) | C2: 'Other b) | D2: 'Total a+b | E2: '% staff cost to total operating expenses
A3: 'Auckland | B3: 166715 | C3: 108550 | D3: =SUM(RC[-2]:RC[-1]) -> 275265 | E3: =RC[-3]/RC[-1] -> 0.605652734637531
A4: 'Canterbury | B4: 82962 | C4: 34122 | D4: =SUM(RC[-2]:RC[-1]) -> 117084 | E4: =RC[-3]/RC[-1] -> 0.708568207440812
A5: 'Lincoln | B5: 16784 | C5: 6354 | D5: =SUM(RC[-2]:RC[-1]) -> 23138 | E5: =RC[-3]/RC[-1] -> 0.725386809577319
A6: 'Massey | B6: 83297 | C6: 42109 | D6: =SUM(RC[-2]:RC[-1]) -> 125406 | E6: =RC[-3]/RC[-1] -> 0.664218617928967
A7: 'Otago | B7: 145012 | C7: 75284 | D7: =SUM(RC[-2]:RC[-1]) -> 220296 | E7: =RC[-3]/RC[-1] -> 0.658259795910956
A8: 'Victoria | B8: 78437 | C8: 33441 | D8: =SUM(RC[-2]:RC[-1]) -> 111878 | E8: =RC[-3]/RC[-1] -> 0.701094048874667
A9: 'Waikato | B9: 85028 | C9: 35281 | D9: =SUM(RC[-2]:RC[-1]) -> 120309 | E9: =RC[-3]/RC[-1] -> 0.706746793672959
A10: 'Total | B10: =SUM(R[-7]C:R[-1]C) -> 658235 | C10: =SUM(R[-7]C:R[-1]C) -> 335141 | D10: =SUM(RC[-2]:RC[-1]) -> 993376 | E10: =RC[-3]/RC[-1] -> 0.662624222852173
A11: 'Notes:
A12: 'Auckland: a) = Academic salaries + General salaries; b) = Operating costs (University of Auckland. Annual Report 1998. p 54)
A13: 'Canterbury: a) = Personnel expenses; b) = Property costs + General expenses (University of Canterbury. 1998 Annual Report. p 42)
A14: 'Lincoln: a) = Personnel expenses; b) = Operating costs + Fixed resource use (Lincoln University. 1998 Annual Report. p27)
A15: 'Massey: a) Staff related; b) Other direct costs (Massey University. Annual Report 1998. p 33)
A16: 'Otago: a) = Salaries - academic + Salaries - general + Salary related costs; b) = Consumables and general + Occupancy costs (University of Otago. Annual Report 1998. p 59)
A17: 'Victoria: a) = People; b) = Occupancy + Equipment + Operating expenses (Victoria University of Wellington. Annual Report 1998. p 23)
A18: 'Waikato: a) = Employees; b) = Suppliers (University of Waikato. Annual Report 1998. p 66)
A20: 'UNIVERSITY FUNDING: University Actual 1993 $(000) from financial statements
A21: 'University | B21: 'Staff a) | C21: 'Other b) | D21: 'Total a+b | E21: '%staff cost to total operating expenses
A22: 'Auckland | B22: 117556 | C22: 62556 | D22: =SUM(RC[-2]:RC[-1]) -> 180112 | E22: =RC[-3]/RC[-1] -> 0.652682775162121
A23: 'Canterbury | B23: 58369 | C23: 35490 | D23: =SUM(RC[-2]:RC[-1]) -> 93859 | E23: =RC[-3]/RC[-1] -> 0.621879627952567
A24: 'Lincoln | B24: 0 | C24: 0 | D24: 0 | E24: 0
A25: 'Massey | B25: 60135 | C25: =23259+14183+21936-15990 -> 43388 | D25: =SUM(RC[-2]:RC[-1]) -> 103523 | E25: =RC[-3]/RC[-1] -> 0.580885407107599
A26: 'Otago | B26: =52848+30314+5038 -> 88200 | C26: =26272+10378 -> 36650 | D26: =SUM(RC[-2]:RC[-1]) -> 124850 | E26: =RC[-3]/RC[-1] -> 0.706447737284742
A27: 'Victoria | B27: 56500 | C27: =91130-6841-3585-3113-56500 -> 21091 | D27: =SUM(RC[-2]:RC[-1]) -> 77591 | E27: =RC[-3]/RC[-1] -> 0.728177237050689
A28: 'Waikato | B28: =1216+1184+2027+31152+6129+4358 -> 46066 | C28: =3153+3971+2069+3518+6723+466+20689 -> 40589 | D28: =SUM(RC[-2]:RC[-1]) -> 86655 | E28: =RC[-3]/RC[-1] -> 0.53160233108303
A29: 'Total | B29: =SUM(R[-7]C:R[-1]C) -> 426826 | C29: =SUM(R[-7]C:R[-1]C) -> 239764 | D29: =SUM(R[-7]C:R[-1]C) -> 666590 | E29: =RC[-3]/RC[-1] -> 0.640312635953135
A31: 'Notes:
A32: 'Auckland: a) = Payment to employees; b) = Other operating expenses (University of Auckland. Annual Report and Financial Statements1993. p 66)
A33: 'Canterbury: a) = Salaries & wages; b) = Consumables + Maintenance + General (University of Canterbury. 1993 Annual Report. p 43)
A34: 'Lincoln: and b) unable to obtain a realistic breakdown (Lincoln University. Annual Report 1993)
A35: 'Massey: a) Salaries and wages + Staff related; b) Indirect tchg/Res cost + Operations and maintenance + Administration - Charges for services (Massey University. Annual Financial Statements 1993. p 23)
A36: 'Otago: a) = Salaries - academic + Salaries - general + Salary related costs; b) = Consumables + Occupancy costs (University of Otago. 1993 Annual Report. p 51)
A37: 'Victoria: a) = Salaries; b) = Total cost of services less refurbishment historic buildings less depreciation less salaries (Victoria University of Wellington. Annual Report and Financial Statments 1993. p 19)
A38: 'Waikato: a) = Academic salaries + General salaries + Salary support services; b) = General expenses + Materials and services + External services + Administration services (University of Waikato. Annual Report 1993. p 32)

Sheet: INFOSinputs
A1: 'INFOS Time Series Output INPUTS
B2: 'Series is PPIQ.SIV | C2: 'Series is PPIQ.SNN01 | D2: 'Inputs
B3: 'Producers Price Index | C3: 'Producers Price Index | D3: 'Non labour costs
B4: 'Inputs - Groups (NZSIC) | C4: 'Inputs - Published Industry (ANZSIC)- Base Dec 97 | D4: 'Derived
B5: 'Central Government | C5: 'Education
B6: 'Units = Index; Magnitude = Units; Series Interval = Quarterly; Storage Month = Mar | C6: 'Units = Index; Magnitude = Units; Series Interval = Quarterly; Storage Month = Mar
B7: 'PPIQ | D7: 'PPIQ
B8: 'SIV | D8: 'SNN01
A9: 'Mar 1979 | B9: 527 | C9: =RC[-1]/R79C[-1]*1000 -> 280.617678381257 | F9: =RC[-3] -> 280.617678381257 | G9: =RC[-1]/R13C[-1]*1000 -> 827.315541601256
A10: 'Jun 1979 | B10: 551 | C10: =RC[-1]/R79C[-1]*1000 -> 293.397231096912 | F10: =RC[-3] -> 293.397231096912 | G10: =RC[-1]/R13C[-1]*1000 -> 864.992150706437
A11: 'Sep 1979 | B11: 571 | C11: =RC[-1]/R79C[-1]*1000 -> 304.046858359957 | F11: =RC[-3] -> 304.046858359957 | G11: =RC[-1]/R13C[-1]*1000 -> 896.389324960753
A12: 'Dec 1979 | B12: 606 | C12: =RC[-1]/R79C[-1]*1000 -> 322.683706070287 | F12: =RC[-3] -> 322.683706070287 | G12: =RC[-1]/R13C[-1]*1000 -> 951.334379905808
A13: 'Mar 1980 | B13: 637 | C13: =RC[-1]/R79C[-1]*1000 -> 339.190628328009 | F13: =RC[-3] -> 339.190628328009 | G13: =RC[-1]/R13C[-1]*1000 -> 1000
A14: 'Jun 1980 | B14: 675 | C14: =RC[-1]/R79C[-1]*1000 -> 359.424920127796 | F14: =RC[-3] -> 359.424920127796 | G14: =RC[-1]/R13C[-1]*1000 -> 1059.6546310832
A15: 'Sep 1980 | B15: 707 | C15: =RC[-1]/R79C[-1]*1000 -> 376.464323748669 | F15: =RC[-3] -> 376.464323748669 | G15: =RC[-1]/R13C[-1]*1000 -> 1109.89010989011
A16: 'Dec 1980 | B16: 744 | C16: =RC[-1]/R79C[-1]*1000 -> 396.166134185304 | F16: =RC[-3] -> 396.166134185304 | G16: =RC[-1]/R13C[-1]*1000 -> 1167.9748822606
A17: 'Mar 1981 | B17: 771 | C17: =RC[-1]/R79C[-1]*1000 -> 410.543130990415 | F17: =RC[-3] -> 410.543130990415 | G17: =RC[-1]/R13C[-1]*1000 -> 1210.36106750392
A18: 'Jun 1981 | B18: 815 | C18: =RC[-1]/R79C[-1]*1000 -> 433.972310969116 | F18: =RC[-3] -> 433.972310969116 | G18: =RC[-1]/R13C[-1]*1000 -> 1279.43485086342
A19: 'Sep 1981 | B19: 857 | C19: =RC[-1]/R79C[-1]*1000 -> 456.336528221512 | F19: =RC[-3] -> 456.336528221512 | G19: =RC[-1]/R13C[-1]*1000 -> 1345.36891679749
A20: 'Dec 1981 | B20: 880 | C20: =RC[-1]/R79C[-1]*1000 -> 468.583599574015 | F20: =RC[-3] -> 468.583599574015 | G20: =RC[-1]/R13C[-1]*1000 -> 1381.47566718995
A21: 'Mar 1982 | B21: 922 | C21: =RC[-1]/R79C[-1]*1000 -> 490.947816826411 | F21: =RC[-3] -> 490.947816826411 | G21: =RC[-1]/R13C[-1]*1000 -> 1447.40973312402
A22: 'Jun 1982 | B22: 966 | C22: =RC[-1]/R79C[-1]*1000 -> 514.376996805112 | F22: =RC[-3] -> 514.376996805112 | G22: =RC[-1]/R13C[-1]*1000 -> 1516.48351648352
A23: 'Sep 1982 | B23: 989 | C23: =RC[-1]/R79C[-1]*1000 -> 526.624068157614 | F23: =RC[-3] -> 526.624068157614 | G23: =RC[-1]/R13C[-1]*1000 -> 1552.59026687598
A24: 'Dec 1982 | B24: 1000 | C24: =RC[-1]/R79C[-1]*1000 -> 532.48136315229 | F24: =RC[-3] -> 532.48136315229 | G24: =RC[-1]/R13C[-1]*1000 -> 1569.85871271586
A25: 'Mar 1983 | B25: 1005 | C25: =RC[-1]/R79C[-1]*1000 -> 535.143769968051 | F25: =RC[-3] -> 535.143769968051 | G25: =RC[-1]/R13C[-1]*1000 -> 1577.70800627944
A26: 'Jun 1983 | B26: 1015 | C26: =RC[-1]/R79C[-1]*1000 -> 540.468583599574 | F26: =RC[-3] -> 540.468583599574 | G26: =RC[-1]/R13C[-1]*1000 -> 1593.40659340659
A27: 'Sep 1983 | B27: 1022 | C27: =RC[-1]/R79C[-1]*1000 -> 544.19595314164 | F27: =RC[-3] -> 544.19595314164 | G27: =RC[-1]/R13C[-1]*1000 -> 1604.3956043956
A28: 'Dec 1983 | B28: 1027 | C28: =RC[-1]/R79C[-1]*1000 -> 546.858359957401 | F28: =RC[-3] -> 546.858359957401 | G28: =RC[-1]/R13C[-1]*1000 -> 1612.24489795918
A29: 'Mar 1984 | B29: 1036 | C29: =RC[-1]/R79C[-1]*1000 -> 551.650692225772 | F29: =RC[-3] -> 551.650692225772 | G29: =RC[-1]/R13C[-1]*1000 -> 1626.37362637363
A30: 'Jun 1984 | B30: 1063 | C30: =RC[-1]/R79C[-1]*1000 -> 566.027689030884 | F30: =RC[-3] -> 566.027689030884 | G30: =RC[-1]/R13C[-1]*1000 -> 1668.75981161695
A31: 'Sep 1984 | B31: 1114 | C31: =RC[-1]/R79C[-1]*1000 -> 593.184238551651 | F31: =RC[-3] -> 593.184238551651 | G31: =RC[-1]/R13C[-1]*1000 -> 1748.82260596546
A32: 'Dec 1984 | B32: 1138 | C32: =RC[-1]/R79C[-1]*1000 -> 605.963791267306 | F32: =RC[-3] -> 605.963791267306 | G32: =RC[-1]/R13C[-1]*1000 -> 1786.49921507064
A33: 'Mar 1985 | B33: 1177 | C33: =RC[-1]/R79C[-1]*1000 -> 626.730564430245 | F33: =RC[-3] -> 626.730564430245 | G33: =RC[-1]/R13C[-1]*1000 -> 1847.72370486656
A34: 'Jun 1985 | B34: 1239 | C34: =RC[-1]/R79C[-1]*1000 -> 659.744408945687 | F34: =RC[-3] -> 659.744408945687 | G34: =RC[-1]/R13C[-1]*1000 -> 1945.05494505494
A35: 'Sep 1985 | B35: 1264 | C35: =RC[-1]/R79C[-1]*1000 -> 673.056443024494 | F35: =RC[-3] -> 673.056443024494 | G35: =RC[-1]/R13C[-1]*1000 -> 1984.30141287284
A36: 'Dec 1985 | B36: 1278 | C36: =RC[-1]/R79C[-1]*1000 -> 680.511182108626 | F36: =RC[-3] -> 680.511182108626 | G36: =RC[-1]/R13C[-1]*1000 -> 2006.27943485086
A37: 'Mar 1986 | B37: 1316 | C37: =RC[-1]/R79C[-1]*1000 -> 700.745473908413 | F37: =RC[-3] -> 700.745473908413 | G37: =RC[-1]/R13C[-1]*1000 -> 2065.93406593407
A38: 'Jun 1986 | B38: 1364 | C38: =RC[-1]/R79C[-1]*1000 -> 726.304579339723 | F38: =RC[-3] -> 726.304579339723 | G38: =RC[-1]/R13C[-1]*1000 -> 2141.28728414443
A39: 'Sep 1986 | B39: 1399 | C39: =RC[-1]/R79C[-1]*1000 -> 744.941427050053 | F39: =RC[-3] -> 744.941427050053 | G39: =RC[-1]/R13C[-1]*1000 -> 2196.23233908948
A40: 'Dec 1986 | B40: 1412 | C40: =RC[-1]/R79C[-1]*1000 -> 751.863684771033 | F40: =RC[-3] -> 751.863684771033 | G40: =RC[-1]/R13C[-1]*1000 -> 2216.64050235479
A41: 'Mar 1987 | B41: 1457 | C41: =RC[-1]/R79C[-1]*1000 -> 775.825346112886 | F41: =RC[-3] -> 775.825346112886 | G41: =RC[-1]/R13C[-1]*1000 -> 2287.284144427
A42: 'Jun 1987 | B42: 1481 | C42: =RC[-1]/R79C[-1]*1000 -> 788.604898828541 | F42: =RC[-3] -> 788.604898828541 | G42: =RC[-1]/R13C[-1]*1000 -> 2324.96075353218
A43: 'Sep 1987 | B43: 1497 | C43: =RC[-1]/R79C[-1]*1000 -> 797.124600638978 | F43: =RC[-3] -> 797.124600638978 | G43: =RC[-1]/R13C[-1]*1000 -> 2350.07849293564
A44: 'Dec 1987 | B44: 1516 | C44: =RC[-1]/R79C[-1]*1000 -> 807.241746538871 | F44: =RC[-3] -> 807.241746538871 | G44: =RC[-1]/R13C[-1]*1000 -> 2379.90580847724
A45: 'Mar 1988 | B45: 1528 | C45: =RC[-1]/R79C[-1]*1000 -> 813.631522896699 | F45: =RC[-3] -> 813.631522896699 | G45: =RC[-1]/R13C[-1]*1000 -> 2398.74411302983
A46: 'Jun 1988 | B46: 1543 | C46: =RC[-1]/R79C[-1]*1000 -> 821.618743343983 | F46: =RC[-3] -> 821.618743343983 | G46: =RC[-1]/R13C[-1]*1000 -> 2422.29199372056
A47: 'Sep 1988 | B47: 1560 | C47: =RC[-1]/R79C[-1]*1000 -> 830.670926517572 | F47: =RC[-3] -> 830.670926517572 | G47: =RC[-1]/R13C[-1]*1000 -> 2448.97959183673
A48: 'Dec 1988 | B48: 1572 | C48: =RC[-1]/R79C[-1]*1000 -> 837.060702875399 | F48: =RC[-3] -> 837.060702875399 | G48: =RC[-1]/R13C[-1]*1000 -> 2467.81789638932
A49: 'Mar 1989 | B49: 1594 | C49: =RC[-1]/R79C[-1]*1000 -> 848.77529286475 | F49: =RC[-3] -> 848.77529286475 | G49: =RC[-1]/R13C[-1]*1000 -> 2502.35478806907
A50: 'Jun 1989 | B50: 1609 | C50: =RC[-1]/R79C[-1]*1000 -> 856.762513312034 | F50: =RC[-3] -> 856.762513312034 | G50: =RC[-1]/R13C[-1]*1000 -> 2525.90266875981
A51: 'Sep 1989 | B51: 1636 | C51: =RC[-1]/R79C[-1]*1000 -> 871.139510117146 | F51: =RC[-3] -> 871.139510117146 | G51: =RC[-1]/R13C[-1]*1000 -> 2568.28885400314
A52: 'Dec 1989 | B52: 1651 | C52: =RC[-1]/R79C[-1]*1000 -> 879.12673056443 | F52: =RC[-3] -> 879.12673056443 | G52: =RC[-1]/R13C[-1]*1000 -> 2591.83673469388
A53: 'Mar 1990 | B53: 1669 | C53: =RC[-1]/R79C[-1]*1000 -> 888.711395101171 | F53: =RC[-3] -> 888.711395101171 | G53: =RC[-1]/R13C[-1]*1000 -> 2620.09419152276
A54: 'Jun 1990 | B54: 1706 | C54: =RC[-1]/R79C[-1]*1000 -> 908.413205537806 | F54: =RC[-3] -> 908.413205537806 | G54: =RC[-1]/R13C[-1]*1000 -> 2678.17896389325
A55: 'Sep 1990 | B55: 1708 | C55: =RC[-1]/R79C[-1]*1000 -> 909.478168264111 | F55: =RC[-3] -> 909.478168264111 | G55: =RC[-1]/R13C[-1]*1000 -> 2681.31868131868
A56: 'Dec 1990 | B56: 1750 | C56: =RC[-1]/R79C[-1]*1000 -> 931.842385516507 | F56: =RC[-3] -> 931.842385516507 | G56: =RC[-1]/R13C[-1]*1000 -> 2747.25274725275
A57: 'Mar 1991 | B57: 1763 | C57: =RC[-1]/R79C[-1]*1000 -> 938.764643237487 | F57: =RC[-3] -> 938.764643237487 | G57: =RC[-1]/R13C[-1]*1000 -> 2767.66091051805
A58: 'Jun 1991 | B58: 1777 | C58: =RC[-1]/R79C[-1]*1000 -> 946.219382321619 | F58: =RC[-3] -> 946.219382321619 | G58: =RC[-1]/R13C[-1]*1000 -> 2789.63893249608
A59: 'Sep 1991 | B59: 1782 | C59: =RC[-1]/R79C[-1]*1000 -> 948.88178913738 | F59: =RC[-3] -> 948.88178913738 | G59: =RC[-1]/R13C[-1]*1000 -> 2797.48822605965
A60: 'Dec 1991 | B60: 1775 | C60: =RC[-1]/R79C[-1]*1000 -> 945.154419595314 | F60: =RC[-3] -> 945.154419595314 | G60: =RC[-1]/R13C[-1]*1000 -> 2786.49921507064
A61: 'Mar 1992 | B61: 1784 | C61: =RC[-1]/R79C[-1]*1000 -> 949.946751863685 | F61: =RC[-3] -> 949.946751863685 | G61: =RC[-1]/R13C[-1]*1000 -> 2800.62794348509
A62: 'Jun 1992 | B62: 1792 | C62: =RC[-1]/R79C[-1]*1000 -> 954.206602768903 | F62: =RC[-3] -> 954.206602768903 | G62: =RC[-1]/R13C[-1]*1000 -> 2813.18681318681
A63: 'Sep 1992 | B63: 1798 | C63: =RC[-1]/R79C[-1]*1000 -> 957.401490947817 | F63: =RC[-3] -> 957.401490947817 | G63: =RC[-1]/R13C[-1]*1000 -> 2822.60596546311
A64: 'Dec 1992 | B64: 1810 | C64: =RC[-1]/R79C[-1]*1000 -> 963.791267305644 | F64: =RC[-3] -> 963.791267305644 | G64: =RC[-1]/R13C[-1]*1000 -> 2841.4442700157
A65: 'Mar 1993 | B65: 1821 | C65: =RC[-1]/R79C[-1]*1000 -> 969.648562300319 | F65: =RC[-3] -> 969.648562300319 | G65: =RC[-1]/R13C[-1]*1000 -> 2858.71271585557
A66: 'Jun 1993 | B66: 1831 | C66: =RC[-1]/R79C[-1]*1000 -> 974.973375931842 | F66: =RC[-3] -> 974.973375931842 | G66: =RC[-1]/R13C[-1]*1000 -> 2874.41130298273
A67: 'Sep 1993 | B67: 1833 | C67: =RC[-1]/R79C[-1]*1000 -> 976.038338658147 | F67: =RC[-3] -> 976.038338658147 | G67: =RC[-1]/R13C[-1]*1000 -> 2877.55102040816
A68: 'Dec 1993 | B68: 1849 | C68: =RC[-1]/R79C[-1]*1000 -> 984.558040468584 | F68: =RC[-3] -> 984.558040468584 | G68: =RC[-1]/R13C[-1]*1000 -> 2902.66875981162
A69: 'Mar 1994 | B69: 1843 | C69: =RC[-1]/R79C[-1]*1000 -> 981.36315228967 | F69: =RC[-3] -> 981.36315228967 | G69: =RC[-1]/R13C[-1]*1000 -> 2893.24960753532
A70: 'Jun 1994 | B70: 1851 | C70: =RC[-1]/R79C[-1]*1000 -> 985.623003194888 | F70: =RC[-3] -> 985.623003194888 | G70: =RC[-1]/R13C[-1]*1000 -> 2905.80847723705
A71: 'Sep 1994 | B71: 1853 | C71: =RC[-1]/R79C[-1]*1000 -> 986.687965921193 | F71: =RC[-3] -> 986.687965921193 | G71: =RC[-1]/R13C[-1]*1000 -> 2908.94819466248
A72: 'Dec 1994 | B72: 1855 | C72: =RC[-1]/R79C[-1]*1000 -> 987.752928647497 | F72: =RC[-3] -> 987.752928647497 | G72: =RC[-1]/R13C[-1]*1000 -> 2912.08791208791
A73: 'Mar 1995 | B73: 1855 | C73: =RC[-1]/R79C[-1]*1000 -> 987.752928647497 | F73: =RC[-3] -> 987.752928647497 | G73: =RC[-1]/R13C[-1]*1000 -> 2912.08791208791
A74: 'Jun 1995 | B74: 1857 | C74: =RC[-1]/R79C[-1]*1000 -> 988.817891373802 | F74: =RC[-3] -> 988.817891373802 | G74: =RC[-1]/R13C[-1]*1000 -> 2915.22762951334
A75: 'Sep 1995 | B75: 1863 | C75: =RC[-1]/R79C[-1]*1000 -> 992.012779552716 | F75: =RC[-3] -> 992.012779552716 | G75: =RC[-1]/R13C[-1]*1000 -> 2924.64678178964
A76: 'Dec 1995 | B76: 1871 | C76: =RC[-1]/R79C[-1]*1000 -> 996.272630457934 | F76: =RC[-3] -> 996.272630457934 | G76: =RC[-1]/R13C[-1]*1000 -> 2937.20565149137
A77: 'Mar 1996 | B77: 1886 | C77: =RC[-1]/R79C[-1]*1000 -> 1004.25985090522 | F77: =RC[-3] -> 1004.25985090522 | G77: =RC[-1]/R13C[-1]*1000 -> 2960.7535321821
A78: 'Jun 1996 | B78: 1891 | C78: =RC[-1]/R79C[-1]*1000 -> 1006.92225772098 | F78: =RC[-3] -> 1006.92225772098 | G78: =RC[-1]/R13C[-1]*1000 -> 2968.60282574568
A79: 'Sep 1996 | B79: 1878 | C79: =RC[-1]/R79C[-1]*1000 -> 1000 | D79: 994 | E79: =RC[-1]/R79C[-1]*1000 -> 1000 | F79: =RC[-1] -> 1000 | G79: =RC[-1]/R13C[-1]*1000 -> 2948.19466248038
A80: 'Dec 1996 | B80: 1880 | C80: =RC[-1]/R79C[-1]*1000 -> 1001.0649627263 | D80: 995 | E80: =RC[-1]/R79C[-1]*1000 -> 1001.0060362173 | F80: =RC[-1] -> 1001.0060362173 | G80: =RC[-1]/R13C[-1]*1000 -> 2951.16065308649
A81: 'Mar 1997 | B81: 1883 | C81: =RC[-1]/R79C[-1]*1000 -> 1002.66240681576 | D81: 993 | E81: =RC[-1]/R79C[-1]*1000 -> 998.993963782696 | F81: =RC[-1] -> 998.993963782696 | G81: =RC[-1]/R13C[-1]*1000 -> 2945.22867187426
A82: 'Jun 1997 | B82: 1881 | C82: =RC[-1]/R79C[-1]*1000 -> 1001.59744408946 | D82: 995 | E82: =RC[-1]/R79C[-1]*1000 -> 1001.0060362173 | F82: =RC[-1] -> 1001.0060362173 | G82: =RC[-1]/R13C[-1]*1000 -> 2951.16065308649
A83: 'Sep 1997 | B83: 1887 | C83: =RC[-1]/R79C[-1]*1000 -> 1004.79233226837 | D83: 999 | E83: =RC[-1]/R79C[-1]*1000 -> 1005.03018108652 | F83: =RC[-1] -> 1005.03018108652 | G83: =RC[-1]/R13C[-1]*1000 -> 2963.02461551096
A84: 'Dec 1997 | B84: 1895 | C84: =RC[-1]/R79C[-1]*1000 -> 1009.05218317359 | D84: 1000 | E84: =RC[-1]/R79C[-1]*1000 -> 1006.03621730382 | F84: =RC[-1] -> 1006.03621730382 | G84: =RC[-1]/R13C[-1]*1000 -> 2965.99060611708
A85: 'Mar 1998 | B85: 1910 | C85: =RC[-1]/R79C[-1]*1000 -> 1017.03940362087 | D85: 999 | E85: =RC[-1]/R79C[-1]*1000 -> 1005.03018108652 | F85: =RC[-1] -> 1005.03018108652 | G85: =RC[-1]/R13C[-1]*1000 -> 2963.02461551096
A86: 'Jun 1998 | B86: 1931 | C86: =RC[-1]/R79C[-1]*1000 -> 1028.22151224707 | D86: 1010 | E86: =RC[-1]/R79C[-1]*1000 -> 1016.09657947686 | F86: =RC[-1] -> 1016.09657947686 | G86: =RC[-1]/R13C[-1]*1000 -> 2995.65051217825
A87: 'Sep 1998 | B87: 1951 | C87: =RC[-1]/R79C[-1]*1000 -> 1038.87113951012 | D87: 1014 | E87: =RC[-1]/R79C[-1]*1000 -> 1020.12072434608 | F87: =RC[-1] -> 1020.12072434608 | G87: =RC[-1]/R13C[-1]*1000 -> 3007.51447460272
A88: 'Dec 1998 | B88: 1950 | C88: =RC[-1]/R79C[-1]*1000 -> 1038.33865814696 | D88: 1016 | E88: =RC[-1]/R79C[-1]*1000 -> 1022.13279678068 | F88: =RC[-1] -> 1022.13279678068 | G88: =RC[-1]/R13C[-1]*1000 -> 3013.44645581495
A89: 'Mar 1999 | B89: 1958 | C89: =RC[-1]/R79C[-1]*1000 -> 1042.59850905218 | D89: 1017 | E89: =RC[-1]/R79C[-1]*1000 -> 1023.13883299799 | F89: =RC[-1] -> 1023.13883299799 | G89: =RC[-1]/R13C[-1]*1000 -> 3016.41244642107
A90: 'Jun 1999 | B90: 1969 | C90: =RC[-1]/R79C[-1]*1000 -> 1048.45580404686 | D90: 1020 | E90: =RC[-1]/R79C[-1]*1000 -> 1026.1569416499 | F90: =RC[-1] -> 1026.1569416499 | G90: =RC[-1]/R13C[-1]*1000 -> 3025.31041823942
A91: 'Sep 1999 | B91: 1986 | C91: =RC[-1]/R79C[-1]*1000 -> 1057.50798722045 | D91: 1024 | E91: =RC[-1]/R79C[-1]*1000 -> 1030.18108651911 | F91: =RC[-1] -> 1030.18108651911 | G91: =RC[-1]/R13C[-1]*1000 -> 3037.17438066389
A92: 'Dec 1999 | D92: 1028 | E92: =RC[-1]/R79C[-1]*1000 -> 1034.20523138833 | F92: =RC[-1] -> 1034.20523138833 | G92: =RC[-1]/R13C[-1]*1000 -> 3049.03834308836
A93: 'Mar 2000 | B93: 'Dec Qtr Telephone Priest 27/6/2000 | D93: 1024

Sheet: INFOSWages
A1: 'INFOS Time Series Output WAGES
B2: 'Series is PWIQ.S1211 | C2: 'Series is LCIQ.SB53B3 | D2: 'Wages
B3: 'Prevailing Weekly Wage Rate Index (Discontinued) | C3: 'Labour Cost Index
B4: 'Sector by Occupation Group | C4: 'All Sectors Combined and Occupation Group | D4: 'Labour Cost Index
B5: 'Central Government Sector | C5: 'All Salary and Wage Rates | D5: 'Derived
B6: 'Professional, Technical and Related Workers | C6: 'Teaching Professionals
B7: 'Units = index; Magnitude = Units; Series Interval = Quarterly; Storage Month = Mar | C7: 'Units = index; Magnitude = Units; Series Interval = Quarterly; Storage Month = Mar
B8: 'PWIQ | C8: 'PWIQ | D8: 'LCIQ
B9: 'S1211 | C9: 'S1211 | D9: 'SB53B3
A10: 'Mar 1979 | B10: 512 | C10: =RC[-1]/R65C[-1]*1000 -> 353.347135955832 | E10: =RC[-2] -> 353.347135955832 | F10: =RC[-1]/R14C[-1]*1000 -> 869.269949066214
A11: 'Jun 1979 | B11: 512 | C11: =RC[-1]/R65C[-1]*1000 -> 353.347135955832 | E11: =RC[-2] -> 353.347135955832 | F11: =RC[-1]/R14C[-1]*1000 -> 869.269949066214
A12: 'Sep 1979 | B12: 512 | C12: =RC[-1]/R65C[-1]*1000 -> 353.347135955832 | E12: =RC[-2] -> 353.347135955832 | F12: =RC[-1]/R14C[-1]*1000 -> 869.269949066214
A13: 'Dec 1979 | B13: 589 | C13: =RC[-1]/R65C[-1]*1000 -> 406.487232574189 | E13: =RC[-2] -> 406.487232574189 | F13: =RC[-1]/R14C[-1]*1000 -> 1000
A14: 'Mar 1980 | B14: 589 | C14: =RC[-1]/R65C[-1]*1000 -> 406.487232574189 | E14: =RC[-2] -> 406.487232574189 | F14: =RC[-1]/R14C[-1]*1000 -> 1000
A15: 'Jun 1980 | B15: 589 | C15: =RC[-1]/R65C[-1]*1000 -> 406.487232574189 | E15: =RC[-2] -> 406.487232574189 | F15: =RC[-1]/R14C[-1]*1000 -> 1000
A16: 'Sep 1980 | B16: 612 | C16: =RC[-1]/R65C[-1]*1000 -> 422.360248447205 | E16: =RC[-2] -> 422.360248447205 | F16: =RC[-1]/R14C[-1]*1000 -> 1039.04923599321
A17: 'Dec 1980 | B17: 707 | C17: =RC[-1]/R65C[-1]*1000 -> 487.92270531401 | E17: =RC[-2] -> 487.92270531401 | F17: =RC[-1]/R14C[-1]*1000 -> 1200.33955857385
A18: 'Mar 1981 | B18: 709 | C18: =RC[-1]/R65C[-1]*1000 -> 489.302967563837 | E18: =RC[-2] -> 489.302967563837 | F18: =RC[-1]/R14C[-1]*1000 -> 1203.73514431239
A19: 'Jun 1981 | B19: 709 | C19: =RC[-1]/R65C[-1]*1000 -> 489.302967563837 | E19: =RC[-2] -> 489.302967563837 | F19: =RC[-1]/R14C[-1]*1000 -> 1203.73514431239
A20: 'Sep 1981 | B20: 744 | C20: =RC[-1]/R65C[-1]*1000 -> 513.457556935818 | E20: =RC[-2] -> 513.457556935818 | F20: =RC[-1]/R14C[-1]*1000 -> 1263.15789473684
A21: 'Dec 1981 | B21: 829 | C21: =RC[-1]/R65C[-1]*1000 -> 572.118702553485 | E21: =RC[-2] -> 572.118702553485 | F21: =RC[-1]/R14C[-1]*1000 -> 1407.47028862479
A22: 'Mar 1982 | B22: 831 | C22: =RC[-1]/R65C[-1]*1000 -> 573.498964803313 | E22: =RC[-2] -> 573.498964803313 | F22: =RC[-1]/R14C[-1]*1000 -> 1410.86587436333
A23: 'Jun 1982 | B23: 831 | C23: =RC[-1]/R65C[-1]*1000 -> 573.498964803313 | E23: =RC[-2] -> 573.498964803313 | F23: =RC[-1]/R14C[-1]*1000 -> 1410.86587436333
A24: 'Sep 1982 | B24: 831 | C24: =RC[-1]/R65C[-1]*1000 -> 573.498964803313 | E24: =RC[-2] -> 573.498964803313 | F24: =RC[-1]/R14C[-1]*1000 -> 1410.86587436333
A25: 'Dec 1982 | B25: 831 | C25: =RC[-1]/R65C[-1]*1000 -> 573.498964803313 | E25: =RC[-2] -> 573.498964803313 | F25: =RC[-1]/R14C[-1]*1000 -> 1410.86587436333
A26: 'Mar 1983 | B26: 831 | C26: =RC[-1]/R65C[-1]*1000 -> 573.498964803313 | E26: =RC[-2] -> 573.498964803313 | F26: =RC[-1]/R14C[-1]*1000 -> 1410.86587436333
A27: 'Jun 1983 | B27: 831 | C27: =RC[-1]/R65C[-1]*1000 -> 573.498964803313 | E27: =RC[-2] -> 573.498964803313 | F27: =RC[-1]/R14C[-1]*1000 -> 1410.86587436333
A28: 'Sep 1983 | B28: 831 | C28: =RC[-1]/R65C[-1]*1000 -> 573.498964803313 | E28: =RC[-2] -> 573.498964803313 | F28: =RC[-1]/R14C[-1]*1000 -> 1410.86587436333
A29: 'Dec 1983 | B29: 831 | C29: =RC[-1]/R65C[-1]*1000 -> 573.498964803313 | E29: =RC[-2] -> 573.498964803313 | F29: =RC[-1]/R14C[-1]*1000 -> 1410.86587436333
A30: 'Mar 1984 | B30: 831 | C30: =RC[-1]/R65C[-1]*1000 -> 573.498964803313 | E30: =RC[-2] -> 573.498964803313 | F30: =RC[-1]/R14C[-1]*1000 -> 1410.86587436333
A31: 'Jun 1984 | B31: 849 | C31: =RC[-1]/R65C[-1]*1000 -> 585.92132505176 | E31: =RC[-2] -> 585.92132505176 | F31: =RC[-1]/R14C[-1]*1000 -> 1441.42614601019
A32: 'Sep 1984 | B32: 849 | C32: =RC[-1]/R65C[-1]*1000 -> 585.92132505176 | E32: =RC[-2] -> 585.92132505176 | F32: =RC[-1]/R14C[-1]*1000 -> 1441.42614601019
A33: 'Dec 1984 | B33: 849 | C33: =RC[-1]/R65C[-1]*1000 -> 585.92132505176 | E33: =RC[-2] -> 585.92132505176 | F33: =RC[-1]/R14C[-1]*1000 -> 1441.42614601019
A34: 'Mar 1985 | B34: 907 | C34: =RC[-1]/R65C[-1]*1000 -> 625.948930296756 | E34: =RC[-2] -> 625.948930296756 | F34: =RC[-1]/R14C[-1]*1000 -> 1539.89813242784
A35: 'Jun 1985 | B35: 923 | C35: =RC[-1]/R65C[-1]*1000 -> 636.991028295376 | E35: =RC[-2] -> 636.991028295376 | F35: =RC[-1]/R14C[-1]*1000 -> 1567.06281833616
A36: 'Sep 1985 | B36: 923 | C36: =RC[-1]/R65C[-1]*1000 -> 636.991028295376 | E36: =RC[-2] -> 636.991028295376 | F36: =RC[-1]/R14C[-1]*1000 -> 1567.06281833616
A37: 'Dec 1985 | B37: 1000 | C37: =RC[-1]/R65C[-1]*1000 -> 690.131124913734 | E37: =RC[-2] -> 690.131124913734 | F37: =RC[-1]/R14C[-1]*1000 -> 1697.79286926995
A38: 'Mar 1986 | B38: 1041 | C38: =RC[-1]/R65C[-1]*1000 -> 718.426501035197 | E38: =RC[-2] -> 718.426501035197 | F38: =RC[-1]/R14C[-1]*1000 -> 1767.40237691002
A39: 'Jun 1986 | B39: 1094 | C39: =RC[-1]/R65C[-1]*1000 -> 755.003450655625 | E39: =RC[-2] -> 755.003450655625 | F39: =RC[-1]/R14C[-1]*1000 -> 1857.38539898132
A40: 'Sep 1986 | B40: 1149 | C40: =RC[-1]/R65C[-1]*1000 -> 792.96066252588 | E40: =RC[-2] -> 792.96066252588 | F40: =RC[-1]/R14C[-1]*1000 -> 1950.76400679117
A41: 'Dec 1986 | B41: 1151 | C41: =RC[-1]/R65C[-1]*1000 -> 794.340924775707 | E41: =RC[-2] -> 794.340924775707 | F41: =RC[-1]/R14C[-1]*1000 -> 1954.15959252971
A42: 'Mar 1987 | B42: 1151 | C42: =RC[-1]/R65C[-1]*1000 -> 794.340924775707 | E42: =RC[-2] -> 794.340924775707 | F42: =RC[-1]/R14C[-1]*1000 -> 1954.15959252971
A43: 'Jun 1987 | B43: 1183 | C43: =RC[-1]/R65C[-1]*1000 -> 816.425120772947 | E43: =RC[-2] -> 816.425120772947 | F43: =RC[-1]/R14C[-1]*1000 -> 2008.48896434635
A44: 'Sep 1987 | B44: 1237 | C44: =RC[-1]/R65C[-1]*1000 -> 853.692201518288 | E44: =RC[-2] -> 853.692201518288 | F44: =RC[-1]/R14C[-1]*1000 -> 2100.16977928693
A45: 'Dec 1987 | B45: 1237 | C45: =RC[-1]/R65C[-1]*1000 -> 853.692201518288 | E45: =RC[-2] -> 853.692201518288 | F45: =RC[-1]/R14C[-1]*1000 -> 2100.16977928693
A46: 'Mar 1988 | B46: 1246 | C46: =RC[-1]/R65C[-1]*1000 -> 859.903381642512 | E46: =RC[-2] -> 859.903381642512 | F46: =RC[-1]/R14C[-1]*1000 -> 2115.44991511036
A47: 'Jun 1988 | B47: 1280 | C47: =RC[-1]/R65C[-1]*1000 -> 883.367839889579 | E47: =RC[-2] -> 883.367839889579 | F47: =RC[-1]/R14C[-1]*1000 -> 2173.17487266553
A48: 'Sep 1988 | B48: 1329 | C48: =RC[-1]/R65C[-1]*1000 -> 917.184265010352 | E48: =RC[-2] -> 917.184265010352 | F48: =RC[-1]/R14C[-1]*1000 -> 2256.36672325976
A49: 'Dec 1988 | B49: 1330 | C49: =RC[-1]/R65C[-1]*1000 -> 917.874396135266 | E49: =RC[-2] -> 917.874396135266 | F49: =RC[-1]/R14C[-1]*1000 -> 2258.06451612903
A50: 'Mar 1989 | B50: 1331 | C50: =RC[-1]/R65C[-1]*1000 -> 918.564527260179 | E50: =RC[-2] -> 918.564527260179 | F50: =RC[-1]/R14C[-1]*1000 -> 2259.7623089983
A51: 'Jun 1989 | B51: 1343 | C51: =RC[-1]/R65C[-1]*1000 -> 926.846100759144 | E51: =RC[-2] -> 926.846100759144 | F51: =RC[-1]/R14C[-1]*1000 -> 2280.13582342954
A52: 'Sep 1989 | B52: 1354 | C52: =RC[-1]/R65C[-1]*1000 -> 934.437543133195 | E52: =RC[-2] -> 934.437543133195 | F52: =RC[-1]/R14C[-1]*1000 -> 2298.81154499151
A53: 'Dec 1989 | B53: 1365 | C53: =RC[-1]/R65C[-1]*1000 -> 942.028985507246 | E53: =RC[-2] -> 942.028985507246 | F53: =RC[-1]/R14C[-1]*1000 -> 2317.48726655348
A54: 'Mar 1990 | B54: 1377 | C54: =RC[-1]/R65C[-1]*1000 -> 950.310559006211 | E54: =RC[-2] -> 950.310559006211 | F54: =RC[-1]/R14C[-1]*1000 -> 2337.86078098472
A55: 'Jun 1990 | B55: 1385 | C55: =RC[-1]/R65C[-1]*1000 -> 955.831608005521 | E55: =RC[-2] -> 955.831608005521 | F55: =RC[-1]/R14C[-1]*1000 -> 2351.44312393888
A56: 'Sep 1990 | B56: 1415 | C56: =RC[-1]/R65C[-1]*1000 -> 976.535541752933 | E56: =RC[-2] -> 976.535541752933 | F56: =RC[-1]/R14C[-1]*1000 -> 2402.37691001698
A57: 'Dec 1990 | B57: 1429 | C57: =RC[-1]/R65C[-1]*1000 -> 986.197377501725 | E57: =RC[-2] -> 986.197377501725 | F57: =RC[-1]/R14C[-1]*1000 -> 2426.14601018676
A58: 'Mar 1991 | B58: 1440 | C58: =RC[-1]/R65C[-1]*1000 -> 993.788819875776 | E58: =RC[-2] -> 993.788819875776 | F58: =RC[-1]/R14C[-1]*1000 -> 2444.82173174873
A59: 'Jun 1991 | B59: 1441 | C59: =RC[-1]/R65C[-1]*1000 -> 994.47895100069 | E59: =RC[-2] -> 994.47895100069 | F59: =RC[-1]/R14C[-1]*1000 -> 2446.519524618
A60: 'Sep 1991 | B60: 1442 | C60: =RC[-1]/R65C[-1]*1000 -> 995.169082125604 | E60: =RC[-2] -> 995.169082125604 | F60: =RC[-1]/R14C[-1]*1000 -> 2448.21731748727
A61: 'Dec 1991 | B61: 1442 | C61: =RC[-1]/R65C[-1]*1000 -> 995.169082125604 | E61: =RC[-2] -> 995.169082125604 | F61: =RC[-1]/R14C[-1]*1000 -> 2448.21731748727
A62: 'Mar 1992 | B62: 1443 | C62: =RC[-1]/R65C[-1]*1000 -> 995.859213250518 | E62: =RC[-2] -> 995.859213250518 | F62: =RC[-1]/R14C[-1]*1000 -> 2449.91511035654
A63: 'Jun 1992 | B63: 1444 | C63: =RC[-1]/R65C[-1]*1000 -> 996.549344375431 | D63: 'LCIQ | E63: =RC[-2] -> 996.549344375431 | F63: =RC[-1]/R14C[-1]*1000 -> 2451.61290322581
A64: 'Sep 1992 | B64: 1446 | C64: =RC[-1]/R65C[-1]*1000 -> 997.929606625259 | D64: 'SB53B3 | E64: =RC[-2] -> 997.929606625259 | F64: =RC[-1]/R14C[-1]*1000 -> 2455.00848896435
A65: 'Dec 1992 | B65: 1449 | C65: =RC[-1]/R65C[-1]*1000 -> 1000 | D65: 1000 | E65: =RC[-1] -> 1000 | F65: =RC[-1]/R14C[-1]*1000 -> 2460.10186757216
A66: 'Mar 1993 | B66: 1452 | C66: =RC[-1]/R65C[-1]*1000 -> 1002.07039337474 | D66: 1001 | E66: =RC[-1] -> 1001 | F66: =RC[-1]/R14C[-1]*1000 -> 2462.56196943973
A67: 'Jun 1993 | B67: 1453 | C67: =RC[-1]/R65C[-1]*1000 -> 1002.76052449965 | D67: 1001 | E67: =RC[-1] -> 1001 | F67: =RC[-1]/R14C[-1]*1000 -> 2462.56196943973
A68: 'Sep 1993 | D68: 1001 | E68: =RC[-1] -> 1001 | F68: =RC[-1]/R14C[-1]*1000 -> 2462.56196943973
A69: 'Dec 1993 | D69: 1001 | E69: =RC[-1] -> 1001 | F69: =RC[-1]/R14C[-1]*1000 -> 2462.56196943973
A70: 'Mar 1994 | D70: 1001 | E70: =RC[-1] -> 1001 | F70: =RC[-1]/R14C[-1]*1000 -> 2462.56196943973
A71: 'Jun 1994 | D71: 1002 | E71: =RC[-1] -> 1002 | F71: =RC[-1]/R14C[-1]*1000 -> 2465.0220713073
A72: 'Sep 1994 | D72: 1002 | E72: =RC[-1] -> 1002 | F72: =RC[-1]/R14C[-1]*1000 -> 2465.0220713073
A73: 'Dec 1994 | D73: 1002 | E73: =RC[-1] -> 1002 | F73: =RC[-1]/R14C[-1]*1000 -> 2465.0220713073
A74: 'Mar 1995 | D74: 1002 | E74: =RC[-1] -> 1002 | F74: =RC[-1]/R14C[-1]*1000 -> 2465.0220713073
A75: 'Jun 1995 | D75: 1009 | E75: =RC[-1] -> 1009 | F75: =RC[-1]/R14C[-1]*1000 -> 2482.24278438031
A76: 'Sep 1995 | D76: 1011 | E76: =RC[-1] -> 1011 | F76: =RC[-1]/R14C[-1]*1000 -> 2487.16298811545
A77: 'Dec 1995 | D77: 1030 | E77: =RC[-1] -> 1030 | F77: =RC[-1]/R14C[-1]*1000 -> 2533.90492359932
A78: 'Mar 1996 | D78: 1033 | E78: =RC[-1] -> 1033 | F78: =RC[-1]/R14C[-1]*1000 -> 2541.28522920204
A79: 'Jun 1996 | D79: 1033 | E79: =RC[-1] -> 1033 | F79: =RC[-1]/R14C[-1]*1000 -> 2541.28522920204
A80: 'Sep 1996 | D80: 1049 | E80: =RC[-1] -> 1049 | F80: =RC[-1]/R14C[-1]*1000 -> 2580.64685908319
A81: 'Dec 1996 | D81: 1074 | E81: =RC[-1] -> 1074 | F81: =RC[-1]/R14C[-1]*1000 -> 2642.1494057725
A82: 'Mar 1997 | D82: 1097 | E82: =RC[-1] -> 1097 | F82: =RC[-1]/R14C[-1]*1000 -> 2698.73174872666
A83: 'Jun 1997 | D83: 1100 | E83: =RC[-1] -> 1100 | F83: =RC[-1]/R14C[-1]*1000 -> 2706.11205432937
A84: 'Sep 1997 | D84: 1113 | E84: =RC[-1] -> 1113 | F84: =RC[-1]/R14C[-1]*1000 -> 2738.09337860781
A85: 'Dec 1997 | D85: 1114 | E85: =RC[-1] -> 1114 | F85: =RC[-1]/R14C[-1]*1000 -> 2740.55348047538
A86: 'Mar 1998 | D86: 1117 | E86: =RC[-1] -> 1117 | F86: =RC[-1]/R14C[-1]*1000 -> 2747.9337860781
A87: 'Jun 1998 | D87: 1161 | E87: =RC[-1] -> 1161 | F87: =RC[-1]/R14C[-1]*1000 -> 2856.17826825127
A88: 'Sep 1998 | D88: 1162 | E88: =RC[-1] -> 1162 | F88: =RC[-1]/R14C[-1]*1000 -> 2858.63837011885
A89: 'Dec 1998 | D89: 1163 | E89: =RC[-1] -> 1163 | F89: =RC[-1]/R14C[-1]*1000 -> 2861.09847198642
A90: 'Mar 1999 | D90: 1165 | E90: =RC[-1] -> 1165 | F90: =RC[-1]/R14C[-1]*1000 -> 2866.01867572156
A91: 'Jun 1999 | D91: 1166 | E91: =RC[-1] -> 1166 | F91: =RC[-1]/R14C[-1]*1000 -> 2868.47877758913
A92: 'Sep 1999 | D92: 1182 | E92: =RC[-1] -> 1182 | F92: =RC[-1]/R14C[-1]*1000 -> 2907.84040747029
A93: 'Dec 2000 | B93: 'Dec Qtr Telephone Priest 27/6/2000 | D93: 1198 | E93: =RC[-1] -> 1198 | F93: =RC[-1]/R14C[-1]*1000 -> 2947.20203735144
D94: 1200

Sheet: Fundingto1989
A1: 'Operations of Universities grants
A2: 'Fiscal years ending March | B2: 'Nominal expenditure inclusive of GST | D2: 'Nominal expenditure inclusive of GST
B3: '$(million) | D3: '$(million)
A4: '1979/80 | B4: 124.833
A5: '1980/81 | B5: 154.069 | C5: 1980 | D5: =R[-1]C[-2]*1/4+RC[-2]*3/4 -> 146.76 | E5: '(2)
A6: '1981/82 | B6: 182.068 | C6: =1+R[-1]C -> 1981 | D6: =R[-1]C[-2]*1/4+RC[-2]*3/4 -> 175.06825 | E6: '(2)
A7: '1982/83 | B7: 196.263 | C7: =1+R[-1]C -> 1982 | D7: =R[-1]C[-2]*1/4+RC[-2]*3/4 -> 192.71425 | E7: '(2)
A8: '1983/84 | B8: 202.027 | C8: =1+R[-1]C -> 1983 | D8: =R[-1]C[-2]*1/4+RC[-2]*3/4 -> 200.586 | E8: '(2)
A9: '1984/85 | B9: 210.248 | C9: =1+R[-1]C -> 1984 | D9: =R[-1]C[-2]*1/4+RC[-2]*3/4 -> 208.19275 | E9: '(2)
A10: '1985/86 | B10: 277.807 | C10: =1+R[-1]C -> 1985 | D10: =R[-1]C[-2]*1/4+RC[-2]*3/4 -> 260.91725 | E10: '(2)
A11: '1986/87 | B11: 325.043 | C11: =1+R[-1]C -> 1986 | D11: =R[-1]C[-2]*1/4+RC[-2]*3/4 -> 313.234 | E11: '(2)
A12: '1987/88 | B12: 391.265 | C12: =1+R[-1]C -> 1987 | D12: =R[-1]C[-2]*1/4+RC[-2]*3/4 -> 374.7095 | E12: '(2)
C13: =1+R[-1]C -> 1988 | D13: =(105761700+32465700+79517300+54786900+64569000+19776400+83777800)/1000000 -> 440.6548 | E13: '(3)
C14: =1+R[-1]C -> 1989 | D14: =(118145210+36675250+83359830+58687440+72126460+20133080+100177090)/1000000 -> 489.30436 | E14: '(3)
A16: '1) Calendar years 1980 - 1987 expenditure = weighted mean of relevant years ending March, for example, calendar 1980 = 1979/80 @ 0.25 plus 1980/81 @ 0.75
A17: '2) Operations of universities. Estimates of the expenditure of the government of New Zealand.
A18: '3) Deloitte Ross Tohmatsu. Appendix to the report to the Taskforce on PSET Institutional Costing: Cost analysis of institutions & modelling of bulk funding proposals - Stage 2 (1989 data analysis). April1990.

Sheet: CPI
B2: 'CPI: New Zealand: All Groups | C2: 'CPI: New Zealand: All Groups: ANNUAL | D2: 'CPI: New Zealand: All Groups: ANNUAL: INDEX
B3: 'CPIQ.SE9A | C3: 's4 | D3: 's6
B4: 'Jun(Q)99=1000 | C4: 'Jun(Q)99=1000 | D4: '1980=1000
B5: 'Q: Jun-1914: Mar-2000 | C5: 'A: 1926: 1999 | D5: 'A: 1926: 1999
A6: 29281 | B6: 296
A7: 29373 | B7: 308
A8: 29465 | B8: 319
A9: 29556 | B9: 331 | C9: 314 | D9: 1000
A10: 29646 | B10: 341
A11: 29738 | B11: 354
A12: 29830 | B12: 368
A13: 29921 | B13: 383 | C13: 362 | D13: 1153
A14: 30011 | B14: 395
A15: 30103 | B15: 415
A16: 30195 | B16: 429
A17: 30286 | B17: 441 | C17: 420 | D17: 1340
A18: 30376 | B18: 445
A19: 30468 | B19: 449
A20: 30560 | B20: 453
A21: 30651 | B21: 457 | C21: 451 | D21: 1439
A22: 30742 | B22: 460
A23: 30834 | B23: 470
A24: 30926 | B24: 484
A25: 31017 | B25: 500 | C25: 478 | D25: 1526
A26: 31107 | B26: 522
A27: 31199 | B27: 548
A28: 31291 | B28: 563
A29: 31382 | B29: 576 | C29: 552 | D29: 1762
A30: 31472 | B30: 589
A31: 31564 | B31: 605
A32: 31656 | B32: 626
A33: 31747 | B33: 681 | C33: 625 | D33: 1994
A34: 31837 | B34: 697
A35: 31929 | B35: 720
A36: 32021 | B36: 732
A37: 32112 | B37: 747 | C37: 724 | D37: 2309
A38: 32203 | B38: 760
A39: 32295 | B39: 766
A40: 32387 | B40: 773
A41: 32478 | B41: 782 | C41: 770 | D41: 2457
A42: 32568 | B42: 790
A43: 32660 | B43: 800
A44: 32752 | B44: 828
A45: 32843 | B45: 838 | C45: 814 | D45: 2596
A46: 32933 | B46: 846
A47: 33025 | B47: 861
A48: 33117 | B48: 869
A49: 33208 | B49: 879 | C49: 864 | D49: 2755
A50: 33298 | B50: 884
A51: 33390 | B51: 885
A52: 33482 | B52: 888
A53: 33573 | B53: 887 | C53: 886 | D53: 2826
A54: 33664 | B54: 891
A55: 33756 | B55: 894
A56: 33848 | B56: 897
A57: 33939 | B57: 899 | C57: 895 | D57: 2856
A58: 34029 | B58: 900
A59: 34121 | B59: 905
A60: 34213 | B60: 910
A61: 34304 | B61: 912 | C61: 907 | D61: 2892
A62: 34394 | B62: 912
A63: 34486 | B63: 915
A64: 34578 | B64: 926
A65: 34669 | B65: 937 | C65: 922 | D65: 2943
A66: 34759 | B66: 948
A67: 34851 | B67: 957
A68: 34943 | B68: 959
A69: 35034 | B69: 964 | C69: 957 | D69: 3053
A70: 35125 | B70: 969
A71: 35217 | B71: 976
A72: 35309 | B72: 982
A73: 35400 | B73: 989 | C73: 979 | D73: 3123
A74: 35490 | B74: 986
A75: 35582 | B75: 987
A76: 35674 | B76: 992
A77: 35765 | B77: 997 | C77: 990 | D77: 3159
A78: 35855 | B78: 999
A79: 35947 | B79: 1004
A80: 36039 | B80: 1009
A81: 36130 | B81: 1001 | C81: 1003 | D81: 3200
A82: 36220 | B82: 998
A83: 36312 | B83: 1000
A84: 36404 | B84: 1004
A85: 36495 | B85: 1006 | C85: 1002 | D85: 3196
A86: 36586 | B86: 1013

Sheet: @SDF
B1: 'Formula from: https://www.excelforum.com/excel-general/559235-interest-rate-mathematical-formula.html
C2: 'n | D2: 'pmt | E2: 'pv | F2: 'j | G2: 'num | H2: 'den | I2: 'r | J2: 'FV is ignored
A3: =DEFINE("RATE", RC[+1], RC[+2], RC[+3], RC[+4], RC[+9]) -> FUN RATE AT #0 | B3: =IRATE(R[+1]C[+1], R[+1]C[+2], R[+1]C[+3], R[+1]C[+4], R[+1]C[+5], R[+1]C[+6], R[+1]C[+7]) -> -0.938554746777802 | C3: 4 | D3: -200 | E3: 8000 | I3: =RC[-5]/RC[-4] -> -0.025
C4: =R[-1]C -> 4 | D4: =R[-1]C -> -200 | E4: =R[-1]C -> 8000 | F4: 0 | G4: =R[-1]C[-3]*(R[-1]C[+2]+1)*(R[-1]C[+2]+1)^(R[-1]C[-4]-1)^2-R[-1]C[-4]*R[-1]C[-2]*R[-1]C[+2]^2*(R[-1]C[+2]+1)^R[-1]C[-4] -> -185.592076512451 | H4: =(R[-1]C[+1]+1)^R[-1]C[-5]*(R[-1]C[-3]*(R[-1]C[+1]+1)^(R[-1]C[-5]+1)-R[-1]C[-3]*(R[-1]C[-5]*R[-1]C[+1]+R[-1]C[+1]+1)) -> 44.0688341906424 | I4: =RC[-2]/RC[-1] -> -4.21141334734604
A6: =DEFINE("IRATE", RC[+1], RC[+2], RC[+3], RC[+4], RC[+5], RC[+6], RC[+7], RC[+8]) -> FUN IRATE AT #1 | B6: =IF(R[+1]C[+4]>=10, RC[+7], IRATE(R[+1]C[+1], R[+1]C[+2], R[+1]C[+3], R[+1]C[+4], R[+1]C[+5], R[+1]C[+6], R[+1]C[+7])) -> -0.91740708779961 | C6: 4 | D6: -200 | E6: 8000 | F6: 1 | G6: -185 | H6: 44 | I6: -4.21 | J6: "<- Input" | K6: "One iterative step"
C7: =R[-1]C -> 4 | D7: =R[-1]C -> -200 | E7: =R[-1]C -> 8000 | F7: =R[-1]C+1 -> 2 | G7: =R[-1]C[-3]*(R[-1]C[+2]+1)*(R[-1]C[+2]+1)^(R[-1]C[-4]-1)^2-R[-1]C[-4]*R[-1]C[-2]*R[-1]C[+2]^2*(R[-1]C[+2]+1)^R[-1]C[-4] -> -59516736.6038882 | H7: =(R[-1]C[+1]+1)^R[-1]C[-5]*(R[-1]C[-3]*(R[-1]C[+1]+1)^(R[-1]C[-5]+1)-R[-1]C[-3]*(R[-1]C[-5]*R[-1]C[+1]+R[-1]C[+1]+1)) -> -272460755.344203 | I7: =RC[-2]/RC[-1] -> 0.218441501891529 | J7: "<- output"
A9: =DEFINE("F1", RC[+1], RC[+2]) -> FUN F1 AT #2 | B9: =1 -> 1 | D9: =CLOSURE("F1") -> F1