Sheet: One
B1: 'Individuals per Age Group | M1: 'Total
A2: 'Period | B2: 0 | C2: =RC[-1]+1 -> 1 | D2: =RC[-1]+1 -> 2 | E2: =RC[-1]+1 -> 3 | F2: =RC[-1]+1 -> 4 | G2: =RC[-1]+1 -> 5 | H2: =RC[-1]+1 -> 6 | I2: =RC[-1]+1 -> 7 | J2: =RC[-1]+1 -> 8 | K2: =RC[-1]+1 -> 9 | L2: =RC[-1]+1 -> 10
A3: 0 | B3: 0 | C3: 50 | D3: 0 | E3: 0 | F3: 0 | G3: 0 | H3: 0 | I3: 0 | J3: 0 | K3: 0 | L3: 0 | M3: =SUM(RC[-11]:RC[-1]) -> 50
A4: =R[-1]C+1 -> 1 | B4: =R[-1]C[+1]/2*0.5+R[-1]C[+2]/2*1+R[-1]C[+3]/2*0.25+R[-1]C[+4]/2*0.1 -> 12.5 | C4: =R[-1]C[-1] -> 0 | D4: =R[-1]C[-1] -> 50 | E4: =R[-1]C[-1] -> 0 | F4: =R[-1]C[-1] -> 0 | G4: =R[-1]C[-1] -> 0 | H4: =R[-1]C[-1] -> 0 | I4: =R[-1]C[-1] -> 0 | J4: =R[-1]C[-1] -> 0 | K4: =R[-1]C[-1] -> 0 | L4: =R[-1]C[-1] -> 0 | M4: =SUM(RC[-11]:RC[-1]) -> 62.5
A5: =R[-1]C+1 -> 2
A6: =R[-1]C+1 -> 3
A7: =R[-1]C+1 -> 4
A8: =R[-1]C+1 -> 5
A9: =R[-1]C+1 -> 6
A10: =R[-1]C+1 -> 7
A11: =R[-1]C+1 -> 8
A12: =R[-1]C+1 -> 9
A13: =R[-1]C+1 -> 10
A14: =R[-1]C+1 -> 11
A15: =R[-1]C+1 -> 12
A16: =R[-1]C+1 -> 13
A17: =R[-1]C+1 -> 14
A18: =R[-1]C+1 -> 15
A19: =R[-1]C+1 -> 16
A20: =R[-1]C+1 -> 17
A21: =R[-1]C+1 -> 18
A22: =R[-1]C+1 -> 19
A23: =R[-1]C+1 -> 20

Sheet: Two
B1: 'Individuals per Age Group | M1: 'Total
A2: 'Period | B2: 0 | C2: =RC[-1]+1 -> 1 | D2: =RC[-1]+1 -> 2 | E2: =RC[-1]+1 -> 3 | F2: =RC[-1]+1 -> 4 | G2: =RC[-1]+1 -> 5 | H2: =RC[-1]+1 -> 6 | I2: =RC[-1]+1 -> 7 | J2: =RC[-1]+1 -> 8 | K2: =RC[-1]+1 -> 9 | L2: =RC[-1]+1 -> 10
A3: 0 | B3: 0 | C3: 50 | D3: 0 | E3: 0 | F3: 0 | G3: 0 | H3: 0 | I3: 0 | J3: 0 | K3: 0 | L3: 0 | M3: =SUM(RC[-11]:RC[-1]) -> 50
A4: =R[-1]C+1 -> 1 | B4: =INT(INT(R[-1]C[+1]/2)*0.75)+INT(INT(R[-1]C[+2]/2)*1)+INT(INT(R[-1]C[+3]/2)*0.25)+INT(INT(R[-1]C[+4]/2)*0.1) -> 18 | C4: =R[-1]C[-1] -> 0 | D4: =R[-1]C[-1] -> 50 | E4: =R[-1]C[-1] -> 0 | F4: =R[-1]C[-1] -> 0 | G4: =R[-1]C[-1] -> 0 | H4: =R[-1]C[-1] -> 0 | I4: =R[-1]C[-1] -> 0 | J4: =R[-1]C[-1] -> 0 | K4: =R[-1]C[-1] -> 0 | L4: =R[-1]C[-1] -> 0 | M4: =SUM(RC[-11]:RC[-1]) -> 68
A5: =R[-1]C+1 -> 2 | B5: =INT(INT(R[-1]C[+1]/2)*0.75)+INT(INT(R[-1]C[+2]/2)*1)+INT(INT(R[-1]C[+3]/2)*0.25)+INT(INT(R[-1]C[+4]/2)*0.1) -> 25 | C5: =R[-1]C[-1] -> 18 | D5: =R[-1]C[-1] -> 0 | E5: =R[-1]C[-1] -> 50 | F5: =R[-1]C[-1] -> 0 | G5: =R[-1]C[-1] -> 0 | H5: =R[-1]C[-1] -> 0 | I5: =R[-1]C[-1] -> 0 | J5: =R[-1]C[-1] -> 0 | K5: =R[-1]C[-1] -> 0 | L5: =R[-1]C[-1] -> 0 | M5: =SUM(RC[-11]:RC[-1]) -> 93
A6: =R[-1]C+1 -> 3 | B6: =INT(INT(R[-1]C[+1]/2)*0.75)+INT(INT(R[-1]C[+2]/2)*1)+INT(INT(R[-1]C[+3]/2)*0.25)+INT(INT(R[-1]C[+4]/2)*0.1) -> 12 | C6: =R[-1]C[-1] -> 25 | D6: =R[-1]C[-1] -> 18 | E6: =R[-1]C[-1] -> 0 | F6: =R[-1]C[-1] -> 50 | G6: =R[-1]C[-1] -> 0 | H6: =R[-1]C[-1] -> 0 | I6: =R[-1]C[-1] -> 0 | J6: =R[-1]C[-1] -> 0 | K6: =R[-1]C[-1] -> 0 | L6: =R[-1]C[-1] -> 0 | M6: =SUM(RC[-11]:RC[-1]) -> 105
A7: =R[-1]C+1 -> 4 | B7: =INT(INT(R[-1]C[+1]/2)*0.75)+INT(INT(R[-1]C[+2]/2)*1)+INT(INT(R[-1]C[+3]/2)*0.25)+INT(INT(R[-1]C[+4]/2)*0.1) -> 20 | C7: =R[-1]C[-1] -> 12 | D7: =R[-1]C[-1] -> 25 | E7: =R[-1]C[-1] -> 18 | F7: =R[-1]C[-1] -> 0 | G7: =R[-1]C[-1] -> 50 | H7: =R[-1]C[-1] -> 0 | I7: =R[-1]C[-1] -> 0 | J7: =R[-1]C[-1] -> 0 | K7: =R[-1]C[-1] -> 0 | L7: =R[-1]C[-1] -> 0 | M7: =SUM(RC[-11]:RC[-1]) -> 125
A8: =R[-1]C+1 -> 5 | B8: =INT(INT(R[-1]C[+1]/2)*0.75)+INT(INT(R[-1]C[+2]/2)*1)+INT(INT(R[-1]C[+3]/2)*0.25)+INT(INT(R[-1]C[+4]/2)*0.1) -> 18 | C8: =R[-1]C[-1] -> 20 | D8: =R[-1]C[-1] -> 12 | E8: =R[-1]C[-1] -> 25 | F8: =R[-1]C[-1] -> 18 | G8: =R[-1]C[-1] -> 0 | H8: =R[-1]C[-1] -> 50 | I8: =R[-1]C[-1] -> 0 | J8: =R[-1]C[-1] -> 0 | K8: =R[-1]C[-1] -> 0 | L8: =R[-1]C[-1] -> 0 | M8: =SUM(RC[-11]:RC[-1]) -> 143
A9: =R[-1]C+1 -> 6 | B9: =INT(INT(R[-1]C[+1]/2)*0.75)+INT(INT(R[-1]C[+2]/2)*1)+INT(INT(R[-1]C[+3]/2)*0.25)+INT(INT(R[-1]C[+4]/2)*0.1) -> 16 | C9: =R[-1]C[-1] -> 18 | D9: =R[-1]C[-1] -> 20 | E9: =R[-1]C[-1] -> 12 | F9: =R[-1]C[-1] -> 25 | G9: =R[-1]C[-1] -> 18 | H9: =R[-1]C[-1] -> 0 | I9: =R[-1]C[-1] -> 50 | J9: =R[-1]C[-1] -> 0 | K9: =R[-1]C[-1] -> 0 | L9: =R[-1]C[-1] -> 0 | M9: =SUM(RC[-11]:RC[-1]) -> 159
A10: =R[-1]C+1 -> 7 | B10: =INT(INT(R[-1]C[+1]/2)*0.75)+INT(INT(R[-1]C[+2]/2)*1)+INT(INT(R[-1]C[+3]/2)*0.25)+INT(INT(R[-1]C[+4]/2)*0.1) -> 18 | C10: =R[-1]C[-1] -> 16 | D10: =R[-1]C[-1] -> 18 | E10: =R[-1]C[-1] -> 20 | F10: =R[-1]C[-1] -> 12 | G10: =R[-1]C[-1] -> 25 | H10: =R[-1]C[-1] -> 18 | I10: =R[-1]C[-1] -> 0 | J10: =R[-1]C[-1] -> 50 | K10: =R[-1]C[-1] -> 0 | L10: =R[-1]C[-1] -> 0 | M10: =SUM(RC[-11]:RC[-1]) -> 177
A11: =R[-1]C+1 -> 8 | B11: =INT(INT(R[-1]C[+1]/2)*0.75)+INT(INT(R[-1]C[+2]/2)*1)+INT(INT(R[-1]C[+3]/2)*0.25)+INT(INT(R[-1]C[+4]/2)*0.1) -> 17 | C11: =R[-1]C[-1] -> 18 | D11: =R[-1]C[-1] -> 16 | E11: =R[-1]C[-1] -> 18 | F11: =R[-1]C[-1] -> 20 | G11: =R[-1]C[-1] -> 12 | H11: =R[-1]C[-1] -> 25 | I11: =R[-1]C[-1] -> 18 | J11: =R[-1]C[-1] -> 0 | K11: =R[-1]C[-1] -> 50 | L11: =R[-1]C[-1] -> 0 | M11: =SUM(RC[-11]:RC[-1]) -> 194
A12: =R[-1]C+1 -> 9 | B12: =INT(INT(R[-1]C[+1]/2)*0.75)+INT(INT(R[-1]C[+2]/2)*1)+INT(INT(R[-1]C[+3]/2)*0.25)+INT(INT(R[-1]C[+4]/2)*0.1) -> 17 | C12: =R[-1]C[-1] -> 17 | D12: =R[-1]C[-1] -> 18 | E12: =R[-1]C[-1] -> 16 | F12: =R[-1]C[-1] -> 18 | G12: =R[-1]C[-1] -> 20 | H12: =R[-1]C[-1] -> 12 | I12: =R[-1]C[-1] -> 25 | J12: =R[-1]C[-1] -> 18 | K12: =R[-1]C[-1] -> 0 | L12: =R[-1]C[-1] -> 50 | M12: =SUM(RC[-11]:RC[-1]) -> 211
A13: =R[-1]C+1 -> 10 | B13: =INT(INT(R[-1]C[+1]/2)*0.75)+INT(INT(R[-1]C[+2]/2)*1)+INT(INT(R[-1]C[+3]/2)*0.25)+INT(INT(R[-1]C[+4]/2)*0.1) -> 17 | C13: =R[-1]C[-1] -> 17 | D13: =R[-1]C[-1] -> 17 | E13: =R[-1]C[-1] -> 18 | F13: =R[-1]C[-1] -> 16 | G13: =R[-1]C[-1] -> 18 | H13: =R[-1]C[-1] -> 20 | I13: =R[-1]C[-1] -> 12 | J13: =R[-1]C[-1] -> 25 | K13: =R[-1]C[-1] -> 18 | L13: =R[-1]C[-1] -> 0 | M13: =SUM(RC[-11]:RC[-1]) -> 178
A14: =R[-1]C+1 -> 11 | B14: =INT(INT(R[-1]C[+1]/2)*0.75)+INT(INT(R[-1]C[+2]/2)*1)+INT(INT(R[-1]C[+3]/2)*0.25)+INT(INT(R[-1]C[+4]/2)*0.1) -> 16 | C14: =R[-1]C[-1] -> 17 | D14: =R[-1]C[-1] -> 17 | E14: =R[-1]C[-1] -> 17 | F14: =R[-1]C[-1] -> 18 | G14: =R[-1]C[-1] -> 16 | H14: =R[-1]C[-1] -> 18 | I14: =R[-1]C[-1] -> 20 | J14: =R[-1]C[-1] -> 12 | K14: =R[-1]C[-1] -> 25 | L14: =R[-1]C[-1] -> 18 | M14: =SUM(RC[-11]:RC[-1]) -> 194
A15: =R[-1]C+1 -> 12 | B15: =INT(INT(R[-1]C[+1]/2)*0.75)+INT(INT(R[-1]C[+2]/2)*1)+INT(INT(R[-1]C[+3]/2)*0.25)+INT(INT(R[-1]C[+4]/2)*0.1) -> 16 | C15: =R[-1]C[-1] -> 16 | D15: =R[-1]C[-1] -> 17 | E15: =R[-1]C[-1] -> 17 | F15: =R[-1]C[-1] -> 17 | G15: =R[-1]C[-1] -> 18 | H15: =R[-1]C[-1] -> 16 | I15: =R[-1]C[-1] -> 18 | J15: =R[-1]C[-1] -> 20 | K15: =R[-1]C[-1] -> 12 | L15: =R[-1]C[-1] -> 25 | M15: =SUM(RC[-11]:RC[-1]) -> 192
A16: =R[-1]C+1 -> 13 | B16: =INT(INT(R[-1]C[+1]/2)*0.75)+INT(INT(R[-1]C[+2]/2)*1)+INT(INT(R[-1]C[+3]/2)*0.25)+INT(INT(R[-1]C[+4]/2)*0.1) -> 16 | C16: =R[-1]C[-1] -> 16 | D16: =R[-1]C[-1] -> 16 | E16: =R[-1]C[-1] -> 17 | F16: =R[-1]C[-1] -> 17 | G16: =R[-1]C[-1] -> 17 | H16: =R[-1]C[-1] -> 18 | I16: =R[-1]C[-1] -> 16 | J16: =R[-1]C[-1] -> 18 | K16: =R[-1]C[-1] -> 20 | L16: =R[-1]C[-1] -> 12 | M16: =SUM(RC[-11]:RC[-1]) -> 183
A17: =R[-1]C+1 -> 14 | B17: =INT(INT(R[-1]C[+1]/2)*0.75)+INT(INT(R[-1]C[+2]/2)*1)+INT(INT(R[-1]C[+3]/2)*0.25)+INT(INT(R[-1]C[+4]/2)*0.1) -> 16 | C17: =R[-1]C[-1] -> 16 | D17: =R[-1]C[-1] -> 16 | E17: =R[-1]C[-1] -> 16 | F17: =R[-1]C[-1] -> 17 | G17: =R[-1]C[-1] -> 17 | H17: =R[-1]C[-1] -> 17 | I17: =R[-1]C[-1] -> 18 | J17: =R[-1]C[-1] -> 16 | K17: =R[-1]C[-1] -> 18 | L17: =R[-1]C[-1] -> 20 | M17: =SUM(RC[-11]:RC[-1]) -> 187
A18: =R[-1]C+1 -> 15 | B18: =INT(INT(R[-1]C[+1]/2)*0.75)+INT(INT(R[-1]C[+2]/2)*1)+INT(INT(R[-1]C[+3]/2)*0.25)+INT(INT(R[-1]C[+4]/2)*0.1) -> 16 | C18: =R[-1]C[-1] -> 16 | D18: =R[-1]C[-1] -> 16 | E18: =R[-1]C[-1] -> 16 | F18: =R[-1]C[-1] -> 16 | G18: =R[-1]C[-1] -> 17 | H18: =R[-1]C[-1] -> 17 | I18: =R[-1]C[-1] -> 17 | J18: =R[-1]C[-1] -> 18 | K18: =R[-1]C[-1] -> 16 | L18: =R[-1]C[-1] -> 18 | M18: =SUM(RC[-11]:RC[-1]) -> 183
A19: =R[-1]C+1 -> 16 | B19: =INT(INT(R[-1]C[+1]/2)*0.75)+INT(INT(R[-1]C[+2]/2)*1)+INT(INT(R[-1]C[+3]/2)*0.25)+INT(INT(R[-1]C[+4]/2)*0.1) -> 16 | C19: =R[-1]C[-1] -> 16 | D19: =R[-1]C[-1] -> 16 | E19: =R[-1]C[-1] -> 16 | F19: =R[-1]C[-1] -> 16 | G19: =R[-1]C[-1] -> 16 | H19: =R[-1]C[-1] -> 17 | I19: =R[-1]C[-1] -> 17 | J19: =R[-1]C[-1] -> 17 | K19: =R[-1]C[-1] -> 18 | L19: =R[-1]C[-1] -> 16 | M19: =SUM(RC[-11]:RC[-1]) -> 181
A20: =R[-1]C+1 -> 17 | B20: =INT(INT(R[-1]C[+1]/2)*0.75)+INT(INT(R[-1]C[+2]/2)*1)+INT(INT(R[-1]C[+3]/2)*0.25)+INT(INT(R[-1]C[+4]/2)*0.1) -> 16 | C20: =R[-1]C[-1] -> 16 | D20: =R[-1]C[-1] -> 16 | E20: =R[-1]C[-1] -> 16 | F20: =R[-1]C[-1] -> 16 | G20: =R[-1]C[-1] -> 16 | H20: =R[-1]C[-1] -> 16 | I20: =R[-1]C[-1] -> 17 | J20: =R[-1]C[-1] -> 17 | K20: =R[-1]C[-1] -> 17 | L20: =R[-1]C[-1] -> 18 | M20: =SUM(RC[-11]:RC[-1]) -> 181
A21: =R[-1]C+1 -> 18 | B21: =INT(INT(R[-1]C[+1]/2)*0.75)+INT(INT(R[-1]C[+2]/2)*1)+INT(INT(R[-1]C[+3]/2)*0.25)+INT(INT(R[-1]C[+4]/2)*0.1) -> 16 | C21: =R[-1]C[-1] -> 16 | D21: =R[-1]C[-1] -> 16 | E21: =R[-1]C[-1] -> 16 | F21: =R[-1]C[-1] -> 16 | G21: =R[-1]C[-1] -> 16 | H21: =R[-1]C[-1] -> 16 | I21: =R[-1]C[-1] -> 16 | J21: =R[-1]C[-1] -> 17 | K21: =R[-1]C[-1] -> 17 | L21: =R[-1]C[-1] -> 17 | M21: =SUM(RC[-11]:RC[-1]) -> 179
A22: =R[-1]C+1 -> 19 | B22: =INT(INT(R[-1]C[+1]/2)*0.75)+INT(INT(R[-1]C[+2]/2)*1)+INT(INT(R[-1]C[+3]/2)*0.25)+INT(INT(R[-1]C[+4]/2)*0.1) -> 16 | C22: =R[-1]C[-1] -> 16 | D22: =R[-1]C[-1] -> 16 | E22: =R[-1]C[-1] -> 16 | F22: =R[-1]C[-1] -> 16 | G22: =R[-1]C[-1] -> 16 | H22: =R[-1]C[-1] -> 16 | I22: =R[-1]C[-1] -> 16 | J22: =R[-1]C[-1] -> 16 | K22: =R[-1]C[-1] -> 17 | L22: =R[-1]C[-1] -> 17 | M22: =SUM(RC[-11]:RC[-1]) -> 178
A23: =R[-1]C+1 -> 20 | B23: =INT(INT(R[-1]C[+1]/2)*0.75)+INT(INT(R[-1]C[+2]/2)*1)+INT(INT(R[-1]C[+3]/2)*0.25)+INT(INT(R[-1]C[+4]/2)*0.1) -> 16 | C23: =R[-1]C[-1] -> 16 | D23: =R[-1]C[-1] -> 16 | E23: =R[-1]C[-1] -> 16 | F23: =R[-1]C[-1] -> 16 | G23: =R[-1]C[-1] -> 16 | H23: =R[-1]C[-1] -> 16 | I23: =R[-1]C[-1] -> 16 | J23: =R[-1]C[-1] -> 16 | K23: =R[-1]C[-1] -> 16 | L23: =R[-1]C[-1] -> 17 | M23: =SUM(RC[-11]:RC[-1]) -> 177

Sheet: Two.B
B1: 'Individuals per Age Group | M1: 'Total
A2: 'Period | B2: 0 | C2: =RC[-1]+1 -> 1 | D2: =RC[-1]+1 -> 2 | E2: =RC[-1]+1 -> 3 | F2: =RC[-1]+1 -> 4 | G2: =RC[-1]+1 -> 5 | H2: =RC[-1]+1 -> 6 | I2: =RC[-1]+1 -> 7 | J2: =RC[-1]+1 -> 8 | K2: =RC[-1]+1 -> 9 | L2: =RC[-1]+1 -> 10
A3: 0 | B3: 0 | C3: 50 | D3: 0 | E3: 0 | F3: 0 | G3: 0 | H3: 0 | I3: 0 | J3: 0 | K3: 0 | L3: 0 | M3: =SUM(RC[-11]:RC[-1]) -> 50
A4: =R[-1]C+1 -> 1 | B4: =ROUND(INT(R[-1]C[+1]/2)*0.75, 0)+ROUND(INT(R[-1]C[+2]/2)*1, 0)+ROUND(INT(R[-1]C[+3]/2)*0.25, 0)+ROUND(INT(R[-1]C[+4]/2)*0.1, 0) -> 19 | C4: =R[-1]C[-1] -> 0 | D4: =R[-1]C[-1] -> 50 | E4: =R[-1]C[-1] -> 0 | F4: =R[-1]C[-1] -> 0 | G4: =R[-1]C[-1] -> 0 | H4: =R[-1]C[-1] -> 0 | I4: =R[-1]C[-1] -> 0 | J4: =R[-1]C[-1] -> 0 | K4: =R[-1]C[-1] -> 0 | L4: =R[-1]C[-1] -> 0 | M4: =SUM(RC[-11]:RC[-1]) -> 69
A5: =R[-1]C+1 -> 2 | B5: =ROUND(INT(R[-1]C[+1]/2)*0.75, 0)+ROUND(INT(R[-1]C[+2]/2)*1, 0)+ROUND(INT(R[-1]C[+3]/2)*0.25, 0)+ROUND(INT(R[-1]C[+4]/2)*0.1, 0) -> 25 | C5: =R[-1]C[-1] -> 19 | D5: =R[-1]C[-1] -> 0 | E5: =R[-1]C[-1] -> 50 | F5: =R[-1]C[-1] -> 0 | G5: =R[-1]C[-1] -> 0 | H5: =R[-1]C[-1] -> 0 | I5: =R[-1]C[-1] -> 0 | J5: =R[-1]C[-1] -> 0 | K5: =R[-1]C[-1] -> 0 | L5: =R[-1]C[-1] -> 0 | M5: =SUM(RC[-11]:RC[-1]) -> 94
A6: =R[-1]C+1 -> 3 | B6: =ROUND(INT(R[-1]C[+1]/2)*0.75, 0)+ROUND(INT(R[-1]C[+2]/2)*1, 0)+ROUND(INT(R[-1]C[+3]/2)*0.25, 0)+ROUND(INT(R[-1]C[+4]/2)*0.1, 0) -> 13 | C6: =R[-1]C[-1] -> 25 | D6: =R[-1]C[-1] -> 19 | E6: =R[-1]C[-1] -> 0 | F6: =R[-1]C[-1] -> 50 | G6: =R[-1]C[-1] -> 0 | H6: =R[-1]C[-1] -> 0 | I6: =R[-1]C[-1] -> 0 | J6: =R[-1]C[-1] -> 0 | K6: =R[-1]C[-1] -> 0 | L6: =R[-1]C[-1] -> 0 | M6: =SUM(RC[-11]:RC[-1]) -> 107
A7: =R[-1]C+1 -> 4 | B7: =ROUND(INT(R[-1]C[+1]/2)*0.75, 0)+ROUND(INT(R[-1]C[+2]/2)*1, 0)+ROUND(INT(R[-1]C[+3]/2)*0.25, 0)+ROUND(INT(R[-1]C[+4]/2)*0.1, 0) -> 21 | C7: =R[-1]C[-1] -> 13 | D7: =R[-1]C[-1] -> 25 | E7: =R[-1]C[-1] -> 19 | F7: =R[-1]C[-1] -> 0 | G7: =R[-1]C[-1] -> 50 | H7: =R[-1]C[-1] -> 0 | I7: =R[-1]C[-1] -> 0 | J7: =R[-1]C[-1] -> 0 | K7: =R[-1]C[-1] -> 0 | L7: =R[-1]C[-1] -> 0 | M7: =SUM(RC[-11]:RC[-1]) -> 128
A8: =R[-1]C+1 -> 5 | B8: =ROUND(INT(R[-1]C[+1]/2)*0.75, 0)+ROUND(INT(R[-1]C[+2]/2)*1, 0)+ROUND(INT(R[-1]C[+3]/2)*0.25, 0)+ROUND(INT(R[-1]C[+4]/2)*0.1, 0) -> 19 | C8: =R[-1]C[-1] -> 21 | D8: =R[-1]C[-1] -> 13 | E8: =R[-1]C[-1] -> 25 | F8: =R[-1]C[-1] -> 19 | G8: =R[-1]C[-1] -> 0 | H8: =R[-1]C[-1] -> 50 | I8: =R[-1]C[-1] -> 0 | J8: =R[-1]C[-1] -> 0 | K8: =R[-1]C[-1] -> 0 | L8: =R[-1]C[-1] -> 0 | M8: =SUM(RC[-11]:RC[-1]) -> 147
A9: =R[-1]C+1 -> 6 | B9: =ROUND(INT(R[-1]C[+1]/2)*0.75, 0)+ROUND(INT(R[-1]C[+2]/2)*1, 0)+ROUND(INT(R[-1]C[+3]/2)*0.25, 0)+ROUND(INT(R[-1]C[+4]/2)*0.1, 0) -> 18 | C9: =R[-1]C[-1] -> 19 | D9: =R[-1]C[-1] -> 21 | E9: =R[-1]C[-1] -> 13 | F9: =R[-1]C[-1] -> 25 | G9: =R[-1]C[-1] -> 19 | H9: =R[-1]C[-1] -> 0 | I9: =R[-1]C[-1] -> 50 | J9: =R[-1]C[-1] -> 0 | K9: =R[-1]C[-1] -> 0 | L9: =R[-1]C[-1] -> 0 | M9: =SUM(RC[-11]:RC[-1]) -> 165
A10: =R[-1]C+1 -> 7 | B10: =ROUND(INT(R[-1]C[+1]/2)*0.75, 0)+ROUND(INT(R[-1]C[+2]/2)*1, 0)+ROUND(INT(R[-1]C[+3]/2)*0.25, 0)+ROUND(INT(R[-1]C[+4]/2)*0.1, 0) -> 20 | C10: =R[-1]C[-1] -> 18 | D10: =R[-1]C[-1] -> 19 | E10: =R[-1]C[-1] -> 21 | F10: =R[-1]C[-1] -> 13 | G10: =R[-1]C[-1] -> 25 | H10: =R[-1]C[-1] -> 19 | I10: =R[-1]C[-1] -> 0 | J10: =R[-1]C[-1] -> 50 | K10: =R[-1]C[-1] -> 0 | L10: =R[-1]C[-1] -> 0 | M10: =SUM(RC[-11]:RC[-1]) -> 185
A11: =R[-1]C+1 -> 8 | B11: =ROUND(INT(R[-1]C[+1]/2)*0.75, 0)+ROUND(INT(R[-1]C[+2]/2)*1, 0)+ROUND(INT(R[-1]C[+3]/2)*0.25, 0)+ROUND(INT(R[-1]C[+4]/2)*0.1, 0) -> 20 | C11: =R[-1]C[-1] -> 20 | D11: =R[-1]C[-1] -> 18 | E11: =R[-1]C[-1] -> 19 | F11: =R[-1]C[-1] -> 21 | G11: =R[-1]C[-1] -> 13 | H11: =R[-1]C[-1] -> 25 | I11: =R[-1]C[-1] -> 19 | J11: =R[-1]C[-1] -> 0 | K11: =R[-1]C[-1] -> 50 | L11: =R[-1]C[-1] -> 0 | M11: =SUM(RC[-11]:RC[-1]) -> 205
A12: =R[-1]C+1 -> 9 | B12: =ROUND(INT(R[-1]C[+1]/2)*0.75, 0)+ROUND(INT(R[-1]C[+2]/2)*1, 0)+ROUND(INT(R[-1]C[+3]/2)*0.25, 0)+ROUND(INT(R[-1]C[+4]/2)*0.1, 0) -> 20 | C12: =R[-1]C[-1] -> 20 | D12: =R[-1]C[-1] -> 20 | E12: =R[-1]C[-1] -> 18 | F12: =R[-1]C[-1] -> 19 | G12: =R[-1]C[-1] -> 21 | H12: =R[-1]C[-1] -> 13 | I12: =R[-1]C[-1] -> 25 | J12: =R[-1]C[-1] -> 19 | K12: =R[-1]C[-1] -> 0 | L12: =R[-1]C[-1] -> 50 | M12: =SUM(RC[-11]:RC[-1]) -> 225
A13: =R[-1]C+1 -> 10 | B13: =ROUND(INT(R[-1]C[+1]/2)*0.75, 0)+ROUND(INT(R[-1]C[+2]/2)*1, 0)+ROUND(INT(R[-1]C[+3]/2)*0.25, 0)+ROUND(INT(R[-1]C[+4]/2)*0.1, 0) -> 21 | C13: =R[-1]C[-1] -> 20 | D13: =R[-1]C[-1] -> 20 | E13: =R[-1]C[-1] -> 20 | F13: =R[-1]C[-1] -> 18 | G13: =R[-1]C[-1] -> 19 | H13: =R[-1]C[-1] -> 21 | I13: =R[-1]C[-1] -> 13 | J13: =R[-1]C[-1] -> 25 | K13: =R[-1]C[-1] -> 19 | L13: =R[-1]C[-1] -> 0 | M13: =SUM(RC[-11]:RC[-1]) -> 196
A14: =R[-1]C+1 -> 11 | B14: =ROUND(INT(R[-1]C[+1]/2)*0.75, 0)+ROUND(INT(R[-1]C[+2]/2)*1, 0)+ROUND(INT(R[-1]C[+3]/2)*0.25, 0)+ROUND(INT(R[-1]C[+4]/2)*0.1, 0) -> 22 | C14: =R[-1]C[-1] -> 21 | D14: =R[-1]C[-1] -> 20 | E14: =R[-1]C[-1] -> 20 | F14: =R[-1]C[-1] -> 20 | G14: =R[-1]C[-1] -> 18 | H14: =R[-1]C[-1] -> 19 | I14: =R[-1]C[-1] -> 21 | J14: =R[-1]C[-1] -> 13 | K14: =R[-1]C[-1] -> 25 | L14: =R[-1]C[-1] -> 19 | M14: =SUM(RC[-11]:RC[-1]) -> 218
A15: =R[-1]C+1 -> 12 | B15: =ROUND(INT(R[-1]C[+1]/2)*0.75, 0)+ROUND(INT(R[-1]C[+2]/2)*1, 0)+ROUND(INT(R[-1]C[+3]/2)*0.25, 0)+ROUND(INT(R[-1]C[+4]/2)*0.1, 0) -> 22 | C15: =R[-1]C[-1] -> 22 | D15: =R[-1]C[-1] -> 21 | E15: =R[-1]C[-1] -> 20 | F15: =R[-1]C[-1] -> 20 | G15: =R[-1]C[-1] -> 20 | H15: =R[-1]C[-1] -> 18 | I15: =R[-1]C[-1] -> 19 | J15: =R[-1]C[-1] -> 21 | K15: =R[-1]C[-1] -> 13 | L15: =R[-1]C[-1] -> 25 | M15: =SUM(RC[-11]:RC[-1]) -> 221
A16: =R[-1]C+1 -> 13 | B16: =ROUND(INT(R[-1]C[+1]/2)*0.75, 0)+ROUND(INT(R[-1]C[+2]/2)*1, 0)+ROUND(INT(R[-1]C[+3]/2)*0.25, 0)+ROUND(INT(R[-1]C[+4]/2)*0.1, 0) -> 22 | C16: =R[-1]C[-1] -> 22 | D16: =R[-1]C[-1] -> 22 | E16: =R[-1]C[-1] -> 21 | F16: =R[-1]C[-1] -> 20 | G16: =R[-1]C[-1] -> 20 | H16: =R[-1]C[-1] -> 20 | I16: =R[-1]C[-1] -> 18 | J16: =R[-1]C[-1] -> 19 | K16: =R[-1]C[-1] -> 21 | L16: =R[-1]C[-1] -> 13 | M16: =SUM(RC[-11]:RC[-1]) -> 218
A17: =R[-1]C+1 -> 14 | B17: =ROUND(INT(R[-1]C[+1]/2)*0.75, 0)+ROUND(INT(R[-1]C[+2]/2)*1, 0)+ROUND(INT(R[-1]C[+3]/2)*0.25, 0)+ROUND(INT(R[-1]C[+4]/2)*0.1, 0) -> 23 | C17: =R[-1]C[-1] -> 22 | D17: =R[-1]C[-1] -> 22 | E17: =R[-1]C[-1] -> 22 | F17: =R[-1]C[-1] -> 21 | G17: =R[-1]C[-1] -> 20 | H17: =R[-1]C[-1] -> 20 | I17: =R[-1]C[-1] -> 20 | J17: =R[-1]C[-1] -> 18 | K17: =R[-1]C[-1] -> 19 | L17: =R[-1]C[-1] -> 21 | M17: =SUM(RC[-11]:RC[-1]) -> 228
A18: =R[-1]C+1 -> 15 | B18: =ROUND(INT(R[-1]C[+1]/2)*0.75, 0)+ROUND(INT(R[-1]C[+2]/2)*1, 0)+ROUND(INT(R[-1]C[+3]/2)*0.25, 0)+ROUND(INT(R[-1]C[+4]/2)*0.1, 0) -> 23 | C18: =R[-1]C[-1] -> 23 | D18: =R[-1]C[-1] -> 22 | E18: =R[-1]C[-1] -> 22 | F18: =R[-1]C[-1] -> 22 | G18: =R[-1]C[-1] -> 21 | H18: =R[-1]C[-1] -> 20 | I18: =R[-1]C[-1] -> 20 | J18: =R[-1]C[-1] -> 20 | K18: =R[-1]C[-1] -> 18 | L18: =R[-1]C[-1] -> 19 | M18: =SUM(RC[-11]:RC[-1]) -> 230
A19: =R[-1]C+1 -> 16 | B19: =ROUND(INT(R[-1]C[+1]/2)*0.75, 0)+ROUND(INT(R[-1]C[+2]/2)*1, 0)+ROUND(INT(R[-1]C[+3]/2)*0.25, 0)+ROUND(INT(R[-1]C[+4]/2)*0.1, 0) -> 23 | C19: =R[-1]C[-1] -> 23 | D19: =R[-1]C[-1] -> 23 | E19: =R[-1]C[-1] -> 22 | F19: =R[-1]C[-1] -> 22 | G19: =R[-1]C[-1] -> 22 | H19: =R[-1]C[-1] -> 21 | I19: =R[-1]C[-1] -> 20 | J19: =R[-1]C[-1] -> 20 | K19: =R[-1]C[-1] -> 20 | L19: =R[-1]C[-1] -> 18 | M19: =SUM(RC[-11]:RC[-1]) -> 234
A20: =R[-1]C+1 -> 17 | B20: =ROUND(INT(R[-1]C[+1]/2)*0.75, 0)+ROUND(INT(R[-1]C[+2]/2)*1, 0)+ROUND(INT(R[-1]C[+3]/2)*0.25, 0)+ROUND(INT(R[-1]C[+4]/2)*0.1, 0) -> 23 | C20: =R[-1]C[-1] -> 23 | D20: =R[-1]C[-1] -> 23 | E20: =R[-1]C[-1] -> 23 | F20: =R[-1]C[-1] -> 22 | G20: =R[-1]C[-1] -> 22 | H20: =R[-1]C[-1] -> 22 | I20: =R[-1]C[-1] -> 21 | J20: =R[-1]C[-1] -> 20 | K20: =R[-1]C[-1] -> 20 | L20: =R[-1]C[-1] -> 20 | M20: =SUM(RC[-11]:RC[-1]) -> 239
A21: =R[-1]C+1 -> 18 | B21: =ROUND(INT(R[-1]C[+1]/2)*0.75, 0)+ROUND(INT(R[-1]C[+2]/2)*1, 0)+ROUND(INT(R[-1]C[+3]/2)*0.25, 0)+ROUND(INT(R[-1]C[+4]/2)*0.1, 0) -> 23 | C21: =R[-1]C[-1] -> 23 | D21: =R[-1]C[-1] -> 23 | E21: =R[-1]C[-1] -> 23 | F21: =R[-1]C[-1] -> 23 | G21: =R[-1]C[-1] -> 22 | H21: =R[-1]C[-1] -> 22 | I21: =R[-1]C[-1] -> 22 | J21: =R[-1]C[-1] -> 21 | K21: =R[-1]C[-1] -> 20 | L21: =R[-1]C[-1] -> 20 | M21: =SUM(RC[-11]:RC[-1]) -> 242
A22: =R[-1]C+1 -> 19 | B22: =ROUND(INT(R[-1]C[+1]/2)*0.75, 0)+ROUND(INT(R[-1]C[+2]/2)*1, 0)+ROUND(INT(R[-1]C[+3]/2)*0.25, 0)+ROUND(INT(R[-1]C[+4]/2)*0.1, 0) -> 23 | C22: =R[-1]C[-1] -> 23 | D22: =R[-1]C[-1] -> 23 | E22: =R[-1]C[-1] -> 23 | F22: =R[-1]C[-1] -> 23 | G22: =R[-1]C[-1] -> 23 | H22: =R[-1]C[-1] -> 22 | I22: =R[-1]C[-1] -> 22 | J22: =R[-1]C[-1] -> 22 | K22: =R[-1]C[-1] -> 21 | L22: =R[-1]C[-1] -> 20 | M22: =SUM(RC[-11]:RC[-1]) -> 245
A23: =R[-1]C+1 -> 20 | B23: =ROUND(INT(R[-1]C[+1]/2)*0.75, 0)+ROUND(INT(R[-1]C[+2]/2)*1, 0)+ROUND(INT(R[-1]C[+3]/2)*0.25, 0)+ROUND(INT(R[-1]C[+4]/2)*0.1, 0) -> 23 | C23: =R[-1]C[-1] -> 23 | D23: =R[-1]C[-1] -> 23 | E23: =R[-1]C[-1] -> 23 | F23: =R[-1]C[-1] -> 23 | G23: =R[-1]C[-1] -> 23 | H23: =R[-1]C[-1] -> 23 | I23: =R[-1]C[-1] -> 22 | J23: =R[-1]C[-1] -> 22 | K23: =R[-1]C[-1] -> 22 | L23: =R[-1]C[-1] -> 21 | M23: =SUM(RC[-11]:RC[-1]) -> 248
Y24: 281421906 | Z24: '04/01/2000 population

Sheet: Three
B1: 'Individuals per Age Group | M1: 'Total | O1: 0 | P1: =RC[-1]+1 -> 1 | Q1: =RC[-1]+1 -> 2 | R1: =RC[-1]+1 -> 3 | S1: =RC[-1]+1 -> 4 | T1: =RC[-1]+1 -> 5 | U1: =RC[-1]+1 -> 6 | V1: =RC[-1]+1 -> 7 | W1: =RC[-1]+1 -> 8 | X1: =RC[-1]+1 -> 9
A2: 'Period | B2: 0 | C2: =RC[-1]+1 -> 1 | D2: =RC[-1]+1 -> 2 | E2: =RC[-1]+1 -> 3 | F2: =RC[-1]+1 -> 4 | G2: =RC[-1]+1 -> 5 | H2: =RC[-1]+1 -> 6 | I2: =RC[-1]+1 -> 7 | J2: =RC[-1]+1 -> 8 | K2: =RC[-1]+1 -> 9 | L2: =RC[-1]+1 -> 10 | N2: 'Survival Rates | O2: 0.99095 | P2: 0.995549725011353 | Q2: 0.990289293895838 | R2: 0.986202096298723 | S2: 0.970658446464898 | T2: 0.935575966895136 | U2: 0.85215324129103 | V2: 0.684482296137339 | W2: 0.369138826295679 | X2: 0.0945910080152874
A3: 0 | B3: 0 | C3: 50 | D3: 0 | E3: 0 | F3: 0 | G3: 0 | H3: 0 | I3: 0 | J3: 0 | K3: 0 | L3: 0 | M3: =SUM(RC[-11]:RC[-1]) -> 50
A4: =R[-1]C+1 -> 1 | B4: =ROUND(INT(R[-1]C[+1]/2)*0.75, 0)+ROUND(INT(R[-1]C[+2]/2)*1, 0)+ROUND(INT(R[-1]C[+3]/2)*0.25, 0)+ROUND(INT(R[-1]C[+4]/2)*0.1, 0) -> 19 | C4: =R[-1]C[-1]*R2C[+12] -> 0 | D4: =R[-1]C[-1]*R2C[+12] -> 49.7774862505676 | E4: =R[-1]C[-1]*R2C[+12] -> 0 | F4: =R[-1]C[-1]*R2C[+12] -> 0 | G4: =R[-1]C[-1]*R2C[+12] -> 0 | H4: =R[-1]C[-1]*R2C[+12] -> 0 | I4: =R[-1]C[-1]*R2C[+12] -> 0 | J4: =R[-1]C[-1]*R2C[+12] -> 0 | K4: =R[-1]C[-1]*R2C[+12] -> 0 | L4: =R[-1]C[-1]*R2C[+12] -> 0 | M4: =SUM(RC[-11]:RC[-1]) -> 68.7774862505676
A5: =R[-1]C+1 -> 2 | B5: =ROUND(INT(R[-1]C[+1]/2)*0.75, 0)+ROUND(INT(R[-1]C[+2]/2)*1, 0)+ROUND(INT(R[-1]C[+3]/2)*0.25, 0)+ROUND(INT(R[-1]C[+4]/2)*0.1, 0) -> 24 | C5: =R[-1]C[-1]*R2C[+12] -> 18.82805 | D5: =R[-1]C[-1]*R2C[+12] -> 0 | E5: =R[-1]C[-1]*R2C[+12] -> 49.2941117109844 | F5: =R[-1]C[-1]*R2C[+12] -> 0 | G5: =R[-1]C[-1]*R2C[+12] -> 0 | H5: =R[-1]C[-1]*R2C[+12] -> 0 | I5: =R[-1]C[-1]*R2C[+12] -> 0 | J5: =R[-1]C[-1]*R2C[+12] -> 0 | K5: =R[-1]C[-1]*R2C[+12] -> 0 | L5: =R[-1]C[-1]*R2C[+12] -> 0 | M5: =SUM(RC[-11]:RC[-1]) -> 92.1221617109844
A6: =R[-1]C+1 -> 3 | B6: =ROUND(INT(R[-1]C[+1]/2)*0.75, 0)+ROUND(INT(R[-1]C[+2]/2)*1, 0)+ROUND(INT(R[-1]C[+3]/2)*0.25, 0)+ROUND(INT(R[-1]C[+4]/2)*0.1, 0) -> 13 | C6: =R[-1]C[-1]*R2C[+12] -> 23.7828 | D6: =R[-1]C[-1]*R2C[+12] -> 18.74426 | E6: =R[-1]C[-1]*R2C[+12] -> 0 | F6: =R[-1]C[-1]*R2C[+12] -> 48.6139563045563 | G6: =R[-1]C[-1]*R2C[+12] -> 0 | H6: =R[-1]C[-1]*R2C[+12] -> 0 | I6: =R[-1]C[-1]*R2C[+12] -> 0 | J6: =R[-1]C[-1]*R2C[+12] -> 0 | K6: =R[-1]C[-1]*R2C[+12] -> 0 | L6: =R[-1]C[-1]*R2C[+12] -> 0 | M6: =SUM(RC[-11]:RC[-1]) -> 104.141016304556
A7: =R[-1]C+1 -> 4 | B7: =ROUND(INT(R[-1]C[+1]/2)*0.75, 0)+ROUND(INT(R[-1]C[+2]/2)*1, 0)+ROUND(INT(R[-1]C[+3]/2)*0.25, 0)+ROUND(INT(R[-1]C[+4]/2)*0.1, 0) -> 19 | C7: =R[-1]C[-1]*R2C[+12] -> 12.88235 | D7: =R[-1]C[-1]*R2C[+12] -> 23.67696 | E7: =R[-1]C[-1]*R2C[+12] -> 18.56224 | F7: =R[-1]C[-1]*R2C[+12] -> 0 | G7: =R[-1]C[-1]*R2C[+12] -> 47.187547303093 | H7: =R[-1]C[-1]*R2C[+12] -> 0 | I7: =R[-1]C[-1]*R2C[+12] -> 0 | J7: =R[-1]C[-1]*R2C[+12] -> 0 | K7: =R[-1]C[-1]*R2C[+12] -> 0 | L7: =R[-1]C[-1]*R2C[+12] -> 0 | M7: =SUM(RC[-11]:RC[-1]) -> 121.309097303093
A8: =R[-1]C+1 -> 5 | B8: =ROUND(INT(R[-1]C[+1]/2)*0.75, 0)+ROUND(INT(R[-1]C[+2]/2)*1, 0)+ROUND(INT(R[-1]C[+3]/2)*0.25, 0)+ROUND(INT(R[-1]C[+4]/2)*0.1, 0) -> 18 | C8: =R[-1]C[-1]*R2C[+12] -> 18.82805 | D8: =R[-1]C[-1]*R2C[+12] -> 12.82502 | E8: =R[-1]C[-1]*R2C[+12] -> 23.44704 | F8: =R[-1]C[-1]*R2C[+12] -> 18.30612 | G8: =R[-1]C[-1]*R2C[+12] -> 0 | H8: =R[-1]C[-1]*R2C[+12] -> 44.1475351935012 | I8: =R[-1]C[-1]*R2C[+12] -> 0 | J8: =R[-1]C[-1]*R2C[+12] -> 0 | K8: =R[-1]C[-1]*R2C[+12] -> 0 | L8: =R[-1]C[-1]*R2C[+12] -> 0 | M8: =SUM(RC[-11]:RC[-1]) -> 135.553765193501
A9: =R[-1]C+1 -> 6 | B9: =ROUND(INT(R[-1]C[+1]/2)*0.75, 0)+ROUND(INT(R[-1]C[+2]/2)*1, 0)+ROUND(INT(R[-1]C[+3]/2)*0.25, 0)+ROUND(INT(R[-1]C[+4]/2)*0.1, 0) -> 17 | C9: =R[-1]C[-1]*R2C[+12] -> 17.8371 | D9: =R[-1]C[-1]*R2C[+12] -> 18.74426 | E9: =R[-1]C[-1]*R2C[+12] -> 12.70048 | F9: =R[-1]C[-1]*R2C[+12] -> 23.12352 | G9: =R[-1]C[-1]*R2C[+12] -> 17.76899 | H9: =R[-1]C[-1]*R2C[+12] -> 0 | I9: =R[-1]C[-1]*R2C[+12] -> 37.6204652101519 | J9: =R[-1]C[-1]*R2C[+12] -> 0 | K9: =R[-1]C[-1]*R2C[+12] -> 0 | L9: =R[-1]C[-1]*R2C[+12] -> 0 | M9: =SUM(RC[-11]:RC[-1]) -> 144.794815210152
A10: =R[-1]C+1 -> 7 | B10: =ROUND(INT(R[-1]C[+1]/2)*0.75, 0)+ROUND(INT(R[-1]C[+2]/2)*1, 0)+ROUND(INT(R[-1]C[+3]/2)*0.25, 0)+ROUND(INT(R[-1]C[+4]/2)*0.1, 0) -> 18 | C10: =R[-1]C[-1]*R2C[+12] -> 16.84615 | D10: =R[-1]C[-1]*R2C[+12] -> 17.75772 | E10: =R[-1]C[-1]*R2C[+12] -> 18.56224 | F10: =R[-1]C[-1]*R2C[+12] -> 12.52524 | G10: =R[-1]C[-1]*R2C[+12] -> 22.44504 | H10: =R[-1]C[-1]*R2C[+12] -> 16.62424 | I10: =R[-1]C[-1]*R2C[+12] -> 0 | J10: =R[-1]C[-1]*R2C[+12] -> 25.7505424087996 | K10: =R[-1]C[-1]*R2C[+12] -> 0 | L10: =R[-1]C[-1]*R2C[+12] -> 0 | M10: =SUM(RC[-11]:RC[-1]) -> 148.5111724088
A11: =R[-1]C+1 -> 8 | B11: =ROUND(INT(R[-1]C[+1]/2)*0.75, 0)+ROUND(INT(R[-1]C[+2]/2)*1, 0)+ROUND(INT(R[-1]C[+3]/2)*0.25, 0)+ROUND(INT(R[-1]C[+4]/2)*0.1, 0) -> 17 | C11: =R[-1]C[-1]*R2C[+12] -> 17.8371 | D11: =R[-1]C[-1]*R2C[+12] -> 16.77118 | E11: =R[-1]C[-1]*R2C[+12] -> 17.58528 | F11: =R[-1]C[-1]*R2C[+12] -> 18.30612 | G11: =R[-1]C[-1]*R2C[+12] -> 12.15773 | H11: =R[-1]C[-1]*R2C[+12] -> 20.99904 | I11: =R[-1]C[-1]*R2C[+12] -> 14.1664 | J11: =R[-1]C[-1]*R2C[+12] -> 0 | K11: =R[-1]C[-1]*R2C[+12] -> 9.50552500126141 | L11: =R[-1]C[-1]*R2C[+12] -> 0 | M11: =SUM(RC[-11]:RC[-1]) -> 144.328375001261
A12: =R[-1]C+1 -> 9 | B12: =ROUND(INT(R[-1]C[+1]/2)*0.75, 0)+ROUND(INT(R[-1]C[+2]/2)*1, 0)+ROUND(INT(R[-1]C[+3]/2)*0.25, 0)+ROUND(INT(R[-1]C[+4]/2)*0.1, 0) -> 17 | C12: =R[-1]C[-1]*R2C[+12] -> 16.84615 | D12: =R[-1]C[-1]*R2C[+12] -> 17.75772 | E12: =R[-1]C[-1]*R2C[+12] -> 16.60832 | F12: =R[-1]C[-1]*R2C[+12] -> 17.34264 | G12: =R[-1]C[-1]*R2C[+12] -> 17.76899 | H12: =R[-1]C[-1]*R2C[+12] -> 11.37448 | I12: =R[-1]C[-1]*R2C[+12] -> 17.8944 | J12: =R[-1]C[-1]*R2C[+12] -> 9.69665 | K12: =R[-1]C[-1]*R2C[+12] -> 0 | L12: =R[-1]C[-1]*R2C[+12] -> 0.899137191583832 | M12: =SUM(RC[-11]:RC[-1]) -> 143.188487191584
A13: =R[-1]C+1 -> 10 | B13: =ROUND(INT(R[-1]C[+1]/2)*0.75, 0)+ROUND(INT(R[-1]C[+2]/2)*1, 0)+ROUND(INT(R[-1]C[+3]/2)*0.25, 0)+ROUND(INT(R[-1]C[+4]/2)*0.1, 0) -> 17 | C13: =R[-1]C[-1]*R2C[+12] -> 16.84615 | D13: =R[-1]C[-1]*R2C[+12] -> 16.77118 | E13: =R[-1]C[-1]*R2C[+12] -> 17.58528 | F13: =R[-1]C[-1]*R2C[+12] -> 16.37916 | G13: =R[-1]C[-1]*R2C[+12] -> 16.83378 | H13: =R[-1]C[-1]*R2C[+12] -> 16.62424 | I13: =R[-1]C[-1]*R2C[+12] -> 9.6928 | J13: =R[-1]C[-1]*R2C[+12] -> 12.2484 | K13: =R[-1]C[-1]*R2C[+12] -> 3.57941 | L13: =R[-1]C[-1]*R2C[+12] -> 0 | M13: =SUM(RC[-11]:RC[-1]) -> 143.5604
A14: =R[-1]C+1 -> 11 | B14: =ROUND(INT(R[-1]C[+1]/2)*0.75, 0)+ROUND(INT(R[-1]C[+2]/2)*1, 0)+ROUND(INT(R[-1]C[+3]/2)*0.25, 0)+ROUND(INT(R[-1]C[+4]/2)*0.1, 0) -> 17 | C14: =R[-1]C[-1]*R2C[+12] -> 16.84615 | D14: =R[-1]C[-1]*R2C[+12] -> 16.77118 | E14: =R[-1]C[-1]*R2C[+12] -> 16.60832 | F14: =R[-1]C[-1]*R2C[+12] -> 17.34264 | G14: =R[-1]C[-1]*R2C[+12] -> 15.89857 | H14: =R[-1]C[-1]*R2C[+12] -> 15.74928 | I14: =R[-1]C[-1]*R2C[+12] -> 14.1664 | J14: =R[-1]C[-1]*R2C[+12] -> 6.63455 | K14: =R[-1]C[-1]*R2C[+12] -> 4.52136 | L14: =R[-1]C[-1]*R2C[+12] -> 0.338579999999999 | M14: =SUM(RC[-11]:RC[-1]) -> 141.87703
A15: =R[-1]C+1 -> 12 | B15: =ROUND(INT(R[-1]C[+1]/2)*0.75, 0)+ROUND(INT(R[-1]C[+2]/2)*1, 0)+ROUND(INT(R[-1]C[+3]/2)*0.25, 0)+ROUND(INT(R[-1]C[+4]/2)*0.1, 0) -> 17 | C15: =R[-1]C[-1]*R2C[+12] -> 16.84615 | D15: =R[-1]C[-1]*R2C[+12] -> 16.77118 | E15: =R[-1]C[-1]*R2C[+12] -> 16.60832 | F15: =R[-1]C[-1]*R2C[+12] -> 16.37916 | G15: =R[-1]C[-1]*R2C[+12] -> 16.83378 | H15: =R[-1]C[-1]*R2C[+12] -> 14.87432 | I15: =R[-1]C[-1]*R2C[+12] -> 13.4208 | J15: =R[-1]C[-1]*R2C[+12] -> 9.69665 | K15: =R[-1]C[-1]*R2C[+12] -> 2.44907 | L15: =R[-1]C[-1]*R2C[+12] -> 0.427679999999999 | M15: =SUM(RC[-11]:RC[-1]) -> 141.30711
A16: =R[-1]C+1 -> 13 | B16: =ROUND(INT(R[-1]C[+1]/2)*0.75, 0)+ROUND(INT(R[-1]C[+2]/2)*1, 0)+ROUND(INT(R[-1]C[+3]/2)*0.25, 0)+ROUND(INT(R[-1]C[+4]/2)*0.1, 0) -> 17 | C16: =R[-1]C[-1]*R2C[+12] -> 16.84615 | D16: =R[-1]C[-1]*R2C[+12] -> 16.77118 | E16: =R[-1]C[-1]*R2C[+12] -> 16.60832 | F16: =R[-1]C[-1]*R2C[+12] -> 16.37916 | G16: =R[-1]C[-1]*R2C[+12] -> 15.89857 | H16: =R[-1]C[-1]*R2C[+12] -> 15.74928 | I16: =R[-1]C[-1]*R2C[+12] -> 12.6752 | J16: =R[-1]C[-1]*R2C[+12] -> 9.1863 | K16: =R[-1]C[-1]*R2C[+12] -> 3.57941 | L16: =R[-1]C[-1]*R2C[+12] -> 0.23166 | M16: =SUM(RC[-11]:RC[-1]) -> 140.92523
A17: =R[-1]C+1 -> 14 | B17: =ROUND(INT(R[-1]C[+1]/2)*0.75, 0)+ROUND(INT(R[-1]C[+2]/2)*1, 0)+ROUND(INT(R[-1]C[+3]/2)*0.25, 0)+ROUND(INT(R[-1]C[+4]/2)*0.1, 0) -> 17 | C17: =R[-1]C[-1]*R2C[+12] -> 16.84615 | D17: =R[-1]C[-1]*R2C[+12] -> 16.77118 | E17: =R[-1]C[-1]*R2C[+12] -> 16.60832 | F17: =R[-1]C[-1]*R2C[+12] -> 16.37916 | G17: =R[-1]C[-1]*R2C[+12] -> 15.89857 | H17: =R[-1]C[-1]*R2C[+12] -> 14.87432 | I17: =R[-1]C[-1]*R2C[+12] -> 13.4208 | J17: =R[-1]C[-1]*R2C[+12] -> 8.67595 | K17: =R[-1]C[-1]*R2C[+12] -> 3.39102 | L17: =R[-1]C[-1]*R2C[+12] -> 0.338579999999999 | M17: =SUM(RC[-11]:RC[-1]) -> 140.20405
A18: =R[-1]C+1 -> 15 | B18: =ROUND(INT(R[-1]C[+1]/2)*0.75, 0)+ROUND(INT(R[-1]C[+2]/2)*1, 0)+ROUND(INT(R[-1]C[+3]/2)*0.25, 0)+ROUND(INT(R[-1]C[+4]/2)*0.1, 0) -> 17 | C18: =R[-1]C[-1]*R2C[+12] -> 16.84615 | D18: =R[-1]C[-1]*R2C[+12] -> 16.77118 | E18: =R[-1]C[-1]*R2C[+12] -> 16.60832 | F18: =R[-1]C[-1]*R2C[+12] -> 16.37916 | G18: =R[-1]C[-1]*R2C[+12] -> 15.89857 | H18: =R[-1]C[-1]*R2C[+12] -> 14.87432 | I18: =R[-1]C[-1]*R2C[+12] -> 12.6752 | J18: =R[-1]C[-1]*R2C[+12] -> 9.1863 | K18: =R[-1]C[-1]*R2C[+12] -> 3.20263 | L18: =R[-1]C[-1]*R2C[+12] -> 0.32076 | M18: =SUM(RC[-11]:RC[-1]) -> 139.76259
A19: =R[-1]C+1 -> 16 | B19: =ROUND(INT(R[-1]C[+1]/2)*0.75, 0)+ROUND(INT(R[-1]C[+2]/2)*1, 0)+ROUND(INT(R[-1]C[+3]/2)*0.25, 0)+ROUND(INT(R[-1]C[+4]/2)*0.1, 0) -> 17 | C19: =R[-1]C[-1]*R2C[+12] -> 16.84615 | D19: =R[-1]C[-1]*R2C[+12] -> 16.77118 | E19: =R[-1]C[-1]*R2C[+12] -> 16.60832 | F19: =R[-1]C[-1]*R2C[+12] -> 16.37916 | G19: =R[-1]C[-1]*R2C[+12] -> 15.89857 | H19: =R[-1]C[-1]*R2C[+12] -> 14.87432 | I19: =R[-1]C[-1]*R2C[+12] -> 12.6752 | J19: =R[-1]C[-1]*R2C[+12] -> 8.67595 | K19: =R[-1]C[-1]*R2C[+12] -> 3.39102 | L19: =R[-1]C[-1]*R2C[+12] -> 0.30294 | M19: =SUM(RC[-11]:RC[-1]) -> 139.42281
A20: =R[-1]C+1 -> 17 | B20: =ROUND(INT(R[-1]C[+1]/2)*0.75, 0)+ROUND(INT(R[-1]C[+2]/2)*1, 0)+ROUND(INT(R[-1]C[+3]/2)*0.25, 0)+ROUND(INT(R[-1]C[+4]/2)*0.1, 0) -> 17 | C20: =R[-1]C[-1]*R2C[+12] -> 16.84615 | D20: =R[-1]C[-1]*R2C[+12] -> 16.77118 | E20: =R[-1]C[-1]*R2C[+12] -> 16.60832 | F20: =R[-1]C[-1]*R2C[+12] -> 16.37916 | G20: =R[-1]C[-1]*R2C[+12] -> 15.89857 | H20: =R[-1]C[-1]*R2C[+12] -> 14.87432 | I20: =R[-1]C[-1]*R2C[+12] -> 12.6752 | J20: =R[-1]C[-1]*R2C[+12] -> 8.67595 | K20: =R[-1]C[-1]*R2C[+12] -> 3.20263 | L20: =R[-1]C[-1]*R2C[+12] -> 0.32076 | M20: =SUM(RC[-11]:RC[-1]) -> 139.25224
A21: =R[-1]C+1 -> 18 | B21: =ROUND(INT(R[-1]C[+1]/2)*0.75, 0)+ROUND(INT(R[-1]C[+2]/2)*1, 0)+ROUND(INT(R[-1]C[+3]/2)*0.25, 0)+ROUND(INT(R[-1]C[+4]/2)*0.1, 0) -> 17 | C21: =R[-1]C[-1]*R2C[+12] -> 16.84615 | D21: =R[-1]C[-1]*R2C[+12] -> 16.77118 | E21: =R[-1]C[-1]*R2C[+12] -> 16.60832 | F21: =R[-1]C[-1]*R2C[+12] -> 16.37916 | G21: =R[-1]C[-1]*R2C[+12] -> 15.89857 | H21: =R[-1]C[-1]*R2C[+12] -> 14.87432 | I21: =R[-1]C[-1]*R2C[+12] -> 12.6752 | J21: =R[-1]C[-1]*R2C[+12] -> 8.67595 | K21: =R[-1]C[-1]*R2C[+12] -> 3.20263 | L21: =R[-1]C[-1]*R2C[+12] -> 0.30294 | M21: =SUM(RC[-11]:RC[-1]) -> 139.23442
A22: =R[-1]C+1 -> 19 | B22: =ROUND(INT(R[-1]C[+1]/2)*0.75, 0)+ROUND(INT(R[-1]C[+2]/2)*1, 0)+ROUND(INT(R[-1]C[+3]/2)*0.25, 0)+ROUND(INT(R[-1]C[+4]/2)*0.1, 0) -> 17 | C22: =R[-1]C[-1]*R2C[+12] -> 16.84615 | D22: =R[-1]C[-1]*R2C[+12] -> 16.77118 | E22: =R[-1]C[-1]*R2C[+12] -> 16.60832 | F22: =R[-1]C[-1]*R2C[+12] -> 16.37916 | G22: =R[-1]C[-1]*R2C[+12] -> 15.89857 | H22: =R[-1]C[-1]*R2C[+12] -> 14.87432 | I22: =R[-1]C[-1]*R2C[+12] -> 12.6752 | J22: =R[-1]C[-1]*R2C[+12] -> 8.67595 | K22: =R[-1]C[-1]*R2C[+12] -> 3.20263 | L22: =R[-1]C[-1]*R2C[+12] -> 0.30294 | M22: =SUM(RC[-11]:RC[-1]) -> 139.23442
A23: =R[-1]C+1 -> 20 | B23: =ROUND(INT(R[-1]C[+1]/2)*0.75, 0)+ROUND(INT(R[-1]C[+2]/2)*1, 0)+ROUND(INT(R[-1]C[+3]/2)*0.25, 0)+ROUND(INT(R[-1]C[+4]/2)*0.1, 0) -> 17 | C23: =R[-1]C[-1]*R2C[+12] -> 16.84615 | D23: =R[-1]C[-1]*R2C[+12] -> 16.77118 | E23: =R[-1]C[-1]*R2C[+12] -> 16.60832 | F23: =R[-1]C[-1]*R2C[+12] -> 16.37916 | G23: =R[-1]C[-1]*R2C[+12] -> 15.89857 | H23: =R[-1]C[-1]*R2C[+12] -> 14.87432 | I23: =R[-1]C[-1]*R2C[+12] -> 12.6752 | J23: =R[-1]C[-1]*R2C[+12] -> 8.67595 | K23: =R[-1]C[-1]*R2C[+12] -> 3.20263 | L23: =R[-1]C[-1]*R2C[+12] -> 0.30294 | M23: =SUM(RC[-11]:RC[-1]) -> 139.23442

Sheet: death & survival rates
A1: 'YEAR | B1: 'death rate | C1: 'number living | D1: '10-year life rate | E1: 'number living | G1: 'YEAR | H1: 'death rate | I1: 'number living | J1: '10-year life rate | K1: 'number living
C2: 100000 | E2: 100000 | I2: =R[+50]C[-6] -> 93521 | J2: =R[+50]C[-6] -> 0.970658446464898 | K2: =R[+50]C[-6] -> 93521
A3: '0-1 | B3: 0.00693 | C3: =ROUND(R[-1]C*(1-RC[-1]), 0) -> 99307 | G3: '-51 | H3: 0.004443 | I3: =ROUND(R[+49]C[-6]*(1-RC[-1]), 0) -> 93105
A4: '1-2 | B4: 0.000517 | C4: =ROUND(R[-1]C*(1-RC[-1]), 0) -> 99256 | G4: '-52 | H4: 0.00478 | I4: =ROUND(R[-1]C*(1-RC[-1]), 0) -> 92660
A5: '2-3 | B5: 0.000347 | C5: =ROUND(R[-1]C*(1-RC[-1]), 0) -> 99222 | G5: '-53 | H5: 0.005152 | I5: =ROUND(R[-1]C*(1-RC[-1]), 0) -> 92183
A6: '3-4 | B6: 0.000243 | C6: =ROUND(R[-1]C*(1-RC[-1]), 0) -> 99198 | G6: '-54 | H6: 0.005579 | I6: =ROUND(R[-1]C*(1-RC[-1]), 0) -> 91669
A7: '4-5 | B7: 0.000202 | C7: =ROUND(R[-1]C*(1-RC[-1]), 0) -> 99178 | G7: '-55 | H7: 0.006075 | I7: =ROUND(R[-1]C*(1-RC[-1]), 0) -> 91112
A8: '5-6 | B8: 0.000189 | C8: =ROUND(R[-1]C*(1-RC[-1]), 0) -> 99159 | G8: '-56 | H8: 0.006654 | I8: =ROUND(R[-1]C*(1-RC[-1]), 0) -> 90506
A9: '6-7 | B9: 0.000177 | C9: =ROUND(R[-1]C*(1-RC[-1]), 0) -> 99141 | G9: '-57 | H9: 0.007309 | I9: =ROUND(R[-1]C*(1-RC[-1]), 0) -> 89844
A10: '7-8 | B10: 0.000167 | C10: =ROUND(R[-1]C*(1-RC[-1]), 0) -> 99124 | G10: '-58 | H10: 0.008023 | I10: =ROUND(R[-1]C*(1-RC[-1]), 0) -> 89123
A11: '8-9 | B11: 0.000154 | C11: =ROUND(R[-1]C*(1-RC[-1]), 0) -> 99109 | G11: '-59 | H11: 0.008773 | I11: =ROUND(R[-1]C*(1-RC[-1]), 0) -> 88341
A12: '9-10 | B12: 0.000137 | C12: =ROUND(R[-1]C*(1-RC[-1]), 0) -> 99095 | D12: =1-(R[-10]C[-1]-RC[-1])/R[-10]C[-1] -> 0.99095 | E12: =ROUND(R[-10]C*RC[-1], 0) -> 99095 | G12: '-60 | H12: 0.009563 | I12: =ROUND(R[-1]C*(1-RC[-1]), 0) -> 87496 | J12: =1-(R[-10]C[-1]-RC[-1])/R[-10]C[-1] -> 0.935575966895136 | K12: =ROUND(R[-10]C*RC[-1], 0) -> 87496
A13: '-11 | B13: 0.000125 | C13: =ROUND(R[-1]C*(1-RC[-1]), 0) -> 99083 | G13: '-61 | H13: 0.010446 | I13: =ROUND(R[-1]C*(1-RC[-1]), 0) -> 86582
A14: '-12 | B14: 0.00013 | C14: =ROUND(R[-1]C*(1-RC[-1]), 0) -> 99070 | G14: '-62 | H14: 0.011448 | I14: =ROUND(R[-1]C*(1-RC[-1]), 0) -> 85591
A15: '-13 | B15: 0.00017 | C15: =ROUND(R[-1]C*(1-RC[-1]), 0) -> 99053 | G15: '-63 | H15: 0.012521 | I15: =ROUND(R[-1]C*(1-RC[-1]), 0) -> 84519
A16: '-14 | B16: 0.000253 | C16: =ROUND(R[-1]C*(1-RC[-1]), 0) -> 99028 | G16: '-64 | H16: 0.013646 | I16: =ROUND(R[-1]C*(1-RC[-1]), 0) -> 83366
A17: '-15 | B17: 0.000366 | C17: =ROUND(R[-1]C*(1-RC[-1]), 0) -> 98992 | G17: '-65 | H17: 0.014828 | I17: =ROUND(R[-1]C*(1-RC[-1]), 0) -> 82130
A18: '-16 | B18: 0.000491 | C18: =ROUND(R[-1]C*(1-RC[-1]), 0) -> 98943 | G18: '-66 | H18: 0.016058 | I18: =ROUND(R[-1]C*(1-RC[-1]), 0) -> 80811
A19: '-17 | B19: 0.000607 | C19: =ROUND(R[-1]C*(1-RC[-1]), 0) -> 98883 | G19: '-67 | H19: 0.0174 | I19: =ROUND(R[-1]C*(1-RC[-1]), 0) -> 79405
A20: '-18 | B20: 0.000706 | C20: =ROUND(R[-1]C*(1-RC[-1]), 0) -> 98813 | G20: '-68 | H20: 0.018933 | I20: =ROUND(R[-1]C*(1-RC[-1]), 0) -> 77902
A21: '-19 | B21: 0.00078 | C21: =ROUND(R[-1]C*(1-RC[-1]), 0) -> 98736 | G21: '-69 | H21: 0.020701 | I21: =ROUND(R[-1]C*(1-RC[-1]), 0) -> 76289
A22: '-20 | B22: 0.000833 | C22: =ROUND(R[-1]C*(1-RC[-1]), 0) -> 98654 | D22: =1-(R[-10]C[-1]-RC[-1])/R[-10]C[-1] -> 0.995549725011353 | E22: =ROUND(R[-10]C*RC[-1], 0) -> 98654 | G22: '-70 | H22: 0.022663 | I22: =ROUND(R[-1]C*(1-RC[-1]), 0) -> 74560 | J22: =1-(R[-10]C[-1]-RC[-1])/R[-10]C[-1] -> 0.85215324129103 | K22: =ROUND(R[-10]C*RC[-1], 0) -> 74560
A23: '-21 | B23: 0.000888 | C23: =ROUND(R[-1]C*(1-RC[-1]), 0) -> 98566 | G23: '-71 | H23: 0.024673 | I23: =ROUND(R[-1]C*(1-RC[-1]), 0) -> 72720
A24: '-22 | B24: 0.000945 | C24: =ROUND(R[-1]C*(1-RC[-1]), 0) -> 98473 | G24: '-72 | H24: 0.026741 | I24: =ROUND(R[-1]C*(1-RC[-1]), 0) -> 70775
A25: '-23 | B25: 0.000983 | C25: =ROUND(R[-1]C*(1-RC[-1]), 0) -> 98376 | G25: '-73 | H25: 0.029042 | I25: =ROUND(R[-1]C*(1-RC[-1]), 0) -> 68720
A26: '-24 | B26: 0.000996 | C26: =ROUND(R[-1]C*(1-RC[-1]), 0) -> 98278 | G26: '-74 | H26: 0.031663 | I26: =ROUND(R[-1]C*(1-RC[-1]), 0) -> 66544
A27: '-25 | B27: 0.000991 | C27: =ROUND(R[-1]C*(1-RC[-1]), 0) -> 98181 | G27: '-75 | H27: 0.034588 | I27: =ROUND(R[-1]C*(1-RC[-1]), 0) -> 64242
A28: '-26 | B28: 0.000981 | C28: =ROUND(R[-1]C*(1-RC[-1]), 0) -> 98085 | G28: '-76 | H28: 0.037675 | I28: =ROUND(R[-1]C*(1-RC[-1]), 0) -> 61822
A29: '-27 | B29: 0.000977 | C29: =ROUND(R[-1]C*(1-RC[-1]), 0) -> 97989 | G29: '-77 | H29: 0.040886 | I29: =ROUND(R[-1]C*(1-RC[-1]), 0) -> 59294
A30: '-28 | B30: 0.000979 | C30: =ROUND(R[-1]C*(1-RC[-1]), 0) -> 97893 | G30: '-78 | H30: 0.044437 | I30: =ROUND(R[-1]C*(1-RC[-1]), 0) -> 56659
A31: '-29 | B31: 0.000993 | C31: =ROUND(R[-1]C*(1-RC[-1]), 0) -> 97796 | G31: '-79 | H31: 0.04853 | I31: =ROUND(R[-1]C*(1-RC[-1]), 0) -> 53909
A32: '-30 | B32: 0.001019 | C32: =ROUND(R[-1]C*(1-RC[-1]), 0) -> 97696 | D32: =1-(R[-10]C[-1]-RC[-1])/R[-10]C[-1] -> 0.990289293895838 | E32: =ROUND(R[-10]C*RC[-1], 0) -> 97696 | G32: '-80 | H32: 0.053313 | I32: =ROUND(R[-1]C*(1-RC[-1]), 0) -> 51035 | J32: =1-(R[-10]C[-1]-RC[-1])/R[-10]C[-1] -> 0.684482296137339 | K32: =ROUND(R[-10]C*RC[-1], 0) -> 51035
A33: '-31 | B33: 0.00105 | C33: =ROUND(R[-1]C*(1-RC[-1]), 0) -> 97593 | G33: '-81 | H33: 0.058841 | I33: =ROUND(R[-1]C*(1-RC[-1]), 0) -> 48032
A34: '-32 | B34: 0.001087 | C34: =ROUND(R[-1]C*(1-RC[-1]), 0) -> 97487 | G34: '-82 | H34: 0.065093 | I34: =ROUND(R[-1]C*(1-RC[-1]), 0) -> 44905
A35: '-33 | B35: 0.001141 | C35: =ROUND(R[-1]C*(1-RC[-1]), 0) -> 97376 | G35: '-83 | H35: 0.07214 | I35: =ROUND(R[-1]C*(1-RC[-1]), 0) -> 41666
A36: '-34 | B36: 0.001215 | C36: =ROUND(R[-1]C*(1-RC[-1]), 0) -> 97258 | G36: '-84 | H36: 0.07985 | I36: =ROUND(R[-1]C*(1-RC[-1]), 0) -> 38339
A37: '-35 | B37: 0.001302 | C37: =ROUND(R[-1]C*(1-RC[-1]), 0) -> 97131 | G37: '-85 | H37: 0.088195 | I37: =ROUND(R[-1]C*(1-RC[-1]), 0) -> 34958
A38: '-36 | B38: 0.001395 | C38: =ROUND(R[-1]C*(1-RC[-1]), 0) -> 96996 | G38: '-86 | H38: 0.096751 | I38: =ROUND(R[-1]C*(1-RC[-1]), 0) -> 31576
A39: '-37 | B39: 0.001492 | C39: =ROUND(R[-1]C*(1-RC[-1]), 0) -> 96851 | G39: '-87 | H39: 0.105884 | I39: =ROUND(R[-1]C*(1-RC[-1]), 0) -> 28233
A40: '-38 | B40: 0.001602 | C40: =ROUND(R[-1]C*(1-RC[-1]), 0) -> 96696 | G40: '-88 | H40: 0.115605 | I40: =ROUND(R[-1]C*(1-RC[-1]), 0) -> 24969
A41: '-39 | B41: 0.001728 | C41: =ROUND(R[-1]C*(1-RC[-1]), 0) -> 96529 | G41: '-89 | H41: 0.125917 | I41: =ROUND(R[-1]C*(1-RC[-1]), 0) -> 21825
A42: '-40 | B42: 0.00187 | C42: =ROUND(R[-1]C*(1-RC[-1]), 0) -> 96348 | D42: =1-(R[-10]C[-1]-RC[-1])/R[-10]C[-1] -> 0.986202096298723 | E42: =ROUND(R[-10]C*RC[-1], 0) -> 96348 | G42: '-90 | H42: 0.136824 | I42: =ROUND(R[-1]C*(1-RC[-1]), 0) -> 18839 | J42: =1-(R[-10]C[-1]-RC[-1])/R[-10]C[-1] -> 0.369138826295679 | K42: =ROUND(R[-10]C*RC[-1], 0) -> 18839
A43: '-41 | B43: 0.002021 | C43: =ROUND(R[-1]C*(1-RC[-1]), 0) -> 96153 | G43: '-91 | H43: 0.148322 | I43: =ROUND(R[-1]C*(1-RC[-1]), 0) -> 16045
A44: '-42 | B44: 0.002181 | C44: =ROUND(R[-1]C*(1-RC[-1]), 0) -> 95943 | G44: '-92 | H44: 0.160404 | I44: =ROUND(R[-1]C*(1-RC[-1]), 0) -> 13471
A45: '-43 | B45: 0.002355 | C45: =ROUND(R[-1]C*(1-RC[-1]), 0) -> 95717 | G45: '-93 | H45: 0.173058 | I45: =ROUND(R[-1]C*(1-RC[-1]), 0) -> 11140
A46: '-44 | B46: 0.00255 | C46: =ROUND(R[-1]C*(1-RC[-1]), 0) -> 95473 | G46: '-94 | H46: 0.186266 | I46: =ROUND(R[-1]C*(1-RC[-1]), 0) -> 9065
A47: '-45 | B47: 0.002768 | C47: =ROUND(R[-1]C*(1-RC[-1]), 0) -> 95209 | G47: '-95 | H47: 0.200006 | I47: =ROUND(R[-1]C*(1-RC[-1]), 0) -> 7252
A48: '-46 | B48: 0.003014 | C48: =ROUND(R[-1]C*(1-RC[-1]), 0) -> 94922 | G48: '-96 | H48: 0.214248 | I48: =ROUND(R[-1]C*(1-RC[-1]), 0) -> 5698
A49: '-47 | B49: 0.003284 | C49: =ROUND(R[-1]C*(1-RC[-1]), 0) -> 94610 | G49: '-97 | H49: 0.22896 | I49: =ROUND(R[-1]C*(1-RC[-1]), 0) -> 4393
A50: '-48 | B50: 0.003567 | C50: =ROUND(R[-1]C*(1-RC[-1]), 0) -> 94273 | G50: '-98 | H50: 0.244099 | I50: =ROUND(R[-1]C*(1-RC[-1]), 0) -> 3321
A51: '-49 | B51: 0.003851 | C51: =ROUND(R[-1]C*(1-RC[-1]), 0) -> 93910 | G51: '-99 | H51: 0.259622 | I51: =ROUND(R[-1]C*(1-RC[-1]), 0) -> 2459
A52: '-50 | B52: 0.004138 | C52: =ROUND(R[-1]C*(1-RC[-1]), 0) -> 93521 | D52: =1-(R[-10]C[-1]-RC[-1])/R[-10]C[-1] -> 0.970658446464898 | E52: =ROUND(R[-10]C*RC[-1], 0) -> 93521 | G52: '-100 | H52: 0.275475 | I52: =ROUND(R[-1]C*(1-RC[-1]), 0) -> 1782 | J52: =1-(R[-10]C[-1]-RC[-1])/R[-10]C[-1] -> 0.0945910080152874 | K52: =ROUND(R[-10]C*RC[-1], 0) -> 1782

Sheet: Four
B1: 'Individuals per Age Group | M1: 'Total | N1: 'MIN(RAND()*O$3 + 0.5*O$3,1) | O1: 0 | P1: =RC[-1]+1 -> 1 | Q1: =RC[-1]+1 -> 2 | R1: =RC[-1]+1 -> 3 | S1: =RC[-1]+1 -> 4 | T1: =RC[-1]+1 -> 5 | U1: =RC[-1]+1 -> 6 | V1: =RC[-1]+1 -> 7 | W1: =RC[-1]+1 -> 8 | X1: =RC[-1]+1 -> 9
A2: 'Period | B2: 0 | C2: =RC[-1]+1 -> 1 | D2: =RC[-1]+1 -> 2 | E2: =RC[-1]+1 -> 3 | F2: =RC[-1]+1 -> 4 | G2: =RC[-1]+1 -> 5 | H2: =RC[-1]+1 -> 6 | I2: =RC[-1]+1 -> 7 | J2: =RC[-1]+1 -> 8 | K2: =RC[-1]+1 -> 9 | L2: =RC[-1]+1 -> 10 | N2: 'Survival Rates | O2: 0.99095 | P2: 0.995549725011353 | Q2: 0.990289293895838 | R2: 0.986202096298723 | S2: 0.970658446464898 | T2: 0.935575966895136 | U2: 0.85215324129103 | V2: 0.684482296137339 | W2: 0.369138826295679 | X2: 0.0945910080152874
A3: 0 | B3: 0 | C3: 50 | D3: 0 | E3: 0 | F3: 0 | G3: 0 | H3: 0 | I3: 0 | J3: 0 | K3: 0 | L3: 0 | M3: =SUM(RC[-11]:RC[-1]) -> 50 | N3: 'death rate | O3: =1-R[-1]C -> 0.00905 | P3: =1-R[-1]C -> 0.00445027498864703 | Q3: =1-R[-1]C -> 0.00971070610416203 | R3: =1-R[-1]C -> 0.013797903701277 | S3: =1-R[-1]C -> 0.029341553535102 | T3: =1-R[-1]C -> 0.064424033104864 | U3: =1-R[-1]C -> 0.14784675870897 | V3: =1-R[-1]C -> 0.315517703862661 | W3: =1-R[-1]C -> 0.630861173704321 | X3: =1-R[-1]C -> 0.905408991984713
A4: =R[-1]C+1 -> 1 | B4: =ROUND(INT(R[-1]C[+1]/2)*0.75, 0)+ROUND(INT(R[-1]C[+2]/2)*1, 0)+ROUND(INT(R[-1]C[+3]/2)*0.25, 0)+ROUND(INT(R[-1]C[+4]/2)*0.1, 0) -> 19 | C4: =R[-1]C[-1]*(1-RC[+12]) -> 0 | D4: =R[-1]C[-1]*(1-RC[+12]) -> 49.8834160941599 | E4: =R[-1]C[-1]*(1-RC[+12]) -> 0 | F4: =R[-1]C[-1]*(1-RC[+12]) -> 0 | G4: =R[-1]C[-1]*(1-RC[+12]) -> 0 | H4: =R[-1]C[-1]*(1-RC[+12]) -> 0 | I4: =R[-1]C[-1]*(1-RC[+12]) -> 0 | J4: =R[-1]C[-1]*(1-RC[+12]) -> 0 | K4: =R[-1]C[-1]*(1-RC[+12]) -> 0 | L4: =R[-1]C[-1]*(1-RC[+12]) -> 0 | M4: =SUM(RC[-11]:RC[-1]) -> 68.8834160941599 | N4: 'random rate | O4: =RAND()*R3C+0.5*R3C -> 0.00710109130725083 | P4: =RAND()*R3C+0.5*R3C -> 0.00233167811680157 | Q4: =RAND()*R3C+0.5*R3C -> 0.00976200072568881 | R4: =RAND()*R3C+0.5*R3C -> 0.0131652972437056 | S4: =RAND()*R3C+0.5*R3C -> 0.0298456537414752 | T4: =RAND()*R3C+0.5*R3C -> 0.0660596437673308 | U4: =RAND()*R3C+0.5*R3C -> 0.111465724042461 | V4: =RAND()*R3C+0.5*R3C -> 0.360278440135211 | W4: =RAND()*R3C+0.5*R3C -> 0.392245385866201 | X4: =RAND()*R3C+0.5*R3C -> 0.852724320352114
A5: =R[-1]C+1 -> 2 | B5: =ROUND(INT(R[-1]C[+1]/2)*0.75, 0)+ROUND(INT(R[-1]C[+2]/2)*1, 0)+ROUND(INT(R[-1]C[+3]/2)*0.25, 0)+ROUND(INT(R[-1]C[+4]/2)*0.1, 0) -> 24 | C5: =R[-1]C[-1]*(1-RC[+12]) -> 18.7969000500498 | D5: =R[-1]C[-1]*(1-RC[+12]) -> 0 | E5: =R[-1]C[-1]*(1-RC[+12]) -> 49.5501298091456 | F5: =R[-1]C[-1]*(1-RC[+12]) -> 0 | G5: =R[-1]C[-1]*(1-RC[+12]) -> 0 | H5: =R[-1]C[-1]*(1-RC[+12]) -> 0 | I5: =R[-1]C[-1]*(1-RC[+12]) -> 0 | J5: =R[-1]C[-1]*(1-RC[+12]) -> 0 | K5: =R[-1]C[-1]*(1-RC[+12]) -> 0 | L5: =R[-1]C[-1]*(1-RC[+12]) -> 0 | M5: =SUM(RC[-11]:RC[-1]) -> 92.3470298591955 | N5: 'random rate | O5: =RAND()*R3C+0.5*R3C -> 0.0106894710500094 | P5: =RAND()*R3C+0.5*R3C -> 0.0049075552101268 | Q5: =RAND()*R3C+0.5*R3C -> 0.0066813043514336 | R5: =RAND()*R3C+0.5*R3C -> 0.0196500655718151 | S5: =RAND()*R3C+0.5*R3C -> 0.0392682705606315 | T5: =RAND()*R3C+0.5*R3C -> 0.0331394255258346 | U5: =RAND()*R3C+0.5*R3C -> 0.110725299082744 | V5: =RAND()*R3C+0.5*R3C -> 0.430493484342417 | W5: =RAND()*R3C+0.5*R3C -> 0.866765148518032 | X5: =RAND()*R3C+0.5*R3C -> 1.1131676462108
A6: =R[-1]C+1 -> 3 | B6: =ROUND(INT(R[-1]C[+1]/2)*0.75, 0)+ROUND(INT(R[-1]C[+2]/2)*1, 0)+ROUND(INT(R[-1]C[+3]/2)*0.25, 0)+ROUND(INT(R[-1]C[+4]/2)*0.1, 0) -> 13 | C6: =R[-1]C[-1]*(1-RC[+12]) -> 23.6796206946488 | D6: =R[-1]C[-1]*(1-RC[+12]) -> 18.6749337498237 | E6: =R[-1]C[-1]*(1-RC[+12]) -> 0 | F6: =R[-1]C[-1]*(1-RC[+12]) -> 49.0659508991384 | G6: =R[-1]C[-1]*(1-RC[+12]) -> 0 | H6: =R[-1]C[-1]*(1-RC[+12]) -> 0 | I6: =R[-1]C[-1]*(1-RC[+12]) -> 0 | J6: =R[-1]C[-1]*(1-RC[+12]) -> 0 | K6: =R[-1]C[-1]*(1-RC[+12]) -> 0 | L6: =R[-1]C[-1]*(1-RC[+12]) -> 0 | M6: =SUM(RC[-11]:RC[-1]) -> 104.420505343611 | N6: 'random rate | O6: =RAND()*R3C+0.5*R3C -> 0.0133491377229682 | P6: =RAND()*R3C+0.5*R3C -> 0.00648863907885586 | Q6: =RAND()*R3C+0.5*R3C -> 0.00590976654781767 | R6: =RAND()*R3C+0.5*R3C -> 0.00977149629823694 | S6: =RAND()*R3C+0.5*R3C -> 0.0334241889253439 | T6: =RAND()*R3C+0.5*R3C -> 0.0400736227993489 | U6: =RAND()*R3C+0.5*R3C -> 0.144194355997332 | V6: =RAND()*R3C+0.5*R3C -> 0.412660469079834 | W6: =RAND()*R3C+0.5*R3C -> 0.556126181477961 | X6: =RAND()*R3C+0.5*R3C -> 0.595652339111665
A7: =R[-1]C+1 -> 4 | B7: =ROUND(INT(R[-1]C[+1]/2)*0.75, 0)+ROUND(INT(R[-1]C[+2]/2)*1, 0)+ROUND(INT(R[-1]C[+3]/2)*0.25, 0)+ROUND(INT(R[-1]C[+4]/2)*0.1, 0) -> 19 | C7: =R[-1]C[-1]*(1-RC[+12]) -> 12.827337491334 | D7: =R[-1]C[-1]*(1-RC[+12]) -> 23.5568378328744 | E7: =R[-1]C[-1]*(1-RC[+12]) -> 18.4677155011552 | F7: =R[-1]C[-1]*(1-RC[+12]) -> 0 | G7: =R[-1]C[-1]*(1-RC[+12]) -> 47.7352514121084 | H7: =R[-1]C[-1]*(1-RC[+12]) -> 0 | I7: =R[-1]C[-1]*(1-RC[+12]) -> 0 | J7: =R[-1]C[-1]*(1-RC[+12]) -> 0 | K7: =R[-1]C[-1]*(1-RC[+12]) -> 0 | L7: =R[-1]C[-1]*(1-RC[+12]) -> 0 | M7: =SUM(RC[-11]:RC[-1]) -> 121.587142237472 | N7: 'random rate | O7: =RAND()*R3C+0.5*R3C -> 0.013281731435846 | P7: =RAND()*R3C+0.5*R3C -> 0.00518517012403652 | Q7: =RAND()*R3C+0.5*R3C -> 0.0110960633887397 | R7: =RAND()*R3C+0.5*R3C -> 0.00907299011064894 | S7: =RAND()*R3C+0.5*R3C -> 0.027120629737013 | T7: =RAND()*R3C+0.5*R3C -> 0.0759853450038084 | U7: =RAND()*R3C+0.5*R3C -> 0.157095951868405 | V7: =RAND()*R3C+0.5*R3C -> 0.321536156450568 | W7: =RAND()*R3C+0.5*R3C -> 0.756386930216371 | X7: =RAND()*R3C+0.5*R3C -> 0.863947907541379
A8: =R[-1]C+1 -> 5 | B8: =ROUND(INT(R[-1]C[+1]/2)*0.75, 0)+ROUND(INT(R[-1]C[+2]/2)*1, 0)+ROUND(INT(R[-1]C[+3]/2)*0.25, 0)+ROUND(INT(R[-1]C[+4]/2)*0.1, 0) -> 18 | C8: =R[-1]C[-1]*(1-RC[+12]) -> 18.8641238729402 | D8: =R[-1]C[-1]*(1-RC[+12]) -> 12.7420172371542 | E8: =R[-1]C[-1]*(1-RC[+12]) -> 23.2404629379952 | F8: =R[-1]C[-1]*(1-RC[+12]) -> 18.1330207916198 | G8: =R[-1]C[-1]*(1-RC[+12]) -> 0 | H8: =R[-1]C[-1]*(1-RC[+12]) -> 45.7850030533166 | I8: =R[-1]C[-1]*(1-RC[+12]) -> 0 | J8: =R[-1]C[-1]*(1-RC[+12]) -> 0 | K8: =R[-1]C[-1]*(1-RC[+12]) -> 0 | L8: =R[-1]C[-1]*(1-RC[+12]) -> 0 | M8: =SUM(RC[-11]:RC[-1]) -> 136.764627893026 | N8: 'random rate | O8: =RAND()*R3C+0.5*R3C -> 0.00715137510841078 | P8: =RAND()*R3C+0.5*R3C -> 0.00665143910319969 | Q8: =RAND()*R3C+0.5*R3C -> 0.0134302785935756 | R8: =RAND()*R3C+0.5*R3C -> 0.018123232920414 | S8: =RAND()*R3C+0.5*R3C -> 0.0427596830199369 | T8: =RAND()*R3C+0.5*R3C -> 0.040855516648586 | U8: =RAND()*R3C+0.5*R3C -> 0.211408136355265 | V8: =RAND()*R3C+0.5*R3C -> 0.366593320520661 | W8: =RAND()*R3C+0.5*R3C -> 0.73640477783293 | X8: =RAND()*R3C+0.5*R3C -> 1.16436231929362
A9: =R[-1]C+1 -> 6 | B9: =ROUND(INT(R[-1]C[+1]/2)*0.75, 0)+ROUND(INT(R[-1]C[+2]/2)*1, 0)+ROUND(INT(R[-1]C[+3]/2)*0.25, 0)+ROUND(INT(R[-1]C[+4]/2)*0.1, 0) -> 17 | C9: =R[-1]C[-1]*(1-RC[+12]) -> 17.7835383801454 | D9: =R[-1]C[-1]*(1-RC[+12]) -> 18.7447530127669 | E9: =R[-1]C[-1]*(1-RC[+12]) -> 12.6628745987006 | F9: =R[-1]C[-1]*(1-RC[+12]) -> 22.9207244214472 | G9: =R[-1]C[-1]*(1-RC[+12]) -> 17.4225384887054 | H9: =R[-1]C[-1]*(1-RC[+12]) -> 0 | I9: =R[-1]C[-1]*(1-RC[+12]) -> 42.1464511847609 | J9: =R[-1]C[-1]*(1-RC[+12]) -> 0 | K9: =R[-1]C[-1]*(1-RC[+12]) -> 0 | L9: =R[-1]C[-1]*(1-RC[+12]) -> 0 | M9: =SUM(RC[-11]:RC[-1]) -> 148.680880086526 | N9: 'random rate | O9: =RAND()*R3C+0.5*R3C -> 0.0120256455474769 | P9: =RAND()*R3C+0.5*R3C -> 0.0063279302541354 | Q9: =RAND()*R3C+0.5*R3C -> 0.00621115455901614 | R9: =RAND()*R3C+0.5*R3C -> 0.0137578376730702 | S9: =RAND()*R3C+0.5*R3C -> 0.0391816846778651 | T9: =RAND()*R3C+0.5*R3C -> 0.0764769177694716 | U9: =RAND()*R3C+0.5*R3C -> 0.0794703860632845 | V9: =RAND()*R3C+0.5*R3C -> 0.440110001208917 | W9: =RAND()*R3C+0.5*R3C -> 0.935974172958075 | X9: =RAND()*R3C+0.5*R3C -> 0.777246181539495
A10: =R[-1]C+1 -> 7 | B10: =ROUND(INT(R[-1]C[+1]/2)*0.75, 0)+ROUND(INT(R[-1]C[+2]/2)*1, 0)+ROUND(INT(R[-1]C[+3]/2)*0.25, 0)+ROUND(INT(R[-1]C[+4]/2)*0.1, 0) -> 18 | C10: =R[-1]C[-1]*(1-RC[+12]) -> 16.8329129059399 | D10: =R[-1]C[-1]*(1-RC[+12]) -> 17.6738634766545 | E10: =R[-1]C[-1]*(1-RC[+12]) -> 18.4912241347817 | F10: =R[-1]C[-1]*(1-RC[+12]) -> 12.4597217755619 | G10: =R[-1]C[-1]*(1-RC[+12]) -> 22.3432188909307 | H10: =R[-1]C[-1]*(1-RC[+12]) -> 16.6441324574377 | I10: =R[-1]C[-1]*(1-RC[+12]) -> 0 | J10: =R[-1]C[-1]*(1-RC[+12]) -> 27.5757868893229 | K10: =R[-1]C[-1]*(1-RC[+12]) -> 0 | L10: =R[-1]C[-1]*(1-RC[+12]) -> 0 | M10: =SUM(RC[-11]:RC[-1]) -> 150.020860530629 | N10: 'random rate | O10: =RAND()*R3C+0.5*R3C -> 0.00982865259177222 | P10: =RAND()*R3C+0.5*R3C -> 0.00616721493476161 | Q10: =RAND()*R3C+0.5*R3C -> 0.013525325076967 | R10: =RAND()*R3C+0.5*R3C -> 0.0160431836827616 | S10: =RAND()*R3C+0.5*R3C -> 0.025195780024132 | T10: =RAND()*R3C+0.5*R3C -> 0.0446781065670953 | U10: =RAND()*R3C+0.5*R3C -> 0.157504843076026 | V10: =RAND()*R3C+0.5*R3C -> 0.345715093106258 | W10: =RAND()*R3C+0.5*R3C -> 0.79439221442726 | X10: =RAND()*R3C+0.5*R3C -> 0.610007213230364
A11: =R[-1]C+1 -> 8 | B11: =ROUND(INT(R[-1]C[+1]/2)*0.75, 0)+ROUND(INT(R[-1]C[+2]/2)*1, 0)+ROUND(INT(R[-1]C[+3]/2)*0.25, 0)+ROUND(INT(R[-1]C[+4]/2)*0.1, 0) -> 17 | C11: =R[-1]C[-1]*(1-RC[+12]) -> 17.893801999626 | D11: =R[-1]C[-1]*(1-RC[+12]) -> 16.7476562617305 | E11: =R[-1]C[-1]*(1-RC[+12]) -> 17.4527620673731 | F11: =R[-1]C[-1]*(1-RC[+12]) -> 18.2371176390899 | G11: =R[-1]C[-1]*(1-RC[+12]) -> 12.0809211587383 | H11: =R[-1]C[-1]*(1-RC[+12]) -> 20.9119793554469 | I11: =R[-1]C[-1]*(1-RC[+12]) -> 14.6273722543306 | J11: =R[-1]C[-1]*(1-RC[+12]) -> 0 | K11: =R[-1]C[-1]*(1-RC[+12]) -> 5.8518219135683 | L11: =R[-1]C[-1]*(1-RC[+12]) -> 0 | M11: =SUM(RC[-11]:RC[-1]) -> 140.803432649904 | N11: 'random rate | O11: =RAND()*R3C+0.5*R3C -> 0.00589988890966628 | P11: =RAND()*R3C+0.5*R3C -> 0.0050648776409527 | Q11: =RAND()*R3C+0.5*R3C -> 0.0125100779223169 | R11: =RAND()*R3C+0.5*R3C -> 0.013742005063575 | S11: =RAND()*R3C+0.5*R3C -> 0.0304020124724252 | T11: =RAND()*R3C+0.5*R3C -> 0.064056998343456 | U11: =RAND()*R3C+0.5*R3C -> 0.121169439636719 | V11: =RAND()*R3C+0.5*R3C -> 0.421487824392991 | W11: =RAND()*R3C+0.5*R3C -> 0.787791299045973 | X11: =RAND()*R3C+0.5*R3C -> 0.896016575434882
A12: =R[-1]C+1 -> 9 | B12: =ROUND(INT(R[-1]C[+1]/2)*0.75, 0)+ROUND(INT(R[-1]C[+2]/2)*1, 0)+ROUND(INT(R[-1]C[+3]/2)*0.25, 0)+ROUND(INT(R[-1]C[+4]/2)*0.1, 0) -> 17 | C12: =R[-1]C[-1]*(1-RC[+12]) -> 16.8579770981147 | D12: =R[-1]C[-1]*(1-RC[+12]) -> 17.8051421334849 | E12: =R[-1]C[-1]*(1-RC[+12]) -> 16.5471878506127 | F12: =R[-1]C[-1]*(1-RC[+12]) -> 17.2604656374486 | G12: =R[-1]C[-1]*(1-RC[+12]) -> 17.499242912346 | H12: =R[-1]C[-1]*(1-RC[+12]) -> 11.1249657893986 | I12: =R[-1]C[-1]*(1-RC[+12]) -> 19.0174430533574 | J12: =R[-1]C[-1]*(1-RC[+12]) -> 11.5735949430717 | K12: =R[-1]C[-1]*(1-RC[+12]) -> 0 | L12: =R[-1]C[-1]*(1-RC[+12]) -> -0.129397107935205 | M12: =SUM(RC[-11]:RC[-1]) -> 144.556622309899 | N12: 'random rate | O12: =RAND()*R3C+0.5*R3C -> 0.00835428834619433 | P12: =RAND()*R3C+0.5*R3C -> 0.00495478077509655 | Q12: =RAND()*R3C+0.5*R3C -> 0.0119699382400076 | R12: =RAND()*R3C+0.5*R3C -> 0.0110181087201123 | S12: =RAND()*R3C+0.5*R3C -> 0.0404600519306995 | T12: =RAND()*R3C+0.5*R3C -> 0.0791293442593308 | U12: =RAND()*R3C+0.5*R3C -> 0.0905957427504837 | V12: =RAND()*R3C+0.5*R3C -> 0.208771422382771 | W12: =RAND()*R3C+0.5*R3C -> 0.846818956817273 | X12: =RAND()*R3C+0.5*R3C -> 1.02211227714145
A13: =R[-1]C+1 -> 10 | B13: =ROUND(INT(R[-1]C[+1]/2)*0.75, 0)+ROUND(INT(R[-1]C[+2]/2)*1, 0)+ROUND(INT(R[-1]C[+3]/2)*0.25, 0)+ROUND(INT(R[-1]C[+4]/2)*0.1, 0) -> 17 | C13: =R[-1]C[-1]*(1-RC[+12]) -> 16.8362858789176 | D13: =R[-1]C[-1]*(1-RC[+12]) -> 16.7982217481984 | E13: =R[-1]C[-1]*(1-RC[+12]) -> 17.6780253639815 | F13: =R[-1]C[-1]*(1-RC[+12]) -> 16.3782110817103 | G13: =R[-1]C[-1]*(1-RC[+12]) -> 16.8198947687241 | H13: =R[-1]C[-1]*(1-RC[+12]) -> 16.5298624818204 | I13: =R[-1]C[-1]*(1-RC[+12]) -> 10.2544064757678 | J13: =R[-1]C[-1]*(1-RC[+12]) -> 12.0656860410842 | K13: =R[-1]C[-1]*(1-RC[+12]) -> 2.26157718819662 | L13: =R[-1]C[-1]*(1-RC[+12]) -> 0 | M13: =SUM(RC[-11]:RC[-1]) -> 142.622171028401 | N13: 'random rate | O13: =RAND()*R3C+0.5*R3C -> 0.00963024241661432 | P13: =RAND()*R3C+0.5*R3C -> 0.00354463347343236 | Q13: =RAND()*R3C+0.5*R3C -> 0.00713932910787409 | R13: =RAND()*R3C+0.5*R3C -> 0.0102118118454844 | S13: =RAND()*R3C+0.5*R3C -> 0.0255248541944685 | T13: =RAND()*R3C+0.5*R3C -> 0.055395563989895 | U13: =RAND()*R3C+0.5*R3C -> 0.0782527632094306 | V13: =RAND()*R3C+0.5*R3C -> 0.365546356193552 | W13: =RAND()*R3C+0.5*R3C -> 0.804591641635906 | X13: =RAND()*R3C+0.5*R3C -> 0.881626124690643
A14: =R[-1]C+1 -> 11 | B14: =ROUND(INT(R[-1]C[+1]/2)*0.75, 0)+ROUND(INT(R[-1]C[+2]/2)*1, 0)+ROUND(INT(R[-1]C[+3]/2)*0.25, 0)+ROUND(INT(R[-1]C[+4]/2)*0.1, 0) -> 17 | C14: =R[-1]C[-1]*(1-RC[+12]) -> 16.8223414774336 | D14: =R[-1]C[-1]*(1-RC[+12]) -> 16.7647893141159 | E14: =R[-1]C[-1]*(1-RC[+12]) -> 16.6730692286796 | F14: =R[-1]C[-1]*(1-RC[+12]) -> 17.3671179710697 | G14: =R[-1]C[-1]*(1-RC[+12]) -> 15.9388744324357 | H14: =R[-1]C[-1]*(1-RC[+12]) -> 15.5108528507191 | I14: =R[-1]C[-1]*(1-RC[+12]) -> 13.6153863713112 | J14: =R[-1]C[-1]*(1-RC[+12]) -> 7.84957687374274 | K14: =R[-1]C[-1]*(1-RC[+12]) -> 7.07750688947498 | L14: =R[-1]C[-1]*(1-RC[+12]) -> -0.735542168105876 | M14: =SUM(RC[-11]:RC[-1]) -> 143.883973240877 | N14: 'random rate | O14: =RAND()*R3C+0.5*R3C -> 0.010450501327438 | P14: =RAND()*R3C+0.5*R3C -> 0.00424657583720268 | Q14: =RAND()*R3C+0.5*R3C -> 0.00745034333959509 | R14: =RAND()*R3C+0.5*R3C -> 0.0175872240541758 | S14: =RAND()*R3C+0.5*R3C -> 0.0268244588546834 | T14: =RAND()*R3C+0.5*R3C -> 0.0778269980879452 | U14: =RAND()*R3C+0.5*R3C -> 0.176315811079164 | V14: =RAND()*R3C+0.5*R3C -> 0.234516703400429 | W14: =RAND()*R3C+0.5*R3C -> 0.41341860998407 | X14: =RAND()*R3C+0.5*R3C -> 1.32523416487606
A15: =R[-1]C+1 -> 12 | B15: =ROUND(INT(R[-1]C[+1]/2)*0.75, 0)+ROUND(INT(R[-1]C[+2]/2)*1, 0)+ROUND(INT(R[-1]C[+3]/2)*0.25, 0)+ROUND(INT(R[-1]C[+4]/2)*0.1, 0) -> 17 | C15: =R[-1]C[-1]*(1-RC[+12]) -> 16.8539760614546 | D15: =R[-1]C[-1]*(1-RC[+12]) -> 16.761667953507 | E15: =R[-1]C[-1]*(1-RC[+12]) -> 16.6233789614652 | F15: =R[-1]C[-1]*(1-RC[+12]) -> 16.5455022889052 | G15: =R[-1]C[-1]*(1-RC[+12]) -> 16.8290394814751 | H15: =R[-1]C[-1]*(1-RC[+12]) -> 14.892176981525 | I15: =R[-1]C[-1]*(1-RC[+12]) -> 12.7030281404644 | J15: =R[-1]C[-1]*(1-RC[+12]) -> 10.0321360199982 | K15: =R[-1]C[-1]*(1-RC[+12]) -> 0.785649162492914 | L15: =R[-1]C[-1]*(1-RC[+12]) -> 2.86859745080247 | M15: =SUM(RC[-11]:RC[-1]) -> 141.89515250209 | N15: 'random rate | O15: =RAND()*R3C+0.5*R3C -> 0.00858964344384831 | P15: =RAND()*R3C+0.5*R3C -> 0.00360672288147112 | Q15: =RAND()*R3C+0.5*R3C -> 0.00843496151374904 | R15: =RAND()*R3C+0.5*R3C -> 0.00765107719669075 | S15: =RAND()*R3C+0.5*R3C -> 0.0309826011714155 | T15: =RAND()*R3C+0.5*R3C -> 0.0656694709119893 | U15: =RAND()*R3C+0.5*R3C -> 0.181023231751213 | V15: =RAND()*R3C+0.5*R3C -> 0.263176545534043 | W15: =RAND()*R3C+0.5*R3C -> 0.899911909249408 | X15: =RAND()*R3C+0.5*R3C -> 0.594688144342411
A16: =R[-1]C+1 -> 13 | B16: =ROUND(INT(R[-1]C[+1]/2)*0.75, 0)+ROUND(INT(R[-1]C[+2]/2)*1, 0)+ROUND(INT(R[-1]C[+3]/2)*0.25, 0)+ROUND(INT(R[-1]C[+4]/2)*0.1, 0) -> 17 | C16: =R[-1]C[-1]*(1-RC[+12]) -> 16.919446538937 | D16: =R[-1]C[-1]*(1-RC[+12]) -> 16.7618991199121 | E16: =R[-1]C[-1]*(1-RC[+12]) -> 16.5694725298109 | F16: =R[-1]C[-1]*(1-RC[+12]) -> 16.2901277997764 | G16: =R[-1]C[-1]*(1-RC[+12]) -> 16.0947987286242 | H16: =R[-1]C[-1]*(1-RC[+12]) -> 15.2458750040023 | I16: =R[-1]C[-1]*(1-RC[+12]) -> 12.1177101554669 | J16: =R[-1]C[-1]*(1-RC[+12]) -> 8.49194680070406 | K16: =R[-1]C[-1]*(1-RC[+12]) -> 6.5021201431867 | L16: =R[-1]C[-1]*(1-RC[+12]) -> 0.280500678330307 | M16: =SUM(RC[-11]:RC[-1]) -> 142.273897498751 | N16: 'random rate | O16: =RAND()*R3C+0.5*R3C -> 0.00473843888606105 | P16: =RAND()*R3C+0.5*R3C -> 0.00546321777168244 | Q16: =RAND()*R3C+0.5*R3C -> 0.0114663662488242 | R16: =RAND()*R3C+0.5*R3C -> 0.0200471373757037 | S16: =RAND()*R3C+0.5*R3C -> 0.0272402464676605 | T16: =RAND()*R3C+0.5*R3C -> 0.0940733711639044 | U16: =RAND()*R3C+0.5*R3C -> 0.186303643147678 | V16: =RAND()*R3C+0.5*R3C -> 0.331502165719553 | W16: =RAND()*R3C+0.5*R3C -> 0.351870814926626 | X16: =RAND()*R3C+0.5*R3C -> 0.64296954452257
A17: =R[-1]C+1 -> 14 | B17: =ROUND(INT(R[-1]C[+1]/2)*0.75, 0)+ROUND(INT(R[-1]C[+2]/2)*1, 0)+ROUND(INT(R[-1]C[+3]/2)*0.25, 0)+ROUND(INT(R[-1]C[+4]/2)*0.1, 0) -> 17 | C17: =R[-1]C[-1]*(1-RC[+12]) -> 16.9019602642591 | D17: =R[-1]C[-1]*(1-RC[+12]) -> 16.8150119357855 | E17: =R[-1]C[-1]*(1-RC[+12]) -> 16.5609708488923 | F17: =R[-1]C[-1]*(1-RC[+12]) -> 16.3722312911595 | G17: =R[-1]C[-1]*(1-RC[+12]) -> 15.8409004081287 | H17: =R[-1]C[-1]*(1-RC[+12]) -> 14.9619700104793 | I17: =R[-1]C[-1]*(1-RC[+12]) -> 13.6421921170405 | J17: =R[-1]C[-1]*(1-RC[+12]) -> 9.17186779952997 | K17: =R[-1]C[-1]*(1-RC[+12]) -> 5.22719660985382 | L17: =R[-1]C[-1]*(1-RC[+12]) -> 2.41946107327942 | M17: =SUM(RC[-11]:RC[-1]) -> 144.913762358408 | N17: 'random rate | O17: =RAND()*R3C+0.5*R3C -> 0.00576704327887485 | P17: =RAND()*R3C+0.5*R3C -> 0.0061724597734987 | Q17: =RAND()*R3C+0.5*R3C -> 0.0119872020218238 | R17: =RAND()*R3C+0.5*R3C -> 0.0119038936391335 | S17: =RAND()*R3C+0.5*R3C -> 0.0275766646627452 | T17: =RAND()*R3C+0.5*R3C -> 0.0703847707104415 | U17: =RAND()*R3C+0.5*R3C -> 0.105187986031683 | V17: =RAND()*R3C+0.5*R3C -> 0.243102229558438 | W17: =RAND()*R3C+0.5*R3C -> 0.384452501584156 | X17: =RAND()*R3C+0.5*R3C -> 0.627896590650563
A18: =R[-1]C+1 -> 15 | B18: =ROUND(INT(R[-1]C[+1]/2)*0.75, 0)+ROUND(INT(R[-1]C[+2]/2)*1, 0)+ROUND(INT(R[-1]C[+3]/2)*0.25, 0)+ROUND(INT(R[-1]C[+4]/2)*0.1, 0) -> 17 | C18: =R[-1]C[-1]*(1-RC[+12]) -> 16.7870222167433 | D18: =R[-1]C[-1]*(1-RC[+12]) -> 16.8637353372792 | E18: =R[-1]C[-1]*(1-RC[+12]) -> 16.5916187258256 | F18: =R[-1]C[-1]*(1-RC[+12]) -> 16.2649743399971 | G18: =R[-1]C[-1]*(1-RC[+12]) -> 15.8773505273638 | H18: =R[-1]C[-1]*(1-RC[+12]) -> 15.0467496592381 | I18: =R[-1]C[-1]*(1-RC[+12]) -> 12.1964262305326 | J18: =R[-1]C[-1]*(1-RC[+12]) -> 8.98242578090968 | K18: =R[-1]C[-1]*(1-RC[+12]) -> 2.27171067678186 | L18: =R[-1]C[-1]*(1-RC[+12]) -> 2.15819942229949 | M18: =SUM(RC[-11]:RC[-1]) -> 140.040212916971 | N18: 'random rate | O18: =RAND()*R3C+0.5*R3C -> 0.0125281048974502 | P18: =RAND()*R3C+0.5*R3C -> 0.00226156767512979 | Q18: =RAND()*R3C+0.5*R3C -> 0.0132853435259536 | R18: =RAND()*R3C+0.5*R3C -> 0.0178731374866867 | S18: =RAND()*R3C+0.5*R3C -> 0.0302268368308999 | T18: =RAND()*R3C+0.5*R3C -> 0.0501329298480408 | U18: =RAND()*R3C+0.5*R3C -> 0.184838211679997 | V18: =RAND()*R3C+0.5*R3C -> 0.341570203392043 | W18: =RAND()*R3C+0.5*R3C -> 0.752317551186435 | X18: =RAND()*R3C+0.5*R3C -> 0.587121054863126
A19: =R[-1]C+1 -> 16 | B19: =ROUND(INT(R[-1]C[+1]/2)*0.75, 0)+ROUND(INT(R[-1]C[+2]/2)*1, 0)+ROUND(INT(R[-1]C[+3]/2)*0.25, 0)+ROUND(INT(R[-1]C[+4]/2)*0.1, 0) -> 17 | C19: =R[-1]C[-1]*(1-RC[+12]) -> 16.8138527104933 | D19: =R[-1]C[-1]*(1-RC[+12]) -> 16.7104246182407 | E19: =R[-1]C[-1]*(1-RC[+12]) -> 16.6553993401418 | F19: =R[-1]C[-1]*(1-RC[+12]) -> 16.4000187835275 | G19: =R[-1]C[-1]*(1-RC[+12]) -> 15.9645792854037 | H19: =R[-1]C[-1]*(1-RC[+12]) -> 14.4743528765307 | I19: =R[-1]C[-1]*(1-RC[+12]) -> 12.8159408753776 | J19: =R[-1]C[-1]*(1-RC[+12]) -> 9.20842780086295 | K19: =R[-1]C[-1]*(1-RC[+12]) -> 3.94179339600402 | L19: =R[-1]C[-1]*(1-RC[+12]) -> -0.336191676150514 | M19: =SUM(RC[-11]:RC[-1]) -> 139.648598010432 | N19: 'random rate | O19: =RAND()*R3C+0.5*R3C -> 0.0109498405592166 | P19: =RAND()*R3C+0.5*R3C -> 0.0045629056490012 | Q19: =RAND()*R3C+0.5*R3C -> 0.0123540836576575 | R19: =RAND()*R3C+0.5*R3C -> 0.0115479957359348 | S19: =RAND()*R3C+0.5*R3C -> 0.0184688305258889 | T19: =RAND()*R3C+0.5*R3C -> 0.0883647210795725 | U19: =RAND()*R3C+0.5*R3C -> 0.148258516582082 | V19: =RAND()*R3C+0.5*R3C -> 0.244989669366379 | W19: =RAND()*R3C+0.5*R3C -> 0.561166048888319 | X19: =RAND()*R3C+0.5*R3C -> 1.14799053400003
A20: =R[-1]C+1 -> 17 | B20: =ROUND(INT(R[-1]C[+1]/2)*0.75, 0)+ROUND(INT(R[-1]C[+2]/2)*1, 0)+ROUND(INT(R[-1]C[+3]/2)*0.25, 0)+ROUND(INT(R[-1]C[+4]/2)*0.1, 0) -> 17 | C20: =R[-1]C[-1]*(1-RC[+12]) -> 16.8969583183725 | D20: =R[-1]C[-1]*(1-RC[+12]) -> 16.7305984739978 | E20: =R[-1]C[-1]*(1-RC[+12]) -> 16.5018977028531 | F20: =R[-1]C[-1]*(1-RC[+12]) -> 16.4590891916481 | G20: =R[-1]C[-1]*(1-RC[+12]) -> 15.8312307499449 | H20: =R[-1]C[-1]*(1-RC[+12]) -> 14.5389030081716 | I20: =R[-1]C[-1]*(1-RC[+12]) -> 11.8715157297131 | J20: =R[-1]C[-1]*(1-RC[+12]) -> 8.614180250966 | K20: =R[-1]C[-1]*(1-RC[+12]) -> 3.74172637152571 | L20: =R[-1]C[-1]*(1-RC[+12]) -> 0.433999010693086 | M20: =SUM(RC[-11]:RC[-1]) -> 138.620098807886 | N20: 'random rate | O20: =RAND()*R3C+0.5*R3C -> 0.006061275389854 | P20: =RAND()*R3C+0.5*R3C -> 0.00495152645435 | Q20: =RAND()*R3C+0.5*R3C -> 0.0124788519832046 | R20: =RAND()*R3C+0.5*R3C -> 0.0117865771023945 | S20: =RAND()*R3C+0.5*R3C -> 0.0346821574469115 | T20: =RAND()*R3C+0.5*R3C -> 0.0893024646465685 | U20: =RAND()*R3C+0.5*R3C -> 0.179824077043054 | V20: =RAND()*R3C+0.5*R3C -> 0.327854245370633 | W20: =RAND()*R3C+0.5*R3C -> 0.593662843164708 | X20: =RAND()*R3C+0.5*R3C -> 0.889898082651148
A21: =R[-1]C+1 -> 18 | B21: =ROUND(INT(R[-1]C[+1]/2)*0.75, 0)+ROUND(INT(R[-1]C[+2]/2)*1, 0)+ROUND(INT(R[-1]C[+3]/2)*0.25, 0)+ROUND(INT(R[-1]C[+4]/2)*0.1, 0) -> 17 | C21: =R[-1]C[-1]*(1-RC[+12]) -> 16.7796127942554 | D21: =R[-1]C[-1]*(1-RC[+12]) -> 16.833483183036 | E21: =R[-1]C[-1]*(1-RC[+12]) -> 16.5529504733562 | F21: =R[-1]C[-1]*(1-RC[+12]) -> 16.1617925887022 | G21: =R[-1]C[-1]*(1-RC[+12]) -> 15.7683510599004 | H21: =R[-1]C[-1]*(1-RC[+12]) -> 14.9664426926623 | I21: =R[-1]C[-1]*(1-RC[+12]) -> 11.4012662252593 | J21: =R[-1]C[-1]*(1-RC[+12]) -> 7.90308801598618 | K21: =R[-1]C[-1]*(1-RC[+12]) -> 0.700561992800026 | L21: =R[-1]C[-1]*(1-RC[+12]) -> 1.67887067420074 | M21: =SUM(RC[-11]:RC[-1]) -> 135.746419700159 | N21: 'random rate | O21: =RAND()*R3C+0.5*R3C -> 0.0129639532790934 | P21: =RAND()*R3C+0.5*R3C -> 0.00375660128530066 | Q21: =RAND()*R3C+0.5*R3C -> 0.010618149788105 | R21: =RAND()*R3C+0.5*R3C -> 0.0206100607502922 | S21: =RAND()*R3C+0.5*R3C -> 0.0419669717871253 | T21: =RAND()*R3C+0.5*R3C -> 0.0546254470635877 | U21: =RAND()*R3C+0.5*R3C -> 0.215809733454358 | V21: =RAND()*R3C+0.5*R3C -> 0.334281468691853 | W21: =RAND()*R3C+0.5*R3C -> 0.918673399860484 | X21: =RAND()*R3C+0.5*R3C -> 0.551311211055722
A22: =R[-1]C+1 -> 19 | B22: =ROUND(INT(R[-1]C[+1]/2)*0.75, 0)+ROUND(INT(R[-1]C[+2]/2)*1, 0)+ROUND(INT(R[-1]C[+3]/2)*0.25, 0)+ROUND(INT(R[-1]C[+4]/2)*0.1, 0) -> 17 | C22: =R[-1]C[-1]*(1-RC[+12]) -> 16.8062395861169 | D22: =R[-1]C[-1]*(1-RC[+12]) -> 16.6942650527609 | E22: =R[-1]C[-1]*(1-RC[+12]) -> 16.7258045739825 | F22: =R[-1]C[-1]*(1-RC[+12]) -> 16.3532015125484 | G22: =R[-1]C[-1]*(1-RC[+12]) -> 15.6378470355475 | H22: =R[-1]C[-1]*(1-RC[+12]) -> 14.8747691029177 | I22: =R[-1]C[-1]*(1-RC[+12]) -> 13.2180635656806 | J22: =R[-1]C[-1]*(1-RC[+12]) -> 6.90628495730174 | K22: =R[-1]C[-1]*(1-RC[+12]) -> 0.919642994430426 | L22: =R[-1]C[-1]*(1-RC[+12]) -> -0.156861675108906 | M22: =SUM(RC[-11]:RC[-1]) -> 134.979256706178 | N22: 'random rate | O22: =RAND()*R3C+0.5*R3C -> 0.0113976714048873 | P22: =RAND()*R3C+0.5*R3C -> 0.00508639517139092 | Q22: =RAND()*R3C+0.5*R3C -> 0.00639669210956959 | R22: =RAND()*R3C+0.5*R3C -> 0.0120672723046795 | S22: =RAND()*R3C+0.5*R3C -> 0.0324187772042684 | T22: =RAND()*R3C+0.5*R3C -> 0.0566693342625504 | U22: =RAND()*R3C+0.5*R3C -> 0.116819952669111 | V22: =RAND()*R3C+0.5*R3C -> 0.394252811849883 | W22: =RAND()*R3C+0.5*R3C -> 0.883634980077383 | X22: =RAND()*R3C+0.5*R3C -> 1.22390834318881
A23: =R[-1]C+1 -> 20 | B23: =ROUND(INT(R[-1]C[+1]/2)*0.75, 0)+ROUND(INT(R[-1]C[+2]/2)*1, 0)+ROUND(INT(R[-1]C[+3]/2)*0.25, 0)+ROUND(INT(R[-1]C[+4]/2)*0.1, 0) -> 17 | C23: =R[-1]C[-1]*(1-RC[+12]) -> 16.8223510809705 | D23: =R[-1]C[-1]*(1-RC[+12]) -> 16.7415449859237 | E23: =R[-1]C[-1]*(1-RC[+12]) -> 16.6054328522357 | F23: =R[-1]C[-1]*(1-RC[+12]) -> 16.5468132176682 | G23: =R[-1]C[-1]*(1-RC[+12]) -> 15.7119118731832 | H23: =R[-1]C[-1]*(1-RC[+12]) -> 14.7972390358664 | I23: =R[-1]C[-1]*(1-RC[+12]) -> 13.1809088898638 | J23: =R[-1]C[-1]*(1-RC[+12]) -> 10.729726902201 | K23: =R[-1]C[-1]*(1-RC[+12]) -> 4.57520116799987 | L23: =R[-1]C[-1]*(1-RC[+12]) -> -0.0614167350157078 | M23: =SUM(RC[-11]:RC[-1]) -> 142.649713270897 | N23: 'random rate | O23: =RAND()*R3C+0.5*R3C -> 0.0104499364134972 | P23: =RAND()*R3C+0.5*R3C -> 0.00384943936219059 | Q23: =RAND()*R3C+0.5*R3C -> 0.00532112077078016 | R23: =RAND()*R3C+0.5*R3C -> 0.0107015094862907 | S23: =RAND()*R3C+0.5*R3C -> 0.0392149291912681 | T23: =RAND()*R3C+0.5*R3C -> 0.0537547143011618 | U23: =RAND()*R3C+0.5*R3C -> 0.113874723119006 | V23: =RAND()*R3C+0.5*R3C -> 0.188252738467703 | W23: =RAND()*R3C+0.5*R3C -> 0.337530785902094 | X23: =RAND()*R3C+0.5*R3C -> 1.06678323587268

Sheet: Five
B1: 'Individuals per Age Group | M1: 'Total | O1: 0 | P1: =RC[-1]+1 -> 1 | Q1: =RC[-1]+1 -> 2 | R1: =RC[-1]+1 -> 3 | S1: =RC[-1]+1 -> 4 | T1: =RC[-1]+1 -> 5 | U1: =RC[-1]+1 -> 6 | V1: =RC[-1]+1 -> 7 | W1: =RC[-1]+1 -> 8 | X1: =RC[-1]+1 -> 9 | Y1: 'catastrophe?
A2: 'Period | B2: 0 | C2: =RC[-1]+1 -> 1 | D2: =RC[-1]+1 -> 2 | E2: =RC[-1]+1 -> 3 | F2: =RC[-1]+1 -> 4 | G2: =RC[-1]+1 -> 5 | H2: =RC[-1]+1 -> 6 | I2: =RC[-1]+1 -> 7 | J2: =RC[-1]+1 -> 8 | K2: =RC[-1]+1 -> 9 | L2: =RC[-1]+1 -> 10 | N2: 'Survival Rates | O2: 0.99095 | P2: 0.995549725011353 | Q2: 0.990289293895838 | R2: 0.986202096298723 | S2: 0.970658446464898 | T2: 0.935575966895136 | U2: 0.85215324129103 | V2: 0.684482296137339 | W2: 0.369138826295679 | X2: 0.0945910080152874 | Y2: =COUNTIF(CLOSURE("=", NA(), 2), R[+2]C:R[+21]C) -> 0
A3: 0 | B3: 0 | C3: 50 | D3: 0 | E3: 0 | F3: 0 | G3: 0 | H3: 0 | I3: 0 | J3: 0 | K3: 0 | L3: 0 | M3: =SUM(RC[-11]:RC[-1]) -> 50 | N3: 'death rate | O3: =1-R[-1]C -> 0.00905 | P3: =1-R[-1]C -> 0.00445027498864703 | Q3: =1-R[-1]C -> 0.00971070610416203 | R3: =1-R[-1]C -> 0.013797903701277 | S3: =1-R[-1]C -> 0.029341553535102 | T3: =1-R[-1]C -> 0.064424033104864 | U3: =1-R[-1]C -> 0.14784675870897 | V3: =1-R[-1]C -> 0.315517703862661 | W3: =1-R[-1]C -> 0.630861173704321 | X3: =1-R[-1]C -> 0.905408991984713
A4: =R[-1]C+1 -> 1 | B4: =ROUND(INT(R[-1]C[+1]/2)*0.75, 0)+ROUND(INT(R[-1]C[+2]/2)*1, 0)+ROUND(INT(R[-1]C[+3]/2)*0.25, 0)+ROUND(INT(R[-1]C[+4]/2)*0.1, 0) -> 19 | C4: =R[-1]C[-1]*(1-RC[+12]) -> 0 | D4: =R[-1]C[-1]*(1-RC[+12]) -> 49.66766706062 | E4: =R[-1]C[-1]*(1-RC[+12]) -> 0 | F4: =R[-1]C[-1]*(1-RC[+12]) -> 0 | G4: =R[-1]C[-1]*(1-RC[+12]) -> 0 | H4: =R[-1]C[-1]*(1-RC[+12]) -> 0 | I4: =R[-1]C[-1]*(1-RC[+12]) -> 0 | J4: =R[-1]C[-1]*(1-RC[+12]) -> 0 | K4: =R[-1]C[-1]*(1-RC[+12]) -> 0 | L4: =R[-1]C[-1]*(1-RC[+12]) -> 0 | M4: =SUM(RC[-11]:RC[-1]) -> 68.66766706062 | N4: 'random rate | O4: =MIN((RAND()*R3C+0.5*R3C)*RC25, 1) -> 0.00575275348766137 | P4: =MIN((RAND()*R3C+0.5*R3C)*RC25, 1) -> 0.0066466587875996 | Q4: =MIN((RAND()*R3C+0.5*R3C)*RC25, 1) -> 0.00860652829730899 | R4: =MIN((RAND()*R3C+0.5*R3C)*RC25, 1) -> 0.0138425578324378 | S4: =MIN((RAND()*R3C+0.5*R3C)*RC25, 1) -> 0.0411479038778827 | T4: =MIN((RAND()*R3C+0.5*R3C)*RC25, 1) -> 0.0558633137816883 | U4: =MIN((RAND()*R3C+0.5*R3C)*RC25, 1) -> 0.188050698983574 | V4: =MIN((RAND()*R3C+0.5*R3C)*RC25, 1) -> 0.271322513028326 | W4: =MIN((RAND()*R3C+0.5*R3C)*RC25, 1) -> 0.523034365868356 | X4: =MIN((RAND()*R3C+0.5*R3C)*RC25, 1) -> 0.738956585966611 | Y4: =IF(RAND()<0.01, 2, 1) -> 1
A5: =R[-1]C+1 -> 2 | B5: =(ROUND(INT(R[-1]C[+1]/2)*0.75, 0)+ROUND(INT(R[-1]C[+2]/2)*1, 0)+ROUND(INT(R[-1]C[+3]/2)*0.25, 0)+ROUND(INT(R[-1]C[+4]/2)*0.1, 0))*(1-RC[+13]) -> 23.8225922975313 | C5: =R[-1]C[-1]*(1-RC[+12]) -> 18.8595522355456 | D5: =R[-1]C[-1]*(1-RC[+12]) -> 0 | E5: =R[-1]C[-1]*(1-RC[+12]) -> 49.1477571984953 | F5: =R[-1]C[-1]*(1-RC[+12]) -> 0 | G5: =R[-1]C[-1]*(1-RC[+12]) -> 0 | H5: =R[-1]C[-1]*(1-RC[+12]) -> 0 | I5: =R[-1]C[-1]*(1-RC[+12]) -> 0 | J5: =R[-1]C[-1]*(1-RC[+12]) -> 0 | K5: =R[-1]C[-1]*(1-RC[+12]) -> 0 | L5: =R[-1]C[-1]*(1-RC[+12]) -> 0 | M5: =SUM(RC[-11]:RC[-1]) -> 91.8299017315722 | N5: 'random rate | O5: =MIN((RAND()*R3C+0.5*R3C)*RC25, 1) -> 0.00739198760286299 | P5: =MIN((RAND()*R3C+0.5*R3C)*RC25, 1) -> 0.00418883033473072 | Q5: =MIN((RAND()*R3C+0.5*R3C)*RC25, 1) -> 0.0104677729576091 | R5: =MIN((RAND()*R3C+0.5*R3C)*RC25, 1) -> 0.00956259314755245 | S5: =MIN((RAND()*R3C+0.5*R3C)*RC25, 1) -> 0.0164807321977742 | T5: =MIN((RAND()*R3C+0.5*R3C)*RC25, 1) -> 0.0912827109160466 | U5: =MIN((RAND()*R3C+0.5*R3C)*RC25, 1) -> 0.130696840002167 | V5: =MIN((RAND()*R3C+0.5*R3C)*RC25, 1) -> 0.173241201702308 | W5: =MIN((RAND()*R3C+0.5*R3C)*RC25, 1) -> 0.75335742160486 | X5: =MIN((RAND()*R3C+0.5*R3C)*RC25, 1) -> 1 | Y5: =IF(RAND()<0.01, 2, 1) -> 1
A6: =R[-1]C+1 -> 3 | B6: =(ROUND(INT(R[-1]C[+1]/2)*0.75, 0)+ROUND(INT(R[-1]C[+2]/2)*1, 0)+ROUND(INT(R[-1]C[+3]/2)*0.25, 0)+ROUND(INT(R[-1]C[+4]/2)*0.1, 0))*(1-RC[+13]) -> 12.8428862816183 | C6: =R[-1]C[-1]*(1-RC[+12]) -> 23.5346802931192 | D6: =R[-1]C[-1]*(1-RC[+12]) -> 18.7622948326512 | E6: =R[-1]C[-1]*(1-RC[+12]) -> 0 | F6: =R[-1]C[-1]*(1-RC[+12]) -> 48.3646213365318 | G6: =R[-1]C[-1]*(1-RC[+12]) -> 0 | H6: =R[-1]C[-1]*(1-RC[+12]) -> 0 | I6: =R[-1]C[-1]*(1-RC[+12]) -> 0 | J6: =R[-1]C[-1]*(1-RC[+12]) -> 0 | K6: =R[-1]C[-1]*(1-RC[+12]) -> 0 | L6: =R[-1]C[-1]*(1-RC[+12]) -> 0 | M6: =SUM(RC[-11]:RC[-1]) -> 103.504482743921 | N6: 'random rate | O6: =MIN((RAND()*R3C+0.5*R3C)*RC25, 1) -> 0.0120856706447483 | P6: =MIN((RAND()*R3C+0.5*R3C)*RC25, 1) -> 0.0051569306460549 | Q6: =MIN((RAND()*R3C+0.5*R3C)*RC25, 1) -> 0.0117937574861364 | R6: =MIN((RAND()*R3C+0.5*R3C)*RC25, 1) -> 0.0159343153503549 | S6: =MIN((RAND()*R3C+0.5*R3C)*RC25, 1) -> 0.0346373949846256 | T6: =MIN((RAND()*R3C+0.5*R3C)*RC25, 1) -> 0.0375089674405728 | U6: =MIN((RAND()*R3C+0.5*R3C)*RC25, 1) -> 0.110198883023705 | V6: =MIN((RAND()*R3C+0.5*R3C)*RC25, 1) -> 0.21366450290536 | W6: =MIN((RAND()*R3C+0.5*R3C)*RC25, 1) -> 0.37102394713665 | X6: =MIN((RAND()*R3C+0.5*R3C)*RC25, 1) -> 0.849378190775794 | Y6: =IF(RAND()<0.01, 2, 1) -> 1
A7: =R[-1]C+1 -> 4 | B7: =(ROUND(INT(R[-1]C[+1]/2)*0.75, 0)+ROUND(INT(R[-1]C[+2]/2)*1, 0)+ROUND(INT(R[-1]C[+3]/2)*0.25, 0)+ROUND(INT(R[-1]C[+4]/2)*0.1, 0))*(1-RC[+13]) -> 18.8465693696095 | C7: =R[-1]C[-1]*(1-RC[+12]) -> 12.7391761690803 | D7: =R[-1]C[-1]*(1-RC[+12]) -> 23.385187994169 | E7: =R[-1]C[-1]*(1-RC[+12]) -> 18.5048589018064 | F7: =R[-1]C[-1]*(1-RC[+12]) -> 0 | G7: =R[-1]C[-1]*(1-RC[+12]) -> 46.975780121188 | H7: =R[-1]C[-1]*(1-RC[+12]) -> 0 | I7: =R[-1]C[-1]*(1-RC[+12]) -> 0 | J7: =R[-1]C[-1]*(1-RC[+12]) -> 0 | K7: =R[-1]C[-1]*(1-RC[+12]) -> 0 | L7: =R[-1]C[-1]*(1-RC[+12]) -> 0 | M7: =SUM(RC[-11]:RC[-1]) -> 120.451572555853 | N7: 'random rate | O7: =MIN((RAND()*R3C+0.5*R3C)*RC25, 1) -> 0.00807529633634272 | P7: =MIN((RAND()*R3C+0.5*R3C)*RC25, 1) -> 0.00635200041335905 | Q7: =MIN((RAND()*R3C+0.5*R3C)*RC25, 1) -> 0.0137209191701257 | R7: =MIN((RAND()*R3C+0.5*R3C)*RC25, 1) -> 0.0111604790290263 | S7: =MIN((RAND()*R3C+0.5*R3C)*RC25, 1) -> 0.0287160568399784 | T7: =MIN((RAND()*R3C+0.5*R3C)*RC25, 1) -> 0.0825816186556878 | U7: =MIN((RAND()*R3C+0.5*R3C)*RC25, 1) -> 0.157193795292046 | V7: =MIN((RAND()*R3C+0.5*R3C)*RC25, 1) -> 0.397373907211749 | W7: =MIN((RAND()*R3C+0.5*R3C)*RC25, 1) -> 0.369677177385162 | X7: =MIN((RAND()*R3C+0.5*R3C)*RC25, 1) -> 1 | Y7: =IF(RAND()<0.01, 2, 1) -> 1
A8: =R[-1]C+1 -> 5 | B8: =(ROUND(INT(R[-1]C[+1]/2)*0.75, 0)+ROUND(INT(R[-1]C[+2]/2)*1, 0)+ROUND(INT(R[-1]C[+3]/2)*0.25, 0)+ROUND(INT(R[-1]C[+4]/2)*0.1, 0))*(1-RC[+13]) -> 17.7866158904303 | C8: =R[-1]C[-1]*(1-RC[+12]) -> 18.6231494571996 | D8: =R[-1]C[-1]*(1-RC[+12]) -> 12.7040345613938 | E8: =R[-1]C[-1]*(1-RC[+12]) -> 23.1879428275932 | F8: =R[-1]C[-1]*(1-RC[+12]) -> 18.1699446830772 | G8: =R[-1]C[-1]*(1-RC[+12]) -> 0 | H8: =R[-1]C[-1]*(1-RC[+12]) -> 44.88089733272 | I8: =R[-1]C[-1]*(1-RC[+12]) -> 0 | J8: =R[-1]C[-1]*(1-RC[+12]) -> 0 | K8: =R[-1]C[-1]*(1-RC[+12]) -> 0 | L8: =R[-1]C[-1]*(1-RC[+12]) -> 0 | M8: =SUM(RC[-11]:RC[-1]) -> 135.352584752414 | N8: 'random rate | O8: =MIN((RAND()*R3C+0.5*R3C)*RC25, 1) -> 0.0118546727538713 | P8: =MIN((RAND()*R3C+0.5*R3C)*RC25, 1) -> 0.00275854633141115 | Q8: =MIN((RAND()*R3C+0.5*R3C)*RC25, 1) -> 0.00843461966715986 | R8: =MIN((RAND()*R3C+0.5*R3C)*RC25, 1) -> 0.0180987177749553 | S8: =MIN((RAND()*R3C+0.5*R3C)*RC25, 1) -> 0.0175987291710346 | T8: =MIN((RAND()*R3C+0.5*R3C)*RC25, 1) -> 0.0445949547418604 | U8: =MIN((RAND()*R3C+0.5*R3C)*RC25, 1) -> 0.151565798097282 | V8: =MIN((RAND()*R3C+0.5*R3C)*RC25, 1) -> 0.462441406097594 | W8: =MIN((RAND()*R3C+0.5*R3C)*RC25, 1) -> 0.929374599507306 | X8: =MIN((RAND()*R3C+0.5*R3C)*RC25, 1) -> 1 | Y8: =IF(RAND()<0.01, 2, 1) -> 1
A9: =R[-1]C+1 -> 6 | B9: =(ROUND(INT(R[-1]C[+1]/2)*0.75, 0)+ROUND(INT(R[-1]C[+2]/2)*1, 0)+ROUND(INT(R[-1]C[+3]/2)*0.25, 0)+ROUND(INT(R[-1]C[+4]/2)*0.1, 0))*(1-RC[+13]) -> 16.7694546848618 | C9: =R[-1]C[-1]*(1-RC[+12]) -> 17.5454028924479 | D9: =R[-1]C[-1]*(1-RC[+12]) -> 18.5100814934087 | E9: =R[-1]C[-1]*(1-RC[+12]) -> 12.5238043072709 | F9: =R[-1]C[-1]*(1-RC[+12]) -> 22.7321492064134 | G9: =R[-1]C[-1]*(1-RC[+12]) -> 17.8461193336956 | H9: =R[-1]C[-1]*(1-RC[+12]) -> 0 | I9: =R[-1]C[-1]*(1-RC[+12]) -> 36.0909530583438 | J9: =R[-1]C[-1]*(1-RC[+12]) -> 0 | K9: =R[-1]C[-1]*(1-RC[+12]) -> 0 | L9: =R[-1]C[-1]*(1-RC[+12]) -> 0 | M9: =SUM(RC[-11]:RC[-1]) -> 142.017964976442 | N9: 'random rate | O9: =MIN((RAND()*R3C+0.5*R3C)*RC25, 1) -> 0.0135614891257773 | P9: =MIN((RAND()*R3C+0.5*R3C)*RC25, 1) -> 0.00607136639540073 | Q9: =MIN((RAND()*R3C+0.5*R3C)*RC25, 1) -> 0.0141868516849451 | R9: =MIN((RAND()*R3C+0.5*R3C)*RC25, 1) -> 0.0196564923662561 | S9: =MIN((RAND()*R3C+0.5*R3C)*RC25, 1) -> 0.0178220327595851 | T9: =MIN((RAND()*R3C+0.5*R3C)*RC25, 1) -> 0.0673486997969742 | U9: =MIN((RAND()*R3C+0.5*R3C)*RC25, 1) -> 0.195850457472204 | V9: =MIN((RAND()*R3C+0.5*R3C)*RC25, 1) -> 0.286653099611548 | W9: =MIN((RAND()*R3C+0.5*R3C)*RC25, 1) -> 0.85076308361318 | X9: =MIN((RAND()*R3C+0.5*R3C)*RC25, 1) -> 0.764169032006474 | Y9: =IF(RAND()<0.01, 2, 1) -> 1
A10: =R[-1]C+1 -> 7 | B10: =(ROUND(INT(R[-1]C[+1]/2)*0.75, 0)+ROUND(INT(R[-1]C[+2]/2)*1, 0)+ROUND(INT(R[-1]C[+3]/2)*0.25, 0)+ROUND(INT(R[-1]C[+4]/2)*0.1, 0))*(1-RC[+13]) -> 17.7708558652246 | C10: =R[-1]C[-1]*(1-RC[+12]) -> 16.5559756746164 | D10: =R[-1]C[-1]*(1-RC[+12]) -> 17.4982065288246 | E10: =R[-1]C[-1]*(1-RC[+12]) -> 18.380224558672 | F10: =R[-1]C[-1]*(1-RC[+12]) -> 12.2819903005863 | G10: =R[-1]C[-1]*(1-RC[+12]) -> 22.0123368987713 | H10: =R[-1]C[-1]*(1-RC[+12]) -> 16.4118781653897 | I10: =R[-1]C[-1]*(1-RC[+12]) -> 0 | J10: =R[-1]C[-1]*(1-RC[+12]) -> 24.6065103316227 | K10: =R[-1]C[-1]*(1-RC[+12]) -> 0 | L10: =R[-1]C[-1]*(1-RC[+12]) -> 0 | M10: =SUM(RC[-11]:RC[-1]) -> 145.517978323708 | N10: 'random rate | O10: =MIN((RAND()*R3C+0.5*R3C)*RC25, 1) -> 0.0127302297097422 | P10: =MIN((RAND()*R3C+0.5*R3C)*RC25, 1) -> 0.00268995610489025 | Q10: =MIN((RAND()*R3C+0.5*R3C)*RC25, 1) -> 0.00701547071972345 | R10: =MIN((RAND()*R3C+0.5*R3C)*RC25, 1) -> 0.0193083507815799 | S10: =MIN((RAND()*R3C+0.5*R3C)*RC25, 1) -> 0.0316649473442225 | T10: =MIN((RAND()*R3C+0.5*R3C)*RC25, 1) -> 0.0803671174381229 | U10: =MIN((RAND()*R3C+0.5*R3C)*RC25, 1) -> 0.105905170749724 | V10: =MIN((RAND()*R3C+0.5*R3C)*RC25, 1) -> 0.318208352884325 | W10: =MIN((RAND()*R3C+0.5*R3C)*RC25, 1) -> 0.707796944904957 | X10: =MIN((RAND()*R3C+0.5*R3C)*RC25, 1) -> 1 | Y10: =IF(RAND()<0.01, 2, 1) -> 1
A11: =R[-1]C+1 -> 8 | B11: =(ROUND(INT(R[-1]C[+1]/2)*0.75, 0)+ROUND(INT(R[-1]C[+2]/2)*1, 0)+ROUND(INT(R[-1]C[+3]/2)*0.25, 0)+ROUND(INT(R[-1]C[+4]/2)*0.1, 0))*(1-RC[+13]) -> 16.8315559181171 | C11: =R[-1]C[-1]*(1-RC[+12]) -> 17.5947737769604 | D11: =R[-1]C[-1]*(1-RC[+12]) -> 16.4622866965227 | E11: =R[-1]C[-1]*(1-RC[+12]) -> 17.2516576147662 | F11: =R[-1]C[-1]*(1-RC[+12]) -> 18.1344238855564 | G11: =R[-1]C[-1]*(1-RC[+12]) -> 11.8307371002916 | H11: =R[-1]C[-1]*(1-RC[+12]) -> 20.5515069474404 | I11: =R[-1]C[-1]*(1-RC[+12]) -> 15.0693321027443 | J11: =R[-1]C[-1]*(1-RC[+12]) -> 0 | K11: =R[-1]C[-1]*(1-RC[+12]) -> 11.8716087312501 | L11: =R[-1]C[-1]*(1-RC[+12]) -> 0 | M11: =SUM(RC[-11]:RC[-1]) -> 145.597882773649 | N11: 'random rate | O11: =MIN((RAND()*R3C+0.5*R3C)*RC25, 1) -> 0.00990847540487697 | P11: =MIN((RAND()*R3C+0.5*R3C)*RC25, 1) -> 0.00565892218828064 | Q11: =MIN((RAND()*R3C+0.5*R3C)*RC25, 1) -> 0.0140899533704942 | R11: =MIN((RAND()*R3C+0.5*R3C)*RC25, 1) -> 0.0133731050091852 | S11: =MIN((RAND()*R3C+0.5*R3C)*RC25, 1) -> 0.0367410484173041 | T11: =MIN((RAND()*R3C+0.5*R3C)*RC25, 1) -> 0.0663641465260556 | U11: =MIN((RAND()*R3C+0.5*R3C)*RC25, 1) -> 0.0818033164221633 | V11: =MIN((RAND()*R3C+0.5*R3C)*RC25, 1) -> 0.25221265232101 | W11: =MIN((RAND()*R3C+0.5*R3C)*RC25, 1) -> 0.517541960592705 | X11: =MIN((RAND()*R3C+0.5*R3C)*RC25, 1) -> 0.871344348787781 | Y11: =IF(RAND()<0.01, 2, 1) -> 1
A12: =R[-1]C+1 -> 9 | B12: =(ROUND(INT(R[-1]C[+1]/2)*0.75, 0)+ROUND(INT(R[-1]C[+2]/2)*1, 0)+ROUND(INT(R[-1]C[+3]/2)*0.25, 0)+ROUND(INT(R[-1]C[+4]/2)*0.1, 0))*(1-RC[+13]) -> 16.9104439078658 | C12: =R[-1]C[-1]*(1-RC[+12]) -> 16.7428871903192 | D12: =R[-1]C[-1]*(1-RC[+12]) -> 17.4842382336686 | E12: =R[-1]C[-1]*(1-RC[+12]) -> 16.3126814997146 | F12: =R[-1]C[-1]*(1-RC[+12]) -> 16.9807006083607 | G12: =R[-1]C[-1]*(1-RC[+12]) -> 17.7001475031582 | H12: =R[-1]C[-1]*(1-RC[+12]) -> 11.0113912033784 | I12: =R[-1]C[-1]*(1-RC[+12]) -> 17.6892897197144 | J12: =R[-1]C[-1]*(1-RC[+12]) -> 9.76703948096517 | K12: =R[-1]C[-1]*(1-RC[+12]) -> 0 | L12: =R[-1]C[-1]*(1-RC[+12]) -> 5.95089876822599 | M12: =SUM(RC[-11]:RC[-1]) -> 146.549718115371 | N12: 'random rate | O12: =MIN((RAND()*R3C+0.5*R3C)*RC25, 1) -> 0.00526800541965897 | P12: =MIN((RAND()*R3C+0.5*R3C)*RC25, 1) -> 0.00628229408874582 | Q12: =MIN((RAND()*R3C+0.5*R3C)*RC25, 1) -> 0.00908775309080405 | R12: =MIN((RAND()*R3C+0.5*R3C)*RC25, 1) -> 0.0157061432852395 | S12: =MIN((RAND()*R3C+0.5*R3C)*RC25, 1) -> 0.0239476249777173 | T12: =MIN((RAND()*R3C+0.5*R3C)*RC25, 1) -> 0.0692556930280328 | U12: =MIN((RAND()*R3C+0.5*R3C)*RC25, 1) -> 0.139270430876238 | V12: =MIN((RAND()*R3C+0.5*R3C)*RC25, 1) -> 0.351859829329366 | W12: =MIN((RAND()*R3C+0.5*R3C)*RC25, 1) -> 0.837419832233957 | X12: =MIN((RAND()*R3C+0.5*R3C)*RC25, 1) -> 0.49872852930528 | Y12: =IF(RAND()<0.01, 2, 1) -> 1
A13: =R[-1]C+1 -> 10 | B13: =(ROUND(INT(R[-1]C[+1]/2)*0.75, 0)+ROUND(INT(R[-1]C[+2]/2)*1, 0)+ROUND(INT(R[-1]C[+3]/2)*0.25, 0)+ROUND(INT(R[-1]C[+4]/2)*0.1, 0))*(1-RC[+13]) -> 16.8644877693421 | C13: =R[-1]C[-1]*(1-RC[+12]) -> 16.7756455563734 | D13: =R[-1]C[-1]*(1-RC[+12]) -> 16.6687022111124 | E13: =R[-1]C[-1]*(1-RC[+12]) -> 17.3078902399407 | F13: =R[-1]C[-1]*(1-RC[+12]) -> 16.0299436415748 | G13: =R[-1]C[-1]*(1-RC[+12]) -> 16.3375219341256 | H13: =R[-1]C[-1]*(1-RC[+12]) -> 16.4951391220381 | I13: =R[-1]C[-1]*(1-RC[+12]) -> 9.40128501294753 | J13: =R[-1]C[-1]*(1-RC[+12]) -> 11.7426735613925 | K13: =R[-1]C[-1]*(1-RC[+12]) -> 3.3401667789019 | L13: =R[-1]C[-1]*(1-RC[+12]) -> 0 | M13: =SUM(RC[-11]:RC[-1]) -> 140.963455827749 | N13: 'random rate | O13: =MIN((RAND()*R3C+0.5*R3C)*RC25, 1) -> 0.00797130768576 | P13: =MIN((RAND()*R3C+0.5*R3C)*RC25, 1) -> 0.00443083551620995 | Q13: =MIN((RAND()*R3C+0.5*R3C)*RC25, 1) -> 0.0100861124957903 | R13: =MIN((RAND()*R3C+0.5*R3C)*RC25, 1) -> 0.0173323961572332 | S13: =MIN((RAND()*R3C+0.5*R3C)*RC25, 1) -> 0.0378770398860023 | T13: =MIN((RAND()*R3C+0.5*R3C)*RC25, 1) -> 0.0680790022176414 | U13: =MIN((RAND()*R3C+0.5*R3C)*RC25, 1) -> 0.146221867944979 | V13: =MIN((RAND()*R3C+0.5*R3C)*RC25, 1) -> 0.33617043151792 | W13: =MIN((RAND()*R3C+0.5*R3C)*RC25, 1) -> 0.658016455711938 | X13: =MIN((RAND()*R3C+0.5*R3C)*RC25, 1) -> 1 | Y13: =IF(RAND()<0.01, 2, 1) -> 1
A14: =R[-1]C+1 -> 11 | B14: =(ROUND(INT(R[-1]C[+1]/2)*0.75, 0)+ROUND(INT(R[-1]C[+2]/2)*1, 0)+ROUND(INT(R[-1]C[+3]/2)*0.25, 0)+ROUND(INT(R[-1]C[+4]/2)*0.1, 0))*(1-RC[+13]) -> 16.9150952177265 | C14: =R[-1]C[-1]*(1-RC[+12]) -> 16.780259789212 | D14: =R[-1]C[-1]*(1-RC[+12]) -> 16.7236892767548 | E14: =R[-1]C[-1]*(1-RC[+12]) -> 16.4998899771286 | F14: =R[-1]C[-1]*(1-RC[+12]) -> 16.9811169990867 | G14: =R[-1]C[-1]*(1-RC[+12]) -> 15.5557702873695 | H14: =R[-1]C[-1]*(1-RC[+12]) -> 14.9426664044351 | I14: =R[-1]C[-1]*(1-RC[+12]) -> 13.8526309365696 | J14: =R[-1]C[-1]*(1-RC[+12]) -> 5.42787400853381 | K14: =R[-1]C[-1]*(1-RC[+12]) -> 4.63597637183258 | L14: =R[-1]C[-1]*(1-RC[+12]) -> 0.878677917977646 | M14: =SUM(RC[-11]:RC[-1]) -> 139.193647186627 | N14: 'random rate | O14: =MIN((RAND()*R3C+0.5*R3C)*RC25, 1) -> 0.00499439895726713 | P14: =MIN((RAND()*R3C+0.5*R3C)*RC25, 1) -> 0.00309712549922547 | Q14: =MIN((RAND()*R3C+0.5*R3C)*RC25, 1) -> 0.0101274971407925 | R14: =MIN((RAND()*R3C+0.5*R3C)*RC25, 1) -> 0.0188800157803115 | S14: =MIN((RAND()*R3C+0.5*R3C)*RC25, 1) -> 0.0295804754406952 | T14: =MIN((RAND()*R3C+0.5*R3C)*RC25, 1) -> 0.0853774235355099 | U14: =MIN((RAND()*R3C+0.5*R3C)*RC25, 1) -> 0.160199205712546 | V14: =MIN((RAND()*R3C+0.5*R3C)*RC25, 1) -> 0.422645521217739 | W14: =MIN((RAND()*R3C+0.5*R3C)*RC25, 1) -> 0.605202652735343 | X14: =MIN((RAND()*R3C+0.5*R3C)*RC25, 1) -> 0.736935914838805 | Y14: =IF(RAND()<0.01, 2, 1) -> 1
A15: =R[-1]C+1 -> 12 | B15: =(ROUND(INT(R[-1]C[+1]/2)*0.75, 0)+ROUND(INT(R[-1]C[+2]/2)*1, 0)+ROUND(INT(R[-1]C[+3]/2)*0.25, 0)+ROUND(INT(R[-1]C[+4]/2)*0.1, 0))*(1-RC[+13]) -> 16.7898299839318 | C15: =R[-1]C[-1]*(1-RC[+12]) -> 16.7059748745673 | D15: =R[-1]C[-1]*(1-RC[+12]) -> 16.69625221925 | E15: =R[-1]C[-1]*(1-RC[+12]) -> 16.5491767599351 | F15: =R[-1]C[-1]*(1-RC[+12]) -> 16.2711494132148 | G15: =R[-1]C[-1]*(1-RC[+12]) -> 16.7105254238251 | H15: =R[-1]C[-1]*(1-RC[+12]) -> 14.9548457269193 | I15: =R[-1]C[-1]*(1-RC[+12]) -> 11.6803755963125 | J15: =R[-1]C[-1]*(1-RC[+12]) -> 10.6202655237352 | K15: =R[-1]C[-1]*(1-RC[+12]) -> 1.51885932279072 | L15: =R[-1]C[-1]*(1-RC[+12]) -> 0.604461172260055 | M15: =SUM(RC[-11]:RC[-1]) -> 139.101716016742 | N15: 'random rate | O15: =MIN((RAND()*R3C+0.5*R3C)*RC25, 1) -> 0.0123629421216612 | P15: =MIN((RAND()*R3C+0.5*R3C)*RC25, 1) -> 0.00500633309717863 | Q15: =MIN((RAND()*R3C+0.5*R3C)*RC25, 1) -> 0.0104350489854079 | R15: =MIN((RAND()*R3C+0.5*R3C)*RC25, 1) -> 0.0138631569198903 | S15: =MIN((RAND()*R3C+0.5*R3C)*RC25, 1) -> 0.0159348513573115 | T15: =MIN((RAND()*R3C+0.5*R3C)*RC25, 1) -> 0.0386303313400117 | U15: =MIN((RAND()*R3C+0.5*R3C)*RC25, 1) -> 0.218320527262409 | V15: =MIN((RAND()*R3C+0.5*R3C)*RC25, 1) -> 0.233339459315364 | W15: =MIN((RAND()*R3C+0.5*R3C)*RC25, 1) -> 0.720174174934285 | X15: =MIN((RAND()*R3C+0.5*R3C)*RC25, 1) -> 0.869615130928479 | Y15: =IF(RAND()<0.01, 2, 1) -> 1
A16: =R[-1]C+1 -> 13 | B16: =(ROUND(INT(R[-1]C[+1]/2)*0.75, 0)+ROUND(INT(R[-1]C[+2]/2)*1, 0)+ROUND(INT(R[-1]C[+3]/2)*0.25, 0)+ROUND(INT(R[-1]C[+4]/2)*0.1, 0))*(1-RC[+13]) -> 16.8306949704715 | C16: =R[-1]C[-1]*(1-RC[+12]) -> 16.6226180626842 | D16: =R[-1]C[-1]*(1-RC[+12]) -> 16.6330931281577 | E16: =R[-1]C[-1]*(1-RC[+12]) -> 16.509254844293 | F16: =R[-1]C[-1]*(1-RC[+12]) -> 16.3696089993421 | G16: =R[-1]C[-1]*(1-RC[+12]) -> 15.6053103584857 | H16: =R[-1]C[-1]*(1-RC[+12]) -> 15.5967669209251 | I16: =R[-1]C[-1]*(1-RC[+12]) -> 12.7931868730577 | J16: =R[-1]C[-1]*(1-RC[+12]) -> 9.2092825777407 | K16: =R[-1]C[-1]*(1-RC[+12]) -> 3.51531482254714 | L16: =R[-1]C[-1]*(1-RC[+12]) -> 0 | M16: =SUM(RC[-11]:RC[-1]) -> 139.685131557705 | N16: 'random rate | O16: =MIN((RAND()*R3C+0.5*R3C)*RC25, 1) -> 0.00995911938402994 | P16: =MIN((RAND()*R3C+0.5*R3C)*RC25, 1) -> 0.00436261558854477 | Q16: =MIN((RAND()*R3C+0.5*R3C)*RC25, 1) -> 0.0111999610751847 | R16: =MIN((RAND()*R3C+0.5*R3C)*RC25, 1) -> 0.0108505554806659 | S16: =MIN((RAND()*R3C+0.5*R3C)*RC25, 1) -> 0.0409214516946359 | T16: =MIN((RAND()*R3C+0.5*R3C)*RC25, 1) -> 0.0666501186917823 | U16: =MIN((RAND()*R3C+0.5*R3C)*RC25, 1) -> 0.144545714033716 | V16: =MIN((RAND()*R3C+0.5*R3C)*RC25, 1) -> 0.211559379935688 | W16: =MIN((RAND()*R3C+0.5*R3C)*RC25, 1) -> 0.668999347079338 | X16: =MIN((RAND()*R3C+0.5*R3C)*RC25, 1) -> 1 | Y16: =IF(RAND()<0.01, 2, 1) -> 1
A17: =R[-1]C+1 -> 14 | B17: =(ROUND(INT(R[-1]C[+1]/2)*0.75, 0)+ROUND(INT(R[-1]C[+2]/2)*1, 0)+ROUND(INT(R[-1]C[+3]/2)*0.25, 0)+ROUND(INT(R[-1]C[+4]/2)*0.1, 0))*(1-RC[+13]) -> 16.8456413616865 | C17: =R[-1]C[-1]*(1-RC[+12]) -> 16.6778736082649 | D17: =R[-1]C[-1]*(1-RC[+12]) -> 16.5533519419846 | E17: =R[-1]C[-1]*(1-RC[+12]) -> 16.4206725423772 | F17: =R[-1]C[-1]*(1-RC[+12]) -> 16.3816959887666 | G17: =R[-1]C[-1]*(1-RC[+12]) -> 16.0604340249699 | H17: =R[-1]C[-1]*(1-RC[+12]) -> 14.5041454909174 | I17: =R[-1]C[-1]*(1-RC[+12]) -> 13.9499170858381 | J17: =R[-1]C[-1]*(1-RC[+12]) -> 10.7132063970309 | K17: =R[-1]C[-1]*(1-RC[+12]) -> 3.10548282149315 | L17: =R[-1]C[-1]*(1-RC[+12]) -> 0 | M17: =SUM(RC[-11]:RC[-1]) -> 141.212421263329 | N17: 'random rate | O17: =MIN((RAND()*R3C+0.5*R3C)*RC25, 1) -> 0.00907991990079401 | P17: =MIN((RAND()*R3C+0.5*R3C)*RC25, 1) -> 0.004166980221675 | Q17: =MIN((RAND()*R3C+0.5*R3C)*RC25, 1) -> 0.0127709611281438 | R17: =MIN((RAND()*R3C+0.5*R3C)*RC25, 1) -> 0.00772650593436753 | S17: =MIN((RAND()*R3C+0.5*R3C)*RC25, 1) -> 0.0188871325139565 | T17: =MIN((RAND()*R3C+0.5*R3C)*RC25, 1) -> 0.0705634711692583 | U17: =MIN((RAND()*R3C+0.5*R3C)*RC25, 1) -> 0.105589180336953 | V17: =MIN((RAND()*R3C+0.5*R3C)*RC25, 1) -> 0.162585014716479 | W17: =MIN((RAND()*R3C+0.5*R3C)*RC25, 1) -> 0.662787758408103 | X17: =MIN((RAND()*R3C+0.5*R3C)*RC25, 1) -> 1 | Y17: =IF(RAND()<0.01, 2, 1) -> 1
A18: =R[-1]C+1 -> 15 | B18: =(ROUND(INT(R[-1]C[+1]/2)*0.75, 0)+ROUND(INT(R[-1]C[+2]/2)*1, 0)+ROUND(INT(R[-1]C[+3]/2)*0.25, 0)+ROUND(INT(R[-1]C[+4]/2)*0.1, 0))*(1-RC[+13]) -> 16.8220920202425 | C18: =R[-1]C[-1]*(1-RC[+12]) -> 16.6693487721349 | D18: =R[-1]C[-1]*(1-RC[+12]) -> 16.5682967639728 | E18: =R[-1]C[-1]*(1-RC[+12]) -> 16.401648227039 | F18: =R[-1]C[-1]*(1-RC[+12]) -> 16.2560114488106 | G18: =R[-1]C[-1]*(1-RC[+12]) -> 16.1393209337999 | H18: =R[-1]C[-1]*(1-RC[+12]) -> 14.9962505875268 | I18: =R[-1]C[-1]*(1-RC[+12]) -> 11.7853280076312 | J18: =R[-1]C[-1]*(1-RC[+12]) -> 11.0302287196848 | K18: =R[-1]C[-1]*(1-RC[+12]) -> 4.59398156853071 | L18: =R[-1]C[-1]*(1-RC[+12]) -> 1.0661012635459 | M18: =SUM(RC[-11]:RC[-1]) -> 142.328608312919 | N18: 'random rate | O18: =MIN((RAND()*R3C+0.5*R3C)*RC25, 1) -> 0.0104651752798539 | P18: =MIN((RAND()*R3C+0.5*R3C)*RC25, 1) -> 0.00657019275154137 | Q18: =MIN((RAND()*R3C+0.5*R3C)*RC25, 1) -> 0.0091645314784098 | R18: =MIN((RAND()*R3C+0.5*R3C)*RC25, 1) -> 0.0100276704953268 | S18: =MIN((RAND()*R3C+0.5*R3C)*RC25, 1) -> 0.0147954799755076 | T18: =MIN((RAND()*R3C+0.5*R3C)*RC25, 1) -> 0.0662611879472575 | U18: =MIN((RAND()*R3C+0.5*R3C)*RC25, 1) -> 0.187451062524764 | V18: =MIN((RAND()*R3C+0.5*R3C)*RC25, 1) -> 0.20929790106906 | W18: =MIN((RAND()*R3C+0.5*R3C)*RC25, 1) -> 0.571185189729576 | X18: =MIN((RAND()*R3C+0.5*R3C)*RC25, 1) -> 0.656703538603602 | Y18: =IF(RAND()<0.01, 2, 1) -> 1
A19: =R[-1]C+1 -> 16 | B19: =(ROUND(INT(R[-1]C[+1]/2)*0.75, 0)+ROUND(INT(R[-1]C[+2]/2)*1, 0)+ROUND(INT(R[-1]C[+3]/2)*0.25, 0)+ROUND(INT(R[-1]C[+4]/2)*0.1, 0))*(1-RC[+13]) -> 16.911163321747 | C19: =R[-1]C[-1]*(1-RC[+12]) -> 16.7341850333987 | D19: =R[-1]C[-1]*(1-RC[+12]) -> 16.5815150712085 | E19: =R[-1]C[-1]*(1-RC[+12]) -> 16.3703554972748 | F19: =R[-1]C[-1]*(1-RC[+12]) -> 16.1909793418605 | G19: =R[-1]C[-1]*(1-RC[+12]) -> 15.8363922123478 | H19: =R[-1]C[-1]*(1-RC[+12]) -> 15.1632009521051 | I19: =R[-1]C[-1]*(1-RC[+12]) -> 11.7027411253176 | J19: =R[-1]C[-1]*(1-RC[+12]) -> 6.27038727964201 | K19: =R[-1]C[-1]*(1-RC[+12]) -> 2.52090384605591 | L19: =R[-1]C[-1]*(1-RC[+12]) -> 0 | M19: =SUM(RC[-11]:RC[-1]) -> 134.281823680958 | N19: 'random rate | O19: =MIN((RAND()*R3C+0.5*R3C)*RC25, 1) -> 0.00522568695605765 | P19: =MIN((RAND()*R3C+0.5*R3C)*RC25, 1) -> 0.00526917410674122 | Q19: =MIN((RAND()*R3C+0.5*R3C)*RC25, 1) -> 0.0119469894532775 | R19: =MIN((RAND()*R3C+0.5*R3C)*RC25, 1) -> 0.0128443728497523 | S19: =MIN((RAND()*R3C+0.5*R3C)*RC25, 1) -> 0.0258131730396592 | T19: =MIN((RAND()*R3C+0.5*R3C)*RC25, 1) -> 0.0604808582528733 | U19: =MIN((RAND()*R3C+0.5*R3C)*RC25, 1) -> 0.219622194426961 | V19: =MIN((RAND()*R3C+0.5*R3C)*RC25, 1) -> 0.467949701902073 | W19: =MIN((RAND()*R3C+0.5*R3C)*RC25, 1) -> 0.771454979754223 | X19: =MIN((RAND()*R3C+0.5*R3C)*RC25, 1) -> 1 | Y19: =IF(RAND()<0.01, 2, 1) -> 1
A20: =R[-1]C+1 -> 17 | B20: =(ROUND(INT(R[-1]C[+1]/2)*0.75, 0)+ROUND(INT(R[-1]C[+2]/2)*1, 0)+ROUND(INT(R[-1]C[+3]/2)*0.25, 0)+ROUND(INT(R[-1]C[+4]/2)*0.1, 0))*(1-RC[+13]) -> 16.8460762815753 | C20: =R[-1]C[-1]*(1-RC[+12]) -> 16.7580439604899 | D20: =R[-1]C[-1]*(1-RC[+12]) -> 16.6727005312754 | E20: =R[-1]C[-1]*(1-RC[+12]) -> 16.4680313633726 | F20: =R[-1]C[-1]*(1-RC[+12]) -> 16.0602873355103 | G20: =R[-1]C[-1]*(1-RC[+12]) -> 15.9123653594267 | H20: =R[-1]C[-1]*(1-RC[+12]) -> 14.775116068121 | I20: =R[-1]C[-1]*(1-RC[+12]) -> 11.8464903464482 | J20: =R[-1]C[-1]*(1-RC[+12]) -> 7.37689952030869 | K20: =R[-1]C[-1]*(1-RC[+12]) -> 3.47440810814455 | L20: =R[-1]C[-1]*(1-RC[+12]) -> 0 | M20: =SUM(RC[-11]:RC[-1]) -> 136.190418874673 | N20: 'random rate | O20: =MIN((RAND()*R3C+0.5*R3C)*RC25, 1) -> 0.00905433637792214 | P20: =MIN((RAND()*R3C+0.5*R3C)*RC25, 1) -> 0.00367418562664164 | Q20: =MIN((RAND()*R3C+0.5*R3C)*RC25, 1) -> 0.00684398906545115 | R20: =MIN((RAND()*R3C+0.5*R3C)*RC25, 1) -> 0.0189408325198636 | S20: =MIN((RAND()*R3C+0.5*R3C)*RC25, 1) -> 0.0172079759075152 | T20: =MIN((RAND()*R3C+0.5*R3C)*RC25, 1) -> 0.067015020213962 | U20: =MIN((RAND()*R3C+0.5*R3C)*RC25, 1) -> 0.218734198414513 | V20: =MIN((RAND()*R3C+0.5*R3C)*RC25, 1) -> 0.369643450084563 | W20: =MIN((RAND()*R3C+0.5*R3C)*RC25, 1) -> 0.445902150346459 | X20: =MIN((RAND()*R3C+0.5*R3C)*RC25, 1) -> 1 | Y20: =IF(RAND()<0.01, 2, 1) -> 1
A21: =R[-1]C+1 -> 18 | B21: =(ROUND(INT(R[-1]C[+1]/2)*0.75, 0)+ROUND(INT(R[-1]C[+2]/2)*1, 0)+ROUND(INT(R[-1]C[+3]/2)*0.25, 0)+ROUND(INT(R[-1]C[+4]/2)*0.1, 0))*(1-RC[+13]) -> 16.8690560769434 | C21: =R[-1]C[-1]*(1-RC[+12]) -> 16.7163179688448 | D21: =R[-1]C[-1]*(1-RC[+12]) -> 16.6788775473547 | E21: =R[-1]C[-1]*(1-RC[+12]) -> 16.5344150104563 | F21: =R[-1]C[-1]*(1-RC[+12]) -> 16.3468532125386 | G21: =R[-1]C[-1]*(1-RC[+12]) -> 15.6948387139075 | H21: =R[-1]C[-1]*(1-RC[+12]) -> 14.5315788587854 | I21: =R[-1]C[-1]*(1-RC[+12]) -> 11.7198427257257 | J21: =R[-1]C[-1]*(1-RC[+12]) -> 8.03769890148213 | K21: =R[-1]C[-1]*(1-RC[+12]) -> 2.78860588219187 | L21: =R[-1]C[-1]*(1-RC[+12]) -> 1.61463808211633 | M21: =SUM(RC[-11]:RC[-1]) -> 137.532722980347 | N21: 'random rate | O21: =MIN((RAND()*R3C+0.5*R3C)*RC25, 1) -> 0.00770258370920903 | P21: =MIN((RAND()*R3C+0.5*R3C)*RC25, 1) -> 0.0047240843455186 | Q21: =MIN((RAND()*R3C+0.5*R3C)*RC25, 1) -> 0.00829412851023742 | R21: =MIN((RAND()*R3C+0.5*R3C)*RC25, 1) -> 0.00735838717816944 | S21: =MIN((RAND()*R3C+0.5*R3C)*RC25, 1) -> 0.0227547997098872 | T21: =MIN((RAND()*R3C+0.5*R3C)*RC25, 1) -> 0.0867744341870142 | U21: =MIN((RAND()*R3C+0.5*R3C)*RC25, 1) -> 0.206785065397042 | V21: =MIN((RAND()*R3C+0.5*R3C)*RC25, 1) -> 0.321512222909804 | W21: =MIN((RAND()*R3C+0.5*R3C)*RC25, 1) -> 0.621981311455469 | X21: =MIN((RAND()*R3C+0.5*R3C)*RC25, 1) -> 0.535276791942959 | Y21: =IF(RAND()<0.01, 2, 1) -> 1
A22: =R[-1]C+1 -> 19 | B22: =(ROUND(INT(R[-1]C[+1]/2)*0.75, 0)+ROUND(INT(R[-1]C[+2]/2)*1, 0)+ROUND(INT(R[-1]C[+3]/2)*0.25, 0)+ROUND(INT(R[-1]C[+4]/2)*0.1, 0))*(1-RC[+13]) -> 16.7895690656702 | C22: =R[-1]C[-1]*(1-RC[+12]) -> 16.6602460045003 | D22: =R[-1]C[-1]*(1-RC[+12]) -> 16.6644668104142 | E22: =R[-1]C[-1]*(1-RC[+12]) -> 16.5256207400952 | F22: =R[-1]C[-1]*(1-RC[+12]) -> 16.2221462808407 | G22: =R[-1]C[-1]*(1-RC[+12]) -> 15.7326094062027 | H22: =R[-1]C[-1]*(1-RC[+12]) -> 15.0831088133026 | I22: =R[-1]C[-1]*(1-RC[+12]) -> 12.8418849280193 | J22: =R[-1]C[-1]*(1-RC[+12]) -> 8.92174012598396 | K22: =R[-1]C[-1]*(1-RC[+12]) -> 2.47232195344726 | L22: =R[-1]C[-1]*(1-RC[+12]) -> 0 | M22: =SUM(RC[-11]:RC[-1]) -> 137.913714128476 | N22: 'random rate | O22: =MIN((RAND()*R3C+0.5*R3C)*RC25, 1) -> 0.0123782902546941 | P22: =MIN((RAND()*R3C+0.5*R3C)*RC25, 1) -> 0.00310182891514602 | Q22: =MIN((RAND()*R3C+0.5*R3C)*RC25, 1) -> 0.00918867632575289 | R22: =MIN((RAND()*R3C+0.5*R3C)*RC25, 1) -> 0.0188859859522205 | S22: =MIN((RAND()*R3C+0.5*R3C)*RC25, 1) -> 0.0375756604864325 | T22: =MIN((RAND()*R3C+0.5*R3C)*RC25, 1) -> 0.0389765012406795 | U22: =MIN((RAND()*R3C+0.5*R3C)*RC25, 1) -> 0.11627738094987 | V22: =MIN((RAND()*R3C+0.5*R3C)*RC25, 1) -> 0.238749159457557 | W22: =MIN((RAND()*R3C+0.5*R3C)*RC25, 1) -> 0.692409235062118 | X22: =MIN((RAND()*R3C+0.5*R3C)*RC25, 1) -> 1 | Y22: =IF(RAND()<0.01, 2, 1) -> 1
A23: =R[-1]C+1 -> 20 | B23: =(ROUND(INT(R[-1]C[+1]/2)*0.75, 0)+ROUND(INT(R[-1]C[+2]/2)*1, 0)+ROUND(INT(R[-1]C[+3]/2)*0.25, 0)+ROUND(INT(R[-1]C[+4]/2)*0.1, 0))*(1-RC[+13]) -> 16.8199923952146 | C23: =R[-1]C[-1]*(1-RC[+12]) -> 16.6117896472649 | D23: =R[-1]C[-1]*(1-RC[+12]) -> 16.6040234593359 | E23: =R[-1]C[-1]*(1-RC[+12]) -> 16.5593692093194 | F23: =R[-1]C[-1]*(1-RC[+12]) -> 16.3808302803602 | G23: =R[-1]C[-1]*(1-RC[+12]) -> 15.5389786896147 | H23: =R[-1]C[-1]*(1-RC[+12]) -> 14.4501202884045 | I23: =R[-1]C[-1]*(1-RC[+12]) -> 12.7318277257365 | J23: =R[-1]C[-1]*(1-RC[+12]) -> 9.32681301078213 | K23: =R[-1]C[-1]*(1-RC[+12]) -> 5.45106747407986 | L23: =R[-1]C[-1]*(1-RC[+12]) -> 1.09100037416092 | M23: =SUM(RC[-11]:RC[-1]) -> 141.565812554274 | N23: 'random rate | O23: =MIN((RAND()*R3C+0.5*R3C)*RC25, 1) -> 0.0105886826344364 | P23: =MIN((RAND()*R3C+0.5*R3C)*RC25, 1) -> 0.00337465276018311 | Q23: =MIN((RAND()*R3C+0.5*R3C)*RC25, 1) -> 0.00630668849417374 | R23: =MIN((RAND()*R3C+0.5*R3C)*RC25, 1) -> 0.00876157464897588 | S23: =MIN((RAND()*R3C+0.5*R3C)*RC25, 1) -> 0.0421132678376131 | T23: =MIN((RAND()*R3C+0.5*R3C)*RC25, 1) -> 0.0815178896701376 | U23: =MIN((RAND()*R3C+0.5*R3C)*RC25, 1) -> 0.15588835940058 | V23: =MIN((RAND()*R3C+0.5*R3C)*RC25, 1) -> 0.27371931277532 | W23: =MIN((RAND()*R3C+0.5*R3C)*RC25, 1) -> 0.389012973130209 | X23: =MIN((RAND()*R3C+0.5*R3C)*RC25, 1) -> 0.558714279651284 | Y23: =IF(RAND()<0.01, 2, 1) -> 1

Sheet: @SDF
A1: =DEFINE("INT", RC[+1], RC[+2]) -> FUN INT AT #1 | B1: =FLOOR(RC[+1], 1) -> #EMPTY!