Sheet: Water Height Level
F8: 'Modeling of Reservoir Water Height Level
F11: 'Copyright 1996
F14: 'Engineering Software
A37: 'Input Values:
A39: 'Density [kg/m^3] | B39: 1000
A41: 'Reservoir Area [m^2] | B41: 15
G42: 'Output Values:
A43: 'Valve Area [m^2] | B43: 0.0075
I44: 'Mass
A45: 'Time Increment [s] | B45: 60 | C45: 'Time | D45: 'Height | E45: 'Height Change | F45: 'Velocity | G45: 'Mass Flow Inlet | H45: 'Mass Flow Outlet | I45: 'Accumulation | J45: 'Mass Change
C46: 't | D46: 'h | E46: 'dh/dt | F46: 'v | G46: 'm in | H46: 'm out | I46: 'm | J46: 'in/out
A47: 'Gravity [kg/(m*s^2)] | B47: 9.81 | C47: '[min] | D47: '[m] | E47: '[m/s] | F47: '[m/s] | G47: '[kg/s] | H47: '[kg/s] | I47: '[kg] | J47: '[kg]
B48: 'No.
A49: 'Initial Conditions | B49: 0 | C49: 0 | D49: 3 | E49: 0 | F49: 0 | G49: 0 | H49: 0 | I49: =RC[-5]*R39C[-7]*R41C[-7] -> 45000 | J49: =(RC[-3]-RC[-2])*R45C[-8] -> 0
B50: 1 | C50: =R[-1]C+R45C[-1]/60 -> 1 | D50: =R[-1]C+RC[+1]*R45C[-2] -> 2.8098391866542 | E50: =(RC[+2]-RC[+3])/(R39C[-3]*R41C[-3]) -> -0.00316934688909666 | F50: =SQRT(2*R47C[-4]*R[-1]C[-2]) -> 7.67202711152665 | G50: 10 | H50: =RC[-2]*R39C[-6]*R43C[-6] -> 57.5402033364499 | I50: =RC[-5]*R39C[-7]*R41C[-7] -> 42147.587799813 | J50: =(RC[-3]-RC[-2])*R45C[-8] -> -2852.41220018699
B51: 2 | C51: =R[-1]C+R45C[-1]/60 -> 2 | D51: =R[-1]C+RC[+1]*R45C[-2] -> 2.62709237891514 | E51: =(RC[+2]-RC[+3])/(R39C[-3]*R41C[-3]) -> -0.00304578012898426 | F51: =SQRT(2*R47C[-4]*R[-1]C[-2]) -> 7.42489359130186 | G51: 10 | H51: =RC[-2]*R39C[-6]*R43C[-6] -> 55.6867019347639 | I51: =RC[-5]*R39C[-7]*R41C[-7] -> 39406.3856837272 | J51: =(RC[-3]-RC[-2])*R45C[-8] -> -2741.20211608584
B52: 3 | C52: =R[-1]C+R45C[-1]/60 -> 3 | D52: =R[-1]C+RC[+1]*R45C[-2] -> 2.45171086339702 | E52: =(RC[+2]-RC[+3])/(R39C[-3]*R41C[-3]) -> -0.00292302525863539 | F52: =SQRT(2*R47C[-4]*R[-1]C[-2]) -> 7.17938385060411 | G52: 10 | H52: =RC[-2]*R39C[-6]*R43C[-6] -> 53.8453788795308 | I52: =RC[-5]*R39C[-7]*R41C[-7] -> 36775.6629509553 | J52: =(RC[-3]-RC[-2])*R45C[-8] -> -2630.72273277185
B53: 4 | C53: =R[-1]C+R45C[-1]/60 -> 4 | D53: =R[-1]C+RC[+1]*R45C[-2] -> 2.28364282061807 | E53: =(RC[+2]-RC[+3])/(R39C[-3]*R41C[-3]) -> -0.0028011340463159 | F53: =SQRT(2*R47C[-4]*R[-1]C[-2]) -> 6.93560142596513 | G53: 10 | H53: =RC[-2]*R39C[-6]*R43C[-6] -> 52.0170106947385 | I53: =RC[-5]*R39C[-7]*R41C[-7] -> 34254.642309271 | J53: =(RC[-3]-RC[-2])*R45C[-8] -> -2521.02064168431
B54: 5 | C54: =R[-1]C+R45C[-1]/60 -> 5 | D54: =R[-1]C+RC[+1]*R45C[-2] -> 2.1228330476326 | E54: =(RC[+2]-RC[+3])/(R39C[-3]*R41C[-3]) -> -0.00268016288309108 | F54: =SQRT(2*R47C[-4]*R[-1]C[-2]) -> 6.69365909951549 | G54: 10 | H54: =RC[-2]*R39C[-6]*R43C[-6] -> 50.2024432463661 | I54: =RC[-5]*R39C[-7]*R41C[-7] -> 31842.495714489 | J54: =(RC[-3]-RC[-2])*R45C[-8] -> -2412.14659478197
B55: 6 | C55: =R[-1]C+R45C[-1]/60 -> 6 | D55: =R[-1]C+RC[+1]*R45C[-2] -> 1.96922265030049 | E55: =(RC[+2]-RC[+3])/(R39C[-3]*R41C[-3]) -> -0.00256017328886846 | F55: =SQRT(2*R47C[-4]*R[-1]C[-2]) -> 6.45367991107025 | G55: 10 | H55: =RC[-2]*R39C[-6]*R43C[-6] -> 48.4025993330268 | I55: =RC[-5]*R39C[-7]*R41C[-7] -> 29538.3397545074 | J55: =(RC[-3]-RC[-2])*R45C[-8] -> -2304.15595998161
B56: 7 | C56: =R[-1]C+R45C[-1]/60 -> 7 | D56: =R[-1]C+RC[+1]*R45C[-2] -> 1.82274870155964 | E56: =(RC[+2]-RC[+3])/(R39C[-3]*R41C[-3]) -> -0.00244123247901421 | F56: =SQRT(2*R47C[-4]*R[-1]C[-2]) -> 6.21579829136175 | G56: 10 | H56: =RC[-2]*R39C[-6]*R43C[-6] -> 46.6184871852132 | I56: =RC[-5]*R39C[-7]*R41C[-7] -> 27341.2305233946 | J56: =(RC[-3]-RC[-2])*R45C[-8] -> -2197.10923111279
B57: 8 | C57: =R[-1]C+R45C[-1]/60 -> 8 | D57: =R[-1]C+RC[+1]*R45C[-2] -> 1.68334386168028 | E57: =(RC[+2]-RC[+3])/(R39C[-3]*R41C[-3]) -> -0.0023234139979894 | F57: =SQRT(2*R47C[-4]*R[-1]C[-2]) -> 5.98016132931213 | G57: 10 | H57: =RC[-2]*R39C[-6]*R43C[-6] -> 44.8512099698409 | I57: =RC[-5]*R39C[-7]*R41C[-7] -> 25250.1579252042 | J57: =(RC[-3]-RC[-2])*R45C[-8] -> -2091.07259819046
B58: 9 | C58: =R[-1]C+R45C[-1]/60 -> 9 | D58: =R[-1]C+RC[+1]*R45C[-2] -> 1.55093595609138 | E58: =(RC[+2]-RC[+3])/(R39C[-3]*R41C[-3]) -> -0.00220679842648163 | F58: =SQRT(2*R47C[-4]*R[-1]C[-2]) -> 5.7469301862966 | G58: 10 | H58: =RC[-2]*R39C[-6]*R43C[-6] -> 43.1019763972245 | I58: =RC[-5]*R39C[-7]*R41C[-7] -> 23264.0393413707 | J58: =(RC[-3]-RC[-2])*R45C[-8] -> -1986.11858383347
B59: 10 | C59: =R[-1]C+R45C[-1]/60 -> 10 | D59: =R[-1]C+RC[+1]*R45C[-2] -> 1.42544750600298 | E59: =(RC[+2]-RC[+3])/(R39C[-3]*R41C[-3]) -> -0.00209147416814004 | F59: =SQRT(2*R47C[-4]*R[-1]C[-2]) -> 5.51628166961341 | G59: 10 | H59: =RC[-2]*R39C[-6]*R43C[-6] -> 41.3721125221006 | I59: =RC[-5]*R39C[-7]*R41C[-7] -> 21381.7125900447 | J59: =(RC[-3]-RC[-2])*R45C[-8] -> -1882.32675132603
B60: 11 | C60: =R[-1]C+R45C[-1]/60 -> 11 | D60: =R[-1]C+RC[+1]*R45C[-2] -> 1.30679520674135 | E60: =(RC[+2]-RC[+3])/(R39C[-3]*R41C[-3]) -> -0.0019775383210271 | F60: =SQRT(2*R47C[-4]*R[-1]C[-2]) -> 5.28840997538754 | G60: 10 | H60: =RC[-2]*R39C[-6]*R43C[-6] -> 39.6630748154065 | I60: =RC[-5]*R39C[-7]*R41C[-7] -> 19601.9281011203 | J60: =(RC[-3]-RC[-2])*R45C[-8] -> -1779.78448892439
B61: 12 | C61: =R[-1]C+R45C[-1]/60 -> 12 | D61: =R[-1]C+RC[+1]*R45C[-2] -> 1.19488934852437 | E61: =(RC[+2]-RC[+3])/(R39C[-3]*R41C[-3]) -> -0.00186509763694975 | F61: =SQRT(2*R47C[-4]*R[-1]C[-2]) -> 5.06352860723284 | G61: 10 | H61: =RC[-2]*R39C[-6]*R43C[-6] -> 37.9764645542463 | I61: =RC[-5]*R39C[-7]*R41C[-7] -> 17923.3402278655 | J61: =(RC[-3]-RC[-2])*R45C[-8] -> -1678.58787325478
B62: 13 | C62: =R[-1]C+R45C[-1]/60 -> 13 | D62: =R[-1]C+RC[+1]*R45C[-2] -> 1.08963317441723 | E62: =(RC[+2]-RC[+3])/(R39C[-3]*R41C[-3]) -> -0.0017542695684523 | F62: =SQRT(2*R47C[-4]*R[-1]C[-2]) -> 4.84187247023794 | G62: 10 | H62: =RC[-2]*R39C[-6]*R43C[-6] -> 36.3140435267846 | I62: =RC[-5]*R39C[-7]*R41C[-7] -> 16344.4976162584 | J62: =(RC[-3]-RC[-2])*R45C[-8] -> -1578.84261160707
B63: 14 | C63: =R[-1]C+R45C[-1]/60 -> 14 | D63: =R[-1]C+RC[+1]*R45C[-2] -> 0.990922170549982 | E63: =(RC[+2]-RC[+3])/(R39C[-3]*R41C[-3]) -> -0.00164518339778745 | F63: =SQRT(2*R47C[-4]*R[-1]C[-2]) -> 4.62370012890823 | G63: 10 | H63: =RC[-2]*R39C[-6]*R43C[-6] -> 34.6777509668118 | I63: =RC[-5]*R39C[-7]*R41C[-7] -> 14863.8325582497 | J63: =(RC[-3]-RC[-2])*R45C[-8] -> -1480.66505800871
B64: 15 | C64: =R[-1]C+R45C[-1]/60 -> 15 | D64: =R[-1]C+RC[+1]*R45C[-2] -> 0.898643284526658 | E64: =(RC[+2]-RC[+3])/(R39C[-3]*R41C[-3]) -> -0.00153798143372207 | F64: =SQRT(2*R47C[-4]*R[-1]C[-2]) -> 4.40929620077747 | G64: 10 | H64: =RC[-2]*R39C[-6]*R43C[-6] -> 33.069721505831 | I64: =RC[-5]*R39C[-7]*R41C[-7] -> 13479.6492678999 | J64: =(RC[-3]-RC[-2])*R45C[-8] -> -1384.18329034986
B65: 16 | C65: =R[-1]C+R45C[-1]/60 -> 16 | D65: =R[-1]C+RC[+1]*R45C[-2] -> 0.812674069564542 | E65: =(RC[+2]-RC[+3])/(R39C[-3]*R41C[-3]) -> -0.0014328202493686 | F65: =SQRT(2*R47C[-4]*R[-1]C[-2]) -> 4.19897383207052 | G65: 10 | H65: =RC[-2]*R39C[-6]*R43C[-6] -> 31.4923037405289 | I65: =RC[-5]*R39C[-7]*R41C[-7] -> 12190.1110434681 | J65: =(RC[-3]-RC[-2])*R45C[-8] -> -1289.53822443174
B66: 17 | C66: =R[-1]C+R45C[-1]/60 -> 17 | D66: =R[-1]C+RC[+1]*R45C[-2] -> 0.732881754617502 | E66: =(RC[+2]-RC[+3])/(R39C[-3]*R41C[-3]) -> -0.00132987191578399 | F66: =SQRT(2*R47C[-4]*R[-1]C[-2]) -> 3.99307716490131 | G66: 10 | H66: =RC[-2]*R39C[-6]*R43C[-6] -> 29.9480787367599 | I66: =RC[-5]*R39C[-7]*R41C[-7] -> 10993.2263192625 | J66: =(RC[-3]-RC[-2])*R45C[-8] -> -1196.88472420559
B67: 18 | C67: =R[-1]C+R45C[-1]/60 -> 18 | D67: =R[-1]C+RC[+1]*R45C[-2] -> 0.659122245023641 | E67: =(RC[+2]-RC[+3])/(R39C[-3]*R41C[-3]) -> -0.00122932515989769 | F67: =SQRT(2*R47C[-4]*R[-1]C[-2]) -> 3.79198365312872 | G67: 10 | H67: =RC[-2]*R39C[-6]*R43C[-6] -> 28.4398773984654 | I67: =RC[-5]*R39C[-7]*R41C[-7] -> 9886.83367535461 | J67: =(RC[-3]-RC[-2])*R45C[-8] -> -1106.39264390792
B68: 19 | C68: =R[-1]C+R45C[-1]/60 -> 19 | D68: =R[-1]C+RC[+1]*R45C[-2] -> 0.591239064672729 | E68: =(RC[+2]-RC[+3])/(R39C[-3]*R41C[-3]) -> -0.00113138633918187 | F68: =SQRT(2*R47C[-4]*R[-1]C[-2]) -> 3.59610601169707 | G68: 10 | H68: =RC[-2]*R39C[-6]*R43C[-6] -> 26.9707950877281 | I68: =RC[-5]*R39C[-7]*R41C[-7] -> 8868.58597009093 | J68: =(RC[-3]-RC[-2])*R45C[-8] -> -1018.24770526368
B69: 20 | C69: =R[-1]C+R45C[-1]/60 -> 20 | D69: =R[-1]C+RC[+1]*R45C[-2] -> 0.529062260044716 | E69: =(RC[+2]-RC[+3])/(R39C[-3]*R41C[-3]) -> -0.00103628007713354 | F69: =SQRT(2*R47C[-4]*R[-1]C[-2]) -> 3.40589348760042 | G69: 10 | H69: =RC[-2]*R39C[-6]*R43C[-6] -> 25.5442011570031 | I69: =RC[-5]*R39C[-7]*R41C[-7] -> 7935.93390067074 | J69: =(RC[-3]-RC[-2])*R45C[-8] -> -932.652069420188
B70: 21 | C70: =R[-1]C+R45C[-1]/60 -> 21 | D70: =R[-1]C+RC[+1]*R45C[-2] -> 0.472407299551891 | E70: =(RC[+2]-RC[+3])/(R39C[-3]*R41C[-3]) -> -0.000944249341547086 | F70: =SQRT(2*R47C[-4]*R[-1]C[-2]) -> 3.22183201642751 | G70: 10 | H70: =RC[-2]*R39C[-6]*R43C[-6] -> 24.1637401232063 | I70: =RC[-5]*R39C[-7]*R41C[-7] -> 7086.10949327836 | J70: =(RC[-3]-RC[-2])*R45C[-8] -> -849.824407392378
B71: 22 | C71: =R[-1]C+R45C[-1]/60 -> 22 | D71: =R[-1]C+RC[+1]*R45C[-2] -> 0.421074019223813 | E71: =(RC[+2]-RC[+3])/(R39C[-3]*R41C[-3]) -> -0.000855554672134634 | F71: =SQRT(2*R47C[-4]*R[-1]C[-2]) -> 3.0444426776026 | G71: 10 | H71: =RC[-2]*R39C[-6]*R43C[-6] -> 22.8333200820195 | I71: =RC[-5]*R39C[-7]*R41C[-7] -> 6316.11028835719 | J71: =(RC[-3]-RC[-2])*R45C[-8] -> -769.999204921171
B72: 23 | C72: =R[-1]C+R45C[-1]/60 -> 23 | D72: =R[-1]C+RC[+1]*R45C[-2] -> 0.374845688430192 | E72: =(RC[+2]-RC[+3])/(R39C[-3]*R41C[-3]) -> -0.000770472179893679 | F72: =SQRT(2*R47C[-4]*R[-1]C[-2]) -> 2.87427769312069 | G72: 10 | H72: =RC[-2]*R39C[-6]*R43C[-6] -> 21.5570826984052 | I72: =RC[-5]*R39C[-7]*R41C[-7] -> 5622.68532645288 | J72: =(RC[-3]-RC[-2])*R45C[-8] -> -693.424961904311
B73: 24 | C73: =R[-1]C+R45C[-1]/60 -> 24 | D73: =R[-1]C+RC[+1]*R45C[-2] -> 0.333488296840366 | E73: =(RC[+2]-RC[+3])/(R39C[-3]*R41C[-3]) -> -0.000689289859830437 | F73: =SQRT(2*R47C[-4]*R[-1]C[-2]) -> 2.71191305299421 | G73: 10 | H73: =RC[-2]*R39C[-6]*R43C[-6] -> 20.3393478974566 | I73: =RC[-5]*R39C[-7]*R41C[-7] -> 5002.32445260549 | J73: =(RC[-3]-RC[-2])*R45C[-8] -> -620.360873847394
B74: 25 | C74: =R[-1]C+R45C[-1]/60 -> 25 | D74: =R[-1]C+RC[+1]*R45C[-2] -> 0.296750194533838 | E74: =(RC[+2]-RC[+3])/(R39C[-3]*R41C[-3]) -> -0.000612301705108803 | F74: =SQRT(2*R47C[-4]*R[-1]C[-2]) -> 2.55793674355094 | G74: 10 | H74: =RC[-2]*R39C[-6]*R43C[-6] -> 19.184525576632 | I74: =RC[-5]*R39C[-7]*R41C[-7] -> 4451.25291800757 | J74: =(RC[-3]-RC[-2])*R45C[-8] -> -551.071534597922
B75: 26 | C75: =R[-1]C+R45C[-1]/60 -> 26 | D75: =R[-1]C+RC[+1]*R45C[-2] -> 0.264362247090368 | E75: =(RC[+2]-RC[+3])/(R39C[-3]*R41C[-3]) -> -0.000539799124057826 | F75: =SQRT(2*R47C[-4]*R[-1]C[-2]) -> 2.41293158144898 | G75: 10 | H75: =RC[-2]*R39C[-6]*R43C[-6] -> 18.0969868608674 | I75: =RC[-5]*R39C[-7]*R41C[-7] -> 3965.43370635552 | J75: =(RC[-3]-RC[-2])*R45C[-8] -> -485.819211652043
B76: 27 | C76: =R[-1]C+R45C[-1]/60 -> 27 | D76: =R[-1]C+RC[+1]*R45C[-2] -> 0.236038689226907 | E76: =(RC[+2]-RC[+3])/(R39C[-3]*R41C[-3]) -> -0.000472059297724352 | F76: =SQRT(2*R47C[-4]*R[-1]C[-2]) -> 2.27745192878204 | G76: 10 | H76: =RC[-2]*R39C[-6]*R43C[-6] -> 17.0808894658653 | I76: =RC[-5]*R39C[-7]*R41C[-7] -> 3540.58033840361 | J76: =(RC[-3]-RC[-2])*R45C[-8] -> -424.853367951917
B77: 28 | C77: =R[-1]C+R45C[-1]/60 -> 28 | D77: =R[-1]C+RC[+1]*R45C[-2] -> 0.21147886290768 | E77: =(RC[+2]-RC[+3])/(R39C[-3]*R41C[-3]) -> -0.000409330438653779 | F77: =SQRT(2*R47C[-4]*R[-1]C[-2]) -> 2.15199421064089 | G77: 10 | H77: =RC[-2]*R39C[-6]*R43C[-6] -> 16.1399565798067 | I77: =RC[-5]*R39C[-7]*R41C[-7] -> 3172.1829436152 | J77: =(RC[-3]-RC[-2])*R45C[-8] -> -368.397394788401
B78: 29 | C78: =R[-1]C+R45C[-1]/60 -> 29 | D78: =R[-1]C+RC[+1]*R45C[-2] -> 0.190369994801457 | E78: =(RC[+2]-RC[+3])/(R39C[-3]*R41C[-3]) -> -0.000351814468437058 | F78: =SQRT(2*R47C[-4]*R[-1]C[-2]) -> 2.03696227020745 | G78: 10 | H78: =RC[-2]*R39C[-6]*R43C[-6] -> 15.2772170265559 | I78: =RC[-5]*R39C[-7]*R41C[-7] -> 2855.54992202185 | J78: =(RC[-3]-RC[-2])*R45C[-8] -> -316.633021593352
B79: 30 | C79: =R[-1]C+R45C[-1]/60 -> 30 | D79: =R[-1]C+RC[+1]*R45C[-2] -> 0.172391090291246 | E79: =(RC[+2]-RC[+3])/(R39C[-3]*R41C[-3]) -> -0.000299648408503511 | F79: =SQRT(2*R47C[-4]*R[-1]C[-2]) -> 1.93263015034035 | G79: 10 | H79: =RC[-2]*R39C[-6]*R43C[-6] -> 14.4947261275527 | I79: =RC[-5]*R39C[-7]*R41C[-7] -> 2585.86635436869 | J79: =(RC[-3]-RC[-2])*R45C[-8] -> -269.68356765316
J80: 'Total
J81: =SUM(R[-32]C:R[-2]C) -> -42414.1336456313