Sheet: Sheet1
A1: CENSUS 2000: MONTANA
A2: SCHOOL ENROLLMENT
D4: ---------------------------------------------Population 3 years and over enrolled in school--------------------------------------
C5: Population 3
C6: years and over | D6: Nursery School | H6: Elementary School | J6: High School | L6: College or
C7: enrolled in | D7: Preschool | F7: Kindergarten | H7: Grades 1-8 | J7: Grades 9-12 | L7: Graduate School
A8: CITIES/TOWNS/CDP* | C8: school | D8: Number | E8: Percent | F8: Number | G8: Percent | H8: Number | I8: Percent | J8: Number | K8: Percent | L8: Number | M8: Percent
A10: MONTANA | B10: COUNTY | C10: 241754 | D10: 13694 | E10: =(RC[-1]/RC[-2])*100 -> 5.6644357487363193 | F10: 12033 | G10: =(RC[-1]/RC[-4])*100 -> 4.9773736939202662 | H10: 108571 | I10: =(RC[-1]/RC[-6])*100 -> 44.909701597491662 | J10: 56201 | K10: =(RC[-1]/RC[-8])*100 -> 23.247185155157723 | L10: 51255 | M10: =(RC[-1]/RC[-10])*100 -> 21.201303804694028
A12: Absarokee CDP | B12: Stillwater County | C12: 285 | D12: 14 | E12: =(RC[-1]/RC[-2])*100 -> 4.9122807017543861 | F12: 18 | G12: =(RC[-1]/RC[-4])*100 -> 6.3157894736842106 | H12: 162 | I12: =(RC[-1]/RC[-6])*100 -> 56.84210526315789 | J12: 82 | K12: =(RC[-1]/RC[-8])*100 -> 28.771929824561404 | L12: 9 | M12: =(RC[-1]/RC[-10])*100 -> 3.1578947368421053
A13: Agency CDP | B13: Hill County | C13: 108 | D13: 0 | E13: =(RC[-1]/RC[-2])*100 -> 0 | F13: 4 | G13: =(RC[-1]/RC[-4])*100 -> 3.7037037037037033 | H13: 66 | I13: =(RC[-1]/RC[-6])*100 -> 61.111111111111114 | J13: 18 | K13: =(RC[-1]/RC[-8])*100 -> 16.666666666666664 | L13: 20 | M13: =(RC[-1]/RC[-10])*100 -> 18.518518518518519
A14: Alberton town | B14: Mineral County | C14: 120 | D14: 0 | E14: =(RC[-1]/RC[-2])*100 -> 0 | F14: 12 | G14: =(RC[-1]/RC[-4])*100 -> 10 | H14: 54 | I14: =(RC[-1]/RC[-6])*100 -> 45 | J14: 45 | K14: =(RC[-1]/RC[-8])*100 -> 37.5 | L14: 9 | M14: =(RC[-1]/RC[-10])*100 -> 7.5
A15: Alder CDP | B15: Madison County | C15: 22 | D15: 0 | E15: =(RC[-1]/RC[-2])*100 -> 0 | F15: 2 | G15: =(RC[-1]/RC[-4])*100 -> 9.0909090909090917 | H15: 9 | I15: =(RC[-1]/RC[-6])*100 -> 40.909090909090914 | J15: 9 | K15: =(RC[-1]/RC[-8])*100 -> 40.909090909090914 | L15: 2 | M15: =(RC[-1]/RC[-10])*100 -> 9.0909090909090917
A16: Amsterdam-Churchill CDP | B16: Gallatin County | C16: 208 | D16: 3 | E16: =(RC[-1]/RC[-2])*100 -> 1.4423076923076923 | F16: 8 | G16: =(RC[-1]/RC[-4])*100 -> 3.8461538461538463 | H16: 113 | I16: =(RC[-1]/RC[-6])*100 -> 54.326923076923073 | J16: 62 | K16: =(RC[-1]/RC[-8])*100 -> 29.807692307692307 | L16: 22 | M16: =(RC[-1]/RC[-10])*100 -> 10.576923076923077
A17: Anaconda-Deer Lodge County** | B17: Deer Lodge County | C17: 2218 | D17: 77 | E17: =(RC[-1]/RC[-2])*100 -> 3.4715960324616777 | F17: 109 | G17: =(RC[-1]/RC[-4])*100 -> 4.9143372407574386 | H17: 1052 | I17: =(RC[-1]/RC[-6])*100 -> 47.430117222723176 | J17: 650 | K17: =(RC[-1]/RC[-8])*100 -> 29.305680793507666 | L17: 330 | M17: =(RC[-1]/RC[-10])*100 -> 14.878268710550044
A18: Antelope CDP | B18: Sheridan County | C18: 29 | D18: 0 | E18: =(RC[-1]/RC[-2])*100 -> 0 | F18: 0 | G18: =(RC[-1]/RC[-4])*100 -> 0 | H18: 19 | I18: =(RC[-1]/RC[-6])*100 -> 65.517241379310349 | J18: 5 | K18: =(RC[-1]/RC[-8])*100 -> 17.241379310344829 | L18: 5 | M18: =(RC[-1]/RC[-10])*100 -> 17.241379310344829
A19: Arlee CDP | B19: Lake County | C19: 159 | D19: 7 | E19: =(RC[-1]/RC[-2])*100 -> 4.4025157232704402 | F19: 4 | G19: =(RC[-1]/RC[-4])*100 -> 2.5157232704402519 | H19: 84 | I19: =(RC[-1]/RC[-6])*100 -> 52.830188679245282 | J19: 31 | K19: =(RC[-1]/RC[-8])*100 -> 19.49685534591195 | L19: 33 | M19: =(RC[-1]/RC[-10])*100 -> 20.754716981132077
A20: Ashland CDP | B20: Rosebud County | C20: 176 | D20: 25 | E20: =(RC[-1]/RC[-2])*100 -> 14.204545454545455 | F20: 1 | G20: =(RC[-1]/RC[-4])*100 -> 0.56818181818181823 | H20: 91 | I20: =(RC[-1]/RC[-6])*100 -> 51.70454545454546 | J20: 38 | K20: =(RC[-1]/RC[-8])*100 -> 21.59090909090909 | L20: 21 | M20: =(RC[-1]/RC[-10])*100 -> 11.931818181818182
A21: Augusta CDP | B21: Lewis and Clark County | C21: 54 | D21: 0 | E21: =(RC[-1]/RC[-2])*100 -> 0 | F21: 2 | G21: =(RC[-1]/RC[-4])*100 -> 3.7037037037037033 | H21: 27 | I21: =(RC[-1]/RC[-6])*100 -> 50 | J21: 14 | K21: =(RC[-1]/RC[-8])*100 -> 25.925925925925924 | L21: 11 | M21: =(RC[-1]/RC[-10])*100 -> 20.37037037037037
A22: Avon CDP | B22: Powell County | C22: 33 | D22: 0 | E22: =(RC[-1]/RC[-2])*100 -> 0 | F22: 6 | G22: =(RC[-1]/RC[-4])*100 -> 18.181818181818183 | H22: 10 | I22: =(RC[-1]/RC[-6])*100 -> 30.303030303030305 | J22: 13 | K22: =(RC[-1]/RC[-8])*100 -> 39.393939393939391 | L22: 4 | M22: =(RC[-1]/RC[-10])*100 -> 12.121212121212121
A23: Azure CDP | B23: Hill County | C23: 116 | D23: 13 | E23: =(RC[-1]/RC[-2])*100 -> 11.206896551724139 | F23: 0 | G23: =(RC[-1]/RC[-4])*100 -> 0 | H23: 35 | I23: =(RC[-1]/RC[-6])*100 -> 30.172413793103448 | J23: 30 | K23: =(RC[-1]/RC[-8])*100 -> 25.862068965517242 | L23: 38 | M23: =(RC[-1]/RC[-10])*100 -> 32.758620689655174
A24: Bainville town | B24: Roosevelt County | C24: 38 | D24: 0 | E24: =(RC[-1]/RC[-2])*100 -> 0 | F24: 0 | G24: =(RC[-1]/RC[-4])*100 -> 0 | H24: 27 | I24: =(RC[-1]/RC[-6])*100 -> 71.05263157894737 | J24: 10 | K24: =(RC[-1]/RC[-8])*100 -> 26.315789473684209 | L24: 1 | M24: =(RC[-1]/RC[-10])*100 -> 2.6315789473684208
A25: Baker city | B25: Fallon County | C25: 390 | D25: 21 | E25: =(RC[-1]/RC[-2])*100 -> 5.384615384615385 | F25: 18 | G25: =(RC[-1]/RC[-4])*100 -> 4.6153846153846159 | H25: 240 | I25: =(RC[-1]/RC[-6])*100 -> 61.53846153846154 | J25: 105 | K25: =(RC[-1]/RC[-8])*100 -> 26.923076923076923 | L25: 6 | M25: =(RC[-1]/RC[-10])*100 -> 1.5384615384615385
A26: Ballantine CDP | B26: Yellowstone County | C26: 94 | D26: 6 | E26: =(RC[-1]/RC[-2])*100 -> 6.3829787234042552 | F26: 4 | G26: =(RC[-1]/RC[-4])*100 -> 4.2553191489361701 | H26: 54 | I26: =(RC[-1]/RC[-6])*100 -> 57.446808510638306 | J26: 25 | K26: =(RC[-1]/RC[-8])*100 -> 26.595744680851062 | L26: 5 | M26: =(RC[-1]/RC[-10])*100 -> 5.3191489361702127
A27: Basin CDP | B27: Jefferson County | C27: 51 | D27: 0 | E27: =(RC[-1]/RC[-2])*100 -> 0 | F27: 7 | G27: =(RC[-1]/RC[-4])*100 -> 13.725490196078432 | H27: 31 | I27: =(RC[-1]/RC[-6])*100 -> 60.784313725490193 | J27: 7 | K27: =(RC[-1]/RC[-8])*100 -> 13.725490196078432 | L27: 6 | M27: =(RC[-1]/RC[-10])*100 -> 11.76470588235294
A28: Bearcreek town | B28: Carbon County | C28: 10 | D28: 2 | E28: =(RC[-1]/RC[-2])*100 -> 20 | F28: 3 | G28: =(RC[-1]/RC[-4])*100 -> 30 | H28: 3 | I28: =(RC[-1]/RC[-6])*100 -> 30 | J28: 0 | K28: =(RC[-1]/RC[-8])*100 -> 0 | L28: 2 | M28: =(RC[-1]/RC[-10])*100 -> 20
A29: Beaver Creek CDP | B29: Hill County | C29: 90 | D29: 7 | E29: =(RC[-1]/RC[-2])*100 -> 7.7777777777777777 | F29: 7 | G29: =(RC[-1]/RC[-4])*100 -> 7.7777777777777777 | H29: 35 | I29: =(RC[-1]/RC[-6])*100 -> 38.888888888888893 | J29: 31 | K29: =(RC[-1]/RC[-8])*100 -> 34.444444444444443 | L29: 10 | M29: =(RC[-1]/RC[-10])*100 -> 11.111111111111111
A30: Belfry CDP | B30: Carbon County | C30: 57 | D30: 3 | E30: =(RC[-1]/RC[-2])*100 -> 5.2631578947368416 | F30: 0 | G30: =(RC[-1]/RC[-4])*100 -> 0 | H30: 30 | I30: =(RC[-1]/RC[-6])*100 -> 52.631578947368418 | J30: 22 | K30: =(RC[-1]/RC[-8])*100 -> 38.596491228070171 | L30: 2 | M30: =(RC[-1]/RC[-10])*100 -> 3.5087719298245612
A31: Belgrade city | B31: Gallatin County | C31: 1658 | D31: 165 | E31: =(RC[-1]/RC[-2])*100 -> 9.9517490952955363 | F31: 123 | G31: =(RC[-1]/RC[-4])*100 -> 7.4185765983112191 | H31: 682 | I31: =(RC[-1]/RC[-6])*100 -> 41.133896260554884 | J31: 402 | K31: =(RC[-1]/RC[-8])*100 -> 24.246079613992762 | L31: 286 | M31: =(RC[-1]/RC[-10])*100 -> 17.249698431845598
A32: Belt city | B32: Cascade County | C32: 163 | D32: 5 | E32: =(RC[-1]/RC[-2])*100 -> 3.0674846625766872 | F32: 3 | G32: =(RC[-1]/RC[-4])*100 -> 1.8404907975460123 | H32: 94 | I32: =(RC[-1]/RC[-6])*100 -> 57.668711656441715 | J32: 41 | K32: =(RC[-1]/RC[-8])*100 -> 25.153374233128833 | L32: 20 | M32: =(RC[-1]/RC[-10])*100 -> 12.269938650306749
A33: Big Arm CDP | B33: Lake County | C33: 26 | D33: 0 | E33: =(RC[-1]/RC[-2])*100 -> 0 | F33: 0 | G33: =(RC[-1]/RC[-4])*100 -> 0 | H33: 5 | I33: =(RC[-1]/RC[-6])*100 -> 19.230769230769234 | J33: 14 | K33: =(RC[-1]/RC[-8])*100 -> 53.846153846153847 | L33: 7 | M33: =(RC[-1]/RC[-10])*100 -> 26.923076923076923
A34: Bigfork CDP | B34: Flathead County | C34: 233 | D34: 20 | E34: =(RC[-1]/RC[-2])*100 -> 8.5836909871244629 | F34: 25 | G34: =(RC[-1]/RC[-4])*100 -> 10.72961373390558 | H34: 81 | I34: =(RC[-1]/RC[-6])*100 -> 34.763948497854074 | J34: 66 | K34: =(RC[-1]/RC[-8])*100 -> 28.326180257510732 | L34: 41 | M34: =(RC[-1]/RC[-10])*100 -> 17.596566523605151
A35: Big Sandy town | B35: Chouteau County | C35: 151 | D35: 11 | E35: =(RC[-1]/RC[-2])*100 -> 7.2847682119205297 | F35: 12 | G35: =(RC[-1]/RC[-4])*100 -> 7.9470198675496695 | H35: 63 | I35: =(RC[-1]/RC[-6])*100 -> 41.721854304635762 | J35: 45 | K35: =(RC[-1]/RC[-8])*100 -> 29.80132450331126 | L35: 20 | M35: =(RC[-1]/RC[-10])*100 -> 13.245033112582782
A36: Big Sky CDP | B36: Gallatin & Madison Counties | C36: 184 | D36: 23 | E36: =(RC[-1]/RC[-2])*100 -> 12.5 | F36: 7 | G36: =(RC[-1]/RC[-4])*100 -> 3.804347826086957 | H36: 73 | I36: =(RC[-1]/RC[-6])*100 -> 39.673913043478258 | J36: 27 | K36: =(RC[-1]/RC[-8])*100 -> 14.673913043478262 | L36: 54 | M36: =(RC[-1]/RC[-10])*100 -> 29.347826086956523
A37: Big Timber city | B37: Sweet Grass County | C37: 346 | D37: 20 | E37: =(RC[-1]/RC[-2])*100 -> 5.7803468208092488 | F37: 15 | G37: =(RC[-1]/RC[-4])*100 -> 4.3352601156069364 | H37: 201 | I37: =(RC[-1]/RC[-6])*100 -> 58.092485549132945 | J37: 84 | K37: =(RC[-1]/RC[-8])*100 -> 24.277456647398843 | L37: 26 | M37: =(RC[-1]/RC[-10])*100 -> 7.5144508670520231
A38: Billings city | B38: Yellowstone County | C38: 23013 | D38: 1658 | E38: =(RC[-1]/RC[-2])*100 -> 7.204623473688784 | F38: 1168 | G38: =(RC[-1]/RC[-4])*100 -> 5.0753921696432451 | H38: 10042 | I38: =(RC[-1]/RC[-6])*100 -> 43.63620562290879 | J38: 4770 | K38: =(RC[-1]/RC[-8])*100 -> 20.72741493938209 | L38: 5375 | M38: =(RC[-1]/RC[-10])*100 -> 23.356363794377092
A39: Birney CDP | B39: Rosebud County | C39: 12 | D39: 2 | E39: =(RC[-1]/RC[-2])*100 -> 16.666666666666664 | F39: 3 | G39: =(RC[-1]/RC[-4])*100 -> 25 | H39: 2 | I39: =(RC[-1]/RC[-6])*100 -> 16.666666666666664 | J39: 2 | K39: =(RC[-1]/RC[-8])*100 -> 16.666666666666664 | L39: 3 | M39: =(RC[-1]/RC[-10])*100 -> 25
A40: Black Eagle CDP | B40: Cascade County | C40: 207 | D40: 18 | E40: =(RC[-1]/RC[-2])*100 -> 8.695652173913043 | F40: 6 | G40: =(RC[-1]/RC[-4])*100 -> 2.8985507246376812 | H40: 106 | I40: =(RC[-1]/RC[-6])*100 -> 51.207729468599041 | J40: 52 | K40: =(RC[-1]/RC[-8])*100 -> 25.120772946859905 | L40: 25 | M40: =(RC[-1]/RC[-10])*100 -> 12.077294685990339
A41: Boneau CDP | B41: Chouteau County | C41: 110 | D41: 17 | E41: =(RC[-1]/RC[-2])*100 -> 15.454545454545453 | F41: 3 | G41: =(RC[-1]/RC[-4])*100 -> 2.7272727272727271 | H41: 66 | I41: =(RC[-1]/RC[-6])*100 -> 60 | J41: 11 | K41: =(RC[-1]/RC[-8])*100 -> 10 | L41: 13 | M41: =(RC[-1]/RC[-10])*100 -> 11.818181818181818
A42: Bonner-West Riverside CDP | B42: Missoula County | C42: 397 | D42: 17 | E42: =(RC[-1]/RC[-2])*100 -> 4.2821158690176322 | F42: 20 | G42: =(RC[-1]/RC[-4])*100 -> 5.037783375314862 | H42: 201 | I42: =(RC[-1]/RC[-6])*100 -> 50.629722921914357 | J42: 68 | K42: =(RC[-1]/RC[-8])*100 -> 17.128463476070529 | L42: 91 | M42: =(RC[-1]/RC[-10])*100 -> 22.921914357682617
A43: Boulder town | B43: Jefferson County | C43: 311 | D43: 6 | E43: =(RC[-1]/RC[-2])*100 -> 1.929260450160772 | F43: 16 | G43: =(RC[-1]/RC[-4])*100 -> 5.144694533762058 | H43: 177 | I43: =(RC[-1]/RC[-6])*100 -> 56.913183279742761 | J43: 90 | K43: =(RC[-1]/RC[-8])*100 -> 28.938906752411576 | L43: 22 | M43: =(RC[-1]/RC[-10])*100 -> 7.07395498392283
A44: Box Elder CDP | B44: Chouteau & Hill Counties | C44: 379 | D44: 69 | E44: =(RC[-1]/RC[-2])*100 -> 18.20580474934037 | F44: 21 | G44: =(RC[-1]/RC[-4])*100 -> 5.5408970976253293 | H44: 158 | I44: =(RC[-1]/RC[-6])*100 -> 41.688654353562008 | J44: 55 | K44: =(RC[-1]/RC[-8])*100 -> 14.511873350923482 | L44: 76 | M44: =(RC[-1]/RC[-10])*100 -> 20.052770448548813
A45: Bozeman city | B45: Gallatin County | C45: 12186 | D45: 400 | E45: =(RC[-1]/RC[-2])*100 -> 3.2824552765468571 | F45: 192 | G45: =(RC[-1]/RC[-4])*100 -> 1.5755785327424916 | H45: 2017 | I45: =(RC[-1]/RC[-6])*100 -> 16.551780731987524 | J45: 896 | K45: =(RC[-1]/RC[-8])*100 -> 7.3526998194649602 | L45: 8681 | M45: =(RC[-1]/RC[-10])*100 -> 71.237485639258168
A46: Bridger town | B46: Carbon County | C46: 180 | D46: 3 | E46: =(RC[-1]/RC[-2])*100 -> 1.6666666666666667 | F46: 11 | G46: =(RC[-1]/RC[-4])*100 -> 6.1111111111111107 | H46: 99 | I46: =(RC[-1]/RC[-6])*100 -> 55.000000000000007 | J46: 54 | K46: =(RC[-1]/RC[-8])*100 -> 30 | L46: 13 | M46: =(RC[-1]/RC[-10])*100 -> 7.2222222222222214
A47: Broadus town | B47: Powder River County | C47: 92 | D47: 12 | E47: =(RC[-1]/RC[-2])*100 -> 13.043478260869565 | F47: 10 | G47: =(RC[-1]/RC[-4])*100 -> 10.869565217391305 | H47: 45 | I47: =(RC[-1]/RC[-6])*100 -> 48.913043478260867 | J47: 23 | K47: =(RC[-1]/RC[-8])*100 -> 25 | L47: 2 | M47: =(RC[-1]/RC[-10])*100 -> 2.1739130434782608
A48: Broadview town | B48: Yellowstone County | C48: 62 | D48: 0 | E48: =(RC[-1]/RC[-2])*100 -> 0 | F48: 2 | G48: =(RC[-1]/RC[-4])*100 -> 3.225806451612903 | H48: 37 | I48: =(RC[-1]/RC[-6])*100 -> 59.677419354838712 | J48: 17 | K48: =(RC[-1]/RC[-8])*100 -> 27.419354838709676 | L48: 6 | M48: =(RC[-1]/RC[-10])*100 -> 9.67741935483871
A49: Brockton town | B49: Roosevelt County | C49: 80 | D49: 6 | E49: =(RC[-1]/RC[-2])*100 -> 7.5 | F49: 4 | G49: =(RC[-1]/RC[-4])*100 -> 5 | H49: 48 | I49: =(RC[-1]/RC[-6])*100 -> 60 | J49: 20 | K49: =(RC[-1]/RC[-8])*100 -> 25 | L49: 2 | M49: =(RC[-1]/RC[-10])*100 -> 2.5
A50: CENSUS 2000: MONTANA
A51: SCHOOL ENROLLMENT
D53: ---------------------------------------------Population 3 years and over enrolled in school--------------------------------------
C54: Population 3
C55: years and over | D55: Nursery School | H55: Elementary School | J55: High School | L55: College or
C56: enrolled in | D56: Preschool | F56: Kindergarten | H56: Grades 1-8 | J56: Grades 9-12 | L56: Graduate School
A57: CITIES/TOWNS/CDP* | B57: COUNTY | C57: school | D57: Number | E57: Percent | F57: Number | G57: Percent | H57: Number | I57: Percent | J57: Number | K57: Percent | L57: Number | M57: Percent
A59: Browning town | B59: Glacier County | C59: 336 | D59: 43 | E59: =(RC[-1]/RC[-2])*100 -> 12.797619047619047 | F59: 15 | G59: =(RC[-1]/RC[-4])*100 -> 4.4642857142857144 | H59: 161 | I59: =(RC[-1]/RC[-6])*100 -> 47.916666666666671 | J59: 72 | K59: =(RC[-1]/RC[-8])*100 -> 21.428571428571427 | L59: 45 | M59: =(RC[-1]/RC[-10])*100 -> 13.392857142857142
A60: Busby CDP | B60: Big Horn County | C60: 253 | D60: 0 | E60: =(RC[-1]/RC[-2])*100 -> 0 | F60: 8 | G60: =(RC[-1]/RC[-4])*100 -> 3.1620553359683794 | H60: 162 | I60: =(RC[-1]/RC[-6])*100 -> 64.031620553359687 | J60: 62 | K60: =(RC[-1]/RC[-8])*100 -> 24.505928853754941 | L60: 21 | M60: =(RC[-1]/RC[-10])*100 -> 8.3003952569169961
A61: Butte-Silver Bow (balance)** | B61: Silver Bow County | C61: 9247 | D61: 584 | E61: =(RC[-1]/RC[-2])*100 -> 6.3155618038282695 | F61: 478 | G61: =(RC[-1]/RC[-4])*100 -> 5.1692440791608094 | H61: 3848 | I61: =(RC[-1]/RC[-6])*100 -> 41.613496269060235 | J61: 1927 | K61: =(RC[-1]/RC[-8])*100 -> 20.839191089001837 | L61: 2410 | M61: =(RC[-1]/RC[-10])*100 -> 26.062506758948849
A62: Camp Three CDP | B62: Musselshell County | C62: 28 | D62: 4 | E62: =(RC[-1]/RC[-2])*100 -> 14.285714285714285 | F62: 0 | G62: =(RC[-1]/RC[-4])*100 -> 0 | H62: 10 | I62: =(RC[-1]/RC[-6])*100 -> 35.714285714285715 | J62: 12 | K62: =(RC[-1]/RC[-8])*100 -> 42.857142857142854 | L62: 2 | M62: =(RC[-1]/RC[-10])*100 -> 7.1428571428571423
A63: Cardwell CDP | B63: Jefferson County | C63: 5 | D63: 0 | E63: =(RC[-1]/RC[-2])*100 -> 0 | F63: 3 | G63: =(RC[-1]/RC[-4])*100 -> 60 | H63: 2 | I63: =(RC[-1]/RC[-6])*100 -> 40 | J63: 0 | K63: =(RC[-1]/RC[-8])*100 -> 0 | L63: 0 | M63: =(RC[-1]/RC[-10])*100 -> 0
A64: Carter CDP | B64: Chouteau County | C64: 10 | D64: 2 | E64: =(RC[-1]/RC[-2])*100 -> 20 | F64: 0 | G64: =(RC[-1]/RC[-4])*100 -> 0 | H64: 2 | I64: =(RC[-1]/RC[-6])*100 -> 20 | J64: 4 | K64: =(RC[-1]/RC[-8])*100 -> 40 | L64: 2 | M64: =(RC[-1]/RC[-10])*100 -> 20
A65: Cascade town | B65: Cascade County | C65: 265 | D65: 29 | E65: =(RC[-1]/RC[-2])*100 -> 10.943396226415095 | F65: 10 | G65: =(RC[-1]/RC[-4])*100 -> 3.7735849056603774 | H65: 132 | I65: =(RC[-1]/RC[-6])*100 -> 49.811320754716981 | J65: 64 | K65: =(RC[-1]/RC[-8])*100 -> 24.150943396226417 | L65: 30 | M65: =(RC[-1]/RC[-10])*100 -> 11.320754716981133
A66: Charlo CDP | B66: Lake County | C66: 157 | D66: 9 | E66: =(RC[-1]/RC[-2])*100 -> 5.7324840764331215 | F66: 11 | G66: =(RC[-1]/RC[-4])*100 -> 7.0063694267515926 | H66: 91 | I66: =(RC[-1]/RC[-6])*100 -> 57.961783439490446 | J66: 35 | K66: =(RC[-1]/RC[-8])*100 -> 22.29299363057325 | L66: 11 | M66: =(RC[-1]/RC[-10])*100 -> 7.0063694267515926
A67: Chester town | B67: Liberty County | C67: 207 | D67: 6 | E67: =(RC[-1]/RC[-2])*100 -> 2.8985507246376812 | F67: 16 | G67: =(RC[-1]/RC[-4])*100 -> 7.7294685990338161 | H67: 92 | I67: =(RC[-1]/RC[-6])*100 -> 44.444444444444443 | J67: 74 | K67: =(RC[-1]/RC[-8])*100 -> 35.748792270531396 | L67: 19 | M67: =(RC[-1]/RC[-10])*100 -> 9.1787439613526569
A68: Chinook city | B68: Blaine County | C68: 287 | D68: 12 | E68: =(RC[-1]/RC[-2])*100 -> 4.1811846689895473 | F68: 13 | G68: =(RC[-1]/RC[-4])*100 -> 4.529616724738676 | H68: 143 | I68: =(RC[-1]/RC[-6])*100 -> 49.825783972125436 | J68: 86 | K68: =(RC[-1]/RC[-8])*100 -> 29.965156794425084 | L68: 33 | M68: =(RC[-1]/RC[-10])*100 -> 11.498257839721255
A69: Choteau city | B69: Teton County | C69: 367 | D69: 29 | E69: =(RC[-1]/RC[-2])*100 -> 7.9019073569482288 | F69: 28 | G69: =(RC[-1]/RC[-4])*100 -> 7.6294277929155312 | H69: 193 | I69: =(RC[-1]/RC[-6])*100 -> 52.588555858310627 | J69: 102 | K69: =(RC[-1]/RC[-8])*100 -> 27.792915531335151 | L69: 15 | M69: =(RC[-1]/RC[-10])*100 -> 4.0871934604904636
A70: Circle town | B70: McCone County | C70: 128 | D70: 6 | E70: =(RC[-1]/RC[-2])*100 -> 4.6875 | F70: 10 | G70: =(RC[-1]/RC[-4])*100 -> 7.8125 | H70: 60 | I70: =(RC[-1]/RC[-6])*100 -> 46.875 | J70: 43 | K70: =(RC[-1]/RC[-8])*100 -> 33.59375 | L70: 9 | M70: =(RC[-1]/RC[-10])*100 -> 7.03125
A71: Clancy CDP | B71: Jefferson County | C71: 326 | D71: 7 | E71: =(RC[-1]/RC[-2])*100 -> 2.147239263803681 | F71: 31 | G71: =(RC[-1]/RC[-4])*100 -> 9.5092024539877311 | H71: 163 | I71: =(RC[-1]/RC[-6])*100 -> 50 | J71: 98 | K71: =(RC[-1]/RC[-8])*100 -> 30.061349693251532 | L71: 27 | M71: =(RC[-1]/RC[-10])*100 -> 8.2822085889570545
A72: Clinton CDP | B72: Missoula County | C72: 182 | D72: 4 | E72: =(RC[-1]/RC[-2])*100 -> 2.197802197802198 | F72: 17 | G72: =(RC[-1]/RC[-4])*100 -> 9.3406593406593412 | H72: 91 | I72: =(RC[-1]/RC[-6])*100 -> 50 | J72: 50 | K72: =(RC[-1]/RC[-8])*100 -> 27.472527472527474 | L72: 20 | M72: =(RC[-1]/RC[-10])*100 -> 10.989010989010989
A73: Clyde Park town | B73: Park County | C73: 38 | D73: 0 | E73: =(RC[-1]/RC[-2])*100 -> 0 | F73: 0 | G73: =(RC[-1]/RC[-4])*100 -> 0 | H73: 18 | I73: =(RC[-1]/RC[-6])*100 -> 47.368421052631575 | J73: 18 | K73: =(RC[-1]/RC[-8])*100 -> 47.368421052631575 | L73: 2 | M73: =(RC[-1]/RC[-10])*100 -> 5.2631578947368416
A74: Colstrip city | B74: Rosebud County | C74: 836 | D74: 68 | E74: =(RC[-1]/RC[-2])*100 -> 8.133971291866029 | F74: 38 | G74: =(RC[-1]/RC[-4])*100 -> 4.5454545454545459 | H74: 395 | I74: =(RC[-1]/RC[-6])*100 -> 47.248803827751196 | J74: 241 | K74: =(RC[-1]/RC[-8])*100 -> 28.827751196172247 | L74: 94 | M74: =(RC[-1]/RC[-10])*100 -> 11.244019138755981
A75: Columbia Falls city | B75: Flathead County | C75: 877 | D75: 34 | E75: =(RC[-1]/RC[-2])*100 -> 3.8768529076396807 | F75: 49 | G75: =(RC[-1]/RC[-4])*100 -> 5.5872291904218923 | H75: 462 | I75: =(RC[-1]/RC[-6])*100 -> 52.679589509692136 | J75: 238 | K75: =(RC[-1]/RC[-8])*100 -> 27.137970353477765 | L75: 94 | M75: =(RC[-1]/RC[-10])*100 -> 10.718358038768528
A76: Columbus town | B76: Stillwater County | C76: 379 | D76: 14 | E76: =(RC[-1]/RC[-2])*100 -> 3.6939313984168867 | F76: 29 | G76: =(RC[-1]/RC[-4])*100 -> 7.6517150395778364 | H76: 209 | I76: =(RC[-1]/RC[-6])*100 -> 55.145118733509236 | J76: 99 | K76: =(RC[-1]/RC[-8])*100 -> 26.121372031662272 | L76: 28 | M76: =(RC[-1]/RC[-10])*100 -> 7.3878627968337733
A77: Conrad city | B77: Pondera County | C77: 727 | D77: 57 | E77: =(RC[-1]/RC[-2])*100 -> 7.8404401650618984 | F77: 21 | G77: =(RC[-1]/RC[-4])*100 -> 2.8885832187070153 | H77: 345 | I77: =(RC[-1]/RC[-6])*100 -> 47.455295735900968 | J77: 249 | K77: =(RC[-1]/RC[-8])*100 -> 34.25034387895461 | L77: 55 | M77: =(RC[-1]/RC[-10])*100 -> 7.5653370013755161
A78: Cooke City-Silver Gate CDP | B78: Park County | C78: 9 | D78: 0 | E78: =(RC[-1]/RC[-2])*100 -> 0 | F78: 0 | G78: =(RC[-1]/RC[-4])*100 -> 0 | H78: 9 | I78: =(RC[-1]/RC[-6])*100 -> 100 | J78: 0 | K78: =(RC[-1]/RC[-8])*100 -> 0 | L78: 0 | M78: =(RC[-1]/RC[-10])*100 -> 0
A79: Coram CDP | B79: Flathead County | C79: 80 | D79: 0 | E79: =(RC[-1]/RC[-2])*100 -> 0 | F79: 5 | G79: =(RC[-1]/RC[-4])*100 -> 6.25 | H79: 51 | I79: =(RC[-1]/RC[-6])*100 -> 63.749999999999993 | J79: 10 | K79: =(RC[-1]/RC[-8])*100 -> 12.5 | L79: 14 | M79: =(RC[-1]/RC[-10])*100 -> 17.5
A80: Corvallis CDP | B80: Ravalli County | C80: 99 | D80: 10 | E80: =(RC[-1]/RC[-2])*100 -> 10.1010101010101 | F80: 0 | G80: =(RC[-1]/RC[-4])*100 -> 0 | H80: 59 | I80: =(RC[-1]/RC[-6])*100 -> 59.595959595959592 | J80: 30 | K80: =(RC[-1]/RC[-8])*100 -> 30.303030303030305 | L80: 0 | M80: =(RC[-1]/RC[-10])*100 -> 0
A81: Crow Agency CDP | B81: Big Horn County | C81: 728 | D81: 79 | E81: =(RC[-1]/RC[-2])*100 -> 10.851648351648352 | F81: 50 | G81: =(RC[-1]/RC[-4])*100 -> 6.8681318681318686 | H81: 389 | I81: =(RC[-1]/RC[-6])*100 -> 53.434065934065934 | J81: 144 | K81: =(RC[-1]/RC[-8])*100 -> 19.780219780219781 | L81: 66 | M81: =(RC[-1]/RC[-10])*100 -> 9.0659340659340657
A82: Culbertson town | B82: Roosevelt County | C82: 150 | D82: 8 | E82: =(RC[-1]/RC[-2])*100 -> 5.3333333333333339 | F82: 10 | G82: =(RC[-1]/RC[-4])*100 -> 6.666666666666667 | H82: 70 | I82: =(RC[-1]/RC[-6])*100 -> 46.666666666666664 | J82: 58 | K82: =(RC[-1]/RC[-8])*100 -> 38.666666666666664 | L82: 4 | M82: =(RC[-1]/RC[-10])*100 -> 2.666666666666667
A83: Custer CDP | B83: Yellowstone County | C83: 21 | D83: 0 | E83: =(RC[-1]/RC[-2])*100 -> 0 | F83: 4 | G83: =(RC[-1]/RC[-4])*100 -> 19.047619047619047 | H83: 14 | I83: =(RC[-1]/RC[-6])*100 -> 66.666666666666657 | J83: 3 | K83: =(RC[-1]/RC[-8])*100 -> 14.285714285714285 | L83: 0 | M83: =(RC[-1]/RC[-10])*100 -> 0
A84: Cut Bank city | B84: Glacier County | C84: 784 | D84: 38 | E84: =(RC[-1]/RC[-2])*100 -> 4.8469387755102042 | F84: 27 | G84: =(RC[-1]/RC[-4])*100 -> 3.4438775510204076 | H84: 397 | I84: =(RC[-1]/RC[-6])*100 -> 50.637755102040813 | J84: 257 | K84: =(RC[-1]/RC[-8])*100 -> 32.780612244897959 | L84: 65 | M84: =(RC[-1]/RC[-10])*100 -> 8.2908163265306118
A85: Darby town | B85: Ravalli County | C85: 194 | D85: 10 | E85: =(RC[-1]/RC[-2])*100 -> 5.1546391752577314 | F85: 5 | G85: =(RC[-1]/RC[-4])*100 -> 2.5773195876288657 | H85: 116 | I85: =(RC[-1]/RC[-6])*100 -> 59.793814432989691 | J85: 50 | K85: =(RC[-1]/RC[-8])*100 -> 25.773195876288657 | L85: 13 | M85: =(RC[-1]/RC[-10])*100 -> 6.7010309278350517
A86: Dayton CDP | B86: Lake County | C86: 11 | D86: 2 | E86: =(RC[-1]/RC[-2])*100 -> 18.181818181818183 | F86: 0 | G86: =(RC[-1]/RC[-4])*100 -> 0 | H86: 3 | I86: =(RC[-1]/RC[-6])*100 -> 27.27272727272727 | J86: 6 | K86: =(RC[-1]/RC[-8])*100 -> 54.54545454545454 | L86: 0 | M86: =(RC[-1]/RC[-10])*100 -> 0
A87: De Borgia CDP | B87: Mineral County | C87: 2 | D87: 0 | E87: =(RC[-1]/RC[-2])*100 -> 0 | F87: 0 | G87: =(RC[-1]/RC[-4])*100 -> 0 | H87: 0 | I87: =(RC[-1]/RC[-6])*100 -> 0 | J87: 2 | K87: =(RC[-1]/RC[-8])*100 -> 100 | L87: 0 | M87: =(RC[-1]/RC[-10])*100 -> 0
A88: Deer Lodge city | B88: Powell County | C88: 796 | D88: 60 | E88: =(RC[-1]/RC[-2])*100 -> 7.5376884422110546 | F88: 15 | G88: =(RC[-1]/RC[-4])*100 -> 1.8844221105527637 | H88: 442 | I88: =(RC[-1]/RC[-6])*100 -> 55.527638190954775 | J88: 203 | K88: =(RC[-1]/RC[-8])*100 -> 25.502512562814072 | L88: 76 | M88: =(RC[-1]/RC[-10])*100 -> 9.5477386934673358
A89: Denton town | B89: Fergus County | C89: 56 | D89: 0 | E89: =(RC[-1]/RC[-2])*100 -> 0 | F89: 4 | G89: =(RC[-1]/RC[-4])*100 -> 7.1428571428571423 | H89: 37 | I89: =(RC[-1]/RC[-6])*100 -> 66.071428571428569 | J89: 12 | K89: =(RC[-1]/RC[-8])*100 -> 21.428571428571427 | L89: 3 | M89: =(RC[-1]/RC[-10])*100 -> 5.3571428571428568
A90: Dillon city | B90: Beaverhead County | C90: 1070 | D90: 63 | E90: =(RC[-1]/RC[-2])*100 -> 5.8878504672897192 | F90: 51 | G90: =(RC[-1]/RC[-4])*100 -> 4.7663551401869162 | H90: 369 | I90: =(RC[-1]/RC[-6])*100 -> 34.485981308411219 | J90: 142 | K90: =(RC[-1]/RC[-8])*100 -> 13.271028037383179 | L90: 445 | M90: =(RC[-1]/RC[-10])*100 -> 41.588785046728972
A91: Dixon CDP | B91: Sanders County | C91: 51 | D91: 0 | E91: =(RC[-1]/RC[-2])*100 -> 0 | F91: 1 | G91: =(RC[-1]/RC[-4])*100 -> 1.9607843137254901 | H91: 33 | I91: =(RC[-1]/RC[-6])*100 -> 64.705882352941174 | J91: 12 | K91: =(RC[-1]/RC[-8])*100 -> 23.52941176470588 | L91: 5 | M91: =(RC[-1]/RC[-10])*100 -> 9.8039215686274517
A92: Dodson town | B92: Phillips County | C92: 40 | D92: 0 | E92: =(RC[-1]/RC[-2])*100 -> 0 | F92: 6 | G92: =(RC[-1]/RC[-4])*100 -> 15 | H92: 11 | I92: =(RC[-1]/RC[-6])*100 -> 27.500000000000004 | J92: 21 | K92: =(RC[-1]/RC[-8])*100 -> 52.5 | L92: 2 | M92: =(RC[-1]/RC[-10])*100 -> 5
A93: Drummond town | B93: Granite County | C93: 90 | D93: 3 | E93: =(RC[-1]/RC[-2])*100 -> 3.3333333333333335 | F93: 5 | G93: =(RC[-1]/RC[-4])*100 -> 5.5555555555555554 | H93: 62 | I93: =(RC[-1]/RC[-6])*100 -> 68.888888888888886 | J93: 15 | K93: =(RC[-1]/RC[-8])*100 -> 16.666666666666664 | L93: 5 | M93: =(RC[-1]/RC[-10])*100 -> 5.5555555555555554
A94: Dutton town | B94: Teton County | C94: 109 | D94: 2 | E94: =(RC[-1]/RC[-2])*100 -> 1.834862385321101 | F94: 7 | G94: =(RC[-1]/RC[-4])*100 -> 6.4220183486238538 | H94: 54 | I94: =(RC[-1]/RC[-6])*100 -> 49.541284403669728 | J94: 40 | K94: =(RC[-1]/RC[-8])*100 -> 36.697247706422019 | L94: 6 | M94: =(RC[-1]/RC[-10])*100 -> 5.5045871559633035
A95: East Glacier Park Village CDP | B95: Glacier County | C95: 134 | D95: 4 | E95: =(RC[-1]/RC[-2])*100 -> 2.9850746268656714 | F95: 6 | G95: =(RC[-1]/RC[-4])*100 -> 4.4776119402985071 | H95: 61 | I95: =(RC[-1]/RC[-6])*100 -> 45.522388059701491 | J95: 35 | K95: =(RC[-1]/RC[-8])*100 -> 26.119402985074625 | L95: 28 | M95: =(RC[-1]/RC[-10])*100 -> 20.8955223880597
A96: East Helena town | B96: Lewis and Clark County | C96: 319 | D96: 9 | E96: =(RC[-1]/RC[-2])*100 -> 2.8213166144200628 | F96: 8 | G96: =(RC[-1]/RC[-4])*100 -> 2.507836990595611 | H96: 145 | I96: =(RC[-1]/RC[-6])*100 -> 45.454545454545453 | J96: 110 | K96: =(RC[-1]/RC[-8])*100 -> 34.482758620689658 | L96: 47 | M96: =(RC[-1]/RC[-10])*100 -> 14.733542319749215
A97: East Missoula CDP | B97: Missoula County | C97: 619 | D97: 8 | E97: =(RC[-1]/RC[-2])*100 -> 1.2924071082390953 | F97: 39 | G97: =(RC[-1]/RC[-4])*100 -> 6.30048465266559 | H97: 319 | I97: =(RC[-1]/RC[-6])*100 -> 51.534733441033929 | J97: 156 | K97: =(RC[-1]/RC[-8])*100 -> 25.20193861066236 | L97: 97 | M97: =(RC[-1]/RC[-10])*100 -> 15.670436187399032
A98: Ekalaka town | B98: Carter County | C98: 66 | D98: 7 | E98: =(RC[-1]/RC[-2])*100 -> 10.606060606060606 | F98: 3 | G98: =(RC[-1]/RC[-4])*100 -> 4.5454545454545459 | H98: 31 | I98: =(RC[-1]/RC[-6])*100 -> 46.969696969696969 | J98: 23 | K98: =(RC[-1]/RC[-8])*100 -> 34.848484848484851 | L98: 2 | M98: =(RC[-1]/RC[-10])*100 -> 3.0303030303030303
A99: CENSUS 2000: MONTANA
A100: SCHOOL ENROLLMENT
D102: ---------------------------------------------Population 3 years and over enrolled in school--------------------------------------
C103: Population 3
C104: years and over | D104: Nursery School | H104: Elementary School | J104: High School | L104: College or
C105: enrolled in | D105: Preschool | F105: Kindergarten | H105: Grades 1-8 | J105: Grades 9-12 | L105: Graduate School
A106: CITIES/TOWNS/CDP* | B106: COUNTY | C106: school | D106: Number | E106: Percent | F106: Number | G106: Percent | H106: Number | I106: Percent | J106: Number | K106: Percent | L106: Number | M106: Percent
A108: Elliston CDP | B108: Powell County | C108: 48 | D108: 0 | E108: =(RC[-1]/RC[-2])*100 -> 0 | F108: 2 | G108: =(RC[-1]/RC[-4])*100 -> 4.1666666666666661 | H108: 36 | I108: =(RC[-1]/RC[-6])*100 -> 75 | J108: 8 | K108: =(RC[-1]/RC[-8])*100 -> 16.666666666666664 | L108: 2 | M108: =(RC[-1]/RC[-10])*100 -> 4.1666666666666661
A109: Elmo CDP | B109: Lake County | C109: 39 | D109: 5 | E109: =(RC[-1]/RC[-2])*100 -> 12.820512820512819 | F109: 5 | G109: =(RC[-1]/RC[-4])*100 -> 12.820512820512819 | H109: 15 | I109: =(RC[-1]/RC[-6])*100 -> 38.461538461538467 | J109: 0 | K109: =(RC[-1]/RC[-8])*100 -> 0 | L109: 14 | M109: =(RC[-1]/RC[-10])*100 -> 35.897435897435898
A110: Ennis town | B110: Madison County | C110: 205 | D110: 18 | E110: =(RC[-1]/RC[-2])*100 -> 8.7804878048780477 | F110: 1 | G110: =(RC[-1]/RC[-4])*100 -> 0.48780487804878048 | H110: 103 | I110: =(RC[-1]/RC[-6])*100 -> 50.243902439024389 | J110: 65 | K110: =(RC[-1]/RC[-8])*100 -> 31.707317073170731 | L110: 18 | M110: =(RC[-1]/RC[-10])*100 -> 8.7804878048780477
A111: Eureka town | B111: Lincoln County | C111: 224 | D111: 27 | E111: =(RC[-1]/RC[-2])*100 -> 12.053571428571429 | F111: 15 | G111: =(RC[-1]/RC[-4])*100 -> 6.6964285714285712 | H111: 118 | I111: =(RC[-1]/RC[-6])*100 -> 52.678571428571431 | J111: 44 | K111: =(RC[-1]/RC[-8])*100 -> 19.642857142857142 | L111: 20 | M111: =(RC[-1]/RC[-10])*100 -> 8.9285714285714288
A112: Evaro CDP | B112: Missoula County | C112: 111 | D112: 5 | E112: =(RC[-1]/RC[-2])*100 -> 4.5045045045045047 | F112: 12 | G112: =(RC[-1]/RC[-4])*100 -> 10.810810810810811 | H112: 57 | I112: =(RC[-1]/RC[-6])*100 -> 51.351351351351347 | J112: 23 | K112: =(RC[-1]/RC[-8])*100 -> 20.72072072072072 | L112: 14 | M112: =(RC[-1]/RC[-10])*100 -> 12.612612612612612
A113: Evergreen CDP | B113: Flathead County | C113: 1439 | D113: 105 | E113: =(RC[-1]/RC[-2])*100 -> 7.2967338429464901 | F113: 109 | G113: =(RC[-1]/RC[-4])*100 -> 7.5747046560111189 | H113: 753 | I113: =(RC[-1]/RC[-6])*100 -> 52.328005559416255 | J113: 319 | K113: =(RC[-1]/RC[-8])*100 -> 22.1681723419041 | L113: 153 | M113: =(RC[-1]/RC[-10])*100 -> 10.632383599722029
A114: Fairfield town | B114: Teton County | C114: 122 | D114: 4 | E114: =(RC[-1]/RC[-2])*100 -> 3.278688524590164 | F114: 10 | G114: =(RC[-1]/RC[-4])*100 -> 8.1967213114754092 | H114: 58 | I114: =(RC[-1]/RC[-6])*100 -> 47.540983606557376 | J114: 39 | K114: =(RC[-1]/RC[-8])*100 -> 31.967213114754102 | L114: 11 | M114: =(RC[-1]/RC[-10])*100 -> 9.0163934426229506
A115: Fairview town | B115: Richland County | C115: 157 | D115: 13 | E115: =(RC[-1]/RC[-2])*100 -> 8.2802547770700627 | F115: 7 | G115: =(RC[-1]/RC[-4])*100 -> 4.4585987261146496 | H115: 91 | I115: =(RC[-1]/RC[-6])*100 -> 57.961783439490446 | J115: 41 | K115: =(RC[-1]/RC[-8])*100 -> 26.114649681528661 | L115: 5 | M115: =(RC[-1]/RC[-10])*100 -> 3.1847133757961785
A116: Fallon CDP | B116: Prairie County | C116: 24 | D116: 0 | E116: =(RC[-1]/RC[-2])*100 -> 0 | F116: 2 | G116: =(RC[-1]/RC[-4])*100 -> 8.3333333333333321 | H116: 8 | I116: =(RC[-1]/RC[-6])*100 -> 33.333333333333329 | J116: 7 | K116: =(RC[-1]/RC[-8])*100 -> 29.166666666666668 | L116: 7 | M116: =(RC[-1]/RC[-10])*100 -> 29.166666666666668
A117: Finley Point CDP | B117: Lake County | C117: 98 | D117: 0 | E117: =(RC[-1]/RC[-2])*100 -> 0 | F117: 13 | G117: =(RC[-1]/RC[-4])*100 -> 13.26530612244898 | H117: 49 | I117: =(RC[-1]/RC[-6])*100 -> 50 | J117: 14 | K117: =(RC[-1]/RC[-8])*100 -> 14.285714285714285 | L117: 22 | M117: =(RC[-1]/RC[-10])*100 -> 22.448979591836736
A118: Flaxville town | B118: Daniels County | C118: 10 | D118: 0 | E118: =(RC[-1]/RC[-2])*100 -> 0 | F118: 0 | G118: =(RC[-1]/RC[-4])*100 -> 0 | H118: 6 | I118: =(RC[-1]/RC[-6])*100 -> 60 | J118: 2 | K118: =(RC[-1]/RC[-8])*100 -> 20 | L118: 2 | M118: =(RC[-1]/RC[-10])*100 -> 20
A119: Florence CDP | B119: Ravalli County | C119: 243 | D119: 0 | E119: =(RC[-1]/RC[-2])*100 -> 0 | F119: 18 | G119: =(RC[-1]/RC[-4])*100 -> 7.4074074074074066 | H119: 105 | I119: =(RC[-1]/RC[-6])*100 -> 43.209876543209873 | J119: 69 | K119: =(RC[-1]/RC[-8])*100 -> 28.39506172839506 | L119: 51 | M119: =(RC[-1]/RC[-10])*100 -> 20.987654320987652
A120: Forsyth city | B120: Rosebud County | C120: 453 | D120: 44 | E120: =(RC[-1]/RC[-2])*100 -> 9.7130242825607063 | F120: 23 | G120: =(RC[-1]/RC[-4])*100 -> 5.0772626931567331 | H120: 221 | I120: =(RC[-1]/RC[-6])*100 -> 48.785871964679913 | J120: 149 | K120: =(RC[-1]/RC[-8])*100 -> 32.891832229580572 | L120: 16 | M120: =(RC[-1]/RC[-10])*100 -> 3.5320088300220749
A121: Fort Belknap Agency CDP | B121: Blaine County | C121: 505 | D121: 54 | E121: =(RC[-1]/RC[-2])*100 -> 10.693069306930694 | F121: 26 | G121: =(RC[-1]/RC[-4])*100 -> 5.1485148514851486 | H121: 251 | I121: =(RC[-1]/RC[-6])*100 -> 49.702970297029701 | J121: 113 | K121: =(RC[-1]/RC[-8])*100 -> 22.376237623762378 | L121: 61 | M121: =(RC[-1]/RC[-10])*100 -> 12.079207920792079
A122: Fort Benton city | B122: Chouteau County | C122: 391 | D122: 15 | E122: =(RC[-1]/RC[-2])*100 -> 3.8363171355498724 | F122: 17 | G122: =(RC[-1]/RC[-4])*100 -> 4.3478260869565215 | H122: 169 | I122: =(RC[-1]/RC[-6])*100 -> 43.222506393861892 | J122: 161 | K122: =(RC[-1]/RC[-8])*100 -> 41.17647058823529 | L122: 29 | M122: =(RC[-1]/RC[-10])*100 -> 7.4168797953964196
A123: Fortine CDP | B123: Lincoln County | C123: 47 | D123: 0 | E123: =(RC[-1]/RC[-2])*100 -> 0 | F123: 0 | G123: =(RC[-1]/RC[-4])*100 -> 0 | H123: 40 | I123: =(RC[-1]/RC[-6])*100 -> 85.106382978723403 | J123: 6 | K123: =(RC[-1]/RC[-8])*100 -> 12.76595744680851 | L123: 1 | M123: =(RC[-1]/RC[-10])*100 -> 2.1276595744680851
A124: Fort Peck town | B124: Valley County | C124: 73 | D124: 2 | E124: =(RC[-1]/RC[-2])*100 -> 2.7397260273972601 | F124: 4 | G124: =(RC[-1]/RC[-4])*100 -> 5.4794520547945202 | H124: 33 | I124: =(RC[-1]/RC[-6])*100 -> 45.205479452054789 | J124: 29 | K124: =(RC[-1]/RC[-8])*100 -> 39.726027397260275 | L124: 5 | M124: =(RC[-1]/RC[-10])*100 -> 6.8493150684931505
A125: Fort Shaw CDP | B125: Cascade County | C125: 64 | D125: 0 | E125: =(RC[-1]/RC[-2])*100 -> 0 | F125: 2 | G125: =(RC[-1]/RC[-4])*100 -> 3.125 | H125: 36 | I125: =(RC[-1]/RC[-6])*100 -> 56.25 | J125: 21 | K125: =(RC[-1]/RC[-8])*100 -> 32.8125 | L125: 5 | M125: =(RC[-1]/RC[-10])*100 -> 7.8125
A126: Fort Smith CDP | B126: Big Horn County | C126: 49 | D126: 0 | E126: =(RC[-1]/RC[-2])*100 -> 0 | F126: 5 | G126: =(RC[-1]/RC[-4])*100 -> 10.204081632653061 | H126: 44 | I126: =(RC[-1]/RC[-6])*100 -> 89.795918367346943 | J126: 0 | K126: =(RC[-1]/RC[-8])*100 -> 0 | L126: 0 | M126: =(RC[-1]/RC[-10])*100 -> 0
A127: Four Corners CDP | B127: Gallatin County | C127: 389 | D127: 13 | E127: =(RC[-1]/RC[-2])*100 -> 3.3419023136246784 | F127: 22 | G127: =(RC[-1]/RC[-4])*100 -> 5.6555269922879177 | H127: 175 | I127: =(RC[-1]/RC[-6])*100 -> 44.987146529562985 | J127: 81 | K127: =(RC[-1]/RC[-8])*100 -> 20.822622107969153 | L127: 98 | M127: =(RC[-1]/RC[-10])*100 -> 25.192802056555269
A128: Fox Lake CDP | B128: Richland County | C128: 47 | D128: 2 | E128: =(RC[-1]/RC[-2])*100 -> 4.2553191489361701 | F128: 2 | G128: =(RC[-1]/RC[-4])*100 -> 4.2553191489361701 | H128: 28 | I128: =(RC[-1]/RC[-6])*100 -> 59.574468085106382 | J128: 13 | K128: =(RC[-1]/RC[-8])*100 -> 27.659574468085108 | L128: 2 | M128: =(RC[-1]/RC[-10])*100 -> 4.2553191489361701
A129: Frazer CDP | B129: Valley County | C129: 216 | D129: 15 | E129: =(RC[-1]/RC[-2])*100 -> 6.9444444444444446 | F129: 7 | G129: =(RC[-1]/RC[-4])*100 -> 3.2407407407407405 | H129: 92 | I129: =(RC[-1]/RC[-6])*100 -> 42.592592592592595 | J129: 66 | K129: =(RC[-1]/RC[-8])*100 -> 30.555555555555557 | L129: 36 | M129: =(RC[-1]/RC[-10])*100 -> 16.666666666666664
A130: Frenchtown CDP | B130: Missoula County | C130: 221 | D130: 8 | E130: =(RC[-1]/RC[-2])*100 -> 3.6199095022624439 | F130: 8 | G130: =(RC[-1]/RC[-4])*100 -> 3.6199095022624439 | H130: 97 | I130: =(RC[-1]/RC[-6])*100 -> 43.891402714932127 | J130: 76 | K130: =(RC[-1]/RC[-8])*100 -> 34.389140271493211 | L130: 32 | M130: =(RC[-1]/RC[-10])*100 -> 14.479638009049776
A131: Froid town | B131: Roosevelt County | C131: 36 | D131: 0 | E131: =(RC[-1]/RC[-2])*100 -> 0 | F131: 5 | G131: =(RC[-1]/RC[-4])*100 -> 13.888888888888889 | H131: 17 | I131: =(RC[-1]/RC[-6])*100 -> 47.222222222222221 | J131: 12 | K131: =(RC[-1]/RC[-8])*100 -> 33.333333333333329 | L131: 2 | M131: =(RC[-1]/RC[-10])*100 -> 5.5555555555555554
A132: Fromberg town | B132: Carbon County | C132: 124 | D132: 7 | E132: =(RC[-1]/RC[-2])*100 -> 5.6451612903225801 | F132: 11 | G132: =(RC[-1]/RC[-4])*100 -> 8.870967741935484 | H132: 58 | I132: =(RC[-1]/RC[-6])*100 -> 46.774193548387096 | J132: 41 | K132: =(RC[-1]/RC[-8])*100 -> 33.064516129032256 | L132: 7 | M132: =(RC[-1]/RC[-10])*100 -> 5.6451612903225801
A133: Gardiner CDP | B133: Park County | C133: 149 | D133: 11 | E133: =(RC[-1]/RC[-2])*100 -> 7.3825503355704702 | F133: 2 | G133: =(RC[-1]/RC[-4])*100 -> 1.3422818791946309 | H133: 86 | I133: =(RC[-1]/RC[-6])*100 -> 57.718120805369132 | J133: 37 | K133: =(RC[-1]/RC[-8])*100 -> 24.832214765100673 | L133: 13 | M133: =(RC[-1]/RC[-10])*100 -> 8.724832214765101
A134: Garrison CDP | B134: Powell County | C134: 21 | D134: 0 | E134: =(RC[-1]/RC[-2])*100 -> 0 | F134: 4 | G134: =(RC[-1]/RC[-4])*100 -> 19.047619047619047 | H134: 13 | I134: =(RC[-1]/RC[-6])*100 -> 61.904761904761905 | J134: 2 | K134: =(RC[-1]/RC[-8])*100 -> 9.5238095238095237 | L134: 2 | M134: =(RC[-1]/RC[-10])*100 -> 9.5238095238095237
A135: Geraldine town | B135: Chouteau County | C135: 79 | D135: 0 | E135: =(RC[-1]/RC[-2])*100 -> 0 | F135: 4 | G135: =(RC[-1]/RC[-4])*100 -> 5.0632911392405067 | H135: 45 | I135: =(RC[-1]/RC[-6])*100 -> 56.962025316455701 | J135: 22 | K135: =(RC[-1]/RC[-8])*100 -> 27.848101265822784 | L135: 8 | M135: =(RC[-1]/RC[-10])*100 -> 10.126582278481013
A136: Gildford CDP | B136: Hill County | C136: 29 | D136: 3 | E136: =(RC[-1]/RC[-2])*100 -> 10.344827586206897 | F136: 0 | G136: =(RC[-1]/RC[-4])*100 -> 0 | H136: 12 | I136: =(RC[-1]/RC[-6])*100 -> 41.379310344827587 | J136: 12 | K136: =(RC[-1]/RC[-8])*100 -> 41.379310344827587 | L136: 2 | M136: =(RC[-1]/RC[-10])*100 -> 6.8965517241379306
A137: Glasgow city | B137: Valley County | C137: 777 | D137: 33 | E137: =(RC[-1]/RC[-2])*100 -> 4.2471042471042466 | F137: 87 | G137: =(RC[-1]/RC[-4])*100 -> 11.196911196911197 | H137: 372 | I137: =(RC[-1]/RC[-6])*100 -> 47.876447876447877 | J137: 251 | K137: =(RC[-1]/RC[-8])*100 -> 32.303732303732303 | L137: 34 | M137: =(RC[-1]/RC[-10])*100 -> 4.3758043758043756
A138: Glendive city | B138: Dawson County | C138: 1162 | D138: 67 | E138: =(RC[-1]/RC[-2])*100 -> 5.76592082616179 | F138: 60 | G138: =(RC[-1]/RC[-4])*100 -> 5.1635111876075728 | H138: 476 | I138: =(RC[-1]/RC[-6])*100 -> 40.963855421686745 | J138: 261 | K138: =(RC[-1]/RC[-8])*100 -> 22.461273666092943 | L138: 298 | M138: =(RC[-1]/RC[-10])*100 -> 25.645438898450944
A139: Grass Range town | B139: Fergus County | C139: 32 | D139: 0 | E139: =(RC[-1]/RC[-2])*100 -> 0 | F139: 2 | G139: =(RC[-1]/RC[-4])*100 -> 6.25 | H139: 8 | I139: =(RC[-1]/RC[-6])*100 -> 25 | J139: 18 | K139: =(RC[-1]/RC[-8])*100 -> 56.25 | L139: 4 | M139: =(RC[-1]/RC[-10])*100 -> 12.5
A140: Great Falls city | B140: Cascade County | C140: 14008 | D140: 909 | E140: =(RC[-1]/RC[-2])*100 -> 6.4891490576813249 | F140: 738 | G140: =(RC[-1]/RC[-4])*100 -> 5.2684180468303827 | H140: 6616 | I140: =(RC[-1]/RC[-6])*100 -> 47.230154197601372 | J140: 3465 | K140: =(RC[-1]/RC[-8])*100 -> 24.735865219874356 | L140: 2280 | M140: =(RC[-1]/RC[-10])*100 -> 16.276413478012564
A141: Greycliff CDP | B141: Sweet Grass County | C141: 25 | D141: 0 | E141: =(RC[-1]/RC[-2])*100 -> 0 | F141: 0 | G141: =(RC[-1]/RC[-4])*100 -> 0 | H141: 15 | I141: =(RC[-1]/RC[-6])*100 -> 60 | J141: 10 | K141: =(RC[-1]/RC[-8])*100 -> 40 | L141: 0 | M141: =(RC[-1]/RC[-10])*100 -> 0
A142: Hamilton city | B142: Ravalli County | C142: 680 | D142: 20 | E142: =(RC[-1]/RC[-2])*100 -> 2.9411764705882351 | F142: 50 | G142: =(RC[-1]/RC[-4])*100 -> 7.3529411764705888 | H142: 313 | I142: =(RC[-1]/RC[-6])*100 -> 46.029411764705877 | J142: 210 | K142: =(RC[-1]/RC[-8])*100 -> 30.882352941176471 | L142: 87 | M142: =(RC[-1]/RC[-10])*100 -> 12.794117647058822
A143: Hardin city | B143: Big Horn County | C143: 1020 | D143: 73 | E143: =(RC[-1]/RC[-2])*100 -> 7.1568627450980387 | F143: 45 | G143: =(RC[-1]/RC[-4])*100 -> 4.4117647058823533 | H143: 546 | I143: =(RC[-1]/RC[-6])*100 -> 53.529411764705884 | J143: 226 | K143: =(RC[-1]/RC[-8])*100 -> 22.156862745098039 | L143: 130 | M143: =(RC[-1]/RC[-10])*100 -> 12.745098039215685
A144: Harlem city | B144: Blaine County | C144: 252 | D144: 24 | E144: =(RC[-1]/RC[-2])*100 -> 9.5238095238095237 | F144: 4 | G144: =(RC[-1]/RC[-4])*100 -> 1.5873015873015872 | H144: 128 | I144: =(RC[-1]/RC[-6])*100 -> 50.793650793650791 | J144: 65 | K144: =(RC[-1]/RC[-8])*100 -> 25.793650793650798 | L144: 31 | M144: =(RC[-1]/RC[-10])*100 -> 12.301587301587301
A145: Harlowton city | B145: Wheatland County | C145: 236 | D145: 19 | E145: =(RC[-1]/RC[-2])*100 -> 8.0508474576271176 | F145: 10 | G145: =(RC[-1]/RC[-4])*100 -> 4.2372881355932197 | H145: 126 | I145: =(RC[-1]/RC[-6])*100 -> 53.389830508474581 | J145: 63 | K145: =(RC[-1]/RC[-8])*100 -> 26.694915254237291 | L145: 18 | M145: =(RC[-1]/RC[-10])*100 -> 7.6271186440677967
A146: Harrison CDP | B146: Madison County | C146: 44 | D146: 4 | E146: =(RC[-1]/RC[-2])*100 -> 9.0909090909090917 | F146: 2 | G146: =(RC[-1]/RC[-4])*100 -> 4.5454545454545459 | H146: 26 | I146: =(RC[-1]/RC[-6])*100 -> 59.090909090909093 | J146: 7 | K146: =(RC[-1]/RC[-8])*100 -> 15.909090909090908 | L146: 5 | M146: =(RC[-1]/RC[-10])*100 -> 11.363636363636363
A147: Havre city | B147: Hill County | C147: 3043 | D147: 230 | E147: =(RC[-1]/RC[-2])*100 -> 7.5583305948077548 | F147: 136 | G147: =(RC[-1]/RC[-4])*100 -> 4.4692737430167595 | H147: 1108 | I147: =(RC[-1]/RC[-6])*100 -> 36.411436082813012 | J147: 580 | K147: =(RC[-1]/RC[-8])*100 -> 19.06013802168912 | L147: 989 | M147: =(RC[-1]/RC[-10])*100 -> 32.500821557673348
A148: CENSUS 2000: MONTANA
A149: SCHOOL ENROLLMENT
D151: ---------------------------------------------Population 3 years and over enrolled in school--------------------------------------
C152: Population 3
C153: years and over | D153: Nursery School | H153: Elementary School | J153: High School | L153: College or
C154: enrolled in | D154: Preschool | F154: Kindergarten | H154: Grades 1-8 | J154: Grades 9-12 | L154: Graduate School
A155: CITIES/TOWNS/CDP* | B155: COUNTY | C155: school | D155: Number | E155: Percent | F155: Number | G155: Percent | H155: Number | I155: Percent | J155: Number | K155: Percent | L155: Number | M155: Percent
A157: Havre North CDP | B157: Hill County | C157: 300 | D157: 24 | E157: =(RC[-1]/RC[-2])*100 -> 8 | F157: 12 | G157: =(RC[-1]/RC[-4])*100 -> 4 | H157: 116 | I157: =(RC[-1]/RC[-6])*100 -> 38.666666666666664 | J157: 84 | K157: =(RC[-1]/RC[-8])*100 -> 28.000000000000004 | L157: 64 | M157: =(RC[-1]/RC[-10])*100 -> 21.333333333333336
A158: Hays CDP | B158: Blaine County | C158: 295 | D158: 35 | E158: =(RC[-1]/RC[-2])*100 -> 11.864406779661017 | F158: 14 | G158: =(RC[-1]/RC[-4])*100 -> 4.7457627118644066 | H158: 160 | I158: =(RC[-1]/RC[-6])*100 -> 54.237288135593218 | J158: 65 | K158: =(RC[-1]/RC[-8])*100 -> 22.033898305084744 | L158: 21 | M158: =(RC[-1]/RC[-10])*100 -> 7.1186440677966107
A159: Heart Butte CDP | B159: Pondera County | C159: 330 | D159: 25 | E159: =(RC[-1]/RC[-2])*100 -> 7.5757575757575761 | F159: 10 | G159: =(RC[-1]/RC[-4])*100 -> 3.0303030303030303 | H159: 148 | I159: =(RC[-1]/RC[-6])*100 -> 44.848484848484851 | J159: 95 | K159: =(RC[-1]/RC[-8])*100 -> 28.787878787878789 | L159: 52 | M159: =(RC[-1]/RC[-10])*100 -> 15.757575757575756
A160: Helena city | B160: Lewis and Clark County | C160: 6359 | D160: 327 | E160: =(RC[-1]/RC[-2])*100 -> 5.1423179745242962 | F160: 336 | G160: =(RC[-1]/RC[-4])*100 -> 5.2838496618965243 | H160: 2385 | I160: =(RC[-1]/RC[-6])*100 -> 37.505897153640511 | J160: 1575 | K160: =(RC[-1]/RC[-8])*100 -> 24.768045290139959 | L160: 1736 | M160: =(RC[-1]/RC[-10])*100 -> 27.299889919798709
A161: Helena Valley Northeast CDP | B161: Lewis and Clark County | C161: 570 | D161: 43 | E161: =(RC[-1]/RC[-2])*100 -> 7.5438596491228065 | F161: 35 | G161: =(RC[-1]/RC[-4])*100 -> 6.140350877192982 | H161: 305 | I161: =(RC[-1]/RC[-6])*100 -> 53.508771929824562 | J161: 117 | K161: =(RC[-1]/RC[-8])*100 -> 20.526315789473685 | L161: 70 | M161: =(RC[-1]/RC[-10])*100 -> 12.280701754385964
A162: Helena Valley Northwest CDP | B162: Lewis and Clark County | C162: 606 | D162: 25 | E162: =(RC[-1]/RC[-2])*100 -> 4.1254125412541249 | F162: 35 | G162: =(RC[-1]/RC[-4])*100 -> 5.7755775577557751 | H162: 318 | I162: =(RC[-1]/RC[-6])*100 -> 52.475247524752476 | J162: 139 | K162: =(RC[-1]/RC[-8])*100 -> 22.937293729372936 | L162: 89 | M162: =(RC[-1]/RC[-10])*100 -> 14.686468646864686
A163: Helena Valley Southeast CDP | B163: Lewis and Clark County | C163: 2234 | D163: 186 | E163: =(RC[-1]/RC[-2])*100 -> 8.3258728737690255 | F163: 181 | G163: =(RC[-1]/RC[-4])*100 -> 8.1020590868397502 | H163: 1167 | I163: =(RC[-1]/RC[-6])*100 -> 52.238137869292743 | J163: 498 | K163: =(RC[-1]/RC[-8])*100 -> 22.291853178155772 | L163: 202 | M163: =(RC[-1]/RC[-10])*100 -> 9.0420769919427038
A164: Helena Valley West Central CDP | B164: Lewis and Clark County | C164: 1988 | D164: 160 | E164: =(RC[-1]/RC[-2])*100 -> 8.0482897384305829 | F164: 139 | G164: =(RC[-1]/RC[-4])*100 -> 6.9919517102615698 | H164: 937 | I164: =(RC[-1]/RC[-6])*100 -> 47.132796780684103 | J164: 550 | K164: =(RC[-1]/RC[-8])*100 -> 27.665995975855129 | L164: 202 | M164: =(RC[-1]/RC[-10])*100 -> 10.160965794768611
A165: Helena West Side CDP | B165: Lewis and Clark County | C165: 472 | D165: 18 | E165: =(RC[-1]/RC[-2])*100 -> 3.8135593220338984 | F165: 26 | G165: =(RC[-1]/RC[-4])*100 -> 5.508474576271186 | H165: 243 | I165: =(RC[-1]/RC[-6])*100 -> 51.483050847457626 | J165: 138 | K165: =(RC[-1]/RC[-8])*100 -> 29.237288135593221 | L165: 47 | M165: =(RC[-1]/RC[-10])*100 -> 9.9576271186440675
A166: Heron CDP | B166: Sanders County | C166: 38 | D166: 2 | E166: =(RC[-1]/RC[-2])*100 -> 5.2631578947368416 | F166: 3 | G166: =(RC[-1]/RC[-4])*100 -> 7.8947368421052628 | H166: 25 | I166: =(RC[-1]/RC[-6])*100 -> 65.789473684210535 | J166: 8 | K166: =(RC[-1]/RC[-8])*100 -> 21.052631578947366 | L166: 0 | M166: =(RC[-1]/RC[-10])*100 -> 0
A167: Herron CDP | B167: Hill County | C167: 24 | D167: 0 | E167: =(RC[-1]/RC[-2])*100 -> 0 | F167: 0 | G167: =(RC[-1]/RC[-4])*100 -> 0 | H167: 17 | I167: =(RC[-1]/RC[-6])*100 -> 70.833333333333343 | J167: 0 | K167: =(RC[-1]/RC[-8])*100 -> 0 | L167: 7 | M167: =(RC[-1]/RC[-10])*100 -> 29.166666666666668
A168: Highwood CDP | B168: Chouteau County | C168: 64 | D168: 4 | E168: =(RC[-1]/RC[-2])*100 -> 6.25 | F168: 2 | G168: =(RC[-1]/RC[-4])*100 -> 3.125 | H168: 33 | I168: =(RC[-1]/RC[-6])*100 -> 51.5625 | J168: 23 | K168: =(RC[-1]/RC[-8])*100 -> 35.9375 | L168: 2 | M168: =(RC[-1]/RC[-10])*100 -> 3.125
A169: Hingham town | B169: Hill County | C169: 65 | D169: 0 | E169: =(RC[-1]/RC[-2])*100 -> 0 | F169: 0 | G169: =(RC[-1]/RC[-4])*100 -> 0 | H169: 29 | I169: =(RC[-1]/RC[-6])*100 -> 44.61538461538462 | J169: 28 | K169: =(RC[-1]/RC[-8])*100 -> 43.07692307692308 | L169: 8 | M169: =(RC[-1]/RC[-10])*100 -> 12.307692307692308
A170: Hobson city | B170: Judith Basin County | C170: 63 | D170: 0 | E170: =(RC[-1]/RC[-2])*100 -> 0 | F170: 0 | G170: =(RC[-1]/RC[-4])*100 -> 0 | H170: 32 | I170: =(RC[-1]/RC[-6])*100 -> 50.793650793650791 | J170: 26 | K170: =(RC[-1]/RC[-8])*100 -> 41.269841269841265 | L170: 5 | M170: =(RC[-1]/RC[-10])*100 -> 7.9365079365079358
A171: Hot Springs town | B171: Sanders County | C171: 118 | D171: 1 | E171: =(RC[-1]/RC[-2])*100 -> 0.84745762711864403 | F171: 7 | G171: =(RC[-1]/RC[-4])*100 -> 5.9322033898305087 | H171: 66 | I171: =(RC[-1]/RC[-6])*100 -> 55.932203389830505 | J171: 37 | K171: =(RC[-1]/RC[-8])*100 -> 31.35593220338983 | L171: 7 | M171: =(RC[-1]/RC[-10])*100 -> 5.9322033898305087
A172: Hungry Horse CDP | B172: Flathead County | C172: 301 | D172: 28 | E172: =(RC[-1]/RC[-2])*100 -> 9.3023255813953494 | F172: 11 | G172: =(RC[-1]/RC[-4])*100 -> 3.6544850498338874 | H172: 169 | I172: =(RC[-1]/RC[-6])*100 -> 56.146179401993358 | J172: 75 | K172: =(RC[-1]/RC[-8])*100 -> 24.916943521594686 | L172: 18 | M172: =(RC[-1]/RC[-10])*100 -> 5.9800664451827243
A173: Huntley CDP | B173: Yellowstone County | C173: 182 | D173: 25 | E173: =(RC[-1]/RC[-2])*100 -> 13.736263736263737 | F173: 5 | G173: =(RC[-1]/RC[-4])*100 -> 2.7472527472527473 | H173: 120 | I173: =(RC[-1]/RC[-6])*100 -> 65.934065934065927 | J173: 25 | K173: =(RC[-1]/RC[-8])*100 -> 13.736263736263737 | L173: 7 | M173: =(RC[-1]/RC[-10])*100 -> 3.8461538461538463
A174: Hysham town | B174: Treasure County | C174: 85 | D174: 4 | E174: =(RC[-1]/RC[-2])*100 -> 4.7058823529411766 | F174: 5 | G174: =(RC[-1]/RC[-4])*100 -> 5.8823529411764701 | H174: 54 | I174: =(RC[-1]/RC[-6])*100 -> 63.529411764705877 | J174: 18 | K174: =(RC[-1]/RC[-8])*100 -> 21.176470588235293 | L174: 4 | M174: =(RC[-1]/RC[-10])*100 -> 4.7058823529411766
A175: Inverness CDP | B175: Hill County | C175: 41 | D175: 9 | E175: =(RC[-1]/RC[-2])*100 -> 21.951219512195124 | F175: 4 | G175: =(RC[-1]/RC[-4])*100 -> 9.7560975609756095 | H175: 19 | I175: =(RC[-1]/RC[-6])*100 -> 46.341463414634148 | J175: 0 | K175: =(RC[-1]/RC[-8])*100 -> 0 | L175: 9 | M175: =(RC[-1]/RC[-10])*100 -> 21.951219512195124
A176: Ismay town | B176: Custer County | C176: 11 | D176: 3 | E176: =(RC[-1]/RC[-2])*100 -> 27.27272727272727 | F176: 0 | G176: =(RC[-1]/RC[-4])*100 -> 0 | H176: 8 | I176: =(RC[-1]/RC[-6])*100 -> 72.727272727272734 | J176: 0 | K176: =(RC[-1]/RC[-8])*100 -> 0 | L176: 0 | M176: =(RC[-1]/RC[-10])*100 -> 0
A177: Jefferson City CDP | B177: Jefferson County | C177: 59 | D177: 0 | E177: =(RC[-1]/RC[-2])*100 -> 0 | F177: 0 | G177: =(RC[-1]/RC[-4])*100 -> 0 | H177: 20 | I177: =(RC[-1]/RC[-6])*100 -> 33.898305084745758 | J177: 32 | K177: =(RC[-1]/RC[-8])*100 -> 54.237288135593218 | L177: 7 | M177: =(RC[-1]/RC[-10])*100 -> 11.864406779661017
A178: Jette CDP | B178: Lake County | C178: 115 | D178: 11 | E178: =(RC[-1]/RC[-2])*100 -> 9.5652173913043477 | F178: 18 | G178: =(RC[-1]/RC[-4])*100 -> 15.65217391304348 | H178: 49 | I178: =(RC[-1]/RC[-6])*100 -> 42.608695652173914 | J178: 27 | K178: =(RC[-1]/RC[-8])*100 -> 23.478260869565219 | L178: 10 | M178: =(RC[-1]/RC[-10])*100 -> 8.695652173913043
A179: Joliet town | B179: Carbon County | C179: 140 | D179: 6 | E179: =(RC[-1]/RC[-2])*100 -> 4.2857142857142856 | F179: 12 | G179: =(RC[-1]/RC[-4])*100 -> 8.5714285714285712 | H179: 62 | I179: =(RC[-1]/RC[-6])*100 -> 44.285714285714285 | J179: 28 | K179: =(RC[-1]/RC[-8])*100 -> 20 | L179: 32 | M179: =(RC[-1]/RC[-10])*100 -> 22.857142857142858
A180: Joplin CDP | B180: Liberty County | C180: 43 | D180: 8 | E180: =(RC[-1]/RC[-2])*100 -> 18.604651162790699 | F180: 0 | G180: =(RC[-1]/RC[-4])*100 -> 0 | H180: 17 | I180: =(RC[-1]/RC[-6])*100 -> 39.534883720930232 | J180: 14 | K180: =(RC[-1]/RC[-8])*100 -> 32.558139534883722 | L180: 4 | M180: =(RC[-1]/RC[-10])*100 -> 9.3023255813953494
A181: Jordan town | B181: Garfield County | C181: 79 | D181: 13 | E181: =(RC[-1]/RC[-2])*100 -> 16.455696202531644 | F181: 2 | G181: =(RC[-1]/RC[-4])*100 -> 2.5316455696202533 | H181: 30 | I181: =(RC[-1]/RC[-6])*100 -> 37.974683544303801 | J181: 28 | K181: =(RC[-1]/RC[-8])*100 -> 35.443037974683541 | L181: 6 | M181: =(RC[-1]/RC[-10])*100 -> 7.59493670886076
A182: Judith Gap city | B182: Wheatland County | C182: 33 | D182: 0 | E182: =(RC[-1]/RC[-2])*100 -> 0 | F182: 4 | G182: =(RC[-1]/RC[-4])*100 -> 12.121212121212121 | H182: 25 | I182: =(RC[-1]/RC[-6])*100 -> 75.757575757575751 | J182: 2 | K182: =(RC[-1]/RC[-8])*100 -> 6.0606060606060606 | L182: 2 | M182: =(RC[-1]/RC[-10])*100 -> 6.0606060606060606
A183: Kalispell city | B183: Flathead County | C183: 3066 | D183: 233 | E183: =(RC[-1]/RC[-2])*100 -> 7.5994781474233521 | F183: 186 | G183: =(RC[-1]/RC[-4])*100 -> 6.0665362035225048 | H183: 1508 | I183: =(RC[-1]/RC[-6])*100 -> 49.18460534898891 | J183: 689 | K183: =(RC[-1]/RC[-8])*100 -> 22.472276581865621 | L183: 450 | M183: =(RC[-1]/RC[-10])*100 -> 14.677103718199607
A184: Kerr CDP | B184: Lake County | C184: 0 | D184: 0 | E184: 0 | F184: 0 | G184: 0 | H184: 0 | I184: 0 | J184: 0 | K184: 0 | L184: 0 | M184: 0
A185: Kevin town | B185: Toole County | C185: 26 | D185: 0 | E185: =(RC[-1]/RC[-2])*100 -> 0 | F185: 0 | G185: =(RC[-1]/RC[-4])*100 -> 0 | H185: 17 | I185: =(RC[-1]/RC[-6])*100 -> 65.384615384615387 | J185: 6 | K185: =(RC[-1]/RC[-8])*100 -> 23.076923076923077 | L185: 3 | M185: =(RC[-1]/RC[-10])*100 -> 11.538461538461538
A186: Kicking Horse CDP | B186: Lake County | C186: 13 | D186: 0 | E186: =(RC[-1]/RC[-2])*100 -> 0 | F186: 0 | G186: =(RC[-1]/RC[-4])*100 -> 0 | H186: 13 | I186: =(RC[-1]/RC[-6])*100 -> 100 | J186: 0 | K186: =(RC[-1]/RC[-8])*100 -> 0 | L186: 0 | M186: =(RC[-1]/RC[-10])*100 -> 0
A187: Kings Point CDP | B187: Lake County | C187: 7 | D187: 0 | E187: =(RC[-1]/RC[-2])*100 -> 0 | F187: 0 | G187: =(RC[-1]/RC[-4])*100 -> 0 | H187: 7 | I187: =(RC[-1]/RC[-6])*100 -> 100 | J187: 0 | K187: =(RC[-1]/RC[-8])*100 -> 0 | L187: 0 | M187: =(RC[-1]/RC[-10])*100 -> 0
A188: Klein CDP | B188: Musselshell County | C188: 32 | D188: 0 | E188: =(RC[-1]/RC[-2])*100 -> 0 | F188: 0 | G188: =(RC[-1]/RC[-4])*100 -> 0 | H188: 18 | I188: =(RC[-1]/RC[-6])*100 -> 56.25 | J188: 14 | K188: =(RC[-1]/RC[-8])*100 -> 43.75 | L188: 0 | M188: =(RC[-1]/RC[-10])*100 -> 0
A189: Knife River CDP | B189: Richland County | C189: 98 | D189: 0 | E189: =(RC[-1]/RC[-2])*100 -> 0 | F189: 9 | G189: =(RC[-1]/RC[-4])*100 -> 9.183673469387756 | H189: 51 | I189: =(RC[-1]/RC[-6])*100 -> 52.040816326530617 | J189: 27 | K189: =(RC[-1]/RC[-8])*100 -> 27.551020408163261 | L189: 11 | M189: =(RC[-1]/RC[-10])*100 -> 11.224489795918368
A190: Kremlin CDP | B190: Hill County | C190: 54 | D190: 2 | E190: =(RC[-1]/RC[-2])*100 -> 3.7037037037037033 | F190: 6 | G190: =(RC[-1]/RC[-4])*100 -> 11.111111111111111 | H190: 33 | I190: =(RC[-1]/RC[-6])*100 -> 61.111111111111114 | J190: 7 | K190: =(RC[-1]/RC[-8])*100 -> 12.962962962962962 | L190: 6 | M190: =(RC[-1]/RC[-10])*100 -> 11.111111111111111
A191: Lakeside CDP | B191: Flathead County | C191: 365 | D191: 25 | E191: =(RC[-1]/RC[-2])*100 -> 6.8493150684931505 | F191: 15 | G191: =(RC[-1]/RC[-4])*100 -> 4.10958904109589 | H191: 183 | I191: =(RC[-1]/RC[-6])*100 -> 50.136986301369866 | J191: 94 | K191: =(RC[-1]/RC[-8])*100 -> 25.753424657534246 | L191: 48 | M191: =(RC[-1]/RC[-10])*100 -> 13.150684931506849
A192: Lame Deer CDP | B192: Rosebud County | C192: 806 | D192: 53 | E192: =(RC[-1]/RC[-2])*100 -> 6.5756823821339943 | F192: 37 | G192: =(RC[-1]/RC[-4])*100 -> 4.5905707196029777 | H192: 435 | I192: =(RC[-1]/RC[-6])*100 -> 53.970223325062037 | J192: 198 | K192: =(RC[-1]/RC[-8])*100 -> 24.565756823821339 | L192: 83 | M192: =(RC[-1]/RC[-10])*100 -> 10.297766749379653
A193: Laurel city | B193: Yellowstone County | C193: 1552 | D193: 115 | E193: =(RC[-1]/RC[-2])*100 -> 7.40979381443299 | F193: 86 | G193: =(RC[-1]/RC[-4])*100 -> 5.5412371134020617 | H193: 702 | I193: =(RC[-1]/RC[-6])*100 -> 45.231958762886599 | J193: 428 | K193: =(RC[-1]/RC[-8])*100 -> 27.577319587628867 | L193: 221 | M193: =(RC[-1]/RC[-10])*100 -> 14.239690721649485
A194: Lavina town | B194: Golden Valley County | C194: 83 | D194: 2 | E194: =(RC[-1]/RC[-2])*100 -> 2.4096385542168677 | F194: 2 | G194: =(RC[-1]/RC[-4])*100 -> 2.4096385542168677 | H194: 53 | I194: =(RC[-1]/RC[-6])*100 -> 63.855421686746979 | J194: 20 | K194: =(RC[-1]/RC[-8])*100 -> 24.096385542168676 | L194: 6 | M194: =(RC[-1]/RC[-10])*100 -> 7.2289156626506017
A195: Lewistown city | B195: Fergus County | C195: 1180 | D195: 113 | E195: =(RC[-1]/RC[-2])*100 -> 9.5762711864406782 | F195: 64 | G195: =(RC[-1]/RC[-4])*100 -> 5.4237288135593218 | H195: 574 | I195: =(RC[-1]/RC[-6])*100 -> 48.644067796610166 | J195: 347 | K195: =(RC[-1]/RC[-8])*100 -> 29.406779661016952 | L195: 82 | M195: =(RC[-1]/RC[-10])*100 -> 6.9491525423728815
A196: Lewistown Heights CDP | B196: Fergus County | C196: 147 | D196: 6 | E196: =(RC[-1]/RC[-2])*100 -> 4.0816326530612246 | F196: 7 | G196: =(RC[-1]/RC[-4])*100 -> 4.7619047619047619 | H196: 99 | I196: =(RC[-1]/RC[-6])*100 -> 67.346938775510196 | J196: 33 | K196: =(RC[-1]/RC[-8])*100 -> 22.448979591836736 | L196: 2 | M196: =(RC[-1]/RC[-10])*100 -> 1.3605442176870748
A197: CENSUS 2000: MONTANA
A198: SCHOOL ENROLLMENT
D200: ---------------------------------------------Population 3 years and over enrolled in school--------------------------------------
C201: Population 3
C202: years and over | D202: Nursery School | H202: Elementary School | J202: High School | L202: College or
C203: enrolled in | D203: Preschool | F203: Kindergarten | H203: Grades 1-8 | J203: Grades 9-12 | L203: Graduate School
A204: CITIES/TOWNS/CDP* | B204: COUNTY | C204: school | D204: Number | E204: Percent | F204: Number | G204: Percent | H204: Number | I204: Percent | J204: Number | K204: Percent | L204: Number | M204: Percent
A206: Libby city | B206: Lincoln County | C206: 654 | D206: 27 | E206: =(RC[-1]/RC[-2])*100 -> 4.1284403669724776 | F206: 6 | G206: =(RC[-1]/RC[-4])*100 -> 0.91743119266055051 | H206: 325 | I206: =(RC[-1]/RC[-6])*100 -> 49.694189602446478 | J206: 190 | K206: =(RC[-1]/RC[-8])*100 -> 29.051987767584098 | L206: 106 | M206: =(RC[-1]/RC[-10])*100 -> 16.207951070336392
A207: Lima town | B207: Beaverhead County | C207: 57 | D207: 1 | E207: =(RC[-1]/RC[-2])*100 -> 1.7543859649122806 | F207: 5 | G207: =(RC[-1]/RC[-4])*100 -> 8.7719298245614024 | H207: 31 | I207: =(RC[-1]/RC[-6])*100 -> 54.385964912280706 | J207: 18 | K207: =(RC[-1]/RC[-8])*100 -> 31.578947368421051 | L207: 2 | M207: =(RC[-1]/RC[-10])*100 -> 3.5087719298245612
A208: Lincoln CDP | B208: Lewis and Clark County | C208: 253 | D208: 7 | E208: =(RC[-1]/RC[-2])*100 -> 2.766798418972332 | F208: 11 | G208: =(RC[-1]/RC[-4])*100 -> 4.3478260869565215 | H208: 145 | I208: =(RC[-1]/RC[-6])*100 -> 57.312252964426882 | J208: 58 | K208: =(RC[-1]/RC[-8])*100 -> 22.92490118577075 | L208: 32 | M208: =(RC[-1]/RC[-10])*100 -> 12.648221343873518
A209: Livingston city | B209: Park County | C209: 1575 | D209: 165 | E209: =(RC[-1]/RC[-2])*100 -> 10.476190476190476 | F209: 93 | G209: =(RC[-1]/RC[-4])*100 -> 5.9047619047619051 | H209: 799 | I209: =(RC[-1]/RC[-6])*100 -> 50.730158730158728 | J209: 297 | K209: =(RC[-1]/RC[-8])*100 -> 18.857142857142858 | L209: 221 | M209: =(RC[-1]/RC[-10])*100 -> 14.031746031746032
A210: Lockwood CDP | B210: Yellowstone County | C210: 1163 | D210: 44 | E210: =(RC[-1]/RC[-2])*100 -> 3.7833190025795354 | F210: 103 | G210: =(RC[-1]/RC[-4])*100 -> 8.8564058469475508 | H210: 569 | I210: =(RC[-1]/RC[-6])*100 -> 48.925193465176271 | J210: 310 | K210: =(RC[-1]/RC[-8])*100 -> 26.655202063628547 | L210: 137 | M210: =(RC[-1]/RC[-10])*100 -> 11.779879621668101
A211: Lodge Grass town | B211: Big Horn County | C211: 180 | D211: 8 | E211: =(RC[-1]/RC[-2])*100 -> 4.4444444444444446 | F211: 13 | G211: =(RC[-1]/RC[-4])*100 -> 7.2222222222222214 | H211: 102 | I211: =(RC[-1]/RC[-6])*100 -> 56.666666666666664 | J211: 42 | K211: =(RC[-1]/RC[-8])*100 -> 23.333333333333332 | L211: 15 | M211: =(RC[-1]/RC[-10])*100 -> 8.3333333333333321
A212: Lodge Pole CDP | B212: Blaine County | C212: 75 | D212: 16 | E212: =(RC[-1]/RC[-2])*100 -> 21.333333333333336 | F212: 3 | G212: =(RC[-1]/RC[-4])*100 -> 4 | H212: 39 | I212: =(RC[-1]/RC[-6])*100 -> 52 | J212: 15 | K212: =(RC[-1]/RC[-8])*100 -> 20 | L212: 2 | M212: =(RC[-1]/RC[-10])*100 -> 2.666666666666667
A213: Lolo CDP | B213: Missoula County | C213: 901 | D213: 57 | E213: =(RC[-1]/RC[-2])*100 -> 6.326304106548279 | F213: 44 | G213: =(RC[-1]/RC[-4])*100 -> 4.8834628190899005 | H213: 435 | I213: =(RC[-1]/RC[-6])*100 -> 48.279689234184239 | J213: 207 | K213: =(RC[-1]/RC[-8])*100 -> 22.97447280799112 | L213: 158 | M213: =(RC[-1]/RC[-10])*100 -> 17.536071032186459
A214: Loma CDP | B214: Chouteau County | C214: 9 | D214: 0 | E214: =(RC[-1]/RC[-2])*100 -> 0 | F214: 0 | G214: =(RC[-1]/RC[-4])*100 -> 0 | H214: 2 | I214: =(RC[-1]/RC[-6])*100 -> 22.222222222222221 | J214: 3 | K214: =(RC[-1]/RC[-8])*100 -> 33.333333333333329 | L214: 4 | M214: =(RC[-1]/RC[-10])*100 -> 44.444444444444443
A215: Lonepine CDP | B215: Sanders County | C215: 19 | D215: 0 | E215: =(RC[-1]/RC[-2])*100 -> 0 | F215: 0 | G215: =(RC[-1]/RC[-4])*100 -> 0 | H215: 13 | I215: =(RC[-1]/RC[-6])*100 -> 68.421052631578945 | J215: 3 | K215: =(RC[-1]/RC[-8])*100 -> 15.789473684210526 | L215: 3 | M215: =(RC[-1]/RC[-10])*100 -> 15.789473684210526
A216: Malmstrom AFB CDP | B216: Cascade County | C216: 1406 | D216: 117 | E216: =(RC[-1]/RC[-2])*100 -> 8.3214793741109538 | F216: 104 | G216: =(RC[-1]/RC[-4])*100 -> 7.3968705547652922 | H216: 715 | I216: =(RC[-1]/RC[-6])*100 -> 50.85348506401138 | J216: 140 | K216: =(RC[-1]/RC[-8])*100 -> 9.9573257467994303 | L216: 330 | M216: =(RC[-1]/RC[-10])*100 -> 23.470839260312946
A217: Malta city | B217: Phillips County | C217: 518 | D217: 39 | E217: =(RC[-1]/RC[-2])*100 -> 7.5289575289575295 | F217: 41 | G217: =(RC[-1]/RC[-4])*100 -> 7.9150579150579148 | H217: 230 | I217: =(RC[-1]/RC[-6])*100 -> 44.401544401544399 | J217: 186 | K217: =(RC[-1]/RC[-8])*100 -> 35.907335907335906 | L217: 22 | M217: =(RC[-1]/RC[-10])*100 -> 4.2471042471042466
A218: Manhattan town | B218: Gallatin County | C218: 380 | D218: 37 | E218: =(RC[-1]/RC[-2])*100 -> 9.7368421052631575 | F218: 10 | G218: =(RC[-1]/RC[-4])*100 -> 2.6315789473684208 | H218: 199 | I218: =(RC[-1]/RC[-6])*100 -> 52.368421052631575 | J218: 97 | K218: =(RC[-1]/RC[-8])*100 -> 25.526315789473685 | L218: 37 | M218: =(RC[-1]/RC[-10])*100 -> 9.7368421052631575
A219: Martin City CDP | B219: Flathead County | C219: 72 | D219: 4 | E219: =(RC[-1]/RC[-2])*100 -> 5.5555555555555554 | F219: 0 | G219: =(RC[-1]/RC[-4])*100 -> 0 | H219: 54 | I219: =(RC[-1]/RC[-6])*100 -> 75 | J219: 14 | K219: =(RC[-1]/RC[-8])*100 -> 19.444444444444446 | L219: 0 | M219: =(RC[-1]/RC[-10])*100 -> 0
A220: Medicine Lake town | B220: Sheridan County | C220: 50 | D220: 3 | E220: =(RC[-1]/RC[-2])*100 -> 6 | F220: 0 | G220: =(RC[-1]/RC[-4])*100 -> 0 | H220: 32 | I220: =(RC[-1]/RC[-6])*100 -> 64 | J220: 13 | K220: =(RC[-1]/RC[-8])*100 -> 26 | L220: 2 | M220: =(RC[-1]/RC[-10])*100 -> 4
A221: Melstone town | B221: Musselshell County | C221: 26 | D221: 0 | E221: =(RC[-1]/RC[-2])*100 -> 0 | F221: 0 | G221: =(RC[-1]/RC[-4])*100 -> 0 | H221: 11 | I221: =(RC[-1]/RC[-6])*100 -> 42.307692307692307 | J221: 15 | K221: =(RC[-1]/RC[-8])*100 -> 57.692307692307686 | L221: 0 | M221: =(RC[-1]/RC[-10])*100 -> 0
A222: Miles City city | B222: Custer County | C222: 2160 | D222: 132 | E222: =(RC[-1]/RC[-2])*100 -> 6.1111111111111107 | F222: 123 | G222: =(RC[-1]/RC[-4])*100 -> 5.6944444444444446 | H222: 954 | I222: =(RC[-1]/RC[-6])*100 -> 44.166666666666664 | J222: 520 | K222: =(RC[-1]/RC[-8])*100 -> 24.074074074074073 | L222: 431 | M222: =(RC[-1]/RC[-10])*100 -> 19.953703703703702
A223: Missoula city | B223: Missoula County | C223: 19468 | D223: 774 | E223: =(RC[-1]/RC[-2])*100 -> 3.9757550852681325 | F223: 528 | G223: =(RC[-1]/RC[-4])*100 -> 2.7121430039038423 | H223: 5283 | I223: =(RC[-1]/RC[-6])*100 -> 27.136839942469692 | J223: 2627 | K223: =(RC[-1]/RC[-8])*100 -> 13.493938771317032 | L223: 10256 | M223: =(RC[-1]/RC[-10])*100 -> 52.681323197041294
A224: Montana City CDP | B224: Jefferson County | C224: 643 | D224: 34 | E224: =(RC[-1]/RC[-2])*100 -> 5.2877138413685847 | F224: 24 | G224: =(RC[-1]/RC[-4])*100 -> 3.7325038880248838 | H224: 379 | I224: =(RC[-1]/RC[-6])*100 -> 58.942457231726287 | J224: 145 | K224: =(RC[-1]/RC[-8])*100 -> 22.55054432348367 | L224: 61 | M224: =(RC[-1]/RC[-10])*100 -> 9.4867807153965789
A225: Moore town | B225: Fergus County | C225: 47 | D225: 0 | E225: =(RC[-1]/RC[-2])*100 -> 0 | F225: 3 | G225: =(RC[-1]/RC[-4])*100 -> 6.3829787234042552 | H225: 31 | I225: =(RC[-1]/RC[-6])*100 -> 65.957446808510639 | J225: 9 | K225: =(RC[-1]/RC[-8])*100 -> 19.148936170212767 | L225: 4 | M225: =(RC[-1]/RC[-10])*100 -> 8.5106382978723403
A226: Muddy CDP | B226: Big Horn County | C226: 255 | D226: 15 | E226: =(RC[-1]/RC[-2])*100 -> 5.8823529411764701 | F226: 4 | G226: =(RC[-1]/RC[-4])*100 -> 1.5686274509803921 | H226: 144 | I226: =(RC[-1]/RC[-6])*100 -> 56.470588235294116 | J226: 59 | K226: =(RC[-1]/RC[-8])*100 -> 23.137254901960784 | L226: 33 | M226: =(RC[-1]/RC[-10])*100 -> 12.941176470588237
A227: Musselshell CDP | B227: Musselshell County | C227: 16 | D227: 0 | E227: =(RC[-1]/RC[-2])*100 -> 0 | F227: 0 | G227: =(RC[-1]/RC[-4])*100 -> 0 | H227: 9 | I227: =(RC[-1]/RC[-6])*100 -> 56.25 | J227: 7 | K227: =(RC[-1]/RC[-8])*100 -> 43.75 | L227: 0 | M227: =(RC[-1]/RC[-10])*100 -> 0
A228: Nashua town | B228: Valley County | C228: 56 | D228: 0 | E228: =(RC[-1]/RC[-2])*100 -> 0 | F228: 1 | G228: =(RC[-1]/RC[-4])*100 -> 1.7857142857142856 | H228: 29 | I228: =(RC[-1]/RC[-6])*100 -> 51.785714285714292 | J228: 14 | K228: =(RC[-1]/RC[-8])*100 -> 25 | L228: 12 | M228: =(RC[-1]/RC[-10])*100 -> 21.428571428571427
A229: Neihart town | B229: Cascade County | C229: 7 | D229: 0 | E229: =(RC[-1]/RC[-2])*100 -> 0 | F229: 0 | G229: =(RC[-1]/RC[-4])*100 -> 0 | H229: 5 | I229: =(RC[-1]/RC[-6])*100 -> 71.428571428571431 | J229: 2 | K229: =(RC[-1]/RC[-8])*100 -> 28.571428571428569 | L229: 0 | M229: =(RC[-1]/RC[-10])*100 -> 0
A230: Niarada CDP | B230: Flathead, Lake & Sanders Cty | C230: 12 | D230: 5 | E230: =(RC[-1]/RC[-2])*100 -> 41.666666666666671 | F230: 0 | G230: =(RC[-1]/RC[-4])*100 -> 0 | H230: 5 | I230: =(RC[-1]/RC[-6])*100 -> 41.666666666666671 | J230: 0 | K230: =(RC[-1]/RC[-8])*100 -> 0 | L230: 2 | M230: =(RC[-1]/RC[-10])*100 -> 16.666666666666664
A231: North Browning CDP | B231: Glacier County | C231: 857 | D231: 72 | E231: =(RC[-1]/RC[-2])*100 -> 8.4014002333722289 | F231: 72 | G231: =(RC[-1]/RC[-4])*100 -> 8.4014002333722289 | H231: 412 | I231: =(RC[-1]/RC[-6])*100 -> 48.074679113185532 | J231: 209 | K231: =(RC[-1]/RC[-8])*100 -> 24.387397899649944 | L231: 92 | M231: =(RC[-1]/RC[-10])*100 -> 10.73512252042007
A232: Noxon CDP | B232: Sanders County | C232: 55 | D232: 0 | E232: =(RC[-1]/RC[-2])*100 -> 0 | F232: 3 | G232: =(RC[-1]/RC[-4])*100 -> 5.4545454545454541 | H232: 32 | I232: =(RC[-1]/RC[-6])*100 -> 58.18181818181818 | J232: 20 | K232: =(RC[-1]/RC[-8])*100 -> 36.363636363636367 | L232: 0 | M232: =(RC[-1]/RC[-10])*100 -> 0
A233: Old Agency CDP | B233: Sanders County | C233: 46 | D233: 2 | E233: =(RC[-1]/RC[-2])*100 -> 4.3478260869565215 | F233: 1 | G233: =(RC[-1]/RC[-4])*100 -> 2.1739130434782608 | H233: 27 | I233: =(RC[-1]/RC[-6])*100 -> 58.695652173913047 | J233: 7 | K233: =(RC[-1]/RC[-8])*100 -> 15.217391304347828 | L233: 9 | M233: =(RC[-1]/RC[-10])*100 -> 19.565217391304348
A234: Opheim town | B234: Valley County | C234: 6 | D234: 0 | E234: =(RC[-1]/RC[-2])*100 -> 0 | F234: 0 | G234: =(RC[-1]/RC[-4])*100 -> 0 | H234: 6 | I234: =(RC[-1]/RC[-6])*100 -> 100 | J234: 0 | K234: =(RC[-1]/RC[-8])*100 -> 0 | L234: 0 | M234: =(RC[-1]/RC[-10])*100 -> 0
A235: Orchard Homes CDP | B235: Missoula County | C235: 1455 | D235: 87 | E235: =(RC[-1]/RC[-2])*100 -> 5.9793814432989691 | F235: 104 | G235: =(RC[-1]/RC[-4])*100 -> 7.1477663230240545 | H235: 548 | I235: =(RC[-1]/RC[-6])*100 -> 37.663230240549829 | J235: 389 | K235: =(RC[-1]/RC[-8])*100 -> 26.735395189003437 | L235: 327 | M235: =(RC[-1]/RC[-10])*100 -> 22.474226804123713
A236: Outlook town | B236: Sheridan County | C236: 15 | D236: 3 | E236: =(RC[-1]/RC[-2])*100 -> 20 | F236: 3 | G236: =(RC[-1]/RC[-4])*100 -> 20 | H236: 4 | I236: =(RC[-1]/RC[-6])*100 -> 26.666666666666668 | J236: 5 | K236: =(RC[-1]/RC[-8])*100 -> 33.333333333333329 | L236: 0 | M236: =(RC[-1]/RC[-10])*100 -> 0
A237: Ovando CDP | B237: Powell County | C237: 10 | D237: 0 | E237: =(RC[-1]/RC[-2])*100 -> 0 | F237: 0 | G237: =(RC[-1]/RC[-4])*100 -> 0 | H237: 10 | I237: =(RC[-1]/RC[-6])*100 -> 100 | J237: 0 | K237: =(RC[-1]/RC[-8])*100 -> 0 | L237: 0 | M237: =(RC[-1]/RC[-10])*100 -> 0
A238: Pablo CDP | B238: Lake County | C238: 766 | D238: 118 | E238: =(RC[-1]/RC[-2])*100 -> 15.404699738903393 | F238: 28 | G238: =(RC[-1]/RC[-4])*100 -> 3.6553524804177546 | H238: 370 | I238: =(RC[-1]/RC[-6])*100 -> 48.302872062663191 | J238: 105 | K238: =(RC[-1]/RC[-8])*100 -> 13.707571801566578 | L238: 145 | M238: =(RC[-1]/RC[-10])*100 -> 18.929503916449086
A239: Paradise CDP | B239: Sanders County | C239: 38 | D239: 2 | E239: =(RC[-1]/RC[-2])*100 -> 5.2631578947368416 | F239: 0 | G239: =(RC[-1]/RC[-4])*100 -> 0 | H239: 20 | I239: =(RC[-1]/RC[-6])*100 -> 52.631578947368418 | J239: 12 | K239: =(RC[-1]/RC[-8])*100 -> 31.578947368421051 | L239: 4 | M239: =(RC[-1]/RC[-10])*100 -> 10.526315789473683
A240: Park City CDP | B240: Stillwater County | C240: 241 | D240: 20 | E240: =(RC[-1]/RC[-2])*100 -> 8.2987551867219906 | F240: 17 | G240: =(RC[-1]/RC[-4])*100 -> 7.0539419087136928 | H240: 114 | I240: =(RC[-1]/RC[-6])*100 -> 47.302904564315348 | J240: 61 | K240: =(RC[-1]/RC[-8])*100 -> 25.311203319502074 | L240: 29 | M240: =(RC[-1]/RC[-10])*100 -> 12.033195020746888
A241: Parker School CDP | B241: Chouteau & Hill Counties | C241: 177 | D241: 13 | E241: =(RC[-1]/RC[-2])*100 -> 7.3446327683615822 | F241: 8 | G241: =(RC[-1]/RC[-4])*100 -> 4.5197740112994351 | H241: 100 | I241: =(RC[-1]/RC[-6])*100 -> 56.497175141242941 | J241: 30 | K241: =(RC[-1]/RC[-8])*100 -> 16.949152542372879 | L241: 26 | M241: =(RC[-1]/RC[-10])*100 -> 14.689265536723164
A242: Philipsburg town | B242: Granite County | C242: 187 | D242: 8 | E242: =(RC[-1]/RC[-2])*100 -> 4.2780748663101598 | F242: 16 | G242: =(RC[-1]/RC[-4])*100 -> 8.5561497326203195 | H242: 99 | I242: =(RC[-1]/RC[-6])*100 -> 52.941176470588239 | J242: 53 | K242: =(RC[-1]/RC[-8])*100 -> 28.342245989304814 | L242: 11 | M242: =(RC[-1]/RC[-10])*100 -> 5.8823529411764701
A243: Pinesdale town | B243: Ravalli County | C243: 350 | D243: 10 | E243: =(RC[-1]/RC[-2])*100 -> 2.8571428571428572 | F243: 28 | G243: =(RC[-1]/RC[-4])*100 -> 8 | H243: 195 | I243: =(RC[-1]/RC[-6])*100 -> 55.714285714285715 | J243: 109 | K243: =(RC[-1]/RC[-8])*100 -> 31.142857142857146 | L243: 8 | M243: =(RC[-1]/RC[-10])*100 -> 2.2857142857142856
A244: Plains town | B244: Sanders County | C244: 297 | D244: 9 | E244: =(RC[-1]/RC[-2])*100 -> 3.0303030303030303 | F244: 14 | G244: =(RC[-1]/RC[-4])*100 -> 4.7138047138047137 | H244: 171 | I244: =(RC[-1]/RC[-6])*100 -> 57.575757575757578 | J244: 79 | K244: =(RC[-1]/RC[-8])*100 -> 26.599326599326602 | L244: 24 | M244: =(RC[-1]/RC[-10])*100 -> 8.0808080808080813
A245: Plentywood city | B245: Sheridan County | C245: 442 | D245: 9 | E245: =(RC[-1]/RC[-2])*100 -> 2.0361990950226243 | F245: 32 | G245: =(RC[-1]/RC[-4])*100 -> 7.2398190045248878 | H245: 215 | I245: =(RC[-1]/RC[-6])*100 -> 48.642533936651581 | J245: 153 | K245: =(RC[-1]/RC[-8])*100 -> 34.615384615384613 | L245: 33 | M245: =(RC[-1]/RC[-10])*100 -> 7.4660633484162897
A246: CENSUS 2000: MONTANA
A247: SCHOOL ENROLLMENT
D249: ---------------------------------------------Population 3 years and over enrolled in school--------------------------------------
C250: Population 3
C251: years and over | D251: Nursery School | H251: Elementary School | J251: High School | L251: College or
C252: enrolled in | D252: Preschool | F252: Kindergarten | H252: Grades 1-8 | J252: Grades 9-12 | L252: Graduate School
A253: CITIES/TOWNS/CDP* | B253: COUNTY | C253: school | D253: Number | E253: Percent | F253: Number | G253: Percent | H253: Number | I253: Percent | J253: Number | K253: Percent | L253: Number | M253: Percent
A255: Plevna town | B255: Fallon County | C255: 28 | D255: 2 | E255: =(RC[-1]/RC[-2])*100 -> 7.1428571428571423 | F255: 0 | G255: =(RC[-1]/RC[-4])*100 -> 0 | H255: 18 | I255: =(RC[-1]/RC[-6])*100 -> 64.285714285714292 | J255: 6 | K255: =(RC[-1]/RC[-8])*100 -> 21.428571428571427 | L255: 2 | M255: =(RC[-1]/RC[-10])*100 -> 7.1428571428571423
A256: Polson city | B256: Lake County | C256: 862 | D256: 72 | E256: =(RC[-1]/RC[-2])*100 -> 8.3526682134570756 | F256: 27 | G256: =(RC[-1]/RC[-4])*100 -> 3.1322505800464038 | H256: 404 | I256: =(RC[-1]/RC[-6])*100 -> 46.867749419953597 | J256: 197 | K256: =(RC[-1]/RC[-8])*100 -> 22.8538283062645 | L256: 162 | M256: =(RC[-1]/RC[-10])*100 -> 18.793503480278424
A257: Poplar city | B257: Roosevelt County | C257: 315 | D257: 13 | E257: =(RC[-1]/RC[-2])*100 -> 4.1269841269841265 | F257: 12 | G257: =(RC[-1]/RC[-4])*100 -> 3.8095238095238098 | H257: 163 | I257: =(RC[-1]/RC[-6])*100 -> 51.746031746031754 | J257: 70 | K257: =(RC[-1]/RC[-8])*100 -> 22.222222222222221 | L257: 57 | M257: =(RC[-1]/RC[-10])*100 -> 18.095238095238095
A258: Power CDP | B258: Teton County | C258: 33 | D258: 6 | E258: =(RC[-1]/RC[-2])*100 -> 18.181818181818183 | F258: 0 | G258: =(RC[-1]/RC[-4])*100 -> 0 | H258: 10 | I258: =(RC[-1]/RC[-6])*100 -> 30.303030303030305 | J258: 13 | K258: =(RC[-1]/RC[-8])*100 -> 39.393939393939391 | L258: 4 | M258: =(RC[-1]/RC[-10])*100 -> 12.121212121212121
A259: Pryor CDP | B259: Big Horn County | C259: 230 | D259: 14 | E259: =(RC[-1]/RC[-2])*100 -> 6.0869565217391308 | F259: 12 | G259: =(RC[-1]/RC[-4])*100 -> 5.2173913043478262 | H259: 116 | I259: =(RC[-1]/RC[-6])*100 -> 50.434782608695649 | J259: 74 | K259: =(RC[-1]/RC[-8])*100 -> 32.173913043478258 | L259: 14 | M259: =(RC[-1]/RC[-10])*100 -> 6.0869565217391308
A260: Radersburg CDP | B260: Broadwater County | C260: 6 | D260: 0 | E260: =(RC[-1]/RC[-2])*100 -> 0 | F260: 0 | G260: =(RC[-1]/RC[-4])*100 -> 0 | H260: 0 | I260: =(RC[-1]/RC[-6])*100 -> 0 | J260: 6 | K260: =(RC[-1]/RC[-8])*100 -> 100 | L260: 0 | M260: =(RC[-1]/RC[-10])*100 -> 0
A261: Ravalli CDP | B261: Lake County | C261: 13 | D261: 0 | E261: =(RC[-1]/RC[-2])*100 -> 0 | F261: 0 | G261: =(RC[-1]/RC[-4])*100 -> 0 | H261: 9 | I261: =(RC[-1]/RC[-6])*100 -> 69.230769230769226 | J261: 4 | K261: =(RC[-1]/RC[-8])*100 -> 30.76923076923077 | L261: 0 | M261: =(RC[-1]/RC[-10])*100 -> 0
A262: Red Lodge city | B262: Carbon County | C262: 449 | D262: 48 | E262: =(RC[-1]/RC[-2])*100 -> 10.690423162583519 | F262: 41 | G262: =(RC[-1]/RC[-4])*100 -> 9.1314031180400885 | H262: 218 | I262: =(RC[-1]/RC[-6])*100 -> 48.552338530066812 | J262: 101 | K262: =(RC[-1]/RC[-8])*100 -> 22.494432071269486 | L262: 41 | M262: =(RC[-1]/RC[-10])*100 -> 9.1314031180400885
A263: Reed Point CDP | B263: Stillwater County | C263: 44 | D263: 4 | E263: =(RC[-1]/RC[-2])*100 -> 9.0909090909090917 | F263: 2 | G263: =(RC[-1]/RC[-4])*100 -> 4.5454545454545459 | H263: 19 | I263: =(RC[-1]/RC[-6])*100 -> 43.18181818181818 | J263: 19 | K263: =(RC[-1]/RC[-8])*100 -> 43.18181818181818 | L263: 0 | M263: =(RC[-1]/RC[-10])*100 -> 0
A264: Reserve CDP | B264: Sheridan County | C264: 5 | D264: 0 | E264: =(RC[-1]/RC[-2])*100 -> 0 | F264: 0 | G264: =(RC[-1]/RC[-4])*100 -> 0 | H264: 0 | I264: =(RC[-1]/RC[-6])*100 -> 0 | J264: 5 | K264: =(RC[-1]/RC[-8])*100 -> 100 | L264: 0 | M264: =(RC[-1]/RC[-10])*100 -> 0
A265: Rexford town | B265: Lincoln County | C265: 29 | D265: 3 | E265: =(RC[-1]/RC[-2])*100 -> 10.344827586206897 | F265: 3 | G265: =(RC[-1]/RC[-4])*100 -> 10.344827586206897 | H265: 5 | I265: =(RC[-1]/RC[-6])*100 -> 17.241379310344829 | J265: 16 | K265: =(RC[-1]/RC[-8])*100 -> 55.172413793103445 | L265: 2 | M265: =(RC[-1]/RC[-10])*100 -> 6.8965517241379306
A266: Richey town | B266: Dawson County | C266: 22 | D266: 0 | E266: =(RC[-1]/RC[-2])*100 -> 0 | F266: 0 | G266: =(RC[-1]/RC[-4])*100 -> 0 | H266: 2 | I266: =(RC[-1]/RC[-6])*100 -> 9.0909090909090917 | J266: 11 | K266: =(RC[-1]/RC[-8])*100 -> 50 | L266: 9 | M266: =(RC[-1]/RC[-10])*100 -> 40.909090909090914
A267: Riverbend CDP | B267: Mineral County | C267: 66 | D267: 3 | E267: =(RC[-1]/RC[-2])*100 -> 4.5454545454545459 | F267: 4 | G267: =(RC[-1]/RC[-4])*100 -> 6.0606060606060606 | H267: 29 | I267: =(RC[-1]/RC[-6])*100 -> 43.939393939393938 | J267: 22 | K267: =(RC[-1]/RC[-8])*100 -> 33.333333333333329 | L267: 8 | M267: =(RC[-1]/RC[-10])*100 -> 12.121212121212121
A268: Rocky Point CDP | B268: Lake County | C268: 39 | D268: 0 | E268: =(RC[-1]/RC[-2])*100 -> 0 | F268: 0 | G268: =(RC[-1]/RC[-4])*100 -> 0 | H268: 12 | I268: =(RC[-1]/RC[-6])*100 -> 30.76923076923077 | J268: 19 | K268: =(RC[-1]/RC[-8])*100 -> 48.717948717948715 | L268: 8 | M268: =(RC[-1]/RC[-10])*100 -> 20.512820512820511
A269: Rollins CDP | B269: Lake County | C269: 21 | D269: 0 | E269: =(RC[-1]/RC[-2])*100 -> 0 | F269: 4 | G269: =(RC[-1]/RC[-4])*100 -> 19.047619047619047 | H269: 8 | I269: =(RC[-1]/RC[-6])*100 -> 38.095238095238095 | J269: 5 | K269: =(RC[-1]/RC[-8])*100 -> 23.809523809523807 | L269: 4 | M269: =(RC[-1]/RC[-10])*100 -> 19.047619047619047
A270: Ronan city | B270: Lake County | C270: 467 | D270: 38 | E270: =(RC[-1]/RC[-2])*100 -> 8.1370449678800867 | F270: 26 | G270: =(RC[-1]/RC[-4])*100 -> 5.5674518201284791 | H270: 205 | I270: =(RC[-1]/RC[-6])*100 -> 43.897216274089935 | J270: 146 | K270: =(RC[-1]/RC[-8])*100 -> 31.263383297644538 | L270: 52 | M270: =(RC[-1]/RC[-10])*100 -> 11.134903640256958
A271: Roundup city | B271: Musselshell County | C271: 407 | D271: 16 | E271: =(RC[-1]/RC[-2])*100 -> 3.9312039312039313 | F271: 19 | G271: =(RC[-1]/RC[-4])*100 -> 4.6683046683046676 | H271: 213 | I271: =(RC[-1]/RC[-6])*100 -> 52.334152334152343 | J271: 124 | K271: =(RC[-1]/RC[-8])*100 -> 30.466830466830469 | L271: 35 | M271: =(RC[-1]/RC[-10])*100 -> 8.5995085995085994
A272: Rudyard CDP | B272: Hill County | C272: 51 | D272: 0 | E272: =(RC[-1]/RC[-2])*100 -> 0 | F272: 0 | G272: =(RC[-1]/RC[-4])*100 -> 0 | H272: 30 | I272: =(RC[-1]/RC[-6])*100 -> 58.82352941176471 | J272: 17 | K272: =(RC[-1]/RC[-8])*100 -> 33.333333333333329 | L272: 4 | M272: =(RC[-1]/RC[-10])*100 -> 7.8431372549019605
A273: Ryegate town | B273: Golden Valley County | C273: 62 | D273: 0 | E273: =(RC[-1]/RC[-2])*100 -> 0 | F273: 3 | G273: =(RC[-1]/RC[-4])*100 -> 4.838709677419355 | H273: 35 | I273: =(RC[-1]/RC[-6])*100 -> 56.451612903225815 | J273: 20 | K273: =(RC[-1]/RC[-8])*100 -> 32.258064516129032 | L273: 4 | M273: =(RC[-1]/RC[-10])*100 -> 6.4516129032258061
A274: Saco town | B274: Phillips County | C274: 54 | D274: 0 | E274: =(RC[-1]/RC[-2])*100 -> 0 | F274: 4 | G274: =(RC[-1]/RC[-4])*100 -> 7.4074074074074066 | H274: 39 | I274: =(RC[-1]/RC[-6])*100 -> 72.222222222222214 | J274: 11 | K274: =(RC[-1]/RC[-8])*100 -> 20.37037037037037 | L274: 0 | M274: =(RC[-1]/RC[-10])*100 -> 0
A275: Saddle Butte CDP | B275: Hill County | C275: 12 | D275: 0 | E275: =(RC[-1]/RC[-2])*100 -> 0 | F275: 0 | G275: =(RC[-1]/RC[-4])*100 -> 0 | H275: 0 | I275: =(RC[-1]/RC[-6])*100 -> 0 | J275: 6 | K275: =(RC[-1]/RC[-8])*100 -> 50 | L275: 6 | M275: =(RC[-1]/RC[-10])*100 -> 50
A276: St. Ignatius town | B276: Lake County | C276: 228 | D276: 24 | E276: =(RC[-1]/RC[-2])*100 -> 10.526315789473683 | F276: 3 | G276: =(RC[-1]/RC[-4])*100 -> 1.3157894736842104 | H276: 105 | I276: =(RC[-1]/RC[-6])*100 -> 46.05263157894737 | J276: 55 | K276: =(RC[-1]/RC[-8])*100 -> 24.12280701754386 | L276: 41 | M276: =(RC[-1]/RC[-10])*100 -> 17.982456140350877
A277: St. Marie CDP | B277: Valley County | C277: 32 | D277: 0 | E277: =(RC[-1]/RC[-2])*100 -> 0 | F277: 0 | G277: =(RC[-1]/RC[-4])*100 -> 0 | H277: 11 | I277: =(RC[-1]/RC[-6])*100 -> 34.375 | J277: 21 | K277: =(RC[-1]/RC[-8])*100 -> 65.625 | L277: 0 | M277: =(RC[-1]/RC[-10])*100 -> 0
A278: St. Pierre CDP | B278: Hill County | C278: 128 | D278: 15 | E278: =(RC[-1]/RC[-2])*100 -> 11.71875 | F278: 3 | G278: =(RC[-1]/RC[-4])*100 -> 2.34375 | H278: 59 | I278: =(RC[-1]/RC[-6])*100 -> 46.09375 | J278: 24 | K278: =(RC[-1]/RC[-8])*100 -> 18.75 | L278: 27 | M278: =(RC[-1]/RC[-10])*100 -> 21.09375
A279: St. Regis CDP | B279: Mineral County | C279: 60 | D279: 0 | E279: =(RC[-1]/RC[-2])*100 -> 0 | F279: 0 | G279: =(RC[-1]/RC[-4])*100 -> 0 | H279: 37 | I279: =(RC[-1]/RC[-6])*100 -> 61.666666666666671 | J279: 23 | K279: =(RC[-1]/RC[-8])*100 -> 38.333333333333336 | L279: 0 | M279: =(RC[-1]/RC[-10])*100 -> 0
A280: St. Xavier CDP | B280: Big Horn County | C280: 19 | D280: 0 | E280: =(RC[-1]/RC[-2])*100 -> 0 | F280: 0 | G280: =(RC[-1]/RC[-4])*100 -> 0 | H280: 19 | I280: =(RC[-1]/RC[-6])*100 -> 100 | J280: 0 | K280: =(RC[-1]/RC[-8])*100 -> 0 | L280: 0 | M280: =(RC[-1]/RC[-10])*100 -> 0
A281: Sangrey CDP | B281: Hill County | C281: 110 | D281: 17 | E281: =(RC[-1]/RC[-2])*100 -> 15.454545454545453 | F281: 0 | G281: =(RC[-1]/RC[-4])*100 -> 0 | H281: 68 | I281: =(RC[-1]/RC[-6])*100 -> 61.818181818181813 | J281: 16 | K281: =(RC[-1]/RC[-8])*100 -> 14.545454545454545 | L281: 9 | M281: =(RC[-1]/RC[-10])*100 -> 8.1818181818181817
A282: Scobey city | B282: Daniels County | C282: 215 | D282: 10 | E282: =(RC[-1]/RC[-2])*100 -> 4.6511627906976747 | F282: 9 | G282: =(RC[-1]/RC[-4])*100 -> 4.1860465116279073 | H282: 96 | I282: =(RC[-1]/RC[-6])*100 -> 44.651162790697676 | J282: 79 | K282: =(RC[-1]/RC[-8])*100 -> 36.744186046511629 | L282: 21 | M282: =(RC[-1]/RC[-10])*100 -> 9.7674418604651159
A283: Seeley Lake CDP | B283: Missoula County | C283: 332 | D283: 14 | E283: =(RC[-1]/RC[-2])*100 -> 4.2168674698795181 | F283: 18 | G283: =(RC[-1]/RC[-4])*100 -> 5.4216867469879517 | H283: 206 | I283: =(RC[-1]/RC[-6])*100 -> 62.048192771084345 | J283: 76 | K283: =(RC[-1]/RC[-8])*100 -> 22.891566265060241 | L283: 18 | M283: =(RC[-1]/RC[-10])*100 -> 5.4216867469879517
A284: Shelby city | B284: Toole County | C284: 806 | D284: 35 | E284: =(RC[-1]/RC[-2])*100 -> 4.3424317617866004 | F284: 51 | G284: =(RC[-1]/RC[-4])*100 -> 6.3275434243176178 | H284: 375 | I284: =(RC[-1]/RC[-6])*100 -> 46.526054590570723 | J284: 261 | K284: =(RC[-1]/RC[-8])*100 -> 32.382133995037222 | L284: 84 | M284: =(RC[-1]/RC[-10])*100 -> 10.421836228287841
A285: Shepherd CDP | B285: Yellowstone County | C285: 38 | D285: 5 | E285: =(RC[-1]/RC[-2])*100 -> 13.157894736842104 | F285: 1 | G285: =(RC[-1]/RC[-4])*100 -> 2.6315789473684208 | H285: 23 | I285: =(RC[-1]/RC[-6])*100 -> 60.526315789473685 | J285: 9 | K285: =(RC[-1]/RC[-8])*100 -> 23.684210526315788 | L285: 0 | M285: =(RC[-1]/RC[-10])*100 -> 0
A286: Sheridan town | B286: Madison County | C286: 121 | D286: 12 | E286: =(RC[-1]/RC[-2])*100 -> 9.9173553719008272 | F286: 3 | G286: =(RC[-1]/RC[-4])*100 -> 2.4793388429752068 | H286: 71 | I286: =(RC[-1]/RC[-6])*100 -> 58.677685950413228 | J286: 28 | K286: =(RC[-1]/RC[-8])*100 -> 23.140495867768596 | L286: 7 | M286: =(RC[-1]/RC[-10])*100 -> 5.785123966942149
A287: Sidney city | B287: Richland County | C287: 1130 | D287: 61 | E287: =(RC[-1]/RC[-2])*100 -> 5.3982300884955752 | F287: 70 | G287: =(RC[-1]/RC[-4])*100 -> 6.1946902654867255 | H287: 615 | I287: =(RC[-1]/RC[-6])*100 -> 54.424778761061944 | J287: 317 | K287: =(RC[-1]/RC[-8])*100 -> 28.053097345132745 | L287: 67 | M287: =(RC[-1]/RC[-10])*100 -> 5.9292035398230087
A288: Simms CDP | B288: Cascade County | C288: 86 | D288: 1 | E288: =(RC[-1]/RC[-2])*100 -> 1.1627906976744187 | F288: 3 | G288: =(RC[-1]/RC[-4])*100 -> 3.4883720930232558 | H288: 42 | I288: =(RC[-1]/RC[-6])*100 -> 48.837209302325576 | J288: 36 | K288: =(RC[-1]/RC[-8])*100 -> 41.860465116279073 | L288: 4 | M288: =(RC[-1]/RC[-10])*100 -> 4.6511627906976747
A289: Somers CDP | B289: Flathead County | C289: 65 | D289: 0 | E289: =(RC[-1]/RC[-2])*100 -> 0 | F289: 0 | G289: =(RC[-1]/RC[-4])*100 -> 0 | H289: 42 | I289: =(RC[-1]/RC[-6])*100 -> 64.615384615384613 | J289: 23 | K289: =(RC[-1]/RC[-8])*100 -> 35.384615384615387 | L289: 0 | M289: =(RC[-1]/RC[-10])*100 -> 0
A290: South Browning CDP | B290: Glacier County | C290: 685 | D290: 73 | E290: =(RC[-1]/RC[-2])*100 -> 10.656934306569344 | F290: 37 | G290: =(RC[-1]/RC[-4])*100 -> 5.4014598540145986 | H290: 362 | I290: =(RC[-1]/RC[-6])*100 -> 52.846715328467155 | J290: 122 | K290: =(RC[-1]/RC[-8])*100 -> 17.810218978102192 | L290: 91 | M290: =(RC[-1]/RC[-10])*100 -> 13.284671532846716
A291: Stanford town | B291: Judith Basin County | C291: 72 | D291: 2 | E291: =(RC[-1]/RC[-2])*100 -> 2.7777777777777777 | F291: 6 | G291: =(RC[-1]/RC[-4])*100 -> 8.3333333333333321 | H291: 37 | I291: =(RC[-1]/RC[-6])*100 -> 51.388888888888886 | J291: 19 | K291: =(RC[-1]/RC[-8])*100 -> 26.388888888888889 | L291: 8 | M291: =(RC[-1]/RC[-10])*100 -> 11.111111111111111
A292: Starr School CDP | B292: Glacier County | C292: 93 | D292: 0 | E292: =(RC[-1]/RC[-2])*100 -> 0 | F292: 5 | G292: =(RC[-1]/RC[-4])*100 -> 5.376344086021505 | H292: 64 | I292: =(RC[-1]/RC[-6])*100 -> 68.817204301075279 | J292: 24 | K292: =(RC[-1]/RC[-8])*100 -> 25.806451612903224 | L292: 0 | M292: =(RC[-1]/RC[-10])*100 -> 0
A293: Stevensville town | B293: Ravalli County | C293: 375 | D293: 21 | E293: =(RC[-1]/RC[-2])*100 -> 5.6000000000000005 | F293: 23 | G293: =(RC[-1]/RC[-4])*100 -> 6.1333333333333329 | H293: 176 | I293: =(RC[-1]/RC[-6])*100 -> 46.93333333333333 | J293: 105 | K293: =(RC[-1]/RC[-8])*100 -> 28.000000000000004 | L293: 50 | M293: =(RC[-1]/RC[-10])*100 -> 13.333333333333334
A294: Sunburst town | B294: Toole County | C294: 120 | D294: 1 | E294: =(RC[-1]/RC[-2])*100 -> 0.83333333333333337 | F294: 15 | G294: =(RC[-1]/RC[-4])*100 -> 12.5 | H294: 68 | I294: =(RC[-1]/RC[-6])*100 -> 56.666666666666664 | J294: 33 | K294: =(RC[-1]/RC[-8])*100 -> 27.500000000000004 | L294: 3 | M294: =(RC[-1]/RC[-10])*100 -> 2.5
A295: CENSUS 2000: MONTANA
A296: SCHOOL ENROLLMENT
D298: ---------------------------------------------Population 3 years and over enrolled in school--------------------------------------
C299: Population 3
C300: years and over | D300: Nursery School | H300: Elementary School | J300: High School | L300: College or
C301: enrolled in | D301: Preschool | F301: Kindergarten | H301: Grades 1-8 | J301: Grades 9-12 | L301: Graduate School
A302: CITIES/TOWNS/CDP* | B302: COUNTY | C302: school | D302: Number | E302: Percent | F302: Number | G302: Percent | H302: Number | I302: Percent | J302: Number | K302: Percent | L302: Number | M302: Percent
A304: Sun Prairie CDP | B304: Cascade County | C304: 548 | D304: 44 | E304: =(RC[-1]/RC[-2])*100 -> 8.0291970802919703 | F304: 15 | G304: =(RC[-1]/RC[-4])*100 -> 2.7372262773722631 | H304: 279 | I304: =(RC[-1]/RC[-6])*100 -> 50.912408759124084 | J304: 147 | K304: =(RC[-1]/RC[-8])*100 -> 26.824817518248175 | L304: 63 | M304: =(RC[-1]/RC[-10])*100 -> 11.496350364963504
A305: Sun River CDP | B305: Cascade County | C305: 26 | D305: 0 | E305: =(RC[-1]/RC[-2])*100 -> 0 | F305: 3 | G305: =(RC[-1]/RC[-4])*100 -> 11.538461538461538 | H305: 13 | I305: =(RC[-1]/RC[-6])*100 -> 50 | J305: 10 | K305: =(RC[-1]/RC[-8])*100 -> 38.461538461538467 | L305: 0 | M305: =(RC[-1]/RC[-10])*100 -> 0
A306: Superior town | B306: Mineral County | C306: 239 | D306: 9 | E306: =(RC[-1]/RC[-2])*100 -> 3.7656903765690379 | F306: 12 | G306: =(RC[-1]/RC[-4])*100 -> 5.02092050209205 | H306: 125 | I306: =(RC[-1]/RC[-6])*100 -> 52.30125523012552 | J306: 73 | K306: =(RC[-1]/RC[-8])*100 -> 30.543933054393307 | L306: 20 | M306: =(RC[-1]/RC[-10])*100 -> 8.3682008368200833
A307: Terry town | B307: Prairie County | C307: 104 | D307: 3 | E307: =(RC[-1]/RC[-2])*100 -> 2.8846153846153846 | F307: 9 | G307: =(RC[-1]/RC[-4])*100 -> 8.6538461538461533 | H307: 42 | I307: =(RC[-1]/RC[-6])*100 -> 40.384615384615387 | J307: 42 | K307: =(RC[-1]/RC[-8])*100 -> 40.384615384615387 | L307: 8 | M307: =(RC[-1]/RC[-10])*100 -> 7.6923076923076925
A308: Thompson Falls city | B308: Sanders County | C308: 322 | D308: 16 | E308: =(RC[-1]/RC[-2])*100 -> 4.9689440993788816 | F308: 7 | G308: =(RC[-1]/RC[-4])*100 -> 2.1739130434782608 | H308: 172 | I308: =(RC[-1]/RC[-6])*100 -> 53.41614906832298 | J308: 110 | K308: =(RC[-1]/RC[-8])*100 -> 34.161490683229815 | L308: 17 | M308: =(RC[-1]/RC[-10])*100 -> 5.2795031055900621
A309: Three Forks city | B309: Gallatin County | C309: 425 | D309: 21 | E309: =(RC[-1]/RC[-2])*100 -> 4.9411764705882346 | F309: 34 | G309: =(RC[-1]/RC[-4])*100 -> 8 | H309: 250 | I309: =(RC[-1]/RC[-6])*100 -> 58.82352941176471 | J309: 93 | K309: =(RC[-1]/RC[-8])*100 -> 21.882352941176471 | L309: 27 | M309: =(RC[-1]/RC[-10])*100 -> 6.3529411764705879
A310: Toston CDP | B310: Broadwater County | C310: 17 | D310: 5 | E310: =(RC[-1]/RC[-2])*100 -> 29.411764705882355 | F310: 3 | G310: =(RC[-1]/RC[-4])*100 -> 17.647058823529413 | H310: 9 | I310: =(RC[-1]/RC[-6])*100 -> 52.941176470588239 | J310: 0 | K310: =(RC[-1]/RC[-8])*100 -> 0 | L310: 0 | M310: =(RC[-1]/RC[-10])*100 -> 0
A311: Townsend city | B311: Broadwater County | C311: 406 | D311: 27 | E311: =(RC[-1]/RC[-2])*100 -> 6.6502463054187197 | F311: 22 | G311: =(RC[-1]/RC[-4])*100 -> 5.4187192118226601 | H311: 208 | I311: =(RC[-1]/RC[-6])*100 -> 51.231527093596064 | J311: 94 | K311: =(RC[-1]/RC[-8])*100 -> 23.152709359605911 | L311: 55 | M311: =(RC[-1]/RC[-10])*100 -> 13.546798029556651
A312: Trout Creek CDP | B312: Sanders County | C312: 39 | D312: 0 | E312: =(RC[-1]/RC[-2])*100 -> 0 | F312: 6 | G312: =(RC[-1]/RC[-4])*100 -> 15.384615384615385 | H312: 23 | I312: =(RC[-1]/RC[-6])*100 -> 58.974358974358978 | J312: 10 | K312: =(RC[-1]/RC[-8])*100 -> 25.641025641025639 | L312: 0 | M312: =(RC[-1]/RC[-10])*100 -> 0
A313: Troy city | B313: Lincoln County | C313: 301 | D313: 15 | E313: =(RC[-1]/RC[-2])*100 -> 4.9833887043189371 | F313: 8 | G313: =(RC[-1]/RC[-4])*100 -> 2.6578073089700998 | H313: 177 | I313: =(RC[-1]/RC[-6])*100 -> 58.80398671096345 | J313: 72 | K313: =(RC[-1]/RC[-8])*100 -> 23.920265780730897 | L313: 29 | M313: =(RC[-1]/RC[-10])*100 -> 9.6345514950166127
A314: Turtle Lake CDP | B314: Lake County | C314: 43 | D314: 9 | E314: =(RC[-1]/RC[-2])*100 -> 20.930232558139537 | F314: 6 | G314: =(RC[-1]/RC[-4])*100 -> 13.953488372093023 | H314: 20 | I314: =(RC[-1]/RC[-6])*100 -> 46.511627906976742 | J314: 0 | K314: =(RC[-1]/RC[-8])*100 -> 0 | L314: 8 | M314: =(RC[-1]/RC[-10])*100 -> 18.604651162790699
A315: Twin Bridges town | B315: Madison County | C315: 98 | D315: 8 | E315: =(RC[-1]/RC[-2])*100 -> 8.1632653061224492 | F315: 3 | G315: =(RC[-1]/RC[-4])*100 -> 3.0612244897959182 | H315: 50 | I315: =(RC[-1]/RC[-6])*100 -> 51.020408163265309 | J315: 28 | K315: =(RC[-1]/RC[-8])*100 -> 28.571428571428569 | L315: 9 | M315: =(RC[-1]/RC[-10])*100 -> 9.183673469387756
A316: Ulm CDP | B316: Cascade County | C316: 173 | D316: 11 | E316: =(RC[-1]/RC[-2])*100 -> 6.3583815028901727 | F316: 14 | G316: =(RC[-1]/RC[-4])*100 -> 8.0924855491329488 | H316: 84 | I316: =(RC[-1]/RC[-6])*100 -> 48.554913294797686 | J316: 55 | K316: =(RC[-1]/RC[-8])*100 -> 31.79190751445087 | L316: 9 | M316: =(RC[-1]/RC[-10])*100 -> 5.202312138728324
A317: Valier town | B317: Pondera County | C317: 134 | D317: 12 | E317: =(RC[-1]/RC[-2])*100 -> 8.9552238805970141 | F317: 5 | G317: =(RC[-1]/RC[-4])*100 -> 3.7313432835820892 | H317: 76 | I317: =(RC[-1]/RC[-6])*100 -> 56.71641791044776 | J317: 39 | K317: =(RC[-1]/RC[-8])*100 -> 29.1044776119403 | L317: 2 | M317: =(RC[-1]/RC[-10])*100 -> 1.4925373134328357
A318: Vaughn CDP | B318: Cascade County | C318: 170 | D318: 7 | E318: =(RC[-1]/RC[-2])*100 -> 4.117647058823529 | F318: 11 | G318: =(RC[-1]/RC[-4])*100 -> 6.4705882352941186 | H318: 102 | I318: =(RC[-1]/RC[-6])*100 -> 60 | J318: 40 | K318: =(RC[-1]/RC[-8])*100 -> 23.52941176470588 | L318: 10 | M318: =(RC[-1]/RC[-10])*100 -> 5.8823529411764701
A319: Victor CDP | B319: Ravalli County | C319: 136 | D319: 6 | E319: =(RC[-1]/RC[-2])*100 -> 4.4117647058823533 | F319: 0 | G319: =(RC[-1]/RC[-4])*100 -> 0 | H319: 85 | I319: =(RC[-1]/RC[-6])*100 -> 62.5 | J319: 30 | K319: =(RC[-1]/RC[-8])*100 -> 22.058823529411764 | L319: 15 | M319: =(RC[-1]/RC[-10])*100 -> 11.029411764705882
A320: Virginia City town | B320: Madison County | C320: 19 | D320: 0 | E320: =(RC[-1]/RC[-2])*100 -> 0 | F320: 0 | G320: =(RC[-1]/RC[-4])*100 -> 0 | H320: 10 | I320: =(RC[-1]/RC[-6])*100 -> 52.631578947368418 | J320: 7 | K320: =(RC[-1]/RC[-8])*100 -> 36.84210526315789 | L320: 2 | M320: =(RC[-1]/RC[-10])*100 -> 10.526315789473683
A321: Walkerville town | B321: Silver Bow County | C321: 192 | D321: 7 | E321: =(RC[-1]/RC[-2])*100 -> 3.6458333333333335 | F321: 11 | G321: =(RC[-1]/RC[-4])*100 -> 5.7291666666666661 | H321: 83 | I321: =(RC[-1]/RC[-6])*100 -> 43.229166666666671 | J321: 43 | K321: =(RC[-1]/RC[-8])*100 -> 22.395833333333336 | L321: 48 | M321: =(RC[-1]/RC[-10])*100 -> 25
A322: Westby town | B322: Sheridan County | C322: 27 | D322: 0 | E322: =(RC[-1]/RC[-2])*100 -> 0 | F322: 0 | G322: =(RC[-1]/RC[-4])*100 -> 0 | H322: 16 | I322: =(RC[-1]/RC[-6])*100 -> 59.259259259259252 | J322: 5 | K322: =(RC[-1]/RC[-8])*100 -> 18.518518518518519 | L322: 6 | M322: =(RC[-1]/RC[-10])*100 -> 22.222222222222221
A323: West Glendive CDP | B323: Dawson County | C323: 424 | D323: 12 | E323: =(RC[-1]/RC[-2])*100 -> 2.8301886792452833 | F323: 8 | G323: =(RC[-1]/RC[-4])*100 -> 1.8867924528301887 | H323: 227 | I323: =(RC[-1]/RC[-6])*100 -> 53.537735849056602 | J323: 124 | K323: =(RC[-1]/RC[-8])*100 -> 29.245283018867923 | L323: 53 | M323: =(RC[-1]/RC[-10])*100 -> 12.5
A324: West Havre CDP | B324: Hill County | C324: 73 | D324: 0 | E324: =(RC[-1]/RC[-2])*100 -> 0 | F324: 26 | G324: =(RC[-1]/RC[-4])*100 -> 35.61643835616438 | H324: 16 | I324: =(RC[-1]/RC[-6])*100 -> 21.917808219178081 | J324: 12 | K324: =(RC[-1]/RC[-8])*100 -> 16.43835616438356 | L324: 19 | M324: =(RC[-1]/RC[-10])*100 -> 26.027397260273972
A325: West Yellowstone town | B325: Gallatin County | C325: 241 | D325: 11 | E325: =(RC[-1]/RC[-2])*100 -> 4.5643153526970952 | F325: 10 | G325: =(RC[-1]/RC[-4])*100 -> 4.1493775933609953 | H325: 142 | I325: =(RC[-1]/RC[-6])*100 -> 58.921161825726145 | J325: 56 | K325: =(RC[-1]/RC[-8])*100 -> 23.236514522821576 | L325: 22 | M325: =(RC[-1]/RC[-10])*100 -> 9.1286307053941904
A326: Whitefish city | B326: Flathead County | C326: 1188 | D326: 59 | E326: =(RC[-1]/RC[-2])*100 -> 4.9663299663299663 | F326: 48 | G326: =(RC[-1]/RC[-4])*100 -> 4.0404040404040407 | H326: 582 | I326: =(RC[-1]/RC[-6])*100 -> 48.98989898989899 | J326: 307 | K326: =(RC[-1]/RC[-8])*100 -> 25.841750841750844 | L326: 192 | M326: =(RC[-1]/RC[-10])*100 -> 16.161616161616163
A327: Whitehall town | B327: Jefferson County | C327: 259 | D327: 15 | E327: =(RC[-1]/RC[-2])*100 -> 5.7915057915057915 | F327: 5 | G327: =(RC[-1]/RC[-4])*100 -> 1.9305019305019304 | H327: 152 | I327: =(RC[-1]/RC[-6])*100 -> 58.687258687258691 | J327: 64 | K327: =(RC[-1]/RC[-8])*100 -> 24.710424710424711 | L327: 23 | M327: =(RC[-1]/RC[-10])*100 -> 8.8803088803088812
A328: White Sulphur Springs city | B328: Meagher County | C328: 225 | D328: 18 | E328: =(RC[-1]/RC[-2])*100 -> 8 | F328: 6 | G328: =(RC[-1]/RC[-4])*100 -> 2.666666666666667 | H328: 124 | I328: =(RC[-1]/RC[-6])*100 -> 55.111111111111114 | J328: 71 | K328: =(RC[-1]/RC[-8])*100 -> 31.555555555555554 | L328: 6 | M328: =(RC[-1]/RC[-10])*100 -> 2.666666666666667
A329: Wibaux town | B329: Wibaux County | C329: 123 | D329: 3 | E329: =(RC[-1]/RC[-2])*100 -> 2.4390243902439024 | F329: 6 | G329: =(RC[-1]/RC[-4])*100 -> 4.8780487804878048 | H329: 66 | I329: =(RC[-1]/RC[-6])*100 -> 53.658536585365859 | J329: 40 | K329: =(RC[-1]/RC[-8])*100 -> 32.520325203252028 | L329: 8 | M329: =(RC[-1]/RC[-10])*100 -> 6.5040650406504072
A330: Willow Creek CDP | B330: Gallatin County | C330: 80 | D330: 2 | E330: =(RC[-1]/RC[-2])*100 -> 2.5 | F330: 3 | G330: =(RC[-1]/RC[-4])*100 -> 3.75 | H330: 46 | I330: =(RC[-1]/RC[-6])*100 -> 57.499999999999993 | J330: 19 | K330: =(RC[-1]/RC[-8])*100 -> 23.75 | L330: 10 | M330: =(RC[-1]/RC[-10])*100 -> 12.5
A331: Wilsall CDP | B331: Park County | C331: 46 | D331: 2 | E331: =(RC[-1]/RC[-2])*100 -> 4.3478260869565215 | F331: 6 | G331: =(RC[-1]/RC[-4])*100 -> 13.043478260869565 | H331: 30 | I331: =(RC[-1]/RC[-6])*100 -> 65.217391304347828 | J331: 6 | K331: =(RC[-1]/RC[-8])*100 -> 13.043478260869565 | L331: 2 | M331: =(RC[-1]/RC[-10])*100 -> 4.3478260869565215
A332: Winifred town | B332: Fergus County | C332: 48 | D332: 0 | E332: =(RC[-1]/RC[-2])*100 -> 0 | F332: 0 | G332: =(RC[-1]/RC[-4])*100 -> 0 | H332: 13 | I332: =(RC[-1]/RC[-6])*100 -> 27.083333333333332 | J332: 27 | K332: =(RC[-1]/RC[-8])*100 -> 56.25 | L332: 8 | M332: =(RC[-1]/RC[-10])*100 -> 16.666666666666664
A333: Winnett town | B333: Petroleum County | C333: 35 | D333: 4 | E333: =(RC[-1]/RC[-2])*100 -> 11.428571428571429 | F333: 6 | G333: =(RC[-1]/RC[-4])*100 -> 17.142857142857142 | H333: 15 | I333: =(RC[-1]/RC[-6])*100 -> 42.857142857142854 | J333: 4 | K333: =(RC[-1]/RC[-8])*100 -> 11.428571428571429 | L333: 6 | M333: =(RC[-1]/RC[-10])*100 -> 17.142857142857142
A334: Winston CDP | B334: Broadwater County | C334: 15 | D334: 0 | E334: =(RC[-1]/RC[-2])*100 -> 0 | F334: 0 | G334: =(RC[-1]/RC[-4])*100 -> 0 | H334: 9 | I334: =(RC[-1]/RC[-6])*100 -> 60 | J334: 0 | K334: =(RC[-1]/RC[-8])*100 -> 0 | L334: 6 | M334: =(RC[-1]/RC[-10])*100 -> 40
A335: Wisdom CDP | B335: Beaverhead County | C335: 14 | D335: 0 | E335: =(RC[-1]/RC[-2])*100 -> 0 | F335: 0 | G335: =(RC[-1]/RC[-4])*100 -> 0 | H335: 8 | I335: =(RC[-1]/RC[-6])*100 -> 57.142857142857139 | J335: 4 | K335: =(RC[-1]/RC[-8])*100 -> 28.571428571428569 | L335: 2 | M335: =(RC[-1]/RC[-10])*100 -> 14.285714285714285
A336: Wolf Point city | B336: Roosevelt County | C336: 903 | D336: 81 | E336: =(RC[-1]/RC[-2])*100 -> 8.9700996677740861 | F336: 37 | G336: =(RC[-1]/RC[-4])*100 -> 4.097452934662237 | H336: 379 | I336: =(RC[-1]/RC[-6])*100 -> 41.971207087486157 | J336: 248 | K336: =(RC[-1]/RC[-8])*100 -> 27.464008859357698 | L336: 158 | M336: =(RC[-1]/RC[-10])*100 -> 17.497231450719823
A337: Woods Bay CDP | B337: Lake County | C337: 195 | D337: 0 | E337: =(RC[-1]/RC[-2])*100 -> 0 | F337: 8 | G337: =(RC[-1]/RC[-4])*100 -> 4.1025641025641022 | H337: 110 | I337: =(RC[-1]/RC[-6])*100 -> 56.410256410256409 | J337: 59 | K337: =(RC[-1]/RC[-8])*100 -> 30.256410256410255 | L337: 18 | M337: =(RC[-1]/RC[-10])*100 -> 9.2307692307692317
A338: Worden CDP | B338: Yellowstone County | C338: 126 | D338: 0 | E338: =(RC[-1]/RC[-2])*100 -> 0 | F338: 0 | G338: =(RC[-1]/RC[-4])*100 -> 0 | H338: 66 | I338: =(RC[-1]/RC[-6])*100 -> 52.380952380952387 | J338: 36 | K338: =(RC[-1]/RC[-8])*100 -> 28.571428571428569 | L338: 24 | M338: =(RC[-1]/RC[-10])*100 -> 19.047619047619047
A339: Wye CDP | B339: Missoula County | C339: 121 | D339: 13 | E339: =(RC[-1]/RC[-2])*100 -> 10.743801652892563 | F339: 9 | G339: =(RC[-1]/RC[-4])*100 -> 7.4380165289256199 | H339: 68 | I339: =(RC[-1]/RC[-6])*100 -> 56.198347107438018 | J339: 9 | K339: =(RC[-1]/RC[-8])*100 -> 7.4380165289256199 | L339: 22 | M339: =(RC[-1]/RC[-10])*100 -> 18.181818181818183
A340: Wyola CDP | B340: Big Horn County | C340: 69 | D340: 5 | E340: =(RC[-1]/RC[-2])*100 -> 7.2463768115942031 | F340: 2 | G340: =(RC[-1]/RC[-4])*100 -> 2.8985507246376812 | H340: 42 | I340: =(RC[-1]/RC[-6])*100 -> 60.869565217391312 | J340: 18 | K340: =(RC[-1]/RC[-8])*100 -> 26.086956521739129 | L340: 2 | M340: =(RC[-1]/RC[-10])*100 -> 2.8985507246376812
A342: * Census designated places (CDPs) are delineated for each decennial census as the statistical counterparts of incorporated places.
A343: ** Consolidated City/County
A345: Source: U.S. Census Bureau, Census 2000 Released May 14, 2002