Sheet: Sheet2
A1: 'RSA 2002 QUARTERLY CUMULATIVE FUEL SALES IN LITERS BY MARKET CATEGORY AND PROVINCE
C4: '2002 FIRST QUARTER - JAN TO MARCH | H4: '2002 Q2 | M4: '2002 SECOND QUARTER - APRIL TO JUNE | R4: '2002 Q3 | W4: '2002 THIRD QUARTER - JULY TO SEPTEMBER | AI4: '2002 FOURTH QUARTER - OCTOBER TO DECEMBER
A5: 'Category Name | B5: 'Province | C5: 'DIESEL GAS OIL - ALL GRADES | D5: 'ILLUMINATING PARAFFIN | E5: 'LIQUID PETROLEUM GAS | F5: 'PETROL - ALL GRADES | G5: 'Q1 TOTAL | H5: 'DIESEL GAS OIL - ALL GRADES | I5: 'ILLUMINATING PARAFFIN | J5: 'LIQUID PETROLEUM GAS | K5: 'PETROL - ALL GRADES | L5: 'Q2 TOTAL | M5: 'DIESEL GAS OIL - ALL GRADES | N5: 'ILLUMINATING PARAFFIN | O5: 'LIQUID PETROLEUM GAS | P5: 'PETROL - ALL GRADES | Q5: 'Q2 CUMULATIVE TOTAL FOR ALL PRODUCTS | R5: 'DIESEL GAS OIL - ALL GRADES | S5: 'ILLUMINATING PARAFFIN | T5: 'LIQUID PETROLEUM GAS | U5: 'PETROL - ALL GRADES | V5: 'Q3 TOTAL | W5: 'DIESEL GAS OIL - ALL GRADES | X5: 'ILLUMINATING PARAFFIN | Y5: 'LIQUID PETROLEUM GAS | Z5: 'PETROL - ALL GRADES | AA5: 'Q3 CUMULATIVE TOTAL FOR ALL PRODUCTS | AI5: 'DIESEL GAS OIL - ALL GRADES | AJ5: 'ILLUMINATING PARAFFIN | AK5: 'LIQUID PETROLEUM GAS | AL5: 'PETROL - ALL GRADES
A6: 'Construction | B6: 'Eastern Cape | C6: 4834540 | D6: 52663 | E6: 0 | F6: 13004 | G6: =SUM(RC[-4]:RC[-1]) -> 4900207 | H6: 5614422 | I6: 50673 | J6: 0 | K6: 5170 | L6: =SUM(RC[-4]:RC[-1]) -> 5670265 | M6: =RC[-10]+RC[-5] -> 10448962 | N6: =RC[-10]+RC[-5] -> 103336 | O6: =RC[-10]+RC[-5] -> 0 | P6: =RC[-10]+RC[-5] -> 18174 | Q6: =RC[-10]+RC[-5] -> 10570472 | R6: 5388799 | S6: 28913 | T6: 0 | U6: 15000 | V6: =SUM(RC[-4]:RC[-1]) -> 5432712 | W6: =RC[-10]+RC[-5] -> 15837761 | X6: =RC[-10]+RC[-5] -> 132249 | Y6: =RC[-10]+RC[-5] -> 0 | Z6: =RC[-10]+RC[-5] -> 33174 | AA6: =RC[-10]+RC[-5] -> 16003184 | AB6: '01 | AC6: 'Construction | AD6: 'Eastern Cape | AE6: 7952654 | AF6: 40402 | AG6: 0 | AH6: 5217 | AI6: =RC[-4]+RC[-12] -> 23790415 | AJ6: =RC[-4]+RC[-12] -> 172651 | AK6: =RC[-4]+RC[-12] -> 0 | AL6: =RC[-4]+RC[-12] -> 38391
B7: 'Free State | C7: 2756302 | D7: 23510 | E7: 0 | F7: 26907 | G7: =SUM(RC[-4]:RC[-1]) -> 2806719 | H7: 2208627 | I7: 7680 | J7: 0 | K7: 25594 | L7: =SUM(RC[-4]:RC[-1]) -> 2241901 | M7: =RC[-10]+RC[-5] -> 4964929 | N7: =RC[-10]+RC[-5] -> 31190 | O7: =RC[-10]+RC[-5] -> 0 | P7: =RC[-10]+RC[-5] -> 52501 | Q7: =RC[-10]+RC[-5] -> 5048620 | R7: 2503376 | S7: 20075 | T7: 0 | U7: 24527 | V7: =SUM(RC[-4]:RC[-1]) -> 2547978 | W7: =RC[-10]+RC[-5] -> 7468305 | X7: =RC[-10]+RC[-5] -> 51265 | Y7: =RC[-10]+RC[-5] -> 0 | Z7: =RC[-10]+RC[-5] -> 77028 | AA7: =RC[-10]+RC[-5] -> 7596598 | AB7: 0 | AD7: 'Free State | AE7: 2192725 | AF7: 18035 | AG7: 0 | AH7: 23652 | AI7: =RC[-4]+RC[-12] -> 9661030 | AJ7: =RC[-4]+RC[-12] -> 69300 | AK7: =RC[-4]+RC[-12] -> 0 | AL7: =RC[-4]+RC[-12] -> 100680
B8: 'Gauteng | C8: 13041535 | D8: 342443 | E8: 33540 | F8: 313856 | G8: =SUM(RC[-4]:RC[-1]) -> 13731374 | H8: 14003683 | I8: 216510 | J8: 51960 | K8: 324197 | L8: =SUM(RC[-4]:RC[-1]) -> 14596350 | M8: =RC[-10]+RC[-5] -> 27045218 | N8: =RC[-10]+RC[-5] -> 558953 | O8: =RC[-10]+RC[-5] -> 85500 | P8: =RC[-10]+RC[-5] -> 638053 | Q8: =RC[-10]+RC[-5] -> 28327724 | R8: 13515252 | S8: 213686 | T8: 57134 | U8: 256085 | V8: =SUM(RC[-4]:RC[-1]) -> 14042157 | W8: =RC[-10]+RC[-5] -> 40560470 | X8: =RC[-10]+RC[-5] -> 772639 | Y8: =RC[-10]+RC[-5] -> 142634 | Z8: =RC[-10]+RC[-5] -> 894138 | AA8: =RC[-10]+RC[-5] -> 42369881 | AB8: 0 | AD8: 'Gauteng | AE8: 11150329 | AF8: 143044 | AG8: 33305 | AH8: 228486 | AI8: =RC[-4]+RC[-12] -> 51710799 | AJ8: =RC[-4]+RC[-12] -> 915683 | AK8: =RC[-4]+RC[-12] -> 175939 | AL8: =RC[-4]+RC[-12] -> 1122624
B9: 'KwaZulu Natal | C9: 6054862 | D9: 132585 | E9: 55410 | F9: 127873 | G9: =SUM(RC[-4]:RC[-1]) -> 6370730 | H9: 7275710 | I9: 165374 | J9: -31560 | K9: 36628 | L9: =SUM(RC[-4]:RC[-1]) -> 7446152 | M9: =RC[-10]+RC[-5] -> 13330572 | N9: =RC[-10]+RC[-5] -> 297959 | O9: =RC[-10]+RC[-5] -> 23850 | P9: =RC[-10]+RC[-5] -> 164501 | Q9: =RC[-10]+RC[-5] -> 13816882 | R9: 7738681 | S9: 180341 | T9: -9600 | U9: 36029 | V9: =SUM(RC[-4]:RC[-1]) -> 7945451 | W9: =RC[-10]+RC[-5] -> 21069253 | X9: =RC[-10]+RC[-5] -> 478300 | Y9: =RC[-10]+RC[-5] -> 14250 | Z9: =RC[-10]+RC[-5] -> 200530 | AA9: =RC[-10]+RC[-5] -> 21762333 | AB9: 0 | AD9: 'KwaZulu Natal | AE9: 6581999 | AF9: 269210 | AG9: 0 | AH9: 23878 | AI9: =RC[-4]+RC[-12] -> 27651252 | AJ9: =RC[-4]+RC[-12] -> 747510 | AK9: =RC[-4]+RC[-12] -> 14250 | AL9: =RC[-4]+RC[-12] -> 224408
B10: 'Mpumalanga | C10: 10261506 | D10: 2210 | E10: 0 | F10: 223645 | G10: =SUM(RC[-4]:RC[-1]) -> 10487361 | H10: 9468576 | I10: 6220 | J10: 0 | K10: 193968 | L10: =SUM(RC[-4]:RC[-1]) -> 9668764 | M10: =RC[-10]+RC[-5] -> 19730082 | N10: =RC[-10]+RC[-5] -> 8430 | O10: =RC[-10]+RC[-5] -> 0 | P10: =RC[-10]+RC[-5] -> 417613 | Q10: =RC[-10]+RC[-5] -> 20156125 | R10: 8169377 | S10: 2291 | T10: 0 | U10: 166496 | V10: =SUM(RC[-4]:RC[-1]) -> 8338164 | W10: =RC[-10]+RC[-5] -> 27899459 | X10: =RC[-10]+RC[-5] -> 10721 | Y10: =RC[-10]+RC[-5] -> 0 | Z10: =RC[-10]+RC[-5] -> 584109 | AA10: =RC[-10]+RC[-5] -> 28494289 | AB10: 0 | AD10: 'Mpumalanga | AE10: 7426252 | AF10: 4344 | AG10: 0 | AH10: 239222 | AI10: =RC[-4]+RC[-12] -> 35325711 | AJ10: =RC[-4]+RC[-12] -> 15065 | AK10: =RC[-4]+RC[-12] -> 0 | AL10: =RC[-4]+RC[-12] -> 823331
B11: 'North West | C11: 5147823 | D11: 207025 | E11: 0 | F11: 33176 | G11: =SUM(RC[-4]:RC[-1]) -> 5388024 | H11: 6747968 | I11: 242178 | J11: 0 | K11: 39183 | L11: =SUM(RC[-4]:RC[-1]) -> 7029329 | M11: =RC[-10]+RC[-5] -> 11895791 | N11: =RC[-10]+RC[-5] -> 449203 | O11: =RC[-10]+RC[-5] -> 0 | P11: =RC[-10]+RC[-5] -> 72359 | Q11: =RC[-10]+RC[-5] -> 12417353 | R11: 7061984 | S11: 237499 | T11: 0 | U11: 40878 | V11: =SUM(RC[-4]:RC[-1]) -> 7340361 | W11: =RC[-10]+RC[-5] -> 18957775 | X11: =RC[-10]+RC[-5] -> 686702 | Y11: =RC[-10]+RC[-5] -> 0 | Z11: =RC[-10]+RC[-5] -> 113237 | AA11: =RC[-10]+RC[-5] -> 19757714 | AB11: 0 | AD11: 'North West | AE11: 5936967 | AF11: 258156 | AG11: 0 | AH11: 33557 | AI11: =RC[-4]+RC[-12] -> 24894742 | AJ11: =RC[-4]+RC[-12] -> 944858 | AK11: =RC[-4]+RC[-12] -> 0 | AL11: =RC[-4]+RC[-12] -> 146794
B12: 'Northern Cape | C12: 1372794 | D12: 54634 | E12: 0 | F12: 11394 | G12: =SUM(RC[-4]:RC[-1]) -> 1438822 | H12: 1246014 | I12: 40631 | J12: 0 | K12: 14200 | L12: =SUM(RC[-4]:RC[-1]) -> 1300845 | M12: =RC[-10]+RC[-5] -> 2618808 | N12: =RC[-10]+RC[-5] -> 95265 | O12: =RC[-10]+RC[-5] -> 0 | P12: =RC[-10]+RC[-5] -> 25594 | Q12: =RC[-10]+RC[-5] -> 2739667 | R12: 1271762 | S12: 59342 | T12: 0 | U12: 13341 | V12: =SUM(RC[-4]:RC[-1]) -> 1344445 | W12: =RC[-10]+RC[-5] -> 3890570 | X12: =RC[-10]+RC[-5] -> 154607 | Y12: =RC[-10]+RC[-5] -> 0 | Z12: =RC[-10]+RC[-5] -> 38935 | AA12: =RC[-10]+RC[-5] -> 4084112 | AB12: 0 | AD12: 'Northern Cape | AE12: 1244866 | AF12: 50008 | AG12: 0 | AH12: 6700 | AI12: =RC[-4]+RC[-12] -> 5135436 | AJ12: =RC[-4]+RC[-12] -> 204615 | AK12: =RC[-4]+RC[-12] -> 0 | AL12: =RC[-4]+RC[-12] -> 45635
B13: 'Northern Province | C13: 2739585 | D13: 0 | E13: 0 | F13: 15807 | G13: =SUM(RC[-4]:RC[-1]) -> 2755392 | H13: 2607873 | I13: 0 | J13: 0 | K13: 12198 | L13: =SUM(RC[-4]:RC[-1]) -> 2620071 | M13: =RC[-10]+RC[-5] -> 5347458 | N13: =RC[-10]+RC[-5] -> 0 | O13: =RC[-10]+RC[-5] -> 0 | P13: =RC[-10]+RC[-5] -> 28005 | Q13: =RC[-10]+RC[-5] -> 5375463 | R13: 3131194 | S13: 60 | T13: 0 | U13: 21076 | V13: =SUM(RC[-4]:RC[-1]) -> 3152330 | W13: =RC[-10]+RC[-5] -> 8478652 | X13: =RC[-10]+RC[-5] -> 60 | Y13: =RC[-10]+RC[-5] -> 0 | Z13: =RC[-10]+RC[-5] -> 49081 | AA13: =RC[-10]+RC[-5] -> 8527793 | AB13: 0 | AD13: 'Northern Province | AE13: 2542284 | AF13: 0 | AG13: 0 | AH13: 9104 | AI13: =RC[-4]+RC[-12] -> 11020936 | AJ13: =RC[-4]+RC[-12] -> 60 | AK13: =RC[-4]+RC[-12] -> 0 | AL13: =RC[-4]+RC[-12] -> 58185
B14: 'Western Cape | C14: 7365680 | D14: 91581 | E14: 514398 | F14: 199721 | G14: =SUM(RC[-4]:RC[-1]) -> 8171380 | H14: 7607063 | I14: 62596 | J14: 512788 | K14: 208535 | L14: =SUM(RC[-4]:RC[-1]) -> 8390982 | M14: =RC[-10]+RC[-5] -> 14972743 | N14: =RC[-10]+RC[-5] -> 154177 | O14: =RC[-10]+RC[-5] -> 1027186 | P14: =RC[-10]+RC[-5] -> 408256 | Q14: =RC[-10]+RC[-5] -> 16562362 | R14: 8293458 | S14: 35720 | T14: 573691 | U14: 216245 | V14: =SUM(RC[-4]:RC[-1]) -> 9119114 | W14: =RC[-10]+RC[-5] -> 23266201 | X14: =RC[-10]+RC[-5] -> 189897 | Y14: =RC[-10]+RC[-5] -> 1600877 | Z14: =RC[-10]+RC[-5] -> 624501 | AA14: =RC[-10]+RC[-5] -> 25681476 | AB14: 0 | AD14: 'Western Cape | AE14: 6530843 | AF14: 43380 | AG14: 453565 | AH14: 164803 | AI14: =RC[-4]+RC[-12] -> 29797044 | AJ14: =RC[-4]+RC[-12] -> 233277 | AK14: =RC[-4]+RC[-12] -> 2054442 | AL14: =RC[-4]+RC[-12] -> 789304
A15: 'Construction Total | C15: 53574627 | D15: 906651 | E15: 603348 | F15: 965383 | G15: =SUM(RC[-4]:RC[-1]) -> 56050009 | H15: 56779936 | I15: 791862 | J15: 533188 | K15: 859673 | L15: =SUM(RC[-4]:RC[-1]) -> 58964659 | M15: =RC[-10]+RC[-5] -> 110354563 | N15: =RC[-10]+RC[-5] -> 1698513 | O15: =RC[-10]+RC[-5] -> 1136536 | P15: =RC[-10]+RC[-5] -> 1825056 | Q15: =RC[-10]+RC[-5] -> 115014668 | R15: 57073883 | S15: 777927 | T15: 621225 | U15: 789677 | V15: =SUM(RC[-4]:RC[-1]) -> 59262712 | W15: =RC[-10]+RC[-5] -> 167428446 | X15: =RC[-10]+RC[-5] -> 2476440 | Y15: =RC[-10]+RC[-5] -> 1757761 | Z15: =RC[-10]+RC[-5] -> 2614733 | AA15: =RC[-10]+RC[-5] -> 174277380 | AB15: 0 | AE15: 0 | AF15: 0 | AG15: 0 | AH15: 0 | AI15: =SUM(R[-9]C:R[-1]C) -> 218987365 | AJ15: =SUM(R[-9]C:R[-1]C) -> 3303019 | AK15: =SUM(R[-9]C:R[-1]C) -> 2244631 | AL15: =SUM(R[-9]C:R[-1]C) -> 3349352
A16: 'General Dealers | B16: 'Eastern Cape | C16: 6441215 | D16: 18934238 | E16: 4086368 | F16: 4001545 | G16: =SUM(RC[-4]:RC[-1]) -> 33463366 | H16: 7319138 | I16: 23441469 | J16: 5429497 | K16: 3315117 | L16: =SUM(RC[-4]:RC[-1]) -> 39505221 | M16: =RC[-10]+RC[-5] -> 13760353 | N16: =RC[-10]+RC[-5] -> 42375707 | O16: =RC[-10]+RC[-5] -> 9515865 | P16: =RC[-10]+RC[-5] -> 7316662 | Q16: =RC[-10]+RC[-5] -> 72968587 | R16: 9722796 | S16: 28213490 | T16: 5257819 | U16: 3312470 | V16: =SUM(RC[-4]:RC[-1]) -> 46506575 | W16: =RC[-10]+RC[-5] -> 23483149 | X16: =RC[-10]+RC[-5] -> 70589197 | Y16: =RC[-10]+RC[-5] -> 14773684 | Z16: =RC[-10]+RC[-5] -> 10629132 | AA16: =RC[-10]+RC[-5] -> 119475162 | AB16: 'XX | AC16: 'General Dealers | AD16: 'Eastern Cape | AE16: 8901893 | AF16: 19067069 | AG16: 5227552 | AH16: 4015052 | AI16: =RC[-4]+RC[-12] -> 32385042 | AJ16: =RC[-4]+RC[-12] -> 89656266 | AK16: =RC[-4]+RC[-12] -> 20001236 | AL16: =RC[-4]+RC[-12] -> 14644184
B17: 'Free State | C17: 10450280 | D17: 7013390 | E17: 643314 | F17: 3133342 | G17: =SUM(RC[-4]:RC[-1]) -> 21240326 | H17: 8432142 | I17: 9231716 | J17: 1321752 | K17: 2718005 | L17: =SUM(RC[-4]:RC[-1]) -> 21703615 | M17: =RC[-10]+RC[-5] -> 18882422 | N17: =RC[-10]+RC[-5] -> 16245106 | O17: =RC[-10]+RC[-5] -> 1965066 | P17: =RC[-10]+RC[-5] -> 5851347 | Q17: =RC[-10]+RC[-5] -> 42943941 | R17: 10972863 | S17: 13033554 | T17: 1508334 | U17: 2655698 | V17: =SUM(RC[-4]:RC[-1]) -> 28170449 | W17: =RC[-10]+RC[-5] -> 29855285 | X17: =RC[-10]+RC[-5] -> 29278660 | Y17: =RC[-10]+RC[-5] -> 3473400 | Z17: =RC[-10]+RC[-5] -> 8507045 | AA17: =RC[-10]+RC[-5] -> 71114390 | AB17: 0 | AD17: 'Free State | AE17: 11903963 | AF17: 7520155 | AG17: 3815871 | AH17: 2491003 | AI17: =RC[-4]+RC[-12] -> 41759248 | AJ17: =RC[-4]+RC[-12] -> 36798815 | AK17: =RC[-4]+RC[-12] -> 7289271 | AL17: =RC[-4]+RC[-12] -> 10998048
B18: 'Gauteng | C18: 26443630 | D18: 18835572 | E18: 4496579 | F18: 12100665 | G18: =SUM(RC[-4]:RC[-1]) -> 61876446 | H18: 29249940 | I18: 24867435 | J18: 11468928 | K18: 15367376 | L18: =SUM(RC[-4]:RC[-1]) -> 80953679 | M18: =RC[-10]+RC[-5] -> 55693570 | N18: =RC[-10]+RC[-5] -> 43703007 | O18: =RC[-10]+RC[-5] -> 15965507 | P18: =RC[-10]+RC[-5] -> 27468041 | Q18: =RC[-10]+RC[-5] -> 142830125 | R18: 31519041 | S18: 25421132 | T18: 13433512 | U18: 17506834 | V18: =SUM(RC[-4]:RC[-1]) -> 87880519 | W18: =RC[-10]+RC[-5] -> 87212611 | X18: =RC[-10]+RC[-5] -> 69124139 | Y18: =RC[-10]+RC[-5] -> 29399019 | Z18: =RC[-10]+RC[-5] -> 44974875 | AA18: =RC[-10]+RC[-5] -> 230710644 | AB18: 0 | AD18: 'Gauteng | AE18: 29018293 | AF18: 22381367 | AG18: 9374943 | AH18: 16468730 | AI18: =RC[-4]+RC[-12] -> 116230904 | AJ18: =RC[-4]+RC[-12] -> 91505506 | AK18: =RC[-4]+RC[-12] -> 38773962 | AL18: =RC[-4]+RC[-12] -> 61443605
B19: 'KwaZulu Natal | C19: 58332964 | D19: 30083718 | E19: 5210657 | F19: 15211664 | G19: =SUM(RC[-4]:RC[-1]) -> 108839003 | H19: 63789349 | I19: 36532371 | J19: 9693813 | K19: 16100829 | L19: =SUM(RC[-4]:RC[-1]) -> 126116362 | M19: =RC[-10]+RC[-5] -> 122122313 | N19: =RC[-10]+RC[-5] -> 66616089 | O19: =RC[-10]+RC[-5] -> 14904470 | P19: =RC[-10]+RC[-5] -> 31312493 | Q19: =RC[-10]+RC[-5] -> 234955365 | R19: 71300181 | S19: 41722493 | T19: 10461960 | U19: 16741907 | V19: =SUM(RC[-4]:RC[-1]) -> 140226541 | W19: =RC[-10]+RC[-5] -> 193422494 | X19: =RC[-10]+RC[-5] -> 108338582 | Y19: =RC[-10]+RC[-5] -> 25366430 | Z19: =RC[-10]+RC[-5] -> 48054400 | AA19: =RC[-10]+RC[-5] -> 375181906 | AB19: 0 | AD19: 'KwaZulu Natal | AE19: 73145659 | AF19: 36524785 | AG19: 9111660 | AH19: 16555736 | AI19: =RC[-4]+RC[-12] -> 266568153 | AJ19: =RC[-4]+RC[-12] -> 144863367 | AK19: =RC[-4]+RC[-12] -> 34478090 | AL19: =RC[-4]+RC[-12] -> 64610136
B20: 'Mpumalanga | C20: 21031464 | D20: 5517329 | E20: 2973725 | F20: 8394012 | G20: =SUM(RC[-4]:RC[-1]) -> 37916530 | H20: 23768754 | I20: 6291058 | J20: 4241366 | K20: 8019846 | L20: =SUM(RC[-4]:RC[-1]) -> 42321024 | M20: =RC[-10]+RC[-5] -> 44800218 | N20: =RC[-10]+RC[-5] -> 11808387 | O20: =RC[-10]+RC[-5] -> 7215091 | P20: =RC[-10]+RC[-5] -> 16413858 | Q20: =RC[-10]+RC[-5] -> 80237554 | R20: 28303228 | S20: 6721251 | T20: 4150630 | U20: 9766363 | V20: =SUM(RC[-4]:RC[-1]) -> 48941472 | W20: =RC[-10]+RC[-5] -> 73103446 | X20: =RC[-10]+RC[-5] -> 18529638 | Y20: =RC[-10]+RC[-5] -> 11365721 | Z20: =RC[-10]+RC[-5] -> 26180221 | AA20: =RC[-10]+RC[-5] -> 129179026 | AB20: 0 | AD20: 'Mpumalanga | AE20: 22059530 | AF20: 5959002 | AG20: 5328687 | AH20: 9464475 | AI20: =RC[-4]+RC[-12] -> 95162976 | AJ20: =RC[-4]+RC[-12] -> 24488640 | AK20: =RC[-4]+RC[-12] -> 16694408 | AL20: =RC[-4]+RC[-12] -> 35644696
B21: 'North West | C21: 14903717 | D21: 7657175 | E21: 825490 | F21: 5292821 | G21: =SUM(RC[-4]:RC[-1]) -> 28679203 | H21: 17404987 | I21: 9622548 | J21: 1993399 | K21: 5284668 | L21: =SUM(RC[-4]:RC[-1]) -> 34305602 | M21: =RC[-10]+RC[-5] -> 32308704 | N21: =RC[-10]+RC[-5] -> 17279723 | O21: =RC[-10]+RC[-5] -> 2818889 | P21: =RC[-10]+RC[-5] -> 10577489 | Q21: =RC[-10]+RC[-5] -> 62984805 | R21: 23247529 | S21: 9768794 | T21: 3523446 | U21: 6345688 | V21: =SUM(RC[-4]:RC[-1]) -> 42885457 | W21: =RC[-10]+RC[-5] -> 55556233 | X21: =RC[-10]+RC[-5] -> 27048517 | Y21: =RC[-10]+RC[-5] -> 6342335 | Z21: =RC[-10]+RC[-5] -> 16923177 | AA21: =RC[-10]+RC[-5] -> 105870262 | AB21: 0 | AD21: 'North West | AE21: 18159779 | AF21: 9146782 | AG21: 3002593 | AH21: 6773248 | AI21: =RC[-4]+RC[-12] -> 73716012 | AJ21: =RC[-4]+RC[-12] -> 36195299 | AK21: =RC[-4]+RC[-12] -> 9344928 | AL21: =RC[-4]+RC[-12] -> 23696425
B22: 'Northern Cape | C22: 5614663 | D22: 1822481 | E22: 836615 | F22: 2485358 | G22: =SUM(RC[-4]:RC[-1]) -> 10759117 | H22: 9933225 | I22: 2529323 | J22: 1046507 | K22: 3324865 | L22: =SUM(RC[-4]:RC[-1]) -> 16833920 | M22: =RC[-10]+RC[-5] -> 15547888 | N22: =RC[-10]+RC[-5] -> 4351804 | O22: =RC[-10]+RC[-5] -> 1883122 | P22: =RC[-10]+RC[-5] -> 5810223 | Q22: =RC[-10]+RC[-5] -> 27593037 | R22: 15722198 | S22: 3193601 | T22: 1165740 | U22: 4514913 | V22: =SUM(RC[-4]:RC[-1]) -> 24596452 | W22: =RC[-10]+RC[-5] -> 31270086 | X22: =RC[-10]+RC[-5] -> 7545405 | Y22: =RC[-10]+RC[-5] -> 3048862 | Z22: =RC[-10]+RC[-5] -> 10325136 | AA22: =RC[-10]+RC[-5] -> 52189489 | AB22: 0 | AD22: 'Northern Cape | AE22: 10480818 | AF22: 2241854 | AG22: 1139131 | AH22: 3781912 | AI22: =RC[-4]+RC[-12] -> 41750904 | AJ22: =RC[-4]+RC[-12] -> 9787259 | AK22: =RC[-4]+RC[-12] -> 4187993 | AL22: =RC[-4]+RC[-12] -> 14107048
B23: 'Northern Province | C23: 16071880 | D23: 6728453 | E23: 1569418 | F23: 17391323 | G23: =SUM(RC[-4]:RC[-1]) -> 41761074 | H23: 24573823 | I23: 6855387 | J23: 552981 | K23: 22198757 | L23: =SUM(RC[-4]:RC[-1]) -> 54180948 | M23: =RC[-10]+RC[-5] -> 40645703 | N23: =RC[-10]+RC[-5] -> 13583840 | O23: =RC[-10]+RC[-5] -> 2122399 | P23: =RC[-10]+RC[-5] -> 39590080 | Q23: =RC[-10]+RC[-5] -> 95942022 | R23: 28459569 | S23: 6479943 | T23: 659738 | U23: 27986013 | V23: =SUM(RC[-4]:RC[-1]) -> 63585263 | W23: =RC[-10]+RC[-5] -> 69105272 | X23: =RC[-10]+RC[-5] -> 20063783 | Y23: =RC[-10]+RC[-5] -> 2782137 | Z23: =RC[-10]+RC[-5] -> 67576093 | AA23: =RC[-10]+RC[-5] -> 159527285 | AB23: 0 | AD23: 'Northern Province | AE23: 32155271 | AF23: 3410969 | AG23: 727347 | AH23: 26079032 | AI23: =RC[-4]+RC[-12] -> 101260543 | AJ23: =RC[-4]+RC[-12] -> 23474752 | AK23: =RC[-4]+RC[-12] -> 3509484 | AL23: =RC[-4]+RC[-12] -> 93655125
B24: 'Western Cape | C24: 24056956 | D24: 6317987 | E24: 4411456 | F24: 5484658 | G24: =SUM(RC[-4]:RC[-1]) -> 40271057 | H24: 25363701 | I24: 11778016 | J24: 9493446 | K24: 4101289 | L24: =SUM(RC[-4]:RC[-1]) -> 50736452 | M24: =RC[-10]+RC[-5] -> 49420657 | N24: =RC[-10]+RC[-5] -> 18096003 | O24: =RC[-10]+RC[-5] -> 13904902 | P24: =RC[-10]+RC[-5] -> 9585947 | Q24: =RC[-10]+RC[-5] -> 91007509 | R24: 27113591 | S24: 13944675 | T24: 12294639 | U24: 4457324 | V24: =SUM(RC[-4]:RC[-1]) -> 57810229 | W24: =RC[-10]+RC[-5] -> 76534248 | X24: =RC[-10]+RC[-5] -> 32040678 | Y24: =RC[-10]+RC[-5] -> 26199541 | Z24: =RC[-10]+RC[-5] -> 14043271 | AA24: =RC[-10]+RC[-5] -> 148817738 | AB24: 0 | AD24: 'Western Cape | AE24: 27196114 | AF24: 8275690 | AG24: 8020805 | AH24: 4884597 | AI24: =RC[-4]+RC[-12] -> 103730362 | AJ24: =RC[-4]+RC[-12] -> 40316368 | AK24: =RC[-4]+RC[-12] -> 34220346 | AL24: =RC[-4]+RC[-12] -> 18927868
A25: 'General Dealers Total | C25: 183346769 | D25: 102910343 | E25: 25053622 | F25: 73495388 | G25: =SUM(RC[-4]:RC[-1]) -> 384806122 | H25: 209835059 | I25: 131149323 | J25: 45241689 | K25: 80430752 | L25: =SUM(RC[-4]:RC[-1]) -> 466656823 | M25: =RC[-10]+RC[-5] -> 393181828 | N25: =RC[-10]+RC[-5] -> 234059666 | O25: =RC[-10]+RC[-5] -> 70295311 | P25: =RC[-10]+RC[-5] -> 153926140 | Q25: =RC[-10]+RC[-5] -> 851462945 | R25: 246360996 | S25: 148498933 | T25: 52455818 | U25: 93287210 | V25: =SUM(RC[-4]:RC[-1]) -> 540602957 | W25: =RC[-10]+RC[-5] -> 639542824 | X25: =RC[-10]+RC[-5] -> 382558599 | Y25: =RC[-10]+RC[-5] -> 122751129 | Z25: =RC[-10]+RC[-5] -> 247213350 | AA25: =RC[-10]+RC[-5] -> 1392065902 | AB25: 0 | AE25: 0 | AF25: 0 | AG25: 0 | AH25: 0 | AI25: =SUM(R[-9]C:R[-1]C) -> 872564144 | AJ25: =SUM(R[-9]C:R[-1]C) -> 497086272 | AK25: =SUM(R[-9]C:R[-1]C) -> 168499718 | AL25: =SUM(R[-9]C:R[-1]C) -> 337727135
A26: 'Government | B26: 'Eastern Cape | C26: 1308142 | D26: 162960 | E26: 0 | F26: 414192 | G26: =SUM(RC[-4]:RC[-1]) -> 1885294 | H26: 1230392 | I26: 202645 | J26: 0 | K26: 477188 | L26: =SUM(RC[-4]:RC[-1]) -> 1910225 | M26: =RC[-10]+RC[-5] -> 2538534 | N26: =RC[-10]+RC[-5] -> 365605 | O26: =RC[-10]+RC[-5] -> 0 | P26: =RC[-10]+RC[-5] -> 891380 | Q26: =RC[-10]+RC[-5] -> 3795519 | R26: 1417513 | S26: 303152 | T26: 0 | U26: 355194 | V26: =SUM(RC[-4]:RC[-1]) -> 2075859 | W26: =RC[-10]+RC[-5] -> 3956047 | X26: =RC[-10]+RC[-5] -> 668757 | Y26: =RC[-10]+RC[-5] -> 0 | Z26: =RC[-10]+RC[-5] -> 1246574 | AA26: =RC[-10]+RC[-5] -> 5871378 | AB26: '03 | AC26: 'Government | AD26: 'Eastern Cape | AE26: 1132685 | AF26: 182377 | AG26: 0 | AH26: 314614 | AI26: =RC[-4]+RC[-12] -> 5088732 | AJ26: =RC[-4]+RC[-12] -> 851134 | AK26: =RC[-4]+RC[-12] -> 0 | AL26: =RC[-4]+RC[-12] -> 1561188
B27: 'Free State | C27: 1450779 | D27: 3010 | E27: 0 | F27: 421607 | G27: =SUM(RC[-4]:RC[-1]) -> 1875396 | H27: 2008612 | I27: 1610 | J27: 0 | K27: 444395 | L27: =SUM(RC[-4]:RC[-1]) -> 2454617 | M27: =RC[-10]+RC[-5] -> 3459391 | N27: =RC[-10]+RC[-5] -> 4620 | O27: =RC[-10]+RC[-5] -> 0 | P27: =RC[-10]+RC[-5] -> 866002 | Q27: =RC[-10]+RC[-5] -> 4330013 | R27: 1555000 | S27: 3400 | T27: 0 | U27: 414932 | V27: =SUM(RC[-4]:RC[-1]) -> 1973332 | W27: =RC[-10]+RC[-5] -> 5014391 | X27: =RC[-10]+RC[-5] -> 8020 | Y27: =RC[-10]+RC[-5] -> 0 | Z27: =RC[-10]+RC[-5] -> 1280934 | AA27: =RC[-10]+RC[-5] -> 6303345 | AB27: 0 | AD27: 'Free State | AE27: 1464433 | AF27: 1410 | AG27: 0 | AH27: 437146 | AI27: =RC[-4]+RC[-12] -> 6478824 | AJ27: =RC[-4]+RC[-12] -> 9430 | AK27: =RC[-4]+RC[-12] -> 0 | AL27: =RC[-4]+RC[-12] -> 1718080
B28: 'Gauteng | C28: 1312594 | D28: 2420 | E28: 0 | F28: 1203111 | G28: =SUM(RC[-4]:RC[-1]) -> 2518125 | H28: 1225912 | I28: 11971 | J28: 2775 | K28: 1136577 | L28: =SUM(RC[-4]:RC[-1]) -> 2377235 | M28: =RC[-10]+RC[-5] -> 2538506 | N28: =RC[-10]+RC[-5] -> 14391 | O28: =RC[-10]+RC[-5] -> 2775 | P28: =RC[-10]+RC[-5] -> 2339688 | Q28: =RC[-10]+RC[-5] -> 4895360 | R28: 1754965 | S28: 18210 | T28: 0 | U28: 1489947 | V28: =SUM(RC[-4]:RC[-1]) -> 3263122 | W28: =RC[-10]+RC[-5] -> 4293471 | X28: =RC[-10]+RC[-5] -> 32601 | Y28: =RC[-10]+RC[-5] -> 2775 | Z28: =RC[-10]+RC[-5] -> 3829635 | AA28: =RC[-10]+RC[-5] -> 8158482 | AB28: 0 | AD28: 'Gauteng | AE28: 1148551 | AF28: 600 | AG28: 0 | AH28: 1564534 | AI28: =RC[-4]+RC[-12] -> 5442022 | AJ28: =RC[-4]+RC[-12] -> 33201 | AK28: =RC[-4]+RC[-12] -> 2775 | AL28: =RC[-4]+RC[-12] -> 5394169
B29: 'KwaZulu Natal | C29: 8407657 | D29: 211070 | E29: 0 | F29: 1379110 | G29: =SUM(RC[-4]:RC[-1]) -> 9997837 | H29: 8477959 | I29: 273960 | J29: 0 | K29: 1384318 | L29: =SUM(RC[-4]:RC[-1]) -> 10136237 | M29: =RC[-10]+RC[-5] -> 16885616 | N29: =RC[-10]+RC[-5] -> 485030 | O29: =RC[-10]+RC[-5] -> 0 | P29: =RC[-10]+RC[-5] -> 2763428 | Q29: =RC[-10]+RC[-5] -> 20134074 | R29: 7489658 | S29: 242548 | T29: 0 | U29: 1340005 | V29: =SUM(RC[-4]:RC[-1]) -> 9072211 | W29: =RC[-10]+RC[-5] -> 24375274 | X29: =RC[-10]+RC[-5] -> 727578 | Y29: =RC[-10]+RC[-5] -> 0 | Z29: =RC[-10]+RC[-5] -> 4103433 | AA29: =RC[-10]+RC[-5] -> 29206285 | AB29: 0 | AD29: 'KwaZulu Natal | AE29: 11613743 | AF29: 534840 | AG29: 0 | AH29: 3408829 | AI29: =RC[-4]+RC[-12] -> 35989017 | AJ29: =RC[-4]+RC[-12] -> 1262418 | AK29: =RC[-4]+RC[-12] -> 0 | AL29: =RC[-4]+RC[-12] -> 7512262
B30: 'Mpumalanga | C30: 1649622 | D30: 8549 | E30: 0 | F30: 584305 | G30: =SUM(RC[-4]:RC[-1]) -> 2242476 | H30: 1672681 | I30: 3401 | J30: 0 | K30: 332195 | L30: =SUM(RC[-4]:RC[-1]) -> 2008277 | M30: =RC[-10]+RC[-5] -> 3322303 | N30: =RC[-10]+RC[-5] -> 11950 | O30: =RC[-10]+RC[-5] -> 0 | P30: =RC[-10]+RC[-5] -> 916500 | Q30: =RC[-10]+RC[-5] -> 4250753 | R30: 1888483 | S30: 3980 | T30: 0 | U30: 353022 | V30: =SUM(RC[-4]:RC[-1]) -> 2245485 | W30: =RC[-10]+RC[-5] -> 5210786 | X30: =RC[-10]+RC[-5] -> 15930 | Y30: =RC[-10]+RC[-5] -> 0 | Z30: =RC[-10]+RC[-5] -> 1269522 | AA30: =RC[-10]+RC[-5] -> 6496238 | AB30: 0 | AD30: 'Mpumalanga | AE30: 1642400 | AF30: 500 | AG30: 0 | AH30: 377703 | AI30: =RC[-4]+RC[-12] -> 6853186 | AJ30: =RC[-4]+RC[-12] -> 16430 | AK30: =RC[-4]+RC[-12] -> 0 | AL30: =RC[-4]+RC[-12] -> 1647225
B31: 'North West | C31: 1477184 | D31: 1980 | E31: 0 | F31: 457399 | G31: =SUM(RC[-4]:RC[-1]) -> 1936563 | H31: 988357 | I31: 1600 | J31: 0 | K31: 302022 | L31: =SUM(RC[-4]:RC[-1]) -> 1291979 | M31: =RC[-10]+RC[-5] -> 2465541 | N31: =RC[-10]+RC[-5] -> 3580 | O31: =RC[-10]+RC[-5] -> 0 | P31: =RC[-10]+RC[-5] -> 759421 | Q31: =RC[-10]+RC[-5] -> 3228542 | R31: 1418896 | S31: 4200 | T31: 0 | U31: 435221 | V31: =SUM(RC[-4]:RC[-1]) -> 1858317 | W31: =RC[-10]+RC[-5] -> 3884437 | X31: =RC[-10]+RC[-5] -> 7780 | Y31: =RC[-10]+RC[-5] -> 0 | Z31: =RC[-10]+RC[-5] -> 1194642 | AA31: =RC[-10]+RC[-5] -> 5086859 | AB31: 0 | AD31: 'North West | AE31: 1166802 | AF31: 200 | AG31: 0 | AH31: 423366 | AI31: =RC[-4]+RC[-12] -> 5051239 | AJ31: =RC[-4]+RC[-12] -> 7980 | AK31: =RC[-4]+RC[-12] -> 0 | AL31: =RC[-4]+RC[-12] -> 1618008
B32: 'Northern Cape | C32: 571995 | D32: 32323 | E32: 0 | F32: 288265 | G32: =SUM(RC[-4]:RC[-1]) -> 892583 | H32: 440910 | I32: 46973 | J32: 0 | K32: 127955 | L32: =SUM(RC[-4]:RC[-1]) -> 615838 | M32: =RC[-10]+RC[-5] -> 1012905 | N32: =RC[-10]+RC[-5] -> 79296 | O32: =RC[-10]+RC[-5] -> 0 | P32: =RC[-10]+RC[-5] -> 416220 | Q32: =RC[-10]+RC[-5] -> 1508421 | R32: 500815 | S32: 55732 | T32: 0 | U32: 194926 | V32: =SUM(RC[-4]:RC[-1]) -> 751473 | W32: =RC[-10]+RC[-5] -> 1513720 | X32: =RC[-10]+RC[-5] -> 135028 | Y32: =RC[-10]+RC[-5] -> 0 | Z32: =RC[-10]+RC[-5] -> 611146 | AA32: =RC[-10]+RC[-5] -> 2259894 | AB32: 0 | AD32: 'Northern Cape | AE32: 379358 | AF32: 36063 | AG32: 0 | AH32: 146321 | AI32: =RC[-4]+RC[-12] -> 1893078 | AJ32: =RC[-4]+RC[-12] -> 171091 | AK32: =RC[-4]+RC[-12] -> 0 | AL32: =RC[-4]+RC[-12] -> 757467
B33: 'Northern Province | C33: 2234668 | D33: 0 | E33: 0 | F33: 1165234 | G33: =SUM(RC[-4]:RC[-1]) -> 3399902 | H33: 1928846 | I33: 0 | J33: 0 | K33: 820299 | L33: =SUM(RC[-4]:RC[-1]) -> 2749145 | M33: =RC[-10]+RC[-5] -> 4163514 | N33: =RC[-10]+RC[-5] -> 0 | O33: =RC[-10]+RC[-5] -> 0 | P33: =RC[-10]+RC[-5] -> 1985533 | Q33: =RC[-10]+RC[-5] -> 6149047 | R33: 1999273 | S33: 0 | T33: 0 | U33: 1007837 | V33: =SUM(RC[-4]:RC[-1]) -> 3007110 | W33: =RC[-10]+RC[-5] -> 6162787 | X33: =RC[-10]+RC[-5] -> 0 | Y33: =RC[-10]+RC[-5] -> 0 | Z33: =RC[-10]+RC[-5] -> 2993370 | AA33: =RC[-10]+RC[-5] -> 9156157 | AB33: 0 | AD33: 'Northern Province | AE33: 1713151 | AF33: 0 | AG33: 0 | AH33: 873599 | AI33: =RC[-4]+RC[-12] -> 7875938 | AJ33: =RC[-4]+RC[-12] -> 0 | AK33: =RC[-4]+RC[-12] -> 0 | AL33: =RC[-4]+RC[-12] -> 3866969
B34: 'Western Cape | C34: 7326859 | D34: 391607 | E34: 0 | F34: 409651 | G34: =SUM(RC[-4]:RC[-1]) -> 8128117 | H34: 5705030 | I34: 85900 | J34: 0 | K34: 637906 | L34: =SUM(RC[-4]:RC[-1]) -> 6428836 | M34: =RC[-10]+RC[-5] -> 13031889 | N34: =RC[-10]+RC[-5] -> 477507 | O34: =RC[-10]+RC[-5] -> 0 | P34: =RC[-10]+RC[-5] -> 1047557 | Q34: =RC[-10]+RC[-5] -> 14556953 | R34: 3600318 | S34: 71363 | T34: 0 | U34: 540477 | V34: =SUM(RC[-4]:RC[-1]) -> 4212158 | W34: =RC[-10]+RC[-5] -> 16632207 | X34: =RC[-10]+RC[-5] -> 548870 | Y34: =RC[-10]+RC[-5] -> 0 | Z34: =RC[-10]+RC[-5] -> 1588034 | AA34: =RC[-10]+RC[-5] -> 18769111 | AB34: 0 | AD34: 'Western Cape | AE34: 4222586 | AF34: 192774 | AG34: 0 | AH34: 573134 | AI34: =RC[-4]+RC[-12] -> 20854793 | AJ34: =RC[-4]+RC[-12] -> 741644 | AK34: =RC[-4]+RC[-12] -> 0 | AL34: =RC[-4]+RC[-12] -> 2161168
A35: 'Government Total | C35: 25739500 | D35: 813919 | E35: 0 | F35: 6322874 | G35: =SUM(RC[-4]:RC[-1]) -> 32876293 | H35: 23678699 | I35: 628060 | J35: 2775 | K35: 5662855 | L35: =SUM(RC[-4]:RC[-1]) -> 29972389 | M35: =RC[-10]+RC[-5] -> 49418199 | N35: =RC[-10]+RC[-5] -> 1441979 | O35: =RC[-10]+RC[-5] -> 2775 | P35: =RC[-10]+RC[-5] -> 11985729 | Q35: =RC[-10]+RC[-5] -> 62848682 | R35: 21624921 | S35: 702585 | T35: 0 | U35: 6131561 | V35: =SUM(RC[-4]:RC[-1]) -> 28459067 | W35: =RC[-10]+RC[-5] -> 71043120 | X35: =RC[-10]+RC[-5] -> 2144564 | Y35: =RC[-10]+RC[-5] -> 2775 | Z35: =RC[-10]+RC[-5] -> 18117290 | AA35: =RC[-10]+RC[-5] -> 91307749 | AB35: 0 | AE35: 0 | AF35: 0 | AG35: 0 | AH35: 0 | AI35: =SUM(R[-9]C:R[-1]C) -> 95526829 | AJ35: =SUM(R[-9]C:R[-1]C) -> 3093328 | AK35: =SUM(R[-9]C:R[-1]C) -> 2775 | AL35: =SUM(R[-9]C:R[-1]C) -> 26236536
A36: 'Independent LPG Marketers | B36: 'Eastern Cape | C36: 0 | D36: 0 | E36: 367598 | F36: 0 | G36: =SUM(RC[-4]:RC[-1]) -> 367598 | H36: 0 | I36: 0 | J36: 137904 | K36: 0 | L36: =SUM(RC[-4]:RC[-1]) -> 137904 | M36: =RC[-10]+RC[-5] -> 0 | N36: =RC[-10]+RC[-5] -> 0 | O36: =RC[-10]+RC[-5] -> 505502 | P36: =RC[-10]+RC[-5] -> 0 | Q36: =RC[-10]+RC[-5] -> 505502 | R36: 0 | S36: -134687 | T36: 32327 | U36: 0 | V36: =SUM(RC[-4]:RC[-1]) -> -102360 | W36: =RC[-10]+RC[-5] -> 0 | X36: =RC[-10]+RC[-5] -> -134687 | Y36: =RC[-10]+RC[-5] -> 537829 | Z36: =RC[-10]+RC[-5] -> 0 | AA36: =RC[-10]+RC[-5] -> 403142 | AB36: '04 | AC36: 'Independant LPG Marketers | AD36: 'Eastern Cape | AE36: 0 | AF36: 0 | AG36: 2169328 | AH36: 0 | AI36: =RC[-4]+RC[-12] -> 0 | AJ36: =RC[-4]+RC[-12] -> -134687 | AK36: =RC[-4]+RC[-12] -> 2707157 | AL36: =RC[-4]+RC[-12] -> 0
B37: 'Free State | C37: 0 | D37: 0 | E37: 1932658 | F37: 0 | G37: =SUM(RC[-4]:RC[-1]) -> 1932658 | H37: 0 | I37: 0 | J37: 3582423 | K37: 0 | L37: =SUM(RC[-4]:RC[-1]) -> 3582423 | M37: =RC[-10]+RC[-5] -> 0 | N37: =RC[-10]+RC[-5] -> 0 | O37: =RC[-10]+RC[-5] -> 5515081 | P37: =RC[-10]+RC[-5] -> 0 | Q37: =RC[-10]+RC[-5] -> 5515081 | R37: 0 | S37: 0 | T37: 3594267 | U37: 0 | V37: =SUM(RC[-4]:RC[-1]) -> 3594267 | W37: =RC[-10]+RC[-5] -> 0 | X37: =RC[-10]+RC[-5] -> 0 | Y37: =RC[-10]+RC[-5] -> 9109348 | Z37: =RC[-10]+RC[-5] -> 0 | AA37: =RC[-10]+RC[-5] -> 9109348 | AB37: 0 | AD37: 'Free State | AE37: 0 | AF37: 0 | AG37: 2023823 | AH37: 0 | AI37: =RC[-4]+RC[-12] -> 0 | AJ37: =RC[-4]+RC[-12] -> 0 | AK37: =RC[-4]+RC[-12] -> 11133171 | AL37: =RC[-4]+RC[-12] -> 0
B38: 'Gauteng | C38: 0 | D38: 0 | E38: 8023716 | F38: 0 | G38: =SUM(RC[-4]:RC[-1]) -> 8023716 | H38: 0 | I38: 0 | J38: 14088080 | K38: 0 | L38: =SUM(RC[-4]:RC[-1]) -> 14088080 | M38: =RC[-10]+RC[-5] -> 0 | N38: =RC[-10]+RC[-5] -> 0 | O38: =RC[-10]+RC[-5] -> 22111796 | P38: =RC[-10]+RC[-5] -> 0 | Q38: =RC[-10]+RC[-5] -> 22111796 | R38: 0 | S38: 0 | T38: 10128384 | U38: 0 | V38: =SUM(RC[-4]:RC[-1]) -> 10128384 | W38: =RC[-10]+RC[-5] -> 0 | X38: =RC[-10]+RC[-5] -> 0 | Y38: =RC[-10]+RC[-5] -> 32240180 | Z38: =RC[-10]+RC[-5] -> 0 | AA38: =RC[-10]+RC[-5] -> 32240180 | AB38: 0 | AD38: 'Gauteng | AE38: 0 | AF38: 0 | AG38: 6896239 | AH38: 0 | AI38: =RC[-4]+RC[-12] -> 0 | AJ38: =RC[-4]+RC[-12] -> 0 | AK38: =RC[-4]+RC[-12] -> 39136419 | AL38: =RC[-4]+RC[-12] -> 0
B39: 'KwaZulu Natal | C39: 0 | D39: 0 | E39: 9095427 | F39: 0 | G39: =SUM(RC[-4]:RC[-1]) -> 9095427 | H39: 0 | I39: 0 | J39: 10001563 | K39: 0 | L39: =SUM(RC[-4]:RC[-1]) -> 10001563 | M39: =RC[-10]+RC[-5] -> 0 | N39: =RC[-10]+RC[-5] -> 0 | O39: =RC[-10]+RC[-5] -> 19096990 | P39: =RC[-10]+RC[-5] -> 0 | Q39: =RC[-10]+RC[-5] -> 19096990 | R39: 0 | S39: 0 | T39: 9618354 | U39: 0 | V39: =SUM(RC[-4]:RC[-1]) -> 9618354 | W39: =RC[-10]+RC[-5] -> 0 | X39: =RC[-10]+RC[-5] -> 0 | Y39: =RC[-10]+RC[-5] -> 28715344 | Z39: =RC[-10]+RC[-5] -> 0 | AA39: =RC[-10]+RC[-5] -> 28715344 | AB39: 0 | AD39: 'KwaZulu Natal | AE39: 0 | AF39: 0 | AG39: 9379444 | AH39: 0 | AI39: =RC[-4]+RC[-12] -> 0 | AJ39: =RC[-4]+RC[-12] -> 0 | AK39: =RC[-4]+RC[-12] -> 38094788 | AL39: =RC[-4]+RC[-12] -> 0
B40: 'Mpumalanga | C40: 0 | D40: 0 | E40: 774647 | F40: 0 | G40: =SUM(RC[-4]:RC[-1]) -> 774647 | H40: 0 | I40: 0 | J40: 842928 | K40: 0 | L40: =SUM(RC[-4]:RC[-1]) -> 842928 | M40: =RC[-10]+RC[-5] -> 0 | N40: =RC[-10]+RC[-5] -> 0 | O40: =RC[-10]+RC[-5] -> 1617575 | P40: =RC[-10]+RC[-5] -> 0 | Q40: =RC[-10]+RC[-5] -> 1617575 | R40: 0 | S40: 0 | T40: 1029301 | U40: 0 | V40: =SUM(RC[-4]:RC[-1]) -> 1029301 | W40: =RC[-10]+RC[-5] -> 0 | X40: =RC[-10]+RC[-5] -> 0 | Y40: =RC[-10]+RC[-5] -> 2646876 | Z40: =RC[-10]+RC[-5] -> 0 | AA40: =RC[-10]+RC[-5] -> 2646876 | AB40: 0 | AD40: 'Mpumalanga | AE40: 0 | AF40: 0 | AG40: 781436 | AH40: 0 | AI40: =RC[-4]+RC[-12] -> 0 | AJ40: =RC[-4]+RC[-12] -> 0 | AK40: =RC[-4]+RC[-12] -> 3428312 | AL40: =RC[-4]+RC[-12] -> 0
B41: 'North West | C41: 0 | D41: 0 | E41: 2503848 | F41: 0 | G41: =SUM(RC[-4]:RC[-1]) -> 2503848 | H41: 0 | I41: 0 | J41: 2404561 | K41: 0 | L41: =SUM(RC[-4]:RC[-1]) -> 2404561 | M41: =RC[-10]+RC[-5] -> 0 | N41: =RC[-10]+RC[-5] -> 0 | O41: =RC[-10]+RC[-5] -> 4908409 | P41: =RC[-10]+RC[-5] -> 0 | Q41: =RC[-10]+RC[-5] -> 4908409 | R41: 0 | S41: 0 | T41: 3429282 | U41: 0 | V41: =SUM(RC[-4]:RC[-1]) -> 3429282 | W41: =RC[-10]+RC[-5] -> 0 | X41: =RC[-10]+RC[-5] -> 0 | Y41: =RC[-10]+RC[-5] -> 8337691 | Z41: =RC[-10]+RC[-5] -> 0 | AA41: =RC[-10]+RC[-5] -> 8337691 | AB41: 0 | AD41: 'North West | AE41: 0 | AF41: 0 | AG41: 1827045 | AH41: 0 | AI41: =RC[-4]+RC[-12] -> 0 | AJ41: =RC[-4]+RC[-12] -> 0 | AK41: =RC[-4]+RC[-12] -> 10164736 | AL41: =RC[-4]+RC[-12] -> 0
B42: 'Northern Province | C42: 0 | D42: 0 | E42: 319412 | F42: 0 | G42: =SUM(RC[-4]:RC[-1]) -> 319412 | H42: 0 | I42: 0 | J42: 183700 | K42: 0 | L42: =SUM(RC[-4]:RC[-1]) -> 183700 | M42: =RC[-10]+RC[-5] -> 0 | N42: =RC[-10]+RC[-5] -> 0 | O42: =RC[-10]+RC[-5] -> 503112 | P42: =RC[-10]+RC[-5] -> 0 | Q42: =RC[-10]+RC[-5] -> 503112 | R42: 0 | S42: 0 | T42: 0 | U42: 0 | V42: =SUM(RC[-4]:RC[-1]) -> 0 | W42: =RC[-10]+RC[-5] -> 0 | X42: =RC[-10]+RC[-5] -> 0 | Y42: =RC[-10]+RC[-5] -> 503112 | Z42: =RC[-10]+RC[-5] -> 0 | AA42: =RC[-10]+RC[-5] -> 503112 | AB42: 0 | AE42: 0 | AF42: 0 | AG42: 0 | AH42: 0 | AI42: =RC[-4]+RC[-12] -> 0 | AJ42: =RC[-4]+RC[-12] -> 0 | AK42: =RC[-4]+RC[-12] -> 503112 | AL42: =RC[-4]+RC[-12] -> 0
B43: 'Western Cape | C43: 73954 | D43: 635139 | E43: 1526143 | F43: 0 | G43: =SUM(RC[-4]:RC[-1]) -> 2235236 | H43: 27327 | I43: 344721 | J43: 566572 | K43: 0 | L43: =SUM(RC[-4]:RC[-1]) -> 938620 | M43: =RC[-10]+RC[-5] -> 101281 | N43: =RC[-10]+RC[-5] -> 979860 | O43: =RC[-10]+RC[-5] -> 2092715 | P43: =RC[-10]+RC[-5] -> 0 | Q43: =RC[-10]+RC[-5] -> 3173856 | R43: 0 | S43: 0 | T43: 614422 | U43: 0 | V43: =SUM(RC[-4]:RC[-1]) -> 614422 | W43: =RC[-10]+RC[-5] -> 101281 | X43: =RC[-10]+RC[-5] -> 979860 | Y43: =RC[-10]+RC[-5] -> 2707137 | Z43: =RC[-10]+RC[-5] -> 0 | AA43: =RC[-10]+RC[-5] -> 3788278 | AB43: 0 | AE43: 0 | AF43: 0 | AG43: 0 | AH43: 0 | AI43: =RC[-4]+RC[-12] -> 101281 | AJ43: =RC[-4]+RC[-12] -> 979860 | AK43: =RC[-4]+RC[-12] -> 2707137 | AL43: =RC[-4]+RC[-12] -> 0
A44: 'Independent LPG Marketers Total | C44: 5117717 | D44: 2348529 | E44: 24543449 | F44: 0 | G44: =SUM(RC[-4]:RC[-1]) -> 32009695 | H44: 2052379 | I44: 1138660 | J44: 31807731 | K44: 0 | L44: =SUM(RC[-4]:RC[-1]) -> 34998770 | M44: =RC[-10]+RC[-5] -> 7170096 | N44: =RC[-10]+RC[-5] -> 3487189 | O44: =RC[-10]+RC[-5] -> 56351180 | P44: =RC[-10]+RC[-5] -> 0 | Q44: =RC[-10]+RC[-5] -> 67008465 | R44: 0 | S44: -134687 | T44: 28446337 | U44: 0 | V44: =SUM(RC[-4]:RC[-1]) -> 28311650 | W44: =RC[-10]+RC[-5] -> 7170096 | X44: =RC[-10]+RC[-5] -> 3352502 | Y44: =RC[-10]+RC[-5] -> 84797517 | Z44: =RC[-10]+RC[-5] -> 0 | AA44: =RC[-10]+RC[-5] -> 95320115 | AB44: 0 | AE44: 0 | AF44: 0 | AG44: 0 | AH44: 0 | AI44: =SUM(R[-8]C:R[-1]C) -> 101281 | AJ44: =SUM(R[-8]C:R[-1]C) -> 845173 | AK44: =SUM(R[-8]C:R[-1]C) -> 107874832 | AL44: =SUM(R[-8]C:R[-1]C) -> 0
A45: 'Local marine fishing | B45: 'Eastern Cape | C45: 2104670 | D45: 100 | E45: 0 | F45: 0 | G45: =SUM(RC[-4]:RC[-1]) -> 2104770 | H45: 2136335 | I45: 120 | J45: 0 | K45: 0 | L45: =SUM(RC[-4]:RC[-1]) -> 2136455 | M45: =RC[-10]+RC[-5] -> 4241005 | N45: =RC[-10]+RC[-5] -> 220 | O45: =RC[-10]+RC[-5] -> 0 | P45: =RC[-10]+RC[-5] -> 0 | Q45: =RC[-10]+RC[-5] -> 4241225 | R45: 2223943 | S45: 140 | T45: 0 | U45: 0 | V45: =SUM(RC[-4]:RC[-1]) -> 2224083 | W45: =RC[-10]+RC[-5] -> 6464948 | X45: =RC[-10]+RC[-5] -> 360 | Y45: =RC[-10]+RC[-5] -> 0 | Z45: =RC[-10]+RC[-5] -> 0 | AA45: =RC[-10]+RC[-5] -> 6465308 | AB45: '05 | AC45: 'Local marine fishing | AD45: 'Eastern Cape | AE45: 2448132 | AF45: 160 | AG45: 0 | AH45: 0 | AI45: =RC[-4]+RC[-12] -> 8913080 | AJ45: =RC[-4]+RC[-12] -> 520 | AK45: =RC[-4]+RC[-12] -> 0 | AL45: =RC[-4]+RC[-12] -> 0
B46: 'Free State | C46: 9484 | D46: 0 | E46: 0 | F46: 0 | G46: =SUM(RC[-4]:RC[-1]) -> 9484 | H46: 9000 | I46: 0 | J46: 0 | K46: 0 | L46: =SUM(RC[-4]:RC[-1]) -> 9000 | M46: =RC[-10]+RC[-5] -> 18484 | N46: =RC[-10]+RC[-5] -> 0 | O46: =RC[-10]+RC[-5] -> 0 | P46: =RC[-10]+RC[-5] -> 0 | Q46: =RC[-10]+RC[-5] -> 18484 | R46: 10000 | S46: 0 | T46: 0 | U46: 0 | V46: =SUM(RC[-4]:RC[-1]) -> 10000 | W46: =RC[-10]+RC[-5] -> 28484 | X46: =RC[-10]+RC[-5] -> 0 | Y46: =RC[-10]+RC[-5] -> 0 | Z46: =RC[-10]+RC[-5] -> 0 | AA46: =RC[-10]+RC[-5] -> 28484 | AB46: 0 | AD46: 'Free State | AE46: 15920 | AF46: 0 | AG46: 0 | AH46: 0 | AI46: =RC[-4]+RC[-12] -> 44404 | AJ46: =RC[-4]+RC[-12] -> 0 | AK46: =RC[-4]+RC[-12] -> 0 | AL46: =RC[-4]+RC[-12] -> 0
B47: 'Gauteng | C47: 24649 | D47: 0 | E47: 0 | F47: 0 | G47: =SUM(RC[-4]:RC[-1]) -> 24649 | H47: 20542 | I47: 0 | J47: 0 | K47: 0 | L47: =SUM(RC[-4]:RC[-1]) -> 20542 | M47: =RC[-10]+RC[-5] -> 45191 | N47: =RC[-10]+RC[-5] -> 0 | O47: =RC[-10]+RC[-5] -> 0 | P47: =RC[-10]+RC[-5] -> 0 | Q47: =RC[-10]+RC[-5] -> 45191 | R47: 20001 | S47: 0 | T47: 0 | U47: 0 | V47: =SUM(RC[-4]:RC[-1]) -> 20001 | W47: =RC[-10]+RC[-5] -> 65192 | X47: =RC[-10]+RC[-5] -> 0 | Y47: =RC[-10]+RC[-5] -> 0 | Z47: =RC[-10]+RC[-5] -> 0 | AA47: =RC[-10]+RC[-5] -> 65192 | AB47: 0 | AD47: 'Gauteng | AE47: 10024 | AF47: 0 | AG47: 0 | AH47: 0 | AI47: =RC[-4]+RC[-12] -> 75216 | AJ47: =RC[-4]+RC[-12] -> 0 | AK47: =RC[-4]+RC[-12] -> 0 | AL47: =RC[-4]+RC[-12] -> 0
B48: 'KwaZulu Natal | C48: 2468893 | D48: 2920 | E48: 0 | F48: 0 | G48: =SUM(RC[-4]:RC[-1]) -> 2471813 | H48: 3348422 | I48: 1320 | J48: 0 | K48: 0 | L48: =SUM(RC[-4]:RC[-1]) -> 3349742 | M48: =RC[-10]+RC[-5] -> 5817315 | N48: =RC[-10]+RC[-5] -> 4240 | O48: =RC[-10]+RC[-5] -> 0 | P48: =RC[-10]+RC[-5] -> 0 | Q48: =RC[-10]+RC[-5] -> 5821555 | R48: 2858450 | S48: 160 | T48: 0 | U48: 0 | V48: =SUM(RC[-4]:RC[-1]) -> 2858610 | W48: =RC[-10]+RC[-5] -> 8675765 | X48: =RC[-10]+RC[-5] -> 4400 | Y48: =RC[-10]+RC[-5] -> 0 | Z48: =RC[-10]+RC[-5] -> 0 | AA48: =RC[-10]+RC[-5] -> 8680165 | AB48: 0 | AD48: 'KwaZulu Natal | AE48: 1573776 | AF48: 240 | AG48: 0 | AH48: 0 | AI48: =RC[-4]+RC[-12] -> 10249541 | AJ48: =RC[-4]+RC[-12] -> 4640 | AK48: =RC[-4]+RC[-12] -> 0 | AL48: =RC[-4]+RC[-12] -> 0
B49: 'Mpumalanga | C49: 8005 | D49: 0 | E49: 0 | F49: 0 | G49: =SUM(RC[-4]:RC[-1]) -> 8005 | H49: 0 | I49: 0 | J49: 0 | K49: 0 | L49: =SUM(RC[-4]:RC[-1]) -> 0 | M49: =RC[-10]+RC[-5] -> 8005 | N49: =RC[-10]+RC[-5] -> 0 | O49: =RC[-10]+RC[-5] -> 0 | P49: =RC[-10]+RC[-5] -> 0 | Q49: =RC[-10]+RC[-5] -> 8005 | R49: 0 | S49: 0 | T49: 0 | U49: 0 | V49: =SUM(RC[-4]:RC[-1]) -> 0 | W49: =RC[-10]+RC[-5] -> 8005 | X49: =RC[-10]+RC[-5] -> 0 | Y49: =RC[-10]+RC[-5] -> 0 | Z49: =RC[-10]+RC[-5] -> 0 | AA49: =RC[-10]+RC[-5] -> 8005 | AB49: 0 | AE49: 0 | AF49: 0 | AG49: 0 | AH49: 0 | AI49: =RC[-4]+RC[-12] -> 8005 | AJ49: =RC[-4]+RC[-12] -> 0 | AK49: =RC[-4]+RC[-12] -> 0 | AL49: =RC[-4]+RC[-12] -> 0
B50: 'Northern Province | C50: 194132 | D50: 0 | E50: 0 | F50: 0 | G50: =SUM(RC[-4]:RC[-1]) -> 194132 | H50: 108307 | I50: 0 | J50: 0 | K50: 0 | L50: =SUM(RC[-4]:RC[-1]) -> 108307 | M50: =RC[-10]+RC[-5] -> 302439 | N50: =RC[-10]+RC[-5] -> 0 | O50: =RC[-10]+RC[-5] -> 0 | P50: =RC[-10]+RC[-5] -> 0 | Q50: =RC[-10]+RC[-5] -> 302439 | R50: 267165 | S50: 0 | T50: 0 | U50: 0 | V50: =SUM(RC[-4]:RC[-1]) -> 267165 | W50: =RC[-10]+RC[-5] -> 569604 | X50: =RC[-10]+RC[-5] -> 0 | Y50: =RC[-10]+RC[-5] -> 0 | Z50: =RC[-10]+RC[-5] -> 0 | AA50: =RC[-10]+RC[-5] -> 569604 | AB50: 0 | AD50: 'Northern Province | AE50: 250441 | AF50: 0 | AG50: 0 | AH50: 0 | AI50: =RC[-4]+RC[-12] -> 820045 | AJ50: =RC[-4]+RC[-12] -> 0 | AK50: =RC[-4]+RC[-12] -> 0 | AL50: =RC[-4]+RC[-12] -> 0
B51: 'Western Cape | C51: 20766147 | D51: 140645 | E51: 0 | F51: 48915 | G51: =SUM(RC[-4]:RC[-1]) -> 20955707 | H51: 22845798 | I51: 91310 | J51: 0 | K51: 74388 | L51: =SUM(RC[-4]:RC[-1]) -> 23011496 | M51: =RC[-10]+RC[-5] -> 43611945 | N51: =RC[-10]+RC[-5] -> 231955 | O51: =RC[-10]+RC[-5] -> 0 | P51: =RC[-10]+RC[-5] -> 123303 | Q51: =RC[-10]+RC[-5] -> 43967203 | R51: 19840763 | S51: 189310 | T51: 0 | U51: 62513 | V51: =SUM(RC[-4]:RC[-1]) -> 20092586 | W51: =RC[-10]+RC[-5] -> 63452708 | X51: =RC[-10]+RC[-5] -> 421265 | Y51: =RC[-10]+RC[-5] -> 0 | Z51: =RC[-10]+RC[-5] -> 185816 | AA51: =RC[-10]+RC[-5] -> 64059789 | AB51: 0 | AD51: 'Western Cape | AE51: 22479799 | AF51: 172494 | AG51: 0 | AH51: 58188 | AI51: =RC[-4]+RC[-12] -> 85932507 | AJ51: =RC[-4]+RC[-12] -> 593759 | AK51: =RC[-4]+RC[-12] -> 0 | AL51: =RC[-4]+RC[-12] -> 244004
A52: 'Local marine fishing Total | C52: 25575980 | D52: 143665 | E52: 0 | F52: 48915 | G52: =SUM(RC[-4]:RC[-1]) -> 25768560 | H52: 28468404 | I52: 92750 | J52: 0 | K52: 74388 | L52: =SUM(RC[-4]:RC[-1]) -> 28635542 | M52: =RC[-10]+RC[-5] -> 54044384 | N52: =RC[-10]+RC[-5] -> 236415 | O52: =RC[-10]+RC[-5] -> 0 | P52: =RC[-10]+RC[-5] -> 123303 | Q52: =RC[-10]+RC[-5] -> 54404102 | R52: 25220322 | S52: 189610 | T52: 0 | U52: 62513 | V52: =SUM(RC[-4]:RC[-1]) -> 25472445 | W52: =RC[-10]+RC[-5] -> 79264706 | X52: =RC[-10]+RC[-5] -> 426025 | Y52: =RC[-10]+RC[-5] -> 0 | Z52: =RC[-10]+RC[-5] -> 185816 | AA52: =RC[-10]+RC[-5] -> 79876547 | AB52: 0 | AE52: 0 | AF52: 0 | AG52: 0 | AH52: 0 | AI52: =SUM(R[-7]C:R[-1]C) -> 106042798 | AJ52: =SUM(R[-7]C:R[-1]C) -> 598919 | AK52: =SUM(R[-7]C:R[-1]C) -> 0 | AL52: =SUM(R[-7]C:R[-1]C) -> 244004
A53: 'Mining | B53: 'Eastern Cape | C53: 1012453 | D53: 125380 | E53: 0 | F53: 0 | G53: =SUM(RC[-4]:RC[-1]) -> 1137833 | H53: 1415652 | I53: 150678 | J53: 0 | K53: 0 | L53: =SUM(RC[-4]:RC[-1]) -> 1566330 | M53: =RC[-10]+RC[-5] -> 2428105 | N53: =RC[-10]+RC[-5] -> 276058 | O53: =RC[-10]+RC[-5] -> 0 | P53: =RC[-10]+RC[-5] -> 0 | Q53: =RC[-10]+RC[-5] -> 2704163 | R53: 1397007 | S53: 142369 | T53: 0 | U53: 0 | V53: =SUM(RC[-4]:RC[-1]) -> 1539376 | W53: =RC[-10]+RC[-5] -> 3825112 | X53: =RC[-10]+RC[-5] -> 418427 | Y53: =RC[-10]+RC[-5] -> 0 | Z53: =RC[-10]+RC[-5] -> 0 | AA53: =RC[-10]+RC[-5] -> 4243539 | AB53: '06 | AC53: 'Mining | AD53: 'Eastern Cape | AE53: 613684 | AF53: 143616 | AG53: 0 | AH53: 0 | AI53: =RC[-4]+RC[-12] -> 4438796 | AJ53: =RC[-4]+RC[-12] -> 562043 | AK53: =RC[-4]+RC[-12] -> 0 | AL53: =RC[-4]+RC[-12] -> 0
B54: 'Free State | C54: 3090002 | D54: 152068 | E54: 0 | F54: 347133 | G54: =SUM(RC[-4]:RC[-1]) -> 3589203 | H54: 3770235 | I54: 193873 | J54: 0 | K54: 366823 | L54: =SUM(RC[-4]:RC[-1]) -> 4330931 | M54: =RC[-10]+RC[-5] -> 6860237 | N54: =RC[-10]+RC[-5] -> 345941 | O54: =RC[-10]+RC[-5] -> 0 | P54: =RC[-10]+RC[-5] -> 713956 | Q54: =RC[-10]+RC[-5] -> 7920134 | R54: 4082462 | S54: 95570 | T54: 0 | U54: 378587 | V54: =SUM(RC[-4]:RC[-1]) -> 4556619 | W54: =RC[-10]+RC[-5] -> 10942699 | X54: =RC[-10]+RC[-5] -> 441511 | Y54: =RC[-10]+RC[-5] -> 0 | Z54: =RC[-10]+RC[-5] -> 1092543 | AA54: =RC[-10]+RC[-5] -> 12476753 | AB54: 0 | AD54: 'Free State | AE54: 3967077 | AF54: 147739 | AG54: 0 | AH54: 336606 | AI54: =RC[-4]+RC[-12] -> 14909776 | AJ54: =RC[-4]+RC[-12] -> 589250 | AK54: =RC[-4]+RC[-12] -> 0 | AL54: =RC[-4]+RC[-12] -> 1429149
B55: 'Gauteng | C55: 12476133 | D55: 44738 | E55: 10001 | F55: 733490 | G55: =SUM(RC[-4]:RC[-1]) -> 13264362 | H55: 14636340 | I55: 75364 | J55: 52505 | K55: 619727 | L55: =SUM(RC[-4]:RC[-1]) -> 15383936 | M55: =RC[-10]+RC[-5] -> 27112473 | N55: =RC[-10]+RC[-5] -> 120102 | O55: =RC[-10]+RC[-5] -> 62506 | P55: =RC[-10]+RC[-5] -> 1353217 | Q55: =RC[-10]+RC[-5] -> 28648298 | R55: 15148635 | S55: 46034 | T55: 112339 | U55: 759841 | V55: =SUM(RC[-4]:RC[-1]) -> 16066849 | W55: =RC[-10]+RC[-5] -> 42261108 | X55: =RC[-10]+RC[-5] -> 166136 | Y55: =RC[-10]+RC[-5] -> 174845 | Z55: =RC[-10]+RC[-5] -> 2113058 | AA55: =RC[-10]+RC[-5] -> 44715147 | AB55: 0 | AD55: 'Gauteng | AE55: 13337817 | AF55: 39903 | AG55: 29595 | AH55: 708252 | AI55: =RC[-4]+RC[-12] -> 55598925 | AJ55: =RC[-4]+RC[-12] -> 206039 | AK55: =RC[-4]+RC[-12] -> 204440 | AL55: =RC[-4]+RC[-12] -> 2821310
B56: 'KwaZulu Natal | C56: 2520134 | D56: 25217 | E56: 0 | F56: 80455 | G56: =SUM(RC[-4]:RC[-1]) -> 2625806 | H56: 2699827 | I56: 15772 | J56: 0 | K56: 70907 | L56: =SUM(RC[-4]:RC[-1]) -> 2786506 | M56: =RC[-10]+RC[-5] -> 5219961 | N56: =RC[-10]+RC[-5] -> 40989 | O56: =RC[-10]+RC[-5] -> 0 | P56: =RC[-10]+RC[-5] -> 151362 | Q56: =RC[-10]+RC[-5] -> 5412312 | R56: 2782018 | S56: 20387 | T56: 0 | U56: 67939 | V56: =SUM(RC[-4]:RC[-1]) -> 2870344 | W56: =RC[-10]+RC[-5] -> 8001979 | X56: =RC[-10]+RC[-5] -> 61376 | Y56: =RC[-10]+RC[-5] -> 0 | Z56: =RC[-10]+RC[-5] -> 219301 | AA56: =RC[-10]+RC[-5] -> 8282656 | AB56: 0 | AD56: 'KwaZulu Natal | AE56: 2563199 | AF56: 17445 | AG56: 0 | AH56: 44251 | AI56: =RC[-4]+RC[-12] -> 10565178 | AJ56: =RC[-4]+RC[-12] -> 78821 | AK56: =RC[-4]+RC[-12] -> 0 | AL56: =RC[-4]+RC[-12] -> 263552
B57: 'Mpumalanga | C57: 51187377 | D57: 261256 | E57: 0 | F57: 1226872 | G57: =SUM(RC[-4]:RC[-1]) -> 52675505 | H57: 52072180 | I57: 301330 | J57: 0 | K57: 1223658 | L57: =SUM(RC[-4]:RC[-1]) -> 53597168 | M57: =RC[-10]+RC[-5] -> 103259557 | N57: =RC[-10]+RC[-5] -> 562586 | O57: =RC[-10]+RC[-5] -> 0 | P57: =RC[-10]+RC[-5] -> 2450530 | Q57: =RC[-10]+RC[-5] -> 106272673 | R57: 59310086 | S57: 421863 | T57: 0 | U57: 1172154 | V57: =SUM(RC[-4]:RC[-1]) -> 60904103 | W57: =RC[-10]+RC[-5] -> 162569643 | X57: =RC[-10]+RC[-5] -> 984449 | Y57: =RC[-10]+RC[-5] -> 0 | Z57: =RC[-10]+RC[-5] -> 3622684 | AA57: =RC[-10]+RC[-5] -> 167176776 | AB57: 0 | AD57: 'Mpumalanga | AE57: 56530468 | AF57: 291818 | AG57: 0 | AH57: 1192759 | AI57: =RC[-4]+RC[-12] -> 219100111 | AJ57: =RC[-4]+RC[-12] -> 1276267 | AK57: =RC[-4]+RC[-12] -> 0 | AL57: =RC[-4]+RC[-12] -> 4815443
B58: 'North West | C58: 23290556 | D58: 484409 | E58: 0 | F58: 653851 | G58: =SUM(RC[-4]:RC[-1]) -> 24428816 | H58: 28290205 | I58: 832310 | J58: 0 | K58: 608298 | L58: =SUM(RC[-4]:RC[-1]) -> 29730813 | M58: =RC[-10]+RC[-5] -> 51580761 | N58: =RC[-10]+RC[-5] -> 1316719 | O58: =RC[-10]+RC[-5] -> 0 | P58: =RC[-10]+RC[-5] -> 1262149 | Q58: =RC[-10]+RC[-5] -> 54159629 | R58: 29996517 | S58: 841416 | T58: 0 | U58: 486414 | V58: =SUM(RC[-4]:RC[-1]) -> 31324347 | W58: =RC[-10]+RC[-5] -> 81577278 | X58: =RC[-10]+RC[-5] -> 2158135 | Y58: =RC[-10]+RC[-5] -> 0 | Z58: =RC[-10]+RC[-5] -> 1748563 | AA58: =RC[-10]+RC[-5] -> 85483976 | AB58: 0 | AD58: 'North West | AE58: 28996928 | AF58: 969873 | AG58: 0 | AH58: 632474 | AI58: =RC[-4]+RC[-12] -> 110574206 | AJ58: =RC[-4]+RC[-12] -> 3128008 | AK58: =RC[-4]+RC[-12] -> 0 | AL58: =RC[-4]+RC[-12] -> 2381037
B59: 'Northern Cape | C59: 23468760 | D59: 102279 | E59: 0 | F59: 510071 | G59: =SUM(RC[-4]:RC[-1]) -> 24081110 | H59: 25403403 | I59: 91127 | J59: 0 | K59: 659281 | L59: =SUM(RC[-4]:RC[-1]) -> 26153811 | M59: =RC[-10]+RC[-5] -> 48872163 | N59: =RC[-10]+RC[-5] -> 193406 | O59: =RC[-10]+RC[-5] -> 0 | P59: =RC[-10]+RC[-5] -> 1169352 | Q59: =RC[-10]+RC[-5] -> 50234921 | R59: 28092452 | S59: 68803 | T59: 0 | U59: 604693 | V59: =SUM(RC[-4]:RC[-1]) -> 28765948 | W59: =RC[-10]+RC[-5] -> 76964615 | X59: =RC[-10]+RC[-5] -> 262209 | Y59: =RC[-10]+RC[-5] -> 0 | Z59: =RC[-10]+RC[-5] -> 1774045 | AA59: =RC[-10]+RC[-5] -> 79000869 | AB59: 0 | AD59: 'Northern Cape | AE59: 23713713 | AF59: 75542 | AG59: 0 | AH59: 497499 | AI59: =RC[-4]+RC[-12] -> 100678328 | AJ59: =RC[-4]+RC[-12] -> 337751 | AK59: =RC[-4]+RC[-12] -> 0 | AL59: =RC[-4]+RC[-12] -> 2271544
B60: 'Northern Province | C60: 21796700 | D60: 95678 | E60: -1496201 | F60: 582116 | G60: =SUM(RC[-4]:RC[-1]) -> 20978293 | H60: 24363745 | I60: 220 | J60: 5406451 | K60: 658029 | L60: =SUM(RC[-4]:RC[-1]) -> 30428445 | M60: =RC[-10]+RC[-5] -> 46160445 | N60: =RC[-10]+RC[-5] -> 95898 | O60: =RC[-10]+RC[-5] -> 3910250 | P60: =RC[-10]+RC[-5] -> 1240145 | Q60: =RC[-10]+RC[-5] -> 51406738 | R60: 25561374 | S60: 65156 | T60: 2571854 | U60: 840059 | V60: =SUM(RC[-4]:RC[-1]) -> 29038443 | W60: =RC[-10]+RC[-5] -> 71721819 | X60: =RC[-10]+RC[-5] -> 161054 | Y60: =RC[-10]+RC[-5] -> 6482104 | Z60: =RC[-10]+RC[-5] -> 2080204 | AA60: =RC[-10]+RC[-5] -> 80445181 | AB60: 0 | AD60: 'Northern Province | AE60: 24715378 | AF60: 43655 | AG60: 2355673 | AH60: 808477 | AI60: =RC[-4]+RC[-12] -> 96437197 | AJ60: =RC[-4]+RC[-12] -> 204709 | AK60: =RC[-4]+RC[-12] -> 8837777 | AL60: =RC[-4]+RC[-12] -> 2888681
B61: 'Western Cape | C61: 11668392 | D61: 1677530 | E61: 0 | F61: 425098 | G61: =SUM(RC[-4]:RC[-1]) -> 13771020 | H61: 10640398 | I61: 2228934 | J61: 0 | K61: 477137 | L61: =SUM(RC[-4]:RC[-1]) -> 13346469 | M61: =RC[-10]+RC[-5] -> 22308790 | N61: =RC[-10]+RC[-5] -> 3906464 | O61: =RC[-10]+RC[-5] -> 0 | P61: =RC[-10]+RC[-5] -> 902235 | Q61: =RC[-10]+RC[-5] -> 27117489 | R61: 10647701 | S61: 2399003 | T61: 0 | U61: 436155 | V61: =SUM(RC[-4]:RC[-1]) -> 13482859 | W61: =RC[-10]+RC[-5] -> 32956491 | X61: =RC[-10]+RC[-5] -> 6305467 | Y61: =RC[-10]+RC[-5] -> 0 | Z61: =RC[-10]+RC[-5] -> 1338390 | AA61: =RC[-10]+RC[-5] -> 40600348 | AB61: 0 | AD61: 'Western Cape | AE61: 10591529 | AF61: 2507258 | AG61: 0 | AH61: 534316 | AI61: =RC[-4]+RC[-12] -> 43548020 | AJ61: =RC[-4]+RC[-12] -> 8812725 | AK61: =RC[-4]+RC[-12] -> 0 | AL61: =RC[-4]+RC[-12] -> 1872706
A62: 'Mining Total | C62: 150510507 | D62: 2968555 | E62: -1486200 | F62: 4559086 | G62: =SUM(RC[-4]:RC[-1]) -> 156551948 | H62: 163291985 | I62: 3889608 | J62: 5458956 | K62: 4683860 | L62: =SUM(RC[-4]:RC[-1]) -> 177324409 | M62: =RC[-10]+RC[-5] -> 313802492 | N62: =RC[-10]+RC[-5] -> 6858163 | O62: =RC[-10]+RC[-5] -> 3972756 | P62: =RC[-10]+RC[-5] -> 9242946 | Q62: =RC[-10]+RC[-5] -> 333876357 | R62: 177018252 | S62: 4100601 | T62: 2684193 | U62: 4745842 | V62: =SUM(RC[-4]:RC[-1]) -> 188548888 | W62: =RC[-10]+RC[-5] -> 490820744 | X62: =RC[-10]+RC[-5] -> 10958764 | Y62: =RC[-10]+RC[-5] -> 6656949 | Z62: =RC[-10]+RC[-5] -> 13988788 | AA62: =RC[-10]+RC[-5] -> 522425245 | AB62: 0 | AE62: 0 | AF62: 0 | AG62: 0 | AH62: 0 | AI62: =SUM(R[-9]C:R[-1]C) -> 655850537 | AJ62: =SUM(R[-9]C:R[-1]C) -> 15195613 | AK62: =SUM(R[-9]C:R[-1]C) -> 9042217 | AL62: =SUM(R[-9]C:R[-1]C) -> 18743422
A63: 'Public Passenger Bus Transport | B63: 'Eastern Cape | C63: 2508655 | D63: 0 | E63: 0 | F63: 122963 | G63: =SUM(RC[-4]:RC[-1]) -> 2631618 | H63: 3689077 | I63: 0 | J63: 0 | K63: 113841 | L63: =SUM(RC[-4]:RC[-1]) -> 3802918 | M63: =RC[-10]+RC[-5] -> 6197732 | N63: =RC[-10]+RC[-5] -> 0 | O63: =RC[-10]+RC[-5] -> 0 | P63: =RC[-10]+RC[-5] -> 236804 | Q63: =RC[-10]+RC[-5] -> 6434536 | R63: 3093897 | S63: 20 | T63: 0 | U63: 132134 | V63: =SUM(RC[-4]:RC[-1]) -> 3226051 | W63: =RC[-10]+RC[-5] -> 9291629 | X63: =RC[-10]+RC[-5] -> 20 | Y63: =RC[-10]+RC[-5] -> 0 | Z63: =RC[-10]+RC[-5] -> 368938 | AA63: =RC[-10]+RC[-5] -> 9660587 | AB63: '07 | AC63: 'Public TPT | AD63: 'Eastern Cape | AE63: 3281403 | AF63: 0 | AG63: 0 | AH63: 148365 | AI63: =RC[-4]+RC[-12] -> 12573032 | AJ63: =RC[-4]+RC[-12] -> 20 | AK63: =RC[-4]+RC[-12] -> 0 | AL63: =RC[-4]+RC[-12] -> 517303
B64: 'Free State | C64: 1957372 | D64: 3300 | E64: 0 | F64: 88624 | G64: =SUM(RC[-4]:RC[-1]) -> 2049296 | H64: 2095178 | I64: 3680 | J64: 0 | K64: 89052 | L64: =SUM(RC[-4]:RC[-1]) -> 2187910 | M64: =RC[-10]+RC[-5] -> 4052550 | N64: =RC[-10]+RC[-5] -> 6980 | O64: =RC[-10]+RC[-5] -> 0 | P64: =RC[-10]+RC[-5] -> 177676 | Q64: =RC[-10]+RC[-5] -> 4237206 | R64: 1939332 | S64: 4068 | T64: 0 | U64: 58527 | V64: =SUM(RC[-4]:RC[-1]) -> 2001927 | W64: =RC[-10]+RC[-5] -> 5991882 | X64: =RC[-10]+RC[-5] -> 11048 | Y64: =RC[-10]+RC[-5] -> 0 | Z64: =RC[-10]+RC[-5] -> 236203 | AA64: =RC[-10]+RC[-5] -> 6239133 | AB64: 0 | AD64: 'Free State | AE64: 1774109 | AF64: 2440 | AG64: 0 | AH64: 99735 | AI64: =RC[-4]+RC[-12] -> 7765991 | AJ64: =RC[-4]+RC[-12] -> 13488 | AK64: =RC[-4]+RC[-12] -> 0 | AL64: =RC[-4]+RC[-12] -> 335938
B65: 'Gauteng | C65: 13416632 | D65: 16215 | E65: 17328 | F65: 861999 | G65: =SUM(RC[-4]:RC[-1]) -> 14312174 | H65: 14493504 | I65: 16616 | J65: 11506 | K65: 911919 | L65: =SUM(RC[-4]:RC[-1]) -> 15433545 | M65: =RC[-10]+RC[-5] -> 27910136 | N65: =RC[-10]+RC[-5] -> 32831 | O65: =RC[-10]+RC[-5] -> 28834 | P65: =RC[-10]+RC[-5] -> 1773918 | Q65: =RC[-10]+RC[-5] -> 29745719 | R65: 17573714 | S65: 22022 | T65: 2593 | U65: 985502 | V65: =SUM(RC[-4]:RC[-1]) -> 18583831 | W65: =RC[-10]+RC[-5] -> 45483850 | X65: =RC[-10]+RC[-5] -> 54853 | Y65: =RC[-10]+RC[-5] -> 31427 | Z65: =RC[-10]+RC[-5] -> 2759420 | AA65: =RC[-10]+RC[-5] -> 48329550 | AB65: 0 | AD65: 'Gauteng | AE65: 16798064 | AF65: 24001 | AG65: 1642 | AH65: 1007608 | AI65: =RC[-4]+RC[-12] -> 62281914 | AJ65: =RC[-4]+RC[-12] -> 78854 | AK65: =RC[-4]+RC[-12] -> 33069 | AL65: =RC[-4]+RC[-12] -> 3767028
B66: 'KwaZulu Natal | C66: 7070408 | D66: 40941 | E66: 0 | F66: 10066 | G66: =SUM(RC[-4]:RC[-1]) -> 7121415 | H66: 11890417 | I66: 105048 | J66: 0 | K66: 190848 | L66: =SUM(RC[-4]:RC[-1]) -> 12186313 | M66: =RC[-10]+RC[-5] -> 18960825 | N66: =RC[-10]+RC[-5] -> 145989 | O66: =RC[-10]+RC[-5] -> 0 | P66: =RC[-10]+RC[-5] -> 200914 | Q66: =RC[-10]+RC[-5] -> 19307728 | R66: 13201191 | S66: 200048 | T66: 0 | U66: 161181 | V66: =SUM(RC[-4]:RC[-1]) -> 13562420 | W66: =RC[-10]+RC[-5] -> 32162016 | X66: =RC[-10]+RC[-5] -> 346037 | Y66: =RC[-10]+RC[-5] -> 0 | Z66: =RC[-10]+RC[-5] -> 362095 | AA66: =RC[-10]+RC[-5] -> 32870148 | AB66: 0 | AD66: 'KwaZulu Natal | AE66: 9500356 | AF66: 206033 | AG66: 0 | AH66: 123585 | AI66: =RC[-4]+RC[-12] -> 41662372 | AJ66: =RC[-4]+RC[-12] -> 552070 | AK66: =RC[-4]+RC[-12] -> 0 | AL66: =RC[-4]+RC[-12] -> 485680
B67: 'Mpumalanga | C67: 4649210 | D67: 0 | E67: 0 | F67: 91542 | G67: =SUM(RC[-4]:RC[-1]) -> 4740752 | H67: 5010401 | I67: -80 | J67: 0 | K67: 117593 | L67: =SUM(RC[-4]:RC[-1]) -> 5127914 | M67: =RC[-10]+RC[-5] -> 9659611 | N67: =RC[-10]+RC[-5] -> -80 | O67: =RC[-10]+RC[-5] -> 0 | P67: =RC[-10]+RC[-5] -> 209135 | Q67: =RC[-10]+RC[-5] -> 9868666 | R67: 4992519 | S67: 0 | T67: 0 | U67: 121025 | V67: =SUM(RC[-4]:RC[-1]) -> 5113544 | W67: =RC[-10]+RC[-5] -> 14652130 | X67: =RC[-10]+RC[-5] -> -80 | Y67: =RC[-10]+RC[-5] -> 0 | Z67: =RC[-10]+RC[-5] -> 330160 | AA67: =RC[-10]+RC[-5] -> 14982210 | AB67: 0 | AD67: 'Mpumalanga | AE67: 5046930 | AF67: 0 | AG67: 0 | AH67: 102082 | AI67: =RC[-4]+RC[-12] -> 19699060 | AJ67: =RC[-4]+RC[-12] -> -80 | AK67: =RC[-4]+RC[-12] -> 0 | AL67: =RC[-4]+RC[-12] -> 432242
B68: 'North West | C68: 815868 | D68: 2265 | E68: 0 | F68: 63998 | G68: =SUM(RC[-4]:RC[-1]) -> 882131 | H68: 1638821 | I68: 0 | J68: 0 | K68: 68286 | L68: =SUM(RC[-4]:RC[-1]) -> 1707107 | M68: =RC[-10]+RC[-5] -> 2454689 | N68: =RC[-10]+RC[-5] -> 2265 | O68: =RC[-10]+RC[-5] -> 0 | P68: =RC[-10]+RC[-5] -> 132284 | Q68: =RC[-10]+RC[-5] -> 2589238 | R68: 849419 | S68: 2000 | T68: 0 | U68: 59141 | V68: =SUM(RC[-4]:RC[-1]) -> 910560 | W68: =RC[-10]+RC[-5] -> 3304108 | X68: =RC[-10]+RC[-5] -> 4265 | Y68: =RC[-10]+RC[-5] -> 0 | Z68: =RC[-10]+RC[-5] -> 191425 | AA68: =RC[-10]+RC[-5] -> 3499798 | AB68: 0 | AD68: 'North West | AE68: 565215 | AF68: 0 | AG68: 0 | AH68: 61779 | AI68: =RC[-4]+RC[-12] -> 3869323 | AJ68: =RC[-4]+RC[-12] -> 4265 | AK68: =RC[-4]+RC[-12] -> 0 | AL68: =RC[-4]+RC[-12] -> 253204
B69: 'Northern Cape | C69: 105006 | D69: 0 | E69: 0 | F69: 83465 | G69: =SUM(RC[-4]:RC[-1]) -> 188471 | H69: 87431 | I69: 0 | J69: 0 | K69: 142696 | L69: =SUM(RC[-4]:RC[-1]) -> 230127 | M69: =RC[-10]+RC[-5] -> 192437 | N69: =RC[-10]+RC[-5] -> 0 | O69: =RC[-10]+RC[-5] -> 0 | P69: =RC[-10]+RC[-5] -> 226161 | Q69: =RC[-10]+RC[-5] -> 418598 | R69: 114898 | S69: 0 | T69: 0 | U69: 94259 | V69: =SUM(RC[-4]:RC[-1]) -> 209157 | W69: =RC[-10]+RC[-5] -> 307335 | X69: =RC[-10]+RC[-5] -> 0 | Y69: =RC[-10]+RC[-5] -> 0 | Z69: =RC[-10]+RC[-5] -> 320420 | AA69: =RC[-10]+RC[-5] -> 627755 | AB69: 0 | AD69: 'Northern Cape | AE69: 249124 | AF69: 29361 | AG69: 0 | AH69: 187805 | AI69: =RC[-4]+RC[-12] -> 556459 | AJ69: =RC[-4]+RC[-12] -> 29361 | AK69: =RC[-4]+RC[-12] -> 0 | AL69: =RC[-4]+RC[-12] -> 508225
B70: 'Northern Province | C70: 1312947 | D70: 0 | E70: 0 | F70: 42288 | G70: =SUM(RC[-4]:RC[-1]) -> 1355235 | H70: 1208581 | I70: 231 | J70: 0 | K70: 8606 | L70: =SUM(RC[-4]:RC[-1]) -> 1217418 | M70: =RC[-10]+RC[-5] -> 2521528 | N70: =RC[-10]+RC[-5] -> 231 | O70: =RC[-10]+RC[-5] -> 0 | P70: =RC[-10]+RC[-5] -> 50894 | Q70: =RC[-10]+RC[-5] -> 2572653 | R70: 1370382 | S70: 0 | T70: 0 | U70: 52297 | V70: =SUM(RC[-4]:RC[-1]) -> 1422679 | W70: =RC[-10]+RC[-5] -> 3891910 | X70: =RC[-10]+RC[-5] -> 231 | Y70: =RC[-10]+RC[-5] -> 0 | Z70: =RC[-10]+RC[-5] -> 103191 | AA70: =RC[-10]+RC[-5] -> 3995332 | AB70: 0 | AD70: 'Northern Province | AE70: 1269470 | AF70: 0 | AG70: 0 | AH70: 20164 | AI70: =RC[-4]+RC[-12] -> 5161380 | AJ70: =RC[-4]+RC[-12] -> 231 | AK70: =RC[-4]+RC[-12] -> 0 | AL70: =RC[-4]+RC[-12] -> 123355
B71: 'Western Cape | C71: 9746819 | D71: 10763 | E71: 86 | F71: 990578 | G71: =SUM(RC[-4]:RC[-1]) -> 10748246 | H71: 7324718 | I71: 6380 | J71: -172 | K71: 750292 | L71: =SUM(RC[-4]:RC[-1]) -> 8081218 | M71: =RC[-10]+RC[-5] -> 17071537 | N71: =RC[-10]+RC[-5] -> 17143 | O71: =RC[-10]+RC[-5] -> -86 | P71: =RC[-10]+RC[-5] -> 1740870 | Q71: =RC[-10]+RC[-5] -> 18829464 | R71: 7890268 | S71: 6602 | T71: 0 | U71: 738034 | V71: =SUM(RC[-4]:RC[-1]) -> 8634904 | W71: =RC[-10]+RC[-5] -> 24961805 | X71: =RC[-10]+RC[-5] -> 23745 | Y71: =RC[-10]+RC[-5] -> -86 | Z71: =RC[-10]+RC[-5] -> 2478904 | AA71: =RC[-10]+RC[-5] -> 27464368 | AB71: 0 | AD71: 'Western Cape | AE71: 9735091 | AF71: 8047 | AG71: 0 | AH71: 927404 | AI71: =RC[-4]+RC[-12] -> 34696896 | AJ71: =RC[-4]+RC[-12] -> 31792 | AK71: =RC[-4]+RC[-12] -> -86 | AL71: =RC[-4]+RC[-12] -> 3406308
A72: 'Public Passenger Bus Transport Total | C72: 41582917 | D72: 73484 | E72: 17414 | F72: 2355523 | G72: =SUM(RC[-4]:RC[-1]) -> 44029338 | H72: 47438128 | I72: 131875 | J72: 11334 | K72: 2393133 | L72: =SUM(RC[-4]:RC[-1]) -> 49974470 | M72: =RC[-10]+RC[-5] -> 89021045 | N72: =RC[-10]+RC[-5] -> 205359 | O72: =RC[-10]+RC[-5] -> 28748 | P72: =RC[-10]+RC[-5] -> 4748656 | Q72: =RC[-10]+RC[-5] -> 94003808 | R72: 51025620 | S72: 234760 | T72: 2593 | U72: 2402100 | V72: =SUM(RC[-4]:RC[-1]) -> 53665073 | W72: =RC[-10]+RC[-5] -> 140046665 | X72: =RC[-10]+RC[-5] -> 440119 | Y72: =RC[-10]+RC[-5] -> 31341 | Z72: =RC[-10]+RC[-5] -> 7150756 | AA72: =RC[-10]+RC[-5] -> 147668881 | AB72: 0 | AE72: 0 | AF72: 0 | AG72: 0 | AH72: 0 | AI72: =SUM(R[-9]C:R[-1]C) -> 188266427 | AJ72: =SUM(R[-9]C:R[-1]C) -> 710001 | AK72: =SUM(R[-9]C:R[-1]C) -> 32983 | AL72: =SUM(R[-9]C:R[-1]C) -> 9829283
A73: 'General Commercial and Industrial | B73: 'Eastern Cape | C73: 13765417 | D73: 2045827 | E73: 8493539 | F73: 2000188 | G73: =SUM(RC[-4]:RC[-1]) -> 26304971 | H73: 12875874 | I73: 2036033 | J73: 8759627 | K73: 1906351 | L73: =SUM(RC[-4]:RC[-1]) -> 25577885 | M73: =RC[-10]+RC[-5] -> 26641291 | N73: =RC[-10]+RC[-5] -> 4081860 | O73: =RC[-10]+RC[-5] -> 17253166 | P73: =RC[-10]+RC[-5] -> 3906539 | Q73: =RC[-10]+RC[-5] -> 51882856 | R73: 12252700 | S73: 2397340 | T73: 9711690 | U73: 1631503 | V73: =SUM(RC[-4]:RC[-1]) -> 25993233 | W73: =RC[-10]+RC[-5] -> 38893991 | X73: =RC[-10]+RC[-5] -> 6479200 | Y73: =RC[-10]+RC[-5] -> 26964856 | Z73: =RC[-10]+RC[-5] -> 5538042 | AA73: =RC[-10]+RC[-5] -> 77876089 | AB73: '08 | AC73: 'Remainder of General Trade | AD73: 'Eastern Cape | AE73: 13014691 | AF73: 2024177 | AG73: 1110241 | AH73: 1653347 | AI73: =RC[-4]+RC[-12] -> 51908682 | AJ73: =RC[-4]+RC[-12] -> 8503377 | AK73: =RC[-4]+RC[-12] -> 28075097 | AL73: =RC[-4]+RC[-12] -> 7191389
B74: 'Free State | C74: 18535886 | D74: 1308541 | E74: 84753 | F74: 434050 | G74: =SUM(RC[-4]:RC[-1]) -> 20363230 | H74: 19088998 | I74: 1152617 | J74: 36406 | K74: 327069 | L74: =SUM(RC[-4]:RC[-1]) -> 20605090 | M74: =RC[-10]+RC[-5] -> 37624884 | N74: =RC[-10]+RC[-5] -> 2461158 | O74: =RC[-10]+RC[-5] -> 121159 | P74: =RC[-10]+RC[-5] -> 761119 | Q74: =RC[-10]+RC[-5] -> 40968320 | R74: 15973829 | S74: 1372455 | T74: 5159 | U74: 374558 | V74: =SUM(RC[-4]:RC[-1]) -> 17726001 | W74: =RC[-10]+RC[-5] -> 53598713 | X74: =RC[-10]+RC[-5] -> 3833613 | Y74: =RC[-10]+RC[-5] -> 126318 | Z74: =RC[-10]+RC[-5] -> 1135677 | AA74: =RC[-10]+RC[-5] -> 58694321 | AB74: 0 | AD74: 'Free State | AE74: 12697719 | AF74: 877222 | AG74: 0 | AH74: 217445 | AI74: =RC[-4]+RC[-12] -> 66296432 | AJ74: =RC[-4]+RC[-12] -> 4710835 | AK74: =RC[-4]+RC[-12] -> 126318 | AL74: =RC[-4]+RC[-12] -> 1353122
B75: 'Gauteng | C75: =44762024+2009667 -> 46771691 | D75: =6179061+352427 -> 6531488 | E75: 12204174 | F75: 10135346 | G75: =SUM(RC[-4]:RC[-1]) -> 75642699 | H75: =53720988+807225 -> 54528213 | I75: =6478500+101700 -> 6580200 | J75: 16588406 | K75: 9187453 | L75: =SUM(RC[-4]:RC[-1]) -> 86884272 | M75: =RC[-10]+RC[-5] -> 101299904 | N75: =RC[-10]+RC[-5] -> 13111688 | O75: =RC[-10]+RC[-5] -> 28792580 | P75: =RC[-10]+RC[-5] -> 19322799 | Q75: =RC[-10]+RC[-5] -> 162526971 | R75: 62571612 | S75: 6537469 | T75: 16448199 | U75: 10382693 | V75: =SUM(RC[-4]:RC[-1]) -> 95939973 | W75: =RC[-10]+RC[-5] -> 163871516 | X75: =RC[-10]+RC[-5] -> 19649157 | Y75: =RC[-10]+RC[-5] -> 45240779 | Z75: =RC[-10]+RC[-5] -> 29705492 | AA75: =RC[-10]+RC[-5] -> 258466944 | AB75: 0 | AD75: 'Gauteng | AE75: 58906460 | AF75: 5329461 | AG75: 9764953 | AH75: 10569350 | AI75: =RC[-4]+RC[-12] -> 222777976 | AJ75: =RC[-4]+RC[-12] -> 24978618 | AK75: =RC[-4]+RC[-12] -> 55005732 | AL75: =RC[-4]+RC[-12] -> 40274842
B76: 'KwaZulu Natal | C76: =36494065+3034096 -> 39528161 | D76: =3332810+1360963 -> 4693773 | E76: 11113943 | F76: 3434843 | G76: =SUM(RC[-4]:RC[-1]) -> 58770720 | H76: =38795986+1217827 -> 40013813 | I76: =4295068+692239 -> 4987307 | J76: 18032516 | K76: 3320753 | L76: =SUM(RC[-4]:RC[-1]) -> 66354389 | M76: =RC[-10]+RC[-5] -> 79541974 | N76: =RC[-10]+RC[-5] -> 9681080 | O76: =RC[-10]+RC[-5] -> 29146459 | P76: =RC[-10]+RC[-5] -> 6755596 | Q76: =RC[-10]+RC[-5] -> 125125109 | R76: 29508714 | S76: 3400127 | T76: 14971968 | U76: 2641980 | V76: =SUM(RC[-4]:RC[-1]) -> 50522789 | W76: =RC[-10]+RC[-5] -> 109050688 | X76: =RC[-10]+RC[-5] -> 13081207 | Y76: =RC[-10]+RC[-5] -> 44118427 | Z76: =RC[-10]+RC[-5] -> 9397576 | AA76: =RC[-10]+RC[-5] -> 175647898 | AB76: 0 | AD76: 'KwaZulu Natal | AE76: 29608576 | AF76: 3795513 | AG76: 15947571 | AH76: 2552587 | AI76: =RC[-4]+RC[-12] -> 138659264 | AJ76: =RC[-4]+RC[-12] -> 16876720 | AK76: =RC[-4]+RC[-12] -> 60065998 | AL76: =RC[-4]+RC[-12] -> 11950163
B77: 'Mpumalanga | C77: 24468776 | D77: 1926207 | E77: 40149 | F77: 3786453 | G77: =SUM(RC[-4]:RC[-1]) -> 30221585 | H77: 23813520 | I77: 1815462 | J77: 27885 | K77: 4230517 | L77: =SUM(RC[-4]:RC[-1]) -> 29887384 | M77: =RC[-10]+RC[-5] -> 48282296 | N77: =RC[-10]+RC[-5] -> 3741669 | O77: =RC[-10]+RC[-5] -> 68034 | P77: =RC[-10]+RC[-5] -> 8016970 | Q77: =RC[-10]+RC[-5] -> 60108969 | R77: 24691939 | S77: 1033199 | T77: 837333 | U77: 3266072 | V77: =SUM(RC[-4]:RC[-1]) -> 29828543 | W77: =RC[-10]+RC[-5] -> 72974235 | X77: =RC[-10]+RC[-5] -> 4774868 | Y77: =RC[-10]+RC[-5] -> 905367 | Z77: =RC[-10]+RC[-5] -> 11283042 | AA77: =RC[-10]+RC[-5] -> 89937512 | AB77: 0 | AD77: 'Mpumalanga | AE77: 19124492 | AF77: 1134777 | AG77: 2535484 | AH77: 2234256 | AI77: =RC[-4]+RC[-12] -> 92098727 | AJ77: =RC[-4]+RC[-12] -> 5909645 | AK77: =RC[-4]+RC[-12] -> 3440851 | AL77: =RC[-4]+RC[-12] -> 13517298
B78: 'North West | C78: 14579442 | D78: 2338521 | E78: 7917627 | F78: 1394020 | G78: =SUM(RC[-4]:RC[-1]) -> 26229610 | H78: 15877316 | I78: 2484672 | J78: 9913026 | K78: 1458819 | L78: =SUM(RC[-4]:RC[-1]) -> 29733833 | M78: =RC[-10]+RC[-5] -> 30456758 | N78: =RC[-10]+RC[-5] -> 4823193 | O78: =RC[-10]+RC[-5] -> 17830653 | P78: =RC[-10]+RC[-5] -> 2852839 | Q78: =RC[-10]+RC[-5] -> 55963443 | R78: 11969495 | S78: 2750684 | T78: 9043658 | U78: 436479 | V78: =SUM(RC[-4]:RC[-1]) -> 24200316 | W78: =RC[-10]+RC[-5] -> 42426253 | X78: =RC[-10]+RC[-5] -> 7573877 | Y78: =RC[-10]+RC[-5] -> 26874311 | Z78: =RC[-10]+RC[-5] -> 3289318 | AA78: =RC[-10]+RC[-5] -> 80163759 | AB78: 0 | AD78: 'North West | AE78: 10258192 | AF78: 555315 | AG78: 1816350 | AH78: 581517 | AI78: =RC[-4]+RC[-12] -> 52684445 | AJ78: =RC[-4]+RC[-12] -> 8129192 | AK78: =RC[-4]+RC[-12] -> 28690661 | AL78: =RC[-4]+RC[-12] -> 3870835
B79: 'Northern Cape | C79: 7045101 | D79: 868638 | E79: 436160 | F79: 991362 | G79: =SUM(RC[-4]:RC[-1]) -> 9341261 | H79: 5721614 | I79: 723862 | J79: 310229 | K79: 567191 | L79: =SUM(RC[-4]:RC[-1]) -> 7322896 | M79: =RC[-10]+RC[-5] -> 12766715 | N79: =RC[-10]+RC[-5] -> 1592500 | O79: =RC[-10]+RC[-5] -> 746389 | P79: =RC[-10]+RC[-5] -> 1558553 | Q79: =RC[-10]+RC[-5] -> 16664157 | R79: 4312126 | S79: 363521 | T79: 321527 | U79: 339792 | V79: =SUM(RC[-4]:RC[-1]) -> 5336966 | W79: =RC[-10]+RC[-5] -> 17078841 | X79: =RC[-10]+RC[-5] -> 1956021 | Y79: =RC[-10]+RC[-5] -> 1067916 | Z79: =RC[-10]+RC[-5] -> 1898345 | AA79: =RC[-10]+RC[-5] -> 22001123 | AB79: 0 | AD79: 'Northern Cape | AE79: 4327168 | AF79: 222515 | AG79: -5903 | AH79: 281595 | AI79: =RC[-4]+RC[-12] -> 21406009 | AJ79: =RC[-4]+RC[-12] -> 2178536 | AK79: =RC[-4]+RC[-12] -> 1062013 | AL79: =RC[-4]+RC[-12] -> 2179940
B80: 'Northern Province | C80: 10522927 | D80: 691229 | E80: 18680 | F80: 6140277 | G80: =SUM(RC[-4]:RC[-1]) -> 17373113 | H80: 6474583 | I80: 375728 | J80: 89996 | K80: 2790203 | L80: =SUM(RC[-4]:RC[-1]) -> 9730510 | M80: =RC[-10]+RC[-5] -> 16997510 | N80: =RC[-10]+RC[-5] -> 1066957 | O80: =RC[-10]+RC[-5] -> 108676 | P80: =RC[-10]+RC[-5] -> 8930480 | Q80: =RC[-10]+RC[-5] -> 27103623 | R80: 6475324 | S80: 925911 | T80: 36165 | U80: 785393 | V80: =SUM(RC[-4]:RC[-1]) -> 8222793 | W80: =RC[-10]+RC[-5] -> 23472834 | X80: =RC[-10]+RC[-5] -> 1992868 | Y80: =RC[-10]+RC[-5] -> 144841 | Z80: =RC[-10]+RC[-5] -> 9715873 | AA80: =RC[-10]+RC[-5] -> 35326416 | AB80: 0 | AD80: 'Northern Province | AE80: 5792422 | AF80: 178099 | AG80: 2263952 | AH80: 869300 | AI80: =RC[-4]+RC[-12] -> 29265256 | AJ80: =RC[-4]+RC[-12] -> 2170967 | AK80: =RC[-4]+RC[-12] -> 2408793 | AL80: =RC[-4]+RC[-12] -> 10585173
B81: 'Western Cape | C81: 22302582 | D81: 6109037 | E81: 27047756 | F81: 2407338 | G81: =SUM(RC[-4]:RC[-1]) -> 57866713 | H81: 23413822 | I81: 8239922 | J81: 29402007 | K81: 2072807 | L81: =SUM(RC[-4]:RC[-1]) -> 63128558 | M81: =RC[-10]+RC[-5] -> 45716404 | N81: =RC[-10]+RC[-5] -> 14348959 | O81: =RC[-10]+RC[-5] -> 56449763 | P81: =RC[-10]+RC[-5] -> 4480145 | Q81: =RC[-10]+RC[-5] -> 120995271 | R81: 21448924 | S81: 6839792 | T81: 32663775 | U81: 2019007 | V81: =SUM(RC[-4]:RC[-1]) -> 62971498 | W81: =RC[-10]+RC[-5] -> 67165328 | X81: =RC[-10]+RC[-5] -> 21188751 | Y81: =RC[-10]+RC[-5] -> 89113538 | Z81: =RC[-10]+RC[-5] -> 6499152 | AA81: =RC[-10]+RC[-5] -> 183966769 | AB81: 0 | AD81: 'Western Cape | AE81: 18626628 | AF81: 5670237 | AG81: 32616091 | AH81: 2549450 | AI81: =RC[-4]+RC[-12] -> 85791956 | AJ81: =RC[-4]+RC[-12] -> 26858988 | AK81: =RC[-4]+RC[-12] -> 121729629 | AL81: =RC[-4]+RC[-12] -> 9048602
A82: 'General Commercial and Industrial Total | C82: 192476220 | D82: 24799871 | E82: 67356781 | F82: 30723877 | G82: =SUM(RC[-4]:RC[-1]) -> 315356749 | H82: 199782701 | I82: 27601864 | J82: 83160098 | K82: 25861163 | L82: =SUM(RC[-4]:RC[-1]) -> 336405826 | M82: =RC[-10]+RC[-5] -> 392258921 | N82: =RC[-10]+RC[-5] -> 52401735 | O82: =RC[-10]+RC[-5] -> 150516879 | P82: =RC[-10]+RC[-5] -> 56585040 | Q82: =RC[-10]+RC[-5] -> 651762575 | R82: 189204663 | S82: 25620498 | T82: 84039474 | U82: 21877477 | V82: =SUM(RC[-4]:RC[-1]) -> 320742112 | W82: =RC[-10]+RC[-5] -> 581463584 | X82: =RC[-10]+RC[-5] -> 78022233 | Y82: =RC[-10]+RC[-5] -> 234556353 | Z82: =RC[-10]+RC[-5] -> 78462517 | AA82: =RC[-10]+RC[-5] -> 972504687 | AB82: 0 | AE82: 0 | AF82: 0 | AG82: 0 | AH82: 0 | AI82: =SUM(R[-9]C:R[-1]C) -> 760888747 | AJ82: =SUM(R[-9]C:R[-1]C) -> 100316878 | AK82: =SUM(R[-9]C:R[-1]C) -> 300605092 | AL82: =SUM(R[-9]C:R[-1]C) -> 99971364
A83: 'Retail - garages | B83: 'Eastern Cape | C83: 37946175 | D83: 2686480 | E83: 0 | F83: 175869374 | G83: =SUM(RC[-4]:RC[-1]) -> 216502029 | H83: 37789937 | I83: 3553050 | J83: 0 | K83: 169394728 | L83: =SUM(RC[-4]:RC[-1]) -> 210737715 | M83: =RC[-10]+RC[-5] -> 75736112 | N83: =RC[-10]+RC[-5] -> 6239530 | O83: =RC[-10]+RC[-5] -> 0 | P83: =RC[-10]+RC[-5] -> 345264102 | Q83: =RC[-10]+RC[-5] -> 427239744 | R83: 41525719 | S83: 4235572 | T83: 0 | U83: 180341425 | V83: =SUM(RC[-4]:RC[-1]) -> 226102716 | W83: =RC[-10]+RC[-5] -> 117261831 | X83: =RC[-10]+RC[-5] -> 10475102 | Y83: =RC[-10]+RC[-5] -> 0 | Z83: =RC[-10]+RC[-5] -> 525605527 | AA83: =RC[-10]+RC[-5] -> 653342460 | AB83: 'X | AC83: 'Retail - garages | AD83: 'Eastern Cape | AE83: 46871061 | AF83: 2315545 | AG83: 0 | AH83: 188224804 | AI83: =RC[-4]+RC[-12] -> 164132892 | AJ83: =RC[-4]+RC[-12] -> 12790647 | AK83: =RC[-4]+RC[-12] -> 0 | AL83: =RC[-4]+RC[-12] -> 713830331
B84: 'Free State | C84: 33368194 | D84: 134377 | E84: 0 | F84: 125875285 | G84: =SUM(RC[-4]:RC[-1]) -> 159377856 | H84: 34034070 | I84: 138422 | J84: 0 | K84: 119458380 | L84: =SUM(RC[-4]:RC[-1]) -> 153630872 | M84: =RC[-10]+RC[-5] -> 67402264 | N84: =RC[-10]+RC[-5] -> 272799 | O84: =RC[-10]+RC[-5] -> 0 | P84: =RC[-10]+RC[-5] -> 245333665 | Q84: =RC[-10]+RC[-5] -> 313008728 | R84: 38061642 | S84: 104452 | T84: 0 | U84: 128657163 | V84: =SUM(RC[-4]:RC[-1]) -> 166823257 | W84: =RC[-10]+RC[-5] -> 105463906 | X84: =RC[-10]+RC[-5] -> 377251 | Y84: =RC[-10]+RC[-5] -> 0 | Z84: =RC[-10]+RC[-5] -> 373990828 | AA84: =RC[-10]+RC[-5] -> 479831985 | AB84: 0 | AD84: 'Free State | AE84: 36961236 | AF84: 17638 | AG84: 0 | AH84: 127377049 | AI84: =RC[-4]+RC[-12] -> 142425142 | AJ84: =RC[-4]+RC[-12] -> 394889 | AK84: =RC[-4]+RC[-12] -> 0 | AL84: =RC[-4]+RC[-12] -> 501367877
B85: 'Gauteng | C85: 102488635 | D85: 920582 | E85: 169172 | F85: 896233002 | G85: =SUM(RC[-4]:RC[-1]) -> 999811391 | H85: 111551581 | I85: 1944569 | J85: 556202 | K85: 888190904 | L85: =SUM(RC[-4]:RC[-1]) -> 1002243256 | M85: =RC[-10]+RC[-5] -> 214040216 | N85: =RC[-10]+RC[-5] -> 2865151 | O85: =RC[-10]+RC[-5] -> 725374 | P85: =RC[-10]+RC[-5] -> 1784423906 | Q85: =RC[-10]+RC[-5] -> 2002054647 | R85: 122514117 | S85: 2098587 | T85: 380111 | U85: 955668043 | V85: =SUM(RC[-4]:RC[-1]) -> 1080660858 | W85: =RC[-10]+RC[-5] -> 336554333 | X85: =RC[-10]+RC[-5] -> 4963738 | Y85: =RC[-10]+RC[-5] -> 1105485 | Z85: =RC[-10]+RC[-5] -> 2740091949 | AA85: =RC[-10]+RC[-5] -> 3082715505 | AB85: 0 | AD85: 'Gauteng | AE85: 118552098 | AF85: 1452334 | AG85: 99234 | AH85: 924311269 | AI85: =RC[-4]+RC[-12] -> 455106431 | AJ85: =RC[-4]+RC[-12] -> 6416072 | AK85: =RC[-4]+RC[-12] -> 1204719 | AL85: =RC[-4]+RC[-12] -> 3664403218
B86: 'KwaZulu Natal | C86: 64807430 | D86: 741394 | E86: 0 | F86: 369903414 | G86: =SUM(RC[-4]:RC[-1]) -> 435452238 | H86: 68419155 | I86: 976312 | J86: 0 | K86: 359580020 | L86: =SUM(RC[-4]:RC[-1]) -> 428975487 | M86: =RC[-10]+RC[-5] -> 133226585 | N86: =RC[-10]+RC[-5] -> 1717706 | O86: =RC[-10]+RC[-5] -> 0 | P86: =RC[-10]+RC[-5] -> 729483434 | Q86: =RC[-10]+RC[-5] -> 864427725 | R86: 77193514 | S86: 864405 | T86: 0 | U86: 381288549 | V86: =SUM(RC[-4]:RC[-1]) -> 459346468 | W86: =RC[-10]+RC[-5] -> 210420099 | X86: =RC[-10]+RC[-5] -> 2582111 | Y86: =RC[-10]+RC[-5] -> 0 | Z86: =RC[-10]+RC[-5] -> 1110771983 | AA86: =RC[-10]+RC[-5] -> 1323774193 | AB86: 0 | AD86: 'KwaZulu Natal | AE86: 77101120 | AF86: 705630 | AG86: 0 | AH86: 385958694 | AI86: =RC[-4]+RC[-12] -> 287521219 | AJ86: =RC[-4]+RC[-12] -> 3287741 | AK86: =RC[-4]+RC[-12] -> 0 | AL86: =RC[-4]+RC[-12] -> 1496730677
B87: 'Mpumalanga | C87: 28783467 | D87: 1038823 | E87: 0 | F87: 143044706 | G87: =SUM(RC[-4]:RC[-1]) -> 172866996 | H87: 30810703 | I87: 1108777 | J87: 0 | K87: 140852650 | L87: =SUM(RC[-4]:RC[-1]) -> 172772130 | M87: =RC[-10]+RC[-5] -> 59594170 | N87: =RC[-10]+RC[-5] -> 2147600 | O87: =RC[-10]+RC[-5] -> 0 | P87: =RC[-10]+RC[-5] -> 283897356 | Q87: =RC[-10]+RC[-5] -> 345639126 | R87: 34463972 | S87: 1162143 | T87: 0 | U87: 151897605 | V87: =SUM(RC[-4]:RC[-1]) -> 187523720 | W87: =RC[-10]+RC[-5] -> 94058142 | X87: =RC[-10]+RC[-5] -> 3309743 | Y87: =RC[-10]+RC[-5] -> 0 | Z87: =RC[-10]+RC[-5] -> 435794961 | AA87: =RC[-10]+RC[-5] -> 533162846 | AB87: 0 | AD87: 'Mpumalanga | AE87: 34404632 | AF87: 1078826 | AG87: 0 | AH87: 150343449 | AI87: =RC[-4]+RC[-12] -> 128462774 | AJ87: =RC[-4]+RC[-12] -> 4388569 | AK87: =RC[-4]+RC[-12] -> 0 | AL87: =RC[-4]+RC[-12] -> 586138410
B88: 'North West | C88: 19102130 | D88: 655121 | E88: 1445 | F88: 124026488 | G88: =SUM(RC[-4]:RC[-1]) -> 143785184 | H88: 21396101 | I88: 749725 | J88: 3192 | K88: 125421127 | L88: =SUM(RC[-4]:RC[-1]) -> 147570145 | M88: =RC[-10]+RC[-5] -> 40498231 | N88: =RC[-10]+RC[-5] -> 1404846 | O88: =RC[-10]+RC[-5] -> 4637 | P88: =RC[-10]+RC[-5] -> 249447615 | Q88: =RC[-10]+RC[-5] -> 291355329 | R88: 23083677 | S88: 695108 | T88: 3322 | U88: 132156246 | V88: =SUM(RC[-4]:RC[-1]) -> 155938353 | W88: =RC[-10]+RC[-5] -> 63581908 | X88: =RC[-10]+RC[-5] -> 2099954 | Y88: =RC[-10]+RC[-5] -> 7959 | Z88: =RC[-10]+RC[-5] -> 381603861 | AA88: =RC[-10]+RC[-5] -> 447293682 | AB88: 0 | AD88: 'North West | AE88: 22998782 | AF88: 523284 | AG88: 3215 | AH88: 131059167 | AI88: =RC[-4]+RC[-12] -> 86580690 | AJ88: =RC[-4]+RC[-12] -> 2623238 | AK88: =RC[-4]+RC[-12] -> 11174 | AL88: =RC[-4]+RC[-12] -> 512663028
B89: 'Northern Cape | C89: 13278317 | D89: 159645 | E89: 0 | F89: 42304554 | G89: =SUM(RC[-4]:RC[-1]) -> 55742516 | H89: 13413841 | I89: 181431 | J89: 0 | K89: 40501475 | L89: =SUM(RC[-4]:RC[-1]) -> 54096747 | M89: =RC[-10]+RC[-5] -> 26692158 | N89: =RC[-10]+RC[-5] -> 341076 | O89: =RC[-10]+RC[-5] -> 0 | P89: =RC[-10]+RC[-5] -> 82806029 | Q89: =RC[-10]+RC[-5] -> 109839263 | R89: 15051622 | S89: 195178 | T89: 0 | U89: 44618124 | V89: =SUM(RC[-4]:RC[-1]) -> 59864924 | W89: =RC[-10]+RC[-5] -> 41743780 | X89: =RC[-10]+RC[-5] -> 536254 | Y89: =RC[-10]+RC[-5] -> 0 | Z89: =RC[-10]+RC[-5] -> 127424153 | AA89: =RC[-10]+RC[-5] -> 169704187 | AB89: 0 | AD89: 'Northern Cape | AE89: 15262760 | AF89: 146506 | AG89: 0 | AH89: 45023423 | AI89: =RC[-4]+RC[-12] -> 57006540 | AJ89: =RC[-4]+RC[-12] -> 682760 | AK89: =RC[-4]+RC[-12] -> 0 | AL89: =RC[-4]+RC[-12] -> 172447576
B90: 'Northern Province | C90: 18142122 | D90: 461246 | E90: 0 | F90: 99674017 | G90: =SUM(RC[-4]:RC[-1]) -> 118277385 | H90: 18773921 | I90: 676287 | J90: 0 | K90: 95422206 | L90: =SUM(RC[-4]:RC[-1]) -> 114872414 | M90: =RC[-10]+RC[-5] -> 36916043 | N90: =RC[-10]+RC[-5] -> 1137533 | O90: =RC[-10]+RC[-5] -> 0 | P90: =RC[-10]+RC[-5] -> 195096223 | Q90: =RC[-10]+RC[-5] -> 233149799 | R90: 20021493 | S90: 726339 | T90: 0 | U90: 103248605 | V90: =SUM(RC[-4]:RC[-1]) -> 123996437 | W90: =RC[-10]+RC[-5] -> 56937536 | X90: =RC[-10]+RC[-5] -> 1863872 | Y90: =RC[-10]+RC[-5] -> 0 | Z90: =RC[-10]+RC[-5] -> 298344828 | AA90: =RC[-10]+RC[-5] -> 357146236 | AB90: 0 | AD90: 'Northern Province | AE90: 20540352 | AF90: 741367 | AG90: 0 | AH90: 103454074 | AI90: =RC[-4]+RC[-12] -> 77477888 | AJ90: =RC[-4]+RC[-12] -> 2605239 | AK90: =RC[-4]+RC[-12] -> 0 | AL90: =RC[-4]+RC[-12] -> 401798902
B91: 'Western Cape | C91: 68492914 | D91: 223906 | E91: 32624 | F91: 403953745 | G91: =SUM(RC[-4]:RC[-1]) -> 472703189 | H91: 69442871 | I91: 659654 | J91: 72401 | K91: 375591536 | L91: =SUM(RC[-4]:RC[-1]) -> 445766462 | M91: =RC[-10]+RC[-5] -> 137935785 | N91: =RC[-10]+RC[-5] -> 883560 | O91: =RC[-10]+RC[-5] -> 105025 | P91: =RC[-10]+RC[-5] -> 779545281 | Q91: =RC[-10]+RC[-5] -> 918469651 | R91: 76309233 | S91: 725943 | T91: 81362 | U91: 397607833 | V91: =SUM(RC[-4]:RC[-1]) -> 474724371 | W91: =RC[-10]+RC[-5] -> 214245018 | X91: =RC[-10]+RC[-5] -> 1609503 | Y91: =RC[-10]+RC[-5] -> 186387 | Z91: =RC[-10]+RC[-5] -> 1177153114 | AA91: =RC[-10]+RC[-5] -> 1393194022 | AB91: 0 | AD91: 'Western Cape | AE91: 84917549 | AF91: 397921 | AG91: 24691 | AH91: 426082785 | AI91: =RC[-4]+RC[-12] -> 299162567 | AJ91: =RC[-4]+RC[-12] -> 2007424 | AK91: =RC[-4]+RC[-12] -> 211078 | AL91: =RC[-4]+RC[-12] -> 1603235899
A92: 'Retail - garages Total | C92: 386409384 | D92: 7021574 | E92: 203241 | F92: 2380884585 | G92: =SUM(RC[-4]:RC[-1]) -> 2774518784 | H92: 405632180 | I92: 9988227 | J92: 631795 | K92: 2314413026 | L92: =SUM(RC[-4]:RC[-1]) -> 2730665228 | M92: =RC[-10]+RC[-5] -> 792041564 | N92: =RC[-10]+RC[-5] -> 17009801 | O92: =RC[-10]+RC[-5] -> 835036 | P92: =RC[-10]+RC[-5] -> 4695297611 | Q92: =RC[-10]+RC[-5] -> 5505184012 | R92: 448224989 | S92: 10807727 | T92: 464795 | U92: 2475483593 | V92: =SUM(RC[-4]:RC[-1]) -> 2934981104 | W92: =RC[-10]+RC[-5] -> 1240266553 | X92: =RC[-10]+RC[-5] -> 27817528 | Y92: =RC[-10]+RC[-5] -> 1299831 | Z92: =RC[-10]+RC[-5] -> 7170781204 | AA92: =RC[-10]+RC[-5] -> 8440165116 | AB92: 0 | AE92: 0 | AF92: 0 | AG92: 0 | AH92: 0 | AI92: =SUM(R[-9]C:R[-1]C) -> 1697876143 | AJ92: =SUM(R[-9]C:R[-1]C) -> 35196579 | AK92: =SUM(R[-9]C:R[-1]C) -> 1426971 | AL92: =SUM(R[-9]C:R[-1]C) -> 9652615918
A93: 'Road Freight | B93: 'Eastern Cape | C93: 20023937 | D93: 16430 | E93: 0 | F93: 260581 | G93: =SUM(RC[-4]:RC[-1]) -> 20300948 | H93: 13319651 | I93: 1102 | J93: 0 | K93: 257623 | L93: =SUM(RC[-4]:RC[-1]) -> 13578376 | M93: =RC[-10]+RC[-5] -> 33343588 | N93: =RC[-10]+RC[-5] -> 17532 | O93: =RC[-10]+RC[-5] -> 0 | P93: =RC[-10]+RC[-5] -> 518204 | Q93: =RC[-10]+RC[-5] -> 33879324 | R93: 17863971 | S93: 260 | T93: 0 | U93: 316960 | V93: =SUM(RC[-4]:RC[-1]) -> 18181191 | W93: =RC[-10]+RC[-5] -> 51207559 | X93: =RC[-10]+RC[-5] -> 17792 | Y93: =RC[-10]+RC[-5] -> 0 | Z93: =RC[-10]+RC[-5] -> 835164 | AA93: =RC[-10]+RC[-5] -> 52060515 | AB93: '10 | AC93: 'Road Haulage | AD93: 'Eastern Cape | AE93: 16631478 | AF93: 803 | AG93: 0 | AH93: 289792 | AI93: =RC[-4]+RC[-12] -> 67839037 | AJ93: =RC[-4]+RC[-12] -> 18595 | AK93: =RC[-4]+RC[-12] -> 0 | AL93: =RC[-4]+RC[-12] -> 1124956
B94: 'Free State | C94: 14277217 | D94: 2315 | E94: 0 | F94: 141208 | G94: =SUM(RC[-4]:RC[-1]) -> 14420740 | H94: 12289977 | I94: 1680 | J94: 0 | K94: 121794 | L94: =SUM(RC[-4]:RC[-1]) -> 12413451 | M94: =RC[-10]+RC[-5] -> 26567194 | N94: =RC[-10]+RC[-5] -> 3995 | O94: =RC[-10]+RC[-5] -> 0 | P94: =RC[-10]+RC[-5] -> 263002 | Q94: =RC[-10]+RC[-5] -> 26834191 | R94: 14581427 | S94: 1700 | T94: 0 | U94: 127374 | V94: =SUM(RC[-4]:RC[-1]) -> 14710501 | W94: =RC[-10]+RC[-5] -> 41148621 | X94: =RC[-10]+RC[-5] -> 5695 | Y94: =RC[-10]+RC[-5] -> 0 | Z94: =RC[-10]+RC[-5] -> 390376 | AA94: =RC[-10]+RC[-5] -> 41544692 | AB94: 0 | AD94: 'Free State | AE94: 16164340 | AF94: 7330 | AG94: 0 | AH94: 102648 | AI94: =RC[-4]+RC[-12] -> 57312961 | AJ94: =RC[-4]+RC[-12] -> 13025 | AK94: =RC[-4]+RC[-12] -> 0 | AL94: =RC[-4]+RC[-12] -> 493024
B95: 'Gauteng | C95: 63590170 | D95: 28410 | E95: 0 | F95: 3296303 | G95: =SUM(RC[-4]:RC[-1]) -> 66914883 | H95: 60982449 | I95: 65735 | J95: 0 | K95: 3460307 | L95: =SUM(RC[-4]:RC[-1]) -> 64508491 | M95: =RC[-10]+RC[-5] -> 124572619 | N95: =RC[-10]+RC[-5] -> 94145 | O95: =RC[-10]+RC[-5] -> 0 | P95: =RC[-10]+RC[-5] -> 6756610 | Q95: =RC[-10]+RC[-5] -> 131423374 | R95: 66543642 | S95: 55151 | T95: 0 | U95: 3610867 | V95: =SUM(RC[-4]:RC[-1]) -> 70209660 | W95: =RC[-10]+RC[-5] -> 191116261 | X95: =RC[-10]+RC[-5] -> 149296 | Y95: =RC[-10]+RC[-5] -> 0 | Z95: =RC[-10]+RC[-5] -> 10367477 | AA95: =RC[-10]+RC[-5] -> 201633034 | AB95: 0 | AD95: 'Gauteng | AE95: 64664667 | AF95: 162452 | AG95: 0 | AH95: 2927092 | AI95: =RC[-4]+RC[-12] -> 255780928 | AJ95: =RC[-4]+RC[-12] -> 311748 | AK95: =RC[-4]+RC[-12] -> 0 | AL95: =RC[-4]+RC[-12] -> 13294569
B96: 'KwaZulu Natal | C96: 50465114 | D96: 74591 | E96: 0 | F96: 1345822 | G96: =SUM(RC[-4]:RC[-1]) -> 51885527 | H96: 59760372 | I96: 73087 | J96: 0 | K96: 1309496 | L96: =SUM(RC[-4]:RC[-1]) -> 61142955 | M96: =RC[-10]+RC[-5] -> 110225486 | N96: =RC[-10]+RC[-5] -> 147678 | O96: =RC[-10]+RC[-5] -> 0 | P96: =RC[-10]+RC[-5] -> 2655318 | Q96: =RC[-10]+RC[-5] -> 113028482 | R96: 71682873 | S96: 106667 | T96: 0 | U96: 1362893 | V96: =SUM(RC[-4]:RC[-1]) -> 73152433 | W96: =RC[-10]+RC[-5] -> 181908359 | X96: =RC[-10]+RC[-5] -> 254345 | Y96: =RC[-10]+RC[-5] -> 0 | Z96: =RC[-10]+RC[-5] -> 4018211 | AA96: =RC[-10]+RC[-5] -> 186180915 | AB96: 0 | AD96: 'KwaZulu Natal | AE96: 62199242 | AF96: 96744 | AG96: 0 | AH96: 1478781 | AI96: =RC[-4]+RC[-12] -> 244107601 | AJ96: =RC[-4]+RC[-12] -> 351089 | AK96: =RC[-4]+RC[-12] -> 0 | AL96: =RC[-4]+RC[-12] -> 5496992
B97: 'Mpumalanga | C97: 13301942 | D97: 45123 | E97: 0 | F97: 99847 | G97: =SUM(RC[-4]:RC[-1]) -> 13446912 | H97: 15256292 | I97: 15422 | J97: 0 | K97: 107442 | L97: =SUM(RC[-4]:RC[-1]) -> 15379156 | M97: =RC[-10]+RC[-5] -> 28558234 | N97: =RC[-10]+RC[-5] -> 60545 | O97: =RC[-10]+RC[-5] -> 0 | P97: =RC[-10]+RC[-5] -> 207289 | Q97: =RC[-10]+RC[-5] -> 28826068 | R97: 16076460 | S97: 6001 | T97: 0 | U97: 180829 | V97: =SUM(RC[-4]:RC[-1]) -> 16263290 | W97: =RC[-10]+RC[-5] -> 44634694 | X97: =RC[-10]+RC[-5] -> 66546 | Y97: =RC[-10]+RC[-5] -> 0 | Z97: =RC[-10]+RC[-5] -> 388118 | AA97: =RC[-10]+RC[-5] -> 45089358 | AB97: 0 | AD97: 'Mpumalanga | AE97: 15659853 | AF97: 4892 | AG97: 0 | AH97: 92628 | AI97: =RC[-4]+RC[-12] -> 60294547 | AJ97: =RC[-4]+RC[-12] -> 71438 | AK97: =RC[-4]+RC[-12] -> 0 | AL97: =RC[-4]+RC[-12] -> 480746
B98: 'North West | C98: 12918501 | D98: 68571 | E98: 0 | F98: 36522 | G98: =SUM(RC[-4]:RC[-1]) -> 13023594 | H98: 13353913 | I98: 33334 | J98: 0 | K98: 49076 | L98: =SUM(RC[-4]:RC[-1]) -> 13436323 | M98: =RC[-10]+RC[-5] -> 26272414 | N98: =RC[-10]+RC[-5] -> 101905 | O98: =RC[-10]+RC[-5] -> 0 | P98: =RC[-10]+RC[-5] -> 85598 | Q98: =RC[-10]+RC[-5] -> 26459917 | R98: 15392809 | S98: 3337 | T98: 0 | U98: 51406 | V98: =SUM(RC[-4]:RC[-1]) -> 15447552 | W98: =RC[-10]+RC[-5] -> 41665223 | X98: =RC[-10]+RC[-5] -> 105242 | Y98: =RC[-10]+RC[-5] -> 0 | Z98: =RC[-10]+RC[-5] -> 137004 | AA98: =RC[-10]+RC[-5] -> 41907469 | AB98: 0 | AD98: 'North West | AE98: 15534442 | AF98: 22469 | AG98: 0 | AH98: 46577 | AI98: =RC[-4]+RC[-12] -> 57199665 | AJ98: =RC[-4]+RC[-12] -> 127711 | AK98: =RC[-4]+RC[-12] -> 0 | AL98: =RC[-4]+RC[-12] -> 183581
B99: 'Northern Cape | C99: 4321733 | D99: 200 | E99: 0 | F99: 27437 | G99: =SUM(RC[-4]:RC[-1]) -> 4349370 | H99: 2406810 | I99: 40 | J99: 0 | K99: 32001 | L99: =SUM(RC[-4]:RC[-1]) -> 2438851 | M99: =RC[-10]+RC[-5] -> 6728543 | N99: =RC[-10]+RC[-5] -> 240 | O99: =RC[-10]+RC[-5] -> 0 | P99: =RC[-10]+RC[-5] -> 59438 | Q99: =RC[-10]+RC[-5] -> 6788221 | R99: 3795568 | S99: 38741 | T99: 0 | U99: 26922 | V99: =SUM(RC[-4]:RC[-1]) -> 3861231 | W99: =RC[-10]+RC[-5] -> 10524111 | X99: =RC[-10]+RC[-5] -> 38981 | Y99: =RC[-10]+RC[-5] -> 0 | Z99: =RC[-10]+RC[-5] -> 86360 | AA99: =RC[-10]+RC[-5] -> 10649452 | AB99: 0 | AD99: 'Northern Cape | AE99: 4240068 | AF99: 47907 | AG99: 0 | AH99: 33261 | AI99: =RC[-4]+RC[-12] -> 14764179 | AJ99: =RC[-4]+RC[-12] -> 86888 | AK99: =RC[-4]+RC[-12] -> 0 | AL99: =RC[-4]+RC[-12] -> 119621
B100: 'Northern Province | C100: 3904904 | D100: 600 | E100: 0 | F100: 130793 | G100: =SUM(RC[-4]:RC[-1]) -> 4036297 | H100: 3705392 | I100: 800 | J100: 0 | K100: -50483 | L100: =SUM(RC[-4]:RC[-1]) -> 3655709 | M100: =RC[-10]+RC[-5] -> 7610296 | N100: =RC[-10]+RC[-5] -> 1400 | O100: =RC[-10]+RC[-5] -> 0 | P100: =RC[-10]+RC[-5] -> 80310 | Q100: =RC[-10]+RC[-5] -> 7692006 | R100: 4258110 | S100: 400 | T100: 0 | U100: 36126 | V100: =SUM(RC[-4]:RC[-1]) -> 4294636 | W100: =RC[-10]+RC[-5] -> 11868406 | X100: =RC[-10]+RC[-5] -> 1800 | Y100: =RC[-10]+RC[-5] -> 0 | Z100: =RC[-10]+RC[-5] -> 116436 | AA100: =RC[-10]+RC[-5] -> 11986642 | AB100: 0 | AD100: 'Northern Province | AE100: 3719889 | AF100: 800 | AG100: 0 | AH100: 4000 | AI100: =RC[-4]+RC[-12] -> 15588295 | AJ100: =RC[-4]+RC[-12] -> 2600 | AK100: =RC[-4]+RC[-12] -> 0 | AL100: =RC[-4]+RC[-12] -> 120436
B101: 'Western Cape | C101: 26718232 | D101: 140623 | E101: 3576 | F101: 555120 | G101: =SUM(RC[-4]:RC[-1]) -> 27417551 | H101: 21681916 | I101: 121746 | J101: 1038 | K101: 402728 | L101: =SUM(RC[-4]:RC[-1]) -> 22207428 | M101: =RC[-10]+RC[-5] -> 48400148 | N101: =RC[-10]+RC[-5] -> 262369 | O101: =RC[-10]+RC[-5] -> 4614 | P101: =RC[-10]+RC[-5] -> 957848 | Q101: =RC[-10]+RC[-5] -> 49624979 | R101: 25600629 | S101: 523611 | T101: 1168 | U101: 475146 | V101: =SUM(RC[-4]:RC[-1]) -> 26600554 | W101: =RC[-10]+RC[-5] -> 74000777 | X101: =RC[-10]+RC[-5] -> 785980 | Y101: =RC[-10]+RC[-5] -> 5782 | Z101: =RC[-10]+RC[-5] -> 1432994 | AA101: =RC[-10]+RC[-5] -> 76225533 | AB101: 0 | AD101: 'Western Cape | AE101: 25332053 | AF101: 787209 | AG101: 1048 | AH101: 584208 | AI101: =RC[-4]+RC[-12] -> 99332830 | AJ101: =RC[-4]+RC[-12] -> 1573189 | AK101: =RC[-4]+RC[-12] -> 6830 | AL101: =RC[-4]+RC[-12] -> 2017202
A102: 'Road Freight Total | C102: 209521750 | D102: 376863 | E102: 3576 | F102: 5893633 | G102: =SUM(RC[-4]:RC[-1]) -> 215795822 | H102: 202756772 | I102: 312946 | J102: 1038 | K102: 5689984 | L102: =SUM(RC[-4]:RC[-1]) -> 208760740 | M102: =RC[-10]+RC[-5] -> 412278522 | N102: =RC[-10]+RC[-5] -> 689809 | O102: =RC[-10]+RC[-5] -> 4614 | P102: =RC[-10]+RC[-5] -> 11583617 | Q102: =RC[-10]+RC[-5] -> 424556562 | R102: 235795489 | S102: 735868 | T102: 1168 | U102: 6188523 | V102: =SUM(RC[-4]:RC[-1]) -> 242721048 | W102: =RC[-10]+RC[-5] -> 648074011 | X102: =RC[-10]+RC[-5] -> 1425677 | Y102: =RC[-10]+RC[-5] -> 5782 | Z102: =RC[-10]+RC[-5] -> 17772140 | AA102: =RC[-10]+RC[-5] -> 667277610 | AB102: 0 | AE102: 0 | AF102: 0 | AG102: 0 | AH102: 0 | AI102: =SUM(R[-9]C:R[-1]C) -> 872220043 | AJ102: =SUM(R[-9]C:R[-1]C) -> 2556283 | AK102: =SUM(R[-9]C:R[-1]C) -> 6830 | AL102: =SUM(R[-9]C:R[-1]C) -> 23331127
A103: 'Transnet | B103: 'Eastern Cape | C103: 222252 | D103: 2000 | E103: 0 | F103: 0 | G103: =SUM(RC[-4]:RC[-1]) -> 224252 | H103: 2037825 | I103: 3000 | J103: 0 | K103: 0 | L103: =SUM(RC[-4]:RC[-1]) -> 2040825 | M103: =RC[-10]+RC[-5] -> 2260077 | N103: =RC[-10]+RC[-5] -> 5000 | O103: =RC[-10]+RC[-5] -> 0 | P103: =RC[-10]+RC[-5] -> 0 | Q103: =RC[-10]+RC[-5] -> 2265077 | R103: 2848324 | S103: 0 | T103: 0 | U103: 20000 | V103: =SUM(RC[-4]:RC[-1]) -> 2868324 | W103: =RC[-10]+RC[-5] -> 5108401 | X103: =RC[-10]+RC[-5] -> 5000 | Y103: =RC[-10]+RC[-5] -> 0 | Z103: =RC[-10]+RC[-5] -> 20000 | AA103: =RC[-10]+RC[-5] -> 5133401 | AB103: '11 | AC103: 'Transnet | AD103: 'Eastern Cape | AE103: 1966117 | AF103: 2000 | AG103: 0 | AH103: 33096 | AI103: =RC[-4]+RC[-12] -> 7074518 | AJ103: =RC[-4]+RC[-12] -> 7000 | AK103: =RC[-4]+RC[-12] -> 0 | AL103: =RC[-4]+RC[-12] -> 53096
B104: 'Free State | C104: 1339761 | D104: 2000 | E104: 0 | F104: 59902 | G104: =SUM(RC[-4]:RC[-1]) -> 1401663 | H104: 2663100 | I104: 2000 | J104: 0 | K104: 0 | L104: =SUM(RC[-4]:RC[-1]) -> 2665100 | M104: =RC[-10]+RC[-5] -> 4002861 | N104: =RC[-10]+RC[-5] -> 4000 | O104: =RC[-10]+RC[-5] -> 0 | P104: =RC[-10]+RC[-5] -> 59902 | Q104: =RC[-10]+RC[-5] -> 4066763 | R104: 4954087 | S104: 4000 | T104: 0 | U104: 0 | V104: =SUM(RC[-4]:RC[-1]) -> 4958087 | W104: =RC[-10]+RC[-5] -> 8956948 | X104: =RC[-10]+RC[-5] -> 8000 | Y104: =RC[-10]+RC[-5] -> 0 | Z104: =RC[-10]+RC[-5] -> 59902 | AA104: =RC[-10]+RC[-5] -> 9024850 | AB104: 0 | AD104: 'Free State | AE104: 7111297 | AF104: 1999 | AG104: 0 | AH104: 2500 | AI104: =RC[-4]+RC[-12] -> 16068245 | AJ104: =RC[-4]+RC[-12] -> 9999 | AK104: =RC[-4]+RC[-12] -> 0 | AL104: =RC[-4]+RC[-12] -> 62402
B105: 'Gauteng | C105: 29729417 | D105: 80 | E105: 0 | F105: 31790 | G105: =SUM(RC[-4]:RC[-1]) -> 29761287 | H105: 32966382 | I105: 5120 | J105: 0 | K105: 60493 | L105: =SUM(RC[-4]:RC[-1]) -> 33031995 | M105: =RC[-10]+RC[-5] -> 62695799 | N105: =RC[-10]+RC[-5] -> 5200 | O105: =RC[-10]+RC[-5] -> 0 | P105: =RC[-10]+RC[-5] -> 92283 | Q105: =RC[-10]+RC[-5] -> 62793282 | R105: 33786376 | S105: 720 | T105: 0 | U105: 30464 | V105: =SUM(RC[-4]:RC[-1]) -> 33817560 | W105: =RC[-10]+RC[-5] -> 96482175 | X105: =RC[-10]+RC[-5] -> 5920 | Y105: =RC[-10]+RC[-5] -> 0 | Z105: =RC[-10]+RC[-5] -> 122747 | AA105: =RC[-10]+RC[-5] -> 96610842 | AB105: 0 | AD105: 'Gauteng | AE105: 33142715 | AF105: 2200 | AG105: 0 | AH105: 5806 | AI105: =RC[-4]+RC[-12] -> 129624890 | AJ105: =RC[-4]+RC[-12] -> 8120 | AK105: =RC[-4]+RC[-12] -> 0 | AL105: =RC[-4]+RC[-12] -> 128553
B106: 'KwaZulu Natal | C106: 6486186 | D106: 10000 | E106: 0 | F106: 166243 | G106: =SUM(RC[-4]:RC[-1]) -> 6662429 | H106: 7760571 | I106: 41305 | J106: 0 | K106: 200926 | L106: =SUM(RC[-4]:RC[-1]) -> 8002802 | M106: =RC[-10]+RC[-5] -> 14246757 | N106: =RC[-10]+RC[-5] -> 51305 | O106: =RC[-10]+RC[-5] -> 0 | P106: =RC[-10]+RC[-5] -> 367169 | Q106: =RC[-10]+RC[-5] -> 14665231 | R106: 8687989 | S106: 4360 | T106: 0 | U106: 119804 | V106: =SUM(RC[-4]:RC[-1]) -> 8812153 | W106: =RC[-10]+RC[-5] -> 22934746 | X106: =RC[-10]+RC[-5] -> 55665 | Y106: =RC[-10]+RC[-5] -> 0 | Z106: =RC[-10]+RC[-5] -> 486973 | AA106: =RC[-10]+RC[-5] -> 23477384 | AB106: 0 | AD106: 'KwaZulu Natal | AE106: 12822694 | AF106: 200 | AG106: 0 | AH106: 178423 | AI106: =RC[-4]+RC[-12] -> 35757440 | AJ106: =RC[-4]+RC[-12] -> 55865 | AK106: =RC[-4]+RC[-12] -> 0 | AL106: =RC[-4]+RC[-12] -> 665396
B107: 'Mpumalanga | C107: 2079716 | D107: 0 | E107: 0 | F107: 15957 | G107: =SUM(RC[-4]:RC[-1]) -> 2095673 | H107: 2683426 | I107: 50803 | J107: 0 | K107: 33176 | L107: =SUM(RC[-4]:RC[-1]) -> 2767405 | M107: =RC[-10]+RC[-5] -> 4763142 | N107: =RC[-10]+RC[-5] -> 50803 | O107: =RC[-10]+RC[-5] -> 0 | P107: =RC[-10]+RC[-5] -> 49133 | Q107: =RC[-10]+RC[-5] -> 4863078 | R107: 3451467 | S107: 0 | T107: 0 | U107: 0 | V107: =SUM(RC[-4]:RC[-1]) -> 3451467 | W107: =RC[-10]+RC[-5] -> 8214609 | X107: =RC[-10]+RC[-5] -> 50803 | Y107: =RC[-10]+RC[-5] -> 0 | Z107: =RC[-10]+RC[-5] -> 49133 | AA107: =RC[-10]+RC[-5] -> 8314545 | AB107: 0 | AD107: 'Mpumalanga | AE107: 6474559 | AF107: 0 | AG107: 0 | AH107: 11088 | AI107: =RC[-4]+RC[-12] -> 14689168 | AJ107: =RC[-4]+RC[-12] -> 50803 | AK107: =RC[-4]+RC[-12] -> 0 | AL107: =RC[-4]+RC[-12] -> 60221
B108: 'North West | C108: 109309 | D108: 0 | E108: 0 | F108: 34547 | G108: =SUM(RC[-4]:RC[-1]) -> 143856 | H108: 392787 | I108: 0 | J108: 0 | K108: 20010 | L108: =SUM(RC[-4]:RC[-1]) -> 412797 | M108: =RC[-10]+RC[-5] -> 502096 | N108: =RC[-10]+RC[-5] -> 0 | O108: =RC[-10]+RC[-5] -> 0 | P108: =RC[-10]+RC[-5] -> 54557 | Q108: =RC[-10]+RC[-5] -> 556653 | R108: 392417 | S108: 0 | T108: 0 | U108: 10000 | V108: =SUM(RC[-4]:RC[-1]) -> 402417 | W108: =RC[-10]+RC[-5] -> 894513 | X108: =RC[-10]+RC[-5] -> 0 | Y108: =RC[-10]+RC[-5] -> 0 | Z108: =RC[-10]+RC[-5] -> 64557 | AA108: =RC[-10]+RC[-5] -> 959070 | AB108: 0 | AD108: 'North West | AE108: 822667 | AF108: 0 | AG108: 0 | AH108: 11000 | AI108: =RC[-4]+RC[-12] -> 1717180 | AJ108: =RC[-4]+RC[-12] -> 0 | AK108: =RC[-4]+RC[-12] -> 0 | AL108: =RC[-4]+RC[-12] -> 75557
B109: 'Northern Cape | C109: 2893137 | D109: 0 | E109: 0 | F109: 0 | G109: =SUM(RC[-4]:RC[-1]) -> 2893137 | H109: 869815 | I109: 1180 | J109: 0 | K109: 0 | L109: =SUM(RC[-4]:RC[-1]) -> 870995 | M109: =RC[-10]+RC[-5] -> 3762952 | N109: =RC[-10]+RC[-5] -> 1180 | O109: =RC[-10]+RC[-5] -> 0 | P109: =RC[-10]+RC[-5] -> 0 | Q109: =RC[-10]+RC[-5] -> 3764132 | R109: 475687 | S109: 1540 | T109: 0 | U109: 0 | V109: =SUM(RC[-4]:RC[-1]) -> 477227 | W109: =RC[-10]+RC[-5] -> 4238639 | X109: =RC[-10]+RC[-5] -> 2720 | Y109: =RC[-10]+RC[-5] -> 0 | Z109: =RC[-10]+RC[-5] -> 0 | AA109: =RC[-10]+RC[-5] -> 4241359 | AB109: 0 | AD109: 'Northern Cape | AE109: 125007 | AF109: 1900 | AG109: 0 | AH109: 0 | AI109: =RC[-4]+RC[-12] -> 4363646 | AJ109: =RC[-4]+RC[-12] -> 4620 | AK109: =RC[-4]+RC[-12] -> 0 | AL109: =RC[-4]+RC[-12] -> 0
B110: 'Northern Province | C110: 2041416 | D110: 0 | E110: 0 | F110: 0 | G110: =SUM(RC[-4]:RC[-1]) -> 2041416 | H110: 1661402 | I110: 0 | J110: 0 | K110: 0 | L110: =SUM(RC[-4]:RC[-1]) -> 1661402 | M110: =RC[-10]+RC[-5] -> 3702818 | N110: =RC[-10]+RC[-5] -> 0 | O110: =RC[-10]+RC[-5] -> 0 | P110: =RC[-10]+RC[-5] -> 0 | Q110: =RC[-10]+RC[-5] -> 3702818 | R110: 1887212 | S110: 0 | T110: 0 | U110: 0 | V110: =SUM(RC[-4]:RC[-1]) -> 1887212 | W110: =RC[-10]+RC[-5] -> 5590030 | X110: =RC[-10]+RC[-5] -> 0 | Y110: =RC[-10]+RC[-5] -> 0 | Z110: =RC[-10]+RC[-5] -> 0 | AA110: =RC[-10]+RC[-5] -> 5590030 | AB110: 0 | AD110: 'Northern Province | AE110: 1336903 | AF110: 0 | AG110: 0 | AH110: 0 | AI110: =RC[-4]+RC[-12] -> 6926933 | AJ110: =RC[-4]+RC[-12] -> 0 | AK110: =RC[-4]+RC[-12] -> 0 | AL110: =RC[-4]+RC[-12] -> 0
B111: 'Western Cape | C111: 7633332 | D111: 5000 | E111: 0 | F111: 189484 | G111: =SUM(RC[-4]:RC[-1]) -> 7827816 | H111: 5837807 | I111: 6511 | J111: 0 | K111: 185638 | L111: =SUM(RC[-4]:RC[-1]) -> 6029956 | M111: =RC[-10]+RC[-5] -> 13471139 | N111: =RC[-10]+RC[-5] -> 11511 | O111: =RC[-10]+RC[-5] -> 0 | P111: =RC[-10]+RC[-5] -> 375122 | Q111: =RC[-10]+RC[-5] -> 13857772 | R111: 5695550 | S111: 3700 | T111: 0 | U111: 171139 | V111: =SUM(RC[-4]:RC[-1]) -> 5870389 | W111: =RC[-10]+RC[-5] -> 19166689 | X111: =RC[-10]+RC[-5] -> 15211 | Y111: =RC[-10]+RC[-5] -> 0 | Z111: =RC[-10]+RC[-5] -> 546261 | AA111: =RC[-10]+RC[-5] -> 19728161 | AB111: 0 | AD111: 'Western Cape | AE111: 5938937 | AF111: 5600 | AG111: 0 | AH111: 121656 | AI111: =RC[-4]+RC[-12] -> 25105626 | AJ111: =RC[-4]+RC[-12] -> 20811 | AK111: =RC[-4]+RC[-12] -> 0 | AL111: =RC[-4]+RC[-12] -> 667917
A112: 'Transnet Total | C112: 52534526 | D112: 19080 | E112: 0 | F112: 497923 | G112: =SUM(RC[-4]:RC[-1]) -> 53051529 | H112: 56873115 | I112: 109919 | J112: 0 | K112: 500243 | L112: =SUM(RC[-4]:RC[-1]) -> 57483277 | M112: =RC[-10]+RC[-5] -> 109407641 | N112: =RC[-10]+RC[-5] -> 128999 | O112: =RC[-10]+RC[-5] -> 0 | P112: =RC[-10]+RC[-5] -> 998166 | Q112: =RC[-10]+RC[-5] -> 110534806 | R112: 62179109 | S112: 14320 | T112: 0 | U112: 351407 | V112: =SUM(RC[-4]:RC[-1]) -> 62544836 | W112: =RC[-10]+RC[-5] -> 171586750 | X112: =RC[-10]+RC[-5] -> 143319 | Y112: =RC[-10]+RC[-5] -> 0 | Z112: =RC[-10]+RC[-5] -> 1349573 | AA112: =RC[-10]+RC[-5] -> 173079642 | AB112: 0 | AE112: 0 | AF112: 0 | AG112: 0 | AH112: 0 | AI112: =SUM(R[-9]C:R[-1]C) -> 241327646 | AJ112: =SUM(R[-9]C:R[-1]C) -> 157218 | AK112: =SUM(R[-9]C:R[-1]C) -> 0 | AL112: =SUM(R[-9]C:R[-1]C) -> 1713142
A113: 'Agricultural Co-ops & Farmers | B113: 'Eastern Cape | C113: 18644183 | D113: 5538504 | E113: 12505 | F113: 729956 | G113: =SUM(RC[-4]:RC[-1]) -> 24925148 | H113: 17480704 | I113: 7983604 | J113: 2579 | K113: 1499517 | L113: =SUM(RC[-4]:RC[-1]) -> 26966404 | M113: =RC[-10]+RC[-5] -> 36124887 | N113: =RC[-10]+RC[-5] -> 13522108 | O113: =RC[-10]+RC[-5] -> 15084 | P113: =RC[-10]+RC[-5] -> 2229473 | Q113: =RC[-10]+RC[-5] -> 51891552 | R113: 17768742 | S113: 9577721 | T113: 0 | U113: 1486822 | V113: =SUM(RC[-4]:RC[-1]) -> 28833285 | W113: =RC[-10]+RC[-5] -> 53893629 | X113: =RC[-10]+RC[-5] -> 23099829 | Y113: =RC[-10]+RC[-5] -> 15084 | Z113: =RC[-10]+RC[-5] -> 3716295 | AA113: =RC[-10]+RC[-5] -> 80724837 | AB113: '12 | AC113: 'Agricult | AD113: 'Eastern Cape | AE113: 15722795 | AF113: 6010593 | AG113: 0 | AH113: 1622768 | AI113: =RC[-4]+RC[-12] -> 69616424 | AJ113: =RC[-4]+RC[-12] -> 29110422 | AK113: =RC[-4]+RC[-12] -> 15084 | AL113: =RC[-4]+RC[-12] -> 5339063
B114: 'Free State | C114: 49526224 | D114: 1273508 | E114: 16518 | F114: 2545482 | G114: =SUM(RC[-4]:RC[-1]) -> 53361732 | H114: 41357544 | I114: 1517397 | J114: 0 | K114: 2444487 | L114: =SUM(RC[-4]:RC[-1]) -> 45319428 | M114: =RC[-10]+RC[-5] -> 90883768 | N114: =RC[-10]+RC[-5] -> 2790905 | O114: =RC[-10]+RC[-5] -> 16518 | P114: =RC[-10]+RC[-5] -> 4989969 | Q114: =RC[-10]+RC[-5] -> 98681160 | R114: 64127720 | S114: 1741363 | T114: 0 | U114: 3457093 | V114: =SUM(RC[-4]:RC[-1]) -> 69326176 | W114: =RC[-10]+RC[-5] -> 155011488 | X114: =RC[-10]+RC[-5] -> 4532268 | Y114: =RC[-10]+RC[-5] -> 16518 | Z114: =RC[-10]+RC[-5] -> 8447062 | AA114: =RC[-10]+RC[-5] -> 168007336 | AB114: 0 | AD114: 'Free State | AE114: 52250827 | AF114: 1215502 | AG114: 0 | AH114: 3230396 | AI114: =RC[-4]+RC[-12] -> 207262315 | AJ114: =RC[-4]+RC[-12] -> 5747770 | AK114: =RC[-4]+RC[-12] -> 16518 | AL114: =RC[-4]+RC[-12] -> 11677458
B115: 'Gauteng | C115: 15904295 | D115: 1473826 | E115: 33830 | F115: 1813571 | G115: =SUM(RC[-4]:RC[-1]) -> 19225522 | H115: 16219756 | I115: 2101839 | J115: 32756 | K115: 3264413 | L115: =SUM(RC[-4]:RC[-1]) -> 21618764 | M115: =RC[-10]+RC[-5] -> 32124051 | N115: =RC[-10]+RC[-5] -> 3575665 | O115: =RC[-10]+RC[-5] -> 66586 | P115: =RC[-10]+RC[-5] -> 5077984 | Q115: =RC[-10]+RC[-5] -> 40844286 | R115: 26477848 | S115: 5229805 | T115: 22557 | U115: 6263287 | V115: =SUM(RC[-4]:RC[-1]) -> 37993497 | W115: =RC[-10]+RC[-5] -> 58601899 | X115: =RC[-10]+RC[-5] -> 8805470 | Y115: =RC[-10]+RC[-5] -> 89143 | Z115: =RC[-10]+RC[-5] -> 11341271 | AA115: =RC[-10]+RC[-5] -> 78837783 | AB115: 0 | AD115: 'Gauteng | AE115: 20021707 | AF115: 769804 | AG115: 15125 | AH115: 5150577 | AI115: =RC[-4]+RC[-12] -> 78623606 | AJ115: =RC[-4]+RC[-12] -> 9575274 | AK115: =RC[-4]+RC[-12] -> 104268 | AL115: =RC[-4]+RC[-12] -> 16491848
B116: 'KwaZulu Natal | C116: 29163313 | D116: 1880658 | E116: 0 | F116: 5520698 | G116: =SUM(RC[-4]:RC[-1]) -> 36564669 | H116: 34431585 | I116: 2675300 | J116: 0 | K116: 5729706 | L116: =SUM(RC[-4]:RC[-1]) -> 42836591 | M116: =RC[-10]+RC[-5] -> 63594898 | N116: =RC[-10]+RC[-5] -> 4555958 | O116: =RC[-10]+RC[-5] -> 0 | P116: =RC[-10]+RC[-5] -> 11250404 | Q116: =RC[-10]+RC[-5] -> 79401260 | R116: 42345622 | S116: 3276492 | T116: 0 | U116: 8366909 | V116: =SUM(RC[-4]:RC[-1]) -> 53989023 | W116: =RC[-10]+RC[-5] -> 105940520 | X116: =RC[-10]+RC[-5] -> 7832450 | Y116: =RC[-10]+RC[-5] -> 0 | Z116: =RC[-10]+RC[-5] -> 19617313 | AA116: =RC[-10]+RC[-5] -> 133390283 | AB116: 0 | AD116: 'KwaZulu Natal | AE116: 35763263 | AF116: 1794282 | AG116: 0 | AH116: 6976705 | AI116: =RC[-4]+RC[-12] -> 141703783 | AJ116: =RC[-4]+RC[-12] -> 9626732 | AK116: =RC[-4]+RC[-12] -> 0 | AL116: =RC[-4]+RC[-12] -> 26594018
B117: 'Mpumalanga | C117: 30945996 | D117: 2905656 | E117: 0 | F117: 2372454 | G117: =SUM(RC[-4]:RC[-1]) -> 36224106 | H117: 36252403 | I117: 3320118 | J117: 0 | K117: 2288100 | L117: =SUM(RC[-4]:RC[-1]) -> 41860621 | M117: =RC[-10]+RC[-5] -> 67198399 | N117: =RC[-10]+RC[-5] -> 6225774 | O117: =RC[-10]+RC[-5] -> 0 | P117: =RC[-10]+RC[-5] -> 4660554 | Q117: =RC[-10]+RC[-5] -> 78084727 | R117: 45582137 | S117: 4521825 | T117: 0 | U117: 5300287 | V117: =SUM(RC[-4]:RC[-1]) -> 55404249 | W117: =RC[-10]+RC[-5] -> 112780536 | X117: =RC[-10]+RC[-5] -> 10747599 | Y117: =RC[-10]+RC[-5] -> 0 | Z117: =RC[-10]+RC[-5] -> 9960841 | AA117: =RC[-10]+RC[-5] -> 133488976 | AB117: 0 | AD117: 'Mpumalanga | AE117: 31531413 | AF117: 1547285 | AG117: 0 | AH117: 3450547 | AI117: =RC[-4]+RC[-12] -> 144311949 | AJ117: =RC[-4]+RC[-12] -> 12294884 | AK117: =RC[-4]+RC[-12] -> 0 | AL117: =RC[-4]+RC[-12] -> 13411388
B118: 'North West | C118: 27371525 | D118: 1382152 | E118: 0 | F118: 2431932 | G118: =SUM(RC[-4]:RC[-1]) -> 31185609 | H118: 34024028 | I118: 1833369 | J118: 0 | K118: 3131352 | L118: =SUM(RC[-4]:RC[-1]) -> 38988749 | M118: =RC[-10]+RC[-5] -> 61395553 | N118: =RC[-10]+RC[-5] -> 3215521 | O118: =RC[-10]+RC[-5] -> 0 | P118: =RC[-10]+RC[-5] -> 5563284 | Q118: =RC[-10]+RC[-5] -> 70174358 | R118: 48070062 | S118: 1783873 | T118: 0 | U118: 5349914 | V118: =SUM(RC[-4]:RC[-1]) -> 55203849 | W118: =RC[-10]+RC[-5] -> 109465615 | X118: =RC[-10]+RC[-5] -> 4999394 | Y118: =RC[-10]+RC[-5] -> 0 | Z118: =RC[-10]+RC[-5] -> 10913198 | AA118: =RC[-10]+RC[-5] -> 125378207 | AB118: 0 | AD118: 'North West | AE118: 42101225 | AF118: 1354060 | AG118: 0 | AH118: 4744072 | AI118: =RC[-4]+RC[-12] -> 151566840 | AJ118: =RC[-4]+RC[-12] -> 6353454 | AK118: =RC[-4]+RC[-12] -> 0 | AL118: =RC[-4]+RC[-12] -> 15657270
B119: 'Northern Cape | C119: 10756767 | D119: 364632 | E119: 30426 | F119: 1316428 | G119: =SUM(RC[-4]:RC[-1]) -> 12468253 | H119: 9642926 | I119: 496420 | J119: 11595 | K119: 972596 | L119: =SUM(RC[-4]:RC[-1]) -> 11123537 | M119: =RC[-10]+RC[-5] -> 20399693 | N119: =RC[-10]+RC[-5] -> 861052 | O119: =RC[-10]+RC[-5] -> 42021 | P119: =RC[-10]+RC[-5] -> 2289024 | Q119: =RC[-10]+RC[-5] -> 23591790 | R119: 10360195 | S119: 447264 | T119: 0 | U119: 915021 | V119: =SUM(RC[-4]:RC[-1]) -> 11722480 | W119: =RC[-10]+RC[-5] -> 30759888 | X119: =RC[-10]+RC[-5] -> 1308316 | Y119: =RC[-10]+RC[-5] -> 42021 | Z119: =RC[-10]+RC[-5] -> 3204045 | AA119: =RC[-10]+RC[-5] -> 35314270 | AB119: 0 | AD119: 'Northern Cape | AE119: 9390270 | AF119: 306312 | AG119: 0 | AH119: 722542 | AI119: =RC[-4]+RC[-12] -> 40150158 | AJ119: =RC[-4]+RC[-12] -> 1614628 | AK119: =RC[-4]+RC[-12] -> 42021 | AL119: =RC[-4]+RC[-12] -> 3926587
B120: 'Northern Province | C120: 24707080 | D120: 1549951 | E120: 0 | F120: 9059806 | G120: =SUM(RC[-4]:RC[-1]) -> 35316837 | H120: 17850091 | I120: 1113426 | J120: 0 | K120: 7388728 | L120: =SUM(RC[-4]:RC[-1]) -> 26352245 | M120: =RC[-10]+RC[-5] -> 42557171 | N120: =RC[-10]+RC[-5] -> 2663377 | O120: =RC[-10]+RC[-5] -> 0 | P120: =RC[-10]+RC[-5] -> 16448534 | Q120: =RC[-10]+RC[-5] -> 61669082 | R120: 8194082 | S120: -678829 | T120: 0 | U120: 2092564 | V120: =SUM(RC[-4]:RC[-1]) -> 9607817 | W120: =RC[-10]+RC[-5] -> 50751253 | X120: =RC[-10]+RC[-5] -> 1984548 | Y120: =RC[-10]+RC[-5] -> 0 | Z120: =RC[-10]+RC[-5] -> 18541098 | AA120: =RC[-10]+RC[-5] -> 71276899 | AB120: 0 | AD120: 'Northern Province | AE120: 11700161 | AF120: 665104 | AG120: 0 | AH120: 2305725 | AI120: =RC[-4]+RC[-12] -> 62451414 | AJ120: =RC[-4]+RC[-12] -> 2649652 | AK120: =RC[-4]+RC[-12] -> 0 | AL120: =RC[-4]+RC[-12] -> 20846823
B121: 'Western Cape | C121: 32468087 | D121: 1694160 | E121: 250036 | F121: 3580917 | G121: =SUM(RC[-4]:RC[-1]) -> 37993200 | H121: 32980764 | I121: 2302718 | J121: 3000 | K121: 3312032 | L121: =SUM(RC[-4]:RC[-1]) -> 38598514 | M121: =RC[-10]+RC[-5] -> 65448851 | N121: =RC[-10]+RC[-5] -> 3996878 | O121: =RC[-10]+RC[-5] -> 253036 | P121: =RC[-10]+RC[-5] -> 6892949 | Q121: =RC[-10]+RC[-5] -> 76591714 | R121: 33604572 | S121: 2890920 | T121: 0 | U121: 4002585 | V121: =SUM(RC[-4]:RC[-1]) -> 40498077 | W121: =RC[-10]+RC[-5] -> 99053423 | X121: =RC[-10]+RC[-5] -> 6887798 | Y121: =RC[-10]+RC[-5] -> 253036 | Z121: =RC[-10]+RC[-5] -> 10895534 | AA121: =RC[-10]+RC[-5] -> 117089791 | AB121: 0 | AD121: 'Western Cape | AE121: 31912412 | AF121: 1662901 | AG121: 0 | AH121: 3813970 | AI121: =RC[-4]+RC[-12] -> 130965835 | AJ121: =RC[-4]+RC[-12] -> 8550699 | AK121: =RC[-4]+RC[-12] -> 253036 | AL121: =RC[-4]+RC[-12] -> 14709504
A122: 'Agricultural Co-ops & Farmers Total | C122: 239487470 | D122: 18063047 | E122: 343315 | F122: 29371244 | G122: =SUM(RC[-4]:RC[-1]) -> 287265076 | H122: 240239801 | I122: 23344191 | J122: 49930 | K122: 30030931 | L122: =SUM(RC[-4]:RC[-1]) -> 293664853 | M122: =RC[-10]+RC[-5] -> 479727271 | N122: =RC[-10]+RC[-5] -> 41407238 | O122: =RC[-10]+RC[-5] -> 393245 | P122: =RC[-10]+RC[-5] -> 59402175 | Q122: =RC[-10]+RC[-5] -> 580929929 | R122: 296530980 | S122: 28790434 | T122: 22557 | U122: 37234482 | V122: =SUM(RC[-4]:RC[-1]) -> 362578453 | W122: =RC[-10]+RC[-5] -> 776258251 | X122: =RC[-10]+RC[-5] -> 70197672 | Y122: =RC[-10]+RC[-5] -> 415802 | Z122: =RC[-10]+RC[-5] -> 96636657 | AA122: =RC[-10]+RC[-5] -> 943508382 | AB122: 0 | AE122: 0 | AF122: 0 | AG122: 0 | AH122: 0 | AI122: =SUM(R[-9]C:R[-1]C) -> 1026652324 | AJ122: =SUM(R[-9]C:R[-1]C) -> 85523515 | AK122: =SUM(R[-9]C:R[-1]C) -> 430927 | AL122: =SUM(R[-9]C:R[-1]C) -> 128653959
A123: 'Local Authorities | B123: 'Eastern Cape | C123: 1714965 | D123: 5573 | E123: 0 | F123: 1007885 | G123: =SUM(RC[-4]:RC[-1]) -> 2728423 | H123: 1876344 | I123: 10401 | J123: 0 | K123: 970307 | L123: =SUM(RC[-4]:RC[-1]) -> 2857052 | M123: =RC[-10]+RC[-5] -> 3591309 | N123: =RC[-10]+RC[-5] -> 15974 | O123: =RC[-10]+RC[-5] -> 0 | P123: =RC[-10]+RC[-5] -> 1978192 | Q123: =RC[-10]+RC[-5] -> 5585475 | R123: 1746304 | S123: 3860 | T123: 0 | U123: 943307 | V123: =SUM(RC[-4]:RC[-1]) -> 2693471 | W123: =RC[-10]+RC[-5] -> 5337613 | X123: =RC[-10]+RC[-5] -> 19834 | Y123: =RC[-10]+RC[-5] -> 0 | Z123: =RC[-10]+RC[-5] -> 2921499 | AA123: =RC[-10]+RC[-5] -> 8278946 | AB123: '13 | AC123: 'Local Authorities | AD123: 'Eastern Cape | AE123: 1932517 | AF123: 1600 | AG123: 0 | AH123: 1046554 | AI123: =RC[-4]+RC[-12] -> 7270130 | AJ123: =RC[-4]+RC[-12] -> 21434 | AK123: =RC[-4]+RC[-12] -> 0 | AL123: =RC[-4]+RC[-12] -> 3968053
B124: 'Free State | C124: 977123 | D124: 1900 | E124: 0 | F124: 489807 | G124: =SUM(RC[-4]:RC[-1]) -> 1468830 | H124: 883213 | I124: 2530 | J124: 0 | K124: 521213 | L124: =SUM(RC[-4]:RC[-1]) -> 1406956 | M124: =RC[-10]+RC[-5] -> 1860336 | N124: =RC[-10]+RC[-5] -> 4430 | O124: =RC[-10]+RC[-5] -> 0 | P124: =RC[-10]+RC[-5] -> 1011020 | Q124: =RC[-10]+RC[-5] -> 2875786 | R124: 816943 | S124: 3200 | T124: 0 | U124: 473943 | V124: =SUM(RC[-4]:RC[-1]) -> 1294086 | W124: =RC[-10]+RC[-5] -> 2677279 | X124: =RC[-10]+RC[-5] -> 7630 | Y124: =RC[-10]+RC[-5] -> 0 | Z124: =RC[-10]+RC[-5] -> 1484963 | AA124: =RC[-10]+RC[-5] -> 4169872 | AB124: 0 | AD124: 'Free State | AE124: 980251 | AF124: 3800 | AG124: 0 | AH124: 524432 | AI124: =RC[-4]+RC[-12] -> 3657530 | AJ124: =RC[-4]+RC[-12] -> 11430 | AK124: =RC[-4]+RC[-12] -> 0 | AL124: =RC[-4]+RC[-12] -> 2009395
B125: 'Gauteng | C125: 4374959 | D125: 15006 | E125: 0 | F125: 2346046 | G125: =SUM(RC[-4]:RC[-1]) -> 6736011 | H125: 4920074 | I125: 6406 | J125: 5401 | K125: 2394867 | L125: =SUM(RC[-4]:RC[-1]) -> 7326748 | M125: =RC[-10]+RC[-5] -> 9295033 | N125: =RC[-10]+RC[-5] -> 21412 | O125: =RC[-10]+RC[-5] -> 5401 | P125: =RC[-10]+RC[-5] -> 4740913 | Q125: =RC[-10]+RC[-5] -> 14062759 | R125: 4044719 | S125: 16520 | T125: 0 | U125: 2240820 | V125: =SUM(RC[-4]:RC[-1]) -> 6302059 | W125: =RC[-10]+RC[-5] -> 13339752 | X125: =RC[-10]+RC[-5] -> 37932 | Y125: =RC[-10]+RC[-5] -> 5401 | Z125: =RC[-10]+RC[-5] -> 6981733 | AA125: =RC[-10]+RC[-5] -> 20364818 | AB125: 0 | AD125: 'Gauteng | AE125: 4347265 | AF125: 2825 | AG125: 0 | AH125: 2357758 | AI125: =RC[-4]+RC[-12] -> 17687017 | AJ125: =RC[-4]+RC[-12] -> 40757 | AK125: =RC[-4]+RC[-12] -> 5401 | AL125: =RC[-4]+RC[-12] -> 9339491
B126: 'KwaZulu Natal | C126: 1538655 | D126: 13879 | E126: 0 | F126: 854832 | G126: =SUM(RC[-4]:RC[-1]) -> 2407366 | H126: 1067979 | I126: 12103 | J126: 0 | K126: 817689 | L126: =SUM(RC[-4]:RC[-1]) -> 1897771 | M126: =RC[-10]+RC[-5] -> 2606634 | N126: =RC[-10]+RC[-5] -> 25982 | O126: =RC[-10]+RC[-5] -> 0 | P126: =RC[-10]+RC[-5] -> 1672521 | Q126: =RC[-10]+RC[-5] -> 4305137 | R126: 938762 | S126: 8247 | T126: 0 | U126: 749339 | V126: =SUM(RC[-4]:RC[-1]) -> 1696348 | W126: =RC[-10]+RC[-5] -> 3545396 | X126: =RC[-10]+RC[-5] -> 34229 | Y126: =RC[-10]+RC[-5] -> 0 | Z126: =RC[-10]+RC[-5] -> 2421860 | AA126: =RC[-10]+RC[-5] -> 6001485 | AB126: 0 | AD126: 'KwaZulu Natal | AE126: 1169353 | AF126: 1200 | AG126: 0 | AH126: 897481 | AI126: =RC[-4]+RC[-12] -> 4714749 | AJ126: =RC[-4]+RC[-12] -> 35429 | AK126: =RC[-4]+RC[-12] -> 0 | AL126: =RC[-4]+RC[-12] -> 3319341
B127: 'Mpumalanga | C127: 1418133 | D127: 600 | E127: 0 | F127: 440253 | G127: =SUM(RC[-4]:RC[-1]) -> 1858986 | H127: 1466646 | I127: 800 | J127: 0 | K127: 446201 | L127: =SUM(RC[-4]:RC[-1]) -> 1913647 | M127: =RC[-10]+RC[-5] -> 2884779 | N127: =RC[-10]+RC[-5] -> 1400 | O127: =RC[-10]+RC[-5] -> 0 | P127: =RC[-10]+RC[-5] -> 886454 | Q127: =RC[-10]+RC[-5] -> 3772633 | R127: 1265494 | S127: 210 | T127: 0 | U127: 391091 | V127: =SUM(RC[-4]:RC[-1]) -> 1656795 | W127: =RC[-10]+RC[-5] -> 4150273 | X127: =RC[-10]+RC[-5] -> 1610 | Y127: =RC[-10]+RC[-5] -> 0 | Z127: =RC[-10]+RC[-5] -> 1277545 | AA127: =RC[-10]+RC[-5] -> 5429428 | AB127: 0 | AD127: 'Mpumalanga | AE127: 1335889 | AF127: 400 | AG127: 0 | AH127: 445901 | AI127: =RC[-4]+RC[-12] -> 5486162 | AJ127: =RC[-4]+RC[-12] -> 2010 | AK127: =RC[-4]+RC[-12] -> 0 | AL127: =RC[-4]+RC[-12] -> 1723446
B128: 'North West | C128: 1006887 | D128: 800 | E128: 0 | F128: 331386 | G128: =SUM(RC[-4]:RC[-1]) -> 1339073 | H128: 477732 | I128: 1200 | J128: 0 | K128: 314699 | L128: =SUM(RC[-4]:RC[-1]) -> 793631 | M128: =RC[-10]+RC[-5] -> 1484619 | N128: =RC[-10]+RC[-5] -> 2000 | O128: =RC[-10]+RC[-5] -> 0 | P128: =RC[-10]+RC[-5] -> 646085 | Q128: =RC[-10]+RC[-5] -> 2132704 | R128: 531909 | S128: 1200 | T128: 0 | U128: 346433 | V128: =SUM(RC[-4]:RC[-1]) -> 879542 | W128: =RC[-10]+RC[-5] -> 2016528 | X128: =RC[-10]+RC[-5] -> 3200 | Y128: =RC[-10]+RC[-5] -> 0 | Z128: =RC[-10]+RC[-5] -> 992518 | AA128: =RC[-10]+RC[-5] -> 3012246 | AB128: 0 | AD128: 'North West | AE128: 510399 | AF128: 1000 | AG128: 0 | AH128: 343048 | AI128: =RC[-4]+RC[-12] -> 2526927 | AJ128: =RC[-4]+RC[-12] -> 4200 | AK128: =RC[-4]+RC[-12] -> 0 | AL128: =RC[-4]+RC[-12] -> 1335566
B129: 'Northern Cape | C129: 626524 | D129: 280 | E129: 0 | F129: 323193 | G129: =SUM(RC[-4]:RC[-1]) -> 949997 | H129: 488342 | I129: 280 | J129: 0 | K129: 196613 | L129: =SUM(RC[-4]:RC[-1]) -> 685235 | M129: =RC[-10]+RC[-5] -> 1114866 | N129: =RC[-10]+RC[-5] -> 560 | O129: =RC[-10]+RC[-5] -> 0 | P129: =RC[-10]+RC[-5] -> 519806 | Q129: =RC[-10]+RC[-5] -> 1635232 | R129: 554025 | S129: 400 | T129: 0 | U129: 271164 | V129: =SUM(RC[-4]:RC[-1]) -> 825589 | W129: =RC[-10]+RC[-5] -> 1668891 | X129: =RC[-10]+RC[-5] -> 960 | Y129: =RC[-10]+RC[-5] -> 0 | Z129: =RC[-10]+RC[-5] -> 790970 | AA129: =RC[-10]+RC[-5] -> 2460821 | AB129: 0 | AD129: 'Northern Cape | AE129: 508944 | AF129: 280 | AG129: 0 | AH129: 285568 | AI129: =RC[-4]+RC[-12] -> 2177835 | AJ129: =RC[-4]+RC[-12] -> 1240 | AK129: =RC[-4]+RC[-12] -> 0 | AL129: =RC[-4]+RC[-12] -> 1076538
B130: 'Northern Province | C130: 550388 | D130: 9320 | E130: 0 | F130: 334641 | G130: =SUM(RC[-4]:RC[-1]) -> 894349 | H130: 647998 | I130: 9200 | J130: 0 | K130: 367499 | L130: =SUM(RC[-4]:RC[-1]) -> 1024697 | M130: =RC[-10]+RC[-5] -> 1198386 | N130: =RC[-10]+RC[-5] -> 18520 | O130: =RC[-10]+RC[-5] -> 0 | P130: =RC[-10]+RC[-5] -> 702140 | Q130: =RC[-10]+RC[-5] -> 1919046 | R130: 451388 | S130: 9000 | T130: 0 | U130: 299049 | V130: =SUM(RC[-4]:RC[-1]) -> 759437 | W130: =RC[-10]+RC[-5] -> 1649774 | X130: =RC[-10]+RC[-5] -> 27520 | Y130: =RC[-10]+RC[-5] -> 0 | Z130: =RC[-10]+RC[-5] -> 1001189 | AA130: =RC[-10]+RC[-5] -> 2678483 | AB130: 0 | AD130: 'Northern Province | AE130: 514583 | AF130: 7000 | AG130: 0 | AH130: 291876 | AI130: =RC[-4]+RC[-12] -> 2164357 | AJ130: =RC[-4]+RC[-12] -> 34520 | AK130: =RC[-4]+RC[-12] -> 0 | AL130: =RC[-4]+RC[-12] -> 1293065
B131: 'Western Cape | C131: 2989065 | D131: 28628 | E131: 0 | F131: 1804714 | G131: =SUM(RC[-4]:RC[-1]) -> 4822407 | H131: 3279436 | I131: 8700 | J131: 0 | K131: 1889827 | L131: =SUM(RC[-4]:RC[-1]) -> 5177963 | M131: =RC[-10]+RC[-5] -> 6268501 | N131: =RC[-10]+RC[-5] -> 37328 | O131: =RC[-10]+RC[-5] -> 0 | P131: =RC[-10]+RC[-5] -> 3694541 | Q131: =RC[-10]+RC[-5] -> 10000370 | R131: 3004206 | S131: 6210 | T131: 0 | U131: 1946150 | V131: =SUM(RC[-4]:RC[-1]) -> 4956566 | W131: =RC[-10]+RC[-5] -> 9272707 | X131: =RC[-10]+RC[-5] -> 43538 | Y131: =RC[-10]+RC[-5] -> 0 | Z131: =RC[-10]+RC[-5] -> 5640691 | AA131: =RC[-10]+RC[-5] -> 14956936 | AB131: 0 | AD131: 'Western Cape | AE131: 2863454 | AF131: 8234 | AG131: 0 | AH131: 1867103 | AI131: =RC[-4]+RC[-12] -> 12136161 | AJ131: =RC[-4]+RC[-12] -> 51772 | AK131: =RC[-4]+RC[-12] -> 0 | AL131: =RC[-4]+RC[-12] -> 7507794
A132: 'Local Authorities Total | C132: 15196699 | D132: 75986 | E132: 0 | F132: 7932757 | G132: =SUM(RC[-4]:RC[-1]) -> 23205442 | H132: 15107764 | I132: 51620 | J132: 5401 | K132: 7918915 | L132: =SUM(RC[-4]:RC[-1]) -> 23083700 | M132: =RC[-10]+RC[-5] -> 30304463 | N132: =RC[-10]+RC[-5] -> 127606 | O132: =RC[-10]+RC[-5] -> 5401 | P132: =RC[-10]+RC[-5] -> 15851672 | Q132: =RC[-10]+RC[-5] -> 46289142 | R132: 13353750 | S132: 48847 | T132: 0 | U132: 7661296 | V132: =SUM(RC[-4]:RC[-1]) -> 21063893 | W132: =RC[-10]+RC[-5] -> 43658213 | X132: =RC[-10]+RC[-5] -> 176453 | Y132: =RC[-10]+RC[-5] -> 5401 | Z132: =RC[-10]+RC[-5] -> 23512968 | AA132: =RC[-10]+RC[-5] -> 67353035 | AB132: 0 | AI132: =SUM(R[-9]C:R[-1]C) -> 57820868 | AJ132: =SUM(R[-9]C:R[-1]C) -> 202792 | AK132: =SUM(R[-9]C:R[-1]C) -> 5401 | AL132: =SUM(R[-9]C:R[-1]C) -> 31572689
A133: 'Grand Total | C133: 1581074066 | D133: 160521567 | E133: 116638546 | F133: 2543051188 | G133: =SUM(RC[-4]:RC[-1]) -> 4401285367 | H133: 1651936923 | I133: 199230905 | J133: 166903935 | K133: 2478518923 | L133: =SUM(RC[-4]:RC[-1]) -> 4496590686 | M133: =RC[-10]+RC[-5] -> 3233010989 | N133: =RC[-10]+RC[-5] -> 359752472 | O133: =RC[-10]+RC[-5] -> 283542481 | P133: =RC[-10]+RC[-5] -> 5021570111 | Q133: =RC[-10]+RC[-5] -> 8897876053 | R133: 1823612974 | S133: 220387423 | T133: 168738160 | U133: 2656215681 | V133: =SUM(RC[-4]:RC[-1]) -> 4868954238 | W133: =RC[-10]+RC[-5] -> 5056623963 | X133: =RC[-10]+RC[-5] -> 580139895 | Y133: =RC[-10]+RC[-5] -> 452280641 | Z133: =RC[-10]+RC[-5] -> 7677785792 | AA133: =RC[-10]+RC[-5] -> 13766830291 | AI133: =R[-118]C+R[-108]C+R[-98]C+R[-89]C+R[-81]C+R[-71]C+R[-61]C+R[-51]C+R[-41]C+R[-31]C+R[-21]C+R[-11]C+R[-1]C -> 6794125152 | AJ133: =R[-118]C+R[-108]C+R[-98]C+R[-89]C+R[-81]C+R[-71]C+R[-61]C+R[-51]C+R[-41]C+R[-31]C+R[-21]C+R[-11]C+R[-1]C -> 744785590 | AK133: =R[-118]C+R[-108]C+R[-98]C+R[-89]C+R[-81]C+R[-71]C+R[-61]C+R[-51]C+R[-41]C+R[-31]C+R[-21]C+R[-11]C+R[-1]C -> 590172377 | AL133: =R[-118]C+R[-108]C+R[-98]C+R[-89]C+R[-81]C+R[-71]C+R[-61]C+R[-51]C+R[-41]C+R[-31]C+R[-21]C+R[-11]C+R[-1]C -> 10333987931