Sheet: 25+ by Community college region
A1: Educational Attainment for People Age 25 & Over
A2: Source: U.S. Bureau of the Census, 2000 Census of Population & Housing. Calculated from Table P37
A4: Community college regions* | B4: Less than Bachelor's | C4: Bachelor's or Higher
A5: VIRGINIA | B5: 0.70535386345528872 | C5: 0.29464613654471139
A8: Northern Virginia | B8: 0.49290048533729874 | C8: 0.5070995146627012
A9: Piedmont Virginia | B9: 0.67113959686466163 | C9: 0.32886040313533832
A10: Sargeant Reynolds | B10: 0.69338519684112998 | C10: 0.30661480315886996
A11: Thomas Nelson | B11: 0.73926244101731786 | C11: 0.26073755898268208
A12: John Tyler | B12: 0.74880690720947163 | C12: 0.25119309279052843
A13: New River | B13: 0.75609227658213485 | C13: 0.24390772341786518
A14: Tidewater Virginia | B14: 0.76112393159501113 | C14: 0.23887606840498893
A15: Germanna | B15: 0.76323170525031347 | C15: 0.23676829474968647
A16: Rappahannock | B16: 0.77070567305791671 | C16: 0.2292943269420834
A17: Virginia Western | B17: 0.79005664877757897 | C17: 0.209943351222421
A18: Lord Fairfax | B18: 0.80546091377221929 | C18: 0.19453908622778074
A19: Blue Ridge | B19: 0.80853584555543667 | C19: 0.19146415444456338
A20: Central Virginia | B20: 0.81274723842419117 | C20: 0.18725276157580892
A21: Rappahannock | B21: 0.82291548989789276 | C21: 0.17708451010210732
A22: Paul D Camp | B22: 0.83557456443801503 | C22: 0.16442543556198502
A23: Dabney S Lancaster | B23: 0.84003383538147047 | C23: 0.15996616461852958
A24: Virginia Highland | B24: 0.85518098883750826 | C24: 0.1448190111624918
A25: Eastern Shore | B25: 0.85885174294115973 | C25: 0.14114825705884032
A26: Patrick Henry | B26: 0.88095262337979696 | C26: 0.11904737662020302
A27: Southside Virginia | B27: 0.88226500609384506 | C27: 0.11773499390615479
A28: Danville | B28: 0.89190245045854533 | C28: 0.10809754954145465
A29: Southwest Virginia | B29: 0.90481470596093727 | C29: 9.5185294039062715E-2
A30: Mountain Empire | B30: 0.90547492689266762 | C30: 9.4525073107332394E-2

Sheet: original
A1: Table P37. Sex by Educational Attainment for the Population 25 Years & Over
A2: Source: U.S. Bureau of the Census, 2000 Census of Population & Housing
D5: Total population 25 years & over | E5: Males | V5: Females
E6: Total males 25 years & over | F6: No schooling completed | G6: Nursery– grade 4 | H6: Grades 5 & 6 | I6: Grades 7 & 8 | J6: Grade 9 | K6: Grade 10 | L6: Grade 11 | M6: Grade 12, no diploma | N6: HS grad, including GED | O6: Less than 1 year of college | P6: 1 or more years college, no degree | Q6: Associate degree | R6: Bachelor's degree | S6: Master's degree | T6: Professional school degree | U6: Doctoral degree | V6: Total females 25 years & over | W6: No schooling completed | X6: Nursery– grade 4 | Y6: Grades 5 & 6 | Z6: Grades 7 & 8 | AA6: Grade 9 | AB6: Grade 10 | AC6: Grade 11 | AD6: Grade 12, no diploma | AE6: HS grad, including GED | AF6: Less than 1 year of college | AG6: 1 or more years college, no degree | AH6: Associate degree | AI6: Bachelor's degree | AJ6: Master's degree | AK6: Professional school degree | AL6: Doctoral degree
A7: 1 | B7: Accomack | C7: 21 | D7: 25894 | E7: 12104 | F7: 167 | G7: 291 | H7: 496 | I7: 757 | J7: 711 | K7: 678 | L7: 654 | M7: 430 | N7: 4069 | O7: 656 | P7: 1125 | Q7: 352 | R7: 995 | S7: 407 | T7: 210 | U7: 106 | V7: 13790 | W7: 189 | X7: 147 | Y7: 316 | Z7: 715 | AA7: 661 | AB7: 892 | AC7: 855 | AD7: 344 | AE7: 4759 | AF7: 954 | AG7: 1488 | AH7: 680 | AI7: 1118 | AJ7: 455 | AK7: 133 | AL7: 84
A8: 2 | B8: Albemarle | C8: 10 | D8: 53847 | E8: 25157 | F8: 165 | G8: 122 | H8: 468 | I8: 693 | J8: 411 | K8: 615 | L8: 650 | M8: 423 | N8: 4047 | O8: 1121 | P8: 2567 | Q8: 1068 | R8: 6014 | S8: 3126 | T8: 1868 | U8: 1799 | V8: 28690 | W8: 159 | X8: 222 | Y8: 266 | Z8: 749 | AA8: 420 | AB8: 460 | AC8: 526 | AD8: 410 | AE8: 5544 | AF8: 1692 | AG8: 3468 | AH8: 1906 | AI8: 7246 | AJ8: 3828 | AK8: 1064 | AL8: 730
A9: 3 | B9: Alleghany | C9: 5 | D9: 12278 | E9: 5791 | F9: 70 | G9: 33 | H9: 182 | I9: 389 | J9: 193 | K9: 254 | L9: 124 | M9: 225 | N9: 2212 | O9: 466 | P9: 561 | Q9: 342 | R9: 452 | S9: 190 | T9: 64 | U9: 34 | V9: 6487 | W9: 48 | X9: 15 | Y9: 115 | Z9: 423 | AA9: 161 | AB9: 214 | AC9: 249 | AD9: 143 | AE9: 2515 | AF9: 508 | AG9: 836 | AH9: 457 | AI9: 594 | AJ9: 125 | AK9: 84 | AL9: 0
A10: 4 | B10: Amelia | C10: 14 | D10: 7789 | E10: 3715 | F10: 100 | G10: 63 | H10: 103 | I10: 384 | J10: 139 | K10: 279 | L10: 202 | M10: 118 | N10: 1294 | O10: 259 | P10: 379 | Q10: 142 | R10: 163 | S10: 67 | T10: 15 | U10: 8 | V10: 4074 | W10: 42 | X10: 40 | Y10: 40 | Z10: 282 | AA10: 121 | AB10: 255 | AC10: 195 | AD10: 110 | AE10: 1520 | AF10: 226 | AG10: 465 | AH10: 271 | AI10: 340 | AJ10: 131 | AK10: 36 | AL10: 0
A11: 5 | B11: Amherst | C11: 11 | D11: 21293 | E11: 10073 | F11: 503 | G11: 144 | H11: 290 | I11: 849 | J11: 363 | K11: 486 | L11: 358 | M11: 237 | N11: 3282 | O11: 698 | P11: 1183 | Q11: 445 | R11: 858 | S11: 246 | T11: 44 | U11: 87 | V11: 11220 | W11: 412 | X11: 120 | Y11: 161 | Z11: 796 | AA11: 291 | AB11: 503 | AC11: 342 | AD11: 410 | AE11: 3826 | AF11: 812 | AG11: 1380 | AH11: 620 | AI11: 1018 | AJ11: 379 | AK11: 100 | AL11: 50
A12: 6 | B12: Appomattox | C12: 11 | D12: 9421 | E12: 4439 | F12: 66 | G12: 62 | H12: 161 | I12: 355 | J12: 162 | K12: 249 | L12: 165 | M12: 194 | N12: 1666 | O12: 314 | P12: 451 | Q12: 133 | R12: 281 | S12: 109 | T12: 50 | U12: 21 | V12: 4982 | W12: 51 | X12: 32 | Y12: 84 | Z12: 270 | AA12: 171 | AB12: 220 | AC12: 304 | AD12: 213 | AE12: 1944 | AF12: 338 | AG12: 563 | AH12: 263 | AI12: 344 | AJ12: 113 | AK12: 61 | AL12: 11
A13: 7 | B13: Arlington | C13: 8 | D13: 138844 | E13: 69317 | F13: 1185 | G13: 667 | H13: 1414 | I13: 1017 | J13: 1007 | K13: 705 | L13: 623 | M13: 1887 | N13: 7021 | O13: 1979 | P13: 5614 | Q13: 2179 | R13: 20579 | S13: 14005 | T13: 6289 | U13: 3146 | V13: 69527 | W13: 1193 | X13: 734 | Y13: 1402 | Z13: 1217 | AA13: 993 | AB13: 785 | AC13: 528 | AD13: 1568 | AE13: 9253 | AF13: 2609 | AG13: 6855 | AH13: 2796 | AI13: 20608 | AJ13: 13036 | AK13: 4413 | AL13: 1537
A14: 8 | B14: Augusta | C14: 6 | D14: 45609 | E14: 22688 | F14: 160 | G14: 106 | H14: 512 | I14: 1305 | J14: 689 | K14: 937 | L14: 856 | M14: 825 | N14: 9133 | O14: 1405 | P14: 2300 | Q14: 869 | R14: 2483 | S14: 747 | T14: 211 | U14: 150 | V14: 22921 | W14: 112 | X14: 105 | Y14: 268 | Z14: 1147 | AA14: 672 | AB14: 817 | AC14: 806 | AD14: 638 | AE14: 9215 | AF14: 1767 | AG14: 2563 | AH14: 1373 | AI14: 2487 | AJ14: 658 | AK14: 235 | AL14: 58
A15: 9 | B15: Bath | C15: 6 | D15: 3705 | E15: 1802 | F15: 8 | G15: 14 | H15: 64 | I15: 154 | J15: 59 | K15: 102 | L15: 52 | M15: 43 | N15: 780 | O15: 130 | P15: 180 | Q15: 67 | R15: 88 | S15: 46 | T15: 15 | U15: 0 | V15: 1903 | W15: 9 | X15: 29 | Y15: 36 | Z15: 110 | AA15: 86 | AB15: 68 | AC15: 85 | AD15: 46 | AE15: 668 | AF15: 138 | AG15: 220 | AH15: 145 | AI15: 117 | AJ15: 137 | AK15: 0 | AL15: 9
A16: 10 | B16: Bedford | C16: 11 | D16: 42413 | E16: 20749 | F16: 182 | G16: 153 | H16: 483 | I16: 949 | J16: 720 | K16: 735 | L16: 678 | M16: 662 | N16: 6419 | O16: 1309 | P16: 2511 | Q16: 1279 | R16: 2935 | S16: 1253 | T16: 284 | U16: 197 | V16: 21664 | W16: 98 | X16: 69 | Y16: 291 | Z16: 761 | AA16: 643 | AB16: 789 | AC16: 643 | AD16: 575 | AE16: 7480 | AF16: 1770 | AG16: 2915 | AH16: 1430 | AI16: 2878 | AJ16: 953 | AK16: 287 | AL16: 82
A17: 11 | B17: Bland | C17: 3 | D17: 4989 | E17: 2672 | F17: 56 | G17: 31 | H17: 26 | I17: 318 | J17: 48 | K17: 159 | L17: 158 | M17: 26 | N17: 1083 | O17: 151 | P17: 311 | Q17: 71 | R17: 146 | S17: 72 | T17: 11 | U17: 5 | V17: 2317 | W17: 33 | X17: 30 | Y17: 25 | Z17: 218 | AA17: 116 | AB17: 93 | AC17: 66 | AD17: 48 | AE17: 820 | AF17: 157 | AG17: 258 | AH17: 230 | AI17: 156 | AJ17: 39 | AK17: 20 | AL17: 8
A18: 12 | B18: Botetourt | C18: 5 | D18: 21621 | E18: 10602 | F18: 60 | G18: 51 | H18: 162 | I18: 619 | J18: 247 | K18: 477 | L18: 391 | M18: 309 | N18: 3448 | O18: 741 | P18: 1320 | Q18: 697 | R18: 1390 | S18: 383 | T18: 216 | U18: 91 | V18: 11019 | W18: 35 | X18: 37 | Y18: 98 | Z18: 405 | AA18: 151 | AB18: 377 | AC18: 338 | AD18: 261 | AE18: 3885 | AF18: 900 | AG18: 1481 | AH18: 889 | AI18: 1497 | AJ18: 490 | AK18: 137 | AL18: 38
A19: 13 | B19: Brunswick | C19: 13 | D19: 12777 | E19: 6849 | F19: 181 | G19: 134 | H19: 301 | I19: 583 | J19: 209 | K19: 364 | L19: 564 | M19: 519 | N19: 2138 | O19: 350 | P19: 682 | Q19: 242 | R19: 439 | S19: 91 | T19: 23 | U19: 29 | V19: 5928 | W19: 69 | X19: 74 | Y19: 125 | Z19: 469 | AA19: 172 | AB19: 341 | AC19: 343 | AD19: 260 | AE19: 1821 | AF19: 414 | AG19: 726 | AH19: 312 | AI19: 556 | AJ19: 199 | AK19: 30 | AL19: 17
A20: 14 | B20: Buchanan | C20: 2 | D20: 18851 | E20: 9406 | F20: 262 | G20: 486 | H20: 667 | I20: 1514 | J20: 516 | K20: 623 | L20: 406 | M20: 341 | N20: 2668 | O20: 517 | P20: 566 | Q20: 284 | R20: 347 | S20: 93 | T20: 103 | U20: 13 | V20: 9445 | W20: 245 | X20: 348 | Y20: 488 | Z20: 1391 | AA20: 484 | AB20: 564 | AC20: 333 | AD20: 219 | AE20: 2520 | AF20: 592 | AG20: 655 | AH20: 662 | AI20: 571 | AJ20: 306 | AK20: 58 | AL20: 9
A21: 15 | B21: Buckingham | C21: 14 | D21: 10893 | E21: 6068 | F21: 202 | G21: 139 | H21: 247 | I21: 535 | J21: 267 | K21: 315 | L21: 381 | M21: 404 | N21: 2268 | O21: 250 | P21: 363 | Q21: 206 | R21: 338 | S21: 77 | T21: 35 | U21: 41 | V21: 4825 | W21: 93 | X21: 62 | Y21: 123 | Z21: 460 | AA21: 161 | AB21: 345 | AC21: 241 | AD21: 80 | AE21: 1875 | AF21: 311 | AG21: 420 | AH21: 216 | AI21: 281 | AJ21: 128 | AK21: 17 | AL21: 12
A22: 16 | B22: Campbell | C22: 11 | D22: 35018 | E22: 16659 | F22: 296 | G22: 135 | H22: 294 | I22: 1114 | J22: 722 | K22: 934 | L22: 638 | M22: 724 | N22: 5223 | O22: 1112 | P22: 2074 | Q22: 923 | R22: 1643 | S22: 584 | T22: 146 | U22: 97 | V22: 18359 | W22: 226 | X22: 90 | Y22: 275 | Z22: 1062 | AA22: 601 | AB22: 926 | AC22: 742 | AD22: 526 | AE22: 6460 | AF22: 1183 | AG22: 2466 | AH22: 1165 | AI22: 1927 | AJ22: 507 | AK22: 164 | AL22: 39
A23: 17 | B23: Caroline | C23: 16 | D23: 15082 | E23: 7381 | F23: 43 | G23: 19 | H23: 196 | I23: 455 | J23: 285 | K23: 404 | L23: 447 | M23: 361 | N23: 2765 | O23: 412 | P23: 889 | Q23: 217 | R23: 557 | S23: 214 | T23: 76 | U23: 41 | V23: 7701 | W23: 45 | X23: 52 | Y23: 128 | Z23: 351 | AA23: 328 | AB23: 495 | AC23: 447 | AD23: 265 | AE23: 2920 | AF23: 594 | AG23: 887 | AH23: 256 | AI23: 671 | AJ23: 188 | AK23: 54 | AL23: 20
A24: 18 | B24: Carroll | C24: 3 | D24: 21006 | E24: 10138 | F24: 241 | G24: 151 | H24: 356 | I24: 1194 | J24: 473 | K24: 627 | L24: 534 | M24: 349 | N24: 3234 | O24: 681 | P24: 818 | Q24: 630 | R24: 503 | S24: 223 | T24: 71 | U24: 53 | V24: 10868 | W24: 143 | X24: 102 | Y24: 284 | Z24: 1228 | AA24: 550 | AB24: 658 | AC24: 381 | AD24: 227 | AE24: 3897 | AF24: 676 | AG24: 925 | AH24: 656 | AI24: 714 | AJ24: 340 | AK24: 62 | AL24: 25
A25: 19 | B25: Charles City | C25: 15 | D25: 4845 | E25: 2327 | F25: 12 | G25: 15 | H25: 82 | I25: 150 | J25: 139 | K25: 202 | L25: 204 | M25: 145 | N25: 785 | O25: 105 | P25: 216 | Q25: 79 | R25: 130 | S25: 27 | T25: 31 | U25: 5 | V25: 2518 | W25: 31 | X25: 16 | Y25: 37 | Z25: 146 | AA25: 128 | AB25: 169 | AC25: 122 | AD25: 65 | AE25: 890 | AF25: 166 | AG25: 287 | AH25: 143 | AI25: 246 | AJ25: 41 | AK25: 17 | AL25: 14
A26: 20 | B26: Charlotte | C26: 14 | D26: 8570 | E26: 4018 | F26: 76 | G26: 66 | H26: 176 | I26: 435 | J26: 213 | K26: 287 | L26: 202 | M26: 201 | N26: 1370 | O26: 207 | P26: 323 | Q26: 116 | R26: 207 | S26: 121 | T26: 11 | U26: 7 | V26: 4552 | W26: 68 | X26: 86 | Y26: 121 | Z26: 419 | AA26: 161 | AB26: 281 | AC26: 211 | AD26: 148 | AE26: 1614 | AF26: 282 | AG26: 424 | AH26: 201 | AI26: 333 | AJ26: 155 | AK26: 25 | AL26: 23
A27: 21 | B27: Chesterfield | C27: 15 | D27: 167037 | E27: 78957 | F27: 372 | G27: 208 | H27: 638 | I27: 1733 | J27: 1365 | K27: 1780 | L27: 1907 | M27: 1826 | N27: 19008 | O27: 5354 | P27: 12319 | Q27: 4678 | R27: 18349 | S27: 6343 | T27: 1778 | U27: 1299 | V27: 88080 | W27: 416 | X27: 183 | Y27: 571 | Z27: 1584 | AA27: 1345 | AB27: 2028 | AC27: 1910 | AD27: 1962 | AE27: 22471 | AF27: 7568 | AG27: 14878 | AH27: 6419 | AI27: 18727 | AJ27: 6126 | AK27: 1381 | AL27: 511
A28: 22 | B28: Clarke | C28: 7 | D28: 9015 | E28: 4330 | F28: 38 | G28: 16 | H28: 118 | I28: 192 | J28: 95 | K28: 185 | L28: 102 | M28: 102 | N28: 1423 | O28: 236 | P28: 596 | Q28: 173 | R28: 634 | S28: 265 | T28: 113 | U28: 42 | V28: 4685 | W28: 37 | X28: 6 | Y28: 81 | Z28: 168 | AA28: 109 | AB28: 151 | AC28: 120 | AD28: 98 | AE28: 1540 | AF28: 369 | AG28: 658 | AH28: 246 | AI28: 824 | AJ28: 223 | AK28: 39 | AL28: 16
A29: 23 | B29: Craig | C29: 5 | D29: 3561 | E29: 1798 | F29: 17 | G29: 32 | H29: 40 | I29: 113 | J29: 48 | K29: 90 | L29: 99 | M29: 57 | N29: 706 | O29: 169 | P29: 169 | Q29: 67 | R29: 123 | S29: 32 | T29: 18 | U29: 18 | V29: 1763 | W29: 6 | X29: 25 | Y29: 22 | Z29: 50 | AA29: 49 | AB29: 72 | AC29: 59 | AD29: 55 | AE29: 747 | AF29: 211 | AG29: 208 | AH29: 65 | AI29: 157 | AJ29: 36 | AK29: 1 | AL29: 0
A30: 24 | B30: Culpeper | C30: 9 | D30: 22628 | E30: 11346 | F30: 110 | G30: 98 | H30: 261 | I30: 828 | J30: 414 | K30: 503 | L30: 580 | M30: 488 | N30: 3883 | O30: 671 | P30: 1135 | Q30: 428 | R30: 1169 | S30: 517 | T30: 184 | U30: 77 | V30: 11282 | W30: 118 | X30: 117 | Y30: 255 | Z30: 558 | AA30: 248 | AB30: 569 | AC30: 471 | AD30: 323 | AE30: 4203 | AF30: 864 | AG30: 1304 | AH30: 643 | AI30: 1065 | AJ30: 452 | AK30: 56 | AL30: 36
A31: 25 | B31: Cumberland | C31: 14 | D31: 6183 | E31: 2883 | F31: 35 | G31: 48 | H31: 119 | I31: 254 | J31: 176 | K31: 271 | L31: 109 | M31: 149 | N31: 1023 | O31: 149 | P31: 183 | Q31: 76 | R31: 202 | S31: 68 | T31: 14 | U31: 7 | V31: 3300 | W31: 34 | X31: 48 | Y31: 53 | Z31: 292 | AA31: 175 | AB31: 215 | AC31: 133 | AD31: 126 | AE31: 1056 | AF31: 310 | AG31: 327 | AH31: 90 | AI31: 338 | AJ31: 91 | AK31: 12 | AL31: 0
A32: 26 | B32: Dickenson | C32: 2 | D32: 11308 | E32: 5397 | F32: 101 | G32: 196 | H32: 255 | I32: 694 | J32: 364 | K32: 345 | L32: 246 | M32: 158 | N32: 1970 | O32: 231 | P32: 333 | Q32: 159 | R32: 233 | S32: 70 | T32: 25 | U32: 17 | V32: 5911 | W32: 90 | X32: 140 | Y32: 381 | Z32: 816 | AA32: 293 | AB32: 278 | AC32: 157 | AD32: 129 | AE32: 1981 | AF32: 427 | AG32: 532 | AH32: 279 | AI32: 331 | AJ32: 39 | AK32: 23 | AL32: 15
A33: 27 | B33: Dinwiddie | C33: 19 | D33: 17199 | E33: 8314 | F33: 420 | G33: 75 | H33: 262 | I33: 576 | J33: 319 | K33: 488 | L33: 267 | M33: 365 | N33: 3204 | O33: 393 | P33: 953 | Q33: 235 | R33: 502 | S33: 174 | T33: 64 | U33: 17 | V33: 8885 | W33: 290 | X33: 42 | Y33: 96 | Z33: 577 | AA33: 283 | AB33: 442 | AC33: 423 | AD33: 242 | AE33: 3321 | AF33: 473 | AG33: 1084 | AH33: 474 | AI33: 793 | AJ33: 237 | AK33: 99 | AL33: 9
A34: 28 | B34: Essex | C34: 18 | D34: 7052 | E34: 3265 | F34: 76 | G34: 50 | H34: 90 | I34: 199 | J34: 92 | K34: 157 | L34: 197 | M34: 96 | N34: 1078 | O34: 177 | P34: 340 | Q34: 121 | R34: 370 | S34: 130 | T34: 67 | U34: 25 | V34: 3787 | W34: 29 | X34: 20 | Y34: 96 | Z34: 176 | AA34: 60 | AB34: 178 | AC34: 183 | AD34: 168 | AE34: 1377 | AF34: 257 | AG34: 451 | AH34: 159 | AI34: 477 | AJ34: 115 | AK34: 23 | AL34: 18
A35: 29 | B35: Fairfax | C35: 8 | D35: 653237 | E35: 317608 | F35: 4223 | G35: 1604 | H35: 4130 | I35: 3599 | J35: 3486 | K35: 2873 | L35: 2635 | M35: 6546 | N35: 36862 | O35: 12634 | P35: 34464 | Q35: 12870 | R35: 95415 | S35: 65227 | T35: 18311 | U35: 12729 | V35: 335629 | W35: 3721 | X35: 1724 | Y35: 4573 | Z35: 4355 | AA35: 3311 | AB35: 3420 | AC35: 2949 | AD35: 7328 | AE35: 53780 | AF35: 18859 | AG35: 44640 | AH35: 20790 | AI35: 103192 | AJ35: 48107 | AK35: 10128 | AL35: 4752
A36: 30 | B36: Fauquier | C36: 9 | D36: 36792 | E36: 17932 | F36: 132 | G36: 97 | H36: 318 | I36: 671 | J36: 466 | K36: 518 | L36: 412 | M36: 370 | N36: 4922 | O36: 1322 | P36: 2732 | Q36: 827 | R36: 3252 | S36: 1357 | T36: 370 | U36: 166 | V36: 18860 | W36: 109 | X36: 68 | Y36: 268 | Z36: 604 | AA36: 208 | AB36: 513 | AC36: 542 | AD36: 406 | AE36: 5361 | AF36: 1804 | AG36: 2944 | AH36: 1222 | AI36: 3448 | AJ36: 1101 | AK36: 197 | AL36: 65
A37: 31 | B37: Floyd | C37: 4 | D37: 9836 | E37: 4795 | F37: 34 | G37: 49 | H37: 196 | I37: 587 | J37: 169 | K37: 163 | L37: 183 | M37: 121 | N37: 1819 | O37: 213 | P37: 440 | Q37: 212 | R37: 382 | S37: 134 | T37: 45 | U37: 48 | V37: 5041 | W37: 80 | X37: 29 | Y37: 142 | Z37: 463 | AA37: 201 | AB37: 177 | AC37: 224 | AD37: 127 | AE37: 1940 | AF37: 361 | AG37: 399 | AH37: 277 | AI37: 411 | AJ37: 178 | AK37: 16 | AL37: 16
A38: 32 | B38: Fluvanna | C38: 10 | D38: 14125 | E38: 6318 | F38: 26 | G38: 56 | H38: 83 | I38: 324 | J38: 152 | K38: 203 | L38: 239 | M38: 227 | N38: 1935 | O38: 476 | P38: 691 | Q38: 284 | R38: 958 | S38: 495 | T38: 120 | U38: 49 | V38: 7807 | W38: 195 | X38: 38 | Y38: 64 | Z38: 359 | AA38: 113 | AB38: 288 | AC38: 250 | AD38: 203 | AE38: 2662 | AF38: 625 | AG38: 806 | AH38: 371 | AI38: 1197 | AJ38: 482 | AK38: 134 | AL38: 20
A39: 33 | B39: Franklin | C39: 12 | D39: 33037 | E39: 16081 | F39: 223 | G39: 167 | H39: 390 | I39: 1335 | J39: 619 | K39: 775 | L39: 717 | M39: 620 | N39: 5313 | O39: 1001 | P39: 1732 | Q39: 667 | R39: 1548 | S39: 525 | T39: 307 | U39: 142 | V39: 16956 | W39: 122 | X39: 107 | Y39: 469 | Z39: 1259 | AA39: 625 | AB39: 868 | AC39: 444 | AD39: 452 | AE39: 5452 | AF39: 1462 | AG39: 2289 | AH39: 1047 | AI39: 1647 | AJ39: 542 | AK39: 134 | AL39: 37
A40: 34 | B40: Frederick | C40: 7 | D40: 39271 | E40: 19228 | F40: 182 | G40: 136 | H40: 463 | I40: 957 | J40: 729 | K40: 872 | L40: 562 | M40: 619 | N40: 6628 | O40: 1394 | P40: 2137 | Q40: 756 | R40: 2569 | S40: 765 | T40: 322 | U40: 137 | V40: 20043 | W40: 88 | X40: 79 | Y40: 320 | Z40: 852 | AA40: 483 | AB40: 886 | AC40: 603 | AD40: 582 | AE40: 7397 | AF40: 1675 | AG40: 2307 | AH40: 1273 | AI40: 2330 | AJ40: 870 | AK40: 190 | AL40: 108
A41: 35 | B41: Giles | C41: 4 | D41: 11856 | E41: 5614 | F41: 56 | G41: 64 | H41: 101 | I41: 444 | J41: 150 | K41: 204 | L41: 198 | M41: 117 | N41: 2307 | O41: 393 | P41: 535 | Q41: 310 | R41: 410 | S41: 182 | T41: 81 | U41: 62 | V41: 6242 | W41: 59 | X41: 29 | Y41: 128 | Z41: 403 | AA41: 282 | AB41: 307 | AC41: 161 | AD41: 152 | AE41: 2535 | AF41: 436 | AG41: 633 | AH41: 376 | AI41: 477 | AJ41: 198 | AK41: 33 | AL41: 33
A42: 36 | B42: Gloucester | C42: 18 | D42: 23273 | E42: 11170 | F42: 45 | G42: 106 | H42: 207 | I42: 474 | J42: 307 | K42: 448 | L42: 306 | M42: 306 | N42: 3556 | O42: 919 | P42: 1783 | Q42: 798 | R42: 1104 | S42: 586 | T42: 109 | U42: 116 | V42: 12103 | W42: 58 | X42: 72 | Y42: 151 | Z42: 393 | AA42: 321 | AB42: 444 | AC42: 355 | AD42: 259 | AE42: 3814 | AF42: 1342 | AG42: 1821 | AH42: 885 | AI42: 1382 | AJ42: 629 | AK42: 83 | AL42: 94
A43: 37 | B43: Goochland | C43: 15 | D43: 12248 | E43: 5939 | F43: 50 | G43: 67 | H43: 131 | I43: 349 | J43: 242 | K43: 217 | L43: 185 | M43: 129 | N43: 1622 | O43: 353 | P43: 588 | Q43: 81 | R43: 1084 | S43: 364 | T43: 399 | U43: 78 | V43: 6309 | W43: 262 | X43: 21 | Y43: 78 | Z43: 171 | AA43: 170 | AB43: 148 | AC43: 232 | AD43: 149 | AE43: 1976 | AF43: 418 | AG43: 712 | AH43: 296 | AI43: 1104 | AJ43: 399 | AK43: 138 | AL43: 35
A44: 38 | B44: Grayson | C44: 3 | D44: 13086 | E44: 6732 | F44: 173 | G44: 98 | H44: 175 | I44: 781 | J44: 343 | K44: 400 | L44: 282 | M44: 214 | N44: 2693 | O44: 277 | P44: 508 | Q44: 224 | R44: 324 | S44: 140 | T44: 69 | U44: 31 | V44: 6354 | W44: 75 | X44: 113 | Y44: 192 | Z44: 729 | AA44: 373 | AB44: 359 | AC44: 280 | AD44: 115 | AE44: 2235 | AF44: 478 | AG44: 574 | AH44: 343 | AI44: 399 | AJ44: 59 | AK44: 23 | AL44: 7
A45: 39 | B45: Greene | C45: 10 | D45: 10120 | E45: 4957 | F45: 53 | G45: 57 | H45: 103 | I45: 378 | J45: 198 | K45: 202 | L45: 157 | M45: 116 | N45: 1619 | O45: 420 | P45: 420 | Q45: 288 | R45: 628 | S45: 248 | T45: 49 | U45: 21 | V45: 5163 | W45: 51 | X45: 44 | Y45: 104 | Z45: 197 | AA45: 79 | AB45: 188 | AC45: 137 | AD45: 123 | AE45: 1894 | AF45: 524 | AG45: 526 | AH45: 235 | AI45: 749 | AJ45: 237 | AK45: 75 | AL45: 0
A46: 40 | B46: Greensville | C46: 19 | D46: 8610 | E46: 5495 | F46: 518 | G46: 89 | H46: 200 | I46: 341 | J46: 253 | K46: 443 | L46: 268 | M46: 110 | N46: 2181 | O46: 142 | P46: 270 | Q46: 54 | R46: 351 | S46: 48 | T46: 227 | U46: 0 | V46: 3115 | W46: 39 | X46: 45 | Y46: 90 | Z46: 189 | AA46: 158 | AB46: 192 | AC46: 196 | AD46: 132 | AE46: 1195 | AF46: 154 | AG46: 267 | AH46: 141 | AI46: 195 | AJ46: 64 | AK46: 39 | AL46: 19
A47: 41 | B47: Halifax | C47: 13 | D47: 26073 | E47: 11984 | F47: 286 | G47: 296 | H47: 517 | I47: 1012 | J47: 457 | K47: 961 | L47: 767 | M47: 462 | N47: 3803 | O47: 689 | P47: 994 | Q47: 588 | R47: 780 | S47: 220 | T47: 125 | U47: 27 | V47: 14089 | W47: 198 | X47: 183 | Y47: 472 | Z47: 990 | AA47: 591 | AB47: 858 | AC47: 895 | AD47: 471 | AE47: 5016 | AF47: 832 | AG47: 1501 | AH47: 766 | AI47: 787 | AJ47: 413 | AK47: 116 | AL47: 0
A48: 42 | B48: Hanover | C48: 15 | D48: 56892 | E48: 27169 | F48: 108 | G48: 75 | H48: 247 | I48: 804 | J48: 674 | K48: 703 | L48: 690 | M48: 686 | N48: 7478 | O48: 2058 | P48: 4102 | Q48: 1458 | R48: 5467 | S48: 1801 | T48: 510 | U48: 308 | V48: 29723 | W48: 82 | X48: 83 | Y48: 174 | Z48: 674 | AA48: 531 | AB48: 758 | AC48: 822 | AD48: 506 | AE48: 8923 | AF48: 2548 | AG48: 4733 | AH48: 1651 | AI48: 5778 | AJ48: 1794 | AK48: 505 | AL48: 161
A49: 43 | B49: Henrico | C49: 15 | D49: 177191 | E49: 79997 | F49: 499 | G49: 283 | H49: 742 | I49: 1931 | J49: 1389 | K49: 1997 | L49: 1854 | M49: 2544 | N49: 18099 | O49: 5062 | P49: 11401 | Q49: 3735 | R49: 19454 | S49: 6603 | T49: 3082 | U49: 1322 | V49: 97194 | W49: 594 | X49: 291 | Y49: 701 | Z49: 2172 | AA49: 1463 | AB49: 2001 | AC49: 2662 | AD49: 2592 | AE49: 23840 | AF49: 7764 | AG49: 15998 | AH49: 5690 | AI49: 21648 | AJ49: 7272 | AK49: 1884 | AL49: 622
A50: 44 | B50: Henry | C50: 12 | D50: 40518 | E50: 19169 | F50: 263 | G50: 323 | H50: 755 | I50: 1857 | J50: 1074 | K50: 1109 | L50: 1099 | M50: 791 | N50: 5937 | O50: 1180 | P50: 2135 | Q50: 832 | R50: 1175 | S50: 441 | T50: 177 | U50: 21 | V50: 21349 | W50: 217 | X50: 168 | Y50: 635 | Z50: 1901 | AA50: 986 | AB50: 1265 | AC50: 1062 | AD50: 725 | AE50: 7303 | AF50: 1415 | AG50: 2405 | AH50: 1261 | AI50: 1392 | AJ50: 474 | AK50: 121 | AL50: 19
A51: 45 | B51: Highland | C51: 6 | D51: 1929 | E51: 942 | F51: 2 | G51: 11 | H51: 21 | I51: 75 | J51: 23 | K51: 30 | L51: 72 | M51: 23 | N51: 381 | O51: 34 | P51: 123 | Q51: 31 | R51: 56 | S51: 40 | T51: 14 | U51: 6 | V51: 987 | W51: 12 | X51: 11 | Y51: 10 | Z51: 70 | AA51: 16 | AB51: 59 | AC51: 50 | AD51: 39 | AE51: 357 | AF51: 51 | AG51: 140 | AH51: 33 | AI51: 87 | AJ51: 30 | AK51: 16 | AL51: 6
A52: 46 | B52: Isle of Wight | C52: 23 | D52: 20121 | E52: 9595 | F52: 67 | G52: 114 | H52: 224 | I52: 466 | J52: 346 | K52: 471 | L52: 329 | M52: 407 | N52: 2896 | O52: 677 | P52: 1296 | Q52: 559 | R52: 1187 | S52: 398 | T52: 108 | U52: 50 | V52: 10526 | W52: 54 | X52: 74 | Y52: 207 | Z52: 456 | AA52: 315 | AB52: 520 | AC52: 436 | AD52: 298 | AE52: 3250 | AF52: 889 | AG52: 1418 | AH52: 833 | AI52: 1289 | AJ52: 421 | AK52: 52 | AL52: 14
A53: 47 | B53: James City | C53: 23 | D53: 34042 | E53: 16218 | F53: 12 | G53: 82 | H53: 117 | I53: 352 | J53: 223 | K53: 359 | L53: 402 | M53: 209 | N53: 3190 | O53: 983 | P53: 2032 | Q53: 833 | R53: 4061 | S53: 2143 | T53: 642 | U53: 578 | V53: 17824 | W53: 52 | X53: 35 | Y53: 124 | Z53: 202 | AA53: 154 | AB53: 420 | AC53: 342 | AD53: 570 | AE53: 3909 | AF53: 1284 | AG53: 2884 | AH53: 1132 | AI53: 4388 | AJ53: 1781 | AK53: 331 | AL53: 216
A54: 48 | B54: King and Queen | C54: 18 | D54: 4663 | E54: 2213 | F54: 48 | G54: 35 | H54: 129 | I54: 205 | J54: 49 | K54: 166 | L54: 128 | M54: 38 | N54: 777 | O54: 155 | P54: 180 | Q54: 85 | R54: 145 | S54: 41 | T54: 17 | U54: 15 | V54: 2450 | W54: 43 | X54: 16 | Y54: 59 | Z54: 116 | AA54: 44 | AB54: 137 | AC54: 158 | AD54: 110 | AE54: 959 | AF54: 172 | AG54: 277 | AH54: 97 | AI54: 195 | AJ54: 46 | AK54: 21 | AL54: 0
A55: 49 | B55: King George | C55: 16 | D55: 10803 | E55: 5426 | F55: 31 | G55: 63 | H55: 97 | I55: 193 | J55: 173 | K55: 214 | L55: 175 | M55: 164 | N55: 1618 | O55: 441 | P55: 634 | Q55: 188 | R55: 856 | S55: 427 | T55: 74 | U55: 78 | V55: 5377 | W55: 30 | X55: 41 | Y55: 43 | Z55: 232 | AA55: 119 | AB55: 146 | AC55: 240 | AD55: 158 | AE55: 1878 | AF55: 542 | AG55: 595 | AH55: 237 | AI55: 824 | AJ55: 227 | AK55: 59 | AL55: 6
A56: 50 | B56: King William | C56: 18 | D56: 8960 | E56: 4359 | F56: 49 | G56: 50 | H56: 89 | I56: 195 | J56: 135 | K56: 215 | L56: 146 | M56: 95 | N56: 1695 | O56: 329 | P56: 570 | Q56: 166 | R56: 456 | S56: 134 | T56: 20 | U56: 15 | V56: 4601 | W56: 29 | X56: 5 | Y56: 62 | Z56: 178 | AA56: 88 | AB56: 204 | AC56: 201 | AD56: 132 | AE56: 1727 | AF56: 436 | AG56: 626 | AH56: 211 | AI56: 439 | AJ56: 185 | AK56: 45 | AL56: 33
A57: 51 | B57: Lancaster | C57: 17 | D57: 8841 | E57: 3949 | F57: 52 | G57: 17 | H57: 75 | I57: 280 | J57: 199 | K57: 261 | L57: 151 | M57: 114 | N57: 966 | O57: 149 | P57: 376 | Q57: 124 | R57: 665 | S57: 267 | T57: 174 | U57: 79 | V57: 4892 | W57: 67 | X57: 50 | Y57: 96 | Z57: 244 | AA57: 173 | AB57: 196 | AC57: 190 | AD57: 97 | AE57: 1502 | AF57: 288 | AG57: 667 | AH57: 342 | AI57: 684 | AJ57: 194 | AK57: 66 | AL57: 36
A58: 52 | B58: Lee | C58: 1 | D58: 16314 | E58: 7762 | F58: 173 | G58: 292 | H58: 498 | I58: 853 | J58: 443 | K58: 488 | L58: 372 | M58: 245 | N58: 2386 | O58: 413 | P58: 692 | Q58: 191 | R58: 399 | S58: 206 | T58: 79 | U58: 32 | V58: 8552 | W58: 141 | X58: 237 | Y58: 370 | Z58: 990 | AA58: 414 | AB58: 357 | AC58: 322 | AD58: 233 | AE58: 2804 | AF58: 571 | AG58: 816 | AH58: 460 | AI58: 504 | AJ58: 243 | AK58: 82 | AL58: 8
A59: 53 | B59: Loudoun | C59: 8 | D59: 109567 | E59: 53130 | F59: 236 | G59: 222 | H59: 397 | I59: 640 | J59: 517 | K59: 569 | L59: 591 | M59: 777 | N59: 8307 | O59: 2984 | P59: 7221 | Q59: 3172 | R59: 17240 | S59: 7957 | T59: 1317 | U59: 983 | V59: 56437 | W59: 338 | X59: 181 | Y59: 391 | Z59: 698 | AA59: 431 | AB59: 633 | AC59: 546 | AD59: 1015 | AE59: 11051 | AF59: 4189 | AG59: 8512 | AH59: 4240 | AI59: 17770 | AJ59: 5279 | AK59: 838 | AL59: 325
A60: 54 | B60: Louisa | C60: 10 | D60: 17697 | E60: 8567 | F60: 126 | G60: 79 | H60: 278 | I60: 701 | J60: 342 | K60: 494 | L60: 419 | M60: 289 | N60: 2757 | O60: 686 | P60: 811 | Q60: 359 | R60: 825 | S60: 242 | T60: 114 | U60: 45 | V60: 9130 | W60: 119 | X60: 65 | Y60: 116 | Z60: 461 | AA60: 294 | AB60: 451 | AC60: 468 | AD60: 299 | AE60: 3416 | AF60: 693 | AG60: 1053 | AH60: 447 | AI60: 837 | AJ60: 330 | AK60: 58 | AL60: 23
A61: 55 | B61: Lunenburg | C61: 14 | D61: 9305 | E61: 4921 | F61: 105 | G61: 75 | H61: 246 | I61: 385 | J61: 291 | K61: 448 | L61: 259 | M61: 240 | N61: 1412 | O61: 374 | P61: 602 | Q61: 122 | R61: 227 | S61: 95 | T61: 29 | U61: 11 | V61: 4384 | W61: 50 | X61: 59 | Y61: 96 | Z61: 354 | AA61: 189 | AB61: 239 | AC61: 142 | AD61: 230 | AE61: 1530 | AF61: 341 | AG61: 466 | AH61: 197 | AI61: 366 | AJ61: 113 | AK61: 8 | AL61: 4
A62: 56 | B62: Madison | C62: 9 | D62: 8644 | E62: 4214 | F62: 64 | G62: 58 | H62: 164 | I62: 226 | J62: 163 | K62: 194 | L62: 125 | M62: 128 | N62: 1534 | O62: 273 | P62: 364 | Q62: 96 | R62: 520 | S62: 196 | T62: 71 | U62: 38 | V62: 4430 | W62: 45 | X62: 51 | Y62: 84 | Z62: 247 | AA62: 134 | AB62: 179 | AC62: 161 | AD62: 135 | AE62: 1601 | AF62: 328 | AG62: 473 | AH62: 142 | AI62: 565 | AJ62: 202 | AK62: 77 | AL62: 6
A63: 57 | B63: Mathews | C63: 18 | D63: 6926 | E63: 3302 | F63: 30 | G63: 33 | H63: 59 | I63: 102 | J63: 112 | K63: 158 | L63: 136 | M63: 78 | N63: 1157 | O63: 188 | P63: 488 | Q63: 130 | R63: 353 | S63: 177 | T63: 64 | U63: 37 | V63: 3624 | W63: 21 | X63: 0 | Y63: 32 | Z63: 89 | AA63: 102 | AB63: 180 | AC63: 129 | AD63: 69 | AE63: 1185 | AF63: 307 | AG63: 574 | AH63: 240 | AI63: 408 | AJ63: 174 | AK63: 107 | AL63: 7
A64: 58 | B64: Mecklenburg | C64: 13 | D64: 22981 | E64: 11154 | F64: 274 | G64: 156 | H64: 361 | I64: 667 | J64: 543 | K64: 741 | L64: 752 | M64: 440 | N64: 3532 | O64: 684 | P64: 1183 | Q64: 454 | R64: 978 | S64: 263 | T64: 105 | U64: 21 | V64: 11827 | W64: 178 | X64: 88 | Y64: 241 | Z64: 709 | AA64: 543 | AB64: 705 | AC64: 592 | AD64: 403 | AE64: 4315 | AF64: 917 | AG64: 1216 | AH64: 510 | AI64: 914 | AJ64: 397 | AK64: 80 | AL64: 19
A65: 59 | B65: Middlesex | C65: 18 | D65: 7436 | E65: 3479 | F65: 54 | G65: 41 | H65: 124 | I65: 279 | J65: 91 | K65: 164 | L65: 118 | M65: 109 | N65: 1037 | O65: 251 | P65: 379 | Q65: 135 | R65: 439 | S65: 153 | T65: 78 | U65: 27 | V65: 3957 | W65: 51 | X65: 35 | Y65: 35 | Z65: 180 | AA65: 112 | AB65: 191 | AC65: 224 | AD65: 145 | AE65: 1190 | AF65: 387 | AG65: 504 | AH65: 192 | AI65: 500 | AJ65: 154 | AK65: 42 | AL65: 15
A66: 60 | B66: Montgomery | C66: 4 | D66: 43106 | E66: 21163 | F66: 140 | G66: 122 | H66: 317 | I66: 1022 | J66: 608 | K66: 591 | L66: 451 | M66: 373 | N66: 4555 | O66: 1105 | P66: 2390 | Q66: 1198 | R66: 3524 | S66: 2224 | T66: 432 | U66: 2111 | V66: 21943 | W66: 93 | X66: 152 | Y66: 345 | Z66: 1057 | AA66: 382 | AB66: 854 | AC66: 441 | AD66: 479 | AE66: 5672 | AF66: 1365 | AG66: 2678 | AH66: 1248 | AI66: 3915 | AJ66: 2260 | AK66: 288 | AL66: 714
A67: 61 | B67: Nelson | C67: 10 | D67: 10403 | E67: 4909 | F67: 90 | G67: 69 | H67: 207 | I67: 421 | J67: 225 | K67: 202 | L67: 207 | M67: 195 | N67: 1277 | O67: 244 | P67: 520 | Q67: 185 | R67: 583 | S67: 349 | T67: 60 | U67: 75 | V67: 5494 | W67: 62 | X67: 51 | Y67: 113 | Z67: 377 | AA67: 222 | AB67: 267 | AC67: 339 | AD67: 177 | AE67: 1489 | AF67: 457 | AG67: 572 | AH67: 273 | AI67: 622 | AJ67: 374 | AK67: 58 | AL67: 41
A68: 62 | B68: New Kent | C68: 15 | D68: 9285 | E68: 4553 | F68: 7 | G68: 16 | H68: 55 | I68: 177 | J68: 103 | K68: 247 | L68: 160 | M68: 203 | N68: 1595 | O68: 355 | P68: 637 | Q68: 308 | R68: 469 | S68: 167 | T68: 31 | U68: 23 | V68: 4732 | W68: 19 | X68: 13 | Y68: 67 | Z68: 140 | AA68: 106 | AB68: 169 | AC68: 183 | AD68: 134 | AE68: 1631 | AF68: 428 | AG68: 775 | AH68: 241 | AI68: 565 | AJ68: 208 | AK68: 53 | AL68: 0
A69: 63 | B69: Northampton | C69: 21 | D69: 9133 | E69: 4178 | F69: 117 | G69: 67 | H69: 265 | I69: 342 | J69: 140 | K69: 189 | L69: 234 | M69: 137 | N69: 1182 | O69: 263 | P69: 424 | Q69: 202 | R69: 417 | S69: 94 | T69: 78 | U69: 27 | V69: 4955 | W69: 67 | X69: 68 | Y69: 157 | Z69: 379 | AA69: 212 | AB69: 204 | AC69: 266 | AD69: 133 | AE69: 1487 | AF69: 258 | AG69: 627 | AH69: 277 | AI69: 544 | AJ69: 209 | AK69: 65 | AL69: 2
A70: 64 | B70: Northumberland | C70: 17 | D70: 9476 | E70: 4448 | F70: 57 | G70: 54 | H70: 212 | I70: 248 | J70: 134 | K70: 239 | L70: 167 | M70: 152 | N70: 1280 | O70: 226 | P70: 542 | Q70: 141 | R70: 510 | S70: 302 | T70: 100 | U70: 84 | V70: 5028 | W70: 65 | X70: 18 | Y70: 63 | Z70: 168 | AA70: 126 | AB70: 212 | AC70: 244 | AD70: 120 | AE70: 1653 | AF70: 351 | AG70: 671 | AH70: 279 | AI70: 691 | AJ70: 255 | AK70: 66 | AL70: 46
A71: 65 | B71: Nottoway | C71: 14 | D71: 10841 | E71: 5497 | F71: 119 | G71: 101 | H71: 194 | I71: 356 | J71: 409 | K71: 399 | L71: 333 | M71: 237 | N71: 1699 | O71: 302 | P71: 587 | Q71: 168 | R71: 375 | S71: 118 | T71: 62 | U71: 38 | V71: 5344 | W71: 75 | X71: 65 | Y71: 170 | Z71: 397 | AA71: 242 | AB71: 363 | AC71: 290 | AD71: 109 | AE71: 1748 | AF71: 364 | AG71: 602 | AH71: 308 | AI71: 403 | AJ71: 136 | AK71: 37 | AL71: 35
A72: 66 | B72: Orange | C72: 9 | D72: 18202 | E72: 8670 | F72: 46 | G72: 133 | H72: 287 | I72: 461 | J72: 377 | K72: 472 | L72: 323 | M72: 290 | N72: 2869 | O72: 499 | P72: 862 | Q72: 340 | R72: 1027 | S72: 475 | T72: 167 | U72: 42 | V72: 9532 | W72: 35 | X72: 69 | Y72: 183 | Z72: 423 | AA72: 341 | AB72: 412 | AC72: 372 | AD72: 285 | AE72: 3321 | AF72: 968 | AG72: 958 | AH72: 509 | AI72: 1126 | AJ72: 380 | AK72: 93 | AL72: 57
A73: 67 | B73: Page | C73: 7 | D73: 16085 | E73: 7759 | F73: 89 | G73: 128 | H73: 335 | I73: 886 | J73: 443 | K73: 468 | L73: 256 | M73: 304 | N73: 3012 | O73: 321 | P73: 576 | Q73: 200 | R73: 431 | S73: 196 | T73: 56 | U73: 58 | V73: 8326 | W73: 74 | X73: 28 | Y73: 174 | Z73: 908 | AA73: 395 | AB73: 571 | AC73: 343 | AD73: 266 | AE73: 3374 | AF73: 500 | AG73: 699 | AH73: 163 | AI73: 520 | AJ73: 250 | AK73: 59 | AL73: 2
A74: 68 | B74: Patrick | C74: 12 | D74: 13815 | E74: 6664 | F74: 147 | G74: 94 | H74: 260 | I74: 718 | J74: 407 | K74: 569 | L74: 311 | M74: 201 | N74: 2257 | O74: 341 | P74: 518 | Q74: 274 | R74: 416 | S74: 111 | T74: 35 | U74: 5 | V74: 7151 | W74: 147 | X74: 107 | Y74: 204 | Z74: 724 | AA74: 390 | AB74: 331 | AC74: 323 | AD74: 284 | AE74: 2494 | AF74: 442 | AG74: 642 | AH74: 440 | AI74: 446 | AJ74: 140 | AK74: 29 | AL74: 8
A75: 69 | B75: Pittsylvania | C75: 12 | D75: 43120 | E75: 20616 | F75: 418 | G75: 444 | H75: 664 | I75: 1821 | J75: 846 | K75: 1281 | L75: 996 | M75: 845 | N75: 6838 | O75: 1196 | P75: 2145 | Q75: 1211 | R75: 1201 | S75: 489 | T75: 173 | U75: 48 | V75: 22504 | W75: 287 | X75: 233 | Y75: 522 | Z75: 1747 | AA75: 842 | AB75: 1253 | AC75: 1017 | AD75: 902 | AE75: 8335 | AF75: 1575 | AG75: 2424 | AH75: 1285 | AI75: 1370 | AJ75: 499 | AK75: 202 | AL75: 11
A76: 70 | B76: Powhatan | C76: 15 | D76: 15411 | E76: 8406 | F76: 110 | G76: 84 | H76: 210 | I76: 290 | J76: 430 | K76: 467 | L76: 425 | M76: 203 | N76: 2644 | O76: 514 | P76: 1029 | Q76: 438 | R76: 1243 | S76: 177 | T76: 105 | U76: 37 | V76: 7005 | W76: 16 | X76: 4 | Y76: 50 | Z76: 197 | AA76: 135 | AB76: 219 | AC76: 239 | AD76: 173 | AE76: 2322 | AF76: 663 | AG76: 1118 | AH76: 481 | AI76: 1056 | AJ76: 244 | AK76: 64 | AL76: 24
A77: 71 | B77: Prince Edward | C77: 14 | D77: 11089 | E77: 5138 | F77: 117 | G77: 77 | H77: 193 | I77: 311 | J77: 236 | K77: 251 | L77: 303 | M77: 204 | N77: 1491 | O77: 298 | P77: 657 | Q77: 150 | R77: 427 | S77: 190 | T77: 86 | U77: 147 | V77: 5951 | W77: 37 | X77: 72 | Y77: 163 | Z77: 330 | AA77: 218 | AB77: 334 | AC77: 270 | AD77: 220 | AE77: 1656 | AF77: 326 | AG77: 715 | AH77: 334 | AI77: 766 | AJ77: 346 | AK77: 74 | AL77: 90
A78: 72 | B78: Prince George | C78: 19 | D78: 20272 | E78: 10733 | F78: 70 | G78: 113 | H78: 199 | I78: 466 | J78: 250 | K78: 532 | L78: 479 | M78: 200 | N78: 3258 | O78: 743 | P78: 1564 | Q78: 834 | R78: 1320 | S78: 542 | T78: 131 | U78: 32 | V78: 9539 | W78: 23 | X78: 14 | Y78: 114 | Z78: 294 | AA78: 201 | AB78: 330 | AC78: 303 | AD78: 133 | AE78: 3185 | AF78: 853 | AG78: 1583 | AH78: 603 | AI78: 1432 | AJ78: 353 | AK78: 110 | AL78: 8
A79: 73 | B79: Prince William | C79: 8 | D79: 171058 | E79: 83403 | F79: 535 | G79: 408 | H79: 1354 | I79: 1250 | J79: 1188 | K79: 1531 | L79: 1332 | M79: 1903 | N79: 19585 | O79: 6443 | P79: 13386 | Q79: 5636 | R79: 17050 | S79: 9589 | T79: 1393 | U79: 820 | V79: 87655 | W79: 695 | X79: 515 | Y79: 999 | Z79: 1342 | AA79: 1166 | AB79: 1567 | AC79: 1471 | AD79: 1953 | AE79: 22969 | AF79: 8388 | AG79: 14728 | AH79: 6895 | AI79: 17616 | AJ79: 6301 | AK79: 795 | AL79: 255
A80: 74 | B80: Pulaski | C80: 4 | D80: 25362 | E80: 12201 | F80: 92 | G80: 128 | H80: 359 | I80: 829 | J80: 337 | K80: 426 | L80: 546 | M80: 313 | N80: 4130 | O80: 908 | P80: 1606 | Q80: 1008 | R80: 1006 | S80: 320 | T80: 126 | U80: 67 | V80: 13161 | W80: 119 | X80: 121 | Y80: 317 | Z80: 1023 | AA80: 470 | AB80: 709 | AC80: 465 | AD80: 283 | AE80: 4460 | AF80: 977 | AG80: 1572 | AH80: 1001 | AI80: 1014 | AJ80: 499 | AK80: 82 | AL80: 49
A81: 75 | B81: Rappahannock | C81: 9 | D81: 5059 | E81: 2495 | F81: 41 | G81: 21 | H81: 79 | I81: 160 | J81: 93 | K81: 103 | L81: 81 | M81: 82 | N81: 766 | O81: 162 | P81: 272 | Q81: 88 | R81: 329 | S81: 128 | T81: 58 | U81: 32 | V81: 2564 | W81: 25 | X81: 14 | Y81: 73 | Z81: 156 | AA81: 59 | AB81: 141 | AC81: 43 | AD81: 43 | AE81: 756 | AF81: 144 | AG81: 351 | AH81: 146 | AI81: 397 | AJ81: 148 | AK81: 30 | AL81: 38
A82: 76 | B82: Richmond | C82: 17 | D82: 6552 | E82: 3658 | F82: 42 | G82: 61 | H82: 187 | I82: 199 | J82: 147 | K82: 356 | L82: 700 | M82: 83 | N82: 986 | O82: 164 | P82: 280 | Q82: 97 | R82: 262 | S82: 74 | T82: 18 | U82: 2 | V82: 2894 | W82: 48 | X82: 27 | Y82: 48 | Z82: 174 | AA82: 154 | AB82: 175 | AC82: 130 | AD82: 93 | AE82: 1061 | AF82: 239 | AG82: 318 | AH82: 133 | AI82: 233 | AJ82: 46 | AK82: 15 | AL82: 0
A83: 77 | B83: Roanoke | C83: 5 | D83: 60771 | E83: 27947 | F83: 111 | G83: 121 | H83: 356 | I83: 1082 | J83: 494 | K83: 730 | L83: 560 | M83: 449 | N83: 7386 | O83: 2001 | P83: 3894 | Q83: 2189 | R83: 5534 | S83: 1723 | T83: 1011 | U83: 306 | V83: 32824 | W83: 126 | X83: 120 | Y83: 257 | Z83: 1417 | AA83: 512 | AB83: 881 | AC83: 821 | AD83: 615 | AE83: 9521 | AF83: 2706 | AG83: 4465 | AH83: 2806 | AI83: 5918 | AJ83: 1867 | AK83: 623 | AL83: 169
A84: 78 | B84: Rockbridge | C84: 6 | D84: 14556 | E84: 7157 | F84: 83 | G84: 147 | H84: 273 | I84: 716 | J84: 273 | K84: 377 | L84: 247 | M84: 132 | N84: 2268 | O84: 392 | P84: 573 | Q84: 248 | R84: 763 | S84: 374 | T84: 76 | U84: 215 | V84: 7399 | W84: 82 | X84: 86 | Y84: 209 | Z84: 553 | AA84: 219 | AB84: 310 | AC84: 310 | AD84: 210 | AE84: 2440 | AF84: 520 | AG84: 776 | AH84: 390 | AI84: 723 | AJ84: 419 | AK84: 71 | AL84: 81
A85: 79 | B85: Rockingham | C85: 6 | D85: 45123 | E85: 21732 | F85: 270 | G85: 195 | H85: 660 | I85: 1931 | J85: 829 | K85: 1112 | L85: 895 | M85: 686 | N85: 7514 | O85: 1184 | P85: 1963 | Q85: 685 | R85: 2327 | S85: 868 | T85: 286 | U85: 327 | V85: 23391 | W85: 234 | X85: 145 | Y85: 341 | Z85: 1722 | AA85: 834 | AB85: 1119 | AC85: 844 | AD85: 656 | AE85: 8420 | AF85: 1403 | AG85: 2436 | AH85: 1092 | AI85: 2756 | AJ85: 945 | AK85: 289 | AL85: 155
A86: 80 | B86: Russell | C86: 2 | D86: 21362 | E86: 10721 | F86: 259 | G86: 250 | H86: 532 | I86: 1146 | J86: 636 | K86: 548 | L86: 858 | M86: 265 | N86: 3360 | O86: 716 | P86: 930 | Q86: 400 | R86: 546 | S86: 202 | T86: 51 | U86: 22 | V86: 10641 | W86: 163 | X86: 160 | Y86: 462 | Z86: 1048 | AA86: 411 | AB86: 503 | AC86: 532 | AD86: 232 | AE86: 3559 | AF86: 704 | AG86: 976 | AH86: 712 | AI86: 776 | AJ86: 349 | AK86: 42 | AL86: 12
A87: 81 | B87: Scott | C87: 1 | D87: 16846 | E87: 7959 | F87: 176 | G87: 258 | H87: 361 | I87: 919 | J87: 347 | K87: 406 | L87: 295 | M87: 144 | N87: 3035 | O87: 447 | P87: 651 | Q87: 290 | R87: 436 | S87: 105 | T87: 68 | U87: 21 | V87: 8887 | W87: 121 | X87: 255 | Y87: 392 | Z87: 1084 | AA87: 453 | AB87: 343 | AC87: 341 | AD87: 105 | AE87: 3073 | AF87: 754 | AG87: 753 | AH87: 439 | AI87: 567 | AJ87: 148 | AK87: 33 | AL87: 26
A88: 82 | B88: Shenandoah | C88: 7 | D88: 24926 | E88: 11912 | F88: 83 | G88: 121 | H88: 279 | I88: 851 | J88: 547 | K88: 544 | L88: 458 | M88: 413 | N88: 4540 | O88: 767 | P88: 1049 | Q88: 446 | R88: 1114 | S88: 444 | T88: 159 | U88: 97 | V88: 13014 | W88: 117 | X88: 25 | Y88: 169 | Z88: 829 | AA88: 414 | AB88: 556 | AC88: 409 | AD88: 347 | AE88: 5032 | AF88: 962 | AG88: 1589 | AH88: 718 | AI88: 1347 | AJ88: 411 | AK88: 59 | AL88: 30
A89: 83 | B89: Smyth | C89: 3 | D89: 23255 | E89: 10957 | F89: 143 | G89: 152 | H89: 373 | I89: 972 | J89: 554 | K89: 679 | L89: 607 | M89: 222 | N89: 3736 | O89: 660 | P89: 1086 | Q89: 529 | R89: 853 | S89: 264 | T89: 92 | U89: 35 | V89: 12298 | W89: 164 | X89: 113 | Y89: 271 | Z89: 1300 | AA89: 569 | AB89: 728 | AC89: 524 | AD89: 185 | AE89: 4256 | AF89: 942 | AG89: 1273 | AH89: 747 | AI89: 864 | AJ89: 265 | AK89: 76 | AL89: 21
A90: 84 | B90: Southampton | C90: 23 | D90: 12070 | E90: 6168 | F90: 201 | G90: 151 | H90: 247 | I90: 421 | J90: 213 | K90: 377 | L90: 740 | M90: 232 | N90: 1666 | O90: 380 | P90: 704 | Q90: 190 | R90: 477 | S90: 106 | T90: 26 | U90: 37 | V90: 5902 | W90: 148 | X90: 51 | Y90: 220 | Z90: 515 | AA90: 190 | AB90: 264 | AC90: 231 | AD90: 245 | AE90: 1527 | AF90: 535 | AG90: 865 | AH90: 341 | AI90: 550 | AJ90: 127 | AK90: 89 | AL90: 4
A91: 85 | B91: Spotsylvania | C91: 16 | D91: 56633 | E91: 27133 | F91: 67 | G91: 96 | H91: 308 | I91: 821 | J91: 711 | K91: 968 | L91: 903 | M91: 1002 | N91: 7881 | O91: 2305 | P91: 3814 | Q91: 1483 | R91: 4543 | S91: 1636 | T91: 353 | U91: 242 | V91: 29500 | W91: 133 | X91: 99 | Y91: 229 | Z91: 769 | AA91: 587 | AB91: 950 | AC91: 700 | AD91: 844 | AE91: 10001 | AF91: 2815 | AG91: 4487 | AH91: 1732 | AI91: 4516 | AJ91: 1417 | AK91: 190 | AL91: 31
A92: 86 | B92: Stafford | C92: 16 | D92: 56029 | E92: 27564 | F92: 65 | G92: 83 | H92: 285 | I92: 512 | J92: 525 | K92: 678 | L92: 614 | M92: 657 | N92: 7155 | O92: 2115 | P92: 3991 | Q92: 1765 | R92: 5338 | S92: 3043 | T92: 505 | U92: 233 | V92: 28465 | W92: 80 | X92: 41 | Y92: 207 | Z92: 509 | AA92: 431 | AB92: 570 | AC92: 570 | AD92: 552 | AE92: 8508 | AF92: 2852 | AG92: 4260 | AH92: 2398 | AI92: 5212 | AJ92: 1892 | AK92: 307 | AL92: 76
A93: 87 | B93: Surry | C93: 19 | D93: 4569 | E93: 2166 | F93: 22 | G93: 36 | H93: 65 | I93: 214 | J93: 107 | K93: 96 | L93: 91 | M93: 83 | N93: 760 | O93: 116 | P93: 242 | Q93: 97 | R93: 203 | S93: 31 | T93: 2 | U93: 1 | V93: 2403 | W93: 45 | X93: 19 | Y93: 31 | Z93: 120 | AA93: 85 | AB93: 105 | AC93: 110 | AD93: 125 | AE93: 745 | AF93: 180 | AG93: 384 | AH93: 105 | AI93: 219 | AJ93: 106 | AK93: 24 | AL93: 0
A94: 88 | B94: Sussex | C94: 19 | D94: 8899 | E94: 5092 | F94: 105 | G94: 71 | H94: 337 | I94: 274 | J94: 147 | K94: 499 | L94: 954 | M94: 131 | N94: 1632 | O94: 164 | P94: 229 | Q94: 138 | R94: 274 | S94: 92 | T94: 18 | U94: 27 | V94: 3807 | W94: 116 | X94: 25 | Y94: 137 | Z94: 401 | AA94: 121 | AB94: 176 | AC94: 164 | AD94: 115 | AE94: 1322 | AF94: 224 | AG94: 351 | AH94: 176 | AI94: 310 | AJ94: 126 | AK94: 36 | AL94: 7
A95: 89 | B95: Tazewell | C95: 2 | D95: 31291 | E95: 14467 | F95: 254 | G95: 299 | H95: 605 | I95: 1445 | J95: 592 | K95: 573 | L95: 533 | M95: 453 | N95: 4788 | O95: 1084 | P95: 1596 | Q95: 670 | R95: 1082 | S95: 282 | T95: 193 | U95: 18 | V95: 16824 | W95: 291 | X95: 214 | Y95: 595 | Z95: 1524 | AA95: 788 | AB95: 892 | AC95: 675 | AD95: 428 | AE95: 5383 | AF95: 1288 | AG95: 1620 | AH95: 1258 | AI95: 1198 | AJ95: 460 | AK95: 183 | AL95: 27
A96: 90 | B96: Warren | C96: 7 | D96: 21127 | E96: 10164 | F96: 93 | G96: 85 | H96: 292 | I96: 558 | J96: 273 | K96: 469 | L96: 308 | M96: 437 | N96: 3950 | O96: 699 | P96: 1071 | Q96: 384 | R96: 988 | S96: 282 | T96: 145 | U96: 130 | V96: 10963 | W96: 99 | X96: 61 | Y96: 210 | Z96: 739 | AA96: 363 | AB96: 414 | AC96: 435 | AD96: 341 | AE96: 4014 | AF96: 845 | AG96: 1180 | AH96: 633 | AI96: 1196 | AJ96: 327 | AK96: 91 | AL96: 15
A97: 91 | B97: Washington | C97: 3 | D97: 35958 | E97: 17022 | F97: 211 | G97: 178 | H97: 496 | I97: 1456 | J97: 695 | K97: 1031 | L97: 663 | M97: 333 | N97: 5247 | O97: 1156 | P97: 1867 | Q97: 856 | R97: 1688 | S97: 524 | T97: 313 | U97: 308 | V97: 18936 | W97: 179 | X97: 144 | Y97: 603 | Z97: 1387 | AA97: 739 | AB97: 863 | AC97: 585 | AD97: 404 | AE97: 5969 | AF97: 1317 | AG97: 2250 | AH97: 1539 | AI97: 1878 | AJ97: 720 | AK97: 199 | AL97: 160
A98: 92 | B98: Westmoreland | C98: 17 | D98: 11808 | E98: 5576 | F98: 123 | G98: 63 | H98: 236 | I98: 433 | J98: 244 | K98: 276 | L98: 257 | M98: 163 | N98: 1808 | O98: 335 | P98: 732 | Q98: 139 | R98: 467 | S98: 193 | T98: 92 | U98: 15 | V98: 6232 | W98: 73 | X98: 39 | Y98: 172 | Z98: 502 | AA98: 275 | AB98: 312 | AC98: 234 | AD98: 221 | AE98: 2140 | AF98: 534 | AG98: 745 | AH98: 180 | AI98: 508 | AJ98: 215 | AK98: 52 | AL98: 30
A99: 93 | B99: Wise | C99: 1 | D99: 26731 | E99: 12635 | F99: 222 | G99: 277 | H99: 570 | I99: 1462 | J99: 533 | K99: 827 | L99: 600 | M99: 363 | N99: 4026 | O99: 718 | P99: 1194 | Q99: 474 | R99: 776 | S99: 349 | T99: 142 | U99: 102 | V99: 14096 | W99: 214 | X99: 282 | Y99: 541 | Z99: 1629 | AA99: 659 | AB99: 810 | AC99: 662 | AD99: 369 | AE99: 3960 | AF99: 1099 | AG99: 1420 | AH99: 922 | AI99: 1030 | AJ99: 387 | AK99: 82 | AL99: 30
A100: 94 | B100: Wythe | C100: 3 | D100: 19528 | E100: 9069 | F100: 82 | G100: 104 | H100: 306 | I100: 791 | J100: 324 | K100: 548 | L100: 297 | M100: 360 | N100: 2914 | O100: 669 | P100: 876 | Q100: 691 | R100: 841 | S100: 173 | T100: 78 | U100: 15 | V100: 10459 | W100: 90 | X100: 86 | Y100: 254 | Z100: 1057 | AA100: 354 | AB100: 568 | AC100: 314 | AD100: 285 | AE100: 3420 | AF100: 826 | AG100: 1165 | AH100: 781 | AI100: 796 | AJ100: 335 | AK100: 65 | AL100: 63
A101: 95 | B101: York | C101: 23 | D101: 36168 | E101: 17092 | F101: 55 | G101: 35 | H101: 88 | I101: 237 | J101: 144 | K101: 254 | L101: 187 | M101: 233 | N101: 3199 | O101: 1348 | P101: 2887 | Q101: 1244 | R101: 3484 | S101: 2828 | T101: 465 | U101: 404 | V101: 19076 | W101: 61 | X101: 47 | Y101: 109 | Z101: 306 | AA101: 136 | AB101: 473 | AC101: 295 | AD101: 348 | AE101: 4450 | AF101: 1623 | AG101: 3412 | AH101: 1485 | AI101: 4083 | AJ101: 1773 | AK101: 322 | AL101: 153
A102: 96 | B102: Alexandria | C102: 8 | D102: 95730 | E102: 45725 | F102: 937 | G102: 503 | H102: 991 | I102: 699 | J102: 695 | K102: 651 | L102: 572 | M102: 1058 | N102: 5158 | O102: 1743 | P102: 4577 | Q102: 1901 | R102: 13358 | S102: 7673 | T102: 3704 | U102: 1505 | V102: 50005 | W102: 969 | X102: 511 | Y102: 844 | Z102: 828 | AA102: 745 | AB102: 725 | AC102: 631 | AD102: 1238 | AE102: 6957 | AF102: 2482 | AG102: 6021 | AH102: 2312 | AI102: 14914 | AJ102: 7566 | AK102: 2332 | AL102: 930
A103: 97 | B103: Bedford City | C103: 11 | D103: 4494 | E103: 2026 | F103: 49 | G103: 7 | H103: 23 | I103: 140 | J103: 39 | K103: 128 | L103: 97 | M103: 142 | N103: 628 | O103: 75 | P103: 261 | Q103: 82 | R103: 225 | S103: 88 | T103: 28 | U103: 14 | V103: 2468 | W103: 15 | X103: 7 | Y103: 35 | Z103: 171 | AA103: 93 | AB103: 133 | AC103: 111 | AD103: 117 | AE103: 828 | AF103: 105 | AG103: 406 | AH103: 118 | AI103: 253 | AJ103: 57 | AK103: 19 | AL103: 0
A104: 98 | B104: Bristol | C104: 3 | D104: 12366 | E104: 5334 | F104: 102 | G104: 86 | H104: 109 | I104: 335 | J104: 171 | K104: 179 | L104: 212 | M104: 170 | N104: 1635 | O104: 302 | P104: 637 | Q104: 280 | R104: 775 | S104: 187 | T104: 72 | U104: 82 | V104: 7032 | W104: 48 | X104: 32 | Y104: 212 | Z104: 606 | AA104: 298 | AB104: 432 | AC104: 253 | AD104: 165 | AE104: 1988 | AF104: 528 | AG104: 978 | AH104: 502 | AI104: 777 | AJ104: 184 | AK104: 10 | AL104: 19
A105: 99 | B105: Buena Vista | C105: 6 | D105: 4250 | E105: 1915 | F105: 24 | G105: 58 | H105: 81 | I105: 153 | J105: 54 | K105: 108 | L105: 74 | M105: 57 | N105: 645 | O105: 122 | P105: 234 | Q105: 91 | R105: 122 | S105: 54 | T105: 12 | U105: 26 | V105: 2335 | W105: 77 | X105: 31 | Y105: 32 | Z105: 224 | AA105: 60 | AB105: 116 | AC105: 122 | AD105: 46 | AE105: 801 | AF105: 240 | AG105: 236 | AH105: 119 | AI105: 159 | AJ105: 51 | AK105: 12 | AL105: 9
A106: 100 | B106: Charlottesville | C106: 10 | D106: 22868 | E106: 10388 | F106: 87 | G106: 65 | H106: 190 | I106: 396 | J106: 289 | K106: 304 | L106: 451 | M106: 231 | N106: 2069 | O106: 456 | P106: 1020 | Q106: 340 | R106: 1892 | S106: 1216 | T106: 599 | U106: 783 | V106: 12480 | W106: 117 | X106: 48 | Y106: 193 | Z106: 528 | AA106: 313 | AB106: 421 | AC106: 456 | AD106: 293 | AE106: 2831 | AF106: 711 | AG106: 1314 | AH106: 422 | AI106: 2545 | AJ106: 1516 | AK106: 388 | AL106: 384
A107: 101 | B107: Chesapeake | C107: 23 | D107: 125498 | E107: 58945 | F107: 386 | G107: 187 | H107: 449 | I107: 1281 | J107: 1149 | K107: 1936 | L107: 1662 | M107: 1778 | N107: 16392 | O107: 5529 | P107: 10051 | Q107: 3632 | R107: 9251 | S107: 3785 | T107: 1043 | U107: 434 | V107: 66553 | W107: 367 | X107: 157 | Y107: 620 | Z107: 1612 | AA107: 1429 | AB107: 1932 | AC107: 1846 | AD107: 1856 | AE107: 18448 | AF107: 6305 | AG107: 11112 | AH107: 4439 | AI107: 10675 | AJ107: 4682 | AK107: 890 | AL107: 183
A108: 103 | B108: Colonial Heights | C108: 19 | D108: 11675 | E108: 5187 | F108: 11 | G108: 20 | H108: 32 | I108: 132 | J108: 147 | K108: 145 | L108: 120 | M108: 126 | N108: 1652 | O108: 491 | P108: 778 | Q108: 373 | R108: 701 | S108: 308 | T108: 68 | U108: 83 | V108: 6488 | W108: 47 | X108: 5 | Y108: 47 | Z108: 218 | AA108: 200 | AB108: 200 | AC108: 260 | AD108: 196 | AE108: 2369 | AF108: 605 | AG108: 951 | AH108: 336 | AI108: 751 | AJ108: 249 | AK108: 28 | AL108: 26
A109: 104 | B109: Covington | C109: 5 | D109: 4485 | E109: 2074 | F109: 11 | G109: 17 | H109: 27 | I109: 148 | J109: 66 | K109: 119 | L109: 110 | M109: 99 | N109: 875 | O109: 187 | P109: 265 | Q109: 49 | R109: 82 | S109: 9 | T109: 10 | U109: 0 | V109: 2411 | W109: 8 | X109: 0 | Y109: 47 | Z109: 177 | AA109: 57 | AB109: 191 | AC109: 120 | AD109: 87 | AE109: 910 | AF109: 241 | AG109: 257 | AH109: 131 | AI109: 145 | AJ109: 26 | AK109: 14 | AL109: 0
A110: 105 | B110: Danville | C110: 12 | D110: 33196 | E110: 14309 | F110: 216 | G110: 199 | H110: 346 | I110: 991 | J110: 645 | K110: 825 | L110: 702 | M110: 629 | N110: 4361 | O110: 817 | P110: 1794 | Q110: 645 | R110: 1360 | S110: 383 | T110: 257 | U110: 139 | V110: 18887 | W110: 256 | X110: 189 | Y110: 407 | Z110: 1383 | AA110: 823 | AB110: 1198 | AC110: 936 | AD110: 709 | AE110: 5837 | AF110: 1237 | AG110: 2482 | AH110: 962 | AI110: 1492 | AJ110: 673 | AK110: 232 | AL110: 71
A111: 106 | B111: Emporia | C111: 19 | D111: 3775 | E111: 1638 | F111: 117 | G111: 39 | H111: 92 | I111: 160 | J111: 83 | K111: 79 | L111: 116 | M111: 40 | N111: 494 | O111: 66 | P111: 106 | Q111: 33 | R111: 131 | S111: 59 | T111: 18 | U111: 5 | V111: 2137 | W111: 101 | X111: 53 | Y111: 87 | Z111: 121 | AA111: 75 | AB111: 143 | AC111: 221 | AD111: 39 | AE111: 595 | AF111: 95 | AG111: 204 | AH111: 81 | AI111: 242 | AJ111: 73 | AK111: 7 | AL111: 0
A112: 107 | B112: Fairfax City | C112: 8 | D112: 15222 | E112: 7379 | F112: 113 | G112: 60 | H112: 154 | I112: 86 | J112: 82 | K112: 92 | L112: 78 | M112: 188 | N112: 1266 | O112: 223 | P112: 915 | Q112: 358 | R112: 1727 | S112: 1463 | T112: 322 | U112: 252 | V112: 7843 | W112: 112 | X112: 62 | Y112: 90 | Z112: 117 | AA112: 75 | AB112: 125 | AC112: 46 | AD112: 256 | AE112: 1706 | AF112: 560 | AG112: 925 | AH112: 584 | AI112: 2053 | AJ112: 872 | AK112: 162 | AL112: 98
A113: 108 | B113: Falls Church | C113: 8 | D113: 7464 | E113: 3512 | F113: 12 | G113: 14 | H113: 14 | I113: 23 | J113: 30 | K113: 5 | L113: 25 | M113: 8 | N113: 272 | O113: 114 | P113: 349 | Q113: 167 | R113: 1088 | S113: 793 | T113: 351 | U113: 247 | V113: 3952 | W113: 19 | X113: 27 | Y113: 10 | Z113: 18 | AA113: 17 | AB113: 39 | AC113: 9 | AD113: 38 | AE113: 666 | AF113: 174 | AG113: 535 | AH113: 121 | AI113: 1148 | AJ113: 827 | AK113: 218 | AL113: 86
A114: 109 | B114: Franklin City | C114: 23 | D114: 5642 | E114: 2355 | F114: 53 | G114: 50 | H114: 117 | I114: 125 | J114: 88 | K114: 95 | L114: 97 | M114: 53 | N114: 686 | O114: 119 | P114: 337 | Q114: 101 | R114: 290 | S114: 97 | T114: 26 | U114: 21 | V114: 3287 | W114: 46 | X114: 73 | Y114: 113 | Z114: 196 | AA114: 110 | AB114: 173 | AC114: 131 | AD114: 118 | AE114: 868 | AF114: 291 | AG114: 505 | AH114: 171 | AI114: 346 | AJ114: 128 | AK114: 18 | AL114: 0
A115: 110 | B115: Fredericksburg | C115: 16 | D115: 11211 | E115: 5233 | F115: 52 | G115: 24 | H115: 104 | I115: 164 | J115: 165 | K115: 141 | L115: 169 | M115: 126 | N115: 1428 | O115: 247 | P115: 622 | Q115: 182 | R115: 1032 | S115: 390 | T115: 257 | U115: 130 | V115: 5978 | W115: 21 | X115: 27 | Y115: 116 | Z115: 207 | AA115: 215 | AB115: 364 | AC115: 148 | AD115: 176 | AE115: 1658 | AF115: 450 | AG115: 706 | AH115: 276 | AI115: 979 | AJ115: 459 | AK115: 86 | AL115: 90
A116: 111 | B116: Galax | C116: 3 | D116: 4782 | E116: 2145 | F116: 69 | G116: 47 | H116: 209 | I116: 211 | J116: 111 | K116: 135 | L116: 49 | M116: 76 | N116: 592 | O116: 155 | P116: 152 | Q116: 77 | R116: 163 | S116: 34 | T116: 44 | U116: 21 | V116: 2637 | W116: 45 | X116: 29 | Y116: 102 | Z116: 295 | AA116: 112 | AB116: 183 | AC116: 119 | AD116: 101 | AE116: 778 | AF116: 156 | AG116: 270 | AH116: 179 | AI116: 195 | AJ116: 39 | AK116: 34 | AL116: 0
A117: 112 | B117: Hampton | C117: 23 | D117: 92477 | E117: 45291 | F117: 203 | G117: 145 | H117: 518 | I117: 945 | J117: 644 | K117: 1088 | L117: 1176 | M117: 1418 | N117: 12090 | O117: 4176 | P117: 8075 | Q117: 4174 | R117: 6007 | S117: 3521 | T117: 660 | U117: 451 | V117: 47186 | W117: 232 | X117: 189 | Y117: 473 | Z117: 1118 | AA117: 827 | AB117: 1489 | AC117: 1428 | AD117: 1509 | AE117: 13800 | AF117: 4105 | AG117: 8763 | AH117: 3754 | AI117: 6493 | AJ117: 2404 | AK117: 449 | AL117: 153
A118: 113 | B118: Harrisonburg | C118: 6 | D118: 17448 | E118: 8249 | F118: 147 | G118: 73 | H118: 236 | I118: 462 | J118: 240 | K118: 344 | L118: 232 | M118: 255 | N118: 1833 | O118: 426 | P118: 936 | Q118: 372 | R118: 1570 | S118: 574 | T118: 203 | U118: 346 | V118: 9199 | W118: 106 | X118: 111 | Y118: 258 | Z118: 460 | AA118: 266 | AB118: 294 | AC118: 274 | AD118: 288 | AE118: 2277 | AF118: 459 | AG118: 1157 | AH118: 495 | AI118: 1828 | AJ118: 640 | AK118: 102 | AL118: 184
A119: 114 | B119: Hopewell | C119: 19 | D119: 14323 | E119: 6445 | F119: 41 | G119: 18 | H119: 167 | I119: 334 | J119: 187 | K119: 378 | L119: 304 | M119: 274 | N119: 2364 | O119: 496 | P119: 942 | Q119: 215 | R119: 463 | S119: 198 | T119: 58 | U119: 6 | V119: 7878 | W119: 92 | X119: 44 | Y119: 121 | Z119: 470 | AA119: 318 | AB119: 479 | AC119: 437 | AD119: 381 | AE119: 2775 | AF119: 638 | AG119: 1009 | AH119: 378 | AI119: 480 | AJ119: 183 | AK119: 73 | AL119: 0
A120: 115 | B120: Lexington | C120: 6 | D120: 3285 | E120: 1476 | F120: 40 | G120: 18 | H120: 55 | I120: 69 | J120: 20 | K120: 37 | L120: 44 | M120: 26 | N120: 243 | O120: 47 | P120: 69 | Q120: 83 | R120: 315 | S120: 182 | T120: 48 | U120: 180 | V120: 1809 | W120: 24 | X120: 5 | Y120: 61 | Z120: 76 | AA120: 43 | AB120: 62 | AC120: 73 | AD120: 99 | AE120: 324 | AF120: 85 | AG120: 185 | AH120: 97 | AI120: 377 | AJ120: 208 | AK120: 22 | AL120: 68
A121: 116 | B121: Lynchburg | C121: 11 | D121: 40806 | E121: 17965 | F121: 153 | G121: 95 | H121: 352 | I121: 736 | J121: 394 | K121: 849 | L121: 593 | M121: 624 | N121: 4864 | O121: 1155 | P121: 2309 | Q121: 804 | R121: 2876 | S121: 1184 | T121: 601 | U121: 376 | V121: 22841 | W121: 169 | X121: 161 | Y121: 478 | Z121: 1177 | AA121: 584 | AB121: 959 | AC121: 988 | AD121: 659 | AE121: 6432 | AF121: 1384 | AG121: 3324 | AH121: 1262 | AI121: 3555 | AJ121: 1311 | AK121: 276 | AL121: 122
A122: 117 | B122: Manassas | C122: 8 | D122: 21188 | E122: 10673 | F122: 106 | G122: 126 | H122: 325 | I122: 220 | J122: 424 | K122: 382 | L122: 302 | M122: 361 | N122: 2324 | O122: 689 | P122: 1461 | Q122: 607 | R122: 2074 | S122: 975 | T122: 194 | U122: 103 | V122: 10515 | W122: 94 | X122: 104 | Y122: 323 | Z122: 194 | AA122: 258 | AB122: 251 | AC122: 279 | AD122: 215 | AE122: 2749 | AF122: 998 | AG122: 1715 | AH122: 719 | AI122: 1706 | AJ122: 731 | AK122: 103 | AL122: 76
A123: 118 | B123: Manassas Park | C123: 8 | D123: 6224 | E123: 3154 | F123: 28 | G123: 16 | H123: 132 | I123: 92 | J123: 125 | K123: 170 | L123: 142 | M123: 129 | N123: 779 | O123: 229 | P123: 496 | Q123: 161 | R123: 384 | S123: 215 | T123: 41 | U123: 15 | V123: 3070 | W123: 20 | X123: 4 | Y123: 109 | Z123: 53 | AA123: 75 | AB123: 136 | AC123: 124 | AD123: 112 | AE123: 931 | AF123: 290 | AG123: 412 | AH123: 194 | AI123: 511 | AJ123: 69 | AK123: 24 | AL123: 6
A124: 119 | B124: Martinsville | C124: 12 | D124: 10843 | E124: 4734 | F124: 66 | G124: 66 | H124: 171 | I124: 348 | J124: 172 | K124: 281 | L124: 296 | M124: 181 | N124: 1291 | O124: 185 | P124: 491 | Q124: 224 | R124: 564 | S124: 239 | T124: 115 | U124: 44 | V124: 6109 | W124: 48 | X124: 33 | Y124: 175 | Z124: 513 | AA124: 212 | AB124: 365 | AC124: 300 | AD124: 186 | AE124: 1887 | AF124: 401 | AG124: 709 | AH124: 442 | AI124: 574 | AJ124: 213 | AK124: 45 | AL124: 6
A125: 120 | B125: Newport News | C125: 23 | D125: 110083 | E125: 51178 | F125: 348 | G125: 158 | H125: 438 | I125: 1051 | J125: 774 | K125: 1526 | L125: 1500 | M125: 1769 | N125: 15122 | O125: 4244 | P125: 9588 | Q125: 3901 | R125: 6749 | S125: 2658 | T125: 822 | U125: 530 | V125: 58905 | W125: 400 | X125: 192 | Y125: 535 | Z125: 1543 | AA125: 1091 | AB125: 1753 | AC125: 1960 | AD125: 2015 | AE125: 18003 | AF125: 5458 | AG125: 10705 | AH125: 4119 | AI125: 7986 | AJ125: 2423 | AK125: 512 | AL125: 210
A126: 121 | B126: Norfolk | C126: 23 | D126: 135258 | E126: 65099 | F126: 603 | G126: 324 | H126: 827 | I126: 1781 | J126: 1523 | K126: 2524 | L126: 2440 | M126: 2623 | N126: 20236 | O126: 5300 | P126: 10914 | Q126: 3203 | R126: 7313 | S126: 3320 | T126: 1491 | U126: 677 | V126: 70159 | W126: 746 | X126: 309 | Y126: 765 | Z126: 2485 | AA126: 2203 | AB126: 3502 | AC126: 3364 | AD126: 3219 | AE126: 19756 | AF126: 5611 | AG126: 11082 | AH126: 3413 | AI126: 8794 | AJ126: 3639 | AK126: 747 | AL126: 524
A127: 122 | B127: Norton | C127: 1 | D127: 2665 | E127: 1145 | F127: 27 | G127: 20 | H127: 37 | I127: 70 | J127: 69 | K127: 98 | L127: 49 | M127: 9 | N127: 284 | O127: 79 | P127: 149 | Q127: 64 | R127: 135 | S127: 25 | T127: 30 | U127: 0 | V127: 1520 | W127: 40 | X127: 24 | Y127: 113 | Z127: 97 | AA127: 74 | AB127: 83 | AC127: 23 | AD127: 60 | AE127: 431 | AF127: 127 | AG127: 186 | AH127: 78 | AI127: 142 | AJ127: 23 | AK127: 15 | AL127: 4
A128: 123 | B128: Petersburg | C128: 19 | D128: 22289 | E128: 9675 | F128: 136 | G128: 121 | H128: 240 | I128: 680 | J128: 411 | K128: 485 | L128: 501 | M128: 480 | N128: 3114 | O128: 423 | P128: 1213 | Q128: 421 | R128: 968 | S128: 268 | T128: 114 | U128: 100 | V128: 12614 | W128: 189 | X128: 174 | Y128: 377 | Z128: 839 | AA128: 433 | AB128: 693 | AC128: 613 | AD128: 617 | AE128: 3645 | AF128: 842 | AG128: 1730 | AH128: 614 | AI128: 1170 | AJ128: 519 | AK128: 134 | AL128: 25
A129: 124 | B129: Poquoson | C129: 23 | D129: 7759 | E129: 3713 | F129: 3 | G129: 29 | H129: 8 | I129: 90 | J129: 61 | K129: 65 | L129: 95 | M129: 35 | N129: 989 | O129: 279 | P129: 554 | Q129: 251 | R129: 616 | S129: 436 | T129: 99 | U129: 103 | V129: 4046 | W129: 6 | X129: 25 | Y129: 24 | Z129: 82 | AA129: 35 | AB129: 132 | AC129: 143 | AD129: 57 | AE129: 1111 | AF129: 351 | AG129: 542 | AH129: 343 | AI129: 755 | AJ129: 376 | AK129: 42 | AL129: 22
A130: 125 | B130: Portsmouth | C130: 23 | D130: 63685 | E130: 29122 | F130: 322 | G130: 169 | H130: 510 | I130: 1245 | J130: 826 | K130: 1501 | L130: 1239 | M130: 1217 | N130: 8698 | O130: 2468 | P130: 5209 | Q130: 1834 | R130: 2430 | S130: 836 | T130: 453 | U130: 165 | V130: 34563 | W130: 390 | X130: 243 | Y130: 602 | Z130: 1595 | AA130: 1188 | AB130: 1707 | AC130: 1511 | AD130: 1558 | AE130: 10021 | AF130: 2986 | AG130: 5854 | AH130: 1997 | AI130: 3361 | AJ130: 1267 | AK130: 219 | AL130: 64
A131: 126 | B131: Radford | C131: 4 | D131: 6766 | E131: 3245 | F131: 32 | G131: 0 | H131: 37 | I131: 144 | J131: 30 | K131: 96 | L131: 72 | M131: 98 | N131: 512 | O131: 163 | P131: 622 | Q131: 259 | R131: 657 | S131: 213 | T131: 96 | U131: 214 | V131: 3521 | W131: 32 | X131: 8 | Y131: 29 | Z131: 236 | AA131: 23 | AB131: 119 | AC131: 85 | AD131: 83 | AE131: 817 | AF131: 209 | AG131: 535 | AH131: 221 | AI131: 597 | AJ131: 358 | AK131: 65 | AL131: 104
A132: 127 | B132: Richmond City | C132: 15 | D132: 128555 | E132: 58197 | F132: 824 | G132: 424 | H132: 1232 | I132: 2479 | J132: 1796 | K132: 2620 | L132: 2289 | M132: 2654 | N132: 13714 | O132: 2754 | P132: 7506 | Q132: 1657 | R132: 11235 | S132: 3923 | T132: 2138 | U132: 952 | V132: 70358 | W132: 810 | X132: 458 | Y132: 1000 | Z132: 2632 | AA132: 2404 | AB132: 3765 | AC132: 3452 | AD132: 3068 | AE132: 16600 | AF132: 3975 | AG132: 9989 | AH132: 2592 | AI132: 12716 | AJ132: 4916 | AK132: 1389 | AL132: 592
A133: 128 | B133: Roanoke City | C133: 5 | D133: 65593 | E133: 29809 | F133: 286 | G133: 169 | H133: 518 | I133: 1518 | J133: 1097 | K133: 1355 | L133: 1181 | M133: 1552 | N133: 8883 | O133: 1772 | P133: 3897 | Q133: 1697 | R133: 3555 | S133: 1209 | T133: 926 | U133: 194 | V133: 35784 | W133: 272 | X133: 91 | Y133: 476 | Z133: 1483 | AA133: 1212 | AB133: 1550 | AC133: 1419 | AD133: 1563 | AE133: 11034 | AF133: 2615 | AG133: 5290 | AH133: 2374 | AI133: 4404 | AJ133: 1424 | AK133: 499 | AL133: 78
A134: 129 | B134: Salem | C134: 5 | D134: 16657 | E134: 7627 | F134: 32 | G134: 26 | H134: 131 | I134: 319 | J134: 302 | K134: 238 | L134: 288 | M134: 201 | N134: 2357 | O134: 372 | P134: 1258 | Q134: 496 | R134: 1010 | S134: 358 | T134: 129 | U134: 110 | V134: 9030 | W134: 34 | X134: 6 | Y134: 156 | Z134: 363 | AA134: 181 | AB134: 301 | AC134: 210 | AD134: 215 | AE134: 3000 | AF134: 808 | AG134: 1449 | AH134: 614 | AI134: 1175 | AJ134: 357 | AK134: 88 | AL134: 73
A135: 130 | B135: Staunton | C135: 6 | D135: 16703 | E135: 7998 | F135: 76 | G135: 78 | H135: 192 | I135: 520 | J135: 236 | K135: 303 | L135: 456 | M135: 204 | N135: 2420 | O135: 495 | P135: 946 | Q135: 402 | R135: 986 | S135: 404 | T135: 203 | U135: 77 | V135: 8705 | W135: 81 | X135: 77 | Y135: 152 | Z135: 509 | AA135: 240 | AB135: 310 | AC135: 342 | AD135: 293 | AE135: 2784 | AF135: 613 | AG135: 1206 | AH135: 364 | AI135: 1077 | AJ135: 465 | AK135: 88 | AL135: 104
A136: 131 | B136: Suffolk | C136: 23 | D136: 41662 | E136: 19423 | F136: 238 | G136: 237 | H136: 420 | I136: 917 | J136: 624 | K136: 828 | L136: 555 | M136: 699 | N136: 5979 | O136: 1603 | P136: 3025 | Q136: 1141 | R136: 2019 | S136: 685 | T136: 327 | U136: 126 | V136: 22239 | W136: 195 | X136: 255 | Y136: 578 | Z136: 956 | AA136: 599 | AB136: 1044 | AC136: 816 | AD136: 691 | AE136: 6359 | AF136: 1582 | AG136: 3359 | AH136: 1752 | AI136: 2853 | AJ136: 862 | AK136: 279 | AL136: 59
A137: 132 | B137: Virginia Beach | C137: 23 | D137: 266627 | E137: 127634 | F137: 516 | G137: 187 | H137: 595 | I137: 1465 | J137: 1197 | K137: 2213 | L137: 2464 | M137: 2678 | N137: 32612 | O137: 12864 | P137: 24557 | Q137: 8997 | R137: 24516 | S137: 8556 | T137: 3223 | U137: 994 | V137: 138993 | W137: 519 | X137: 375 | Y137: 863 | Z137: 1997 | AA137: 1789 | AB137: 2361 | AC137: 2717 | AD137: 3529 | AE137: 36542 | AF137: 13448 | AG137: 26110 | AH137: 11083 | AI137: 26646 | AJ137: 8526 | AK137: 1925 | AL137: 563
A138: 133 | B138: Waynesboro | C138: 6 | D138: 13303 | E138: 5989 | F138: 95 | G138: 35 | H138: 145 | I138: 242 | J138: 216 | K138: 186 | L138: 196 | M138: 169 | N138: 1964 | O138: 321 | P138: 678 | Q138: 274 | R138: 921 | S138: 358 | T138: 90 | U138: 99 | V138: 7314 | W138: 25 | X138: 43 | Y138: 169 | Z138: 382 | AA138: 179 | AB138: 310 | AC138: 310 | AD138: 241 | AE138: 2539 | AF138: 658 | AG138: 940 | AH138: 247 | AI138: 907 | AJ138: 271 | AK138: 63 | AL138: 30
A139: 134 | B139: Williamsburg | C139: 23 | D139: 5360 | E139: 2506 | F139: 35 | G139: 7 | H139: 38 | I139: 35 | J139: 14 | K139: 63 | L139: 41 | M139: 34 | N139: 505 | O139: 139 | P139: 276 | Q139: 105 | R139: 601 | S139: 306 | T139: 121 | U139: 186 | V139: 2854 | W139: 12 | X139: 0 | Y139: 26 | Z139: 49 | AA139: 33 | AB139: 42 | AC139: 55 | AD139: 73 | AE139: 610 | AF139: 139 | AG139: 469 | AH139: 147 | AI139: 667 | AJ139: 363 | AK139: 89 | AL139: 80
A140: 135 | B140: Winchester | C140: 7 | D140: 15316 | E140: 7242 | F140: 64 | G140: 64 | H140: 241 | I140: 511 | J140: 270 | K140: 326 | L140: 253 | M140: 245 | N140: 1801 | O140: 400 | P140: 973 | Q140: 313 | R140: 1022 | S140: 428 | T140: 227 | U140: 104 | V140: 8074 | W140: 76 | X140: 54 | Y140: 148 | Z140: 384 | AA140: 273 | AB140: 351 | AC140: 299 | AD140: 216 | AE140: 2285 | AF140: 674 | AG140: 1023 | AH140: 439 | AI140: 1135 | AJ140: 616 | AK140: 69 | AL140: 32
B142: Total Counties | D142: =SUM(R[-135]C:R[-38]C) -> 3291631 | E142: =SUM(R[-135]C:R[-38]C) -> 1587773 | F142: =SUM(R[-135]C:R[-38]C) -> 19348 | G142: =SUM(R[-135]C:R[-38]C) -> 13938 | H142: =SUM(R[-135]C:R[-38]C) -> 33269 | I142: =SUM(R[-135]C:R[-38]C) -> 67193 | J142: =SUM(R[-135]C:R[-38]C) -> 40270 | K142: =SUM(R[-135]C:R[-38]C) -> 50584 | L142: =SUM(R[-135]C:R[-38]C) -> 44775 | M142: =SUM(R[-135]C:R[-38]C) -> 43051 | N142: =SUM(R[-135]C:R[-38]C) -> 381329 | O142: =SUM(R[-135]C:R[-38]C) -> 90857 | P142: =SUM(R[-135]C:R[-38]C) -> 185163 | Q142: =SUM(R[-135]C:R[-38]C) -> 74566 | R142: =SUM(R[-135]C:R[-38]C) -> 302120 | S142: =SUM(R[-135]C:R[-38]C) -> 158567 | T142: =SUM(R[-135]C:R[-38]C) -> 50235 | U142: =SUM(R[-135]C:R[-38]C) -> 32508 | V142: =SUM(R[-135]C:R[-38]C) -> 1703858 | W142: =SUM(R[-135]C:R[-38]C) -> 16956 | X142: =SUM(R[-135]C:R[-38]C) -> 11166 | Y142: =SUM(R[-135]C:R[-38]C) -> 27027 | Z142: =SUM(R[-135]C:R[-38]C) -> 66629 | AA142: =SUM(R[-135]C:R[-38]C) -> 37593 | AB142: =SUM(R[-135]C:R[-38]C) -> 50712 | AC142: =SUM(R[-135]C:R[-38]C) -> 43718 | AD142: =SUM(R[-135]C:R[-38]C) -> 41848 | AE142: =SUM(R[-135]C:R[-38]C) -> 451245 | AF142: =SUM(R[-135]C:R[-38]C) -> 122202 | AG142: =SUM(R[-135]C:R[-38]C) -> 224345 | AH142: =SUM(R[-135]C:R[-38]C) -> 104985 | AI142: =SUM(R[-135]C:R[-38]C) -> 325427 | AJ142: =SUM(R[-135]C:R[-38]C) -> 134866 | AK142: =SUM(R[-135]C:R[-38]C) -> 31643 | AL142: =SUM(R[-135]C:R[-38]C) -> 13496
B143: Total Cities | D143: =SUM(R[-38]C:R[-3]C) -> 1374943 | E143: =SUM(R[-38]C:R[-3]C) -> 642669 | F143: =SUM(R[-38]C:R[-3]C) -> 5572 | G143: =SUM(R[-38]C:R[-3]C) -> 3385 | H143: =SUM(R[-38]C:R[-3]C) -> 9380 | I143: =SUM(R[-38]C:R[-3]C) -> 20143 | J143: =SUM(R[-38]C:R[-3]C) -> 14561 | K143: =SUM(R[-38]C:R[-3]C) -> 21940 | L143: =SUM(R[-38]C:R[-3]C) -> 20361 | M143: =SUM(R[-38]C:R[-3]C) -> 21346 | N143: =SUM(R[-38]C:R[-3]C) -> 175710 | O143: =SUM(R[-38]C:R[-3]C) -> 49605 | P143: =SUM(R[-38]C:R[-3]C) -> 102767 | Q143: =SUM(R[-38]C:R[-3]C) -> 37703 | R143: =SUM(R[-38]C:R[-3]C) -> 96825 | S143: =SUM(R[-38]C:R[-3]C) -> 39662 | T143: =SUM(R[-38]C:R[-3]C) -> 15416 | U143: =SUM(R[-38]C:R[-3]C) -> 8293 | V143: =SUM(R[-38]C:R[-3]C) -> 732274 | W143: =SUM(R[-38]C:R[-3]C) -> 5828 | X143: =SUM(R[-38]C:R[-3]C) -> 3686 | Y143: =SUM(R[-38]C:R[-3]C) -> 9875 | Z143: =SUM(R[-38]C:R[-3]C) -> 24789 | AA143: =SUM(R[-38]C:R[-3]C) -> 18026 | AB143: =SUM(R[-38]C:R[-3]C) -> 27143 | AC143: =SUM(R[-38]C:R[-3]C) -> 25636 | AD143: =SUM(R[-38]C:R[-3]C) -> 24862 | AE143: =SUM(R[-38]C:R[-3]C) -> 204179 | AF143: =SUM(R[-38]C:R[-3]C) -> 59521 | AG143: =SUM(R[-38]C:R[-3]C) -> 117240 | AH143: =SUM(R[-38]C:R[-3]C) -> 45559 | AI143: =SUM(R[-38]C:R[-3]C) -> 110639 | AJ143: =SUM(R[-38]C:R[-3]C) -> 41759 | AK143: =SUM(R[-38]C:R[-3]C) -> 9406 | AL143: =SUM(R[-38]C:R[-3]C) -> 4126
B145: Metro areas
B146: Blacksburg | D146: =R[-105]C+R[-80]C+R[-66]C+R[-15]C -> 87090 | E146: =R[-105]C+R[-80]C+R[-66]C+R[-15]C -> 42223 | F146: =R[-105]C+R[-80]C+R[-66]C+R[-15]C -> 320 | G146: =R[-105]C+R[-80]C+R[-66]C+R[-15]C -> 314 | H146: =R[-105]C+R[-80]C+R[-66]C+R[-15]C -> 814 | I146: =R[-105]C+R[-80]C+R[-66]C+R[-15]C -> 2439 | J146: =R[-105]C+R[-80]C+R[-66]C+R[-15]C -> 1125 | K146: =R[-105]C+R[-80]C+R[-66]C+R[-15]C -> 1317 | L146: =R[-105]C+R[-80]C+R[-66]C+R[-15]C -> 1267 | M146: =R[-105]C+R[-80]C+R[-66]C+R[-15]C -> 901 | N146: =R[-105]C+R[-80]C+R[-66]C+R[-15]C -> 11504 | O146: =R[-105]C+R[-80]C+R[-66]C+R[-15]C -> 2569 | P146: =R[-105]C+R[-80]C+R[-66]C+R[-15]C -> 5153 | Q146: =R[-105]C+R[-80]C+R[-66]C+R[-15]C -> 2775 | R146: =R[-105]C+R[-80]C+R[-66]C+R[-15]C -> 5597 | S146: =R[-105]C+R[-80]C+R[-66]C+R[-15]C -> 2939 | T146: =R[-105]C+R[-80]C+R[-66]C+R[-15]C -> 735 | U146: =R[-105]C+R[-80]C+R[-66]C+R[-15]C -> 2454 | V146: =R[-105]C+R[-80]C+R[-66]C+R[-15]C -> 44867 | W146: =R[-105]C+R[-80]C+R[-66]C+R[-15]C -> 303 | X146: =R[-105]C+R[-80]C+R[-66]C+R[-15]C -> 310 | Y146: =R[-105]C+R[-80]C+R[-66]C+R[-15]C -> 819 | Z146: =R[-105]C+R[-80]C+R[-66]C+R[-15]C -> 2719 | AA146: =R[-105]C+R[-80]C+R[-66]C+R[-15]C -> 1157 | AB146: =R[-105]C+R[-80]C+R[-66]C+R[-15]C -> 1989 | AC146: =R[-105]C+R[-80]C+R[-66]C+R[-15]C -> 1152 | AD146: =R[-105]C+R[-80]C+R[-66]C+R[-15]C -> 997 | AE146: =R[-105]C+R[-80]C+R[-66]C+R[-15]C -> 13484 | AF146: =R[-105]C+R[-80]C+R[-66]C+R[-15]C -> 2987 | AG146: =R[-105]C+R[-80]C+R[-66]C+R[-15]C -> 5418 | AH146: =R[-105]C+R[-80]C+R[-66]C+R[-15]C -> 2846 | AI146: =R[-105]C+R[-80]C+R[-66]C+R[-15]C -> 6003 | AJ146: =R[-105]C+R[-80]C+R[-66]C+R[-15]C -> 3315 | AK146: =R[-105]C+R[-80]C+R[-66]C+R[-15]C -> 468 | AL146: =R[-105]C+R[-80]C+R[-66]C+R[-15]C -> 900
B147: Bristol combined | D147: =R[-60]C+R[-50]C+R[-43]C -> 65170 | E147: =R[-60]C+R[-50]C+R[-43]C -> 30315 | F147: =R[-60]C+R[-50]C+R[-43]C -> 489 | G147: =R[-60]C+R[-50]C+R[-43]C -> 522 | H147: =R[-60]C+R[-50]C+R[-43]C -> 966 | I147: =R[-60]C+R[-50]C+R[-43]C -> 2710 | J147: =R[-60]C+R[-50]C+R[-43]C -> 1213 | K147: =R[-60]C+R[-50]C+R[-43]C -> 1616 | L147: =R[-60]C+R[-50]C+R[-43]C -> 1170 | M147: =R[-60]C+R[-50]C+R[-43]C -> 647 | N147: =R[-60]C+R[-50]C+R[-43]C -> 9917 | O147: =R[-60]C+R[-50]C+R[-43]C -> 1905 | P147: =R[-60]C+R[-50]C+R[-43]C -> 3155 | Q147: =R[-60]C+R[-50]C+R[-43]C -> 1426 | R147: =R[-60]C+R[-50]C+R[-43]C -> 2899 | S147: =R[-60]C+R[-50]C+R[-43]C -> 816 | T147: =R[-60]C+R[-50]C+R[-43]C -> 453 | U147: =R[-60]C+R[-50]C+R[-43]C -> 411 | V147: =R[-60]C+R[-50]C+R[-43]C -> 34855 | W147: =R[-60]C+R[-50]C+R[-43]C -> 348 | X147: =R[-60]C+R[-50]C+R[-43]C -> 431 | Y147: =R[-60]C+R[-50]C+R[-43]C -> 1207 | Z147: =R[-60]C+R[-50]C+R[-43]C -> 3077 | AA147: =R[-60]C+R[-50]C+R[-43]C -> 1490 | AB147: =R[-60]C+R[-50]C+R[-43]C -> 1638 | AC147: =R[-60]C+R[-50]C+R[-43]C -> 1179 | AD147: =R[-60]C+R[-50]C+R[-43]C -> 674 | AE147: =R[-60]C+R[-50]C+R[-43]C -> 11030 | AF147: =R[-60]C+R[-50]C+R[-43]C -> 2599 | AG147: =R[-60]C+R[-50]C+R[-43]C -> 3981 | AH147: =R[-60]C+R[-50]C+R[-43]C -> 2480 | AI147: =R[-60]C+R[-50]C+R[-43]C -> 3222 | AJ147: =R[-60]C+R[-50]C+R[-43]C -> 1052 | AK147: =R[-60]C+R[-50]C+R[-43]C -> 242 | AL147: =R[-60]C+R[-50]C+R[-43]C -> 205
B148: Charlottesville | D148: =R[-140]C+R[-110]C+R[-103]C+R[-81]C+R[-42]C -> 111363 | E148: =R[-140]C+R[-110]C+R[-103]C+R[-81]C+R[-42]C -> 51729 | F148: =R[-140]C+R[-110]C+R[-103]C+R[-81]C+R[-42]C -> 421 | G148: =R[-140]C+R[-110]C+R[-103]C+R[-81]C+R[-42]C -> 369 | H148: =R[-140]C+R[-110]C+R[-103]C+R[-81]C+R[-42]C -> 1051 | I148: =R[-140]C+R[-110]C+R[-103]C+R[-81]C+R[-42]C -> 2212 | J148: =R[-140]C+R[-110]C+R[-103]C+R[-81]C+R[-42]C -> 1275 | K148: =R[-140]C+R[-110]C+R[-103]C+R[-81]C+R[-42]C -> 1526 | L148: =R[-140]C+R[-110]C+R[-103]C+R[-81]C+R[-42]C -> 1704 | M148: =R[-140]C+R[-110]C+R[-103]C+R[-81]C+R[-42]C -> 1192 | N148: =R[-140]C+R[-110]C+R[-103]C+R[-81]C+R[-42]C -> 10947 | O148: =R[-140]C+R[-110]C+R[-103]C+R[-81]C+R[-42]C -> 2717 | P148: =R[-140]C+R[-110]C+R[-103]C+R[-81]C+R[-42]C -> 5218 | Q148: =R[-140]C+R[-110]C+R[-103]C+R[-81]C+R[-42]C -> 2165 | R148: =R[-140]C+R[-110]C+R[-103]C+R[-81]C+R[-42]C -> 10075 | S148: =R[-140]C+R[-110]C+R[-103]C+R[-81]C+R[-42]C -> 5434 | T148: =R[-140]C+R[-110]C+R[-103]C+R[-81]C+R[-42]C -> 2696 | U148: =R[-140]C+R[-110]C+R[-103]C+R[-81]C+R[-42]C -> 2727 | V148: =R[-140]C+R[-110]C+R[-103]C+R[-81]C+R[-42]C -> 59634 | W148: =R[-140]C+R[-110]C+R[-103]C+R[-81]C+R[-42]C -> 584 | X148: =R[-140]C+R[-110]C+R[-103]C+R[-81]C+R[-42]C -> 403 | Y148: =R[-140]C+R[-110]C+R[-103]C+R[-81]C+R[-42]C -> 740 | Z148: =R[-140]C+R[-110]C+R[-103]C+R[-81]C+R[-42]C -> 2210 | AA148: =R[-140]C+R[-110]C+R[-103]C+R[-81]C+R[-42]C -> 1147 | AB148: =R[-140]C+R[-110]C+R[-103]C+R[-81]C+R[-42]C -> 1624 | AC148: =R[-140]C+R[-110]C+R[-103]C+R[-81]C+R[-42]C -> 1708 | AD148: =R[-140]C+R[-110]C+R[-103]C+R[-81]C+R[-42]C -> 1206 | AE148: =R[-140]C+R[-110]C+R[-103]C+R[-81]C+R[-42]C -> 14420 | AF148: =R[-140]C+R[-110]C+R[-103]C+R[-81]C+R[-42]C -> 4009 | AG148: =R[-140]C+R[-110]C+R[-103]C+R[-81]C+R[-42]C -> 6686 | AH148: =R[-140]C+R[-110]C+R[-103]C+R[-81]C+R[-42]C -> 3207 | AI148: =R[-140]C+R[-110]C+R[-103]C+R[-81]C+R[-42]C -> 12359 | AJ148: =R[-140]C+R[-110]C+R[-103]C+R[-81]C+R[-42]C -> 6437 | AK148: =R[-140]C+R[-110]C+R[-103]C+R[-81]C+R[-42]C -> 1719 | AL148: =R[-140]C+R[-110]C+R[-103]C+R[-81]C+R[-42]C -> 1175
B149: Danville | D149: =R[-74]C+R[-39]C -> 76316 | E149: =R[-74]C+R[-39]C -> 34925 | F149: =R[-74]C+R[-39]C -> 634 | G149: =R[-74]C+R[-39]C -> 643 | H149: =R[-74]C+R[-39]C -> 1010 | I149: =R[-74]C+R[-39]C -> 2812 | J149: =R[-74]C+R[-39]C -> 1491 | K149: =R[-74]C+R[-39]C -> 2106 | L149: =R[-74]C+R[-39]C -> 1698 | M149: =R[-74]C+R[-39]C -> 1474 | N149: =R[-74]C+R[-39]C -> 11199 | O149: =R[-74]C+R[-39]C -> 2013 | P149: =R[-74]C+R[-39]C -> 3939 | Q149: =R[-74]C+R[-39]C -> 1856 | R149: =R[-74]C+R[-39]C -> 2561 | S149: =R[-74]C+R[-39]C -> 872 | T149: =R[-74]C+R[-39]C -> 430 | U149: =R[-74]C+R[-39]C -> 187 | V149: =R[-74]C+R[-39]C -> 41391 | W149: =R[-74]C+R[-39]C -> 543 | X149: =R[-74]C+R[-39]C -> 422 | Y149: =R[-74]C+R[-39]C -> 929 | Z149: =R[-74]C+R[-39]C -> 3130 | AA149: =R[-74]C+R[-39]C -> 1665 | AB149: =R[-74]C+R[-39]C -> 2451 | AC149: =R[-74]C+R[-39]C -> 1953 | AD149: =R[-74]C+R[-39]C -> 1611 | AE149: =R[-74]C+R[-39]C -> 14172 | AF149: =R[-74]C+R[-39]C -> 2812 | AG149: =R[-74]C+R[-39]C -> 4906 | AH149: =R[-74]C+R[-39]C -> 2247 | AI149: =R[-74]C+R[-39]C -> 2862 | AJ149: =R[-74]C+R[-39]C -> 1172 | AK149: =R[-74]C+R[-39]C -> 434 | AL149: =R[-74]C+R[-39]C -> 82
B150: Harrisonburg | D150: =R[-65]C+R[-32]C -> 62571 | E150: =R[-65]C+R[-32]C -> 29981 | F150: =R[-65]C+R[-32]C -> 417 | G150: =R[-65]C+R[-32]C -> 268 | H150: =R[-65]C+R[-32]C -> 896 | I150: =R[-65]C+R[-32]C -> 2393 | J150: =R[-65]C+R[-32]C -> 1069 | K150: =R[-65]C+R[-32]C -> 1456 | L150: =R[-65]C+R[-32]C -> 1127 | M150: =R[-65]C+R[-32]C -> 941 | N150: =R[-65]C+R[-32]C -> 9347 | O150: =R[-65]C+R[-32]C -> 1610 | P150: =R[-65]C+R[-32]C -> 2899 | Q150: =R[-65]C+R[-32]C -> 1057 | R150: =R[-65]C+R[-32]C -> 3897 | S150: =R[-65]C+R[-32]C -> 1442 | T150: =R[-65]C+R[-32]C -> 489 | U150: =R[-65]C+R[-32]C -> 673 | V150: =R[-65]C+R[-32]C -> 32590 | W150: =R[-65]C+R[-32]C -> 340 | X150: =R[-65]C+R[-32]C -> 256 | Y150: =R[-65]C+R[-32]C -> 599 | Z150: =R[-65]C+R[-32]C -> 2182 | AA150: =R[-65]C+R[-32]C -> 1100 | AB150: =R[-65]C+R[-32]C -> 1413 | AC150: =R[-65]C+R[-32]C -> 1118 | AD150: =R[-65]C+R[-32]C -> 944 | AE150: =R[-65]C+R[-32]C -> 10697 | AF150: =R[-65]C+R[-32]C -> 1862 | AG150: =R[-65]C+R[-32]C -> 3593 | AH150: =R[-65]C+R[-32]C -> 1587 | AI150: =R[-65]C+R[-32]C -> 4584 | AJ150: =R[-65]C+R[-32]C -> 1585 | AK150: =R[-65]C+R[-32]C -> 391 | AL150: =R[-65]C+R[-32]C -> 339
B151: Lynchburg | D151: =R[-140]C+R[-139]C+R[-135]C+R[-129]C+R[-48]C+R[-30]C -> 153445 | E151: =R[-140]C+R[-139]C+R[-135]C+R[-129]C+R[-48]C+R[-30]C -> 71911 | F151: =R[-140]C+R[-139]C+R[-135]C+R[-129]C+R[-48]C+R[-30]C -> 1249 | G151: =R[-140]C+R[-139]C+R[-135]C+R[-129]C+R[-48]C+R[-30]C -> 596 | H151: =R[-140]C+R[-139]C+R[-135]C+R[-129]C+R[-48]C+R[-30]C -> 1603 | I151: =R[-140]C+R[-139]C+R[-135]C+R[-129]C+R[-48]C+R[-30]C -> 4143 | J151: =R[-140]C+R[-139]C+R[-135]C+R[-129]C+R[-48]C+R[-30]C -> 2400 | K151: =R[-140]C+R[-139]C+R[-135]C+R[-129]C+R[-48]C+R[-30]C -> 3381 | L151: =R[-140]C+R[-139]C+R[-135]C+R[-129]C+R[-48]C+R[-30]C -> 2529 | M151: =R[-140]C+R[-139]C+R[-135]C+R[-129]C+R[-48]C+R[-30]C -> 2583 | N151: =R[-140]C+R[-139]C+R[-135]C+R[-129]C+R[-48]C+R[-30]C -> 22082 | O151: =R[-140]C+R[-139]C+R[-135]C+R[-129]C+R[-48]C+R[-30]C -> 4663 | P151: =R[-140]C+R[-139]C+R[-135]C+R[-129]C+R[-48]C+R[-30]C -> 8789 | Q151: =R[-140]C+R[-139]C+R[-135]C+R[-129]C+R[-48]C+R[-30]C -> 3666 | R151: =R[-140]C+R[-139]C+R[-135]C+R[-129]C+R[-48]C+R[-30]C -> 8818 | S151: =R[-140]C+R[-139]C+R[-135]C+R[-129]C+R[-48]C+R[-30]C -> 3464 | T151: =R[-140]C+R[-139]C+R[-135]C+R[-129]C+R[-48]C+R[-30]C -> 1153 | U151: =R[-140]C+R[-139]C+R[-135]C+R[-129]C+R[-48]C+R[-30]C -> 792 | V151: =R[-140]C+R[-139]C+R[-135]C+R[-129]C+R[-48]C+R[-30]C -> 81534 | W151: =R[-140]C+R[-139]C+R[-135]C+R[-129]C+R[-48]C+R[-30]C -> 971 | X151: =R[-140]C+R[-139]C+R[-135]C+R[-129]C+R[-48]C+R[-30]C -> 479 | Y151: =R[-140]C+R[-139]C+R[-135]C+R[-129]C+R[-48]C+R[-30]C -> 1324 | Z151: =R[-140]C+R[-139]C+R[-135]C+R[-129]C+R[-48]C+R[-30]C -> 4237 | AA151: =R[-140]C+R[-139]C+R[-135]C+R[-129]C+R[-48]C+R[-30]C -> 2383 | AB151: =R[-140]C+R[-139]C+R[-135]C+R[-129]C+R[-48]C+R[-30]C -> 3530 | AC151: =R[-140]C+R[-139]C+R[-135]C+R[-129]C+R[-48]C+R[-30]C -> 3130 | AD151: =R[-140]C+R[-139]C+R[-135]C+R[-129]C+R[-48]C+R[-30]C -> 2500 | AE151: =R[-140]C+R[-139]C+R[-135]C+R[-129]C+R[-48]C+R[-30]C -> 26970 | AF151: =R[-140]C+R[-139]C+R[-135]C+R[-129]C+R[-48]C+R[-30]C -> 5592 | AG151: =R[-140]C+R[-139]C+R[-135]C+R[-129]C+R[-48]C+R[-30]C -> 11054 | AH151: =R[-140]C+R[-139]C+R[-135]C+R[-129]C+R[-48]C+R[-30]C -> 4858 | AI151: =R[-140]C+R[-139]C+R[-135]C+R[-129]C+R[-48]C+R[-30]C -> 9975 | AJ151: =R[-140]C+R[-139]C+R[-135]C+R[-129]C+R[-48]C+R[-30]C -> 3320 | AK151: =R[-140]C+R[-139]C+R[-135]C+R[-129]C+R[-48]C+R[-30]C -> 907 | AL151: =R[-140]C+R[-139]C+R[-135]C+R[-129]C+R[-48]C+R[-30]C -> 304
B152: NoVa | D152: =R[-139]C+R[-124]C+R[-117]C+R[-116]C+R[-93]C+R[-73]C+R[-61]C+R[-60]C+R[-56]C+R[-50]C+R[-40]C+R[-39]C+R[-37]C+R[-30]C+R[-29]C -> 1409341 | E152: =R[-139]C+R[-124]C+R[-117]C+R[-116]C+R[-93]C+R[-73]C+R[-61]C+R[-60]C+R[-56]C+R[-50]C+R[-40]C+R[-39]C+R[-37]C+R[-30]C+R[-29]C -> 686257 | F152: =R[-139]C+R[-124]C+R[-117]C+R[-116]C+R[-93]C+R[-73]C+R[-61]C+R[-60]C+R[-56]C+R[-50]C+R[-40]C+R[-39]C+R[-37]C+R[-30]C+R[-29]C -> 7822 | G152: =R[-139]C+R[-124]C+R[-117]C+R[-116]C+R[-93]C+R[-73]C+R[-61]C+R[-60]C+R[-56]C+R[-50]C+R[-40]C+R[-39]C+R[-37]C+R[-30]C+R[-29]C -> 4021 | H152: =R[-139]C+R[-124]C+R[-117]C+R[-116]C+R[-93]C+R[-73]C+R[-61]C+R[-60]C+R[-56]C+R[-50]C+R[-40]C+R[-39]C+R[-37]C+R[-30]C+R[-29]C -> 10336 | I152: =R[-139]C+R[-124]C+R[-117]C+R[-116]C+R[-93]C+R[-73]C+R[-61]C+R[-60]C+R[-56]C+R[-50]C+R[-40]C+R[-39]C+R[-37]C+R[-30]C+R[-29]C -> 10544 | J152: =R[-139]C+R[-124]C+R[-117]C+R[-116]C+R[-93]C+R[-73]C+R[-61]C+R[-60]C+R[-56]C+R[-50]C+R[-40]C+R[-39]C+R[-37]C+R[-30]C+R[-29]C -> 9789 | K152: =R[-139]C+R[-124]C+R[-117]C+R[-116]C+R[-93]C+R[-73]C+R[-61]C+R[-60]C+R[-56]C+R[-50]C+R[-40]C+R[-39]C+R[-37]C+R[-30]C+R[-29]C -> 9937 | L152: =R[-139]C+R[-124]C+R[-117]C+R[-116]C+R[-93]C+R[-73]C+R[-61]C+R[-60]C+R[-56]C+R[-50]C+R[-40]C+R[-39]C+R[-37]C+R[-30]C+R[-29]C -> 8808 | M152: =R[-139]C+R[-124]C+R[-117]C+R[-116]C+R[-93]C+R[-73]C+R[-61]C+R[-60]C+R[-56]C+R[-50]C+R[-40]C+R[-39]C+R[-37]C+R[-30]C+R[-29]C -> 15551 | N152: =R[-139]C+R[-124]C+R[-117]C+R[-116]C+R[-93]C+R[-73]C+R[-61]C+R[-60]C+R[-56]C+R[-50]C+R[-40]C+R[-39]C+R[-37]C+R[-30]C+R[-29]C -> 108333 | O152: =R[-139]C+R[-124]C+R[-117]C+R[-116]C+R[-93]C+R[-73]C+R[-61]C+R[-60]C+R[-56]C+R[-50]C+R[-40]C+R[-39]C+R[-37]C+R[-30]C+R[-29]C -> 33962 | P152: =R[-139]C+R[-124]C+R[-117]C+R[-116]C+R[-93]C+R[-73]C+R[-61]C+R[-60]C+R[-56]C+R[-50]C+R[-40]C+R[-39]C+R[-37]C+R[-30]C+R[-29]C -> 81309 | Q152: =R[-139]C+R[-124]C+R[-117]C+R[-116]C+R[-93]C+R[-73]C+R[-61]C+R[-60]C+R[-56]C+R[-50]C+R[-40]C+R[-39]C+R[-37]C+R[-30]C+R[-29]C -> 31865 | R152: =R[-139]C+R[-124]C+R[-117]C+R[-116]C+R[-93]C+R[-73]C+R[-61]C+R[-60]C+R[-56]C+R[-50]C+R[-40]C+R[-39]C+R[-37]C+R[-30]C+R[-29]C -> 184702 | S152: =R[-139]C+R[-124]C+R[-117]C+R[-116]C+R[-93]C+R[-73]C+R[-61]C+R[-60]C+R[-56]C+R[-50]C+R[-40]C+R[-39]C+R[-37]C+R[-30]C+R[-29]C -> 114870 | T152: =R[-139]C+R[-124]C+R[-117]C+R[-116]C+R[-93]C+R[-73]C+R[-61]C+R[-60]C+R[-56]C+R[-50]C+R[-40]C+R[-39]C+R[-37]C+R[-30]C+R[-29]C -> 33665 | U152: =R[-139]C+R[-124]C+R[-117]C+R[-116]C+R[-93]C+R[-73]C+R[-61]C+R[-60]C+R[-56]C+R[-50]C+R[-40]C+R[-39]C+R[-37]C+R[-30]C+R[-29]C -> 20743 | V152: =R[-139]C+R[-124]C+R[-117]C+R[-116]C+R[-93]C+R[-73]C+R[-61]C+R[-60]C+R[-56]C+R[-50]C+R[-40]C+R[-39]C+R[-37]C+R[-30]C+R[-29]C -> 723084 | W152: =R[-139]C+R[-124]C+R[-117]C+R[-116]C+R[-93]C+R[-73]C+R[-61]C+R[-60]C+R[-56]C+R[-50]C+R[-40]C+R[-39]C+R[-37]C+R[-30]C+R[-29]C -> 7640 | X152: =R[-139]C+R[-124]C+R[-117]C+R[-116]C+R[-93]C+R[-73]C+R[-61]C+R[-60]C+R[-56]C+R[-50]C+R[-40]C+R[-39]C+R[-37]C+R[-30]C+R[-29]C -> 4164 | Y152: =R[-139]C+R[-124]C+R[-117]C+R[-116]C+R[-93]C+R[-73]C+R[-61]C+R[-60]C+R[-56]C+R[-50]C+R[-40]C+R[-39]C+R[-37]C+R[-30]C+R[-29]C -> 9852 | Z152: =R[-139]C+R[-124]C+R[-117]C+R[-116]C+R[-93]C+R[-73]C+R[-61]C+R[-60]C+R[-56]C+R[-50]C+R[-40]C+R[-39]C+R[-37]C+R[-30]C+R[-29]C -> 11818 | AA152: =R[-139]C+R[-124]C+R[-117]C+R[-116]C+R[-93]C+R[-73]C+R[-61]C+R[-60]C+R[-56]C+R[-50]C+R[-40]C+R[-39]C+R[-37]C+R[-30]C+R[-29]C -> 8984 | AB152: =R[-139]C+R[-124]C+R[-117]C+R[-116]C+R[-93]C+R[-73]C+R[-61]C+R[-60]C+R[-56]C+R[-50]C+R[-40]C+R[-39]C+R[-37]C+R[-30]C+R[-29]C -> 10643 | AC152: =R[-139]C+R[-124]C+R[-117]C+R[-116]C+R[-93]C+R[-73]C+R[-61]C+R[-60]C+R[-56]C+R[-50]C+R[-40]C+R[-39]C+R[-37]C+R[-30]C+R[-29]C -> 9098 | AD152: =R[-139]C+R[-124]C+R[-117]C+R[-116]C+R[-93]C+R[-73]C+R[-61]C+R[-60]C+R[-56]C+R[-50]C+R[-40]C+R[-39]C+R[-37]C+R[-30]C+R[-29]C -> 16140 | AE152: =R[-139]C+R[-124]C+R[-117]C+R[-116]C+R[-93]C+R[-73]C+R[-61]C+R[-60]C+R[-56]C+R[-50]C+R[-40]C+R[-39]C+R[-37]C+R[-30]C+R[-29]C -> 141144 | AF152: =R[-139]C+R[-124]C+R[-117]C+R[-116]C+R[-93]C+R[-73]C+R[-61]C+R[-60]C+R[-56]C+R[-50]C+R[-40]C+R[-39]C+R[-37]C+R[-30]C+R[-29]C -> 47684 | AG152: =R[-139]C+R[-124]C+R[-117]C+R[-116]C+R[-93]C+R[-73]C+R[-61]C+R[-60]C+R[-56]C+R[-50]C+R[-40]C+R[-39]C+R[-37]C+R[-30]C+R[-29]C -> 98578 | AH152: =R[-139]C+R[-124]C+R[-117]C+R[-116]C+R[-93]C+R[-73]C+R[-61]C+R[-60]C+R[-56]C+R[-50]C+R[-40]C+R[-39]C+R[-37]C+R[-30]C+R[-29]C -> 45158 | AI152: =R[-139]C+R[-124]C+R[-117]C+R[-116]C+R[-93]C+R[-73]C+R[-61]C+R[-60]C+R[-56]C+R[-50]C+R[-40]C+R[-39]C+R[-37]C+R[-30]C+R[-29]C -> 195693 | AJ152: =R[-139]C+R[-124]C+R[-117]C+R[-116]C+R[-93]C+R[-73]C+R[-61]C+R[-60]C+R[-56]C+R[-50]C+R[-40]C+R[-39]C+R[-37]C+R[-30]C+R[-29]C -> 88207 | AK152: =R[-139]C+R[-124]C+R[-117]C+R[-116]C+R[-93]C+R[-73]C+R[-61]C+R[-60]C+R[-56]C+R[-50]C+R[-40]C+R[-39]C+R[-37]C+R[-30]C+R[-29]C -> 19923 | AL152: =R[-139]C+R[-124]C+R[-117]C+R[-116]C+R[-93]C+R[-73]C+R[-61]C+R[-60]C+R[-56]C+R[-50]C+R[-40]C+R[-39]C+R[-37]C+R[-30]C+R[-29]C -> 8358
B153: Richmond | D153: =R[-143]C+R[-130]C+R[-128]C+R[-126]C+R[-122]C+R[-120]C+R[-110]C+R[-105]C+R[-104]C+R[-99]C+R[-97]C+R[-93]C+R[-85]C+R[-77]C+R[-75]C+R[-59]C+R[-45]C+R[-34]C+R[-25]C+R[-21]C -> 726495 | E153: =R[-143]C+R[-130]C+R[-128]C+R[-126]C+R[-122]C+R[-120]C+R[-110]C+R[-105]C+R[-104]C+R[-99]C+R[-97]C+R[-93]C+R[-85]C+R[-77]C+R[-75]C+R[-59]C+R[-45]C+R[-34]C+R[-25]C+R[-21]C -> 340109 | F153: =R[-143]C+R[-130]C+R[-128]C+R[-126]C+R[-122]C+R[-120]C+R[-110]C+R[-105]C+R[-104]C+R[-99]C+R[-97]C+R[-93]C+R[-85]C+R[-77]C+R[-75]C+R[-59]C+R[-45]C+R[-34]C+R[-25]C+R[-21]C -> 3166 | G153: =R[-143]C+R[-130]C+R[-128]C+R[-126]C+R[-122]C+R[-120]C+R[-110]C+R[-105]C+R[-104]C+R[-99]C+R[-97]C+R[-93]C+R[-85]C+R[-77]C+R[-75]C+R[-59]C+R[-45]C+R[-34]C+R[-25]C+R[-21]C -> 1884 | H153: =R[-143]C+R[-130]C+R[-128]C+R[-126]C+R[-122]C+R[-120]C+R[-110]C+R[-105]C+R[-104]C+R[-99]C+R[-97]C+R[-93]C+R[-85]C+R[-77]C+R[-75]C+R[-59]C+R[-45]C+R[-34]C+R[-25]C+R[-21]C -> 5488 | I153: =R[-143]C+R[-130]C+R[-128]C+R[-126]C+R[-122]C+R[-120]C+R[-110]C+R[-105]C+R[-104]C+R[-99]C+R[-97]C+R[-93]C+R[-85]C+R[-77]C+R[-75]C+R[-59]C+R[-45]C+R[-34]C+R[-25]C+R[-21]C -> 12569 | J153: =R[-143]C+R[-130]C+R[-128]C+R[-126]C+R[-122]C+R[-120]C+R[-110]C+R[-105]C+R[-104]C+R[-99]C+R[-97]C+R[-93]C+R[-85]C+R[-77]C+R[-75]C+R[-59]C+R[-45]C+R[-34]C+R[-25]C+R[-21]C -> 8725 | K153: =R[-143]C+R[-130]C+R[-128]C+R[-126]C+R[-122]C+R[-120]C+R[-110]C+R[-105]C+R[-104]C+R[-99]C+R[-97]C+R[-93]C+R[-85]C+R[-77]C+R[-75]C+R[-59]C+R[-45]C+R[-34]C+R[-25]C+R[-21]C -> 12589 | L153: =R[-143]C+R[-130]C+R[-128]C+R[-126]C+R[-122]C+R[-120]C+R[-110]C+R[-105]C+R[-104]C+R[-99]C+R[-97]C+R[-93]C+R[-85]C+R[-77]C+R[-75]C+R[-59]C+R[-45]C+R[-34]C+R[-25]C+R[-21]C -> 11790 | M153: =R[-143]C+R[-130]C+R[-128]C+R[-126]C+R[-122]C+R[-120]C+R[-110]C+R[-105]C+R[-104]C+R[-99]C+R[-97]C+R[-93]C+R[-85]C+R[-77]C+R[-75]C+R[-59]C+R[-45]C+R[-34]C+R[-25]C+R[-21]C -> 11016 | N153: =R[-143]C+R[-130]C+R[-128]C+R[-126]C+R[-122]C+R[-120]C+R[-110]C+R[-105]C+R[-104]C+R[-99]C+R[-97]C+R[-93]C+R[-85]C+R[-77]C+R[-75]C+R[-59]C+R[-45]C+R[-34]C+R[-25]C+R[-21]C -> 90480 | O153: =R[-143]C+R[-130]C+R[-128]C+R[-126]C+R[-122]C+R[-120]C+R[-110]C+R[-105]C+R[-104]C+R[-99]C+R[-97]C+R[-93]C+R[-85]C+R[-77]C+R[-75]C+R[-59]C+R[-45]C+R[-34]C+R[-25]C+R[-21]C -> 21255 | P153: =R[-143]C+R[-130]C+R[-128]C+R[-126]C+R[-122]C+R[-120]C+R[-110]C+R[-105]C+R[-104]C+R[-99]C+R[-97]C+R[-93]C+R[-85]C+R[-77]C+R[-75]C+R[-59]C+R[-45]C+R[-34]C+R[-25]C+R[-21]C -> 46489 | Q153: =R[-143]C+R[-130]C+R[-128]C+R[-126]C+R[-122]C+R[-120]C+R[-110]C+R[-105]C+R[-104]C+R[-99]C+R[-97]C+R[-93]C+R[-85]C+R[-77]C+R[-75]C+R[-59]C+R[-45]C+R[-34]C+R[-25]C+R[-21]C -> 15695 | R153: =R[-143]C+R[-130]C+R[-128]C+R[-126]C+R[-122]C+R[-120]C+R[-110]C+R[-105]C+R[-104]C+R[-99]C+R[-97]C+R[-93]C+R[-85]C+R[-77]C+R[-75]C+R[-59]C+R[-45]C+R[-34]C+R[-25]C+R[-21]C -> 64007 | S153: =R[-143]C+R[-130]C+R[-128]C+R[-126]C+R[-122]C+R[-120]C+R[-110]C+R[-105]C+R[-104]C+R[-99]C+R[-97]C+R[-93]C+R[-85]C+R[-77]C+R[-75]C+R[-59]C+R[-45]C+R[-34]C+R[-25]C+R[-21]C -> 21753 | T153: =R[-143]C+R[-130]C+R[-128]C+R[-126]C+R[-122]C+R[-120]C+R[-110]C+R[-105]C+R[-104]C+R[-99]C+R[-97]C+R[-93]C+R[-85]C+R[-77]C+R[-75]C+R[-59]C+R[-45]C+R[-34]C+R[-25]C+R[-21]C -> 8783 | U153: =R[-143]C+R[-130]C+R[-128]C+R[-126]C+R[-122]C+R[-120]C+R[-110]C+R[-105]C+R[-104]C+R[-99]C+R[-97]C+R[-93]C+R[-85]C+R[-77]C+R[-75]C+R[-59]C+R[-45]C+R[-34]C+R[-25]C+R[-21]C -> 4420 | V153: =R[-143]C+R[-130]C+R[-128]C+R[-126]C+R[-122]C+R[-120]C+R[-110]C+R[-105]C+R[-104]C+R[-99]C+R[-97]C+R[-93]C+R[-85]C+R[-77]C+R[-75]C+R[-59]C+R[-45]C+R[-34]C+R[-25]C+R[-21]C -> 386386 | W153: =R[-143]C+R[-130]C+R[-128]C+R[-126]C+R[-122]C+R[-120]C+R[-110]C+R[-105]C+R[-104]C+R[-99]C+R[-97]C+R[-93]C+R[-85]C+R[-77]C+R[-75]C+R[-59]C+R[-45]C+R[-34]C+R[-25]C+R[-21]C -> 3299 | X153: =R[-143]C+R[-130]C+R[-128]C+R[-126]C+R[-122]C+R[-120]C+R[-110]C+R[-105]C+R[-104]C+R[-99]C+R[-97]C+R[-93]C+R[-85]C+R[-77]C+R[-75]C+R[-59]C+R[-45]C+R[-34]C+R[-25]C+R[-21]C -> 1599 | Y153: =R[-143]C+R[-130]C+R[-128]C+R[-126]C+R[-122]C+R[-120]C+R[-110]C+R[-105]C+R[-104]C+R[-99]C+R[-97]C+R[-93]C+R[-85]C+R[-77]C+R[-75]C+R[-59]C+R[-45]C+R[-34]C+R[-25]C+R[-21]C -> 4028 | Z153: =R[-143]C+R[-130]C+R[-128]C+R[-126]C+R[-122]C+R[-120]C+R[-110]C+R[-105]C+R[-104]C+R[-99]C+R[-97]C+R[-93]C+R[-85]C+R[-77]C+R[-75]C+R[-59]C+R[-45]C+R[-34]C+R[-25]C+R[-21]C -> 12195 | AA153: =R[-143]C+R[-130]C+R[-128]C+R[-126]C+R[-122]C+R[-120]C+R[-110]C+R[-105]C+R[-104]C+R[-99]C+R[-97]C+R[-93]C+R[-85]C+R[-77]C+R[-75]C+R[-59]C+R[-45]C+R[-34]C+R[-25]C+R[-21]C -> 8888 | AB153: =R[-143]C+R[-130]C+R[-128]C+R[-126]C+R[-122]C+R[-120]C+R[-110]C+R[-105]C+R[-104]C+R[-99]C+R[-97]C+R[-93]C+R[-85]C+R[-77]C+R[-75]C+R[-59]C+R[-45]C+R[-34]C+R[-25]C+R[-21]C -> 13334 | AC153: =R[-143]C+R[-130]C+R[-128]C+R[-126]C+R[-122]C+R[-120]C+R[-110]C+R[-105]C+R[-104]C+R[-99]C+R[-97]C+R[-93]C+R[-85]C+R[-77]C+R[-75]C+R[-59]C+R[-45]C+R[-34]C+R[-25]C+R[-21]C -> 13424 | AD153: =R[-143]C+R[-130]C+R[-128]C+R[-126]C+R[-122]C+R[-120]C+R[-110]C+R[-105]C+R[-104]C+R[-99]C+R[-97]C+R[-93]C+R[-85]C+R[-77]C+R[-75]C+R[-59]C+R[-45]C+R[-34]C+R[-25]C+R[-21]C -> 11375 | AE153: =R[-143]C+R[-130]C+R[-128]C+R[-126]C+R[-122]C+R[-120]C+R[-110]C+R[-105]C+R[-104]C+R[-99]C+R[-97]C+R[-93]C+R[-85]C+R[-77]C+R[-75]C+R[-59]C+R[-45]C+R[-34]C+R[-25]C+R[-21]C -> 106868 | AF153: =R[-143]C+R[-130]C+R[-128]C+R[-126]C+R[-122]C+R[-120]C+R[-110]C+R[-105]C+R[-104]C+R[-99]C+R[-97]C+R[-93]C+R[-85]C+R[-77]C+R[-75]C+R[-59]C+R[-45]C+R[-34]C+R[-25]C+R[-21]C -> 29596 | AG153: =R[-143]C+R[-130]C+R[-128]C+R[-126]C+R[-122]C+R[-120]C+R[-110]C+R[-105]C+R[-104]C+R[-99]C+R[-97]C+R[-93]C+R[-85]C+R[-77]C+R[-75]C+R[-59]C+R[-45]C+R[-34]C+R[-25]C+R[-21]C -> 58833 | AH153: =R[-143]C+R[-130]C+R[-128]C+R[-126]C+R[-122]C+R[-120]C+R[-110]C+R[-105]C+R[-104]C+R[-99]C+R[-97]C+R[-93]C+R[-85]C+R[-77]C+R[-75]C+R[-59]C+R[-45]C+R[-34]C+R[-25]C+R[-21]C -> 21466 | AI153: =R[-143]C+R[-130]C+R[-128]C+R[-126]C+R[-122]C+R[-120]C+R[-110]C+R[-105]C+R[-104]C+R[-99]C+R[-97]C+R[-93]C+R[-85]C+R[-77]C+R[-75]C+R[-59]C+R[-45]C+R[-34]C+R[-25]C+R[-21]C -> 69596 | AJ153: =R[-143]C+R[-130]C+R[-128]C+R[-126]C+R[-122]C+R[-120]C+R[-110]C+R[-105]C+R[-104]C+R[-99]C+R[-97]C+R[-93]C+R[-85]C+R[-77]C+R[-75]C+R[-59]C+R[-45]C+R[-34]C+R[-25]C+R[-21]C -> 23638 | AK153: =R[-143]C+R[-130]C+R[-128]C+R[-126]C+R[-122]C+R[-120]C+R[-110]C+R[-105]C+R[-104]C+R[-99]C+R[-97]C+R[-93]C+R[-85]C+R[-77]C+R[-75]C+R[-59]C+R[-45]C+R[-34]C+R[-25]C+R[-21]C -> 6137 | AL153: =R[-143]C+R[-130]C+R[-128]C+R[-126]C+R[-122]C+R[-120]C+R[-110]C+R[-105]C+R[-104]C+R[-99]C+R[-97]C+R[-93]C+R[-85]C+R[-77]C+R[-75]C+R[-59]C+R[-45]C+R[-34]C+R[-25]C+R[-21]C -> 2110
B154: Roanoke | D154: =R[-136]C+R[-125]C+R[-115]C+R[-71]C+R[-21]C+R[-20]C -> 201240 | E154: =R[-136]C+R[-125]C+R[-115]C+R[-71]C+R[-21]C+R[-20]C -> 93864 | F154: =R[-136]C+R[-125]C+R[-115]C+R[-71]C+R[-21]C+R[-20]C -> 729 | G154: =R[-136]C+R[-125]C+R[-115]C+R[-71]C+R[-21]C+R[-20]C -> 566 | H154: =R[-136]C+R[-125]C+R[-115]C+R[-71]C+R[-21]C+R[-20]C -> 1597 | I154: =R[-136]C+R[-125]C+R[-115]C+R[-71]C+R[-21]C+R[-20]C -> 4986 | J154: =R[-136]C+R[-125]C+R[-115]C+R[-71]C+R[-21]C+R[-20]C -> 2807 | K154: =R[-136]C+R[-125]C+R[-115]C+R[-71]C+R[-21]C+R[-20]C -> 3665 | L154: =R[-136]C+R[-125]C+R[-115]C+R[-71]C+R[-21]C+R[-20]C -> 3236 | M154: =R[-136]C+R[-125]C+R[-115]C+R[-71]C+R[-21]C+R[-20]C -> 3188 | N154: =R[-136]C+R[-125]C+R[-115]C+R[-71]C+R[-21]C+R[-20]C -> 28093 | O154: =R[-136]C+R[-125]C+R[-115]C+R[-71]C+R[-21]C+R[-20]C -> 6056 | P154: =R[-136]C+R[-125]C+R[-115]C+R[-71]C+R[-21]C+R[-20]C -> 12270 | Q154: =R[-136]C+R[-125]C+R[-115]C+R[-71]C+R[-21]C+R[-20]C -> 5813 | R154: =R[-136]C+R[-125]C+R[-115]C+R[-71]C+R[-21]C+R[-20]C -> 13160 | S154: =R[-136]C+R[-125]C+R[-115]C+R[-71]C+R[-21]C+R[-20]C -> 4230 | T154: =R[-136]C+R[-125]C+R[-115]C+R[-71]C+R[-21]C+R[-20]C -> 2607 | U154: =R[-136]C+R[-125]C+R[-115]C+R[-71]C+R[-21]C+R[-20]C -> 861 | V154: =R[-136]C+R[-125]C+R[-115]C+R[-71]C+R[-21]C+R[-20]C -> 107376 | W154: =R[-136]C+R[-125]C+R[-115]C+R[-71]C+R[-21]C+R[-20]C -> 595 | X154: =R[-136]C+R[-125]C+R[-115]C+R[-71]C+R[-21]C+R[-20]C -> 386 | Y154: =R[-136]C+R[-125]C+R[-115]C+R[-71]C+R[-21]C+R[-20]C -> 1478 | Z154: =R[-136]C+R[-125]C+R[-115]C+R[-71]C+R[-21]C+R[-20]C -> 4977 | AA154: =R[-136]C+R[-125]C+R[-115]C+R[-71]C+R[-21]C+R[-20]C -> 2730 | AB154: =R[-136]C+R[-125]C+R[-115]C+R[-71]C+R[-21]C+R[-20]C -> 4049 | AC154: =R[-136]C+R[-125]C+R[-115]C+R[-71]C+R[-21]C+R[-20]C -> 3291 | AD154: =R[-136]C+R[-125]C+R[-115]C+R[-71]C+R[-21]C+R[-20]C -> 3161 | AE154: =R[-136]C+R[-125]C+R[-115]C+R[-71]C+R[-21]C+R[-20]C -> 33639 | AF154: =R[-136]C+R[-125]C+R[-115]C+R[-71]C+R[-21]C+R[-20]C -> 8702 | AG154: =R[-136]C+R[-125]C+R[-115]C+R[-71]C+R[-21]C+R[-20]C -> 15182 | AH154: =R[-136]C+R[-125]C+R[-115]C+R[-71]C+R[-21]C+R[-20]C -> 7795 | AI154: =R[-136]C+R[-125]C+R[-115]C+R[-71]C+R[-21]C+R[-20]C -> 14798 | AJ154: =R[-136]C+R[-125]C+R[-115]C+R[-71]C+R[-21]C+R[-20]C -> 4716 | AK154: =R[-136]C+R[-125]C+R[-115]C+R[-71]C+R[-21]C+R[-20]C -> 1482 | AL154: =R[-136]C+R[-125]C+R[-115]C+R[-71]C+R[-21]C+R[-20]C -> 395
B155: Virginia Beach | D155: =R[-113]C+R[-103]C+R[-102]C+R[-92]C+R[-62]C+R[-54]C+R[-48]C+R[-38]C+R[-30]C+R[-29]C+R[-26]C+R[-25]C+R[-19]C+R[-18]C+R[-16]C -> 973508 | E155: =R[-113]C+R[-103]C+R[-102]C+R[-92]C+R[-62]C+R[-54]C+R[-48]C+R[-38]C+R[-30]C+R[-29]C+R[-26]C+R[-25]C+R[-19]C+R[-18]C+R[-16]C -> 462454 | F155: =R[-113]C+R[-103]C+R[-102]C+R[-92]C+R[-62]C+R[-54]C+R[-48]C+R[-38]C+R[-30]C+R[-29]C+R[-26]C+R[-25]C+R[-19]C+R[-18]C+R[-16]C -> 2885 | G155: =R[-113]C+R[-103]C+R[-102]C+R[-92]C+R[-62]C+R[-54]C+R[-48]C+R[-38]C+R[-30]C+R[-29]C+R[-26]C+R[-25]C+R[-19]C+R[-18]C+R[-16]C -> 1849 | H155: =R[-113]C+R[-103]C+R[-102]C+R[-92]C+R[-62]C+R[-54]C+R[-48]C+R[-38]C+R[-30]C+R[-29]C+R[-26]C+R[-25]C+R[-19]C+R[-18]C+R[-16]C -> 4563 | I155: =R[-113]C+R[-103]C+R[-102]C+R[-92]C+R[-62]C+R[-54]C+R[-48]C+R[-38]C+R[-30]C+R[-29]C+R[-26]C+R[-25]C+R[-19]C+R[-18]C+R[-16]C -> 10655 | J155: =R[-113]C+R[-103]C+R[-102]C+R[-92]C+R[-62]C+R[-54]C+R[-48]C+R[-38]C+R[-30]C+R[-29]C+R[-26]C+R[-25]C+R[-19]C+R[-18]C+R[-16]C -> 8051 | K155: =R[-113]C+R[-103]C+R[-102]C+R[-92]C+R[-62]C+R[-54]C+R[-48]C+R[-38]C+R[-30]C+R[-29]C+R[-26]C+R[-25]C+R[-19]C+R[-18]C+R[-16]C -> 13530 | L155: =R[-113]C+R[-103]C+R[-102]C+R[-92]C+R[-62]C+R[-54]C+R[-48]C+R[-38]C+R[-30]C+R[-29]C+R[-26]C+R[-25]C+R[-19]C+R[-18]C+R[-16]C -> 12623 | M155: =R[-113]C+R[-103]C+R[-102]C+R[-92]C+R[-62]C+R[-54]C+R[-48]C+R[-38]C+R[-30]C+R[-29]C+R[-26]C+R[-25]C+R[-19]C+R[-18]C+R[-16]C -> 13567 | N155: =R[-113]C+R[-103]C+R[-102]C+R[-92]C+R[-62]C+R[-54]C+R[-48]C+R[-38]C+R[-30]C+R[-29]C+R[-26]C+R[-25]C+R[-19]C+R[-18]C+R[-16]C -> 127381 | O155: =R[-113]C+R[-103]C+R[-102]C+R[-92]C+R[-62]C+R[-54]C+R[-48]C+R[-38]C+R[-30]C+R[-29]C+R[-26]C+R[-25]C+R[-19]C+R[-18]C+R[-16]C -> 40833 | P155: =R[-113]C+R[-103]C+R[-102]C+R[-92]C+R[-62]C+R[-54]C+R[-48]C+R[-38]C+R[-30]C+R[-29]C+R[-26]C+R[-25]C+R[-19]C+R[-18]C+R[-16]C -> 80977 | Q155: =R[-113]C+R[-103]C+R[-102]C+R[-92]C+R[-62]C+R[-54]C+R[-48]C+R[-38]C+R[-30]C+R[-29]C+R[-26]C+R[-25]C+R[-19]C+R[-18]C+R[-16]C -> 30899 | R155: =R[-113]C+R[-103]C+R[-102]C+R[-92]C+R[-62]C+R[-54]C+R[-48]C+R[-38]C+R[-30]C+R[-29]C+R[-26]C+R[-25]C+R[-19]C+R[-18]C+R[-16]C -> 69894 | S155: =R[-113]C+R[-103]C+R[-102]C+R[-92]C+R[-62]C+R[-54]C+R[-48]C+R[-38]C+R[-30]C+R[-29]C+R[-26]C+R[-25]C+R[-19]C+R[-18]C+R[-16]C -> 30266 | T155: =R[-113]C+R[-103]C+R[-102]C+R[-92]C+R[-62]C+R[-54]C+R[-48]C+R[-38]C+R[-30]C+R[-29]C+R[-26]C+R[-25]C+R[-19]C+R[-18]C+R[-16]C -> 9629 | U155: =R[-113]C+R[-103]C+R[-102]C+R[-92]C+R[-62]C+R[-54]C+R[-48]C+R[-38]C+R[-30]C+R[-29]C+R[-26]C+R[-25]C+R[-19]C+R[-18]C+R[-16]C -> 4852 | V155: =R[-113]C+R[-103]C+R[-102]C+R[-92]C+R[-62]C+R[-54]C+R[-48]C+R[-38]C+R[-30]C+R[-29]C+R[-26]C+R[-25]C+R[-19]C+R[-18]C+R[-16]C -> 511054 | W155: =R[-113]C+R[-103]C+R[-102]C+R[-92]C+R[-62]C+R[-54]C+R[-48]C+R[-38]C+R[-30]C+R[-29]C+R[-26]C+R[-25]C+R[-19]C+R[-18]C+R[-16]C -> 3158 | X155: =R[-113]C+R[-103]C+R[-102]C+R[-92]C+R[-62]C+R[-54]C+R[-48]C+R[-38]C+R[-30]C+R[-29]C+R[-26]C+R[-25]C+R[-19]C+R[-18]C+R[-16]C -> 1992 | Y155: =R[-113]C+R[-103]C+R[-102]C+R[-92]C+R[-62]C+R[-54]C+R[-48]C+R[-38]C+R[-30]C+R[-29]C+R[-26]C+R[-25]C+R[-19]C+R[-18]C+R[-16]C -> 5140 | Z155: =R[-113]C+R[-103]C+R[-102]C+R[-92]C+R[-62]C+R[-54]C+R[-48]C+R[-38]C+R[-30]C+R[-29]C+R[-26]C+R[-25]C+R[-19]C+R[-18]C+R[-16]C -> 13003 | AA155: =R[-113]C+R[-103]C+R[-102]C+R[-92]C+R[-62]C+R[-54]C+R[-48]C+R[-38]C+R[-30]C+R[-29]C+R[-26]C+R[-25]C+R[-19]C+R[-18]C+R[-16]C -> 10307 | AB155: =R[-113]C+R[-103]C+R[-102]C+R[-92]C+R[-62]C+R[-54]C+R[-48]C+R[-38]C+R[-30]C+R[-29]C+R[-26]C+R[-25]C+R[-19]C+R[-18]C+R[-16]C -> 16104 | AC155: =R[-113]C+R[-103]C+R[-102]C+R[-92]C+R[-62]C+R[-54]C+R[-48]C+R[-38]C+R[-30]C+R[-29]C+R[-26]C+R[-25]C+R[-19]C+R[-18]C+R[-16]C -> 15507 | AD155: =R[-113]C+R[-103]C+R[-102]C+R[-92]C+R[-62]C+R[-54]C+R[-48]C+R[-38]C+R[-30]C+R[-29]C+R[-26]C+R[-25]C+R[-19]C+R[-18]C+R[-16]C -> 16176 | AE155: =R[-113]C+R[-103]C+R[-102]C+R[-92]C+R[-62]C+R[-54]C+R[-48]C+R[-38]C+R[-30]C+R[-29]C+R[-26]C+R[-25]C+R[-19]C+R[-18]C+R[-16]C -> 142003 | AF155: =R[-113]C+R[-103]C+R[-102]C+R[-92]C+R[-62]C+R[-54]C+R[-48]C+R[-38]C+R[-30]C+R[-29]C+R[-26]C+R[-25]C+R[-19]C+R[-18]C+R[-16]C -> 45610 | AG155: =R[-113]C+R[-103]C+R[-102]C+R[-92]C+R[-62]C+R[-54]C+R[-48]C+R[-38]C+R[-30]C+R[-29]C+R[-26]C+R[-25]C+R[-19]C+R[-18]C+R[-16]C -> 88489 | AH155: =R[-113]C+R[-103]C+R[-102]C+R[-92]C+R[-62]C+R[-54]C+R[-48]C+R[-38]C+R[-30]C+R[-29]C+R[-26]C+R[-25]C+R[-19]C+R[-18]C+R[-16]C -> 35727 | AI155: =R[-113]C+R[-103]C+R[-102]C+R[-92]C+R[-62]C+R[-54]C+R[-48]C+R[-38]C+R[-30]C+R[-29]C+R[-26]C+R[-25]C+R[-19]C+R[-18]C+R[-16]C -> 79999 | AJ155: =R[-113]C+R[-103]C+R[-102]C+R[-92]C+R[-62]C+R[-54]C+R[-48]C+R[-38]C+R[-30]C+R[-29]C+R[-26]C+R[-25]C+R[-19]C+R[-18]C+R[-16]C -> 29426 | AK155: =R[-113]C+R[-103]C+R[-102]C+R[-92]C+R[-62]C+R[-54]C+R[-48]C+R[-38]C+R[-30]C+R[-29]C+R[-26]C+R[-25]C+R[-19]C+R[-18]C+R[-16]C -> 6071 | AL155: =R[-113]C+R[-103]C+R[-102]C+R[-92]C+R[-62]C+R[-54]C+R[-48]C+R[-38]C+R[-30]C+R[-29]C+R[-26]C+R[-25]C+R[-19]C+R[-18]C+R[-16]C -> 2342
B156: Winchester | D156: =R[-116]C+R[-16]C -> 54587 | E156: =R[-116]C+R[-16]C -> 26470 | F156: =R[-116]C+R[-16]C -> 246 | G156: =R[-116]C+R[-16]C -> 200 | H156: =R[-116]C+R[-16]C -> 704 | I156: =R[-116]C+R[-16]C -> 1468 | J156: =R[-116]C+R[-16]C -> 999 | K156: =R[-116]C+R[-16]C -> 1198 | L156: =R[-116]C+R[-16]C -> 815 | M156: =R[-116]C+R[-16]C -> 864 | N156: =R[-116]C+R[-16]C -> 8429 | O156: =R[-116]C+R[-16]C -> 1794 | P156: =R[-116]C+R[-16]C -> 3110 | Q156: =R[-116]C+R[-16]C -> 1069 | R156: =R[-116]C+R[-16]C -> 3591 | S156: =R[-116]C+R[-16]C -> 1193 | T156: =R[-116]C+R[-16]C -> 549 | U156: =R[-116]C+R[-16]C -> 241 | V156: =R[-116]C+R[-16]C -> 28117 | W156: =R[-116]C+R[-16]C -> 164 | X156: =R[-116]C+R[-16]C -> 133 | Y156: =R[-116]C+R[-16]C -> 468 | Z156: =R[-116]C+R[-16]C -> 1236 | AA156: =R[-116]C+R[-16]C -> 756 | AB156: =R[-116]C+R[-16]C -> 1237 | AC156: =R[-116]C+R[-16]C -> 902 | AD156: =R[-116]C+R[-16]C -> 798 | AE156: =R[-116]C+R[-16]C -> 9682 | AF156: =R[-116]C+R[-16]C -> 2349 | AG156: =R[-116]C+R[-16]C -> 3330 | AH156: =R[-116]C+R[-16]C -> 1712 | AI156: =R[-116]C+R[-16]C -> 3465 | AJ156: =R[-116]C+R[-16]C -> 1486 | AK156: =R[-116]C+R[-16]C -> 259 | AL156: =R[-116]C+R[-16]C -> 140
B157: Total metro | D157: =SUM(R[-11]C:R[-1]C) -> 3921126 | E157: =SUM(R[-11]C:R[-1]C) -> 1870238 | F157: =SUM(R[-11]C:R[-1]C) -> 18378 | G157: =SUM(R[-11]C:R[-1]C) -> 11232 | H157: =SUM(R[-11]C:R[-1]C) -> 29028 | I157: =SUM(R[-11]C:R[-1]C) -> 56931 | J157: =SUM(R[-11]C:R[-1]C) -> 38944 | K157: =SUM(R[-11]C:R[-1]C) -> 52321 | L157: =SUM(R[-11]C:R[-1]C) -> 46767 | M157: =SUM(R[-11]C:R[-1]C) -> 51924 | N157: =SUM(R[-11]C:R[-1]C) -> 437712 | O157: =SUM(R[-11]C:R[-1]C) -> 119377 | P157: =SUM(R[-11]C:R[-1]C) -> 253308 | Q157: =SUM(R[-11]C:R[-1]C) -> 98286 | R157: =SUM(R[-11]C:R[-1]C) -> 369201 | S157: =SUM(R[-11]C:R[-1]C) -> 187279 | T157: =SUM(R[-11]C:R[-1]C) -> 61189 | U157: =SUM(R[-11]C:R[-1]C) -> 38361 | V157: =SUM(R[-11]C:R[-1]C) -> 2050888 | W157: =SUM(R[-11]C:R[-1]C) -> 17945 | X157: =SUM(R[-11]C:R[-1]C) -> 10575 | Y157: =SUM(R[-11]C:R[-1]C) -> 26584 | Z157: =SUM(R[-11]C:R[-1]C) -> 60784 | AA157: =SUM(R[-11]C:R[-1]C) -> 40607 | AB157: =SUM(R[-11]C:R[-1]C) -> 58012 | AC157: =SUM(R[-11]C:R[-1]C) -> 52462 | AD157: =SUM(R[-11]C:R[-1]C) -> 55582 | AE157: =SUM(R[-11]C:R[-1]C) -> 524109 | AF157: =SUM(R[-11]C:R[-1]C) -> 153802 | AG157: =SUM(R[-11]C:R[-1]C) -> 300050 | AH157: =SUM(R[-11]C:R[-1]C) -> 129083 | AI157: =SUM(R[-11]C:R[-1]C) -> 402556 | AJ157: =SUM(R[-11]C:R[-1]C) -> 164354 | AK157: =SUM(R[-11]C:R[-1]C) -> 38033 | AL157: =SUM(R[-11]C:R[-1]C) -> 16350
B159: Micro areas
B160: Martinsville | D160: =R[-110]C+R[-36]C -> 51361 | E160: =R[-110]C+R[-36]C -> 23903 | F160: =R[-110]C+R[-36]C -> 329 | G160: =R[-110]C+R[-36]C -> 389 | H160: =R[-110]C+R[-36]C -> 926 | I160: =R[-110]C+R[-36]C -> 2205 | J160: =R[-110]C+R[-36]C -> 1246 | K160: =R[-110]C+R[-36]C -> 1390 | L160: =R[-110]C+R[-36]C -> 1395 | M160: =R[-110]C+R[-36]C -> 972 | N160: =R[-110]C+R[-36]C -> 7228 | O160: =R[-110]C+R[-36]C -> 1365 | P160: =R[-110]C+R[-36]C -> 2626 | Q160: =R[-110]C+R[-36]C -> 1056 | R160: =R[-110]C+R[-36]C -> 1739 | S160: =R[-110]C+R[-36]C -> 680 | T160: =R[-110]C+R[-36]C -> 292 | U160: =R[-110]C+R[-36]C -> 65 | V160: =R[-110]C+R[-36]C -> 27458 | W160: =R[-110]C+R[-36]C -> 265 | X160: =R[-110]C+R[-36]C -> 201 | Y160: =R[-110]C+R[-36]C -> 810 | Z160: =R[-110]C+R[-36]C -> 2414 | AA160: =R[-110]C+R[-36]C -> 1198 | AB160: =R[-110]C+R[-36]C -> 1630 | AC160: =R[-110]C+R[-36]C -> 1362 | AD160: =R[-110]C+R[-36]C -> 911 | AE160: =R[-110]C+R[-36]C -> 9190 | AF160: =R[-110]C+R[-36]C -> 1816 | AG160: =R[-110]C+R[-36]C -> 3114 | AH160: =R[-110]C+R[-36]C -> 1703 | AI160: =R[-110]C+R[-36]C -> 1966 | AJ160: =R[-110]C+R[-36]C -> 687 | AK160: =R[-110]C+R[-36]C -> 166 | AL160: =R[-110]C+R[-36]C -> 25
B161: Staunton | D161: =R[-147]C+R[-26]C+R[-23]C -> 75615 | E161: =R[-147]C+R[-26]C+R[-23]C -> 36675 | F161: =R[-147]C+R[-26]C+R[-23]C -> 331 | G161: =R[-147]C+R[-26]C+R[-23]C -> 219 | H161: =R[-147]C+R[-26]C+R[-23]C -> 849 | I161: =R[-147]C+R[-26]C+R[-23]C -> 2067 | J161: =R[-147]C+R[-26]C+R[-23]C -> 1141 | K161: =R[-147]C+R[-26]C+R[-23]C -> 1426 | L161: =R[-147]C+R[-26]C+R[-23]C -> 1508 | M161: =R[-147]C+R[-26]C+R[-23]C -> 1198 | N161: =R[-147]C+R[-26]C+R[-23]C -> 13517 | O161: =R[-147]C+R[-26]C+R[-23]C -> 2221 | P161: =R[-147]C+R[-26]C+R[-23]C -> 3924 | Q161: =R[-147]C+R[-26]C+R[-23]C -> 1545 | R161: =R[-147]C+R[-26]C+R[-23]C -> 4390 | S161: =R[-147]C+R[-26]C+R[-23]C -> 1509 | T161: =R[-147]C+R[-26]C+R[-23]C -> 504 | U161: =R[-147]C+R[-26]C+R[-23]C -> 326 | V161: =R[-147]C+R[-26]C+R[-23]C -> 38940 | W161: =R[-147]C+R[-26]C+R[-23]C -> 218 | X161: =R[-147]C+R[-26]C+R[-23]C -> 225 | Y161: =R[-147]C+R[-26]C+R[-23]C -> 589 | Z161: =R[-147]C+R[-26]C+R[-23]C -> 2038 | AA161: =R[-147]C+R[-26]C+R[-23]C -> 1091 | AB161: =R[-147]C+R[-26]C+R[-23]C -> 1437 | AC161: =R[-147]C+R[-26]C+R[-23]C -> 1458 | AD161: =R[-147]C+R[-26]C+R[-23]C -> 1172 | AE161: =R[-147]C+R[-26]C+R[-23]C -> 14538 | AF161: =R[-147]C+R[-26]C+R[-23]C -> 3038 | AG161: =R[-147]C+R[-26]C+R[-23]C -> 4709 | AH161: =R[-147]C+R[-26]C+R[-23]C -> 1984 | AI161: =R[-147]C+R[-26]C+R[-23]C -> 4471 | AJ161: =R[-147]C+R[-26]C+R[-23]C -> 1394 | AK161: =R[-147]C+R[-26]C+R[-23]C -> 386 | AL161: =R[-147]C+R[-26]C+R[-23]C -> 192
B162: Tazewell | D162: =R[-67]C -> 31291 | E162: =R[-67]C -> 14467 | F162: =R[-67]C -> 254 | G162: =R[-67]C -> 299 | H162: =R[-67]C -> 605 | I162: =R[-67]C -> 1445 | J162: =R[-67]C -> 592 | K162: =R[-67]C -> 573 | L162: =R[-67]C -> 533 | M162: =R[-67]C -> 453 | N162: =R[-67]C -> 4788 | O162: =R[-67]C -> 1084 | P162: =R[-67]C -> 1596 | Q162: =R[-67]C -> 670 | R162: =R[-67]C -> 1082 | S162: =R[-67]C -> 282 | T162: =R[-67]C -> 193 | U162: =R[-67]C -> 18 | V162: =R[-67]C -> 16824 | W162: =R[-67]C -> 291 | X162: =R[-67]C -> 214 | Y162: =R[-67]C -> 595 | Z162: =R[-67]C -> 1524 | AA162: =R[-67]C -> 788 | AB162: =R[-67]C -> 892 | AC162: =R[-67]C -> 675 | AD162: =R[-67]C -> 428 | AE162: =R[-67]C -> 5383 | AF162: =R[-67]C -> 1288 | AG162: =R[-67]C -> 1620 | AH162: =R[-67]C -> 1258 | AI162: =R[-67]C -> 1198 | AJ162: =R[-67]C -> 460 | AK162: =R[-67]C -> 183 | AL162: =R[-67]C -> 27
B163: Total micro | D163: =R[-3]C+R[-2]C+R[-1]C -> 158267 | E163: =R[-3]C+R[-2]C+R[-1]C -> 75045 | F163: =R[-3]C+R[-2]C+R[-1]C -> 914 | G163: =R[-3]C+R[-2]C+R[-1]C -> 907 | H163: =R[-3]C+R[-2]C+R[-1]C -> 2380 | I163: =R[-3]C+R[-2]C+R[-1]C -> 5717 | J163: =R[-3]C+R[-2]C+R[-1]C -> 2979 | K163: =R[-3]C+R[-2]C+R[-1]C -> 3389 | L163: =R[-3]C+R[-2]C+R[-1]C -> 3436 | M163: =R[-3]C+R[-2]C+R[-1]C -> 2623 | N163: =R[-3]C+R[-2]C+R[-1]C -> 25533 | O163: =R[-3]C+R[-2]C+R[-1]C -> 4670 | P163: =R[-3]C+R[-2]C+R[-1]C -> 8146 | Q163: =R[-3]C+R[-2]C+R[-1]C -> 3271 | R163: =R[-3]C+R[-2]C+R[-1]C -> 7211 | S163: =R[-3]C+R[-2]C+R[-1]C -> 2471 | T163: =R[-3]C+R[-2]C+R[-1]C -> 989 | U163: =R[-3]C+R[-2]C+R[-1]C -> 409 | V163: =R[-3]C+R[-2]C+R[-1]C -> 83222 | W163: =R[-3]C+R[-2]C+R[-1]C -> 774 | X163: =R[-3]C+R[-2]C+R[-1]C -> 640 | Y163: =R[-3]C+R[-2]C+R[-1]C -> 1994 | Z163: =R[-3]C+R[-2]C+R[-1]C -> 5976 | AA163: =R[-3]C+R[-2]C+R[-1]C -> 3077 | AB163: =R[-3]C+R[-2]C+R[-1]C -> 3959 | AC163: =R[-3]C+R[-2]C+R[-1]C -> 3495 | AD163: =R[-3]C+R[-2]C+R[-1]C -> 2511 | AE163: =R[-3]C+R[-2]C+R[-1]C -> 29111 | AF163: =R[-3]C+R[-2]C+R[-1]C -> 6142 | AG163: =R[-3]C+R[-2]C+R[-1]C -> 9443 | AH163: =R[-3]C+R[-2]C+R[-1]C -> 4945 | AI163: =R[-3]C+R[-2]C+R[-1]C -> 7635 | AJ163: =R[-3]C+R[-2]C+R[-1]C -> 2541 | AK163: =R[-3]C+R[-2]C+R[-1]C -> 735 | AL163: =R[-3]C+R[-2]C+R[-1]C -> 244
B165: Nonmetro/micro | D165: =R[3]C-R[-8]C-R[-2]C -> 587181 | E165: =R[3]C-R[-8]C-R[-2]C -> 285159 | F165: =R[3]C-R[-8]C-R[-2]C -> 5628 | G165: =R[3]C-R[-8]C-R[-2]C -> 5184 | H165: =R[3]C-R[-8]C-R[-2]C -> 11241 | I165: =R[3]C-R[-8]C-R[-2]C -> 24688 | J165: =R[3]C-R[-8]C-R[-2]C -> 12908 | K165: =R[3]C-R[-8]C-R[-2]C -> 16814 | L165: =R[3]C-R[-8]C-R[-2]C -> 14933 | M165: =R[3]C-R[-8]C-R[-2]C -> 9850 | N165: =R[3]C-R[-8]C-R[-2]C -> 93794 | O165: =R[3]C-R[-8]C-R[-2]C -> 16415 | P165: =R[3]C-R[-8]C-R[-2]C -> 26476 | Q165: =R[3]C-R[-8]C-R[-2]C -> 10712 | R165: =R[3]C-R[-8]C-R[-2]C -> 22533 | S165: =R[3]C-R[-8]C-R[-2]C -> 8479 | T165: =R[3]C-R[-8]C-R[-2]C -> 3473 | U165: =R[3]C-R[-8]C-R[-2]C -> 2031 | V165: =R[3]C-R[-8]C-R[-2]C -> 302022 | W165: =R[3]C-R[-8]C-R[-2]C -> 4065 | X165: =R[3]C-R[-8]C-R[-2]C -> 3637 | Y165: =R[3]C-R[-8]C-R[-2]C -> 8324 | Z165: =R[3]C-R[-8]C-R[-2]C -> 24658 | AA165: =R[3]C-R[-8]C-R[-2]C -> 11935 | AB165: =R[3]C-R[-8]C-R[-2]C -> 15884 | AC165: =R[3]C-R[-8]C-R[-2]C -> 13397 | AD165: =R[3]C-R[-8]C-R[-2]C -> 8617 | AE165: =R[3]C-R[-8]C-R[-2]C -> 102204 | AF165: =R[3]C-R[-8]C-R[-2]C -> 21779 | AG165: =R[3]C-R[-8]C-R[-2]C -> 32092 | AH165: =R[3]C-R[-8]C-R[-2]C -> 16516 | AI165: =R[3]C-R[-8]C-R[-2]C -> 25875 | AJ165: =R[3]C-R[-8]C-R[-2]C -> 9730 | AK165: =R[3]C-R[-8]C-R[-2]C -> 2281 | AL165: =R[3]C-R[-8]C-R[-2]C -> 1028
B168: Total | D168: =SUM(R[-161]C:R[-28]C) -> 4666574 | E168: =SUM(R[-161]C:R[-28]C) -> 2230442 | F168: =SUM(R[-161]C:R[-28]C) -> 24920 | G168: =SUM(R[-161]C:R[-28]C) -> 17323 | H168: =SUM(R[-161]C:R[-28]C) -> 42649 | I168: =SUM(R[-161]C:R[-28]C) -> 87336 | J168: =SUM(R[-161]C:R[-28]C) -> 54831 | K168: =SUM(R[-161]C:R[-28]C) -> 72524 | L168: =SUM(R[-161]C:R[-28]C) -> 65136 | M168: =SUM(R[-161]C:R[-28]C) -> 64397 | N168: =SUM(R[-161]C:R[-28]C) -> 557039 | O168: =SUM(R[-161]C:R[-28]C) -> 140462 | P168: =SUM(R[-161]C:R[-28]C) -> 287930 | Q168: =SUM(R[-161]C:R[-28]C) -> 112269 | R168: =SUM(R[-161]C:R[-28]C) -> 398945 | S168: =SUM(R[-161]C:R[-28]C) -> 198229 | T168: =SUM(R[-161]C:R[-28]C) -> 65651 | U168: =SUM(R[-161]C:R[-28]C) -> 40801 | V168: =SUM(R[-161]C:R[-28]C) -> 2436132 | W168: =SUM(R[-161]C:R[-28]C) -> 22784 | X168: =SUM(R[-161]C:R[-28]C) -> 14852 | Y168: =SUM(R[-161]C:R[-28]C) -> 36902 | Z168: =SUM(R[-161]C:R[-28]C) -> 91418 | AA168: =SUM(R[-161]C:R[-28]C) -> 55619 | AB168: =SUM(R[-161]C:R[-28]C) -> 77855 | AC168: =SUM(R[-161]C:R[-28]C) -> 69354 | AD168: =SUM(R[-161]C:R[-28]C) -> 66710 | AE168: =SUM(R[-161]C:R[-28]C) -> 655424 | AF168: =SUM(R[-161]C:R[-28]C) -> 181723 | AG168: =SUM(R[-161]C:R[-28]C) -> 341585 | AH168: =SUM(R[-161]C:R[-28]C) -> 150544 | AI168: =SUM(R[-161]C:R[-28]C) -> 436066 | AJ168: =SUM(R[-161]C:R[-28]C) -> 176625 | AK168: =SUM(R[-161]C:R[-28]C) -> 41049 | AL168: =SUM(R[-161]C:R[-28]C) -> 17622
B170: PDs
B171: 1 LENOWISCO | D171: =R[-113]C+R[-84]C+R[-72]C+R[-44]C -> 62556 | E171: =R[-113]C+R[-84]C+R[-72]C+R[-44]C -> 29501 | F171: =R[-113]C+R[-84]C+R[-72]C+R[-44]C -> 598 | G171: =R[-113]C+R[-84]C+R[-72]C+R[-44]C -> 847 | H171: =R[-113]C+R[-84]C+R[-72]C+R[-44]C -> 1466 | I171: =R[-113]C+R[-84]C+R[-72]C+R[-44]C -> 3304 | J171: =R[-113]C+R[-84]C+R[-72]C+R[-44]C -> 1392 | K171: =R[-113]C+R[-84]C+R[-72]C+R[-44]C -> 1819 | L171: =R[-113]C+R[-84]C+R[-72]C+R[-44]C -> 1316 | M171: =R[-113]C+R[-84]C+R[-72]C+R[-44]C -> 761 | N171: =R[-113]C+R[-84]C+R[-72]C+R[-44]C -> 9731 | O171: =R[-113]C+R[-84]C+R[-72]C+R[-44]C -> 1657 | P171: =R[-113]C+R[-84]C+R[-72]C+R[-44]C -> 2686 | Q171: =R[-113]C+R[-84]C+R[-72]C+R[-44]C -> 1019 | R171: =R[-113]C+R[-84]C+R[-72]C+R[-44]C -> 1746 | S171: =R[-113]C+R[-84]C+R[-72]C+R[-44]C -> 685 | T171: =R[-113]C+R[-84]C+R[-72]C+R[-44]C -> 319 | U171: =R[-113]C+R[-84]C+R[-72]C+R[-44]C -> 155 | V171: =R[-113]C+R[-84]C+R[-72]C+R[-44]C -> 33055 | W171: =R[-113]C+R[-84]C+R[-72]C+R[-44]C -> 516 | X171: =R[-113]C+R[-84]C+R[-72]C+R[-44]C -> 798 | Y171: =R[-113]C+R[-84]C+R[-72]C+R[-44]C -> 1416 | Z171: =R[-113]C+R[-84]C+R[-72]C+R[-44]C -> 3800 | AA171: =R[-113]C+R[-84]C+R[-72]C+R[-44]C -> 1600 | AB171: =R[-113]C+R[-84]C+R[-72]C+R[-44]C -> 1593 | AC171: =R[-113]C+R[-84]C+R[-72]C+R[-44]C -> 1348 | AD171: =R[-113]C+R[-84]C+R[-72]C+R[-44]C -> 767 | AE171: =R[-113]C+R[-84]C+R[-72]C+R[-44]C -> 10268 | AF171: =R[-113]C+R[-84]C+R[-72]C+R[-44]C -> 2551 | AG171: =R[-113]C+R[-84]C+R[-72]C+R[-44]C -> 3175 | AH171: =R[-113]C+R[-84]C+R[-72]C+R[-44]C -> 1899 | AI171: =R[-113]C+R[-84]C+R[-72]C+R[-44]C -> 2243 | AJ171: =R[-113]C+R[-84]C+R[-72]C+R[-44]C -> 801 | AK171: =R[-113]C+R[-84]C+R[-72]C+R[-44]C -> 212 | AL171: =R[-113]C+R[-84]C+R[-72]C+R[-44]C -> 68
B172: 2 Cumberland Plateau | D172: =R[-152]C+R[-140]C+R[-86]C+R[-77]C -> 82812 | E172: =R[-152]C+R[-140]C+R[-86]C+R[-77]C -> 39991 | F172: =R[-152]C+R[-140]C+R[-86]C+R[-77]C -> 876 | G172: =R[-152]C+R[-140]C+R[-86]C+R[-77]C -> 1231 | H172: =R[-152]C+R[-140]C+R[-86]C+R[-77]C -> 2059 | I172: =R[-152]C+R[-140]C+R[-86]C+R[-77]C -> 4799 | J172: =R[-152]C+R[-140]C+R[-86]C+R[-77]C -> 2108 | K172: =R[-152]C+R[-140]C+R[-86]C+R[-77]C -> 2089 | L172: =R[-152]C+R[-140]C+R[-86]C+R[-77]C -> 2043 | M172: =R[-152]C+R[-140]C+R[-86]C+R[-77]C -> 1217 | N172: =R[-152]C+R[-140]C+R[-86]C+R[-77]C -> 12786 | O172: =R[-152]C+R[-140]C+R[-86]C+R[-77]C -> 2548 | P172: =R[-152]C+R[-140]C+R[-86]C+R[-77]C -> 3425 | Q172: =R[-152]C+R[-140]C+R[-86]C+R[-77]C -> 1513 | R172: =R[-152]C+R[-140]C+R[-86]C+R[-77]C -> 2208 | S172: =R[-152]C+R[-140]C+R[-86]C+R[-77]C -> 647 | T172: =R[-152]C+R[-140]C+R[-86]C+R[-77]C -> 372 | U172: =R[-152]C+R[-140]C+R[-86]C+R[-77]C -> 70 | V172: =R[-152]C+R[-140]C+R[-86]C+R[-77]C -> 42821 | W172: =R[-152]C+R[-140]C+R[-86]C+R[-77]C -> 789 | X172: =R[-152]C+R[-140]C+R[-86]C+R[-77]C -> 862 | Y172: =R[-152]C+R[-140]C+R[-86]C+R[-77]C -> 1926 | Z172: =R[-152]C+R[-140]C+R[-86]C+R[-77]C -> 4779 | AA172: =R[-152]C+R[-140]C+R[-86]C+R[-77]C -> 1976 | AB172: =R[-152]C+R[-140]C+R[-86]C+R[-77]C -> 2237 | AC172: =R[-152]C+R[-140]C+R[-86]C+R[-77]C -> 1697 | AD172: =R[-152]C+R[-140]C+R[-86]C+R[-77]C -> 1008 | AE172: =R[-152]C+R[-140]C+R[-86]C+R[-77]C -> 13443 | AF172: =R[-152]C+R[-140]C+R[-86]C+R[-77]C -> 3011 | AG172: =R[-152]C+R[-140]C+R[-86]C+R[-77]C -> 3783 | AH172: =R[-152]C+R[-140]C+R[-86]C+R[-77]C -> 2911 | AI172: =R[-152]C+R[-140]C+R[-86]C+R[-77]C -> 2876 | AJ172: =R[-152]C+R[-140]C+R[-86]C+R[-77]C -> 1154 | AK172: =R[-152]C+R[-140]C+R[-86]C+R[-77]C -> 306 | AL172: =R[-152]C+R[-140]C+R[-86]C+R[-77]C -> 63
B173: 3 Mount Rogers | D173: =R[-156]C+R[-149]C+R[-129]C+R[-84]C+R[-76]C+R[-73]C+R[-69]C+R[-57]C -> 134970 | E173: =R[-156]C+R[-149]C+R[-129]C+R[-84]C+R[-76]C+R[-73]C+R[-69]C+R[-57]C -> 64069 | F173: =R[-156]C+R[-149]C+R[-129]C+R[-84]C+R[-76]C+R[-73]C+R[-69]C+R[-57]C -> 1077 | G173: =R[-156]C+R[-149]C+R[-129]C+R[-84]C+R[-76]C+R[-73]C+R[-69]C+R[-57]C -> 847 | H173: =R[-156]C+R[-149]C+R[-129]C+R[-84]C+R[-76]C+R[-73]C+R[-69]C+R[-57]C -> 2050 | I173: =R[-156]C+R[-149]C+R[-129]C+R[-84]C+R[-76]C+R[-73]C+R[-69]C+R[-57]C -> 6058 | J173: =R[-156]C+R[-149]C+R[-129]C+R[-84]C+R[-76]C+R[-73]C+R[-69]C+R[-57]C -> 2719 | K173: =R[-156]C+R[-149]C+R[-129]C+R[-84]C+R[-76]C+R[-73]C+R[-69]C+R[-57]C -> 3758 | L173: =R[-156]C+R[-149]C+R[-129]C+R[-84]C+R[-76]C+R[-73]C+R[-69]C+R[-57]C -> 2802 | M173: =R[-156]C+R[-149]C+R[-129]C+R[-84]C+R[-76]C+R[-73]C+R[-69]C+R[-57]C -> 1750 | N173: =R[-156]C+R[-149]C+R[-129]C+R[-84]C+R[-76]C+R[-73]C+R[-69]C+R[-57]C -> 21134 | O173: =R[-156]C+R[-149]C+R[-129]C+R[-84]C+R[-76]C+R[-73]C+R[-69]C+R[-57]C -> 4051 | P173: =R[-156]C+R[-149]C+R[-129]C+R[-84]C+R[-76]C+R[-73]C+R[-69]C+R[-57]C -> 6255 | Q173: =R[-156]C+R[-149]C+R[-129]C+R[-84]C+R[-76]C+R[-73]C+R[-69]C+R[-57]C -> 3358 | R173: =R[-156]C+R[-149]C+R[-129]C+R[-84]C+R[-76]C+R[-73]C+R[-69]C+R[-57]C -> 5293 | S173: =R[-156]C+R[-149]C+R[-129]C+R[-84]C+R[-76]C+R[-73]C+R[-69]C+R[-57]C -> 1617 | T173: =R[-156]C+R[-149]C+R[-129]C+R[-84]C+R[-76]C+R[-73]C+R[-69]C+R[-57]C -> 750 | U173: =R[-156]C+R[-149]C+R[-129]C+R[-84]C+R[-76]C+R[-73]C+R[-69]C+R[-57]C -> 550 | V173: =R[-156]C+R[-149]C+R[-129]C+R[-84]C+R[-76]C+R[-73]C+R[-69]C+R[-57]C -> 70901 | W173: =R[-156]C+R[-149]C+R[-129]C+R[-84]C+R[-76]C+R[-73]C+R[-69]C+R[-57]C -> 777 | X173: =R[-156]C+R[-149]C+R[-129]C+R[-84]C+R[-76]C+R[-73]C+R[-69]C+R[-57]C -> 649 | Y173: =R[-156]C+R[-149]C+R[-129]C+R[-84]C+R[-76]C+R[-73]C+R[-69]C+R[-57]C -> 1943 | Z173: =R[-156]C+R[-149]C+R[-129]C+R[-84]C+R[-76]C+R[-73]C+R[-69]C+R[-57]C -> 6820 | AA173: =R[-156]C+R[-149]C+R[-129]C+R[-84]C+R[-76]C+R[-73]C+R[-69]C+R[-57]C -> 3111 | AB173: =R[-156]C+R[-149]C+R[-129]C+R[-84]C+R[-76]C+R[-73]C+R[-69]C+R[-57]C -> 3884 | AC173: =R[-156]C+R[-149]C+R[-129]C+R[-84]C+R[-76]C+R[-73]C+R[-69]C+R[-57]C -> 2522 | AD173: =R[-156]C+R[-149]C+R[-129]C+R[-84]C+R[-76]C+R[-73]C+R[-69]C+R[-57]C -> 1530 | AE173: =R[-156]C+R[-149]C+R[-129]C+R[-84]C+R[-76]C+R[-73]C+R[-69]C+R[-57]C -> 23363 | AF173: =R[-156]C+R[-149]C+R[-129]C+R[-84]C+R[-76]C+R[-73]C+R[-69]C+R[-57]C -> 5080 | AG173: =R[-156]C+R[-149]C+R[-129]C+R[-84]C+R[-76]C+R[-73]C+R[-69]C+R[-57]C -> 7693 | AH173: =R[-156]C+R[-149]C+R[-129]C+R[-84]C+R[-76]C+R[-73]C+R[-69]C+R[-57]C -> 4977 | AI173: =R[-156]C+R[-149]C+R[-129]C+R[-84]C+R[-76]C+R[-73]C+R[-69]C+R[-57]C -> 5779 | AJ173: =R[-156]C+R[-149]C+R[-129]C+R[-84]C+R[-76]C+R[-73]C+R[-69]C+R[-57]C -> 1981 | AK173: =R[-156]C+R[-149]C+R[-129]C+R[-84]C+R[-76]C+R[-73]C+R[-69]C+R[-57]C -> 489 | AL173: =R[-156]C+R[-149]C+R[-129]C+R[-84]C+R[-76]C+R[-73]C+R[-69]C+R[-57]C -> 303
B174: 4 New River Valley | D174: =R[-137]C+R[-133]C+R[-108]C+R[-94]C+R[-43]C -> 96926 | E174: =R[-137]C+R[-133]C+R[-108]C+R[-94]C+R[-43]C -> 47018 | F174: =R[-137]C+R[-133]C+R[-108]C+R[-94]C+R[-43]C -> 354 | G174: =R[-137]C+R[-133]C+R[-108]C+R[-94]C+R[-43]C -> 363 | H174: =R[-137]C+R[-133]C+R[-108]C+R[-94]C+R[-43]C -> 1010 | I174: =R[-137]C+R[-133]C+R[-108]C+R[-94]C+R[-43]C -> 3026 | J174: =R[-137]C+R[-133]C+R[-108]C+R[-94]C+R[-43]C -> 1294 | K174: =R[-137]C+R[-133]C+R[-108]C+R[-94]C+R[-43]C -> 1480 | L174: =R[-137]C+R[-133]C+R[-108]C+R[-94]C+R[-43]C -> 1450 | M174: =R[-137]C+R[-133]C+R[-108]C+R[-94]C+R[-43]C -> 1022 | N174: =R[-137]C+R[-133]C+R[-108]C+R[-94]C+R[-43]C -> 13323 | O174: =R[-137]C+R[-133]C+R[-108]C+R[-94]C+R[-43]C -> 2782 | P174: =R[-137]C+R[-133]C+R[-108]C+R[-94]C+R[-43]C -> 5593 | Q174: =R[-137]C+R[-133]C+R[-108]C+R[-94]C+R[-43]C -> 2987 | R174: =R[-137]C+R[-133]C+R[-108]C+R[-94]C+R[-43]C -> 5979 | S174: =R[-137]C+R[-133]C+R[-108]C+R[-94]C+R[-43]C -> 3073 | T174: =R[-137]C+R[-133]C+R[-108]C+R[-94]C+R[-43]C -> 780 | U174: =R[-137]C+R[-133]C+R[-108]C+R[-94]C+R[-43]C -> 2502 | V174: =R[-137]C+R[-133]C+R[-108]C+R[-94]C+R[-43]C -> 49908 | W174: =R[-137]C+R[-133]C+R[-108]C+R[-94]C+R[-43]C -> 383 | X174: =R[-137]C+R[-133]C+R[-108]C+R[-94]C+R[-43]C -> 339 | Y174: =R[-137]C+R[-133]C+R[-108]C+R[-94]C+R[-43]C -> 961 | Z174: =R[-137]C+R[-133]C+R[-108]C+R[-94]C+R[-43]C -> 3182 | AA174: =R[-137]C+R[-133]C+R[-108]C+R[-94]C+R[-43]C -> 1358 | AB174: =R[-137]C+R[-133]C+R[-108]C+R[-94]C+R[-43]C -> 2166 | AC174: =R[-137]C+R[-133]C+R[-108]C+R[-94]C+R[-43]C -> 1376 | AD174: =R[-137]C+R[-133]C+R[-108]C+R[-94]C+R[-43]C -> 1124 | AE174: =R[-137]C+R[-133]C+R[-108]C+R[-94]C+R[-43]C -> 15424 | AF174: =R[-137]C+R[-133]C+R[-108]C+R[-94]C+R[-43]C -> 3348 | AG174: =R[-137]C+R[-133]C+R[-108]C+R[-94]C+R[-43]C -> 5817 | AH174: =R[-137]C+R[-133]C+R[-108]C+R[-94]C+R[-43]C -> 3123 | AI174: =R[-137]C+R[-133]C+R[-108]C+R[-94]C+R[-43]C -> 6414 | AJ174: =R[-137]C+R[-133]C+R[-108]C+R[-94]C+R[-43]C -> 3493 | AK174: =R[-137]C+R[-133]C+R[-108]C+R[-94]C+R[-43]C -> 484 | AL174: =R[-137]C+R[-133]C+R[-108]C+R[-94]C+R[-43]C -> 916
B175: 5 Roanoke Valley-Alleghany | D175: =R[-166]C+R[-157]C+R[-146]C+R[-92]C+R[-66]C+R[-42]C+R[-41]C -> 184966 | E175: =R[-166]C+R[-157]C+R[-146]C+R[-92]C+R[-66]C+R[-42]C+R[-41]C -> 85648 | F175: =R[-166]C+R[-157]C+R[-146]C+R[-92]C+R[-66]C+R[-42]C+R[-41]C -> 587 | G175: =R[-166]C+R[-157]C+R[-146]C+R[-92]C+R[-66]C+R[-42]C+R[-41]C -> 449 | H175: =R[-166]C+R[-157]C+R[-146]C+R[-92]C+R[-66]C+R[-42]C+R[-41]C -> 1416 | I175: =R[-166]C+R[-157]C+R[-146]C+R[-92]C+R[-66]C+R[-42]C+R[-41]C -> 4188 | J175: =R[-166]C+R[-157]C+R[-146]C+R[-92]C+R[-66]C+R[-42]C+R[-41]C -> 2447 | K175: =R[-166]C+R[-157]C+R[-146]C+R[-92]C+R[-66]C+R[-42]C+R[-41]C -> 3263 | L175: =R[-166]C+R[-157]C+R[-146]C+R[-92]C+R[-66]C+R[-42]C+R[-41]C -> 2753 | M175: =R[-166]C+R[-157]C+R[-146]C+R[-92]C+R[-66]C+R[-42]C+R[-41]C -> 2892 | N175: =R[-166]C+R[-157]C+R[-146]C+R[-92]C+R[-66]C+R[-42]C+R[-41]C -> 25867 | O175: =R[-166]C+R[-157]C+R[-146]C+R[-92]C+R[-66]C+R[-42]C+R[-41]C -> 5708 | P175: =R[-166]C+R[-157]C+R[-146]C+R[-92]C+R[-66]C+R[-42]C+R[-41]C -> 11364 | Q175: =R[-166]C+R[-157]C+R[-146]C+R[-92]C+R[-66]C+R[-42]C+R[-41]C -> 5537 | R175: =R[-166]C+R[-157]C+R[-146]C+R[-92]C+R[-66]C+R[-42]C+R[-41]C -> 12146 | S175: =R[-166]C+R[-157]C+R[-146]C+R[-92]C+R[-66]C+R[-42]C+R[-41]C -> 3904 | T175: =R[-166]C+R[-157]C+R[-146]C+R[-92]C+R[-66]C+R[-42]C+R[-41]C -> 2374 | U175: =R[-166]C+R[-157]C+R[-146]C+R[-92]C+R[-66]C+R[-42]C+R[-41]C -> 753 | V175: =R[-166]C+R[-157]C+R[-146]C+R[-92]C+R[-66]C+R[-42]C+R[-41]C -> 99318 | W175: =R[-166]C+R[-157]C+R[-146]C+R[-92]C+R[-66]C+R[-42]C+R[-41]C -> 529 | X175: =R[-166]C+R[-157]C+R[-146]C+R[-92]C+R[-66]C+R[-42]C+R[-41]C -> 294 | Y175: =R[-166]C+R[-157]C+R[-146]C+R[-92]C+R[-66]C+R[-42]C+R[-41]C -> 1171 | Z175: =R[-166]C+R[-157]C+R[-146]C+R[-92]C+R[-66]C+R[-42]C+R[-41]C -> 4318 | AA175: =R[-166]C+R[-157]C+R[-146]C+R[-92]C+R[-66]C+R[-42]C+R[-41]C -> 2323 | AB175: =R[-166]C+R[-157]C+R[-146]C+R[-92]C+R[-66]C+R[-42]C+R[-41]C -> 3586 | AC175: =R[-166]C+R[-157]C+R[-146]C+R[-92]C+R[-66]C+R[-42]C+R[-41]C -> 3216 | AD175: =R[-166]C+R[-157]C+R[-146]C+R[-92]C+R[-66]C+R[-42]C+R[-41]C -> 2939 | AE175: =R[-166]C+R[-157]C+R[-146]C+R[-92]C+R[-66]C+R[-42]C+R[-41]C -> 31612 | AF175: =R[-166]C+R[-157]C+R[-146]C+R[-92]C+R[-66]C+R[-42]C+R[-41]C -> 7989 | AG175: =R[-166]C+R[-157]C+R[-146]C+R[-92]C+R[-66]C+R[-42]C+R[-41]C -> 13986 | AH175: =R[-166]C+R[-157]C+R[-146]C+R[-92]C+R[-66]C+R[-42]C+R[-41]C -> 7336 | AI175: =R[-166]C+R[-157]C+R[-146]C+R[-92]C+R[-66]C+R[-42]C+R[-41]C -> 13890 | AJ175: =R[-166]C+R[-157]C+R[-146]C+R[-92]C+R[-66]C+R[-42]C+R[-41]C -> 4325 | AK175: =R[-166]C+R[-157]C+R[-146]C+R[-92]C+R[-66]C+R[-42]C+R[-41]C -> 1446 | AL175: =R[-166]C+R[-157]C+R[-146]C+R[-92]C+R[-66]C+R[-42]C+R[-41]C -> 358
B176: 6 Central Shenandoah | D176: =R[-162]C+R[-161]C+R[-125]C+R[-92]C+R[-91]C+R[-71]C+R[-58]C+R[-56]C+R[-41]C+R[-38]C -> 165911 | E176: =R[-162]C+R[-161]C+R[-125]C+R[-92]C+R[-91]C+R[-71]C+R[-58]C+R[-56]C+R[-41]C+R[-38]C -> 79948 | F176: =R[-162]C+R[-161]C+R[-125]C+R[-92]C+R[-91]C+R[-71]C+R[-58]C+R[-56]C+R[-41]C+R[-38]C -> 905 | G176: =R[-162]C+R[-161]C+R[-125]C+R[-92]C+R[-91]C+R[-71]C+R[-58]C+R[-56]C+R[-41]C+R[-38]C -> 735 | H176: =R[-162]C+R[-161]C+R[-125]C+R[-92]C+R[-91]C+R[-71]C+R[-58]C+R[-56]C+R[-41]C+R[-38]C -> 2239 | I176: =R[-162]C+R[-161]C+R[-125]C+R[-92]C+R[-91]C+R[-71]C+R[-58]C+R[-56]C+R[-41]C+R[-38]C -> 5627 | J176: =R[-162]C+R[-161]C+R[-125]C+R[-92]C+R[-91]C+R[-71]C+R[-58]C+R[-56]C+R[-41]C+R[-38]C -> 2639 | K176: =R[-162]C+R[-161]C+R[-125]C+R[-92]C+R[-91]C+R[-71]C+R[-58]C+R[-56]C+R[-41]C+R[-38]C -> 3536 | L176: =R[-162]C+R[-161]C+R[-125]C+R[-92]C+R[-91]C+R[-71]C+R[-58]C+R[-56]C+R[-41]C+R[-38]C -> 3124 | M176: =R[-162]C+R[-161]C+R[-125]C+R[-92]C+R[-91]C+R[-71]C+R[-58]C+R[-56]C+R[-41]C+R[-38]C -> 2420 | N176: =R[-162]C+R[-161]C+R[-125]C+R[-92]C+R[-91]C+R[-71]C+R[-58]C+R[-56]C+R[-41]C+R[-38]C -> 27181 | O176: =R[-162]C+R[-161]C+R[-125]C+R[-92]C+R[-91]C+R[-71]C+R[-58]C+R[-56]C+R[-41]C+R[-38]C -> 4556 | P176: =R[-162]C+R[-161]C+R[-125]C+R[-92]C+R[-91]C+R[-71]C+R[-58]C+R[-56]C+R[-41]C+R[-38]C -> 8002 | Q176: =R[-162]C+R[-161]C+R[-125]C+R[-92]C+R[-91]C+R[-71]C+R[-58]C+R[-56]C+R[-41]C+R[-38]C -> 3122 | R176: =R[-162]C+R[-161]C+R[-125]C+R[-92]C+R[-91]C+R[-71]C+R[-58]C+R[-56]C+R[-41]C+R[-38]C -> 9631 | S176: =R[-162]C+R[-161]C+R[-125]C+R[-92]C+R[-91]C+R[-71]C+R[-58]C+R[-56]C+R[-41]C+R[-38]C -> 3647 | T176: =R[-162]C+R[-161]C+R[-125]C+R[-92]C+R[-91]C+R[-71]C+R[-58]C+R[-56]C+R[-41]C+R[-38]C -> 1158 | U176: =R[-162]C+R[-161]C+R[-125]C+R[-92]C+R[-91]C+R[-71]C+R[-58]C+R[-56]C+R[-41]C+R[-38]C -> 1426 | V176: =R[-162]C+R[-161]C+R[-125]C+R[-92]C+R[-91]C+R[-71]C+R[-58]C+R[-56]C+R[-41]C+R[-38]C -> 85963 | W176: =R[-162]C+R[-161]C+R[-125]C+R[-92]C+R[-91]C+R[-71]C+R[-58]C+R[-56]C+R[-41]C+R[-38]C -> 762 | X176: =R[-162]C+R[-161]C+R[-125]C+R[-92]C+R[-91]C+R[-71]C+R[-58]C+R[-56]C+R[-41]C+R[-38]C -> 643 | Y176: =R[-162]C+R[-161]C+R[-125]C+R[-92]C+R[-91]C+R[-71]C+R[-58]C+R[-56]C+R[-41]C+R[-38]C -> 1536 | Z176: =R[-162]C+R[-161]C+R[-125]C+R[-92]C+R[-91]C+R[-71]C+R[-58]C+R[-56]C+R[-41]C+R[-38]C -> 5253 | AA176: =R[-162]C+R[-161]C+R[-125]C+R[-92]C+R[-91]C+R[-71]C+R[-58]C+R[-56]C+R[-41]C+R[-38]C -> 2615 | AB176: =R[-162]C+R[-161]C+R[-125]C+R[-92]C+R[-91]C+R[-71]C+R[-58]C+R[-56]C+R[-41]C+R[-38]C -> 3465 | AC176: =R[-162]C+R[-161]C+R[-125]C+R[-92]C+R[-91]C+R[-71]C+R[-58]C+R[-56]C+R[-41]C+R[-38]C -> 3216 | AD176: =R[-162]C+R[-161]C+R[-125]C+R[-92]C+R[-91]C+R[-71]C+R[-58]C+R[-56]C+R[-41]C+R[-38]C -> 2556 | AE176: =R[-162]C+R[-161]C+R[-125]C+R[-92]C+R[-91]C+R[-71]C+R[-58]C+R[-56]C+R[-41]C+R[-38]C -> 29825 | AF176: =R[-162]C+R[-161]C+R[-125]C+R[-92]C+R[-91]C+R[-71]C+R[-58]C+R[-56]C+R[-41]C+R[-38]C -> 5934 | AG176: =R[-162]C+R[-161]C+R[-125]C+R[-92]C+R[-91]C+R[-71]C+R[-58]C+R[-56]C+R[-41]C+R[-38]C -> 9859 | AH176: =R[-162]C+R[-161]C+R[-125]C+R[-92]C+R[-91]C+R[-71]C+R[-58]C+R[-56]C+R[-41]C+R[-38]C -> 4355 | AI176: =R[-162]C+R[-161]C+R[-125]C+R[-92]C+R[-91]C+R[-71]C+R[-58]C+R[-56]C+R[-41]C+R[-38]C -> 10518 | AJ176: =R[-162]C+R[-161]C+R[-125]C+R[-92]C+R[-91]C+R[-71]C+R[-58]C+R[-56]C+R[-41]C+R[-38]C -> 3824 | AK176: =R[-162]C+R[-161]C+R[-125]C+R[-92]C+R[-91]C+R[-71]C+R[-58]C+R[-56]C+R[-41]C+R[-38]C -> 898 | AL176: =R[-162]C+R[-161]C+R[-125]C+R[-92]C+R[-91]C+R[-71]C+R[-58]C+R[-56]C+R[-41]C+R[-38]C -> 704
B177: 7 Northern Shenandoah Valley | D177: =R[-149]C+R[-137]C+R[-104]C+R[-89]C+R[-81]C+R[-37]C -> 125740 | E177: =R[-149]C+R[-137]C+R[-104]C+R[-89]C+R[-81]C+R[-37]C -> 60635 | F177: =R[-149]C+R[-137]C+R[-104]C+R[-89]C+R[-81]C+R[-37]C -> 549 | G177: =R[-149]C+R[-137]C+R[-104]C+R[-89]C+R[-81]C+R[-37]C -> 550 | H177: =R[-149]C+R[-137]C+R[-104]C+R[-89]C+R[-81]C+R[-37]C -> 1728 | I177: =R[-149]C+R[-137]C+R[-104]C+R[-89]C+R[-81]C+R[-37]C -> 3955 | J177: =R[-149]C+R[-137]C+R[-104]C+R[-89]C+R[-81]C+R[-37]C -> 2357 | K177: =R[-149]C+R[-137]C+R[-104]C+R[-89]C+R[-81]C+R[-37]C -> 2864 | L177: =R[-149]C+R[-137]C+R[-104]C+R[-89]C+R[-81]C+R[-37]C -> 1939 | M177: =R[-149]C+R[-137]C+R[-104]C+R[-89]C+R[-81]C+R[-37]C -> 2120 | N177: =R[-149]C+R[-137]C+R[-104]C+R[-89]C+R[-81]C+R[-37]C -> 21354 | O177: =R[-149]C+R[-137]C+R[-104]C+R[-89]C+R[-81]C+R[-37]C -> 3817 | P177: =R[-149]C+R[-137]C+R[-104]C+R[-89]C+R[-81]C+R[-37]C -> 6402 | Q177: =R[-149]C+R[-137]C+R[-104]C+R[-89]C+R[-81]C+R[-37]C -> 2272 | R177: =R[-149]C+R[-137]C+R[-104]C+R[-89]C+R[-81]C+R[-37]C -> 6758 | S177: =R[-149]C+R[-137]C+R[-104]C+R[-89]C+R[-81]C+R[-37]C -> 2380 | T177: =R[-149]C+R[-137]C+R[-104]C+R[-89]C+R[-81]C+R[-37]C -> 1022 | U177: =R[-149]C+R[-137]C+R[-104]C+R[-89]C+R[-81]C+R[-37]C -> 568 | V177: =R[-149]C+R[-137]C+R[-104]C+R[-89]C+R[-81]C+R[-37]C -> 65105 | W177: =R[-149]C+R[-137]C+R[-104]C+R[-89]C+R[-81]C+R[-37]C -> 491 | X177: =R[-149]C+R[-137]C+R[-104]C+R[-89]C+R[-81]C+R[-37]C -> 253 | Y177: =R[-149]C+R[-137]C+R[-104]C+R[-89]C+R[-81]C+R[-37]C -> 1102 | Z177: =R[-149]C+R[-137]C+R[-104]C+R[-89]C+R[-81]C+R[-37]C -> 3880 | AA177: =R[-149]C+R[-137]C+R[-104]C+R[-89]C+R[-81]C+R[-37]C -> 2037 | AB177: =R[-149]C+R[-137]C+R[-104]C+R[-89]C+R[-81]C+R[-37]C -> 2929 | AC177: =R[-149]C+R[-137]C+R[-104]C+R[-89]C+R[-81]C+R[-37]C -> 2209 | AD177: =R[-149]C+R[-137]C+R[-104]C+R[-89]C+R[-81]C+R[-37]C -> 1850 | AE177: =R[-149]C+R[-137]C+R[-104]C+R[-89]C+R[-81]C+R[-37]C -> 23642 | AF177: =R[-149]C+R[-137]C+R[-104]C+R[-89]C+R[-81]C+R[-37]C -> 5025 | AG177: =R[-149]C+R[-137]C+R[-104]C+R[-89]C+R[-81]C+R[-37]C -> 7456 | AH177: =R[-149]C+R[-137]C+R[-104]C+R[-89]C+R[-81]C+R[-37]C -> 3472 | AI177: =R[-149]C+R[-137]C+R[-104]C+R[-89]C+R[-81]C+R[-37]C -> 7352 | AJ177: =R[-149]C+R[-137]C+R[-104]C+R[-89]C+R[-81]C+R[-37]C -> 2697 | AK177: =R[-149]C+R[-137]C+R[-104]C+R[-89]C+R[-81]C+R[-37]C -> 507 | AL177: =R[-149]C+R[-137]C+R[-104]C+R[-89]C+R[-81]C+R[-37]C -> 203
B178: 8 Northern Virginia | D178: =R[-165]C+R[-143]C+R[-119]C+R[-99]C+R[-76]C+R[-66]C+R[-65]C+R[-56]C+R[-55]C -> 1218534 | E178: =R[-165]C+R[-143]C+R[-119]C+R[-99]C+R[-76]C+R[-66]C+R[-65]C+R[-56]C+R[-55]C -> 593901 | F178: =R[-165]C+R[-143]C+R[-119]C+R[-99]C+R[-76]C+R[-66]C+R[-65]C+R[-56]C+R[-55]C -> 7375 | G178: =R[-165]C+R[-143]C+R[-119]C+R[-99]C+R[-76]C+R[-66]C+R[-65]C+R[-56]C+R[-55]C -> 3620 | H178: =R[-165]C+R[-143]C+R[-119]C+R[-99]C+R[-76]C+R[-66]C+R[-65]C+R[-56]C+R[-55]C -> 8911 | I178: =R[-165]C+R[-143]C+R[-119]C+R[-99]C+R[-76]C+R[-66]C+R[-65]C+R[-56]C+R[-55]C -> 7626 | J178: =R[-165]C+R[-143]C+R[-119]C+R[-99]C+R[-76]C+R[-66]C+R[-65]C+R[-56]C+R[-55]C -> 7554 | K178: =R[-165]C+R[-143]C+R[-119]C+R[-99]C+R[-76]C+R[-66]C+R[-65]C+R[-56]C+R[-55]C -> 6978 | L178: =R[-165]C+R[-143]C+R[-119]C+R[-99]C+R[-76]C+R[-66]C+R[-65]C+R[-56]C+R[-55]C -> 6300 | M178: =R[-165]C+R[-143]C+R[-119]C+R[-99]C+R[-76]C+R[-66]C+R[-65]C+R[-56]C+R[-55]C -> 12857 | N178: =R[-165]C+R[-143]C+R[-119]C+R[-99]C+R[-76]C+R[-66]C+R[-65]C+R[-56]C+R[-55]C -> 81574 | O178: =R[-165]C+R[-143]C+R[-119]C+R[-99]C+R[-76]C+R[-66]C+R[-65]C+R[-56]C+R[-55]C -> 27038 | P178: =R[-165]C+R[-143]C+R[-119]C+R[-99]C+R[-76]C+R[-66]C+R[-65]C+R[-56]C+R[-55]C -> 68483 | Q178: =R[-165]C+R[-143]C+R[-119]C+R[-99]C+R[-76]C+R[-66]C+R[-65]C+R[-56]C+R[-55]C -> 27051 | R178: =R[-165]C+R[-143]C+R[-119]C+R[-99]C+R[-76]C+R[-66]C+R[-65]C+R[-56]C+R[-55]C -> 168915 | S178: =R[-165]C+R[-143]C+R[-119]C+R[-99]C+R[-76]C+R[-66]C+R[-65]C+R[-56]C+R[-55]C -> 107897 | T178: =R[-165]C+R[-143]C+R[-119]C+R[-99]C+R[-76]C+R[-66]C+R[-65]C+R[-56]C+R[-55]C -> 31922 | U178: =R[-165]C+R[-143]C+R[-119]C+R[-99]C+R[-76]C+R[-66]C+R[-65]C+R[-56]C+R[-55]C -> 19800 | V178: =R[-165]C+R[-143]C+R[-119]C+R[-99]C+R[-76]C+R[-66]C+R[-65]C+R[-56]C+R[-55]C -> 624633 | W178: =R[-165]C+R[-143]C+R[-119]C+R[-99]C+R[-76]C+R[-66]C+R[-65]C+R[-56]C+R[-55]C -> 7161 | X178: =R[-165]C+R[-143]C+R[-119]C+R[-99]C+R[-76]C+R[-66]C+R[-65]C+R[-56]C+R[-55]C -> 3862 | Y178: =R[-165]C+R[-143]C+R[-119]C+R[-99]C+R[-76]C+R[-66]C+R[-65]C+R[-56]C+R[-55]C -> 8741 | Z178: =R[-165]C+R[-143]C+R[-119]C+R[-99]C+R[-76]C+R[-66]C+R[-65]C+R[-56]C+R[-55]C -> 8822 | AA178: =R[-165]C+R[-143]C+R[-119]C+R[-99]C+R[-76]C+R[-66]C+R[-65]C+R[-56]C+R[-55]C -> 7071 | AB178: =R[-165]C+R[-143]C+R[-119]C+R[-99]C+R[-76]C+R[-66]C+R[-65]C+R[-56]C+R[-55]C -> 7681 | AC178: =R[-165]C+R[-143]C+R[-119]C+R[-99]C+R[-76]C+R[-66]C+R[-65]C+R[-56]C+R[-55]C -> 6583 | AD178: =R[-165]C+R[-143]C+R[-119]C+R[-99]C+R[-76]C+R[-66]C+R[-65]C+R[-56]C+R[-55]C -> 13723 | AE178: =R[-165]C+R[-143]C+R[-119]C+R[-99]C+R[-76]C+R[-66]C+R[-65]C+R[-56]C+R[-55]C -> 110062 | AF178: =R[-165]C+R[-143]C+R[-119]C+R[-99]C+R[-76]C+R[-66]C+R[-65]C+R[-56]C+R[-55]C -> 38549 | AG178: =R[-165]C+R[-143]C+R[-119]C+R[-99]C+R[-76]C+R[-66]C+R[-65]C+R[-56]C+R[-55]C -> 84343 | AH178: =R[-165]C+R[-143]C+R[-119]C+R[-99]C+R[-76]C+R[-66]C+R[-65]C+R[-56]C+R[-55]C -> 38651 | AI178: =R[-165]C+R[-143]C+R[-119]C+R[-99]C+R[-76]C+R[-66]C+R[-65]C+R[-56]C+R[-55]C -> 179518 | AJ178: =R[-165]C+R[-143]C+R[-119]C+R[-99]C+R[-76]C+R[-66]C+R[-65]C+R[-56]C+R[-55]C -> 82788 | AK178: =R[-165]C+R[-143]C+R[-119]C+R[-99]C+R[-76]C+R[-66]C+R[-65]C+R[-56]C+R[-55]C -> 19013 | AL178: =R[-165]C+R[-143]C+R[-119]C+R[-99]C+R[-76]C+R[-66]C+R[-65]C+R[-56]C+R[-55]C -> 8065
B179: 9 Rappahannock-Rapidan | D179: =R[-149]C+R[-143]C+R[-117]C+R[-107]C+R[-98]C -> 91325 | E179: =R[-149]C+R[-143]C+R[-117]C+R[-107]C+R[-98]C -> 44657 | F179: =R[-149]C+R[-143]C+R[-117]C+R[-107]C+R[-98]C -> 393 | G179: =R[-149]C+R[-143]C+R[-117]C+R[-107]C+R[-98]C -> 407 | H179: =R[-149]C+R[-143]C+R[-117]C+R[-107]C+R[-98]C -> 1109 | I179: =R[-149]C+R[-143]C+R[-117]C+R[-107]C+R[-98]C -> 2346 | J179: =R[-149]C+R[-143]C+R[-117]C+R[-107]C+R[-98]C -> 1513 | K179: =R[-149]C+R[-143]C+R[-117]C+R[-107]C+R[-98]C -> 1790 | L179: =R[-149]C+R[-143]C+R[-117]C+R[-107]C+R[-98]C -> 1521 | M179: =R[-149]C+R[-143]C+R[-117]C+R[-107]C+R[-98]C -> 1358 | N179: =R[-149]C+R[-143]C+R[-117]C+R[-107]C+R[-98]C -> 13974 | O179: =R[-149]C+R[-143]C+R[-117]C+R[-107]C+R[-98]C -> 2927 | P179: =R[-149]C+R[-143]C+R[-117]C+R[-107]C+R[-98]C -> 5365 | Q179: =R[-149]C+R[-143]C+R[-117]C+R[-107]C+R[-98]C -> 1779 | R179: =R[-149]C+R[-143]C+R[-117]C+R[-107]C+R[-98]C -> 6297 | S179: =R[-149]C+R[-143]C+R[-117]C+R[-107]C+R[-98]C -> 2673 | T179: =R[-149]C+R[-143]C+R[-117]C+R[-107]C+R[-98]C -> 850 | U179: =R[-149]C+R[-143]C+R[-117]C+R[-107]C+R[-98]C -> 355 | V179: =R[-149]C+R[-143]C+R[-117]C+R[-107]C+R[-98]C -> 46668 | W179: =R[-149]C+R[-143]C+R[-117]C+R[-107]C+R[-98]C -> 332 | X179: =R[-149]C+R[-143]C+R[-117]C+R[-107]C+R[-98]C -> 319 | Y179: =R[-149]C+R[-143]C+R[-117]C+R[-107]C+R[-98]C -> 863 | Z179: =R[-149]C+R[-143]C+R[-117]C+R[-107]C+R[-98]C -> 1988 | AA179: =R[-149]C+R[-143]C+R[-117]C+R[-107]C+R[-98]C -> 990 | AB179: =R[-149]C+R[-143]C+R[-117]C+R[-107]C+R[-98]C -> 1814 | AC179: =R[-149]C+R[-143]C+R[-117]C+R[-107]C+R[-98]C -> 1589 | AD179: =R[-149]C+R[-143]C+R[-117]C+R[-107]C+R[-98]C -> 1192 | AE179: =R[-149]C+R[-143]C+R[-117]C+R[-107]C+R[-98]C -> 15242 | AF179: =R[-149]C+R[-143]C+R[-117]C+R[-107]C+R[-98]C -> 4108 | AG179: =R[-149]C+R[-143]C+R[-117]C+R[-107]C+R[-98]C -> 6030 | AH179: =R[-149]C+R[-143]C+R[-117]C+R[-107]C+R[-98]C -> 2662 | AI179: =R[-149]C+R[-143]C+R[-117]C+R[-107]C+R[-98]C -> 6601 | AJ179: =R[-149]C+R[-143]C+R[-117]C+R[-107]C+R[-98]C -> 2283 | AK179: =R[-149]C+R[-143]C+R[-117]C+R[-107]C+R[-98]C -> 453 | AL179: =R[-149]C+R[-143]C+R[-117]C+R[-107]C+R[-98]C -> 202
B180: 10 Thomas Jefferson | D180: =R[-172]C+R[-142]C+R[-135]C+R[-120]C+R[-113]C+R[-74]C -> 129060 | E180: =R[-172]C+R[-142]C+R[-135]C+R[-120]C+R[-113]C+R[-74]C -> 60296 | F180: =R[-172]C+R[-142]C+R[-135]C+R[-120]C+R[-113]C+R[-74]C -> 547 | G180: =R[-172]C+R[-142]C+R[-135]C+R[-120]C+R[-113]C+R[-74]C -> 448 | H180: =R[-172]C+R[-142]C+R[-135]C+R[-120]C+R[-113]C+R[-74]C -> 1329 | I180: =R[-172]C+R[-142]C+R[-135]C+R[-120]C+R[-113]C+R[-74]C -> 2913 | J180: =R[-172]C+R[-142]C+R[-135]C+R[-120]C+R[-113]C+R[-74]C -> 1617 | K180: =R[-172]C+R[-142]C+R[-135]C+R[-120]C+R[-113]C+R[-74]C -> 2020 | L180: =R[-172]C+R[-142]C+R[-135]C+R[-120]C+R[-113]C+R[-74]C -> 2123 | M180: =R[-172]C+R[-142]C+R[-135]C+R[-120]C+R[-113]C+R[-74]C -> 1481 | N180: =R[-172]C+R[-142]C+R[-135]C+R[-120]C+R[-113]C+R[-74]C -> 13704 | O180: =R[-172]C+R[-142]C+R[-135]C+R[-120]C+R[-113]C+R[-74]C -> 3403 | P180: =R[-172]C+R[-142]C+R[-135]C+R[-120]C+R[-113]C+R[-74]C -> 6029 | Q180: =R[-172]C+R[-142]C+R[-135]C+R[-120]C+R[-113]C+R[-74]C -> 2524 | R180: =R[-172]C+R[-142]C+R[-135]C+R[-120]C+R[-113]C+R[-74]C -> 10900 | S180: =R[-172]C+R[-142]C+R[-135]C+R[-120]C+R[-113]C+R[-74]C -> 5676 | T180: =R[-172]C+R[-142]C+R[-135]C+R[-120]C+R[-113]C+R[-74]C -> 2810 | U180: =R[-172]C+R[-142]C+R[-135]C+R[-120]C+R[-113]C+R[-74]C -> 2772 | V180: =R[-172]C+R[-142]C+R[-135]C+R[-120]C+R[-113]C+R[-74]C -> 68764 | W180: =R[-172]C+R[-142]C+R[-135]C+R[-120]C+R[-113]C+R[-74]C -> 703 | X180: =R[-172]C+R[-142]C+R[-135]C+R[-120]C+R[-113]C+R[-74]C -> 468 | Y180: =R[-172]C+R[-142]C+R[-135]C+R[-120]C+R[-113]C+R[-74]C -> 856 | Z180: =R[-172]C+R[-142]C+R[-135]C+R[-120]C+R[-113]C+R[-74]C -> 2671 | AA180: =R[-172]C+R[-142]C+R[-135]C+R[-120]C+R[-113]C+R[-74]C -> 1441 | AB180: =R[-172]C+R[-142]C+R[-135]C+R[-120]C+R[-113]C+R[-74]C -> 2075 | AC180: =R[-172]C+R[-142]C+R[-135]C+R[-120]C+R[-113]C+R[-74]C -> 2176 | AD180: =R[-172]C+R[-142]C+R[-135]C+R[-120]C+R[-113]C+R[-74]C -> 1505 | AE180: =R[-172]C+R[-142]C+R[-135]C+R[-120]C+R[-113]C+R[-74]C -> 17836 | AF180: =R[-172]C+R[-142]C+R[-135]C+R[-120]C+R[-113]C+R[-74]C -> 4702 | AG180: =R[-172]C+R[-142]C+R[-135]C+R[-120]C+R[-113]C+R[-74]C -> 7739 | AH180: =R[-172]C+R[-142]C+R[-135]C+R[-120]C+R[-113]C+R[-74]C -> 3654 | AI180: =R[-172]C+R[-142]C+R[-135]C+R[-120]C+R[-113]C+R[-74]C -> 13196 | AJ180: =R[-172]C+R[-142]C+R[-135]C+R[-120]C+R[-113]C+R[-74]C -> 6767 | AK180: =R[-172]C+R[-142]C+R[-135]C+R[-120]C+R[-113]C+R[-74]C -> 1777 | AL180: =R[-172]C+R[-142]C+R[-135]C+R[-120]C+R[-113]C+R[-74]C -> 1198
B181: 11 Region 2000 | D181: =R[-170]C+R[-169]C+R[-165]C+R[-159]C+R[-78]C+R[-60]C -> 153445 | E181: =R[-170]C+R[-169]C+R[-165]C+R[-159]C+R[-78]C+R[-60]C -> 71911 | F181: =R[-170]C+R[-169]C+R[-165]C+R[-159]C+R[-78]C+R[-60]C -> 1249 | G181: =R[-170]C+R[-169]C+R[-165]C+R[-159]C+R[-78]C+R[-60]C -> 596 | H181: =R[-170]C+R[-169]C+R[-165]C+R[-159]C+R[-78]C+R[-60]C -> 1603 | I181: =R[-170]C+R[-169]C+R[-165]C+R[-159]C+R[-78]C+R[-60]C -> 4143 | J181: =R[-170]C+R[-169]C+R[-165]C+R[-159]C+R[-78]C+R[-60]C -> 2400 | K181: =R[-170]C+R[-169]C+R[-165]C+R[-159]C+R[-78]C+R[-60]C -> 3381 | L181: =R[-170]C+R[-169]C+R[-165]C+R[-159]C+R[-78]C+R[-60]C -> 2529 | M181: =R[-170]C+R[-169]C+R[-165]C+R[-159]C+R[-78]C+R[-60]C -> 2583 | N181: =R[-170]C+R[-169]C+R[-165]C+R[-159]C+R[-78]C+R[-60]C -> 22082 | O181: =R[-170]C+R[-169]C+R[-165]C+R[-159]C+R[-78]C+R[-60]C -> 4663 | P181: =R[-170]C+R[-169]C+R[-165]C+R[-159]C+R[-78]C+R[-60]C -> 8789 | Q181: =R[-170]C+R[-169]C+R[-165]C+R[-159]C+R[-78]C+R[-60]C -> 3666 | R181: =R[-170]C+R[-169]C+R[-165]C+R[-159]C+R[-78]C+R[-60]C -> 8818 | S181: =R[-170]C+R[-169]C+R[-165]C+R[-159]C+R[-78]C+R[-60]C -> 3464 | T181: =R[-170]C+R[-169]C+R[-165]C+R[-159]C+R[-78]C+R[-60]C -> 1153 | U181: =R[-170]C+R[-169]C+R[-165]C+R[-159]C+R[-78]C+R[-60]C -> 792 | V181: =R[-170]C+R[-169]C+R[-165]C+R[-159]C+R[-78]C+R[-60]C -> 81534 | W181: =R[-170]C+R[-169]C+R[-165]C+R[-159]C+R[-78]C+R[-60]C -> 971 | X181: =R[-170]C+R[-169]C+R[-165]C+R[-159]C+R[-78]C+R[-60]C -> 479 | Y181: =R[-170]C+R[-169]C+R[-165]C+R[-159]C+R[-78]C+R[-60]C -> 1324 | Z181: =R[-170]C+R[-169]C+R[-165]C+R[-159]C+R[-78]C+R[-60]C -> 4237 | AA181: =R[-170]C+R[-169]C+R[-165]C+R[-159]C+R[-78]C+R[-60]C -> 2383 | AB181: =R[-170]C+R[-169]C+R[-165]C+R[-159]C+R[-78]C+R[-60]C -> 3530 | AC181: =R[-170]C+R[-169]C+R[-165]C+R[-159]C+R[-78]C+R[-60]C -> 3130 | AD181: =R[-170]C+R[-169]C+R[-165]C+R[-159]C+R[-78]C+R[-60]C -> 2500 | AE181: =R[-170]C+R[-169]C+R[-165]C+R[-159]C+R[-78]C+R[-60]C -> 26970 | AF181: =R[-170]C+R[-169]C+R[-165]C+R[-159]C+R[-78]C+R[-60]C -> 5592 | AG181: =R[-170]C+R[-169]C+R[-165]C+R[-159]C+R[-78]C+R[-60]C -> 11054 | AH181: =R[-170]C+R[-169]C+R[-165]C+R[-159]C+R[-78]C+R[-60]C -> 4858 | AI181: =R[-170]C+R[-169]C+R[-165]C+R[-159]C+R[-78]C+R[-60]C -> 9975 | AJ181: =R[-170]C+R[-169]C+R[-165]C+R[-159]C+R[-78]C+R[-60]C -> 3320 | AK181: =R[-170]C+R[-169]C+R[-165]C+R[-159]C+R[-78]C+R[-60]C -> 907 | AL181: =R[-170]C+R[-169]C+R[-165]C+R[-159]C+R[-78]C+R[-60]C -> 304
B182: 12 West Piedmont | D182: =R[-143]C+R[-132]C+R[-108]C+R[-107]C+R[-72]C+R[-58]C -> 174529 | E182: =R[-143]C+R[-132]C+R[-108]C+R[-107]C+R[-72]C+R[-58]C -> 81573 | F182: =R[-143]C+R[-132]C+R[-108]C+R[-107]C+R[-72]C+R[-58]C -> 1333 | G182: =R[-143]C+R[-132]C+R[-108]C+R[-107]C+R[-72]C+R[-58]C -> 1293 | H182: =R[-143]C+R[-132]C+R[-108]C+R[-107]C+R[-72]C+R[-58]C -> 2586 | I182: =R[-143]C+R[-132]C+R[-108]C+R[-107]C+R[-72]C+R[-58]C -> 7070 | J182: =R[-143]C+R[-132]C+R[-108]C+R[-107]C+R[-72]C+R[-58]C -> 3763 | K182: =R[-143]C+R[-132]C+R[-108]C+R[-107]C+R[-72]C+R[-58]C -> 4840 | L182: =R[-143]C+R[-132]C+R[-108]C+R[-107]C+R[-72]C+R[-58]C -> 4121 | M182: =R[-143]C+R[-132]C+R[-108]C+R[-107]C+R[-72]C+R[-58]C -> 3267 | N182: =R[-143]C+R[-132]C+R[-108]C+R[-107]C+R[-72]C+R[-58]C -> 25997 | O182: =R[-143]C+R[-132]C+R[-108]C+R[-107]C+R[-72]C+R[-58]C -> 4720 | P182: =R[-143]C+R[-132]C+R[-108]C+R[-107]C+R[-72]C+R[-58]C -> 8815 | Q182: =R[-143]C+R[-132]C+R[-108]C+R[-107]C+R[-72]C+R[-58]C -> 3853 | R182: =R[-143]C+R[-132]C+R[-108]C+R[-107]C+R[-72]C+R[-58]C -> 6264 | S182: =R[-143]C+R[-132]C+R[-108]C+R[-107]C+R[-72]C+R[-58]C -> 2188 | T182: =R[-143]C+R[-132]C+R[-108]C+R[-107]C+R[-72]C+R[-58]C -> 1064 | U182: =R[-143]C+R[-132]C+R[-108]C+R[-107]C+R[-72]C+R[-58]C -> 399 | V182: =R[-143]C+R[-132]C+R[-108]C+R[-107]C+R[-72]C+R[-58]C -> 92956 | W182: =R[-143]C+R[-132]C+R[-108]C+R[-107]C+R[-72]C+R[-58]C -> 1077 | X182: =R[-143]C+R[-132]C+R[-108]C+R[-107]C+R[-72]C+R[-58]C -> 837 | Y182: =R[-143]C+R[-132]C+R[-108]C+R[-107]C+R[-72]C+R[-58]C -> 2412 | Z182: =R[-143]C+R[-132]C+R[-108]C+R[-107]C+R[-72]C+R[-58]C -> 7527 | AA182: =R[-143]C+R[-132]C+R[-108]C+R[-107]C+R[-72]C+R[-58]C -> 3878 | AB182: =R[-143]C+R[-132]C+R[-108]C+R[-107]C+R[-72]C+R[-58]C -> 5280 | AC182: =R[-143]C+R[-132]C+R[-108]C+R[-107]C+R[-72]C+R[-58]C -> 4082 | AD182: =R[-143]C+R[-132]C+R[-108]C+R[-107]C+R[-72]C+R[-58]C -> 3258 | AE182: =R[-143]C+R[-132]C+R[-108]C+R[-107]C+R[-72]C+R[-58]C -> 31308 | AF182: =R[-143]C+R[-132]C+R[-108]C+R[-107]C+R[-72]C+R[-58]C -> 6532 | AG182: =R[-143]C+R[-132]C+R[-108]C+R[-107]C+R[-72]C+R[-58]C -> 10951 | AH182: =R[-143]C+R[-132]C+R[-108]C+R[-107]C+R[-72]C+R[-58]C -> 5437 | AI182: =R[-143]C+R[-132]C+R[-108]C+R[-107]C+R[-72]C+R[-58]C -> 6921 | AJ182: =R[-143]C+R[-132]C+R[-108]C+R[-107]C+R[-72]C+R[-58]C -> 2541 | AK182: =R[-143]C+R[-132]C+R[-108]C+R[-107]C+R[-72]C+R[-58]C -> 763 | AL182: =R[-143]C+R[-132]C+R[-108]C+R[-107]C+R[-72]C+R[-58]C -> 152
B183: 13 Southside | D183: =R[-164]C+R[-136]C+R[-119]C -> 61831 | E183: =R[-164]C+R[-136]C+R[-119]C -> 29987 | F183: =R[-164]C+R[-136]C+R[-119]C -> 741 | G183: =R[-164]C+R[-136]C+R[-119]C -> 586 | H183: =R[-164]C+R[-136]C+R[-119]C -> 1179 | I183: =R[-164]C+R[-136]C+R[-119]C -> 2262 | J183: =R[-164]C+R[-136]C+R[-119]C -> 1209 | K183: =R[-164]C+R[-136]C+R[-119]C -> 2066 | L183: =R[-164]C+R[-136]C+R[-119]C -> 2083 | M183: =R[-164]C+R[-136]C+R[-119]C -> 1421 | N183: =R[-164]C+R[-136]C+R[-119]C -> 9473 | O183: =R[-164]C+R[-136]C+R[-119]C -> 1723 | P183: =R[-164]C+R[-136]C+R[-119]C -> 2859 | Q183: =R[-164]C+R[-136]C+R[-119]C -> 1284 | R183: =R[-164]C+R[-136]C+R[-119]C -> 2197 | S183: =R[-164]C+R[-136]C+R[-119]C -> 574 | T183: =R[-164]C+R[-136]C+R[-119]C -> 253 | U183: =R[-164]C+R[-136]C+R[-119]C -> 77 | V183: =R[-164]C+R[-136]C+R[-119]C -> 31844 | W183: =R[-164]C+R[-136]C+R[-119]C -> 445 | X183: =R[-164]C+R[-136]C+R[-119]C -> 345 | Y183: =R[-164]C+R[-136]C+R[-119]C -> 838 | Z183: =R[-164]C+R[-136]C+R[-119]C -> 2168 | AA183: =R[-164]C+R[-136]C+R[-119]C -> 1306 | AB183: =R[-164]C+R[-136]C+R[-119]C -> 1904 | AC183: =R[-164]C+R[-136]C+R[-119]C -> 1830 | AD183: =R[-164]C+R[-136]C+R[-119]C -> 1134 | AE183: =R[-164]C+R[-136]C+R[-119]C -> 11152 | AF183: =R[-164]C+R[-136]C+R[-119]C -> 2163 | AG183: =R[-164]C+R[-136]C+R[-119]C -> 3443 | AH183: =R[-164]C+R[-136]C+R[-119]C -> 1588 | AI183: =R[-164]C+R[-136]C+R[-119]C -> 2257 | AJ183: =R[-164]C+R[-136]C+R[-119]C -> 1009 | AK183: =R[-164]C+R[-136]C+R[-119]C -> 226 | AL183: =R[-164]C+R[-136]C+R[-119]C -> 36
B184: 14 Piedmont | D184: =R[-174]C+R[-163]C+R[-158]C+R[-153]C+R[-123]C+R[-113]C+R[-107]C -> 64670 | E184: =R[-174]C+R[-163]C+R[-158]C+R[-153]C+R[-123]C+R[-113]C+R[-107]C -> 32240 | F184: =R[-174]C+R[-163]C+R[-158]C+R[-153]C+R[-123]C+R[-113]C+R[-107]C -> 754 | G184: =R[-174]C+R[-163]C+R[-158]C+R[-153]C+R[-123]C+R[-113]C+R[-107]C -> 569 | H184: =R[-174]C+R[-163]C+R[-158]C+R[-153]C+R[-123]C+R[-113]C+R[-107]C -> 1278 | I184: =R[-174]C+R[-163]C+R[-158]C+R[-153]C+R[-123]C+R[-113]C+R[-107]C -> 2660 | J184: =R[-174]C+R[-163]C+R[-158]C+R[-153]C+R[-123]C+R[-113]C+R[-107]C -> 1731 | K184: =R[-174]C+R[-163]C+R[-158]C+R[-153]C+R[-123]C+R[-113]C+R[-107]C -> 2250 | L184: =R[-174]C+R[-163]C+R[-158]C+R[-153]C+R[-123]C+R[-113]C+R[-107]C -> 1789 | M184: =R[-174]C+R[-163]C+R[-158]C+R[-153]C+R[-123]C+R[-113]C+R[-107]C -> 1553 | N184: =R[-174]C+R[-163]C+R[-158]C+R[-153]C+R[-123]C+R[-113]C+R[-107]C -> 10557 | O184: =R[-174]C+R[-163]C+R[-158]C+R[-153]C+R[-123]C+R[-113]C+R[-107]C -> 1839 | P184: =R[-174]C+R[-163]C+R[-158]C+R[-153]C+R[-123]C+R[-113]C+R[-107]C -> 3094 | Q184: =R[-174]C+R[-163]C+R[-158]C+R[-153]C+R[-123]C+R[-113]C+R[-107]C -> 980 | R184: =R[-174]C+R[-163]C+R[-158]C+R[-153]C+R[-123]C+R[-113]C+R[-107]C -> 1939 | S184: =R[-174]C+R[-163]C+R[-158]C+R[-153]C+R[-123]C+R[-113]C+R[-107]C -> 736 | T184: =R[-174]C+R[-163]C+R[-158]C+R[-153]C+R[-123]C+R[-113]C+R[-107]C -> 252 | U184: =R[-174]C+R[-163]C+R[-158]C+R[-153]C+R[-123]C+R[-113]C+R[-107]C -> 259 | V184: =R[-174]C+R[-163]C+R[-158]C+R[-153]C+R[-123]C+R[-113]C+R[-107]C -> 32430 | W184: =R[-174]C+R[-163]C+R[-158]C+R[-153]C+R[-123]C+R[-113]C+R[-107]C -> 399 | X184: =R[-174]C+R[-163]C+R[-158]C+R[-153]C+R[-123]C+R[-113]C+R[-107]C -> 432 | Y184: =R[-174]C+R[-163]C+R[-158]C+R[-153]C+R[-123]C+R[-113]C+R[-107]C -> 766 | Z184: =R[-174]C+R[-163]C+R[-158]C+R[-153]C+R[-123]C+R[-113]C+R[-107]C -> 2534 | AA184: =R[-174]C+R[-163]C+R[-158]C+R[-153]C+R[-123]C+R[-113]C+R[-107]C -> 1267 | AB184: =R[-174]C+R[-163]C+R[-158]C+R[-153]C+R[-123]C+R[-113]C+R[-107]C -> 2032 | AC184: =R[-174]C+R[-163]C+R[-158]C+R[-153]C+R[-123]C+R[-113]C+R[-107]C -> 1482 | AD184: =R[-174]C+R[-163]C+R[-158]C+R[-153]C+R[-123]C+R[-113]C+R[-107]C -> 1023 | AE184: =R[-174]C+R[-163]C+R[-158]C+R[-153]C+R[-123]C+R[-113]C+R[-107]C -> 10999 | AF184: =R[-174]C+R[-163]C+R[-158]C+R[-153]C+R[-123]C+R[-113]C+R[-107]C -> 2160 | AG184: =R[-174]C+R[-163]C+R[-158]C+R[-153]C+R[-123]C+R[-113]C+R[-107]C -> 3419 | AH184: =R[-174]C+R[-163]C+R[-158]C+R[-153]C+R[-123]C+R[-113]C+R[-107]C -> 1617 | AI184: =R[-174]C+R[-163]C+R[-158]C+R[-153]C+R[-123]C+R[-113]C+R[-107]C -> 2827 | AJ184: =R[-174]C+R[-163]C+R[-158]C+R[-153]C+R[-123]C+R[-113]C+R[-107]C -> 1100 | AK184: =R[-174]C+R[-163]C+R[-158]C+R[-153]C+R[-123]C+R[-113]C+R[-107]C -> 209 | AL184: =R[-174]C+R[-163]C+R[-158]C+R[-153]C+R[-123]C+R[-113]C+R[-107]C -> 164
B185: 15 Richmond Regional | D185: =R[-160]C+R[-158]C+R[-142]C+R[-137]C+R[-136]C+R[-117]C+R[-109]C+R[-53]C -> 571464 | E185: =R[-160]C+R[-158]C+R[-142]C+R[-137]C+R[-136]C+R[-117]C+R[-109]C+R[-53]C -> 265545 | F185: =R[-160]C+R[-158]C+R[-142]C+R[-137]C+R[-136]C+R[-117]C+R[-109]C+R[-53]C -> 1982 | G185: =R[-160]C+R[-158]C+R[-142]C+R[-137]C+R[-136]C+R[-117]C+R[-109]C+R[-53]C -> 1172 | H185: =R[-160]C+R[-158]C+R[-142]C+R[-137]C+R[-136]C+R[-117]C+R[-109]C+R[-53]C -> 3337 | I185: =R[-160]C+R[-158]C+R[-142]C+R[-137]C+R[-136]C+R[-117]C+R[-109]C+R[-53]C -> 7913 | J185: =R[-160]C+R[-158]C+R[-142]C+R[-137]C+R[-136]C+R[-117]C+R[-109]C+R[-53]C -> 6138 | K185: =R[-160]C+R[-158]C+R[-142]C+R[-137]C+R[-136]C+R[-117]C+R[-109]C+R[-53]C -> 8233 | L185: =R[-160]C+R[-158]C+R[-142]C+R[-137]C+R[-136]C+R[-117]C+R[-109]C+R[-53]C -> 7714 | M185: =R[-160]C+R[-158]C+R[-142]C+R[-137]C+R[-136]C+R[-117]C+R[-109]C+R[-53]C -> 8390 | N185: =R[-160]C+R[-158]C+R[-142]C+R[-137]C+R[-136]C+R[-117]C+R[-109]C+R[-53]C -> 64945 | O185: =R[-160]C+R[-158]C+R[-142]C+R[-137]C+R[-136]C+R[-117]C+R[-109]C+R[-53]C -> 16555 | P185: =R[-160]C+R[-158]C+R[-142]C+R[-137]C+R[-136]C+R[-117]C+R[-109]C+R[-53]C -> 37798 | Q185: =R[-160]C+R[-158]C+R[-142]C+R[-137]C+R[-136]C+R[-117]C+R[-109]C+R[-53]C -> 12434 | R185: =R[-160]C+R[-158]C+R[-142]C+R[-137]C+R[-136]C+R[-117]C+R[-109]C+R[-53]C -> 57431 | S185: =R[-160]C+R[-158]C+R[-142]C+R[-137]C+R[-136]C+R[-117]C+R[-109]C+R[-53]C -> 19405 | T185: =R[-160]C+R[-158]C+R[-142]C+R[-137]C+R[-136]C+R[-117]C+R[-109]C+R[-53]C -> 8074 | U185: =R[-160]C+R[-158]C+R[-142]C+R[-137]C+R[-136]C+R[-117]C+R[-109]C+R[-53]C -> 4024 | V185: =R[-160]C+R[-158]C+R[-142]C+R[-137]C+R[-136]C+R[-117]C+R[-109]C+R[-53]C -> 305919 | W185: =R[-160]C+R[-158]C+R[-142]C+R[-137]C+R[-136]C+R[-117]C+R[-109]C+R[-53]C -> 2230 | X185: =R[-160]C+R[-158]C+R[-142]C+R[-137]C+R[-136]C+R[-117]C+R[-109]C+R[-53]C -> 1069 | Y185: =R[-160]C+R[-158]C+R[-142]C+R[-137]C+R[-136]C+R[-117]C+R[-109]C+R[-53]C -> 2678 | Z185: =R[-160]C+R[-158]C+R[-142]C+R[-137]C+R[-136]C+R[-117]C+R[-109]C+R[-53]C -> 7716 | AA185: =R[-160]C+R[-158]C+R[-142]C+R[-137]C+R[-136]C+R[-117]C+R[-109]C+R[-53]C -> 6282 | AB185: =R[-160]C+R[-158]C+R[-142]C+R[-137]C+R[-136]C+R[-117]C+R[-109]C+R[-53]C -> 9257 | AC185: =R[-160]C+R[-158]C+R[-142]C+R[-137]C+R[-136]C+R[-117]C+R[-109]C+R[-53]C -> 9622 | AD185: =R[-160]C+R[-158]C+R[-142]C+R[-137]C+R[-136]C+R[-117]C+R[-109]C+R[-53]C -> 8649 | AE185: =R[-160]C+R[-158]C+R[-142]C+R[-137]C+R[-136]C+R[-117]C+R[-109]C+R[-53]C -> 78653 | AF185: =R[-160]C+R[-158]C+R[-142]C+R[-137]C+R[-136]C+R[-117]C+R[-109]C+R[-53]C -> 23530 | AG185: =R[-160]C+R[-158]C+R[-142]C+R[-137]C+R[-136]C+R[-117]C+R[-109]C+R[-53]C -> 48490 | AH185: =R[-160]C+R[-158]C+R[-142]C+R[-137]C+R[-136]C+R[-117]C+R[-109]C+R[-53]C -> 17513 | AI185: =R[-160]C+R[-158]C+R[-142]C+R[-137]C+R[-136]C+R[-117]C+R[-109]C+R[-53]C -> 61840 | AJ185: =R[-160]C+R[-158]C+R[-142]C+R[-137]C+R[-136]C+R[-117]C+R[-109]C+R[-53]C -> 21000 | AK185: =R[-160]C+R[-158]C+R[-142]C+R[-137]C+R[-136]C+R[-117]C+R[-109]C+R[-53]C -> 5431 | AL185: =R[-160]C+R[-158]C+R[-142]C+R[-137]C+R[-136]C+R[-117]C+R[-109]C+R[-53]C -> 1959
B186: 16 RADCO | D186: =R[-163]C+R[-131]C+R[-95]C+R[-94]C+R[-71]C -> 149758 | E186: =R[-163]C+R[-131]C+R[-95]C+R[-94]C+R[-71]C -> 72737 | F186: =R[-163]C+R[-131]C+R[-95]C+R[-94]C+R[-71]C -> 258 | G186: =R[-163]C+R[-131]C+R[-95]C+R[-94]C+R[-71]C -> 285 | H186: =R[-163]C+R[-131]C+R[-95]C+R[-94]C+R[-71]C -> 990 | I186: =R[-163]C+R[-131]C+R[-95]C+R[-94]C+R[-71]C -> 2145 | J186: =R[-163]C+R[-131]C+R[-95]C+R[-94]C+R[-71]C -> 1859 | K186: =R[-163]C+R[-131]C+R[-95]C+R[-94]C+R[-71]C -> 2405 | L186: =R[-163]C+R[-131]C+R[-95]C+R[-94]C+R[-71]C -> 2308 | M186: =R[-163]C+R[-131]C+R[-95]C+R[-94]C+R[-71]C -> 2310 | N186: =R[-163]C+R[-131]C+R[-95]C+R[-94]C+R[-71]C -> 20847 | O186: =R[-163]C+R[-131]C+R[-95]C+R[-94]C+R[-71]C -> 5520 | P186: =R[-163]C+R[-131]C+R[-95]C+R[-94]C+R[-71]C -> 9950 | Q186: =R[-163]C+R[-131]C+R[-95]C+R[-94]C+R[-71]C -> 3835 | R186: =R[-163]C+R[-131]C+R[-95]C+R[-94]C+R[-71]C -> 12326 | S186: =R[-163]C+R[-131]C+R[-95]C+R[-94]C+R[-71]C -> 5710 | T186: =R[-163]C+R[-131]C+R[-95]C+R[-94]C+R[-71]C -> 1265 | U186: =R[-163]C+R[-131]C+R[-95]C+R[-94]C+R[-71]C -> 724 | V186: =R[-163]C+R[-131]C+R[-95]C+R[-94]C+R[-71]C -> 77021 | W186: =R[-163]C+R[-131]C+R[-95]C+R[-94]C+R[-71]C -> 309 | X186: =R[-163]C+R[-131]C+R[-95]C+R[-94]C+R[-71]C -> 260 | Y186: =R[-163]C+R[-131]C+R[-95]C+R[-94]C+R[-71]C -> 723 | Z186: =R[-163]C+R[-131]C+R[-95]C+R[-94]C+R[-71]C -> 2068 | AA186: =R[-163]C+R[-131]C+R[-95]C+R[-94]C+R[-71]C -> 1680 | AB186: =R[-163]C+R[-131]C+R[-95]C+R[-94]C+R[-71]C -> 2525 | AC186: =R[-163]C+R[-131]C+R[-95]C+R[-94]C+R[-71]C -> 2105 | AD186: =R[-163]C+R[-131]C+R[-95]C+R[-94]C+R[-71]C -> 1995 | AE186: =R[-163]C+R[-131]C+R[-95]C+R[-94]C+R[-71]C -> 24965 | AF186: =R[-163]C+R[-131]C+R[-95]C+R[-94]C+R[-71]C -> 7253 | AG186: =R[-163]C+R[-131]C+R[-95]C+R[-94]C+R[-71]C -> 10935 | AH186: =R[-163]C+R[-131]C+R[-95]C+R[-94]C+R[-71]C -> 4899 | AI186: =R[-163]C+R[-131]C+R[-95]C+R[-94]C+R[-71]C -> 12202 | AJ186: =R[-163]C+R[-131]C+R[-95]C+R[-94]C+R[-71]C -> 4183 | AK186: =R[-163]C+R[-131]C+R[-95]C+R[-94]C+R[-71]C -> 696 | AL186: =R[-163]C+R[-131]C+R[-95]C+R[-94]C+R[-71]C -> 223
B187: 17 Northern Neck | D187: =R[-130]C+R[-117]C+R[-105]C+R[-89]C -> 36677 | E187: =R[-130]C+R[-117]C+R[-105]C+R[-89]C -> 17631 | F187: =R[-130]C+R[-117]C+R[-105]C+R[-89]C -> 274 | G187: =R[-130]C+R[-117]C+R[-105]C+R[-89]C -> 195 | H187: =R[-130]C+R[-117]C+R[-105]C+R[-89]C -> 710 | I187: =R[-130]C+R[-117]C+R[-105]C+R[-89]C -> 1160 | J187: =R[-130]C+R[-117]C+R[-105]C+R[-89]C -> 724 | K187: =R[-130]C+R[-117]C+R[-105]C+R[-89]C -> 1132 | L187: =R[-130]C+R[-117]C+R[-105]C+R[-89]C -> 1275 | M187: =R[-130]C+R[-117]C+R[-105]C+R[-89]C -> 512 | N187: =R[-130]C+R[-117]C+R[-105]C+R[-89]C -> 5040 | O187: =R[-130]C+R[-117]C+R[-105]C+R[-89]C -> 874 | P187: =R[-130]C+R[-117]C+R[-105]C+R[-89]C -> 1930 | Q187: =R[-130]C+R[-117]C+R[-105]C+R[-89]C -> 501 | R187: =R[-130]C+R[-117]C+R[-105]C+R[-89]C -> 1904 | S187: =R[-130]C+R[-117]C+R[-105]C+R[-89]C -> 836 | T187: =R[-130]C+R[-117]C+R[-105]C+R[-89]C -> 384 | U187: =R[-130]C+R[-117]C+R[-105]C+R[-89]C -> 180 | V187: =R[-130]C+R[-117]C+R[-105]C+R[-89]C -> 19046 | W187: =R[-130]C+R[-117]C+R[-105]C+R[-89]C -> 253 | X187: =R[-130]C+R[-117]C+R[-105]C+R[-89]C -> 134 | Y187: =R[-130]C+R[-117]C+R[-105]C+R[-89]C -> 379 | Z187: =R[-130]C+R[-117]C+R[-105]C+R[-89]C -> 1088 | AA187: =R[-130]C+R[-117]C+R[-105]C+R[-89]C -> 728 | AB187: =R[-130]C+R[-117]C+R[-105]C+R[-89]C -> 895 | AC187: =R[-130]C+R[-117]C+R[-105]C+R[-89]C -> 798 | AD187: =R[-130]C+R[-117]C+R[-105]C+R[-89]C -> 531 | AE187: =R[-130]C+R[-117]C+R[-105]C+R[-89]C -> 6356 | AF187: =R[-130]C+R[-117]C+R[-105]C+R[-89]C -> 1412 | AG187: =R[-130]C+R[-117]C+R[-105]C+R[-89]C -> 2401 | AH187: =R[-130]C+R[-117]C+R[-105]C+R[-89]C -> 934 | AI187: =R[-130]C+R[-117]C+R[-105]C+R[-89]C -> 2116 | AJ187: =R[-130]C+R[-117]C+R[-105]C+R[-89]C -> 710 | AK187: =R[-130]C+R[-117]C+R[-105]C+R[-89]C -> 199 | AL187: =R[-130]C+R[-117]C+R[-105]C+R[-89]C -> 112
B188: 18 Middle Peninsula | D188: =R[-154]C+R[-146]C+R[-134]C+R[-132]C+R[-125]C+R[-123]C -> 58310 | E188: =R[-154]C+R[-146]C+R[-134]C+R[-132]C+R[-125]C+R[-123]C -> 27788 | F188: =R[-154]C+R[-146]C+R[-134]C+R[-132]C+R[-125]C+R[-123]C -> 302 | G188: =R[-154]C+R[-146]C+R[-134]C+R[-132]C+R[-125]C+R[-123]C -> 315 | H188: =R[-154]C+R[-146]C+R[-134]C+R[-132]C+R[-125]C+R[-123]C -> 698 | I188: =R[-154]C+R[-146]C+R[-134]C+R[-132]C+R[-125]C+R[-123]C -> 1454 | J188: =R[-154]C+R[-146]C+R[-134]C+R[-132]C+R[-125]C+R[-123]C -> 786 | K188: =R[-154]C+R[-146]C+R[-134]C+R[-132]C+R[-125]C+R[-123]C -> 1308 | L188: =R[-154]C+R[-146]C+R[-134]C+R[-132]C+R[-125]C+R[-123]C -> 1031 | M188: =R[-154]C+R[-146]C+R[-134]C+R[-132]C+R[-125]C+R[-123]C -> 722 | N188: =R[-154]C+R[-146]C+R[-134]C+R[-132]C+R[-125]C+R[-123]C -> 9300 | O188: =R[-154]C+R[-146]C+R[-134]C+R[-132]C+R[-125]C+R[-123]C -> 2019 | P188: =R[-154]C+R[-146]C+R[-134]C+R[-132]C+R[-125]C+R[-123]C -> 3740 | Q188: =R[-154]C+R[-146]C+R[-134]C+R[-132]C+R[-125]C+R[-123]C -> 1435 | R188: =R[-154]C+R[-146]C+R[-134]C+R[-132]C+R[-125]C+R[-123]C -> 2867 | S188: =R[-154]C+R[-146]C+R[-134]C+R[-132]C+R[-125]C+R[-123]C -> 1221 | T188: =R[-154]C+R[-146]C+R[-134]C+R[-132]C+R[-125]C+R[-123]C -> 355 | U188: =R[-154]C+R[-146]C+R[-134]C+R[-132]C+R[-125]C+R[-123]C -> 235 | V188: =R[-154]C+R[-146]C+R[-134]C+R[-132]C+R[-125]C+R[-123]C -> 30522 | W188: =R[-154]C+R[-146]C+R[-134]C+R[-132]C+R[-125]C+R[-123]C -> 231 | X188: =R[-154]C+R[-146]C+R[-134]C+R[-132]C+R[-125]C+R[-123]C -> 148 | Y188: =R[-154]C+R[-146]C+R[-134]C+R[-132]C+R[-125]C+R[-123]C -> 435 | Z188: =R[-154]C+R[-146]C+R[-134]C+R[-132]C+R[-125]C+R[-123]C -> 1132 | AA188: =R[-154]C+R[-146]C+R[-134]C+R[-132]C+R[-125]C+R[-123]C -> 727 | AB188: =R[-154]C+R[-146]C+R[-134]C+R[-132]C+R[-125]C+R[-123]C -> 1334 | AC188: =R[-154]C+R[-146]C+R[-134]C+R[-132]C+R[-125]C+R[-123]C -> 1250 | AD188: =R[-154]C+R[-146]C+R[-134]C+R[-132]C+R[-125]C+R[-123]C -> 883 | AE188: =R[-154]C+R[-146]C+R[-134]C+R[-132]C+R[-125]C+R[-123]C -> 10252 | AF188: =R[-154]C+R[-146]C+R[-134]C+R[-132]C+R[-125]C+R[-123]C -> 2901 | AG188: =R[-154]C+R[-146]C+R[-134]C+R[-132]C+R[-125]C+R[-123]C -> 4253 | AH188: =R[-154]C+R[-146]C+R[-134]C+R[-132]C+R[-125]C+R[-123]C -> 1784 | AI188: =R[-154]C+R[-146]C+R[-134]C+R[-132]C+R[-125]C+R[-123]C -> 3401 | AJ188: =R[-154]C+R[-146]C+R[-134]C+R[-132]C+R[-125]C+R[-123]C -> 1303 | AK188: =R[-154]C+R[-146]C+R[-134]C+R[-132]C+R[-125]C+R[-123]C -> 321 | AL188: =R[-154]C+R[-146]C+R[-134]C+R[-132]C+R[-125]C+R[-123]C -> 167
B189: 19 Crater | D189: =R[-156]C+R[-143]C+R[-111]C+R[-96]C+R[-95]C+R[-81]C+R[-78]C+R[-70]C+R[-61]C -> 111611 | E189: =R[-156]C+R[-143]C+R[-111]C+R[-96]C+R[-95]C+R[-81]C+R[-78]C+R[-70]C+R[-61]C -> 54745 | F189: =R[-156]C+R[-143]C+R[-111]C+R[-96]C+R[-95]C+R[-81]C+R[-78]C+R[-70]C+R[-61]C -> 1440 | G189: =R[-156]C+R[-143]C+R[-111]C+R[-96]C+R[-95]C+R[-81]C+R[-78]C+R[-70]C+R[-61]C -> 582 | H189: =R[-156]C+R[-143]C+R[-111]C+R[-96]C+R[-95]C+R[-81]C+R[-78]C+R[-70]C+R[-61]C -> 1594 | I189: =R[-156]C+R[-143]C+R[-111]C+R[-96]C+R[-95]C+R[-81]C+R[-78]C+R[-70]C+R[-61]C -> 3177 | J189: =R[-156]C+R[-143]C+R[-111]C+R[-96]C+R[-95]C+R[-81]C+R[-78]C+R[-70]C+R[-61]C -> 1904 | K189: =R[-156]C+R[-143]C+R[-111]C+R[-96]C+R[-95]C+R[-81]C+R[-78]C+R[-70]C+R[-61]C -> 3145 | L189: =R[-156]C+R[-143]C+R[-111]C+R[-96]C+R[-95]C+R[-81]C+R[-78]C+R[-70]C+R[-61]C -> 3100 | M189: =R[-156]C+R[-143]C+R[-111]C+R[-96]C+R[-95]C+R[-81]C+R[-78]C+R[-70]C+R[-61]C -> 1809 | N189: =R[-156]C+R[-143]C+R[-111]C+R[-96]C+R[-95]C+R[-81]C+R[-78]C+R[-70]C+R[-61]C -> 18659 | O189: =R[-156]C+R[-143]C+R[-111]C+R[-96]C+R[-95]C+R[-81]C+R[-78]C+R[-70]C+R[-61]C -> 3034 | P189: =R[-156]C+R[-143]C+R[-111]C+R[-96]C+R[-95]C+R[-81]C+R[-78]C+R[-70]C+R[-61]C -> 6297 | Q189: =R[-156]C+R[-143]C+R[-111]C+R[-96]C+R[-95]C+R[-81]C+R[-78]C+R[-70]C+R[-61]C -> 2400 | R189: =R[-156]C+R[-143]C+R[-111]C+R[-96]C+R[-95]C+R[-81]C+R[-78]C+R[-70]C+R[-61]C -> 4913 | S189: =R[-156]C+R[-143]C+R[-111]C+R[-96]C+R[-95]C+R[-81]C+R[-78]C+R[-70]C+R[-61]C -> 1720 | T189: =R[-156]C+R[-143]C+R[-111]C+R[-96]C+R[-95]C+R[-81]C+R[-78]C+R[-70]C+R[-61]C -> 700 | U189: =R[-156]C+R[-143]C+R[-111]C+R[-96]C+R[-95]C+R[-81]C+R[-78]C+R[-70]C+R[-61]C -> 271 | V189: =R[-156]C+R[-143]C+R[-111]C+R[-96]C+R[-95]C+R[-81]C+R[-78]C+R[-70]C+R[-61]C -> 56866 | W189: =R[-156]C+R[-143]C+R[-111]C+R[-96]C+R[-95]C+R[-81]C+R[-78]C+R[-70]C+R[-61]C -> 942 | X189: =R[-156]C+R[-143]C+R[-111]C+R[-96]C+R[-95]C+R[-81]C+R[-78]C+R[-70]C+R[-61]C -> 421 | Y189: =R[-156]C+R[-143]C+R[-111]C+R[-96]C+R[-95]C+R[-81]C+R[-78]C+R[-70]C+R[-61]C -> 1100 | Z189: =R[-156]C+R[-143]C+R[-111]C+R[-96]C+R[-95]C+R[-81]C+R[-78]C+R[-70]C+R[-61]C -> 3229 | AA189: =R[-156]C+R[-143]C+R[-111]C+R[-96]C+R[-95]C+R[-81]C+R[-78]C+R[-70]C+R[-61]C -> 1874 | AB189: =R[-156]C+R[-143]C+R[-111]C+R[-96]C+R[-95]C+R[-81]C+R[-78]C+R[-70]C+R[-61]C -> 2760 | AC189: =R[-156]C+R[-143]C+R[-111]C+R[-96]C+R[-95]C+R[-81]C+R[-78]C+R[-70]C+R[-61]C -> 2727 | AD189: =R[-156]C+R[-143]C+R[-111]C+R[-96]C+R[-95]C+R[-81]C+R[-78]C+R[-70]C+R[-61]C -> 1980 | AE189: =R[-156]C+R[-143]C+R[-111]C+R[-96]C+R[-95]C+R[-81]C+R[-78]C+R[-70]C+R[-61]C -> 19152 | AF189: =R[-156]C+R[-143]C+R[-111]C+R[-96]C+R[-95]C+R[-81]C+R[-78]C+R[-70]C+R[-61]C -> 4064 | AG189: =R[-156]C+R[-143]C+R[-111]C+R[-96]C+R[-95]C+R[-81]C+R[-78]C+R[-70]C+R[-61]C -> 7563 | AH189: =R[-156]C+R[-143]C+R[-111]C+R[-96]C+R[-95]C+R[-81]C+R[-78]C+R[-70]C+R[-61]C -> 2908 | AI189: =R[-156]C+R[-143]C+R[-111]C+R[-96]C+R[-95]C+R[-81]C+R[-78]C+R[-70]C+R[-61]C -> 5592 | AJ189: =R[-156]C+R[-143]C+R[-111]C+R[-96]C+R[-95]C+R[-81]C+R[-78]C+R[-70]C+R[-61]C -> 1910 | AK189: =R[-156]C+R[-143]C+R[-111]C+R[-96]C+R[-95]C+R[-81]C+R[-78]C+R[-70]C+R[-61]C -> 550 | AL189: =R[-156]C+R[-143]C+R[-111]C+R[-96]C+R[-95]C+R[-81]C+R[-78]C+R[-70]C+R[-61]C -> 94
B190: 22 Accomack-Northampton | D190: =R[-183]C+R[-121]C -> 35027 | E190: =R[-183]C+R[-121]C -> 16282 | F190: =R[-183]C+R[-121]C -> 284 | G190: =R[-183]C+R[-121]C -> 358 | H190: =R[-183]C+R[-121]C -> 761 | I190: =R[-183]C+R[-121]C -> 1099 | J190: =R[-183]C+R[-121]C -> 851 | K190: =R[-183]C+R[-121]C -> 867 | L190: =R[-183]C+R[-121]C -> 888 | M190: =R[-183]C+R[-121]C -> 567 | N190: =R[-183]C+R[-121]C -> 5251 | O190: =R[-183]C+R[-121]C -> 919 | P190: =R[-183]C+R[-121]C -> 1549 | Q190: =R[-183]C+R[-121]C -> 554 | R190: =R[-183]C+R[-121]C -> 1412 | S190: =R[-183]C+R[-121]C -> 501 | T190: =R[-183]C+R[-121]C -> 288 | U190: =R[-183]C+R[-121]C -> 133 | V190: =R[-183]C+R[-121]C -> 18745 | W190: =R[-183]C+R[-121]C -> 256 | X190: =R[-183]C+R[-121]C -> 215 | Y190: =R[-183]C+R[-121]C -> 473 | Z190: =R[-183]C+R[-121]C -> 1094 | AA190: =R[-183]C+R[-121]C -> 873 | AB190: =R[-183]C+R[-121]C -> 1096 | AC190: =R[-183]C+R[-121]C -> 1121 | AD190: =R[-183]C+R[-121]C -> 477 | AE190: =R[-183]C+R[-121]C -> 6246 | AF190: =R[-183]C+R[-121]C -> 1212 | AG190: =R[-183]C+R[-121]C -> 2115 | AH190: =R[-183]C+R[-121]C -> 957 | AI190: =R[-183]C+R[-121]C -> 1662 | AJ190: =R[-183]C+R[-121]C -> 664 | AK190: =R[-183]C+R[-121]C -> 198 | AL190: =R[-183]C+R[-121]C -> 86
B191: 23 Hampton Roads | D191: =SUM(R[-139]C,R[-138]C,R[-101]C,R[-90]C,R[-84]C,R[-77]C,R[-74]C,R[-66]C,R[-65]C,R[-62]C)+SUM(R[-61]C,R[-55]C,R[-54]C,R[-52]C) -> 956452 | E191: =SUM(R[-139]C,R[-138]C,R[-101]C,R[-90]C,R[-84]C,R[-77]C,R[-74]C,R[-66]C,R[-65]C,R[-62]C)+SUM(R[-61]C,R[-55]C,R[-54]C,R[-52]C) -> 454339 | F191: =SUM(R[-139]C,R[-138]C,R[-101]C,R[-90]C,R[-84]C,R[-77]C,R[-74]C,R[-66]C,R[-65]C,R[-62]C)+SUM(R[-61]C,R[-55]C,R[-54]C,R[-52]C) -> 3042 | G191: =SUM(R[-139]C,R[-138]C,R[-101]C,R[-90]C,R[-84]C,R[-77]C,R[-74]C,R[-66]C,R[-65]C,R[-62]C)+SUM(R[-61]C,R[-55]C,R[-54]C,R[-52]C) -> 1875 | H191: =SUM(R[-139]C,R[-138]C,R[-101]C,R[-90]C,R[-84]C,R[-77]C,R[-74]C,R[-66]C,R[-65]C,R[-62]C)+SUM(R[-61]C,R[-55]C,R[-54]C,R[-52]C) -> 4596 | I191: =SUM(R[-139]C,R[-138]C,R[-101]C,R[-90]C,R[-84]C,R[-77]C,R[-74]C,R[-66]C,R[-65]C,R[-62]C)+SUM(R[-61]C,R[-55]C,R[-54]C,R[-52]C) -> 10411 | J191: =SUM(R[-139]C,R[-138]C,R[-101]C,R[-90]C,R[-84]C,R[-77]C,R[-74]C,R[-66]C,R[-65]C,R[-62]C)+SUM(R[-61]C,R[-55]C,R[-54]C,R[-52]C) -> 7826 | K191: =SUM(R[-139]C,R[-138]C,R[-101]C,R[-90]C,R[-84]C,R[-77]C,R[-74]C,R[-66]C,R[-65]C,R[-62]C)+SUM(R[-61]C,R[-55]C,R[-54]C,R[-52]C) -> 13300 | L191: =SUM(R[-139]C,R[-138]C,R[-101]C,R[-90]C,R[-84]C,R[-77]C,R[-74]C,R[-66]C,R[-65]C,R[-62]C)+SUM(R[-61]C,R[-55]C,R[-54]C,R[-52]C) -> 12927 | M191: =SUM(R[-139]C,R[-138]C,R[-101]C,R[-90]C,R[-84]C,R[-77]C,R[-74]C,R[-66]C,R[-65]C,R[-62]C)+SUM(R[-61]C,R[-55]C,R[-54]C,R[-52]C) -> 13385 | N191: =SUM(R[-139]C,R[-138]C,R[-101]C,R[-90]C,R[-84]C,R[-77]C,R[-74]C,R[-66]C,R[-65]C,R[-62]C)+SUM(R[-61]C,R[-55]C,R[-54]C,R[-52]C) -> 124260 | O191: =SUM(R[-139]C,R[-138]C,R[-101]C,R[-90]C,R[-84]C,R[-77]C,R[-74]C,R[-66]C,R[-65]C,R[-62]C)+SUM(R[-61]C,R[-55]C,R[-54]C,R[-52]C) -> 40109 | P191: =SUM(R[-139]C,R[-138]C,R[-101]C,R[-90]C,R[-84]C,R[-77]C,R[-74]C,R[-66]C,R[-65]C,R[-62]C)+SUM(R[-61]C,R[-55]C,R[-54]C,R[-52]C) -> 79505 | Q191: =SUM(R[-139]C,R[-138]C,R[-101]C,R[-90]C,R[-84]C,R[-77]C,R[-74]C,R[-66]C,R[-65]C,R[-62]C)+SUM(R[-61]C,R[-55]C,R[-54]C,R[-52]C) -> 30165 | R191: =SUM(R[-139]C,R[-138]C,R[-101]C,R[-90]C,R[-84]C,R[-77]C,R[-74]C,R[-66]C,R[-65]C,R[-62]C)+SUM(R[-61]C,R[-55]C,R[-54]C,R[-52]C) -> 69001 | S191: =SUM(R[-139]C,R[-138]C,R[-101]C,R[-90]C,R[-84]C,R[-77]C,R[-74]C,R[-66]C,R[-65]C,R[-62]C)+SUM(R[-61]C,R[-55]C,R[-54]C,R[-52]C) -> 29675 | T191: =SUM(R[-139]C,R[-138]C,R[-101]C,R[-90]C,R[-84]C,R[-77]C,R[-74]C,R[-66]C,R[-65]C,R[-62]C)+SUM(R[-61]C,R[-55]C,R[-54]C,R[-52]C) -> 9506 | U191: =SUM(R[-139]C,R[-138]C,R[-101]C,R[-90]C,R[-84]C,R[-77]C,R[-74]C,R[-66]C,R[-65]C,R[-62]C)+SUM(R[-61]C,R[-55]C,R[-54]C,R[-52]C) -> 4756 | V191: =SUM(R[-139]C,R[-138]C,R[-101]C,R[-90]C,R[-84]C,R[-77]C,R[-74]C,R[-66]C,R[-65]C,R[-62]C)+SUM(R[-61]C,R[-55]C,R[-54]C,R[-52]C) -> 502113 | W191: =SUM(R[-139]C,R[-138]C,R[-101]C,R[-90]C,R[-84]C,R[-77]C,R[-74]C,R[-66]C,R[-65]C,R[-62]C)+SUM(R[-61]C,R[-55]C,R[-54]C,R[-52]C) -> 3228 | X191: =SUM(R[-139]C,R[-138]C,R[-101]C,R[-90]C,R[-84]C,R[-77]C,R[-74]C,R[-66]C,R[-65]C,R[-62]C)+SUM(R[-61]C,R[-55]C,R[-54]C,R[-52]C) -> 2025 | Y191: =SUM(R[-139]C,R[-138]C,R[-101]C,R[-90]C,R[-84]C,R[-77]C,R[-74]C,R[-66]C,R[-65]C,R[-62]C)+SUM(R[-61]C,R[-55]C,R[-54]C,R[-52]C) -> 5259 | Z191: =SUM(R[-139]C,R[-138]C,R[-101]C,R[-90]C,R[-84]C,R[-77]C,R[-74]C,R[-66]C,R[-65]C,R[-62]C)+SUM(R[-61]C,R[-55]C,R[-54]C,R[-52]C) -> 13112 | AA191: =SUM(R[-139]C,R[-138]C,R[-101]C,R[-90]C,R[-84]C,R[-77]C,R[-74]C,R[-66]C,R[-65]C,R[-62]C)+SUM(R[-61]C,R[-55]C,R[-54]C,R[-52]C) -> 10099 | AB191: =SUM(R[-139]C,R[-138]C,R[-101]C,R[-90]C,R[-84]C,R[-77]C,R[-74]C,R[-66]C,R[-65]C,R[-62]C)+SUM(R[-61]C,R[-55]C,R[-54]C,R[-52]C) -> 15812 | AC191: =SUM(R[-139]C,R[-138]C,R[-101]C,R[-90]C,R[-84]C,R[-77]C,R[-74]C,R[-66]C,R[-65]C,R[-62]C)+SUM(R[-61]C,R[-55]C,R[-54]C,R[-52]C) -> 15275 | AD191: =SUM(R[-139]C,R[-138]C,R[-101]C,R[-90]C,R[-84]C,R[-77]C,R[-74]C,R[-66]C,R[-65]C,R[-62]C)+SUM(R[-61]C,R[-55]C,R[-54]C,R[-52]C) -> 16086 | AE191: =SUM(R[-139]C,R[-138]C,R[-101]C,R[-90]C,R[-84]C,R[-77]C,R[-74]C,R[-66]C,R[-65]C,R[-62]C)+SUM(R[-61]C,R[-55]C,R[-54]C,R[-52]C) -> 138654 | AF191: =SUM(R[-139]C,R[-138]C,R[-101]C,R[-90]C,R[-84]C,R[-77]C,R[-74]C,R[-66]C,R[-65]C,R[-62]C)+SUM(R[-61]C,R[-55]C,R[-54]C,R[-52]C) -> 44607 | AG191: =SUM(R[-139]C,R[-138]C,R[-101]C,R[-90]C,R[-84]C,R[-77]C,R[-74]C,R[-66]C,R[-65]C,R[-62]C)+SUM(R[-61]C,R[-55]C,R[-54]C,R[-52]C) -> 87080 | AH191: =SUM(R[-139]C,R[-138]C,R[-101]C,R[-90]C,R[-84]C,R[-77]C,R[-74]C,R[-66]C,R[-65]C,R[-62]C)+SUM(R[-61]C,R[-55]C,R[-54]C,R[-52]C) -> 35009 | AI191: =SUM(R[-139]C,R[-138]C,R[-101]C,R[-90]C,R[-84]C,R[-77]C,R[-74]C,R[-66]C,R[-65]C,R[-62]C)+SUM(R[-61]C,R[-55]C,R[-54]C,R[-52]C) -> 78886 | AJ191: =SUM(R[-139]C,R[-138]C,R[-101]C,R[-90]C,R[-84]C,R[-77]C,R[-74]C,R[-66]C,R[-65]C,R[-62]C)+SUM(R[-61]C,R[-55]C,R[-54]C,R[-52]C) -> 28772 | AK191: =SUM(R[-139]C,R[-138]C,R[-101]C,R[-90]C,R[-84]C,R[-77]C,R[-74]C,R[-66]C,R[-65]C,R[-62]C)+SUM(R[-61]C,R[-55]C,R[-54]C,R[-52]C) -> 5964 | AL191: =SUM(R[-139]C,R[-138]C,R[-101]C,R[-90]C,R[-84]C,R[-77]C,R[-74]C,R[-66]C,R[-65]C,R[-62]C)+SUM(R[-61]C,R[-55]C,R[-54]C,R[-52]C) -> 2245
B193: Virginia | D193: =SUM(R[-186]C:R[-53]C) -> 4666574 | E193: =SUM(R[-186]C:R[-53]C) -> 2230442 | F193: =SUM(R[-186]C:R[-53]C) -> 24920 | G193: =SUM(R[-186]C:R[-53]C) -> 17323 | H193: =SUM(R[-186]C:R[-53]C) -> 42649 | I193: =SUM(R[-186]C:R[-53]C) -> 87336 | J193: =SUM(R[-186]C:R[-53]C) -> 54831 | K193: =SUM(R[-186]C:R[-53]C) -> 72524 | L193: =SUM(R[-186]C:R[-53]C) -> 65136 | M193: =SUM(R[-186]C:R[-53]C) -> 64397 | N193: =SUM(R[-186]C:R[-53]C) -> 557039 | O193: =SUM(R[-186]C:R[-53]C) -> 140462 | P193: =SUM(R[-186]C:R[-53]C) -> 287930 | Q193: =SUM(R[-186]C:R[-53]C) -> 112269 | R193: =SUM(R[-186]C:R[-53]C) -> 398945 | S193: =SUM(R[-186]C:R[-53]C) -> 198229 | T193: =SUM(R[-186]C:R[-53]C) -> 65651 | U193: =SUM(R[-186]C:R[-53]C) -> 40801 | V193: =SUM(R[-186]C:R[-53]C) -> 2436132 | W193: =SUM(R[-186]C:R[-53]C) -> 22784 | X193: =SUM(R[-186]C:R[-53]C) -> 14852 | Y193: =SUM(R[-186]C:R[-53]C) -> 36902 | Z193: =SUM(R[-186]C:R[-53]C) -> 91418 | AA193: =SUM(R[-186]C:R[-53]C) -> 55619 | AB193: =SUM(R[-186]C:R[-53]C) -> 77855 | AC193: =SUM(R[-186]C:R[-53]C) -> 69354 | AD193: =SUM(R[-186]C:R[-53]C) -> 66710 | AE193: =SUM(R[-186]C:R[-53]C) -> 655424 | AF193: =SUM(R[-186]C:R[-53]C) -> 181723 | AG193: =SUM(R[-186]C:R[-53]C) -> 341585 | AH193: =SUM(R[-186]C:R[-53]C) -> 150544 | AI193: =SUM(R[-186]C:R[-53]C) -> 436066 | AJ193: =SUM(R[-186]C:R[-53]C) -> 176625 | AK193: =SUM(R[-186]C:R[-53]C) -> 41049 | AL193: =SUM(R[-186]C:R[-53]C) -> 17622