Sheet: Calculations
B1: 'Calculation of GC rich regions and finding CpG islands
A2: 'HGPRT | B2: 'GC content | C2: 'GC sequence | D2: '%GC content | E2: 'CpG/50 bases
A3: 'G | B3: =IF(EQUAL(RC[-1], "G"), 1, IF(EQUAL(RC[-1], "C"), 1, 0)) -> 1 | C3: =IF(AND(EQUAL(RC[-2], "C"), EQUAL(R[+1]C[-2], "G"))=1, 1, 0) -> 0 | D3: =SUM(RC[-2]:R[+49]C[-2])*2 -> 36 | E3: =SUM(RC[-2]:R[+49]C[-2])*2 -> 2 | F3: =IF(AND(EQUAL(RC[-5], "G"), EQUAL(R[+1]C[-5], "A"), EQUAL(R[+2]C[-5], "T"), EQUAL(R[+3]C[-5], "C"))=1, 1, 0) -> 0
A4: 'C | B4: =IF(EQUAL(RC[-1], "G"), 1, IF(EQUAL(RC[-1], "C"), 1, 0)) -> 1 | C4: =IF(AND(EQUAL(RC[-2], "C"), EQUAL(R[+1]C[-2], "G"))=1, 1, 0) -> 0 | D4: =SUM(RC[-2]:R[+49]C[-2])*2 -> 34 | E4: =SUM(RC[-2]:R[+49]C[-2])*2 -> 2 | F4: =IF(AND(EQUAL(RC[-5], "G"), EQUAL(R[+1]C[-5], "A"), EQUAL(R[+2]C[-5], "T"), EQUAL(R[+3]C[-5], "C"))=1, 1, 0) -> 0
A5: 'C | B5: =IF(EQUAL(RC[-1], "G"), 1, IF(EQUAL(RC[-1], "C"), 1, 0)) -> 1 | C5: =IF(AND(EQUAL(RC[-2], "C"), EQUAL(R[+1]C[-2], "G"))=1, 1, 0) -> 0 | D5: =SUM(RC[-2]:R[+49]C[-2])*2 -> 32 | E5: =SUM(RC[-2]:R[+49]C[-2])*2 -> 2 | F5: =IF(AND(EQUAL(RC[-5], "G"), EQUAL(R[+1]C[-5], "A"), EQUAL(R[+2]C[-5], "T"), EQUAL(R[+3]C[-5], "C"))=1, 1, 0) -> 0
A6: 'A | B6: =IF(EQUAL(RC[-1], "G"), 1, IF(EQUAL(RC[-1], "C"), 1, 0)) -> 0 | C6: =IF(AND(EQUAL(RC[-2], "C"), EQUAL(R[+1]C[-2], "G"))=1, 1, 0) -> 0 | D6: =SUM(RC[-2]:R[+49]C[-2])*2 -> 30 | E6: =SUM(RC[-2]:R[+49]C[-2])*2 -> 2 | F6: =IF(AND(EQUAL(RC[-5], "G"), EQUAL(R[+1]C[-5], "A"), EQUAL(R[+2]C[-5], "T"), EQUAL(R[+3]C[-5], "C"))=1, 1, 0) -> 0
A7: 'C | B7: =IF(EQUAL(RC[-1], "G"), 1, IF(EQUAL(RC[-1], "C"), 1, 0)) -> 1 | C7: =IF(AND(EQUAL(RC[-2], "C"), EQUAL(R[+1]C[-2], "G"))=1, 1, 0) -> 0 | D7: =SUM(RC[-2]:R[+49]C[-2])*2 -> 30 | E7: =SUM(RC[-2]:R[+49]C[-2])*2 -> 2 | F7: =IF(AND(EQUAL(RC[-5], "G"), EQUAL(R[+1]C[-5], "A"), EQUAL(R[+2]C[-5], "T"), EQUAL(R[+3]C[-5], "C"))=1, 1, 0) -> 0
A8: 'A | B8: =IF(EQUAL(RC[-1], "G"), 1, IF(EQUAL(RC[-1], "C"), 1, 0)) -> 0 | C8: =IF(AND(EQUAL(RC[-2], "C"), EQUAL(R[+1]C[-2], "G"))=1, 1, 0) -> 0 | D8: =SUM(RC[-2]:R[+49]C[-2])*2 -> 28 | E8: =SUM(RC[-2]:R[+49]C[-2])*2 -> 2 | F8: =IF(AND(EQUAL(RC[-5], "G"), EQUAL(R[+1]C[-5], "A"), EQUAL(R[+2]C[-5], "T"), EQUAL(R[+3]C[-5], "C"))=1, 1, 0) -> 0
A9: 'C | B9: =IF(EQUAL(RC[-1], "G"), 1, IF(EQUAL(RC[-1], "C"), 1, 0)) -> 1 | C9: =IF(AND(EQUAL(RC[-2], "C"), EQUAL(R[+1]C[-2], "G"))=1, 1, 0) -> 1 | D9: =SUM(RC[-2]:R[+49]C[-2])*2 -> 28 | E9: =SUM(RC[-2]:R[+49]C[-2])*2 -> 2 | F9: =IF(AND(EQUAL(RC[-5], "G"), EQUAL(R[+1]C[-5], "A"), EQUAL(R[+2]C[-5], "T"), EQUAL(R[+3]C[-5], "C"))=1, 1, 0) -> 0
A10: 'G | B10: =IF(EQUAL(RC[-1], "G"), 1, IF(EQUAL(RC[-1], "C"), 1, 0)) -> 1 | C10: =IF(AND(EQUAL(RC[-2], "C"), EQUAL(R[+1]C[-2], "G"))=1, 1, 0) -> 0 | D10: =SUM(RC[-2]:R[+49]C[-2])*2 -> 26 | E10: =SUM(RC[-2]:R[+49]C[-2])*2 -> 0 | F10: =IF(AND(EQUAL(RC[-5], "G"), EQUAL(R[+1]C[-5], "A"), EQUAL(R[+2]C[-5], "T"), EQUAL(R[+3]C[-5], "C"))=1, 1, 0) -> 0
A11: 'A | B11: =IF(EQUAL(RC[-1], "G"), 1, IF(EQUAL(RC[-1], "C"), 1, 0)) -> 0 | C11: =IF(AND(EQUAL(RC[-2], "C"), EQUAL(R[+1]C[-2], "G"))=1, 1, 0) -> 0 | D11: =SUM(RC[-2]:R[+49]C[-2])*2 -> 26 | E11: =SUM(RC[-2]:R[+49]C[-2])*2 -> 0 | F11: =IF(AND(EQUAL(RC[-5], "G"), EQUAL(R[+1]C[-5], "A"), EQUAL(R[+2]C[-5], "T"), EQUAL(R[+3]C[-5], "C"))=1, 1, 0) -> 0
A12: 'G | B12: =IF(EQUAL(RC[-1], "G"), 1, IF(EQUAL(RC[-1], "C"), 1, 0)) -> 1 | C12: =IF(AND(EQUAL(RC[-2], "C"), EQUAL(R[+1]C[-2], "G"))=1, 1, 0) -> 0 | D12: =SUM(RC[-2]:R[+49]C[-2])*2 -> 28 | E12: =SUM(RC[-2]:R[+49]C[-2])*2 -> 0 | F12: =IF(AND(EQUAL(RC[-5], "G"), EQUAL(R[+1]C[-5], "A"), EQUAL(R[+2]C[-5], "T"), EQUAL(R[+3]C[-5], "C"))=1, 1, 0) -> 0
A13: 'G | B13: =IF(EQUAL(RC[-1], "G"), 1, IF(EQUAL(RC[-1], "C"), 1, 0)) -> 1 | C13: =IF(AND(EQUAL(RC[-2], "C"), EQUAL(R[+1]C[-2], "G"))=1, 1, 0) -> 0 | D13: =SUM(RC[-2]:R[+49]C[-2])*2 -> 26 | E13: =SUM(RC[-2]:R[+49]C[-2])*2 -> 0 | F13: =IF(AND(EQUAL(RC[-5], "G"), EQUAL(R[+1]C[-5], "A"), EQUAL(R[+2]C[-5], "T"), EQUAL(R[+3]C[-5], "C"))=1, 1, 0) -> 0
A14: 'C | B14: =IF(EQUAL(RC[-1], "G"), 1, IF(EQUAL(RC[-1], "C"), 1, 0)) -> 1 | C14: =IF(AND(EQUAL(RC[-2], "C"), EQUAL(R[+1]C[-2], "G"))=1, 1, 0) -> 0 | D14: =SUM(RC[-2]:R[+49]C[-2])*2 -> 24 | E14: =SUM(RC[-2]:R[+49]C[-2])*2 -> 0 | F14: =IF(AND(EQUAL(RC[-5], "G"), EQUAL(R[+1]C[-5], "A"), EQUAL(R[+2]C[-5], "T"), EQUAL(R[+3]C[-5], "C"))=1, 1, 0) -> 0
A15: 'T | B15: =IF(EQUAL(RC[-1], "G"), 1, IF(EQUAL(RC[-1], "C"), 1, 0)) -> 0 | C15: =IF(AND(EQUAL(RC[-2], "C"), EQUAL(R[+1]C[-2], "G"))=1, 1, 0) -> 0 | D15: =SUM(RC[-2]:R[+49]C[-2])*2 -> 22 | E15: =SUM(RC[-2]:R[+49]C[-2])*2 -> 0 | F15: =IF(AND(EQUAL(RC[-5], "G"), EQUAL(R[+1]C[-5], "A"), EQUAL(R[+2]C[-5], "T"), EQUAL(R[+3]C[-5], "C"))=1, 1, 0) -> 0
A16: 'A | B16: =IF(EQUAL(RC[-1], "G"), 1, IF(EQUAL(RC[-1], "C"), 1, 0)) -> 0 | C16: =IF(AND(EQUAL(RC[-2], "C"), EQUAL(R[+1]C[-2], "G"))=1, 1, 0) -> 0 | D16: =SUM(RC[-2]:R[+49]C[-2])*2 -> 24 | E16: =SUM(RC[-2]:R[+49]C[-2])*2 -> 0 | F16: =IF(AND(EQUAL(RC[-5], "G"), EQUAL(R[+1]C[-5], "A"), EQUAL(R[+2]C[-5], "T"), EQUAL(R[+3]C[-5], "C"))=1, 1, 0) -> 0
A17: 'A | B17: =IF(EQUAL(RC[-1], "G"), 1, IF(EQUAL(RC[-1], "C"), 1, 0)) -> 0 | C17: =IF(AND(EQUAL(RC[-2], "C"), EQUAL(R[+1]C[-2], "G"))=1, 1, 0) -> 0 | D17: =SUM(RC[-2]:R[+49]C[-2])*2 -> 24 | E17: =SUM(RC[-2]:R[+49]C[-2])*2 -> 0 | F17: =IF(AND(EQUAL(RC[-5], "G"), EQUAL(R[+1]C[-5], "A"), EQUAL(R[+2]C[-5], "T"), EQUAL(R[+3]C[-5], "C"))=1, 1, 0) -> 0
A18: 'A | B18: =IF(EQUAL(RC[-1], "G"), 1, IF(EQUAL(RC[-1], "C"), 1, 0)) -> 0 | C18: =IF(AND(EQUAL(RC[-2], "C"), EQUAL(R[+1]C[-2], "G"))=1, 1, 0) -> 0 | D18: =SUM(RC[-2]:R[+49]C[-2])*2 -> 24 | E18: =SUM(RC[-2]:R[+49]C[-2])*2 -> 0 | F18: =IF(AND(EQUAL(RC[-5], "G"), EQUAL(R[+1]C[-5], "A"), EQUAL(R[+2]C[-5], "T"), EQUAL(R[+3]C[-5], "C"))=1, 1, 0) -> 0
A19: 'A | B19: =IF(EQUAL(RC[-1], "G"), 1, IF(EQUAL(RC[-1], "C"), 1, 0)) -> 0 | C19: =IF(AND(EQUAL(RC[-2], "C"), EQUAL(R[+1]C[-2], "G"))=1, 1, 0) -> 0 | D19: =SUM(RC[-2]:R[+49]C[-2])*2 -> 24 | E19: =SUM(RC[-2]:R[+49]C[-2])*2 -> 0 | F19: =IF(AND(EQUAL(RC[-5], "G"), EQUAL(R[+1]C[-5], "A"), EQUAL(R[+2]C[-5], "T"), EQUAL(R[+3]C[-5], "C"))=1, 1, 0) -> 0
A20: 'T | B20: =IF(EQUAL(RC[-1], "G"), 1, IF(EQUAL(RC[-1], "C"), 1, 0)) -> 0 | C20: =IF(AND(EQUAL(RC[-2], "C"), EQUAL(R[+1]C[-2], "G"))=1, 1, 0) -> 0 | D20: =SUM(RC[-2]:R[+49]C[-2])*2 -> 24 | E20: =SUM(RC[-2]:R[+49]C[-2])*2 -> 0 | F20: =IF(AND(EQUAL(RC[-5], "G"), EQUAL(R[+1]C[-5], "A"), EQUAL(R[+2]C[-5], "T"), EQUAL(R[+3]C[-5], "C"))=1, 1, 0) -> 0
A21: 'C | B21: =IF(EQUAL(RC[-1], "G"), 1, IF(EQUAL(RC[-1], "C"), 1, 0)) -> 1 | C21: =IF(AND(EQUAL(RC[-2], "C"), EQUAL(R[+1]C[-2], "G"))=1, 1, 0) -> 0 | D21: =SUM(RC[-2]:R[+49]C[-2])*2 -> 26 | E21: =SUM(RC[-2]:R[+49]C[-2])*2 -> 0 | F21: =IF(AND(EQUAL(RC[-5], "G"), EQUAL(R[+1]C[-5], "A"), EQUAL(R[+2]C[-5], "T"), EQUAL(R[+3]C[-5], "C"))=1, 1, 0) -> 0
A22: 'A | B22: =IF(EQUAL(RC[-1], "G"), 1, IF(EQUAL(RC[-1], "C"), 1, 0)) -> 0 | C22: =IF(AND(EQUAL(RC[-2], "C"), EQUAL(R[+1]C[-2], "G"))=1, 1, 0) -> 0 | D22: =SUM(RC[-2]:R[+49]C[-2])*2 -> 24 | E22: =SUM(RC[-2]:R[+49]C[-2])*2 -> 0 | F22: =IF(AND(EQUAL(RC[-5], "G"), EQUAL(R[+1]C[-5], "A"), EQUAL(R[+2]C[-5], "T"), EQUAL(R[+3]C[-5], "C"))=1, 1, 0) -> 0
A23: 'A | B23: =IF(EQUAL(RC[-1], "G"), 1, IF(EQUAL(RC[-1], "C"), 1, 0)) -> 0 | C23: =IF(AND(EQUAL(RC[-2], "C"), EQUAL(R[+1]C[-2], "G"))=1, 1, 0) -> 0 | D23: =SUM(RC[-2]:R[+49]C[-2])*2 -> 24 | E23: =SUM(RC[-2]:R[+49]C[-2])*2 -> 0 | F23: =IF(AND(EQUAL(RC[-5], "G"), EQUAL(R[+1]C[-5], "A"), EQUAL(R[+2]C[-5], "T"), EQUAL(R[+3]C[-5], "C"))=1, 1, 0) -> 0
A24: 'C | B24: =IF(EQUAL(RC[-1], "G"), 1, IF(EQUAL(RC[-1], "C"), 1, 0)) -> 1 | C24: =IF(AND(EQUAL(RC[-2], "C"), EQUAL(R[+1]C[-2], "G"))=1, 1, 0) -> 0 | D24: =SUM(RC[-2]:R[+49]C[-2])*2 -> 24 | E24: =SUM(RC[-2]:R[+49]C[-2])*2 -> 0 | F24: =IF(AND(EQUAL(RC[-5], "G"), EQUAL(R[+1]C[-5], "A"), EQUAL(R[+2]C[-5], "T"), EQUAL(R[+3]C[-5], "C"))=1, 1, 0) -> 0
A25: 'A | B25: =IF(EQUAL(RC[-1], "G"), 1, IF(EQUAL(RC[-1], "C"), 1, 0)) -> 0 | C25: =IF(AND(EQUAL(RC[-2], "C"), EQUAL(R[+1]C[-2], "G"))=1, 1, 0) -> 0 | D25: =SUM(RC[-2]:R[+49]C[-2])*2 -> 24 | E25: =SUM(RC[-2]:R[+49]C[-2])*2 -> 0 | F25: =IF(AND(EQUAL(RC[-5], "G"), EQUAL(R[+1]C[-5], "A"), EQUAL(R[+2]C[-5], "T"), EQUAL(R[+3]C[-5], "C"))=1, 1, 0) -> 0
A26: 'T | B26: =IF(EQUAL(RC[-1], "G"), 1, IF(EQUAL(RC[-1], "C"), 1, 0)) -> 0 | C26: =IF(AND(EQUAL(RC[-2], "C"), EQUAL(R[+1]C[-2], "G"))=1, 1, 0) -> 0 | D26: =SUM(RC[-2]:R[+49]C[-2])*2 -> 24 | E26: =SUM(RC[-2]:R[+49]C[-2])*2 -> 0 | F26: =IF(AND(EQUAL(RC[-5], "G"), EQUAL(R[+1]C[-5], "A"), EQUAL(R[+2]C[-5], "T"), EQUAL(R[+3]C[-5], "C"))=1, 1, 0) -> 0
A27: 'C | B27: =IF(EQUAL(RC[-1], "G"), 1, IF(EQUAL(RC[-1], "C"), 1, 0)) -> 1 | C27: =IF(AND(EQUAL(RC[-2], "C"), EQUAL(R[+1]C[-2], "G"))=1, 1, 0) -> 0 | D27: =SUM(RC[-2]:R[+49]C[-2])*2 -> 26 | E27: =SUM(RC[-2]:R[+49]C[-2])*2 -> 0 | F27: =IF(AND(EQUAL(RC[-5], "G"), EQUAL(R[+1]C[-5], "A"), EQUAL(R[+2]C[-5], "T"), EQUAL(R[+3]C[-5], "C"))=1, 1, 0) -> 0
A28: 'T | B28: =IF(EQUAL(RC[-1], "G"), 1, IF(EQUAL(RC[-1], "C"), 1, 0)) -> 0 | C28: =IF(AND(EQUAL(RC[-2], "C"), EQUAL(R[+1]C[-2], "G"))=1, 1, 0) -> 0 | D28: =SUM(RC[-2]:R[+49]C[-2])*2 -> 24 | E28: =SUM(RC[-2]:R[+49]C[-2])*2 -> 0 | F28: =IF(AND(EQUAL(RC[-5], "G"), EQUAL(R[+1]C[-5], "A"), EQUAL(R[+2]C[-5], "T"), EQUAL(R[+3]C[-5], "C"))=1, 1, 0) -> 0
A29: 'A | B29: =IF(EQUAL(RC[-1], "G"), 1, IF(EQUAL(RC[-1], "C"), 1, 0)) -> 0 | C29: =IF(AND(EQUAL(RC[-2], "C"), EQUAL(R[+1]C[-2], "G"))=1, 1, 0) -> 0 | D29: =SUM(RC[-2]:R[+49]C[-2])*2 -> 24 | E29: =SUM(RC[-2]:R[+49]C[-2])*2 -> 0 | F29: =IF(AND(EQUAL(RC[-5], "G"), EQUAL(R[+1]C[-5], "A"), EQUAL(R[+2]C[-5], "T"), EQUAL(R[+3]C[-5], "C"))=1, 1, 0) -> 0
A30: 'A | B30: =IF(EQUAL(RC[-1], "G"), 1, IF(EQUAL(RC[-1], "C"), 1, 0)) -> 0 | C30: =IF(AND(EQUAL(RC[-2], "C"), EQUAL(R[+1]C[-2], "G"))=1, 1, 0) -> 0 | D30: =SUM(RC[-2]:R[+49]C[-2])*2 -> 24 | E30: =SUM(RC[-2]:R[+49]C[-2])*2 -> 0 | F30: =IF(AND(EQUAL(RC[-5], "G"), EQUAL(R[+1]C[-5], "A"), EQUAL(R[+2]C[-5], "T"), EQUAL(R[+3]C[-5], "C"))=1, 1, 0) -> 0
A31: 'G | B31: =IF(EQUAL(RC[-1], "G"), 1, IF(EQUAL(RC[-1], "C"), 1, 0)) -> 1 | C31: =IF(AND(EQUAL(RC[-2], "C"), EQUAL(R[+1]C[-2], "G"))=1, 1, 0) -> 0 | D31: =SUM(RC[-2]:R[+49]C[-2])*2 -> 26 | E31: =SUM(RC[-2]:R[+49]C[-2])*2 -> 0 | F31: =IF(AND(EQUAL(RC[-5], "G"), EQUAL(R[+1]C[-5], "A"), EQUAL(R[+2]C[-5], "T"), EQUAL(R[+3]C[-5], "C"))=1, 1, 0) -> 0
A32: 'A | B32: =IF(EQUAL(RC[-1], "G"), 1, IF(EQUAL(RC[-1], "C"), 1, 0)) -> 0 | C32: =IF(AND(EQUAL(RC[-2], "C"), EQUAL(R[+1]C[-2], "G"))=1, 1, 0) -> 0 | D32: =SUM(RC[-2]:R[+49]C[-2])*2 -> 24 | E32: =SUM(RC[-2]:R[+49]C[-2])*2 -> 0 | F32: =IF(AND(EQUAL(RC[-5], "G"), EQUAL(R[+1]C[-5], "A"), EQUAL(R[+2]C[-5], "T"), EQUAL(R[+3]C[-5], "C"))=1, 1, 0) -> 0
A33: 'A | B33: =IF(EQUAL(RC[-1], "G"), 1, IF(EQUAL(RC[-1], "C"), 1, 0)) -> 0 | C33: =IF(AND(EQUAL(RC[-2], "C"), EQUAL(R[+1]C[-2], "G"))=1, 1, 0) -> 0 | D33: =SUM(RC[-2]:R[+49]C[-2])*2 -> 26 | E33: =SUM(RC[-2]:R[+49]C[-2])*2 -> 0 | F33: =IF(AND(EQUAL(RC[-5], "G"), EQUAL(R[+1]C[-5], "A"), EQUAL(R[+2]C[-5], "T"), EQUAL(R[+3]C[-5], "C"))=1, 1, 0) -> 0
A34: 'A | B34: =IF(EQUAL(RC[-1], "G"), 1, IF(EQUAL(RC[-1], "C"), 1, 0)) -> 0 | C34: =IF(AND(EQUAL(RC[-2], "C"), EQUAL(R[+1]C[-2], "G"))=1, 1, 0) -> 0 | D34: =SUM(RC[-2]:R[+49]C[-2])*2 -> 28 | E34: =SUM(RC[-2]:R[+49]C[-2])*2 -> 0 | F34: =IF(AND(EQUAL(RC[-5], "G"), EQUAL(R[+1]C[-5], "A"), EQUAL(R[+2]C[-5], "T"), EQUAL(R[+3]C[-5], "C"))=1, 1, 0) -> 0
A35: 'T | B35: =IF(EQUAL(RC[-1], "G"), 1, IF(EQUAL(RC[-1], "C"), 1, 0)) -> 0 | C35: =IF(AND(EQUAL(RC[-2], "C"), EQUAL(R[+1]C[-2], "G"))=1, 1, 0) -> 0 | D35: =SUM(RC[-2]:R[+49]C[-2])*2 -> 28 | E35: =SUM(RC[-2]:R[+49]C[-2])*2 -> 0 | F35: =IF(AND(EQUAL(RC[-5], "G"), EQUAL(R[+1]C[-5], "A"), EQUAL(R[+2]C[-5], "T"), EQUAL(R[+3]C[-5], "C"))=1, 1, 0) -> 0
A36: 'G | B36: =IF(EQUAL(RC[-1], "G"), 1, IF(EQUAL(RC[-1], "C"), 1, 0)) -> 1 | C36: =IF(AND(EQUAL(RC[-2], "C"), EQUAL(R[+1]C[-2], "G"))=1, 1, 0) -> 0 | D36: =SUM(RC[-2]:R[+49]C[-2])*2 -> 28 | E36: =SUM(RC[-2]:R[+49]C[-2])*2 -> 0 | F36: =IF(AND(EQUAL(RC[-5], "G"), EQUAL(R[+1]C[-5], "A"), EQUAL(R[+2]C[-5], "T"), EQUAL(R[+3]C[-5], "C"))=1, 1, 0) -> 0
A37: 'A | B37: =IF(EQUAL(RC[-1], "G"), 1, IF(EQUAL(RC[-1], "C"), 1, 0)) -> 0 | C37: =IF(AND(EQUAL(RC[-2], "C"), EQUAL(R[+1]C[-2], "G"))=1, 1, 0) -> 0 | D37: =SUM(RC[-2]:R[+49]C[-2])*2 -> 26 | E37: =SUM(RC[-2]:R[+49]C[-2])*2 -> 0 | F37: =IF(AND(EQUAL(RC[-5], "G"), EQUAL(R[+1]C[-5], "A"), EQUAL(R[+2]C[-5], "T"), EQUAL(R[+3]C[-5], "C"))=1, 1, 0) -> 0
A38: 'C | B38: =IF(EQUAL(RC[-1], "G"), 1, IF(EQUAL(RC[-1], "C"), 1, 0)) -> 1 | C38: =IF(AND(EQUAL(RC[-2], "C"), EQUAL(R[+1]C[-2], "G"))=1, 1, 0) -> 0 | D38: =SUM(RC[-2]:R[+49]C[-2])*2 -> 26 | E38: =SUM(RC[-2]:R[+49]C[-2])*2 -> 0 | F38: =IF(AND(EQUAL(RC[-5], "G"), EQUAL(R[+1]C[-5], "A"), EQUAL(R[+2]C[-5], "T"), EQUAL(R[+3]C[-5], "C"))=1, 1, 0) -> 0
A39: 'A | B39: =IF(EQUAL(RC[-1], "G"), 1, IF(EQUAL(RC[-1], "C"), 1, 0)) -> 0 | C39: =IF(AND(EQUAL(RC[-2], "C"), EQUAL(R[+1]C[-2], "G"))=1, 1, 0) -> 0 | D39: =SUM(RC[-2]:R[+49]C[-2])*2 -> 26 | E39: =SUM(RC[-2]:R[+49]C[-2])*2 -> 0 | F39: =IF(AND(EQUAL(RC[-5], "G"), EQUAL(R[+1]C[-5], "A"), EQUAL(R[+2]C[-5], "T"), EQUAL(R[+3]C[-5], "C"))=1, 1, 0) -> 0
A40: 'T | B40: =IF(EQUAL(RC[-1], "G"), 1, IF(EQUAL(RC[-1], "C"), 1, 0)) -> 0 | C40: =IF(AND(EQUAL(RC[-2], "C"), EQUAL(R[+1]C[-2], "G"))=1, 1, 0) -> 0 | D40: =SUM(RC[-2]:R[+49]C[-2])*2 -> 26 | E40: =SUM(RC[-2]:R[+49]C[-2])*2 -> 0 | F40: =IF(AND(EQUAL(RC[-5], "G"), EQUAL(R[+1]C[-5], "A"), EQUAL(R[+2]C[-5], "T"), EQUAL(R[+3]C[-5], "C"))=1, 1, 0) -> 0
A41: 'C | B41: =IF(EQUAL(RC[-1], "G"), 1, IF(EQUAL(RC[-1], "C"), 1, 0)) -> 1 | C41: =IF(AND(EQUAL(RC[-2], "C"), EQUAL(R[+1]C[-2], "G"))=1, 1, 0) -> 0 | D41: =SUM(RC[-2]:R[+49]C[-2])*2 -> 26 | E41: =SUM(RC[-2]:R[+49]C[-2])*2 -> 0 | F41: =IF(AND(EQUAL(RC[-5], "G"), EQUAL(R[+1]C[-5], "A"), EQUAL(R[+2]C[-5], "T"), EQUAL(R[+3]C[-5], "C"))=1, 1, 0) -> 0
A42: 'T | B42: =IF(EQUAL(RC[-1], "G"), 1, IF(EQUAL(RC[-1], "C"), 1, 0)) -> 0 | C42: =IF(AND(EQUAL(RC[-2], "C"), EQUAL(R[+1]C[-2], "G"))=1, 1, 0) -> 0 | D42: =SUM(RC[-2]:R[+49]C[-2])*2 -> 24 | E42: =SUM(RC[-2]:R[+49]C[-2])*2 -> 0 | F42: =IF(AND(EQUAL(RC[-5], "G"), EQUAL(R[+1]C[-5], "A"), EQUAL(R[+2]C[-5], "T"), EQUAL(R[+3]C[-5], "C"))=1, 1, 0) -> 0
A43: 'T | B43: =IF(EQUAL(RC[-1], "G"), 1, IF(EQUAL(RC[-1], "C"), 1, 0)) -> 0 | C43: =IF(AND(EQUAL(RC[-2], "C"), EQUAL(R[+1]C[-2], "G"))=1, 1, 0) -> 0 | D43: =SUM(RC[-2]:R[+49]C[-2])*2 -> 26 | E43: =SUM(RC[-2]:R[+49]C[-2])*2 -> 0 | F43: =IF(AND(EQUAL(RC[-5], "G"), EQUAL(R[+1]C[-5], "A"), EQUAL(R[+2]C[-5], "T"), EQUAL(R[+3]C[-5], "C"))=1, 1, 0) -> 0
A44: 'A | B44: =IF(EQUAL(RC[-1], "G"), 1, IF(EQUAL(RC[-1], "C"), 1, 0)) -> 0 | C44: =IF(AND(EQUAL(RC[-2], "C"), EQUAL(R[+1]C[-2], "G"))=1, 1, 0) -> 0 | D44: =SUM(RC[-2]:R[+49]C[-2])*2 -> 26 | E44: =SUM(RC[-2]:R[+49]C[-2])*2 -> 0 | F44: =IF(AND(EQUAL(RC[-5], "G"), EQUAL(R[+1]C[-5], "A"), EQUAL(R[+2]C[-5], "T"), EQUAL(R[+3]C[-5], "C"))=1, 1, 0) -> 0
A45: 'T | B45: =IF(EQUAL(RC[-1], "G"), 1, IF(EQUAL(RC[-1], "C"), 1, 0)) -> 0 | C45: =IF(AND(EQUAL(RC[-2], "C"), EQUAL(R[+1]C[-2], "G"))=1, 1, 0) -> 0 | D45: =SUM(RC[-2]:R[+49]C[-2])*2 -> 28 | E45: =SUM(RC[-2]:R[+49]C[-2])*2 -> 0 | F45: =IF(AND(EQUAL(RC[-5], "G"), EQUAL(R[+1]C[-5], "A"), EQUAL(R[+2]C[-5], "T"), EQUAL(R[+3]C[-5], "C"))=1, 1, 0) -> 0
A46: 'T | B46: =IF(EQUAL(RC[-1], "G"), 1, IF(EQUAL(RC[-1], "C"), 1, 0)) -> 0 | C46: =IF(AND(EQUAL(RC[-2], "C"), EQUAL(R[+1]C[-2], "G"))=1, 1, 0) -> 0 | D46: =SUM(RC[-2]:R[+49]C[-2])*2 -> 28 | E46: =SUM(RC[-2]:R[+49]C[-2])*2 -> 0 | F46: =IF(AND(EQUAL(RC[-5], "G"), EQUAL(R[+1]C[-5], "A"), EQUAL(R[+2]C[-5], "T"), EQUAL(R[+3]C[-5], "C"))=1, 1, 0) -> 0
A47: 'T | B47: =IF(EQUAL(RC[-1], "G"), 1, IF(EQUAL(RC[-1], "C"), 1, 0)) -> 0 | C47: =IF(AND(EQUAL(RC[-2], "C"), EQUAL(R[+1]C[-2], "G"))=1, 1, 0) -> 0 | D47: =SUM(RC[-2]:R[+49]C[-2])*2 -> 30 | E47: =SUM(RC[-2]:R[+49]C[-2])*2 -> 0 | F47: =IF(AND(EQUAL(RC[-5], "G"), EQUAL(R[+1]C[-5], "A"), EQUAL(R[+2]C[-5], "T"), EQUAL(R[+3]C[-5], "C"))=1, 1, 0) -> 0
A48: 'G | B48: =IF(EQUAL(RC[-1], "G"), 1, IF(EQUAL(RC[-1], "C"), 1, 0)) -> 1 | C48: =IF(AND(EQUAL(RC[-2], "C"), EQUAL(R[+1]C[-2], "G"))=1, 1, 0) -> 0 | D48: =SUM(RC[-2]:R[+49]C[-2])*2 -> 30 | E48: =SUM(RC[-2]:R[+49]C[-2])*2 -> 0 | F48: =IF(AND(EQUAL(RC[-5], "G"), EQUAL(R[+1]C[-5], "A"), EQUAL(R[+2]C[-5], "T"), EQUAL(R[+3]C[-5], "C"))=1, 1, 0) -> 0
A49: 'G | B49: =IF(EQUAL(RC[-1], "G"), 1, IF(EQUAL(RC[-1], "C"), 1, 0)) -> 1 | C49: =IF(AND(EQUAL(RC[-2], "C"), EQUAL(R[+1]C[-2], "G"))=1, 1, 0) -> 0 | D49: =SUM(RC[-2]:R[+49]C[-2])*2 -> 30 | E49: =SUM(RC[-2]:R[+49]C[-2])*2 -> 0 | F49: =IF(AND(EQUAL(RC[-5], "G"), EQUAL(R[+1]C[-5], "A"), EQUAL(R[+2]C[-5], "T"), EQUAL(R[+3]C[-5], "C"))=1, 1, 0) -> 0
A50: 'T | B50: =IF(EQUAL(RC[-1], "G"), 1, IF(EQUAL(RC[-1], "C"), 1, 0)) -> 0 | C50: =IF(AND(EQUAL(RC[-2], "C"), EQUAL(R[+1]C[-2], "G"))=1, 1, 0) -> 0 | D50: =SUM(RC[-2]:R[+49]C[-2])*2 -> 28 | E50: =SUM(RC[-2]:R[+49]C[-2])*2 -> 0 | F50: =IF(AND(EQUAL(RC[-5], "G"), EQUAL(R[+1]C[-5], "A"), EQUAL(R[+2]C[-5], "T"), EQUAL(R[+3]C[-5], "C"))=1, 1, 0) -> 0
A51: 'A | B51: =IF(EQUAL(RC[-1], "G"), 1, IF(EQUAL(RC[-1], "C"), 1, 0)) -> 0 | C51: =IF(AND(EQUAL(RC[-2], "C"), EQUAL(R[+1]C[-2], "G"))=1, 1, 0) -> 0 | D51: =SUM(RC[-2]:R[+49]C[-2])*2 -> 30 | E51: =SUM(RC[-2]:R[+49]C[-2])*2 -> 0 | F51: =IF(AND(EQUAL(RC[-5], "G"), EQUAL(R[+1]C[-5], "A"), EQUAL(R[+2]C[-5], "T"), EQUAL(R[+3]C[-5], "C"))=1, 1, 0) -> 0
A52: 'A | B52: =IF(EQUAL(RC[-1], "G"), 1, IF(EQUAL(RC[-1], "C"), 1, 0)) -> 0 | C52: =IF(AND(EQUAL(RC[-2], "C"), EQUAL(R[+1]C[-2], "G"))=1, 1, 0) -> 0 | D52: =SUM(RC[-2]:R[+49]C[-2])*2 -> 30 | E52: =SUM(RC[-2]:R[+49]C[-2])*2 -> 0 | F52: =IF(AND(EQUAL(RC[-5], "G"), EQUAL(R[+1]C[-5], "A"), EQUAL(R[+2]C[-5], "T"), EQUAL(R[+3]C[-5], "C"))=1, 1, 0) -> 0
A53: 'T | B53: =IF(EQUAL(RC[-1], "G"), 1, IF(EQUAL(RC[-1], "C"), 1, 0)) -> 0 | C53: =IF(AND(EQUAL(RC[-2], "C"), EQUAL(R[+1]C[-2], "G"))=1, 1, 0) -> 0 | D53: =SUM(RC[-2]:R[+49]C[-2])*2 -> 32 | E53: =SUM(RC[-2]:R[+49]C[-2])*2 -> 0 | F53: =IF(AND(EQUAL(RC[-5], "G"), EQUAL(R[+1]C[-5], "A"), EQUAL(R[+2]C[-5], "T"), EQUAL(R[+3]C[-5], "C"))=1, 1, 0) -> 0
A54: 'A | B54: =IF(EQUAL(RC[-1], "G"), 1, IF(EQUAL(RC[-1], "C"), 1, 0)) -> 0 | C54: =IF(AND(EQUAL(RC[-2], "C"), EQUAL(R[+1]C[-2], "G"))=1, 1, 0) -> 0 | D54: =SUM(RC[-2]:R[+49]C[-2])*2 -> 32 | E54: =SUM(RC[-2]:R[+49]C[-2])*2 -> 0 | F54: =IF(AND(EQUAL(RC[-5], "G"), EQUAL(R[+1]C[-5], "A"), EQUAL(R[+2]C[-5], "T"), EQUAL(R[+3]C[-5], "C"))=1, 1, 0) -> 0
A55: 'T | B55: =IF(EQUAL(RC[-1], "G"), 1, IF(EQUAL(RC[-1], "C"), 1, 0)) -> 0 | C55: =IF(AND(EQUAL(RC[-2], "C"), EQUAL(R[+1]C[-2], "G"))=1, 1, 0) -> 0 | D55: =SUM(RC[-2]:R[+49]C[-2])*2 -> 34 | E55: =SUM(RC[-2]:R[+49]C[-2])*2 -> 0 | F55: =IF(AND(EQUAL(RC[-5], "G"), EQUAL(R[+1]C[-5], "A"), EQUAL(R[+2]C[-5], "T"), EQUAL(R[+3]C[-5], "C"))=1, 1, 0) -> 0
A56: 'A | B56: =IF(EQUAL(RC[-1], "G"), 1, IF(EQUAL(RC[-1], "C"), 1, 0)) -> 0 | C56: =IF(AND(EQUAL(RC[-2], "C"), EQUAL(R[+1]C[-2], "G"))=1, 1, 0) -> 0 | D56: =SUM(RC[-2]:R[+49]C[-2])*2 -> 34 | E56: =SUM(RC[-2]:R[+49]C[-2])*2 -> 0 | F56: =IF(AND(EQUAL(RC[-5], "G"), EQUAL(R[+1]C[-5], "A"), EQUAL(R[+2]C[-5], "T"), EQUAL(R[+3]C[-5], "C"))=1, 1, 0) -> 0
A57: 'T | B57: =IF(EQUAL(RC[-1], "G"), 1, IF(EQUAL(RC[-1], "C"), 1, 0)) -> 0 | C57: =IF(AND(EQUAL(RC[-2], "C"), EQUAL(R[+1]C[-2], "G"))=1, 1, 0) -> 0 | D57: =SUM(RC[-2]:R[+49]C[-2])*2 -> 34 | E57: =SUM(RC[-2]:R[+49]C[-2])*2 -> 0 | F57: =IF(AND(EQUAL(RC[-5], "G"), EQUAL(R[+1]C[-5], "A"), EQUAL(R[+2]C[-5], "T"), EQUAL(R[+3]C[-5], "C"))=1, 1, 0) -> 0
A58: 'T | B58: =IF(EQUAL(RC[-1], "G"), 1, IF(EQUAL(RC[-1], "C"), 1, 0)) -> 0 | C58: =IF(AND(EQUAL(RC[-2], "C"), EQUAL(R[+1]C[-2], "G"))=1, 1, 0) -> 0 | D58: =SUM(RC[-2]:R[+49]C[-2])*2 -> 36 | E58: =SUM(RC[-2]:R[+49]C[-2])*2 -> 0 | F58: =IF(AND(EQUAL(RC[-5], "G"), EQUAL(R[+1]C[-5], "A"), EQUAL(R[+2]C[-5], "T"), EQUAL(R[+3]C[-5], "C"))=1, 1, 0) -> 0
A59: 'T | B59: =IF(EQUAL(RC[-1], "G"), 1, IF(EQUAL(RC[-1], "C"), 1, 0)) -> 0 | C59: =IF(AND(EQUAL(RC[-2], "C"), EQUAL(R[+1]C[-2], "G"))=1, 1, 0) -> 0 | D59: =SUM(RC[-2]:R[+49]C[-2])*2 -> 36 | E59: =SUM(RC[-2]:R[+49]C[-2])*2 -> 0 | F59: =IF(AND(EQUAL(RC[-5], "G"), EQUAL(R[+1]C[-5], "A"), EQUAL(R[+2]C[-5], "T"), EQUAL(R[+3]C[-5], "C"))=1, 1, 0) -> 0
A60: 'G | B60: =IF(EQUAL(RC[-1], "G"), 1, IF(EQUAL(RC[-1], "C"), 1, 0)) -> 1 | C60: =IF(AND(EQUAL(RC[-2], "C"), EQUAL(R[+1]C[-2], "G"))=1, 1, 0) -> 0 | D60: =SUM(RC[-2]:R[+49]C[-2])*2 -> 36 | E60: =SUM(RC[-2]:R[+49]C[-2])*2 -> 0 | F60: =IF(AND(EQUAL(RC[-5], "G"), EQUAL(R[+1]C[-5], "A"), EQUAL(R[+2]C[-5], "T"), EQUAL(R[+3]C[-5], "C"))=1, 1, 0) -> 0
A61: 'G | B61: =IF(EQUAL(RC[-1], "G"), 1, IF(EQUAL(RC[-1], "C"), 1, 0)) -> 1 | C61: =IF(AND(EQUAL(RC[-2], "C"), EQUAL(R[+1]C[-2], "G"))=1, 1, 0) -> 0 | D61: =SUM(RC[-2]:R[+49]C[-2])*2 -> 36 | E61: =SUM(RC[-2]:R[+49]C[-2])*2 -> 0 | F61: =IF(AND(EQUAL(RC[-5], "G"), EQUAL(R[+1]C[-5], "A"), EQUAL(R[+2]C[-5], "T"), EQUAL(R[+3]C[-5], "C"))=1, 1, 0) -> 0
A62: 'T | B62: =IF(EQUAL(RC[-1], "G"), 1, IF(EQUAL(RC[-1], "C"), 1, 0)) -> 0 | C62: =IF(AND(EQUAL(RC[-2], "C"), EQUAL(R[+1]C[-2], "G"))=1, 1, 0) -> 0 | D62: =SUM(RC[-2]:R[+49]C[-2])*2 -> 34 | E62: =SUM(RC[-2]:R[+49]C[-2])*2 -> 0 | F62: =IF(AND(EQUAL(RC[-5], "G"), EQUAL(R[+1]C[-5], "A"), EQUAL(R[+2]C[-5], "T"), EQUAL(R[+3]C[-5], "C"))=1, 1, 0) -> 0
A63: 'A | B63: =IF(EQUAL(RC[-1], "G"), 1, IF(EQUAL(RC[-1], "C"), 1, 0)) -> 0 | C63: =IF(AND(EQUAL(RC[-2], "C"), EQUAL(R[+1]C[-2], "G"))=1, 1, 0) -> 0 | D63: =SUM(RC[-2]:R[+49]C[-2])*2 -> 36 | E63: =SUM(RC[-2]:R[+49]C[-2])*2 -> 0 | F63: =IF(AND(EQUAL(RC[-5], "G"), EQUAL(R[+1]C[-5], "A"), EQUAL(R[+2]C[-5], "T"), EQUAL(R[+3]C[-5], "C"))=1, 1, 0) -> 0
A64: 'A | B64: =IF(EQUAL(RC[-1], "G"), 1, IF(EQUAL(RC[-1], "C"), 1, 0)) -> 0 | C64: =IF(AND(EQUAL(RC[-2], "C"), EQUAL(R[+1]C[-2], "G"))=1, 1, 0) -> 0 | D64: =SUM(RC[-2]:R[+49]C[-2])*2 -> 36 | E64: =SUM(RC[-2]:R[+49]C[-2])*2 -> 0 | F64: =IF(AND(EQUAL(RC[-5], "G"), EQUAL(R[+1]C[-5], "A"), EQUAL(R[+2]C[-5], "T"), EQUAL(R[+3]C[-5], "C"))=1, 1, 0) -> 0
A65: 'C | B65: =IF(EQUAL(RC[-1], "G"), 1, IF(EQUAL(RC[-1], "C"), 1, 0)) -> 1 | C65: =IF(AND(EQUAL(RC[-2], "C"), EQUAL(R[+1]C[-2], "G"))=1, 1, 0) -> 0 | D65: =SUM(RC[-2]:R[+49]C[-2])*2 -> 36 | E65: =SUM(RC[-2]:R[+49]C[-2])*2 -> 0 | F65: =IF(AND(EQUAL(RC[-5], "G"), EQUAL(R[+1]C[-5], "A"), EQUAL(R[+2]C[-5], "T"), EQUAL(R[+3]C[-5], "C"))=1, 1, 0) -> 0
A66: 'A | B66: =IF(EQUAL(RC[-1], "G"), 1, IF(EQUAL(RC[-1], "C"), 1, 0)) -> 0 | C66: =IF(AND(EQUAL(RC[-2], "C"), EQUAL(R[+1]C[-2], "G"))=1, 1, 0) -> 0 | D66: =SUM(RC[-2]:R[+49]C[-2])*2 -> 36 | E66: =SUM(RC[-2]:R[+49]C[-2])*2 -> 0 | F66: =IF(AND(EQUAL(RC[-5], "G"), EQUAL(R[+1]C[-5], "A"), EQUAL(R[+2]C[-5], "T"), EQUAL(R[+3]C[-5], "C"))=1, 1, 0) -> 0
A67: 'T | B67: =IF(EQUAL(RC[-1], "G"), 1, IF(EQUAL(RC[-1], "C"), 1, 0)) -> 0 | C67: =IF(AND(EQUAL(RC[-2], "C"), EQUAL(R[+1]C[-2], "G"))=1, 1, 0) -> 0 | D67: =SUM(RC[-2]:R[+49]C[-2])*2 -> 36 | E67: =SUM(RC[-2]:R[+49]C[-2])*2 -> 0 | F67: =IF(AND(EQUAL(RC[-5], "G"), EQUAL(R[+1]C[-5], "A"), EQUAL(R[+2]C[-5], "T"), EQUAL(R[+3]C[-5], "C"))=1, 1, 0) -> 0
A68: 'A | B68: =IF(EQUAL(RC[-1], "G"), 1, IF(EQUAL(RC[-1], "C"), 1, 0)) -> 0 | C68: =IF(AND(EQUAL(RC[-2], "C"), EQUAL(R[+1]C[-2], "G"))=1, 1, 0) -> 0 | D68: =SUM(RC[-2]:R[+49]C[-2])*2 -> 38 | E68: =SUM(RC[-2]:R[+49]C[-2])*2 -> 0 | F68: =IF(AND(EQUAL(RC[-5], "G"), EQUAL(R[+1]C[-5], "A"), EQUAL(R[+2]C[-5], "T"), EQUAL(R[+3]C[-5], "C"))=1, 1, 0) -> 0
A69: 'T | B69: =IF(EQUAL(RC[-1], "G"), 1, IF(EQUAL(RC[-1], "C"), 1, 0)) -> 0 | C69: =IF(AND(EQUAL(RC[-2], "C"), EQUAL(R[+1]C[-2], "G"))=1, 1, 0) -> 0 | D69: =SUM(RC[-2]:R[+49]C[-2])*2 -> 40 | E69: =SUM(RC[-2]:R[+49]C[-2])*2 -> 0 | F69: =IF(AND(EQUAL(RC[-5], "G"), EQUAL(R[+1]C[-5], "A"), EQUAL(R[+2]C[-5], "T"), EQUAL(R[+3]C[-5], "C"))=1, 1, 0) -> 0
A70: 'G | B70: =IF(EQUAL(RC[-1], "G"), 1, IF(EQUAL(RC[-1], "C"), 1, 0)) -> 1 | C70: =IF(AND(EQUAL(RC[-2], "C"), EQUAL(R[+1]C[-2], "G"))=1, 1, 0) -> 0 | D70: =SUM(RC[-2]:R[+49]C[-2])*2 -> 40 | E70: =SUM(RC[-2]:R[+49]C[-2])*2 -> 0 | F70: =IF(AND(EQUAL(RC[-5], "G"), EQUAL(R[+1]C[-5], "A"), EQUAL(R[+2]C[-5], "T"), EQUAL(R[+3]C[-5], "C"))=1, 1, 0) -> 0
A71: 'A | B71: =IF(EQUAL(RC[-1], "G"), 1, IF(EQUAL(RC[-1], "C"), 1, 0)) -> 0 | C71: =IF(AND(EQUAL(RC[-2], "C"), EQUAL(R[+1]C[-2], "G"))=1, 1, 0) -> 0 | D71: =SUM(RC[-2]:R[+49]C[-2])*2 -> 40 | E71: =SUM(RC[-2]:R[+49]C[-2])*2 -> 0 | F71: =IF(AND(EQUAL(RC[-5], "G"), EQUAL(R[+1]C[-5], "A"), EQUAL(R[+2]C[-5], "T"), EQUAL(R[+3]C[-5], "C"))=1, 1, 0) -> 0
A72: 'A | B72: =IF(EQUAL(RC[-1], "G"), 1, IF(EQUAL(RC[-1], "C"), 1, 0)) -> 0 | C72: =IF(AND(EQUAL(RC[-2], "C"), EQUAL(R[+1]C[-2], "G"))=1, 1, 0) -> 0 | D72: =SUM(RC[-2]:R[+49]C[-2])*2 -> 42 | E72: =SUM(RC[-2]:R[+49]C[-2])*2 -> 0 | F72: =IF(AND(EQUAL(RC[-5], "G"), EQUAL(R[+1]C[-5], "A"), EQUAL(R[+2]C[-5], "T"), EQUAL(R[+3]C[-5], "C"))=1, 1, 0) -> 0
A73: 'T | B73: =IF(EQUAL(RC[-1], "G"), 1, IF(EQUAL(RC[-1], "C"), 1, 0)) -> 0 | C73: =IF(AND(EQUAL(RC[-2], "C"), EQUAL(R[+1]C[-2], "G"))=1, 1, 0) -> 0 | D73: =SUM(RC[-2]:R[+49]C[-2])*2 -> 42 | E73: =SUM(RC[-2]:R[+49]C[-2])*2 -> 0 | F73: =IF(AND(EQUAL(RC[-5], "G"), EQUAL(R[+1]C[-5], "A"), EQUAL(R[+2]C[-5], "T"), EQUAL(R[+3]C[-5], "C"))=1, 1, 0) -> 0
A74: 'C | B74: =IF(EQUAL(RC[-1], "G"), 1, IF(EQUAL(RC[-1], "C"), 1, 0)) -> 1 | C74: =IF(AND(EQUAL(RC[-2], "C"), EQUAL(R[+1]C[-2], "G"))=1, 1, 0) -> 0 | D74: =SUM(RC[-2]:R[+49]C[-2])*2 -> 44 | E74: =SUM(RC[-2]:R[+49]C[-2])*2 -> 0 | F74: =IF(AND(EQUAL(RC[-5], "G"), EQUAL(R[+1]C[-5], "A"), EQUAL(R[+2]C[-5], "T"), EQUAL(R[+3]C[-5], "C"))=1, 1, 0) -> 0
A75: 'T | B75: =IF(EQUAL(RC[-1], "G"), 1, IF(EQUAL(RC[-1], "C"), 1, 0)) -> 0 | C75: =IF(AND(EQUAL(RC[-2], "C"), EQUAL(R[+1]C[-2], "G"))=1, 1, 0) -> 0 | D75: =SUM(RC[-2]:R[+49]C[-2])*2 -> 44 | E75: =SUM(RC[-2]:R[+49]C[-2])*2 -> 0 | F75: =IF(AND(EQUAL(RC[-5], "G"), EQUAL(R[+1]C[-5], "A"), EQUAL(R[+2]C[-5], "T"), EQUAL(R[+3]C[-5], "C"))=1, 1, 0) -> 0
A76: 'C | B76: =IF(EQUAL(RC[-1], "G"), 1, IF(EQUAL(RC[-1], "C"), 1, 0)) -> 1 | C76: =IF(AND(EQUAL(RC[-2], "C"), EQUAL(R[+1]C[-2], "G"))=1, 1, 0) -> 0 | D76: =SUM(RC[-2]:R[+49]C[-2])*2 -> 44 | E76: =SUM(RC[-2]:R[+49]C[-2])*2 -> 0 | F76: =IF(AND(EQUAL(RC[-5], "G"), EQUAL(R[+1]C[-5], "A"), EQUAL(R[+2]C[-5], "T"), EQUAL(R[+3]C[-5], "C"))=1, 1, 0) -> 0
A77: 'T | B77: =IF(EQUAL(RC[-1], "G"), 1, IF(EQUAL(RC[-1], "C"), 1, 0)) -> 0 | C77: =IF(AND(EQUAL(RC[-2], "C"), EQUAL(R[+1]C[-2], "G"))=1, 1, 0) -> 0 | D77: =SUM(RC[-2]:R[+49]C[-2])*2 -> 42 | E77: =SUM(RC[-2]:R[+49]C[-2])*2 -> 0 | F77: =IF(AND(EQUAL(RC[-5], "G"), EQUAL(R[+1]C[-5], "A"), EQUAL(R[+2]C[-5], "T"), EQUAL(R[+3]C[-5], "C"))=1, 1, 0) -> 0
A78: 'A | B78: =IF(EQUAL(RC[-1], "G"), 1, IF(EQUAL(RC[-1], "C"), 1, 0)) -> 0 | C78: =IF(AND(EQUAL(RC[-2], "C"), EQUAL(R[+1]C[-2], "G"))=1, 1, 0) -> 0 | D78: =SUM(RC[-2]:R[+49]C[-2])*2 -> 44 | E78: =SUM(RC[-2]:R[+49]C[-2])*2 -> 0 | F78: =IF(AND(EQUAL(RC[-5], "G"), EQUAL(R[+1]C[-5], "A"), EQUAL(R[+2]C[-5], "T"), EQUAL(R[+3]C[-5], "C"))=1, 1, 0) -> 0
A79: 'T | B79: =IF(EQUAL(RC[-1], "G"), 1, IF(EQUAL(RC[-1], "C"), 1, 0)) -> 0 | C79: =IF(AND(EQUAL(RC[-2], "C"), EQUAL(R[+1]C[-2], "G"))=1, 1, 0) -> 0 | D79: =SUM(RC[-2]:R[+49]C[-2])*2 -> 44 | E79: =SUM(RC[-2]:R[+49]C[-2])*2 -> 0 | F79: =IF(AND(EQUAL(RC[-5], "G"), EQUAL(R[+1]C[-5], "A"), EQUAL(R[+2]C[-5], "T"), EQUAL(R[+3]C[-5], "C"))=1, 1, 0) -> 0
A80: 'C | B80: =IF(EQUAL(RC[-1], "G"), 1, IF(EQUAL(RC[-1], "C"), 1, 0)) -> 1 | C80: =IF(AND(EQUAL(RC[-2], "C"), EQUAL(R[+1]C[-2], "G"))=1, 1, 0) -> 0 | D80: =SUM(RC[-2]:R[+49]C[-2])*2 -> 46 | E80: =SUM(RC[-2]:R[+49]C[-2])*2 -> 0 | F80: =IF(AND(EQUAL(RC[-5], "G"), EQUAL(R[+1]C[-5], "A"), EQUAL(R[+2]C[-5], "T"), EQUAL(R[+3]C[-5], "C"))=1, 1, 0) -> 0
A81: 'A | B81: =IF(EQUAL(RC[-1], "G"), 1, IF(EQUAL(RC[-1], "C"), 1, 0)) -> 0 | C81: =IF(AND(EQUAL(RC[-2], "C"), EQUAL(R[+1]C[-2], "G"))=1, 1, 0) -> 0 | D81: =SUM(RC[-2]:R[+49]C[-2])*2 -> 46 | E81: =SUM(RC[-2]:R[+49]C[-2])*2 -> 0 | F81: =IF(AND(EQUAL(RC[-5], "G"), EQUAL(R[+1]C[-5], "A"), EQUAL(R[+2]C[-5], "T"), EQUAL(R[+3]C[-5], "C"))=1, 1, 0) -> 0
A82: 'C | B82: =IF(EQUAL(RC[-1], "G"), 1, IF(EQUAL(RC[-1], "C"), 1, 0)) -> 1 | C82: =IF(AND(EQUAL(RC[-2], "C"), EQUAL(R[+1]C[-2], "G"))=1, 1, 0) -> 0 | D82: =SUM(RC[-2]:R[+49]C[-2])*2 -> 46 | E82: =SUM(RC[-2]:R[+49]C[-2])*2 -> 0 | F82: =IF(AND(EQUAL(RC[-5], "G"), EQUAL(R[+1]C[-5], "A"), EQUAL(R[+2]C[-5], "T"), EQUAL(R[+3]C[-5], "C"))=1, 1, 0) -> 0
A83: 'C | B83: =IF(EQUAL(RC[-1], "G"), 1, IF(EQUAL(RC[-1], "C"), 1, 0)) -> 1 | C83: =IF(AND(EQUAL(RC[-2], "C"), EQUAL(R[+1]C[-2], "G"))=1, 1, 0) -> 0 | D83: =SUM(RC[-2]:R[+49]C[-2])*2 -> 46 | E83: =SUM(RC[-2]:R[+49]C[-2])*2 -> 0 | F83: =IF(AND(EQUAL(RC[-5], "G"), EQUAL(R[+1]C[-5], "A"), EQUAL(R[+2]C[-5], "T"), EQUAL(R[+3]C[-5], "C"))=1, 1, 0) -> 0
A84: 'A | B84: =IF(EQUAL(RC[-1], "G"), 1, IF(EQUAL(RC[-1], "C"), 1, 0)) -> 0 | C84: =IF(AND(EQUAL(RC[-2], "C"), EQUAL(R[+1]C[-2], "G"))=1, 1, 0) -> 0 | D84: =SUM(RC[-2]:R[+49]C[-2])*2 -> 46 | E84: =SUM(RC[-2]:R[+49]C[-2])*2 -> 0 | F84: =IF(AND(EQUAL(RC[-5], "G"), EQUAL(R[+1]C[-5], "A"), EQUAL(R[+2]C[-5], "T"), EQUAL(R[+3]C[-5], "C"))=1, 1, 0) -> 0
A85: 'T | B85: =IF(EQUAL(RC[-1], "G"), 1, IF(EQUAL(RC[-1], "C"), 1, 0)) -> 0 | C85: =IF(AND(EQUAL(RC[-2], "C"), EQUAL(R[+1]C[-2], "G"))=1, 1, 0) -> 0 | D85: =SUM(RC[-2]:R[+49]C[-2])*2 -> 48 | E85: =SUM(RC[-2]:R[+49]C[-2])*2 -> 0 | F85: =IF(AND(EQUAL(RC[-5], "G"), EQUAL(R[+1]C[-5], "A"), EQUAL(R[+2]C[-5], "T"), EQUAL(R[+3]C[-5], "C"))=1, 1, 0) -> 0
A86: 'T | B86: =IF(EQUAL(RC[-1], "G"), 1, IF(EQUAL(RC[-1], "C"), 1, 0)) -> 0 | C86: =IF(AND(EQUAL(RC[-2], "C"), EQUAL(R[+1]C[-2], "G"))=1, 1, 0) -> 0 | D86: =SUM(RC[-2]:R[+49]C[-2])*2 -> 50 | E86: =SUM(RC[-2]:R[+49]C[-2])*2 -> 0 | F86: =IF(AND(EQUAL(RC[-5], "G"), EQUAL(R[+1]C[-5], "A"), EQUAL(R[+2]C[-5], "T"), EQUAL(R[+3]C[-5], "C"))=1, 1, 0) -> 0
A87: 'T | B87: =IF(EQUAL(RC[-1], "G"), 1, IF(EQUAL(RC[-1], "C"), 1, 0)) -> 0 | C87: =IF(AND(EQUAL(RC[-2], "C"), EQUAL(R[+1]C[-2], "G"))=1, 1, 0) -> 0 | D87: =SUM(RC[-2]:R[+49]C[-2])*2 -> 50 | E87: =SUM(RC[-2]:R[+49]C[-2])*2 -> 0 | F87: =IF(AND(EQUAL(RC[-5], "G"), EQUAL(R[+1]C[-5], "A"), EQUAL(R[+2]C[-5], "T"), EQUAL(R[+3]C[-5], "C"))=1, 1, 0) -> 0
A88: 'C | B88: =IF(EQUAL(RC[-1], "G"), 1, IF(EQUAL(RC[-1], "C"), 1, 0)) -> 1 | C88: =IF(AND(EQUAL(RC[-2], "C"), EQUAL(R[+1]C[-2], "G"))=1, 1, 0) -> 0 | D88: =SUM(RC[-2]:R[+49]C[-2])*2 -> 52 | E88: =SUM(RC[-2]:R[+49]C[-2])*2 -> 0 | F88: =IF(AND(EQUAL(RC[-5], "G"), EQUAL(R[+1]C[-5], "A"), EQUAL(R[+2]C[-5], "T"), EQUAL(R[+3]C[-5], "C"))=1, 1, 0) -> 0
A89: 'T | B89: =IF(EQUAL(RC[-1], "G"), 1, IF(EQUAL(RC[-1], "C"), 1, 0)) -> 0 | C89: =IF(AND(EQUAL(RC[-2], "C"), EQUAL(R[+1]C[-2], "G"))=1, 1, 0) -> 0 | D89: =SUM(RC[-2]:R[+49]C[-2])*2 -> 50 | E89: =SUM(RC[-2]:R[+49]C[-2])*2 -> 0 | F89: =IF(AND(EQUAL(RC[-5], "G"), EQUAL(R[+1]C[-5], "A"), EQUAL(R[+2]C[-5], "T"), EQUAL(R[+3]C[-5], "C"))=1, 1, 0) -> 0
A90: 'T | B90: =IF(EQUAL(RC[-1], "G"), 1, IF(EQUAL(RC[-1], "C"), 1, 0)) -> 0 | C90: =IF(AND(EQUAL(RC[-2], "C"), EQUAL(R[+1]C[-2], "G"))=1, 1, 0) -> 0 | D90: =SUM(RC[-2]:R[+49]C[-2])*2 -> 50 | E90: =SUM(RC[-2]:R[+49]C[-2])*2 -> 0 | F90: =IF(AND(EQUAL(RC[-5], "G"), EQUAL(R[+1]C[-5], "A"), EQUAL(R[+2]C[-5], "T"), EQUAL(R[+3]C[-5], "C"))=1, 1, 0) -> 0
A91: 'T | B91: =IF(EQUAL(RC[-1], "G"), 1, IF(EQUAL(RC[-1], "C"), 1, 0)) -> 0 | C91: =IF(AND(EQUAL(RC[-2], "C"), EQUAL(R[+1]C[-2], "G"))=1, 1, 0) -> 0 | D91: =SUM(RC[-2]:R[+49]C[-2])*2 -> 50 | E91: =SUM(RC[-2]:R[+49]C[-2])*2 -> 0 | F91: =IF(AND(EQUAL(RC[-5], "G"), EQUAL(R[+1]C[-5], "A"), EQUAL(R[+2]C[-5], "T"), EQUAL(R[+3]C[-5], "C"))=1, 1, 0) -> 0
A92: 'G | B92: =IF(EQUAL(RC[-1], "G"), 1, IF(EQUAL(RC[-1], "C"), 1, 0)) -> 1 | C92: =IF(AND(EQUAL(RC[-2], "C"), EQUAL(R[+1]C[-2], "G"))=1, 1, 0) -> 0 | D92: =SUM(RC[-2]:R[+49]C[-2])*2 -> 50 | E92: =SUM(RC[-2]:R[+49]C[-2])*2 -> 0 | F92: =IF(AND(EQUAL(RC[-5], "G"), EQUAL(R[+1]C[-5], "A"), EQUAL(R[+2]C[-5], "T"), EQUAL(R[+3]C[-5], "C"))=1, 1, 0) -> 0
A93: 'T | B93: =IF(EQUAL(RC[-1], "G"), 1, IF(EQUAL(RC[-1], "C"), 1, 0)) -> 0 | C93: =IF(AND(EQUAL(RC[-2], "C"), EQUAL(R[+1]C[-2], "G"))=1, 1, 0) -> 0 | D93: =SUM(RC[-2]:R[+49]C[-2])*2 -> 48 | E93: =SUM(RC[-2]:R[+49]C[-2])*2 -> 0 | F93: =IF(AND(EQUAL(RC[-5], "G"), EQUAL(R[+1]C[-5], "A"), EQUAL(R[+2]C[-5], "T"), EQUAL(R[+3]C[-5], "C"))=1, 1, 0) -> 0
A94: 'G | B94: =IF(EQUAL(RC[-1], "G"), 1, IF(EQUAL(RC[-1], "C"), 1, 0)) -> 1 | C94: =IF(AND(EQUAL(RC[-2], "C"), EQUAL(R[+1]C[-2], "G"))=1, 1, 0) -> 0 | D94: =SUM(RC[-2]:R[+49]C[-2])*2 -> 50 | E94: =SUM(RC[-2]:R[+49]C[-2])*2 -> 0 | F94: =IF(AND(EQUAL(RC[-5], "G"), EQUAL(R[+1]C[-5], "A"), EQUAL(R[+2]C[-5], "T"), EQUAL(R[+3]C[-5], "C"))=1, 1, 0) -> 0
A95: 'T | B95: =IF(EQUAL(RC[-1], "G"), 1, IF(EQUAL(RC[-1], "C"), 1, 0)) -> 0 | C95: =IF(AND(EQUAL(RC[-2], "C"), EQUAL(R[+1]C[-2], "G"))=1, 1, 0) -> 0 | D95: =SUM(RC[-2]:R[+49]C[-2])*2 -> 48 | E95: =SUM(RC[-2]:R[+49]C[-2])*2 -> 0 | F95: =IF(AND(EQUAL(RC[-5], "G"), EQUAL(R[+1]C[-5], "A"), EQUAL(R[+2]C[-5], "T"), EQUAL(R[+3]C[-5], "C"))=1, 1, 0) -> 0
A96: 'G | B96: =IF(EQUAL(RC[-1], "G"), 1, IF(EQUAL(RC[-1], "C"), 1, 0)) -> 1 | C96: =IF(AND(EQUAL(RC[-2], "C"), EQUAL(R[+1]C[-2], "G"))=1, 1, 0) -> 0 | D96: =SUM(RC[-2]:R[+49]C[-2])*2 -> 48 | E96: =SUM(RC[-2]:R[+49]C[-2])*2 -> 0 | F96: =IF(AND(EQUAL(RC[-5], "G"), EQUAL(R[+1]C[-5], "A"), EQUAL(R[+2]C[-5], "T"), EQUAL(R[+3]C[-5], "C"))=1, 1, 0) -> 0
A97: 'T | B97: =IF(EQUAL(RC[-1], "G"), 1, IF(EQUAL(RC[-1], "C"), 1, 0)) -> 0 | C97: =IF(AND(EQUAL(RC[-2], "C"), EQUAL(R[+1]C[-2], "G"))=1, 1, 0) -> 0 | D97: =SUM(RC[-2]:R[+49]C[-2])*2 -> 48 | E97: =SUM(RC[-2]:R[+49]C[-2])*2 -> 0 | F97: =IF(AND(EQUAL(RC[-5], "G"), EQUAL(R[+1]C[-5], "A"), EQUAL(R[+2]C[-5], "T"), EQUAL(R[+3]C[-5], "C"))=1, 1, 0) -> 0
A98: 'G | B98: =IF(EQUAL(RC[-1], "G"), 1, IF(EQUAL(RC[-1], "C"), 1, 0)) -> 1 | C98: =IF(AND(EQUAL(RC[-2], "C"), EQUAL(R[+1]C[-2], "G"))=1, 1, 0) -> 0 | D98: =SUM(RC[-2]:R[+49]C[-2])*2 -> 48 | E98: =SUM(RC[-2]:R[+49]C[-2])*2 -> 0 | F98: =IF(AND(EQUAL(RC[-5], "G"), EQUAL(R[+1]C[-5], "A"), EQUAL(R[+2]C[-5], "T"), EQUAL(R[+3]C[-5], "C"))=1, 1, 0) -> 0
A99: 'T | B99: =IF(EQUAL(RC[-1], "G"), 1, IF(EQUAL(RC[-1], "C"), 1, 0)) -> 0 | C99: =IF(AND(EQUAL(RC[-2], "C"), EQUAL(R[+1]C[-2], "G"))=1, 1, 0) -> 0 | D99: =SUM(RC[-2]:R[+49]C[-2])*2 -> 48 | E99: =SUM(RC[-2]:R[+49]C[-2])*2 -> 0 | F99: =IF(AND(EQUAL(RC[-5], "G"), EQUAL(R[+1]C[-5], "A"), EQUAL(R[+2]C[-5], "T"), EQUAL(R[+3]C[-5], "C"))=1, 1, 0) -> 0
A100: 'G | B100: =IF(EQUAL(RC[-1], "G"), 1, IF(EQUAL(RC[-1], "C"), 1, 0)) -> 1 | C100: =IF(AND(EQUAL(RC[-2], "C"), EQUAL(R[+1]C[-2], "G"))=1, 1, 0) -> 0 | D100: =SUM(RC[-2]:R[+49]C[-2])*2 -> 48 | E100: =SUM(RC[-2]:R[+49]C[-2])*2 -> 0 | F100: =IF(AND(EQUAL(RC[-5], "G"), EQUAL(R[+1]C[-5], "A"), EQUAL(R[+2]C[-5], "T"), EQUAL(R[+3]C[-5], "C"))=1, 1, 0) -> 0
A101: 'T | B101: =IF(EQUAL(RC[-1], "G"), 1, IF(EQUAL(RC[-1], "C"), 1, 0)) -> 0 | C101: =IF(AND(EQUAL(RC[-2], "C"), EQUAL(R[+1]C[-2], "G"))=1, 1, 0) -> 0 | D101: =SUM(RC[-2]:R[+49]C[-2])*2 -> 46 | E101: =SUM(RC[-2]:R[+49]C[-2])*2 -> 0 | F101: =IF(AND(EQUAL(RC[-5], "G"), EQUAL(R[+1]C[-5], "A"), EQUAL(R[+2]C[-5], "T"), EQUAL(R[+3]C[-5], "C"))=1, 1, 0) -> 0
A102: 'G | B102: =IF(EQUAL(RC[-1], "G"), 1, IF(EQUAL(RC[-1], "C"), 1, 0)) -> 1 | C102: =IF(AND(EQUAL(RC[-2], "C"), EQUAL(R[+1]C[-2], "G"))=1, 1, 0) -> 0 | D102: =SUM(RC[-2]:R[+49]C[-2])*2 -> 48 | E102: =SUM(RC[-2]:R[+49]C[-2])*2 -> 0 | F102: =IF(AND(EQUAL(RC[-5], "G"), EQUAL(R[+1]C[-5], "A"), EQUAL(R[+2]C[-5], "T"), EQUAL(R[+3]C[-5], "C"))=1, 1, 0) -> 0
A103: 'T | B103: =IF(EQUAL(RC[-1], "G"), 1, IF(EQUAL(RC[-1], "C"), 1, 0)) -> 0 | C103: =IF(AND(EQUAL(RC[-2], "C"), EQUAL(R[+1]C[-2], "G"))=1, 1, 0) -> 0 | D103: =SUM(RC[-2]:R[+49]C[-2])*2 -> 46 | E103: =SUM(RC[-2]:R[+49]C[-2])*2 -> 0 | F103: =IF(AND(EQUAL(RC[-5], "G"), EQUAL(R[+1]C[-5], "A"), EQUAL(R[+2]C[-5], "T"), EQUAL(R[+3]C[-5], "C"))=1, 1, 0) -> 0
A104: 'G | B104: =IF(EQUAL(RC[-1], "G"), 1, IF(EQUAL(RC[-1], "C"), 1, 0)) -> 1 | C104: =IF(AND(EQUAL(RC[-2], "C"), EQUAL(R[+1]C[-2], "G"))=1, 1, 0) -> 0 | D104: =SUM(RC[-2]:R[+49]C[-2])*2 -> 46 | E104: =SUM(RC[-2]:R[+49]C[-2])*2 -> 0 | F104: =IF(AND(EQUAL(RC[-5], "G"), EQUAL(R[+1]C[-5], "A"), EQUAL(R[+2]C[-5], "T"), EQUAL(R[+3]C[-5], "C"))=1, 1, 0) -> 0
A105: 'T | B105: =IF(EQUAL(RC[-1], "G"), 1, IF(EQUAL(RC[-1], "C"), 1, 0)) -> 0 | C105: =IF(AND(EQUAL(RC[-2], "C"), EQUAL(R[+1]C[-2], "G"))=1, 1, 0) -> 0 | D105: =SUM(RC[-2]:R[+49]C[-2])*2 -> 46 | E105: =SUM(RC[-2]:R[+49]C[-2])*2 -> 0 | F105: =IF(AND(EQUAL(RC[-5], "G"), EQUAL(R[+1]C[-5], "A"), EQUAL(R[+2]C[-5], "T"), EQUAL(R[+3]C[-5], "C"))=1, 1, 0) -> 0
A106: 'T | B106: =IF(EQUAL(RC[-1], "G"), 1, IF(EQUAL(RC[-1], "C"), 1, 0)) -> 0 | C106: =IF(AND(EQUAL(RC[-2], "C"), EQUAL(R[+1]C[-2], "G"))=1, 1, 0) -> 0 | D106: =SUM(RC[-2]:R[+49]C[-2])*2 -> 46 | E106: =SUM(RC[-2]:R[+49]C[-2])*2 -> 0 | F106: =IF(AND(EQUAL(RC[-5], "G"), EQUAL(R[+1]C[-5], "A"), EQUAL(R[+2]C[-5], "T"), EQUAL(R[+3]C[-5], "C"))=1, 1, 0) -> 0
A107: 'G | B107: =IF(EQUAL(RC[-1], "G"), 1, IF(EQUAL(RC[-1], "C"), 1, 0)) -> 1 | C107: =IF(AND(EQUAL(RC[-2], "C"), EQUAL(R[+1]C[-2], "G"))=1, 1, 0) -> 0 | D107: =SUM(RC[-2]:R[+49]C[-2])*2 -> 48 | E107: =SUM(RC[-2]:R[+49]C[-2])*2 -> 0 | F107: =IF(AND(EQUAL(RC[-5], "G"), EQUAL(R[+1]C[-5], "A"), EQUAL(R[+2]C[-5], "T"), EQUAL(R[+3]C[-5], "C"))=1, 1, 0) -> 0
A108: 'T | B108: =IF(EQUAL(RC[-1], "G"), 1, IF(EQUAL(RC[-1], "C"), 1, 0)) -> 0 | C108: =IF(AND(EQUAL(RC[-2], "C"), EQUAL(R[+1]C[-2], "G"))=1, 1, 0) -> 0 | D108: =SUM(RC[-2]:R[+49]C[-2])*2 -> 46 | E108: =SUM(RC[-2]:R[+49]C[-2])*2 -> 0 | F108: =IF(AND(EQUAL(RC[-5], "G"), EQUAL(R[+1]C[-5], "A"), EQUAL(R[+2]C[-5], "T"), EQUAL(R[+3]C[-5], "C"))=1, 1, 0) -> 0
A109: 'A | B109: =IF(EQUAL(RC[-1], "G"), 1, IF(EQUAL(RC[-1], "C"), 1, 0)) -> 0 | C109: =IF(AND(EQUAL(RC[-2], "C"), EQUAL(R[+1]C[-2], "G"))=1, 1, 0) -> 0 | D109: =SUM(RC[-2]:R[+49]C[-2])*2 -> 46 | E109: =SUM(RC[-2]:R[+49]C[-2])*2 -> 0 | F109: =IF(AND(EQUAL(RC[-5], "G"), EQUAL(R[+1]C[-5], "A"), EQUAL(R[+2]C[-5], "T"), EQUAL(R[+3]C[-5], "C"))=1, 1, 0) -> 0
A110: 'G | B110: =IF(EQUAL(RC[-1], "G"), 1, IF(EQUAL(RC[-1], "C"), 1, 0)) -> 1 | C110: =IF(AND(EQUAL(RC[-2], "C"), EQUAL(R[+1]C[-2], "G"))=1, 1, 0) -> 0 | D110: =SUM(RC[-2]:R[+49]C[-2])*2 -> 46 | E110: =SUM(RC[-2]:R[+49]C[-2])*2 -> 0 | F110: =IF(AND(EQUAL(RC[-5], "G"), EQUAL(R[+1]C[-5], "A"), EQUAL(R[+2]C[-5], "T"), EQUAL(R[+3]C[-5], "C"))=1, 1, 0) -> 0
A111: 'T | B111: =IF(EQUAL(RC[-1], "G"), 1, IF(EQUAL(RC[-1], "C"), 1, 0)) -> 0 | C111: =IF(AND(EQUAL(RC[-2], "C"), EQUAL(R[+1]C[-2], "G"))=1, 1, 0) -> 0 | D111: =SUM(RC[-2]:R[+49]C[-2])*2 -> 46 | E111: =SUM(RC[-2]:R[+49]C[-2])*2 -> 0 | F111: =IF(AND(EQUAL(RC[-5], "G"), EQUAL(R[+1]C[-5], "A"), EQUAL(R[+2]C[-5], "T"), EQUAL(R[+3]C[-5], "C"))=1, 1, 0) -> 0
A112: 'C | B112: =IF(EQUAL(RC[-1], "G"), 1, IF(EQUAL(RC[-1], "C"), 1, 0)) -> 1 | C112: =IF(AND(EQUAL(RC[-2], "C"), EQUAL(R[+1]C[-2], "G"))=1, 1, 0) -> 0 | D112: =SUM(RC[-2]:R[+49]C[-2])*2 -> 46 | E112: =SUM(RC[-2]:R[+49]C[-2])*2 -> 0 | F112: =IF(AND(EQUAL(RC[-5], "G"), EQUAL(R[+1]C[-5], "A"), EQUAL(R[+2]C[-5], "T"), EQUAL(R[+3]C[-5], "C"))=1, 1, 0) -> 0
A113: 'A | B113: =IF(EQUAL(RC[-1], "G"), 1, IF(EQUAL(RC[-1], "C"), 1, 0)) -> 0 | C113: =IF(AND(EQUAL(RC[-2], "C"), EQUAL(R[+1]C[-2], "G"))=1, 1, 0) -> 0 | D113: =SUM(RC[-2]:R[+49]C[-2])*2 -> 46 | E113: =SUM(RC[-2]:R[+49]C[-2])*2 -> 0 | F113: =IF(AND(EQUAL(RC[-5], "G"), EQUAL(R[+1]C[-5], "A"), EQUAL(R[+2]C[-5], "T"), EQUAL(R[+3]C[-5], "C"))=1, 1, 0) -> 0
A114: 'T | B114: =IF(EQUAL(RC[-1], "G"), 1, IF(EQUAL(RC[-1], "C"), 1, 0)) -> 0 | C114: =IF(AND(EQUAL(RC[-2], "C"), EQUAL(R[+1]C[-2], "G"))=1, 1, 0) -> 0 | D114: =SUM(RC[-2]:R[+49]C[-2])*2 -> 46 | E114: =SUM(RC[-2]:R[+49]C[-2])*2 -> 0 | F114: =IF(AND(EQUAL(RC[-5], "G"), EQUAL(R[+1]C[-5], "A"), EQUAL(R[+2]C[-5], "T"), EQUAL(R[+3]C[-5], "C"))=1, 1, 0) -> 0
A115: 'G | B115: =IF(EQUAL(RC[-1], "G"), 1, IF(EQUAL(RC[-1], "C"), 1, 0)) -> 1 | C115: =IF(AND(EQUAL(RC[-2], "C"), EQUAL(R[+1]C[-2], "G"))=1, 1, 0) -> 0 | D115: =SUM(RC[-2]:R[+49]C[-2])*2 -> 46 | E115: =SUM(RC[-2]:R[+49]C[-2])*2 -> 0 | F115: =IF(AND(EQUAL(RC[-5], "G"), EQUAL(R[+1]C[-5], "A"), EQUAL(R[+2]C[-5], "T"), EQUAL(R[+3]C[-5], "C"))=1, 1, 0) -> 0
A116: 'T | B116: =IF(EQUAL(RC[-1], "G"), 1, IF(EQUAL(RC[-1], "C"), 1, 0)) -> 0 | C116: =IF(AND(EQUAL(RC[-2], "C"), EQUAL(R[+1]C[-2], "G"))=1, 1, 0) -> 0 | D116: =SUM(RC[-2]:R[+49]C[-2])*2 -> 44 | E116: =SUM(RC[-2]:R[+49]C[-2])*2 -> 0 | F116: =IF(AND(EQUAL(RC[-5], "G"), EQUAL(R[+1]C[-5], "A"), EQUAL(R[+2]C[-5], "T"), EQUAL(R[+3]C[-5], "C"))=1, 1, 0) -> 0
A117: 'G | B117: =IF(EQUAL(RC[-1], "G"), 1, IF(EQUAL(RC[-1], "C"), 1, 0)) -> 1 | C117: =IF(AND(EQUAL(RC[-2], "C"), EQUAL(R[+1]C[-2], "G"))=1, 1, 0) -> 0 | D117: =SUM(RC[-2]:R[+49]C[-2])*2 -> 46 | E117: =SUM(RC[-2]:R[+49]C[-2])*2 -> 0 | F117: =IF(AND(EQUAL(RC[-5], "G"), EQUAL(R[+1]C[-5], "A"), EQUAL(R[+2]C[-5], "T"), EQUAL(R[+3]C[-5], "C"))=1, 1, 0) -> 0
A118: 'C | B118: =IF(EQUAL(RC[-1], "G"), 1, IF(EQUAL(RC[-1], "C"), 1, 0)) -> 1 | C118: =IF(AND(EQUAL(RC[-2], "C"), EQUAL(R[+1]C[-2], "G"))=1, 1, 0) -> 0 | D118: =SUM(RC[-2]:R[+49]C[-2])*2 -> 46 | E118: =SUM(RC[-2]:R[+49]C[-2])*2 -> 0 | F118: =IF(AND(EQUAL(RC[-5], "G"), EQUAL(R[+1]C[-5], "A"), EQUAL(R[+2]C[-5], "T"), EQUAL(R[+3]C[-5], "C"))=1, 1, 0) -> 0
A119: 'A | B119: =IF(EQUAL(RC[-1], "G"), 1, IF(EQUAL(RC[-1], "C"), 1, 0)) -> 0 | C119: =IF(AND(EQUAL(RC[-2], "C"), EQUAL(R[+1]C[-2], "G"))=1, 1, 0) -> 0 | D119: =SUM(RC[-2]:R[+49]C[-2])*2 -> 46 | E119: =SUM(RC[-2]:R[+49]C[-2])*2 -> 0 | F119: =IF(AND(EQUAL(RC[-5], "G"), EQUAL(R[+1]C[-5], "A"), EQUAL(R[+2]C[-5], "T"), EQUAL(R[+3]C[-5], "C"))=1, 1, 0) -> 0
A120: 'G | B120: =IF(EQUAL(RC[-1], "G"), 1, IF(EQUAL(RC[-1], "C"), 1, 0)) -> 1 | C120: =IF(AND(EQUAL(RC[-2], "C"), EQUAL(R[+1]C[-2], "G"))=1, 1, 0) -> 0 | D120: =SUM(RC[-2]:R[+49]C[-2])*2 -> 46 | E120: =SUM(RC[-2]:R[+49]C[-2])*2 -> 0 | F120: =IF(AND(EQUAL(RC[-5], "G"), EQUAL(R[+1]C[-5], "A"), EQUAL(R[+2]C[-5], "T"), EQUAL(R[+3]C[-5], "C"))=1, 1, 0) -> 0
A121: 'G | B121: =IF(EQUAL(RC[-1], "G"), 1, IF(EQUAL(RC[-1], "C"), 1, 0)) -> 1 | C121: =IF(AND(EQUAL(RC[-2], "C"), EQUAL(R[+1]C[-2], "G"))=1, 1, 0) -> 0 | D121: =SUM(RC[-2]:R[+49]C[-2])*2 -> 44 | E121: =SUM(RC[-2]:R[+49]C[-2])*2 -> 0 | F121: =IF(AND(EQUAL(RC[-5], "G"), EQUAL(R[+1]C[-5], "A"), EQUAL(R[+2]C[-5], "T"), EQUAL(R[+3]C[-5], "C"))=1, 1, 0) -> 0
A122: 'T | B122: =IF(EQUAL(RC[-1], "G"), 1, IF(EQUAL(RC[-1], "C"), 1, 0)) -> 0 | C122: =IF(AND(EQUAL(RC[-2], "C"), EQUAL(R[+1]C[-2], "G"))=1, 1, 0) -> 0 | D122: =SUM(RC[-2]:R[+49]C[-2])*2 -> 42 | E122: =SUM(RC[-2]:R[+49]C[-2])*2 -> 0 | F122: =IF(AND(EQUAL(RC[-5], "G"), EQUAL(R[+1]C[-5], "A"), EQUAL(R[+2]C[-5], "T"), EQUAL(R[+3]C[-5], "C"))=1, 1, 0) -> 0
A123: 'G | B123: =IF(EQUAL(RC[-1], "G"), 1, IF(EQUAL(RC[-1], "C"), 1, 0)) -> 1 | C123: =IF(AND(EQUAL(RC[-2], "C"), EQUAL(R[+1]C[-2], "G"))=1, 1, 0) -> 0 | D123: =SUM(RC[-2]:R[+49]C[-2])*2 -> 42 | E123: =SUM(RC[-2]:R[+49]C[-2])*2 -> 0 | F123: =IF(AND(EQUAL(RC[-5], "G"), EQUAL(R[+1]C[-5], "A"), EQUAL(R[+2]C[-5], "T"), EQUAL(R[+3]C[-5], "C"))=1, 1, 0) -> 0
A124: 'C | B124: =IF(EQUAL(RC[-1], "G"), 1, IF(EQUAL(RC[-1], "C"), 1, 0)) -> 1 | C124: =IF(AND(EQUAL(RC[-2], "C"), EQUAL(R[+1]C[-2], "G"))=1, 1, 0) -> 0 | D124: =SUM(RC[-2]:R[+49]C[-2])*2 -> 42 | E124: =SUM(RC[-2]:R[+49]C[-2])*2 -> 0 | F124: =IF(AND(EQUAL(RC[-5], "G"), EQUAL(R[+1]C[-5], "A"), EQUAL(R[+2]C[-5], "T"), EQUAL(R[+3]C[-5], "C"))=1, 1, 0) -> 0
A125: 'T | B125: =IF(EQUAL(RC[-1], "G"), 1, IF(EQUAL(RC[-1], "C"), 1, 0)) -> 0 | C125: =IF(AND(EQUAL(RC[-2], "C"), EQUAL(R[+1]C[-2], "G"))=1, 1, 0) -> 0 | D125: =SUM(RC[-2]:R[+49]C[-2])*2 -> 42 | E125: =SUM(RC[-2]:R[+49]C[-2])*2 -> 0 | F125: =IF(AND(EQUAL(RC[-5], "G"), EQUAL(R[+1]C[-5], "A"), EQUAL(R[+2]C[-5], "T"), EQUAL(R[+3]C[-5], "C"))=1, 1, 0) -> 0
A126: 'T | B126: =IF(EQUAL(RC[-1], "G"), 1, IF(EQUAL(RC[-1], "C"), 1, 0)) -> 0 | C126: =IF(AND(EQUAL(RC[-2], "C"), EQUAL(R[+1]C[-2], "G"))=1, 1, 0) -> 0 | D126: =SUM(RC[-2]:R[+49]C[-2])*2 -> 42 | E126: =SUM(RC[-2]:R[+49]C[-2])*2 -> 0 | F126: =IF(AND(EQUAL(RC[-5], "G"), EQUAL(R[+1]C[-5], "A"), EQUAL(R[+2]C[-5], "T"), EQUAL(R[+3]C[-5], "C"))=1, 1, 0) -> 0
A127: 'G | B127: =IF(EQUAL(RC[-1], "G"), 1, IF(EQUAL(RC[-1], "C"), 1, 0)) -> 1 | C127: =IF(AND(EQUAL(RC[-2], "C"), EQUAL(R[+1]C[-2], "G"))=1, 1, 0) -> 0 | D127: =SUM(RC[-2]:R[+49]C[-2])*2 -> 44 | E127: =SUM(RC[-2]:R[+49]C[-2])*2 -> 0 | F127: =IF(AND(EQUAL(RC[-5], "G"), EQUAL(R[+1]C[-5], "A"), EQUAL(R[+2]C[-5], "T"), EQUAL(R[+3]C[-5], "C"))=1, 1, 0) -> 0
A128: 'A | B128: =IF(EQUAL(RC[-1], "G"), 1, IF(EQUAL(RC[-1], "C"), 1, 0)) -> 0 | C128: =IF(AND(EQUAL(RC[-2], "C"), EQUAL(R[+1]C[-2], "G"))=1, 1, 0) -> 0 | D128: =SUM(RC[-2]:R[+49]C[-2])*2 -> 44 | E128: =SUM(RC[-2]:R[+49]C[-2])*2 -> 0 | F128: =IF(AND(EQUAL(RC[-5], "G"), EQUAL(R[+1]C[-5], "A"), EQUAL(R[+2]C[-5], "T"), EQUAL(R[+3]C[-5], "C"))=1, 1, 0) -> 0
A129: 'G | B129: =IF(EQUAL(RC[-1], "G"), 1, IF(EQUAL(RC[-1], "C"), 1, 0)) -> 1 | C129: =IF(AND(EQUAL(RC[-2], "C"), EQUAL(R[+1]C[-2], "G"))=1, 1, 0) -> 0 | D129: =SUM(RC[-2]:R[+49]C[-2])*2 -> 44 | E129: =SUM(RC[-2]:R[+49]C[-2])*2 -> 0 | F129: =IF(AND(EQUAL(RC[-5], "G"), EQUAL(R[+1]C[-5], "A"), EQUAL(R[+2]C[-5], "T"), EQUAL(R[+3]C[-5], "C"))=1, 1, 0) -> 0
A130: 'G | B130: =IF(EQUAL(RC[-1], "G"), 1, IF(EQUAL(RC[-1], "C"), 1, 0)) -> 1 | C130: =IF(AND(EQUAL(RC[-2], "C"), EQUAL(R[+1]C[-2], "G"))=1, 1, 0) -> 0 | D130: =SUM(RC[-2]:R[+49]C[-2])*2 -> 42 | E130: =SUM(RC[-2]:R[+49]C[-2])*2 -> 0 | F130: =IF(AND(EQUAL(RC[-5], "G"), EQUAL(R[+1]C[-5], "A"), EQUAL(R[+2]C[-5], "T"), EQUAL(R[+3]C[-5], "C"))=1, 1, 0) -> 0
A131: 'A | B131: =IF(EQUAL(RC[-1], "G"), 1, IF(EQUAL(RC[-1], "C"), 1, 0)) -> 0 | C131: =IF(AND(EQUAL(RC[-2], "C"), EQUAL(R[+1]C[-2], "G"))=1, 1, 0) -> 0 | D131: =SUM(RC[-2]:R[+49]C[-2])*2 -> 40 | E131: =SUM(RC[-2]:R[+49]C[-2])*2 -> 0 | F131: =IF(AND(EQUAL(RC[-5], "G"), EQUAL(R[+1]C[-5], "A"), EQUAL(R[+2]C[-5], "T"), EQUAL(R[+3]C[-5], "C"))=1, 1, 0) -> 0
A132: 'G | B132: =IF(EQUAL(RC[-1], "G"), 1, IF(EQUAL(RC[-1], "C"), 1, 0)) -> 1 | C132: =IF(AND(EQUAL(RC[-2], "C"), EQUAL(R[+1]C[-2], "G"))=1, 1, 0) -> 0 | D132: =SUM(RC[-2]:R[+49]C[-2])*2 -> 40 | E132: =SUM(RC[-2]:R[+49]C[-2])*2 -> 0 | F132: =IF(AND(EQUAL(RC[-5], "G"), EQUAL(R[+1]C[-5], "A"), EQUAL(R[+2]C[-5], "T"), EQUAL(R[+3]C[-5], "C"))=1, 1, 0) -> 0
A133: 'G | B133: =IF(EQUAL(RC[-1], "G"), 1, IF(EQUAL(RC[-1], "C"), 1, 0)) -> 1 | C133: =IF(AND(EQUAL(RC[-2], "C"), EQUAL(R[+1]C[-2], "G"))=1, 1, 0) -> 0 | D133: =SUM(RC[-2]:R[+49]C[-2])*2 -> 40 | E133: =SUM(RC[-2]:R[+49]C[-2])*2 -> 0 | F133: =IF(AND(EQUAL(RC[-5], "G"), EQUAL(R[+1]C[-5], "A"), EQUAL(R[+2]C[-5], "T"), EQUAL(R[+3]C[-5], "C"))=1, 1, 0) -> 0
A134: 'G | B134: =IF(EQUAL(RC[-1], "G"), 1, IF(EQUAL(RC[-1], "C"), 1, 0)) -> 1 | C134: =IF(AND(EQUAL(RC[-2], "C"), EQUAL(R[+1]C[-2], "G"))=1, 1, 0) -> 0 | D134: =SUM(RC[-2]:R[+49]C[-2])*2 -> 38 | E134: =SUM(RC[-2]:R[+49]C[-2])*2 -> 0 | F134: =IF(AND(EQUAL(RC[-5], "G"), EQUAL(R[+1]C[-5], "A"), EQUAL(R[+2]C[-5], "T"), EQUAL(R[+3]C[-5], "C"))=1, 1, 0) -> 0
A135: 'C | B135: =IF(EQUAL(RC[-1], "G"), 1, IF(EQUAL(RC[-1], "C"), 1, 0)) -> 1 | C135: =IF(AND(EQUAL(RC[-2], "C"), EQUAL(R[+1]C[-2], "G"))=1, 1, 0) -> 0 | D135: =SUM(RC[-2]:R[+49]C[-2])*2 -> 38 | E135: =SUM(RC[-2]:R[+49]C[-2])*2 -> 0 | F135: =IF(AND(EQUAL(RC[-5], "G"), EQUAL(R[+1]C[-5], "A"), EQUAL(R[+2]C[-5], "T"), EQUAL(R[+3]C[-5], "C"))=1, 1, 0) -> 0
A136: 'A | B136: =IF(EQUAL(RC[-1], "G"), 1, IF(EQUAL(RC[-1], "C"), 1, 0)) -> 0 | C136: =IF(AND(EQUAL(RC[-2], "C"), EQUAL(R[+1]C[-2], "G"))=1, 1, 0) -> 0 | D136: =SUM(RC[-2]:R[+49]C[-2])*2 -> 36 | E136: =SUM(RC[-2]:R[+49]C[-2])*2 -> 0 | F136: =IF(AND(EQUAL(RC[-5], "G"), EQUAL(R[+1]C[-5], "A"), EQUAL(R[+2]C[-5], "T"), EQUAL(R[+3]C[-5], "C"))=1, 1, 0) -> 0
A137: 'C | B137: =IF(EQUAL(RC[-1], "G"), 1, IF(EQUAL(RC[-1], "C"), 1, 0)) -> 1 | C137: =IF(AND(EQUAL(RC[-2], "C"), EQUAL(R[+1]C[-2], "G"))=1, 1, 0) -> 0 | D137: =SUM(RC[-2]:R[+49]C[-2])*2 -> 36 | E137: =SUM(RC[-2]:R[+49]C[-2])*2 -> 0 | F137: =IF(AND(EQUAL(RC[-5], "G"), EQUAL(R[+1]C[-5], "A"), EQUAL(R[+2]C[-5], "T"), EQUAL(R[+3]C[-5], "C"))=1, 1, 0) -> 0
A138: 'A | B138: =IF(EQUAL(RC[-1], "G"), 1, IF(EQUAL(RC[-1], "C"), 1, 0)) -> 0 | C138: =IF(AND(EQUAL(RC[-2], "C"), EQUAL(R[+1]C[-2], "G"))=1, 1, 0) -> 0 | D138: =SUM(RC[-2]:R[+49]C[-2])*2 -> 34 | E138: =SUM(RC[-2]:R[+49]C[-2])*2 -> 0 | F138: =IF(AND(EQUAL(RC[-5], "G"), EQUAL(R[+1]C[-5], "A"), EQUAL(R[+2]C[-5], "T"), EQUAL(R[+3]C[-5], "C"))=1, 1, 0) -> 0
A139: 'A | B139: =IF(EQUAL(RC[-1], "G"), 1, IF(EQUAL(RC[-1], "C"), 1, 0)) -> 0 | C139: =IF(AND(EQUAL(RC[-2], "C"), EQUAL(R[+1]C[-2], "G"))=1, 1, 0) -> 0 | D139: =SUM(RC[-2]:R[+49]C[-2])*2 -> 34 | E139: =SUM(RC[-2]:R[+49]C[-2])*2 -> 0 | F139: =IF(AND(EQUAL(RC[-5], "G"), EQUAL(R[+1]C[-5], "A"), EQUAL(R[+2]C[-5], "T"), EQUAL(R[+3]C[-5], "C"))=1, 1, 0) -> 0
A140: 'T | B140: =IF(EQUAL(RC[-1], "G"), 1, IF(EQUAL(RC[-1], "C"), 1, 0)) -> 0 | C140: =IF(AND(EQUAL(RC[-2], "C"), EQUAL(R[+1]C[-2], "G"))=1, 1, 0) -> 0 | D140: =SUM(RC[-2]:R[+49]C[-2])*2 -> 34 | E140: =SUM(RC[-2]:R[+49]C[-2])*2 -> 0 | F140: =IF(AND(EQUAL(RC[-5], "G"), EQUAL(R[+1]C[-5], "A"), EQUAL(R[+2]C[-5], "T"), EQUAL(R[+3]C[-5], "C"))=1, 1, 0) -> 0
A141: 'T | B141: =IF(EQUAL(RC[-1], "G"), 1, IF(EQUAL(RC[-1], "C"), 1, 0)) -> 0 | C141: =IF(AND(EQUAL(RC[-2], "C"), EQUAL(R[+1]C[-2], "G"))=1, 1, 0) -> 0 | D141: =SUM(RC[-2]:R[+49]C[-2])*2 -> 34 | E141: =SUM(RC[-2]:R[+49]C[-2])*2 -> 0 | F141: =IF(AND(EQUAL(RC[-5], "G"), EQUAL(R[+1]C[-5], "A"), EQUAL(R[+2]C[-5], "T"), EQUAL(R[+3]C[-5], "C"))=1, 1, 0) -> 0
A142: 'T | B142: =IF(EQUAL(RC[-1], "G"), 1, IF(EQUAL(RC[-1], "C"), 1, 0)) -> 0 | C142: =IF(AND(EQUAL(RC[-2], "C"), EQUAL(R[+1]C[-2], "G"))=1, 1, 0) -> 0 | D142: =SUM(RC[-2]:R[+49]C[-2])*2 -> 34 | E142: =SUM(RC[-2]:R[+49]C[-2])*2 -> 0 | F142: =IF(AND(EQUAL(RC[-5], "G"), EQUAL(R[+1]C[-5], "A"), EQUAL(R[+2]C[-5], "T"), EQUAL(R[+3]C[-5], "C"))=1, 1, 0) -> 0
A143: 'G | B143: =IF(EQUAL(RC[-1], "G"), 1, IF(EQUAL(RC[-1], "C"), 1, 0)) -> 1 | C143: =IF(AND(EQUAL(RC[-2], "C"), EQUAL(R[+1]C[-2], "G"))=1, 1, 0) -> 0 | D143: =SUM(RC[-2]:R[+49]C[-2])*2 -> 34 | E143: =SUM(RC[-2]:R[+49]C[-2])*2 -> 0 | F143: =IF(AND(EQUAL(RC[-5], "G"), EQUAL(R[+1]C[-5], "A"), EQUAL(R[+2]C[-5], "T"), EQUAL(R[+3]C[-5], "C"))=1, 1, 0) -> 0
A144: 'A | B144: =IF(EQUAL(RC[-1], "G"), 1, IF(EQUAL(RC[-1], "C"), 1, 0)) -> 0 | C144: =IF(AND(EQUAL(RC[-2], "C"), EQUAL(R[+1]C[-2], "G"))=1, 1, 0) -> 0 | D144: =SUM(RC[-2]:R[+49]C[-2])*2 -> 32 | E144: =SUM(RC[-2]:R[+49]C[-2])*2 -> 0 | F144: =IF(AND(EQUAL(RC[-5], "G"), EQUAL(R[+1]C[-5], "A"), EQUAL(R[+2]C[-5], "T"), EQUAL(R[+3]C[-5], "C"))=1, 1, 0) -> 0
A145: 'T | B145: =IF(EQUAL(RC[-1], "G"), 1, IF(EQUAL(RC[-1], "C"), 1, 0)) -> 0 | C145: =IF(AND(EQUAL(RC[-2], "C"), EQUAL(R[+1]C[-2], "G"))=1, 1, 0) -> 0 | D145: =SUM(RC[-2]:R[+49]C[-2])*2 -> 32 | E145: =SUM(RC[-2]:R[+49]C[-2])*2 -> 0 | F145: =IF(AND(EQUAL(RC[-5], "G"), EQUAL(R[+1]C[-5], "A"), EQUAL(R[+2]C[-5], "T"), EQUAL(R[+3]C[-5], "C"))=1, 1, 0) -> 0
A146: 'G | B146: =IF(EQUAL(RC[-1], "G"), 1, IF(EQUAL(RC[-1], "C"), 1, 0)) -> 1 | C146: =IF(AND(EQUAL(RC[-2], "C"), EQUAL(R[+1]C[-2], "G"))=1, 1, 0) -> 0 | D146: =SUM(RC[-2]:R[+49]C[-2])*2 -> 34 | E146: =SUM(RC[-2]:R[+49]C[-2])*2 -> 0 | F146: =IF(AND(EQUAL(RC[-5], "G"), EQUAL(R[+1]C[-5], "A"), EQUAL(R[+2]C[-5], "T"), EQUAL(R[+3]C[-5], "C"))=1, 1, 0) -> 0
A147: 'A | B147: =IF(EQUAL(RC[-1], "G"), 1, IF(EQUAL(RC[-1], "C"), 1, 0)) -> 0 | C147: =IF(AND(EQUAL(RC[-2], "C"), EQUAL(R[+1]C[-2], "G"))=1, 1, 0) -> 0 | D147: =SUM(RC[-2]:R[+49]C[-2])*2 -> 32 | E147: =SUM(RC[-2]:R[+49]C[-2])*2 -> 0 | F147: =IF(AND(EQUAL(RC[-5], "G"), EQUAL(R[+1]C[-5], "A"), EQUAL(R[+2]C[-5], "T"), EQUAL(R[+3]C[-5], "C"))=1, 1, 0) -> 0
A148: 'C | B148: =IF(EQUAL(RC[-1], "G"), 1, IF(EQUAL(RC[-1], "C"), 1, 0)) -> 1 | C148: =IF(AND(EQUAL(RC[-2], "C"), EQUAL(R[+1]C[-2], "G"))=1, 1, 0) -> 0 | D148: =SUM(RC[-2]:R[+49]C[-2])*2 -> 34 | E148: =SUM(RC[-2]:R[+49]C[-2])*2 -> 0 | F148: =IF(AND(EQUAL(RC[-5], "G"), EQUAL(R[+1]C[-5], "A"), EQUAL(R[+2]C[-5], "T"), EQUAL(R[+3]C[-5], "C"))=1, 1, 0) -> 0
A149: 'A | B149: =IF(EQUAL(RC[-1], "G"), 1, IF(EQUAL(RC[-1], "C"), 1, 0)) -> 0 | C149: =IF(AND(EQUAL(RC[-2], "C"), EQUAL(R[+1]C[-2], "G"))=1, 1, 0) -> 0 | D149: =SUM(RC[-2]:R[+49]C[-2])*2 -> 34 | E149: =SUM(RC[-2]:R[+49]C[-2])*2 -> 0 | F149: =IF(AND(EQUAL(RC[-5], "G"), EQUAL(R[+1]C[-5], "A"), EQUAL(R[+2]C[-5], "T"), EQUAL(R[+3]C[-5], "C"))=1, 1, 0) -> 0
A150: 'A | B150: =IF(EQUAL(RC[-1], "G"), 1, IF(EQUAL(RC[-1], "C"), 1, 0)) -> 0 | C150: =IF(AND(EQUAL(RC[-2], "C"), EQUAL(R[+1]C[-2], "G"))=1, 1, 0) -> 0 | D150: =SUM(RC[-2]:R[+49]C[-2])*2 -> 36 | E150: =SUM(RC[-2]:R[+49]C[-2])*2 -> 0 | F150: =IF(AND(EQUAL(RC[-5], "G"), EQUAL(R[+1]C[-5], "A"), EQUAL(R[+2]C[-5], "T"), EQUAL(R[+3]C[-5], "C"))=1, 1, 0) -> 0
A151: 'G | B151: =IF(EQUAL(RC[-1], "G"), 1, IF(EQUAL(RC[-1], "C"), 1, 0)) -> 1 | C151: =IF(AND(EQUAL(RC[-2], "C"), EQUAL(R[+1]C[-2], "G"))=1, 1, 0) -> 0 | D151: =SUM(RC[-2]:R[+49]C[-2])*2 -> 36 | E151: =SUM(RC[-2]:R[+49]C[-2])*2 -> 0 | F151: =IF(AND(EQUAL(RC[-5], "G"), EQUAL(R[+1]C[-5], "A"), EQUAL(R[+2]C[-5], "T"), EQUAL(R[+3]C[-5], "C"))=1, 1, 0) -> 0
A152: 'A | B152: =IF(EQUAL(RC[-1], "G"), 1, IF(EQUAL(RC[-1], "C"), 1, 0)) -> 0 | C152: =IF(AND(EQUAL(RC[-2], "C"), EQUAL(R[+1]C[-2], "G"))=1, 1, 0) -> 0 | D152: =SUM(RC[-2]:R[+49]C[-2])*2 -> 34 | E152: =SUM(RC[-2]:R[+49]C[-2])*2 -> 0 | F152: =IF(AND(EQUAL(RC[-5], "G"), EQUAL(R[+1]C[-5], "A"), EQUAL(R[+2]C[-5], "T"), EQUAL(R[+3]C[-5], "C"))=1, 1, 0) -> 0
A153: 'T | B153: =IF(EQUAL(RC[-1], "G"), 1, IF(EQUAL(RC[-1], "C"), 1, 0)) -> 0 | C153: =IF(AND(EQUAL(RC[-2], "C"), EQUAL(R[+1]C[-2], "G"))=1, 1, 0) -> 0 | D153: =SUM(RC[-2]:R[+49]C[-2])*2 -> 36 | E153: =SUM(RC[-2]:R[+49]C[-2])*2 -> 0 | F153: =IF(AND(EQUAL(RC[-5], "G"), EQUAL(R[+1]C[-5], "A"), EQUAL(R[+2]C[-5], "T"), EQUAL(R[+3]C[-5], "C"))=1, 1, 0) -> 0
A154: 'G | B154: =IF(EQUAL(RC[-1], "G"), 1, IF(EQUAL(RC[-1], "C"), 1, 0)) -> 1 | C154: =IF(AND(EQUAL(RC[-2], "C"), EQUAL(R[+1]C[-2], "G"))=1, 1, 0) -> 0 | D154: =SUM(RC[-2]:R[+49]C[-2])*2 -> 36 | E154: =SUM(RC[-2]:R[+49]C[-2])*2 -> 0 | F154: =IF(AND(EQUAL(RC[-5], "G"), EQUAL(R[+1]C[-5], "A"), EQUAL(R[+2]C[-5], "T"), EQUAL(R[+3]C[-5], "C"))=1, 1, 0) -> 0
A155: 'T | B155: =IF(EQUAL(RC[-1], "G"), 1, IF(EQUAL(RC[-1], "C"), 1, 0)) -> 0 | C155: =IF(AND(EQUAL(RC[-2], "C"), EQUAL(R[+1]C[-2], "G"))=1, 1, 0) -> 0 | D155: =SUM(RC[-2]:R[+49]C[-2])*2 -> 34 | E155: =SUM(RC[-2]:R[+49]C[-2])*2 -> 0 | F155: =IF(AND(EQUAL(RC[-5], "G"), EQUAL(R[+1]C[-5], "A"), EQUAL(R[+2]C[-5], "T"), EQUAL(R[+3]C[-5], "C"))=1, 1, 0) -> 0
A156: 'C | B156: =IF(EQUAL(RC[-1], "G"), 1, IF(EQUAL(RC[-1], "C"), 1, 0)) -> 1 | C156: =IF(AND(EQUAL(RC[-2], "C"), EQUAL(R[+1]C[-2], "G"))=1, 1, 0) -> 0 | D156: =SUM(RC[-2]:R[+49]C[-2])*2 -> 36 | E156: =SUM(RC[-2]:R[+49]C[-2])*2 -> 0 | F156: =IF(AND(EQUAL(RC[-5], "G"), EQUAL(R[+1]C[-5], "A"), EQUAL(R[+2]C[-5], "T"), EQUAL(R[+3]C[-5], "C"))=1, 1, 0) -> 0
A157: 'T | B157: =IF(EQUAL(RC[-1], "G"), 1, IF(EQUAL(RC[-1], "C"), 1, 0)) -> 0 | C157: =IF(AND(EQUAL(RC[-2], "C"), EQUAL(R[+1]C[-2], "G"))=1, 1, 0) -> 0 | D157: =SUM(RC[-2]:R[+49]C[-2])*2 -> 34 | E157: =SUM(RC[-2]:R[+49]C[-2])*2 -> 0 | F157: =IF(AND(EQUAL(RC[-5], "G"), EQUAL(R[+1]C[-5], "A"), EQUAL(R[+2]C[-5], "T"), EQUAL(R[+3]C[-5], "C"))=1, 1, 0) -> 0
A158: 'T | B158: =IF(EQUAL(RC[-1], "G"), 1, IF(EQUAL(RC[-1], "C"), 1, 0)) -> 0 | C158: =IF(AND(EQUAL(RC[-2], "C"), EQUAL(R[+1]C[-2], "G"))=1, 1, 0) -> 0 | D158: =SUM(RC[-2]:R[+49]C[-2])*2 -> 36 | E158: =SUM(RC[-2]:R[+49]C[-2])*2 -> 0 | F158: =IF(AND(EQUAL(RC[-5], "G"), EQUAL(R[+1]C[-5], "A"), EQUAL(R[+2]C[-5], "T"), EQUAL(R[+3]C[-5], "C"))=1, 1, 0) -> 0
A159: 'T | B159: =IF(EQUAL(RC[-1], "G"), 1, IF(EQUAL(RC[-1], "C"), 1, 0)) -> 0 | C159: =IF(AND(EQUAL(RC[-2], "C"), EQUAL(R[+1]C[-2], "G"))=1, 1, 0) -> 0 | D159: =SUM(RC[-2]:R[+49]C[-2])*2 -> 36 | E159: =SUM(RC[-2]:R[+49]C[-2])*2 -> 0 | F159: =IF(AND(EQUAL(RC[-5], "G"), EQUAL(R[+1]C[-5], "A"), EQUAL(R[+2]C[-5], "T"), EQUAL(R[+3]C[-5], "C"))=1, 1, 0) -> 0
A160: 'C | B160: =IF(EQUAL(RC[-1], "G"), 1, IF(EQUAL(RC[-1], "C"), 1, 0)) -> 1 | C160: =IF(AND(EQUAL(RC[-2], "C"), EQUAL(R[+1]C[-2], "G"))=1, 1, 0) -> 0 | D160: =SUM(RC[-2]:R[+49]C[-2])*2 -> 36 | E160: =SUM(RC[-2]:R[+49]C[-2])*2 -> 0 | F160: =IF(AND(EQUAL(RC[-5], "G"), EQUAL(R[+1]C[-5], "A"), EQUAL(R[+2]C[-5], "T"), EQUAL(R[+3]C[-5], "C"))=1, 1, 0) -> 0
A161: 'T | B161: =IF(EQUAL(RC[-1], "G"), 1, IF(EQUAL(RC[-1], "C"), 1, 0)) -> 0 | C161: =IF(AND(EQUAL(RC[-2], "C"), EQUAL(R[+1]C[-2], "G"))=1, 1, 0) -> 0 | D161: =SUM(RC[-2]:R[+49]C[-2])*2 -> 34 | E161: =SUM(RC[-2]:R[+49]C[-2])*2 -> 0 | F161: =IF(AND(EQUAL(RC[-5], "G"), EQUAL(R[+1]C[-5], "A"), EQUAL(R[+2]C[-5], "T"), EQUAL(R[+3]C[-5], "C"))=1, 1, 0) -> 0
A162: 'C | B162: =IF(EQUAL(RC[-1], "G"), 1, IF(EQUAL(RC[-1], "C"), 1, 0)) -> 1 | C162: =IF(AND(EQUAL(RC[-2], "C"), EQUAL(R[+1]C[-2], "G"))=1, 1, 0) -> 0 | D162: =SUM(RC[-2]:R[+49]C[-2])*2 -> 34 | E162: =SUM(RC[-2]:R[+49]C[-2])*2 -> 0 | F162: =IF(AND(EQUAL(RC[-5], "G"), EQUAL(R[+1]C[-5], "A"), EQUAL(R[+2]C[-5], "T"), EQUAL(R[+3]C[-5], "C"))=1, 1, 0) -> 0
A163: 'A | B163: =IF(EQUAL(RC[-1], "G"), 1, IF(EQUAL(RC[-1], "C"), 1, 0)) -> 0 | C163: =IF(AND(EQUAL(RC[-2], "C"), EQUAL(R[+1]C[-2], "G"))=1, 1, 0) -> 0 | D163: =SUM(RC[-2]:R[+49]C[-2])*2 -> 34 | E163: =SUM(RC[-2]:R[+49]C[-2])*2 -> 0 | F163: =IF(AND(EQUAL(RC[-5], "G"), EQUAL(R[+1]C[-5], "A"), EQUAL(R[+2]C[-5], "T"), EQUAL(R[+3]C[-5], "C"))=1, 1, 0) -> 0
A164: 'A | B164: =IF(EQUAL(RC[-1], "G"), 1, IF(EQUAL(RC[-1], "C"), 1, 0)) -> 0 | C164: =IF(AND(EQUAL(RC[-2], "C"), EQUAL(R[+1]C[-2], "G"))=1, 1, 0) -> 0 | D164: =SUM(RC[-2]:R[+49]C[-2])*2 -> 34 | E164: =SUM(RC[-2]:R[+49]C[-2])*2 -> 0 | F164: =IF(AND(EQUAL(RC[-5], "G"), EQUAL(R[+1]C[-5], "A"), EQUAL(R[+2]C[-5], "T"), EQUAL(R[+3]C[-5], "C"))=1, 1, 0) -> 0
A165: 'A | B165: =IF(EQUAL(RC[-1], "G"), 1, IF(EQUAL(RC[-1], "C"), 1, 0)) -> 0 | C165: =IF(AND(EQUAL(RC[-2], "C"), EQUAL(R[+1]C[-2], "G"))=1, 1, 0) -> 0 | D165: =SUM(RC[-2]:R[+49]C[-2])*2 -> 36 | E165: =SUM(RC[-2]:R[+49]C[-2])*2 -> 0 | F165: =IF(AND(EQUAL(RC[-5], "G"), EQUAL(R[+1]C[-5], "A"), EQUAL(R[+2]C[-5], "T"), EQUAL(R[+3]C[-5], "C"))=1, 1, 0) -> 0
A166: 'C | B166: =IF(EQUAL(RC[-1], "G"), 1, IF(EQUAL(RC[-1], "C"), 1, 0)) -> 1 | C166: =IF(AND(EQUAL(RC[-2], "C"), EQUAL(R[+1]C[-2], "G"))=1, 1, 0) -> 0 | D166: =SUM(RC[-2]:R[+49]C[-2])*2 -> 36 | E166: =SUM(RC[-2]:R[+49]C[-2])*2 -> 0 | F166: =IF(AND(EQUAL(RC[-5], "G"), EQUAL(R[+1]C[-5], "A"), EQUAL(R[+2]C[-5], "T"), EQUAL(R[+3]C[-5], "C"))=1, 1, 0) -> 0
A167: 'C | B167: =IF(EQUAL(RC[-1], "G"), 1, IF(EQUAL(RC[-1], "C"), 1, 0)) -> 1 | C167: =IF(AND(EQUAL(RC[-2], "C"), EQUAL(R[+1]C[-2], "G"))=1, 1, 0) -> 0 | D167: =SUM(RC[-2]:R[+49]C[-2])*2 -> 36 | E167: =SUM(RC[-2]:R[+49]C[-2])*2 -> 0 | F167: =IF(AND(EQUAL(RC[-5], "G"), EQUAL(R[+1]C[-5], "A"), EQUAL(R[+2]C[-5], "T"), EQUAL(R[+3]C[-5], "C"))=1, 1, 0) -> 0
A168: 'C | B168: =IF(EQUAL(RC[-1], "G"), 1, IF(EQUAL(RC[-1], "C"), 1, 0)) -> 1 | C168: =IF(AND(EQUAL(RC[-2], "C"), EQUAL(R[+1]C[-2], "G"))=1, 1, 0) -> 0 | D168: =SUM(RC[-2]:R[+49]C[-2])*2 -> 36 | E168: =SUM(RC[-2]:R[+49]C[-2])*2 -> 0 | F168: =IF(AND(EQUAL(RC[-5], "G"), EQUAL(R[+1]C[-5], "A"), EQUAL(R[+2]C[-5], "T"), EQUAL(R[+3]C[-5], "C"))=1, 1, 0) -> 0
A169: 'T | B169: =IF(EQUAL(RC[-1], "G"), 1, IF(EQUAL(RC[-1], "C"), 1, 0)) -> 0 | C169: =IF(AND(EQUAL(RC[-2], "C"), EQUAL(R[+1]C[-2], "G"))=1, 1, 0) -> 0 | D169: =SUM(RC[-2]:R[+49]C[-2])*2 -> 36 | E169: =SUM(RC[-2]:R[+49]C[-2])*2 -> 0 | F169: =IF(AND(EQUAL(RC[-5], "G"), EQUAL(R[+1]C[-5], "A"), EQUAL(R[+2]C[-5], "T"), EQUAL(R[+3]C[-5], "C"))=1, 1, 0) -> 0
A170: 'A | B170: =IF(EQUAL(RC[-1], "G"), 1, IF(EQUAL(RC[-1], "C"), 1, 0)) -> 0 | C170: =IF(AND(EQUAL(RC[-2], "C"), EQUAL(R[+1]C[-2], "G"))=1, 1, 0) -> 0 | D170: =SUM(RC[-2]:R[+49]C[-2])*2 -> 36 | E170: =SUM(RC[-2]:R[+49]C[-2])*2 -> 0 | F170: =IF(AND(EQUAL(RC[-5], "G"), EQUAL(R[+1]C[-5], "A"), EQUAL(R[+2]C[-5], "T"), EQUAL(R[+3]C[-5], "C"))=1, 1, 0) -> 0
A171: 'T | B171: =IF(EQUAL(RC[-1], "G"), 1, IF(EQUAL(RC[-1], "C"), 1, 0)) -> 0 | C171: =IF(AND(EQUAL(RC[-2], "C"), EQUAL(R[+1]C[-2], "G"))=1, 1, 0) -> 0 | D171: =SUM(RC[-2]:R[+49]C[-2])*2 -> 36 | E171: =SUM(RC[-2]:R[+49]C[-2])*2 -> 0 | F171: =IF(AND(EQUAL(RC[-5], "G"), EQUAL(R[+1]C[-5], "A"), EQUAL(R[+2]C[-5], "T"), EQUAL(R[+3]C[-5], "C"))=1, 1, 0) -> 0
A172: 'T | B172: =IF(EQUAL(RC[-1], "G"), 1, IF(EQUAL(RC[-1], "C"), 1, 0)) -> 0 | C172: =IF(AND(EQUAL(RC[-2], "C"), EQUAL(R[+1]C[-2], "G"))=1, 1, 0) -> 0 | D172: =SUM(RC[-2]:R[+49]C[-2])*2 -> 38 | E172: =SUM(RC[-2]:R[+49]C[-2])*2 -> 0 | F172: =IF(AND(EQUAL(RC[-5], "G"), EQUAL(R[+1]C[-5], "A"), EQUAL(R[+2]C[-5], "T"), EQUAL(R[+3]C[-5], "C"))=1, 1, 0) -> 0
A173: 'C | B173: =IF(EQUAL(RC[-1], "G"), 1, IF(EQUAL(RC[-1], "C"), 1, 0)) -> 1 | C173: =IF(AND(EQUAL(RC[-2], "C"), EQUAL(R[+1]C[-2], "G"))=1, 1, 0) -> 0 | D173: =SUM(RC[-2]:R[+49]C[-2])*2 -> 40 | E173: =SUM(RC[-2]:R[+49]C[-2])*2 -> 0 | F173: =IF(AND(EQUAL(RC[-5], "G"), EQUAL(R[+1]C[-5], "A"), EQUAL(R[+2]C[-5], "T"), EQUAL(R[+3]C[-5], "C"))=1, 1, 0) -> 0
A174: 'C | B174: =IF(EQUAL(RC[-1], "G"), 1, IF(EQUAL(RC[-1], "C"), 1, 0)) -> 1 | C174: =IF(AND(EQUAL(RC[-2], "C"), EQUAL(R[+1]C[-2], "G"))=1, 1, 0) -> 0 | D174: =SUM(RC[-2]:R[+49]C[-2])*2 -> 38 | E174: =SUM(RC[-2]:R[+49]C[-2])*2 -> 0 | F174: =IF(AND(EQUAL(RC[-5], "G"), EQUAL(R[+1]C[-5], "A"), EQUAL(R[+2]C[-5], "T"), EQUAL(R[+3]C[-5], "C"))=1, 1, 0) -> 0
A175: 'A | B175: =IF(EQUAL(RC[-1], "G"), 1, IF(EQUAL(RC[-1], "C"), 1, 0)) -> 0 | C175: =IF(AND(EQUAL(RC[-2], "C"), EQUAL(R[+1]C[-2], "G"))=1, 1, 0) -> 0 | D175: =SUM(RC[-2]:R[+49]C[-2])*2 -> 36 | E175: =SUM(RC[-2]:R[+49]C[-2])*2 -> 0 | F175: =IF(AND(EQUAL(RC[-5], "G"), EQUAL(R[+1]C[-5], "A"), EQUAL(R[+2]C[-5], "T"), EQUAL(R[+3]C[-5], "C"))=1, 1, 0) -> 0
A176: 'C | B176: =IF(EQUAL(RC[-1], "G"), 1, IF(EQUAL(RC[-1], "C"), 1, 0)) -> 1 | C176: =IF(AND(EQUAL(RC[-2], "C"), EQUAL(R[+1]C[-2], "G"))=1, 1, 0) -> 0 | D176: =SUM(RC[-2]:R[+49]C[-2])*2 -> 38 | E176: =SUM(RC[-2]:R[+49]C[-2])*2 -> 0 | F176: =IF(AND(EQUAL(RC[-5], "G"), EQUAL(R[+1]C[-5], "A"), EQUAL(R[+2]C[-5], "T"), EQUAL(R[+3]C[-5], "C"))=1, 1, 0) -> 0
A177: 'C | B177: =IF(EQUAL(RC[-1], "G"), 1, IF(EQUAL(RC[-1], "C"), 1, 0)) -> 1 | C177: =IF(AND(EQUAL(RC[-2], "C"), EQUAL(R[+1]C[-2], "G"))=1, 1, 0) -> 0 | D177: =SUM(RC[-2]:R[+49]C[-2])*2 -> 36 | E177: =SUM(RC[-2]:R[+49]C[-2])*2 -> 0 | F177: =IF(AND(EQUAL(RC[-5], "G"), EQUAL(R[+1]C[-5], "A"), EQUAL(R[+2]C[-5], "T"), EQUAL(R[+3]C[-5], "C"))=1, 1, 0) -> 0
A178: 'T | B178: =IF(EQUAL(RC[-1], "G"), 1, IF(EQUAL(RC[-1], "C"), 1, 0)) -> 0 | C178: =IF(AND(EQUAL(RC[-2], "C"), EQUAL(R[+1]C[-2], "G"))=1, 1, 0) -> 0 | D178: =SUM(RC[-2]:R[+49]C[-2])*2 -> 34 | E178: =SUM(RC[-2]:R[+49]C[-2])*2 -> 0 | F178: =IF(AND(EQUAL(RC[-5], "G"), EQUAL(R[+1]C[-5], "A"), EQUAL(R[+2]C[-5], "T"), EQUAL(R[+3]C[-5], "C"))=1, 1, 0) -> 0
A179: 'T | B179: =IF(EQUAL(RC[-1], "G"), 1, IF(EQUAL(RC[-1], "C"), 1, 0)) -> 0 | C179: =IF(AND(EQUAL(RC[-2], "C"), EQUAL(R[+1]C[-2], "G"))=1, 1, 0) -> 0 | D179: =SUM(RC[-2]:R[+49]C[-2])*2 -> 34 | E179: =SUM(RC[-2]:R[+49]C[-2])*2 -> 0 | F179: =IF(AND(EQUAL(RC[-5], "G"), EQUAL(R[+1]C[-5], "A"), EQUAL(R[+2]C[-5], "T"), EQUAL(R[+3]C[-5], "C"))=1, 1, 0) -> 0
A180: 'A | B180: =IF(EQUAL(RC[-1], "G"), 1, IF(EQUAL(RC[-1], "C"), 1, 0)) -> 0 | C180: =IF(AND(EQUAL(RC[-2], "C"), EQUAL(R[+1]C[-2], "G"))=1, 1, 0) -> 0 | D180: =SUM(RC[-2]:R[+49]C[-2])*2 -> 34 | E180: =SUM(RC[-2]:R[+49]C[-2])*2 -> 0 | F180: =IF(AND(EQUAL(RC[-5], "G"), EQUAL(R[+1]C[-5], "A"), EQUAL(R[+2]C[-5], "T"), EQUAL(R[+3]C[-5], "C"))=1, 1, 0) -> 0
A181: 'T | B181: =IF(EQUAL(RC[-1], "G"), 1, IF(EQUAL(RC[-1], "C"), 1, 0)) -> 0 | C181: =IF(AND(EQUAL(RC[-2], "C"), EQUAL(R[+1]C[-2], "G"))=1, 1, 0) -> 0 | D181: =SUM(RC[-2]:R[+49]C[-2])*2 -> 34 | E181: =SUM(RC[-2]:R[+49]C[-2])*2 -> 0 | F181: =IF(AND(EQUAL(RC[-5], "G"), EQUAL(R[+1]C[-5], "A"), EQUAL(R[+2]C[-5], "T"), EQUAL(R[+3]C[-5], "C"))=1, 1, 0) -> 0
A182: 'C | B182: =IF(EQUAL(RC[-1], "G"), 1, IF(EQUAL(RC[-1], "C"), 1, 0)) -> 1 | C182: =IF(AND(EQUAL(RC[-2], "C"), EQUAL(R[+1]C[-2], "G"))=1, 1, 0) -> 0 | D182: =SUM(RC[-2]:R[+49]C[-2])*2 -> 34 | E182: =SUM(RC[-2]:R[+49]C[-2])*2 -> 0 | F182: =IF(AND(EQUAL(RC[-5], "G"), EQUAL(R[+1]C[-5], "A"), EQUAL(R[+2]C[-5], "T"), EQUAL(R[+3]C[-5], "C"))=1, 1, 0) -> 0
A183: 'A | B183: =IF(EQUAL(RC[-1], "G"), 1, IF(EQUAL(RC[-1], "C"), 1, 0)) -> 0 | C183: =IF(AND(EQUAL(RC[-2], "C"), EQUAL(R[+1]C[-2], "G"))=1, 1, 0) -> 0 | D183: =SUM(RC[-2]:R[+49]C[-2])*2 -> 34 | E183: =SUM(RC[-2]:R[+49]C[-2])*2 -> 0 | F183: =IF(AND(EQUAL(RC[-5], "G"), EQUAL(R[+1]C[-5], "A"), EQUAL(R[+2]C[-5], "T"), EQUAL(R[+3]C[-5], "C"))=1, 1, 0) -> 0
A184: 'G | B184: =IF(EQUAL(RC[-1], "G"), 1, IF(EQUAL(RC[-1], "C"), 1, 0)) -> 1 | C184: =IF(AND(EQUAL(RC[-2], "C"), EQUAL(R[+1]C[-2], "G"))=1, 1, 0) -> 0 | D184: =SUM(RC[-2]:R[+49]C[-2])*2 -> 34 | E184: =SUM(RC[-2]:R[+49]C[-2])*2 -> 0 | F184: =IF(AND(EQUAL(RC[-5], "G"), EQUAL(R[+1]C[-5], "A"), EQUAL(R[+2]C[-5], "T"), EQUAL(R[+3]C[-5], "C"))=1, 1, 0) -> 0
A185: 'A | B185: =IF(EQUAL(RC[-1], "G"), 1, IF(EQUAL(RC[-1], "C"), 1, 0)) -> 0 | C185: =IF(AND(EQUAL(RC[-2], "C"), EQUAL(R[+1]C[-2], "G"))=1, 1, 0) -> 0 | D185: =SUM(RC[-2]:R[+49]C[-2])*2 -> 32 | E185: =SUM(RC[-2]:R[+49]C[-2])*2 -> 0 | F185: =IF(AND(EQUAL(RC[-5], "G"), EQUAL(R[+1]C[-5], "A"), EQUAL(R[+2]C[-5], "T"), EQUAL(R[+3]C[-5], "C"))=1, 1, 0) -> 0
A186: 'T | B186: =IF(EQUAL(RC[-1], "G"), 1, IF(EQUAL(RC[-1], "C"), 1, 0)) -> 0 | C186: =IF(AND(EQUAL(RC[-2], "C"), EQUAL(R[+1]C[-2], "G"))=1, 1, 0) -> 0 | D186: =SUM(RC[-2]:R[+49]C[-2])*2 -> 34 | E186: =SUM(RC[-2]:R[+49]C[-2])*2 -> 0 | F186: =IF(AND(EQUAL(RC[-5], "G"), EQUAL(R[+1]C[-5], "A"), EQUAL(R[+2]C[-5], "T"), EQUAL(R[+3]C[-5], "C"))=1, 1, 0) -> 0
A187: 'T | B187: =IF(EQUAL(RC[-1], "G"), 1, IF(EQUAL(RC[-1], "C"), 1, 0)) -> 0 | C187: =IF(AND(EQUAL(RC[-2], "C"), EQUAL(R[+1]C[-2], "G"))=1, 1, 0) -> 0 | D187: =SUM(RC[-2]:R[+49]C[-2])*2 -> 36 | E187: =SUM(RC[-2]:R[+49]C[-2])*2 -> 0 | F187: =IF(AND(EQUAL(RC[-5], "G"), EQUAL(R[+1]C[-5], "A"), EQUAL(R[+2]C[-5], "T"), EQUAL(R[+3]C[-5], "C"))=1, 1, 0) -> 0
A188: 'T | B188: =IF(EQUAL(RC[-1], "G"), 1, IF(EQUAL(RC[-1], "C"), 1, 0)) -> 0 | C188: =IF(AND(EQUAL(RC[-2], "C"), EQUAL(R[+1]C[-2], "G"))=1, 1, 0) -> 0 | D188: =SUM(RC[-2]:R[+49]C[-2])*2 -> 36 | E188: =SUM(RC[-2]:R[+49]C[-2])*2 -> 0 | F188: =IF(AND(EQUAL(RC[-5], "G"), EQUAL(R[+1]C[-5], "A"), EQUAL(R[+2]C[-5], "T"), EQUAL(R[+3]C[-5], "C"))=1, 1, 0) -> 0
A189: 'T | B189: =IF(EQUAL(RC[-1], "G"), 1, IF(EQUAL(RC[-1], "C"), 1, 0)) -> 0 | C189: =IF(AND(EQUAL(RC[-2], "C"), EQUAL(R[+1]C[-2], "G"))=1, 1, 0) -> 0 | D189: =SUM(RC[-2]:R[+49]C[-2])*2 -> 38 | E189: =SUM(RC[-2]:R[+49]C[-2])*2 -> 0 | F189: =IF(AND(EQUAL(RC[-5], "G"), EQUAL(R[+1]C[-5], "A"), EQUAL(R[+2]C[-5], "T"), EQUAL(R[+3]C[-5], "C"))=1, 1, 0) -> 0
A190: 'A | B190: =IF(EQUAL(RC[-1], "G"), 1, IF(EQUAL(RC[-1], "C"), 1, 0)) -> 0 | C190: =IF(AND(EQUAL(RC[-2], "C"), EQUAL(R[+1]C[-2], "G"))=1, 1, 0) -> 0 | D190: =SUM(RC[-2]:R[+49]C[-2])*2 -> 40 | E190: =SUM(RC[-2]:R[+49]C[-2])*2 -> 2 | F190: =IF(AND(EQUAL(RC[-5], "G"), EQUAL(R[+1]C[-5], "A"), EQUAL(R[+2]C[-5], "T"), EQUAL(R[+3]C[-5], "C"))=1, 1, 0) -> 0
A191: 'T | B191: =IF(EQUAL(RC[-1], "G"), 1, IF(EQUAL(RC[-1], "C"), 1, 0)) -> 0 | C191: =IF(AND(EQUAL(RC[-2], "C"), EQUAL(R[+1]C[-2], "G"))=1, 1, 0) -> 0 | D191: =SUM(RC[-2]:R[+49]C[-2])*2 -> 42 | E191: =SUM(RC[-2]:R[+49]C[-2])*2 -> 2 | F191: =IF(AND(EQUAL(RC[-5], "G"), EQUAL(R[+1]C[-5], "A"), EQUAL(R[+2]C[-5], "T"), EQUAL(R[+3]C[-5], "C"))=1, 1, 0) -> 0
A192: 'T | B192: =IF(EQUAL(RC[-1], "G"), 1, IF(EQUAL(RC[-1], "C"), 1, 0)) -> 0 | C192: =IF(AND(EQUAL(RC[-2], "C"), EQUAL(R[+1]C[-2], "G"))=1, 1, 0) -> 0 | D192: =SUM(RC[-2]:R[+49]C[-2])*2 -> 42 | E192: =SUM(RC[-2]:R[+49]C[-2])*2 -> 2 | F192: =IF(AND(EQUAL(RC[-5], "G"), EQUAL(R[+1]C[-5], "A"), EQUAL(R[+2]C[-5], "T"), EQUAL(R[+3]C[-5], "C"))=1, 1, 0) -> 0
A193: 'T | B193: =IF(EQUAL(RC[-1], "G"), 1, IF(EQUAL(RC[-1], "C"), 1, 0)) -> 0 | C193: =IF(AND(EQUAL(RC[-2], "C"), EQUAL(R[+1]C[-2], "G"))=1, 1, 0) -> 0 | D193: =SUM(RC[-2]:R[+49]C[-2])*2 -> 44 | E193: =SUM(RC[-2]:R[+49]C[-2])*2 -> 2 | F193: =IF(AND(EQUAL(RC[-5], "G"), EQUAL(R[+1]C[-5], "A"), EQUAL(R[+2]C[-5], "T"), EQUAL(R[+3]C[-5], "C"))=1, 1, 0) -> 0
A194: 'T | B194: =IF(EQUAL(RC[-1], "G"), 1, IF(EQUAL(RC[-1], "C"), 1, 0)) -> 0 | C194: =IF(AND(EQUAL(RC[-2], "C"), EQUAL(R[+1]C[-2], "G"))=1, 1, 0) -> 0 | D194: =SUM(RC[-2]:R[+49]C[-2])*2 -> 44 | E194: =SUM(RC[-2]:R[+49]C[-2])*2 -> 2 | F194: =IF(AND(EQUAL(RC[-5], "G"), EQUAL(R[+1]C[-5], "A"), EQUAL(R[+2]C[-5], "T"), EQUAL(R[+3]C[-5], "C"))=1, 1, 0) -> 0
A195: 'G | B195: =IF(EQUAL(RC[-1], "G"), 1, IF(EQUAL(RC[-1], "C"), 1, 0)) -> 1 | C195: =IF(AND(EQUAL(RC[-2], "C"), EQUAL(R[+1]C[-2], "G"))=1, 1, 0) -> 0 | D195: =SUM(RC[-2]:R[+49]C[-2])*2 -> 44 | E195: =SUM(RC[-2]:R[+49]C[-2])*2 -> 2 | F195: =IF(AND(EQUAL(RC[-5], "G"), EQUAL(R[+1]C[-5], "A"), EQUAL(R[+2]C[-5], "T"), EQUAL(R[+3]C[-5], "C"))=1, 1, 0) -> 0
A196: 'A | B196: =IF(EQUAL(RC[-1], "G"), 1, IF(EQUAL(RC[-1], "C"), 1, 0)) -> 0 | C196: =IF(AND(EQUAL(RC[-2], "C"), EQUAL(R[+1]C[-2], "G"))=1, 1, 0) -> 0 | D196: =SUM(RC[-2]:R[+49]C[-2])*2 -> 42 | E196: =SUM(RC[-2]:R[+49]C[-2])*2 -> 2 | F196: =IF(AND(EQUAL(RC[-5], "G"), EQUAL(R[+1]C[-5], "A"), EQUAL(R[+2]C[-5], "T"), EQUAL(R[+3]C[-5], "C"))=1, 1, 0) -> 0
A197: 'G | B197: =IF(EQUAL(RC[-1], "G"), 1, IF(EQUAL(RC[-1], "C"), 1, 0)) -> 1 | C197: =IF(AND(EQUAL(RC[-2], "C"), EQUAL(R[+1]C[-2], "G"))=1, 1, 0) -> 0 | D197: =SUM(RC[-2]:R[+49]C[-2])*2 -> 42 | E197: =SUM(RC[-2]:R[+49]C[-2])*2 -> 2 | F197: =IF(AND(EQUAL(RC[-5], "G"), EQUAL(R[+1]C[-5], "A"), EQUAL(R[+2]C[-5], "T"), EQUAL(R[+3]C[-5], "C"))=1, 1, 0) -> 0
A198: 'G | B198: =IF(EQUAL(RC[-1], "G"), 1, IF(EQUAL(RC[-1], "C"), 1, 0)) -> 1 | C198: =IF(AND(EQUAL(RC[-2], "C"), EQUAL(R[+1]C[-2], "G"))=1, 1, 0) -> 0 | D198: =SUM(RC[-2]:R[+49]C[-2])*2 -> 42 | E198: =SUM(RC[-2]:R[+49]C[-2])*2 -> 2 | F198: =IF(AND(EQUAL(RC[-5], "G"), EQUAL(R[+1]C[-5], "A"), EQUAL(R[+2]C[-5], "T"), EQUAL(R[+3]C[-5], "C"))=1, 1, 0) -> 0
A199: 'C | B199: =IF(EQUAL(RC[-1], "G"), 1, IF(EQUAL(RC[-1], "C"), 1, 0)) -> 1 | C199: =IF(AND(EQUAL(RC[-2], "C"), EQUAL(R[+1]C[-2], "G"))=1, 1, 0) -> 0 | D199: =SUM(RC[-2]:R[+49]C[-2])*2 -> 42 | E199: =SUM(RC[-2]:R[+49]C[-2])*2 -> 2 | F199: =IF(AND(EQUAL(RC[-5], "G"), EQUAL(R[+1]C[-5], "A"), EQUAL(R[+2]C[-5], "T"), EQUAL(R[+3]C[-5], "C"))=1, 1, 0) -> 0
A200: 'A | B200: =IF(EQUAL(RC[-1], "G"), 1, IF(EQUAL(RC[-1], "C"), 1, 0)) -> 0 | C200: =IF(AND(EQUAL(RC[-2], "C"), EQUAL(R[+1]C[-2], "G"))=1, 1, 0) -> 0 | D200: =SUM(RC[-2]:R[+49]C[-2])*2 -> 40 | E200: =SUM(RC[-2]:R[+49]C[-2])*2 -> 2 | F200: =IF(AND(EQUAL(RC[-5], "G"), EQUAL(R[+1]C[-5], "A"), EQUAL(R[+2]C[-5], "T"), EQUAL(R[+3]C[-5], "C"))=1, 1, 0) -> 0
A201: 'A | B201: =IF(EQUAL(RC[-1], "G"), 1, IF(EQUAL(RC[-1], "C"), 1, 0)) -> 0 | C201: =IF(AND(EQUAL(RC[-2], "C"), EQUAL(R[+1]C[-2], "G"))=1, 1, 0) -> 0 | D201: =SUM(RC[-2]:R[+49]C[-2])*2 -> 42 | E201: =SUM(RC[-2]:R[+49]C[-2])*2 -> 2 | F201: =IF(AND(EQUAL(RC[-5], "G"), EQUAL(R[+1]C[-5], "A"), EQUAL(R[+2]C[-5], "T"), EQUAL(R[+3]C[-5], "C"))=1, 1, 0) -> 0
A202: 'G | B202: =IF(EQUAL(RC[-1], "G"), 1, IF(EQUAL(RC[-1], "C"), 1, 0)) -> 1 | C202: =IF(AND(EQUAL(RC[-2], "C"), EQUAL(R[+1]C[-2], "G"))=1, 1, 0) -> 0 | D202: =SUM(RC[-2]:R[+49]C[-2])*2 -> 44 | E202: =SUM(RC[-2]:R[+49]C[-2])*2 -> 2 | F202: =IF(AND(EQUAL(RC[-5], "G"), EQUAL(R[+1]C[-5], "A"), EQUAL(R[+2]C[-5], "T"), EQUAL(R[+3]C[-5], "C"))=1, 1, 0) -> 1
A203: 'A | B203: =IF(EQUAL(RC[-1], "G"), 1, IF(EQUAL(RC[-1], "C"), 1, 0)) -> 0 | C203: =IF(AND(EQUAL(RC[-2], "C"), EQUAL(R[+1]C[-2], "G"))=1, 1, 0) -> 0 | D203: =SUM(RC[-2]:R[+49]C[-2])*2 -> 42 | E203: =SUM(RC[-2]:R[+49]C[-2])*2 -> 2 | F203: =IF(AND(EQUAL(RC[-5], "G"), EQUAL(R[+1]C[-5], "A"), EQUAL(R[+2]C[-5], "T"), EQUAL(R[+3]C[-5], "C"))=1, 1, 0) -> 0
A204: 'T | B204: =IF(EQUAL(RC[-1], "G"), 1, IF(EQUAL(RC[-1], "C"), 1, 0)) -> 0 | C204: =IF(AND(EQUAL(RC[-2], "C"), EQUAL(R[+1]C[-2], "G"))=1, 1, 0) -> 0 | D204: =SUM(RC[-2]:R[+49]C[-2])*2 -> 42 | E204: =SUM(RC[-2]:R[+49]C[-2])*2 -> 2 | F204: =IF(AND(EQUAL(RC[-5], "G"), EQUAL(R[+1]C[-5], "A"), EQUAL(R[+2]C[-5], "T"), EQUAL(R[+3]C[-5], "C"))=1, 1, 0) -> 0
A205: 'C | B205: =IF(EQUAL(RC[-1], "G"), 1, IF(EQUAL(RC[-1], "C"), 1, 0)) -> 1 | C205: =IF(AND(EQUAL(RC[-2], "C"), EQUAL(R[+1]C[-2], "G"))=1, 1, 0) -> 0 | D205: =SUM(RC[-2]:R[+49]C[-2])*2 -> 42 | E205: =SUM(RC[-2]:R[+49]C[-2])*2 -> 2 | F205: =IF(AND(EQUAL(RC[-5], "G"), EQUAL(R[+1]C[-5], "A"), EQUAL(R[+2]C[-5], "T"), EQUAL(R[+3]C[-5], "C"))=1, 1, 0) -> 0
A206: 'T | B206: =IF(EQUAL(RC[-1], "G"), 1, IF(EQUAL(RC[-1], "C"), 1, 0)) -> 0 | C206: =IF(AND(EQUAL(RC[-2], "C"), EQUAL(R[+1]C[-2], "G"))=1, 1, 0) -> 0 | D206: =SUM(RC[-2]:R[+49]C[-2])*2 -> 42 | E206: =SUM(RC[-2]:R[+49]C[-2])*2 -> 2 | F206: =IF(AND(EQUAL(RC[-5], "G"), EQUAL(R[+1]C[-5], "A"), EQUAL(R[+2]C[-5], "T"), EQUAL(R[+3]C[-5], "C"))=1, 1, 0) -> 0
A207: 'C | B207: =IF(EQUAL(RC[-1], "G"), 1, IF(EQUAL(RC[-1], "C"), 1, 0)) -> 1 | C207: =IF(AND(EQUAL(RC[-2], "C"), EQUAL(R[+1]C[-2], "G"))=1, 1, 0) -> 0 | D207: =SUM(RC[-2]:R[+49]C[-2])*2 -> 44 | E207: =SUM(RC[-2]:R[+49]C[-2])*2 -> 2 | F207: =IF(AND(EQUAL(RC[-5], "G"), EQUAL(R[+1]C[-5], "A"), EQUAL(R[+2]C[-5], "T"), EQUAL(R[+3]C[-5], "C"))=1, 1, 0) -> 0
A208: 'A | B208: =IF(EQUAL(RC[-1], "G"), 1, IF(EQUAL(RC[-1], "C"), 1, 0)) -> 0 | C208: =IF(AND(EQUAL(RC[-2], "C"), EQUAL(R[+1]C[-2], "G"))=1, 1, 0) -> 0 | D208: =SUM(RC[-2]:R[+49]C[-2])*2 -> 42 | E208: =SUM(RC[-2]:R[+49]C[-2])*2 -> 2 | F208: =IF(AND(EQUAL(RC[-5], "G"), EQUAL(R[+1]C[-5], "A"), EQUAL(R[+2]C[-5], "T"), EQUAL(R[+3]C[-5], "C"))=1, 1, 0) -> 0
A209: 'A | B209: =IF(EQUAL(RC[-1], "G"), 1, IF(EQUAL(RC[-1], "C"), 1, 0)) -> 0 | C209: =IF(AND(EQUAL(RC[-2], "C"), EQUAL(R[+1]C[-2], "G"))=1, 1, 0) -> 0 | D209: =SUM(RC[-2]:R[+49]C[-2])*2 -> 44 | E209: =SUM(RC[-2]:R[+49]C[-2])*2 -> 2 | F209: =IF(AND(EQUAL(RC[-5], "G"), EQUAL(R[+1]C[-5], "A"), EQUAL(R[+2]C[-5], "T"), EQUAL(R[+3]C[-5], "C"))=1, 1, 0) -> 0
A210: 'T | B210: =IF(EQUAL(RC[-1], "G"), 1, IF(EQUAL(RC[-1], "C"), 1, 0)) -> 0 | C210: =IF(AND(EQUAL(RC[-2], "C"), EQUAL(R[+1]C[-2], "G"))=1, 1, 0) -> 0 | D210: =SUM(RC[-2]:R[+49]C[-2])*2 -> 46 | E210: =SUM(RC[-2]:R[+49]C[-2])*2 -> 2 | F210: =IF(AND(EQUAL(RC[-5], "G"), EQUAL(R[+1]C[-5], "A"), EQUAL(R[+2]C[-5], "T"), EQUAL(R[+3]C[-5], "C"))=1, 1, 0) -> 0
A211: 'T | B211: =IF(EQUAL(RC[-1], "G"), 1, IF(EQUAL(RC[-1], "C"), 1, 0)) -> 0 | C211: =IF(AND(EQUAL(RC[-2], "C"), EQUAL(R[+1]C[-2], "G"))=1, 1, 0) -> 0 | D211: =SUM(RC[-2]:R[+49]C[-2])*2 -> 46 | E211: =SUM(RC[-2]:R[+49]C[-2])*2 -> 2 | F211: =IF(AND(EQUAL(RC[-5], "G"), EQUAL(R[+1]C[-5], "A"), EQUAL(R[+2]C[-5], "T"), EQUAL(R[+3]C[-5], "C"))=1, 1, 0) -> 0
A212: 'G | B212: =IF(EQUAL(RC[-1], "G"), 1, IF(EQUAL(RC[-1], "C"), 1, 0)) -> 1 | C212: =IF(AND(EQUAL(RC[-2], "C"), EQUAL(R[+1]C[-2], "G"))=1, 1, 0) -> 0 | D212: =SUM(RC[-2]:R[+49]C[-2])*2 -> 46 | E212: =SUM(RC[-2]:R[+49]C[-2])*2 -> 2 | F212: =IF(AND(EQUAL(RC[-5], "G"), EQUAL(R[+1]C[-5], "A"), EQUAL(R[+2]C[-5], "T"), EQUAL(R[+3]C[-5], "C"))=1, 1, 0) -> 0
A213: 'T | B213: =IF(EQUAL(RC[-1], "G"), 1, IF(EQUAL(RC[-1], "C"), 1, 0)) -> 0 | C213: =IF(AND(EQUAL(RC[-2], "C"), EQUAL(R[+1]C[-2], "G"))=1, 1, 0) -> 0 | D213: =SUM(RC[-2]:R[+49]C[-2])*2 -> 46 | E213: =SUM(RC[-2]:R[+49]C[-2])*2 -> 2 | F213: =IF(AND(EQUAL(RC[-5], "G"), EQUAL(R[+1]C[-5], "A"), EQUAL(R[+2]C[-5], "T"), EQUAL(R[+3]C[-5], "C"))=1, 1, 0) -> 0
A214: 'C | B214: =IF(EQUAL(RC[-1], "G"), 1, IF(EQUAL(RC[-1], "C"), 1, 0)) -> 1 | C214: =IF(AND(EQUAL(RC[-2], "C"), EQUAL(R[+1]C[-2], "G"))=1, 1, 0) -> 0 | D214: =SUM(RC[-2]:R[+49]C[-2])*2 -> 48 | E214: =SUM(RC[-2]:R[+49]C[-2])*2 -> 2 | F214: =IF(AND(EQUAL(RC[-5], "G"), EQUAL(R[+1]C[-5], "A"), EQUAL(R[+2]C[-5], "T"), EQUAL(R[+3]C[-5], "C"))=1, 1, 0) -> 0
A215: 'T | B215: =IF(EQUAL(RC[-1], "G"), 1, IF(EQUAL(RC[-1], "C"), 1, 0)) -> 0 | C215: =IF(AND(EQUAL(RC[-2], "C"), EQUAL(R[+1]C[-2], "G"))=1, 1, 0) -> 0 | D215: =SUM(RC[-2]:R[+49]C[-2])*2 -> 46 | E215: =SUM(RC[-2]:R[+49]C[-2])*2 -> 2 | F215: =IF(AND(EQUAL(RC[-5], "G"), EQUAL(R[+1]C[-5], "A"), EQUAL(R[+2]C[-5], "T"), EQUAL(R[+3]C[-5], "C"))=1, 1, 0) -> 0
A216: 'G | B216: =IF(EQUAL(RC[-1], "G"), 1, IF(EQUAL(RC[-1], "C"), 1, 0)) -> 1 | C216: =IF(AND(EQUAL(RC[-2], "C"), EQUAL(R[+1]C[-2], "G"))=1, 1, 0) -> 0 | D216: =SUM(RC[-2]:R[+49]C[-2])*2 -> 48 | E216: =SUM(RC[-2]:R[+49]C[-2])*2 -> 2 | F216: =IF(AND(EQUAL(RC[-5], "G"), EQUAL(R[+1]C[-5], "A"), EQUAL(R[+2]C[-5], "T"), EQUAL(R[+3]C[-5], "C"))=1, 1, 0) -> 0
A217: 'G | B217: =IF(EQUAL(RC[-1], "G"), 1, IF(EQUAL(RC[-1], "C"), 1, 0)) -> 1 | C217: =IF(AND(EQUAL(RC[-2], "C"), EQUAL(R[+1]C[-2], "G"))=1, 1, 0) -> 0 | D217: =SUM(RC[-2]:R[+49]C[-2])*2 -> 48 | E217: =SUM(RC[-2]:R[+49]C[-2])*2 -> 2 | F217: =IF(AND(EQUAL(RC[-5], "G"), EQUAL(R[+1]C[-5], "A"), EQUAL(R[+2]C[-5], "T"), EQUAL(R[+3]C[-5], "C"))=1, 1, 0) -> 0
A218: 'G | B218: =IF(EQUAL(RC[-1], "G"), 1, IF(EQUAL(RC[-1], "C"), 1, 0)) -> 1 | C218: =IF(AND(EQUAL(RC[-2], "C"), EQUAL(R[+1]C[-2], "G"))=1, 1, 0) -> 0 | D218: =SUM(RC[-2]:R[+49]C[-2])*2 -> 48 | E218: =SUM(RC[-2]:R[+49]C[-2])*2 -> 2 | F218: =IF(AND(EQUAL(RC[-5], "G"), EQUAL(R[+1]C[-5], "A"), EQUAL(R[+2]C[-5], "T"), EQUAL(R[+3]C[-5], "C"))=1, 1, 0) -> 0
A219: 'T | B219: =IF(EQUAL(RC[-1], "G"), 1, IF(EQUAL(RC[-1], "C"), 1, 0)) -> 0 | C219: =IF(AND(EQUAL(RC[-2], "C"), EQUAL(R[+1]C[-2], "G"))=1, 1, 0) -> 0 | D219: =SUM(RC[-2]:R[+49]C[-2])*2 -> 48 | E219: =SUM(RC[-2]:R[+49]C[-2])*2 -> 2 | F219: =IF(AND(EQUAL(RC[-5], "G"), EQUAL(R[+1]C[-5], "A"), EQUAL(R[+2]C[-5], "T"), EQUAL(R[+3]C[-5], "C"))=1, 1, 0) -> 0
A220: 'A | B220: =IF(EQUAL(RC[-1], "G"), 1, IF(EQUAL(RC[-1], "C"), 1, 0)) -> 0 | C220: =IF(AND(EQUAL(RC[-2], "C"), EQUAL(R[+1]C[-2], "G"))=1, 1, 0) -> 0 | D220: =SUM(RC[-2]:R[+49]C[-2])*2 -> 48 | E220: =SUM(RC[-2]:R[+49]C[-2])*2 -> 2 | F220: =IF(AND(EQUAL(RC[-5], "G"), EQUAL(R[+1]C[-5], "A"), EQUAL(R[+2]C[-5], "T"), EQUAL(R[+3]C[-5], "C"))=1, 1, 0) -> 0
A221: 'G | B221: =IF(EQUAL(RC[-1], "G"), 1, IF(EQUAL(RC[-1], "C"), 1, 0)) -> 1 | C221: =IF(AND(EQUAL(RC[-2], "C"), EQUAL(R[+1]C[-2], "G"))=1, 1, 0) -> 0 | D221: =SUM(RC[-2]:R[+49]C[-2])*2 -> 48 | E221: =SUM(RC[-2]:R[+49]C[-2])*2 -> 2 | F221: =IF(AND(EQUAL(RC[-5], "G"), EQUAL(R[+1]C[-5], "A"), EQUAL(R[+2]C[-5], "T"), EQUAL(R[+3]C[-5], "C"))=1, 1, 0) -> 0
A222: 'G | B222: =IF(EQUAL(RC[-1], "G"), 1, IF(EQUAL(RC[-1], "C"), 1, 0)) -> 1 | C222: =IF(AND(EQUAL(RC[-2], "C"), EQUAL(R[+1]C[-2], "G"))=1, 1, 0) -> 0 | D222: =SUM(RC[-2]:R[+49]C[-2])*2 -> 46 | E222: =SUM(RC[-2]:R[+49]C[-2])*2 -> 2 | F222: =IF(AND(EQUAL(RC[-5], "G"), EQUAL(R[+1]C[-5], "A"), EQUAL(R[+2]C[-5], "T"), EQUAL(R[+3]C[-5], "C"))=1, 1, 0) -> 0
A223: 'T | B223: =IF(EQUAL(RC[-1], "G"), 1, IF(EQUAL(RC[-1], "C"), 1, 0)) -> 0 | C223: =IF(AND(EQUAL(RC[-2], "C"), EQUAL(R[+1]C[-2], "G"))=1, 1, 0) -> 0 | D223: =SUM(RC[-2]:R[+49]C[-2])*2 -> 44 | E223: =SUM(RC[-2]:R[+49]C[-2])*2 -> 2 | F223: =IF(AND(EQUAL(RC[-5], "G"), EQUAL(R[+1]C[-5], "A"), EQUAL(R[+2]C[-5], "T"), EQUAL(R[+3]C[-5], "C"))=1, 1, 0) -> 0
A224: 'T | B224: =IF(EQUAL(RC[-1], "G"), 1, IF(EQUAL(RC[-1], "C"), 1, 0)) -> 0 | C224: =IF(AND(EQUAL(RC[-2], "C"), EQUAL(R[+1]C[-2], "G"))=1, 1, 0) -> 0 | D224: =SUM(RC[-2]:R[+49]C[-2])*2 -> 44 | E224: =SUM(RC[-2]:R[+49]C[-2])*2 -> 2 | F224: =IF(AND(EQUAL(RC[-5], "G"), EQUAL(R[+1]C[-5], "A"), EQUAL(R[+2]C[-5], "T"), EQUAL(R[+3]C[-5], "C"))=1, 1, 0) -> 0
A225: 'G | B225: =IF(EQUAL(RC[-1], "G"), 1, IF(EQUAL(RC[-1], "C"), 1, 0)) -> 1 | C225: =IF(AND(EQUAL(RC[-2], "C"), EQUAL(R[+1]C[-2], "G"))=1, 1, 0) -> 0 | D225: =SUM(RC[-2]:R[+49]C[-2])*2 -> 44 | E225: =SUM(RC[-2]:R[+49]C[-2])*2 -> 2 | F225: =IF(AND(EQUAL(RC[-5], "G"), EQUAL(R[+1]C[-5], "A"), EQUAL(R[+2]C[-5], "T"), EQUAL(R[+3]C[-5], "C"))=1, 1, 0) -> 0
A226: 'A | B226: =IF(EQUAL(RC[-1], "G"), 1, IF(EQUAL(RC[-1], "C"), 1, 0)) -> 0 | C226: =IF(AND(EQUAL(RC[-2], "C"), EQUAL(R[+1]C[-2], "G"))=1, 1, 0) -> 0 | D226: =SUM(RC[-2]:R[+49]C[-2])*2 -> 44 | E226: =SUM(RC[-2]:R[+49]C[-2])*2 -> 2 | F226: =IF(AND(EQUAL(RC[-5], "G"), EQUAL(R[+1]C[-5], "A"), EQUAL(R[+2]C[-5], "T"), EQUAL(R[+3]C[-5], "C"))=1, 1, 0) -> 0
A227: 'A | B227: =IF(EQUAL(RC[-1], "G"), 1, IF(EQUAL(RC[-1], "C"), 1, 0)) -> 0 | C227: =IF(AND(EQUAL(RC[-2], "C"), EQUAL(R[+1]C[-2], "G"))=1, 1, 0) -> 0 | D227: =SUM(RC[-2]:R[+49]C[-2])*2 -> 46 | E227: =SUM(RC[-2]:R[+49]C[-2])*2 -> 2 | F227: =IF(AND(EQUAL(RC[-5], "G"), EQUAL(R[+1]C[-5], "A"), EQUAL(R[+2]C[-5], "T"), EQUAL(R[+3]C[-5], "C"))=1, 1, 0) -> 0
A228: 'T | B228: =IF(EQUAL(RC[-1], "G"), 1, IF(EQUAL(RC[-1], "C"), 1, 0)) -> 0 | C228: =IF(AND(EQUAL(RC[-2], "C"), EQUAL(R[+1]C[-2], "G"))=1, 1, 0) -> 0 | D228: =SUM(RC[-2]:R[+49]C[-2])*2 -> 48 | E228: =SUM(RC[-2]:R[+49]C[-2])*2 -> 2 | F228: =IF(AND(EQUAL(RC[-5], "G"), EQUAL(R[+1]C[-5], "A"), EQUAL(R[+2]C[-5], "T"), EQUAL(R[+3]C[-5], "C"))=1, 1, 0) -> 0
A229: 'A | B229: =IF(EQUAL(RC[-1], "G"), 1, IF(EQUAL(RC[-1], "C"), 1, 0)) -> 0 | C229: =IF(AND(EQUAL(RC[-2], "C"), EQUAL(R[+1]C[-2], "G"))=1, 1, 0) -> 0 | D229: =SUM(RC[-2]:R[+49]C[-2])*2 -> 48 | E229: =SUM(RC[-2]:R[+49]C[-2])*2 -> 2 | F229: =IF(AND(EQUAL(RC[-5], "G"), EQUAL(R[+1]C[-5], "A"), EQUAL(R[+2]C[-5], "T"), EQUAL(R[+3]C[-5], "C"))=1, 1, 0) -> 0
A230: 'T | B230: =IF(EQUAL(RC[-1], "G"), 1, IF(EQUAL(RC[-1], "C"), 1, 0)) -> 0 | C230: =IF(AND(EQUAL(RC[-2], "C"), EQUAL(R[+1]C[-2], "G"))=1, 1, 0) -> 0 | D230: =SUM(RC[-2]:R[+49]C[-2])*2 -> 48 | E230: =SUM(RC[-2]:R[+49]C[-2])*2 -> 2 | F230: =IF(AND(EQUAL(RC[-5], "G"), EQUAL(R[+1]C[-5], "A"), EQUAL(R[+2]C[-5], "T"), EQUAL(R[+3]C[-5], "C"))=1, 1, 0) -> 0
A231: 'A | B231: =IF(EQUAL(RC[-1], "G"), 1, IF(EQUAL(RC[-1], "C"), 1, 0)) -> 0 | C231: =IF(AND(EQUAL(RC[-2], "C"), EQUAL(R[+1]C[-2], "G"))=1, 1, 0) -> 0 | D231: =SUM(RC[-2]:R[+49]C[-2])*2 -> 48 | E231: =SUM(RC[-2]:R[+49]C[-2])*2 -> 2 | F231: =IF(AND(EQUAL(RC[-5], "G"), EQUAL(R[+1]C[-5], "A"), EQUAL(R[+2]C[-5], "T"), EQUAL(R[+3]C[-5], "C"))=1, 1, 0) -> 0
A232: 'C | B232: =IF(EQUAL(RC[-1], "G"), 1, IF(EQUAL(RC[-1], "C"), 1, 0)) -> 1 | C232: =IF(AND(EQUAL(RC[-2], "C"), EQUAL(R[+1]C[-2], "G"))=1, 1, 0) -> 0 | D232: =SUM(RC[-2]:R[+49]C[-2])*2 -> 50 | E232: =SUM(RC[-2]:R[+49]C[-2])*2 -> 2 | F232: =IF(AND(EQUAL(RC[-5], "G"), EQUAL(R[+1]C[-5], "A"), EQUAL(R[+2]C[-5], "T"), EQUAL(R[+3]C[-5], "C"))=1, 1, 0) -> 0
A233: 'A | B233: =IF(EQUAL(RC[-1], "G"), 1, IF(EQUAL(RC[-1], "C"), 1, 0)) -> 0 | C233: =IF(AND(EQUAL(RC[-2], "C"), EQUAL(R[+1]C[-2], "G"))=1, 1, 0) -> 0 | D233: =SUM(RC[-2]:R[+49]C[-2])*2 -> 48 | E233: =SUM(RC[-2]:R[+49]C[-2])*2 -> 2 | F233: =IF(AND(EQUAL(RC[-5], "G"), EQUAL(R[+1]C[-5], "A"), EQUAL(R[+2]C[-5], "T"), EQUAL(R[+3]C[-5], "C"))=1, 1, 0) -> 0
A234: 'T | B234: =IF(EQUAL(RC[-1], "G"), 1, IF(EQUAL(RC[-1], "C"), 1, 0)) -> 0 | C234: =IF(AND(EQUAL(RC[-2], "C"), EQUAL(R[+1]C[-2], "G"))=1, 1, 0) -> 0 | D234: =SUM(RC[-2]:R[+49]C[-2])*2 -> 50 | E234: =SUM(RC[-2]:R[+49]C[-2])*2 -> 2 | F234: =IF(AND(EQUAL(RC[-5], "G"), EQUAL(R[+1]C[-5], "A"), EQUAL(R[+2]C[-5], "T"), EQUAL(R[+3]C[-5], "C"))=1, 1, 0) -> 0
A235: 'G | B235: =IF(EQUAL(RC[-1], "G"), 1, IF(EQUAL(RC[-1], "C"), 1, 0)) -> 1 | C235: =IF(AND(EQUAL(RC[-2], "C"), EQUAL(R[+1]C[-2], "G"))=1, 1, 0) -> 0 | D235: =SUM(RC[-2]:R[+49]C[-2])*2 -> 50 | E235: =SUM(RC[-2]:R[+49]C[-2])*2 -> 2 | F235: =IF(AND(EQUAL(RC[-5], "G"), EQUAL(R[+1]C[-5], "A"), EQUAL(R[+2]C[-5], "T"), EQUAL(R[+3]C[-5], "C"))=1, 1, 0) -> 0
A236: 'C | B236: =IF(EQUAL(RC[-1], "G"), 1, IF(EQUAL(RC[-1], "C"), 1, 0)) -> 1 | C236: =IF(AND(EQUAL(RC[-2], "C"), EQUAL(R[+1]C[-2], "G"))=1, 1, 0) -> 0 | D236: =SUM(RC[-2]:R[+49]C[-2])*2 -> 50 | E236: =SUM(RC[-2]:R[+49]C[-2])*2 -> 2 | F236: =IF(AND(EQUAL(RC[-5], "G"), EQUAL(R[+1]C[-5], "A"), EQUAL(R[+2]C[-5], "T"), EQUAL(R[+3]C[-5], "C"))=1, 1, 0) -> 0
A237: 'T | B237: =IF(EQUAL(RC[-1], "G"), 1, IF(EQUAL(RC[-1], "C"), 1, 0)) -> 0 | C237: =IF(AND(EQUAL(RC[-2], "C"), EQUAL(R[+1]C[-2], "G"))=1, 1, 0) -> 0 | D237: =SUM(RC[-2]:R[+49]C[-2])*2 -> 50 | E237: =SUM(RC[-2]:R[+49]C[-2])*2 -> 2 | F237: =IF(AND(EQUAL(RC[-5], "G"), EQUAL(R[+1]C[-5], "A"), EQUAL(R[+2]C[-5], "T"), EQUAL(R[+3]C[-5], "C"))=1, 1, 0) -> 0
A238: 'G | B238: =IF(EQUAL(RC[-1], "G"), 1, IF(EQUAL(RC[-1], "C"), 1, 0)) -> 1 | C238: =IF(AND(EQUAL(RC[-2], "C"), EQUAL(R[+1]C[-2], "G"))=1, 1, 0) -> 0 | D238: =SUM(RC[-2]:R[+49]C[-2])*2 -> 50 | E238: =SUM(RC[-2]:R[+49]C[-2])*2 -> 2 | F238: =IF(AND(EQUAL(RC[-5], "G"), EQUAL(R[+1]C[-5], "A"), EQUAL(R[+2]C[-5], "T"), EQUAL(R[+3]C[-5], "C"))=1, 1, 0) -> 0
A239: 'C | B239: =IF(EQUAL(RC[-1], "G"), 1, IF(EQUAL(RC[-1], "C"), 1, 0)) -> 1 | C239: =IF(AND(EQUAL(RC[-2], "C"), EQUAL(R[+1]C[-2], "G"))=1, 1, 0) -> 1 | D239: =SUM(RC[-2]:R[+49]C[-2])*2 -> 48 | E239: =SUM(RC[-2]:R[+49]C[-2])*2 -> 2 | F239: =IF(AND(EQUAL(RC[-5], "G"), EQUAL(R[+1]C[-5], "A"), EQUAL(R[+2]C[-5], "T"), EQUAL(R[+3]C[-5], "C"))=1, 1, 0) -> 0
A240: 'G | B240: =IF(EQUAL(RC[-1], "G"), 1, IF(EQUAL(RC[-1], "C"), 1, 0)) -> 1 | C240: =IF(AND(EQUAL(RC[-2], "C"), EQUAL(R[+1]C[-2], "G"))=1, 1, 0) -> 0 | D240: =SUM(RC[-2]:R[+49]C[-2])*2 -> 46 | E240: =SUM(RC[-2]:R[+49]C[-2])*2 -> 0 | F240: =IF(AND(EQUAL(RC[-5], "G"), EQUAL(R[+1]C[-5], "A"), EQUAL(R[+2]C[-5], "T"), EQUAL(R[+3]C[-5], "C"))=1, 1, 0) -> 0
A241: 'A | B241: =IF(EQUAL(RC[-1], "G"), 1, IF(EQUAL(RC[-1], "C"), 1, 0)) -> 0 | C241: =IF(AND(EQUAL(RC[-2], "C"), EQUAL(R[+1]C[-2], "G"))=1, 1, 0) -> 0 | D241: =SUM(RC[-2]:R[+49]C[-2])*2 -> 46 | E241: =SUM(RC[-2]:R[+49]C[-2])*2 -> 0 | F241: =IF(AND(EQUAL(RC[-5], "G"), EQUAL(R[+1]C[-5], "A"), EQUAL(R[+2]C[-5], "T"), EQUAL(R[+3]C[-5], "C"))=1, 1, 0) -> 0
A242: 'C | B242: =IF(EQUAL(RC[-1], "G"), 1, IF(EQUAL(RC[-1], "C"), 1, 0)) -> 1 | C242: =IF(AND(EQUAL(RC[-2], "C"), EQUAL(R[+1]C[-2], "G"))=1, 1, 0) -> 0 | D242: =SUM(RC[-2]:R[+49]C[-2])*2 -> 48 | E242: =SUM(RC[-2]:R[+49]C[-2])*2 -> 0 | F242: =IF(AND(EQUAL(RC[-5], "G"), EQUAL(R[+1]C[-5], "A"), EQUAL(R[+2]C[-5], "T"), EQUAL(R[+3]C[-5], "C"))=1, 1, 0) -> 0
A243: 'T | B243: =IF(EQUAL(RC[-1], "G"), 1, IF(EQUAL(RC[-1], "C"), 1, 0)) -> 0 | C243: =IF(AND(EQUAL(RC[-2], "C"), EQUAL(R[+1]C[-2], "G"))=1, 1, 0) -> 0 | D243: =SUM(RC[-2]:R[+49]C[-2])*2 -> 46 | E243: =SUM(RC[-2]:R[+49]C[-2])*2 -> 0 | F243: =IF(AND(EQUAL(RC[-5], "G"), EQUAL(R[+1]C[-5], "A"), EQUAL(R[+2]C[-5], "T"), EQUAL(R[+3]C[-5], "C"))=1, 1, 0) -> 0
A244: 'A | B244: =IF(EQUAL(RC[-1], "G"), 1, IF(EQUAL(RC[-1], "C"), 1, 0)) -> 0 | C244: =IF(AND(EQUAL(RC[-2], "C"), EQUAL(R[+1]C[-2], "G"))=1, 1, 0) -> 0 | D244: =SUM(RC[-2]:R[+49]C[-2])*2 -> 48 | E244: =SUM(RC[-2]:R[+49]C[-2])*2 -> 0 | F244: =IF(AND(EQUAL(RC[-5], "G"), EQUAL(R[+1]C[-5], "A"), EQUAL(R[+2]C[-5], "T"), EQUAL(R[+3]C[-5], "C"))=1, 1, 0) -> 0
A245: 'A | B245: =IF(EQUAL(RC[-1], "G"), 1, IF(EQUAL(RC[-1], "C"), 1, 0)) -> 0 | C245: =IF(AND(EQUAL(RC[-2], "C"), EQUAL(R[+1]C[-2], "G"))=1, 1, 0) -> 0 | D245: =SUM(RC[-2]:R[+49]C[-2])*2 -> 50 | E245: =SUM(RC[-2]:R[+49]C[-2])*2 -> 0 | F245: =IF(AND(EQUAL(RC[-5], "G"), EQUAL(R[+1]C[-5], "A"), EQUAL(R[+2]C[-5], "T"), EQUAL(R[+3]C[-5], "C"))=1, 1, 0) -> 0
A246: 'T | B246: =IF(EQUAL(RC[-1], "G"), 1, IF(EQUAL(RC[-1], "C"), 1, 0)) -> 0 | C246: =IF(AND(EQUAL(RC[-2], "C"), EQUAL(R[+1]C[-2], "G"))=1, 1, 0) -> 0 | D246: =SUM(RC[-2]:R[+49]C[-2])*2 -> 52 | E246: =SUM(RC[-2]:R[+49]C[-2])*2 -> 0 | F246: =IF(AND(EQUAL(RC[-5], "G"), EQUAL(R[+1]C[-5], "A"), EQUAL(R[+2]C[-5], "T"), EQUAL(R[+3]C[-5], "C"))=1, 1, 0) -> 0
A247: 'C | B247: =IF(EQUAL(RC[-1], "G"), 1, IF(EQUAL(RC[-1], "C"), 1, 0)) -> 1 | C247: =IF(AND(EQUAL(RC[-2], "C"), EQUAL(R[+1]C[-2], "G"))=1, 1, 0) -> 0 | D247: =SUM(RC[-2]:R[+49]C[-2])*2 -> 52 | E247: =SUM(RC[-2]:R[+49]C[-2])*2 -> 0 | F247: =IF(AND(EQUAL(RC[-5], "G"), EQUAL(R[+1]C[-5], "A"), EQUAL(R[+2]C[-5], "T"), EQUAL(R[+3]C[-5], "C"))=1, 1, 0) -> 0
A248: 'C | B248: =IF(EQUAL(RC[-1], "G"), 1, IF(EQUAL(RC[-1], "C"), 1, 0)) -> 1 | C248: =IF(AND(EQUAL(RC[-2], "C"), EQUAL(R[+1]C[-2], "G"))=1, 1, 0) -> 0 | D248: =SUM(RC[-2]:R[+49]C[-2])*2 -> 50 | E248: =SUM(RC[-2]:R[+49]C[-2])*2 -> 0 | F248: =IF(AND(EQUAL(RC[-5], "G"), EQUAL(R[+1]C[-5], "A"), EQUAL(R[+2]C[-5], "T"), EQUAL(R[+3]C[-5], "C"))=1, 1, 0) -> 0
A249: 'T | B249: =IF(EQUAL(RC[-1], "G"), 1, IF(EQUAL(RC[-1], "C"), 1, 0)) -> 0 | C249: =IF(AND(EQUAL(RC[-2], "C"), EQUAL(R[+1]C[-2], "G"))=1, 1, 0) -> 0 | D249: =SUM(RC[-2]:R[+49]C[-2])*2 -> 48 | E249: =SUM(RC[-2]:R[+49]C[-2])*2 -> 0 | F249: =IF(AND(EQUAL(RC[-5], "G"), EQUAL(R[+1]C[-5], "A"), EQUAL(R[+2]C[-5], "T"), EQUAL(R[+3]C[-5], "C"))=1, 1, 0) -> 0
A250: 'C | B250: =IF(EQUAL(RC[-1], "G"), 1, IF(EQUAL(RC[-1], "C"), 1, 0)) -> 1 | C250: =IF(AND(EQUAL(RC[-2], "C"), EQUAL(R[+1]C[-2], "G"))=1, 1, 0) -> 0 | D250: =SUM(RC[-2]:R[+49]C[-2])*2 -> 48 | E250: =SUM(RC[-2]:R[+49]C[-2])*2 -> 0 | F250: =IF(AND(EQUAL(RC[-5], "G"), EQUAL(R[+1]C[-5], "A"), EQUAL(R[+2]C[-5], "T"), EQUAL(R[+3]C[-5], "C"))=1, 1, 0) -> 0
A251: 'C | B251: =IF(EQUAL(RC[-1], "G"), 1, IF(EQUAL(RC[-1], "C"), 1, 0)) -> 1 | C251: =IF(AND(EQUAL(RC[-2], "C"), EQUAL(R[+1]C[-2], "G"))=1, 1, 0) -> 0 | D251: =SUM(RC[-2]:R[+49]C[-2])*2 -> 46 | E251: =SUM(RC[-2]:R[+49]C[-2])*2 -> 0 | F251: =IF(AND(EQUAL(RC[-5], "G"), EQUAL(R[+1]C[-5], "A"), EQUAL(R[+2]C[-5], "T"), EQUAL(R[+3]C[-5], "C"))=1, 1, 0) -> 0
A252: 'T | B252: =IF(EQUAL(RC[-1], "G"), 1, IF(EQUAL(RC[-1], "C"), 1, 0)) -> 0 | C252: =IF(AND(EQUAL(RC[-2], "C"), EQUAL(R[+1]C[-2], "G"))=1, 1, 0) -> 0 | D252: =SUM(RC[-2]:R[+49]C[-2])*2 -> 46 | E252: =SUM(RC[-2]:R[+49]C[-2])*2 -> 0 | F252: =IF(AND(EQUAL(RC[-5], "G"), EQUAL(R[+1]C[-5], "A"), EQUAL(R[+2]C[-5], "T"), EQUAL(R[+3]C[-5], "C"))=1, 1, 0) -> 0
A253: 'T | B253: =IF(EQUAL(RC[-1], "G"), 1, IF(EQUAL(RC[-1], "C"), 1, 0)) -> 0 | C253: =IF(AND(EQUAL(RC[-2], "C"), EQUAL(R[+1]C[-2], "G"))=1, 1, 0) -> 0 | D253: =SUM(RC[-2]:R[+49]C[-2])*2 -> 48 | E253: =SUM(RC[-2]:R[+49]C[-2])*2 -> 0 | F253: =IF(AND(EQUAL(RC[-5], "G"), EQUAL(R[+1]C[-5], "A"), EQUAL(R[+2]C[-5], "T"), EQUAL(R[+3]C[-5], "C"))=1, 1, 0) -> 0
A254: 'T | B254: =IF(EQUAL(RC[-1], "G"), 1, IF(EQUAL(RC[-1], "C"), 1, 0)) -> 0 | C254: =IF(AND(EQUAL(RC[-2], "C"), EQUAL(R[+1]C[-2], "G"))=1, 1, 0) -> 0 | D254: =SUM(RC[-2]:R[+49]C[-2])*2 -> 48 | E254: =SUM(RC[-2]:R[+49]C[-2])*2 -> 0 | F254: =IF(AND(EQUAL(RC[-5], "G"), EQUAL(R[+1]C[-5], "A"), EQUAL(R[+2]C[-5], "T"), EQUAL(R[+3]C[-5], "C"))=1, 1, 0) -> 0
A255: 'C | B255: =IF(EQUAL(RC[-1], "G"), 1, IF(EQUAL(RC[-1], "C"), 1, 0)) -> 1 | C255: =IF(AND(EQUAL(RC[-2], "C"), EQUAL(R[+1]C[-2], "G"))=1, 1, 0) -> 0 | D255: =SUM(RC[-2]:R[+49]C[-2])*2 -> 50 | E255: =SUM(RC[-2]:R[+49]C[-2])*2 -> 0 | F255: =IF(AND(EQUAL(RC[-5], "G"), EQUAL(R[+1]C[-5], "A"), EQUAL(R[+2]C[-5], "T"), EQUAL(R[+3]C[-5], "C"))=1, 1, 0) -> 0
A256: 'C | B256: =IF(EQUAL(RC[-1], "G"), 1, IF(EQUAL(RC[-1], "C"), 1, 0)) -> 1 | C256: =IF(AND(EQUAL(RC[-2], "C"), EQUAL(R[+1]C[-2], "G"))=1, 1, 0) -> 0 | D256: =SUM(RC[-2]:R[+49]C[-2])*2 -> 48 | E256: =SUM(RC[-2]:R[+49]C[-2])*2 -> 0 | F256: =IF(AND(EQUAL(RC[-5], "G"), EQUAL(R[+1]C[-5], "A"), EQUAL(R[+2]C[-5], "T"), EQUAL(R[+3]C[-5], "C"))=1, 1, 0) -> 0
A257: 'T | B257: =IF(EQUAL(RC[-1], "G"), 1, IF(EQUAL(RC[-1], "C"), 1, 0)) -> 0 | C257: =IF(AND(EQUAL(RC[-2], "C"), EQUAL(R[+1]C[-2], "G"))=1, 1, 0) -> 0 | D257: =SUM(RC[-2]:R[+49]C[-2])*2 -> 48 | E257: =SUM(RC[-2]:R[+49]C[-2])*2 -> 0 | F257: =IF(AND(EQUAL(RC[-5], "G"), EQUAL(R[+1]C[-5], "A"), EQUAL(R[+2]C[-5], "T"), EQUAL(R[+3]C[-5], "C"))=1, 1, 0) -> 0
A258: 'G | B258: =IF(EQUAL(RC[-1], "G"), 1, IF(EQUAL(RC[-1], "C"), 1, 0)) -> 1 | C258: =IF(AND(EQUAL(RC[-2], "C"), EQUAL(R[+1]C[-2], "G"))=1, 1, 0) -> 0 | D258: =SUM(RC[-2]:R[+49]C[-2])*2 -> 48 | E258: =SUM(RC[-2]:R[+49]C[-2])*2 -> 0 | F258: =IF(AND(EQUAL(RC[-5], "G"), EQUAL(R[+1]C[-5], "A"), EQUAL(R[+2]C[-5], "T"), EQUAL(R[+3]C[-5], "C"))=1, 1, 0) -> 0
A259: 'G | B259: =IF(EQUAL(RC[-1], "G"), 1, IF(EQUAL(RC[-1], "C"), 1, 0)) -> 1 | C259: =IF(AND(EQUAL(RC[-2], "C"), EQUAL(R[+1]C[-2], "G"))=1, 1, 0) -> 0 | D259: =SUM(RC[-2]:R[+49]C[-2])*2 -> 46 | E259: =SUM(RC[-2]:R[+49]C[-2])*2 -> 0 | F259: =IF(AND(EQUAL(RC[-5], "G"), EQUAL(R[+1]C[-5], "A"), EQUAL(R[+2]C[-5], "T"), EQUAL(R[+3]C[-5], "C"))=1, 1, 0) -> 0
A260: 'T | B260: =IF(EQUAL(RC[-1], "G"), 1, IF(EQUAL(RC[-1], "C"), 1, 0)) -> 0 | C260: =IF(AND(EQUAL(RC[-2], "C"), EQUAL(R[+1]C[-2], "G"))=1, 1, 0) -> 0 | D260: =SUM(RC[-2]:R[+49]C[-2])*2 -> 44 | E260: =SUM(RC[-2]:R[+49]C[-2])*2 -> 0 | F260: =IF(AND(EQUAL(RC[-5], "G"), EQUAL(R[+1]C[-5], "A"), EQUAL(R[+2]C[-5], "T"), EQUAL(R[+3]C[-5], "C"))=1, 1, 0) -> 0
A261: 'A | B261: =IF(EQUAL(RC[-1], "G"), 1, IF(EQUAL(RC[-1], "C"), 1, 0)) -> 0 | C261: =IF(AND(EQUAL(RC[-2], "C"), EQUAL(R[+1]C[-2], "G"))=1, 1, 0) -> 0 | D261: =SUM(RC[-2]:R[+49]C[-2])*2 -> 44 | E261: =SUM(RC[-2]:R[+49]C[-2])*2 -> 0 | F261: =IF(AND(EQUAL(RC[-5], "G"), EQUAL(R[+1]C[-5], "A"), EQUAL(R[+2]C[-5], "T"), EQUAL(R[+3]C[-5], "C"))=1, 1, 0) -> 0
A262: 'G | B262: =IF(EQUAL(RC[-1], "G"), 1, IF(EQUAL(RC[-1], "C"), 1, 0)) -> 1 | C262: =IF(AND(EQUAL(RC[-2], "C"), EQUAL(R[+1]C[-2], "G"))=1, 1, 0) -> 0 | D262: =SUM(RC[-2]:R[+49]C[-2])*2 -> 44 | E262: =SUM(RC[-2]:R[+49]C[-2])*2 -> 0 | F262: =IF(AND(EQUAL(RC[-5], "G"), EQUAL(R[+1]C[-5], "A"), EQUAL(R[+2]C[-5], "T"), EQUAL(R[+3]C[-5], "C"))=1, 1, 0) -> 0
A263: 'C | B263: =IF(EQUAL(RC[-1], "G"), 1, IF(EQUAL(RC[-1], "C"), 1, 0)) -> 1 | C263: =IF(AND(EQUAL(RC[-2], "C"), EQUAL(R[+1]C[-2], "G"))=1, 1, 0) -> 0 | D263: =SUM(RC[-2]:R[+49]C[-2])*2 -> 44 | E263: =SUM(RC[-2]:R[+49]C[-2])*2 -> 0 | F263: =IF(AND(EQUAL(RC[-5], "G"), EQUAL(R[+1]C[-5], "A"), EQUAL(R[+2]C[-5], "T"), EQUAL(R[+3]C[-5], "C"))=1, 1, 0) -> 0
A264: 'T | B264: =IF(EQUAL(RC[-1], "G"), 1, IF(EQUAL(RC[-1], "C"), 1, 0)) -> 0 | C264: =IF(AND(EQUAL(RC[-2], "C"), EQUAL(R[+1]C[-2], "G"))=1, 1, 0) -> 0 | D264: =SUM(RC[-2]:R[+49]C[-2])*2 -> 42 | E264: =SUM(RC[-2]:R[+49]C[-2])*2 -> 0 | F264: =IF(AND(EQUAL(RC[-5], "G"), EQUAL(R[+1]C[-5], "A"), EQUAL(R[+2]C[-5], "T"), EQUAL(R[+3]C[-5], "C"))=1, 1, 0) -> 0
A265: 'G | B265: =IF(EQUAL(RC[-1], "G"), 1, IF(EQUAL(RC[-1], "C"), 1, 0)) -> 1 | C265: =IF(AND(EQUAL(RC[-2], "C"), EQUAL(R[+1]C[-2], "G"))=1, 1, 0) -> 0 | D265: =SUM(RC[-2]:R[+49]C[-2])*2 -> 42 | E265: =SUM(RC[-2]:R[+49]C[-2])*2 -> 0 | F265: =IF(AND(EQUAL(RC[-5], "G"), EQUAL(R[+1]C[-5], "A"), EQUAL(R[+2]C[-5], "T"), EQUAL(R[+3]C[-5], "C"))=1, 1, 0) -> 0
A266: 'G | B266: =IF(EQUAL(RC[-1], "G"), 1, IF(EQUAL(RC[-1], "C"), 1, 0)) -> 1 | C266: =IF(AND(EQUAL(RC[-2], "C"), EQUAL(R[+1]C[-2], "G"))=1, 1, 0) -> 0 | D266: =SUM(RC[-2]:R[+49]C[-2])*2 -> 40 | E266: =SUM(RC[-2]:R[+49]C[-2])*2 -> 0 | F266: =IF(AND(EQUAL(RC[-5], "G"), EQUAL(R[+1]C[-5], "A"), EQUAL(R[+2]C[-5], "T"), EQUAL(R[+3]C[-5], "C"))=1, 1, 0) -> 0
A267: 'G | B267: =IF(EQUAL(RC[-1], "G"), 1, IF(EQUAL(RC[-1], "C"), 1, 0)) -> 1 | C267: =IF(AND(EQUAL(RC[-2], "C"), EQUAL(R[+1]C[-2], "G"))=1, 1, 0) -> 0 | D267: =SUM(RC[-2]:R[+49]C[-2])*2 -> 38 | E267: =SUM(RC[-2]:R[+49]C[-2])*2 -> 0 | F267: =IF(AND(EQUAL(RC[-5], "G"), EQUAL(R[+1]C[-5], "A"), EQUAL(R[+2]C[-5], "T"), EQUAL(R[+3]C[-5], "C"))=1, 1, 0) -> 0
A268: 'C | B268: =IF(EQUAL(RC[-1], "G"), 1, IF(EQUAL(RC[-1], "C"), 1, 0)) -> 1 | C268: =IF(AND(EQUAL(RC[-2], "C"), EQUAL(R[+1]C[-2], "G"))=1, 1, 0) -> 0 | D268: =SUM(RC[-2]:R[+49]C[-2])*2 -> 38 | E268: =SUM(RC[-2]:R[+49]C[-2])*2 -> 0 | F268: =IF(AND(EQUAL(RC[-5], "G"), EQUAL(R[+1]C[-5], "A"), EQUAL(R[+2]C[-5], "T"), EQUAL(R[+3]C[-5], "C"))=1, 1, 0) -> 0
A269: 'A | B269: =IF(EQUAL(RC[-1], "G"), 1, IF(EQUAL(RC[-1], "C"), 1, 0)) -> 0 | C269: =IF(AND(EQUAL(RC[-2], "C"), EQUAL(R[+1]C[-2], "G"))=1, 1, 0) -> 0 | D269: =SUM(RC[-2]:R[+49]C[-2])*2 -> 38 | E269: =SUM(RC[-2]:R[+49]C[-2])*2 -> 0 | F269: =IF(AND(EQUAL(RC[-5], "G"), EQUAL(R[+1]C[-5], "A"), EQUAL(R[+2]C[-5], "T"), EQUAL(R[+3]C[-5], "C"))=1, 1, 0) -> 0
A270: 'T | B270: =IF(EQUAL(RC[-1], "G"), 1, IF(EQUAL(RC[-1], "C"), 1, 0)) -> 0 | C270: =IF(AND(EQUAL(RC[-2], "C"), EQUAL(R[+1]C[-2], "G"))=1, 1, 0) -> 0 | D270: =SUM(RC[-2]:R[+49]C[-2])*2 -> 40 | E270: =SUM(RC[-2]:R[+49]C[-2])*2 -> 0 | F270: =IF(AND(EQUAL(RC[-5], "G"), EQUAL(R[+1]C[-5], "A"), EQUAL(R[+2]C[-5], "T"), EQUAL(R[+3]C[-5], "C"))=1, 1, 0) -> 0
A271: 'A | B271: =IF(EQUAL(RC[-1], "G"), 1, IF(EQUAL(RC[-1], "C"), 1, 0)) -> 0 | C271: =IF(AND(EQUAL(RC[-2], "C"), EQUAL(R[+1]C[-2], "G"))=1, 1, 0) -> 0 | D271: =SUM(RC[-2]:R[+49]C[-2])*2 -> 40 | E271: =SUM(RC[-2]:R[+49]C[-2])*2 -> 0 | F271: =IF(AND(EQUAL(RC[-5], "G"), EQUAL(R[+1]C[-5], "A"), EQUAL(R[+2]C[-5], "T"), EQUAL(R[+3]C[-5], "C"))=1, 1, 0) -> 0
A272: 'T | B272: =IF(EQUAL(RC[-1], "G"), 1, IF(EQUAL(RC[-1], "C"), 1, 0)) -> 0 | C272: =IF(AND(EQUAL(RC[-2], "C"), EQUAL(R[+1]C[-2], "G"))=1, 1, 0) -> 0 | D272: =SUM(RC[-2]:R[+49]C[-2])*2 -> 40 | E272: =SUM(RC[-2]:R[+49]C[-2])*2 -> 0 | F272: =IF(AND(EQUAL(RC[-5], "G"), EQUAL(R[+1]C[-5], "A"), EQUAL(R[+2]C[-5], "T"), EQUAL(R[+3]C[-5], "C"))=1, 1, 0) -> 0
A273: 'A | B273: =IF(EQUAL(RC[-1], "G"), 1, IF(EQUAL(RC[-1], "C"), 1, 0)) -> 0 | C273: =IF(AND(EQUAL(RC[-2], "C"), EQUAL(R[+1]C[-2], "G"))=1, 1, 0) -> 0 | D273: =SUM(RC[-2]:R[+49]C[-2])*2 -> 40 | E273: =SUM(RC[-2]:R[+49]C[-2])*2 -> 0 | F273: =IF(AND(EQUAL(RC[-5], "G"), EQUAL(R[+1]C[-5], "A"), EQUAL(R[+2]C[-5], "T"), EQUAL(R[+3]C[-5], "C"))=1, 1, 0) -> 0
A274: 'A | B274: =IF(EQUAL(RC[-1], "G"), 1, IF(EQUAL(RC[-1], "C"), 1, 0)) -> 0 | C274: =IF(AND(EQUAL(RC[-2], "C"), EQUAL(R[+1]C[-2], "G"))=1, 1, 0) -> 0 | D274: =SUM(RC[-2]:R[+49]C[-2])*2 -> 42 | E274: =SUM(RC[-2]:R[+49]C[-2])*2 -> 0 | F274: =IF(AND(EQUAL(RC[-5], "G"), EQUAL(R[+1]C[-5], "A"), EQUAL(R[+2]C[-5], "T"), EQUAL(R[+3]C[-5], "C"))=1, 1, 0) -> 0
A275: 'G | B275: =IF(EQUAL(RC[-1], "G"), 1, IF(EQUAL(RC[-1], "C"), 1, 0)) -> 1 | C275: =IF(AND(EQUAL(RC[-2], "C"), EQUAL(R[+1]C[-2], "G"))=1, 1, 0) -> 0 | D275: =SUM(RC[-2]:R[+49]C[-2])*2 -> 44 | E275: =SUM(RC[-2]:R[+49]C[-2])*2 -> 0 | F275: =IF(AND(EQUAL(RC[-5], "G"), EQUAL(R[+1]C[-5], "A"), EQUAL(R[+2]C[-5], "T"), EQUAL(R[+3]C[-5], "C"))=1, 1, 0) -> 0
A276: 'C | B276: =IF(EQUAL(RC[-1], "G"), 1, IF(EQUAL(RC[-1], "C"), 1, 0)) -> 1 | C276: =IF(AND(EQUAL(RC[-2], "C"), EQUAL(R[+1]C[-2], "G"))=1, 1, 0) -> 0 | D276: =SUM(RC[-2]:R[+49]C[-2])*2 -> 42 | E276: =SUM(RC[-2]:R[+49]C[-2])*2 -> 0 | F276: =IF(AND(EQUAL(RC[-5], "G"), EQUAL(R[+1]C[-5], "A"), EQUAL(R[+2]C[-5], "T"), EQUAL(R[+3]C[-5], "C"))=1, 1, 0) -> 0
A277: 'C | B277: =IF(EQUAL(RC[-1], "G"), 1, IF(EQUAL(RC[-1], "C"), 1, 0)) -> 1 | C277: =IF(AND(EQUAL(RC[-2], "C"), EQUAL(R[+1]C[-2], "G"))=1, 1, 0) -> 0 | D277: =SUM(RC[-2]:R[+49]C[-2])*2 -> 42 | E277: =SUM(RC[-2]:R[+49]C[-2])*2 -> 0 | F277: =IF(AND(EQUAL(RC[-5], "G"), EQUAL(R[+1]C[-5], "A"), EQUAL(R[+2]C[-5], "T"), EQUAL(R[+3]C[-5], "C"))=1, 1, 0) -> 0
A278: 'A | B278: =IF(EQUAL(RC[-1], "G"), 1, IF(EQUAL(RC[-1], "C"), 1, 0)) -> 0 | C278: =IF(AND(EQUAL(RC[-2], "C"), EQUAL(R[+1]C[-2], "G"))=1, 1, 0) -> 0 | D278: =SUM(RC[-2]:R[+49]C[-2])*2 -> 40 | E278: =SUM(RC[-2]:R[+49]C[-2])*2 -> 0 | F278: =IF(AND(EQUAL(RC[-5], "G"), EQUAL(R[+1]C[-5], "A"), EQUAL(R[+2]C[-5], "T"), EQUAL(R[+3]C[-5], "C"))=1, 1, 0) -> 0
A279: 'T | B279: =IF(EQUAL(RC[-1], "G"), 1, IF(EQUAL(RC[-1], "C"), 1, 0)) -> 0 | C279: =IF(AND(EQUAL(RC[-2], "C"), EQUAL(R[+1]C[-2], "G"))=1, 1, 0) -> 0 | D279: =SUM(RC[-2]:R[+49]C[-2])*2 -> 40 | E279: =SUM(RC[-2]:R[+49]C[-2])*2 -> 0 | F279: =IF(AND(EQUAL(RC[-5], "G"), EQUAL(R[+1]C[-5], "A"), EQUAL(R[+2]C[-5], "T"), EQUAL(R[+3]C[-5], "C"))=1, 1, 0) -> 0
A280: 'T | B280: =IF(EQUAL(RC[-1], "G"), 1, IF(EQUAL(RC[-1], "C"), 1, 0)) -> 0 | C280: =IF(AND(EQUAL(RC[-2], "C"), EQUAL(R[+1]C[-2], "G"))=1, 1, 0) -> 0 | D280: =SUM(RC[-2]:R[+49]C[-2])*2 -> 40 | E280: =SUM(RC[-2]:R[+49]C[-2])*2 -> 0 | F280: =IF(AND(EQUAL(RC[-5], "G"), EQUAL(R[+1]C[-5], "A"), EQUAL(R[+2]C[-5], "T"), EQUAL(R[+3]C[-5], "C"))=1, 1, 0) -> 0
A281: 'C | B281: =IF(EQUAL(RC[-1], "G"), 1, IF(EQUAL(RC[-1], "C"), 1, 0)) -> 1 | C281: =IF(AND(EQUAL(RC[-2], "C"), EQUAL(R[+1]C[-2], "G"))=1, 1, 0) -> 0 | D281: =SUM(RC[-2]:R[+49]C[-2])*2 -> 40 | E281: =SUM(RC[-2]:R[+49]C[-2])*2 -> 0 | F281: =IF(AND(EQUAL(RC[-5], "G"), EQUAL(R[+1]C[-5], "A"), EQUAL(R[+2]C[-5], "T"), EQUAL(R[+3]C[-5], "C"))=1, 1, 0) -> 0
A282: 'T | B282: =IF(EQUAL(RC[-1], "G"), 1, IF(EQUAL(RC[-1], "C"), 1, 0)) -> 0 | C282: =IF(AND(EQUAL(RC[-2], "C"), EQUAL(R[+1]C[-2], "G"))=1, 1, 0) -> 0 | D282: =SUM(RC[-2]:R[+49]C[-2])*2 -> 40 | E282: =SUM(RC[-2]:R[+49]C[-2])*2 -> 0 | F282: =IF(AND(EQUAL(RC[-5], "G"), EQUAL(R[+1]C[-5], "A"), EQUAL(R[+2]C[-5], "T"), EQUAL(R[+3]C[-5], "C"))=1, 1, 0) -> 0
A283: 'C | B283: =IF(EQUAL(RC[-1], "G"), 1, IF(EQUAL(RC[-1], "C"), 1, 0)) -> 1 | C283: =IF(AND(EQUAL(RC[-2], "C"), EQUAL(R[+1]C[-2], "G"))=1, 1, 0) -> 0 | D283: =SUM(RC[-2]:R[+49]C[-2])*2 -> 42 | E283: =SUM(RC[-2]:R[+49]C[-2])*2 -> 0 | F283: =IF(AND(EQUAL(RC[-5], "G"), EQUAL(R[+1]C[-5], "A"), EQUAL(R[+2]C[-5], "T"), EQUAL(R[+3]C[-5], "C"))=1, 1, 0) -> 0
A284: 'A | B284: =IF(EQUAL(RC[-1], "G"), 1, IF(EQUAL(RC[-1], "C"), 1, 0)) -> 0 | C284: =IF(AND(EQUAL(RC[-2], "C"), EQUAL(R[+1]C[-2], "G"))=1, 1, 0) -> 0 | D284: =SUM(RC[-2]:R[+49]C[-2])*2 -> 42 | E284: =SUM(RC[-2]:R[+49]C[-2])*2 -> 0 | F284: =IF(AND(EQUAL(RC[-5], "G"), EQUAL(R[+1]C[-5], "A"), EQUAL(R[+2]C[-5], "T"), EQUAL(R[+3]C[-5], "C"))=1, 1, 0) -> 0
A285: 'C | B285: =IF(EQUAL(RC[-1], "G"), 1, IF(EQUAL(RC[-1], "C"), 1, 0)) -> 1 | C285: =IF(AND(EQUAL(RC[-2], "C"), EQUAL(R[+1]C[-2], "G"))=1, 1, 0) -> 0 | D285: =SUM(RC[-2]:R[+49]C[-2])*2 -> 42 | E285: =SUM(RC[-2]:R[+49]C[-2])*2 -> 0 | F285: =IF(AND(EQUAL(RC[-5], "G"), EQUAL(R[+1]C[-5], "A"), EQUAL(R[+2]C[-5], "T"), EQUAL(R[+3]C[-5], "C"))=1, 1, 0) -> 0
A286: 'C | B286: =IF(EQUAL(RC[-1], "G"), 1, IF(EQUAL(RC[-1], "C"), 1, 0)) -> 1 | C286: =IF(AND(EQUAL(RC[-2], "C"), EQUAL(R[+1]C[-2], "G"))=1, 1, 0) -> 0 | D286: =SUM(RC[-2]:R[+49]C[-2])*2 -> 42 | E286: =SUM(RC[-2]:R[+49]C[-2])*2 -> 0 | F286: =IF(AND(EQUAL(RC[-5], "G"), EQUAL(R[+1]C[-5], "A"), EQUAL(R[+2]C[-5], "T"), EQUAL(R[+3]C[-5], "C"))=1, 1, 0) -> 0
A287: 'A | B287: =IF(EQUAL(RC[-1], "G"), 1, IF(EQUAL(RC[-1], "C"), 1, 0)) -> 0 | C287: =IF(AND(EQUAL(RC[-2], "C"), EQUAL(R[+1]C[-2], "G"))=1, 1, 0) -> 0 | D287: =SUM(RC[-2]:R[+49]C[-2])*2 -> 40 | E287: =SUM(RC[-2]:R[+49]C[-2])*2 -> 0 | F287: =IF(AND(EQUAL(RC[-5], "G"), EQUAL(R[+1]C[-5], "A"), EQUAL(R[+2]C[-5], "T"), EQUAL(R[+3]C[-5], "C"))=1, 1, 0) -> 0
A288: 'T | B288: =IF(EQUAL(RC[-1], "G"), 1, IF(EQUAL(RC[-1], "C"), 1, 0)) -> 0 | C288: =IF(AND(EQUAL(RC[-2], "C"), EQUAL(R[+1]C[-2], "G"))=1, 1, 0) -> 0 | D288: =SUM(RC[-2]:R[+49]C[-2])*2 -> 40 | E288: =SUM(RC[-2]:R[+49]C[-2])*2 -> 0 | F288: =IF(AND(EQUAL(RC[-5], "G"), EQUAL(R[+1]C[-5], "A"), EQUAL(R[+2]C[-5], "T"), EQUAL(R[+3]C[-5], "C"))=1, 1, 0) -> 0
A289: 'A | B289: =IF(EQUAL(RC[-1], "G"), 1, IF(EQUAL(RC[-1], "C"), 1, 0)) -> 0 | C289: =IF(AND(EQUAL(RC[-2], "C"), EQUAL(R[+1]C[-2], "G"))=1, 1, 0) -> 0 | D289: =SUM(RC[-2]:R[+49]C[-2])*2 -> 40 | E289: =SUM(RC[-2]:R[+49]C[-2])*2 -> 0 | F289: =IF(AND(EQUAL(RC[-5], "G"), EQUAL(R[+1]C[-5], "A"), EQUAL(R[+2]C[-5], "T"), EQUAL(R[+3]C[-5], "C"))=1, 1, 0) -> 0
A290: 'C | B290: =IF(EQUAL(RC[-1], "G"), 1, IF(EQUAL(RC[-1], "C"), 1, 0)) -> 1 | C290: =IF(AND(EQUAL(RC[-2], "C"), EQUAL(R[+1]C[-2], "G"))=1, 1, 0) -> 0 | D290: =SUM(RC[-2]:R[+49]C[-2])*2 -> 40 | E290: =SUM(RC[-2]:R[+49]C[-2])*2 -> 0 | F290: =IF(AND(EQUAL(RC[-5], "G"), EQUAL(R[+1]C[-5], "A"), EQUAL(R[+2]C[-5], "T"), EQUAL(R[+3]C[-5], "C"))=1, 1, 0) -> 0
A291: 'C | B291: =IF(EQUAL(RC[-1], "G"), 1, IF(EQUAL(RC[-1], "C"), 1, 0)) -> 1 | C291: =IF(AND(EQUAL(RC[-2], "C"), EQUAL(R[+1]C[-2], "G"))=1, 1, 0) -> 0 | D291: =SUM(RC[-2]:R[+49]C[-2])*2 -> 38 | E291: =SUM(RC[-2]:R[+49]C[-2])*2 -> 0 | F291: =IF(AND(EQUAL(RC[-5], "G"), EQUAL(R[+1]C[-5], "A"), EQUAL(R[+2]C[-5], "T"), EQUAL(R[+3]C[-5], "C"))=1, 1, 0) -> 0
A292: 'A | B292: =IF(EQUAL(RC[-1], "G"), 1, IF(EQUAL(RC[-1], "C"), 1, 0)) -> 0 | C292: =IF(AND(EQUAL(RC[-2], "C"), EQUAL(R[+1]C[-2], "G"))=1, 1, 0) -> 0 | D292: =SUM(RC[-2]:R[+49]C[-2])*2 -> 38 | E292: =SUM(RC[-2]:R[+49]C[-2])*2 -> 0 | F292: =IF(AND(EQUAL(RC[-5], "G"), EQUAL(R[+1]C[-5], "A"), EQUAL(R[+2]C[-5], "T"), EQUAL(R[+3]C[-5], "C"))=1, 1, 0) -> 0
A293: 'G | B293: =IF(EQUAL(RC[-1], "G"), 1, IF(EQUAL(RC[-1], "C"), 1, 0)) -> 1 | C293: =IF(AND(EQUAL(RC[-2], "C"), EQUAL(R[+1]C[-2], "G"))=1, 1, 0) -> 0 | D293: =SUM(RC[-2]:R[+49]C[-2])*2 -> 38 | E293: =SUM(RC[-2]:R[+49]C[-2])*2 -> 0 | F293: =IF(AND(EQUAL(RC[-5], "G"), EQUAL(R[+1]C[-5], "A"), EQUAL(R[+2]C[-5], "T"), EQUAL(R[+3]C[-5], "C"))=1, 1, 0) -> 0
A294: 'G | B294: =IF(EQUAL(RC[-1], "G"), 1, IF(EQUAL(RC[-1], "C"), 1, 0)) -> 1 | C294: =IF(AND(EQUAL(RC[-2], "C"), EQUAL(R[+1]C[-2], "G"))=1, 1, 0) -> 0 | D294: =SUM(RC[-2]:R[+49]C[-2])*2 -> 38 | E294: =SUM(RC[-2]:R[+49]C[-2])*2 -> 0 | F294: =IF(AND(EQUAL(RC[-5], "G"), EQUAL(R[+1]C[-5], "A"), EQUAL(R[+2]C[-5], "T"), EQUAL(R[+3]C[-5], "C"))=1, 1, 0) -> 0
A295: 'C | B295: =IF(EQUAL(RC[-1], "G"), 1, IF(EQUAL(RC[-1], "C"), 1, 0)) -> 1 | C295: =IF(AND(EQUAL(RC[-2], "C"), EQUAL(R[+1]C[-2], "G"))=1, 1, 0) -> 0 | D295: =SUM(RC[-2]:R[+49]C[-2])*2 -> 36 | E295: =SUM(RC[-2]:R[+49]C[-2])*2 -> 0 | F295: =IF(AND(EQUAL(RC[-5], "G"), EQUAL(R[+1]C[-5], "A"), EQUAL(R[+2]C[-5], "T"), EQUAL(R[+3]C[-5], "C"))=1, 1, 0) -> 0
A296: 'T | B296: =IF(EQUAL(RC[-1], "G"), 1, IF(EQUAL(RC[-1], "C"), 1, 0)) -> 0 | C296: =IF(AND(EQUAL(RC[-2], "C"), EQUAL(R[+1]C[-2], "G"))=1, 1, 0) -> 0 | D296: =SUM(RC[-2]:R[+49]C[-2])*2 -> 34 | E296: =SUM(RC[-2]:R[+49]C[-2])*2 -> 0 | F296: =IF(AND(EQUAL(RC[-5], "G"), EQUAL(R[+1]C[-5], "A"), EQUAL(R[+2]C[-5], "T"), EQUAL(R[+3]C[-5], "C"))=1, 1, 0) -> 0
A297: 'A | B297: =IF(EQUAL(RC[-1], "G"), 1, IF(EQUAL(RC[-1], "C"), 1, 0)) -> 0 | C297: =IF(AND(EQUAL(RC[-2], "C"), EQUAL(R[+1]C[-2], "G"))=1, 1, 0) -> 0 | D297: =SUM(RC[-2]:R[+49]C[-2])*2 -> 34 | E297: =SUM(RC[-2]:R[+49]C[-2])*2 -> 0 | F297: =IF(AND(EQUAL(RC[-5], "G"), EQUAL(R[+1]C[-5], "A"), EQUAL(R[+2]C[-5], "T"), EQUAL(R[+3]C[-5], "C"))=1, 1, 0) -> 0
A298: 'A | B298: =IF(EQUAL(RC[-1], "G"), 1, IF(EQUAL(RC[-1], "C"), 1, 0)) -> 0 | C298: =IF(AND(EQUAL(RC[-2], "C"), EQUAL(R[+1]C[-2], "G"))=1, 1, 0) -> 0 | D298: =SUM(RC[-2]:R[+49]C[-2])*2 -> 34 | E298: =SUM(RC[-2]:R[+49]C[-2])*2 -> 0 | F298: =IF(AND(EQUAL(RC[-5], "G"), EQUAL(R[+1]C[-5], "A"), EQUAL(R[+2]C[-5], "T"), EQUAL(R[+3]C[-5], "C"))=1, 1, 0) -> 0
A299: 'A | B299: =IF(EQUAL(RC[-1], "G"), 1, IF(EQUAL(RC[-1], "C"), 1, 0)) -> 0 | C299: =IF(AND(EQUAL(RC[-2], "C"), EQUAL(R[+1]C[-2], "G"))=1, 1, 0) -> 0 | D299: =SUM(RC[-2]:R[+49]C[-2])*2 -> 36 | E299: =SUM(RC[-2]:R[+49]C[-2])*2 -> 0 | F299: =IF(AND(EQUAL(RC[-5], "G"), EQUAL(R[+1]C[-5], "A"), EQUAL(R[+2]C[-5], "T"), EQUAL(R[+3]C[-5], "C"))=1, 1, 0) -> 0
A300: 'T | B300: =IF(EQUAL(RC[-1], "G"), 1, IF(EQUAL(RC[-1], "C"), 1, 0)) -> 0 | C300: =IF(AND(EQUAL(RC[-2], "C"), EQUAL(R[+1]C[-2], "G"))=1, 1, 0) -> 0 | D300: =SUM(RC[-2]:R[+49]C[-2])*2 -> 38 | E300: =SUM(RC[-2]:R[+49]C[-2])*2 -> 0 | F300: =IF(AND(EQUAL(RC[-5], "G"), EQUAL(R[+1]C[-5], "A"), EQUAL(R[+2]C[-5], "T"), EQUAL(R[+3]C[-5], "C"))=1, 1, 0) -> 0
A301: 'G | B301: =IF(EQUAL(RC[-1], "G"), 1, IF(EQUAL(RC[-1], "C"), 1, 0)) -> 1 | C301: =IF(AND(EQUAL(RC[-2], "C"), EQUAL(R[+1]C[-2], "G"))=1, 1, 0) -> 0 | D301: =SUM(RC[-2]:R[+49]C[-2])*2 -> 38 | E301: =SUM(RC[-2]:R[+49]C[-2])*2 -> 0 | F301: =IF(AND(EQUAL(RC[-5], "G"), EQUAL(R[+1]C[-5], "A"), EQUAL(R[+2]C[-5], "T"), EQUAL(R[+3]C[-5], "C"))=1, 1, 0) -> 0
A302: 'C | B302: =IF(EQUAL(RC[-1], "G"), 1, IF(EQUAL(RC[-1], "C"), 1, 0)) -> 1 | C302: =IF(AND(EQUAL(RC[-2], "C"), EQUAL(R[+1]C[-2], "G"))=1, 1, 0) -> 0 | D302: =SUM(RC[-2]:R[+49]C[-2])*2 -> 36 | E302: =SUM(RC[-2]:R[+49]C[-2])*2 -> 0 | F302: =IF(AND(EQUAL(RC[-5], "G"), EQUAL(R[+1]C[-5], "A"), EQUAL(R[+2]C[-5], "T"), EQUAL(R[+3]C[-5], "C"))=1, 1, 0) -> 0
A303: 'T | B303: =IF(EQUAL(RC[-1], "G"), 1, IF(EQUAL(RC[-1], "C"), 1, 0)) -> 0 | C303: =IF(AND(EQUAL(RC[-2], "C"), EQUAL(R[+1]C[-2], "G"))=1, 1, 0) -> 0 | D303: =SUM(RC[-2]:R[+49]C[-2])*2 -> 34 | E303: =SUM(RC[-2]:R[+49]C[-2])*2 -> 0 | F303: =IF(AND(EQUAL(RC[-5], "G"), EQUAL(R[+1]C[-5], "A"), EQUAL(R[+2]C[-5], "T"), EQUAL(R[+3]C[-5], "C"))=1, 1, 0) -> 0
A304: 'C | B304: =IF(EQUAL(RC[-1], "G"), 1, IF(EQUAL(RC[-1], "C"), 1, 0)) -> 1 | C304: =IF(AND(EQUAL(RC[-2], "C"), EQUAL(R[+1]C[-2], "G"))=1, 1, 0) -> 0 | D304: =SUM(RC[-2]:R[+49]C[-2])*2 -> 36 | E304: =SUM(RC[-2]:R[+49]C[-2])*2 -> 0 | F304: =IF(AND(EQUAL(RC[-5], "G"), EQUAL(R[+1]C[-5], "A"), EQUAL(R[+2]C[-5], "T"), EQUAL(R[+3]C[-5], "C"))=1, 1, 0) -> 0
A305: 'A | B305: =IF(EQUAL(RC[-1], "G"), 1, IF(EQUAL(RC[-1], "C"), 1, 0)) -> 0 | C305: =IF(AND(EQUAL(RC[-2], "C"), EQUAL(R[+1]C[-2], "G"))=1, 1, 0) -> 0 | D305: =SUM(RC[-2]:R[+49]C[-2])*2 -> 36 | E305: =SUM(RC[-2]:R[+49]C[-2])*2 -> 0 | F305: =IF(AND(EQUAL(RC[-5], "G"), EQUAL(R[+1]C[-5], "A"), EQUAL(R[+2]C[-5], "T"), EQUAL(R[+3]C[-5], "C"))=1, 1, 0) -> 0
A306: 'C | B306: =IF(EQUAL(RC[-1], "G"), 1, IF(EQUAL(RC[-1], "C"), 1, 0)) -> 1 | C306: =IF(AND(EQUAL(RC[-2], "C"), EQUAL(R[+1]C[-2], "G"))=1, 1, 0) -> 0 | D306: =SUM(RC[-2]:R[+49]C[-2])*2 -> 36 | E306: =SUM(RC[-2]:R[+49]C[-2])*2 -> 0 | F306: =IF(AND(EQUAL(RC[-5], "G"), EQUAL(R[+1]C[-5], "A"), EQUAL(R[+2]C[-5], "T"), EQUAL(R[+3]C[-5], "C"))=1, 1, 0) -> 0
A307: 'T | B307: =IF(EQUAL(RC[-1], "G"), 1, IF(EQUAL(RC[-1], "C"), 1, 0)) -> 0 | C307: =IF(AND(EQUAL(RC[-2], "C"), EQUAL(R[+1]C[-2], "G"))=1, 1, 0) -> 0 | D307: =SUM(RC[-2]:R[+49]C[-2])*2 -> 34 | E307: =SUM(RC[-2]:R[+49]C[-2])*2 -> 0 | F307: =IF(AND(EQUAL(RC[-5], "G"), EQUAL(R[+1]C[-5], "A"), EQUAL(R[+2]C[-5], "T"), EQUAL(R[+3]C[-5], "C"))=1, 1, 0) -> 0
A308: 'T | B308: =IF(EQUAL(RC[-1], "G"), 1, IF(EQUAL(RC[-1], "C"), 1, 0)) -> 0 | C308: =IF(AND(EQUAL(RC[-2], "C"), EQUAL(R[+1]C[-2], "G"))=1, 1, 0) -> 0 | D308: =SUM(RC[-2]:R[+49]C[-2])*2 -> 36 | E308: =SUM(RC[-2]:R[+49]C[-2])*2 -> 0 | F308: =IF(AND(EQUAL(RC[-5], "G"), EQUAL(R[+1]C[-5], "A"), EQUAL(R[+2]C[-5], "T"), EQUAL(R[+3]C[-5], "C"))=1, 1, 0) -> 0
A309: 'T | B309: =IF(EQUAL(RC[-1], "G"), 1, IF(EQUAL(RC[-1], "C"), 1, 0)) -> 0 | C309: =IF(AND(EQUAL(RC[-2], "C"), EQUAL(R[+1]C[-2], "G"))=1, 1, 0) -> 0 | D309: =SUM(RC[-2]:R[+49]C[-2])*2 -> 38 | E309: =SUM(RC[-2]:R[+49]C[-2])*2 -> 0 | F309: =IF(AND(EQUAL(RC[-5], "G"), EQUAL(R[+1]C[-5], "A"), EQUAL(R[+2]C[-5], "T"), EQUAL(R[+3]C[-5], "C"))=1, 1, 0) -> 0
A310: 'A | B310: =IF(EQUAL(RC[-1], "G"), 1, IF(EQUAL(RC[-1], "C"), 1, 0)) -> 0 | C310: =IF(AND(EQUAL(RC[-2], "C"), EQUAL(R[+1]C[-2], "G"))=1, 1, 0) -> 0 | D310: =SUM(RC[-2]:R[+49]C[-2])*2 -> 38 | E310: =SUM(RC[-2]:R[+49]C[-2])*2 -> 0 | F310: =IF(AND(EQUAL(RC[-5], "G"), EQUAL(R[+1]C[-5], "A"), EQUAL(R[+2]C[-5], "T"), EQUAL(R[+3]C[-5], "C"))=1, 1, 0) -> 0
A311: 'T | B311: =IF(EQUAL(RC[-1], "G"), 1, IF(EQUAL(RC[-1], "C"), 1, 0)) -> 0 | C311: =IF(AND(EQUAL(RC[-2], "C"), EQUAL(R[+1]C[-2], "G"))=1, 1, 0) -> 0 | D311: =SUM(RC[-2]:R[+49]C[-2])*2 -> 40 | E311: =SUM(RC[-2]:R[+49]C[-2])*2 -> 0 | F311: =IF(AND(EQUAL(RC[-5], "G"), EQUAL(R[+1]C[-5], "A"), EQUAL(R[+2]C[-5], "T"), EQUAL(R[+3]C[-5], "C"))=1, 1, 0) -> 0
A312: 'G | B312: =IF(EQUAL(RC[-1], "G"), 1, IF(EQUAL(RC[-1], "C"), 1, 0)) -> 1 | C312: =IF(AND(EQUAL(RC[-2], "C"), EQUAL(R[+1]C[-2], "G"))=1, 1, 0) -> 0 | D312: =SUM(RC[-2]:R[+49]C[-2])*2 -> 42 | E312: =SUM(RC[-2]:R[+49]C[-2])*2 -> 0 | F312: =IF(AND(EQUAL(RC[-5], "G"), EQUAL(R[+1]C[-5], "A"), EQUAL(R[+2]C[-5], "T"), EQUAL(R[+3]C[-5], "C"))=1, 1, 0) -> 0
A313: 'T | B313: =IF(EQUAL(RC[-1], "G"), 1, IF(EQUAL(RC[-1], "C"), 1, 0)) -> 0 | C313: =IF(AND(EQUAL(RC[-2], "C"), EQUAL(R[+1]C[-2], "G"))=1, 1, 0) -> 0 | D313: =SUM(RC[-2]:R[+49]C[-2])*2 -> 40 | E313: =SUM(RC[-2]:R[+49]C[-2])*2 -> 0 | F313: =IF(AND(EQUAL(RC[-5], "G"), EQUAL(R[+1]C[-5], "A"), EQUAL(R[+2]C[-5], "T"), EQUAL(R[+3]C[-5], "C"))=1, 1, 0) -> 0
A314: 'A | B314: =IF(EQUAL(RC[-1], "G"), 1, IF(EQUAL(RC[-1], "C"), 1, 0)) -> 0 | C314: =IF(AND(EQUAL(RC[-2], "C"), EQUAL(R[+1]C[-2], "G"))=1, 1, 0) -> 0 | D314: =SUM(RC[-2]:R[+49]C[-2])*2 -> 40 | E314: =SUM(RC[-2]:R[+49]C[-2])*2 -> 0 | F314: =IF(AND(EQUAL(RC[-5], "G"), EQUAL(R[+1]C[-5], "A"), EQUAL(R[+2]C[-5], "T"), EQUAL(R[+3]C[-5], "C"))=1, 1, 0) -> 0
A315: 'A | B315: =IF(EQUAL(RC[-1], "G"), 1, IF(EQUAL(RC[-1], "C"), 1, 0)) -> 0 | C315: =IF(AND(EQUAL(RC[-2], "C"), EQUAL(R[+1]C[-2], "G"))=1, 1, 0) -> 0 | D315: =SUM(RC[-2]:R[+49]C[-2])*2 -> 42 | E315: =SUM(RC[-2]:R[+49]C[-2])*2 -> 2 | F315: =IF(AND(EQUAL(RC[-5], "G"), EQUAL(R[+1]C[-5], "A"), EQUAL(R[+2]C[-5], "T"), EQUAL(R[+3]C[-5], "C"))=1, 1, 0) -> 0
A316: 'A | B316: =IF(EQUAL(RC[-1], "G"), 1, IF(EQUAL(RC[-1], "C"), 1, 0)) -> 0 | C316: =IF(AND(EQUAL(RC[-2], "C"), EQUAL(R[+1]C[-2], "G"))=1, 1, 0) -> 0 | D316: =SUM(RC[-2]:R[+49]C[-2])*2 -> 44 | E316: =SUM(RC[-2]:R[+49]C[-2])*2 -> 2 | F316: =IF(AND(EQUAL(RC[-5], "G"), EQUAL(R[+1]C[-5], "A"), EQUAL(R[+2]C[-5], "T"), EQUAL(R[+3]C[-5], "C"))=1, 1, 0) -> 0
A317: 'G | B317: =IF(EQUAL(RC[-1], "G"), 1, IF(EQUAL(RC[-1], "C"), 1, 0)) -> 1 | C317: =IF(AND(EQUAL(RC[-2], "C"), EQUAL(R[+1]C[-2], "G"))=1, 1, 0) -> 0 | D317: =SUM(RC[-2]:R[+49]C[-2])*2 -> 44 | E317: =SUM(RC[-2]:R[+49]C[-2])*2 -> 2 | F317: =IF(AND(EQUAL(RC[-5], "G"), EQUAL(R[+1]C[-5], "A"), EQUAL(R[+2]C[-5], "T"), EQUAL(R[+3]C[-5], "C"))=1, 1, 0) -> 0
A318: 'G | B318: =IF(EQUAL(RC[-1], "G"), 1, IF(EQUAL(RC[-1], "C"), 1, 0)) -> 1 | C318: =IF(AND(EQUAL(RC[-2], "C"), EQUAL(R[+1]C[-2], "G"))=1, 1, 0) -> 0 | D318: =SUM(RC[-2]:R[+49]C[-2])*2 -> 42 | E318: =SUM(RC[-2]:R[+49]C[-2])*2 -> 2 | F318: =IF(AND(EQUAL(RC[-5], "G"), EQUAL(R[+1]C[-5], "A"), EQUAL(R[+2]C[-5], "T"), EQUAL(R[+3]C[-5], "C"))=1, 1, 0) -> 0
A319: 'C | B319: =IF(EQUAL(RC[-1], "G"), 1, IF(EQUAL(RC[-1], "C"), 1, 0)) -> 1 | C319: =IF(AND(EQUAL(RC[-2], "C"), EQUAL(R[+1]C[-2], "G"))=1, 1, 0) -> 0 | D319: =SUM(RC[-2]:R[+49]C[-2])*2 -> 40 | E319: =SUM(RC[-2]:R[+49]C[-2])*2 -> 2 | F319: =IF(AND(EQUAL(RC[-5], "G"), EQUAL(R[+1]C[-5], "A"), EQUAL(R[+2]C[-5], "T"), EQUAL(R[+3]C[-5], "C"))=1, 1, 0) -> 0
A320: 'A | B320: =IF(EQUAL(RC[-1], "G"), 1, IF(EQUAL(RC[-1], "C"), 1, 0)) -> 0 | C320: =IF(AND(EQUAL(RC[-2], "C"), EQUAL(R[+1]C[-2], "G"))=1, 1, 0) -> 0 | D320: =SUM(RC[-2]:R[+49]C[-2])*2 -> 38 | E320: =SUM(RC[-2]:R[+49]C[-2])*2 -> 2 | F320: =IF(AND(EQUAL(RC[-5], "G"), EQUAL(R[+1]C[-5], "A"), EQUAL(R[+2]C[-5], "T"), EQUAL(R[+3]C[-5], "C"))=1, 1, 0) -> 0
A321: 'A | B321: =IF(EQUAL(RC[-1], "G"), 1, IF(EQUAL(RC[-1], "C"), 1, 0)) -> 0 | C321: =IF(AND(EQUAL(RC[-2], "C"), EQUAL(R[+1]C[-2], "G"))=1, 1, 0) -> 0 | D321: =SUM(RC[-2]:R[+49]C[-2])*2 -> 40 | E321: =SUM(RC[-2]:R[+49]C[-2])*2 -> 2 | F321: =IF(AND(EQUAL(RC[-5], "G"), EQUAL(R[+1]C[-5], "A"), EQUAL(R[+2]C[-5], "T"), EQUAL(R[+3]C[-5], "C"))=1, 1, 0) -> 0
A322: 'A | B322: =IF(EQUAL(RC[-1], "G"), 1, IF(EQUAL(RC[-1], "C"), 1, 0)) -> 0 | C322: =IF(AND(EQUAL(RC[-2], "C"), EQUAL(R[+1]C[-2], "G"))=1, 1, 0) -> 0 | D322: =SUM(RC[-2]:R[+49]C[-2])*2 -> 42 | E322: =SUM(RC[-2]:R[+49]C[-2])*2 -> 2 | F322: =IF(AND(EQUAL(RC[-5], "G"), EQUAL(R[+1]C[-5], "A"), EQUAL(R[+2]C[-5], "T"), EQUAL(R[+3]C[-5], "C"))=1, 1, 0) -> 0
A323: 'G | B323: =IF(EQUAL(RC[-1], "G"), 1, IF(EQUAL(RC[-1], "C"), 1, 0)) -> 1 | C323: =IF(AND(EQUAL(RC[-2], "C"), EQUAL(R[+1]C[-2], "G"))=1, 1, 0) -> 0 | D323: =SUM(RC[-2]:R[+49]C[-2])*2 -> 42 | E323: =SUM(RC[-2]:R[+49]C[-2])*2 -> 2 | F323: =IF(AND(EQUAL(RC[-5], "G"), EQUAL(R[+1]C[-5], "A"), EQUAL(R[+2]C[-5], "T"), EQUAL(R[+3]C[-5], "C"))=1, 1, 0) -> 0
A324: 'C | B324: =IF(EQUAL(RC[-1], "G"), 1, IF(EQUAL(RC[-1], "C"), 1, 0)) -> 1 | C324: =IF(AND(EQUAL(RC[-2], "C"), EQUAL(R[+1]C[-2], "G"))=1, 1, 0) -> 0 | D324: =SUM(RC[-2]:R[+49]C[-2])*2 -> 40 | E324: =SUM(RC[-2]:R[+49]C[-2])*2 -> 2 | F324: =IF(AND(EQUAL(RC[-5], "G"), EQUAL(R[+1]C[-5], "A"), EQUAL(R[+2]C[-5], "T"), EQUAL(R[+3]C[-5], "C"))=1, 1, 0) -> 0
A325: 'A | B325: =IF(EQUAL(RC[-1], "G"), 1, IF(EQUAL(RC[-1], "C"), 1, 0)) -> 0 | C325: =IF(AND(EQUAL(RC[-2], "C"), EQUAL(R[+1]C[-2], "G"))=1, 1, 0) -> 0 | D325: =SUM(RC[-2]:R[+49]C[-2])*2 -> 38 | E325: =SUM(RC[-2]:R[+49]C[-2])*2 -> 2 | F325: =IF(AND(EQUAL(RC[-5], "G"), EQUAL(R[+1]C[-5], "A"), EQUAL(R[+2]C[-5], "T"), EQUAL(R[+3]C[-5], "C"))=1, 1, 0) -> 0
A326: 'G | B326: =IF(EQUAL(RC[-1], "G"), 1, IF(EQUAL(RC[-1], "C"), 1, 0)) -> 1 | C326: =IF(AND(EQUAL(RC[-2], "C"), EQUAL(R[+1]C[-2], "G"))=1, 1, 0) -> 0 | D326: =SUM(RC[-2]:R[+49]C[-2])*2 -> 38 | E326: =SUM(RC[-2]:R[+49]C[-2])*2 -> 2 | F326: =IF(AND(EQUAL(RC[-5], "G"), EQUAL(R[+1]C[-5], "A"), EQUAL(R[+2]C[-5], "T"), EQUAL(R[+3]C[-5], "C"))=1, 1, 0) -> 0
A327: 'T | B327: =IF(EQUAL(RC[-1], "G"), 1, IF(EQUAL(RC[-1], "C"), 1, 0)) -> 0 | C327: =IF(AND(EQUAL(RC[-2], "C"), EQUAL(R[+1]C[-2], "G"))=1, 1, 0) -> 0 | D327: =SUM(RC[-2]:R[+49]C[-2])*2 -> 38 | E327: =SUM(RC[-2]:R[+49]C[-2])*2 -> 2 | F327: =IF(AND(EQUAL(RC[-5], "G"), EQUAL(R[+1]C[-5], "A"), EQUAL(R[+2]C[-5], "T"), EQUAL(R[+3]C[-5], "C"))=1, 1, 0) -> 0
A328: 'T | B328: =IF(EQUAL(RC[-1], "G"), 1, IF(EQUAL(RC[-1], "C"), 1, 0)) -> 0 | C328: =IF(AND(EQUAL(RC[-2], "C"), EQUAL(R[+1]C[-2], "G"))=1, 1, 0) -> 0 | D328: =SUM(RC[-2]:R[+49]C[-2])*2 -> 38 | E328: =SUM(RC[-2]:R[+49]C[-2])*2 -> 2 | F328: =IF(AND(EQUAL(RC[-5], "G"), EQUAL(R[+1]C[-5], "A"), EQUAL(R[+2]C[-5], "T"), EQUAL(R[+3]C[-5], "C"))=1, 1, 0) -> 0
A329: 'T | B329: =IF(EQUAL(RC[-1], "G"), 1, IF(EQUAL(RC[-1], "C"), 1, 0)) -> 0 | C329: =IF(AND(EQUAL(RC[-2], "C"), EQUAL(R[+1]C[-2], "G"))=1, 1, 0) -> 0 | D329: =SUM(RC[-2]:R[+49]C[-2])*2 -> 38 | E329: =SUM(RC[-2]:R[+49]C[-2])*2 -> 2 | F329: =IF(AND(EQUAL(RC[-5], "G"), EQUAL(R[+1]C[-5], "A"), EQUAL(R[+2]C[-5], "T"), EQUAL(R[+3]C[-5], "C"))=1, 1, 0) -> 0
A330: 'A | B330: =IF(EQUAL(RC[-1], "G"), 1, IF(EQUAL(RC[-1], "C"), 1, 0)) -> 0 | C330: =IF(AND(EQUAL(RC[-2], "C"), EQUAL(R[+1]C[-2], "G"))=1, 1, 0) -> 0 | D330: =SUM(RC[-2]:R[+49]C[-2])*2 -> 38 | E330: =SUM(RC[-2]:R[+49]C[-2])*2 -> 2 | F330: =IF(AND(EQUAL(RC[-5], "G"), EQUAL(R[+1]C[-5], "A"), EQUAL(R[+2]C[-5], "T"), EQUAL(R[+3]C[-5], "C"))=1, 1, 0) -> 0
A331: 'G | B331: =IF(EQUAL(RC[-1], "G"), 1, IF(EQUAL(RC[-1], "C"), 1, 0)) -> 1 | C331: =IF(AND(EQUAL(RC[-2], "C"), EQUAL(R[+1]C[-2], "G"))=1, 1, 0) -> 0 | D331: =SUM(RC[-2]:R[+49]C[-2])*2 -> 38 | E331: =SUM(RC[-2]:R[+49]C[-2])*2 -> 2 | F331: =IF(AND(EQUAL(RC[-5], "G"), EQUAL(R[+1]C[-5], "A"), EQUAL(R[+2]C[-5], "T"), EQUAL(R[+3]C[-5], "C"))=1, 1, 0) -> 0
A332: 'G | B332: =IF(EQUAL(RC[-1], "G"), 1, IF(EQUAL(RC[-1], "C"), 1, 0)) -> 1 | C332: =IF(AND(EQUAL(RC[-2], "C"), EQUAL(R[+1]C[-2], "G"))=1, 1, 0) -> 0 | D332: =SUM(RC[-2]:R[+49]C[-2])*2 -> 38 | E332: =SUM(RC[-2]:R[+49]C[-2])*2 -> 2 | F332: =IF(AND(EQUAL(RC[-5], "G"), EQUAL(R[+1]C[-5], "A"), EQUAL(R[+2]C[-5], "T"), EQUAL(R[+3]C[-5], "C"))=1, 1, 0) -> 0
A333: 'G | B333: =IF(EQUAL(RC[-1], "G"), 1, IF(EQUAL(RC[-1], "C"), 1, 0)) -> 1 | C333: =IF(AND(EQUAL(RC[-2], "C"), EQUAL(R[+1]C[-2], "G"))=1, 1, 0) -> 0 | D333: =SUM(RC[-2]:R[+49]C[-2])*2 -> 38 | E333: =SUM(RC[-2]:R[+49]C[-2])*2 -> 2 | F333: =IF(AND(EQUAL(RC[-5], "G"), EQUAL(R[+1]C[-5], "A"), EQUAL(R[+2]C[-5], "T"), EQUAL(R[+3]C[-5], "C"))=1, 1, 0) -> 0
A334: 'T | B334: =IF(EQUAL(RC[-1], "G"), 1, IF(EQUAL(RC[-1], "C"), 1, 0)) -> 0 | C334: =IF(AND(EQUAL(RC[-2], "C"), EQUAL(R[+1]C[-2], "G"))=1, 1, 0) -> 0 | D334: =SUM(RC[-2]:R[+49]C[-2])*2 -> 36 | E334: =SUM(RC[-2]:R[+49]C[-2])*2 -> 2 | F334: =IF(AND(EQUAL(RC[-5], "G"), EQUAL(R[+1]C[-5], "A"), EQUAL(R[+2]C[-5], "T"), EQUAL(R[+3]C[-5], "C"))=1, 1, 0) -> 0
A335: 'C | B335: =IF(EQUAL(RC[-1], "G"), 1, IF(EQUAL(RC[-1], "C"), 1, 0)) -> 1 | C335: =IF(AND(EQUAL(RC[-2], "C"), EQUAL(R[+1]C[-2], "G"))=1, 1, 0) -> 0 | D335: =SUM(RC[-2]:R[+49]C[-2])*2 -> 36 | E335: =SUM(RC[-2]:R[+49]C[-2])*2 -> 2 | F335: =IF(AND(EQUAL(RC[-5], "G"), EQUAL(R[+1]C[-5], "A"), EQUAL(R[+2]C[-5], "T"), EQUAL(R[+3]C[-5], "C"))=1, 1, 0) -> 0
A336: 'T | B336: =IF(EQUAL(RC[-1], "G"), 1, IF(EQUAL(RC[-1], "C"), 1, 0)) -> 0 | C336: =IF(AND(EQUAL(RC[-2], "C"), EQUAL(R[+1]C[-2], "G"))=1, 1, 0) -> 0 | D336: =SUM(RC[-2]:R[+49]C[-2])*2 -> 36 | E336: =SUM(RC[-2]:R[+49]C[-2])*2 -> 2 | F336: =IF(AND(EQUAL(RC[-5], "G"), EQUAL(R[+1]C[-5], "A"), EQUAL(R[+2]C[-5], "T"), EQUAL(R[+3]C[-5], "C"))=1, 1, 0) -> 0
A337: 'A | B337: =IF(EQUAL(RC[-1], "G"), 1, IF(EQUAL(RC[-1], "C"), 1, 0)) -> 0 | C337: =IF(AND(EQUAL(RC[-2], "C"), EQUAL(R[+1]C[-2], "G"))=1, 1, 0) -> 0 | D337: =SUM(RC[-2]:R[+49]C[-2])*2 -> 38 | E337: =SUM(RC[-2]:R[+49]C[-2])*2 -> 2 | F337: =IF(AND(EQUAL(RC[-5], "G"), EQUAL(R[+1]C[-5], "A"), EQUAL(R[+2]C[-5], "T"), EQUAL(R[+3]C[-5], "C"))=1, 1, 0) -> 0
A338: 'A | B338: =IF(EQUAL(RC[-1], "G"), 1, IF(EQUAL(RC[-1], "C"), 1, 0)) -> 0 | C338: =IF(AND(EQUAL(RC[-2], "C"), EQUAL(R[+1]C[-2], "G"))=1, 1, 0) -> 0 | D338: =SUM(RC[-2]:R[+49]C[-2])*2 -> 40 | E338: =SUM(RC[-2]:R[+49]C[-2])*2 -> 2 | F338: =IF(AND(EQUAL(RC[-5], "G"), EQUAL(R[+1]C[-5], "A"), EQUAL(R[+2]C[-5], "T"), EQUAL(R[+3]C[-5], "C"))=1, 1, 0) -> 0
A339: 'T | B339: =IF(EQUAL(RC[-1], "G"), 1, IF(EQUAL(RC[-1], "C"), 1, 0)) -> 0 | C339: =IF(AND(EQUAL(RC[-2], "C"), EQUAL(R[+1]C[-2], "G"))=1, 1, 0) -> 0 | D339: =SUM(RC[-2]:R[+49]C[-2])*2 -> 40 | E339: =SUM(RC[-2]:R[+49]C[-2])*2 -> 2 | F339: =IF(AND(EQUAL(RC[-5], "G"), EQUAL(R[+1]C[-5], "A"), EQUAL(R[+2]C[-5], "T"), EQUAL(R[+3]C[-5], "C"))=1, 1, 0) -> 0
A340: 'T | B340: =IF(EQUAL(RC[-1], "G"), 1, IF(EQUAL(RC[-1], "C"), 1, 0)) -> 0 | C340: =IF(AND(EQUAL(RC[-2], "C"), EQUAL(R[+1]C[-2], "G"))=1, 1, 0) -> 0 | D340: =SUM(RC[-2]:R[+49]C[-2])*2 -> 42 | E340: =SUM(RC[-2]:R[+49]C[-2])*2 -> 2 | F340: =IF(AND(EQUAL(RC[-5], "G"), EQUAL(R[+1]C[-5], "A"), EQUAL(R[+2]C[-5], "T"), EQUAL(R[+3]C[-5], "C"))=1, 1, 0) -> 0
A341: 'C | B341: =IF(EQUAL(RC[-1], "G"), 1, IF(EQUAL(RC[-1], "C"), 1, 0)) -> 1 | C341: =IF(AND(EQUAL(RC[-2], "C"), EQUAL(R[+1]C[-2], "G"))=1, 1, 0) -> 0 | D341: =SUM(RC[-2]:R[+49]C[-2])*2 -> 42 | E341: =SUM(RC[-2]:R[+49]C[-2])*2 -> 2 | F341: =IF(AND(EQUAL(RC[-5], "G"), EQUAL(R[+1]C[-5], "A"), EQUAL(R[+2]C[-5], "T"), EQUAL(R[+3]C[-5], "C"))=1, 1, 0) -> 0
A342: 'T | B342: =IF(EQUAL(RC[-1], "G"), 1, IF(EQUAL(RC[-1], "C"), 1, 0)) -> 0 | C342: =IF(AND(EQUAL(RC[-2], "C"), EQUAL(R[+1]C[-2], "G"))=1, 1, 0) -> 0 | D342: =SUM(RC[-2]:R[+49]C[-2])*2 -> 40 | E342: =SUM(RC[-2]:R[+49]C[-2])*2 -> 2 | F342: =IF(AND(EQUAL(RC[-5], "G"), EQUAL(R[+1]C[-5], "A"), EQUAL(R[+2]C[-5], "T"), EQUAL(R[+3]C[-5], "C"))=1, 1, 0) -> 0
A343: 'C | B343: =IF(EQUAL(RC[-1], "G"), 1, IF(EQUAL(RC[-1], "C"), 1, 0)) -> 1 | C343: =IF(AND(EQUAL(RC[-2], "C"), EQUAL(R[+1]C[-2], "G"))=1, 1, 0) -> 0 | D343: =SUM(RC[-2]:R[+49]C[-2])*2 -> 42 | E343: =SUM(RC[-2]:R[+49]C[-2])*2 -> 2 | F343: =IF(AND(EQUAL(RC[-5], "G"), EQUAL(R[+1]C[-5], "A"), EQUAL(R[+2]C[-5], "T"), EQUAL(R[+3]C[-5], "C"))=1, 1, 0) -> 0
A344: 'A | B344: =IF(EQUAL(RC[-1], "G"), 1, IF(EQUAL(RC[-1], "C"), 1, 0)) -> 0 | C344: =IF(AND(EQUAL(RC[-2], "C"), EQUAL(R[+1]C[-2], "G"))=1, 1, 0) -> 0 | D344: =SUM(RC[-2]:R[+49]C[-2])*2 -> 40 | E344: =SUM(RC[-2]:R[+49]C[-2])*2 -> 2 | F344: =IF(AND(EQUAL(RC[-5], "G"), EQUAL(R[+1]C[-5], "A"), EQUAL(R[+2]C[-5], "T"), EQUAL(R[+3]C[-5], "C"))=1, 1, 0) -> 0
A345: 'T | B345: =IF(EQUAL(RC[-1], "G"), 1, IF(EQUAL(RC[-1], "C"), 1, 0)) -> 0 | C345: =IF(AND(EQUAL(RC[-2], "C"), EQUAL(R[+1]C[-2], "G"))=1, 1, 0) -> 0 | D345: =SUM(RC[-2]:R[+49]C[-2])*2 -> 42 | E345: =SUM(RC[-2]:R[+49]C[-2])*2 -> 2 | F345: =IF(AND(EQUAL(RC[-5], "G"), EQUAL(R[+1]C[-5], "A"), EQUAL(R[+2]C[-5], "T"), EQUAL(R[+3]C[-5], "C"))=1, 1, 0) -> 0
A346: 'A | B346: =IF(EQUAL(RC[-1], "G"), 1, IF(EQUAL(RC[-1], "C"), 1, 0)) -> 0 | C346: =IF(AND(EQUAL(RC[-2], "C"), EQUAL(R[+1]C[-2], "G"))=1, 1, 0) -> 0 | D346: =SUM(RC[-2]:R[+49]C[-2])*2 -> 44 | E346: =SUM(RC[-2]:R[+49]C[-2])*2 -> 2 | F346: =IF(AND(EQUAL(RC[-5], "G"), EQUAL(R[+1]C[-5], "A"), EQUAL(R[+2]C[-5], "T"), EQUAL(R[+3]C[-5], "C"))=1, 1, 0) -> 0
A347: 'A | B347: =IF(EQUAL(RC[-1], "G"), 1, IF(EQUAL(RC[-1], "C"), 1, 0)) -> 0 | C347: =IF(AND(EQUAL(RC[-2], "C"), EQUAL(R[+1]C[-2], "G"))=1, 1, 0) -> 0 | D347: =SUM(RC[-2]:R[+49]C[-2])*2 -> 46 | E347: =SUM(RC[-2]:R[+49]C[-2])*2 -> 2 | F347: =IF(AND(EQUAL(RC[-5], "G"), EQUAL(R[+1]C[-5], "A"), EQUAL(R[+2]C[-5], "T"), EQUAL(R[+3]C[-5], "C"))=1, 1, 0) -> 0
A348: 'G | B348: =IF(EQUAL(RC[-1], "G"), 1, IF(EQUAL(RC[-1], "C"), 1, 0)) -> 1 | C348: =IF(AND(EQUAL(RC[-2], "C"), EQUAL(R[+1]C[-2], "G"))=1, 1, 0) -> 0 | D348: =SUM(RC[-2]:R[+49]C[-2])*2 -> 46 | E348: =SUM(RC[-2]:R[+49]C[-2])*2 -> 2 | F348: =IF(AND(EQUAL(RC[-5], "G"), EQUAL(R[+1]C[-5], "A"), EQUAL(R[+2]C[-5], "T"), EQUAL(R[+3]C[-5], "C"))=1, 1, 0) -> 0
A349: 'C | B349: =IF(EQUAL(RC[-1], "G"), 1, IF(EQUAL(RC[-1], "C"), 1, 0)) -> 1 | C349: =IF(AND(EQUAL(RC[-2], "C"), EQUAL(R[+1]C[-2], "G"))=1, 1, 0) -> 0 | D349: =SUM(RC[-2]:R[+49]C[-2])*2 -> 46 | E349: =SUM(RC[-2]:R[+49]C[-2])*2 -> 2 | F349: =IF(AND(EQUAL(RC[-5], "G"), EQUAL(R[+1]C[-5], "A"), EQUAL(R[+2]C[-5], "T"), EQUAL(R[+3]C[-5], "C"))=1, 1, 0) -> 0
A350: 'T | B350: =IF(EQUAL(RC[-1], "G"), 1, IF(EQUAL(RC[-1], "C"), 1, 0)) -> 0 | C350: =IF(AND(EQUAL(RC[-2], "C"), EQUAL(R[+1]C[-2], "G"))=1, 1, 0) -> 0 | D350: =SUM(RC[-2]:R[+49]C[-2])*2 -> 44 | E350: =SUM(RC[-2]:R[+49]C[-2])*2 -> 2 | F350: =IF(AND(EQUAL(RC[-5], "G"), EQUAL(R[+1]C[-5], "A"), EQUAL(R[+2]C[-5], "T"), EQUAL(R[+3]C[-5], "C"))=1, 1, 0) -> 0
A351: 'T | B351: =IF(EQUAL(RC[-1], "G"), 1, IF(EQUAL(RC[-1], "C"), 1, 0)) -> 0 | C351: =IF(AND(EQUAL(RC[-2], "C"), EQUAL(R[+1]C[-2], "G"))=1, 1, 0) -> 0 | D351: =SUM(RC[-2]:R[+49]C[-2])*2 -> 44 | E351: =SUM(RC[-2]:R[+49]C[-2])*2 -> 2 | F351: =IF(AND(EQUAL(RC[-5], "G"), EQUAL(R[+1]C[-5], "A"), EQUAL(R[+2]C[-5], "T"), EQUAL(R[+3]C[-5], "C"))=1, 1, 0) -> 0
A352: 'A | B352: =IF(EQUAL(RC[-1], "G"), 1, IF(EQUAL(RC[-1], "C"), 1, 0)) -> 0 | C352: =IF(AND(EQUAL(RC[-2], "C"), EQUAL(R[+1]C[-2], "G"))=1, 1, 0) -> 0 | D352: =SUM(RC[-2]:R[+49]C[-2])*2 -> 44 | E352: =SUM(RC[-2]:R[+49]C[-2])*2 -> 2 | F352: =IF(AND(EQUAL(RC[-5], "G"), EQUAL(R[+1]C[-5], "A"), EQUAL(R[+2]C[-5], "T"), EQUAL(R[+3]C[-5], "C"))=1, 1, 0) -> 0
A353: 'C | B353: =IF(EQUAL(RC[-1], "G"), 1, IF(EQUAL(RC[-1], "C"), 1, 0)) -> 1 | C353: =IF(AND(EQUAL(RC[-2], "C"), EQUAL(R[+1]C[-2], "G"))=1, 1, 0) -> 0 | D353: =SUM(RC[-2]:R[+49]C[-2])*2 -> 44 | E353: =SUM(RC[-2]:R[+49]C[-2])*2 -> 2 | F353: =IF(AND(EQUAL(RC[-5], "G"), EQUAL(R[+1]C[-5], "A"), EQUAL(R[+2]C[-5], "T"), EQUAL(R[+3]C[-5], "C"))=1, 1, 0) -> 0
A354: 'C | B354: =IF(EQUAL(RC[-1], "G"), 1, IF(EQUAL(RC[-1], "C"), 1, 0)) -> 1 | C354: =IF(AND(EQUAL(RC[-2], "C"), EQUAL(R[+1]C[-2], "G"))=1, 1, 0) -> 0 | D354: =SUM(RC[-2]:R[+49]C[-2])*2 -> 44 | E354: =SUM(RC[-2]:R[+49]C[-2])*2 -> 2 | F354: =IF(AND(EQUAL(RC[-5], "G"), EQUAL(R[+1]C[-5], "A"), EQUAL(R[+2]C[-5], "T"), EQUAL(R[+3]C[-5], "C"))=1, 1, 0) -> 0
A355: 'A | B355: =IF(EQUAL(RC[-1], "G"), 1, IF(EQUAL(RC[-1], "C"), 1, 0)) -> 0 | C355: =IF(AND(EQUAL(RC[-2], "C"), EQUAL(R[+1]C[-2], "G"))=1, 1, 0) -> 0 | D355: =SUM(RC[-2]:R[+49]C[-2])*2 -> 44 | E355: =SUM(RC[-2]:R[+49]C[-2])*2 -> 2 | F355: =IF(AND(EQUAL(RC[-5], "G"), EQUAL(R[+1]C[-5], "A"), EQUAL(R[+2]C[-5], "T"), EQUAL(R[+3]C[-5], "C"))=1, 1, 0) -> 0
A356: 'A | B356: =IF(EQUAL(RC[-1], "G"), 1, IF(EQUAL(RC[-1], "C"), 1, 0)) -> 0 | C356: =IF(AND(EQUAL(RC[-2], "C"), EQUAL(R[+1]C[-2], "G"))=1, 1, 0) -> 0 | D356: =SUM(RC[-2]:R[+49]C[-2])*2 -> 46 | E356: =SUM(RC[-2]:R[+49]C[-2])*2 -> 2 | F356: =IF(AND(EQUAL(RC[-5], "G"), EQUAL(R[+1]C[-5], "A"), EQUAL(R[+2]C[-5], "T"), EQUAL(R[+3]C[-5], "C"))=1, 1, 0) -> 0
A357: 'G | B357: =IF(EQUAL(RC[-1], "G"), 1, IF(EQUAL(RC[-1], "C"), 1, 0)) -> 1 | C357: =IF(AND(EQUAL(RC[-2], "C"), EQUAL(R[+1]C[-2], "G"))=1, 1, 0) -> 0 | D357: =SUM(RC[-2]:R[+49]C[-2])*2 -> 48 | E357: =SUM(RC[-2]:R[+49]C[-2])*2 -> 2 | F357: =IF(AND(EQUAL(RC[-5], "G"), EQUAL(R[+1]C[-5], "A"), EQUAL(R[+2]C[-5], "T"), EQUAL(R[+3]C[-5], "C"))=1, 1, 0) -> 0
A358: 'G | B358: =IF(EQUAL(RC[-1], "G"), 1, IF(EQUAL(RC[-1], "C"), 1, 0)) -> 1 | C358: =IF(AND(EQUAL(RC[-2], "C"), EQUAL(R[+1]C[-2], "G"))=1, 1, 0) -> 0 | D358: =SUM(RC[-2]:R[+49]C[-2])*2 -> 46 | E358: =SUM(RC[-2]:R[+49]C[-2])*2 -> 2 | F358: =IF(AND(EQUAL(RC[-5], "G"), EQUAL(R[+1]C[-5], "A"), EQUAL(R[+2]C[-5], "T"), EQUAL(R[+3]C[-5], "C"))=1, 1, 0) -> 0
A359: 'A | B359: =IF(EQUAL(RC[-1], "G"), 1, IF(EQUAL(RC[-1], "C"), 1, 0)) -> 0 | C359: =IF(AND(EQUAL(RC[-2], "C"), EQUAL(R[+1]C[-2], "G"))=1, 1, 0) -> 0 | D359: =SUM(RC[-2]:R[+49]C[-2])*2 -> 46 | E359: =SUM(RC[-2]:R[+49]C[-2])*2 -> 2 | F359: =IF(AND(EQUAL(RC[-5], "G"), EQUAL(R[+1]C[-5], "A"), EQUAL(R[+2]C[-5], "T"), EQUAL(R[+3]C[-5], "C"))=1, 1, 0) -> 0
A360: 'G | B360: =IF(EQUAL(RC[-1], "G"), 1, IF(EQUAL(RC[-1], "C"), 1, 0)) -> 1 | C360: =IF(AND(EQUAL(RC[-2], "C"), EQUAL(R[+1]C[-2], "G"))=1, 1, 0) -> 0 | D360: =SUM(RC[-2]:R[+49]C[-2])*2 -> 46 | E360: =SUM(RC[-2]:R[+49]C[-2])*2 -> 2 | F360: =IF(AND(EQUAL(RC[-5], "G"), EQUAL(R[+1]C[-5], "A"), EQUAL(R[+2]C[-5], "T"), EQUAL(R[+3]C[-5], "C"))=1, 1, 0) -> 0
A361: 'C | B361: =IF(EQUAL(RC[-1], "G"), 1, IF(EQUAL(RC[-1], "C"), 1, 0)) -> 1 | C361: =IF(AND(EQUAL(RC[-2], "C"), EQUAL(R[+1]C[-2], "G"))=1, 1, 0) -> 0 | D361: =SUM(RC[-2]:R[+49]C[-2])*2 -> 46 | E361: =SUM(RC[-2]:R[+49]C[-2])*2 -> 2 | F361: =IF(AND(EQUAL(RC[-5], "G"), EQUAL(R[+1]C[-5], "A"), EQUAL(R[+2]C[-5], "T"), EQUAL(R[+3]C[-5], "C"))=1, 1, 0) -> 0
A362: 'T | B362: =IF(EQUAL(RC[-1], "G"), 1, IF(EQUAL(RC[-1], "C"), 1, 0)) -> 0 | C362: =IF(AND(EQUAL(RC[-2], "C"), EQUAL(R[+1]C[-2], "G"))=1, 1, 0) -> 0 | D362: =SUM(RC[-2]:R[+49]C[-2])*2 -> 46 | E362: =SUM(RC[-2]:R[+49]C[-2])*2 -> 2 | F362: =IF(AND(EQUAL(RC[-5], "G"), EQUAL(R[+1]C[-5], "A"), EQUAL(R[+2]C[-5], "T"), EQUAL(R[+3]C[-5], "C"))=1, 1, 0) -> 0
A363: 'T | B363: =IF(EQUAL(RC[-1], "G"), 1, IF(EQUAL(RC[-1], "C"), 1, 0)) -> 0 | C363: =IF(AND(EQUAL(RC[-2], "C"), EQUAL(R[+1]C[-2], "G"))=1, 1, 0) -> 0 | D363: =SUM(RC[-2]:R[+49]C[-2])*2 -> 46 | E363: =SUM(RC[-2]:R[+49]C[-2])*2 -> 2 | F363: =IF(AND(EQUAL(RC[-5], "G"), EQUAL(R[+1]C[-5], "A"), EQUAL(R[+2]C[-5], "T"), EQUAL(R[+3]C[-5], "C"))=1, 1, 0) -> 0
A364: 'C | B364: =IF(EQUAL(RC[-1], "G"), 1, IF(EQUAL(RC[-1], "C"), 1, 0)) -> 1 | C364: =IF(AND(EQUAL(RC[-2], "C"), EQUAL(R[+1]C[-2], "G"))=1, 1, 0) -> 1 | D364: =SUM(RC[-2]:R[+49]C[-2])*2 -> 48 | E364: =SUM(RC[-2]:R[+49]C[-2])*2 -> 2 | F364: =IF(AND(EQUAL(RC[-5], "G"), EQUAL(R[+1]C[-5], "A"), EQUAL(R[+2]C[-5], "T"), EQUAL(R[+3]C[-5], "C"))=1, 1, 0) -> 0
A365: 'G | B365: =IF(EQUAL(RC[-1], "G"), 1, IF(EQUAL(RC[-1], "C"), 1, 0)) -> 1 | C365: =IF(AND(EQUAL(RC[-2], "C"), EQUAL(R[+1]C[-2], "G"))=1, 1, 0) -> 0 | D365: =SUM(RC[-2]:R[+49]C[-2])*2 -> 48 | E365: =SUM(RC[-2]:R[+49]C[-2])*2 -> 0 | F365: =IF(AND(EQUAL(RC[-5], "G"), EQUAL(R[+1]C[-5], "A"), EQUAL(R[+2]C[-5], "T"), EQUAL(R[+3]C[-5], "C"))=1, 1, 0) -> 0
A366: 'T | B366: =IF(EQUAL(RC[-1], "G"), 1, IF(EQUAL(RC[-1], "C"), 1, 0)) -> 0 | C366: =IF(AND(EQUAL(RC[-2], "C"), EQUAL(R[+1]C[-2], "G"))=1, 1, 0) -> 0 | D366: =SUM(RC[-2]:R[+49]C[-2])*2 -> 46 | E366: =SUM(RC[-2]:R[+49]C[-2])*2 -> 0 | F366: =IF(AND(EQUAL(RC[-5], "G"), EQUAL(R[+1]C[-5], "A"), EQUAL(R[+2]C[-5], "T"), EQUAL(R[+3]C[-5], "C"))=1, 1, 0) -> 0
A367: 'T | B367: =IF(EQUAL(RC[-1], "G"), 1, IF(EQUAL(RC[-1], "C"), 1, 0)) -> 0 | C367: =IF(AND(EQUAL(RC[-2], "C"), EQUAL(R[+1]C[-2], "G"))=1, 1, 0) -> 0 | D367: =SUM(RC[-2]:R[+49]C[-2])*2 -> 48 | E367: =SUM(RC[-2]:R[+49]C[-2])*2 -> 0 | F367: =IF(AND(EQUAL(RC[-5], "G"), EQUAL(R[+1]C[-5], "A"), EQUAL(R[+2]C[-5], "T"), EQUAL(R[+3]C[-5], "C"))=1, 1, 0) -> 0
A368: 'T | B368: =IF(EQUAL(RC[-1], "G"), 1, IF(EQUAL(RC[-1], "C"), 1, 0)) -> 0 | C368: =IF(AND(EQUAL(RC[-2], "C"), EQUAL(R[+1]C[-2], "G"))=1, 1, 0) -> 0 | D368: =SUM(RC[-2]:R[+49]C[-2])*2 -> 48 | E368: =SUM(RC[-2]:R[+49]C[-2])*2 -> 0 | F368: =IF(AND(EQUAL(RC[-5], "G"), EQUAL(R[+1]C[-5], "A"), EQUAL(R[+2]C[-5], "T"), EQUAL(R[+3]C[-5], "C"))=1, 1, 0) -> 0
A369: 'T | B369: =IF(EQUAL(RC[-1], "G"), 1, IF(EQUAL(RC[-1], "C"), 1, 0)) -> 0 | C369: =IF(AND(EQUAL(RC[-2], "C"), EQUAL(R[+1]C[-2], "G"))=1, 1, 0) -> 0 | D369: =SUM(RC[-2]:R[+49]C[-2])*2 -> 48 | E369: =SUM(RC[-2]:R[+49]C[-2])*2 -> 0 | F369: =IF(AND(EQUAL(RC[-5], "G"), EQUAL(R[+1]C[-5], "A"), EQUAL(R[+2]C[-5], "T"), EQUAL(R[+3]C[-5], "C"))=1, 1, 0) -> 0
A370: 'C | B370: =IF(EQUAL(RC[-1], "G"), 1, IF(EQUAL(RC[-1], "C"), 1, 0)) -> 1 | C370: =IF(AND(EQUAL(RC[-2], "C"), EQUAL(R[+1]C[-2], "G"))=1, 1, 0) -> 0 | D370: =SUM(RC[-2]:R[+49]C[-2])*2 -> 48 | E370: =SUM(RC[-2]:R[+49]C[-2])*2 -> 0 | F370: =IF(AND(EQUAL(RC[-5], "G"), EQUAL(R[+1]C[-5], "A"), EQUAL(R[+2]C[-5], "T"), EQUAL(R[+3]C[-5], "C"))=1, 1, 0) -> 0
A371: 'C | B371: =IF(EQUAL(RC[-1], "G"), 1, IF(EQUAL(RC[-1], "C"), 1, 0)) -> 1 | C371: =IF(AND(EQUAL(RC[-2], "C"), EQUAL(R[+1]C[-2], "G"))=1, 1, 0) -> 0 | D371: =SUM(RC[-2]:R[+49]C[-2])*2 -> 46 | E371: =SUM(RC[-2]:R[+49]C[-2])*2 -> 0 | F371: =IF(AND(EQUAL(RC[-5], "G"), EQUAL(R[+1]C[-5], "A"), EQUAL(R[+2]C[-5], "T"), EQUAL(R[+3]C[-5], "C"))=1, 1, 0) -> 0
A372: 'T | B372: =IF(EQUAL(RC[-1], "G"), 1, IF(EQUAL(RC[-1], "C"), 1, 0)) -> 0 | C372: =IF(AND(EQUAL(RC[-2], "C"), EQUAL(R[+1]C[-2], "G"))=1, 1, 0) -> 0 | D372: =SUM(RC[-2]:R[+49]C[-2])*2 -> 46 | E372: =SUM(RC[-2]:R[+49]C[-2])*2 -> 0 | F372: =IF(AND(EQUAL(RC[-5], "G"), EQUAL(R[+1]C[-5], "A"), EQUAL(R[+2]C[-5], "T"), EQUAL(R[+3]C[-5], "C"))=1, 1, 0) -> 0
A373: 'T | B373: =IF(EQUAL(RC[-1], "G"), 1, IF(EQUAL(RC[-1], "C"), 1, 0)) -> 0 | C373: =IF(AND(EQUAL(RC[-2], "C"), EQUAL(R[+1]C[-2], "G"))=1, 1, 0) -> 0 | D373: =SUM(RC[-2]:R[+49]C[-2])*2 -> 46 | E373: =SUM(RC[-2]:R[+49]C[-2])*2 -> 0 | F373: =IF(AND(EQUAL(RC[-5], "G"), EQUAL(R[+1]C[-5], "A"), EQUAL(R[+2]C[-5], "T"), EQUAL(R[+3]C[-5], "C"))=1, 1, 0) -> 0
A374: 'T | B374: =IF(EQUAL(RC[-1], "G"), 1, IF(EQUAL(RC[-1], "C"), 1, 0)) -> 0 | C374: =IF(AND(EQUAL(RC[-2], "C"), EQUAL(R[+1]C[-2], "G"))=1, 1, 0) -> 0 | D374: =SUM(RC[-2]:R[+49]C[-2])*2 -> 46 | E374: =SUM(RC[-2]:R[+49]C[-2])*2 -> 0 | F374: =IF(AND(EQUAL(RC[-5], "G"), EQUAL(R[+1]C[-5], "A"), EQUAL(R[+2]C[-5], "T"), EQUAL(R[+3]C[-5], "C"))=1, 1, 0) -> 0
A375: 'T | B375: =IF(EQUAL(RC[-1], "G"), 1, IF(EQUAL(RC[-1], "C"), 1, 0)) -> 0 | C375: =IF(AND(EQUAL(RC[-2], "C"), EQUAL(R[+1]C[-2], "G"))=1, 1, 0) -> 0 | D375: =SUM(RC[-2]:R[+49]C[-2])*2 -> 46 | E375: =SUM(RC[-2]:R[+49]C[-2])*2 -> 0 | F375: =IF(AND(EQUAL(RC[-5], "G"), EQUAL(R[+1]C[-5], "A"), EQUAL(R[+2]C[-5], "T"), EQUAL(R[+3]C[-5], "C"))=1, 1, 0) -> 0
A376: 'G | B376: =IF(EQUAL(RC[-1], "G"), 1, IF(EQUAL(RC[-1], "C"), 1, 0)) -> 1 | C376: =IF(AND(EQUAL(RC[-2], "C"), EQUAL(R[+1]C[-2], "G"))=1, 1, 0) -> 0 | D376: =SUM(RC[-2]:R[+49]C[-2])*2 -> 48 | E376: =SUM(RC[-2]:R[+49]C[-2])*2 -> 2 | F376: =IF(AND(EQUAL(RC[-5], "G"), EQUAL(R[+1]C[-5], "A"), EQUAL(R[+2]C[-5], "T"), EQUAL(R[+3]C[-5], "C"))=1, 1, 0) -> 0
A377: 'T | B377: =IF(EQUAL(RC[-1], "G"), 1, IF(EQUAL(RC[-1], "C"), 1, 0)) -> 0 | C377: =IF(AND(EQUAL(RC[-2], "C"), EQUAL(R[+1]C[-2], "G"))=1, 1, 0) -> 0 | D377: =SUM(RC[-2]:R[+49]C[-2])*2 -> 48 | E377: =SUM(RC[-2]:R[+49]C[-2])*2 -> 2 | F377: =IF(AND(EQUAL(RC[-5], "G"), EQUAL(R[+1]C[-5], "A"), EQUAL(R[+2]C[-5], "T"), EQUAL(R[+3]C[-5], "C"))=1, 1, 0) -> 0
A378: 'A | B378: =IF(EQUAL(RC[-1], "G"), 1, IF(EQUAL(RC[-1], "C"), 1, 0)) -> 0 | C378: =IF(AND(EQUAL(RC[-2], "C"), EQUAL(R[+1]C[-2], "G"))=1, 1, 0) -> 0 | D378: =SUM(RC[-2]:R[+49]C[-2])*2 -> 48 | E378: =SUM(RC[-2]:R[+49]C[-2])*2 -> 2 | F378: =IF(AND(EQUAL(RC[-5], "G"), EQUAL(R[+1]C[-5], "A"), EQUAL(R[+2]C[-5], "T"), EQUAL(R[+3]C[-5], "C"))=1, 1, 0) -> 0
A379: 'T | B379: =IF(EQUAL(RC[-1], "G"), 1, IF(EQUAL(RC[-1], "C"), 1, 0)) -> 0 | C379: =IF(AND(EQUAL(RC[-2], "C"), EQUAL(R[+1]C[-2], "G"))=1, 1, 0) -> 0 | D379: =SUM(RC[-2]:R[+49]C[-2])*2 -> 50 | E379: =SUM(RC[-2]:R[+49]C[-2])*2 -> 4 | F379: =IF(AND(EQUAL(RC[-5], "G"), EQUAL(R[+1]C[-5], "A"), EQUAL(R[+2]C[-5], "T"), EQUAL(R[+3]C[-5], "C"))=1, 1, 0) -> 0
A380: 'T | B380: =IF(EQUAL(RC[-1], "G"), 1, IF(EQUAL(RC[-1], "C"), 1, 0)) -> 0 | C380: =IF(AND(EQUAL(RC[-2], "C"), EQUAL(R[+1]C[-2], "G"))=1, 1, 0) -> 0 | D380: =SUM(RC[-2]:R[+49]C[-2])*2 -> 52 | E380: =SUM(RC[-2]:R[+49]C[-2])*2 -> 4 | F380: =IF(AND(EQUAL(RC[-5], "G"), EQUAL(R[+1]C[-5], "A"), EQUAL(R[+2]C[-5], "T"), EQUAL(R[+3]C[-5], "C"))=1, 1, 0) -> 0
A381: 'G | B381: =IF(EQUAL(RC[-1], "G"), 1, IF(EQUAL(RC[-1], "C"), 1, 0)) -> 1 | C381: =IF(AND(EQUAL(RC[-2], "C"), EQUAL(R[+1]C[-2], "G"))=1, 1, 0) -> 0 | D381: =SUM(RC[-2]:R[+49]C[-2])*2 -> 52 | E381: =SUM(RC[-2]:R[+49]C[-2])*2 -> 4 | F381: =IF(AND(EQUAL(RC[-5], "G"), EQUAL(R[+1]C[-5], "A"), EQUAL(R[+2]C[-5], "T"), EQUAL(R[+3]C[-5], "C"))=1, 1, 0) -> 0
A382: 'G | B382: =IF(EQUAL(RC[-1], "G"), 1, IF(EQUAL(RC[-1], "C"), 1, 0)) -> 1 | C382: =IF(AND(EQUAL(RC[-2], "C"), EQUAL(R[+1]C[-2], "G"))=1, 1, 0) -> 0 | D382: =SUM(RC[-2]:R[+49]C[-2])*2 -> 50 | E382: =SUM(RC[-2]:R[+49]C[-2])*2 -> 4 | F382: =IF(AND(EQUAL(RC[-5], "G"), EQUAL(R[+1]C[-5], "A"), EQUAL(R[+2]C[-5], "T"), EQUAL(R[+3]C[-5], "C"))=1, 1, 0) -> 0
A383: 'T | B383: =IF(EQUAL(RC[-1], "G"), 1, IF(EQUAL(RC[-1], "C"), 1, 0)) -> 0 | C383: =IF(AND(EQUAL(RC[-2], "C"), EQUAL(R[+1]C[-2], "G"))=1, 1, 0) -> 0 | D383: =SUM(RC[-2]:R[+49]C[-2])*2 -> 50 | E383: =SUM(RC[-2]:R[+49]C[-2])*2 -> 4 | F383: =IF(AND(EQUAL(RC[-5], "G"), EQUAL(R[+1]C[-5], "A"), EQUAL(R[+2]C[-5], "T"), EQUAL(R[+3]C[-5], "C"))=1, 1, 0) -> 0
A384: 'A | B384: =IF(EQUAL(RC[-1], "G"), 1, IF(EQUAL(RC[-1], "C"), 1, 0)) -> 0 | C384: =IF(AND(EQUAL(RC[-2], "C"), EQUAL(R[+1]C[-2], "G"))=1, 1, 0) -> 0 | D384: =SUM(RC[-2]:R[+49]C[-2])*2 -> 50 | E384: =SUM(RC[-2]:R[+49]C[-2])*2 -> 4 | F384: =IF(AND(EQUAL(RC[-5], "G"), EQUAL(R[+1]C[-5], "A"), EQUAL(R[+2]C[-5], "T"), EQUAL(R[+3]C[-5], "C"))=1, 1, 0) -> 0
A385: 'C | B385: =IF(EQUAL(RC[-1], "G"), 1, IF(EQUAL(RC[-1], "C"), 1, 0)) -> 1 | C385: =IF(AND(EQUAL(RC[-2], "C"), EQUAL(R[+1]C[-2], "G"))=1, 1, 0) -> 0 | D385: =SUM(RC[-2]:R[+49]C[-2])*2 -> 50 | E385: =SUM(RC[-2]:R[+49]C[-2])*2 -> 4 | F385: =IF(AND(EQUAL(RC[-5], "G"), EQUAL(R[+1]C[-5], "A"), EQUAL(R[+2]C[-5], "T"), EQUAL(R[+3]C[-5], "C"))=1, 1, 0) -> 0
A386: 'C | B386: =IF(EQUAL(RC[-1], "G"), 1, IF(EQUAL(RC[-1], "C"), 1, 0)) -> 1 | C386: =IF(AND(EQUAL(RC[-2], "C"), EQUAL(R[+1]C[-2], "G"))=1, 1, 0) -> 0 | D386: =SUM(RC[-2]:R[+49]C[-2])*2 -> 48 | E386: =SUM(RC[-2]:R[+49]C[-2])*2 -> 4 | F386: =IF(AND(EQUAL(RC[-5], "G"), EQUAL(R[+1]C[-5], "A"), EQUAL(R[+2]C[-5], "T"), EQUAL(R[+3]C[-5], "C"))=1, 1, 0) -> 0
A387: 'C | B387: =IF(EQUAL(RC[-1], "G"), 1, IF(EQUAL(RC[-1], "C"), 1, 0)) -> 1 | C387: =IF(AND(EQUAL(RC[-2], "C"), EQUAL(R[+1]C[-2], "G"))=1, 1, 0) -> 0 | D387: =SUM(RC[-2]:R[+49]C[-2])*2 -> 48 | E387: =SUM(RC[-2]:R[+49]C[-2])*2 -> 4 | F387: =IF(AND(EQUAL(RC[-5], "G"), EQUAL(R[+1]C[-5], "A"), EQUAL(R[+2]C[-5], "T"), EQUAL(R[+3]C[-5], "C"))=1, 1, 0) -> 0
A388: 'T | B388: =IF(EQUAL(RC[-1], "G"), 1, IF(EQUAL(RC[-1], "C"), 1, 0)) -> 0 | C388: =IF(AND(EQUAL(RC[-2], "C"), EQUAL(R[+1]C[-2], "G"))=1, 1, 0) -> 0 | D388: =SUM(RC[-2]:R[+49]C[-2])*2 -> 46 | E388: =SUM(RC[-2]:R[+49]C[-2])*2 -> 4 | F388: =IF(AND(EQUAL(RC[-5], "G"), EQUAL(R[+1]C[-5], "A"), EQUAL(R[+2]C[-5], "T"), EQUAL(R[+3]C[-5], "C"))=1, 1, 0) -> 0
A389: 'G | B389: =IF(EQUAL(RC[-1], "G"), 1, IF(EQUAL(RC[-1], "C"), 1, 0)) -> 1 | C389: =IF(AND(EQUAL(RC[-2], "C"), EQUAL(R[+1]C[-2], "G"))=1, 1, 0) -> 0 | D389: =SUM(RC[-2]:R[+49]C[-2])*2 -> 46 | E389: =SUM(RC[-2]:R[+49]C[-2])*2 -> 4 | F389: =IF(AND(EQUAL(RC[-5], "G"), EQUAL(R[+1]C[-5], "A"), EQUAL(R[+2]C[-5], "T"), EQUAL(R[+3]C[-5], "C"))=1, 1, 0) -> 1
A390: 'A | B390: =IF(EQUAL(RC[-1], "G"), 1, IF(EQUAL(RC[-1], "C"), 1, 0)) -> 0 | C390: =IF(AND(EQUAL(RC[-2], "C"), EQUAL(R[+1]C[-2], "G"))=1, 1, 0) -> 0 | D390: =SUM(RC[-2]:R[+49]C[-2])*2 -> 44 | E390: =SUM(RC[-2]:R[+49]C[-2])*2 -> 4 | F390: =IF(AND(EQUAL(RC[-5], "G"), EQUAL(R[+1]C[-5], "A"), EQUAL(R[+2]C[-5], "T"), EQUAL(R[+3]C[-5], "C"))=1, 1, 0) -> 0
A391: 'T | B391: =IF(EQUAL(RC[-1], "G"), 1, IF(EQUAL(RC[-1], "C"), 1, 0)) -> 0 | C391: =IF(AND(EQUAL(RC[-2], "C"), EQUAL(R[+1]C[-2], "G"))=1, 1, 0) -> 0 | D391: =SUM(RC[-2]:R[+49]C[-2])*2 -> 46 | E391: =SUM(RC[-2]:R[+49]C[-2])*2 -> 4 | F391: =IF(AND(EQUAL(RC[-5], "G"), EQUAL(R[+1]C[-5], "A"), EQUAL(R[+2]C[-5], "T"), EQUAL(R[+3]C[-5], "C"))=1, 1, 0) -> 0
A392: 'C | B392: =IF(EQUAL(RC[-1], "G"), 1, IF(EQUAL(RC[-1], "C"), 1, 0)) -> 1 | C392: =IF(AND(EQUAL(RC[-2], "C"), EQUAL(R[+1]C[-2], "G"))=1, 1, 0) -> 0 | D392: =SUM(RC[-2]:R[+49]C[-2])*2 -> 46 | E392: =SUM(RC[-2]:R[+49]C[-2])*2 -> 4 | F392: =IF(AND(EQUAL(RC[-5], "G"), EQUAL(R[+1]C[-5], "A"), EQUAL(R[+2]C[-5], "T"), EQUAL(R[+3]C[-5], "C"))=1, 1, 0) -> 0
A393: 'T | B393: =IF(EQUAL(RC[-1], "G"), 1, IF(EQUAL(RC[-1], "C"), 1, 0)) -> 0 | C393: =IF(AND(EQUAL(RC[-2], "C"), EQUAL(R[+1]C[-2], "G"))=1, 1, 0) -> 0 | D393: =SUM(RC[-2]:R[+49]C[-2])*2 -> 44 | E393: =SUM(RC[-2]:R[+49]C[-2])*2 -> 4 | F393: =IF(AND(EQUAL(RC[-5], "G"), EQUAL(R[+1]C[-5], "A"), EQUAL(R[+2]C[-5], "T"), EQUAL(R[+3]C[-5], "C"))=1, 1, 0) -> 0
A394: 'G | B394: =IF(EQUAL(RC[-1], "G"), 1, IF(EQUAL(RC[-1], "C"), 1, 0)) -> 1 | C394: =IF(AND(EQUAL(RC[-2], "C"), EQUAL(R[+1]C[-2], "G"))=1, 1, 0) -> 0 | D394: =SUM(RC[-2]:R[+49]C[-2])*2 -> 44 | E394: =SUM(RC[-2]:R[+49]C[-2])*2 -> 4 | F394: =IF(AND(EQUAL(RC[-5], "G"), EQUAL(R[+1]C[-5], "A"), EQUAL(R[+2]C[-5], "T"), EQUAL(R[+3]C[-5], "C"))=1, 1, 0) -> 0
A395: 'G | B395: =IF(EQUAL(RC[-1], "G"), 1, IF(EQUAL(RC[-1], "C"), 1, 0)) -> 1 | C395: =IF(AND(EQUAL(RC[-2], "C"), EQUAL(R[+1]C[-2], "G"))=1, 1, 0) -> 0 | D395: =SUM(RC[-2]:R[+49]C[-2])*2 -> 44 | E395: =SUM(RC[-2]:R[+49]C[-2])*2 -> 4 | F395: =IF(AND(EQUAL(RC[-5], "G"), EQUAL(R[+1]C[-5], "A"), EQUAL(R[+2]C[-5], "T"), EQUAL(R[+3]C[-5], "C"))=1, 1, 0) -> 0
A396: 'C | B396: =IF(EQUAL(RC[-1], "G"), 1, IF(EQUAL(RC[-1], "C"), 1, 0)) -> 1 | C396: =IF(AND(EQUAL(RC[-2], "C"), EQUAL(R[+1]C[-2], "G"))=1, 1, 0) -> 0 | D396: =SUM(RC[-2]:R[+49]C[-2])*2 -> 42 | E396: =SUM(RC[-2]:R[+49]C[-2])*2 -> 4 | F396: =IF(AND(EQUAL(RC[-5], "G"), EQUAL(R[+1]C[-5], "A"), EQUAL(R[+2]C[-5], "T"), EQUAL(R[+3]C[-5], "C"))=1, 1, 0) -> 0
A397: 'T | B397: =IF(EQUAL(RC[-1], "G"), 1, IF(EQUAL(RC[-1], "C"), 1, 0)) -> 0 | C397: =IF(AND(EQUAL(RC[-2], "C"), EQUAL(R[+1]C[-2], "G"))=1, 1, 0) -> 0 | D397: =SUM(RC[-2]:R[+49]C[-2])*2 -> 40 | E397: =SUM(RC[-2]:R[+49]C[-2])*2 -> 4 | F397: =IF(AND(EQUAL(RC[-5], "G"), EQUAL(R[+1]C[-5], "A"), EQUAL(R[+2]C[-5], "T"), EQUAL(R[+3]C[-5], "C"))=1, 1, 0) -> 0
A398: 'G | B398: =IF(EQUAL(RC[-1], "G"), 1, IF(EQUAL(RC[-1], "C"), 1, 0)) -> 1 | C398: =IF(AND(EQUAL(RC[-2], "C"), EQUAL(R[+1]C[-2], "G"))=1, 1, 0) -> 0 | D398: =SUM(RC[-2]:R[+49]C[-2])*2 -> 40 | E398: =SUM(RC[-2]:R[+49]C[-2])*2 -> 4 | F398: =IF(AND(EQUAL(RC[-5], "G"), EQUAL(R[+1]C[-5], "A"), EQUAL(R[+2]C[-5], "T"), EQUAL(R[+3]C[-5], "C"))=1, 1, 0) -> 0
A399: 'T | B399: =IF(EQUAL(RC[-1], "G"), 1, IF(EQUAL(RC[-1], "C"), 1, 0)) -> 0 | C399: =IF(AND(EQUAL(RC[-2], "C"), EQUAL(R[+1]C[-2], "G"))=1, 1, 0) -> 0 | D399: =SUM(RC[-2]:R[+49]C[-2])*2 -> 40 | E399: =SUM(RC[-2]:R[+49]C[-2])*2 -> 4 | F399: =IF(AND(EQUAL(RC[-5], "G"), EQUAL(R[+1]C[-5], "A"), EQUAL(R[+2]C[-5], "T"), EQUAL(R[+3]C[-5], "C"))=1, 1, 0) -> 0
A400: 'T | B400: =IF(EQUAL(RC[-1], "G"), 1, IF(EQUAL(RC[-1], "C"), 1, 0)) -> 0 | C400: =IF(AND(EQUAL(RC[-2], "C"), EQUAL(R[+1]C[-2], "G"))=1, 1, 0) -> 0 | D400: =SUM(RC[-2]:R[+49]C[-2])*2 -> 40 | E400: =SUM(RC[-2]:R[+49]C[-2])*2 -> 4 | F400: =IF(AND(EQUAL(RC[-5], "G"), EQUAL(R[+1]C[-5], "A"), EQUAL(R[+2]C[-5], "T"), EQUAL(R[+3]C[-5], "C"))=1, 1, 0) -> 0
A401: 'T | B401: =IF(EQUAL(RC[-1], "G"), 1, IF(EQUAL(RC[-1], "C"), 1, 0)) -> 0 | C401: =IF(AND(EQUAL(RC[-2], "C"), EQUAL(R[+1]C[-2], "G"))=1, 1, 0) -> 0 | D401: =SUM(RC[-2]:R[+49]C[-2])*2 -> 40 | E401: =SUM(RC[-2]:R[+49]C[-2])*2 -> 4 | F401: =IF(AND(EQUAL(RC[-5], "G"), EQUAL(R[+1]C[-5], "A"), EQUAL(R[+2]C[-5], "T"), EQUAL(R[+3]C[-5], "C"))=1, 1, 0) -> 0
A402: 'A | B402: =IF(EQUAL(RC[-1], "G"), 1, IF(EQUAL(RC[-1], "C"), 1, 0)) -> 0 | C402: =IF(AND(EQUAL(RC[-2], "C"), EQUAL(R[+1]C[-2], "G"))=1, 1, 0) -> 0 | D402: =SUM(RC[-2]:R[+49]C[-2])*2 -> 42 | E402: =SUM(RC[-2]:R[+49]C[-2])*2 -> 4 | F402: =IF(AND(EQUAL(RC[-5], "G"), EQUAL(R[+1]C[-5], "A"), EQUAL(R[+2]C[-5], "T"), EQUAL(R[+3]C[-5], "C"))=1, 1, 0) -> 0
A403: 'G | B403: =IF(EQUAL(RC[-1], "G"), 1, IF(EQUAL(RC[-1], "C"), 1, 0)) -> 1 | C403: =IF(AND(EQUAL(RC[-2], "C"), EQUAL(R[+1]C[-2], "G"))=1, 1, 0) -> 0 | D403: =SUM(RC[-2]:R[+49]C[-2])*2 -> 42 | E403: =SUM(RC[-2]:R[+49]C[-2])*2 -> 4 | F403: =IF(AND(EQUAL(RC[-5], "G"), EQUAL(R[+1]C[-5], "A"), EQUAL(R[+2]C[-5], "T"), EQUAL(R[+3]C[-5], "C"))=1, 1, 0) -> 0
A404: 'G | B404: =IF(EQUAL(RC[-1], "G"), 1, IF(EQUAL(RC[-1], "C"), 1, 0)) -> 1 | C404: =IF(AND(EQUAL(RC[-2], "C"), EQUAL(R[+1]C[-2], "G"))=1, 1, 0) -> 0 | D404: =SUM(RC[-2]:R[+49]C[-2])*2 -> 42 | E404: =SUM(RC[-2]:R[+49]C[-2])*2 -> 4 | F404: =IF(AND(EQUAL(RC[-5], "G"), EQUAL(R[+1]C[-5], "A"), EQUAL(R[+2]C[-5], "T"), EQUAL(R[+3]C[-5], "C"))=1, 1, 0) -> 0
A405: 'G | B405: =IF(EQUAL(RC[-1], "G"), 1, IF(EQUAL(RC[-1], "C"), 1, 0)) -> 1 | C405: =IF(AND(EQUAL(RC[-2], "C"), EQUAL(R[+1]C[-2], "G"))=1, 1, 0) -> 0 | D405: =SUM(RC[-2]:R[+49]C[-2])*2 -> 42 | E405: =SUM(RC[-2]:R[+49]C[-2])*2 -> 4 | F405: =IF(AND(EQUAL(RC[-5], "G"), EQUAL(R[+1]C[-5], "A"), EQUAL(R[+2]C[-5], "T"), EQUAL(R[+3]C[-5], "C"))=1, 1, 0) -> 0
A406: 'C | B406: =IF(EQUAL(RC[-1], "G"), 1, IF(EQUAL(RC[-1], "C"), 1, 0)) -> 1 | C406: =IF(AND(EQUAL(RC[-2], "C"), EQUAL(R[+1]C[-2], "G"))=1, 1, 0) -> 0 | D406: =SUM(RC[-2]:R[+49]C[-2])*2 -> 42 | E406: =SUM(RC[-2]:R[+49]C[-2])*2 -> 4 | F406: =IF(AND(EQUAL(RC[-5], "G"), EQUAL(R[+1]C[-5], "A"), EQUAL(R[+2]C[-5], "T"), EQUAL(R[+3]C[-5], "C"))=1, 1, 0) -> 0
A407: 'T | B407: =IF(EQUAL(RC[-1], "G"), 1, IF(EQUAL(RC[-1], "C"), 1, 0)) -> 0 | C407: =IF(AND(EQUAL(RC[-2], "C"), EQUAL(R[+1]C[-2], "G"))=1, 1, 0) -> 0 | D407: =SUM(RC[-2]:R[+49]C[-2])*2 -> 42 | E407: =SUM(RC[-2]:R[+49]C[-2])*2 -> 4 | F407: =IF(AND(EQUAL(RC[-5], "G"), EQUAL(R[+1]C[-5], "A"), EQUAL(R[+2]C[-5], "T"), EQUAL(R[+3]C[-5], "C"))=1, 1, 0) -> 0
A408: 'G | B408: =IF(EQUAL(RC[-1], "G"), 1, IF(EQUAL(RC[-1], "C"), 1, 0)) -> 1 | C408: =IF(AND(EQUAL(RC[-2], "C"), EQUAL(R[+1]C[-2], "G"))=1, 1, 0) -> 0 | D408: =SUM(RC[-2]:R[+49]C[-2])*2 -> 44 | E408: =SUM(RC[-2]:R[+49]C[-2])*2 -> 4 | F408: =IF(AND(EQUAL(RC[-5], "G"), EQUAL(R[+1]C[-5], "A"), EQUAL(R[+2]C[-5], "T"), EQUAL(R[+3]C[-5], "C"))=1, 1, 0) -> 0
A409: 'T | B409: =IF(EQUAL(RC[-1], "G"), 1, IF(EQUAL(RC[-1], "C"), 1, 0)) -> 0 | C409: =IF(AND(EQUAL(RC[-2], "C"), EQUAL(R[+1]C[-2], "G"))=1, 1, 0) -> 0 | D409: =SUM(RC[-2]:R[+49]C[-2])*2 -> 42 | E409: =SUM(RC[-2]:R[+49]C[-2])*2 -> 4 | F409: =IF(AND(EQUAL(RC[-5], "G"), EQUAL(R[+1]C[-5], "A"), EQUAL(R[+2]C[-5], "T"), EQUAL(R[+3]C[-5], "C"))=1, 1, 0) -> 0
A410: 'G | B410: =IF(EQUAL(RC[-1], "G"), 1, IF(EQUAL(RC[-1], "C"), 1, 0)) -> 1 | C410: =IF(AND(EQUAL(RC[-2], "C"), EQUAL(R[+1]C[-2], "G"))=1, 1, 0) -> 0 | D410: =SUM(RC[-2]:R[+49]C[-2])*2 -> 42 | E410: =SUM(RC[-2]:R[+49]C[-2])*2 -> 4 | F410: =IF(AND(EQUAL(RC[-5], "G"), EQUAL(R[+1]C[-5], "A"), EQUAL(R[+2]C[-5], "T"), EQUAL(R[+3]C[-5], "C"))=1, 1, 0) -> 0
A411: 'G | B411: =IF(EQUAL(RC[-1], "G"), 1, IF(EQUAL(RC[-1], "C"), 1, 0)) -> 1 | C411: =IF(AND(EQUAL(RC[-2], "C"), EQUAL(R[+1]C[-2], "G"))=1, 1, 0) -> 0 | D411: =SUM(RC[-2]:R[+49]C[-2])*2 -> 40 | E411: =SUM(RC[-2]:R[+49]C[-2])*2 -> 4 | F411: =IF(AND(EQUAL(RC[-5], "G"), EQUAL(R[+1]C[-5], "A"), EQUAL(R[+2]C[-5], "T"), EQUAL(R[+3]C[-5], "C"))=1, 1, 0) -> 0
A412: 'T | B412: =IF(EQUAL(RC[-1], "G"), 1, IF(EQUAL(RC[-1], "C"), 1, 0)) -> 0 | C412: =IF(AND(EQUAL(RC[-2], "C"), EQUAL(R[+1]C[-2], "G"))=1, 1, 0) -> 0 | D412: =SUM(RC[-2]:R[+49]C[-2])*2 -> 40 | E412: =SUM(RC[-2]:R[+49]C[-2])*2 -> 4 | F412: =IF(AND(EQUAL(RC[-5], "G"), EQUAL(R[+1]C[-5], "A"), EQUAL(R[+2]C[-5], "T"), EQUAL(R[+3]C[-5], "C"))=1, 1, 0) -> 0
A413: 'G | B413: =IF(EQUAL(RC[-1], "G"), 1, IF(EQUAL(RC[-1], "C"), 1, 0)) -> 1 | C413: =IF(AND(EQUAL(RC[-2], "C"), EQUAL(R[+1]C[-2], "G"))=1, 1, 0) -> 0 | D413: =SUM(RC[-2]:R[+49]C[-2])*2 -> 40 | E413: =SUM(RC[-2]:R[+49]C[-2])*2 -> 4 | F413: =IF(AND(EQUAL(RC[-5], "G"), EQUAL(R[+1]C[-5], "A"), EQUAL(R[+2]C[-5], "T"), EQUAL(R[+3]C[-5], "C"))=1, 1, 0) -> 0
A414: 'C | B414: =IF(EQUAL(RC[-1], "G"), 1, IF(EQUAL(RC[-1], "C"), 1, 0)) -> 1 | C414: =IF(AND(EQUAL(RC[-2], "C"), EQUAL(R[+1]C[-2], "G"))=1, 1, 0) -> 0 | D414: =SUM(RC[-2]:R[+49]C[-2])*2 -> 40 | E414: =SUM(RC[-2]:R[+49]C[-2])*2 -> 4 | F414: =IF(AND(EQUAL(RC[-5], "G"), EQUAL(R[+1]C[-5], "A"), EQUAL(R[+2]C[-5], "T"), EQUAL(R[+3]C[-5], "C"))=1, 1, 0) -> 0
A415: 'T | B415: =IF(EQUAL(RC[-1], "G"), 1, IF(EQUAL(RC[-1], "C"), 1, 0)) -> 0 | C415: =IF(AND(EQUAL(RC[-2], "C"), EQUAL(R[+1]C[-2], "G"))=1, 1, 0) -> 0 | D415: =SUM(RC[-2]:R[+49]C[-2])*2 -> 40 | E415: =SUM(RC[-2]:R[+49]C[-2])*2 -> 4 | F415: =IF(AND(EQUAL(RC[-5], "G"), EQUAL(R[+1]C[-5], "A"), EQUAL(R[+2]C[-5], "T"), EQUAL(R[+3]C[-5], "C"))=1, 1, 0) -> 0
A416: 'C | B416: =IF(EQUAL(RC[-1], "G"), 1, IF(EQUAL(RC[-1], "C"), 1, 0)) -> 1 | C416: =IF(AND(EQUAL(RC[-2], "C"), EQUAL(R[+1]C[-2], "G"))=1, 1, 0) -> 0 | D416: =SUM(RC[-2]:R[+49]C[-2])*2 -> 40 | E416: =SUM(RC[-2]:R[+49]C[-2])*2 -> 4 | F416: =IF(AND(EQUAL(RC[-5], "G"), EQUAL(R[+1]C[-5], "A"), EQUAL(R[+2]C[-5], "T"), EQUAL(R[+3]C[-5], "C"))=1, 1, 0) -> 0
A417: 'A | B417: =IF(EQUAL(RC[-1], "G"), 1, IF(EQUAL(RC[-1], "C"), 1, 0)) -> 0 | C417: =IF(AND(EQUAL(RC[-2], "C"), EQUAL(R[+1]C[-2], "G"))=1, 1, 0) -> 0 | D417: =SUM(RC[-2]:R[+49]C[-2])*2 -> 38 | E417: =SUM(RC[-2]:R[+49]C[-2])*2 -> 4 | F417: =IF(AND(EQUAL(RC[-5], "G"), EQUAL(R[+1]C[-5], "A"), EQUAL(R[+2]C[-5], "T"), EQUAL(R[+3]C[-5], "C"))=1, 1, 0) -> 0
A418: 'A | B418: =IF(EQUAL(RC[-1], "G"), 1, IF(EQUAL(RC[-1], "C"), 1, 0)) -> 0 | C418: =IF(AND(EQUAL(RC[-2], "C"), EQUAL(R[+1]C[-2], "G"))=1, 1, 0) -> 0 | D418: =SUM(RC[-2]:R[+49]C[-2])*2 -> 38 | E418: =SUM(RC[-2]:R[+49]C[-2])*2 -> 4 | F418: =IF(AND(EQUAL(RC[-5], "G"), EQUAL(R[+1]C[-5], "A"), EQUAL(R[+2]C[-5], "T"), EQUAL(R[+3]C[-5], "C"))=1, 1, 0) -> 0
A419: 'T | B419: =IF(EQUAL(RC[-1], "G"), 1, IF(EQUAL(RC[-1], "C"), 1, 0)) -> 0 | C419: =IF(AND(EQUAL(RC[-2], "C"), EQUAL(R[+1]C[-2], "G"))=1, 1, 0) -> 0 | D419: =SUM(RC[-2]:R[+49]C[-2])*2 -> 40 | E419: =SUM(RC[-2]:R[+49]C[-2])*2 -> 4 | F419: =IF(AND(EQUAL(RC[-5], "G"), EQUAL(R[+1]C[-5], "A"), EQUAL(R[+2]C[-5], "T"), EQUAL(R[+3]C[-5], "C"))=1, 1, 0) -> 0
A420: 'T | B420: =IF(EQUAL(RC[-1], "G"), 1, IF(EQUAL(RC[-1], "C"), 1, 0)) -> 0 | C420: =IF(AND(EQUAL(RC[-2], "C"), EQUAL(R[+1]C[-2], "G"))=1, 1, 0) -> 0 | D420: =SUM(RC[-2]:R[+49]C[-2])*2 -> 40 | E420: =SUM(RC[-2]:R[+49]C[-2])*2 -> 4 | F420: =IF(AND(EQUAL(RC[-5], "G"), EQUAL(R[+1]C[-5], "A"), EQUAL(R[+2]C[-5], "T"), EQUAL(R[+3]C[-5], "C"))=1, 1, 0) -> 0
A421: 'C | B421: =IF(EQUAL(RC[-1], "G"), 1, IF(EQUAL(RC[-1], "C"), 1, 0)) -> 1 | C421: =IF(AND(EQUAL(RC[-2], "C"), EQUAL(R[+1]C[-2], "G"))=1, 1, 0) -> 0 | D421: =SUM(RC[-2]:R[+49]C[-2])*2 -> 42 | E421: =SUM(RC[-2]:R[+49]C[-2])*2 -> 4 | F421: =IF(AND(EQUAL(RC[-5], "G"), EQUAL(R[+1]C[-5], "A"), EQUAL(R[+2]C[-5], "T"), EQUAL(R[+3]C[-5], "C"))=1, 1, 0) -> 0
A422: 'T | B422: =IF(EQUAL(RC[-1], "G"), 1, IF(EQUAL(RC[-1], "C"), 1, 0)) -> 0 | C422: =IF(AND(EQUAL(RC[-2], "C"), EQUAL(R[+1]C[-2], "G"))=1, 1, 0) -> 0 | D422: =SUM(RC[-2]:R[+49]C[-2])*2 -> 40 | E422: =SUM(RC[-2]:R[+49]C[-2])*2 -> 4 | F422: =IF(AND(EQUAL(RC[-5], "G"), EQUAL(R[+1]C[-5], "A"), EQUAL(R[+2]C[-5], "T"), EQUAL(R[+3]C[-5], "C"))=1, 1, 0) -> 0
A423: 'T | B423: =IF(EQUAL(RC[-1], "G"), 1, IF(EQUAL(RC[-1], "C"), 1, 0)) -> 0 | C423: =IF(AND(EQUAL(RC[-2], "C"), EQUAL(R[+1]C[-2], "G"))=1, 1, 0) -> 0 | D423: =SUM(RC[-2]:R[+49]C[-2])*2 -> 40 | E423: =SUM(RC[-2]:R[+49]C[-2])*2 -> 4 | F423: =IF(AND(EQUAL(RC[-5], "G"), EQUAL(R[+1]C[-5], "A"), EQUAL(R[+2]C[-5], "T"), EQUAL(R[+3]C[-5], "C"))=1, 1, 0) -> 0
A424: 'A | B424: =IF(EQUAL(RC[-1], "G"), 1, IF(EQUAL(RC[-1], "C"), 1, 0)) -> 0 | C424: =IF(AND(EQUAL(RC[-2], "C"), EQUAL(R[+1]C[-2], "G"))=1, 1, 0) -> 0 | D424: =SUM(RC[-2]:R[+49]C[-2])*2 -> 42 | E424: =SUM(RC[-2]:R[+49]C[-2])*2 -> 4 | F424: =IF(AND(EQUAL(RC[-5], "G"), EQUAL(R[+1]C[-5], "A"), EQUAL(R[+2]C[-5], "T"), EQUAL(R[+3]C[-5], "C"))=1, 1, 0) -> 0
A425: 'C | B425: =IF(EQUAL(RC[-1], "G"), 1, IF(EQUAL(RC[-1], "C"), 1, 0)) -> 1 | C425: =IF(AND(EQUAL(RC[-2], "C"), EQUAL(R[+1]C[-2], "G"))=1, 1, 0) -> 1 | D425: =SUM(RC[-2]:R[+49]C[-2])*2 -> 42 | E425: =SUM(RC[-2]:R[+49]C[-2])*2 -> 4 | F425: =IF(AND(EQUAL(RC[-5], "G"), EQUAL(R[+1]C[-5], "A"), EQUAL(R[+2]C[-5], "T"), EQUAL(R[+3]C[-5], "C"))=1, 1, 0) -> 0
A426: 'G | B426: =IF(EQUAL(RC[-1], "G"), 1, IF(EQUAL(RC[-1], "C"), 1, 0)) -> 1 | C426: =IF(AND(EQUAL(RC[-2], "C"), EQUAL(R[+1]C[-2], "G"))=1, 1, 0) -> 0 | D426: =SUM(RC[-2]:R[+49]C[-2])*2 -> 40 | E426: =SUM(RC[-2]:R[+49]C[-2])*2 -> 2 | F426: =IF(AND(EQUAL(RC[-5], "G"), EQUAL(R[+1]C[-5], "A"), EQUAL(R[+2]C[-5], "T"), EQUAL(R[+3]C[-5], "C"))=1, 1, 0) -> 0
A427: 'A | B427: =IF(EQUAL(RC[-1], "G"), 1, IF(EQUAL(RC[-1], "C"), 1, 0)) -> 0 | C427: =IF(AND(EQUAL(RC[-2], "C"), EQUAL(R[+1]C[-2], "G"))=1, 1, 0) -> 0 | D427: =SUM(RC[-2]:R[+49]C[-2])*2 -> 40 | E427: =SUM(RC[-2]:R[+49]C[-2])*2 -> 2 | F427: =IF(AND(EQUAL(RC[-5], "G"), EQUAL(R[+1]C[-5], "A"), EQUAL(R[+2]C[-5], "T"), EQUAL(R[+3]C[-5], "C"))=1, 1, 0) -> 0
A428: 'C | B428: =IF(EQUAL(RC[-1], "G"), 1, IF(EQUAL(RC[-1], "C"), 1, 0)) -> 1 | C428: =IF(AND(EQUAL(RC[-2], "C"), EQUAL(R[+1]C[-2], "G"))=1, 1, 0) -> 1 | D428: =SUM(RC[-2]:R[+49]C[-2])*2 -> 42 | E428: =SUM(RC[-2]:R[+49]C[-2])*2 -> 2 | F428: =IF(AND(EQUAL(RC[-5], "G"), EQUAL(R[+1]C[-5], "A"), EQUAL(R[+2]C[-5], "T"), EQUAL(R[+3]C[-5], "C"))=1, 1, 0) -> 0
A429: 'G | B429: =IF(EQUAL(RC[-1], "G"), 1, IF(EQUAL(RC[-1], "C"), 1, 0)) -> 1 | C429: =IF(AND(EQUAL(RC[-2], "C"), EQUAL(R[+1]C[-2], "G"))=1, 1, 0) -> 0 | D429: =SUM(RC[-2]:R[+49]C[-2])*2 -> 42 | E429: =SUM(RC[-2]:R[+49]C[-2])*2 -> 0 | F429: =IF(AND(EQUAL(RC[-5], "G"), EQUAL(R[+1]C[-5], "A"), EQUAL(R[+2]C[-5], "T"), EQUAL(R[+3]C[-5], "C"))=1, 1, 0) -> 0
A430: 'A | B430: =IF(EQUAL(RC[-1], "G"), 1, IF(EQUAL(RC[-1], "C"), 1, 0)) -> 0 | C430: =IF(AND(EQUAL(RC[-2], "C"), EQUAL(R[+1]C[-2], "G"))=1, 1, 0) -> 0 | D430: =SUM(RC[-2]:R[+49]C[-2])*2 -> 42 | E430: =SUM(RC[-2]:R[+49]C[-2])*2 -> 0 | F430: =IF(AND(EQUAL(RC[-5], "G"), EQUAL(R[+1]C[-5], "A"), EQUAL(R[+2]C[-5], "T"), EQUAL(R[+3]C[-5], "C"))=1, 1, 0) -> 0
A431: 'A | B431: =IF(EQUAL(RC[-1], "G"), 1, IF(EQUAL(RC[-1], "C"), 1, 0)) -> 0 | C431: =IF(AND(EQUAL(RC[-2], "C"), EQUAL(R[+1]C[-2], "G"))=1, 1, 0) -> 0 | D431: =SUM(RC[-2]:R[+49]C[-2])*2 -> 44 | E431: =SUM(RC[-2]:R[+49]C[-2])*2 -> 0 | F431: =IF(AND(EQUAL(RC[-5], "G"), EQUAL(R[+1]C[-5], "A"), EQUAL(R[+2]C[-5], "T"), EQUAL(R[+3]C[-5], "C"))=1, 1, 0) -> 0
A432: 'G | B432: =IF(EQUAL(RC[-1], "G"), 1, IF(EQUAL(RC[-1], "C"), 1, 0)) -> 1 | C432: =IF(AND(EQUAL(RC[-2], "C"), EQUAL(R[+1]C[-2], "G"))=1, 1, 0) -> 0 | D432: =SUM(RC[-2]:R[+49]C[-2])*2 -> 46 | E432: =SUM(RC[-2]:R[+49]C[-2])*2 -> 0 | F432: =IF(AND(EQUAL(RC[-5], "G"), EQUAL(R[+1]C[-5], "A"), EQUAL(R[+2]C[-5], "T"), EQUAL(R[+3]C[-5], "C"))=1, 1, 0) -> 0
A433: 'T | B433: =IF(EQUAL(RC[-1], "G"), 1, IF(EQUAL(RC[-1], "C"), 1, 0)) -> 0 | C433: =IF(AND(EQUAL(RC[-2], "C"), EQUAL(R[+1]C[-2], "G"))=1, 1, 0) -> 0 | D433: =SUM(RC[-2]:R[+49]C[-2])*2 -> 46 | E433: =SUM(RC[-2]:R[+49]C[-2])*2 -> 0 | F433: =IF(AND(EQUAL(RC[-5], "G"), EQUAL(R[+1]C[-5], "A"), EQUAL(R[+2]C[-5], "T"), EQUAL(R[+3]C[-5], "C"))=1, 1, 0) -> 0
A434: 'A | B434: =IF(EQUAL(RC[-1], "G"), 1, IF(EQUAL(RC[-1], "C"), 1, 0)) -> 0 | C434: =IF(AND(EQUAL(RC[-2], "C"), EQUAL(R[+1]C[-2], "G"))=1, 1, 0) -> 0 | D434: =SUM(RC[-2]:R[+49]C[-2])*2 -> 46 | E434: =SUM(RC[-2]:R[+49]C[-2])*2 -> 0 | F434: =IF(AND(EQUAL(RC[-5], "G"), EQUAL(R[+1]C[-5], "A"), EQUAL(R[+2]C[-5], "T"), EQUAL(R[+3]C[-5], "C"))=1, 1, 0) -> 0
A435: 'A | B435: =IF(EQUAL(RC[-1], "G"), 1, IF(EQUAL(RC[-1], "C"), 1, 0)) -> 0 | C435: =IF(AND(EQUAL(RC[-2], "C"), EQUAL(R[+1]C[-2], "G"))=1, 1, 0) -> 0 | D435: =SUM(RC[-2]:R[+49]C[-2])*2 -> 46 | E435: =SUM(RC[-2]:R[+49]C[-2])*2 -> 0 | F435: =IF(AND(EQUAL(RC[-5], "G"), EQUAL(R[+1]C[-5], "A"), EQUAL(R[+2]C[-5], "T"), EQUAL(R[+3]C[-5], "C"))=1, 1, 0) -> 0
A436: 'G | B436: =IF(EQUAL(RC[-1], "G"), 1, IF(EQUAL(RC[-1], "C"), 1, 0)) -> 1 | C436: =IF(AND(EQUAL(RC[-2], "C"), EQUAL(R[+1]C[-2], "G"))=1, 1, 0) -> 0 | D436: =SUM(RC[-2]:R[+49]C[-2])*2 -> 48 | E436: =SUM(RC[-2]:R[+49]C[-2])*2 -> 0 | F436: =IF(AND(EQUAL(RC[-5], "G"), EQUAL(R[+1]C[-5], "A"), EQUAL(R[+2]C[-5], "T"), EQUAL(R[+3]C[-5], "C"))=1, 1, 0) -> 0
A437: 'A | B437: =IF(EQUAL(RC[-1], "G"), 1, IF(EQUAL(RC[-1], "C"), 1, 0)) -> 0 | C437: =IF(AND(EQUAL(RC[-2], "C"), EQUAL(R[+1]C[-2], "G"))=1, 1, 0) -> 0 | D437: =SUM(RC[-2]:R[+49]C[-2])*2 -> 48 | E437: =SUM(RC[-2]:R[+49]C[-2])*2 -> 0 | F437: =IF(AND(EQUAL(RC[-5], "G"), EQUAL(R[+1]C[-5], "A"), EQUAL(R[+2]C[-5], "T"), EQUAL(R[+3]C[-5], "C"))=1, 1, 0) -> 0
A438: 'A | B438: =IF(EQUAL(RC[-1], "G"), 1, IF(EQUAL(RC[-1], "C"), 1, 0)) -> 0 | C438: =IF(AND(EQUAL(RC[-2], "C"), EQUAL(R[+1]C[-2], "G"))=1, 1, 0) -> 0 | D438: =SUM(RC[-2]:R[+49]C[-2])*2 -> 50 | E438: =SUM(RC[-2]:R[+49]C[-2])*2 -> 0 | F438: =IF(AND(EQUAL(RC[-5], "G"), EQUAL(R[+1]C[-5], "A"), EQUAL(R[+2]C[-5], "T"), EQUAL(R[+3]C[-5], "C"))=1, 1, 0) -> 0
A439: 'T | B439: =IF(EQUAL(RC[-1], "G"), 1, IF(EQUAL(RC[-1], "C"), 1, 0)) -> 0 | C439: =IF(AND(EQUAL(RC[-2], "C"), EQUAL(R[+1]C[-2], "G"))=1, 1, 0) -> 0 | D439: =SUM(RC[-2]:R[+49]C[-2])*2 -> 50 | E439: =SUM(RC[-2]:R[+49]C[-2])*2 -> 0 | F439: =IF(AND(EQUAL(RC[-5], "G"), EQUAL(R[+1]C[-5], "A"), EQUAL(R[+2]C[-5], "T"), EQUAL(R[+3]C[-5], "C"))=1, 1, 0) -> 0
A440: 'G | B440: =IF(EQUAL(RC[-1], "G"), 1, IF(EQUAL(RC[-1], "C"), 1, 0)) -> 1 | C440: =IF(AND(EQUAL(RC[-2], "C"), EQUAL(R[+1]C[-2], "G"))=1, 1, 0) -> 0 | D440: =SUM(RC[-2]:R[+49]C[-2])*2 -> 50 | E440: =SUM(RC[-2]:R[+49]C[-2])*2 -> 0 | F440: =IF(AND(EQUAL(RC[-5], "G"), EQUAL(R[+1]C[-5], "A"), EQUAL(R[+2]C[-5], "T"), EQUAL(R[+3]C[-5], "C"))=1, 1, 0) -> 0
A441: 'T | B441: =IF(EQUAL(RC[-1], "G"), 1, IF(EQUAL(RC[-1], "C"), 1, 0)) -> 0 | C441: =IF(AND(EQUAL(RC[-2], "C"), EQUAL(R[+1]C[-2], "G"))=1, 1, 0) -> 0 | D441: =SUM(RC[-2]:R[+49]C[-2])*2 -> 48 | E441: =SUM(RC[-2]:R[+49]C[-2])*2 -> 0 | F441: =IF(AND(EQUAL(RC[-5], "G"), EQUAL(R[+1]C[-5], "A"), EQUAL(R[+2]C[-5], "T"), EQUAL(R[+3]C[-5], "C"))=1, 1, 0) -> 0
A442: 'T | B442: =IF(EQUAL(RC[-1], "G"), 1, IF(EQUAL(RC[-1], "C"), 1, 0)) -> 0 | C442: =IF(AND(EQUAL(RC[-2], "C"), EQUAL(R[+1]C[-2], "G"))=1, 1, 0) -> 0 | D442: =SUM(RC[-2]:R[+49]C[-2])*2 -> 50 | E442: =SUM(RC[-2]:R[+49]C[-2])*2 -> 0 | F442: =IF(AND(EQUAL(RC[-5], "G"), EQUAL(R[+1]C[-5], "A"), EQUAL(R[+2]C[-5], "T"), EQUAL(R[+3]C[-5], "C"))=1, 1, 0) -> 0
A443: 'T | B443: =IF(EQUAL(RC[-1], "G"), 1, IF(EQUAL(RC[-1], "C"), 1, 0)) -> 0 | C443: =IF(AND(EQUAL(RC[-2], "C"), EQUAL(R[+1]C[-2], "G"))=1, 1, 0) -> 0 | D443: =SUM(RC[-2]:R[+49]C[-2])*2 -> 50 | E443: =SUM(RC[-2]:R[+49]C[-2])*2 -> 0 | F443: =IF(AND(EQUAL(RC[-5], "G"), EQUAL(R[+1]C[-5], "A"), EQUAL(R[+2]C[-5], "T"), EQUAL(R[+3]C[-5], "C"))=1, 1, 0) -> 0
A444: 'G | B444: =IF(EQUAL(RC[-1], "G"), 1, IF(EQUAL(RC[-1], "C"), 1, 0)) -> 1 | C444: =IF(AND(EQUAL(RC[-2], "C"), EQUAL(R[+1]C[-2], "G"))=1, 1, 0) -> 0 | D444: =SUM(RC[-2]:R[+49]C[-2])*2 -> 52 | E444: =SUM(RC[-2]:R[+49]C[-2])*2 -> 0 | F444: =IF(AND(EQUAL(RC[-5], "G"), EQUAL(R[+1]C[-5], "A"), EQUAL(R[+2]C[-5], "T"), EQUAL(R[+3]C[-5], "C"))=1, 1, 0) -> 0
A445: 'A | B445: =IF(EQUAL(RC[-1], "G"), 1, IF(EQUAL(RC[-1], "C"), 1, 0)) -> 0 | C445: =IF(AND(EQUAL(RC[-2], "C"), EQUAL(R[+1]C[-2], "G"))=1, 1, 0) -> 0 | D445: =SUM(RC[-2]:R[+49]C[-2])*2 -> 52 | E445: =SUM(RC[-2]:R[+49]C[-2])*2 -> 0 | F445: =IF(AND(EQUAL(RC[-5], "G"), EQUAL(R[+1]C[-5], "A"), EQUAL(R[+2]C[-5], "T"), EQUAL(R[+3]C[-5], "C"))=1, 1, 0) -> 0
A446: 'A | B446: =IF(EQUAL(RC[-1], "G"), 1, IF(EQUAL(RC[-1], "C"), 1, 0)) -> 0 | C446: =IF(AND(EQUAL(RC[-2], "C"), EQUAL(R[+1]C[-2], "G"))=1, 1, 0) -> 0 | D446: =SUM(RC[-2]:R[+49]C[-2])*2 -> 52 | E446: =SUM(RC[-2]:R[+49]C[-2])*2 -> 0 | F446: =IF(AND(EQUAL(RC[-5], "G"), EQUAL(R[+1]C[-5], "A"), EQUAL(R[+2]C[-5], "T"), EQUAL(R[+3]C[-5], "C"))=1, 1, 0) -> 0
A447: 'A | B447: =IF(EQUAL(RC[-1], "G"), 1, IF(EQUAL(RC[-1], "C"), 1, 0)) -> 0 | C447: =IF(AND(EQUAL(RC[-2], "C"), EQUAL(R[+1]C[-2], "G"))=1, 1, 0) -> 0 | D447: =SUM(RC[-2]:R[+49]C[-2])*2 -> 54 | E447: =SUM(RC[-2]:R[+49]C[-2])*2 -> 0 | F447: =IF(AND(EQUAL(RC[-5], "G"), EQUAL(R[+1]C[-5], "A"), EQUAL(R[+2]C[-5], "T"), EQUAL(R[+3]C[-5], "C"))=1, 1, 0) -> 0
A448: 'G | B448: =IF(EQUAL(RC[-1], "G"), 1, IF(EQUAL(RC[-1], "C"), 1, 0)) -> 1 | C448: =IF(AND(EQUAL(RC[-2], "C"), EQUAL(R[+1]C[-2], "G"))=1, 1, 0) -> 0 | D448: =SUM(RC[-2]:R[+49]C[-2])*2 -> 54 | E448: =SUM(RC[-2]:R[+49]C[-2])*2 -> 0 | F448: =IF(AND(EQUAL(RC[-5], "G"), EQUAL(R[+1]C[-5], "A"), EQUAL(R[+2]C[-5], "T"), EQUAL(R[+3]C[-5], "C"))=1, 1, 0) -> 0
A449: 'A | B449: =IF(EQUAL(RC[-1], "G"), 1, IF(EQUAL(RC[-1], "C"), 1, 0)) -> 0 | C449: =IF(AND(EQUAL(RC[-2], "C"), EQUAL(R[+1]C[-2], "G"))=1, 1, 0) -> 0 | D449: =SUM(RC[-2]:R[+49]C[-2])*2 -> 52 | E449: =SUM(RC[-2]:R[+49]C[-2])*2 -> 0 | F449: =IF(AND(EQUAL(RC[-5], "G"), EQUAL(R[+1]C[-5], "A"), EQUAL(R[+2]C[-5], "T"), EQUAL(R[+3]C[-5], "C"))=1, 1, 0) -> 0
A450: 'A | B450: =IF(EQUAL(RC[-1], "G"), 1, IF(EQUAL(RC[-1], "C"), 1, 0)) -> 0 | C450: =IF(AND(EQUAL(RC[-2], "C"), EQUAL(R[+1]C[-2], "G"))=1, 1, 0) -> 0 | D450: =SUM(RC[-2]:R[+49]C[-2])*2 -> 54 | E450: =SUM(RC[-2]:R[+49]C[-2])*2 -> 0 | F450: =IF(AND(EQUAL(RC[-5], "G"), EQUAL(R[+1]C[-5], "A"), EQUAL(R[+2]C[-5], "T"), EQUAL(R[+3]C[-5], "C"))=1, 1, 0) -> 0
A451: 'C | B451: =IF(EQUAL(RC[-1], "G"), 1, IF(EQUAL(RC[-1], "C"), 1, 0)) -> 1 | C451: =IF(AND(EQUAL(RC[-2], "C"), EQUAL(R[+1]C[-2], "G"))=1, 1, 0) -> 0 | D451: =SUM(RC[-2]:R[+49]C[-2])*2 -> 54 | E451: =SUM(RC[-2]:R[+49]C[-2])*2 -> 0 | F451: =IF(AND(EQUAL(RC[-5], "G"), EQUAL(R[+1]C[-5], "A"), EQUAL(R[+2]C[-5], "T"), EQUAL(R[+3]C[-5], "C"))=1, 1, 0) -> 0
A452: 'T | B452: =IF(EQUAL(RC[-1], "G"), 1, IF(EQUAL(RC[-1], "C"), 1, 0)) -> 0 | C452: =IF(AND(EQUAL(RC[-2], "C"), EQUAL(R[+1]C[-2], "G"))=1, 1, 0) -> 0 | D452: =SUM(RC[-2]:R[+49]C[-2])*2 -> 54 | E452: =SUM(RC[-2]:R[+49]C[-2])*2 -> 0 | F452: =IF(AND(EQUAL(RC[-5], "G"), EQUAL(R[+1]C[-5], "A"), EQUAL(R[+2]C[-5], "T"), EQUAL(R[+3]C[-5], "C"))=1, 1, 0) -> 0
A453: 'G | B453: =IF(EQUAL(RC[-1], "G"), 1, IF(EQUAL(RC[-1], "C"), 1, 0)) -> 1 | C453: =IF(AND(EQUAL(RC[-2], "C"), EQUAL(R[+1]C[-2], "G"))=1, 1, 0) -> 0 | D453: =SUM(RC[-2]:R[+49]C[-2])*2 -> 56 | E453: =SUM(RC[-2]:R[+49]C[-2])*2 -> 0 | F453: =IF(AND(EQUAL(RC[-5], "G"), EQUAL(R[+1]C[-5], "A"), EQUAL(R[+2]C[-5], "T"), EQUAL(R[+3]C[-5], "C"))=1, 1, 0) -> 0
A454: 'G | B454: =IF(EQUAL(RC[-1], "G"), 1, IF(EQUAL(RC[-1], "C"), 1, 0)) -> 1 | C454: =IF(AND(EQUAL(RC[-2], "C"), EQUAL(R[+1]C[-2], "G"))=1, 1, 0) -> 0 | D454: =SUM(RC[-2]:R[+49]C[-2])*2 -> 56 | E454: =SUM(RC[-2]:R[+49]C[-2])*2 -> 0 | F454: =IF(AND(EQUAL(RC[-5], "G"), EQUAL(R[+1]C[-5], "A"), EQUAL(R[+2]C[-5], "T"), EQUAL(R[+3]C[-5], "C"))=1, 1, 0) -> 0
A455: 'G | B455: =IF(EQUAL(RC[-1], "G"), 1, IF(EQUAL(RC[-1], "C"), 1, 0)) -> 1 | C455: =IF(AND(EQUAL(RC[-2], "C"), EQUAL(R[+1]C[-2], "G"))=1, 1, 0) -> 0 | D455: =SUM(RC[-2]:R[+49]C[-2])*2 -> 54 | E455: =SUM(RC[-2]:R[+49]C[-2])*2 -> 0 | F455: =IF(AND(EQUAL(RC[-5], "G"), EQUAL(R[+1]C[-5], "A"), EQUAL(R[+2]C[-5], "T"), EQUAL(R[+3]C[-5], "C"))=1, 1, 0) -> 0
A456: 'C | B456: =IF(EQUAL(RC[-1], "G"), 1, IF(EQUAL(RC[-1], "C"), 1, 0)) -> 1 | C456: =IF(AND(EQUAL(RC[-2], "C"), EQUAL(R[+1]C[-2], "G"))=1, 1, 0) -> 0 | D456: =SUM(RC[-2]:R[+49]C[-2])*2 -> 54 | E456: =SUM(RC[-2]:R[+49]C[-2])*2 -> 0 | F456: =IF(AND(EQUAL(RC[-5], "G"), EQUAL(R[+1]C[-5], "A"), EQUAL(R[+2]C[-5], "T"), EQUAL(R[+3]C[-5], "C"))=1, 1, 0) -> 0
A457: 'C | B457: =IF(EQUAL(RC[-1], "G"), 1, IF(EQUAL(RC[-1], "C"), 1, 0)) -> 1 | C457: =IF(AND(EQUAL(RC[-2], "C"), EQUAL(R[+1]C[-2], "G"))=1, 1, 0) -> 0 | D457: =SUM(RC[-2]:R[+49]C[-2])*2 -> 52 | E457: =SUM(RC[-2]:R[+49]C[-2])*2 -> 0 | F457: =IF(AND(EQUAL(RC[-5], "G"), EQUAL(R[+1]C[-5], "A"), EQUAL(R[+2]C[-5], "T"), EQUAL(R[+3]C[-5], "C"))=1, 1, 0) -> 0
A458: 'T | B458: =IF(EQUAL(RC[-1], "G"), 1, IF(EQUAL(RC[-1], "C"), 1, 0)) -> 0 | C458: =IF(AND(EQUAL(RC[-2], "C"), EQUAL(R[+1]C[-2], "G"))=1, 1, 0) -> 0 | D458: =SUM(RC[-2]:R[+49]C[-2])*2 -> 50 | E458: =SUM(RC[-2]:R[+49]C[-2])*2 -> 0 | F458: =IF(AND(EQUAL(RC[-5], "G"), EQUAL(R[+1]C[-5], "A"), EQUAL(R[+2]C[-5], "T"), EQUAL(R[+3]C[-5], "C"))=1, 1, 0) -> 0
A459: 'A | B459: =IF(EQUAL(RC[-1], "G"), 1, IF(EQUAL(RC[-1], "C"), 1, 0)) -> 0 | C459: =IF(AND(EQUAL(RC[-2], "C"), EQUAL(R[+1]C[-2], "G"))=1, 1, 0) -> 0 | D459: =SUM(RC[-2]:R[+49]C[-2])*2 -> 50 | E459: =SUM(RC[-2]:R[+49]C[-2])*2 -> 0 | F459: =IF(AND(EQUAL(RC[-5], "G"), EQUAL(R[+1]C[-5], "A"), EQUAL(R[+2]C[-5], "T"), EQUAL(R[+3]C[-5], "C"))=1, 1, 0) -> 0
A460: 'A | B460: =IF(EQUAL(RC[-1], "G"), 1, IF(EQUAL(RC[-1], "C"), 1, 0)) -> 0 | C460: =IF(AND(EQUAL(RC[-2], "C"), EQUAL(R[+1]C[-2], "G"))=1, 1, 0) -> 0 | D460: =SUM(RC[-2]:R[+49]C[-2])*2 -> 50 | E460: =SUM(RC[-2]:R[+49]C[-2])*2 -> 0 | F460: =IF(AND(EQUAL(RC[-5], "G"), EQUAL(R[+1]C[-5], "A"), EQUAL(R[+2]C[-5], "T"), EQUAL(R[+3]C[-5], "C"))=1, 1, 0) -> 0
A461: 'G | B461: =IF(EQUAL(RC[-1], "G"), 1, IF(EQUAL(RC[-1], "C"), 1, 0)) -> 1 | C461: =IF(AND(EQUAL(RC[-2], "C"), EQUAL(R[+1]C[-2], "G"))=1, 1, 0) -> 0 | D461: =SUM(RC[-2]:R[+49]C[-2])*2 -> 50 | E461: =SUM(RC[-2]:R[+49]C[-2])*2 -> 0 | F461: =IF(AND(EQUAL(RC[-5], "G"), EQUAL(R[+1]C[-5], "A"), EQUAL(R[+2]C[-5], "T"), EQUAL(R[+3]C[-5], "C"))=1, 1, 0) -> 0
A462: 'A | B462: =IF(EQUAL(RC[-1], "G"), 1, IF(EQUAL(RC[-1], "C"), 1, 0)) -> 0 | C462: =IF(AND(EQUAL(RC[-2], "C"), EQUAL(R[+1]C[-2], "G"))=1, 1, 0) -> 0 | D462: =SUM(RC[-2]:R[+49]C[-2])*2 -> 48 | E462: =SUM(RC[-2]:R[+49]C[-2])*2 -> 0 | F462: =IF(AND(EQUAL(RC[-5], "G"), EQUAL(R[+1]C[-5], "A"), EQUAL(R[+2]C[-5], "T"), EQUAL(R[+3]C[-5], "C"))=1, 1, 0) -> 0
A463: 'G | B463: =IF(EQUAL(RC[-1], "G"), 1, IF(EQUAL(RC[-1], "C"), 1, 0)) -> 1 | C463: =IF(AND(EQUAL(RC[-2], "C"), EQUAL(R[+1]C[-2], "G"))=1, 1, 0) -> 0 | D463: =SUM(RC[-2]:R[+49]C[-2])*2 -> 50 | E463: =SUM(RC[-2]:R[+49]C[-2])*2 -> 0 | F463: =IF(AND(EQUAL(RC[-5], "G"), EQUAL(R[+1]C[-5], "A"), EQUAL(R[+2]C[-5], "T"), EQUAL(R[+3]C[-5], "C"))=1, 1, 0) -> 0
A464: 'G | B464: =IF(EQUAL(RC[-1], "G"), 1, IF(EQUAL(RC[-1], "C"), 1, 0)) -> 1 | C464: =IF(AND(EQUAL(RC[-2], "C"), EQUAL(R[+1]C[-2], "G"))=1, 1, 0) -> 0 | D464: =SUM(RC[-2]:R[+49]C[-2])*2 -> 50 | E464: =SUM(RC[-2]:R[+49]C[-2])*2 -> 2 | F464: =IF(AND(EQUAL(RC[-5], "G"), EQUAL(R[+1]C[-5], "A"), EQUAL(R[+2]C[-5], "T"), EQUAL(R[+3]C[-5], "C"))=1, 1, 0) -> 0
A465: 'A | B465: =IF(EQUAL(RC[-1], "G"), 1, IF(EQUAL(RC[-1], "C"), 1, 0)) -> 0 | C465: =IF(AND(EQUAL(RC[-2], "C"), EQUAL(R[+1]C[-2], "G"))=1, 1, 0) -> 0 | D465: =SUM(RC[-2]:R[+49]C[-2])*2 -> 50 | E465: =SUM(RC[-2]:R[+49]C[-2])*2 -> 2 | F465: =IF(AND(EQUAL(RC[-5], "G"), EQUAL(R[+1]C[-5], "A"), EQUAL(R[+2]C[-5], "T"), EQUAL(R[+3]C[-5], "C"))=1, 1, 0) -> 0
A466: 'A | B466: =IF(EQUAL(RC[-1], "G"), 1, IF(EQUAL(RC[-1], "C"), 1, 0)) -> 0 | C466: =IF(AND(EQUAL(RC[-2], "C"), EQUAL(R[+1]C[-2], "G"))=1, 1, 0) -> 0 | D466: =SUM(RC[-2]:R[+49]C[-2])*2 -> 52 | E466: =SUM(RC[-2]:R[+49]C[-2])*2 -> 2 | F466: =IF(AND(EQUAL(RC[-5], "G"), EQUAL(R[+1]C[-5], "A"), EQUAL(R[+2]C[-5], "T"), EQUAL(R[+3]C[-5], "C"))=1, 1, 0) -> 0
A467: 'T | B467: =IF(EQUAL(RC[-1], "G"), 1, IF(EQUAL(RC[-1], "C"), 1, 0)) -> 0 | C467: =IF(AND(EQUAL(RC[-2], "C"), EQUAL(R[+1]C[-2], "G"))=1, 1, 0) -> 0 | D467: =SUM(RC[-2]:R[+49]C[-2])*2 -> 52 | E467: =SUM(RC[-2]:R[+49]C[-2])*2 -> 2 | F467: =IF(AND(EQUAL(RC[-5], "G"), EQUAL(R[+1]C[-5], "A"), EQUAL(R[+2]C[-5], "T"), EQUAL(R[+3]C[-5], "C"))=1, 1, 0) -> 0
A468: 'C | B468: =IF(EQUAL(RC[-1], "G"), 1, IF(EQUAL(RC[-1], "C"), 1, 0)) -> 1 | C468: =IF(AND(EQUAL(RC[-2], "C"), EQUAL(R[+1]C[-2], "G"))=1, 1, 0) -> 0 | D468: =SUM(RC[-2]:R[+49]C[-2])*2 -> 52 | E468: =SUM(RC[-2]:R[+49]C[-2])*2 -> 2 | F468: =IF(AND(EQUAL(RC[-5], "G"), EQUAL(R[+1]C[-5], "A"), EQUAL(R[+2]C[-5], "T"), EQUAL(R[+3]C[-5], "C"))=1, 1, 0) -> 0
A469: 'A | B469: =IF(EQUAL(RC[-1], "G"), 1, IF(EQUAL(RC[-1], "C"), 1, 0)) -> 0 | C469: =IF(AND(EQUAL(RC[-2], "C"), EQUAL(R[+1]C[-2], "G"))=1, 1, 0) -> 0 | D469: =SUM(RC[-2]:R[+49]C[-2])*2 -> 52 | E469: =SUM(RC[-2]:R[+49]C[-2])*2 -> 2 | F469: =IF(AND(EQUAL(RC[-5], "G"), EQUAL(R[+1]C[-5], "A"), EQUAL(R[+2]C[-5], "T"), EQUAL(R[+3]C[-5], "C"))=1, 1, 0) -> 0
A470: 'C | B470: =IF(EQUAL(RC[-1], "G"), 1, IF(EQUAL(RC[-1], "C"), 1, 0)) -> 1 | C470: =IF(AND(EQUAL(RC[-2], "C"), EQUAL(R[+1]C[-2], "G"))=1, 1, 0) -> 0 | D470: =SUM(RC[-2]:R[+49]C[-2])*2 -> 54 | E470: =SUM(RC[-2]:R[+49]C[-2])*2 -> 2 | F470: =IF(AND(EQUAL(RC[-5], "G"), EQUAL(R[+1]C[-5], "A"), EQUAL(R[+2]C[-5], "T"), EQUAL(R[+3]C[-5], "C"))=1, 1, 0) -> 0
A471: 'A | B471: =IF(EQUAL(RC[-1], "G"), 1, IF(EQUAL(RC[-1], "C"), 1, 0)) -> 0 | C471: =IF(AND(EQUAL(RC[-2], "C"), EQUAL(R[+1]C[-2], "G"))=1, 1, 0) -> 0 | D471: =SUM(RC[-2]:R[+49]C[-2])*2 -> 52 | E471: =SUM(RC[-2]:R[+49]C[-2])*2 -> 2 | F471: =IF(AND(EQUAL(RC[-5], "G"), EQUAL(R[+1]C[-5], "A"), EQUAL(R[+2]C[-5], "T"), EQUAL(R[+3]C[-5], "C"))=1, 1, 0) -> 0
A472: 'T | B472: =IF(EQUAL(RC[-1], "G"), 1, IF(EQUAL(RC[-1], "C"), 1, 0)) -> 0 | C472: =IF(AND(EQUAL(RC[-2], "C"), EQUAL(R[+1]C[-2], "G"))=1, 1, 0) -> 0 | D472: =SUM(RC[-2]:R[+49]C[-2])*2 -> 54 | E472: =SUM(RC[-2]:R[+49]C[-2])*2 -> 2 | F472: =IF(AND(EQUAL(RC[-5], "G"), EQUAL(R[+1]C[-5], "A"), EQUAL(R[+2]C[-5], "T"), EQUAL(R[+3]C[-5], "C"))=1, 1, 0) -> 0
A473: 'C | B473: =IF(EQUAL(RC[-1], "G"), 1, IF(EQUAL(RC[-1], "C"), 1, 0)) -> 1 | C473: =IF(AND(EQUAL(RC[-2], "C"), EQUAL(R[+1]C[-2], "G"))=1, 1, 0) -> 0 | D473: =SUM(RC[-2]:R[+49]C[-2])*2 -> 54 | E473: =SUM(RC[-2]:R[+49]C[-2])*2 -> 2 | F473: =IF(AND(EQUAL(RC[-5], "G"), EQUAL(R[+1]C[-5], "A"), EQUAL(R[+2]C[-5], "T"), EQUAL(R[+3]C[-5], "C"))=1, 1, 0) -> 0
A474: 'A | B474: =IF(EQUAL(RC[-1], "G"), 1, IF(EQUAL(RC[-1], "C"), 1, 0)) -> 0 | C474: =IF(AND(EQUAL(RC[-2], "C"), EQUAL(R[+1]C[-2], "G"))=1, 1, 0) -> 0 | D474: =SUM(RC[-2]:R[+49]C[-2])*2 -> 52 | E474: =SUM(RC[-2]:R[+49]C[-2])*2 -> 2 | F474: =IF(AND(EQUAL(RC[-5], "G"), EQUAL(R[+1]C[-5], "A"), EQUAL(R[+2]C[-5], "T"), EQUAL(R[+3]C[-5], "C"))=1, 1, 0) -> 0
A475: 'T | B475: =IF(EQUAL(RC[-1], "G"), 1, IF(EQUAL(RC[-1], "C"), 1, 0)) -> 0 | C475: =IF(AND(EQUAL(RC[-2], "C"), EQUAL(R[+1]C[-2], "G"))=1, 1, 0) -> 0 | D475: =SUM(RC[-2]:R[+49]C[-2])*2 -> 52 | E475: =SUM(RC[-2]:R[+49]C[-2])*2 -> 2 | F475: =IF(AND(EQUAL(RC[-5], "G"), EQUAL(R[+1]C[-5], "A"), EQUAL(R[+2]C[-5], "T"), EQUAL(R[+3]C[-5], "C"))=1, 1, 0) -> 0
A476: 'G | B476: =IF(EQUAL(RC[-1], "G"), 1, IF(EQUAL(RC[-1], "C"), 1, 0)) -> 1 | C476: =IF(AND(EQUAL(RC[-2], "C"), EQUAL(R[+1]C[-2], "G"))=1, 1, 0) -> 0 | D476: =SUM(RC[-2]:R[+49]C[-2])*2 -> 54 | E476: =SUM(RC[-2]:R[+49]C[-2])*2 -> 2 | F476: =IF(AND(EQUAL(RC[-5], "G"), EQUAL(R[+1]C[-5], "A"), EQUAL(R[+2]C[-5], "T"), EQUAL(R[+3]C[-5], "C"))=1, 1, 0) -> 0
A477: 'G | B477: =IF(EQUAL(RC[-1], "G"), 1, IF(EQUAL(RC[-1], "C"), 1, 0)) -> 1 | C477: =IF(AND(EQUAL(RC[-2], "C"), EQUAL(R[+1]C[-2], "G"))=1, 1, 0) -> 0 | D477: =SUM(RC[-2]:R[+49]C[-2])*2 -> 54 | E477: =SUM(RC[-2]:R[+49]C[-2])*2 -> 2 | F477: =IF(AND(EQUAL(RC[-5], "G"), EQUAL(R[+1]C[-5], "A"), EQUAL(R[+2]C[-5], "T"), EQUAL(R[+3]C[-5], "C"))=1, 1, 0) -> 0
A478: 'G | B478: =IF(EQUAL(RC[-1], "G"), 1, IF(EQUAL(RC[-1], "C"), 1, 0)) -> 1 | C478: =IF(AND(EQUAL(RC[-2], "C"), EQUAL(R[+1]C[-2], "G"))=1, 1, 0) -> 0 | D478: =SUM(RC[-2]:R[+49]C[-2])*2 -> 52 | E478: =SUM(RC[-2]:R[+49]C[-2])*2 -> 2 | F478: =IF(AND(EQUAL(RC[-5], "G"), EQUAL(R[+1]C[-5], "A"), EQUAL(R[+2]C[-5], "T"), EQUAL(R[+3]C[-5], "C"))=1, 1, 0) -> 0
A479: 'G | B479: =IF(EQUAL(RC[-1], "G"), 1, IF(EQUAL(RC[-1], "C"), 1, 0)) -> 1 | C479: =IF(AND(EQUAL(RC[-2], "C"), EQUAL(R[+1]C[-2], "G"))=1, 1, 0) -> 0 | D479: =SUM(RC[-2]:R[+49]C[-2])*2 -> 50 | E479: =SUM(RC[-2]:R[+49]C[-2])*2 -> 2 | F479: =IF(AND(EQUAL(RC[-5], "G"), EQUAL(R[+1]C[-5], "A"), EQUAL(R[+2]C[-5], "T"), EQUAL(R[+3]C[-5], "C"))=1, 1, 0) -> 0
A480: 'G | B480: =IF(EQUAL(RC[-1], "G"), 1, IF(EQUAL(RC[-1], "C"), 1, 0)) -> 1 | C480: =IF(AND(EQUAL(RC[-2], "C"), EQUAL(R[+1]C[-2], "G"))=1, 1, 0) -> 0 | D480: =SUM(RC[-2]:R[+49]C[-2])*2 -> 48 | E480: =SUM(RC[-2]:R[+49]C[-2])*2 -> 2 | F480: =IF(AND(EQUAL(RC[-5], "G"), EQUAL(R[+1]C[-5], "A"), EQUAL(R[+2]C[-5], "T"), EQUAL(R[+3]C[-5], "C"))=1, 1, 0) -> 0
A481: 'G | B481: =IF(EQUAL(RC[-1], "G"), 1, IF(EQUAL(RC[-1], "C"), 1, 0)) -> 1 | C481: =IF(AND(EQUAL(RC[-2], "C"), EQUAL(R[+1]C[-2], "G"))=1, 1, 0) -> 0 | D481: =SUM(RC[-2]:R[+49]C[-2])*2 -> 48 | E481: =SUM(RC[-2]:R[+49]C[-2])*2 -> 2 | F481: =IF(AND(EQUAL(RC[-5], "G"), EQUAL(R[+1]C[-5], "A"), EQUAL(R[+2]C[-5], "T"), EQUAL(R[+3]C[-5], "C"))=1, 1, 0) -> 0
A482: 'G | B482: =IF(EQUAL(RC[-1], "G"), 1, IF(EQUAL(RC[-1], "C"), 1, 0)) -> 1 | C482: =IF(AND(EQUAL(RC[-2], "C"), EQUAL(R[+1]C[-2], "G"))=1, 1, 0) -> 0 | D482: =SUM(RC[-2]:R[+49]C[-2])*2 -> 48 | E482: =SUM(RC[-2]:R[+49]C[-2])*2 -> 2 | F482: =IF(AND(EQUAL(RC[-5], "G"), EQUAL(R[+1]C[-5], "A"), EQUAL(R[+2]C[-5], "T"), EQUAL(R[+3]C[-5], "C"))=1, 1, 0) -> 0
A483: 'A | B483: =IF(EQUAL(RC[-1], "G"), 1, IF(EQUAL(RC[-1], "C"), 1, 0)) -> 0 | C483: =IF(AND(EQUAL(RC[-2], "C"), EQUAL(R[+1]C[-2], "G"))=1, 1, 0) -> 0 | D483: =SUM(RC[-2]:R[+49]C[-2])*2 -> 46 | E483: =SUM(RC[-2]:R[+49]C[-2])*2 -> 2 | F483: =IF(AND(EQUAL(RC[-5], "G"), EQUAL(R[+1]C[-5], "A"), EQUAL(R[+2]C[-5], "T"), EQUAL(R[+3]C[-5], "C"))=1, 1, 0) -> 0
A484: 'A | B484: =IF(EQUAL(RC[-1], "G"), 1, IF(EQUAL(RC[-1], "C"), 1, 0)) -> 0 | C484: =IF(AND(EQUAL(RC[-2], "C"), EQUAL(R[+1]C[-2], "G"))=1, 1, 0) -> 0 | D484: =SUM(RC[-2]:R[+49]C[-2])*2 -> 46 | E484: =SUM(RC[-2]:R[+49]C[-2])*2 -> 2 | F484: =IF(AND(EQUAL(RC[-5], "G"), EQUAL(R[+1]C[-5], "A"), EQUAL(R[+2]C[-5], "T"), EQUAL(R[+3]C[-5], "C"))=1, 1, 0) -> 0
A485: 'C | B485: =IF(EQUAL(RC[-1], "G"), 1, IF(EQUAL(RC[-1], "C"), 1, 0)) -> 1 | C485: =IF(AND(EQUAL(RC[-2], "C"), EQUAL(R[+1]C[-2], "G"))=1, 1, 0) -> 0 | D485: =SUM(RC[-2]:R[+49]C[-2])*2 -> 46 | E485: =SUM(RC[-2]:R[+49]C[-2])*2 -> 2 | F485: =IF(AND(EQUAL(RC[-5], "G"), EQUAL(R[+1]C[-5], "A"), EQUAL(R[+2]C[-5], "T"), EQUAL(R[+3]C[-5], "C"))=1, 1, 0) -> 0
A486: 'C | B486: =IF(EQUAL(RC[-1], "G"), 1, IF(EQUAL(RC[-1], "C"), 1, 0)) -> 1 | C486: =IF(AND(EQUAL(RC[-2], "C"), EQUAL(R[+1]C[-2], "G"))=1, 1, 0) -> 0 | D486: =SUM(RC[-2]:R[+49]C[-2])*2 -> 44 | E486: =SUM(RC[-2]:R[+49]C[-2])*2 -> 2 | F486: =IF(AND(EQUAL(RC[-5], "G"), EQUAL(R[+1]C[-5], "A"), EQUAL(R[+2]C[-5], "T"), EQUAL(R[+3]C[-5], "C"))=1, 1, 0) -> 0
A487: 'C | B487: =IF(EQUAL(RC[-1], "G"), 1, IF(EQUAL(RC[-1], "C"), 1, 0)) -> 1 | C487: =IF(AND(EQUAL(RC[-2], "C"), EQUAL(R[+1]C[-2], "G"))=1, 1, 0) -> 0 | D487: =SUM(RC[-2]:R[+49]C[-2])*2 -> 42 | E487: =SUM(RC[-2]:R[+49]C[-2])*2 -> 2 | F487: =IF(AND(EQUAL(RC[-5], "G"), EQUAL(R[+1]C[-5], "A"), EQUAL(R[+2]C[-5], "T"), EQUAL(R[+3]C[-5], "C"))=1, 1, 0) -> 0
A488: 'T | B488: =IF(EQUAL(RC[-1], "G"), 1, IF(EQUAL(RC[-1], "C"), 1, 0)) -> 0 | C488: =IF(AND(EQUAL(RC[-2], "C"), EQUAL(R[+1]C[-2], "G"))=1, 1, 0) -> 0 | D488: =SUM(RC[-2]:R[+49]C[-2])*2 -> 40 | E488: =SUM(RC[-2]:R[+49]C[-2])*2 -> 2 | F488: =IF(AND(EQUAL(RC[-5], "G"), EQUAL(R[+1]C[-5], "A"), EQUAL(R[+2]C[-5], "T"), EQUAL(R[+3]C[-5], "C"))=1, 1, 0) -> 0
A489: 'A | B489: =IF(EQUAL(RC[-1], "G"), 1, IF(EQUAL(RC[-1], "C"), 1, 0)) -> 0 | C489: =IF(AND(EQUAL(RC[-2], "C"), EQUAL(R[+1]C[-2], "G"))=1, 1, 0) -> 0 | D489: =SUM(RC[-2]:R[+49]C[-2])*2 -> 42 | E489: =SUM(RC[-2]:R[+49]C[-2])*2 -> 2 | F489: =IF(AND(EQUAL(RC[-5], "G"), EQUAL(R[+1]C[-5], "A"), EQUAL(R[+2]C[-5], "T"), EQUAL(R[+3]C[-5], "C"))=1, 1, 0) -> 0
A490: 'A | B490: =IF(EQUAL(RC[-1], "G"), 1, IF(EQUAL(RC[-1], "C"), 1, 0)) -> 0 | C490: =IF(AND(EQUAL(RC[-2], "C"), EQUAL(R[+1]C[-2], "G"))=1, 1, 0) -> 0 | D490: =SUM(RC[-2]:R[+49]C[-2])*2 -> 44 | E490: =SUM(RC[-2]:R[+49]C[-2])*2 -> 2 | F490: =IF(AND(EQUAL(RC[-5], "G"), EQUAL(R[+1]C[-5], "A"), EQUAL(R[+2]C[-5], "T"), EQUAL(R[+3]C[-5], "C"))=1, 1, 0) -> 0
A491: 'G | B491: =IF(EQUAL(RC[-1], "G"), 1, IF(EQUAL(RC[-1], "C"), 1, 0)) -> 1 | C491: =IF(AND(EQUAL(RC[-2], "C"), EQUAL(R[+1]C[-2], "G"))=1, 1, 0) -> 0 | D491: =SUM(RC[-2]:R[+49]C[-2])*2 -> 46 | E491: =SUM(RC[-2]:R[+49]C[-2])*2 -> 2 | F491: =IF(AND(EQUAL(RC[-5], "G"), EQUAL(R[+1]C[-5], "A"), EQUAL(R[+2]C[-5], "T"), EQUAL(R[+3]C[-5], "C"))=1, 1, 0) -> 0
A492: 'A | B492: =IF(EQUAL(RC[-1], "G"), 1, IF(EQUAL(RC[-1], "C"), 1, 0)) -> 0 | C492: =IF(AND(EQUAL(RC[-2], "C"), EQUAL(R[+1]C[-2], "G"))=1, 1, 0) -> 0 | D492: =SUM(RC[-2]:R[+49]C[-2])*2 -> 44 | E492: =SUM(RC[-2]:R[+49]C[-2])*2 -> 2 | F492: =IF(AND(EQUAL(RC[-5], "G"), EQUAL(R[+1]C[-5], "A"), EQUAL(R[+2]C[-5], "T"), EQUAL(R[+3]C[-5], "C"))=1, 1, 0) -> 0
A493: 'G | B493: =IF(EQUAL(RC[-1], "G"), 1, IF(EQUAL(RC[-1], "C"), 1, 0)) -> 1 | C493: =IF(AND(EQUAL(RC[-2], "C"), EQUAL(R[+1]C[-2], "G"))=1, 1, 0) -> 0 | D493: =SUM(RC[-2]:R[+49]C[-2])*2 -> 44 | E493: =SUM(RC[-2]:R[+49]C[-2])*2 -> 2 | F493: =IF(AND(EQUAL(RC[-5], "G"), EQUAL(R[+1]C[-5], "A"), EQUAL(R[+2]C[-5], "T"), EQUAL(R[+3]C[-5], "C"))=1, 1, 0) -> 0
A494: 'C | B494: =IF(EQUAL(RC[-1], "G"), 1, IF(EQUAL(RC[-1], "C"), 1, 0)) -> 1 | C494: =IF(AND(EQUAL(RC[-2], "C"), EQUAL(R[+1]C[-2], "G"))=1, 1, 0) -> 0 | D494: =SUM(RC[-2]:R[+49]C[-2])*2 -> 42 | E494: =SUM(RC[-2]:R[+49]C[-2])*2 -> 2 | F494: =IF(AND(EQUAL(RC[-5], "G"), EQUAL(R[+1]C[-5], "A"), EQUAL(R[+2]C[-5], "T"), EQUAL(R[+3]C[-5], "C"))=1, 1, 0) -> 0
A495: 'T | B495: =IF(EQUAL(RC[-1], "G"), 1, IF(EQUAL(RC[-1], "C"), 1, 0)) -> 0 | C495: =IF(AND(EQUAL(RC[-2], "C"), EQUAL(R[+1]C[-2], "G"))=1, 1, 0) -> 0 | D495: =SUM(RC[-2]:R[+49]C[-2])*2 -> 40 | E495: =SUM(RC[-2]:R[+49]C[-2])*2 -> 2 | F495: =IF(AND(EQUAL(RC[-5], "G"), EQUAL(R[+1]C[-5], "A"), EQUAL(R[+2]C[-5], "T"), EQUAL(R[+3]C[-5], "C"))=1, 1, 0) -> 0
A496: 'C | B496: =IF(EQUAL(RC[-1], "G"), 1, IF(EQUAL(RC[-1], "C"), 1, 0)) -> 1 | C496: =IF(AND(EQUAL(RC[-2], "C"), EQUAL(R[+1]C[-2], "G"))=1, 1, 0) -> 0 | D496: =SUM(RC[-2]:R[+49]C[-2])*2 -> 40 | E496: =SUM(RC[-2]:R[+49]C[-2])*2 -> 2 | F496: =IF(AND(EQUAL(RC[-5], "G"), EQUAL(R[+1]C[-5], "A"), EQUAL(R[+2]C[-5], "T"), EQUAL(R[+3]C[-5], "C"))=1, 1, 0) -> 0
A497: 'A | B497: =IF(EQUAL(RC[-1], "G"), 1, IF(EQUAL(RC[-1], "C"), 1, 0)) -> 0 | C497: =IF(AND(EQUAL(RC[-2], "C"), EQUAL(R[+1]C[-2], "G"))=1, 1, 0) -> 0 | D497: =SUM(RC[-2]:R[+49]C[-2])*2 -> 38 | E497: =SUM(RC[-2]:R[+49]C[-2])*2 -> 2 | F497: =IF(AND(EQUAL(RC[-5], "G"), EQUAL(R[+1]C[-5], "A"), EQUAL(R[+2]C[-5], "T"), EQUAL(R[+3]C[-5], "C"))=1, 1, 0) -> 0
A498: 'T | B498: =IF(EQUAL(RC[-1], "G"), 1, IF(EQUAL(RC[-1], "C"), 1, 0)) -> 0 | C498: =IF(AND(EQUAL(RC[-2], "C"), EQUAL(R[+1]C[-2], "G"))=1, 1, 0) -> 0 | D498: =SUM(RC[-2]:R[+49]C[-2])*2 -> 38 | E498: =SUM(RC[-2]:R[+49]C[-2])*2 -> 2 | F498: =IF(AND(EQUAL(RC[-5], "G"), EQUAL(R[+1]C[-5], "A"), EQUAL(R[+2]C[-5], "T"), EQUAL(R[+3]C[-5], "C"))=1, 1, 0) -> 0
A499: 'G | B499: =IF(EQUAL(RC[-1], "G"), 1, IF(EQUAL(RC[-1], "C"), 1, 0)) -> 1 | C499: =IF(AND(EQUAL(RC[-2], "C"), EQUAL(R[+1]C[-2], "G"))=1, 1, 0) -> 0 | D499: =SUM(RC[-2]:R[+49]C[-2])*2 -> 40 | E499: =SUM(RC[-2]:R[+49]C[-2])*2 -> 2 | F499: =IF(AND(EQUAL(RC[-5], "G"), EQUAL(R[+1]C[-5], "A"), EQUAL(R[+2]C[-5], "T"), EQUAL(R[+3]C[-5], "C"))=1, 1, 0) -> 0
A500: 'A | B500: =IF(EQUAL(RC[-1], "G"), 1, IF(EQUAL(RC[-1], "C"), 1, 0)) -> 0 | C500: =IF(AND(EQUAL(RC[-2], "C"), EQUAL(R[+1]C[-2], "G"))=1, 1, 0) -> 0 | D500: =SUM(RC[-2]:R[+49]C[-2])*2 -> 38 | E500: =SUM(RC[-2]:R[+49]C[-2])*2 -> 2 | F500: =IF(AND(EQUAL(RC[-5], "G"), EQUAL(R[+1]C[-5], "A"), EQUAL(R[+2]C[-5], "T"), EQUAL(R[+3]C[-5], "C"))=1, 1, 0) -> 0
A501: 'G | B501: =IF(EQUAL(RC[-1], "G"), 1, IF(EQUAL(RC[-1], "C"), 1, 0)) -> 1 | C501: =IF(AND(EQUAL(RC[-2], "C"), EQUAL(R[+1]C[-2], "G"))=1, 1, 0) -> 0 | D501: =SUM(RC[-2]:R[+49]C[-2])*2 -> 38 | E501: =SUM(RC[-2]:R[+49]C[-2])*2 -> 2 | F501: =IF(AND(EQUAL(RC[-5], "G"), EQUAL(R[+1]C[-5], "A"), EQUAL(R[+2]C[-5], "T"), EQUAL(R[+3]C[-5], "C"))=1, 1, 0) -> 0
A502: 'G | B502: =IF(EQUAL(RC[-1], "G"), 1, IF(EQUAL(RC[-1], "C"), 1, 0)) -> 1 | C502: =IF(AND(EQUAL(RC[-2], "C"), EQUAL(R[+1]C[-2], "G"))=1, 1, 0) -> 0 | D502: =SUM(RC[-2]:R[+49]C[-2])*2 -> 36 | E502: =SUM(RC[-2]:R[+49]C[-2])*2 -> 2 | F502: =IF(AND(EQUAL(RC[-5], "G"), EQUAL(R[+1]C[-5], "A"), EQUAL(R[+2]C[-5], "T"), EQUAL(R[+3]C[-5], "C"))=1, 1, 0) -> 0
A503: 'G | B503: =IF(EQUAL(RC[-1], "G"), 1, IF(EQUAL(RC[-1], "C"), 1, 0)) -> 1 | C503: =IF(AND(EQUAL(RC[-2], "C"), EQUAL(R[+1]C[-2], "G"))=1, 1, 0) -> 0 | D503: =SUM(RC[-2]:R[+49]C[-2])*2 -> 36 | E503: =SUM(RC[-2]:R[+49]C[-2])*2 -> 2 | F503: =IF(AND(EQUAL(RC[-5], "G"), EQUAL(R[+1]C[-5], "A"), EQUAL(R[+2]C[-5], "T"), EQUAL(R[+3]C[-5], "C"))=1, 1, 0) -> 0
A504: 'A | B504: =IF(EQUAL(RC[-1], "G"), 1, IF(EQUAL(RC[-1], "C"), 1, 0)) -> 0 | C504: =IF(AND(EQUAL(RC[-2], "C"), EQUAL(R[+1]C[-2], "G"))=1, 1, 0) -> 0 | D504: =SUM(RC[-2]:R[+49]C[-2])*2 -> 36 | E504: =SUM(RC[-2]:R[+49]C[-2])*2 -> 2 | F504: =IF(AND(EQUAL(RC[-5], "G"), EQUAL(R[+1]C[-5], "A"), EQUAL(R[+2]C[-5], "T"), EQUAL(R[+3]C[-5], "C"))=1, 1, 0) -> 0
A505: 'G | B505: =IF(EQUAL(RC[-1], "G"), 1, IF(EQUAL(RC[-1], "C"), 1, 0)) -> 1 | C505: =IF(AND(EQUAL(RC[-2], "C"), EQUAL(R[+1]C[-2], "G"))=1, 1, 0) -> 0 | D505: =SUM(RC[-2]:R[+49]C[-2])*2 -> 36 | E505: =SUM(RC[-2]:R[+49]C[-2])*2 -> 2 | F505: =IF(AND(EQUAL(RC[-5], "G"), EQUAL(R[+1]C[-5], "A"), EQUAL(R[+2]C[-5], "T"), EQUAL(R[+3]C[-5], "C"))=1, 1, 0) -> 0
A506: 'T | B506: =IF(EQUAL(RC[-1], "G"), 1, IF(EQUAL(RC[-1], "C"), 1, 0)) -> 0 | C506: =IF(AND(EQUAL(RC[-2], "C"), EQUAL(R[+1]C[-2], "G"))=1, 1, 0) -> 0 | D506: =SUM(RC[-2]:R[+49]C[-2])*2 -> 34 | E506: =SUM(RC[-2]:R[+49]C[-2])*2 -> 2 | F506: =IF(AND(EQUAL(RC[-5], "G"), EQUAL(R[+1]C[-5], "A"), EQUAL(R[+2]C[-5], "T"), EQUAL(R[+3]C[-5], "C"))=1, 1, 0) -> 0
A507: 'A | B507: =IF(EQUAL(RC[-1], "G"), 1, IF(EQUAL(RC[-1], "C"), 1, 0)) -> 0 | C507: =IF(AND(EQUAL(RC[-2], "C"), EQUAL(R[+1]C[-2], "G"))=1, 1, 0) -> 0 | D507: =SUM(RC[-2]:R[+49]C[-2])*2 -> 34 | E507: =SUM(RC[-2]:R[+49]C[-2])*2 -> 2 | F507: =IF(AND(EQUAL(RC[-5], "G"), EQUAL(R[+1]C[-5], "A"), EQUAL(R[+2]C[-5], "T"), EQUAL(R[+3]C[-5], "C"))=1, 1, 0) -> 0
A508: 'A | B508: =IF(EQUAL(RC[-1], "G"), 1, IF(EQUAL(RC[-1], "C"), 1, 0)) -> 0 | C508: =IF(AND(EQUAL(RC[-2], "C"), EQUAL(R[+1]C[-2], "G"))=1, 1, 0) -> 0 | D508: =SUM(RC[-2]:R[+49]C[-2])*2 -> 34 | E508: =SUM(RC[-2]:R[+49]C[-2])*2 -> 2 | F508: =IF(AND(EQUAL(RC[-5], "G"), EQUAL(R[+1]C[-5], "A"), EQUAL(R[+2]C[-5], "T"), EQUAL(R[+3]C[-5], "C"))=1, 1, 0) -> 0
A509: 'A | B509: =IF(EQUAL(RC[-1], "G"), 1, IF(EQUAL(RC[-1], "C"), 1, 0)) -> 0 | C509: =IF(AND(EQUAL(RC[-2], "C"), EQUAL(R[+1]C[-2], "G"))=1, 1, 0) -> 0 | D509: =SUM(RC[-2]:R[+49]C[-2])*2 -> 36 | E509: =SUM(RC[-2]:R[+49]C[-2])*2 -> 2 | F509: =IF(AND(EQUAL(RC[-5], "G"), EQUAL(R[+1]C[-5], "A"), EQUAL(R[+2]C[-5], "T"), EQUAL(R[+3]C[-5], "C"))=1, 1, 0) -> 0
A510: 'A | B510: =IF(EQUAL(RC[-1], "G"), 1, IF(EQUAL(RC[-1], "C"), 1, 0)) -> 0 | C510: =IF(AND(EQUAL(RC[-2], "C"), EQUAL(R[+1]C[-2], "G"))=1, 1, 0) -> 0 | D510: =SUM(RC[-2]:R[+49]C[-2])*2 -> 36 | E510: =SUM(RC[-2]:R[+49]C[-2])*2 -> 2 | F510: =IF(AND(EQUAL(RC[-5], "G"), EQUAL(R[+1]C[-5], "A"), EQUAL(R[+2]C[-5], "T"), EQUAL(R[+3]C[-5], "C"))=1, 1, 0) -> 0
A511: 'T | B511: =IF(EQUAL(RC[-1], "G"), 1, IF(EQUAL(RC[-1], "C"), 1, 0)) -> 0 | C511: =IF(AND(EQUAL(RC[-2], "C"), EQUAL(R[+1]C[-2], "G"))=1, 1, 0) -> 0 | D511: =SUM(RC[-2]:R[+49]C[-2])*2 -> 38 | E511: =SUM(RC[-2]:R[+49]C[-2])*2 -> 2 | F511: =IF(AND(EQUAL(RC[-5], "G"), EQUAL(R[+1]C[-5], "A"), EQUAL(R[+2]C[-5], "T"), EQUAL(R[+3]C[-5], "C"))=1, 1, 0) -> 0
A512: 'G | B512: =IF(EQUAL(RC[-1], "G"), 1, IF(EQUAL(RC[-1], "C"), 1, 0)) -> 1 | C512: =IF(AND(EQUAL(RC[-2], "C"), EQUAL(R[+1]C[-2], "G"))=1, 1, 0) -> 0 | D512: =SUM(RC[-2]:R[+49]C[-2])*2 -> 38 | E512: =SUM(RC[-2]:R[+49]C[-2])*2 -> 2 | F512: =IF(AND(EQUAL(RC[-5], "G"), EQUAL(R[+1]C[-5], "A"), EQUAL(R[+2]C[-5], "T"), EQUAL(R[+3]C[-5], "C"))=1, 1, 0) -> 0
A513: 'C | B513: =IF(EQUAL(RC[-1], "G"), 1, IF(EQUAL(RC[-1], "C"), 1, 0)) -> 1 | C513: =IF(AND(EQUAL(RC[-2], "C"), EQUAL(R[+1]C[-2], "G"))=1, 1, 0) -> 1 | D513: =SUM(RC[-2]:R[+49]C[-2])*2 -> 38 | E513: =SUM(RC[-2]:R[+49]C[-2])*2 -> 2 | F513: =IF(AND(EQUAL(RC[-5], "G"), EQUAL(R[+1]C[-5], "A"), EQUAL(R[+2]C[-5], "T"), EQUAL(R[+3]C[-5], "C"))=1, 1, 0) -> 0
A514: 'G | B514: =IF(EQUAL(RC[-1], "G"), 1, IF(EQUAL(RC[-1], "C"), 1, 0)) -> 1 | C514: =IF(AND(EQUAL(RC[-2], "C"), EQUAL(R[+1]C[-2], "G"))=1, 1, 0) -> 0 | D514: =SUM(RC[-2]:R[+49]C[-2])*2 -> 38 | E514: =SUM(RC[-2]:R[+49]C[-2])*2 -> 0 | F514: =IF(AND(EQUAL(RC[-5], "G"), EQUAL(R[+1]C[-5], "A"), EQUAL(R[+2]C[-5], "T"), EQUAL(R[+3]C[-5], "C"))=1, 1, 0) -> 0
A515: 'G | B515: =IF(EQUAL(RC[-1], "G"), 1, IF(EQUAL(RC[-1], "C"), 1, 0)) -> 1 | C515: =IF(AND(EQUAL(RC[-2], "C"), EQUAL(R[+1]C[-2], "G"))=1, 1, 0) -> 0 | D515: =SUM(RC[-2]:R[+49]C[-2])*2 -> 36 | E515: =SUM(RC[-2]:R[+49]C[-2])*2 -> 0 | F515: =IF(AND(EQUAL(RC[-5], "G"), EQUAL(R[+1]C[-5], "A"), EQUAL(R[+2]C[-5], "T"), EQUAL(R[+3]C[-5], "C"))=1, 1, 0) -> 0
A516: 'A | B516: =IF(EQUAL(RC[-1], "G"), 1, IF(EQUAL(RC[-1], "C"), 1, 0)) -> 0 | C516: =IF(AND(EQUAL(RC[-2], "C"), EQUAL(R[+1]C[-2], "G"))=1, 1, 0) -> 0 | D516: =SUM(RC[-2]:R[+49]C[-2])*2 -> 36 | E516: =SUM(RC[-2]:R[+49]C[-2])*2 -> 0 | F516: =IF(AND(EQUAL(RC[-5], "G"), EQUAL(R[+1]C[-5], "A"), EQUAL(R[+2]C[-5], "T"), EQUAL(R[+3]C[-5], "C"))=1, 1, 0) -> 0
A517: 'A | B517: =IF(EQUAL(RC[-1], "G"), 1, IF(EQUAL(RC[-1], "C"), 1, 0)) -> 0 | C517: =IF(AND(EQUAL(RC[-2], "C"), EQUAL(R[+1]C[-2], "G"))=1, 1, 0) -> 0 | D517: =SUM(RC[-2]:R[+49]C[-2])*2 -> 36 | E517: =SUM(RC[-2]:R[+49]C[-2])*2 -> 0 | F517: =IF(AND(EQUAL(RC[-5], "G"), EQUAL(R[+1]C[-5], "A"), EQUAL(R[+2]C[-5], "T"), EQUAL(R[+3]C[-5], "C"))=1, 1, 0) -> 0
A518: 'G | B518: =IF(EQUAL(RC[-1], "G"), 1, IF(EQUAL(RC[-1], "C"), 1, 0)) -> 1 | C518: =IF(AND(EQUAL(RC[-2], "C"), EQUAL(R[+1]C[-2], "G"))=1, 1, 0) -> 0 | D518: =SUM(RC[-2]:R[+49]C[-2])*2 -> 38 | E518: =SUM(RC[-2]:R[+49]C[-2])*2 -> 0 | F518: =IF(AND(EQUAL(RC[-5], "G"), EQUAL(R[+1]C[-5], "A"), EQUAL(R[+2]C[-5], "T"), EQUAL(R[+3]C[-5], "C"))=1, 1, 0) -> 0
A519: 'G | B519: =IF(EQUAL(RC[-1], "G"), 1, IF(EQUAL(RC[-1], "C"), 1, 0)) -> 1 | C519: =IF(AND(EQUAL(RC[-2], "C"), EQUAL(R[+1]C[-2], "G"))=1, 1, 0) -> 0 | D519: =SUM(RC[-2]:R[+49]C[-2])*2 -> 38 | E519: =SUM(RC[-2]:R[+49]C[-2])*2 -> 0 | F519: =IF(AND(EQUAL(RC[-5], "G"), EQUAL(R[+1]C[-5], "A"), EQUAL(R[+2]C[-5], "T"), EQUAL(R[+3]C[-5], "C"))=1, 1, 0) -> 0
A520: 'A | B520: =IF(EQUAL(RC[-1], "G"), 1, IF(EQUAL(RC[-1], "C"), 1, 0)) -> 0 | C520: =IF(AND(EQUAL(RC[-2], "C"), EQUAL(R[+1]C[-2], "G"))=1, 1, 0) -> 0 | D520: =SUM(RC[-2]:R[+49]C[-2])*2 -> 38 | E520: =SUM(RC[-2]:R[+49]C[-2])*2 -> 0 | F520: =IF(AND(EQUAL(RC[-5], "G"), EQUAL(R[+1]C[-5], "A"), EQUAL(R[+2]C[-5], "T"), EQUAL(R[+3]C[-5], "C"))=1, 1, 0) -> 0
A521: 'G | B521: =IF(EQUAL(RC[-1], "G"), 1, IF(EQUAL(RC[-1], "C"), 1, 0)) -> 1 | C521: =IF(AND(EQUAL(RC[-2], "C"), EQUAL(R[+1]C[-2], "G"))=1, 1, 0) -> 0 | D521: =SUM(RC[-2]:R[+49]C[-2])*2 -> 40 | E521: =SUM(RC[-2]:R[+49]C[-2])*2 -> 0 | F521: =IF(AND(EQUAL(RC[-5], "G"), EQUAL(R[+1]C[-5], "A"), EQUAL(R[+2]C[-5], "T"), EQUAL(R[+3]C[-5], "C"))=1, 1, 0) -> 0
A522: 'T | B522: =IF(EQUAL(RC[-1], "G"), 1, IF(EQUAL(RC[-1], "C"), 1, 0)) -> 0 | C522: =IF(AND(EQUAL(RC[-2], "C"), EQUAL(R[+1]C[-2], "G"))=1, 1, 0) -> 0 | D522: =SUM(RC[-2]:R[+49]C[-2])*2 -> 40 | E522: =SUM(RC[-2]:R[+49]C[-2])*2 -> 0 | F522: =IF(AND(EQUAL(RC[-5], "G"), EQUAL(R[+1]C[-5], "A"), EQUAL(R[+2]C[-5], "T"), EQUAL(R[+3]C[-5], "C"))=1, 1, 0) -> 0
A523: 'T | B523: =IF(EQUAL(RC[-1], "G"), 1, IF(EQUAL(RC[-1], "C"), 1, 0)) -> 0 | C523: =IF(AND(EQUAL(RC[-2], "C"), EQUAL(R[+1]C[-2], "G"))=1, 1, 0) -> 0 | D523: =SUM(RC[-2]:R[+49]C[-2])*2 -> 40 | E523: =SUM(RC[-2]:R[+49]C[-2])*2 -> 0 | F523: =IF(AND(EQUAL(RC[-5], "G"), EQUAL(R[+1]C[-5], "A"), EQUAL(R[+2]C[-5], "T"), EQUAL(R[+3]C[-5], "C"))=1, 1, 0) -> 0
A524: 'A | B524: =IF(EQUAL(RC[-1], "G"), 1, IF(EQUAL(RC[-1], "C"), 1, 0)) -> 0 | C524: =IF(AND(EQUAL(RC[-2], "C"), EQUAL(R[+1]C[-2], "G"))=1, 1, 0) -> 0 | D524: =SUM(RC[-2]:R[+49]C[-2])*2 -> 42 | E524: =SUM(RC[-2]:R[+49]C[-2])*2 -> 0 | F524: =IF(AND(EQUAL(RC[-5], "G"), EQUAL(R[+1]C[-5], "A"), EQUAL(R[+2]C[-5], "T"), EQUAL(R[+3]C[-5], "C"))=1, 1, 0) -> 0
A525: 'G | B525: =IF(EQUAL(RC[-1], "G"), 1, IF(EQUAL(RC[-1], "C"), 1, 0)) -> 1 | C525: =IF(AND(EQUAL(RC[-2], "C"), EQUAL(R[+1]C[-2], "G"))=1, 1, 0) -> 0 | D525: =SUM(RC[-2]:R[+49]C[-2])*2 -> 42 | E525: =SUM(RC[-2]:R[+49]C[-2])*2 -> 0 | F525: =IF(AND(EQUAL(RC[-5], "G"), EQUAL(R[+1]C[-5], "A"), EQUAL(R[+2]C[-5], "T"), EQUAL(R[+3]C[-5], "C"))=1, 1, 0) -> 0
A526: 'G | B526: =IF(EQUAL(RC[-1], "G"), 1, IF(EQUAL(RC[-1], "C"), 1, 0)) -> 1 | C526: =IF(AND(EQUAL(RC[-2], "C"), EQUAL(R[+1]C[-2], "G"))=1, 1, 0) -> 0 | D526: =SUM(RC[-2]:R[+49]C[-2])*2 -> 40 | E526: =SUM(RC[-2]:R[+49]C[-2])*2 -> 0 | F526: =IF(AND(EQUAL(RC[-5], "G"), EQUAL(R[+1]C[-5], "A"), EQUAL(R[+2]C[-5], "T"), EQUAL(R[+3]C[-5], "C"))=1, 1, 0) -> 0
A527: 'T | B527: =IF(EQUAL(RC[-1], "G"), 1, IF(EQUAL(RC[-1], "C"), 1, 0)) -> 0 | C527: =IF(AND(EQUAL(RC[-2], "C"), EQUAL(R[+1]C[-2], "G"))=1, 1, 0) -> 0 | D527: =SUM(RC[-2]:R[+49]C[-2])*2 -> 40 | E527: =SUM(RC[-2]:R[+49]C[-2])*2 -> 0 | F527: =IF(AND(EQUAL(RC[-5], "G"), EQUAL(R[+1]C[-5], "A"), EQUAL(R[+2]C[-5], "T"), EQUAL(R[+3]C[-5], "C"))=1, 1, 0) -> 0
A528: 'A | B528: =IF(EQUAL(RC[-1], "G"), 1, IF(EQUAL(RC[-1], "C"), 1, 0)) -> 0 | C528: =IF(AND(EQUAL(RC[-2], "C"), EQUAL(R[+1]C[-2], "G"))=1, 1, 0) -> 0 | D528: =SUM(RC[-2]:R[+49]C[-2])*2 -> 40 | E528: =SUM(RC[-2]:R[+49]C[-2])*2 -> 0 | F528: =IF(AND(EQUAL(RC[-5], "G"), EQUAL(R[+1]C[-5], "A"), EQUAL(R[+2]C[-5], "T"), EQUAL(R[+3]C[-5], "C"))=1, 1, 0) -> 0
A529: 'T | B529: =IF(EQUAL(RC[-1], "G"), 1, IF(EQUAL(RC[-1], "C"), 1, 0)) -> 0 | C529: =IF(AND(EQUAL(RC[-2], "C"), EQUAL(R[+1]C[-2], "G"))=1, 1, 0) -> 0 | D529: =SUM(RC[-2]:R[+49]C[-2])*2 -> 42 | E529: =SUM(RC[-2]:R[+49]C[-2])*2 -> 0 | F529: =IF(AND(EQUAL(RC[-5], "G"), EQUAL(R[+1]C[-5], "A"), EQUAL(R[+2]C[-5], "T"), EQUAL(R[+3]C[-5], "C"))=1, 1, 0) -> 0
A530: 'G | B530: =IF(EQUAL(RC[-1], "G"), 1, IF(EQUAL(RC[-1], "C"), 1, 0)) -> 1 | C530: =IF(AND(EQUAL(RC[-2], "C"), EQUAL(R[+1]C[-2], "G"))=1, 1, 0) -> 0 | D530: =SUM(RC[-2]:R[+49]C[-2])*2 -> 42 | E530: =SUM(RC[-2]:R[+49]C[-2])*2 -> 0 | F530: =IF(AND(EQUAL(RC[-5], "G"), EQUAL(R[+1]C[-5], "A"), EQUAL(R[+2]C[-5], "T"), EQUAL(R[+3]C[-5], "C"))=1, 1, 0) -> 0
A531: 'G | B531: =IF(EQUAL(RC[-1], "G"), 1, IF(EQUAL(RC[-1], "C"), 1, 0)) -> 1 | C531: =IF(AND(EQUAL(RC[-2], "C"), EQUAL(R[+1]C[-2], "G"))=1, 1, 0) -> 0 | D531: =SUM(RC[-2]:R[+49]C[-2])*2 -> 42 | E531: =SUM(RC[-2]:R[+49]C[-2])*2 -> 0 | F531: =IF(AND(EQUAL(RC[-5], "G"), EQUAL(R[+1]C[-5], "A"), EQUAL(R[+2]C[-5], "T"), EQUAL(R[+3]C[-5], "C"))=1, 1, 0) -> 0
A532: 'T | B532: =IF(EQUAL(RC[-1], "G"), 1, IF(EQUAL(RC[-1], "C"), 1, 0)) -> 0 | C532: =IF(AND(EQUAL(RC[-2], "C"), EQUAL(R[+1]C[-2], "G"))=1, 1, 0) -> 0 | D532: =SUM(RC[-2]:R[+49]C[-2])*2 -> 42 | E532: =SUM(RC[-2]:R[+49]C[-2])*2 -> 0 | F532: =IF(AND(EQUAL(RC[-5], "G"), EQUAL(R[+1]C[-5], "A"), EQUAL(R[+2]C[-5], "T"), EQUAL(R[+3]C[-5], "C"))=1, 1, 0) -> 0
A533: 'T | B533: =IF(EQUAL(RC[-1], "G"), 1, IF(EQUAL(RC[-1], "C"), 1, 0)) -> 0 | C533: =IF(AND(EQUAL(RC[-2], "C"), EQUAL(R[+1]C[-2], "G"))=1, 1, 0) -> 0 | D533: =SUM(RC[-2]:R[+49]C[-2])*2 -> 44 | E533: =SUM(RC[-2]:R[+49]C[-2])*2 -> 0 | F533: =IF(AND(EQUAL(RC[-5], "G"), EQUAL(R[+1]C[-5], "A"), EQUAL(R[+2]C[-5], "T"), EQUAL(R[+3]C[-5], "C"))=1, 1, 0) -> 0
A534: 'A | B534: =IF(EQUAL(RC[-1], "G"), 1, IF(EQUAL(RC[-1], "C"), 1, 0)) -> 0 | C534: =IF(AND(EQUAL(RC[-2], "C"), EQUAL(R[+1]C[-2], "G"))=1, 1, 0) -> 0 | D534: =SUM(RC[-2]:R[+49]C[-2])*2 -> 46 | E534: =SUM(RC[-2]:R[+49]C[-2])*2 -> 0 | F534: =IF(AND(EQUAL(RC[-5], "G"), EQUAL(R[+1]C[-5], "A"), EQUAL(R[+2]C[-5], "T"), EQUAL(R[+3]C[-5], "C"))=1, 1, 0) -> 0
A535: 'T | B535: =IF(EQUAL(RC[-1], "G"), 1, IF(EQUAL(RC[-1], "C"), 1, 0)) -> 0 | C535: =IF(AND(EQUAL(RC[-2], "C"), EQUAL(R[+1]C[-2], "G"))=1, 1, 0) -> 0 | D535: =SUM(RC[-2]:R[+49]C[-2])*2 -> 48 | E535: =SUM(RC[-2]:R[+49]C[-2])*2 -> 0 | F535: =IF(AND(EQUAL(RC[-5], "G"), EQUAL(R[+1]C[-5], "A"), EQUAL(R[+2]C[-5], "T"), EQUAL(R[+3]C[-5], "C"))=1, 1, 0) -> 0
A536: 'T | B536: =IF(EQUAL(RC[-1], "G"), 1, IF(EQUAL(RC[-1], "C"), 1, 0)) -> 0 | C536: =IF(AND(EQUAL(RC[-2], "C"), EQUAL(R[+1]C[-2], "G"))=1, 1, 0) -> 0 | D536: =SUM(RC[-2]:R[+49]C[-2])*2 -> 48 | E536: =SUM(RC[-2]:R[+49]C[-2])*2 -> 0 | F536: =IF(AND(EQUAL(RC[-5], "G"), EQUAL(R[+1]C[-5], "A"), EQUAL(R[+2]C[-5], "T"), EQUAL(R[+3]C[-5], "C"))=1, 1, 0) -> 0
A537: 'T | B537: =IF(EQUAL(RC[-1], "G"), 1, IF(EQUAL(RC[-1], "C"), 1, 0)) -> 0 | C537: =IF(AND(EQUAL(RC[-2], "C"), EQUAL(R[+1]C[-2], "G"))=1, 1, 0) -> 0 | D537: =SUM(RC[-2]:R[+49]C[-2])*2 -> 50 | E537: =SUM(RC[-2]:R[+49]C[-2])*2 -> 0 | F537: =IF(AND(EQUAL(RC[-5], "G"), EQUAL(R[+1]C[-5], "A"), EQUAL(R[+2]C[-5], "T"), EQUAL(R[+3]C[-5], "C"))=1, 1, 0) -> 0
A538: 'G | B538: =IF(EQUAL(RC[-1], "G"), 1, IF(EQUAL(RC[-1], "C"), 1, 0)) -> 1 | C538: =IF(AND(EQUAL(RC[-2], "C"), EQUAL(R[+1]C[-2], "G"))=1, 1, 0) -> 0 | D538: =SUM(RC[-2]:R[+49]C[-2])*2 -> 52 | E538: =SUM(RC[-2]:R[+49]C[-2])*2 -> 0 | F538: =IF(AND(EQUAL(RC[-5], "G"), EQUAL(R[+1]C[-5], "A"), EQUAL(R[+2]C[-5], "T"), EQUAL(R[+3]C[-5], "C"))=1, 1, 0) -> 0
A539: 'G | B539: =IF(EQUAL(RC[-1], "G"), 1, IF(EQUAL(RC[-1], "C"), 1, 0)) -> 1 | C539: =IF(AND(EQUAL(RC[-2], "C"), EQUAL(R[+1]C[-2], "G"))=1, 1, 0) -> 0 | D539: =SUM(RC[-2]:R[+49]C[-2])*2 -> 52 | E539: =SUM(RC[-2]:R[+49]C[-2])*2 -> 0 | F539: =IF(AND(EQUAL(RC[-5], "G"), EQUAL(R[+1]C[-5], "A"), EQUAL(R[+2]C[-5], "T"), EQUAL(R[+3]C[-5], "C"))=1, 1, 0) -> 0
A540: 'G | B540: =IF(EQUAL(RC[-1], "G"), 1, IF(EQUAL(RC[-1], "C"), 1, 0)) -> 1 | C540: =IF(AND(EQUAL(RC[-2], "C"), EQUAL(R[+1]C[-2], "G"))=1, 1, 0) -> 0 | D540: =SUM(RC[-2]:R[+49]C[-2])*2 -> 52 | E540: =SUM(RC[-2]:R[+49]C[-2])*2 -> 0 | F540: =IF(AND(EQUAL(RC[-5], "G"), EQUAL(R[+1]C[-5], "A"), EQUAL(R[+2]C[-5], "T"), EQUAL(R[+3]C[-5], "C"))=1, 1, 0) -> 0
A541: 'T | B541: =IF(EQUAL(RC[-1], "G"), 1, IF(EQUAL(RC[-1], "C"), 1, 0)) -> 0 | C541: =IF(AND(EQUAL(RC[-2], "C"), EQUAL(R[+1]C[-2], "G"))=1, 1, 0) -> 0 | D541: =SUM(RC[-2]:R[+49]C[-2])*2 -> 52 | E541: =SUM(RC[-2]:R[+49]C[-2])*2 -> 0 | F541: =IF(AND(EQUAL(RC[-5], "G"), EQUAL(R[+1]C[-5], "A"), EQUAL(R[+2]C[-5], "T"), EQUAL(R[+3]C[-5], "C"))=1, 1, 0) -> 0
A542: 'T | B542: =IF(EQUAL(RC[-1], "G"), 1, IF(EQUAL(RC[-1], "C"), 1, 0)) -> 0 | C542: =IF(AND(EQUAL(RC[-2], "C"), EQUAL(R[+1]C[-2], "G"))=1, 1, 0) -> 0 | D542: =SUM(RC[-2]:R[+49]C[-2])*2 -> 54 | E542: =SUM(RC[-2]:R[+49]C[-2])*2 -> 0 | F542: =IF(AND(EQUAL(RC[-5], "G"), EQUAL(R[+1]C[-5], "A"), EQUAL(R[+2]C[-5], "T"), EQUAL(R[+3]C[-5], "C"))=1, 1, 0) -> 0
A543: 'A | B543: =IF(EQUAL(RC[-1], "G"), 1, IF(EQUAL(RC[-1], "C"), 1, 0)) -> 0 | C543: =IF(AND(EQUAL(RC[-2], "C"), EQUAL(R[+1]C[-2], "G"))=1, 1, 0) -> 0 | D543: =SUM(RC[-2]:R[+49]C[-2])*2 -> 56 | E543: =SUM(RC[-2]:R[+49]C[-2])*2 -> 0 | F543: =IF(AND(EQUAL(RC[-5], "G"), EQUAL(R[+1]C[-5], "A"), EQUAL(R[+2]C[-5], "T"), EQUAL(R[+3]C[-5], "C"))=1, 1, 0) -> 0
A544: 'T | B544: =IF(EQUAL(RC[-1], "G"), 1, IF(EQUAL(RC[-1], "C"), 1, 0)) -> 0 | C544: =IF(AND(EQUAL(RC[-2], "C"), EQUAL(R[+1]C[-2], "G"))=1, 1, 0) -> 0 | D544: =SUM(RC[-2]:R[+49]C[-2])*2 -> 56 | E544: =SUM(RC[-2]:R[+49]C[-2])*2 -> 0 | F544: =IF(AND(EQUAL(RC[-5], "G"), EQUAL(R[+1]C[-5], "A"), EQUAL(R[+2]C[-5], "T"), EQUAL(R[+3]C[-5], "C"))=1, 1, 0) -> 0
A545: 'T | B545: =IF(EQUAL(RC[-1], "G"), 1, IF(EQUAL(RC[-1], "C"), 1, 0)) -> 0 | C545: =IF(AND(EQUAL(RC[-2], "C"), EQUAL(R[+1]C[-2], "G"))=1, 1, 0) -> 0 | D545: =SUM(RC[-2]:R[+49]C[-2])*2 -> 58 | E545: =SUM(RC[-2]:R[+49]C[-2])*2 -> 0 | F545: =IF(AND(EQUAL(RC[-5], "G"), EQUAL(R[+1]C[-5], "A"), EQUAL(R[+2]C[-5], "T"), EQUAL(R[+3]C[-5], "C"))=1, 1, 0) -> 0
A546: 'A | B546: =IF(EQUAL(RC[-1], "G"), 1, IF(EQUAL(RC[-1], "C"), 1, 0)) -> 0 | C546: =IF(AND(EQUAL(RC[-2], "C"), EQUAL(R[+1]C[-2], "G"))=1, 1, 0) -> 0 | D546: =SUM(RC[-2]:R[+49]C[-2])*2 -> 60 | E546: =SUM(RC[-2]:R[+49]C[-2])*2 -> 0 | F546: =IF(AND(EQUAL(RC[-5], "G"), EQUAL(R[+1]C[-5], "A"), EQUAL(R[+2]C[-5], "T"), EQUAL(R[+3]C[-5], "C"))=1, 1, 0) -> 0
A547: 'A | B547: =IF(EQUAL(RC[-1], "G"), 1, IF(EQUAL(RC[-1], "C"), 1, 0)) -> 0 | C547: =IF(AND(EQUAL(RC[-2], "C"), EQUAL(R[+1]C[-2], "G"))=1, 1, 0) -> 0 | D547: =SUM(RC[-2]:R[+49]C[-2])*2 -> 60 | E547: =SUM(RC[-2]:R[+49]C[-2])*2 -> 0 | F547: =IF(AND(EQUAL(RC[-5], "G"), EQUAL(R[+1]C[-5], "A"), EQUAL(R[+2]C[-5], "T"), EQUAL(R[+3]C[-5], "C"))=1, 1, 0) -> 0
A548: 'G | B548: =IF(EQUAL(RC[-1], "G"), 1, IF(EQUAL(RC[-1], "C"), 1, 0)) -> 1 | C548: =IF(AND(EQUAL(RC[-2], "C"), EQUAL(R[+1]C[-2], "G"))=1, 1, 0) -> 0 | D548: =SUM(RC[-2]:R[+49]C[-2])*2 -> 62 | E548: =SUM(RC[-2]:R[+49]C[-2])*2 -> 0 | F548: =IF(AND(EQUAL(RC[-5], "G"), EQUAL(R[+1]C[-5], "A"), EQUAL(R[+2]C[-5], "T"), EQUAL(R[+3]C[-5], "C"))=1, 1, 0) -> 0
A549: 'T | B549: =IF(EQUAL(RC[-1], "G"), 1, IF(EQUAL(RC[-1], "C"), 1, 0)) -> 0 | C549: =IF(AND(EQUAL(RC[-2], "C"), EQUAL(R[+1]C[-2], "G"))=1, 1, 0) -> 0 | D549: =SUM(RC[-2]:R[+49]C[-2])*2 -> 62 | E549: =SUM(RC[-2]:R[+49]C[-2])*2 -> 0 | F549: =IF(AND(EQUAL(RC[-5], "G"), EQUAL(R[+1]C[-5], "A"), EQUAL(R[+2]C[-5], "T"), EQUAL(R[+3]C[-5], "C"))=1, 1, 0) -> 0
A550: 'A | B550: =IF(EQUAL(RC[-1], "G"), 1, IF(EQUAL(RC[-1], "C"), 1, 0)) -> 0 | C550: =IF(AND(EQUAL(RC[-2], "C"), EQUAL(R[+1]C[-2], "G"))=1, 1, 0) -> 0 | D550: =SUM(RC[-2]:R[+49]C[-2])*2 -> 62 | E550: =SUM(RC[-2]:R[+49]C[-2])*2 -> 0 | F550: =IF(AND(EQUAL(RC[-5], "G"), EQUAL(R[+1]C[-5], "A"), EQUAL(R[+2]C[-5], "T"), EQUAL(R[+3]C[-5], "C"))=1, 1, 0) -> 0
A551: 'T | B551: =IF(EQUAL(RC[-1], "G"), 1, IF(EQUAL(RC[-1], "C"), 1, 0)) -> 0 | C551: =IF(AND(EQUAL(RC[-2], "C"), EQUAL(R[+1]C[-2], "G"))=1, 1, 0) -> 0 | D551: =SUM(RC[-2]:R[+49]C[-2])*2 -> 64 | E551: =SUM(RC[-2]:R[+49]C[-2])*2 -> 2 | F551: =IF(AND(EQUAL(RC[-5], "G"), EQUAL(R[+1]C[-5], "A"), EQUAL(R[+2]C[-5], "T"), EQUAL(R[+3]C[-5], "C"))=1, 1, 0) -> 0
A552: 'G | B552: =IF(EQUAL(RC[-1], "G"), 1, IF(EQUAL(RC[-1], "C"), 1, 0)) -> 1 | C552: =IF(AND(EQUAL(RC[-2], "C"), EQUAL(R[+1]C[-2], "G"))=1, 1, 0) -> 0 | D552: =SUM(RC[-2]:R[+49]C[-2])*2 -> 66 | E552: =SUM(RC[-2]:R[+49]C[-2])*2 -> 2 | F552: =IF(AND(EQUAL(RC[-5], "G"), EQUAL(R[+1]C[-5], "A"), EQUAL(R[+2]C[-5], "T"), EQUAL(R[+3]C[-5], "C"))=1, 1, 0) -> 0
A553: 'G | B553: =IF(EQUAL(RC[-1], "G"), 1, IF(EQUAL(RC[-1], "C"), 1, 0)) -> 1 | C553: =IF(AND(EQUAL(RC[-2], "C"), EQUAL(R[+1]C[-2], "G"))=1, 1, 0) -> 0 | D553: =SUM(RC[-2]:R[+49]C[-2])*2 -> 66 | E553: =SUM(RC[-2]:R[+49]C[-2])*2 -> 2 | F553: =IF(AND(EQUAL(RC[-5], "G"), EQUAL(R[+1]C[-5], "A"), EQUAL(R[+2]C[-5], "T"), EQUAL(R[+3]C[-5], "C"))=1, 1, 0) -> 0
A554: 'T | B554: =IF(EQUAL(RC[-1], "G"), 1, IF(EQUAL(RC[-1], "C"), 1, 0)) -> 0 | C554: =IF(AND(EQUAL(RC[-2], "C"), EQUAL(R[+1]C[-2], "G"))=1, 1, 0) -> 0 | D554: =SUM(RC[-2]:R[+49]C[-2])*2 -> 66 | E554: =SUM(RC[-2]:R[+49]C[-2])*2 -> 2 | F554: =IF(AND(EQUAL(RC[-5], "G"), EQUAL(R[+1]C[-5], "A"), EQUAL(R[+2]C[-5], "T"), EQUAL(R[+3]C[-5], "C"))=1, 1, 0) -> 0
A555: 'T | B555: =IF(EQUAL(RC[-1], "G"), 1, IF(EQUAL(RC[-1], "C"), 1, 0)) -> 0 | C555: =IF(AND(EQUAL(RC[-2], "C"), EQUAL(R[+1]C[-2], "G"))=1, 1, 0) -> 0 | D555: =SUM(RC[-2]:R[+49]C[-2])*2 -> 68 | E555: =SUM(RC[-2]:R[+49]C[-2])*2 -> 2 | F555: =IF(AND(EQUAL(RC[-5], "G"), EQUAL(R[+1]C[-5], "A"), EQUAL(R[+2]C[-5], "T"), EQUAL(R[+3]C[-5], "C"))=1, 1, 0) -> 0
A556: 'A | B556: =IF(EQUAL(RC[-1], "G"), 1, IF(EQUAL(RC[-1], "C"), 1, 0)) -> 0 | C556: =IF(AND(EQUAL(RC[-2], "C"), EQUAL(R[+1]C[-2], "G"))=1, 1, 0) -> 0 | D556: =SUM(RC[-2]:R[+49]C[-2])*2 -> 68 | E556: =SUM(RC[-2]:R[+49]C[-2])*2 -> 2 | F556: =IF(AND(EQUAL(RC[-5], "G"), EQUAL(R[+1]C[-5], "A"), EQUAL(R[+2]C[-5], "T"), EQUAL(R[+3]C[-5], "C"))=1, 1, 0) -> 0
A557: 'T | B557: =IF(EQUAL(RC[-1], "G"), 1, IF(EQUAL(RC[-1], "C"), 1, 0)) -> 0 | C557: =IF(AND(EQUAL(RC[-2], "C"), EQUAL(R[+1]C[-2], "G"))=1, 1, 0) -> 0 | D557: =SUM(RC[-2]:R[+49]C[-2])*2 -> 70 | E557: =SUM(RC[-2]:R[+49]C[-2])*2 -> 2 | F557: =IF(AND(EQUAL(RC[-5], "G"), EQUAL(R[+1]C[-5], "A"), EQUAL(R[+2]C[-5], "T"), EQUAL(R[+3]C[-5], "C"))=1, 1, 0) -> 0
A558: 'G | B558: =IF(EQUAL(RC[-1], "G"), 1, IF(EQUAL(RC[-1], "C"), 1, 0)) -> 1 | C558: =IF(AND(EQUAL(RC[-2], "C"), EQUAL(R[+1]C[-2], "G"))=1, 1, 0) -> 0 | D558: =SUM(RC[-2]:R[+49]C[-2])*2 -> 70 | E558: =SUM(RC[-2]:R[+49]C[-2])*2 -> 2 | F558: =IF(AND(EQUAL(RC[-5], "G"), EQUAL(R[+1]C[-5], "A"), EQUAL(R[+2]C[-5], "T"), EQUAL(R[+3]C[-5], "C"))=1, 1, 0) -> 0
A559: 'A | B559: =IF(EQUAL(RC[-1], "G"), 1, IF(EQUAL(RC[-1], "C"), 1, 0)) -> 0 | C559: =IF(AND(EQUAL(RC[-2], "C"), EQUAL(R[+1]C[-2], "G"))=1, 1, 0) -> 0 | D559: =SUM(RC[-2]:R[+49]C[-2])*2 -> 68 | E559: =SUM(RC[-2]:R[+49]C[-2])*2 -> 2 | F559: =IF(AND(EQUAL(RC[-5], "G"), EQUAL(R[+1]C[-5], "A"), EQUAL(R[+2]C[-5], "T"), EQUAL(R[+3]C[-5], "C"))=1, 1, 0) -> 0
A560: 'G | B560: =IF(EQUAL(RC[-1], "G"), 1, IF(EQUAL(RC[-1], "C"), 1, 0)) -> 1 | C560: =IF(AND(EQUAL(RC[-2], "C"), EQUAL(R[+1]C[-2], "G"))=1, 1, 0) -> 0 | D560: =SUM(RC[-2]:R[+49]C[-2])*2 -> 70 | E560: =SUM(RC[-2]:R[+49]C[-2])*2 -> 2 | F560: =IF(AND(EQUAL(RC[-5], "G"), EQUAL(R[+1]C[-5], "A"), EQUAL(R[+2]C[-5], "T"), EQUAL(R[+3]C[-5], "C"))=1, 1, 0) -> 0
A561: 'T | B561: =IF(EQUAL(RC[-1], "G"), 1, IF(EQUAL(RC[-1], "C"), 1, 0)) -> 0 | C561: =IF(AND(EQUAL(RC[-2], "C"), EQUAL(R[+1]C[-2], "G"))=1, 1, 0) -> 0 | D561: =SUM(RC[-2]:R[+49]C[-2])*2 -> 70 | E561: =SUM(RC[-2]:R[+49]C[-2])*2 -> 2 | F561: =IF(AND(EQUAL(RC[-5], "G"), EQUAL(R[+1]C[-5], "A"), EQUAL(R[+2]C[-5], "T"), EQUAL(R[+3]C[-5], "C"))=1, 1, 0) -> 0
A562: 'C | B562: =IF(EQUAL(RC[-1], "G"), 1, IF(EQUAL(RC[-1], "C"), 1, 0)) -> 1 | C562: =IF(AND(EQUAL(RC[-2], "C"), EQUAL(R[+1]C[-2], "G"))=1, 1, 0) -> 0 | D562: =SUM(RC[-2]:R[+49]C[-2])*2 -> 70 | E562: =SUM(RC[-2]:R[+49]C[-2])*2 -> 2 | F562: =IF(AND(EQUAL(RC[-5], "G"), EQUAL(R[+1]C[-5], "A"), EQUAL(R[+2]C[-5], "T"), EQUAL(R[+3]C[-5], "C"))=1, 1, 0) -> 0
A563: 'C | B563: =IF(EQUAL(RC[-1], "G"), 1, IF(EQUAL(RC[-1], "C"), 1, 0)) -> 1 | C563: =IF(AND(EQUAL(RC[-2], "C"), EQUAL(R[+1]C[-2], "G"))=1, 1, 0) -> 0 | D563: =SUM(RC[-2]:R[+49]C[-2])*2 -> 68 | E563: =SUM(RC[-2]:R[+49]C[-2])*2 -> 2 | F563: =IF(AND(EQUAL(RC[-5], "G"), EQUAL(R[+1]C[-5], "A"), EQUAL(R[+2]C[-5], "T"), EQUAL(R[+3]C[-5], "C"))=1, 1, 0) -> 0
A564: 'T | B564: =IF(EQUAL(RC[-1], "G"), 1, IF(EQUAL(RC[-1], "C"), 1, 0)) -> 0 | C564: =IF(AND(EQUAL(RC[-2], "C"), EQUAL(R[+1]C[-2], "G"))=1, 1, 0) -> 0 | D564: =SUM(RC[-2]:R[+49]C[-2])*2 -> 66 | E564: =SUM(RC[-2]:R[+49]C[-2])*2 -> 2 | F564: =IF(AND(EQUAL(RC[-5], "G"), EQUAL(R[+1]C[-5], "A"), EQUAL(R[+2]C[-5], "T"), EQUAL(R[+3]C[-5], "C"))=1, 1, 0) -> 0
A565: 'C | B565: =IF(EQUAL(RC[-1], "G"), 1, IF(EQUAL(RC[-1], "C"), 1, 0)) -> 1 | C565: =IF(AND(EQUAL(RC[-2], "C"), EQUAL(R[+1]C[-2], "G"))=1, 1, 0) -> 0 | D565: =SUM(RC[-2]:R[+49]C[-2])*2 -> 66 | E565: =SUM(RC[-2]:R[+49]C[-2])*2 -> 2 | F565: =IF(AND(EQUAL(RC[-5], "G"), EQUAL(R[+1]C[-5], "A"), EQUAL(R[+2]C[-5], "T"), EQUAL(R[+3]C[-5], "C"))=1, 1, 0) -> 0
A566: 'T | B566: =IF(EQUAL(RC[-1], "G"), 1, IF(EQUAL(RC[-1], "C"), 1, 0)) -> 0 | C566: =IF(AND(EQUAL(RC[-2], "C"), EQUAL(R[+1]C[-2], "G"))=1, 1, 0) -> 0 | D566: =SUM(RC[-2]:R[+49]C[-2])*2 -> 64 | E566: =SUM(RC[-2]:R[+49]C[-2])*2 -> 2 | F566: =IF(AND(EQUAL(RC[-5], "G"), EQUAL(R[+1]C[-5], "A"), EQUAL(R[+2]C[-5], "T"), EQUAL(R[+3]C[-5], "C"))=1, 1, 0) -> 0
A567: 'G | B567: =IF(EQUAL(RC[-1], "G"), 1, IF(EQUAL(RC[-1], "C"), 1, 0)) -> 1 | C567: =IF(AND(EQUAL(RC[-2], "C"), EQUAL(R[+1]C[-2], "G"))=1, 1, 0) -> 0 | D567: =SUM(RC[-2]:R[+49]C[-2])*2 -> 66 | E567: =SUM(RC[-2]:R[+49]C[-2])*2 -> 2 | F567: =IF(AND(EQUAL(RC[-5], "G"), EQUAL(R[+1]C[-5], "A"), EQUAL(R[+2]C[-5], "T"), EQUAL(R[+3]C[-5], "C"))=1, 1, 0) -> 0
A568: 'G | B568: =IF(EQUAL(RC[-1], "G"), 1, IF(EQUAL(RC[-1], "C"), 1, 0)) -> 1 | C568: =IF(AND(EQUAL(RC[-2], "C"), EQUAL(R[+1]C[-2], "G"))=1, 1, 0) -> 0 | D568: =SUM(RC[-2]:R[+49]C[-2])*2 -> 64 | E568: =SUM(RC[-2]:R[+49]C[-2])*2 -> 2 | F568: =IF(AND(EQUAL(RC[-5], "G"), EQUAL(R[+1]C[-5], "A"), EQUAL(R[+2]C[-5], "T"), EQUAL(R[+3]C[-5], "C"))=1, 1, 0) -> 0
A569: 'G | B569: =IF(EQUAL(RC[-1], "G"), 1, IF(EQUAL(RC[-1], "C"), 1, 0)) -> 1 | C569: =IF(AND(EQUAL(RC[-2], "C"), EQUAL(R[+1]C[-2], "G"))=1, 1, 0) -> 0 | D569: =SUM(RC[-2]:R[+49]C[-2])*2 -> 62 | E569: =SUM(RC[-2]:R[+49]C[-2])*2 -> 2 | F569: =IF(AND(EQUAL(RC[-5], "G"), EQUAL(R[+1]C[-5], "A"), EQUAL(R[+2]C[-5], "T"), EQUAL(R[+3]C[-5], "C"))=1, 1, 0) -> 0
A570: 'G | B570: =IF(EQUAL(RC[-1], "G"), 1, IF(EQUAL(RC[-1], "C"), 1, 0)) -> 1 | C570: =IF(AND(EQUAL(RC[-2], "C"), EQUAL(R[+1]C[-2], "G"))=1, 1, 0) -> 0 | D570: =SUM(RC[-2]:R[+49]C[-2])*2 -> 62 | E570: =SUM(RC[-2]:R[+49]C[-2])*2 -> 2 | F570: =IF(AND(EQUAL(RC[-5], "G"), EQUAL(R[+1]C[-5], "A"), EQUAL(R[+2]C[-5], "T"), EQUAL(R[+3]C[-5], "C"))=1, 1, 0) -> 0
A571: 'G | B571: =IF(EQUAL(RC[-1], "G"), 1, IF(EQUAL(RC[-1], "C"), 1, 0)) -> 1 | C571: =IF(AND(EQUAL(RC[-2], "C"), EQUAL(R[+1]C[-2], "G"))=1, 1, 0) -> 0 | D571: =SUM(RC[-2]:R[+49]C[-2])*2 -> 60 | E571: =SUM(RC[-2]:R[+49]C[-2])*2 -> 2 | F571: =IF(AND(EQUAL(RC[-5], "G"), EQUAL(R[+1]C[-5], "A"), EQUAL(R[+2]C[-5], "T"), EQUAL(R[+3]C[-5], "C"))=1, 1, 0) -> 0
A572: 'A | B572: =IF(EQUAL(RC[-1], "G"), 1, IF(EQUAL(RC[-1], "C"), 1, 0)) -> 0 | C572: =IF(AND(EQUAL(RC[-2], "C"), EQUAL(R[+1]C[-2], "G"))=1, 1, 0) -> 0 | D572: =SUM(RC[-2]:R[+49]C[-2])*2 -> 60 | E572: =SUM(RC[-2]:R[+49]C[-2])*2 -> 2 | F572: =IF(AND(EQUAL(RC[-5], "G"), EQUAL(R[+1]C[-5], "A"), EQUAL(R[+2]C[-5], "T"), EQUAL(R[+3]C[-5], "C"))=1, 1, 0) -> 0
A573: 'C | B573: =IF(EQUAL(RC[-1], "G"), 1, IF(EQUAL(RC[-1], "C"), 1, 0)) -> 1 | C573: =IF(AND(EQUAL(RC[-2], "C"), EQUAL(R[+1]C[-2], "G"))=1, 1, 0) -> 0 | D573: =SUM(RC[-2]:R[+49]C[-2])*2 -> 62 | E573: =SUM(RC[-2]:R[+49]C[-2])*2 -> 2 | F573: =IF(AND(EQUAL(RC[-5], "G"), EQUAL(R[+1]C[-5], "A"), EQUAL(R[+2]C[-5], "T"), EQUAL(R[+3]C[-5], "C"))=1, 1, 0) -> 0
A574: 'T | B574: =IF(EQUAL(RC[-1], "G"), 1, IF(EQUAL(RC[-1], "C"), 1, 0)) -> 0 | C574: =IF(AND(EQUAL(RC[-2], "C"), EQUAL(R[+1]C[-2], "G"))=1, 1, 0) -> 0 | D574: =SUM(RC[-2]:R[+49]C[-2])*2 -> 60 | E574: =SUM(RC[-2]:R[+49]C[-2])*2 -> 2 | F574: =IF(AND(EQUAL(RC[-5], "G"), EQUAL(R[+1]C[-5], "A"), EQUAL(R[+2]C[-5], "T"), EQUAL(R[+3]C[-5], "C"))=1, 1, 0) -> 0
A575: 'A | B575: =IF(EQUAL(RC[-1], "G"), 1, IF(EQUAL(RC[-1], "C"), 1, 0)) -> 0 | C575: =IF(AND(EQUAL(RC[-2], "C"), EQUAL(R[+1]C[-2], "G"))=1, 1, 0) -> 0 | D575: =SUM(RC[-2]:R[+49]C[-2])*2 -> 60 | E575: =SUM(RC[-2]:R[+49]C[-2])*2 -> 2 | F575: =IF(AND(EQUAL(RC[-5], "G"), EQUAL(R[+1]C[-5], "A"), EQUAL(R[+2]C[-5], "T"), EQUAL(R[+3]C[-5], "C"))=1, 1, 0) -> 0
A576: 'C | B576: =IF(EQUAL(RC[-1], "G"), 1, IF(EQUAL(RC[-1], "C"), 1, 0)) -> 1 | C576: =IF(AND(EQUAL(RC[-2], "C"), EQUAL(R[+1]C[-2], "G"))=1, 1, 0) -> 0 | D576: =SUM(RC[-2]:R[+49]C[-2])*2 -> 62 | E576: =SUM(RC[-2]:R[+49]C[-2])*2 -> 2 | F576: =IF(AND(EQUAL(RC[-5], "G"), EQUAL(R[+1]C[-5], "A"), EQUAL(R[+2]C[-5], "T"), EQUAL(R[+3]C[-5], "C"))=1, 1, 0) -> 0
A577: 'A | B577: =IF(EQUAL(RC[-1], "G"), 1, IF(EQUAL(RC[-1], "C"), 1, 0)) -> 0 | C577: =IF(AND(EQUAL(RC[-2], "C"), EQUAL(R[+1]C[-2], "G"))=1, 1, 0) -> 0 | D577: =SUM(RC[-2]:R[+49]C[-2])*2 -> 60 | E577: =SUM(RC[-2]:R[+49]C[-2])*2 -> 2 | F577: =IF(AND(EQUAL(RC[-5], "G"), EQUAL(R[+1]C[-5], "A"), EQUAL(R[+2]C[-5], "T"), EQUAL(R[+3]C[-5], "C"))=1, 1, 0) -> 0
A578: 'G | B578: =IF(EQUAL(RC[-1], "G"), 1, IF(EQUAL(RC[-1], "C"), 1, 0)) -> 1 | C578: =IF(AND(EQUAL(RC[-2], "C"), EQUAL(R[+1]C[-2], "G"))=1, 1, 0) -> 0 | D578: =SUM(RC[-2]:R[+49]C[-2])*2 -> 60 | E578: =SUM(RC[-2]:R[+49]C[-2])*2 -> 2 | F578: =IF(AND(EQUAL(RC[-5], "G"), EQUAL(R[+1]C[-5], "A"), EQUAL(R[+2]C[-5], "T"), EQUAL(R[+3]C[-5], "C"))=1, 1, 0) -> 0
A579: 'T | B579: =IF(EQUAL(RC[-1], "G"), 1, IF(EQUAL(RC[-1], "C"), 1, 0)) -> 0 | C579: =IF(AND(EQUAL(RC[-2], "C"), EQUAL(R[+1]C[-2], "G"))=1, 1, 0) -> 0 | D579: =SUM(RC[-2]:R[+49]C[-2])*2 -> 58 | E579: =SUM(RC[-2]:R[+49]C[-2])*2 -> 2 | F579: =IF(AND(EQUAL(RC[-5], "G"), EQUAL(R[+1]C[-5], "A"), EQUAL(R[+2]C[-5], "T"), EQUAL(R[+3]C[-5], "C"))=1, 1, 0) -> 0
A580: 'G | B580: =IF(EQUAL(RC[-1], "G"), 1, IF(EQUAL(RC[-1], "C"), 1, 0)) -> 1 | C580: =IF(AND(EQUAL(RC[-2], "C"), EQUAL(R[+1]C[-2], "G"))=1, 1, 0) -> 0 | D580: =SUM(RC[-2]:R[+49]C[-2])*2 -> 58 | E580: =SUM(RC[-2]:R[+49]C[-2])*2 -> 2 | F580: =IF(AND(EQUAL(RC[-5], "G"), EQUAL(R[+1]C[-5], "A"), EQUAL(R[+2]C[-5], "T"), EQUAL(R[+3]C[-5], "C"))=1, 1, 0) -> 0
A581: 'G | B581: =IF(EQUAL(RC[-1], "G"), 1, IF(EQUAL(RC[-1], "C"), 1, 0)) -> 1 | C581: =IF(AND(EQUAL(RC[-2], "C"), EQUAL(R[+1]C[-2], "G"))=1, 1, 0) -> 0 | D581: =SUM(RC[-2]:R[+49]C[-2])*2 -> 56 | E581: =SUM(RC[-2]:R[+49]C[-2])*2 -> 2 | F581: =IF(AND(EQUAL(RC[-5], "G"), EQUAL(R[+1]C[-5], "A"), EQUAL(R[+2]C[-5], "T"), EQUAL(R[+3]C[-5], "C"))=1, 1, 0) -> 0
A582: 'G | B582: =IF(EQUAL(RC[-1], "G"), 1, IF(EQUAL(RC[-1], "C"), 1, 0)) -> 1 | C582: =IF(AND(EQUAL(RC[-2], "C"), EQUAL(R[+1]C[-2], "G"))=1, 1, 0) -> 0 | D582: =SUM(RC[-2]:R[+49]C[-2])*2 -> 54 | E582: =SUM(RC[-2]:R[+49]C[-2])*2 -> 2 | F582: =IF(AND(EQUAL(RC[-5], "G"), EQUAL(R[+1]C[-5], "A"), EQUAL(R[+2]C[-5], "T"), EQUAL(R[+3]C[-5], "C"))=1, 1, 0) -> 0
A583: 'C | B583: =IF(EQUAL(RC[-1], "G"), 1, IF(EQUAL(RC[-1], "C"), 1, 0)) -> 1 | C583: =IF(AND(EQUAL(RC[-2], "C"), EQUAL(R[+1]C[-2], "G"))=1, 1, 0) -> 0 | D583: =SUM(RC[-2]:R[+49]C[-2])*2 -> 54 | E583: =SUM(RC[-2]:R[+49]C[-2])*2 -> 2 | F583: =IF(AND(EQUAL(RC[-5], "G"), EQUAL(R[+1]C[-5], "A"), EQUAL(R[+2]C[-5], "T"), EQUAL(R[+3]C[-5], "C"))=1, 1, 0) -> 0
A584: 'C | B584: =IF(EQUAL(RC[-1], "G"), 1, IF(EQUAL(RC[-1], "C"), 1, 0)) -> 1 | C584: =IF(AND(EQUAL(RC[-2], "C"), EQUAL(R[+1]C[-2], "G"))=1, 1, 0) -> 0 | D584: =SUM(RC[-2]:R[+49]C[-2])*2 -> 54 | E584: =SUM(RC[-2]:R[+49]C[-2])*2 -> 2 | F584: =IF(AND(EQUAL(RC[-5], "G"), EQUAL(R[+1]C[-5], "A"), EQUAL(R[+2]C[-5], "T"), EQUAL(R[+3]C[-5], "C"))=1, 1, 0) -> 0
A585: 'T | B585: =IF(EQUAL(RC[-1], "G"), 1, IF(EQUAL(RC[-1], "C"), 1, 0)) -> 0 | C585: =IF(AND(EQUAL(RC[-2], "C"), EQUAL(R[+1]C[-2], "G"))=1, 1, 0) -> 0 | D585: =SUM(RC[-2]:R[+49]C[-2])*2 -> 54 | E585: =SUM(RC[-2]:R[+49]C[-2])*2 -> 2 | F585: =IF(AND(EQUAL(RC[-5], "G"), EQUAL(R[+1]C[-5], "A"), EQUAL(R[+2]C[-5], "T"), EQUAL(R[+3]C[-5], "C"))=1, 1, 0) -> 0
A586: 'G | B586: =IF(EQUAL(RC[-1], "G"), 1, IF(EQUAL(RC[-1], "C"), 1, 0)) -> 1 | C586: =IF(AND(EQUAL(RC[-2], "C"), EQUAL(R[+1]C[-2], "G"))=1, 1, 0) -> 0 | D586: =SUM(RC[-2]:R[+49]C[-2])*2 -> 54 | E586: =SUM(RC[-2]:R[+49]C[-2])*2 -> 2 | F586: =IF(AND(EQUAL(RC[-5], "G"), EQUAL(R[+1]C[-5], "A"), EQUAL(R[+2]C[-5], "T"), EQUAL(R[+3]C[-5], "C"))=1, 1, 0) -> 0
A587: 'G | B587: =IF(EQUAL(RC[-1], "G"), 1, IF(EQUAL(RC[-1], "C"), 1, 0)) -> 1 | C587: =IF(AND(EQUAL(RC[-2], "C"), EQUAL(R[+1]C[-2], "G"))=1, 1, 0) -> 0 | D587: =SUM(RC[-2]:R[+49]C[-2])*2 -> 54 | E587: =SUM(RC[-2]:R[+49]C[-2])*2 -> 2 | F587: =IF(AND(EQUAL(RC[-5], "G"), EQUAL(R[+1]C[-5], "A"), EQUAL(R[+2]C[-5], "T"), EQUAL(R[+3]C[-5], "C"))=1, 1, 0) -> 0
A588: 'G | B588: =IF(EQUAL(RC[-1], "G"), 1, IF(EQUAL(RC[-1], "C"), 1, 0)) -> 1 | C588: =IF(AND(EQUAL(RC[-2], "C"), EQUAL(R[+1]C[-2], "G"))=1, 1, 0) -> 0 | D588: =SUM(RC[-2]:R[+49]C[-2])*2 -> 54 | E588: =SUM(RC[-2]:R[+49]C[-2])*2 -> 2 | F588: =IF(AND(EQUAL(RC[-5], "G"), EQUAL(R[+1]C[-5], "A"), EQUAL(R[+2]C[-5], "T"), EQUAL(R[+3]C[-5], "C"))=1, 1, 0) -> 0
A589: 'G | B589: =IF(EQUAL(RC[-1], "G"), 1, IF(EQUAL(RC[-1], "C"), 1, 0)) -> 1 | C589: =IF(AND(EQUAL(RC[-2], "C"), EQUAL(R[+1]C[-2], "G"))=1, 1, 0) -> 0 | D589: =SUM(RC[-2]:R[+49]C[-2])*2 -> 54 | E589: =SUM(RC[-2]:R[+49]C[-2])*2 -> 2 | F589: =IF(AND(EQUAL(RC[-5], "G"), EQUAL(R[+1]C[-5], "A"), EQUAL(R[+2]C[-5], "T"), EQUAL(R[+3]C[-5], "C"))=1, 1, 0) -> 0
A590: 'G | B590: =IF(EQUAL(RC[-1], "G"), 1, IF(EQUAL(RC[-1], "C"), 1, 0)) -> 1 | C590: =IF(AND(EQUAL(RC[-2], "C"), EQUAL(R[+1]C[-2], "G"))=1, 1, 0) -> 0 | D590: =SUM(RC[-2]:R[+49]C[-2])*2 -> 54 | E590: =SUM(RC[-2]:R[+49]C[-2])*2 -> 2 | F590: =IF(AND(EQUAL(RC[-5], "G"), EQUAL(R[+1]C[-5], "A"), EQUAL(R[+2]C[-5], "T"), EQUAL(R[+3]C[-5], "C"))=1, 1, 0) -> 0
A591: 'G | B591: =IF(EQUAL(RC[-1], "G"), 1, IF(EQUAL(RC[-1], "C"), 1, 0)) -> 1 | C591: =IF(AND(EQUAL(RC[-2], "C"), EQUAL(R[+1]C[-2], "G"))=1, 1, 0) -> 0 | D591: =SUM(RC[-2]:R[+49]C[-2])*2 -> 54 | E591: =SUM(RC[-2]:R[+49]C[-2])*2 -> 2 | F591: =IF(AND(EQUAL(RC[-5], "G"), EQUAL(R[+1]C[-5], "A"), EQUAL(R[+2]C[-5], "T"), EQUAL(R[+3]C[-5], "C"))=1, 1, 0) -> 0
A592: 'C | B592: =IF(EQUAL(RC[-1], "G"), 1, IF(EQUAL(RC[-1], "C"), 1, 0)) -> 1 | C592: =IF(AND(EQUAL(RC[-2], "C"), EQUAL(R[+1]C[-2], "G"))=1, 1, 0) -> 0 | D592: =SUM(RC[-2]:R[+49]C[-2])*2 -> 52 | E592: =SUM(RC[-2]:R[+49]C[-2])*2 -> 2 | F592: =IF(AND(EQUAL(RC[-5], "G"), EQUAL(R[+1]C[-5], "A"), EQUAL(R[+2]C[-5], "T"), EQUAL(R[+3]C[-5], "C"))=1, 1, 0) -> 0
A593: 'T | B593: =IF(EQUAL(RC[-1], "G"), 1, IF(EQUAL(RC[-1], "C"), 1, 0)) -> 0 | C593: =IF(AND(EQUAL(RC[-2], "C"), EQUAL(R[+1]C[-2], "G"))=1, 1, 0) -> 0 | D593: =SUM(RC[-2]:R[+49]C[-2])*2 -> 50 | E593: =SUM(RC[-2]:R[+49]C[-2])*2 -> 2 | F593: =IF(AND(EQUAL(RC[-5], "G"), EQUAL(R[+1]C[-5], "A"), EQUAL(R[+2]C[-5], "T"), EQUAL(R[+3]C[-5], "C"))=1, 1, 0) -> 0
A594: 'G | B594: =IF(EQUAL(RC[-1], "G"), 1, IF(EQUAL(RC[-1], "C"), 1, 0)) -> 1 | C594: =IF(AND(EQUAL(RC[-2], "C"), EQUAL(R[+1]C[-2], "G"))=1, 1, 0) -> 0 | D594: =SUM(RC[-2]:R[+49]C[-2])*2 -> 52 | E594: =SUM(RC[-2]:R[+49]C[-2])*2 -> 2 | F594: =IF(AND(EQUAL(RC[-5], "G"), EQUAL(R[+1]C[-5], "A"), EQUAL(R[+2]C[-5], "T"), EQUAL(R[+3]C[-5], "C"))=1, 1, 0) -> 0
A595: 'C | B595: =IF(EQUAL(RC[-1], "G"), 1, IF(EQUAL(RC[-1], "C"), 1, 0)) -> 1 | C595: =IF(AND(EQUAL(RC[-2], "C"), EQUAL(R[+1]C[-2], "G"))=1, 1, 0) -> 0 | D595: =SUM(RC[-2]:R[+49]C[-2])*2 -> 50 | E595: =SUM(RC[-2]:R[+49]C[-2])*2 -> 2 | F595: =IF(AND(EQUAL(RC[-5], "G"), EQUAL(R[+1]C[-5], "A"), EQUAL(R[+2]C[-5], "T"), EQUAL(R[+3]C[-5], "C"))=1, 1, 0) -> 0
A596: 'A | B596: =IF(EQUAL(RC[-1], "G"), 1, IF(EQUAL(RC[-1], "C"), 1, 0)) -> 0 | C596: =IF(AND(EQUAL(RC[-2], "C"), EQUAL(R[+1]C[-2], "G"))=1, 1, 0) -> 0 | D596: =SUM(RC[-2]:R[+49]C[-2])*2 -> 48 | E596: =SUM(RC[-2]:R[+49]C[-2])*2 -> 2 | F596: =IF(AND(EQUAL(RC[-5], "G"), EQUAL(R[+1]C[-5], "A"), EQUAL(R[+2]C[-5], "T"), EQUAL(R[+3]C[-5], "C"))=1, 1, 0) -> 0
A597: 'G | B597: =IF(EQUAL(RC[-1], "G"), 1, IF(EQUAL(RC[-1], "C"), 1, 0)) -> 1 | C597: =IF(AND(EQUAL(RC[-2], "C"), EQUAL(R[+1]C[-2], "G"))=1, 1, 0) -> 0 | D597: =SUM(RC[-2]:R[+49]C[-2])*2 -> 50 | E597: =SUM(RC[-2]:R[+49]C[-2])*2 -> 2 | F597: =IF(AND(EQUAL(RC[-5], "G"), EQUAL(R[+1]C[-5], "A"), EQUAL(R[+2]C[-5], "T"), EQUAL(R[+3]C[-5], "C"))=1, 1, 0) -> 0
A598: 'C | B598: =IF(EQUAL(RC[-1], "G"), 1, IF(EQUAL(RC[-1], "C"), 1, 0)) -> 1 | C598: =IF(AND(EQUAL(RC[-2], "C"), EQUAL(R[+1]C[-2], "G"))=1, 1, 0) -> 0 | D598: =SUM(RC[-2]:R[+49]C[-2])*2 -> 50 | E598: =SUM(RC[-2]:R[+49]C[-2])*2 -> 2 | F598: =IF(AND(EQUAL(RC[-5], "G"), EQUAL(R[+1]C[-5], "A"), EQUAL(R[+2]C[-5], "T"), EQUAL(R[+3]C[-5], "C"))=1, 1, 0) -> 0
A599: 'A | B599: =IF(EQUAL(RC[-1], "G"), 1, IF(EQUAL(RC[-1], "C"), 1, 0)) -> 0 | C599: =IF(AND(EQUAL(RC[-2], "C"), EQUAL(R[+1]C[-2], "G"))=1, 1, 0) -> 0 | D599: =SUM(RC[-2]:R[+49]C[-2])*2 -> 48 | E599: =SUM(RC[-2]:R[+49]C[-2])*2 -> 2 | F599: =IF(AND(EQUAL(RC[-5], "G"), EQUAL(R[+1]C[-5], "A"), EQUAL(R[+2]C[-5], "T"), EQUAL(R[+3]C[-5], "C"))=1, 1, 0) -> 0
A600: 'C | B600: =IF(EQUAL(RC[-1], "G"), 1, IF(EQUAL(RC[-1], "C"), 1, 0)) -> 1 | C600: =IF(AND(EQUAL(RC[-2], "C"), EQUAL(R[+1]C[-2], "G"))=1, 1, 0) -> 1 | D600: =SUM(RC[-2]:R[+49]C[-2])*2 -> 48 | E600: =SUM(RC[-2]:R[+49]C[-2])*2 -> 2 | F600: =IF(AND(EQUAL(RC[-5], "G"), EQUAL(R[+1]C[-5], "A"), EQUAL(R[+2]C[-5], "T"), EQUAL(R[+3]C[-5], "C"))=1, 1, 0) -> 0
A601: 'G | B601: =IF(EQUAL(RC[-1], "G"), 1, IF(EQUAL(RC[-1], "C"), 1, 0)) -> 1 | C601: =IF(AND(EQUAL(RC[-2], "C"), EQUAL(R[+1]C[-2], "G"))=1, 1, 0) -> 0 | D601: =SUM(RC[-2]:R[+49]C[-2])*2 -> 46 | E601: =SUM(RC[-2]:R[+49]C[-2])*2 -> 0 | F601: =IF(AND(EQUAL(RC[-5], "G"), EQUAL(R[+1]C[-5], "A"), EQUAL(R[+2]C[-5], "T"), EQUAL(R[+3]C[-5], "C"))=1, 1, 0) -> 0
A602: 'G | B602: =IF(EQUAL(RC[-1], "G"), 1, IF(EQUAL(RC[-1], "C"), 1, 0)) -> 1 | C602: =IF(AND(EQUAL(RC[-2], "C"), EQUAL(R[+1]C[-2], "G"))=1, 1, 0) -> 0 | D602: =SUM(RC[-2]:R[+49]C[-2])*2 -> 46 | E602: =SUM(RC[-2]:R[+49]C[-2])*2 -> 0 | F602: =IF(AND(EQUAL(RC[-5], "G"), EQUAL(R[+1]C[-5], "A"), EQUAL(R[+2]C[-5], "T"), EQUAL(R[+3]C[-5], "C"))=1, 1, 0) -> 0
A603: 'C | B603: =IF(EQUAL(RC[-1], "G"), 1, IF(EQUAL(RC[-1], "C"), 1, 0)) -> 1 | C603: =IF(AND(EQUAL(RC[-2], "C"), EQUAL(R[+1]C[-2], "G"))=1, 1, 0) -> 0 | D603: =SUM(RC[-2]:R[+49]C[-2])*2 -> 44 | E603: =SUM(RC[-2]:R[+49]C[-2])*2 -> 0 | F603: =IF(AND(EQUAL(RC[-5], "G"), EQUAL(R[+1]C[-5], "A"), EQUAL(R[+2]C[-5], "T"), EQUAL(R[+3]C[-5], "C"))=1, 1, 0) -> 0
A604: 'C | B604: =IF(EQUAL(RC[-1], "G"), 1, IF(EQUAL(RC[-1], "C"), 1, 0)) -> 1 | C604: =IF(AND(EQUAL(RC[-2], "C"), EQUAL(R[+1]C[-2], "G"))=1, 1, 0) -> 0 | D604: =SUM(RC[-2]:R[+49]C[-2])*2 -> 44 | E604: =SUM(RC[-2]:R[+49]C[-2])*2 -> 0 | F604: =IF(AND(EQUAL(RC[-5], "G"), EQUAL(R[+1]C[-5], "A"), EQUAL(R[+2]C[-5], "T"), EQUAL(R[+3]C[-5], "C"))=1, 1, 0) -> 0
A605: 'A | B605: =IF(EQUAL(RC[-1], "G"), 1, IF(EQUAL(RC[-1], "C"), 1, 0)) -> 0 | C605: =IF(AND(EQUAL(RC[-2], "C"), EQUAL(R[+1]C[-2], "G"))=1, 1, 0) -> 0 | D605: =SUM(RC[-2]:R[+49]C[-2])*2 -> 42 | E605: =SUM(RC[-2]:R[+49]C[-2])*2 -> 0 | F605: =IF(AND(EQUAL(RC[-5], "G"), EQUAL(R[+1]C[-5], "A"), EQUAL(R[+2]C[-5], "T"), EQUAL(R[+3]C[-5], "C"))=1, 1, 0) -> 0
A606: 'G | B606: =IF(EQUAL(RC[-1], "G"), 1, IF(EQUAL(RC[-1], "C"), 1, 0)) -> 1 | C606: =IF(AND(EQUAL(RC[-2], "C"), EQUAL(R[+1]C[-2], "G"))=1, 1, 0) -> 0 | D606: =SUM(RC[-2]:R[+49]C[-2])*2 -> 44 | E606: =SUM(RC[-2]:R[+49]C[-2])*2 -> 0 | F606: =IF(AND(EQUAL(RC[-5], "G"), EQUAL(R[+1]C[-5], "A"), EQUAL(R[+2]C[-5], "T"), EQUAL(R[+3]C[-5], "C"))=1, 1, 0) -> 0
A607: 'T | B607: =IF(EQUAL(RC[-1], "G"), 1, IF(EQUAL(RC[-1], "C"), 1, 0)) -> 0 | C607: =IF(AND(EQUAL(RC[-2], "C"), EQUAL(R[+1]C[-2], "G"))=1, 1, 0) -> 0 | D607: =SUM(RC[-2]:R[+49]C[-2])*2 -> 42 | E607: =SUM(RC[-2]:R[+49]C[-2])*2 -> 0 | F607: =IF(AND(EQUAL(RC[-5], "G"), EQUAL(R[+1]C[-5], "A"), EQUAL(R[+2]C[-5], "T"), EQUAL(R[+3]C[-5], "C"))=1, 1, 0) -> 0
A608: 'A | B608: =IF(EQUAL(RC[-1], "G"), 1, IF(EQUAL(RC[-1], "C"), 1, 0)) -> 0 | C608: =IF(AND(EQUAL(RC[-2], "C"), EQUAL(R[+1]C[-2], "G"))=1, 1, 0) -> 0 | D608: =SUM(RC[-2]:R[+49]C[-2])*2 -> 44 | E608: =SUM(RC[-2]:R[+49]C[-2])*2 -> 0 | F608: =IF(AND(EQUAL(RC[-5], "G"), EQUAL(R[+1]C[-5], "A"), EQUAL(R[+2]C[-5], "T"), EQUAL(R[+3]C[-5], "C"))=1, 1, 0) -> 0
A609: 'C | B609: =IF(EQUAL(RC[-1], "G"), 1, IF(EQUAL(RC[-1], "C"), 1, 0)) -> 1 | C609: =IF(AND(EQUAL(RC[-2], "C"), EQUAL(R[+1]C[-2], "G"))=1, 1, 0) -> 0 | D609: =SUM(RC[-2]:R[+49]C[-2])*2 -> 46 | E609: =SUM(RC[-2]:R[+49]C[-2])*2 -> 0 | F609: =IF(AND(EQUAL(RC[-5], "G"), EQUAL(R[+1]C[-5], "A"), EQUAL(R[+2]C[-5], "T"), EQUAL(R[+3]C[-5], "C"))=1, 1, 0) -> 0
A610: 'C | B610: =IF(EQUAL(RC[-1], "G"), 1, IF(EQUAL(RC[-1], "C"), 1, 0)) -> 1 | C610: =IF(AND(EQUAL(RC[-2], "C"), EQUAL(R[+1]C[-2], "G"))=1, 1, 0) -> 0 | D610: =SUM(RC[-2]:R[+49]C[-2])*2 -> 44 | E610: =SUM(RC[-2]:R[+49]C[-2])*2 -> 0 | F610: =IF(AND(EQUAL(RC[-5], "G"), EQUAL(R[+1]C[-5], "A"), EQUAL(R[+2]C[-5], "T"), EQUAL(R[+3]C[-5], "C"))=1, 1, 0) -> 0
A611: 'A | B611: =IF(EQUAL(RC[-1], "G"), 1, IF(EQUAL(RC[-1], "C"), 1, 0)) -> 0 | C611: =IF(AND(EQUAL(RC[-2], "C"), EQUAL(R[+1]C[-2], "G"))=1, 1, 0) -> 0 | D611: =SUM(RC[-2]:R[+49]C[-2])*2 -> 44 | E611: =SUM(RC[-2]:R[+49]C[-2])*2 -> 0 | F611: =IF(AND(EQUAL(RC[-5], "G"), EQUAL(R[+1]C[-5], "A"), EQUAL(R[+2]C[-5], "T"), EQUAL(R[+3]C[-5], "C"))=1, 1, 0) -> 0
A612: 'T | B612: =IF(EQUAL(RC[-1], "G"), 1, IF(EQUAL(RC[-1], "C"), 1, 0)) -> 0 | C612: =IF(AND(EQUAL(RC[-2], "C"), EQUAL(R[+1]C[-2], "G"))=1, 1, 0) -> 0 | D612: =SUM(RC[-2]:R[+49]C[-2])*2 -> 46 | E612: =SUM(RC[-2]:R[+49]C[-2])*2 -> 0 | F612: =IF(AND(EQUAL(RC[-5], "G"), EQUAL(R[+1]C[-5], "A"), EQUAL(R[+2]C[-5], "T"), EQUAL(R[+3]C[-5], "C"))=1, 1, 0) -> 0
A613: 'T | B613: =IF(EQUAL(RC[-1], "G"), 1, IF(EQUAL(RC[-1], "C"), 1, 0)) -> 0 | C613: =IF(AND(EQUAL(RC[-2], "C"), EQUAL(R[+1]C[-2], "G"))=1, 1, 0) -> 0 | D613: =SUM(RC[-2]:R[+49]C[-2])*2 -> 46 | E613: =SUM(RC[-2]:R[+49]C[-2])*2 -> 0 | F613: =IF(AND(EQUAL(RC[-5], "G"), EQUAL(R[+1]C[-5], "A"), EQUAL(R[+2]C[-5], "T"), EQUAL(R[+3]C[-5], "C"))=1, 1, 0) -> 0
A614: 'T | B614: =IF(EQUAL(RC[-1], "G"), 1, IF(EQUAL(RC[-1], "C"), 1, 0)) -> 0 | C614: =IF(AND(EQUAL(RC[-2], "C"), EQUAL(R[+1]C[-2], "G"))=1, 1, 0) -> 0 | D614: =SUM(RC[-2]:R[+49]C[-2])*2 -> 46 | E614: =SUM(RC[-2]:R[+49]C[-2])*2 -> 0 | F614: =IF(AND(EQUAL(RC[-5], "G"), EQUAL(R[+1]C[-5], "A"), EQUAL(R[+2]C[-5], "T"), EQUAL(R[+3]C[-5], "C"))=1, 1, 0) -> 0
A615: 'T | B615: =IF(EQUAL(RC[-1], "G"), 1, IF(EQUAL(RC[-1], "C"), 1, 0)) -> 0 | C615: =IF(AND(EQUAL(RC[-2], "C"), EQUAL(R[+1]C[-2], "G"))=1, 1, 0) -> 0 | D615: =SUM(RC[-2]:R[+49]C[-2])*2 -> 48 | E615: =SUM(RC[-2]:R[+49]C[-2])*2 -> 0 | F615: =IF(AND(EQUAL(RC[-5], "G"), EQUAL(R[+1]C[-5], "A"), EQUAL(R[+2]C[-5], "T"), EQUAL(R[+3]C[-5], "C"))=1, 1, 0) -> 0
A616: 'C | B616: =IF(EQUAL(RC[-1], "G"), 1, IF(EQUAL(RC[-1], "C"), 1, 0)) -> 1 | C616: =IF(AND(EQUAL(RC[-2], "C"), EQUAL(R[+1]C[-2], "G"))=1, 1, 0) -> 0 | D616: =SUM(RC[-2]:R[+49]C[-2])*2 -> 48 | E616: =SUM(RC[-2]:R[+49]C[-2])*2 -> 0 | F616: =IF(AND(EQUAL(RC[-5], "G"), EQUAL(R[+1]C[-5], "A"), EQUAL(R[+2]C[-5], "T"), EQUAL(R[+3]C[-5], "C"))=1, 1, 0) -> 0
A617: 'T | B617: =IF(EQUAL(RC[-1], "G"), 1, IF(EQUAL(RC[-1], "C"), 1, 0)) -> 0 | C617: =IF(AND(EQUAL(RC[-2], "C"), EQUAL(R[+1]C[-2], "G"))=1, 1, 0) -> 0 | D617: =SUM(RC[-2]:R[+49]C[-2])*2 -> 48 | E617: =SUM(RC[-2]:R[+49]C[-2])*2 -> 0 | F617: =IF(AND(EQUAL(RC[-5], "G"), EQUAL(R[+1]C[-5], "A"), EQUAL(R[+2]C[-5], "T"), EQUAL(R[+3]C[-5], "C"))=1, 1, 0) -> 0
A618: 'T | B618: =IF(EQUAL(RC[-1], "G"), 1, IF(EQUAL(RC[-1], "C"), 1, 0)) -> 0 | C618: =IF(AND(EQUAL(RC[-2], "C"), EQUAL(R[+1]C[-2], "G"))=1, 1, 0) -> 0 | D618: =SUM(RC[-2]:R[+49]C[-2])*2 -> 50 | E618: =SUM(RC[-2]:R[+49]C[-2])*2 -> 0 | F618: =IF(AND(EQUAL(RC[-5], "G"), EQUAL(R[+1]C[-5], "A"), EQUAL(R[+2]C[-5], "T"), EQUAL(R[+3]C[-5], "C"))=1, 1, 0) -> 0
A619: 'C | B619: =IF(EQUAL(RC[-1], "G"), 1, IF(EQUAL(RC[-1], "C"), 1, 0)) -> 1 | C619: =IF(AND(EQUAL(RC[-2], "C"), EQUAL(R[+1]C[-2], "G"))=1, 1, 0) -> 0 | D619: =SUM(RC[-2]:R[+49]C[-2])*2 -> 52 | E619: =SUM(RC[-2]:R[+49]C[-2])*2 -> 0 | F619: =IF(AND(EQUAL(RC[-5], "G"), EQUAL(R[+1]C[-5], "A"), EQUAL(R[+2]C[-5], "T"), EQUAL(R[+3]C[-5], "C"))=1, 1, 0) -> 0
A620: 'A | B620: =IF(EQUAL(RC[-1], "G"), 1, IF(EQUAL(RC[-1], "C"), 1, 0)) -> 0 | C620: =IF(AND(EQUAL(RC[-2], "C"), EQUAL(R[+1]C[-2], "G"))=1, 1, 0) -> 0 | D620: =SUM(RC[-2]:R[+49]C[-2])*2 -> 50 | E620: =SUM(RC[-2]:R[+49]C[-2])*2 -> 0 | F620: =IF(AND(EQUAL(RC[-5], "G"), EQUAL(R[+1]C[-5], "A"), EQUAL(R[+2]C[-5], "T"), EQUAL(R[+3]C[-5], "C"))=1, 1, 0) -> 0
A621: 'G | B621: =IF(EQUAL(RC[-1], "G"), 1, IF(EQUAL(RC[-1], "C"), 1, 0)) -> 1 | C621: =IF(AND(EQUAL(RC[-2], "C"), EQUAL(R[+1]C[-2], "G"))=1, 1, 0) -> 0 | D621: =SUM(RC[-2]:R[+49]C[-2])*2 -> 52 | E621: =SUM(RC[-2]:R[+49]C[-2])*2 -> 0 | F621: =IF(AND(EQUAL(RC[-5], "G"), EQUAL(R[+1]C[-5], "A"), EQUAL(R[+2]C[-5], "T"), EQUAL(R[+3]C[-5], "C"))=1, 1, 0) -> 0
A622: 'G | B622: =IF(EQUAL(RC[-1], "G"), 1, IF(EQUAL(RC[-1], "C"), 1, 0)) -> 1 | C622: =IF(AND(EQUAL(RC[-2], "C"), EQUAL(R[+1]C[-2], "G"))=1, 1, 0) -> 0 | D622: =SUM(RC[-2]:R[+49]C[-2])*2 -> 50 | E622: =SUM(RC[-2]:R[+49]C[-2])*2 -> 0 | F622: =IF(AND(EQUAL(RC[-5], "G"), EQUAL(R[+1]C[-5], "A"), EQUAL(R[+2]C[-5], "T"), EQUAL(R[+3]C[-5], "C"))=1, 1, 0) -> 0
A623: 'A | B623: =IF(EQUAL(RC[-1], "G"), 1, IF(EQUAL(RC[-1], "C"), 1, 0)) -> 0 | C623: =IF(AND(EQUAL(RC[-2], "C"), EQUAL(R[+1]C[-2], "G"))=1, 1, 0) -> 0 | D623: =SUM(RC[-2]:R[+49]C[-2])*2 -> 50 | E623: =SUM(RC[-2]:R[+49]C[-2])*2 -> 0 | F623: =IF(AND(EQUAL(RC[-5], "G"), EQUAL(R[+1]C[-5], "A"), EQUAL(R[+2]C[-5], "T"), EQUAL(R[+3]C[-5], "C"))=1, 1, 0) -> 0
A624: 'A | B624: =IF(EQUAL(RC[-1], "G"), 1, IF(EQUAL(RC[-1], "C"), 1, 0)) -> 0 | C624: =IF(AND(EQUAL(RC[-2], "C"), EQUAL(R[+1]C[-2], "G"))=1, 1, 0) -> 0 | D624: =SUM(RC[-2]:R[+49]C[-2])*2 -> 52 | E624: =SUM(RC[-2]:R[+49]C[-2])*2 -> 0 | F624: =IF(AND(EQUAL(RC[-5], "G"), EQUAL(R[+1]C[-5], "A"), EQUAL(R[+2]C[-5], "T"), EQUAL(R[+3]C[-5], "C"))=1, 1, 0) -> 0
A625: 'C | B625: =IF(EQUAL(RC[-1], "G"), 1, IF(EQUAL(RC[-1], "C"), 1, 0)) -> 1 | C625: =IF(AND(EQUAL(RC[-2], "C"), EQUAL(R[+1]C[-2], "G"))=1, 1, 0) -> 0 | D625: =SUM(RC[-2]:R[+49]C[-2])*2 -> 52 | E625: =SUM(RC[-2]:R[+49]C[-2])*2 -> 0 | F625: =IF(AND(EQUAL(RC[-5], "G"), EQUAL(R[+1]C[-5], "A"), EQUAL(R[+2]C[-5], "T"), EQUAL(R[+3]C[-5], "C"))=1, 1, 0) -> 0
A626: 'A | B626: =IF(EQUAL(RC[-1], "G"), 1, IF(EQUAL(RC[-1], "C"), 1, 0)) -> 0 | C626: =IF(AND(EQUAL(RC[-2], "C"), EQUAL(R[+1]C[-2], "G"))=1, 1, 0) -> 0 | D626: =SUM(RC[-2]:R[+49]C[-2])*2 -> 52 | E626: =SUM(RC[-2]:R[+49]C[-2])*2 -> 0 | F626: =IF(AND(EQUAL(RC[-5], "G"), EQUAL(R[+1]C[-5], "A"), EQUAL(R[+2]C[-5], "T"), EQUAL(R[+3]C[-5], "C"))=1, 1, 0) -> 0
A627: 'A | B627: =IF(EQUAL(RC[-1], "G"), 1, IF(EQUAL(RC[-1], "C"), 1, 0)) -> 0 | C627: =IF(AND(EQUAL(RC[-2], "C"), EQUAL(R[+1]C[-2], "G"))=1, 1, 0) -> 0 | D627: =SUM(RC[-2]:R[+49]C[-2])*2 -> 54 | E627: =SUM(RC[-2]:R[+49]C[-2])*2 -> 0 | F627: =IF(AND(EQUAL(RC[-5], "G"), EQUAL(R[+1]C[-5], "A"), EQUAL(R[+2]C[-5], "T"), EQUAL(R[+3]C[-5], "C"))=1, 1, 0) -> 0
A628: 'A | B628: =IF(EQUAL(RC[-1], "G"), 1, IF(EQUAL(RC[-1], "C"), 1, 0)) -> 0 | C628: =IF(AND(EQUAL(RC[-2], "C"), EQUAL(R[+1]C[-2], "G"))=1, 1, 0) -> 0 | D628: =SUM(RC[-2]:R[+49]C[-2])*2 -> 56 | E628: =SUM(RC[-2]:R[+49]C[-2])*2 -> 0 | F628: =IF(AND(EQUAL(RC[-5], "G"), EQUAL(R[+1]C[-5], "A"), EQUAL(R[+2]C[-5], "T"), EQUAL(R[+3]C[-5], "C"))=1, 1, 0) -> 0
A629: 'A | B629: =IF(EQUAL(RC[-1], "G"), 1, IF(EQUAL(RC[-1], "C"), 1, 0)) -> 0 | C629: =IF(AND(EQUAL(RC[-2], "C"), EQUAL(R[+1]C[-2], "G"))=1, 1, 0) -> 0 | D629: =SUM(RC[-2]:R[+49]C[-2])*2 -> 56 | E629: =SUM(RC[-2]:R[+49]C[-2])*2 -> 0 | F629: =IF(AND(EQUAL(RC[-5], "G"), EQUAL(R[+1]C[-5], "A"), EQUAL(R[+2]C[-5], "T"), EQUAL(R[+3]C[-5], "C"))=1, 1, 0) -> 0
A630: 'T | B630: =IF(EQUAL(RC[-1], "G"), 1, IF(EQUAL(RC[-1], "C"), 1, 0)) -> 0 | C630: =IF(AND(EQUAL(RC[-2], "C"), EQUAL(R[+1]C[-2], "G"))=1, 1, 0) -> 0 | D630: =SUM(RC[-2]:R[+49]C[-2])*2 -> 58 | E630: =SUM(RC[-2]:R[+49]C[-2])*2 -> 0 | F630: =IF(AND(EQUAL(RC[-5], "G"), EQUAL(R[+1]C[-5], "A"), EQUAL(R[+2]C[-5], "T"), EQUAL(R[+3]C[-5], "C"))=1, 1, 0) -> 0
A631: 'T | B631: =IF(EQUAL(RC[-1], "G"), 1, IF(EQUAL(RC[-1], "C"), 1, 0)) -> 0 | C631: =IF(AND(EQUAL(RC[-2], "C"), EQUAL(R[+1]C[-2], "G"))=1, 1, 0) -> 0 | D631: =SUM(RC[-2]:R[+49]C[-2])*2 -> 60 | E631: =SUM(RC[-2]:R[+49]C[-2])*2 -> 0 | F631: =IF(AND(EQUAL(RC[-5], "G"), EQUAL(R[+1]C[-5], "A"), EQUAL(R[+2]C[-5], "T"), EQUAL(R[+3]C[-5], "C"))=1, 1, 0) -> 0
A632: 'C | B632: =IF(EQUAL(RC[-1], "G"), 1, IF(EQUAL(RC[-1], "C"), 1, 0)) -> 1 | C632: =IF(AND(EQUAL(RC[-2], "C"), EQUAL(R[+1]C[-2], "G"))=1, 1, 0) -> 0 | D632: =SUM(RC[-2]:R[+49]C[-2])*2 -> 60 | E632: =SUM(RC[-2]:R[+49]C[-2])*2 -> 0 | F632: =IF(AND(EQUAL(RC[-5], "G"), EQUAL(R[+1]C[-5], "A"), EQUAL(R[+2]C[-5], "T"), EQUAL(R[+3]C[-5], "C"))=1, 1, 0) -> 0
A633: 'C | B633: =IF(EQUAL(RC[-1], "G"), 1, IF(EQUAL(RC[-1], "C"), 1, 0)) -> 1 | C633: =IF(AND(EQUAL(RC[-2], "C"), EQUAL(R[+1]C[-2], "G"))=1, 1, 0) -> 0 | D633: =SUM(RC[-2]:R[+49]C[-2])*2 -> 60 | E633: =SUM(RC[-2]:R[+49]C[-2])*2 -> 0 | F633: =IF(AND(EQUAL(RC[-5], "G"), EQUAL(R[+1]C[-5], "A"), EQUAL(R[+2]C[-5], "T"), EQUAL(R[+3]C[-5], "C"))=1, 1, 0) -> 0
A634: 'C | B634: =IF(EQUAL(RC[-1], "G"), 1, IF(EQUAL(RC[-1], "C"), 1, 0)) -> 1 | C634: =IF(AND(EQUAL(RC[-2], "C"), EQUAL(R[+1]C[-2], "G"))=1, 1, 0) -> 0 | D634: =SUM(RC[-2]:R[+49]C[-2])*2 -> 60 | E634: =SUM(RC[-2]:R[+49]C[-2])*2 -> 0 | F634: =IF(AND(EQUAL(RC[-5], "G"), EQUAL(R[+1]C[-5], "A"), EQUAL(R[+2]C[-5], "T"), EQUAL(R[+3]C[-5], "C"))=1, 1, 0) -> 0
A635: 'A | B635: =IF(EQUAL(RC[-1], "G"), 1, IF(EQUAL(RC[-1], "C"), 1, 0)) -> 0 | C635: =IF(AND(EQUAL(RC[-2], "C"), EQUAL(R[+1]C[-2], "G"))=1, 1, 0) -> 0 | D635: =SUM(RC[-2]:R[+49]C[-2])*2 -> 60 | E635: =SUM(RC[-2]:R[+49]C[-2])*2 -> 0 | F635: =IF(AND(EQUAL(RC[-5], "G"), EQUAL(R[+1]C[-5], "A"), EQUAL(R[+2]C[-5], "T"), EQUAL(R[+3]C[-5], "C"))=1, 1, 0) -> 0
A636: 'G | B636: =IF(EQUAL(RC[-1], "G"), 1, IF(EQUAL(RC[-1], "C"), 1, 0)) -> 1 | C636: =IF(AND(EQUAL(RC[-2], "C"), EQUAL(R[+1]C[-2], "G"))=1, 1, 0) -> 0 | D636: =SUM(RC[-2]:R[+49]C[-2])*2 -> 60 | E636: =SUM(RC[-2]:R[+49]C[-2])*2 -> 0 | F636: =IF(AND(EQUAL(RC[-5], "G"), EQUAL(R[+1]C[-5], "A"), EQUAL(R[+2]C[-5], "T"), EQUAL(R[+3]C[-5], "C"))=1, 1, 0) -> 0
A637: 'G | B637: =IF(EQUAL(RC[-1], "G"), 1, IF(EQUAL(RC[-1], "C"), 1, 0)) -> 1 | C637: =IF(AND(EQUAL(RC[-2], "C"), EQUAL(R[+1]C[-2], "G"))=1, 1, 0) -> 0 | D637: =SUM(RC[-2]:R[+49]C[-2])*2 -> 60 | E637: =SUM(RC[-2]:R[+49]C[-2])*2 -> 0 | F637: =IF(AND(EQUAL(RC[-5], "G"), EQUAL(R[+1]C[-5], "A"), EQUAL(R[+2]C[-5], "T"), EQUAL(R[+3]C[-5], "C"))=1, 1, 0) -> 0
A638: 'C | B638: =IF(EQUAL(RC[-1], "G"), 1, IF(EQUAL(RC[-1], "C"), 1, 0)) -> 1 | C638: =IF(AND(EQUAL(RC[-2], "C"), EQUAL(R[+1]C[-2], "G"))=1, 1, 0) -> 0 | D638: =SUM(RC[-2]:R[+49]C[-2])*2 -> 58 | E638: =SUM(RC[-2]:R[+49]C[-2])*2 -> 0 | F638: =IF(AND(EQUAL(RC[-5], "G"), EQUAL(R[+1]C[-5], "A"), EQUAL(R[+2]C[-5], "T"), EQUAL(R[+3]C[-5], "C"))=1, 1, 0) -> 0
A639: 'C | B639: =IF(EQUAL(RC[-1], "G"), 1, IF(EQUAL(RC[-1], "C"), 1, 0)) -> 1 | C639: =IF(AND(EQUAL(RC[-2], "C"), EQUAL(R[+1]C[-2], "G"))=1, 1, 0) -> 0 | D639: =SUM(RC[-2]:R[+49]C[-2])*2 -> 56 | E639: =SUM(RC[-2]:R[+49]C[-2])*2 -> 0 | F639: =IF(AND(EQUAL(RC[-5], "G"), EQUAL(R[+1]C[-5], "A"), EQUAL(R[+2]C[-5], "T"), EQUAL(R[+3]C[-5], "C"))=1, 1, 0) -> 0
A640: 'C | B640: =IF(EQUAL(RC[-1], "G"), 1, IF(EQUAL(RC[-1], "C"), 1, 0)) -> 1 | C640: =IF(AND(EQUAL(RC[-2], "C"), EQUAL(R[+1]C[-2], "G"))=1, 1, 0) -> 0 | D640: =SUM(RC[-2]:R[+49]C[-2])*2 -> 56 | E640: =SUM(RC[-2]:R[+49]C[-2])*2 -> 2 | F640: =IF(AND(EQUAL(RC[-5], "G"), EQUAL(R[+1]C[-5], "A"), EQUAL(R[+2]C[-5], "T"), EQUAL(R[+3]C[-5], "C"))=1, 1, 0) -> 0
A641: 'A | B641: =IF(EQUAL(RC[-1], "G"), 1, IF(EQUAL(RC[-1], "C"), 1, 0)) -> 0 | C641: =IF(AND(EQUAL(RC[-2], "C"), EQUAL(R[+1]C[-2], "G"))=1, 1, 0) -> 0 | D641: =SUM(RC[-2]:R[+49]C[-2])*2 -> 56 | E641: =SUM(RC[-2]:R[+49]C[-2])*2 -> 2 | F641: =IF(AND(EQUAL(RC[-5], "G"), EQUAL(R[+1]C[-5], "A"), EQUAL(R[+2]C[-5], "T"), EQUAL(R[+3]C[-5], "C"))=1, 1, 0) -> 0
A642: 'A | B642: =IF(EQUAL(RC[-1], "G"), 1, IF(EQUAL(RC[-1], "C"), 1, 0)) -> 0 | C642: =IF(AND(EQUAL(RC[-2], "C"), EQUAL(R[+1]C[-2], "G"))=1, 1, 0) -> 0 | D642: =SUM(RC[-2]:R[+49]C[-2])*2 -> 58 | E642: =SUM(RC[-2]:R[+49]C[-2])*2 -> 2 | F642: =IF(AND(EQUAL(RC[-5], "G"), EQUAL(R[+1]C[-5], "A"), EQUAL(R[+2]C[-5], "T"), EQUAL(R[+3]C[-5], "C"))=1, 1, 0) -> 0
A643: 'C | B643: =IF(EQUAL(RC[-1], "G"), 1, IF(EQUAL(RC[-1], "C"), 1, 0)) -> 1 | C643: =IF(AND(EQUAL(RC[-2], "C"), EQUAL(R[+1]C[-2], "G"))=1, 1, 0) -> 0 | D643: =SUM(RC[-2]:R[+49]C[-2])*2 -> 60 | E643: =SUM(RC[-2]:R[+49]C[-2])*2 -> 4 | F643: =IF(AND(EQUAL(RC[-5], "G"), EQUAL(R[+1]C[-5], "A"), EQUAL(R[+2]C[-5], "T"), EQUAL(R[+3]C[-5], "C"))=1, 1, 0) -> 0
A644: 'T | B644: =IF(EQUAL(RC[-1], "G"), 1, IF(EQUAL(RC[-1], "C"), 1, 0)) -> 0 | C644: =IF(AND(EQUAL(RC[-2], "C"), EQUAL(R[+1]C[-2], "G"))=1, 1, 0) -> 0 | D644: =SUM(RC[-2]:R[+49]C[-2])*2 -> 60 | E644: =SUM(RC[-2]:R[+49]C[-2])*2 -> 4 | F644: =IF(AND(EQUAL(RC[-5], "G"), EQUAL(R[+1]C[-5], "A"), EQUAL(R[+2]C[-5], "T"), EQUAL(R[+3]C[-5], "C"))=1, 1, 0) -> 0
A645: 'T | B645: =IF(EQUAL(RC[-1], "G"), 1, IF(EQUAL(RC[-1], "C"), 1, 0)) -> 0 | C645: =IF(AND(EQUAL(RC[-2], "C"), EQUAL(R[+1]C[-2], "G"))=1, 1, 0) -> 0 | D645: =SUM(RC[-2]:R[+49]C[-2])*2 -> 62 | E645: =SUM(RC[-2]:R[+49]C[-2])*2 -> 4 | F645: =IF(AND(EQUAL(RC[-5], "G"), EQUAL(R[+1]C[-5], "A"), EQUAL(R[+2]C[-5], "T"), EQUAL(R[+3]C[-5], "C"))=1, 1, 0) -> 0
A646: 'G | B646: =IF(EQUAL(RC[-1], "G"), 1, IF(EQUAL(RC[-1], "C"), 1, 0)) -> 1 | C646: =IF(AND(EQUAL(RC[-2], "C"), EQUAL(R[+1]C[-2], "G"))=1, 1, 0) -> 0 | D646: =SUM(RC[-2]:R[+49]C[-2])*2 -> 64 | E646: =SUM(RC[-2]:R[+49]C[-2])*2 -> 6 | F646: =IF(AND(EQUAL(RC[-5], "G"), EQUAL(R[+1]C[-5], "A"), EQUAL(R[+2]C[-5], "T"), EQUAL(R[+3]C[-5], "C"))=1, 1, 0) -> 0
A647: 'C | B647: =IF(EQUAL(RC[-1], "G"), 1, IF(EQUAL(RC[-1], "C"), 1, 0)) -> 1 | C647: =IF(AND(EQUAL(RC[-2], "C"), EQUAL(R[+1]C[-2], "G"))=1, 1, 0) -> 0 | D647: =SUM(RC[-2]:R[+49]C[-2])*2 -> 64 | E647: =SUM(RC[-2]:R[+49]C[-2])*2 -> 6 | F647: =IF(AND(EQUAL(RC[-5], "G"), EQUAL(R[+1]C[-5], "A"), EQUAL(R[+2]C[-5], "T"), EQUAL(R[+3]C[-5], "C"))=1, 1, 0) -> 0
A648: 'A | B648: =IF(EQUAL(RC[-1], "G"), 1, IF(EQUAL(RC[-1], "C"), 1, 0)) -> 0 | C648: =IF(AND(EQUAL(RC[-2], "C"), EQUAL(R[+1]C[-2], "G"))=1, 1, 0) -> 0 | D648: =SUM(RC[-2]:R[+49]C[-2])*2 -> 64 | E648: =SUM(RC[-2]:R[+49]C[-2])*2 -> 6 | F648: =IF(AND(EQUAL(RC[-5], "G"), EQUAL(R[+1]C[-5], "A"), EQUAL(R[+2]C[-5], "T"), EQUAL(R[+3]C[-5], "C"))=1, 1, 0) -> 0
A649: 'A | B649: =IF(EQUAL(RC[-1], "G"), 1, IF(EQUAL(RC[-1], "C"), 1, 0)) -> 0 | C649: =IF(AND(EQUAL(RC[-2], "C"), EQUAL(R[+1]C[-2], "G"))=1, 1, 0) -> 0 | D649: =SUM(RC[-2]:R[+49]C[-2])*2 -> 64 | E649: =SUM(RC[-2]:R[+49]C[-2])*2 -> 6 | F649: =IF(AND(EQUAL(RC[-5], "G"), EQUAL(R[+1]C[-5], "A"), EQUAL(R[+2]C[-5], "T"), EQUAL(R[+3]C[-5], "C"))=1, 1, 0) -> 0
A650: 'A | B650: =IF(EQUAL(RC[-1], "G"), 1, IF(EQUAL(RC[-1], "C"), 1, 0)) -> 0 | C650: =IF(AND(EQUAL(RC[-2], "C"), EQUAL(R[+1]C[-2], "G"))=1, 1, 0) -> 0 | D650: =SUM(RC[-2]:R[+49]C[-2])*2 -> 66 | E650: =SUM(RC[-2]:R[+49]C[-2])*2 -> 6 | F650: =IF(AND(EQUAL(RC[-5], "G"), EQUAL(R[+1]C[-5], "A"), EQUAL(R[+2]C[-5], "T"), EQUAL(R[+3]C[-5], "C"))=1, 1, 0) -> 0
A651: 'C | B651: =IF(EQUAL(RC[-1], "G"), 1, IF(EQUAL(RC[-1], "C"), 1, 0)) -> 1 | C651: =IF(AND(EQUAL(RC[-2], "C"), EQUAL(R[+1]C[-2], "G"))=1, 1, 0) -> 0 | D651: =SUM(RC[-2]:R[+49]C[-2])*2 -> 66 | E651: =SUM(RC[-2]:R[+49]C[-2])*2 -> 6 | F651: =IF(AND(EQUAL(RC[-5], "G"), EQUAL(R[+1]C[-5], "A"), EQUAL(R[+2]C[-5], "T"), EQUAL(R[+3]C[-5], "C"))=1, 1, 0) -> 0
A652: 'A | B652: =IF(EQUAL(RC[-1], "G"), 1, IF(EQUAL(RC[-1], "C"), 1, 0)) -> 0 | C652: =IF(AND(EQUAL(RC[-2], "C"), EQUAL(R[+1]C[-2], "G"))=1, 1, 0) -> 0 | D652: =SUM(RC[-2]:R[+49]C[-2])*2 -> 66 | E652: =SUM(RC[-2]:R[+49]C[-2])*2 -> 6 | F652: =IF(AND(EQUAL(RC[-5], "G"), EQUAL(R[+1]C[-5], "A"), EQUAL(R[+2]C[-5], "T"), EQUAL(R[+3]C[-5], "C"))=1, 1, 0) -> 0
A653: 'G | B653: =IF(EQUAL(RC[-1], "G"), 1, IF(EQUAL(RC[-1], "C"), 1, 0)) -> 1 | C653: =IF(AND(EQUAL(RC[-2], "C"), EQUAL(R[+1]C[-2], "G"))=1, 1, 0) -> 0 | D653: =SUM(RC[-2]:R[+49]C[-2])*2 -> 68 | E653: =SUM(RC[-2]:R[+49]C[-2])*2 -> 6 | F653: =IF(AND(EQUAL(RC[-5], "G"), EQUAL(R[+1]C[-5], "A"), EQUAL(R[+2]C[-5], "T"), EQUAL(R[+3]C[-5], "C"))=1, 1, 0) -> 0
A654: 'A | B654: =IF(EQUAL(RC[-1], "G"), 1, IF(EQUAL(RC[-1], "C"), 1, 0)) -> 0 | C654: =IF(AND(EQUAL(RC[-2], "C"), EQUAL(R[+1]C[-2], "G"))=1, 1, 0) -> 0 | D654: =SUM(RC[-2]:R[+49]C[-2])*2 -> 68 | E654: =SUM(RC[-2]:R[+49]C[-2])*2 -> 6 | F654: =IF(AND(EQUAL(RC[-5], "G"), EQUAL(R[+1]C[-5], "A"), EQUAL(R[+2]C[-5], "T"), EQUAL(R[+3]C[-5], "C"))=1, 1, 0) -> 0
A655: 'G | B655: =IF(EQUAL(RC[-1], "G"), 1, IF(EQUAL(RC[-1], "C"), 1, 0)) -> 1 | C655: =IF(AND(EQUAL(RC[-2], "C"), EQUAL(R[+1]C[-2], "G"))=1, 1, 0) -> 0 | D655: =SUM(RC[-2]:R[+49]C[-2])*2 -> 68 | E655: =SUM(RC[-2]:R[+49]C[-2])*2 -> 6 | F655: =IF(AND(EQUAL(RC[-5], "G"), EQUAL(R[+1]C[-5], "A"), EQUAL(R[+2]C[-5], "T"), EQUAL(R[+3]C[-5], "C"))=1, 1, 0) -> 0
A656: 'T | B656: =IF(EQUAL(RC[-1], "G"), 1, IF(EQUAL(RC[-1], "C"), 1, 0)) -> 0 | C656: =IF(AND(EQUAL(RC[-2], "C"), EQUAL(R[+1]C[-2], "G"))=1, 1, 0) -> 0 | D656: =SUM(RC[-2]:R[+49]C[-2])*2 -> 66 | E656: =SUM(RC[-2]:R[+49]C[-2])*2 -> 6 | F656: =IF(AND(EQUAL(RC[-5], "G"), EQUAL(R[+1]C[-5], "A"), EQUAL(R[+2]C[-5], "T"), EQUAL(R[+3]C[-5], "C"))=1, 1, 0) -> 0
A657: 'C | B657: =IF(EQUAL(RC[-1], "G"), 1, IF(EQUAL(RC[-1], "C"), 1, 0)) -> 1 | C657: =IF(AND(EQUAL(RC[-2], "C"), EQUAL(R[+1]C[-2], "G"))=1, 1, 0) -> 0 | D657: =SUM(RC[-2]:R[+49]C[-2])*2 -> 68 | E657: =SUM(RC[-2]:R[+49]C[-2])*2 -> 6 | F657: =IF(AND(EQUAL(RC[-5], "G"), EQUAL(R[+1]C[-5], "A"), EQUAL(R[+2]C[-5], "T"), EQUAL(R[+3]C[-5], "C"))=1, 1, 0) -> 0
A658: 'C | B658: =IF(EQUAL(RC[-1], "G"), 1, IF(EQUAL(RC[-1], "C"), 1, 0)) -> 1 | C658: =IF(AND(EQUAL(RC[-2], "C"), EQUAL(R[+1]C[-2], "G"))=1, 1, 0) -> 0 | D658: =SUM(RC[-2]:R[+49]C[-2])*2 -> 66 | E658: =SUM(RC[-2]:R[+49]C[-2])*2 -> 6 | F658: =IF(AND(EQUAL(RC[-5], "G"), EQUAL(R[+1]C[-5], "A"), EQUAL(R[+2]C[-5], "T"), EQUAL(R[+3]C[-5], "C"))=1, 1, 0) -> 0
A659: 'A | B659: =IF(EQUAL(RC[-1], "G"), 1, IF(EQUAL(RC[-1], "C"), 1, 0)) -> 0 | C659: =IF(AND(EQUAL(RC[-2], "C"), EQUAL(R[+1]C[-2], "G"))=1, 1, 0) -> 0 | D659: =SUM(RC[-2]:R[+49]C[-2])*2 -> 66 | E659: =SUM(RC[-2]:R[+49]C[-2])*2 -> 6 | F659: =IF(AND(EQUAL(RC[-5], "G"), EQUAL(R[+1]C[-5], "A"), EQUAL(R[+2]C[-5], "T"), EQUAL(R[+3]C[-5], "C"))=1, 1, 0) -> 0
A660: 'G | B660: =IF(EQUAL(RC[-1], "G"), 1, IF(EQUAL(RC[-1], "C"), 1, 0)) -> 1 | C660: =IF(AND(EQUAL(RC[-2], "C"), EQUAL(R[+1]C[-2], "G"))=1, 1, 0) -> 0 | D660: =SUM(RC[-2]:R[+49]C[-2])*2 -> 68 | E660: =SUM(RC[-2]:R[+49]C[-2])*2 -> 6 | F660: =IF(AND(EQUAL(RC[-5], "G"), EQUAL(R[+1]C[-5], "A"), EQUAL(R[+2]C[-5], "T"), EQUAL(R[+3]C[-5], "C"))=1, 1, 0) -> 0
A661: 'G | B661: =IF(EQUAL(RC[-1], "G"), 1, IF(EQUAL(RC[-1], "C"), 1, 0)) -> 1 | C661: =IF(AND(EQUAL(RC[-2], "C"), EQUAL(R[+1]C[-2], "G"))=1, 1, 0) -> 0 | D661: =SUM(RC[-2]:R[+49]C[-2])*2 -> 68 | E661: =SUM(RC[-2]:R[+49]C[-2])*2 -> 6 | F661: =IF(AND(EQUAL(RC[-5], "G"), EQUAL(R[+1]C[-5], "A"), EQUAL(R[+2]C[-5], "T"), EQUAL(R[+3]C[-5], "C"))=1, 1, 0) -> 0
A662: 'A | B662: =IF(EQUAL(RC[-1], "G"), 1, IF(EQUAL(RC[-1], "C"), 1, 0)) -> 0 | C662: =IF(AND(EQUAL(RC[-2], "C"), EQUAL(R[+1]C[-2], "G"))=1, 1, 0) -> 0 | D662: =SUM(RC[-2]:R[+49]C[-2])*2 -> 68 | E662: =SUM(RC[-2]:R[+49]C[-2])*2 -> 6 | F662: =IF(AND(EQUAL(RC[-5], "G"), EQUAL(R[+1]C[-5], "A"), EQUAL(R[+2]C[-5], "T"), EQUAL(R[+3]C[-5], "C"))=1, 1, 0) -> 0
A663: 'A | B663: =IF(EQUAL(RC[-1], "G"), 1, IF(EQUAL(RC[-1], "C"), 1, 0)) -> 0 | C663: =IF(AND(EQUAL(RC[-2], "C"), EQUAL(R[+1]C[-2], "G"))=1, 1, 0) -> 0 | D663: =SUM(RC[-2]:R[+49]C[-2])*2 -> 70 | E663: =SUM(RC[-2]:R[+49]C[-2])*2 -> 6 | F663: =IF(AND(EQUAL(RC[-5], "G"), EQUAL(R[+1]C[-5], "A"), EQUAL(R[+2]C[-5], "T"), EQUAL(R[+3]C[-5], "C"))=1, 1, 0) -> 0
A664: 'C | B664: =IF(EQUAL(RC[-1], "G"), 1, IF(EQUAL(RC[-1], "C"), 1, 0)) -> 1 | C664: =IF(AND(EQUAL(RC[-2], "C"), EQUAL(R[+1]C[-2], "G"))=1, 1, 0) -> 0 | D664: =SUM(RC[-2]:R[+49]C[-2])*2 -> 70 | E664: =SUM(RC[-2]:R[+49]C[-2])*2 -> 6 | F664: =IF(AND(EQUAL(RC[-5], "G"), EQUAL(R[+1]C[-5], "A"), EQUAL(R[+2]C[-5], "T"), EQUAL(R[+3]C[-5], "C"))=1, 1, 0) -> 0
A665: 'T | B665: =IF(EQUAL(RC[-1], "G"), 1, IF(EQUAL(RC[-1], "C"), 1, 0)) -> 0 | C665: =IF(AND(EQUAL(RC[-2], "C"), EQUAL(R[+1]C[-2], "G"))=1, 1, 0) -> 0 | D665: =SUM(RC[-2]:R[+49]C[-2])*2 -> 70 | E665: =SUM(RC[-2]:R[+49]C[-2])*2 -> 6 | F665: =IF(AND(EQUAL(RC[-5], "G"), EQUAL(R[+1]C[-5], "A"), EQUAL(R[+2]C[-5], "T"), EQUAL(R[+3]C[-5], "C"))=1, 1, 0) -> 0
A666: 'G | B666: =IF(EQUAL(RC[-1], "G"), 1, IF(EQUAL(RC[-1], "C"), 1, 0)) -> 1 | C666: =IF(AND(EQUAL(RC[-2], "C"), EQUAL(R[+1]C[-2], "G"))=1, 1, 0) -> 0 | D666: =SUM(RC[-2]:R[+49]C[-2])*2 -> 72 | E666: =SUM(RC[-2]:R[+49]C[-2])*2 -> 8 | F666: =IF(AND(EQUAL(RC[-5], "G"), EQUAL(R[+1]C[-5], "A"), EQUAL(R[+2]C[-5], "T"), EQUAL(R[+3]C[-5], "C"))=1, 1, 0) -> 0
A667: 'C | B667: =IF(EQUAL(RC[-1], "G"), 1, IF(EQUAL(RC[-1], "C"), 1, 0)) -> 1 | C667: =IF(AND(EQUAL(RC[-2], "C"), EQUAL(R[+1]C[-2], "G"))=1, 1, 0) -> 0 | D667: =SUM(RC[-2]:R[+49]C[-2])*2 -> 72 | E667: =SUM(RC[-2]:R[+49]C[-2])*2 -> 8 | F667: =IF(AND(EQUAL(RC[-5], "G"), EQUAL(R[+1]C[-5], "A"), EQUAL(R[+2]C[-5], "T"), EQUAL(R[+3]C[-5], "C"))=1, 1, 0) -> 0
A668: 'C | B668: =IF(EQUAL(RC[-1], "G"), 1, IF(EQUAL(RC[-1], "C"), 1, 0)) -> 1 | C668: =IF(AND(EQUAL(RC[-2], "C"), EQUAL(R[+1]C[-2], "G"))=1, 1, 0) -> 0 | D668: =SUM(RC[-2]:R[+49]C[-2])*2 -> 70 | E668: =SUM(RC[-2]:R[+49]C[-2])*2 -> 8 | F668: =IF(AND(EQUAL(RC[-5], "G"), EQUAL(R[+1]C[-5], "A"), EQUAL(R[+2]C[-5], "T"), EQUAL(R[+3]C[-5], "C"))=1, 1, 0) -> 0
A669: 'T | B669: =IF(EQUAL(RC[-1], "G"), 1, IF(EQUAL(RC[-1], "C"), 1, 0)) -> 0 | C669: =IF(AND(EQUAL(RC[-2], "C"), EQUAL(R[+1]C[-2], "G"))=1, 1, 0) -> 0 | D669: =SUM(RC[-2]:R[+49]C[-2])*2 -> 70 | E669: =SUM(RC[-2]:R[+49]C[-2])*2 -> 8 | F669: =IF(AND(EQUAL(RC[-5], "G"), EQUAL(R[+1]C[-5], "A"), EQUAL(R[+2]C[-5], "T"), EQUAL(R[+3]C[-5], "C"))=1, 1, 0) -> 0
A670: 'G | B670: =IF(EQUAL(RC[-1], "G"), 1, IF(EQUAL(RC[-1], "C"), 1, 0)) -> 1 | C670: =IF(AND(EQUAL(RC[-2], "C"), EQUAL(R[+1]C[-2], "G"))=1, 1, 0) -> 0 | D670: =SUM(RC[-2]:R[+49]C[-2])*2 -> 72 | E670: =SUM(RC[-2]:R[+49]C[-2])*2 -> 8 | F670: =IF(AND(EQUAL(RC[-5], "G"), EQUAL(R[+1]C[-5], "A"), EQUAL(R[+2]C[-5], "T"), EQUAL(R[+3]C[-5], "C"))=1, 1, 0) -> 0
A671: 'T | B671: =IF(EQUAL(RC[-1], "G"), 1, IF(EQUAL(RC[-1], "C"), 1, 0)) -> 0 | C671: =IF(AND(EQUAL(RC[-2], "C"), EQUAL(R[+1]C[-2], "G"))=1, 1, 0) -> 0 | D671: =SUM(RC[-2]:R[+49]C[-2])*2 -> 70 | E671: =SUM(RC[-2]:R[+49]C[-2])*2 -> 8 | F671: =IF(AND(EQUAL(RC[-5], "G"), EQUAL(R[+1]C[-5], "A"), EQUAL(R[+2]C[-5], "T"), EQUAL(R[+3]C[-5], "C"))=1, 1, 0) -> 0
A672: 'G | B672: =IF(EQUAL(RC[-1], "G"), 1, IF(EQUAL(RC[-1], "C"), 1, 0)) -> 1 | C672: =IF(AND(EQUAL(RC[-2], "C"), EQUAL(R[+1]C[-2], "G"))=1, 1, 0) -> 0 | D672: =SUM(RC[-2]:R[+49]C[-2])*2 -> 72 | E672: =SUM(RC[-2]:R[+49]C[-2])*2 -> 8 | F672: =IF(AND(EQUAL(RC[-5], "G"), EQUAL(R[+1]C[-5], "A"), EQUAL(R[+2]C[-5], "T"), EQUAL(R[+3]C[-5], "C"))=1, 1, 0) -> 0
A673: 'G | B673: =IF(EQUAL(RC[-1], "G"), 1, IF(EQUAL(RC[-1], "C"), 1, 0)) -> 1 | C673: =IF(AND(EQUAL(RC[-2], "C"), EQUAL(R[+1]C[-2], "G"))=1, 1, 0) -> 0 | D673: =SUM(RC[-2]:R[+49]C[-2])*2 -> 72 | E673: =SUM(RC[-2]:R[+49]C[-2])*2 -> 8 | F673: =IF(AND(EQUAL(RC[-5], "G"), EQUAL(R[+1]C[-5], "A"), EQUAL(R[+2]C[-5], "T"), EQUAL(R[+3]C[-5], "C"))=1, 1, 0) -> 0
A674: 'A | B674: =IF(EQUAL(RC[-1], "G"), 1, IF(EQUAL(RC[-1], "C"), 1, 0)) -> 0 | C674: =IF(AND(EQUAL(RC[-2], "C"), EQUAL(R[+1]C[-2], "G"))=1, 1, 0) -> 0 | D674: =SUM(RC[-2]:R[+49]C[-2])*2 -> 72 | E674: =SUM(RC[-2]:R[+49]C[-2])*2 -> 8 | F674: =IF(AND(EQUAL(RC[-5], "G"), EQUAL(R[+1]C[-5], "A"), EQUAL(R[+2]C[-5], "T"), EQUAL(R[+3]C[-5], "C"))=1, 1, 0) -> 0
A675: 'G | B675: =IF(EQUAL(RC[-1], "G"), 1, IF(EQUAL(RC[-1], "C"), 1, 0)) -> 1 | C675: =IF(AND(EQUAL(RC[-2], "C"), EQUAL(R[+1]C[-2], "G"))=1, 1, 0) -> 0 | D675: =SUM(RC[-2]:R[+49]C[-2])*2 -> 74 | E675: =SUM(RC[-2]:R[+49]C[-2])*2 -> 10 | F675: =IF(AND(EQUAL(RC[-5], "G"), EQUAL(R[+1]C[-5], "A"), EQUAL(R[+2]C[-5], "T"), EQUAL(R[+3]C[-5], "C"))=1, 1, 0) -> 0
A676: 'G | B676: =IF(EQUAL(RC[-1], "G"), 1, IF(EQUAL(RC[-1], "C"), 1, 0)) -> 1 | C676: =IF(AND(EQUAL(RC[-2], "C"), EQUAL(R[+1]C[-2], "G"))=1, 1, 0) -> 0 | D676: =SUM(RC[-2]:R[+49]C[-2])*2 -> 74 | E676: =SUM(RC[-2]:R[+49]C[-2])*2 -> 10 | F676: =IF(AND(EQUAL(RC[-5], "G"), EQUAL(R[+1]C[-5], "A"), EQUAL(R[+2]C[-5], "T"), EQUAL(R[+3]C[-5], "C"))=1, 1, 0) -> 0
A677: 'C | B677: =IF(EQUAL(RC[-1], "G"), 1, IF(EQUAL(RC[-1], "C"), 1, 0)) -> 1 | C677: =IF(AND(EQUAL(RC[-2], "C"), EQUAL(R[+1]C[-2], "G"))=1, 1, 0) -> 0 | D677: =SUM(RC[-2]:R[+49]C[-2])*2 -> 74 | E677: =SUM(RC[-2]:R[+49]C[-2])*2 -> 10 | F677: =IF(AND(EQUAL(RC[-5], "G"), EQUAL(R[+1]C[-5], "A"), EQUAL(R[+2]C[-5], "T"), EQUAL(R[+3]C[-5], "C"))=1, 1, 0) -> 0
A678: 'T | B678: =IF(EQUAL(RC[-1], "G"), 1, IF(EQUAL(RC[-1], "C"), 1, 0)) -> 0 | C678: =IF(AND(EQUAL(RC[-2], "C"), EQUAL(R[+1]C[-2], "G"))=1, 1, 0) -> 0 | D678: =SUM(RC[-2]:R[+49]C[-2])*2 -> 72 | E678: =SUM(RC[-2]:R[+49]C[-2])*2 -> 10 | F678: =IF(AND(EQUAL(RC[-5], "G"), EQUAL(R[+1]C[-5], "A"), EQUAL(R[+2]C[-5], "T"), EQUAL(R[+3]C[-5], "C"))=1, 1, 0) -> 0
A679: 'C | B679: =IF(EQUAL(RC[-1], "G"), 1, IF(EQUAL(RC[-1], "C"), 1, 0)) -> 1 | C679: =IF(AND(EQUAL(RC[-2], "C"), EQUAL(R[+1]C[-2], "G"))=1, 1, 0) -> 0 | D679: =SUM(RC[-2]:R[+49]C[-2])*2 -> 74 | E679: =SUM(RC[-2]:R[+49]C[-2])*2 -> 10 | F679: =IF(AND(EQUAL(RC[-5], "G"), EQUAL(R[+1]C[-5], "A"), EQUAL(R[+2]C[-5], "T"), EQUAL(R[+3]C[-5], "C"))=1, 1, 0) -> 0
A680: 'C | B680: =IF(EQUAL(RC[-1], "G"), 1, IF(EQUAL(RC[-1], "C"), 1, 0)) -> 1 | C680: =IF(AND(EQUAL(RC[-2], "C"), EQUAL(R[+1]C[-2], "G"))=1, 1, 0) -> 0 | D680: =SUM(RC[-2]:R[+49]C[-2])*2 -> 74 | E680: =SUM(RC[-2]:R[+49]C[-2])*2 -> 12 | F680: =IF(AND(EQUAL(RC[-5], "G"), EQUAL(R[+1]C[-5], "A"), EQUAL(R[+2]C[-5], "T"), EQUAL(R[+3]C[-5], "C"))=1, 1, 0) -> 0
A681: 'T | B681: =IF(EQUAL(RC[-1], "G"), 1, IF(EQUAL(RC[-1], "C"), 1, 0)) -> 0 | C681: =IF(AND(EQUAL(RC[-2], "C"), EQUAL(R[+1]C[-2], "G"))=1, 1, 0) -> 0 | D681: =SUM(RC[-2]:R[+49]C[-2])*2 -> 74 | E681: =SUM(RC[-2]:R[+49]C[-2])*2 -> 12 | F681: =IF(AND(EQUAL(RC[-5], "G"), EQUAL(R[+1]C[-5], "A"), EQUAL(R[+2]C[-5], "T"), EQUAL(R[+3]C[-5], "C"))=1, 1, 0) -> 0
A682: 'G | B682: =IF(EQUAL(RC[-1], "G"), 1, IF(EQUAL(RC[-1], "C"), 1, 0)) -> 1 | C682: =IF(AND(EQUAL(RC[-2], "C"), EQUAL(R[+1]C[-2], "G"))=1, 1, 0) -> 0 | D682: =SUM(RC[-2]:R[+49]C[-2])*2 -> 74 | E682: =SUM(RC[-2]:R[+49]C[-2])*2 -> 12 | F682: =IF(AND(EQUAL(RC[-5], "G"), EQUAL(R[+1]C[-5], "A"), EQUAL(R[+2]C[-5], "T"), EQUAL(R[+3]C[-5], "C"))=1, 1, 0) -> 0
A683: 'G | B683: =IF(EQUAL(RC[-1], "G"), 1, IF(EQUAL(RC[-1], "C"), 1, 0)) -> 1 | C683: =IF(AND(EQUAL(RC[-2], "C"), EQUAL(R[+1]C[-2], "G"))=1, 1, 0) -> 0 | D683: =SUM(RC[-2]:R[+49]C[-2])*2 -> 74 | E683: =SUM(RC[-2]:R[+49]C[-2])*2 -> 12 | F683: =IF(AND(EQUAL(RC[-5], "G"), EQUAL(R[+1]C[-5], "A"), EQUAL(R[+2]C[-5], "T"), EQUAL(R[+3]C[-5], "C"))=1, 1, 0) -> 0
A684: 'G | B684: =IF(EQUAL(RC[-1], "G"), 1, IF(EQUAL(RC[-1], "C"), 1, 0)) -> 1 | C684: =IF(AND(EQUAL(RC[-2], "C"), EQUAL(R[+1]C[-2], "G"))=1, 1, 0) -> 0 | D684: =SUM(RC[-2]:R[+49]C[-2])*2 -> 74 | E684: =SUM(RC[-2]:R[+49]C[-2])*2 -> 12 | F684: =IF(AND(EQUAL(RC[-5], "G"), EQUAL(R[+1]C[-5], "A"), EQUAL(R[+2]C[-5], "T"), EQUAL(R[+3]C[-5], "C"))=1, 1, 0) -> 0
A685: 'A | B685: =IF(EQUAL(RC[-1], "G"), 1, IF(EQUAL(RC[-1], "C"), 1, 0)) -> 0 | C685: =IF(AND(EQUAL(RC[-2], "C"), EQUAL(R[+1]C[-2], "G"))=1, 1, 0) -> 0 | D685: =SUM(RC[-2]:R[+49]C[-2])*2 -> 74 | E685: =SUM(RC[-2]:R[+49]C[-2])*2 -> 12 | F685: =IF(AND(EQUAL(RC[-5], "G"), EQUAL(R[+1]C[-5], "A"), EQUAL(R[+2]C[-5], "T"), EQUAL(R[+3]C[-5], "C"))=1, 1, 0) -> 0
A686: 'G | B686: =IF(EQUAL(RC[-1], "G"), 1, IF(EQUAL(RC[-1], "C"), 1, 0)) -> 1 | C686: =IF(AND(EQUAL(RC[-2], "C"), EQUAL(R[+1]C[-2], "G"))=1, 1, 0) -> 0 | D686: =SUM(RC[-2]:R[+49]C[-2])*2 -> 76 | E686: =SUM(RC[-2]:R[+49]C[-2])*2 -> 12 | F686: =IF(AND(EQUAL(RC[-5], "G"), EQUAL(R[+1]C[-5], "A"), EQUAL(R[+2]C[-5], "T"), EQUAL(R[+3]C[-5], "C"))=1, 1, 0) -> 0
A687: 'A | B687: =IF(EQUAL(RC[-1], "G"), 1, IF(EQUAL(RC[-1], "C"), 1, 0)) -> 0 | C687: =IF(AND(EQUAL(RC[-2], "C"), EQUAL(R[+1]C[-2], "G"))=1, 1, 0) -> 0 | D687: =SUM(RC[-2]:R[+49]C[-2])*2 -> 76 | E687: =SUM(RC[-2]:R[+49]C[-2])*2 -> 12 | F687: =IF(AND(EQUAL(RC[-5], "G"), EQUAL(R[+1]C[-5], "A"), EQUAL(R[+2]C[-5], "T"), EQUAL(R[+3]C[-5], "C"))=1, 1, 0) -> 0
A688: 'A | B688: =IF(EQUAL(RC[-1], "G"), 1, IF(EQUAL(RC[-1], "C"), 1, 0)) -> 0 | C688: =IF(AND(EQUAL(RC[-2], "C"), EQUAL(R[+1]C[-2], "G"))=1, 1, 0) -> 0 | D688: =SUM(RC[-2]:R[+49]C[-2])*2 -> 78 | E688: =SUM(RC[-2]:R[+49]C[-2])*2 -> 14 | F688: =IF(AND(EQUAL(RC[-5], "G"), EQUAL(R[+1]C[-5], "A"), EQUAL(R[+2]C[-5], "T"), EQUAL(R[+3]C[-5], "C"))=1, 1, 0) -> 0
A689: 'C | B689: =IF(EQUAL(RC[-1], "G"), 1, IF(EQUAL(RC[-1], "C"), 1, 0)) -> 1 | C689: =IF(AND(EQUAL(RC[-2], "C"), EQUAL(R[+1]C[-2], "G"))=1, 1, 0) -> 1 | D689: =SUM(RC[-2]:R[+49]C[-2])*2 -> 80 | E689: =SUM(RC[-2]:R[+49]C[-2])*2 -> 14 | F689: =IF(AND(EQUAL(RC[-5], "G"), EQUAL(R[+1]C[-5], "A"), EQUAL(R[+2]C[-5], "T"), EQUAL(R[+3]C[-5], "C"))=1, 1, 0) -> 0
A690: 'G | B690: =IF(EQUAL(RC[-1], "G"), 1, IF(EQUAL(RC[-1], "C"), 1, 0)) -> 1 | C690: =IF(AND(EQUAL(RC[-2], "C"), EQUAL(R[+1]C[-2], "G"))=1, 1, 0) -> 0 | D690: =SUM(RC[-2]:R[+49]C[-2])*2 -> 80 | E690: =SUM(RC[-2]:R[+49]C[-2])*2 -> 12 | F690: =IF(AND(EQUAL(RC[-5], "G"), EQUAL(R[+1]C[-5], "A"), EQUAL(R[+2]C[-5], "T"), EQUAL(R[+3]C[-5], "C"))=1, 1, 0) -> 0
A691: 'C | B691: =IF(EQUAL(RC[-1], "G"), 1, IF(EQUAL(RC[-1], "C"), 1, 0)) -> 1 | C691: =IF(AND(EQUAL(RC[-2], "C"), EQUAL(R[+1]C[-2], "G"))=1, 1, 0) -> 0 | D691: =SUM(RC[-2]:R[+49]C[-2])*2 -> 78 | E691: =SUM(RC[-2]:R[+49]C[-2])*2 -> 12 | F691: =IF(AND(EQUAL(RC[-5], "G"), EQUAL(R[+1]C[-5], "A"), EQUAL(R[+2]C[-5], "T"), EQUAL(R[+3]C[-5], "C"))=1, 1, 0) -> 0
A692: 'C | B692: =IF(EQUAL(RC[-1], "G"), 1, IF(EQUAL(RC[-1], "C"), 1, 0)) -> 1 | C692: =IF(AND(EQUAL(RC[-2], "C"), EQUAL(R[+1]C[-2], "G"))=1, 1, 0) -> 1 | D692: =SUM(RC[-2]:R[+49]C[-2])*2 -> 78 | E692: =SUM(RC[-2]:R[+49]C[-2])*2 -> 12 | F692: =IF(AND(EQUAL(RC[-5], "G"), EQUAL(R[+1]C[-5], "A"), EQUAL(R[+2]C[-5], "T"), EQUAL(R[+3]C[-5], "C"))=1, 1, 0) -> 0
A693: 'G | B693: =IF(EQUAL(RC[-1], "G"), 1, IF(EQUAL(RC[-1], "C"), 1, 0)) -> 1 | C693: =IF(AND(EQUAL(RC[-2], "C"), EQUAL(R[+1]C[-2], "G"))=1, 1, 0) -> 0 | D693: =SUM(RC[-2]:R[+49]C[-2])*2 -> 78 | E693: =SUM(RC[-2]:R[+49]C[-2])*2 -> 12 | F693: =IF(AND(EQUAL(RC[-5], "G"), EQUAL(R[+1]C[-5], "A"), EQUAL(R[+2]C[-5], "T"), EQUAL(R[+3]C[-5], "C"))=1, 1, 0) -> 0
A694: 'G | B694: =IF(EQUAL(RC[-1], "G"), 1, IF(EQUAL(RC[-1], "C"), 1, 0)) -> 1 | C694: =IF(AND(EQUAL(RC[-2], "C"), EQUAL(R[+1]C[-2], "G"))=1, 1, 0) -> 0 | D694: =SUM(RC[-2]:R[+49]C[-2])*2 -> 78 | E694: =SUM(RC[-2]:R[+49]C[-2])*2 -> 12 | F694: =IF(AND(EQUAL(RC[-5], "G"), EQUAL(R[+1]C[-5], "A"), EQUAL(R[+2]C[-5], "T"), EQUAL(R[+3]C[-5], "C"))=1, 1, 0) -> 0
A695: 'C | B695: =IF(EQUAL(RC[-1], "G"), 1, IF(EQUAL(RC[-1], "C"), 1, 0)) -> 1 | C695: =IF(AND(EQUAL(RC[-2], "C"), EQUAL(R[+1]C[-2], "G"))=1, 1, 0) -> 1 | D695: =SUM(RC[-2]:R[+49]C[-2])*2 -> 76 | E695: =SUM(RC[-2]:R[+49]C[-2])*2 -> 12 | F695: =IF(AND(EQUAL(RC[-5], "G"), EQUAL(R[+1]C[-5], "A"), EQUAL(R[+2]C[-5], "T"), EQUAL(R[+3]C[-5], "C"))=1, 1, 0) -> 0
A696: 'G | B696: =IF(EQUAL(RC[-1], "G"), 1, IF(EQUAL(RC[-1], "C"), 1, 0)) -> 1 | C696: =IF(AND(EQUAL(RC[-2], "C"), EQUAL(R[+1]C[-2], "G"))=1, 1, 0) -> 0 | D696: =SUM(RC[-2]:R[+49]C[-2])*2 -> 76 | E696: =SUM(RC[-2]:R[+49]C[-2])*2 -> 10 | F696: =IF(AND(EQUAL(RC[-5], "G"), EQUAL(R[+1]C[-5], "A"), EQUAL(R[+2]C[-5], "T"), EQUAL(R[+3]C[-5], "C"))=1, 1, 0) -> 0
A697: 'C | B697: =IF(EQUAL(RC[-1], "G"), 1, IF(EQUAL(RC[-1], "C"), 1, 0)) -> 1 | C697: =IF(AND(EQUAL(RC[-2], "C"), EQUAL(R[+1]C[-2], "G"))=1, 1, 0) -> 0 | D697: =SUM(RC[-2]:R[+49]C[-2])*2 -> 76 | E697: =SUM(RC[-2]:R[+49]C[-2])*2 -> 10 | F697: =IF(AND(EQUAL(RC[-5], "G"), EQUAL(R[+1]C[-5], "A"), EQUAL(R[+2]C[-5], "T"), EQUAL(R[+3]C[-5], "C"))=1, 1, 0) -> 0
A698: 'A | B698: =IF(EQUAL(RC[-1], "G"), 1, IF(EQUAL(RC[-1], "C"), 1, 0)) -> 0 | C698: =IF(AND(EQUAL(RC[-2], "C"), EQUAL(R[+1]C[-2], "G"))=1, 1, 0) -> 0 | D698: =SUM(RC[-2]:R[+49]C[-2])*2 -> 76 | E698: =SUM(RC[-2]:R[+49]C[-2])*2 -> 10 | F698: =IF(AND(EQUAL(RC[-5], "G"), EQUAL(R[+1]C[-5], "A"), EQUAL(R[+2]C[-5], "T"), EQUAL(R[+3]C[-5], "C"))=1, 1, 0) -> 0
A699: 'G | B699: =IF(EQUAL(RC[-1], "G"), 1, IF(EQUAL(RC[-1], "C"), 1, 0)) -> 1 | C699: =IF(AND(EQUAL(RC[-2], "C"), EQUAL(R[+1]C[-2], "G"))=1, 1, 0) -> 0 | D699: =SUM(RC[-2]:R[+49]C[-2])*2 -> 78 | E699: =SUM(RC[-2]:R[+49]C[-2])*2 -> 10 | F699: =IF(AND(EQUAL(RC[-5], "G"), EQUAL(R[+1]C[-5], "A"), EQUAL(R[+2]C[-5], "T"), EQUAL(R[+3]C[-5], "C"))=1, 1, 0) -> 0
A700: 'A | B700: =IF(EQUAL(RC[-1], "G"), 1, IF(EQUAL(RC[-1], "C"), 1, 0)) -> 0 | C700: =IF(AND(EQUAL(RC[-2], "C"), EQUAL(R[+1]C[-2], "G"))=1, 1, 0) -> 0 | D700: =SUM(RC[-2]:R[+49]C[-2])*2 -> 78 | E700: =SUM(RC[-2]:R[+49]C[-2])*2 -> 10 | F700: =IF(AND(EQUAL(RC[-5], "G"), EQUAL(R[+1]C[-5], "A"), EQUAL(R[+2]C[-5], "T"), EQUAL(R[+3]C[-5], "C"))=1, 1, 0) -> 0
A701: 'G | B701: =IF(EQUAL(RC[-1], "G"), 1, IF(EQUAL(RC[-1], "C"), 1, 0)) -> 1 | C701: =IF(AND(EQUAL(RC[-2], "C"), EQUAL(R[+1]C[-2], "G"))=1, 1, 0) -> 0 | D701: =SUM(RC[-2]:R[+49]C[-2])*2 -> 80 | E701: =SUM(RC[-2]:R[+49]C[-2])*2 -> 12 | F701: =IF(AND(EQUAL(RC[-5], "G"), EQUAL(R[+1]C[-5], "A"), EQUAL(R[+2]C[-5], "T"), EQUAL(R[+3]C[-5], "C"))=1, 1, 0) -> 0
A702: 'C | B702: =IF(EQUAL(RC[-1], "G"), 1, IF(EQUAL(RC[-1], "C"), 1, 0)) -> 1 | C702: =IF(AND(EQUAL(RC[-2], "C"), EQUAL(R[+1]C[-2], "G"))=1, 1, 0) -> 0 | D702: =SUM(RC[-2]:R[+49]C[-2])*2 -> 80 | E702: =SUM(RC[-2]:R[+49]C[-2])*2 -> 12 | F702: =IF(AND(EQUAL(RC[-5], "G"), EQUAL(R[+1]C[-5], "A"), EQUAL(R[+2]C[-5], "T"), EQUAL(R[+3]C[-5], "C"))=1, 1, 0) -> 0
A703: 'C | B703: =IF(EQUAL(RC[-1], "G"), 1, IF(EQUAL(RC[-1], "C"), 1, 0)) -> 1 | C703: =IF(AND(EQUAL(RC[-2], "C"), EQUAL(R[+1]C[-2], "G"))=1, 1, 0) -> 0 | D703: =SUM(RC[-2]:R[+49]C[-2])*2 -> 80 | E703: =SUM(RC[-2]:R[+49]C[-2])*2 -> 12 | F703: =IF(AND(EQUAL(RC[-5], "G"), EQUAL(R[+1]C[-5], "A"), EQUAL(R[+2]C[-5], "T"), EQUAL(R[+3]C[-5], "C"))=1, 1, 0) -> 0
A704: 'T | B704: =IF(EQUAL(RC[-1], "G"), 1, IF(EQUAL(RC[-1], "C"), 1, 0)) -> 0 | C704: =IF(AND(EQUAL(RC[-2], "C"), EQUAL(R[+1]C[-2], "G"))=1, 1, 0) -> 0 | D704: =SUM(RC[-2]:R[+49]C[-2])*2 -> 78 | E704: =SUM(RC[-2]:R[+49]C[-2])*2 -> 12 | F704: =IF(AND(EQUAL(RC[-5], "G"), EQUAL(R[+1]C[-5], "A"), EQUAL(R[+2]C[-5], "T"), EQUAL(R[+3]C[-5], "C"))=1, 1, 0) -> 0
A705: 'T | B705: =IF(EQUAL(RC[-1], "G"), 1, IF(EQUAL(RC[-1], "C"), 1, 0)) -> 0 | C705: =IF(AND(EQUAL(RC[-2], "C"), EQUAL(R[+1]C[-2], "G"))=1, 1, 0) -> 0 | D705: =SUM(RC[-2]:R[+49]C[-2])*2 -> 80 | E705: =SUM(RC[-2]:R[+49]C[-2])*2 -> 12 | F705: =IF(AND(EQUAL(RC[-5], "G"), EQUAL(R[+1]C[-5], "A"), EQUAL(R[+2]C[-5], "T"), EQUAL(R[+3]C[-5], "C"))=1, 1, 0) -> 0
A706: 'C | B706: =IF(EQUAL(RC[-1], "G"), 1, IF(EQUAL(RC[-1], "C"), 1, 0)) -> 1 | C706: =IF(AND(EQUAL(RC[-2], "C"), EQUAL(R[+1]C[-2], "G"))=1, 1, 0) -> 0 | D706: =SUM(RC[-2]:R[+49]C[-2])*2 -> 82 | E706: =SUM(RC[-2]:R[+49]C[-2])*2 -> 14 | F706: =IF(AND(EQUAL(RC[-5], "G"), EQUAL(R[+1]C[-5], "A"), EQUAL(R[+2]C[-5], "T"), EQUAL(R[+3]C[-5], "C"))=1, 1, 0) -> 0
A707: 'A | B707: =IF(EQUAL(RC[-1], "G"), 1, IF(EQUAL(RC[-1], "C"), 1, 0)) -> 0 | C707: =IF(AND(EQUAL(RC[-2], "C"), EQUAL(R[+1]C[-2], "G"))=1, 1, 0) -> 0 | D707: =SUM(RC[-2]:R[+49]C[-2])*2 -> 82 | E707: =SUM(RC[-2]:R[+49]C[-2])*2 -> 14 | F707: =IF(AND(EQUAL(RC[-5], "G"), EQUAL(R[+1]C[-5], "A"), EQUAL(R[+2]C[-5], "T"), EQUAL(R[+3]C[-5], "C"))=1, 1, 0) -> 0
A708: 'G | B708: =IF(EQUAL(RC[-1], "G"), 1, IF(EQUAL(RC[-1], "C"), 1, 0)) -> 1 | C708: =IF(AND(EQUAL(RC[-2], "C"), EQUAL(R[+1]C[-2], "G"))=1, 1, 0) -> 0 | D708: =SUM(RC[-2]:R[+49]C[-2])*2 -> 82 | E708: =SUM(RC[-2]:R[+49]C[-2])*2 -> 14 | F708: =IF(AND(EQUAL(RC[-5], "G"), EQUAL(R[+1]C[-5], "A"), EQUAL(R[+2]C[-5], "T"), EQUAL(R[+3]C[-5], "C"))=1, 1, 0) -> 0
A709: 'G | B709: =IF(EQUAL(RC[-1], "G"), 1, IF(EQUAL(RC[-1], "C"), 1, 0)) -> 1 | C709: =IF(AND(EQUAL(RC[-2], "C"), EQUAL(R[+1]C[-2], "G"))=1, 1, 0) -> 0 | D709: =SUM(RC[-2]:R[+49]C[-2])*2 -> 82 | E709: =SUM(RC[-2]:R[+49]C[-2])*2 -> 14 | F709: =IF(AND(EQUAL(RC[-5], "G"), EQUAL(R[+1]C[-5], "A"), EQUAL(R[+2]C[-5], "T"), EQUAL(R[+3]C[-5], "C"))=1, 1, 0) -> 0
A710: 'G | B710: =IF(EQUAL(RC[-1], "G"), 1, IF(EQUAL(RC[-1], "C"), 1, 0)) -> 1 | C710: =IF(AND(EQUAL(RC[-2], "C"), EQUAL(R[+1]C[-2], "G"))=1, 1, 0) -> 0 | D710: =SUM(RC[-2]:R[+49]C[-2])*2 -> 82 | E710: =SUM(RC[-2]:R[+49]C[-2])*2 -> 14 | F710: =IF(AND(EQUAL(RC[-5], "G"), EQUAL(R[+1]C[-5], "A"), EQUAL(R[+2]C[-5], "T"), EQUAL(R[+3]C[-5], "C"))=1, 1, 0) -> 0
A711: 'G | B711: =IF(EQUAL(RC[-1], "G"), 1, IF(EQUAL(RC[-1], "C"), 1, 0)) -> 1 | C711: =IF(AND(EQUAL(RC[-2], "C"), EQUAL(R[+1]C[-2], "G"))=1, 1, 0) -> 0 | D711: =SUM(RC[-2]:R[+49]C[-2])*2 -> 82 | E711: =SUM(RC[-2]:R[+49]C[-2])*2 -> 14 | F711: =IF(AND(EQUAL(RC[-5], "G"), EQUAL(R[+1]C[-5], "A"), EQUAL(R[+2]C[-5], "T"), EQUAL(R[+3]C[-5], "C"))=1, 1, 0) -> 0
A712: 'G | B712: =IF(EQUAL(RC[-1], "G"), 1, IF(EQUAL(RC[-1], "C"), 1, 0)) -> 1 | C712: =IF(AND(EQUAL(RC[-2], "C"), EQUAL(R[+1]C[-2], "G"))=1, 1, 0) -> 0 | D712: =SUM(RC[-2]:R[+49]C[-2])*2 -> 82 | E712: =SUM(RC[-2]:R[+49]C[-2])*2 -> 14 | F712: =IF(AND(EQUAL(RC[-5], "G"), EQUAL(R[+1]C[-5], "A"), EQUAL(R[+2]C[-5], "T"), EQUAL(R[+3]C[-5], "C"))=1, 1, 0) -> 0
A713: 'A | B713: =IF(EQUAL(RC[-1], "G"), 1, IF(EQUAL(RC[-1], "C"), 1, 0)) -> 0 | C713: =IF(AND(EQUAL(RC[-2], "C"), EQUAL(R[+1]C[-2], "G"))=1, 1, 0) -> 0 | D713: =SUM(RC[-2]:R[+49]C[-2])*2 -> 82 | E713: =SUM(RC[-2]:R[+49]C[-2])*2 -> 16 | F713: =IF(AND(EQUAL(RC[-5], "G"), EQUAL(R[+1]C[-5], "A"), EQUAL(R[+2]C[-5], "T"), EQUAL(R[+3]C[-5], "C"))=1, 1, 0) -> 0
A714: 'C | B714: =IF(EQUAL(RC[-1], "G"), 1, IF(EQUAL(RC[-1], "C"), 1, 0)) -> 1 | C714: =IF(AND(EQUAL(RC[-2], "C"), EQUAL(R[+1]C[-2], "G"))=1, 1, 0) -> 0 | D714: =SUM(RC[-2]:R[+49]C[-2])*2 -> 84 | E714: =SUM(RC[-2]:R[+49]C[-2])*2 -> 16 | F714: =IF(AND(EQUAL(RC[-5], "G"), EQUAL(R[+1]C[-5], "A"), EQUAL(R[+2]C[-5], "T"), EQUAL(R[+3]C[-5], "C"))=1, 1, 0) -> 0
A715: 'C | B715: =IF(EQUAL(RC[-1], "G"), 1, IF(EQUAL(RC[-1], "C"), 1, 0)) -> 1 | C715: =IF(AND(EQUAL(RC[-2], "C"), EQUAL(R[+1]C[-2], "G"))=1, 1, 0) -> 1 | D715: =SUM(RC[-2]:R[+49]C[-2])*2 -> 84 | E715: =SUM(RC[-2]:R[+49]C[-2])*2 -> 16 | F715: =IF(AND(EQUAL(RC[-5], "G"), EQUAL(R[+1]C[-5], "A"), EQUAL(R[+2]C[-5], "T"), EQUAL(R[+3]C[-5], "C"))=1, 1, 0) -> 0
A716: 'G | B716: =IF(EQUAL(RC[-1], "G"), 1, IF(EQUAL(RC[-1], "C"), 1, 0)) -> 1 | C716: =IF(AND(EQUAL(RC[-2], "C"), EQUAL(R[+1]C[-2], "G"))=1, 1, 0) -> 0 | D716: =SUM(RC[-2]:R[+49]C[-2])*2 -> 82 | E716: =SUM(RC[-2]:R[+49]C[-2])*2 -> 14 | F716: =IF(AND(EQUAL(RC[-5], "G"), EQUAL(R[+1]C[-5], "A"), EQUAL(R[+2]C[-5], "T"), EQUAL(R[+3]C[-5], "C"))=1, 1, 0) -> 0
A717: 'A | B717: =IF(EQUAL(RC[-1], "G"), 1, IF(EQUAL(RC[-1], "C"), 1, 0)) -> 0 | C717: =IF(AND(EQUAL(RC[-2], "C"), EQUAL(R[+1]C[-2], "G"))=1, 1, 0) -> 0 | D717: =SUM(RC[-2]:R[+49]C[-2])*2 -> 82 | E717: =SUM(RC[-2]:R[+49]C[-2])*2 -> 14 | F717: =IF(AND(EQUAL(RC[-5], "G"), EQUAL(R[+1]C[-5], "A"), EQUAL(R[+2]C[-5], "T"), EQUAL(R[+3]C[-5], "C"))=1, 1, 0) -> 0
A718: 'C | B718: =IF(EQUAL(RC[-1], "G"), 1, IF(EQUAL(RC[-1], "C"), 1, 0)) -> 1 | C718: =IF(AND(EQUAL(RC[-2], "C"), EQUAL(R[+1]C[-2], "G"))=1, 1, 0) -> 0 | D718: =SUM(RC[-2]:R[+49]C[-2])*2 -> 84 | E718: =SUM(RC[-2]:R[+49]C[-2])*2 -> 16 | F718: =IF(AND(EQUAL(RC[-5], "G"), EQUAL(R[+1]C[-5], "A"), EQUAL(R[+2]C[-5], "T"), EQUAL(R[+3]C[-5], "C"))=1, 1, 0) -> 0
A719: 'C | B719: =IF(EQUAL(RC[-1], "G"), 1, IF(EQUAL(RC[-1], "C"), 1, 0)) -> 1 | C719: =IF(AND(EQUAL(RC[-2], "C"), EQUAL(R[+1]C[-2], "G"))=1, 1, 0) -> 0 | D719: =SUM(RC[-2]:R[+49]C[-2])*2 -> 84 | E719: =SUM(RC[-2]:R[+49]C[-2])*2 -> 16 | F719: =IF(AND(EQUAL(RC[-5], "G"), EQUAL(R[+1]C[-5], "A"), EQUAL(R[+2]C[-5], "T"), EQUAL(R[+3]C[-5], "C"))=1, 1, 0) -> 0
A720: 'T | B720: =IF(EQUAL(RC[-1], "G"), 1, IF(EQUAL(RC[-1], "C"), 1, 0)) -> 0 | C720: =IF(AND(EQUAL(RC[-2], "C"), EQUAL(R[+1]C[-2], "G"))=1, 1, 0) -> 0 | D720: =SUM(RC[-2]:R[+49]C[-2])*2 -> 82 | E720: =SUM(RC[-2]:R[+49]C[-2])*2 -> 16 | F720: =IF(AND(EQUAL(RC[-5], "G"), EQUAL(R[+1]C[-5], "A"), EQUAL(R[+2]C[-5], "T"), EQUAL(R[+3]C[-5], "C"))=1, 1, 0) -> 0
A721: 'G | B721: =IF(EQUAL(RC[-1], "G"), 1, IF(EQUAL(RC[-1], "C"), 1, 0)) -> 1 | C721: =IF(AND(EQUAL(RC[-2], "C"), EQUAL(R[+1]C[-2], "G"))=1, 1, 0) -> 0 | D721: =SUM(RC[-2]:R[+49]C[-2])*2 -> 84 | E721: =SUM(RC[-2]:R[+49]C[-2])*2 -> 18 | F721: =IF(AND(EQUAL(RC[-5], "G"), EQUAL(R[+1]C[-5], "A"), EQUAL(R[+2]C[-5], "T"), EQUAL(R[+3]C[-5], "C"))=1, 1, 0) -> 0
A722: 'G | B722: =IF(EQUAL(RC[-1], "G"), 1, IF(EQUAL(RC[-1], "C"), 1, 0)) -> 1 | C722: =IF(AND(EQUAL(RC[-2], "C"), EQUAL(R[+1]C[-2], "G"))=1, 1, 0) -> 0 | D722: =SUM(RC[-2]:R[+49]C[-2])*2 -> 84 | E722: =SUM(RC[-2]:R[+49]C[-2])*2 -> 18 | F722: =IF(AND(EQUAL(RC[-5], "G"), EQUAL(R[+1]C[-5], "A"), EQUAL(R[+2]C[-5], "T"), EQUAL(R[+3]C[-5], "C"))=1, 1, 0) -> 0
A723: 'G | B723: =IF(EQUAL(RC[-1], "G"), 1, IF(EQUAL(RC[-1], "C"), 1, 0)) -> 1 | C723: =IF(AND(EQUAL(RC[-2], "C"), EQUAL(R[+1]C[-2], "G"))=1, 1, 0) -> 0 | D723: =SUM(RC[-2]:R[+49]C[-2])*2 -> 84 | E723: =SUM(RC[-2]:R[+49]C[-2])*2 -> 18 | F723: =IF(AND(EQUAL(RC[-5], "G"), EQUAL(R[+1]C[-5], "A"), EQUAL(R[+2]C[-5], "T"), EQUAL(R[+3]C[-5], "C"))=1, 1, 0) -> 0
A724: 'C | B724: =IF(EQUAL(RC[-1], "G"), 1, IF(EQUAL(RC[-1], "C"), 1, 0)) -> 1 | C724: =IF(AND(EQUAL(RC[-2], "C"), EQUAL(R[+1]C[-2], "G"))=1, 1, 0) -> 1 | D724: =SUM(RC[-2]:R[+49]C[-2])*2 -> 84 | E724: =SUM(RC[-2]:R[+49]C[-2])*2 -> 18 | F724: =IF(AND(EQUAL(RC[-5], "G"), EQUAL(R[+1]C[-5], "A"), EQUAL(R[+2]C[-5], "T"), EQUAL(R[+3]C[-5], "C"))=1, 1, 0) -> 0
A725: 'G | B725: =IF(EQUAL(RC[-1], "G"), 1, IF(EQUAL(RC[-1], "C"), 1, 0)) -> 1 | C725: =IF(AND(EQUAL(RC[-2], "C"), EQUAL(R[+1]C[-2], "G"))=1, 1, 0) -> 0 | D725: =SUM(RC[-2]:R[+49]C[-2])*2 -> 84 | E725: =SUM(RC[-2]:R[+49]C[-2])*2 -> 18 | F725: =IF(AND(EQUAL(RC[-5], "G"), EQUAL(R[+1]C[-5], "A"), EQUAL(R[+2]C[-5], "T"), EQUAL(R[+3]C[-5], "C"))=1, 1, 0) -> 0
A726: 'G | B726: =IF(EQUAL(RC[-1], "G"), 1, IF(EQUAL(RC[-1], "C"), 1, 0)) -> 1 | C726: =IF(AND(EQUAL(RC[-2], "C"), EQUAL(R[+1]C[-2], "G"))=1, 1, 0) -> 0 | D726: =SUM(RC[-2]:R[+49]C[-2])*2 -> 84 | E726: =SUM(RC[-2]:R[+49]C[-2])*2 -> 18 | F726: =IF(AND(EQUAL(RC[-5], "G"), EQUAL(R[+1]C[-5], "A"), EQUAL(R[+2]C[-5], "T"), EQUAL(R[+3]C[-5], "C"))=1, 1, 0) -> 0
A727: 'T | B727: =IF(EQUAL(RC[-1], "G"), 1, IF(EQUAL(RC[-1], "C"), 1, 0)) -> 0 | C727: =IF(AND(EQUAL(RC[-2], "C"), EQUAL(R[+1]C[-2], "G"))=1, 1, 0) -> 0 | D727: =SUM(RC[-2]:R[+49]C[-2])*2 -> 84 | E727: =SUM(RC[-2]:R[+49]C[-2])*2 -> 18 | F727: =IF(AND(EQUAL(RC[-5], "G"), EQUAL(R[+1]C[-5], "A"), EQUAL(R[+2]C[-5], "T"), EQUAL(R[+3]C[-5], "C"))=1, 1, 0) -> 0
A728: 'C | B728: =IF(EQUAL(RC[-1], "G"), 1, IF(EQUAL(RC[-1], "C"), 1, 0)) -> 1 | C728: =IF(AND(EQUAL(RC[-2], "C"), EQUAL(R[+1]C[-2], "G"))=1, 1, 0) -> 0 | D728: =SUM(RC[-2]:R[+49]C[-2])*2 -> 86 | E728: =SUM(RC[-2]:R[+49]C[-2])*2 -> 18 | F728: =IF(AND(EQUAL(RC[-5], "G"), EQUAL(R[+1]C[-5], "A"), EQUAL(R[+2]C[-5], "T"), EQUAL(R[+3]C[-5], "C"))=1, 1, 0) -> 0
A729: 'C | B729: =IF(EQUAL(RC[-1], "G"), 1, IF(EQUAL(RC[-1], "C"), 1, 0)) -> 1 | C729: =IF(AND(EQUAL(RC[-2], "C"), EQUAL(R[+1]C[-2], "G"))=1, 1, 0) -> 1 | D729: =SUM(RC[-2]:R[+49]C[-2])*2 -> 86 | E729: =SUM(RC[-2]:R[+49]C[-2])*2 -> 18 | F729: =IF(AND(EQUAL(RC[-5], "G"), EQUAL(R[+1]C[-5], "A"), EQUAL(R[+2]C[-5], "T"), EQUAL(R[+3]C[-5], "C"))=1, 1, 0) -> 0
A730: 'G | B730: =IF(EQUAL(RC[-1], "G"), 1, IF(EQUAL(RC[-1], "C"), 1, 0)) -> 1 | C730: =IF(AND(EQUAL(RC[-2], "C"), EQUAL(R[+1]C[-2], "G"))=1, 1, 0) -> 0 | D730: =SUM(RC[-2]:R[+49]C[-2])*2 -> 86 | E730: =SUM(RC[-2]:R[+49]C[-2])*2 -> 16 | F730: =IF(AND(EQUAL(RC[-5], "G"), EQUAL(R[+1]C[-5], "A"), EQUAL(R[+2]C[-5], "T"), EQUAL(R[+3]C[-5], "C"))=1, 1, 0) -> 0
A731: 'A | B731: =IF(EQUAL(RC[-1], "G"), 1, IF(EQUAL(RC[-1], "C"), 1, 0)) -> 0 | C731: =IF(AND(EQUAL(RC[-2], "C"), EQUAL(R[+1]C[-2], "G"))=1, 1, 0) -> 0 | D731: =SUM(RC[-2]:R[+49]C[-2])*2 -> 86 | E731: =SUM(RC[-2]:R[+49]C[-2])*2 -> 16 | F731: =IF(AND(EQUAL(RC[-5], "G"), EQUAL(R[+1]C[-5], "A"), EQUAL(R[+2]C[-5], "T"), EQUAL(R[+3]C[-5], "C"))=1, 1, 0) -> 0
A732: 'G | B732: =IF(EQUAL(RC[-1], "G"), 1, IF(EQUAL(RC[-1], "C"), 1, 0)) -> 1 | C732: =IF(AND(EQUAL(RC[-2], "C"), EQUAL(R[+1]C[-2], "G"))=1, 1, 0) -> 0 | D732: =SUM(RC[-2]:R[+49]C[-2])*2 -> 86 | E732: =SUM(RC[-2]:R[+49]C[-2])*2 -> 16 | F732: =IF(AND(EQUAL(RC[-5], "G"), EQUAL(R[+1]C[-5], "A"), EQUAL(R[+2]C[-5], "T"), EQUAL(R[+3]C[-5], "C"))=1, 1, 0) -> 0
A733: 'G | B733: =IF(EQUAL(RC[-1], "G"), 1, IF(EQUAL(RC[-1], "C"), 1, 0)) -> 1 | C733: =IF(AND(EQUAL(RC[-2], "C"), EQUAL(R[+1]C[-2], "G"))=1, 1, 0) -> 0 | D733: =SUM(RC[-2]:R[+49]C[-2])*2 -> 86 | E733: =SUM(RC[-2]:R[+49]C[-2])*2 -> 16 | F733: =IF(AND(EQUAL(RC[-5], "G"), EQUAL(R[+1]C[-5], "A"), EQUAL(R[+2]C[-5], "T"), EQUAL(R[+3]C[-5], "C"))=1, 1, 0) -> 0
A734: 'G | B734: =IF(EQUAL(RC[-1], "G"), 1, IF(EQUAL(RC[-1], "C"), 1, 0)) -> 1 | C734: =IF(AND(EQUAL(RC[-2], "C"), EQUAL(R[+1]C[-2], "G"))=1, 1, 0) -> 0 | D734: =SUM(RC[-2]:R[+49]C[-2])*2 -> 84 | E734: =SUM(RC[-2]:R[+49]C[-2])*2 -> 16 | F734: =IF(AND(EQUAL(RC[-5], "G"), EQUAL(R[+1]C[-5], "A"), EQUAL(R[+2]C[-5], "T"), EQUAL(R[+3]C[-5], "C"))=1, 1, 0) -> 0
A735: 'G | B735: =IF(EQUAL(RC[-1], "G"), 1, IF(EQUAL(RC[-1], "C"), 1, 0)) -> 1 | C735: =IF(AND(EQUAL(RC[-2], "C"), EQUAL(R[+1]C[-2], "G"))=1, 1, 0) -> 0 | D735: =SUM(RC[-2]:R[+49]C[-2])*2 -> 82 | E735: =SUM(RC[-2]:R[+49]C[-2])*2 -> 16 | F735: =IF(AND(EQUAL(RC[-5], "G"), EQUAL(R[+1]C[-5], "A"), EQUAL(R[+2]C[-5], "T"), EQUAL(R[+3]C[-5], "C"))=1, 1, 0) -> 0
A736: 'G | B736: =IF(EQUAL(RC[-1], "G"), 1, IF(EQUAL(RC[-1], "C"), 1, 0)) -> 1 | C736: =IF(AND(EQUAL(RC[-2], "C"), EQUAL(R[+1]C[-2], "G"))=1, 1, 0) -> 0 | D736: =SUM(RC[-2]:R[+49]C[-2])*2 -> 80 | E736: =SUM(RC[-2]:R[+49]C[-2])*2 -> 16 | F736: =IF(AND(EQUAL(RC[-5], "G"), EQUAL(R[+1]C[-5], "A"), EQUAL(R[+2]C[-5], "T"), EQUAL(R[+3]C[-5], "C"))=1, 1, 0) -> 0
A737: 'C | B737: =IF(EQUAL(RC[-1], "G"), 1, IF(EQUAL(RC[-1], "C"), 1, 0)) -> 1 | C737: =IF(AND(EQUAL(RC[-2], "C"), EQUAL(R[+1]C[-2], "G"))=1, 1, 0) -> 1 | D737: =SUM(RC[-2]:R[+49]C[-2])*2 -> 80 | E737: =SUM(RC[-2]:R[+49]C[-2])*2 -> 18 | F737: =IF(AND(EQUAL(RC[-5], "G"), EQUAL(R[+1]C[-5], "A"), EQUAL(R[+2]C[-5], "T"), EQUAL(R[+3]C[-5], "C"))=1, 1, 0) -> 0
A738: 'G | B738: =IF(EQUAL(RC[-1], "G"), 1, IF(EQUAL(RC[-1], "C"), 1, 0)) -> 1 | C738: =IF(AND(EQUAL(RC[-2], "C"), EQUAL(R[+1]C[-2], "G"))=1, 1, 0) -> 0 | D738: =SUM(RC[-2]:R[+49]C[-2])*2 -> 80 | E738: =SUM(RC[-2]:R[+49]C[-2])*2 -> 16 | F738: =IF(AND(EQUAL(RC[-5], "G"), EQUAL(R[+1]C[-5], "A"), EQUAL(R[+2]C[-5], "T"), EQUAL(R[+3]C[-5], "C"))=1, 1, 0) -> 0
A739: 'G | B739: =IF(EQUAL(RC[-1], "G"), 1, IF(EQUAL(RC[-1], "C"), 1, 0)) -> 1 | C739: =IF(AND(EQUAL(RC[-2], "C"), EQUAL(R[+1]C[-2], "G"))=1, 1, 0) -> 0 | D739: =SUM(RC[-2]:R[+49]C[-2])*2 -> 78 | E739: =SUM(RC[-2]:R[+49]C[-2])*2 -> 16 | F739: =IF(AND(EQUAL(RC[-5], "G"), EQUAL(R[+1]C[-5], "A"), EQUAL(R[+2]C[-5], "T"), EQUAL(R[+3]C[-5], "C"))=1, 1, 0) -> 0
A740: 'T | B740: =IF(EQUAL(RC[-1], "G"), 1, IF(EQUAL(RC[-1], "C"), 1, 0)) -> 0 | C740: =IF(AND(EQUAL(RC[-2], "C"), EQUAL(R[+1]C[-2], "G"))=1, 1, 0) -> 0 | D740: =SUM(RC[-2]:R[+49]C[-2])*2 -> 78 | E740: =SUM(RC[-2]:R[+49]C[-2])*2 -> 16 | F740: =IF(AND(EQUAL(RC[-5], "G"), EQUAL(R[+1]C[-5], "A"), EQUAL(R[+2]C[-5], "T"), EQUAL(R[+3]C[-5], "C"))=1, 1, 0) -> 0
A741: 'C | B741: =IF(EQUAL(RC[-1], "G"), 1, IF(EQUAL(RC[-1], "C"), 1, 0)) -> 1 | C741: =IF(AND(EQUAL(RC[-2], "C"), EQUAL(R[+1]C[-2], "G"))=1, 1, 0) -> 0 | D741: =SUM(RC[-2]:R[+49]C[-2])*2 -> 80 | E741: =SUM(RC[-2]:R[+49]C[-2])*2 -> 16 | F741: =IF(AND(EQUAL(RC[-5], "G"), EQUAL(R[+1]C[-5], "A"), EQUAL(R[+2]C[-5], "T"), EQUAL(R[+3]C[-5], "C"))=1, 1, 0) -> 0
A742: 'C | B742: =IF(EQUAL(RC[-1], "G"), 1, IF(EQUAL(RC[-1], "C"), 1, 0)) -> 1 | C742: =IF(AND(EQUAL(RC[-2], "C"), EQUAL(R[+1]C[-2], "G"))=1, 1, 0) -> 1 | D742: =SUM(RC[-2]:R[+49]C[-2])*2 -> 80 | E742: =SUM(RC[-2]:R[+49]C[-2])*2 -> 18 | F742: =IF(AND(EQUAL(RC[-5], "G"), EQUAL(R[+1]C[-5], "A"), EQUAL(R[+2]C[-5], "T"), EQUAL(R[+3]C[-5], "C"))=1, 1, 0) -> 0
A743: 'G | B743: =IF(EQUAL(RC[-1], "G"), 1, IF(EQUAL(RC[-1], "C"), 1, 0)) -> 1 | C743: =IF(AND(EQUAL(RC[-2], "C"), EQUAL(R[+1]C[-2], "G"))=1, 1, 0) -> 0 | D743: =SUM(RC[-2]:R[+49]C[-2])*2 -> 80 | E743: =SUM(RC[-2]:R[+49]C[-2])*2 -> 16 | F743: =IF(AND(EQUAL(RC[-5], "G"), EQUAL(R[+1]C[-5], "A"), EQUAL(R[+2]C[-5], "T"), EQUAL(R[+3]C[-5], "C"))=1, 1, 0) -> 0
A744: 'A | B744: =IF(EQUAL(RC[-1], "G"), 1, IF(EQUAL(RC[-1], "C"), 1, 0)) -> 0 | C744: =IF(AND(EQUAL(RC[-2], "C"), EQUAL(R[+1]C[-2], "G"))=1, 1, 0) -> 0 | D744: =SUM(RC[-2]:R[+49]C[-2])*2 -> 78 | E744: =SUM(RC[-2]:R[+49]C[-2])*2 -> 16 | F744: =IF(AND(EQUAL(RC[-5], "G"), EQUAL(R[+1]C[-5], "A"), EQUAL(R[+2]C[-5], "T"), EQUAL(R[+3]C[-5], "C"))=1, 1, 0) -> 0
A745: 'G | B745: =IF(EQUAL(RC[-1], "G"), 1, IF(EQUAL(RC[-1], "C"), 1, 0)) -> 1 | C745: =IF(AND(EQUAL(RC[-2], "C"), EQUAL(R[+1]C[-2], "G"))=1, 1, 0) -> 0 | D745: =SUM(RC[-2]:R[+49]C[-2])*2 -> 80 | E745: =SUM(RC[-2]:R[+49]C[-2])*2 -> 16 | F745: =IF(AND(EQUAL(RC[-5], "G"), EQUAL(R[+1]C[-5], "A"), EQUAL(R[+2]C[-5], "T"), EQUAL(R[+3]C[-5], "C"))=1, 1, 0) -> 0
A746: 'G | B746: =IF(EQUAL(RC[-1], "G"), 1, IF(EQUAL(RC[-1], "C"), 1, 0)) -> 1 | C746: =IF(AND(EQUAL(RC[-2], "C"), EQUAL(R[+1]C[-2], "G"))=1, 1, 0) -> 0 | D746: =SUM(RC[-2]:R[+49]C[-2])*2 -> 78 | E746: =SUM(RC[-2]:R[+49]C[-2])*2 -> 16 | F746: =IF(AND(EQUAL(RC[-5], "G"), EQUAL(R[+1]C[-5], "A"), EQUAL(R[+2]C[-5], "T"), EQUAL(R[+3]C[-5], "C"))=1, 1, 0) -> 0
A747: 'G | B747: =IF(EQUAL(RC[-1], "G"), 1, IF(EQUAL(RC[-1], "C"), 1, 0)) -> 1 | C747: =IF(AND(EQUAL(RC[-2], "C"), EQUAL(R[+1]C[-2], "G"))=1, 1, 0) -> 0 | D747: =SUM(RC[-2]:R[+49]C[-2])*2 -> 78 | E747: =SUM(RC[-2]:R[+49]C[-2])*2 -> 16 | F747: =IF(AND(EQUAL(RC[-5], "G"), EQUAL(R[+1]C[-5], "A"), EQUAL(R[+2]C[-5], "T"), EQUAL(R[+3]C[-5], "C"))=1, 1, 0) -> 0
A748: 'G | B748: =IF(EQUAL(RC[-1], "G"), 1, IF(EQUAL(RC[-1], "C"), 1, 0)) -> 1 | C748: =IF(AND(EQUAL(RC[-2], "C"), EQUAL(R[+1]C[-2], "G"))=1, 1, 0) -> 0 | D748: =SUM(RC[-2]:R[+49]C[-2])*2 -> 76 | E748: =SUM(RC[-2]:R[+49]C[-2])*2 -> 16 | F748: =IF(AND(EQUAL(RC[-5], "G"), EQUAL(R[+1]C[-5], "A"), EQUAL(R[+2]C[-5], "T"), EQUAL(R[+3]C[-5], "C"))=1, 1, 0) -> 0
A749: 'G | B749: =IF(EQUAL(RC[-1], "G"), 1, IF(EQUAL(RC[-1], "C"), 1, 0)) -> 1 | C749: =IF(AND(EQUAL(RC[-2], "C"), EQUAL(R[+1]C[-2], "G"))=1, 1, 0) -> 0 | D749: =SUM(RC[-2]:R[+49]C[-2])*2 -> 76 | E749: =SUM(RC[-2]:R[+49]C[-2])*2 -> 16 | F749: =IF(AND(EQUAL(RC[-5], "G"), EQUAL(R[+1]C[-5], "A"), EQUAL(R[+2]C[-5], "T"), EQUAL(R[+3]C[-5], "C"))=1, 1, 0) -> 0
A750: 'C | B750: =IF(EQUAL(RC[-1], "G"), 1, IF(EQUAL(RC[-1], "C"), 1, 0)) -> 1 | C750: =IF(AND(EQUAL(RC[-2], "C"), EQUAL(R[+1]C[-2], "G"))=1, 1, 0) -> 1 | D750: =SUM(RC[-2]:R[+49]C[-2])*2 -> 74 | E750: =SUM(RC[-2]:R[+49]C[-2])*2 -> 16 | F750: =IF(AND(EQUAL(RC[-5], "G"), EQUAL(R[+1]C[-5], "A"), EQUAL(R[+2]C[-5], "T"), EQUAL(R[+3]C[-5], "C"))=1, 1, 0) -> 0
A751: 'G | B751: =IF(EQUAL(RC[-1], "G"), 1, IF(EQUAL(RC[-1], "C"), 1, 0)) -> 1 | C751: =IF(AND(EQUAL(RC[-2], "C"), EQUAL(R[+1]C[-2], "G"))=1, 1, 0) -> 0 | D751: =SUM(RC[-2]:R[+49]C[-2])*2 -> 74 | E751: =SUM(RC[-2]:R[+49]C[-2])*2 -> 14 | F751: =IF(AND(EQUAL(RC[-5], "G"), EQUAL(R[+1]C[-5], "A"), EQUAL(R[+2]C[-5], "T"), EQUAL(R[+3]C[-5], "C"))=1, 1, 0) -> 0
A752: 'G | B752: =IF(EQUAL(RC[-1], "G"), 1, IF(EQUAL(RC[-1], "C"), 1, 0)) -> 1 | C752: =IF(AND(EQUAL(RC[-2], "C"), EQUAL(R[+1]C[-2], "G"))=1, 1, 0) -> 0 | D752: =SUM(RC[-2]:R[+49]C[-2])*2 -> 74 | E752: =SUM(RC[-2]:R[+49]C[-2])*2 -> 14 | F752: =IF(AND(EQUAL(RC[-5], "G"), EQUAL(R[+1]C[-5], "A"), EQUAL(R[+2]C[-5], "T"), EQUAL(R[+3]C[-5], "C"))=1, 1, 0) -> 0
A753: 'T | B753: =IF(EQUAL(RC[-1], "G"), 1, IF(EQUAL(RC[-1], "C"), 1, 0)) -> 0 | C753: =IF(AND(EQUAL(RC[-2], "C"), EQUAL(R[+1]C[-2], "G"))=1, 1, 0) -> 0 | D753: =SUM(RC[-2]:R[+49]C[-2])*2 -> 72 | E753: =SUM(RC[-2]:R[+49]C[-2])*2 -> 14 | F753: =IF(AND(EQUAL(RC[-5], "G"), EQUAL(R[+1]C[-5], "A"), EQUAL(R[+2]C[-5], "T"), EQUAL(R[+3]C[-5], "C"))=1, 1, 0) -> 0
A754: 'C | B754: =IF(EQUAL(RC[-1], "G"), 1, IF(EQUAL(RC[-1], "C"), 1, 0)) -> 1 | C754: =IF(AND(EQUAL(RC[-2], "C"), EQUAL(R[+1]C[-2], "G"))=1, 1, 0) -> 0 | D754: =SUM(RC[-2]:R[+49]C[-2])*2 -> 74 | E754: =SUM(RC[-2]:R[+49]C[-2])*2 -> 14 | F754: =IF(AND(EQUAL(RC[-5], "G"), EQUAL(R[+1]C[-5], "A"), EQUAL(R[+2]C[-5], "T"), EQUAL(R[+3]C[-5], "C"))=1, 1, 0) -> 0
A755: 'C | B755: =IF(EQUAL(RC[-1], "G"), 1, IF(EQUAL(RC[-1], "C"), 1, 0)) -> 1 | C755: =IF(AND(EQUAL(RC[-2], "C"), EQUAL(R[+1]C[-2], "G"))=1, 1, 0) -> 1 | D755: =SUM(RC[-2]:R[+49]C[-2])*2 -> 72 | E755: =SUM(RC[-2]:R[+49]C[-2])*2 -> 14 | F755: =IF(AND(EQUAL(RC[-5], "G"), EQUAL(R[+1]C[-5], "A"), EQUAL(R[+2]C[-5], "T"), EQUAL(R[+3]C[-5], "C"))=1, 1, 0) -> 0
A756: 'G | B756: =IF(EQUAL(RC[-1], "G"), 1, IF(EQUAL(RC[-1], "C"), 1, 0)) -> 1 | C756: =IF(AND(EQUAL(RC[-2], "C"), EQUAL(R[+1]C[-2], "G"))=1, 1, 0) -> 0 | D756: =SUM(RC[-2]:R[+49]C[-2])*2 -> 70 | E756: =SUM(RC[-2]:R[+49]C[-2])*2 -> 12 | F756: =IF(AND(EQUAL(RC[-5], "G"), EQUAL(R[+1]C[-5], "A"), EQUAL(R[+2]C[-5], "T"), EQUAL(R[+3]C[-5], "C"))=1, 1, 0) -> 0
A757: 'A | B757: =IF(EQUAL(RC[-1], "G"), 1, IF(EQUAL(RC[-1], "C"), 1, 0)) -> 0 | C757: =IF(AND(EQUAL(RC[-2], "C"), EQUAL(R[+1]C[-2], "G"))=1, 1, 0) -> 0 | D757: =SUM(RC[-2]:R[+49]C[-2])*2 -> 70 | E757: =SUM(RC[-2]:R[+49]C[-2])*2 -> 12 | F757: =IF(AND(EQUAL(RC[-5], "G"), EQUAL(R[+1]C[-5], "A"), EQUAL(R[+2]C[-5], "T"), EQUAL(R[+3]C[-5], "C"))=1, 1, 0) -> 0
A758: 'G | B758: =IF(EQUAL(RC[-1], "G"), 1, IF(EQUAL(RC[-1], "C"), 1, 0)) -> 1 | C758: =IF(AND(EQUAL(RC[-2], "C"), EQUAL(R[+1]C[-2], "G"))=1, 1, 0) -> 0 | D758: =SUM(RC[-2]:R[+49]C[-2])*2 -> 70 | E758: =SUM(RC[-2]:R[+49]C[-2])*2 -> 12 | F758: =IF(AND(EQUAL(RC[-5], "G"), EQUAL(R[+1]C[-5], "A"), EQUAL(R[+2]C[-5], "T"), EQUAL(R[+3]C[-5], "C"))=1, 1, 0) -> 0
A759: 'G | B759: =IF(EQUAL(RC[-1], "G"), 1, IF(EQUAL(RC[-1], "C"), 1, 0)) -> 1 | C759: =IF(AND(EQUAL(RC[-2], "C"), EQUAL(R[+1]C[-2], "G"))=1, 1, 0) -> 0 | D759: =SUM(RC[-2]:R[+49]C[-2])*2 -> 70 | E759: =SUM(RC[-2]:R[+49]C[-2])*2 -> 14 | F759: =IF(AND(EQUAL(RC[-5], "G"), EQUAL(R[+1]C[-5], "A"), EQUAL(R[+2]C[-5], "T"), EQUAL(R[+3]C[-5], "C"))=1, 1, 0) -> 0
A760: 'G | B760: =IF(EQUAL(RC[-1], "G"), 1, IF(EQUAL(RC[-1], "C"), 1, 0)) -> 1 | C760: =IF(AND(EQUAL(RC[-2], "C"), EQUAL(R[+1]C[-2], "G"))=1, 1, 0) -> 0 | D760: =SUM(RC[-2]:R[+49]C[-2])*2 -> 70 | E760: =SUM(RC[-2]:R[+49]C[-2])*2 -> 14 | F760: =IF(AND(EQUAL(RC[-5], "G"), EQUAL(R[+1]C[-5], "A"), EQUAL(R[+2]C[-5], "T"), EQUAL(R[+3]C[-5], "C"))=1, 1, 0) -> 0
A761: 'G | B761: =IF(EQUAL(RC[-1], "G"), 1, IF(EQUAL(RC[-1], "C"), 1, 0)) -> 1 | C761: =IF(AND(EQUAL(RC[-2], "C"), EQUAL(R[+1]C[-2], "G"))=1, 1, 0) -> 0 | D761: =SUM(RC[-2]:R[+49]C[-2])*2 -> 68 | E761: =SUM(RC[-2]:R[+49]C[-2])*2 -> 14 | F761: =IF(AND(EQUAL(RC[-5], "G"), EQUAL(R[+1]C[-5], "A"), EQUAL(R[+2]C[-5], "T"), EQUAL(R[+3]C[-5], "C"))=1, 1, 0) -> 0
A762: 'C | B762: =IF(EQUAL(RC[-1], "G"), 1, IF(EQUAL(RC[-1], "C"), 1, 0)) -> 1 | C762: =IF(AND(EQUAL(RC[-2], "C"), EQUAL(R[+1]C[-2], "G"))=1, 1, 0) -> 1 | D762: =SUM(RC[-2]:R[+49]C[-2])*2 -> 68 | E762: =SUM(RC[-2]:R[+49]C[-2])*2 -> 14 | F762: =IF(AND(EQUAL(RC[-5], "G"), EQUAL(R[+1]C[-5], "A"), EQUAL(R[+2]C[-5], "T"), EQUAL(R[+3]C[-5], "C"))=1, 1, 0) -> 0
A763: 'G | B763: =IF(EQUAL(RC[-1], "G"), 1, IF(EQUAL(RC[-1], "C"), 1, 0)) -> 1 | C763: =IF(AND(EQUAL(RC[-2], "C"), EQUAL(R[+1]C[-2], "G"))=1, 1, 0) -> 0 | D763: =SUM(RC[-2]:R[+49]C[-2])*2 -> 68 | E763: =SUM(RC[-2]:R[+49]C[-2])*2 -> 12 | F763: =IF(AND(EQUAL(RC[-5], "G"), EQUAL(R[+1]C[-5], "A"), EQUAL(R[+2]C[-5], "T"), EQUAL(R[+3]C[-5], "C"))=1, 1, 0) -> 0
A764: 'G | B764: =IF(EQUAL(RC[-1], "G"), 1, IF(EQUAL(RC[-1], "C"), 1, 0)) -> 1 | C764: =IF(AND(EQUAL(RC[-2], "C"), EQUAL(R[+1]C[-2], "G"))=1, 1, 0) -> 0 | D764: =SUM(RC[-2]:R[+49]C[-2])*2 -> 68 | E764: =SUM(RC[-2]:R[+49]C[-2])*2 -> 14 | F764: =IF(AND(EQUAL(RC[-5], "G"), EQUAL(R[+1]C[-5], "A"), EQUAL(R[+2]C[-5], "T"), EQUAL(R[+3]C[-5], "C"))=1, 1, 0) -> 0
A765: 'T | B765: =IF(EQUAL(RC[-1], "G"), 1, IF(EQUAL(RC[-1], "C"), 1, 0)) -> 0 | C765: =IF(AND(EQUAL(RC[-2], "C"), EQUAL(R[+1]C[-2], "G"))=1, 1, 0) -> 0 | D765: =SUM(RC[-2]:R[+49]C[-2])*2 -> 68 | E765: =SUM(RC[-2]:R[+49]C[-2])*2 -> 14 | F765: =IF(AND(EQUAL(RC[-5], "G"), EQUAL(R[+1]C[-5], "A"), EQUAL(R[+2]C[-5], "T"), EQUAL(R[+3]C[-5], "C"))=1, 1, 0) -> 0
A766: 'C | B766: =IF(EQUAL(RC[-1], "G"), 1, IF(EQUAL(RC[-1], "C"), 1, 0)) -> 1 | C766: =IF(AND(EQUAL(RC[-2], "C"), EQUAL(R[+1]C[-2], "G"))=1, 1, 0) -> 0 | D766: =SUM(RC[-2]:R[+49]C[-2])*2 -> 70 | E766: =SUM(RC[-2]:R[+49]C[-2])*2 -> 14 | F766: =IF(AND(EQUAL(RC[-5], "G"), EQUAL(R[+1]C[-5], "A"), EQUAL(R[+2]C[-5], "T"), EQUAL(R[+3]C[-5], "C"))=1, 1, 0) -> 0
A767: 'C | B767: =IF(EQUAL(RC[-1], "G"), 1, IF(EQUAL(RC[-1], "C"), 1, 0)) -> 1 | C767: =IF(AND(EQUAL(RC[-2], "C"), EQUAL(R[+1]C[-2], "G"))=1, 1, 0) -> 1 | D767: =SUM(RC[-2]:R[+49]C[-2])*2 -> 70 | E767: =SUM(RC[-2]:R[+49]C[-2])*2 -> 16 | F767: =IF(AND(EQUAL(RC[-5], "G"), EQUAL(R[+1]C[-5], "A"), EQUAL(R[+2]C[-5], "T"), EQUAL(R[+3]C[-5], "C"))=1, 1, 0) -> 0
A768: 'G | B768: =IF(EQUAL(RC[-1], "G"), 1, IF(EQUAL(RC[-1], "C"), 1, 0)) -> 1 | C768: =IF(AND(EQUAL(RC[-2], "C"), EQUAL(R[+1]C[-2], "G"))=1, 1, 0) -> 0 | D768: =SUM(RC[-2]:R[+49]C[-2])*2 -> 70 | E768: =SUM(RC[-2]:R[+49]C[-2])*2 -> 14 | F768: =IF(AND(EQUAL(RC[-5], "G"), EQUAL(R[+1]C[-5], "A"), EQUAL(R[+2]C[-5], "T"), EQUAL(R[+3]C[-5], "C"))=1, 1, 0) -> 0
A769: 'A | B769: =IF(EQUAL(RC[-1], "G"), 1, IF(EQUAL(RC[-1], "C"), 1, 0)) -> 0 | C769: =IF(AND(EQUAL(RC[-2], "C"), EQUAL(R[+1]C[-2], "G"))=1, 1, 0) -> 0 | D769: =SUM(RC[-2]:R[+49]C[-2])*2 -> 68 | E769: =SUM(RC[-2]:R[+49]C[-2])*2 -> 14 | F769: =IF(AND(EQUAL(RC[-5], "G"), EQUAL(R[+1]C[-5], "A"), EQUAL(R[+2]C[-5], "T"), EQUAL(R[+3]C[-5], "C"))=1, 1, 0) -> 0
A770: 'C | B770: =IF(EQUAL(RC[-1], "G"), 1, IF(EQUAL(RC[-1], "C"), 1, 0)) -> 1 | C770: =IF(AND(EQUAL(RC[-2], "C"), EQUAL(R[+1]C[-2], "G"))=1, 1, 0) -> 1 | D770: =SUM(RC[-2]:R[+49]C[-2])*2 -> 68 | E770: =SUM(RC[-2]:R[+49]C[-2])*2 -> 14 | F770: =IF(AND(EQUAL(RC[-5], "G"), EQUAL(R[+1]C[-5], "A"), EQUAL(R[+2]C[-5], "T"), EQUAL(R[+3]C[-5], "C"))=1, 1, 0) -> 0
A771: 'G | B771: =IF(EQUAL(RC[-1], "G"), 1, IF(EQUAL(RC[-1], "C"), 1, 0)) -> 1 | C771: =IF(AND(EQUAL(RC[-2], "C"), EQUAL(R[+1]C[-2], "G"))=1, 1, 0) -> 0 | D771: =SUM(RC[-2]:R[+49]C[-2])*2 -> 68 | E771: =SUM(RC[-2]:R[+49]C[-2])*2 -> 12 | F771: =IF(AND(EQUAL(RC[-5], "G"), EQUAL(R[+1]C[-5], "A"), EQUAL(R[+2]C[-5], "T"), EQUAL(R[+3]C[-5], "C"))=1, 1, 0) -> 0
A772: 'G | B772: =IF(EQUAL(RC[-1], "G"), 1, IF(EQUAL(RC[-1], "C"), 1, 0)) -> 1 | C772: =IF(AND(EQUAL(RC[-2], "C"), EQUAL(R[+1]C[-2], "G"))=1, 1, 0) -> 0 | D772: =SUM(RC[-2]:R[+49]C[-2])*2 -> 66 | E772: =SUM(RC[-2]:R[+49]C[-2])*2 -> 12 | F772: =IF(AND(EQUAL(RC[-5], "G"), EQUAL(R[+1]C[-5], "A"), EQUAL(R[+2]C[-5], "T"), EQUAL(R[+3]C[-5], "C"))=1, 1, 0) -> 0
A773: 'G | B773: =IF(EQUAL(RC[-1], "G"), 1, IF(EQUAL(RC[-1], "C"), 1, 0)) -> 1 | C773: =IF(AND(EQUAL(RC[-2], "C"), EQUAL(R[+1]C[-2], "G"))=1, 1, 0) -> 0 | D773: =SUM(RC[-2]:R[+49]C[-2])*2 -> 66 | E773: =SUM(RC[-2]:R[+49]C[-2])*2 -> 14 | F773: =IF(AND(EQUAL(RC[-5], "G"), EQUAL(R[+1]C[-5], "A"), EQUAL(R[+2]C[-5], "T"), EQUAL(R[+3]C[-5], "C"))=1, 1, 0) -> 0
A774: 'C | B774: =IF(EQUAL(RC[-1], "G"), 1, IF(EQUAL(RC[-1], "C"), 1, 0)) -> 1 | C774: =IF(AND(EQUAL(RC[-2], "C"), EQUAL(R[+1]C[-2], "G"))=1, 1, 0) -> 1 | D774: =SUM(RC[-2]:R[+49]C[-2])*2 -> 66 | E774: =SUM(RC[-2]:R[+49]C[-2])*2 -> 14 | F774: =IF(AND(EQUAL(RC[-5], "G"), EQUAL(R[+1]C[-5], "A"), EQUAL(R[+2]C[-5], "T"), EQUAL(R[+3]C[-5], "C"))=1, 1, 0) -> 0
A775: 'G | B775: =IF(EQUAL(RC[-1], "G"), 1, IF(EQUAL(RC[-1], "C"), 1, 0)) -> 1 | C775: =IF(AND(EQUAL(RC[-2], "C"), EQUAL(R[+1]C[-2], "G"))=1, 1, 0) -> 0 | D775: =SUM(RC[-2]:R[+49]C[-2])*2 -> 64 | E775: =SUM(RC[-2]:R[+49]C[-2])*2 -> 12 | F775: =IF(AND(EQUAL(RC[-5], "G"), EQUAL(R[+1]C[-5], "A"), EQUAL(R[+2]C[-5], "T"), EQUAL(R[+3]C[-5], "C"))=1, 1, 0) -> 0
A776: 'G | B776: =IF(EQUAL(RC[-1], "G"), 1, IF(EQUAL(RC[-1], "C"), 1, 0)) -> 1 | C776: =IF(AND(EQUAL(RC[-2], "C"), EQUAL(R[+1]C[-2], "G"))=1, 1, 0) -> 0 | D776: =SUM(RC[-2]:R[+49]C[-2])*2 -> 64 | E776: =SUM(RC[-2]:R[+49]C[-2])*2 -> 12 | F776: =IF(AND(EQUAL(RC[-5], "G"), EQUAL(R[+1]C[-5], "A"), EQUAL(R[+2]C[-5], "T"), EQUAL(R[+3]C[-5], "C"))=1, 1, 0) -> 0
A777: 'G | B777: =IF(EQUAL(RC[-1], "G"), 1, IF(EQUAL(RC[-1], "C"), 1, 0)) -> 1 | C777: =IF(AND(EQUAL(RC[-2], "C"), EQUAL(R[+1]C[-2], "G"))=1, 1, 0) -> 0 | D777: =SUM(RC[-2]:R[+49]C[-2])*2 -> 64 | E777: =SUM(RC[-2]:R[+49]C[-2])*2 -> 14 | F777: =IF(AND(EQUAL(RC[-5], "G"), EQUAL(R[+1]C[-5], "A"), EQUAL(R[+2]C[-5], "T"), EQUAL(R[+3]C[-5], "C"))=1, 1, 0) -> 0
A778: 'G | B778: =IF(EQUAL(RC[-1], "G"), 1, IF(EQUAL(RC[-1], "C"), 1, 0)) -> 1 | C778: =IF(AND(EQUAL(RC[-2], "C"), EQUAL(R[+1]C[-2], "G"))=1, 1, 0) -> 0 | D778: =SUM(RC[-2]:R[+49]C[-2])*2 -> 64 | E778: =SUM(RC[-2]:R[+49]C[-2])*2 -> 14 | F778: =IF(AND(EQUAL(RC[-5], "G"), EQUAL(R[+1]C[-5], "A"), EQUAL(R[+2]C[-5], "T"), EQUAL(R[+3]C[-5], "C"))=1, 1, 0) -> 0
A779: 'C | B779: =IF(EQUAL(RC[-1], "G"), 1, IF(EQUAL(RC[-1], "C"), 1, 0)) -> 1 | C779: =IF(AND(EQUAL(RC[-2], "C"), EQUAL(R[+1]C[-2], "G"))=1, 1, 0) -> 0 | D779: =SUM(RC[-2]:R[+49]C[-2])*2 -> 62 | E779: =SUM(RC[-2]:R[+49]C[-2])*2 -> 14 | F779: =IF(AND(EQUAL(RC[-5], "G"), EQUAL(R[+1]C[-5], "A"), EQUAL(R[+2]C[-5], "T"), EQUAL(R[+3]C[-5], "C"))=1, 1, 0) -> 0
A780: 'C | B780: =IF(EQUAL(RC[-1], "G"), 1, IF(EQUAL(RC[-1], "C"), 1, 0)) -> 1 | C780: =IF(AND(EQUAL(RC[-2], "C"), EQUAL(R[+1]C[-2], "G"))=1, 1, 0) -> 0 | D780: =SUM(RC[-2]:R[+49]C[-2])*2 -> 60 | E780: =SUM(RC[-2]:R[+49]C[-2])*2 -> 14 | F780: =IF(AND(EQUAL(RC[-5], "G"), EQUAL(R[+1]C[-5], "A"), EQUAL(R[+2]C[-5], "T"), EQUAL(R[+3]C[-5], "C"))=1, 1, 0) -> 0
A781: 'T | B781: =IF(EQUAL(RC[-1], "G"), 1, IF(EQUAL(RC[-1], "C"), 1, 0)) -> 0 | C781: =IF(AND(EQUAL(RC[-2], "C"), EQUAL(R[+1]C[-2], "G"))=1, 1, 0) -> 0 | D781: =SUM(RC[-2]:R[+49]C[-2])*2 -> 60 | E781: =SUM(RC[-2]:R[+49]C[-2])*2 -> 14 | F781: =IF(AND(EQUAL(RC[-5], "G"), EQUAL(R[+1]C[-5], "A"), EQUAL(R[+2]C[-5], "T"), EQUAL(R[+3]C[-5], "C"))=1, 1, 0) -> 0
A782: 'G | B782: =IF(EQUAL(RC[-1], "G"), 1, IF(EQUAL(RC[-1], "C"), 1, 0)) -> 1 | C782: =IF(AND(EQUAL(RC[-2], "C"), EQUAL(R[+1]C[-2], "G"))=1, 1, 0) -> 0 | D782: =SUM(RC[-2]:R[+49]C[-2])*2 -> 62 | E782: =SUM(RC[-2]:R[+49]C[-2])*2 -> 14 | F782: =IF(AND(EQUAL(RC[-5], "G"), EQUAL(R[+1]C[-5], "A"), EQUAL(R[+2]C[-5], "T"), EQUAL(R[+3]C[-5], "C"))=1, 1, 0) -> 0
A783: 'A | B783: =IF(EQUAL(RC[-1], "G"), 1, IF(EQUAL(RC[-1], "C"), 1, 0)) -> 0 | C783: =IF(AND(EQUAL(RC[-2], "C"), EQUAL(R[+1]C[-2], "G"))=1, 1, 0) -> 0 | D783: =SUM(RC[-2]:R[+49]C[-2])*2 -> 60 | E783: =SUM(RC[-2]:R[+49]C[-2])*2 -> 14 | F783: =IF(AND(EQUAL(RC[-5], "G"), EQUAL(R[+1]C[-5], "A"), EQUAL(R[+2]C[-5], "T"), EQUAL(R[+3]C[-5], "C"))=1, 1, 0) -> 0
A784: 'T | B784: =IF(EQUAL(RC[-1], "G"), 1, IF(EQUAL(RC[-1], "C"), 1, 0)) -> 0 | C784: =IF(AND(EQUAL(RC[-2], "C"), EQUAL(R[+1]C[-2], "G"))=1, 1, 0) -> 0 | D784: =SUM(RC[-2]:R[+49]C[-2])*2 -> 62 | E784: =SUM(RC[-2]:R[+49]C[-2])*2 -> 14 | F784: =IF(AND(EQUAL(RC[-5], "G"), EQUAL(R[+1]C[-5], "A"), EQUAL(R[+2]C[-5], "T"), EQUAL(R[+3]C[-5], "C"))=1, 1, 0) -> 0
A785: 'T | B785: =IF(EQUAL(RC[-1], "G"), 1, IF(EQUAL(RC[-1], "C"), 1, 0)) -> 0 | C785: =IF(AND(EQUAL(RC[-2], "C"), EQUAL(R[+1]C[-2], "G"))=1, 1, 0) -> 0 | D785: =SUM(RC[-2]:R[+49]C[-2])*2 -> 62 | E785: =SUM(RC[-2]:R[+49]C[-2])*2 -> 14 | F785: =IF(AND(EQUAL(RC[-5], "G"), EQUAL(R[+1]C[-5], "A"), EQUAL(R[+2]C[-5], "T"), EQUAL(R[+3]C[-5], "C"))=1, 1, 0) -> 0
A786: 'C | B786: =IF(EQUAL(RC[-1], "G"), 1, IF(EQUAL(RC[-1], "C"), 1, 0)) -> 1 | C786: =IF(AND(EQUAL(RC[-2], "C"), EQUAL(R[+1]C[-2], "G"))=1, 1, 0) -> 1 | D786: =SUM(RC[-2]:R[+49]C[-2])*2 -> 62 | E786: =SUM(RC[-2]:R[+49]C[-2])*2 -> 14 | F786: =IF(AND(EQUAL(RC[-5], "G"), EQUAL(R[+1]C[-5], "A"), EQUAL(R[+2]C[-5], "T"), EQUAL(R[+3]C[-5], "C"))=1, 1, 0) -> 0
A787: 'G | B787: =IF(EQUAL(RC[-1], "G"), 1, IF(EQUAL(RC[-1], "C"), 1, 0)) -> 1 | C787: =IF(AND(EQUAL(RC[-2], "C"), EQUAL(R[+1]C[-2], "G"))=1, 1, 0) -> 0 | D787: =SUM(RC[-2]:R[+49]C[-2])*2 -> 60 | E787: =SUM(RC[-2]:R[+49]C[-2])*2 -> 12 | F787: =IF(AND(EQUAL(RC[-5], "G"), EQUAL(R[+1]C[-5], "A"), EQUAL(R[+2]C[-5], "T"), EQUAL(R[+3]C[-5], "C"))=1, 1, 0) -> 0
A788: 'T | B788: =IF(EQUAL(RC[-1], "G"), 1, IF(EQUAL(RC[-1], "C"), 1, 0)) -> 0 | C788: =IF(AND(EQUAL(RC[-2], "C"), EQUAL(R[+1]C[-2], "G"))=1, 1, 0) -> 0 | D788: =SUM(RC[-2]:R[+49]C[-2])*2 -> 60 | E788: =SUM(RC[-2]:R[+49]C[-2])*2 -> 12 | F788: =IF(AND(EQUAL(RC[-5], "G"), EQUAL(R[+1]C[-5], "A"), EQUAL(R[+2]C[-5], "T"), EQUAL(R[+3]C[-5], "C"))=1, 1, 0) -> 0
A789: 'G | B789: =IF(EQUAL(RC[-1], "G"), 1, IF(EQUAL(RC[-1], "C"), 1, 0)) -> 1 | C789: =IF(AND(EQUAL(RC[-2], "C"), EQUAL(R[+1]C[-2], "G"))=1, 1, 0) -> 0 | D789: =SUM(RC[-2]:R[+49]C[-2])*2 -> 62 | E789: =SUM(RC[-2]:R[+49]C[-2])*2 -> 12 | F789: =IF(AND(EQUAL(RC[-5], "G"), EQUAL(R[+1]C[-5], "A"), EQUAL(R[+2]C[-5], "T"), EQUAL(R[+3]C[-5], "C"))=1, 1, 0) -> 0
A790: 'G | B790: =IF(EQUAL(RC[-1], "G"), 1, IF(EQUAL(RC[-1], "C"), 1, 0)) -> 1 | C790: =IF(AND(EQUAL(RC[-2], "C"), EQUAL(R[+1]C[-2], "G"))=1, 1, 0) -> 0 | D790: =SUM(RC[-2]:R[+49]C[-2])*2 -> 60 | E790: =SUM(RC[-2]:R[+49]C[-2])*2 -> 12 | F790: =IF(AND(EQUAL(RC[-5], "G"), EQUAL(R[+1]C[-5], "A"), EQUAL(R[+2]C[-5], "T"), EQUAL(R[+3]C[-5], "C"))=1, 1, 0) -> 0
A791: 'C | B791: =IF(EQUAL(RC[-1], "G"), 1, IF(EQUAL(RC[-1], "C"), 1, 0)) -> 1 | C791: =IF(AND(EQUAL(RC[-2], "C"), EQUAL(R[+1]C[-2], "G"))=1, 1, 0) -> 1 | D791: =SUM(RC[-2]:R[+49]C[-2])*2 -> 60 | E791: =SUM(RC[-2]:R[+49]C[-2])*2 -> 12 | F791: =IF(AND(EQUAL(RC[-5], "G"), EQUAL(R[+1]C[-5], "A"), EQUAL(R[+2]C[-5], "T"), EQUAL(R[+3]C[-5], "C"))=1, 1, 0) -> 0
A792: 'G | B792: =IF(EQUAL(RC[-1], "G"), 1, IF(EQUAL(RC[-1], "C"), 1, 0)) -> 1 | C792: =IF(AND(EQUAL(RC[-2], "C"), EQUAL(R[+1]C[-2], "G"))=1, 1, 0) -> 0 | D792: =SUM(RC[-2]:R[+49]C[-2])*2 -> 58 | E792: =SUM(RC[-2]:R[+49]C[-2])*2 -> 10 | F792: =IF(AND(EQUAL(RC[-5], "G"), EQUAL(R[+1]C[-5], "A"), EQUAL(R[+2]C[-5], "T"), EQUAL(R[+3]C[-5], "C"))=1, 1, 0) -> 0
A793: 'T | B793: =IF(EQUAL(RC[-1], "G"), 1, IF(EQUAL(RC[-1], "C"), 1, 0)) -> 0 | C793: =IF(AND(EQUAL(RC[-2], "C"), EQUAL(R[+1]C[-2], "G"))=1, 1, 0) -> 0 | D793: =SUM(RC[-2]:R[+49]C[-2])*2 -> 58 | E793: =SUM(RC[-2]:R[+49]C[-2])*2 -> 10 | F793: =IF(AND(EQUAL(RC[-5], "G"), EQUAL(R[+1]C[-5], "A"), EQUAL(R[+2]C[-5], "T"), EQUAL(R[+3]C[-5], "C"))=1, 1, 0) -> 0
A794: 'C | B794: =IF(EQUAL(RC[-1], "G"), 1, IF(EQUAL(RC[-1], "C"), 1, 0)) -> 1 | C794: =IF(AND(EQUAL(RC[-2], "C"), EQUAL(R[+1]C[-2], "G"))=1, 1, 0) -> 0 | D794: =SUM(RC[-2]:R[+49]C[-2])*2 -> 58 | E794: =SUM(RC[-2]:R[+49]C[-2])*2 -> 10 | F794: =IF(AND(EQUAL(RC[-5], "G"), EQUAL(R[+1]C[-5], "A"), EQUAL(R[+2]C[-5], "T"), EQUAL(R[+3]C[-5], "C"))=1, 1, 0) -> 0
A795: 'T | B795: =IF(EQUAL(RC[-1], "G"), 1, IF(EQUAL(RC[-1], "C"), 1, 0)) -> 0 | C795: =IF(AND(EQUAL(RC[-2], "C"), EQUAL(R[+1]C[-2], "G"))=1, 1, 0) -> 0 | D795: =SUM(RC[-2]:R[+49]C[-2])*2 -> 58 | E795: =SUM(RC[-2]:R[+49]C[-2])*2 -> 10 | F795: =IF(AND(EQUAL(RC[-5], "G"), EQUAL(R[+1]C[-5], "A"), EQUAL(R[+2]C[-5], "T"), EQUAL(R[+3]C[-5], "C"))=1, 1, 0) -> 0
A796: 'C | B796: =IF(EQUAL(RC[-1], "G"), 1, IF(EQUAL(RC[-1], "C"), 1, 0)) -> 1 | C796: =IF(AND(EQUAL(RC[-2], "C"), EQUAL(R[+1]C[-2], "G"))=1, 1, 0) -> 0 | D796: =SUM(RC[-2]:R[+49]C[-2])*2 -> 60 | E796: =SUM(RC[-2]:R[+49]C[-2])*2 -> 10 | F796: =IF(AND(EQUAL(RC[-5], "G"), EQUAL(R[+1]C[-5], "A"), EQUAL(R[+2]C[-5], "T"), EQUAL(R[+3]C[-5], "C"))=1, 1, 0) -> 0
A797: 'T | B797: =IF(EQUAL(RC[-1], "G"), 1, IF(EQUAL(RC[-1], "C"), 1, 0)) -> 0 | C797: =IF(AND(EQUAL(RC[-2], "C"), EQUAL(R[+1]C[-2], "G"))=1, 1, 0) -> 0 | D797: =SUM(RC[-2]:R[+49]C[-2])*2 -> 58 | E797: =SUM(RC[-2]:R[+49]C[-2])*2 -> 10 | F797: =IF(AND(EQUAL(RC[-5], "G"), EQUAL(R[+1]C[-5], "A"), EQUAL(R[+2]C[-5], "T"), EQUAL(R[+3]C[-5], "C"))=1, 1, 0) -> 0
A798: 'G | B798: =IF(EQUAL(RC[-1], "G"), 1, IF(EQUAL(RC[-1], "C"), 1, 0)) -> 1 | C798: =IF(AND(EQUAL(RC[-2], "C"), EQUAL(R[+1]C[-2], "G"))=1, 1, 0) -> 0 | D798: =SUM(RC[-2]:R[+49]C[-2])*2 -> 58 | E798: =SUM(RC[-2]:R[+49]C[-2])*2 -> 10 | F798: =IF(AND(EQUAL(RC[-5], "G"), EQUAL(R[+1]C[-5], "A"), EQUAL(R[+2]C[-5], "T"), EQUAL(R[+3]C[-5], "C"))=1, 1, 0) -> 0
A799: 'A | B799: =IF(EQUAL(RC[-1], "G"), 1, IF(EQUAL(RC[-1], "C"), 1, 0)) -> 0 | C799: =IF(AND(EQUAL(RC[-2], "C"), EQUAL(R[+1]C[-2], "G"))=1, 1, 0) -> 0 | D799: =SUM(RC[-2]:R[+49]C[-2])*2 -> 56 | E799: =SUM(RC[-2]:R[+49]C[-2])*2 -> 10 | F799: =IF(AND(EQUAL(RC[-5], "G"), EQUAL(R[+1]C[-5], "A"), EQUAL(R[+2]C[-5], "T"), EQUAL(R[+3]C[-5], "C"))=1, 1, 0) -> 0
A800: 'G | B800: =IF(EQUAL(RC[-1], "G"), 1, IF(EQUAL(RC[-1], "C"), 1, 0)) -> 1 | C800: =IF(AND(EQUAL(RC[-2], "C"), EQUAL(R[+1]C[-2], "G"))=1, 1, 0) -> 0 | D800: =SUM(RC[-2]:R[+49]C[-2])*2 -> 56 | E800: =SUM(RC[-2]:R[+49]C[-2])*2 -> 10 | F800: =IF(AND(EQUAL(RC[-5], "G"), EQUAL(R[+1]C[-5], "A"), EQUAL(R[+2]C[-5], "T"), EQUAL(R[+3]C[-5], "C"))=1, 1, 0) -> 0
A801: 'G | B801: =IF(EQUAL(RC[-1], "G"), 1, IF(EQUAL(RC[-1], "C"), 1, 0)) -> 1 | C801: =IF(AND(EQUAL(RC[-2], "C"), EQUAL(R[+1]C[-2], "G"))=1, 1, 0) -> 0 | D801: =SUM(RC[-2]:R[+49]C[-2])*2 -> 56 | E801: =SUM(RC[-2]:R[+49]C[-2])*2 -> 10 | F801: =IF(AND(EQUAL(RC[-5], "G"), EQUAL(R[+1]C[-5], "A"), EQUAL(R[+2]C[-5], "T"), EQUAL(R[+3]C[-5], "C"))=1, 1, 0) -> 0
A802: 'T | B802: =IF(EQUAL(RC[-1], "G"), 1, IF(EQUAL(RC[-1], "C"), 1, 0)) -> 0 | C802: =IF(AND(EQUAL(RC[-2], "C"), EQUAL(R[+1]C[-2], "G"))=1, 1, 0) -> 0 | D802: =SUM(RC[-2]:R[+49]C[-2])*2 -> 54 | E802: =SUM(RC[-2]:R[+49]C[-2])*2 -> 10 | F802: =IF(AND(EQUAL(RC[-5], "G"), EQUAL(R[+1]C[-5], "A"), EQUAL(R[+2]C[-5], "T"), EQUAL(R[+3]C[-5], "C"))=1, 1, 0) -> 0
A803: 'G | B803: =IF(EQUAL(RC[-1], "G"), 1, IF(EQUAL(RC[-1], "C"), 1, 0)) -> 1 | C803: =IF(AND(EQUAL(RC[-2], "C"), EQUAL(R[+1]C[-2], "G"))=1, 1, 0) -> 0 | D803: =SUM(RC[-2]:R[+49]C[-2])*2 -> 54 | E803: =SUM(RC[-2]:R[+49]C[-2])*2 -> 10 | F803: =IF(AND(EQUAL(RC[-5], "G"), EQUAL(R[+1]C[-5], "A"), EQUAL(R[+2]C[-5], "T"), EQUAL(R[+3]C[-5], "C"))=1, 1, 0) -> 0
A804: 'T | B804: =IF(EQUAL(RC[-1], "G"), 1, IF(EQUAL(RC[-1], "C"), 1, 0)) -> 0 | C804: =IF(AND(EQUAL(RC[-2], "C"), EQUAL(R[+1]C[-2], "G"))=1, 1, 0) -> 0 | D804: =SUM(RC[-2]:R[+49]C[-2])*2 -> 54 | E804: =SUM(RC[-2]:R[+49]C[-2])*2 -> 10 | F804: =IF(AND(EQUAL(RC[-5], "G"), EQUAL(R[+1]C[-5], "A"), EQUAL(R[+2]C[-5], "T"), EQUAL(R[+3]C[-5], "C"))=1, 1, 0) -> 0
A805: 'T | B805: =IF(EQUAL(RC[-1], "G"), 1, IF(EQUAL(RC[-1], "C"), 1, 0)) -> 0 | C805: =IF(AND(EQUAL(RC[-2], "C"), EQUAL(R[+1]C[-2], "G"))=1, 1, 0) -> 0 | D805: =SUM(RC[-2]:R[+49]C[-2])*2 -> 56 | E805: =SUM(RC[-2]:R[+49]C[-2])*2 -> 12 | F805: =IF(AND(EQUAL(RC[-5], "G"), EQUAL(R[+1]C[-5], "A"), EQUAL(R[+2]C[-5], "T"), EQUAL(R[+3]C[-5], "C"))=1, 1, 0) -> 0
A806: 'G | B806: =IF(EQUAL(RC[-1], "G"), 1, IF(EQUAL(RC[-1], "C"), 1, 0)) -> 1 | C806: =IF(AND(EQUAL(RC[-2], "C"), EQUAL(R[+1]C[-2], "G"))=1, 1, 0) -> 0 | D806: =SUM(RC[-2]:R[+49]C[-2])*2 -> 58 | E806: =SUM(RC[-2]:R[+49]C[-2])*2 -> 12 | F806: =IF(AND(EQUAL(RC[-5], "G"), EQUAL(R[+1]C[-5], "A"), EQUAL(R[+2]C[-5], "T"), EQUAL(R[+3]C[-5], "C"))=1, 1, 0) -> 0
A807: 'T | B807: =IF(EQUAL(RC[-1], "G"), 1, IF(EQUAL(RC[-1], "C"), 1, 0)) -> 0 | C807: =IF(AND(EQUAL(RC[-2], "C"), EQUAL(R[+1]C[-2], "G"))=1, 1, 0) -> 0 | D807: =SUM(RC[-2]:R[+49]C[-2])*2 -> 58 | E807: =SUM(RC[-2]:R[+49]C[-2])*2 -> 12 | F807: =IF(AND(EQUAL(RC[-5], "G"), EQUAL(R[+1]C[-5], "A"), EQUAL(R[+2]C[-5], "T"), EQUAL(R[+3]C[-5], "C"))=1, 1, 0) -> 0
A808: 'C | B808: =IF(EQUAL(RC[-1], "G"), 1, IF(EQUAL(RC[-1], "C"), 1, 0)) -> 1 | C808: =IF(AND(EQUAL(RC[-2], "C"), EQUAL(R[+1]C[-2], "G"))=1, 1, 0) -> 1 | D808: =SUM(RC[-2]:R[+49]C[-2])*2 -> 58 | E808: =SUM(RC[-2]:R[+49]C[-2])*2 -> 12 | F808: =IF(AND(EQUAL(RC[-5], "G"), EQUAL(R[+1]C[-5], "A"), EQUAL(R[+2]C[-5], "T"), EQUAL(R[+3]C[-5], "C"))=1, 1, 0) -> 0
A809: 'G | B809: =IF(EQUAL(RC[-1], "G"), 1, IF(EQUAL(RC[-1], "C"), 1, 0)) -> 1 | C809: =IF(AND(EQUAL(RC[-2], "C"), EQUAL(R[+1]C[-2], "G"))=1, 1, 0) -> 0 | D809: =SUM(RC[-2]:R[+49]C[-2])*2 -> 56 | E809: =SUM(RC[-2]:R[+49]C[-2])*2 -> 10 | F809: =IF(AND(EQUAL(RC[-5], "G"), EQUAL(R[+1]C[-5], "A"), EQUAL(R[+2]C[-5], "T"), EQUAL(R[+3]C[-5], "C"))=1, 1, 0) -> 0
A810: 'A | B810: =IF(EQUAL(RC[-1], "G"), 1, IF(EQUAL(RC[-1], "C"), 1, 0)) -> 0 | C810: =IF(AND(EQUAL(RC[-2], "C"), EQUAL(R[+1]C[-2], "G"))=1, 1, 0) -> 0 | D810: =SUM(RC[-2]:R[+49]C[-2])*2 -> 56 | E810: =SUM(RC[-2]:R[+49]C[-2])*2 -> 10 | F810: =IF(AND(EQUAL(RC[-5], "G"), EQUAL(R[+1]C[-5], "A"), EQUAL(R[+2]C[-5], "T"), EQUAL(R[+3]C[-5], "C"))=1, 1, 0) -> 0
A811: 'G | B811: =IF(EQUAL(RC[-1], "G"), 1, IF(EQUAL(RC[-1], "C"), 1, 0)) -> 1 | C811: =IF(AND(EQUAL(RC[-2], "C"), EQUAL(R[+1]C[-2], "G"))=1, 1, 0) -> 0 | D811: =SUM(RC[-2]:R[+49]C[-2])*2 -> 58 | E811: =SUM(RC[-2]:R[+49]C[-2])*2 -> 10 | F811: =IF(AND(EQUAL(RC[-5], "G"), EQUAL(R[+1]C[-5], "A"), EQUAL(R[+2]C[-5], "T"), EQUAL(R[+3]C[-5], "C"))=1, 1, 0) -> 0
A812: 'G | B812: =IF(EQUAL(RC[-1], "G"), 1, IF(EQUAL(RC[-1], "C"), 1, 0)) -> 1 | C812: =IF(AND(EQUAL(RC[-2], "C"), EQUAL(R[+1]C[-2], "G"))=1, 1, 0) -> 0 | D812: =SUM(RC[-2]:R[+49]C[-2])*2 -> 56 | E812: =SUM(RC[-2]:R[+49]C[-2])*2 -> 10 | F812: =IF(AND(EQUAL(RC[-5], "G"), EQUAL(R[+1]C[-5], "A"), EQUAL(R[+2]C[-5], "T"), EQUAL(R[+3]C[-5], "C"))=1, 1, 0) -> 0
A813: 'C | B813: =IF(EQUAL(RC[-1], "G"), 1, IF(EQUAL(RC[-1], "C"), 1, 0)) -> 1 | C813: =IF(AND(EQUAL(RC[-2], "C"), EQUAL(R[+1]C[-2], "G"))=1, 1, 0) -> 1 | D813: =SUM(RC[-2]:R[+49]C[-2])*2 -> 56 | E813: =SUM(RC[-2]:R[+49]C[-2])*2 -> 10 | F813: =IF(AND(EQUAL(RC[-5], "G"), EQUAL(R[+1]C[-5], "A"), EQUAL(R[+2]C[-5], "T"), EQUAL(R[+3]C[-5], "C"))=1, 1, 0) -> 0
A814: 'G | B814: =IF(EQUAL(RC[-1], "G"), 1, IF(EQUAL(RC[-1], "C"), 1, 0)) -> 1 | C814: =IF(AND(EQUAL(RC[-2], "C"), EQUAL(R[+1]C[-2], "G"))=1, 1, 0) -> 0 | D814: =SUM(RC[-2]:R[+49]C[-2])*2 -> 56 | E814: =SUM(RC[-2]:R[+49]C[-2])*2 -> 8 | F814: =IF(AND(EQUAL(RC[-5], "G"), EQUAL(R[+1]C[-5], "A"), EQUAL(R[+2]C[-5], "T"), EQUAL(R[+3]C[-5], "C"))=1, 1, 0) -> 0
A815: 'G | B815: =IF(EQUAL(RC[-1], "G"), 1, IF(EQUAL(RC[-1], "C"), 1, 0)) -> 1 | C815: =IF(AND(EQUAL(RC[-2], "C"), EQUAL(R[+1]C[-2], "G"))=1, 1, 0) -> 0 | D815: =SUM(RC[-2]:R[+49]C[-2])*2 -> 54 | E815: =SUM(RC[-2]:R[+49]C[-2])*2 -> 8 | F815: =IF(AND(EQUAL(RC[-5], "G"), EQUAL(R[+1]C[-5], "A"), EQUAL(R[+2]C[-5], "T"), EQUAL(R[+3]C[-5], "C"))=1, 1, 0) -> 0
A816: 'C | B816: =IF(EQUAL(RC[-1], "G"), 1, IF(EQUAL(RC[-1], "C"), 1, 0)) -> 1 | C816: =IF(AND(EQUAL(RC[-2], "C"), EQUAL(R[+1]C[-2], "G"))=1, 1, 0) -> 1 | D816: =SUM(RC[-2]:R[+49]C[-2])*2 -> 54 | E816: =SUM(RC[-2]:R[+49]C[-2])*2 -> 8 | F816: =IF(AND(EQUAL(RC[-5], "G"), EQUAL(R[+1]C[-5], "A"), EQUAL(R[+2]C[-5], "T"), EQUAL(R[+3]C[-5], "C"))=1, 1, 0) -> 0
A817: 'G | B817: =IF(EQUAL(RC[-1], "G"), 1, IF(EQUAL(RC[-1], "C"), 1, 0)) -> 1 | C817: =IF(AND(EQUAL(RC[-2], "C"), EQUAL(R[+1]C[-2], "G"))=1, 1, 0) -> 0 | D817: =SUM(RC[-2]:R[+49]C[-2])*2 -> 54 | E817: =SUM(RC[-2]:R[+49]C[-2])*2 -> 6 | F817: =IF(AND(EQUAL(RC[-5], "G"), EQUAL(R[+1]C[-5], "A"), EQUAL(R[+2]C[-5], "T"), EQUAL(R[+3]C[-5], "C"))=1, 1, 0) -> 0
A818: 'A | B818: =IF(EQUAL(RC[-1], "G"), 1, IF(EQUAL(RC[-1], "C"), 1, 0)) -> 0 | C818: =IF(AND(EQUAL(RC[-2], "C"), EQUAL(R[+1]C[-2], "G"))=1, 1, 0) -> 0 | D818: =SUM(RC[-2]:R[+49]C[-2])*2 -> 52 | E818: =SUM(RC[-2]:R[+49]C[-2])*2 -> 6 | F818: =IF(AND(EQUAL(RC[-5], "G"), EQUAL(R[+1]C[-5], "A"), EQUAL(R[+2]C[-5], "T"), EQUAL(R[+3]C[-5], "C"))=1, 1, 0) -> 0
A819: 'A | B819: =IF(EQUAL(RC[-1], "G"), 1, IF(EQUAL(RC[-1], "C"), 1, 0)) -> 0 | C819: =IF(AND(EQUAL(RC[-2], "C"), EQUAL(R[+1]C[-2], "G"))=1, 1, 0) -> 0 | D819: =SUM(RC[-2]:R[+49]C[-2])*2 -> 54 | E819: =SUM(RC[-2]:R[+49]C[-2])*2 -> 6 | F819: =IF(AND(EQUAL(RC[-5], "G"), EQUAL(R[+1]C[-5], "A"), EQUAL(R[+2]C[-5], "T"), EQUAL(R[+3]C[-5], "C"))=1, 1, 0) -> 0
A820: 'G | B820: =IF(EQUAL(RC[-1], "G"), 1, IF(EQUAL(RC[-1], "C"), 1, 0)) -> 1 | C820: =IF(AND(EQUAL(RC[-2], "C"), EQUAL(R[+1]C[-2], "G"))=1, 1, 0) -> 0 | D820: =SUM(RC[-2]:R[+49]C[-2])*2 -> 56 | E820: =SUM(RC[-2]:R[+49]C[-2])*2 -> 8 | F820: =IF(AND(EQUAL(RC[-5], "G"), EQUAL(R[+1]C[-5], "A"), EQUAL(R[+2]C[-5], "T"), EQUAL(R[+3]C[-5], "C"))=1, 1, 0) -> 0
A821: 'A | B821: =IF(EQUAL(RC[-1], "G"), 1, IF(EQUAL(RC[-1], "C"), 1, 0)) -> 0 | C821: =IF(AND(EQUAL(RC[-2], "C"), EQUAL(R[+1]C[-2], "G"))=1, 1, 0) -> 0 | D821: =SUM(RC[-2]:R[+49]C[-2])*2 -> 56 | E821: =SUM(RC[-2]:R[+49]C[-2])*2 -> 8 | F821: =IF(AND(EQUAL(RC[-5], "G"), EQUAL(R[+1]C[-5], "A"), EQUAL(R[+2]C[-5], "T"), EQUAL(R[+3]C[-5], "C"))=1, 1, 0) -> 0
A822: 'C | B822: =IF(EQUAL(RC[-1], "G"), 1, IF(EQUAL(RC[-1], "C"), 1, 0)) -> 1 | C822: =IF(AND(EQUAL(RC[-2], "C"), EQUAL(R[+1]C[-2], "G"))=1, 1, 0) -> 1 | D822: =SUM(RC[-2]:R[+49]C[-2])*2 -> 58 | E822: =SUM(RC[-2]:R[+49]C[-2])*2 -> 8 | F822: =IF(AND(EQUAL(RC[-5], "G"), EQUAL(R[+1]C[-5], "A"), EQUAL(R[+2]C[-5], "T"), EQUAL(R[+3]C[-5], "C"))=1, 1, 0) -> 0
A823: 'G | B823: =IF(EQUAL(RC[-1], "G"), 1, IF(EQUAL(RC[-1], "C"), 1, 0)) -> 1 | C823: =IF(AND(EQUAL(RC[-2], "C"), EQUAL(R[+1]C[-2], "G"))=1, 1, 0) -> 0 | D823: =SUM(RC[-2]:R[+49]C[-2])*2 -> 58 | E823: =SUM(RC[-2]:R[+49]C[-2])*2 -> 6 | F823: =IF(AND(EQUAL(RC[-5], "G"), EQUAL(R[+1]C[-5], "A"), EQUAL(R[+2]C[-5], "T"), EQUAL(R[+3]C[-5], "C"))=1, 1, 0) -> 0
A824: 'A | B824: =IF(EQUAL(RC[-1], "G"), 1, IF(EQUAL(RC[-1], "C"), 1, 0)) -> 0 | C824: =IF(AND(EQUAL(RC[-2], "C"), EQUAL(R[+1]C[-2], "G"))=1, 1, 0) -> 0 | D824: =SUM(RC[-2]:R[+49]C[-2])*2 -> 56 | E824: =SUM(RC[-2]:R[+49]C[-2])*2 -> 6 | F824: =IF(AND(EQUAL(RC[-5], "G"), EQUAL(R[+1]C[-5], "A"), EQUAL(R[+2]C[-5], "T"), EQUAL(R[+3]C[-5], "C"))=1, 1, 0) -> 0
A825: 'G | B825: =IF(EQUAL(RC[-1], "G"), 1, IF(EQUAL(RC[-1], "C"), 1, 0)) -> 1 | C825: =IF(AND(EQUAL(RC[-2], "C"), EQUAL(R[+1]C[-2], "G"))=1, 1, 0) -> 0 | D825: =SUM(RC[-2]:R[+49]C[-2])*2 -> 58 | E825: =SUM(RC[-2]:R[+49]C[-2])*2 -> 6 | F825: =IF(AND(EQUAL(RC[-5], "G"), EQUAL(R[+1]C[-5], "A"), EQUAL(R[+2]C[-5], "T"), EQUAL(R[+3]C[-5], "C"))=1, 1, 0) -> 0
A826: 'C | B826: =IF(EQUAL(RC[-1], "G"), 1, IF(EQUAL(RC[-1], "C"), 1, 0)) -> 1 | C826: =IF(AND(EQUAL(RC[-2], "C"), EQUAL(R[+1]C[-2], "G"))=1, 1, 0) -> 1 | D826: =SUM(RC[-2]:R[+49]C[-2])*2 -> 58 | E826: =SUM(RC[-2]:R[+49]C[-2])*2 -> 6 | F826: =IF(AND(EQUAL(RC[-5], "G"), EQUAL(R[+1]C[-5], "A"), EQUAL(R[+2]C[-5], "T"), EQUAL(R[+3]C[-5], "C"))=1, 1, 0) -> 0
A827: 'G | B827: =IF(EQUAL(RC[-1], "G"), 1, IF(EQUAL(RC[-1], "C"), 1, 0)) -> 1 | C827: =IF(AND(EQUAL(RC[-2], "C"), EQUAL(R[+1]C[-2], "G"))=1, 1, 0) -> 0 | D827: =SUM(RC[-2]:R[+49]C[-2])*2 -> 56 | E827: =SUM(RC[-2]:R[+49]C[-2])*2 -> 4 | F827: =IF(AND(EQUAL(RC[-5], "G"), EQUAL(R[+1]C[-5], "A"), EQUAL(R[+2]C[-5], "T"), EQUAL(R[+3]C[-5], "C"))=1, 1, 0) -> 0
A828: 'T | B828: =IF(EQUAL(RC[-1], "G"), 1, IF(EQUAL(RC[-1], "C"), 1, 0)) -> 0 | C828: =IF(AND(EQUAL(RC[-2], "C"), EQUAL(R[+1]C[-2], "G"))=1, 1, 0) -> 0 | D828: =SUM(RC[-2]:R[+49]C[-2])*2 -> 54 | E828: =SUM(RC[-2]:R[+49]C[-2])*2 -> 4 | F828: =IF(AND(EQUAL(RC[-5], "G"), EQUAL(R[+1]C[-5], "A"), EQUAL(R[+2]C[-5], "T"), EQUAL(R[+3]C[-5], "C"))=1, 1, 0) -> 0
A829: 'T | B829: =IF(EQUAL(RC[-1], "G"), 1, IF(EQUAL(RC[-1], "C"), 1, 0)) -> 0 | C829: =IF(AND(EQUAL(RC[-2], "C"), EQUAL(R[+1]C[-2], "G"))=1, 1, 0) -> 0 | D829: =SUM(RC[-2]:R[+49]C[-2])*2 -> 56 | E829: =SUM(RC[-2]:R[+49]C[-2])*2 -> 4 | F829: =IF(AND(EQUAL(RC[-5], "G"), EQUAL(R[+1]C[-5], "A"), EQUAL(R[+2]C[-5], "T"), EQUAL(R[+3]C[-5], "C"))=1, 1, 0) -> 0
A830: 'G | B830: =IF(EQUAL(RC[-1], "G"), 1, IF(EQUAL(RC[-1], "C"), 1, 0)) -> 1 | C830: =IF(AND(EQUAL(RC[-2], "C"), EQUAL(R[+1]C[-2], "G"))=1, 1, 0) -> 0 | D830: =SUM(RC[-2]:R[+49]C[-2])*2 -> 58 | E830: =SUM(RC[-2]:R[+49]C[-2])*2 -> 4 | F830: =IF(AND(EQUAL(RC[-5], "G"), EQUAL(R[+1]C[-5], "A"), EQUAL(R[+2]C[-5], "T"), EQUAL(R[+3]C[-5], "C"))=1, 1, 0) -> 0
A831: 'G | B831: =IF(EQUAL(RC[-1], "G"), 1, IF(EQUAL(RC[-1], "C"), 1, 0)) -> 1 | C831: =IF(AND(EQUAL(RC[-2], "C"), EQUAL(R[+1]C[-2], "G"))=1, 1, 0) -> 0 | D831: =SUM(RC[-2]:R[+49]C[-2])*2 -> 56 | E831: =SUM(RC[-2]:R[+49]C[-2])*2 -> 4 | F831: =IF(AND(EQUAL(RC[-5], "G"), EQUAL(R[+1]C[-5], "A"), EQUAL(R[+2]C[-5], "T"), EQUAL(R[+3]C[-5], "C"))=1, 1, 0) -> 0
A832: 'A | B832: =IF(EQUAL(RC[-1], "G"), 1, IF(EQUAL(RC[-1], "C"), 1, 0)) -> 0 | C832: =IF(AND(EQUAL(RC[-2], "C"), EQUAL(R[+1]C[-2], "G"))=1, 1, 0) -> 0 | D832: =SUM(RC[-2]:R[+49]C[-2])*2 -> 56 | E832: =SUM(RC[-2]:R[+49]C[-2])*2 -> 6 | F832: =IF(AND(EQUAL(RC[-5], "G"), EQUAL(R[+1]C[-5], "A"), EQUAL(R[+2]C[-5], "T"), EQUAL(R[+3]C[-5], "C"))=1, 1, 0) -> 0
A833: 'C | B833: =IF(EQUAL(RC[-1], "G"), 1, IF(EQUAL(RC[-1], "C"), 1, 0)) -> 1 | C833: =IF(AND(EQUAL(RC[-2], "C"), EQUAL(R[+1]C[-2], "G"))=1, 1, 0) -> 0 | D833: =SUM(RC[-2]:R[+49]C[-2])*2 -> 58 | E833: =SUM(RC[-2]:R[+49]C[-2])*2 -> 6 | F833: =IF(AND(EQUAL(RC[-5], "G"), EQUAL(R[+1]C[-5], "A"), EQUAL(R[+2]C[-5], "T"), EQUAL(R[+3]C[-5], "C"))=1, 1, 0) -> 0
A834: 'T | B834: =IF(EQUAL(RC[-1], "G"), 1, IF(EQUAL(RC[-1], "C"), 1, 0)) -> 0 | C834: =IF(AND(EQUAL(RC[-2], "C"), EQUAL(R[+1]C[-2], "G"))=1, 1, 0) -> 0 | D834: =SUM(RC[-2]:R[+49]C[-2])*2 -> 58 | E834: =SUM(RC[-2]:R[+49]C[-2])*2 -> 6 | F834: =IF(AND(EQUAL(RC[-5], "G"), EQUAL(R[+1]C[-5], "A"), EQUAL(R[+2]C[-5], "T"), EQUAL(R[+3]C[-5], "C"))=1, 1, 0) -> 0
A835: 'T | B835: =IF(EQUAL(RC[-1], "G"), 1, IF(EQUAL(RC[-1], "C"), 1, 0)) -> 0 | C835: =IF(AND(EQUAL(RC[-2], "C"), EQUAL(R[+1]C[-2], "G"))=1, 1, 0) -> 0 | D835: =SUM(RC[-2]:R[+49]C[-2])*2 -> 60 | E835: =SUM(RC[-2]:R[+49]C[-2])*2 -> 6 | F835: =IF(AND(EQUAL(RC[-5], "G"), EQUAL(R[+1]C[-5], "A"), EQUAL(R[+2]C[-5], "T"), EQUAL(R[+3]C[-5], "C"))=1, 1, 0) -> 0
A836: 'A | B836: =IF(EQUAL(RC[-1], "G"), 1, IF(EQUAL(RC[-1], "C"), 1, 0)) -> 0 | C836: =IF(AND(EQUAL(RC[-2], "C"), EQUAL(R[+1]C[-2], "G"))=1, 1, 0) -> 0 | D836: =SUM(RC[-2]:R[+49]C[-2])*2 -> 60 | E836: =SUM(RC[-2]:R[+49]C[-2])*2 -> 6 | F836: =IF(AND(EQUAL(RC[-5], "G"), EQUAL(R[+1]C[-5], "A"), EQUAL(R[+2]C[-5], "T"), EQUAL(R[+3]C[-5], "C"))=1, 1, 0) -> 0
A837: 'C | B837: =IF(EQUAL(RC[-1], "G"), 1, IF(EQUAL(RC[-1], "C"), 1, 0)) -> 1 | C837: =IF(AND(EQUAL(RC[-2], "C"), EQUAL(R[+1]C[-2], "G"))=1, 1, 0) -> 0 | D837: =SUM(RC[-2]:R[+49]C[-2])*2 -> 62 | E837: =SUM(RC[-2]:R[+49]C[-2])*2 -> 6 | F837: =IF(AND(EQUAL(RC[-5], "G"), EQUAL(R[+1]C[-5], "A"), EQUAL(R[+2]C[-5], "T"), EQUAL(R[+3]C[-5], "C"))=1, 1, 0) -> 0
A838: 'C | B838: =IF(EQUAL(RC[-1], "G"), 1, IF(EQUAL(RC[-1], "C"), 1, 0)) -> 1 | C838: =IF(AND(EQUAL(RC[-2], "C"), EQUAL(R[+1]C[-2], "G"))=1, 1, 0) -> 0 | D838: =SUM(RC[-2]:R[+49]C[-2])*2 -> 60 | E838: =SUM(RC[-2]:R[+49]C[-2])*2 -> 6 | F838: =IF(AND(EQUAL(RC[-5], "G"), EQUAL(R[+1]C[-5], "A"), EQUAL(R[+2]C[-5], "T"), EQUAL(R[+3]C[-5], "C"))=1, 1, 0) -> 0
A839: 'T | B839: =IF(EQUAL(RC[-1], "G"), 1, IF(EQUAL(RC[-1], "C"), 1, 0)) -> 0 | C839: =IF(AND(EQUAL(RC[-2], "C"), EQUAL(R[+1]C[-2], "G"))=1, 1, 0) -> 0 | D839: =SUM(RC[-2]:R[+49]C[-2])*2 -> 60 | E839: =SUM(RC[-2]:R[+49]C[-2])*2 -> 6 | F839: =IF(AND(EQUAL(RC[-5], "G"), EQUAL(R[+1]C[-5], "A"), EQUAL(R[+2]C[-5], "T"), EQUAL(R[+3]C[-5], "C"))=1, 1, 0) -> 0
A840: 'C | B840: =IF(EQUAL(RC[-1], "G"), 1, IF(EQUAL(RC[-1], "C"), 1, 0)) -> 1 | C840: =IF(AND(EQUAL(RC[-2], "C"), EQUAL(R[+1]C[-2], "G"))=1, 1, 0) -> 0 | D840: =SUM(RC[-2]:R[+49]C[-2])*2 -> 62 | E840: =SUM(RC[-2]:R[+49]C[-2])*2 -> 8 | F840: =IF(AND(EQUAL(RC[-5], "G"), EQUAL(R[+1]C[-5], "A"), EQUAL(R[+2]C[-5], "T"), EQUAL(R[+3]C[-5], "C"))=1, 1, 0) -> 0
A841: 'A | B841: =IF(EQUAL(RC[-1], "G"), 1, IF(EQUAL(RC[-1], "C"), 1, 0)) -> 0 | C841: =IF(AND(EQUAL(RC[-2], "C"), EQUAL(R[+1]C[-2], "G"))=1, 1, 0) -> 0 | D841: =SUM(RC[-2]:R[+49]C[-2])*2 -> 62 | E841: =SUM(RC[-2]:R[+49]C[-2])*2 -> 8 | F841: =IF(AND(EQUAL(RC[-5], "G"), EQUAL(R[+1]C[-5], "A"), EQUAL(R[+2]C[-5], "T"), EQUAL(R[+3]C[-5], "C"))=1, 1, 0) -> 0
A842: 'C | B842: =IF(EQUAL(RC[-1], "G"), 1, IF(EQUAL(RC[-1], "C"), 1, 0)) -> 1 | C842: =IF(AND(EQUAL(RC[-2], "C"), EQUAL(R[+1]C[-2], "G"))=1, 1, 0) -> 0 | D842: =SUM(RC[-2]:R[+49]C[-2])*2 -> 64 | E842: =SUM(RC[-2]:R[+49]C[-2])*2 -> 8 | F842: =IF(AND(EQUAL(RC[-5], "G"), EQUAL(R[+1]C[-5], "A"), EQUAL(R[+2]C[-5], "T"), EQUAL(R[+3]C[-5], "C"))=1, 1, 0) -> 0
A843: 'T | B843: =IF(EQUAL(RC[-1], "G"), 1, IF(EQUAL(RC[-1], "C"), 1, 0)) -> 0 | C843: =IF(AND(EQUAL(RC[-2], "C"), EQUAL(R[+1]C[-2], "G"))=1, 1, 0) -> 0 | D843: =SUM(RC[-2]:R[+49]C[-2])*2 -> 62 | E843: =SUM(RC[-2]:R[+49]C[-2])*2 -> 8 | F843: =IF(AND(EQUAL(RC[-5], "G"), EQUAL(R[+1]C[-5], "A"), EQUAL(R[+2]C[-5], "T"), EQUAL(R[+3]C[-5], "C"))=1, 1, 0) -> 0
A844: 'G | B844: =IF(EQUAL(RC[-1], "G"), 1, IF(EQUAL(RC[-1], "C"), 1, 0)) -> 1 | C844: =IF(AND(EQUAL(RC[-2], "C"), EQUAL(R[+1]C[-2], "G"))=1, 1, 0) -> 0 | D844: =SUM(RC[-2]:R[+49]C[-2])*2 -> 62 | E844: =SUM(RC[-2]:R[+49]C[-2])*2 -> 8 | F844: =IF(AND(EQUAL(RC[-5], "G"), EQUAL(R[+1]C[-5], "A"), EQUAL(R[+2]C[-5], "T"), EQUAL(R[+3]C[-5], "C"))=1, 1, 0) -> 0
A845: 'C | B845: =IF(EQUAL(RC[-1], "G"), 1, IF(EQUAL(RC[-1], "C"), 1, 0)) -> 1 | C845: =IF(AND(EQUAL(RC[-2], "C"), EQUAL(R[+1]C[-2], "G"))=1, 1, 0) -> 0 | D845: =SUM(RC[-2]:R[+49]C[-2])*2 -> 60 | E845: =SUM(RC[-2]:R[+49]C[-2])*2 -> 8 | F845: =IF(AND(EQUAL(RC[-5], "G"), EQUAL(R[+1]C[-5], "A"), EQUAL(R[+2]C[-5], "T"), EQUAL(R[+3]C[-5], "C"))=1, 1, 0) -> 0
A846: 'T | B846: =IF(EQUAL(RC[-1], "G"), 1, IF(EQUAL(RC[-1], "C"), 1, 0)) -> 0 | C846: =IF(AND(EQUAL(RC[-2], "C"), EQUAL(R[+1]C[-2], "G"))=1, 1, 0) -> 0 | D846: =SUM(RC[-2]:R[+49]C[-2])*2 -> 58 | E846: =SUM(RC[-2]:R[+49]C[-2])*2 -> 8 | F846: =IF(AND(EQUAL(RC[-5], "G"), EQUAL(R[+1]C[-5], "A"), EQUAL(R[+2]C[-5], "T"), EQUAL(R[+3]C[-5], "C"))=1, 1, 0) -> 0
A847: 'T | B847: =IF(EQUAL(RC[-1], "G"), 1, IF(EQUAL(RC[-1], "C"), 1, 0)) -> 0 | C847: =IF(AND(EQUAL(RC[-2], "C"), EQUAL(R[+1]C[-2], "G"))=1, 1, 0) -> 0 | D847: =SUM(RC[-2]:R[+49]C[-2])*2 -> 60 | E847: =SUM(RC[-2]:R[+49]C[-2])*2 -> 8 | F847: =IF(AND(EQUAL(RC[-5], "G"), EQUAL(R[+1]C[-5], "A"), EQUAL(R[+2]C[-5], "T"), EQUAL(R[+3]C[-5], "C"))=1, 1, 0) -> 0
A848: 'T | B848: =IF(EQUAL(RC[-1], "G"), 1, IF(EQUAL(RC[-1], "C"), 1, 0)) -> 0 | C848: =IF(AND(EQUAL(RC[-2], "C"), EQUAL(R[+1]C[-2], "G"))=1, 1, 0) -> 0 | D848: =SUM(RC[-2]:R[+49]C[-2])*2 -> 62 | E848: =SUM(RC[-2]:R[+49]C[-2])*2 -> 8 | F848: =IF(AND(EQUAL(RC[-5], "G"), EQUAL(R[+1]C[-5], "A"), EQUAL(R[+2]C[-5], "T"), EQUAL(R[+3]C[-5], "C"))=1, 1, 0) -> 0
A849: 'T | B849: =IF(EQUAL(RC[-1], "G"), 1, IF(EQUAL(RC[-1], "C"), 1, 0)) -> 0 | C849: =IF(AND(EQUAL(RC[-2], "C"), EQUAL(R[+1]C[-2], "G"))=1, 1, 0) -> 0 | D849: =SUM(RC[-2]:R[+49]C[-2])*2 -> 64 | E849: =SUM(RC[-2]:R[+49]C[-2])*2 -> 10 | F849: =IF(AND(EQUAL(RC[-5], "G"), EQUAL(R[+1]C[-5], "A"), EQUAL(R[+2]C[-5], "T"), EQUAL(R[+3]C[-5], "C"))=1, 1, 0) -> 0
A850: 'C | B850: =IF(EQUAL(RC[-1], "G"), 1, IF(EQUAL(RC[-1], "C"), 1, 0)) -> 1 | C850: =IF(AND(EQUAL(RC[-2], "C"), EQUAL(R[+1]C[-2], "G"))=1, 1, 0) -> 0 | D850: =SUM(RC[-2]:R[+49]C[-2])*2 -> 66 | E850: =SUM(RC[-2]:R[+49]C[-2])*2 -> 10 | F850: =IF(AND(EQUAL(RC[-5], "G"), EQUAL(R[+1]C[-5], "A"), EQUAL(R[+2]C[-5], "T"), EQUAL(R[+3]C[-5], "C"))=1, 1, 0) -> 0
A851: 'T | B851: =IF(EQUAL(RC[-1], "G"), 1, IF(EQUAL(RC[-1], "C"), 1, 0)) -> 0 | C851: =IF(AND(EQUAL(RC[-2], "C"), EQUAL(R[+1]C[-2], "G"))=1, 1, 0) -> 0 | D851: =SUM(RC[-2]:R[+49]C[-2])*2 -> 66 | E851: =SUM(RC[-2]:R[+49]C[-2])*2 -> 12 | F851: =IF(AND(EQUAL(RC[-5], "G"), EQUAL(R[+1]C[-5], "A"), EQUAL(R[+2]C[-5], "T"), EQUAL(R[+3]C[-5], "C"))=1, 1, 0) -> 0
A852: 'A | B852: =IF(EQUAL(RC[-1], "G"), 1, IF(EQUAL(RC[-1], "C"), 1, 0)) -> 0 | C852: =IF(AND(EQUAL(RC[-2], "C"), EQUAL(R[+1]C[-2], "G"))=1, 1, 0) -> 0 | D852: =SUM(RC[-2]:R[+49]C[-2])*2 -> 68 | E852: =SUM(RC[-2]:R[+49]C[-2])*2 -> 12 | F852: =IF(AND(EQUAL(RC[-5], "G"), EQUAL(R[+1]C[-5], "A"), EQUAL(R[+2]C[-5], "T"), EQUAL(R[+3]C[-5], "C"))=1, 1, 0) -> 0
A853: 'G | B853: =IF(EQUAL(RC[-1], "G"), 1, IF(EQUAL(RC[-1], "C"), 1, 0)) -> 1 | C853: =IF(AND(EQUAL(RC[-2], "C"), EQUAL(R[+1]C[-2], "G"))=1, 1, 0) -> 0 | D853: =SUM(RC[-2]:R[+49]C[-2])*2 -> 68 | E853: =SUM(RC[-2]:R[+49]C[-2])*2 -> 12 | F853: =IF(AND(EQUAL(RC[-5], "G"), EQUAL(R[+1]C[-5], "A"), EQUAL(R[+2]C[-5], "T"), EQUAL(R[+3]C[-5], "C"))=1, 1, 0) -> 0
A854: 'C | B854: =IF(EQUAL(RC[-1], "G"), 1, IF(EQUAL(RC[-1], "C"), 1, 0)) -> 1 | C854: =IF(AND(EQUAL(RC[-2], "C"), EQUAL(R[+1]C[-2], "G"))=1, 1, 0) -> 1 | D854: =SUM(RC[-2]:R[+49]C[-2])*2 -> 68 | E854: =SUM(RC[-2]:R[+49]C[-2])*2 -> 12 | F854: =IF(AND(EQUAL(RC[-5], "G"), EQUAL(R[+1]C[-5], "A"), EQUAL(R[+2]C[-5], "T"), EQUAL(R[+3]C[-5], "C"))=1, 1, 0) -> 0
A855: 'G | B855: =IF(EQUAL(RC[-1], "G"), 1, IF(EQUAL(RC[-1], "C"), 1, 0)) -> 1 | C855: =IF(AND(EQUAL(RC[-2], "C"), EQUAL(R[+1]C[-2], "G"))=1, 1, 0) -> 0 | D855: =SUM(RC[-2]:R[+49]C[-2])*2 -> 68 | E855: =SUM(RC[-2]:R[+49]C[-2])*2 -> 10 | F855: =IF(AND(EQUAL(RC[-5], "G"), EQUAL(R[+1]C[-5], "A"), EQUAL(R[+2]C[-5], "T"), EQUAL(R[+3]C[-5], "C"))=1, 1, 0) -> 0
A856: 'G | B856: =IF(EQUAL(RC[-1], "G"), 1, IF(EQUAL(RC[-1], "C"), 1, 0)) -> 1 | C856: =IF(AND(EQUAL(RC[-2], "C"), EQUAL(R[+1]C[-2], "G"))=1, 1, 0) -> 0 | D856: =SUM(RC[-2]:R[+49]C[-2])*2 -> 68 | E856: =SUM(RC[-2]:R[+49]C[-2])*2 -> 12 | F856: =IF(AND(EQUAL(RC[-5], "G"), EQUAL(R[+1]C[-5], "A"), EQUAL(R[+2]C[-5], "T"), EQUAL(R[+3]C[-5], "C"))=1, 1, 0) -> 0
A857: 'T | B857: =IF(EQUAL(RC[-1], "G"), 1, IF(EQUAL(RC[-1], "C"), 1, 0)) -> 0 | C857: =IF(AND(EQUAL(RC[-2], "C"), EQUAL(R[+1]C[-2], "G"))=1, 1, 0) -> 0 | D857: =SUM(RC[-2]:R[+49]C[-2])*2 -> 68 | E857: =SUM(RC[-2]:R[+49]C[-2])*2 -> 12 | F857: =IF(AND(EQUAL(RC[-5], "G"), EQUAL(R[+1]C[-5], "A"), EQUAL(R[+2]C[-5], "T"), EQUAL(R[+3]C[-5], "C"))=1, 1, 0) -> 0
A858: 'A | B858: =IF(EQUAL(RC[-1], "G"), 1, IF(EQUAL(RC[-1], "C"), 1, 0)) -> 0 | C858: =IF(AND(EQUAL(RC[-2], "C"), EQUAL(R[+1]C[-2], "G"))=1, 1, 0) -> 0 | D858: =SUM(RC[-2]:R[+49]C[-2])*2 -> 68 | E858: =SUM(RC[-2]:R[+49]C[-2])*2 -> 12 | F858: =IF(AND(EQUAL(RC[-5], "G"), EQUAL(R[+1]C[-5], "A"), EQUAL(R[+2]C[-5], "T"), EQUAL(R[+3]C[-5], "C"))=1, 1, 0) -> 0
A859: 'G | B859: =IF(EQUAL(RC[-1], "G"), 1, IF(EQUAL(RC[-1], "C"), 1, 0)) -> 1 | C859: =IF(AND(EQUAL(RC[-2], "C"), EQUAL(R[+1]C[-2], "G"))=1, 1, 0) -> 0 | D859: =SUM(RC[-2]:R[+49]C[-2])*2 -> 70 | E859: =SUM(RC[-2]:R[+49]C[-2])*2 -> 12 | F859: =IF(AND(EQUAL(RC[-5], "G"), EQUAL(R[+1]C[-5], "A"), EQUAL(R[+2]C[-5], "T"), EQUAL(R[+3]C[-5], "C"))=1, 1, 0) -> 0
A860: 'C | B860: =IF(EQUAL(RC[-1], "G"), 1, IF(EQUAL(RC[-1], "C"), 1, 0)) -> 1 | C860: =IF(AND(EQUAL(RC[-2], "C"), EQUAL(R[+1]C[-2], "G"))=1, 1, 0) -> 0 | D860: =SUM(RC[-2]:R[+49]C[-2])*2 -> 70 | E860: =SUM(RC[-2]:R[+49]C[-2])*2 -> 14 | F860: =IF(AND(EQUAL(RC[-5], "G"), EQUAL(R[+1]C[-5], "A"), EQUAL(R[+2]C[-5], "T"), EQUAL(R[+3]C[-5], "C"))=1, 1, 0) -> 0
A861: 'A | B861: =IF(EQUAL(RC[-1], "G"), 1, IF(EQUAL(RC[-1], "C"), 1, 0)) -> 0 | C861: =IF(AND(EQUAL(RC[-2], "C"), EQUAL(R[+1]C[-2], "G"))=1, 1, 0) -> 0 | D861: =SUM(RC[-2]:R[+49]C[-2])*2 -> 70 | E861: =SUM(RC[-2]:R[+49]C[-2])*2 -> 14 | F861: =IF(AND(EQUAL(RC[-5], "G"), EQUAL(R[+1]C[-5], "A"), EQUAL(R[+2]C[-5], "T"), EQUAL(R[+3]C[-5], "C"))=1, 1, 0) -> 0
A862: 'C | B862: =IF(EQUAL(RC[-1], "G"), 1, IF(EQUAL(RC[-1], "C"), 1, 0)) -> 1 | C862: =IF(AND(EQUAL(RC[-2], "C"), EQUAL(R[+1]C[-2], "G"))=1, 1, 0) -> 0 | D862: =SUM(RC[-2]:R[+49]C[-2])*2 -> 72 | E862: =SUM(RC[-2]:R[+49]C[-2])*2 -> 14 | F862: =IF(AND(EQUAL(RC[-5], "G"), EQUAL(R[+1]C[-5], "A"), EQUAL(R[+2]C[-5], "T"), EQUAL(R[+3]C[-5], "C"))=1, 1, 0) -> 0
A863: 'C | B863: =IF(EQUAL(RC[-1], "G"), 1, IF(EQUAL(RC[-1], "C"), 1, 0)) -> 1 | C863: =IF(AND(EQUAL(RC[-2], "C"), EQUAL(R[+1]C[-2], "G"))=1, 1, 0) -> 0 | D863: =SUM(RC[-2]:R[+49]C[-2])*2 -> 70 | E863: =SUM(RC[-2]:R[+49]C[-2])*2 -> 14 | F863: =IF(AND(EQUAL(RC[-5], "G"), EQUAL(R[+1]C[-5], "A"), EQUAL(R[+2]C[-5], "T"), EQUAL(R[+3]C[-5], "C"))=1, 1, 0) -> 0
A864: 'T | B864: =IF(EQUAL(RC[-1], "G"), 1, IF(EQUAL(RC[-1], "C"), 1, 0)) -> 0 | C864: =IF(AND(EQUAL(RC[-2], "C"), EQUAL(R[+1]C[-2], "G"))=1, 1, 0) -> 0 | D864: =SUM(RC[-2]:R[+49]C[-2])*2 -> 68 | E864: =SUM(RC[-2]:R[+49]C[-2])*2 -> 14 | F864: =IF(AND(EQUAL(RC[-5], "G"), EQUAL(R[+1]C[-5], "A"), EQUAL(R[+2]C[-5], "T"), EQUAL(R[+3]C[-5], "C"))=1, 1, 0) -> 0
A865: 'C | B865: =IF(EQUAL(RC[-1], "G"), 1, IF(EQUAL(RC[-1], "C"), 1, 0)) -> 1 | C865: =IF(AND(EQUAL(RC[-2], "C"), EQUAL(R[+1]C[-2], "G"))=1, 1, 0) -> 0 | D865: =SUM(RC[-2]:R[+49]C[-2])*2 -> 70 | E865: =SUM(RC[-2]:R[+49]C[-2])*2 -> 14 | F865: =IF(AND(EQUAL(RC[-5], "G"), EQUAL(R[+1]C[-5], "A"), EQUAL(R[+2]C[-5], "T"), EQUAL(R[+3]C[-5], "C"))=1, 1, 0) -> 0
A866: 'C | B866: =IF(EQUAL(RC[-1], "G"), 1, IF(EQUAL(RC[-1], "C"), 1, 0)) -> 1 | C866: =IF(AND(EQUAL(RC[-2], "C"), EQUAL(R[+1]C[-2], "G"))=1, 1, 0) -> 0 | D866: =SUM(RC[-2]:R[+49]C[-2])*2 -> 68 | E866: =SUM(RC[-2]:R[+49]C[-2])*2 -> 14 | F866: =IF(AND(EQUAL(RC[-5], "G"), EQUAL(R[+1]C[-5], "A"), EQUAL(R[+2]C[-5], "T"), EQUAL(R[+3]C[-5], "C"))=1, 1, 0) -> 0
A867: 'T | B867: =IF(EQUAL(RC[-1], "G"), 1, IF(EQUAL(RC[-1], "C"), 1, 0)) -> 0 | C867: =IF(AND(EQUAL(RC[-2], "C"), EQUAL(R[+1]C[-2], "G"))=1, 1, 0) -> 0 | D867: =SUM(RC[-2]:R[+49]C[-2])*2 -> 68 | E867: =SUM(RC[-2]:R[+49]C[-2])*2 -> 14 | F867: =IF(AND(EQUAL(RC[-5], "G"), EQUAL(R[+1]C[-5], "A"), EQUAL(R[+2]C[-5], "T"), EQUAL(R[+3]C[-5], "C"))=1, 1, 0) -> 0
A868: 'C | B868: =IF(EQUAL(RC[-1], "G"), 1, IF(EQUAL(RC[-1], "C"), 1, 0)) -> 1 | C868: =IF(AND(EQUAL(RC[-2], "C"), EQUAL(R[+1]C[-2], "G"))=1, 1, 0) -> 0 | D868: =SUM(RC[-2]:R[+49]C[-2])*2 -> 68 | E868: =SUM(RC[-2]:R[+49]C[-2])*2 -> 14 | F868: =IF(AND(EQUAL(RC[-5], "G"), EQUAL(R[+1]C[-5], "A"), EQUAL(R[+2]C[-5], "T"), EQUAL(R[+3]C[-5], "C"))=1, 1, 0) -> 0
A869: 'C | B869: =IF(EQUAL(RC[-1], "G"), 1, IF(EQUAL(RC[-1], "C"), 1, 0)) -> 1 | C869: =IF(AND(EQUAL(RC[-2], "C"), EQUAL(R[+1]C[-2], "G"))=1, 1, 0) -> 1 | D869: =SUM(RC[-2]:R[+49]C[-2])*2 -> 68 | E869: =SUM(RC[-2]:R[+49]C[-2])*2 -> 14 | F869: =IF(AND(EQUAL(RC[-5], "G"), EQUAL(R[+1]C[-5], "A"), EQUAL(R[+2]C[-5], "T"), EQUAL(R[+3]C[-5], "C"))=1, 1, 0) -> 0
A870: 'G | B870: =IF(EQUAL(RC[-1], "G"), 1, IF(EQUAL(RC[-1], "C"), 1, 0)) -> 1 | C870: =IF(AND(EQUAL(RC[-2], "C"), EQUAL(R[+1]C[-2], "G"))=1, 1, 0) -> 0 | D870: =SUM(RC[-2]:R[+49]C[-2])*2 -> 66 | E870: =SUM(RC[-2]:R[+49]C[-2])*2 -> 12 | F870: =IF(AND(EQUAL(RC[-5], "G"), EQUAL(R[+1]C[-5], "A"), EQUAL(R[+2]C[-5], "T"), EQUAL(R[+3]C[-5], "C"))=1, 1, 0) -> 0
A871: 'C | B871: =IF(EQUAL(RC[-1], "G"), 1, IF(EQUAL(RC[-1], "C"), 1, 0)) -> 1 | C871: =IF(AND(EQUAL(RC[-2], "C"), EQUAL(R[+1]C[-2], "G"))=1, 1, 0) -> 0 | D871: =SUM(RC[-2]:R[+49]C[-2])*2 -> 64 | E871: =SUM(RC[-2]:R[+49]C[-2])*2 -> 12 | F871: =IF(AND(EQUAL(RC[-5], "G"), EQUAL(R[+1]C[-5], "A"), EQUAL(R[+2]C[-5], "T"), EQUAL(R[+3]C[-5], "C"))=1, 1, 0) -> 0
A872: 'C | B872: =IF(EQUAL(RC[-1], "G"), 1, IF(EQUAL(RC[-1], "C"), 1, 0)) -> 1 | C872: =IF(AND(EQUAL(RC[-2], "C"), EQUAL(R[+1]C[-2], "G"))=1, 1, 0) -> 0 | D872: =SUM(RC[-2]:R[+49]C[-2])*2 -> 64 | E872: =SUM(RC[-2]:R[+49]C[-2])*2 -> 12 | F872: =IF(AND(EQUAL(RC[-5], "G"), EQUAL(R[+1]C[-5], "A"), EQUAL(R[+2]C[-5], "T"), EQUAL(R[+3]C[-5], "C"))=1, 1, 0) -> 0
A873: 'A | B873: =IF(EQUAL(RC[-1], "G"), 1, IF(EQUAL(RC[-1], "C"), 1, 0)) -> 0 | C873: =IF(AND(EQUAL(RC[-2], "C"), EQUAL(R[+1]C[-2], "G"))=1, 1, 0) -> 0 | D873: =SUM(RC[-2]:R[+49]C[-2])*2 -> 62 | E873: =SUM(RC[-2]:R[+49]C[-2])*2 -> 12 | F873: =IF(AND(EQUAL(RC[-5], "G"), EQUAL(R[+1]C[-5], "A"), EQUAL(R[+2]C[-5], "T"), EQUAL(R[+3]C[-5], "C"))=1, 1, 0) -> 0
A874: 'G | B874: =IF(EQUAL(RC[-1], "G"), 1, IF(EQUAL(RC[-1], "C"), 1, 0)) -> 1 | C874: =IF(AND(EQUAL(RC[-2], "C"), EQUAL(R[+1]C[-2], "G"))=1, 1, 0) -> 0 | D874: =SUM(RC[-2]:R[+49]C[-2])*2 -> 64 | E874: =SUM(RC[-2]:R[+49]C[-2])*2 -> 14 | F874: =IF(AND(EQUAL(RC[-5], "G"), EQUAL(R[+1]C[-5], "A"), EQUAL(R[+2]C[-5], "T"), EQUAL(R[+3]C[-5], "C"))=1, 1, 0) -> 0
A875: 'C | B875: =IF(EQUAL(RC[-1], "G"), 1, IF(EQUAL(RC[-1], "C"), 1, 0)) -> 1 | C875: =IF(AND(EQUAL(RC[-2], "C"), EQUAL(R[+1]C[-2], "G"))=1, 1, 0) -> 0 | D875: =SUM(RC[-2]:R[+49]C[-2])*2 -> 64 | E875: =SUM(RC[-2]:R[+49]C[-2])*2 -> 14 | F875: =IF(AND(EQUAL(RC[-5], "G"), EQUAL(R[+1]C[-5], "A"), EQUAL(R[+2]C[-5], "T"), EQUAL(R[+3]C[-5], "C"))=1, 1, 0) -> 0
A876: 'T | B876: =IF(EQUAL(RC[-1], "G"), 1, IF(EQUAL(RC[-1], "C"), 1, 0)) -> 0 | C876: =IF(AND(EQUAL(RC[-2], "C"), EQUAL(R[+1]C[-2], "G"))=1, 1, 0) -> 0 | D876: =SUM(RC[-2]:R[+49]C[-2])*2 -> 62 | E876: =SUM(RC[-2]:R[+49]C[-2])*2 -> 14 | F876: =IF(AND(EQUAL(RC[-5], "G"), EQUAL(R[+1]C[-5], "A"), EQUAL(R[+2]C[-5], "T"), EQUAL(R[+3]C[-5], "C"))=1, 1, 0) -> 0
A877: 'T | B877: =IF(EQUAL(RC[-1], "G"), 1, IF(EQUAL(RC[-1], "C"), 1, 0)) -> 0 | C877: =IF(AND(EQUAL(RC[-2], "C"), EQUAL(R[+1]C[-2], "G"))=1, 1, 0) -> 0 | D877: =SUM(RC[-2]:R[+49]C[-2])*2 -> 64 | E877: =SUM(RC[-2]:R[+49]C[-2])*2 -> 14 | F877: =IF(AND(EQUAL(RC[-5], "G"), EQUAL(R[+1]C[-5], "A"), EQUAL(R[+2]C[-5], "T"), EQUAL(R[+3]C[-5], "C"))=1, 1, 0) -> 0
A878: 'C | B878: =IF(EQUAL(RC[-1], "G"), 1, IF(EQUAL(RC[-1], "C"), 1, 0)) -> 1 | C878: =IF(AND(EQUAL(RC[-2], "C"), EQUAL(R[+1]C[-2], "G"))=1, 1, 0) -> 0 | D878: =SUM(RC[-2]:R[+49]C[-2])*2 -> 66 | E878: =SUM(RC[-2]:R[+49]C[-2])*2 -> 14 | F878: =IF(AND(EQUAL(RC[-5], "G"), EQUAL(R[+1]C[-5], "A"), EQUAL(R[+2]C[-5], "T"), EQUAL(R[+3]C[-5], "C"))=1, 1, 0) -> 0
A879: 'C | B879: =IF(EQUAL(RC[-1], "G"), 1, IF(EQUAL(RC[-1], "C"), 1, 0)) -> 1 | C879: =IF(AND(EQUAL(RC[-2], "C"), EQUAL(R[+1]C[-2], "G"))=1, 1, 0) -> 0 | D879: =SUM(RC[-2]:R[+49]C[-2])*2 -> 64 | E879: =SUM(RC[-2]:R[+49]C[-2])*2 -> 14 | F879: =IF(AND(EQUAL(RC[-5], "G"), EQUAL(R[+1]C[-5], "A"), EQUAL(R[+2]C[-5], "T"), EQUAL(R[+3]C[-5], "C"))=1, 1, 0) -> 0
A880: 'T | B880: =IF(EQUAL(RC[-1], "G"), 1, IF(EQUAL(RC[-1], "C"), 1, 0)) -> 0 | C880: =IF(AND(EQUAL(RC[-2], "C"), EQUAL(R[+1]C[-2], "G"))=1, 1, 0) -> 0 | D880: =SUM(RC[-2]:R[+49]C[-2])*2 -> 64 | E880: =SUM(RC[-2]:R[+49]C[-2])*2 -> 14 | F880: =IF(AND(EQUAL(RC[-5], "G"), EQUAL(R[+1]C[-5], "A"), EQUAL(R[+2]C[-5], "T"), EQUAL(R[+3]C[-5], "C"))=1, 1, 0) -> 0
A881: 'C | B881: =IF(EQUAL(RC[-1], "G"), 1, IF(EQUAL(RC[-1], "C"), 1, 0)) -> 1 | C881: =IF(AND(EQUAL(RC[-2], "C"), EQUAL(R[+1]C[-2], "G"))=1, 1, 0) -> 1 | D881: =SUM(RC[-2]:R[+49]C[-2])*2 -> 64 | E881: =SUM(RC[-2]:R[+49]C[-2])*2 -> 14 | F881: =IF(AND(EQUAL(RC[-5], "G"), EQUAL(R[+1]C[-5], "A"), EQUAL(R[+2]C[-5], "T"), EQUAL(R[+3]C[-5], "C"))=1, 1, 0) -> 0
A882: 'G | B882: =IF(EQUAL(RC[-1], "G"), 1, IF(EQUAL(RC[-1], "C"), 1, 0)) -> 1 | C882: =IF(AND(EQUAL(RC[-2], "C"), EQUAL(R[+1]C[-2], "G"))=1, 1, 0) -> 0 | D882: =SUM(RC[-2]:R[+49]C[-2])*2 -> 64 | E882: =SUM(RC[-2]:R[+49]C[-2])*2 -> 12 | F882: =IF(AND(EQUAL(RC[-5], "G"), EQUAL(R[+1]C[-5], "A"), EQUAL(R[+2]C[-5], "T"), EQUAL(R[+3]C[-5], "C"))=1, 1, 0) -> 0
A883: 'G | B883: =IF(EQUAL(RC[-1], "G"), 1, IF(EQUAL(RC[-1], "C"), 1, 0)) -> 1 | C883: =IF(AND(EQUAL(RC[-2], "C"), EQUAL(R[+1]C[-2], "G"))=1, 1, 0) -> 0 | D883: =SUM(RC[-2]:R[+49]C[-2])*2 -> 62 | E883: =SUM(RC[-2]:R[+49]C[-2])*2 -> 12 | F883: =IF(AND(EQUAL(RC[-5], "G"), EQUAL(R[+1]C[-5], "A"), EQUAL(R[+2]C[-5], "T"), EQUAL(R[+3]C[-5], "C"))=1, 1, 0) -> 0
A884: 'G | B884: =IF(EQUAL(RC[-1], "G"), 1, IF(EQUAL(RC[-1], "C"), 1, 0)) -> 1 | C884: =IF(AND(EQUAL(RC[-2], "C"), EQUAL(R[+1]C[-2], "G"))=1, 1, 0) -> 0 | D884: =SUM(RC[-2]:R[+49]C[-2])*2 -> 62 | E884: =SUM(RC[-2]:R[+49]C[-2])*2 -> 12 | F884: =IF(AND(EQUAL(RC[-5], "G"), EQUAL(R[+1]C[-5], "A"), EQUAL(R[+2]C[-5], "T"), EQUAL(R[+3]C[-5], "C"))=1, 1, 0) -> 0
A885: 'A | B885: =IF(EQUAL(RC[-1], "G"), 1, IF(EQUAL(RC[-1], "C"), 1, 0)) -> 0 | C885: =IF(AND(EQUAL(RC[-2], "C"), EQUAL(R[+1]C[-2], "G"))=1, 1, 0) -> 0 | D885: =SUM(RC[-2]:R[+49]C[-2])*2 -> 62 | E885: =SUM(RC[-2]:R[+49]C[-2])*2 -> 12 | F885: =IF(AND(EQUAL(RC[-5], "G"), EQUAL(R[+1]C[-5], "A"), EQUAL(R[+2]C[-5], "T"), EQUAL(R[+3]C[-5], "C"))=1, 1, 0) -> 0
A886: 'G | B886: =IF(EQUAL(RC[-1], "G"), 1, IF(EQUAL(RC[-1], "C"), 1, 0)) -> 1 | C886: =IF(AND(EQUAL(RC[-2], "C"), EQUAL(R[+1]C[-2], "G"))=1, 1, 0) -> 0 | D886: =SUM(RC[-2]:R[+49]C[-2])*2 -> 64 | E886: =SUM(RC[-2]:R[+49]C[-2])*2 -> 12 | F886: =IF(AND(EQUAL(RC[-5], "G"), EQUAL(R[+1]C[-5], "A"), EQUAL(R[+2]C[-5], "T"), EQUAL(R[+3]C[-5], "C"))=1, 1, 0) -> 0
A887: 'A | B887: =IF(EQUAL(RC[-1], "G"), 1, IF(EQUAL(RC[-1], "C"), 1, 0)) -> 0 | C887: =IF(AND(EQUAL(RC[-2], "C"), EQUAL(R[+1]C[-2], "G"))=1, 1, 0) -> 0 | D887: =SUM(RC[-2]:R[+49]C[-2])*2 -> 62 | E887: =SUM(RC[-2]:R[+49]C[-2])*2 -> 12 | F887: =IF(AND(EQUAL(RC[-5], "G"), EQUAL(R[+1]C[-5], "A"), EQUAL(R[+2]C[-5], "T"), EQUAL(R[+3]C[-5], "C"))=1, 1, 0) -> 0
A888: 'C | B888: =IF(EQUAL(RC[-1], "G"), 1, IF(EQUAL(RC[-1], "C"), 1, 0)) -> 1 | C888: =IF(AND(EQUAL(RC[-2], "C"), EQUAL(R[+1]C[-2], "G"))=1, 1, 0) -> 0 | D888: =SUM(RC[-2]:R[+49]C[-2])*2 -> 64 | E888: =SUM(RC[-2]:R[+49]C[-2])*2 -> 12 | F888: =IF(AND(EQUAL(RC[-5], "G"), EQUAL(R[+1]C[-5], "A"), EQUAL(R[+2]C[-5], "T"), EQUAL(R[+3]C[-5], "C"))=1, 1, 0) -> 0
A889: 'C | B889: =IF(EQUAL(RC[-1], "G"), 1, IF(EQUAL(RC[-1], "C"), 1, 0)) -> 1 | C889: =IF(AND(EQUAL(RC[-2], "C"), EQUAL(R[+1]C[-2], "G"))=1, 1, 0) -> 1 | D889: =SUM(RC[-2]:R[+49]C[-2])*2 -> 64 | E889: =SUM(RC[-2]:R[+49]C[-2])*2 -> 14 | F889: =IF(AND(EQUAL(RC[-5], "G"), EQUAL(R[+1]C[-5], "A"), EQUAL(R[+2]C[-5], "T"), EQUAL(R[+3]C[-5], "C"))=1, 1, 0) -> 0
A890: 'G | B890: =IF(EQUAL(RC[-1], "G"), 1, IF(EQUAL(RC[-1], "C"), 1, 0)) -> 1 | C890: =IF(AND(EQUAL(RC[-2], "C"), EQUAL(R[+1]C[-2], "G"))=1, 1, 0) -> 0 | D890: =SUM(RC[-2]:R[+49]C[-2])*2 -> 64 | E890: =SUM(RC[-2]:R[+49]C[-2])*2 -> 12 | F890: =IF(AND(EQUAL(RC[-5], "G"), EQUAL(R[+1]C[-5], "A"), EQUAL(R[+2]C[-5], "T"), EQUAL(R[+3]C[-5], "C"))=1, 1, 0) -> 0
A891: 'C | B891: =IF(EQUAL(RC[-1], "G"), 1, IF(EQUAL(RC[-1], "C"), 1, 0)) -> 1 | C891: =IF(AND(EQUAL(RC[-2], "C"), EQUAL(R[+1]C[-2], "G"))=1, 1, 0) -> 0 | D891: =SUM(RC[-2]:R[+49]C[-2])*2 -> 62 | E891: =SUM(RC[-2]:R[+49]C[-2])*2 -> 12 | F891: =IF(AND(EQUAL(RC[-5], "G"), EQUAL(R[+1]C[-5], "A"), EQUAL(R[+2]C[-5], "T"), EQUAL(R[+3]C[-5], "C"))=1, 1, 0) -> 0
A892: 'T | B892: =IF(EQUAL(RC[-1], "G"), 1, IF(EQUAL(RC[-1], "C"), 1, 0)) -> 0 | C892: =IF(AND(EQUAL(RC[-2], "C"), EQUAL(R[+1]C[-2], "G"))=1, 1, 0) -> 0 | D892: =SUM(RC[-2]:R[+49]C[-2])*2 -> 62 | E892: =SUM(RC[-2]:R[+49]C[-2])*2 -> 14 | F892: =IF(AND(EQUAL(RC[-5], "G"), EQUAL(R[+1]C[-5], "A"), EQUAL(R[+2]C[-5], "T"), EQUAL(R[+3]C[-5], "C"))=1, 1, 0) -> 0
A893: 'T | B893: =IF(EQUAL(RC[-1], "G"), 1, IF(EQUAL(RC[-1], "C"), 1, 0)) -> 0 | C893: =IF(AND(EQUAL(RC[-2], "C"), EQUAL(R[+1]C[-2], "G"))=1, 1, 0) -> 0 | D893: =SUM(RC[-2]:R[+49]C[-2])*2 -> 64 | E893: =SUM(RC[-2]:R[+49]C[-2])*2 -> 14 | F893: =IF(AND(EQUAL(RC[-5], "G"), EQUAL(R[+1]C[-5], "A"), EQUAL(R[+2]C[-5], "T"), EQUAL(R[+3]C[-5], "C"))=1, 1, 0) -> 0
A894: 'T | B894: =IF(EQUAL(RC[-1], "G"), 1, IF(EQUAL(RC[-1], "C"), 1, 0)) -> 0 | C894: =IF(AND(EQUAL(RC[-2], "C"), EQUAL(R[+1]C[-2], "G"))=1, 1, 0) -> 0 | D894: =SUM(RC[-2]:R[+49]C[-2])*2 -> 64 | E894: =SUM(RC[-2]:R[+49]C[-2])*2 -> 14 | F894: =IF(AND(EQUAL(RC[-5], "G"), EQUAL(R[+1]C[-5], "A"), EQUAL(R[+2]C[-5], "T"), EQUAL(R[+3]C[-5], "C"))=1, 1, 0) -> 0
A895: 'T | B895: =IF(EQUAL(RC[-1], "G"), 1, IF(EQUAL(RC[-1], "C"), 1, 0)) -> 0 | C895: =IF(AND(EQUAL(RC[-2], "C"), EQUAL(R[+1]C[-2], "G"))=1, 1, 0) -> 0 | D895: =SUM(RC[-2]:R[+49]C[-2])*2 -> 66 | E895: =SUM(RC[-2]:R[+49]C[-2])*2 -> 14 | F895: =IF(AND(EQUAL(RC[-5], "G"), EQUAL(R[+1]C[-5], "A"), EQUAL(R[+2]C[-5], "T"), EQUAL(R[+3]C[-5], "C"))=1, 1, 0) -> 0
A896: 'C | B896: =IF(EQUAL(RC[-1], "G"), 1, IF(EQUAL(RC[-1], "C"), 1, 0)) -> 1 | C896: =IF(AND(EQUAL(RC[-2], "C"), EQUAL(R[+1]C[-2], "G"))=1, 1, 0) -> 0 | D896: =SUM(RC[-2]:R[+49]C[-2])*2 -> 66 | E896: =SUM(RC[-2]:R[+49]C[-2])*2 -> 14 | F896: =IF(AND(EQUAL(RC[-5], "G"), EQUAL(R[+1]C[-5], "A"), EQUAL(R[+2]C[-5], "T"), EQUAL(R[+3]C[-5], "C"))=1, 1, 0) -> 0
A897: 'C | B897: =IF(EQUAL(RC[-1], "G"), 1, IF(EQUAL(RC[-1], "C"), 1, 0)) -> 1 | C897: =IF(AND(EQUAL(RC[-2], "C"), EQUAL(R[+1]C[-2], "G"))=1, 1, 0) -> 0 | D897: =SUM(RC[-2]:R[+49]C[-2])*2 -> #EMPTY! | E897: =SUM(RC[-2]:R[+49]C[-2])*2 -> #EMPTY! | F897: =IF(AND(EQUAL(RC[-5], "G"), EQUAL(R[+1]C[-5], "A"), EQUAL(R[+2]C[-5], "T"), EQUAL(R[+3]C[-5], "C"))=1, 1, 0) -> 0
A898: 'C | B898: =IF(EQUAL(RC[-1], "G"), 1, IF(EQUAL(RC[-1], "C"), 1, 0)) -> 1 | C898: =IF(AND(EQUAL(RC[-2], "C"), EQUAL(R[+1]C[-2], "G"))=1, 1, 0) -> 1 | D898: =SUM(RC[-2]:R[+49]C[-2])*2 -> #EMPTY! | E898: =SUM(RC[-2]:R[+49]C[-2])*2 -> #EMPTY! | F898: =IF(AND(EQUAL(RC[-5], "G"), EQUAL(R[+1]C[-5], "A"), EQUAL(R[+2]C[-5], "T"), EQUAL(R[+3]C[-5], "C"))=1, 1, 0) -> 0
A899: 'G | B899: =IF(EQUAL(RC[-1], "G"), 1, IF(EQUAL(RC[-1], "C"), 1, 0)) -> 1 | C899: =IF(AND(EQUAL(RC[-2], "C"), EQUAL(R[+1]C[-2], "G"))=1, 1, 0) -> 0 | D899: =SUM(RC[-2]:R[+49]C[-2])*2 -> #EMPTY! | E899: =SUM(RC[-2]:R[+49]C[-2])*2 -> #EMPTY! | F899: =IF(AND(EQUAL(RC[-5], "G"), EQUAL(R[+1]C[-5], "A"), EQUAL(R[+2]C[-5], "T"), EQUAL(R[+3]C[-5], "C"))=1, 1, 0) -> 0
A900: 'C | B900: =IF(EQUAL(RC[-1], "G"), 1, IF(EQUAL(RC[-1], "C"), 1, 0)) -> 1 | C900: =IF(AND(EQUAL(RC[-2], "C"), EQUAL(R[+1]C[-2], "G"))=1, 1, 0) -> 1 | D900: =SUM(RC[-2]:R[+49]C[-2])*2 -> #EMPTY! | E900: =SUM(RC[-2]:R[+49]C[-2])*2 -> #EMPTY! | F900: =IF(AND(EQUAL(RC[-5], "G"), EQUAL(R[+1]C[-5], "A"), EQUAL(R[+2]C[-5], "T"), EQUAL(R[+3]C[-5], "C"))=1, 1, 0) -> 0
A901: 'G | B901: =IF(EQUAL(RC[-1], "G"), 1, IF(EQUAL(RC[-1], "C"), 1, 0)) -> 1 | C901: =IF(AND(EQUAL(RC[-2], "C"), EQUAL(R[+1]C[-2], "G"))=1, 1, 0) -> 0 | D901: =SUM(RC[-2]:R[+49]C[-2])*2 -> #EMPTY! | E901: =SUM(RC[-2]:R[+49]C[-2])*2 -> #EMPTY! | F901: =IF(AND(EQUAL(RC[-5], "G"), EQUAL(R[+1]C[-5], "A"), EQUAL(R[+2]C[-5], "T"), EQUAL(R[+3]C[-5], "C"))=1, 1, 0) -> 0
A902: 'A | B902: =IF(EQUAL(RC[-1], "G"), 1, IF(EQUAL(RC[-1], "C"), 1, 0)) -> 0 | C902: =IF(AND(EQUAL(RC[-2], "C"), EQUAL(R[+1]C[-2], "G"))=1, 1, 0) -> 0 | D902: =SUM(RC[-2]:R[+49]C[-2])*2 -> #EMPTY! | E902: =SUM(RC[-2]:R[+49]C[-2])*2 -> #EMPTY! | F902: =IF(AND(EQUAL(RC[-5], "G"), EQUAL(R[+1]C[-5], "A"), EQUAL(R[+2]C[-5], "T"), EQUAL(R[+3]C[-5], "C"))=1, 1, 0) -> 0
A903: 'G | B903: =IF(EQUAL(RC[-1], "G"), 1, IF(EQUAL(RC[-1], "C"), 1, 0)) -> 1 | C903: =IF(AND(EQUAL(RC[-2], "C"), EQUAL(R[+1]C[-2], "G"))=1, 1, 0) -> 0 | D903: =SUM(RC[-2]:R[+49]C[-2])*2 -> #EMPTY! | E903: =SUM(RC[-2]:R[+49]C[-2])*2 -> #EMPTY! | F903: =IF(AND(EQUAL(RC[-5], "G"), EQUAL(R[+1]C[-5], "A"), EQUAL(R[+2]C[-5], "T"), EQUAL(R[+3]C[-5], "C"))=1, 1, 0) -> 0
A904: 'C | B904: =IF(EQUAL(RC[-1], "G"), 1, IF(EQUAL(RC[-1], "C"), 1, 0)) -> 1 | C904: =IF(AND(EQUAL(RC[-2], "C"), EQUAL(R[+1]C[-2], "G"))=1, 1, 0) -> 0 | D904: =SUM(RC[-2]:R[+49]C[-2])*2 -> #EMPTY! | E904: =SUM(RC[-2]:R[+49]C[-2])*2 -> #EMPTY! | F904: =IF(AND(EQUAL(RC[-5], "G"), EQUAL(R[+1]C[-5], "A"), EQUAL(R[+2]C[-5], "T"), EQUAL(R[+3]C[-5], "C"))=1, 1, 0) -> 0
A905: 'C | B905: =IF(EQUAL(RC[-1], "G"), 1, IF(EQUAL(RC[-1], "C"), 1, 0)) -> 1 | C905: =IF(AND(EQUAL(RC[-2], "C"), EQUAL(R[+1]C[-2], "G"))=1, 1, 0) -> 1 | D905: =SUM(RC[-2]:R[+49]C[-2])*2 -> #EMPTY! | E905: =SUM(RC[-2]:R[+49]C[-2])*2 -> #EMPTY! | F905: =IF(AND(EQUAL(RC[-5], "G"), EQUAL(R[+1]C[-5], "A"), EQUAL(R[+2]C[-5], "T"), EQUAL(R[+3]C[-5], "C"))=1, 1, 0) -> 0
A906: 'G | B906: =IF(EQUAL(RC[-1], "G"), 1, IF(EQUAL(RC[-1], "C"), 1, 0)) -> 1 | C906: =IF(AND(EQUAL(RC[-2], "C"), EQUAL(R[+1]C[-2], "G"))=1, 1, 0) -> 0 | D906: =SUM(RC[-2]:R[+49]C[-2])*2 -> #EMPTY! | E906: =SUM(RC[-2]:R[+49]C[-2])*2 -> #EMPTY! | F906: =IF(AND(EQUAL(RC[-5], "G"), EQUAL(R[+1]C[-5], "A"), EQUAL(R[+2]C[-5], "T"), EQUAL(R[+3]C[-5], "C"))=1, 1, 0) -> 0
A907: 'A | B907: =IF(EQUAL(RC[-1], "G"), 1, IF(EQUAL(RC[-1], "C"), 1, 0)) -> 0 | C907: =IF(AND(EQUAL(RC[-2], "C"), EQUAL(R[+1]C[-2], "G"))=1, 1, 0) -> 0 | D907: =SUM(RC[-2]:R[+49]C[-2])*2 -> #EMPTY! | E907: =SUM(RC[-2]:R[+49]C[-2])*2 -> #EMPTY! | F907: =IF(AND(EQUAL(RC[-5], "G"), EQUAL(R[+1]C[-5], "A"), EQUAL(R[+2]C[-5], "T"), EQUAL(R[+3]C[-5], "C"))=1, 1, 0) -> 0
A908: 'C | B908: =IF(EQUAL(RC[-1], "G"), 1, IF(EQUAL(RC[-1], "C"), 1, 0)) -> 1 | C908: =IF(AND(EQUAL(RC[-2], "C"), EQUAL(R[+1]C[-2], "G"))=1, 1, 0) -> 0 | D908: =SUM(RC[-2]:R[+49]C[-2])*2 -> #EMPTY! | E908: =SUM(RC[-2]:R[+49]C[-2])*2 -> #EMPTY! | F908: =IF(AND(EQUAL(RC[-5], "G"), EQUAL(R[+1]C[-5], "A"), EQUAL(R[+2]C[-5], "T"), EQUAL(R[+3]C[-5], "C"))=1, 1, 0) -> 0
A909: 'C | B909: =IF(EQUAL(RC[-1], "G"), 1, IF(EQUAL(RC[-1], "C"), 1, 0)) -> 1 | C909: =IF(AND(EQUAL(RC[-2], "C"), EQUAL(R[+1]C[-2], "G"))=1, 1, 0) -> 1 | D909: =SUM(RC[-2]:R[+49]C[-2])*2 -> #EMPTY! | E909: =SUM(RC[-2]:R[+49]C[-2])*2 -> #EMPTY! | F909: =IF(AND(EQUAL(RC[-5], "G"), EQUAL(R[+1]C[-5], "A"), EQUAL(R[+2]C[-5], "T"), EQUAL(R[+3]C[-5], "C"))=1, 1, 0) -> 0
A910: 'G | B910: =IF(EQUAL(RC[-1], "G"), 1, IF(EQUAL(RC[-1], "C"), 1, 0)) -> 1 | C910: =IF(AND(EQUAL(RC[-2], "C"), EQUAL(R[+1]C[-2], "G"))=1, 1, 0) -> 0 | D910: =SUM(RC[-2]:R[+49]C[-2])*2 -> #EMPTY! | E910: =SUM(RC[-2]:R[+49]C[-2])*2 -> #EMPTY! | F910: =IF(AND(EQUAL(RC[-5], "G"), EQUAL(R[+1]C[-5], "A"), EQUAL(R[+2]C[-5], "T"), EQUAL(R[+3]C[-5], "C"))=1, 1, 0) -> 0
A911: 'G | B911: =IF(EQUAL(RC[-1], "G"), 1, IF(EQUAL(RC[-1], "C"), 1, 0)) -> 1 | C911: =IF(AND(EQUAL(RC[-2], "C"), EQUAL(R[+1]C[-2], "G"))=1, 1, 0) -> 0 | D911: =SUM(RC[-2]:R[+49]C[-2])*2 -> #EMPTY! | E911: =SUM(RC[-2]:R[+49]C[-2])*2 -> #EMPTY! | F911: =IF(AND(EQUAL(RC[-5], "G"), EQUAL(R[+1]C[-5], "A"), EQUAL(R[+2]C[-5], "T"), EQUAL(R[+3]C[-5], "C"))=1, 1, 0) -> 0
A912: 'T | B912: =IF(EQUAL(RC[-1], "G"), 1, IF(EQUAL(RC[-1], "C"), 1, 0)) -> 0 | C912: =IF(AND(EQUAL(RC[-2], "C"), EQUAL(R[+1]C[-2], "G"))=1, 1, 0) -> 0 | D912: =SUM(RC[-2]:R[+49]C[-2])*2 -> #EMPTY! | E912: =SUM(RC[-2]:R[+49]C[-2])*2 -> #EMPTY! | F912: =IF(AND(EQUAL(RC[-5], "G"), EQUAL(R[+1]C[-5], "A"), EQUAL(R[+2]C[-5], "T"), EQUAL(R[+3]C[-5], "C"))=1, 1, 0) -> 0
A913: 'T | B913: =IF(EQUAL(RC[-1], "G"), 1, IF(EQUAL(RC[-1], "C"), 1, 0)) -> 0 | C913: =IF(AND(EQUAL(RC[-2], "C"), EQUAL(R[+1]C[-2], "G"))=1, 1, 0) -> 0 | D913: =SUM(RC[-2]:R[+49]C[-2])*2 -> #EMPTY! | E913: =SUM(RC[-2]:R[+49]C[-2])*2 -> #EMPTY! | F913: =IF(AND(EQUAL(RC[-5], "G"), EQUAL(R[+1]C[-5], "A"), EQUAL(R[+2]C[-5], "T"), EQUAL(R[+3]C[-5], "C"))=1, 1, 0) -> 0
A914: 'C | B914: =IF(EQUAL(RC[-1], "G"), 1, IF(EQUAL(RC[-1], "C"), 1, 0)) -> 1 | C914: =IF(AND(EQUAL(RC[-2], "C"), EQUAL(R[+1]C[-2], "G"))=1, 1, 0) -> 0 | D914: =SUM(RC[-2]:R[+49]C[-2])*2 -> #EMPTY! | E914: =SUM(RC[-2]:R[+49]C[-2])*2 -> #EMPTY! | F914: =IF(AND(EQUAL(RC[-5], "G"), EQUAL(R[+1]C[-5], "A"), EQUAL(R[+2]C[-5], "T"), EQUAL(R[+3]C[-5], "C"))=1, 1, 0) -> 0
A915: 'T | B915: =IF(EQUAL(RC[-1], "G"), 1, IF(EQUAL(RC[-1], "C"), 1, 0)) -> 0 | C915: =IF(AND(EQUAL(RC[-2], "C"), EQUAL(R[+1]C[-2], "G"))=1, 1, 0) -> 0 | D915: =SUM(RC[-2]:R[+49]C[-2])*2 -> #EMPTY! | E915: =SUM(RC[-2]:R[+49]C[-2])*2 -> #EMPTY! | F915: =IF(AND(EQUAL(RC[-5], "G"), EQUAL(R[+1]C[-5], "A"), EQUAL(R[+2]C[-5], "T"), EQUAL(R[+3]C[-5], "C"))=1, 1, 0) -> 0
A916: 'G | B916: =IF(EQUAL(RC[-1], "G"), 1, IF(EQUAL(RC[-1], "C"), 1, 0)) -> 1 | C916: =IF(AND(EQUAL(RC[-2], "C"), EQUAL(R[+1]C[-2], "G"))=1, 1, 0) -> 0 | D916: =SUM(RC[-2]:R[+49]C[-2])*2 -> #EMPTY! | E916: =SUM(RC[-2]:R[+49]C[-2])*2 -> #EMPTY! | F916: =IF(AND(EQUAL(RC[-5], "G"), EQUAL(R[+1]C[-5], "A"), EQUAL(R[+2]C[-5], "T"), EQUAL(R[+3]C[-5], "C"))=1, 1, 0) -> 0
A917: 'T | B917: =IF(EQUAL(RC[-1], "G"), 1, IF(EQUAL(RC[-1], "C"), 1, 0)) -> 0 | C917: =IF(AND(EQUAL(RC[-2], "C"), EQUAL(R[+1]C[-2], "G"))=1, 1, 0) -> 0 | D917: =SUM(RC[-2]:R[+49]C[-2])*2 -> #EMPTY! | E917: =SUM(RC[-2]:R[+49]C[-2])*2 -> #EMPTY! | F917: =IF(AND(EQUAL(RC[-5], "G"), EQUAL(R[+1]C[-5], "A"), EQUAL(R[+2]C[-5], "T"), EQUAL(R[+3]C[-5], "C"))=1, 1, 0) -> 0
A918: 'C | B918: =IF(EQUAL(RC[-1], "G"), 1, IF(EQUAL(RC[-1], "C"), 1, 0)) -> 1 | C918: =IF(AND(EQUAL(RC[-2], "C"), EQUAL(R[+1]C[-2], "G"))=1, 1, 0) -> 0 | D918: =SUM(RC[-2]:R[+49]C[-2])*2 -> #EMPTY! | E918: =SUM(RC[-2]:R[+49]C[-2])*2 -> #EMPTY! | F918: =IF(AND(EQUAL(RC[-5], "G"), EQUAL(R[+1]C[-5], "A"), EQUAL(R[+2]C[-5], "T"), EQUAL(R[+3]C[-5], "C"))=1, 1, 0) -> 0
A919: 'A | B919: =IF(EQUAL(RC[-1], "G"), 1, IF(EQUAL(RC[-1], "C"), 1, 0)) -> 0 | C919: =IF(AND(EQUAL(RC[-2], "C"), EQUAL(R[+1]C[-2], "G"))=1, 1, 0) -> 0 | D919: =SUM(RC[-2]:R[+49]C[-2])*2 -> #EMPTY! | E919: =SUM(RC[-2]:R[+49]C[-2])*2 -> #EMPTY! | F919: =IF(AND(EQUAL(RC[-5], "G"), EQUAL(R[+1]C[-5], "A"), EQUAL(R[+2]C[-5], "T"), EQUAL(R[+3]C[-5], "C"))=1, 1, 0) -> 0
A920: 'T | B920: =IF(EQUAL(RC[-1], "G"), 1, IF(EQUAL(RC[-1], "C"), 1, 0)) -> 0 | C920: =IF(AND(EQUAL(RC[-2], "C"), EQUAL(R[+1]C[-2], "G"))=1, 1, 0) -> 0 | D920: =SUM(RC[-2]:R[+49]C[-2])*2 -> #EMPTY! | E920: =SUM(RC[-2]:R[+49]C[-2])*2 -> #EMPTY! | F920: =IF(AND(EQUAL(RC[-5], "G"), EQUAL(R[+1]C[-5], "A"), EQUAL(R[+2]C[-5], "T"), EQUAL(R[+3]C[-5], "C"))=1, 1, 0) -> 0
A921: 'G | B921: =IF(EQUAL(RC[-1], "G"), 1, IF(EQUAL(RC[-1], "C"), 1, 0)) -> 1 | C921: =IF(AND(EQUAL(RC[-2], "C"), EQUAL(R[+1]C[-2], "G"))=1, 1, 0) -> 0 | D921: =SUM(RC[-2]:R[+49]C[-2])*2 -> #EMPTY! | E921: =SUM(RC[-2]:R[+49]C[-2])*2 -> #EMPTY! | F921: =IF(AND(EQUAL(RC[-5], "G"), EQUAL(R[+1]C[-5], "A"), EQUAL(R[+2]C[-5], "T"), EQUAL(R[+3]C[-5], "C"))=1, 1, 0) -> 0
A922: 'T | B922: =IF(EQUAL(RC[-1], "G"), 1, IF(EQUAL(RC[-1], "C"), 1, 0)) -> 0 | C922: =IF(AND(EQUAL(RC[-2], "C"), EQUAL(R[+1]C[-2], "G"))=1, 1, 0) -> 0 | D922: =SUM(RC[-2]:R[+49]C[-2])*2 -> #EMPTY! | E922: =SUM(RC[-2]:R[+49]C[-2])*2 -> #EMPTY! | F922: =IF(AND(EQUAL(RC[-5], "G"), EQUAL(R[+1]C[-5], "A"), EQUAL(R[+2]C[-5], "T"), EQUAL(R[+3]C[-5], "C"))=1, 1, 0) -> 0
A923: 'C | B923: =IF(EQUAL(RC[-1], "G"), 1, IF(EQUAL(RC[-1], "C"), 1, 0)) -> 1 | C923: =IF(AND(EQUAL(RC[-2], "C"), EQUAL(R[+1]C[-2], "G"))=1, 1, 0) -> 1 | D923: =SUM(RC[-2]:R[+49]C[-2])*2 -> #EMPTY! | E923: =SUM(RC[-2]:R[+49]C[-2])*2 -> #EMPTY! | F923: =IF(AND(EQUAL(RC[-5], "G"), EQUAL(R[+1]C[-5], "A"), EQUAL(R[+2]C[-5], "T"), EQUAL(R[+3]C[-5], "C"))=1, 1, 0) -> 0
A924: 'G | B924: =IF(EQUAL(RC[-1], "G"), 1, IF(EQUAL(RC[-1], "C"), 1, 0)) -> 1 | C924: =IF(AND(EQUAL(RC[-2], "C"), EQUAL(R[+1]C[-2], "G"))=1, 1, 0) -> 0 | D924: =SUM(RC[-2]:R[+49]C[-2])*2 -> #EMPTY! | E924: =SUM(RC[-2]:R[+49]C[-2])*2 -> #EMPTY! | F924: =IF(AND(EQUAL(RC[-5], "G"), EQUAL(R[+1]C[-5], "A"), EQUAL(R[+2]C[-5], "T"), EQUAL(R[+3]C[-5], "C"))=1, 1, 0) -> 0
A925: 'A | B925: =IF(EQUAL(RC[-1], "G"), 1, IF(EQUAL(RC[-1], "C"), 1, 0)) -> 0 | C925: =IF(AND(EQUAL(RC[-2], "C"), EQUAL(R[+1]C[-2], "G"))=1, 1, 0) -> 0 | D925: =SUM(RC[-2]:R[+49]C[-2])*2 -> #EMPTY! | E925: =SUM(RC[-2]:R[+49]C[-2])*2 -> #EMPTY! | F925: =IF(AND(EQUAL(RC[-5], "G"), EQUAL(R[+1]C[-5], "A"), EQUAL(R[+2]C[-5], "T"), EQUAL(R[+3]C[-5], "C"))=1, 1, 0) -> 0
A926: 'C | B926: =IF(EQUAL(RC[-1], "G"), 1, IF(EQUAL(RC[-1], "C"), 1, 0)) -> 1 | C926: =IF(AND(EQUAL(RC[-2], "C"), EQUAL(R[+1]C[-2], "G"))=1, 1, 0) -> 0 | D926: =SUM(RC[-2]:R[+49]C[-2])*2 -> #EMPTY! | E926: =SUM(RC[-2]:R[+49]C[-2])*2 -> #EMPTY! | F926: =IF(AND(EQUAL(RC[-5], "G"), EQUAL(R[+1]C[-5], "A"), EQUAL(R[+2]C[-5], "T"), EQUAL(R[+3]C[-5], "C"))=1, 1, 0) -> 0
A927: 'C | B927: =IF(EQUAL(RC[-1], "G"), 1, IF(EQUAL(RC[-1], "C"), 1, 0)) -> 1 | C927: =IF(AND(EQUAL(RC[-2], "C"), EQUAL(R[+1]C[-2], "G"))=1, 1, 0) -> 0 | D927: =SUM(RC[-2]:R[+49]C[-2])*2 -> #EMPTY! | E927: =SUM(RC[-2]:R[+49]C[-2])*2 -> #EMPTY! | F927: =IF(AND(EQUAL(RC[-5], "G"), EQUAL(R[+1]C[-5], "A"), EQUAL(R[+2]C[-5], "T"), EQUAL(R[+3]C[-5], "C"))=1, 1, 0) -> 0
A928: 'T | B928: =IF(EQUAL(RC[-1], "G"), 1, IF(EQUAL(RC[-1], "C"), 1, 0)) -> 0 | C928: =IF(AND(EQUAL(RC[-2], "C"), EQUAL(R[+1]C[-2], "G"))=1, 1, 0) -> 0 | D928: =SUM(RC[-2]:R[+49]C[-2])*2 -> #EMPTY! | E928: =SUM(RC[-2]:R[+49]C[-2])*2 -> #EMPTY! | F928: =IF(AND(EQUAL(RC[-5], "G"), EQUAL(R[+1]C[-5], "A"), EQUAL(R[+2]C[-5], "T"), EQUAL(R[+3]C[-5], "C"))=1, 1, 0) -> 0
A929: 'C | B929: =IF(EQUAL(RC[-1], "G"), 1, IF(EQUAL(RC[-1], "C"), 1, 0)) -> 1 | C929: =IF(AND(EQUAL(RC[-2], "C"), EQUAL(R[+1]C[-2], "G"))=1, 1, 0) -> 0 | D929: =SUM(RC[-2]:R[+49]C[-2])*2 -> #EMPTY! | E929: =SUM(RC[-2]:R[+49]C[-2])*2 -> #EMPTY! | F929: =IF(AND(EQUAL(RC[-5], "G"), EQUAL(R[+1]C[-5], "A"), EQUAL(R[+2]C[-5], "T"), EQUAL(R[+3]C[-5], "C"))=1, 1, 0) -> 0
A930: 'A | B930: =IF(EQUAL(RC[-1], "G"), 1, IF(EQUAL(RC[-1], "C"), 1, 0)) -> 0 | C930: =IF(AND(EQUAL(RC[-2], "C"), EQUAL(R[+1]C[-2], "G"))=1, 1, 0) -> 0 | D930: =SUM(RC[-2]:R[+49]C[-2])*2 -> #EMPTY! | E930: =SUM(RC[-2]:R[+49]C[-2])*2 -> #EMPTY! | F930: =IF(AND(EQUAL(RC[-5], "G"), EQUAL(R[+1]C[-5], "A"), EQUAL(R[+2]C[-5], "T"), EQUAL(R[+3]C[-5], "C"))=1, 1, 0) -> 0
A931: 'G | B931: =IF(EQUAL(RC[-1], "G"), 1, IF(EQUAL(RC[-1], "C"), 1, 0)) -> 1 | C931: =IF(AND(EQUAL(RC[-2], "C"), EQUAL(R[+1]C[-2], "G"))=1, 1, 0) -> 0 | D931: =SUM(RC[-2]:R[+49]C[-2])*2 -> #EMPTY! | E931: =SUM(RC[-2]:R[+49]C[-2])*2 -> #EMPTY! | F931: =IF(AND(EQUAL(RC[-5], "G"), EQUAL(R[+1]C[-5], "A"), EQUAL(R[+2]C[-5], "T"), EQUAL(R[+3]C[-5], "C"))=1, 1, 0) -> 0
A932: 'T | B932: =IF(EQUAL(RC[-1], "G"), 1, IF(EQUAL(RC[-1], "C"), 1, 0)) -> 0 | C932: =IF(AND(EQUAL(RC[-2], "C"), EQUAL(R[+1]C[-2], "G"))=1, 1, 0) -> 0 | D932: =SUM(RC[-2]:R[+49]C[-2])*2 -> #EMPTY! | E932: =SUM(RC[-2]:R[+49]C[-2])*2 -> #EMPTY! | F932: =IF(AND(EQUAL(RC[-5], "G"), EQUAL(R[+1]C[-5], "A"), EQUAL(R[+2]C[-5], "T"), EQUAL(R[+3]C[-5], "C"))=1, 1, 0) -> 0
A933: 'C | B933: =IF(EQUAL(RC[-1], "G"), 1, IF(EQUAL(RC[-1], "C"), 1, 0)) -> 1 | C933: =IF(AND(EQUAL(RC[-2], "C"), EQUAL(R[+1]C[-2], "G"))=1, 1, 0) -> 0 | D933: =SUM(RC[-2]:R[+49]C[-2])*2 -> #EMPTY! | E933: =SUM(RC[-2]:R[+49]C[-2])*2 -> #EMPTY! | F933: =IF(AND(EQUAL(RC[-5], "G"), EQUAL(R[+1]C[-5], "A"), EQUAL(R[+2]C[-5], "T"), EQUAL(R[+3]C[-5], "C"))=1, 1, 0) -> 0
A934: 'C | B934: =IF(EQUAL(RC[-1], "G"), 1, IF(EQUAL(RC[-1], "C"), 1, 0)) -> 1 | C934: =IF(AND(EQUAL(RC[-2], "C"), EQUAL(R[+1]C[-2], "G"))=1, 1, 0) -> 0 | D934: =SUM(RC[-2]:R[+49]C[-2])*2 -> #EMPTY! | E934: =SUM(RC[-2]:R[+49]C[-2])*2 -> #EMPTY! | F934: =IF(AND(EQUAL(RC[-5], "G"), EQUAL(R[+1]C[-5], "A"), EQUAL(R[+2]C[-5], "T"), EQUAL(R[+3]C[-5], "C"))=1, 1, 0) -> 0
A935: 'C | B935: =IF(EQUAL(RC[-1], "G"), 1, IF(EQUAL(RC[-1], "C"), 1, 0)) -> 1 | C935: =IF(AND(EQUAL(RC[-2], "C"), EQUAL(R[+1]C[-2], "G"))=1, 1, 0) -> 0 | D935: =SUM(RC[-2]:R[+49]C[-2])*2 -> #EMPTY! | E935: =SUM(RC[-2]:R[+49]C[-2])*2 -> #EMPTY! | F935: =IF(AND(EQUAL(RC[-5], "G"), EQUAL(R[+1]C[-5], "A"), EQUAL(R[+2]C[-5], "T"), EQUAL(R[+3]C[-5], "C"))=1, 1, 0) -> 0
A936: 'A | B936: =IF(EQUAL(RC[-1], "G"), 1, IF(EQUAL(RC[-1], "C"), 1, 0)) -> 0 | C936: =IF(AND(EQUAL(RC[-2], "C"), EQUAL(R[+1]C[-2], "G"))=1, 1, 0) -> 0 | D936: =SUM(RC[-2]:R[+49]C[-2])*2 -> #EMPTY! | E936: =SUM(RC[-2]:R[+49]C[-2])*2 -> #EMPTY! | F936: =IF(AND(EQUAL(RC[-5], "G"), EQUAL(R[+1]C[-5], "A"), EQUAL(R[+2]C[-5], "T"), EQUAL(R[+3]C[-5], "C"))=1, 1, 0) -> 0
A937: 'G | B937: =IF(EQUAL(RC[-1], "G"), 1, IF(EQUAL(RC[-1], "C"), 1, 0)) -> 1 | C937: =IF(AND(EQUAL(RC[-2], "C"), EQUAL(R[+1]C[-2], "G"))=1, 1, 0) -> 0 | D937: =SUM(RC[-2]:R[+49]C[-2])*2 -> #EMPTY! | E937: =SUM(RC[-2]:R[+49]C[-2])*2 -> #EMPTY! | F937: =IF(AND(EQUAL(RC[-5], "G"), EQUAL(R[+1]C[-5], "A"), EQUAL(R[+2]C[-5], "T"), EQUAL(R[+3]C[-5], "C"))=1, 1, 0) -> 0
A938: 'C | B938: =IF(EQUAL(RC[-1], "G"), 1, IF(EQUAL(RC[-1], "C"), 1, 0)) -> 1 | C938: =IF(AND(EQUAL(RC[-2], "C"), EQUAL(R[+1]C[-2], "G"))=1, 1, 0) -> 1 | D938: =SUM(RC[-2]:R[+49]C[-2])*2 -> #EMPTY! | E938: =SUM(RC[-2]:R[+49]C[-2])*2 -> #EMPTY! | F938: =IF(AND(EQUAL(RC[-5], "G"), EQUAL(R[+1]C[-5], "A"), EQUAL(R[+2]C[-5], "T"), EQUAL(R[+3]C[-5], "C"))=1, 1, 0) -> 0
A939: 'G | B939: =IF(EQUAL(RC[-1], "G"), 1, IF(EQUAL(RC[-1], "C"), 1, 0)) -> 1 | C939: =IF(AND(EQUAL(RC[-2], "C"), EQUAL(R[+1]C[-2], "G"))=1, 1, 0) -> 0 | D939: =SUM(RC[-2]:R[+49]C[-2])*2 -> #EMPTY! | E939: =SUM(RC[-2]:R[+49]C[-2])*2 -> #EMPTY! | F939: =IF(AND(EQUAL(RC[-5], "G"), EQUAL(R[+1]C[-5], "A"), EQUAL(R[+2]C[-5], "T"), EQUAL(R[+3]C[-5], "C"))=1, 1, 0) -> 0
A940: 'T | B940: =IF(EQUAL(RC[-1], "G"), 1, IF(EQUAL(RC[-1], "C"), 1, 0)) -> 0 | C940: =IF(AND(EQUAL(RC[-2], "C"), EQUAL(R[+1]C[-2], "G"))=1, 1, 0) -> 0 | D940: =SUM(RC[-2]:R[+49]C[-2])*2 -> #EMPTY! | E940: =SUM(RC[-2]:R[+49]C[-2])*2 -> #EMPTY! | F940: =IF(AND(EQUAL(RC[-5], "G"), EQUAL(R[+1]C[-5], "A"), EQUAL(R[+2]C[-5], "T"), EQUAL(R[+3]C[-5], "C"))=1, 1, 0) -> 0
A941: 'C | B941: =IF(EQUAL(RC[-1], "G"), 1, IF(EQUAL(RC[-1], "C"), 1, 0)) -> 1 | C941: =IF(AND(EQUAL(RC[-2], "C"), EQUAL(R[+1]C[-2], "G"))=1, 1, 0) -> 1 | D941: =SUM(RC[-2]:R[+49]C[-2])*2 -> #EMPTY! | E941: =SUM(RC[-2]:R[+49]C[-2])*2 -> #EMPTY! | F941: =IF(AND(EQUAL(RC[-5], "G"), EQUAL(R[+1]C[-5], "A"), EQUAL(R[+2]C[-5], "T"), EQUAL(R[+3]C[-5], "C"))=1, 1, 0) -> 0
A942: 'G | B942: =IF(EQUAL(RC[-1], "G"), 1, IF(EQUAL(RC[-1], "C"), 1, 0)) -> 1 | C942: =IF(AND(EQUAL(RC[-2], "C"), EQUAL(R[+1]C[-2], "G"))=1, 1, 0) -> 0 | D942: =SUM(RC[-2]:R[+49]C[-2])*2 -> #EMPTY! | E942: =SUM(RC[-2]:R[+49]C[-2])*2 -> #EMPTY! | F942: =IF(AND(EQUAL(RC[-5], "G"), EQUAL(R[+1]C[-5], "A"), EQUAL(R[+2]C[-5], "T"), EQUAL(R[+3]C[-5], "C"))=1, 1, 0) -> 0
A943: 'T | B943: =IF(EQUAL(RC[-1], "G"), 1, IF(EQUAL(RC[-1], "C"), 1, 0)) -> 0 | C943: =IF(AND(EQUAL(RC[-2], "C"), EQUAL(R[+1]C[-2], "G"))=1, 1, 0) -> 0 | D943: =SUM(RC[-2]:R[+49]C[-2])*2 -> #EMPTY! | E943: =SUM(RC[-2]:R[+49]C[-2])*2 -> #EMPTY! | F943: =IF(AND(EQUAL(RC[-5], "G"), EQUAL(R[+1]C[-5], "A"), EQUAL(R[+2]C[-5], "T"), EQUAL(R[+3]C[-5], "C"))=1, 1, 0) -> 0
A944: 'G | B944: =IF(EQUAL(RC[-1], "G"), 1, IF(EQUAL(RC[-1], "C"), 1, 0)) -> 1 | C944: =IF(AND(EQUAL(RC[-2], "C"), EQUAL(R[+1]C[-2], "G"))=1, 1, 0) -> 0 | D944: =SUM(RC[-2]:R[+49]C[-2])*2 -> #EMPTY! | E944: =SUM(RC[-2]:R[+49]C[-2])*2 -> #EMPTY! | F944: =IF(AND(EQUAL(RC[-5], "G"), EQUAL(R[+1]C[-5], "A"), EQUAL(R[+2]C[-5], "T"), EQUAL(R[+3]C[-5], "C"))=1, 1, 0) -> 0
A945: 'A | B945: =IF(EQUAL(RC[-1], "G"), 1, IF(EQUAL(RC[-1], "C"), 1, 0)) -> 0 | C945: =IF(AND(EQUAL(RC[-2], "C"), EQUAL(R[+1]C[-2], "G"))=1, 1, 0) -> 0 | D945: =SUM(RC[-2]:R[+49]C[-2])*2 -> #EMPTY! | E945: =SUM(RC[-2]:R[+49]C[-2])*2 -> #EMPTY! | F945: =IF(AND(EQUAL(RC[-5], "G"), EQUAL(R[+1]C[-5], "A"), EQUAL(R[+2]C[-5], "T"), EQUAL(R[+3]C[-5], "C"))=1, 1, 0) -> 0

Sheet: Plot
B1: 'Plot of GC content and location of CpG regions

Sheet: Sequences
A2: 'HGPRT | B2: 'Calmodulin
A3: 'G | B3: 'C
A4: 'C | B4: 'C
A5: 'C | B5: 'C
A6: 'A | B6: 'G
A7: 'C | B7: 'G
A8: 'A | B8: 'G
A9: 'C | B9: 'C
A10: 'G | B10: 'C
A11: 'A | B11: 'C
A12: 'G | B12: 'T
A13: 'G | B13: 'G
A14: 'C | B14: 'T
A15: 'T | B15: 'A
A16: 'A | B16: 'A
A17: 'A | B17: 'A
A18: 'A | B18: 'A
A19: 'A | B19: 'C
A20: 'T | B20: 'A
A21: 'C | B21: 'G
A22: 'A | B22: 'A
A23: 'A | B23: 'A
A24: 'C | B24: 'G
A25: 'A | B25: 'A
A26: 'T | B26: 'T
A27: 'C | B27: 'C
A28: 'T | B28: 'A
A29: 'A | B29: 'A
A30: 'A | B30: 'A
A31: 'G | B31: 'T
A32: 'A | B32: 'T
A33: 'A | B33: 'C
A34: 'A | B34: 'T
A35: 'T | B35: 'G
A36: 'G | B36: 'T
A37: 'A | B37: 'G
A38: 'C | B38: 'T
A39: 'A | B39: 'T
A40: 'T | B40: 'C
A41: 'C | B41: 'T
A42: 'T | B42: 'G
A43: 'T | B43: 'C
A44: 'A | B44: 'C
A45: 'T | B45: 'T
A46: 'T | B46: 'T
A47: 'T | B47: 'G
A48: 'G | B48: 'G
A49: 'G | B49: 'C
A50: 'T | B50: 'A
A51: 'A | B51: 'A
A52: 'A | B52: 'G
A53: 'T | B53: 'A
A54: 'A | B54: 'A
A55: 'T | B55: 'A
A56: 'A | B56: 'A
A57: 'T | B57: 'G
A58: 'T | B58: 'A
A59: 'T | B59: 'A
A60: 'G | B60: 'A
A61: 'G | B61: 'C
A62: 'T | B62: 'T
A63: 'A | B63: 'G
A64: 'A | B64: 'C
A65: 'C | B65: 'A
A66: 'A | B66: 'G
A67: 'T | B67: 'C
A68: 'A | B68: 'A
A69: 'T | B69: 'T
A70: 'G | B70: 'T
A71: 'A | B71: 'T
A72: 'A | B72: 'T
A73: 'T | B73: 'G
A74: 'C | B74: 'T
A75: 'T | B75: 'C
A76: 'C | B76: 'T
A77: 'T | B77: 'A
A78: 'A | B78: 'G
A79: 'T | B79: 'A
A80: 'C | B80: 'T
A81: 'A | B81: 'T
A82: 'C | B82: 'T
A83: 'C | B83: 'T
A84: 'A | B84: 'T
A85: 'T | B85: 'A
A86: 'T | B86: 'C
A87: 'T | B87: 'A
A88: 'C | B88: 'A
A89: 'T | B89: 'G
A90: 'T | B90: 'T
A91: 'T | B91: 'C
A92: 'G | B92: 'C
A93: 'T | B93: 'T
A94: 'G | B94: 'G
A95: 'T | B95: 'G
A96: 'G | B96: 'G
A97: 'T | B97: 'G
A98: 'G | B98: 'T
A99: 'T | B99: 'T
A100: 'G | B100: 'C
A101: 'T | B101: 'A
A102: 'G | B102: 'C
A103: 'T | B103: 'A
A104: 'G | B104: 'T
A105: 'T | B105: 'T
A106: 'T | B106: 'A
A107: 'G | B107: 'C
A108: 'T | B108: 'T
A109: 'A | B109: 'G
A110: 'G | B110: 'G
A111: 'T | B111: 'C
A112: 'C | B112: 'T
A113: 'A | B113: 'G
A114: 'T | B114: 'A
A115: 'G | B115: 'A
A116: 'T | B116: 'A
A117: 'G | B117: 'T
A118: 'C | B118: 'T
A119: 'A | B119: 'G
A120: 'G | B120: 'T
A121: 'G | B121: 'T
A122: 'T | B122: 'C
A123: 'G | B123: 'T
A124: 'C | B124: 'T
A125: 'T | B125: 'T
A126: 'T | B126: 'C
A127: 'G | B127: 'T
A128: 'A | B128: 'C
A129: 'G | B129: 'T
A130: 'G | B130: 'A
A131: 'A | B131: 'C
A132: 'G | B132: 'T
A133: 'G | B133: 'T
A134: 'G | B134: 'T
A135: 'C | B135: 'A
A136: 'A | B136: 'C
A137: 'C | B137: 'A
A138: 'A | B138: 'G
A139: 'A | B139: 'A
A140: 'T | B140: 'A
A141: 'T | B141: 'A
A142: 'T | B142: 'A
A143: 'G | B143: 'A
A144: 'A | B144: 'T
A145: 'T | B145: 'G
A146: 'G | B146: 'G
A147: 'A | B147: 'A
A148: 'C | B148: 'A
A149: 'A | B149: 'A
A150: 'A | B150: 'A
A151: 'G | B151: 'C
A152: 'A | B152: 'A
A153: 'T | B153: 'C
A154: 'G | B154: 'T
A155: 'T | B155: 'A
A156: 'C | B156: 'G
A157: 'T | B157: 'T
A158: 'T | B158: 'A
A159: 'T | B159: 'A
A160: 'C | B160: 'A
A161: 'T | B161: 'C
A162: 'C | B162: 'T
A163: 'A | B163: 'T
A164: 'A | B164: 'A
A165: 'A | B165: 'A
A166: 'C | B166: 'A
A167: 'C | B167: 'G
A168: 'C | B168: 'A
A169: 'T | B169: 'T
A170: 'A | B170: 'T
A171: 'T | B171: 'T
A172: 'T | B172: 'A
A173: 'C | B173: 'A
A174: 'C | B174: 'A
A175: 'A | B175: 'T
A176: 'C | B176: 'A
A177: 'C | B177: 'T
A178: 'T | B178: 'T
A179: 'T | B179: 'A
A180: 'A | B180: 'T
A181: 'T | B181: 'T
A182: 'C | B182: 'T
A183: 'A | B183: 'T
A184: 'G | B184: 'A
A185: 'A | B185: 'A
A186: 'T | B186: 'A
A187: 'T | B187: 'A
A188: 'T | B188: 'G
A189: 'T | B189: 'G
A190: 'A | B190: 'A
A191: 'T | B191: 'A
A192: 'T | B192: 'T
A193: 'T | B193: 'A
A194: 'T | B194: 'T
A195: 'G | B195: 'A
A196: 'A | B196: 'A
A197: 'G | B197: 'T
A198: 'G | B198: 'A
A199: 'C | B199: 'A
A200: 'A | B200: 'A
A201: 'A | B201: 'A
A202: 'G | B202: 'A
A203: 'A | B203: 'A
A204: 'T | B204: 'T
A205: 'C | B205: 'G
A206: 'T | B206: 'G
A207: 'C | B207: 'A
A208: 'A | B208: 'A
A209: 'A | B209: 'A
A210: 'T | B210: 'A
A211: 'T | B211: 'C
A212: 'G | B212: 'A
A213: 'T | B213: 'C
A214: 'C | B214: 'T
A215: 'T | B215: 'A
A216: 'G | B216: 'G
A217: 'G | B217: 'T
A218: 'G | B218: 'A
A219: 'T | B219: 'T
A220: 'A | B220: 'A
A221: 'G | B221: 'T
A222: 'G | B222: 'T
A223: 'T | B223: 'T
A224: 'T | B224: 'A
A225: 'G | B225: 'A
A226: 'A | B226: 'A
A227: 'A | B227: 'G
A228: 'T | B228: 'A
A229: 'A | B229: 'T
A230: 'T | B230: 'T
A231: 'A | B231: 'T
A232: 'C | B232: 'A
A233: 'A | B233: 'A
A234: 'T | B234: 'A
A235: 'G | B235: 'T
A236: 'C | B236: 'A
A237: 'T | B237: 'G
A238: 'G | B238: 'T
A239: 'C | B239: 'C
A240: 'G | B240: 'T
A241: 'A | B241: 'T
A242: 'C | B242: 'T
A243: 'T | B243: 'T
A244: 'A | B244: 'A
A245: 'A | B245: 'A
A246: 'T | B246: 'A
A247: 'C | B247: 'A
A248: 'C | B248: 'G
A249: 'T | B249: 'G
A250: 'C | B250: 'A
A251: 'C | B251: 'A
A252: 'T | B252: 'T
A253: 'T | B253: 'A
A254: 'T | B254: 'T
A255: 'C | B255: 'A
A256: 'C | B256: 'A
A257: 'T | B257: 'T
A258: 'G | B258: 'C
A259: 'G | B259: 'A
A260: 'T | B260: 'A
A261: 'A | B261: 'A
A262: 'G | B262: 'A
A263: 'C | B263: 'C
A264: 'T | B264: 'T
A265: 'G | B265: 'G
A266: 'G | B266: 'T
A267: 'G | B267: 'A
A268: 'C | B268: 'G
A269: 'A | B269: 'T
A270: 'T | B270: 'T
A271: 'A | B271: 'T
A272: 'T | B272: 'A
A273: 'A | B273: 'A
A274: 'A | B274: 'A
A275: 'G | B275: 'A
A276: 'C | B276: 'T
A277: 'C | B277: 'A
A278: 'A | B278: 'C
A279: 'T | B279: 'A
A280: 'T | B280: 'A
A281: 'C | B281: 'T
A282: 'T | B282: 'C
A283: 'C | B283: 'T
A284: 'A | B284: 'A
A285: 'C | B285: 'G
A286: 'C | B286: 'C
A287: 'A | B287: 'T
A288: 'T | B288: 'C
A289: 'A | B289: 'C
A290: 'C | B290: 'A
A291: 'C | B291: 'T
A292: 'A | B292: 'A
A293: 'G | B293: 'A
A294: 'G | B294: 'G
A295: 'C | B295: 'A
A296: 'T | B296: 'G
A297: 'A | B297: 'A
A298: 'A | B298: 'G
A299: 'A | B299: 'G
A300: 'T | B300: 'C
A301: 'G | B301: 'A
A302: 'C | B302: 'A
A303: 'T | B303: 'T
A304: 'C | B304: 'T
A305: 'A | B305: 'G
A306: 'C | B306: 'G
A307: 'T | B307: 'C
A308: 'T | B308: 'T
A309: 'T | B309: 'G
A310: 'A | B310: 'T
A311: 'T | B311: 'G
A312: 'G | B312: 'T
A313: 'T | B313: 'G
A314: 'A | B314: 'T
A315: 'A | B315: 'T
A316: 'A | B316: 'C
A317: 'G | B317: 'C
A318: 'G | B318: 'A
A319: 'C | B319: 'C
A320: 'A | B320: 'T
A321: 'A | B321: 'T
A322: 'A | B322: 'G
A323: 'G | B323: 'T
A324: 'C | B324: 'A
A325: 'A | B325: 'A
A326: 'G | B326: 'T
A327: 'T | B327: 'G
A328: 'T | B328: 'C
A329: 'T | B329: 'A
A330: 'A | B330: 'G
A331: 'G | B331: 'A
A332: 'G | B332: 'G
A333: 'G | B333: 'G
A334: 'T | B334: 'A
A335: 'C | B335: 'T
A336: 'T | B336: 'T
A337: 'A | B337: 'T
A338: 'A | B338: 'G
A339: 'T | B339: 'A
A340: 'T | B340: 'A
A341: 'C | B341: 'G
A342: 'T | B342: 'C
A343: 'C | B343: 'A
A344: 'A | B344: 'T
A345: 'T | B345: 'C
A346: 'A | B346: 'T
A347: 'A | B347: 'A
A348: 'G | B348: 'T
A349: 'C | B349: 'T
A350: 'T | B350: 'T
A351: 'T | B351: 'T
A352: 'A | B352: 'T
A353: 'C | B353: 'T
A354: 'C | B354: 'C
A355: 'A | B355: 'C
A356: 'A | B356: 'C
A357: 'G | B357: 'T
A358: 'G | B358: 'T
A359: 'A | B359: 'G
A360: 'G | B360: 'T
A361: 'C | B361: 'T
A362: 'T | B362: 'T
A363: 'T | B363: 'C
A364: 'C | B364: 'T
A365: 'G | B365: 'A
A366: 'T | B366: 'T
A367: 'T | B367: 'G
A368: 'T | B368: 'G
A369: 'T | B369: 'A
A370: 'C | B370: 'T
A371: 'C | B371: 'T
A372: 'T | B372: 'T
A373: 'T | B373: 'A
A374: 'T | B374: 'T
A375: 'T | B375: 'G
A376: 'G | B376: 'A
A377: 'T | B377: 'A
A378: 'A | B378: 'T
A379: 'T | B379: 'A
A380: 'T | B380: 'A
A381: 'G | B381: 'A
A382: 'G | B382: 'G
A383: 'T | B383: 'A
A384: 'A | B384: 'C
A385: 'C | B385: 'T
A386: 'C | B386: 'C
A387: 'C | B387: 'T
A388: 'T | B388: 'G
A389: 'G | B389: 'A
A390: 'A | B390: 'C
A391: 'T | B391: 'C
A392: 'C | B392: 'C
A393: 'T | B393: 'T
A394: 'G | B394: 'T
A395: 'G | B395: 'C
A396: 'C | B396: 'T
A397: 'T | B397: 'C
A398: 'G | B398: 'A
A399: 'T | B399: 'G
A400: 'T | B400: 'G
A401: 'T | B401: 'A
A402: 'A | B402: 'T
A403: 'G | B403: 'C
A404: 'G | B404: 'A
A405: 'G | B405: 'G
A406: 'C | B406: 'G
A407: 'T | B407: 'A
A408: 'G | B408: 'A
A409: 'T | B409: 'A
A410: 'G | B410: 'A
A411: 'G | B411: 'T
A412: 'T | B412: 'T
A413: 'G | B413: 'A
A414: 'C | B414: 'C
A415: 'T | B415: 'G
A416: 'C | B416: 'A
A417: 'A | B417: 'A
A418: 'A | B418: 'A
A419: 'T | B419: 'A
A420: 'T | B420: 'A
A421: 'C | B421: 'T
A422: 'T | B422: 'T
A423: 'T | B423: 'T
A424: 'A | B424: 'A
A425: 'C | B425: 'A
A426: 'G | B426: 'A
A427: 'A | B427: 'G
A428: 'C | B428: 'C
A429: 'G | B429: 'C
A430: 'A | B430: 'T
A431: 'A | B431: 'G
A432: 'G | B432: 'G
A433: 'T | B433: 'G
A434: 'A | B434: 'T
A435: 'A | B435: 'T
A436: 'G | B436: 'T
A437: 'A | B437: 'A
A438: 'A | B438: 'A
A439: 'T | B439: 'G
A440: 'G | B440: 'G
A441: 'T | B441: 'T
A442: 'T | B442: 'C
A443: 'T | B443: 'T
A444: 'G | B444: 'G
A445: 'A | B445: 'T
A446: 'A | B446: 'A
A447: 'A | B447: 'G
A448: 'G | B448: 'A
A449: 'A | B449: 'A
A450: 'A | B450: 'G
A451: 'C | B451: 'C
A452: 'T | B452: 'T
A453: 'G | B453: 'G
A454: 'G | B454: 'C
A455: 'G | B455: 'A
A456: 'C | B456: 'C
A457: 'C | B457: 'A
A458: 'T | B458: 'G
A459: 'A | B459: 'G
A460: 'A | B460: 'T
A461: 'G | B461: 'A
A462: 'A | B462: 'C
A463: 'G | B463: 'A
A464: 'G | B464: 'C
A465: 'A | B465: 'T
A466: 'A | B466: 'A
A467: 'T | B467: 'A
A468: 'C | B468: 'T
A469: 'A | B469: 'T
A470: 'C | B470: 'T
A471: 'A | B471: 'T
A472: 'T | B472: 'A
A473: 'C | B473: 'G
A474: 'A | B474: 'T
A475: 'T | B475: 'A
A476: 'G | B476: 'A
A477: 'G | B477: 'G
A478: 'G | B478: 'A
A479: 'G | B479: 'C
A480: 'G | B480: 'G
A481: 'G | B481: 'G
A482: 'G | B482: 'G
A483: 'A | B483: 'C
A484: 'A | B484: 'G
A485: 'C | B485: 'C
A486: 'C | B486: 'C
A487: 'C | B487: 'A
A488: 'T | B488: 'G
A489: 'A | B489: 'G
A490: 'A | B490: 'A
A491: 'G | B491: 'A
A492: 'A | B492: 'A
A493: 'G | B493: 'A
A494: 'C | B494: 'A
A495: 'T | B495: 'G
A496: 'C | B496: 'A
A497: 'A | B497: 'A
A498: 'T | B498: 'C
A499: 'G | B499: 'A
A500: 'A | B500: 'A
A501: 'G | B501: 'A
A502: 'G | B502: 'A
A503: 'G | B503: 'T
A504: 'A | B504: 'A
A505: 'G | B505: 'G
A506: 'T | B506: 'T
A507: 'A | B507: 'A
A508: 'A | B508: 'G
A509: 'A | B509: 'G
A510: 'A | B510: 'G
A511: 'T | B511: 'G
A512: 'G | B512: 'A
A513: 'C | B513: 'G
A514: 'G | B514: 'A
A515: 'G | B515: 'A
A516: 'A | B516: 'A
A517: 'A | B517: 'T
A518: 'G | B518: 'A
A519: 'G | B519: 'T
A520: 'A | B520: 'T
A521: 'G | B521: 'C
A522: 'T | B522: 'A
A523: 'T | B523: 'G
A524: 'A | B524: 'G
A525: 'G | B525: 'C
A526: 'G | B526: 'A
A527: 'T | B527: 'T
A528: 'A | B528: 'C
A529: 'T | B529: 'C
A530: 'G | B530: 'T
A531: 'G | B531: 'A
A532: 'T | B532: 'A
A533: 'T | B533: 'A
A534: 'A | B534: 'A
A535: 'T | B535: 'A
A536: 'T | B536: 'A
A537: 'T | B537: 'T
A538: 'G | B538: 'A
A539: 'G | B539: 'T
A540: 'G | B540: 'T
A541: 'T | B541: 'C
A542: 'T | B542: 'A
A543: 'A | B543: 'G
A544: 'T | B544: 'T
A545: 'T | B545: 'G
A546: 'A | B546: 'G
A547: 'A | B547: 'A
A548: 'G | B548: 'A
A549: 'T | B549: 'A
A550: 'A | B550: 'C
A551: 'T | B551: 'G
A552: 'G | B552: 'T
A553: 'G | B553: 'A
A554: 'T | B554: 'A
A555: 'T | B555: 'A
A556: 'A | B556: 'A
A557: 'T | B557: 'A
A558: 'G | B558: 'C
A559: 'A | B559: 'A
A560: 'G | B560: 'T
A561: 'T | B561: 'T
A562: 'C | B562: 'A
A563: 'C | B563: 'A
A564: 'T | B564: 'A
A565: 'C | B565: 'G
A566: 'T | B566: 'A
A567: 'G | B567: 'C
A568: 'G | B568: 'T
A569: 'G | B569: 'G
A570: 'G | B570: 'A
A571: 'G | B571: 'T
A572: 'A | B572: 'T
A573: 'C | B573: 'A
A574: 'T | B574: 'A
A575: 'A | B575: 'A
A576: 'C | B576: 'C
A577: 'A | B577: 'A
A578: 'G | B578: 'T
A579: 'T | B579: 'C
A580: 'G | B580: 'G
A581: 'G | B581: 'C
A582: 'G | B582: 'A
A583: 'C | B583: 'G
A584: 'C | B584: 'C
A585: 'T | B585: 'A
A586: 'G | B586: 'T
A587: 'G | B587: 'G
A588: 'G | B588: 'A
A589: 'G | B589: 'C
A590: 'G | B590: 'A
A591: 'G | B591: 'C
A592: 'C | B592: 'A
A593: 'T | B593: 'G
A594: 'G | B594: 'A
A595: 'C | B595: 'T
A596: 'A | B596: 'T
A597: 'G | B597: 'T
A598: 'C | B598: 'A
A599: 'A | B599: 'G
A600: 'C | B600: 'C
A601: 'G | B601: 'A
A602: 'G | B602: 'A
A603: 'C | B603: 'C
A604: 'C | B604: 'T
A605: 'A | B605: 'G
A606: 'G | B606: 'A
A607: 'T | B607: 'G
A608: 'A | B608: 'C
A609: 'C | B609: 'A
A610: 'C | B610: 'T
A611: 'A | B611: 'A
A612: 'T | B612: 'A
A613: 'T | B613: 'A
A614: 'T | B614: 'T
A615: 'T | B615: 'A
A616: 'C | B616: 'A
A617: 'T | B617: 'T
A618: 'T | B618: 'T
A619: 'C | B619: 'T
A620: 'A | B620: 'G
A621: 'G | B621: 'A
A622: 'G | B622: 'C
A623: 'A | B623: 'T
A624: 'A | B624: 'C
A625: 'C | B625: 'G
A626: 'A | B626: 'G
A627: 'A | B627: 'A
A628: 'A | B628: 'T
A629: 'A | B629: 'A
A630: 'T | B630: 'C
A631: 'T | B631: 'T
A632: 'C | B632: 'G
A633: 'C | B633: 'C
A634: 'C | B634: 'T
A635: 'A | B635: 'C
A636: 'G | B636: 'C
A637: 'G | B637: 'A
A638: 'C | B638: 'A
A639: 'C | B639: 'A
A640: 'C | B640: 'A
A641: 'A | B641: 'T
A642: 'A | B642: 'C
A643: 'C | B643: 'C
A644: 'T | B644: 'G
A645: 'T | B645: 'A
A646: 'G | B646: 'A
A647: 'C | B647: 'G
A648: 'A | B648: 'A
A649: 'A | B649: 'G
A650: 'A | B650: 'G
A651: 'C | B651: 'A
A652: 'A | B652: 'C
A653: 'G | B653: 'C
A654: 'A | B654: 'A
A655: 'G | B655: 'A
A656: 'T | B656: 'T
A657: 'C | B657: 'T
A658: 'C | B658: 'T
A659: 'A | B659: 'C
A660: 'G | B660: 'T
A661: 'G | B661: 'T
A662: 'A | B662: 'C
A663: 'A | B663: 'C
A664: 'C | B664: 'A
A665: 'T | B665: 'G
A666: 'G | B666: 'G
A667: 'C | B667: 'A
A668: 'C | B668: 'G
A669: 'T | B669: 'G
A670: 'G | B670: 'A
A671: 'T | B671: 'C
A672: 'G | B672: 'A
A673: 'G | B673: 'A
A674: 'A | B674: 'C
A675: 'G | B675: 'T
A676: 'G | B676: 'A
A677: 'C | B677: 'C
A678: 'T | B678: 'C
A679: 'C | B679: 'T
A680: 'C | B680: 'C
A681: 'T | B681: 'G
A682: 'G | B682: 'T
A683: 'G | B683: 'C
A684: 'G | B684: 'C
A685: 'A | B685: 'T
A686: 'G | B686: 'C
A687: 'A | B687: 'T
A688: 'A | B688: 'G
A689: 'C | B689: 'C
A690: 'G | B690: 'A
A691: 'C | B691: 'G
A692: 'C | B692: 'A
A693: 'G | B693: 'C
A694: 'G | B694: 'C
A695: 'C | B695: 'C
A696: 'G | B696: 'C
A697: 'C | B697: 'T
A698: 'A | B698: 'C
A699: 'G | B699: 'T
A700: 'A | B700: 'C
A701: 'G | B701: 'C
A702: 'C | B702: 'T
A703: 'C | B703: 'C
A704: 'T | B704: 'G
A705: 'T | B705: 'G
A706: 'C | B706: 'C
A707: 'A | B707: 'A
A708: 'G | B708: 'G
A709: 'G | B709: 'C
A710: 'G | B710: 'T
A711: 'G | B711: 'G
A712: 'G | B712: 'A
A713: 'A | B713: 'A
A714: 'C | B714: 'G
A715: 'C | B715: 'G
A716: 'G | B716: 'A
A717: 'A | B717: 'G
A718: 'C | B718: 'T
A719: 'C | B719: 'G
A720: 'T | B720: 'T
A721: 'G | B721: 'G
A722: 'G | B722: 'G
A723: 'G | B723: 'C
A724: 'C | B724: 'C
A725: 'G | B725: 'A
A726: 'G | B726: 'A
A727: 'T | B727: 'T
A728: 'C | B728: 'C
A729: 'C | B729: 'T
A730: 'G | B730: 'G
A731: 'A | B731: 'C
A732: 'G | B732: 'C
A733: 'G | B733: 'T
A734: 'G | B734: 'C
A735: 'G | B735: 'C
A736: 'G | B736: 'A
A737: 'C | B737: 'C
A738: 'G | B738: 'C
A739: 'G | B739: 'T
A740: 'T | B740: 'C
A741: 'C | B741: 'C
A742: 'C | B742: 'C
A743: 'G | B743: 'C
A744: 'A | B744: 'G
A745: 'G | B745: 'C
A746: 'G | B746: 'G
A747: 'G | B747: 'G
A748: 'G | B748: 'A
A749: 'G | B749: 'C
A750: 'C | B750: 'C
A751: 'G | B751: 'C
A752: 'G | B752: 'C
A753: 'T | B753: 'C
A754: 'C | B754: 'T
A755: 'C | B755: 'A
A756: 'G | B756: 'C
A757: 'A | B757: 'T
A758: 'G | B758: 'C
A759: 'G | B759: 'T
A760: 'G | B760: 'C
A761: 'G | B761: 'A
A762: 'C | B762: 'G
A763: 'G | B763: 'G
A764: 'G | B764: 'A
A765: 'T | B765: 'C
A766: 'C | B766: 'C
A767: 'C | B767: 'T
A768: 'G | B768: 'C
A769: 'A | B769: 'C
A770: 'C | B770: 'T
A771: 'G | B771: 'G
A772: 'G | B772: 'C
A773: 'G | B773: 'A
A774: 'C | B774: 'G
A775: 'G | B775: 'C
A776: 'G | B776: 'A
A777: 'G | B777: 'C
A778: 'G | B778: 'C
A779: 'C | B779: 'C
A780: 'C | B780: 'C
A781: 'T | B781: 'A
A782: 'G | B782: 'A
A783: 'A | B783: 'A
A784: 'T | B784: 'C
A785: 'T | B785: 'T
A786: 'C | B786: 'G
A787: 'G | B787: 'G
A788: 'T | B788: 'A
A789: 'G | B789: 'A
A790: 'G | B790: 'G
A791: 'C | B791: 'T
A792: 'G | B792: 'G
A793: 'T | B793: 'G
A794: 'C | B794: 'C
A795: 'T | B795: 'C
A796: 'C | B796: 'G
A797: 'T | B797: 'C
A798: 'G | B798: 'T
A799: 'A | B799: 'G
A800: 'G | B800: 'C
A801: 'G | B801: 'A
A802: 'T | B802: 'G
A803: 'G | B803: 'A
A804: 'T | B804: 'C
A805: 'T | B805: 'C
A806: 'G | B806: 'C
A807: 'T | B807: 'A
A808: 'C | B808: 'A
A809: 'G | B809: 'G
A810: 'A | B810: 'G
A811: 'G | B811: 'A
A812: 'G | B812: 'C
A813: 'C | B813: 'G
A814: 'G | B814: 'A
A815: 'G | B815: 'G
A816: 'C | B816: 'G
A817: 'G | B817: 'G
A818: 'A | B818: 'G
A819: 'A | B819: 'C
A820: 'G | B820: 'A
A821: 'A | B821: 'C
A822: 'C | B822: 'G
A823: 'G | B823: 'C
A824: 'A | B824: 'G
A825: 'G | B825: 'G
A826: 'C | B826: 'G
A827: 'G | B827: 'A
A828: 'T | B828: 'G
A829: 'T | B829: 'C
A830: 'G | B830: 'C
A831: 'G | B831: 'G
A832: 'A | B832: 'G
A833: 'C | B833: 'C
A834: 'T | B834: 'A
A835: 'T | B835: 'G
A836: 'A | B836: 'C
A837: 'C | B837: 'C
A838: 'C | B838: 'C
A839: 'T | B839: 'T
A840: 'C | B840: 'A
A841: 'A | B841: 'G
A842: 'C | B842: 'T
A843: 'T | B843: 'G
A844: 'G | B844: 'G
A845: 'C | B845: 'A
A846: 'T | B846: 'G
A847: 'T | B847: 'C
A848: 'T | B848: 'G
A849: 'T | B849: 'G
A850: 'C | B850: 'T
A851: 'T | B851: 'T
A852: 'A | B852: 'G
A853: 'G | B853: 'G
A854: 'C | B854: 'A
A855: 'G | B855: 'G
A856: 'G | B856: 'A
A857: 'T | B857: 'T
A858: 'A | B858: 'G
A859: 'G | B859: 'T
A860: 'C | B860: 'T
A861: 'A | B861: 'G
A862: 'C | B862: 'A
A863: 'C | B863: 'G
A864: 'T | B864: 'G
A865: 'C | B865: 'T
A866: 'C | B866: 'G
A867: 'T | B867: 'G
A868: 'C | B868: 'G
A869: 'C | B869: 'A
A870: 'G | B870: 'G
A871: 'C | B871: 'G
A872: 'C | B872: 'G
A873: 'A | B873: 'T
A874: 'G | B874: 'C
A875: 'C | B875: 'A
A876: 'T | B876: 'C
A877: 'T | B877: 'C
A878: 'C | B878: 'C
A879: 'C | B879: 'A
A880: 'T | B880: 'G
A881: 'C | B881: 'G
A882: 'G | B882: 'T
A883: 'G | B883: 'G
A884: 'G | B884: 'G
A885: 'A | B885: 'G
A886: 'G | B886: 'G
A887: 'A | B887: 'T
A888: 'C | B888: 'G
A889: 'C | B889: 'A
A890: 'G | B890: 'G
A891: 'C | B891: 'G
A892: 'T | B892: 'C
A893: 'T | B893: 'T
A894: 'T | B894: 'G
A895: 'T | B895: 'G
A896: 'C | B896: 'G
A897: 'C | B897: 'G
A898: 'C | B898: 'T
A899: 'G | B899: 'A
A900: 'C | B900: 'G
A901: 'G | B901: 'G
A902: 'A | B902: 'T
A903: 'G | B903: 'A
A904: 'C | B904: 'G
A905: 'C | B905: 'C
A906: 'G | B906: 'G
A907: 'A | B907: 'G
A908: 'C | B908: 'A
A909: 'C | B909: 'G
A910: 'G | B910: 'T
A911: 'G | B911: 'G
A912: 'T | B912: 'A
A913: 'T | B913: 'A
A914: 'C | B914: 'C
A915: 'T | B915: 'G
A916: 'G | B916: 'G
A917: 'T | B917: 'C
A918: 'C | B918: 'T
A919: 'A | B919: 'T
A920: 'T | B920: 'C
A921: 'G | B921: 'C
A922: 'T | B922: 'G
A923: 'C | B923: 'A
A924: 'G | B924: 'A
A925: 'A | B925: 'G
A926: 'C | B926: 'C
A927: 'C | B927: 'T
A928: 'T | B928: 'C
A929: 'C | B929: 'T
A930: 'A | B930: 'G
A931: 'G | B931: 'G
A932: 'T | B932: 'G
A933: 'C | B933: 'C
A934: 'C | B934: 'C
A935: 'C | B935: 'G
A936: 'A | B936: 'C
A937: 'G | B937: 'C
A938: 'C | B938: 'C
A939: 'G | B939: 'C
A940: 'T | B940: 'C
A941: 'C | B941: 'A
A942: 'G | B942: 'G
A943: 'T | B943: 'G
A944: 'G | B944: 'T
A945: 'A | B945: 'T