Sheet: Usage Chart
A1: 'Residential Electric Power Usage
B3: 'Daily Average Usage (kWh/day)
A4: 'Month/Year | B4: 1990 | C4: 1991 | D4: 1992 | E4: 1993 | F4: 1994 | G4: 1995
A5: 'Sep | B5: 20.9 | C5: 19.2 | D5: 23.5 | E5: 21.4 | F5: 27.1 | G5: 28.1
A6: 'Oct | B6: 19.4 | C6: 21.6 | D6: 22.1 | E6: 25.3 | F6: 26.1 | G6: 29.9
A7: 'Nov | B7: 18.9 | C7: 23.7 | D7: 24.3 | E7: 28.9 | F7: 28.1 | G7: 30.2
A8: 'Dec | B8: 20.4 | C8: 24.5 | D8: 25.3 | E8: 28.7 | F8: 33.1 | G8: 34
A9: 'Jan | B9: 26.3 | C9: 29.2 | D9: 27.8 | E9: 35.4 | F9: 38.6 | G9: 42.4
A10: 'Feb | B10: 26.4 | C10: 32.2 | D10: 29.9 | E10: 32.5 | F10: 36.5 | G10: 36.9
A11: 'Mar | B11: 23 | C11: 27.2 | D11: 25.2 | E11: 31.9 | F11: 34.4 | G11: 34
A12: 'Apr | B12: 21.5 | C12: 23.2 | D12: 23.4 | E12: 28.5 | F12: 33.7 | G12: 32.5
A13: 'May | B13: 20.2 | C13: 22.5 | D13: 21.6 | E13: 25.8 | F13: 27.7 | G13: 31.6
A14: 'Jun | B14: 19.9 | C14: 20.4 | D14: 22.8 | E14: 24.2 | F14: 28.1 | G14: 30.8
A15: 'Jul | B15: 18.7 | C15: 20.5 | D15: 23.3 | E15: 23.5 | F15: 28 | G15: 30.1
A16: 'Aug | B16: 20.3 | C16: 19.9 | D16: 23.4 | E16: 24.9 | F16: 29.5 | G16: 33.6

Sheet: ANOVA
A1: 'Residential Electric Power Usage
A2: 'ANOVA
B4: 'Anova: Single Factor
B6: 'SUMMARY
B7: 'Groups | C7: 'Count | D7: 'Sum | E7: 'Average | F7: 'Variance
B8: 1990 | C8: 12 | D8: 255.9 | E8: 21.325 | F8: 6.83659090909094
B9: 1991 | C9: 12 | D9: 284.1 | E9: 23.675 | F9: 16.1184090909092
B10: 1992 | C10: 12 | D10: 292.6 | E10: 24.3833333333333 | F10: 5.72515151515174
B11: 1993 | C11: 12 | D11: 331 | E11: 27.5833333333333 | F11: 17.2433333333336
B12: 1994 | C12: 12 | D12: 370.9 | E12: 30.9083333333333 | F12: 17.2135606060605
B13: 1995 | C13: 12 | D13: 394.1 | E13: 32.8416666666667 | F13: 14.7771969696962
B16: 'ANOVA
B17: 'Source of Variation | C17: 'SS | D17: 'df | E17: 'MS | F17: 'F | G17: 'P-value | H17: 'F crit
B18: 'Between Groups | C18: 1194.88944444444 | D18: 5 | E18: 238.977888888888 | F18: 18.4031479832138 | G18: 2.12604206194225E-11 | H18: 2.35380781532513
B19: 'Within Groups | C19: 857.056666666664 | D19: 66 | E19: 12.985707070707
B21: 'Total | C21: 2051.9461111111 | D21: 71
F23: =R[-5]C[-1]/R[-4]C[-1] -> 18.4031479832138

Sheet: Correlation
A1: 'Residential Electric Power Usage
A2: 'Correlation
C4: 1990 | D4: 1991 | E4: 1992 | F4: 1993 | G4: 1994 | H4: 1995
B5: 1990 | C5: 1
B6: 1991 | C6: 0.864609749943662 | D6: 1
B7: 1992 | C7: 0.865390762141107 | D7: 0.892457317596501 | E7: 1
B8: 1993 | C8: 0.789775614800007 | D8: 0.924365546683988 | E8: 0.781621813646514 | F8: 1
B9: 1994 | C9: 0.882660999992424 | D9: 0.859167175365194 | E9: 0.840035713694391 | F9: 0.89387959872871 | G9: 1
B10: 1995 | C10: 0.848093674991363 | D10: 0.788454586272743 | E10: 0.765275310865177 | F10: 0.862739851669525 | G10: 0.901091473376091 | H10: 1

Sheet: Statistics
A1: 'Residential Electric Power Usage
B3: 'Basic Statistics
B4: 1990 | D4: 1991 | F4: 1992 | H4: 1993 | J4: 1994 | L4: 1995
B6: 'Mean | C6: 21.325 | D6: 'Mean | E6: 23.675 | F6: 'Mean | G6: 24.3833333333333 | H6: 'Mean | I6: 27.5833333333333 | J6: 'Mean | K6: 30.9083333333333 | L6: 'Mean | M6: 32.8416666666667
B7: 'Standard Error | C7: 0.754795276277556 | D7: 'Standard Error | E7: 1.15896538238887 | F7: 'Standard Error | G7: 0.690721332807941 | H7: 'Standard Error | I7: 1.19872617575678 | J7: 'Standard Error | K7: 1.19769085486964 | L7: 'Standard Error | M7: 1.10969954528603
B8: 'Median | C8: 20.35 | D8: 'Median | E8: 22.85 | F8: 'Median | G8: 23.45 | H8: 'Median | I8: 27.15 | J8: 'Median | K8: 28.8 | L8: 'Median | M8: 32.05
B9: 'Mode | D9: 'Mode | F9: 'Mode | G9: 23.4 | H9: 'Mode | J9: 'Mode | K9: 28.1 | L9: 'Mode | M9: 34
B10: 'Standard Deviation | C10: 2.61468753565143 | D10: 'Standard Deviation | E10: 4.01477385302201 | F10: 'Standard Deviation | G10: 2.39272888459009 | H10: 'Standard Deviation | I10: 4.15250928154696 | J10: 'Standard Deviation | K10: 4.14892282478964 | L10: 'Standard Deviation | M10: 3.84411198714296
B11: 'Sample Variance | C11: 6.83659090909094 | D11: 'Sample Variance | E11: 16.1184090909092 | F11: 'Sample Variance | G11: 5.72515151515174 | H11: 'Sample Variance | I11: 17.2433333333336 | J11: 'Sample Variance | K11: 17.2135606060605 | L11: 'Sample Variance | M11: 14.7771969696962
B12: 'Kurtosis | C12: 0.643492353343798 | D12: 'Kurtosis | E12: 0.339480520673749 | F12: 'Kurtosis | G12: 1.54796415516144 | H12: 'Kurtosis | I12: -0.519626988139276 | J12: 'Kurtosis | K12: -0.969695513933226 | L12: 'Kurtosis | M12: 2.6975347183803
B13: 'Skewness | C13: 1.29870416582981 | D13: 'Skewness | E13: 1.03064387009845 | F13: 'Skewness | G13: 1.33623128374842 | H13: 'Skewness | I13: 0.458914435049279 | J13: 'Skewness | K13: 0.662358421387716 | L13: 'Skewness | M13: 1.46352699978683
B14: 'Range | C14: 7.7 | D14: 'Range | E14: 13 | F14: 'Range | G14: 8.3 | H14: 'Range | I14: 14 | J14: 'Range | K14: 12.5 | L14: 'Range | M14: 14.3
B15: 'Minimum | C15: 18.7 | D15: 'Minimum | E15: 19.2 | F15: 'Minimum | G15: 21.6 | H15: 'Minimum | I15: 21.4 | J15: 'Minimum | K15: 26.1 | L15: 'Minimum | M15: 28.1
B16: 'Maximum | C16: 26.4 | D16: 'Maximum | E16: 32.2 | F16: 'Maximum | G16: 29.9 | H16: 'Maximum | I16: 35.4 | J16: 'Maximum | K16: 38.6 | L16: 'Maximum | M16: 42.4
B17: 'Sum | C17: 255.9 | D17: 'Sum | E17: 284.1 | F17: 'Sum | G17: 292.6 | H17: 'Sum | I17: 331 | J17: 'Sum | K17: 370.9 | L17: 'Sum | M17: 394.1
B18: 'Count | C18: 12 | D18: 'Count | E18: 12 | F18: 'Count | G18: 12 | H18: 'Count | I18: 12 | J18: 'Count | K18: 12 | L18: 'Count | M18: 12
B19: 'Largest(1) | C19: 26.4 | D19: 'Largest(1) | E19: 32.2 | F19: 'Largest(1) | G19: 29.9 | H19: 'Largest(1) | I19: 35.4 | J19: 'Largest(1) | K19: 38.6 | L19: 'Largest(1) | M19: 42.4
B20: 'Smallest(1) | C20: 18.7 | D20: 'Smallest(1) | E20: 19.2 | F20: 'Smallest(1) | G20: 21.6 | H20: 'Smallest(1) | I20: 21.4 | J20: 'Smallest(1) | K20: 26.1 | L20: 'Smallest(1) | M20: 28.1
B21: 'Confidence Level(95.0%) | C21: 1.66129404219141 | D21: 'Confidence Level(95.0%) | E21: 2.55086689779535 | F21: 'Confidence Level(95.0%) | G21: 1.52026817214259 | H21: 'Confidence Level(95.0%) | I21: 2.63837985821116 | J21: 'Confidence Level(95.0%) | K21: 2.63610113115017 | L21: 'Confidence Level(95.0%) | M21: 2.44243346659245

Sheet: FFT
A1: 'Residential Electric Power Usage
I2: 'n= | J2: 64
B4: 'Month | C4: 'Daily Average Usage (kWh/day) | D4: 'Term | E4: 'Fourier Coefficients | I4: 'Magnitude | J4: 'Frequency | K4: 'Period
B5: 33117 | C5: 20.9 | D5: 0 | E5: '1656.7 | I5: =IMABS(RC[-4]) -> #NAME? | J5: 0 | K5: 'Infinite
B6: 33147 | C6: 19.4 | D6: 1 | E6: '13.3325801975743+121.422071786327i | I6: =IMABS(RC[-4]) -> #NAME? | J6: =RC[-6]/R2C10 -> 0.015625 | K6: =1/RC[-1] -> 64
B7: 33178 | C7: 18.9 | D7: 2 | E7: '-27.9374710940332+55.1897756248931i | I7: =IMABS(RC[-4]) -> #NAME? | J7: =RC[-6]/R2C10 -> 0.03125 | K7: =1/RC[-1] -> 32
B8: 33208 | C8: 20.4 | D8: 3 | E8: '-6.682756866897+50.9210810586189i | I8: =IMABS(RC[-4]) -> #NAME? | J8: =RC[-6]/R2C10 -> 0.046875 | K8: =1/RC[-1] -> 21.3333333333333
B9: 33239 | C9: 26.3 | D9: 4 | E9: '-16.4441758305038-4.63784659125856i | I9: =IMABS(RC[-4]) -> #NAME? | J9: =RC[-6]/R2C10 -> 0.0625 | K9: =1/RC[-1] -> 16
B10: 33270 | C10: 26.4 | D10: 5 | E10: '29.3786155891547-85.3854777040556i | I10: =IMABS(RC[-4]) -> #NAME? | J10: =RC[-6]/R2C10 -> 0.078125 | K10: =1/RC[-1] -> 12.8
B11: 33298 | C11: 23 | D11: 6 | E11: '-17.4073127354454+80.0300173114832i | I11: =IMABS(RC[-4]) -> #NAME? | J11: =RC[-6]/R2C10 -> 0.09375 | K11: =1/RC[-1] -> 10.6666666666667
B12: 33329 | C12: 21.5 | D12: 7 | E12: '-13.1119042770068+52.2060788190727i | I12: =IMABS(RC[-4]) -> #NAME? | J12: =RC[-6]/R2C10 -> 0.109375 | K12: =1/RC[-1] -> 9.14285714285714
B13: 33359 | C13: 20.2 | D13: 8 | E13: '-7.06984848098348+21.7279220613579i | I13: =IMABS(RC[-4]) -> #NAME? | J13: =RC[-6]/R2C10 -> 0.125 | K13: =1/RC[-1] -> 8
B14: 33390 | C14: 19.9 | D14: 9 | E14: '-22.54047040674+21.1177102702097i | I14: =IMABS(RC[-4]) -> #NAME? | J14: =RC[-6]/R2C10 -> 0.140625 | K14: =1/RC[-1] -> 7.11111111111111
B15: 33420 | C15: 18.7 | D15: 10 | E15: '-21.8295820000543+11.1875274565675i | I15: =IMABS(RC[-4]) -> #NAME? | J15: =RC[-6]/R2C10 -> 0.15625 | K15: =1/RC[-1] -> 6.4
B16: 33451 | C16: 20.3 | D16: 11 | E16: '31.1228477478507+26.5885553351886i | I16: =IMABS(RC[-4]) -> #NAME? | J16: =RC[-6]/R2C10 -> 0.171875 | K16: =1/RC[-1] -> 5.81818181818182
B17: 33482 | C17: 19.2 | D17: 12 | E17: '5.1378571498428+13.2689720370488i | I17: =IMABS(RC[-4]) -> #NAME? | J17: =RC[-6]/R2C10 -> 0.1875 | K17: =1/RC[-1] -> 5.33333333333333
B18: 33512 | C18: 21.6 | D18: 13 | E18: '1.89156330032191+24.0649951503389i | I18: =IMABS(RC[-4]) -> #NAME? | J18: =RC[-6]/R2C10 -> 0.203125 | K18: =1/RC[-1] -> 4.92307692307692
B19: 33543 | C19: 23.7 | D19: 14 | E19: '-6.79928247934635+7.30195488444692i | I19: =IMABS(RC[-4]) -> #NAME? | J19: =RC[-6]/R2C10 -> 0.21875 | K19: =1/RC[-1] -> 4.57142857142857
B20: 33573 | C20: 24.5 | D20: 15 | E20: '12.8498068631754+12.6293875633888i | I20: =IMABS(RC[-4]) -> #NAME? | J20: =RC[-6]/R2C10 -> 0.234375 | K20: =1/RC[-1] -> 4.26666666666667
B21: 33604 | C21: 29.2 | D21: 16 | E21: '5.50000000000005-2.99999999999994i | I21: =IMABS(RC[-4]) -> #NAME? | J21: =RC[-6]/R2C10 -> 0.25 | K21: =1/RC[-1] -> 4
B22: 33635 | C22: 32.2 | D22: 17 | E22: '-11.6522967732408+13.5151749644385i | I22: =IMABS(RC[-4]) -> #NAME? | J22: =RC[-6]/R2C10 -> 0.265625 | K22: =1/RC[-1] -> 3.76470588235294
B23: 33664 | C23: 27.2 | D23: 18 | E23: '-14.2872550838265+7.88056262575426i | I23: =IMABS(RC[-4]) -> #NAME? | J23: =RC[-6]/R2C10 -> 0.28125 | K23: =1/RC[-1] -> 3.55555555555556
B24: 33695 | C24: 23.2 | D24: 19 | E24: '-0.569824581761672-8.85841702866303i | I24: =IMABS(RC[-4]) -> #NAME? | J24: =RC[-6]/R2C10 -> 0.296875 | K24: =1/RC[-1] -> 3.36842105263158
B25: 33725 | C25: 22.5 | D25: 20 | E25: '-7.56140695106108-4.22808423779885i | I25: =IMABS(RC[-4]) -> #NAME? | J25: =RC[-6]/R2C10 -> 0.3125 | K25: =1/RC[-1] -> 3.2
B26: 33756 | C26: 20.4 | D26: 21 | E26: '-10.477194251915+2.08269367430184i | I26: =IMABS(RC[-4]) -> #NAME? | J26: =RC[-6]/R2C10 -> 0.328125 | K26: =1/RC[-1] -> 3.04761904761905
B27: 33786 | C27: 20.5 | D27: 22 | E27: '-0.886673241364354+18.5928732014847i | I27: =IMABS(RC[-4]) -> #NAME? | J27: =RC[-6]/R2C10 -> 0.34375 | K27: =1/RC[-1] -> 2.90909090909091
B28: 33817 | C28: 19.9 | D28: 23 | E28: '-12.9801583844602+3.99208346421355i | I28: =IMABS(RC[-4]) -> #NAME? | J28: =RC[-6]/R2C10 -> 0.359375 | K28: =1/RC[-1] -> 2.78260869565217
B29: 33848 | C29: 23.5 | D29: 24 | E29: '-1.13015151901653+3.72792206135788i | I29: =IMABS(RC[-4]) -> #NAME? | J29: =RC[-6]/R2C10 -> 0.375 | K29: =1/RC[-1] -> 2.66666666666667
B30: 33878 | C30: 22.1 | D30: 25 | E30: '-19.0388300101091+4.70505183664551i | I30: =IMABS(RC[-4]) -> #NAME? | J30: =RC[-6]/R2C10 -> 0.390625 | K30: =1/RC[-1] -> 2.56
B31: 33909 | C31: 24.3 | D31: 26 | E31: '-8.00536421127021+1.10458392506803i | I31: =IMABS(RC[-4]) -> #NAME? | J31: =RC[-6]/R2C10 -> 0.40625 | K31: =1/RC[-1] -> 2.46153846153846
B32: 33939 | C32: 25.3 | D32: 27 | E32: '5.43603612935256+5.12718591209157i | I32: =IMABS(RC[-4]) -> #NAME? | J32: =RC[-6]/R2C10 -> 0.421875 | K32: =1/RC[-1] -> 2.37037037037037
B33: 33970 | C33: 27.8 | D33: 28 | E33: '-13.1322743682779+9.46509713389376i | I33: =IMABS(RC[-4]) -> #NAME? | J33: =RC[-6]/R2C10 -> 0.4375 | K33: =1/RC[-1] -> 2.28571428571429
B34: 34001 | C34: 29.9 | D34: 29 | E34: '6.52610967831004+6.4732217164987i | I34: =IMABS(RC[-4]) -> #NAME? | J34: =RC[-6]/R2C10 -> 0.453125 | K34: =1/RC[-1] -> 2.20689655172414
B35: 34029 | C35: 25.2 | D35: 30 | E35: '-13.2470591546592+4.63760423486797i | I35: =IMABS(RC[-4]) -> #NAME? | J35: =RC[-6]/R2C10 -> 0.46875 | K35: =1/RC[-1] -> 2.13333333333333
B36: 34060 | C36: 23.4 | D36: 31 | E36: '-14.6841239536084-1.01051342920644i | I36: =IMABS(RC[-4]) -> #NAME? | J36: =RC[-6]/R2C10 -> 0.484375 | K36: =1/RC[-1] -> 2.06451612903226
B37: 34090 | C37: 21.6 | D37: 32 | E37: '-6.5 | I37: =IMABS(RC[-4]) -> #NAME? | J37: =RC[-6]/R2C10 -> 0.5 | K37: =1/RC[-1] -> 2
B38: 34121 | C38: 22.8 | D38: 33 | E38: '-14.6841239536086+1.01051342920654i | I38: =IMABS(RC[-4]) -> #NAME? | J38: =-(R2C10-RC[-6])/R2C10 -> -0.484375 | K38: =1/RC[-1] -> -2.06451612903226
B39: 34151 | C39: 23.3 | D39: 34 | E39: '-13.2470591546593-4.63760423486795i | I39: =IMABS(RC[-4]) -> #NAME? | J39: =-(R2C10-RC[-6])/R2C10 -> -0.46875 | K39: =1/RC[-1] -> -2.13333333333333
B40: 34182 | C40: 23.4 | D40: 35 | E40: '6.52610967830997-6.4732217164987i | I40: =IMABS(RC[-4]) -> #NAME? | J40: =-(R2C10-RC[-6])/R2C10 -> -0.453125 | K40: =1/RC[-1] -> -2.20689655172414
B41: 34213 | C41: 21.4 | D41: 36 | E41: '-13.1322743682779-9.46509713389375i | I41: =IMABS(RC[-4]) -> #NAME? | J41: =-(R2C10-RC[-6])/R2C10 -> -0.4375 | K41: =1/RC[-1] -> -2.28571428571429
B42: 34243 | C42: 25.3 | D42: 37 | E42: '5.43603612935263-5.12718591209155i | I42: =IMABS(RC[-4]) -> #NAME? | J42: =-(R2C10-RC[-6])/R2C10 -> -0.421875 | K42: =1/RC[-1] -> -2.37037037037037
B43: 34274 | C43: 28.9 | D43: 38 | E43: '-8.00536421127028-1.10458392506802i | I43: =IMABS(RC[-4]) -> #NAME? | J43: =-(R2C10-RC[-6])/R2C10 -> -0.40625 | K43: =1/RC[-1] -> -2.46153846153846
B44: 34304 | C44: 28.7 | D44: 39 | E44: '-19.0388300101092-4.70505183664543i | I44: =IMABS(RC[-4]) -> #NAME? | J44: =-(R2C10-RC[-6])/R2C10 -> -0.390625 | K44: =1/RC[-1] -> -2.56
B45: 34335 | C45: 35.4 | D45: 40 | E45: '-1.13015151901656-3.72792206135787i | I45: =IMABS(RC[-4]) -> #NAME? | J45: =-(R2C10-RC[-6])/R2C10 -> -0.375 | K45: =1/RC[-1] -> -2.66666666666667
B46: 34366 | C46: 32.5 | D46: 41 | E46: '-12.9801583844602-3.9920834642135i | I46: =IMABS(RC[-4]) -> #NAME? | J46: =-(R2C10-RC[-6])/R2C10 -> -0.359375 | K46: =1/RC[-1] -> -2.78260869565217
B47: 34394 | C47: 31.9 | D47: 42 | E47: '-0.886673241364401-18.5928732014847i | I47: =IMABS(RC[-4]) -> #NAME? | J47: =-(R2C10-RC[-6])/R2C10 -> -0.34375 | K47: =1/RC[-1] -> -2.90909090909091
B48: 34425 | C48: 28.5 | D48: 43 | E48: '-10.477194251915-2.08269367430177i | I48: =IMABS(RC[-4]) -> #NAME? | J48: =-(R2C10-RC[-6])/R2C10 -> -0.328125 | K48: =1/RC[-1] -> -3.04761904761905
B49: 34455 | C49: 25.8 | D49: 44 | E49: '-7.56140695106109+4.22808423779886i | I49: =IMABS(RC[-4]) -> #NAME? | J49: =-(R2C10-RC[-6])/R2C10 -> -0.3125 | K49: =1/RC[-1] -> -3.2
B50: 34486 | C50: 24.2 | D50: 45 | E50: '-0.569824581761658+8.85841702866308i | I50: =IMABS(RC[-4]) -> #NAME? | J50: =-(R2C10-RC[-6])/R2C10 -> -0.296875 | K50: =1/RC[-1] -> -3.36842105263158
B51: 34516 | C51: 23.5 | D51: 46 | E51: '-14.2872550838265-7.88056262575424i | I51: =IMABS(RC[-4]) -> #NAME? | J51: =-(R2C10-RC[-6])/R2C10 -> -0.28125 | K51: =1/RC[-1] -> -3.55555555555556
B52: 34547 | C52: 24.9 | D52: 47 | E52: '-11.6522967732409-13.5151749644384i | I52: =IMABS(RC[-4]) -> #NAME? | J52: =-(R2C10-RC[-6])/R2C10 -> -0.265625 | K52: =1/RC[-1] -> -3.76470588235294
B53: 34578 | C53: 27.1 | D53: 48 | E53: '5.50000000000006+2.99999999999994i | I53: =IMABS(RC[-4]) -> #NAME? | J53: =-(R2C10-RC[-6])/R2C10 -> -0.25 | K53: =1/RC[-1] -> -4
B54: 34608 | C54: 26.1 | D54: 49 | E54: '12.8498068631753-12.6293875633889i | I54: =IMABS(RC[-4]) -> #NAME? | J54: =-(R2C10-RC[-6])/R2C10 -> -0.234375 | K54: =1/RC[-1] -> -4.26666666666667
B55: 34639 | C55: 28.1 | D55: 50 | E55: '-6.79928247934637-7.30195488444694i | I55: =IMABS(RC[-4]) -> #NAME? | J55: =-(R2C10-RC[-6])/R2C10 -> -0.21875 | K55: =1/RC[-1] -> -4.57142857142857
B56: 34669 | C56: 33.1 | D56: 51 | E56: '1.89156330032178-24.064995150339i | I56: =IMABS(RC[-4]) -> #NAME? | J56: =-(R2C10-RC[-6])/R2C10 -> -0.203125 | K56: =1/RC[-1] -> -4.92307692307692
B57: 34700 | C57: 38.6 | D57: 52 | E57: '5.13785714984278-13.2689720370489i | I57: =IMABS(RC[-4]) -> #NAME? | J57: =-(R2C10-RC[-6])/R2C10 -> -0.1875 | K57: =1/RC[-1] -> -5.33333333333333
B58: 34731 | C58: 36.5 | D58: 53 | E58: '31.1228477478506-26.5885553351887i | I58: =IMABS(RC[-4]) -> #NAME? | J58: =-(R2C10-RC[-6])/R2C10 -> -0.171875 | K58: =1/RC[-1] -> -5.81818181818182
B59: 34759 | C59: 34.4 | D59: 54 | E59: '-21.8295820000544-11.1875274565674i | I59: =IMABS(RC[-4]) -> #NAME? | J59: =-(R2C10-RC[-6])/R2C10 -> -0.15625 | K59: =1/RC[-1] -> -6.4
B60: 34790 | C60: 33.7 | D60: 55 | E60: '-22.5404704067401-21.1177102702097i | I60: =IMABS(RC[-4]) -> #NAME? | J60: =-(R2C10-RC[-6])/R2C10 -> -0.140625 | K60: =1/RC[-1] -> -7.11111111111111
B61: 34820 | C61: 27.7 | D61: 56 | E61: '-7.06984848098352-21.7279220613579i | I61: =IMABS(RC[-4]) -> #NAME? | J61: =-(R2C10-RC[-6])/R2C10 -> -0.125 | K61: =1/RC[-1] -> -8
B62: 34851 | C62: 28.1 | D62: 57 | E62: '-13.111904277007-52.2060788190728i | I62: =IMABS(RC[-4]) -> #NAME? | J62: =-(R2C10-RC[-6])/R2C10 -> -0.109375 | K62: =1/RC[-1] -> -9.14285714285714
B63: 34881 | C63: 28 | D63: 58 | E63: '-17.4073127354457-80.0300173114832i | I63: =IMABS(RC[-4]) -> #NAME? | J63: =-(R2C10-RC[-6])/R2C10 -> -0.09375 | K63: =1/RC[-1] -> -10.6666666666667
B64: 34912 | C64: 29.5 | D64: 59 | E64: '29.378615589155+85.3854777040555i | I64: =IMABS(RC[-4]) -> #NAME? | J64: =-(R2C10-RC[-6])/R2C10 -> -0.078125 | K64: =1/RC[-1] -> -12.8
B65: 34943 | C65: 28.1 | D65: 60 | E65: '-16.4441758305038+4.63784659125857i | I65: =IMABS(RC[-4]) -> #NAME? | J65: =-(R2C10-RC[-6])/R2C10 -> -0.0625 | K65: =1/RC[-1] -> -16
B66: 34973 | C66: 29.9 | D66: 61 | E66: '-6.68275686689722-50.9210810586189i | I66: =IMABS(RC[-4]) -> #NAME? | J66: =-(R2C10-RC[-6])/R2C10 -> -0.046875 | K66: =1/RC[-1] -> -21.3333333333333
B67: 35004 | C67: 30.2 | D67: 62 | E67: '-27.9374710940334-55.1897756248931i | I67: =IMABS(RC[-4]) -> #NAME? | J67: =-(R2C10-RC[-6])/R2C10 -> -0.03125 | K67: =1/RC[-1] -> -32
B68: 35034 | C68: 34 | D68: 63 | E68: '13.3325801975738-121.422071786327i | I68: =IMABS(RC[-4]) -> #NAME? | J68: =-(R2C10-RC[-6])/R2C10 -> -0.015625 | K68: =1/RC[-1] -> -64
B69: 35065 | C69: 42.4
B70: 35096 | C70: 36.9
B71: 35125 | C71: 34
B72: 35156 | C72: 32.5
B73: 35186 | C73: 31.6
B74: 35217 | C74: 30.8
B75: 35247 | C75: 30.1
B76: 35278 | C76: 33.6

Sheet: Fit
A1: 'Residential Electric Power Usage
A2: 'Coefficients | D2: 'Curve Fit Statistics
A3: 'A= | B3: -3.93295360299084 | D3: 'SumSquared Residual | E3: =R[+79]C -> 1493.74350474638
A4: 'B= | B4: 0.525280433559757 | D4: 'Average Y | E4: =AVERAGE(R[+6]C[-3]:R[+77]C[-3]) -> 26.7861111111111
A5: 'C= | B5: 1.62201978246256 | D5: 'SumSquared Average | E5: =R[+77]C[+1] -> 2051.94611111111
A6: 'D= | B6: 26.797961292304 | E6: =1-R[-3]C/R[-1]C -> 0.272035704710815
A7: 'E= | B7: 0
A9: 'Month | B9: 'Usage (kWh/day) | C9: 't | D9: 'Fit | F9: '(y-<y>)^2
A10: 33117 | B10: 20.9 | C10: 1 | D10: =Fit!R3C2*SIN(Fit!R4C2*RC[-1]+Fit!R5C2)+Fit!R6C2+Fit!R7C2*RC[-1] -> 23.5006772681086 | E10: =(RC[-1]-RC[-3])^2 -> 6.7635222528566 | F10: =(RC[-4]-R4C5)^2 -> 34.6463040123457
A11: 33147 | B11: 19.4 | C11: 2 | D11: =Fit!R3C2*SIN(Fit!R4C2*RC[-1]+Fit!R5C2)+Fit!R6C2+Fit!R7C2*RC[-1] -> 25.0202458179487 | E11: =(RC[-1]-RC[-3])^2 -> 31.5871630541701 | F11: =(RC[-4]-R4C5)^2 -> 54.554637345679
A12: 33178 | B12: 18.9 | C12: 3 | D12: =Fit!R3C2*SIN(Fit!R4C2*RC[-1]+Fit!R5C2)+Fit!R6C2+Fit!R7C2*RC[-1] -> 27.0191456552827 | E12: =(RC[-1]-RC[-3])^2 -> 65.9205261716962 | F12: =(RC[-4]-R4C5)^2 -> 62.1907484567902
A13: 33208 | B13: 20.4 | C13: 4 | D13: =Fit!R3C2*SIN(Fit!R4C2*RC[-1]+Fit!R5C2)+Fit!R6C2+Fit!R7C2*RC[-1] -> 28.9584068232067 | E13: =(RC[-1]-RC[-3])^2 -> 73.2463273515113 | F13: =(RC[-4]-R4C5)^2 -> 40.7824151234568
A14: 33239 | B14: 26.3 | C14: 5 | D14: =Fit!R3C2*SIN(Fit!R4C2*RC[-1]+Fit!R5C2)+Fit!R6C2+Fit!R7C2*RC[-1] -> 30.3151399359798 | E14: =(RC[-1]-RC[-3])^2 -> 16.1213487054997 | F14: =(RC[-4]-R4C5)^2 -> 0.236304012345679
A15: 33270 | B15: 26.4 | C15: 6 | D15: =Fit!R3C2*SIN(Fit!R4C2*RC[-1]+Fit!R5C2)+Fit!R6C2+Fit!R7C2*RC[-1] -> 30.7235245689544 | E15: =(RC[-1]-RC[-3])^2 -> 18.6928646983526 | F15: =(RC[-4]-R4C5)^2 -> 0.149081790123458
A16: 33298 | B16: 23 | C16: 7 | D16: =Fit!R3C2*SIN(Fit!R4C2*RC[-1]+Fit!R5C2)+Fit!R6C2+Fit!R7C2*RC[-1] -> 30.0734466264048 | E16: =(RC[-1]-RC[-3])^2 -> 50.0336471765978 | F16: =(RC[-4]-R4C5)^2 -> 14.334637345679
A17: 33329 | B17: 21.5 | C17: 8 | D17: =Fit!R3C2*SIN(Fit!R4C2*RC[-1]+Fit!R5C2)+Fit!R6C2+Fit!R7C2*RC[-1] -> 28.5401887683903 | E17: =(RC[-1]-RC[-3])^2 -> 49.5642578945692 | F17: =(RC[-4]-R4C5)^2 -> 27.9429706790123
A18: 33359 | B18: 20.2 | C18: 9 | D18: =Fit!R3C2*SIN(Fit!R4C2*RC[-1]+Fit!R5C2)+Fit!R6C2+Fit!R7C2*RC[-1] -> 26.5371683689194 | E18: =(RC[-1]-RC[-3])^2 -> 40.1597029360321 | F18: =(RC[-4]-R4C5)^2 -> 43.3768595679012
A19: 33390 | B19: 19.9 | C19: 10 | D19: =Fit!R3C2*SIN(Fit!R4C2*RC[-1]+Fit!R5C2)+Fit!R6C2+Fit!R7C2*RC[-1] -> 24.6044664256572 | E19: =(RC[-1]-RC[-3])^2 -> 22.1320043501363 | F19: =(RC[-4]-R4C5)^2 -> 47.4185262345679
A20: 33420 | B20: 18.7 | C20: 11 | D20: =Fit!R3C2*SIN(Fit!R4C2*RC[-1]+Fit!R5C2)+Fit!R6C2+Fit!R7C2*RC[-1] -> 23.2632037389625 | E20: =(RC[-1]-RC[-3])^2 -> 20.8228283632809 | F20: =(RC[-4]-R4C5)^2 -> 65.3851929012346
A21: 33451 | B21: 20.3 | C21: 12 | D21: =Fit!R3C2*SIN(Fit!R4C2*RC[-1]+Fit!R5C2)+Fit!R6C2+Fit!R7C2*RC[-1] -> 22.8750293914667 | E21: =(RC[-1]-RC[-3])^2 -> 6.63077636691753 | F21: =(RC[-4]-R4C5)^2 -> 42.069637345679
A22: 33482 | B22: 19.2 | C22: 13 | D22: =Fit!R3C2*SIN(Fit!R4C2*RC[-1]+Fit!R5C2)+Fit!R6C2+Fit!R7C2*RC[-1] -> 23.5446081129546 | E22: =(RC[-1]-RC[-3])^2 -> 18.8756196551513 | F22: =(RC[-4]-R4C5)^2 -> 57.5490817901235
A23: 33512 | B23: 21.6 | C23: 14 | D23: =Fit!R3C2*SIN(Fit!R4C2*RC[-1]+Fit!R5C2)+Fit!R6C2+Fit!R7C2*RC[-1] -> 25.0913991840145 | E23: =(RC[-1]-RC[-3])^2 -> 12.1898682621374 | F23: =(RC[-4]-R4C5)^2 -> 26.8957484567901
A24: 33543 | B24: 23.7 | C24: 15 | D24: =Fit!R3C2*SIN(Fit!R4C2*RC[-1]+Fit!R5C2)+Fit!R6C2+Fit!R7C2*RC[-1] -> 27.0983362257626 | E24: =(RC[-1]-RC[-3])^2 -> 11.5486891033305 | F24: =(RC[-4]-R4C5)^2 -> 9.52408179012346
A25: 33573 | B25: 24.5 | C25: 16 | D25: =Fit!R3C2*SIN(Fit!R4C2*RC[-1]+Fit!R5C2)+Fit!R6C2+Fit!R7C2*RC[-1] -> 29.0242821833566 | E25: =(RC[-1]-RC[-3])^2 -> 20.4691292746375 | F25: =(RC[-4]-R4C5)^2 -> 5.22630401234568
A26: 33604 | B26: 29.2 | C26: 17 | D26: =Fit!R3C2*SIN(Fit!R4C2*RC[-1]+Fit!R5C2)+Fit!R6C2+Fit!R7C2*RC[-1] -> 30.3499378951395 | E26: =(RC[-1]-RC[-3])^2 -> 1.32235716267797 | F26: =(RC[-4]-R4C5)^2 -> 5.82685956790123
A27: 33635 | B27: 32.2 | C27: 18 | D27: =Fit!R3C2*SIN(Fit!R4C2*RC[-1]+Fit!R5C2)+Fit!R6C2+Fit!R7C2*RC[-1] -> 30.717862438608 | E27: =(RC[-1]-RC[-3])^2 -> 2.19673175088911 | F27: =(RC[-4]-R4C5)^2 -> 29.3101929012346
A28: 33664 | B28: 27.2 | C28: 19 | D28: =Fit!R3C2*SIN(Fit!R4C2*RC[-1]+Fit!R5C2)+Fit!R6C2+Fit!R7C2*RC[-1] -> 30.0288511054351 | E28: =(RC[-1]-RC[-3])^2 -> 8.00239857672152 | F28: =(RC[-4]-R4C5)^2 -> 0.171304012345678
A29: 33695 | B29: 23.2 | C29: 20 | D29: =Fit!R3C2*SIN(Fit!R4C2*RC[-1]+Fit!R5C2)+Fit!R6C2+Fit!R7C2*RC[-1] -> 28.4686842942235 | E29: =(RC[-1]-RC[-3])^2 -> 27.7590341921975 | F29: =(RC[-4]-R4C5)^2 -> 12.8601929012346
A30: 33725 | B30: 22.5 | C30: 21 | D30: =Fit!R3C2*SIN(Fit!R4C2*RC[-1]+Fit!R5C2)+Fit!R6C2+Fit!R7C2*RC[-1] -> 26.4580349287966 | E30: =(RC[-1]-RC[-3])^2 -> 15.6660404975737 | F30: =(RC[-4]-R4C5)^2 -> 18.3707484567901
A31: 33756 | B31: 20.4 | C31: 22 | D31: =Fit!R3C2*SIN(Fit!R4C2*RC[-1]+Fit!R5C2)+Fit!R6C2+Fit!R7C2*RC[-1] -> 24.539041030076 | E31: =(RC[-1]-RC[-3])^2 -> 17.1316606486524 | F31: =(RC[-4]-R4C5)^2 -> 40.7824151234568
A32: 33786 | B32: 20.5 | C32: 23 | D32: =Fit!R3C2*SIN(Fit!R4C2*RC[-1]+Fit!R5C2)+Fit!R6C2+Fit!R7C2*RC[-1] -> 23.2291272531518 | E32: =(RC[-1]-RC[-3])^2 -> 7.44813556389582 | F32: =(RC[-4]-R4C5)^2 -> 39.5151929012346
A33: 33817 | B33: 19.9 | C33: 24 | D33: =Fit!R3C2*SIN(Fit!R4C2*RC[-1]+Fit!R5C2)+Fit!R6C2+Fit!R7C2*RC[-1] -> 22.8814899707038 | E33: =(RC[-1]-RC[-3])^2 -> 8.88928244540725 | F33: =(RC[-4]-R4C5)^2 -> 47.4185262345679
A34: 33848 | B34: 23.5 | C34: 25 | D34: =Fit!R3C2*SIN(Fit!R4C2*RC[-1]+Fit!R5C2)+Fit!R6C2+Fit!R7C2*RC[-1] -> 23.5898637699482 | E34: =(RC[-1]-RC[-3])^2 -> 0.00807549714930726 | F34: =(RC[-4]-R4C5)^2 -> 10.7985262345679
A35: 33878 | B35: 22.1 | C35: 26 | D35: =Fit!R3C2*SIN(Fit!R4C2*RC[-1]+Fit!R5C2)+Fit!R6C2+Fit!R7C2*RC[-1] -> 25.1632474866848 | E35: =(RC[-1]-RC[-3])^2 -> 9.38348516468084 | F35: =(RC[-4]-R4C5)^2 -> 21.959637345679
A36: 33909 | B36: 24.3 | C36: 27 | D36: =Fit!R3C2*SIN(Fit!R4C2*RC[-1]+Fit!R5C2)+Fit!R6C2+Fit!R7C2*RC[-1] -> 27.1774044792549 | E36: =(RC[-1]-RC[-3])^2 -> 8.27945653723593 | F36: =(RC[-4]-R4C5)^2 -> 6.18074845679012
A37: 33939 | B37: 25.3 | C37: 28 | D37: =Fit!R3C2*SIN(Fit!R4C2*RC[-1]+Fit!R5C2)+Fit!R6C2+Fit!R7C2*RC[-1] -> 29.0892509536595 | E37: =(RC[-1]-RC[-3])^2 -> 14.3584227898095 | F37: =(RC[-4]-R4C5)^2 -> 2.2085262345679
A38: 33970 | B38: 27.8 | C38: 29 | D38: =Fit!R3C2*SIN(Fit!R4C2*RC[-1]+Fit!R5C2)+Fit!R6C2+Fit!R7C2*RC[-1] -> 30.3832894384042 | E38: =(RC[-1]-RC[-3])^2 -> 6.6733843225706 | F38: =(RC[-4]-R4C5)^2 -> 1.02797067901235
A39: 34001 | B39: 29.9 | C39: 30 | D39: =Fit!R3C2*SIN(Fit!R4C2*RC[-1]+Fit!R5C2)+Fit!R6C2+Fit!R7C2*RC[-1] -> 30.7106040682072 | E39: =(RC[-1]-RC[-3])^2 -> 0.657078955394117 | F39: =(RC[-4]-R4C5)^2 -> 9.69630401234567
A40: 34029 | B40: 25.2 | C40: 31 | D40: =Fit!R3C2*SIN(Fit!R4C2*RC[-1]+Fit!R5C2)+Fit!R6C2+Fit!R7C2*RC[-1] -> 29.9829399197233 | E40: =(RC[-1]-RC[-3])^2 -> 22.8765142756828 | F40: =(RC[-4]-R4C5)^2 -> 2.51574845679013
A41: 34060 | B41: 23.4 | C41: 32 | D41: =Fit!R3C2*SIN(Fit!R4C2*RC[-1]+Fit!R5C2)+Fit!R6C2+Fit!R7C2*RC[-1] -> 28.3964994776512 | E41: =(RC[-1]-RC[-3])^2 -> 24.9650070301683 | F41: =(RC[-4]-R4C5)^2 -> 11.4657484567901
A42: 34090 | B42: 21.6 | C42: 33 | D42: =Fit!R3C2*SIN(Fit!R4C2*RC[-1]+Fit!R5C2)+Fit!R6C2+Fit!R7C2*RC[-1] -> 26.3790399115719 | E42: =(RC[-1]-RC[-3])^2 -> 22.839222476397 | F42: =(RC[-4]-R4C5)^2 -> 26.8957484567901
A43: 34121 | B43: 22.8 | C43: 34 | D43: =Fit!R3C2*SIN(Fit!R4C2*RC[-1]+Fit!R5C2)+Fit!R6C2+Fit!R7C2*RC[-1] -> 24.4745354992738 | E43: =(RC[-1]-RC[-3])^2 -> 2.80406913832817 | F43: =(RC[-4]-R4C5)^2 -> 15.8890817901235
A44: 34151 | B44: 23.3 | C44: 35 | D44: =Fit!R3C2*SIN(Fit!R4C2*RC[-1]+Fit!R5C2)+Fit!R6C2+Fit!R7C2*RC[-1] -> 23.1965040478265 | E44: =(RC[-1]-RC[-3])^2 -> 0.0107114121163045 | F44: =(RC[-4]-R4C5)^2 -> 12.1529706790123
A45: 34182 | B45: 23.4 | C45: 36 | D45: =Fit!R3C2*SIN(Fit!R4C2*RC[-1]+Fit!R5C2)+Fit!R6C2+Fit!R7C2*RC[-1] -> 22.8895453933212 | E45: =(RC[-1]-RC[-3])^2 -> 0.260563905479564 | F45: =(RC[-4]-R4C5)^2 -> 11.4657484567901
A46: 34213 | B46: 21.4 | C46: 37 | D46: =Fit!R3C2*SIN(Fit!R4C2*RC[-1]+Fit!R5C2)+Fit!R6C2+Fit!R7C2*RC[-1] -> 23.6364258103357 | E46: =(RC[-1]-RC[-3])^2 -> 5.00160040513577 | F46: =(RC[-4]-R4C5)^2 -> 29.0101929012346
A47: 34243 | B47: 25.3 | C47: 38 | D47: =Fit!R3C2*SIN(Fit!R4C2*RC[-1]+Fit!R5C2)+Fit!R6C2+Fit!R7C2*RC[-1] -> 25.2357614682986 | E47: =(RC[-1]-RC[-3])^2 -> 0.00412658895514753 | F47: =(RC[-4]-R4C5)^2 -> 2.2085262345679
A48: 34274 | B48: 28.9 | C48: 39 | D48: =Fit!R3C2*SIN(Fit!R4C2*RC[-1]+Fit!R5C2)+Fit!R6C2+Fit!R7C2*RC[-1] -> 27.2563182180309 | E48: =(RC[-1]-RC[-3])^2 -> 2.70168980037722 | F48: =(RC[-4]-R4C5)^2 -> 4.46852623456789
A49: 34304 | B49: 28.7 | C49: 40 | D49: =Fit!R3C2*SIN(Fit!R4C2*RC[-1]+Fit!R5C2)+Fit!R6C2+Fit!R7C2*RC[-1] -> 29.1532866778991 | E49: =(RC[-1]-RC[-3])^2 -> 0.205468812360781 | F49: =(RC[-4]-R4C5)^2 -> 3.66297067901234
A50: 34335 | B50: 35.4 | C50: 41 | D50: =Fit!R3C2*SIN(Fit!R4C2*RC[-1]+Fit!R5C2)+Fit!R6C2+Fit!R7C2*RC[-1] -> 30.4151809845462 | E50: =(RC[-1]-RC[-3])^2 -> 24.84842061683 | F50: =(RC[-4]-R4C5)^2 -> 74.1990817901234
A51: 34366 | B51: 32.5 | C51: 42 | D51: =Fit!R3C2*SIN(Fit!R4C2*RC[-1]+Fit!R5C2)+Fit!R6C2+Fit!R7C2*RC[-1] -> 30.7017524134649 | E51: =(RC[-1]-RC[-3])^2 -> 3.23369438247938 | F51: =(RC[-4]-R4C5)^2 -> 32.6485262345679
A52: 34394 | B52: 31.9 | C52: 43 | D52: =Fit!R3C2*SIN(Fit!R4C2*RC[-1]+Fit!R5C2)+Fit!R6C2+Fit!R7C2*RC[-1] -> 29.9357317649637 | E52: =(RC[-1]-RC[-3])^2 -> 3.85834969917258 | F52: =(RC[-4]-R4C5)^2 -> 26.1518595679012
A53: 34425 | B53: 28.5 | C53: 44 | D53: =Fit!R3C2*SIN(Fit!R4C2*RC[-1]+Fit!R5C2)+Fit!R6C2+Fit!R7C2*RC[-1] -> 28.3236637133675 | E53: =(RC[-1]-RC[-3])^2 -> 0.0310944859833373 | F53: =(RC[-4]-R4C5)^2 -> 2.93741512345679
A54: 34455 | B54: 25.8 | C54: 45 | D54: =Fit!R3C2*SIN(Fit!R4C2*RC[-1]+Fit!R5C2)+Fit!R6C2+Fit!R7C2*RC[-1] -> 26.300215485151 | E54: =(RC[-1]-RC[-3])^2 -> 0.250215531584889 | F54: =(RC[-4]-R4C5)^2 -> 0.972415123456789
A55: 34486 | B55: 24.2 | C55: 46 | D55: =Fit!R3C2*SIN(Fit!R4C2*RC[-1]+Fit!R5C2)+Fit!R6C2+Fit!R7C2*RC[-1] -> 24.4109761008295 | E55: =(RC[-1]-RC[-3])^2 -> 0.0445109151212051 | F55: =(RC[-4]-R4C5)^2 -> 6.68797067901235
A56: 34516 | B56: 23.5 | C56: 47 | D56: =Fit!R3C2*SIN(Fit!R4C2*RC[-1]+Fit!R5C2)+Fit!R6C2+Fit!R7C2*RC[-1] -> 23.1653474076243 | E56: =(RC[-1]-RC[-3])^2 -> 0.111992357583746 | F56: =(RC[-4]-R4C5)^2 -> 10.7985262345679
A57: 34547 | B57: 24.9 | C57: 48 | D57: =Fit!R3C2*SIN(Fit!R4C2*RC[-1]+Fit!R5C2)+Fit!R6C2+Fit!R7C2*RC[-1] -> 22.8991923790353 | E57: =(RC[-1]-RC[-3])^2 -> 4.00323113611039 | F57: =(RC[-4]-R4C5)^2 -> 3.5574151234568
A58: 34578 | B58: 27.1 | C58: 49 | D58: =Fit!R3C2*SIN(Fit!R4C2*RC[-1]+Fit!R5C2)+Fit!R6C2+Fit!R7C2*RC[-1] -> 23.6842752733854 | E58: =(RC[-1]-RC[-3])^2 -> 11.6671754080062 | F58: =(RC[-4]-R4C5)^2 -> 0.0985262345679019
A59: 34608 | B59: 26.1 | C59: 50 | D59: =Fit!R3C2*SIN(Fit!R4C2*RC[-1]+Fit!R5C2)+Fit!R6C2+Fit!R7C2*RC[-1] -> 25.308911600121 | E59: =(RC[-1]-RC[-3])^2 -> 0.625820856423051 | F59: =(RC[-4]-R4C5)^2 -> 0.470748456790122
A60: 34639 | B60: 28.1 | C60: 51 | D60: =Fit!R3C2*SIN(Fit!R4C2*RC[-1]+Fit!R5C2)+Fit!R6C2+Fit!R7C2*RC[-1] -> 27.3350453072826 | E60: =(RC[-1]-RC[-3])^2 -> 0.585155681910327 | F60: =(RC[-4]-R4C5)^2 -> 1.72630401234568
A61: 34669 | B61: 33.1 | C61: 52 | D61: =Fit!R3C2*SIN(Fit!R4C2*RC[-1]+Fit!R5C2)+Fit!R6C2+Fit!R7C2*RC[-1] -> 29.2163632798085 | E61: =(RC[-1]-RC[-3])^2 -> 15.0826341744199 | F61: =(RC[-4]-R4C5)^2 -> 39.8651929012346
A62: 34700 | B62: 38.6 | C62: 53 | D62: =Fit!R3C2*SIN(Fit!R4C2*RC[-1]+Fit!R5C2)+Fit!R6C2+Fit!R7C2*RC[-1] -> 30.4455995468699 | E62: =(RC[-1]-RC[-3])^2 -> 66.4942467500091 | F62: =(RC[-4]-R4C5)^2 -> 139.567970679012
A63: 34731 | B63: 36.5 | C63: 54 | D63: =Fit!R3C2*SIN(Fit!R4C2*RC[-1]+Fit!R5C2)+Fit!R6C2+Fit!R7C2*RC[-1] -> 30.6913110789019 | E63: =(RC[-1]-RC[-3])^2 -> 33.740866982088 | F63: =(RC[-4]-R4C5)^2 -> 94.359637345679
A64: 34759 | B64: 34.4 | C64: 55 | D64: =Fit!R3C2*SIN(Fit!R4C2*RC[-1]+Fit!R5C2)+Fit!R6C2+Fit!R7C2*RC[-1] -> 29.8872458649951 | E64: =(RC[-1]-RC[-3])^2 -> 20.3649498830042 | F64: =(RC[-4]-R4C5)^2 -> 57.9713040123457
A65: 34790 | B65: 33.7 | C65: 56 | D65: =Fit!R3C2*SIN(Fit!R4C2*RC[-1]+Fit!R5C2)+Fit!R6C2+Fit!R7C2*RC[-1] -> 28.250206661142 | E65: =(RC[-1]-RC[-3])^2 -> 29.7002474362611 | F65: =(RC[-4]-R4C5)^2 -> 47.8018595679013
A66: 34820 | B66: 27.7 | C66: 57 | D66: =Fit!R3C2*SIN(Fit!R4C2*RC[-1]+Fit!R5C2)+Fit!R6C2+Fit!R7C2*RC[-1] -> 26.2215937479728 | E66: =(RC[-1]-RC[-3])^2 -> 2.18568504603326 | F66: =(RC[-4]-R4C5)^2 -> 0.835192901234566
A67: 34851 | B67: 28.1 | C67: 58 | D67: =Fit!R3C2*SIN(Fit!R4C2*RC[-1]+Fit!R5C2)+Fit!R6C2+Fit!R7C2*RC[-1] -> 24.348388717043 | E67: =(RC[-1]-RC[-3])^2 -> 14.0745872184102 | F67: =(RC[-4]-R4C5)^2 -> 1.72630401234568
A68: 34881 | B68: 28 | C68: 59 | D68: =Fit!R3C2*SIN(Fit!R4C2*RC[-1]+Fit!R5C2)+Fit!R6C2+Fit!R7C2*RC[-1] -> 23.1356700199768 | E68: =(RC[-1]-RC[-3])^2 -> 23.6617061545522 | F68: =(RC[-4]-R4C5)^2 -> 1.4735262345679
A69: 34912 | B69: 29.5 | C69: 60 | D69: =Fit!R3C2*SIN(Fit!R4C2*RC[-1]+Fit!R5C2)+Fit!R6C2+Fit!R7C2*RC[-1] -> 22.9104269994548 | E69: =(RC[-1]-RC[-3])^2 -> 43.422472329514 | F69: =(RC[-4]-R4C5)^2 -> 7.36519290123457
A70: 34943 | B70: 28.1 | C70: 61 | D70: =Fit!R3C2*SIN(Fit!R4C2*RC[-1]+Fit!R5C2)+Fit!R6C2+Fit!R7C2*RC[-1] -> 23.7333926741087 | E70: =(RC[-1]-RC[-3])^2 -> 19.067259538528 | F70: =(RC[-4]-R4C5)^2 -> 1.72630401234568
A71: 34973 | B71: 29.9 | C71: 62 | D71: =Fit!R3C2*SIN(Fit!R4C2*RC[-1]+Fit!R5C2)+Fit!R6C2+Fit!R7C2*RC[-1] -> 25.3826680943676 | E71: =(RC[-1]-RC[-3])^2 -> 20.4062875456444 | F71: =(RC[-4]-R4C5)^2 -> 9.69630401234567
A72: 35004 | B72: 30.2 | C72: 63 | D72: =Fit!R3C2*SIN(Fit!R4C2*RC[-1]+Fit!R5C2)+Fit!R6C2+Fit!R7C2*RC[-1] -> 27.4135536882085 | E72: =(RC[-1]-RC[-3])^2 -> 7.76428304849622 | F72: =(RC[-4]-R4C5)^2 -> 11.654637345679
A73: 35034 | B73: 34 | C73: 64 | D73: =Fit!R3C2*SIN(Fit!R4C2*RC[-1]+Fit!R5C2)+Fit!R6C2+Fit!R7C2*RC[-1] -> 29.2784550736894 | E73: =(RC[-1]-RC[-3])^2 -> 22.2929864911695 | F73: =(RC[-4]-R4C5)^2 -> 52.0401929012346
A74: 35065 | B74: 42.4 | C74: 65 | D74: =Fit!R3C2*SIN(Fit!R4C2*RC[-1]+Fit!R5C2)+Fit!R6C2+Fit!R7C2*RC[-1] -> 30.4745327384997 | E74: =(RC[-1]-RC[-3])^2 -> 142.216769405116 | F74: =(RC[-4]-R4C5)^2 -> 243.793526234568
A75: 35096 | B75: 36.9 | C75: 66 | D75: =Fit!R3C2*SIN(Fit!R4C2*RC[-1]+Fit!R5C2)+Fit!R6C2+Fit!R7C2*RC[-1] -> 30.6792843163797 | E75: =(RC[-1]-RC[-3])^2 -> 38.69730361644 | F75: =(RC[-4]-R4C5)^2 -> 102.29074845679
A76: 35125 | B76: 34 | C76: 67 | D76: =Fit!R3C2*SIN(Fit!R4C2*RC[-1]+Fit!R5C2)+Fit!R6C2+Fit!R7C2*RC[-1] -> 29.8375019639723 | E76: =(RC[-1]-RC[-3])^2 -> 17.3263898999345 | F76: =(RC[-4]-R4C5)^2 -> 52.0401929012346
A77: 35156 | B77: 32.5 | C77: 68 | D77: =Fit!R3C2*SIN(Fit!R4C2*RC[-1]+Fit!R5C2)+Fit!R6C2+Fit!R7C2*RC[-1] -> 28.1761582337415 | E77: =(RC[-1]-RC[-3])^2 -> 18.6956076196415 | F77: =(RC[-4]-R4C5)^2 -> 32.6485262345679
A78: 35186 | B78: 31.6 | C78: 69 | D78: =Fit!R3C2*SIN(Fit!R4C2*RC[-1]+Fit!R5C2)+Fit!R6C2+Fit!R7C2*RC[-1] -> 26.1432067159378 | E78: =(RC[-1]-RC[-3])^2 -> 29.7765929449868 | F78: =(RC[-4]-R4C5)^2 -> 23.1735262345679
A79: 35217 | B79: 30.8 | C79: 70 | D79: =Fit!R3C2*SIN(Fit!R4C2*RC[-1]+Fit!R5C2)+Fit!R6C2+Fit!R7C2*RC[-1] -> 24.2867988343961 | E79: =(RC[-1]-RC[-3])^2 -> 42.4217894236234 | F79: =(RC[-4]-R4C5)^2 -> 16.1113040123457
A80: 35247 | B80: 30.1 | C80: 71 | D80: =Fit!R3C2*SIN(Fit!R4C2*RC[-1]+Fit!R5C2)+Fit!R6C2+Fit!R7C2*RC[-1] -> 23.1074839699425 | E80: =(RC[-1]-RC[-3])^2 -> 48.8952804306113 | F80: =(RC[-4]-R4C5)^2 -> 10.9818595679012
A81: 35278 | B81: 33.6 | C81: 72 | D81: =Fit!R3C2*SIN(Fit!R4C2*RC[-1]+Fit!R5C2)+Fit!R6C2+Fit!R7C2*RC[-1] -> 22.923244679681 | E81: =(RC[-1]-RC[-3])^2 -> 113.993104169961 | F81: =(RC[-4]-R4C5)^2 -> 46.4290817901235
E82: =SUM(R[-72]C:R[-1]C) -> 1493.74350474638 | F82: =SUM(R[-72]C:R[-1]C) -> 2051.94611111111