Sheet: 2001
A1: Name | B1: Type | C1: Code | D1: Population '000s | E1: Libraries - Total Administrative Units | F1: Libraries - Service Points | G1: Collections - Books & Bound Periodicals | H1: Collections - Current Periodicals - Titles | I1: Collections - Current Periodicals - Subscriptions | J1: Collections - Manuscripts | K1: Collections - Microforms | L1: Collections - Audio-visual Materials | M1: Collections - CD-ROMs | N1: Additions - Books & Bound Periodicals | O1: Additions - Audio-visual Materials | P1: Facilities & Services - Percentage Stock on Open Access | Q1: Facilities & Services - Percentage Catalogue Records Automated | R1: Facilities & Services - Number of Workstations for users | S1: Facilities & Services - Number connected to the internet | T1: Use & Users - Registered Users | U1: Use & Users - Consultations | V1: Use & Users - Number of Visits | W1: Use & Users - Potential Total Population Served | X1: Library Staff FTE - Trained Librarians | Y1: Library Staff FTE - Other Library Staff | Z1: Library Staff FTE - Total Staff | AA1: Recurrent Expenditure (Euros) - Staff | AB1: Recurrent Expenditure (Euros) - Acquisition of Stock | AC1: Recurrent Expenditure (Euros) - Electronic Information | AD1: Recurrent Expenditure (Euros) - Automation | AE1: Recurrent Expenditure (Euros) - Premises and Related Costs | AF1: Recurrent Expenditure (Euros) - New Buildings / Refurbishment | AG1: Recurrent Expenditure (Euros) - Other Expenditure | AH1: Recurrent Expenditure (Euros) - TOTAL EXPENDITURE | AI1: Income - Public Funding | AJ1: Income - Fees & Charges | AK1: Income - Other Income | AL1: Income - TOTAL INCOME | AM1: Capital Expenditure - New Buildings / Refurbishment | AN1: Capital Expenditure - Acquisition of Stock | AO1: Capital Expenditure - Automation | AP1: Capital Expenditure - Other Capital Expenditure | AQ1: Capital Expenditure - TOTAL CAPITAL PAYMENTS | AR1: Additions | AS1: Loans per visit | AT1: Cost per pop | AU1: Users per 1000 pop | AV1: visits per 1000 pop | AW1: Bookstock per 1000 pop | AX1: Total stock per 1000 pop | AY1: AV materials per 1000 pop
A2: Bulgaria | B2: CEE | C2: C1 | D2: =RC[19]/1000 -> 289 | E2: 84 | F2: 84 | G2: 8501798 | H2: 8198 | K2: 23792 | L2: 84101 | N2: 101846 | O2: 3634 | T2: 200848 | U2: 5002065 | V2: 2813081 | W2: 289000 | X2: 496 | Y2: 312 | Z2: 808 | AA2: 951033 | AB2: 1319389 | AC2: 0 | AD2: 0 | AE2: 0 | AF2: 0 | AG2: 89817 | AH2: 2360239 | AI2: 1386130 | AJ2: 141230 | AK2: 832879 | AL2: 2360239 | AR2: =RC[-30]+RC[-29] -> 105480 | AS2: =RC[-24]/RC[-23] -> 1.7781446748245073 | AT2: =RC[-12]/RC[-23] -> 8.1669169550173013 | AU2: =RC[-27]/RC[-43] -> 694.97577854671283 | AV2: =RC[-26]/RC[-44] -> 9733.8442906574401 | AW2: =RC[-42]/RC[-45] -> 29417.986159169552 | AX2: =SUM(RC[-43]:RC[-37])/RC[-46] -> 29819.685121107268 | AY2: =RC[-39]/RC[-47] -> 291.0069204152249
A3: Czech Republic | B3: CEE | C3: C2 | D3: =RC[19]/1000 -> 192 | E3: 80 | F3: 1081 | G3: 10704109 | H3: 21703 | J3: 43062 | K3: 13753 | L3: 38158 | N3: 266549 | O3: 2556 | T3: 276163 | U3: 2178474 | V3: 4255805 | W3: 192000 | X3: 395 | Y3: 372 | Z3: 767 | AB3: 4761705 | AR3: =RC[-30]+RC[-29] -> 269105 | AS3: =RC[-24]/RC[-23] -> 0.51188294576466731 | AT3: =RC[-12]/RC[-23] -> 0 | AU3: =RC[-27]/RC[-43] -> 1438.3489583333333 | AV3: =RC[-26]/RC[-44] -> 22165.651041666668 | AW3: =RC[-42]/RC[-45] -> 55750.567708333336 | AX3: =SUM(RC[-43]:RC[-37])/RC[-46] -> 56358.255208333336 | AY3: =RC[-39]/RC[-47] -> 198.73958333333334
A4: Estonia | B4: CEE | C4: C3 | D4: =RC[19]/1000 -> 48 | E4: 23 | F4: 37 | G4: 7399469 | H4: 11565 | I4: 20099 | J4: 72773 | K4: 28166 | L4: 38818 | M4: 3712 | N4: 110337 | O4: 2304 | P4: 5 | Q4: 20 | R4: 271 | S4: 261 | T4: 84571 | U4: 1905991 | V4: 1550796 | W4: 48000 | X4: 527 | Y4: 51 | Z4: 578 | AA4: 2398155 | AB4: 1379407 | AC4: 302797 | AD4: 114234 | AE4: 236763 | AF4: 0 | AG4: 375264 | AH4: 4806620 | AI4: 4806620 | AJ4: 0 | AK4: 0 | AL4: 4806620 | AM4: 0 | AN4: 0 | AO4: 15664 | AP4: 80035 | AQ4: 95699 | AR4: =RC[-30]+RC[-29] -> 112641 | AS4: =RC[-24]/RC[-23] -> 1.2290404411669877 | AT4: =RC[-12]/RC[-23] -> 100.13791666666667 | AU4: =RC[-27]/RC[-43] -> 1761.8958333333333 | AV4: =RC[-26]/RC[-44] -> 32308.25 | AW4: =RC[-42]/RC[-45] -> 154155.60416666666 | AX4: =SUM(RC[-43]:RC[-37])/RC[-46] -> 157804.20833333334 | AY4: =RC[-39]/RC[-47] -> 808.70833333333337
A5: Hungary | B5: CEE | C5: C4 | D5: =RC[19]/1000 -> 214 | E5: 141 | F5: 401 | G5: 16366142 | H5: 26078 | J5: 796077 | K5: 5418049 | L5: 117905 | M5: 22354 | N5: 374994 | O5: 6380 | T5: 284873 | U5: 4014677 | V5: 3788043 | W5: 214000 | X5: 1016 | Y5: 385 | Z5: 1401 | AA5: 4490076 | AB5: 8336805 | AC5: 40116 | AD5: 217899 | AE5: 132781 | AF5: 593518 | AG5: 632260 | AH5: 14443455 | AI5: 13565728 | AJ5: 517464 | AK5: 360263 | AL5: 14443455 | AR5: =RC[-30]+RC[-29] -> 381374 | AS5: =RC[-24]/RC[-23] -> 1.0598287823026296 | AT5: =RC[-12]/RC[-23] -> 67.492780373831778 | AU5: =RC[-27]/RC[-43] -> 1331.1822429906542 | AV5: =RC[-26]/RC[-44] -> 17701.135514018693 | AW5: =RC[-42]/RC[-45] -> 76477.299065420564 | AX5: =SUM(RC[-43]:RC[-37])/RC[-46] -> 106292.54672897197 | AY5: =RC[-39]/RC[-47] -> 550.95794392523362
A6: Latvia | B6: CEE | C6: C5 | D6: =RC[19]/1000 -> 61 | E6: 31 | F6: 31 | G6: 5631479 | J6: 25362 | L6: 4085 | N6: 134553 | T6: 94467 | U6: 4209082 | V6: 1976819 | W6: 61000 | X6: 378 | Y6: 27 | Z6: 405 | AA6: 1106524 | AB6: 1023219 | AC6: 0 | AD6: 0 | AE6: 0 | AF6: 0 | AG6: 252124 | AH6: 2381867 | AI6: 1283798 | AJ6: 0 | AK6: 954612 | AL6: 2238410 | AM6: 506776 | AN6: 0 | AO6: 25899 | AP6: 6083 | AQ6: 538758 | AR6: =RC[-30]+RC[-29] -> 134553 | AS6: =RC[-24]/RC[-23] -> 2.1292197211783175 | AT6: =RC[-12]/RC[-23] -> 39.046999999999997 | AU6: =RC[-27]/RC[-43] -> 1548.639344262295 | AV6: =RC[-26]/RC[-44] -> 32406.868852459018 | AW6: =RC[-42]/RC[-45] -> 92319.327868852459 | AX6: =SUM(RC[-43]:RC[-37])/RC[-46] -> 92802.065573770495 | AY6: =RC[-39]/RC[-47] -> 66.967213114754102
A7: Lithuania | B7: CEE | C7: C6 | D7: =RC[19]/1000 -> 97 | E7: 15 | F7: 106 | G7: 10977183 | H7: 4000 | I7: 5000 | J7: 248300 | K7: 26764 | L7: 37250 | M7: 3625 | N7: 174036 | O7: 852 | P7: 4 | Q7: 3 | R7: 298 | S7: 298 | T7: 118445 | U7: 8134682 | V7: 4520707 | W7: 97000 | X7: 594 | Y7: 92 | Z7: 686 | AA7: 1856644 | AB7: 787172 | AC7: 0 | AD7: 94213 | AE7: 0 | AF7: 0 | AG7: 344466 | AH7: 3082495 | AI7: 2440386 | AJ7: 324443 | AK7: 293871 | AL7: 3058700 | AR7: =RC[-30]+RC[-29] -> 174888 | AS7: =RC[-24]/RC[-23] -> 1.7994269480415341 | AT7: =RC[-12]/RC[-23] -> 31.778298969072164 | AU7: =RC[-27]/RC[-43] -> 1221.0824742268042 | AV7: =RC[-26]/RC[-44] -> 46605.226804123711 | AW7: =RC[-42]/RC[-45] -> 113166.8350515464 | AX7: =SUM(RC[-43]:RC[-37])/RC[-46] -> 116516.72164948453 | AY7: =RC[-39]/RC[-47] -> 384.02061855670104
A8: Poland | B8: CEE | C8: C7 | D8: =RC[19]/1000 -> 796 | W8: 796000 | AR8: =RC[-30]+RC[-29] -> 0 | AS8: =RC[-24]/RC[-23] -> #DIV/0! | AT8: =RC[-12]/RC[-23] -> 0 | AU8: =RC[-27]/RC[-43] -> 0 | AV8: =RC[-26]/RC[-44] -> 0 | AW8: =RC[-42]/RC[-45] -> 0 | AX8: =SUM(RC[-43]:RC[-37])/RC[-46] -> 0 | AY8: =RC[-39]/RC[-47] -> 0
A9: Romania | B9: CEE | C9: C8 | D9: =RC[19]/1000 -> 438 | W9: 438000 | AR9: =RC[-30]+RC[-29] -> 0 | AS9: =RC[-24]/RC[-23] -> #DIV/0! | AT9: =RC[-12]/RC[-23] -> 0 | AU9: =RC[-27]/RC[-43] -> 0 | AV9: =RC[-26]/RC[-44] -> 0 | AW9: =RC[-42]/RC[-45] -> 0 | AX9: =SUM(RC[-43]:RC[-37])/RC[-46] -> 0 | AY9: =RC[-39]/RC[-47] -> 0
A10: Slovak Rep | B10: CEE | C10: C9 | D10: =RC[19]/1000 -> 112 | E10: 35 | F10: 568 | G10: 4670126 | H10: 7534 | I10: 9231 | M10: 1130 | N10: 98198 | O10: 568 | R10: 1094 | S10: 896 | T10: 142344 | U10: 2706702 | V10: 1045163 | W10: 112000 | X10: 254 | Y10: 244 | Z10: 498 | AA10: 1189740 | AB10: 960166 | AC10: 0 | AD10: 0 | AE10: 89466 | AF10: 0 | AG10: 385251 | AH10: 2624623 | AI10: 2496700 | AJ10: 34423 | AK10: 0 | AL10: 2531123 | AM10: 227232 | AN10: 0 | AO10: 140400 | AP10: 0 | AQ10: 367632 | AR10: =RC[-30]+RC[-29] -> 98766 | AS10: =RC[-24]/RC[-23] -> 2.5897415044351932 | AT10: =RC[-12]/RC[-23] -> 23.434133928571427 | AU10: =RC[-27]/RC[-43] -> 1270.9285714285713 | AV10: =RC[-26]/RC[-44] -> 9331.8125 | AW10: =RC[-42]/RC[-45] -> 41697.553571428572 | AX10: =SUM(RC[-43]:RC[-37])/RC[-46] -> 41857.330357142855 | AY10: =RC[-39]/RC[-47] -> 0
A11: Slovenia | B11: CEE | C11: C10 | D11: =RC[19]/1000 -> 55 | E11: 54 | F11: 79 | G11: 4151409 | H11: 14489 | I11: 16234 | N11: 118375 | O11: 12372 | Q11: 44 | R11: 314 | S11: 299 | T11: 135425 | U11: 3263696 | V11: 1512745 | W11: 55000 | X11: 263 | Y11: 93 | Z11: 356 | AA11: 1005555 | AB11: 4009447 | AC11: 14203 | AD11: 77143 | AE11: 47009 | AF11: 210125 | AG11: 3811444 | AH11: 9174926 | AI11: 5917186 | AJ11: 172832 | AK11: 3084908 | AL11: 9174926 | AR11: =RC[-30]+RC[-29] -> 130747 | AS11: =RC[-24]/RC[-23] -> 2.1574660633484162 | AT11: =RC[-12]/RC[-23] -> 166.81683636363636 | AU11: =RC[-27]/RC[-43] -> 2462.2727272727275 | AV11: =RC[-26]/RC[-44] -> 27504.454545454544 | AW11: =RC[-42]/RC[-45] -> 75480.163636363635 | AX11: =SUM(RC[-43]:RC[-37])/RC[-46] -> 76038.763636363641 | AY11: =RC[-39]/RC[-47] -> 0
A12: Austria | B12: EU | C12: C11 | D12: =RC[19]/1000 -> 269 | W12: 269000 | AR12: =RC[-30]+RC[-29] -> 0 | AS12: =RC[-24]/RC[-23] -> #DIV/0! | AT12: =RC[-12]/RC[-23] -> 0 | AU12: =RC[-27]/RC[-43] -> 0 | AV12: =RC[-26]/RC[-44] -> 0 | AW12: =RC[-42]/RC[-45] -> 0 | AX12: =SUM(RC[-43]:RC[-37])/RC[-46] -> 0 | AY12: =RC[-39]/RC[-47] -> 0
A13: België Nederlandstalige Universiteiten | B13: België Nederlandstalige Universiteiten | C13: C12a | D13: 58.777000000000001 | E13: 41 | F13: 317 | G13: 9925746 | H13: 42654 | I13: 14074 | J13: 115 | K13: 1000 | L13: 9068 | M13: 2028 | N13: 179054 | O13: 210 | P13: 48 | Q13: 60 | R13: 354 | T13: 106123 | U13: 666128 | V13: 1071148 | W13: 58777 | X13: 116 | Y13: 191 | Z13: 307 | AA13: 8375210 | AB13: 5472894 | AC13: 1948575 | AD13: 375538 | AE13: 112271 | AF13: 13758 | AG13: 361682 | AH13: 16659928 | AI13: 5971614 | AJ13: 98259 | AK13: 98414 | AL13: 6108793 | AM13: 0 | AN13: 0 | AO13: 88939 | AP13: 0 | AQ13: 88939 | AR13: 179264 | AS13: =RC[-24]/RC[-23] -> 0.62188231691605644 | AT13: =RC[-12]/RC[-23] -> 283.44297939670281 | AU13: =RC[-27]/RC[-43] -> 1805.5191656600371 | AV13: =RC[-26]/RC[-44] -> 18223.931129523451 | AW13: =RC[-42]/RC[-45] -> 168871.25916600029 | AX13: =SUM(RC[-43]:RC[-37])/RC[-46] -> 170044.14992258875 | AY13: =RC[-39]/RC[-47] -> 154.27803392483455
A14: Belgique universités francophones | B14: Belgique universités francophones | C14: C12b | D14: 74.457999999999998 | G14: 9057965 | H14: 29979 | I14: 20837 | J14: 1135 | K14: 279897 | L14: 11873 | M14: 1193 | N14: 128821 | O14: 1511 | P14: 46 | Q14: 56 | R14: 423 | T14: 63788 | U14: 460619 | V14: 3062634 | W14: 74458 | X14: 124 | Y14: 179 | Z14: 301 | AA14: 7062183 | AB14: 7195308 | AC14: 771134 | AD14: 279846 | AE14: 772490 | AF14: 0 | AG14: 346279 | AH14: 16427240 | AI14: 6715288 | AJ14: 394456 | AK14: 439313 | AL14: 7207068 | AM14: 0 | AN14: 68369 | AO14: 48691 | AP14: 0 | AQ14: 117060 | AR14: 130332 | AS14: =RC[-24]/RC[-23] -> 0.15039962333076692 | AT14: =RC[-12]/RC[-23] -> 220.62424454054636 | AU14: =RC[-27]/RC[-43] -> 856.69773563619765 | AV14: =RC[-26]/RC[-44] -> 41132.369926670071 | AW14: =RC[-42]/RC[-45] -> 121652.00515726987 | AX14: =SUM(RC[-43]:RC[-37])/RC[-46] -> 126284.33479276908 | AY14: =RC[-39]/RC[-47] -> 159.45902387923394
A15: Belgium | B15: EU | C15: C12 | D15: =RC[19]/1000 -> 133.23500000000001 | E15: 72 | F15: 47 | G15: 18983711 | H15: 72633 | I15: 34911 | J15: 1250 | K15: 280897 | L15: 20941 | M15: 3221 | N15: 307875 | O15: 1721 | P15: 46 | Q15: 56 | R15: 777 | T15: 169911 | U15: 1126747 | V15: 4133782 | W15: 133235 | X15: 240 | Y15: 369 | Z15: 609 | AA15: 15437393 | AB15: 12668202 | AC15: 2719709 | AD15: 655384 | AE15: 884761 | AF15: 13758 | AG15: 707961 | AH15: 33087168 | AI15: 26002762 | AJ15: 492716 | AK15: 537726 | AL15: 27033204 | AM15: 68369 | AN15: 137630 | AO15: 0 | AP15: 0 | AQ15: 205999 | AR15: =RC[-30]+RC[-29] -> 309596 | AS15: =RC[-24]/RC[-23] -> 0.27257049355771545 | AT15: =RC[-12]/RC[-23] -> 248.33690846999662 | AU15: =RC[-27]/RC[-43] -> 1275.2730138477125 | AV15: =RC[-26]/RC[-44] -> 31026.246857057078 | AW15: =RC[-42]/RC[-45] -> 142482.913648816 | AX15: =SUM(RC[-43]:RC[-37])/RC[-46] -> 145589.10196269749 | AY15: =RC[-39]/RC[-47] -> 157.17341539385296
A16: Denmark | B16: EU | C16: C13 | D16: =RC[19]/1000 -> 180 | E16: 19 | F16: 40 | G16: 10698685 | H16: 74100 | I16: 94344 | J16: 95140 | K16: 1220634 | L16: 883224 | M16: 36856 | N16: 255661 | O16: 28595 | P16: 20 | R16: 932 | U16: 5085626 | W16: 180000 | X16: 427 | Y16: 472 | Z16: 899 | AA16: 38129876 | AB16: 19659084 | AF16: 550806 | AG16: 10882096 | AH16: 69221863 | AI16: 69221863 | AL16: 69221863 | AM16: 2680041 | AQ16: 2680041 | AR16: =RC[-30]+RC[-29] -> 284256 | AS16: =RC[-24]/RC[-23] -> #DIV/0! | AT16: =RC[-12]/RC[-23] -> 384.56590555555556 | AU16: =RC[-27]/RC[-43] -> 0 | AV16: =RC[-26]/RC[-44] -> 0 | AW16: =RC[-42]/RC[-45] -> 59437.138888888891 | AX16: =SUM(RC[-43]:RC[-37])/RC[-46] -> 72794.350000000006 | AY16: =RC[-39]/RC[-47] -> 4906.8
A17: Eire | B17: EU | C17: C15 | D17: =RC[19]/1000 -> 137 | W17: 137000 | AR17: =RC[-30]+RC[-29] -> 0 | AS17: =RC[-24]/RC[-23] -> #DIV/0! | AT17: =RC[-12]/RC[-23] -> 0 | AU17: =RC[-27]/RC[-43] -> 0 | AV17: =RC[-26]/RC[-44] -> 0 | AW17: =RC[-42]/RC[-45] -> 0 | AX17: =SUM(RC[-43]:RC[-37])/RC[-46] -> 0 | AY17: =RC[-39]/RC[-47] -> 0
A18: Finland | B18: EU | C18: C16 | D18: =RC[19]/1000 -> 224 | E18: 48 | F18: 457 | G18: 15572434 | H18: 161100 | I18: 382625 | J18: 262463 | K18: 1251223 | L18: 325048 | N18: 610881 | O18: 15112 | P18: 45 | U18: 13617288 | V18: 16882610 | W18: 224000 | X18: 1310 | Y18: 138 | Z18: 1448 | AA18: 36907466 | AB18: 22543220 | AC18: 0 | AD18: 0 | AE18: 0 | AF18: 3528953 | AG18: 10987011 | AH18: 76666650 | AI18: 62922332 | AJ18: 4788563 | AK18: 5513940 | AL18: 73224835 | AR18: =RC[-30]+RC[-29] -> 625993 | AS18: =RC[-24]/RC[-23] -> 0.80658665929024009 | AT18: =RC[-12]/RC[-23] -> 342.26183035714286 | AU18: =RC[-27]/RC[-43] -> 0 | AV18: =RC[-26]/RC[-44] -> 75368.794642857145 | AW18: =RC[-42]/RC[-45] -> 69519.794642857145 | AX18: =SUM(RC[-43]:RC[-37])/RC[-46] -> 80155.772321428565 | AY18: =RC[-39]/RC[-47] -> 1451.1071428571429
A19: France | B19: EU | C19: C17 | D19: =RC[19]/1000 -> 2278 | E19: 95 | F19: 396 | G19: 25684360 | H19: 152995 | K19: 1384057 | L19: 97296 | M19: 44108 | N19: 1008519 | P19: 35 | W19: 2278000 | X19: 1812 | Y19: 2552 | Z19: 4364 | AA19: 167287948 | AB19: 60509187 | AC19: 5924182 | AD19: 0 | AE19: 0 | AF19: 0 | AG19: 68159578 | AH19: 301880895 | AI19: 285222928 | AJ19: 8495252 | AK19: 8162715 | AL19: 301880895 | AR19: =RC[-30]+RC[-29] -> 1008519 | AS19: =RC[-24]/RC[-23] -> #DIV/0! | AT19: =RC[-12]/RC[-23] -> 132.52014705882354 | AU19: =RC[-27]/RC[-43] -> 0 | AV19: =RC[-26]/RC[-44] -> 0 | AW19: =RC[-42]/RC[-45] -> 11274.960491659351 | AX19: =SUM(RC[-43]:RC[-37])/RC[-46] -> 12011.771729587357 | AY19: =RC[-39]/RC[-47] -> 42.711150131694467
A20: Greece | B20: EU | C20: C18 | D20: =RC[19]/1000 -> 347 | E20: 82 | F20: 180 | G20: 5683287 | I20: 36200 | J20: 29790 | K20: 25338 | L20: 22796 | M20: 18726 | N20: 296750 | O20: 1439 | P20: 95 | Q20: 49 | T20: 402192 | U20: 1415696 | W20: 347000 | X20: 728 | Y20: 395 | Z20: 1123 | AA20: 4055275 | AB20: 14572579 | AC20: 696828 | AD20: 126795 | AE20: 0 | AF20: 948625 | AG20: 3944656 | AH20: 24344758 | AI20: 13660012 | AJ20: 10500572 | AK20: 184174 | AL20: 24344758 | AR20: =RC[-30]+RC[-29] -> 298189 | AS20: =RC[-24]/RC[-23] -> #DIV/0! | AT20: =RC[-12]/RC[-23] -> 70.157804034582128 | AU20: =RC[-27]/RC[-43] -> 1159.0547550432277 | AV20: =RC[-26]/RC[-44] -> 0 | AW20: =RC[-42]/RC[-45] -> 16378.34870317003 | AX20: =SUM(RC[-43]:RC[-37])/RC[-46] -> 16761.20172910663 | AY20: =RC[-39]/RC[-47] -> 65.694524495677229
A21: Iceland | B21: EFTA | C21: C19 | D21: =RC[19]/1000 -> 8 | W21: 8000 | AR21: =RC[-30]+RC[-29] -> 0 | AS21: =RC[-24]/RC[-23] -> #DIV/0! | AT21: =RC[-12]/RC[-23] -> 0 | AU21: =RC[-27]/RC[-43] -> 0 | AV21: =RC[-26]/RC[-44] -> 0 | AW21: =RC[-42]/RC[-45] -> 0 | AX21: =SUM(RC[-43]:RC[-37])/RC[-46] -> 0 | AY21: =RC[-39]/RC[-47] -> 0
A22: Italy | B22: EU | C22: C20 | D22: =RC[19]/1000 -> 1852 | W22: 1852000 | AR22: =RC[-30]+RC[-29] -> 0 | AS22: =RC[-24]/RC[-23] -> #DIV/0! | AT22: =RC[-12]/RC[-23] -> 0 | AU22: =RC[-27]/RC[-43] -> 0 | AV22: =RC[-26]/RC[-44] -> 0 | AW22: =RC[-42]/RC[-45] -> 0 | AX22: =SUM(RC[-43]:RC[-37])/RC[-46] -> 0 | AY22: =RC[-39]/RC[-47] -> 0
A23: Liechtenstein | B23: EFTA | C23: C21 | D23: =RC[19]/1000 -> 1 | W23: 1000 | AR23: =RC[-30]+RC[-29] -> 0 | AS23: =RC[-24]/RC[-23] -> #DIV/0! | AT23: =RC[-12]/RC[-23] -> 0 | AU23: =RC[-27]/RC[-43] -> 0 | AV23: =RC[-26]/RC[-44] -> 0 | AW23: =RC[-42]/RC[-45] -> 0 | AX23: =SUM(RC[-43]:RC[-37])/RC[-46] -> 0 | AY23: =RC[-39]/RC[-47] -> 0
A24: Luxembourg | B24: EU | C24: C22 | D24: =RC[19]/1000 -> 2.9990000000000001 | E24: 6 | F24: 6 | G24: 469000 | H24: 1650 | I24: 770 | J24: 10 | K24: 5 | L24: 3200 | M24: 184 | N24: 3800 | O24: 120 | P24: 83 | Q24: 41 | R24: 38 | S24: 30 | T24: 13837 | W24: 2999 | X24: 5 | Y24: 5 | Z24: 9 | AA24: 303856 | AB24: 233335 | AC24: 17967 | AD24: 151 | AE24: 1425 | AF24: 8928 | AG24: 67651 | AH24: 633313 | AI24: 563959 | AJ24: 0 | AK24: 69354 | AL24: 633313 | AR24: =RC[-30]+RC[-29] -> 3920 | AS24: =RC[-24]/RC[-23] -> #DIV/0! | AT24: =RC[-12]/RC[-23] -> 211.17472490830278 | AU24: =RC[-27]/RC[-43] -> 4613.8712904301428 | AV24: =RC[-26]/RC[-44] -> 0 | AW24: =RC[-42]/RC[-45] -> 156385.46182060687 | AX24: =SUM(RC[-43]:RC[-37])/RC[-46] -> 158325.77525841945 | AY24: =RC[-39]/RC[-47] -> 1067.02234078026
A25: Netherlands | B25: EU | C25: C23 | D25: =RC[19]/1000 -> 540 | E25: 23 | F25: 138 | G25: 25084875 | H25: 152742 | I25: 161182 | K25: 5797711 | U25: 4162863 | W25: 540000 | X25: 868 | Y25: 1002 | Z25: 1870 | AR25: =RC[-30]+RC[-29] -> 0 | AS25: =RC[-24]/RC[-23] -> #DIV/0! | AT25: =RC[-12]/RC[-23] -> 0 | AU25: =RC[-27]/RC[-43] -> 0 | AV25: =RC[-26]/RC[-44] -> 0 | AW25: =RC[-42]/RC[-45] -> 46453.472222222219 | AX25: =SUM(RC[-43]:RC[-37])/RC[-46] -> 57771.314814814818 | AY25: =RC[-39]/RC[-47] -> 0
A26: Norway | B26: EFTA | C26: C24 | D26: =RC[19]/1000 -> 194 | E26: 85 | F26: 186 | G26: 12847148 | H26: 86079 | J26: 49356 | K26: 442477 | L26: 115851 | N26: 291236 | O26: 5151 | P26: 21 | R26: 1140 | S26: 424 | U26: 2688468 | V26: 5376936 | W26: 194000 | X26: 619 | Y26: 346 | Z26: 964 | AA26: 38591900 | AB26: 21176919 | AC26: 0 | AD26: 0 | AE26: 0 | AF26: 0 | AG26: 17201698 | AH26: 76970517 | AI26: 62407529 | AJ26: 8521543 | AK26: 0 | AL26: 70929072 | AR26: =RC[-30]+RC[-29] -> 296387 | AS26: =RC[-24]/RC[-23] -> 0.5 | AT26: =RC[-12]/RC[-23] -> 396.75524226804123 | AU26: =RC[-27]/RC[-43] -> 0 | AV26: =RC[-26]/RC[-44] -> 27716.164948453606 | AW26: =RC[-42]/RC[-45] -> 66222.412371134022 | AX26: =SUM(RC[-43]:RC[-37])/RC[-46] -> 69798.510309278354 | AY26: =RC[-39]/RC[-47] -> 597.17010309278351
A27: Portugal | B27: EU | C27: C25 | D27: =RC[19]/1000 -> 325 | E27: 230 | F27: 230 | G27: 8616219 | J27: 14149 | K27: 47946 | L27: 144852 | N27: 333379 | O27: 9748 | R27: 484 | S27: 146 | T27: 1106067 | U27: 1615393 | W27: 325000 | X27: 829 | Y27: 470 | Z27: 1215 | AA27: 7048520 | AB27: 10692942 | AC27: 0 | AD27: 0 | AE27: 0 | AF27: 0 | AG27: 1519291 | AH27: 19260753 | AI27: 17669449 | AJ27: 525356 | AK27: 1065948 | AL27: 19260753 | AM27: 12126 | AN27: 0 | AO27: 0 | AP27: 457209 | AQ27: 469335 | AR27: =RC[-30]+RC[-29] -> 343127 | AS27: =RC[-24]/RC[-23] -> #DIV/0! | AT27: =RC[-12]/RC[-23] -> 59.263855384615383 | AU27: =RC[-27]/RC[-43] -> 3403.2830769230768 | AV27: =RC[-26]/RC[-44] -> 0 | AW27: =RC[-42]/RC[-45] -> 26511.443076923078 | AX27: =SUM(RC[-43]:RC[-37])/RC[-46] -> 27148.203076923077 | AY27: =RC[-39]/RC[-47] -> 445.69846153846152
A28: Spain | B28: EU | C28: C26 | D28: =RC[19]/1000 -> 1680 | E28: 610 | F28: 1007 | G28: 29482682 | H28: 234938 | J28: 41839 | K28: 1635186 | L28: 1038741 | M28: 71863 | N28: 1371270 | O28: 77635 | T28: 3805781 | U28: 14251982 | V28: 51875328 | W28: 1680000 | X28: 5874 | Y28: 1556 | Z28: 7430 | AA28: 122788945 | AB28: 79317863 | AC28: 0 | AD28: 0 | AE28: 0 | AF28: 0 | AG28: 10218365 | AH28: 212325173 | AI28: 181396888 | AJ28: 9628756 | AK28: 21299529 | AL28: 212325173 | AR28: =RC[-30]+RC[-29] -> 1448905 | AS28: =RC[-24]/RC[-23] -> 0.27473526528834669 | AT28: =RC[-12]/RC[-23] -> 126.38403154761905 | AU28: =RC[-27]/RC[-43] -> 2265.3458333333333 | AV28: =RC[-26]/RC[-44] -> 30878.17142857143 | AW28: =RC[-42]/RC[-45] -> 17549.215476190475 | AX28: =SUM(RC[-43]:RC[-37])/RC[-46] -> 19348.362499999999 | AY28: =RC[-39]/RC[-47] -> 618.29821428571427
A29: Sweden | B29: EU | C29: C27 | D29: =RC[19]/1000 -> 292 | E29: 37 | F29: 155 | G29: 23323000 | H29: 254183 | J29: 69985 | K29: 2710924 | L29: 45375 | M29: 9291 | N29: 342000 | O29: 1045 | R29: 2510 | T29: 497999 | U29: 6899208 | W29: 292000 | X29: 1111 | Y29: 622 | Z29: 1733 | AA29: 66313682 | AB29: 31054748 | AC29: 0 | AD29: 0 | AE29: 0 | AF29: 0 | AG29: 20561175 | AH29: 117929605 | AI29: 103233087 | AJ29: 2479925 | AK29: 12216593 | AL29: 117929605 | AR29: =RC[-30]+RC[-29] -> 343045 | AS29: =RC[-24]/RC[-23] -> #DIV/0! | AT29: =RC[-12]/RC[-23] -> 403.86851027397262 | AU29: =RC[-27]/RC[-43] -> 1705.4760273972602 | AV29: =RC[-26]/RC[-44] -> 0 | AW29: =RC[-42]/RC[-45] -> 79873.287671232873 | AX29: =SUM(RC[-43]:RC[-37])/RC[-46] -> 90454.650684931505 | AY29: =RC[-39]/RC[-47] -> 155.39383561643837
A30: Switzerland | B30: EFTA | C30: C28 | D30: =RC[19]/1000 -> 162 | W30: 162000 | AR30: =RC[-30]+RC[-29] -> 0 | AS30: =RC[-24]/RC[-23] -> #DIV/0! | AT30: =RC[-12]/RC[-23] -> 0 | AU30: =RC[-27]/RC[-43] -> 0 | AV30: =RC[-26]/RC[-44] -> 0 | AW30: =RC[-42]/RC[-45] -> 0 | AX30: =SUM(RC[-43]:RC[-37])/RC[-46] -> 0 | AY30: =RC[-39]/RC[-47] -> 0
A31: UK | B31: EU | C31: C29 | D31: =RC[19]/1000 -> 1910 | E31: 166 | F31: 790 | G31: 104563000 | H31: 839000 | J31: 107000 | K31: 10641000 | L31: 2405000 | N31: 2831000 | O31: 157000 | R31: 35670 | S31: 35670 | T31: 2449000 | U31: 79300000 | V31: 119300000 | W31: 1910000 | X31: 3629 | Y31: 6191 | Z31: 9820 | AA31: 349430033 | AB31: 221228019 | AC31: 24467620 | AD31: 264739 | AE31: 2493264 | AF31: 0 | AG31: 91189805 | AH31: 689073480 | AI31: 482267515 | AJ31: 32964520 | AK31: 108013536 | AL31: 623245571 | AR31: =RC[-30]+RC[-29] -> 2988000 | AS31: =RC[-24]/RC[-23] -> 0.66471081307627833 | AT31: =RC[-12]/RC[-23] -> 360.77145549738219 | AU31: =RC[-27]/RC[-43] -> 1282.1989528795812 | AV31: =RC[-26]/RC[-44] -> 62460.732984293194 | AW31: =RC[-42]/RC[-45] -> 54745.02617801047 | AX31: =SUM(RC[-43]:RC[-37])/RC[-46] -> 62070.680628272254 | AY31: =RC[-39]/RC[-47] -> 1259.1623036649214
A32: Germany | B32: EU | C32: C31 | D32: =RC[19]/1000 -> 2415 | E32: 241 | F32: 845 | G32: 154369463 | I32: 519536 | J32: 178925 | K32: 49986069 | L32: 1722099 | N32: 3232266 | O32: 61183 | T32: 2228181 | U32: 57583739 | W32: 2415000 | X32: 5231 | Y32: 3638 | Z32: 8869 | AA32: 240640929 | AB32: 200462916 | AC32: 18827653 | AD32: 0 | AE32: 4629073 | AF32: 0 | AG32: 26773402 | AH32: 491333973 | AI32: 454813141 | AJ32: 11287646 | AK32: 25233186 | AL32: 491333973 | AM32: 15760576 | AN32: 0 | AO32: 0 | AP32: 13353451 | AQ32: 29114027 | AR32: =RC[-30]+RC[-29] -> 3293449 | AS32: =RC[-24]/RC[-23] -> #DIV/0! | AT32: =RC[-12]/RC[-23] -> 203.45092049689441 | AU32: =RC[-27]/RC[-43] -> 922.64223602484469 | AV32: =RC[-26]/RC[-44] -> 0 | AW32: =RC[-42]/RC[-45] -> 63921.102691511391 | AX32: =SUM(RC[-43]:RC[-37])/RC[-46] -> 85621.570186335404 | AY32: =RC[-39]/RC[-47] -> 713.08447204968945
A33: USA | B33: World - A | C33: C50 | D33: =RC[19]/1000 -> 16072.976000000001 | E33: 3575 | G33: 878906177 | I33: 7543703 | K33: 1062082077 | L33: 94285669 | M33: 3473225 | N33: 24550615 | O33: 3249220 | S33: 28803 | U33: 220701765 | V33: 16541520 | W33: 16072976 | X33: 30041 | Y33: 66668 | Z33: 96709 | AA33: 2534637034 | AB33: 1800363164 | AC33: 0 | AD33: 0 | AE33: 0 | AF33: 0 | AG33: 694734341 | AH33: 5029734539 | AI33: 4388151679 | AJ33: 204458423 | AK33: 437124437 | AL33: 5029734539 | AR33: =RC[-30]+RC[-29] -> 27799835 | AS33: =RC[-24]/RC[-23] -> 13.342290490837602 | AT33: =RC[-12]/RC[-23] -> 312.93112980446188 | AU33: =RC[-27]/RC[-43] -> 0 | AV33: =RC[-26]/RC[-44] -> 1029.1510420969955 | AW33: =RC[-42]/RC[-45] -> 54682.230409601805 | AX33: =SUM(RC[-43]:RC[-37])/RC[-46] -> 127312.50584832577 | AY33: =RC[-39]/RC[-47] -> 5866.0990348022669
A34: Turkey | B34: World - B | C34: C42 | D34: =RC[19]/1000 -> 1019.7809999999999 | W34: 1019781 | AR34: =RC[-30]+RC[-29] -> 0 | AS34: =RC[-24]/RC[-23] -> #DIV/0! | AT34: =RC[-12]/RC[-23] -> 0 | AU34: =RC[-27]/RC[-43] -> 0 | AV34: =RC[-26]/RC[-44] -> 0 | AW34: =RC[-42]/RC[-45] -> 0 | AX34: =SUM(RC[-43]:RC[-37])/RC[-46] -> 0 | AY34: =RC[-39]/RC[-47] -> 0
A35: Australia | B35: World - A | C35: C70 | D35: =RC[19]/1000 -> 1063.7750000000001 | W35: 1063775 | AR35: =RC[-30]+RC[-29] -> 0 | AS35: =RC[-24]/RC[-23] -> #DIV/0! | AT35: =RC[-12]/RC[-23] -> 0 | AU35: =RC[-27]/RC[-43] -> 0 | AV35: =RC[-26]/RC[-44] -> 0 | AW35: =RC[-42]/RC[-45] -> 0 | AX35: =SUM(RC[-43]:RC[-37])/RC[-46] -> 0 | AY35: =RC[-39]/RC[-47] -> 0
A36: Japan | B36: World - A | C36: C41 | D36: =RC[19]/1000 -> 3782.3130000000001 | E36: 1064 | F36: 1651 | G36: 280726000 | N36: 7637000 | U36: 28374000 | W36: 3782313 | X36: 7508 | Y36: 6902 | Z36: 14410 | AA36: 217143840 | AB36: 685720182 | AC36: 2303953 | AD36: 85529 | AE36: 805492 | AF36: 1661955 | AG36: 28519971 | AH36: 936240922 | AI36: 835799770 | AJ36: 35882362 | AK36: 64558790 | AL36: 936240922 | AR36: =RC[-30]+RC[-29] -> 7637000 | AS36: =RC[-24]/RC[-23] -> #DIV/0! | AT36: =RC[-12]/RC[-23] -> 247.53131800567536 | AU36: =RC[-27]/RC[-43] -> 0 | AV36: =RC[-26]/RC[-44] -> 0 | AW36: =RC[-42]/RC[-45] -> 74220.721553187162 | AX36: =SUM(RC[-43]:RC[-37])/RC[-46] -> 74220.721553187162 | AY36: =RC[-39]/RC[-47] -> 0
A37: Korea | B37: World - A | C37: C40 | D37: =RC[19]/1000 -> 2413.145 | W37: 2413145 | AR37: =RC[-30]+RC[-29] -> 0 | AS37: =RC[-24]/RC[-23] -> #DIV/0! | AT37: =RC[-12]/RC[-23] -> 0 | AU37: =RC[-27]/RC[-43] -> 0 | AV37: =RC[-26]/RC[-44] -> 0 | AW37: =RC[-42]/RC[-45] -> 0 | AX37: =SUM(RC[-43]:RC[-37])/RC[-46] -> 0 | AY37: =RC[-39]/RC[-47] -> 0
A38: Canada | B38: World - A | C38: C51 | D38: =RC[19]/1000 -> 2030.395 | E38: 2739 | F38: 910 | G38: 75032608 | I38: 150814 | V38: 241138449 | W38: 2030395 | X38: 3130 | Y38: 6616 | Z38: 13349 | AA38: 402701509 | AB38: 87045658 | AC38: 0 | AD38: 0 | AE38: 0 | AF38: 0 | AG38: 130705857 | AH38: 620453024 | AI38: 573016599 | AJ38: 14160664 | AK38: 33275761 | AL38: 620453024 | AM38: 25852154 | AN38: 38825 | AO38: 1941548 | AP38: 309008 | AQ38: 28141535 | AR38: =RC[-30]+RC[-29] -> 0 | AS38: =RC[-24]/RC[-23] -> 0 | AT38: =RC[-12]/RC[-23] -> 305.58242312456446 | AU38: =RC[-27]/RC[-43] -> 0 | AV38: =RC[-26]/RC[-44] -> 118764.3039901103 | AW38: =RC[-42]/RC[-45] -> 36954.685172097059 | AX38: =SUM(RC[-43]:RC[-37])/RC[-46] -> 37028.963329795435 | AY38: =RC[-39]/RC[-47] -> 0
A39: New Zealand | B39: World - A | C39: C71 | D39: =RC[19]/1000 -> 169.55699999999999 | W39: 169557 | AR39: =RC[-30]+RC[-29] -> 0 | AS39: =RC[-24]/RC[-23] -> #DIV/0! | AT39: =RC[-12]/RC[-23] -> 0 | AU39: =RC[-27]/RC[-43] -> 0 | AV39: =RC[-26]/RC[-44] -> 0 | AW39: =RC[-42]/RC[-45] -> 0 | AX39: =SUM(RC[-43]:RC[-37])/RC[-46] -> 0 | AY39: =RC[-39]/RC[-47] -> 0
A40: Mexico | B40: World - B | C40: C72 | D40: =RC[19]/1000 -> 1492.1759999999999 | W40: 1492176 | AR40: =RC[-30]+RC[-29] -> 0 | AS40: =RC[-24]/RC[-23] -> #DIV/0! | AT40: =RC[-12]/RC[-23] -> 0 | AU40: =RC[-27]/RC[-43] -> 0 | AV40: =RC[-26]/RC[-44] -> 0 | AW40: =RC[-42]/RC[-45] -> 0 | AX40: =SUM(RC[-43]:RC[-37])/RC[-46] -> 0 | AY40: =RC[-39]/RC[-47] -> 0
A41: CEE - Total | B41: Totals | D41: =RC[19]/1000 -> 2302 | E41: 934 | F41: 3615 | G41: 131734074 | H41: 1142831 | I41: 1168450 | J41: 1960226 | K41: 8711868 | L41: 852840 | M41: 88631 | N41: 4228576 | O41: 57769 | P41: 7 | Q41: 26 | R41: 6829 | S41: 3511 | T41: 2553436 | U41: 55149153 | V41: 37603812 | W41: 2302000 | X41: 11489 | Y41: 4214 | Z41: 15703 | AA41: 33263888 | AB41: 47382991 | AC41: 565690 | AD41: 1636390 | AE41: 1196376 | AF41: 3889473 | AG41: 13733644 | AH41: 101668452 | AI41: 79791420 | AJ41: 2661068 | AK41: 18955212 | AL41: 101407700 | AM41: 14119252 | AN41: 0 | AO41: 866018 | AP41: 246785 | AQ41: 15232055 | AR41: =RC[-30]+RC[-29] -> 4286345 | AS41: =RC[-24]/RC[-23] -> 1.4665841058879883 | AT41: =RC[-12]/RC[-23] -> 44.165270199826239 | AU41: =RC[-27]/RC[-43] -> 1109.2250217202434 | AV41: =RC[-26]/RC[-44] -> 16335.278887923545 | AW41: =RC[-42]/RC[-45] -> 57225.922675933973 | AX41: =SUM(RC[-43]:RC[-37])/RC[-46] -> 63274.943527367504 | AY41: =RC[-39]/RC[-47] -> 370.47784535186793
A42: EU - Total | B42: Totals | D42: =RC[19]/1000 -> 12585.234 | E42: 3208 | F42: 6424 | G42: 487754400 | H42: 2911598 | I42: 3865860 | J42: 1766522 | K42: 78693509 | L42: 9969449 | M42: 423705 | N42: 14813673 | O42: 660572 | P42: 38 | Q42: 48 | R42: 154269 | S42: 80462 | T42: 14382525 | U42: 210580745 | V42: 403657987 | W42: 12585234 | X42: 24539 | Y42: 20301 | Z42: 47560 | AA42: 1354514691 | AB42: 864718452 | AC42: 67486035 | AD42: 1353979 | AE42: 9296599 | AF42: 29096808 | AG42: 318420990 | AH42: 2644887555 | AI42: 2231179957 | AJ42: 106286030 | AK42: 235802452 | AL42: 2573268439 | AM42: 82712061 | AN42: 1136892 | AO42: 3768217 | AP42: 25911026 | AQ42: 113528196 | AR42: =RC[-30]+RC[-29] -> 15474245 | AS42: =RC[-24]/RC[-23] -> 0.52168110574261972 | AT42: =RC[-12]/RC[-23] -> 210.15799587039859 | AU42: =RC[-27]/RC[-43] -> 1142.8095019925731 | AV42: =RC[-26]/RC[-44] -> 32073.935772668192 | AW42: =RC[-42]/RC[-45] -> 38756.085107356761 | AX42: =SUM(RC[-43]:RC[-37])/RC[-46] -> 46513.639952979815 | AY42: =RC[-39]/RC[-47] -> 792.15444067229896
A43: EFTA - Total | B43: Totals | D43: =RC[19]/1000 -> 365 | E43: 243 | F43: 546 | G43: 31208347 | H43: 219470 | I43: 292848 | J43: 109166 | K43: 1270604 | L43: 319773 | M43: 23761 | N43: 848616 | O43: 17118 | P43: 22 | Q43: 31 | R43: 3105 | S43: 1159 | T43: 332547 | U43: 7957560 | V43: 11540072 | W43: 365000 | X43: 1569 | Y43: 884 | Z43: 2452 | AA43: 70333312 | AB43: 37558616 | AC43: 0 | AD43: 0 | AE43: 0 | AF43: 0 | AG43: 27051215 | AH43: 134943143 | AI43: 117633762 | AJ43: 11267938 | AK43: -2 | AL43: 128901698 | AM43: 3931886 | AN43: 61209 | AO43: 230814 | AP43: 741183 | AQ43: 4965092 | AR43: =RC[-30]+RC[-29] -> 865734 | AS43: =RC[-24]/RC[-23] -> 0.68955895595798711 | AT43: =RC[-12]/RC[-23] -> 369.70724109589042 | AU43: =RC[-27]/RC[-43] -> 911.08767123287669 | AV43: =RC[-26]/RC[-44] -> 31616.635616438358 | AW43: =RC[-42]/RC[-45] -> 85502.320547945201 | AX43: =SUM(RC[-43]:RC[-37])/RC[-46] -> 91627.312328767119 | AY43: =RC[-39]/RC[-47] -> 876.09041095890416
A44: World A - Total | B44: Totals | D44: =RC[19]/1000 -> 25532.161 | E44: 8272 | F44: 14308 | G44: 1449728909 | H44: 9563506 | I44: 11934892 | J44: 8727610 | K44: 1374967028 | L44: 122512732 | M44: 4522442 | N44: 41732246 | O44: 4281006 | P44: 36 | Q44: 54 | R44: 151587 | S44: 53281 | T44: 14000859 | U44: 308064410 | V44: 356095263 | W44: 25532161 | X44: 47154 | Y44: 87500 | Z44: 138257 | AA44: 3544120087 | AB44: 3250815148 | AC44: 4374510 | AD44: 162394 | AE44: 1529386 | AF44: 3155550 | AG44: 932900246 | AH44: 7737057321 | AI44: 6800824975 | AJ44: 301274447 | AK44: 634957899 | AL44: 7737057321 | AM44: 258632557 | AN44: 3662525 | AO44: 15606518 | AP44: 44189468 | AQ44: 322091068 | AR44: =RC[-30]+RC[-29] -> 46013252 | AS44: =RC[-24]/RC[-23] -> 0.8651179670424316 | AT44: =RC[-12]/RC[-23] -> 303.03182409824223 | AU44: =RC[-27]/RC[-43] -> 548.36169175025964 | AV44: =RC[-26]/RC[-44] -> 13946.930030716945 | AW44: =RC[-42]/RC[-45] -> 56780.50161911481 | AX44: =SUM(RC[-43]:RC[-37])/RC[-46] -> 116792.19471473644 | AY44: =RC[-39]/RC[-47] -> 4798.3690843873337
A45: World B - Total | B45: Totals | D45: =RC[19]/1000 -> 2511.9569999999999 | E45: 404 | F45: 495 | G45: 39127601 | H45: 254526 | I45: 343668 | J45: 232280 | K45: 27338657 | L45: 2504638 | M45: 93433 | N45: 1186903 | O45: 95485 | P45: 22 | Q45: 30 | R45: 49718 | S45: 17743 | T45: 4591924 | U45: 93952846 | V45: 84887696 | W45: 2511957 | X45: 1498 | Y45: 2242 | Z45: 3740 | AA45: 6618301 | AB45: 9331753 | AC45: 68112 | AD45: 369971 | AE45: 225448 | AF45: 1007737 | AG45: 2903375 | AH45: 20524697 | AI45: 15654749 | AJ45: 480700 | AK45: 4389248 | AL45: 20524697 | AM45: 3123861 | AN45: 0 | AO45: 159645 | AP45: 37498 | AQ45: 3321004 | AR45: =RC[-30]+RC[-29] -> 1282388 | AS45: =RC[-24]/RC[-23] -> 1.1067899168802979 | AT45: =RC[-12]/RC[-23] -> 8.1707995001506788 | AU45: =RC[-27]/RC[-43] -> 1828.026514785086 | AV45: =RC[-26]/RC[-44] -> 33793.451082164225 | AW45: =RC[-42]/RC[-45] -> 15576.540920087407 | AX45: =SUM(RC[-43]:RC[-37])/RC[-46] -> 27824.840552605001 | AY45: =RC[-39]/RC[-47] -> 997.08633547469174
A46: EU Accession Countries - Totals | B46: Totals | D46: =RC[19]/1000 -> 1616.63 | E46: 667 | F46: 2835 | G46: 93938357 | H46: 859989 | I46: 884554 | J46: 1531096 | K46: 7862199 | L46: 532106 | M46: 74514 | N46: 3141060 | O46: 42180 | P46: 7 | Q46: 26 | R46: 5462 | S46: 3000 | T46: 1898554 | U46: 38312786 | V46: 27326879 | W46: 1616630 | X46: 8467 | Y46: 2946 | Z46: 11413 | AA46: 28300167 | AB46: 38915339 | AC46: 512335 | AD46: 1281841 | AE46: 978957 | AF46: 2934421 | AG46: 11121444 | AH46: 84044504 | AI46: 67073361 | AJ46: 2421845 | AK46: 14288546 | AL46: 83783752 | AM46: 11011200 | AN46: 2101 | AO46: 708194 | AP46: 241384 | AQ46: 11962879 | AR46: =RC[-30]+RC[-29] -> 3183240 | AS46: =RC[-24]/RC[-23] -> 1.4020183570908336 | AT46: =RC[-12]/RC[-23] -> 51.987470231283595 | AU46: =RC[-27]/RC[-43] -> 1174.3899346170738 | AV46: =RC[-26]/RC[-44] -> 16903.607504500102 | AW46: =RC[-42]/RC[-45] -> 58107.518108658129 | AX46: =SUM(RC[-43]:RC[-37])/RC[-46] -> 65372.296072694429 | AY46: =RC[-39]/RC[-47] -> 329.14519710756326

Sheet: 2000
A1: Name | B1: Type | C1: Code | D1: Population '000s | E1: Libraries - Total Administrative Units | F1: Libraries - Service Points | G1: Collections - Books & Bound Periodicals | H1: Collections - Current Periodicals - Titles | I1: Collections - Current Periodicals - Subscriptions | J1: Collections - Manuscripts | K1: Collections - Microforms | L1: Collections - Audio-visual Materials | M1: Collections - CD-ROMs | N1: Additions - Books & Bound Periodicals | O1: Additions - Audio-visual Materials | P1: Facilities & Services - Percentage Stock on Open Access | Q1: Facilities & Services - Percentage Catalogue Records Automated | R1: Facilities & Services - Number of Workstations for users | S1: Facilities & Services - Number connected to the internet | T1: Use & Users - Registered Users | U1: Use & Users - Loans | V1: Use & Users - Number of Visits | W1: Use & Users - Potential Total Population Served | X1: Library Staff FTE - Trained Librarians | Y1: Library Staff FTE - Other Library Staff | Z1: Library Staff FTE - Total Staff | AA1: Recurrent Expenditure (Euros) - Staff | AB1: Recurrent Expenditure (Euros) - Acquisition of Stock | AC1: Recurrent Expenditure (Euros) - Electronic Information | AD1: Recurrent Expenditure (Euros) - Automation | AE1: Recurrent Expenditure (Euros) - Premises and Related Costs | AF1: Recurrent Expenditure (Euros) - New Buildings / Refurbishment | AG1: Recurrent Expenditure (Euros) - Other Expenditure | AH1: Recurrent Expenditure (Euros) - TOTAL EXPENDITURE | AI1: Income - Public Funding | AJ1: Income - Fees & Charges | AK1: Income - Other Income | AL1: Income - TOTAL INCOME | AM1: Capital Expenditure - New Buildings / Refurbishment | AN1: Capital Expenditure - Acquisition of Stock | AO1: Capital Expenditure - Automation | AP1: Capital Expenditure - Other Capital Expenditure | AQ1: Capital Expenditure - TOTAL CAPITAL PAYMENTS | AR1: Additions | AS1: Loans per visit | AT1: Cost per pop | AU1: Users per 1000 pop | AV1: visits per 1000 pop | AW1: Bookstock per 1000 pop | AX1: Total stock per 1000 pop | AY1: AV materials per 1000 pop
A2: Bulgaria | B2: CEE | C2: C1 | D2: =RC[19]/1000 -> 289 | E2: 84 | F2: 84 | G2: 8501798 | H2: 8198 | K2: 23792 | L2: 84101 | N2: 101846 | O2: 3634 | T2: 200848 | U2: 5002065 | V2: 2813081 | W2: 289000 | X2: 496 | Y2: 312 | Z2: 808 | AA2: 915682 | AB2: 1270346 | AC2: 0 | AD2: 0 | AE2: 0 | AF2: 0 | AG2: 86478 | AH2: 2272506 | AI2: 1440682 | AJ2: 146788 | AK2: 865658 | AL2: 2453128 | AR2: =RC[-30]+RC[-29] -> 105480 | AS2: =RC[-24]/RC[-23] -> 1.7781446748245073 | AT2: =RC[-12]/RC[-23] -> 7.8633425605536331 | AU2: =RC[-27]/RC[-43] -> 694.97577854671283 | AV2: =RC[-26]/RC[-44] -> 9733.8442906574401 | AW2: =RC[-42]/RC[-45] -> 29417.986159169552 | AX2: =SUM(RC[-43]:RC[-37])/RC[-46] -> 29819.685121107268 | AY2: =RC[-39]/RC[-47] -> 291.0069204152249
A3: Czech Republic | B3: CEE | C3: C2 | D3: =RC[19]/1000 -> 192 | E3: 75 | F3: 1186 | G3: 10618145 | H3: 21511 | J3: 43062 | K3: 13753 | L3: 38158 | N3: 230445 | O3: 2556 | T3: 265265 | U3: 2507780 | V3: 4255805 | W3: 192000 | X3: 406 | Y3: 387 | Z3: 793 | AB3: 3583782 | AR3: =RC[-30]+RC[-29] -> 233001 | AS3: =RC[-24]/RC[-23] -> 0.58926102112291334 | AT3: =RC[-12]/RC[-23] -> 0 | AU3: =RC[-27]/RC[-43] -> 1381.5885416666667 | AV3: =RC[-26]/RC[-44] -> 22165.651041666668 | AW3: =RC[-42]/RC[-45] -> 55302.838541666664 | AX3: =SUM(RC[-43]:RC[-37])/RC[-46] -> 55909.526041666664 | AY3: =RC[-39]/RC[-47] -> 198.73958333333334
A4: Estonia | B4: CEE | C4: C3 | D4: =RC[19]/1000 -> 48 | E4: 20 | F4: 37 | G4: 7384025 | H4: 12527 | I4: 23467 | J4: 71068 | K4: 29088 | L4: 36998 | M4: 3570 | N4: 110480 | O4: 4134 | P4: 5 | Q4: 15 | R4: 196 | S4: 190 | T4: 73823 | U4: 1978566 | V4: 1761645 | W4: 48000 | X4: 522 | Y4: 98 | Z4: 620 | AA4: 2322593 | AB4: 1441470 | AC4: 297336 | AD4: 103588 | AE4: 186120 | AF4: 0 | AG4: 438451 | AH4: 4789558 | AI4: 3335112 | AJ4: 0 | AK4: 1995303 | AL4: 5330415 | AM4: 505799 | AN4: 0 | AO4: 25849 | AP4: 6071 | AQ4: 537719 | AR4: =RC[-30]+RC[-29] -> 114614 | AS4: =RC[-24]/RC[-23] -> 1.1231354784874366 | AT4: =RC[-12]/RC[-23] -> 99.782458333333338 | AU4: =RC[-27]/RC[-43] -> 1537.9791666666667 | AV4: =RC[-26]/RC[-44] -> 36700.9375 | AW4: =RC[-42]/RC[-45] -> 153833.85416666666 | AX4: =SUM(RC[-43]:RC[-37])/RC[-46] -> 157515.47916666666 | AY4: =RC[-39]/RC[-47] -> 770.79166666666663
A5: Hungary | B5: CEE | C5: C4 | D5: =RC[19]/1000 -> 214 | E5: 141 | F5: 401 | G5: 16366142 | H5: 26078 | J5: 796077 | K5: 5418049 | L5: 117905 | M5: 22354 | N5: 374994 | O5: 6380 | T5: 284873 | U5: 4014677 | V5: 3788043 | W5: 214000 | X5: 1016 | Y5: 385 | Z5: 1401 | AA5: 3976037 | AB5: 7382380 | AC5: 35523 | AD5: 192953 | AE5: 117580 | AF5: 525570 | AG5: 559877 | AH5: 12789920 | AI5: 11030528 | AJ5: 420759 | AK5: 292935 | AL5: 11744223 | AR5: =RC[-30]+RC[-29] -> 381374 | AS5: =RC[-24]/RC[-23] -> 1.0598287823026296 | AT5: =RC[-12]/RC[-23] -> 59.765981308411213 | AU5: =RC[-27]/RC[-43] -> 1331.1822429906542 | AV5: =RC[-26]/RC[-44] -> 17701.135514018693 | AW5: =RC[-42]/RC[-45] -> 76477.299065420564 | AX5: =SUM(RC[-43]:RC[-37])/RC[-46] -> 106292.54672897197 | AY5: =RC[-39]/RC[-47] -> 550.95794392523362
A6: Latvia | B6: CEE | C6: C5 | D6: =RC[19]/1000 -> 61 | E6: 28 | F6: 28 | G6: 5467590 | J6: 25362 | L6: 1590 | N6: 134553 | T6: 88495 | U6: 4209082 | V6: 1547742 | W6: 61000 | X6: 362 | Y6: 22 | Z6: 384 | AA6: 933321 | AB6: 639562 | AC6: 0 | AD6: 0 | AE6: 0 | AF6: 0 | AG6: 245185 | AH6: 1818068 | AI6: 1112621 | AJ6: 32498 | AK6: 580061 | AL6: 1725180 | AM6: 491342 | AN6: 0 | AO6: 25110 | AP6: 5897 | AQ6: 522350 | AR6: =RC[-30]+RC[-29] -> 134553 | AS6: =RC[-24]/RC[-23] -> 2.7194984693831401 | AT6: =RC[-12]/RC[-23] -> 29.804393442622949 | AU6: =RC[-27]/RC[-43] -> 1450.7377049180327 | AV6: =RC[-26]/RC[-44] -> 25372.819672131147 | AW6: =RC[-42]/RC[-45] -> 89632.62295081967 | AX6: =SUM(RC[-43]:RC[-37])/RC[-46] -> 90074.459016393448 | AY6: =RC[-39]/RC[-47] -> 26.065573770491802
A7: Lithuania | B7: CEE | C7: C6 | D7: =RC[19]/1000 -> 97 | E7: 15 | F7: 106 | G7: 12319023 | H7: 4208 | I7: 4000 | J7: 249193 | K7: 28264 | L7: 3640 | M7: 2720 | N7: 155423 | O7: 32784 | P7: 4 | Q7: 3 | R7: 263 | S7: 263 | T7: 107259 | U7: 7194060 | V7: 4179376 | W7: 97000 | X7: 558 | Y7: 97 | Z7: 655 | AA7: 1644192 | AB7: 479185 | AC7: 0 | AD7: 156133 | AE7: 0 | AF7: 0 | AG7: 462325 | AH7: 2741835 | AI7: 2019659 | AJ7: 98125 | AK7: 624048 | AL7: 2741832 | AR7: =RC[-30]+RC[-29] -> 188207 | AS7: =RC[-24]/RC[-23] -> 1.7213239488382954 | AT7: =RC[-12]/RC[-23] -> 28.266340206185568 | AU7: =RC[-27]/RC[-43] -> 1105.7628865979382 | AV7: =RC[-26]/RC[-44] -> 43086.350515463921 | AW7: =RC[-42]/RC[-45] -> 127000.23711340207 | AX7: =SUM(RC[-43]:RC[-37])/RC[-46] -> 130010.80412371134 | AY7: =RC[-39]/RC[-47] -> 37.52577319587629
A8: Poland | B8: CEE | C8: C7 | D8: =RC[19]/1000 -> 796 | W8: 796000 | AR8: =RC[-30]+RC[-29] -> 0 | AS8: =RC[-24]/RC[-23] -> #DIV/0! | AT8: =RC[-12]/RC[-23] -> 0 | AU8: =RC[-27]/RC[-43] -> 0 | AV8: =RC[-26]/RC[-44] -> 0 | AW8: =RC[-42]/RC[-45] -> 0 | AX8: =SUM(RC[-43]:RC[-37])/RC[-46] -> 0 | AY8: =RC[-39]/RC[-47] -> 0
A9: Romania | B9: CEE | C9: C8 | D9: =RC[19]/1000 -> 438 | W9: 438000 | AR9: =RC[-30]+RC[-29] -> 0 | AS9: =RC[-24]/RC[-23] -> #DIV/0! | AT9: =RC[-12]/RC[-23] -> 0 | AU9: =RC[-27]/RC[-43] -> 0 | AV9: =RC[-26]/RC[-44] -> 0 | AW9: =RC[-42]/RC[-45] -> 0 | AX9: =SUM(RC[-43]:RC[-37])/RC[-46] -> 0 | AY9: =RC[-39]/RC[-47] -> 0
A10: Slovak Rep | B10: CEE | C10: C9 | D10: =RC[19]/1000 -> 112 | E10: 34 | F10: 569 | G10: 4663015 | H10: 7561 | I10: 9455 | M10: 1017 | N10: 88241 | O10: 439 | R10: 261 | S10: 80 | T10: 145708 | U10: 2594041 | V10: 847070 | W10: 112000 | X10: 262 | Y10: 228 | Z10: 490 | AA10: 1069535 | AB10: 829960 | AC10: 72718 | AD10: 140600 | AE10: 54571 | AF10: 1075864 | AG10: 106293 | AH10: 3349541 | AI10: 2902983 | AJ10: 27554 | AK10: 321355 | AL10: 3251893 | AM10: 220415 | AN10: 0 | AO10: 136188 | AP10: 0 | AQ10: 356603 | AR10: =RC[-30]+RC[-29] -> 88680 | AS10: =RC[-24]/RC[-23] -> 3.0623691076298298 | AT10: =RC[-12]/RC[-23] -> 29.906616071428573 | AU10: =RC[-27]/RC[-43] -> 1300.9642857142858 | AV10: =RC[-26]/RC[-44] -> 7563.125 | AW10: =RC[-42]/RC[-45] -> 41634.0625 | AX10: =SUM(RC[-43]:RC[-37])/RC[-46] -> 41795.071428571428 | AY10: =RC[-39]/RC[-47] -> 0
A11: Slovenia | B11: CEE | C11: C10 | D11: =RC[19]/1000 -> 55 | E11: 53 | F11: 79 | G11: 4080556 | H11: 16504 | I11: 13802 | N11: 127715 | O11: 12372 | Q11: 44 | R11: 262 | S11: 249 | T11: 124456 | U11: 2949667 | V11: 1533531 | W11: 55000 | X11: 268 | Y11: 97 | Z11: 365 | AA11: 912040 | AB11: 4200165 | AC11: 12882 | AD11: 69969 | AE11: 42637 | AF11: 190584 | AG11: 3456985 | AH11: 8885262 | AI11: 5730373 | AJ11: 167375 | AK11: 2987513 | AL11: 8885262 | AR11: =RC[-30]+RC[-29] -> 140087 | AS11: =RC[-24]/RC[-23] -> 1.9234479120409043 | AT11: =RC[-12]/RC[-23] -> 161.5502181818182 | AU11: =RC[-27]/RC[-43] -> 2262.8363636363638 | AV11: =RC[-26]/RC[-44] -> 27882.381818181817 | AW11: =RC[-42]/RC[-45] -> 74191.927272727276 | AX11: =SUM(RC[-43]:RC[-37])/RC[-46] -> 74742.94545454545 | AY11: =RC[-39]/RC[-47] -> 0
A12: Austria | B12: EU | C12: C11 | D12: =RC[19]/1000 -> 269 | W12: 269000 | AR12: =RC[-30]+RC[-29] -> 0 | AS12: =RC[-24]/RC[-23] -> #DIV/0! | AT12: =RC[-12]/RC[-23] -> 0 | AU12: =RC[-27]/RC[-43] -> 0 | AV12: =RC[-26]/RC[-44] -> 0 | AW12: =RC[-42]/RC[-45] -> 0 | AX12: =SUM(RC[-43]:RC[-37])/RC[-46] -> 0 | AY12: =RC[-39]/RC[-47] -> 0
A13: België Nederlandstalige Universiteiten | B13: België Nederlandstalige Universiteiten | C13: C12a | D13: 94 | E13: 41 | F13: 317 | G13: 9811675 | H13: 40200 | I13: 10953 | J13: 110 | K13: 2672 | L13: 7793 | M13: 1340 | N13: 187374 | O13: 353 | P13: 46 | Q13: 60 | R13: 311 | T13: 75145 | U13: 674914 | V13: 720027 | W13: 94000 | X13: 113 | Y13: 197 | Z13: 305 | AA13: 7996380 | AB13: 5161661 | AC13: 606533 | AD13: 368990 | AE13: 82920 | AF13: 0 | AG13: 366734 | AH13: 14583218 | AI13: 4550869 | AJ13: 82920 | AK13: 40332 | AL13: 4674121 | AM13: 0 | AN13: 0 | AO13: 65444 | AP13: 6867 | AQ13: 72311 | AR13: 187727 | AS13: =RC[-24]/RC[-23] -> 0.93734540510286424 | AT13: =RC[-12]/RC[-23] -> 155.1406170212766 | AU13: =RC[-27]/RC[-43] -> 799.41489361702122 | AV13: =RC[-26]/RC[-44] -> 7659.8617021276596 | AW13: =RC[-42]/RC[-45] -> 104379.52127659574 | AX13: =SUM(RC[-43]:RC[-37])/RC[-46] -> 105050.4574468085 | AY13: =RC[-39]/RC[-47] -> 82.90425531914893
A14: Belgique universités francophones | B14: Belgique universités francophones | C14: C12b | D14: 60 | G14: 8948663 | H14: 17836 | I14: 17852 | J14: 600 | K14: 279683 | L14: 6462 | M14: 903 | N14: 126961 | O14: 1676 | P14: 44 | Q14: 54 | R14: 376 | T14: 50333 | U14: 453954 | V14: 3104312 | W14: 60000 | X14: 122 | Y14: 184 | Z14: 305 | AA14: 7661861 | AB14: 7003969 | AC14: 602631 | AD14: 387143 | AE14: 749875 | AF14: 0 | AG14: 362068 | AH14: 16767548 | AI14: 6514595 | AJ14: 263176 | AK14: 261511 | AL14: 6688966 | AM14: 0 | AN14: 26196 | AO14: 53352 | AP14: 0 | AQ14: 43802 | AR14: 128637 | AS14: =RC[-24]/RC[-23] -> 0.14623336829545483 | AT14: =RC[-12]/RC[-23] -> 279.45913333333334 | AU14: =RC[-27]/RC[-43] -> 838.88333333333333 | AV14: =RC[-26]/RC[-44] -> 51738.533333333333 | AW14: =RC[-42]/RC[-45] -> 149144.38333333333 | AX14: =SUM(RC[-43]:RC[-37])/RC[-46] -> 154533.31666666668 | AY14: =RC[-39]/RC[-47] -> 107.7
A15: Belgium | B15: EU | C15: C12 | D15: =RC[19]/1000 -> 154.798 | E15: 72 | F15: 44 | G15: 18760338 | H15: 58036 | I15: 28805 | J15: 710 | K15: 282355 | L15: 14255 | M15: 2243 | N15: 314335 | O15: 2029 | P15: 45 | Q15: 55 | R15: 687 | T15: 125478 | U15: 1128868 | V15: 3824339 | W15: 154798 | X15: 235 | Y15: 381 | Z15: 616 | AA15: 15686241 | AB15: 12165630 | AC15: 1209164 | AD15: 756134 | AE15: 832796 | AF15: 0 | AG15: 728801 | AH15: 31378766 | AI15: 20180280 | AJ15: 323786 | AK15: 272096 | AL15: 20776162 | AM15: 0 | AN15: 111359 | AO15: 6867 | AP15: 101809 | AQ15: 220035 | AR15: =RC[-30]+RC[-29] -> 316364 | AS15: =RC[-24]/RC[-23] -> 0.29517989906229547 | AT15: =RC[-12]/RC[-23] -> 202.70782568250235 | AU15: =RC[-27]/RC[-43] -> 810.59186811199106 | AV15: =RC[-26]/RC[-44] -> 24705.351490329333 | AW15: =RC[-42]/RC[-45] -> 121192.37974650835 | AX15: =SUM(RC[-43]:RC[-37])/RC[-46] -> 123688.56186772439 | AY15: =RC[-39]/RC[-47] -> 92.087753071745112
A16: Denmark | B16: EU | C16: C13 | D16: =RC[19]/1000 -> 180 | E16: 19 | F16: 43 | G16: 10548697 | I16: 95313 | J16: 91740 | K16: 1203105 | L16: 857726 | M16: 30834 | N16: 248933 | O16: 20955 | R16: 848 | U16: 4846988 | W16: 180000 | X16: 398 | Y16: 432 | Z16: 830 | AA16: 38104345 | AB16: 16651008 | AC16: 595731 | AD16: 32925 | AE16: 310085 | AF16: 0 | AG16: 10979155 | AH16: 66673249 | AI16: 61903726 | AJ16: 1806241 | AK16: 2963283 | AL16: 66673249 | AM16: 2229685 | AN16: 0 | AO16: 0 | AP16: 0 | AQ16: 2229685 | AR16: =RC[-30]+RC[-29] -> 269888 | AS16: =RC[-24]/RC[-23] -> #DIV/0! | AT16: =RC[-12]/RC[-23] -> 370.40693888888887 | AU16: =RC[-27]/RC[-43] -> 0 | AV16: =RC[-26]/RC[-44] -> 0 | AW16: =RC[-42]/RC[-45] -> 58603.87222222222 | AX16: =SUM(RC[-43]:RC[-37])/RC[-46] -> 71263.416666666672 | AY16: =RC[-39]/RC[-47] -> 4765.1444444444442
A17: Eire | B17: EU | C17: C15 | D17: =RC[19]/1000 -> 137 | W17: 137000 | AR17: =RC[-30]+RC[-29] -> 0 | AS17: =RC[-24]/RC[-23] -> #DIV/0! | AT17: =RC[-12]/RC[-23] -> 0 | AU17: =RC[-27]/RC[-43] -> 0 | AV17: =RC[-26]/RC[-44] -> 0 | AW17: =RC[-42]/RC[-45] -> 0 | AX17: =SUM(RC[-43]:RC[-37])/RC[-46] -> 0 | AY17: =RC[-39]/RC[-47] -> 0
A18: Finland | B18: EU | C18: C16 | D18: =RC[19]/1000 -> 224 | E18: 47 | F18: 457 | G18: 15437808 | H18: 237807 | I18: 273707 | J18: 265120 | K18: 1274515 | L18: 306772 | N18: 620732 | O18: 18049 | P18: 45 | U18: 13070949 | V18: 16070244 | W18: 224000 | X18: 1260 | Y18: 137 | Z18: 1397 | AA18: 35800663 | AB18: 21903460 | AC18: 0 | AD18: 0 | AE18: 0 | AF18: 19252956 | AG18: 10771852 | AH18: 87728930 | AI18: 57682476 | AJ18: 4033957 | AK18: 6954000 | AL18: 68670434 | AR18: =RC[-30]+RC[-29] -> 638781 | AS18: =RC[-24]/RC[-23] -> 0.81336344364155266 | AT18: =RC[-12]/RC[-23] -> 391.64700892857144 | AU18: =RC[-27]/RC[-43] -> 0 | AV18: =RC[-26]/RC[-44] -> 71742.16071428571 | AW18: =RC[-42]/RC[-45] -> 68918.78571428571 | AX18: =SUM(RC[-43]:RC[-37])/RC[-46] -> 79445.21875 | AY18: =RC[-39]/RC[-47] -> 1369.5178571428571
A19: France | B19: EU | C19: C17 | D19: =RC[19]/1000 -> 2278 | E19: 95 | F19: 396 | G19: 25684360 | H19: 152995 | K19: 1384057 | L19: 97296 | M19: 44108 | N19: 1008519 | P19: 35 | W19: 2278000 | X19: 1812 | Y19: 2552 | Z19: 4364 | AA19: 159036673 | AB19: 57524645 | AC19: 5631979 | AD19: 0 | AE19: 0 | AF19: 0 | AG19: 64797689 | AH19: 286990986 | AI19: 273570384 | AJ19: 8148186 | AK19: 7829233 | AL19: 289547804 | AR19: =RC[-30]+RC[-29] -> 1008519 | AS19: =RC[-24]/RC[-23] -> #DIV/0! | AT19: =RC[-12]/RC[-23] -> 125.98375153643546 | AU19: =RC[-27]/RC[-43] -> 0 | AV19: =RC[-26]/RC[-44] -> 0 | AW19: =RC[-42]/RC[-45] -> 11274.960491659351 | AX19: =SUM(RC[-43]:RC[-37])/RC[-46] -> 12011.771729587357 | AY19: =RC[-39]/RC[-47] -> 42.711150131694467
A20: Greece | B20: EU | C20: C18 | D20: =RC[19]/1000 -> 347 | E20: 82 | F20: 172 | G20: 5683287 | I20: 36200 | J20: 29790 | K20: 25338 | L20: 22796 | M20: 14045 | N20: 296750 | O20: 1439 | P20: 36 | Q20: 49 | T20: 402192 | U20: 1415696 | W20: 347000 | X20: 728 | Y20: 395 | Z20: 1123 | AA20: 3852511 | AB20: 13843950 | AC20: 661987 | AD20: 120455 | AE20: 0 | AF20: 901194 | AG20: 3747423 | AH20: 23127520 | AI20: 12977011 | AJ20: 9975543 | AK20: 174966 | AL20: 23127520 | AR20: =RC[-30]+RC[-29] -> 298189 | AS20: =RC[-24]/RC[-23] -> #DIV/0! | AT20: =RC[-12]/RC[-23] -> 66.649913544668593 | AU20: =RC[-27]/RC[-43] -> 1159.0547550432277 | AV20: =RC[-26]/RC[-44] -> 0 | AW20: =RC[-42]/RC[-45] -> 16378.34870317003 | AX20: =SUM(RC[-43]:RC[-37])/RC[-46] -> 16747.711815561961 | AY20: =RC[-39]/RC[-47] -> 65.694524495677229
A21: Iceland | B21: EFTA | C21: C19 | D21: =RC[19]/1000 -> 8 | W21: 8000 | AR21: =RC[-30]+RC[-29] -> 0 | AS21: =RC[-24]/RC[-23] -> #DIV/0! | AT21: =RC[-12]/RC[-23] -> 0 | AU21: =RC[-27]/RC[-43] -> 0 | AV21: =RC[-26]/RC[-44] -> 0 | AW21: =RC[-42]/RC[-45] -> 0 | AX21: =SUM(RC[-43]:RC[-37])/RC[-46] -> 0 | AY21: =RC[-39]/RC[-47] -> 0
A22: Italy | B22: EU | C22: C20 | D22: =RC[19]/1000 -> 1852 | W22: 1852000 | AR22: =RC[-30]+RC[-29] -> 0 | AS22: =RC[-24]/RC[-23] -> #DIV/0! | AT22: =RC[-12]/RC[-23] -> 0 | AU22: =RC[-27]/RC[-43] -> 0 | AV22: =RC[-26]/RC[-44] -> 0 | AW22: =RC[-42]/RC[-45] -> 0 | AX22: =SUM(RC[-43]:RC[-37])/RC[-46] -> 0 | AY22: =RC[-39]/RC[-47] -> 0
A23: Liechtenstein | B23: EFTA | C23: C21 | D23: =RC[19]/1000 -> 1 | W23: 1000 | AR23: =RC[-30]+RC[-29] -> 0 | AS23: =RC[-24]/RC[-23] -> #DIV/0! | AT23: =RC[-12]/RC[-23] -> 0 | AU23: =RC[-27]/RC[-43] -> 0 | AV23: =RC[-26]/RC[-44] -> 0 | AW23: =RC[-42]/RC[-45] -> 0 | AX23: =SUM(RC[-43]:RC[-37])/RC[-46] -> 0 | AY23: =RC[-39]/RC[-47] -> 0
A24: Luxembourg | B24: EU | C24: C22 | D24: =RC[19]/1000 -> 2.9990000000000001 | E24: 7 | F24: 5 | G24: 395010 | H24: 1650 | I24: 807 | J24: 10 | K24: 5 | L24: 2415 | M24: 135 | N24: 3800 | O24: 120 | P24: 81 | Q24: 45 | R24: 33 | S24: 27 | T24: 13837 | W24: 2999 | X24: 5 | Y24: 5 | Z24: 9 | AA24: 283225 | AB24: 217492 | AC24: 16747 | AD24: 141 | AE24: 1328 | AF24: 8322 | AG24: 63057 | AH24: 590312 | AI24: 259634 | AJ24: 0 | AK24: 31929 | AL24: 291563 | AR24: =RC[-30]+RC[-29] -> 3920 | AS24: =RC[-24]/RC[-23] -> #DIV/0! | AT24: =RC[-12]/RC[-23] -> 196.83627875958652 | AU24: =RC[-27]/RC[-43] -> 4613.8712904301428 | AV24: =RC[-26]/RC[-44] -> 0 | AW24: =RC[-42]/RC[-45] -> 131713.9046348783 | AX24: =SUM(RC[-43]:RC[-37])/RC[-46] -> 133388.4628209403 | AY24: =RC[-39]/RC[-47] -> 805.26842280760252
A25: Netherlands | B25: EU | C25: C23 | D25: =RC[19]/1000 -> 540 | E25: 23 | F25: 138 | G25: 25084875 | H25: 152742 | I25: 161182 | K25: 5797711 | U25: 4162863 | W25: 540000 | X25: 868 | Y25: 1002 | Z25: 1870 | AR25: =RC[-30]+RC[-29] -> 0 | AS25: =RC[-24]/RC[-23] -> #DIV/0! | AT25: =RC[-12]/RC[-23] -> 0 | AU25: =RC[-27]/RC[-43] -> 0 | AV25: =RC[-26]/RC[-44] -> 0 | AW25: =RC[-42]/RC[-45] -> 46453.472222222219 | AX25: =SUM(RC[-43]:RC[-37])/RC[-46] -> 57771.314814814818 | AY25: =RC[-39]/RC[-47] -> 0
A26: Norway | B26: EFTA | C26: C24 | D26: =RC[19]/1000 -> 194 | E26: 85 | F26: 189 | G26: 12563166 | H26: 77324 | J26: 48499 | K26: 456921 | L26: 108283 | N26: 314668 | O26: 5108 | P26: 22 | R26: 1026 | S26: 424 | U26: 2720777 | V26: 4583208 | W26: 194000 | X26: 610 | Y26: 330 | Z26: 940 | AA26: 34745459 | AB26: 17932081 | AC26: 0 | AD26: 0 | AE26: 0 | AF26: 0 | AG26: 10781692 | AH26: 63459232 | AI26: 60452914 | AJ26: 3006318 | AK26: 0 | AL26: 63459232 | AR26: =RC[-30]+RC[-29] -> 319776 | AS26: =RC[-24]/RC[-23] -> 0.59364030609127927 | AT26: =RC[-12]/RC[-23] -> 327.1094432989691 | AU26: =RC[-27]/RC[-43] -> 0 | AV26: =RC[-26]/RC[-44] -> 23624.783505154639 | AW26: =RC[-42]/RC[-45] -> 64758.587628865978 | AX26: =SUM(RC[-43]:RC[-37])/RC[-46] -> 68320.582474226801 | AY26: =RC[-39]/RC[-47] -> 558.15979381443299
A27: Portugal | B27: EU | C27: C25 | D27: =RC[19]/1000 -> 325 | E27: 230 | F27: 230 | G27: 8616219 | J27: 14149 | K27: 47946 | L27: 144852 | N27: 333379 | O27: 9748 | R27: 484 | S27: 146 | T27: 1106067 | U27: 1615393 | W27: 325000 | X27: 829 | Y27: 470 | Z27: 1215 | AA27: 6585510 | AB27: 9990534 | AC27: 0 | AD27: 0 | AE27: 0 | AF27: 0 | AG27: 1419490 | AH27: 17995534 | AI27: 17034202 | AJ27: 506469 | AK27: 1027625 | AL27: 18568296 | AM27: 10888 | AN27: 0 | AO27: 0 | AP27: 410531 | AQ27: 421418 | AR27: =RC[-30]+RC[-29] -> 343127 | AS27: =RC[-24]/RC[-23] -> #DIV/0! | AT27: =RC[-12]/RC[-23] -> 55.370873846153849 | AU27: =RC[-27]/RC[-43] -> 3403.2830769230768 | AV27: =RC[-26]/RC[-44] -> 0 | AW27: =RC[-42]/RC[-45] -> 26511.443076923078 | AX27: =SUM(RC[-43]:RC[-37])/RC[-46] -> 27148.203076923077 | AY27: =RC[-39]/RC[-47] -> 445.69846153846152
A28: Spain | B28: EU | C28: C26 | D28: =RC[19]/1000 -> 1680 | E28: 610 | F28: 1007 | G28: 29482682 | H28: 234938 | J28: 41839 | K28: 1635186 | L28: 1038741 | M28: 71863 | N28: 1371270 | O28: 77635 | T28: 3805781 | U28: 14251982 | V28: 51875328 | W28: 1680000 | X28: 5874 | Y28: 1556 | Z28: 7430 | AA28: 114982902 | AB28: 74275401 | AC28: 0 | AD28: 0 | AE28: 0 | AF28: 0 | AG28: 9568754 | AH28: 198827057 | AI28: 169864971 | AJ28: 9016629 | AK28: 19945457 | AL28: 198827057 | AR28: =RC[-30]+RC[-29] -> 1448905 | AS28: =RC[-24]/RC[-23] -> 0.27473526528834669 | AT28: =RC[-12]/RC[-23] -> 118.34943869047619 | AU28: =RC[-27]/RC[-43] -> 2265.3458333333333 | AV28: =RC[-26]/RC[-44] -> 30878.17142857143 | AW28: =RC[-42]/RC[-45] -> 17549.215476190475 | AX28: =SUM(RC[-43]:RC[-37])/RC[-46] -> 19348.362499999999 | AY28: =RC[-39]/RC[-47] -> 618.29821428571427
A29: Sweden | B29: EU | C29: C27 | D29: =RC[19]/1000 -> 292 | E29: 37 | F29: 155 | G29: 23323000 | H29: 254183 | J29: 69985 | K29: 2710924 | L29: 45375 | M29: 7743 | N29: 342000 | O29: 871 | R29: 2092 | T29: 497999 | U29: 5332904 | W29: 292000 | X29: 1038 | Y29: 578 | Z29: 1616 | AA29: 62997998 | AB29: 29502011 | AC29: 0 | AD29: 0 | AE29: 0 | AF29: 0 | AG29: 19533116 | AH29: 112033125 | AI29: 98071433 | AJ29: 2355929 | AK29: 11605763 | AL29: 112033125 | AR29: =RC[-30]+RC[-29] -> 342871 | AS29: =RC[-24]/RC[-23] -> #DIV/0! | AT29: =RC[-12]/RC[-23] -> 383.67508561643837 | AU29: =RC[-27]/RC[-43] -> 1705.4760273972602 | AV29: =RC[-26]/RC[-44] -> 0 | AW29: =RC[-42]/RC[-45] -> 79873.287671232873 | AX29: =SUM(RC[-43]:RC[-37])/RC[-46] -> 90449.349315068495 | AY29: =RC[-39]/RC[-47] -> 155.39383561643837
A30: Switzerland | B30: EFTA | C30: C28 | D30: =RC[19]/1000 -> 162 | W30: 162000 | AR30: =RC[-30]+RC[-29] -> 0 | AS30: =RC[-24]/RC[-23] -> #DIV/0! | AT30: =RC[-12]/RC[-23] -> 0 | AU30: =RC[-27]/RC[-43] -> 0 | AV30: =RC[-26]/RC[-44] -> 0 | AW30: =RC[-42]/RC[-45] -> 0 | AX30: =SUM(RC[-43]:RC[-37])/RC[-46] -> 0 | AY30: =RC[-39]/RC[-47] -> 0
A31: UK | B31: EU | C31: C29 | D31: =RC[19]/1000 -> 1910 | E31: 169 | F31: 780 | G31: 100136000 | H31: 664000 | J31: 92000 | K31: 10641000 | L31: 2405000 | N31: 2831000 | O31: 157000 | R31: 34720 | S31: 34720 | T31: 2449000 | U31: 78600000 | V31: 120400000 | W31: 1910000 | X31: 3666 | Y31: 5964 | Z31: 9630 | AA31: 344292699 | AB31: 209729465 | AC31: 24358297 | AD31: 263556 | AE31: 2482124 | AF31: 0 | AG31: 98965124 | AH31: 680091265 | AI31: 470536180 | AJ31: 32038787 | AK31: 103168188 | AL31: 605743155 | AR31: =RC[-30]+RC[-29] -> 2988000 | AS31: =RC[-24]/RC[-23] -> 0.65282392026578073 | AT31: =RC[-12]/RC[-23] -> 356.06872513089007 | AU31: =RC[-27]/RC[-43] -> 1282.1989528795812 | AV31: =RC[-26]/RC[-44] -> 63036.649214659687 | AW31: =RC[-42]/RC[-45] -> 52427.225130890052 | AX31: =SUM(RC[-43]:RC[-37])/RC[-46] -> 59653.403141361254 | AY31: =RC[-39]/RC[-47] -> 1259.1623036649214
A32: Germany | B32: EU | C32: C31 | D32: =RC[19]/1000 -> 2415 | E32: 237 | F32: 820 | G32: 143911373 | I32: 459800 | J32: 175023 | K32: 44230143 | L32: 1619872 | N32: 3191283 | O32: 75607 | T32: 2030448 | U32: 54699051 | W32: 2415000 | X32: 5252 | Y32: 3621 | Z32: 8873 | AA32: 238823496 | AB32: 174616372 | AC32: 11044241 | AD32: 0 | AE32: 4223480 | AF32: 0 | AG32: 22113445 | AH32: 450821034 | AI32: 417311527 | AJ32: 10356923 | AK32: 23152584 | AL32: 450821034 | AM32: 7505785 | AN32: 0 | AO32: 0 | AP32: 10919092 | AQ32: 18424877 | AR32: =RC[-30]+RC[-29] -> 3266890 | AS32: =RC[-24]/RC[-23] -> #DIV/0! | AT32: =RC[-12]/RC[-23] -> 186.67537639751552 | AU32: =RC[-27]/RC[-43] -> 840.7652173913043 | AV32: =RC[-26]/RC[-44] -> 0 | AW32: =RC[-42]/RC[-45] -> 59590.630641821946 | AX32: =SUM(RC[-43]:RC[-37])/RC[-46] -> 78839.010766045554 | AY32: =RC[-39]/RC[-47] -> 670.75445134575568
A33: USA | B33: World - A | C33: C50 | D33: =RC[19]/1000 -> 16072.976000000001 | E33: 3575 | G33: 878906177 | I33: 7543703 | K33: 1062082077 | L33: 94285669 | M33: 3473225 | N33: 24550615 | O33: 3249220 | S33: 28803 | U33: 220701765 | V33: 16541520 | W33: 16072976 | X33: 30041 | Y33: 66668 | Z33: 96709 | AA33: 2369165242 | AB33: 1682827866 | AC33: 0 | AD33: 0 | AE33: 0 | AF33: 0 | AG33: 649379155 | AH33: 4701372263 | AI33: 4095522241 | AJ33: 190823855 | AK33: 407974222 | AL33: 4694320338 | AR33: =RC[-30]+RC[-29] -> 27799835 | AS33: =RC[-24]/RC[-23] -> 13.342290490837602 | AT33: =RC[-12]/RC[-23] -> 292.50166633733539 | AU33: =RC[-27]/RC[-43] -> 0 | AV33: =RC[-26]/RC[-44] -> 1029.1510420969955 | AW33: =RC[-42]/RC[-45] -> 54682.230409601805 | AX33: =SUM(RC[-43]:RC[-37])/RC[-46] -> 127312.50584832577 | AY33: =RC[-39]/RC[-47] -> 5866.0990348022669
A34: Turkey | B34: World - B | C34: C42 | D34: =RC[19]/1000 -> 1019.7809999999999 | W34: 1019781 | AR34: =RC[-30]+RC[-29] -> 0 | AS34: =RC[-24]/RC[-23] -> #DIV/0! | AT34: =RC[-12]/RC[-23] -> 0 | AU34: =RC[-27]/RC[-43] -> 0 | AV34: =RC[-26]/RC[-44] -> 0 | AW34: =RC[-42]/RC[-45] -> 0 | AX34: =SUM(RC[-43]:RC[-37])/RC[-46] -> 0 | AY34: =RC[-39]/RC[-47] -> 0
A35: Australia | B35: World - A | C35: C70 | D35: =RC[19]/1000 -> 1063.7750000000001 | W35: 1063775 | AR35: =RC[-30]+RC[-29] -> 0 | AS35: =RC[-24]/RC[-23] -> #DIV/0! | AT35: =RC[-12]/RC[-23] -> 0 | AU35: =RC[-27]/RC[-43] -> 0 | AV35: =RC[-26]/RC[-44] -> 0 | AW35: =RC[-42]/RC[-45] -> 0 | AX35: =SUM(RC[-43]:RC[-37])/RC[-46] -> 0 | AY35: =RC[-39]/RC[-47] -> 0
A36: Japan | B36: World - A | C36: C41 | D36: =RC[19]/1000 -> 3782.3130000000001 | E36: 1069 | F36: 1645 | G36: 273022000 | N36: 8009000 | U36: 28599000 | W36: 3782313 | X36: 7508 | Y36: 7116 | Z36: 14624 | AA36: 269734282 | AB36: 773529232 | AC36: 2861951 | AD36: 106243 | AE36: 1000575 | AF36: 2064467 | AG36: 35427273 | AH36: 1084724023 | AI36: 968353409 | AJ36: 41573124 | AK36: 74797490 | AL36: 1084724023 | AR36: =RC[-30]+RC[-29] -> 8009000 | AS36: =RC[-24]/RC[-23] -> #DIV/0! | AT36: =RC[-12]/RC[-23] -> 286.78853997540659 | AU36: =RC[-27]/RC[-43] -> 0 | AV36: =RC[-26]/RC[-44] -> 0 | AW36: =RC[-42]/RC[-45] -> 72183.872672621219 | AX36: =SUM(RC[-43]:RC[-37])/RC[-46] -> 72183.872672621219 | AY36: =RC[-39]/RC[-47] -> 0
A37: Korea | B37: World - A | C37: C40 | D37: =RC[19]/1000 -> 2413.145 | W37: 2413145 | AR37: =RC[-30]+RC[-29] -> 0 | AS37: =RC[-24]/RC[-23] -> #DIV/0! | AT37: =RC[-12]/RC[-23] -> 0 | AU37: =RC[-27]/RC[-43] -> 0 | AV37: =RC[-26]/RC[-44] -> 0 | AW37: =RC[-42]/RC[-45] -> 0 | AX37: =SUM(RC[-43]:RC[-37])/RC[-46] -> 0 | AY37: =RC[-39]/RC[-47] -> 0
A38: Canada | B38: World - A | C38: C51 | D38: =RC[19]/1000 -> 2030.395 | E38: 2739 | F38: 910 | G38: 75032608 | I38: 150814 | V38: 241138449 | W38: 2030395 | X38: 3130 | Y38: 6616 | Z38: 13349 | AA38: 368924881 | AB38: 79744695 | AC38: 0 | AD38: 0 | AE38: 0 | AF38: 0 | AG38: 119742890 | AH38: 568412466 | AI38: 524954776 | AJ38: 12972937 | AK38: 30484753 | AL38: 568412466 | AM38: 24797063 | AN38: 37240 | AO38: 1862309 | AP38: 296397 | AQ38: 26993009 | AR38: =RC[-30]+RC[-29] -> 0 | AS38: =RC[-24]/RC[-23] -> 0 | AT38: =RC[-12]/RC[-23] -> 279.95166753267222 | AU38: =RC[-27]/RC[-43] -> 0 | AV38: =RC[-26]/RC[-44] -> 118764.3039901103 | AW38: =RC[-42]/RC[-45] -> 36954.685172097059 | AX38: =SUM(RC[-43]:RC[-37])/RC[-46] -> 37028.963329795435 | AY38: =RC[-39]/RC[-47] -> 0
A39: New Zealand | B39: World - A | C39: C71 | D39: =RC[19]/1000 -> 169.55699999999999 | W39: 169557 | AR39: =RC[-30]+RC[-29] -> 0 | AS39: =RC[-24]/RC[-23] -> #DIV/0! | AT39: =RC[-12]/RC[-23] -> 0 | AU39: =RC[-27]/RC[-43] -> 0 | AV39: =RC[-26]/RC[-44] -> 0 | AW39: =RC[-42]/RC[-45] -> 0 | AX39: =SUM(RC[-43]:RC[-37])/RC[-46] -> 0 | AY39: =RC[-39]/RC[-47] -> 0
A40: Mexico | B40: World - B | C40: C72 | D40: =RC[19]/1000 -> 1492.1759999999999 | W40: 1492176 | AR40: =RC[-30]+RC[-29] -> 0 | AS40: =RC[-24]/RC[-23] -> #DIV/0! | AT40: =RC[-12]/RC[-23] -> 0 | AU40: =RC[-27]/RC[-43] -> 0 | AV40: =RC[-26]/RC[-44] -> 0 | AW40: =RC[-42]/RC[-45] -> 0 | AX40: =SUM(RC[-43]:RC[-37])/RC[-46] -> 0 | AY40: =RC[-39]/RC[-47] -> 0
A41: CEE - Total | B41: Totals | D41: =RC[19]/1000 -> 2302 | E41: 921 | F41: 3718 | G41: 132732653 | H41: 1145851 | I41: 1168610 | J41: 1959414 | K41: 8714290 | L41: 814915 | M41: 87471 | N41: 4173385 | O41: 91402 | P41: 7 | Q41: 25 | R41: 5834 | S41: 2539 | T41: 2507027 | U41: 54183722 | V41: 36866946 | W41: 2302000 | X41: 11456 | Y41: 4264 | Z41: 15720 | AA41: 30931712 | AB41: 43202822 | AC41: 615631 | AD41: 1734214 | AE41: 1053527 | AF41: 4709161 | AG41: 13760127 | AH41: 96007192 | AI41: 72507375 | AJ41: 2272901 | AK41: 20265779 | AL41: 95046065 | AM41: 14195148 | AN41: 0 | AO41: 850369 | AP41: 167740 | AQ41: 15213260 | AR41: =RC[-30]+RC[-29] -> 4264787 | AS41: =RC[-24]/RC[-23] -> 1.4697100757952666 | AT41: =RC[-12]/RC[-23] -> 41.705991311902693 | AU41: =RC[-27]/RC[-43] -> 1089.0647263249348 | AV41: =RC[-26]/RC[-44] -> 16015.180712423979 | AW41: =RC[-42]/RC[-45] -> 57659.710251954821 | AX41: =SUM(RC[-43]:RC[-37])/RC[-46] -> 63693.833188531709 | AY41: =RC[-39]/RC[-47] -> 354.00304083405734
A42: EU - Total | B42: Totals | D42: =RC[19]/1000 -> 12606.797 | E42: 3208 | F42: 6380 | G42: 472421959 | H42: 2717982 | I42: 3801024 | J42: 1743680 | K42: 72921512 | L42: 9834253 | M42: 403338 | N42: 14772422 | O42: 667490 | P42: 570 | Q42: 797 | R42: 152722 | S42: 79121 | T42: 14140359 | U42: 205193236 | V42: 404448544 | W42: 12606797 | X42: 24490 | Y42: 19985 | Z42: 44390 | AA42: 1307779703 | AB42: 794221645 | AC42: 57367844 | AD42: 1459793 | AE42: 9052575 | AF42: 26028702 | AG42: 310371177 | AH42: 2506281437 | AI42: 2080162445 | AJ42: 101137418 | AK42: 222993859 | AL42: 2404293725 | AM42: 67383686 | AN42: 1008600 | AO42: 3390366 | AP42: 22296403 | AQ42: 94079054 | AR42: =RC[-30]+RC[-29] -> 15439912 | AS42: =RC[-24]/RC[-23] -> 0.50734077064695771 | AT42: =RC[-12]/RC[-23] -> 198.80398145540062 | AU42: =RC[-27]/RC[-43] -> 1121.645648771849 | AV42: =RC[-26]/RC[-44] -> 32081.784453259617 | AW42: =RC[-42]/RC[-45] -> 37473.591349174574 | AX42: =SUM(RC[-43]:RC[-37])/RC[-46] -> 44725.376953400613 | AY42: =RC[-39]/RC[-47] -> 780.07546246679465
A43: EFTA - Total | B43: Totals | D43: =RC[19]/1000 -> 365 | E43: 243 | F43: 549 | G43: 30924365 | H43: 210715 | I43: 279662 | J43: 108309 | K43: 1285048 | L43: 312205 | M43: 23211 | N43: 872048 | O43: 17075 | P43: 22 | Q43: 30 | R43: 2991 | S43: 1159 | T43: 332547 | U43: 7989869 | V43: 10746344 | W43: 365000 | X43: 1560 | Y43: 868 | Z43: 2428 | AA43: 64431009 | AB43: 33252750 | AC43: 0 | AD43: 0 | AE43: 0 | AF43: 0 | AG43: 19993268 | AH43: 117677025 | AI43: 112102195 | AJ43: 5574832 | AK43: 0 | AL43: 117677025 | AM43: 3530457 | AN43: 54960 | AO43: 207249 | AP43: 665511 | AQ43: 4458177 | AR43: =RC[-30]+RC[-29] -> 889123 | AS43: =RC[-24]/RC[-23] -> 0.7434964858746379 | AT43: =RC[-12]/RC[-23] -> 322.4028082191781 | AU43: =RC[-27]/RC[-43] -> 911.08767123287669 | AV43: =RC[-26]/RC[-44] -> 29442.038356164383 | AW43: =RC[-42]/RC[-45] -> 84724.287671232873 | AX43: =SUM(RC[-43]:RC[-37])/RC[-46] -> 90804.150684931505 | AY43: =RC[-39]/RC[-47] -> 855.35616438356169
A44: World A - Total | B44: Totals | D44: =RC[19]/1000 -> 25532.161 | E44: 8277 | F44: 14302 | G44: 1442024909 | H44: 9563506 | I44: 11934892 | J44: 8727610 | K44: 1374967028 | L44: 122512732 | M44: 4522442 | N44: 42104246 | O44: 4281006 | P44: 36 | Q44: 54 | R44: 151587 | S44: 53281 | T44: 14000859 | U44: 308289410 | V44: 356095263 | W44: 25532161 | X44: 47154 | Y44: 87714 | Z44: 138471 | AA44: 3368504691 | AB44: 3159813067 | AC44: 4759983 | AD44: 176703 | AE44: 1664152 | AF44: 3433611 | AG44: 877873504 | AH44: 7416225709 | AI44: 6513727492 | AJ44: 288463914 | AK44: 605389809 | AL44: 7407581239 | AM44: 233811586 | AN44: 3290975 | AO44: 14132145 | AP44: 39696849 | AQ44: 290931555 | AR44: =RC[-30]+RC[-29] -> 46385252 | AS44: =RC[-24]/RC[-23] -> 0.86574982043498849 | AT44: =RC[-12]/RC[-23] -> 290.46604041859206 | AU44: =RC[-27]/RC[-43] -> 548.36169175025964 | AV44: =RC[-26]/RC[-44] -> 13946.930030716945 | AW44: =RC[-42]/RC[-45] -> 56478.764527608924 | AX44: =SUM(RC[-43]:RC[-37])/RC[-46] -> 116490.45762323056 | AY44: =RC[-39]/RC[-47] -> 4798.3690843873337
A45: World B - Total | B45: Totals | D45: =RC[19]/1000 -> 2511.9569999999999 | E45: 404 | F45: 495 | G45: 39127601 | H45: 254526 | I45: 343668 | J45: 232280 | K45: 27338657 | L45: 2504638 | M45: 93433 | N45: 1186903 | O45: 95485 | P45: 22 | Q45: 30 | R45: 49718 | S45: 17743 | T45: 4591924 | U45: 93952846 | V45: 84887696 | W45: 2511957 | X45: 1498 | Y45: 2242 | Z45: 3740 | AA45: 5961000 | AB45: 8404965 | AC45: 61348 | AD45: 333227 | AE45: 203058 | AF45: 907653 | AG45: 2615022 | AH45: 18486274 | AI45: 13977573 | AJ45: 429200 | AK45: 3919005 | AL45: 18325778 | AM45: 2804929 | AN45: 0 | AO45: 143346 | AP45: 33669 | AQ45: 2981944 | AR45: =RC[-30]+RC[-29] -> 1282388 | AS45: =RC[-24]/RC[-23] -> 1.1067899168802979 | AT45: =RC[-12]/RC[-23] -> 7.3593114850294015 | AU45: =RC[-27]/RC[-43] -> 1828.026514785086 | AV45: =RC[-26]/RC[-44] -> 33793.451082164225 | AW45: =RC[-42]/RC[-45] -> 15576.540920087407 | AX45: =SUM(RC[-43]:RC[-37])/RC[-46] -> 27824.840552605001 | AY45: =RC[-39]/RC[-47] -> 997.08633547469174
A46: EU Accession Countries - Totals | B46: Totals | D46: =RC[19]/1000 -> 1616.7809999999999 | E46: 654 | F46: 2938 | G46: 94939747 | H46: 863034 | I46: 884767 | J46: 1530290 | K46: 7864730 | L46: 494258 | M46: 73277 | N46: 3085998 | O46: 75819 | P46: 7 | Q46: 25 | R46: 4468 | S46: 2028 | T46: 1852486 | U46: 37348465 | V46: 26594292 | W46: 1616781 | X46: 8435 | Y46: 2996 | Z46: 11431 | AA46: 26359480 | AB46: 35378159 | AC46: 566828 | AD46: 1407401 | AE46: 853073 | AF46: 3829161 | AG46: 11353938 | AH46: 79748040 | AI46: 60810581 | AJ46: 2047968 | AK46: 15906170 | AL46: 78764727 | AM46: 11172512 | AN46: 1893 | AO46: 696811 | AP46: 160209 | AQ46: 12031428 | AR46: =RC[-30]+RC[-29] -> 3161817 | AS46: =RC[-24]/RC[-23] -> 1.4043789923040628 | AT46: =RC[-12]/RC[-23] -> 49.325196176847697 | AU46: =RC[-27]/RC[-43] -> 1145.786596947886 | AV46: =RC[-26]/RC[-44] -> 16448.914231426519 | AW46: =RC[-42]/RC[-45] -> 58721.463822249272 | AX46: =SUM(RC[-43]:RC[-37])/RC[-46] -> 65964.470760109136 | AY46: =RC[-39]/RC[-47] -> 305.70497797784611

Sheet: 1999
A1: Name | B1: Type | C1: Code | D1: Population '000s | E1: Libraries - Total Administrative Units | F1: Libraries - Service Points | G1: Collections - Books & Bound Periodicals | H1: Collections - Current Periodicals - Titles | I1: Collections - Current Periodicals - Subscriptions | J1: Collections - Manuscripts | K1: Collections - Microforms | L1: Collections - Audio-visual Materials | M1: Collections - CD-ROMs | N1: Additions - Books & Bound Periodicals | O1: Additions - Audio-visual Materials | P1: Facilities & Services - Percentage Stock on Open Access | Q1: Facilities & Services - Percentage Catalogue Records Automated | R1: Facilities & Services - Number of Workstations for users | S1: Facilities & Services - Number connected to the internet | T1: Use & Users - Registered Users | U1: Use & Users - Consultations | V1: Use & Users - Number of Visits | W1: Use & Users - Potential Total Population Served | X1: Library Staff FTE - Trained Librarians | Y1: Library Staff FTE - Other Library Staff | Z1: Library Staff FTE - Total Staff | AA1: Recurrent Expenditure (Euros) - Staff | AB1: Recurrent Expenditure (Euros) - Acquisition of Stock | AC1: Recurrent Expenditure (Euros) - Electronic Information | AD1: Recurrent Expenditure (Euros) - Automation | AE1: Recurrent Expenditure (Euros) - Premises and Related Costs | AF1: Recurrent Expenditure (Euros) - New Buildings / Refurbishment | AG1: Recurrent Expenditure (Euros) - Other Expenditure | AH1: Recurrent Expenditure (Euros) - TOTAL EXPENDITURE | AI1: Income - Public Funding | AJ1: Income - Fees & Charges | AK1: Income - Other Income | AL1: Income - TOTAL INCOME | AM1: Capital Expenditure - New Buildings / Refurbishment | AN1: Capital Expenditure - Acquisition of Stock | AO1: Capital Expenditure - Automation | AP1: Capital Expenditure - Other Capital Expenditure | AQ1: Capital Expenditure - TOTAL CAPITAL PAYMENTS | AR1: Additions | AS1: Loans per visit | AT1: Cost per pop | AU1: Users per 1000 pop | AV1: visits per 1000 pop | AW1: Bookstock per 1000 pop | AX1: Total stock per 1000 pop | AY1: AV materials per 1000 pop
A2: Bulgaria | B2: CEE | C2: C1 | D2: =RC[19]/1000 -> 289 | E2: 90 | F2: 90 | G2: 8451195 | H2: 8632 | K2: 23913 | L2: 80488 | N2: 161926 | O2: 1599 | T2: 207639 | U2: 5304114 | V2: 2916446 | W2: 289000 | X2: 495 | Y2: 371 | Z2: 866 | AA2: 944064 | AB2: 1357884 | AC2: 0 | AD2: 0 | AE2: 0 | AF2: 0 | AG2: 167145 | AH2: 2469093 | AI2: 1751400 | AJ2: 213616 | AK2: 523579 | AL2: 2488595 | AR2: =RC[-30]+RC[-29] -> 163525 | AS2: =RC[-24]/RC[-23] -> 1.81869096839098 | AT2: =RC[-12]/RC[-23] -> 8.5435743944636684 | AU2: =RC[-27]/RC[-43] -> 718.47404844290656 | AV2: =RC[-26]/RC[-44] -> 10091.508650519032 | AW2: =RC[-42]/RC[-45] -> 29242.889273356403 | AX2: =SUM(RC[-43]:RC[-37])/RC[-46] -> 29634.006920415224 | AY2: =RC[-39]/RC[-47] -> 278.50519031141869
A3: Czech Republic | B3: CEE | C3: C2 | D3: =RC[19]/1000 -> 192 | E3: 76 | F3: 1163 | G3: 10096576 | H3: 21423 | J3: 40947 | K3: 13753 | L3: 36842 | N3: 206714 | O3: 2468 | T3: 231560 | U3: 2140444 | V3: 4109027 | W3: 192000 | X3: 379 | Y3: 358 | Z3: 737 | AB3: 3475691 | AR3: =RC[-30]+RC[-29] -> 209182 | AS3: =RC[-24]/RC[-23] -> 0.52091261507894693 | AT3: =RC[-12]/RC[-23] -> 0 | AU3: =RC[-27]/RC[-43] -> 1206.0416666666667 | AV3: =RC[-26]/RC[-44] -> 21401.182291666668 | AW3: =RC[-42]/RC[-45] -> 52586.333333333336 | AX3: =SUM(RC[-43]:RC[-37])/RC[-46] -> 53174.692708333336 | AY3: =RC[-39]/RC[-47] -> 191.88541666666666
A4: Estonia | B4: CEE | C4: C3 | D4: =RC[19]/1000 -> 48 | E4: 19 | F4: 36 | G4: 7392179 | H4: 11621 | I4: 18514 | J4: 68736 | K4: 29204 | L4: 32888 | M4: 3296 | N4: 104181 | O4: 2704 | P4: 4 | Q4: 10 | R4: 103 | S4: 81 | T4: 75122 | U4: 1998782 | V4: 1823352 | W4: 48000 | X4: 524 | Y4: 114 | Z4: 638 | AA4: 2211295 | AB4: 1675271 | AC4: 323860 | AD4: 91954 | AE4: 479378 | AF4: 0 | AG4: 59038 | AH4: 4840795 | AI4: 5215571 | AJ4: 0 | AK4: 322314 | AL4: 5537885 | AM4: 690916 | AN4: 0 | AO4: 0 | AP4: 127867 | AQ4: 818783 | AR4: =RC[-30]+RC[-29] -> 106885 | AS4: =RC[-24]/RC[-23] -> 1.0962129089720472 | AT4: =RC[-12]/RC[-23] -> 100.84989583333333 | AU4: =RC[-27]/RC[-43] -> 1565.0416666666667 | AV4: =RC[-26]/RC[-44] -> 37986.5 | AW4: =RC[-42]/RC[-45] -> 154003.72916666666 | AX4: =SUM(RC[-43]:RC[-37])/RC[-46] -> 157425.79166666666 | AY4: =RC[-39]/RC[-47] -> 685.16666666666663
A5: Hungary | B5: CEE | C5: C4 | D5: =RC[19]/1000 -> 214 | E5: 96 | F5: 273 | G5: 14307557 | H5: 24539 | J5: 695944 | K5: 3688597 | L5: 123091 | M5: 4196 | N5: 327826 | O5: 6661 | T5: 284010 | U5: 4597282 | V5: 3758974 | W5: 214000 | X5: 702 | Y5: 336 | Z5: 1038 | AA5: 2519201 | AB5: 5894215 | AC5: 31697 | AD5: 168949 | AE5: 231864 | AF5: 468953 | AG5: 375832 | AH5: 9690711 | AI5: 8357649 | AJ5: 318802 | AK5: 221952 | AL5: 8898404 | AR5: =RC[-30]+RC[-29] -> 334487 | AS5: =RC[-24]/RC[-23] -> 1.2230151099741577 | AT5: =RC[-12]/RC[-23] -> 45.283696261682245 | AU5: =RC[-27]/RC[-43] -> 1327.1495327102805 | AV5: =RC[-26]/RC[-44] -> 17565.299065420561 | AW5: =RC[-42]/RC[-45] -> 66857.742990654209 | AX5: =SUM(RC[-43]:RC[-37])/RC[-46] -> 88055.719626168226 | AY5: =RC[-39]/RC[-47] -> 575.19158878504675
A6: Latvia | B6: CEE | C6: C5 | D6: =RC[19]/1000 -> 61 | E6: 26 | F6: 26 | G6: 4745097 | J6: 21773 | L6: 1872 | N6: 128323 | T6: 73197 | U6: 3268260 | V6: 1309129 | W6: 61000 | X6: 341 | Y6: 21 | Z6: 362 | AA6: 670779 | AB6: 443119 | AC6: 0 | AD6: 0 | AE6: 0 | AF6: 0 | AG6: 157641 | AH6: 1271539 | AI6: 1103919 | AJ6: 32605 | AK6: 135015 | AL6: 1271539 | AM6: 671168 | AN6: 0 | AO6: 0 | AP6: 124212 | AQ6: 795380 | AR6: =RC[-30]+RC[-29] -> 128323 | AS6: =RC[-24]/RC[-23] -> 2.4965148583523855 | AT6: =RC[-12]/RC[-23] -> 20.844901639344261 | AU6: =RC[-27]/RC[-43] -> 1199.950819672131 | AV6: =RC[-26]/RC[-44] -> 21461.131147540982 | AW6: =RC[-42]/RC[-45] -> 77788.475409836072 | AX6: =SUM(RC[-43]:RC[-37])/RC[-46] -> 78176.098360655742 | AY6: =RC[-39]/RC[-47] -> 30.688524590163933
A7: Lithuania | B7: CEE | C7: C6 | D7: =RC[19]/1000 -> 97 | E7: 15 | F7: 106 | G7: 12290866 | H7: 5204 | I7: 5243 | J7: 245500 | K7: 27000 | L7: 3617 | M7: 2085 | N7: 181398 | O7: 590 | P7: 4 | Q7: 5 | R7: 249 | S7: 249 | T7: 97636 | U7: 7225817 | V7: 3174874 | W7: 97000 | X7: 585 | Y7: 89 | Z7: 674 | AA7: 1462972 | AB7: 295648 | AC7: 0 | AD7: 0 | AE7: 0 | AF7: 0 | AG7: 374065 | AH7: 2132685 | AI7: 1874136 | AJ7: 44290 | AK7: 208505 | AL7: 2126931 | AR7: =RC[-30]+RC[-29] -> 181988 | AS7: =RC[-24]/RC[-23] -> 2.2759381947126092 | AT7: =RC[-12]/RC[-23] -> 21.986443298969071 | AU7: =RC[-27]/RC[-43] -> 1006.5567010309278 | AV7: =RC[-26]/RC[-44] -> 32730.659793814433 | AW7: =RC[-42]/RC[-45] -> 126709.9587628866 | AX7: =SUM(RC[-43]:RC[-37])/RC[-46] -> 129685.72164948453 | AY7: =RC[-39]/RC[-47] -> 37.288659793814432
A8: Poland | B8: CEE | C8: C7 | D8: =RC[19]/1000 -> 796 | W8: 796000 | AR8: =RC[-30]+RC[-29] -> 0 | AS8: =RC[-24]/RC[-23] -> #DIV/0! | AT8: =RC[-12]/RC[-23] -> 0 | AU8: =RC[-27]/RC[-43] -> 0 | AV8: =RC[-26]/RC[-44] -> 0 | AW8: =RC[-42]/RC[-45] -> 0 | AX8: =SUM(RC[-43]:RC[-37])/RC[-46] -> 0 | AY8: =RC[-39]/RC[-47] -> 0
A9: Romania | B9: CEE | C9: C8 | D9: =RC[19]/1000 -> 438 | W9: 438000 | AR9: =RC[-30]+RC[-29] -> 0 | AS9: =RC[-24]/RC[-23] -> #DIV/0! | AT9: =RC[-12]/RC[-23] -> 0 | AU9: =RC[-27]/RC[-43] -> 0 | AV9: =RC[-26]/RC[-44] -> 0 | AW9: =RC[-42]/RC[-45] -> 0 | AX9: =SUM(RC[-43]:RC[-37])/RC[-46] -> 0 | AY9: =RC[-39]/RC[-47] -> 0
A10: Slovak Rep | B10: CEE | C10: C9 | D10: =RC[19]/1000 -> 112 | E10: 44 | F10: 571 | G10: 3894219 | H10: 6659 | I10: 8832 | M10: 915 | N10: 80408 | O10: 395 | R10: 226 | S10: 69 | T10: 131577 | U10: 2413614 | V10: 733756 | W10: 112000 | X10: 396 | Y10: 68 | Z10: 464 | AA10: 866104 | AB10: 668220 | AC10: 73024 | AD10: 141192 | AE10: 54801 | AF10: 1080397 | AG10: 106741 | AH10: 2990479 | AI10: 2588412 | AJ10: 28353 | AK10: 286533 | AL10: 2903299 | AM10: 213803 | AN10: 0 | AO10: 132102 | AP10: 0 | AQ10: 345905 | AR10: =RC[-30]+RC[-29] -> 80803 | AS10: =RC[-24]/RC[-23] -> 3.2893959299821738 | AT10: =RC[-12]/RC[-23] -> 26.700705357142859 | AU10: =RC[-27]/RC[-43] -> 1174.7946428571429 | AV10: =RC[-26]/RC[-44] -> 6551.3928571428569 | AW10: =RC[-42]/RC[-45] -> 34769.8125 | AX10: =SUM(RC[-43]:RC[-37])/RC[-46] -> 34916.294642857145 | AY10: =RC[-39]/RC[-47] -> 0
A11: Slovenia | B11: CEE | C11: C10 | D11: =RC[19]/1000 -> 55 | E11: 54 | F11: 54 | G11: 3486062 | H11: 14459 | I11: 12092 | N11: 113965 | O11: 13712 | Q11: 44 | R11: 218 | S11: 208 | T11: 126886 | U11: 3253613 | V11: 1698891 | W11: 55000 | X11: 256 | Y11: 106 | Z11: 362 | AA11: 764138 | AB11: 4685441 | AC11: 12463 | AD11: 66428 | AE11: 91165 | AF11: 184385 | AG11: 3316458 | AH11: 9120478 | AI11: 7918176 | AJ11: 233869 | AK11: 968432 | AL11: 9120478 | AR11: =RC[-30]+RC[-29] -> 127677 | AS11: =RC[-24]/RC[-23] -> 1.9151393467856384 | AT11: =RC[-12]/RC[-23] -> 165.82687272727273 | AU11: =RC[-27]/RC[-43] -> 2307.0181818181818 | AV11: =RC[-26]/RC[-44] -> 30888.927272727273 | AW11: =RC[-42]/RC[-45] -> 63382.945454545457 | AX11: =SUM(RC[-43]:RC[-37])/RC[-46] -> 63865.69090909091 | AY11: =RC[-39]/RC[-47] -> 0
A12: Austria | B12: EU | C12: C11 | D12: =RC[19]/1000 -> 269 | W12: 269000 | AR12: =RC[-30]+RC[-29] -> 0 | AS12: =RC[-24]/RC[-23] -> #DIV/0! | AT12: =RC[-12]/RC[-23] -> 0 | AU12: =RC[-27]/RC[-43] -> 0 | AV12: =RC[-26]/RC[-44] -> 0 | AW12: =RC[-42]/RC[-45] -> 0 | AX12: =SUM(RC[-43]:RC[-37])/RC[-46] -> 0 | AY12: =RC[-39]/RC[-47] -> 0
A13: België Nederlandstalige Universiteiten | B13: België Nederlandstalige Universiteiten | C13: C12a | AR13: 0 | AS13: =RC[-24]/RC[-23] -> #DIV/0! | AT13: =RC[-12]/RC[-23] -> #DIV/0! | AU13: =RC[-27]/RC[-43] -> #DIV/0! | AV13: =RC[-26]/RC[-44] -> #DIV/0! | AW13: =RC[-42]/RC[-45] -> #DIV/0! | AX13: =SUM(RC[-43]:RC[-37])/RC[-46] -> #DIV/0! | AY13: =RC[-39]/RC[-47] -> #DIV/0!
A14: Belgique universités francophones | B14: Belgique universités francophones | C14: C12b | AR14: 0 | AS14: =RC[-24]/RC[-23] -> #DIV/0! | AT14: =RC[-12]/RC[-23] -> #DIV/0! | AU14: =RC[-27]/RC[-43] -> #DIV/0! | AV14: =RC[-26]/RC[-44] -> #DIV/0! | AW14: =RC[-42]/RC[-45] -> #DIV/0! | AX14: =SUM(RC[-43]:RC[-37])/RC[-46] -> #DIV/0! | AY14: =RC[-39]/RC[-47] -> #DIV/0!
A15: Belgium | B15: EU | C15: C12 | D15: =RC[19]/1000 -> 163 | E15: 72 | F15: 40 | G15: 14483585 | H15: 53955 | I15: 23379 | J15: 8400 | K15: 273755 | L15: 12383 | M15: 1616 | N15: 371939 | O15: 849 | P15: 42 | Q15: 54 | R15: 628 | T15: 187168 | U15: 967585 | V15: 4410532 | W15: 163000 | X15: 203 | Y15: 345 | Z15: 548 | AA15: 6734760 | AB15: 5372958 | AC15: 994934 | AD15: 565360 | AE15: 805626 | AF15: 0 | AG15: 464313 | AH15: 14937952 | AI15: 9302488 | AJ15: 58289 | AK15: 350114 | AL15: 9710891 | AM15: 0 | AN15: 34879 | AO15: 131529 | AP15: 11831 | AQ15: 178239 | AR15: =RC[-30]+RC[-29] -> 372788 | AS15: =RC[-24]/RC[-23] -> 0.21938056452146815 | AT15: =RC[-12]/RC[-23] -> 91.643877300613497 | AU15: =RC[-27]/RC[-43] -> 1148.2699386503068 | AV15: =RC[-26]/RC[-44] -> 27058.478527607364 | AW15: =RC[-42]/RC[-45] -> 88856.349693251541 | AX15: =SUM(RC[-43]:RC[-37])/RC[-46] -> 91147.687116564412 | AY15: =RC[-39]/RC[-47] -> 75.969325153374228
A16: Denmark | B16: EU | C16: C13 | D16: =RC[19]/1000 -> 180 | E16: 19 | F16: 41 | G16: 9494806 | I16: 95229 | J16: 84455 | K16: 1182593 | L16: 873270 | M16: 22708 | N16: 236147 | O16: 26039 | R16: 845 | U16: 4617998 | W16: 180000 | X16: 392 | Y16: 431 | Z16: 823 | AA16: 36569403 | AB16: 17082078 | AC16: 652812 | AD16: 34272 | AE16: 322765 | AF16: 0 | AG16: 11428122 | AH16: 66089451 | AI16: 60943568 | AJ16: 1948770 | AK16: 3197113 | AL16: 66089451 | AM16: 3354185 | AN16: 0 | AO16: 0 | AP16: 0 | AQ16: 3354185 | AR16: =RC[-30]+RC[-29] -> 262186 | AS16: =RC[-24]/RC[-23] -> #DIV/0! | AT16: =RC[-12]/RC[-23] -> 367.16361666666666 | AU16: =RC[-27]/RC[-43] -> 0 | AV16: =RC[-26]/RC[-44] -> 0 | AW16: =RC[-42]/RC[-45] -> 52748.922222222223 | AX16: =SUM(RC[-43]:RC[-37])/RC[-46] -> 65294.783333333333 | AY16: =RC[-39]/RC[-47] -> 4851.5
A17: Eire | B17: EU | C17: C15 | D17: =RC[19]/1000 -> 137 | W17: 137000 | AR17: =RC[-30]+RC[-29] -> 0 | AS17: =RC[-24]/RC[-23] -> #DIV/0! | AT17: =RC[-12]/RC[-23] -> 0 | AU17: =RC[-27]/RC[-43] -> 0 | AV17: =RC[-26]/RC[-44] -> 0 | AW17: =RC[-42]/RC[-45] -> 0 | AX17: =SUM(RC[-43]:RC[-37])/RC[-46] -> 0 | AY17: =RC[-39]/RC[-47] -> 0
A18: Finland | B18: EU | C18: C16 | D18: =RC[19]/1000 -> 224 | E18: 38 | F18: 398 | G18: 14902315 | H18: 143624 | I18: 233525 | J18: 229973 | K18: 1263072 | L18: 285095 | N18: 577131 | O18: 10654 | P18: 45 | U18: 10397428 | V18: 12820317 | W18: 224000 | X18: 1165 | Y18: 142 | Z18: 1307 | AA18: 31900079 | AB18: 18078830 | AC18: 0 | AD18: 0 | AE18: 0 | AF18: 1113881 | AG18: 8121853 | AH18: 59214643 | AI18: 47882857 | AJ18: 5773971 | AK18: 4276603 | AL18: 57933431 | AR18: =RC[-30]+RC[-29] -> 587785 | AS18: =RC[-24]/RC[-23] -> 0.81101177139379632 | AT18: =RC[-12]/RC[-23] -> 264.35108482142857 | AU18: =RC[-27]/RC[-43] -> 0 | AV18: =RC[-26]/RC[-44] -> 57233.558035714283 | AW18: =RC[-42]/RC[-45] -> 66528.19196428571 | AX18: =SUM(RC[-43]:RC[-37])/RC[-46] -> 76150.017857142855 | AY18: =RC[-39]/RC[-47] -> 1272.7455357142858
A19: France | B19: EU | C19: C17 | D19: =RC[19]/1000 -> 2278 | E19: 96 | F19: 396 | G19: 25684360 | H19: 152995 | I19: 233525 | K19: 1384057 | L19: 97296 | M19: 44108 | N19: 1008519 | P19: 35 | W19: 2278000 | X19: 1812 | Y19: 2552 | Z19: 4364 | AA19: 146286290 | AB19: 52912745 | AC19: 5180449 | AD19: 0 | AE19: 0 | AF19: 0 | AG19: 59602689 | AH19: 263982173 | AI19: 251637535 | AJ19: 7494925 | AK19: 7201543 | AL19: 266334004 | AR19: =RC[-30]+RC[-29] -> 1008519 | AS19: =RC[-24]/RC[-23] -> #DIV/0! | AT19: =RC[-12]/RC[-23] -> 115.88330684811238 | AU19: =RC[-27]/RC[-43] -> 0 | AV19: =RC[-26]/RC[-44] -> 0 | AW19: =RC[-42]/RC[-45] -> 11274.960491659351 | AX19: =SUM(RC[-43]:RC[-37])/RC[-46] -> 12114.284899034241 | AY19: =RC[-39]/RC[-47] -> 42.711150131694467
A20: Greece | B20: EU | C20: C18 | D20: =RC[19]/1000 -> 347 | E20: 82 | F20: 174 | G20: 5683287 | I20: 36200 | J20: 29790 | K20: 25338 | L20: 22796 | M20: 10534 | N20: 296750 | O20: 1439 | P20: 36 | Q20: 49 | T20: 402192 | U20: 1415696 | W20: 347000 | X20: 728 | Y20: 395 | Z20: 1123 | AA20: 3659885 | AB20: 13151753 | AC20: 628888 | AD20: 114432 | AE20: 0 | AF20: 856134 | AG20: 3560052 | AH20: 21971144 | AI20: 12328160 | AJ20: 9476766 | AK20: 166218 | AL20: 21971144 | AR20: =RC[-30]+RC[-29] -> 298189 | AS20: =RC[-24]/RC[-23] -> #DIV/0! | AT20: =RC[-12]/RC[-23] -> 63.317417867435161 | AU20: =RC[-27]/RC[-43] -> 1159.0547550432277 | AV20: =RC[-26]/RC[-44] -> 0 | AW20: =RC[-42]/RC[-45] -> 16378.34870317003 | AX20: =SUM(RC[-43]:RC[-37])/RC[-46] -> 16737.593659942362 | AY20: =RC[-39]/RC[-47] -> 65.694524495677229
A21: Iceland | B21: EFTA | C21: C19 | D21: =RC[19]/1000 -> 8 | W21: 8000 | AR21: =RC[-30]+RC[-29] -> 0 | AS21: =RC[-24]/RC[-23] -> #DIV/0! | AT21: =RC[-12]/RC[-23] -> 0 | AU21: =RC[-27]/RC[-43] -> 0 | AV21: =RC[-26]/RC[-44] -> 0 | AW21: =RC[-42]/RC[-45] -> 0 | AX21: =SUM(RC[-43]:RC[-37])/RC[-46] -> 0 | AY21: =RC[-39]/RC[-47] -> 0
A22: Italy | B22: EU | C22: C20 | D22: =RC[19]/1000 -> 1852 | W22: 1852000 | AR22: =RC[-30]+RC[-29] -> 0 | AS22: =RC[-24]/RC[-23] -> #DIV/0! | AT22: =RC[-12]/RC[-23] -> 0 | AU22: =RC[-27]/RC[-43] -> 0 | AV22: =RC[-26]/RC[-44] -> 0 | AW22: =RC[-42]/RC[-45] -> 0 | AX22: =SUM(RC[-43]:RC[-37])/RC[-46] -> 0 | AY22: =RC[-39]/RC[-47] -> 0
A23: Liechtenstein | B23: EFTA | C23: C21 | D23: =RC[19]/1000 -> 1 | W23: 1000 | AR23: =RC[-30]+RC[-29] -> 0 | AS23: =RC[-24]/RC[-23] -> #DIV/0! | AT23: =RC[-12]/RC[-23] -> 0 | AU23: =RC[-27]/RC[-43] -> 0 | AV23: =RC[-26]/RC[-44] -> 0 | AW23: =RC[-42]/RC[-45] -> 0 | AX23: =SUM(RC[-43]:RC[-37])/RC[-46] -> 0 | AY23: =RC[-39]/RC[-47] -> 0
A24: Luxembourg | B24: EU | C24: C22 | D24: =RC[19]/1000 -> 2.9990000000000001 | E24: 7 | F24: 5 | G24: 321020 | H24: 1650 | I24: 844 | J24: 10 | K24: 5 | L24: 1631 | M24: 86 | N24: 3800 | O24: 120 | P24: 78 | Q24: 49 | R24: 28 | S24: 23 | T24: 13837 | W24: 2999 | X24: 5 | Y24: 5 | Z24: 9 | AA24: 257427 | AB24: 205448 | AC24: 13389 | AD24: 164 | AE24: 1546 | AF24: 487 | AG24: 69331 | AH24: 547792 | AI24: 240933 | AJ24: 0 | AK24: 29629 | AL24: 270562 | AR24: =RC[-30]+RC[-29] -> 3920 | AS24: =RC[-24]/RC[-23] -> #DIV/0! | AT24: =RC[-12]/RC[-23] -> 182.65821940646882 | AU24: =RC[-27]/RC[-43] -> 4613.8712904301428 | AV24: =RC[-26]/RC[-44] -> 0 | AW24: =RC[-42]/RC[-45] -> 107042.34744914972 | AX24: =SUM(RC[-43]:RC[-37])/RC[-46] -> 108451.48382794265 | AY24: =RC[-39]/RC[-47] -> 543.84794931643876
A25: Netherlands | B25: EU | C25: C23 | D25: =RC[19]/1000 -> 540 | E25: 23 | F25: 139 | G25: 24825096 | H25: 148011 | I25: 151734 | K25: 5704333 | U25: 4082889 | W25: 540000 | X25: 868 | Y25: 1002 | Z25: 1870 | AR25: =RC[-30]+RC[-29] -> 0 | AS25: =RC[-24]/RC[-23] -> #DIV/0! | AT25: =RC[-12]/RC[-23] -> 0 | AU25: =RC[-27]/RC[-43] -> 0 | AV25: =RC[-26]/RC[-44] -> 0 | AW25: =RC[-42]/RC[-45] -> 45972.4 | AX25: =SUM(RC[-43]:RC[-37])/RC[-46] -> 57091.062962962962 | AY25: =RC[-39]/RC[-47] -> 0
A26: Norway | B26: EFTA | C26: C24 | D26: =RC[19]/1000 -> 194 | E26: 79 | F26: 217 | G26: 12147560 | H26: 76728 | J26: 46115 | K26: 481751 | L26: 103062 | N26: 323651 | O26: 5250 | P26: 22 | R26: 923 | S26: 412 | U26: 2683402 | V26: 4573762 | W26: 194000 | X26: 608 | Y26: 330 | Z26: 933 | AA26: 29983798 | AB26: 16678103 | AC26: 0 | AD26: 0 | AE26: 0 | AF26: 0 | AG26: 6624018 | AH26: 53285919 | AI26: 51297594 | AJ26: 1988325 | AK26: 0 | AL26: 53285919 | AR26: =RC[-30]+RC[-29] -> 328901 | AS26: =RC[-24]/RC[-23] -> 0.58669471651563854 | AT26: =RC[-12]/RC[-23] -> 274.66968556701033 | AU26: =RC[-27]/RC[-43] -> 0 | AV26: =RC[-26]/RC[-44] -> 23576.092783505155 | AW26: =RC[-42]/RC[-45] -> 62616.288659793812 | AX26: =SUM(RC[-43]:RC[-37])/RC[-46] -> 66264 | AY26: =RC[-39]/RC[-47] -> 531.24742268041234
A27: Portugal | B27: EU | C27: C25 | D27: =RC[19]/1000 -> 325 | E27: 232 | F27: 232 | G27: 8526990 | J27: 14029 | K27: 47174 | L27: 150733 | N27: 336724 | O27: 9457 | R27: 469 | S27: 148 | T27: 1025402 | U27: 1584359 | W27: 325000 | X27: 760 | Y27: 442 | Z27: 1160 | AA27: 6057533 | AB27: 9189567 | AC27: 0 | AD27: 0 | AE27: 0 | AF27: 0 | AG27: 1305686 | AH27: 16552785 | AI27: 15668525 | AJ27: 465864 | AK27: 945238 | AL27: 17079627 | AM27: 10888 | AN27: 0 | AO27: 0 | AP27: 410531 | AQ27: 421418 | AR27: =RC[-30]+RC[-29] -> 346181 | AS27: =RC[-24]/RC[-23] -> #DIV/0! | AT27: =RC[-12]/RC[-23] -> 50.931646153846152 | AU27: =RC[-27]/RC[-43] -> 3155.083076923077 | AV27: =RC[-26]/RC[-44] -> 0 | AW27: =RC[-42]/RC[-45] -> 26236.892307692309 | AX27: =SUM(RC[-43]:RC[-37])/RC[-46] -> 26889.003076923076 | AY27: =RC[-39]/RC[-47] -> 463.79384615384618
A28: Spain | B28: EU | C28: C26 | D28: =RC[19]/1000 -> 1680 | E28: 625 | F28: 1063 | G28: 27023341 | H28: 317690 | J28: 43420 | K28: 1462593 | L28: 826371 | M28: 66432 | N28: 1299635 | O28: 61818 | T28: 2977391 | U28: 14034491 | V28: 47166561 | W28: 1680000 | X28: 4487 | Y28: 1528 | Z28: 6015 | AA28: 98823361 | AB28: 62079372 | AC28: 0 | AD28: 0 | AE28: 0 | AF28: 0 | AG28: 9772710 | AH28: 170675442 | AI28: 149643265 | AJ28: 7196828 | AK28: 13835349 | AL28: 170675442 | AR28: =RC[-30]+RC[-29] -> 1361453 | AS28: =RC[-24]/RC[-23] -> 0.29755171253634538 | AT28: =RC[-12]/RC[-23] -> 101.59252499999999 | AU28: =RC[-27]/RC[-43] -> 1772.2565476190475 | AV28: =RC[-26]/RC[-44] -> 28075.333928571428 | AW28: =RC[-42]/RC[-45] -> 16085.322023809524 | AX28: =SUM(RC[-43]:RC[-37])/RC[-46] -> 17702.289880952379 | AY28: =RC[-39]/RC[-47] -> 491.88749999999999
A29: Sweden | B29: EU | C29: C27 | D29: =RC[19]/1000 -> 292 | E29: 37 | F29: 155 | G29: 23323000 | H29: 254183 | J29: 69985 | K29: 2710924 | L29: 45375 | M29: 6453 | N29: 342000 | O29: 726 | R29: 1743 | T29: 497999 | U29: 5313555 | W29: 292000 | X29: 1070 | Y29: 596 | Z29: 1666 | AA29: 57521486 | AB29: 26937356 | AC29: 0 | AD29: 0 | AE29: 0 | AF29: 0 | AG29: 17835073 | AH29: 102293915 | AI29: 89545934 | AJ29: 2151125 | AK29: 10596856 | AL29: 102293915 | AR29: =RC[-30]+RC[-29] -> 342726 | AS29: =RC[-24]/RC[-23] -> #DIV/0! | AT29: =RC[-12]/RC[-23] -> 350.32162671232879 | AU29: =RC[-27]/RC[-43] -> 1705.4760273972602 | AV29: =RC[-26]/RC[-44] -> 0 | AW29: =RC[-42]/RC[-45] -> 79873.287671232873 | AX29: =SUM(RC[-43]:RC[-37])/RC[-46] -> 90444.931506849316 | AY29: =RC[-39]/RC[-47] -> 155.39383561643837
A30: Switzerland | B30: EFTA | C30: C28 | D30: =RC[19]/1000 -> 162 | W30: 162000 | AR30: =RC[-30]+RC[-29] -> 0 | AS30: =RC[-24]/RC[-23] -> #DIV/0! | AT30: =RC[-12]/RC[-23] -> 0 | AU30: =RC[-27]/RC[-43] -> 0 | AV30: =RC[-26]/RC[-44] -> 0 | AW30: =RC[-42]/RC[-45] -> 0 | AX30: =SUM(RC[-43]:RC[-37])/RC[-46] -> 0 | AY30: =RC[-39]/RC[-47] -> 0
A31: UK | B31: EU | C31: C29 | D31: =RC[19]/1000 -> 1910 | E31: 169 | F31: 750 | G31: 102172000 | H31: 596000 | J31: 123000 | K31: 10533000 | L31: 3077000 | N31: 2874000 | O31: 163000 | R31: 32010 | S31: 32010 | T31: 2481000 | U31: 77900000 | V31: 120600000 | W31: 1910000 | X31: 3619 | Y31: 5791 | Z31: 9410 | AA31: 299092399 | AB31: 180900149 | AC31: 19517056 | AD31: 295701 | AE31: 2784858 | AF31: 0 | AG31: 89105813 | AH31: 591695976 | AI31: 409132638 | AJ31: 25834575 | AK31: 103053651 | AL31: 538020864 | AR31: =RC[-30]+RC[-29] -> 3037000 | AS31: =RC[-24]/RC[-23] -> 0.64593698175787728 | AT31: =RC[-12]/RC[-23] -> 309.78846910994764 | AU31: =RC[-27]/RC[-43] -> 1298.9528795811518 | AV31: =RC[-26]/RC[-44] -> 63141.3612565445 | AW31: =RC[-42]/RC[-45] -> 53493.193717277485 | AX31: =SUM(RC[-43]:RC[-37])/RC[-46] -> 60995.287958115186 | AY31: =RC[-39]/RC[-47] -> 1610.9947643979058
A32: Germany | B32: EU | C32: C31 | D32: =RC[19]/1000 -> 2415 | E32: 242 | F32: 952 | G32: 145781090 | I32: 456321 | J32: 163272 | K32: 43292567 | L32: 1591678 | N32: 3487821 | O32: 73511 | T32: 2036028 | U32: 55396873 | W32: 2415000 | X32: 5501 | Y32: 3483 | Z32: 8984 | AA32: 254168203 | AB32: 181944259 | AC32: 7445788 | AD32: 0 | AE32: 5841944 | AF32: 0 | AG32: 19384343 | AH32: 468784537 | AI32: 433939804 | AJ32: 10769607 | AK32: 24075126 | AL32: 468784537 | AM32: 4203335 | AN32: 0 | AO32: 0 | AP32: 13469577 | AQ32: 17672912 | AR32: =RC[-30]+RC[-29] -> 3561332 | AS32: =RC[-24]/RC[-23] -> #DIV/0! | AT32: =RC[-12]/RC[-23] -> 194.11367991718427 | AU32: =RC[-27]/RC[-43] -> 843.07577639751548 | AV32: =RC[-26]/RC[-44] -> 0 | AW32: =RC[-42]/RC[-45] -> 60364.840579710144 | AX32: =SUM(RC[-43]:RC[-37])/RC[-46] -> 79207.009523809524 | AY32: =RC[-39]/RC[-47] -> 659.07991718426501
A33: USA | B33: World - A | C33: C50 | D33: =RC[19]/1000 -> 16072.976000000001 | E33: 3533 | G33: 909998739 | I33: 7810572 | K33: 1099654748 | L33: 93295688 | M33: 3596095 | N33: 25419128 | O33: 3215104 | S33: 13099 | U33: 218384439 | V33: 16367837 | W33: 16072976 | X33: 31104 | Y33: 69026 | Z33: 100130 | AA33: 2170451277 | AB33: 1541680515 | AC33: 0 | AD33: 0 | AE33: 0 | AF33: 0 | AG33: 594912415 | AH33: 4307044208 | AI33: 3983549604 | AJ33: 171020826 | AK33: 307697064 | AL33: 4462267509 | AR33: =RC[-30]+RC[-29] -> 28634232 | AS33: =RC[-24]/RC[-23] -> 13.342290676526165 | AT33: =RC[-12]/RC[-23] -> 267.96806067526012 | AU33: =RC[-27]/RC[-43] -> 0 | AV33: =RC[-26]/RC[-44] -> 1018.3451403150232 | AW33: =RC[-42]/RC[-45] -> 56616.692453220858 | AX33: =SUM(RC[-43]:RC[-37])/RC[-46] -> 131547.2531035945 | AY33: =RC[-39]/RC[-47] -> 5804.5061474614286
A34: Turkey | B34: World - B | C34: C42 | D34: =RC[19]/1000 -> 1019.7809999999999 | W34: 1019781 | AR34: =RC[-30]+RC[-29] -> 0 | AS34: =RC[-24]/RC[-23] -> #DIV/0! | AT34: =RC[-12]/RC[-23] -> 0 | AU34: =RC[-27]/RC[-43] -> 0 | AV34: =RC[-26]/RC[-44] -> 0 | AW34: =RC[-42]/RC[-45] -> 0 | AX34: =SUM(RC[-43]:RC[-37])/RC[-46] -> 0 | AY34: =RC[-39]/RC[-47] -> 0
A35: Australia | B35: World - A | C35: C70 | D35: =RC[19]/1000 -> 1063.7750000000001 | W35: 1063775 | AR35: =RC[-30]+RC[-29] -> 0 | AS35: =RC[-24]/RC[-23] -> #DIV/0! | AT35: =RC[-12]/RC[-23] -> 0 | AU35: =RC[-27]/RC[-43] -> 0 | AV35: =RC[-26]/RC[-44] -> 0 | AW35: =RC[-42]/RC[-45] -> 0 | AX35: =SUM(RC[-43]:RC[-37])/RC[-46] -> 0 | AY35: =RC[-39]/RC[-47] -> 0
A36: Japan | B36: World - A | C36: C41 | D36: =RC[19]/1000 -> 3782.3130000000001 | E36: 1064 | F36: 1640 | G36: 266939000 | N36: 8108000 | U36: 28629000 | W36: 3782313 | X36: 7528 | Y36: 7219 | Z36: 14747 | AA36: 256865797 | AB36: 710178277 | AC36: 2725413 | AD36: 101174 | AE36: 952840 | AF36: 1965975 | AG36: 33737110 | AH36: 1006526585 | AI36: 930928123 | AJ36: 39966390 | AK36: 71906686 | AL36: 1042801202 | AR36: =RC[-30]+RC[-29] -> 8108000 | AS36: =RC[-24]/RC[-23] -> #DIV/0! | AT36: =RC[-12]/RC[-23] -> 266.11403789162875 | AU36: =RC[-27]/RC[-43] -> 0 | AV36: =RC[-26]/RC[-44] -> 0 | AW36: =RC[-42]/RC[-45] -> 70575.5975245835 | AX36: =SUM(RC[-43]:RC[-37])/RC[-46] -> 70575.5975245835 | AY36: =RC[-39]/RC[-47] -> 0
A37: Korea | B37: World - A | C37: C40 | D37: =RC[19]/1000 -> 2413.145 | W37: 2413145 | AR37: =RC[-30]+RC[-29] -> 0 | AS37: =RC[-24]/RC[-23] -> #DIV/0! | AT37: =RC[-12]/RC[-23] -> 0 | AU37: =RC[-27]/RC[-43] -> 0 | AV37: =RC[-26]/RC[-44] -> 0 | AW37: =RC[-42]/RC[-45] -> 0 | AX37: =SUM(RC[-43]:RC[-37])/RC[-46] -> 0 | AY37: =RC[-39]/RC[-47] -> 0
A38: Canada | B38: World - A | C38: C51 | D38: =RC[19]/1000 -> 2030.395 | E38: 2739 | F38: 910 | G38: 75032608 | I38: 150814 | V38: 241138449 | W38: 2030395 | X38: 3130 | Y38: 6616 | Z38: 13349 | AA38: 337981271 | AB38: 73056101 | AC38: 0 | AD38: 0 | AE38: 0 | AF38: 0 | AG38: 109699443 | AH38: 520736815 | AI38: 480924143 | AJ38: 11884831 | AK38: 27927841 | AL38: 520736815 | AM38: 23785033 | AN38: 35720 | AO38: 1786304 | AP38: 284300 | AQ38: 25891357 | AR38: =RC[-30]+RC[-29] -> 0 | AS38: =RC[-24]/RC[-23] -> 0 | AT38: =RC[-12]/RC[-23] -> 256.47069412601979 | AU38: =RC[-27]/RC[-43] -> 0 | AV38: =RC[-26]/RC[-44] -> 118764.3039901103 | AW38: =RC[-42]/RC[-45] -> 36954.685172097059 | AX38: =SUM(RC[-43]:RC[-37])/RC[-46] -> 37028.963329795435 | AY38: =RC[-39]/RC[-47] -> 0
A39: New Zealand | B39: World - A | C39: C71 | D39: =RC[19]/1000 -> 169.55699999999999 | W39: 169557 | AR39: =RC[-30]+RC[-29] -> 0 | AS39: =RC[-24]/RC[-23] -> #DIV/0! | AT39: =RC[-12]/RC[-23] -> 0 | AU39: =RC[-27]/RC[-43] -> 0 | AV39: =RC[-26]/RC[-44] -> 0 | AW39: =RC[-42]/RC[-45] -> 0 | AX39: =SUM(RC[-43]:RC[-37])/RC[-46] -> 0 | AY39: =RC[-39]/RC[-47] -> 0
A40: Mexico | B40: World - B | C40: C72 | D40: =RC[19]/1000 -> 1482.3710000000001 | W40: 1482371 | AR40: =RC[-30]+RC[-29] -> 0 | AS40: =RC[-24]/RC[-23] -> #DIV/0! | AT40: =RC[-12]/RC[-23] -> 0 | AU40: =RC[-27]/RC[-43] -> 0 | AV40: =RC[-26]/RC[-44] -> 0 | AW40: =RC[-42]/RC[-45] -> 0 | AX40: =SUM(RC[-43]:RC[-37])/RC[-46] -> 0 | AY40: =RC[-39]/RC[-47] -> 0
A41: CEE - Total | B41: Totals | D41: =RC[19]/1000 -> 2302 | E41: 889 | F41: 3558 | G41: 128550475 | H41: 1150028 | I41: 1169472 | J41: 1840904 | K41: 7028976 | L41: 800525 | M41: 67953 | N41: 4178770 | O41: 57326 | P41: 7 | Q41: 24 | R41: 5653 | S41: 2368 | T41: 2445998 | U41: 53981585 | V41: 35697764 | W41: 2302000 | X41: 11309 | Y41: 4123 | Z41: 15432 | AA41: 24454752 | AB41: 40482501 | AC41: 631802 | AD41: 1485296 | AE41: 2252617 | AF41: 4556003 | AG41: 11976923 | AH41: 85839890 | AI41: 75281051 | AJ41: 2283116 | AK41: 6992567 | AL41: 84556741 | AM41: 18161879 | AN41: 0 | AO41: 132102 | AP41: 3321626 | AQ41: 21615607 | AR41: =RC[-30]+RC[-29] -> 4236096 | AS41: =RC[-24]/RC[-23] -> 1.5121839283827412 | AT41: =RC[-12]/RC[-23] -> 37.289265855777586 | AU41: =RC[-27]/RC[-43] -> 1062.5534317984361 | AV41: =RC[-26]/RC[-44] -> 15507.282363162467 | AW41: =RC[-42]/RC[-45] -> 55842.95178105995 | AX41: =SUM(RC[-43]:RC[-37])/RC[-46] -> 61080.943961772369 | AY41: =RC[-39]/RC[-47] -> 347.751954821894
A42: EU - Total | B42: Totals | D42: =RC[19]/1000 -> 12614.999 | E42: 3236 | F42: 6442 | G42: 466859698 | H42: 2597026 | I42: 3592687 | J42: 1721767 | K42: 71541221 | L42: 10216118 | M42: 374900 | N42: 14993494 | O42: 645386 | P42: 565 | Q42: 800 | R42: 147466 | S42: 75105 | T42: 13212864 | U42: 201253002 | V42: 394561498 | W42: 12614999 | X42: 23102 | Y42: 19567 | Z42: 42626 | AA42: 1198984746 | AB42: 729016025 | AC42: 45642981 | AD42: 1296512 | AE42: 11079473 | AF42: 2309895 | AG42: 290625447 | AH42: 2278955075 | AI42: 1945458232 | AJ42: 89793634 | AK42: 204968777 | AL42: 2240220645 | AM42: 63829927 | AN42: 618027 | AO42: 2330594 | AP42: 20953504 | AQ42: 87732051 | AR42: =RC[-30]+RC[-29] -> 15638880 | AS42: =RC[-24]/RC[-23] -> 0.51006751297360498 | AT42: =RC[-12]/RC[-23] -> 180.65439997260404 | AU42: =RC[-27]/RC[-43] -> 1047.393186475877 | AV42: =RC[-26]/RC[-44] -> 31277.172356494044 | AW42: =RC[-42]/RC[-45] -> 37008.30241841478 | AX42: =SUM(RC[-43]:RC[-37])/RC[-46] -> 44146.132472939556 | AY42: =RC[-39]/RC[-47] -> 809.83898611486222
A43: EFTA - Total | B43: Totals | D43: =RC[19]/1000 -> 365 | E43: 237 | F43: 575 | G43: 30406655 | H43: 209379 | I43: 274629 | J43: 105592 | K43: 1305273 | L43: 306782 | M43: 23253 | N43: 877931 | O43: 17205 | P43: 22 | Q43: 29 | R43: 2886 | S43: 1146 | T43: 328798 | U43: 7947289 | V43: 10730809 | W43: 365000 | X43: 1553 | Y43: 865 | Z43: 2413 | AA43: 56412816 | AB43: 31378906 | AC43: 0 | AD43: 0 | AE43: 0 | AF43: 0 | AG43: 12462713 | AH43: 100254435 | AI43: 96513515 | AJ43: 3740921 | AK43: 0 | AL43: 100254435 | AM43: 3258172 | AN43: 33771 | AO43: 127351 | AP43: 408943 | AQ43: 3828237 | AR43: =RC[-30]+RC[-29] -> 895136 | AS43: =RC[-24]/RC[-23] -> 0.74060483231040641 | AT43: =RC[-12]/RC[-23] -> 274.66968493150682 | AU43: =RC[-27]/RC[-43] -> 900.81643835616444 | AV43: =RC[-26]/RC[-44] -> 29399.476712328767 | AW43: =RC[-42]/RC[-45] -> 83305.904109589042 | AX43: =SUM(RC[-43]:RC[-37])/RC[-46] -> 89401.542465753431 | AY43: =RC[-39]/RC[-47] -> 840.49863013698632
A44: World A - Total | B44: Totals | D44: =RC[19]/1000 -> 25532.161 | E44: 8232 | F44: 14664 | G44: 1467437321 | H44: 9525832 | I44: 12085893 | J44: 8931152 | K44: 1419450734 | L44: 121345564 | M44: 4661148 | N44: 43188675 | O44: 4240600 | P44: 36 | Q44: 54 | R44: 150448 | S44: 35505 | T44: 13991240 | U44: 305549846 | V44: 355659287 | W44: 25532161 | X44: 48256 | Y44: 90223 | Z44: 142082 | AA44: 3095726536 | AB44: 2896312322 | AC44: 4464248 | AD44: 165724 | AE44: 1560759 | AF44: 3220282 | AG44: 805523081 | AH44: 6806972952 | AI44: 6295012011 | AJ44: 261493900 | AK44: 477019216 | AL44: 7033525149 | AM44: 235444298 | AN44: 2229566 | AO44: 10059325 | AP44: 26850335 | AQ44: 274583524 | AR44: =RC[-30]+RC[-29] -> 47429275 | AS44: =RC[-24]/RC[-23] -> 0.85910830159202334 | AT44: =RC[-12]/RC[-23] -> 266.60387078085557 | AU44: =RC[-27]/RC[-43] -> 547.98495121505778 | AV44: =RC[-26]/RC[-44] -> 13929.854468644467 | AW44: =RC[-42]/RC[-45] -> 57474.074403651146 | AX44: =SUM(RC[-43]:RC[-37])/RC[-46] -> 119200.15873313662 | AY44: =RC[-39]/RC[-47] -> 4752.6554450287231
A45: World B - Total | B45: Totals | D45: =RC[19]/1000 -> 2502.152 | E45: 397 | F45: 501 | G45: 39556590 | H45: 250460 | I45: 338180 | J45: 234826 | K45: 27962358 | L45: 2470429 | M45: 94457 | N45: 1199917 | O45: 94180 | P45: 22 | Q45: 29 | R45: 49038 | S45: 17499 | T45: 4560375 | U45: 92669567 | V45: 83728235 | W45: 2502152 | X45: 1514 | Y45: 2267 | Z45: 3781 | AA45: 4556539 | AB45: 7709846 | AC45: 57884 | AD45: 308531 | AE45: 423425 | AF45: 856393 | AG45: 2251538 | AH45: 16164154 | AI45: 14039863 | AJ45: 426461 | AK45: 1307024 | AL45: 15773350 | AM45: 3514963 | AN45: 0 | AO45: 0 | AP45: 650510 | AQ45: 4165473 | AR45: =RC[-30]+RC[-29] -> 1294097 | AS45: =RC[-24]/RC[-23] -> 1.106789925763991 | AT45: =RC[-12]/RC[-23] -> 6.4601007452784645 | AU45: =RC[-27]/RC[-43] -> 1822.581122170036 | AV45: =RC[-26]/RC[-44] -> 33462.489489047824 | AW45: =RC[-42]/RC[-45] -> 15809.027589051344 | AX45: =SUM(RC[-43]:RC[-37])/RC[-46] -> 28338.526196649924 | AY45: =RC[-39]/RC[-47] -> 987.32171346904579
A46: EU Accession Countries - Totals | B46: Totals | D46: =RC[19]/1000 -> 1617.2339999999999 | E46: 618 | F46: 2766 | G46: 90478910 | H46: 865888 | I46: 882769 | J46: 1409326 | K46: 6168199 | L46: 479031 | M46: 53414 | N46: 3020548 | O46: 43455 | P46: 7 | Q46: 24 | R46: 4263 | S46: 1846 | T46: 1767295 | U46: 36797270 | V46: 25217334 | W46: 1617234 | X46: 8239 | Y46: 2786 | Z46: 11025 | AA46: 20847446 | AB46: 32836386 | AC46: 584503 | AD46: 1175046 | AE46: 1824013 | AF46: 3704509 | AG46: 9793559 | AH46: 70765460 | AI46: 62499873 | AJ46: 1944817 | AK46: 5413697 | AL46: 69858393 | AM46: 14163304 | AN46: 1179 | AO46: 136548 | AP46: 2582176 | AQ46: 16883207 | AR46: =RC[-30]+RC[-29] -> 3064003 | AS46: =RC[-24]/RC[-23] -> 1.4592054021253793 | AT46: =RC[-12]/RC[-23] -> 43.757093902304803 | AU46: =RC[-27]/RC[-43] -> 1092.7886749845725 | AV46: =RC[-26]/RC[-44] -> 15592.878952582001 | AW46: =RC[-42]/RC[-45] -> 55946.70282717282 | AX46: =SUM(RC[-43]:RC[-37])/RC[-46] -> 62042.68337173223 | AY46: =RC[-39]/RC[-47] -> 296.20388886209417

Sheet: 1998
A1: Name | B1: Type | C1: Code | D1: Population '000s | E1: Libraries - Total Administrative Units | F1: Libraries - Service Points | G1: Collections - Books & Bound Periodicals | H1: Collections - Current Periodicals - Titles | I1: Collections - Current Periodicals - Subscriptions | J1: Collections - Manuscripts | K1: Collections - Microforms | L1: Collections - Audio-visual Materials | M1: Collections - CD-ROMs | N1: Additions - Books & Bound Periodicals | O1: Additions - Audio-visual Materials | P1: Facilities & Services - Percentage Stock on Open Access | Q1: Facilities & Services - Percentage Catalogue Records Automated | R1: Facilities & Services - Number of Workstations for users | S1: Facilities & Services - Number connected to the internet | T1: Use & Users - Registered Users | U1: Use & Users - Consultations | V1: Use & Users - Number of Visits | W1: Use & Users - Potential Total Population Served | X1: Library Staff FTE - Trained Librarians | Y1: Library Staff FTE - Other Library Staff | Z1: Library Staff FTE - Total Staff | AA1: Recurrent Expenditure (Euros) - Staff | AB1: Recurrent Expenditure (Euros) - Acquisition of Stock | AC1: Recurrent Expenditure (Euros) - Electronic Information | AD1: Recurrent Expenditure (Euros) - Automation | AE1: Recurrent Expenditure (Euros) - Premises and Related Costs | AF1: Recurrent Expenditure (Euros) - New Buildings / Refurbishment | AG1: Recurrent Expenditure (Euros) - Other Expenditure | AH1: Recurrent Expenditure (Euros) - TOTAL EXPENDITURE | AI1: Income - Public Funding | AJ1: Income - Fees & Charges | AK1: Income - Other Income | AL1: Income - TOTAL INCOME | AM1: Capital Expenditure - New Buildings / Refurbishment | AN1: Capital Expenditure - Acquisition of Stock | AO1: Capital Expenditure - Automation | AP1: Capital Expenditure - Other Capital Expenditure | AQ1: Capital Expenditure - TOTAL CAPITAL PAYMENTS | AR1: Additions | AS1: Loans per visit | AT1: Cost per pop | AU1: Users per 1000 pop | AV1: visits per 1000 pop | AW1: Bookstock per 1000 pop | AX1: Total stock per 1000 pop | AY1: AV materials per 1000 pop
A2: Bulgaria | B2: CEE | C2: C1 | D2: =RC[19]/1000 -> 289 | E2: 93 | F2: 93 | G2: 8374850 | H2: 8836 | K2: 22548 | L2: 79414 | N2: 94287 | O2: 27935 | T2: 204905 | U2: 5015109 | V2: 2855611 | W2: 289000 | X2: 489 | Y2: 406 | Z2: 895 | AA2: 611331 | AB2: 763465 | AC2: 0 | AD2: 0 | AE2: 0 | AF2: 0 | AG2: 77417 | AH2: 1452213 | AI2: 1088345 | AJ2: 88903 | AK2: 300128 | AL2: 1477376 | AR2: =RC[-30]+RC[-29] -> 122222 | AS2: =RC[-24]/RC[-23] -> 1.7562297525818467 | AT2: =RC[-12]/RC[-23] -> 5.0249584775086502 | AU2: =RC[-27]/RC[-43] -> 709.01384083044979 | AV2: =RC[-26]/RC[-44] -> 9881.0069204152242 | AW2: =RC[-42]/RC[-45] -> 28978.719723183392 | AX2: =SUM(RC[-43]:RC[-37])/RC[-46] -> 29362.103806228373 | AY2: =RC[-39]/RC[-47] -> 274.78892733564015
A3: Czech Republic | B3: CEE | C3: C2 | D3: =RC[19]/1000 -> 192 | E3: 64 | F3: 781 | G3: 10890110 | H3: 21937 | J3: 44165 | K3: 13753 | L3: 31404 | N3: 246113 | O3: 2104 | T3: 224724 | U3: 2034158 | V3: 3502540 | W3: 192000 | X3: 319 | Y3: 289 | Z3: 608 | AB3: 3252830 | AR3: =RC[-30]+RC[-29] -> 248217 | AS3: =RC[-24]/RC[-23] -> 0.58076652943292584 | AT3: =RC[-12]/RC[-23] -> 0 | AU3: =RC[-27]/RC[-43] -> 1170.4375 | AV3: =RC[-26]/RC[-44] -> 18242.395833333332 | AW3: =RC[-42]/RC[-45] -> 56719.322916666664 | AX3: =SUM(RC[-43]:RC[-37])/RC[-46] -> 57298.796875 | AY3: =RC[-39]/RC[-47] -> 163.5625
A4: Estonia | B4: CEE | C4: C3 | D4: =RC[19]/1000 -> 48 | E4: 20 | F4: 38 | G4: 7574555 | H4: 11177 | I4: 21036 | J4: 68195 | K4: 176082 | L4: 30028 | M4: 2478 | N4: 113041 | O4: 1833 | P4: 4 | Q4: 5 | R4: 100 | S4: 80 | T4: 73625 | U4: 2125956 | V4: 1719207 | W4: 48000 | X4: 505 | Y4: 108 | Z4: 613 | AA4: 1841732 | AB4: 1481963 | AC4: 267699 | AD4: 0 | AE4: 305786 | AF4: 0 | AG4: 341095 | AH4: 4238275 | AI4: 4314084 | AJ4: 0 | AK4: 326644 | AL4: 4640728 | AM4: 251828 | AN4: 0 | AO4: 0 | AP4: 143422 | AQ4: 395250 | AR4: =RC[-30]+RC[-29] -> 114874 | AS4: =RC[-24]/RC[-23] -> 1.236591056225341 | AT4: =RC[-12]/RC[-23] -> 88.29739583333334 | AU4: =RC[-27]/RC[-43] -> 1533.8541666666667 | AV4: =RC[-26]/RC[-44] -> 35816.8125 | AW4: =RC[-42]/RC[-45] -> 157803.22916666666 | AX4: =SUM(RC[-43]:RC[-37])/RC[-46] -> 164240.64583333334 | AY4: =RC[-39]/RC[-47] -> 625.58333333333337
A5: Hungary | B5: CEE | C5: C4 | D5: =RC[19]/1000 -> 214 | E5: 34 | F5: 35 | G5: 10015000 | H5: 23000 | J5: 158000 | K5: 472897 | L5: 18293 | M5: 538 | N5: 394632 | O5: 5267 | T5: 175228 | U5: 1788000 | V5: 3785722 | W5: 214000 | X5: 592 | Y5: 368 | Z5: 960 | AA5: 1944988 | AB5: 4428822 | AC5: 26931 | AD5: 101632 | AE5: 144939 | AF5: 398442 | AG5: 413298 | AH5: 7459052 | AI5: 6432979 | AJ5: 245386 | AK5: 170839 | AL5: 6849204 | AR5: =RC[-30]+RC[-29] -> 399899 | AS5: =RC[-24]/RC[-23] -> 0.4723009243679277 | AT5: =RC[-12]/RC[-23] -> 34.85538317757009 | AU5: =RC[-27]/RC[-43] -> 818.82242990654208 | AV5: =RC[-26]/RC[-44] -> 17690.289719626169 | AW5: =RC[-42]/RC[-45] -> 46799.06542056075 | AX5: =SUM(RC[-43]:RC[-37])/RC[-46] -> 49942.654205607476 | AY5: =RC[-39]/RC[-47] -> 85.481308411214954
A6: Latvia | B6: CEE | C6: C5 | D6: =RC[19]/1000 -> 61 | E6: 16 | F6: 16 | G6: 6100000 | J6: 21773 | L6: 1685 | N6: 79000 | T6: 52000 | U6: 3050000 | V6: 1220000 | W6: 61000 | X6: 130 | Y6: 200 | Z6: 330 | AA6: 450596 | AB6: 281430 | AC6: 0 | AD6: 0 | AE6: 0 | AF6: 0 | AG6: 206075 | AH6: 938101 | AI6: 805911 | AJ6: 13441 | AK6: 118749 | AL6: 938101 | AM6: 244630 | AN6: 0 | AO6: 0 | AP6: 139323 | AQ6: 383953 | AR6: =RC[-30]+RC[-29] -> 79000 | AS6: =RC[-24]/RC[-23] -> 2.5 | AT6: =RC[-12]/RC[-23] -> 15.378704918032787 | AU6: =RC[-27]/RC[-43] -> 852.45901639344265 | AV6: =RC[-26]/RC[-44] -> 20000 | AW6: =RC[-42]/RC[-45] -> 100000 | AX6: =SUM(RC[-43]:RC[-37])/RC[-46] -> 100384.55737704918 | AY6: =RC[-39]/RC[-47] -> 27.622950819672131
A7: Lithuania | B7: CEE | C7: C6 | D7: =RC[19]/1000 -> 97 | E7: 15 | F7: 106 | G7: 12042758 | H7: 4454 | I7: 4500 | J7: 241338 | K7: 26694 | L7: 3027 | M7: 1600 | N7: 219660 | O7: 639 | P7: 4 | Q7: 4 | R7: 145 | S7: 145 | T7: 90457 | U7: 6813352 | V7: 3467868 | W7: 97000 | X7: 572 | Y7: 93 | Z7: 665 | AA7: 1196195 | AB7: 441626 | AC7: 0 | AD7: 0 | AE7: 0 | AF7: 0 | AG7: 411637 | AH7: 2049458 | AI7: 1617182 | AJ7: 27586 | AK7: 396188 | AL7: 2040956 | AR7: =RC[-30]+RC[-29] -> 220299 | AS7: =RC[-24]/RC[-23] -> 1.9647091527128484 | AT7: =RC[-12]/RC[-23] -> 21.128432989690722 | AU7: =RC[-27]/RC[-43] -> 932.54639175257728 | AV7: =RC[-26]/RC[-44] -> 35751.216494845357 | AW7: =RC[-42]/RC[-45] -> 124152.14432989691 | AX7: =SUM(RC[-43]:RC[-37])/RC[-46] -> 127055.37113402062 | AY7: =RC[-39]/RC[-47] -> 31.206185567010309
A8: Poland | B8: CEE | C8: C7 | D8: =RC[19]/1000 -> 796 | W8: 796000 | AR8: =RC[-30]+RC[-29] -> 0 | AS8: =RC[-24]/RC[-23] -> #DIV/0! | AT8: =RC[-12]/RC[-23] -> 0 | AU8: =RC[-27]/RC[-43] -> 0 | AV8: =RC[-26]/RC[-44] -> 0 | AW8: =RC[-42]/RC[-45] -> 0 | AX8: =SUM(RC[-43]:RC[-37])/RC[-46] -> 0 | AY8: =RC[-39]/RC[-47] -> 0
A9: Romania | B9: CEE | C9: C8 | D9: =RC[19]/1000 -> 438 | W9: 438000 | AR9: =RC[-30]+RC[-29] -> 0 | AS9: =RC[-24]/RC[-23] -> #DIV/0! | AT9: =RC[-12]/RC[-23] -> 0 | AU9: =RC[-27]/RC[-43] -> 0 | AV9: =RC[-26]/RC[-44] -> 0 | AW9: =RC[-42]/RC[-45] -> 0 | AX9: =SUM(RC[-43]:RC[-37])/RC[-46] -> 0 | AY9: =RC[-39]/RC[-47] -> 0
A10: Slovak Rep | B10: CEE | C10: C9 | D10: =RC[19]/1000 -> 112 | E10: 42 | F10: 569 | G10: 4613211 | H10: 8646 | I10: 10864 | M10: 824 | N10: 94955 | O10: 356 | R10: 191 | S10: 58 | T10: 143811 | U10: 2497920 | V10: 620442 | W10: 112000 | X10: 425 | Y10: 68 | Z10: 493 | AA10: 768209 | AB10: 1008318 | AC10: 66024 | AD10: 127657 | AE10: 49548 | AF10: 976828 | AG10: 96509 | AH10: 3093093 | AI10: 2680016 | AJ10: 26232 | AK10: 296673 | AL10: 3002922 | AM10: 207389 | AN10: 0 | AO10: 128139 | AP10: 0 | AQ10: 335528 | AR10: =RC[-30]+RC[-29] -> 95311 | AS10: =RC[-24]/RC[-23] -> 4.026033053855155 | AT10: =RC[-12]/RC[-23] -> 27.616901785714287 | AU10: =RC[-27]/RC[-43] -> 1284.0267857142858 | AV10: =RC[-26]/RC[-44] -> 5539.6607142857147 | AW10: =RC[-42]/RC[-45] -> 41189.383928571428 | AX10: =SUM(RC[-43]:RC[-37])/RC[-46] -> 41370.9375 | AY10: =RC[-39]/RC[-47] -> 0
A11: Slovenia | B11: CEE | C11: C10 | D11: =RC[19]/1000 -> 55 | E11: 71 | F11: 71 | G11: 3286162 | H11: 14439 | I11: 12075 | N11: 109504 | O11: 13687 | Q11: 44 | R11: 182 | S11: 173 | T11: 119970 | U11: 3565229 | V11: 1851256 | W11: 55000 | X11: 256 | Y11: 116 | Z11: 372 | AA11: 653166 | AB11: 3844481 | AC11: 11062 | AD11: 41748 | AE11: 59537 | AF11: 163668 | AG11: 4922947 | AH11: 9696609 | AI11: 8330237 | AJ11: 138936 | AK11: 1227435 | AL11: 9696609 | AR11: =RC[-30]+RC[-29] -> 123191 | AS11: =RC[-24]/RC[-23] -> 1.9258433193464328 | AT11: =RC[-12]/RC[-23] -> 176.30198181818182 | AU11: =RC[-27]/RC[-43] -> 2181.2727272727275 | AV11: =RC[-26]/RC[-44] -> 33659.199999999997 | AW11: =RC[-42]/RC[-45] -> 59748.4 | AX11: =SUM(RC[-43]:RC[-37])/RC[-46] -> 60230.472727272725 | AY11: =RC[-39]/RC[-47] -> 0
A12: Austria | B12: EU | C12: C11 | D12: =RC[19]/1000 -> 269 | W12: 269000 | AR12: =RC[-30]+RC[-29] -> 0 | AS12: =RC[-24]/RC[-23] -> #DIV/0! | AT12: =RC[-12]/RC[-23] -> 0 | AU12: =RC[-27]/RC[-43] -> 0 | AV12: =RC[-26]/RC[-44] -> 0 | AW12: =RC[-42]/RC[-45] -> 0 | AX12: =SUM(RC[-43]:RC[-37])/RC[-46] -> 0 | AY12: =RC[-39]/RC[-47] -> 0
A13: België Nederlandstalige Universiteiten | B13: België Nederlandstalige Universiteiten | C13: C12a | AR13: 0 | AS13: =RC[-24]/RC[-23] -> #DIV/0! | AT13: =RC[-12]/RC[-23] -> #DIV/0! | AU13: =RC[-27]/RC[-43] -> #DIV/0! | AV13: =RC[-26]/RC[-44] -> #DIV/0! | AW13: =RC[-42]/RC[-45] -> #DIV/0! | AX13: =SUM(RC[-43]:RC[-37])/RC[-46] -> #DIV/0! | AY13: =RC[-39]/RC[-47] -> #DIV/0!
A14: Belgique universités francophones | B14: Belgique universités francophones | C14: C12b | AR14: 0 | AS14: =RC[-24]/RC[-23] -> #DIV/0! | AT14: =RC[-12]/RC[-23] -> #DIV/0! | AU14: =RC[-27]/RC[-43] -> #DIV/0! | AV14: =RC[-26]/RC[-44] -> #DIV/0! | AW14: =RC[-42]/RC[-45] -> #DIV/0! | AX14: =SUM(RC[-43]:RC[-37])/RC[-46] -> #DIV/0! | AY14: =RC[-39]/RC[-47] -> #DIV/0!
A15: Belgium | B15: EU | C15: C12 | D15: =RC[19]/1000 -> 172 | E15: 72 | F15: 62 | G15: 12629071 | H15: 47699 | I15: 24624 | J15: 12410 | K15: 289603 | L15: 10335 | M15: 963 | N15: 411116 | O15: 105 | P15: 42 | Q15: 54 | R15: 640 | T15: 105958 | U15: 743570 | V15: 5743293 | W15: 172000 | X15: 209 | Y15: 365 | Z15: 574 | AA15: 7488757 | AB15: 6125761 | AC15: 297397 | AD15: 549787 | AE15: 794959 | AF15: 0 | AG15: 252880 | AH15: 15509540 | AI15: 6307458 | AJ15: 48169 | AK15: 391161 | AL15: 6746787 | AM15: 12 | AN15: 5441 | AO15: 272091 | AP15: 7 | AQ15: 277551 | AR15: =RC[-30]+RC[-29] -> 411221 | AS15: =RC[-24]/RC[-23] -> 0.1294675371777132 | AT15: =RC[-12]/RC[-23] -> 90.17174418604651 | AU15: =RC[-27]/RC[-43] -> 616.03488372093022 | AV15: =RC[-26]/RC[-44] -> 33391.238372093023 | AW15: =RC[-42]/RC[-45] -> 73424.83139534884 | AX15: =SUM(RC[-43]:RC[-37])/RC[-46] -> 75666.889534883725 | AY15: =RC[-39]/RC[-47] -> 60.087209302325583
A16: Denmark | B16: EU | C16: C13 | D16: =RC[19]/1000 -> 180 | E16: 20 | F16: 42 | G16: 9185601 | I16: 85661 | J16: 78466 | K16: 1158546 | L16: 858562 | M16: 15764 | N16: 241760 | O16: 30374 | R16: 842 | U16: 4493802 | W16: 180000 | X16: 379 | Y16: 438 | Z16: 817 | AA16: 34062299 | AB16: 13831318 | AC16: 614444 | AD16: 26713 | AE16: 251577 | AF16: 0 | AG16: 8907554 | AH16: 57693905 | AI16: 53799968 | AJ16: 1474652 | AK16: 2419285 | AL16: 57693905 | AM16: 2814516 | AN16: 0 | AO16: 0 | AP16: 0 | AQ16: 2814516 | AR16: =RC[-30]+RC[-29] -> 272134 | AS16: =RC[-24]/RC[-23] -> #DIV/0! | AT16: =RC[-12]/RC[-23] -> 320.52169444444445 | AU16: =RC[-27]/RC[-43] -> 0 | AV16: =RC[-26]/RC[-44] -> 0 | AW16: =RC[-42]/RC[-45] -> 51031.116666666669 | AX16: =SUM(RC[-43]:RC[-37])/RC[-46] -> 63236.666666666664 | AY16: =RC[-39]/RC[-47] -> 4769.7888888888892
A17: Eire | B17: EU | C17: C15 | D17: =RC[19]/1000 -> 137 | W17: 137000 | AR17: =RC[-30]+RC[-29] -> 0 | AS17: =RC[-24]/RC[-23] -> #DIV/0! | AT17: =RC[-12]/RC[-23] -> 0 | AU17: =RC[-27]/RC[-43] -> 0 | AV17: =RC[-26]/RC[-44] -> 0 | AW17: =RC[-42]/RC[-45] -> 0 | AX17: =SUM(RC[-43]:RC[-37])/RC[-46] -> 0 | AY17: =RC[-39]/RC[-47] -> 0
A18: Finland | B18: EU | C18: C16 | D18: =RC[19]/1000 -> 224 | E18: 19 | F18: 299 | G18: 13866678 | H18: 142861 | I18: 130709 | J18: 197526 | K18: 1263719 | L18: 235334 | N18: 435603 | O18: 9260 | P18: 45 | U18: 7930527 | V18: 8826708 | W18: 224000 | X18: 976 | Y18: 128 | Z18: 1104 | AA18: 26399655 | AB18: 14258865 | AC18: 0 | AD18: 0 | AE18: 0 | AF18: 475352 | AG18: 8581666 | AH18: 49240185 | AI18: 37422576 | AJ18: 4680443 | AK18: 4087531 | AL18: 46190551 | AR18: =RC[-30]+RC[-29] -> 444863 | AS18: =RC[-24]/RC[-23] -> 0.89846939538500648 | AT18: =RC[-12]/RC[-23] -> 219.82225446428572 | AU18: =RC[-27]/RC[-43] -> 0 | AV18: =RC[-26]/RC[-44] -> 39404.946428571428 | AW18: =RC[-42]/RC[-45] -> 61904.8125 | AX18: =SUM(RC[-43]:RC[-37])/RC[-46] -> 70700.12053571429 | AY18: =RC[-39]/RC[-47] -> 1050.5982142857142
A19: France | B19: EU | C19: C17 | D19: =RC[19]/1000 -> 2278 | E19: 95 | F19: 391 | G19: 25311234 | H19: 158224 | K19: 1732918 | L19: 61762 | M19: 35591 | N19: 1151306 | P19: 32 | W19: 2278000 | X19: 1774 | Y19: 2288 | Z19: 4062 | AA19: 135449600 | AB19: 53065050 | AC19: 5076786 | AD19: 0 | AE19: 0 | AF19: 0 | AG19: 58891333 | AH19: 252482769 | AI19: 240056836 | AJ19: 8150662 | AK19: 5113227 | AL19: 253320725 | AR19: =RC[-30]+RC[-29] -> 1151306 | AS19: =RC[-24]/RC[-23] -> #DIV/0! | AT19: =RC[-12]/RC[-23] -> 110.83528050921861 | AU19: =RC[-27]/RC[-43] -> 0 | AV19: =RC[-26]/RC[-44] -> 0 | AW19: =RC[-42]/RC[-45] -> 11111.165057067603 | AX19: =SUM(RC[-43]:RC[-37])/RC[-46] -> 11984.07769973661 | AY19: =RC[-39]/RC[-47] -> 27.112379280070236
A20: Greece | B20: EU | C20: C18 | D20: =RC[19]/1000 -> 347 | E20: 83 | F20: 170 | G20: 5683287 | I20: 36200 | J20: 29790 | K20: 25338 | L20: 22796 | M20: 7901 | N20: 296750 | O20: 1439 | P20: 36 | Q20: 49 | T20: 402192 | U20: 1415696 | W20: 347000 | X20: 728 | Y20: 395 | Z20: 1123 | AA20: 3476891 | AB20: 12494165 | AC20: 597444 | AD20: 108710 | AE20: 0 | AF20: 813327 | AG20: 3382050 | AH20: 20872587 | AI20: 11711752 | AJ20: 9002928 | AK20: 157907 | AL20: 20872587 | AR20: =RC[-30]+RC[-29] -> 298189 | AS20: =RC[-24]/RC[-23] -> #DIV/0! | AT20: =RC[-12]/RC[-23] -> 60.151547550432277 | AU20: =RC[-27]/RC[-43] -> 1159.0547550432277 | AV20: =RC[-26]/RC[-44] -> 0 | AW20: =RC[-42]/RC[-45] -> 16378.34870317003 | AX20: =SUM(RC[-43]:RC[-37])/RC[-46] -> 16730.005763688761 | AY20: =RC[-39]/RC[-47] -> 65.694524495677229
A21: Iceland | B21: EFTA | C21: C19 | D21: =RC[19]/1000 -> 8 | W21: 8000 | AR21: =RC[-30]+RC[-29] -> 0 | AS21: =RC[-24]/RC[-23] -> #DIV/0! | AT21: =RC[-12]/RC[-23] -> 0 | AU21: =RC[-27]/RC[-43] -> 0 | AV21: =RC[-26]/RC[-44] -> 0 | AW21: =RC[-42]/RC[-45] -> 0 | AX21: =SUM(RC[-43]:RC[-37])/RC[-46] -> 0 | AY21: =RC[-39]/RC[-47] -> 0
A22: Italy | B22: EU | C22: C20 | D22: =RC[19]/1000 -> 1852 | W22: 1852000 | AR22: =RC[-30]+RC[-29] -> 0 | AS22: =RC[-24]/RC[-23] -> #DIV/0! | AT22: =RC[-12]/RC[-23] -> 0 | AU22: =RC[-27]/RC[-43] -> 0 | AV22: =RC[-26]/RC[-44] -> 0 | AW22: =RC[-42]/RC[-45] -> 0 | AX22: =SUM(RC[-43]:RC[-37])/RC[-46] -> 0 | AY22: =RC[-39]/RC[-47] -> 0
A23: Liechtenstein | B23: EFTA | C23: C21 | D23: =RC[19]/1000 -> 1 | W23: 1000 | AR23: =RC[-30]+RC[-29] -> 0 | AS23: =RC[-24]/RC[-23] -> #DIV/0! | AT23: =RC[-12]/RC[-23] -> 0 | AU23: =RC[-27]/RC[-43] -> 0 | AV23: =RC[-26]/RC[-44] -> 0 | AW23: =RC[-42]/RC[-45] -> 0 | AX23: =SUM(RC[-43]:RC[-37])/RC[-46] -> 0 | AY23: =RC[-39]/RC[-47] -> 0
A24: Luxembourg | B24: EU | C24: C22 | D24: =RC[19]/1000 -> 2.9990000000000001 | E24: 7 | F24: 5 | G24: 247030 | H24: 1650 | I24: 881 | J24: 10 | K24: 5 | L24: 847 | M24: 37 | N24: 3800 | O24: 120 | P24: 75 | Q24: 53 | R24: 23 | S24: 19 | T24: 13837 | W24: 2999 | X24: 5 | Y24: 5 | Z24: 9 | AA24: 243611 | AB24: 204945 | AC24: 8343 | AD24: 155 | AE24: 1463 | AF24: 0 | AG24: 67620 | AH24: 526137 | AI24: 231409 | AJ24: 0 | AK24: 28458 | AL24: 259867 | AR24: =RC[-30]+RC[-29] -> 3920 | AS24: =RC[-24]/RC[-23] -> #DIV/0! | AT24: =RC[-12]/RC[-23] -> 175.43747915971991 | AU24: =RC[-27]/RC[-43] -> 4613.8712904301428 | AV24: =RC[-26]/RC[-44] -> 0 | AW24: =RC[-42]/RC[-45] -> 82370.790263421135 | AX24: =SUM(RC[-43]:RC[-37])/RC[-46] -> 83514.504834944979 | AY24: =RC[-39]/RC[-47] -> 282.42747582527505
A25: Netherlands | B25: EU | C25: C23 | D25: =RC[19]/1000 -> 540 | E25: 23 | F25: 142 | G25: 24283551 | H25: 149482 | I25: 147524 | K25: 5593165 | U25: 4018097 | W25: 540000 | X25: 868 | Y25: 1002 | Z25: 1870 | AR25: =RC[-30]+RC[-29] -> 0 | AS25: =RC[-24]/RC[-23] -> #DIV/0! | AT25: =RC[-12]/RC[-23] -> 0 | AU25: =RC[-27]/RC[-43] -> 0 | AV25: =RC[-26]/RC[-44] -> 0 | AW25: =RC[-42]/RC[-45] -> 44969.538888888892 | AX25: =SUM(RC[-43]:RC[-37])/RC[-46] -> 55877.262962962966 | AY25: =RC[-39]/RC[-47] -> 0
A26: Norway | B26: EFTA | C26: C24 | D26: =RC[19]/1000 -> 194 | E26: 95 | F26: 216 | G26: 11151907 | H26: 80160 | J26: 36327 | K26: 502973 | L26: 118064 | N26: 338531 | O26: 5668 | P26: 22 | R26: 831 | S26: 402 | U26: 2629439 | V26: 4186342 | W26: 194000 | X26: 578 | Y26: 325 | Z26: 909 | AA26: 26376025 | AB26: 16467888 | AC26: 0 | AD26: 0 | AE26: 0 | AF26: 0 | AG26: 5224862 | AH26: 48068775 | AI26: 46463506 | AJ26: 1605269 | AK26: 0 | AL26: 48068775 | AR26: =RC[-30]+RC[-29] -> 344199 | AS26: =RC[-24]/RC[-23] -> 0.62809942427064014 | AT26: =RC[-12]/RC[-23] -> 247.77719072164948 | AU26: =RC[-27]/RC[-43] -> 0 | AV26: =RC[-26]/RC[-44] -> 21579.082474226805 | AW26: =RC[-42]/RC[-45] -> 57484.056701030931 | AX26: =SUM(RC[-43]:RC[-37])/RC[-46] -> 61285.726804123711 | AY26: =RC[-39]/RC[-47] -> 608.57731958762884
A27: Portugal | B27: EU | C27: C25 | D27: =RC[19]/1000 -> 325 | E27: 231 | F27: 231 | G27: 8340979 | J27: 14045 | K27: 46255 | L27: 129625 | N27: 339130 | O27: 8749 | R27: 450 | S27: 150 | T27: 924426 | U27: 1559217 | W27: 325000 | X27: 691 | Y27: 414 | Z27: 1105 | AA27: 5788612 | AB27: 8781601 | AC27: 0 | AD27: 0 | AE27: 0 | AF27: 0 | AG27: 1247721 | AH27: 15817933 | AI27: 14972929 | AJ27: 445182 | AK27: 903275 | AL27: 16321386 | AM27: 10888 | AN27: 0 | AO27: 0 | AP27: 410531 | AQ27: 421418 | AR27: =RC[-30]+RC[-29] -> 347879 | AS27: =RC[-24]/RC[-23] -> #DIV/0! | AT27: =RC[-12]/RC[-23] -> 48.670563076923074 | AU27: =RC[-27]/RC[-43] -> 2844.3876923076923 | AV27: =RC[-26]/RC[-44] -> 0 | AW27: =RC[-42]/RC[-45] -> 25664.550769230769 | AX27: =SUM(RC[-43]:RC[-37])/RC[-46] -> 26248.935384615386 | AY27: =RC[-39]/RC[-47] -> 398.84615384615387
A28: Spain | B28: EU | C28: C26 | D28: =RC[19]/1000 -> 1680 | E28: 640 | F28: 1118 | G28: 24564000 | H28: 409926 | J28: 45000 | K28: 1290000 | L28: 614000 | M28: 61000 | N28: 1228000 | O28: 46000 | T28: 2149000 | U28: 13817000 | V28: 42458551 | W28: 1680000 | X28: 3100 | Y28: 1500 | Z28: 4600 | AA28: 82663819 | AB28: 49883342 | AC28: 0 | AD28: 0 | AE28: 0 | AF28: 0 | AG28: 9976665 | AH28: 142523826 | AI28: 122192757 | AJ28: 5690223 | AK28: 14640846 | AL28: 142523826 | AR28: =RC[-30]+RC[-29] -> 1274000 | AS28: =RC[-24]/RC[-23] -> 0.32542325808527944 | AT28: =RC[-12]/RC[-23] -> 84.835610714285721 | AU28: =RC[-27]/RC[-43] -> 1279.1666666666667 | AV28: =RC[-26]/RC[-44] -> 25272.947023809524 | AW28: =RC[-42]/RC[-45] -> 14621.428571428571 | AX28: =SUM(RC[-43]:RC[-37])/RC[-46] -> 16061.860714285714 | AY28: =RC[-39]/RC[-47] -> 365.47619047619048
A29: Sweden | B29: EU | C29: C27 | D29: =RC[19]/1000 -> 292 | E29: 37 | F29: 155 | G29: 23323000 | H29: 254183 | J29: 69985 | K29: 2710924 | L29: 45375 | M29: 5378 | N29: 342000 | O29: 605 | R29: 1453 | T29: 497999 | U29: 5305107 | W29: 292000 | X29: 1006 | Y29: 561 | Z29: 1567 | AA29: 54300975 | AB29: 25429188 | AC29: 0 | AD29: 0 | AE29: 0 | AF29: 0 | AG29: 16836524 | AH29: 96566687 | AI29: 84532439 | AJ29: 2030688 | AK29: 10003560 | AL29: 96566687 | AR29: =RC[-30]+RC[-29] -> 342605 | AS29: =RC[-24]/RC[-23] -> #DIV/0! | AT29: =RC[-12]/RC[-23] -> 330.70783219178082 | AU29: =RC[-27]/RC[-43] -> 1705.4760273972602 | AV29: =RC[-26]/RC[-44] -> 0 | AW29: =RC[-42]/RC[-45] -> 79873.287671232873 | AX29: =SUM(RC[-43]:RC[-37])/RC[-46] -> 90441.25 | AY29: =RC[-39]/RC[-47] -> 155.39383561643837
A30: Switzerland | B30: EFTA | C30: C28 | D30: =RC[19]/1000 -> 162 | W30: 162000 | AR30: =RC[-30]+RC[-29] -> 0 | AS30: =RC[-24]/RC[-23] -> #DIV/0! | AT30: =RC[-12]/RC[-23] -> 0 | AU30: =RC[-27]/RC[-43] -> 0 | AV30: =RC[-26]/RC[-44] -> 0 | AW30: =RC[-42]/RC[-45] -> 0 | AX30: =SUM(RC[-43]:RC[-37])/RC[-46] -> 0 | AY30: =RC[-39]/RC[-47] -> 0
A31: UK | B31: EU | C31: C29 | D31: =RC[19]/1000 -> 1910 | E31: 174 | F31: 770 | G31: 98869000 | H31: 565000 | J31: 189000 | K31: 9894000 | L31: 2094000 | N31: 2760000 | O31: 138000 | R31: 28240 | S31: 28240 | T31: 2342000 | U31: 7580000 | V31: 119300000 | W31: 1910000 | X31: 3560 | Y31: 5700 | Z31: 9230 | AA31: 276392080 | AB31: 170649317 | AC31: 16395830 | AD31: 291658 | AE31: 2746781 | AF31: 0 | AG31: 89507623 | AH31: 555983289 | AI31: 398179276 | AJ31: 23115337 | AK31: 110692248 | AL31: 531986861 | AR31: =RC[-30]+RC[-29] -> 2898000 | AS31: =RC[-24]/RC[-23] -> 6.3537300922045264E-2 | AT31: =RC[-12]/RC[-23] -> 291.09072722513088 | AU31: =RC[-27]/RC[-43] -> 1226.1780104712043 | AV31: =RC[-26]/RC[-44] -> 62460.732984293194 | AW31: =RC[-42]/RC[-45] -> 51763.874345549739 | AX31: =SUM(RC[-43]:RC[-37])/RC[-46] -> 58435.078534031411 | AY31: =RC[-39]/RC[-47] -> 1096.3350785340315
A32: Germany | B32: EU | C32: C31 | D32: =RC[19]/1000 -> 2415 | E32: 255 | F32: 1112 | G32: 145623450 | I32: 462018 | J32: 153625 | K32: 42668446 | L32: 1540274 | N32: 3717589 | O32: 69841 | T32: 2096272 | U32: 58313089 | W32: 2415000 | X32: 5503 | Y32: 3763 | Z32: 9266 | AA32: 240319141 | AB32: 198427180 | AC32: 0 | AD32: 0 | AE32: 0 | AF32: 0 | AG32: 27439102 | AH32: 466185423 | AI32: 431533882 | AJ32: 10709896 | AK32: 23941645 | AL32: 466185423 | AM32: 12576305 | AN32: 24219 | AO32: 1211113 | AP32: 1827360 | AQ32: 15638992 | AR32: =RC[-30]+RC[-29] -> 3787430 | AS32: =RC[-24]/RC[-23] -> #DIV/0! | AT32: =RC[-12]/RC[-23] -> 193.03744223602484 | AU32: =RC[-27]/RC[-43] -> 868.02153209109736 | AV32: =RC[-26]/RC[-44] -> 0 | AW32: =RC[-42]/RC[-45] -> 60299.565217391304 | AX32: =SUM(RC[-43]:RC[-37])/RC[-46] -> 78860.378053830224 | AY32: =RC[-39]/RC[-47] -> 637.7946169772257
A33: USA | B33: World - A | C33: C50 | D33: =RC[19]/1000 -> 16072.976000000001 | E33: 3658 | G33: 878906177 | I33: 7543703 | K33: 1062082077 | L33: 92305707 | M33: 3473225 | N33: 24550615 | O33: 3180988 | S33: 3460 | U33: 216067113 | V33: 16194154 | W33: 16072976 | X33: 30041 | Y33: 66668 | Z33: 96709 | AA33: 2064402020 | AB33: 1466353289 | AC33: 0 | AD33: 0 | AE33: 0 | AF33: 0 | AG33: 565844718 | AH33: 4096600028 | AI33: 3486785028 | AJ33: 147121248 | AK33: 325957862 | AL33: 3959864145 | AR33: =RC[-30]+RC[-29] -> 27731603 | AS33: =RC[-24]/RC[-23] -> 13.342290866197764 | AT33: =RC[-12]/RC[-23] -> 254.87501679838257 | AU33: =RC[-27]/RC[-43] -> 0 | AV33: =RC[-26]/RC[-44] -> 1007.5392385330507 | AW33: =RC[-42]/RC[-45] -> 54682.230409601805 | AX33: =SUM(RC[-43]:RC[-37])/RC[-46] -> 127189.32007364411 | AY33: =RC[-39]/RC[-47] -> 5742.9132601205902
A34: Turkey | B34: World - B | C34: C42 | D34: =RC[19]/1000 -> 1019.7809999999999 | W34: 1019781 | AR34: =RC[-30]+RC[-29] -> 0 | AS34: =RC[-24]/RC[-23] -> #DIV/0! | AT34: =RC[-12]/RC[-23] -> 0 | AU34: =RC[-27]/RC[-43] -> 0 | AV34: =RC[-26]/RC[-44] -> 0 | AW34: =RC[-42]/RC[-45] -> 0 | AX34: =SUM(RC[-43]:RC[-37])/RC[-46] -> 0 | AY34: =RC[-39]/RC[-47] -> 0
A35: Australia | B35: World - A | C35: C70 | D35: =RC[19]/1000 -> 1063.7750000000001 | W35: 1063775 | AR35: =RC[-30]+RC[-29] -> 0 | AS35: =RC[-24]/RC[-23] -> #DIV/0! | AT35: =RC[-12]/RC[-23] -> 0 | AU35: =RC[-27]/RC[-43] -> 0 | AV35: =RC[-26]/RC[-44] -> 0 | AW35: =RC[-42]/RC[-45] -> 0 | AX35: =SUM(RC[-43]:RC[-37])/RC[-46] -> 0 | AY35: =RC[-39]/RC[-47] -> 0
A36: Japan | B36: World - A | C36: C41 | D36: =RC[19]/1000 -> 3782.3130000000001 | E36: 1060 | F36: 1638 | G36: 262323000 | N36: 7596000 | U36: 28082000 | W36: 3782313 | X36: 7685 | Y36: 7386 | Z36: 15071 | AA36: 171066412 | AB36: 558096989 | AC36: 1815059 | AD36: 67380 | AE36: 634568 | AF36: 1309292 | AG36: 22468099 | AH36: 755457798 | AI36: 643001250 | AJ36: 27130765 | AK36: 60110191 | AL36: 730242207 | AR36: =RC[-30]+RC[-29] -> 7596000 | AS36: =RC[-24]/RC[-23] -> #DIV/0! | AT36: =RC[-12]/RC[-23] -> 199.73434192252202 | AU36: =RC[-27]/RC[-43] -> 0 | AV36: =RC[-26]/RC[-44] -> 0 | AW36: =RC[-42]/RC[-45] -> 69355.180282541391 | AX36: =SUM(RC[-43]:RC[-37])/RC[-46] -> 69355.180282541391 | AY36: =RC[-39]/RC[-47] -> 0
A37: Korea | B37: World - A | C37: C40 | D37: =RC[19]/1000 -> 2413.145 | W37: 2413145 | AR37: =RC[-30]+RC[-29] -> 0 | AS37: =RC[-24]/RC[-23] -> #DIV/0! | AT37: =RC[-12]/RC[-23] -> 0 | AU37: =RC[-27]/RC[-43] -> 0 | AV37: =RC[-26]/RC[-44] -> 0 | AW37: =RC[-42]/RC[-45] -> 0 | AX37: =SUM(RC[-43]:RC[-37])/RC[-46] -> 0 | AY37: =RC[-39]/RC[-47] -> 0
A38: Canada | B38: World - A | C38: C51 | D38: =RC[19]/1000 -> 2030.395 | E38: 2739 | F38: 910 | G38: 75032608 | I38: 150814 | V38: 241138449 | W38: 2030395 | X38: 3130 | Y38: 6616 | Z38: 13349 | AA38: 293843525 | AB38: 63515538 | AC38: 0 | AD38: 0 | AE38: 0 | AF38: 0 | AG38: 95373542 | AH38: 452732605 | AI38: 418119161 | AJ38: 10332764 | AK38: 24280680 | AL38: 452732605 | AM38: 22814306 | AN38: 34262 | AO38: 1713400 | AP38: 272698 | AQ38: 24834666 | AR38: =RC[-30]+RC[-29] -> 0 | AS38: =RC[-24]/RC[-23] -> 0 | AT38: =RC[-12]/RC[-23] -> 222.97760041765272 | AU38: =RC[-27]/RC[-43] -> 0 | AV38: =RC[-26]/RC[-44] -> 118764.3039901103 | AW38: =RC[-42]/RC[-45] -> 36954.685172097059 | AX38: =SUM(RC[-43]:RC[-37])/RC[-46] -> 37028.963329795435 | AY38: =RC[-39]/RC[-47] -> 0
A39: New Zealand | B39: World - A | C39: C71 | D39: =RC[19]/1000 -> 169.55699999999999 | W39: 169557 | AR39: =RC[-30]+RC[-29] -> 0 | AS39: =RC[-24]/RC[-23] -> #DIV/0! | AT39: =RC[-12]/RC[-23] -> 0 | AU39: =RC[-27]/RC[-43] -> 0 | AV39: =RC[-26]/RC[-44] -> 0 | AW39: =RC[-42]/RC[-45] -> 0 | AX39: =SUM(RC[-43]:RC[-37])/RC[-46] -> 0 | AY39: =RC[-39]/RC[-47] -> 0
A40: Mexico | B40: World - B | C40: C72 | D40: =RC[19]/1000 -> 1472.0650000000001 | W40: 1472065 | AR40: =RC[-30]+RC[-29] -> 0 | AS40: =RC[-24]/RC[-23] -> #DIV/0! | AT40: =RC[-12]/RC[-23] -> 0 | AU40: =RC[-27]/RC[-43] -> 0 | AV40: =RC[-26]/RC[-44] -> 0 | AW40: =RC[-42]/RC[-45] -> 0 | AX40: =SUM(RC[-43]:RC[-37])/RC[-46] -> 0 | AY40: =RC[-39]/RC[-47] -> 0
A41: CEE - Total | B41: Totals | D41: =RC[19]/1000 -> 2302 | E41: 828 | F41: 2941 | G41: 126491439 | H41: 1147291 | I41: 1169350 | J41: 1307734 | K41: 3884077 | L41: 675738 | M41: 52668 | N41: 4215307 | O41: 81117 | P41: 7 | Q41: 25 | R41: 5415 | S41: 2197 | T41: 2305369 | U41: 50718857 | V41: 35230950 | W41: 2302000 | X41: 10893 | Y41: 4299 | Z41: 15192 | AA41: 19782295 | AB41: 33193035 | AC41: 541041 | AD41: 910041 | AE41: 1471099 | AF41: 4044104 | AG41: 16805028 | AH41: 76746642 | AI41: 67115517 | AJ41: 1435466 | AK41: 7560985 | AL41: 76111974 | AM41: 7197019 | AN41: 0 | AO41: 128139 | AP41: 3980765 | AQ41: 11305923 | AR41: =RC[-30]+RC[-29] -> 4296424 | AS41: =RC[-24]/RC[-23] -> 1.4396108251409627 | AT41: =RC[-12]/RC[-23] -> 33.33911468288445 | AU41: =RC[-27]/RC[-43] -> 1001.4635099913119 | AV41: =RC[-26]/RC[-44] -> 15304.496090356211 | AW41: =RC[-42]/RC[-45] -> 54948.496524761074 | AX41: =SUM(RC[-43]:RC[-37])/RC[-46] -> 58526.627715030409 | AY41: =RC[-39]/RC[-47] -> 293.54387489139879
A42: EU - Total | B42: Totals | D42: =RC[19]/1000 -> 12623.999 | E42: 3222 | F42: 6610 | G42: 456896271 | H42: 2607349 | I42: 3456628 | J42: 1748911 | K42: 70347326 | L42: 8798156 | M42: 335900 | N42: 15109695 | O42: 595970 | P42: 559 | Q42: 804 | R42: 140990 | S42: 69870 | T42: 11978897 | U42: 129609159 | V42: 383335811 | W42: 12623999 | X42: 21306 | Y42: 19432 | Z42: 40707 | AA42: 1106072823 | AB42: 710451516 | AC42: 30415479 | AD42: 1252244 | AE42: 5051921 | AF42: 813327 | AG42: 293436566 | AH42: 2147493871 | AI42: 1772893425 | AJ42: 78624680 | AK42: 206567694 | AL42: 2058085799 | AM42: 56962882 | AN42: 109757 | AO42: 5488470 | AP42: 8311033 | AQ42: 70872136 | AR42: =RC[-30]+RC[-29] -> 15705665 | AS42: =RC[-24]/RC[-23] -> 0.33810866420721647 | AT42: =RC[-12]/RC[-23] -> 170.11201212864481 | AU42: =RC[-27]/RC[-43] -> 948.89876021061161 | AV42: =RC[-26]/RC[-44] -> 30365.640158875172 | AW42: =RC[-42]/RC[-45] -> 36192.673256707327 | AX42: =SUM(RC[-43]:RC[-37])/RC[-46] -> 43107.619146674522 | AY42: =RC[-39]/RC[-47] -> 696.93890184877239
A43: EFTA - Total | B43: Totals | D43: =RC[19]/1000 -> 365 | E43: 252 | F43: 576 | G43: 29513106 | H43: 213551 | I43: 276097 | J43: 96137 | K43: 1331100 | L43: 312453 | M43: 24523 | N43: 895911 | O43: 17075 | P43: 22 | Q43: 31 | R43: 2704 | S43: 1103 | T43: 316308 | U43: 7652215 | V43: 10061366 | W43: 365000 | X43: 1528 | Y43: 863 | Z43: 2397 | AA43: 49824055 | AB43: 31107681 | AC43: 0 | AD43: 0 | AE43: 0 | AF43: 0 | AG43: 9869713 | AH43: 90801448 | AI43: 87769111 | AJ43: 3032337 | AK43: 0 | AL43: 90801448 | AM43: 2530295 | AN43: 4873 | AO43: 243671 | AP43: 367655 | AQ43: 3146494 | AR43: =RC[-30]+RC[-29] -> 912986 | AS43: =RC[-24]/RC[-23] -> 0.76055428258946156 | AT43: =RC[-12]/RC[-23] -> 248.77109041095889 | AU43: =RC[-27]/RC[-43] -> 866.59726027397255 | AV43: =RC[-26]/RC[-44] -> 27565.386301369865 | AW43: =RC[-42]/RC[-45] -> 80857.824657534249 | AX43: =SUM(RC[-43]:RC[-37])/RC[-46] -> 87032.786301369866 | AY43: =RC[-39]/RC[-47] -> 856.03561643835621
A44: World A - Total | B44: Totals | D44: =RC[19]/1000 -> 25532.161 | E44: 8355 | F44: 14286 | G44: 1427438544 | H44: 9220092 | I44: 11730676 | J44: 8671109 | K44: 1377409700 | L44: 120253013 | M44: 4519118 | N44: 41334841 | O44: 4203040 | P44: 36 | Q44: 54 | R44: 149591 | S44: 24671 | T44: 13791141 | U44: 301923876 | V44: 355705795 | W44: 25532161 | X44: 47400 | Y44: 88055 | Z44: 139058 | AA44: 2796861970 | AB44: 2556554102 | AC44: 2973081 | AD44: 110369 | AE44: 1039427 | AF44: 2144630 | AG44: 741440296 | AH44: 6101123874 | AI44: 5225697634 | AJ44: 213183509 | AK44: 473711314 | AL44: 5912592465 | AM44: 174273615 | AN44: 325937 | AO44: 16299110 | AP44: 22279951 | AQ44: 213178613 | AR44: =RC[-30]+RC[-29] -> 45537881 | AS44: =RC[-24]/RC[-23] -> 0.84880224118923897 | AT44: =RC[-12]/RC[-23] -> 238.95838170533236 | AU44: =RC[-27]/RC[-43] -> 540.14781592517761 | AV44: =RC[-26]/RC[-44] -> 13931.676014419618 | AW44: =RC[-42]/RC[-45] -> 55907.470738571639 | AX44: =SUM(RC[-43]:RC[-37])/RC[-46] -> 115902.53766612234 | AY44: =RC[-39]/RC[-47] -> 4709.8642766665935
A45: World B - Total | B45: Totals | D45: =RC[19]/1000 -> 2491.846 | E45: 403 | F45: 481 | G45: 38041917 | H45: 240131 | I45: 324232 | J45: 225834 | K45: 27097172 | L45: 2437096 | M45: 90840 | N45: 1153970 | O45: 92910 | P45: 22 | Q45: 31 | R45: 48377 | S45: 17263 | T45: 4459895 | U45: 91419176 | V45: 82598490 | W45: 2491846 | X45: 1456 | Y45: 2180 | Z45: 3636 | AA45: 3523362 | AB45: 5848165 | AC45: 48439 | AD45: 182804 | AE45: 260699 | AF45: 716675 | AG45: 2956919 | AH45: 13537068 | AI45: 11831365 | AJ45: 253039 | AK45: 1335713 | AL45: 13420117 | AM45: 1287103 | AN45: 0 | AO45: 0 | AP45: 733036 | AQ45: 2020139 | AR45: =RC[-30]+RC[-29] -> 1246880 | AS45: =RC[-24]/RC[-23] -> 1.1067899183144874 | AT45: =RC[-12]/RC[-23] -> 5.4325459920075314 | AU45: =RC[-27]/RC[-43] -> 1789.7955973202197 | AV45: =RC[-26]/RC[-44] -> 33147.509918349686 | AW45: =RC[-42]/RC[-45] -> 15266.560212790037 | AX45: =SUM(RC[-43]:RC[-37])/RC[-46] -> 27472.49308344095 | AY45: =RC[-39]/RC[-47] -> 978.02833722469211
A46: EU Accession Countries - Totals | B46: Totals | D46: =RC[19]/1000 -> 1617.7139999999999 | E46: 552 | F46: 2155 | G46: 88748523 | H46: 867001 | I46: 884621 | J46: 880305 | K46: 3030140 | L46: 350307 | M46: 38038 | N46: 3133775 | O46: 40573 | P46: 7 | Q46: 25 | R46: 4000 | S46: 1663 | T46: 1611350 | U46: 33776742 | V46: 24705800 | W46: 1617714 | X46: 7830 | Y46: 2936 | Z46: 10766 | AA46: 17057547 | AB46: 27442888 | AC46: 499882 | AD46: 715743 | AE46: 1191194 | AF46: 3289406 | AG46: 13818127 | AH46: 64014787 | AI46: 56020373 | AJ46: 1349036 | AK46: 6111107 | AL46: 63480522 | AM46: 5756136 | AN46: 159 | AO46: 136087 | AP46: 3132479 | AQ46: 9024861 | AR46: =RC[-30]+RC[-29] -> 3174348 | AS46: =RC[-24]/RC[-23] -> 1.3671584000518098 | AT46: =RC[-12]/RC[-23] -> 39.571139892465538 | AU46: =RC[-27]/RC[-43] -> 996.0660537029413 | AV46: =RC[-26]/RC[-44] -> 15272.044378672621 | AW46: =RC[-42]/RC[-45] -> 54860.453083796026 | AX46: =SUM(RC[-43]:RC[-37])/RC[-46] -> 58600.553002570297 | AY46: =RC[-39]/RC[-47] -> 216.54445717846295

Sheet: 1997
A1: Name | B1: Type | C1: Code | D1: Population '000s | E1: Libraries - Total Administrative Units | F1: Libraries - Service Points | G1: Collections - Books & Bound Periodicals | H1: Collections - Current Periodicals - Titles | I1: Collections - Current Periodicals - Subscriptions | J1: Collections - Manuscripts | K1: Collections - Microforms | L1: Collections - Audio-visual Materials | M1: Collections - CD-ROMs | N1: Additions - Books & Bound Periodicals | O1: Additions - Audio-visual Materials | P1: Facilities & Services - Percentage Stock on Open Access | Q1: Facilities & Services - Percentage Catalogue Records Automated | R1: Facilities & Services - Number of Workstations for users | S1: Facilities & Services - Number connected to the internet | T1: Use & Users - Registered Users | U1: Use & Users - Consultations | V1: Use & Users - Number of Visits | W1: Use & Users - Potential Total Population Served | X1: Library Staff FTE - Trained Librarians | Y1: Library Staff FTE - Other Library Staff | Z1: Library Staff FTE - Total Staff | AA1: Recurrent Expenditure (Euros) - Staff | AB1: Recurrent Expenditure (Euros) - Acquisition of Stock | AC1: Recurrent Expenditure (Euros) - Electronic Information | AD1: Recurrent Expenditure (Euros) - Automation | AE1: Recurrent Expenditure (Euros) - Premises and Related Costs | AF1: Recurrent Expenditure (Euros) - New Buildings / Refurbishment | AG1: Recurrent Expenditure (Euros) - Other Expenditure | AH1: Recurrent Expenditure (Euros) - TOTAL EXPENDITURE | AI1: Income - Public Funding | AJ1: Income - Fees & Charges | AK1: Income - Other Income | AL1: Income - TOTAL INCOME | AM1: Capital Expenditure - New Buildings / Refurbishment | AN1: Capital Expenditure - Acquisition of Stock | AO1: Capital Expenditure - Automation | AP1: Capital Expenditure - Other Capital Expenditure | AQ1: Capital Expenditure - TOTAL CAPITAL PAYMENTS | AR1: Additions | AS1: Loans per visit | AT1: Cost per pop | AU1: Users per 1000 pop | AV1: visits per 1000 pop | AW1: Bookstock per 1000 pop | AX1: Total stock per 1000 pop | AY1: AV materials per 1000 pop
A2: Bulgaria | B2: CEE | C2: C1 | D2: =RC[19]/1000 -> 289 | E2: 92 | F2: 92 | G2: 8269272 | H2: 10078 | K2: 15715 | L2: 43546 | N2: 103396 | O2: 495 | T2: 191258 | U2: 5282430 | V2: 2607227 | W2: 289000 | X2: 498 | Y2: 397 | Z2: 895 | AA2: 469825 | AB2: 288543 | AC2: 0 | AD2: 0 | AE2: 0 | AF2: 0 | AG2: 232453 | AH2: 990821 | AI2: 600365 | AJ2: 347262 | AK2: 140132 | AL2: 1087759 | AR2: =RC[-30]+RC[-29] -> 103891 | AS2: =RC[-24]/RC[-23] -> 2.0260721448496812 | AT2: =RC[-12]/RC[-23] -> 3.4284463667820071 | AU2: =RC[-27]/RC[-43] -> 661.79238754325263 | AV2: =RC[-26]/RC[-44] -> 9021.5467128027685 | AW2: =RC[-42]/RC[-45] -> 28613.397923875433 | AX2: =SUM(RC[-43]:RC[-37])/RC[-46] -> 28853.325259515572 | AY2: =RC[-39]/RC[-47] -> 150.67820069204151
A3: Czech Republic | B3: CEE | C3: C2 | D3: =RC[19]/1000 -> 192 | E3: 65 | F3: 800 | G3: 10414000 | H3: 21000 | J3: 33000 | K3: 17000 | L3: 41000 | N3: 215000 | O3: 2000 | T3: 234000 | U3: 2119000 | V3: 3330748 | W3: 192000 | X3: 330 | Y3: 280 | Z3: 610 | AB3: 2523069 | AR3: =RC[-30]+RC[-29] -> 217000 | AS3: =RC[-24]/RC[-23] -> 0.63619343162556874 | AT3: =RC[-12]/RC[-23] -> 0 | AU3: =RC[-27]/RC[-43] -> 1218.75 | AV3: =RC[-26]/RC[-44] -> 17347.645833333332 | AW3: =RC[-42]/RC[-45] -> 54239.583333333336 | AX3: =SUM(RC[-43]:RC[-37])/RC[-46] -> 54822.916666666664 | AY3: =RC[-39]/RC[-47] -> 213.54166666666666
A4: Estonia | B4: CEE | C4: C3 | D4: =RC[19]/1000 -> 48 | E4: 17 | F4: 34 | G4: 7539047 | H4: 12548 | I4: 20050 | J4: 67381 | K4: 373416 | L4: 27465 | M4: 1881 | N4: 110097 | O4: 2281 | P4: 5 | Q4: 5 | R4: 100 | S4: 80 | T4: 75289 | U4: 2316291 | V4: 1653611 | W4: 48000 | X4: 537 | Y4: 112 | Z4: 649 | AA4: 1551612 | AB4: 1494468 | AC4: 251406 | AD4: 0 | AE4: 300842 | AF4: 0 | AG4: 191475 | AH4: 3789804 | AI4: 4178516 | AJ4: 0 | AK4: 167015 | AL4: 4345531 | AM4: 327294 | AN4: 0 | AO4: 0 | AP4: 208797 | AQ4: 536090 | AR4: =RC[-30]+RC[-29] -> 112378 | AS4: =RC[-24]/RC[-23] -> 1.4007472132200378 | AT4: =RC[-12]/RC[-23] -> 78.954250000000002 | AU4: =RC[-27]/RC[-43] -> 1568.5208333333333 | AV4: =RC[-26]/RC[-44] -> 34450.229166666664 | AW4: =RC[-42]/RC[-45] -> 157063.47916666666 | AX4: =SUM(RC[-43]:RC[-37])/RC[-46] -> 167537.25 | AY4: =RC[-39]/RC[-47] -> 572.1875
A5: Hungary | B5: CEE | C5: C4 | D5: =RC[19]/1000 -> 214 | E5: 34 | F5: 35 | G5: 10015000 | H5: 23000 | J5: 158000 | K5: 472897 | L5: 18293 | M5: 520 | N5: 377709 | O5: 6076 | T5: 175228 | U5: 1788000 | V5: 3785722 | W5: 214000 | X5: 592 | Y5: 368 | Z5: 960 | AA5: 1508810 | AB5: 3552710 | AC5: 24643 | AD5: 89054 | AE5: 140526 | AF5: 364590 | AG5: 374225 | AH5: 6054558 | AI5: 5221689 | AJ5: 199181 | AK5: 138671 | AL5: 5559541 | AR5: =RC[-30]+RC[-29] -> 383785 | AS5: =RC[-24]/RC[-23] -> 0.4723009243679277 | AT5: =RC[-12]/RC[-23] -> 28.292327102803739 | AU5: =RC[-27]/RC[-43] -> 818.82242990654208 | AV5: =RC[-26]/RC[-44] -> 17690.289719626169 | AW5: =RC[-42]/RC[-45] -> 46799.06542056075 | AX5: =SUM(RC[-43]:RC[-37])/RC[-46] -> 49942.570093457944 | AY5: =RC[-39]/RC[-47] -> 85.481308411214954
A6: Latvia | B6: CEE | C6: C5 | D6: =RC[19]/1000 -> 61 | E6: 16 | F6: 16 | G6: 5919515 | J6: 21773 | L6: 1517 | N6: 76773 | T6: 51618 | U6: 3002512 | V6: 1118979 | W6: 61000 | X6: 134 | Y6: 193 | Z6: 327 | AA6: 472674 | AB6: 266164 | AC6: 0 | AD6: 0 | AE6: 0 | AF6: 0 | AG6: 164388 | AH6: 903226 | AI6: 778636 | AJ6: 48160 | AK6: 76430 | AL6: 903226 | AM6: 317940 | AN6: 0 | AO6: 0 | AP6: 202829 | AQ6: 520768 | AR6: =RC[-30]+RC[-29] -> 76773 | AS6: =RC[-24]/RC[-23] -> 2.683260365029192 | AT6: =RC[-12]/RC[-23] -> 14.806983606557377 | AU6: =RC[-27]/RC[-43] -> 846.19672131147536 | AV6: =RC[-26]/RC[-44] -> 18343.918032786885 | AW6: =RC[-42]/RC[-45] -> 97041.229508196717 | AX6: =SUM(RC[-43]:RC[-37])/RC[-46] -> 97423.032786885247 | AY6: =RC[-39]/RC[-47] -> 24.868852459016395
A7: Lithuania | B7: CEE | C7: C6 | D7: =RC[19]/1000 -> 97 | E7: 15 | F7: 83 | G7: 12035215 | H7: 3751 | I7: 3800 | J7: 235571 | K7: 25422 | L7: 2388 | M7: 1456 | N7: 153930 | O7: 128 | P7: 4 | Q7: 3 | R7: 134 | S7: 134 | T7: 85914 | U7: 5774470 | V7: 2965782 | W7: 97000 | X7: 552 | Y7: 90 | Z7: 642 | AA7: 725846 | AB7: 453640 | AC7: 0 | AD7: 0 | AE7: 0 | AF7: 0 | AG7: 22027 | AH7: 1201513 | AI7: 967621 | AJ7: 35919 | AK7: 194903 | AL7: 1198443 | AR7: =RC[-30]+RC[-29] -> 154058 | AS7: =RC[-24]/RC[-23] -> 1.9470311708682566 | AT7: =RC[-12]/RC[-23] -> 12.386731958762887 | AU7: =RC[-27]/RC[-43] -> 885.71134020618558 | AV7: =RC[-26]/RC[-44] -> 30575.072164948455 | AW7: =RC[-42]/RC[-45] -> 124074.38144329897 | AX7: =SUM(RC[-43]:RC[-37])/RC[-46] -> 126882.50515463918 | AY7: =RC[-39]/RC[-47] -> 24.618556701030929
A8: Poland | B8: CEE | C8: C7 | D8: =RC[19]/1000 -> 796 | W8: 796000 | AR8: =RC[-30]+RC[-29] -> 0 | AS8: =RC[-24]/RC[-23] -> #DIV/0! | AT8: =RC[-12]/RC[-23] -> 0 | AU8: =RC[-27]/RC[-43] -> 0 | AV8: =RC[-26]/RC[-44] -> 0 | AW8: =RC[-42]/RC[-45] -> 0 | AX8: =SUM(RC[-43]:RC[-37])/RC[-46] -> 0 | AY8: =RC[-39]/RC[-47] -> 0
A9: Romania | B9: CEE | C9: C8 | D9: =RC[19]/1000 -> 438 | W9: 438000 | AR9: =RC[-30]+RC[-29] -> 0 | AS9: =RC[-24]/RC[-23] -> #DIV/0! | AT9: =RC[-12]/RC[-23] -> 0 | AU9: =RC[-27]/RC[-43] -> 0 | AV9: =RC[-26]/RC[-44] -> 0 | AW9: =RC[-42]/RC[-45] -> 0 | AX9: =SUM(RC[-43]:RC[-37])/RC[-46] -> 0 | AY9: =RC[-39]/RC[-47] -> 0
A10: Slovak Rep | B10: CEE | C10: C9 | D10: =RC[19]/1000 -> 112 | E10: 41 | F10: 524 | G10: 4646428 | H10: 8464 | I10: 13008 | M10: 742 | N10: 90558 | O10: 320 | R10: 191 | S10: 58 | T10: 132731 | U10: 2502927 | V10: 620442 | W10: 112000 | X10: 515 | Y10: 42 | Z10: 557 | AA10: 673295 | AB10: 836165 | AC10: 60750 | AD10: 117460 | AE10: 45590 | AF10: 898804 | AG10: 88800 | AH10: 2720864 | AI10: 2355463 | AJ10: 25335 | AK10: 260746 | AL10: 2641544 | AM10: 201167 | AN10: 0 | AO10: 124295 | AP10: 0 | AQ10: 325462 | AR10: =RC[-30]+RC[-29] -> 90878 | AS10: =RC[-24]/RC[-23] -> 4.0341031071397486 | AT10: =RC[-12]/RC[-23] -> 24.293428571428571 | AU10: =RC[-27]/RC[-43] -> 1185.0982142857142 | AV10: =RC[-26]/RC[-44] -> 5539.6607142857147 | AW10: =RC[-42]/RC[-45] -> 41485.964285714283 | AX10: =SUM(RC[-43]:RC[-37])/RC[-46] -> 41684.303571428572 | AY10: =RC[-39]/RC[-47] -> 0
A11: Slovenia | B11: CEE | C11: C10 | D11: =RC[19]/1000 -> 55 | E11: 68 | F11: 68 | G11: 3147517 | H11: 14920 | I11: 12075 | N11: 97769 | O11: 18949 | Q11: 44 | R11: 152 | S11: 144 | T11: 126464 | U11: 3123226 | V11: 1623843 | W11: 55000 | X11: 293 | Y11: 51 | Z11: 344 | AA11: 467641 | AB11: 4012420 | AC11: 10162 | AD11: 36725 | AE11: 57952 | AF11: 150354 | AG11: 5384933 | AH11: 10120187 | AI11: 9811711 | AJ11: 606872 | AK11: 963111 | AL11: 11381695 | AR11: =RC[-30]+RC[-29] -> 116718 | AS11: =RC[-24]/RC[-23] -> 1.9233546592866428 | AT11: =RC[-12]/RC[-23] -> 184.0034 | AU11: =RC[-27]/RC[-43] -> 2299.3454545454547 | AV11: =RC[-26]/RC[-44] -> 29524.418181818182 | AW11: =RC[-42]/RC[-45] -> 57227.581818181818 | AX11: =SUM(RC[-43]:RC[-37])/RC[-46] -> 57718.400000000001 | AY11: =RC[-39]/RC[-47] -> 0
A12: Austria | B12: EU | C12: C11 | D12: =RC[19]/1000 -> 268 | W12: 268000 | AR12: =RC[-30]+RC[-29] -> 0 | AS12: =RC[-24]/RC[-23] -> #DIV/0! | AT12: =RC[-12]/RC[-23] -> 0 | AU12: =RC[-27]/RC[-43] -> 0 | AV12: =RC[-26]/RC[-44] -> 0 | AW12: =RC[-42]/RC[-45] -> 0 | AX12: =SUM(RC[-43]:RC[-37])/RC[-46] -> 0 | AY12: =RC[-39]/RC[-47] -> 0
A13: België Nederlandstalige Universiteiten | B13: België Nederlandstalige Universiteiten | C13: C12a | AR13: 0 | AS13: =RC[-24]/RC[-23] -> #DIV/0! | AT13: =RC[-12]/RC[-23] -> #DIV/0! | AU13: =RC[-27]/RC[-43] -> #DIV/0! | AV13: =RC[-26]/RC[-44] -> #DIV/0! | AW13: =RC[-42]/RC[-45] -> #DIV/0! | AX13: =SUM(RC[-43]:RC[-37])/RC[-46] -> #DIV/0! | AY13: =RC[-39]/RC[-47] -> #DIV/0!
A14: Belgique universités francophones | B14: Belgique universités francophones | C14: C12b | AR14: 0 | AS14: =RC[-24]/RC[-23] -> #DIV/0! | AT14: =RC[-12]/RC[-23] -> #DIV/0! | AU14: =RC[-27]/RC[-43] -> #DIV/0! | AV14: =RC[-26]/RC[-44] -> #DIV/0! | AW14: =RC[-42]/RC[-45] -> #DIV/0! | AX14: =SUM(RC[-43]:RC[-37])/RC[-46] -> #DIV/0! | AY14: =RC[-39]/RC[-47] -> #DIV/0!
A15: Belgium | B15: EU | C15: C12 | D15: =RC[19]/1000 -> 172 | E15: 16 | F15: 61 | G15: 18301000 | H15: 67000 | I15: 34588 | J15: 20000 | K15: 311000 | L15: 11000 | M15: 860 | N15: 393000 | O15: 699 | P15: 42 | Q15: 54 | R15: 640 | T15: 139000 | U15: 743570 | V15: 5743293 | W15: 172000 | X15: 206 | Y15: 359 | Z15: 565 | AA15: 6118202 | AB15: 5004654 | AC15: 242969 | AD15: 449168 | AE15: 649470 | AF15: 0 | AG15: 206599 | AH15: 12671060 | AI15: 5153098 | AJ15: 39353 | AK15: 319573 | AL15: 5512023 | AM15: 12 | AN15: 5441 | AO15: 272091 | AP15: 7 | AQ15: 277551 | AR15: =RC[-30]+RC[-29] -> 393699 | AS15: =RC[-24]/RC[-23] -> 0.1294675371777132 | AT15: =RC[-12]/RC[-23] -> 73.668953488372097 | AU15: =RC[-27]/RC[-43] -> 808.1395348837209 | AV15: =RC[-26]/RC[-44] -> 33391.238372093023 | AW15: =RC[-42]/RC[-45] -> 106401.16279069768 | AX15: =SUM(RC[-43]:RC[-37])/RC[-46] -> 108985.16279069768 | AY15: =RC[-39]/RC[-47] -> 63.953488372093027
A16: Denmark | B16: EU | C16: C13 | D16: =RC[19]/1000 -> 180 | E16: 20 | F16: 45 | G16: 9364000 | I16: 81412 | J16: 74000 | K16: 1116466 | L16: 827289 | M16: 6947 | N16: 233649 | O16: 18303 | R16: 842 | U16: 4065248 | W16: 180000 | X16: 363 | Y16: 407 | Z16: 770 | AA16: 32290632 | AB16: 14644737 | AC16: 670866 | AD16: 23072 | AE16: 217292 | AF16: 0 | AG16: 7693641 | AH16: 55540241 | AI16: 53749701 | AJ16: 969947 | AK16: 1591276 | AL16: 56310925 | AM16: 2566435 | AN16: 0 | AO16: 0 | AP16: 0 | AQ16: 2566435 | AR16: =RC[-30]+RC[-29] -> 251952 | AS16: =RC[-24]/RC[-23] -> #DIV/0! | AT16: =RC[-12]/RC[-23] -> 308.55689444444442 | AU16: =RC[-27]/RC[-43] -> 0 | AV16: =RC[-26]/RC[-44] -> 0 | AW16: =RC[-42]/RC[-45] -> 52022.222222222219 | AX16: =SUM(RC[-43]:RC[-37])/RC[-46] -> 63722.855555555558 | AY16: =RC[-39]/RC[-47] -> 4596.05
A17: Eire | B17: EU | C17: C15 | D17: =RC[19]/1000 -> 137 | W17: 137000 | AR17: =RC[-30]+RC[-29] -> 0 | AS17: =RC[-24]/RC[-23] -> #DIV/0! | AT17: =RC[-12]/RC[-23] -> 0 | AU17: =RC[-27]/RC[-43] -> 0 | AV17: =RC[-26]/RC[-44] -> 0 | AW17: =RC[-42]/RC[-45] -> 0 | AX17: =SUM(RC[-43]:RC[-37])/RC[-46] -> 0 | AY17: =RC[-39]/RC[-47] -> 0
A18: Finland | B18: EU | C18: C16 | D18: =RC[19]/1000 -> 224 | E18: 19 | F18: 304 | G18: 13833439 | H18: 110566 | I18: 128399 | J18: 196975 | K18: 1249403 | L18: 226588 | N18: 443029 | O18: 10567 | P18: 45 | U18: 7137194 | V18: 8958827 | W18: 224000 | X18: 927 | Y18: 136 | Z18: 1063 | AA18: 25168281 | AB18: 15057273 | AC18: 0 | AD18: 0 | AE18: 0 | AF18: 507326 | AG18: 6675719 | AH18: 47408598 | AI18: 37506298 | AJ18: 4680443 | AK18: 4087531 | AL18: 46190551 | AR18: =RC[-30]+RC[-29] -> 453596 | AS18: =RC[-24]/RC[-23] -> 0.79666612604529585 | AT18: =RC[-12]/RC[-23] -> 211.64552678571428 | AU18: =RC[-27]/RC[-43] -> 0 | AV18: =RC[-26]/RC[-44] -> 39994.763392857145 | AW18: =RC[-42]/RC[-45] -> 61756.424107142855 | AX18: =SUM(RC[-43]:RC[-37])/RC[-46] -> 70291.830357142855 | AY18: =RC[-39]/RC[-47] -> 1011.5535714285714
A19: France | B19: EU | C19: C17 | D19: =RC[19]/1000 -> 2266 | E19: 95 | F19: 333 | G19: 24289889 | H19: 148148 | K19: 2817834 | L19: 71668 | M19: 29988 | N19: 1040621 | P19: 36 | W19: 2266000 | X19: 1620 | Y19: 2264 | Z19: 3884 | AA19: 126698303 | AB19: 57043738 | AC19: 0 | AD19: 0 | AE19: 0 | AF19: 0 | AG19: 51622195 | AH19: 235364236 | AI19: 221473448 | AJ19: 7538024 | AK19: 7826327 | AL19: 236837798 | AR19: =RC[-30]+RC[-29] -> 1040621 | AS19: =RC[-24]/RC[-23] -> #DIV/0! | AT19: =RC[-12]/RC[-23] -> 103.86771226831421 | AU19: =RC[-27]/RC[-43] -> 0 | AV19: =RC[-26]/RC[-44] -> 0 | AW19: =RC[-42]/RC[-45] -> 10719.280229479258 | AX19: =SUM(RC[-43]:RC[-37])/RC[-46] -> 12073.048102383054 | AY19: =RC[-39]/RC[-47] -> 31.627537511032656
A20: Greece | B20: EU | C20: C18 | D20: =RC[19]/1000 -> 346 | E20: 81 | F20: 167 | G20: 5683287 | I20: 36200 | J20: 29790 | K20: 25338 | L20: 22796 | M20: 5926 | N20: 296750 | O20: 1439 | P20: 36 | Q20: 49 | T20: 402192 | U20: 1415696 | W20: 346000 | X20: 728 | Y20: 395 | Z20: 1123 | AA20: 3303046 | AB20: 11869457 | AC20: 567572 | AD20: 103275 | AE20: 0 | AF20: 772661 | AG20: 3212947 | AH20: 19828958 | AI20: 11126164 | AJ20: 8552782 | AK20: 150012 | AL20: 19828958 | AR20: =RC[-30]+RC[-29] -> 298189 | AS20: =RC[-24]/RC[-23] -> #DIV/0! | AT20: =RC[-12]/RC[-23] -> 57.309127167630059 | AU20: =RC[-27]/RC[-43] -> 1162.4046242774566 | AV20: =RC[-26]/RC[-44] -> 0 | AW20: =RC[-42]/RC[-45] -> 16425.684971098264 | AX20: =SUM(RC[-43]:RC[-37])/RC[-46] -> 16772.65028901734 | AY20: =RC[-39]/RC[-47] -> 65.884393063583815
A21: Iceland | B21: EFTA | C21: C19 | D21: =RC[19]/1000 -> 8 | W21: 8000 | AR21: =RC[-30]+RC[-29] -> 0 | AS21: =RC[-24]/RC[-23] -> #DIV/0! | AT21: =RC[-12]/RC[-23] -> 0 | AU21: =RC[-27]/RC[-43] -> 0 | AV21: =RC[-26]/RC[-44] -> 0 | AW21: =RC[-42]/RC[-45] -> 0 | AX21: =SUM(RC[-43]:RC[-37])/RC[-46] -> 0 | AY21: =RC[-39]/RC[-47] -> 0
A22: Italy | B22: EU | C22: C20 | D22: =RC[19]/1000 -> 1852 | W22: 1852000 | AR22: =RC[-30]+RC[-29] -> 0 | AS22: =RC[-24]/RC[-23] -> #DIV/0! | AT22: =RC[-12]/RC[-23] -> 0 | AU22: =RC[-27]/RC[-43] -> 0 | AV22: =RC[-26]/RC[-44] -> 0 | AW22: =RC[-42]/RC[-45] -> 0 | AX22: =SUM(RC[-43]:RC[-37])/RC[-46] -> 0 | AY22: =RC[-39]/RC[-47] -> 0
A23: Liechtenstein | B23: EFTA | C23: C21 | D23: =RC[19]/1000 -> 1 | W23: 1000 | AR23: =RC[-30]+RC[-29] -> 0 | AS23: =RC[-24]/RC[-23] -> #DIV/0! | AT23: =RC[-12]/RC[-23] -> 0 | AU23: =RC[-27]/RC[-43] -> 0 | AV23: =RC[-26]/RC[-44] -> 0 | AW23: =RC[-42]/RC[-45] -> 0 | AX23: =SUM(RC[-43]:RC[-37])/RC[-46] -> 0 | AY23: =RC[-39]/RC[-47] -> 0
A24: Luxembourg | B24: EU | C24: C22 | D24: =RC[19]/1000 -> 2.9790000000000001 | E24: 7 | F24: 5 | G24: 247030 | H24: 1650 | I24: 881 | J24: 10 | K24: 5 | L24: 847 | M24: 37 | N24: 3800 | O24: 120 | P24: 75 | Q24: 53 | R24: 18 | S24: 14 | T24: 13837 | W24: 2979 | X24: 4 | Y24: 4 | Z24: 8 | AA24: 183601 | AB24: 187723 | AC24: 4486 | AD24: 91 | AE24: 3128 | AF24: 202 | AG24: 43750 | AH24: 422981 | AI24: 216242 | AJ24: 0 | AK24: 13322 | AL24: 229564 | AR24: =RC[-30]+RC[-29] -> 3920 | AS24: =RC[-24]/RC[-23] -> #DIV/0! | AT24: =RC[-12]/RC[-23] -> 141.98757972473985 | AU24: =RC[-27]/RC[-43] -> 4644.8472641826111 | AV24: =RC[-26]/RC[-44] -> 0 | AW24: =RC[-42]/RC[-45] -> 82923.799932863374 | AX24: =SUM(RC[-43]:RC[-37])/RC[-46] -> 84075.1930177912 | AY24: =RC[-39]/RC[-47] -> 284.3235985229943
A25: Netherlands | B25: EU | C25: C23 | D25: =RC[19]/1000 -> 540 | E25: 23 | F25: 140 | G25: 24043000 | H25: 147200 | I25: 148300 | K25: 4675000 | U25: 3926000 | W25: 540000 | X25: 904 | Y25: 943 | Z25: 1847 | AR25: =RC[-30]+RC[-29] -> 0 | AS25: =RC[-24]/RC[-23] -> #DIV/0! | AT25: =RC[-12]/RC[-23] -> 0 | AU25: =RC[-27]/RC[-43] -> 0 | AV25: =RC[-26]/RC[-44] -> 0 | AW25: =RC[-42]/RC[-45] -> 44524.074074074073 | AX25: =SUM(RC[-43]:RC[-37])/RC[-46] -> 53728.703703703701 | AY25: =RC[-39]/RC[-47] -> 0
A26: Norway | B26: EFTA | C26: C24 | D26: =RC[19]/1000 -> 193 | E26: 95 | F26: 215 | G26: 10725257 | H26: 86934 | J26: 35289 | K26: 480471 | L26: 114723 | N26: 335158 | O26: 12540 | P26: 22 | R26: 748 | S26: 330 | U26: 2609463 | V26: 4836784 | W26: 193000 | X26: 582 | Y26: 331 | Z26: 885 | AA26: 25891021 | AB26: 17028512 | AC26: 0 | AD26: 0 | AE26: 0 | AF26: 0 | AG26: 6314312 | AH26: 49233845 | AI26: 47505864 | AJ26: 1727981 | AK26: 0 | AL26: 49233845 | AR26: =RC[-30]+RC[-29] -> 347698 | AS26: =RC[-24]/RC[-23] -> 0.53950372809701652 | AT26: =RC[-12]/RC[-23] -> 255.09764248704664 | AU26: =RC[-27]/RC[-43] -> 0 | AV26: =RC[-26]/RC[-44] -> 25061.056994818653 | AW26: =RC[-42]/RC[-45] -> 55571.279792746114 | AX26: =SUM(RC[-43]:RC[-37])/RC[-46] -> 59288.466321243526 | AY26: =RC[-39]/RC[-47] -> 594.41968911917104
A27: Portugal | B27: EU | C27: C25 | D27: =RC[19]/1000 -> 325 | E27: 225 | F27: 225 | G27: 8127193 | J27: 14398 | K27: 43002 | L27: 187780 | N27: 487992 | O27: 10019 | R27: 414 | S27: 143 | T27: 841500 | U27: 1244504 | W27: 325000 | X27: 591 | Y27: 437 | Z27: 1028 | AA27: 4835741 | AB27: 8093822 | AC27: 0 | AD27: 0 | AE27: 0 | AF27: 0 | AG27: 1197629 | AH27: 14127192 | AI27: 13599479 | AJ27: 548530 | AK27: 606741 | AL27: 14754750 | AM27: 0 | AN27: 0 | AO27: 0 | AP27: 553022 | AQ27: 553022 | AR27: =RC[-30]+RC[-29] -> 498011 | AS27: =RC[-24]/RC[-23] -> #DIV/0! | AT27: =RC[-12]/RC[-23] -> 43.468283076923079 | AU27: =RC[-27]/RC[-43] -> 2589.2307692307691 | AV27: =RC[-26]/RC[-44] -> 0 | AW27: =RC[-42]/RC[-45] -> 25006.747692307694 | AX27: =SUM(RC[-43]:RC[-37])/RC[-46] -> 25761.147692307692 | AY27: =RC[-39]/RC[-47] -> 577.78461538461534
A28: Spain | B28: EU | C28: C26 | D28: =RC[19]/1000 -> 1680 | E28: 640 | F28: 1118 | G28: 24564000 | H28: 400441 | J28: 45000 | K28: 1290000 | L28: 614000 | M28: 61000 | N28: 1228000 | O28: 46000 | T28: 2149000 | U28: 13817000 | V28: 42457793 | W28: 1680000 | X28: 3100 | Y28: 1500 | Z28: 4600 | AA28: 82663819 | AB28: 49883342 | AC28: 0 | AD28: 0 | AE28: 0 | AF28: 0 | AG28: 9976665 | AH28: 142523826 | AI28: 122194236 | AJ28: 5024139 | AK28: 15305451 | AL28: 142523826 | AR28: =RC[-30]+RC[-29] -> 1274000 | AS28: =RC[-24]/RC[-23] -> 0.32542906787453602 | AT28: =RC[-12]/RC[-23] -> 84.835610714285721 | AU28: =RC[-27]/RC[-43] -> 1279.1666666666667 | AV28: =RC[-26]/RC[-44] -> 25272.495833333334 | AW28: =RC[-42]/RC[-45] -> 14621.428571428571 | AX28: =SUM(RC[-43]:RC[-37])/RC[-46] -> 16056.214880952381 | AY28: =RC[-39]/RC[-47] -> 365.47619047619048
A29: Sweden | B29: EU | C29: C27 | D29: =RC[19]/1000 -> 292 | E29: 37 | F29: 155 | G29: 23323000 | H29: 254183 | J29: 69985 | K29: 2710924 | L29: 45375 | M29: 4482 | N29: 342000 | O29: 504 | R29: 1211 | T29: 497999 | U29: 5270509 | W29: 292000 | X29: 939 | Y29: 529 | Z29: 1468 | AA29: 46338666 | AB29: 21700433 | AC29: 0 | AD29: 0 | AE29: 0 | AF29: 0 | AG29: 14367736 | AH29: 82406835 | AI29: 72137204 | AJ29: 1732922 | AK29: 8536709 | AL29: 82406835 | AR29: =RC[-30]+RC[-29] -> 342504 | AS29: =RC[-24]/RC[-23] -> #DIV/0! | AT29: =RC[-12]/RC[-23] -> 282.21518835616439 | AU29: =RC[-27]/RC[-43] -> 1705.4760273972602 | AV29: =RC[-26]/RC[-44] -> 0 | AW29: =RC[-42]/RC[-45] -> 79873.287671232873 | AX29: =SUM(RC[-43]:RC[-37])/RC[-46] -> 90438.181506849316 | AY29: =RC[-39]/RC[-47] -> 155.39383561643837
A30: Switzerland | B30: EFTA | C30: C28 | D30: =RC[19]/1000 -> 162 | W30: 162000 | AR30: =RC[-30]+RC[-29] -> 0 | AS30: =RC[-24]/RC[-23] -> #DIV/0! | AT30: =RC[-12]/RC[-23] -> 0 | AU30: =RC[-27]/RC[-43] -> 0 | AV30: =RC[-26]/RC[-44] -> 0 | AW30: =RC[-42]/RC[-45] -> 0 | AX30: =SUM(RC[-43]:RC[-37])/RC[-46] -> 0 | AY30: =RC[-39]/RC[-47] -> 0
A31: UK | B31: EU | C31: C29 | D31: =RC[19]/1000 -> 1910 | E31: 177 | F31: 760 | G31: 90526000 | H31: 556000 | J31: 90000 | K31: 8471000 | L31: 6230000 | N31: 2648000 | O31: 136866 | R31: 22980 | S31: 22980 | T31: 2321000 | U31: 72500000 | V31: 113900000 | W31: 1910000 | X31: 3435 | Y31: 5455 | Z31: 8890 | AA31: 257041704 | AB31: 160948081 | AC31: 13184056 | AD31: 256178 | AE31: 2412629 | AF31: 0 | AG31: 81595658 | AH31: 515438305 | AI31: 365705018 | AJ31: 12701000 | AK31: 78043750 | AL31: 456449768 | AR31: =RC[-30]+RC[-29] -> 2784866 | AS31: =RC[-24]/RC[-23] -> 0.63652326602282705 | AT31: =RC[-12]/RC[-23] -> 269.86298691099478 | AU31: =RC[-27]/RC[-43] -> 1215.1832460732985 | AV31: =RC[-26]/RC[-44] -> 59633.507853403142 | AW31: =RC[-42]/RC[-45] -> 47395.811518324605 | AX31: =SUM(RC[-43]:RC[-37])/RC[-46] -> 55430.890052356022 | AY31: =RC[-39]/RC[-47] -> 3261.780104712042
A32: Germany | B32: EU | C32: C31 | D32: =RC[19]/1000 -> 2415 | E32: 255 | F32: 1166 | G32: 143123027 | I32: 475875 | J32: 155266 | K32: 31393465 | L32: 1538792 | N32: 3747592 | O32: 53427 | T32: 2101009 | U32: 57764752 | W32: 2415000 | X32: 5586 | Y32: 3662 | Z32: 9248 | AA32: 237878656 | AB32: 191301030 | AC32: 0 | AD32: 0 | AE32: 0 | AF32: 0 | AG32: 26968221 | AH32: 456147907 | AI32: 422242454 | AJ32: 10479299 | AK32: 23426154 | AL32: 456147907 | AM32: 11915831 | AN32: 25262 | AO32: 1263299 | AP32: 2567674 | AQ32: 15772067 | AR32: =RC[-30]+RC[-29] -> 3801019 | AS32: =RC[-24]/RC[-23] -> #DIV/0! | AT32: =RC[-12]/RC[-23] -> 188.8811209109731 | AU32: =RC[-27]/RC[-43] -> 869.98302277432708 | AV32: =RC[-26]/RC[-44] -> 0 | AW32: =RC[-42]/RC[-45] -> 59264.193374741204 | AX32: =SUM(RC[-43]:RC[-37])/RC[-46] -> 73162.08074534162 | AY32: =RC[-39]/RC[-47] -> 637.18095238095236
A33: USA | B33: World - A | C33: C50 | D33: =RC[19]/1000 -> 16072.976000000001 | E33: 3533 | G33: 842811692 | I33: 6626232 | K33: 621642543 | L33: 52713984 | M33: 2227866 | N33: 20426862 | O33: 1969547 | S33: 3108 | U33: 223400252 | V33: 16324851 | W33: 16072976 | X33: 28655 | Y33: 67490 | Z33: 96145 | AA33: 1754054448 | AB33: 1224375073 | AC33: 0 | AD33: 0 | AE33: 0 | AF33: 0 | AG33: 534686830 | AH33: 3513116351 | AI33: 2885525787 | AJ33: 112764838 | AK33: 273853302 | AL33: 3272143927 | AR33: =RC[-30]+RC[-29] -> 22396409 | AS33: =RC[-24]/RC[-23] -> 13.68467326286776 | AT33: =RC[-12]/RC[-23] -> 218.57286111794107 | AU33: =RC[-27]/RC[-43] -> 0 | AV33: =RC[-26]/RC[-44] -> 1015.6707133762907 | AW33: =RC[-42]/RC[-45] -> 52436.56756533451 | AX33: =SUM(RC[-43]:RC[-37])/RC[-46] -> 94943.3581559507 | AY33: =RC[-39]/RC[-47] -> 3279.6654459012443
A34: Turkey | B34: World - B | C34: C42 | D34: =RC[19]/1000 -> 1019.7809999999999 | W34: 1019781 | AR34: =RC[-30]+RC[-29] -> 0 | AS34: =RC[-24]/RC[-23] -> #DIV/0! | AT34: =RC[-12]/RC[-23] -> 0 | AU34: =RC[-27]/RC[-43] -> 0 | AV34: =RC[-26]/RC[-44] -> 0 | AW34: =RC[-42]/RC[-45] -> 0 | AX34: =SUM(RC[-43]:RC[-37])/RC[-46] -> 0 | AY34: =RC[-39]/RC[-47] -> 0
A35: Australia | B35: World - A | C35: C70 | D35: =RC[19]/1000 -> 1063.7750000000001 | W35: 1063775 | AR35: =RC[-30]+RC[-29] -> 0 | AS35: =RC[-24]/RC[-23] -> #DIV/0! | AT35: =RC[-12]/RC[-23] -> 0 | AU35: =RC[-27]/RC[-43] -> 0 | AV35: =RC[-26]/RC[-44] -> 0 | AW35: =RC[-42]/RC[-45] -> 0 | AX35: =SUM(RC[-43]:RC[-37])/RC[-46] -> 0 | AY35: =RC[-39]/RC[-47] -> 0
A36: Japan | B36: World - A | C36: C41 | D36: =RC[19]/1000 -> 3782.3130000000001 | E36: 1055 | F36: 1638 | G36: 255312000 | N36: 8105000 | U36: 27495000 | W36: 3782313 | X36: 7775 | Y36: 7330 | Z36: 15105 | AA36: 394563885 | AB36: 575846079 | AC36: 4186425 | AD36: 155411 | AE36: 1463629 | AF36: 3019875 | AG36: 51822567 | AH36: 1031057871 | AI36: 846867504 | AJ36: 33095139 | AK36: 80372688 | AL36: 960335330 | AR36: =RC[-30]+RC[-29] -> 8105000 | AS36: =RC[-24]/RC[-23] -> #DIV/0! | AT36: =RC[-12]/RC[-23] -> 272.59982740719767 | AU36: =RC[-27]/RC[-43] -> 0 | AV36: =RC[-26]/RC[-44] -> 0 | AW36: =RC[-42]/RC[-45] -> 67501.552621372161 | AX36: =SUM(RC[-43]:RC[-37])/RC[-46] -> 67501.552621372161 | AY36: =RC[-39]/RC[-47] -> 0
A37: Korea | B37: World - A | C37: C40 | D37: =RC[19]/1000 -> 2413.145 | W37: 2413145 | AR37: =RC[-30]+RC[-29] -> 0 | AS37: =RC[-24]/RC[-23] -> #DIV/0! | AT37: =RC[-12]/RC[-23] -> 0 | AU37: =RC[-27]/RC[-43] -> 0 | AV37: =RC[-26]/RC[-44] -> 0 | AW37: =RC[-42]/RC[-45] -> 0 | AX37: =SUM(RC[-43]:RC[-37])/RC[-46] -> 0 | AY37: =RC[-39]/RC[-47] -> 0
A38: Canada | B38: World - A | C38: C51 | D38: =RC[19]/1000 -> 2030.395 | E38: 2739 | F38: 910 | G38: 75032608 | I38: 150814 | V38: 241138449 | W38: 2030395 | X38: 3130 | Y38: 6616 | Z38: 13349 | AA38: 313061342 | AB38: 67699552 | AC38: 0 | AD38: 0 | AE38: 0 | AF38: 0 | AG38: 101581118 | AH38: 482342012 | AI38: 445464796 | AJ38: 11008543 | AK38: 25868673 | AL38: 482342012 | AM38: 21883197 | AN38: 32864 | AO38: 1643472 | AP38: 261568 | AQ38: 23821101 | AR38: =RC[-30]+RC[-29] -> 0 | AS38: =RC[-24]/RC[-23] -> 0 | AT38: =RC[-12]/RC[-23] -> 237.56067760214145 | AU38: =RC[-27]/RC[-43] -> 0 | AV38: =RC[-26]/RC[-44] -> 118764.3039901103 | AW38: =RC[-42]/RC[-45] -> 36954.685172097059 | AX38: =SUM(RC[-43]:RC[-37])/RC[-46] -> 37028.963329795435 | AY38: =RC[-39]/RC[-47] -> 0
A39: New Zealand | B39: World - A | C39: C71 | D39: =RC[19]/1000 -> 169.55699999999999 | W39: 169557 | AR39: =RC[-30]+RC[-29] -> 0 | AS39: =RC[-24]/RC[-23] -> #DIV/0! | AT39: =RC[-12]/RC[-23] -> 0 | AU39: =RC[-27]/RC[-43] -> 0 | AV39: =RC[-26]/RC[-44] -> 0 | AW39: =RC[-42]/RC[-45] -> 0 | AX39: =SUM(RC[-43]:RC[-37])/RC[-46] -> 0 | AY39: =RC[-39]/RC[-47] -> 0
A40: Mexico | B40: World - B | C40: C72 | D40: =RC[19]/1000 -> 1454.825 | W40: 1454825 | AR40: =RC[-30]+RC[-29] -> 0 | AS40: =RC[-24]/RC[-23] -> #DIV/0! | AT40: =RC[-12]/RC[-23] -> 0 | AU40: =RC[-27]/RC[-43] -> 0 | AV40: =RC[-26]/RC[-44] -> 0 | AW40: =RC[-42]/RC[-45] -> 0 | AX40: =SUM(RC[-43]:RC[-37])/RC[-46] -> 0 | AY40: =RC[-39]/RC[-47] -> 0
A41: CEE - Total | B41: Totals | D41: =RC[19]/1000 -> 2302 | E41: 819 | F41: 2866 | G41: 125322044 | H41: 1148665 | I41: 1169809 | J41: 1280275 | K41: 4155692 | L41: 643013 | M41: 50640 | N41: 4045561 | O41: 61834 | P41: 7 | Q41: 25 | R41: 5360 | S41: 2152 | T41: 2292157 | U41: 49335492 | V41: 33487510 | W41: 2302000 | X41: 11089 | Y41: 4148 | Z41: 15237 | AA41: 15520339 | AB41: 28964183 | AC41: 502512 | AD41: 805366 | AE41: 1431944 | AF41: 3715124 | AG41: 17335157 | AH41: 68274624 | AI41: 62791488 | AJ41: 3271297 | AK41: 5198554 | AL41: 71261341 | AM41: 9571890 | AN41: 0 | AO41: 124295 | AP41: 5978017 | AQ41: 15674195 | AR41: =RC[-30]+RC[-29] -> 4107395 | AS41: =RC[-24]/RC[-23] -> 1.4732505343036852 | AT41: =RC[-12]/RC[-23] -> 29.658828844483057 | AU41: =RC[-27]/RC[-43] -> 995.72415291051254 | AV41: =RC[-26]/RC[-44] -> 14547.137271937445 | AW41: =RC[-42]/RC[-45] -> 54440.50564726325 | AX41: =SUM(RC[-43]:RC[-37])/RC[-46] -> 58110.39878366638 | AY41: =RC[-39]/RC[-47] -> 279.32797567332756
A42: EU - Total | B42: Totals | D42: =RC[19]/1000 -> 12609.978999999999 | E42: 3174 | F42: 6515 | G42: 450853255 | H42: 2582166 | I42: 3456232 | J42: 1607764 | K42: 57387957 | L42: 12824112 | M42: 267608 | N42: 15034063 | O42: 545847 | P42: 562 | Q42: 804 | R42: 114559 | S42: 56806 | T42: 11864485 | U42: 193208923 | V42: 379773799 | W42: 12609979 | X42: 20898 | Y42: 18746 | Z42: 39644 | AA42: 1029967919 | AB42: 674081036 | AC42: 18171259 | AD42: 1038368 | AE42: 11557200 | AF42: 1434909 | AG42: 255895187 | AH42: 1992145874 | AI42: 1625272334 | AJ42: 61085647 | AK42: 168093649 | AL42: 1854451627 | AM42: 45663094 | AN42: 96810 | AO42: 4841133 | AP42: 9839681 | AQ42: 60440719 | AR42: =RC[-30]+RC[-29] -> 15579910 | AS42: =RC[-24]/RC[-23] -> 0.50874737411782323 | AT42: =RC[-12]/RC[-23] -> 157.98169640092183 | AU42: =RC[-27]/RC[-43] -> 940.8806311255554 | AV42: =RC[-26]/RC[-44] -> 30116.925571406584 | AW42: =RC[-42]/RC[-45] -> 35753.688011692961 | AX42: =SUM(RC[-43]:RC[-37])/RC[-46] -> 41949.244641882433 | AY42: =RC[-39]/RC[-47] -> 1016.9812336721576
A43: EFTA - Total | B43: Totals | D43: =RC[19]/1000 -> 364 | E43: 253 | F43: 576 | G43: 28419766 | H43: 231095 | I43: 303073 | J43: 93508 | K43: 1273152 | L43: 303993 | M43: 20134 | N43: 888100 | O43: 23228 | P43: 22 | Q43: 31 | R43: 2285 | S43: 906 | T43: 311962 | U43: 7573982 | V43: 10689400 | W43: 364000 | X43: 1543 | Y43: 834 | Z43: 2349 | AA43: 47804842 | AB43: 31441222 | AC43: 0 | AD43: 0 | AE43: 0 | AF43: 0 | AG43: 11658663 | AH43: 90904726 | AI43: 87714205 | AJ43: 3190521 | AK43: 0 | AL43: 90904726 | AM43: 2377785 | AN43: 5042 | AO43: 252090 | AP43: 512373 | AQ43: 3147290 | AR43: =RC[-30]+RC[-29] -> 911328 | AS43: =RC[-24]/RC[-23] -> 0.70855071379123247 | AT43: =RC[-12]/RC[-23] -> 249.73825824175825 | AU43: =RC[-27]/RC[-43] -> 857.03846153846155 | AV43: =RC[-26]/RC[-44] -> 29366.483516483517 | AW43: =RC[-42]/RC[-45] -> 78076.280219780223 | AX43: =SUM(RC[-43]:RC[-37])/RC[-46] -> 84188.793956043955 | AY43: =RC[-39]/RC[-47] -> 835.14560439560444
A44: World A - Total | B44: Totals | D44: =RC[19]/1000 -> 25532.161 | E44: 8216 | F44: 14108 | G44: 1378509392 | H44: 8914828 | I44: 10523412 | J44: 7978434 | K44: 811120585 | L44: 70142766 | M44: 2914426 | N44: 37429613 | O44: 2643704 | P44: 36 | Q44: 54 | R44: 121521 | S44: 20454 | T44: 13643146 | U44: 309198810 | V44: 355546138 | W44: 25532161 | X44: 46127 | Y44: 88762 | Z44: 138492 | AA44: 2848008824 | AB44: 2329265267 | AC44: 6857397 | AD44: 254564 | AE44: 2397436 | AF44: 4946579 | AG44: 762181983 | AH44: 5953912049 | AI44: 4939581944 | AJ44: 186636290 | AK44: 452386721 | AL44: 5578604952 | AM44: 158494448 | AN44: 322485 | AO44: 16126798 | AP44: 29699153 | AQ44: 204642884 | AR44: =RC[-30]+RC[-29] -> 40073317 | AS44: =RC[-24]/RC[-23] -> 0.86964468729512678 | AT44: =RC[-12]/RC[-23] -> 233.19264080310319 | AU44: =RC[-27]/RC[-43] -> 534.35140096445423 | AV44: =RC[-26]/RC[-44] -> 13925.422842194987 | AW44: =RC[-42]/RC[-45] -> 53991.097424146748 | AX44: =SUM(RC[-43]:RC[-37])/RC[-46] -> 89694.869267039321 | AY44: =RC[-39]/RC[-47] -> 2747.2318539742873
A45: World B - Total | B45: Totals | D45: =RC[19]/1000 -> 2474.6060000000002 | E45: 379 | F45: 459 | G45: 35788554 | H45: 226703 | I45: 291229 | J45: 202891 | K45: 15859148 | L45: 1541690 | M45: 57921 | N45: 1036658 | O45: 60922 | P45: 22 | Q45: 31 | R45: 39197 | S45: 13987 | T45: 4400751 | U45: 90501370 | V45: 81769239 | W45: 2474606 | X45: 1388 | Y45: 2077 | Z45: 3465 | AA45: 2605073 | AB45: 4846581 | AC45: 41988 | AD45: 151740 | AE45: 239445 | AF45: 621228 | AG45: 2936077 | AH45: 11442131 | AI45: 10530423 | AJ45: 544045 | AK45: 882344 | AL45: 11956814 | AM45: 1643915 | AN45: 0 | AO45: 0 | AP45: 1048728 | AQ45: 2692643 | AR45: =RC[-30]+RC[-29] -> 1097580 | AS45: =RC[-24]/RC[-23] -> 1.1067899262215219 | AT45: =RC[-12]/RC[-23] -> 4.6238193069927087 | AU45: =RC[-27]/RC[-43] -> 1778.3643133492765 | AV45: =RC[-26]/RC[-44] -> 33043.336595805551 | AW45: =RC[-42]/RC[-45] -> 14462.324103311799 | AX45: =SUM(RC[-43]:RC[-37])/RC[-46] -> 21808.779256172496 | AY45: =RC[-39]/RC[-47] -> 623.00422774372964
A46: EU Accession Countries - Totals | B46: Totals | D46: =RC[19]/1000 -> 1613.8530000000001 | E46: 545 | F46: 2096 | G46: 87876842 | H46: 865898 | I46: 883685 | J46: 862415 | K46: 3233799 | L46: 356898 | M46: 36354 | N46: 2998120 | O46: 46566 | P46: 7 | Q46: 25 | R46: 3866 | S46: 1589 | T46: 1605727 | U46: 32495905 | V46: 23544336 | W46: 1613853 | X46: 7975 | Y46: 2827 | Z46: 10802 | AA46: 13586911 | AB46: 24315182 | AC46: 464114 | AD46: 634413 | AE46: 1159489 | AF46: 3021020 | AG46: 13999611 | AH46: 57180740 | AI46: 52628341 | AJ46: 2537598 | AK46: 4318939 | AL46: 59484880 | AM46: 7622666 | AN46: 150 | AO46: 131810 | AP46: 4713713 | AQ46: 12468332 | AR46: =RC[-30]+RC[-29] -> 3044686 | AS46: =RC[-24]/RC[-23] -> 1.380200528908524 | AT46: =RC[-12]/RC[-23] -> 35.431194786637938 | AU46: =RC[-27]/RC[-43] -> 994.9648450013724 | AV46: =RC[-26]/RC[-44] -> 14588.897501817079 | AW46: =RC[-42]/RC[-45] -> 54451.577683965021 | AX46: =SUM(RC[-43]:RC[-37])/RC[-46] -> 58317.511570136805 | AY46: =RC[-39]/RC[-47] -> 221.14653565101653

Sheet: 2001 Grossed
A1: Name | B1: Type | C1: Code | D1: Staff & Students '000s | E1: Libraries - Total Administrative Units | F1: Libraries - Service Points | G1: Collections - Books & Bound Periodicals | H1: Collections - Current Periodicals - Titles | I1: Collections - Current Periodicals - Subscriptions | J1: Collections - Manuscripts | K1: Collections - Microforms | L1: Collections - Audio-visual Materials | M1: Collections - CD-ROMs | N1: Additions - Books & Bound Periodicals | O1: Additions - Audio-visual Materials | P1: Facilities & Services - Percentage Stock on Open Access | Q1: Facilities & Services - Percentage Catalogue Records Automated | R1: Facilities & Services - Number of Workstations for users | S1: Facilities & Services - Number connected to the internet | T1: Use & Users - Registered Users | U1: Use & Users - Consultations | V1: Use & Users - Number of Visits | W1: Use & Users - Staff & Students | X1: Library Staff FTE - Trained Librarians | Y1: Library Staff FTE - Other Library Staff | Z1: Library Staff FTE - Total Staff | AA1: Recurrent Expenditure (Euros) - Staff | AB1: Recurrent Expenditure (Euros) - Acquisition of Stock | AC1: Recurrent Expenditure (Euros) - Electronic Information | AD1: Recurrent Expenditure (Euros) - Automation | AE1: Recurrent Expenditure (Euros) - Premises and Related Costs | AF1: Recurrent Expenditure (Euros) - New Buildings / Refurbishment | AG1: Recurrent Expenditure (Euros) - Other Expenditure | AH1: Recurrent Expenditure (Euros) - TOTAL EXPENDITURE | AI1: Income - Public Funding | AJ1: Income - Fees & Charges | AK1: Income - Other Income | AL1: Income - TOTAL INCOME | AM1: Capital Expenditure - New Buildings / Refurbishment | AN1: Capital Expenditure - Acquisition of Stock | AO1: Capital Expenditure - Automation | AP1: Capital Expenditure - Other Capital Expenditure | AQ1: Capital Expenditure - TOTAL CAPITAL PAYMENTS | AR1: Additions | AS1: Loans per visit | AT1: Cost per pop | AU1: Users per 1000 pop | AV1: visits per 1000 pop | AW1: Bookstock per 1000 pop | AX1: Total stock per 1000 pop | AY1: AV materials per 1000 pop
A2: Bulgaria | B2: CEE | C2: C1 | D2: =RC[19]/1000 -> 289 | E2: 84 | F2: 84 | G2: 8501798 | H2: 8198 | I2: 12444 | J2: 107543 | K2: 23792 | L2: 84101 | M2: 1358 | N2: 101846 | O2: 3634 | P2: 7 | Q2: 24 | R2: 398 | S2: 199 | T2: 200848 | U2: 5002065 | V2: 2813081 | W2: 289000 | X2: 496 | Y2: 312 | Z2: 808 | AA2: 951033 | AB2: 1319389 | AC2: 0 | AD2: 0 | AE2: 0 | AF2: 0 | AG2: 89817 | AH2: 2360239 | AI2: 1386130 | AJ2: 141230 | AK2: 832879 | AL2: 2360239 | AM2: 387269 | AN2: 0 | AO2: 19792 | AP2: 4648 | AQ2: 411709 | AR2: =RC[-30]+RC[-29] -> 105480 | AS2: =RC[-24]/RC[-23] -> 1.7781446748245073 | AT2: =RC[-12]/RC[-23] -> 8.1669169550173013 | AU2: =RC[-27]/RC[-43] -> 694.97577854671283 | AV2: =RC[-26]/RC[-44] -> 9733.8442906574401 | AW2: =RC[-42]/RC[-45] -> 29417.986159169552 | AX2: =SUM(RC[-43]:RC[-37])/RC[-46] -> 30239.564013840831 | AY2: =RC[-39]/RC[-47] -> 291.0069204152249
A3: Czech Republic | B3: CEE | C3: C2 | D3: =RC[19]/1000 -> 192 | E3: 80 | F3: 1081 | G3: 10704109 | H3: 21703 | I3: 18612 | J3: 43062 | K3: 13753 | L3: 38158 | M3: 30757 | N3: 266549 | O3: 2556 | P3: 7 | Q3: 24 | R3: 645 | S3: 232 | T3: 276163 | U3: 2178474 | V3: 4255805 | W3: 192000 | X3: 395 | Y3: 372 | Z3: 767 | AA3: 2673385 | AB3: 4761705 | AC3: 27514 | AD3: 149445 | AE3: 91067 | AF3: 407063 | AG3: 125270 | AH3: 8235449 | AI3: 6281402 | AJ3: 192879 | AK3: 1761168 | AL3: 8235449 | AM3: 1254459 | AN3: 0 | AO3: 64109 | AP3: 15058 | AQ3: 1333626 | AR3: =RC[-30]+RC[-29] -> 269105 | AS3: =RC[-24]/RC[-23] -> 0.51188294576466731 | AT3: =RC[-12]/RC[-23] -> 42.892963541666667 | AU3: =RC[-27]/RC[-43] -> 1438.3489583333333 | AV3: =RC[-26]/RC[-44] -> 22165.651041666668 | AW3: =RC[-42]/RC[-45] -> 55750.567708333336 | AX3: =SUM(RC[-43]:RC[-37])/RC[-46] -> 56615.385416666664 | AY3: =RC[-39]/RC[-47] -> 198.73958333333334
A4: Estonia | B4: CEE | C4: C3 | D4: =RC[19]/1000 -> 48 | E4: 23 | F4: 37 | G4: 7399469 | H4: 11565 | I4: 20099 | J4: 72773 | K4: 28166 | L4: 38818 | M4: 3712 | N4: 110337 | O4: 2304 | P4: 5 | Q4: 20 | R4: 271 | S4: 261 | T4: 84571 | U4: 1905991 | V4: 1550796 | W4: 48000 | X4: 527 | Y4: 51 | Z4: 578 | AA4: 2398155 | AB4: 1379407 | AC4: 302797 | AD4: 114234 | AE4: 236763 | AF4: 0 | AG4: 375264 | AH4: 4806620 | AI4: 4806620 | AJ4: 0 | AK4: 0 | AL4: 4806620 | AM4: 0 | AN4: 0 | AO4: 15664 | AP4: 80035 | AQ4: 95699 | AR4: =RC[-30]+RC[-29] -> 112641 | AS4: =RC[-24]/RC[-23] -> 1.2290404411669877 | AT4: =RC[-12]/RC[-23] -> 100.13791666666667 | AU4: =RC[-27]/RC[-43] -> 1761.8958333333333 | AV4: =RC[-26]/RC[-44] -> 32308.25 | AW4: =RC[-42]/RC[-45] -> 154155.60416666666 | AX4: =SUM(RC[-43]:RC[-37])/RC[-46] -> 157804.20833333334 | AY4: =RC[-39]/RC[-47] -> 808.70833333333337
A5: Hungary | B5: CEE | C5: C4 | D5: =RC[19]/1000 -> 214 | E5: 141 | F5: 401 | G5: 16366142 | H5: 26078 | I5: 32892 | J5: 796077 | K5: 5418049 | L5: 117905 | M5: 22354 | N5: 374994 | O5: 6380 | P5: 7 | Q5: 24 | R5: 506 | S5: 181 | T5: 284873 | U5: 4014677 | V5: 3788043 | W5: 214000 | X5: 1016 | Y5: 385 | Z5: 1401 | AA5: 4490076 | AB5: 8336805 | AC5: 40116 | AD5: 217899 | AE5: 132781 | AF5: 593518 | AG5: 632260 | AH5: 14443455 | AI5: 13565728 | AJ5: 517464 | AK5: 360263 | AL5: 14443455 | AM5: 1854027 | AN5: 0 | AO5: 94751 | AP5: 22253 | AQ5: 1971031 | AR5: =RC[-30]+RC[-29] -> 381374 | AS5: =RC[-24]/RC[-23] -> 1.0598287823026296 | AT5: =RC[-12]/RC[-23] -> 67.492780373831778 | AU5: =RC[-27]/RC[-43] -> 1331.1822429906542 | AV5: =RC[-26]/RC[-44] -> 17701.135514018693 | AW5: =RC[-42]/RC[-45] -> 76477.299065420564 | AX5: =SUM(RC[-43]:RC[-37])/RC[-46] -> 106446.2476635514 | AY5: =RC[-39]/RC[-47] -> 550.95794392523362
A6: Latvia | B6: CEE | C6: C5 | D6: =RC[19]/1000 -> 61 | E6: 31 | F6: 31 | G6: 5631479 | H6: 5848 | I6: 5937 | J6: 25362 | K6: 139070 | L6: 4085 | M6: 487 | N6: 134553 | O6: 1179 | P6: 7 | Q6: 24 | R6: 113 | S6: 38 | T6: 94467 | U6: 4209082 | V6: 1976819 | W6: 61000 | X6: 378 | Y6: 27 | Z6: 405 | AA6: 1106524 | AB6: 1023219 | AC6: 0 | AD6: 0 | AE6: 0 | AF6: 0 | AG6: 252124 | AH6: 2381867 | AI6: 1283798 | AJ6: 0 | AK6: 954612 | AL6: 2238410 | AM6: 506776 | AN6: 0 | AO6: 25899 | AP6: 6083 | AQ6: 538758 | AR6: =RC[-30]+RC[-29] -> 135732 | AS6: =RC[-24]/RC[-23] -> 2.1292197211783175 | AT6: =RC[-12]/RC[-23] -> 39.046999999999997 | AU6: =RC[-27]/RC[-43] -> 1548.639344262295 | AV6: =RC[-26]/RC[-44] -> 32406.868852459018 | AW6: =RC[-42]/RC[-45] -> 92319.327868852459 | AX6: =SUM(RC[-43]:RC[-37])/RC[-46] -> 95283.081967213118 | AY6: =RC[-39]/RC[-47] -> 66.967213114754102
A7: Lithuania | B7: CEE | C7: C6 | D7: =RC[19]/1000 -> 97 | E7: 15 | F7: 106 | G7: 10977183 | H7: 4000 | I7: 5000 | J7: 248300 | K7: 26764 | L7: 37250 | M7: 3625 | N7: 174036 | O7: 852 | P7: 4 | Q7: 3 | R7: 298 | S7: 298 | T7: 118445 | U7: 8134682 | V7: 4520707 | W7: 97000 | X7: 594 | Y7: 92 | Z7: 686 | AA7: 1856644 | AB7: 787172 | AC7: 0 | AD7: 94213 | AE7: 0 | AF7: 0 | AG7: 344466 | AH7: 3082495 | AI7: 2440386 | AJ7: 324443 | AK7: 293871 | AL7: 3058700 | AM7: 440651 | AN7: 0 | AO7: 22520 | AP7: 5289 | AQ7: 468460 | AR7: =RC[-30]+RC[-29] -> 174888 | AS7: =RC[-24]/RC[-23] -> 1.7994269480415341 | AT7: =RC[-12]/RC[-23] -> 31.778298969072164 | AU7: =RC[-27]/RC[-43] -> 1221.0824742268042 | AV7: =RC[-26]/RC[-44] -> 46605.226804123711 | AW7: =RC[-42]/RC[-45] -> 113166.8350515464 | AX7: =SUM(RC[-43]:RC[-37])/RC[-46] -> 116516.72164948453 | AY7: =RC[-39]/RC[-47] -> 384.02061855670104
A8: Poland | B8: CEE | C8: C7 | D8: =RC[19]/1000 -> 796 | E8: 272 | F8: 507 | G8: 33263503 | H8: 761757 | I8: 761988 | J8: 272749 | K8: 1656530 | L8: 162765 | M8: 9223 | N8: 1828594 | O8: 14397 | P8: 13 | Q8: 45 | R8: 1881 | S8: 671 | T8: 668208 | U8: 11593575 | V8: 7497180 | W8: 796000 | X8: 4910 | Y8: 1639 | Z8: 6549 | AA8: 11210209 | AB8: 15806310 | AC8: 115372 | AD8: 626663 | AE8: 381871 | AF8: 1706924 | AG8: 4917790 | AH8: 34765139 | AI8: 26516321 | AJ8: 814219 | AK8: 7434599 | AL8: 34765139 | AM8: 5190222 | AN8: 0 | AO8: 265247 | AP8: 62300 | AQ8: 5517769 | AR8: =RC[-30]+RC[-29] -> 1842991 | AS8: =RC[-24]/RC[-23] -> 1.5463914431826367 | AT8: =RC[-12]/RC[-23] -> 43.674797738693471 | AU8: =RC[-27]/RC[-43] -> 839.4572864321608 | AV8: =RC[-26]/RC[-44] -> 9418.5678391959791 | AW8: =RC[-42]/RC[-45] -> 41788.320351758797 | AX8: =SUM(RC[-43]:RC[-37])/RC[-46] -> 46342.355527638189 | AY8: =RC[-39]/RC[-47] -> 204.4786432160804
A9: Romania | B9: CEE | C9: C8 | D9: =RC[19]/1000 -> 438 | E9: 199 | F9: 721 | G9: 30068856 | H9: 281659 | I9: 286013 | J9: 323105 | K9: 856117 | L9: 257986 | M9: 14591 | N9: 1021094 | O9: 13527 | P9: 7 | Q9: 24 | R9: 1309 | S9: 436 | T9: 548092 | U9: 12140209 | V9: 8643473 | W9: 438000 | X9: 2656 | Y9: 999 | Z9: 3655 | AA9: 6382567 | AB9: 8999371 | AC9: 65688 | AD9: 356793 | AE9: 217419 | AF9: 971843 | AG9: 2799958 | AH9: 19793639 | AI9: 15097149 | AJ9: 463578 | AK9: 4232912 | AL9: 19793639 | AM9: 2855926 | AN9: 0 | AO9: 145952 | AP9: 34281 | AQ9: 3036159 | AR9: =RC[-30]+RC[-29] -> 1034621 | AS9: =RC[-24]/RC[-23] -> 1.4045521979417301 | AT9: =RC[-12]/RC[-23] -> 45.190956621004567 | AU9: =RC[-27]/RC[-43] -> 1251.3515981735161 | AV9: =RC[-26]/RC[-44] -> 19733.956621004567 | AW9: =RC[-42]/RC[-45] -> 68650.356164383556 | AX9: =SUM(RC[-43]:RC[-37])/RC[-46] -> 73261.020547945212 | AY9: =RC[-39]/RC[-47] -> 589.0091324200913
A10: Slovak Rep | B10: CEE | C10: C9 | D10: =RC[19]/1000 -> 112 | E10: 35 | F10: 568 | G10: 4670126 | H10: 7534 | I10: 9231 | J10: 67849 | K10: 137847 | L10: 73725 | M10: 1130 | N10: 98198 | O10: 568 | P10: 7 | Q10: 24 | R10: 1094 | S10: 896 | T10: 142344 | U10: 2706702 | V10: 1045163 | W10: 112000 | X10: 254 | Y10: 244 | Z10: 498 | AA10: 1189740 | AB10: 960166 | AC10: 0 | AD10: 0 | AE10: 89466 | AF10: 0 | AG10: 385251 | AH10: 2624623 | AI10: 2496700 | AJ10: 34423 | AK10: 0 | AL10: 2531123 | AM10: 227232 | AN10: 0 | AO10: 140400 | AP10: 0 | AQ10: 367632 | AR10: =RC[-30]+RC[-29] -> 98766 | AS10: =RC[-24]/RC[-23] -> 2.5897415044351932 | AT10: =RC[-12]/RC[-23] -> 23.434133928571427 | AU10: =RC[-27]/RC[-43] -> 1270.9285714285713 | AV10: =RC[-26]/RC[-44] -> 9331.8125 | AW10: =RC[-42]/RC[-45] -> 41697.553571428572 | AX10: =SUM(RC[-43]:RC[-37])/RC[-46] -> 44352.160714285717 | AY10: =RC[-39]/RC[-47] -> 658.25892857142856
A11: Slovenia | B11: CEE | C11: C10 | D11: =RC[19]/1000 -> 55 | E11: 54 | F11: 79 | G11: 4151409 | H11: 14489 | I11: 16234 | J11: 3406 | K11: 411780 | L11: 38047 | M11: 1394 | N11: 118375 | O11: 12372 | P11: 7 | Q11: 44 | R11: 314 | S11: 299 | T11: 135425 | U11: 3263696 | V11: 1512745 | W11: 55000 | X11: 263 | Y11: 93 | Z11: 356 | AA11: 1005555 | AB11: 4009447 | AC11: 14203 | AD11: 77143 | AE11: 47009 | AF11: 210125 | AG11: 3811444 | AH11: 9174926 | AI11: 5917186 | AJ11: 172832 | AK11: 3084908 | AL11: 9174926 | AM11: 1402690 | AN11: 0 | AO11: 71684 | AP11: 16838 | AQ11: 1491212 | AR11: =RC[-30]+RC[-29] -> 130747 | AS11: =RC[-24]/RC[-23] -> 2.1574660633484162 | AT11: =RC[-12]/RC[-23] -> 166.81683636363636 | AU11: =RC[-27]/RC[-43] -> 2462.2727272727275 | AV11: =RC[-26]/RC[-44] -> 27504.454545454544 | AW11: =RC[-42]/RC[-45] -> 75480.163636363635 | AX11: =SUM(RC[-43]:RC[-37])/RC[-46] -> 84304.709090909091 | AY11: =RC[-39]/RC[-47] -> 691.76363636363635
A12: Austria | B12: EU | C12: C11 | D12: =RC[19]/1000 -> 269 | E12: 20 | F12: 39 | G12: 17573390 | H12: 13954 | I12: 61565 | J12: 46584 | K12: 1452195 | L12: 279258 | M12: 1802 | N12: 456661 | O12: 15371 | P12: 36 | Q12: 54 | R12: 2985 | S12: 1023 | T12: 233649 | U12: 3650183 | V12: 5513310 | W12: 269000 | X12: 552 | Y12: 389 | Z12: 941 | AA12: 29650270 | AB12: 17934796 | AC12: 1429166 | AD12: 29573 | AE12: 124115 | AF12: 605343 | AG12: 6984315 | AH12: 56757578 | AI12: 49684386 | AJ12: 2332970 | AK12: 4740222 | AL12: 56757578 | AM12: 1793944 | AN12: 27926 | AO12: 105311 | AP12: 338168 | AQ12: 2265349 | AR12: =RC[-30]+RC[-29] -> 472032 | AS12: =RC[-24]/RC[-23] -> 0.66206743317535199 | AT12: =RC[-12]/RC[-23] -> 210.99471375464685 | AU12: =RC[-27]/RC[-43] -> 868.58364312267656 | AV12: =RC[-26]/RC[-44] -> 20495.576208178438 | AW12: =RC[-42]/RC[-45] -> 65328.587360594793 | AX12: =SUM(RC[-43]:RC[-37])/RC[-46] -> 72225.828996282522 | AY12: =RC[-39]/RC[-47] -> 1038.1338289962825
A13: België Nederlandstalige Universiteiten | B13: België Nederlandstalige Universiteiten | C13: C12a | D13: 58.777000000000001 | E13: 41 | F13: 317 | G13: 9925746 | H13: 42654 | I13: 14074 | J13: 115 | K13: 1000 | L13: 9068 | M13: 2028 | N13: 179054 | O13: 210 | P13: 48 | Q13: 60 | R13: 354 | T13: 106123 | U13: 666128 | V13: 1071148 | W13: 58777 | X13: 116 | Y13: 191 | Z13: 307 | AA13: 8375210 | AB13: 5472894 | AC13: 1948575 | AD13: 375538 | AE13: 112271 | AF13: 13758 | AG13: 361682 | AH13: 16659928 | AI13: 5971614 | AJ13: 98259 | AK13: 98414 | AL13: 6108793 | AM13: 0 | AN13: 0 | AO13: 88939 | AP13: 0 | AQ13: 88939 | AR13: 179264 | AS13: =RC[-24]/RC[-23] -> 0.62188231691605644 | AT13: =RC[-12]/RC[-23] -> 283.44297939670281 | AU13: =RC[-27]/RC[-43] -> 1805.5191656600371 | AV13: =RC[-26]/RC[-44] -> 18223.931129523451 | AW13: =RC[-42]/RC[-45] -> 168871.25916600029 | AX13: =SUM(RC[-43]:RC[-37])/RC[-46] -> 170044.14992258875 | AY13: =RC[-39]/RC[-47] -> 154.27803392483455
A14: Belgique universités francophones | B14: Belgique universités francophones | C14: C12b | D14: 74.457999999999998 | G14: 9057965 | H14: 29979 | I14: 20837 | J14: 1135 | K14: 279897 | L14: 11873 | M14: 1193 | N14: 128821 | O14: 1511 | P14: 46 | Q14: 56 | R14: 423 | T14: 63788 | U14: 460619 | V14: 3062634 | W14: 74458 | X14: 124 | Y14: 179 | Z14: 301 | AA14: 7062183 | AB14: 7195308 | AC14: 771134 | AD14: 279846 | AE14: 772490 | AF14: 0 | AG14: 346279 | AH14: 16427240 | AI14: 6715288 | AJ14: 394456 | AK14: 439313 | AL14: 7207068 | AM14: 0 | AN14: 68369 | AO14: 48691 | AP14: 0 | AQ14: 117060 | AR14: 130332 | AS14: =RC[-24]/RC[-23] -> 0.15039962333076692 | AT14: =RC[-12]/RC[-23] -> 220.62424454054636 | AU14: =RC[-27]/RC[-43] -> 856.69773563619765 | AV14: =RC[-26]/RC[-44] -> 41132.369926670071 | AW14: =RC[-42]/RC[-45] -> 121652.00515726987 | AX14: =SUM(RC[-43]:RC[-37])/RC[-46] -> 126284.33479276908 | AY14: =RC[-39]/RC[-47] -> 159.45902387923394
A15: Belgium | B15: EU | C15: C12 | D15: =RC[19]/1000 -> 133.23500000000001 | E15: 72 | F15: 47 | G15: 18983711 | H15: 72633 | I15: 34911 | J15: 1250 | K15: 280897 | L15: 20941 | M15: 3221 | N15: 307875 | O15: 1721 | P15: 46 | Q15: 56 | R15: 777 | S15: 215 | T15: 169911 | U15: 1126747 | V15: 4133782 | W15: 133235 | X15: 240 | Y15: 369 | Z15: 609 | AA15: 15437393 | AB15: 12668202 | AC15: 2719709 | AD15: 655384 | AE15: 884761 | AF15: 13758 | AG15: 707961 | AH15: 33087168 | AI15: 26002762 | AJ15: 492716 | AK15: 537726 | AL15: 27033204 | AM15: 68369 | AN15: 137630 | AO15: 0 | AP15: 0 | AQ15: 205999 | AR15: =RC[-30]+RC[-29] -> 309596 | AS15: =RC[-24]/RC[-23] -> 0.27257049355771545 | AT15: =RC[-12]/RC[-23] -> 248.33690846999662 | AU15: =RC[-27]/RC[-43] -> 1275.2730138477125 | AV15: =RC[-26]/RC[-44] -> 31026.246857057078 | AW15: =RC[-42]/RC[-45] -> 142482.913648816 | AX15: =SUM(RC[-43]:RC[-37])/RC[-46] -> 145589.10196269749 | AY15: =RC[-39]/RC[-47] -> 157.17341539385296
A16: Denmark | B16: EU | C16: C13 | D16: =RC[19]/1000 -> 180 | E16: 19 | F16: 40 | G16: 10698685 | H16: 74100 | I16: 94344 | J16: 95140 | K16: 1220634 | L16: 883224 | M16: 36856 | N16: 255661 | O16: 28595 | P16: 20 | Q16: 54 | R16: 932 | S16: 296 | T16: 156651 | U16: 5085626 | V16: 5110253 | W16: 180000 | X16: 427 | Y16: 472 | Z16: 899 | AA16: 38129876 | AB16: 19659084 | AC16: 0 | AD16: 0 | AE16: 0 | AF16: 550806 | AG16: 10882096 | AH16: 69221863 | AI16: 69221863 | AJ16: 0 | AK16: 0 | AL16: 69221863 | AM16: 2680041 | AN16: 0 | AO16: 0 | AP16: 0 | AQ16: 2680041 | AR16: =RC[-30]+RC[-29] -> 284256 | AS16: =RC[-24]/RC[-23] -> 0.99518086482215262 | AT16: =RC[-12]/RC[-23] -> 384.56590555555556 | AU16: =RC[-27]/RC[-43] -> 870.2833333333333 | AV16: =RC[-26]/RC[-44] -> 28390.294444444444 | AW16: =RC[-42]/RC[-45] -> 59437.138888888891 | AX16: =SUM(RC[-43]:RC[-37])/RC[-46] -> 72794.350000000006 | AY16: =RC[-39]/RC[-47] -> 4906.8
A17: Eire | B17: EU | C17: C15 | D17: =RC[19]/1000 -> 137 | E17: 46 | F17: 74 | G17: 8504000 | H17: 61000 | I17: 85214 | J17: 23745 | K17: 740212 | L17: 196016 | M17: 3600 | N17: 261000 | O17: 8375 | P17: 36 | Q17: 54 | R17: 1627 | S17: 542 | T17: 118894 | U17: 3265858 | V17: 4152796 | W17: 137000 | X17: 250 | Y17: 500 | Z17: 750 | AA17: 15063180 | AB17: 9111386 | AC17: 726057 | AD17: 15024 | AE17: 63053 | AF17: 307531 | AG17: 3548231 | AH17: 28834462 | AI17: 25241078 | AJ17: 1185214 | AK17: 2408170 | AL17: 28834462 | AM17: 913644 | AN17: 14223 | AO17: 53634 | AP17: 172227 | AQ17: 1153728 | AR17: =RC[-30]+RC[-29] -> 269375 | AS17: =RC[-24]/RC[-23] -> 0.786423893685122 | AT17: =RC[-12]/RC[-23] -> 210.47052554744525 | AU17: =RC[-27]/RC[-43] -> 867.83941605839414 | AV17: =RC[-26]/RC[-44] -> 30312.379562043796 | AW17: =RC[-42]/RC[-45] -> 62072.992700729927 | AX17: =SUM(RC[-43]:RC[-37])/RC[-46] -> 70173.62773722627 | AY17: =RC[-39]/RC[-47] -> 1430.7737226277372
A18: Finland | B18: EU | C18: C16 | D18: =RC[19]/1000 -> 224 | E18: 48 | F18: 457 | G18: 15572434 | H18: 237807 | I18: 382625 | J18: 262463 | K18: 1251223 | L18: 325048 | M18: 32569 | N18: 610881 | O18: 15112 | P18: 45 | Q18: 54 | R18: 3396 | S18: 2426 | T18: 265729 | U18: 13617288 | V18: 16882610 | W18: 224000 | X18: 1310 | Y18: 138 | Z18: 1448 | AA18: 39607466 | AB18: 22543220 | AC18: 0 | AD18: 0 | AE18: 0 | AF18: 3528953 | AG18: 10987011 | AH18: 76666650 | AI18: 62922332 | AJ18: 5513940 | AK18: 4788563 | AL18: 73224835 | AM18: 2333094 | AN18: 36319 | AO18: 136960 | AP18: 439802 | AQ18: 2946175 | AR18: =RC[-30]+RC[-29] -> 625993 | AS18: =RC[-24]/RC[-23] -> 0.80658665929024009 | AT18: =RC[-12]/RC[-23] -> 342.26183035714286 | AU18: =RC[-27]/RC[-43] -> 1186.2901785714287 | AV18: =RC[-26]/RC[-44] -> 75368.794642857145 | AW18: =RC[-42]/RC[-45] -> 69519.794642857145 | AX18: =SUM(RC[-43]:RC[-37])/RC[-46] -> 80643.611607142855 | AY18: =RC[-39]/RC[-47] -> 1451.1071428571429
A19: France | B19: EU | C19: C17 | D19: =RC[19]/1000 -> 2278 | E19: 95 | F19: 396 | G19: 25684360 | H19: 152995 | I19: 214826 | J19: 359579 | K19: 1384057 | L19: 97296 | M19: 44108 | N19: 1008519 | O19: 125955 | P19: 35 | Q19: 54 | R19: 24456 | S19: 9010 | T19: 1344536 | U19: 13048777 | V19: 52900392 | W19: 2278000 | X19: 1812 | Y19: 2552 | Z19: 4364 | AA19: 167287948 | AB19: 60509187 | AC19: 5924182 | AD19: 0 | AE19: 0 | AF19: 0 | AG19: 68159578 | AH19: 301880895 | AI19: 285222928 | AJ19: 8495252 | AK19: 8162715 | AL19: 301880895 | AM19: 9837452 | AN19: 153140 | AO19: 577490 | AP19: 1854417 | AQ19: 12422499 | AR19: =RC[-30]+RC[-29] -> 1134474 | AS19: =RC[-24]/RC[-23] -> 0.24666692450974653 | AT19: =RC[-12]/RC[-23] -> 132.52014705882354 | AU19: =RC[-27]/RC[-43] -> 590.22651448639158 | AV19: =RC[-26]/RC[-44] -> 23222.296751536436 | AW19: =RC[-42]/RC[-45] -> 11274.960491659351 | AX19: =SUM(RC[-43]:RC[-37])/RC[-46] -> 12263.924934152765 | AY19: =RC[-39]/RC[-47] -> 42.711150131694467
A20: Greece | B20: EU | C20: C18 | D20: =RC[19]/1000 -> 347 | E20: 82 | F20: 180 | G20: 5683287 | H20: 61430 | I20: 36200 | J20: 29790 | K20: 25338 | L20: 22796 | M20: 18726 | N20: 296750 | O20: 1439 | P20: 95 | Q20: 49 | R20: 1660 | S20: 553 | T20: 402192 | U20: 1415696 | V20: 4235852 | W20: 347000 | X20: 728 | Y20: 395 | Z20: 1123 | AA20: 4055275 | AB20: 14572579 | AC20: 696828 | AD20: 126795 | AE20: 0 | AF20: 948625 | AG20: 3944656 | AH20: 24344758 | AI20: 13660012 | AJ20: 10500572 | AK20: 184174 | AL20: 24344758 | AM20: 867962 | AN20: 13511 | AO20: 50952 | AP20: 163616 | AQ20: 1096041 | AR20: =RC[-30]+RC[-29] -> 298189 | AS20: =RC[-24]/RC[-23] -> 0.33421753167957707 | AT20: =RC[-12]/RC[-23] -> 70.157804034582128 | AU20: =RC[-27]/RC[-43] -> 1159.0547550432277 | AV20: =RC[-26]/RC[-44] -> 12207.066282420748 | AW20: =RC[-42]/RC[-45] -> 16378.34870317003 | AX20: =SUM(RC[-43]:RC[-37])/RC[-46] -> 16938.233429394812 | AY20: =RC[-39]/RC[-47] -> 65.694524495677229
A21: Iceland | B21: EFTA | C21: C19 | D21: =RC[19]/1000 -> 8 | E21: 6 | F21: 13 | G21: 671662 | H21: 4969 | I21: 6079 | J21: 2187 | K21: 30293 | L21: 7207 | M21: 573 | N21: 20390 | O21: 422 | P21: 22 | Q21: 30 | R21: 70 | S21: 25 | T21: 7324 | U21: 186235 | V21: 217837 | W21: 8000 | X21: 35 | Y21: 19 | Z21: 54 | AA21: 1484979 | AB21: 766395 | AC21: 0 | AD21: 0 | AE21: 0 | AF21: 0 | AG21: 460796 | AH21: 2712170 | AI21: 2583684 | AJ21: 128486 | AK21: 0 | AL21: 2712170 | AM21: 86178 | AN21: 1342 | AO21: 5058 | AP21: 16245 | AQ21: 108823 | AR21: =RC[-30]+RC[-29] -> 20812 | AS21: =RC[-24]/RC[-23] -> 0.85492822615074571 | AT21: =RC[-12]/RC[-23] -> 339.02125000000001 | AU21: =RC[-27]/RC[-43] -> 915.5 | AV21: =RC[-26]/RC[-44] -> 27229.625 | AW21: =RC[-42]/RC[-45] -> 83957.75 | AX21: =SUM(RC[-43]:RC[-37])/RC[-46] -> 90371.25 | AY21: =RC[-39]/RC[-47] -> 900.875
A22: Italy | B22: EU | C22: C20 | D22: =RC[19]/1000 -> 1852 | E22: 1514 | F22: 2020 | G22: 39280920 | H22: 243411 | I22: 316853 | J22: 430260 | K22: 1496820 | L22: 2141553 | M22: 37371 | N22: 2805780 | O22: 117879 | P22: 36 | Q22: 54 | R22: 22888 | S22: 8023 | T22: 1035944 | U22: 5648382 | V22: 19316000 | W22: 1852000 | X22: 1723 | Y22: 2004 | Z22: 6532 | AA22: 203627804 | AB22: 123169979 | AC22: 9815021 | AD22: 203095 | AE22: 852375 | AF22: 4157287 | AG22: 47965860 | AH22: 389791421 | AI22: 341215177 | AJ22: 16022031 | AK22: 32554213 | AL22: 389791421 | AM22: 12350868 | AN22: 192267 | AO22: 725036 | AP22: 2328210 | AQ22: 15596381 | AR22: =RC[-30]+RC[-29] -> 2923659 | AS22: =RC[-24]/RC[-23] -> 0.29241985918409608 | AT22: =RC[-12]/RC[-23] -> 210.47052969762419 | AU22: =RC[-27]/RC[-43] -> 559.36501079913603 | AV22: =RC[-26]/RC[-44] -> 10429.805615550757 | AW22: =RC[-42]/RC[-45] -> 21210 | AX22: =SUM(RC[-43]:RC[-37])/RC[-46] -> 23729.583153347732 | AY22: =RC[-39]/RC[-47] -> 1156.3461123110151
A23: Liechtenstein | B23: EFTA | C23: C21 | D23: =RC[19]/1000 -> 1 | E23: 1 | F23: 2 | G23: 76657 | H23: 765 | I23: 935 | J23: 249 | K23: 3458 | L23: 870 | M23: 88 | N23: 2327 | O23: 52 | P23: 22 | Q23: 30 | R23: 7 | S23: 2 | T23: 883 | U23: 22447 | V23: 26257 | W23: 1000 | X23: 3 | Y23: 2 | Z23: 5 | AA23: 185623 | AB23: 95800 | AC23: 0 | AD23: 0 | AE23: 0 | AF23: 0 | AG23: 57598 | AH23: 339021 | AI23: 322961 | AJ23: 16061 | AK23: -1 | AL23: 339021 | AM23: 10772 | AN23: 168 | AO23: 633 | AP23: 2030 | AQ23: 13603 | AR23: =RC[-30]+RC[-29] -> 2379 | AS23: =RC[-24]/RC[-23] -> 0.85489583730052943 | AT23: =RC[-12]/RC[-23] -> 339.02100000000002 | AU23: =RC[-27]/RC[-43] -> 883 | AV23: =RC[-26]/RC[-44] -> 26257 | AW23: =RC[-42]/RC[-45] -> 76657 | AX23: =SUM(RC[-43]:RC[-37])/RC[-46] -> 83022 | AY23: =RC[-39]/RC[-47] -> 870
A24: Luxembourg | B24: EU | C24: C22 | D24: =RC[19]/1000 -> 2.9990000000000001 | E24: 6 | F24: 6 | G24: 469000 | H24: 1650 | I24: 770 | J24: 10 | K24: 5 | L24: 3200 | M24: 184 | N24: 3800 | O24: 120 | P24: 83 | Q24: 41 | R24: 38 | S24: 30 | T24: 13837 | U24: 248939 | V24: 481389 | W24: 2999 | X24: 5 | Y24: 5 | Z24: 9 | AA24: 303856 | AB24: 233335 | AC24: 17967 | AD24: 151 | AE24: 1425 | AF24: 8928 | AG24: 67651 | AH24: 633313 | AI24: 563959 | AJ24: 0 | AK24: 69354 | AL24: 633313 | AM24: 9906 | AN24: 154 | AO24: 581 | AP24: 1868 | AQ24: 12509 | AR24: =RC[-30]+RC[-29] -> 3920 | AS24: =RC[-24]/RC[-23] -> 0.51712648190964061 | AT24: =RC[-12]/RC[-23] -> 211.17472490830278 | AU24: =RC[-27]/RC[-43] -> 4613.8712904301428 | AV24: =RC[-26]/RC[-44] -> 160516.50550183395 | AW24: =RC[-42]/RC[-45] -> 156385.46182060687 | AX24: =SUM(RC[-43]:RC[-37])/RC[-46] -> 158325.77525841945 | AY24: =RC[-39]/RC[-47] -> 1067.02234078026
A25: Netherlands | B25: EU | C25: C23 | D25: =RC[19]/1000 -> 540 | E25: 23 | F25: 138 | G25: 25084875 | H25: 152742 | I25: 161182 | J25: 103146 | K25: 5797711 | L25: 662326 | M25: 7736 | N25: 686980 | O25: 36457 | P25: 36 | Q25: 54 | R25: 7079 | S25: 2655 | T25: 554154 | U25: 4162863 | V25: 18077577 | W25: 540000 | X25: 868 | Y25: 1002 | Z25: 1870 | AA25: 59373118 | AB25: 35913493 | AC25: 2861832 | AD25: 59218 | AE25: 248533 | AF25: 1212168 | AG25: 13985724 | AH25: 113654086 | AI25: 99490386 | AJ25: 4671651 | AK25: 9492049 | AL25: 113654086 | AM25: 3601224 | AN25: 56061 | AO25: 211403 | AP25: 678852 | AQ25: 4547540 | AR25: =RC[-30]+RC[-29] -> 723437 | AS25: =RC[-24]/RC[-23] -> 0.23027770812426909 | AT25: =RC[-12]/RC[-23] -> 210.47052962962962 | AU25: =RC[-27]/RC[-43] -> 1026.2111111111112 | AV25: =RC[-26]/RC[-44] -> 33476.994444444441 | AW25: =RC[-42]/RC[-45] -> 46453.472222222219 | AX25: =SUM(RC[-43]:RC[-37])/RC[-46] -> 59203.181481481479 | AY25: =RC[-39]/RC[-47] -> 1226.5296296296297
A26: Norway | B26: EFTA | C26: C24 | D26: =RC[19]/1000 -> 194 | E26: 85 | F26: 186 | G26: 12847148 | H26: 86079 | I26: 129643 | J26: 49356 | K26: 442477 | L26: 115851 | M26: 8422 | N26: 291236 | O26: 5151 | P26: 21 | Q26: 32 | R26: 1140 | S26: 424 | T26: 125315 | U26: 2688468 | V26: 5376936 | W26: 194000 | X26: 619 | Y26: 346 | Z26: 964 | AA26: 38591900 | AB26: 21176919 | AC26: 0 | AD26: 0 | AE26: 0 | AF26: 0 | AG26: 17201698 | AH26: 76970517 | AI26: 62407529 | AJ26: 8521543 | AK26: 0 | AL26: 70929072 | AM26: 2089824 | AN26: 32532 | AO26: 122679 | AP26: 393946 | AQ26: 2638981 | AR26: =RC[-30]+RC[-29] -> 296387 | AS26: =RC[-24]/RC[-23] -> 0.5 | AT26: =RC[-12]/RC[-23] -> 396.75524226804123 | AU26: =RC[-27]/RC[-43] -> 645.95360824742272 | AV26: =RC[-26]/RC[-44] -> 27716.164948453606 | AW26: =RC[-42]/RC[-45] -> 66222.412371134022 | AX26: =SUM(RC[-43]:RC[-37])/RC[-46] -> 70510.18556701031 | AY26: =RC[-39]/RC[-47] -> 597.17010309278351
A27: Portugal | B27: EU | C27: C25 | D27: =RC[19]/1000 -> 325 | E27: 230 | F27: 230 | G27: 8616219 | H27: 99940 | I27: 154155 | J27: 14149 | K27: 47946 | L27: 144852 | M27: 12895 | N27: 333379 | O27: 9748 | P27: 36 | Q27: 54 | R27: 484 | S27: 146 | T27: 1106067 | U27: 1615393 | V27: 10534730 | W27: 325000 | X27: 829 | Y27: 470 | Z27: 1215 | AA27: 7048520 | AB27: 10692942 | AC27: 0 | AD27: 0 | AE27: 0 | AF27: 0 | AG27: 1519291 | AH27: 19260753 | AI27: 17669449 | AJ27: 525356 | AK27: 1065948 | AL27: 19260753 | AM27: 12126 | AN27: 0 | AO27: 0 | AP27: 457209 | AQ27: 469335 | AR27: =RC[-30]+RC[-29] -> 343127 | AS27: =RC[-24]/RC[-23] -> 0.15333976286055742 | AT27: =RC[-12]/RC[-23] -> 59.263855384615383 | AU27: =RC[-27]/RC[-43] -> 3403.2830769230768 | AV27: =RC[-26]/RC[-44] -> 32414.553846153845 | AW27: =RC[-42]/RC[-45] -> 26511.443076923078 | AX27: =SUM(RC[-43]:RC[-37])/RC[-46] -> 27969.710769230769 | AY27: =RC[-39]/RC[-47] -> 445.69846153846152
A28: Spain | B28: EU | C28: C26 | D28: =RC[19]/1000 -> 1680 | E28: 610 | F28: 1007 | G28: 29482682 | H28: 234938 | I28: 632303 | J28: 41839 | K28: 1635186 | L28: 1038741 | M28: 71863 | N28: 1371270 | O28: 77635 | P28: 36 | Q28: 54 | R28: 17051 | S28: 6282 | T28: 3805781 | U28: 14251982 | V28: 51875328 | W28: 1680000 | X28: 5874 | Y28: 1556 | Z28: 7430 | AA28: 122788945 | AB28: 79317863 | AC28: 0 | AD28: 0 | AE28: 0 | AF28: 0 | AG28: 10218365 | AH28: 212325173 | AI28: 181396888 | AJ28: 9628756 | AK28: 21299529 | AL28: 212325173 | AM28: 6755195 | AN28: 105158 | AO28: 396552 | AP28: 1273393 | AQ28: 8530298 | AR28: =RC[-30]+RC[-29] -> 1448905 | AS28: =RC[-24]/RC[-23] -> 0.27473526528834669 | AT28: =RC[-12]/RC[-23] -> 126.38403154761905 | AU28: =RC[-27]/RC[-43] -> 2265.3458333333333 | AV28: =RC[-26]/RC[-44] -> 30878.17142857143 | AW28: =RC[-42]/RC[-45] -> 17549.215476190475 | AX28: =SUM(RC[-43]:RC[-37])/RC[-46] -> 19724.733333333334 | AY28: =RC[-39]/RC[-47] -> 618.29821428571427
A29: Sweden | B29: EU | C29: C27 | D29: =RC[19]/1000 -> 292 | E29: 37 | F29: 155 | G29: 23323000 | H29: 254183 | I29: 213316 | J29: 69985 | K29: 2710924 | L29: 45375 | M29: 9291 | N29: 342000 | O29: 1045 | P29: 22 | Q29: 54 | R29: 2510 | S29: 2328 | T29: 497999 | U29: 6899208 | V29: 8408494 | W29: 292000 | X29: 1111 | Y29: 622 | Z29: 1733 | AA29: 66313682 | AB29: 31054748 | AC29: 0 | AD29: 0 | AE29: 0 | AF29: 0 | AG29: 20561175 | AH29: 117929605 | AI29: 103233087 | AJ29: 2479925 | AK29: 12216593 | AL29: 117929605 | AM29: 1947329 | AN29: 30314 | AO29: 114315 | AP29: 367082 | AQ29: 2459040 | AR29: =RC[-30]+RC[-29] -> 343045 | AS29: =RC[-24]/RC[-23] -> 0.82050459927782549 | AT29: =RC[-12]/RC[-23] -> 403.86851027397262 | AU29: =RC[-27]/RC[-43] -> 1705.4760273972602 | AV29: =RC[-26]/RC[-44] -> 28796.212328767124 | AW29: =RC[-42]/RC[-45] -> 79873.287671232873 | AX29: =SUM(RC[-43]:RC[-37])/RC[-46] -> 91185.184931506854 | AY29: =RC[-39]/RC[-47] -> 155.39383561643837
A30: Switzerland | B30: EFTA | C30: C28 | D30: =RC[19]/1000 -> 162 | E30: 151 | F30: 345 | G30: 17612880 | H30: 127657 | I30: 156191 | J30: 57374 | K30: 794376 | L30: 195845 | M30: 14678 | N30: 534663 | O30: 11493 | P30: 22 | Q30: 30 | R30: 1888 | S30: 708 | T30: 199025 | U30: 5060410 | V30: 5919042 | W30: 162000 | X30: 912 | Y30: 517 | Z30: 1429 | AA30: 30070810 | AB30: 15519502 | AC30: 0 | AD30: 0 | AE30: 0 | AF30: 0 | AG30: 9331123 | AH30: 54921435 | AI30: 52319588 | AJ30: 2601848 | AK30: -1 | AL30: 54921435 | AM30: 1745112 | AN30: 27167 | AO30: 102444 | AP30: 328962 | AQ30: 2203685 | AR30: =RC[-30]+RC[-29] -> 546156 | AS30: =RC[-24]/RC[-23] -> 0.85493733614324752 | AT30: =RC[-12]/RC[-23] -> 339.02120370370369 | AU30: =RC[-27]/RC[-43] -> 1228.5493827160494 | AV30: =RC[-26]/RC[-44] -> 36537.296296296299 | AW30: =RC[-42]/RC[-45] -> 108721.48148148147 | AX30: =SUM(RC[-43]:RC[-37])/RC[-46] -> 117030.87037037036 | AY30: =RC[-39]/RC[-47] -> 1208.9197530864199
A31: UK | B31: EU | C31: C29 | D31: =RC[19]/1000 -> 1910 | E31: 166 | F31: 790 | G31: 104563000 | H31: 839000 | I31: 1073993 | J31: 107000 | K31: 10641000 | L31: 2405000 | M31: 72935 | N31: 2831000 | O31: 157000 | P31: 36 | Q31: 54 | R31: 35670 | S31: 35670 | T31: 2449000 | U31: 79300000 | V31: 119300000 | W31: 1910000 | X31: 3629 | Y31: 6191 | Z31: 9820 | AA31: 349430033 | AB31: 221228019 | AC31: 24467620 | AD31: 264739 | AE31: 2493264 | AF31: 0 | AG31: 91189805 | AH31: 689073480 | AI31: 482267515 | AJ31: 32964520 | AK31: 108013536 | AL31: 623245571 | AM31: 23780331 | AN31: 370189 | AO31: 1395983 | AP31: 4482731 | AQ31: 30029234 | AR31: =RC[-30]+RC[-29] -> 2988000 | AS31: =RC[-24]/RC[-23] -> 0.66471081307627833 | AT31: =RC[-12]/RC[-23] -> 360.77145549738219 | AU31: =RC[-27]/RC[-43] -> 1282.1989528795812 | AV31: =RC[-26]/RC[-44] -> 62460.732984293194 | AW31: =RC[-42]/RC[-45] -> 54745.02617801047 | AX31: =SUM(RC[-43]:RC[-37])/RC[-46] -> 62671.1664921466 | AY31: =RC[-39]/RC[-47] -> 1259.1623036649214
A32: Germany | B32: EU | C32: C31 | D32: =RC[19]/1000 -> 2415 | E32: 241 | F32: 845 | G32: 154369463 | H32: 411815 | I32: 519536 | J32: 178925 | K32: 49986069 | L32: 1722099 | M32: 70548 | N32: 3232266 | O32: 61183 | P32: 36 | Q32: 54 | R32: 32716 | S32: 11263 | T32: 2228181 | U32: 57583739 | V32: 83547840 | W32: 2415000 | X32: 5231 | Y32: 3638 | Z32: 8869 | AA32: 240640929 | AB32: 200462916 | AC32: 18827653 | AD32: 0 | AE32: 4629073 | AF32: 0 | AG32: 26773402 | AH32: 491333973 | AI32: 454813141 | AJ32: 11287646 | AK32: 25233186 | AL32: 491333973 | AM32: 15760576 | AN32: 0 | AO32: 0 | AP32: 13353451 | AQ32: 29114027 | AR32: =RC[-30]+RC[-29] -> 3293449 | AS32: =RC[-24]/RC[-23] -> 0.68923073295491544 | AT32: =RC[-12]/RC[-23] -> 203.45092049689441 | AU32: =RC[-27]/RC[-43] -> 922.64223602484469 | AV32: =RC[-26]/RC[-44] -> 34595.378881987577 | AW32: =RC[-42]/RC[-45] -> 63921.102691511391 | AX32: =SUM(RC[-43]:RC[-37])/RC[-46] -> 85821.306418219465 | AY32: =RC[-39]/RC[-47] -> 713.08447204968945
A33: USA | B33: World - A | C33: C50 | D33: =RC[19]/1000 -> 16072.976000000001 | E33: 3575 | F33: 10148 | G33: 878906177 | H33: 5717285 | I33: 7543703 | J33: 5217566 | K33: 1062082077 | L33: 94285669 | M33: 3473225 | N33: 24550615 | O33: 3249220 | P33: 36 | Q33: 54 | R33: 82736 | S33: 28803 | T33: 7641610 | U33: 220701765 | V33: 16541520 | W33: 16072976 | X33: 30041 | Y33: 66668 | Z33: 96709 | AA33: 2534637034 | AB33: 1800363164 | AC33: 0 | AD33: 0 | AE33: 0 | AF33: 0 | AG33: 694734341 | AH33: 5029734539 | AI33: 4388151679 | AJ33: 204458423 | AK33: 437124437 | AL33: 5029734539 | AM33: 159490587 | AN33: 2482795 | AO33: 9362619 | AP33: 30064902 | AQ33: 201400903 | AR33: =RC[-30]+RC[-29] -> 27799835 | AS33: =RC[-24]/RC[-23] -> 13.342290490837602 | AT33: =RC[-12]/RC[-23] -> 312.93112980446188 | AU33: =RC[-27]/RC[-43] -> 475.43217883234564 | AV33: =RC[-26]/RC[-44] -> 1029.1510420969955 | AW33: =RC[-42]/RC[-45] -> 54682.230409601805 | AX33: =SUM(RC[-43]:RC[-37])/RC[-46] -> 127992.83107247842 | AY33: =RC[-39]/RC[-47] -> 5866.0990348022669
A34: Turkey | B34: World - B | C34: C42 | D34: =RC[19]/1000 -> 1019.7809999999999 | E34: 164 | F34: 201 | G34: 15884663 | H34: 103330 | I34: 139519 | J34: 94299 | K34: 11098696 | L34: 1016810 | M34: 37931 | N34: 481848 | O34: 38764 | P34: 22 | Q34: 30 | R34: 20184 | S34: 7203 | T34: 1864187 | U34: 38142111 | V34: 34461925 | W34: 1019781 | X34: 608 | Y34: 910 | Z34: 1518 | AA34: 2938235 | AB34: 4142888 | AC34: 30239 | AD34: 164251 | AE34: 100089 | AF34: 447391 | AG34: 1288970 | AH34: 9112063 | AI34: 6950020 | AJ34: 213410 | AK34: 1948633 | AL34: 9112063 | AM34: 1386857 | AN34: 0 | AO34: 70875 | AP34: 16648 | AQ34: 1474380 | AR34: =RC[-30]+RC[-29] -> 520612 | AS34: =RC[-24]/RC[-23] -> 1.1067899137961679 | AT34: =RC[-12]/RC[-23] -> 8.9353135624217348 | AU34: =RC[-27]/RC[-43] -> 1828.0268018329427 | AV34: =RC[-26]/RC[-44] -> 33793.456634316586 | AW34: =RC[-42]/RC[-45] -> 15576.543395101498 | AX34: =SUM(RC[-43]:RC[-37])/RC[-46] -> 27824.844746077837 | AY34: =RC[-39]/RC[-47] -> 997.08662938415216
A35: Australia | B35: World - A | C35: C70 | D35: =RC[19]/1000 -> 1063.7750000000001 | E35: 181 | F35: 444 | G35: 35088509 | H35: 228251 | I35: 308190 | J35: 208301 | K35: 24516522 | L35: 2271047 | M35: 83788 | N35: 1064381 | O35: 86580 | P35: 36 | Q35: 54 | R35: 5795 | S35: 2068 | T35: 535213 | U35: 10950706 | V35: 9894114 | W35: 1063775 | X35: 1343 | Y35: 2012 | Z35: 3355 | AA35: 167752600 | AB35: 119155366 | AC35: 0 | AD35: 0 | AE35: 0 | AF35: 0 | AG35: 45980347 | AH35: 332888313 | AI35: 290425747 | AJ35: 13531891 | AK35: 28930675 | AL35: 332888313 | AM35: 10555736 | AN35: 164322 | AO35: 619656 | AP35: 1989818 | AQ35: 13329532 | AR35: =RC[-30]+RC[-29] -> 1150961 | AS35: =RC[-24]/RC[-23] -> 1.1067899561294725 | AT35: =RC[-12]/RC[-23] -> 312.93113017320394 | AU35: =RC[-27]/RC[-43] -> 503.12613099574622 | AV35: =RC[-26]/RC[-44] -> 9300.9461587271744 | AW35: =RC[-42]/RC[-45] -> 32984.897182204884 | AX35: =SUM(RC[-43]:RC[-37])/RC[-46] -> 58945.367206411123 | AY35: =RC[-39]/RC[-47] -> 2134.894127047543
A36: Japan | B36: World - A | C36: C41 | D36: =RC[19]/1000 -> 3782.3130000000001 | E36: 1064 | F36: 1651 | G36: 280726000 | H36: 1742791 | I36: 2353161 | J36: 1590463 | K36: 90887827 | L36: 8278609 | M36: 310617 | N36: 7637000 | O36: 315608 | P36: 36 | Q36: 54 | R36: 31557 | S36: 11262 | T36: 2914715 | U36: 28374000 | V36: 53882295 | W36: 3782313 | X36: 7508 | Y36: 6902 | Z36: 14410 | AA36: 217143840 | AB36: 685720182 | AC36: 2303953 | AD36: 85529 | AE36: 805492 | AF36: 1661955 | AG36: 28519971 | AH36: 936240922 | AI36: 835799770 | AJ36: 35882362 | AK36: 64558790 | AL36: 936240922 | AM36: 37271852 | AN36: 580212 | AO36: 2187979 | AP36: 7025961 | AQ36: 47066004 | AR36: =RC[-30]+RC[-29] -> 7952608 | AS36: =RC[-24]/RC[-23] -> 0.52659226931592285 | AT36: =RC[-12]/RC[-23] -> 247.53131800567536 | AU36: =RC[-27]/RC[-43] -> 770.61708007771961 | AV36: =RC[-26]/RC[-44] -> 14245.858288301364 | AW36: =RC[-42]/RC[-45] -> 74220.721553187162 | AX36: =SUM(RC[-43]:RC[-37])/RC[-46] -> 102024.73142756826 | AY36: =RC[-39]/RC[-47] -> 2188.7688829560111
A37: Korea | B37: World - A | C37: C40 | D37: =RC[19]/1000 -> 2413.145 | E37: 676 | F37: 1050 | G37: 170932232 | H37: 1111914 | I37: 1501335 | J37: 1014728 | K37: 57987138 | L37: 5281817 | M37: 198176 | N37: 5191892 | O37: 201360 | P37: 36 | Q37: 54 | R37: 20134 | S37: 7185 | T37: 1859611 | U37: 18299262 | V37: 34377322 | W37: 2413145 | X37: 4821 | Y37: 4622 | Z37: 9443 | AA37: 195146717 | AB37: 539538391 | AC37: 2070557 | AD37: 76865 | AE37: 723894 | AF37: 1493595 | AG37: 25630840 | AH37: 764680859 | AI37: 667139701 | AJ37: 31084234 | AK37: 66456924 | AL37: 764680859 | AM37: 23779731 | AN37: 370180 | AO37: 1395948 | AP37: 4482617 | AQ37: 30028476 | AR37: =RC[-30]+RC[-29] -> 5393252 | AS37: =RC[-24]/RC[-23] -> 0.53230621047212456 | AT37: =RC[-12]/RC[-23] -> 316.88143853767593 | AU37: =RC[-27]/RC[-43] -> 770.61718214197651 | AV37: =RC[-26]/RC[-44] -> 14245.858412983886 | AW37: =RC[-42]/RC[-45] -> 70833.800704060472 | AX37: =SUM(RC[-43]:RC[-37])/RC[-46] -> 98637.810823634718 | AY37: =RC[-39]/RC[-47] -> 2188.7690130514329
A38: Canada | B38: World - A | C38: C51 | D38: =RC[19]/1000 -> 2030.395 | E38: 2739 | F38: 910 | G38: 75032608 | H38: 704438 | I38: 150814 | J38: 642867 | K38: 128742278 | L38: 11440224 | M38: 421442 | N38: 3034914 | O38: 395232 | P38: 36 | Q38: 54 | R38: 10489 | S38: 3658 | T38: 968806 | U38: 27446627 | V38: 241138449 | W38: 2030395 | X38: 3130 | Y38: 6616 | Z38: 13349 | AA38: 402701509 | AB38: 87045658 | AC38: 0 | AD38: 0 | AE38: 0 | AF38: 0 | AG38: 130705857 | AH38: 620453024 | AI38: 573016599 | AJ38: 14160664 | AK38: 33275761 | AL38: 620453024 | AM38: 25852154 | AN38: 38825 | AO38: 1941548 | AP38: 309008 | AQ38: 28141535 | AR38: =RC[-30]+RC[-29] -> 3430146 | AS38: =RC[-24]/RC[-23] -> 0.11382103150211437 | AT38: =RC[-12]/RC[-23] -> 305.58242312456446 | AU38: =RC[-27]/RC[-43] -> 477.15149022727104 | AV38: =RC[-26]/RC[-44] -> 118764.3039901103 | AW38: =RC[-42]/RC[-45] -> 36954.685172097059 | AX38: =SUM(RC[-43]:RC[-37])/RC[-46] -> 106942.08319070919 | AY38: =RC[-39]/RC[-47] -> 5634.4819604067188
A39: New Zealand | B39: World - A | C39: C71 | D39: =RC[19]/1000 -> 169.55699999999999 | E39: 37 | F39: 105 | G39: 9043383 | H39: 58827 | I39: 77689 | J39: 53685 | K39: 10751186 | L39: 955366 | M39: 35194 | N39: 253444 | O39: 33006 | P39: 36 | Q39: 54 | R39: 876 | S39: 305 | T39: 80904 | U39: 2292050 | V39: 261563 | W39: 169557 | X39: 311 | Y39: 680 | Z39: 991 | AA39: 26738387 | AB39: 18992387 | AC39: 0 | AD39: 0 | AE39: 0 | AF39: 0 | AG39: 7328890 | AH39: 53059664 | AI39: 46291479 | AJ39: 2156873 | AK39: 4611312 | AL39: 53059664 | AM39: 1682497 | AN39: 26191 | AO39: 98768 | AP39: 317162 | AQ39: 2124618 | AR39: =RC[-30]+RC[-29] -> 286450 | AS39: =RC[-24]/RC[-23] -> 8.7628984221774484 | AT39: =RC[-12]/RC[-23] -> 312.93113230359114 | AU39: =RC[-27]/RC[-43] -> 477.14927723420448 | AV39: =RC[-26]/RC[-44] -> 1542.6257836597724 | AW39: =RC[-42]/RC[-45] -> 53335.356251879901 | AX39: =SUM(RC[-43]:RC[-37])/RC[-46] -> 123706.65911758288 | AY39: =RC[-39]/RC[-47] -> 5634.482799294633
A40: Mexico | B40: World - B | C40: C72 | D40: =RC[19]/1000 -> 1492.1759999999999 | E40: 240 | F40: 294 | G40: 23242938 | H40: 151196 | I40: 204149 | J40: 137981 | K40: 16239961 | L40: 1487828 | M40: 55502 | N40: 705055 | O40: 56721 | P40: 22 | Q40: 30 | R40: 29534 | S40: 10540 | T40: 2727737 | U40: 55810735 | V40: 50425771 | W40: 1492176 | X40: 890 | Y40: 1332 | Z40: 2222 | AA40: 3680066 | AB40: 5188865 | AC40: 37873 | AD40: 205720 | AE40: 125359 | AF40: 560346 | AG40: 1614405 | AH40: 11412634 | AI40: 8704729 | AJ40: 267290 | AK40: 2440615 | AL40: 11412634 | AM40: 1737004 | AN40: 0 | AO40: 88770 | AP40: 20850 | AQ40: 1846624 | AR40: =RC[-30]+RC[-29] -> 761776 | AS40: =RC[-24]/RC[-23] -> 1.1067899189880508 | AT40: =RC[-12]/RC[-23] -> 7.6483162844061292 | AU40: =RC[-27]/RC[-43] -> 1828.0263186112095 | AV40: =RC[-26]/RC[-44] -> 33793.447287719413 | AW40: =RC[-42]/RC[-45] -> 15576.539228616464 | AX40: =SUM(RC[-43]:RC[-37])/RC[-46] -> 27824.8376867072 | AY40: =RC[-39]/RC[-47] -> 997.08613461146683
A41: CEE - Total | B41: Totals | D41: =RC[19]/1000 -> 2302 | E41: 934 | F41: 3615 | G41: 131734074 | H41: 1142831 | I41: 1168450 | J41: 1960226 | K41: 8711868 | L41: 852840 | M41: 88631 | N41: 4228576 | O41: 57769 | P41: 7 | Q41: 26 | R41: 6829 | S41: 3511 | T41: 2553436 | U41: 55149153 | V41: 37603812 | W41: 2302000 | X41: 11489 | Y41: 4214 | Z41: 15703 | AA41: 33263888 | AB41: 47382991 | AC41: 565690 | AD41: 1636390 | AE41: 1196376 | AF41: 3889473 | AG41: 13733644 | AH41: 101668452 | AI41: 79791420 | AJ41: 2661068 | AK41: 18955212 | AL41: 101407700 | AM41: 14119252 | AN41: 0 | AO41: 866018 | AP41: 246785 | AQ41: 15232055 | AR41: =RC[-30]+RC[-29] -> 4286345 | AS41: =RC[-24]/RC[-23] -> 1.4665841058879883 | AT41: =RC[-12]/RC[-23] -> 44.165270199826239 | AU41: =RC[-27]/RC[-43] -> 1109.2250217202434 | AV41: =RC[-26]/RC[-44] -> 16335.278887923545 | AW41: =RC[-42]/RC[-45] -> 57225.922675933973 | AX41: =SUM(RC[-43]:RC[-37])/RC[-46] -> 63274.943527367504 | AY41: =RC[-39]/RC[-47] -> 370.47784535186793
A42: EU - Total | B42: Totals | D42: =RC[19]/1000 -> 12585.234 | E42: 3208 | F42: 6424 | G42: 487754400 | H42: 2911598 | I42: 3865860 | J42: 1766522 | K42: 78693509 | L42: 9969449 | M42: 423705 | N42: 14813673 | O42: 660572 | P42: 38 | Q42: 48 | R42: 154269 | S42: 80462 | T42: 14382525 | U42: 210580745 | V42: 403657987 | W42: 12585234 | X42: 24539 | Y42: 20301 | Z42: 47560 | AA42: 1354514691 | AB42: 864718452 | AC42: 67486035 | AD42: 1353979 | AE42: 9296599 | AF42: 29096808 | AG42: 318420990 | AH42: 2644887555 | AI42: 2231179957 | AJ42: 106286030 | AK42: 235802452 | AL42: 2573268439 | AM42: 82712061 | AN42: 1136892 | AO42: 3768217 | AP42: 25911026 | AQ42: 113528196 | AR42: =RC[-30]+RC[-29] -> 15474245 | AS42: =RC[-24]/RC[-23] -> 0.52168110574261972 | AT42: =RC[-12]/RC[-23] -> 210.15799587039859 | AU42: =RC[-27]/RC[-43] -> 1142.8095019925731 | AV42: =RC[-26]/RC[-44] -> 32073.935772668192 | AW42: =RC[-42]/RC[-45] -> 38756.085107356761 | AX42: =SUM(RC[-43]:RC[-37])/RC[-46] -> 46513.639952979815 | AY42: =RC[-39]/RC[-47] -> 792.15444067229896
A43: EFTA - Total | B43: Totals | D43: =RC[19]/1000 -> 365 | E43: 243 | F43: 546 | G43: 31208347 | H43: 219470 | I43: 292848 | J43: 109166 | K43: 1270604 | L43: 319773 | M43: 23761 | N43: 848616 | O43: 17118 | P43: 22 | Q43: 31 | R43: 3105 | S43: 1159 | T43: 332547 | U43: 7957560 | V43: 11540072 | W43: 365000 | X43: 1569 | Y43: 884 | Z43: 2452 | AA43: 70333312 | AB43: 37558616 | AC43: 0 | AD43: 0 | AE43: 0 | AF43: 0 | AG43: 27051215 | AH43: 134943143 | AI43: 117633762 | AJ43: 11267938 | AK43: -2 | AL43: 128901698 | AM43: 3931886 | AN43: 61209 | AO43: 230814 | AP43: 741183 | AQ43: 4965092 | AR43: =RC[-30]+RC[-29] -> 865734 | AS43: =RC[-24]/RC[-23] -> 0.68955895595798711 | AT43: =RC[-12]/RC[-23] -> 369.70724109589042 | AU43: =RC[-27]/RC[-43] -> 911.08767123287669 | AV43: =RC[-26]/RC[-44] -> 31616.635616438358 | AW43: =RC[-42]/RC[-45] -> 85502.320547945201 | AX43: =SUM(RC[-43]:RC[-37])/RC[-46] -> 91627.312328767119 | AY43: =RC[-39]/RC[-47] -> 876.09041095890416
A44: World A - Total | B44: Totals | D44: =RC[19]/1000 -> 25532.161 | E44: 8272 | F44: 14308 | G44: 1449728909 | H44: 9563506 | I44: 11934892 | J44: 8727610 | K44: 1374967028 | L44: 122512732 | M44: 4522442 | N44: 41732246 | O44: 4281006 | P44: 36 | Q44: 54 | R44: 151587 | S44: 53281 | T44: 14000859 | U44: 308064410 | V44: 356095263 | W44: 25532161 | X44: 47154 | Y44: 87500 | Z44: 138257 | AA44: 3544120087 | AB44: 3250815148 | AC44: 4374510 | AD44: 162394 | AE44: 1529386 | AF44: 3155550 | AG44: 932900246 | AH44: 7737057321 | AI44: 6800824975 | AJ44: 301274447 | AK44: 634957899 | AL44: 7737057321 | AM44: 258632557 | AN44: 3662525 | AO44: 15606518 | AP44: 44189468 | AQ44: 322091068 | AR44: =RC[-30]+RC[-29] -> 46013252 | AS44: =RC[-24]/RC[-23] -> 0.8651179670424316 | AT44: =RC[-12]/RC[-23] -> 303.03182409824223 | AU44: =RC[-27]/RC[-43] -> 548.36169175025964 | AV44: =RC[-26]/RC[-44] -> 13946.930030716945 | AW44: =RC[-42]/RC[-45] -> 56780.50161911481 | AX44: =SUM(RC[-43]:RC[-37])/RC[-46] -> 116792.19471473644 | AY44: =RC[-39]/RC[-47] -> 4798.3690843873337
A45: World B - Total | B45: Totals | D45: =RC[19]/1000 -> 2511.9569999999999 | E45: 404 | F45: 495 | G45: 39127601 | H45: 254526 | I45: 343668 | J45: 232280 | K45: 27338657 | L45: 2504638 | M45: 93433 | N45: 1186903 | O45: 95485 | P45: 22 | Q45: 30 | R45: 49718 | S45: 17743 | T45: 4591924 | U45: 93952846 | V45: 84887696 | W45: 2511957 | X45: 1498 | Y45: 2242 | Z45: 3740 | AA45: 6618301 | AB45: 9331753 | AC45: 68112 | AD45: 369971 | AE45: 225448 | AF45: 1007737 | AG45: 2903375 | AH45: 20524697 | AI45: 15654749 | AJ45: 480700 | AK45: 4389248 | AL45: 20524697 | AM45: 3123861 | AN45: 0 | AO45: 159645 | AP45: 37498 | AQ45: 3321004 | AR45: =RC[-30]+RC[-29] -> 1282388 | AS45: =RC[-24]/RC[-23] -> 1.1067899168802979 | AT45: =RC[-12]/RC[-23] -> 8.1707995001506788 | AU45: =RC[-27]/RC[-43] -> 1828.026514785086 | AV45: =RC[-26]/RC[-44] -> 33793.451082164225 | AW45: =RC[-42]/RC[-45] -> 15576.540920087407 | AX45: =SUM(RC[-43]:RC[-37])/RC[-46] -> 27824.840552605001 | AY45: =RC[-39]/RC[-47] -> 997.08633547469174
A46: EU Accession Countries - Totals | B46: Totals | D46: =RC[19]/1000 -> 1616.63 | E46: 667 | F46: 2835 | G46: 93938357 | H46: 859989 | I46: 884554 | J46: 1531096 | K46: 7862199 | L46: 532106 | M46: 74514 | N46: 3141060 | O46: 42180 | P46: 7 | Q46: 26 | R46: 5462 | S46: 3000 | T46: 1898554 | U46: 38312786 | V46: 27326879 | W46: 1616630 | X46: 8467 | Y46: 2946 | Z46: 11413 | AA46: 28300167 | AB46: 38915339 | AC46: 512335 | AD46: 1281841 | AE46: 978957 | AF46: 2934421 | AG46: 11121444 | AH46: 84044504 | AI46: 67073361 | AJ46: 2421845 | AK46: 14288546 | AL46: 83783752 | AM46: 11011200 | AN46: 2101 | AO46: 708194 | AP46: 241384 | AQ46: 11962879 | AR46: =RC[-30]+RC[-29] -> 3183240 | AS46: =RC[-24]/RC[-23] -> 1.4020183570908336 | AT46: =RC[-12]/RC[-23] -> 51.987470231283595 | AU46: =RC[-27]/RC[-43] -> 1174.3899346170738 | AV46: =RC[-26]/RC[-44] -> 16903.607504500102 | AW46: =RC[-42]/RC[-45] -> 58107.518108658129 | AX46: =SUM(RC[-43]:RC[-37])/RC[-46] -> 65372.296072694429 | AY46: =RC[-39]/RC[-47] -> 329.14519710756326

Sheet: Gross
A1: Name | B1: Type | C1: Code | D1: Population '000s | E1: Libraries - Total Administrative Units | F1: Libraries - Service Points | G1: Collections - Books & Bound Periodicals | H1: Collections - Current Periodicals - Titles | I1: Collections - Current Periodicals - Subscriptions | J1: Collections - Manuscripts | K1: Collections - Microforms | L1: Collections - Audio-visual Materials | M1: Collections - CD-ROMs | N1: Additions - Books & Bound Periodicals | O1: Additions - Audio-visual Materials | P1: Facilities & Services - Percentage Stock on Open Access | Q1: Facilities & Services - Percentage Catalogue Records Automated | R1: Facilities & Services - Number of Workstations for users | S1: Facilities & Services - Number connected to the internet | T1: Use & Users - Registered Users | U1: Use & Users - Consultations | V1: Use & Users - Number of Visits | W1: Use & Users - Potential Total Population Served | X1: Library Staff FTE - Trained Librarians | Y1: Library Staff FTE - Other Library Staff | Z1: Library Staff FTE - Total Staff | AA1: Recurrent Expenditure (Euros) - Staff | AB1: Recurrent Expenditure (Euros) - Acquisition of Stock | AC1: Recurrent Expenditure (Euros) - Electronic Information | AD1: Recurrent Expenditure (Euros) - Automation | AE1: Recurrent Expenditure (Euros) - Premises and Related Costs | AF1: Recurrent Expenditure (Euros) - New Buildings / Refurbishment | AG1: Recurrent Expenditure (Euros) - Other Expenditure | AH1: Recurrent Expenditure (Euros) - TOTAL EXPENDITURE | AI1: Income - Public Funding | AJ1: Income - Fees & Charges | AK1: Income - Other Income | AL1: Income - TOTAL INCOME | AM1: Capital Expenditure - New Buildings / Refurbishment | AN1: Capital Expenditure - Acquisition of Stock | AO1: Capital Expenditure - Automation | AP1: Capital Expenditure - Other Capital Expenditure | AQ1: Capital Expenditure - TOTAL CAPITAL PAYMENTS | AR1: Additions | AS1: Loans per visit | AT1: Cost per pop | AU1: Users per 1000 pop | AV1: visits per 1000 pop | AW1: Bookstock per 1000 pop | AX1: Total stock per 1000 pop | AY1: AV materials per 1000 pop
A2: Bulgaria | B2: CEE | C2: C1 | D2: 0 | E2: 1 | F2: 1 | G2: 1 | H2: 1 | I2: 2 | J2: 2 | K2: 1 | L2: 1 | M2: 2 | N2: 1 | O2: 1 | P2: 2 | Q2: 2 | R2: 2 | S2: 2 | T2: 1 | U2: 1 | V2: 1 | W2: 0 | X2: 1 | Y2: 1 | Z2: 1 | AA2: 1 | AB2: 1 | AC2: 1 | AD2: 1 | AE2: 1 | AF2: 1 | AG2: 1 | AH2: 1 | AI2: 1 | AJ2: 1 | AK2: 1 | AL2: 1 | AM2: 2 | AN2: 2 | AO2: 2 | AP2: 2 | AQ2: 2 | AR2: =MAX(RC[-30],RC[-29]) -> 1 | AS2: =MAX(RC[-24],RC[-23]) -> 1 | AT2: =MAX(RC[-12],RC[-23]) -> 1 | AU2: =MAX(RC[-27],RC[-43]) -> 1 | AV2: =MAX(RC[-26],RC[-44]) -> 1 | AW2: =MAX(RC[-42],RC[-45]) -> 1 | AX2: =MAX(RC[-43]:RC[-37]) -> 2 | AY2: =RC[-39] -> 1
A3: Czech Republic | B3: CEE | C3: C2 | D3: 0 | E3: 0 | F3: 0 | G3: 0 | H3: 0 | I3: 2 | J3: 1 | K3: 1 | L3: 1 | M3: 2 | N3: 0 | O3: 1 | P3: 2 | Q3: 2 | R3: 2 | S3: 2 | T3: 0 | U3: 0 | V3: 1 | W3: 0 | X3: 0 | Y3: 0 | Z3: 0 | AA3: 2 | AB3: 0 | AC3: 2 | AD3: 2 | AE3: 2 | AF3: 2 | AG3: 2 | AH3: 2 | AI3: 2 | AJ3: 2 | AK3: 2 | AL3: 2 | AM3: 2 | AN3: 2 | AO3: 2 | AP3: 2 | AQ3: 2 | AR3: =MAX(RC[-30],RC[-29]) -> 1 | AS3: =MAX(RC[-24],RC[-23]) -> 1 | AT3: =MAX(RC[-12],RC[-23]) -> 2 | AU3: =MAX(RC[-27],RC[-43]) -> 0 | AV3: =MAX(RC[-26],RC[-44]) -> 1 | AW3: =MAX(RC[-42],RC[-45]) -> 0 | AX3: =MAX(RC[-43]:RC[-37]) -> 2 | AY3: =RC[-39] -> 1
A4: Estonia | B4: CEE | C4: C3 | D4: 0 | E4: 0 | F4: 0 | G4: 0 | H4: 0 | I4: 0 | J4: 0 | K4: 0 | L4: 0 | M4: 0 | N4: 0 | O4: 0 | P4: 0 | Q4: 0 | R4: 0 | S4: 0 | T4: 0 | U4: 0 | V4: 0 | W4: 0 | X4: 0 | Y4: 0 | Z4: 0 | AA4: 0 | AB4: 0 | AC4: 0 | AD4: 0 | AE4: 0 | AF4: 0 | AG4: 0 | AH4: 0 | AI4: 0 | AJ4: 0 | AK4: 0 | AL4: 0 | AM4: 0 | AN4: 0 | AO4: 0 | AP4: 0 | AQ4: 1 | AR4: =MAX(RC[-30],RC[-29]) -> 0 | AS4: =MAX(RC[-24],RC[-23]) -> 0 | AT4: =MAX(RC[-12],RC[-23]) -> 0 | AU4: =MAX(RC[-27],RC[-43]) -> 0 | AV4: =MAX(RC[-26],RC[-44]) -> 0 | AW4: =MAX(RC[-42],RC[-45]) -> 0 | AX4: =MAX(RC[-43]:RC[-37]) -> 0 | AY4: =RC[-39] -> 0
A5: Hungary | B5: CEE | C5: C4 | D5: 0 | E5: 1 | F5: 1 | G5: 1 | H5: 1 | I5: 2 | J5: 1 | K5: 1 | L5: 1 | M5: 1 | N5: 1 | O5: 1 | P5: 2 | Q5: 2 | R5: 2 | S5: 2 | T5: 1 | U5: 1 | V5: 1 | W5: 0 | X5: 1 | Y5: 1 | Z5: 1 | AA5: 1 | AB5: 1 | AC5: 1 | AD5: 1 | AE5: 1 | AF5: 1 | AG5: 1 | AH5: 1 | AI5: 1 | AJ5: 1 | AK5: 1 | AL5: 1 | AM5: 2 | AN5: 2 | AO5: 2 | AP5: 2 | AQ5: 2 | AR5: =MAX(RC[-30],RC[-29]) -> 1 | AS5: =MAX(RC[-24],RC[-23]) -> 1 | AT5: =MAX(RC[-12],RC[-23]) -> 1 | AU5: =MAX(RC[-27],RC[-43]) -> 1 | AV5: =MAX(RC[-26],RC[-44]) -> 1 | AW5: =MAX(RC[-42],RC[-45]) -> 1 | AX5: =MAX(RC[-43]:RC[-37]) -> 2 | AY5: =RC[-39] -> 1
A6: Latvia | B6: CEE | C6: C5 | D6: 0 | E6: 0 | F6: 0 | G6: 0 | H6: 2 | I6: 2 | J6: 0 | K6: 2 | L6: 0 | M6: 2 | N6: 1 | O6: 2 | P6: 2 | Q6: 2 | R6: 2 | S6: 2 | T6: 0 | U6: 1 | V6: 0 | W6: 0 | X6: 0 | Y6: 0 | Z6: 0 | AA6: 0 | AB6: 0 | AC6: 0 | AD6: 0 | AE6: 0 | AF6: 0 | AG6: 0 | AH6: 0 | AI6: 0 | AJ6: 0 | AK6: 0 | AL6: 0 | AM6: 1 | AN6: 1 | AO6: 1 | AP6: 1 | AQ6: 1 | AR6: =MAX(RC[-30],RC[-29]) -> 2 | AS6: =MAX(RC[-24],RC[-23]) -> 1 | AT6: =MAX(RC[-12],RC[-23]) -> 0 | AU6: =MAX(RC[-27],RC[-43]) -> 0 | AV6: =MAX(RC[-26],RC[-44]) -> 0 | AW6: =MAX(RC[-42],RC[-45]) -> 0 | AX6: =MAX(RC[-43]:RC[-37]) -> 2 | AY6: =RC[-39] -> 0
A7: Lithuania | B7: CEE | C7: C6 | D7: 0 | E7: 0 | F7: 0 | G7: 0 | H7: 0 | I7: 0 | J7: 0 | K7: 0 | L7: 0 | M7: 0 | N7: 0 | O7: 0 | P7: 0 | Q7: 0 | R7: 0 | S7: 0 | T7: 0 | U7: 0 | V7: 0 | W7: 0 | X7: 0 | Y7: 0 | Z7: 0 | AA7: 0 | AB7: 0 | AC7: 0 | AD7: 0 | AE7: 0 | AF7: 0 | AG7: 0 | AH7: 0 | AI7: 0 | AJ7: 0 | AK7: 0 | AL7: 0 | AM7: 2 | AN7: 2 | AO7: 2 | AP7: 2 | AQ7: 2 | AR7: =MAX(RC[-30],RC[-29]) -> 0 | AS7: =MAX(RC[-24],RC[-23]) -> 0 | AT7: =MAX(RC[-12],RC[-23]) -> 0 | AU7: =MAX(RC[-27],RC[-43]) -> 0 | AV7: =MAX(RC[-26],RC[-44]) -> 0 | AW7: =MAX(RC[-42],RC[-45]) -> 0 | AX7: =MAX(RC[-43]:RC[-37]) -> 0 | AY7: =RC[-39] -> 0
A8: Poland | B8: CEE | C8: C7 | D8: 0 | E8: 2 | F8: 2 | G8: 2 | H8: 2 | I8: 2 | J8: 2 | K8: 2 | L8: 2 | M8: 2 | N8: 2 | O8: 2 | P8: 2 | Q8: 2 | R8: 2 | S8: 2 | T8: 2 | U8: 2 | V8: 2 | W8: 0 | X8: 2 | Y8: 2 | Z8: 2 | AA8: 2 | AB8: 2 | AC8: 2 | AD8: 2 | AE8: 2 | AF8: 2 | AG8: 2 | AH8: 2 | AI8: 2 | AJ8: 2 | AK8: 2 | AL8: 2 | AM8: 2 | AN8: 2 | AO8: 2 | AP8: 2 | AQ8: 2 | AR8: =MAX(RC[-30],RC[-29]) -> 2 | AS8: =MAX(RC[-24],RC[-23]) -> 2 | AT8: =MAX(RC[-12],RC[-23]) -> 2 | AU8: =MAX(RC[-27],RC[-43]) -> 2 | AV8: =MAX(RC[-26],RC[-44]) -> 2 | AW8: =MAX(RC[-42],RC[-45]) -> 2 | AX8: =MAX(RC[-43]:RC[-37]) -> 2 | AY8: =RC[-39] -> 2
A9: Romania | B9: CEE | C9: C8 | D9: 0 | E9: 2 | F9: 2 | G9: 2 | H9: 2 | I9: 2 | J9: 2 | K9: 2 | L9: 2 | M9: 2 | N9: 2 | O9: 2 | P9: 2 | Q9: 2 | R9: 2 | S9: 2 | T9: 2 | U9: 2 | V9: 2 | W9: 0 | X9: 2 | Y9: 2 | Z9: 2 | AA9: 2 | AB9: 2 | AC9: 2 | AD9: 2 | AE9: 2 | AF9: 2 | AG9: 2 | AH9: 2 | AI9: 2 | AJ9: 2 | AK9: 2 | AL9: 2 | AM9: 2 | AN9: 2 | AO9: 2 | AP9: 2 | AQ9: 2 | AR9: =MAX(RC[-30],RC[-29]) -> 2 | AS9: =MAX(RC[-24],RC[-23]) -> 2 | AT9: =MAX(RC[-12],RC[-23]) -> 2 | AU9: =MAX(RC[-27],RC[-43]) -> 2 | AV9: =MAX(RC[-26],RC[-44]) -> 2 | AW9: =MAX(RC[-42],RC[-45]) -> 2 | AX9: =MAX(RC[-43]:RC[-37]) -> 2 | AY9: =RC[-39] -> 2
A10: Slovak Rep | B10: CEE | C10: C9 | D10: 0 | E10: 0 | F10: 0 | G10: 0 | H10: 0 | I10: 0 | J10: 2 | K10: 2 | L10: 2 | M10: 0 | N10: 0 | O10: 0 | P10: 2 | Q10: 2 | R10: 0 | S10: 0 | T10: 0 | U10: 0 | V10: 0 | W10: 0 | X10: 0 | Y10: 0 | Z10: 0 | AA10: 0 | AB10: 0 | AC10: 0 | AD10: 0 | AE10: 0 | AF10: 0 | AG10: 0 | AH10: 0 | AI10: 0 | AJ10: 0 | AK10: 0 | AL10: 0 | AM10: 0 | AN10: 0 | AO10: 0 | AP10: 0 | AQ10: 0 | AR10: =MAX(RC[-30],RC[-29]) -> 0 | AS10: =MAX(RC[-24],RC[-23]) -> 0 | AT10: =MAX(RC[-12],RC[-23]) -> 0 | AU10: =MAX(RC[-27],RC[-43]) -> 0 | AV10: =MAX(RC[-26],RC[-44]) -> 0 | AW10: =MAX(RC[-42],RC[-45]) -> 0 | AX10: =MAX(RC[-43]:RC[-37]) -> 2 | AY10: =RC[-39] -> 2
A11: Slovenia | B11: CEE | C11: C10 | D11: 0 | E11: 0 | F11: 0 | G11: 0 | H11: 0 | I11: 0 | J11: 2 | K11: 2 | L11: 2 | M11: 2 | N11: 0 | O11: 1 | P11: 2 | Q11: 1 | R11: 0 | S11: 0 | T11: 0 | U11: 0 | V11: 0 | W11: 0 | X11: 0 | Y11: 0 | Z11: 0 | AA11: 1 | AB11: 0 | AC11: 1 | AD11: 1 | AE11: 1 | AF11: 1 | AG11: 1 | AH11: 0 | AI11: 1 | AJ11: 1 | AK11: 1 | AL11: 0 | AM11: 2 | AN11: 2 | AO11: 2 | AP11: 2 | AQ11: 2 | AR11: =MAX(RC[-30],RC[-29]) -> 1 | AS11: =MAX(RC[-24],RC[-23]) -> 0 | AT11: =MAX(RC[-12],RC[-23]) -> 0 | AU11: =MAX(RC[-27],RC[-43]) -> 0 | AV11: =MAX(RC[-26],RC[-44]) -> 0 | AW11: =MAX(RC[-42],RC[-45]) -> 0 | AX11: =MAX(RC[-43]:RC[-37]) -> 2 | AY11: =RC[-39] -> 2
A12: Austria | B12: EU | C12: C11 | D12: 0 | E12: 2 | F12: 2 | G12: 2 | H12: 2 | I12: 2 | J12: 2 | K12: 2 | L12: 2 | M12: 2 | N12: 2 | O12: 2 | P12: 2 | Q12: 2 | R12: 2 | S12: 2 | T12: 2 | U12: 2 | V12: 2 | W12: 0 | X12: 2 | Y12: 2 | Z12: 2 | AA12: 2 | AB12: 2 | AC12: 2 | AD12: 2 | AE12: 2 | AF12: 2 | AG12: 2 | AH12: 2 | AI12: 2 | AJ12: 2 | AK12: 2 | AL12: 2 | AM12: 2 | AN12: 2 | AO12: 2 | AP12: 2 | AQ12: 2 | AR12: =MAX(RC[-30],RC[-29]) -> 2 | AS12: =MAX(RC[-24],RC[-23]) -> 2 | AT12: =MAX(RC[-12],RC[-23]) -> 2 | AU12: =MAX(RC[-27],RC[-43]) -> 2 | AV12: =MAX(RC[-26],RC[-44]) -> 2 | AW12: =MAX(RC[-42],RC[-45]) -> 2 | AX12: =MAX(RC[-43]:RC[-37]) -> 2 | AY12: =RC[-39] -> 2
A13: België Vlaamse Gemeenschap | B13: België Vlaamse Gemeenschap | AS13: =MAX(RC[-24],RC[-23]) -> 0 | AT13: =MAX(RC[-12],RC[-23]) -> 0 | AU13: =MAX(RC[-27],RC[-43]) -> 0 | AV13: =MAX(RC[-26],RC[-44]) -> 0 | AW13: =MAX(RC[-42],RC[-45]) -> 0 | AX13: =MAX(RC[-43]:RC[-37]) -> 0 | AY13: =RC[-39] -> 0
A14: Belgique universités francophones | B14: Belgique universités francophones | AS14: =MAX(RC[-24],RC[-23]) -> 0 | AT14: =MAX(RC[-12],RC[-23]) -> 0 | AU14: =MAX(RC[-27],RC[-43]) -> 0 | AV14: =MAX(RC[-26],RC[-44]) -> 0 | AW14: =MAX(RC[-42],RC[-45]) -> 0 | AX14: =MAX(RC[-43]:RC[-37]) -> 0 | AY14: =RC[-39] -> 0
A15: Belgium | B15: EU | C15: C12 | D15: 0 | E15: 1 | F15: 0 | G15: 0 | H15: 0 | I15: 0 | J15: 0 | K15: 0 | L15: 0 | M15: 0 | N15: 0 | O15: 0 | P15: 0 | Q15: 0 | R15: 0 | S15: 2 | T15: 0 | U15: 0 | V15: 0 | W15: 0 | X15: 0 | Y15: 0 | Z15: 0 | AA15: 0 | AB15: 0 | AC15: 0 | AD15: 0 | AE15: 0 | AF15: 0 | AG15: 0 | AH15: 0 | AI15: 0 | AJ15: 0 | AK15: 0 | AL15: 0 | AM15: 0 | AN15: 0 | AO15: 0 | AP15: 0 | AQ15: 0 | AR15: =MAX(RC[-30],RC[-29]) -> 0 | AS15: =MAX(RC[-24],RC[-23]) -> 0 | AT15: =MAX(RC[-12],RC[-23]) -> 0 | AU15: =MAX(RC[-27],RC[-43]) -> 0 | AV15: =MAX(RC[-26],RC[-44]) -> 0 | AW15: =MAX(RC[-42],RC[-45]) -> 0 | AX15: =MAX(RC[-43]:RC[-37]) -> 0 | AY15: =RC[-39] -> 0
A16: Denmark | B16: EU | C16: C13 | D16: 0 | E16: 0 | F16: 0 | G16: 0 | H16: 0 | I16: 0 | J16: 0 | K16: 0 | L16: 0 | M16: 0 | N16: 0 | O16: 0 | P16: 0 | Q16: 2 | R16: 0 | S16: 2 | T16: 2 | U16: 0 | V16: 2 | W16: 0 | X16: 0 | Y16: 0 | Z16: 0 | AA16: 0 | AB16: 0 | AC16: 1 | AD16: 1 | AE16: 1 | AF16: 0 | AG16: 0 | AH16: 0 | AI16: 0 | AJ16: 1 | AK16: 1 | AL16: 0 | AM16: 1 | AN16: 1 | AO16: 1 | AP16: 1 | AQ16: 0 | AR16: =MAX(RC[-30],RC[-29]) -> 0 | AS16: =MAX(RC[-24],RC[-23]) -> 2 | AT16: =MAX(RC[-12],RC[-23]) -> 0 | AU16: =MAX(RC[-27],RC[-43]) -> 2 | AV16: =MAX(RC[-26],RC[-44]) -> 2 | AW16: =MAX(RC[-42],RC[-45]) -> 0 | AX16: =MAX(RC[-43]:RC[-37]) -> 0 | AY16: =RC[-39] -> 0
A17: Eire | B17: EU | C17: C15 | D17: 0 | E17: 2 | F17: 2 | G17: 2 | H17: 2 | I17: 2 | J17: 2 | K17: 2 | L17: 2 | M17: 2 | N17: 2 | O17: 2 | P17: 2 | Q17: 2 | R17: 2 | S17: 2 | T17: 2 | U17: 2 | V17: 2 | W17: 0 | X17: 2 | Y17: 2 | Z17: 2 | AA17: 2 | AB17: 2 | AC17: 2 | AD17: 2 | AE17: 2 | AF17: 2 | AG17: 2 | AH17: 2 | AI17: 2 | AJ17: 2 | AK17: 2 | AL17: 2 | AM17: 2 | AN17: 2 | AO17: 2 | AP17: 2 | AQ17: 2 | AR17: =MAX(RC[-30],RC[-29]) -> 2 | AS17: =MAX(RC[-24],RC[-23]) -> 2 | AT17: =MAX(RC[-12],RC[-23]) -> 2 | AU17: =MAX(RC[-27],RC[-43]) -> 2 | AV17: =MAX(RC[-26],RC[-44]) -> 2 | AW17: =MAX(RC[-42],RC[-45]) -> 2 | AX17: =MAX(RC[-43]:RC[-37]) -> 2 | AY17: =RC[-39] -> 2
A18: Finland | B18: EU | C18: C16 | D18: 0 | E18: 0 | F18: 1 | G18: 0 | H18: 0 | I18: 0 | J18: 0 | K18: 0 | L18: 0 | M18: 2 | N18: 0 | O18: 0 | P18: 1 | Q18: 2 | R18: 2 | S18: 2 | T18: 2 | U18: 0 | V18: 0 | W18: 0 | X18: 0 | Y18: 0 | Z18: 0 | AA18: 0 | AB18: 0 | AC18: 1 | AD18: 1 | AE18: 1 | AF18: 0 | AG18: 0 | AH18: 0 | AI18: 0 | AJ18: 0 | AK18: 0 | AL18: 0 | AM18: 2 | AN18: 2 | AO18: 2 | AP18: 2 | AQ18: 2 | AR18: =MAX(RC[-30],RC[-29]) -> 0 | AS18: =MAX(RC[-24],RC[-23]) -> 0 | AT18: =MAX(RC[-12],RC[-23]) -> 0 | AU18: =MAX(RC[-27],RC[-43]) -> 2 | AV18: =MAX(RC[-26],RC[-44]) -> 0 | AW18: =MAX(RC[-42],RC[-45]) -> 0 | AX18: =MAX(RC[-43]:RC[-37]) -> 2 | AY18: =RC[-39] -> 0
A19: France | B19: EU | C19: C17 | D19: 0 | E19: 1 | F19: 1 | G19: 1 | H19: 1 | I19: 2 | J19: 2 | K19: 1 | L19: 1 | M19: 1 | N19: 1 | O19: 2 | P19: 1 | Q19: 2 | R19: 2 | S19: 2 | T19: 2 | U19: 2 | V19: 2 | W19: 0 | X19: 1 | Y19: 1 | Z19: 1 | AA19: 1 | AB19: 1 | AC19: 1 | AD19: 1 | AE19: 1 | AF19: 1 | AG19: 1 | AH19: 1 | AI19: 1 | AJ19: 1 | AK19: 1 | AL19: 1 | AM19: 2 | AN19: 2 | AO19: 2 | AP19: 2 | AQ19: 2 | AR19: =MAX(RC[-30],RC[-29]) -> 2 | AS19: =MAX(RC[-24],RC[-23]) -> 2 | AT19: =MAX(RC[-12],RC[-23]) -> 1 | AU19: =MAX(RC[-27],RC[-43]) -> 2 | AV19: =MAX(RC[-26],RC[-44]) -> 2 | AW19: =MAX(RC[-42],RC[-45]) -> 1 | AX19: =MAX(RC[-43]:RC[-37]) -> 2 | AY19: =RC[-39] -> 1
A20: Greece | B20: EU | C20: C18 | D20: 0 | E20: 1 | F20: 0 | G20: 0 | H20: 2 | I20: 0 | J20: 0 | K20: 0 | L20: 0 | M20: 0 | N20: 0 | O20: 0 | P20: 0 | Q20: 0 | R20: 2 | S20: 2 | T20: 0 | U20: 0 | V20: 2 | W20: 0 | X20: 0 | Y20: 0 | Z20: 0 | AA20: 1 | AB20: 0 | AC20: 0 | AD20: 0 | AE20: 0 | AF20: 0 | AG20: 0 | AH20: 0 | AI20: 0 | AJ20: 0 | AK20: 0 | AL20: 0 | AM20: 2 | AN20: 2 | AO20: 2 | AP20: 2 | AQ20: 2 | AR20: =MAX(RC[-30],RC[-29]) -> 0 | AS20: =MAX(RC[-24],RC[-23]) -> 2 | AT20: =MAX(RC[-12],RC[-23]) -> 0 | AU20: =MAX(RC[-27],RC[-43]) -> 0 | AV20: =MAX(RC[-26],RC[-44]) -> 2 | AW20: =MAX(RC[-42],RC[-45]) -> 0 | AX20: =MAX(RC[-43]:RC[-37]) -> 2 | AY20: =RC[-39] -> 0
A21: Iceland | B21: EFTA | C21: C19 | D21: 0 | E21: 2 | F21: 2 | G21: 2 | H21: 2 | I21: 2 | J21: 2 | K21: 2 | L21: 2 | M21: 2 | N21: 2 | O21: 2 | P21: 2 | Q21: 2 | R21: 2 | S21: 2 | T21: 2 | U21: 2 | V21: 2 | W21: 0 | X21: 2 | Y21: 2 | Z21: 2 | AA21: 2 | AB21: 2 | AC21: 2 | AD21: 2 | AE21: 2 | AF21: 2 | AG21: 2 | AH21: 2 | AI21: 2 | AJ21: 2 | AK21: 2 | AL21: 2 | AM21: 2 | AN21: 2 | AO21: 2 | AP21: 2 | AQ21: 2 | AR21: =MAX(RC[-30],RC[-29]) -> 2 | AS21: =MAX(RC[-24],RC[-23]) -> 2 | AT21: =MAX(RC[-12],RC[-23]) -> 2 | AU21: =MAX(RC[-27],RC[-43]) -> 2 | AV21: =MAX(RC[-26],RC[-44]) -> 2 | AW21: =MAX(RC[-42],RC[-45]) -> 2 | AX21: =MAX(RC[-43]:RC[-37]) -> 2 | AY21: =RC[-39] -> 2
A22: Italy | B22: EU | C22: C20 | D22: 0 | E22: 2 | F22: 2 | G22: 2 | H22: 2 | I22: 2 | J22: 2 | K22: 2 | L22: 2 | M22: 2 | N22: 2 | O22: 2 | P22: 2 | Q22: 2 | R22: 2 | S22: 2 | T22: 2 | U22: 2 | V22: 2 | W22: 0 | X22: 2 | Y22: 2 | Z22: 2 | AA22: 2 | AB22: 2 | AC22: 2 | AD22: 2 | AE22: 2 | AF22: 2 | AG22: 2 | AH22: 2 | AI22: 2 | AJ22: 2 | AK22: 2 | AL22: 2 | AM22: 2 | AN22: 2 | AO22: 2 | AP22: 2 | AQ22: 2 | AR22: =MAX(RC[-30],RC[-29]) -> 2 | AS22: =MAX(RC[-24],RC[-23]) -> 2 | AT22: =MAX(RC[-12],RC[-23]) -> 2 | AU22: =MAX(RC[-27],RC[-43]) -> 2 | AV22: =MAX(RC[-26],RC[-44]) -> 2 | AW22: =MAX(RC[-42],RC[-45]) -> 2 | AX22: =MAX(RC[-43]:RC[-37]) -> 2 | AY22: =RC[-39] -> 2
A23: Liechtenstein | B23: EFTA | C23: C21 | D23: 0 | E23: 2 | F23: 2 | G23: 2 | H23: 2 | I23: 2 | J23: 2 | K23: 2 | L23: 2 | M23: 2 | N23: 2 | O23: 2 | P23: 2 | Q23: 2 | R23: 2 | S23: 2 | T23: 2 | U23: 2 | V23: 2 | W23: 0 | X23: 2 | Y23: 2 | Z23: 2 | AA23: 2 | AB23: 2 | AC23: 2 | AD23: 2 | AE23: 2 | AF23: 2 | AG23: 2 | AH23: 2 | AI23: 2 | AJ23: 2 | AK23: 2 | AL23: 2 | AM23: 2 | AN23: 2 | AO23: 2 | AP23: 2 | AQ23: 2 | AR23: =MAX(RC[-30],RC[-29]) -> 2 | AS23: =MAX(RC[-24],RC[-23]) -> 2 | AT23: =MAX(RC[-12],RC[-23]) -> 2 | AU23: =MAX(RC[-27],RC[-43]) -> 2 | AV23: =MAX(RC[-26],RC[-44]) -> 2 | AW23: =MAX(RC[-42],RC[-45]) -> 2 | AX23: =MAX(RC[-43]:RC[-37]) -> 2 | AY23: =RC[-39] -> 2
A24: Luxembourg | B24: EU | C24: C22 | D24: 0 | E24: 0 | F24: 0 | G24: 0 | H24: 0 | I24: 0 | J24: 1 | K24: 1 | L24: 0 | M24: 0 | N24: 0 | O24: 0 | P24: 0 | Q24: 0 | R24: 0 | S24: 0 | T24: 1 | U24: 2 | V24: 2 | W24: 0 | X24: 1 | Y24: 1 | Z24: 1 | AA24: 1 | AB24: 1 | AC24: 1 | AD24: 1 | AE24: 1 | AF24: 1 | AG24: 1 | AH24: 1 | AI24: 1 | AJ24: 1 | AK24: 1 | AL24: 1 | AM24: 2 | AN24: 2 | AO24: 2 | AP24: 2 | AQ24: 2 | AR24: =MAX(RC[-30],RC[-29]) -> 0 | AS24: =MAX(RC[-24],RC[-23]) -> 2 | AT24: =MAX(RC[-12],RC[-23]) -> 1 | AU24: =MAX(RC[-27],RC[-43]) -> 1 | AV24: =MAX(RC[-26],RC[-44]) -> 2 | AW24: =MAX(RC[-42],RC[-45]) -> 0 | AX24: =MAX(RC[-43]:RC[-37]) -> 1 | AY24: =RC[-39] -> 0
A25: Netherlands | B25: EU | C25: C23 | D25: 0 | E25: 1 | F25: 1 | G25: 1 | H25: 1 | I25: 1 | J25: 2 | K25: 1 | L25: 2 | M25: 2 | N25: 2 | O25: 2 | P25: 2 | Q25: 2 | R25: 2 | S25: 2 | T25: 2 | U25: 1 | V25: 2 | W25: 0 | X25: 1 | Y25: 1 | Z25: 1 | AA25: 2 | AB25: 2 | AC25: 2 | AD25: 2 | AE25: 2 | AF25: 2 | AG25: 2 | AH25: 2 | AI25: 2 | AJ25: 2 | AK25: 2 | AL25: 2 | AM25: 2 | AN25: 2 | AO25: 2 | AP25: 2 | AQ25: 2 | AR25: =MAX(RC[-30],RC[-29]) -> 2 | AS25: =MAX(RC[-24],RC[-23]) -> 2 | AT25: =MAX(RC[-12],RC[-23]) -> 2 | AU25: =MAX(RC[-27],RC[-43]) -> 2 | AV25: =MAX(RC[-26],RC[-44]) -> 2 | AW25: =MAX(RC[-42],RC[-45]) -> 1 | AX25: =MAX(RC[-43]:RC[-37]) -> 2 | AY25: =RC[-39] -> 2
A26: Norway | B26: EFTA | C26: C24 | D26: 0 | E26: 0 | F26: 0 | G26: 0 | H26: 0 | I26: 2 | J26: 0 | K26: 0 | L26: 0 | M26: 2 | N26: 0 | O26: 0 | P26: 0 | Q26: 2 | R26: 0 | S26: 1 | T26: 2 | U26: 0 | V26: 0 | W26: 0 | X26: 0 | Y26: 0 | Z26: 0 | AA26: 0 | AB26: 0 | AC26: 0 | AD26: 0 | AE26: 0 | AF26: 0 | AG26: 0 | AH26: 0 | AI26: 0 | AJ26: 0 | AK26: 0 | AL26: 0 | AM26: 2 | AN26: 2 | AO26: 2 | AP26: 2 | AQ26: 2 | AR26: =MAX(RC[-30],RC[-29]) -> 0 | AS26: =MAX(RC[-24],RC[-23]) -> 0 | AT26: =MAX(RC[-12],RC[-23]) -> 0 | AU26: =MAX(RC[-27],RC[-43]) -> 2 | AV26: =MAX(RC[-26],RC[-44]) -> 0 | AW26: =MAX(RC[-42],RC[-45]) -> 0 | AX26: =MAX(RC[-43]:RC[-37]) -> 2 | AY26: =RC[-39] -> 0
A27: Portugal | B27: EU | C27: C25 | D27: 0 | E27: 1 | F27: 1 | G27: 1 | H27: 2 | I27: 2 | J27: 1 | K27: 1 | L27: 1 | M27: 2 | N27: 1 | O27: 1 | P27: 2 | Q27: 2 | R27: 1 | S27: 1 | T27: 1 | U27: 1 | V27: 2 | W27: 0 | X27: 1 | Y27: 1 | Z27: 1 | AA27: 1 | AB27: 1 | AC27: 1 | AD27: 1 | AE27: 1 | AF27: 1 | AG27: 1 | AH27: 1 | AI27: 1 | AJ27: 1 | AK27: 1 | AL27: 1 | AM27: 1 | AN27: 1 | AO27: 1 | AP27: 1 | AQ27: 1 | AR27: =MAX(RC[-30],RC[-29]) -> 1 | AS27: =MAX(RC[-24],RC[-23]) -> 2 | AT27: =MAX(RC[-12],RC[-23]) -> 1 | AU27: =MAX(RC[-27],RC[-43]) -> 1 | AV27: =MAX(RC[-26],RC[-44]) -> 2 | AW27: =MAX(RC[-42],RC[-45]) -> 1 | AX27: =MAX(RC[-43]:RC[-37]) -> 2 | AY27: =RC[-39] -> 1
A28: Spain | B28: EU | C28: C26 | D28: 0 | E28: 1 | F28: 1 | G28: 1 | H28: 1 | I28: 2 | J28: 1 | K28: 1 | L28: 1 | M28: 1 | N28: 1 | O28: 1 | P28: 2 | Q28: 2 | R28: 2 | S28: 2 | T28: 1 | U28: 1 | V28: 1 | W28: 0 | X28: 1 | Y28: 1 | Z28: 1 | AA28: 1 | AB28: 1 | AC28: 1 | AD28: 1 | AE28: 1 | AF28: 1 | AG28: 1 | AH28: 1 | AI28: 1 | AJ28: 1 | AK28: 1 | AL28: 1 | AM28: 2 | AN28: 2 | AO28: 2 | AP28: 2 | AQ28: 2 | AR28: =MAX(RC[-30],RC[-29]) -> 1 | AS28: =MAX(RC[-24],RC[-23]) -> 1 | AT28: =MAX(RC[-12],RC[-23]) -> 1 | AU28: =MAX(RC[-27],RC[-43]) -> 1 | AV28: =MAX(RC[-26],RC[-44]) -> 1 | AW28: =MAX(RC[-42],RC[-45]) -> 1 | AX28: =MAX(RC[-43]:RC[-37]) -> 2 | AY28: =RC[-39] -> 1
A29: Sweden | B29: EU | C29: C27 | D29: 0 | E29: 0 | F29: 0 | G29: 0 | H29: 0 | I29: 2 | J29: 0 | K29: 0 | L29: 0 | M29: 0 | N29: 0 | O29: 0 | P29: 2 | Q29: 2 | R29: 0 | S29: 2 | T29: 0 | U29: 0 | V29: 2 | W29: 0 | X29: 0 | Y29: 0 | Z29: 0 | AA29: 0 | AB29: 0 | AC29: 0 | AD29: 0 | AE29: 0 | AF29: 0 | AG29: 0 | AH29: 0 | AI29: 1 | AJ29: 1 | AK29: 1 | AL29: 0 | AM29: 2 | AN29: 2 | AO29: 2 | AP29: 2 | AQ29: 2 | AR29: =MAX(RC[-30],RC[-29]) -> 0 | AS29: =MAX(RC[-24],RC[-23]) -> 2 | AT29: =MAX(RC[-12],RC[-23]) -> 0 | AU29: =MAX(RC[-27],RC[-43]) -> 0 | AV29: =MAX(RC[-26],RC[-44]) -> 2 | AW29: =MAX(RC[-42],RC[-45]) -> 0 | AX29: =MAX(RC[-43]:RC[-37]) -> 2 | AY29: =RC[-39] -> 0
A30: Switzerland | B30: EFTA | C30: C28 | D30: 0 | E30: 2 | F30: 2 | G30: 2 | H30: 2 | I30: 2 | J30: 2 | K30: 2 | L30: 2 | M30: 2 | N30: 2 | O30: 2 | P30: 2 | Q30: 2 | R30: 2 | S30: 2 | T30: 2 | U30: 2 | V30: 2 | W30: 0 | X30: 2 | Y30: 2 | Z30: 2 | AA30: 2 | AB30: 2 | AC30: 2 | AD30: 2 | AE30: 2 | AF30: 2 | AG30: 2 | AH30: 2 | AI30: 2 | AJ30: 2 | AK30: 2 | AL30: 2 | AM30: 2 | AN30: 2 | AO30: 2 | AP30: 2 | AQ30: 2 | AR30: =MAX(RC[-30],RC[-29]) -> 2 | AS30: =MAX(RC[-24],RC[-23]) -> 2 | AT30: =MAX(RC[-12],RC[-23]) -> 2 | AU30: =MAX(RC[-27],RC[-43]) -> 2 | AV30: =MAX(RC[-26],RC[-44]) -> 2 | AW30: =MAX(RC[-42],RC[-45]) -> 2 | AX30: =MAX(RC[-43]:RC[-37]) -> 2 | AY30: =RC[-39] -> 2
A31: UK | B31: EU | C31: C29 | D31: 0 | E31: 0 | F31: 0 | G31: 0 | H31: 0 | I31: 2 | J31: 0 | K31: 1 | L31: 1 | M31: 2 | N31: 1 | O31: 1 | P31: 2 | Q31: 2 | R31: 0 | S31: 0 | T31: 1 | U31: 0 | V31: 0 | W31: 0 | X31: 0 | Y31: 0 | Z31: 0 | AA31: 0 | AB31: 0 | AC31: 0 | AD31: 0 | AE31: 0 | AF31: 0 | AG31: 0 | AH31: 0 | AI31: 0 | AJ31: 0 | AK31: 0 | AL31: 0 | AM31: 2 | AN31: 2 | AO31: 2 | AP31: 2 | AQ31: 2 | AR31: =MAX(RC[-30],RC[-29]) -> 1 | AS31: =MAX(RC[-24],RC[-23]) -> 0 | AT31: =MAX(RC[-12],RC[-23]) -> 0 | AU31: =MAX(RC[-27],RC[-43]) -> 1 | AV31: =MAX(RC[-26],RC[-44]) -> 0 | AW31: =MAX(RC[-42],RC[-45]) -> 0 | AX31: =MAX(RC[-43]:RC[-37]) -> 2 | AY31: =RC[-39] -> 1
A32: Germany | B32: EU | C32: C31 | D32: 0 | E32: 0 | F32: 0 | G32: 0 | H32: 2 | I32: 0 | J32: 0 | K32: 0 | L32: 0 | M32: 2 | N32: 0 | O32: 0 | P32: 2 | Q32: 2 | R32: 2 | S32: 2 | T32: 0 | U32: 0 | V32: 2 | W32: 0 | X32: 0 | Y32: 0 | Z32: 0 | AA32: 0 | AB32: 0 | AC32: 0 | AD32: 0 | AE32: 0 | AF32: 0 | AG32: 0 | AH32: 0 | AI32: 1 | AJ32: 1 | AK32: 1 | AL32: 0 | AM32: 0 | AN32: 0 | AO32: 0 | AP32: 0 | AQ32: 1 | AR32: =MAX(RC[-30],RC[-29]) -> 0 | AS32: =MAX(RC[-24],RC[-23]) -> 2 | AT32: =MAX(RC[-12],RC[-23]) -> 0 | AU32: =MAX(RC[-27],RC[-43]) -> 0 | AV32: =MAX(RC[-26],RC[-44]) -> 2 | AW32: =MAX(RC[-42],RC[-45]) -> 0 | AX32: =MAX(RC[-43]:RC[-37]) -> 2 | AY32: =RC[-39] -> 0
A33: USA | B33: World - A | C33: C50 | D33: 0 | E33: 1 | F33: 2 | G33: 1 | H33: 2 | I33: 1 | J33: 2 | K33: 1 | L33: 1 | M33: 1 | N33: 1 | O33: 1 | P33: 2 | Q33: 2 | R33: 2 | S33: 1 | T33: 2 | U33: 1 | V33: 1 | W33: 0 | X33: 1 | Y33: 1 | Z33: 1 | AA33: 1 | AB33: 1 | AC33: 1 | AD33: 1 | AE33: 1 | AF33: 1 | AG33: 1 | AH33: 1 | AI33: 1 | AJ33: 1 | AK33: 1 | AL33: 1 | AM33: 2 | AN33: 2 | AO33: 2 | AP33: 2 | AQ33: 2 | AR33: =MAX(RC[-30],RC[-29]) -> 1 | AS33: =MAX(RC[-24],RC[-23]) -> 1 | AT33: =MAX(RC[-12],RC[-23]) -> 1 | AU33: =MAX(RC[-27],RC[-43]) -> 2 | AV33: =MAX(RC[-26],RC[-44]) -> 1 | AW33: =MAX(RC[-42],RC[-45]) -> 1 | AX33: =MAX(RC[-43]:RC[-37]) -> 2 | AY33: =RC[-39] -> 1
A34: Turkey | B34: World - B | C34: C42 | D34: 0 | E34: 2 | F34: 2 | G34: 2 | H34: 2 | I34: 2 | J34: 2 | K34: 2 | L34: 2 | M34: 2 | N34: 2 | O34: 2 | P34: 2 | Q34: 2 | R34: 2 | S34: 2 | T34: 2 | U34: 2 | V34: 2 | W34: 0 | X34: 2 | Y34: 2 | Z34: 2 | AA34: 2 | AB34: 2 | AC34: 2 | AD34: 2 | AE34: 2 | AF34: 2 | AG34: 2 | AH34: 2 | AI34: 2 | AJ34: 2 | AK34: 2 | AL34: 2 | AM34: 2 | AN34: 2 | AO34: 2 | AP34: 2 | AQ34: 2 | AR34: =MAX(RC[-30],RC[-29]) -> 2 | AS34: =MAX(RC[-24],RC[-23]) -> 2 | AT34: =MAX(RC[-12],RC[-23]) -> 2 | AU34: =MAX(RC[-27],RC[-43]) -> 2 | AV34: =MAX(RC[-26],RC[-44]) -> 2 | AW34: =MAX(RC[-42],RC[-45]) -> 2 | AX34: =MAX(RC[-43]:RC[-37]) -> 2 | AY34: =RC[-39] -> 2
A35: Australia | B35: World - A | C35: C70 | D35: 0 | E35: 2 | F35: 2 | G35: 2 | H35: 2 | I35: 2 | J35: 2 | K35: 2 | L35: 2 | M35: 2 | N35: 2 | O35: 2 | P35: 2 | Q35: 2 | R35: 2 | S35: 2 | T35: 2 | U35: 2 | V35: 2 | W35: 0 | X35: 2 | Y35: 2 | Z35: 2 | AA35: 2 | AB35: 2 | AC35: 2 | AD35: 2 | AE35: 2 | AF35: 2 | AG35: 2 | AH35: 2 | AI35: 2 | AJ35: 2 | AK35: 2 | AL35: 2 | AM35: 2 | AN35: 2 | AO35: 2 | AP35: 2 | AQ35: 2 | AR35: =MAX(RC[-30],RC[-29]) -> 2 | AS35: =MAX(RC[-24],RC[-23]) -> 2 | AT35: =MAX(RC[-12],RC[-23]) -> 2 | AU35: =MAX(RC[-27],RC[-43]) -> 2 | AV35: =MAX(RC[-26],RC[-44]) -> 2 | AW35: =MAX(RC[-42],RC[-45]) -> 2 | AX35: =MAX(RC[-43]:RC[-37]) -> 2 | AY35: =RC[-39] -> 2
A36: Japan | B36: World - A | C36: C41 | D36: 0 | E36: 0 | F36: 0 | G36: 0 | H36: 2 | I36: 2 | J36: 2 | K36: 2 | L36: 2 | M36: 2 | N36: 0 | O36: 2 | P36: 2 | Q36: 2 | R36: 2 | S36: 2 | T36: 2 | U36: 0 | V36: 2 | W36: 0 | X36: 0 | Y36: 0 | Z36: 0 | AA36: 1 | AB36: 0 | AC36: 1 | AD36: 1 | AE36: 1 | AF36: 1 | AG36: 1 | AH36: 0 | AI36: 1 | AJ36: 1 | AK36: 1 | AL36: 1 | AM36: 2 | AN36: 2 | AO36: 2 | AP36: 2 | AQ36: 2 | AR36: =MAX(RC[-30],RC[-29]) -> 2 | AS36: =MAX(RC[-24],RC[-23]) -> 2 | AT36: =MAX(RC[-12],RC[-23]) -> 0 | AU36: =MAX(RC[-27],RC[-43]) -> 2 | AV36: =MAX(RC[-26],RC[-44]) -> 2 | AW36: =MAX(RC[-42],RC[-45]) -> 0 | AX36: =MAX(RC[-43]:RC[-37]) -> 2 | AY36: =RC[-39] -> 2
A37: Korea | B37: World - A | C37: C40 | D37: 0 | E37: 2 | F37: 2 | G37: 2 | H37: 2 | I37: 2 | J37: 2 | K37: 2 | L37: 2 | M37: 2 | N37: 2 | O37: 2 | P37: 2 | Q37: 2 | R37: 2 | S37: 2 | T37: 2 | U37: 2 | V37: 2 | W37: 0 | X37: 2 | Y37: 2 | Z37: 2 | AA37: 2 | AB37: 2 | AC37: 2 | AD37: 2 | AE37: 2 | AF37: 2 | AG37: 2 | AH37: 2 | AI37: 2 | AJ37: 2 | AK37: 2 | AL37: 2 | AM37: 2 | AN37: 2 | AO37: 2 | AP37: 2 | AQ37: 2 | AR37: =MAX(RC[-30],RC[-29]) -> 2 | AS37: =MAX(RC[-24],RC[-23]) -> 2 | AT37: =MAX(RC[-12],RC[-23]) -> 2 | AU37: =MAX(RC[-27],RC[-43]) -> 2 | AV37: =MAX(RC[-26],RC[-44]) -> 2 | AW37: =MAX(RC[-42],RC[-45]) -> 2 | AX37: =MAX(RC[-43]:RC[-37]) -> 2 | AY37: =RC[-39] -> 2
A38: Canada | B38: World - A | C38: C51 | D38: 0 | E38: 1 | F38: 1 | G38: 1 | H38: 2 | I38: 1 | J38: 2 | K38: 2 | L38: 2 | M38: 2 | N38: 2 | O38: 2 | P38: 2 | Q38: 2 | R38: 2 | S38: 2 | T38: 2 | U38: 2 | V38: 1 | W38: 0 | X38: 1 | Y38: 1 | Z38: 1 | AA38: 1 | AB38: 1 | AC38: 1 | AD38: 1 | AE38: 1 | AF38: 1 | AG38: 1 | AH38: 1 | AI38: 1 | AJ38: 1 | AK38: 1 | AL38: 1 | AM38: 1 | AN38: 1 | AO38: 1 | AP38: 1 | AQ38: 1 | AR38: =MAX(RC[-30],RC[-29]) -> 2 | AS38: =MAX(RC[-24],RC[-23]) -> 2 | AT38: =MAX(RC[-12],RC[-23]) -> 1 | AU38: =MAX(RC[-27],RC[-43]) -> 2 | AV38: =MAX(RC[-26],RC[-44]) -> 1 | AW38: =MAX(RC[-42],RC[-45]) -> 1 | AX38: =MAX(RC[-43]:RC[-37]) -> 2 | AY38: =RC[-39] -> 2
A39: New Zealand | B39: World - A | C39: C71 | D39: 0 | E39: 2 | F39: 2 | G39: 2 | H39: 2 | I39: 2 | J39: 2 | K39: 2 | L39: 2 | M39: 2 | N39: 2 | O39: 2 | P39: 2 | Q39: 2 | R39: 2 | S39: 2 | T39: 2 | U39: 2 | V39: 2 | W39: 0 | X39: 2 | Y39: 2 | Z39: 2 | AA39: 2 | AB39: 2 | AC39: 2 | AD39: 2 | AE39: 2 | AF39: 2 | AG39: 2 | AH39: 2 | AI39: 2 | AJ39: 2 | AK39: 2 | AL39: 2 | AM39: 2 | AN39: 2 | AO39: 2 | AP39: 2 | AQ39: 2 | AR39: =MAX(RC[-30],RC[-29]) -> 2 | AS39: =MAX(RC[-24],RC[-23]) -> 2 | AT39: =MAX(RC[-12],RC[-23]) -> 2 | AU39: =MAX(RC[-27],RC[-43]) -> 2 | AV39: =MAX(RC[-26],RC[-44]) -> 2 | AW39: =MAX(RC[-42],RC[-45]) -> 2 | AX39: =MAX(RC[-43]:RC[-37]) -> 2 | AY39: =RC[-39] -> 2
A40: Mexico | B40: World - B | C40: C72 | D40: 0 | E40: 2 | F40: 2 | G40: 2 | H40: 2 | I40: 2 | J40: 2 | K40: 2 | L40: 2 | M40: 2 | N40: 2 | O40: 2 | P40: 2 | Q40: 2 | R40: 2 | S40: 2 | T40: 2 | U40: 2 | V40: 2 | W40: 0 | X40: 2 | Y40: 2 | Z40: 2 | AA40: 2 | AB40: 2 | AC40: 2 | AD40: 2 | AE40: 2 | AF40: 2 | AG40: 2 | AH40: 2 | AI40: 2 | AJ40: 2 | AK40: 2 | AL40: 2 | AM40: 2 | AN40: 2 | AO40: 2 | AP40: 2 | AQ40: 2 | AR40: =MAX(RC[-30],RC[-29]) -> 2 | AS40: =MAX(RC[-24],RC[-23]) -> 2 | AT40: =MAX(RC[-12],RC[-23]) -> 2 | AU40: =MAX(RC[-27],RC[-43]) -> 2 | AV40: =MAX(RC[-26],RC[-44]) -> 2 | AW40: =MAX(RC[-42],RC[-45]) -> 2 | AX40: =MAX(RC[-43]:RC[-37]) -> 2 | AY40: =RC[-39] -> 2
A41: CEE - Total | B41: Totals | D41: 0 | E41: 0 | F41: 0 | G41: 0 | H41: 0 | I41: 0 | J41: 0 | K41: 0 | L41: 0 | M41: 0 | N41: 0 | O41: 0 | P41: 0 | Q41: 0 | R41: 0 | S41: 0 | T41: 0 | U41: 0 | V41: 0 | W41: 0 | X41: 0 | Y41: 0 | Z41: 0 | AA41: 0 | AB41: 0 | AC41: 0 | AD41: 0 | AE41: 0 | AF41: 0 | AG41: 0 | AH41: 0 | AI41: 0 | AJ41: 0 | AK41: 0 | AL41: 0 | AM41: 0 | AN41: 0 | AO41: 0 | AP41: 0 | AQ41: 0 | AR41: 0 | AS41: =MAX(RC[-24],RC[-23]) -> 0 | AT41: =MAX(RC[-12],RC[-23]) -> 0 | AU41: =MAX(RC[-27],RC[-43]) -> 0 | AV41: =MAX(RC[-26],RC[-44]) -> 0 | AW41: =MAX(RC[-42],RC[-45]) -> 0 | AX41: =MAX(RC[-43]:RC[-37]) -> 0 | AY41: =RC[-39] -> 0
A42: EU - Total | B42: Totals | D42: 0 | E42: 0 | F42: 0 | G42: 0 | H42: 0 | I42: 0 | J42: 0 | K42: 0 | L42: 0 | M42: 0 | N42: 0 | O42: 0 | P42: 0 | Q42: 0 | R42: 0 | S42: 0 | T42: 0 | U42: 0 | V42: 0 | W42: 0 | X42: 0 | Y42: 0 | Z42: 0 | AA42: 0 | AB42: 0 | AC42: 0 | AD42: 0 | AE42: 0 | AF42: 0 | AG42: 0 | AH42: 0 | AI42: 0 | AJ42: 0 | AK42: 0 | AL42: 0 | AM42: 0 | AN42: 0 | AO42: 0 | AP42: 0 | AQ42: 0 | AR42: 0 | AS42: =MAX(RC[-24],RC[-23]) -> 0 | AT42: =MAX(RC[-12],RC[-23]) -> 0 | AU42: =MAX(RC[-27],RC[-43]) -> 0 | AV42: =MAX(RC[-26],RC[-44]) -> 0 | AW42: =MAX(RC[-42],RC[-45]) -> 0 | AX42: =MAX(RC[-43]:RC[-37]) -> 0 | AY42: =RC[-39] -> 0
A43: EFTA - Total | B43: Totals | D43: 0 | E43: 0 | F43: 0 | G43: 0 | H43: 0 | I43: 0 | J43: 0 | K43: 0 | L43: 0 | M43: 0 | N43: 0 | O43: 0 | P43: 0 | Q43: 0 | R43: 0 | S43: 0 | T43: 0 | U43: 0 | V43: 0 | W43: 0 | X43: 0 | Y43: 0 | Z43: 0 | AA43: 0 | AB43: 0 | AC43: 0 | AD43: 0 | AE43: 0 | AF43: 0 | AG43: 0 | AH43: 0 | AI43: 0 | AJ43: 0 | AK43: 0 | AL43: 0 | AM43: 0 | AN43: 0 | AO43: 0 | AP43: 0 | AQ43: 0 | AR43: 0 | AS43: =MAX(RC[-24],RC[-23]) -> 0 | AT43: =MAX(RC[-12],RC[-23]) -> 0 | AU43: =MAX(RC[-27],RC[-43]) -> 0 | AV43: =MAX(RC[-26],RC[-44]) -> 0 | AW43: =MAX(RC[-42],RC[-45]) -> 0 | AX43: =MAX(RC[-43]:RC[-37]) -> 0 | AY43: =RC[-39] -> 0
A44: World A - Total | B44: Totals | D44: 0 | E44: 0 | F44: 0 | G44: 0 | H44: 0 | I44: 0 | J44: 0 | K44: 0 | L44: 0 | M44: 0 | N44: 0 | O44: 0 | P44: 0 | Q44: 0 | R44: 0 | S44: 0 | T44: 0 | U44: 0 | V44: 0 | W44: 0 | X44: 0 | Y44: 0 | Z44: 0 | AA44: 0 | AB44: 0 | AC44: 0 | AD44: 0 | AE44: 0 | AF44: 0 | AG44: 0 | AH44: 0 | AI44: 0 | AJ44: 0 | AK44: 0 | AL44: 0 | AM44: 0 | AN44: 0 | AO44: 0 | AP44: 0 | AQ44: 0 | AR44: 0 | AS44: =MAX(RC[-24],RC[-23]) -> 0 | AT44: =MAX(RC[-12],RC[-23]) -> 0 | AU44: =MAX(RC[-27],RC[-43]) -> 0 | AV44: =MAX(RC[-26],RC[-44]) -> 0 | AW44: =MAX(RC[-42],RC[-45]) -> 0 | AX44: =MAX(RC[-43]:RC[-37]) -> 0 | AY44: =RC[-39] -> 0
A45: World B - Total | B45: Totals | D45: 0 | E45: 0 | F45: 0 | G45: 0 | H45: 0 | I45: 0 | J45: 0 | K45: 0 | L45: 0 | M45: 0 | N45: 0 | O45: 0 | P45: 0 | Q45: 0 | R45: 0 | S45: 0 | T45: 0 | U45: 0 | V45: 0 | W45: 0 | X45: 0 | Y45: 0 | Z45: 0 | AA45: 0 | AB45: 0 | AC45: 0 | AD45: 0 | AE45: 0 | AF45: 0 | AG45: 0 | AH45: 0 | AI45: 0 | AJ45: 0 | AK45: 0 | AL45: 0 | AM45: 0 | AN45: 0 | AO45: 0 | AP45: 0 | AQ45: 0 | AR45: 0 | AS45: =MAX(RC[-24],RC[-23]) -> 0 | AT45: =MAX(RC[-12],RC[-23]) -> 0 | AU45: =MAX(RC[-27],RC[-43]) -> 0 | AV45: =MAX(RC[-26],RC[-44]) -> 0 | AW45: =MAX(RC[-42],RC[-45]) -> 0 | AX45: =MAX(RC[-43]:RC[-37]) -> 0 | AY45: =RC[-39] -> 0
E47: 0 | F47: 0 | G47: 0 | H47: 0 | I47: 1 | J47: 1 | K47: 0 | L47: 0 | M47: 1 | N47: 0 | O47: 0 | P47: 1 | Q47: 1 | R47: 1 | S47: 2 | T47: 0 | U47: 0 | V47: 0 | W47: 1 | X47: 0 | Y47: 1 | Z47: 1 | AA47: 0 | AB47: 0 | AC47: 0 | AD47: 0 | AE47: 0 | AF47: 0 | AG47: 0 | AH47: 0 | AI47: 0 | AJ47: 0 | AK47: 0 | AL47: 0 | AM47: 2 | AN47: 2 | AO47: 2 | AP47: 2 | AQ47: 2
E48: 0 | F48: 0 | G48: 0 | H48: 0 | I48: 1 | J48: 1 | K48: 1 | L48: 1 | M48: 1 | N48: 0 | O48: 1 | P48: 1 | Q48: 1 | R48: 1 | S48: 2 | T48: 0 | U48: 0 | V48: 1 | W48: 1 | X48: 0 | Y48: 0 | Z48: 0 | AA48: 2 | AB48: 0 | AC48: 2 | AD48: 2 | AE48: 2 | AF48: 2 | AG48: 2 | AH48: 2 | AI48: 2 | AJ48: 2 | AK48: 2 | AL48: 2 | AM48: 2 | AN48: 2 | AO48: 2 | AP48: 2 | AQ48: 2
E49: 0 | F49: 0 | G49: 0 | H49: 0 | I49: 0 | J49: 0 | K49: 0 | L49: 0 | M49: 0 | N49: 0 | O49: 0 | P49: 0 | Q49: 0 | R49: 0 | S49: 0 | T49: 0 | U49: 0 | V49: 0 | W49: 1 | X49: 0 | Y49: 0 | Z49: 0 | AA49: 0 | AB49: 0 | AC49: 0 | AD49: 0 | AE49: 0 | AF49: 0 | AG49: 0 | AH49: 0 | AI49: 0 | AJ49: 0 | AK49: 0 | AL49: 0 | AM49: 0 | AN49: 0 | AO49: 0 | AP49: 0 | AQ49: 0
E50: 0 | F50: 0 | G50: 0 | H50: 0 | I50: 1 | J50: 1 | K50: 1 | L50: 0 | M50: 0 | N50: 1 | O50: 1 | P50: 1 | Q50: 1 | R50: 1 | S50: 2 | T50: 0 | U50: 0 | V50: 0 | W50: 1 | X50: 0 | Y50: 0 | Z50: 0 | AA50: 0 | AB50: 0 | AC50: 1 | AD50: 1 | AE50: 1 | AF50: 1 | AG50: 1 | AH50: 1 | AI50: 0 | AJ50: 0 | AK50: 0 | AL50: 0 | AM50: 2 | AN50: 2 | AO50: 2 | AP50: 2 | AQ50: 2
E51: 0 | F51: 0 | G51: 0 | H51: 1 | I51: 1 | J51: 1 | K51: 1 | L51: 1 | M51: 1 | N51: 0 | O51: 1 | P51: 1 | Q51: 1 | R51: 1 | S51: 2 | T51: 0 | U51: 0 | V51: 1 | W51: 1 | X51: 0 | Y51: 0 | Z51: 0 | AA51: 0 | AB51: 0 | AC51: 0 | AD51: 0 | AE51: 0 | AF51: 0 | AG51: 1 | AH51: 1 | AI51: 1 | AJ51: 1 | AK51: 1 | AL51: 1 | AM51: 1 | AN51: 1 | AO51: 1 | AP51: 1 | AQ51: 1
E52: 0 | F52: 0 | G52: 0 | H52: 0 | I52: 0 | J52: 0 | K52: 0 | L52: 0 | M52: 0 | N52: 0 | O52: 0 | P52: 0 | Q52: 0 | R52: 1 | S52: 2 | T52: 0 | U52: 0 | V52: 0 | W52: 1 | X52: 0 | Y52: 0 | Z52: 0 | AA52: 0 | AB52: 0 | AC52: 0 | AD52: 0 | AE52: 0 | AF52: 0 | AG52: 0 | AH52: 0 | AI52: 0 | AJ52: 0 | AK52: 0 | AL52: 0 | AM52: 2 | AN52: 2 | AO52: 2 | AP52: 2 | AQ52: 2
E53: 1 | F53: 1 | G53: 1 | H53: 1 | I53: 1 | J53: 1 | K53: 1 | L53: 1 | M53: 1 | N53: 1 | O53: 1 | P53: 1 | Q53: 1 | R53: 1 | S53: 2 | T53: 1 | U53: 1 | V53: 1 | W53: 1 | X53: 1 | Y53: 1 | Z53: 1 | AA53: 1 | AB53: 1 | AC53: 1 | AD53: 1 | AE53: 1 | AF53: 1 | AG53: 1 | AH53: 1 | AI53: 1 | AJ53: 1 | AK53: 1 | AL53: 1 | AM53: 1 | AN53: 1 | AO53: 1 | AP53: 1 | AQ53: 1
E54: 2 | F54: 2 | G54: 2 | H54: 2 | I54: 2 | J54: 2 | K54: 2 | L54: 2 | M54: 2 | N54: 2 | O54: 2 | P54: 2 | Q54: 2 | R54: 2 | S54: 2 | T54: 2 | U54: 2 | V54: 2 | W54: 2 | X54: 2 | Y54: 2 | Z54: 2 | AA54: 2 | AB54: 2 | AC54: 2 | AD54: 2 | AE54: 2 | AF54: 2 | AG54: 2 | AH54: 2 | AI54: 2 | AJ54: 2 | AK54: 2 | AL54: 2 | AM54: 2 | AN54: 2 | AO54: 2 | AP54: 2 | AQ54: 2
E55: 0 | F55: 0 | G55: 0 | H55: 0 | I55: 0 | J55: 1 | K55: 1 | L55: 1 | M55: 1 | N55: 0 | O55: 0 | P55: 1 | Q55: 1 | R55: 0 | S55: 2 | T55: 0 | U55: 0 | V55: 0 | W55: 1 | X55: 0 | Y55: 0 | Z55: 0 | AA55: 0 | AB55: 0 | AC55: 0 | AD55: 0 | AE55: 0 | AF55: 0 | AG55: 0 | AH55: 0 | AI55: 0 | AJ55: 0 | AK55: 0 | AL55: 0 | AM55: 2 | AN55: 2 | AO55: 2 | AP55: 2 | AQ55: 2
E56: 0 | F56: 0 | G56: 0 | H56: 0 | I56: 1 | J56: 1 | K56: 1 | L56: 1 | M56: 1 | N56: 0 | O56: 0 | P56: 1 | Q56: 1 | R56: 1 | S56: 2 | T56: 0 | U56: 0 | V56: 0 | W56: 1 | X56: 0 | Y56: 0 | Z56: 0 | AA56: 1 | AB56: 0 | AC56: 1 | AD56: 1 | AE56: 1 | AF56: 1 | AG56: 1 | AH56: 1 | AI56: 1 | AJ56: 1 | AK56: 1 | AL56: 0 | AM56: 2 | AN56: 2 | AO56: 2 | AP56: 2 | AQ56: 2
E57: 1 | F57: 1 | G57: 1 | H57: 1 | I57: 1 | J57: 1 | K57: 1 | L57: 1 | M57: 1 | N57: 1 | O57: 1 | P57: 1 | Q57: 1 | R57: 1 | S57: 2 | T57: 1 | U57: 1 | V57: 1 | W57: 1 | X57: 1 | Y57: 1 | Z57: 1 | AA57: 2 | AB57: 2 | AC57: 2 | AD57: 2 | AE57: 2 | AF57: 2 | AG57: 2 | AH57: 2 | AI57: 2 | AJ57: 2 | AK57: 2 | AL57: 2 | AM57: 2 | AN57: 2 | AO57: 2 | AP57: 2 | AQ57: 2
E58: 1 | F58: 1 | G58: 1 | H58: 1 | I58: 1 | J58: 1 | K58: 1 | L58: 1 | M58: 1 | N58: 1 | O58: 1 | P58: 1 | Q58: 1 | R58: 1 | S58: 2 | T58: 1 | U58: 1 | V58: 1 | W58: 1 | X58: 1 | Y58: 1 | Z58: 1 | AA58: 1 | AB58: 1 | AC58: 1 | AD58: 1 | AE58: 1 | AF58: 1 | AG58: 1 | AH58: 1 | AI58: 1 | AJ58: 1 | AK58: 1 | AL58: 1 | AM58: 1 | AN58: 1 | AO58: 1 | AP58: 1 | AQ58: 1
E59: 0 | F59: 0 | G59: 0 | H59: 1 | I59: 0 | J59: 0 | K59: 0 | L59: 0 | M59: 0 | N59: 0 | O59: 0 | P59: 1 | Q59: 1 | R59: 0 | S59: 2 | T59: 1 | U59: 0 | V59: 1 | W59: 1 | X59: 0 | Y59: 0 | Z59: 0 | AA59: 0 | AB59: 0 | AC59: 0 | AD59: 0 | AE59: 0 | AF59: 0 | AG59: 0 | AH59: 0 | AI59: 0 | AJ59: 0 | AK59: 0 | AL59: 0 | AM59: 0 | AN59: 0 | AO59: 0 | AP59: 0 | AQ59: 0
E60: 1 | F60: 1 | G60: 1 | H60: 1 | I60: 1 | J60: 1 | K60: 1 | L60: 1 | M60: 1 | N60: 1 | O60: 1 | P60: 1 | Q60: 1 | R60: 1 | S60: 2 | T60: 1 | U60: 1 | V60: 1 | W60: 1 | X60: 1 | Y60: 1 | Z60: 1 | AA60: 1 | AB60: 1 | AC60: 1 | AD60: 1 | AE60: 1 | AF60: 1 | AG60: 1 | AH60: 1 | AI60: 1 | AJ60: 1 | AK60: 1 | AL60: 1 | AM60: 2 | AN60: 2 | AO60: 2 | AP60: 2 | AQ60: 2
E61: 0 | F61: 0 | G61: 0 | H61: 0 | I61: 1 | J61: 0 | K61: 0 | L61: 0 | M61: 1 | N61: 0 | O61: 0 | P61: 1 | Q61: 1 | R61: 1 | S61: 2 | T61: 1 | U61: 0 | V61: 0 | W61: 1 | X61: 0 | Y61: 0 | Z61: 0 | AA61: 0 | AB61: 0 | AC61: 0 | AD61: 0 | AE61: 0 | AF61: 0 | AG61: 0 | AH61: 0 | AI61: 0 | AJ61: 0 | AK61: 0 | AL61: 0 | AM61: 2 | AN61: 2 | AO61: 2 | AP61: 2 | AQ61: 2
E62: 1 | F62: 1 | G62: 1 | H62: 1 | I62: 1 | J62: 1 | K62: 1 | L62: 1 | M62: 1 | N62: 1 | O62: 1 | P62: 1 | Q62: 1 | R62: 1 | S62: 2 | T62: 1 | U62: 1 | V62: 1 | W62: 1 | X62: 1 | Y62: 1 | Z62: 1 | AA62: 1 | AB62: 1 | AC62: 1 | AD62: 1 | AE62: 1 | AF62: 1 | AG62: 1 | AH62: 1 | AI62: 1 | AJ62: 1 | AK62: 1 | AL62: 1 | AM62: 2 | AN62: 2 | AO62: 2 | AP62: 2 | AQ62: 2
E63: 2 | F63: 2 | G63: 2 | H63: 2 | I63: 2 | J63: 2 | K63: 2 | L63: 2 | M63: 2 | N63: 2 | O63: 2 | P63: 2 | Q63: 2 | R63: 2 | S63: 2 | T63: 2 | U63: 2 | V63: 2 | W63: 2 | X63: 2 | Y63: 2 | Z63: 2 | AA63: 2 | AB63: 0 | AC63: 0 | AD63: 0 | AE63: 0 | AF63: 2 | AG63: 2 | AH63: 1 | AI63: 1 | AJ63: 1 | AK63: 1 | AL63: 1 | AM63: 2 | AN63: 2 | AO63: 2 | AP63: 2 | AQ63: 2
E64: 2 | F64: 2 | G64: 2 | H64: 2 | I64: 2 | J64: 2 | K64: 2 | L64: 2 | M64: 2 | N64: 2 | O64: 2 | P64: 2 | Q64: 2 | R64: 2 | S64: 2 | T64: 2 | U64: 2 | V64: 2 | W64: 2 | X64: 2 | Y64: 2 | Z64: 2 | AA64: 2 | AB64: 2 | AC64: 2 | AD64: 2 | AE64: 2 | AF64: 2 | AG64: 2 | AH64: 2 | AI64: 2 | AJ64: 2 | AK64: 2 | AL64: 2 | AM64: 2 | AN64: 2 | AO64: 2 | AP64: 2 | AQ64: 2
E65: 1 | F65: 1 | G65: 1 | H65: 1 | I65: 1 | J65: 1 | K65: 1 | L65: 1 | M65: 1 | N65: 1 | O65: 1 | P65: 1 | Q65: 1 | R65: 1 | S65: 2 | T65: 1 | U65: 1 | V65: 1 | W65: 1 | X65: 1 | Y65: 1 | Z65: 1 | AA65: 2 | AB65: 2 | AC65: 2 | AD65: 2 | AE65: 2 | AF65: 2 | AG65: 2 | AH65: 2 | AI65: 2 | AJ65: 2 | AK65: 2 | AL65: 2 | AM65: 2 | AN65: 2 | AO65: 2 | AP65: 2 | AQ65: 2
E66: 2 | F66: 2 | G66: 2 | H66: 2 | I66: 2 | J66: 2 | K66: 2 | L66: 2 | M66: 2 | N66: 2 | O66: 2 | P66: 2 | Q66: 2 | R66: 2 | S66: 2 | T66: 2 | U66: 2 | V66: 2 | W66: 2 | X66: 2 | Y66: 2 | Z66: 2 | AA66: 2 | AB66: 2 | AC66: 2 | AD66: 2 | AE66: 2 | AF66: 2 | AG66: 2 | AH66: 2 | AI66: 2 | AJ66: 2 | AK66: 2 | AL66: 2 | AM66: 2 | AN66: 2 | AO66: 2 | AP66: 2 | AQ66: 2
E67: 1 | F67: 1 | G67: 1 | H67: 1 | I67: 1 | J67: 1 | K67: 1 | L67: 1 | M67: 1 | N67: 1 | O67: 1 | P67: 1 | Q67: 1 | R67: 1 | S67: 2 | T67: 1 | U67: 1 | V67: 1 | W67: 1 | X67: 1 | Y67: 1 | Z67: 1 | AA67: 2 | AB67: 1 | AC67: 2 | AD67: 2 | AE67: 2 | AF67: 2 | AG67: 2 | AH67: 2 | AI67: 1 | AJ67: 1 | AK67: 1 | AL67: 1 | AM67: 2 | AN67: 2 | AO67: 2 | AP67: 2 | AQ67: 2
E68: 1 | F68: 1 | G68: 1 | H68: 1 | I68: 1 | J68: 1 | K68: 1 | L68: 1 | M68: 1 | N68: 1 | O68: 1 | P68: 1 | Q68: 1 | R68: 1 | S68: 2 | T68: 1 | U68: 1 | V68: 1 | W68: 1 | X68: 1 | Y68: 1 | Z68: 1 | AA68: 2 | AB68: 2 | AC68: 2 | AD68: 2 | AE68: 2 | AF68: 2 | AG68: 2 | AH68: 2 | AI68: 2 | AJ68: 2 | AK68: 2 | AL68: 2 | AM68: 2 | AN68: 2 | AO68: 2 | AP68: 2 | AQ68: 2
E69: 0 | F69: 0 | G69: 0 | H69: 0 | I69: 1 | J69: 0 | K69: 0 | L69: 0 | M69: 1 | N69: 0 | O69: 1 | P69: 1 | Q69: 1 | R69: 1 | S69: 2 | T69: 1 | U69: 0 | V69: 1 | W69: 1 | X69: 0 | Y69: 0 | Z69: 0 | AA69: 0 | AB69: 0 | AC69: 0 | AD69: 0 | AE69: 0 | AF69: 0 | AG69: 0 | AH69: 0 | AI69: 0 | AJ69: 0 | AK69: 0 | AL69: 0 | AM69: 2 | AN69: 2 | AO69: 2 | AP69: 2 | AQ69: 2
E70: 1 | F70: 1 | G70: 1 | H70: 1 | I70: 1 | J70: 1 | K70: 1 | L70: 1 | M70: 1 | N70: 1 | O70: 1 | P70: 1 | Q70: 1 | R70: 1 | S70: 2 | T70: 1 | U70: 1 | V70: 1 | W70: 1 | X70: 1 | Y70: 1 | Z70: 1 | AA70: 1 | AB70: 1 | AC70: 1 | AD70: 1 | AE70: 1 | AF70: 1 | AG70: 1 | AH70: 1 | AI70: 1 | AJ70: 1 | AK70: 1 | AL70: 1 | AM70: 1 | AN70: 1 | AO70: 1 | AP70: 1 | AQ70: 1
E71: 0 | F71: 0 | G71: 0 | H71: 0 | I71: 1 | J71: 0 | K71: 0 | L71: 0 | M71: 0 | N71: 0 | O71: 0 | P71: 1 | Q71: 1 | R71: 1 | S71: 2 | T71: 0 | U71: 0 | V71: 0 | W71: 1 | X71: 0 | Y71: 0 | Z71: 0 | AA71: 0 | AB71: 0 | AC71: 0 | AD71: 0 | AE71: 0 | AF71: 0 | AG71: 0 | AH71: 0 | AI71: 1 | AJ71: 1 | AK71: 1 | AL71: 0 | AM71: 2 | AN71: 2 | AO71: 2 | AP71: 2 | AQ71: 2
E72: 1 | F72: 1 | G72: 1 | H72: 1 | I72: 1 | J72: 1 | K72: 1 | L72: 1 | M72: 1 | N72: 1 | O72: 1 | P72: 1 | Q72: 1 | R72: 1 | S72: 2 | T72: 1 | U72: 1 | V72: 1 | W72: 1 | X72: 1 | Y72: 1 | Z72: 1 | AA72: 1 | AB72: 1 | AC72: 1 | AD72: 1 | AE72: 1 | AF72: 1 | AG72: 1 | AH72: 1 | AI72: 1 | AJ72: 1 | AK72: 1 | AL72: 1 | AM72: 2 | AN72: 2 | AO72: 2 | AP72: 2 | AQ72: 2
E73: 2 | F73: 2 | G73: 2 | H73: 2 | I73: 2 | J73: 2 | K73: 2 | L73: 2 | M73: 2 | N73: 2 | O73: 2 | P73: 2 | Q73: 2 | R73: 2 | S73: 2 | T73: 2 | U73: 2 | V73: 2 | W73: 2 | X73: 2 | Y73: 2 | Z73: 2 | AA73: 2 | AB73: 2 | AC73: 2 | AD73: 2 | AE73: 2 | AF73: 2 | AG73: 2 | AH73: 2 | AI73: 2 | AJ73: 2 | AK73: 2 | AL73: 2 | AM73: 2 | AN73: 2 | AO73: 2 | AP73: 2 | AQ73: 2
E74: 0 | F74: 0 | G74: 0 | H74: 0 | I74: 1 | J74: 0 | K74: 0 | L74: 0 | M74: 1 | N74: 0 | O74: 0 | P74: 1 | Q74: 1 | R74: 0 | S74: 2 | T74: 0 | U74: 0 | V74: 0 | W74: 1 | X74: 0 | Y74: 0 | Z74: 0 | AA74: 0 | AB74: 0 | AC74: 0 | AD74: 0 | AE74: 0 | AF74: 0 | AG74: 0 | AH74: 0 | AI74: 0 | AJ74: 0 | AK74: 0 | AL74: 0 | AM74: 2 | AN74: 2 | AO74: 2 | AP74: 2 | AQ74: 2
E75: 0 | F75: 0 | G75: 0 | H75: 1 | I75: 0 | J75: 0 | K75: 0 | L75: 0 | M75: 0 | N75: 0 | O75: 0 | P75: 1 | Q75: 1 | R75: 1 | S75: 2 | T75: 0 | U75: 0 | V75: 1 | W75: 1 | X75: 1 | Y75: 1 | Z75: 0 | AA75: 0 | AB75: 0 | AC75: 0 | AD75: 0 | AE75: 0 | AF75: 0 | AG75: 0 | AH75: 0 | AI75: 1 | AJ75: 1 | AK75: 1 | AL75: 1 | AM75: 1 | AN75: 1 | AO75: 1 | AP75: 1 | AQ75: 0
E76: 1 | F76: 1 | G76: 1 | H76: 1 | I76: 1 | J76: 1 | K76: 1 | L76: 1 | M76: 1 | N76: 1 | O76: 1 | P76: 1 | Q76: 1 | R76: 1 | S76: 1 | T76: 1 | U76: 1 | V76: 1 | W76: 1 | X76: 1 | Y76: 1 | Z76: 1 | AA76: 1 | AB76: 1 | AC76: 1 | AD76: 1 | AE76: 1 | AF76: 1 | AG76: 1 | AH76: 1 | AI76: 1 | AJ76: 1 | AK76: 1 | AL76: 1 | AM76: 2 | AN76: 2 | AO76: 2 | AP76: 2 | AQ76: 2
E77: 2 | F77: 2 | G77: 2 | H77: 2 | I77: 2 | J77: 2 | K77: 2 | L77: 2 | M77: 2 | N77: 2 | O77: 2 | P77: 2 | Q77: 2 | R77: 2 | S77: 2 | T77: 2 | U77: 2 | V77: 2 | W77: 2 | X77: 2 | Y77: 2 | Z77: 2 | AA77: 2 | AB77: 2 | AC77: 2 | AD77: 2 | AE77: 2 | AF77: 2 | AG77: 2 | AH77: 2 | AI77: 2 | AJ77: 2 | AK77: 2 | AL77: 2 | AM77: 2 | AN77: 2 | AO77: 2 | AP77: 2 | AQ77: 2
E78: 2 | F78: 2 | G78: 2 | H78: 2 | I78: 2 | J78: 2 | K78: 2 | L78: 2 | M78: 2 | N78: 2 | O78: 2 | P78: 2 | Q78: 2 | R78: 2 | S78: 2 | T78: 2 | U78: 2 | V78: 2 | W78: 2 | X78: 2 | Y78: 2 | Z78: 2 | AA78: 2 | AB78: 2 | AC78: 2 | AD78: 2 | AE78: 2 | AF78: 2 | AG78: 2 | AH78: 2 | AI78: 2 | AJ78: 2 | AK78: 2 | AL78: 2 | AM78: 2 | AN78: 2 | AO78: 2 | AP78: 2 | AQ78: 2
E79: 1 | F79: 1 | G79: 1 | H79: 1 | I79: 1 | J79: 1 | K79: 1 | L79: 1 | M79: 1 | N79: 1 | O79: 1 | P79: 1 | Q79: 1 | R79: 1 | S79: 1 | T79: 1 | U79: 1 | V79: 1 | W79: 1 | X79: 1 | Y79: 1 | Z79: 1 | AA79: 1 | AB79: 1 | AC79: 1 | AD79: 1 | AE79: 1 | AF79: 1 | AG79: 1 | AH79: 1 | AI79: 1 | AJ79: 1 | AK79: 1 | AL79: 1 | AM79: 2 | AN79: 2 | AO79: 2 | AP79: 2 | AQ79: 2
E80: 2 | F80: 2 | G80: 2 | H80: 2 | I80: 2 | J80: 2 | K80: 2 | L80: 2 | M80: 2 | N80: 2 | O80: 2 | P80: 2 | Q80: 2 | R80: 2 | S80: 2 | T80: 2 | U80: 2 | V80: 2 | W80: 2 | X80: 2 | Y80: 2 | Z80: 2 | AA80: 2 | AB80: 2 | AC80: 2 | AD80: 2 | AE80: 2 | AF80: 2 | AG80: 2 | AH80: 2 | AI80: 2 | AJ80: 2 | AK80: 2 | AL80: 2 | AM80: 2 | AN80: 2 | AO80: 2 | AP80: 2 | AQ80: 2
E81: 2 | F81: 2 | G81: 2 | H81: 2 | I81: 2 | J81: 2 | K81: 2 | L81: 2 | M81: 2 | N81: 2 | O81: 2 | P81: 2 | Q81: 2 | R81: 2 | S81: 2 | T81: 2 | U81: 2 | V81: 2 | W81: 2 | X81: 2 | Y81: 2 | Z81: 2 | AA81: 2 | AB81: 2 | AC81: 2 | AD81: 2 | AE81: 2 | AF81: 2 | AG81: 2 | AH81: 2 | AI81: 2 | AJ81: 2 | AK81: 2 | AL81: 2 | AM81: 2 | AN81: 2 | AO81: 2 | AP81: 2 | AQ81: 2
E82: 2 | F82: 2 | G82: 2 | H82: 2 | I82: 2 | J82: 2 | K82: 2 | L82: 2 | M82: 2 | N82: 2 | O82: 2 | P82: 2 | Q82: 2 | R82: 2 | S82: 2 | T82: 2 | U82: 2 | V82: 2 | W82: 2 | X82: 2 | Y82: 2 | Z82: 2 | AA82: 2 | AB82: 2 | AC82: 2 | AD82: 2 | AE82: 2 | AF82: 2 | AG82: 2 | AH82: 2 | AI82: 2 | AJ82: 2 | AK82: 2 | AL82: 2 | AM82: 2 | AN82: 2 | AO82: 2 | AP82: 2 | AQ82: 2
E83: 2 | F83: 2 | G83: 2 | H83: 2 | I83: 2 | J83: 2 | K83: 2 | L83: 2 | M83: 2 | N83: 2 | O83: 2 | P83: 2 | Q83: 2 | R83: 2 | S83: 2 | T83: 2 | U83: 2 | V83: 2 | W83: 2 | X83: 2 | Y83: 2 | Z83: 2 | AA83: 2 | AB83: 2 | AC83: 2 | AD83: 2 | AE83: 2 | AF83: 2 | AG83: 2 | AH83: 2 | AI83: 2 | AJ83: 2 | AK83: 2 | AL83: 2 | AM83: 2 | AN83: 2 | AO83: 2 | AP83: 2 | AQ83: 2
E84: 0 | F84: 0 | G84: 0 | H84: 0 | I84: 0 | J84: 0 | K84: 0 | L84: 0 | M84: 0 | N84: 0 | O84: 0 | P84: 0 | Q84: 0 | R84: 0 | S84: 0 | T84: 0 | U84: 0 | V84: 0 | W84: 0 | X84: 0 | Y84: 0 | Z84: 0 | AA84: 0 | AB84: 0 | AC84: 0 | AD84: 0 | AE84: 0 | AF84: 0 | AG84: 0 | AH84: 0 | AI84: 0 | AJ84: 0 | AK84: 0 | AL84: 0 | AM84: 0 | AN84: 0 | AO84: 0 | AP84: 0 | AQ84: 0
E85: 0 | F85: 0 | G85: 0 | H85: 0 | I85: 0 | J85: 0 | K85: 0 | L85: 0 | M85: 0 | N85: 0 | O85: 0 | P85: 0 | Q85: 0 | R85: 0 | S85: 0 | T85: 0 | U85: 0 | V85: 0 | W85: 0 | X85: 0 | Y85: 0 | Z85: 0 | AA85: 0 | AB85: 0 | AC85: 0 | AD85: 0 | AE85: 0 | AF85: 0 | AG85: 0 | AH85: 0 | AI85: 0 | AJ85: 0 | AK85: 0 | AL85: 0 | AM85: 0 | AN85: 0 | AO85: 0 | AP85: 0 | AQ85: 0
E86: 0 | F86: 0 | G86: 0 | H86: 0 | I86: 0 | J86: 0 | K86: 0 | L86: 0 | M86: 0 | N86: 0 | O86: 0 | P86: 0 | Q86: 0 | R86: 0 | S86: 0 | T86: 0 | U86: 0 | V86: 0 | W86: 0 | X86: 0 | Y86: 0 | Z86: 0 | AA86: 0 | AB86: 0 | AC86: 0 | AD86: 0 | AE86: 0 | AF86: 0 | AG86: 0 | AH86: 0 | AI86: 0 | AJ86: 0 | AK86: 0 | AL86: 0 | AM86: 0 | AN86: 0 | AO86: 0 | AP86: 0 | AQ86: 0
E87: 0 | F87: 0 | G87: 0 | H87: 0 | I87: 0 | J87: 0 | K87: 0 | L87: 0 | M87: 0 | N87: 0 | O87: 0 | P87: 0 | Q87: 0 | R87: 0 | S87: 0 | T87: 0 | U87: 0 | V87: 0 | W87: 0 | X87: 0 | Y87: 0 | Z87: 0 | AA87: 0 | AB87: 0 | AC87: 0 | AD87: 0 | AE87: 0 | AF87: 0 | AG87: 0 | AH87: 0 | AI87: 0 | AJ87: 0 | AK87: 0 | AL87: 0 | AM87: 0 | AN87: 0 | AO87: 0 | AP87: 0 | AQ87: 0
E88: 0 | F88: 0 | G88: 0 | H88: 0 | I88: 0 | J88: 0 | K88: 0 | L88: 0 | M88: 0 | N88: 0 | O88: 0 | P88: 0 | Q88: 0 | R88: 0 | S88: 0 | T88: 0 | U88: 0 | V88: 0 | W88: 0 | X88: 0 | Y88: 0 | Z88: 0 | AA88: 0 | AB88: 0 | AC88: 0 | AD88: 0 | AE88: 0 | AF88: 0 | AG88: 0 | AH88: 0 | AI88: 0 | AJ88: 0 | AK88: 0 | AL88: 0 | AM88: 0 | AN88: 0 | AO88: 0 | AP88: 0 | AQ88: 0
A90: Bulgaria | B90: CEE | C90: C1 | E90: =R[-88]C-R[-43]C -> 1 | F90: =R[-88]C-R[-43]C -> 1 | G90: =R[-88]C-R[-43]C -> 1 | H90: =R[-88]C-R[-43]C -> 1 | I90: =R[-88]C-R[-43]C -> 1 | J90: =R[-88]C-R[-43]C -> 1 | K90: =R[-88]C-R[-43]C -> 1 | L90: =R[-88]C-R[-43]C -> 1 | M90: =R[-88]C-R[-43]C -> 1 | N90: =R[-88]C-R[-43]C -> 1 | O90: =R[-88]C-R[-43]C -> 1 | P90: =R[-88]C-R[-43]C -> 1 | Q90: =R[-88]C-R[-43]C -> 1 | R90: =R[-88]C-R[-43]C -> 1 | S90: =R[-88]C-R[-43]C -> 0 | T90: =R[-88]C-R[-43]C -> 1 | U90: =R[-88]C-R[-43]C -> 1 | V90: =R[-88]C-R[-43]C -> 1 | W90: =R[-88]C-R[-43]C -> -1 | X90: =R[-88]C-R[-43]C -> 1 | Y90: =R[-88]C-R[-43]C -> 0 | Z90: =R[-88]C-R[-43]C -> 0 | AA90: =R[-88]C-R[-43]C -> 1 | AB90: =R[-88]C-R[-43]C -> 1 | AC90: =R[-88]C-R[-43]C -> 1 | AD90: =R[-88]C-R[-43]C -> 1 | AE90: =R[-88]C-R[-43]C -> 1 | AF90: =R[-88]C-R[-43]C -> 1 | AG90: =R[-88]C-R[-43]C -> 1 | AH90: =R[-88]C-R[-43]C -> 1 | AI90: =R[-88]C-R[-43]C -> 1 | AJ90: =R[-88]C-R[-43]C -> 1 | AK90: =R[-88]C-R[-43]C -> 1 | AL90: =R[-88]C-R[-43]C -> 1 | AM90: =R[-88]C-R[-43]C -> 0 | AN90: =R[-88]C-R[-43]C -> 0 | AO90: =R[-88]C-R[-43]C -> 0 | AP90: =R[-88]C-R[-43]C -> 0 | AQ90: =R[-88]C-R[-43]C -> 0
A91: Czech Republic | B91: CEE | C91: C2 | E91: =R[-88]C-R[-43]C -> 0 | F91: =R[-88]C-R[-43]C -> 0 | G91: =R[-88]C-R[-43]C -> 0 | H91: =R[-88]C-R[-43]C -> 0 | I91: =R[-88]C-R[-43]C -> 1 | J91: =R[-88]C-R[-43]C -> 0 | K91: =R[-88]C-R[-43]C -> 0 | L91: =R[-88]C-R[-43]C -> 0 | M91: =R[-88]C-R[-43]C -> 1 | N91: =R[-88]C-R[-43]C -> 0 | O91: =R[-88]C-R[-43]C -> 0 | P91: =R[-88]C-R[-43]C -> 1 | Q91: =R[-88]C-R[-43]C -> 1 | R91: =R[-88]C-R[-43]C -> 1 | S91: =R[-88]C-R[-43]C -> 0 | T91: =R[-88]C-R[-43]C -> 0 | U91: =R[-88]C-R[-43]C -> 0 | V91: =R[-88]C-R[-43]C -> 0 | W91: =R[-88]C-R[-43]C -> -1 | X91: =R[-88]C-R[-43]C -> 0 | Y91: =R[-88]C-R[-43]C -> 0 | Z91: =R[-88]C-R[-43]C -> 0 | AA91: =R[-88]C-R[-43]C -> 0 | AB91: =R[-88]C-R[-43]C -> 0 | AC91: =R[-88]C-R[-43]C -> 0 | AD91: =R[-88]C-R[-43]C -> 0 | AE91: =R[-88]C-R[-43]C -> 0 | AF91: =R[-88]C-R[-43]C -> 0 | AG91: =R[-88]C-R[-43]C -> 0 | AH91: =R[-88]C-R[-43]C -> 0 | AI91: =R[-88]C-R[-43]C -> 0 | AJ91: =R[-88]C-R[-43]C -> 0 | AK91: =R[-88]C-R[-43]C -> 0 | AL91: =R[-88]C-R[-43]C -> 0 | AM91: =R[-88]C-R[-43]C -> 0 | AN91: =R[-88]C-R[-43]C -> 0 | AO91: =R[-88]C-R[-43]C -> 0 | AP91: =R[-88]C-R[-43]C -> 0 | AQ91: =R[-88]C-R[-43]C -> 0
A92: Estonia | B92: CEE | C92: C3 | E92: =R[-88]C-R[-43]C -> 0 | F92: =R[-88]C-R[-43]C -> 0 | G92: =R[-88]C-R[-43]C -> 0 | H92: =R[-88]C-R[-43]C -> 0 | I92: =R[-88]C-R[-43]C -> 0 | J92: =R[-88]C-R[-43]C -> 0 | K92: =R[-88]C-R[-43]C -> 0 | L92: =R[-88]C-R[-43]C -> 0 | M92: =R[-88]C-R[-43]C -> 0 | N92: =R[-88]C-R[-43]C -> 0 | O92: =R[-88]C-R[-43]C -> 0 | P92: =R[-88]C-R[-43]C -> 0 | Q92: =R[-88]C-R[-43]C -> 0 | R92: =R[-88]C-R[-43]C -> 0 | S92: =R[-88]C-R[-43]C -> 0 | T92: =R[-88]C-R[-43]C -> 0 | U92: =R[-88]C-R[-43]C -> 0 | V92: =R[-88]C-R[-43]C -> 0 | W92: =R[-88]C-R[-43]C -> -1 | X92: =R[-88]C-R[-43]C -> 0 | Y92: =R[-88]C-R[-43]C -> 0 | Z92: =R[-88]C-R[-43]C -> 0 | AA92: =R[-88]C-R[-43]C -> 0 | AB92: =R[-88]C-R[-43]C -> 0 | AC92: =R[-88]C-R[-43]C -> 0 | AD92: =R[-88]C-R[-43]C -> 0 | AE92: =R[-88]C-R[-43]C -> 0 | AF92: =R[-88]C-R[-43]C -> 0 | AG92: =R[-88]C-R[-43]C -> 0 | AH92: =R[-88]C-R[-43]C -> 0 | AI92: =R[-88]C-R[-43]C -> 0 | AJ92: =R[-88]C-R[-43]C -> 0 | AK92: =R[-88]C-R[-43]C -> 0 | AL92: =R[-88]C-R[-43]C -> 0 | AM92: =R[-88]C-R[-43]C -> 0 | AN92: =R[-88]C-R[-43]C -> 0 | AO92: =R[-88]C-R[-43]C -> 0 | AP92: =R[-88]C-R[-43]C -> 0 | AQ92: =R[-88]C-R[-43]C -> 1
A93: Hungary | B93: CEE | C93: C4 | E93: =R[-88]C-R[-43]C -> 1 | F93: =R[-88]C-R[-43]C -> 1 | G93: =R[-88]C-R[-43]C -> 1 | H93: =R[-88]C-R[-43]C -> 1 | I93: =R[-88]C-R[-43]C -> 1 | J93: =R[-88]C-R[-43]C -> 0 | K93: =R[-88]C-R[-43]C -> 0 | L93: =R[-88]C-R[-43]C -> 1 | M93: =R[-88]C-R[-43]C -> 1 | N93: =R[-88]C-R[-43]C -> 0 | O93: =R[-88]C-R[-43]C -> 0 | P93: =R[-88]C-R[-43]C -> 1 | Q93: =R[-88]C-R[-43]C -> 1 | R93: =R[-88]C-R[-43]C -> 1 | S93: =R[-88]C-R[-43]C -> 0 | T93: =R[-88]C-R[-43]C -> 1 | U93: =R[-88]C-R[-43]C -> 1 | V93: =R[-88]C-R[-43]C -> 1 | W93: =R[-88]C-R[-43]C -> -1 | X93: =R[-88]C-R[-43]C -> 1 | Y93: =R[-88]C-R[-43]C -> 1 | Z93: =R[-88]C-R[-43]C -> 1 | AA93: =R[-88]C-R[-43]C -> 1 | AB93: =R[-88]C-R[-43]C -> 1 | AC93: =R[-88]C-R[-43]C -> 0 | AD93: =R[-88]C-R[-43]C -> 0 | AE93: =R[-88]C-R[-43]C -> 0 | AF93: =R[-88]C-R[-43]C -> 0 | AG93: =R[-88]C-R[-43]C -> 0 | AH93: =R[-88]C-R[-43]C -> 0 | AI93: =R[-88]C-R[-43]C -> 1 | AJ93: =R[-88]C-R[-43]C -> 1 | AK93: =R[-88]C-R[-43]C -> 1 | AL93: =R[-88]C-R[-43]C -> 1 | AM93: =R[-88]C-R[-43]C -> 0 | AN93: =R[-88]C-R[-43]C -> 0 | AO93: =R[-88]C-R[-43]C -> 0 | AP93: =R[-88]C-R[-43]C -> 0 | AQ93: =R[-88]C-R[-43]C -> 0
A94: Latvia | B94: CEE | C94: C5 | E94: =R[-88]C-R[-43]C -> 0 | F94: =R[-88]C-R[-43]C -> 0 | G94: =R[-88]C-R[-43]C -> 0 | H94: =R[-88]C-R[-43]C -> 1 | I94: =R[-88]C-R[-43]C -> 1 | J94: =R[-88]C-R[-43]C -> -1 | K94: =R[-88]C-R[-43]C -> 1 | L94: =R[-88]C-R[-43]C -> -1 | M94: =R[-88]C-R[-43]C -> 1 | N94: =R[-88]C-R[-43]C -> 1 | O94: =R[-88]C-R[-43]C -> 1 | P94: =R[-88]C-R[-43]C -> 1 | Q94: =R[-88]C-R[-43]C -> 1 | R94: =R[-88]C-R[-43]C -> 1 | S94: =R[-88]C-R[-43]C -> 0 | T94: =R[-88]C-R[-43]C -> 0 | U94: =R[-88]C-R[-43]C -> 1 | V94: =R[-88]C-R[-43]C -> -1 | W94: =R[-88]C-R[-43]C -> -1 | X94: =R[-88]C-R[-43]C -> 0 | Y94: =R[-88]C-R[-43]C -> 0 | Z94: =R[-88]C-R[-43]C -> 0 | AA94: =R[-88]C-R[-43]C -> 0 | AB94: =R[-88]C-R[-43]C -> 0 | AC94: =R[-88]C-R[-43]C -> 0 | AD94: =R[-88]C-R[-43]C -> 0 | AE94: =R[-88]C-R[-43]C -> 0 | AF94: =R[-88]C-R[-43]C -> 0 | AG94: =R[-88]C-R[-43]C -> -1 | AH94: =R[-88]C-R[-43]C -> -1 | AI94: =R[-88]C-R[-43]C -> -1 | AJ94: =R[-88]C-R[-43]C -> -1 | AK94: =R[-88]C-R[-43]C -> -1 | AL94: =R[-88]C-R[-43]C -> -1 | AM94: =R[-88]C-R[-43]C -> 0 | AN94: =R[-88]C-R[-43]C -> 0 | AO94: =R[-88]C-R[-43]C -> 0 | AP94: =R[-88]C-R[-43]C -> 0 | AQ94: =R[-88]C-R[-43]C -> 0
A95: Lithuania | B95: CEE | C95: C6 | E95: =R[-88]C-R[-43]C -> 0 | F95: =R[-88]C-R[-43]C -> 0 | G95: =R[-88]C-R[-43]C -> 0 | H95: =R[-88]C-R[-43]C -> 0 | I95: =R[-88]C-R[-43]C -> 0 | J95: =R[-88]C-R[-43]C -> 0 | K95: =R[-88]C-R[-43]C -> 0 | L95: =R[-88]C-R[-43]C -> 0 | M95: =R[-88]C-R[-43]C -> 0 | N95: =R[-88]C-R[-43]C -> 0 | O95: =R[-88]C-R[-43]C -> 0 | P95: =R[-88]C-R[-43]C -> 0 | Q95: =R[-88]C-R[-43]C -> 0 | R95: =R[-88]C-R[-43]C -> -1 | S95: =R[-88]C-R[-43]C -> -2 | T95: =R[-88]C-R[-43]C -> 0 | U95: =R[-88]C-R[-43]C -> 0 | V95: =R[-88]C-R[-43]C -> 0 | W95: =R[-88]C-R[-43]C -> -1 | X95: =R[-88]C-R[-43]C -> 0 | Y95: =R[-88]C-R[-43]C -> 0 | Z95: =R[-88]C-R[-43]C -> 0 | AA95: =R[-88]C-R[-43]C -> 0 | AB95: =R[-88]C-R[-43]C -> 0 | AC95: =R[-88]C-R[-43]C -> 0 | AD95: =R[-88]C-R[-43]C -> 0 | AE95: =R[-88]C-R[-43]C -> 0 | AF95: =R[-88]C-R[-43]C -> 0 | AG95: =R[-88]C-R[-43]C -> 0 | AH95: =R[-88]C-R[-43]C -> 0 | AI95: =R[-88]C-R[-43]C -> 0 | AJ95: =R[-88]C-R[-43]C -> 0 | AK95: =R[-88]C-R[-43]C -> 0 | AL95: =R[-88]C-R[-43]C -> 0 | AM95: =R[-88]C-R[-43]C -> 0 | AN95: =R[-88]C-R[-43]C -> 0 | AO95: =R[-88]C-R[-43]C -> 0 | AP95: =R[-88]C-R[-43]C -> 0 | AQ95: =R[-88]C-R[-43]C -> 0
A96: Poland | B96: CEE | C96: C7 | E96: =R[-88]C-R[-43]C -> 1 | F96: =R[-88]C-R[-43]C -> 1 | G96: =R[-88]C-R[-43]C -> 1 | H96: =R[-88]C-R[-43]C -> 1 | I96: =R[-88]C-R[-43]C -> 1 | J96: =R[-88]C-R[-43]C -> 1 | K96: =R[-88]C-R[-43]C -> 1 | L96: =R[-88]C-R[-43]C -> 1 | M96: =R[-88]C-R[-43]C -> 1 | N96: =R[-88]C-R[-43]C -> 1 | O96: =R[-88]C-R[-43]C -> 1 | P96: =R[-88]C-R[-43]C -> 1 | Q96: =R[-88]C-R[-43]C -> 1 | R96: =R[-88]C-R[-43]C -> 1 | S96: =R[-88]C-R[-43]C -> 0 | T96: =R[-88]C-R[-43]C -> 1 | U96: =R[-88]C-R[-43]C -> 1 | V96: =R[-88]C-R[-43]C -> 1 | W96: =R[-88]C-R[-43]C -> -1 | X96: =R[-88]C-R[-43]C -> 1 | Y96: =R[-88]C-R[-43]C -> 1 | Z96: =R[-88]C-R[-43]C -> 1 | AA96: =R[-88]C-R[-43]C -> 1 | AB96: =R[-88]C-R[-43]C -> 1 | AC96: =R[-88]C-R[-43]C -> 1 | AD96: =R[-88]C-R[-43]C -> 1 | AE96: =R[-88]C-R[-43]C -> 1 | AF96: =R[-88]C-R[-43]C -> 1 | AG96: =R[-88]C-R[-43]C -> 1 | AH96: =R[-88]C-R[-43]C -> 1 | AI96: =R[-88]C-R[-43]C -> 1 | AJ96: =R[-88]C-R[-43]C -> 1 | AK96: =R[-88]C-R[-43]C -> 1 | AL96: =R[-88]C-R[-43]C -> 1 | AM96: =R[-88]C-R[-43]C -> 1 | AN96: =R[-88]C-R[-43]C -> 1 | AO96: =R[-88]C-R[-43]C -> 1 | AP96: =R[-88]C-R[-43]C -> 1 | AQ96: =R[-88]C-R[-43]C -> 1
A97: Romania | B97: CEE | C97: C8 | E97: =R[-88]C-R[-43]C -> 0 | F97: =R[-88]C-R[-43]C -> 0 | G97: =R[-88]C-R[-43]C -> 0 | H97: =R[-88]C-R[-43]C -> 0 | I97: =R[-88]C-R[-43]C -> 0 | J97: =R[-88]C-R[-43]C -> 0 | K97: =R[-88]C-R[-43]C -> 0 | L97: =R[-88]C-R[-43]C -> 0 | M97: =R[-88]C-R[-43]C -> 0 | N97: =R[-88]C-R[-43]C -> 0 | O97: =R[-88]C-R[-43]C -> 0 | P97: =R[-88]C-R[-43]C -> 0 | Q97: =R[-88]C-R[-43]C -> 0 | R97: =R[-88]C-R[-43]C -> 0 | S97: =R[-88]C-R[-43]C -> 0 | T97: =R[-88]C-R[-43]C -> 0 | U97: =R[-88]C-R[-43]C -> 0 | V97: =R[-88]C-R[-43]C -> 0 | W97: =R[-88]C-R[-43]C -> -2 | X97: =R[-88]C-R[-43]C -> 0 | Y97: =R[-88]C-R[-43]C -> 0 | Z97: =R[-88]C-R[-43]C -> 0 | AA97: =R[-88]C-R[-43]C -> 0 | AB97: =R[-88]C-R[-43]C -> 0 | AC97: =R[-88]C-R[-43]C -> 0 | AD97: =R[-88]C-R[-43]C -> 0 | AE97: =R[-88]C-R[-43]C -> 0 | AF97: =R[-88]C-R[-43]C -> 0 | AG97: =R[-88]C-R[-43]C -> 0 | AH97: =R[-88]C-R[-43]C -> 0 | AI97: =R[-88]C-R[-43]C -> 0 | AJ97: =R[-88]C-R[-43]C -> 0 | AK97: =R[-88]C-R[-43]C -> 0 | AL97: =R[-88]C-R[-43]C -> 0 | AM97: =R[-88]C-R[-43]C -> 0 | AN97: =R[-88]C-R[-43]C -> 0 | AO97: =R[-88]C-R[-43]C -> 0 | AP97: =R[-88]C-R[-43]C -> 0 | AQ97: =R[-88]C-R[-43]C -> 0
A98: Slovak Rep | B98: CEE | C98: C9 | E98: =R[-88]C-R[-43]C -> 0 | F98: =R[-88]C-R[-43]C -> 0 | G98: =R[-88]C-R[-43]C -> 0 | H98: =R[-88]C-R[-43]C -> 0 | I98: =R[-88]C-R[-43]C -> 0 | J98: =R[-88]C-R[-43]C -> 1 | K98: =R[-88]C-R[-43]C -> 1 | L98: =R[-88]C-R[-43]C -> 1 | M98: =R[-88]C-R[-43]C -> -1 | N98: =R[-88]C-R[-43]C -> 0 | O98: =R[-88]C-R[-43]C -> 0 | P98: =R[-88]C-R[-43]C -> 1 | Q98: =R[-88]C-R[-43]C -> 1 | R98: =R[-88]C-R[-43]C -> 0 | S98: =R[-88]C-R[-43]C -> -2 | T98: =R[-88]C-R[-43]C -> 0 | U98: =R[-88]C-R[-43]C -> 0 | V98: =R[-88]C-R[-43]C -> 0 | W98: =R[-88]C-R[-43]C -> -1 | X98: =R[-88]C-R[-43]C -> 0 | Y98: =R[-88]C-R[-43]C -> 0 | Z98: =R[-88]C-R[-43]C -> 0 | AA98: =R[-88]C-R[-43]C -> 0 | AB98: =R[-88]C-R[-43]C -> 0 | AC98: =R[-88]C-R[-43]C -> 0 | AD98: =R[-88]C-R[-43]C -> 0 | AE98: =R[-88]C-R[-43]C -> 0 | AF98: =R[-88]C-R[-43]C -> 0 | AG98: =R[-88]C-R[-43]C -> 0 | AH98: =R[-88]C-R[-43]C -> 0 | AI98: =R[-88]C-R[-43]C -> 0 | AJ98: =R[-88]C-R[-43]C -> 0 | AK98: =R[-88]C-R[-43]C -> 0 | AL98: =R[-88]C-R[-43]C -> 0 | AM98: =R[-88]C-R[-43]C -> -2 | AN98: =R[-88]C-R[-43]C -> -2 | AO98: =R[-88]C-R[-43]C -> -2 | AP98: =R[-88]C-R[-43]C -> -2 | AQ98: =R[-88]C-R[-43]C -> -2
A99: Slovenia | B99: CEE | C99: C10 | E99: =R[-88]C-R[-43]C -> 0 | F99: =R[-88]C-R[-43]C -> 0 | G99: =R[-88]C-R[-43]C -> 0 | H99: =R[-88]C-R[-43]C -> 0 | I99: =R[-88]C-R[-43]C -> -1 | J99: =R[-88]C-R[-43]C -> 1 | K99: =R[-88]C-R[-43]C -> 1 | L99: =R[-88]C-R[-43]C -> 1 | M99: =R[-88]C-R[-43]C -> 1 | N99: =R[-88]C-R[-43]C -> 0 | O99: =R[-88]C-R[-43]C -> 1 | P99: =R[-88]C-R[-43]C -> 1 | Q99: =R[-88]C-R[-43]C -> 0 | R99: =R[-88]C-R[-43]C -> -1 | S99: =R[-88]C-R[-43]C -> -2 | T99: =R[-88]C-R[-43]C -> 0 | U99: =R[-88]C-R[-43]C -> 0 | V99: =R[-88]C-R[-43]C -> 0 | W99: =R[-88]C-R[-43]C -> -1 | X99: =R[-88]C-R[-43]C -> 0 | Y99: =R[-88]C-R[-43]C -> 0 | Z99: =R[-88]C-R[-43]C -> 0 | AA99: =R[-88]C-R[-43]C -> 0 | AB99: =R[-88]C-R[-43]C -> 0 | AC99: =R[-88]C-R[-43]C -> 0 | AD99: =R[-88]C-R[-43]C -> 0 | AE99: =R[-88]C-R[-43]C -> 0 | AF99: =R[-88]C-R[-43]C -> 0 | AG99: =R[-88]C-R[-43]C -> 0 | AH99: =R[-88]C-R[-43]C -> -1 | AI99: =R[-88]C-R[-43]C -> 0 | AJ99: =R[-88]C-R[-43]C -> 0 | AK99: =R[-88]C-R[-43]C -> 0 | AL99: =R[-88]C-R[-43]C -> 0 | AM99: =R[-88]C-R[-43]C -> 0 | AN99: =R[-88]C-R[-43]C -> 0 | AO99: =R[-88]C-R[-43]C -> 0 | AP99: =R[-88]C-R[-43]C -> 0 | AQ99: =R[-88]C-R[-43]C -> 0
A100: Austria | B100: EU | C100: C11 | E100: =R[-88]C-R[-43]C -> 1 | F100: =R[-88]C-R[-43]C -> 1 | G100: =R[-88]C-R[-43]C -> 1 | H100: =R[-88]C-R[-43]C -> 1 | I100: =R[-88]C-R[-43]C -> 1 | J100: =R[-88]C-R[-43]C -> 1 | K100: =R[-88]C-R[-43]C -> 1 | L100: =R[-88]C-R[-43]C -> 1 | M100: =R[-88]C-R[-43]C -> 1 | N100: =R[-88]C-R[-43]C -> 1 | O100: =R[-88]C-R[-43]C -> 1 | P100: =R[-88]C-R[-43]C -> 1 | Q100: =R[-88]C-R[-43]C -> 1 | R100: =R[-88]C-R[-43]C -> 1 | S100: =R[-88]C-R[-43]C -> 0 | T100: =R[-88]C-R[-43]C -> 1 | U100: =R[-88]C-R[-43]C -> 1 | V100: =R[-88]C-R[-43]C -> 1 | W100: =R[-88]C-R[-43]C -> -1 | X100: =R[-88]C-R[-43]C -> 1 | Y100: =R[-88]C-R[-43]C -> 1 | Z100: =R[-88]C-R[-43]C -> 1 | AA100: =R[-88]C-R[-43]C -> 0 | AB100: =R[-88]C-R[-43]C -> 0 | AC100: =R[-88]C-R[-43]C -> 0 | AD100: =R[-88]C-R[-43]C -> 0 | AE100: =R[-88]C-R[-43]C -> 0 | AF100: =R[-88]C-R[-43]C -> 0 | AG100: =R[-88]C-R[-43]C -> 0 | AH100: =R[-88]C-R[-43]C -> 0 | AI100: =R[-88]C-R[-43]C -> 0 | AJ100: =R[-88]C-R[-43]C -> 0 | AK100: =R[-88]C-R[-43]C -> 0 | AL100: =R[-88]C-R[-43]C -> 0 | AM100: =R[-88]C-R[-43]C -> 0 | AN100: =R[-88]C-R[-43]C -> 0 | AO100: =R[-88]C-R[-43]C -> 0 | AP100: =R[-88]C-R[-43]C -> 0 | AQ100: =R[-88]C-R[-43]C -> 0
A101: Belgium | B101: EU | C101: C12 | E101: =R[-86]C-R[-43]C -> 0 | F101: =R[-86]C-R[-43]C -> -1 | G101: =R[-86]C-R[-43]C -> -1 | H101: =R[-86]C-R[-43]C -> -1 | I101: =R[-86]C-R[-43]C -> -1 | J101: =R[-86]C-R[-43]C -> -1 | K101: =R[-86]C-R[-43]C -> -1 | L101: =R[-86]C-R[-43]C -> -1 | M101: =R[-86]C-R[-43]C -> -1 | N101: =R[-86]C-R[-43]C -> -1 | O101: =R[-86]C-R[-43]C -> -1 | P101: =R[-86]C-R[-43]C -> -1 | Q101: =R[-86]C-R[-43]C -> -1 | R101: =R[-86]C-R[-43]C -> -1 | S101: =R[-86]C-R[-43]C -> 0 | T101: =R[-86]C-R[-43]C -> -1 | U101: =R[-86]C-R[-43]C -> -1 | V101: =R[-86]C-R[-43]C -> -1 | W101: =R[-86]C-R[-43]C -> -1 | X101: =R[-86]C-R[-43]C -> -1 | Y101: =R[-86]C-R[-43]C -> -1 | Z101: =R[-86]C-R[-43]C -> -1 | AA101: =R[-86]C-R[-43]C -> -1 | AB101: =R[-86]C-R[-43]C -> -1 | AC101: =R[-86]C-R[-43]C -> -1 | AD101: =R[-86]C-R[-43]C -> -1 | AE101: =R[-86]C-R[-43]C -> -1 | AF101: =R[-86]C-R[-43]C -> -1 | AG101: =R[-86]C-R[-43]C -> -1 | AH101: =R[-86]C-R[-43]C -> -1 | AI101: =R[-86]C-R[-43]C -> -1 | AJ101: =R[-86]C-R[-43]C -> -1 | AK101: =R[-86]C-R[-43]C -> -1 | AL101: =R[-86]C-R[-43]C -> -1 | AM101: =R[-86]C-R[-43]C -> -1 | AN101: =R[-86]C-R[-43]C -> -1 | AO101: =R[-86]C-R[-43]C -> -1 | AP101: =R[-86]C-R[-43]C -> -1 | AQ101: =R[-86]C-R[-43]C -> -1
A102: Denmark | B102: EU | C102: C13 | E102: =R[-86]C-R[-43]C -> 0 | F102: =R[-86]C-R[-43]C -> 0 | G102: =R[-86]C-R[-43]C -> 0 | H102: =R[-86]C-R[-43]C -> -1 | I102: =R[-86]C-R[-43]C -> 0 | J102: =R[-86]C-R[-43]C -> 0 | K102: =R[-86]C-R[-43]C -> 0 | L102: =R[-86]C-R[-43]C -> 0 | M102: =R[-86]C-R[-43]C -> 0 | N102: =R[-86]C-R[-43]C -> 0 | O102: =R[-86]C-R[-43]C -> 0 | P102: =R[-86]C-R[-43]C -> -1 | Q102: =R[-86]C-R[-43]C -> 1 | R102: =R[-86]C-R[-43]C -> 0 | S102: =R[-86]C-R[-43]C -> 0 | T102: =R[-86]C-R[-43]C -> 1 | U102: =R[-86]C-R[-43]C -> 0 | V102: =R[-86]C-R[-43]C -> 1 | W102: =R[-86]C-R[-43]C -> -1 | X102: =R[-86]C-R[-43]C -> 0 | Y102: =R[-86]C-R[-43]C -> 0 | Z102: =R[-86]C-R[-43]C -> 0 | AA102: =R[-86]C-R[-43]C -> 0 | AB102: =R[-86]C-R[-43]C -> 0 | AC102: =R[-86]C-R[-43]C -> 1 | AD102: =R[-86]C-R[-43]C -> 1 | AE102: =R[-86]C-R[-43]C -> 1 | AF102: =R[-86]C-R[-43]C -> 0 | AG102: =R[-86]C-R[-43]C -> 0 | AH102: =R[-86]C-R[-43]C -> 0 | AI102: =R[-86]C-R[-43]C -> 0 | AJ102: =R[-86]C-R[-43]C -> 1 | AK102: =R[-86]C-R[-43]C -> 1 | AL102: =R[-86]C-R[-43]C -> 0 | AM102: =R[-86]C-R[-43]C -> 1 | AN102: =R[-86]C-R[-43]C -> 1 | AO102: =R[-86]C-R[-43]C -> 1 | AP102: =R[-86]C-R[-43]C -> 1 | AQ102: =R[-86]C-R[-43]C -> 0
A103: Eire | B103: EU | C103: C15 | E103: =R[-86]C-R[-43]C -> 1 | F103: =R[-86]C-R[-43]C -> 1 | G103: =R[-86]C-R[-43]C -> 1 | H103: =R[-86]C-R[-43]C -> 1 | I103: =R[-86]C-R[-43]C -> 1 | J103: =R[-86]C-R[-43]C -> 1 | K103: =R[-86]C-R[-43]C -> 1 | L103: =R[-86]C-R[-43]C -> 1 | M103: =R[-86]C-R[-43]C -> 1 | N103: =R[-86]C-R[-43]C -> 1 | O103: =R[-86]C-R[-43]C -> 1 | P103: =R[-86]C-R[-43]C -> 1 | Q103: =R[-86]C-R[-43]C -> 1 | R103: =R[-86]C-R[-43]C -> 1 | S103: =R[-86]C-R[-43]C -> 0 | T103: =R[-86]C-R[-43]C -> 1 | U103: =R[-86]C-R[-43]C -> 1 | V103: =R[-86]C-R[-43]C -> 1 | W103: =R[-86]C-R[-43]C -> -1 | X103: =R[-86]C-R[-43]C -> 1 | Y103: =R[-86]C-R[-43]C -> 1 | Z103: =R[-86]C-R[-43]C -> 1 | AA103: =R[-86]C-R[-43]C -> 1 | AB103: =R[-86]C-R[-43]C -> 1 | AC103: =R[-86]C-R[-43]C -> 1 | AD103: =R[-86]C-R[-43]C -> 1 | AE103: =R[-86]C-R[-43]C -> 1 | AF103: =R[-86]C-R[-43]C -> 1 | AG103: =R[-86]C-R[-43]C -> 1 | AH103: =R[-86]C-R[-43]C -> 1 | AI103: =R[-86]C-R[-43]C -> 1 | AJ103: =R[-86]C-R[-43]C -> 1 | AK103: =R[-86]C-R[-43]C -> 1 | AL103: =R[-86]C-R[-43]C -> 1 | AM103: =R[-86]C-R[-43]C -> 0 | AN103: =R[-86]C-R[-43]C -> 0 | AO103: =R[-86]C-R[-43]C -> 0 | AP103: =R[-86]C-R[-43]C -> 0 | AQ103: =R[-86]C-R[-43]C -> 0
A104: Finland | B104: EU | C104: C16 | E104: =R[-86]C-R[-43]C -> 0 | F104: =R[-86]C-R[-43]C -> 1 | G104: =R[-86]C-R[-43]C -> 0 | H104: =R[-86]C-R[-43]C -> 0 | I104: =R[-86]C-R[-43]C -> -1 | J104: =R[-86]C-R[-43]C -> 0 | K104: =R[-86]C-R[-43]C -> 0 | L104: =R[-86]C-R[-43]C -> 0 | M104: =R[-86]C-R[-43]C -> 1 | N104: =R[-86]C-R[-43]C -> 0 | O104: =R[-86]C-R[-43]C -> 0 | P104: =R[-86]C-R[-43]C -> 0 | Q104: =R[-86]C-R[-43]C -> 1 | R104: =R[-86]C-R[-43]C -> 1 | S104: =R[-86]C-R[-43]C -> 0 | T104: =R[-86]C-R[-43]C -> 1 | U104: =R[-86]C-R[-43]C -> 0 | V104: =R[-86]C-R[-43]C -> 0 | W104: =R[-86]C-R[-43]C -> -1 | X104: =R[-86]C-R[-43]C -> 0 | Y104: =R[-86]C-R[-43]C -> 0 | Z104: =R[-86]C-R[-43]C -> 0 | AA104: =R[-86]C-R[-43]C -> 0 | AB104: =R[-86]C-R[-43]C -> 0 | AC104: =R[-86]C-R[-43]C -> 1 | AD104: =R[-86]C-R[-43]C -> 1 | AE104: =R[-86]C-R[-43]C -> 1 | AF104: =R[-86]C-R[-43]C -> 0 | AG104: =R[-86]C-R[-43]C -> 0 | AH104: =R[-86]C-R[-43]C -> 0 | AI104: =R[-86]C-R[-43]C -> 0 | AJ104: =R[-86]C-R[-43]C -> 0 | AK104: =R[-86]C-R[-43]C -> 0 | AL104: =R[-86]C-R[-43]C -> 0 | AM104: =R[-86]C-R[-43]C -> 0 | AN104: =R[-86]C-R[-43]C -> 0 | AO104: =R[-86]C-R[-43]C -> 0 | AP104: =R[-86]C-R[-43]C -> 0 | AQ104: =R[-86]C-R[-43]C -> 0
A105: France | B105: EU | C105: C17 | E105: =R[-86]C-R[-43]C -> 0 | F105: =R[-86]C-R[-43]C -> 0 | G105: =R[-86]C-R[-43]C -> 0 | H105: =R[-86]C-R[-43]C -> 0 | I105: =R[-86]C-R[-43]C -> 1 | J105: =R[-86]C-R[-43]C -> 1 | K105: =R[-86]C-R[-43]C -> 0 | L105: =R[-86]C-R[-43]C -> 0 | M105: =R[-86]C-R[-43]C -> 0 | N105: =R[-86]C-R[-43]C -> 0 | O105: =R[-86]C-R[-43]C -> 1 | P105: =R[-86]C-R[-43]C -> 0 | Q105: =R[-86]C-R[-43]C -> 1 | R105: =R[-86]C-R[-43]C -> 1 | S105: =R[-86]C-R[-43]C -> 0 | T105: =R[-86]C-R[-43]C -> 1 | U105: =R[-86]C-R[-43]C -> 1 | V105: =R[-86]C-R[-43]C -> 1 | W105: =R[-86]C-R[-43]C -> -1 | X105: =R[-86]C-R[-43]C -> 0 | Y105: =R[-86]C-R[-43]C -> 0 | Z105: =R[-86]C-R[-43]C -> 0 | AA105: =R[-86]C-R[-43]C -> 0 | AB105: =R[-86]C-R[-43]C -> 0 | AC105: =R[-86]C-R[-43]C -> 0 | AD105: =R[-86]C-R[-43]C -> 0 | AE105: =R[-86]C-R[-43]C -> 0 | AF105: =R[-86]C-R[-43]C -> 0 | AG105: =R[-86]C-R[-43]C -> 0 | AH105: =R[-86]C-R[-43]C -> 0 | AI105: =R[-86]C-R[-43]C -> 0 | AJ105: =R[-86]C-R[-43]C -> 0 | AK105: =R[-86]C-R[-43]C -> 0 | AL105: =R[-86]C-R[-43]C -> 0 | AM105: =R[-86]C-R[-43]C -> 0 | AN105: =R[-86]C-R[-43]C -> 0 | AO105: =R[-86]C-R[-43]C -> 0 | AP105: =R[-86]C-R[-43]C -> 0 | AQ105: =R[-86]C-R[-43]C -> 0
A106: Greece | B106: EU | C106: C18 | E106: =R[-86]C-R[-43]C -> -1 | F106: =R[-86]C-R[-43]C -> -2 | G106: =R[-86]C-R[-43]C -> -2 | H106: =R[-86]C-R[-43]C -> 0 | I106: =R[-86]C-R[-43]C -> -2 | J106: =R[-86]C-R[-43]C -> -2 | K106: =R[-86]C-R[-43]C -> -2 | L106: =R[-86]C-R[-43]C -> -2 | M106: =R[-86]C-R[-43]C -> -2 | N106: =R[-86]C-R[-43]C -> -2 | O106: =R[-86]C-R[-43]C -> -2 | P106: =R[-86]C-R[-43]C -> -2 | Q106: =R[-86]C-R[-43]C -> -2 | R106: =R[-86]C-R[-43]C -> 0 | S106: =R[-86]C-R[-43]C -> 0 | T106: =R[-86]C-R[-43]C -> -2 | U106: =R[-86]C-R[-43]C -> -2 | V106: =R[-86]C-R[-43]C -> 0 | W106: =R[-86]C-R[-43]C -> -2 | X106: =R[-86]C-R[-43]C -> -2 | Y106: =R[-86]C-R[-43]C -> -2 | Z106: =R[-86]C-R[-43]C -> -2 | AA106: =R[-86]C-R[-43]C -> -1 | AB106: =R[-86]C-R[-43]C -> 0 | AC106: =R[-86]C-R[-43]C -> 0 | AD106: =R[-86]C-R[-43]C -> 0 | AE106: =R[-86]C-R[-43]C -> 0 | AF106: =R[-86]C-R[-43]C -> -2 | AG106: =R[-86]C-R[-43]C -> -2 | AH106: =R[-86]C-R[-43]C -> -1 | AI106: =R[-86]C-R[-43]C -> -1 | AJ106: =R[-86]C-R[-43]C -> -1 | AK106: =R[-86]C-R[-43]C -> -1 | AL106: =R[-86]C-R[-43]C -> -1 | AM106: =R[-86]C-R[-43]C -> 0 | AN106: =R[-86]C-R[-43]C -> 0 | AO106: =R[-86]C-R[-43]C -> 0 | AP106: =R[-86]C-R[-43]C -> 0 | AQ106: =R[-86]C-R[-43]C -> 0
A107: Iceland | B107: EFTA | C107: C19 | E107: =R[-86]C-R[-43]C -> 0 | F107: =R[-86]C-R[-43]C -> 0 | G107: =R[-86]C-R[-43]C -> 0 | H107: =R[-86]C-R[-43]C -> 0 | I107: =R[-86]C-R[-43]C -> 0 | J107: =R[-86]C-R[-43]C -> 0 | K107: =R[-86]C-R[-43]C -> 0 | L107: =R[-86]C-R[-43]C -> 0 | M107: =R[-86]C-R[-43]C -> 0 | N107: =R[-86]C-R[-43]C -> 0 | O107: =R[-86]C-R[-43]C -> 0 | P107: =R[-86]C-R[-43]C -> 0 | Q107: =R[-86]C-R[-43]C -> 0 | R107: =R[-86]C-R[-43]C -> 0 | S107: =R[-86]C-R[-43]C -> 0 | T107: =R[-86]C-R[-43]C -> 0 | U107: =R[-86]C-R[-43]C -> 0 | V107: =R[-86]C-R[-43]C -> 0 | W107: =R[-86]C-R[-43]C -> -2 | X107: =R[-86]C-R[-43]C -> 0 | Y107: =R[-86]C-R[-43]C -> 0 | Z107: =R[-86]C-R[-43]C -> 0 | AA107: =R[-86]C-R[-43]C -> 0 | AB107: =R[-86]C-R[-43]C -> 0 | AC107: =R[-86]C-R[-43]C -> 0 | AD107: =R[-86]C-R[-43]C -> 0 | AE107: =R[-86]C-R[-43]C -> 0 | AF107: =R[-86]C-R[-43]C -> 0 | AG107: =R[-86]C-R[-43]C -> 0 | AH107: =R[-86]C-R[-43]C -> 0 | AI107: =R[-86]C-R[-43]C -> 0 | AJ107: =R[-86]C-R[-43]C -> 0 | AK107: =R[-86]C-R[-43]C -> 0 | AL107: =R[-86]C-R[-43]C -> 0 | AM107: =R[-86]C-R[-43]C -> 0 | AN107: =R[-86]C-R[-43]C -> 0 | AO107: =R[-86]C-R[-43]C -> 0 | AP107: =R[-86]C-R[-43]C -> 0 | AQ107: =R[-86]C-R[-43]C -> 0
A108: Italy | B108: EU | C108: C20 | E108: =R[-86]C-R[-43]C -> 1 | F108: =R[-86]C-R[-43]C -> 1 | G108: =R[-86]C-R[-43]C -> 1 | H108: =R[-86]C-R[-43]C -> 1 | I108: =R[-86]C-R[-43]C -> 1 | J108: =R[-86]C-R[-43]C -> 1 | K108: =R[-86]C-R[-43]C -> 1 | L108: =R[-86]C-R[-43]C -> 1 | M108: =R[-86]C-R[-43]C -> 1 | N108: =R[-86]C-R[-43]C -> 1 | O108: =R[-86]C-R[-43]C -> 1 | P108: =R[-86]C-R[-43]C -> 1 | Q108: =R[-86]C-R[-43]C -> 1 | R108: =R[-86]C-R[-43]C -> 1 | S108: =R[-86]C-R[-43]C -> 0 | T108: =R[-86]C-R[-43]C -> 1 | U108: =R[-86]C-R[-43]C -> 1 | V108: =R[-86]C-R[-43]C -> 1 | W108: =R[-86]C-R[-43]C -> -1 | X108: =R[-86]C-R[-43]C -> 1 | Y108: =R[-86]C-R[-43]C -> 1 | Z108: =R[-86]C-R[-43]C -> 1 | AA108: =R[-86]C-R[-43]C -> 0 | AB108: =R[-86]C-R[-43]C -> 0 | AC108: =R[-86]C-R[-43]C -> 0 | AD108: =R[-86]C-R[-43]C -> 0 | AE108: =R[-86]C-R[-43]C -> 0 | AF108: =R[-86]C-R[-43]C -> 0 | AG108: =R[-86]C-R[-43]C -> 0 | AH108: =R[-86]C-R[-43]C -> 0 | AI108: =R[-86]C-R[-43]C -> 0 | AJ108: =R[-86]C-R[-43]C -> 0 | AK108: =R[-86]C-R[-43]C -> 0 | AL108: =R[-86]C-R[-43]C -> 0 | AM108: =R[-86]C-R[-43]C -> 0 | AN108: =R[-86]C-R[-43]C -> 0 | AO108: =R[-86]C-R[-43]C -> 0 | AP108: =R[-86]C-R[-43]C -> 0 | AQ108: =R[-86]C-R[-43]C -> 0
A109: Liechtenstein | B109: EFTA | C109: C21 | E109: =R[-86]C-R[-43]C -> 0 | F109: =R[-86]C-R[-43]C -> 0 | G109: =R[-86]C-R[-43]C -> 0 | H109: =R[-86]C-R[-43]C -> 0 | I109: =R[-86]C-R[-43]C -> 0 | J109: =R[-86]C-R[-43]C -> 0 | K109: =R[-86]C-R[-43]C -> 0 | L109: =R[-86]C-R[-43]C -> 0 | M109: =R[-86]C-R[-43]C -> 0 | N109: =R[-86]C-R[-43]C -> 0 | O109: =R[-86]C-R[-43]C -> 0 | P109: =R[-86]C-R[-43]C -> 0 | Q109: =R[-86]C-R[-43]C -> 0 | R109: =R[-86]C-R[-43]C -> 0 | S109: =R[-86]C-R[-43]C -> 0 | T109: =R[-86]C-R[-43]C -> 0 | U109: =R[-86]C-R[-43]C -> 0 | V109: =R[-86]C-R[-43]C -> 0 | W109: =R[-86]C-R[-43]C -> -2 | X109: =R[-86]C-R[-43]C -> 0 | Y109: =R[-86]C-R[-43]C -> 0 | Z109: =R[-86]C-R[-43]C -> 0 | AA109: =R[-86]C-R[-43]C -> 0 | AB109: =R[-86]C-R[-43]C -> 0 | AC109: =R[-86]C-R[-43]C -> 0 | AD109: =R[-86]C-R[-43]C -> 0 | AE109: =R[-86]C-R[-43]C -> 0 | AF109: =R[-86]C-R[-43]C -> 0 | AG109: =R[-86]C-R[-43]C -> 0 | AH109: =R[-86]C-R[-43]C -> 0 | AI109: =R[-86]C-R[-43]C -> 0 | AJ109: =R[-86]C-R[-43]C -> 0 | AK109: =R[-86]C-R[-43]C -> 0 | AL109: =R[-86]C-R[-43]C -> 0 | AM109: =R[-86]C-R[-43]C -> 0 | AN109: =R[-86]C-R[-43]C -> 0 | AO109: =R[-86]C-R[-43]C -> 0 | AP109: =R[-86]C-R[-43]C -> 0 | AQ109: =R[-86]C-R[-43]C -> 0
A110: Luxembourg | B110: EU | C110: C22 | E110: =R[-86]C-R[-43]C -> -1 | F110: =R[-86]C-R[-43]C -> -1 | G110: =R[-86]C-R[-43]C -> -1 | H110: =R[-86]C-R[-43]C -> -1 | I110: =R[-86]C-R[-43]C -> -1 | J110: =R[-86]C-R[-43]C -> 0 | K110: =R[-86]C-R[-43]C -> 0 | L110: =R[-86]C-R[-43]C -> -1 | M110: =R[-86]C-R[-43]C -> -1 | N110: =R[-86]C-R[-43]C -> -1 | O110: =R[-86]C-R[-43]C -> -1 | P110: =R[-86]C-R[-43]C -> -1 | Q110: =R[-86]C-R[-43]C -> -1 | R110: =R[-86]C-R[-43]C -> -1 | S110: =R[-86]C-R[-43]C -> -2 | T110: =R[-86]C-R[-43]C -> 0 | U110: =R[-86]C-R[-43]C -> 1 | V110: =R[-86]C-R[-43]C -> 1 | W110: =R[-86]C-R[-43]C -> -1 | X110: =R[-86]C-R[-43]C -> 0 | Y110: =R[-86]C-R[-43]C -> 0 | Z110: =R[-86]C-R[-43]C -> 0 | AA110: =R[-86]C-R[-43]C -> -1 | AB110: =R[-86]C-R[-43]C -> 0 | AC110: =R[-86]C-R[-43]C -> -1 | AD110: =R[-86]C-R[-43]C -> -1 | AE110: =R[-86]C-R[-43]C -> -1 | AF110: =R[-86]C-R[-43]C -> -1 | AG110: =R[-86]C-R[-43]C -> -1 | AH110: =R[-86]C-R[-43]C -> -1 | AI110: =R[-86]C-R[-43]C -> 0 | AJ110: =R[-86]C-R[-43]C -> 0 | AK110: =R[-86]C-R[-43]C -> 0 | AL110: =R[-86]C-R[-43]C -> 0 | AM110: =R[-86]C-R[-43]C -> 0 | AN110: =R[-86]C-R[-43]C -> 0 | AO110: =R[-86]C-R[-43]C -> 0 | AP110: =R[-86]C-R[-43]C -> 0 | AQ110: =R[-86]C-R[-43]C -> 0
A111: Netherlands | B111: EU | C111: C23 | E111: =R[-86]C-R[-43]C -> 0 | F111: =R[-86]C-R[-43]C -> 0 | G111: =R[-86]C-R[-43]C -> 0 | H111: =R[-86]C-R[-43]C -> 0 | I111: =R[-86]C-R[-43]C -> 0 | J111: =R[-86]C-R[-43]C -> 1 | K111: =R[-86]C-R[-43]C -> 0 | L111: =R[-86]C-R[-43]C -> 1 | M111: =R[-86]C-R[-43]C -> 1 | N111: =R[-86]C-R[-43]C -> 1 | O111: =R[-86]C-R[-43]C -> 1 | P111: =R[-86]C-R[-43]C -> 1 | Q111: =R[-86]C-R[-43]C -> 1 | R111: =R[-86]C-R[-43]C -> 1 | S111: =R[-86]C-R[-43]C -> 0 | T111: =R[-86]C-R[-43]C -> 1 | U111: =R[-86]C-R[-43]C -> 0 | V111: =R[-86]C-R[-43]C -> 1 | W111: =R[-86]C-R[-43]C -> -1 | X111: =R[-86]C-R[-43]C -> 0 | Y111: =R[-86]C-R[-43]C -> 0 | Z111: =R[-86]C-R[-43]C -> 0 | AA111: =R[-86]C-R[-43]C -> 0 | AB111: =R[-86]C-R[-43]C -> 0 | AC111: =R[-86]C-R[-43]C -> 0 | AD111: =R[-86]C-R[-43]C -> 0 | AE111: =R[-86]C-R[-43]C -> 0 | AF111: =R[-86]C-R[-43]C -> 0 | AG111: =R[-86]C-R[-43]C -> 0 | AH111: =R[-86]C-R[-43]C -> 0 | AI111: =R[-86]C-R[-43]C -> 0 | AJ111: =R[-86]C-R[-43]C -> 0 | AK111: =R[-86]C-R[-43]C -> 0 | AL111: =R[-86]C-R[-43]C -> 0 | AM111: =R[-86]C-R[-43]C -> 0 | AN111: =R[-86]C-R[-43]C -> 0 | AO111: =R[-86]C-R[-43]C -> 0 | AP111: =R[-86]C-R[-43]C -> 0 | AQ111: =R[-86]C-R[-43]C -> 0
A112: Norway | B112: EFTA | C112: C24 | E112: =R[-86]C-R[-43]C -> 0 | F112: =R[-86]C-R[-43]C -> 0 | G112: =R[-86]C-R[-43]C -> 0 | H112: =R[-86]C-R[-43]C -> 0 | I112: =R[-86]C-R[-43]C -> 1 | J112: =R[-86]C-R[-43]C -> 0 | K112: =R[-86]C-R[-43]C -> 0 | L112: =R[-86]C-R[-43]C -> 0 | M112: =R[-86]C-R[-43]C -> 1 | N112: =R[-86]C-R[-43]C -> 0 | O112: =R[-86]C-R[-43]C -> -1 | P112: =R[-86]C-R[-43]C -> -1 | Q112: =R[-86]C-R[-43]C -> 1 | R112: =R[-86]C-R[-43]C -> -1 | S112: =R[-86]C-R[-43]C -> -1 | T112: =R[-86]C-R[-43]C -> 1 | U112: =R[-86]C-R[-43]C -> 0 | V112: =R[-86]C-R[-43]C -> -1 | W112: =R[-86]C-R[-43]C -> -1 | X112: =R[-86]C-R[-43]C -> 0 | Y112: =R[-86]C-R[-43]C -> 0 | Z112: =R[-86]C-R[-43]C -> 0 | AA112: =R[-86]C-R[-43]C -> 0 | AB112: =R[-86]C-R[-43]C -> 0 | AC112: =R[-86]C-R[-43]C -> 0 | AD112: =R[-86]C-R[-43]C -> 0 | AE112: =R[-86]C-R[-43]C -> 0 | AF112: =R[-86]C-R[-43]C -> 0 | AG112: =R[-86]C-R[-43]C -> 0 | AH112: =R[-86]C-R[-43]C -> 0 | AI112: =R[-86]C-R[-43]C -> 0 | AJ112: =R[-86]C-R[-43]C -> 0 | AK112: =R[-86]C-R[-43]C -> 0 | AL112: =R[-86]C-R[-43]C -> 0 | AM112: =R[-86]C-R[-43]C -> 0 | AN112: =R[-86]C-R[-43]C -> 0 | AO112: =R[-86]C-R[-43]C -> 0 | AP112: =R[-86]C-R[-43]C -> 0 | AQ112: =R[-86]C-R[-43]C -> 0
A113: Portugal | B113: EU | C113: C25 | E113: =R[-86]C-R[-43]C -> 0 | F113: =R[-86]C-R[-43]C -> 0 | G113: =R[-86]C-R[-43]C -> 0 | H113: =R[-86]C-R[-43]C -> 1 | I113: =R[-86]C-R[-43]C -> 1 | J113: =R[-86]C-R[-43]C -> 0 | K113: =R[-86]C-R[-43]C -> 0 | L113: =R[-86]C-R[-43]C -> 0 | M113: =R[-86]C-R[-43]C -> 1 | N113: =R[-86]C-R[-43]C -> 0 | O113: =R[-86]C-R[-43]C -> 0 | P113: =R[-86]C-R[-43]C -> 1 | Q113: =R[-86]C-R[-43]C -> 1 | R113: =R[-86]C-R[-43]C -> 0 | S113: =R[-86]C-R[-43]C -> -1 | T113: =R[-86]C-R[-43]C -> 0 | U113: =R[-86]C-R[-43]C -> 0 | V113: =R[-86]C-R[-43]C -> 1 | W113: =R[-86]C-R[-43]C -> -1 | X113: =R[-86]C-R[-43]C -> 0 | Y113: =R[-86]C-R[-43]C -> 0 | Z113: =R[-86]C-R[-43]C -> 0 | AA113: =R[-86]C-R[-43]C -> 0 | AB113: =R[-86]C-R[-43]C -> 0 | AC113: =R[-86]C-R[-43]C -> 0 | AD113: =R[-86]C-R[-43]C -> 0 | AE113: =R[-86]C-R[-43]C -> 0 | AF113: =R[-86]C-R[-43]C -> 0 | AG113: =R[-86]C-R[-43]C -> 0 | AH113: =R[-86]C-R[-43]C -> 0 | AI113: =R[-86]C-R[-43]C -> 0 | AJ113: =R[-86]C-R[-43]C -> 0 | AK113: =R[-86]C-R[-43]C -> 0 | AL113: =R[-86]C-R[-43]C -> 0 | AM113: =R[-86]C-R[-43]C -> 0 | AN113: =R[-86]C-R[-43]C -> 0 | AO113: =R[-86]C-R[-43]C -> 0 | AP113: =R[-86]C-R[-43]C -> 0 | AQ113: =R[-86]C-R[-43]C -> 0
A114: Spain | B114: EU | C114: C26 | E114: =R[-86]C-R[-43]C -> 1 | F114: =R[-86]C-R[-43]C -> 1 | G114: =R[-86]C-R[-43]C -> 1 | H114: =R[-86]C-R[-43]C -> 1 | I114: =R[-86]C-R[-43]C -> 1 | J114: =R[-86]C-R[-43]C -> 1 | K114: =R[-86]C-R[-43]C -> 1 | L114: =R[-86]C-R[-43]C -> 1 | M114: =R[-86]C-R[-43]C -> 1 | N114: =R[-86]C-R[-43]C -> 1 | O114: =R[-86]C-R[-43]C -> 1 | P114: =R[-86]C-R[-43]C -> 1 | Q114: =R[-86]C-R[-43]C -> 1 | R114: =R[-86]C-R[-43]C -> 1 | S114: =R[-86]C-R[-43]C -> 0 | T114: =R[-86]C-R[-43]C -> 1 | U114: =R[-86]C-R[-43]C -> 1 | V114: =R[-86]C-R[-43]C -> 1 | W114: =R[-86]C-R[-43]C -> -1 | X114: =R[-86]C-R[-43]C -> 1 | Y114: =R[-86]C-R[-43]C -> 1 | Z114: =R[-86]C-R[-43]C -> 1 | AA114: =R[-86]C-R[-43]C -> 1 | AB114: =R[-86]C-R[-43]C -> 1 | AC114: =R[-86]C-R[-43]C -> 1 | AD114: =R[-86]C-R[-43]C -> 1 | AE114: =R[-86]C-R[-43]C -> 1 | AF114: =R[-86]C-R[-43]C -> 1 | AG114: =R[-86]C-R[-43]C -> 1 | AH114: =R[-86]C-R[-43]C -> 1 | AI114: =R[-86]C-R[-43]C -> 0 | AJ114: =R[-86]C-R[-43]C -> 0 | AK114: =R[-86]C-R[-43]C -> 0 | AL114: =R[-86]C-R[-43]C -> 1 | AM114: =R[-86]C-R[-43]C -> 0 | AN114: =R[-86]C-R[-43]C -> 0 | AO114: =R[-86]C-R[-43]C -> 0 | AP114: =R[-86]C-R[-43]C -> 0 | AQ114: =R[-86]C-R[-43]C -> 0
A115: Sweden | B115: EU | C115: C27 | E115: =R[-86]C-R[-43]C -> -1 | F115: =R[-86]C-R[-43]C -> -1 | G115: =R[-86]C-R[-43]C -> -1 | H115: =R[-86]C-R[-43]C -> -1 | I115: =R[-86]C-R[-43]C -> 1 | J115: =R[-86]C-R[-43]C -> -1 | K115: =R[-86]C-R[-43]C -> -1 | L115: =R[-86]C-R[-43]C -> -1 | M115: =R[-86]C-R[-43]C -> -1 | N115: =R[-86]C-R[-43]C -> -1 | O115: =R[-86]C-R[-43]C -> -1 | P115: =R[-86]C-R[-43]C -> 1 | Q115: =R[-86]C-R[-43]C -> 1 | R115: =R[-86]C-R[-43]C -> -1 | S115: =R[-86]C-R[-43]C -> 0 | T115: =R[-86]C-R[-43]C -> -1 | U115: =R[-86]C-R[-43]C -> -1 | V115: =R[-86]C-R[-43]C -> 1 | W115: =R[-86]C-R[-43]C -> -1 | X115: =R[-86]C-R[-43]C -> -1 | Y115: =R[-86]C-R[-43]C -> -1 | Z115: =R[-86]C-R[-43]C -> -1 | AA115: =R[-86]C-R[-43]C -> -1 | AB115: =R[-86]C-R[-43]C -> -1 | AC115: =R[-86]C-R[-43]C -> -1 | AD115: =R[-86]C-R[-43]C -> -1 | AE115: =R[-86]C-R[-43]C -> -1 | AF115: =R[-86]C-R[-43]C -> -1 | AG115: =R[-86]C-R[-43]C -> -1 | AH115: =R[-86]C-R[-43]C -> -1 | AI115: =R[-86]C-R[-43]C -> 0 | AJ115: =R[-86]C-R[-43]C -> 0 | AK115: =R[-86]C-R[-43]C -> 0 | AL115: =R[-86]C-R[-43]C -> -1 | AM115: =R[-86]C-R[-43]C -> 0 | AN115: =R[-86]C-R[-43]C -> 0 | AO115: =R[-86]C-R[-43]C -> 0 | AP115: =R[-86]C-R[-43]C -> 0 | AQ115: =R[-86]C-R[-43]C -> 0
A116: Switzerland | B116: EFTA | C116: C28 | E116: =R[-86]C-R[-43]C -> 0 | F116: =R[-86]C-R[-43]C -> 0 | G116: =R[-86]C-R[-43]C -> 0 | H116: =R[-86]C-R[-43]C -> 0 | I116: =R[-86]C-R[-43]C -> 0 | J116: =R[-86]C-R[-43]C -> 0 | K116: =R[-86]C-R[-43]C -> 0 | L116: =R[-86]C-R[-43]C -> 0 | M116: =R[-86]C-R[-43]C -> 0 | N116: =R[-86]C-R[-43]C -> 0 | O116: =R[-86]C-R[-43]C -> 0 | P116: =R[-86]C-R[-43]C -> 0 | Q116: =R[-86]C-R[-43]C -> 0 | R116: =R[-86]C-R[-43]C -> 0 | S116: =R[-86]C-R[-43]C -> 0 | T116: =R[-86]C-R[-43]C -> 0 | U116: =R[-86]C-R[-43]C -> 0 | V116: =R[-86]C-R[-43]C -> 0 | W116: =R[-86]C-R[-43]C -> -2 | X116: =R[-86]C-R[-43]C -> 0 | Y116: =R[-86]C-R[-43]C -> 0 | Z116: =R[-86]C-R[-43]C -> 0 | AA116: =R[-86]C-R[-43]C -> 0 | AB116: =R[-86]C-R[-43]C -> 0 | AC116: =R[-86]C-R[-43]C -> 0 | AD116: =R[-86]C-R[-43]C -> 0 | AE116: =R[-86]C-R[-43]C -> 0 | AF116: =R[-86]C-R[-43]C -> 0 | AG116: =R[-86]C-R[-43]C -> 0 | AH116: =R[-86]C-R[-43]C -> 0 | AI116: =R[-86]C-R[-43]C -> 0 | AJ116: =R[-86]C-R[-43]C -> 0 | AK116: =R[-86]C-R[-43]C -> 0 | AL116: =R[-86]C-R[-43]C -> 0 | AM116: =R[-86]C-R[-43]C -> 0 | AN116: =R[-86]C-R[-43]C -> 0 | AO116: =R[-86]C-R[-43]C -> 0 | AP116: =R[-86]C-R[-43]C -> 0 | AQ116: =R[-86]C-R[-43]C -> 0
A117: UK | B117: EU | C117: C29 | E117: =R[-86]C-R[-43]C -> 0 | F117: =R[-86]C-R[-43]C -> 0 | G117: =R[-86]C-R[-43]C -> 0 | H117: =R[-86]C-R[-43]C -> 0 | I117: =R[-86]C-R[-43]C -> 1 | J117: =R[-86]C-R[-43]C -> 0 | K117: =R[-86]C-R[-43]C -> 1 | L117: =R[-86]C-R[-43]C -> 1 | M117: =R[-86]C-R[-43]C -> 1 | N117: =R[-86]C-R[-43]C -> 1 | O117: =R[-86]C-R[-43]C -> 1 | P117: =R[-86]C-R[-43]C -> 1 | Q117: =R[-86]C-R[-43]C -> 1 | R117: =R[-86]C-R[-43]C -> 0 | S117: =R[-86]C-R[-43]C -> -2 | T117: =R[-86]C-R[-43]C -> 1 | U117: =R[-86]C-R[-43]C -> 0 | V117: =R[-86]C-R[-43]C -> 0 | W117: =R[-86]C-R[-43]C -> -1 | X117: =R[-86]C-R[-43]C -> 0 | Y117: =R[-86]C-R[-43]C -> 0 | Z117: =R[-86]C-R[-43]C -> 0 | AA117: =R[-86]C-R[-43]C -> 0 | AB117: =R[-86]C-R[-43]C -> 0 | AC117: =R[-86]C-R[-43]C -> 0 | AD117: =R[-86]C-R[-43]C -> 0 | AE117: =R[-86]C-R[-43]C -> 0 | AF117: =R[-86]C-R[-43]C -> 0 | AG117: =R[-86]C-R[-43]C -> 0 | AH117: =R[-86]C-R[-43]C -> 0 | AI117: =R[-86]C-R[-43]C -> 0 | AJ117: =R[-86]C-R[-43]C -> 0 | AK117: =R[-86]C-R[-43]C -> 0 | AL117: =R[-86]C-R[-43]C -> 0 | AM117: =R[-86]C-R[-43]C -> 0 | AN117: =R[-86]C-R[-43]C -> 0 | AO117: =R[-86]C-R[-43]C -> 0 | AP117: =R[-86]C-R[-43]C -> 0 | AQ117: =R[-86]C-R[-43]C -> 0
A118: Germany | B118: EU | C118: C31 | E118: =R[-86]C-R[-43]C -> 0 | F118: =R[-86]C-R[-43]C -> 0 | G118: =R[-86]C-R[-43]C -> 0 | H118: =R[-86]C-R[-43]C -> 1 | I118: =R[-86]C-R[-43]C -> 0 | J118: =R[-86]C-R[-43]C -> 0 | K118: =R[-86]C-R[-43]C -> 0 | L118: =R[-86]C-R[-43]C -> 0 | M118: =R[-86]C-R[-43]C -> 2 | N118: =R[-86]C-R[-43]C -> 0 | O118: =R[-86]C-R[-43]C -> 0 | P118: =R[-86]C-R[-43]C -> 1 | Q118: =R[-86]C-R[-43]C -> 1 | R118: =R[-86]C-R[-43]C -> 1 | S118: =R[-86]C-R[-43]C -> 0 | T118: =R[-86]C-R[-43]C -> 0 | U118: =R[-86]C-R[-43]C -> 0 | V118: =R[-86]C-R[-43]C -> 1 | W118: =R[-86]C-R[-43]C -> -1 | X118: =R[-86]C-R[-43]C -> -1 | Y118: =R[-86]C-R[-43]C -> -1 | Z118: =R[-86]C-R[-43]C -> 0 | AA118: =R[-86]C-R[-43]C -> 0 | AB118: =R[-86]C-R[-43]C -> 0 | AC118: =R[-86]C-R[-43]C -> 0 | AD118: =R[-86]C-R[-43]C -> 0 | AE118: =R[-86]C-R[-43]C -> 0 | AF118: =R[-86]C-R[-43]C -> 0 | AG118: =R[-86]C-R[-43]C -> 0 | AH118: =R[-86]C-R[-43]C -> 0 | AI118: =R[-86]C-R[-43]C -> 0 | AJ118: =R[-86]C-R[-43]C -> 0 | AK118: =R[-86]C-R[-43]C -> 0 | AL118: =R[-86]C-R[-43]C -> -1 | AM118: =R[-86]C-R[-43]C -> -1 | AN118: =R[-86]C-R[-43]C -> -1 | AO118: =R[-86]C-R[-43]C -> -1 | AP118: =R[-86]C-R[-43]C -> -1 | AQ118: =R[-86]C-R[-43]C -> 1
A119: USA | B119: World - A | C119: C50 | E119: =R[-86]C-R[-43]C -> 0 | F119: =R[-86]C-R[-43]C -> 1 | G119: =R[-86]C-R[-43]C -> 0 | H119: =R[-86]C-R[-43]C -> 1 | I119: =R[-86]C-R[-43]C -> 0 | J119: =R[-86]C-R[-43]C -> 1 | K119: =R[-86]C-R[-43]C -> 0 | L119: =R[-86]C-R[-43]C -> 0 | M119: =R[-86]C-R[-43]C -> 0 | N119: =R[-86]C-R[-43]C -> 0 | O119: =R[-86]C-R[-43]C -> 0 | P119: =R[-86]C-R[-43]C -> 1 | Q119: =R[-86]C-R[-43]C -> 1 | R119: =R[-86]C-R[-43]C -> 1 | S119: =R[-86]C-R[-43]C -> 0 | T119: =R[-86]C-R[-43]C -> 1 | U119: =R[-86]C-R[-43]C -> 0 | V119: =R[-86]C-R[-43]C -> 0 | W119: =R[-86]C-R[-43]C -> -1 | X119: =R[-86]C-R[-43]C -> 0 | Y119: =R[-86]C-R[-43]C -> 0 | Z119: =R[-86]C-R[-43]C -> 0 | AA119: =R[-86]C-R[-43]C -> 0 | AB119: =R[-86]C-R[-43]C -> 0 | AC119: =R[-86]C-R[-43]C -> 0 | AD119: =R[-86]C-R[-43]C -> 0 | AE119: =R[-86]C-R[-43]C -> 0 | AF119: =R[-86]C-R[-43]C -> 0 | AG119: =R[-86]C-R[-43]C -> 0 | AH119: =R[-86]C-R[-43]C -> 0 | AI119: =R[-86]C-R[-43]C -> 0 | AJ119: =R[-86]C-R[-43]C -> 0 | AK119: =R[-86]C-R[-43]C -> 0 | AL119: =R[-86]C-R[-43]C -> 0 | AM119: =R[-86]C-R[-43]C -> 0 | AN119: =R[-86]C-R[-43]C -> 0 | AO119: =R[-86]C-R[-43]C -> 0 | AP119: =R[-86]C-R[-43]C -> 0 | AQ119: =R[-86]C-R[-43]C -> 0
A120: Turkey | B120: World - B | C120: C42 | E120: =R[-86]C-R[-43]C -> 0 | F120: =R[-86]C-R[-43]C -> 0 | G120: =R[-86]C-R[-43]C -> 0 | H120: =R[-86]C-R[-43]C -> 0 | I120: =R[-86]C-R[-43]C -> 0 | J120: =R[-86]C-R[-43]C -> 0 | K120: =R[-86]C-R[-43]C -> 0 | L120: =R[-86]C-R[-43]C -> 0 | M120: =R[-86]C-R[-43]C -> 0 | N120: =R[-86]C-R[-43]C -> 0 | O120: =R[-86]C-R[-43]C -> 0 | P120: =R[-86]C-R[-43]C -> 0 | Q120: =R[-86]C-R[-43]C -> 0 | R120: =R[-86]C-R[-43]C -> 0 | S120: =R[-86]C-R[-43]C -> 0 | T120: =R[-86]C-R[-43]C -> 0 | U120: =R[-86]C-R[-43]C -> 0 | V120: =R[-86]C-R[-43]C -> 0 | W120: =R[-86]C-R[-43]C -> -2 | X120: =R[-86]C-R[-43]C -> 0 | Y120: =R[-86]C-R[-43]C -> 0 | Z120: =R[-86]C-R[-43]C -> 0 | AA120: =R[-86]C-R[-43]C -> 0 | AB120: =R[-86]C-R[-43]C -> 0 | AC120: =R[-86]C-R[-43]C -> 0 | AD120: =R[-86]C-R[-43]C -> 0 | AE120: =R[-86]C-R[-43]C -> 0 | AF120: =R[-86]C-R[-43]C -> 0 | AG120: =R[-86]C-R[-43]C -> 0 | AH120: =R[-86]C-R[-43]C -> 0 | AI120: =R[-86]C-R[-43]C -> 0 | AJ120: =R[-86]C-R[-43]C -> 0 | AK120: =R[-86]C-R[-43]C -> 0 | AL120: =R[-86]C-R[-43]C -> 0 | AM120: =R[-86]C-R[-43]C -> 0 | AN120: =R[-86]C-R[-43]C -> 0 | AO120: =R[-86]C-R[-43]C -> 0 | AP120: =R[-86]C-R[-43]C -> 0 | AQ120: =R[-86]C-R[-43]C -> 0
A121: Australia | B121: World - A | C121: C70 | E121: =R[-86]C-R[-43]C -> 0 | F121: =R[-86]C-R[-43]C -> 0 | G121: =R[-86]C-R[-43]C -> 0 | H121: =R[-86]C-R[-43]C -> 0 | I121: =R[-86]C-R[-43]C -> 0 | J121: =R[-86]C-R[-43]C -> 0 | K121: =R[-86]C-R[-43]C -> 0 | L121: =R[-86]C-R[-43]C -> 0 | M121: =R[-86]C-R[-43]C -> 0 | N121: =R[-86]C-R[-43]C -> 0 | O121: =R[-86]C-R[-43]C -> 0 | P121: =R[-86]C-R[-43]C -> 0 | Q121: =R[-86]C-R[-43]C -> 0 | R121: =R[-86]C-R[-43]C -> 0 | S121: =R[-86]C-R[-43]C -> 0 | T121: =R[-86]C-R[-43]C -> 0 | U121: =R[-86]C-R[-43]C -> 0 | V121: =R[-86]C-R[-43]C -> 0 | W121: =R[-86]C-R[-43]C -> -2 | X121: =R[-86]C-R[-43]C -> 0 | Y121: =R[-86]C-R[-43]C -> 0 | Z121: =R[-86]C-R[-43]C -> 0 | AA121: =R[-86]C-R[-43]C -> 0 | AB121: =R[-86]C-R[-43]C -> 0 | AC121: =R[-86]C-R[-43]C -> 0 | AD121: =R[-86]C-R[-43]C -> 0 | AE121: =R[-86]C-R[-43]C -> 0 | AF121: =R[-86]C-R[-43]C -> 0 | AG121: =R[-86]C-R[-43]C -> 0 | AH121: =R[-86]C-R[-43]C -> 0 | AI121: =R[-86]C-R[-43]C -> 0 | AJ121: =R[-86]C-R[-43]C -> 0 | AK121: =R[-86]C-R[-43]C -> 0 | AL121: =R[-86]C-R[-43]C -> 0 | AM121: =R[-86]C-R[-43]C -> 0 | AN121: =R[-86]C-R[-43]C -> 0 | AO121: =R[-86]C-R[-43]C -> 0 | AP121: =R[-86]C-R[-43]C -> 0 | AQ121: =R[-86]C-R[-43]C -> 0
A122: Japan | B122: World - A | C122: C41 | E122: =R[-86]C-R[-43]C -> -1 | F122: =R[-86]C-R[-43]C -> -1 | G122: =R[-86]C-R[-43]C -> -1 | H122: =R[-86]C-R[-43]C -> 1 | I122: =R[-86]C-R[-43]C -> 1 | J122: =R[-86]C-R[-43]C -> 1 | K122: =R[-86]C-R[-43]C -> 1 | L122: =R[-86]C-R[-43]C -> 1 | M122: =R[-86]C-R[-43]C -> 1 | N122: =R[-86]C-R[-43]C -> -1 | O122: =R[-86]C-R[-43]C -> 1 | P122: =R[-86]C-R[-43]C -> 1 | Q122: =R[-86]C-R[-43]C -> 1 | R122: =R[-86]C-R[-43]C -> 1 | S122: =R[-86]C-R[-43]C -> 1 | T122: =R[-86]C-R[-43]C -> 1 | U122: =R[-86]C-R[-43]C -> -1 | V122: =R[-86]C-R[-43]C -> 1 | W122: =R[-86]C-R[-43]C -> -1 | X122: =R[-86]C-R[-43]C -> -1 | Y122: =R[-86]C-R[-43]C -> -1 | Z122: =R[-86]C-R[-43]C -> -1 | AA122: =R[-86]C-R[-43]C -> 0 | AB122: =R[-86]C-R[-43]C -> -1 | AC122: =R[-86]C-R[-43]C -> 0 | AD122: =R[-86]C-R[-43]C -> 0 | AE122: =R[-86]C-R[-43]C -> 0 | AF122: =R[-86]C-R[-43]C -> 0 | AG122: =R[-86]C-R[-43]C -> 0 | AH122: =R[-86]C-R[-43]C -> -1 | AI122: =R[-86]C-R[-43]C -> 0 | AJ122: =R[-86]C-R[-43]C -> 0 | AK122: =R[-86]C-R[-43]C -> 0 | AL122: =R[-86]C-R[-43]C -> 0 | AM122: =R[-86]C-R[-43]C -> 0 | AN122: =R[-86]C-R[-43]C -> 0 | AO122: =R[-86]C-R[-43]C -> 0 | AP122: =R[-86]C-R[-43]C -> 0 | AQ122: =R[-86]C-R[-43]C -> 0
A123: Korea | B123: World - A | C123: C40 | E123: =R[-86]C-R[-43]C -> 0 | F123: =R[-86]C-R[-43]C -> 0 | G123: =R[-86]C-R[-43]C -> 0 | H123: =R[-86]C-R[-43]C -> 0 | I123: =R[-86]C-R[-43]C -> 0 | J123: =R[-86]C-R[-43]C -> 0 | K123: =R[-86]C-R[-43]C -> 0 | L123: =R[-86]C-R[-43]C -> 0 | M123: =R[-86]C-R[-43]C -> 0 | N123: =R[-86]C-R[-43]C -> 0 | O123: =R[-86]C-R[-43]C -> 0 | P123: =R[-86]C-R[-43]C -> 0 | Q123: =R[-86]C-R[-43]C -> 0 | R123: =R[-86]C-R[-43]C -> 0 | S123: =R[-86]C-R[-43]C -> 0 | T123: =R[-86]C-R[-43]C -> 0 | U123: =R[-86]C-R[-43]C -> 0 | V123: =R[-86]C-R[-43]C -> 0 | W123: =R[-86]C-R[-43]C -> -2 | X123: =R[-86]C-R[-43]C -> 0 | Y123: =R[-86]C-R[-43]C -> 0 | Z123: =R[-86]C-R[-43]C -> 0 | AA123: =R[-86]C-R[-43]C -> 0 | AB123: =R[-86]C-R[-43]C -> 0 | AC123: =R[-86]C-R[-43]C -> 0 | AD123: =R[-86]C-R[-43]C -> 0 | AE123: =R[-86]C-R[-43]C -> 0 | AF123: =R[-86]C-R[-43]C -> 0 | AG123: =R[-86]C-R[-43]C -> 0 | AH123: =R[-86]C-R[-43]C -> 0 | AI123: =R[-86]C-R[-43]C -> 0 | AJ123: =R[-86]C-R[-43]C -> 0 | AK123: =R[-86]C-R[-43]C -> 0 | AL123: =R[-86]C-R[-43]C -> 0 | AM123: =R[-86]C-R[-43]C -> 0 | AN123: =R[-86]C-R[-43]C -> 0 | AO123: =R[-86]C-R[-43]C -> 0 | AP123: =R[-86]C-R[-43]C -> 0 | AQ123: =R[-86]C-R[-43]C -> 0
A124: Canada | B124: World - A | C124: C51 | E124: =R[-86]C-R[-43]C -> -1 | F124: =R[-86]C-R[-43]C -> -1 | G124: =R[-86]C-R[-43]C -> -1 | H124: =R[-86]C-R[-43]C -> 0 | I124: =R[-86]C-R[-43]C -> -1 | J124: =R[-86]C-R[-43]C -> 0 | K124: =R[-86]C-R[-43]C -> 0 | L124: =R[-86]C-R[-43]C -> 0 | M124: =R[-86]C-R[-43]C -> 0 | N124: =R[-86]C-R[-43]C -> 0 | O124: =R[-86]C-R[-43]C -> 0 | P124: =R[-86]C-R[-43]C -> 0 | Q124: =R[-86]C-R[-43]C -> 0 | R124: =R[-86]C-R[-43]C -> 0 | S124: =R[-86]C-R[-43]C -> 0 | T124: =R[-86]C-R[-43]C -> 0 | U124: =R[-86]C-R[-43]C -> 0 | V124: =R[-86]C-R[-43]C -> -1 | W124: =R[-86]C-R[-43]C -> -2 | X124: =R[-86]C-R[-43]C -> -1 | Y124: =R[-86]C-R[-43]C -> -1 | Z124: =R[-86]C-R[-43]C -> -1 | AA124: =R[-86]C-R[-43]C -> -1 | AB124: =R[-86]C-R[-43]C -> -1 | AC124: =R[-86]C-R[-43]C -> -1 | AD124: =R[-86]C-R[-43]C -> -1 | AE124: =R[-86]C-R[-43]C -> -1 | AF124: =R[-86]C-R[-43]C -> -1 | AG124: =R[-86]C-R[-43]C -> -1 | AH124: =R[-86]C-R[-43]C -> -1 | AI124: =R[-86]C-R[-43]C -> -1 | AJ124: =R[-86]C-R[-43]C -> -1 | AK124: =R[-86]C-R[-43]C -> -1 | AL124: =R[-86]C-R[-43]C -> -1 | AM124: =R[-86]C-R[-43]C -> -1 | AN124: =R[-86]C-R[-43]C -> -1 | AO124: =R[-86]C-R[-43]C -> -1 | AP124: =R[-86]C-R[-43]C -> -1 | AQ124: =R[-86]C-R[-43]C -> -1
A125: New Zealand | B125: World - A | C125: C71 | E125: =R[-86]C-R[-43]C -> 0 | F125: =R[-86]C-R[-43]C -> 0 | G125: =R[-86]C-R[-43]C -> 0 | H125: =R[-86]C-R[-43]C -> 0 | I125: =R[-86]C-R[-43]C -> 0 | J125: =R[-86]C-R[-43]C -> 0 | K125: =R[-86]C-R[-43]C -> 0 | L125: =R[-86]C-R[-43]C -> 0 | M125: =R[-86]C-R[-43]C -> 0 | N125: =R[-86]C-R[-43]C -> 0 | O125: =R[-86]C-R[-43]C -> 0 | P125: =R[-86]C-R[-43]C -> 0 | Q125: =R[-86]C-R[-43]C -> 0 | R125: =R[-86]C-R[-43]C -> 0 | S125: =R[-86]C-R[-43]C -> 0 | T125: =R[-86]C-R[-43]C -> 0 | U125: =R[-86]C-R[-43]C -> 0 | V125: =R[-86]C-R[-43]C -> 0 | W125: =R[-86]C-R[-43]C -> -2 | X125: =R[-86]C-R[-43]C -> 0 | Y125: =R[-86]C-R[-43]C -> 0 | Z125: =R[-86]C-R[-43]C -> 0 | AA125: =R[-86]C-R[-43]C -> 0 | AB125: =R[-86]C-R[-43]C -> 0 | AC125: =R[-86]C-R[-43]C -> 0 | AD125: =R[-86]C-R[-43]C -> 0 | AE125: =R[-86]C-R[-43]C -> 0 | AF125: =R[-86]C-R[-43]C -> 0 | AG125: =R[-86]C-R[-43]C -> 0 | AH125: =R[-86]C-R[-43]C -> 0 | AI125: =R[-86]C-R[-43]C -> 0 | AJ125: =R[-86]C-R[-43]C -> 0 | AK125: =R[-86]C-R[-43]C -> 0 | AL125: =R[-86]C-R[-43]C -> 0 | AM125: =R[-86]C-R[-43]C -> 0 | AN125: =R[-86]C-R[-43]C -> 0 | AO125: =R[-86]C-R[-43]C -> 0 | AP125: =R[-86]C-R[-43]C -> 0 | AQ125: =R[-86]C-R[-43]C -> 0
A126: Mexico | B126: World - B | C126: C72 | E126: =R[-86]C-R[-43]C -> 0 | F126: =R[-86]C-R[-43]C -> 0 | G126: =R[-86]C-R[-43]C -> 0 | H126: =R[-86]C-R[-43]C -> 0 | I126: =R[-86]C-R[-43]C -> 0 | J126: =R[-86]C-R[-43]C -> 0 | K126: =R[-86]C-R[-43]C -> 0 | L126: =R[-86]C-R[-43]C -> 0 | M126: =R[-86]C-R[-43]C -> 0 | N126: =R[-86]C-R[-43]C -> 0 | O126: =R[-86]C-R[-43]C -> 0 | P126: =R[-86]C-R[-43]C -> 0 | Q126: =R[-86]C-R[-43]C -> 0 | R126: =R[-86]C-R[-43]C -> 0 | S126: =R[-86]C-R[-43]C -> 0 | T126: =R[-86]C-R[-43]C -> 0 | U126: =R[-86]C-R[-43]C -> 0 | V126: =R[-86]C-R[-43]C -> 0 | W126: =R[-86]C-R[-43]C -> -2 | X126: =R[-86]C-R[-43]C -> 0 | Y126: =R[-86]C-R[-43]C -> 0 | Z126: =R[-86]C-R[-43]C -> 0 | AA126: =R[-86]C-R[-43]C -> 0 | AB126: =R[-86]C-R[-43]C -> 0 | AC126: =R[-86]C-R[-43]C -> 0 | AD126: =R[-86]C-R[-43]C -> 0 | AE126: =R[-86]C-R[-43]C -> 0 | AF126: =R[-86]C-R[-43]C -> 0 | AG126: =R[-86]C-R[-43]C -> 0 | AH126: =R[-86]C-R[-43]C -> 0 | AI126: =R[-86]C-R[-43]C -> 0 | AJ126: =R[-86]C-R[-43]C -> 0 | AK126: =R[-86]C-R[-43]C -> 0 | AL126: =R[-86]C-R[-43]C -> 0 | AM126: =R[-86]C-R[-43]C -> 0 | AN126: =R[-86]C-R[-43]C -> 0 | AO126: =R[-86]C-R[-43]C -> 0 | AP126: =R[-86]C-R[-43]C -> 0 | AQ126: =R[-86]C-R[-43]C -> 0
A127: CEE - Total | B127: Totals | E127: =R[-86]C-R[-43]C -> 0 | F127: =R[-86]C-R[-43]C -> 0 | G127: =R[-86]C-R[-43]C -> 0 | H127: =R[-86]C-R[-43]C -> 0 | I127: =R[-86]C-R[-43]C -> 0 | J127: =R[-86]C-R[-43]C -> 0 | K127: =R[-86]C-R[-43]C -> 0 | L127: =R[-86]C-R[-43]C -> 0 | M127: =R[-86]C-R[-43]C -> 0 | N127: =R[-86]C-R[-43]C -> 0 | O127: =R[-86]C-R[-43]C -> 0 | P127: =R[-86]C-R[-43]C -> 0 | Q127: =R[-86]C-R[-43]C -> 0 | R127: =R[-86]C-R[-43]C -> 0 | S127: =R[-86]C-R[-43]C -> 0 | T127: =R[-86]C-R[-43]C -> 0 | U127: =R[-86]C-R[-43]C -> 0 | V127: =R[-86]C-R[-43]C -> 0 | W127: =R[-86]C-R[-43]C -> 0 | X127: =R[-86]C-R[-43]C -> 0 | Y127: =R[-86]C-R[-43]C -> 0 | Z127: =R[-86]C-R[-43]C -> 0 | AA127: =R[-86]C-R[-43]C -> 0 | AB127: =R[-86]C-R[-43]C -> 0 | AC127: =R[-86]C-R[-43]C -> 0 | AD127: =R[-86]C-R[-43]C -> 0 | AE127: =R[-86]C-R[-43]C -> 0 | AF127: =R[-86]C-R[-43]C -> 0 | AG127: =R[-86]C-R[-43]C -> 0 | AH127: =R[-86]C-R[-43]C -> 0 | AI127: =R[-86]C-R[-43]C -> 0 | AJ127: =R[-86]C-R[-43]C -> 0 | AK127: =R[-86]C-R[-43]C -> 0 | AL127: =R[-86]C-R[-43]C -> 0 | AM127: =R[-86]C-R[-43]C -> 0 | AN127: =R[-86]C-R[-43]C -> 0 | AO127: =R[-86]C-R[-43]C -> 0 | AP127: =R[-86]C-R[-43]C -> 0 | AQ127: =R[-86]C-R[-43]C -> 0
A128: EU - Total | B128: Totals | E128: =R[-86]C-R[-43]C -> 0 | F128: =R[-86]C-R[-43]C -> 0 | G128: =R[-86]C-R[-43]C -> 0 | H128: =R[-86]C-R[-43]C -> 0 | I128: =R[-86]C-R[-43]C -> 0 | J128: =R[-86]C-R[-43]C -> 0 | K128: =R[-86]C-R[-43]C -> 0 | L128: =R[-86]C-R[-43]C -> 0 | M128: =R[-86]C-R[-43]C -> 0 | N128: =R[-86]C-R[-43]C -> 0 | O128: =R[-86]C-R[-43]C -> 0 | P128: =R[-86]C-R[-43]C -> 0 | Q128: =R[-86]C-R[-43]C -> 0 | R128: =R[-86]C-R[-43]C -> 0 | S128: =R[-86]C-R[-43]C -> 0 | T128: =R[-86]C-R[-43]C -> 0 | U128: =R[-86]C-R[-43]C -> 0 | V128: =R[-86]C-R[-43]C -> 0 | W128: =R[-86]C-R[-43]C -> 0 | X128: =R[-86]C-R[-43]C -> 0 | Y128: =R[-86]C-R[-43]C -> 0 | Z128: =R[-86]C-R[-43]C -> 0 | AA128: =R[-86]C-R[-43]C -> 0 | AB128: =R[-86]C-R[-43]C -> 0 | AC128: =R[-86]C-R[-43]C -> 0 | AD128: =R[-86]C-R[-43]C -> 0 | AE128: =R[-86]C-R[-43]C -> 0 | AF128: =R[-86]C-R[-43]C -> 0 | AG128: =R[-86]C-R[-43]C -> 0 | AH128: =R[-86]C-R[-43]C -> 0 | AI128: =R[-86]C-R[-43]C -> 0 | AJ128: =R[-86]C-R[-43]C -> 0 | AK128: =R[-86]C-R[-43]C -> 0 | AL128: =R[-86]C-R[-43]C -> 0 | AM128: =R[-86]C-R[-43]C -> 0 | AN128: =R[-86]C-R[-43]C -> 0 | AO128: =R[-86]C-R[-43]C -> 0 | AP128: =R[-86]C-R[-43]C -> 0 | AQ128: =R[-86]C-R[-43]C -> 0
A129: EFTA - Total | B129: Totals | E129: =R[-86]C-R[-43]C -> 0 | F129: =R[-86]C-R[-43]C -> 0 | G129: =R[-86]C-R[-43]C -> 0 | H129: =R[-86]C-R[-43]C -> 0 | I129: =R[-86]C-R[-43]C -> 0 | J129: =R[-86]C-R[-43]C -> 0 | K129: =R[-86]C-R[-43]C -> 0 | L129: =R[-86]C-R[-43]C -> 0 | M129: =R[-86]C-R[-43]C -> 0 | N129: =R[-86]C-R[-43]C -> 0 | O129: =R[-86]C-R[-43]C -> 0 | P129: =R[-86]C-R[-43]C -> 0 | Q129: =R[-86]C-R[-43]C -> 0 | R129: =R[-86]C-R[-43]C -> 0 | S129: =R[-86]C-R[-43]C -> 0 | T129: =R[-86]C-R[-43]C -> 0 | U129: =R[-86]C-R[-43]C -> 0 | V129: =R[-86]C-R[-43]C -> 0 | W129: =R[-86]C-R[-43]C -> 0 | X129: =R[-86]C-R[-43]C -> 0 | Y129: =R[-86]C-R[-43]C -> 0 | Z129: =R[-86]C-R[-43]C -> 0 | AA129: =R[-86]C-R[-43]C -> 0 | AB129: =R[-86]C-R[-43]C -> 0 | AC129: =R[-86]C-R[-43]C -> 0 | AD129: =R[-86]C-R[-43]C -> 0 | AE129: =R[-86]C-R[-43]C -> 0 | AF129: =R[-86]C-R[-43]C -> 0 | AG129: =R[-86]C-R[-43]C -> 0 | AH129: =R[-86]C-R[-43]C -> 0 | AI129: =R[-86]C-R[-43]C -> 0 | AJ129: =R[-86]C-R[-43]C -> 0 | AK129: =R[-86]C-R[-43]C -> 0 | AL129: =R[-86]C-R[-43]C -> 0 | AM129: =R[-86]C-R[-43]C -> 0 | AN129: =R[-86]C-R[-43]C -> 0 | AO129: =R[-86]C-R[-43]C -> 0 | AP129: =R[-86]C-R[-43]C -> 0 | AQ129: =R[-86]C-R[-43]C -> 0
A130: World A - Total | B130: Totals | E130: =R[-86]C-R[-43]C -> 0 | F130: =R[-86]C-R[-43]C -> 0 | G130: =R[-86]C-R[-43]C -> 0 | H130: =R[-86]C-R[-43]C -> 0 | I130: =R[-86]C-R[-43]C -> 0 | J130: =R[-86]C-R[-43]C -> 0 | K130: =R[-86]C-R[-43]C -> 0 | L130: =R[-86]C-R[-43]C -> 0 | M130: =R[-86]C-R[-43]C -> 0 | N130: =R[-86]C-R[-43]C -> 0 | O130: =R[-86]C-R[-43]C -> 0 | P130: =R[-86]C-R[-43]C -> 0 | Q130: =R[-86]C-R[-43]C -> 0 | R130: =R[-86]C-R[-43]C -> 0 | S130: =R[-86]C-R[-43]C -> 0 | T130: =R[-86]C-R[-43]C -> 0 | U130: =R[-86]C-R[-43]C -> 0 | V130: =R[-86]C-R[-43]C -> 0 | W130: =R[-86]C-R[-43]C -> 0 | X130: =R[-86]C-R[-43]C -> 0 | Y130: =R[-86]C-R[-43]C -> 0 | Z130: =R[-86]C-R[-43]C -> 0 | AA130: =R[-86]C-R[-43]C -> 0 | AB130: =R[-86]C-R[-43]C -> 0 | AC130: =R[-86]C-R[-43]C -> 0 | AD130: =R[-86]C-R[-43]C -> 0 | AE130: =R[-86]C-R[-43]C -> 0 | AF130: =R[-86]C-R[-43]C -> 0 | AG130: =R[-86]C-R[-43]C -> 0 | AH130: =R[-86]C-R[-43]C -> 0 | AI130: =R[-86]C-R[-43]C -> 0 | AJ130: =R[-86]C-R[-43]C -> 0 | AK130: =R[-86]C-R[-43]C -> 0 | AL130: =R[-86]C-R[-43]C -> 0 | AM130: =R[-86]C-R[-43]C -> 0 | AN130: =R[-86]C-R[-43]C -> 0 | AO130: =R[-86]C-R[-43]C -> 0 | AP130: =R[-86]C-R[-43]C -> 0 | AQ130: =R[-86]C-R[-43]C -> 0
A131: World B - Total | B131: Totals | E131: =R[-86]C-R[-43]C -> 0 | F131: =R[-86]C-R[-43]C -> 0 | G131: =R[-86]C-R[-43]C -> 0 | H131: =R[-86]C-R[-43]C -> 0 | I131: =R[-86]C-R[-43]C -> 0 | J131: =R[-86]C-R[-43]C -> 0 | K131: =R[-86]C-R[-43]C -> 0 | L131: =R[-86]C-R[-43]C -> 0 | M131: =R[-86]C-R[-43]C -> 0 | N131: =R[-86]C-R[-43]C -> 0 | O131: =R[-86]C-R[-43]C -> 0 | P131: =R[-86]C-R[-43]C -> 0 | Q131: =R[-86]C-R[-43]C -> 0 | R131: =R[-86]C-R[-43]C -> 0 | S131: =R[-86]C-R[-43]C -> 0 | T131: =R[-86]C-R[-43]C -> 0 | U131: =R[-86]C-R[-43]C -> 0 | V131: =R[-86]C-R[-43]C -> 0 | W131: =R[-86]C-R[-43]C -> 0 | X131: =R[-86]C-R[-43]C -> 0 | Y131: =R[-86]C-R[-43]C -> 0 | Z131: =R[-86]C-R[-43]C -> 0 | AA131: =R[-86]C-R[-43]C -> 0 | AB131: =R[-86]C-R[-43]C -> 0 | AC131: =R[-86]C-R[-43]C -> 0 | AD131: =R[-86]C-R[-43]C -> 0 | AE131: =R[-86]C-R[-43]C -> 0 | AF131: =R[-86]C-R[-43]C -> 0 | AG131: =R[-86]C-R[-43]C -> 0 | AH131: =R[-86]C-R[-43]C -> 0 | AI131: =R[-86]C-R[-43]C -> 0 | AJ131: =R[-86]C-R[-43]C -> 0 | AK131: =R[-86]C-R[-43]C -> 0 | AL131: =R[-86]C-R[-43]C -> 0 | AM131: =R[-86]C-R[-43]C -> 0 | AN131: =R[-86]C-R[-43]C -> 0 | AO131: =R[-86]C-R[-43]C -> 0 | AP131: =R[-86]C-R[-43]C -> 0 | AQ131: =R[-86]C-R[-43]C -> 0
E132: =R[-86]C-R[-43]C -> 0 | F132: =R[-86]C-R[-43]C -> 0 | G132: =R[-86]C-R[-43]C -> 0 | H132: =R[-86]C-R[-43]C -> 0 | I132: =R[-86]C-R[-43]C -> 0 | J132: =R[-86]C-R[-43]C -> 0 | K132: =R[-86]C-R[-43]C -> 0 | L132: =R[-86]C-R[-43]C -> 0 | M132: =R[-86]C-R[-43]C -> 0 | N132: =R[-86]C-R[-43]C -> 0 | O132: =R[-86]C-R[-43]C -> 0 | P132: =R[-86]C-R[-43]C -> 0 | Q132: =R[-86]C-R[-43]C -> 0 | R132: =R[-86]C-R[-43]C -> 0 | S132: =R[-86]C-R[-43]C -> 0 | T132: =R[-86]C-R[-43]C -> 0 | U132: =R[-86]C-R[-43]C -> 0 | V132: =R[-86]C-R[-43]C -> 0 | W132: =R[-86]C-R[-43]C -> 0 | X132: =R[-86]C-R[-43]C -> 0 | Y132: =R[-86]C-R[-43]C -> 0 | Z132: =R[-86]C-R[-43]C -> 0 | AA132: =R[-86]C-R[-43]C -> 0 | AB132: =R[-86]C-R[-43]C -> 0 | AC132: =R[-86]C-R[-43]C -> 0 | AD132: =R[-86]C-R[-43]C -> 0 | AE132: =R[-86]C-R[-43]C -> 0 | AF132: =R[-86]C-R[-43]C -> 0 | AG132: =R[-86]C-R[-43]C -> 0 | AH132: =R[-86]C-R[-43]C -> 0 | AI132: =R[-86]C-R[-43]C -> 0 | AJ132: =R[-86]C-R[-43]C -> 0 | AK132: =R[-86]C-R[-43]C -> 0 | AL132: =R[-86]C-R[-43]C -> 0 | AM132: =R[-86]C-R[-43]C -> 0 | AN132: =R[-86]C-R[-43]C -> 0 | AO132: =R[-86]C-R[-43]C -> 0 | AP132: =R[-86]C-R[-43]C -> 0 | AQ132: =R[-86]C-R[-43]C -> 0
E133: =R[-86]C-R[-43]C -> -1 | F133: =R[-86]C-R[-43]C -> -1 | G133: =R[-86]C-R[-43]C -> -1 | H133: =R[-86]C-R[-43]C -> -1 | I133: =R[-86]C-R[-43]C -> 0 | J133: =R[-86]C-R[-43]C -> 0 | K133: =R[-86]C-R[-43]C -> -1 | L133: =R[-86]C-R[-43]C -> -1 | M133: =R[-86]C-R[-43]C -> 0 | N133: =R[-86]C-R[-43]C -> -1 | O133: =R[-86]C-R[-43]C -> -1 | P133: =R[-86]C-R[-43]C -> 0 | Q133: =R[-86]C-R[-43]C -> 0 | R133: =R[-86]C-R[-43]C -> 0 | S133: =R[-86]C-R[-43]C -> 2 | T133: =R[-86]C-R[-43]C -> -1 | U133: =R[-86]C-R[-43]C -> -1 | V133: =R[-86]C-R[-43]C -> -1 | W133: =R[-86]C-R[-43]C -> 2 | X133: =R[-86]C-R[-43]C -> -1 | Y133: =R[-86]C-R[-43]C -> 1 | Z133: =R[-86]C-R[-43]C -> 1 | AA133: =R[-86]C-R[-43]C -> -1 | AB133: =R[-86]C-R[-43]C -> -1 | AC133: =R[-86]C-R[-43]C -> -1 | AD133: =R[-86]C-R[-43]C -> -1 | AE133: =R[-86]C-R[-43]C -> -1 | AF133: =R[-86]C-R[-43]C -> -1 | AG133: =R[-86]C-R[-43]C -> -1 | AH133: =R[-86]C-R[-43]C -> -1 | AI133: =R[-86]C-R[-43]C -> -1 | AJ133: =R[-86]C-R[-43]C -> -1 | AK133: =R[-86]C-R[-43]C -> -1 | AL133: =R[-86]C-R[-43]C -> -1 | AM133: =R[-86]C-R[-43]C -> 2 | AN133: =R[-86]C-R[-43]C -> 2 | AO133: =R[-86]C-R[-43]C -> 2 | AP133: =R[-86]C-R[-43]C -> 2 | AQ133: =R[-86]C-R[-43]C -> 2
E134: =R[-86]C-R[-43]C -> 0 | F134: =R[-86]C-R[-43]C -> 0 | G134: =R[-86]C-R[-43]C -> 0 | H134: =R[-86]C-R[-43]C -> 0 | I134: =R[-86]C-R[-43]C -> 0 | J134: =R[-86]C-R[-43]C -> 1 | K134: =R[-86]C-R[-43]C -> 1 | L134: =R[-86]C-R[-43]C -> 1 | M134: =R[-86]C-R[-43]C -> 0 | N134: =R[-86]C-R[-43]C -> 0 | O134: =R[-86]C-R[-43]C -> 1 | P134: =R[-86]C-R[-43]C -> 0 | Q134: =R[-86]C-R[-43]C -> 0 | R134: =R[-86]C-R[-43]C -> 0 | S134: =R[-86]C-R[-43]C -> 2 | T134: =R[-86]C-R[-43]C -> 0 | U134: =R[-86]C-R[-43]C -> 0 | V134: =R[-86]C-R[-43]C -> 1 | W134: =R[-86]C-R[-43]C -> 2 | X134: =R[-86]C-R[-43]C -> 0 | Y134: =R[-86]C-R[-43]C -> 0 | Z134: =R[-86]C-R[-43]C -> 0 | AA134: =R[-86]C-R[-43]C -> 2 | AB134: =R[-86]C-R[-43]C -> 0 | AC134: =R[-86]C-R[-43]C -> 2 | AD134: =R[-86]C-R[-43]C -> 2 | AE134: =R[-86]C-R[-43]C -> 2 | AF134: =R[-86]C-R[-43]C -> 2 | AG134: =R[-86]C-R[-43]C -> 2 | AH134: =R[-86]C-R[-43]C -> 2 | AI134: =R[-86]C-R[-43]C -> 2 | AJ134: =R[-86]C-R[-43]C -> 2 | AK134: =R[-86]C-R[-43]C -> 2 | AL134: =R[-86]C-R[-43]C -> 2 | AM134: =R[-86]C-R[-43]C -> 2 | AN134: =R[-86]C-R[-43]C -> 2 | AO134: =R[-86]C-R[-43]C -> 2 | AP134: =R[-86]C-R[-43]C -> 2 | AQ134: =R[-86]C-R[-43]C -> 2
E135: =R[-86]C-R[-43]C -> 0 | F135: =R[-86]C-R[-43]C -> 0 | G135: =R[-86]C-R[-43]C -> 0 | H135: =R[-86]C-R[-43]C -> 0 | I135: =R[-86]C-R[-43]C -> 0 | J135: =R[-86]C-R[-43]C -> 0 | K135: =R[-86]C-R[-43]C -> 0 | L135: =R[-86]C-R[-43]C -> 0 | M135: =R[-86]C-R[-43]C -> 0 | N135: =R[-86]C-R[-43]C -> 0 | O135: =R[-86]C-R[-43]C -> 0 | P135: =R[-86]C-R[-43]C -> 0 | Q135: =R[-86]C-R[-43]C -> 0 | R135: =R[-86]C-R[-43]C -> 0 | S135: =R[-86]C-R[-43]C -> 0 | T135: =R[-86]C-R[-43]C -> 0 | U135: =R[-86]C-R[-43]C -> 0 | V135: =R[-86]C-R[-43]C -> 0 | W135: =R[-86]C-R[-43]C -> 2 | X135: =R[-86]C-R[-43]C -> 0 | Y135: =R[-86]C-R[-43]C -> 0 | Z135: =R[-86]C-R[-43]C -> 0 | AA135: =R[-86]C-R[-43]C -> 0 | AB135: =R[-86]C-R[-43]C -> 0 | AC135: =R[-86]C-R[-43]C -> 0 | AD135: =R[-86]C-R[-43]C -> 0 | AE135: =R[-86]C-R[-43]C -> 0 | AF135: =R[-86]C-R[-43]C -> 0 | AG135: =R[-86]C-R[-43]C -> 0 | AH135: =R[-86]C-R[-43]C -> 0 | AI135: =R[-86]C-R[-43]C -> 0 | AJ135: =R[-86]C-R[-43]C -> 0 | AK135: =R[-86]C-R[-43]C -> 0 | AL135: =R[-86]C-R[-43]C -> 0 | AM135: =R[-86]C-R[-43]C -> 0 | AN135: =R[-86]C-R[-43]C -> 0 | AO135: =R[-86]C-R[-43]C -> 0 | AP135: =R[-86]C-R[-43]C -> 0 | AQ135: =R[-86]C-R[-43]C -> -1
E136: =R[-86]C-R[-43]C -> -1 | F136: =R[-86]C-R[-43]C -> -1 | G136: =R[-86]C-R[-43]C -> -1 | H136: =R[-86]C-R[-43]C -> -1 | I136: =R[-86]C-R[-43]C -> 0 | J136: =R[-86]C-R[-43]C -> 1 | K136: =R[-86]C-R[-43]C -> 1 | L136: =R[-86]C-R[-43]C -> -1 | M136: =R[-86]C-R[-43]C -> -1 | N136: =R[-86]C-R[-43]C -> 1 | O136: =R[-86]C-R[-43]C -> 1 | P136: =R[-86]C-R[-43]C -> 0 | Q136: =R[-86]C-R[-43]C -> 0 | R136: =R[-86]C-R[-43]C -> 0 | S136: =R[-86]C-R[-43]C -> 2 | T136: =R[-86]C-R[-43]C -> -1 | U136: =R[-86]C-R[-43]C -> -1 | V136: =R[-86]C-R[-43]C -> -1 | W136: =R[-86]C-R[-43]C -> 2 | X136: =R[-86]C-R[-43]C -> -1 | Y136: =R[-86]C-R[-43]C -> -1 | Z136: =R[-86]C-R[-43]C -> -1 | AA136: =R[-86]C-R[-43]C -> -1 | AB136: =R[-86]C-R[-43]C -> -1 | AC136: =R[-86]C-R[-43]C -> 1 | AD136: =R[-86]C-R[-43]C -> 1 | AE136: =R[-86]C-R[-43]C -> 1 | AF136: =R[-86]C-R[-43]C -> 1 | AG136: =R[-86]C-R[-43]C -> 1 | AH136: =R[-86]C-R[-43]C -> 1 | AI136: =R[-86]C-R[-43]C -> -1 | AJ136: =R[-86]C-R[-43]C -> -1 | AK136: =R[-86]C-R[-43]C -> -1 | AL136: =R[-86]C-R[-43]C -> -1 | AM136: =R[-86]C-R[-43]C -> 2 | AN136: =R[-86]C-R[-43]C -> 2 | AO136: =R[-86]C-R[-43]C -> 2 | AP136: =R[-86]C-R[-43]C -> 2 | AQ136: =R[-86]C-R[-43]C -> 2
E137: =R[-86]C-R[-43]C -> 0 | F137: =R[-86]C-R[-43]C -> 0 | G137: =R[-86]C-R[-43]C -> 0 | H137: =R[-86]C-R[-43]C -> 0 | I137: =R[-86]C-R[-43]C -> 0 | J137: =R[-86]C-R[-43]C -> 2 | K137: =R[-86]C-R[-43]C -> 0 | L137: =R[-86]C-R[-43]C -> 2 | M137: =R[-86]C-R[-43]C -> 0 | N137: =R[-86]C-R[-43]C -> -1 | O137: =R[-86]C-R[-43]C -> 0 | P137: =R[-86]C-R[-43]C -> 0 | Q137: =R[-86]C-R[-43]C -> 0 | R137: =R[-86]C-R[-43]C -> 0 | S137: =R[-86]C-R[-43]C -> 2 | T137: =R[-86]C-R[-43]C -> 0 | U137: =R[-86]C-R[-43]C -> -1 | V137: =R[-86]C-R[-43]C -> 2 | W137: =R[-86]C-R[-43]C -> 2 | X137: =R[-86]C-R[-43]C -> 0 | Y137: =R[-86]C-R[-43]C -> 0 | Z137: =R[-86]C-R[-43]C -> 0 | AA137: =R[-86]C-R[-43]C -> 0 | AB137: =R[-86]C-R[-43]C -> 0 | AC137: =R[-86]C-R[-43]C -> 0 | AD137: =R[-86]C-R[-43]C -> 0 | AE137: =R[-86]C-R[-43]C -> 0 | AF137: =R[-86]C-R[-43]C -> 0 | AG137: =R[-86]C-R[-43]C -> 2 | AH137: =R[-86]C-R[-43]C -> 2 | AI137: =R[-86]C-R[-43]C -> 2 | AJ137: =R[-86]C-R[-43]C -> 2 | AK137: =R[-86]C-R[-43]C -> 2 | AL137: =R[-86]C-R[-43]C -> 2 | AM137: =R[-86]C-R[-43]C -> 1 | AN137: =R[-86]C-R[-43]C -> 1 | AO137: =R[-86]C-R[-43]C -> 1 | AP137: =R[-86]C-R[-43]C -> 1 | AQ137: =R[-86]C-R[-43]C -> 1
E138: =R[-86]C-R[-43]C -> 0 | F138: =R[-86]C-R[-43]C -> 0 | G138: =R[-86]C-R[-43]C -> 0 | H138: =R[-86]C-R[-43]C -> 0 | I138: =R[-86]C-R[-43]C -> 0 | J138: =R[-86]C-R[-43]C -> 0 | K138: =R[-86]C-R[-43]C -> 0 | L138: =R[-86]C-R[-43]C -> 0 | M138: =R[-86]C-R[-43]C -> 0 | N138: =R[-86]C-R[-43]C -> 0 | O138: =R[-86]C-R[-43]C -> 0 | P138: =R[-86]C-R[-43]C -> 0 | Q138: =R[-86]C-R[-43]C -> 0 | R138: =R[-86]C-R[-43]C -> 2 | S138: =R[-86]C-R[-43]C -> 4 | T138: =R[-86]C-R[-43]C -> 0 | U138: =R[-86]C-R[-43]C -> 0 | V138: =R[-86]C-R[-43]C -> 0 | W138: =R[-86]C-R[-43]C -> 2 | X138: =R[-86]C-R[-43]C -> 0 | Y138: =R[-86]C-R[-43]C -> 0 | Z138: =R[-86]C-R[-43]C -> 0 | AA138: =R[-86]C-R[-43]C -> 0 | AB138: =R[-86]C-R[-43]C -> 0 | AC138: =R[-86]C-R[-43]C -> 0 | AD138: =R[-86]C-R[-43]C -> 0 | AE138: =R[-86]C-R[-43]C -> 0 | AF138: =R[-86]C-R[-43]C -> 0 | AG138: =R[-86]C-R[-43]C -> 0 | AH138: =R[-86]C-R[-43]C -> 0 | AI138: =R[-86]C-R[-43]C -> 0 | AJ138: =R[-86]C-R[-43]C -> 0 | AK138: =R[-86]C-R[-43]C -> 0 | AL138: =R[-86]C-R[-43]C -> 0 | AM138: =R[-86]C-R[-43]C -> 2 | AN138: =R[-86]C-R[-43]C -> 2 | AO138: =R[-86]C-R[-43]C -> 2 | AP138: =R[-86]C-R[-43]C -> 2 | AQ138: =R[-86]C-R[-43]C -> 2
E139: =R[-86]C-R[-43]C -> 0 | F139: =R[-86]C-R[-43]C -> 0 | G139: =R[-86]C-R[-43]C -> 0 | H139: =R[-86]C-R[-43]C -> 0 | I139: =R[-86]C-R[-43]C -> 0 | J139: =R[-86]C-R[-43]C -> 0 | K139: =R[-86]C-R[-43]C -> 0 | L139: =R[-86]C-R[-43]C -> 0 | M139: =R[-86]C-R[-43]C -> 0 | N139: =R[-86]C-R[-43]C -> 0 | O139: =R[-86]C-R[-43]C -> 0 | P139: =R[-86]C-R[-43]C -> 0 | Q139: =R[-86]C-R[-43]C -> 0 | R139: =R[-86]C-R[-43]C -> 0 | S139: =R[-86]C-R[-43]C -> 2 | T139: =R[-86]C-R[-43]C -> 0 | U139: =R[-86]C-R[-43]C -> 0 | V139: =R[-86]C-R[-43]C -> 0 | W139: =R[-86]C-R[-43]C -> 2 | X139: =R[-86]C-R[-43]C -> 0 | Y139: =R[-86]C-R[-43]C -> 0 | Z139: =R[-86]C-R[-43]C -> 0 | AA139: =R[-86]C-R[-43]C -> 0 | AB139: =R[-86]C-R[-43]C -> 0 | AC139: =R[-86]C-R[-43]C -> 0 | AD139: =R[-86]C-R[-43]C -> 0 | AE139: =R[-86]C-R[-43]C -> 0 | AF139: =R[-86]C-R[-43]C -> 0 | AG139: =R[-86]C-R[-43]C -> 0 | AH139: =R[-86]C-R[-43]C -> 0 | AI139: =R[-86]C-R[-43]C -> 0 | AJ139: =R[-86]C-R[-43]C -> 0 | AK139: =R[-86]C-R[-43]C -> 0 | AL139: =R[-86]C-R[-43]C -> 0 | AM139: =R[-86]C-R[-43]C -> 0 | AN139: =R[-86]C-R[-43]C -> 0 | AO139: =R[-86]C-R[-43]C -> 0 | AP139: =R[-86]C-R[-43]C -> 0 | AQ139: =R[-86]C-R[-43]C -> 0
E140: =R[-86]C-R[-43]C -> 2 | F140: =R[-86]C-R[-43]C -> 2 | G140: =R[-86]C-R[-43]C -> 2 | H140: =R[-86]C-R[-43]C -> 2 | I140: =R[-86]C-R[-43]C -> 2 | J140: =R[-86]C-R[-43]C -> 2 | K140: =R[-86]C-R[-43]C -> 2 | L140: =R[-86]C-R[-43]C -> 2 | M140: =R[-86]C-R[-43]C -> 2 | N140: =R[-86]C-R[-43]C -> 2 | O140: =R[-86]C-R[-43]C -> 2 | P140: =R[-86]C-R[-43]C -> 2 | Q140: =R[-86]C-R[-43]C -> 2 | R140: =R[-86]C-R[-43]C -> 2 | S140: =R[-86]C-R[-43]C -> 2 | T140: =R[-86]C-R[-43]C -> 2 | U140: =R[-86]C-R[-43]C -> 2 | V140: =R[-86]C-R[-43]C -> 2 | W140: =R[-86]C-R[-43]C -> 4 | X140: =R[-86]C-R[-43]C -> 2 | Y140: =R[-86]C-R[-43]C -> 2 | Z140: =R[-86]C-R[-43]C -> 2 | AA140: =R[-86]C-R[-43]C -> 2 | AB140: =R[-86]C-R[-43]C -> 2 | AC140: =R[-86]C-R[-43]C -> 2 | AD140: =R[-86]C-R[-43]C -> 2 | AE140: =R[-86]C-R[-43]C -> 2 | AF140: =R[-86]C-R[-43]C -> 2 | AG140: =R[-86]C-R[-43]C -> 2 | AH140: =R[-86]C-R[-43]C -> 2 | AI140: =R[-86]C-R[-43]C -> 2 | AJ140: =R[-86]C-R[-43]C -> 2 | AK140: =R[-86]C-R[-43]C -> 2 | AL140: =R[-86]C-R[-43]C -> 2 | AM140: =R[-86]C-R[-43]C -> 2 | AN140: =R[-86]C-R[-43]C -> 2 | AO140: =R[-86]C-R[-43]C -> 2 | AP140: =R[-86]C-R[-43]C -> 2 | AQ140: =R[-86]C-R[-43]C -> 2
E141: =R[-86]C-R[-43]C -> 0 | F141: =R[-86]C-R[-43]C -> 0 | G141: =R[-86]C-R[-43]C -> 0 | H141: =R[-86]C-R[-43]C -> 0 | I141: =R[-86]C-R[-43]C -> 0 | J141: =R[-86]C-R[-43]C -> 0 | K141: =R[-86]C-R[-43]C -> 0 | L141: =R[-86]C-R[-43]C -> 0 | M141: =R[-86]C-R[-43]C -> 2 | N141: =R[-86]C-R[-43]C -> 0 | O141: =R[-86]C-R[-43]C -> 0 | P141: =R[-86]C-R[-43]C -> 0 | Q141: =R[-86]C-R[-43]C -> 0 | R141: =R[-86]C-R[-43]C -> 0 | S141: =R[-86]C-R[-43]C -> 4 | T141: =R[-86]C-R[-43]C -> 0 | U141: =R[-86]C-R[-43]C -> 0 | V141: =R[-86]C-R[-43]C -> 0 | W141: =R[-86]C-R[-43]C -> 2 | X141: =R[-86]C-R[-43]C -> 0 | Y141: =R[-86]C-R[-43]C -> 0 | Z141: =R[-86]C-R[-43]C -> 0 | AA141: =R[-86]C-R[-43]C -> 0 | AB141: =R[-86]C-R[-43]C -> 0 | AC141: =R[-86]C-R[-43]C -> 0 | AD141: =R[-86]C-R[-43]C -> 0 | AE141: =R[-86]C-R[-43]C -> 0 | AF141: =R[-86]C-R[-43]C -> 0 | AG141: =R[-86]C-R[-43]C -> 0 | AH141: =R[-86]C-R[-43]C -> 0 | AI141: =R[-86]C-R[-43]C -> 0 | AJ141: =R[-86]C-R[-43]C -> 0 | AK141: =R[-86]C-R[-43]C -> 0 | AL141: =R[-86]C-R[-43]C -> 0 | AM141: =R[-86]C-R[-43]C -> 4 | AN141: =R[-86]C-R[-43]C -> 4 | AO141: =R[-86]C-R[-43]C -> 4 | AP141: =R[-86]C-R[-43]C -> 4 | AQ141: =R[-86]C-R[-43]C -> 4
E142: =R[-86]C-R[-43]C -> 0 | F142: =R[-86]C-R[-43]C -> 0 | G142: =R[-86]C-R[-43]C -> 0 | H142: =R[-86]C-R[-43]C -> 0 | I142: =R[-86]C-R[-43]C -> 2 | J142: =R[-86]C-R[-43]C -> 0 | K142: =R[-86]C-R[-43]C -> 0 | L142: =R[-86]C-R[-43]C -> 0 | M142: =R[-86]C-R[-43]C -> 0 | N142: =R[-86]C-R[-43]C -> 0 | O142: =R[-86]C-R[-43]C -> -1 | P142: =R[-86]C-R[-43]C -> 0 | Q142: =R[-86]C-R[-43]C -> 1 | R142: =R[-86]C-R[-43]C -> 2 | S142: =R[-86]C-R[-43]C -> 4 | T142: =R[-86]C-R[-43]C -> 0 | U142: =R[-86]C-R[-43]C -> 0 | V142: =R[-86]C-R[-43]C -> 0 | W142: =R[-86]C-R[-43]C -> 2 | X142: =R[-86]C-R[-43]C -> 0 | Y142: =R[-86]C-R[-43]C -> 0 | Z142: =R[-86]C-R[-43]C -> 0 | AA142: =R[-86]C-R[-43]C -> 1 | AB142: =R[-86]C-R[-43]C -> 0 | AC142: =R[-86]C-R[-43]C -> 1 | AD142: =R[-86]C-R[-43]C -> 1 | AE142: =R[-86]C-R[-43]C -> 1 | AF142: =R[-86]C-R[-43]C -> 1 | AG142: =R[-86]C-R[-43]C -> 1 | AH142: =R[-86]C-R[-43]C -> 2 | AI142: =R[-86]C-R[-43]C -> 1 | AJ142: =R[-86]C-R[-43]C -> 1 | AK142: =R[-86]C-R[-43]C -> 1 | AL142: =R[-86]C-R[-43]C -> 0 | AM142: =R[-86]C-R[-43]C -> 2 | AN142: =R[-86]C-R[-43]C -> 2 | AO142: =R[-86]C-R[-43]C -> 2 | AP142: =R[-86]C-R[-43]C -> 2 | AQ142: =R[-86]C-R[-43]C -> 2
E143: =R[-86]C-R[-43]C -> 0 | F143: =R[-86]C-R[-43]C -> 0 | G143: =R[-86]C-R[-43]C -> 0 | H143: =R[-86]C-R[-43]C -> 0 | I143: =R[-86]C-R[-43]C -> 0 | J143: =R[-86]C-R[-43]C -> 0 | K143: =R[-86]C-R[-43]C -> 0 | L143: =R[-86]C-R[-43]C -> 0 | M143: =R[-86]C-R[-43]C -> 0 | N143: =R[-86]C-R[-43]C -> 0 | O143: =R[-86]C-R[-43]C -> 0 | P143: =R[-86]C-R[-43]C -> 0 | Q143: =R[-86]C-R[-43]C -> 0 | R143: =R[-86]C-R[-43]C -> 0 | S143: =R[-86]C-R[-43]C -> 2 | T143: =R[-86]C-R[-43]C -> 0 | U143: =R[-86]C-R[-43]C -> 0 | V143: =R[-86]C-R[-43]C -> 0 | W143: =R[-86]C-R[-43]C -> 2 | X143: =R[-86]C-R[-43]C -> 0 | Y143: =R[-86]C-R[-43]C -> 0 | Z143: =R[-86]C-R[-43]C -> 0 | AA143: =R[-86]C-R[-43]C -> 2 | AB143: =R[-86]C-R[-43]C -> 2 | AC143: =R[-86]C-R[-43]C -> 2 | AD143: =R[-86]C-R[-43]C -> 2 | AE143: =R[-86]C-R[-43]C -> 2 | AF143: =R[-86]C-R[-43]C -> 2 | AG143: =R[-86]C-R[-43]C -> 2 | AH143: =R[-86]C-R[-43]C -> 2 | AI143: =R[-86]C-R[-43]C -> 2 | AJ143: =R[-86]C-R[-43]C -> 2 | AK143: =R[-86]C-R[-43]C -> 2 | AL143: =R[-86]C-R[-43]C -> 2 | AM143: =R[-86]C-R[-43]C -> 2 | AN143: =R[-86]C-R[-43]C -> 2 | AO143: =R[-86]C-R[-43]C -> 2 | AP143: =R[-86]C-R[-43]C -> 2 | AQ143: =R[-86]C-R[-43]C -> 2
E144: =R[-86]C-R[-43]C -> 1 | F144: =R[-86]C-R[-43]C -> 2 | G144: =R[-86]C-R[-43]C -> 2 | H144: =R[-86]C-R[-43]C -> 2 | I144: =R[-86]C-R[-43]C -> 2 | J144: =R[-86]C-R[-43]C -> 2 | K144: =R[-86]C-R[-43]C -> 2 | L144: =R[-86]C-R[-43]C -> 2 | M144: =R[-86]C-R[-43]C -> 2 | N144: =R[-86]C-R[-43]C -> 2 | O144: =R[-86]C-R[-43]C -> 2 | P144: =R[-86]C-R[-43]C -> 2 | Q144: =R[-86]C-R[-43]C -> 2 | R144: =R[-86]C-R[-43]C -> 2 | S144: =R[-86]C-R[-43]C -> 2 | T144: =R[-86]C-R[-43]C -> 2 | U144: =R[-86]C-R[-43]C -> 2 | V144: =R[-86]C-R[-43]C -> 2 | W144: =R[-86]C-R[-43]C -> 2 | X144: =R[-86]C-R[-43]C -> 2 | Y144: =R[-86]C-R[-43]C -> 2 | Z144: =R[-86]C-R[-43]C -> 2 | AA144: =R[-86]C-R[-43]C -> 2 | AB144: =R[-86]C-R[-43]C -> 2 | AC144: =R[-86]C-R[-43]C -> 2 | AD144: =R[-86]C-R[-43]C -> 2 | AE144: =R[-86]C-R[-43]C -> 2 | AF144: =R[-86]C-R[-43]C -> 2 | AG144: =R[-86]C-R[-43]C -> 2 | AH144: =R[-86]C-R[-43]C -> 2 | AI144: =R[-86]C-R[-43]C -> 2 | AJ144: =R[-86]C-R[-43]C -> 2 | AK144: =R[-86]C-R[-43]C -> 2 | AL144: =R[-86]C-R[-43]C -> 2 | AM144: =R[-86]C-R[-43]C -> 2 | AN144: =R[-86]C-R[-43]C -> 2 | AO144: =R[-86]C-R[-43]C -> 2 | AP144: =R[-86]C-R[-43]C -> 2 | AQ144: =R[-86]C-R[-43]C -> 2
E145: =R[-86]C-R[-43]C -> 0 | F145: =R[-86]C-R[-43]C -> 0 | G145: =R[-86]C-R[-43]C -> 0 | H145: =R[-86]C-R[-43]C -> 2 | I145: =R[-86]C-R[-43]C -> 0 | J145: =R[-86]C-R[-43]C -> 0 | K145: =R[-86]C-R[-43]C -> 0 | L145: =R[-86]C-R[-43]C -> 0 | M145: =R[-86]C-R[-43]C -> 0 | N145: =R[-86]C-R[-43]C -> 0 | O145: =R[-86]C-R[-43]C -> 0 | P145: =R[-86]C-R[-43]C -> 2 | Q145: =R[-86]C-R[-43]C -> 0 | R145: =R[-86]C-R[-43]C -> 0 | S145: =R[-86]C-R[-43]C -> 2 | T145: =R[-86]C-R[-43]C -> 0 | U145: =R[-86]C-R[-43]C -> 0 | V145: =R[-86]C-R[-43]C -> 0 | W145: =R[-86]C-R[-43]C -> 2 | X145: =R[-86]C-R[-43]C -> 0 | Y145: =R[-86]C-R[-43]C -> 0 | Z145: =R[-86]C-R[-43]C -> 0 | AA145: =R[-86]C-R[-43]C -> 0 | AB145: =R[-86]C-R[-43]C -> 0 | AC145: =R[-86]C-R[-43]C -> -1 | AD145: =R[-86]C-R[-43]C -> -1 | AE145: =R[-86]C-R[-43]C -> -1 | AF145: =R[-86]C-R[-43]C -> 0 | AG145: =R[-86]C-R[-43]C -> 0 | AH145: =R[-86]C-R[-43]C -> 0 | AI145: =R[-86]C-R[-43]C -> 0 | AJ145: =R[-86]C-R[-43]C -> -1 | AK145: =R[-86]C-R[-43]C -> -1 | AL145: =R[-86]C-R[-43]C -> 0 | AM145: =R[-86]C-R[-43]C -> -1 | AN145: =R[-86]C-R[-43]C -> -1 | AO145: =R[-86]C-R[-43]C -> -1 | AP145: =R[-86]C-R[-43]C -> -1 | AQ145: =R[-86]C-R[-43]C -> 0
E146: =R[-86]C-R[-43]C -> 0 | F146: =R[-86]C-R[-43]C -> 0 | G146: =R[-86]C-R[-43]C -> 0 | H146: =R[-86]C-R[-43]C -> 0 | I146: =R[-86]C-R[-43]C -> 0 | J146: =R[-86]C-R[-43]C -> 0 | K146: =R[-86]C-R[-43]C -> 0 | L146: =R[-86]C-R[-43]C -> 0 | M146: =R[-86]C-R[-43]C -> 0 | N146: =R[-86]C-R[-43]C -> 0 | O146: =R[-86]C-R[-43]C -> 0 | P146: =R[-86]C-R[-43]C -> 0 | Q146: =R[-86]C-R[-43]C -> 0 | R146: =R[-86]C-R[-43]C -> 0 | S146: =R[-86]C-R[-43]C -> 2 | T146: =R[-86]C-R[-43]C -> 0 | U146: =R[-86]C-R[-43]C -> 0 | V146: =R[-86]C-R[-43]C -> 0 | W146: =R[-86]C-R[-43]C -> 2 | X146: =R[-86]C-R[-43]C -> 0 | Y146: =R[-86]C-R[-43]C -> 0 | Z146: =R[-86]C-R[-43]C -> 0 | AA146: =R[-86]C-R[-43]C -> 0 | AB146: =R[-86]C-R[-43]C -> 0 | AC146: =R[-86]C-R[-43]C -> 0 | AD146: =R[-86]C-R[-43]C -> 0 | AE146: =R[-86]C-R[-43]C -> 0 | AF146: =R[-86]C-R[-43]C -> 0 | AG146: =R[-86]C-R[-43]C -> 0 | AH146: =R[-86]C-R[-43]C -> 0 | AI146: =R[-86]C-R[-43]C -> 0 | AJ146: =R[-86]C-R[-43]C -> 0 | AK146: =R[-86]C-R[-43]C -> 0 | AL146: =R[-86]C-R[-43]C -> 0 | AM146: =R[-86]C-R[-43]C -> 2 | AN146: =R[-86]C-R[-43]C -> 2 | AO146: =R[-86]C-R[-43]C -> 2 | AP146: =R[-86]C-R[-43]C -> 2 | AQ146: =R[-86]C-R[-43]C -> 2
E147: =R[-86]C-R[-43]C -> 0 | F147: =R[-86]C-R[-43]C -> -1 | G147: =R[-86]C-R[-43]C -> 0 | H147: =R[-86]C-R[-43]C -> 0 | I147: =R[-86]C-R[-43]C -> 2 | J147: =R[-86]C-R[-43]C -> 0 | K147: =R[-86]C-R[-43]C -> 0 | L147: =R[-86]C-R[-43]C -> 0 | M147: =R[-86]C-R[-43]C -> 0 | N147: =R[-86]C-R[-43]C -> 0 | O147: =R[-86]C-R[-43]C -> 0 | P147: =R[-86]C-R[-43]C -> 1 | Q147: =R[-86]C-R[-43]C -> 0 | R147: =R[-86]C-R[-43]C -> 0 | S147: =R[-86]C-R[-43]C -> 2 | T147: =R[-86]C-R[-43]C -> 0 | U147: =R[-86]C-R[-43]C -> 0 | V147: =R[-86]C-R[-43]C -> 0 | W147: =R[-86]C-R[-43]C -> 2 | X147: =R[-86]C-R[-43]C -> 0 | Y147: =R[-86]C-R[-43]C -> 0 | Z147: =R[-86]C-R[-43]C -> 0 | AA147: =R[-86]C-R[-43]C -> 0 | AB147: =R[-86]C-R[-43]C -> 0 | AC147: =R[-86]C-R[-43]C -> -1 | AD147: =R[-86]C-R[-43]C -> -1 | AE147: =R[-86]C-R[-43]C -> -1 | AF147: =R[-86]C-R[-43]C -> 0 | AG147: =R[-86]C-R[-43]C -> 0 | AH147: =R[-86]C-R[-43]C -> 0 | AI147: =R[-86]C-R[-43]C -> 0 | AJ147: =R[-86]C-R[-43]C -> 0 | AK147: =R[-86]C-R[-43]C -> 0 | AL147: =R[-86]C-R[-43]C -> 0 | AM147: =R[-86]C-R[-43]C -> 2 | AN147: =R[-86]C-R[-43]C -> 2 | AO147: =R[-86]C-R[-43]C -> 2 | AP147: =R[-86]C-R[-43]C -> 2 | AQ147: =R[-86]C-R[-43]C -> 2
E148: =R[-86]C-R[-43]C -> 1 | F148: =R[-86]C-R[-43]C -> 1 | G148: =R[-86]C-R[-43]C -> 1 | H148: =R[-86]C-R[-43]C -> 1 | I148: =R[-86]C-R[-43]C -> 0 | J148: =R[-86]C-R[-43]C -> 0 | K148: =R[-86]C-R[-43]C -> 1 | L148: =R[-86]C-R[-43]C -> 1 | M148: =R[-86]C-R[-43]C -> 1 | N148: =R[-86]C-R[-43]C -> 1 | O148: =R[-86]C-R[-43]C -> 0 | P148: =R[-86]C-R[-43]C -> 1 | Q148: =R[-86]C-R[-43]C -> 0 | R148: =R[-86]C-R[-43]C -> 0 | S148: =R[-86]C-R[-43]C -> 2 | T148: =R[-86]C-R[-43]C -> 0 | U148: =R[-86]C-R[-43]C -> 0 | V148: =R[-86]C-R[-43]C -> 0 | W148: =R[-86]C-R[-43]C -> 2 | X148: =R[-86]C-R[-43]C -> 1 | Y148: =R[-86]C-R[-43]C -> 1 | Z148: =R[-86]C-R[-43]C -> 1 | AA148: =R[-86]C-R[-43]C -> 1 | AB148: =R[-86]C-R[-43]C -> 1 | AC148: =R[-86]C-R[-43]C -> 1 | AD148: =R[-86]C-R[-43]C -> 1 | AE148: =R[-86]C-R[-43]C -> 1 | AF148: =R[-86]C-R[-43]C -> 1 | AG148: =R[-86]C-R[-43]C -> 1 | AH148: =R[-86]C-R[-43]C -> 1 | AI148: =R[-86]C-R[-43]C -> 1 | AJ148: =R[-86]C-R[-43]C -> 1 | AK148: =R[-86]C-R[-43]C -> 1 | AL148: =R[-86]C-R[-43]C -> 1 | AM148: =R[-86]C-R[-43]C -> 2 | AN148: =R[-86]C-R[-43]C -> 2 | AO148: =R[-86]C-R[-43]C -> 2 | AP148: =R[-86]C-R[-43]C -> 2 | AQ148: =R[-86]C-R[-43]C -> 2
E149: =R[-86]C-R[-43]C -> 3 | F149: =R[-86]C-R[-43]C -> 4 | G149: =R[-86]C-R[-43]C -> 4 | H149: =R[-86]C-R[-43]C -> 2 | I149: =R[-86]C-R[-43]C -> 4 | J149: =R[-86]C-R[-43]C -> 4 | K149: =R[-86]C-R[-43]C -> 4 | L149: =R[-86]C-R[-43]C -> 4 | M149: =R[-86]C-R[-43]C -> 4 | N149: =R[-86]C-R[-43]C -> 4 | O149: =R[-86]C-R[-43]C -> 4 | P149: =R[-86]C-R[-43]C -> 4 | Q149: =R[-86]C-R[-43]C -> 4 | R149: =R[-86]C-R[-43]C -> 2 | S149: =R[-86]C-R[-43]C -> 2 | T149: =R[-86]C-R[-43]C -> 4 | U149: =R[-86]C-R[-43]C -> 4 | V149: =R[-86]C-R[-43]C -> 2 | W149: =R[-86]C-R[-43]C -> 4 | X149: =R[-86]C-R[-43]C -> 4 | Y149: =R[-86]C-R[-43]C -> 4 | Z149: =R[-86]C-R[-43]C -> 4 | AA149: =R[-86]C-R[-43]C -> 3 | AB149: =R[-86]C-R[-43]C -> 0 | AC149: =R[-86]C-R[-43]C -> 0 | AD149: =R[-86]C-R[-43]C -> 0 | AE149: =R[-86]C-R[-43]C -> 0 | AF149: =R[-86]C-R[-43]C -> 4 | AG149: =R[-86]C-R[-43]C -> 4 | AH149: =R[-86]C-R[-43]C -> 2 | AI149: =R[-86]C-R[-43]C -> 2 | AJ149: =R[-86]C-R[-43]C -> 2 | AK149: =R[-86]C-R[-43]C -> 2 | AL149: =R[-86]C-R[-43]C -> 2 | AM149: =R[-86]C-R[-43]C -> 2 | AN149: =R[-86]C-R[-43]C -> 2 | AO149: =R[-86]C-R[-43]C -> 2 | AP149: =R[-86]C-R[-43]C -> 2 | AQ149: =R[-86]C-R[-43]C -> 2
E150: =R[-86]C-R[-43]C -> 2 | F150: =R[-86]C-R[-43]C -> 2 | G150: =R[-86]C-R[-43]C -> 2 | H150: =R[-86]C-R[-43]C -> 2 | I150: =R[-86]C-R[-43]C -> 2 | J150: =R[-86]C-R[-43]C -> 2 | K150: =R[-86]C-R[-43]C -> 2 | L150: =R[-86]C-R[-43]C -> 2 | M150: =R[-86]C-R[-43]C -> 2 | N150: =R[-86]C-R[-43]C -> 2 | O150: =R[-86]C-R[-43]C -> 2 | P150: =R[-86]C-R[-43]C -> 2 | Q150: =R[-86]C-R[-43]C -> 2 | R150: =R[-86]C-R[-43]C -> 2 | S150: =R[-86]C-R[-43]C -> 2 | T150: =R[-86]C-R[-43]C -> 2 | U150: =R[-86]C-R[-43]C -> 2 | V150: =R[-86]C-R[-43]C -> 2 | W150: =R[-86]C-R[-43]C -> 4 | X150: =R[-86]C-R[-43]C -> 2 | Y150: =R[-86]C-R[-43]C -> 2 | Z150: =R[-86]C-R[-43]C -> 2 | AA150: =R[-86]C-R[-43]C -> 2 | AB150: =R[-86]C-R[-43]C -> 2 | AC150: =R[-86]C-R[-43]C -> 2 | AD150: =R[-86]C-R[-43]C -> 2 | AE150: =R[-86]C-R[-43]C -> 2 | AF150: =R[-86]C-R[-43]C -> 2 | AG150: =R[-86]C-R[-43]C -> 2 | AH150: =R[-86]C-R[-43]C -> 2 | AI150: =R[-86]C-R[-43]C -> 2 | AJ150: =R[-86]C-R[-43]C -> 2 | AK150: =R[-86]C-R[-43]C -> 2 | AL150: =R[-86]C-R[-43]C -> 2 | AM150: =R[-86]C-R[-43]C -> 2 | AN150: =R[-86]C-R[-43]C -> 2 | AO150: =R[-86]C-R[-43]C -> 2 | AP150: =R[-86]C-R[-43]C -> 2 | AQ150: =R[-86]C-R[-43]C -> 2
E151: =R[-86]C-R[-43]C -> 0 | F151: =R[-86]C-R[-43]C -> 0 | G151: =R[-86]C-R[-43]C -> 0 | H151: =R[-86]C-R[-43]C -> 0 | I151: =R[-86]C-R[-43]C -> 0 | J151: =R[-86]C-R[-43]C -> 0 | K151: =R[-86]C-R[-43]C -> 0 | L151: =R[-86]C-R[-43]C -> 0 | M151: =R[-86]C-R[-43]C -> 0 | N151: =R[-86]C-R[-43]C -> 0 | O151: =R[-86]C-R[-43]C -> 0 | P151: =R[-86]C-R[-43]C -> 0 | Q151: =R[-86]C-R[-43]C -> 0 | R151: =R[-86]C-R[-43]C -> 0 | S151: =R[-86]C-R[-43]C -> 2 | T151: =R[-86]C-R[-43]C -> 0 | U151: =R[-86]C-R[-43]C -> 0 | V151: =R[-86]C-R[-43]C -> 0 | W151: =R[-86]C-R[-43]C -> 2 | X151: =R[-86]C-R[-43]C -> 0 | Y151: =R[-86]C-R[-43]C -> 0 | Z151: =R[-86]C-R[-43]C -> 0 | AA151: =R[-86]C-R[-43]C -> 2 | AB151: =R[-86]C-R[-43]C -> 2 | AC151: =R[-86]C-R[-43]C -> 2 | AD151: =R[-86]C-R[-43]C -> 2 | AE151: =R[-86]C-R[-43]C -> 2 | AF151: =R[-86]C-R[-43]C -> 2 | AG151: =R[-86]C-R[-43]C -> 2 | AH151: =R[-86]C-R[-43]C -> 2 | AI151: =R[-86]C-R[-43]C -> 2 | AJ151: =R[-86]C-R[-43]C -> 2 | AK151: =R[-86]C-R[-43]C -> 2 | AL151: =R[-86]C-R[-43]C -> 2 | AM151: =R[-86]C-R[-43]C -> 2 | AN151: =R[-86]C-R[-43]C -> 2 | AO151: =R[-86]C-R[-43]C -> 2 | AP151: =R[-86]C-R[-43]C -> 2 | AQ151: =R[-86]C-R[-43]C -> 2
E152: =R[-86]C-R[-43]C -> 2 | F152: =R[-86]C-R[-43]C -> 2 | G152: =R[-86]C-R[-43]C -> 2 | H152: =R[-86]C-R[-43]C -> 2 | I152: =R[-86]C-R[-43]C -> 2 | J152: =R[-86]C-R[-43]C -> 2 | K152: =R[-86]C-R[-43]C -> 2 | L152: =R[-86]C-R[-43]C -> 2 | M152: =R[-86]C-R[-43]C -> 2 | N152: =R[-86]C-R[-43]C -> 2 | O152: =R[-86]C-R[-43]C -> 2 | P152: =R[-86]C-R[-43]C -> 2 | Q152: =R[-86]C-R[-43]C -> 2 | R152: =R[-86]C-R[-43]C -> 2 | S152: =R[-86]C-R[-43]C -> 2 | T152: =R[-86]C-R[-43]C -> 2 | U152: =R[-86]C-R[-43]C -> 2 | V152: =R[-86]C-R[-43]C -> 2 | W152: =R[-86]C-R[-43]C -> 4 | X152: =R[-86]C-R[-43]C -> 2 | Y152: =R[-86]C-R[-43]C -> 2 | Z152: =R[-86]C-R[-43]C -> 2 | AA152: =R[-86]C-R[-43]C -> 2 | AB152: =R[-86]C-R[-43]C -> 2 | AC152: =R[-86]C-R[-43]C -> 2 | AD152: =R[-86]C-R[-43]C -> 2 | AE152: =R[-86]C-R[-43]C -> 2 | AF152: =R[-86]C-R[-43]C -> 2 | AG152: =R[-86]C-R[-43]C -> 2 | AH152: =R[-86]C-R[-43]C -> 2 | AI152: =R[-86]C-R[-43]C -> 2 | AJ152: =R[-86]C-R[-43]C -> 2 | AK152: =R[-86]C-R[-43]C -> 2 | AL152: =R[-86]C-R[-43]C -> 2 | AM152: =R[-86]C-R[-43]C -> 2 | AN152: =R[-86]C-R[-43]C -> 2 | AO152: =R[-86]C-R[-43]C -> 2 | AP152: =R[-86]C-R[-43]C -> 2 | AQ152: =R[-86]C-R[-43]C -> 2
E153: =R[-86]C-R[-43]C -> 2 | F153: =R[-86]C-R[-43]C -> 2 | G153: =R[-86]C-R[-43]C -> 2 | H153: =R[-86]C-R[-43]C -> 2 | I153: =R[-86]C-R[-43]C -> 2 | J153: =R[-86]C-R[-43]C -> 1 | K153: =R[-86]C-R[-43]C -> 1 | L153: =R[-86]C-R[-43]C -> 2 | M153: =R[-86]C-R[-43]C -> 2 | N153: =R[-86]C-R[-43]C -> 2 | O153: =R[-86]C-R[-43]C -> 2 | P153: =R[-86]C-R[-43]C -> 2 | Q153: =R[-86]C-R[-43]C -> 2 | R153: =R[-86]C-R[-43]C -> 2 | S153: =R[-86]C-R[-43]C -> 4 | T153: =R[-86]C-R[-43]C -> 1 | U153: =R[-86]C-R[-43]C -> 0 | V153: =R[-86]C-R[-43]C -> 0 | W153: =R[-86]C-R[-43]C -> 2 | X153: =R[-86]C-R[-43]C -> 1 | Y153: =R[-86]C-R[-43]C -> 1 | Z153: =R[-86]C-R[-43]C -> 1 | AA153: =R[-86]C-R[-43]C -> 3 | AB153: =R[-86]C-R[-43]C -> 1 | AC153: =R[-86]C-R[-43]C -> 3 | AD153: =R[-86]C-R[-43]C -> 3 | AE153: =R[-86]C-R[-43]C -> 3 | AF153: =R[-86]C-R[-43]C -> 3 | AG153: =R[-86]C-R[-43]C -> 3 | AH153: =R[-86]C-R[-43]C -> 3 | AI153: =R[-86]C-R[-43]C -> 1 | AJ153: =R[-86]C-R[-43]C -> 1 | AK153: =R[-86]C-R[-43]C -> 1 | AL153: =R[-86]C-R[-43]C -> 1 | AM153: =R[-86]C-R[-43]C -> 2 | AN153: =R[-86]C-R[-43]C -> 2 | AO153: =R[-86]C-R[-43]C -> 2 | AP153: =R[-86]C-R[-43]C -> 2 | AQ153: =R[-86]C-R[-43]C -> 2
E154: =R[-86]C-R[-43]C -> 1 | F154: =R[-86]C-R[-43]C -> 1 | G154: =R[-86]C-R[-43]C -> 1 | H154: =R[-86]C-R[-43]C -> 1 | I154: =R[-86]C-R[-43]C -> 1 | J154: =R[-86]C-R[-43]C -> 0 | K154: =R[-86]C-R[-43]C -> 1 | L154: =R[-86]C-R[-43]C -> 0 | M154: =R[-86]C-R[-43]C -> 0 | N154: =R[-86]C-R[-43]C -> 0 | O154: =R[-86]C-R[-43]C -> 0 | P154: =R[-86]C-R[-43]C -> 0 | Q154: =R[-86]C-R[-43]C -> 0 | R154: =R[-86]C-R[-43]C -> 0 | S154: =R[-86]C-R[-43]C -> 2 | T154: =R[-86]C-R[-43]C -> 0 | U154: =R[-86]C-R[-43]C -> 1 | V154: =R[-86]C-R[-43]C -> 0 | W154: =R[-86]C-R[-43]C -> 2 | X154: =R[-86]C-R[-43]C -> 1 | Y154: =R[-86]C-R[-43]C -> 1 | Z154: =R[-86]C-R[-43]C -> 1 | AA154: =R[-86]C-R[-43]C -> 2 | AB154: =R[-86]C-R[-43]C -> 2 | AC154: =R[-86]C-R[-43]C -> 2 | AD154: =R[-86]C-R[-43]C -> 2 | AE154: =R[-86]C-R[-43]C -> 2 | AF154: =R[-86]C-R[-43]C -> 2 | AG154: =R[-86]C-R[-43]C -> 2 | AH154: =R[-86]C-R[-43]C -> 2 | AI154: =R[-86]C-R[-43]C -> 2 | AJ154: =R[-86]C-R[-43]C -> 2 | AK154: =R[-86]C-R[-43]C -> 2 | AL154: =R[-86]C-R[-43]C -> 2 | AM154: =R[-86]C-R[-43]C -> 2 | AN154: =R[-86]C-R[-43]C -> 2 | AO154: =R[-86]C-R[-43]C -> 2 | AP154: =R[-86]C-R[-43]C -> 2 | AQ154: =R[-86]C-R[-43]C -> 2
E155: =R[-86]C-R[-43]C -> 0 | F155: =R[-86]C-R[-43]C -> 0 | G155: =R[-86]C-R[-43]C -> 0 | H155: =R[-86]C-R[-43]C -> 0 | I155: =R[-86]C-R[-43]C -> 0 | J155: =R[-86]C-R[-43]C -> 0 | K155: =R[-86]C-R[-43]C -> 0 | L155: =R[-86]C-R[-43]C -> 0 | M155: =R[-86]C-R[-43]C -> 0 | N155: =R[-86]C-R[-43]C -> 0 | O155: =R[-86]C-R[-43]C -> 2 | P155: =R[-86]C-R[-43]C -> 2 | Q155: =R[-86]C-R[-43]C -> 0 | R155: =R[-86]C-R[-43]C -> 2 | S155: =R[-86]C-R[-43]C -> 3 | T155: =R[-86]C-R[-43]C -> 0 | U155: =R[-86]C-R[-43]C -> 0 | V155: =R[-86]C-R[-43]C -> 2 | W155: =R[-86]C-R[-43]C -> 2 | X155: =R[-86]C-R[-43]C -> 0 | Y155: =R[-86]C-R[-43]C -> 0 | Z155: =R[-86]C-R[-43]C -> 0 | AA155: =R[-86]C-R[-43]C -> 0 | AB155: =R[-86]C-R[-43]C -> 0 | AC155: =R[-86]C-R[-43]C -> 0 | AD155: =R[-86]C-R[-43]C -> 0 | AE155: =R[-86]C-R[-43]C -> 0 | AF155: =R[-86]C-R[-43]C -> 0 | AG155: =R[-86]C-R[-43]C -> 0 | AH155: =R[-86]C-R[-43]C -> 0 | AI155: =R[-86]C-R[-43]C -> 0 | AJ155: =R[-86]C-R[-43]C -> 0 | AK155: =R[-86]C-R[-43]C -> 0 | AL155: =R[-86]C-R[-43]C -> 0 | AM155: =R[-86]C-R[-43]C -> 2 | AN155: =R[-86]C-R[-43]C -> 2 | AO155: =R[-86]C-R[-43]C -> 2 | AP155: =R[-86]C-R[-43]C -> 2 | AQ155: =R[-86]C-R[-43]C -> 2
E156: =R[-86]C-R[-43]C -> 1 | F156: =R[-86]C-R[-43]C -> 1 | G156: =R[-86]C-R[-43]C -> 1 | H156: =R[-86]C-R[-43]C -> 0 | I156: =R[-86]C-R[-43]C -> 0 | J156: =R[-86]C-R[-43]C -> 1 | K156: =R[-86]C-R[-43]C -> 1 | L156: =R[-86]C-R[-43]C -> 1 | M156: =R[-86]C-R[-43]C -> 0 | N156: =R[-86]C-R[-43]C -> 1 | O156: =R[-86]C-R[-43]C -> 1 | P156: =R[-86]C-R[-43]C -> 0 | Q156: =R[-86]C-R[-43]C -> 0 | R156: =R[-86]C-R[-43]C -> 1 | S156: =R[-86]C-R[-43]C -> 3 | T156: =R[-86]C-R[-43]C -> 1 | U156: =R[-86]C-R[-43]C -> 1 | V156: =R[-86]C-R[-43]C -> 0 | W156: =R[-86]C-R[-43]C -> 2 | X156: =R[-86]C-R[-43]C -> 1 | Y156: =R[-86]C-R[-43]C -> 1 | Z156: =R[-86]C-R[-43]C -> 1 | AA156: =R[-86]C-R[-43]C -> 1 | AB156: =R[-86]C-R[-43]C -> 1 | AC156: =R[-86]C-R[-43]C -> 1 | AD156: =R[-86]C-R[-43]C -> 1 | AE156: =R[-86]C-R[-43]C -> 1 | AF156: =R[-86]C-R[-43]C -> 1 | AG156: =R[-86]C-R[-43]C -> 1 | AH156: =R[-86]C-R[-43]C -> 1 | AI156: =R[-86]C-R[-43]C -> 1 | AJ156: =R[-86]C-R[-43]C -> 1 | AK156: =R[-86]C-R[-43]C -> 1 | AL156: =R[-86]C-R[-43]C -> 1 | AM156: =R[-86]C-R[-43]C -> 1 | AN156: =R[-86]C-R[-43]C -> 1 | AO156: =R[-86]C-R[-43]C -> 1 | AP156: =R[-86]C-R[-43]C -> 1 | AQ156: =R[-86]C-R[-43]C -> 1
E157: =R[-86]C-R[-43]C -> -1 | F157: =R[-86]C-R[-43]C -> -1 | G157: =R[-86]C-R[-43]C -> -1 | H157: =R[-86]C-R[-43]C -> -1 | I157: =R[-86]C-R[-43]C -> 0 | J157: =R[-86]C-R[-43]C -> -1 | K157: =R[-86]C-R[-43]C -> -1 | L157: =R[-86]C-R[-43]C -> -1 | M157: =R[-86]C-R[-43]C -> -1 | N157: =R[-86]C-R[-43]C -> -1 | O157: =R[-86]C-R[-43]C -> -1 | P157: =R[-86]C-R[-43]C -> 0 | Q157: =R[-86]C-R[-43]C -> 0 | R157: =R[-86]C-R[-43]C -> 0 | S157: =R[-86]C-R[-43]C -> 2 | T157: =R[-86]C-R[-43]C -> -1 | U157: =R[-86]C-R[-43]C -> -1 | V157: =R[-86]C-R[-43]C -> -1 | W157: =R[-86]C-R[-43]C -> 2 | X157: =R[-86]C-R[-43]C -> -1 | Y157: =R[-86]C-R[-43]C -> -1 | Z157: =R[-86]C-R[-43]C -> -1 | AA157: =R[-86]C-R[-43]C -> -1 | AB157: =R[-86]C-R[-43]C -> -1 | AC157: =R[-86]C-R[-43]C -> -1 | AD157: =R[-86]C-R[-43]C -> -1 | AE157: =R[-86]C-R[-43]C -> -1 | AF157: =R[-86]C-R[-43]C -> -1 | AG157: =R[-86]C-R[-43]C -> -1 | AH157: =R[-86]C-R[-43]C -> -1 | AI157: =R[-86]C-R[-43]C -> 1 | AJ157: =R[-86]C-R[-43]C -> 1 | AK157: =R[-86]C-R[-43]C -> 1 | AL157: =R[-86]C-R[-43]C -> -1 | AM157: =R[-86]C-R[-43]C -> 2 | AN157: =R[-86]C-R[-43]C -> 2 | AO157: =R[-86]C-R[-43]C -> 2 | AP157: =R[-86]C-R[-43]C -> 2 | AQ157: =R[-86]C-R[-43]C -> 2
E158: =R[-86]C-R[-43]C -> 2 | F158: =R[-86]C-R[-43]C -> 2 | G158: =R[-86]C-R[-43]C -> 2 | H158: =R[-86]C-R[-43]C -> 2 | I158: =R[-86]C-R[-43]C -> 0 | J158: =R[-86]C-R[-43]C -> 2 | K158: =R[-86]C-R[-43]C -> 2 | L158: =R[-86]C-R[-43]C -> 2 | M158: =R[-86]C-R[-43]C -> 2 | N158: =R[-86]C-R[-43]C -> 2 | O158: =R[-86]C-R[-43]C -> 2 | P158: =R[-86]C-R[-43]C -> 0 | Q158: =R[-86]C-R[-43]C -> 0 | R158: =R[-86]C-R[-43]C -> 2 | S158: =R[-86]C-R[-43]C -> 2 | T158: =R[-86]C-R[-43]C -> 2 | U158: =R[-86]C-R[-43]C -> 2 | V158: =R[-86]C-R[-43]C -> 0 | W158: =R[-86]C-R[-43]C -> 2 | X158: =R[-86]C-R[-43]C -> 2 | Y158: =R[-86]C-R[-43]C -> 2 | Z158: =R[-86]C-R[-43]C -> 2 | AA158: =R[-86]C-R[-43]C -> 2 | AB158: =R[-86]C-R[-43]C -> 2 | AC158: =R[-86]C-R[-43]C -> 2 | AD158: =R[-86]C-R[-43]C -> 2 | AE158: =R[-86]C-R[-43]C -> 2 | AF158: =R[-86]C-R[-43]C -> 2 | AG158: =R[-86]C-R[-43]C -> 2 | AH158: =R[-86]C-R[-43]C -> 2 | AI158: =R[-86]C-R[-43]C -> 1 | AJ158: =R[-86]C-R[-43]C -> 1 | AK158: =R[-86]C-R[-43]C -> 1 | AL158: =R[-86]C-R[-43]C -> 2 | AM158: =R[-86]C-R[-43]C -> 2 | AN158: =R[-86]C-R[-43]C -> 2 | AO158: =R[-86]C-R[-43]C -> 2 | AP158: =R[-86]C-R[-43]C -> 2 | AQ158: =R[-86]C-R[-43]C -> 2

Sheet: Ranking
A1: Rank | B1: Country | C1: =Selection!RC[1] -> Recurrent Expenditure (Euros) - Staff / Library Staff FTE - Total Staff | D1: Data
A2: 1 | B2: =IF(ISERR(Selection!RC[2]),"",IF(ISNA(Selection!RC[2]),"",Selection!RC[4])) -> Denmark | C2: =IF(ISERR(Selection!RC[1]),"",IF(ISNA(Selection!RC[1]),"",Selection!RC[1])) -> 42413.65517241379 | D2: =IF(RC[-1]="","",IF(Menus!R10C11="2001 Grossed",VLOOKUP(MAX(Selection!RC[9]:RC[10]),R2C14:R4C15,2),"")) -> Returned Data for year 2001 | E2: To Change the number of | N2: 0 | O2: Returned Data for year 2001
A3: =1+R[-1]C -> 2 | B3: =IF(ISERR(Selection!RC[2]),"",IF(ISNA(Selection!RC[2]),"",Selection!RC[4])) -> Norway | C3: =IF(ISERR(Selection!RC[1]),"",IF(ISNA(Selection!RC[1]),"",Selection!RC[1])) -> 40033.091286307055 | D3: =IF(RC[-1]="","",IF(Menus!R10C11="2001 Grossed",VLOOKUP(MAX(Selection!RC[9]:RC[10]),R2C14:R4C15,2),"")) -> Returned Data for year 2001 | E3: Decimal Places shown, | N3: 1 | O3: Apportioned or estimated from previous years returns
A4: =1+R[-1]C -> 3 | B4: =IF(ISERR(Selection!RC[2]),"",IF(ISNA(Selection!RC[2]),"",Selection!RC[4])) -> France | C4: =IF(ISERR(Selection!RC[1]),"",IF(ISNA(Selection!RC[1]),"",Selection!RC[1])) -> 38333.626947754354 | D4: =IF(RC[-1]="","",IF(Menus!R10C11="2001 Grossed",VLOOKUP(MAX(Selection!RC[9]:RC[10]),R2C14:R4C15,2),"")) -> Apportioned or estimated from previous years returns | E4: select column C and | N4: 2 | O4: Grossed on regional averages
A5: =1+R[-1]C -> 4 | B5: =IF(ISERR(Selection!RC[2]),"",IF(ISNA(Selection!RC[2]),"",Selection!RC[4])) -> Sweden | C5: =IF(ISERR(Selection!RC[1]),"",IF(ISNA(Selection!RC[1]),"",Selection!RC[1])) -> 38265.252163877667 | D5: =IF(RC[-1]="","",IF(Menus!R10C11="2001 Grossed",VLOOKUP(MAX(Selection!RC[9]:RC[10]),R2C14:R4C15,2),"")) -> Returned Data for year 2001 | E5: change cell format
A6: =1+R[-1]C -> 5 | B6: =IF(ISERR(Selection!RC[2]),"",IF(ISNA(Selection!RC[2]),"",Selection!RC[4])) -> Liechtenstein | C6: =IF(ISERR(Selection!RC[1]),"",IF(ISNA(Selection!RC[1]),"",Selection!RC[1])) -> 37124.6 | D6: =IF(RC[-1]="","",IF(Menus!R10C11="2001 Grossed",VLOOKUP(MAX(Selection!RC[9]:RC[10]),R2C14:R4C15,2),"")) -> Grossed on regional averages
A7: =1+R[-1]C -> 6 | B7: =IF(ISERR(Selection!RC[2]),"",IF(ISNA(Selection!RC[2]),"",Selection!RC[4])) -> UK | C7: =IF(ISERR(Selection!RC[1]),"",IF(ISNA(Selection!RC[1]),"",Selection!RC[1])) -> 35583.506415478616 | D7: =IF(RC[-1]="","",IF(Menus!R10C11="2001 Grossed",VLOOKUP(MAX(Selection!RC[9]:RC[10]),R2C14:R4C15,2),"")) -> Returned Data for year 2001
A8: =1+R[-1]C -> 7 | B8: =IF(ISERR(Selection!RC[2]),"",IF(ISNA(Selection!RC[2]),"",Selection!RC[4])) -> Luxembourg | C8: =IF(ISERR(Selection!RC[1]),"",IF(ISNA(Selection!RC[1]),"",Selection!RC[1])) -> 33761.777777777781 | D8: =IF(RC[-1]="","",IF(Menus!R10C11="2001 Grossed",VLOOKUP(MAX(Selection!RC[9]:RC[10]),R2C14:R4C15,2),"")) -> Apportioned or estimated from previous years returns
A9: =1+R[-1]C -> 8 | B9: =IF(ISERR(Selection!RC[2]),"",IF(ISNA(Selection!RC[2]),"",Selection!RC[4])) -> Netherlands | C9: =IF(ISERR(Selection!RC[1]),"",IF(ISNA(Selection!RC[1]),"",Selection!RC[1])) -> 31750.330481283421 | D9: =IF(RC[-1]="","",IF(Menus!R10C11="2001 Grossed",VLOOKUP(MAX(Selection!RC[9]:RC[10]),R2C14:R4C15,2),"")) -> Grossed on regional averages
A10: =1+R[-1]C -> 9 | B10: =IF(ISERR(Selection!RC[2]),"",IF(ISNA(Selection!RC[2]),"",Selection!RC[4])) -> Austria | C10: =IF(ISERR(Selection!RC[1]),"",IF(ISNA(Selection!RC[1]),"",Selection!RC[1])) -> 31509.319872476088 | D10: =IF(RC[-1]="","",IF(Menus!R10C11="2001 Grossed",VLOOKUP(MAX(Selection!RC[9]:RC[10]),R2C14:R4C15,2),"")) -> Grossed on regional averages
A11: =1+R[-1]C -> 10 | B11: =IF(ISERR(Selection!RC[2]),"",IF(ISNA(Selection!RC[2]),"",Selection!RC[4])) -> Italy | C11: =IF(ISERR(Selection!RC[1]),"",IF(ISNA(Selection!RC[1]),"",Selection!RC[1])) -> 31173.883037354561 | D11: =IF(RC[-1]="","",IF(Menus!R10C11="2001 Grossed",VLOOKUP(MAX(Selection!RC[9]:RC[10]),R2C14:R4C15,2),"")) -> Grossed on regional averages
A12: =1+R[-1]C -> 11 | B12: =IF(ISERR(Selection!RC[2]),"",IF(ISNA(Selection!RC[2]),"",Selection!RC[4])) -> Iceland | C12: =IF(ISERR(Selection!RC[1]),"",IF(ISNA(Selection!RC[1]),"",Selection!RC[1])) -> 27499.611111111109 | D12: =IF(RC[-1]="","",IF(Menus!R10C11="2001 Grossed",VLOOKUP(MAX(Selection!RC[9]:RC[10]),R2C14:R4C15,2),"")) -> Grossed on regional averages
A13: =1+R[-1]C -> 12 | B13: =IF(ISERR(Selection!RC[2]),"",IF(ISNA(Selection!RC[2]),"",Selection!RC[4])) -> Finland | C13: =IF(ISERR(Selection!RC[1]),"",IF(ISNA(Selection!RC[1]),"",Selection!RC[1])) -> 27353.222375690606 | D13: =IF(RC[-1]="","",IF(Menus!R10C11="2001 Grossed",VLOOKUP(MAX(Selection!RC[9]:RC[10]),R2C14:R4C15,2),"")) -> Returned Data for year 2001
A14: =1+R[-1]C -> 13 | B14: =IF(ISERR(Selection!RC[2]),"",IF(ISNA(Selection!RC[2]),"",Selection!RC[4])) -> België Nederlandstalige Universiteiten | C14: =IF(ISERR(Selection!RC[1]),"",IF(ISNA(Selection!RC[1]),"",Selection!RC[1])) -> 27280.814332247555 | D14: =IF(RC[-1]="","",IF(Menus!R10C11="2001 Grossed",VLOOKUP(MAX(Selection!RC[9]:RC[10]),R2C14:R4C15,2),"")) -> Returned Data for year 2001
A15: =1+R[-1]C -> 14 | B15: =IF(ISERR(Selection!RC[2]),"",IF(ISNA(Selection!RC[2]),"",Selection!RC[4])) -> Germany | C15: =IF(ISERR(Selection!RC[1]),"",IF(ISNA(Selection!RC[1]),"",Selection!RC[1])) -> 27132.814184237232 | D15: =IF(RC[-1]="","",IF(Menus!R10C11="2001 Grossed",VLOOKUP(MAX(Selection!RC[9]:RC[10]),R2C14:R4C15,2),"")) -> Returned Data for year 2001
A16: =1+R[-1]C -> 15 | B16: =IF(ISERR(Selection!RC[2]),"",IF(ISNA(Selection!RC[2]),"",Selection!RC[4])) -> Belgium | C16: =IF(ISERR(Selection!RC[1]),"",IF(ISNA(Selection!RC[1]),"",Selection!RC[1])) -> 25348.756978653531 | D16: =IF(RC[-1]="","",IF(Menus!R10C11="2001 Grossed",VLOOKUP(MAX(Selection!RC[9]:RC[10]),R2C14:R4C15,2),"")) -> Returned Data for year 2001
A17: =1+R[-1]C -> 16 | B17: =IF(ISERR(Selection!RC[2]),"",IF(ISNA(Selection!RC[2]),"",Selection!RC[4])) -> Belgique universités francophones | C17: =IF(ISERR(Selection!RC[1]),"",IF(ISNA(Selection!RC[1]),"",Selection!RC[1])) -> 23462.401993355481 | D17: =IF(RC[-1]="","",IF(Menus!R10C11="2001 Grossed",VLOOKUP(MAX(Selection!RC[9]:RC[10]),R2C14:R4C15,2),"")) -> Returned Data for year 2001
A18: =1+R[-1]C -> 17 | B18: =IF(ISERR(Selection!RC[2]),"",IF(ISNA(Selection!RC[2]),"",Selection!RC[4])) -> Switzerland | C18: =IF(ISERR(Selection!RC[1]),"",IF(ISNA(Selection!RC[1]),"",Selection!RC[1])) -> 21043.254023792862 | D18: =IF(RC[-1]="","",IF(Menus!R10C11="2001 Grossed",VLOOKUP(MAX(Selection!RC[9]:RC[10]),R2C14:R4C15,2),"")) -> Grossed on regional averages
A19: =1+R[-1]C -> 18 | B19: =IF(ISERR(Selection!RC[2]),"",IF(ISNA(Selection!RC[2]),"",Selection!RC[4])) -> Eire | C19: =IF(ISERR(Selection!RC[1]),"",IF(ISNA(Selection!RC[1]),"",Selection!RC[1])) -> 20084.240000000002 | D19: =IF(RC[-1]="","",IF(Menus!R10C11="2001 Grossed",VLOOKUP(MAX(Selection!RC[9]:RC[10]),R2C14:R4C15,2),"")) -> Grossed on regional averages
A20: =1+R[-1]C -> 19 | B20: =IF(ISERR(Selection!RC[2]),"",IF(ISNA(Selection!RC[2]),"",Selection!RC[4])) -> Spain | C20: =IF(ISERR(Selection!RC[1]),"",IF(ISNA(Selection!RC[1]),"",Selection!RC[1])) -> 16526.102960969045 | D20: =IF(RC[-1]="","",IF(Menus!R10C11="2001 Grossed",VLOOKUP(MAX(Selection!RC[9]:RC[10]),R2C14:R4C15,2),"")) -> Apportioned or estimated from previous years returns
A21: =1+R[-1]C -> 20 | B21: =IF(ISERR(Selection!RC[2]),"",IF(ISNA(Selection!RC[2]),"",Selection!RC[4])) -> Portugal | C21: =IF(ISERR(Selection!RC[1]),"",IF(ISNA(Selection!RC[1]),"",Selection!RC[1])) -> 5801.2510288065841 | D21: =IF(RC[-1]="","",IF(Menus!R10C11="2001 Grossed",VLOOKUP(MAX(Selection!RC[9]:RC[10]),R2C14:R4C15,2),"")) -> Apportioned or estimated from previous years returns
A22: =1+R[-1]C -> 21 | B22: =IF(ISERR(Selection!RC[2]),"",IF(ISNA(Selection!RC[2]),"",Selection!RC[4])) -> Greece | C22: =IF(ISERR(Selection!RC[1]),"",IF(ISNA(Selection!RC[1]),"",Selection!RC[1])) -> 3611.1086375779164 | D22: =IF(RC[-1]="","",IF(Menus!R10C11="2001 Grossed",VLOOKUP(MAX(Selection!RC[9]:RC[10]),R2C14:R4C15,2),"")) -> Apportioned or estimated from previous years returns
A23: =1+R[-1]C -> 22 | B23: =IF(ISERR(Selection!RC[2]),"",IF(ISNA(Selection!RC[2]),"",Selection!RC[4])) ->  | C23: =IF(ISERR(Selection!RC[1]),"",IF(ISNA(Selection!RC[1]),"",Selection!RC[1])) ->  | D23: =IF(RC[-1]="","",IF(Menus!R10C11="2001 Grossed",VLOOKUP(MAX(Selection!RC[9]:RC[10]),R2C14:R4C15,2),"")) -> 
A24: =1+R[-1]C -> 23 | B24: =IF(ISERR(Selection!RC[2]),"",IF(ISNA(Selection!RC[2]),"",Selection!RC[4])) ->  | C24: =IF(ISERR(Selection!RC[1]),"",IF(ISNA(Selection!RC[1]),"",Selection!RC[1])) ->  | D24: =IF(RC[-1]="","",IF(Menus!R10C11="2001 Grossed",VLOOKUP(MAX(Selection!RC[9]:RC[10]),R2C14:R4C15,2),"")) -> 
A25: =1+R[-1]C -> 24 | B25: =IF(ISERR(Selection!RC[2]),"",IF(ISNA(Selection!RC[2]),"",Selection!RC[4])) ->  | C25: =IF(ISERR(Selection!RC[1]),"",IF(ISNA(Selection!RC[1]),"",Selection!RC[1])) ->  | D25: =IF(RC[-1]="","",IF(Menus!R10C11="2001 Grossed",VLOOKUP(MAX(Selection!RC[9]:RC[10]),R2C14:R4C15,2),"")) -> 
A26: =1+R[-1]C -> 25 | B26: =IF(ISERR(Selection!RC[2]),"",IF(ISNA(Selection!RC[2]),"",Selection!RC[4])) ->  | C26: =IF(ISERR(Selection!RC[1]),"",IF(ISNA(Selection!RC[1]),"",Selection!RC[1])) ->  | D26: =IF(RC[-1]="","",IF(Menus!R10C11="2001 Grossed",VLOOKUP(MAX(Selection!RC[9]:RC[10]),R2C14:R4C15,2),"")) -> 
A27: =1+R[-1]C -> 26 | B27: =IF(ISERR(Selection!RC[2]),"",IF(ISNA(Selection!RC[2]),"",Selection!RC[4])) ->  | C27: =IF(ISERR(Selection!RC[1]),"",IF(ISNA(Selection!RC[1]),"",Selection!RC[1])) ->  | D27: =IF(RC[-1]="","",IF(Menus!R10C11="2001 Grossed",VLOOKUP(MAX(Selection!RC[9]:RC[10]),R2C14:R4C15,2),"")) -> 
A28: =1+R[-1]C -> 27 | B28: =IF(ISERR(Selection!RC[2]),"",IF(ISNA(Selection!RC[2]),"",Selection!RC[4])) ->  | C28: =IF(ISERR(Selection!RC[1]),"",IF(ISNA(Selection!RC[1]),"",Selection!RC[1])) ->  | D28: =IF(RC[-1]="","",IF(Menus!R10C11="2001 Grossed",VLOOKUP(MAX(Selection!RC[9]:RC[10]),R2C14:R4C15,2),"")) -> 
A29: =1+R[-1]C -> 28 | B29: =IF(ISERR(Selection!RC[2]),"",IF(ISNA(Selection!RC[2]),"",Selection!RC[4])) ->  | C29: =IF(ISERR(Selection!RC[1]),"",IF(ISNA(Selection!RC[1]),"",Selection!RC[1])) ->  | D29: =IF(RC[-1]="","",IF(Menus!R10C11="2001 Grossed",VLOOKUP(MAX(Selection!RC[9]:RC[10]),R2C14:R4C15,2),"")) -> 
A30: =1+R[-1]C -> 29 | B30: =IF(ISERR(Selection!RC[2]),"",IF(ISNA(Selection!RC[2]),"",Selection!RC[4])) ->  | C30: =IF(ISERR(Selection!RC[1]),"",IF(ISNA(Selection!RC[1]),"",Selection!RC[1])) ->  | D30: =IF(RC[-1]="","",IF(Menus!R10C11="2001 Grossed",VLOOKUP(MAX(Selection!RC[9]:RC[10]),R2C14:R4C15,2),"")) -> 
A31: =1+R[-1]C -> 30 | B31: =IF(ISERR(Selection!RC[2]),"",IF(ISNA(Selection!RC[2]),"",Selection!RC[4])) ->  | C31: =IF(ISERR(Selection!RC[1]),"",IF(ISNA(Selection!RC[1]),"",Selection!RC[1])) ->  | D31: =IF(RC[-1]="","",IF(Menus!R10C11="2001 Grossed",VLOOKUP(MAX(Selection!RC[9]:RC[10]),R2C14:R4C15,2),"")) -> 
A32: =1+R[-1]C -> 31 | B32: =IF(ISERR(Selection!RC[2]),"",IF(ISNA(Selection!RC[2]),"",Selection!RC[4])) ->  | C32: =IF(ISERR(Selection!RC[1]),"",IF(ISNA(Selection!RC[1]),"",Selection!RC[1])) ->  | D32: =IF(RC[-1]="","",IF(Menus!R10C11="2001 Grossed",VLOOKUP(MAX(Selection!RC[9]:RC[10]),R2C14:R4C15,2),"")) -> 
A33: =1+R[-1]C -> 32 | B33: =IF(ISERR(Selection!RC[2]),"",IF(ISNA(Selection!RC[2]),"",Selection!RC[4])) ->  | C33: =IF(ISERR(Selection!RC[1]),"",IF(ISNA(Selection!RC[1]),"",Selection!RC[1])) ->  | D33: =IF(RC[-1]="","",IF(Menus!R10C11="2001 Grossed",VLOOKUP(MAX(Selection!RC[9]:RC[10]),R2C14:R4C15,2),"")) -> 
A34: =1+R[-1]C -> 33 | B34: =IF(ISERR(Selection!RC[2]),"",IF(ISNA(Selection!RC[2]),"",Selection!RC[4])) ->  | C34: =IF(ISERR(Selection!RC[1]),"",IF(ISNA(Selection!RC[1]),"",Selection!RC[1])) ->  | D34: =IF(RC[-1]="","",IF(Menus!R10C11="2001 Grossed",VLOOKUP(MAX(Selection!RC[9]:RC[10]),R2C14:R4C15,2),"")) -> 
A35: =1+R[-1]C -> 34 | B35: =IF(ISERR(Selection!RC[2]),"",IF(ISNA(Selection!RC[2]),"",Selection!RC[4])) ->  | C35: =IF(ISERR(Selection!RC[1]),"",IF(ISNA(Selection!RC[1]),"",Selection!RC[1])) ->  | D35: =IF(RC[-1]="","",IF(Menus!R10C11="2001 Grossed",VLOOKUP(MAX(Selection!RC[9]:RC[10]),R2C14:R4C15,2),"")) -> 
A36: =1+R[-1]C -> 35 | B36: =IF(ISERR(Selection!RC[2]),"",IF(ISNA(Selection!RC[2]),"",Selection!RC[4])) ->  | C36: =IF(ISERR(Selection!RC[1]),"",IF(ISNA(Selection!RC[1]),"",Selection!RC[1])) ->  | D36: =IF(RC[-1]="","",IF(Menus!R10C11="2001 Grossed",VLOOKUP(MAX(Selection!RC[9]:RC[10]),R2C14:R4C15,2),"")) -> 
A37: =1+R[-1]C -> 36 | B37: =IF(ISERR(Selection!RC[2]),"",IF(ISNA(Selection!RC[2]),"",Selection!RC[4])) ->  | C37: =IF(ISERR(Selection!RC[1]),"",IF(ISNA(Selection!RC[1]),"",Selection!RC[1])) ->  | D37: =IF(RC[-1]="","",IF(Menus!R10C11="2001 Grossed",VLOOKUP(MAX(Selection!RC[9]:RC[10]),R2C14:R4C15,2),"")) -> 
A38: =1+R[-1]C -> 37 | B38: =IF(ISERR(Selection!RC[2]),"",IF(ISNA(Selection!RC[2]),"",Selection!RC[4])) ->  | C38: =IF(ISERR(Selection!RC[1]),"",IF(ISNA(Selection!RC[1]),"",Selection!RC[1])) ->  | D38: =IF(RC[-1]="","",IF(Menus!R10C11="2001 Grossed",VLOOKUP(MAX(Selection!RC[9]:RC[10]),R2C14:R4C15,2),"")) -> 
A39: =1+R[-1]C -> 38 | B39: =IF(ISERR(Selection!RC[2]),"",IF(ISNA(Selection!RC[2]),"",Selection!RC[4])) ->  | C39: =IF(ISERR(Selection!RC[1]),"",IF(ISNA(Selection!RC[1]),"",Selection!RC[1])) ->  | D39: =IF(RC[-1]="","",IF(Menus!R10C11="2001 Grossed",VLOOKUP(MAX(Selection!RC[9]:RC[10]),R2C14:R4C15,2),"")) -> 
A40: =1+R[-1]C -> 39 | B40: =IF(ISERR(Selection!RC[2]),"",IF(ISNA(Selection!RC[2]),"",Selection!RC[4])) ->  | C40: =IF(ISERR(Selection!RC[1]),"",IF(ISNA(Selection!RC[1]),"",Selection!RC[1])) ->  | D40: =IF(RC[-1]="","",IF(Menus!R10C11="2001 Grossed",VLOOKUP(MAX(Selection!RC[9]:RC[10]),R2C14:R4C15,2),"")) -> 
A41: =1+R[-1]C -> 40 | B41: =IF(ISERR(Selection!RC[2]),"",IF(ISNA(Selection!RC[2]),"",Selection!RC[4])) ->  | C41: =IF(ISERR(Selection!RC[1]),"",IF(ISNA(Selection!RC[1]),"",Selection!RC[1])) ->  | D41: =IF(RC[-1]="","",IF(Menus!R10C11="2001 Grossed",VLOOKUP(MAX(Selection!RC[9]:RC[10]),R2C14:R4C15,2),"")) -> 
A42: =1+R[-1]C -> 41 | B42: =IF(ISERR(Selection!RC[2]),"",IF(ISNA(Selection!RC[2]),"",Selection!RC[4])) ->  | C42: =IF(ISERR(Selection!RC[1]),"",IF(ISNA(Selection!RC[1]),"",Selection!RC[1])) ->  | D42: =IF(RC[-1]="","",IF(Menus!R10C11="2001 Grossed",VLOOKUP(MAX(Selection!RC[9]:RC[10]),R2C14:R4C15,2),"")) -> 
A43: =1+R[-1]C -> 42 | B43: =IF(ISERR(Selection!RC[2]),"",IF(ISNA(Selection!RC[2]),"",Selection!RC[4])) ->  | C43: =IF(ISERR(Selection!RC[1]),"",IF(ISNA(Selection!RC[1]),"",Selection!RC[1])) ->  | D43: =IF(RC[-1]="","",IF(Menus!R10C11="2001 Grossed",VLOOKUP(MAX(Selection!RC[9]:RC[10]),R2C14:R4C15,2),"")) -> 
A44: =1+R[-1]C -> 43 | B44: =IF(ISERR(Selection!RC[2]),"",IF(ISNA(Selection!RC[2]),"",Selection!RC[4])) ->  | C44: =IF(ISERR(Selection!RC[1]),"",IF(ISNA(Selection!RC[1]),"",Selection!RC[1])) ->  | D44: =IF(RC[-1]="","",IF(Menus!R10C11="2001 Grossed",VLOOKUP(MAX(Selection!RC[9]:RC[10]),R2C14:R4C15,2),"")) -> 
A45: =1+R[-1]C -> 44 | B45: =IF(ISERR(Selection!RC[2]),"",IF(ISNA(Selection!RC[2]),"",Selection!RC[4])) ->  | C45: =IF(ISERR(Selection!RC[1]),"",IF(ISNA(Selection!RC[1]),"",Selection!RC[1])) ->  | D45: =IF(RC[-1]="","",IF(Menus!R10C11="2001 Grossed",VLOOKUP(MAX(Selection!RC[9]:RC[10]),R2C14:R4C15,2),"")) -> 
A46: =1+R[-1]C -> 45 | B46: =IF(ISERR(Selection!RC[2]),"",IF(ISNA(Selection!RC[2]),"",Selection!RC[4])) ->  | C46: =IF(ISERR(Selection!RC[1]),"",IF(ISNA(Selection!RC[1]),"",Selection!RC[1])) ->  | D46: =IF(RC[-1]="","",IF(Menus!R10C11="2001 Grossed",VLOOKUP(MAX(Selection!RC[9]:RC[10]),R2C14:R4C15,2),"")) -> 
A47: =1+R[-1]C -> 46 | B47: =IF(ISERR(Selection!RC[2]),"",IF(ISNA(Selection!RC[2]),"",Selection!RC[4])) ->  | C47: =IF(ISERR(Selection!RC[1]),"",IF(ISNA(Selection!RC[1]),"",Selection!RC[1])) ->  | D47: =IF(RC[-1]="","",IF(Menus!R10C11="2001 Grossed",VLOOKUP(MAX(Selection!RC[9]:RC[10]),R2C14:R4C15,2),"")) -> 
A48: =1+R[-1]C -> 47 | B48: =IF(ISERR(Selection!RC[2]),"",IF(ISNA(Selection!RC[2]),"",Selection!RC[4])) ->  | C48: =IF(ISERR(Selection!RC[1]),"",IF(ISNA(Selection!RC[1]),"",Selection!RC[1])) ->  | D48: =IF(RC[-1]="","",IF(Menus!R10C11="2001 Grossed",VLOOKUP(MAX(Selection!RC[9]:RC[10]),R2C14:R4C15,2),"")) -> 
A49: =1+R[-1]C -> 48 | B49: =IF(ISERR(Selection!RC[2]),"",IF(ISNA(Selection!RC[2]),"",Selection!RC[4])) ->  | C49: =IF(ISERR(Selection!RC[1]),"",IF(ISNA(Selection!RC[1]),"",Selection!RC[1])) ->  | D49: =IF(RC[-1]="","",IF(Menus!R10C11="2001 Grossed",VLOOKUP(MAX(Selection!RC[9]:RC[10]),R2C14:R4C15,2),"")) -> 
A50: =1+R[-1]C -> 49 | B50: =IF(ISERR(Selection!RC[2]),"",IF(ISNA(Selection!RC[2]),"",Selection!RC[4])) ->  | C50: =IF(ISERR(Selection!RC[1]),"",IF(ISNA(Selection!RC[1]),"",Selection!RC[1])) ->  | D50: =IF(RC[-1]="","",IF(Menus!R10C11="2001 Grossed",VLOOKUP(MAX(Selection!RC[9]:RC[10]),R2C14:R4C15,2),"")) -> 
A51: =1+R[-1]C -> 50 | B51: =IF(ISERR(Selection!RC[2]),"",IF(ISNA(Selection!RC[2]),"",Selection!RC[4])) ->  | C51: =IF(ISERR(Selection!RC[1]),"",IF(ISNA(Selection!RC[1]),"",Selection!RC[1])) ->  | D51: =IF(RC[-1]="","",IF(Menus!R10C11="2001 Grossed",VLOOKUP(MAX(Selection!RC[9]:RC[10]),R2C14:R4C15,2),"")) -> 
A52: =1+R[-1]C -> 51 | B52: =IF(ISERR(Selection!RC[2]),"",IF(ISNA(Selection!RC[2]),"",Selection!RC[4])) ->  | C52: =IF(ISERR(Selection!RC[1]),"",IF(ISNA(Selection!RC[1]),"",Selection!RC[1])) ->  | D52: =IF(RC[-1]="","",IF(Menus!R10C11="2001 Grossed",VLOOKUP(MAX(Selection!RC[9]:RC[10]),R2C14:R4C15,2),"")) -> 
A53: =1+R[-1]C -> 52 | B53: =IF(ISERR(Selection!RC[2]),"",IF(ISNA(Selection!RC[2]),"",Selection!RC[4])) ->  | C53: =IF(ISERR(Selection!RC[1]),"",IF(ISNA(Selection!RC[1]),"",Selection!RC[1])) ->  | D53: =IF(RC[-1]="","",IF(Menus!R10C11="2001 Grossed",VLOOKUP(MAX(Selection!RC[9]:RC[10]),R2C14:R4C15,2),"")) -> 
A54: =1+R[-1]C -> 53 | B54: =IF(ISERR(Selection!RC[2]),"",IF(ISNA(Selection!RC[2]),"",Selection!RC[4])) ->  | C54: =IF(ISERR(Selection!RC[1]),"",IF(ISNA(Selection!RC[1]),"",Selection!RC[1])) ->  | D54: =IF(RC[-1]="","",IF(Menus!R10C11="2001 Grossed",VLOOKUP(MAX(Selection!RC[9]:RC[10]),R2C14:R4C15,2),"")) -> 
A55: =1+R[-1]C -> 54 | B55: =IF(ISERR(Selection!RC[2]),"",IF(ISNA(Selection!RC[2]),"",Selection!RC[4])) ->  | C55: =IF(ISERR(Selection!RC[1]),"",IF(ISNA(Selection!RC[1]),"",Selection!RC[1])) ->  | D55: =IF(RC[-1]="","",IF(Menus!R10C11="2001 Grossed",VLOOKUP(MAX(Selection!RC[9]:RC[10]),R2C14:R4C15,2),"")) -> 
A56: =1+R[-1]C -> 55 | B56: =IF(ISERR(Selection!RC[2]),"",IF(ISNA(Selection!RC[2]),"",Selection!RC[4])) ->  | C56: =IF(ISERR(Selection!RC[1]),"",IF(ISNA(Selection!RC[1]),"",Selection!RC[1])) ->  | D56: =IF(RC[-1]="","",IF(Menus!R10C11="2001 Grossed",VLOOKUP(MAX(Selection!RC[9]:RC[10]),R2C14:R4C15,2),"")) -> 
A57: =1+R[-1]C -> 56 | B57: =IF(ISERR(Selection!RC[2]),"",IF(ISNA(Selection!RC[2]),"",Selection!RC[4])) ->  | C57: =IF(ISERR(Selection!RC[1]),"",IF(ISNA(Selection!RC[1]),"",Selection!RC[1])) ->  | D57: =IF(RC[-1]="","",IF(Menus!R10C11="2001 Grossed",VLOOKUP(MAX(Selection!RC[9]:RC[10]),R2C14:R4C15,2),"")) -> 
A58: =1+R[-1]C -> 57 | B58: =IF(ISERR(Selection!RC[2]),"",IF(ISNA(Selection!RC[2]),"",Selection!RC[4])) ->  | C58: =IF(ISERR(Selection!RC[1]),"",IF(ISNA(Selection!RC[1]),"",Selection!RC[1])) ->  | D58: =IF(RC[-1]="","",IF(Menus!R10C11="2001 Grossed",VLOOKUP(MAX(Selection!RC[9]:RC[10]),R2C14:R4C15,2),"")) -> 
A59: =1+R[-1]C -> 58 | B59: =IF(ISERR(Selection!RC[2]),"",IF(ISNA(Selection!RC[2]),"",Selection!RC[4])) ->  | C59: =IF(ISERR(Selection!RC[1]),"",IF(ISNA(Selection!RC[1]),"",Selection!RC[1])) ->  | D59: =IF(RC[-1]="","",IF(Menus!R10C11="2001 Grossed",VLOOKUP(MAX(Selection!RC[9]:RC[10]),R2C14:R4C15,2),"")) -> 
A60: =1+R[-1]C -> 59 | B60: =IF(ISERR(Selection!RC[2]),"",IF(ISNA(Selection!RC[2]),"",Selection!RC[4])) ->  | C60: =IF(ISERR(Selection!RC[1]),"",IF(ISNA(Selection!RC[1]),"",Selection!RC[1])) ->  | D60: =IF(RC[-1]="","",IF(Menus!R10C11="2001 Grossed",VLOOKUP(MAX(Selection!RC[9]:RC[10]),R2C14:R4C15,2),"")) -> 
A61: =1+R[-1]C -> 60 | B61: =IF(ISERR(Selection!RC[2]),"",IF(ISNA(Selection!RC[2]),"",Selection!RC[4])) ->  | C61: =IF(ISERR(Selection!RC[1]),"",IF(ISNA(Selection!RC[1]),"",Selection!RC[1])) ->  | D61: =IF(RC[-1]="","",IF(Menus!R10C11="2001 Grossed",VLOOKUP(MAX(Selection!RC[9]:RC[10]),R2C14:R4C15,2),"")) -> 
A62: =1+R[-1]C -> 61 | B62: =IF(ISERR(Selection!RC[2]),"",IF(ISNA(Selection!RC[2]),"",Selection!RC[4])) ->  | C62: =IF(ISERR(Selection!RC[1]),"",IF(ISNA(Selection!RC[1]),"",Selection!RC[1])) ->  | D62: =IF(RC[-1]="","",IF(Menus!R10C11="2001 Grossed",VLOOKUP(MAX(Selection!RC[9]:RC[10]),R2C14:R4C15,2),"")) -> 
A63: =1+R[-1]C -> 62 | B63: =IF(ISERR(Selection!RC[2]),"",IF(ISNA(Selection!RC[2]),"",Selection!RC[4])) ->  | C63: =IF(ISERR(Selection!RC[1]),"",IF(ISNA(Selection!RC[1]),"",Selection!RC[1])) ->  | D63: =IF(RC[-1]="","",IF(Menus!R10C11="2001 Grossed",VLOOKUP(MAX(Selection!RC[9]:RC[10]),R2C14:R4C15,2),"")) -> 
A64: =1+R[-1]C -> 63 | B64: =IF(ISERR(Selection!RC[2]),"",IF(ISNA(Selection!RC[2]),"",Selection!RC[4])) ->  | C64: =IF(ISERR(Selection!RC[1]),"",IF(ISNA(Selection!RC[1]),"",Selection!RC[1])) ->  | D64: =IF(RC[-1]="","",IF(Menus!R10C11="2001 Grossed",VLOOKUP(MAX(Selection!RC[9]:RC[10]),R2C14:R4C15,2),"")) -> 
A65: =1+R[-1]C -> 64 | B65: =IF(ISERR(Selection!RC[2]),"",IF(ISNA(Selection!RC[2]),"",Selection!RC[4])) ->  | C65: =IF(ISERR(Selection!RC[1]),"",IF(ISNA(Selection!RC[1]),"",Selection!RC[1])) ->  | D65: =IF(RC[-1]="","",IF(Menus!R10C11="2001 Grossed",VLOOKUP(MAX(Selection!RC[9]:RC[10]),R2C14:R4C15,2),"")) -> 
A66: =1+R[-1]C -> 65 | B66: =IF(ISERR(Selection!RC[2]),"",IF(ISNA(Selection!RC[2]),"",Selection!RC[4])) ->  | C66: =IF(ISERR(Selection!RC[1]),"",IF(ISNA(Selection!RC[1]),"",Selection!RC[1])) ->  | D66: =IF(RC[-1]="","",IF(Menus!R10C11="2001 Grossed",VLOOKUP(MAX(Selection!RC[9]:RC[10]),R2C14:R4C15,2),"")) -> 
A67: =1+R[-1]C -> 66 | B67: =IF(ISERR(Selection!RC[2]),"",IF(ISNA(Selection!RC[2]),"",Selection!RC[4])) ->  | C67: =IF(ISERR(Selection!RC[1]),"",IF(ISNA(Selection!RC[1]),"",Selection!RC[1])) ->  | D67: =IF(RC[-1]="","",IF(Menus!R10C11="2001 Grossed",VLOOKUP(MAX(Selection!RC[9]:RC[10]),R2C14:R4C15,2),"")) -> 
A68: =1+R[-1]C -> 67 | B68: =IF(ISERR(Selection!RC[2]),"",IF(ISNA(Selection!RC[2]),"",Selection!RC[4])) ->  | C68: =IF(ISERR(Selection!RC[1]),"",IF(ISNA(Selection!RC[1]),"",Selection!RC[1])) ->  | D68: =IF(RC[-1]="","",IF(Menus!R10C11="2001 Grossed",VLOOKUP(MAX(Selection!RC[9]:RC[10]),R2C14:R4C15,2),"")) -> 
A69: =1+R[-1]C -> 68 | B69: =IF(ISERR(Selection!RC[2]),"",IF(ISNA(Selection!RC[2]),"",Selection!RC[4])) ->  | C69: =IF(ISERR(Selection!RC[1]),"",IF(ISNA(Selection!RC[1]),"",Selection!RC[1])) ->  | D69: =IF(RC[-1]="","",IF(Menus!R10C11="2001 Grossed",VLOOKUP(MAX(Selection!RC[9]:RC[10]),R2C14:R4C15,2),"")) -> 
A70: =1+R[-1]C -> 69 | B70: =IF(ISERR(Selection!RC[2]),"",IF(ISNA(Selection!RC[2]),"",Selection!RC[4])) ->  | C70: =IF(ISERR(Selection!RC[1]),"",IF(ISNA(Selection!RC[1]),"",Selection!RC[1])) ->  | D70: =IF(RC[-1]="","",IF(Menus!R10C11="2001 Grossed",VLOOKUP(MAX(Selection!RC[9]:RC[10]),R2C14:R4C15,2),"")) -> 
A71: =1+R[-1]C -> 70 | B71: =IF(ISERR(Selection!RC[2]),"",IF(ISNA(Selection!RC[2]),"",Selection!RC[4])) ->  | C71: =IF(ISERR(Selection!RC[1]),"",IF(ISNA(Selection!RC[1]),"",Selection!RC[1])) ->  | D71: =IF(RC[-1]="","",IF(Menus!R10C11="2001 Grossed",VLOOKUP(MAX(Selection!RC[9]:RC[10]),R2C14:R4C15,2),"")) -> 
A72: =1+R[-1]C -> 71 | B72: =IF(ISERR(Selection!RC[2]),"",IF(ISNA(Selection!RC[2]),"",Selection!RC[4])) ->  | C72: =IF(ISERR(Selection!RC[1]),"",IF(ISNA(Selection!RC[1]),"",Selection!RC[1])) ->  | D72: =IF(RC[-1]="","",IF(Menus!R10C11="2001 Grossed",VLOOKUP(MAX(Selection!RC[9]:RC[10]),R2C14:R4C15,2),"")) -> 
A73: =1+R[-1]C -> 72 | B73: =IF(ISERR(Selection!RC[2]),"",IF(ISNA(Selection!RC[2]),"",Selection!RC[4])) ->  | C73: =IF(ISERR(Selection!RC[1]),"",IF(ISNA(Selection!RC[1]),"",Selection!RC[1])) ->  | D73: =IF(RC[-1]="","",IF(Menus!R10C11="2001 Grossed",VLOOKUP(MAX(Selection!RC[9]:RC[10]),R2C14:R4C15,2),"")) -> 
A74: =1+R[-1]C -> 73 | B74: =IF(ISERR(Selection!RC[2]),"",IF(ISNA(Selection!RC[2]),"",Selection!RC[4])) ->  | C74: =IF(ISERR(Selection!RC[1]),"",IF(ISNA(Selection!RC[1]),"",Selection!RC[1])) ->  | D74: =IF(RC[-1]="","",IF(Menus!R10C11="2001 Grossed",VLOOKUP(MAX(Selection!RC[9]:RC[10]),R2C14:R4C15,2),"")) -> 
A75: =1+R[-1]C -> 74 | B75: =IF(ISERR(Selection!RC[2]),"",IF(ISNA(Selection!RC[2]),"",Selection!RC[4])) ->  | C75: =IF(ISERR(Selection!RC[1]),"",IF(ISNA(Selection!RC[1]),"",Selection!RC[1])) ->  | D75: =IF(RC[-1]="","",IF(Menus!R10C11="2001 Grossed",VLOOKUP(MAX(Selection!RC[9]:RC[10]),R2C14:R4C15,2),"")) -> 
A76: =1+R[-1]C -> 75 | B76: =IF(ISERR(Selection!RC[2]),"",IF(ISNA(Selection!RC[2]),"",Selection!RC[4])) ->  | C76: =IF(ISERR(Selection!RC[1]),"",IF(ISNA(Selection!RC[1]),"",Selection!RC[1])) ->  | D76: =IF(RC[-1]="","",IF(Menus!R10C11="2001 Grossed",VLOOKUP(MAX(Selection!RC[9]:RC[10]),R2C14:R4C15,2),"")) -> 
A77: =1+R[-1]C -> 76 | B77: =IF(ISERR(Selection!RC[2]),"",IF(ISNA(Selection!RC[2]),"",Selection!RC[4])) ->  | C77: =IF(ISERR(Selection!RC[1]),"",IF(ISNA(Selection!RC[1]),"",Selection!RC[1])) ->  | D77: =IF(RC[-1]="","",IF(Menus!R10C11="2001 Grossed",VLOOKUP(MAX(Selection!RC[9]:RC[10]),R2C14:R4C15,2),"")) -> 
A78: =1+R[-1]C -> 77 | B78: =IF(ISERR(Selection!RC[2]),"",IF(ISNA(Selection!RC[2]),"",Selection!RC[4])) ->  | C78: =IF(ISERR(Selection!RC[1]),"",IF(ISNA(Selection!RC[1]),"",Selection!RC[1])) ->  | D78: =IF(RC[-1]="","",IF(Menus!R10C11="2001 Grossed",VLOOKUP(MAX(Selection!RC[9]:RC[10]),R2C14:R4C15,2),"")) -> 
A79: =1+R[-1]C -> 78 | B79: =IF(ISERR(Selection!RC[2]),"",IF(ISNA(Selection!RC[2]),"",Selection!RC[4])) ->  | C79: =IF(ISERR(Selection!RC[1]),"",IF(ISNA(Selection!RC[1]),"",Selection!RC[1])) ->  | D79: =IF(RC[-1]="","",IF(Menus!R10C11="2001 Grossed",VLOOKUP(MAX(Selection!RC[9]:RC[10]),R2C14:R4C15,2),"")) -> 
A80: =1+R[-1]C -> 79 | B80: =IF(ISERR(Selection!RC[2]),"",IF(ISNA(Selection!RC[2]),"",Selection!RC[4])) ->  | C80: =IF(ISERR(Selection!RC[1]),"",IF(ISNA(Selection!RC[1]),"",Selection!RC[1])) ->  | D80: =IF(RC[-1]="","",IF(Menus!R10C11="2001 Grossed",VLOOKUP(MAX(Selection!RC[9]:RC[10]),R2C14:R4C15,2),"")) -> 
A81: =1+R[-1]C -> 80 | B81: =IF(ISERR(Selection!RC[2]),"",IF(ISNA(Selection!RC[2]),"",Selection!RC[4])) ->  | C81: =IF(ISERR(Selection!RC[1]),"",IF(ISNA(Selection!RC[1]),"",Selection!RC[1])) ->  | D81: =IF(RC[-1]="","",IF(Menus!R10C11="2001 Grossed",VLOOKUP(MAX(Selection!RC[9]:RC[10]),R2C14:R4C15,2),"")) -> 
A82: =1+R[-1]C -> 81 | B82: =IF(ISERR(Selection!RC[2]),"",IF(ISNA(Selection!RC[2]),"",Selection!RC[4])) ->  | C82: =IF(ISERR(Selection!RC[1]),"",IF(ISNA(Selection!RC[1]),"",Selection!RC[1])) ->  | D82: =IF(RC[-1]="","",IF(Menus!R10C11="2001 Grossed",VLOOKUP(MAX(Selection!RC[9]:RC[10]),R2C14:R4C15,2),"")) -> 
A83: =1+R[-1]C -> 82 | B83: =IF(ISERR(Selection!RC[2]),"",IF(ISNA(Selection!RC[2]),"",Selection!RC[4])) ->  | C83: =IF(ISERR(Selection!RC[1]),"",IF(ISNA(Selection!RC[1]),"",Selection!RC[1])) ->  | D83: =IF(RC[-1]="","",IF(Menus!R10C11="2001 Grossed",VLOOKUP(MAX(Selection!RC[9]:RC[10]),R2C14:R4C15,2),"")) -> 
A84: =1+R[-1]C -> 83 | B84: =IF(ISERR(Selection!RC[2]),"",IF(ISNA(Selection!RC[2]),"",Selection!RC[4])) ->  | C84: =IF(ISERR(Selection!RC[1]),"",IF(ISNA(Selection!RC[1]),"",Selection!RC[1])) ->  | D84: =IF(RC[-1]="","",IF(Menus!R10C11="2001 Grossed",VLOOKUP(MAX(Selection!RC[9]:RC[10]),R2C14:R4C15,2),"")) -> 
A85: =1+R[-1]C -> 84 | B85: =IF(ISERR(Selection!RC[2]),"",IF(ISNA(Selection!RC[2]),"",Selection!RC[4])) ->  | C85: =IF(ISERR(Selection!RC[1]),"",IF(ISNA(Selection!RC[1]),"",Selection!RC[1])) ->  | D85: =IF(RC[-1]="","",IF(Menus!R10C11="2001 Grossed",VLOOKUP(MAX(Selection!RC[9]:RC[10]),R2C14:R4C15,2),"")) -> 
A86: =1+R[-1]C -> 85 | B86: =IF(ISERR(Selection!RC[2]),"",IF(ISNA(Selection!RC[2]),"",Selection!RC[4])) ->  | C86: =IF(ISERR(Selection!RC[1]),"",IF(ISNA(Selection!RC[1]),"",Selection!RC[1])) ->  | D86: =IF(RC[-1]="","",IF(Menus!R10C11="2001 Grossed",VLOOKUP(MAX(Selection!RC[9]:RC[10]),R2C14:R4C15,2),"")) -> 
A87: =1+R[-1]C -> 86 | B87: =IF(ISERR(Selection!RC[2]),"",IF(ISNA(Selection!RC[2]),"",Selection!RC[4])) ->  | C87: =IF(ISERR(Selection!RC[1]),"",IF(ISNA(Selection!RC[1]),"",Selection!RC[1])) ->  | D87: =IF(RC[-1]="","",IF(Menus!R10C11="2001 Grossed",VLOOKUP(MAX(Selection!RC[9]:RC[10]),R2C14:R4C15,2),"")) -> 
A88: =1+R[-1]C -> 87 | B88: =IF(ISERR(Selection!RC[2]),"",IF(ISNA(Selection!RC[2]),"",Selection!RC[4])) ->  | C88: =IF(ISERR(Selection!RC[1]),"",IF(ISNA(Selection!RC[1]),"",Selection!RC[1])) ->  | D88: =IF(RC[-1]="","",IF(Menus!R10C11="2001 Grossed",VLOOKUP(MAX(Selection!RC[9]:RC[10]),R2C14:R4C15,2),"")) -> 
A89: =1+R[-1]C -> 88 | B89: =IF(ISERR(Selection!RC[2]),"",IF(ISNA(Selection!RC[2]),"",Selection!RC[4])) ->  | C89: =IF(ISERR(Selection!RC[1]),"",IF(ISNA(Selection!RC[1]),"",Selection!RC[1])) ->  | D89: =IF(RC[-1]="","",IF(Menus!R10C11="2001 Grossed",VLOOKUP(MAX(Selection!RC[9]:RC[10]),R2C14:R4C15,2),"")) -> 
A90: =1+R[-1]C -> 89 | B90: =IF(ISERR(Selection!RC[2]),"",IF(ISNA(Selection!RC[2]),"",Selection!RC[4])) ->  | C90: =IF(ISERR(Selection!RC[1]),"",IF(ISNA(Selection!RC[1]),"",Selection!RC[1])) ->  | D90: =IF(RC[-1]="","",IF(Menus!R10C11="2001 Grossed",VLOOKUP(MAX(Selection!RC[9]:RC[10]),R2C14:R4C15,2),"")) -> 
A91: =1+R[-1]C -> 90 | B91: =IF(ISERR(Selection!RC[2]),"",IF(ISNA(Selection!RC[2]),"",Selection!RC[4])) ->  | C91: =IF(ISERR(Selection!RC[1]),"",IF(ISNA(Selection!RC[1]),"",Selection!RC[1])) ->  | D91: =IF(RC[-1]="","",IF(Menus!R10C11="2001 Grossed",VLOOKUP(MAX(Selection!RC[9]:RC[10]),R2C14:R4C15,2),"")) -> 
A92: =1+R[-1]C -> 91 | B92: =IF(ISERR(Selection!RC[2]),"",IF(ISNA(Selection!RC[2]),"",Selection!RC[4])) ->  | C92: =IF(ISERR(Selection!RC[1]),"",IF(ISNA(Selection!RC[1]),"",Selection!RC[1])) ->  | D92: =IF(RC[-1]="","",IF(Menus!R10C11="2001 Grossed",VLOOKUP(MAX(Selection!RC[9]:RC[10]),R2C14:R4C15,2),"")) -> 
A93: =1+R[-1]C -> 92 | B93: =IF(ISERR(Selection!RC[2]),"",IF(ISNA(Selection!RC[2]),"",Selection!RC[4])) ->  | C93: =IF(ISERR(Selection!RC[1]),"",IF(ISNA(Selection!RC[1]),"",Selection!RC[1])) ->  | D93: =IF(RC[-1]="","",IF(Menus!R10C11="2001 Grossed",VLOOKUP(MAX(Selection!RC[9]:RC[10]),R2C14:R4C15,2),"")) -> 
A94: =1+R[-1]C -> 93 | B94: =IF(ISERR(Selection!RC[2]),"",IF(ISNA(Selection!RC[2]),"",Selection!RC[4])) ->  | C94: =IF(ISERR(Selection!RC[1]),"",IF(ISNA(Selection!RC[1]),"",Selection!RC[1])) ->  | D94: =IF(RC[-1]="","",IF(Menus!R10C11="2001 Grossed",VLOOKUP(MAX(Selection!RC[9]:RC[10]),R2C14:R4C15,2),"")) -> 
A95: =1+R[-1]C -> 94 | B95: =IF(ISERR(Selection!RC[2]),"",IF(ISNA(Selection!RC[2]),"",Selection!RC[4])) ->  | C95: =IF(ISERR(Selection!RC[1]),"",IF(ISNA(Selection!RC[1]),"",Selection!RC[1])) ->  | D95: =IF(RC[-1]="","",IF(Menus!R10C11="2001 Grossed",VLOOKUP(MAX(Selection!RC[9]:RC[10]),R2C14:R4C15,2),"")) -> 
A96: =1+R[-1]C -> 95 | B96: =IF(ISERR(Selection!RC[2]),"",IF(ISNA(Selection!RC[2]),"",Selection!RC[4])) ->  | C96: =IF(ISERR(Selection!RC[1]),"",IF(ISNA(Selection!RC[1]),"",Selection!RC[1])) ->  | D96: =IF(RC[-1]="","",IF(Menus!R10C11="2001 Grossed",VLOOKUP(MAX(Selection!RC[9]:RC[10]),R2C14:R4C15,2),"")) -> 
A97: =1+R[-1]C -> 96 | B97: =IF(ISERR(Selection!RC[2]),"",IF(ISNA(Selection!RC[2]),"",Selection!RC[4])) ->  | C97: =IF(ISERR(Selection!RC[1]),"",IF(ISNA(Selection!RC[1]),"",Selection!RC[1])) ->  | D97: =IF(RC[-1]="","",IF(Menus!R10C11="2001 Grossed",VLOOKUP(MAX(Selection!RC[9]:RC[10]),R2C14:R4C15,2),"")) -> 
A98: =1+R[-1]C -> 97 | B98: =IF(ISERR(Selection!RC[2]),"",IF(ISNA(Selection!RC[2]),"",Selection!RC[4])) ->  | C98: =IF(ISERR(Selection!RC[1]),"",IF(ISNA(Selection!RC[1]),"",Selection!RC[1])) ->  | D98: =IF(RC[-1]="","",IF(Menus!R10C11="2001 Grossed",VLOOKUP(MAX(Selection!RC[9]:RC[10]),R2C14:R4C15,2),"")) -> 
A99: =1+R[-1]C -> 98 | B99: =IF(ISERR(Selection!RC[2]),"",IF(ISNA(Selection!RC[2]),"",Selection!RC[4])) ->  | C99: =IF(ISERR(Selection!RC[1]),"",IF(ISNA(Selection!RC[1]),"",Selection!RC[1])) ->  | D99: =IF(RC[-1]="","",IF(Menus!R10C11="2001 Grossed",VLOOKUP(MAX(Selection!RC[9]:RC[10]),R2C14:R4C15,2),"")) -> 
A100: =1+R[-1]C -> 99 | B100: =IF(ISERR(Selection!RC[2]),"",IF(ISNA(Selection!RC[2]),"",Selection!RC[4])) ->  | C100: =IF(ISERR(Selection!RC[1]),"",IF(ISNA(Selection!RC[1]),"",Selection!RC[1])) ->  | D100: =IF(RC[-1]="","",IF(Menus!R10C11="2001 Grossed",VLOOKUP(MAX(Selection!RC[9]:RC[10]),R2C14:R4C15,2),"")) -> 
A101: =1+R[-1]C -> 100 | B101: =IF(ISERR(Selection!RC[2]),"",IF(ISNA(Selection!RC[2]),"",Selection!RC[4])) ->  | C101: =IF(ISERR(Selection!RC[1]),"",IF(ISNA(Selection!RC[1]),"",Selection!RC[1])) ->  | D101: =IF(RC[-1]="","",IF(Menus!R10C11="2001 Grossed",VLOOKUP(MAX(Selection!RC[9]:RC[10]),R2C14:R4C15,2),"")) -> 

Sheet: Selection
A1: Row in data sheet | B1: x | C1: y | D1: =IF(Menus!R9C10,OFFSET(INDIRECT(ADDRESS(1,3,3,1,Menus!R10C11)),0,Menus!R3C[6])&" / "&OFFSET(INDIRECT(ADDRESS(1,3,3,1,Menus!R10C11)),0,Menus!R4C[6]),OFFSET(INDIRECT(ADDRESS(1,3,3,1,Menus!R10C11)),0,Menus!R3C[6])) -> Recurrent Expenditure (Euros) - Staff / Library Staff FTE - Total Staff | E1: =OFFSET(INDIRECT(ADDRESS(1,3,3,1,Menus!R10C11)),0,Menus!R4C[5]) -> Library Staff FTE - Total Staff | F1: Name | G1: =IF(Menus!R5C11=0,"(blank)",Menus!R5C11) -> EFTA | H1: =IF(Menus!R6C11=0,"(blank)",Menus!R6C11) -> EU | I1: =IF(Menus!R7C11=0,"(blank)",Menus!R7C11) -> België Nederlandstalige Universiteiten | J1: =IF(Menus!R8C11=0,"(blank)",Menus!R8C11) -> België Nederlandstalige Universiteiten | K1: =SUM(R[1]C:R[500]C) -> 20 | M1: Real data x | N1: Real data y
A2: 16 | B2: =OFFSET(INDIRECT(ADDRESS(RC1,3,3,1,Menus!R10C11)),0,Menus!R4C10) -> 899 | C2: =OFFSET(INDIRECT(ADDRESS(RC1,3,3,1,Menus!R10C11)),0,Menus!R3C10) -> 38129876 | D2: =IF(Menus!R9C10,RC[-1]/RC[-2],RC[-1]) -> 42413.65517241379 | E2: =IF(RC11=1,VALUE(RC[-3]),NA()) -> 899 | F2: =INDIRECT(ADDRESS(RC1,1,3,1,Menus!R10C11)) -> Denmark | G2: =IF(INDIRECT(ADDRESS(RC1,2,3,1,Menus!R10C11))=R1C,RC4,NA()) -> NA() | H2: =IF(INDIRECT(ADDRESS(RC1,2,3,1,Menus!R10C11))=R1C,RC4,NA()) -> 42413.65517241379 | I2: =IF(INDIRECT(ADDRESS(RC1,2,3,1,Menus!R10C11))=R1C,RC4,NA()) -> NA() | J2: =IF(INDIRECT(ADDRESS(RC1,1,3,1,Menus!R10C11))=T(R1C),RC4,NA()) -> NA() | K2: =IF(OR(ISNUMBER(RC7),ISNUMBER(RC8),ISNUMBER(RC9),ISNUMBER(RC10)),1,0) -> 1 | M2: =OFFSET(INDIRECT(ADDRESS(RC1,3,3,1,"Gross")),0,Menus!R4C10) -> 0 | N2: =OFFSET(INDIRECT(ADDRESS(RC1,3,3,1,"Gross")),0,Menus!R3C10) -> 0 | P2: 1 | Q2: Apportioned or estimated from previous years returns
A3: 26 | B3: =OFFSET(INDIRECT(ADDRESS(RC1,3,3,1,Menus!R10C11)),0,Menus!R4C10) -> 964 | C3: =OFFSET(INDIRECT(ADDRESS(RC1,3,3,1,Menus!R10C11)),0,Menus!R3C10) -> 38591900 | D3: =IF(Menus!R9C10,RC[-1]/RC[-2],RC[-1]) -> 40033.091286307055 | E3: =IF(RC11=1,VALUE(RC[-3]),NA()) -> 964 | F3: =INDIRECT(ADDRESS(RC1,1,3,1,Menus!R10C11)) -> Norway | G3: =IF(INDIRECT(ADDRESS(RC1,2,3,1,Menus!R10C11))=R1C,RC4,NA()) -> 40033.091286307055 | H3: =IF(INDIRECT(ADDRESS(RC1,2,3,1,Menus!R10C11))=R1C,RC4,NA()) -> NA() | I3: =IF(INDIRECT(ADDRESS(RC1,2,3,1,Menus!R10C11))=R1C,RC4,NA()) -> NA() | J3: =IF(INDIRECT(ADDRESS(RC1,1,3,1,Menus!R10C11))=T(R1C),RC4,NA()) -> NA() | K3: =IF(OR(ISNUMBER(RC7),ISNUMBER(RC8),ISNUMBER(RC9),ISNUMBER(RC10)),1,0) -> 1 | M3: =OFFSET(INDIRECT(ADDRESS(RC1,3,3,1,"Gross")),0,Menus!R4C10) -> 0 | N3: =OFFSET(INDIRECT(ADDRESS(RC1,3,3,1,"Gross")),0,Menus!R3C10) -> 0
A4: 19 | B4: =OFFSET(INDIRECT(ADDRESS(RC1,3,3,1,Menus!R10C11)),0,Menus!R4C10) -> 4364 | C4: =OFFSET(INDIRECT(ADDRESS(RC1,3,3,1,Menus!R10C11)),0,Menus!R3C10) -> 167287948 | D4: =IF(Menus!R9C10,RC[-1]/RC[-2],RC[-1]) -> 38333.626947754354 | E4: =IF(RC11=1,VALUE(RC[-3]),NA()) -> 4364 | F4: =INDIRECT(ADDRESS(RC1,1,3,1,Menus!R10C11)) -> France | G4: =IF(INDIRECT(ADDRESS(RC1,2,3,1,Menus!R10C11))=R1C,RC4,NA()) -> NA() | H4: =IF(INDIRECT(ADDRESS(RC1,2,3,1,Menus!R10C11))=R1C,RC4,NA()) -> 38333.626947754354 | I4: =IF(INDIRECT(ADDRESS(RC1,2,3,1,Menus!R10C11))=R1C,RC4,NA()) -> NA() | J4: =IF(INDIRECT(ADDRESS(RC1,1,3,1,Menus!R10C11))=T(R1C),RC4,NA()) -> NA() | K4: =IF(OR(ISNUMBER(RC7),ISNUMBER(RC8),ISNUMBER(RC9),ISNUMBER(RC10)),1,0) -> 1 | M4: =OFFSET(INDIRECT(ADDRESS(RC1,3,3,1,"Gross")),0,Menus!R4C10) -> 1 | N4: =OFFSET(INDIRECT(ADDRESS(RC1,3,3,1,"Gross")),0,Menus!R3C10) -> 1
A5: 29 | B5: =OFFSET(INDIRECT(ADDRESS(RC1,3,3,1,Menus!R10C11)),0,Menus!R4C10) -> 1733 | C5: =OFFSET(INDIRECT(ADDRESS(RC1,3,3,1,Menus!R10C11)),0,Menus!R3C10) -> 66313682 | D5: =IF(Menus!R9C10,RC[-1]/RC[-2],RC[-1]) -> 38265.252163877667 | E5: =IF(RC11=1,VALUE(RC[-3]),NA()) -> 1733 | F5: =INDIRECT(ADDRESS(RC1,1,3,1,Menus!R10C11)) -> Sweden | G5: =IF(INDIRECT(ADDRESS(RC1,2,3,1,Menus!R10C11))=R1C,RC4,NA()) -> NA() | H5: =IF(INDIRECT(ADDRESS(RC1,2,3,1,Menus!R10C11))=R1C,RC4,NA()) -> 38265.252163877667 | I5: =IF(INDIRECT(ADDRESS(RC1,2,3,1,Menus!R10C11))=R1C,RC4,NA()) -> NA() | J5: =IF(INDIRECT(ADDRESS(RC1,1,3,1,Menus!R10C11))=T(R1C),RC4,NA()) -> NA() | K5: =IF(OR(ISNUMBER(RC7),ISNUMBER(RC8),ISNUMBER(RC9),ISNUMBER(RC10)),1,0) -> 1 | M5: =OFFSET(INDIRECT(ADDRESS(RC1,3,3,1,"Gross")),0,Menus!R4C10) -> 0 | N5: =OFFSET(INDIRECT(ADDRESS(RC1,3,3,1,"Gross")),0,Menus!R3C10) -> 0
A6: 23 | B6: =OFFSET(INDIRECT(ADDRESS(RC1,3,3,1,Menus!R10C11)),0,Menus!R4C10) -> 5 | C6: =OFFSET(INDIRECT(ADDRESS(RC1,3,3,1,Menus!R10C11)),0,Menus!R3C10) -> 185623 | D6: =IF(Menus!R9C10,RC[-1]/RC[-2],RC[-1]) -> 37124.6 | E6: =IF(RC11=1,VALUE(RC[-3]),NA()) -> 5 | F6: =INDIRECT(ADDRESS(RC1,1,3,1,Menus!R10C11)) -> Liechtenstein | G6: =IF(INDIRECT(ADDRESS(RC1,2,3,1,Menus!R10C11))=R1C,RC4,NA()) -> 37124.6 | H6: =IF(INDIRECT(ADDRESS(RC1,2,3,1,Menus!R10C11))=R1C,RC4,NA()) -> NA() | I6: =IF(INDIRECT(ADDRESS(RC1,2,3,1,Menus!R10C11))=R1C,RC4,NA()) -> NA() | J6: =IF(INDIRECT(ADDRESS(RC1,1,3,1,Menus!R10C11))=T(R1C),RC4,NA()) -> NA() | K6: =IF(OR(ISNUMBER(RC7),ISNUMBER(RC8),ISNUMBER(RC9),ISNUMBER(RC10)),1,0) -> 1 | M6: =OFFSET(INDIRECT(ADDRESS(RC1,3,3,1,"Gross")),0,Menus!R4C10) -> 2 | N6: =OFFSET(INDIRECT(ADDRESS(RC1,3,3,1,"Gross")),0,Menus!R3C10) -> 2
A7: 31 | B7: =OFFSET(INDIRECT(ADDRESS(RC1,3,3,1,Menus!R10C11)),0,Menus!R4C10) -> 9820 | C7: =OFFSET(INDIRECT(ADDRESS(RC1,3,3,1,Menus!R10C11)),0,Menus!R3C10) -> 349430033 | D7: =IF(Menus!R9C10,RC[-1]/RC[-2],RC[-1]) -> 35583.506415478616 | E7: =IF(RC11=1,VALUE(RC[-3]),NA()) -> 9820 | F7: =INDIRECT(ADDRESS(RC1,1,3,1,Menus!R10C11)) -> UK | G7: =IF(INDIRECT(ADDRESS(RC1,2,3,1,Menus!R10C11))=R1C,RC4,NA()) -> NA() | H7: =IF(INDIRECT(ADDRESS(RC1,2,3,1,Menus!R10C11))=R1C,RC4,NA()) -> 35583.506415478616 | I7: =IF(INDIRECT(ADDRESS(RC1,2,3,1,Menus!R10C11))=R1C,RC4,NA()) -> NA() | J7: =IF(INDIRECT(ADDRESS(RC1,1,3,1,Menus!R10C11))=T(R1C),RC4,NA()) -> NA() | K7: =IF(OR(ISNUMBER(RC7),ISNUMBER(RC8),ISNUMBER(RC9),ISNUMBER(RC10)),1,0) -> 1 | M7: =OFFSET(INDIRECT(ADDRESS(RC1,3,3,1,"Gross")),0,Menus!R4C10) -> 0 | N7: =OFFSET(INDIRECT(ADDRESS(RC1,3,3,1,"Gross")),0,Menus!R3C10) -> 0
A8: 24 | B8: =OFFSET(INDIRECT(ADDRESS(RC1,3,3,1,Menus!R10C11)),0,Menus!R4C10) -> 9 | C8: =OFFSET(INDIRECT(ADDRESS(RC1,3,3,1,Menus!R10C11)),0,Menus!R3C10) -> 303856 | D8: =IF(Menus!R9C10,RC[-1]/RC[-2],RC[-1]) -> 33761.777777777781 | E8: =IF(RC11=1,VALUE(RC[-3]),NA()) -> 9 | F8: =INDIRECT(ADDRESS(RC1,1,3,1,Menus!R10C11)) -> Luxembourg | G8: =IF(INDIRECT(ADDRESS(RC1,2,3,1,Menus!R10C11))=R1C,RC4,NA()) -> NA() | H8: =IF(INDIRECT(ADDRESS(RC1,2,3,1,Menus!R10C11))=R1C,RC4,NA()) -> 33761.777777777781 | I8: =IF(INDIRECT(ADDRESS(RC1,2,3,1,Menus!R10C11))=R1C,RC4,NA()) -> NA() | J8: =IF(INDIRECT(ADDRESS(RC1,1,3,1,Menus!R10C11))=T(R1C),RC4,NA()) -> NA() | K8: =IF(OR(ISNUMBER(RC7),ISNUMBER(RC8),ISNUMBER(RC9),ISNUMBER(RC10)),1,0) -> 1 | M8: =OFFSET(INDIRECT(ADDRESS(RC1,3,3,1,"Gross")),0,Menus!R4C10) -> 1 | N8: =OFFSET(INDIRECT(ADDRESS(RC1,3,3,1,"Gross")),0,Menus!R3C10) -> 1
A9: 25 | B9: =OFFSET(INDIRECT(ADDRESS(RC1,3,3,1,Menus!R10C11)),0,Menus!R4C10) -> 1870 | C9: =OFFSET(INDIRECT(ADDRESS(RC1,3,3,1,Menus!R10C11)),0,Menus!R3C10) -> 59373118 | D9: =IF(Menus!R9C10,RC[-1]/RC[-2],RC[-1]) -> 31750.330481283421 | E9: =IF(RC11=1,VALUE(RC[-3]),NA()) -> 1870 | F9: =INDIRECT(ADDRESS(RC1,1,3,1,Menus!R10C11)) -> Netherlands | G9: =IF(INDIRECT(ADDRESS(RC1,2,3,1,Menus!R10C11))=R1C,RC4,NA()) -> NA() | H9: =IF(INDIRECT(ADDRESS(RC1,2,3,1,Menus!R10C11))=R1C,RC4,NA()) -> 31750.330481283421 | I9: =IF(INDIRECT(ADDRESS(RC1,2,3,1,Menus!R10C11))=R1C,RC4,NA()) -> NA() | J9: =IF(INDIRECT(ADDRESS(RC1,1,3,1,Menus!R10C11))=T(R1C),RC4,NA()) -> NA() | K9: =IF(OR(ISNUMBER(RC7),ISNUMBER(RC8),ISNUMBER(RC9),ISNUMBER(RC10)),1,0) -> 1 | M9: =OFFSET(INDIRECT(ADDRESS(RC1,3,3,1,"Gross")),0,Menus!R4C10) -> 1 | N9: =OFFSET(INDIRECT(ADDRESS(RC1,3,3,1,"Gross")),0,Menus!R3C10) -> 2
A10: 12 | B10: =OFFSET(INDIRECT(ADDRESS(RC1,3,3,1,Menus!R10C11)),0,Menus!R4C10) -> 941 | C10: =OFFSET(INDIRECT(ADDRESS(RC1,3,3,1,Menus!R10C11)),0,Menus!R3C10) -> 29650270 | D10: =IF(Menus!R9C10,RC[-1]/RC[-2],RC[-1]) -> 31509.319872476088 | E10: =IF(RC11=1,VALUE(RC[-3]),NA()) -> 941 | F10: =INDIRECT(ADDRESS(RC1,1,3,1,Menus!R10C11)) -> Austria | G10: =IF(INDIRECT(ADDRESS(RC1,2,3,1,Menus!R10C11))=R1C,RC4,NA()) -> NA() | H10: =IF(INDIRECT(ADDRESS(RC1,2,3,1,Menus!R10C11))=R1C,RC4,NA()) -> 31509.319872476088 | I10: =IF(INDIRECT(ADDRESS(RC1,2,3,1,Menus!R10C11))=R1C,RC4,NA()) -> NA() | J10: =IF(INDIRECT(ADDRESS(RC1,1,3,1,Menus!R10C11))=T(R1C),RC4,NA()) -> NA() | K10: =IF(OR(ISNUMBER(RC7),ISNUMBER(RC8),ISNUMBER(RC9),ISNUMBER(RC10)),1,0) -> 1 | M10: =OFFSET(INDIRECT(ADDRESS(RC1,3,3,1,"Gross")),0,Menus!R4C10) -> 2 | N10: =OFFSET(INDIRECT(ADDRESS(RC1,3,3,1,"Gross")),0,Menus!R3C10) -> 2
A11: 22 | B11: =OFFSET(INDIRECT(ADDRESS(RC1,3,3,1,Menus!R10C11)),0,Menus!R4C10) -> 6532 | C11: =OFFSET(INDIRECT(ADDRESS(RC1,3,3,1,Menus!R10C11)),0,Menus!R3C10) -> 203627804 | D11: =IF(Menus!R9C10,RC[-1]/RC[-2],RC[-1]) -> 31173.883037354561 | E11: =IF(RC11=1,VALUE(RC[-3]),NA()) -> 6532 | F11: =INDIRECT(ADDRESS(RC1,1,3,1,Menus!R10C11)) -> Italy | G11: =IF(INDIRECT(ADDRESS(RC1,2,3,1,Menus!R10C11))=R1C,RC4,NA()) -> NA() | H11: =IF(INDIRECT(ADDRESS(RC1,2,3,1,Menus!R10C11))=R1C,RC4,NA()) -> 31173.883037354561 | I11: =IF(INDIRECT(ADDRESS(RC1,2,3,1,Menus!R10C11))=R1C,RC4,NA()) -> NA() | J11: =IF(INDIRECT(ADDRESS(RC1,1,3,1,Menus!R10C11))=T(R1C),RC4,NA()) -> NA() | K11: =IF(OR(ISNUMBER(RC7),ISNUMBER(RC8),ISNUMBER(RC9),ISNUMBER(RC10)),1,0) -> 1 | M11: =OFFSET(INDIRECT(ADDRESS(RC1,3,3,1,"Gross")),0,Menus!R4C10) -> 2 | N11: =OFFSET(INDIRECT(ADDRESS(RC1,3,3,1,"Gross")),0,Menus!R3C10) -> 2
A12: 21 | B12: =OFFSET(INDIRECT(ADDRESS(RC1,3,3,1,Menus!R10C11)),0,Menus!R4C10) -> 54 | C12: =OFFSET(INDIRECT(ADDRESS(RC1,3,3,1,Menus!R10C11)),0,Menus!R3C10) -> 1484979 | D12: =IF(Menus!R9C10,RC[-1]/RC[-2],RC[-1]) -> 27499.611111111109 | E12: =IF(RC11=1,VALUE(RC[-3]),NA()) -> 54 | F12: =INDIRECT(ADDRESS(RC1,1,3,1,Menus!R10C11)) -> Iceland | G12: =IF(INDIRECT(ADDRESS(RC1,2,3,1,Menus!R10C11))=R1C,RC4,NA()) -> 27499.611111111109 | H12: =IF(INDIRECT(ADDRESS(RC1,2,3,1,Menus!R10C11))=R1C,RC4,NA()) -> NA() | I12: =IF(INDIRECT(ADDRESS(RC1,2,3,1,Menus!R10C11))=R1C,RC4,NA()) -> NA() | J12: =IF(INDIRECT(ADDRESS(RC1,1,3,1,Menus!R10C11))=T(R1C),RC4,NA()) -> NA() | K12: =IF(OR(ISNUMBER(RC7),ISNUMBER(RC8),ISNUMBER(RC9),ISNUMBER(RC10)),1,0) -> 1 | M12: =OFFSET(INDIRECT(ADDRESS(RC1,3,3,1,"Gross")),0,Menus!R4C10) -> 2 | N12: =OFFSET(INDIRECT(ADDRESS(RC1,3,3,1,"Gross")),0,Menus!R3C10) -> 2
A13: 18 | B13: =OFFSET(INDIRECT(ADDRESS(RC1,3,3,1,Menus!R10C11)),0,Menus!R4C10) -> 1448 | C13: =OFFSET(INDIRECT(ADDRESS(RC1,3,3,1,Menus!R10C11)),0,Menus!R3C10) -> 39607466 | D13: =IF(Menus!R9C10,RC[-1]/RC[-2],RC[-1]) -> 27353.222375690606 | E13: =IF(RC11=1,VALUE(RC[-3]),NA()) -> 1448 | F13: =INDIRECT(ADDRESS(RC1,1,3,1,Menus!R10C11)) -> Finland | G13: =IF(INDIRECT(ADDRESS(RC1,2,3,1,Menus!R10C11))=R1C,RC4,NA()) -> NA() | H13: =IF(INDIRECT(ADDRESS(RC1,2,3,1,Menus!R10C11))=R1C,RC4,NA()) -> 27353.222375690606 | I13: =IF(INDIRECT(ADDRESS(RC1,2,3,1,Menus!R10C11))=R1C,RC4,NA()) -> NA() | J13: =IF(INDIRECT(ADDRESS(RC1,1,3,1,Menus!R10C11))=T(R1C),RC4,NA()) -> NA() | K13: =IF(OR(ISNUMBER(RC7),ISNUMBER(RC8),ISNUMBER(RC9),ISNUMBER(RC10)),1,0) -> 1 | M13: =OFFSET(INDIRECT(ADDRESS(RC1,3,3,1,"Gross")),0,Menus!R4C10) -> 0 | N13: =OFFSET(INDIRECT(ADDRESS(RC1,3,3,1,"Gross")),0,Menus!R3C10) -> 0
A14: 13 | B14: =OFFSET(INDIRECT(ADDRESS(RC1,3,3,1,Menus!R10C11)),0,Menus!R4C10) -> 307 | C14: =OFFSET(INDIRECT(ADDRESS(RC1,3,3,1,Menus!R10C11)),0,Menus!R3C10) -> 8375210 | D14: =IF(Menus!R9C10,RC[-1]/RC[-2],RC[-1]) -> 27280.814332247555 | E14: =IF(RC11=1,VALUE(RC[-3]),NA()) -> 307 | F14: =INDIRECT(ADDRESS(RC1,1,3,1,Menus!R10C11)) -> België Nederlandstalige Universiteiten | G14: =IF(INDIRECT(ADDRESS(RC1,2,3,1,Menus!R10C11))=R1C,RC4,NA()) -> NA() | H14: =IF(INDIRECT(ADDRESS(RC1,2,3,1,Menus!R10C11))=R1C,RC4,NA()) -> NA() | I14: =IF(INDIRECT(ADDRESS(RC1,2,3,1,Menus!R10C11))=R1C,RC4,NA()) -> 27280.814332247555 | J14: =IF(INDIRECT(ADDRESS(RC1,1,3,1,Menus!R10C11))=T(R1C),RC4,NA()) -> 27280.814332247555 | K14: =IF(OR(ISNUMBER(RC7),ISNUMBER(RC8),ISNUMBER(RC9),ISNUMBER(RC10)),1,0) -> 1 | M14: =OFFSET(INDIRECT(ADDRESS(RC1,3,3,1,"Gross")),0,Menus!R4C10) -> 0 | N14: =OFFSET(INDIRECT(ADDRESS(RC1,3,3,1,"Gross")),0,Menus!R3C10) -> 0
A15: 32 | B15: =OFFSET(INDIRECT(ADDRESS(RC1,3,3,1,Menus!R10C11)),0,Menus!R4C10) -> 8869 | C15: =OFFSET(INDIRECT(ADDRESS(RC1,3,3,1,Menus!R10C11)),0,Menus!R3C10) -> 240640929 | D15: =IF(Menus!R9C10,RC[-1]/RC[-2],RC[-1]) -> 27132.814184237232 | E15: =IF(RC11=1,VALUE(RC[-3]),NA()) -> 8869 | F15: =INDIRECT(ADDRESS(RC1,1,3,1,Menus!R10C11)) -> Germany | G15: =IF(INDIRECT(ADDRESS(RC1,2,3,1,Menus!R10C11))=R1C,RC4,NA()) -> NA() | H15: =IF(INDIRECT(ADDRESS(RC1,2,3,1,Menus!R10C11))=R1C,RC4,NA()) -> 27132.814184237232 | I15: =IF(INDIRECT(ADDRESS(RC1,2,3,1,Menus!R10C11))=R1C,RC4,NA()) -> NA() | J15: =IF(INDIRECT(ADDRESS(RC1,1,3,1,Menus!R10C11))=T(R1C),RC4,NA()) -> NA() | K15: =IF(OR(ISNUMBER(RC7),ISNUMBER(RC8),ISNUMBER(RC9),ISNUMBER(RC10)),1,0) -> 1 | M15: =OFFSET(INDIRECT(ADDRESS(RC1,3,3,1,"Gross")),0,Menus!R4C10) -> 0 | N15: =OFFSET(INDIRECT(ADDRESS(RC1,3,3,1,"Gross")),0,Menus!R3C10) -> 0
A16: 15 | B16: =OFFSET(INDIRECT(ADDRESS(RC1,3,3,1,Menus!R10C11)),0,Menus!R4C10) -> 609 | C16: =OFFSET(INDIRECT(ADDRESS(RC1,3,3,1,Menus!R10C11)),0,Menus!R3C10) -> 15437393 | D16: =IF(Menus!R9C10,RC[-1]/RC[-2],RC[-1]) -> 25348.756978653531 | E16: =IF(RC11=1,VALUE(RC[-3]),NA()) -> 609 | F16: =INDIRECT(ADDRESS(RC1,1,3,1,Menus!R10C11)) -> Belgium | G16: =IF(INDIRECT(ADDRESS(RC1,2,3,1,Menus!R10C11))=R1C,RC4,NA()) -> NA() | H16: =IF(INDIRECT(ADDRESS(RC1,2,3,1,Menus!R10C11))=R1C,RC4,NA()) -> 25348.756978653531 | I16: =IF(INDIRECT(ADDRESS(RC1,2,3,1,Menus!R10C11))=R1C,RC4,NA()) -> NA() | J16: =IF(INDIRECT(ADDRESS(RC1,1,3,1,Menus!R10C11))=T(R1C),RC4,NA()) -> NA() | K16: =IF(OR(ISNUMBER(RC7),ISNUMBER(RC8),ISNUMBER(RC9),ISNUMBER(RC10)),1,0) -> 1 | M16: =OFFSET(INDIRECT(ADDRESS(RC1,3,3,1,"Gross")),0,Menus!R4C10) -> 0 | N16: =OFFSET(INDIRECT(ADDRESS(RC1,3,3,1,"Gross")),0,Menus!R3C10) -> 0
A17: 14 | B17: =OFFSET(INDIRECT(ADDRESS(RC1,3,3,1,Menus!R10C11)),0,Menus!R4C10) -> 301 | C17: =OFFSET(INDIRECT(ADDRESS(RC1,3,3,1,Menus!R10C11)),0,Menus!R3C10) -> 7062183 | D17: =IF(Menus!R9C10,RC[-1]/RC[-2],RC[-1]) -> 23462.401993355481 | E17: =IF(RC11=1,VALUE(RC[-3]),NA()) -> NA() | F17: =INDIRECT(ADDRESS(RC1,1,3,1,Menus!R10C11)) -> Belgique universités francophones | G17: =IF(INDIRECT(ADDRESS(RC1,2,3,1,Menus!R10C11))=R1C,RC4,NA()) -> NA() | H17: =IF(INDIRECT(ADDRESS(RC1,2,3,1,Menus!R10C11))=R1C,RC4,NA()) -> NA() | I17: =IF(INDIRECT(ADDRESS(RC1,2,3,1,Menus!R10C11))=R1C,RC4,NA()) -> NA() | J17: =IF(INDIRECT(ADDRESS(RC1,1,3,1,Menus!R10C11))=T(R1C),RC4,NA()) -> NA() | K17: =IF(OR(ISNUMBER(RC7),ISNUMBER(RC8),ISNUMBER(RC9),ISNUMBER(RC10)),1,0) -> 0 | M17: =OFFSET(INDIRECT(ADDRESS(RC1,3,3,1,"Gross")),0,Menus!R4C10) -> 0 | N17: =OFFSET(INDIRECT(ADDRESS(RC1,3,3,1,"Gross")),0,Menus!R3C10) -> 0 | P17: 0 | Q17: Returned Data for year 2000
A18: 30 | B18: =OFFSET(INDIRECT(ADDRESS(RC1,3,3,1,Menus!R10C11)),0,Menus!R4C10) -> 1429 | C18: =OFFSET(INDIRECT(ADDRESS(RC1,3,3,1,Menus!R10C11)),0,Menus!R3C10) -> 30070810 | D18: =IF(Menus!R9C10,RC[-1]/RC[-2],RC[-1]) -> 21043.254023792862 | E18: =IF(RC11=1,VALUE(RC[-3]),NA()) -> 1429 | F18: =INDIRECT(ADDRESS(RC1,1,3,1,Menus!R10C11)) -> Switzerland | G18: =IF(INDIRECT(ADDRESS(RC1,2,3,1,Menus!R10C11))=R1C,RC4,NA()) -> 21043.254023792862 | H18: =IF(INDIRECT(ADDRESS(RC1,2,3,1,Menus!R10C11))=R1C,RC4,NA()) -> NA() | I18: =IF(INDIRECT(ADDRESS(RC1,2,3,1,Menus!R10C11))=R1C,RC4,NA()) -> NA() | J18: =IF(INDIRECT(ADDRESS(RC1,1,3,1,Menus!R10C11))=T(R1C),RC4,NA()) -> NA() | K18: =IF(OR(ISNUMBER(RC7),ISNUMBER(RC8),ISNUMBER(RC9),ISNUMBER(RC10)),1,0) -> 1 | M18: =OFFSET(INDIRECT(ADDRESS(RC1,3,3,1,"Gross")),0,Menus!R4C10) -> 2 | N18: =OFFSET(INDIRECT(ADDRESS(RC1,3,3,1,"Gross")),0,Menus!R3C10) -> 2
A19: 17 | B19: =OFFSET(INDIRECT(ADDRESS(RC1,3,3,1,Menus!R10C11)),0,Menus!R4C10) -> 750 | C19: =OFFSET(INDIRECT(ADDRESS(RC1,3,3,1,Menus!R10C11)),0,Menus!R3C10) -> 15063180 | D19: =IF(Menus!R9C10,RC[-1]/RC[-2],RC[-1]) -> 20084.240000000002 | E19: =IF(RC11=1,VALUE(RC[-3]),NA()) -> 750 | F19: =INDIRECT(ADDRESS(RC1,1,3,1,Menus!R10C11)) -> Eire | G19: =IF(INDIRECT(ADDRESS(RC1,2,3,1,Menus!R10C11))=R1C,RC4,NA()) -> NA() | H19: =IF(INDIRECT(ADDRESS(RC1,2,3,1,Menus!R10C11))=R1C,RC4,NA()) -> 20084.240000000002 | I19: =IF(INDIRECT(ADDRESS(RC1,2,3,1,Menus!R10C11))=R1C,RC4,NA()) -> NA() | J19: =IF(INDIRECT(ADDRESS(RC1,1,3,1,Menus!R10C11))=T(R1C),RC4,NA()) -> NA() | K19: =IF(OR(ISNUMBER(RC7),ISNUMBER(RC8),ISNUMBER(RC9),ISNUMBER(RC10)),1,0) -> 1 | M19: =OFFSET(INDIRECT(ADDRESS(RC1,3,3,1,"Gross")),0,Menus!R4C10) -> 2 | N19: =OFFSET(INDIRECT(ADDRESS(RC1,3,3,1,"Gross")),0,Menus!R3C10) -> 2
A20: 28 | B20: =OFFSET(INDIRECT(ADDRESS(RC1,3,3,1,Menus!R10C11)),0,Menus!R4C10) -> 7430 | C20: =OFFSET(INDIRECT(ADDRESS(RC1,3,3,1,Menus!R10C11)),0,Menus!R3C10) -> 122788945 | D20: =IF(Menus!R9C10,RC[-1]/RC[-2],RC[-1]) -> 16526.102960969045 | E20: =IF(RC11=1,VALUE(RC[-3]),NA()) -> 7430 | F20: =INDIRECT(ADDRESS(RC1,1,3,1,Menus!R10C11)) -> Spain | G20: =IF(INDIRECT(ADDRESS(RC1,2,3,1,Menus!R10C11))=R1C,RC4,NA()) -> NA() | H20: =IF(INDIRECT(ADDRESS(RC1,2,3,1,Menus!R10C11))=R1C,RC4,NA()) -> 16526.102960969045 | I20: =IF(INDIRECT(ADDRESS(RC1,2,3,1,Menus!R10C11))=R1C,RC4,NA()) -> NA() | J20: =IF(INDIRECT(ADDRESS(RC1,1,3,1,Menus!R10C11))=T(R1C),RC4,NA()) -> NA() | K20: =IF(OR(ISNUMBER(RC7),ISNUMBER(RC8),ISNUMBER(RC9),ISNUMBER(RC10)),1,0) -> 1 | M20: =OFFSET(INDIRECT(ADDRESS(RC1,3,3,1,"Gross")),0,Menus!R4C10) -> 1 | N20: =OFFSET(INDIRECT(ADDRESS(RC1,3,3,1,"Gross")),0,Menus!R3C10) -> 1
A21: 27 | B21: =OFFSET(INDIRECT(ADDRESS(RC1,3,3,1,Menus!R10C11)),0,Menus!R4C10) -> 1215 | C21: =OFFSET(INDIRECT(ADDRESS(RC1,3,3,1,Menus!R10C11)),0,Menus!R3C10) -> 7048520 | D21: =IF(Menus!R9C10,RC[-1]/RC[-2],RC[-1]) -> 5801.2510288065841 | E21: =IF(RC11=1,VALUE(RC[-3]),NA()) -> 1215 | F21: =INDIRECT(ADDRESS(RC1,1,3,1,Menus!R10C11)) -> Portugal | G21: =IF(INDIRECT(ADDRESS(RC1,2,3,1,Menus!R10C11))=R1C,RC4,NA()) -> NA() | H21: =IF(INDIRECT(ADDRESS(RC1,2,3,1,Menus!R10C11))=R1C,RC4,NA()) -> 5801.2510288065841 | I21: =IF(INDIRECT(ADDRESS(RC1,2,3,1,Menus!R10C11))=R1C,RC4,NA()) -> NA() | J21: =IF(INDIRECT(ADDRESS(RC1,1,3,1,Menus!R10C11))=T(R1C),RC4,NA()) -> NA() | K21: =IF(OR(ISNUMBER(RC7),ISNUMBER(RC8),ISNUMBER(RC9),ISNUMBER(RC10)),1,0) -> 1 | M21: =OFFSET(INDIRECT(ADDRESS(RC1,3,3,1,"Gross")),0,Menus!R4C10) -> 1 | N21: =OFFSET(INDIRECT(ADDRESS(RC1,3,3,1,"Gross")),0,Menus!R3C10) -> 1 | P21: 2 | Q21: Grossed on regional averages
A22: 20 | B22: =OFFSET(INDIRECT(ADDRESS(RC1,3,3,1,Menus!R10C11)),0,Menus!R4C10) -> 1123 | C22: =OFFSET(INDIRECT(ADDRESS(RC1,3,3,1,Menus!R10C11)),0,Menus!R3C10) -> 4055275 | D22: =IF(Menus!R9C10,RC[-1]/RC[-2],RC[-1]) -> 3611.1086375779164 | E22: =IF(RC11=1,VALUE(RC[-3]),NA()) -> 1123 | F22: =INDIRECT(ADDRESS(RC1,1,3,1,Menus!R10C11)) -> Greece | G22: =IF(INDIRECT(ADDRESS(RC1,2,3,1,Menus!R10C11))=R1C,RC4,NA()) -> NA() | H22: =IF(INDIRECT(ADDRESS(RC1,2,3,1,Menus!R10C11))=R1C,RC4,NA()) -> 3611.1086375779164 | I22: =IF(INDIRECT(ADDRESS(RC1,2,3,1,Menus!R10C11))=R1C,RC4,NA()) -> NA() | J22: =IF(INDIRECT(ADDRESS(RC1,1,3,1,Menus!R10C11))=T(R1C),RC4,NA()) -> NA() | K22: =IF(OR(ISNUMBER(RC7),ISNUMBER(RC8),ISNUMBER(RC9),ISNUMBER(RC10)),1,0) -> 1 | M22: =OFFSET(INDIRECT(ADDRESS(RC1,3,3,1,"Gross")),0,Menus!R4C10) -> 0 | N22: =OFFSET(INDIRECT(ADDRESS(RC1,3,3,1,"Gross")),0,Menus!R3C10) -> 1
A23: 176 | B23: =OFFSET(INDIRECT(ADDRESS(RC1,3,3,1,Menus!R10C11)),0,Menus!R4C10) -> 0 | C23: =OFFSET(INDIRECT(ADDRESS(RC1,3,3,1,Menus!R10C11)),0,Menus!R3C10) -> 0 | D23: =IF(Menus!R9C10,RC[-1]/RC[-2],RC[-1]) -> #DIV/0! | E23: =IF(RC11=1,VALUE(RC[-3]),NA()) -> NA() | F23: =INDIRECT(ADDRESS(RC1,1,3,1,Menus!R10C11)) -> 0 | G23: =IF(INDIRECT(ADDRESS(RC1,2,3,1,Menus!R10C11))=R1C,RC4,NA()) -> NA() | H23: =IF(INDIRECT(ADDRESS(RC1,2,3,1,Menus!R10C11))=R1C,RC4,NA()) -> NA() | I23: =IF(INDIRECT(ADDRESS(RC1,2,3,1,Menus!R10C11))=R1C,RC4,NA()) -> NA() | J23: =IF(INDIRECT(ADDRESS(RC1,1,3,1,Menus!R10C11))=T(R1C),RC4,NA()) -> NA() | K23: =IF(OR(ISNUMBER(RC7),ISNUMBER(RC8),ISNUMBER(RC9),ISNUMBER(RC10)),1,0) -> 0 | M23: =OFFSET(INDIRECT(ADDRESS(RC1,3,3,1,"Gross")),0,Menus!R4C10) -> 0 | N23: =OFFSET(INDIRECT(ADDRESS(RC1,3,3,1,"Gross")),0,Menus!R3C10) -> 0
A24: 129 | B24: =OFFSET(INDIRECT(ADDRESS(RC1,3,3,1,Menus!R10C11)),0,Menus!R4C10) -> 0 | C24: =OFFSET(INDIRECT(ADDRESS(RC1,3,3,1,Menus!R10C11)),0,Menus!R3C10) -> 0 | D24: =IF(Menus!R9C10,RC[-1]/RC[-2],RC[-1]) -> #DIV/0! | E24: =IF(RC11=1,VALUE(RC[-3]),NA()) -> NA() | F24: =INDIRECT(ADDRESS(RC1,1,3,1,Menus!R10C11)) -> 0 | G24: =IF(INDIRECT(ADDRESS(RC1,2,3,1,Menus!R10C11))=R1C,RC4,NA()) -> NA() | H24: =IF(INDIRECT(ADDRESS(RC1,2,3,1,Menus!R10C11))=R1C,RC4,NA()) -> NA() | I24: =IF(INDIRECT(ADDRESS(RC1,2,3,1,Menus!R10C11))=R1C,RC4,NA()) -> NA() | J24: =IF(INDIRECT(ADDRESS(RC1,1,3,1,Menus!R10C11))=T(R1C),RC4,NA()) -> NA() | K24: =IF(OR(ISNUMBER(RC7),ISNUMBER(RC8),ISNUMBER(RC9),ISNUMBER(RC10)),1,0) -> 0 | M24: =OFFSET(INDIRECT(ADDRESS(RC1,3,3,1,"Gross")),0,Menus!R4C10) -> 0 | N24: =OFFSET(INDIRECT(ADDRESS(RC1,3,3,1,"Gross")),0,Menus!R3C10) -> 0
A25: 125 | B25: =OFFSET(INDIRECT(ADDRESS(RC1,3,3,1,Menus!R10C11)),0,Menus!R4C10) -> 0 | C25: =OFFSET(INDIRECT(ADDRESS(RC1,3,3,1,Menus!R10C11)),0,Menus!R3C10) -> 0 | D25: =IF(Menus!R9C10,RC[-1]/RC[-2],RC[-1]) -> #DIV/0! | E25: =IF(RC11=1,VALUE(RC[-3]),NA()) -> NA() | F25: =INDIRECT(ADDRESS(RC1,1,3,1,Menus!R10C11)) -> 0 | G25: =IF(INDIRECT(ADDRESS(RC1,2,3,1,Menus!R10C11))=R1C,RC4,NA()) -> NA() | H25: =IF(INDIRECT(ADDRESS(RC1,2,3,1,Menus!R10C11))=R1C,RC4,NA()) -> NA() | I25: =IF(INDIRECT(ADDRESS(RC1,2,3,1,Menus!R10C11))=R1C,RC4,NA()) -> NA() | J25: =IF(INDIRECT(ADDRESS(RC1,1,3,1,Menus!R10C11))=T(R1C),RC4,NA()) -> NA() | K25: =IF(OR(ISNUMBER(RC7),ISNUMBER(RC8),ISNUMBER(RC9),ISNUMBER(RC10)),1,0) -> 0 | M25: =OFFSET(INDIRECT(ADDRESS(RC1,3,3,1,"Gross")),0,Menus!R4C10) -> 0 | N25: =OFFSET(INDIRECT(ADDRESS(RC1,3,3,1,"Gross")),0,Menus!R3C10) -> 0
A26: 47 | B26: =OFFSET(INDIRECT(ADDRESS(RC1,3,3,1,Menus!R10C11)),0,Menus!R4C10) -> 0 | C26: =OFFSET(INDIRECT(ADDRESS(RC1,3,3,1,Menus!R10C11)),0,Menus!R3C10) -> 0 | D26: =IF(Menus!R9C10,RC[-1]/RC[-2],RC[-1]) -> #DIV/0! | E26: =IF(RC11=1,VALUE(RC[-3]),NA()) -> NA() | F26: =INDIRECT(ADDRESS(RC1,1,3,1,Menus!R10C11)) -> 0 | G26: =IF(INDIRECT(ADDRESS(RC1,2,3,1,Menus!R10C11))=R1C,RC4,NA()) -> NA() | H26: =IF(INDIRECT(ADDRESS(RC1,2,3,1,Menus!R10C11))=R1C,RC4,NA()) -> NA() | I26: =IF(INDIRECT(ADDRESS(RC1,2,3,1,Menus!R10C11))=R1C,RC4,NA()) -> NA() | J26: =IF(INDIRECT(ADDRESS(RC1,1,3,1,Menus!R10C11))=T(R1C),RC4,NA()) -> NA() | K26: =IF(OR(ISNUMBER(RC7),ISNUMBER(RC8),ISNUMBER(RC9),ISNUMBER(RC10)),1,0) -> 0 | M26: =OFFSET(INDIRECT(ADDRESS(RC1,3,3,1,"Gross")),0,Menus!R4C10) -> 1 | N26: =OFFSET(INDIRECT(ADDRESS(RC1,3,3,1,"Gross")),0,Menus!R3C10) -> 0
A27: 187 | B27: =OFFSET(INDIRECT(ADDRESS(RC1,3,3,1,Menus!R10C11)),0,Menus!R4C10) -> 0 | C27: =OFFSET(INDIRECT(ADDRESS(RC1,3,3,1,Menus!R10C11)),0,Menus!R3C10) -> 0 | D27: =IF(Menus!R9C10,RC[-1]/RC[-2],RC[-1]) -> #DIV/0! | E27: =IF(RC11=1,VALUE(RC[-3]),NA()) -> NA() | F27: =INDIRECT(ADDRESS(RC1,1,3,1,Menus!R10C11)) -> 0 | G27: =IF(INDIRECT(ADDRESS(RC1,2,3,1,Menus!R10C11))=R1C,RC4,NA()) -> NA() | H27: =IF(INDIRECT(ADDRESS(RC1,2,3,1,Menus!R10C11))=R1C,RC4,NA()) -> NA() | I27: =IF(INDIRECT(ADDRESS(RC1,2,3,1,Menus!R10C11))=R1C,RC4,NA()) -> NA() | J27: =IF(INDIRECT(ADDRESS(RC1,1,3,1,Menus!R10C11))=T(R1C),RC4,NA()) -> NA() | K27: =IF(OR(ISNUMBER(RC7),ISNUMBER(RC8),ISNUMBER(RC9),ISNUMBER(RC10)),1,0) -> 0 | M27: =OFFSET(INDIRECT(ADDRESS(RC1,3,3,1,"Gross")),0,Menus!R4C10) -> 0 | N27: =OFFSET(INDIRECT(ADDRESS(RC1,3,3,1,"Gross")),0,Menus!R3C10) -> 0
A28: 122 | B28: =OFFSET(INDIRECT(ADDRESS(RC1,3,3,1,Menus!R10C11)),0,Menus!R4C10) -> 0 | C28: =OFFSET(INDIRECT(ADDRESS(RC1,3,3,1,Menus!R10C11)),0,Menus!R3C10) -> 0 | D28: =IF(Menus!R9C10,RC[-1]/RC[-2],RC[-1]) -> #DIV/0! | E28: =IF(RC11=1,VALUE(RC[-3]),NA()) -> NA() | F28: =INDIRECT(ADDRESS(RC1,1,3,1,Menus!R10C11)) -> 0 | G28: =IF(INDIRECT(ADDRESS(RC1,2,3,1,Menus!R10C11))=R1C,RC4,NA()) -> NA() | H28: =IF(INDIRECT(ADDRESS(RC1,2,3,1,Menus!R10C11))=R1C,RC4,NA()) -> NA() | I28: =IF(INDIRECT(ADDRESS(RC1,2,3,1,Menus!R10C11))=R1C,RC4,NA()) -> NA() | J28: =IF(INDIRECT(ADDRESS(RC1,1,3,1,Menus!R10C11))=T(R1C),RC4,NA()) -> NA() | K28: =IF(OR(ISNUMBER(RC7),ISNUMBER(RC8),ISNUMBER(RC9),ISNUMBER(RC10)),1,0) -> 0 | M28: =OFFSET(INDIRECT(ADDRESS(RC1,3,3,1,"Gross")),0,Menus!R4C10) -> -1 | N28: =OFFSET(INDIRECT(ADDRESS(RC1,3,3,1,"Gross")),0,Menus!R3C10) -> 0
A29: 86 | B29: =OFFSET(INDIRECT(ADDRESS(RC1,3,3,1,Menus!R10C11)),0,Menus!R4C10) -> 0 | C29: =OFFSET(INDIRECT(ADDRESS(RC1,3,3,1,Menus!R10C11)),0,Menus!R3C10) -> 0 | D29: =IF(Menus!R9C10,RC[-1]/RC[-2],RC[-1]) -> #DIV/0! | E29: =IF(RC11=1,VALUE(RC[-3]),NA()) -> NA() | F29: =INDIRECT(ADDRESS(RC1,1,3,1,Menus!R10C11)) -> 0 | G29: =IF(INDIRECT(ADDRESS(RC1,2,3,1,Menus!R10C11))=R1C,RC4,NA()) -> NA() | H29: =IF(INDIRECT(ADDRESS(RC1,2,3,1,Menus!R10C11))=R1C,RC4,NA()) -> NA() | I29: =IF(INDIRECT(ADDRESS(RC1,2,3,1,Menus!R10C11))=R1C,RC4,NA()) -> NA() | J29: =IF(INDIRECT(ADDRESS(RC1,1,3,1,Menus!R10C11))=T(R1C),RC4,NA()) -> NA() | K29: =IF(OR(ISNUMBER(RC7),ISNUMBER(RC8),ISNUMBER(RC9),ISNUMBER(RC10)),1,0) -> 0 | M29: =OFFSET(INDIRECT(ADDRESS(RC1,3,3,1,"Gross")),0,Menus!R4C10) -> 0 | N29: =OFFSET(INDIRECT(ADDRESS(RC1,3,3,1,"Gross")),0,Menus!R3C10) -> 0
A30: 167 | B30: =OFFSET(INDIRECT(ADDRESS(RC1,3,3,1,Menus!R10C11)),0,Menus!R4C10) -> 0 | C30: =OFFSET(INDIRECT(ADDRESS(RC1,3,3,1,Menus!R10C11)),0,Menus!R3C10) -> 0 | D30: =IF(Menus!R9C10,RC[-1]/RC[-2],RC[-1]) -> #DIV/0! | E30: =IF(RC11=1,VALUE(RC[-3]),NA()) -> NA() | F30: =INDIRECT(ADDRESS(RC1,1,3,1,Menus!R10C11)) -> 0 | G30: =IF(INDIRECT(ADDRESS(RC1,2,3,1,Menus!R10C11))=R1C,RC4,NA()) -> NA() | H30: =IF(INDIRECT(ADDRESS(RC1,2,3,1,Menus!R10C11))=R1C,RC4,NA()) -> NA() | I30: =IF(INDIRECT(ADDRESS(RC1,2,3,1,Menus!R10C11))=R1C,RC4,NA()) -> NA() | J30: =IF(INDIRECT(ADDRESS(RC1,1,3,1,Menus!R10C11))=T(R1C),RC4,NA()) -> NA() | K30: =IF(OR(ISNUMBER(RC7),ISNUMBER(RC8),ISNUMBER(RC9),ISNUMBER(RC10)),1,0) -> 0 | M30: =OFFSET(INDIRECT(ADDRESS(RC1,3,3,1,"Gross")),0,Menus!R4C10) -> 0 | N30: =OFFSET(INDIRECT(ADDRESS(RC1,3,3,1,"Gross")),0,Menus!R3C10) -> 0
A31: 113 | B31: =OFFSET(INDIRECT(ADDRESS(RC1,3,3,1,Menus!R10C11)),0,Menus!R4C10) -> 0 | C31: =OFFSET(INDIRECT(ADDRESS(RC1,3,3,1,Menus!R10C11)),0,Menus!R3C10) -> 0 | D31: =IF(Menus!R9C10,RC[-1]/RC[-2],RC[-1]) -> #DIV/0! | E31: =IF(RC11=1,VALUE(RC[-3]),NA()) -> NA() | F31: =INDIRECT(ADDRESS(RC1,1,3,1,Menus!R10C11)) -> 0 | G31: =IF(INDIRECT(ADDRESS(RC1,2,3,1,Menus!R10C11))=R1C,RC4,NA()) -> NA() | H31: =IF(INDIRECT(ADDRESS(RC1,2,3,1,Menus!R10C11))=R1C,RC4,NA()) -> NA() | I31: =IF(INDIRECT(ADDRESS(RC1,2,3,1,Menus!R10C11))=R1C,RC4,NA()) -> NA() | J31: =IF(INDIRECT(ADDRESS(RC1,1,3,1,Menus!R10C11))=T(R1C),RC4,NA()) -> NA() | K31: =IF(OR(ISNUMBER(RC7),ISNUMBER(RC8),ISNUMBER(RC9),ISNUMBER(RC10)),1,0) -> 0 | M31: =OFFSET(INDIRECT(ADDRESS(RC1,3,3,1,"Gross")),0,Menus!R4C10) -> 0 | N31: =OFFSET(INDIRECT(ADDRESS(RC1,3,3,1,"Gross")),0,Menus!R3C10) -> 0
A32: 119 | B32: =OFFSET(INDIRECT(ADDRESS(RC1,3,3,1,Menus!R10C11)),0,Menus!R4C10) -> 0 | C32: =OFFSET(INDIRECT(ADDRESS(RC1,3,3,1,Menus!R10C11)),0,Menus!R3C10) -> 0 | D32: =IF(Menus!R9C10,RC[-1]/RC[-2],RC[-1]) -> #DIV/0! | E32: =IF(RC11=1,VALUE(RC[-3]),NA()) -> NA() | F32: =INDIRECT(ADDRESS(RC1,1,3,1,Menus!R10C11)) -> 0 | G32: =IF(INDIRECT(ADDRESS(RC1,2,3,1,Menus!R10C11))=R1C,RC4,NA()) -> NA() | H32: =IF(INDIRECT(ADDRESS(RC1,2,3,1,Menus!R10C11))=R1C,RC4,NA()) -> NA() | I32: =IF(INDIRECT(ADDRESS(RC1,2,3,1,Menus!R10C11))=R1C,RC4,NA()) -> NA() | J32: =IF(INDIRECT(ADDRESS(RC1,1,3,1,Menus!R10C11))=T(R1C),RC4,NA()) -> NA() | K32: =IF(OR(ISNUMBER(RC7),ISNUMBER(RC8),ISNUMBER(RC9),ISNUMBER(RC10)),1,0) -> 0 | M32: =OFFSET(INDIRECT(ADDRESS(RC1,3,3,1,"Gross")),0,Menus!R4C10) -> 0 | N32: =OFFSET(INDIRECT(ADDRESS(RC1,3,3,1,"Gross")),0,Menus!R3C10) -> 0
A33: 91 | B33: =OFFSET(INDIRECT(ADDRESS(RC1,3,3,1,Menus!R10C11)),0,Menus!R4C10) -> 0 | C33: =OFFSET(INDIRECT(ADDRESS(RC1,3,3,1,Menus!R10C11)),0,Menus!R3C10) -> 0 | D33: =IF(Menus!R9C10,RC[-1]/RC[-2],RC[-1]) -> #DIV/0! | E33: =IF(RC11=1,VALUE(RC[-3]),NA()) -> NA() | F33: =INDIRECT(ADDRESS(RC1,1,3,1,Menus!R10C11)) -> 0 | G33: =IF(INDIRECT(ADDRESS(RC1,2,3,1,Menus!R10C11))=R1C,RC4,NA()) -> NA() | H33: =IF(INDIRECT(ADDRESS(RC1,2,3,1,Menus!R10C11))=R1C,RC4,NA()) -> NA() | I33: =IF(INDIRECT(ADDRESS(RC1,2,3,1,Menus!R10C11))=R1C,RC4,NA()) -> NA() | J33: =IF(INDIRECT(ADDRESS(RC1,1,3,1,Menus!R10C11))=T(R1C),RC4,NA()) -> NA() | K33: =IF(OR(ISNUMBER(RC7),ISNUMBER(RC8),ISNUMBER(RC9),ISNUMBER(RC10)),1,0) -> 0 | M33: =OFFSET(INDIRECT(ADDRESS(RC1,3,3,1,"Gross")),0,Menus!R4C10) -> 0 | N33: =OFFSET(INDIRECT(ADDRESS(RC1,3,3,1,"Gross")),0,Menus!R3C10) -> 0
A34: 75 | B34: =OFFSET(INDIRECT(ADDRESS(RC1,3,3,1,Menus!R10C11)),0,Menus!R4C10) -> 0 | C34: =OFFSET(INDIRECT(ADDRESS(RC1,3,3,1,Menus!R10C11)),0,Menus!R3C10) -> 0 | D34: =IF(Menus!R9C10,RC[-1]/RC[-2],RC[-1]) -> #DIV/0! | E34: =IF(RC11=1,VALUE(RC[-3]),NA()) -> NA() | F34: =INDIRECT(ADDRESS(RC1,1,3,1,Menus!R10C11)) -> 0 | G34: =IF(INDIRECT(ADDRESS(RC1,2,3,1,Menus!R10C11))=R1C,RC4,NA()) -> NA() | H34: =IF(INDIRECT(ADDRESS(RC1,2,3,1,Menus!R10C11))=R1C,RC4,NA()) -> NA() | I34: =IF(INDIRECT(ADDRESS(RC1,2,3,1,Menus!R10C11))=R1C,RC4,NA()) -> NA() | J34: =IF(INDIRECT(ADDRESS(RC1,1,3,1,Menus!R10C11))=T(R1C),RC4,NA()) -> NA() | K34: =IF(OR(ISNUMBER(RC7),ISNUMBER(RC8),ISNUMBER(RC9),ISNUMBER(RC10)),1,0) -> 0 | M34: =OFFSET(INDIRECT(ADDRESS(RC1,3,3,1,"Gross")),0,Menus!R4C10) -> 0 | N34: =OFFSET(INDIRECT(ADDRESS(RC1,3,3,1,"Gross")),0,Menus!R3C10) -> 0
A35: 65 | B35: =OFFSET(INDIRECT(ADDRESS(RC1,3,3,1,Menus!R10C11)),0,Menus!R4C10) -> 0 | C35: =OFFSET(INDIRECT(ADDRESS(RC1,3,3,1,Menus!R10C11)),0,Menus!R3C10) -> 0 | D35: =IF(Menus!R9C10,RC[-1]/RC[-2],RC[-1]) -> #DIV/0! | E35: =IF(RC11=1,VALUE(RC[-3]),NA()) -> NA() | F35: =INDIRECT(ADDRESS(RC1,1,3,1,Menus!R10C11)) -> 0 | G35: =IF(INDIRECT(ADDRESS(RC1,2,3,1,Menus!R10C11))=R1C,RC4,NA()) -> NA() | H35: =IF(INDIRECT(ADDRESS(RC1,2,3,1,Menus!R10C11))=R1C,RC4,NA()) -> NA() | I35: =IF(INDIRECT(ADDRESS(RC1,2,3,1,Menus!R10C11))=R1C,RC4,NA()) -> NA() | J35: =IF(INDIRECT(ADDRESS(RC1,1,3,1,Menus!R10C11))=T(R1C),RC4,NA()) -> NA() | K35: =IF(OR(ISNUMBER(RC7),ISNUMBER(RC8),ISNUMBER(RC9),ISNUMBER(RC10)),1,0) -> 0 | M35: =OFFSET(INDIRECT(ADDRESS(RC1,3,3,1,"Gross")),0,Menus!R4C10) -> 1 | N35: =OFFSET(INDIRECT(ADDRESS(RC1,3,3,1,"Gross")),0,Menus!R3C10) -> 2
A36: 49 | B36: =OFFSET(INDIRECT(ADDRESS(RC1,3,3,1,Menus!R10C11)),0,Menus!R4C10) -> 0 | C36: =OFFSET(INDIRECT(ADDRESS(RC1,3,3,1,Menus!R10C11)),0,Menus!R3C10) -> 0 | D36: =IF(Menus!R9C10,RC[-1]/RC[-2],RC[-1]) -> #DIV/0! | E36: =IF(RC11=1,VALUE(RC[-3]),NA()) -> NA() | F36: =INDIRECT(ADDRESS(RC1,1,3,1,Menus!R10C11)) -> 0 | G36: =IF(INDIRECT(ADDRESS(RC1,2,3,1,Menus!R10C11))=R1C,RC4,NA()) -> NA() | H36: =IF(INDIRECT(ADDRESS(RC1,2,3,1,Menus!R10C11))=R1C,RC4,NA()) -> NA() | I36: =IF(INDIRECT(ADDRESS(RC1,2,3,1,Menus!R10C11))=R1C,RC4,NA()) -> NA() | J36: =IF(INDIRECT(ADDRESS(RC1,1,3,1,Menus!R10C11))=T(R1C),RC4,NA()) -> NA() | K36: =IF(OR(ISNUMBER(RC7),ISNUMBER(RC8),ISNUMBER(RC9),ISNUMBER(RC10)),1,0) -> 0 | M36: =OFFSET(INDIRECT(ADDRESS(RC1,3,3,1,"Gross")),0,Menus!R4C10) -> 0 | N36: =OFFSET(INDIRECT(ADDRESS(RC1,3,3,1,"Gross")),0,Menus!R3C10) -> 0
A37: 171 | B37: =OFFSET(INDIRECT(ADDRESS(RC1,3,3,1,Menus!R10C11)),0,Menus!R4C10) -> 0 | C37: =OFFSET(INDIRECT(ADDRESS(RC1,3,3,1,Menus!R10C11)),0,Menus!R3C10) -> 0 | D37: =IF(Menus!R9C10,RC[-1]/RC[-2],RC[-1]) -> #DIV/0! | E37: =IF(RC11=1,VALUE(RC[-3]),NA()) -> NA() | F37: =INDIRECT(ADDRESS(RC1,1,3,1,Menus!R10C11)) -> 0 | G37: =IF(INDIRECT(ADDRESS(RC1,2,3,1,Menus!R10C11))=R1C,RC4,NA()) -> NA() | H37: =IF(INDIRECT(ADDRESS(RC1,2,3,1,Menus!R10C11))=R1C,RC4,NA()) -> NA() | I37: =IF(INDIRECT(ADDRESS(RC1,2,3,1,Menus!R10C11))=R1C,RC4,NA()) -> NA() | J37: =IF(INDIRECT(ADDRESS(RC1,1,3,1,Menus!R10C11))=T(R1C),RC4,NA()) -> NA() | K37: =IF(OR(ISNUMBER(RC7),ISNUMBER(RC8),ISNUMBER(RC9),ISNUMBER(RC10)),1,0) -> 0 | M37: =OFFSET(INDIRECT(ADDRESS(RC1,3,3,1,"Gross")),0,Menus!R4C10) -> 0 | N37: =OFFSET(INDIRECT(ADDRESS(RC1,3,3,1,"Gross")),0,Menus!R3C10) -> 0
A38: 138 | B38: =OFFSET(INDIRECT(ADDRESS(RC1,3,3,1,Menus!R10C11)),0,Menus!R4C10) -> 0 | C38: =OFFSET(INDIRECT(ADDRESS(RC1,3,3,1,Menus!R10C11)),0,Menus!R3C10) -> 0 | D38: =IF(Menus!R9C10,RC[-1]/RC[-2],RC[-1]) -> #DIV/0! | E38: =IF(RC11=1,VALUE(RC[-3]),NA()) -> NA() | F38: =INDIRECT(ADDRESS(RC1,1,3,1,Menus!R10C11)) -> 0 | G38: =IF(INDIRECT(ADDRESS(RC1,2,3,1,Menus!R10C11))=R1C,RC4,NA()) -> NA() | H38: =IF(INDIRECT(ADDRESS(RC1,2,3,1,Menus!R10C11))=R1C,RC4,NA()) -> NA() | I38: =IF(INDIRECT(ADDRESS(RC1,2,3,1,Menus!R10C11))=R1C,RC4,NA()) -> NA() | J38: =IF(INDIRECT(ADDRESS(RC1,1,3,1,Menus!R10C11))=T(R1C),RC4,NA()) -> NA() | K38: =IF(OR(ISNUMBER(RC7),ISNUMBER(RC8),ISNUMBER(RC9),ISNUMBER(RC10)),1,0) -> 0 | M38: =OFFSET(INDIRECT(ADDRESS(RC1,3,3,1,"Gross")),0,Menus!R4C10) -> 0 | N38: =OFFSET(INDIRECT(ADDRESS(RC1,3,3,1,"Gross")),0,Menus!R3C10) -> 0
A39: 107 | B39: =OFFSET(INDIRECT(ADDRESS(RC1,3,3,1,Menus!R10C11)),0,Menus!R4C10) -> 0 | C39: =OFFSET(INDIRECT(ADDRESS(RC1,3,3,1,Menus!R10C11)),0,Menus!R3C10) -> 0 | D39: =IF(Menus!R9C10,RC[-1]/RC[-2],RC[-1]) -> #DIV/0! | E39: =IF(RC11=1,VALUE(RC[-3]),NA()) -> NA() | F39: =INDIRECT(ADDRESS(RC1,1,3,1,Menus!R10C11)) -> 0 | G39: =IF(INDIRECT(ADDRESS(RC1,2,3,1,Menus!R10C11))=R1C,RC4,NA()) -> NA() | H39: =IF(INDIRECT(ADDRESS(RC1,2,3,1,Menus!R10C11))=R1C,RC4,NA()) -> NA() | I39: =IF(INDIRECT(ADDRESS(RC1,2,3,1,Menus!R10C11))=R1C,RC4,NA()) -> NA() | J39: =IF(INDIRECT(ADDRESS(RC1,1,3,1,Menus!R10C11))=T(R1C),RC4,NA()) -> NA() | K39: =IF(OR(ISNUMBER(RC7),ISNUMBER(RC8),ISNUMBER(RC9),ISNUMBER(RC10)),1,0) -> 0 | M39: =OFFSET(INDIRECT(ADDRESS(RC1,3,3,1,"Gross")),0,Menus!R4C10) -> 0 | N39: =OFFSET(INDIRECT(ADDRESS(RC1,3,3,1,"Gross")),0,Menus!R3C10) -> 0
A40: 67 | B40: =OFFSET(INDIRECT(ADDRESS(RC1,3,3,1,Menus!R10C11)),0,Menus!R4C10) -> 0 | C40: =OFFSET(INDIRECT(ADDRESS(RC1,3,3,1,Menus!R10C11)),0,Menus!R3C10) -> 0 | D40: =IF(Menus!R9C10,RC[-1]/RC[-2],RC[-1]) -> #DIV/0! | E40: =IF(RC11=1,VALUE(RC[-3]),NA()) -> NA() | F40: =INDIRECT(ADDRESS(RC1,1,3,1,Menus!R10C11)) -> 0 | G40: =IF(INDIRECT(ADDRESS(RC1,2,3,1,Menus!R10C11))=R1C,RC4,NA()) -> NA() | H40: =IF(INDIRECT(ADDRESS(RC1,2,3,1,Menus!R10C11))=R1C,RC4,NA()) -> NA() | I40: =IF(INDIRECT(ADDRESS(RC1,2,3,1,Menus!R10C11))=R1C,RC4,NA()) -> NA() | J40: =IF(INDIRECT(ADDRESS(RC1,1,3,1,Menus!R10C11))=T(R1C),RC4,NA()) -> NA() | K40: =IF(OR(ISNUMBER(RC7),ISNUMBER(RC8),ISNUMBER(RC9),ISNUMBER(RC10)),1,0) -> 0 | M40: =OFFSET(INDIRECT(ADDRESS(RC1,3,3,1,"Gross")),0,Menus!R4C10) -> 1 | N40: =OFFSET(INDIRECT(ADDRESS(RC1,3,3,1,"Gross")),0,Menus!R3C10) -> 2
A41: 96 | B41: =OFFSET(INDIRECT(ADDRESS(RC1,3,3,1,Menus!R10C11)),0,Menus!R4C10) -> 0 | C41: =OFFSET(INDIRECT(ADDRESS(RC1,3,3,1,Menus!R10C11)),0,Menus!R3C10) -> 0 | D41: =IF(Menus!R9C10,RC[-1]/RC[-2],RC[-1]) -> #DIV/0! | E41: =IF(RC11=1,VALUE(RC[-3]),NA()) -> NA() | F41: =INDIRECT(ADDRESS(RC1,1,3,1,Menus!R10C11)) -> 0 | G41: =IF(INDIRECT(ADDRESS(RC1,2,3,1,Menus!R10C11))=R1C,RC4,NA()) -> NA() | H41: =IF(INDIRECT(ADDRESS(RC1,2,3,1,Menus!R10C11))=R1C,RC4,NA()) -> NA() | I41: =IF(INDIRECT(ADDRESS(RC1,2,3,1,Menus!R10C11))=R1C,RC4,NA()) -> NA() | J41: =IF(INDIRECT(ADDRESS(RC1,1,3,1,Menus!R10C11))=T(R1C),RC4,NA()) -> NA() | K41: =IF(OR(ISNUMBER(RC7),ISNUMBER(RC8),ISNUMBER(RC9),ISNUMBER(RC10)),1,0) -> 0 | M41: =OFFSET(INDIRECT(ADDRESS(RC1,3,3,1,"Gross")),0,Menus!R4C10) -> 1 | N41: =OFFSET(INDIRECT(ADDRESS(RC1,3,3,1,"Gross")),0,Menus!R3C10) -> 1
A42: 186 | B42: =OFFSET(INDIRECT(ADDRESS(RC1,3,3,1,Menus!R10C11)),0,Menus!R4C10) -> 0 | C42: =OFFSET(INDIRECT(ADDRESS(RC1,3,3,1,Menus!R10C11)),0,Menus!R3C10) -> 0 | D42: =IF(Menus!R9C10,RC[-1]/RC[-2],RC[-1]) -> #DIV/0! | E42: =IF(RC11=1,VALUE(RC[-3]),NA()) -> NA() | F42: =INDIRECT(ADDRESS(RC1,1,3,1,Menus!R10C11)) -> 0 | G42: =IF(INDIRECT(ADDRESS(RC1,2,3,1,Menus!R10C11))=R1C,RC4,NA()) -> NA() | H42: =IF(INDIRECT(ADDRESS(RC1,2,3,1,Menus!R10C11))=R1C,RC4,NA()) -> NA() | I42: =IF(INDIRECT(ADDRESS(RC1,2,3,1,Menus!R10C11))=R1C,RC4,NA()) -> NA() | J42: =IF(INDIRECT(ADDRESS(RC1,1,3,1,Menus!R10C11))=T(R1C),RC4,NA()) -> NA() | K42: =IF(OR(ISNUMBER(RC7),ISNUMBER(RC8),ISNUMBER(RC9),ISNUMBER(RC10)),1,0) -> 0 | M42: =OFFSET(INDIRECT(ADDRESS(RC1,3,3,1,"Gross")),0,Menus!R4C10) -> 0 | N42: =OFFSET(INDIRECT(ADDRESS(RC1,3,3,1,"Gross")),0,Menus!R3C10) -> 0
A43: 182 | B43: =OFFSET(INDIRECT(ADDRESS(RC1,3,3,1,Menus!R10C11)),0,Menus!R4C10) -> 0 | C43: =OFFSET(INDIRECT(ADDRESS(RC1,3,3,1,Menus!R10C11)),0,Menus!R3C10) -> 0 | D43: =IF(Menus!R9C10,RC[-1]/RC[-2],RC[-1]) -> #DIV/0! | E43: =IF(RC11=1,VALUE(RC[-3]),NA()) -> NA() | F43: =INDIRECT(ADDRESS(RC1,1,3,1,Menus!R10C11)) -> 0 | G43: =IF(INDIRECT(ADDRESS(RC1,2,3,1,Menus!R10C11))=R1C,RC4,NA()) -> NA() | H43: =IF(INDIRECT(ADDRESS(RC1,2,3,1,Menus!R10C11))=R1C,RC4,NA()) -> NA() | I43: =IF(INDIRECT(ADDRESS(RC1,2,3,1,Menus!R10C11))=R1C,RC4,NA()) -> NA() | J43: =IF(INDIRECT(ADDRESS(RC1,1,3,1,Menus!R10C11))=T(R1C),RC4,NA()) -> NA() | K43: =IF(OR(ISNUMBER(RC7),ISNUMBER(RC8),ISNUMBER(RC9),ISNUMBER(RC10)),1,0) -> 0 | M43: =OFFSET(INDIRECT(ADDRESS(RC1,3,3,1,"Gross")),0,Menus!R4C10) -> 0 | N43: =OFFSET(INDIRECT(ADDRESS(RC1,3,3,1,"Gross")),0,Menus!R3C10) -> 0
A44: 56 | B44: =OFFSET(INDIRECT(ADDRESS(RC1,3,3,1,Menus!R10C11)),0,Menus!R4C10) -> 0 | C44: =OFFSET(INDIRECT(ADDRESS(RC1,3,3,1,Menus!R10C11)),0,Menus!R3C10) -> 0 | D44: =IF(Menus!R9C10,RC[-1]/RC[-2],RC[-1]) -> #DIV/0! | E44: =IF(RC11=1,VALUE(RC[-3]),NA()) -> NA() | F44: =INDIRECT(ADDRESS(RC1,1,3,1,Menus!R10C11)) -> 0 | G44: =IF(INDIRECT(ADDRESS(RC1,2,3,1,Menus!R10C11))=R1C,RC4,NA()) -> NA() | H44: =IF(INDIRECT(ADDRESS(RC1,2,3,1,Menus!R10C11))=R1C,RC4,NA()) -> NA() | I44: =IF(INDIRECT(ADDRESS(RC1,2,3,1,Menus!R10C11))=R1C,RC4,NA()) -> NA() | J44: =IF(INDIRECT(ADDRESS(RC1,1,3,1,Menus!R10C11))=T(R1C),RC4,NA()) -> NA() | K44: =IF(OR(ISNUMBER(RC7),ISNUMBER(RC8),ISNUMBER(RC9),ISNUMBER(RC10)),1,0) -> 0 | M44: =OFFSET(INDIRECT(ADDRESS(RC1,3,3,1,"Gross")),0,Menus!R4C10) -> 0 | N44: =OFFSET(INDIRECT(ADDRESS(RC1,3,3,1,"Gross")),0,Menus!R3C10) -> 1
A45: 183 | B45: =OFFSET(INDIRECT(ADDRESS(RC1,3,3,1,Menus!R10C11)),0,Menus!R4C10) -> 0 | C45: =OFFSET(INDIRECT(ADDRESS(RC1,3,3,1,Menus!R10C11)),0,Menus!R3C10) -> 0 | D45: =IF(Menus!R9C10,RC[-1]/RC[-2],RC[-1]) -> #DIV/0! | E45: =IF(RC11=1,VALUE(RC[-3]),NA()) -> NA() | F45: =INDIRECT(ADDRESS(RC1,1,3,1,Menus!R10C11)) -> 0 | G45: =IF(INDIRECT(ADDRESS(RC1,2,3,1,Menus!R10C11))=R1C,RC4,NA()) -> NA() | H45: =IF(INDIRECT(ADDRESS(RC1,2,3,1,Menus!R10C11))=R1C,RC4,NA()) -> NA() | I45: =IF(INDIRECT(ADDRESS(RC1,2,3,1,Menus!R10C11))=R1C,RC4,NA()) -> NA() | J45: =IF(INDIRECT(ADDRESS(RC1,1,3,1,Menus!R10C11))=T(R1C),RC4,NA()) -> NA() | K45: =IF(OR(ISNUMBER(RC7),ISNUMBER(RC8),ISNUMBER(RC9),ISNUMBER(RC10)),1,0) -> 0 | M45: =OFFSET(INDIRECT(ADDRESS(RC1,3,3,1,"Gross")),0,Menus!R4C10) -> 0 | N45: =OFFSET(INDIRECT(ADDRESS(RC1,3,3,1,"Gross")),0,Menus!R3C10) -> 0
A46: 99 | B46: =OFFSET(INDIRECT(ADDRESS(RC1,3,3,1,Menus!R10C11)),0,Menus!R4C10) -> 0 | C46: =OFFSET(INDIRECT(ADDRESS(RC1,3,3,1,Menus!R10C11)),0,Menus!R3C10) -> 0 | D46: =IF(Menus!R9C10,RC[-1]/RC[-2],RC[-1]) -> #DIV/0! | E46: =IF(RC11=1,VALUE(RC[-3]),NA()) -> NA() | F46: =INDIRECT(ADDRESS(RC1,1,3,1,Menus!R10C11)) -> 0 | G46: =IF(INDIRECT(ADDRESS(RC1,2,3,1,Menus!R10C11))=R1C,RC4,NA()) -> NA() | H46: =IF(INDIRECT(ADDRESS(RC1,2,3,1,Menus!R10C11))=R1C,RC4,NA()) -> NA() | I46: =IF(INDIRECT(ADDRESS(RC1,2,3,1,Menus!R10C11))=R1C,RC4,NA()) -> NA() | J46: =IF(INDIRECT(ADDRESS(RC1,1,3,1,Menus!R10C11))=T(R1C),RC4,NA()) -> NA() | K46: =IF(OR(ISNUMBER(RC7),ISNUMBER(RC8),ISNUMBER(RC9),ISNUMBER(RC10)),1,0) -> 0 | M46: =OFFSET(INDIRECT(ADDRESS(RC1,3,3,1,"Gross")),0,Menus!R4C10) -> 0 | N46: =OFFSET(INDIRECT(ADDRESS(RC1,3,3,1,"Gross")),0,Menus!R3C10) -> 0
A47: 148 | B47: =OFFSET(INDIRECT(ADDRESS(RC1,3,3,1,Menus!R10C11)),0,Menus!R4C10) -> 0 | C47: =OFFSET(INDIRECT(ADDRESS(RC1,3,3,1,Menus!R10C11)),0,Menus!R3C10) -> 0 | D47: =IF(Menus!R9C10,RC[-1]/RC[-2],RC[-1]) -> #DIV/0! | E47: =IF(RC11=1,VALUE(RC[-3]),NA()) -> NA() | F47: =INDIRECT(ADDRESS(RC1,1,3,1,Menus!R10C11)) -> 0 | G47: =IF(INDIRECT(ADDRESS(RC1,2,3,1,Menus!R10C11))=R1C,RC4,NA()) -> NA() | H47: =IF(INDIRECT(ADDRESS(RC1,2,3,1,Menus!R10C11))=R1C,RC4,NA()) -> NA() | I47: =IF(INDIRECT(ADDRESS(RC1,2,3,1,Menus!R10C11))=R1C,RC4,NA()) -> NA() | J47: =IF(INDIRECT(ADDRESS(RC1,1,3,1,Menus!R10C11))=T(R1C),RC4,NA()) -> NA() | K47: =IF(OR(ISNUMBER(RC7),ISNUMBER(RC8),ISNUMBER(RC9),ISNUMBER(RC10)),1,0) -> 0 | M47: =OFFSET(INDIRECT(ADDRESS(RC1,3,3,1,"Gross")),0,Menus!R4C10) -> 1 | N47: =OFFSET(INDIRECT(ADDRESS(RC1,3,3,1,"Gross")),0,Menus!R3C10) -> 1
A48: 94 | B48: =OFFSET(INDIRECT(ADDRESS(RC1,3,3,1,Menus!R10C11)),0,Menus!R4C10) -> 0 | C48: =OFFSET(INDIRECT(ADDRESS(RC1,3,3,1,Menus!R10C11)),0,Menus!R3C10) -> 0 | D48: =IF(Menus!R9C10,RC[-1]/RC[-2],RC[-1]) -> #DIV/0! | E48: =IF(RC11=1,VALUE(RC[-3]),NA()) -> NA() | F48: =INDIRECT(ADDRESS(RC1,1,3,1,Menus!R10C11)) -> 0 | G48: =IF(INDIRECT(ADDRESS(RC1,2,3,1,Menus!R10C11))=R1C,RC4,NA()) -> NA() | H48: =IF(INDIRECT(ADDRESS(RC1,2,3,1,Menus!R10C11))=R1C,RC4,NA()) -> NA() | I48: =IF(INDIRECT(ADDRESS(RC1,2,3,1,Menus!R10C11))=R1C,RC4,NA()) -> NA() | J48: =IF(INDIRECT(ADDRESS(RC1,1,3,1,Menus!R10C11))=T(R1C),RC4,NA()) -> NA() | K48: =IF(OR(ISNUMBER(RC7),ISNUMBER(RC8),ISNUMBER(RC9),ISNUMBER(RC10)),1,0) -> 0 | M48: =OFFSET(INDIRECT(ADDRESS(RC1,3,3,1,"Gross")),0,Menus!R4C10) -> 0 | N48: =OFFSET(INDIRECT(ADDRESS(RC1,3,3,1,"Gross")),0,Menus!R3C10) -> 0
A49: 194 | B49: =OFFSET(INDIRECT(ADDRESS(RC1,3,3,1,Menus!R10C11)),0,Menus!R4C10) -> 0 | C49: =OFFSET(INDIRECT(ADDRESS(RC1,3,3,1,Menus!R10C11)),0,Menus!R3C10) -> 0 | D49: =IF(Menus!R9C10,RC[-1]/RC[-2],RC[-1]) -> #DIV/0! | E49: =IF(RC11=1,VALUE(RC[-3]),NA()) -> NA() | F49: =INDIRECT(ADDRESS(RC1,1,3,1,Menus!R10C11)) -> 0 | G49: =IF(INDIRECT(ADDRESS(RC1,2,3,1,Menus!R10C11))=R1C,RC4,NA()) -> NA() | H49: =IF(INDIRECT(ADDRESS(RC1,2,3,1,Menus!R10C11))=R1C,RC4,NA()) -> NA() | I49: =IF(INDIRECT(ADDRESS(RC1,2,3,1,Menus!R10C11))=R1C,RC4,NA()) -> NA() | J49: =IF(INDIRECT(ADDRESS(RC1,1,3,1,Menus!R10C11))=T(R1C),RC4,NA()) -> NA() | K49: =IF(OR(ISNUMBER(RC7),ISNUMBER(RC8),ISNUMBER(RC9),ISNUMBER(RC10)),1,0) -> 0 | M49: =OFFSET(INDIRECT(ADDRESS(RC1,3,3,1,"Gross")),0,Menus!R4C10) -> 0 | N49: =OFFSET(INDIRECT(ADDRESS(RC1,3,3,1,"Gross")),0,Menus!R3C10) -> 0
A50: 136 | B50: =OFFSET(INDIRECT(ADDRESS(RC1,3,3,1,Menus!R10C11)),0,Menus!R4C10) -> 0 | C50: =OFFSET(INDIRECT(ADDRESS(RC1,3,3,1,Menus!R10C11)),0,Menus!R3C10) -> 0 | D50: =IF(Menus!R9C10,RC[-1]/RC[-2],RC[-1]) -> #DIV/0! | E50: =IF(RC11=1,VALUE(RC[-3]),NA()) -> NA() | F50: =INDIRECT(ADDRESS(RC1,1,3,1,Menus!R10C11)) -> 0 | G50: =IF(INDIRECT(ADDRESS(RC1,2,3,1,Menus!R10C11))=R1C,RC4,NA()) -> NA() | H50: =IF(INDIRECT(ADDRESS(RC1,2,3,1,Menus!R10C11))=R1C,RC4,NA()) -> NA() | I50: =IF(INDIRECT(ADDRESS(RC1,2,3,1,Menus!R10C11))=R1C,RC4,NA()) -> NA() | J50: =IF(INDIRECT(ADDRESS(RC1,1,3,1,Menus!R10C11))=T(R1C),RC4,NA()) -> NA() | K50: =IF(OR(ISNUMBER(RC7),ISNUMBER(RC8),ISNUMBER(RC9),ISNUMBER(RC10)),1,0) -> 0 | M50: =OFFSET(INDIRECT(ADDRESS(RC1,3,3,1,"Gross")),0,Menus!R4C10) -> -1 | N50: =OFFSET(INDIRECT(ADDRESS(RC1,3,3,1,"Gross")),0,Menus!R3C10) -> -1
A51: 196 | B51: =OFFSET(INDIRECT(ADDRESS(RC1,3,3,1,Menus!R10C11)),0,Menus!R4C10) -> 0 | C51: =OFFSET(INDIRECT(ADDRESS(RC1,3,3,1,Menus!R10C11)),0,Menus!R3C10) -> 0 | D51: =IF(Menus!R9C10,RC[-1]/RC[-2],RC[-1]) -> #DIV/0! | E51: =IF(RC11=1,VALUE(RC[-3]),NA()) -> NA() | F51: =INDIRECT(ADDRESS(RC1,1,3,1,Menus!R10C11)) -> 0 | G51: =IF(INDIRECT(ADDRESS(RC1,2,3,1,Menus!R10C11))=R1C,RC4,NA()) -> NA() | H51: =IF(INDIRECT(ADDRESS(RC1,2,3,1,Menus!R10C11))=R1C,RC4,NA()) -> NA() | I51: =IF(INDIRECT(ADDRESS(RC1,2,3,1,Menus!R10C11))=R1C,RC4,NA()) -> NA() | J51: =IF(INDIRECT(ADDRESS(RC1,1,3,1,Menus!R10C11))=T(R1C),RC4,NA()) -> NA() | K51: =IF(OR(ISNUMBER(RC7),ISNUMBER(RC8),ISNUMBER(RC9),ISNUMBER(RC10)),1,0) -> 0 | M51: =OFFSET(INDIRECT(ADDRESS(RC1,3,3,1,"Gross")),0,Menus!R4C10) -> 0 | N51: =OFFSET(INDIRECT(ADDRESS(RC1,3,3,1,"Gross")),0,Menus!R3C10) -> 0
A52: 179 | B52: =OFFSET(INDIRECT(ADDRESS(RC1,3,3,1,Menus!R10C11)),0,Menus!R4C10) -> 0 | C52: =OFFSET(INDIRECT(ADDRESS(RC1,3,3,1,Menus!R10C11)),0,Menus!R3C10) -> 0 | D52: =IF(Menus!R9C10,RC[-1]/RC[-2],RC[-1]) -> #DIV/0! | E52: =IF(RC11=1,VALUE(RC[-3]),NA()) -> NA() | F52: =INDIRECT(ADDRESS(RC1,1,3,1,Menus!R10C11)) -> 0 | G52: =IF(INDIRECT(ADDRESS(RC1,2,3,1,Menus!R10C11))=R1C,RC4,NA()) -> NA() | H52: =IF(INDIRECT(ADDRESS(RC1,2,3,1,Menus!R10C11))=R1C,RC4,NA()) -> NA() | I52: =IF(INDIRECT(ADDRESS(RC1,2,3,1,Menus!R10C11))=R1C,RC4,NA()) -> NA() | J52: =IF(INDIRECT(ADDRESS(RC1,1,3,1,Menus!R10C11))=T(R1C),RC4,NA()) -> NA() | K52: =IF(OR(ISNUMBER(RC7),ISNUMBER(RC8),ISNUMBER(RC9),ISNUMBER(RC10)),1,0) -> 0 | M52: =OFFSET(INDIRECT(ADDRESS(RC1,3,3,1,"Gross")),0,Menus!R4C10) -> 0 | N52: =OFFSET(INDIRECT(ADDRESS(RC1,3,3,1,"Gross")),0,Menus!R3C10) -> 0
A53: 157 | B53: =OFFSET(INDIRECT(ADDRESS(RC1,3,3,1,Menus!R10C11)),0,Menus!R4C10) -> 0 | C53: =OFFSET(INDIRECT(ADDRESS(RC1,3,3,1,Menus!R10C11)),0,Menus!R3C10) -> 0 | D53: =IF(Menus!R9C10,RC[-1]/RC[-2],RC[-1]) -> #DIV/0! | E53: =IF(RC11=1,VALUE(RC[-3]),NA()) -> NA() | F53: =INDIRECT(ADDRESS(RC1,1,3,1,Menus!R10C11)) -> 0 | G53: =IF(INDIRECT(ADDRESS(RC1,2,3,1,Menus!R10C11))=R1C,RC4,NA()) -> NA() | H53: =IF(INDIRECT(ADDRESS(RC1,2,3,1,Menus!R10C11))=R1C,RC4,NA()) -> NA() | I53: =IF(INDIRECT(ADDRESS(RC1,2,3,1,Menus!R10C11))=R1C,RC4,NA()) -> NA() | J53: =IF(INDIRECT(ADDRESS(RC1,1,3,1,Menus!R10C11))=T(R1C),RC4,NA()) -> NA() | K53: =IF(OR(ISNUMBER(RC7),ISNUMBER(RC8),ISNUMBER(RC9),ISNUMBER(RC10)),1,0) -> 0 | M53: =OFFSET(INDIRECT(ADDRESS(RC1,3,3,1,"Gross")),0,Menus!R4C10) -> -1 | N53: =OFFSET(INDIRECT(ADDRESS(RC1,3,3,1,"Gross")),0,Menus!R3C10) -> -1
A54: 159 | B54: =OFFSET(INDIRECT(ADDRESS(RC1,3,3,1,Menus!R10C11)),0,Menus!R4C10) -> 0 | C54: =OFFSET(INDIRECT(ADDRESS(RC1,3,3,1,Menus!R10C11)),0,Menus!R3C10) -> 0 | D54: =IF(Menus!R9C10,RC[-1]/RC[-2],RC[-1]) -> #DIV/0! | E54: =IF(RC11=1,VALUE(RC[-3]),NA()) -> NA() | F54: =INDIRECT(ADDRESS(RC1,1,3,1,Menus!R10C11)) -> 0 | G54: =IF(INDIRECT(ADDRESS(RC1,2,3,1,Menus!R10C11))=R1C,RC4,NA()) -> NA() | H54: =IF(INDIRECT(ADDRESS(RC1,2,3,1,Menus!R10C11))=R1C,RC4,NA()) -> NA() | I54: =IF(INDIRECT(ADDRESS(RC1,2,3,1,Menus!R10C11))=R1C,RC4,NA()) -> NA() | J54: =IF(INDIRECT(ADDRESS(RC1,1,3,1,Menus!R10C11))=T(R1C),RC4,NA()) -> NA() | K54: =IF(OR(ISNUMBER(RC7),ISNUMBER(RC8),ISNUMBER(RC9),ISNUMBER(RC10)),1,0) -> 0 | M54: =OFFSET(INDIRECT(ADDRESS(RC1,3,3,1,"Gross")),0,Menus!R4C10) -> 0 | N54: =OFFSET(INDIRECT(ADDRESS(RC1,3,3,1,"Gross")),0,Menus!R3C10) -> 0
A55: 93 | B55: =OFFSET(INDIRECT(ADDRESS(RC1,3,3,1,Menus!R10C11)),0,Menus!R4C10) -> 0 | C55: =OFFSET(INDIRECT(ADDRESS(RC1,3,3,1,Menus!R10C11)),0,Menus!R3C10) -> 0 | D55: =IF(Menus!R9C10,RC[-1]/RC[-2],RC[-1]) -> #DIV/0! | E55: =IF(RC11=1,VALUE(RC[-3]),NA()) -> NA() | F55: =INDIRECT(ADDRESS(RC1,1,3,1,Menus!R10C11)) -> 0 | G55: =IF(INDIRECT(ADDRESS(RC1,2,3,1,Menus!R10C11))=R1C,RC4,NA()) -> NA() | H55: =IF(INDIRECT(ADDRESS(RC1,2,3,1,Menus!R10C11))=R1C,RC4,NA()) -> NA() | I55: =IF(INDIRECT(ADDRESS(RC1,2,3,1,Menus!R10C11))=R1C,RC4,NA()) -> NA() | J55: =IF(INDIRECT(ADDRESS(RC1,1,3,1,Menus!R10C11))=T(R1C),RC4,NA()) -> NA() | K55: =IF(OR(ISNUMBER(RC7),ISNUMBER(RC8),ISNUMBER(RC9),ISNUMBER(RC10)),1,0) -> 0 | M55: =OFFSET(INDIRECT(ADDRESS(RC1,3,3,1,"Gross")),0,Menus!R4C10) -> 1 | N55: =OFFSET(INDIRECT(ADDRESS(RC1,3,3,1,"Gross")),0,Menus!R3C10) -> 1
A56: 79 | B56: =OFFSET(INDIRECT(ADDRESS(RC1,3,3,1,Menus!R10C11)),0,Menus!R4C10) -> 0 | C56: =OFFSET(INDIRECT(ADDRESS(RC1,3,3,1,Menus!R10C11)),0,Menus!R3C10) -> 0 | D56: =IF(Menus!R9C10,RC[-1]/RC[-2],RC[-1]) -> #DIV/0! | E56: =IF(RC11=1,VALUE(RC[-3]),NA()) -> NA() | F56: =INDIRECT(ADDRESS(RC1,1,3,1,Menus!R10C11)) -> 0 | G56: =IF(INDIRECT(ADDRESS(RC1,2,3,1,Menus!R10C11))=R1C,RC4,NA()) -> NA() | H56: =IF(INDIRECT(ADDRESS(RC1,2,3,1,Menus!R10C11))=R1C,RC4,NA()) -> NA() | I56: =IF(INDIRECT(ADDRESS(RC1,2,3,1,Menus!R10C11))=R1C,RC4,NA()) -> NA() | J56: =IF(INDIRECT(ADDRESS(RC1,1,3,1,Menus!R10C11))=T(R1C),RC4,NA()) -> NA() | K56: =IF(OR(ISNUMBER(RC7),ISNUMBER(RC8),ISNUMBER(RC9),ISNUMBER(RC10)),1,0) -> 0 | M56: =OFFSET(INDIRECT(ADDRESS(RC1,3,3,1,"Gross")),0,Menus!R4C10) -> 1 | N56: =OFFSET(INDIRECT(ADDRESS(RC1,3,3,1,"Gross")),0,Menus!R3C10) -> 1
A57: 51 | B57: =OFFSET(INDIRECT(ADDRESS(RC1,3,3,1,Menus!R10C11)),0,Menus!R4C10) -> 0 | C57: =OFFSET(INDIRECT(ADDRESS(RC1,3,3,1,Menus!R10C11)),0,Menus!R3C10) -> 0 | D57: =IF(Menus!R9C10,RC[-1]/RC[-2],RC[-1]) -> #DIV/0! | E57: =IF(RC11=1,VALUE(RC[-3]),NA()) -> NA() | F57: =INDIRECT(ADDRESS(RC1,1,3,1,Menus!R10C11)) -> 0 | G57: =IF(INDIRECT(ADDRESS(RC1,2,3,1,Menus!R10C11))=R1C,RC4,NA()) -> NA() | H57: =IF(INDIRECT(ADDRESS(RC1,2,3,1,Menus!R10C11))=R1C,RC4,NA()) -> NA() | I57: =IF(INDIRECT(ADDRESS(RC1,2,3,1,Menus!R10C11))=R1C,RC4,NA()) -> NA() | J57: =IF(INDIRECT(ADDRESS(RC1,1,3,1,Menus!R10C11))=T(R1C),RC4,NA()) -> NA() | K57: =IF(OR(ISNUMBER(RC7),ISNUMBER(RC8),ISNUMBER(RC9),ISNUMBER(RC10)),1,0) -> 0 | M57: =OFFSET(INDIRECT(ADDRESS(RC1,3,3,1,"Gross")),0,Menus!R4C10) -> 0 | N57: =OFFSET(INDIRECT(ADDRESS(RC1,3,3,1,"Gross")),0,Menus!R3C10) -> 0
A58: 53 | B58: =OFFSET(INDIRECT(ADDRESS(RC1,3,3,1,Menus!R10C11)),0,Menus!R4C10) -> 0 | C58: =OFFSET(INDIRECT(ADDRESS(RC1,3,3,1,Menus!R10C11)),0,Menus!R3C10) -> 0 | D58: =IF(Menus!R9C10,RC[-1]/RC[-2],RC[-1]) -> #DIV/0! | E58: =IF(RC11=1,VALUE(RC[-3]),NA()) -> NA() | F58: =INDIRECT(ADDRESS(RC1,1,3,1,Menus!R10C11)) -> 0 | G58: =IF(INDIRECT(ADDRESS(RC1,2,3,1,Menus!R10C11))=R1C,RC4,NA()) -> NA() | H58: =IF(INDIRECT(ADDRESS(RC1,2,3,1,Menus!R10C11))=R1C,RC4,NA()) -> NA() | I58: =IF(INDIRECT(ADDRESS(RC1,2,3,1,Menus!R10C11))=R1C,RC4,NA()) -> NA() | J58: =IF(INDIRECT(ADDRESS(RC1,1,3,1,Menus!R10C11))=T(R1C),RC4,NA()) -> NA() | K58: =IF(OR(ISNUMBER(RC7),ISNUMBER(RC8),ISNUMBER(RC9),ISNUMBER(RC10)),1,0) -> 0 | M58: =OFFSET(INDIRECT(ADDRESS(RC1,3,3,1,"Gross")),0,Menus!R4C10) -> 1 | N58: =OFFSET(INDIRECT(ADDRESS(RC1,3,3,1,"Gross")),0,Menus!R3C10) -> 1
A59: 124 | B59: =OFFSET(INDIRECT(ADDRESS(RC1,3,3,1,Menus!R10C11)),0,Menus!R4C10) -> 0 | C59: =OFFSET(INDIRECT(ADDRESS(RC1,3,3,1,Menus!R10C11)),0,Menus!R3C10) -> 0 | D59: =IF(Menus!R9C10,RC[-1]/RC[-2],RC[-1]) -> #DIV/0! | E59: =IF(RC11=1,VALUE(RC[-3]),NA()) -> NA() | F59: =INDIRECT(ADDRESS(RC1,1,3,1,Menus!R10C11)) -> 0 | G59: =IF(INDIRECT(ADDRESS(RC1,2,3,1,Menus!R10C11))=R1C,RC4,NA()) -> NA() | H59: =IF(INDIRECT(ADDRESS(RC1,2,3,1,Menus!R10C11))=R1C,RC4,NA()) -> NA() | I59: =IF(INDIRECT(ADDRESS(RC1,2,3,1,Menus!R10C11))=R1C,RC4,NA()) -> NA() | J59: =IF(INDIRECT(ADDRESS(RC1,1,3,1,Menus!R10C11))=T(R1C),RC4,NA()) -> NA() | K59: =IF(OR(ISNUMBER(RC7),ISNUMBER(RC8),ISNUMBER(RC9),ISNUMBER(RC10)),1,0) -> 0 | M59: =OFFSET(INDIRECT(ADDRESS(RC1,3,3,1,"Gross")),0,Menus!R4C10) -> -1 | N59: =OFFSET(INDIRECT(ADDRESS(RC1,3,3,1,"Gross")),0,Menus!R3C10) -> -1
A60: 126 | B60: =OFFSET(INDIRECT(ADDRESS(RC1,3,3,1,Menus!R10C11)),0,Menus!R4C10) -> 0 | C60: =OFFSET(INDIRECT(ADDRESS(RC1,3,3,1,Menus!R10C11)),0,Menus!R3C10) -> 0 | D60: =IF(Menus!R9C10,RC[-1]/RC[-2],RC[-1]) -> #DIV/0! | E60: =IF(RC11=1,VALUE(RC[-3]),NA()) -> NA() | F60: =INDIRECT(ADDRESS(RC1,1,3,1,Menus!R10C11)) -> 0 | G60: =IF(INDIRECT(ADDRESS(RC1,2,3,1,Menus!R10C11))=R1C,RC4,NA()) -> NA() | H60: =IF(INDIRECT(ADDRESS(RC1,2,3,1,Menus!R10C11))=R1C,RC4,NA()) -> NA() | I60: =IF(INDIRECT(ADDRESS(RC1,2,3,1,Menus!R10C11))=R1C,RC4,NA()) -> NA() | J60: =IF(INDIRECT(ADDRESS(RC1,1,3,1,Menus!R10C11))=T(R1C),RC4,NA()) -> NA() | K60: =IF(OR(ISNUMBER(RC7),ISNUMBER(RC8),ISNUMBER(RC9),ISNUMBER(RC10)),1,0) -> 0 | M60: =OFFSET(INDIRECT(ADDRESS(RC1,3,3,1,"Gross")),0,Menus!R4C10) -> 0 | N60: =OFFSET(INDIRECT(ADDRESS(RC1,3,3,1,"Gross")),0,Menus!R3C10) -> 0
A61: 162 | B61: =OFFSET(INDIRECT(ADDRESS(RC1,3,3,1,Menus!R10C11)),0,Menus!R4C10) -> 0 | C61: =OFFSET(INDIRECT(ADDRESS(RC1,3,3,1,Menus!R10C11)),0,Menus!R3C10) -> 0 | D61: =IF(Menus!R9C10,RC[-1]/RC[-2],RC[-1]) -> #DIV/0! | E61: =IF(RC11=1,VALUE(RC[-3]),NA()) -> NA() | F61: =INDIRECT(ADDRESS(RC1,1,3,1,Menus!R10C11)) -> 0 | G61: =IF(INDIRECT(ADDRESS(RC1,2,3,1,Menus!R10C11))=R1C,RC4,NA()) -> NA() | H61: =IF(INDIRECT(ADDRESS(RC1,2,3,1,Menus!R10C11))=R1C,RC4,NA()) -> NA() | I61: =IF(INDIRECT(ADDRESS(RC1,2,3,1,Menus!R10C11))=R1C,RC4,NA()) -> NA() | J61: =IF(INDIRECT(ADDRESS(RC1,1,3,1,Menus!R10C11))=T(R1C),RC4,NA()) -> NA() | K61: =IF(OR(ISNUMBER(RC7),ISNUMBER(RC8),ISNUMBER(RC9),ISNUMBER(RC10)),1,0) -> 0 | M61: =OFFSET(INDIRECT(ADDRESS(RC1,3,3,1,"Gross")),0,Menus!R4C10) -> 0 | N61: =OFFSET(INDIRECT(ADDRESS(RC1,3,3,1,"Gross")),0,Menus!R3C10) -> 0
A62: 70 | B62: =OFFSET(INDIRECT(ADDRESS(RC1,3,3,1,Menus!R10C11)),0,Menus!R4C10) -> 0 | C62: =OFFSET(INDIRECT(ADDRESS(RC1,3,3,1,Menus!R10C11)),0,Menus!R3C10) -> 0 | D62: =IF(Menus!R9C10,RC[-1]/RC[-2],RC[-1]) -> #DIV/0! | E62: =IF(RC11=1,VALUE(RC[-3]),NA()) -> NA() | F62: =INDIRECT(ADDRESS(RC1,1,3,1,Menus!R10C11)) -> 0 | G62: =IF(INDIRECT(ADDRESS(RC1,2,3,1,Menus!R10C11))=R1C,RC4,NA()) -> NA() | H62: =IF(INDIRECT(ADDRESS(RC1,2,3,1,Menus!R10C11))=R1C,RC4,NA()) -> NA() | I62: =IF(INDIRECT(ADDRESS(RC1,2,3,1,Menus!R10C11))=R1C,RC4,NA()) -> NA() | J62: =IF(INDIRECT(ADDRESS(RC1,1,3,1,Menus!R10C11))=T(R1C),RC4,NA()) -> NA() | K62: =IF(OR(ISNUMBER(RC7),ISNUMBER(RC8),ISNUMBER(RC9),ISNUMBER(RC10)),1,0) -> 0 | M62: =OFFSET(INDIRECT(ADDRESS(RC1,3,3,1,"Gross")),0,Menus!R4C10) -> 1 | N62: =OFFSET(INDIRECT(ADDRESS(RC1,3,3,1,"Gross")),0,Menus!R3C10) -> 1
A63: 58 | B63: =OFFSET(INDIRECT(ADDRESS(RC1,3,3,1,Menus!R10C11)),0,Menus!R4C10) -> 0 | C63: =OFFSET(INDIRECT(ADDRESS(RC1,3,3,1,Menus!R10C11)),0,Menus!R3C10) -> 0 | D63: =IF(Menus!R9C10,RC[-1]/RC[-2],RC[-1]) -> #DIV/0! | E63: =IF(RC11=1,VALUE(RC[-3]),NA()) -> NA() | F63: =INDIRECT(ADDRESS(RC1,1,3,1,Menus!R10C11)) -> 0 | G63: =IF(INDIRECT(ADDRESS(RC1,2,3,1,Menus!R10C11))=R1C,RC4,NA()) -> NA() | H63: =IF(INDIRECT(ADDRESS(RC1,2,3,1,Menus!R10C11))=R1C,RC4,NA()) -> NA() | I63: =IF(INDIRECT(ADDRESS(RC1,2,3,1,Menus!R10C11))=R1C,RC4,NA()) -> NA() | J63: =IF(INDIRECT(ADDRESS(RC1,1,3,1,Menus!R10C11))=T(R1C),RC4,NA()) -> NA() | K63: =IF(OR(ISNUMBER(RC7),ISNUMBER(RC8),ISNUMBER(RC9),ISNUMBER(RC10)),1,0) -> 0 | M63: =OFFSET(INDIRECT(ADDRESS(RC1,3,3,1,"Gross")),0,Menus!R4C10) -> 1 | N63: =OFFSET(INDIRECT(ADDRESS(RC1,3,3,1,"Gross")),0,Menus!R3C10) -> 1
A64: 130 | B64: =OFFSET(INDIRECT(ADDRESS(RC1,3,3,1,Menus!R10C11)),0,Menus!R4C10) -> 0 | C64: =OFFSET(INDIRECT(ADDRESS(RC1,3,3,1,Menus!R10C11)),0,Menus!R3C10) -> 0 | D64: =IF(Menus!R9C10,RC[-1]/RC[-2],RC[-1]) -> #DIV/0! | E64: =IF(RC11=1,VALUE(RC[-3]),NA()) -> NA() | F64: =INDIRECT(ADDRESS(RC1,1,3,1,Menus!R10C11)) -> 0 | G64: =IF(INDIRECT(ADDRESS(RC1,2,3,1,Menus!R10C11))=R1C,RC4,NA()) -> NA() | H64: =IF(INDIRECT(ADDRESS(RC1,2,3,1,Menus!R10C11))=R1C,RC4,NA()) -> NA() | I64: =IF(INDIRECT(ADDRESS(RC1,2,3,1,Menus!R10C11))=R1C,RC4,NA()) -> NA() | J64: =IF(INDIRECT(ADDRESS(RC1,1,3,1,Menus!R10C11))=T(R1C),RC4,NA()) -> NA() | K64: =IF(OR(ISNUMBER(RC7),ISNUMBER(RC8),ISNUMBER(RC9),ISNUMBER(RC10)),1,0) -> 0 | M64: =OFFSET(INDIRECT(ADDRESS(RC1,3,3,1,"Gross")),0,Menus!R4C10) -> 0 | N64: =OFFSET(INDIRECT(ADDRESS(RC1,3,3,1,"Gross")),0,Menus!R3C10) -> 0
A65: 115 | B65: =OFFSET(INDIRECT(ADDRESS(RC1,3,3,1,Menus!R10C11)),0,Menus!R4C10) -> 0 | C65: =OFFSET(INDIRECT(ADDRESS(RC1,3,3,1,Menus!R10C11)),0,Menus!R3C10) -> 0 | D65: =IF(Menus!R9C10,RC[-1]/RC[-2],RC[-1]) -> #DIV/0! | E65: =IF(RC11=1,VALUE(RC[-3]),NA()) -> NA() | F65: =INDIRECT(ADDRESS(RC1,1,3,1,Menus!R10C11)) -> 0 | G65: =IF(INDIRECT(ADDRESS(RC1,2,3,1,Menus!R10C11))=R1C,RC4,NA()) -> NA() | H65: =IF(INDIRECT(ADDRESS(RC1,2,3,1,Menus!R10C11))=R1C,RC4,NA()) -> NA() | I65: =IF(INDIRECT(ADDRESS(RC1,2,3,1,Menus!R10C11))=R1C,RC4,NA()) -> NA() | J65: =IF(INDIRECT(ADDRESS(RC1,1,3,1,Menus!R10C11))=T(R1C),RC4,NA()) -> NA() | K65: =IF(OR(ISNUMBER(RC7),ISNUMBER(RC8),ISNUMBER(RC9),ISNUMBER(RC10)),1,0) -> 0 | M65: =OFFSET(INDIRECT(ADDRESS(RC1,3,3,1,"Gross")),0,Menus!R4C10) -> -1 | N65: =OFFSET(INDIRECT(ADDRESS(RC1,3,3,1,"Gross")),0,Menus!R3C10) -> -1
A66: 73 | B66: =OFFSET(INDIRECT(ADDRESS(RC1,3,3,1,Menus!R10C11)),0,Menus!R4C10) -> 0 | C66: =OFFSET(INDIRECT(ADDRESS(RC1,3,3,1,Menus!R10C11)),0,Menus!R3C10) -> 0 | D66: =IF(Menus!R9C10,RC[-1]/RC[-2],RC[-1]) -> #DIV/0! | E66: =IF(RC11=1,VALUE(RC[-3]),NA()) -> NA() | F66: =INDIRECT(ADDRESS(RC1,1,3,1,Menus!R10C11)) -> 0 | G66: =IF(INDIRECT(ADDRESS(RC1,2,3,1,Menus!R10C11))=R1C,RC4,NA()) -> NA() | H66: =IF(INDIRECT(ADDRESS(RC1,2,3,1,Menus!R10C11))=R1C,RC4,NA()) -> NA() | I66: =IF(INDIRECT(ADDRESS(RC1,2,3,1,Menus!R10C11))=R1C,RC4,NA()) -> NA() | J66: =IF(INDIRECT(ADDRESS(RC1,1,3,1,Menus!R10C11))=T(R1C),RC4,NA()) -> NA() | K66: =IF(OR(ISNUMBER(RC7),ISNUMBER(RC8),ISNUMBER(RC9),ISNUMBER(RC10)),1,0) -> 0 | M66: =OFFSET(INDIRECT(ADDRESS(RC1,3,3,1,"Gross")),0,Menus!R4C10) -> 2 | N66: =OFFSET(INDIRECT(ADDRESS(RC1,3,3,1,"Gross")),0,Menus!R3C10) -> 2
A67: 100 | B67: =OFFSET(INDIRECT(ADDRESS(RC1,3,3,1,Menus!R10C11)),0,Menus!R4C10) -> 0 | C67: =OFFSET(INDIRECT(ADDRESS(RC1,3,3,1,Menus!R10C11)),0,Menus!R3C10) -> 0 | D67: =IF(Menus!R9C10,RC[-1]/RC[-2],RC[-1]) -> #DIV/0! | E67: =IF(RC11=1,VALUE(RC[-3]),NA()) -> NA() | F67: =INDIRECT(ADDRESS(RC1,1,3,1,Menus!R10C11)) -> 0 | G67: =IF(INDIRECT(ADDRESS(RC1,2,3,1,Menus!R10C11))=R1C,RC4,NA()) -> NA() | H67: =IF(INDIRECT(ADDRESS(RC1,2,3,1,Menus!R10C11))=R1C,RC4,NA()) -> NA() | I67: =IF(INDIRECT(ADDRESS(RC1,2,3,1,Menus!R10C11))=R1C,RC4,NA()) -> NA() | J67: =IF(INDIRECT(ADDRESS(RC1,1,3,1,Menus!R10C11))=T(R1C),RC4,NA()) -> NA() | K67: =IF(OR(ISNUMBER(RC7),ISNUMBER(RC8),ISNUMBER(RC9),ISNUMBER(RC10)),1,0) -> 0 | M67: =OFFSET(INDIRECT(ADDRESS(RC1,3,3,1,"Gross")),0,Menus!R4C10) -> 1 | N67: =OFFSET(INDIRECT(ADDRESS(RC1,3,3,1,"Gross")),0,Menus!R3C10) -> 0
A68: 82 | B68: =OFFSET(INDIRECT(ADDRESS(RC1,3,3,1,Menus!R10C11)),0,Menus!R4C10) -> 0 | C68: =OFFSET(INDIRECT(ADDRESS(RC1,3,3,1,Menus!R10C11)),0,Menus!R3C10) -> 0 | D68: =IF(Menus!R9C10,RC[-1]/RC[-2],RC[-1]) -> #DIV/0! | E68: =IF(RC11=1,VALUE(RC[-3]),NA()) -> NA() | F68: =INDIRECT(ADDRESS(RC1,1,3,1,Menus!R10C11)) -> 0 | G68: =IF(INDIRECT(ADDRESS(RC1,2,3,1,Menus!R10C11))=R1C,RC4,NA()) -> NA() | H68: =IF(INDIRECT(ADDRESS(RC1,2,3,1,Menus!R10C11))=R1C,RC4,NA()) -> NA() | I68: =IF(INDIRECT(ADDRESS(RC1,2,3,1,Menus!R10C11))=R1C,RC4,NA()) -> NA() | J68: =IF(INDIRECT(ADDRESS(RC1,1,3,1,Menus!R10C11))=T(R1C),RC4,NA()) -> NA() | K68: =IF(OR(ISNUMBER(RC7),ISNUMBER(RC8),ISNUMBER(RC9),ISNUMBER(RC10)),1,0) -> 0 | M68: =OFFSET(INDIRECT(ADDRESS(RC1,3,3,1,"Gross")),0,Menus!R4C10) -> 2 | N68: =OFFSET(INDIRECT(ADDRESS(RC1,3,3,1,"Gross")),0,Menus!R3C10) -> 2
A69: 178 | B69: =OFFSET(INDIRECT(ADDRESS(RC1,3,3,1,Menus!R10C11)),0,Menus!R4C10) -> 0 | C69: =OFFSET(INDIRECT(ADDRESS(RC1,3,3,1,Menus!R10C11)),0,Menus!R3C10) -> 0 | D69: =IF(Menus!R9C10,RC[-1]/RC[-2],RC[-1]) -> #DIV/0! | E69: =IF(RC11=1,VALUE(RC[-3]),NA()) -> NA() | F69: =INDIRECT(ADDRESS(RC1,1,3,1,Menus!R10C11)) -> 0 | G69: =IF(INDIRECT(ADDRESS(RC1,2,3,1,Menus!R10C11))=R1C,RC4,NA()) -> NA() | H69: =IF(INDIRECT(ADDRESS(RC1,2,3,1,Menus!R10C11))=R1C,RC4,NA()) -> NA() | I69: =IF(INDIRECT(ADDRESS(RC1,2,3,1,Menus!R10C11))=R1C,RC4,NA()) -> NA() | J69: =IF(INDIRECT(ADDRESS(RC1,1,3,1,Menus!R10C11))=T(R1C),RC4,NA()) -> NA() | K69: =IF(OR(ISNUMBER(RC7),ISNUMBER(RC8),ISNUMBER(RC9),ISNUMBER(RC10)),1,0) -> 0 | M69: =OFFSET(INDIRECT(ADDRESS(RC1,3,3,1,"Gross")),0,Menus!R4C10) -> 0 | N69: =OFFSET(INDIRECT(ADDRESS(RC1,3,3,1,"Gross")),0,Menus!R3C10) -> 0
A70: 117 | B70: =OFFSET(INDIRECT(ADDRESS(RC1,3,3,1,Menus!R10C11)),0,Menus!R4C10) -> 0 | C70: =OFFSET(INDIRECT(ADDRESS(RC1,3,3,1,Menus!R10C11)),0,Menus!R3C10) -> 0 | D70: =IF(Menus!R9C10,RC[-1]/RC[-2],RC[-1]) -> #DIV/0! | E70: =IF(RC11=1,VALUE(RC[-3]),NA()) -> NA() | F70: =INDIRECT(ADDRESS(RC1,1,3,1,Menus!R10C11)) -> 0 | G70: =IF(INDIRECT(ADDRESS(RC1,2,3,1,Menus!R10C11))=R1C,RC4,NA()) -> NA() | H70: =IF(INDIRECT(ADDRESS(RC1,2,3,1,Menus!R10C11))=R1C,RC4,NA()) -> NA() | I70: =IF(INDIRECT(ADDRESS(RC1,2,3,1,Menus!R10C11))=R1C,RC4,NA()) -> NA() | J70: =IF(INDIRECT(ADDRESS(RC1,1,3,1,Menus!R10C11))=T(R1C),RC4,NA()) -> NA() | K70: =IF(OR(ISNUMBER(RC7),ISNUMBER(RC8),ISNUMBER(RC9),ISNUMBER(RC10)),1,0) -> 0 | M70: =OFFSET(INDIRECT(ADDRESS(RC1,3,3,1,"Gross")),0,Menus!R4C10) -> 0 | N70: =OFFSET(INDIRECT(ADDRESS(RC1,3,3,1,"Gross")),0,Menus!R3C10) -> 0
A71: 150 | B71: =OFFSET(INDIRECT(ADDRESS(RC1,3,3,1,Menus!R10C11)),0,Menus!R4C10) -> 0 | C71: =OFFSET(INDIRECT(ADDRESS(RC1,3,3,1,Menus!R10C11)),0,Menus!R3C10) -> 0 | D71: =IF(Menus!R9C10,RC[-1]/RC[-2],RC[-1]) -> #DIV/0! | E71: =IF(RC11=1,VALUE(RC[-3]),NA()) -> NA() | F71: =INDIRECT(ADDRESS(RC1,1,3,1,Menus!R10C11)) -> 0 | G71: =IF(INDIRECT(ADDRESS(RC1,2,3,1,Menus!R10C11))=R1C,RC4,NA()) -> NA() | H71: =IF(INDIRECT(ADDRESS(RC1,2,3,1,Menus!R10C11))=R1C,RC4,NA()) -> NA() | I71: =IF(INDIRECT(ADDRESS(RC1,2,3,1,Menus!R10C11))=R1C,RC4,NA()) -> NA() | J71: =IF(INDIRECT(ADDRESS(RC1,1,3,1,Menus!R10C11))=T(R1C),RC4,NA()) -> NA() | K71: =IF(OR(ISNUMBER(RC7),ISNUMBER(RC8),ISNUMBER(RC9),ISNUMBER(RC10)),1,0) -> 0 | M71: =OFFSET(INDIRECT(ADDRESS(RC1,3,3,1,"Gross")),0,Menus!R4C10) -> 2 | N71: =OFFSET(INDIRECT(ADDRESS(RC1,3,3,1,"Gross")),0,Menus!R3C10) -> 2
A72: 184 | B72: =OFFSET(INDIRECT(ADDRESS(RC1,3,3,1,Menus!R10C11)),0,Menus!R4C10) -> 0 | C72: =OFFSET(INDIRECT(ADDRESS(RC1,3,3,1,Menus!R10C11)),0,Menus!R3C10) -> 0 | D72: =IF(Menus!R9C10,RC[-1]/RC[-2],RC[-1]) -> #DIV/0! | E72: =IF(RC11=1,VALUE(RC[-3]),NA()) -> NA() | F72: =INDIRECT(ADDRESS(RC1,1,3,1,Menus!R10C11)) -> 0 | G72: =IF(INDIRECT(ADDRESS(RC1,2,3,1,Menus!R10C11))=R1C,RC4,NA()) -> NA() | H72: =IF(INDIRECT(ADDRESS(RC1,2,3,1,Menus!R10C11))=R1C,RC4,NA()) -> NA() | I72: =IF(INDIRECT(ADDRESS(RC1,2,3,1,Menus!R10C11))=R1C,RC4,NA()) -> NA() | J72: =IF(INDIRECT(ADDRESS(RC1,1,3,1,Menus!R10C11))=T(R1C),RC4,NA()) -> NA() | K72: =IF(OR(ISNUMBER(RC7),ISNUMBER(RC8),ISNUMBER(RC9),ISNUMBER(RC10)),1,0) -> 0 | M72: =OFFSET(INDIRECT(ADDRESS(RC1,3,3,1,"Gross")),0,Menus!R4C10) -> 0 | N72: =OFFSET(INDIRECT(ADDRESS(RC1,3,3,1,"Gross")),0,Menus!R3C10) -> 0
A73: 143 | B73: =OFFSET(INDIRECT(ADDRESS(RC1,3,3,1,Menus!R10C11)),0,Menus!R4C10) -> 0 | C73: =OFFSET(INDIRECT(ADDRESS(RC1,3,3,1,Menus!R10C11)),0,Menus!R3C10) -> 0 | D73: =IF(Menus!R9C10,RC[-1]/RC[-2],RC[-1]) -> #DIV/0! | E73: =IF(RC11=1,VALUE(RC[-3]),NA()) -> NA() | F73: =INDIRECT(ADDRESS(RC1,1,3,1,Menus!R10C11)) -> 0 | G73: =IF(INDIRECT(ADDRESS(RC1,2,3,1,Menus!R10C11))=R1C,RC4,NA()) -> NA() | H73: =IF(INDIRECT(ADDRESS(RC1,2,3,1,Menus!R10C11))=R1C,RC4,NA()) -> NA() | I73: =IF(INDIRECT(ADDRESS(RC1,2,3,1,Menus!R10C11))=R1C,RC4,NA()) -> NA() | J73: =IF(INDIRECT(ADDRESS(RC1,1,3,1,Menus!R10C11))=T(R1C),RC4,NA()) -> NA() | K73: =IF(OR(ISNUMBER(RC7),ISNUMBER(RC8),ISNUMBER(RC9),ISNUMBER(RC10)),1,0) -> 0 | M73: =OFFSET(INDIRECT(ADDRESS(RC1,3,3,1,"Gross")),0,Menus!R4C10) -> 0 | N73: =OFFSET(INDIRECT(ADDRESS(RC1,3,3,1,"Gross")),0,Menus!R3C10) -> 2
A74: 105 | B74: =OFFSET(INDIRECT(ADDRESS(RC1,3,3,1,Menus!R10C11)),0,Menus!R4C10) -> 0 | C74: =OFFSET(INDIRECT(ADDRESS(RC1,3,3,1,Menus!R10C11)),0,Menus!R3C10) -> 0 | D74: =IF(Menus!R9C10,RC[-1]/RC[-2],RC[-1]) -> #DIV/0! | E74: =IF(RC11=1,VALUE(RC[-3]),NA()) -> NA() | F74: =INDIRECT(ADDRESS(RC1,1,3,1,Menus!R10C11)) -> 0 | G74: =IF(INDIRECT(ADDRESS(RC1,2,3,1,Menus!R10C11))=R1C,RC4,NA()) -> NA() | H74: =IF(INDIRECT(ADDRESS(RC1,2,3,1,Menus!R10C11))=R1C,RC4,NA()) -> NA() | I74: =IF(INDIRECT(ADDRESS(RC1,2,3,1,Menus!R10C11))=R1C,RC4,NA()) -> NA() | J74: =IF(INDIRECT(ADDRESS(RC1,1,3,1,Menus!R10C11))=T(R1C),RC4,NA()) -> NA() | K74: =IF(OR(ISNUMBER(RC7),ISNUMBER(RC8),ISNUMBER(RC9),ISNUMBER(RC10)),1,0) -> 0 | M74: =OFFSET(INDIRECT(ADDRESS(RC1,3,3,1,"Gross")),0,Menus!R4C10) -> 0 | N74: =OFFSET(INDIRECT(ADDRESS(RC1,3,3,1,"Gross")),0,Menus!R3C10) -> 0
A75: 146 | B75: =OFFSET(INDIRECT(ADDRESS(RC1,3,3,1,Menus!R10C11)),0,Menus!R4C10) -> 0 | C75: =OFFSET(INDIRECT(ADDRESS(RC1,3,3,1,Menus!R10C11)),0,Menus!R3C10) -> 0 | D75: =IF(Menus!R9C10,RC[-1]/RC[-2],RC[-1]) -> #DIV/0! | E75: =IF(RC11=1,VALUE(RC[-3]),NA()) -> NA() | F75: =INDIRECT(ADDRESS(RC1,1,3,1,Menus!R10C11)) -> 0 | G75: =IF(INDIRECT(ADDRESS(RC1,2,3,1,Menus!R10C11))=R1C,RC4,NA()) -> NA() | H75: =IF(INDIRECT(ADDRESS(RC1,2,3,1,Menus!R10C11))=R1C,RC4,NA()) -> NA() | I75: =IF(INDIRECT(ADDRESS(RC1,2,3,1,Menus!R10C11))=R1C,RC4,NA()) -> NA() | J75: =IF(INDIRECT(ADDRESS(RC1,1,3,1,Menus!R10C11))=T(R1C),RC4,NA()) -> NA() | K75: =IF(OR(ISNUMBER(RC7),ISNUMBER(RC8),ISNUMBER(RC9),ISNUMBER(RC10)),1,0) -> 0 | M75: =OFFSET(INDIRECT(ADDRESS(RC1,3,3,1,"Gross")),0,Menus!R4C10) -> 0 | N75: =OFFSET(INDIRECT(ADDRESS(RC1,3,3,1,"Gross")),0,Menus!R3C10) -> 0
A76: 62 | B76: =OFFSET(INDIRECT(ADDRESS(RC1,3,3,1,Menus!R10C11)),0,Menus!R4C10) -> 0 | C76: =OFFSET(INDIRECT(ADDRESS(RC1,3,3,1,Menus!R10C11)),0,Menus!R3C10) -> 0 | D76: =IF(Menus!R9C10,RC[-1]/RC[-2],RC[-1]) -> #DIV/0! | E76: =IF(RC11=1,VALUE(RC[-3]),NA()) -> NA() | F76: =INDIRECT(ADDRESS(RC1,1,3,1,Menus!R10C11)) -> 0 | G76: =IF(INDIRECT(ADDRESS(RC1,2,3,1,Menus!R10C11))=R1C,RC4,NA()) -> NA() | H76: =IF(INDIRECT(ADDRESS(RC1,2,3,1,Menus!R10C11))=R1C,RC4,NA()) -> NA() | I76: =IF(INDIRECT(ADDRESS(RC1,2,3,1,Menus!R10C11))=R1C,RC4,NA()) -> NA() | J76: =IF(INDIRECT(ADDRESS(RC1,1,3,1,Menus!R10C11))=T(R1C),RC4,NA()) -> NA() | K76: =IF(OR(ISNUMBER(RC7),ISNUMBER(RC8),ISNUMBER(RC9),ISNUMBER(RC10)),1,0) -> 0 | M76: =OFFSET(INDIRECT(ADDRESS(RC1,3,3,1,"Gross")),0,Menus!R4C10) -> 1 | N76: =OFFSET(INDIRECT(ADDRESS(RC1,3,3,1,"Gross")),0,Menus!R3C10) -> 1
A77: 154 | B77: =OFFSET(INDIRECT(ADDRESS(RC1,3,3,1,Menus!R10C11)),0,Menus!R4C10) -> 0 | C77: =OFFSET(INDIRECT(ADDRESS(RC1,3,3,1,Menus!R10C11)),0,Menus!R3C10) -> 0 | D77: =IF(Menus!R9C10,RC[-1]/RC[-2],RC[-1]) -> #DIV/0! | E77: =IF(RC11=1,VALUE(RC[-3]),NA()) -> NA() | F77: =INDIRECT(ADDRESS(RC1,1,3,1,Menus!R10C11)) -> 0 | G77: =IF(INDIRECT(ADDRESS(RC1,2,3,1,Menus!R10C11))=R1C,RC4,NA()) -> NA() | H77: =IF(INDIRECT(ADDRESS(RC1,2,3,1,Menus!R10C11))=R1C,RC4,NA()) -> NA() | I77: =IF(INDIRECT(ADDRESS(RC1,2,3,1,Menus!R10C11))=R1C,RC4,NA()) -> NA() | J77: =IF(INDIRECT(ADDRESS(RC1,1,3,1,Menus!R10C11))=T(R1C),RC4,NA()) -> NA() | K77: =IF(OR(ISNUMBER(RC7),ISNUMBER(RC8),ISNUMBER(RC9),ISNUMBER(RC10)),1,0) -> 0 | M77: =OFFSET(INDIRECT(ADDRESS(RC1,3,3,1,"Gross")),0,Menus!R4C10) -> 1 | N77: =OFFSET(INDIRECT(ADDRESS(RC1,3,3,1,"Gross")),0,Menus!R3C10) -> 2
A78: 88 | B78: =OFFSET(INDIRECT(ADDRESS(RC1,3,3,1,Menus!R10C11)),0,Menus!R4C10) -> 0 | C78: =OFFSET(INDIRECT(ADDRESS(RC1,3,3,1,Menus!R10C11)),0,Menus!R3C10) -> 0 | D78: =IF(Menus!R9C10,RC[-1]/RC[-2],RC[-1]) -> #DIV/0! | E78: =IF(RC11=1,VALUE(RC[-3]),NA()) -> NA() | F78: =INDIRECT(ADDRESS(RC1,1,3,1,Menus!R10C11)) -> 0 | G78: =IF(INDIRECT(ADDRESS(RC1,2,3,1,Menus!R10C11))=R1C,RC4,NA()) -> NA() | H78: =IF(INDIRECT(ADDRESS(RC1,2,3,1,Menus!R10C11))=R1C,RC4,NA()) -> NA() | I78: =IF(INDIRECT(ADDRESS(RC1,2,3,1,Menus!R10C11))=R1C,RC4,NA()) -> NA() | J78: =IF(INDIRECT(ADDRESS(RC1,1,3,1,Menus!R10C11))=T(R1C),RC4,NA()) -> NA() | K78: =IF(OR(ISNUMBER(RC7),ISNUMBER(RC8),ISNUMBER(RC9),ISNUMBER(RC10)),1,0) -> 0 | M78: =OFFSET(INDIRECT(ADDRESS(RC1,3,3,1,"Gross")),0,Menus!R4C10) -> 0 | N78: =OFFSET(INDIRECT(ADDRESS(RC1,3,3,1,"Gross")),0,Menus!R3C10) -> 0
A79: 109 | B79: =OFFSET(INDIRECT(ADDRESS(RC1,3,3,1,Menus!R10C11)),0,Menus!R4C10) -> 0 | C79: =OFFSET(INDIRECT(ADDRESS(RC1,3,3,1,Menus!R10C11)),0,Menus!R3C10) -> 0 | D79: =IF(Menus!R9C10,RC[-1]/RC[-2],RC[-1]) -> #DIV/0! | E79: =IF(RC11=1,VALUE(RC[-3]),NA()) -> NA() | F79: =INDIRECT(ADDRESS(RC1,1,3,1,Menus!R10C11)) -> 0 | G79: =IF(INDIRECT(ADDRESS(RC1,2,3,1,Menus!R10C11))=R1C,RC4,NA()) -> NA() | H79: =IF(INDIRECT(ADDRESS(RC1,2,3,1,Menus!R10C11))=R1C,RC4,NA()) -> NA() | I79: =IF(INDIRECT(ADDRESS(RC1,2,3,1,Menus!R10C11))=R1C,RC4,NA()) -> NA() | J79: =IF(INDIRECT(ADDRESS(RC1,1,3,1,Menus!R10C11))=T(R1C),RC4,NA()) -> NA() | K79: =IF(OR(ISNUMBER(RC7),ISNUMBER(RC8),ISNUMBER(RC9),ISNUMBER(RC10)),1,0) -> 0 | M79: =OFFSET(INDIRECT(ADDRESS(RC1,3,3,1,"Gross")),0,Menus!R4C10) -> 0 | N79: =OFFSET(INDIRECT(ADDRESS(RC1,3,3,1,"Gross")),0,Menus!R3C10) -> 0
A80: 160 | B80: =OFFSET(INDIRECT(ADDRESS(RC1,3,3,1,Menus!R10C11)),0,Menus!R4C10) -> 0 | C80: =OFFSET(INDIRECT(ADDRESS(RC1,3,3,1,Menus!R10C11)),0,Menus!R3C10) -> 0 | D80: =IF(Menus!R9C10,RC[-1]/RC[-2],RC[-1]) -> #DIV/0! | E80: =IF(RC11=1,VALUE(RC[-3]),NA()) -> NA() | F80: =INDIRECT(ADDRESS(RC1,1,3,1,Menus!R10C11)) -> 0 | G80: =IF(INDIRECT(ADDRESS(RC1,2,3,1,Menus!R10C11))=R1C,RC4,NA()) -> NA() | H80: =IF(INDIRECT(ADDRESS(RC1,2,3,1,Menus!R10C11))=R1C,RC4,NA()) -> NA() | I80: =IF(INDIRECT(ADDRESS(RC1,2,3,1,Menus!R10C11))=R1C,RC4,NA()) -> NA() | J80: =IF(INDIRECT(ADDRESS(RC1,1,3,1,Menus!R10C11))=T(R1C),RC4,NA()) -> NA() | K80: =IF(OR(ISNUMBER(RC7),ISNUMBER(RC8),ISNUMBER(RC9),ISNUMBER(RC10)),1,0) -> 0 | M80: =OFFSET(INDIRECT(ADDRESS(RC1,3,3,1,"Gross")),0,Menus!R4C10) -> 0 | N80: =OFFSET(INDIRECT(ADDRESS(RC1,3,3,1,"Gross")),0,Menus!R3C10) -> 0
A81: 81 | B81: =OFFSET(INDIRECT(ADDRESS(RC1,3,3,1,Menus!R10C11)),0,Menus!R4C10) -> 0 | C81: =OFFSET(INDIRECT(ADDRESS(RC1,3,3,1,Menus!R10C11)),0,Menus!R3C10) -> 0 | D81: =IF(Menus!R9C10,RC[-1]/RC[-2],RC[-1]) -> #DIV/0! | E81: =IF(RC11=1,VALUE(RC[-3]),NA()) -> NA() | F81: =INDIRECT(ADDRESS(RC1,1,3,1,Menus!R10C11)) -> 0 | G81: =IF(INDIRECT(ADDRESS(RC1,2,3,1,Menus!R10C11))=R1C,RC4,NA()) -> NA() | H81: =IF(INDIRECT(ADDRESS(RC1,2,3,1,Menus!R10C11))=R1C,RC4,NA()) -> NA() | I81: =IF(INDIRECT(ADDRESS(RC1,2,3,1,Menus!R10C11))=R1C,RC4,NA()) -> NA() | J81: =IF(INDIRECT(ADDRESS(RC1,1,3,1,Menus!R10C11))=T(R1C),RC4,NA()) -> NA() | K81: =IF(OR(ISNUMBER(RC7),ISNUMBER(RC8),ISNUMBER(RC9),ISNUMBER(RC10)),1,0) -> 0 | M81: =OFFSET(INDIRECT(ADDRESS(RC1,3,3,1,"Gross")),0,Menus!R4C10) -> 2 | N81: =OFFSET(INDIRECT(ADDRESS(RC1,3,3,1,"Gross")),0,Menus!R3C10) -> 2
A82: 112 | B82: =OFFSET(INDIRECT(ADDRESS(RC1,3,3,1,Menus!R10C11)),0,Menus!R4C10) -> 0 | C82: =OFFSET(INDIRECT(ADDRESS(RC1,3,3,1,Menus!R10C11)),0,Menus!R3C10) -> 0 | D82: =IF(Menus!R9C10,RC[-1]/RC[-2],RC[-1]) -> #DIV/0! | E82: =IF(RC11=1,VALUE(RC[-3]),NA()) -> NA() | F82: =INDIRECT(ADDRESS(RC1,1,3,1,Menus!R10C11)) -> 0 | G82: =IF(INDIRECT(ADDRESS(RC1,2,3,1,Menus!R10C11))=R1C,RC4,NA()) -> NA() | H82: =IF(INDIRECT(ADDRESS(RC1,2,3,1,Menus!R10C11))=R1C,RC4,NA()) -> NA() | I82: =IF(INDIRECT(ADDRESS(RC1,2,3,1,Menus!R10C11))=R1C,RC4,NA()) -> NA() | J82: =IF(INDIRECT(ADDRESS(RC1,1,3,1,Menus!R10C11))=T(R1C),RC4,NA()) -> NA() | K82: =IF(OR(ISNUMBER(RC7),ISNUMBER(RC8),ISNUMBER(RC9),ISNUMBER(RC10)),1,0) -> 0 | M82: =OFFSET(INDIRECT(ADDRESS(RC1,3,3,1,"Gross")),0,Menus!R4C10) -> 0 | N82: =OFFSET(INDIRECT(ADDRESS(RC1,3,3,1,"Gross")),0,Menus!R3C10) -> 0
A83: 68 | B83: =OFFSET(INDIRECT(ADDRESS(RC1,3,3,1,Menus!R10C11)),0,Menus!R4C10) -> 0 | C83: =OFFSET(INDIRECT(ADDRESS(RC1,3,3,1,Menus!R10C11)),0,Menus!R3C10) -> 0 | D83: =IF(Menus!R9C10,RC[-1]/RC[-2],RC[-1]) -> #DIV/0! | E83: =IF(RC11=1,VALUE(RC[-3]),NA()) -> NA() | F83: =INDIRECT(ADDRESS(RC1,1,3,1,Menus!R10C11)) -> 0 | G83: =IF(INDIRECT(ADDRESS(RC1,2,3,1,Menus!R10C11))=R1C,RC4,NA()) -> NA() | H83: =IF(INDIRECT(ADDRESS(RC1,2,3,1,Menus!R10C11))=R1C,RC4,NA()) -> NA() | I83: =IF(INDIRECT(ADDRESS(RC1,2,3,1,Menus!R10C11))=R1C,RC4,NA()) -> NA() | J83: =IF(INDIRECT(ADDRESS(RC1,1,3,1,Menus!R10C11))=T(R1C),RC4,NA()) -> NA() | K83: =IF(OR(ISNUMBER(RC7),ISNUMBER(RC8),ISNUMBER(RC9),ISNUMBER(RC10)),1,0) -> 0 | M83: =OFFSET(INDIRECT(ADDRESS(RC1,3,3,1,"Gross")),0,Menus!R4C10) -> 1 | N83: =OFFSET(INDIRECT(ADDRESS(RC1,3,3,1,"Gross")),0,Menus!R3C10) -> 2
A84: 190 | B84: =OFFSET(INDIRECT(ADDRESS(RC1,3,3,1,Menus!R10C11)),0,Menus!R4C10) -> 0 | C84: =OFFSET(INDIRECT(ADDRESS(RC1,3,3,1,Menus!R10C11)),0,Menus!R3C10) -> 0 | D84: =IF(Menus!R9C10,RC[-1]/RC[-2],RC[-1]) -> #DIV/0! | E84: =IF(RC11=1,VALUE(RC[-3]),NA()) -> NA() | F84: =INDIRECT(ADDRESS(RC1,1,3,1,Menus!R10C11)) -> 0 | G84: =IF(INDIRECT(ADDRESS(RC1,2,3,1,Menus!R10C11))=R1C,RC4,NA()) -> NA() | H84: =IF(INDIRECT(ADDRESS(RC1,2,3,1,Menus!R10C11))=R1C,RC4,NA()) -> NA() | I84: =IF(INDIRECT(ADDRESS(RC1,2,3,1,Menus!R10C11))=R1C,RC4,NA()) -> NA() | J84: =IF(INDIRECT(ADDRESS(RC1,1,3,1,Menus!R10C11))=T(R1C),RC4,NA()) -> NA() | K84: =IF(OR(ISNUMBER(RC7),ISNUMBER(RC8),ISNUMBER(RC9),ISNUMBER(RC10)),1,0) -> 0 | M84: =OFFSET(INDIRECT(ADDRESS(RC1,3,3,1,"Gross")),0,Menus!R4C10) -> 0 | N84: =OFFSET(INDIRECT(ADDRESS(RC1,3,3,1,"Gross")),0,Menus!R3C10) -> 0
A85: 69 | B85: =OFFSET(INDIRECT(ADDRESS(RC1,3,3,1,Menus!R10C11)),0,Menus!R4C10) -> 0 | C85: =OFFSET(INDIRECT(ADDRESS(RC1,3,3,1,Menus!R10C11)),0,Menus!R3C10) -> 0 | D85: =IF(Menus!R9C10,RC[-1]/RC[-2],RC[-1]) -> #DIV/0! | E85: =IF(RC11=1,VALUE(RC[-3]),NA()) -> NA() | F85: =INDIRECT(ADDRESS(RC1,1,3,1,Menus!R10C11)) -> 0 | G85: =IF(INDIRECT(ADDRESS(RC1,2,3,1,Menus!R10C11))=R1C,RC4,NA()) -> NA() | H85: =IF(INDIRECT(ADDRESS(RC1,2,3,1,Menus!R10C11))=R1C,RC4,NA()) -> NA() | I85: =IF(INDIRECT(ADDRESS(RC1,2,3,1,Menus!R10C11))=R1C,RC4,NA()) -> NA() | J85: =IF(INDIRECT(ADDRESS(RC1,1,3,1,Menus!R10C11))=T(R1C),RC4,NA()) -> NA() | K85: =IF(OR(ISNUMBER(RC7),ISNUMBER(RC8),ISNUMBER(RC9),ISNUMBER(RC10)),1,0) -> 0 | M85: =OFFSET(INDIRECT(ADDRESS(RC1,3,3,1,"Gross")),0,Menus!R4C10) -> 0 | N85: =OFFSET(INDIRECT(ADDRESS(RC1,3,3,1,"Gross")),0,Menus!R3C10) -> 0
A86: 134 | B86: =OFFSET(INDIRECT(ADDRESS(RC1,3,3,1,Menus!R10C11)),0,Menus!R4C10) -> 0 | C86: =OFFSET(INDIRECT(ADDRESS(RC1,3,3,1,Menus!R10C11)),0,Menus!R3C10) -> 0 | D86: =IF(Menus!R9C10,RC[-1]/RC[-2],RC[-1]) -> #DIV/0! | E86: =IF(RC11=1,VALUE(RC[-3]),NA()) -> NA() | F86: =INDIRECT(ADDRESS(RC1,1,3,1,Menus!R10C11)) -> 0 | G86: =IF(INDIRECT(ADDRESS(RC1,2,3,1,Menus!R10C11))=R1C,RC4,NA()) -> NA() | H86: =IF(INDIRECT(ADDRESS(RC1,2,3,1,Menus!R10C11))=R1C,RC4,NA()) -> NA() | I86: =IF(INDIRECT(ADDRESS(RC1,2,3,1,Menus!R10C11))=R1C,RC4,NA()) -> NA() | J86: =IF(INDIRECT(ADDRESS(RC1,1,3,1,Menus!R10C11))=T(R1C),RC4,NA()) -> NA() | K86: =IF(OR(ISNUMBER(RC7),ISNUMBER(RC8),ISNUMBER(RC9),ISNUMBER(RC10)),1,0) -> 0 | M86: =OFFSET(INDIRECT(ADDRESS(RC1,3,3,1,"Gross")),0,Menus!R4C10) -> 0 | N86: =OFFSET(INDIRECT(ADDRESS(RC1,3,3,1,"Gross")),0,Menus!R3C10) -> 2
A87: 135 | B87: =OFFSET(INDIRECT(ADDRESS(RC1,3,3,1,Menus!R10C11)),0,Menus!R4C10) -> 0 | C87: =OFFSET(INDIRECT(ADDRESS(RC1,3,3,1,Menus!R10C11)),0,Menus!R3C10) -> 0 | D87: =IF(Menus!R9C10,RC[-1]/RC[-2],RC[-1]) -> #DIV/0! | E87: =IF(RC11=1,VALUE(RC[-3]),NA()) -> NA() | F87: =INDIRECT(ADDRESS(RC1,1,3,1,Menus!R10C11)) -> 0 | G87: =IF(INDIRECT(ADDRESS(RC1,2,3,1,Menus!R10C11))=R1C,RC4,NA()) -> NA() | H87: =IF(INDIRECT(ADDRESS(RC1,2,3,1,Menus!R10C11))=R1C,RC4,NA()) -> NA() | I87: =IF(INDIRECT(ADDRESS(RC1,2,3,1,Menus!R10C11))=R1C,RC4,NA()) -> NA() | J87: =IF(INDIRECT(ADDRESS(RC1,1,3,1,Menus!R10C11))=T(R1C),RC4,NA()) -> NA() | K87: =IF(OR(ISNUMBER(RC7),ISNUMBER(RC8),ISNUMBER(RC9),ISNUMBER(RC10)),1,0) -> 0 | M87: =OFFSET(INDIRECT(ADDRESS(RC1,3,3,1,"Gross")),0,Menus!R4C10) -> 0 | N87: =OFFSET(INDIRECT(ADDRESS(RC1,3,3,1,"Gross")),0,Menus!R3C10) -> 0
A88: 193 | B88: =OFFSET(INDIRECT(ADDRESS(RC1,3,3,1,Menus!R10C11)),0,Menus!R4C10) -> 0 | C88: =OFFSET(INDIRECT(ADDRESS(RC1,3,3,1,Menus!R10C11)),0,Menus!R3C10) -> 0 | D88: =IF(Menus!R9C10,RC[-1]/RC[-2],RC[-1]) -> #DIV/0! | E88: =IF(RC11=1,VALUE(RC[-3]),NA()) -> NA() | F88: =INDIRECT(ADDRESS(RC1,1,3,1,Menus!R10C11)) -> 0 | G88: =IF(INDIRECT(ADDRESS(RC1,2,3,1,Menus!R10C11))=R1C,RC4,NA()) -> NA() | H88: =IF(INDIRECT(ADDRESS(RC1,2,3,1,Menus!R10C11))=R1C,RC4,NA()) -> NA() | I88: =IF(INDIRECT(ADDRESS(RC1,2,3,1,Menus!R10C11))=R1C,RC4,NA()) -> NA() | J88: =IF(INDIRECT(ADDRESS(RC1,1,3,1,Menus!R10C11))=T(R1C),RC4,NA()) -> NA() | K88: =IF(OR(ISNUMBER(RC7),ISNUMBER(RC8),ISNUMBER(RC9),ISNUMBER(RC10)),1,0) -> 0 | M88: =OFFSET(INDIRECT(ADDRESS(RC1,3,3,1,"Gross")),0,Menus!R4C10) -> 0 | N88: =OFFSET(INDIRECT(ADDRESS(RC1,3,3,1,"Gross")),0,Menus!R3C10) -> 0
A89: 55 | B89: =OFFSET(INDIRECT(ADDRESS(RC1,3,3,1,Menus!R10C11)),0,Menus!R4C10) -> 0 | C89: =OFFSET(INDIRECT(ADDRESS(RC1,3,3,1,Menus!R10C11)),0,Menus!R3C10) -> 0 | D89: =IF(Menus!R9C10,RC[-1]/RC[-2],RC[-1]) -> #DIV/0! | E89: =IF(RC11=1,VALUE(RC[-3]),NA()) -> NA() | F89: =INDIRECT(ADDRESS(RC1,1,3,1,Menus!R10C11)) -> 0 | G89: =IF(INDIRECT(ADDRESS(RC1,2,3,1,Menus!R10C11))=R1C,RC4,NA()) -> NA() | H89: =IF(INDIRECT(ADDRESS(RC1,2,3,1,Menus!R10C11))=R1C,RC4,NA()) -> NA() | I89: =IF(INDIRECT(ADDRESS(RC1,2,3,1,Menus!R10C11))=R1C,RC4,NA()) -> NA() | J89: =IF(INDIRECT(ADDRESS(RC1,1,3,1,Menus!R10C11))=T(R1C),RC4,NA()) -> NA() | K89: =IF(OR(ISNUMBER(RC7),ISNUMBER(RC8),ISNUMBER(RC9),ISNUMBER(RC10)),1,0) -> 0 | M89: =OFFSET(INDIRECT(ADDRESS(RC1,3,3,1,"Gross")),0,Menus!R4C10) -> 0 | N89: =OFFSET(INDIRECT(ADDRESS(RC1,3,3,1,"Gross")),0,Menus!R3C10) -> 0
A90: 188 | B90: =OFFSET(INDIRECT(ADDRESS(RC1,3,3,1,Menus!R10C11)),0,Menus!R4C10) -> 0 | C90: =OFFSET(INDIRECT(ADDRESS(RC1,3,3,1,Menus!R10C11)),0,Menus!R3C10) -> 0 | D90: =IF(Menus!R9C10,RC[-1]/RC[-2],RC[-1]) -> #DIV/0! | E90: =IF(RC11=1,VALUE(RC[-3]),NA()) -> NA() | F90: =INDIRECT(ADDRESS(RC1,1,3,1,Menus!R10C11)) -> 0 | G90: =IF(INDIRECT(ADDRESS(RC1,2,3,1,Menus!R10C11))=R1C,RC4,NA()) -> NA() | H90: =IF(INDIRECT(ADDRESS(RC1,2,3,1,Menus!R10C11))=R1C,RC4,NA()) -> NA() | I90: =IF(INDIRECT(ADDRESS(RC1,2,3,1,Menus!R10C11))=R1C,RC4,NA()) -> NA() | J90: =IF(INDIRECT(ADDRESS(RC1,1,3,1,Menus!R10C11))=T(R1C),RC4,NA()) -> NA() | K90: =IF(OR(ISNUMBER(RC7),ISNUMBER(RC8),ISNUMBER(RC9),ISNUMBER(RC10)),1,0) -> 0 | M90: =OFFSET(INDIRECT(ADDRESS(RC1,3,3,1,"Gross")),0,Menus!R4C10) -> 0 | N90: =OFFSET(INDIRECT(ADDRESS(RC1,3,3,1,"Gross")),0,Menus!R3C10) -> 0
A91: 116 | B91: =OFFSET(INDIRECT(ADDRESS(RC1,3,3,1,Menus!R10C11)),0,Menus!R4C10) -> 0 | C91: =OFFSET(INDIRECT(ADDRESS(RC1,3,3,1,Menus!R10C11)),0,Menus!R3C10) -> 0 | D91: =IF(Menus!R9C10,RC[-1]/RC[-2],RC[-1]) -> #DIV/0! | E91: =IF(RC11=1,VALUE(RC[-3]),NA()) -> NA() | F91: =INDIRECT(ADDRESS(RC1,1,3,1,Menus!R10C11)) -> 0 | G91: =IF(INDIRECT(ADDRESS(RC1,2,3,1,Menus!R10C11))=R1C,RC4,NA()) -> NA() | H91: =IF(INDIRECT(ADDRESS(RC1,2,3,1,Menus!R10C11))=R1C,RC4,NA()) -> NA() | I91: =IF(INDIRECT(ADDRESS(RC1,2,3,1,Menus!R10C11))=R1C,RC4,NA()) -> NA() | J91: =IF(INDIRECT(ADDRESS(RC1,1,3,1,Menus!R10C11))=T(R1C),RC4,NA()) -> NA() | K91: =IF(OR(ISNUMBER(RC7),ISNUMBER(RC8),ISNUMBER(RC9),ISNUMBER(RC10)),1,0) -> 0 | M91: =OFFSET(INDIRECT(ADDRESS(RC1,3,3,1,"Gross")),0,Menus!R4C10) -> 0 | N91: =OFFSET(INDIRECT(ADDRESS(RC1,3,3,1,"Gross")),0,Menus!R3C10) -> 0
A92: 95 | B92: =OFFSET(INDIRECT(ADDRESS(RC1,3,3,1,Menus!R10C11)),0,Menus!R4C10) -> 0 | C92: =OFFSET(INDIRECT(ADDRESS(RC1,3,3,1,Menus!R10C11)),0,Menus!R3C10) -> 0 | D92: =IF(Menus!R9C10,RC[-1]/RC[-2],RC[-1]) -> #DIV/0! | E92: =IF(RC11=1,VALUE(RC[-3]),NA()) -> NA() | F92: =INDIRECT(ADDRESS(RC1,1,3,1,Menus!R10C11)) -> 0 | G92: =IF(INDIRECT(ADDRESS(RC1,2,3,1,Menus!R10C11))=R1C,RC4,NA()) -> NA() | H92: =IF(INDIRECT(ADDRESS(RC1,2,3,1,Menus!R10C11))=R1C,RC4,NA()) -> NA() | I92: =IF(INDIRECT(ADDRESS(RC1,2,3,1,Menus!R10C11))=R1C,RC4,NA()) -> NA() | J92: =IF(INDIRECT(ADDRESS(RC1,1,3,1,Menus!R10C11))=T(R1C),RC4,NA()) -> NA() | K92: =IF(OR(ISNUMBER(RC7),ISNUMBER(RC8),ISNUMBER(RC9),ISNUMBER(RC10)),1,0) -> 0 | M92: =OFFSET(INDIRECT(ADDRESS(RC1,3,3,1,"Gross")),0,Menus!R4C10) -> 0 | N92: =OFFSET(INDIRECT(ADDRESS(RC1,3,3,1,"Gross")),0,Menus!R3C10) -> 0
A93: 181 | B93: =OFFSET(INDIRECT(ADDRESS(RC1,3,3,1,Menus!R10C11)),0,Menus!R4C10) -> 0 | C93: =OFFSET(INDIRECT(ADDRESS(RC1,3,3,1,Menus!R10C11)),0,Menus!R3C10) -> 0 | D93: =IF(Menus!R9C10,RC[-1]/RC[-2],RC[-1]) -> #DIV/0! | E93: =IF(RC11=1,VALUE(RC[-3]),NA()) -> NA() | F93: =INDIRECT(ADDRESS(RC1,1,3,1,Menus!R10C11)) -> 0 | G93: =IF(INDIRECT(ADDRESS(RC1,2,3,1,Menus!R10C11))=R1C,RC4,NA()) -> NA() | H93: =IF(INDIRECT(ADDRESS(RC1,2,3,1,Menus!R10C11))=R1C,RC4,NA()) -> NA() | I93: =IF(INDIRECT(ADDRESS(RC1,2,3,1,Menus!R10C11))=R1C,RC4,NA()) -> NA() | J93: =IF(INDIRECT(ADDRESS(RC1,1,3,1,Menus!R10C11))=T(R1C),RC4,NA()) -> NA() | K93: =IF(OR(ISNUMBER(RC7),ISNUMBER(RC8),ISNUMBER(RC9),ISNUMBER(RC10)),1,0) -> 0 | M93: =OFFSET(INDIRECT(ADDRESS(RC1,3,3,1,"Gross")),0,Menus!R4C10) -> 0 | N93: =OFFSET(INDIRECT(ADDRESS(RC1,3,3,1,"Gross")),0,Menus!R3C10) -> 0
A94: 161 | B94: =OFFSET(INDIRECT(ADDRESS(RC1,3,3,1,Menus!R10C11)),0,Menus!R4C10) -> 0 | C94: =OFFSET(INDIRECT(ADDRESS(RC1,3,3,1,Menus!R10C11)),0,Menus!R3C10) -> 0 | D94: =IF(Menus!R9C10,RC[-1]/RC[-2],RC[-1]) -> #DIV/0! | E94: =IF(RC11=1,VALUE(RC[-3]),NA()) -> NA() | F94: =INDIRECT(ADDRESS(RC1,1,3,1,Menus!R10C11)) -> 0 | G94: =IF(INDIRECT(ADDRESS(RC1,2,3,1,Menus!R10C11))=R1C,RC4,NA()) -> NA() | H94: =IF(INDIRECT(ADDRESS(RC1,2,3,1,Menus!R10C11))=R1C,RC4,NA()) -> NA() | I94: =IF(INDIRECT(ADDRESS(RC1,2,3,1,Menus!R10C11))=R1C,RC4,NA()) -> NA() | J94: =IF(INDIRECT(ADDRESS(RC1,1,3,1,Menus!R10C11))=T(R1C),RC4,NA()) -> NA() | K94: =IF(OR(ISNUMBER(RC7),ISNUMBER(RC8),ISNUMBER(RC9),ISNUMBER(RC10)),1,0) -> 0 | M94: =OFFSET(INDIRECT(ADDRESS(RC1,3,3,1,"Gross")),0,Menus!R4C10) -> 0 | N94: =OFFSET(INDIRECT(ADDRESS(RC1,3,3,1,"Gross")),0,Menus!R3C10) -> 0
A95: 145 | B95: =OFFSET(INDIRECT(ADDRESS(RC1,3,3,1,Menus!R10C11)),0,Menus!R4C10) -> 0 | C95: =OFFSET(INDIRECT(ADDRESS(RC1,3,3,1,Menus!R10C11)),0,Menus!R3C10) -> 0 | D95: =IF(Menus!R9C10,RC[-1]/RC[-2],RC[-1]) -> #DIV/0! | E95: =IF(RC11=1,VALUE(RC[-3]),NA()) -> NA() | F95: =INDIRECT(ADDRESS(RC1,1,3,1,Menus!R10C11)) -> 0 | G95: =IF(INDIRECT(ADDRESS(RC1,2,3,1,Menus!R10C11))=R1C,RC4,NA()) -> NA() | H95: =IF(INDIRECT(ADDRESS(RC1,2,3,1,Menus!R10C11))=R1C,RC4,NA()) -> NA() | I95: =IF(INDIRECT(ADDRESS(RC1,2,3,1,Menus!R10C11))=R1C,RC4,NA()) -> NA() | J95: =IF(INDIRECT(ADDRESS(RC1,1,3,1,Menus!R10C11))=T(R1C),RC4,NA()) -> NA() | K95: =IF(OR(ISNUMBER(RC7),ISNUMBER(RC8),ISNUMBER(RC9),ISNUMBER(RC10)),1,0) -> 0 | M95: =OFFSET(INDIRECT(ADDRESS(RC1,3,3,1,"Gross")),0,Menus!R4C10) -> 0 | N95: =OFFSET(INDIRECT(ADDRESS(RC1,3,3,1,"Gross")),0,Menus!R3C10) -> 0
A96: 74 | B96: =OFFSET(INDIRECT(ADDRESS(RC1,3,3,1,Menus!R10C11)),0,Menus!R4C10) -> 0 | C96: =OFFSET(INDIRECT(ADDRESS(RC1,3,3,1,Menus!R10C11)),0,Menus!R3C10) -> 0 | D96: =IF(Menus!R9C10,RC[-1]/RC[-2],RC[-1]) -> #DIV/0! | E96: =IF(RC11=1,VALUE(RC[-3]),NA()) -> NA() | F96: =INDIRECT(ADDRESS(RC1,1,3,1,Menus!R10C11)) -> 0 | G96: =IF(INDIRECT(ADDRESS(RC1,2,3,1,Menus!R10C11))=R1C,RC4,NA()) -> NA() | H96: =IF(INDIRECT(ADDRESS(RC1,2,3,1,Menus!R10C11))=R1C,RC4,NA()) -> NA() | I96: =IF(INDIRECT(ADDRESS(RC1,2,3,1,Menus!R10C11))=R1C,RC4,NA()) -> NA() | J96: =IF(INDIRECT(ADDRESS(RC1,1,3,1,Menus!R10C11))=T(R1C),RC4,NA()) -> NA() | K96: =IF(OR(ISNUMBER(RC7),ISNUMBER(RC8),ISNUMBER(RC9),ISNUMBER(RC10)),1,0) -> 0 | M96: =OFFSET(INDIRECT(ADDRESS(RC1,3,3,1,"Gross")),0,Menus!R4C10) -> 0 | N96: =OFFSET(INDIRECT(ADDRESS(RC1,3,3,1,"Gross")),0,Menus!R3C10) -> 0
A97: 163 | B97: =OFFSET(INDIRECT(ADDRESS(RC1,3,3,1,Menus!R10C11)),0,Menus!R4C10) -> 0 | C97: =OFFSET(INDIRECT(ADDRESS(RC1,3,3,1,Menus!R10C11)),0,Menus!R3C10) -> 0 | D97: =IF(Menus!R9C10,RC[-1]/RC[-2],RC[-1]) -> #DIV/0! | E97: =IF(RC11=1,VALUE(RC[-3]),NA()) -> NA() | F97: =INDIRECT(ADDRESS(RC1,1,3,1,Menus!R10C11)) -> 0 | G97: =IF(INDIRECT(ADDRESS(RC1,2,3,1,Menus!R10C11))=R1C,RC4,NA()) -> NA() | H97: =IF(INDIRECT(ADDRESS(RC1,2,3,1,Menus!R10C11))=R1C,RC4,NA()) -> NA() | I97: =IF(INDIRECT(ADDRESS(RC1,2,3,1,Menus!R10C11))=R1C,RC4,NA()) -> NA() | J97: =IF(INDIRECT(ADDRESS(RC1,1,3,1,Menus!R10C11))=T(R1C),RC4,NA()) -> NA() | K97: =IF(OR(ISNUMBER(RC7),ISNUMBER(RC8),ISNUMBER(RC9),ISNUMBER(RC10)),1,0) -> 0 | M97: =OFFSET(INDIRECT(ADDRESS(RC1,3,3,1,"Gross")),0,Menus!R4C10) -> 0 | N97: =OFFSET(INDIRECT(ADDRESS(RC1,3,3,1,"Gross")),0,Menus!R3C10) -> 0
A98: 164 | B98: =OFFSET(INDIRECT(ADDRESS(RC1,3,3,1,Menus!R10C11)),0,Menus!R4C10) -> 0 | C98: =OFFSET(INDIRECT(ADDRESS(RC1,3,3,1,Menus!R10C11)),0,Menus!R3C10) -> 0 | D98: =IF(Menus!R9C10,RC[-1]/RC[-2],RC[-1]) -> #DIV/0! | E98: =IF(RC11=1,VALUE(RC[-3]),NA()) -> NA() | F98: =INDIRECT(ADDRESS(RC1,1,3,1,Menus!R10C11)) -> 0 | G98: =IF(INDIRECT(ADDRESS(RC1,2,3,1,Menus!R10C11))=R1C,RC4,NA()) -> NA() | H98: =IF(INDIRECT(ADDRESS(RC1,2,3,1,Menus!R10C11))=R1C,RC4,NA()) -> NA() | I98: =IF(INDIRECT(ADDRESS(RC1,2,3,1,Menus!R10C11))=R1C,RC4,NA()) -> NA() | J98: =IF(INDIRECT(ADDRESS(RC1,1,3,1,Menus!R10C11))=T(R1C),RC4,NA()) -> NA() | K98: =IF(OR(ISNUMBER(RC7),ISNUMBER(RC8),ISNUMBER(RC9),ISNUMBER(RC10)),1,0) -> 0 | M98: =OFFSET(INDIRECT(ADDRESS(RC1,3,3,1,"Gross")),0,Menus!R4C10) -> 0 | N98: =OFFSET(INDIRECT(ADDRESS(RC1,3,3,1,"Gross")),0,Menus!R3C10) -> 0
A99: 155 | B99: =OFFSET(INDIRECT(ADDRESS(RC1,3,3,1,Menus!R10C11)),0,Menus!R4C10) -> 0 | C99: =OFFSET(INDIRECT(ADDRESS(RC1,3,3,1,Menus!R10C11)),0,Menus!R3C10) -> 0 | D99: =IF(Menus!R9C10,RC[-1]/RC[-2],RC[-1]) -> #DIV/0! | E99: =IF(RC11=1,VALUE(RC[-3]),NA()) -> NA() | F99: =INDIRECT(ADDRESS(RC1,1,3,1,Menus!R10C11)) -> 0 | G99: =IF(INDIRECT(ADDRESS(RC1,2,3,1,Menus!R10C11))=R1C,RC4,NA()) -> NA() | H99: =IF(INDIRECT(ADDRESS(RC1,2,3,1,Menus!R10C11))=R1C,RC4,NA()) -> NA() | I99: =IF(INDIRECT(ADDRESS(RC1,2,3,1,Menus!R10C11))=R1C,RC4,NA()) -> NA() | J99: =IF(INDIRECT(ADDRESS(RC1,1,3,1,Menus!R10C11))=T(R1C),RC4,NA()) -> NA() | K99: =IF(OR(ISNUMBER(RC7),ISNUMBER(RC8),ISNUMBER(RC9),ISNUMBER(RC10)),1,0) -> 0 | M99: =OFFSET(INDIRECT(ADDRESS(RC1,3,3,1,"Gross")),0,Menus!R4C10) -> 0 | N99: =OFFSET(INDIRECT(ADDRESS(RC1,3,3,1,"Gross")),0,Menus!R3C10) -> 0
A100: 84 | B100: =OFFSET(INDIRECT(ADDRESS(RC1,3,3,1,Menus!R10C11)),0,Menus!R4C10) -> 0 | C100: =OFFSET(INDIRECT(ADDRESS(RC1,3,3,1,Menus!R10C11)),0,Menus!R3C10) -> 0 | D100: =IF(Menus!R9C10,RC[-1]/RC[-2],RC[-1]) -> #DIV/0! | E100: =IF(RC11=1,VALUE(RC[-3]),NA()) -> NA() | F100: =INDIRECT(ADDRESS(RC1,1,3,1,Menus!R10C11)) -> 0 | G100: =IF(INDIRECT(ADDRESS(RC1,2,3,1,Menus!R10C11))=R1C,RC4,NA()) -> NA() | H100: =IF(INDIRECT(ADDRESS(RC1,2,3,1,Menus!R10C11))=R1C,RC4,NA()) -> NA() | I100: =IF(INDIRECT(ADDRESS(RC1,2,3,1,Menus!R10C11))=R1C,RC4,NA()) -> NA() | J100: =IF(INDIRECT(ADDRESS(RC1,1,3,1,Menus!R10C11))=T(R1C),RC4,NA()) -> NA() | K100: =IF(OR(ISNUMBER(RC7),ISNUMBER(RC8),ISNUMBER(RC9),ISNUMBER(RC10)),1,0) -> 0 | M100: =OFFSET(INDIRECT(ADDRESS(RC1,3,3,1,"Gross")),0,Menus!R4C10) -> 0 | N100: =OFFSET(INDIRECT(ADDRESS(RC1,3,3,1,"Gross")),0,Menus!R3C10) -> 0
A101: 85 | B101: =OFFSET(INDIRECT(ADDRESS(RC1,3,3,1,Menus!R10C11)),0,Menus!R4C10) -> 0 | C101: =OFFSET(INDIRECT(ADDRESS(RC1,3,3,1,Menus!R10C11)),0,Menus!R3C10) -> 0 | D101: =IF(Menus!R9C10,RC[-1]/RC[-2],RC[-1]) -> #DIV/0! | E101: =IF(RC11=1,VALUE(RC[-3]),NA()) -> NA() | F101: =INDIRECT(ADDRESS(RC1,1,3,1,Menus!R10C11)) -> 0 | G101: =IF(INDIRECT(ADDRESS(RC1,2,3,1,Menus!R10C11))=R1C,RC4,NA()) -> NA() | H101: =IF(INDIRECT(ADDRESS(RC1,2,3,1,Menus!R10C11))=R1C,RC4,NA()) -> NA() | I101: =IF(INDIRECT(ADDRESS(RC1,2,3,1,Menus!R10C11))=R1C,RC4,NA()) -> NA() | J101: =IF(INDIRECT(ADDRESS(RC1,1,3,1,Menus!R10C11))=T(R1C),RC4,NA()) -> NA() | K101: =IF(OR(ISNUMBER(RC7),ISNUMBER(RC8),ISNUMBER(RC9),ISNUMBER(RC10)),1,0) -> 0 | M101: =OFFSET(INDIRECT(ADDRESS(RC1,3,3,1,"Gross")),0,Menus!R4C10) -> 0 | N101: =OFFSET(INDIRECT(ADDRESS(RC1,3,3,1,"Gross")),0,Menus!R3C10) -> 0
A102: 63 | B102: =OFFSET(INDIRECT(ADDRESS(RC1,3,3,1,Menus!R10C11)),0,Menus!R4C10) -> 0 | C102: =OFFSET(INDIRECT(ADDRESS(RC1,3,3,1,Menus!R10C11)),0,Menus!R3C10) -> 0 | D102: =IF(Menus!R9C10,RC[-1]/RC[-2],RC[-1]) -> #DIV/0! | E102: =IF(RC11=1,VALUE(RC[-3]),NA()) -> NA() | F102: =INDIRECT(ADDRESS(RC1,1,3,1,Menus!R10C11)) -> 0 | G102: =IF(INDIRECT(ADDRESS(RC1,2,3,1,Menus!R10C11))=R1C,RC4,NA()) -> NA() | H102: =IF(INDIRECT(ADDRESS(RC1,2,3,1,Menus!R10C11))=R1C,RC4,NA()) -> NA() | I102: =IF(INDIRECT(ADDRESS(RC1,2,3,1,Menus!R10C11))=R1C,RC4,NA()) -> NA() | J102: =IF(INDIRECT(ADDRESS(RC1,1,3,1,Menus!R10C11))=T(R1C),RC4,NA()) -> NA() | K102: =IF(OR(ISNUMBER(RC7),ISNUMBER(RC8),ISNUMBER(RC9),ISNUMBER(RC10)),1,0) -> 0 | M102: =OFFSET(INDIRECT(ADDRESS(RC1,3,3,1,"Gross")),0,Menus!R4C10) -> 2 | N102: =OFFSET(INDIRECT(ADDRESS(RC1,3,3,1,"Gross")),0,Menus!R3C10) -> 2
A103: 80 | B103: =OFFSET(INDIRECT(ADDRESS(RC1,3,3,1,Menus!R10C11)),0,Menus!R4C10) -> 0 | C103: =OFFSET(INDIRECT(ADDRESS(RC1,3,3,1,Menus!R10C11)),0,Menus!R3C10) -> 0 | D103: =IF(Menus!R9C10,RC[-1]/RC[-2],RC[-1]) -> #DIV/0! | E103: =IF(RC11=1,VALUE(RC[-3]),NA()) -> NA() | F103: =INDIRECT(ADDRESS(RC1,1,3,1,Menus!R10C11)) -> 0 | G103: =IF(INDIRECT(ADDRESS(RC1,2,3,1,Menus!R10C11))=R1C,RC4,NA()) -> NA() | H103: =IF(INDIRECT(ADDRESS(RC1,2,3,1,Menus!R10C11))=R1C,RC4,NA()) -> NA() | I103: =IF(INDIRECT(ADDRESS(RC1,2,3,1,Menus!R10C11))=R1C,RC4,NA()) -> NA() | J103: =IF(INDIRECT(ADDRESS(RC1,1,3,1,Menus!R10C11))=T(R1C),RC4,NA()) -> NA() | K103: =IF(OR(ISNUMBER(RC7),ISNUMBER(RC8),ISNUMBER(RC9),ISNUMBER(RC10)),1,0) -> 0 | M103: =OFFSET(INDIRECT(ADDRESS(RC1,3,3,1,"Gross")),0,Menus!R4C10) -> 2 | N103: =OFFSET(INDIRECT(ADDRESS(RC1,3,3,1,"Gross")),0,Menus!R3C10) -> 2
A104: 50 | B104: =OFFSET(INDIRECT(ADDRESS(RC1,3,3,1,Menus!R10C11)),0,Menus!R4C10) -> 0 | C104: =OFFSET(INDIRECT(ADDRESS(RC1,3,3,1,Menus!R10C11)),0,Menus!R3C10) -> 0 | D104: =IF(Menus!R9C10,RC[-1]/RC[-2],RC[-1]) -> #DIV/0! | E104: =IF(RC11=1,VALUE(RC[-3]),NA()) -> NA() | F104: =INDIRECT(ADDRESS(RC1,1,3,1,Menus!R10C11)) -> 0 | G104: =IF(INDIRECT(ADDRESS(RC1,2,3,1,Menus!R10C11))=R1C,RC4,NA()) -> NA() | H104: =IF(INDIRECT(ADDRESS(RC1,2,3,1,Menus!R10C11))=R1C,RC4,NA()) -> NA() | I104: =IF(INDIRECT(ADDRESS(RC1,2,3,1,Menus!R10C11))=R1C,RC4,NA()) -> NA() | J104: =IF(INDIRECT(ADDRESS(RC1,1,3,1,Menus!R10C11))=T(R1C),RC4,NA()) -> NA() | K104: =IF(OR(ISNUMBER(RC7),ISNUMBER(RC8),ISNUMBER(RC9),ISNUMBER(RC10)),1,0) -> 0 | M104: =OFFSET(INDIRECT(ADDRESS(RC1,3,3,1,"Gross")),0,Menus!R4C10) -> 0 | N104: =OFFSET(INDIRECT(ADDRESS(RC1,3,3,1,"Gross")),0,Menus!R3C10) -> 0
A105: 120 | B105: =OFFSET(INDIRECT(ADDRESS(RC1,3,3,1,Menus!R10C11)),0,Menus!R4C10) -> 0 | C105: =OFFSET(INDIRECT(ADDRESS(RC1,3,3,1,Menus!R10C11)),0,Menus!R3C10) -> 0 | D105: =IF(Menus!R9C10,RC[-1]/RC[-2],RC[-1]) -> #DIV/0! | E105: =IF(RC11=1,VALUE(RC[-3]),NA()) -> NA() | F105: =INDIRECT(ADDRESS(RC1,1,3,1,Menus!R10C11)) -> 0 | G105: =IF(INDIRECT(ADDRESS(RC1,2,3,1,Menus!R10C11))=R1C,RC4,NA()) -> NA() | H105: =IF(INDIRECT(ADDRESS(RC1,2,3,1,Menus!R10C11))=R1C,RC4,NA()) -> NA() | I105: =IF(INDIRECT(ADDRESS(RC1,2,3,1,Menus!R10C11))=R1C,RC4,NA()) -> NA() | J105: =IF(INDIRECT(ADDRESS(RC1,1,3,1,Menus!R10C11))=T(R1C),RC4,NA()) -> NA() | K105: =IF(OR(ISNUMBER(RC7),ISNUMBER(RC8),ISNUMBER(RC9),ISNUMBER(RC10)),1,0) -> 0 | M105: =OFFSET(INDIRECT(ADDRESS(RC1,3,3,1,"Gross")),0,Menus!R4C10) -> 0 | N105: =OFFSET(INDIRECT(ADDRESS(RC1,3,3,1,"Gross")),0,Menus!R3C10) -> 0
A106: 149 | B106: =OFFSET(INDIRECT(ADDRESS(RC1,3,3,1,Menus!R10C11)),0,Menus!R4C10) -> 0 | C106: =OFFSET(INDIRECT(ADDRESS(RC1,3,3,1,Menus!R10C11)),0,Menus!R3C10) -> 0 | D106: =IF(Menus!R9C10,RC[-1]/RC[-2],RC[-1]) -> #DIV/0! | E106: =IF(RC11=1,VALUE(RC[-3]),NA()) -> NA() | F106: =INDIRECT(ADDRESS(RC1,1,3,1,Menus!R10C11)) -> 0 | G106: =IF(INDIRECT(ADDRESS(RC1,2,3,1,Menus!R10C11))=R1C,RC4,NA()) -> NA() | H106: =IF(INDIRECT(ADDRESS(RC1,2,3,1,Menus!R10C11))=R1C,RC4,NA()) -> NA() | I106: =IF(INDIRECT(ADDRESS(RC1,2,3,1,Menus!R10C11))=R1C,RC4,NA()) -> NA() | J106: =IF(INDIRECT(ADDRESS(RC1,1,3,1,Menus!R10C11))=T(R1C),RC4,NA()) -> NA() | K106: =IF(OR(ISNUMBER(RC7),ISNUMBER(RC8),ISNUMBER(RC9),ISNUMBER(RC10)),1,0) -> 0 | M106: =OFFSET(INDIRECT(ADDRESS(RC1,3,3,1,"Gross")),0,Menus!R4C10) -> 4 | N106: =OFFSET(INDIRECT(ADDRESS(RC1,3,3,1,"Gross")),0,Menus!R3C10) -> 3
A107: 197 | B107: =OFFSET(INDIRECT(ADDRESS(RC1,3,3,1,Menus!R10C11)),0,Menus!R4C10) -> 0 | C107: =OFFSET(INDIRECT(ADDRESS(RC1,3,3,1,Menus!R10C11)),0,Menus!R3C10) -> 0 | D107: =IF(Menus!R9C10,RC[-1]/RC[-2],RC[-1]) -> #DIV/0! | E107: =IF(RC11=1,VALUE(RC[-3]),NA()) -> NA() | F107: =INDIRECT(ADDRESS(RC1,1,3,1,Menus!R10C11)) -> 0 | G107: =IF(INDIRECT(ADDRESS(RC1,2,3,1,Menus!R10C11))=R1C,RC4,NA()) -> NA() | H107: =IF(INDIRECT(ADDRESS(RC1,2,3,1,Menus!R10C11))=R1C,RC4,NA()) -> NA() | I107: =IF(INDIRECT(ADDRESS(RC1,2,3,1,Menus!R10C11))=R1C,RC4,NA()) -> NA() | J107: =IF(INDIRECT(ADDRESS(RC1,1,3,1,Menus!R10C11))=T(R1C),RC4,NA()) -> NA() | K107: =IF(OR(ISNUMBER(RC7),ISNUMBER(RC8),ISNUMBER(RC9),ISNUMBER(RC10)),1,0) -> 0 | M107: =OFFSET(INDIRECT(ADDRESS(RC1,3,3,1,"Gross")),0,Menus!R4C10) -> 0 | N107: =OFFSET(INDIRECT(ADDRESS(RC1,3,3,1,"Gross")),0,Menus!R3C10) -> 0
A108: 104 | B108: =OFFSET(INDIRECT(ADDRESS(RC1,3,3,1,Menus!R10C11)),0,Menus!R4C10) -> 0 | C108: =OFFSET(INDIRECT(ADDRESS(RC1,3,3,1,Menus!R10C11)),0,Menus!R3C10) -> 0 | D108: =IF(Menus!R9C10,RC[-1]/RC[-2],RC[-1]) -> #DIV/0! | E108: =IF(RC11=1,VALUE(RC[-3]),NA()) -> NA() | F108: =INDIRECT(ADDRESS(RC1,1,3,1,Menus!R10C11)) -> 0 | G108: =IF(INDIRECT(ADDRESS(RC1,2,3,1,Menus!R10C11))=R1C,RC4,NA()) -> NA() | H108: =IF(INDIRECT(ADDRESS(RC1,2,3,1,Menus!R10C11))=R1C,RC4,NA()) -> NA() | I108: =IF(INDIRECT(ADDRESS(RC1,2,3,1,Menus!R10C11))=R1C,RC4,NA()) -> NA() | J108: =IF(INDIRECT(ADDRESS(RC1,1,3,1,Menus!R10C11))=T(R1C),RC4,NA()) -> NA() | K108: =IF(OR(ISNUMBER(RC7),ISNUMBER(RC8),ISNUMBER(RC9),ISNUMBER(RC10)),1,0) -> 0 | M108: =OFFSET(INDIRECT(ADDRESS(RC1,3,3,1,"Gross")),0,Menus!R4C10) -> 0 | N108: =OFFSET(INDIRECT(ADDRESS(RC1,3,3,1,"Gross")),0,Menus!R3C10) -> 0
A109: 165 | B109: =OFFSET(INDIRECT(ADDRESS(RC1,3,3,1,Menus!R10C11)),0,Menus!R4C10) -> 0 | C109: =OFFSET(INDIRECT(ADDRESS(RC1,3,3,1,Menus!R10C11)),0,Menus!R3C10) -> 0 | D109: =IF(Menus!R9C10,RC[-1]/RC[-2],RC[-1]) -> #DIV/0! | E109: =IF(RC11=1,VALUE(RC[-3]),NA()) -> NA() | F109: =INDIRECT(ADDRESS(RC1,1,3,1,Menus!R10C11)) -> 0 | G109: =IF(INDIRECT(ADDRESS(RC1,2,3,1,Menus!R10C11))=R1C,RC4,NA()) -> NA() | H109: =IF(INDIRECT(ADDRESS(RC1,2,3,1,Menus!R10C11))=R1C,RC4,NA()) -> NA() | I109: =IF(INDIRECT(ADDRESS(RC1,2,3,1,Menus!R10C11))=R1C,RC4,NA()) -> NA() | J109: =IF(INDIRECT(ADDRESS(RC1,1,3,1,Menus!R10C11))=T(R1C),RC4,NA()) -> NA() | K109: =IF(OR(ISNUMBER(RC7),ISNUMBER(RC8),ISNUMBER(RC9),ISNUMBER(RC10)),1,0) -> 0 | M109: =OFFSET(INDIRECT(ADDRESS(RC1,3,3,1,"Gross")),0,Menus!R4C10) -> 0 | N109: =OFFSET(INDIRECT(ADDRESS(RC1,3,3,1,"Gross")),0,Menus!R3C10) -> 0
A110: 189 | B110: =OFFSET(INDIRECT(ADDRESS(RC1,3,3,1,Menus!R10C11)),0,Menus!R4C10) -> 0 | C110: =OFFSET(INDIRECT(ADDRESS(RC1,3,3,1,Menus!R10C11)),0,Menus!R3C10) -> 0 | D110: =IF(Menus!R9C10,RC[-1]/RC[-2],RC[-1]) -> #DIV/0! | E110: =IF(RC11=1,VALUE(RC[-3]),NA()) -> NA() | F110: =INDIRECT(ADDRESS(RC1,1,3,1,Menus!R10C11)) -> 0 | G110: =IF(INDIRECT(ADDRESS(RC1,2,3,1,Menus!R10C11))=R1C,RC4,NA()) -> NA() | H110: =IF(INDIRECT(ADDRESS(RC1,2,3,1,Menus!R10C11))=R1C,RC4,NA()) -> NA() | I110: =IF(INDIRECT(ADDRESS(RC1,2,3,1,Menus!R10C11))=R1C,RC4,NA()) -> NA() | J110: =IF(INDIRECT(ADDRESS(RC1,1,3,1,Menus!R10C11))=T(R1C),RC4,NA()) -> NA() | K110: =IF(OR(ISNUMBER(RC7),ISNUMBER(RC8),ISNUMBER(RC9),ISNUMBER(RC10)),1,0) -> 0 | M110: =OFFSET(INDIRECT(ADDRESS(RC1,3,3,1,"Gross")),0,Menus!R4C10) -> 0 | N110: =OFFSET(INDIRECT(ADDRESS(RC1,3,3,1,"Gross")),0,Menus!R3C10) -> 0
A111: 175 | B111: =OFFSET(INDIRECT(ADDRESS(RC1,3,3,1,Menus!R10C11)),0,Menus!R4C10) -> 0 | C111: =OFFSET(INDIRECT(ADDRESS(RC1,3,3,1,Menus!R10C11)),0,Menus!R3C10) -> 0 | D111: =IF(Menus!R9C10,RC[-1]/RC[-2],RC[-1]) -> #DIV/0! | E111: =IF(RC11=1,VALUE(RC[-3]),NA()) -> NA() | F111: =INDIRECT(ADDRESS(RC1,1,3,1,Menus!R10C11)) -> 0 | G111: =IF(INDIRECT(ADDRESS(RC1,2,3,1,Menus!R10C11))=R1C,RC4,NA()) -> NA() | H111: =IF(INDIRECT(ADDRESS(RC1,2,3,1,Menus!R10C11))=R1C,RC4,NA()) -> NA() | I111: =IF(INDIRECT(ADDRESS(RC1,2,3,1,Menus!R10C11))=R1C,RC4,NA()) -> NA() | J111: =IF(INDIRECT(ADDRESS(RC1,1,3,1,Menus!R10C11))=T(R1C),RC4,NA()) -> NA() | K111: =IF(OR(ISNUMBER(RC7),ISNUMBER(RC8),ISNUMBER(RC9),ISNUMBER(RC10)),1,0) -> 0 | M111: =OFFSET(INDIRECT(ADDRESS(RC1,3,3,1,"Gross")),0,Menus!R4C10) -> 0 | N111: =OFFSET(INDIRECT(ADDRESS(RC1,3,3,1,"Gross")),0,Menus!R3C10) -> 0
A112: 66 | B112: =OFFSET(INDIRECT(ADDRESS(RC1,3,3,1,Menus!R10C11)),0,Menus!R4C10) -> 0 | C112: =OFFSET(INDIRECT(ADDRESS(RC1,3,3,1,Menus!R10C11)),0,Menus!R3C10) -> 0 | D112: =IF(Menus!R9C10,RC[-1]/RC[-2],RC[-1]) -> #DIV/0! | E112: =IF(RC11=1,VALUE(RC[-3]),NA()) -> NA() | F112: =INDIRECT(ADDRESS(RC1,1,3,1,Menus!R10C11)) -> 0 | G112: =IF(INDIRECT(ADDRESS(RC1,2,3,1,Menus!R10C11))=R1C,RC4,NA()) -> NA() | H112: =IF(INDIRECT(ADDRESS(RC1,2,3,1,Menus!R10C11))=R1C,RC4,NA()) -> NA() | I112: =IF(INDIRECT(ADDRESS(RC1,2,3,1,Menus!R10C11))=R1C,RC4,NA()) -> NA() | J112: =IF(INDIRECT(ADDRESS(RC1,1,3,1,Menus!R10C11))=T(R1C),RC4,NA()) -> NA() | K112: =IF(OR(ISNUMBER(RC7),ISNUMBER(RC8),ISNUMBER(RC9),ISNUMBER(RC10)),1,0) -> 0 | M112: =OFFSET(INDIRECT(ADDRESS(RC1,3,3,1,"Gross")),0,Menus!R4C10) -> 2 | N112: =OFFSET(INDIRECT(ADDRESS(RC1,3,3,1,"Gross")),0,Menus!R3C10) -> 2
A113: 89 | B113: =OFFSET(INDIRECT(ADDRESS(RC1,3,3,1,Menus!R10C11)),0,Menus!R4C10) -> 0 | C113: =OFFSET(INDIRECT(ADDRESS(RC1,3,3,1,Menus!R10C11)),0,Menus!R3C10) -> 0 | D113: =IF(Menus!R9C10,RC[-1]/RC[-2],RC[-1]) -> #DIV/0! | E113: =IF(RC11=1,VALUE(RC[-3]),NA()) -> NA() | F113: =INDIRECT(ADDRESS(RC1,1,3,1,Menus!R10C11)) -> 0 | G113: =IF(INDIRECT(ADDRESS(RC1,2,3,1,Menus!R10C11))=R1C,RC4,NA()) -> NA() | H113: =IF(INDIRECT(ADDRESS(RC1,2,3,1,Menus!R10C11))=R1C,RC4,NA()) -> NA() | I113: =IF(INDIRECT(ADDRESS(RC1,2,3,1,Menus!R10C11))=R1C,RC4,NA()) -> NA() | J113: =IF(INDIRECT(ADDRESS(RC1,1,3,1,Menus!R10C11))=T(R1C),RC4,NA()) -> NA() | K113: =IF(OR(ISNUMBER(RC7),ISNUMBER(RC8),ISNUMBER(RC9),ISNUMBER(RC10)),1,0) -> 0 | M113: =OFFSET(INDIRECT(ADDRESS(RC1,3,3,1,"Gross")),0,Menus!R4C10) -> 0 | N113: =OFFSET(INDIRECT(ADDRESS(RC1,3,3,1,"Gross")),0,Menus!R3C10) -> 0
A114: 92 | B114: =OFFSET(INDIRECT(ADDRESS(RC1,3,3,1,Menus!R10C11)),0,Menus!R4C10) -> 0 | C114: =OFFSET(INDIRECT(ADDRESS(RC1,3,3,1,Menus!R10C11)),0,Menus!R3C10) -> 0 | D114: =IF(Menus!R9C10,RC[-1]/RC[-2],RC[-1]) -> #DIV/0! | E114: =IF(RC11=1,VALUE(RC[-3]),NA()) -> NA() | F114: =INDIRECT(ADDRESS(RC1,1,3,1,Menus!R10C11)) -> 0 | G114: =IF(INDIRECT(ADDRESS(RC1,2,3,1,Menus!R10C11))=R1C,RC4,NA()) -> NA() | H114: =IF(INDIRECT(ADDRESS(RC1,2,3,1,Menus!R10C11))=R1C,RC4,NA()) -> NA() | I114: =IF(INDIRECT(ADDRESS(RC1,2,3,1,Menus!R10C11))=R1C,RC4,NA()) -> NA() | J114: =IF(INDIRECT(ADDRESS(RC1,1,3,1,Menus!R10C11))=T(R1C),RC4,NA()) -> NA() | K114: =IF(OR(ISNUMBER(RC7),ISNUMBER(RC8),ISNUMBER(RC9),ISNUMBER(RC10)),1,0) -> 0 | M114: =OFFSET(INDIRECT(ADDRESS(RC1,3,3,1,"Gross")),0,Menus!R4C10) -> 0 | N114: =OFFSET(INDIRECT(ADDRESS(RC1,3,3,1,"Gross")),0,Menus!R3C10) -> 0
A115: 177 | B115: =OFFSET(INDIRECT(ADDRESS(RC1,3,3,1,Menus!R10C11)),0,Menus!R4C10) -> 0 | C115: =OFFSET(INDIRECT(ADDRESS(RC1,3,3,1,Menus!R10C11)),0,Menus!R3C10) -> 0 | D115: =IF(Menus!R9C10,RC[-1]/RC[-2],RC[-1]) -> #DIV/0! | E115: =IF(RC11=1,VALUE(RC[-3]),NA()) -> NA() | F115: =INDIRECT(ADDRESS(RC1,1,3,1,Menus!R10C11)) -> 0 | G115: =IF(INDIRECT(ADDRESS(RC1,2,3,1,Menus!R10C11))=R1C,RC4,NA()) -> NA() | H115: =IF(INDIRECT(ADDRESS(RC1,2,3,1,Menus!R10C11))=R1C,RC4,NA()) -> NA() | I115: =IF(INDIRECT(ADDRESS(RC1,2,3,1,Menus!R10C11))=R1C,RC4,NA()) -> NA() | J115: =IF(INDIRECT(ADDRESS(RC1,1,3,1,Menus!R10C11))=T(R1C),RC4,NA()) -> NA() | K115: =IF(OR(ISNUMBER(RC7),ISNUMBER(RC8),ISNUMBER(RC9),ISNUMBER(RC10)),1,0) -> 0 | M115: =OFFSET(INDIRECT(ADDRESS(RC1,3,3,1,"Gross")),0,Menus!R4C10) -> 0 | N115: =OFFSET(INDIRECT(ADDRESS(RC1,3,3,1,"Gross")),0,Menus!R3C10) -> 0
A116: 169 | B116: =OFFSET(INDIRECT(ADDRESS(RC1,3,3,1,Menus!R10C11)),0,Menus!R4C10) -> 0 | C116: =OFFSET(INDIRECT(ADDRESS(RC1,3,3,1,Menus!R10C11)),0,Menus!R3C10) -> 0 | D116: =IF(Menus!R9C10,RC[-1]/RC[-2],RC[-1]) -> #DIV/0! | E116: =IF(RC11=1,VALUE(RC[-3]),NA()) -> NA() | F116: =INDIRECT(ADDRESS(RC1,1,3,1,Menus!R10C11)) -> 0 | G116: =IF(INDIRECT(ADDRESS(RC1,2,3,1,Menus!R10C11))=R1C,RC4,NA()) -> NA() | H116: =IF(INDIRECT(ADDRESS(RC1,2,3,1,Menus!R10C11))=R1C,RC4,NA()) -> NA() | I116: =IF(INDIRECT(ADDRESS(RC1,2,3,1,Menus!R10C11))=R1C,RC4,NA()) -> NA() | J116: =IF(INDIRECT(ADDRESS(RC1,1,3,1,Menus!R10C11))=T(R1C),RC4,NA()) -> NA() | K116: =IF(OR(ISNUMBER(RC7),ISNUMBER(RC8),ISNUMBER(RC9),ISNUMBER(RC10)),1,0) -> 0 | M116: =OFFSET(INDIRECT(ADDRESS(RC1,3,3,1,"Gross")),0,Menus!R4C10) -> 0 | N116: =OFFSET(INDIRECT(ADDRESS(RC1,3,3,1,"Gross")),0,Menus!R3C10) -> 0
A117: 140 | B117: =OFFSET(INDIRECT(ADDRESS(RC1,3,3,1,Menus!R10C11)),0,Menus!R4C10) -> 0 | C117: =OFFSET(INDIRECT(ADDRESS(RC1,3,3,1,Menus!R10C11)),0,Menus!R3C10) -> 0 | D117: =IF(Menus!R9C10,RC[-1]/RC[-2],RC[-1]) -> #DIV/0! | E117: =IF(RC11=1,VALUE(RC[-3]),NA()) -> NA() | F117: =INDIRECT(ADDRESS(RC1,1,3,1,Menus!R10C11)) -> 0 | G117: =IF(INDIRECT(ADDRESS(RC1,2,3,1,Menus!R10C11))=R1C,RC4,NA()) -> NA() | H117: =IF(INDIRECT(ADDRESS(RC1,2,3,1,Menus!R10C11))=R1C,RC4,NA()) -> NA() | I117: =IF(INDIRECT(ADDRESS(RC1,2,3,1,Menus!R10C11))=R1C,RC4,NA()) -> NA() | J117: =IF(INDIRECT(ADDRESS(RC1,1,3,1,Menus!R10C11))=T(R1C),RC4,NA()) -> NA() | K117: =IF(OR(ISNUMBER(RC7),ISNUMBER(RC8),ISNUMBER(RC9),ISNUMBER(RC10)),1,0) -> 0 | M117: =OFFSET(INDIRECT(ADDRESS(RC1,3,3,1,"Gross")),0,Menus!R4C10) -> 2 | N117: =OFFSET(INDIRECT(ADDRESS(RC1,3,3,1,"Gross")),0,Menus!R3C10) -> 2
A118: 166 | B118: =OFFSET(INDIRECT(ADDRESS(RC1,3,3,1,Menus!R10C11)),0,Menus!R4C10) -> 0 | C118: =OFFSET(INDIRECT(ADDRESS(RC1,3,3,1,Menus!R10C11)),0,Menus!R3C10) -> 0 | D118: =IF(Menus!R9C10,RC[-1]/RC[-2],RC[-1]) -> #DIV/0! | E118: =IF(RC11=1,VALUE(RC[-3]),NA()) -> NA() | F118: =INDIRECT(ADDRESS(RC1,1,3,1,Menus!R10C11)) -> 0 | G118: =IF(INDIRECT(ADDRESS(RC1,2,3,1,Menus!R10C11))=R1C,RC4,NA()) -> NA() | H118: =IF(INDIRECT(ADDRESS(RC1,2,3,1,Menus!R10C11))=R1C,RC4,NA()) -> NA() | I118: =IF(INDIRECT(ADDRESS(RC1,2,3,1,Menus!R10C11))=R1C,RC4,NA()) -> NA() | J118: =IF(INDIRECT(ADDRESS(RC1,1,3,1,Menus!R10C11))=T(R1C),RC4,NA()) -> NA() | K118: =IF(OR(ISNUMBER(RC7),ISNUMBER(RC8),ISNUMBER(RC9),ISNUMBER(RC10)),1,0) -> 0 | M118: =OFFSET(INDIRECT(ADDRESS(RC1,3,3,1,"Gross")),0,Menus!R4C10) -> 0 | N118: =OFFSET(INDIRECT(ADDRESS(RC1,3,3,1,"Gross")),0,Menus!R3C10) -> 0
A119: 172 | B119: =OFFSET(INDIRECT(ADDRESS(RC1,3,3,1,Menus!R10C11)),0,Menus!R4C10) -> 0 | C119: =OFFSET(INDIRECT(ADDRESS(RC1,3,3,1,Menus!R10C11)),0,Menus!R3C10) -> 0 | D119: =IF(Menus!R9C10,RC[-1]/RC[-2],RC[-1]) -> #DIV/0! | E119: =IF(RC11=1,VALUE(RC[-3]),NA()) -> NA() | F119: =INDIRECT(ADDRESS(RC1,1,3,1,Menus!R10C11)) -> 0 | G119: =IF(INDIRECT(ADDRESS(RC1,2,3,1,Menus!R10C11))=R1C,RC4,NA()) -> NA() | H119: =IF(INDIRECT(ADDRESS(RC1,2,3,1,Menus!R10C11))=R1C,RC4,NA()) -> NA() | I119: =IF(INDIRECT(ADDRESS(RC1,2,3,1,Menus!R10C11))=R1C,RC4,NA()) -> NA() | J119: =IF(INDIRECT(ADDRESS(RC1,1,3,1,Menus!R10C11))=T(R1C),RC4,NA()) -> NA() | K119: =IF(OR(ISNUMBER(RC7),ISNUMBER(RC8),ISNUMBER(RC9),ISNUMBER(RC10)),1,0) -> 0 | M119: =OFFSET(INDIRECT(ADDRESS(RC1,3,3,1,"Gross")),0,Menus!R4C10) -> 0 | N119: =OFFSET(INDIRECT(ADDRESS(RC1,3,3,1,"Gross")),0,Menus!R3C10) -> 0
A120: 110 | B120: =OFFSET(INDIRECT(ADDRESS(RC1,3,3,1,Menus!R10C11)),0,Menus!R4C10) -> 0 | C120: =OFFSET(INDIRECT(ADDRESS(RC1,3,3,1,Menus!R10C11)),0,Menus!R3C10) -> 0 | D120: =IF(Menus!R9C10,RC[-1]/RC[-2],RC[-1]) -> #DIV/0! | E120: =IF(RC11=1,VALUE(RC[-3]),NA()) -> NA() | F120: =INDIRECT(ADDRESS(RC1,1,3,1,Menus!R10C11)) -> 0 | G120: =IF(INDIRECT(ADDRESS(RC1,2,3,1,Menus!R10C11))=R1C,RC4,NA()) -> NA() | H120: =IF(INDIRECT(ADDRESS(RC1,2,3,1,Menus!R10C11))=R1C,RC4,NA()) -> NA() | I120: =IF(INDIRECT(ADDRESS(RC1,2,3,1,Menus!R10C11))=R1C,RC4,NA()) -> NA() | J120: =IF(INDIRECT(ADDRESS(RC1,1,3,1,Menus!R10C11))=T(R1C),RC4,NA()) -> NA() | K120: =IF(OR(ISNUMBER(RC7),ISNUMBER(RC8),ISNUMBER(RC9),ISNUMBER(RC10)),1,0) -> 0 | M120: =OFFSET(INDIRECT(ADDRESS(RC1,3,3,1,"Gross")),0,Menus!R4C10) -> 0 | N120: =OFFSET(INDIRECT(ADDRESS(RC1,3,3,1,"Gross")),0,Menus!R3C10) -> -1
A121: 139 | B121: =OFFSET(INDIRECT(ADDRESS(RC1,3,3,1,Menus!R10C11)),0,Menus!R4C10) -> 0 | C121: =OFFSET(INDIRECT(ADDRESS(RC1,3,3,1,Menus!R10C11)),0,Menus!R3C10) -> 0 | D121: =IF(Menus!R9C10,RC[-1]/RC[-2],RC[-1]) -> #DIV/0! | E121: =IF(RC11=1,VALUE(RC[-3]),NA()) -> NA() | F121: =INDIRECT(ADDRESS(RC1,1,3,1,Menus!R10C11)) -> 0 | G121: =IF(INDIRECT(ADDRESS(RC1,2,3,1,Menus!R10C11))=R1C,RC4,NA()) -> NA() | H121: =IF(INDIRECT(ADDRESS(RC1,2,3,1,Menus!R10C11))=R1C,RC4,NA()) -> NA() | I121: =IF(INDIRECT(ADDRESS(RC1,2,3,1,Menus!R10C11))=R1C,RC4,NA()) -> NA() | J121: =IF(INDIRECT(ADDRESS(RC1,1,3,1,Menus!R10C11))=T(R1C),RC4,NA()) -> NA() | K121: =IF(OR(ISNUMBER(RC7),ISNUMBER(RC8),ISNUMBER(RC9),ISNUMBER(RC10)),1,0) -> 0 | M121: =OFFSET(INDIRECT(ADDRESS(RC1,3,3,1,"Gross")),0,Menus!R4C10) -> 0 | N121: =OFFSET(INDIRECT(ADDRESS(RC1,3,3,1,"Gross")),0,Menus!R3C10) -> 0
A122: 156 | B122: =OFFSET(INDIRECT(ADDRESS(RC1,3,3,1,Menus!R10C11)),0,Menus!R4C10) -> 0 | C122: =OFFSET(INDIRECT(ADDRESS(RC1,3,3,1,Menus!R10C11)),0,Menus!R3C10) -> 0 | D122: =IF(Menus!R9C10,RC[-1]/RC[-2],RC[-1]) -> #DIV/0! | E122: =IF(RC11=1,VALUE(RC[-3]),NA()) -> NA() | F122: =INDIRECT(ADDRESS(RC1,1,3,1,Menus!R10C11)) -> 0 | G122: =IF(INDIRECT(ADDRESS(RC1,2,3,1,Menus!R10C11))=R1C,RC4,NA()) -> NA() | H122: =IF(INDIRECT(ADDRESS(RC1,2,3,1,Menus!R10C11))=R1C,RC4,NA()) -> NA() | I122: =IF(INDIRECT(ADDRESS(RC1,2,3,1,Menus!R10C11))=R1C,RC4,NA()) -> NA() | J122: =IF(INDIRECT(ADDRESS(RC1,1,3,1,Menus!R10C11))=T(R1C),RC4,NA()) -> NA() | K122: =IF(OR(ISNUMBER(RC7),ISNUMBER(RC8),ISNUMBER(RC9),ISNUMBER(RC10)),1,0) -> 0 | M122: =OFFSET(INDIRECT(ADDRESS(RC1,3,3,1,"Gross")),0,Menus!R4C10) -> 1 | N122: =OFFSET(INDIRECT(ADDRESS(RC1,3,3,1,"Gross")),0,Menus!R3C10) -> 1
A123: 191 | B123: =OFFSET(INDIRECT(ADDRESS(RC1,3,3,1,Menus!R10C11)),0,Menus!R4C10) -> 0 | C123: =OFFSET(INDIRECT(ADDRESS(RC1,3,3,1,Menus!R10C11)),0,Menus!R3C10) -> 0 | D123: =IF(Menus!R9C10,RC[-1]/RC[-2],RC[-1]) -> #DIV/0! | E123: =IF(RC11=1,VALUE(RC[-3]),NA()) -> NA() | F123: =INDIRECT(ADDRESS(RC1,1,3,1,Menus!R10C11)) -> 0 | G123: =IF(INDIRECT(ADDRESS(RC1,2,3,1,Menus!R10C11))=R1C,RC4,NA()) -> NA() | H123: =IF(INDIRECT(ADDRESS(RC1,2,3,1,Menus!R10C11))=R1C,RC4,NA()) -> NA() | I123: =IF(INDIRECT(ADDRESS(RC1,2,3,1,Menus!R10C11))=R1C,RC4,NA()) -> NA() | J123: =IF(INDIRECT(ADDRESS(RC1,1,3,1,Menus!R10C11))=T(R1C),RC4,NA()) -> NA() | K123: =IF(OR(ISNUMBER(RC7),ISNUMBER(RC8),ISNUMBER(RC9),ISNUMBER(RC10)),1,0) -> 0 | M123: =OFFSET(INDIRECT(ADDRESS(RC1,3,3,1,"Gross")),0,Menus!R4C10) -> 0 | N123: =OFFSET(INDIRECT(ADDRESS(RC1,3,3,1,"Gross")),0,Menus!R3C10) -> 0
A124: 192 | B124: =OFFSET(INDIRECT(ADDRESS(RC1,3,3,1,Menus!R10C11)),0,Menus!R4C10) -> 0 | C124: =OFFSET(INDIRECT(ADDRESS(RC1,3,3,1,Menus!R10C11)),0,Menus!R3C10) -> 0 | D124: =IF(Menus!R9C10,RC[-1]/RC[-2],RC[-1]) -> #DIV/0! | E124: =IF(RC11=1,VALUE(RC[-3]),NA()) -> NA() | F124: =INDIRECT(ADDRESS(RC1,1,3,1,Menus!R10C11)) -> 0 | G124: =IF(INDIRECT(ADDRESS(RC1,2,3,1,Menus!R10C11))=R1C,RC4,NA()) -> NA() | H124: =IF(INDIRECT(ADDRESS(RC1,2,3,1,Menus!R10C11))=R1C,RC4,NA()) -> NA() | I124: =IF(INDIRECT(ADDRESS(RC1,2,3,1,Menus!R10C11))=R1C,RC4,NA()) -> NA() | J124: =IF(INDIRECT(ADDRESS(RC1,1,3,1,Menus!R10C11))=T(R1C),RC4,NA()) -> NA() | K124: =IF(OR(ISNUMBER(RC7),ISNUMBER(RC8),ISNUMBER(RC9),ISNUMBER(RC10)),1,0) -> 0 | M124: =OFFSET(INDIRECT(ADDRESS(RC1,3,3,1,"Gross")),0,Menus!R4C10) -> 0 | N124: =OFFSET(INDIRECT(ADDRESS(RC1,3,3,1,"Gross")),0,Menus!R3C10) -> 0
A125: 137 | B125: =OFFSET(INDIRECT(ADDRESS(RC1,3,3,1,Menus!R10C11)),0,Menus!R4C10) -> 0 | C125: =OFFSET(INDIRECT(ADDRESS(RC1,3,3,1,Menus!R10C11)),0,Menus!R3C10) -> 0 | D125: =IF(Menus!R9C10,RC[-1]/RC[-2],RC[-1]) -> #DIV/0! | E125: =IF(RC11=1,VALUE(RC[-3]),NA()) -> NA() | F125: =INDIRECT(ADDRESS(RC1,1,3,1,Menus!R10C11)) -> 0 | G125: =IF(INDIRECT(ADDRESS(RC1,2,3,1,Menus!R10C11))=R1C,RC4,NA()) -> NA() | H125: =IF(INDIRECT(ADDRESS(RC1,2,3,1,Menus!R10C11))=R1C,RC4,NA()) -> NA() | I125: =IF(INDIRECT(ADDRESS(RC1,2,3,1,Menus!R10C11))=R1C,RC4,NA()) -> NA() | J125: =IF(INDIRECT(ADDRESS(RC1,1,3,1,Menus!R10C11))=T(R1C),RC4,NA()) -> NA() | K125: =IF(OR(ISNUMBER(RC7),ISNUMBER(RC8),ISNUMBER(RC9),ISNUMBER(RC10)),1,0) -> 0 | M125: =OFFSET(INDIRECT(ADDRESS(RC1,3,3,1,"Gross")),0,Menus!R4C10) -> 0 | N125: =OFFSET(INDIRECT(ADDRESS(RC1,3,3,1,"Gross")),0,Menus!R3C10) -> 0
A126: 83 | B126: =OFFSET(INDIRECT(ADDRESS(RC1,3,3,1,Menus!R10C11)),0,Menus!R4C10) -> 0 | C126: =OFFSET(INDIRECT(ADDRESS(RC1,3,3,1,Menus!R10C11)),0,Menus!R3C10) -> 0 | D126: =IF(Menus!R9C10,RC[-1]/RC[-2],RC[-1]) -> #DIV/0! | E126: =IF(RC11=1,VALUE(RC[-3]),NA()) -> NA() | F126: =INDIRECT(ADDRESS(RC1,1,3,1,Menus!R10C11)) -> 0 | G126: =IF(INDIRECT(ADDRESS(RC1,2,3,1,Menus!R10C11))=R1C,RC4,NA()) -> NA() | H126: =IF(INDIRECT(ADDRESS(RC1,2,3,1,Menus!R10C11))=R1C,RC4,NA()) -> NA() | I126: =IF(INDIRECT(ADDRESS(RC1,2,3,1,Menus!R10C11))=R1C,RC4,NA()) -> NA() | J126: =IF(INDIRECT(ADDRESS(RC1,1,3,1,Menus!R10C11))=T(R1C),RC4,NA()) -> NA() | K126: =IF(OR(ISNUMBER(RC7),ISNUMBER(RC8),ISNUMBER(RC9),ISNUMBER(RC10)),1,0) -> 0 | M126: =OFFSET(INDIRECT(ADDRESS(RC1,3,3,1,"Gross")),0,Menus!R4C10) -> 2 | N126: =OFFSET(INDIRECT(ADDRESS(RC1,3,3,1,"Gross")),0,Menus!R3C10) -> 2
A127: 76 | B127: =OFFSET(INDIRECT(ADDRESS(RC1,3,3,1,Menus!R10C11)),0,Menus!R4C10) -> 0 | C127: =OFFSET(INDIRECT(ADDRESS(RC1,3,3,1,Menus!R10C11)),0,Menus!R3C10) -> 0 | D127: =IF(Menus!R9C10,RC[-1]/RC[-2],RC[-1]) -> #DIV/0! | E127: =IF(RC11=1,VALUE(RC[-3]),NA()) -> NA() | F127: =INDIRECT(ADDRESS(RC1,1,3,1,Menus!R10C11)) -> 0 | G127: =IF(INDIRECT(ADDRESS(RC1,2,3,1,Menus!R10C11))=R1C,RC4,NA()) -> NA() | H127: =IF(INDIRECT(ADDRESS(RC1,2,3,1,Menus!R10C11))=R1C,RC4,NA()) -> NA() | I127: =IF(INDIRECT(ADDRESS(RC1,2,3,1,Menus!R10C11))=R1C,RC4,NA()) -> NA() | J127: =IF(INDIRECT(ADDRESS(RC1,1,3,1,Menus!R10C11))=T(R1C),RC4,NA()) -> NA() | K127: =IF(OR(ISNUMBER(RC7),ISNUMBER(RC8),ISNUMBER(RC9),ISNUMBER(RC10)),1,0) -> 0 | M127: =OFFSET(INDIRECT(ADDRESS(RC1,3,3,1,"Gross")),0,Menus!R4C10) -> 1 | N127: =OFFSET(INDIRECT(ADDRESS(RC1,3,3,1,"Gross")),0,Menus!R3C10) -> 1
A128: 61 | B128: =OFFSET(INDIRECT(ADDRESS(RC1,3,3,1,Menus!R10C11)),0,Menus!R4C10) -> 0 | C128: =OFFSET(INDIRECT(ADDRESS(RC1,3,3,1,Menus!R10C11)),0,Menus!R3C10) -> 0 | D128: =IF(Menus!R9C10,RC[-1]/RC[-2],RC[-1]) -> #DIV/0! | E128: =IF(RC11=1,VALUE(RC[-3]),NA()) -> NA() | F128: =INDIRECT(ADDRESS(RC1,1,3,1,Menus!R10C11)) -> 0 | G128: =IF(INDIRECT(ADDRESS(RC1,2,3,1,Menus!R10C11))=R1C,RC4,NA()) -> NA() | H128: =IF(INDIRECT(ADDRESS(RC1,2,3,1,Menus!R10C11))=R1C,RC4,NA()) -> NA() | I128: =IF(INDIRECT(ADDRESS(RC1,2,3,1,Menus!R10C11))=R1C,RC4,NA()) -> NA() | J128: =IF(INDIRECT(ADDRESS(RC1,1,3,1,Menus!R10C11))=T(R1C),RC4,NA()) -> NA() | K128: =IF(OR(ISNUMBER(RC7),ISNUMBER(RC8),ISNUMBER(RC9),ISNUMBER(RC10)),1,0) -> 0 | M128: =OFFSET(INDIRECT(ADDRESS(RC1,3,3,1,"Gross")),0,Menus!R4C10) -> 0 | N128: =OFFSET(INDIRECT(ADDRESS(RC1,3,3,1,"Gross")),0,Menus!R3C10) -> 0
A129: 152 | B129: =OFFSET(INDIRECT(ADDRESS(RC1,3,3,1,Menus!R10C11)),0,Menus!R4C10) -> 0 | C129: =OFFSET(INDIRECT(ADDRESS(RC1,3,3,1,Menus!R10C11)),0,Menus!R3C10) -> 0 | D129: =IF(Menus!R9C10,RC[-1]/RC[-2],RC[-1]) -> #DIV/0! | E129: =IF(RC11=1,VALUE(RC[-3]),NA()) -> NA() | F129: =INDIRECT(ADDRESS(RC1,1,3,1,Menus!R10C11)) -> 0 | G129: =IF(INDIRECT(ADDRESS(RC1,2,3,1,Menus!R10C11))=R1C,RC4,NA()) -> NA() | H129: =IF(INDIRECT(ADDRESS(RC1,2,3,1,Menus!R10C11))=R1C,RC4,NA()) -> NA() | I129: =IF(INDIRECT(ADDRESS(RC1,2,3,1,Menus!R10C11))=R1C,RC4,NA()) -> NA() | J129: =IF(INDIRECT(ADDRESS(RC1,1,3,1,Menus!R10C11))=T(R1C),RC4,NA()) -> NA() | K129: =IF(OR(ISNUMBER(RC7),ISNUMBER(RC8),ISNUMBER(RC9),ISNUMBER(RC10)),1,0) -> 0 | M129: =OFFSET(INDIRECT(ADDRESS(RC1,3,3,1,"Gross")),0,Menus!R4C10) -> 2 | N129: =OFFSET(INDIRECT(ADDRESS(RC1,3,3,1,"Gross")),0,Menus!R3C10) -> 2
A130: 78 | B130: =OFFSET(INDIRECT(ADDRESS(RC1,3,3,1,Menus!R10C11)),0,Menus!R4C10) -> 0 | C130: =OFFSET(INDIRECT(ADDRESS(RC1,3,3,1,Menus!R10C11)),0,Menus!R3C10) -> 0 | D130: =IF(Menus!R9C10,RC[-1]/RC[-2],RC[-1]) -> #DIV/0! | E130: =IF(RC11=1,VALUE(RC[-3]),NA()) -> NA() | F130: =INDIRECT(ADDRESS(RC1,1,3,1,Menus!R10C11)) -> 0 | G130: =IF(INDIRECT(ADDRESS(RC1,2,3,1,Menus!R10C11))=R1C,RC4,NA()) -> NA() | H130: =IF(INDIRECT(ADDRESS(RC1,2,3,1,Menus!R10C11))=R1C,RC4,NA()) -> NA() | I130: =IF(INDIRECT(ADDRESS(RC1,2,3,1,Menus!R10C11))=R1C,RC4,NA()) -> NA() | J130: =IF(INDIRECT(ADDRESS(RC1,1,3,1,Menus!R10C11))=T(R1C),RC4,NA()) -> NA() | K130: =IF(OR(ISNUMBER(RC7),ISNUMBER(RC8),ISNUMBER(RC9),ISNUMBER(RC10)),1,0) -> 0 | M130: =OFFSET(INDIRECT(ADDRESS(RC1,3,3,1,"Gross")),0,Menus!R4C10) -> 2 | N130: =OFFSET(INDIRECT(ADDRESS(RC1,3,3,1,"Gross")),0,Menus!R3C10) -> 2
A131: 144 | B131: =OFFSET(INDIRECT(ADDRESS(RC1,3,3,1,Menus!R10C11)),0,Menus!R4C10) -> 0 | C131: =OFFSET(INDIRECT(ADDRESS(RC1,3,3,1,Menus!R10C11)),0,Menus!R3C10) -> 0 | D131: =IF(Menus!R9C10,RC[-1]/RC[-2],RC[-1]) -> #DIV/0! | E131: =IF(RC11=1,VALUE(RC[-3]),NA()) -> NA() | F131: =INDIRECT(ADDRESS(RC1,1,3,1,Menus!R10C11)) -> 0 | G131: =IF(INDIRECT(ADDRESS(RC1,2,3,1,Menus!R10C11))=R1C,RC4,NA()) -> NA() | H131: =IF(INDIRECT(ADDRESS(RC1,2,3,1,Menus!R10C11))=R1C,RC4,NA()) -> NA() | I131: =IF(INDIRECT(ADDRESS(RC1,2,3,1,Menus!R10C11))=R1C,RC4,NA()) -> NA() | J131: =IF(INDIRECT(ADDRESS(RC1,1,3,1,Menus!R10C11))=T(R1C),RC4,NA()) -> NA() | K131: =IF(OR(ISNUMBER(RC7),ISNUMBER(RC8),ISNUMBER(RC9),ISNUMBER(RC10)),1,0) -> 0 | M131: =OFFSET(INDIRECT(ADDRESS(RC1,3,3,1,"Gross")),0,Menus!R4C10) -> 2 | N131: =OFFSET(INDIRECT(ADDRESS(RC1,3,3,1,"Gross")),0,Menus!R3C10) -> 2
A132: 153 | B132: =OFFSET(INDIRECT(ADDRESS(RC1,3,3,1,Menus!R10C11)),0,Menus!R4C10) -> 0 | C132: =OFFSET(INDIRECT(ADDRESS(RC1,3,3,1,Menus!R10C11)),0,Menus!R3C10) -> 0 | D132: =IF(Menus!R9C10,RC[-1]/RC[-2],RC[-1]) -> #DIV/0! | E132: =IF(RC11=1,VALUE(RC[-3]),NA()) -> NA() | F132: =INDIRECT(ADDRESS(RC1,1,3,1,Menus!R10C11)) -> 0 | G132: =IF(INDIRECT(ADDRESS(RC1,2,3,1,Menus!R10C11))=R1C,RC4,NA()) -> NA() | H132: =IF(INDIRECT(ADDRESS(RC1,2,3,1,Menus!R10C11))=R1C,RC4,NA()) -> NA() | I132: =IF(INDIRECT(ADDRESS(RC1,2,3,1,Menus!R10C11))=R1C,RC4,NA()) -> NA() | J132: =IF(INDIRECT(ADDRESS(RC1,1,3,1,Menus!R10C11))=T(R1C),RC4,NA()) -> NA() | K132: =IF(OR(ISNUMBER(RC7),ISNUMBER(RC8),ISNUMBER(RC9),ISNUMBER(RC10)),1,0) -> 0 | M132: =OFFSET(INDIRECT(ADDRESS(RC1,3,3,1,"Gross")),0,Menus!R4C10) -> 1 | N132: =OFFSET(INDIRECT(ADDRESS(RC1,3,3,1,"Gross")),0,Menus!R3C10) -> 3
A133: 147 | B133: =OFFSET(INDIRECT(ADDRESS(RC1,3,3,1,Menus!R10C11)),0,Menus!R4C10) -> 0 | C133: =OFFSET(INDIRECT(ADDRESS(RC1,3,3,1,Menus!R10C11)),0,Menus!R3C10) -> 0 | D133: =IF(Menus!R9C10,RC[-1]/RC[-2],RC[-1]) -> #DIV/0! | E133: =IF(RC11=1,VALUE(RC[-3]),NA()) -> NA() | F133: =INDIRECT(ADDRESS(RC1,1,3,1,Menus!R10C11)) -> 0 | G133: =IF(INDIRECT(ADDRESS(RC1,2,3,1,Menus!R10C11))=R1C,RC4,NA()) -> NA() | H133: =IF(INDIRECT(ADDRESS(RC1,2,3,1,Menus!R10C11))=R1C,RC4,NA()) -> NA() | I133: =IF(INDIRECT(ADDRESS(RC1,2,3,1,Menus!R10C11))=R1C,RC4,NA()) -> NA() | J133: =IF(INDIRECT(ADDRESS(RC1,1,3,1,Menus!R10C11))=T(R1C),RC4,NA()) -> NA() | K133: =IF(OR(ISNUMBER(RC7),ISNUMBER(RC8),ISNUMBER(RC9),ISNUMBER(RC10)),1,0) -> 0 | M133: =OFFSET(INDIRECT(ADDRESS(RC1,3,3,1,"Gross")),0,Menus!R4C10) -> 0 | N133: =OFFSET(INDIRECT(ADDRESS(RC1,3,3,1,"Gross")),0,Menus!R3C10) -> 0
A134: 132 | B134: =OFFSET(INDIRECT(ADDRESS(RC1,3,3,1,Menus!R10C11)),0,Menus!R4C10) -> 0 | C134: =OFFSET(INDIRECT(ADDRESS(RC1,3,3,1,Menus!R10C11)),0,Menus!R3C10) -> 0 | D134: =IF(Menus!R9C10,RC[-1]/RC[-2],RC[-1]) -> #DIV/0! | E134: =IF(RC11=1,VALUE(RC[-3]),NA()) -> NA() | F134: =INDIRECT(ADDRESS(RC1,1,3,1,Menus!R10C11)) -> 0 | G134: =IF(INDIRECT(ADDRESS(RC1,2,3,1,Menus!R10C11))=R1C,RC4,NA()) -> NA() | H134: =IF(INDIRECT(ADDRESS(RC1,2,3,1,Menus!R10C11))=R1C,RC4,NA()) -> NA() | I134: =IF(INDIRECT(ADDRESS(RC1,2,3,1,Menus!R10C11))=R1C,RC4,NA()) -> NA() | J134: =IF(INDIRECT(ADDRESS(RC1,1,3,1,Menus!R10C11))=T(R1C),RC4,NA()) -> NA() | K134: =IF(OR(ISNUMBER(RC7),ISNUMBER(RC8),ISNUMBER(RC9),ISNUMBER(RC10)),1,0) -> 0 | M134: =OFFSET(INDIRECT(ADDRESS(RC1,3,3,1,"Gross")),0,Menus!R4C10) -> 0 | N134: =OFFSET(INDIRECT(ADDRESS(RC1,3,3,1,"Gross")),0,Menus!R3C10) -> 0
A135: 90 | B135: =OFFSET(INDIRECT(ADDRESS(RC1,3,3,1,Menus!R10C11)),0,Menus!R4C10) -> 0 | C135: =OFFSET(INDIRECT(ADDRESS(RC1,3,3,1,Menus!R10C11)),0,Menus!R3C10) -> 0 | D135: =IF(Menus!R9C10,RC[-1]/RC[-2],RC[-1]) -> #DIV/0! | E135: =IF(RC11=1,VALUE(RC[-3]),NA()) -> NA() | F135: =INDIRECT(ADDRESS(RC1,1,3,1,Menus!R10C11)) -> 0 | G135: =IF(INDIRECT(ADDRESS(RC1,2,3,1,Menus!R10C11))=R1C,RC4,NA()) -> NA() | H135: =IF(INDIRECT(ADDRESS(RC1,2,3,1,Menus!R10C11))=R1C,RC4,NA()) -> NA() | I135: =IF(INDIRECT(ADDRESS(RC1,2,3,1,Menus!R10C11))=R1C,RC4,NA()) -> NA() | J135: =IF(INDIRECT(ADDRESS(RC1,1,3,1,Menus!R10C11))=T(R1C),RC4,NA()) -> NA() | K135: =IF(OR(ISNUMBER(RC7),ISNUMBER(RC8),ISNUMBER(RC9),ISNUMBER(RC10)),1,0) -> 0 | M135: =OFFSET(INDIRECT(ADDRESS(RC1,3,3,1,"Gross")),0,Menus!R4C10) -> 0 | N135: =OFFSET(INDIRECT(ADDRESS(RC1,3,3,1,"Gross")),0,Menus!R3C10) -> 1
A136: 128 | B136: =OFFSET(INDIRECT(ADDRESS(RC1,3,3,1,Menus!R10C11)),0,Menus!R4C10) -> 0 | C136: =OFFSET(INDIRECT(ADDRESS(RC1,3,3,1,Menus!R10C11)),0,Menus!R3C10) -> 0 | D136: =IF(Menus!R9C10,RC[-1]/RC[-2],RC[-1]) -> #DIV/0! | E136: =IF(RC11=1,VALUE(RC[-3]),NA()) -> NA() | F136: =INDIRECT(ADDRESS(RC1,1,3,1,Menus!R10C11)) -> 0 | G136: =IF(INDIRECT(ADDRESS(RC1,2,3,1,Menus!R10C11))=R1C,RC4,NA()) -> NA() | H136: =IF(INDIRECT(ADDRESS(RC1,2,3,1,Menus!R10C11))=R1C,RC4,NA()) -> NA() | I136: =IF(INDIRECT(ADDRESS(RC1,2,3,1,Menus!R10C11))=R1C,RC4,NA()) -> NA() | J136: =IF(INDIRECT(ADDRESS(RC1,1,3,1,Menus!R10C11))=T(R1C),RC4,NA()) -> NA() | K136: =IF(OR(ISNUMBER(RC7),ISNUMBER(RC8),ISNUMBER(RC9),ISNUMBER(RC10)),1,0) -> 0 | M136: =OFFSET(INDIRECT(ADDRESS(RC1,3,3,1,"Gross")),0,Menus!R4C10) -> 0 | N136: =OFFSET(INDIRECT(ADDRESS(RC1,3,3,1,"Gross")),0,Menus!R3C10) -> 0
A137: 57 | B137: =OFFSET(INDIRECT(ADDRESS(RC1,3,3,1,Menus!R10C11)),0,Menus!R4C10) -> 0 | C137: =OFFSET(INDIRECT(ADDRESS(RC1,3,3,1,Menus!R10C11)),0,Menus!R3C10) -> 0 | D137: =IF(Menus!R9C10,RC[-1]/RC[-2],RC[-1]) -> #DIV/0! | E137: =IF(RC11=1,VALUE(RC[-3]),NA()) -> NA() | F137: =INDIRECT(ADDRESS(RC1,1,3,1,Menus!R10C11)) -> 0 | G137: =IF(INDIRECT(ADDRESS(RC1,2,3,1,Menus!R10C11))=R1C,RC4,NA()) -> NA() | H137: =IF(INDIRECT(ADDRESS(RC1,2,3,1,Menus!R10C11))=R1C,RC4,NA()) -> NA() | I137: =IF(INDIRECT(ADDRESS(RC1,2,3,1,Menus!R10C11))=R1C,RC4,NA()) -> NA() | J137: =IF(INDIRECT(ADDRESS(RC1,1,3,1,Menus!R10C11))=T(R1C),RC4,NA()) -> NA() | K137: =IF(OR(ISNUMBER(RC7),ISNUMBER(RC8),ISNUMBER(RC9),ISNUMBER(RC10)),1,0) -> 0 | M137: =OFFSET(INDIRECT(ADDRESS(RC1,3,3,1,"Gross")),0,Menus!R4C10) -> 1 | N137: =OFFSET(INDIRECT(ADDRESS(RC1,3,3,1,"Gross")),0,Menus!R3C10) -> 2
A138: 71 | B138: =OFFSET(INDIRECT(ADDRESS(RC1,3,3,1,Menus!R10C11)),0,Menus!R4C10) -> 0 | C138: =OFFSET(INDIRECT(ADDRESS(RC1,3,3,1,Menus!R10C11)),0,Menus!R3C10) -> 0 | D138: =IF(Menus!R9C10,RC[-1]/RC[-2],RC[-1]) -> #DIV/0! | E138: =IF(RC11=1,VALUE(RC[-3]),NA()) -> NA() | F138: =INDIRECT(ADDRESS(RC1,1,3,1,Menus!R10C11)) -> 0 | G138: =IF(INDIRECT(ADDRESS(RC1,2,3,1,Menus!R10C11))=R1C,RC4,NA()) -> NA() | H138: =IF(INDIRECT(ADDRESS(RC1,2,3,1,Menus!R10C11))=R1C,RC4,NA()) -> NA() | I138: =IF(INDIRECT(ADDRESS(RC1,2,3,1,Menus!R10C11))=R1C,RC4,NA()) -> NA() | J138: =IF(INDIRECT(ADDRESS(RC1,1,3,1,Menus!R10C11))=T(R1C),RC4,NA()) -> NA() | K138: =IF(OR(ISNUMBER(RC7),ISNUMBER(RC8),ISNUMBER(RC9),ISNUMBER(RC10)),1,0) -> 0 | M138: =OFFSET(INDIRECT(ADDRESS(RC1,3,3,1,"Gross")),0,Menus!R4C10) -> 0 | N138: =OFFSET(INDIRECT(ADDRESS(RC1,3,3,1,"Gross")),0,Menus!R3C10) -> 0
A139: 168 | B139: =OFFSET(INDIRECT(ADDRESS(RC1,3,3,1,Menus!R10C11)),0,Menus!R4C10) -> 0 | C139: =OFFSET(INDIRECT(ADDRESS(RC1,3,3,1,Menus!R10C11)),0,Menus!R3C10) -> 0 | D139: =IF(Menus!R9C10,RC[-1]/RC[-2],RC[-1]) -> #DIV/0! | E139: =IF(RC11=1,VALUE(RC[-3]),NA()) -> NA() | F139: =INDIRECT(ADDRESS(RC1,1,3,1,Menus!R10C11)) -> 0 | G139: =IF(INDIRECT(ADDRESS(RC1,2,3,1,Menus!R10C11))=R1C,RC4,NA()) -> NA() | H139: =IF(INDIRECT(ADDRESS(RC1,2,3,1,Menus!R10C11))=R1C,RC4,NA()) -> NA() | I139: =IF(INDIRECT(ADDRESS(RC1,2,3,1,Menus!R10C11))=R1C,RC4,NA()) -> NA() | J139: =IF(INDIRECT(ADDRESS(RC1,1,3,1,Menus!R10C11))=T(R1C),RC4,NA()) -> NA() | K139: =IF(OR(ISNUMBER(RC7),ISNUMBER(RC8),ISNUMBER(RC9),ISNUMBER(RC10)),1,0) -> 0 | M139: =OFFSET(INDIRECT(ADDRESS(RC1,3,3,1,"Gross")),0,Menus!R4C10) -> 0 | N139: =OFFSET(INDIRECT(ADDRESS(RC1,3,3,1,"Gross")),0,Menus!R3C10) -> 0
A140: 106 | B140: =OFFSET(INDIRECT(ADDRESS(RC1,3,3,1,Menus!R10C11)),0,Menus!R4C10) -> 0 | C140: =OFFSET(INDIRECT(ADDRESS(RC1,3,3,1,Menus!R10C11)),0,Menus!R3C10) -> 0 | D140: =IF(Menus!R9C10,RC[-1]/RC[-2],RC[-1]) -> #DIV/0! | E140: =IF(RC11=1,VALUE(RC[-3]),NA()) -> NA() | F140: =INDIRECT(ADDRESS(RC1,1,3,1,Menus!R10C11)) -> 0 | G140: =IF(INDIRECT(ADDRESS(RC1,2,3,1,Menus!R10C11))=R1C,RC4,NA()) -> NA() | H140: =IF(INDIRECT(ADDRESS(RC1,2,3,1,Menus!R10C11))=R1C,RC4,NA()) -> NA() | I140: =IF(INDIRECT(ADDRESS(RC1,2,3,1,Menus!R10C11))=R1C,RC4,NA()) -> NA() | J140: =IF(INDIRECT(ADDRESS(RC1,1,3,1,Menus!R10C11))=T(R1C),RC4,NA()) -> NA() | K140: =IF(OR(ISNUMBER(RC7),ISNUMBER(RC8),ISNUMBER(RC9),ISNUMBER(RC10)),1,0) -> 0 | M140: =OFFSET(INDIRECT(ADDRESS(RC1,3,3,1,"Gross")),0,Menus!R4C10) -> -2 | N140: =OFFSET(INDIRECT(ADDRESS(RC1,3,3,1,"Gross")),0,Menus!R3C10) -> -1
A141: 111 | B141: =OFFSET(INDIRECT(ADDRESS(RC1,3,3,1,Menus!R10C11)),0,Menus!R4C10) -> 0 | C141: =OFFSET(INDIRECT(ADDRESS(RC1,3,3,1,Menus!R10C11)),0,Menus!R3C10) -> 0 | D141: =IF(Menus!R9C10,RC[-1]/RC[-2],RC[-1]) -> #DIV/0! | E141: =IF(RC11=1,VALUE(RC[-3]),NA()) -> NA() | F141: =INDIRECT(ADDRESS(RC1,1,3,1,Menus!R10C11)) -> 0 | G141: =IF(INDIRECT(ADDRESS(RC1,2,3,1,Menus!R10C11))=R1C,RC4,NA()) -> NA() | H141: =IF(INDIRECT(ADDRESS(RC1,2,3,1,Menus!R10C11))=R1C,RC4,NA()) -> NA() | I141: =IF(INDIRECT(ADDRESS(RC1,2,3,1,Menus!R10C11))=R1C,RC4,NA()) -> NA() | J141: =IF(INDIRECT(ADDRESS(RC1,1,3,1,Menus!R10C11))=T(R1C),RC4,NA()) -> NA() | K141: =IF(OR(ISNUMBER(RC7),ISNUMBER(RC8),ISNUMBER(RC9),ISNUMBER(RC10)),1,0) -> 0 | M141: =OFFSET(INDIRECT(ADDRESS(RC1,3,3,1,"Gross")),0,Menus!R4C10) -> 0 | N141: =OFFSET(INDIRECT(ADDRESS(RC1,3,3,1,"Gross")),0,Menus!R3C10) -> 0
A142: 133 | B142: =OFFSET(INDIRECT(ADDRESS(RC1,3,3,1,Menus!R10C11)),0,Menus!R4C10) -> 0 | C142: =OFFSET(INDIRECT(ADDRESS(RC1,3,3,1,Menus!R10C11)),0,Menus!R3C10) -> 0 | D142: =IF(Menus!R9C10,RC[-1]/RC[-2],RC[-1]) -> #DIV/0! | E142: =IF(RC11=1,VALUE(RC[-3]),NA()) -> NA() | F142: =INDIRECT(ADDRESS(RC1,1,3,1,Menus!R10C11)) -> 0 | G142: =IF(INDIRECT(ADDRESS(RC1,2,3,1,Menus!R10C11))=R1C,RC4,NA()) -> NA() | H142: =IF(INDIRECT(ADDRESS(RC1,2,3,1,Menus!R10C11))=R1C,RC4,NA()) -> NA() | I142: =IF(INDIRECT(ADDRESS(RC1,2,3,1,Menus!R10C11))=R1C,RC4,NA()) -> NA() | J142: =IF(INDIRECT(ADDRESS(RC1,1,3,1,Menus!R10C11))=T(R1C),RC4,NA()) -> NA() | K142: =IF(OR(ISNUMBER(RC7),ISNUMBER(RC8),ISNUMBER(RC9),ISNUMBER(RC10)),1,0) -> 0 | M142: =OFFSET(INDIRECT(ADDRESS(RC1,3,3,1,"Gross")),0,Menus!R4C10) -> 1 | N142: =OFFSET(INDIRECT(ADDRESS(RC1,3,3,1,"Gross")),0,Menus!R3C10) -> -1
A143: 101 | B143: =OFFSET(INDIRECT(ADDRESS(RC1,3,3,1,Menus!R10C11)),0,Menus!R4C10) -> 0 | C143: =OFFSET(INDIRECT(ADDRESS(RC1,3,3,1,Menus!R10C11)),0,Menus!R3C10) -> 0 | D143: =IF(Menus!R9C10,RC[-1]/RC[-2],RC[-1]) -> #DIV/0! | E143: =IF(RC11=1,VALUE(RC[-3]),NA()) -> NA() | F143: =INDIRECT(ADDRESS(RC1,1,3,1,Menus!R10C11)) -> 0 | G143: =IF(INDIRECT(ADDRESS(RC1,2,3,1,Menus!R10C11))=R1C,RC4,NA()) -> NA() | H143: =IF(INDIRECT(ADDRESS(RC1,2,3,1,Menus!R10C11))=R1C,RC4,NA()) -> NA() | I143: =IF(INDIRECT(ADDRESS(RC1,2,3,1,Menus!R10C11))=R1C,RC4,NA()) -> NA() | J143: =IF(INDIRECT(ADDRESS(RC1,1,3,1,Menus!R10C11))=T(R1C),RC4,NA()) -> NA() | K143: =IF(OR(ISNUMBER(RC7),ISNUMBER(RC8),ISNUMBER(RC9),ISNUMBER(RC10)),1,0) -> 0 | M143: =OFFSET(INDIRECT(ADDRESS(RC1,3,3,1,"Gross")),0,Menus!R4C10) -> -1 | N143: =OFFSET(INDIRECT(ADDRESS(RC1,3,3,1,"Gross")),0,Menus!R3C10) -> -1
A144: 102 | B144: =OFFSET(INDIRECT(ADDRESS(RC1,3,3,1,Menus!R10C11)),0,Menus!R4C10) -> 0 | C144: =OFFSET(INDIRECT(ADDRESS(RC1,3,3,1,Menus!R10C11)),0,Menus!R3C10) -> 0 | D144: =IF(Menus!R9C10,RC[-1]/RC[-2],RC[-1]) -> #DIV/0! | E144: =IF(RC11=1,VALUE(RC[-3]),NA()) -> NA() | F144: =INDIRECT(ADDRESS(RC1,1,3,1,Menus!R10C11)) -> 0 | G144: =IF(INDIRECT(ADDRESS(RC1,2,3,1,Menus!R10C11))=R1C,RC4,NA()) -> NA() | H144: =IF(INDIRECT(ADDRESS(RC1,2,3,1,Menus!R10C11))=R1C,RC4,NA()) -> NA() | I144: =IF(INDIRECT(ADDRESS(RC1,2,3,1,Menus!R10C11))=R1C,RC4,NA()) -> NA() | J144: =IF(INDIRECT(ADDRESS(RC1,1,3,1,Menus!R10C11))=T(R1C),RC4,NA()) -> NA() | K144: =IF(OR(ISNUMBER(RC7),ISNUMBER(RC8),ISNUMBER(RC9),ISNUMBER(RC10)),1,0) -> 0 | M144: =OFFSET(INDIRECT(ADDRESS(RC1,3,3,1,"Gross")),0,Menus!R4C10) -> 0 | N144: =OFFSET(INDIRECT(ADDRESS(RC1,3,3,1,"Gross")),0,Menus!R3C10) -> 0
A145: 185 | B145: =OFFSET(INDIRECT(ADDRESS(RC1,3,3,1,Menus!R10C11)),0,Menus!R4C10) -> 0 | C145: =OFFSET(INDIRECT(ADDRESS(RC1,3,3,1,Menus!R10C11)),0,Menus!R3C10) -> 0 | D145: =IF(Menus!R9C10,RC[-1]/RC[-2],RC[-1]) -> #DIV/0! | E145: =IF(RC11=1,VALUE(RC[-3]),NA()) -> NA() | F145: =INDIRECT(ADDRESS(RC1,1,3,1,Menus!R10C11)) -> 0 | G145: =IF(INDIRECT(ADDRESS(RC1,2,3,1,Menus!R10C11))=R1C,RC4,NA()) -> NA() | H145: =IF(INDIRECT(ADDRESS(RC1,2,3,1,Menus!R10C11))=R1C,RC4,NA()) -> NA() | I145: =IF(INDIRECT(ADDRESS(RC1,2,3,1,Menus!R10C11))=R1C,RC4,NA()) -> NA() | J145: =IF(INDIRECT(ADDRESS(RC1,1,3,1,Menus!R10C11))=T(R1C),RC4,NA()) -> NA() | K145: =IF(OR(ISNUMBER(RC7),ISNUMBER(RC8),ISNUMBER(RC9),ISNUMBER(RC10)),1,0) -> 0 | M145: =OFFSET(INDIRECT(ADDRESS(RC1,3,3,1,"Gross")),0,Menus!R4C10) -> 0 | N145: =OFFSET(INDIRECT(ADDRESS(RC1,3,3,1,"Gross")),0,Menus!R3C10) -> 0
A146: 170 | B146: =OFFSET(INDIRECT(ADDRESS(RC1,3,3,1,Menus!R10C11)),0,Menus!R4C10) -> 0 | C146: =OFFSET(INDIRECT(ADDRESS(RC1,3,3,1,Menus!R10C11)),0,Menus!R3C10) -> 0 | D146: =IF(Menus!R9C10,RC[-1]/RC[-2],RC[-1]) -> #DIV/0! | E146: =IF(RC11=1,VALUE(RC[-3]),NA()) -> NA() | F146: =INDIRECT(ADDRESS(RC1,1,3,1,Menus!R10C11)) -> 0 | G146: =IF(INDIRECT(ADDRESS(RC1,2,3,1,Menus!R10C11))=R1C,RC4,NA()) -> NA() | H146: =IF(INDIRECT(ADDRESS(RC1,2,3,1,Menus!R10C11))=R1C,RC4,NA()) -> NA() | I146: =IF(INDIRECT(ADDRESS(RC1,2,3,1,Menus!R10C11))=R1C,RC4,NA()) -> NA() | J146: =IF(INDIRECT(ADDRESS(RC1,1,3,1,Menus!R10C11))=T(R1C),RC4,NA()) -> NA() | K146: =IF(OR(ISNUMBER(RC7),ISNUMBER(RC8),ISNUMBER(RC9),ISNUMBER(RC10)),1,0) -> 0 | M146: =OFFSET(INDIRECT(ADDRESS(RC1,3,3,1,"Gross")),0,Menus!R4C10) -> 0 | N146: =OFFSET(INDIRECT(ADDRESS(RC1,3,3,1,"Gross")),0,Menus!R3C10) -> 0
A147: 151 | B147: =OFFSET(INDIRECT(ADDRESS(RC1,3,3,1,Menus!R10C11)),0,Menus!R4C10) -> 0 | C147: =OFFSET(INDIRECT(ADDRESS(RC1,3,3,1,Menus!R10C11)),0,Menus!R3C10) -> 0 | D147: =IF(Menus!R9C10,RC[-1]/RC[-2],RC[-1]) -> #DIV/0! | E147: =IF(RC11=1,VALUE(RC[-3]),NA()) -> NA() | F147: =INDIRECT(ADDRESS(RC1,1,3,1,Menus!R10C11)) -> 0 | G147: =IF(INDIRECT(ADDRESS(RC1,2,3,1,Menus!R10C11))=R1C,RC4,NA()) -> NA() | H147: =IF(INDIRECT(ADDRESS(RC1,2,3,1,Menus!R10C11))=R1C,RC4,NA()) -> NA() | I147: =IF(INDIRECT(ADDRESS(RC1,2,3,1,Menus!R10C11))=R1C,RC4,NA()) -> NA() | J147: =IF(INDIRECT(ADDRESS(RC1,1,3,1,Menus!R10C11))=T(R1C),RC4,NA()) -> NA() | K147: =IF(OR(ISNUMBER(RC7),ISNUMBER(RC8),ISNUMBER(RC9),ISNUMBER(RC10)),1,0) -> 0 | M147: =OFFSET(INDIRECT(ADDRESS(RC1,3,3,1,"Gross")),0,Menus!R4C10) -> 0 | N147: =OFFSET(INDIRECT(ADDRESS(RC1,3,3,1,"Gross")),0,Menus!R3C10) -> 2
A148: 174 | B148: =OFFSET(INDIRECT(ADDRESS(RC1,3,3,1,Menus!R10C11)),0,Menus!R4C10) -> 0 | C148: =OFFSET(INDIRECT(ADDRESS(RC1,3,3,1,Menus!R10C11)),0,Menus!R3C10) -> 0 | D148: =IF(Menus!R9C10,RC[-1]/RC[-2],RC[-1]) -> #DIV/0! | E148: =IF(RC11=1,VALUE(RC[-3]),NA()) -> NA() | F148: =INDIRECT(ADDRESS(RC1,1,3,1,Menus!R10C11)) -> 0 | G148: =IF(INDIRECT(ADDRESS(RC1,2,3,1,Menus!R10C11))=R1C,RC4,NA()) -> NA() | H148: =IF(INDIRECT(ADDRESS(RC1,2,3,1,Menus!R10C11))=R1C,RC4,NA()) -> NA() | I148: =IF(INDIRECT(ADDRESS(RC1,2,3,1,Menus!R10C11))=R1C,RC4,NA()) -> NA() | J148: =IF(INDIRECT(ADDRESS(RC1,1,3,1,Menus!R10C11))=T(R1C),RC4,NA()) -> NA() | K148: =IF(OR(ISNUMBER(RC7),ISNUMBER(RC8),ISNUMBER(RC9),ISNUMBER(RC10)),1,0) -> 0 | M148: =OFFSET(INDIRECT(ADDRESS(RC1,3,3,1,"Gross")),0,Menus!R4C10) -> 0 | N148: =OFFSET(INDIRECT(ADDRESS(RC1,3,3,1,"Gross")),0,Menus!R3C10) -> 0
A149: 142 | B149: =OFFSET(INDIRECT(ADDRESS(RC1,3,3,1,Menus!R10C11)),0,Menus!R4C10) -> 0 | C149: =OFFSET(INDIRECT(ADDRESS(RC1,3,3,1,Menus!R10C11)),0,Menus!R3C10) -> 0 | D149: =IF(Menus!R9C10,RC[-1]/RC[-2],RC[-1]) -> #DIV/0! | E149: =IF(RC11=1,VALUE(RC[-3]),NA()) -> NA() | F149: =INDIRECT(ADDRESS(RC1,1,3,1,Menus!R10C11)) -> 0 | G149: =IF(INDIRECT(ADDRESS(RC1,2,3,1,Menus!R10C11))=R1C,RC4,NA()) -> NA() | H149: =IF(INDIRECT(ADDRESS(RC1,2,3,1,Menus!R10C11))=R1C,RC4,NA()) -> NA() | I149: =IF(INDIRECT(ADDRESS(RC1,2,3,1,Menus!R10C11))=R1C,RC4,NA()) -> NA() | J149: =IF(INDIRECT(ADDRESS(RC1,1,3,1,Menus!R10C11))=T(R1C),RC4,NA()) -> NA() | K149: =IF(OR(ISNUMBER(RC7),ISNUMBER(RC8),ISNUMBER(RC9),ISNUMBER(RC10)),1,0) -> 0 | M149: =OFFSET(INDIRECT(ADDRESS(RC1,3,3,1,"Gross")),0,Menus!R4C10) -> 0 | N149: =OFFSET(INDIRECT(ADDRESS(RC1,3,3,1,"Gross")),0,Menus!R3C10) -> 1
A150: 59 | B150: =OFFSET(INDIRECT(ADDRESS(RC1,3,3,1,Menus!R10C11)),0,Menus!R4C10) -> 0 | C150: =OFFSET(INDIRECT(ADDRESS(RC1,3,3,1,Menus!R10C11)),0,Menus!R3C10) -> 0 | D150: =IF(Menus!R9C10,RC[-1]/RC[-2],RC[-1]) -> #DIV/0! | E150: =IF(RC11=1,VALUE(RC[-3]),NA()) -> NA() | F150: =INDIRECT(ADDRESS(RC1,1,3,1,Menus!R10C11)) -> 0 | G150: =IF(INDIRECT(ADDRESS(RC1,2,3,1,Menus!R10C11))=R1C,RC4,NA()) -> NA() | H150: =IF(INDIRECT(ADDRESS(RC1,2,3,1,Menus!R10C11))=R1C,RC4,NA()) -> NA() | I150: =IF(INDIRECT(ADDRESS(RC1,2,3,1,Menus!R10C11))=R1C,RC4,NA()) -> NA() | J150: =IF(INDIRECT(ADDRESS(RC1,1,3,1,Menus!R10C11))=T(R1C),RC4,NA()) -> NA() | K150: =IF(OR(ISNUMBER(RC7),ISNUMBER(RC8),ISNUMBER(RC9),ISNUMBER(RC10)),1,0) -> 0 | M150: =OFFSET(INDIRECT(ADDRESS(RC1,3,3,1,"Gross")),0,Menus!R4C10) -> 0 | N150: =OFFSET(INDIRECT(ADDRESS(RC1,3,3,1,"Gross")),0,Menus!R3C10) -> 0
A151: 108 | B151: =OFFSET(INDIRECT(ADDRESS(RC1,3,3,1,Menus!R10C11)),0,Menus!R4C10) -> 0 | C151: =OFFSET(INDIRECT(ADDRESS(RC1,3,3,1,Menus!R10C11)),0,Menus!R3C10) -> 0 | D151: =IF(Menus!R9C10,RC[-1]/RC[-2],RC[-1]) -> #DIV/0! | E151: =IF(RC11=1,VALUE(RC[-3]),NA()) -> NA() | F151: =INDIRECT(ADDRESS(RC1,1,3,1,Menus!R10C11)) -> 0 | G151: =IF(INDIRECT(ADDRESS(RC1,2,3,1,Menus!R10C11))=R1C,RC4,NA()) -> NA() | H151: =IF(INDIRECT(ADDRESS(RC1,2,3,1,Menus!R10C11))=R1C,RC4,NA()) -> NA() | I151: =IF(INDIRECT(ADDRESS(RC1,2,3,1,Menus!R10C11))=R1C,RC4,NA()) -> NA() | J151: =IF(INDIRECT(ADDRESS(RC1,1,3,1,Menus!R10C11))=T(R1C),RC4,NA()) -> NA() | K151: =IF(OR(ISNUMBER(RC7),ISNUMBER(RC8),ISNUMBER(RC9),ISNUMBER(RC10)),1,0) -> 0 | M151: =OFFSET(INDIRECT(ADDRESS(RC1,3,3,1,"Gross")),0,Menus!R4C10) -> 1 | N151: =OFFSET(INDIRECT(ADDRESS(RC1,3,3,1,"Gross")),0,Menus!R3C10) -> 0
A152: 173 | B152: =OFFSET(INDIRECT(ADDRESS(RC1,3,3,1,Menus!R10C11)),0,Menus!R4C10) -> 0 | C152: =OFFSET(INDIRECT(ADDRESS(RC1,3,3,1,Menus!R10C11)),0,Menus!R3C10) -> 0 | D152: =IF(Menus!R9C10,RC[-1]/RC[-2],RC[-1]) -> #DIV/0! | E152: =IF(RC11=1,VALUE(RC[-3]),NA()) -> NA() | F152: =INDIRECT(ADDRESS(RC1,1,3,1,Menus!R10C11)) -> 0 | G152: =IF(INDIRECT(ADDRESS(RC1,2,3,1,Menus!R10C11))=R1C,RC4,NA()) -> NA() | H152: =IF(INDIRECT(ADDRESS(RC1,2,3,1,Menus!R10C11))=R1C,RC4,NA()) -> NA() | I152: =IF(INDIRECT(ADDRESS(RC1,2,3,1,Menus!R10C11))=R1C,RC4,NA()) -> NA() | J152: =IF(INDIRECT(ADDRESS(RC1,1,3,1,Menus!R10C11))=T(R1C),RC4,NA()) -> NA() | K152: =IF(OR(ISNUMBER(RC7),ISNUMBER(RC8),ISNUMBER(RC9),ISNUMBER(RC10)),1,0) -> 0 | M152: =OFFSET(INDIRECT(ADDRESS(RC1,3,3,1,"Gross")),0,Menus!R4C10) -> 0 | N152: =OFFSET(INDIRECT(ADDRESS(RC1,3,3,1,"Gross")),0,Menus!R3C10) -> 0
A153: 52 | B153: =OFFSET(INDIRECT(ADDRESS(RC1,3,3,1,Menus!R10C11)),0,Menus!R4C10) -> 0 | C153: =OFFSET(INDIRECT(ADDRESS(RC1,3,3,1,Menus!R10C11)),0,Menus!R3C10) -> 0 | D153: =IF(Menus!R9C10,RC[-1]/RC[-2],RC[-1]) -> #DIV/0! | E153: =IF(RC11=1,VALUE(RC[-3]),NA()) -> NA() | F153: =INDIRECT(ADDRESS(RC1,1,3,1,Menus!R10C11)) -> 0 | G153: =IF(INDIRECT(ADDRESS(RC1,2,3,1,Menus!R10C11))=R1C,RC4,NA()) -> NA() | H153: =IF(INDIRECT(ADDRESS(RC1,2,3,1,Menus!R10C11))=R1C,RC4,NA()) -> NA() | I153: =IF(INDIRECT(ADDRESS(RC1,2,3,1,Menus!R10C11))=R1C,RC4,NA()) -> NA() | J153: =IF(INDIRECT(ADDRESS(RC1,1,3,1,Menus!R10C11))=T(R1C),RC4,NA()) -> NA() | K153: =IF(OR(ISNUMBER(RC7),ISNUMBER(RC8),ISNUMBER(RC9),ISNUMBER(RC10)),1,0) -> 0 | M153: =OFFSET(INDIRECT(ADDRESS(RC1,3,3,1,"Gross")),0,Menus!R4C10) -> 0 | N153: =OFFSET(INDIRECT(ADDRESS(RC1,3,3,1,"Gross")),0,Menus!R3C10) -> 0
A154: 64 | B154: =OFFSET(INDIRECT(ADDRESS(RC1,3,3,1,Menus!R10C11)),0,Menus!R4C10) -> 0 | C154: =OFFSET(INDIRECT(ADDRESS(RC1,3,3,1,Menus!R10C11)),0,Menus!R3C10) -> 0 | D154: =IF(Menus!R9C10,RC[-1]/RC[-2],RC[-1]) -> #DIV/0! | E154: =IF(RC11=1,VALUE(RC[-3]),NA()) -> NA() | F154: =INDIRECT(ADDRESS(RC1,1,3,1,Menus!R10C11)) -> 0 | G154: =IF(INDIRECT(ADDRESS(RC1,2,3,1,Menus!R10C11))=R1C,RC4,NA()) -> NA() | H154: =IF(INDIRECT(ADDRESS(RC1,2,3,1,Menus!R10C11))=R1C,RC4,NA()) -> NA() | I154: =IF(INDIRECT(ADDRESS(RC1,2,3,1,Menus!R10C11))=R1C,RC4,NA()) -> NA() | J154: =IF(INDIRECT(ADDRESS(RC1,1,3,1,Menus!R10C11))=T(R1C),RC4,NA()) -> NA() | K154: =IF(OR(ISNUMBER(RC7),ISNUMBER(RC8),ISNUMBER(RC9),ISNUMBER(RC10)),1,0) -> 0 | M154: =OFFSET(INDIRECT(ADDRESS(RC1,3,3,1,"Gross")),0,Menus!R4C10) -> 2 | N154: =OFFSET(INDIRECT(ADDRESS(RC1,3,3,1,"Gross")),0,Menus!R3C10) -> 2
A155: 121 | B155: =OFFSET(INDIRECT(ADDRESS(RC1,3,3,1,Menus!R10C11)),0,Menus!R4C10) -> 0 | C155: =OFFSET(INDIRECT(ADDRESS(RC1,3,3,1,Menus!R10C11)),0,Menus!R3C10) -> 0 | D155: =IF(Menus!R9C10,RC[-1]/RC[-2],RC[-1]) -> #DIV/0! | E155: =IF(RC11=1,VALUE(RC[-3]),NA()) -> NA() | F155: =INDIRECT(ADDRESS(RC1,1,3,1,Menus!R10C11)) -> 0 | G155: =IF(INDIRECT(ADDRESS(RC1,2,3,1,Menus!R10C11))=R1C,RC4,NA()) -> NA() | H155: =IF(INDIRECT(ADDRESS(RC1,2,3,1,Menus!R10C11))=R1C,RC4,NA()) -> NA() | I155: =IF(INDIRECT(ADDRESS(RC1,2,3,1,Menus!R10C11))=R1C,RC4,NA()) -> NA() | J155: =IF(INDIRECT(ADDRESS(RC1,1,3,1,Menus!R10C11))=T(R1C),RC4,NA()) -> NA() | K155: =IF(OR(ISNUMBER(RC7),ISNUMBER(RC8),ISNUMBER(RC9),ISNUMBER(RC10)),1,0) -> 0 | M155: =OFFSET(INDIRECT(ADDRESS(RC1,3,3,1,"Gross")),0,Menus!R4C10) -> 0 | N155: =OFFSET(INDIRECT(ADDRESS(RC1,3,3,1,"Gross")),0,Menus!R3C10) -> 0
A156: 141 | B156: =OFFSET(INDIRECT(ADDRESS(RC1,3,3,1,Menus!R10C11)),0,Menus!R4C10) -> 0 | C156: =OFFSET(INDIRECT(ADDRESS(RC1,3,3,1,Menus!R10C11)),0,Menus!R3C10) -> 0 | D156: =IF(Menus!R9C10,RC[-1]/RC[-2],RC[-1]) -> #DIV/0! | E156: =IF(RC11=1,VALUE(RC[-3]),NA()) -> NA() | F156: =INDIRECT(ADDRESS(RC1,1,3,1,Menus!R10C11)) -> 0 | G156: =IF(INDIRECT(ADDRESS(RC1,2,3,1,Menus!R10C11))=R1C,RC4,NA()) -> NA() | H156: =IF(INDIRECT(ADDRESS(RC1,2,3,1,Menus!R10C11))=R1C,RC4,NA()) -> NA() | I156: =IF(INDIRECT(ADDRESS(RC1,2,3,1,Menus!R10C11))=R1C,RC4,NA()) -> NA() | J156: =IF(INDIRECT(ADDRESS(RC1,1,3,1,Menus!R10C11))=T(R1C),RC4,NA()) -> NA() | K156: =IF(OR(ISNUMBER(RC7),ISNUMBER(RC8),ISNUMBER(RC9),ISNUMBER(RC10)),1,0) -> 0 | M156: =OFFSET(INDIRECT(ADDRESS(RC1,3,3,1,"Gross")),0,Menus!R4C10) -> 0 | N156: =OFFSET(INDIRECT(ADDRESS(RC1,3,3,1,"Gross")),0,Menus!R3C10) -> 0
A157: 114 | B157: =OFFSET(INDIRECT(ADDRESS(RC1,3,3,1,Menus!R10C11)),0,Menus!R4C10) -> 0 | C157: =OFFSET(INDIRECT(ADDRESS(RC1,3,3,1,Menus!R10C11)),0,Menus!R3C10) -> 0 | D157: =IF(Menus!R9C10,RC[-1]/RC[-2],RC[-1]) -> #DIV/0! | E157: =IF(RC11=1,VALUE(RC[-3]),NA()) -> NA() | F157: =INDIRECT(ADDRESS(RC1,1,3,1,Menus!R10C11)) -> 0 | G157: =IF(INDIRECT(ADDRESS(RC1,2,3,1,Menus!R10C11))=R1C,RC4,NA()) -> NA() | H157: =IF(INDIRECT(ADDRESS(RC1,2,3,1,Menus!R10C11))=R1C,RC4,NA()) -> NA() | I157: =IF(INDIRECT(ADDRESS(RC1,2,3,1,Menus!R10C11))=R1C,RC4,NA()) -> NA() | J157: =IF(INDIRECT(ADDRESS(RC1,1,3,1,Menus!R10C11))=T(R1C),RC4,NA()) -> NA() | K157: =IF(OR(ISNUMBER(RC7),ISNUMBER(RC8),ISNUMBER(RC9),ISNUMBER(RC10)),1,0) -> 0 | M157: =OFFSET(INDIRECT(ADDRESS(RC1,3,3,1,"Gross")),0,Menus!R4C10) -> 1 | N157: =OFFSET(INDIRECT(ADDRESS(RC1,3,3,1,"Gross")),0,Menus!R3C10) -> 1
A158: 180 | B158: =OFFSET(INDIRECT(ADDRESS(RC1,3,3,1,Menus!R10C11)),0,Menus!R4C10) -> 0 | C158: =OFFSET(INDIRECT(ADDRESS(RC1,3,3,1,Menus!R10C11)),0,Menus!R3C10) -> 0 | D158: =IF(Menus!R9C10,RC[-1]/RC[-2],RC[-1]) -> #DIV/0! | E158: =IF(RC11=1,VALUE(RC[-3]),NA()) -> NA() | F158: =INDIRECT(ADDRESS(RC1,1,3,1,Menus!R10C11)) -> 0 | G158: =IF(INDIRECT(ADDRESS(RC1,2,3,1,Menus!R10C11))=R1C,RC4,NA()) -> NA() | H158: =IF(INDIRECT(ADDRESS(RC1,2,3,1,Menus!R10C11))=R1C,RC4,NA()) -> NA() | I158: =IF(INDIRECT(ADDRESS(RC1,2,3,1,Menus!R10C11))=R1C,RC4,NA()) -> NA() | J158: =IF(INDIRECT(ADDRESS(RC1,1,3,1,Menus!R10C11))=T(R1C),RC4,NA()) -> NA() | K158: =IF(OR(ISNUMBER(RC7),ISNUMBER(RC8),ISNUMBER(RC9),ISNUMBER(RC10)),1,0) -> 0 | M158: =OFFSET(INDIRECT(ADDRESS(RC1,3,3,1,"Gross")),0,Menus!R4C10) -> 0 | N158: =OFFSET(INDIRECT(ADDRESS(RC1,3,3,1,"Gross")),0,Menus!R3C10) -> 0
A159: 60 | B159: =OFFSET(INDIRECT(ADDRESS(RC1,3,3,1,Menus!R10C11)),0,Menus!R4C10) -> 0 | C159: =OFFSET(INDIRECT(ADDRESS(RC1,3,3,1,Menus!R10C11)),0,Menus!R3C10) -> 0 | D159: =IF(Menus!R9C10,RC[-1]/RC[-2],RC[-1]) -> #DIV/0! | E159: =IF(RC11=1,VALUE(RC[-3]),NA()) -> NA() | F159: =INDIRECT(ADDRESS(RC1,1,3,1,Menus!R10C11)) -> 0 | G159: =IF(INDIRECT(ADDRESS(RC1,2,3,1,Menus!R10C11))=R1C,RC4,NA()) -> NA() | H159: =IF(INDIRECT(ADDRESS(RC1,2,3,1,Menus!R10C11))=R1C,RC4,NA()) -> NA() | I159: =IF(INDIRECT(ADDRESS(RC1,2,3,1,Menus!R10C11))=R1C,RC4,NA()) -> NA() | J159: =IF(INDIRECT(ADDRESS(RC1,1,3,1,Menus!R10C11))=T(R1C),RC4,NA()) -> NA() | K159: =IF(OR(ISNUMBER(RC7),ISNUMBER(RC8),ISNUMBER(RC9),ISNUMBER(RC10)),1,0) -> 0 | M159: =OFFSET(INDIRECT(ADDRESS(RC1,3,3,1,"Gross")),0,Menus!R4C10) -> 1 | N159: =OFFSET(INDIRECT(ADDRESS(RC1,3,3,1,"Gross")),0,Menus!R3C10) -> 1
A160: 72 | B160: =OFFSET(INDIRECT(ADDRESS(RC1,3,3,1,Menus!R10C11)),0,Menus!R4C10) -> 0 | C160: =OFFSET(INDIRECT(ADDRESS(RC1,3,3,1,Menus!R10C11)),0,Menus!R3C10) -> 0 | D160: =IF(Menus!R9C10,RC[-1]/RC[-2],RC[-1]) -> #DIV/0! | E160: =IF(RC11=1,VALUE(RC[-3]),NA()) -> NA() | F160: =INDIRECT(ADDRESS(RC1,1,3,1,Menus!R10C11)) -> 0 | G160: =IF(INDIRECT(ADDRESS(RC1,2,3,1,Menus!R10C11))=R1C,RC4,NA()) -> NA() | H160: =IF(INDIRECT(ADDRESS(RC1,2,3,1,Menus!R10C11))=R1C,RC4,NA()) -> NA() | I160: =IF(INDIRECT(ADDRESS(RC1,2,3,1,Menus!R10C11))=R1C,RC4,NA()) -> NA() | J160: =IF(INDIRECT(ADDRESS(RC1,1,3,1,Menus!R10C11))=T(R1C),RC4,NA()) -> NA() | K160: =IF(OR(ISNUMBER(RC7),ISNUMBER(RC8),ISNUMBER(RC9),ISNUMBER(RC10)),1,0) -> 0 | M160: =OFFSET(INDIRECT(ADDRESS(RC1,3,3,1,"Gross")),0,Menus!R4C10) -> 1 | N160: =OFFSET(INDIRECT(ADDRESS(RC1,3,3,1,"Gross")),0,Menus!R3C10) -> 1
A161: 198 | B161: =OFFSET(INDIRECT(ADDRESS(RC1,3,3,1,Menus!R10C11)),0,Menus!R4C10) -> 0 | C161: =OFFSET(INDIRECT(ADDRESS(RC1,3,3,1,Menus!R10C11)),0,Menus!R3C10) -> 0 | D161: =IF(Menus!R9C10,RC[-1]/RC[-2],RC[-1]) -> #DIV/0! | E161: =IF(RC11=1,VALUE(RC[-3]),NA()) -> NA() | F161: =INDIRECT(ADDRESS(RC1,1,3,1,Menus!R10C11)) -> 0 | G161: =IF(INDIRECT(ADDRESS(RC1,2,3,1,Menus!R10C11))=R1C,RC4,NA()) -> NA() | H161: =IF(INDIRECT(ADDRESS(RC1,2,3,1,Menus!R10C11))=R1C,RC4,NA()) -> NA() | I161: =IF(INDIRECT(ADDRESS(RC1,2,3,1,Menus!R10C11))=R1C,RC4,NA()) -> NA() | J161: =IF(INDIRECT(ADDRESS(RC1,1,3,1,Menus!R10C11))=T(R1C),RC4,NA()) -> NA() | K161: =IF(OR(ISNUMBER(RC7),ISNUMBER(RC8),ISNUMBER(RC9),ISNUMBER(RC10)),1,0) -> 0 | M161: =OFFSET(INDIRECT(ADDRESS(RC1,3,3,1,"Gross")),0,Menus!R4C10) -> 0 | N161: =OFFSET(INDIRECT(ADDRESS(RC1,3,3,1,"Gross")),0,Menus!R3C10) -> 0
A162: 199 | B162: =OFFSET(INDIRECT(ADDRESS(RC1,3,3,1,Menus!R10C11)),0,Menus!R4C10) -> 0 | C162: =OFFSET(INDIRECT(ADDRESS(RC1,3,3,1,Menus!R10C11)),0,Menus!R3C10) -> 0 | D162: =IF(Menus!R9C10,RC[-1]/RC[-2],RC[-1]) -> #DIV/0! | E162: =IF(RC11=1,VALUE(RC[-3]),NA()) -> NA() | F162: =INDIRECT(ADDRESS(RC1,1,3,1,Menus!R10C11)) -> 0 | G162: =IF(INDIRECT(ADDRESS(RC1,2,3,1,Menus!R10C11))=R1C,RC4,NA()) -> NA() | H162: =IF(INDIRECT(ADDRESS(RC1,2,3,1,Menus!R10C11))=R1C,RC4,NA()) -> NA() | I162: =IF(INDIRECT(ADDRESS(RC1,2,3,1,Menus!R10C11))=R1C,RC4,NA()) -> NA() | J162: =IF(INDIRECT(ADDRESS(RC1,1,3,1,Menus!R10C11))=T(R1C),RC4,NA()) -> NA() | K162: =IF(OR(ISNUMBER(RC7),ISNUMBER(RC8),ISNUMBER(RC9),ISNUMBER(RC10)),1,0) -> 0 | M162: =OFFSET(INDIRECT(ADDRESS(RC1,3,3,1,"Gross")),0,Menus!R4C10) -> 0 | N162: =OFFSET(INDIRECT(ADDRESS(RC1,3,3,1,"Gross")),0,Menus!R3C10) -> 0
A163: 200 | B163: =OFFSET(INDIRECT(ADDRESS(RC1,3,3,1,Menus!R10C11)),0,Menus!R4C10) -> 0 | C163: =OFFSET(INDIRECT(ADDRESS(RC1,3,3,1,Menus!R10C11)),0,Menus!R3C10) -> 0 | D163: =IF(Menus!R9C10,RC[-1]/RC[-2],RC[-1]) -> #DIV/0! | E163: =IF(RC11=1,VALUE(RC[-3]),NA()) -> NA() | F163: =INDIRECT(ADDRESS(RC1,1,3,1,Menus!R10C11)) -> 0 | G163: =IF(INDIRECT(ADDRESS(RC1,2,3,1,Menus!R10C11))=R1C,RC4,NA()) -> NA() | H163: =IF(INDIRECT(ADDRESS(RC1,2,3,1,Menus!R10C11))=R1C,RC4,NA()) -> NA() | I163: =IF(INDIRECT(ADDRESS(RC1,2,3,1,Menus!R10C11))=R1C,RC4,NA()) -> NA() | J163: =IF(INDIRECT(ADDRESS(RC1,1,3,1,Menus!R10C11))=T(R1C),RC4,NA()) -> NA() | K163: =IF(OR(ISNUMBER(RC7),ISNUMBER(RC8),ISNUMBER(RC9),ISNUMBER(RC10)),1,0) -> 0 | M163: =OFFSET(INDIRECT(ADDRESS(RC1,3,3,1,"Gross")),0,Menus!R4C10) -> 0 | N163: =OFFSET(INDIRECT(ADDRESS(RC1,3,3,1,"Gross")),0,Menus!R3C10) -> 0
A164: 201 | B164: =OFFSET(INDIRECT(ADDRESS(RC1,3,3,1,Menus!R10C11)),0,Menus!R4C10) -> 0 | C164: =OFFSET(INDIRECT(ADDRESS(RC1,3,3,1,Menus!R10C11)),0,Menus!R3C10) -> 0 | D164: =IF(Menus!R9C10,RC[-1]/RC[-2],RC[-1]) -> #DIV/0! | E164: =IF(RC11=1,VALUE(RC[-3]),NA()) -> NA() | F164: =INDIRECT(ADDRESS(RC1,1,3,1,Menus!R10C11)) -> 0 | G164: =IF(INDIRECT(ADDRESS(RC1,2,3,1,Menus!R10C11))=R1C,RC4,NA()) -> NA() | H164: =IF(INDIRECT(ADDRESS(RC1,2,3,1,Menus!R10C11))=R1C,RC4,NA()) -> NA() | I164: =IF(INDIRECT(ADDRESS(RC1,2,3,1,Menus!R10C11))=R1C,RC4,NA()) -> NA() | J164: =IF(INDIRECT(ADDRESS(RC1,1,3,1,Menus!R10C11))=T(R1C),RC4,NA()) -> NA() | K164: =IF(OR(ISNUMBER(RC7),ISNUMBER(RC8),ISNUMBER(RC9),ISNUMBER(RC10)),1,0) -> 0 | M164: =OFFSET(INDIRECT(ADDRESS(RC1,3,3,1,"Gross")),0,Menus!R4C10) -> 0 | N164: =OFFSET(INDIRECT(ADDRESS(RC1,3,3,1,"Gross")),0,Menus!R3C10) -> 0
A165: 202 | B165: =OFFSET(INDIRECT(ADDRESS(RC1,3,3,1,Menus!R10C11)),0,Menus!R4C10) -> 0 | C165: =OFFSET(INDIRECT(ADDRESS(RC1,3,3,1,Menus!R10C11)),0,Menus!R3C10) -> 0 | D165: =IF(Menus!R9C10,RC[-1]/RC[-2],RC[-1]) -> #DIV/0! | E165: =IF(RC11=1,VALUE(RC[-3]),NA()) -> NA() | F165: =INDIRECT(ADDRESS(RC1,1,3,1,Menus!R10C11)) -> 0 | G165: =IF(INDIRECT(ADDRESS(RC1,2,3,1,Menus!R10C11))=R1C,RC4,NA()) -> NA() | H165: =IF(INDIRECT(ADDRESS(RC1,2,3,1,Menus!R10C11))=R1C,RC4,NA()) -> NA() | I165: =IF(INDIRECT(ADDRESS(RC1,2,3,1,Menus!R10C11))=R1C,RC4,NA()) -> NA() | J165: =IF(INDIRECT(ADDRESS(RC1,1,3,1,Menus!R10C11))=T(R1C),RC4,NA()) -> NA() | K165: =IF(OR(ISNUMBER(RC7),ISNUMBER(RC8),ISNUMBER(RC9),ISNUMBER(RC10)),1,0) -> 0 | M165: =OFFSET(INDIRECT(ADDRESS(RC1,3,3,1,"Gross")),0,Menus!R4C10) -> 0 | N165: =OFFSET(INDIRECT(ADDRESS(RC1,3,3,1,"Gross")),0,Menus!R3C10) -> 0
A166: 203 | B166: =OFFSET(INDIRECT(ADDRESS(RC1,3,3,1,Menus!R10C11)),0,Menus!R4C10) -> 0 | C166: =OFFSET(INDIRECT(ADDRESS(RC1,3,3,1,Menus!R10C11)),0,Menus!R3C10) -> 0 | D166: =IF(Menus!R9C10,RC[-1]/RC[-2],RC[-1]) -> #DIV/0! | E166: =IF(RC11=1,VALUE(RC[-3]),NA()) -> NA() | F166: =INDIRECT(ADDRESS(RC1,1,3,1,Menus!R10C11)) -> 0 | G166: =IF(INDIRECT(ADDRESS(RC1,2,3,1,Menus!R10C11))=R1C,RC4,NA()) -> NA() | H166: =IF(INDIRECT(ADDRESS(RC1,2,3,1,Menus!R10C11))=R1C,RC4,NA()) -> NA() | I166: =IF(INDIRECT(ADDRESS(RC1,2,3,1,Menus!R10C11))=R1C,RC4,NA()) -> NA() | J166: =IF(INDIRECT(ADDRESS(RC1,1,3,1,Menus!R10C11))=T(R1C),RC4,NA()) -> NA() | K166: =IF(OR(ISNUMBER(RC7),ISNUMBER(RC8),ISNUMBER(RC9),ISNUMBER(RC10)),1,0) -> 0 | M166: =OFFSET(INDIRECT(ADDRESS(RC1,3,3,1,"Gross")),0,Menus!R4C10) -> 0 | N166: =OFFSET(INDIRECT(ADDRESS(RC1,3,3,1,"Gross")),0,Menus!R3C10) -> 0
A167: 204 | B167: =OFFSET(INDIRECT(ADDRESS(RC1,3,3,1,Menus!R10C11)),0,Menus!R4C10) -> 0 | C167: =OFFSET(INDIRECT(ADDRESS(RC1,3,3,1,Menus!R10C11)),0,Menus!R3C10) -> 0 | D167: =IF(Menus!R9C10,RC[-1]/RC[-2],RC[-1]) -> #DIV/0! | E167: =IF(RC11=1,VALUE(RC[-3]),NA()) -> NA() | F167: =INDIRECT(ADDRESS(RC1,1,3,1,Menus!R10C11)) -> 0 | G167: =IF(INDIRECT(ADDRESS(RC1,2,3,1,Menus!R10C11))=R1C,RC4,NA()) -> NA() | H167: =IF(INDIRECT(ADDRESS(RC1,2,3,1,Menus!R10C11))=R1C,RC4,NA()) -> NA() | I167: =IF(INDIRECT(ADDRESS(RC1,2,3,1,Menus!R10C11))=R1C,RC4,NA()) -> NA() | J167: =IF(INDIRECT(ADDRESS(RC1,1,3,1,Menus!R10C11))=T(R1C),RC4,NA()) -> NA() | K167: =IF(OR(ISNUMBER(RC7),ISNUMBER(RC8),ISNUMBER(RC9),ISNUMBER(RC10)),1,0) -> 0 | M167: =OFFSET(INDIRECT(ADDRESS(RC1,3,3,1,"Gross")),0,Menus!R4C10) -> 0 | N167: =OFFSET(INDIRECT(ADDRESS(RC1,3,3,1,"Gross")),0,Menus!R3C10) -> 0
A168: 205 | B168: =OFFSET(INDIRECT(ADDRESS(RC1,3,3,1,Menus!R10C11)),0,Menus!R4C10) -> 0 | C168: =OFFSET(INDIRECT(ADDRESS(RC1,3,3,1,Menus!R10C11)),0,Menus!R3C10) -> 0 | D168: =IF(Menus!R9C10,RC[-1]/RC[-2],RC[-1]) -> #DIV/0! | E168: =IF(RC11=1,VALUE(RC[-3]),NA()) -> NA() | F168: =INDIRECT(ADDRESS(RC1,1,3,1,Menus!R10C11)) -> 0 | G168: =IF(INDIRECT(ADDRESS(RC1,2,3,1,Menus!R10C11))=R1C,RC4,NA()) -> NA() | H168: =IF(INDIRECT(ADDRESS(RC1,2,3,1,Menus!R10C11))=R1C,RC4,NA()) -> NA() | I168: =IF(INDIRECT(ADDRESS(RC1,2,3,1,Menus!R10C11))=R1C,RC4,NA()) -> NA() | J168: =IF(INDIRECT(ADDRESS(RC1,1,3,1,Menus!R10C11))=T(R1C),RC4,NA()) -> NA() | K168: =IF(OR(ISNUMBER(RC7),ISNUMBER(RC8),ISNUMBER(RC9),ISNUMBER(RC10)),1,0) -> 0 | M168: =OFFSET(INDIRECT(ADDRESS(RC1,3,3,1,"Gross")),0,Menus!R4C10) -> 0 | N168: =OFFSET(INDIRECT(ADDRESS(RC1,3,3,1,"Gross")),0,Menus!R3C10) -> 0
A169: 206 | B169: =OFFSET(INDIRECT(ADDRESS(RC1,3,3,1,Menus!R10C11)),0,Menus!R4C10) -> 0 | C169: =OFFSET(INDIRECT(ADDRESS(RC1,3,3,1,Menus!R10C11)),0,Menus!R3C10) -> 0 | D169: =IF(Menus!R9C10,RC[-1]/RC[-2],RC[-1]) -> #DIV/0! | E169: =IF(RC11=1,VALUE(RC[-3]),NA()) -> NA() | F169: =INDIRECT(ADDRESS(RC1,1,3,1,Menus!R10C11)) -> 0 | G169: =IF(INDIRECT(ADDRESS(RC1,2,3,1,Menus!R10C11))=R1C,RC4,NA()) -> NA() | H169: =IF(INDIRECT(ADDRESS(RC1,2,3,1,Menus!R10C11))=R1C,RC4,NA()) -> NA() | I169: =IF(INDIRECT(ADDRESS(RC1,2,3,1,Menus!R10C11))=R1C,RC4,NA()) -> NA() | J169: =IF(INDIRECT(ADDRESS(RC1,1,3,1,Menus!R10C11))=T(R1C),RC4,NA()) -> NA() | K169: =IF(OR(ISNUMBER(RC7),ISNUMBER(RC8),ISNUMBER(RC9),ISNUMBER(RC10)),1,0) -> 0 | M169: =OFFSET(INDIRECT(ADDRESS(RC1,3,3,1,"Gross")),0,Menus!R4C10) -> 0 | N169: =OFFSET(INDIRECT(ADDRESS(RC1,3,3,1,"Gross")),0,Menus!R3C10) -> 0
A170: 207 | B170: =OFFSET(INDIRECT(ADDRESS(RC1,3,3,1,Menus!R10C11)),0,Menus!R4C10) -> 0 | C170: =OFFSET(INDIRECT(ADDRESS(RC1,3,3,1,Menus!R10C11)),0,Menus!R3C10) -> 0 | D170: =IF(Menus!R9C10,RC[-1]/RC[-2],RC[-1]) -> #DIV/0! | E170: =IF(RC11=1,VALUE(RC[-3]),NA()) -> NA() | F170: =INDIRECT(ADDRESS(RC1,1,3,1,Menus!R10C11)) -> 0 | G170: =IF(INDIRECT(ADDRESS(RC1,2,3,1,Menus!R10C11))=R1C,RC4,NA()) -> NA() | H170: =IF(INDIRECT(ADDRESS(RC1,2,3,1,Menus!R10C11))=R1C,RC4,NA()) -> NA() | I170: =IF(INDIRECT(ADDRESS(RC1,2,3,1,Menus!R10C11))=R1C,RC4,NA()) -> NA() | J170: =IF(INDIRECT(ADDRESS(RC1,1,3,1,Menus!R10C11))=T(R1C),RC4,NA()) -> NA() | K170: =IF(OR(ISNUMBER(RC7),ISNUMBER(RC8),ISNUMBER(RC9),ISNUMBER(RC10)),1,0) -> 0 | M170: =OFFSET(INDIRECT(ADDRESS(RC1,3,3,1,"Gross")),0,Menus!R4C10) -> 0 | N170: =OFFSET(INDIRECT(ADDRESS(RC1,3,3,1,"Gross")),0,Menus!R3C10) -> 0
A171: 208 | B171: =OFFSET(INDIRECT(ADDRESS(RC1,3,3,1,Menus!R10C11)),0,Menus!R4C10) -> 0 | C171: =OFFSET(INDIRECT(ADDRESS(RC1,3,3,1,Menus!R10C11)),0,Menus!R3C10) -> 0 | D171: =IF(Menus!R9C10,RC[-1]/RC[-2],RC[-1]) -> #DIV/0! | E171: =IF(RC11=1,VALUE(RC[-3]),NA()) -> NA() | F171: =INDIRECT(ADDRESS(RC1,1,3,1,Menus!R10C11)) -> 0 | G171: =IF(INDIRECT(ADDRESS(RC1,2,3,1,Menus!R10C11))=R1C,RC4,NA()) -> NA() | H171: =IF(INDIRECT(ADDRESS(RC1,2,3,1,Menus!R10C11))=R1C,RC4,NA()) -> NA() | I171: =IF(INDIRECT(ADDRESS(RC1,2,3,1,Menus!R10C11))=R1C,RC4,NA()) -> NA() | J171: =IF(INDIRECT(ADDRESS(RC1,1,3,1,Menus!R10C11))=T(R1C),RC4,NA()) -> NA() | K171: =IF(OR(ISNUMBER(RC7),ISNUMBER(RC8),ISNUMBER(RC9),ISNUMBER(RC10)),1,0) -> 0 | M171: =OFFSET(INDIRECT(ADDRESS(RC1,3,3,1,"Gross")),0,Menus!R4C10) -> 0 | N171: =OFFSET(INDIRECT(ADDRESS(RC1,3,3,1,"Gross")),0,Menus!R3C10) -> 0
A172: 209 | B172: =OFFSET(INDIRECT(ADDRESS(RC1,3,3,1,Menus!R10C11)),0,Menus!R4C10) -> 0 | C172: =OFFSET(INDIRECT(ADDRESS(RC1,3,3,1,Menus!R10C11)),0,Menus!R3C10) -> 0 | D172: =IF(Menus!R9C10,RC[-1]/RC[-2],RC[-1]) -> #DIV/0! | E172: =IF(RC11=1,VALUE(RC[-3]),NA()) -> NA() | F172: =INDIRECT(ADDRESS(RC1,1,3,1,Menus!R10C11)) -> 0 | G172: =IF(INDIRECT(ADDRESS(RC1,2,3,1,Menus!R10C11))=R1C,RC4,NA()) -> NA() | H172: =IF(INDIRECT(ADDRESS(RC1,2,3,1,Menus!R10C11))=R1C,RC4,NA()) -> NA() | I172: =IF(INDIRECT(ADDRESS(RC1,2,3,1,Menus!R10C11))=R1C,RC4,NA()) -> NA() | J172: =IF(INDIRECT(ADDRESS(RC1,1,3,1,Menus!R10C11))=T(R1C),RC4,NA()) -> NA() | K172: =IF(OR(ISNUMBER(RC7),ISNUMBER(RC8),ISNUMBER(RC9),ISNUMBER(RC10)),1,0) -> 0 | M172: =OFFSET(INDIRECT(ADDRESS(RC1,3,3,1,"Gross")),0,Menus!R4C10) -> 0 | N172: =OFFSET(INDIRECT(ADDRESS(RC1,3,3,1,"Gross")),0,Menus!R3C10) -> 0
A173: 210 | B173: =OFFSET(INDIRECT(ADDRESS(RC1,3,3,1,Menus!R10C11)),0,Menus!R4C10) -> 0 | C173: =OFFSET(INDIRECT(ADDRESS(RC1,3,3,1,Menus!R10C11)),0,Menus!R3C10) -> 0 | D173: =IF(Menus!R9C10,RC[-1]/RC[-2],RC[-1]) -> #DIV/0! | E173: =IF(RC11=1,VALUE(RC[-3]),NA()) -> NA() | F173: =INDIRECT(ADDRESS(RC1,1,3,1,Menus!R10C11)) -> 0 | G173: =IF(INDIRECT(ADDRESS(RC1,2,3,1,Menus!R10C11))=R1C,RC4,NA()) -> NA() | H173: =IF(INDIRECT(ADDRESS(RC1,2,3,1,Menus!R10C11))=R1C,RC4,NA()) -> NA() | I173: =IF(INDIRECT(ADDRESS(RC1,2,3,1,Menus!R10C11))=R1C,RC4,NA()) -> NA() | J173: =IF(INDIRECT(ADDRESS(RC1,1,3,1,Menus!R10C11))=T(R1C),RC4,NA()) -> NA() | K173: =IF(OR(ISNUMBER(RC7),ISNUMBER(RC8),ISNUMBER(RC9),ISNUMBER(RC10)),1,0) -> 0 | M173: =OFFSET(INDIRECT(ADDRESS(RC1,3,3,1,"Gross")),0,Menus!R4C10) -> 0 | N173: =OFFSET(INDIRECT(ADDRESS(RC1,3,3,1,"Gross")),0,Menus!R3C10) -> 0
A174: 211 | B174: =OFFSET(INDIRECT(ADDRESS(RC1,3,3,1,Menus!R10C11)),0,Menus!R4C10) -> 0 | C174: =OFFSET(INDIRECT(ADDRESS(RC1,3,3,1,Menus!R10C11)),0,Menus!R3C10) -> 0 | D174: =IF(Menus!R9C10,RC[-1]/RC[-2],RC[-1]) -> #DIV/0! | E174: =IF(RC11=1,VALUE(RC[-3]),NA()) -> NA() | F174: =INDIRECT(ADDRESS(RC1,1,3,1,Menus!R10C11)) -> 0 | G174: =IF(INDIRECT(ADDRESS(RC1,2,3,1,Menus!R10C11))=R1C,RC4,NA()) -> NA() | H174: =IF(INDIRECT(ADDRESS(RC1,2,3,1,Menus!R10C11))=R1C,RC4,NA()) -> NA() | I174: =IF(INDIRECT(ADDRESS(RC1,2,3,1,Menus!R10C11))=R1C,RC4,NA()) -> NA() | J174: =IF(INDIRECT(ADDRESS(RC1,1,3,1,Menus!R10C11))=T(R1C),RC4,NA()) -> NA() | K174: =IF(OR(ISNUMBER(RC7),ISNUMBER(RC8),ISNUMBER(RC9),ISNUMBER(RC10)),1,0) -> 0 | M174: =OFFSET(INDIRECT(ADDRESS(RC1,3,3,1,"Gross")),0,Menus!R4C10) -> 0 | N174: =OFFSET(INDIRECT(ADDRESS(RC1,3,3,1,"Gross")),0,Menus!R3C10) -> 0
A175: 212 | B175: =OFFSET(INDIRECT(ADDRESS(RC1,3,3,1,Menus!R10C11)),0,Menus!R4C10) -> 0 | C175: =OFFSET(INDIRECT(ADDRESS(RC1,3,3,1,Menus!R10C11)),0,Menus!R3C10) -> 0 | D175: =IF(Menus!R9C10,RC[-1]/RC[-2],RC[-1]) -> #DIV/0! | E175: =IF(RC11=1,VALUE(RC[-3]),NA()) -> NA() | F175: =INDIRECT(ADDRESS(RC1,1,3,1,Menus!R10C11)) -> 0 | G175: =IF(INDIRECT(ADDRESS(RC1,2,3,1,Menus!R10C11))=R1C,RC4,NA()) -> NA() | H175: =IF(INDIRECT(ADDRESS(RC1,2,3,1,Menus!R10C11))=R1C,RC4,NA()) -> NA() | I175: =IF(INDIRECT(ADDRESS(RC1,2,3,1,Menus!R10C11))=R1C,RC4,NA()) -> NA() | J175: =IF(INDIRECT(ADDRESS(RC1,1,3,1,Menus!R10C11))=T(R1C),RC4,NA()) -> NA() | K175: =IF(OR(ISNUMBER(RC7),ISNUMBER(RC8),ISNUMBER(RC9),ISNUMBER(RC10)),1,0) -> 0 | M175: =OFFSET(INDIRECT(ADDRESS(RC1,3,3,1,"Gross")),0,Menus!R4C10) -> 0 | N175: =OFFSET(INDIRECT(ADDRESS(RC1,3,3,1,"Gross")),0,Menus!R3C10) -> 0
A176: 213 | B176: =OFFSET(INDIRECT(ADDRESS(RC1,3,3,1,Menus!R10C11)),0,Menus!R4C10) -> 0 | C176: =OFFSET(INDIRECT(ADDRESS(RC1,3,3,1,Menus!R10C11)),0,Menus!R3C10) -> 0 | D176: =IF(Menus!R9C10,RC[-1]/RC[-2],RC[-1]) -> #DIV/0! | E176: =IF(RC11=1,VALUE(RC[-3]),NA()) -> NA() | F176: =INDIRECT(ADDRESS(RC1,1,3,1,Menus!R10C11)) -> 0 | G176: =IF(INDIRECT(ADDRESS(RC1,2,3,1,Menus!R10C11))=R1C,RC4,NA()) -> NA() | H176: =IF(INDIRECT(ADDRESS(RC1,2,3,1,Menus!R10C11))=R1C,RC4,NA()) -> NA() | I176: =IF(INDIRECT(ADDRESS(RC1,2,3,1,Menus!R10C11))=R1C,RC4,NA()) -> NA() | J176: =IF(INDIRECT(ADDRESS(RC1,1,3,1,Menus!R10C11))=T(R1C),RC4,NA()) -> NA() | K176: =IF(OR(ISNUMBER(RC7),ISNUMBER(RC8),ISNUMBER(RC9),ISNUMBER(RC10)),1,0) -> 0 | M176: =OFFSET(INDIRECT(ADDRESS(RC1,3,3,1,"Gross")),0,Menus!R4C10) -> 0 | N176: =OFFSET(INDIRECT(ADDRESS(RC1,3,3,1,"Gross")),0,Menus!R3C10) -> 0
A177: 214 | B177: =OFFSET(INDIRECT(ADDRESS(RC1,3,3,1,Menus!R10C11)),0,Menus!R4C10) -> 0 | C177: =OFFSET(INDIRECT(ADDRESS(RC1,3,3,1,Menus!R10C11)),0,Menus!R3C10) -> 0 | D177: =IF(Menus!R9C10,RC[-1]/RC[-2],RC[-1]) -> #DIV/0! | E177: =IF(RC11=1,VALUE(RC[-3]),NA()) -> NA() | F177: =INDIRECT(ADDRESS(RC1,1,3,1,Menus!R10C11)) -> 0 | G177: =IF(INDIRECT(ADDRESS(RC1,2,3,1,Menus!R10C11))=R1C,RC4,NA()) -> NA() | H177: =IF(INDIRECT(ADDRESS(RC1,2,3,1,Menus!R10C11))=R1C,RC4,NA()) -> NA() | I177: =IF(INDIRECT(ADDRESS(RC1,2,3,1,Menus!R10C11))=R1C,RC4,NA()) -> NA() | J177: =IF(INDIRECT(ADDRESS(RC1,1,3,1,Menus!R10C11))=T(R1C),RC4,NA()) -> NA() | K177: =IF(OR(ISNUMBER(RC7),ISNUMBER(RC8),ISNUMBER(RC9),ISNUMBER(RC10)),1,0) -> 0 | M177: =OFFSET(INDIRECT(ADDRESS(RC1,3,3,1,"Gross")),0,Menus!R4C10) -> 0 | N177: =OFFSET(INDIRECT(ADDRESS(RC1,3,3,1,"Gross")),0,Menus!R3C10) -> 0
A178: 215 | B178: =OFFSET(INDIRECT(ADDRESS(RC1,3,3,1,Menus!R10C11)),0,Menus!R4C10) -> 0 | C178: =OFFSET(INDIRECT(ADDRESS(RC1,3,3,1,Menus!R10C11)),0,Menus!R3C10) -> 0 | D178: =IF(Menus!R9C10,RC[-1]/RC[-2],RC[-1]) -> #DIV/0! | E178: =IF(RC11=1,VALUE(RC[-3]),NA()) -> NA() | F178: =INDIRECT(ADDRESS(RC1,1,3,1,Menus!R10C11)) -> 0 | G178: =IF(INDIRECT(ADDRESS(RC1,2,3,1,Menus!R10C11))=R1C,RC4,NA()) -> NA() | H178: =IF(INDIRECT(ADDRESS(RC1,2,3,1,Menus!R10C11))=R1C,RC4,NA()) -> NA() | I178: =IF(INDIRECT(ADDRESS(RC1,2,3,1,Menus!R10C11))=R1C,RC4,NA()) -> NA() | J178: =IF(INDIRECT(ADDRESS(RC1,1,3,1,Menus!R10C11))=T(R1C),RC4,NA()) -> NA() | K178: =IF(OR(ISNUMBER(RC7),ISNUMBER(RC8),ISNUMBER(RC9),ISNUMBER(RC10)),1,0) -> 0 | M178: =OFFSET(INDIRECT(ADDRESS(RC1,3,3,1,"Gross")),0,Menus!R4C10) -> 0 | N178: =OFFSET(INDIRECT(ADDRESS(RC1,3,3,1,"Gross")),0,Menus!R3C10) -> 0
A179: 216 | B179: =OFFSET(INDIRECT(ADDRESS(RC1,3,3,1,Menus!R10C11)),0,Menus!R4C10) -> 0 | C179: =OFFSET(INDIRECT(ADDRESS(RC1,3,3,1,Menus!R10C11)),0,Menus!R3C10) -> 0 | D179: =IF(Menus!R9C10,RC[-1]/RC[-2],RC[-1]) -> #DIV/0! | E179: =IF(RC11=1,VALUE(RC[-3]),NA()) -> NA() | F179: =INDIRECT(ADDRESS(RC1,1,3,1,Menus!R10C11)) -> 0 | G179: =IF(INDIRECT(ADDRESS(RC1,2,3,1,Menus!R10C11))=R1C,RC4,NA()) -> NA() | H179: =IF(INDIRECT(ADDRESS(RC1,2,3,1,Menus!R10C11))=R1C,RC4,NA()) -> NA() | I179: =IF(INDIRECT(ADDRESS(RC1,2,3,1,Menus!R10C11))=R1C,RC4,NA()) -> NA() | J179: =IF(INDIRECT(ADDRESS(RC1,1,3,1,Menus!R10C11))=T(R1C),RC4,NA()) -> NA() | K179: =IF(OR(ISNUMBER(RC7),ISNUMBER(RC8),ISNUMBER(RC9),ISNUMBER(RC10)),1,0) -> 0 | M179: =OFFSET(INDIRECT(ADDRESS(RC1,3,3,1,"Gross")),0,Menus!R4C10) -> 0 | N179: =OFFSET(INDIRECT(ADDRESS(RC1,3,3,1,"Gross")),0,Menus!R3C10) -> 0
A180: 217 | B180: =OFFSET(INDIRECT(ADDRESS(RC1,3,3,1,Menus!R10C11)),0,Menus!R4C10) -> 0 | C180: =OFFSET(INDIRECT(ADDRESS(RC1,3,3,1,Menus!R10C11)),0,Menus!R3C10) -> 0 | D180: =IF(Menus!R9C10,RC[-1]/RC[-2],RC[-1]) -> #DIV/0! | E180: =IF(RC11=1,VALUE(RC[-3]),NA()) -> NA() | F180: =INDIRECT(ADDRESS(RC1,1,3,1,Menus!R10C11)) -> 0 | G180: =IF(INDIRECT(ADDRESS(RC1,2,3,1,Menus!R10C11))=R1C,RC4,NA()) -> NA() | H180: =IF(INDIRECT(ADDRESS(RC1,2,3,1,Menus!R10C11))=R1C,RC4,NA()) -> NA() | I180: =IF(INDIRECT(ADDRESS(RC1,2,3,1,Menus!R10C11))=R1C,RC4,NA()) -> NA() | J180: =IF(INDIRECT(ADDRESS(RC1,1,3,1,Menus!R10C11))=T(R1C),RC4,NA()) -> NA() | K180: =IF(OR(ISNUMBER(RC7),ISNUMBER(RC8),ISNUMBER(RC9),ISNUMBER(RC10)),1,0) -> 0 | M180: =OFFSET(INDIRECT(ADDRESS(RC1,3,3,1,"Gross")),0,Menus!R4C10) -> 0 | N180: =OFFSET(INDIRECT(ADDRESS(RC1,3,3,1,"Gross")),0,Menus!R3C10) -> 0
A181: 218 | B181: =OFFSET(INDIRECT(ADDRESS(RC1,3,3,1,Menus!R10C11)),0,Menus!R4C10) -> 0 | C181: =OFFSET(INDIRECT(ADDRESS(RC1,3,3,1,Menus!R10C11)),0,Menus!R3C10) -> 0 | D181: =IF(Menus!R9C10,RC[-1]/RC[-2],RC[-1]) -> #DIV/0! | E181: =IF(RC11=1,VALUE(RC[-3]),NA()) -> NA() | F181: =INDIRECT(ADDRESS(RC1,1,3,1,Menus!R10C11)) -> 0 | G181: =IF(INDIRECT(ADDRESS(RC1,2,3,1,Menus!R10C11))=R1C,RC4,NA()) -> NA() | H181: =IF(INDIRECT(ADDRESS(RC1,2,3,1,Menus!R10C11))=R1C,RC4,NA()) -> NA() | I181: =IF(INDIRECT(ADDRESS(RC1,2,3,1,Menus!R10C11))=R1C,RC4,NA()) -> NA() | J181: =IF(INDIRECT(ADDRESS(RC1,1,3,1,Menus!R10C11))=T(R1C),RC4,NA()) -> NA() | K181: =IF(OR(ISNUMBER(RC7),ISNUMBER(RC8),ISNUMBER(RC9),ISNUMBER(RC10)),1,0) -> 0 | M181: =OFFSET(INDIRECT(ADDRESS(RC1,3,3,1,"Gross")),0,Menus!R4C10) -> 0 | N181: =OFFSET(INDIRECT(ADDRESS(RC1,3,3,1,"Gross")),0,Menus!R3C10) -> 0
A182: 219 | B182: =OFFSET(INDIRECT(ADDRESS(RC1,3,3,1,Menus!R10C11)),0,Menus!R4C10) -> 0 | C182: =OFFSET(INDIRECT(ADDRESS(RC1,3,3,1,Menus!R10C11)),0,Menus!R3C10) -> 0 | D182: =IF(Menus!R9C10,RC[-1]/RC[-2],RC[-1]) -> #DIV/0! | E182: =IF(RC11=1,VALUE(RC[-3]),NA()) -> NA() | F182: =INDIRECT(ADDRESS(RC1,1,3,1,Menus!R10C11)) -> 0 | G182: =IF(INDIRECT(ADDRESS(RC1,2,3,1,Menus!R10C11))=R1C,RC4,NA()) -> NA() | H182: =IF(INDIRECT(ADDRESS(RC1,2,3,1,Menus!R10C11))=R1C,RC4,NA()) -> NA() | I182: =IF(INDIRECT(ADDRESS(RC1,2,3,1,Menus!R10C11))=R1C,RC4,NA()) -> NA() | J182: =IF(INDIRECT(ADDRESS(RC1,1,3,1,Menus!R10C11))=T(R1C),RC4,NA()) -> NA() | K182: =IF(OR(ISNUMBER(RC7),ISNUMBER(RC8),ISNUMBER(RC9),ISNUMBER(RC10)),1,0) -> 0 | M182: =OFFSET(INDIRECT(ADDRESS(RC1,3,3,1,"Gross")),0,Menus!R4C10) -> 0 | N182: =OFFSET(INDIRECT(ADDRESS(RC1,3,3,1,"Gross")),0,Menus!R3C10) -> 0
A183: 220 | B183: =OFFSET(INDIRECT(ADDRESS(RC1,3,3,1,Menus!R10C11)),0,Menus!R4C10) -> 0 | C183: =OFFSET(INDIRECT(ADDRESS(RC1,3,3,1,Menus!R10C11)),0,Menus!R3C10) -> 0 | D183: =IF(Menus!R9C10,RC[-1]/RC[-2],RC[-1]) -> #DIV/0! | E183: =IF(RC11=1,VALUE(RC[-3]),NA()) -> NA() | F183: =INDIRECT(ADDRESS(RC1,1,3,1,Menus!R10C11)) -> 0 | G183: =IF(INDIRECT(ADDRESS(RC1,2,3,1,Menus!R10C11))=R1C,RC4,NA()) -> NA() | H183: =IF(INDIRECT(ADDRESS(RC1,2,3,1,Menus!R10C11))=R1C,RC4,NA()) -> NA() | I183: =IF(INDIRECT(ADDRESS(RC1,2,3,1,Menus!R10C11))=R1C,RC4,NA()) -> NA() | J183: =IF(INDIRECT(ADDRESS(RC1,1,3,1,Menus!R10C11))=T(R1C),RC4,NA()) -> NA() | K183: =IF(OR(ISNUMBER(RC7),ISNUMBER(RC8),ISNUMBER(RC9),ISNUMBER(RC10)),1,0) -> 0 | M183: =OFFSET(INDIRECT(ADDRESS(RC1,3,3,1,"Gross")),0,Menus!R4C10) -> 0 | N183: =OFFSET(INDIRECT(ADDRESS(RC1,3,3,1,"Gross")),0,Menus!R3C10) -> 0
A184: 221 | B184: =OFFSET(INDIRECT(ADDRESS(RC1,3,3,1,Menus!R10C11)),0,Menus!R4C10) -> 0 | C184: =OFFSET(INDIRECT(ADDRESS(RC1,3,3,1,Menus!R10C11)),0,Menus!R3C10) -> 0 | D184: =IF(Menus!R9C10,RC[-1]/RC[-2],RC[-1]) -> #DIV/0! | E184: =IF(RC11=1,VALUE(RC[-3]),NA()) -> NA() | F184: =INDIRECT(ADDRESS(RC1,1,3,1,Menus!R10C11)) -> 0 | G184: =IF(INDIRECT(ADDRESS(RC1,2,3,1,Menus!R10C11))=R1C,RC4,NA()) -> NA() | H184: =IF(INDIRECT(ADDRESS(RC1,2,3,1,Menus!R10C11))=R1C,RC4,NA()) -> NA() | I184: =IF(INDIRECT(ADDRESS(RC1,2,3,1,Menus!R10C11))=R1C,RC4,NA()) -> NA() | J184: =IF(INDIRECT(ADDRESS(RC1,1,3,1,Menus!R10C11))=T(R1C),RC4,NA()) -> NA() | K184: =IF(OR(ISNUMBER(RC7),ISNUMBER(RC8),ISNUMBER(RC9),ISNUMBER(RC10)),1,0) -> 0 | M184: =OFFSET(INDIRECT(ADDRESS(RC1,3,3,1,"Gross")),0,Menus!R4C10) -> 0 | N184: =OFFSET(INDIRECT(ADDRESS(RC1,3,3,1,"Gross")),0,Menus!R3C10) -> 0
A185: 222 | B185: =OFFSET(INDIRECT(ADDRESS(RC1,3,3,1,Menus!R10C11)),0,Menus!R4C10) -> 0 | C185: =OFFSET(INDIRECT(ADDRESS(RC1,3,3,1,Menus!R10C11)),0,Menus!R3C10) -> 0 | D185: =IF(Menus!R9C10,RC[-1]/RC[-2],RC[-1]) -> #DIV/0! | E185: =IF(RC11=1,VALUE(RC[-3]),NA()) -> NA() | F185: =INDIRECT(ADDRESS(RC1,1,3,1,Menus!R10C11)) -> 0 | G185: =IF(INDIRECT(ADDRESS(RC1,2,3,1,Menus!R10C11))=R1C,RC4,NA()) -> NA() | H185: =IF(INDIRECT(ADDRESS(RC1,2,3,1,Menus!R10C11))=R1C,RC4,NA()) -> NA() | I185: =IF(INDIRECT(ADDRESS(RC1,2,3,1,Menus!R10C11))=R1C,RC4,NA()) -> NA() | J185: =IF(INDIRECT(ADDRESS(RC1,1,3,1,Menus!R10C11))=T(R1C),RC4,NA()) -> NA() | K185: =IF(OR(ISNUMBER(RC7),ISNUMBER(RC8),ISNUMBER(RC9),ISNUMBER(RC10)),1,0) -> 0 | M185: =OFFSET(INDIRECT(ADDRESS(RC1,3,3,1,"Gross")),0,Menus!R4C10) -> 0 | N185: =OFFSET(INDIRECT(ADDRESS(RC1,3,3,1,"Gross")),0,Menus!R3C10) -> 0
A186: 223 | B186: =OFFSET(INDIRECT(ADDRESS(RC1,3,3,1,Menus!R10C11)),0,Menus!R4C10) -> 0 | C186: =OFFSET(INDIRECT(ADDRESS(RC1,3,3,1,Menus!R10C11)),0,Menus!R3C10) -> 0 | D186: =IF(Menus!R9C10,RC[-1]/RC[-2],RC[-1]) -> #DIV/0! | E186: =IF(RC11=1,VALUE(RC[-3]),NA()) -> NA() | F186: =INDIRECT(ADDRESS(RC1,1,3,1,Menus!R10C11)) -> 0 | G186: =IF(INDIRECT(ADDRESS(RC1,2,3,1,Menus!R10C11))=R1C,RC4,NA()) -> NA() | H186: =IF(INDIRECT(ADDRESS(RC1,2,3,1,Menus!R10C11))=R1C,RC4,NA()) -> NA() | I186: =IF(INDIRECT(ADDRESS(RC1,2,3,1,Menus!R10C11))=R1C,RC4,NA()) -> NA() | J186: =IF(INDIRECT(ADDRESS(RC1,1,3,1,Menus!R10C11))=T(R1C),RC4,NA()) -> NA() | K186: =IF(OR(ISNUMBER(RC7),ISNUMBER(RC8),ISNUMBER(RC9),ISNUMBER(RC10)),1,0) -> 0 | M186: =OFFSET(INDIRECT(ADDRESS(RC1,3,3,1,"Gross")),0,Menus!R4C10) -> 0 | N186: =OFFSET(INDIRECT(ADDRESS(RC1,3,3,1,"Gross")),0,Menus!R3C10) -> 0
A187: 224 | B187: =OFFSET(INDIRECT(ADDRESS(RC1,3,3,1,Menus!R10C11)),0,Menus!R4C10) -> 0 | C187: =OFFSET(INDIRECT(ADDRESS(RC1,3,3,1,Menus!R10C11)),0,Menus!R3C10) -> 0 | D187: =IF(Menus!R9C10,RC[-1]/RC[-2],RC[-1]) -> #DIV/0! | E187: =IF(RC11=1,VALUE(RC[-3]),NA()) -> NA() | F187: =INDIRECT(ADDRESS(RC1,1,3,1,Menus!R10C11)) -> 0 | G187: =IF(INDIRECT(ADDRESS(RC1,2,3,1,Menus!R10C11))=R1C,RC4,NA()) -> NA() | H187: =IF(INDIRECT(ADDRESS(RC1,2,3,1,Menus!R10C11))=R1C,RC4,NA()) -> NA() | I187: =IF(INDIRECT(ADDRESS(RC1,2,3,1,Menus!R10C11))=R1C,RC4,NA()) -> NA() | J187: =IF(INDIRECT(ADDRESS(RC1,1,3,1,Menus!R10C11))=T(R1C),RC4,NA()) -> NA() | K187: =IF(OR(ISNUMBER(RC7),ISNUMBER(RC8),ISNUMBER(RC9),ISNUMBER(RC10)),1,0) -> 0 | M187: =OFFSET(INDIRECT(ADDRESS(RC1,3,3,1,"Gross")),0,Menus!R4C10) -> 0 | N187: =OFFSET(INDIRECT(ADDRESS(RC1,3,3,1,"Gross")),0,Menus!R3C10) -> 0
A188: 225 | B188: =OFFSET(INDIRECT(ADDRESS(RC1,3,3,1,Menus!R10C11)),0,Menus!R4C10) -> 0 | C188: =OFFSET(INDIRECT(ADDRESS(RC1,3,3,1,Menus!R10C11)),0,Menus!R3C10) -> 0 | D188: =IF(Menus!R9C10,RC[-1]/RC[-2],RC[-1]) -> #DIV/0! | E188: =IF(RC11=1,VALUE(RC[-3]),NA()) -> NA() | F188: =INDIRECT(ADDRESS(RC1,1,3,1,Menus!R10C11)) -> 0 | G188: =IF(INDIRECT(ADDRESS(RC1,2,3,1,Menus!R10C11))=R1C,RC4,NA()) -> NA() | H188: =IF(INDIRECT(ADDRESS(RC1,2,3,1,Menus!R10C11))=R1C,RC4,NA()) -> NA() | I188: =IF(INDIRECT(ADDRESS(RC1,2,3,1,Menus!R10C11))=R1C,RC4,NA()) -> NA() | J188: =IF(INDIRECT(ADDRESS(RC1,1,3,1,Menus!R10C11))=T(R1C),RC4,NA()) -> NA() | K188: =IF(OR(ISNUMBER(RC7),ISNUMBER(RC8),ISNUMBER(RC9),ISNUMBER(RC10)),1,0) -> 0 | M188: =OFFSET(INDIRECT(ADDRESS(RC1,3,3,1,"Gross")),0,Menus!R4C10) -> 0 | N188: =OFFSET(INDIRECT(ADDRESS(RC1,3,3,1,"Gross")),0,Menus!R3C10) -> 0
A189: 226 | B189: =OFFSET(INDIRECT(ADDRESS(RC1,3,3,1,Menus!R10C11)),0,Menus!R4C10) -> 0 | C189: =OFFSET(INDIRECT(ADDRESS(RC1,3,3,1,Menus!R10C11)),0,Menus!R3C10) -> 0 | D189: =IF(Menus!R9C10,RC[-1]/RC[-2],RC[-1]) -> #DIV/0! | E189: =IF(RC11=1,VALUE(RC[-3]),NA()) -> NA() | F189: =INDIRECT(ADDRESS(RC1,1,3,1,Menus!R10C11)) -> 0 | G189: =IF(INDIRECT(ADDRESS(RC1,2,3,1,Menus!R10C11))=R1C,RC4,NA()) -> NA() | H189: =IF(INDIRECT(ADDRESS(RC1,2,3,1,Menus!R10C11))=R1C,RC4,NA()) -> NA() | I189: =IF(INDIRECT(ADDRESS(RC1,2,3,1,Menus!R10C11))=R1C,RC4,NA()) -> NA() | J189: =IF(INDIRECT(ADDRESS(RC1,1,3,1,Menus!R10C11))=T(R1C),RC4,NA()) -> NA() | K189: =IF(OR(ISNUMBER(RC7),ISNUMBER(RC8),ISNUMBER(RC9),ISNUMBER(RC10)),1,0) -> 0 | M189: =OFFSET(INDIRECT(ADDRESS(RC1,3,3,1,"Gross")),0,Menus!R4C10) -> 0 | N189: =OFFSET(INDIRECT(ADDRESS(RC1,3,3,1,"Gross")),0,Menus!R3C10) -> 0
A190: 227 | B190: =OFFSET(INDIRECT(ADDRESS(RC1,3,3,1,Menus!R10C11)),0,Menus!R4C10) -> 0 | C190: =OFFSET(INDIRECT(ADDRESS(RC1,3,3,1,Menus!R10C11)),0,Menus!R3C10) -> 0 | D190: =IF(Menus!R9C10,RC[-1]/RC[-2],RC[-1]) -> #DIV/0! | E190: =IF(RC11=1,VALUE(RC[-3]),NA()) -> NA() | F190: =INDIRECT(ADDRESS(RC1,1,3,1,Menus!R10C11)) -> 0 | G190: =IF(INDIRECT(ADDRESS(RC1,2,3,1,Menus!R10C11))=R1C,RC4,NA()) -> NA() | H190: =IF(INDIRECT(ADDRESS(RC1,2,3,1,Menus!R10C11))=R1C,RC4,NA()) -> NA() | I190: =IF(INDIRECT(ADDRESS(RC1,2,3,1,Menus!R10C11))=R1C,RC4,NA()) -> NA() | J190: =IF(INDIRECT(ADDRESS(RC1,1,3,1,Menus!R10C11))=T(R1C),RC4,NA()) -> NA() | K190: =IF(OR(ISNUMBER(RC7),ISNUMBER(RC8),ISNUMBER(RC9),ISNUMBER(RC10)),1,0) -> 0 | M190: =OFFSET(INDIRECT(ADDRESS(RC1,3,3,1,"Gross")),0,Menus!R4C10) -> 0 | N190: =OFFSET(INDIRECT(ADDRESS(RC1,3,3,1,"Gross")),0,Menus!R3C10) -> 0
A191: 228 | B191: =OFFSET(INDIRECT(ADDRESS(RC1,3,3,1,Menus!R10C11)),0,Menus!R4C10) -> 0 | C191: =OFFSET(INDIRECT(ADDRESS(RC1,3,3,1,Menus!R10C11)),0,Menus!R3C10) -> 0 | D191: =IF(Menus!R9C10,RC[-1]/RC[-2],RC[-1]) -> #DIV/0! | E191: =IF(RC11=1,VALUE(RC[-3]),NA()) -> NA() | F191: =INDIRECT(ADDRESS(RC1,1,3,1,Menus!R10C11)) -> 0 | G191: =IF(INDIRECT(ADDRESS(RC1,2,3,1,Menus!R10C11))=R1C,RC4,NA()) -> NA() | H191: =IF(INDIRECT(ADDRESS(RC1,2,3,1,Menus!R10C11))=R1C,RC4,NA()) -> NA() | I191: =IF(INDIRECT(ADDRESS(RC1,2,3,1,Menus!R10C11))=R1C,RC4,NA()) -> NA() | J191: =IF(INDIRECT(ADDRESS(RC1,1,3,1,Menus!R10C11))=T(R1C),RC4,NA()) -> NA() | K191: =IF(OR(ISNUMBER(RC7),ISNUMBER(RC8),ISNUMBER(RC9),ISNUMBER(RC10)),1,0) -> 0 | M191: =OFFSET(INDIRECT(ADDRESS(RC1,3,3,1,"Gross")),0,Menus!R4C10) -> 0 | N191: =OFFSET(INDIRECT(ADDRESS(RC1,3,3,1,"Gross")),0,Menus!R3C10) -> 0
A192: 229 | B192: =OFFSET(INDIRECT(ADDRESS(RC1,3,3,1,Menus!R10C11)),0,Menus!R4C10) -> 0 | C192: =OFFSET(INDIRECT(ADDRESS(RC1,3,3,1,Menus!R10C11)),0,Menus!R3C10) -> 0 | D192: =IF(Menus!R9C10,RC[-1]/RC[-2],RC[-1]) -> #DIV/0! | E192: =IF(RC11=1,VALUE(RC[-3]),NA()) -> NA() | F192: =INDIRECT(ADDRESS(RC1,1,3,1,Menus!R10C11)) -> 0 | G192: =IF(INDIRECT(ADDRESS(RC1,2,3,1,Menus!R10C11))=R1C,RC4,NA()) -> NA() | H192: =IF(INDIRECT(ADDRESS(RC1,2,3,1,Menus!R10C11))=R1C,RC4,NA()) -> NA() | I192: =IF(INDIRECT(ADDRESS(RC1,2,3,1,Menus!R10C11))=R1C,RC4,NA()) -> NA() | J192: =IF(INDIRECT(ADDRESS(RC1,1,3,1,Menus!R10C11))=T(R1C),RC4,NA()) -> NA() | K192: =IF(OR(ISNUMBER(RC7),ISNUMBER(RC8),ISNUMBER(RC9),ISNUMBER(RC10)),1,0) -> 0 | M192: =OFFSET(INDIRECT(ADDRESS(RC1,3,3,1,"Gross")),0,Menus!R4C10) -> 0 | N192: =OFFSET(INDIRECT(ADDRESS(RC1,3,3,1,"Gross")),0,Menus!R3C10) -> 0
A193: 230 | B193: =OFFSET(INDIRECT(ADDRESS(RC1,3,3,1,Menus!R10C11)),0,Menus!R4C10) -> 0 | C193: =OFFSET(INDIRECT(ADDRESS(RC1,3,3,1,Menus!R10C11)),0,Menus!R3C10) -> 0 | D193: =IF(Menus!R9C10,RC[-1]/RC[-2],RC[-1]) -> #DIV/0! | E193: =IF(RC11=1,VALUE(RC[-3]),NA()) -> NA() | F193: =INDIRECT(ADDRESS(RC1,1,3,1,Menus!R10C11)) -> 0 | G193: =IF(INDIRECT(ADDRESS(RC1,2,3,1,Menus!R10C11))=R1C,RC4,NA()) -> NA() | H193: =IF(INDIRECT(ADDRESS(RC1,2,3,1,Menus!R10C11))=R1C,RC4,NA()) -> NA() | I193: =IF(INDIRECT(ADDRESS(RC1,2,3,1,Menus!R10C11))=R1C,RC4,NA()) -> NA() | J193: =IF(INDIRECT(ADDRESS(RC1,1,3,1,Menus!R10C11))=T(R1C),RC4,NA()) -> NA() | K193: =IF(OR(ISNUMBER(RC7),ISNUMBER(RC8),ISNUMBER(RC9),ISNUMBER(RC10)),1,0) -> 0 | M193: =OFFSET(INDIRECT(ADDRESS(RC1,3,3,1,"Gross")),0,Menus!R4C10) -> 0 | N193: =OFFSET(INDIRECT(ADDRESS(RC1,3,3,1,"Gross")),0,Menus!R3C10) -> 0
A194: 231 | B194: =OFFSET(INDIRECT(ADDRESS(RC1,3,3,1,Menus!R10C11)),0,Menus!R4C10) -> 0 | C194: =OFFSET(INDIRECT(ADDRESS(RC1,3,3,1,Menus!R10C11)),0,Menus!R3C10) -> 0 | D194: =IF(Menus!R9C10,RC[-1]/RC[-2],RC[-1]) -> #DIV/0! | E194: =IF(RC11=1,VALUE(RC[-3]),NA()) -> NA() | F194: =INDIRECT(ADDRESS(RC1,1,3,1,Menus!R10C11)) -> 0 | G194: =IF(INDIRECT(ADDRESS(RC1,2,3,1,Menus!R10C11))=R1C,RC4,NA()) -> NA() | H194: =IF(INDIRECT(ADDRESS(RC1,2,3,1,Menus!R10C11))=R1C,RC4,NA()) -> NA() | I194: =IF(INDIRECT(ADDRESS(RC1,2,3,1,Menus!R10C11))=R1C,RC4,NA()) -> NA() | J194: =IF(INDIRECT(ADDRESS(RC1,1,3,1,Menus!R10C11))=T(R1C),RC4,NA()) -> NA() | K194: =IF(OR(ISNUMBER(RC7),ISNUMBER(RC8),ISNUMBER(RC9),ISNUMBER(RC10)),1,0) -> 0 | M194: =OFFSET(INDIRECT(ADDRESS(RC1,3,3,1,"Gross")),0,Menus!R4C10) -> 0 | N194: =OFFSET(INDIRECT(ADDRESS(RC1,3,3,1,"Gross")),0,Menus!R3C10) -> 0
A195: 232 | B195: =OFFSET(INDIRECT(ADDRESS(RC1,3,3,1,Menus!R10C11)),0,Menus!R4C10) -> 0 | C195: =OFFSET(INDIRECT(ADDRESS(RC1,3,3,1,Menus!R10C11)),0,Menus!R3C10) -> 0 | D195: =IF(Menus!R9C10,RC[-1]/RC[-2],RC[-1]) -> #DIV/0! | E195: =IF(RC11=1,VALUE(RC[-3]),NA()) -> NA() | F195: =INDIRECT(ADDRESS(RC1,1,3,1,Menus!R10C11)) -> 0 | G195: =IF(INDIRECT(ADDRESS(RC1,2,3,1,Menus!R10C11))=R1C,RC4,NA()) -> NA() | H195: =IF(INDIRECT(ADDRESS(RC1,2,3,1,Menus!R10C11))=R1C,RC4,NA()) -> NA() | I195: =IF(INDIRECT(ADDRESS(RC1,2,3,1,Menus!R10C11))=R1C,RC4,NA()) -> NA() | J195: =IF(INDIRECT(ADDRESS(RC1,1,3,1,Menus!R10C11))=T(R1C),RC4,NA()) -> NA() | K195: =IF(OR(ISNUMBER(RC7),ISNUMBER(RC8),ISNUMBER(RC9),ISNUMBER(RC10)),1,0) -> 0 | M195: =OFFSET(INDIRECT(ADDRESS(RC1,3,3,1,"Gross")),0,Menus!R4C10) -> 0 | N195: =OFFSET(INDIRECT(ADDRESS(RC1,3,3,1,"Gross")),0,Menus!R3C10) -> 0
A196: 233 | B196: =OFFSET(INDIRECT(ADDRESS(RC1,3,3,1,Menus!R10C11)),0,Menus!R4C10) -> 0 | C196: =OFFSET(INDIRECT(ADDRESS(RC1,3,3,1,Menus!R10C11)),0,Menus!R3C10) -> 0 | D196: =IF(Menus!R9C10,RC[-1]/RC[-2],RC[-1]) -> #DIV/0! | E196: =IF(RC11=1,VALUE(RC[-3]),NA()) -> NA() | F196: =INDIRECT(ADDRESS(RC1,1,3,1,Menus!R10C11)) -> 0 | G196: =IF(INDIRECT(ADDRESS(RC1,2,3,1,Menus!R10C11))=R1C,RC4,NA()) -> NA() | H196: =IF(INDIRECT(ADDRESS(RC1,2,3,1,Menus!R10C11))=R1C,RC4,NA()) -> NA() | I196: =IF(INDIRECT(ADDRESS(RC1,2,3,1,Menus!R10C11))=R1C,RC4,NA()) -> NA() | J196: =IF(INDIRECT(ADDRESS(RC1,1,3,1,Menus!R10C11))=T(R1C),RC4,NA()) -> NA() | K196: =IF(OR(ISNUMBER(RC7),ISNUMBER(RC8),ISNUMBER(RC9),ISNUMBER(RC10)),1,0) -> 0 | M196: =OFFSET(INDIRECT(ADDRESS(RC1,3,3,1,"Gross")),0,Menus!R4C10) -> 0 | N196: =OFFSET(INDIRECT(ADDRESS(RC1,3,3,1,"Gross")),0,Menus!R3C10) -> 0
A197: 234 | B197: =OFFSET(INDIRECT(ADDRESS(RC1,3,3,1,Menus!R10C11)),0,Menus!R4C10) -> 0 | C197: =OFFSET(INDIRECT(ADDRESS(RC1,3,3,1,Menus!R10C11)),0,Menus!R3C10) -> 0 | D197: =IF(Menus!R9C10,RC[-1]/RC[-2],RC[-1]) -> #DIV/0! | E197: =IF(RC11=1,VALUE(RC[-3]),NA()) -> NA() | F197: =INDIRECT(ADDRESS(RC1,1,3,1,Menus!R10C11)) -> 0 | G197: =IF(INDIRECT(ADDRESS(RC1,2,3,1,Menus!R10C11))=R1C,RC4,NA()) -> NA() | H197: =IF(INDIRECT(ADDRESS(RC1,2,3,1,Menus!R10C11))=R1C,RC4,NA()) -> NA() | I197: =IF(INDIRECT(ADDRESS(RC1,2,3,1,Menus!R10C11))=R1C,RC4,NA()) -> NA() | J197: =IF(INDIRECT(ADDRESS(RC1,1,3,1,Menus!R10C11))=T(R1C),RC4,NA()) -> NA() | K197: =IF(OR(ISNUMBER(RC7),ISNUMBER(RC8),ISNUMBER(RC9),ISNUMBER(RC10)),1,0) -> 0 | M197: =OFFSET(INDIRECT(ADDRESS(RC1,3,3,1,"Gross")),0,Menus!R4C10) -> 0 | N197: =OFFSET(INDIRECT(ADDRESS(RC1,3,3,1,"Gross")),0,Menus!R3C10) -> 0
A198: 235 | B198: =OFFSET(INDIRECT(ADDRESS(RC1,3,3,1,Menus!R10C11)),0,Menus!R4C10) -> 0 | C198: =OFFSET(INDIRECT(ADDRESS(RC1,3,3,1,Menus!R10C11)),0,Menus!R3C10) -> 0 | D198: =IF(Menus!R9C10,RC[-1]/RC[-2],RC[-1]) -> #DIV/0! | E198: =IF(RC11=1,VALUE(RC[-3]),NA()) -> NA() | F198: =INDIRECT(ADDRESS(RC1,1,3,1,Menus!R10C11)) -> 0 | G198: =IF(INDIRECT(ADDRESS(RC1,2,3,1,Menus!R10C11))=R1C,RC4,NA()) -> NA() | H198: =IF(INDIRECT(ADDRESS(RC1,2,3,1,Menus!R10C11))=R1C,RC4,NA()) -> NA() | I198: =IF(INDIRECT(ADDRESS(RC1,2,3,1,Menus!R10C11))=R1C,RC4,NA()) -> NA() | J198: =IF(INDIRECT(ADDRESS(RC1,1,3,1,Menus!R10C11))=T(R1C),RC4,NA()) -> NA() | K198: =IF(OR(ISNUMBER(RC7),ISNUMBER(RC8),ISNUMBER(RC9),ISNUMBER(RC10)),1,0) -> 0 | M198: =OFFSET(INDIRECT(ADDRESS(RC1,3,3,1,"Gross")),0,Menus!R4C10) -> 0 | N198: =OFFSET(INDIRECT(ADDRESS(RC1,3,3,1,"Gross")),0,Menus!R3C10) -> 0
A199: 236 | B199: =OFFSET(INDIRECT(ADDRESS(RC1,3,3,1,Menus!R10C11)),0,Menus!R4C10) -> 0 | C199: =OFFSET(INDIRECT(ADDRESS(RC1,3,3,1,Menus!R10C11)),0,Menus!R3C10) -> 0 | D199: =IF(Menus!R9C10,RC[-1]/RC[-2],RC[-1]) -> #DIV/0! | E199: =IF(RC11=1,VALUE(RC[-3]),NA()) -> NA() | F199: =INDIRECT(ADDRESS(RC1,1,3,1,Menus!R10C11)) -> 0 | G199: =IF(INDIRECT(ADDRESS(RC1,2,3,1,Menus!R10C11))=R1C,RC4,NA()) -> NA() | H199: =IF(INDIRECT(ADDRESS(RC1,2,3,1,Menus!R10C11))=R1C,RC4,NA()) -> NA() | I199: =IF(INDIRECT(ADDRESS(RC1,2,3,1,Menus!R10C11))=R1C,RC4,NA()) -> NA() | J199: =IF(INDIRECT(ADDRESS(RC1,1,3,1,Menus!R10C11))=T(R1C),RC4,NA()) -> NA() | K199: =IF(OR(ISNUMBER(RC7),ISNUMBER(RC8),ISNUMBER(RC9),ISNUMBER(RC10)),1,0) -> 0 | M199: =OFFSET(INDIRECT(ADDRESS(RC1,3,3,1,"Gross")),0,Menus!R4C10) -> 0 | N199: =OFFSET(INDIRECT(ADDRESS(RC1,3,3,1,"Gross")),0,Menus!R3C10) -> 0
A200: 237 | B200: =OFFSET(INDIRECT(ADDRESS(RC1,3,3,1,Menus!R10C11)),0,Menus!R4C10) -> 0 | C200: =OFFSET(INDIRECT(ADDRESS(RC1,3,3,1,Menus!R10C11)),0,Menus!R3C10) -> 0 | D200: =IF(Menus!R9C10,RC[-1]/RC[-2],RC[-1]) -> #DIV/0! | E200: =IF(RC11=1,VALUE(RC[-3]),NA()) -> NA() | F200: =INDIRECT(ADDRESS(RC1,1,3,1,Menus!R10C11)) -> 0 | G200: =IF(INDIRECT(ADDRESS(RC1,2,3,1,Menus!R10C11))=R1C,RC4,NA()) -> NA() | H200: =IF(INDIRECT(ADDRESS(RC1,2,3,1,Menus!R10C11))=R1C,RC4,NA()) -> NA() | I200: =IF(INDIRECT(ADDRESS(RC1,2,3,1,Menus!R10C11))=R1C,RC4,NA()) -> NA() | J200: =IF(INDIRECT(ADDRESS(RC1,1,3,1,Menus!R10C11))=T(R1C),RC4,NA()) -> NA() | K200: =IF(OR(ISNUMBER(RC7),ISNUMBER(RC8),ISNUMBER(RC9),ISNUMBER(RC10)),1,0) -> 0 | M200: =OFFSET(INDIRECT(ADDRESS(RC1,3,3,1,"Gross")),0,Menus!R4C10) -> 0 | N200: =OFFSET(INDIRECT(ADDRESS(RC1,3,3,1,"Gross")),0,Menus!R3C10) -> 0
A201: 238 | B201: =OFFSET(INDIRECT(ADDRESS(RC1,3,3,1,Menus!R10C11)),0,Menus!R4C10) -> 0 | C201: =OFFSET(INDIRECT(ADDRESS(RC1,3,3,1,Menus!R10C11)),0,Menus!R3C10) -> 0 | D201: =IF(Menus!R9C10,RC[-1]/RC[-2],RC[-1]) -> #DIV/0! | E201: =IF(RC11=1,VALUE(RC[-3]),NA()) -> NA() | F201: =INDIRECT(ADDRESS(RC1,1,3,1,Menus!R10C11)) -> 0 | G201: =IF(INDIRECT(ADDRESS(RC1,2,3,1,Menus!R10C11))=R1C,RC4,NA()) -> NA() | H201: =IF(INDIRECT(ADDRESS(RC1,2,3,1,Menus!R10C11))=R1C,RC4,NA()) -> NA() | I201: =IF(INDIRECT(ADDRESS(RC1,2,3,1,Menus!R10C11))=R1C,RC4,NA()) -> NA() | J201: =IF(INDIRECT(ADDRESS(RC1,1,3,1,Menus!R10C11))=T(R1C),RC4,NA()) -> NA() | K201: =IF(OR(ISNUMBER(RC7),ISNUMBER(RC8),ISNUMBER(RC9),ISNUMBER(RC10)),1,0) -> 0 | M201: =OFFSET(INDIRECT(ADDRESS(RC1,3,3,1,"Gross")),0,Menus!R4C10) -> 0 | N201: =OFFSET(INDIRECT(ADDRESS(RC1,3,3,1,"Gross")),0,Menus!R3C10) -> 0
A202: 239 | B202: =OFFSET(INDIRECT(ADDRESS(RC1,3,3,1,Menus!R10C11)),0,Menus!R4C10) -> 0 | C202: =OFFSET(INDIRECT(ADDRESS(RC1,3,3,1,Menus!R10C11)),0,Menus!R3C10) -> 0 | D202: =IF(Menus!R9C10,RC[-1]/RC[-2],RC[-1]) -> #DIV/0! | E202: =IF(RC11=1,VALUE(RC[-3]),NA()) -> NA() | F202: =INDIRECT(ADDRESS(RC1,1,3,1,Menus!R10C11)) -> 0 | G202: =IF(INDIRECT(ADDRESS(RC1,2,3,1,Menus!R10C11))=R1C,RC4,NA()) -> NA() | H202: =IF(INDIRECT(ADDRESS(RC1,2,3,1,Menus!R10C11))=R1C,RC4,NA()) -> NA() | I202: =IF(INDIRECT(ADDRESS(RC1,2,3,1,Menus!R10C11))=R1C,RC4,NA()) -> NA() | J202: =IF(INDIRECT(ADDRESS(RC1,1,3,1,Menus!R10C11))=T(R1C),RC4,NA()) -> NA() | K202: =IF(OR(ISNUMBER(RC7),ISNUMBER(RC8),ISNUMBER(RC9),ISNUMBER(RC10)),1,0) -> 0 | M202: =OFFSET(INDIRECT(ADDRESS(RC1,3,3,1,"Gross")),0,Menus!R4C10) -> 0 | N202: =OFFSET(INDIRECT(ADDRESS(RC1,3,3,1,"Gross")),0,Menus!R3C10) -> 0
A203: 240 | B203: =OFFSET(INDIRECT(ADDRESS(RC1,3,3,1,Menus!R10C11)),0,Menus!R4C10) -> 0 | C203: =OFFSET(INDIRECT(ADDRESS(RC1,3,3,1,Menus!R10C11)),0,Menus!R3C10) -> 0 | D203: =IF(Menus!R9C10,RC[-1]/RC[-2],RC[-1]) -> #DIV/0! | E203: =IF(RC11=1,VALUE(RC[-3]),NA()) -> NA() | F203: =INDIRECT(ADDRESS(RC1,1,3,1,Menus!R10C11)) -> 0 | G203: =IF(INDIRECT(ADDRESS(RC1,2,3,1,Menus!R10C11))=R1C,RC4,NA()) -> NA() | H203: =IF(INDIRECT(ADDRESS(RC1,2,3,1,Menus!R10C11))=R1C,RC4,NA()) -> NA() | I203: =IF(INDIRECT(ADDRESS(RC1,2,3,1,Menus!R10C11))=R1C,RC4,NA()) -> NA() | J203: =IF(INDIRECT(ADDRESS(RC1,1,3,1,Menus!R10C11))=T(R1C),RC4,NA()) -> NA() | K203: =IF(OR(ISNUMBER(RC7),ISNUMBER(RC8),ISNUMBER(RC9),ISNUMBER(RC10)),1,0) -> 0 | M203: =OFFSET(INDIRECT(ADDRESS(RC1,3,3,1,"Gross")),0,Menus!R4C10) -> 0 | N203: =OFFSET(INDIRECT(ADDRESS(RC1,3,3,1,"Gross")),0,Menus!R3C10) -> 0
A204: 241 | B204: =OFFSET(INDIRECT(ADDRESS(RC1,3,3,1,Menus!R10C11)),0,Menus!R4C10) -> 0 | C204: =OFFSET(INDIRECT(ADDRESS(RC1,3,3,1,Menus!R10C11)),0,Menus!R3C10) -> 0 | D204: =IF(Menus!R9C10,RC[-1]/RC[-2],RC[-1]) -> #DIV/0! | E204: =IF(RC11=1,VALUE(RC[-3]),NA()) -> NA() | F204: =INDIRECT(ADDRESS(RC1,1,3,1,Menus!R10C11)) -> 0 | G204: =IF(INDIRECT(ADDRESS(RC1,2,3,1,Menus!R10C11))=R1C,RC4,NA()) -> NA() | H204: =IF(INDIRECT(ADDRESS(RC1,2,3,1,Menus!R10C11))=R1C,RC4,NA()) -> NA() | I204: =IF(INDIRECT(ADDRESS(RC1,2,3,1,Menus!R10C11))=R1C,RC4,NA()) -> NA() | J204: =IF(INDIRECT(ADDRESS(RC1,1,3,1,Menus!R10C11))=T(R1C),RC4,NA()) -> NA() | K204: =IF(OR(ISNUMBER(RC7),ISNUMBER(RC8),ISNUMBER(RC9),ISNUMBER(RC10)),1,0) -> 0 | M204: =OFFSET(INDIRECT(ADDRESS(RC1,3,3,1,"Gross")),0,Menus!R4C10) -> 0 | N204: =OFFSET(INDIRECT(ADDRESS(RC1,3,3,1,"Gross")),0,Menus!R3C10) -> 0
A205: 242 | B205: =OFFSET(INDIRECT(ADDRESS(RC1,3,3,1,Menus!R10C11)),0,Menus!R4C10) -> 0 | C205: =OFFSET(INDIRECT(ADDRESS(RC1,3,3,1,Menus!R10C11)),0,Menus!R3C10) -> 0 | D205: =IF(Menus!R9C10,RC[-1]/RC[-2],RC[-1]) -> #DIV/0! | E205: =IF(RC11=1,VALUE(RC[-3]),NA()) -> NA() | F205: =INDIRECT(ADDRESS(RC1,1,3,1,Menus!R10C11)) -> 0 | G205: =IF(INDIRECT(ADDRESS(RC1,2,3,1,Menus!R10C11))=R1C,RC4,NA()) -> NA() | H205: =IF(INDIRECT(ADDRESS(RC1,2,3,1,Menus!R10C11))=R1C,RC4,NA()) -> NA() | I205: =IF(INDIRECT(ADDRESS(RC1,2,3,1,Menus!R10C11))=R1C,RC4,NA()) -> NA() | J205: =IF(INDIRECT(ADDRESS(RC1,1,3,1,Menus!R10C11))=T(R1C),RC4,NA()) -> NA() | K205: =IF(OR(ISNUMBER(RC7),ISNUMBER(RC8),ISNUMBER(RC9),ISNUMBER(RC10)),1,0) -> 0 | M205: =OFFSET(INDIRECT(ADDRESS(RC1,3,3,1,"Gross")),0,Menus!R4C10) -> 0 | N205: =OFFSET(INDIRECT(ADDRESS(RC1,3,3,1,"Gross")),0,Menus!R3C10) -> 0
A206: 243 | B206: =OFFSET(INDIRECT(ADDRESS(RC1,3,3,1,Menus!R10C11)),0,Menus!R4C10) -> 0 | C206: =OFFSET(INDIRECT(ADDRESS(RC1,3,3,1,Menus!R10C11)),0,Menus!R3C10) -> 0 | D206: =IF(Menus!R9C10,RC[-1]/RC[-2],RC[-1]) -> #DIV/0! | E206: =IF(RC11=1,VALUE(RC[-3]),NA()) -> NA() | F206: =INDIRECT(ADDRESS(RC1,1,3,1,Menus!R10C11)) -> 0 | G206: =IF(INDIRECT(ADDRESS(RC1,2,3,1,Menus!R10C11))=R1C,RC4,NA()) -> NA() | H206: =IF(INDIRECT(ADDRESS(RC1,2,3,1,Menus!R10C11))=R1C,RC4,NA()) -> NA() | I206: =IF(INDIRECT(ADDRESS(RC1,2,3,1,Menus!R10C11))=R1C,RC4,NA()) -> NA() | J206: =IF(INDIRECT(ADDRESS(RC1,1,3,1,Menus!R10C11))=T(R1C),RC4,NA()) -> NA() | K206: =IF(OR(ISNUMBER(RC7),ISNUMBER(RC8),ISNUMBER(RC9),ISNUMBER(RC10)),1,0) -> 0 | M206: =OFFSET(INDIRECT(ADDRESS(RC1,3,3,1,"Gross")),0,Menus!R4C10) -> 0 | N206: =OFFSET(INDIRECT(ADDRESS(RC1,3,3,1,"Gross")),0,Menus!R3C10) -> 0
A207: 244 | B207: =OFFSET(INDIRECT(ADDRESS(RC1,3,3,1,Menus!R10C11)),0,Menus!R4C10) -> 0 | C207: =OFFSET(INDIRECT(ADDRESS(RC1,3,3,1,Menus!R10C11)),0,Menus!R3C10) -> 0 | D207: =IF(Menus!R9C10,RC[-1]/RC[-2],RC[-1]) -> #DIV/0! | E207: =IF(RC11=1,VALUE(RC[-3]),NA()) -> NA() | F207: =INDIRECT(ADDRESS(RC1,1,3,1,Menus!R10C11)) -> 0 | G207: =IF(INDIRECT(ADDRESS(RC1,2,3,1,Menus!R10C11))=R1C,RC4,NA()) -> NA() | H207: =IF(INDIRECT(ADDRESS(RC1,2,3,1,Menus!R10C11))=R1C,RC4,NA()) -> NA() | I207: =IF(INDIRECT(ADDRESS(RC1,2,3,1,Menus!R10C11))=R1C,RC4,NA()) -> NA() | J207: =IF(INDIRECT(ADDRESS(RC1,1,3,1,Menus!R10C11))=T(R1C),RC4,NA()) -> NA() | K207: =IF(OR(ISNUMBER(RC7),ISNUMBER(RC8),ISNUMBER(RC9),ISNUMBER(RC10)),1,0) -> 0 | M207: =OFFSET(INDIRECT(ADDRESS(RC1,3,3,1,"Gross")),0,Menus!R4C10) -> 0 | N207: =OFFSET(INDIRECT(ADDRESS(RC1,3,3,1,"Gross")),0,Menus!R3C10) -> 0
A208: 245 | B208: =OFFSET(INDIRECT(ADDRESS(RC1,3,3,1,Menus!R10C11)),0,Menus!R4C10) -> 0 | C208: =OFFSET(INDIRECT(ADDRESS(RC1,3,3,1,Menus!R10C11)),0,Menus!R3C10) -> 0 | D208: =IF(Menus!R9C10,RC[-1]/RC[-2],RC[-1]) -> #DIV/0! | E208: =IF(RC11=1,VALUE(RC[-3]),NA()) -> NA() | F208: =INDIRECT(ADDRESS(RC1,1,3,1,Menus!R10C11)) -> 0 | G208: =IF(INDIRECT(ADDRESS(RC1,2,3,1,Menus!R10C11))=R1C,RC4,NA()) -> NA() | H208: =IF(INDIRECT(ADDRESS(RC1,2,3,1,Menus!R10C11))=R1C,RC4,NA()) -> NA() | I208: =IF(INDIRECT(ADDRESS(RC1,2,3,1,Menus!R10C11))=R1C,RC4,NA()) -> NA() | J208: =IF(INDIRECT(ADDRESS(RC1,1,3,1,Menus!R10C11))=T(R1C),RC4,NA()) -> NA() | K208: =IF(OR(ISNUMBER(RC7),ISNUMBER(RC8),ISNUMBER(RC9),ISNUMBER(RC10)),1,0) -> 0 | M208: =OFFSET(INDIRECT(ADDRESS(RC1,3,3,1,"Gross")),0,Menus!R4C10) -> 0 | N208: =OFFSET(INDIRECT(ADDRESS(RC1,3,3,1,"Gross")),0,Menus!R3C10) -> 0
A209: 246 | B209: =OFFSET(INDIRECT(ADDRESS(RC1,3,3,1,Menus!R10C11)),0,Menus!R4C10) -> 0 | C209: =OFFSET(INDIRECT(ADDRESS(RC1,3,3,1,Menus!R10C11)),0,Menus!R3C10) -> 0 | D209: =IF(Menus!R9C10,RC[-1]/RC[-2],RC[-1]) -> #DIV/0! | E209: =IF(RC11=1,VALUE(RC[-3]),NA()) -> NA() | F209: =INDIRECT(ADDRESS(RC1,1,3,1,Menus!R10C11)) -> 0 | G209: =IF(INDIRECT(ADDRESS(RC1,2,3,1,Menus!R10C11))=R1C,RC4,NA()) -> NA() | H209: =IF(INDIRECT(ADDRESS(RC1,2,3,1,Menus!R10C11))=R1C,RC4,NA()) -> NA() | I209: =IF(INDIRECT(ADDRESS(RC1,2,3,1,Menus!R10C11))=R1C,RC4,NA()) -> NA() | J209: =IF(INDIRECT(ADDRESS(RC1,1,3,1,Menus!R10C11))=T(R1C),RC4,NA()) -> NA() | K209: =IF(OR(ISNUMBER(RC7),ISNUMBER(RC8),ISNUMBER(RC9),ISNUMBER(RC10)),1,0) -> 0 | M209: =OFFSET(INDIRECT(ADDRESS(RC1,3,3,1,"Gross")),0,Menus!R4C10) -> 0 | N209: =OFFSET(INDIRECT(ADDRESS(RC1,3,3,1,"Gross")),0,Menus!R3C10) -> 0
A210: 247 | B210: =OFFSET(INDIRECT(ADDRESS(RC1,3,3,1,Menus!R10C11)),0,Menus!R4C10) -> 0 | C210: =OFFSET(INDIRECT(ADDRESS(RC1,3,3,1,Menus!R10C11)),0,Menus!R3C10) -> 0 | D210: =IF(Menus!R9C10,RC[-1]/RC[-2],RC[-1]) -> #DIV/0! | E210: =IF(RC11=1,VALUE(RC[-3]),NA()) -> NA() | F210: =INDIRECT(ADDRESS(RC1,1,3,1,Menus!R10C11)) -> 0 | G210: =IF(INDIRECT(ADDRESS(RC1,2,3,1,Menus!R10C11))=R1C,RC4,NA()) -> NA() | H210: =IF(INDIRECT(ADDRESS(RC1,2,3,1,Menus!R10C11))=R1C,RC4,NA()) -> NA() | I210: =IF(INDIRECT(ADDRESS(RC1,2,3,1,Menus!R10C11))=R1C,RC4,NA()) -> NA() | J210: =IF(INDIRECT(ADDRESS(RC1,1,3,1,Menus!R10C11))=T(R1C),RC4,NA()) -> NA() | K210: =IF(OR(ISNUMBER(RC7),ISNUMBER(RC8),ISNUMBER(RC9),ISNUMBER(RC10)),1,0) -> 0 | M210: =OFFSET(INDIRECT(ADDRESS(RC1,3,3,1,"Gross")),0,Menus!R4C10) -> 0 | N210: =OFFSET(INDIRECT(ADDRESS(RC1,3,3,1,"Gross")),0,Menus!R3C10) -> 0
A211: 248 | B211: =OFFSET(INDIRECT(ADDRESS(RC1,3,3,1,Menus!R10C11)),0,Menus!R4C10) -> 0 | C211: =OFFSET(INDIRECT(ADDRESS(RC1,3,3,1,Menus!R10C11)),0,Menus!R3C10) -> 0 | D211: =IF(Menus!R9C10,RC[-1]/RC[-2],RC[-1]) -> #DIV/0! | E211: =IF(RC11=1,VALUE(RC[-3]),NA()) -> NA() | F211: =INDIRECT(ADDRESS(RC1,1,3,1,Menus!R10C11)) -> 0 | G211: =IF(INDIRECT(ADDRESS(RC1,2,3,1,Menus!R10C11))=R1C,RC4,NA()) -> NA() | H211: =IF(INDIRECT(ADDRESS(RC1,2,3,1,Menus!R10C11))=R1C,RC4,NA()) -> NA() | I211: =IF(INDIRECT(ADDRESS(RC1,2,3,1,Menus!R10C11))=R1C,RC4,NA()) -> NA() | J211: =IF(INDIRECT(ADDRESS(RC1,1,3,1,Menus!R10C11))=T(R1C),RC4,NA()) -> NA() | K211: =IF(OR(ISNUMBER(RC7),ISNUMBER(RC8),ISNUMBER(RC9),ISNUMBER(RC10)),1,0) -> 0 | M211: =OFFSET(INDIRECT(ADDRESS(RC1,3,3,1,"Gross")),0,Menus!R4C10) -> 0 | N211: =OFFSET(INDIRECT(ADDRESS(RC1,3,3,1,"Gross")),0,Menus!R3C10) -> 0
A212: 249 | B212: =OFFSET(INDIRECT(ADDRESS(RC1,3,3,1,Menus!R10C11)),0,Menus!R4C10) -> 0 | C212: =OFFSET(INDIRECT(ADDRESS(RC1,3,3,1,Menus!R10C11)),0,Menus!R3C10) -> 0 | D212: =IF(Menus!R9C10,RC[-1]/RC[-2],RC[-1]) -> #DIV/0! | E212: =IF(RC11=1,VALUE(RC[-3]),NA()) -> NA() | F212: =INDIRECT(ADDRESS(RC1,1,3,1,Menus!R10C11)) -> 0 | G212: =IF(INDIRECT(ADDRESS(RC1,2,3,1,Menus!R10C11))=R1C,RC4,NA()) -> NA() | H212: =IF(INDIRECT(ADDRESS(RC1,2,3,1,Menus!R10C11))=R1C,RC4,NA()) -> NA() | I212: =IF(INDIRECT(ADDRESS(RC1,2,3,1,Menus!R10C11))=R1C,RC4,NA()) -> NA() | J212: =IF(INDIRECT(ADDRESS(RC1,1,3,1,Menus!R10C11))=T(R1C),RC4,NA()) -> NA() | K212: =IF(OR(ISNUMBER(RC7),ISNUMBER(RC8),ISNUMBER(RC9),ISNUMBER(RC10)),1,0) -> 0 | M212: =OFFSET(INDIRECT(ADDRESS(RC1,3,3,1,"Gross")),0,Menus!R4C10) -> 0 | N212: =OFFSET(INDIRECT(ADDRESS(RC1,3,3,1,"Gross")),0,Menus!R3C10) -> 0
A213: 250 | B213: =OFFSET(INDIRECT(ADDRESS(RC1,3,3,1,Menus!R10C11)),0,Menus!R4C10) -> 0 | C213: =OFFSET(INDIRECT(ADDRESS(RC1,3,3,1,Menus!R10C11)),0,Menus!R3C10) -> 0 | D213: =IF(Menus!R9C10,RC[-1]/RC[-2],RC[-1]) -> #DIV/0! | E213: =IF(RC11=1,VALUE(RC[-3]),NA()) -> NA() | F213: =INDIRECT(ADDRESS(RC1,1,3,1,Menus!R10C11)) -> 0 | G213: =IF(INDIRECT(ADDRESS(RC1,2,3,1,Menus!R10C11))=R1C,RC4,NA()) -> NA() | H213: =IF(INDIRECT(ADDRESS(RC1,2,3,1,Menus!R10C11))=R1C,RC4,NA()) -> NA() | I213: =IF(INDIRECT(ADDRESS(RC1,2,3,1,Menus!R10C11))=R1C,RC4,NA()) -> NA() | J213: =IF(INDIRECT(ADDRESS(RC1,1,3,1,Menus!R10C11))=T(R1C),RC4,NA()) -> NA() | K213: =IF(OR(ISNUMBER(RC7),ISNUMBER(RC8),ISNUMBER(RC9),ISNUMBER(RC10)),1,0) -> 0 | M213: =OFFSET(INDIRECT(ADDRESS(RC1,3,3,1,"Gross")),0,Menus!R4C10) -> 0 | N213: =OFFSET(INDIRECT(ADDRESS(RC1,3,3,1,"Gross")),0,Menus!R3C10) -> 0
A214: 251 | B214: =OFFSET(INDIRECT(ADDRESS(RC1,3,3,1,Menus!R10C11)),0,Menus!R4C10) -> 0 | C214: =OFFSET(INDIRECT(ADDRESS(RC1,3,3,1,Menus!R10C11)),0,Menus!R3C10) -> 0 | D214: =IF(Menus!R9C10,RC[-1]/RC[-2],RC[-1]) -> #DIV/0! | E214: =IF(RC11=1,VALUE(RC[-3]),NA()) -> NA() | F214: =INDIRECT(ADDRESS(RC1,1,3,1,Menus!R10C11)) -> 0 | G214: =IF(INDIRECT(ADDRESS(RC1,2,3,1,Menus!R10C11))=R1C,RC4,NA()) -> NA() | H214: =IF(INDIRECT(ADDRESS(RC1,2,3,1,Menus!R10C11))=R1C,RC4,NA()) -> NA() | I214: =IF(INDIRECT(ADDRESS(RC1,2,3,1,Menus!R10C11))=R1C,RC4,NA()) -> NA() | J214: =IF(INDIRECT(ADDRESS(RC1,1,3,1,Menus!R10C11))=T(R1C),RC4,NA()) -> NA() | K214: =IF(OR(ISNUMBER(RC7),ISNUMBER(RC8),ISNUMBER(RC9),ISNUMBER(RC10)),1,0) -> 0 | M214: =OFFSET(INDIRECT(ADDRESS(RC1,3,3,1,"Gross")),0,Menus!R4C10) -> 0 | N214: =OFFSET(INDIRECT(ADDRESS(RC1,3,3,1,"Gross")),0,Menus!R3C10) -> 0
A215: 252 | B215: =OFFSET(INDIRECT(ADDRESS(RC1,3,3,1,Menus!R10C11)),0,Menus!R4C10) -> 0 | C215: =OFFSET(INDIRECT(ADDRESS(RC1,3,3,1,Menus!R10C11)),0,Menus!R3C10) -> 0 | D215: =IF(Menus!R9C10,RC[-1]/RC[-2],RC[-1]) -> #DIV/0! | E215: =IF(RC11=1,VALUE(RC[-3]),NA()) -> NA() | F215: =INDIRECT(ADDRESS(RC1,1,3,1,Menus!R10C11)) -> 0 | G215: =IF(INDIRECT(ADDRESS(RC1,2,3,1,Menus!R10C11))=R1C,RC4,NA()) -> NA() | H215: =IF(INDIRECT(ADDRESS(RC1,2,3,1,Menus!R10C11))=R1C,RC4,NA()) -> NA() | I215: =IF(INDIRECT(ADDRESS(RC1,2,3,1,Menus!R10C11))=R1C,RC4,NA()) -> NA() | J215: =IF(INDIRECT(ADDRESS(RC1,1,3,1,Menus!R10C11))=T(R1C),RC4,NA()) -> NA() | K215: =IF(OR(ISNUMBER(RC7),ISNUMBER(RC8),ISNUMBER(RC9),ISNUMBER(RC10)),1,0) -> 0 | M215: =OFFSET(INDIRECT(ADDRESS(RC1,3,3,1,"Gross")),0,Menus!R4C10) -> 0 | N215: =OFFSET(INDIRECT(ADDRESS(RC1,3,3,1,"Gross")),0,Menus!R3C10) -> 0
A216: 253 | B216: =OFFSET(INDIRECT(ADDRESS(RC1,3,3,1,Menus!R10C11)),0,Menus!R4C10) -> 0 | C216: =OFFSET(INDIRECT(ADDRESS(RC1,3,3,1,Menus!R10C11)),0,Menus!R3C10) -> 0 | D216: =IF(Menus!R9C10,RC[-1]/RC[-2],RC[-1]) -> #DIV/0! | E216: =IF(RC11=1,VALUE(RC[-3]),NA()) -> NA() | F216: =INDIRECT(ADDRESS(RC1,1,3,1,Menus!R10C11)) -> 0 | G216: =IF(INDIRECT(ADDRESS(RC1,2,3,1,Menus!R10C11))=R1C,RC4,NA()) -> NA() | H216: =IF(INDIRECT(ADDRESS(RC1,2,3,1,Menus!R10C11))=R1C,RC4,NA()) -> NA() | I216: =IF(INDIRECT(ADDRESS(RC1,2,3,1,Menus!R10C11))=R1C,RC4,NA()) -> NA() | J216: =IF(INDIRECT(ADDRESS(RC1,1,3,1,Menus!R10C11))=T(R1C),RC4,NA()) -> NA() | K216: =IF(OR(ISNUMBER(RC7),ISNUMBER(RC8),ISNUMBER(RC9),ISNUMBER(RC10)),1,0) -> 0 | M216: =OFFSET(INDIRECT(ADDRESS(RC1,3,3,1,"Gross")),0,Menus!R4C10) -> 0 | N216: =OFFSET(INDIRECT(ADDRESS(RC1,3,3,1,"Gross")),0,Menus!R3C10) -> 0
A217: 254 | B217: =OFFSET(INDIRECT(ADDRESS(RC1,3,3,1,Menus!R10C11)),0,Menus!R4C10) -> 0 | C217: =OFFSET(INDIRECT(ADDRESS(RC1,3,3,1,Menus!R10C11)),0,Menus!R3C10) -> 0 | D217: =IF(Menus!R9C10,RC[-1]/RC[-2],RC[-1]) -> #DIV/0! | E217: =IF(RC11=1,VALUE(RC[-3]),NA()) -> NA() | F217: =INDIRECT(ADDRESS(RC1,1,3,1,Menus!R10C11)) -> 0 | G217: =IF(INDIRECT(ADDRESS(RC1,2,3,1,Menus!R10C11))=R1C,RC4,NA()) -> NA() | H217: =IF(INDIRECT(ADDRESS(RC1,2,3,1,Menus!R10C11))=R1C,RC4,NA()) -> NA() | I217: =IF(INDIRECT(ADDRESS(RC1,2,3,1,Menus!R10C11))=R1C,RC4,NA()) -> NA() | J217: =IF(INDIRECT(ADDRESS(RC1,1,3,1,Menus!R10C11))=T(R1C),RC4,NA()) -> NA() | K217: =IF(OR(ISNUMBER(RC7),ISNUMBER(RC8),ISNUMBER(RC9),ISNUMBER(RC10)),1,0) -> 0 | M217: =OFFSET(INDIRECT(ADDRESS(RC1,3,3,1,"Gross")),0,Menus!R4C10) -> 0 | N217: =OFFSET(INDIRECT(ADDRESS(RC1,3,3,1,"Gross")),0,Menus!R3C10) -> 0
A218: 255 | B218: =OFFSET(INDIRECT(ADDRESS(RC1,3,3,1,Menus!R10C11)),0,Menus!R4C10) -> 0 | C218: =OFFSET(INDIRECT(ADDRESS(RC1,3,3,1,Menus!R10C11)),0,Menus!R3C10) -> 0 | D218: =IF(Menus!R9C10,RC[-1]/RC[-2],RC[-1]) -> #DIV/0! | E218: =IF(RC11=1,VALUE(RC[-3]),NA()) -> NA() | F218: =INDIRECT(ADDRESS(RC1,1,3,1,Menus!R10C11)) -> 0 | G218: =IF(INDIRECT(ADDRESS(RC1,2,3,1,Menus!R10C11))=R1C,RC4,NA()) -> NA() | H218: =IF(INDIRECT(ADDRESS(RC1,2,3,1,Menus!R10C11))=R1C,RC4,NA()) -> NA() | I218: =IF(INDIRECT(ADDRESS(RC1,2,3,1,Menus!R10C11))=R1C,RC4,NA()) -> NA() | J218: =IF(INDIRECT(ADDRESS(RC1,1,3,1,Menus!R10C11))=T(R1C),RC4,NA()) -> NA() | K218: =IF(OR(ISNUMBER(RC7),ISNUMBER(RC8),ISNUMBER(RC9),ISNUMBER(RC10)),1,0) -> 0 | M218: =OFFSET(INDIRECT(ADDRESS(RC1,3,3,1,"Gross")),0,Menus!R4C10) -> 0 | N218: =OFFSET(INDIRECT(ADDRESS(RC1,3,3,1,"Gross")),0,Menus!R3C10) -> 0
A219: 256 | B219: =OFFSET(INDIRECT(ADDRESS(RC1,3,3,1,Menus!R10C11)),0,Menus!R4C10) -> 0 | C219: =OFFSET(INDIRECT(ADDRESS(RC1,3,3,1,Menus!R10C11)),0,Menus!R3C10) -> 0 | D219: =IF(Menus!R9C10,RC[-1]/RC[-2],RC[-1]) -> #DIV/0! | E219: =IF(RC11=1,VALUE(RC[-3]),NA()) -> NA() | F219: =INDIRECT(ADDRESS(RC1,1,3,1,Menus!R10C11)) -> 0 | G219: =IF(INDIRECT(ADDRESS(RC1,2,3,1,Menus!R10C11))=R1C,RC4,NA()) -> NA() | H219: =IF(INDIRECT(ADDRESS(RC1,2,3,1,Menus!R10C11))=R1C,RC4,NA()) -> NA() | I219: =IF(INDIRECT(ADDRESS(RC1,2,3,1,Menus!R10C11))=R1C,RC4,NA()) -> NA() | J219: =IF(INDIRECT(ADDRESS(RC1,1,3,1,Menus!R10C11))=T(R1C),RC4,NA()) -> NA() | K219: =IF(OR(ISNUMBER(RC7),ISNUMBER(RC8),ISNUMBER(RC9),ISNUMBER(RC10)),1,0) -> 0 | M219: =OFFSET(INDIRECT(ADDRESS(RC1,3,3,1,"Gross")),0,Menus!R4C10) -> 0 | N219: =OFFSET(INDIRECT(ADDRESS(RC1,3,3,1,"Gross")),0,Menus!R3C10) -> 0
A220: 257 | B220: =OFFSET(INDIRECT(ADDRESS(RC1,3,3,1,Menus!R10C11)),0,Menus!R4C10) -> 0 | C220: =OFFSET(INDIRECT(ADDRESS(RC1,3,3,1,Menus!R10C11)),0,Menus!R3C10) -> 0 | D220: =IF(Menus!R9C10,RC[-1]/RC[-2],RC[-1]) -> #DIV/0! | E220: =IF(RC11=1,VALUE(RC[-3]),NA()) -> NA() | F220: =INDIRECT(ADDRESS(RC1,1,3,1,Menus!R10C11)) -> 0 | G220: =IF(INDIRECT(ADDRESS(RC1,2,3,1,Menus!R10C11))=R1C,RC4,NA()) -> NA() | H220: =IF(INDIRECT(ADDRESS(RC1,2,3,1,Menus!R10C11))=R1C,RC4,NA()) -> NA() | I220: =IF(INDIRECT(ADDRESS(RC1,2,3,1,Menus!R10C11))=R1C,RC4,NA()) -> NA() | J220: =IF(INDIRECT(ADDRESS(RC1,1,3,1,Menus!R10C11))=T(R1C),RC4,NA()) -> NA() | K220: =IF(OR(ISNUMBER(RC7),ISNUMBER(RC8),ISNUMBER(RC9),ISNUMBER(RC10)),1,0) -> 0 | M220: =OFFSET(INDIRECT(ADDRESS(RC1,3,3,1,"Gross")),0,Menus!R4C10) -> 0 | N220: =OFFSET(INDIRECT(ADDRESS(RC1,3,3,1,"Gross")),0,Menus!R3C10) -> 0
A221: 258 | B221: =OFFSET(INDIRECT(ADDRESS(RC1,3,3,1,Menus!R10C11)),0,Menus!R4C10) -> 0 | C221: =OFFSET(INDIRECT(ADDRESS(RC1,3,3,1,Menus!R10C11)),0,Menus!R3C10) -> 0 | D221: =IF(Menus!R9C10,RC[-1]/RC[-2],RC[-1]) -> #DIV/0! | E221: =IF(RC11=1,VALUE(RC[-3]),NA()) -> NA() | F221: =INDIRECT(ADDRESS(RC1,1,3,1,Menus!R10C11)) -> 0 | G221: =IF(INDIRECT(ADDRESS(RC1,2,3,1,Menus!R10C11))=R1C,RC4,NA()) -> NA() | H221: =IF(INDIRECT(ADDRESS(RC1,2,3,1,Menus!R10C11))=R1C,RC4,NA()) -> NA() | I221: =IF(INDIRECT(ADDRESS(RC1,2,3,1,Menus!R10C11))=R1C,RC4,NA()) -> NA() | J221: =IF(INDIRECT(ADDRESS(RC1,1,3,1,Menus!R10C11))=T(R1C),RC4,NA()) -> NA() | K221: =IF(OR(ISNUMBER(RC7),ISNUMBER(RC8),ISNUMBER(RC9),ISNUMBER(RC10)),1,0) -> 0 | M221: =OFFSET(INDIRECT(ADDRESS(RC1,3,3,1,"Gross")),0,Menus!R4C10) -> 0 | N221: =OFFSET(INDIRECT(ADDRESS(RC1,3,3,1,"Gross")),0,Menus!R3C10) -> 0
A222: 259 | B222: =OFFSET(INDIRECT(ADDRESS(RC1,3,3,1,Menus!R10C11)),0,Menus!R4C10) -> 0 | C222: =OFFSET(INDIRECT(ADDRESS(RC1,3,3,1,Menus!R10C11)),0,Menus!R3C10) -> 0 | D222: =IF(Menus!R9C10,RC[-1]/RC[-2],RC[-1]) -> #DIV/0! | E222: =IF(RC11=1,VALUE(RC[-3]),NA()) -> NA() | F222: =INDIRECT(ADDRESS(RC1,1,3,1,Menus!R10C11)) -> 0 | G222: =IF(INDIRECT(ADDRESS(RC1,2,3,1,Menus!R10C11))=R1C,RC4,NA()) -> NA() | H222: =IF(INDIRECT(ADDRESS(RC1,2,3,1,Menus!R10C11))=R1C,RC4,NA()) -> NA() | I222: =IF(INDIRECT(ADDRESS(RC1,2,3,1,Menus!R10C11))=R1C,RC4,NA()) -> NA() | J222: =IF(INDIRECT(ADDRESS(RC1,1,3,1,Menus!R10C11))=T(R1C),RC4,NA()) -> NA() | K222: =IF(OR(ISNUMBER(RC7),ISNUMBER(RC8),ISNUMBER(RC9),ISNUMBER(RC10)),1,0) -> 0 | M222: =OFFSET(INDIRECT(ADDRESS(RC1,3,3,1,"Gross")),0,Menus!R4C10) -> 0 | N222: =OFFSET(INDIRECT(ADDRESS(RC1,3,3,1,"Gross")),0,Menus!R3C10) -> 0
A223: 260 | B223: =OFFSET(INDIRECT(ADDRESS(RC1,3,3,1,Menus!R10C11)),0,Menus!R4C10) -> 0 | C223: =OFFSET(INDIRECT(ADDRESS(RC1,3,3,1,Menus!R10C11)),0,Menus!R3C10) -> 0 | D223: =IF(Menus!R9C10,RC[-1]/RC[-2],RC[-1]) -> #DIV/0! | E223: =IF(RC11=1,VALUE(RC[-3]),NA()) -> NA() | F223: =INDIRECT(ADDRESS(RC1,1,3,1,Menus!R10C11)) -> 0 | G223: =IF(INDIRECT(ADDRESS(RC1,2,3,1,Menus!R10C11))=R1C,RC4,NA()) -> NA() | H223: =IF(INDIRECT(ADDRESS(RC1,2,3,1,Menus!R10C11))=R1C,RC4,NA()) -> NA() | I223: =IF(INDIRECT(ADDRESS(RC1,2,3,1,Menus!R10C11))=R1C,RC4,NA()) -> NA() | J223: =IF(INDIRECT(ADDRESS(RC1,1,3,1,Menus!R10C11))=T(R1C),RC4,NA()) -> NA() | K223: =IF(OR(ISNUMBER(RC7),ISNUMBER(RC8),ISNUMBER(RC9),ISNUMBER(RC10)),1,0) -> 0 | M223: =OFFSET(INDIRECT(ADDRESS(RC1,3,3,1,"Gross")),0,Menus!R4C10) -> 0 | N223: =OFFSET(INDIRECT(ADDRESS(RC1,3,3,1,"Gross")),0,Menus!R3C10) -> 0
A224: 261 | B224: =OFFSET(INDIRECT(ADDRESS(RC1,3,3,1,Menus!R10C11)),0,Menus!R4C10) -> 0 | C224: =OFFSET(INDIRECT(ADDRESS(RC1,3,3,1,Menus!R10C11)),0,Menus!R3C10) -> 0 | D224: =IF(Menus!R9C10,RC[-1]/RC[-2],RC[-1]) -> #DIV/0! | E224: =IF(RC11=1,VALUE(RC[-3]),NA()) -> NA() | F224: =INDIRECT(ADDRESS(RC1,1,3,1,Menus!R10C11)) -> 0 | G224: =IF(INDIRECT(ADDRESS(RC1,2,3,1,Menus!R10C11))=R1C,RC4,NA()) -> NA() | H224: =IF(INDIRECT(ADDRESS(RC1,2,3,1,Menus!R10C11))=R1C,RC4,NA()) -> NA() | I224: =IF(INDIRECT(ADDRESS(RC1,2,3,1,Menus!R10C11))=R1C,RC4,NA()) -> NA() | J224: =IF(INDIRECT(ADDRESS(RC1,1,3,1,Menus!R10C11))=T(R1C),RC4,NA()) -> NA() | K224: =IF(OR(ISNUMBER(RC7),ISNUMBER(RC8),ISNUMBER(RC9),ISNUMBER(RC10)),1,0) -> 0 | M224: =OFFSET(INDIRECT(ADDRESS(RC1,3,3,1,"Gross")),0,Menus!R4C10) -> 0 | N224: =OFFSET(INDIRECT(ADDRESS(RC1,3,3,1,"Gross")),0,Menus!R3C10) -> 0
A225: 262 | B225: =OFFSET(INDIRECT(ADDRESS(RC1,3,3,1,Menus!R10C11)),0,Menus!R4C10) -> 0 | C225: =OFFSET(INDIRECT(ADDRESS(RC1,3,3,1,Menus!R10C11)),0,Menus!R3C10) -> 0 | D225: =IF(Menus!R9C10,RC[-1]/RC[-2],RC[-1]) -> #DIV/0! | E225: =IF(RC11=1,VALUE(RC[-3]),NA()) -> NA() | F225: =INDIRECT(ADDRESS(RC1,1,3,1,Menus!R10C11)) -> 0 | G225: =IF(INDIRECT(ADDRESS(RC1,2,3,1,Menus!R10C11))=R1C,RC4,NA()) -> NA() | H225: =IF(INDIRECT(ADDRESS(RC1,2,3,1,Menus!R10C11))=R1C,RC4,NA()) -> NA() | I225: =IF(INDIRECT(ADDRESS(RC1,2,3,1,Menus!R10C11))=R1C,RC4,NA()) -> NA() | J225: =IF(INDIRECT(ADDRESS(RC1,1,3,1,Menus!R10C11))=T(R1C),RC4,NA()) -> NA() | K225: =IF(OR(ISNUMBER(RC7),ISNUMBER(RC8),ISNUMBER(RC9),ISNUMBER(RC10)),1,0) -> 0 | M225: =OFFSET(INDIRECT(ADDRESS(RC1,3,3,1,"Gross")),0,Menus!R4C10) -> 0 | N225: =OFFSET(INDIRECT(ADDRESS(RC1,3,3,1,"Gross")),0,Menus!R3C10) -> 0
A226: 263 | B226: =OFFSET(INDIRECT(ADDRESS(RC1,3,3,1,Menus!R10C11)),0,Menus!R4C10) -> 0 | C226: =OFFSET(INDIRECT(ADDRESS(RC1,3,3,1,Menus!R10C11)),0,Menus!R3C10) -> 0 | D226: =IF(Menus!R9C10,RC[-1]/RC[-2],RC[-1]) -> #DIV/0! | E226: =IF(RC11=1,VALUE(RC[-3]),NA()) -> NA() | F226: =INDIRECT(ADDRESS(RC1,1,3,1,Menus!R10C11)) -> 0 | G226: =IF(INDIRECT(ADDRESS(RC1,2,3,1,Menus!R10C11))=R1C,RC4,NA()) -> NA() | H226: =IF(INDIRECT(ADDRESS(RC1,2,3,1,Menus!R10C11))=R1C,RC4,NA()) -> NA() | I226: =IF(INDIRECT(ADDRESS(RC1,2,3,1,Menus!R10C11))=R1C,RC4,NA()) -> NA() | J226: =IF(INDIRECT(ADDRESS(RC1,1,3,1,Menus!R10C11))=T(R1C),RC4,NA()) -> NA() | K226: =IF(OR(ISNUMBER(RC7),ISNUMBER(RC8),ISNUMBER(RC9),ISNUMBER(RC10)),1,0) -> 0 | M226: =OFFSET(INDIRECT(ADDRESS(RC1,3,3,1,"Gross")),0,Menus!R4C10) -> 0 | N226: =OFFSET(INDIRECT(ADDRESS(RC1,3,3,1,"Gross")),0,Menus!R3C10) -> 0
A227: 264 | B227: =OFFSET(INDIRECT(ADDRESS(RC1,3,3,1,Menus!R10C11)),0,Menus!R4C10) -> 0 | C227: =OFFSET(INDIRECT(ADDRESS(RC1,3,3,1,Menus!R10C11)),0,Menus!R3C10) -> 0 | D227: =IF(Menus!R9C10,RC[-1]/RC[-2],RC[-1]) -> #DIV/0! | E227: =IF(RC11=1,VALUE(RC[-3]),NA()) -> NA() | F227: =INDIRECT(ADDRESS(RC1,1,3,1,Menus!R10C11)) -> 0 | G227: =IF(INDIRECT(ADDRESS(RC1,2,3,1,Menus!R10C11))=R1C,RC4,NA()) -> NA() | H227: =IF(INDIRECT(ADDRESS(RC1,2,3,1,Menus!R10C11))=R1C,RC4,NA()) -> NA() | I227: =IF(INDIRECT(ADDRESS(RC1,2,3,1,Menus!R10C11))=R1C,RC4,NA()) -> NA() | J227: =IF(INDIRECT(ADDRESS(RC1,1,3,1,Menus!R10C11))=T(R1C),RC4,NA()) -> NA() | K227: =IF(OR(ISNUMBER(RC7),ISNUMBER(RC8),ISNUMBER(RC9),ISNUMBER(RC10)),1,0) -> 0 | M227: =OFFSET(INDIRECT(ADDRESS(RC1,3,3,1,"Gross")),0,Menus!R4C10) -> 0 | N227: =OFFSET(INDIRECT(ADDRESS(RC1,3,3,1,"Gross")),0,Menus!R3C10) -> 0
A228: 265 | B228: =OFFSET(INDIRECT(ADDRESS(RC1,3,3,1,Menus!R10C11)),0,Menus!R4C10) -> 0 | C228: =OFFSET(INDIRECT(ADDRESS(RC1,3,3,1,Menus!R10C11)),0,Menus!R3C10) -> 0 | D228: =IF(Menus!R9C10,RC[-1]/RC[-2],RC[-1]) -> #DIV/0! | E228: =IF(RC11=1,VALUE(RC[-3]),NA()) -> NA() | F228: =INDIRECT(ADDRESS(RC1,1,3,1,Menus!R10C11)) -> 0 | G228: =IF(INDIRECT(ADDRESS(RC1,2,3,1,Menus!R10C11))=R1C,RC4,NA()) -> NA() | H228: =IF(INDIRECT(ADDRESS(RC1,2,3,1,Menus!R10C11))=R1C,RC4,NA()) -> NA() | I228: =IF(INDIRECT(ADDRESS(RC1,2,3,1,Menus!R10C11))=R1C,RC4,NA()) -> NA() | J228: =IF(INDIRECT(ADDRESS(RC1,1,3,1,Menus!R10C11))=T(R1C),RC4,NA()) -> NA() | K228: =IF(OR(ISNUMBER(RC7),ISNUMBER(RC8),ISNUMBER(RC9),ISNUMBER(RC10)),1,0) -> 0 | M228: =OFFSET(INDIRECT(ADDRESS(RC1,3,3,1,"Gross")),0,Menus!R4C10) -> 0 | N228: =OFFSET(INDIRECT(ADDRESS(RC1,3,3,1,"Gross")),0,Menus!R3C10) -> 0
A229: 266 | B229: =OFFSET(INDIRECT(ADDRESS(RC1,3,3,1,Menus!R10C11)),0,Menus!R4C10) -> 0 | C229: =OFFSET(INDIRECT(ADDRESS(RC1,3,3,1,Menus!R10C11)),0,Menus!R3C10) -> 0 | D229: =IF(Menus!R9C10,RC[-1]/RC[-2],RC[-1]) -> #DIV/0! | E229: =IF(RC11=1,VALUE(RC[-3]),NA()) -> NA() | F229: =INDIRECT(ADDRESS(RC1,1,3,1,Menus!R10C11)) -> 0 | G229: =IF(INDIRECT(ADDRESS(RC1,2,3,1,Menus!R10C11))=R1C,RC4,NA()) -> NA() | H229: =IF(INDIRECT(ADDRESS(RC1,2,3,1,Menus!R10C11))=R1C,RC4,NA()) -> NA() | I229: =IF(INDIRECT(ADDRESS(RC1,2,3,1,Menus!R10C11))=R1C,RC4,NA()) -> NA() | J229: =IF(INDIRECT(ADDRESS(RC1,1,3,1,Menus!R10C11))=T(R1C),RC4,NA()) -> NA() | K229: =IF(OR(ISNUMBER(RC7),ISNUMBER(RC8),ISNUMBER(RC9),ISNUMBER(RC10)),1,0) -> 0 | M229: =OFFSET(INDIRECT(ADDRESS(RC1,3,3,1,"Gross")),0,Menus!R4C10) -> 0 | N229: =OFFSET(INDIRECT(ADDRESS(RC1,3,3,1,"Gross")),0,Menus!R3C10) -> 0
A230: 267 | B230: =OFFSET(INDIRECT(ADDRESS(RC1,3,3,1,Menus!R10C11)),0,Menus!R4C10) -> 0 | C230: =OFFSET(INDIRECT(ADDRESS(RC1,3,3,1,Menus!R10C11)),0,Menus!R3C10) -> 0 | D230: =IF(Menus!R9C10,RC[-1]/RC[-2],RC[-1]) -> #DIV/0! | E230: =IF(RC11=1,VALUE(RC[-3]),NA()) -> NA() | F230: =INDIRECT(ADDRESS(RC1,1,3,1,Menus!R10C11)) -> 0 | G230: =IF(INDIRECT(ADDRESS(RC1,2,3,1,Menus!R10C11))=R1C,RC4,NA()) -> NA() | H230: =IF(INDIRECT(ADDRESS(RC1,2,3,1,Menus!R10C11))=R1C,RC4,NA()) -> NA() | I230: =IF(INDIRECT(ADDRESS(RC1,2,3,1,Menus!R10C11))=R1C,RC4,NA()) -> NA() | J230: =IF(INDIRECT(ADDRESS(RC1,1,3,1,Menus!R10C11))=T(R1C),RC4,NA()) -> NA() | K230: =IF(OR(ISNUMBER(RC7),ISNUMBER(RC8),ISNUMBER(RC9),ISNUMBER(RC10)),1,0) -> 0 | M230: =OFFSET(INDIRECT(ADDRESS(RC1,3,3,1,"Gross")),0,Menus!R4C10) -> 0 | N230: =OFFSET(INDIRECT(ADDRESS(RC1,3,3,1,"Gross")),0,Menus!R3C10) -> 0
A231: 268 | B231: =OFFSET(INDIRECT(ADDRESS(RC1,3,3,1,Menus!R10C11)),0,Menus!R4C10) -> 0 | C231: =OFFSET(INDIRECT(ADDRESS(RC1,3,3,1,Menus!R10C11)),0,Menus!R3C10) -> 0 | D231: =IF(Menus!R9C10,RC[-1]/RC[-2],RC[-1]) -> #DIV/0! | E231: =IF(RC11=1,VALUE(RC[-3]),NA()) -> NA() | F231: =INDIRECT(ADDRESS(RC1,1,3,1,Menus!R10C11)) -> 0 | G231: =IF(INDIRECT(ADDRESS(RC1,2,3,1,Menus!R10C11))=R1C,RC4,NA()) -> NA() | H231: =IF(INDIRECT(ADDRESS(RC1,2,3,1,Menus!R10C11))=R1C,RC4,NA()) -> NA() | I231: =IF(INDIRECT(ADDRESS(RC1,2,3,1,Menus!R10C11))=R1C,RC4,NA()) -> NA() | J231: =IF(INDIRECT(ADDRESS(RC1,1,3,1,Menus!R10C11))=T(R1C),RC4,NA()) -> NA() | K231: =IF(OR(ISNUMBER(RC7),ISNUMBER(RC8),ISNUMBER(RC9),ISNUMBER(RC10)),1,0) -> 0 | M231: =OFFSET(INDIRECT(ADDRESS(RC1,3,3,1,"Gross")),0,Menus!R4C10) -> 0 | N231: =OFFSET(INDIRECT(ADDRESS(RC1,3,3,1,"Gross")),0,Menus!R3C10) -> 0
A232: 269 | B232: =OFFSET(INDIRECT(ADDRESS(RC1,3,3,1,Menus!R10C11)),0,Menus!R4C10) -> 0 | C232: =OFFSET(INDIRECT(ADDRESS(RC1,3,3,1,Menus!R10C11)),0,Menus!R3C10) -> 0 | D232: =IF(Menus!R9C10,RC[-1]/RC[-2],RC[-1]) -> #DIV/0! | E232: =IF(RC11=1,VALUE(RC[-3]),NA()) -> NA() | F232: =INDIRECT(ADDRESS(RC1,1,3,1,Menus!R10C11)) -> 0 | G232: =IF(INDIRECT(ADDRESS(RC1,2,3,1,Menus!R10C11))=R1C,RC4,NA()) -> NA() | H232: =IF(INDIRECT(ADDRESS(RC1,2,3,1,Menus!R10C11))=R1C,RC4,NA()) -> NA() | I232: =IF(INDIRECT(ADDRESS(RC1,2,3,1,Menus!R10C11))=R1C,RC4,NA()) -> NA() | J232: =IF(INDIRECT(ADDRESS(RC1,1,3,1,Menus!R10C11))=T(R1C),RC4,NA()) -> NA() | K232: =IF(OR(ISNUMBER(RC7),ISNUMBER(RC8),ISNUMBER(RC9),ISNUMBER(RC10)),1,0) -> 0 | M232: =OFFSET(INDIRECT(ADDRESS(RC1,3,3,1,"Gross")),0,Menus!R4C10) -> 0 | N232: =OFFSET(INDIRECT(ADDRESS(RC1,3,3,1,"Gross")),0,Menus!R3C10) -> 0
A233: 270 | B233: =OFFSET(INDIRECT(ADDRESS(RC1,3,3,1,Menus!R10C11)),0,Menus!R4C10) -> 0 | C233: =OFFSET(INDIRECT(ADDRESS(RC1,3,3,1,Menus!R10C11)),0,Menus!R3C10) -> 0 | D233: =IF(Menus!R9C10,RC[-1]/RC[-2],RC[-1]) -> #DIV/0! | E233: =IF(RC11=1,VALUE(RC[-3]),NA()) -> NA() | F233: =INDIRECT(ADDRESS(RC1,1,3,1,Menus!R10C11)) -> 0 | G233: =IF(INDIRECT(ADDRESS(RC1,2,3,1,Menus!R10C11))=R1C,RC4,NA()) -> NA() | H233: =IF(INDIRECT(ADDRESS(RC1,2,3,1,Menus!R10C11))=R1C,RC4,NA()) -> NA() | I233: =IF(INDIRECT(ADDRESS(RC1,2,3,1,Menus!R10C11))=R1C,RC4,NA()) -> NA() | J233: =IF(INDIRECT(ADDRESS(RC1,1,3,1,Menus!R10C11))=T(R1C),RC4,NA()) -> NA() | K233: =IF(OR(ISNUMBER(RC7),ISNUMBER(RC8),ISNUMBER(RC9),ISNUMBER(RC10)),1,0) -> 0 | M233: =OFFSET(INDIRECT(ADDRESS(RC1,3,3,1,"Gross")),0,Menus!R4C10) -> 0 | N233: =OFFSET(INDIRECT(ADDRESS(RC1,3,3,1,"Gross")),0,Menus!R3C10) -> 0
A234: 271 | B234: =OFFSET(INDIRECT(ADDRESS(RC1,3,3,1,Menus!R10C11)),0,Menus!R4C10) -> 0 | C234: =OFFSET(INDIRECT(ADDRESS(RC1,3,3,1,Menus!R10C11)),0,Menus!R3C10) -> 0 | D234: =IF(Menus!R9C10,RC[-1]/RC[-2],RC[-1]) -> #DIV/0! | E234: =IF(RC11=1,VALUE(RC[-3]),NA()) -> NA() | F234: =INDIRECT(ADDRESS(RC1,1,3,1,Menus!R10C11)) -> 0 | G234: =IF(INDIRECT(ADDRESS(RC1,2,3,1,Menus!R10C11))=R1C,RC4,NA()) -> NA() | H234: =IF(INDIRECT(ADDRESS(RC1,2,3,1,Menus!R10C11))=R1C,RC4,NA()) -> NA() | I234: =IF(INDIRECT(ADDRESS(RC1,2,3,1,Menus!R10C11))=R1C,RC4,NA()) -> NA() | J234: =IF(INDIRECT(ADDRESS(RC1,1,3,1,Menus!R10C11))=T(R1C),RC4,NA()) -> NA() | K234: =IF(OR(ISNUMBER(RC7),ISNUMBER(RC8),ISNUMBER(RC9),ISNUMBER(RC10)),1,0) -> 0 | M234: =OFFSET(INDIRECT(ADDRESS(RC1,3,3,1,"Gross")),0,Menus!R4C10) -> 0 | N234: =OFFSET(INDIRECT(ADDRESS(RC1,3,3,1,"Gross")),0,Menus!R3C10) -> 0
A235: 272 | B235: =OFFSET(INDIRECT(ADDRESS(RC1,3,3,1,Menus!R10C11)),0,Menus!R4C10) -> 0 | C235: =OFFSET(INDIRECT(ADDRESS(RC1,3,3,1,Menus!R10C11)),0,Menus!R3C10) -> 0 | D235: =IF(Menus!R9C10,RC[-1]/RC[-2],RC[-1]) -> #DIV/0! | E235: =IF(RC11=1,VALUE(RC[-3]),NA()) -> NA() | F235: =INDIRECT(ADDRESS(RC1,1,3,1,Menus!R10C11)) -> 0 | G235: =IF(INDIRECT(ADDRESS(RC1,2,3,1,Menus!R10C11))=R1C,RC4,NA()) -> NA() | H235: =IF(INDIRECT(ADDRESS(RC1,2,3,1,Menus!R10C11))=R1C,RC4,NA()) -> NA() | I235: =IF(INDIRECT(ADDRESS(RC1,2,3,1,Menus!R10C11))=R1C,RC4,NA()) -> NA() | J235: =IF(INDIRECT(ADDRESS(RC1,1,3,1,Menus!R10C11))=T(R1C),RC4,NA()) -> NA() | K235: =IF(OR(ISNUMBER(RC7),ISNUMBER(RC8),ISNUMBER(RC9),ISNUMBER(RC10)),1,0) -> 0 | M235: =OFFSET(INDIRECT(ADDRESS(RC1,3,3,1,"Gross")),0,Menus!R4C10) -> 0 | N235: =OFFSET(INDIRECT(ADDRESS(RC1,3,3,1,"Gross")),0,Menus!R3C10) -> 0
A236: 273 | B236: =OFFSET(INDIRECT(ADDRESS(RC1,3,3,1,Menus!R10C11)),0,Menus!R4C10) -> 0 | C236: =OFFSET(INDIRECT(ADDRESS(RC1,3,3,1,Menus!R10C11)),0,Menus!R3C10) -> 0 | D236: =IF(Menus!R9C10,RC[-1]/RC[-2],RC[-1]) -> #DIV/0! | E236: =IF(RC11=1,VALUE(RC[-3]),NA()) -> NA() | F236: =INDIRECT(ADDRESS(RC1,1,3,1,Menus!R10C11)) -> 0 | G236: =IF(INDIRECT(ADDRESS(RC1,2,3,1,Menus!R10C11))=R1C,RC4,NA()) -> NA() | H236: =IF(INDIRECT(ADDRESS(RC1,2,3,1,Menus!R10C11))=R1C,RC4,NA()) -> NA() | I236: =IF(INDIRECT(ADDRESS(RC1,2,3,1,Menus!R10C11))=R1C,RC4,NA()) -> NA() | J236: =IF(INDIRECT(ADDRESS(RC1,1,3,1,Menus!R10C11))=T(R1C),RC4,NA()) -> NA() | K236: =IF(OR(ISNUMBER(RC7),ISNUMBER(RC8),ISNUMBER(RC9),ISNUMBER(RC10)),1,0) -> 0 | M236: =OFFSET(INDIRECT(ADDRESS(RC1,3,3,1,"Gross")),0,Menus!R4C10) -> 0 | N236: =OFFSET(INDIRECT(ADDRESS(RC1,3,3,1,"Gross")),0,Menus!R3C10) -> 0
A237: 274 | B237: =OFFSET(INDIRECT(ADDRESS(RC1,3,3,1,Menus!R10C11)),0,Menus!R4C10) -> 0 | C237: =OFFSET(INDIRECT(ADDRESS(RC1,3,3,1,Menus!R10C11)),0,Menus!R3C10) -> 0 | D237: =IF(Menus!R9C10,RC[-1]/RC[-2],RC[-1]) -> #DIV/0! | E237: =IF(RC11=1,VALUE(RC[-3]),NA()) -> NA() | F237: =INDIRECT(ADDRESS(RC1,1,3,1,Menus!R10C11)) -> 0 | G237: =IF(INDIRECT(ADDRESS(RC1,2,3,1,Menus!R10C11))=R1C,RC4,NA()) -> NA() | H237: =IF(INDIRECT(ADDRESS(RC1,2,3,1,Menus!R10C11))=R1C,RC4,NA()) -> NA() | I237: =IF(INDIRECT(ADDRESS(RC1,2,3,1,Menus!R10C11))=R1C,RC4,NA()) -> NA() | J237: =IF(INDIRECT(ADDRESS(RC1,1,3,1,Menus!R10C11))=T(R1C),RC4,NA()) -> NA() | K237: =IF(OR(ISNUMBER(RC7),ISNUMBER(RC8),ISNUMBER(RC9),ISNUMBER(RC10)),1,0) -> 0 | M237: =OFFSET(INDIRECT(ADDRESS(RC1,3,3,1,"Gross")),0,Menus!R4C10) -> 0 | N237: =OFFSET(INDIRECT(ADDRESS(RC1,3,3,1,"Gross")),0,Menus!R3C10) -> 0
A238: 275 | B238: =OFFSET(INDIRECT(ADDRESS(RC1,3,3,1,Menus!R10C11)),0,Menus!R4C10) -> 0 | C238: =OFFSET(INDIRECT(ADDRESS(RC1,3,3,1,Menus!R10C11)),0,Menus!R3C10) -> 0 | D238: =IF(Menus!R9C10,RC[-1]/RC[-2],RC[-1]) -> #DIV/0! | E238: =IF(RC11=1,VALUE(RC[-3]),NA()) -> NA() | F238: =INDIRECT(ADDRESS(RC1,1,3,1,Menus!R10C11)) -> 0 | G238: =IF(INDIRECT(ADDRESS(RC1,2,3,1,Menus!R10C11))=R1C,RC4,NA()) -> NA() | H238: =IF(INDIRECT(ADDRESS(RC1,2,3,1,Menus!R10C11))=R1C,RC4,NA()) -> NA() | I238: =IF(INDIRECT(ADDRESS(RC1,2,3,1,Menus!R10C11))=R1C,RC4,NA()) -> NA() | J238: =IF(INDIRECT(ADDRESS(RC1,1,3,1,Menus!R10C11))=T(R1C),RC4,NA()) -> NA() | K238: =IF(OR(ISNUMBER(RC7),ISNUMBER(RC8),ISNUMBER(RC9),ISNUMBER(RC10)),1,0) -> 0 | M238: =OFFSET(INDIRECT(ADDRESS(RC1,3,3,1,"Gross")),0,Menus!R4C10) -> 0 | N238: =OFFSET(INDIRECT(ADDRESS(RC1,3,3,1,"Gross")),0,Menus!R3C10) -> 0
A239: 276 | B239: =OFFSET(INDIRECT(ADDRESS(RC1,3,3,1,Menus!R10C11)),0,Menus!R4C10) -> 0 | C239: =OFFSET(INDIRECT(ADDRESS(RC1,3,3,1,Menus!R10C11)),0,Menus!R3C10) -> 0 | D239: =IF(Menus!R9C10,RC[-1]/RC[-2],RC[-1]) -> #DIV/0! | E239: =IF(RC11=1,VALUE(RC[-3]),NA()) -> NA() | F239: =INDIRECT(ADDRESS(RC1,1,3,1,Menus!R10C11)) -> 0 | G239: =IF(INDIRECT(ADDRESS(RC1,2,3,1,Menus!R10C11))=R1C,RC4,NA()) -> NA() | H239: =IF(INDIRECT(ADDRESS(RC1,2,3,1,Menus!R10C11))=R1C,RC4,NA()) -> NA() | I239: =IF(INDIRECT(ADDRESS(RC1,2,3,1,Menus!R10C11))=R1C,RC4,NA()) -> NA() | J239: =IF(INDIRECT(ADDRESS(RC1,1,3,1,Menus!R10C11))=T(R1C),RC4,NA()) -> NA() | K239: =IF(OR(ISNUMBER(RC7),ISNUMBER(RC8),ISNUMBER(RC9),ISNUMBER(RC10)),1,0) -> 0 | M239: =OFFSET(INDIRECT(ADDRESS(RC1,3,3,1,"Gross")),0,Menus!R4C10) -> 0 | N239: =OFFSET(INDIRECT(ADDRESS(RC1,3,3,1,"Gross")),0,Menus!R3C10) -> 0
A240: 277 | B240: =OFFSET(INDIRECT(ADDRESS(RC1,3,3,1,Menus!R10C11)),0,Menus!R4C10) -> 0 | C240: =OFFSET(INDIRECT(ADDRESS(RC1,3,3,1,Menus!R10C11)),0,Menus!R3C10) -> 0 | D240: =IF(Menus!R9C10,RC[-1]/RC[-2],RC[-1]) -> #DIV/0! | E240: =IF(RC11=1,VALUE(RC[-3]),NA()) -> NA() | F240: =INDIRECT(ADDRESS(RC1,1,3,1,Menus!R10C11)) -> 0 | G240: =IF(INDIRECT(ADDRESS(RC1,2,3,1,Menus!R10C11))=R1C,RC4,NA()) -> NA() | H240: =IF(INDIRECT(ADDRESS(RC1,2,3,1,Menus!R10C11))=R1C,RC4,NA()) -> NA() | I240: =IF(INDIRECT(ADDRESS(RC1,2,3,1,Menus!R10C11))=R1C,RC4,NA()) -> NA() | J240: =IF(INDIRECT(ADDRESS(RC1,1,3,1,Menus!R10C11))=T(R1C),RC4,NA()) -> NA() | K240: =IF(OR(ISNUMBER(RC7),ISNUMBER(RC8),ISNUMBER(RC9),ISNUMBER(RC10)),1,0) -> 0 | M240: =OFFSET(INDIRECT(ADDRESS(RC1,3,3,1,"Gross")),0,Menus!R4C10) -> 0 | N240: =OFFSET(INDIRECT(ADDRESS(RC1,3,3,1,"Gross")),0,Menus!R3C10) -> 0
A241: 278 | B241: =OFFSET(INDIRECT(ADDRESS(RC1,3,3,1,Menus!R10C11)),0,Menus!R4C10) -> 0 | C241: =OFFSET(INDIRECT(ADDRESS(RC1,3,3,1,Menus!R10C11)),0,Menus!R3C10) -> 0 | D241: =IF(Menus!R9C10,RC[-1]/RC[-2],RC[-1]) -> #DIV/0! | E241: =IF(RC11=1,VALUE(RC[-3]),NA()) -> NA() | F241: =INDIRECT(ADDRESS(RC1,1,3,1,Menus!R10C11)) -> 0 | G241: =IF(INDIRECT(ADDRESS(RC1,2,3,1,Menus!R10C11))=R1C,RC4,NA()) -> NA() | H241: =IF(INDIRECT(ADDRESS(RC1,2,3,1,Menus!R10C11))=R1C,RC4,NA()) -> NA() | I241: =IF(INDIRECT(ADDRESS(RC1,2,3,1,Menus!R10C11))=R1C,RC4,NA()) -> NA() | J241: =IF(INDIRECT(ADDRESS(RC1,1,3,1,Menus!R10C11))=T(R1C),RC4,NA()) -> NA() | K241: =IF(OR(ISNUMBER(RC7),ISNUMBER(RC8),ISNUMBER(RC9),ISNUMBER(RC10)),1,0) -> 0 | M241: =OFFSET(INDIRECT(ADDRESS(RC1,3,3,1,"Gross")),0,Menus!R4C10) -> 0 | N241: =OFFSET(INDIRECT(ADDRESS(RC1,3,3,1,"Gross")),0,Menus!R3C10) -> 0
A242: 279 | B242: =OFFSET(INDIRECT(ADDRESS(RC1,3,3,1,Menus!R10C11)),0,Menus!R4C10) -> 0 | C242: =OFFSET(INDIRECT(ADDRESS(RC1,3,3,1,Menus!R10C11)),0,Menus!R3C10) -> 0 | D242: =IF(Menus!R9C10,RC[-1]/RC[-2],RC[-1]) -> #DIV/0! | E242: =IF(RC11=1,VALUE(RC[-3]),NA()) -> NA() | F242: =INDIRECT(ADDRESS(RC1,1,3,1,Menus!R10C11)) -> 0 | G242: =IF(INDIRECT(ADDRESS(RC1,2,3,1,Menus!R10C11))=R1C,RC4,NA()) -> NA() | H242: =IF(INDIRECT(ADDRESS(RC1,2,3,1,Menus!R10C11))=R1C,RC4,NA()) -> NA() | I242: =IF(INDIRECT(ADDRESS(RC1,2,3,1,Menus!R10C11))=R1C,RC4,NA()) -> NA() | J242: =IF(INDIRECT(ADDRESS(RC1,1,3,1,Menus!R10C11))=T(R1C),RC4,NA()) -> NA() | K242: =IF(OR(ISNUMBER(RC7),ISNUMBER(RC8),ISNUMBER(RC9),ISNUMBER(RC10)),1,0) -> 0 | M242: =OFFSET(INDIRECT(ADDRESS(RC1,3,3,1,"Gross")),0,Menus!R4C10) -> 0 | N242: =OFFSET(INDIRECT(ADDRESS(RC1,3,3,1,"Gross")),0,Menus!R3C10) -> 0
A243: 280 | B243: =OFFSET(INDIRECT(ADDRESS(RC1,3,3,1,Menus!R10C11)),0,Menus!R4C10) -> 0 | C243: =OFFSET(INDIRECT(ADDRESS(RC1,3,3,1,Menus!R10C11)),0,Menus!R3C10) -> 0 | D243: =IF(Menus!R9C10,RC[-1]/RC[-2],RC[-1]) -> #DIV/0! | E243: =IF(RC11=1,VALUE(RC[-3]),NA()) -> NA() | F243: =INDIRECT(ADDRESS(RC1,1,3,1,Menus!R10C11)) -> 0 | G243: =IF(INDIRECT(ADDRESS(RC1,2,3,1,Menus!R10C11))=R1C,RC4,NA()) -> NA() | H243: =IF(INDIRECT(ADDRESS(RC1,2,3,1,Menus!R10C11))=R1C,RC4,NA()) -> NA() | I243: =IF(INDIRECT(ADDRESS(RC1,2,3,1,Menus!R10C11))=R1C,RC4,NA()) -> NA() | J243: =IF(INDIRECT(ADDRESS(RC1,1,3,1,Menus!R10C11))=T(R1C),RC4,NA()) -> NA() | K243: =IF(OR(ISNUMBER(RC7),ISNUMBER(RC8),ISNUMBER(RC9),ISNUMBER(RC10)),1,0) -> 0 | M243: =OFFSET(INDIRECT(ADDRESS(RC1,3,3,1,"Gross")),0,Menus!R4C10) -> 0 | N243: =OFFSET(INDIRECT(ADDRESS(RC1,3,3,1,"Gross")),0,Menus!R3C10) -> 0
A244: 281 | B244: =OFFSET(INDIRECT(ADDRESS(RC1,3,3,1,Menus!R10C11)),0,Menus!R4C10) -> 0 | C244: =OFFSET(INDIRECT(ADDRESS(RC1,3,3,1,Menus!R10C11)),0,Menus!R3C10) -> 0 | D244: =IF(Menus!R9C10,RC[-1]/RC[-2],RC[-1]) -> #DIV/0! | E244: =IF(RC11=1,VALUE(RC[-3]),NA()) -> NA() | F244: =INDIRECT(ADDRESS(RC1,1,3,1,Menus!R10C11)) -> 0 | G244: =IF(INDIRECT(ADDRESS(RC1,2,3,1,Menus!R10C11))=R1C,RC4,NA()) -> NA() | H244: =IF(INDIRECT(ADDRESS(RC1,2,3,1,Menus!R10C11))=R1C,RC4,NA()) -> NA() | I244: =IF(INDIRECT(ADDRESS(RC1,2,3,1,Menus!R10C11))=R1C,RC4,NA()) -> NA() | J244: =IF(INDIRECT(ADDRESS(RC1,1,3,1,Menus!R10C11))=T(R1C),RC4,NA()) -> NA() | K244: =IF(OR(ISNUMBER(RC7),ISNUMBER(RC8),ISNUMBER(RC9),ISNUMBER(RC10)),1,0) -> 0 | M244: =OFFSET(INDIRECT(ADDRESS(RC1,3,3,1,"Gross")),0,Menus!R4C10) -> 0 | N244: =OFFSET(INDIRECT(ADDRESS(RC1,3,3,1,"Gross")),0,Menus!R3C10) -> 0
A245: 282 | B245: =OFFSET(INDIRECT(ADDRESS(RC1,3,3,1,Menus!R10C11)),0,Menus!R4C10) -> 0 | C245: =OFFSET(INDIRECT(ADDRESS(RC1,3,3,1,Menus!R10C11)),0,Menus!R3C10) -> 0 | D245: =IF(Menus!R9C10,RC[-1]/RC[-2],RC[-1]) -> #DIV/0! | E245: =IF(RC11=1,VALUE(RC[-3]),NA()) -> NA() | F245: =INDIRECT(ADDRESS(RC1,1,3,1,Menus!R10C11)) -> 0 | G245: =IF(INDIRECT(ADDRESS(RC1,2,3,1,Menus!R10C11))=R1C,RC4,NA()) -> NA() | H245: =IF(INDIRECT(ADDRESS(RC1,2,3,1,Menus!R10C11))=R1C,RC4,NA()) -> NA() | I245: =IF(INDIRECT(ADDRESS(RC1,2,3,1,Menus!R10C11))=R1C,RC4,NA()) -> NA() | J245: =IF(INDIRECT(ADDRESS(RC1,1,3,1,Menus!R10C11))=T(R1C),RC4,NA()) -> NA() | K245: =IF(OR(ISNUMBER(RC7),ISNUMBER(RC8),ISNUMBER(RC9),ISNUMBER(RC10)),1,0) -> 0 | M245: =OFFSET(INDIRECT(ADDRESS(RC1,3,3,1,"Gross")),0,Menus!R4C10) -> 0 | N245: =OFFSET(INDIRECT(ADDRESS(RC1,3,3,1,"Gross")),0,Menus!R3C10) -> 0
A246: 283 | B246: =OFFSET(INDIRECT(ADDRESS(RC1,3,3,1,Menus!R10C11)),0,Menus!R4C10) -> 0 | C246: =OFFSET(INDIRECT(ADDRESS(RC1,3,3,1,Menus!R10C11)),0,Menus!R3C10) -> 0 | D246: =IF(Menus!R9C10,RC[-1]/RC[-2],RC[-1]) -> #DIV/0! | E246: =IF(RC11=1,VALUE(RC[-3]),NA()) -> NA() | F246: =INDIRECT(ADDRESS(RC1,1,3,1,Menus!R10C11)) -> 0 | G246: =IF(INDIRECT(ADDRESS(RC1,2,3,1,Menus!R10C11))=R1C,RC4,NA()) -> NA() | H246: =IF(INDIRECT(ADDRESS(RC1,2,3,1,Menus!R10C11))=R1C,RC4,NA()) -> NA() | I246: =IF(INDIRECT(ADDRESS(RC1,2,3,1,Menus!R10C11))=R1C,RC4,NA()) -> NA() | J246: =IF(INDIRECT(ADDRESS(RC1,1,3,1,Menus!R10C11))=T(R1C),RC4,NA()) -> NA() | K246: =IF(OR(ISNUMBER(RC7),ISNUMBER(RC8),ISNUMBER(RC9),ISNUMBER(RC10)),1,0) -> 0 | M246: =OFFSET(INDIRECT(ADDRESS(RC1,3,3,1,"Gross")),0,Menus!R4C10) -> 0 | N246: =OFFSET(INDIRECT(ADDRESS(RC1,3,3,1,"Gross")),0,Menus!R3C10) -> 0
A247: 284 | B247: =OFFSET(INDIRECT(ADDRESS(RC1,3,3,1,Menus!R10C11)),0,Menus!R4C10) -> 0 | C247: =OFFSET(INDIRECT(ADDRESS(RC1,3,3,1,Menus!R10C11)),0,Menus!R3C10) -> 0 | D247: =IF(Menus!R9C10,RC[-1]/RC[-2],RC[-1]) -> #DIV/0! | E247: =IF(RC11=1,VALUE(RC[-3]),NA()) -> NA() | F247: =INDIRECT(ADDRESS(RC1,1,3,1,Menus!R10C11)) -> 0 | G247: =IF(INDIRECT(ADDRESS(RC1,2,3,1,Menus!R10C11))=R1C,RC4,NA()) -> NA() | H247: =IF(INDIRECT(ADDRESS(RC1,2,3,1,Menus!R10C11))=R1C,RC4,NA()) -> NA() | I247: =IF(INDIRECT(ADDRESS(RC1,2,3,1,Menus!R10C11))=R1C,RC4,NA()) -> NA() | J247: =IF(INDIRECT(ADDRESS(RC1,1,3,1,Menus!R10C11))=T(R1C),RC4,NA()) -> NA() | K247: =IF(OR(ISNUMBER(RC7),ISNUMBER(RC8),ISNUMBER(RC9),ISNUMBER(RC10)),1,0) -> 0 | M247: =OFFSET(INDIRECT(ADDRESS(RC1,3,3,1,"Gross")),0,Menus!R4C10) -> 0 | N247: =OFFSET(INDIRECT(ADDRESS(RC1,3,3,1,"Gross")),0,Menus!R3C10) -> 0
A248: 285 | B248: =OFFSET(INDIRECT(ADDRESS(RC1,3,3,1,Menus!R10C11)),0,Menus!R4C10) -> 0 | C248: =OFFSET(INDIRECT(ADDRESS(RC1,3,3,1,Menus!R10C11)),0,Menus!R3C10) -> 0 | D248: =IF(Menus!R9C10,RC[-1]/RC[-2],RC[-1]) -> #DIV/0! | E248: =IF(RC11=1,VALUE(RC[-3]),NA()) -> NA() | F248: =INDIRECT(ADDRESS(RC1,1,3,1,Menus!R10C11)) -> 0 | G248: =IF(INDIRECT(ADDRESS(RC1,2,3,1,Menus!R10C11))=R1C,RC4,NA()) -> NA() | H248: =IF(INDIRECT(ADDRESS(RC1,2,3,1,Menus!R10C11))=R1C,RC4,NA()) -> NA() | I248: =IF(INDIRECT(ADDRESS(RC1,2,3,1,Menus!R10C11))=R1C,RC4,NA()) -> NA() | J248: =IF(INDIRECT(ADDRESS(RC1,1,3,1,Menus!R10C11))=T(R1C),RC4,NA()) -> NA() | K248: =IF(OR(ISNUMBER(RC7),ISNUMBER(RC8),ISNUMBER(RC9),ISNUMBER(RC10)),1,0) -> 0 | M248: =OFFSET(INDIRECT(ADDRESS(RC1,3,3,1,"Gross")),0,Menus!R4C10) -> 0 | N248: =OFFSET(INDIRECT(ADDRESS(RC1,3,3,1,"Gross")),0,Menus!R3C10) -> 0
A249: 286 | B249: =OFFSET(INDIRECT(ADDRESS(RC1,3,3,1,Menus!R10C11)),0,Menus!R4C10) -> 0 | C249: =OFFSET(INDIRECT(ADDRESS(RC1,3,3,1,Menus!R10C11)),0,Menus!R3C10) -> 0 | D249: =IF(Menus!R9C10,RC[-1]/RC[-2],RC[-1]) -> #DIV/0! | E249: =IF(RC11=1,VALUE(RC[-3]),NA()) -> NA() | F249: =INDIRECT(ADDRESS(RC1,1,3,1,Menus!R10C11)) -> 0 | G249: =IF(INDIRECT(ADDRESS(RC1,2,3,1,Menus!R10C11))=R1C,RC4,NA()) -> NA() | H249: =IF(INDIRECT(ADDRESS(RC1,2,3,1,Menus!R10C11))=R1C,RC4,NA()) -> NA() | I249: =IF(INDIRECT(ADDRESS(RC1,2,3,1,Menus!R10C11))=R1C,RC4,NA()) -> NA() | J249: =IF(INDIRECT(ADDRESS(RC1,1,3,1,Menus!R10C11))=T(R1C),RC4,NA()) -> NA() | K249: =IF(OR(ISNUMBER(RC7),ISNUMBER(RC8),ISNUMBER(RC9),ISNUMBER(RC10)),1,0) -> 0 | M249: =OFFSET(INDIRECT(ADDRESS(RC1,3,3,1,"Gross")),0,Menus!R4C10) -> 0 | N249: =OFFSET(INDIRECT(ADDRESS(RC1,3,3,1,"Gross")),0,Menus!R3C10) -> 0
A250: 287 | B250: =OFFSET(INDIRECT(ADDRESS(RC1,3,3,1,Menus!R10C11)),0,Menus!R4C10) -> 0 | C250: =OFFSET(INDIRECT(ADDRESS(RC1,3,3,1,Menus!R10C11)),0,Menus!R3C10) -> 0 | D250: =IF(Menus!R9C10,RC[-1]/RC[-2],RC[-1]) -> #DIV/0! | E250: =IF(RC11=1,VALUE(RC[-3]),NA()) -> NA() | F250: =INDIRECT(ADDRESS(RC1,1,3,1,Menus!R10C11)) -> 0 | G250: =IF(INDIRECT(ADDRESS(RC1,2,3,1,Menus!R10C11))=R1C,RC4,NA()) -> NA() | H250: =IF(INDIRECT(ADDRESS(RC1,2,3,1,Menus!R10C11))=R1C,RC4,NA()) -> NA() | I250: =IF(INDIRECT(ADDRESS(RC1,2,3,1,Menus!R10C11))=R1C,RC4,NA()) -> NA() | J250: =IF(INDIRECT(ADDRESS(RC1,1,3,1,Menus!R10C11))=T(R1C),RC4,NA()) -> NA() | K250: =IF(OR(ISNUMBER(RC7),ISNUMBER(RC8),ISNUMBER(RC9),ISNUMBER(RC10)),1,0) -> 0 | M250: =OFFSET(INDIRECT(ADDRESS(RC1,3,3,1,"Gross")),0,Menus!R4C10) -> 0 | N250: =OFFSET(INDIRECT(ADDRESS(RC1,3,3,1,"Gross")),0,Menus!R3C10) -> 0
A251: 288 | B251: =OFFSET(INDIRECT(ADDRESS(RC1,3,3,1,Menus!R10C11)),0,Menus!R4C10) -> 0 | C251: =OFFSET(INDIRECT(ADDRESS(RC1,3,3,1,Menus!R10C11)),0,Menus!R3C10) -> 0 | D251: =IF(Menus!R9C10,RC[-1]/RC[-2],RC[-1]) -> #DIV/0! | E251: =IF(RC11=1,VALUE(RC[-3]),NA()) -> NA() | F251: =INDIRECT(ADDRESS(RC1,1,3,1,Menus!R10C11)) -> 0 | G251: =IF(INDIRECT(ADDRESS(RC1,2,3,1,Menus!R10C11))=R1C,RC4,NA()) -> NA() | H251: =IF(INDIRECT(ADDRESS(RC1,2,3,1,Menus!R10C11))=R1C,RC4,NA()) -> NA() | I251: =IF(INDIRECT(ADDRESS(RC1,2,3,1,Menus!R10C11))=R1C,RC4,NA()) -> NA() | J251: =IF(INDIRECT(ADDRESS(RC1,1,3,1,Menus!R10C11))=T(R1C),RC4,NA()) -> NA() | K251: =IF(OR(ISNUMBER(RC7),ISNUMBER(RC8),ISNUMBER(RC9),ISNUMBER(RC10)),1,0) -> 0 | M251: =OFFSET(INDIRECT(ADDRESS(RC1,3,3,1,"Gross")),0,Menus!R4C10) -> 0 | N251: =OFFSET(INDIRECT(ADDRESS(RC1,3,3,1,"Gross")),0,Menus!R3C10) -> 0
A252: 289 | B252: =OFFSET(INDIRECT(ADDRESS(RC1,3,3,1,Menus!R10C11)),0,Menus!R4C10) -> 0 | C252: =OFFSET(INDIRECT(ADDRESS(RC1,3,3,1,Menus!R10C11)),0,Menus!R3C10) -> 0 | D252: =IF(Menus!R9C10,RC[-1]/RC[-2],RC[-1]) -> #DIV/0! | E252: =IF(RC11=1,VALUE(RC[-3]),NA()) -> NA() | F252: =INDIRECT(ADDRESS(RC1,1,3,1,Menus!R10C11)) -> 0 | G252: =IF(INDIRECT(ADDRESS(RC1,2,3,1,Menus!R10C11))=R1C,RC4,NA()) -> NA() | H252: =IF(INDIRECT(ADDRESS(RC1,2,3,1,Menus!R10C11))=R1C,RC4,NA()) -> NA() | I252: =IF(INDIRECT(ADDRESS(RC1,2,3,1,Menus!R10C11))=R1C,RC4,NA()) -> NA() | J252: =IF(INDIRECT(ADDRESS(RC1,1,3,1,Menus!R10C11))=T(R1C),RC4,NA()) -> NA() | K252: =IF(OR(ISNUMBER(RC7),ISNUMBER(RC8),ISNUMBER(RC9),ISNUMBER(RC10)),1,0) -> 0 | M252: =OFFSET(INDIRECT(ADDRESS(RC1,3,3,1,"Gross")),0,Menus!R4C10) -> 0 | N252: =OFFSET(INDIRECT(ADDRESS(RC1,3,3,1,"Gross")),0,Menus!R3C10) -> 0
A253: 290 | B253: =OFFSET(INDIRECT(ADDRESS(RC1,3,3,1,Menus!R10C11)),0,Menus!R4C10) -> 0 | C253: =OFFSET(INDIRECT(ADDRESS(RC1,3,3,1,Menus!R10C11)),0,Menus!R3C10) -> 0 | D253: =IF(Menus!R9C10,RC[-1]/RC[-2],RC[-1]) -> #DIV/0! | E253: =IF(RC11=1,VALUE(RC[-3]),NA()) -> NA() | F253: =INDIRECT(ADDRESS(RC1,1,3,1,Menus!R10C11)) -> 0 | G253: =IF(INDIRECT(ADDRESS(RC1,2,3,1,Menus!R10C11))=R1C,RC4,NA()) -> NA() | H253: =IF(INDIRECT(ADDRESS(RC1,2,3,1,Menus!R10C11))=R1C,RC4,NA()) -> NA() | I253: =IF(INDIRECT(ADDRESS(RC1,2,3,1,Menus!R10C11))=R1C,RC4,NA()) -> NA() | J253: =IF(INDIRECT(ADDRESS(RC1,1,3,1,Menus!R10C11))=T(R1C),RC4,NA()) -> NA() | K253: =IF(OR(ISNUMBER(RC7),ISNUMBER(RC8),ISNUMBER(RC9),ISNUMBER(RC10)),1,0) -> 0 | M253: =OFFSET(INDIRECT(ADDRESS(RC1,3,3,1,"Gross")),0,Menus!R4C10) -> 0 | N253: =OFFSET(INDIRECT(ADDRESS(RC1,3,3,1,"Gross")),0,Menus!R3C10) -> 0
A254: 291 | B254: =OFFSET(INDIRECT(ADDRESS(RC1,3,3,1,Menus!R10C11)),0,Menus!R4C10) -> 0 | C254: =OFFSET(INDIRECT(ADDRESS(RC1,3,3,1,Menus!R10C11)),0,Menus!R3C10) -> 0 | D254: =IF(Menus!R9C10,RC[-1]/RC[-2],RC[-1]) -> #DIV/0! | E254: =IF(RC11=1,VALUE(RC[-3]),NA()) -> NA() | F254: =INDIRECT(ADDRESS(RC1,1,3,1,Menus!R10C11)) -> 0 | G254: =IF(INDIRECT(ADDRESS(RC1,2,3,1,Menus!R10C11))=R1C,RC4,NA()) -> NA() | H254: =IF(INDIRECT(ADDRESS(RC1,2,3,1,Menus!R10C11))=R1C,RC4,NA()) -> NA() | I254: =IF(INDIRECT(ADDRESS(RC1,2,3,1,Menus!R10C11))=R1C,RC4,NA()) -> NA() | J254: =IF(INDIRECT(ADDRESS(RC1,1,3,1,Menus!R10C11))=T(R1C),RC4,NA()) -> NA() | K254: =IF(OR(ISNUMBER(RC7),ISNUMBER(RC8),ISNUMBER(RC9),ISNUMBER(RC10)),1,0) -> 0 | M254: =OFFSET(INDIRECT(ADDRESS(RC1,3,3,1,"Gross")),0,Menus!R4C10) -> 0 | N254: =OFFSET(INDIRECT(ADDRESS(RC1,3,3,1,"Gross")),0,Menus!R3C10) -> 0
A255: 292 | B255: =OFFSET(INDIRECT(ADDRESS(RC1,3,3,1,Menus!R10C11)),0,Menus!R4C10) -> 0 | C255: =OFFSET(INDIRECT(ADDRESS(RC1,3,3,1,Menus!R10C11)),0,Menus!R3C10) -> 0 | D255: =IF(Menus!R9C10,RC[-1]/RC[-2],RC[-1]) -> #DIV/0! | E255: =IF(RC11=1,VALUE(RC[-3]),NA()) -> NA() | F255: =INDIRECT(ADDRESS(RC1,1,3,1,Menus!R10C11)) -> 0 | G255: =IF(INDIRECT(ADDRESS(RC1,2,3,1,Menus!R10C11))=R1C,RC4,NA()) -> NA() | H255: =IF(INDIRECT(ADDRESS(RC1,2,3,1,Menus!R10C11))=R1C,RC4,NA()) -> NA() | I255: =IF(INDIRECT(ADDRESS(RC1,2,3,1,Menus!R10C11))=R1C,RC4,NA()) -> NA() | J255: =IF(INDIRECT(ADDRESS(RC1,1,3,1,Menus!R10C11))=T(R1C),RC4,NA()) -> NA() | K255: =IF(OR(ISNUMBER(RC7),ISNUMBER(RC8),ISNUMBER(RC9),ISNUMBER(RC10)),1,0) -> 0 | M255: =OFFSET(INDIRECT(ADDRESS(RC1,3,3,1,"Gross")),0,Menus!R4C10) -> 0 | N255: =OFFSET(INDIRECT(ADDRESS(RC1,3,3,1,"Gross")),0,Menus!R3C10) -> 0
A256: 293 | B256: =OFFSET(INDIRECT(ADDRESS(RC1,3,3,1,Menus!R10C11)),0,Menus!R4C10) -> 0 | C256: =OFFSET(INDIRECT(ADDRESS(RC1,3,3,1,Menus!R10C11)),0,Menus!R3C10) -> 0 | D256: =IF(Menus!R9C10,RC[-1]/RC[-2],RC[-1]) -> #DIV/0! | E256: =IF(RC11=1,VALUE(RC[-3]),NA()) -> NA() | F256: =INDIRECT(ADDRESS(RC1,1,3,1,Menus!R10C11)) -> 0 | G256: =IF(INDIRECT(ADDRESS(RC1,2,3,1,Menus!R10C11))=R1C,RC4,NA()) -> NA() | H256: =IF(INDIRECT(ADDRESS(RC1,2,3,1,Menus!R10C11))=R1C,RC4,NA()) -> NA() | I256: =IF(INDIRECT(ADDRESS(RC1,2,3,1,Menus!R10C11))=R1C,RC4,NA()) -> NA() | J256: =IF(INDIRECT(ADDRESS(RC1,1,3,1,Menus!R10C11))=T(R1C),RC4,NA()) -> NA() | K256: =IF(OR(ISNUMBER(RC7),ISNUMBER(RC8),ISNUMBER(RC9),ISNUMBER(RC10)),1,0) -> 0 | M256: =OFFSET(INDIRECT(ADDRESS(RC1,3,3,1,"Gross")),0,Menus!R4C10) -> 0 | N256: =OFFSET(INDIRECT(ADDRESS(RC1,3,3,1,"Gross")),0,Menus!R3C10) -> 0
A257: 294 | B257: =OFFSET(INDIRECT(ADDRESS(RC1,3,3,1,Menus!R10C11)),0,Menus!R4C10) -> 0 | C257: =OFFSET(INDIRECT(ADDRESS(RC1,3,3,1,Menus!R10C11)),0,Menus!R3C10) -> 0 | D257: =IF(Menus!R9C10,RC[-1]/RC[-2],RC[-1]) -> #DIV/0! | E257: =IF(RC11=1,VALUE(RC[-3]),NA()) -> NA() | F257: =INDIRECT(ADDRESS(RC1,1,3,1,Menus!R10C11)) -> 0 | G257: =IF(INDIRECT(ADDRESS(RC1,2,3,1,Menus!R10C11))=R1C,RC4,NA()) -> NA() | H257: =IF(INDIRECT(ADDRESS(RC1,2,3,1,Menus!R10C11))=R1C,RC4,NA()) -> NA() | I257: =IF(INDIRECT(ADDRESS(RC1,2,3,1,Menus!R10C11))=R1C,RC4,NA()) -> NA() | J257: =IF(INDIRECT(ADDRESS(RC1,1,3,1,Menus!R10C11))=T(R1C),RC4,NA()) -> NA() | K257: =IF(OR(ISNUMBER(RC7),ISNUMBER(RC8),ISNUMBER(RC9),ISNUMBER(RC10)),1,0) -> 0 | M257: =OFFSET(INDIRECT(ADDRESS(RC1,3,3,1,"Gross")),0,Menus!R4C10) -> 0 | N257: =OFFSET(INDIRECT(ADDRESS(RC1,3,3,1,"Gross")),0,Menus!R3C10) -> 0
A258: 295 | B258: =OFFSET(INDIRECT(ADDRESS(RC1,3,3,1,Menus!R10C11)),0,Menus!R4C10) -> 0 | C258: =OFFSET(INDIRECT(ADDRESS(RC1,3,3,1,Menus!R10C11)),0,Menus!R3C10) -> 0 | D258: =IF(Menus!R9C10,RC[-1]/RC[-2],RC[-1]) -> #DIV/0! | E258: =IF(RC11=1,VALUE(RC[-3]),NA()) -> NA() | F258: =INDIRECT(ADDRESS(RC1,1,3,1,Menus!R10C11)) -> 0 | G258: =IF(INDIRECT(ADDRESS(RC1,2,3,1,Menus!R10C11))=R1C,RC4,NA()) -> NA() | H258: =IF(INDIRECT(ADDRESS(RC1,2,3,1,Menus!R10C11))=R1C,RC4,NA()) -> NA() | I258: =IF(INDIRECT(ADDRESS(RC1,2,3,1,Menus!R10C11))=R1C,RC4,NA()) -> NA() | J258: =IF(INDIRECT(ADDRESS(RC1,1,3,1,Menus!R10C11))=T(R1C),RC4,NA()) -> NA() | K258: =IF(OR(ISNUMBER(RC7),ISNUMBER(RC8),ISNUMBER(RC9),ISNUMBER(RC10)),1,0) -> 0 | M258: =OFFSET(INDIRECT(ADDRESS(RC1,3,3,1,"Gross")),0,Menus!R4C10) -> 0 | N258: =OFFSET(INDIRECT(ADDRESS(RC1,3,3,1,"Gross")),0,Menus!R3C10) -> 0
A259: 296 | B259: =OFFSET(INDIRECT(ADDRESS(RC1,3,3,1,Menus!R10C11)),0,Menus!R4C10) -> 0 | C259: =OFFSET(INDIRECT(ADDRESS(RC1,3,3,1,Menus!R10C11)),0,Menus!R3C10) -> 0 | D259: =IF(Menus!R9C10,RC[-1]/RC[-2],RC[-1]) -> #DIV/0! | E259: =IF(RC11=1,VALUE(RC[-3]),NA()) -> NA() | F259: =INDIRECT(ADDRESS(RC1,1,3,1,Menus!R10C11)) -> 0 | G259: =IF(INDIRECT(ADDRESS(RC1,2,3,1,Menus!R10C11))=R1C,RC4,NA()) -> NA() | H259: =IF(INDIRECT(ADDRESS(RC1,2,3,1,Menus!R10C11))=R1C,RC4,NA()) -> NA() | I259: =IF(INDIRECT(ADDRESS(RC1,2,3,1,Menus!R10C11))=R1C,RC4,NA()) -> NA() | J259: =IF(INDIRECT(ADDRESS(RC1,1,3,1,Menus!R10C11))=T(R1C),RC4,NA()) -> NA() | K259: =IF(OR(ISNUMBER(RC7),ISNUMBER(RC8),ISNUMBER(RC9),ISNUMBER(RC10)),1,0) -> 0 | M259: =OFFSET(INDIRECT(ADDRESS(RC1,3,3,1,"Gross")),0,Menus!R4C10) -> 0 | N259: =OFFSET(INDIRECT(ADDRESS(RC1,3,3,1,"Gross")),0,Menus!R3C10) -> 0
A260: 297 | B260: =OFFSET(INDIRECT(ADDRESS(RC1,3,3,1,Menus!R10C11)),0,Menus!R4C10) -> 0 | C260: =OFFSET(INDIRECT(ADDRESS(RC1,3,3,1,Menus!R10C11)),0,Menus!R3C10) -> 0 | D260: =IF(Menus!R9C10,RC[-1]/RC[-2],RC[-1]) -> #DIV/0! | E260: =IF(RC11=1,VALUE(RC[-3]),NA()) -> NA() | F260: =INDIRECT(ADDRESS(RC1,1,3,1,Menus!R10C11)) -> 0 | G260: =IF(INDIRECT(ADDRESS(RC1,2,3,1,Menus!R10C11))=R1C,RC4,NA()) -> NA() | H260: =IF(INDIRECT(ADDRESS(RC1,2,3,1,Menus!R10C11))=R1C,RC4,NA()) -> NA() | I260: =IF(INDIRECT(ADDRESS(RC1,2,3,1,Menus!R10C11))=R1C,RC4,NA()) -> NA() | J260: =IF(INDIRECT(ADDRESS(RC1,1,3,1,Menus!R10C11))=T(R1C),RC4,NA()) -> NA() | K260: =IF(OR(ISNUMBER(RC7),ISNUMBER(RC8),ISNUMBER(RC9),ISNUMBER(RC10)),1,0) -> 0 | M260: =OFFSET(INDIRECT(ADDRESS(RC1,3,3,1,"Gross")),0,Menus!R4C10) -> 0 | N260: =OFFSET(INDIRECT(ADDRESS(RC1,3,3,1,"Gross")),0,Menus!R3C10) -> 0
A261: 298 | B261: =OFFSET(INDIRECT(ADDRESS(RC1,3,3,1,Menus!R10C11)),0,Menus!R4C10) -> 0 | C261: =OFFSET(INDIRECT(ADDRESS(RC1,3,3,1,Menus!R10C11)),0,Menus!R3C10) -> 0 | D261: =IF(Menus!R9C10,RC[-1]/RC[-2],RC[-1]) -> #DIV/0! | E261: =IF(RC11=1,VALUE(RC[-3]),NA()) -> NA() | F261: =INDIRECT(ADDRESS(RC1,1,3,1,Menus!R10C11)) -> 0 | G261: =IF(INDIRECT(ADDRESS(RC1,2,3,1,Menus!R10C11))=R1C,RC4,NA()) -> NA() | H261: =IF(INDIRECT(ADDRESS(RC1,2,3,1,Menus!R10C11))=R1C,RC4,NA()) -> NA() | I261: =IF(INDIRECT(ADDRESS(RC1,2,3,1,Menus!R10C11))=R1C,RC4,NA()) -> NA() | J261: =IF(INDIRECT(ADDRESS(RC1,1,3,1,Menus!R10C11))=T(R1C),RC4,NA()) -> NA() | K261: =IF(OR(ISNUMBER(RC7),ISNUMBER(RC8),ISNUMBER(RC9),ISNUMBER(RC10)),1,0) -> 0 | M261: =OFFSET(INDIRECT(ADDRESS(RC1,3,3,1,"Gross")),0,Menus!R4C10) -> 0 | N261: =OFFSET(INDIRECT(ADDRESS(RC1,3,3,1,"Gross")),0,Menus!R3C10) -> 0
A262: 299 | B262: =OFFSET(INDIRECT(ADDRESS(RC1,3,3,1,Menus!R10C11)),0,Menus!R4C10) -> 0 | C262: =OFFSET(INDIRECT(ADDRESS(RC1,3,3,1,Menus!R10C11)),0,Menus!R3C10) -> 0 | D262: =IF(Menus!R9C10,RC[-1]/RC[-2],RC[-1]) -> #DIV/0! | E262: =IF(RC11=1,VALUE(RC[-3]),NA()) -> NA() | F262: =INDIRECT(ADDRESS(RC1,1,3,1,Menus!R10C11)) -> 0 | G262: =IF(INDIRECT(ADDRESS(RC1,2,3,1,Menus!R10C11))=R1C,RC4,NA()) -> NA() | H262: =IF(INDIRECT(ADDRESS(RC1,2,3,1,Menus!R10C11))=R1C,RC4,NA()) -> NA() | I262: =IF(INDIRECT(ADDRESS(RC1,2,3,1,Menus!R10C11))=R1C,RC4,NA()) -> NA() | J262: =IF(INDIRECT(ADDRESS(RC1,1,3,1,Menus!R10C11))=T(R1C),RC4,NA()) -> NA() | K262: =IF(OR(ISNUMBER(RC7),ISNUMBER(RC8),ISNUMBER(RC9),ISNUMBER(RC10)),1,0) -> 0 | M262: =OFFSET(INDIRECT(ADDRESS(RC1,3,3,1,"Gross")),0,Menus!R4C10) -> 0 | N262: =OFFSET(INDIRECT(ADDRESS(RC1,3,3,1,"Gross")),0,Menus!R3C10) -> 0
A263: 300 | B263: =OFFSET(INDIRECT(ADDRESS(RC1,3,3,1,Menus!R10C11)),0,Menus!R4C10) -> 0 | C263: =OFFSET(INDIRECT(ADDRESS(RC1,3,3,1,Menus!R10C11)),0,Menus!R3C10) -> 0 | D263: =IF(Menus!R9C10,RC[-1]/RC[-2],RC[-1]) -> #DIV/0! | E263: =IF(RC11=1,VALUE(RC[-3]),NA()) -> NA() | F263: =INDIRECT(ADDRESS(RC1,1,3,1,Menus!R10C11)) -> 0 | G263: =IF(INDIRECT(ADDRESS(RC1,2,3,1,Menus!R10C11))=R1C,RC4,NA()) -> NA() | H263: =IF(INDIRECT(ADDRESS(RC1,2,3,1,Menus!R10C11))=R1C,RC4,NA()) -> NA() | I263: =IF(INDIRECT(ADDRESS(RC1,2,3,1,Menus!R10C11))=R1C,RC4,NA()) -> NA() | J263: =IF(INDIRECT(ADDRESS(RC1,1,3,1,Menus!R10C11))=T(R1C),RC4,NA()) -> NA() | K263: =IF(OR(ISNUMBER(RC7),ISNUMBER(RC8),ISNUMBER(RC9),ISNUMBER(RC10)),1,0) -> 0 | M263: =OFFSET(INDIRECT(ADDRESS(RC1,3,3,1,"Gross")),0,Menus!R4C10) -> 0 | N263: =OFFSET(INDIRECT(ADDRESS(RC1,3,3,1,"Gross")),0,Menus!R3C10) -> 0
A264: 301 | B264: =OFFSET(INDIRECT(ADDRESS(RC1,3,3,1,Menus!R10C11)),0,Menus!R4C10) -> 0 | C264: =OFFSET(INDIRECT(ADDRESS(RC1,3,3,1,Menus!R10C11)),0,Menus!R3C10) -> 0 | D264: =IF(Menus!R9C10,RC[-1]/RC[-2],RC[-1]) -> #DIV/0! | E264: =IF(RC11=1,VALUE(RC[-3]),NA()) -> NA() | F264: =INDIRECT(ADDRESS(RC1,1,3,1,Menus!R10C11)) -> 0 | G264: =IF(INDIRECT(ADDRESS(RC1,2,3,1,Menus!R10C11))=R1C,RC4,NA()) -> NA() | H264: =IF(INDIRECT(ADDRESS(RC1,2,3,1,Menus!R10C11))=R1C,RC4,NA()) -> NA() | I264: =IF(INDIRECT(ADDRESS(RC1,2,3,1,Menus!R10C11))=R1C,RC4,NA()) -> NA() | J264: =IF(INDIRECT(ADDRESS(RC1,1,3,1,Menus!R10C11))=T(R1C),RC4,NA()) -> NA() | K264: =IF(OR(ISNUMBER(RC7),ISNUMBER(RC8),ISNUMBER(RC9),ISNUMBER(RC10)),1,0) -> 0 | M264: =OFFSET(INDIRECT(ADDRESS(RC1,3,3,1,"Gross")),0,Menus!R4C10) -> 0 | N264: =OFFSET(INDIRECT(ADDRESS(RC1,3,3,1,"Gross")),0,Menus!R3C10) -> 0
A265: 302 | B265: =OFFSET(INDIRECT(ADDRESS(RC1,3,3,1,Menus!R10C11)),0,Menus!R4C10) -> 0 | C265: =OFFSET(INDIRECT(ADDRESS(RC1,3,3,1,Menus!R10C11)),0,Menus!R3C10) -> 0 | D265: =IF(Menus!R9C10,RC[-1]/RC[-2],RC[-1]) -> #DIV/0! | E265: =IF(RC11=1,VALUE(RC[-3]),NA()) -> NA() | F265: =INDIRECT(ADDRESS(RC1,1,3,1,Menus!R10C11)) -> 0 | G265: =IF(INDIRECT(ADDRESS(RC1,2,3,1,Menus!R10C11))=R1C,RC4,NA()) -> NA() | H265: =IF(INDIRECT(ADDRESS(RC1,2,3,1,Menus!R10C11))=R1C,RC4,NA()) -> NA() | I265: =IF(INDIRECT(ADDRESS(RC1,2,3,1,Menus!R10C11))=R1C,RC4,NA()) -> NA() | J265: =IF(INDIRECT(ADDRESS(RC1,1,3,1,Menus!R10C11))=T(R1C),RC4,NA()) -> NA() | K265: =IF(OR(ISNUMBER(RC7),ISNUMBER(RC8),ISNUMBER(RC9),ISNUMBER(RC10)),1,0) -> 0 | M265: =OFFSET(INDIRECT(ADDRESS(RC1,3,3,1,"Gross")),0,Menus!R4C10) -> 0 | N265: =OFFSET(INDIRECT(ADDRESS(RC1,3,3,1,"Gross")),0,Menus!R3C10) -> 0
A266: 303 | B266: =OFFSET(INDIRECT(ADDRESS(RC1,3,3,1,Menus!R10C11)),0,Menus!R4C10) -> 0 | C266: =OFFSET(INDIRECT(ADDRESS(RC1,3,3,1,Menus!R10C11)),0,Menus!R3C10) -> 0 | D266: =IF(Menus!R9C10,RC[-1]/RC[-2],RC[-1]) -> #DIV/0! | E266: =IF(RC11=1,VALUE(RC[-3]),NA()) -> NA() | F266: =INDIRECT(ADDRESS(RC1,1,3,1,Menus!R10C11)) -> 0 | G266: =IF(INDIRECT(ADDRESS(RC1,2,3,1,Menus!R10C11))=R1C,RC4,NA()) -> NA() | H266: =IF(INDIRECT(ADDRESS(RC1,2,3,1,Menus!R10C11))=R1C,RC4,NA()) -> NA() | I266: =IF(INDIRECT(ADDRESS(RC1,2,3,1,Menus!R10C11))=R1C,RC4,NA()) -> NA() | J266: =IF(INDIRECT(ADDRESS(RC1,1,3,1,Menus!R10C11))=T(R1C),RC4,NA()) -> NA() | K266: =IF(OR(ISNUMBER(RC7),ISNUMBER(RC8),ISNUMBER(RC9),ISNUMBER(RC10)),1,0) -> 0 | M266: =OFFSET(INDIRECT(ADDRESS(RC1,3,3,1,"Gross")),0,Menus!R4C10) -> 0 | N266: =OFFSET(INDIRECT(ADDRESS(RC1,3,3,1,"Gross")),0,Menus!R3C10) -> 0
A267: 304 | B267: =OFFSET(INDIRECT(ADDRESS(RC1,3,3,1,Menus!R10C11)),0,Menus!R4C10) -> 0 | C267: =OFFSET(INDIRECT(ADDRESS(RC1,3,3,1,Menus!R10C11)),0,Menus!R3C10) -> 0 | D267: =IF(Menus!R9C10,RC[-1]/RC[-2],RC[-1]) -> #DIV/0! | E267: =IF(RC11=1,VALUE(RC[-3]),NA()) -> NA() | F267: =INDIRECT(ADDRESS(RC1,1,3,1,Menus!R10C11)) -> 0 | G267: =IF(INDIRECT(ADDRESS(RC1,2,3,1,Menus!R10C11))=R1C,RC4,NA()) -> NA() | H267: =IF(INDIRECT(ADDRESS(RC1,2,3,1,Menus!R10C11))=R1C,RC4,NA()) -> NA() | I267: =IF(INDIRECT(ADDRESS(RC1,2,3,1,Menus!R10C11))=R1C,RC4,NA()) -> NA() | J267: =IF(INDIRECT(ADDRESS(RC1,1,3,1,Menus!R10C11))=T(R1C),RC4,NA()) -> NA() | K267: =IF(OR(ISNUMBER(RC7),ISNUMBER(RC8),ISNUMBER(RC9),ISNUMBER(RC10)),1,0) -> 0 | M267: =OFFSET(INDIRECT(ADDRESS(RC1,3,3,1,"Gross")),0,Menus!R4C10) -> 0 | N267: =OFFSET(INDIRECT(ADDRESS(RC1,3,3,1,"Gross")),0,Menus!R3C10) -> 0
A268: 305 | B268: =OFFSET(INDIRECT(ADDRESS(RC1,3,3,1,Menus!R10C11)),0,Menus!R4C10) -> 0 | C268: =OFFSET(INDIRECT(ADDRESS(RC1,3,3,1,Menus!R10C11)),0,Menus!R3C10) -> 0 | D268: =IF(Menus!R9C10,RC[-1]/RC[-2],RC[-1]) -> #DIV/0! | E268: =IF(RC11=1,VALUE(RC[-3]),NA()) -> NA() | F268: =INDIRECT(ADDRESS(RC1,1,3,1,Menus!R10C11)) -> 0 | G268: =IF(INDIRECT(ADDRESS(RC1,2,3,1,Menus!R10C11))=R1C,RC4,NA()) -> NA() | H268: =IF(INDIRECT(ADDRESS(RC1,2,3,1,Menus!R10C11))=R1C,RC4,NA()) -> NA() | I268: =IF(INDIRECT(ADDRESS(RC1,2,3,1,Menus!R10C11))=R1C,RC4,NA()) -> NA() | J268: =IF(INDIRECT(ADDRESS(RC1,1,3,1,Menus!R10C11))=T(R1C),RC4,NA()) -> NA() | K268: =IF(OR(ISNUMBER(RC7),ISNUMBER(RC8),ISNUMBER(RC9),ISNUMBER(RC10)),1,0) -> 0 | M268: =OFFSET(INDIRECT(ADDRESS(RC1,3,3,1,"Gross")),0,Menus!R4C10) -> 0 | N268: =OFFSET(INDIRECT(ADDRESS(RC1,3,3,1,"Gross")),0,Menus!R3C10) -> 0
A269: 306 | B269: =OFFSET(INDIRECT(ADDRESS(RC1,3,3,1,Menus!R10C11)),0,Menus!R4C10) -> 0 | C269: =OFFSET(INDIRECT(ADDRESS(RC1,3,3,1,Menus!R10C11)),0,Menus!R3C10) -> 0 | D269: =IF(Menus!R9C10,RC[-1]/RC[-2],RC[-1]) -> #DIV/0! | E269: =IF(RC11=1,VALUE(RC[-3]),NA()) -> NA() | F269: =INDIRECT(ADDRESS(RC1,1,3,1,Menus!R10C11)) -> 0 | G269: =IF(INDIRECT(ADDRESS(RC1,2,3,1,Menus!R10C11))=R1C,RC4,NA()) -> NA() | H269: =IF(INDIRECT(ADDRESS(RC1,2,3,1,Menus!R10C11))=R1C,RC4,NA()) -> NA() | I269: =IF(INDIRECT(ADDRESS(RC1,2,3,1,Menus!R10C11))=R1C,RC4,NA()) -> NA() | J269: =IF(INDIRECT(ADDRESS(RC1,1,3,1,Menus!R10C11))=T(R1C),RC4,NA()) -> NA() | K269: =IF(OR(ISNUMBER(RC7),ISNUMBER(RC8),ISNUMBER(RC9),ISNUMBER(RC10)),1,0) -> 0 | M269: =OFFSET(INDIRECT(ADDRESS(RC1,3,3,1,"Gross")),0,Menus!R4C10) -> 0 | N269: =OFFSET(INDIRECT(ADDRESS(RC1,3,3,1,"Gross")),0,Menus!R3C10) -> 0
A270: 307 | B270: =OFFSET(INDIRECT(ADDRESS(RC1,3,3,1,Menus!R10C11)),0,Menus!R4C10) -> 0 | C270: =OFFSET(INDIRECT(ADDRESS(RC1,3,3,1,Menus!R10C11)),0,Menus!R3C10) -> 0 | D270: =IF(Menus!R9C10,RC[-1]/RC[-2],RC[-1]) -> #DIV/0! | E270: =IF(RC11=1,VALUE(RC[-3]),NA()) -> NA() | F270: =INDIRECT(ADDRESS(RC1,1,3,1,Menus!R10C11)) -> 0 | G270: =IF(INDIRECT(ADDRESS(RC1,2,3,1,Menus!R10C11))=R1C,RC4,NA()) -> NA() | H270: =IF(INDIRECT(ADDRESS(RC1,2,3,1,Menus!R10C11))=R1C,RC4,NA()) -> NA() | I270: =IF(INDIRECT(ADDRESS(RC1,2,3,1,Menus!R10C11))=R1C,RC4,NA()) -> NA() | J270: =IF(INDIRECT(ADDRESS(RC1,1,3,1,Menus!R10C11))=T(R1C),RC4,NA()) -> NA() | K270: =IF(OR(ISNUMBER(RC7),ISNUMBER(RC8),ISNUMBER(RC9),ISNUMBER(RC10)),1,0) -> 0 | M270: =OFFSET(INDIRECT(ADDRESS(RC1,3,3,1,"Gross")),0,Menus!R4C10) -> 0 | N270: =OFFSET(INDIRECT(ADDRESS(RC1,3,3,1,"Gross")),0,Menus!R3C10) -> 0
A271: 308 | B271: =OFFSET(INDIRECT(ADDRESS(RC1,3,3,1,Menus!R10C11)),0,Menus!R4C10) -> 0 | C271: =OFFSET(INDIRECT(ADDRESS(RC1,3,3,1,Menus!R10C11)),0,Menus!R3C10) -> 0 | D271: =IF(Menus!R9C10,RC[-1]/RC[-2],RC[-1]) -> #DIV/0! | E271: =IF(RC11=1,VALUE(RC[-3]),NA()) -> NA() | F271: =INDIRECT(ADDRESS(RC1,1,3,1,Menus!R10C11)) -> 0 | G271: =IF(INDIRECT(ADDRESS(RC1,2,3,1,Menus!R10C11))=R1C,RC4,NA()) -> NA() | H271: =IF(INDIRECT(ADDRESS(RC1,2,3,1,Menus!R10C11))=R1C,RC4,NA()) -> NA() | I271: =IF(INDIRECT(ADDRESS(RC1,2,3,1,Menus!R10C11))=R1C,RC4,NA()) -> NA() | J271: =IF(INDIRECT(ADDRESS(RC1,1,3,1,Menus!R10C11))=T(R1C),RC4,NA()) -> NA() | K271: =IF(OR(ISNUMBER(RC7),ISNUMBER(RC8),ISNUMBER(RC9),ISNUMBER(RC10)),1,0) -> 0 | M271: =OFFSET(INDIRECT(ADDRESS(RC1,3,3,1,"Gross")),0,Menus!R4C10) -> 0 | N271: =OFFSET(INDIRECT(ADDRESS(RC1,3,3,1,"Gross")),0,Menus!R3C10) -> 0
A272: 309 | B272: =OFFSET(INDIRECT(ADDRESS(RC1,3,3,1,Menus!R10C11)),0,Menus!R4C10) -> 0 | C272: =OFFSET(INDIRECT(ADDRESS(RC1,3,3,1,Menus!R10C11)),0,Menus!R3C10) -> 0 | D272: =IF(Menus!R9C10,RC[-1]/RC[-2],RC[-1]) -> #DIV/0! | E272: =IF(RC11=1,VALUE(RC[-3]),NA()) -> NA() | F272: =INDIRECT(ADDRESS(RC1,1,3,1,Menus!R10C11)) -> 0 | G272: =IF(INDIRECT(ADDRESS(RC1,2,3,1,Menus!R10C11))=R1C,RC4,NA()) -> NA() | H272: =IF(INDIRECT(ADDRESS(RC1,2,3,1,Menus!R10C11))=R1C,RC4,NA()) -> NA() | I272: =IF(INDIRECT(ADDRESS(RC1,2,3,1,Menus!R10C11))=R1C,RC4,NA()) -> NA() | J272: =IF(INDIRECT(ADDRESS(RC1,1,3,1,Menus!R10C11))=T(R1C),RC4,NA()) -> NA() | K272: =IF(OR(ISNUMBER(RC7),ISNUMBER(RC8),ISNUMBER(RC9),ISNUMBER(RC10)),1,0) -> 0 | M272: =OFFSET(INDIRECT(ADDRESS(RC1,3,3,1,"Gross")),0,Menus!R4C10) -> 0 | N272: =OFFSET(INDIRECT(ADDRESS(RC1,3,3,1,"Gross")),0,Menus!R3C10) -> 0
A273: 310 | B273: =OFFSET(INDIRECT(ADDRESS(RC1,3,3,1,Menus!R10C11)),0,Menus!R4C10) -> 0 | C273: =OFFSET(INDIRECT(ADDRESS(RC1,3,3,1,Menus!R10C11)),0,Menus!R3C10) -> 0 | D273: =IF(Menus!R9C10,RC[-1]/RC[-2],RC[-1]) -> #DIV/0! | E273: =IF(RC11=1,VALUE(RC[-3]),NA()) -> NA() | F273: =INDIRECT(ADDRESS(RC1,1,3,1,Menus!R10C11)) -> 0 | G273: =IF(INDIRECT(ADDRESS(RC1,2,3,1,Menus!R10C11))=R1C,RC4,NA()) -> NA() | H273: =IF(INDIRECT(ADDRESS(RC1,2,3,1,Menus!R10C11))=R1C,RC4,NA()) -> NA() | I273: =IF(INDIRECT(ADDRESS(RC1,2,3,1,Menus!R10C11))=R1C,RC4,NA()) -> NA() | J273: =IF(INDIRECT(ADDRESS(RC1,1,3,1,Menus!R10C11))=T(R1C),RC4,NA()) -> NA() | K273: =IF(OR(ISNUMBER(RC7),ISNUMBER(RC8),ISNUMBER(RC9),ISNUMBER(RC10)),1,0) -> 0 | M273: =OFFSET(INDIRECT(ADDRESS(RC1,3,3,1,"Gross")),0,Menus!R4C10) -> 0 | N273: =OFFSET(INDIRECT(ADDRESS(RC1,3,3,1,"Gross")),0,Menus!R3C10) -> 0
A274: 311 | B274: =OFFSET(INDIRECT(ADDRESS(RC1,3,3,1,Menus!R10C11)),0,Menus!R4C10) -> 0 | C274: =OFFSET(INDIRECT(ADDRESS(RC1,3,3,1,Menus!R10C11)),0,Menus!R3C10) -> 0 | D274: =IF(Menus!R9C10,RC[-1]/RC[-2],RC[-1]) -> #DIV/0! | E274: =IF(RC11=1,VALUE(RC[-3]),NA()) -> NA() | F274: =INDIRECT(ADDRESS(RC1,1,3,1,Menus!R10C11)) -> 0 | G274: =IF(INDIRECT(ADDRESS(RC1,2,3,1,Menus!R10C11))=R1C,RC4,NA()) -> NA() | H274: =IF(INDIRECT(ADDRESS(RC1,2,3,1,Menus!R10C11))=R1C,RC4,NA()) -> NA() | I274: =IF(INDIRECT(ADDRESS(RC1,2,3,1,Menus!R10C11))=R1C,RC4,NA()) -> NA() | J274: =IF(INDIRECT(ADDRESS(RC1,1,3,1,Menus!R10C11))=T(R1C),RC4,NA()) -> NA() | K274: =IF(OR(ISNUMBER(RC7),ISNUMBER(RC8),ISNUMBER(RC9),ISNUMBER(RC10)),1,0) -> 0 | M274: =OFFSET(INDIRECT(ADDRESS(RC1,3,3,1,"Gross")),0,Menus!R4C10) -> 0 | N274: =OFFSET(INDIRECT(ADDRESS(RC1,3,3,1,"Gross")),0,Menus!R3C10) -> 0
A275: 312 | B275: =OFFSET(INDIRECT(ADDRESS(RC1,3,3,1,Menus!R10C11)),0,Menus!R4C10) -> 0 | C275: =OFFSET(INDIRECT(ADDRESS(RC1,3,3,1,Menus!R10C11)),0,Menus!R3C10) -> 0 | D275: =IF(Menus!R9C10,RC[-1]/RC[-2],RC[-1]) -> #DIV/0! | E275: =IF(RC11=1,VALUE(RC[-3]),NA()) -> NA() | F275: =INDIRECT(ADDRESS(RC1,1,3,1,Menus!R10C11)) -> 0 | G275: =IF(INDIRECT(ADDRESS(RC1,2,3,1,Menus!R10C11))=R1C,RC4,NA()) -> NA() | H275: =IF(INDIRECT(ADDRESS(RC1,2,3,1,Menus!R10C11))=R1C,RC4,NA()) -> NA() | I275: =IF(INDIRECT(ADDRESS(RC1,2,3,1,Menus!R10C11))=R1C,RC4,NA()) -> NA() | J275: =IF(INDIRECT(ADDRESS(RC1,1,3,1,Menus!R10C11))=T(R1C),RC4,NA()) -> NA() | K275: =IF(OR(ISNUMBER(RC7),ISNUMBER(RC8),ISNUMBER(RC9),ISNUMBER(RC10)),1,0) -> 0 | M275: =OFFSET(INDIRECT(ADDRESS(RC1,3,3,1,"Gross")),0,Menus!R4C10) -> 0 | N275: =OFFSET(INDIRECT(ADDRESS(RC1,3,3,1,"Gross")),0,Menus!R3C10) -> 0
A276: 313 | B276: =OFFSET(INDIRECT(ADDRESS(RC1,3,3,1,Menus!R10C11)),0,Menus!R4C10) -> 0 | C276: =OFFSET(INDIRECT(ADDRESS(RC1,3,3,1,Menus!R10C11)),0,Menus!R3C10) -> 0 | D276: =IF(Menus!R9C10,RC[-1]/RC[-2],RC[-1]) -> #DIV/0! | E276: =IF(RC11=1,VALUE(RC[-3]),NA()) -> NA() | F276: =INDIRECT(ADDRESS(RC1,1,3,1,Menus!R10C11)) -> 0 | G276: =IF(INDIRECT(ADDRESS(RC1,2,3,1,Menus!R10C11))=R1C,RC4,NA()) -> NA() | H276: =IF(INDIRECT(ADDRESS(RC1,2,3,1,Menus!R10C11))=R1C,RC4,NA()) -> NA() | I276: =IF(INDIRECT(ADDRESS(RC1,2,3,1,Menus!R10C11))=R1C,RC4,NA()) -> NA() | J276: =IF(INDIRECT(ADDRESS(RC1,1,3,1,Menus!R10C11))=T(R1C),RC4,NA()) -> NA() | K276: =IF(OR(ISNUMBER(RC7),ISNUMBER(RC8),ISNUMBER(RC9),ISNUMBER(RC10)),1,0) -> 0 | M276: =OFFSET(INDIRECT(ADDRESS(RC1,3,3,1,"Gross")),0,Menus!R4C10) -> 0 | N276: =OFFSET(INDIRECT(ADDRESS(RC1,3,3,1,"Gross")),0,Menus!R3C10) -> 0
A277: 314 | B277: =OFFSET(INDIRECT(ADDRESS(RC1,3,3,1,Menus!R10C11)),0,Menus!R4C10) -> 0 | C277: =OFFSET(INDIRECT(ADDRESS(RC1,3,3,1,Menus!R10C11)),0,Menus!R3C10) -> 0 | D277: =IF(Menus!R9C10,RC[-1]/RC[-2],RC[-1]) -> #DIV/0! | E277: =IF(RC11=1,VALUE(RC[-3]),NA()) -> NA() | F277: =INDIRECT(ADDRESS(RC1,1,3,1,Menus!R10C11)) -> 0 | G277: =IF(INDIRECT(ADDRESS(RC1,2,3,1,Menus!R10C11))=R1C,RC4,NA()) -> NA() | H277: =IF(INDIRECT(ADDRESS(RC1,2,3,1,Menus!R10C11))=R1C,RC4,NA()) -> NA() | I277: =IF(INDIRECT(ADDRESS(RC1,2,3,1,Menus!R10C11))=R1C,RC4,NA()) -> NA() | J277: =IF(INDIRECT(ADDRESS(RC1,1,3,1,Menus!R10C11))=T(R1C),RC4,NA()) -> NA() | K277: =IF(OR(ISNUMBER(RC7),ISNUMBER(RC8),ISNUMBER(RC9),ISNUMBER(RC10)),1,0) -> 0 | M277: =OFFSET(INDIRECT(ADDRESS(RC1,3,3,1,"Gross")),0,Menus!R4C10) -> 0 | N277: =OFFSET(INDIRECT(ADDRESS(RC1,3,3,1,"Gross")),0,Menus!R3C10) -> 0
A278: 315 | B278: =OFFSET(INDIRECT(ADDRESS(RC1,3,3,1,Menus!R10C11)),0,Menus!R4C10) -> 0 | C278: =OFFSET(INDIRECT(ADDRESS(RC1,3,3,1,Menus!R10C11)),0,Menus!R3C10) -> 0 | D278: =IF(Menus!R9C10,RC[-1]/RC[-2],RC[-1]) -> #DIV/0! | E278: =IF(RC11=1,VALUE(RC[-3]),NA()) -> NA() | F278: =INDIRECT(ADDRESS(RC1,1,3,1,Menus!R10C11)) -> 0 | G278: =IF(INDIRECT(ADDRESS(RC1,2,3,1,Menus!R10C11))=R1C,RC4,NA()) -> NA() | H278: =IF(INDIRECT(ADDRESS(RC1,2,3,1,Menus!R10C11))=R1C,RC4,NA()) -> NA() | I278: =IF(INDIRECT(ADDRESS(RC1,2,3,1,Menus!R10C11))=R1C,RC4,NA()) -> NA() | J278: =IF(INDIRECT(ADDRESS(RC1,1,3,1,Menus!R10C11))=T(R1C),RC4,NA()) -> NA() | K278: =IF(OR(ISNUMBER(RC7),ISNUMBER(RC8),ISNUMBER(RC9),ISNUMBER(RC10)),1,0) -> 0 | M278: =OFFSET(INDIRECT(ADDRESS(RC1,3,3,1,"Gross")),0,Menus!R4C10) -> 0 | N278: =OFFSET(INDIRECT(ADDRESS(RC1,3,3,1,"Gross")),0,Menus!R3C10) -> 0
A279: 316 | B279: =OFFSET(INDIRECT(ADDRESS(RC1,3,3,1,Menus!R10C11)),0,Menus!R4C10) -> 0 | C279: =OFFSET(INDIRECT(ADDRESS(RC1,3,3,1,Menus!R10C11)),0,Menus!R3C10) -> 0 | D279: =IF(Menus!R9C10,RC[-1]/RC[-2],RC[-1]) -> #DIV/0! | E279: =IF(RC11=1,VALUE(RC[-3]),NA()) -> NA() | F279: =INDIRECT(ADDRESS(RC1,1,3,1,Menus!R10C11)) -> 0 | G279: =IF(INDIRECT(ADDRESS(RC1,2,3,1,Menus!R10C11))=R1C,RC4,NA()) -> NA() | H279: =IF(INDIRECT(ADDRESS(RC1,2,3,1,Menus!R10C11))=R1C,RC4,NA()) -> NA() | I279: =IF(INDIRECT(ADDRESS(RC1,2,3,1,Menus!R10C11))=R1C,RC4,NA()) -> NA() | J279: =IF(INDIRECT(ADDRESS(RC1,1,3,1,Menus!R10C11))=T(R1C),RC4,NA()) -> NA() | K279: =IF(OR(ISNUMBER(RC7),ISNUMBER(RC8),ISNUMBER(RC9),ISNUMBER(RC10)),1,0) -> 0 | M279: =OFFSET(INDIRECT(ADDRESS(RC1,3,3,1,"Gross")),0,Menus!R4C10) -> 0 | N279: =OFFSET(INDIRECT(ADDRESS(RC1,3,3,1,"Gross")),0,Menus!R3C10) -> 0
A280: 317 | B280: =OFFSET(INDIRECT(ADDRESS(RC1,3,3,1,Menus!R10C11)),0,Menus!R4C10) -> 0 | C280: =OFFSET(INDIRECT(ADDRESS(RC1,3,3,1,Menus!R10C11)),0,Menus!R3C10) -> 0 | D280: =IF(Menus!R9C10,RC[-1]/RC[-2],RC[-1]) -> #DIV/0! | E280: =IF(RC11=1,VALUE(RC[-3]),NA()) -> NA() | F280: =INDIRECT(ADDRESS(RC1,1,3,1,Menus!R10C11)) -> 0 | G280: =IF(INDIRECT(ADDRESS(RC1,2,3,1,Menus!R10C11))=R1C,RC4,NA()) -> NA() | H280: =IF(INDIRECT(ADDRESS(RC1,2,3,1,Menus!R10C11))=R1C,RC4,NA()) -> NA() | I280: =IF(INDIRECT(ADDRESS(RC1,2,3,1,Menus!R10C11))=R1C,RC4,NA()) -> NA() | J280: =IF(INDIRECT(ADDRESS(RC1,1,3,1,Menus!R10C11))=T(R1C),RC4,NA()) -> NA() | K280: =IF(OR(ISNUMBER(RC7),ISNUMBER(RC8),ISNUMBER(RC9),ISNUMBER(RC10)),1,0) -> 0 | M280: =OFFSET(INDIRECT(ADDRESS(RC1,3,3,1,"Gross")),0,Menus!R4C10) -> 0 | N280: =OFFSET(INDIRECT(ADDRESS(RC1,3,3,1,"Gross")),0,Menus!R3C10) -> 0
A281: 318 | B281: =OFFSET(INDIRECT(ADDRESS(RC1,3,3,1,Menus!R10C11)),0,Menus!R4C10) -> 0 | C281: =OFFSET(INDIRECT(ADDRESS(RC1,3,3,1,Menus!R10C11)),0,Menus!R3C10) -> 0 | D281: =IF(Menus!R9C10,RC[-1]/RC[-2],RC[-1]) -> #DIV/0! | E281: =IF(RC11=1,VALUE(RC[-3]),NA()) -> NA() | F281: =INDIRECT(ADDRESS(RC1,1,3,1,Menus!R10C11)) -> 0 | G281: =IF(INDIRECT(ADDRESS(RC1,2,3,1,Menus!R10C11))=R1C,RC4,NA()) -> NA() | H281: =IF(INDIRECT(ADDRESS(RC1,2,3,1,Menus!R10C11))=R1C,RC4,NA()) -> NA() | I281: =IF(INDIRECT(ADDRESS(RC1,2,3,1,Menus!R10C11))=R1C,RC4,NA()) -> NA() | J281: =IF(INDIRECT(ADDRESS(RC1,1,3,1,Menus!R10C11))=T(R1C),RC4,NA()) -> NA() | K281: =IF(OR(ISNUMBER(RC7),ISNUMBER(RC8),ISNUMBER(RC9),ISNUMBER(RC10)),1,0) -> 0 | M281: =OFFSET(INDIRECT(ADDRESS(RC1,3,3,1,"Gross")),0,Menus!R4C10) -> 0 | N281: =OFFSET(INDIRECT(ADDRESS(RC1,3,3,1,"Gross")),0,Menus!R3C10) -> 0
A282: 319 | B282: =OFFSET(INDIRECT(ADDRESS(RC1,3,3,1,Menus!R10C11)),0,Menus!R4C10) -> 0 | C282: =OFFSET(INDIRECT(ADDRESS(RC1,3,3,1,Menus!R10C11)),0,Menus!R3C10) -> 0 | D282: =IF(Menus!R9C10,RC[-1]/RC[-2],RC[-1]) -> #DIV/0! | E282: =IF(RC11=1,VALUE(RC[-3]),NA()) -> NA() | F282: =INDIRECT(ADDRESS(RC1,1,3,1,Menus!R10C11)) -> 0 | G282: =IF(INDIRECT(ADDRESS(RC1,2,3,1,Menus!R10C11))=R1C,RC4,NA()) -> NA() | H282: =IF(INDIRECT(ADDRESS(RC1,2,3,1,Menus!R10C11))=R1C,RC4,NA()) -> NA() | I282: =IF(INDIRECT(ADDRESS(RC1,2,3,1,Menus!R10C11))=R1C,RC4,NA()) -> NA() | J282: =IF(INDIRECT(ADDRESS(RC1,1,3,1,Menus!R10C11))=T(R1C),RC4,NA()) -> NA() | K282: =IF(OR(ISNUMBER(RC7),ISNUMBER(RC8),ISNUMBER(RC9),ISNUMBER(RC10)),1,0) -> 0 | M282: =OFFSET(INDIRECT(ADDRESS(RC1,3,3,1,"Gross")),0,Menus!R4C10) -> 0 | N282: =OFFSET(INDIRECT(ADDRESS(RC1,3,3,1,"Gross")),0,Menus!R3C10) -> 0
A283: 320 | B283: =OFFSET(INDIRECT(ADDRESS(RC1,3,3,1,Menus!R10C11)),0,Menus!R4C10) -> 0 | C283: =OFFSET(INDIRECT(ADDRESS(RC1,3,3,1,Menus!R10C11)),0,Menus!R3C10) -> 0 | D283: =IF(Menus!R9C10,RC[-1]/RC[-2],RC[-1]) -> #DIV/0! | E283: =IF(RC11=1,VALUE(RC[-3]),NA()) -> NA() | F283: =INDIRECT(ADDRESS(RC1,1,3,1,Menus!R10C11)) -> 0 | G283: =IF(INDIRECT(ADDRESS(RC1,2,3,1,Menus!R10C11))=R1C,RC4,NA()) -> NA() | H283: =IF(INDIRECT(ADDRESS(RC1,2,3,1,Menus!R10C11))=R1C,RC4,NA()) -> NA() | I283: =IF(INDIRECT(ADDRESS(RC1,2,3,1,Menus!R10C11))=R1C,RC4,NA()) -> NA() | J283: =IF(INDIRECT(ADDRESS(RC1,1,3,1,Menus!R10C11))=T(R1C),RC4,NA()) -> NA() | K283: =IF(OR(ISNUMBER(RC7),ISNUMBER(RC8),ISNUMBER(RC9),ISNUMBER(RC10)),1,0) -> 0 | M283: =OFFSET(INDIRECT(ADDRESS(RC1,3,3,1,"Gross")),0,Menus!R4C10) -> 0 | N283: =OFFSET(INDIRECT(ADDRESS(RC1,3,3,1,"Gross")),0,Menus!R3C10) -> 0
A284: 321 | B284: =OFFSET(INDIRECT(ADDRESS(RC1,3,3,1,Menus!R10C11)),0,Menus!R4C10) -> 0 | C284: =OFFSET(INDIRECT(ADDRESS(RC1,3,3,1,Menus!R10C11)),0,Menus!R3C10) -> 0 | D284: =IF(Menus!R9C10,RC[-1]/RC[-2],RC[-1]) -> #DIV/0! | E284: =IF(RC11=1,VALUE(RC[-3]),NA()) -> NA() | F284: =INDIRECT(ADDRESS(RC1,1,3,1,Menus!R10C11)) -> 0 | G284: =IF(INDIRECT(ADDRESS(RC1,2,3,1,Menus!R10C11))=R1C,RC4,NA()) -> NA() | H284: =IF(INDIRECT(ADDRESS(RC1,2,3,1,Menus!R10C11))=R1C,RC4,NA()) -> NA() | I284: =IF(INDIRECT(ADDRESS(RC1,2,3,1,Menus!R10C11))=R1C,RC4,NA()) -> NA() | J284: =IF(INDIRECT(ADDRESS(RC1,1,3,1,Menus!R10C11))=T(R1C),RC4,NA()) -> NA() | K284: =IF(OR(ISNUMBER(RC7),ISNUMBER(RC8),ISNUMBER(RC9),ISNUMBER(RC10)),1,0) -> 0 | M284: =OFFSET(INDIRECT(ADDRESS(RC1,3,3,1,"Gross")),0,Menus!R4C10) -> 0 | N284: =OFFSET(INDIRECT(ADDRESS(RC1,3,3,1,"Gross")),0,Menus!R3C10) -> 0
A285: 322 | B285: =OFFSET(INDIRECT(ADDRESS(RC1,3,3,1,Menus!R10C11)),0,Menus!R4C10) -> 0 | C285: =OFFSET(INDIRECT(ADDRESS(RC1,3,3,1,Menus!R10C11)),0,Menus!R3C10) -> 0 | D285: =IF(Menus!R9C10,RC[-1]/RC[-2],RC[-1]) -> #DIV/0! | E285: =IF(RC11=1,VALUE(RC[-3]),NA()) -> NA() | F285: =INDIRECT(ADDRESS(RC1,1,3,1,Menus!R10C11)) -> 0 | G285: =IF(INDIRECT(ADDRESS(RC1,2,3,1,Menus!R10C11))=R1C,RC4,NA()) -> NA() | H285: =IF(INDIRECT(ADDRESS(RC1,2,3,1,Menus!R10C11))=R1C,RC4,NA()) -> NA() | I285: =IF(INDIRECT(ADDRESS(RC1,2,3,1,Menus!R10C11))=R1C,RC4,NA()) -> NA() | J285: =IF(INDIRECT(ADDRESS(RC1,1,3,1,Menus!R10C11))=T(R1C),RC4,NA()) -> NA() | K285: =IF(OR(ISNUMBER(RC7),ISNUMBER(RC8),ISNUMBER(RC9),ISNUMBER(RC10)),1,0) -> 0 | M285: =OFFSET(INDIRECT(ADDRESS(RC1,3,3,1,"Gross")),0,Menus!R4C10) -> 0 | N285: =OFFSET(INDIRECT(ADDRESS(RC1,3,3,1,"Gross")),0,Menus!R3C10) -> 0
A286: 323 | B286: =OFFSET(INDIRECT(ADDRESS(RC1,3,3,1,Menus!R10C11)),0,Menus!R4C10) -> 0 | C286: =OFFSET(INDIRECT(ADDRESS(RC1,3,3,1,Menus!R10C11)),0,Menus!R3C10) -> 0 | D286: =IF(Menus!R9C10,RC[-1]/RC[-2],RC[-1]) -> #DIV/0! | E286: =IF(RC11=1,VALUE(RC[-3]),NA()) -> NA() | F286: =INDIRECT(ADDRESS(RC1,1,3,1,Menus!R10C11)) -> 0 | G286: =IF(INDIRECT(ADDRESS(RC1,2,3,1,Menus!R10C11))=R1C,RC4,NA()) -> NA() | H286: =IF(INDIRECT(ADDRESS(RC1,2,3,1,Menus!R10C11))=R1C,RC4,NA()) -> NA() | I286: =IF(INDIRECT(ADDRESS(RC1,2,3,1,Menus!R10C11))=R1C,RC4,NA()) -> NA() | J286: =IF(INDIRECT(ADDRESS(RC1,1,3,1,Menus!R10C11))=T(R1C),RC4,NA()) -> NA() | K286: =IF(OR(ISNUMBER(RC7),ISNUMBER(RC8),ISNUMBER(RC9),ISNUMBER(RC10)),1,0) -> 0 | M286: =OFFSET(INDIRECT(ADDRESS(RC1,3,3,1,"Gross")),0,Menus!R4C10) -> 0 | N286: =OFFSET(INDIRECT(ADDRESS(RC1,3,3,1,"Gross")),0,Menus!R3C10) -> 0
A287: 324 | B287: =OFFSET(INDIRECT(ADDRESS(RC1,3,3,1,Menus!R10C11)),0,Menus!R4C10) -> 0 | C287: =OFFSET(INDIRECT(ADDRESS(RC1,3,3,1,Menus!R10C11)),0,Menus!R3C10) -> 0 | D287: =IF(Menus!R9C10,RC[-1]/RC[-2],RC[-1]) -> #DIV/0! | E287: =IF(RC11=1,VALUE(RC[-3]),NA()) -> NA() | F287: =INDIRECT(ADDRESS(RC1,1,3,1,Menus!R10C11)) -> 0 | G287: =IF(INDIRECT(ADDRESS(RC1,2,3,1,Menus!R10C11))=R1C,RC4,NA()) -> NA() | H287: =IF(INDIRECT(ADDRESS(RC1,2,3,1,Menus!R10C11))=R1C,RC4,NA()) -> NA() | I287: =IF(INDIRECT(ADDRESS(RC1,2,3,1,Menus!R10C11))=R1C,RC4,NA()) -> NA() | J287: =IF(INDIRECT(ADDRESS(RC1,1,3,1,Menus!R10C11))=T(R1C),RC4,NA()) -> NA() | K287: =IF(OR(ISNUMBER(RC7),ISNUMBER(RC8),ISNUMBER(RC9),ISNUMBER(RC10)),1,0) -> 0 | M287: =OFFSET(INDIRECT(ADDRESS(RC1,3,3,1,"Gross")),0,Menus!R4C10) -> 0 | N287: =OFFSET(INDIRECT(ADDRESS(RC1,3,3,1,"Gross")),0,Menus!R3C10) -> 0
A288: 325 | B288: =OFFSET(INDIRECT(ADDRESS(RC1,3,3,1,Menus!R10C11)),0,Menus!R4C10) -> 0 | C288: =OFFSET(INDIRECT(ADDRESS(RC1,3,3,1,Menus!R10C11)),0,Menus!R3C10) -> 0 | D288: =IF(Menus!R9C10,RC[-1]/RC[-2],RC[-1]) -> #DIV/0! | E288: =IF(RC11=1,VALUE(RC[-3]),NA()) -> NA() | F288: =INDIRECT(ADDRESS(RC1,1,3,1,Menus!R10C11)) -> 0 | G288: =IF(INDIRECT(ADDRESS(RC1,2,3,1,Menus!R10C11))=R1C,RC4,NA()) -> NA() | H288: =IF(INDIRECT(ADDRESS(RC1,2,3,1,Menus!R10C11))=R1C,RC4,NA()) -> NA() | I288: =IF(INDIRECT(ADDRESS(RC1,2,3,1,Menus!R10C11))=R1C,RC4,NA()) -> NA() | J288: =IF(INDIRECT(ADDRESS(RC1,1,3,1,Menus!R10C11))=T(R1C),RC4,NA()) -> NA() | K288: =IF(OR(ISNUMBER(RC7),ISNUMBER(RC8),ISNUMBER(RC9),ISNUMBER(RC10)),1,0) -> 0 | M288: =OFFSET(INDIRECT(ADDRESS(RC1,3,3,1,"Gross")),0,Menus!R4C10) -> 0 | N288: =OFFSET(INDIRECT(ADDRESS(RC1,3,3,1,"Gross")),0,Menus!R3C10) -> 0
A289: 326 | B289: =OFFSET(INDIRECT(ADDRESS(RC1,3,3,1,Menus!R10C11)),0,Menus!R4C10) -> 0 | C289: =OFFSET(INDIRECT(ADDRESS(RC1,3,3,1,Menus!R10C11)),0,Menus!R3C10) -> 0 | D289: =IF(Menus!R9C10,RC[-1]/RC[-2],RC[-1]) -> #DIV/0! | E289: =IF(RC11=1,VALUE(RC[-3]),NA()) -> NA() | F289: =INDIRECT(ADDRESS(RC1,1,3,1,Menus!R10C11)) -> 0 | G289: =IF(INDIRECT(ADDRESS(RC1,2,3,1,Menus!R10C11))=R1C,RC4,NA()) -> NA() | H289: =IF(INDIRECT(ADDRESS(RC1,2,3,1,Menus!R10C11))=R1C,RC4,NA()) -> NA() | I289: =IF(INDIRECT(ADDRESS(RC1,2,3,1,Menus!R10C11))=R1C,RC4,NA()) -> NA() | J289: =IF(INDIRECT(ADDRESS(RC1,1,3,1,Menus!R10C11))=T(R1C),RC4,NA()) -> NA() | K289: =IF(OR(ISNUMBER(RC7),ISNUMBER(RC8),ISNUMBER(RC9),ISNUMBER(RC10)),1,0) -> 0 | M289: =OFFSET(INDIRECT(ADDRESS(RC1,3,3,1,"Gross")),0,Menus!R4C10) -> 0 | N289: =OFFSET(INDIRECT(ADDRESS(RC1,3,3,1,"Gross")),0,Menus!R3C10) -> 0
A290: 327 | B290: =OFFSET(INDIRECT(ADDRESS(RC1,3,3,1,Menus!R10C11)),0,Menus!R4C10) -> 0 | C290: =OFFSET(INDIRECT(ADDRESS(RC1,3,3,1,Menus!R10C11)),0,Menus!R3C10) -> 0 | D290: =IF(Menus!R9C10,RC[-1]/RC[-2],RC[-1]) -> #DIV/0! | E290: =IF(RC11=1,VALUE(RC[-3]),NA()) -> NA() | F290: =INDIRECT(ADDRESS(RC1,1,3,1,Menus!R10C11)) -> 0 | G290: =IF(INDIRECT(ADDRESS(RC1,2,3,1,Menus!R10C11))=R1C,RC4,NA()) -> NA() | H290: =IF(INDIRECT(ADDRESS(RC1,2,3,1,Menus!R10C11))=R1C,RC4,NA()) -> NA() | I290: =IF(INDIRECT(ADDRESS(RC1,2,3,1,Menus!R10C11))=R1C,RC4,NA()) -> NA() | J290: =IF(INDIRECT(ADDRESS(RC1,1,3,1,Menus!R10C11))=T(R1C),RC4,NA()) -> NA() | K290: =IF(OR(ISNUMBER(RC7),ISNUMBER(RC8),ISNUMBER(RC9),ISNUMBER(RC10)),1,0) -> 0 | M290: =OFFSET(INDIRECT(ADDRESS(RC1,3,3,1,"Gross")),0,Menus!R4C10) -> 0 | N290: =OFFSET(INDIRECT(ADDRESS(RC1,3,3,1,"Gross")),0,Menus!R3C10) -> 0
A291: 328 | B291: =OFFSET(INDIRECT(ADDRESS(RC1,3,3,1,Menus!R10C11)),0,Menus!R4C10) -> 0 | C291: =OFFSET(INDIRECT(ADDRESS(RC1,3,3,1,Menus!R10C11)),0,Menus!R3C10) -> 0 | D291: =IF(Menus!R9C10,RC[-1]/RC[-2],RC[-1]) -> #DIV/0! | E291: =IF(RC11=1,VALUE(RC[-3]),NA()) -> NA() | F291: =INDIRECT(ADDRESS(RC1,1,3,1,Menus!R10C11)) -> 0 | G291: =IF(INDIRECT(ADDRESS(RC1,2,3,1,Menus!R10C11))=R1C,RC4,NA()) -> NA() | H291: =IF(INDIRECT(ADDRESS(RC1,2,3,1,Menus!R10C11))=R1C,RC4,NA()) -> NA() | I291: =IF(INDIRECT(ADDRESS(RC1,2,3,1,Menus!R10C11))=R1C,RC4,NA()) -> NA() | J291: =IF(INDIRECT(ADDRESS(RC1,1,3,1,Menus!R10C11))=T(R1C),RC4,NA()) -> NA() | K291: =IF(OR(ISNUMBER(RC7),ISNUMBER(RC8),ISNUMBER(RC9),ISNUMBER(RC10)),1,0) -> 0 | M291: =OFFSET(INDIRECT(ADDRESS(RC1,3,3,1,"Gross")),0,Menus!R4C10) -> 0 | N291: =OFFSET(INDIRECT(ADDRESS(RC1,3,3,1,"Gross")),0,Menus!R3C10) -> 0
A292: 329 | B292: =OFFSET(INDIRECT(ADDRESS(RC1,3,3,1,Menus!R10C11)),0,Menus!R4C10) -> 0 | C292: =OFFSET(INDIRECT(ADDRESS(RC1,3,3,1,Menus!R10C11)),0,Menus!R3C10) -> 0 | D292: =IF(Menus!R9C10,RC[-1]/RC[-2],RC[-1]) -> #DIV/0! | E292: =IF(RC11=1,VALUE(RC[-3]),NA()) -> NA() | F292: =INDIRECT(ADDRESS(RC1,1,3,1,Menus!R10C11)) -> 0 | G292: =IF(INDIRECT(ADDRESS(RC1,2,3,1,Menus!R10C11))=R1C,RC4,NA()) -> NA() | H292: =IF(INDIRECT(ADDRESS(RC1,2,3,1,Menus!R10C11))=R1C,RC4,NA()) -> NA() | I292: =IF(INDIRECT(ADDRESS(RC1,2,3,1,Menus!R10C11))=R1C,RC4,NA()) -> NA() | J292: =IF(INDIRECT(ADDRESS(RC1,1,3,1,Menus!R10C11))=T(R1C),RC4,NA()) -> NA() | K292: =IF(OR(ISNUMBER(RC7),ISNUMBER(RC8),ISNUMBER(RC9),ISNUMBER(RC10)),1,0) -> 0 | M292: =OFFSET(INDIRECT(ADDRESS(RC1,3,3,1,"Gross")),0,Menus!R4C10) -> 0 | N292: =OFFSET(INDIRECT(ADDRESS(RC1,3,3,1,"Gross")),0,Menus!R3C10) -> 0
A293: 330 | B293: =OFFSET(INDIRECT(ADDRESS(RC1,3,3,1,Menus!R10C11)),0,Menus!R4C10) -> 0 | C293: =OFFSET(INDIRECT(ADDRESS(RC1,3,3,1,Menus!R10C11)),0,Menus!R3C10) -> 0 | D293: =IF(Menus!R9C10,RC[-1]/RC[-2],RC[-1]) -> #DIV/0! | E293: =IF(RC11=1,VALUE(RC[-3]),NA()) -> NA() | F293: =INDIRECT(ADDRESS(RC1,1,3,1,Menus!R10C11)) -> 0 | G293: =IF(INDIRECT(ADDRESS(RC1,2,3,1,Menus!R10C11))=R1C,RC4,NA()) -> NA() | H293: =IF(INDIRECT(ADDRESS(RC1,2,3,1,Menus!R10C11))=R1C,RC4,NA()) -> NA() | I293: =IF(INDIRECT(ADDRESS(RC1,2,3,1,Menus!R10C11))=R1C,RC4,NA()) -> NA() | J293: =IF(INDIRECT(ADDRESS(RC1,1,3,1,Menus!R10C11))=T(R1C),RC4,NA()) -> NA() | K293: =IF(OR(ISNUMBER(RC7),ISNUMBER(RC8),ISNUMBER(RC9),ISNUMBER(RC10)),1,0) -> 0 | M293: =OFFSET(INDIRECT(ADDRESS(RC1,3,3,1,"Gross")),0,Menus!R4C10) -> 0 | N293: =OFFSET(INDIRECT(ADDRESS(RC1,3,3,1,"Gross")),0,Menus!R3C10) -> 0
A294: 331 | B294: =OFFSET(INDIRECT(ADDRESS(RC1,3,3,1,Menus!R10C11)),0,Menus!R4C10) -> 0 | C294: =OFFSET(INDIRECT(ADDRESS(RC1,3,3,1,Menus!R10C11)),0,Menus!R3C10) -> 0 | D294: =IF(Menus!R9C10,RC[-1]/RC[-2],RC[-1]) -> #DIV/0! | E294: =IF(RC11=1,VALUE(RC[-3]),NA()) -> NA() | F294: =INDIRECT(ADDRESS(RC1,1,3,1,Menus!R10C11)) -> 0 | G294: =IF(INDIRECT(ADDRESS(RC1,2,3,1,Menus!R10C11))=R1C,RC4,NA()) -> NA() | H294: =IF(INDIRECT(ADDRESS(RC1,2,3,1,Menus!R10C11))=R1C,RC4,NA()) -> NA() | I294: =IF(INDIRECT(ADDRESS(RC1,2,3,1,Menus!R10C11))=R1C,RC4,NA()) -> NA() | J294: =IF(INDIRECT(ADDRESS(RC1,1,3,1,Menus!R10C11))=T(R1C),RC4,NA()) -> NA() | K294: =IF(OR(ISNUMBER(RC7),ISNUMBER(RC8),ISNUMBER(RC9),ISNUMBER(RC10)),1,0) -> 0 | M294: =OFFSET(INDIRECT(ADDRESS(RC1,3,3,1,"Gross")),0,Menus!R4C10) -> 0 | N294: =OFFSET(INDIRECT(ADDRESS(RC1,3,3,1,"Gross")),0,Menus!R3C10) -> 0
A295: 332 | B295: =OFFSET(INDIRECT(ADDRESS(RC1,3,3,1,Menus!R10C11)),0,Menus!R4C10) -> 0 | C295: =OFFSET(INDIRECT(ADDRESS(RC1,3,3,1,Menus!R10C11)),0,Menus!R3C10) -> 0 | D295: =IF(Menus!R9C10,RC[-1]/RC[-2],RC[-1]) -> #DIV/0! | E295: =IF(RC11=1,VALUE(RC[-3]),NA()) -> NA() | F295: =INDIRECT(ADDRESS(RC1,1,3,1,Menus!R10C11)) -> 0 | G295: =IF(INDIRECT(ADDRESS(RC1,2,3,1,Menus!R10C11))=R1C,RC4,NA()) -> NA() | H295: =IF(INDIRECT(ADDRESS(RC1,2,3,1,Menus!R10C11))=R1C,RC4,NA()) -> NA() | I295: =IF(INDIRECT(ADDRESS(RC1,2,3,1,Menus!R10C11))=R1C,RC4,NA()) -> NA() | J295: =IF(INDIRECT(ADDRESS(RC1,1,3,1,Menus!R10C11))=T(R1C),RC4,NA()) -> NA() | K295: =IF(OR(ISNUMBER(RC7),ISNUMBER(RC8),ISNUMBER(RC9),ISNUMBER(RC10)),1,0) -> 0 | M295: =OFFSET(INDIRECT(ADDRESS(RC1,3,3,1,"Gross")),0,Menus!R4C10) -> 0 | N295: =OFFSET(INDIRECT(ADDRESS(RC1,3,3,1,"Gross")),0,Menus!R3C10) -> 0
A296: 333 | B296: =OFFSET(INDIRECT(ADDRESS(RC1,3,3,1,Menus!R10C11)),0,Menus!R4C10) -> 0 | C296: =OFFSET(INDIRECT(ADDRESS(RC1,3,3,1,Menus!R10C11)),0,Menus!R3C10) -> 0 | D296: =IF(Menus!R9C10,RC[-1]/RC[-2],RC[-1]) -> #DIV/0! | E296: =IF(RC11=1,VALUE(RC[-3]),NA()) -> NA() | F296: =INDIRECT(ADDRESS(RC1,1,3,1,Menus!R10C11)) -> 0 | G296: =IF(INDIRECT(ADDRESS(RC1,2,3,1,Menus!R10C11))=R1C,RC4,NA()) -> NA() | H296: =IF(INDIRECT(ADDRESS(RC1,2,3,1,Menus!R10C11))=R1C,RC4,NA()) -> NA() | I296: =IF(INDIRECT(ADDRESS(RC1,2,3,1,Menus!R10C11))=R1C,RC4,NA()) -> NA() | J296: =IF(INDIRECT(ADDRESS(RC1,1,3,1,Menus!R10C11))=T(R1C),RC4,NA()) -> NA() | K296: =IF(OR(ISNUMBER(RC7),ISNUMBER(RC8),ISNUMBER(RC9),ISNUMBER(RC10)),1,0) -> 0 | M296: =OFFSET(INDIRECT(ADDRESS(RC1,3,3,1,"Gross")),0,Menus!R4C10) -> 0 | N296: =OFFSET(INDIRECT(ADDRESS(RC1,3,3,1,"Gross")),0,Menus!R3C10) -> 0
A297: 334 | B297: =OFFSET(INDIRECT(ADDRESS(RC1,3,3,1,Menus!R10C11)),0,Menus!R4C10) -> 0 | C297: =OFFSET(INDIRECT(ADDRESS(RC1,3,3,1,Menus!R10C11)),0,Menus!R3C10) -> 0 | D297: =IF(Menus!R9C10,RC[-1]/RC[-2],RC[-1]) -> #DIV/0! | E297: =IF(RC11=1,VALUE(RC[-3]),NA()) -> NA() | F297: =INDIRECT(ADDRESS(RC1,1,3,1,Menus!R10C11)) -> 0 | G297: =IF(INDIRECT(ADDRESS(RC1,2,3,1,Menus!R10C11))=R1C,RC4,NA()) -> NA() | H297: =IF(INDIRECT(ADDRESS(RC1,2,3,1,Menus!R10C11))=R1C,RC4,NA()) -> NA() | I297: =IF(INDIRECT(ADDRESS(RC1,2,3,1,Menus!R10C11))=R1C,RC4,NA()) -> NA() | J297: =IF(INDIRECT(ADDRESS(RC1,1,3,1,Menus!R10C11))=T(R1C),RC4,NA()) -> NA() | K297: =IF(OR(ISNUMBER(RC7),ISNUMBER(RC8),ISNUMBER(RC9),ISNUMBER(RC10)),1,0) -> 0 | M297: =OFFSET(INDIRECT(ADDRESS(RC1,3,3,1,"Gross")),0,Menus!R4C10) -> 0 | N297: =OFFSET(INDIRECT(ADDRESS(RC1,3,3,1,"Gross")),0,Menus!R3C10) -> 0
A298: 335 | B298: =OFFSET(INDIRECT(ADDRESS(RC1,3,3,1,Menus!R10C11)),0,Menus!R4C10) -> 0 | C298: =OFFSET(INDIRECT(ADDRESS(RC1,3,3,1,Menus!R10C11)),0,Menus!R3C10) -> 0 | D298: =IF(Menus!R9C10,RC[-1]/RC[-2],RC[-1]) -> #DIV/0! | E298: =IF(RC11=1,VALUE(RC[-3]),NA()) -> NA() | F298: =INDIRECT(ADDRESS(RC1,1,3,1,Menus!R10C11)) -> 0 | G298: =IF(INDIRECT(ADDRESS(RC1,2,3,1,Menus!R10C11))=R1C,RC4,NA()) -> NA() | H298: =IF(INDIRECT(ADDRESS(RC1,2,3,1,Menus!R10C11))=R1C,RC4,NA()) -> NA() | I298: =IF(INDIRECT(ADDRESS(RC1,2,3,1,Menus!R10C11))=R1C,RC4,NA()) -> NA() | J298: =IF(INDIRECT(ADDRESS(RC1,1,3,1,Menus!R10C11))=T(R1C),RC4,NA()) -> NA() | K298: =IF(OR(ISNUMBER(RC7),ISNUMBER(RC8),ISNUMBER(RC9),ISNUMBER(RC10)),1,0) -> 0 | M298: =OFFSET(INDIRECT(ADDRESS(RC1,3,3,1,"Gross")),0,Menus!R4C10) -> 0 | N298: =OFFSET(INDIRECT(ADDRESS(RC1,3,3,1,"Gross")),0,Menus!R3C10) -> 0
A299: 336 | B299: =OFFSET(INDIRECT(ADDRESS(RC1,3,3,1,Menus!R10C11)),0,Menus!R4C10) -> 0 | C299: =OFFSET(INDIRECT(ADDRESS(RC1,3,3,1,Menus!R10C11)),0,Menus!R3C10) -> 0 | D299: =IF(Menus!R9C10,RC[-1]/RC[-2],RC[-1]) -> #DIV/0! | E299: =IF(RC11=1,VALUE(RC[-3]),NA()) -> NA() | F299: =INDIRECT(ADDRESS(RC1,1,3,1,Menus!R10C11)) -> 0 | G299: =IF(INDIRECT(ADDRESS(RC1,2,3,1,Menus!R10C11))=R1C,RC4,NA()) -> NA() | H299: =IF(INDIRECT(ADDRESS(RC1,2,3,1,Menus!R10C11))=R1C,RC4,NA()) -> NA() | I299: =IF(INDIRECT(ADDRESS(RC1,2,3,1,Menus!R10C11))=R1C,RC4,NA()) -> NA() | J299: =IF(INDIRECT(ADDRESS(RC1,1,3,1,Menus!R10C11))=T(R1C),RC4,NA()) -> NA() | K299: =IF(OR(ISNUMBER(RC7),ISNUMBER(RC8),ISNUMBER(RC9),ISNUMBER(RC10)),1,0) -> 0 | M299: =OFFSET(INDIRECT(ADDRESS(RC1,3,3,1,"Gross")),0,Menus!R4C10) -> 0 | N299: =OFFSET(INDIRECT(ADDRESS(RC1,3,3,1,"Gross")),0,Menus!R3C10) -> 0
A300: 337 | B300: =OFFSET(INDIRECT(ADDRESS(RC1,3,3,1,Menus!R10C11)),0,Menus!R4C10) -> 0 | C300: =OFFSET(INDIRECT(ADDRESS(RC1,3,3,1,Menus!R10C11)),0,Menus!R3C10) -> 0 | D300: =IF(Menus!R9C10,RC[-1]/RC[-2],RC[-1]) -> #DIV/0! | E300: =IF(RC11=1,VALUE(RC[-3]),NA()) -> NA() | F300: =INDIRECT(ADDRESS(RC1,1,3,1,Menus!R10C11)) -> 0 | G300: =IF(INDIRECT(ADDRESS(RC1,2,3,1,Menus!R10C11))=R1C,RC4,NA()) -> NA() | H300: =IF(INDIRECT(ADDRESS(RC1,2,3,1,Menus!R10C11))=R1C,RC4,NA()) -> NA() | I300: =IF(INDIRECT(ADDRESS(RC1,2,3,1,Menus!R10C11))=R1C,RC4,NA()) -> NA() | J300: =IF(INDIRECT(ADDRESS(RC1,1,3,1,Menus!R10C11))=T(R1C),RC4,NA()) -> NA() | K300: =IF(OR(ISNUMBER(RC7),ISNUMBER(RC8),ISNUMBER(RC9),ISNUMBER(RC10)),1,0) -> 0 | M300: =OFFSET(INDIRECT(ADDRESS(RC1,3,3,1,"Gross")),0,Menus!R4C10) -> 0 | N300: =OFFSET(INDIRECT(ADDRESS(RC1,3,3,1,"Gross")),0,Menus!R3C10) -> 0
A301: 338 | B301: =OFFSET(INDIRECT(ADDRESS(RC1,3,3,1,Menus!R10C11)),0,Menus!R4C10) -> 0 | C301: =OFFSET(INDIRECT(ADDRESS(RC1,3,3,1,Menus!R10C11)),0,Menus!R3C10) -> 0 | D301: =IF(Menus!R9C10,RC[-1]/RC[-2],RC[-1]) -> #DIV/0! | E301: =IF(RC11=1,VALUE(RC[-3]),NA()) -> NA() | F301: =INDIRECT(ADDRESS(RC1,1,3,1,Menus!R10C11)) -> 0 | G301: =IF(INDIRECT(ADDRESS(RC1,2,3,1,Menus!R10C11))=R1C,RC4,NA()) -> NA() | H301: =IF(INDIRECT(ADDRESS(RC1,2,3,1,Menus!R10C11))=R1C,RC4,NA()) -> NA() | I301: =IF(INDIRECT(ADDRESS(RC1,2,3,1,Menus!R10C11))=R1C,RC4,NA()) -> NA() | J301: =IF(INDIRECT(ADDRESS(RC1,1,3,1,Menus!R10C11))=T(R1C),RC4,NA()) -> NA() | K301: =IF(OR(ISNUMBER(RC7),ISNUMBER(RC8),ISNUMBER(RC9),ISNUMBER(RC10)),1,0) -> 0 | M301: =OFFSET(INDIRECT(ADDRESS(RC1,3,3,1,"Gross")),0,Menus!R4C10) -> 0 | N301: =OFFSET(INDIRECT(ADDRESS(RC1,3,3,1,"Gross")),0,Menus!R3C10) -> 0
A302: 339 | B302: =OFFSET(INDIRECT(ADDRESS(RC1,3,3,1,Menus!R10C11)),0,Menus!R4C10) -> 0 | C302: =OFFSET(INDIRECT(ADDRESS(RC1,3,3,1,Menus!R10C11)),0,Menus!R3C10) -> 0 | D302: =IF(Menus!R9C10,RC[-1]/RC[-2],RC[-1]) -> #DIV/0! | E302: =IF(RC11=1,VALUE(RC[-3]),NA()) -> NA() | F302: =INDIRECT(ADDRESS(RC1,1,3,1,Menus!R10C11)) -> 0 | G302: =IF(INDIRECT(ADDRESS(RC1,2,3,1,Menus!R10C11))=R1C,RC4,NA()) -> NA() | H302: =IF(INDIRECT(ADDRESS(RC1,2,3,1,Menus!R10C11))=R1C,RC4,NA()) -> NA() | I302: =IF(INDIRECT(ADDRESS(RC1,2,3,1,Menus!R10C11))=R1C,RC4,NA()) -> NA() | J302: =IF(INDIRECT(ADDRESS(RC1,1,3,1,Menus!R10C11))=T(R1C),RC4,NA()) -> NA() | K302: =IF(OR(ISNUMBER(RC7),ISNUMBER(RC8),ISNUMBER(RC9),ISNUMBER(RC10)),1,0) -> 0 | M302: =OFFSET(INDIRECT(ADDRESS(RC1,3,3,1,"Gross")),0,Menus!R4C10) -> 0 | N302: =OFFSET(INDIRECT(ADDRESS(RC1,3,3,1,"Gross")),0,Menus!R3C10) -> 0
A303: 340 | B303: =OFFSET(INDIRECT(ADDRESS(RC1,3,3,1,Menus!R10C11)),0,Menus!R4C10) -> 0 | C303: =OFFSET(INDIRECT(ADDRESS(RC1,3,3,1,Menus!R10C11)),0,Menus!R3C10) -> 0 | D303: =IF(Menus!R9C10,RC[-1]/RC[-2],RC[-1]) -> #DIV/0! | E303: =IF(RC11=1,VALUE(RC[-3]),NA()) -> NA() | F303: =INDIRECT(ADDRESS(RC1,1,3,1,Menus!R10C11)) -> 0 | G303: =IF(INDIRECT(ADDRESS(RC1,2,3,1,Menus!R10C11))=R1C,RC4,NA()) -> NA() | H303: =IF(INDIRECT(ADDRESS(RC1,2,3,1,Menus!R10C11))=R1C,RC4,NA()) -> NA() | I303: =IF(INDIRECT(ADDRESS(RC1,2,3,1,Menus!R10C11))=R1C,RC4,NA()) -> NA() | J303: =IF(INDIRECT(ADDRESS(RC1,1,3,1,Menus!R10C11))=T(R1C),RC4,NA()) -> NA() | K303: =IF(OR(ISNUMBER(RC7),ISNUMBER(RC8),ISNUMBER(RC9),ISNUMBER(RC10)),1,0) -> 0 | M303: =OFFSET(INDIRECT(ADDRESS(RC1,3,3,1,"Gross")),0,Menus!R4C10) -> 0 | N303: =OFFSET(INDIRECT(ADDRESS(RC1,3,3,1,"Gross")),0,Menus!R3C10) -> 0
A304: 341 | B304: =OFFSET(INDIRECT(ADDRESS(RC1,3,3,1,Menus!R10C11)),0,Menus!R4C10) -> 0 | C304: =OFFSET(INDIRECT(ADDRESS(RC1,3,3,1,Menus!R10C11)),0,Menus!R3C10) -> 0 | D304: =IF(Menus!R9C10,RC[-1]/RC[-2],RC[-1]) -> #DIV/0! | E304: =IF(RC11=1,VALUE(RC[-3]),NA()) -> NA() | F304: =INDIRECT(ADDRESS(RC1,1,3,1,Menus!R10C11)) -> 0 | G304: =IF(INDIRECT(ADDRESS(RC1,2,3,1,Menus!R10C11))=R1C,RC4,NA()) -> NA() | H304: =IF(INDIRECT(ADDRESS(RC1,2,3,1,Menus!R10C11))=R1C,RC4,NA()) -> NA() | I304: =IF(INDIRECT(ADDRESS(RC1,2,3,1,Menus!R10C11))=R1C,RC4,NA()) -> NA() | J304: =IF(INDIRECT(ADDRESS(RC1,1,3,1,Menus!R10C11))=T(R1C),RC4,NA()) -> NA() | K304: =IF(OR(ISNUMBER(RC7),ISNUMBER(RC8),ISNUMBER(RC9),ISNUMBER(RC10)),1,0) -> 0 | M304: =OFFSET(INDIRECT(ADDRESS(RC1,3,3,1,"Gross")),0,Menus!R4C10) -> 0 | N304: =OFFSET(INDIRECT(ADDRESS(RC1,3,3,1,"Gross")),0,Menus!R3C10) -> 0
A305: 342 | B305: =OFFSET(INDIRECT(ADDRESS(RC1,3,3,1,Menus!R10C11)),0,Menus!R4C10) -> 0 | C305: =OFFSET(INDIRECT(ADDRESS(RC1,3,3,1,Menus!R10C11)),0,Menus!R3C10) -> 0 | D305: =IF(Menus!R9C10,RC[-1]/RC[-2],RC[-1]) -> #DIV/0! | E305: =IF(RC11=1,VALUE(RC[-3]),NA()) -> NA() | F305: =INDIRECT(ADDRESS(RC1,1,3,1,Menus!R10C11)) -> 0 | G305: =IF(INDIRECT(ADDRESS(RC1,2,3,1,Menus!R10C11))=R1C,RC4,NA()) -> NA() | H305: =IF(INDIRECT(ADDRESS(RC1,2,3,1,Menus!R10C11))=R1C,RC4,NA()) -> NA() | I305: =IF(INDIRECT(ADDRESS(RC1,2,3,1,Menus!R10C11))=R1C,RC4,NA()) -> NA() | J305: =IF(INDIRECT(ADDRESS(RC1,1,3,1,Menus!R10C11))=T(R1C),RC4,NA()) -> NA() | K305: =IF(OR(ISNUMBER(RC7),ISNUMBER(RC8),ISNUMBER(RC9),ISNUMBER(RC10)),1,0) -> 0 | M305: =OFFSET(INDIRECT(ADDRESS(RC1,3,3,1,"Gross")),0,Menus!R4C10) -> 0 | N305: =OFFSET(INDIRECT(ADDRESS(RC1,3,3,1,"Gross")),0,Menus!R3C10) -> 0
A306: 343 | B306: =OFFSET(INDIRECT(ADDRESS(RC1,3,3,1,Menus!R10C11)),0,Menus!R4C10) -> 0 | C306: =OFFSET(INDIRECT(ADDRESS(RC1,3,3,1,Menus!R10C11)),0,Menus!R3C10) -> 0 | D306: =IF(Menus!R9C10,RC[-1]/RC[-2],RC[-1]) -> #DIV/0! | E306: =IF(RC11=1,VALUE(RC[-3]),NA()) -> NA() | F306: =INDIRECT(ADDRESS(RC1,1,3,1,Menus!R10C11)) -> 0 | G306: =IF(INDIRECT(ADDRESS(RC1,2,3,1,Menus!R10C11))=R1C,RC4,NA()) -> NA() | H306: =IF(INDIRECT(ADDRESS(RC1,2,3,1,Menus!R10C11))=R1C,RC4,NA()) -> NA() | I306: =IF(INDIRECT(ADDRESS(RC1,2,3,1,Menus!R10C11))=R1C,RC4,NA()) -> NA() | J306: =IF(INDIRECT(ADDRESS(RC1,1,3,1,Menus!R10C11))=T(R1C),RC4,NA()) -> NA() | K306: =IF(OR(ISNUMBER(RC7),ISNUMBER(RC8),ISNUMBER(RC9),ISNUMBER(RC10)),1,0) -> 0 | M306: =OFFSET(INDIRECT(ADDRESS(RC1,3,3,1,"Gross")),0,Menus!R4C10) -> 0 | N306: =OFFSET(INDIRECT(ADDRESS(RC1,3,3,1,"Gross")),0,Menus!R3C10) -> 0
A307: 344 | B307: =OFFSET(INDIRECT(ADDRESS(RC1,3,3,1,Menus!R10C11)),0,Menus!R4C10) -> 0 | C307: =OFFSET(INDIRECT(ADDRESS(RC1,3,3,1,Menus!R10C11)),0,Menus!R3C10) -> 0 | D307: =IF(Menus!R9C10,RC[-1]/RC[-2],RC[-1]) -> #DIV/0! | E307: =IF(RC11=1,VALUE(RC[-3]),NA()) -> NA() | F307: =INDIRECT(ADDRESS(RC1,1,3,1,Menus!R10C11)) -> 0 | G307: =IF(INDIRECT(ADDRESS(RC1,2,3,1,Menus!R10C11))=R1C,RC4,NA()) -> NA() | H307: =IF(INDIRECT(ADDRESS(RC1,2,3,1,Menus!R10C11))=R1C,RC4,NA()) -> NA() | I307: =IF(INDIRECT(ADDRESS(RC1,2,3,1,Menus!R10C11))=R1C,RC4,NA()) -> NA() | J307: =IF(INDIRECT(ADDRESS(RC1,1,3,1,Menus!R10C11))=T(R1C),RC4,NA()) -> NA() | K307: =IF(OR(ISNUMBER(RC7),ISNUMBER(RC8),ISNUMBER(RC9),ISNUMBER(RC10)),1,0) -> 0 | M307: =OFFSET(INDIRECT(ADDRESS(RC1,3,3,1,"Gross")),0,Menus!R4C10) -> 0 | N307: =OFFSET(INDIRECT(ADDRESS(RC1,3,3,1,"Gross")),0,Menus!R3C10) -> 0
A308: 345 | B308: =OFFSET(INDIRECT(ADDRESS(RC1,3,3,1,Menus!R10C11)),0,Menus!R4C10) -> 0 | C308: =OFFSET(INDIRECT(ADDRESS(RC1,3,3,1,Menus!R10C11)),0,Menus!R3C10) -> 0 | D308: =IF(Menus!R9C10,RC[-1]/RC[-2],RC[-1]) -> #DIV/0! | E308: =IF(RC11=1,VALUE(RC[-3]),NA()) -> NA() | F308: =INDIRECT(ADDRESS(RC1,1,3,1,Menus!R10C11)) -> 0 | G308: =IF(INDIRECT(ADDRESS(RC1,2,3,1,Menus!R10C11))=R1C,RC4,NA()) -> NA() | H308: =IF(INDIRECT(ADDRESS(RC1,2,3,1,Menus!R10C11))=R1C,RC4,NA()) -> NA() | I308: =IF(INDIRECT(ADDRESS(RC1,2,3,1,Menus!R10C11))=R1C,RC4,NA()) -> NA() | J308: =IF(INDIRECT(ADDRESS(RC1,1,3,1,Menus!R10C11))=T(R1C),RC4,NA()) -> NA() | K308: =IF(OR(ISNUMBER(RC7),ISNUMBER(RC8),ISNUMBER(RC9),ISNUMBER(RC10)),1,0) -> 0 | M308: =OFFSET(INDIRECT(ADDRESS(RC1,3,3,1,"Gross")),0,Menus!R4C10) -> 0 | N308: =OFFSET(INDIRECT(ADDRESS(RC1,3,3,1,"Gross")),0,Menus!R3C10) -> 0
A309: 346 | B309: =OFFSET(INDIRECT(ADDRESS(RC1,3,3,1,Menus!R10C11)),0,Menus!R4C10) -> 0 | C309: =OFFSET(INDIRECT(ADDRESS(RC1,3,3,1,Menus!R10C11)),0,Menus!R3C10) -> 0 | D309: =IF(Menus!R9C10,RC[-1]/RC[-2],RC[-1]) -> #DIV/0! | E309: =IF(RC11=1,VALUE(RC[-3]),NA()) -> NA() | F309: =INDIRECT(ADDRESS(RC1,1,3,1,Menus!R10C11)) -> 0 | G309: =IF(INDIRECT(ADDRESS(RC1,2,3,1,Menus!R10C11))=R1C,RC4,NA()) -> NA() | H309: =IF(INDIRECT(ADDRESS(RC1,2,3,1,Menus!R10C11))=R1C,RC4,NA()) -> NA() | I309: =IF(INDIRECT(ADDRESS(RC1,2,3,1,Menus!R10C11))=R1C,RC4,NA()) -> NA() | J309: =IF(INDIRECT(ADDRESS(RC1,1,3,1,Menus!R10C11))=T(R1C),RC4,NA()) -> NA() | K309: =IF(OR(ISNUMBER(RC7),ISNUMBER(RC8),ISNUMBER(RC9),ISNUMBER(RC10)),1,0) -> 0 | M309: =OFFSET(INDIRECT(ADDRESS(RC1,3,3,1,"Gross")),0,Menus!R4C10) -> 0 | N309: =OFFSET(INDIRECT(ADDRESS(RC1,3,3,1,"Gross")),0,Menus!R3C10) -> 0
A310: 347 | B310: =OFFSET(INDIRECT(ADDRESS(RC1,3,3,1,Menus!R10C11)),0,Menus!R4C10) -> 0 | C310: =OFFSET(INDIRECT(ADDRESS(RC1,3,3,1,Menus!R10C11)),0,Menus!R3C10) -> 0 | D310: =IF(Menus!R9C10,RC[-1]/RC[-2],RC[-1]) -> #DIV/0! | E310: =IF(RC11=1,VALUE(RC[-3]),NA()) -> NA() | F310: =INDIRECT(ADDRESS(RC1,1,3,1,Menus!R10C11)) -> 0 | G310: =IF(INDIRECT(ADDRESS(RC1,2,3,1,Menus!R10C11))=R1C,RC4,NA()) -> NA() | H310: =IF(INDIRECT(ADDRESS(RC1,2,3,1,Menus!R10C11))=R1C,RC4,NA()) -> NA() | I310: =IF(INDIRECT(ADDRESS(RC1,2,3,1,Menus!R10C11))=R1C,RC4,NA()) -> NA() | J310: =IF(INDIRECT(ADDRESS(RC1,1,3,1,Menus!R10C11))=T(R1C),RC4,NA()) -> NA() | K310: =IF(OR(ISNUMBER(RC7),ISNUMBER(RC8),ISNUMBER(RC9),ISNUMBER(RC10)),1,0) -> 0 | M310: =OFFSET(INDIRECT(ADDRESS(RC1,3,3,1,"Gross")),0,Menus!R4C10) -> 0 | N310: =OFFSET(INDIRECT(ADDRESS(RC1,3,3,1,"Gross")),0,Menus!R3C10) -> 0
A311: 348 | B311: =OFFSET(INDIRECT(ADDRESS(RC1,3,3,1,Menus!R10C11)),0,Menus!R4C10) -> 0 | C311: =OFFSET(INDIRECT(ADDRESS(RC1,3,3,1,Menus!R10C11)),0,Menus!R3C10) -> 0 | D311: =IF(Menus!R9C10,RC[-1]/RC[-2],RC[-1]) -> #DIV/0! | E311: =IF(RC11=1,VALUE(RC[-3]),NA()) -> NA() | F311: =INDIRECT(ADDRESS(RC1,1,3,1,Menus!R10C11)) -> 0 | G311: =IF(INDIRECT(ADDRESS(RC1,2,3,1,Menus!R10C11))=R1C,RC4,NA()) -> NA() | H311: =IF(INDIRECT(ADDRESS(RC1,2,3,1,Menus!R10C11))=R1C,RC4,NA()) -> NA() | I311: =IF(INDIRECT(ADDRESS(RC1,2,3,1,Menus!R10C11))=R1C,RC4,NA()) -> NA() | J311: =IF(INDIRECT(ADDRESS(RC1,1,3,1,Menus!R10C11))=T(R1C),RC4,NA()) -> NA() | K311: =IF(OR(ISNUMBER(RC7),ISNUMBER(RC8),ISNUMBER(RC9),ISNUMBER(RC10)),1,0) -> 0 | M311: =OFFSET(INDIRECT(ADDRESS(RC1,3,3,1,"Gross")),0,Menus!R4C10) -> 0 | N311: =OFFSET(INDIRECT(ADDRESS(RC1,3,3,1,"Gross")),0,Menus!R3C10) -> 0
A312: 349 | B312: =OFFSET(INDIRECT(ADDRESS(RC1,3,3,1,Menus!R10C11)),0,Menus!R4C10) -> 0 | C312: =OFFSET(INDIRECT(ADDRESS(RC1,3,3,1,Menus!R10C11)),0,Menus!R3C10) -> 0 | D312: =IF(Menus!R9C10,RC[-1]/RC[-2],RC[-1]) -> #DIV/0! | E312: =IF(RC11=1,VALUE(RC[-3]),NA()) -> NA() | F312: =INDIRECT(ADDRESS(RC1,1,3,1,Menus!R10C11)) -> 0 | G312: =IF(INDIRECT(ADDRESS(RC1,2,3,1,Menus!R10C11))=R1C,RC4,NA()) -> NA() | H312: =IF(INDIRECT(ADDRESS(RC1,2,3,1,Menus!R10C11))=R1C,RC4,NA()) -> NA() | I312: =IF(INDIRECT(ADDRESS(RC1,2,3,1,Menus!R10C11))=R1C,RC4,NA()) -> NA() | J312: =IF(INDIRECT(ADDRESS(RC1,1,3,1,Menus!R10C11))=T(R1C),RC4,NA()) -> NA() | K312: =IF(OR(ISNUMBER(RC7),ISNUMBER(RC8),ISNUMBER(RC9),ISNUMBER(RC10)),1,0) -> 0 | M312: =OFFSET(INDIRECT(ADDRESS(RC1,3,3,1,"Gross")),0,Menus!R4C10) -> 0 | N312: =OFFSET(INDIRECT(ADDRESS(RC1,3,3,1,"Gross")),0,Menus!R3C10) -> 0
A313: 350 | B313: =OFFSET(INDIRECT(ADDRESS(RC1,3,3,1,Menus!R10C11)),0,Menus!R4C10) -> 0 | C313: =OFFSET(INDIRECT(ADDRESS(RC1,3,3,1,Menus!R10C11)),0,Menus!R3C10) -> 0 | D313: =IF(Menus!R9C10,RC[-1]/RC[-2],RC[-1]) -> #DIV/0! | E313: =IF(RC11=1,VALUE(RC[-3]),NA()) -> NA() | F313: =INDIRECT(ADDRESS(RC1,1,3,1,Menus!R10C11)) -> 0 | G313: =IF(INDIRECT(ADDRESS(RC1,2,3,1,Menus!R10C11))=R1C,RC4,NA()) -> NA() | H313: =IF(INDIRECT(ADDRESS(RC1,2,3,1,Menus!R10C11))=R1C,RC4,NA()) -> NA() | I313: =IF(INDIRECT(ADDRESS(RC1,2,3,1,Menus!R10C11))=R1C,RC4,NA()) -> NA() | J313: =IF(INDIRECT(ADDRESS(RC1,1,3,1,Menus!R10C11))=T(R1C),RC4,NA()) -> NA() | K313: =IF(OR(ISNUMBER(RC7),ISNUMBER(RC8),ISNUMBER(RC9),ISNUMBER(RC10)),1,0) -> 0 | M313: =OFFSET(INDIRECT(ADDRESS(RC1,3,3,1,"Gross")),0,Menus!R4C10) -> 0 | N313: =OFFSET(INDIRECT(ADDRESS(RC1,3,3,1,"Gross")),0,Menus!R3C10) -> 0
A314: 351 | B314: =OFFSET(INDIRECT(ADDRESS(RC1,3,3,1,Menus!R10C11)),0,Menus!R4C10) -> 0 | C314: =OFFSET(INDIRECT(ADDRESS(RC1,3,3,1,Menus!R10C11)),0,Menus!R3C10) -> 0 | D314: =IF(Menus!R9C10,RC[-1]/RC[-2],RC[-1]) -> #DIV/0! | E314: =IF(RC11=1,VALUE(RC[-3]),NA()) -> NA() | F314: =INDIRECT(ADDRESS(RC1,1,3,1,Menus!R10C11)) -> 0 | G314: =IF(INDIRECT(ADDRESS(RC1,2,3,1,Menus!R10C11))=R1C,RC4,NA()) -> NA() | H314: =IF(INDIRECT(ADDRESS(RC1,2,3,1,Menus!R10C11))=R1C,RC4,NA()) -> NA() | I314: =IF(INDIRECT(ADDRESS(RC1,2,3,1,Menus!R10C11))=R1C,RC4,NA()) -> NA() | J314: =IF(INDIRECT(ADDRESS(RC1,1,3,1,Menus!R10C11))=T(R1C),RC4,NA()) -> NA() | K314: =IF(OR(ISNUMBER(RC7),ISNUMBER(RC8),ISNUMBER(RC9),ISNUMBER(RC10)),1,0) -> 0 | M314: =OFFSET(INDIRECT(ADDRESS(RC1,3,3,1,"Gross")),0,Menus!R4C10) -> 0 | N314: =OFFSET(INDIRECT(ADDRESS(RC1,3,3,1,"Gross")),0,Menus!R3C10) -> 0
A315: 352 | B315: =OFFSET(INDIRECT(ADDRESS(RC1,3,3,1,Menus!R10C11)),0,Menus!R4C10) -> 0 | C315: =OFFSET(INDIRECT(ADDRESS(RC1,3,3,1,Menus!R10C11)),0,Menus!R3C10) -> 0 | D315: =IF(Menus!R9C10,RC[-1]/RC[-2],RC[-1]) -> #DIV/0! | E315: =IF(RC11=1,VALUE(RC[-3]),NA()) -> NA() | F315: =INDIRECT(ADDRESS(RC1,1,3,1,Menus!R10C11)) -> 0 | G315: =IF(INDIRECT(ADDRESS(RC1,2,3,1,Menus!R10C11))=R1C,RC4,NA()) -> NA() | H315: =IF(INDIRECT(ADDRESS(RC1,2,3,1,Menus!R10C11))=R1C,RC4,NA()) -> NA() | I315: =IF(INDIRECT(ADDRESS(RC1,2,3,1,Menus!R10C11))=R1C,RC4,NA()) -> NA() | J315: =IF(INDIRECT(ADDRESS(RC1,1,3,1,Menus!R10C11))=T(R1C),RC4,NA()) -> NA() | K315: =IF(OR(ISNUMBER(RC7),ISNUMBER(RC8),ISNUMBER(RC9),ISNUMBER(RC10)),1,0) -> 0 | M315: =OFFSET(INDIRECT(ADDRESS(RC1,3,3,1,"Gross")),0,Menus!R4C10) -> 0 | N315: =OFFSET(INDIRECT(ADDRESS(RC1,3,3,1,"Gross")),0,Menus!R3C10) -> 0
A316: 353 | B316: =OFFSET(INDIRECT(ADDRESS(RC1,3,3,1,Menus!R10C11)),0,Menus!R4C10) -> 0 | C316: =OFFSET(INDIRECT(ADDRESS(RC1,3,3,1,Menus!R10C11)),0,Menus!R3C10) -> 0 | D316: =IF(Menus!R9C10,RC[-1]/RC[-2],RC[-1]) -> #DIV/0! | E316: =IF(RC11=1,VALUE(RC[-3]),NA()) -> NA() | F316: =INDIRECT(ADDRESS(RC1,1,3,1,Menus!R10C11)) -> 0 | G316: =IF(INDIRECT(ADDRESS(RC1,2,3,1,Menus!R10C11))=R1C,RC4,NA()) -> NA() | H316: =IF(INDIRECT(ADDRESS(RC1,2,3,1,Menus!R10C11))=R1C,RC4,NA()) -> NA() | I316: =IF(INDIRECT(ADDRESS(RC1,2,3,1,Menus!R10C11))=R1C,RC4,NA()) -> NA() | J316: =IF(INDIRECT(ADDRESS(RC1,1,3,1,Menus!R10C11))=T(R1C),RC4,NA()) -> NA() | K316: =IF(OR(ISNUMBER(RC7),ISNUMBER(RC8),ISNUMBER(RC9),ISNUMBER(RC10)),1,0) -> 0 | M316: =OFFSET(INDIRECT(ADDRESS(RC1,3,3,1,"Gross")),0,Menus!R4C10) -> 0 | N316: =OFFSET(INDIRECT(ADDRESS(RC1,3,3,1,"Gross")),0,Menus!R3C10) -> 0
A317: 354 | B317: =OFFSET(INDIRECT(ADDRESS(RC1,3,3,1,Menus!R10C11)),0,Menus!R4C10) -> 0 | C317: =OFFSET(INDIRECT(ADDRESS(RC1,3,3,1,Menus!R10C11)),0,Menus!R3C10) -> 0 | D317: =IF(Menus!R9C10,RC[-1]/RC[-2],RC[-1]) -> #DIV/0! | E317: =IF(RC11=1,VALUE(RC[-3]),NA()) -> NA() | F317: =INDIRECT(ADDRESS(RC1,1,3,1,Menus!R10C11)) -> 0 | G317: =IF(INDIRECT(ADDRESS(RC1,2,3,1,Menus!R10C11))=R1C,RC4,NA()) -> NA() | H317: =IF(INDIRECT(ADDRESS(RC1,2,3,1,Menus!R10C11))=R1C,RC4,NA()) -> NA() | I317: =IF(INDIRECT(ADDRESS(RC1,2,3,1,Menus!R10C11))=R1C,RC4,NA()) -> NA() | J317: =IF(INDIRECT(ADDRESS(RC1,1,3,1,Menus!R10C11))=T(R1C),RC4,NA()) -> NA() | K317: =IF(OR(ISNUMBER(RC7),ISNUMBER(RC8),ISNUMBER(RC9),ISNUMBER(RC10)),1,0) -> 0 | M317: =OFFSET(INDIRECT(ADDRESS(RC1,3,3,1,"Gross")),0,Menus!R4C10) -> 0 | N317: =OFFSET(INDIRECT(ADDRESS(RC1,3,3,1,"Gross")),0,Menus!R3C10) -> 0
A318: 355 | B318: =OFFSET(INDIRECT(ADDRESS(RC1,3,3,1,Menus!R10C11)),0,Menus!R4C10) -> 0 | C318: =OFFSET(INDIRECT(ADDRESS(RC1,3,3,1,Menus!R10C11)),0,Menus!R3C10) -> 0 | D318: =IF(Menus!R9C10,RC[-1]/RC[-2],RC[-1]) -> #DIV/0! | E318: =IF(RC11=1,VALUE(RC[-3]),NA()) -> NA() | F318: =INDIRECT(ADDRESS(RC1,1,3,1,Menus!R10C11)) -> 0 | G318: =IF(INDIRECT(ADDRESS(RC1,2,3,1,Menus!R10C11))=R1C,RC4,NA()) -> NA() | H318: =IF(INDIRECT(ADDRESS(RC1,2,3,1,Menus!R10C11))=R1C,RC4,NA()) -> NA() | I318: =IF(INDIRECT(ADDRESS(RC1,2,3,1,Menus!R10C11))=R1C,RC4,NA()) -> NA() | J318: =IF(INDIRECT(ADDRESS(RC1,1,3,1,Menus!R10C11))=T(R1C),RC4,NA()) -> NA() | K318: =IF(OR(ISNUMBER(RC7),ISNUMBER(RC8),ISNUMBER(RC9),ISNUMBER(RC10)),1,0) -> 0 | M318: =OFFSET(INDIRECT(ADDRESS(RC1,3,3,1,"Gross")),0,Menus!R4C10) -> 0 | N318: =OFFSET(INDIRECT(ADDRESS(RC1,3,3,1,"Gross")),0,Menus!R3C10) -> 0
A319: 356 | B319: =OFFSET(INDIRECT(ADDRESS(RC1,3,3,1,Menus!R10C11)),0,Menus!R4C10) -> 0 | C319: =OFFSET(INDIRECT(ADDRESS(RC1,3,3,1,Menus!R10C11)),0,Menus!R3C10) -> 0 | D319: =IF(Menus!R9C10,RC[-1]/RC[-2],RC[-1]) -> #DIV/0! | E319: =IF(RC11=1,VALUE(RC[-3]),NA()) -> NA() | F319: =INDIRECT(ADDRESS(RC1,1,3,1,Menus!R10C11)) -> 0 | G319: =IF(INDIRECT(ADDRESS(RC1,2,3,1,Menus!R10C11))=R1C,RC4,NA()) -> NA() | H319: =IF(INDIRECT(ADDRESS(RC1,2,3,1,Menus!R10C11))=R1C,RC4,NA()) -> NA() | I319: =IF(INDIRECT(ADDRESS(RC1,2,3,1,Menus!R10C11))=R1C,RC4,NA()) -> NA() | J319: =IF(INDIRECT(ADDRESS(RC1,1,3,1,Menus!R10C11))=T(R1C),RC4,NA()) -> NA() | K319: =IF(OR(ISNUMBER(RC7),ISNUMBER(RC8),ISNUMBER(RC9),ISNUMBER(RC10)),1,0) -> 0 | M319: =OFFSET(INDIRECT(ADDRESS(RC1,3,3,1,"Gross")),0,Menus!R4C10) -> 0 | N319: =OFFSET(INDIRECT(ADDRESS(RC1,3,3,1,"Gross")),0,Menus!R3C10) -> 0
A320: 357 | B320: =OFFSET(INDIRECT(ADDRESS(RC1,3,3,1,Menus!R10C11)),0,Menus!R4C10) -> 0 | C320: =OFFSET(INDIRECT(ADDRESS(RC1,3,3,1,Menus!R10C11)),0,Menus!R3C10) -> 0 | D320: =IF(Menus!R9C10,RC[-1]/RC[-2],RC[-1]) -> #DIV/0! | E320: =IF(RC11=1,VALUE(RC[-3]),NA()) -> NA() | F320: =INDIRECT(ADDRESS(RC1,1,3,1,Menus!R10C11)) -> 0 | G320: =IF(INDIRECT(ADDRESS(RC1,2,3,1,Menus!R10C11))=R1C,RC4,NA()) -> NA() | H320: =IF(INDIRECT(ADDRESS(RC1,2,3,1,Menus!R10C11))=R1C,RC4,NA()) -> NA() | I320: =IF(INDIRECT(ADDRESS(RC1,2,3,1,Menus!R10C11))=R1C,RC4,NA()) -> NA() | J320: =IF(INDIRECT(ADDRESS(RC1,1,3,1,Menus!R10C11))=T(R1C),RC4,NA()) -> NA() | K320: =IF(OR(ISNUMBER(RC7),ISNUMBER(RC8),ISNUMBER(RC9),ISNUMBER(RC10)),1,0) -> 0 | M320: =OFFSET(INDIRECT(ADDRESS(RC1,3,3,1,"Gross")),0,Menus!R4C10) -> 0 | N320: =OFFSET(INDIRECT(ADDRESS(RC1,3,3,1,"Gross")),0,Menus!R3C10) -> 0
A321: 358 | B321: =OFFSET(INDIRECT(ADDRESS(RC1,3,3,1,Menus!R10C11)),0,Menus!R4C10) -> 0 | C321: =OFFSET(INDIRECT(ADDRESS(RC1,3,3,1,Menus!R10C11)),0,Menus!R3C10) -> 0 | D321: =IF(Menus!R9C10,RC[-1]/RC[-2],RC[-1]) -> #DIV/0! | E321: =IF(RC11=1,VALUE(RC[-3]),NA()) -> NA() | F321: =INDIRECT(ADDRESS(RC1,1,3,1,Menus!R10C11)) -> 0 | G321: =IF(INDIRECT(ADDRESS(RC1,2,3,1,Menus!R10C11))=R1C,RC4,NA()) -> NA() | H321: =IF(INDIRECT(ADDRESS(RC1,2,3,1,Menus!R10C11))=R1C,RC4,NA()) -> NA() | I321: =IF(INDIRECT(ADDRESS(RC1,2,3,1,Menus!R10C11))=R1C,RC4,NA()) -> NA() | J321: =IF(INDIRECT(ADDRESS(RC1,1,3,1,Menus!R10C11))=T(R1C),RC4,NA()) -> NA() | K321: =IF(OR(ISNUMBER(RC7),ISNUMBER(RC8),ISNUMBER(RC9),ISNUMBER(RC10)),1,0) -> 0 | M321: =OFFSET(INDIRECT(ADDRESS(RC1,3,3,1,"Gross")),0,Menus!R4C10) -> 0 | N321: =OFFSET(INDIRECT(ADDRESS(RC1,3,3,1,"Gross")),0,Menus!R3C10) -> 0
A322: 359 | B322: =OFFSET(INDIRECT(ADDRESS(RC1,3,3,1,Menus!R10C11)),0,Menus!R4C10) -> 0 | C322: =OFFSET(INDIRECT(ADDRESS(RC1,3,3,1,Menus!R10C11)),0,Menus!R3C10) -> 0 | D322: =IF(Menus!R9C10,RC[-1]/RC[-2],RC[-1]) -> #DIV/0! | E322: =IF(RC11=1,VALUE(RC[-3]),NA()) -> NA() | F322: =INDIRECT(ADDRESS(RC1,1,3,1,Menus!R10C11)) -> 0 | G322: =IF(INDIRECT(ADDRESS(RC1,2,3,1,Menus!R10C11))=R1C,RC4,NA()) -> NA() | H322: =IF(INDIRECT(ADDRESS(RC1,2,3,1,Menus!R10C11))=R1C,RC4,NA()) -> NA() | I322: =IF(INDIRECT(ADDRESS(RC1,2,3,1,Menus!R10C11))=R1C,RC4,NA()) -> NA() | J322: =IF(INDIRECT(ADDRESS(RC1,1,3,1,Menus!R10C11))=T(R1C),RC4,NA()) -> NA() | K322: =IF(OR(ISNUMBER(RC7),ISNUMBER(RC8),ISNUMBER(RC9),ISNUMBER(RC10)),1,0) -> 0 | M322: =OFFSET(INDIRECT(ADDRESS(RC1,3,3,1,"Gross")),0,Menus!R4C10) -> 0 | N322: =OFFSET(INDIRECT(ADDRESS(RC1,3,3,1,"Gross")),0,Menus!R3C10) -> 0
A323: 360 | B323: =OFFSET(INDIRECT(ADDRESS(RC1,3,3,1,Menus!R10C11)),0,Menus!R4C10) -> 0 | C323: =OFFSET(INDIRECT(ADDRESS(RC1,3,3,1,Menus!R10C11)),0,Menus!R3C10) -> 0 | D323: =IF(Menus!R9C10,RC[-1]/RC[-2],RC[-1]) -> #DIV/0! | E323: =IF(RC11=1,VALUE(RC[-3]),NA()) -> NA() | F323: =INDIRECT(ADDRESS(RC1,1,3,1,Menus!R10C11)) -> 0 | G323: =IF(INDIRECT(ADDRESS(RC1,2,3,1,Menus!R10C11))=R1C,RC4,NA()) -> NA() | H323: =IF(INDIRECT(ADDRESS(RC1,2,3,1,Menus!R10C11))=R1C,RC4,NA()) -> NA() | I323: =IF(INDIRECT(ADDRESS(RC1,2,3,1,Menus!R10C11))=R1C,RC4,NA()) -> NA() | J323: =IF(INDIRECT(ADDRESS(RC1,1,3,1,Menus!R10C11))=T(R1C),RC4,NA()) -> NA() | K323: =IF(OR(ISNUMBER(RC7),ISNUMBER(RC8),ISNUMBER(RC9),ISNUMBER(RC10)),1,0) -> 0 | M323: =OFFSET(INDIRECT(ADDRESS(RC1,3,3,1,"Gross")),0,Menus!R4C10) -> 0 | N323: =OFFSET(INDIRECT(ADDRESS(RC1,3,3,1,"Gross")),0,Menus!R3C10) -> 0
A324: 361 | B324: =OFFSET(INDIRECT(ADDRESS(RC1,3,3,1,Menus!R10C11)),0,Menus!R4C10) -> 0 | C324: =OFFSET(INDIRECT(ADDRESS(RC1,3,3,1,Menus!R10C11)),0,Menus!R3C10) -> 0 | D324: =IF(Menus!R9C10,RC[-1]/RC[-2],RC[-1]) -> #DIV/0! | E324: =IF(RC11=1,VALUE(RC[-3]),NA()) -> NA() | F324: =INDIRECT(ADDRESS(RC1,1,3,1,Menus!R10C11)) -> 0 | G324: =IF(INDIRECT(ADDRESS(RC1,2,3,1,Menus!R10C11))=R1C,RC4,NA()) -> NA() | H324: =IF(INDIRECT(ADDRESS(RC1,2,3,1,Menus!R10C11))=R1C,RC4,NA()) -> NA() | I324: =IF(INDIRECT(ADDRESS(RC1,2,3,1,Menus!R10C11))=R1C,RC4,NA()) -> NA() | J324: =IF(INDIRECT(ADDRESS(RC1,1,3,1,Menus!R10C11))=T(R1C),RC4,NA()) -> NA() | K324: =IF(OR(ISNUMBER(RC7),ISNUMBER(RC8),ISNUMBER(RC9),ISNUMBER(RC10)),1,0) -> 0 | M324: =OFFSET(INDIRECT(ADDRESS(RC1,3,3,1,"Gross")),0,Menus!R4C10) -> 0 | N324: =OFFSET(INDIRECT(ADDRESS(RC1,3,3,1,"Gross")),0,Menus!R3C10) -> 0
A325: 362 | B325: =OFFSET(INDIRECT(ADDRESS(RC1,3,3,1,Menus!R10C11)),0,Menus!R4C10) -> 0 | C325: =OFFSET(INDIRECT(ADDRESS(RC1,3,3,1,Menus!R10C11)),0,Menus!R3C10) -> 0 | D325: =IF(Menus!R9C10,RC[-1]/RC[-2],RC[-1]) -> #DIV/0! | E325: =IF(RC11=1,VALUE(RC[-3]),NA()) -> NA() | F325: =INDIRECT(ADDRESS(RC1,1,3,1,Menus!R10C11)) -> 0 | G325: =IF(INDIRECT(ADDRESS(RC1,2,3,1,Menus!R10C11))=R1C,RC4,NA()) -> NA() | H325: =IF(INDIRECT(ADDRESS(RC1,2,3,1,Menus!R10C11))=R1C,RC4,NA()) -> NA() | I325: =IF(INDIRECT(ADDRESS(RC1,2,3,1,Menus!R10C11))=R1C,RC4,NA()) -> NA() | J325: =IF(INDIRECT(ADDRESS(RC1,1,3,1,Menus!R10C11))=T(R1C),RC4,NA()) -> NA() | K325: =IF(OR(ISNUMBER(RC7),ISNUMBER(RC8),ISNUMBER(RC9),ISNUMBER(RC10)),1,0) -> 0 | M325: =OFFSET(INDIRECT(ADDRESS(RC1,3,3,1,"Gross")),0,Menus!R4C10) -> 0 | N325: =OFFSET(INDIRECT(ADDRESS(RC1,3,3,1,"Gross")),0,Menus!R3C10) -> 0
A326: 363 | B326: =OFFSET(INDIRECT(ADDRESS(RC1,3,3,1,Menus!R10C11)),0,Menus!R4C10) -> 0 | C326: =OFFSET(INDIRECT(ADDRESS(RC1,3,3,1,Menus!R10C11)),0,Menus!R3C10) -> 0 | D326: =IF(Menus!R9C10,RC[-1]/RC[-2],RC[-1]) -> #DIV/0! | E326: =IF(RC11=1,VALUE(RC[-3]),NA()) -> NA() | F326: =INDIRECT(ADDRESS(RC1,1,3,1,Menus!R10C11)) -> 0 | G326: =IF(INDIRECT(ADDRESS(RC1,2,3,1,Menus!R10C11))=R1C,RC4,NA()) -> NA() | H326: =IF(INDIRECT(ADDRESS(RC1,2,3,1,Menus!R10C11))=R1C,RC4,NA()) -> NA() | I326: =IF(INDIRECT(ADDRESS(RC1,2,3,1,Menus!R10C11))=R1C,RC4,NA()) -> NA() | J326: =IF(INDIRECT(ADDRESS(RC1,1,3,1,Menus!R10C11))=T(R1C),RC4,NA()) -> NA() | K326: =IF(OR(ISNUMBER(RC7),ISNUMBER(RC8),ISNUMBER(RC9),ISNUMBER(RC10)),1,0) -> 0 | M326: =OFFSET(INDIRECT(ADDRESS(RC1,3,3,1,"Gross")),0,Menus!R4C10) -> 0 | N326: =OFFSET(INDIRECT(ADDRESS(RC1,3,3,1,"Gross")),0,Menus!R3C10) -> 0
A327: 364 | B327: =OFFSET(INDIRECT(ADDRESS(RC1,3,3,1,Menus!R10C11)),0,Menus!R4C10) -> 0 | C327: =OFFSET(INDIRECT(ADDRESS(RC1,3,3,1,Menus!R10C11)),0,Menus!R3C10) -> 0 | D327: =IF(Menus!R9C10,RC[-1]/RC[-2],RC[-1]) -> #DIV/0! | E327: =IF(RC11=1,VALUE(RC[-3]),NA()) -> NA() | F327: =INDIRECT(ADDRESS(RC1,1,3,1,Menus!R10C11)) -> 0 | G327: =IF(INDIRECT(ADDRESS(RC1,2,3,1,Menus!R10C11))=R1C,RC4,NA()) -> NA() | H327: =IF(INDIRECT(ADDRESS(RC1,2,3,1,Menus!R10C11))=R1C,RC4,NA()) -> NA() | I327: =IF(INDIRECT(ADDRESS(RC1,2,3,1,Menus!R10C11))=R1C,RC4,NA()) -> NA() | J327: =IF(INDIRECT(ADDRESS(RC1,1,3,1,Menus!R10C11))=T(R1C),RC4,NA()) -> NA() | K327: =IF(OR(ISNUMBER(RC7),ISNUMBER(RC8),ISNUMBER(RC9),ISNUMBER(RC10)),1,0) -> 0 | M327: =OFFSET(INDIRECT(ADDRESS(RC1,3,3,1,"Gross")),0,Menus!R4C10) -> 0 | N327: =OFFSET(INDIRECT(ADDRESS(RC1,3,3,1,"Gross")),0,Menus!R3C10) -> 0
A328: 365 | B328: =OFFSET(INDIRECT(ADDRESS(RC1,3,3,1,Menus!R10C11)),0,Menus!R4C10) -> 0 | C328: =OFFSET(INDIRECT(ADDRESS(RC1,3,3,1,Menus!R10C11)),0,Menus!R3C10) -> 0 | D328: =IF(Menus!R9C10,RC[-1]/RC[-2],RC[-1]) -> #DIV/0! | E328: =IF(RC11=1,VALUE(RC[-3]),NA()) -> NA() | F328: =INDIRECT(ADDRESS(RC1,1,3,1,Menus!R10C11)) -> 0 | G328: =IF(INDIRECT(ADDRESS(RC1,2,3,1,Menus!R10C11))=R1C,RC4,NA()) -> NA() | H328: =IF(INDIRECT(ADDRESS(RC1,2,3,1,Menus!R10C11))=R1C,RC4,NA()) -> NA() | I328: =IF(INDIRECT(ADDRESS(RC1,2,3,1,Menus!R10C11))=R1C,RC4,NA()) -> NA() | J328: =IF(INDIRECT(ADDRESS(RC1,1,3,1,Menus!R10C11))=T(R1C),RC4,NA()) -> NA() | K328: =IF(OR(ISNUMBER(RC7),ISNUMBER(RC8),ISNUMBER(RC9),ISNUMBER(RC10)),1,0) -> 0 | M328: =OFFSET(INDIRECT(ADDRESS(RC1,3,3,1,"Gross")),0,Menus!R4C10) -> 0 | N328: =OFFSET(INDIRECT(ADDRESS(RC1,3,3,1,"Gross")),0,Menus!R3C10) -> 0
A329: 366 | B329: =OFFSET(INDIRECT(ADDRESS(RC1,3,3,1,Menus!R10C11)),0,Menus!R4C10) -> 0 | C329: =OFFSET(INDIRECT(ADDRESS(RC1,3,3,1,Menus!R10C11)),0,Menus!R3C10) -> 0 | D329: =IF(Menus!R9C10,RC[-1]/RC[-2],RC[-1]) -> #DIV/0! | E329: =IF(RC11=1,VALUE(RC[-3]),NA()) -> NA() | F329: =INDIRECT(ADDRESS(RC1,1,3,1,Menus!R10C11)) -> 0 | G329: =IF(INDIRECT(ADDRESS(RC1,2,3,1,Menus!R10C11))=R1C,RC4,NA()) -> NA() | H329: =IF(INDIRECT(ADDRESS(RC1,2,3,1,Menus!R10C11))=R1C,RC4,NA()) -> NA() | I329: =IF(INDIRECT(ADDRESS(RC1,2,3,1,Menus!R10C11))=R1C,RC4,NA()) -> NA() | J329: =IF(INDIRECT(ADDRESS(RC1,1,3,1,Menus!R10C11))=T(R1C),RC4,NA()) -> NA() | K329: =IF(OR(ISNUMBER(RC7),ISNUMBER(RC8),ISNUMBER(RC9),ISNUMBER(RC10)),1,0) -> 0 | M329: =OFFSET(INDIRECT(ADDRESS(RC1,3,3,1,"Gross")),0,Menus!R4C10) -> 0 | N329: =OFFSET(INDIRECT(ADDRESS(RC1,3,3,1,"Gross")),0,Menus!R3C10) -> 0
A330: 367 | B330: =OFFSET(INDIRECT(ADDRESS(RC1,3,3,1,Menus!R10C11)),0,Menus!R4C10) -> 0 | C330: =OFFSET(INDIRECT(ADDRESS(RC1,3,3,1,Menus!R10C11)),0,Menus!R3C10) -> 0 | D330: =IF(Menus!R9C10,RC[-1]/RC[-2],RC[-1]) -> #DIV/0! | E330: =IF(RC11=1,VALUE(RC[-3]),NA()) -> NA() | F330: =INDIRECT(ADDRESS(RC1,1,3,1,Menus!R10C11)) -> 0 | G330: =IF(INDIRECT(ADDRESS(RC1,2,3,1,Menus!R10C11))=R1C,RC4,NA()) -> NA() | H330: =IF(INDIRECT(ADDRESS(RC1,2,3,1,Menus!R10C11))=R1C,RC4,NA()) -> NA() | I330: =IF(INDIRECT(ADDRESS(RC1,2,3,1,Menus!R10C11))=R1C,RC4,NA()) -> NA() | J330: =IF(INDIRECT(ADDRESS(RC1,1,3,1,Menus!R10C11))=T(R1C),RC4,NA()) -> NA() | K330: =IF(OR(ISNUMBER(RC7),ISNUMBER(RC8),ISNUMBER(RC9),ISNUMBER(RC10)),1,0) -> 0 | M330: =OFFSET(INDIRECT(ADDRESS(RC1,3,3,1,"Gross")),0,Menus!R4C10) -> 0 | N330: =OFFSET(INDIRECT(ADDRESS(RC1,3,3,1,"Gross")),0,Menus!R3C10) -> 0
A331: 368 | B331: =OFFSET(INDIRECT(ADDRESS(RC1,3,3,1,Menus!R10C11)),0,Menus!R4C10) -> 0 | C331: =OFFSET(INDIRECT(ADDRESS(RC1,3,3,1,Menus!R10C11)),0,Menus!R3C10) -> 0 | D331: =IF(Menus!R9C10,RC[-1]/RC[-2],RC[-1]) -> #DIV/0! | E331: =IF(RC11=1,VALUE(RC[-3]),NA()) -> NA() | F331: =INDIRECT(ADDRESS(RC1,1,3,1,Menus!R10C11)) -> 0 | G331: =IF(INDIRECT(ADDRESS(RC1,2,3,1,Menus!R10C11))=R1C,RC4,NA()) -> NA() | H331: =IF(INDIRECT(ADDRESS(RC1,2,3,1,Menus!R10C11))=R1C,RC4,NA()) -> NA() | I331: =IF(INDIRECT(ADDRESS(RC1,2,3,1,Menus!R10C11))=R1C,RC4,NA()) -> NA() | J331: =IF(INDIRECT(ADDRESS(RC1,1,3,1,Menus!R10C11))=T(R1C),RC4,NA()) -> NA() | K331: =IF(OR(ISNUMBER(RC7),ISNUMBER(RC8),ISNUMBER(RC9),ISNUMBER(RC10)),1,0) -> 0 | M331: =OFFSET(INDIRECT(ADDRESS(RC1,3,3,1,"Gross")),0,Menus!R4C10) -> 0 | N331: =OFFSET(INDIRECT(ADDRESS(RC1,3,3,1,"Gross")),0,Menus!R3C10) -> 0
A332: 369 | B332: =OFFSET(INDIRECT(ADDRESS(RC1,3,3,1,Menus!R10C11)),0,Menus!R4C10) -> 0 | C332: =OFFSET(INDIRECT(ADDRESS(RC1,3,3,1,Menus!R10C11)),0,Menus!R3C10) -> 0 | D332: =IF(Menus!R9C10,RC[-1]/RC[-2],RC[-1]) -> #DIV/0! | E332: =IF(RC11=1,VALUE(RC[-3]),NA()) -> NA() | F332: =INDIRECT(ADDRESS(RC1,1,3,1,Menus!R10C11)) -> 0 | G332: =IF(INDIRECT(ADDRESS(RC1,2,3,1,Menus!R10C11))=R1C,RC4,NA()) -> NA() | H332: =IF(INDIRECT(ADDRESS(RC1,2,3,1,Menus!R10C11))=R1C,RC4,NA()) -> NA() | I332: =IF(INDIRECT(ADDRESS(RC1,2,3,1,Menus!R10C11))=R1C,RC4,NA()) -> NA() | J332: =IF(INDIRECT(ADDRESS(RC1,1,3,1,Menus!R10C11))=T(R1C),RC4,NA()) -> NA() | K332: =IF(OR(ISNUMBER(RC7),ISNUMBER(RC8),ISNUMBER(RC9),ISNUMBER(RC10)),1,0) -> 0 | M332: =OFFSET(INDIRECT(ADDRESS(RC1,3,3,1,"Gross")),0,Menus!R4C10) -> 0 | N332: =OFFSET(INDIRECT(ADDRESS(RC1,3,3,1,"Gross")),0,Menus!R3C10) -> 0
A333: 370 | B333: =OFFSET(INDIRECT(ADDRESS(RC1,3,3,1,Menus!R10C11)),0,Menus!R4C10) -> 0 | C333: =OFFSET(INDIRECT(ADDRESS(RC1,3,3,1,Menus!R10C11)),0,Menus!R3C10) -> 0 | D333: =IF(Menus!R9C10,RC[-1]/RC[-2],RC[-1]) -> #DIV/0! | E333: =IF(RC11=1,VALUE(RC[-3]),NA()) -> NA() | F333: =INDIRECT(ADDRESS(RC1,1,3,1,Menus!R10C11)) -> 0 | G333: =IF(INDIRECT(ADDRESS(RC1,2,3,1,Menus!R10C11))=R1C,RC4,NA()) -> NA() | H333: =IF(INDIRECT(ADDRESS(RC1,2,3,1,Menus!R10C11))=R1C,RC4,NA()) -> NA() | I333: =IF(INDIRECT(ADDRESS(RC1,2,3,1,Menus!R10C11))=R1C,RC4,NA()) -> NA() | J333: =IF(INDIRECT(ADDRESS(RC1,1,3,1,Menus!R10C11))=T(R1C),RC4,NA()) -> NA() | K333: =IF(OR(ISNUMBER(RC7),ISNUMBER(RC8),ISNUMBER(RC9),ISNUMBER(RC10)),1,0) -> 0 | M333: =OFFSET(INDIRECT(ADDRESS(RC1,3,3,1,"Gross")),0,Menus!R4C10) -> 0 | N333: =OFFSET(INDIRECT(ADDRESS(RC1,3,3,1,"Gross")),0,Menus!R3C10) -> 0
A334: 371 | B334: =OFFSET(INDIRECT(ADDRESS(RC1,3,3,1,Menus!R10C11)),0,Menus!R4C10) -> 0 | C334: =OFFSET(INDIRECT(ADDRESS(RC1,3,3,1,Menus!R10C11)),0,Menus!R3C10) -> 0 | D334: =IF(Menus!R9C10,RC[-1]/RC[-2],RC[-1]) -> #DIV/0! | E334: =IF(RC11=1,VALUE(RC[-3]),NA()) -> NA() | F334: =INDIRECT(ADDRESS(RC1,1,3,1,Menus!R10C11)) -> 0 | G334: =IF(INDIRECT(ADDRESS(RC1,2,3,1,Menus!R10C11))=R1C,RC4,NA()) -> NA() | H334: =IF(INDIRECT(ADDRESS(RC1,2,3,1,Menus!R10C11))=R1C,RC4,NA()) -> NA() | I334: =IF(INDIRECT(ADDRESS(RC1,2,3,1,Menus!R10C11))=R1C,RC4,NA()) -> NA() | J334: =IF(INDIRECT(ADDRESS(RC1,1,3,1,Menus!R10C11))=T(R1C),RC4,NA()) -> NA() | K334: =IF(OR(ISNUMBER(RC7),ISNUMBER(RC8),ISNUMBER(RC9),ISNUMBER(RC10)),1,0) -> 0 | M334: =OFFSET(INDIRECT(ADDRESS(RC1,3,3,1,"Gross")),0,Menus!R4C10) -> 0 | N334: =OFFSET(INDIRECT(ADDRESS(RC1,3,3,1,"Gross")),0,Menus!R3C10) -> 0
A335: 372 | B335: =OFFSET(INDIRECT(ADDRESS(RC1,3,3,1,Menus!R10C11)),0,Menus!R4C10) -> 0 | C335: =OFFSET(INDIRECT(ADDRESS(RC1,3,3,1,Menus!R10C11)),0,Menus!R3C10) -> 0 | D335: =IF(Menus!R9C10,RC[-1]/RC[-2],RC[-1]) -> #DIV/0! | E335: =IF(RC11=1,VALUE(RC[-3]),NA()) -> NA() | F335: =INDIRECT(ADDRESS(RC1,1,3,1,Menus!R10C11)) -> 0 | G335: =IF(INDIRECT(ADDRESS(RC1,2,3,1,Menus!R10C11))=R1C,RC4,NA()) -> NA() | H335: =IF(INDIRECT(ADDRESS(RC1,2,3,1,Menus!R10C11))=R1C,RC4,NA()) -> NA() | I335: =IF(INDIRECT(ADDRESS(RC1,2,3,1,Menus!R10C11))=R1C,RC4,NA()) -> NA() | J335: =IF(INDIRECT(ADDRESS(RC1,1,3,1,Menus!R10C11))=T(R1C),RC4,NA()) -> NA() | K335: =IF(OR(ISNUMBER(RC7),ISNUMBER(RC8),ISNUMBER(RC9),ISNUMBER(RC10)),1,0) -> 0 | M335: =OFFSET(INDIRECT(ADDRESS(RC1,3,3,1,"Gross")),0,Menus!R4C10) -> 0 | N335: =OFFSET(INDIRECT(ADDRESS(RC1,3,3,1,"Gross")),0,Menus!R3C10) -> 0
A336: 373 | B336: =OFFSET(INDIRECT(ADDRESS(RC1,3,3,1,Menus!R10C11)),0,Menus!R4C10) -> 0 | C336: =OFFSET(INDIRECT(ADDRESS(RC1,3,3,1,Menus!R10C11)),0,Menus!R3C10) -> 0 | D336: =IF(Menus!R9C10,RC[-1]/RC[-2],RC[-1]) -> #DIV/0! | E336: =IF(RC11=1,VALUE(RC[-3]),NA()) -> NA() | F336: =INDIRECT(ADDRESS(RC1,1,3,1,Menus!R10C11)) -> 0 | G336: =IF(INDIRECT(ADDRESS(RC1,2,3,1,Menus!R10C11))=R1C,RC4,NA()) -> NA() | H336: =IF(INDIRECT(ADDRESS(RC1,2,3,1,Menus!R10C11))=R1C,RC4,NA()) -> NA() | I336: =IF(INDIRECT(ADDRESS(RC1,2,3,1,Menus!R10C11))=R1C,RC4,NA()) -> NA() | J336: =IF(INDIRECT(ADDRESS(RC1,1,3,1,Menus!R10C11))=T(R1C),RC4,NA()) -> NA() | K336: =IF(OR(ISNUMBER(RC7),ISNUMBER(RC8),ISNUMBER(RC9),ISNUMBER(RC10)),1,0) -> 0 | M336: =OFFSET(INDIRECT(ADDRESS(RC1,3,3,1,"Gross")),0,Menus!R4C10) -> 0 | N336: =OFFSET(INDIRECT(ADDRESS(RC1,3,3,1,"Gross")),0,Menus!R3C10) -> 0
A337: 374 | B337: =OFFSET(INDIRECT(ADDRESS(RC1,3,3,1,Menus!R10C11)),0,Menus!R4C10) -> 0 | C337: =OFFSET(INDIRECT(ADDRESS(RC1,3,3,1,Menus!R10C11)),0,Menus!R3C10) -> 0 | D337: =IF(Menus!R9C10,RC[-1]/RC[-2],RC[-1]) -> #DIV/0! | E337: =IF(RC11=1,VALUE(RC[-3]),NA()) -> NA() | F337: =INDIRECT(ADDRESS(RC1,1,3,1,Menus!R10C11)) -> 0 | G337: =IF(INDIRECT(ADDRESS(RC1,2,3,1,Menus!R10C11))=R1C,RC4,NA()) -> NA() | H337: =IF(INDIRECT(ADDRESS(RC1,2,3,1,Menus!R10C11))=R1C,RC4,NA()) -> NA() | I337: =IF(INDIRECT(ADDRESS(RC1,2,3,1,Menus!R10C11))=R1C,RC4,NA()) -> NA() | J337: =IF(INDIRECT(ADDRESS(RC1,1,3,1,Menus!R10C11))=T(R1C),RC4,NA()) -> NA() | K337: =IF(OR(ISNUMBER(RC7),ISNUMBER(RC8),ISNUMBER(RC9),ISNUMBER(RC10)),1,0) -> 0 | M337: =OFFSET(INDIRECT(ADDRESS(RC1,3,3,1,"Gross")),0,Menus!R4C10) -> 0 | N337: =OFFSET(INDIRECT(ADDRESS(RC1,3,3,1,"Gross")),0,Menus!R3C10) -> 0
A338: 375 | B338: =OFFSET(INDIRECT(ADDRESS(RC1,3,3,1,Menus!R10C11)),0,Menus!R4C10) -> 0 | C338: =OFFSET(INDIRECT(ADDRESS(RC1,3,3,1,Menus!R10C11)),0,Menus!R3C10) -> 0 | D338: =IF(Menus!R9C10,RC[-1]/RC[-2],RC[-1]) -> #DIV/0! | E338: =IF(RC11=1,VALUE(RC[-3]),NA()) -> NA() | F338: =INDIRECT(ADDRESS(RC1,1,3,1,Menus!R10C11)) -> 0 | G338: =IF(INDIRECT(ADDRESS(RC1,2,3,1,Menus!R10C11))=R1C,RC4,NA()) -> NA() | H338: =IF(INDIRECT(ADDRESS(RC1,2,3,1,Menus!R10C11))=R1C,RC4,NA()) -> NA() | I338: =IF(INDIRECT(ADDRESS(RC1,2,3,1,Menus!R10C11))=R1C,RC4,NA()) -> NA() | J338: =IF(INDIRECT(ADDRESS(RC1,1,3,1,Menus!R10C11))=T(R1C),RC4,NA()) -> NA() | K338: =IF(OR(ISNUMBER(RC7),ISNUMBER(RC8),ISNUMBER(RC9),ISNUMBER(RC10)),1,0) -> 0 | M338: =OFFSET(INDIRECT(ADDRESS(RC1,3,3,1,"Gross")),0,Menus!R4C10) -> 0 | N338: =OFFSET(INDIRECT(ADDRESS(RC1,3,3,1,"Gross")),0,Menus!R3C10) -> 0
A339: 376 | B339: =OFFSET(INDIRECT(ADDRESS(RC1,3,3,1,Menus!R10C11)),0,Menus!R4C10) -> 0 | C339: =OFFSET(INDIRECT(ADDRESS(RC1,3,3,1,Menus!R10C11)),0,Menus!R3C10) -> 0 | D339: =IF(Menus!R9C10,RC[-1]/RC[-2],RC[-1]) -> #DIV/0! | E339: =IF(RC11=1,VALUE(RC[-3]),NA()) -> NA() | F339: =INDIRECT(ADDRESS(RC1,1,3,1,Menus!R10C11)) -> 0 | G339: =IF(INDIRECT(ADDRESS(RC1,2,3,1,Menus!R10C11))=R1C,RC4,NA()) -> NA() | H339: =IF(INDIRECT(ADDRESS(RC1,2,3,1,Menus!R10C11))=R1C,RC4,NA()) -> NA() | I339: =IF(INDIRECT(ADDRESS(RC1,2,3,1,Menus!R10C11))=R1C,RC4,NA()) -> NA() | J339: =IF(INDIRECT(ADDRESS(RC1,1,3,1,Menus!R10C11))=T(R1C),RC4,NA()) -> NA() | K339: =IF(OR(ISNUMBER(RC7),ISNUMBER(RC8),ISNUMBER(RC9),ISNUMBER(RC10)),1,0) -> 0 | M339: =OFFSET(INDIRECT(ADDRESS(RC1,3,3,1,"Gross")),0,Menus!R4C10) -> 0 | N339: =OFFSET(INDIRECT(ADDRESS(RC1,3,3,1,"Gross")),0,Menus!R3C10) -> 0
A340: 377 | B340: =OFFSET(INDIRECT(ADDRESS(RC1,3,3,1,Menus!R10C11)),0,Menus!R4C10) -> 0 | C340: =OFFSET(INDIRECT(ADDRESS(RC1,3,3,1,Menus!R10C11)),0,Menus!R3C10) -> 0 | D340: =IF(Menus!R9C10,RC[-1]/RC[-2],RC[-1]) -> #DIV/0! | E340: =IF(RC11=1,VALUE(RC[-3]),NA()) -> NA() | F340: =INDIRECT(ADDRESS(RC1,1,3,1,Menus!R10C11)) -> 0 | G340: =IF(INDIRECT(ADDRESS(RC1,2,3,1,Menus!R10C11))=R1C,RC4,NA()) -> NA() | H340: =IF(INDIRECT(ADDRESS(RC1,2,3,1,Menus!R10C11))=R1C,RC4,NA()) -> NA() | I340: =IF(INDIRECT(ADDRESS(RC1,2,3,1,Menus!R10C11))=R1C,RC4,NA()) -> NA() | J340: =IF(INDIRECT(ADDRESS(RC1,1,3,1,Menus!R10C11))=T(R1C),RC4,NA()) -> NA() | K340: =IF(OR(ISNUMBER(RC7),ISNUMBER(RC8),ISNUMBER(RC9),ISNUMBER(RC10)),1,0) -> 0 | M340: =OFFSET(INDIRECT(ADDRESS(RC1,3,3,1,"Gross")),0,Menus!R4C10) -> 0 | N340: =OFFSET(INDIRECT(ADDRESS(RC1,3,3,1,"Gross")),0,Menus!R3C10) -> 0
A341: 378 | B341: =OFFSET(INDIRECT(ADDRESS(RC1,3,3,1,Menus!R10C11)),0,Menus!R4C10) -> 0 | C341: =OFFSET(INDIRECT(ADDRESS(RC1,3,3,1,Menus!R10C11)),0,Menus!R3C10) -> 0 | D341: =IF(Menus!R9C10,RC[-1]/RC[-2],RC[-1]) -> #DIV/0! | E341: =IF(RC11=1,VALUE(RC[-3]),NA()) -> NA() | F341: =INDIRECT(ADDRESS(RC1,1,3,1,Menus!R10C11)) -> 0 | G341: =IF(INDIRECT(ADDRESS(RC1,2,3,1,Menus!R10C11))=R1C,RC4,NA()) -> NA() | H341: =IF(INDIRECT(ADDRESS(RC1,2,3,1,Menus!R10C11))=R1C,RC4,NA()) -> NA() | I341: =IF(INDIRECT(ADDRESS(RC1,2,3,1,Menus!R10C11))=R1C,RC4,NA()) -> NA() | J341: =IF(INDIRECT(ADDRESS(RC1,1,3,1,Menus!R10C11))=T(R1C),RC4,NA()) -> NA() | K341: =IF(OR(ISNUMBER(RC7),ISNUMBER(RC8),ISNUMBER(RC9),ISNUMBER(RC10)),1,0) -> 0 | M341: =OFFSET(INDIRECT(ADDRESS(RC1,3,3,1,"Gross")),0,Menus!R4C10) -> 0 | N341: =OFFSET(INDIRECT(ADDRESS(RC1,3,3,1,"Gross")),0,Menus!R3C10) -> 0
A342: 379 | B342: =OFFSET(INDIRECT(ADDRESS(RC1,3,3,1,Menus!R10C11)),0,Menus!R4C10) -> 0 | C342: =OFFSET(INDIRECT(ADDRESS(RC1,3,3,1,Menus!R10C11)),0,Menus!R3C10) -> 0 | D342: =IF(Menus!R9C10,RC[-1]/RC[-2],RC[-1]) -> #DIV/0! | E342: =IF(RC11=1,VALUE(RC[-3]),NA()) -> NA() | F342: =INDIRECT(ADDRESS(RC1,1,3,1,Menus!R10C11)) -> 0 | G342: =IF(INDIRECT(ADDRESS(RC1,2,3,1,Menus!R10C11))=R1C,RC4,NA()) -> NA() | H342: =IF(INDIRECT(ADDRESS(RC1,2,3,1,Menus!R10C11))=R1C,RC4,NA()) -> NA() | I342: =IF(INDIRECT(ADDRESS(RC1,2,3,1,Menus!R10C11))=R1C,RC4,NA()) -> NA() | J342: =IF(INDIRECT(ADDRESS(RC1,1,3,1,Menus!R10C11))=T(R1C),RC4,NA()) -> NA() | K342: =IF(OR(ISNUMBER(RC7),ISNUMBER(RC8),ISNUMBER(RC9),ISNUMBER(RC10)),1,0) -> 0 | M342: =OFFSET(INDIRECT(ADDRESS(RC1,3,3,1,"Gross")),0,Menus!R4C10) -> 0 | N342: =OFFSET(INDIRECT(ADDRESS(RC1,3,3,1,"Gross")),0,Menus!R3C10) -> 0
A343: 380 | B343: =OFFSET(INDIRECT(ADDRESS(RC1,3,3,1,Menus!R10C11)),0,Menus!R4C10) -> 0 | C343: =OFFSET(INDIRECT(ADDRESS(RC1,3,3,1,Menus!R10C11)),0,Menus!R3C10) -> 0 | D343: =IF(Menus!R9C10,RC[-1]/RC[-2],RC[-1]) -> #DIV/0! | E343: =IF(RC11=1,VALUE(RC[-3]),NA()) -> NA() | F343: =INDIRECT(ADDRESS(RC1,1,3,1,Menus!R10C11)) -> 0 | G343: =IF(INDIRECT(ADDRESS(RC1,2,3,1,Menus!R10C11))=R1C,RC4,NA()) -> NA() | H343: =IF(INDIRECT(ADDRESS(RC1,2,3,1,Menus!R10C11))=R1C,RC4,NA()) -> NA() | I343: =IF(INDIRECT(ADDRESS(RC1,2,3,1,Menus!R10C11))=R1C,RC4,NA()) -> NA() | J343: =IF(INDIRECT(ADDRESS(RC1,1,3,1,Menus!R10C11))=T(R1C),RC4,NA()) -> NA() | K343: =IF(OR(ISNUMBER(RC7),ISNUMBER(RC8),ISNUMBER(RC9),ISNUMBER(RC10)),1,0) -> 0 | M343: =OFFSET(INDIRECT(ADDRESS(RC1,3,3,1,"Gross")),0,Menus!R4C10) -> 0 | N343: =OFFSET(INDIRECT(ADDRESS(RC1,3,3,1,"Gross")),0,Menus!R3C10) -> 0
A344: 381 | B344: =OFFSET(INDIRECT(ADDRESS(RC1,3,3,1,Menus!R10C11)),0,Menus!R4C10) -> 0 | C344: =OFFSET(INDIRECT(ADDRESS(RC1,3,3,1,Menus!R10C11)),0,Menus!R3C10) -> 0 | D344: =IF(Menus!R9C10,RC[-1]/RC[-2],RC[-1]) -> #DIV/0! | E344: =IF(RC11=1,VALUE(RC[-3]),NA()) -> NA() | F344: =INDIRECT(ADDRESS(RC1,1,3,1,Menus!R10C11)) -> 0 | G344: =IF(INDIRECT(ADDRESS(RC1,2,3,1,Menus!R10C11))=R1C,RC4,NA()) -> NA() | H344: =IF(INDIRECT(ADDRESS(RC1,2,3,1,Menus!R10C11))=R1C,RC4,NA()) -> NA() | I344: =IF(INDIRECT(ADDRESS(RC1,2,3,1,Menus!R10C11))=R1C,RC4,NA()) -> NA() | J344: =IF(INDIRECT(ADDRESS(RC1,1,3,1,Menus!R10C11))=T(R1C),RC4,NA()) -> NA() | K344: =IF(OR(ISNUMBER(RC7),ISNUMBER(RC8),ISNUMBER(RC9),ISNUMBER(RC10)),1,0) -> 0 | M344: =OFFSET(INDIRECT(ADDRESS(RC1,3,3,1,"Gross")),0,Menus!R4C10) -> 0 | N344: =OFFSET(INDIRECT(ADDRESS(RC1,3,3,1,"Gross")),0,Menus!R3C10) -> 0
A345: 382 | B345: =OFFSET(INDIRECT(ADDRESS(RC1,3,3,1,Menus!R10C11)),0,Menus!R4C10) -> 0 | C345: =OFFSET(INDIRECT(ADDRESS(RC1,3,3,1,Menus!R10C11)),0,Menus!R3C10) -> 0 | D345: =IF(Menus!R9C10,RC[-1]/RC[-2],RC[-1]) -> #DIV/0! | E345: =IF(RC11=1,VALUE(RC[-3]),NA()) -> NA() | F345: =INDIRECT(ADDRESS(RC1,1,3,1,Menus!R10C11)) -> 0 | G345: =IF(INDIRECT(ADDRESS(RC1,2,3,1,Menus!R10C11))=R1C,RC4,NA()) -> NA() | H345: =IF(INDIRECT(ADDRESS(RC1,2,3,1,Menus!R10C11))=R1C,RC4,NA()) -> NA() | I345: =IF(INDIRECT(ADDRESS(RC1,2,3,1,Menus!R10C11))=R1C,RC4,NA()) -> NA() | J345: =IF(INDIRECT(ADDRESS(RC1,1,3,1,Menus!R10C11))=T(R1C),RC4,NA()) -> NA() | K345: =IF(OR(ISNUMBER(RC7),ISNUMBER(RC8),ISNUMBER(RC9),ISNUMBER(RC10)),1,0) -> 0 | M345: =OFFSET(INDIRECT(ADDRESS(RC1,3,3,1,"Gross")),0,Menus!R4C10) -> 0 | N345: =OFFSET(INDIRECT(ADDRESS(RC1,3,3,1,"Gross")),0,Menus!R3C10) -> 0
A346: 383 | B346: =OFFSET(INDIRECT(ADDRESS(RC1,3,3,1,Menus!R10C11)),0,Menus!R4C10) -> 0 | C346: =OFFSET(INDIRECT(ADDRESS(RC1,3,3,1,Menus!R10C11)),0,Menus!R3C10) -> 0 | D346: =IF(Menus!R9C10,RC[-1]/RC[-2],RC[-1]) -> #DIV/0! | E346: =IF(RC11=1,VALUE(RC[-3]),NA()) -> NA() | F346: =INDIRECT(ADDRESS(RC1,1,3,1,Menus!R10C11)) -> 0 | G346: =IF(INDIRECT(ADDRESS(RC1,2,3,1,Menus!R10C11))=R1C,RC4,NA()) -> NA() | H346: =IF(INDIRECT(ADDRESS(RC1,2,3,1,Menus!R10C11))=R1C,RC4,NA()) -> NA() | I346: =IF(INDIRECT(ADDRESS(RC1,2,3,1,Menus!R10C11))=R1C,RC4,NA()) -> NA() | J346: =IF(INDIRECT(ADDRESS(RC1,1,3,1,Menus!R10C11))=T(R1C),RC4,NA()) -> NA() | K346: =IF(OR(ISNUMBER(RC7),ISNUMBER(RC8),ISNUMBER(RC9),ISNUMBER(RC10)),1,0) -> 0 | M346: =OFFSET(INDIRECT(ADDRESS(RC1,3,3,1,"Gross")),0,Menus!R4C10) -> 0 | N346: =OFFSET(INDIRECT(ADDRESS(RC1,3,3,1,"Gross")),0,Menus!R3C10) -> 0
A347: 384 | B347: =OFFSET(INDIRECT(ADDRESS(RC1,3,3,1,Menus!R10C11)),0,Menus!R4C10) -> 0 | C347: =OFFSET(INDIRECT(ADDRESS(RC1,3,3,1,Menus!R10C11)),0,Menus!R3C10) -> 0 | D347: =IF(Menus!R9C10,RC[-1]/RC[-2],RC[-1]) -> #DIV/0! | E347: =IF(RC11=1,VALUE(RC[-3]),NA()) -> NA() | F347: =INDIRECT(ADDRESS(RC1,1,3,1,Menus!R10C11)) -> 0 | G347: =IF(INDIRECT(ADDRESS(RC1,2,3,1,Menus!R10C11))=R1C,RC4,NA()) -> NA() | H347: =IF(INDIRECT(ADDRESS(RC1,2,3,1,Menus!R10C11))=R1C,RC4,NA()) -> NA() | I347: =IF(INDIRECT(ADDRESS(RC1,2,3,1,Menus!R10C11))=R1C,RC4,NA()) -> NA() | J347: =IF(INDIRECT(ADDRESS(RC1,1,3,1,Menus!R10C11))=T(R1C),RC4,NA()) -> NA() | K347: =IF(OR(ISNUMBER(RC7),ISNUMBER(RC8),ISNUMBER(RC9),ISNUMBER(RC10)),1,0) -> 0 | M347: =OFFSET(INDIRECT(ADDRESS(RC1,3,3,1,"Gross")),0,Menus!R4C10) -> 0 | N347: =OFFSET(INDIRECT(ADDRESS(RC1,3,3,1,"Gross")),0,Menus!R3C10) -> 0
A348: 385 | B348: =OFFSET(INDIRECT(ADDRESS(RC1,3,3,1,Menus!R10C11)),0,Menus!R4C10) -> 0 | C348: =OFFSET(INDIRECT(ADDRESS(RC1,3,3,1,Menus!R10C11)),0,Menus!R3C10) -> 0 | D348: =IF(Menus!R9C10,RC[-1]/RC[-2],RC[-1]) -> #DIV/0! | E348: =IF(RC11=1,VALUE(RC[-3]),NA()) -> NA() | F348: =INDIRECT(ADDRESS(RC1,1,3,1,Menus!R10C11)) -> 0 | G348: =IF(INDIRECT(ADDRESS(RC1,2,3,1,Menus!R10C11))=R1C,RC4,NA()) -> NA() | H348: =IF(INDIRECT(ADDRESS(RC1,2,3,1,Menus!R10C11))=R1C,RC4,NA()) -> NA() | I348: =IF(INDIRECT(ADDRESS(RC1,2,3,1,Menus!R10C11))=R1C,RC4,NA()) -> NA() | J348: =IF(INDIRECT(ADDRESS(RC1,1,3,1,Menus!R10C11))=T(R1C),RC4,NA()) -> NA() | K348: =IF(OR(ISNUMBER(RC7),ISNUMBER(RC8),ISNUMBER(RC9),ISNUMBER(RC10)),1,0) -> 0 | M348: =OFFSET(INDIRECT(ADDRESS(RC1,3,3,1,"Gross")),0,Menus!R4C10) -> 0 | N348: =OFFSET(INDIRECT(ADDRESS(RC1,3,3,1,"Gross")),0,Menus!R3C10) -> 0
A349: 386 | B349: =OFFSET(INDIRECT(ADDRESS(RC1,3,3,1,Menus!R10C11)),0,Menus!R4C10) -> 0 | C349: =OFFSET(INDIRECT(ADDRESS(RC1,3,3,1,Menus!R10C11)),0,Menus!R3C10) -> 0 | D349: =IF(Menus!R9C10,RC[-1]/RC[-2],RC[-1]) -> #DIV/0! | E349: =IF(RC11=1,VALUE(RC[-3]),NA()) -> NA() | F349: =INDIRECT(ADDRESS(RC1,1,3,1,Menus!R10C11)) -> 0 | G349: =IF(INDIRECT(ADDRESS(RC1,2,3,1,Menus!R10C11))=R1C,RC4,NA()) -> NA() | H349: =IF(INDIRECT(ADDRESS(RC1,2,3,1,Menus!R10C11))=R1C,RC4,NA()) -> NA() | I349: =IF(INDIRECT(ADDRESS(RC1,2,3,1,Menus!R10C11))=R1C,RC4,NA()) -> NA() | J349: =IF(INDIRECT(ADDRESS(RC1,1,3,1,Menus!R10C11))=T(R1C),RC4,NA()) -> NA() | K349: =IF(OR(ISNUMBER(RC7),ISNUMBER(RC8),ISNUMBER(RC9),ISNUMBER(RC10)),1,0) -> 0 | M349: =OFFSET(INDIRECT(ADDRESS(RC1,3,3,1,"Gross")),0,Menus!R4C10) -> 0 | N349: =OFFSET(INDIRECT(ADDRESS(RC1,3,3,1,"Gross")),0,Menus!R3C10) -> 0
A350: 387 | B350: =OFFSET(INDIRECT(ADDRESS(RC1,3,3,1,Menus!R10C11)),0,Menus!R4C10) -> 0 | C350: =OFFSET(INDIRECT(ADDRESS(RC1,3,3,1,Menus!R10C11)),0,Menus!R3C10) -> 0 | D350: =IF(Menus!R9C10,RC[-1]/RC[-2],RC[-1]) -> #DIV/0! | E350: =IF(RC11=1,VALUE(RC[-3]),NA()) -> NA() | F350: =INDIRECT(ADDRESS(RC1,1,3,1,Menus!R10C11)) -> 0 | G350: =IF(INDIRECT(ADDRESS(RC1,2,3,1,Menus!R10C11))=R1C,RC4,NA()) -> NA() | H350: =IF(INDIRECT(ADDRESS(RC1,2,3,1,Menus!R10C11))=R1C,RC4,NA()) -> NA() | I350: =IF(INDIRECT(ADDRESS(RC1,2,3,1,Menus!R10C11))=R1C,RC4,NA()) -> NA() | J350: =IF(INDIRECT(ADDRESS(RC1,1,3,1,Menus!R10C11))=T(R1C),RC4,NA()) -> NA() | K350: =IF(OR(ISNUMBER(RC7),ISNUMBER(RC8),ISNUMBER(RC9),ISNUMBER(RC10)),1,0) -> 0 | M350: =OFFSET(INDIRECT(ADDRESS(RC1,3,3,1,"Gross")),0,Menus!R4C10) -> 0 | N350: =OFFSET(INDIRECT(ADDRESS(RC1,3,3,1,"Gross")),0,Menus!R3C10) -> 0
A351: 388 | B351: =OFFSET(INDIRECT(ADDRESS(RC1,3,3,1,Menus!R10C11)),0,Menus!R4C10) -> 0 | C351: =OFFSET(INDIRECT(ADDRESS(RC1,3,3,1,Menus!R10C11)),0,Menus!R3C10) -> 0 | D351: =IF(Menus!R9C10,RC[-1]/RC[-2],RC[-1]) -> #DIV/0! | E351: =IF(RC11=1,VALUE(RC[-3]),NA()) -> NA() | F351: =INDIRECT(ADDRESS(RC1,1,3,1,Menus!R10C11)) -> 0 | G351: =IF(INDIRECT(ADDRESS(RC1,2,3,1,Menus!R10C11))=R1C,RC4,NA()) -> NA() | H351: =IF(INDIRECT(ADDRESS(RC1,2,3,1,Menus!R10C11))=R1C,RC4,NA()) -> NA() | I351: =IF(INDIRECT(ADDRESS(RC1,2,3,1,Menus!R10C11))=R1C,RC4,NA()) -> NA() | J351: =IF(INDIRECT(ADDRESS(RC1,1,3,1,Menus!R10C11))=T(R1C),RC4,NA()) -> NA() | K351: =IF(OR(ISNUMBER(RC7),ISNUMBER(RC8),ISNUMBER(RC9),ISNUMBER(RC10)),1,0) -> 0 | M351: =OFFSET(INDIRECT(ADDRESS(RC1,3,3,1,"Gross")),0,Menus!R4C10) -> 0 | N351: =OFFSET(INDIRECT(ADDRESS(RC1,3,3,1,"Gross")),0,Menus!R3C10) -> 0
A352: 389 | B352: =OFFSET(INDIRECT(ADDRESS(RC1,3,3,1,Menus!R10C11)),0,Menus!R4C10) -> 0 | C352: =OFFSET(INDIRECT(ADDRESS(RC1,3,3,1,Menus!R10C11)),0,Menus!R3C10) -> 0 | D352: =IF(Menus!R9C10,RC[-1]/RC[-2],RC[-1]) -> #DIV/0! | E352: =IF(RC11=1,VALUE(RC[-3]),NA()) -> NA() | F352: =INDIRECT(ADDRESS(RC1,1,3,1,Menus!R10C11)) -> 0 | G352: =IF(INDIRECT(ADDRESS(RC1,2,3,1,Menus!R10C11))=R1C,RC4,NA()) -> NA() | H352: =IF(INDIRECT(ADDRESS(RC1,2,3,1,Menus!R10C11))=R1C,RC4,NA()) -> NA() | I352: =IF(INDIRECT(ADDRESS(RC1,2,3,1,Menus!R10C11))=R1C,RC4,NA()) -> NA() | J352: =IF(INDIRECT(ADDRESS(RC1,1,3,1,Menus!R10C11))=T(R1C),RC4,NA()) -> NA() | K352: =IF(OR(ISNUMBER(RC7),ISNUMBER(RC8),ISNUMBER(RC9),ISNUMBER(RC10)),1,0) -> 0 | M352: =OFFSET(INDIRECT(ADDRESS(RC1,3,3,1,"Gross")),0,Menus!R4C10) -> 0 | N352: =OFFSET(INDIRECT(ADDRESS(RC1,3,3,1,"Gross")),0,Menus!R3C10) -> 0
A353: 390 | B353: =OFFSET(INDIRECT(ADDRESS(RC1,3,3,1,Menus!R10C11)),0,Menus!R4C10) -> 0 | C353: =OFFSET(INDIRECT(ADDRESS(RC1,3,3,1,Menus!R10C11)),0,Menus!R3C10) -> 0 | D353: =IF(Menus!R9C10,RC[-1]/RC[-2],RC[-1]) -> #DIV/0! | E353: =IF(RC11=1,VALUE(RC[-3]),NA()) -> NA() | F353: =INDIRECT(ADDRESS(RC1,1,3,1,Menus!R10C11)) -> 0 | G353: =IF(INDIRECT(ADDRESS(RC1,2,3,1,Menus!R10C11))=R1C,RC4,NA()) -> NA() | H353: =IF(INDIRECT(ADDRESS(RC1,2,3,1,Menus!R10C11))=R1C,RC4,NA()) -> NA() | I353: =IF(INDIRECT(ADDRESS(RC1,2,3,1,Menus!R10C11))=R1C,RC4,NA()) -> NA() | J353: =IF(INDIRECT(ADDRESS(RC1,1,3,1,Menus!R10C11))=T(R1C),RC4,NA()) -> NA() | K353: =IF(OR(ISNUMBER(RC7),ISNUMBER(RC8),ISNUMBER(RC9),ISNUMBER(RC10)),1,0) -> 0 | M353: =OFFSET(INDIRECT(ADDRESS(RC1,3,3,1,"Gross")),0,Menus!R4C10) -> 0 | N353: =OFFSET(INDIRECT(ADDRESS(RC1,3,3,1,"Gross")),0,Menus!R3C10) -> 0
A354: 391 | B354: =OFFSET(INDIRECT(ADDRESS(RC1,3,3,1,Menus!R10C11)),0,Menus!R4C10) -> 0 | C354: =OFFSET(INDIRECT(ADDRESS(RC1,3,3,1,Menus!R10C11)),0,Menus!R3C10) -> 0 | D354: =IF(Menus!R9C10,RC[-1]/RC[-2],RC[-1]) -> #DIV/0! | E354: =IF(RC11=1,VALUE(RC[-3]),NA()) -> NA() | F354: =INDIRECT(ADDRESS(RC1,1,3,1,Menus!R10C11)) -> 0 | G354: =IF(INDIRECT(ADDRESS(RC1,2,3,1,Menus!R10C11))=R1C,RC4,NA()) -> NA() | H354: =IF(INDIRECT(ADDRESS(RC1,2,3,1,Menus!R10C11))=R1C,RC4,NA()) -> NA() | I354: =IF(INDIRECT(ADDRESS(RC1,2,3,1,Menus!R10C11))=R1C,RC4,NA()) -> NA() | J354: =IF(INDIRECT(ADDRESS(RC1,1,3,1,Menus!R10C11))=T(R1C),RC4,NA()) -> NA() | K354: =IF(OR(ISNUMBER(RC7),ISNUMBER(RC8),ISNUMBER(RC9),ISNUMBER(RC10)),1,0) -> 0 | M354: =OFFSET(INDIRECT(ADDRESS(RC1,3,3,1,"Gross")),0,Menus!R4C10) -> 0 | N354: =OFFSET(INDIRECT(ADDRESS(RC1,3,3,1,"Gross")),0,Menus!R3C10) -> 0
A355: 392 | B355: =OFFSET(INDIRECT(ADDRESS(RC1,3,3,1,Menus!R10C11)),0,Menus!R4C10) -> 0 | C355: =OFFSET(INDIRECT(ADDRESS(RC1,3,3,1,Menus!R10C11)),0,Menus!R3C10) -> 0 | D355: =IF(Menus!R9C10,RC[-1]/RC[-2],RC[-1]) -> #DIV/0! | E355: =IF(RC11=1,VALUE(RC[-3]),NA()) -> NA() | F355: =INDIRECT(ADDRESS(RC1,1,3,1,Menus!R10C11)) -> 0 | G355: =IF(INDIRECT(ADDRESS(RC1,2,3,1,Menus!R10C11))=R1C,RC4,NA()) -> NA() | H355: =IF(INDIRECT(ADDRESS(RC1,2,3,1,Menus!R10C11))=R1C,RC4,NA()) -> NA() | I355: =IF(INDIRECT(ADDRESS(RC1,2,3,1,Menus!R10C11))=R1C,RC4,NA()) -> NA() | J355: =IF(INDIRECT(ADDRESS(RC1,1,3,1,Menus!R10C11))=T(R1C),RC4,NA()) -> NA() | K355: =IF(OR(ISNUMBER(RC7),ISNUMBER(RC8),ISNUMBER(RC9),ISNUMBER(RC10)),1,0) -> 0 | M355: =OFFSET(INDIRECT(ADDRESS(RC1,3,3,1,"Gross")),0,Menus!R4C10) -> 0 | N355: =OFFSET(INDIRECT(ADDRESS(RC1,3,3,1,"Gross")),0,Menus!R3C10) -> 0
A356: 393 | B356: =OFFSET(INDIRECT(ADDRESS(RC1,3,3,1,Menus!R10C11)),0,Menus!R4C10) -> 0 | C356: =OFFSET(INDIRECT(ADDRESS(RC1,3,3,1,Menus!R10C11)),0,Menus!R3C10) -> 0 | D356: =IF(Menus!R9C10,RC[-1]/RC[-2],RC[-1]) -> #DIV/0! | E356: =IF(RC11=1,VALUE(RC[-3]),NA()) -> NA() | F356: =INDIRECT(ADDRESS(RC1,1,3,1,Menus!R10C11)) -> 0 | G356: =IF(INDIRECT(ADDRESS(RC1,2,3,1,Menus!R10C11))=R1C,RC4,NA()) -> NA() | H356: =IF(INDIRECT(ADDRESS(RC1,2,3,1,Menus!R10C11))=R1C,RC4,NA()) -> NA() | I356: =IF(INDIRECT(ADDRESS(RC1,2,3,1,Menus!R10C11))=R1C,RC4,NA()) -> NA() | J356: =IF(INDIRECT(ADDRESS(RC1,1,3,1,Menus!R10C11))=T(R1C),RC4,NA()) -> NA() | K356: =IF(OR(ISNUMBER(RC7),ISNUMBER(RC8),ISNUMBER(RC9),ISNUMBER(RC10)),1,0) -> 0 | M356: =OFFSET(INDIRECT(ADDRESS(RC1,3,3,1,"Gross")),0,Menus!R4C10) -> 0 | N356: =OFFSET(INDIRECT(ADDRESS(RC1,3,3,1,"Gross")),0,Menus!R3C10) -> 0
A357: 394 | B357: =OFFSET(INDIRECT(ADDRESS(RC1,3,3,1,Menus!R10C11)),0,Menus!R4C10) -> 0 | C357: =OFFSET(INDIRECT(ADDRESS(RC1,3,3,1,Menus!R10C11)),0,Menus!R3C10) -> 0 | D357: =IF(Menus!R9C10,RC[-1]/RC[-2],RC[-1]) -> #DIV/0! | E357: =IF(RC11=1,VALUE(RC[-3]),NA()) -> NA() | F357: =INDIRECT(ADDRESS(RC1,1,3,1,Menus!R10C11)) -> 0 | G357: =IF(INDIRECT(ADDRESS(RC1,2,3,1,Menus!R10C11))=R1C,RC4,NA()) -> NA() | H357: =IF(INDIRECT(ADDRESS(RC1,2,3,1,Menus!R10C11))=R1C,RC4,NA()) -> NA() | I357: =IF(INDIRECT(ADDRESS(RC1,2,3,1,Menus!R10C11))=R1C,RC4,NA()) -> NA() | J357: =IF(INDIRECT(ADDRESS(RC1,1,3,1,Menus!R10C11))=T(R1C),RC4,NA()) -> NA() | K357: =IF(OR(ISNUMBER(RC7),ISNUMBER(RC8),ISNUMBER(RC9),ISNUMBER(RC10)),1,0) -> 0 | M357: =OFFSET(INDIRECT(ADDRESS(RC1,3,3,1,"Gross")),0,Menus!R4C10) -> 0 | N357: =OFFSET(INDIRECT(ADDRESS(RC1,3,3,1,"Gross")),0,Menus!R3C10) -> 0
A358: 395 | B358: =OFFSET(INDIRECT(ADDRESS(RC1,3,3,1,Menus!R10C11)),0,Menus!R4C10) -> 0 | C358: =OFFSET(INDIRECT(ADDRESS(RC1,3,3,1,Menus!R10C11)),0,Menus!R3C10) -> 0 | D358: =IF(Menus!R9C10,RC[-1]/RC[-2],RC[-1]) -> #DIV/0! | E358: =IF(RC11=1,VALUE(RC[-3]),NA()) -> NA() | F358: =INDIRECT(ADDRESS(RC1,1,3,1,Menus!R10C11)) -> 0 | G358: =IF(INDIRECT(ADDRESS(RC1,2,3,1,Menus!R10C11))=R1C,RC4,NA()) -> NA() | H358: =IF(INDIRECT(ADDRESS(RC1,2,3,1,Menus!R10C11))=R1C,RC4,NA()) -> NA() | I358: =IF(INDIRECT(ADDRESS(RC1,2,3,1,Menus!R10C11))=R1C,RC4,NA()) -> NA() | J358: =IF(INDIRECT(ADDRESS(RC1,1,3,1,Menus!R10C11))=T(R1C),RC4,NA()) -> NA() | K358: =IF(OR(ISNUMBER(RC7),ISNUMBER(RC8),ISNUMBER(RC9),ISNUMBER(RC10)),1,0) -> 0 | M358: =OFFSET(INDIRECT(ADDRESS(RC1,3,3,1,"Gross")),0,Menus!R4C10) -> 0 | N358: =OFFSET(INDIRECT(ADDRESS(RC1,3,3,1,"Gross")),0,Menus!R3C10) -> 0
A359: 396 | B359: =OFFSET(INDIRECT(ADDRESS(RC1,3,3,1,Menus!R10C11)),0,Menus!R4C10) -> 0 | C359: =OFFSET(INDIRECT(ADDRESS(RC1,3,3,1,Menus!R10C11)),0,Menus!R3C10) -> 0 | D359: =IF(Menus!R9C10,RC[-1]/RC[-2],RC[-1]) -> #DIV/0! | E359: =IF(RC11=1,VALUE(RC[-3]),NA()) -> NA() | F359: =INDIRECT(ADDRESS(RC1,1,3,1,Menus!R10C11)) -> 0 | G359: =IF(INDIRECT(ADDRESS(RC1,2,3,1,Menus!R10C11))=R1C,RC4,NA()) -> NA() | H359: =IF(INDIRECT(ADDRESS(RC1,2,3,1,Menus!R10C11))=R1C,RC4,NA()) -> NA() | I359: =IF(INDIRECT(ADDRESS(RC1,2,3,1,Menus!R10C11))=R1C,RC4,NA()) -> NA() | J359: =IF(INDIRECT(ADDRESS(RC1,1,3,1,Menus!R10C11))=T(R1C),RC4,NA()) -> NA() | K359: =IF(OR(ISNUMBER(RC7),ISNUMBER(RC8),ISNUMBER(RC9),ISNUMBER(RC10)),1,0) -> 0 | M359: =OFFSET(INDIRECT(ADDRESS(RC1,3,3,1,"Gross")),0,Menus!R4C10) -> 0 | N359: =OFFSET(INDIRECT(ADDRESS(RC1,3,3,1,"Gross")),0,Menus!R3C10) -> 0
A360: 397 | B360: =OFFSET(INDIRECT(ADDRESS(RC1,3,3,1,Menus!R10C11)),0,Menus!R4C10) -> 0 | C360: =OFFSET(INDIRECT(ADDRESS(RC1,3,3,1,Menus!R10C11)),0,Menus!R3C10) -> 0 | D360: =IF(Menus!R9C10,RC[-1]/RC[-2],RC[-1]) -> #DIV/0! | E360: =IF(RC11=1,VALUE(RC[-3]),NA()) -> NA() | F360: =INDIRECT(ADDRESS(RC1,1,3,1,Menus!R10C11)) -> 0 | G360: =IF(INDIRECT(ADDRESS(RC1,2,3,1,Menus!R10C11))=R1C,RC4,NA()) -> NA() | H360: =IF(INDIRECT(ADDRESS(RC1,2,3,1,Menus!R10C11))=R1C,RC4,NA()) -> NA() | I360: =IF(INDIRECT(ADDRESS(RC1,2,3,1,Menus!R10C11))=R1C,RC4,NA()) -> NA() | J360: =IF(INDIRECT(ADDRESS(RC1,1,3,1,Menus!R10C11))=T(R1C),RC4,NA()) -> NA() | K360: =IF(OR(ISNUMBER(RC7),ISNUMBER(RC8),ISNUMBER(RC9),ISNUMBER(RC10)),1,0) -> 0 | M360: =OFFSET(INDIRECT(ADDRESS(RC1,3,3,1,"Gross")),0,Menus!R4C10) -> 0 | N360: =OFFSET(INDIRECT(ADDRESS(RC1,3,3,1,"Gross")),0,Menus!R3C10) -> 0
A361: 398 | B361: =OFFSET(INDIRECT(ADDRESS(RC1,3,3,1,Menus!R10C11)),0,Menus!R4C10) -> 0 | C361: =OFFSET(INDIRECT(ADDRESS(RC1,3,3,1,Menus!R10C11)),0,Menus!R3C10) -> 0 | D361: =IF(Menus!R9C10,RC[-1]/RC[-2],RC[-1]) -> #DIV/0! | E361: =IF(RC11=1,VALUE(RC[-3]),NA()) -> NA() | F361: =INDIRECT(ADDRESS(RC1,1,3,1,Menus!R10C11)) -> 0 | G361: =IF(INDIRECT(ADDRESS(RC1,2,3,1,Menus!R10C11))=R1C,RC4,NA()) -> NA() | H361: =IF(INDIRECT(ADDRESS(RC1,2,3,1,Menus!R10C11))=R1C,RC4,NA()) -> NA() | I361: =IF(INDIRECT(ADDRESS(RC1,2,3,1,Menus!R10C11))=R1C,RC4,NA()) -> NA() | J361: =IF(INDIRECT(ADDRESS(RC1,1,3,1,Menus!R10C11))=T(R1C),RC4,NA()) -> NA() | K361: =IF(OR(ISNUMBER(RC7),ISNUMBER(RC8),ISNUMBER(RC9),ISNUMBER(RC10)),1,0) -> 0 | M361: =OFFSET(INDIRECT(ADDRESS(RC1,3,3,1,"Gross")),0,Menus!R4C10) -> 0 | N361: =OFFSET(INDIRECT(ADDRESS(RC1,3,3,1,"Gross")),0,Menus!R3C10) -> 0
A362: 399 | B362: =OFFSET(INDIRECT(ADDRESS(RC1,3,3,1,Menus!R10C11)),0,Menus!R4C10) -> 0 | C362: =OFFSET(INDIRECT(ADDRESS(RC1,3,3,1,Menus!R10C11)),0,Menus!R3C10) -> 0 | D362: =IF(Menus!R9C10,RC[-1]/RC[-2],RC[-1]) -> #DIV/0! | E362: =IF(RC11=1,VALUE(RC[-3]),NA()) -> NA() | F362: =INDIRECT(ADDRESS(RC1,1,3,1,Menus!R10C11)) -> 0 | G362: =IF(INDIRECT(ADDRESS(RC1,2,3,1,Menus!R10C11))=R1C,RC4,NA()) -> NA() | H362: =IF(INDIRECT(ADDRESS(RC1,2,3,1,Menus!R10C11))=R1C,RC4,NA()) -> NA() | I362: =IF(INDIRECT(ADDRESS(RC1,2,3,1,Menus!R10C11))=R1C,RC4,NA()) -> NA() | J362: =IF(INDIRECT(ADDRESS(RC1,1,3,1,Menus!R10C11))=T(R1C),RC4,NA()) -> NA() | K362: =IF(OR(ISNUMBER(RC7),ISNUMBER(RC8),ISNUMBER(RC9),ISNUMBER(RC10)),1,0) -> 0 | M362: =OFFSET(INDIRECT(ADDRESS(RC1,3,3,1,"Gross")),0,Menus!R4C10) -> 0 | N362: =OFFSET(INDIRECT(ADDRESS(RC1,3,3,1,"Gross")),0,Menus!R3C10) -> 0
A363: 400 | B363: =OFFSET(INDIRECT(ADDRESS(RC1,3,3,1,Menus!R10C11)),0,Menus!R4C10) -> 0 | C363: =OFFSET(INDIRECT(ADDRESS(RC1,3,3,1,Menus!R10C11)),0,Menus!R3C10) -> 0 | D363: =IF(Menus!R9C10,RC[-1]/RC[-2],RC[-1]) -> #DIV/0! | E363: =IF(RC11=1,VALUE(RC[-3]),NA()) -> NA() | F363: =INDIRECT(ADDRESS(RC1,1,3,1,Menus!R10C11)) -> 0 | G363: =IF(INDIRECT(ADDRESS(RC1,2,3,1,Menus!R10C11))=R1C,RC4,NA()) -> NA() | H363: =IF(INDIRECT(ADDRESS(RC1,2,3,1,Menus!R10C11))=R1C,RC4,NA()) -> NA() | I363: =IF(INDIRECT(ADDRESS(RC1,2,3,1,Menus!R10C11))=R1C,RC4,NA()) -> NA() | J363: =IF(INDIRECT(ADDRESS(RC1,1,3,1,Menus!R10C11))=T(R1C),RC4,NA()) -> NA() | K363: =IF(OR(ISNUMBER(RC7),ISNUMBER(RC8),ISNUMBER(RC9),ISNUMBER(RC10)),1,0) -> 0 | M363: =OFFSET(INDIRECT(ADDRESS(RC1,3,3,1,"Gross")),0,Menus!R4C10) -> 0 | N363: =OFFSET(INDIRECT(ADDRESS(RC1,3,3,1,"Gross")),0,Menus!R3C10) -> 0
A364: 401 | B364: =OFFSET(INDIRECT(ADDRESS(RC1,3,3,1,Menus!R10C11)),0,Menus!R4C10) -> 0 | C364: =OFFSET(INDIRECT(ADDRESS(RC1,3,3,1,Menus!R10C11)),0,Menus!R3C10) -> 0 | D364: =IF(Menus!R9C10,RC[-1]/RC[-2],RC[-1]) -> #DIV/0! | E364: =IF(RC11=1,VALUE(RC[-3]),NA()) -> NA() | F364: =INDIRECT(ADDRESS(RC1,1,3,1,Menus!R10C11)) -> 0 | G364: =IF(INDIRECT(ADDRESS(RC1,2,3,1,Menus!R10C11))=R1C,RC4,NA()) -> NA() | H364: =IF(INDIRECT(ADDRESS(RC1,2,3,1,Menus!R10C11))=R1C,RC4,NA()) -> NA() | I364: =IF(INDIRECT(ADDRESS(RC1,2,3,1,Menus!R10C11))=R1C,RC4,NA()) -> NA() | J364: =IF(INDIRECT(ADDRESS(RC1,1,3,1,Menus!R10C11))=T(R1C),RC4,NA()) -> NA() | K364: =IF(OR(ISNUMBER(RC7),ISNUMBER(RC8),ISNUMBER(RC9),ISNUMBER(RC10)),1,0) -> 0 | M364: =OFFSET(INDIRECT(ADDRESS(RC1,3,3,1,"Gross")),0,Menus!R4C10) -> 0 | N364: =OFFSET(INDIRECT(ADDRESS(RC1,3,3,1,"Gross")),0,Menus!R3C10) -> 0
A365: 402 | B365: =OFFSET(INDIRECT(ADDRESS(RC1,3,3,1,Menus!R10C11)),0,Menus!R4C10) -> 0 | C365: =OFFSET(INDIRECT(ADDRESS(RC1,3,3,1,Menus!R10C11)),0,Menus!R3C10) -> 0 | D365: =IF(Menus!R9C10,RC[-1]/RC[-2],RC[-1]) -> #DIV/0! | E365: =IF(RC11=1,VALUE(RC[-3]),NA()) -> NA() | F365: =INDIRECT(ADDRESS(RC1,1,3,1,Menus!R10C11)) -> 0 | G365: =IF(INDIRECT(ADDRESS(RC1,2,3,1,Menus!R10C11))=R1C,RC4,NA()) -> NA() | H365: =IF(INDIRECT(ADDRESS(RC1,2,3,1,Menus!R10C11))=R1C,RC4,NA()) -> NA() | I365: =IF(INDIRECT(ADDRESS(RC1,2,3,1,Menus!R10C11))=R1C,RC4,NA()) -> NA() | J365: =IF(INDIRECT(ADDRESS(RC1,1,3,1,Menus!R10C11))=T(R1C),RC4,NA()) -> NA() | K365: =IF(OR(ISNUMBER(RC7),ISNUMBER(RC8),ISNUMBER(RC9),ISNUMBER(RC10)),1,0) -> 0 | M365: =OFFSET(INDIRECT(ADDRESS(RC1,3,3,1,"Gross")),0,Menus!R4C10) -> 0 | N365: =OFFSET(INDIRECT(ADDRESS(RC1,3,3,1,"Gross")),0,Menus!R3C10) -> 0
A366: 403 | B366: =OFFSET(INDIRECT(ADDRESS(RC1,3,3,1,Menus!R10C11)),0,Menus!R4C10) -> 0 | C366: =OFFSET(INDIRECT(ADDRESS(RC1,3,3,1,Menus!R10C11)),0,Menus!R3C10) -> 0 | D366: =IF(Menus!R9C10,RC[-1]/RC[-2],RC[-1]) -> #DIV/0! | E366: =IF(RC11=1,VALUE(RC[-3]),NA()) -> NA() | F366: =INDIRECT(ADDRESS(RC1,1,3,1,Menus!R10C11)) -> 0 | G366: =IF(INDIRECT(ADDRESS(RC1,2,3,1,Menus!R10C11))=R1C,RC4,NA()) -> NA() | H366: =IF(INDIRECT(ADDRESS(RC1,2,3,1,Menus!R10C11))=R1C,RC4,NA()) -> NA() | I366: =IF(INDIRECT(ADDRESS(RC1,2,3,1,Menus!R10C11))=R1C,RC4,NA()) -> NA() | J366: =IF(INDIRECT(ADDRESS(RC1,1,3,1,Menus!R10C11))=T(R1C),RC4,NA()) -> NA() | K366: =IF(OR(ISNUMBER(RC7),ISNUMBER(RC8),ISNUMBER(RC9),ISNUMBER(RC10)),1,0) -> 0 | M366: =OFFSET(INDIRECT(ADDRESS(RC1,3,3,1,"Gross")),0,Menus!R4C10) -> 0 | N366: =OFFSET(INDIRECT(ADDRESS(RC1,3,3,1,"Gross")),0,Menus!R3C10) -> 0
A367: 404 | B367: =OFFSET(INDIRECT(ADDRESS(RC1,3,3,1,Menus!R10C11)),0,Menus!R4C10) -> 0 | C367: =OFFSET(INDIRECT(ADDRESS(RC1,3,3,1,Menus!R10C11)),0,Menus!R3C10) -> 0 | D367: =IF(Menus!R9C10,RC[-1]/RC[-2],RC[-1]) -> #DIV/0! | E367: =IF(RC11=1,VALUE(RC[-3]),NA()) -> NA() | F367: =INDIRECT(ADDRESS(RC1,1,3,1,Menus!R10C11)) -> 0 | G367: =IF(INDIRECT(ADDRESS(RC1,2,3,1,Menus!R10C11))=R1C,RC4,NA()) -> NA() | H367: =IF(INDIRECT(ADDRESS(RC1,2,3,1,Menus!R10C11))=R1C,RC4,NA()) -> NA() | I367: =IF(INDIRECT(ADDRESS(RC1,2,3,1,Menus!R10C11))=R1C,RC4,NA()) -> NA() | J367: =IF(INDIRECT(ADDRESS(RC1,1,3,1,Menus!R10C11))=T(R1C),RC4,NA()) -> NA() | K367: =IF(OR(ISNUMBER(RC7),ISNUMBER(RC8),ISNUMBER(RC9),ISNUMBER(RC10)),1,0) -> 0 | M367: =OFFSET(INDIRECT(ADDRESS(RC1,3,3,1,"Gross")),0,Menus!R4C10) -> 0 | N367: =OFFSET(INDIRECT(ADDRESS(RC1,3,3,1,"Gross")),0,Menus!R3C10) -> 0
A368: 405 | B368: =OFFSET(INDIRECT(ADDRESS(RC1,3,3,1,Menus!R10C11)),0,Menus!R4C10) -> 0 | C368: =OFFSET(INDIRECT(ADDRESS(RC1,3,3,1,Menus!R10C11)),0,Menus!R3C10) -> 0 | D368: =IF(Menus!R9C10,RC[-1]/RC[-2],RC[-1]) -> #DIV/0! | E368: =IF(RC11=1,VALUE(RC[-3]),NA()) -> NA() | F368: =INDIRECT(ADDRESS(RC1,1,3,1,Menus!R10C11)) -> 0 | G368: =IF(INDIRECT(ADDRESS(RC1,2,3,1,Menus!R10C11))=R1C,RC4,NA()) -> NA() | H368: =IF(INDIRECT(ADDRESS(RC1,2,3,1,Menus!R10C11))=R1C,RC4,NA()) -> NA() | I368: =IF(INDIRECT(ADDRESS(RC1,2,3,1,Menus!R10C11))=R1C,RC4,NA()) -> NA() | J368: =IF(INDIRECT(ADDRESS(RC1,1,3,1,Menus!R10C11))=T(R1C),RC4,NA()) -> NA() | K368: =IF(OR(ISNUMBER(RC7),ISNUMBER(RC8),ISNUMBER(RC9),ISNUMBER(RC10)),1,0) -> 0 | M368: =OFFSET(INDIRECT(ADDRESS(RC1,3,3,1,"Gross")),0,Menus!R4C10) -> 0 | N368: =OFFSET(INDIRECT(ADDRESS(RC1,3,3,1,"Gross")),0,Menus!R3C10) -> 0
A369: 406 | B369: =OFFSET(INDIRECT(ADDRESS(RC1,3,3,1,Menus!R10C11)),0,Menus!R4C10) -> 0 | C369: =OFFSET(INDIRECT(ADDRESS(RC1,3,3,1,Menus!R10C11)),0,Menus!R3C10) -> 0 | D369: =IF(Menus!R9C10,RC[-1]/RC[-2],RC[-1]) -> #DIV/0! | E369: =IF(RC11=1,VALUE(RC[-3]),NA()) -> NA() | F369: =INDIRECT(ADDRESS(RC1,1,3,1,Menus!R10C11)) -> 0 | G369: =IF(INDIRECT(ADDRESS(RC1,2,3,1,Menus!R10C11))=R1C,RC4,NA()) -> NA() | H369: =IF(INDIRECT(ADDRESS(RC1,2,3,1,Menus!R10C11))=R1C,RC4,NA()) -> NA() | I369: =IF(INDIRECT(ADDRESS(RC1,2,3,1,Menus!R10C11))=R1C,RC4,NA()) -> NA() | J369: =IF(INDIRECT(ADDRESS(RC1,1,3,1,Menus!R10C11))=T(R1C),RC4,NA()) -> NA() | K369: =IF(OR(ISNUMBER(RC7),ISNUMBER(RC8),ISNUMBER(RC9),ISNUMBER(RC10)),1,0) -> 0 | M369: =OFFSET(INDIRECT(ADDRESS(RC1,3,3,1,"Gross")),0,Menus!R4C10) -> 0 | N369: =OFFSET(INDIRECT(ADDRESS(RC1,3,3,1,"Gross")),0,Menus!R3C10) -> 0
A370: 407 | B370: =OFFSET(INDIRECT(ADDRESS(RC1,3,3,1,Menus!R10C11)),0,Menus!R4C10) -> 0 | C370: =OFFSET(INDIRECT(ADDRESS(RC1,3,3,1,Menus!R10C11)),0,Menus!R3C10) -> 0 | D370: =IF(Menus!R9C10,RC[-1]/RC[-2],RC[-1]) -> #DIV/0! | E370: =IF(RC11=1,VALUE(RC[-3]),NA()) -> NA() | F370: =INDIRECT(ADDRESS(RC1,1,3,1,Menus!R10C11)) -> 0 | G370: =IF(INDIRECT(ADDRESS(RC1,2,3,1,Menus!R10C11))=R1C,RC4,NA()) -> NA() | H370: =IF(INDIRECT(ADDRESS(RC1,2,3,1,Menus!R10C11))=R1C,RC4,NA()) -> NA() | I370: =IF(INDIRECT(ADDRESS(RC1,2,3,1,Menus!R10C11))=R1C,RC4,NA()) -> NA() | J370: =IF(INDIRECT(ADDRESS(RC1,1,3,1,Menus!R10C11))=T(R1C),RC4,NA()) -> NA() | K370: =IF(OR(ISNUMBER(RC7),ISNUMBER(RC8),ISNUMBER(RC9),ISNUMBER(RC10)),1,0) -> 0 | M370: =OFFSET(INDIRECT(ADDRESS(RC1,3,3,1,"Gross")),0,Menus!R4C10) -> 0 | N370: =OFFSET(INDIRECT(ADDRESS(RC1,3,3,1,"Gross")),0,Menus!R3C10) -> 0
A371: 408 | B371: =OFFSET(INDIRECT(ADDRESS(RC1,3,3,1,Menus!R10C11)),0,Menus!R4C10) -> 0 | C371: =OFFSET(INDIRECT(ADDRESS(RC1,3,3,1,Menus!R10C11)),0,Menus!R3C10) -> 0 | D371: =IF(Menus!R9C10,RC[-1]/RC[-2],RC[-1]) -> #DIV/0! | E371: =IF(RC11=1,VALUE(RC[-3]),NA()) -> NA() | F371: =INDIRECT(ADDRESS(RC1,1,3,1,Menus!R10C11)) -> 0 | G371: =IF(INDIRECT(ADDRESS(RC1,2,3,1,Menus!R10C11))=R1C,RC4,NA()) -> NA() | H371: =IF(INDIRECT(ADDRESS(RC1,2,3,1,Menus!R10C11))=R1C,RC4,NA()) -> NA() | I371: =IF(INDIRECT(ADDRESS(RC1,2,3,1,Menus!R10C11))=R1C,RC4,NA()) -> NA() | J371: =IF(INDIRECT(ADDRESS(RC1,1,3,1,Menus!R10C11))=T(R1C),RC4,NA()) -> NA() | K371: =IF(OR(ISNUMBER(RC7),ISNUMBER(RC8),ISNUMBER(RC9),ISNUMBER(RC10)),1,0) -> 0 | M371: =OFFSET(INDIRECT(ADDRESS(RC1,3,3,1,"Gross")),0,Menus!R4C10) -> 0 | N371: =OFFSET(INDIRECT(ADDRESS(RC1,3,3,1,"Gross")),0,Menus!R3C10) -> 0
A372: 409 | B372: =OFFSET(INDIRECT(ADDRESS(RC1,3,3,1,Menus!R10C11)),0,Menus!R4C10) -> 0 | C372: =OFFSET(INDIRECT(ADDRESS(RC1,3,3,1,Menus!R10C11)),0,Menus!R3C10) -> 0 | D372: =IF(Menus!R9C10,RC[-1]/RC[-2],RC[-1]) -> #DIV/0! | E372: =IF(RC11=1,VALUE(RC[-3]),NA()) -> NA() | F372: =INDIRECT(ADDRESS(RC1,1,3,1,Menus!R10C11)) -> 0 | G372: =IF(INDIRECT(ADDRESS(RC1,2,3,1,Menus!R10C11))=R1C,RC4,NA()) -> NA() | H372: =IF(INDIRECT(ADDRESS(RC1,2,3,1,Menus!R10C11))=R1C,RC4,NA()) -> NA() | I372: =IF(INDIRECT(ADDRESS(RC1,2,3,1,Menus!R10C11))=R1C,RC4,NA()) -> NA() | J372: =IF(INDIRECT(ADDRESS(RC1,1,3,1,Menus!R10C11))=T(R1C),RC4,NA()) -> NA() | K372: =IF(OR(ISNUMBER(RC7),ISNUMBER(RC8),ISNUMBER(RC9),ISNUMBER(RC10)),1,0) -> 0 | M372: =OFFSET(INDIRECT(ADDRESS(RC1,3,3,1,"Gross")),0,Menus!R4C10) -> 0 | N372: =OFFSET(INDIRECT(ADDRESS(RC1,3,3,1,"Gross")),0,Menus!R3C10) -> 0
A373: 410 | B373: =OFFSET(INDIRECT(ADDRESS(RC1,3,3,1,Menus!R10C11)),0,Menus!R4C10) -> 0 | C373: =OFFSET(INDIRECT(ADDRESS(RC1,3,3,1,Menus!R10C11)),0,Menus!R3C10) -> 0 | D373: =IF(Menus!R9C10,RC[-1]/RC[-2],RC[-1]) -> #DIV/0! | E373: =IF(RC11=1,VALUE(RC[-3]),NA()) -> NA() | F373: =INDIRECT(ADDRESS(RC1,1,3,1,Menus!R10C11)) -> 0 | G373: =IF(INDIRECT(ADDRESS(RC1,2,3,1,Menus!R10C11))=R1C,RC4,NA()) -> NA() | H373: =IF(INDIRECT(ADDRESS(RC1,2,3,1,Menus!R10C11))=R1C,RC4,NA()) -> NA() | I373: =IF(INDIRECT(ADDRESS(RC1,2,3,1,Menus!R10C11))=R1C,RC4,NA()) -> NA() | J373: =IF(INDIRECT(ADDRESS(RC1,1,3,1,Menus!R10C11))=T(R1C),RC4,NA()) -> NA() | K373: =IF(OR(ISNUMBER(RC7),ISNUMBER(RC8),ISNUMBER(RC9),ISNUMBER(RC10)),1,0) -> 0 | M373: =OFFSET(INDIRECT(ADDRESS(RC1,3,3,1,"Gross")),0,Menus!R4C10) -> 0 | N373: =OFFSET(INDIRECT(ADDRESS(RC1,3,3,1,"Gross")),0,Menus!R3C10) -> 0
A374: 411 | B374: =OFFSET(INDIRECT(ADDRESS(RC1,3,3,1,Menus!R10C11)),0,Menus!R4C10) -> 0 | C374: =OFFSET(INDIRECT(ADDRESS(RC1,3,3,1,Menus!R10C11)),0,Menus!R3C10) -> 0 | D374: =IF(Menus!R9C10,RC[-1]/RC[-2],RC[-1]) -> #DIV/0! | E374: =IF(RC11=1,VALUE(RC[-3]),NA()) -> NA() | F374: =INDIRECT(ADDRESS(RC1,1,3,1,Menus!R10C11)) -> 0 | G374: =IF(INDIRECT(ADDRESS(RC1,2,3,1,Menus!R10C11))=R1C,RC4,NA()) -> NA() | H374: =IF(INDIRECT(ADDRESS(RC1,2,3,1,Menus!R10C11))=R1C,RC4,NA()) -> NA() | I374: =IF(INDIRECT(ADDRESS(RC1,2,3,1,Menus!R10C11))=R1C,RC4,NA()) -> NA() | J374: =IF(INDIRECT(ADDRESS(RC1,1,3,1,Menus!R10C11))=T(R1C),RC4,NA()) -> NA() | K374: =IF(OR(ISNUMBER(RC7),ISNUMBER(RC8),ISNUMBER(RC9),ISNUMBER(RC10)),1,0) -> 0 | M374: =OFFSET(INDIRECT(ADDRESS(RC1,3,3,1,"Gross")),0,Menus!R4C10) -> 0 | N374: =OFFSET(INDIRECT(ADDRESS(RC1,3,3,1,"Gross")),0,Menus!R3C10) -> 0
A375: 412 | B375: =OFFSET(INDIRECT(ADDRESS(RC1,3,3,1,Menus!R10C11)),0,Menus!R4C10) -> 0 | C375: =OFFSET(INDIRECT(ADDRESS(RC1,3,3,1,Menus!R10C11)),0,Menus!R3C10) -> 0 | D375: =IF(Menus!R9C10,RC[-1]/RC[-2],RC[-1]) -> #DIV/0! | E375: =IF(RC11=1,VALUE(RC[-3]),NA()) -> NA() | F375: =INDIRECT(ADDRESS(RC1,1,3,1,Menus!R10C11)) -> 0 | G375: =IF(INDIRECT(ADDRESS(RC1,2,3,1,Menus!R10C11))=R1C,RC4,NA()) -> NA() | H375: =IF(INDIRECT(ADDRESS(RC1,2,3,1,Menus!R10C11))=R1C,RC4,NA()) -> NA() | I375: =IF(INDIRECT(ADDRESS(RC1,2,3,1,Menus!R10C11))=R1C,RC4,NA()) -> NA() | J375: =IF(INDIRECT(ADDRESS(RC1,1,3,1,Menus!R10C11))=T(R1C),RC4,NA()) -> NA() | K375: =IF(OR(ISNUMBER(RC7),ISNUMBER(RC8),ISNUMBER(RC9),ISNUMBER(RC10)),1,0) -> 0 | M375: =OFFSET(INDIRECT(ADDRESS(RC1,3,3,1,"Gross")),0,Menus!R4C10) -> 0 | N375: =OFFSET(INDIRECT(ADDRESS(RC1,3,3,1,"Gross")),0,Menus!R3C10) -> 0
A376: 413 | B376: =OFFSET(INDIRECT(ADDRESS(RC1,3,3,1,Menus!R10C11)),0,Menus!R4C10) -> 0 | C376: =OFFSET(INDIRECT(ADDRESS(RC1,3,3,1,Menus!R10C11)),0,Menus!R3C10) -> 0 | D376: =IF(Menus!R9C10,RC[-1]/RC[-2],RC[-1]) -> #DIV/0! | E376: =IF(RC11=1,VALUE(RC[-3]),NA()) -> NA() | F376: =INDIRECT(ADDRESS(RC1,1,3,1,Menus!R10C11)) -> 0 | G376: =IF(INDIRECT(ADDRESS(RC1,2,3,1,Menus!R10C11))=R1C,RC4,NA()) -> NA() | H376: =IF(INDIRECT(ADDRESS(RC1,2,3,1,Menus!R10C11))=R1C,RC4,NA()) -> NA() | I376: =IF(INDIRECT(ADDRESS(RC1,2,3,1,Menus!R10C11))=R1C,RC4,NA()) -> NA() | J376: =IF(INDIRECT(ADDRESS(RC1,1,3,1,Menus!R10C11))=T(R1C),RC4,NA()) -> NA() | K376: =IF(OR(ISNUMBER(RC7),ISNUMBER(RC8),ISNUMBER(RC9),ISNUMBER(RC10)),1,0) -> 0 | M376: =OFFSET(INDIRECT(ADDRESS(RC1,3,3,1,"Gross")),0,Menus!R4C10) -> 0 | N376: =OFFSET(INDIRECT(ADDRESS(RC1,3,3,1,"Gross")),0,Menus!R3C10) -> 0
A377: 414 | B377: =OFFSET(INDIRECT(ADDRESS(RC1,3,3,1,Menus!R10C11)),0,Menus!R4C10) -> 0 | C377: =OFFSET(INDIRECT(ADDRESS(RC1,3,3,1,Menus!R10C11)),0,Menus!R3C10) -> 0 | D377: =IF(Menus!R9C10,RC[-1]/RC[-2],RC[-1]) -> #DIV/0! | E377: =IF(RC11=1,VALUE(RC[-3]),NA()) -> NA() | F377: =INDIRECT(ADDRESS(RC1,1,3,1,Menus!R10C11)) -> 0 | G377: =IF(INDIRECT(ADDRESS(RC1,2,3,1,Menus!R10C11))=R1C,RC4,NA()) -> NA() | H377: =IF(INDIRECT(ADDRESS(RC1,2,3,1,Menus!R10C11))=R1C,RC4,NA()) -> NA() | I377: =IF(INDIRECT(ADDRESS(RC1,2,3,1,Menus!R10C11))=R1C,RC4,NA()) -> NA() | J377: =IF(INDIRECT(ADDRESS(RC1,1,3,1,Menus!R10C11))=T(R1C),RC4,NA()) -> NA() | K377: =IF(OR(ISNUMBER(RC7),ISNUMBER(RC8),ISNUMBER(RC9),ISNUMBER(RC10)),1,0) -> 0 | M377: =OFFSET(INDIRECT(ADDRESS(RC1,3,3,1,"Gross")),0,Menus!R4C10) -> 0 | N377: =OFFSET(INDIRECT(ADDRESS(RC1,3,3,1,"Gross")),0,Menus!R3C10) -> 0
A378: 415 | B378: =OFFSET(INDIRECT(ADDRESS(RC1,3,3,1,Menus!R10C11)),0,Menus!R4C10) -> 0 | C378: =OFFSET(INDIRECT(ADDRESS(RC1,3,3,1,Menus!R10C11)),0,Menus!R3C10) -> 0 | D378: =IF(Menus!R9C10,RC[-1]/RC[-2],RC[-1]) -> #DIV/0! | E378: =IF(RC11=1,VALUE(RC[-3]),NA()) -> NA() | F378: =INDIRECT(ADDRESS(RC1,1,3,1,Menus!R10C11)) -> 0 | G378: =IF(INDIRECT(ADDRESS(RC1,2,3,1,Menus!R10C11))=R1C,RC4,NA()) -> NA() | H378: =IF(INDIRECT(ADDRESS(RC1,2,3,1,Menus!R10C11))=R1C,RC4,NA()) -> NA() | I378: =IF(INDIRECT(ADDRESS(RC1,2,3,1,Menus!R10C11))=R1C,RC4,NA()) -> NA() | J378: =IF(INDIRECT(ADDRESS(RC1,1,3,1,Menus!R10C11))=T(R1C),RC4,NA()) -> NA() | K378: =IF(OR(ISNUMBER(RC7),ISNUMBER(RC8),ISNUMBER(RC9),ISNUMBER(RC10)),1,0) -> 0 | M378: =OFFSET(INDIRECT(ADDRESS(RC1,3,3,1,"Gross")),0,Menus!R4C10) -> 0 | N378: =OFFSET(INDIRECT(ADDRESS(RC1,3,3,1,"Gross")),0,Menus!R3C10) -> 0
A379: 416 | B379: =OFFSET(INDIRECT(ADDRESS(RC1,3,3,1,Menus!R10C11)),0,Menus!R4C10) -> 0 | C379: =OFFSET(INDIRECT(ADDRESS(RC1,3,3,1,Menus!R10C11)),0,Menus!R3C10) -> 0 | D379: =IF(Menus!R9C10,RC[-1]/RC[-2],RC[-1]) -> #DIV/0! | E379: =IF(RC11=1,VALUE(RC[-3]),NA()) -> NA() | F379: =INDIRECT(ADDRESS(RC1,1,3,1,Menus!R10C11)) -> 0 | G379: =IF(INDIRECT(ADDRESS(RC1,2,3,1,Menus!R10C11))=R1C,RC4,NA()) -> NA() | H379: =IF(INDIRECT(ADDRESS(RC1,2,3,1,Menus!R10C11))=R1C,RC4,NA()) -> NA() | I379: =IF(INDIRECT(ADDRESS(RC1,2,3,1,Menus!R10C11))=R1C,RC4,NA()) -> NA() | J379: =IF(INDIRECT(ADDRESS(RC1,1,3,1,Menus!R10C11))=T(R1C),RC4,NA()) -> NA() | K379: =IF(OR(ISNUMBER(RC7),ISNUMBER(RC8),ISNUMBER(RC9),ISNUMBER(RC10)),1,0) -> 0 | M379: =OFFSET(INDIRECT(ADDRESS(RC1,3,3,1,"Gross")),0,Menus!R4C10) -> 0 | N379: =OFFSET(INDIRECT(ADDRESS(RC1,3,3,1,"Gross")),0,Menus!R3C10) -> 0
A380: 417 | B380: =OFFSET(INDIRECT(ADDRESS(RC1,3,3,1,Menus!R10C11)),0,Menus!R4C10) -> 0 | C380: =OFFSET(INDIRECT(ADDRESS(RC1,3,3,1,Menus!R10C11)),0,Menus!R3C10) -> 0 | D380: =IF(Menus!R9C10,RC[-1]/RC[-2],RC[-1]) -> #DIV/0! | E380: =IF(RC11=1,VALUE(RC[-3]),NA()) -> NA() | F380: =INDIRECT(ADDRESS(RC1,1,3,1,Menus!R10C11)) -> 0 | G380: =IF(INDIRECT(ADDRESS(RC1,2,3,1,Menus!R10C11))=R1C,RC4,NA()) -> NA() | H380: =IF(INDIRECT(ADDRESS(RC1,2,3,1,Menus!R10C11))=R1C,RC4,NA()) -> NA() | I380: =IF(INDIRECT(ADDRESS(RC1,2,3,1,Menus!R10C11))=R1C,RC4,NA()) -> NA() | J380: =IF(INDIRECT(ADDRESS(RC1,1,3,1,Menus!R10C11))=T(R1C),RC4,NA()) -> NA() | K380: =IF(OR(ISNUMBER(RC7),ISNUMBER(RC8),ISNUMBER(RC9),ISNUMBER(RC10)),1,0) -> 0 | M380: =OFFSET(INDIRECT(ADDRESS(RC1,3,3,1,"Gross")),0,Menus!R4C10) -> 0 | N380: =OFFSET(INDIRECT(ADDRESS(RC1,3,3,1,"Gross")),0,Menus!R3C10) -> 0
A381: 418 | B381: =OFFSET(INDIRECT(ADDRESS(RC1,3,3,1,Menus!R10C11)),0,Menus!R4C10) -> 0 | C381: =OFFSET(INDIRECT(ADDRESS(RC1,3,3,1,Menus!R10C11)),0,Menus!R3C10) -> 0 | D381: =IF(Menus!R9C10,RC[-1]/RC[-2],RC[-1]) -> #DIV/0! | E381: =IF(RC11=1,VALUE(RC[-3]),NA()) -> NA() | F381: =INDIRECT(ADDRESS(RC1,1,3,1,Menus!R10C11)) -> 0 | G381: =IF(INDIRECT(ADDRESS(RC1,2,3,1,Menus!R10C11))=R1C,RC4,NA()) -> NA() | H381: =IF(INDIRECT(ADDRESS(RC1,2,3,1,Menus!R10C11))=R1C,RC4,NA()) -> NA() | I381: =IF(INDIRECT(ADDRESS(RC1,2,3,1,Menus!R10C11))=R1C,RC4,NA()) -> NA() | J381: =IF(INDIRECT(ADDRESS(RC1,1,3,1,Menus!R10C11))=T(R1C),RC4,NA()) -> NA() | K381: =IF(OR(ISNUMBER(RC7),ISNUMBER(RC8),ISNUMBER(RC9),ISNUMBER(RC10)),1,0) -> 0 | M381: =OFFSET(INDIRECT(ADDRESS(RC1,3,3,1,"Gross")),0,Menus!R4C10) -> 0 | N381: =OFFSET(INDIRECT(ADDRESS(RC1,3,3,1,"Gross")),0,Menus!R3C10) -> 0
A382: 419 | B382: =OFFSET(INDIRECT(ADDRESS(RC1,3,3,1,Menus!R10C11)),0,Menus!R4C10) -> 0 | C382: =OFFSET(INDIRECT(ADDRESS(RC1,3,3,1,Menus!R10C11)),0,Menus!R3C10) -> 0 | D382: =IF(Menus!R9C10,RC[-1]/RC[-2],RC[-1]) -> #DIV/0! | E382: =IF(RC11=1,VALUE(RC[-3]),NA()) -> NA() | F382: =INDIRECT(ADDRESS(RC1,1,3,1,Menus!R10C11)) -> 0 | G382: =IF(INDIRECT(ADDRESS(RC1,2,3,1,Menus!R10C11))=R1C,RC4,NA()) -> NA() | H382: =IF(INDIRECT(ADDRESS(RC1,2,3,1,Menus!R10C11))=R1C,RC4,NA()) -> NA() | I382: =IF(INDIRECT(ADDRESS(RC1,2,3,1,Menus!R10C11))=R1C,RC4,NA()) -> NA() | J382: =IF(INDIRECT(ADDRESS(RC1,1,3,1,Menus!R10C11))=T(R1C),RC4,NA()) -> NA() | K382: =IF(OR(ISNUMBER(RC7),ISNUMBER(RC8),ISNUMBER(RC9),ISNUMBER(RC10)),1,0) -> 0 | M382: =OFFSET(INDIRECT(ADDRESS(RC1,3,3,1,"Gross")),0,Menus!R4C10) -> 0 | N382: =OFFSET(INDIRECT(ADDRESS(RC1,3,3,1,"Gross")),0,Menus!R3C10) -> 0
A383: 420 | B383: =OFFSET(INDIRECT(ADDRESS(RC1,3,3,1,Menus!R10C11)),0,Menus!R4C10) -> 0 | C383: =OFFSET(INDIRECT(ADDRESS(RC1,3,3,1,Menus!R10C11)),0,Menus!R3C10) -> 0 | D383: =IF(Menus!R9C10,RC[-1]/RC[-2],RC[-1]) -> #DIV/0! | E383: =IF(RC11=1,VALUE(RC[-3]),NA()) -> NA() | F383: =INDIRECT(ADDRESS(RC1,1,3,1,Menus!R10C11)) -> 0 | G383: =IF(INDIRECT(ADDRESS(RC1,2,3,1,Menus!R10C11))=R1C,RC4,NA()) -> NA() | H383: =IF(INDIRECT(ADDRESS(RC1,2,3,1,Menus!R10C11))=R1C,RC4,NA()) -> NA() | I383: =IF(INDIRECT(ADDRESS(RC1,2,3,1,Menus!R10C11))=R1C,RC4,NA()) -> NA() | J383: =IF(INDIRECT(ADDRESS(RC1,1,3,1,Menus!R10C11))=T(R1C),RC4,NA()) -> NA() | K383: =IF(OR(ISNUMBER(RC7),ISNUMBER(RC8),ISNUMBER(RC9),ISNUMBER(RC10)),1,0) -> 0 | M383: =OFFSET(INDIRECT(ADDRESS(RC1,3,3,1,"Gross")),0,Menus!R4C10) -> 0 | N383: =OFFSET(INDIRECT(ADDRESS(RC1,3,3,1,"Gross")),0,Menus!R3C10) -> 0
A384: 421 | B384: =OFFSET(INDIRECT(ADDRESS(RC1,3,3,1,Menus!R10C11)),0,Menus!R4C10) -> 0 | C384: =OFFSET(INDIRECT(ADDRESS(RC1,3,3,1,Menus!R10C11)),0,Menus!R3C10) -> 0 | D384: =IF(Menus!R9C10,RC[-1]/RC[-2],RC[-1]) -> #DIV/0! | E384: =IF(RC11=1,VALUE(RC[-3]),NA()) -> NA() | F384: =INDIRECT(ADDRESS(RC1,1,3,1,Menus!R10C11)) -> 0 | G384: =IF(INDIRECT(ADDRESS(RC1,2,3,1,Menus!R10C11))=R1C,RC4,NA()) -> NA() | H384: =IF(INDIRECT(ADDRESS(RC1,2,3,1,Menus!R10C11))=R1C,RC4,NA()) -> NA() | I384: =IF(INDIRECT(ADDRESS(RC1,2,3,1,Menus!R10C11))=R1C,RC4,NA()) -> NA() | J384: =IF(INDIRECT(ADDRESS(RC1,1,3,1,Menus!R10C11))=T(R1C),RC4,NA()) -> NA() | K384: =IF(OR(ISNUMBER(RC7),ISNUMBER(RC8),ISNUMBER(RC9),ISNUMBER(RC10)),1,0) -> 0 | M384: =OFFSET(INDIRECT(ADDRESS(RC1,3,3,1,"Gross")),0,Menus!R4C10) -> 0 | N384: =OFFSET(INDIRECT(ADDRESS(RC1,3,3,1,"Gross")),0,Menus!R3C10) -> 0
A385: 422 | B385: =OFFSET(INDIRECT(ADDRESS(RC1,3,3,1,Menus!R10C11)),0,Menus!R4C10) -> 0 | C385: =OFFSET(INDIRECT(ADDRESS(RC1,3,3,1,Menus!R10C11)),0,Menus!R3C10) -> 0 | D385: =IF(Menus!R9C10,RC[-1]/RC[-2],RC[-1]) -> #DIV/0! | E385: =IF(RC11=1,VALUE(RC[-3]),NA()) -> NA() | F385: =INDIRECT(ADDRESS(RC1,1,3,1,Menus!R10C11)) -> 0 | G385: =IF(INDIRECT(ADDRESS(RC1,2,3,1,Menus!R10C11))=R1C,RC4,NA()) -> NA() | H385: =IF(INDIRECT(ADDRESS(RC1,2,3,1,Menus!R10C11))=R1C,RC4,NA()) -> NA() | I385: =IF(INDIRECT(ADDRESS(RC1,2,3,1,Menus!R10C11))=R1C,RC4,NA()) -> NA() | J385: =IF(INDIRECT(ADDRESS(RC1,1,3,1,Menus!R10C11))=T(R1C),RC4,NA()) -> NA() | K385: =IF(OR(ISNUMBER(RC7),ISNUMBER(RC8),ISNUMBER(RC9),ISNUMBER(RC10)),1,0) -> 0 | M385: =OFFSET(INDIRECT(ADDRESS(RC1,3,3,1,"Gross")),0,Menus!R4C10) -> 0 | N385: =OFFSET(INDIRECT(ADDRESS(RC1,3,3,1,"Gross")),0,Menus!R3C10) -> 0
A386: 423 | B386: =OFFSET(INDIRECT(ADDRESS(RC1,3,3,1,Menus!R10C11)),0,Menus!R4C10) -> 0 | C386: =OFFSET(INDIRECT(ADDRESS(RC1,3,3,1,Menus!R10C11)),0,Menus!R3C10) -> 0 | D386: =IF(Menus!R9C10,RC[-1]/RC[-2],RC[-1]) -> #DIV/0! | E386: =IF(RC11=1,VALUE(RC[-3]),NA()) -> NA() | F386: =INDIRECT(ADDRESS(RC1,1,3,1,Menus!R10C11)) -> 0 | G386: =IF(INDIRECT(ADDRESS(RC1,2,3,1,Menus!R10C11))=R1C,RC4,NA()) -> NA() | H386: =IF(INDIRECT(ADDRESS(RC1,2,3,1,Menus!R10C11))=R1C,RC4,NA()) -> NA() | I386: =IF(INDIRECT(ADDRESS(RC1,2,3,1,Menus!R10C11))=R1C,RC4,NA()) -> NA() | J386: =IF(INDIRECT(ADDRESS(RC1,1,3,1,Menus!R10C11))=T(R1C),RC4,NA()) -> NA() | K386: =IF(OR(ISNUMBER(RC7),ISNUMBER(RC8),ISNUMBER(RC9),ISNUMBER(RC10)),1,0) -> 0 | M386: =OFFSET(INDIRECT(ADDRESS(RC1,3,3,1,"Gross")),0,Menus!R4C10) -> 0 | N386: =OFFSET(INDIRECT(ADDRESS(RC1,3,3,1,"Gross")),0,Menus!R3C10) -> 0
A387: 424 | B387: =OFFSET(INDIRECT(ADDRESS(RC1,3,3,1,Menus!R10C11)),0,Menus!R4C10) -> 0 | C387: =OFFSET(INDIRECT(ADDRESS(RC1,3,3,1,Menus!R10C11)),0,Menus!R3C10) -> 0 | D387: =IF(Menus!R9C10,RC[-1]/RC[-2],RC[-1]) -> #DIV/0! | E387: =IF(RC11=1,VALUE(RC[-3]),NA()) -> NA() | F387: =INDIRECT(ADDRESS(RC1,1,3,1,Menus!R10C11)) -> 0 | G387: =IF(INDIRECT(ADDRESS(RC1,2,3,1,Menus!R10C11))=R1C,RC4,NA()) -> NA() | H387: =IF(INDIRECT(ADDRESS(RC1,2,3,1,Menus!R10C11))=R1C,RC4,NA()) -> NA() | I387: =IF(INDIRECT(ADDRESS(RC1,2,3,1,Menus!R10C11))=R1C,RC4,NA()) -> NA() | J387: =IF(INDIRECT(ADDRESS(RC1,1,3,1,Menus!R10C11))=T(R1C),RC4,NA()) -> NA() | K387: =IF(OR(ISNUMBER(RC7),ISNUMBER(RC8),ISNUMBER(RC9),ISNUMBER(RC10)),1,0) -> 0 | M387: =OFFSET(INDIRECT(ADDRESS(RC1,3,3,1,"Gross")),0,Menus!R4C10) -> 0 | N387: =OFFSET(INDIRECT(ADDRESS(RC1,3,3,1,"Gross")),0,Menus!R3C10) -> 0
A388: 425 | B388: =OFFSET(INDIRECT(ADDRESS(RC1,3,3,1,Menus!R10C11)),0,Menus!R4C10) -> 0 | C388: =OFFSET(INDIRECT(ADDRESS(RC1,3,3,1,Menus!R10C11)),0,Menus!R3C10) -> 0 | D388: =IF(Menus!R9C10,RC[-1]/RC[-2],RC[-1]) -> #DIV/0! | E388: =IF(RC11=1,VALUE(RC[-3]),NA()) -> NA() | F388: =INDIRECT(ADDRESS(RC1,1,3,1,Menus!R10C11)) -> 0 | G388: =IF(INDIRECT(ADDRESS(RC1,2,3,1,Menus!R10C11))=R1C,RC4,NA()) -> NA() | H388: =IF(INDIRECT(ADDRESS(RC1,2,3,1,Menus!R10C11))=R1C,RC4,NA()) -> NA() | I388: =IF(INDIRECT(ADDRESS(RC1,2,3,1,Menus!R10C11))=R1C,RC4,NA()) -> NA() | J388: =IF(INDIRECT(ADDRESS(RC1,1,3,1,Menus!R10C11))=T(R1C),RC4,NA()) -> NA() | K388: =IF(OR(ISNUMBER(RC7),ISNUMBER(RC8),ISNUMBER(RC9),ISNUMBER(RC10)),1,0) -> 0 | M388: =OFFSET(INDIRECT(ADDRESS(RC1,3,3,1,"Gross")),0,Menus!R4C10) -> 0 | N388: =OFFSET(INDIRECT(ADDRESS(RC1,3,3,1,"Gross")),0,Menus!R3C10) -> 0
A389: 426 | B389: =OFFSET(INDIRECT(ADDRESS(RC1,3,3,1,Menus!R10C11)),0,Menus!R4C10) -> 0 | C389: =OFFSET(INDIRECT(ADDRESS(RC1,3,3,1,Menus!R10C11)),0,Menus!R3C10) -> 0 | D389: =IF(Menus!R9C10,RC[-1]/RC[-2],RC[-1]) -> #DIV/0! | E389: =IF(RC11=1,VALUE(RC[-3]),NA()) -> NA() | F389: =INDIRECT(ADDRESS(RC1,1,3,1,Menus!R10C11)) -> 0 | G389: =IF(INDIRECT(ADDRESS(RC1,2,3,1,Menus!R10C11))=R1C,RC4,NA()) -> NA() | H389: =IF(INDIRECT(ADDRESS(RC1,2,3,1,Menus!R10C11))=R1C,RC4,NA()) -> NA() | I389: =IF(INDIRECT(ADDRESS(RC1,2,3,1,Menus!R10C11))=R1C,RC4,NA()) -> NA() | J389: =IF(INDIRECT(ADDRESS(RC1,1,3,1,Menus!R10C11))=T(R1C),RC4,NA()) -> NA() | K389: =IF(OR(ISNUMBER(RC7),ISNUMBER(RC8),ISNUMBER(RC9),ISNUMBER(RC10)),1,0) -> 0 | M389: =OFFSET(INDIRECT(ADDRESS(RC1,3,3,1,"Gross")),0,Menus!R4C10) -> 0 | N389: =OFFSET(INDIRECT(ADDRESS(RC1,3,3,1,"Gross")),0,Menus!R3C10) -> 0
A390: 427 | B390: =OFFSET(INDIRECT(ADDRESS(RC1,3,3,1,Menus!R10C11)),0,Menus!R4C10) -> 0 | C390: =OFFSET(INDIRECT(ADDRESS(RC1,3,3,1,Menus!R10C11)),0,Menus!R3C10) -> 0 | D390: =IF(Menus!R9C10,RC[-1]/RC[-2],RC[-1]) -> #DIV/0! | E390: =IF(RC11=1,VALUE(RC[-3]),NA()) -> NA() | F390: =INDIRECT(ADDRESS(RC1,1,3,1,Menus!R10C11)) -> 0 | G390: =IF(INDIRECT(ADDRESS(RC1,2,3,1,Menus!R10C11))=R1C,RC4,NA()) -> NA() | H390: =IF(INDIRECT(ADDRESS(RC1,2,3,1,Menus!R10C11))=R1C,RC4,NA()) -> NA() | I390: =IF(INDIRECT(ADDRESS(RC1,2,3,1,Menus!R10C11))=R1C,RC4,NA()) -> NA() | J390: =IF(INDIRECT(ADDRESS(RC1,1,3,1,Menus!R10C11))=T(R1C),RC4,NA()) -> NA() | K390: =IF(OR(ISNUMBER(RC7),ISNUMBER(RC8),ISNUMBER(RC9),ISNUMBER(RC10)),1,0) -> 0 | M390: =OFFSET(INDIRECT(ADDRESS(RC1,3,3,1,"Gross")),0,Menus!R4C10) -> 0 | N390: =OFFSET(INDIRECT(ADDRESS(RC1,3,3,1,"Gross")),0,Menus!R3C10) -> 0
A391: 428 | B391: =OFFSET(INDIRECT(ADDRESS(RC1,3,3,1,Menus!R10C11)),0,Menus!R4C10) -> 0 | C391: =OFFSET(INDIRECT(ADDRESS(RC1,3,3,1,Menus!R10C11)),0,Menus!R3C10) -> 0 | D391: =IF(Menus!R9C10,RC[-1]/RC[-2],RC[-1]) -> #DIV/0! | E391: =IF(RC11=1,VALUE(RC[-3]),NA()) -> NA() | F391: =INDIRECT(ADDRESS(RC1,1,3,1,Menus!R10C11)) -> 0 | G391: =IF(INDIRECT(ADDRESS(RC1,2,3,1,Menus!R10C11))=R1C,RC4,NA()) -> NA() | H391: =IF(INDIRECT(ADDRESS(RC1,2,3,1,Menus!R10C11))=R1C,RC4,NA()) -> NA() | I391: =IF(INDIRECT(ADDRESS(RC1,2,3,1,Menus!R10C11))=R1C,RC4,NA()) -> NA() | J391: =IF(INDIRECT(ADDRESS(RC1,1,3,1,Menus!R10C11))=T(R1C),RC4,NA()) -> NA() | K391: =IF(OR(ISNUMBER(RC7),ISNUMBER(RC8),ISNUMBER(RC9),ISNUMBER(RC10)),1,0) -> 0 | M391: =OFFSET(INDIRECT(ADDRESS(RC1,3,3,1,"Gross")),0,Menus!R4C10) -> 0 | N391: =OFFSET(INDIRECT(ADDRESS(RC1,3,3,1,"Gross")),0,Menus!R3C10) -> 0
A392: 429 | B392: =OFFSET(INDIRECT(ADDRESS(RC1,3,3,1,Menus!R10C11)),0,Menus!R4C10) -> 0 | C392: =OFFSET(INDIRECT(ADDRESS(RC1,3,3,1,Menus!R10C11)),0,Menus!R3C10) -> 0 | D392: =IF(Menus!R9C10,RC[-1]/RC[-2],RC[-1]) -> #DIV/0! | E392: =IF(RC11=1,VALUE(RC[-3]),NA()) -> NA() | F392: =INDIRECT(ADDRESS(RC1,1,3,1,Menus!R10C11)) -> 0 | G392: =IF(INDIRECT(ADDRESS(RC1,2,3,1,Menus!R10C11))=R1C,RC4,NA()) -> NA() | H392: =IF(INDIRECT(ADDRESS(RC1,2,3,1,Menus!R10C11))=R1C,RC4,NA()) -> NA() | I392: =IF(INDIRECT(ADDRESS(RC1,2,3,1,Menus!R10C11))=R1C,RC4,NA()) -> NA() | J392: =IF(INDIRECT(ADDRESS(RC1,1,3,1,Menus!R10C11))=T(R1C),RC4,NA()) -> NA() | K392: =IF(OR(ISNUMBER(RC7),ISNUMBER(RC8),ISNUMBER(RC9),ISNUMBER(RC10)),1,0) -> 0 | M392: =OFFSET(INDIRECT(ADDRESS(RC1,3,3,1,"Gross")),0,Menus!R4C10) -> 0 | N392: =OFFSET(INDIRECT(ADDRESS(RC1,3,3,1,"Gross")),0,Menus!R3C10) -> 0
A393: 430 | B393: =OFFSET(INDIRECT(ADDRESS(RC1,3,3,1,Menus!R10C11)),0,Menus!R4C10) -> 0 | C393: =OFFSET(INDIRECT(ADDRESS(RC1,3,3,1,Menus!R10C11)),0,Menus!R3C10) -> 0 | D393: =IF(Menus!R9C10,RC[-1]/RC[-2],RC[-1]) -> #DIV/0! | E393: =IF(RC11=1,VALUE(RC[-3]),NA()) -> NA() | F393: =INDIRECT(ADDRESS(RC1,1,3,1,Menus!R10C11)) -> 0 | G393: =IF(INDIRECT(ADDRESS(RC1,2,3,1,Menus!R10C11))=R1C,RC4,NA()) -> NA() | H393: =IF(INDIRECT(ADDRESS(RC1,2,3,1,Menus!R10C11))=R1C,RC4,NA()) -> NA() | I393: =IF(INDIRECT(ADDRESS(RC1,2,3,1,Menus!R10C11))=R1C,RC4,NA()) -> NA() | J393: =IF(INDIRECT(ADDRESS(RC1,1,3,1,Menus!R10C11))=T(R1C),RC4,NA()) -> NA() | K393: =IF(OR(ISNUMBER(RC7),ISNUMBER(RC8),ISNUMBER(RC9),ISNUMBER(RC10)),1,0) -> 0 | M393: =OFFSET(INDIRECT(ADDRESS(RC1,3,3,1,"Gross")),0,Menus!R4C10) -> 0 | N393: =OFFSET(INDIRECT(ADDRESS(RC1,3,3,1,"Gross")),0,Menus!R3C10) -> 0
A394: 431 | B394: =OFFSET(INDIRECT(ADDRESS(RC1,3,3,1,Menus!R10C11)),0,Menus!R4C10) -> 0 | C394: =OFFSET(INDIRECT(ADDRESS(RC1,3,3,1,Menus!R10C11)),0,Menus!R3C10) -> 0 | D394: =IF(Menus!R9C10,RC[-1]/RC[-2],RC[-1]) -> #DIV/0! | E394: =IF(RC11=1,VALUE(RC[-3]),NA()) -> NA() | F394: =INDIRECT(ADDRESS(RC1,1,3,1,Menus!R10C11)) -> 0 | G394: =IF(INDIRECT(ADDRESS(RC1,2,3,1,Menus!R10C11))=R1C,RC4,NA()) -> NA() | H394: =IF(INDIRECT(ADDRESS(RC1,2,3,1,Menus!R10C11))=R1C,RC4,NA()) -> NA() | I394: =IF(INDIRECT(ADDRESS(RC1,2,3,1,Menus!R10C11))=R1C,RC4,NA()) -> NA() | J394: =IF(INDIRECT(ADDRESS(RC1,1,3,1,Menus!R10C11))=T(R1C),RC4,NA()) -> NA() | K394: =IF(OR(ISNUMBER(RC7),ISNUMBER(RC8),ISNUMBER(RC9),ISNUMBER(RC10)),1,0) -> 0 | M394: =OFFSET(INDIRECT(ADDRESS(RC1,3,3,1,"Gross")),0,Menus!R4C10) -> 0 | N394: =OFFSET(INDIRECT(ADDRESS(RC1,3,3,1,"Gross")),0,Menus!R3C10) -> 0
A395: 432 | B395: =OFFSET(INDIRECT(ADDRESS(RC1,3,3,1,Menus!R10C11)),0,Menus!R4C10) -> 0 | C395: =OFFSET(INDIRECT(ADDRESS(RC1,3,3,1,Menus!R10C11)),0,Menus!R3C10) -> 0 | D395: =IF(Menus!R9C10,RC[-1]/RC[-2],RC[-1]) -> #DIV/0! | E395: =IF(RC11=1,VALUE(RC[-3]),NA()) -> NA() | F395: =INDIRECT(ADDRESS(RC1,1,3,1,Menus!R10C11)) -> 0 | G395: =IF(INDIRECT(ADDRESS(RC1,2,3,1,Menus!R10C11))=R1C,RC4,NA()) -> NA() | H395: =IF(INDIRECT(ADDRESS(RC1,2,3,1,Menus!R10C11))=R1C,RC4,NA()) -> NA() | I395: =IF(INDIRECT(ADDRESS(RC1,2,3,1,Menus!R10C11))=R1C,RC4,NA()) -> NA() | J395: =IF(INDIRECT(ADDRESS(RC1,1,3,1,Menus!R10C11))=T(R1C),RC4,NA()) -> NA() | K395: =IF(OR(ISNUMBER(RC7),ISNUMBER(RC8),ISNUMBER(RC9),ISNUMBER(RC10)),1,0) -> 0 | M395: =OFFSET(INDIRECT(ADDRESS(RC1,3,3,1,"Gross")),0,Menus!R4C10) -> 0 | N395: =OFFSET(INDIRECT(ADDRESS(RC1,3,3,1,"Gross")),0,Menus!R3C10) -> 0
A396: 433 | B396: =OFFSET(INDIRECT(ADDRESS(RC1,3,3,1,Menus!R10C11)),0,Menus!R4C10) -> 0 | C396: =OFFSET(INDIRECT(ADDRESS(RC1,3,3,1,Menus!R10C11)),0,Menus!R3C10) -> 0 | D396: =IF(Menus!R9C10,RC[-1]/RC[-2],RC[-1]) -> #DIV/0! | E396: =IF(RC11=1,VALUE(RC[-3]),NA()) -> NA() | F396: =INDIRECT(ADDRESS(RC1,1,3,1,Menus!R10C11)) -> 0 | G396: =IF(INDIRECT(ADDRESS(RC1,2,3,1,Menus!R10C11))=R1C,RC4,NA()) -> NA() | H396: =IF(INDIRECT(ADDRESS(RC1,2,3,1,Menus!R10C11))=R1C,RC4,NA()) -> NA() | I396: =IF(INDIRECT(ADDRESS(RC1,2,3,1,Menus!R10C11))=R1C,RC4,NA()) -> NA() | J396: =IF(INDIRECT(ADDRESS(RC1,1,3,1,Menus!R10C11))=T(R1C),RC4,NA()) -> NA() | K396: =IF(OR(ISNUMBER(RC7),ISNUMBER(RC8),ISNUMBER(RC9),ISNUMBER(RC10)),1,0) -> 0 | M396: =OFFSET(INDIRECT(ADDRESS(RC1,3,3,1,"Gross")),0,Menus!R4C10) -> 0 | N396: =OFFSET(INDIRECT(ADDRESS(RC1,3,3,1,"Gross")),0,Menus!R3C10) -> 0
A397: 434 | B397: =OFFSET(INDIRECT(ADDRESS(RC1,3,3,1,Menus!R10C11)),0,Menus!R4C10) -> 0 | C397: =OFFSET(INDIRECT(ADDRESS(RC1,3,3,1,Menus!R10C11)),0,Menus!R3C10) -> 0 | D397: =IF(Menus!R9C10,RC[-1]/RC[-2],RC[-1]) -> #DIV/0! | E397: =IF(RC11=1,VALUE(RC[-3]),NA()) -> NA() | F397: =INDIRECT(ADDRESS(RC1,1,3,1,Menus!R10C11)) -> 0 | G397: =IF(INDIRECT(ADDRESS(RC1,2,3,1,Menus!R10C11))=R1C,RC4,NA()) -> NA() | H397: =IF(INDIRECT(ADDRESS(RC1,2,3,1,Menus!R10C11))=R1C,RC4,NA()) -> NA() | I397: =IF(INDIRECT(ADDRESS(RC1,2,3,1,Menus!R10C11))=R1C,RC4,NA()) -> NA() | J397: =IF(INDIRECT(ADDRESS(RC1,1,3,1,Menus!R10C11))=T(R1C),RC4,NA()) -> NA() | K397: =IF(OR(ISNUMBER(RC7),ISNUMBER(RC8),ISNUMBER(RC9),ISNUMBER(RC10)),1,0) -> 0 | M397: =OFFSET(INDIRECT(ADDRESS(RC1,3,3,1,"Gross")),0,Menus!R4C10) -> 0 | N397: =OFFSET(INDIRECT(ADDRESS(RC1,3,3,1,"Gross")),0,Menus!R3C10) -> 0
A398: 435 | B398: =OFFSET(INDIRECT(ADDRESS(RC1,3,3,1,Menus!R10C11)),0,Menus!R4C10) -> 0 | C398: =OFFSET(INDIRECT(ADDRESS(RC1,3,3,1,Menus!R10C11)),0,Menus!R3C10) -> 0 | D398: =IF(Menus!R9C10,RC[-1]/RC[-2],RC[-1]) -> #DIV/0! | E398: =IF(RC11=1,VALUE(RC[-3]),NA()) -> NA() | F398: =INDIRECT(ADDRESS(RC1,1,3,1,Menus!R10C11)) -> 0 | G398: =IF(INDIRECT(ADDRESS(RC1,2,3,1,Menus!R10C11))=R1C,RC4,NA()) -> NA() | H398: =IF(INDIRECT(ADDRESS(RC1,2,3,1,Menus!R10C11))=R1C,RC4,NA()) -> NA() | I398: =IF(INDIRECT(ADDRESS(RC1,2,3,1,Menus!R10C11))=R1C,RC4,NA()) -> NA() | J398: =IF(INDIRECT(ADDRESS(RC1,1,3,1,Menus!R10C11))=T(R1C),RC4,NA()) -> NA() | K398: =IF(OR(ISNUMBER(RC7),ISNUMBER(RC8),ISNUMBER(RC9),ISNUMBER(RC10)),1,0) -> 0 | M398: =OFFSET(INDIRECT(ADDRESS(RC1,3,3,1,"Gross")),0,Menus!R4C10) -> 0 | N398: =OFFSET(INDIRECT(ADDRESS(RC1,3,3,1,"Gross")),0,Menus!R3C10) -> 0
A399: 436 | B399: =OFFSET(INDIRECT(ADDRESS(RC1,3,3,1,Menus!R10C11)),0,Menus!R4C10) -> 0 | C399: =OFFSET(INDIRECT(ADDRESS(RC1,3,3,1,Menus!R10C11)),0,Menus!R3C10) -> 0 | D399: =IF(Menus!R9C10,RC[-1]/RC[-2],RC[-1]) -> #DIV/0! | E399: =IF(RC11=1,VALUE(RC[-3]),NA()) -> NA() | F399: =INDIRECT(ADDRESS(RC1,1,3,1,Menus!R10C11)) -> 0 | G399: =IF(INDIRECT(ADDRESS(RC1,2,3,1,Menus!R10C11))=R1C,RC4,NA()) -> NA() | H399: =IF(INDIRECT(ADDRESS(RC1,2,3,1,Menus!R10C11))=R1C,RC4,NA()) -> NA() | I399: =IF(INDIRECT(ADDRESS(RC1,2,3,1,Menus!R10C11))=R1C,RC4,NA()) -> NA() | J399: =IF(INDIRECT(ADDRESS(RC1,1,3,1,Menus!R10C11))=T(R1C),RC4,NA()) -> NA() | K399: =IF(OR(ISNUMBER(RC7),ISNUMBER(RC8),ISNUMBER(RC9),ISNUMBER(RC10)),1,0) -> 0 | M399: =OFFSET(INDIRECT(ADDRESS(RC1,3,3,1,"Gross")),0,Menus!R4C10) -> 0 | N399: =OFFSET(INDIRECT(ADDRESS(RC1,3,3,1,"Gross")),0,Menus!R3C10) -> 0
A400: 437 | B400: =OFFSET(INDIRECT(ADDRESS(RC1,3,3,1,Menus!R10C11)),0,Menus!R4C10) -> 0 | C400: =OFFSET(INDIRECT(ADDRESS(RC1,3,3,1,Menus!R10C11)),0,Menus!R3C10) -> 0 | D400: =IF(Menus!R9C10,RC[-1]/RC[-2],RC[-1]) -> #DIV/0! | E400: =IF(RC11=1,VALUE(RC[-3]),NA()) -> NA() | F400: =INDIRECT(ADDRESS(RC1,1,3,1,Menus!R10C11)) -> 0 | G400: =IF(INDIRECT(ADDRESS(RC1,2,3,1,Menus!R10C11))=R1C,RC4,NA()) -> NA() | H400: =IF(INDIRECT(ADDRESS(RC1,2,3,1,Menus!R10C11))=R1C,RC4,NA()) -> NA() | I400: =IF(INDIRECT(ADDRESS(RC1,2,3,1,Menus!R10C11))=R1C,RC4,NA()) -> NA() | J400: =IF(INDIRECT(ADDRESS(RC1,1,3,1,Menus!R10C11))=T(R1C),RC4,NA()) -> NA() | K400: =IF(OR(ISNUMBER(RC7),ISNUMBER(RC8),ISNUMBER(RC9),ISNUMBER(RC10)),1,0) -> 0 | M400: =OFFSET(INDIRECT(ADDRESS(RC1,3,3,1,"Gross")),0,Menus!R4C10) -> 0 | N400: =OFFSET(INDIRECT(ADDRESS(RC1,3,3,1,"Gross")),0,Menus!R3C10) -> 0
A401: 438 | B401: =OFFSET(INDIRECT(ADDRESS(RC1,3,3,1,Menus!R10C11)),0,Menus!R4C10) -> 0 | C401: =OFFSET(INDIRECT(ADDRESS(RC1,3,3,1,Menus!R10C11)),0,Menus!R3C10) -> 0 | D401: =IF(Menus!R9C10,RC[-1]/RC[-2],RC[-1]) -> #DIV/0! | E401: =IF(RC11=1,VALUE(RC[-3]),NA()) -> NA() | F401: =INDIRECT(ADDRESS(RC1,1,3,1,Menus!R10C11)) -> 0 | G401: =IF(INDIRECT(ADDRESS(RC1,2,3,1,Menus!R10C11))=R1C,RC4,NA()) -> NA() | H401: =IF(INDIRECT(ADDRESS(RC1,2,3,1,Menus!R10C11))=R1C,RC4,NA()) -> NA() | I401: =IF(INDIRECT(ADDRESS(RC1,2,3,1,Menus!R10C11))=R1C,RC4,NA()) -> NA() | J401: =IF(INDIRECT(ADDRESS(RC1,1,3,1,Menus!R10C11))=T(R1C),RC4,NA()) -> NA() | K401: =IF(OR(ISNUMBER(RC7),ISNUMBER(RC8),ISNUMBER(RC9),ISNUMBER(RC10)),1,0) -> 0 | M401: =OFFSET(INDIRECT(ADDRESS(RC1,3,3,1,"Gross")),0,Menus!R4C10) -> 0 | N401: =OFFSET(INDIRECT(ADDRESS(RC1,3,3,1,"Gross")),0,Menus!R3C10) -> 0
A402: 439 | B402: =OFFSET(INDIRECT(ADDRESS(RC1,3,3,1,Menus!R10C11)),0,Menus!R4C10) -> 0 | C402: =OFFSET(INDIRECT(ADDRESS(RC1,3,3,1,Menus!R10C11)),0,Menus!R3C10) -> 0 | D402: =IF(Menus!R9C10,RC[-1]/RC[-2],RC[-1]) -> #DIV/0! | E402: =IF(RC11=1,VALUE(RC[-3]),NA()) -> NA() | F402: =INDIRECT(ADDRESS(RC1,1,3,1,Menus!R10C11)) -> 0 | G402: =IF(INDIRECT(ADDRESS(RC1,2,3,1,Menus!R10C11))=R1C,RC4,NA()) -> NA() | H402: =IF(INDIRECT(ADDRESS(RC1,2,3,1,Menus!R10C11))=R1C,RC4,NA()) -> NA() | I402: =IF(INDIRECT(ADDRESS(RC1,2,3,1,Menus!R10C11))=R1C,RC4,NA()) -> NA() | J402: =IF(INDIRECT(ADDRESS(RC1,1,3,1,Menus!R10C11))=T(R1C),RC4,NA()) -> NA() | K402: =IF(OR(ISNUMBER(RC7),ISNUMBER(RC8),ISNUMBER(RC9),ISNUMBER(RC10)),1,0) -> 0 | M402: =OFFSET(INDIRECT(ADDRESS(RC1,3,3,1,"Gross")),0,Menus!R4C10) -> 0 | N402: =OFFSET(INDIRECT(ADDRESS(RC1,3,3,1,"Gross")),0,Menus!R3C10) -> 0
A403: 440 | B403: =OFFSET(INDIRECT(ADDRESS(RC1,3,3,1,Menus!R10C11)),0,Menus!R4C10) -> 0 | C403: =OFFSET(INDIRECT(ADDRESS(RC1,3,3,1,Menus!R10C11)),0,Menus!R3C10) -> 0 | D403: =IF(Menus!R9C10,RC[-1]/RC[-2],RC[-1]) -> #DIV/0! | E403: =IF(RC11=1,VALUE(RC[-3]),NA()) -> NA() | F403: =INDIRECT(ADDRESS(RC1,1,3,1,Menus!R10C11)) -> 0 | G403: =IF(INDIRECT(ADDRESS(RC1,2,3,1,Menus!R10C11))=R1C,RC4,NA()) -> NA() | H403: =IF(INDIRECT(ADDRESS(RC1,2,3,1,Menus!R10C11))=R1C,RC4,NA()) -> NA() | I403: =IF(INDIRECT(ADDRESS(RC1,2,3,1,Menus!R10C11))=R1C,RC4,NA()) -> NA() | J403: =IF(INDIRECT(ADDRESS(RC1,1,3,1,Menus!R10C11))=T(R1C),RC4,NA()) -> NA() | K403: =IF(OR(ISNUMBER(RC7),ISNUMBER(RC8),ISNUMBER(RC9),ISNUMBER(RC10)),1,0) -> 0 | M403: =OFFSET(INDIRECT(ADDRESS(RC1,3,3,1,"Gross")),0,Menus!R4C10) -> 0 | N403: =OFFSET(INDIRECT(ADDRESS(RC1,3,3,1,"Gross")),0,Menus!R3C10) -> 0
A404: 441 | B404: =OFFSET(INDIRECT(ADDRESS(RC1,3,3,1,Menus!R10C11)),0,Menus!R4C10) -> 0 | C404: =OFFSET(INDIRECT(ADDRESS(RC1,3,3,1,Menus!R10C11)),0,Menus!R3C10) -> 0 | D404: =IF(Menus!R9C10,RC[-1]/RC[-2],RC[-1]) -> #DIV/0! | E404: =IF(RC11=1,VALUE(RC[-3]),NA()) -> NA() | F404: =INDIRECT(ADDRESS(RC1,1,3,1,Menus!R10C11)) -> 0 | G404: =IF(INDIRECT(ADDRESS(RC1,2,3,1,Menus!R10C11))=R1C,RC4,NA()) -> NA() | H404: =IF(INDIRECT(ADDRESS(RC1,2,3,1,Menus!R10C11))=R1C,RC4,NA()) -> NA() | I404: =IF(INDIRECT(ADDRESS(RC1,2,3,1,Menus!R10C11))=R1C,RC4,NA()) -> NA() | J404: =IF(INDIRECT(ADDRESS(RC1,1,3,1,Menus!R10C11))=T(R1C),RC4,NA()) -> NA() | K404: =IF(OR(ISNUMBER(RC7),ISNUMBER(RC8),ISNUMBER(RC9),ISNUMBER(RC10)),1,0) -> 0 | M404: =OFFSET(INDIRECT(ADDRESS(RC1,3,3,1,"Gross")),0,Menus!R4C10) -> 0 | N404: =OFFSET(INDIRECT(ADDRESS(RC1,3,3,1,"Gross")),0,Menus!R3C10) -> 0
A405: 442 | B405: =OFFSET(INDIRECT(ADDRESS(RC1,3,3,1,Menus!R10C11)),0,Menus!R4C10) -> 0 | C405: =OFFSET(INDIRECT(ADDRESS(RC1,3,3,1,Menus!R10C11)),0,Menus!R3C10) -> 0 | D405: =IF(Menus!R9C10,RC[-1]/RC[-2],RC[-1]) -> #DIV/0! | E405: =IF(RC11=1,VALUE(RC[-3]),NA()) -> NA() | F405: =INDIRECT(ADDRESS(RC1,1,3,1,Menus!R10C11)) -> 0 | G405: =IF(INDIRECT(ADDRESS(RC1,2,3,1,Menus!R10C11))=R1C,RC4,NA()) -> NA() | H405: =IF(INDIRECT(ADDRESS(RC1,2,3,1,Menus!R10C11))=R1C,RC4,NA()) -> NA() | I405: =IF(INDIRECT(ADDRESS(RC1,2,3,1,Menus!R10C11))=R1C,RC4,NA()) -> NA() | J405: =IF(INDIRECT(ADDRESS(RC1,1,3,1,Menus!R10C11))=T(R1C),RC4,NA()) -> NA() | K405: =IF(OR(ISNUMBER(RC7),ISNUMBER(RC8),ISNUMBER(RC9),ISNUMBER(RC10)),1,0) -> 0 | M405: =OFFSET(INDIRECT(ADDRESS(RC1,3,3,1,"Gross")),0,Menus!R4C10) -> 0 | N405: =OFFSET(INDIRECT(ADDRESS(RC1,3,3,1,"Gross")),0,Menus!R3C10) -> 0
A406: 443 | B406: =OFFSET(INDIRECT(ADDRESS(RC1,3,3,1,Menus!R10C11)),0,Menus!R4C10) -> 0 | C406: =OFFSET(INDIRECT(ADDRESS(RC1,3,3,1,Menus!R10C11)),0,Menus!R3C10) -> 0 | D406: =IF(Menus!R9C10,RC[-1]/RC[-2],RC[-1]) -> #DIV/0! | E406: =IF(RC11=1,VALUE(RC[-3]),NA()) -> NA() | F406: =INDIRECT(ADDRESS(RC1,1,3,1,Menus!R10C11)) -> 0 | G406: =IF(INDIRECT(ADDRESS(RC1,2,3,1,Menus!R10C11))=R1C,RC4,NA()) -> NA() | H406: =IF(INDIRECT(ADDRESS(RC1,2,3,1,Menus!R10C11))=R1C,RC4,NA()) -> NA() | I406: =IF(INDIRECT(ADDRESS(RC1,2,3,1,Menus!R10C11))=R1C,RC4,NA()) -> NA() | J406: =IF(INDIRECT(ADDRESS(RC1,1,3,1,Menus!R10C11))=T(R1C),RC4,NA()) -> NA() | K406: =IF(OR(ISNUMBER(RC7),ISNUMBER(RC8),ISNUMBER(RC9),ISNUMBER(RC10)),1,0) -> 0 | M406: =OFFSET(INDIRECT(ADDRESS(RC1,3,3,1,"Gross")),0,Menus!R4C10) -> 0 | N406: =OFFSET(INDIRECT(ADDRESS(RC1,3,3,1,"Gross")),0,Menus!R3C10) -> 0
A407: 444 | B407: =OFFSET(INDIRECT(ADDRESS(RC1,3,3,1,Menus!R10C11)),0,Menus!R4C10) -> 0 | C407: =OFFSET(INDIRECT(ADDRESS(RC1,3,3,1,Menus!R10C11)),0,Menus!R3C10) -> 0 | D407: =IF(Menus!R9C10,RC[-1]/RC[-2],RC[-1]) -> #DIV/0! | E407: =IF(RC11=1,VALUE(RC[-3]),NA()) -> NA() | F407: =INDIRECT(ADDRESS(RC1,1,3,1,Menus!R10C11)) -> 0 | G407: =IF(INDIRECT(ADDRESS(RC1,2,3,1,Menus!R10C11))=R1C,RC4,NA()) -> NA() | H407: =IF(INDIRECT(ADDRESS(RC1,2,3,1,Menus!R10C11))=R1C,RC4,NA()) -> NA() | I407: =IF(INDIRECT(ADDRESS(RC1,2,3,1,Menus!R10C11))=R1C,RC4,NA()) -> NA() | J407: =IF(INDIRECT(ADDRESS(RC1,1,3,1,Menus!R10C11))=T(R1C),RC4,NA()) -> NA() | K407: =IF(OR(ISNUMBER(RC7),ISNUMBER(RC8),ISNUMBER(RC9),ISNUMBER(RC10)),1,0) -> 0 | M407: =OFFSET(INDIRECT(ADDRESS(RC1,3,3,1,"Gross")),0,Menus!R4C10) -> 0 | N407: =OFFSET(INDIRECT(ADDRESS(RC1,3,3,1,"Gross")),0,Menus!R3C10) -> 0
A408: 445 | B408: =OFFSET(INDIRECT(ADDRESS(RC1,3,3,1,Menus!R10C11)),0,Menus!R4C10) -> 0 | C408: =OFFSET(INDIRECT(ADDRESS(RC1,3,3,1,Menus!R10C11)),0,Menus!R3C10) -> 0 | D408: =IF(Menus!R9C10,RC[-1]/RC[-2],RC[-1]) -> #DIV/0! | E408: =IF(RC11=1,VALUE(RC[-3]),NA()) -> NA() | F408: =INDIRECT(ADDRESS(RC1,1,3,1,Menus!R10C11)) -> 0 | G408: =IF(INDIRECT(ADDRESS(RC1,2,3,1,Menus!R10C11))=R1C,RC4,NA()) -> NA() | H408: =IF(INDIRECT(ADDRESS(RC1,2,3,1,Menus!R10C11))=R1C,RC4,NA()) -> NA() | I408: =IF(INDIRECT(ADDRESS(RC1,2,3,1,Menus!R10C11))=R1C,RC4,NA()) -> NA() | J408: =IF(INDIRECT(ADDRESS(RC1,1,3,1,Menus!R10C11))=T(R1C),RC4,NA()) -> NA() | K408: =IF(OR(ISNUMBER(RC7),ISNUMBER(RC8),ISNUMBER(RC9),ISNUMBER(RC10)),1,0) -> 0 | M408: =OFFSET(INDIRECT(ADDRESS(RC1,3,3,1,"Gross")),0,Menus!R4C10) -> 0 | N408: =OFFSET(INDIRECT(ADDRESS(RC1,3,3,1,"Gross")),0,Menus!R3C10) -> 0
A409: 446 | B409: =OFFSET(INDIRECT(ADDRESS(RC1,3,3,1,Menus!R10C11)),0,Menus!R4C10) -> 0 | C409: =OFFSET(INDIRECT(ADDRESS(RC1,3,3,1,Menus!R10C11)),0,Menus!R3C10) -> 0 | D409: =IF(Menus!R9C10,RC[-1]/RC[-2],RC[-1]) -> #DIV/0! | E409: =IF(RC11=1,VALUE(RC[-3]),NA()) -> NA() | F409: =INDIRECT(ADDRESS(RC1,1,3,1,Menus!R10C11)) -> 0 | G409: =IF(INDIRECT(ADDRESS(RC1,2,3,1,Menus!R10C11))=R1C,RC4,NA()) -> NA() | H409: =IF(INDIRECT(ADDRESS(RC1,2,3,1,Menus!R10C11))=R1C,RC4,NA()) -> NA() | I409: =IF(INDIRECT(ADDRESS(RC1,2,3,1,Menus!R10C11))=R1C,RC4,NA()) -> NA() | J409: =IF(INDIRECT(ADDRESS(RC1,1,3,1,Menus!R10C11))=T(R1C),RC4,NA()) -> NA() | K409: =IF(OR(ISNUMBER(RC7),ISNUMBER(RC8),ISNUMBER(RC9),ISNUMBER(RC10)),1,0) -> 0 | M409: =OFFSET(INDIRECT(ADDRESS(RC1,3,3,1,"Gross")),0,Menus!R4C10) -> 0 | N409: =OFFSET(INDIRECT(ADDRESS(RC1,3,3,1,"Gross")),0,Menus!R3C10) -> 0
A410: 447 | B410: =OFFSET(INDIRECT(ADDRESS(RC1,3,3,1,Menus!R10C11)),0,Menus!R4C10) -> 0 | C410: =OFFSET(INDIRECT(ADDRESS(RC1,3,3,1,Menus!R10C11)),0,Menus!R3C10) -> 0 | D410: =IF(Menus!R9C10,RC[-1]/RC[-2],RC[-1]) -> #DIV/0! | E410: =IF(RC11=1,VALUE(RC[-3]),NA()) -> NA() | F410: =INDIRECT(ADDRESS(RC1,1,3,1,Menus!R10C11)) -> 0 | G410: =IF(INDIRECT(ADDRESS(RC1,2,3,1,Menus!R10C11))=R1C,RC4,NA()) -> NA() | H410: =IF(INDIRECT(ADDRESS(RC1,2,3,1,Menus!R10C11))=R1C,RC4,NA()) -> NA() | I410: =IF(INDIRECT(ADDRESS(RC1,2,3,1,Menus!R10C11))=R1C,RC4,NA()) -> NA() | J410: =IF(INDIRECT(ADDRESS(RC1,1,3,1,Menus!R10C11))=T(R1C),RC4,NA()) -> NA() | K410: =IF(OR(ISNUMBER(RC7),ISNUMBER(RC8),ISNUMBER(RC9),ISNUMBER(RC10)),1,0) -> 0 | M410: =OFFSET(INDIRECT(ADDRESS(RC1,3,3,1,"Gross")),0,Menus!R4C10) -> 0 | N410: =OFFSET(INDIRECT(ADDRESS(RC1,3,3,1,"Gross")),0,Menus!R3C10) -> 0
A411: 448 | B411: =OFFSET(INDIRECT(ADDRESS(RC1,3,3,1,Menus!R10C11)),0,Menus!R4C10) -> 0 | C411: =OFFSET(INDIRECT(ADDRESS(RC1,3,3,1,Menus!R10C11)),0,Menus!R3C10) -> 0 | D411: =IF(Menus!R9C10,RC[-1]/RC[-2],RC[-1]) -> #DIV/0! | E411: =IF(RC11=1,VALUE(RC[-3]),NA()) -> NA() | F411: =INDIRECT(ADDRESS(RC1,1,3,1,Menus!R10C11)) -> 0 | G411: =IF(INDIRECT(ADDRESS(RC1,2,3,1,Menus!R10C11))=R1C,RC4,NA()) -> NA() | H411: =IF(INDIRECT(ADDRESS(RC1,2,3,1,Menus!R10C11))=R1C,RC4,NA()) -> NA() | I411: =IF(INDIRECT(ADDRESS(RC1,2,3,1,Menus!R10C11))=R1C,RC4,NA()) -> NA() | J411: =IF(INDIRECT(ADDRESS(RC1,1,3,1,Menus!R10C11))=T(R1C),RC4,NA()) -> NA() | K411: =IF(OR(ISNUMBER(RC7),ISNUMBER(RC8),ISNUMBER(RC9),ISNUMBER(RC10)),1,0) -> 0 | M411: =OFFSET(INDIRECT(ADDRESS(RC1,3,3,1,"Gross")),0,Menus!R4C10) -> 0 | N411: =OFFSET(INDIRECT(ADDRESS(RC1,3,3,1,"Gross")),0,Menus!R3C10) -> 0
A412: 449 | B412: =OFFSET(INDIRECT(ADDRESS(RC1,3,3,1,Menus!R10C11)),0,Menus!R4C10) -> 0 | C412: =OFFSET(INDIRECT(ADDRESS(RC1,3,3,1,Menus!R10C11)),0,Menus!R3C10) -> 0 | D412: =IF(Menus!R9C10,RC[-1]/RC[-2],RC[-1]) -> #DIV/0! | E412: =IF(RC11=1,VALUE(RC[-3]),NA()) -> NA() | F412: =INDIRECT(ADDRESS(RC1,1,3,1,Menus!R10C11)) -> 0 | G412: =IF(INDIRECT(ADDRESS(RC1,2,3,1,Menus!R10C11))=R1C,RC4,NA()) -> NA() | H412: =IF(INDIRECT(ADDRESS(RC1,2,3,1,Menus!R10C11))=R1C,RC4,NA()) -> NA() | I412: =IF(INDIRECT(ADDRESS(RC1,2,3,1,Menus!R10C11))=R1C,RC4,NA()) -> NA() | J412: =IF(INDIRECT(ADDRESS(RC1,1,3,1,Menus!R10C11))=T(R1C),RC4,NA()) -> NA() | K412: =IF(OR(ISNUMBER(RC7),ISNUMBER(RC8),ISNUMBER(RC9),ISNUMBER(RC10)),1,0) -> 0 | M412: =OFFSET(INDIRECT(ADDRESS(RC1,3,3,1,"Gross")),0,Menus!R4C10) -> 0 | N412: =OFFSET(INDIRECT(ADDRESS(RC1,3,3,1,"Gross")),0,Menus!R3C10) -> 0
A413: 450 | B413: =OFFSET(INDIRECT(ADDRESS(RC1,3,3,1,Menus!R10C11)),0,Menus!R4C10) -> 0 | C413: =OFFSET(INDIRECT(ADDRESS(RC1,3,3,1,Menus!R10C11)),0,Menus!R3C10) -> 0 | D413: =IF(Menus!R9C10,RC[-1]/RC[-2],RC[-1]) -> #DIV/0! | E413: =IF(RC11=1,VALUE(RC[-3]),NA()) -> NA() | F413: =INDIRECT(ADDRESS(RC1,1,3,1,Menus!R10C11)) -> 0 | G413: =IF(INDIRECT(ADDRESS(RC1,2,3,1,Menus!R10C11))=R1C,RC4,NA()) -> NA() | H413: =IF(INDIRECT(ADDRESS(RC1,2,3,1,Menus!R10C11))=R1C,RC4,NA()) -> NA() | I413: =IF(INDIRECT(ADDRESS(RC1,2,3,1,Menus!R10C11))=R1C,RC4,NA()) -> NA() | J413: =IF(INDIRECT(ADDRESS(RC1,1,3,1,Menus!R10C11))=T(R1C),RC4,NA()) -> NA() | K413: =IF(OR(ISNUMBER(RC7),ISNUMBER(RC8),ISNUMBER(RC9),ISNUMBER(RC10)),1,0) -> 0 | M413: =OFFSET(INDIRECT(ADDRESS(RC1,3,3,1,"Gross")),0,Menus!R4C10) -> 0 | N413: =OFFSET(INDIRECT(ADDRESS(RC1,3,3,1,"Gross")),0,Menus!R3C10) -> 0
A414: 451 | B414: =OFFSET(INDIRECT(ADDRESS(RC1,3,3,1,Menus!R10C11)),0,Menus!R4C10) -> 0 | C414: =OFFSET(INDIRECT(ADDRESS(RC1,3,3,1,Menus!R10C11)),0,Menus!R3C10) -> 0 | D414: =IF(Menus!R9C10,RC[-1]/RC[-2],RC[-1]) -> #DIV/0! | E414: =IF(RC11=1,VALUE(RC[-3]),NA()) -> NA() | F414: =INDIRECT(ADDRESS(RC1,1,3,1,Menus!R10C11)) -> 0 | G414: =IF(INDIRECT(ADDRESS(RC1,2,3,1,Menus!R10C11))=R1C,RC4,NA()) -> NA() | H414: =IF(INDIRECT(ADDRESS(RC1,2,3,1,Menus!R10C11))=R1C,RC4,NA()) -> NA() | I414: =IF(INDIRECT(ADDRESS(RC1,2,3,1,Menus!R10C11))=R1C,RC4,NA()) -> NA() | J414: =IF(INDIRECT(ADDRESS(RC1,1,3,1,Menus!R10C11))=T(R1C),RC4,NA()) -> NA() | K414: =IF(OR(ISNUMBER(RC7),ISNUMBER(RC8),ISNUMBER(RC9),ISNUMBER(RC10)),1,0) -> 0 | M414: =OFFSET(INDIRECT(ADDRESS(RC1,3,3,1,"Gross")),0,Menus!R4C10) -> 0 | N414: =OFFSET(INDIRECT(ADDRESS(RC1,3,3,1,"Gross")),0,Menus!R3C10) -> 0
A415: 452 | B415: =OFFSET(INDIRECT(ADDRESS(RC1,3,3,1,Menus!R10C11)),0,Menus!R4C10) -> 0 | C415: =OFFSET(INDIRECT(ADDRESS(RC1,3,3,1,Menus!R10C11)),0,Menus!R3C10) -> 0 | D415: =IF(Menus!R9C10,RC[-1]/RC[-2],RC[-1]) -> #DIV/0! | E415: =IF(RC11=1,VALUE(RC[-3]),NA()) -> NA() | F415: =INDIRECT(ADDRESS(RC1,1,3,1,Menus!R10C11)) -> 0 | G415: =IF(INDIRECT(ADDRESS(RC1,2,3,1,Menus!R10C11))=R1C,RC4,NA()) -> NA() | H415: =IF(INDIRECT(ADDRESS(RC1,2,3,1,Menus!R10C11))=R1C,RC4,NA()) -> NA() | I415: =IF(INDIRECT(ADDRESS(RC1,2,3,1,Menus!R10C11))=R1C,RC4,NA()) -> NA() | J415: =IF(INDIRECT(ADDRESS(RC1,1,3,1,Menus!R10C11))=T(R1C),RC4,NA()) -> NA() | K415: =IF(OR(ISNUMBER(RC7),ISNUMBER(RC8),ISNUMBER(RC9),ISNUMBER(RC10)),1,0) -> 0 | M415: =OFFSET(INDIRECT(ADDRESS(RC1,3,3,1,"Gross")),0,Menus!R4C10) -> 0 | N415: =OFFSET(INDIRECT(ADDRESS(RC1,3,3,1,"Gross")),0,Menus!R3C10) -> 0
A416: 453 | B416: =OFFSET(INDIRECT(ADDRESS(RC1,3,3,1,Menus!R10C11)),0,Menus!R4C10) -> 0 | C416: =OFFSET(INDIRECT(ADDRESS(RC1,3,3,1,Menus!R10C11)),0,Menus!R3C10) -> 0 | D416: =IF(Menus!R9C10,RC[-1]/RC[-2],RC[-1]) -> #DIV/0! | E416: =IF(RC11=1,VALUE(RC[-3]),NA()) -> NA() | F416: =INDIRECT(ADDRESS(RC1,1,3,1,Menus!R10C11)) -> 0 | G416: =IF(INDIRECT(ADDRESS(RC1,2,3,1,Menus!R10C11))=R1C,RC4,NA()) -> NA() | H416: =IF(INDIRECT(ADDRESS(RC1,2,3,1,Menus!R10C11))=R1C,RC4,NA()) -> NA() | I416: =IF(INDIRECT(ADDRESS(RC1,2,3,1,Menus!R10C11))=R1C,RC4,NA()) -> NA() | J416: =IF(INDIRECT(ADDRESS(RC1,1,3,1,Menus!R10C11))=T(R1C),RC4,NA()) -> NA() | K416: =IF(OR(ISNUMBER(RC7),ISNUMBER(RC8),ISNUMBER(RC9),ISNUMBER(RC10)),1,0) -> 0 | M416: =OFFSET(INDIRECT(ADDRESS(RC1,3,3,1,"Gross")),0,Menus!R4C10) -> 0 | N416: =OFFSET(INDIRECT(ADDRESS(RC1,3,3,1,"Gross")),0,Menus!R3C10) -> 0
A417: 454 | B417: =OFFSET(INDIRECT(ADDRESS(RC1,3,3,1,Menus!R10C11)),0,Menus!R4C10) -> 0 | C417: =OFFSET(INDIRECT(ADDRESS(RC1,3,3,1,Menus!R10C11)),0,Menus!R3C10) -> 0 | D417: =IF(Menus!R9C10,RC[-1]/RC[-2],RC[-1]) -> #DIV/0! | E417: =IF(RC11=1,VALUE(RC[-3]),NA()) -> NA() | F417: =INDIRECT(ADDRESS(RC1,1,3,1,Menus!R10C11)) -> 0 | G417: =IF(INDIRECT(ADDRESS(RC1,2,3,1,Menus!R10C11))=R1C,RC4,NA()) -> NA() | H417: =IF(INDIRECT(ADDRESS(RC1,2,3,1,Menus!R10C11))=R1C,RC4,NA()) -> NA() | I417: =IF(INDIRECT(ADDRESS(RC1,2,3,1,Menus!R10C11))=R1C,RC4,NA()) -> NA() | J417: =IF(INDIRECT(ADDRESS(RC1,1,3,1,Menus!R10C11))=T(R1C),RC4,NA()) -> NA() | K417: =IF(OR(ISNUMBER(RC7),ISNUMBER(RC8),ISNUMBER(RC9),ISNUMBER(RC10)),1,0) -> 0 | M417: =OFFSET(INDIRECT(ADDRESS(RC1,3,3,1,"Gross")),0,Menus!R4C10) -> 0 | N417: =OFFSET(INDIRECT(ADDRESS(RC1,3,3,1,"Gross")),0,Menus!R3C10) -> 0
A418: 455 | B418: =OFFSET(INDIRECT(ADDRESS(RC1,3,3,1,Menus!R10C11)),0,Menus!R4C10) -> 0 | C418: =OFFSET(INDIRECT(ADDRESS(RC1,3,3,1,Menus!R10C11)),0,Menus!R3C10) -> 0 | D418: =IF(Menus!R9C10,RC[-1]/RC[-2],RC[-1]) -> #DIV/0! | E418: =IF(RC11=1,VALUE(RC[-3]),NA()) -> NA() | F418: =INDIRECT(ADDRESS(RC1,1,3,1,Menus!R10C11)) -> 0 | G418: =IF(INDIRECT(ADDRESS(RC1,2,3,1,Menus!R10C11))=R1C,RC4,NA()) -> NA() | H418: =IF(INDIRECT(ADDRESS(RC1,2,3,1,Menus!R10C11))=R1C,RC4,NA()) -> NA() | I418: =IF(INDIRECT(ADDRESS(RC1,2,3,1,Menus!R10C11))=R1C,RC4,NA()) -> NA() | J418: =IF(INDIRECT(ADDRESS(RC1,1,3,1,Menus!R10C11))=T(R1C),RC4,NA()) -> NA() | K418: =IF(OR(ISNUMBER(RC7),ISNUMBER(RC8),ISNUMBER(RC9),ISNUMBER(RC10)),1,0) -> 0 | M418: =OFFSET(INDIRECT(ADDRESS(RC1,3,3,1,"Gross")),0,Menus!R4C10) -> 0 | N418: =OFFSET(INDIRECT(ADDRESS(RC1,3,3,1,"Gross")),0,Menus!R3C10) -> 0
A419: 456 | B419: =OFFSET(INDIRECT(ADDRESS(RC1,3,3,1,Menus!R10C11)),0,Menus!R4C10) -> 0 | C419: =OFFSET(INDIRECT(ADDRESS(RC1,3,3,1,Menus!R10C11)),0,Menus!R3C10) -> 0 | D419: =IF(Menus!R9C10,RC[-1]/RC[-2],RC[-1]) -> #DIV/0! | E419: =IF(RC11=1,VALUE(RC[-3]),NA()) -> NA() | F419: =INDIRECT(ADDRESS(RC1,1,3,1,Menus!R10C11)) -> 0 | G419: =IF(INDIRECT(ADDRESS(RC1,2,3,1,Menus!R10C11))=R1C,RC4,NA()) -> NA() | H419: =IF(INDIRECT(ADDRESS(RC1,2,3,1,Menus!R10C11))=R1C,RC4,NA()) -> NA() | I419: =IF(INDIRECT(ADDRESS(RC1,2,3,1,Menus!R10C11))=R1C,RC4,NA()) -> NA() | J419: =IF(INDIRECT(ADDRESS(RC1,1,3,1,Menus!R10C11))=T(R1C),RC4,NA()) -> NA() | K419: =IF(OR(ISNUMBER(RC7),ISNUMBER(RC8),ISNUMBER(RC9),ISNUMBER(RC10)),1,0) -> 0 | M419: =OFFSET(INDIRECT(ADDRESS(RC1,3,3,1,"Gross")),0,Menus!R4C10) -> 0 | N419: =OFFSET(INDIRECT(ADDRESS(RC1,3,3,1,"Gross")),0,Menus!R3C10) -> 0
A420: 457 | B420: =OFFSET(INDIRECT(ADDRESS(RC1,3,3,1,Menus!R10C11)),0,Menus!R4C10) -> 0 | C420: =OFFSET(INDIRECT(ADDRESS(RC1,3,3,1,Menus!R10C11)),0,Menus!R3C10) -> 0 | D420: =IF(Menus!R9C10,RC[-1]/RC[-2],RC[-1]) -> #DIV/0! | E420: =IF(RC11=1,VALUE(RC[-3]),NA()) -> NA() | F420: =INDIRECT(ADDRESS(RC1,1,3,1,Menus!R10C11)) -> 0 | G420: =IF(INDIRECT(ADDRESS(RC1,2,3,1,Menus!R10C11))=R1C,RC4,NA()) -> NA() | H420: =IF(INDIRECT(ADDRESS(RC1,2,3,1,Menus!R10C11))=R1C,RC4,NA()) -> NA() | I420: =IF(INDIRECT(ADDRESS(RC1,2,3,1,Menus!R10C11))=R1C,RC4,NA()) -> NA() | J420: =IF(INDIRECT(ADDRESS(RC1,1,3,1,Menus!R10C11))=T(R1C),RC4,NA()) -> NA() | K420: =IF(OR(ISNUMBER(RC7),ISNUMBER(RC8),ISNUMBER(RC9),ISNUMBER(RC10)),1,0) -> 0 | M420: =OFFSET(INDIRECT(ADDRESS(RC1,3,3,1,"Gross")),0,Menus!R4C10) -> 0 | N420: =OFFSET(INDIRECT(ADDRESS(RC1,3,3,1,"Gross")),0,Menus!R3C10) -> 0
A421: 458 | B421: =OFFSET(INDIRECT(ADDRESS(RC1,3,3,1,Menus!R10C11)),0,Menus!R4C10) -> 0 | C421: =OFFSET(INDIRECT(ADDRESS(RC1,3,3,1,Menus!R10C11)),0,Menus!R3C10) -> 0 | D421: =IF(Menus!R9C10,RC[-1]/RC[-2],RC[-1]) -> #DIV/0! | E421: =IF(RC11=1,VALUE(RC[-3]),NA()) -> NA() | F421: =INDIRECT(ADDRESS(RC1,1,3,1,Menus!R10C11)) -> 0 | G421: =IF(INDIRECT(ADDRESS(RC1,2,3,1,Menus!R10C11))=R1C,RC4,NA()) -> NA() | H421: =IF(INDIRECT(ADDRESS(RC1,2,3,1,Menus!R10C11))=R1C,RC4,NA()) -> NA() | I421: =IF(INDIRECT(ADDRESS(RC1,2,3,1,Menus!R10C11))=R1C,RC4,NA()) -> NA() | J421: =IF(INDIRECT(ADDRESS(RC1,1,3,1,Menus!R10C11))=T(R1C),RC4,NA()) -> NA() | K421: =IF(OR(ISNUMBER(RC7),ISNUMBER(RC8),ISNUMBER(RC9),ISNUMBER(RC10)),1,0) -> 0 | M421: =OFFSET(INDIRECT(ADDRESS(RC1,3,3,1,"Gross")),0,Menus!R4C10) -> 0 | N421: =OFFSET(INDIRECT(ADDRESS(RC1,3,3,1,"Gross")),0,Menus!R3C10) -> 0
A422: 459 | B422: =OFFSET(INDIRECT(ADDRESS(RC1,3,3,1,Menus!R10C11)),0,Menus!R4C10) -> 0 | C422: =OFFSET(INDIRECT(ADDRESS(RC1,3,3,1,Menus!R10C11)),0,Menus!R3C10) -> 0 | D422: =IF(Menus!R9C10,RC[-1]/RC[-2],RC[-1]) -> #DIV/0! | E422: =IF(RC11=1,VALUE(RC[-3]),NA()) -> NA() | F422: =INDIRECT(ADDRESS(RC1,1,3,1,Menus!R10C11)) -> 0 | G422: =IF(INDIRECT(ADDRESS(RC1,2,3,1,Menus!R10C11))=R1C,RC4,NA()) -> NA() | H422: =IF(INDIRECT(ADDRESS(RC1,2,3,1,Menus!R10C11))=R1C,RC4,NA()) -> NA() | I422: =IF(INDIRECT(ADDRESS(RC1,2,3,1,Menus!R10C11))=R1C,RC4,NA()) -> NA() | J422: =IF(INDIRECT(ADDRESS(RC1,1,3,1,Menus!R10C11))=T(R1C),RC4,NA()) -> NA() | K422: =IF(OR(ISNUMBER(RC7),ISNUMBER(RC8),ISNUMBER(RC9),ISNUMBER(RC10)),1,0) -> 0 | M422: =OFFSET(INDIRECT(ADDRESS(RC1,3,3,1,"Gross")),0,Menus!R4C10) -> 0 | N422: =OFFSET(INDIRECT(ADDRESS(RC1,3,3,1,"Gross")),0,Menus!R3C10) -> 0
A423: 460 | B423: =OFFSET(INDIRECT(ADDRESS(RC1,3,3,1,Menus!R10C11)),0,Menus!R4C10) -> 0 | C423: =OFFSET(INDIRECT(ADDRESS(RC1,3,3,1,Menus!R10C11)),0,Menus!R3C10) -> 0 | D423: =IF(Menus!R9C10,RC[-1]/RC[-2],RC[-1]) -> #DIV/0! | E423: =IF(RC11=1,VALUE(RC[-3]),NA()) -> NA() | F423: =INDIRECT(ADDRESS(RC1,1,3,1,Menus!R10C11)) -> 0 | G423: =IF(INDIRECT(ADDRESS(RC1,2,3,1,Menus!R10C11))=R1C,RC4,NA()) -> NA() | H423: =IF(INDIRECT(ADDRESS(RC1,2,3,1,Menus!R10C11))=R1C,RC4,NA()) -> NA() | I423: =IF(INDIRECT(ADDRESS(RC1,2,3,1,Menus!R10C11))=R1C,RC4,NA()) -> NA() | J423: =IF(INDIRECT(ADDRESS(RC1,1,3,1,Menus!R10C11))=T(R1C),RC4,NA()) -> NA() | K423: =IF(OR(ISNUMBER(RC7),ISNUMBER(RC8),ISNUMBER(RC9),ISNUMBER(RC10)),1,0) -> 0 | M423: =OFFSET(INDIRECT(ADDRESS(RC1,3,3,1,"Gross")),0,Menus!R4C10) -> 0 | N423: =OFFSET(INDIRECT(ADDRESS(RC1,3,3,1,"Gross")),0,Menus!R3C10) -> 0
A424: 461 | B424: =OFFSET(INDIRECT(ADDRESS(RC1,3,3,1,Menus!R10C11)),0,Menus!R4C10) -> 0 | C424: =OFFSET(INDIRECT(ADDRESS(RC1,3,3,1,Menus!R10C11)),0,Menus!R3C10) -> 0 | D424: =IF(Menus!R9C10,RC[-1]/RC[-2],RC[-1]) -> #DIV/0! | E424: =IF(RC11=1,VALUE(RC[-3]),NA()) -> NA() | F424: =INDIRECT(ADDRESS(RC1,1,3,1,Menus!R10C11)) -> 0 | G424: =IF(INDIRECT(ADDRESS(RC1,2,3,1,Menus!R10C11))=R1C,RC4,NA()) -> NA() | H424: =IF(INDIRECT(ADDRESS(RC1,2,3,1,Menus!R10C11))=R1C,RC4,NA()) -> NA() | I424: =IF(INDIRECT(ADDRESS(RC1,2,3,1,Menus!R10C11))=R1C,RC4,NA()) -> NA() | J424: =IF(INDIRECT(ADDRESS(RC1,1,3,1,Menus!R10C11))=T(R1C),RC4,NA()) -> NA() | K424: =IF(OR(ISNUMBER(RC7),ISNUMBER(RC8),ISNUMBER(RC9),ISNUMBER(RC10)),1,0) -> 0 | M424: =OFFSET(INDIRECT(ADDRESS(RC1,3,3,1,"Gross")),0,Menus!R4C10) -> 0 | N424: =OFFSET(INDIRECT(ADDRESS(RC1,3,3,1,"Gross")),0,Menus!R3C10) -> 0
A425: 462 | B425: =OFFSET(INDIRECT(ADDRESS(RC1,3,3,1,Menus!R10C11)),0,Menus!R4C10) -> 0 | C425: =OFFSET(INDIRECT(ADDRESS(RC1,3,3,1,Menus!R10C11)),0,Menus!R3C10) -> 0 | D425: =IF(Menus!R9C10,RC[-1]/RC[-2],RC[-1]) -> #DIV/0! | E425: =IF(RC11=1,VALUE(RC[-3]),NA()) -> NA() | F425: =INDIRECT(ADDRESS(RC1,1,3,1,Menus!R10C11)) -> 0 | G425: =IF(INDIRECT(ADDRESS(RC1,2,3,1,Menus!R10C11))=R1C,RC4,NA()) -> NA() | H425: =IF(INDIRECT(ADDRESS(RC1,2,3,1,Menus!R10C11))=R1C,RC4,NA()) -> NA() | I425: =IF(INDIRECT(ADDRESS(RC1,2,3,1,Menus!R10C11))=R1C,RC4,NA()) -> NA() | J425: =IF(INDIRECT(ADDRESS(RC1,1,3,1,Menus!R10C11))=T(R1C),RC4,NA()) -> NA() | K425: =IF(OR(ISNUMBER(RC7),ISNUMBER(RC8),ISNUMBER(RC9),ISNUMBER(RC10)),1,0) -> 0 | M425: =OFFSET(INDIRECT(ADDRESS(RC1,3,3,1,"Gross")),0,Menus!R4C10) -> 0 | N425: =OFFSET(INDIRECT(ADDRESS(RC1,3,3,1,"Gross")),0,Menus!R3C10) -> 0
A426: 463 | B426: =OFFSET(INDIRECT(ADDRESS(RC1,3,3,1,Menus!R10C11)),0,Menus!R4C10) -> 0 | C426: =OFFSET(INDIRECT(ADDRESS(RC1,3,3,1,Menus!R10C11)),0,Menus!R3C10) -> 0 | D426: =IF(Menus!R9C10,RC[-1]/RC[-2],RC[-1]) -> #DIV/0! | E426: =IF(RC11=1,VALUE(RC[-3]),NA()) -> NA() | F426: =INDIRECT(ADDRESS(RC1,1,3,1,Menus!R10C11)) -> 0 | G426: =IF(INDIRECT(ADDRESS(RC1,2,3,1,Menus!R10C11))=R1C,RC4,NA()) -> NA() | H426: =IF(INDIRECT(ADDRESS(RC1,2,3,1,Menus!R10C11))=R1C,RC4,NA()) -> NA() | I426: =IF(INDIRECT(ADDRESS(RC1,2,3,1,Menus!R10C11))=R1C,RC4,NA()) -> NA() | J426: =IF(INDIRECT(ADDRESS(RC1,1,3,1,Menus!R10C11))=T(R1C),RC4,NA()) -> NA() | K426: =IF(OR(ISNUMBER(RC7),ISNUMBER(RC8),ISNUMBER(RC9),ISNUMBER(RC10)),1,0) -> 0 | M426: =OFFSET(INDIRECT(ADDRESS(RC1,3,3,1,"Gross")),0,Menus!R4C10) -> 0 | N426: =OFFSET(INDIRECT(ADDRESS(RC1,3,3,1,"Gross")),0,Menus!R3C10) -> 0
A427: 464 | B427: =OFFSET(INDIRECT(ADDRESS(RC1,3,3,1,Menus!R10C11)),0,Menus!R4C10) -> 0 | C427: =OFFSET(INDIRECT(ADDRESS(RC1,3,3,1,Menus!R10C11)),0,Menus!R3C10) -> 0 | D427: =IF(Menus!R9C10,RC[-1]/RC[-2],RC[-1]) -> #DIV/0! | E427: =IF(RC11=1,VALUE(RC[-3]),NA()) -> NA() | F427: =INDIRECT(ADDRESS(RC1,1,3,1,Menus!R10C11)) -> 0 | G427: =IF(INDIRECT(ADDRESS(RC1,2,3,1,Menus!R10C11))=R1C,RC4,NA()) -> NA() | H427: =IF(INDIRECT(ADDRESS(RC1,2,3,1,Menus!R10C11))=R1C,RC4,NA()) -> NA() | I427: =IF(INDIRECT(ADDRESS(RC1,2,3,1,Menus!R10C11))=R1C,RC4,NA()) -> NA() | J427: =IF(INDIRECT(ADDRESS(RC1,1,3,1,Menus!R10C11))=T(R1C),RC4,NA()) -> NA() | K427: =IF(OR(ISNUMBER(RC7),ISNUMBER(RC8),ISNUMBER(RC9),ISNUMBER(RC10)),1,0) -> 0 | M427: =OFFSET(INDIRECT(ADDRESS(RC1,3,3,1,"Gross")),0,Menus!R4C10) -> 0 | N427: =OFFSET(INDIRECT(ADDRESS(RC1,3,3,1,"Gross")),0,Menus!R3C10) -> 0
A428: 465 | B428: =OFFSET(INDIRECT(ADDRESS(RC1,3,3,1,Menus!R10C11)),0,Menus!R4C10) -> 0 | C428: =OFFSET(INDIRECT(ADDRESS(RC1,3,3,1,Menus!R10C11)),0,Menus!R3C10) -> 0 | D428: =IF(Menus!R9C10,RC[-1]/RC[-2],RC[-1]) -> #DIV/0! | E428: =IF(RC11=1,VALUE(RC[-3]),NA()) -> NA() | F428: =INDIRECT(ADDRESS(RC1,1,3,1,Menus!R10C11)) -> 0 | G428: =IF(INDIRECT(ADDRESS(RC1,2,3,1,Menus!R10C11))=R1C,RC4,NA()) -> NA() | H428: =IF(INDIRECT(ADDRESS(RC1,2,3,1,Menus!R10C11))=R1C,RC4,NA()) -> NA() | I428: =IF(INDIRECT(ADDRESS(RC1,2,3,1,Menus!R10C11))=R1C,RC4,NA()) -> NA() | J428: =IF(INDIRECT(ADDRESS(RC1,1,3,1,Menus!R10C11))=T(R1C),RC4,NA()) -> NA() | K428: =IF(OR(ISNUMBER(RC7),ISNUMBER(RC8),ISNUMBER(RC9),ISNUMBER(RC10)),1,0) -> 0 | M428: =OFFSET(INDIRECT(ADDRESS(RC1,3,3,1,"Gross")),0,Menus!R4C10) -> 0 | N428: =OFFSET(INDIRECT(ADDRESS(RC1,3,3,1,"Gross")),0,Menus!R3C10) -> 0
A429: 466 | B429: =OFFSET(INDIRECT(ADDRESS(RC1,3,3,1,Menus!R10C11)),0,Menus!R4C10) -> 0 | C429: =OFFSET(INDIRECT(ADDRESS(RC1,3,3,1,Menus!R10C11)),0,Menus!R3C10) -> 0 | D429: =IF(Menus!R9C10,RC[-1]/RC[-2],RC[-1]) -> #DIV/0! | E429: =IF(RC11=1,VALUE(RC[-3]),NA()) -> NA() | F429: =INDIRECT(ADDRESS(RC1,1,3,1,Menus!R10C11)) -> 0 | G429: =IF(INDIRECT(ADDRESS(RC1,2,3,1,Menus!R10C11))=R1C,RC4,NA()) -> NA() | H429: =IF(INDIRECT(ADDRESS(RC1,2,3,1,Menus!R10C11))=R1C,RC4,NA()) -> NA() | I429: =IF(INDIRECT(ADDRESS(RC1,2,3,1,Menus!R10C11))=R1C,RC4,NA()) -> NA() | J429: =IF(INDIRECT(ADDRESS(RC1,1,3,1,Menus!R10C11))=T(R1C),RC4,NA()) -> NA() | K429: =IF(OR(ISNUMBER(RC7),ISNUMBER(RC8),ISNUMBER(RC9),ISNUMBER(RC10)),1,0) -> 0 | M429: =OFFSET(INDIRECT(ADDRESS(RC1,3,3,1,"Gross")),0,Menus!R4C10) -> 0 | N429: =OFFSET(INDIRECT(ADDRESS(RC1,3,3,1,"Gross")),0,Menus!R3C10) -> 0
A430: 467 | B430: =OFFSET(INDIRECT(ADDRESS(RC1,3,3,1,Menus!R10C11)),0,Menus!R4C10) -> 0 | C430: =OFFSET(INDIRECT(ADDRESS(RC1,3,3,1,Menus!R10C11)),0,Menus!R3C10) -> 0 | D430: =IF(Menus!R9C10,RC[-1]/RC[-2],RC[-1]) -> #DIV/0! | E430: =IF(RC11=1,VALUE(RC[-3]),NA()) -> NA() | F430: =INDIRECT(ADDRESS(RC1,1,3,1,Menus!R10C11)) -> 0 | G430: =IF(INDIRECT(ADDRESS(RC1,2,3,1,Menus!R10C11))=R1C,RC4,NA()) -> NA() | H430: =IF(INDIRECT(ADDRESS(RC1,2,3,1,Menus!R10C11))=R1C,RC4,NA()) -> NA() | I430: =IF(INDIRECT(ADDRESS(RC1,2,3,1,Menus!R10C11))=R1C,RC4,NA()) -> NA() | J430: =IF(INDIRECT(ADDRESS(RC1,1,3,1,Menus!R10C11))=T(R1C),RC4,NA()) -> NA() | K430: =IF(OR(ISNUMBER(RC7),ISNUMBER(RC8),ISNUMBER(RC9),ISNUMBER(RC10)),1,0) -> 0 | M430: =OFFSET(INDIRECT(ADDRESS(RC1,3,3,1,"Gross")),0,Menus!R4C10) -> 0 | N430: =OFFSET(INDIRECT(ADDRESS(RC1,3,3,1,"Gross")),0,Menus!R3C10) -> 0
A431: 468 | B431: =OFFSET(INDIRECT(ADDRESS(RC1,3,3,1,Menus!R10C11)),0,Menus!R4C10) -> 0 | C431: =OFFSET(INDIRECT(ADDRESS(RC1,3,3,1,Menus!R10C11)),0,Menus!R3C10) -> 0 | D431: =IF(Menus!R9C10,RC[-1]/RC[-2],RC[-1]) -> #DIV/0! | E431: =IF(RC11=1,VALUE(RC[-3]),NA()) -> NA() | F431: =INDIRECT(ADDRESS(RC1,1,3,1,Menus!R10C11)) -> 0 | G431: =IF(INDIRECT(ADDRESS(RC1,2,3,1,Menus!R10C11))=R1C,RC4,NA()) -> NA() | H431: =IF(INDIRECT(ADDRESS(RC1,2,3,1,Menus!R10C11))=R1C,RC4,NA()) -> NA() | I431: =IF(INDIRECT(ADDRESS(RC1,2,3,1,Menus!R10C11))=R1C,RC4,NA()) -> NA() | J431: =IF(INDIRECT(ADDRESS(RC1,1,3,1,Menus!R10C11))=T(R1C),RC4,NA()) -> NA() | K431: =IF(OR(ISNUMBER(RC7),ISNUMBER(RC8),ISNUMBER(RC9),ISNUMBER(RC10)),1,0) -> 0 | M431: =OFFSET(INDIRECT(ADDRESS(RC1,3,3,1,"Gross")),0,Menus!R4C10) -> 0 | N431: =OFFSET(INDIRECT(ADDRESS(RC1,3,3,1,"Gross")),0,Menus!R3C10) -> 0
A432: 469 | B432: =OFFSET(INDIRECT(ADDRESS(RC1,3,3,1,Menus!R10C11)),0,Menus!R4C10) -> 0 | C432: =OFFSET(INDIRECT(ADDRESS(RC1,3,3,1,Menus!R10C11)),0,Menus!R3C10) -> 0 | D432: =IF(Menus!R9C10,RC[-1]/RC[-2],RC[-1]) -> #DIV/0! | E432: =IF(RC11=1,VALUE(RC[-3]),NA()) -> NA() | F432: =INDIRECT(ADDRESS(RC1,1,3,1,Menus!R10C11)) -> 0 | G432: =IF(INDIRECT(ADDRESS(RC1,2,3,1,Menus!R10C11))=R1C,RC4,NA()) -> NA() | H432: =IF(INDIRECT(ADDRESS(RC1,2,3,1,Menus!R10C11))=R1C,RC4,NA()) -> NA() | I432: =IF(INDIRECT(ADDRESS(RC1,2,3,1,Menus!R10C11))=R1C,RC4,NA()) -> NA() | J432: =IF(INDIRECT(ADDRESS(RC1,1,3,1,Menus!R10C11))=T(R1C),RC4,NA()) -> NA() | K432: =IF(OR(ISNUMBER(RC7),ISNUMBER(RC8),ISNUMBER(RC9),ISNUMBER(RC10)),1,0) -> 0 | M432: =OFFSET(INDIRECT(ADDRESS(RC1,3,3,1,"Gross")),0,Menus!R4C10) -> 0 | N432: =OFFSET(INDIRECT(ADDRESS(RC1,3,3,1,"Gross")),0,Menus!R3C10) -> 0
A433: 470 | B433: =OFFSET(INDIRECT(ADDRESS(RC1,3,3,1,Menus!R10C11)),0,Menus!R4C10) -> 0 | C433: =OFFSET(INDIRECT(ADDRESS(RC1,3,3,1,Menus!R10C11)),0,Menus!R3C10) -> 0 | D433: =IF(Menus!R9C10,RC[-1]/RC[-2],RC[-1]) -> #DIV/0! | E433: =IF(RC11=1,VALUE(RC[-3]),NA()) -> NA() | F433: =INDIRECT(ADDRESS(RC1,1,3,1,Menus!R10C11)) -> 0 | G433: =IF(INDIRECT(ADDRESS(RC1,2,3,1,Menus!R10C11))=R1C,RC4,NA()) -> NA() | H433: =IF(INDIRECT(ADDRESS(RC1,2,3,1,Menus!R10C11))=R1C,RC4,NA()) -> NA() | I433: =IF(INDIRECT(ADDRESS(RC1,2,3,1,Menus!R10C11))=R1C,RC4,NA()) -> NA() | J433: =IF(INDIRECT(ADDRESS(RC1,1,3,1,Menus!R10C11))=T(R1C),RC4,NA()) -> NA() | K433: =IF(OR(ISNUMBER(RC7),ISNUMBER(RC8),ISNUMBER(RC9),ISNUMBER(RC10)),1,0) -> 0 | M433: =OFFSET(INDIRECT(ADDRESS(RC1,3,3,1,"Gross")),0,Menus!R4C10) -> 0 | N433: =OFFSET(INDIRECT(ADDRESS(RC1,3,3,1,"Gross")),0,Menus!R3C10) -> 0
A434: 471 | B434: =OFFSET(INDIRECT(ADDRESS(RC1,3,3,1,Menus!R10C11)),0,Menus!R4C10) -> 0 | C434: =OFFSET(INDIRECT(ADDRESS(RC1,3,3,1,Menus!R10C11)),0,Menus!R3C10) -> 0 | D434: =IF(Menus!R9C10,RC[-1]/RC[-2],RC[-1]) -> #DIV/0! | E434: =IF(RC11=1,VALUE(RC[-3]),NA()) -> NA() | F434: =INDIRECT(ADDRESS(RC1,1,3,1,Menus!R10C11)) -> 0 | G434: =IF(INDIRECT(ADDRESS(RC1,2,3,1,Menus!R10C11))=R1C,RC4,NA()) -> NA() | H434: =IF(INDIRECT(ADDRESS(RC1,2,3,1,Menus!R10C11))=R1C,RC4,NA()) -> NA() | I434: =IF(INDIRECT(ADDRESS(RC1,2,3,1,Menus!R10C11))=R1C,RC4,NA()) -> NA() | J434: =IF(INDIRECT(ADDRESS(RC1,1,3,1,Menus!R10C11))=T(R1C),RC4,NA()) -> NA() | K434: =IF(OR(ISNUMBER(RC7),ISNUMBER(RC8),ISNUMBER(RC9),ISNUMBER(RC10)),1,0) -> 0 | M434: =OFFSET(INDIRECT(ADDRESS(RC1,3,3,1,"Gross")),0,Menus!R4C10) -> 0 | N434: =OFFSET(INDIRECT(ADDRESS(RC1,3,3,1,"Gross")),0,Menus!R3C10) -> 0
A435: 472 | B435: =OFFSET(INDIRECT(ADDRESS(RC1,3,3,1,Menus!R10C11)),0,Menus!R4C10) -> 0 | C435: =OFFSET(INDIRECT(ADDRESS(RC1,3,3,1,Menus!R10C11)),0,Menus!R3C10) -> 0 | D435: =IF(Menus!R9C10,RC[-1]/RC[-2],RC[-1]) -> #DIV/0! | E435: =IF(RC11=1,VALUE(RC[-3]),NA()) -> NA() | F435: =INDIRECT(ADDRESS(RC1,1,3,1,Menus!R10C11)) -> 0 | G435: =IF(INDIRECT(ADDRESS(RC1,2,3,1,Menus!R10C11))=R1C,RC4,NA()) -> NA() | H435: =IF(INDIRECT(ADDRESS(RC1,2,3,1,Menus!R10C11))=R1C,RC4,NA()) -> NA() | I435: =IF(INDIRECT(ADDRESS(RC1,2,3,1,Menus!R10C11))=R1C,RC4,NA()) -> NA() | J435: =IF(INDIRECT(ADDRESS(RC1,1,3,1,Menus!R10C11))=T(R1C),RC4,NA()) -> NA() | K435: =IF(OR(ISNUMBER(RC7),ISNUMBER(RC8),ISNUMBER(RC9),ISNUMBER(RC10)),1,0) -> 0 | M435: =OFFSET(INDIRECT(ADDRESS(RC1,3,3,1,"Gross")),0,Menus!R4C10) -> 0 | N435: =OFFSET(INDIRECT(ADDRESS(RC1,3,3,1,"Gross")),0,Menus!R3C10) -> 0
A436: 473 | B436: =OFFSET(INDIRECT(ADDRESS(RC1,3,3,1,Menus!R10C11)),0,Menus!R4C10) -> 0 | C436: =OFFSET(INDIRECT(ADDRESS(RC1,3,3,1,Menus!R10C11)),0,Menus!R3C10) -> 0 | D436: =IF(Menus!R9C10,RC[-1]/RC[-2],RC[-1]) -> #DIV/0! | E436: =IF(RC11=1,VALUE(RC[-3]),NA()) -> NA() | F436: =INDIRECT(ADDRESS(RC1,1,3,1,Menus!R10C11)) -> 0 | G436: =IF(INDIRECT(ADDRESS(RC1,2,3,1,Menus!R10C11))=R1C,RC4,NA()) -> NA() | H436: =IF(INDIRECT(ADDRESS(RC1,2,3,1,Menus!R10C11))=R1C,RC4,NA()) -> NA() | I436: =IF(INDIRECT(ADDRESS(RC1,2,3,1,Menus!R10C11))=R1C,RC4,NA()) -> NA() | J436: =IF(INDIRECT(ADDRESS(RC1,1,3,1,Menus!R10C11))=T(R1C),RC4,NA()) -> NA() | K436: =IF(OR(ISNUMBER(RC7),ISNUMBER(RC8),ISNUMBER(RC9),ISNUMBER(RC10)),1,0) -> 0 | M436: =OFFSET(INDIRECT(ADDRESS(RC1,3,3,1,"Gross")),0,Menus!R4C10) -> 0 | N436: =OFFSET(INDIRECT(ADDRESS(RC1,3,3,1,"Gross")),0,Menus!R3C10) -> 0
A437: 474 | B437: =OFFSET(INDIRECT(ADDRESS(RC1,3,3,1,Menus!R10C11)),0,Menus!R4C10) -> 0 | C437: =OFFSET(INDIRECT(ADDRESS(RC1,3,3,1,Menus!R10C11)),0,Menus!R3C10) -> 0 | D437: =IF(Menus!R9C10,RC[-1]/RC[-2],RC[-1]) -> #DIV/0! | E437: =IF(RC11=1,VALUE(RC[-3]),NA()) -> NA() | F437: =INDIRECT(ADDRESS(RC1,1,3,1,Menus!R10C11)) -> 0 | G437: =IF(INDIRECT(ADDRESS(RC1,2,3,1,Menus!R10C11))=R1C,RC4,NA()) -> NA() | H437: =IF(INDIRECT(ADDRESS(RC1,2,3,1,Menus!R10C11))=R1C,RC4,NA()) -> NA() | I437: =IF(INDIRECT(ADDRESS(RC1,2,3,1,Menus!R10C11))=R1C,RC4,NA()) -> NA() | J437: =IF(INDIRECT(ADDRESS(RC1,1,3,1,Menus!R10C11))=T(R1C),RC4,NA()) -> NA() | K437: =IF(OR(ISNUMBER(RC7),ISNUMBER(RC8),ISNUMBER(RC9),ISNUMBER(RC10)),1,0) -> 0 | M437: =OFFSET(INDIRECT(ADDRESS(RC1,3,3,1,"Gross")),0,Menus!R4C10) -> 0 | N437: =OFFSET(INDIRECT(ADDRESS(RC1,3,3,1,"Gross")),0,Menus!R3C10) -> 0
A438: 475 | B438: =OFFSET(INDIRECT(ADDRESS(RC1,3,3,1,Menus!R10C11)),0,Menus!R4C10) -> 0 | C438: =OFFSET(INDIRECT(ADDRESS(RC1,3,3,1,Menus!R10C11)),0,Menus!R3C10) -> 0 | D438: =IF(Menus!R9C10,RC[-1]/RC[-2],RC[-1]) -> #DIV/0! | E438: =IF(RC11=1,VALUE(RC[-3]),NA()) -> NA() | F438: =INDIRECT(ADDRESS(RC1,1,3,1,Menus!R10C11)) -> 0 | G438: =IF(INDIRECT(ADDRESS(RC1,2,3,1,Menus!R10C11))=R1C,RC4,NA()) -> NA() | H438: =IF(INDIRECT(ADDRESS(RC1,2,3,1,Menus!R10C11))=R1C,RC4,NA()) -> NA() | I438: =IF(INDIRECT(ADDRESS(RC1,2,3,1,Menus!R10C11))=R1C,RC4,NA()) -> NA() | J438: =IF(INDIRECT(ADDRESS(RC1,1,3,1,Menus!R10C11))=T(R1C),RC4,NA()) -> NA() | K438: =IF(OR(ISNUMBER(RC7),ISNUMBER(RC8),ISNUMBER(RC9),ISNUMBER(RC10)),1,0) -> 0 | M438: =OFFSET(INDIRECT(ADDRESS(RC1,3,3,1,"Gross")),0,Menus!R4C10) -> 0 | N438: =OFFSET(INDIRECT(ADDRESS(RC1,3,3,1,"Gross")),0,Menus!R3C10) -> 0
A439: 476 | B439: =OFFSET(INDIRECT(ADDRESS(RC1,3,3,1,Menus!R10C11)),0,Menus!R4C10) -> 0 | C439: =OFFSET(INDIRECT(ADDRESS(RC1,3,3,1,Menus!R10C11)),0,Menus!R3C10) -> 0 | D439: =IF(Menus!R9C10,RC[-1]/RC[-2],RC[-1]) -> #DIV/0! | E439: =IF(RC11=1,VALUE(RC[-3]),NA()) -> NA() | F439: =INDIRECT(ADDRESS(RC1,1,3,1,Menus!R10C11)) -> 0 | G439: =IF(INDIRECT(ADDRESS(RC1,2,3,1,Menus!R10C11))=R1C,RC4,NA()) -> NA() | H439: =IF(INDIRECT(ADDRESS(RC1,2,3,1,Menus!R10C11))=R1C,RC4,NA()) -> NA() | I439: =IF(INDIRECT(ADDRESS(RC1,2,3,1,Menus!R10C11))=R1C,RC4,NA()) -> NA() | J439: =IF(INDIRECT(ADDRESS(RC1,1,3,1,Menus!R10C11))=T(R1C),RC4,NA()) -> NA() | K439: =IF(OR(ISNUMBER(RC7),ISNUMBER(RC8),ISNUMBER(RC9),ISNUMBER(RC10)),1,0) -> 0 | M439: =OFFSET(INDIRECT(ADDRESS(RC1,3,3,1,"Gross")),0,Menus!R4C10) -> 0 | N439: =OFFSET(INDIRECT(ADDRESS(RC1,3,3,1,"Gross")),0,Menus!R3C10) -> 0
A440: 477 | B440: =OFFSET(INDIRECT(ADDRESS(RC1,3,3,1,Menus!R10C11)),0,Menus!R4C10) -> 0 | C440: =OFFSET(INDIRECT(ADDRESS(RC1,3,3,1,Menus!R10C11)),0,Menus!R3C10) -> 0 | D440: =IF(Menus!R9C10,RC[-1]/RC[-2],RC[-1]) -> #DIV/0! | E440: =IF(RC11=1,VALUE(RC[-3]),NA()) -> NA() | F440: =INDIRECT(ADDRESS(RC1,1,3,1,Menus!R10C11)) -> 0 | G440: =IF(INDIRECT(ADDRESS(RC1,2,3,1,Menus!R10C11))=R1C,RC4,NA()) -> NA() | H440: =IF(INDIRECT(ADDRESS(RC1,2,3,1,Menus!R10C11))=R1C,RC4,NA()) -> NA() | I440: =IF(INDIRECT(ADDRESS(RC1,2,3,1,Menus!R10C11))=R1C,RC4,NA()) -> NA() | J440: =IF(INDIRECT(ADDRESS(RC1,1,3,1,Menus!R10C11))=T(R1C),RC4,NA()) -> NA() | K440: =IF(OR(ISNUMBER(RC7),ISNUMBER(RC8),ISNUMBER(RC9),ISNUMBER(RC10)),1,0) -> 0 | M440: =OFFSET(INDIRECT(ADDRESS(RC1,3,3,1,"Gross")),0,Menus!R4C10) -> 0 | N440: =OFFSET(INDIRECT(ADDRESS(RC1,3,3,1,"Gross")),0,Menus!R3C10) -> 0
A441: 478 | B441: =OFFSET(INDIRECT(ADDRESS(RC1,3,3,1,Menus!R10C11)),0,Menus!R4C10) -> 0 | C441: =OFFSET(INDIRECT(ADDRESS(RC1,3,3,1,Menus!R10C11)),0,Menus!R3C10) -> 0 | D441: =IF(Menus!R9C10,RC[-1]/RC[-2],RC[-1]) -> #DIV/0! | E441: =IF(RC11=1,VALUE(RC[-3]),NA()) -> NA() | F441: =INDIRECT(ADDRESS(RC1,1,3,1,Menus!R10C11)) -> 0 | G441: =IF(INDIRECT(ADDRESS(RC1,2,3,1,Menus!R10C11))=R1C,RC4,NA()) -> NA() | H441: =IF(INDIRECT(ADDRESS(RC1,2,3,1,Menus!R10C11))=R1C,RC4,NA()) -> NA() | I441: =IF(INDIRECT(ADDRESS(RC1,2,3,1,Menus!R10C11))=R1C,RC4,NA()) -> NA() | J441: =IF(INDIRECT(ADDRESS(RC1,1,3,1,Menus!R10C11))=T(R1C),RC4,NA()) -> NA() | K441: =IF(OR(ISNUMBER(RC7),ISNUMBER(RC8),ISNUMBER(RC9),ISNUMBER(RC10)),1,0) -> 0 | M441: =OFFSET(INDIRECT(ADDRESS(RC1,3,3,1,"Gross")),0,Menus!R4C10) -> 0 | N441: =OFFSET(INDIRECT(ADDRESS(RC1,3,3,1,"Gross")),0,Menus!R3C10) -> 0
A442: 479 | B442: =OFFSET(INDIRECT(ADDRESS(RC1,3,3,1,Menus!R10C11)),0,Menus!R4C10) -> 0 | C442: =OFFSET(INDIRECT(ADDRESS(RC1,3,3,1,Menus!R10C11)),0,Menus!R3C10) -> 0 | D442: =IF(Menus!R9C10,RC[-1]/RC[-2],RC[-1]) -> #DIV/0! | E442: =IF(RC11=1,VALUE(RC[-3]),NA()) -> NA() | F442: =INDIRECT(ADDRESS(RC1,1,3,1,Menus!R10C11)) -> 0 | G442: =IF(INDIRECT(ADDRESS(RC1,2,3,1,Menus!R10C11))=R1C,RC4,NA()) -> NA() | H442: =IF(INDIRECT(ADDRESS(RC1,2,3,1,Menus!R10C11))=R1C,RC4,NA()) -> NA() | I442: =IF(INDIRECT(ADDRESS(RC1,2,3,1,Menus!R10C11))=R1C,RC4,NA()) -> NA() | J442: =IF(INDIRECT(ADDRESS(RC1,1,3,1,Menus!R10C11))=T(R1C),RC4,NA()) -> NA() | K442: =IF(OR(ISNUMBER(RC7),ISNUMBER(RC8),ISNUMBER(RC9),ISNUMBER(RC10)),1,0) -> 0 | M442: =OFFSET(INDIRECT(ADDRESS(RC1,3,3,1,"Gross")),0,Menus!R4C10) -> 0 | N442: =OFFSET(INDIRECT(ADDRESS(RC1,3,3,1,"Gross")),0,Menus!R3C10) -> 0
A443: 480 | B443: =OFFSET(INDIRECT(ADDRESS(RC1,3,3,1,Menus!R10C11)),0,Menus!R4C10) -> 0 | C443: =OFFSET(INDIRECT(ADDRESS(RC1,3,3,1,Menus!R10C11)),0,Menus!R3C10) -> 0 | D443: =IF(Menus!R9C10,RC[-1]/RC[-2],RC[-1]) -> #DIV/0! | E443: =IF(RC11=1,VALUE(RC[-3]),NA()) -> NA() | F443: =INDIRECT(ADDRESS(RC1,1,3,1,Menus!R10C11)) -> 0 | G443: =IF(INDIRECT(ADDRESS(RC1,2,3,1,Menus!R10C11))=R1C,RC4,NA()) -> NA() | H443: =IF(INDIRECT(ADDRESS(RC1,2,3,1,Menus!R10C11))=R1C,RC4,NA()) -> NA() | I443: =IF(INDIRECT(ADDRESS(RC1,2,3,1,Menus!R10C11))=R1C,RC4,NA()) -> NA() | J443: =IF(INDIRECT(ADDRESS(RC1,1,3,1,Menus!R10C11))=T(R1C),RC4,NA()) -> NA() | K443: =IF(OR(ISNUMBER(RC7),ISNUMBER(RC8),ISNUMBER(RC9),ISNUMBER(RC10)),1,0) -> 0 | M443: =OFFSET(INDIRECT(ADDRESS(RC1,3,3,1,"Gross")),0,Menus!R4C10) -> 0 | N443: =OFFSET(INDIRECT(ADDRESS(RC1,3,3,1,"Gross")),0,Menus!R3C10) -> 0
A444: 481 | B444: =OFFSET(INDIRECT(ADDRESS(RC1,3,3,1,Menus!R10C11)),0,Menus!R4C10) -> 0 | C444: =OFFSET(INDIRECT(ADDRESS(RC1,3,3,1,Menus!R10C11)),0,Menus!R3C10) -> 0 | D444: =IF(Menus!R9C10,RC[-1]/RC[-2],RC[-1]) -> #DIV/0! | E444: =IF(RC11=1,VALUE(RC[-3]),NA()) -> NA() | F444: =INDIRECT(ADDRESS(RC1,1,3,1,Menus!R10C11)) -> 0 | G444: =IF(INDIRECT(ADDRESS(RC1,2,3,1,Menus!R10C11))=R1C,RC4,NA()) -> NA() | H444: =IF(INDIRECT(ADDRESS(RC1,2,3,1,Menus!R10C11))=R1C,RC4,NA()) -> NA() | I444: =IF(INDIRECT(ADDRESS(RC1,2,3,1,Menus!R10C11))=R1C,RC4,NA()) -> NA() | J444: =IF(INDIRECT(ADDRESS(RC1,1,3,1,Menus!R10C11))=T(R1C),RC4,NA()) -> NA() | K444: =IF(OR(ISNUMBER(RC7),ISNUMBER(RC8),ISNUMBER(RC9),ISNUMBER(RC10)),1,0) -> 0 | M444: =OFFSET(INDIRECT(ADDRESS(RC1,3,3,1,"Gross")),0,Menus!R4C10) -> 0 | N444: =OFFSET(INDIRECT(ADDRESS(RC1,3,3,1,"Gross")),0,Menus!R3C10) -> 0
A445: 482 | B445: =OFFSET(INDIRECT(ADDRESS(RC1,3,3,1,Menus!R10C11)),0,Menus!R4C10) -> 0 | C445: =OFFSET(INDIRECT(ADDRESS(RC1,3,3,1,Menus!R10C11)),0,Menus!R3C10) -> 0 | D445: =IF(Menus!R9C10,RC[-1]/RC[-2],RC[-1]) -> #DIV/0! | E445: =IF(RC11=1,VALUE(RC[-3]),NA()) -> NA() | F445: =INDIRECT(ADDRESS(RC1,1,3,1,Menus!R10C11)) -> 0 | G445: =IF(INDIRECT(ADDRESS(RC1,2,3,1,Menus!R10C11))=R1C,RC4,NA()) -> NA() | H445: =IF(INDIRECT(ADDRESS(RC1,2,3,1,Menus!R10C11))=R1C,RC4,NA()) -> NA() | I445: =IF(INDIRECT(ADDRESS(RC1,2,3,1,Menus!R10C11))=R1C,RC4,NA()) -> NA() | J445: =IF(INDIRECT(ADDRESS(RC1,1,3,1,Menus!R10C11))=T(R1C),RC4,NA()) -> NA() | K445: =IF(OR(ISNUMBER(RC7),ISNUMBER(RC8),ISNUMBER(RC9),ISNUMBER(RC10)),1,0) -> 0 | M445: =OFFSET(INDIRECT(ADDRESS(RC1,3,3,1,"Gross")),0,Menus!R4C10) -> 0 | N445: =OFFSET(INDIRECT(ADDRESS(RC1,3,3,1,"Gross")),0,Menus!R3C10) -> 0
A446: 483 | B446: =OFFSET(INDIRECT(ADDRESS(RC1,3,3,1,Menus!R10C11)),0,Menus!R4C10) -> 0 | C446: =OFFSET(INDIRECT(ADDRESS(RC1,3,3,1,Menus!R10C11)),0,Menus!R3C10) -> 0 | D446: =IF(Menus!R9C10,RC[-1]/RC[-2],RC[-1]) -> #DIV/0! | E446: =IF(RC11=1,VALUE(RC[-3]),NA()) -> NA() | F446: =INDIRECT(ADDRESS(RC1,1,3,1,Menus!R10C11)) -> 0 | G446: =IF(INDIRECT(ADDRESS(RC1,2,3,1,Menus!R10C11))=R1C,RC4,NA()) -> NA() | H446: =IF(INDIRECT(ADDRESS(RC1,2,3,1,Menus!R10C11))=R1C,RC4,NA()) -> NA() | I446: =IF(INDIRECT(ADDRESS(RC1,2,3,1,Menus!R10C11))=R1C,RC4,NA()) -> NA() | J446: =IF(INDIRECT(ADDRESS(RC1,1,3,1,Menus!R10C11))=T(R1C),RC4,NA()) -> NA() | K446: =IF(OR(ISNUMBER(RC7),ISNUMBER(RC8),ISNUMBER(RC9),ISNUMBER(RC10)),1,0) -> 0 | M446: =OFFSET(INDIRECT(ADDRESS(RC1,3,3,1,"Gross")),0,Menus!R4C10) -> 0 | N446: =OFFSET(INDIRECT(ADDRESS(RC1,3,3,1,"Gross")),0,Menus!R3C10) -> 0
A447: 484 | B447: =OFFSET(INDIRECT(ADDRESS(RC1,3,3,1,Menus!R10C11)),0,Menus!R4C10) -> 0 | C447: =OFFSET(INDIRECT(ADDRESS(RC1,3,3,1,Menus!R10C11)),0,Menus!R3C10) -> 0 | D447: =IF(Menus!R9C10,RC[-1]/RC[-2],RC[-1]) -> #DIV/0! | E447: =IF(RC11=1,VALUE(RC[-3]),NA()) -> NA() | F447: =INDIRECT(ADDRESS(RC1,1,3,1,Menus!R10C11)) -> 0 | G447: =IF(INDIRECT(ADDRESS(RC1,2,3,1,Menus!R10C11))=R1C,RC4,NA()) -> NA() | H447: =IF(INDIRECT(ADDRESS(RC1,2,3,1,Menus!R10C11))=R1C,RC4,NA()) -> NA() | I447: =IF(INDIRECT(ADDRESS(RC1,2,3,1,Menus!R10C11))=R1C,RC4,NA()) -> NA() | J447: =IF(INDIRECT(ADDRESS(RC1,1,3,1,Menus!R10C11))=T(R1C),RC4,NA()) -> NA() | K447: =IF(OR(ISNUMBER(RC7),ISNUMBER(RC8),ISNUMBER(RC9),ISNUMBER(RC10)),1,0) -> 0 | M447: =OFFSET(INDIRECT(ADDRESS(RC1,3,3,1,"Gross")),0,Menus!R4C10) -> 0 | N447: =OFFSET(INDIRECT(ADDRESS(RC1,3,3,1,"Gross")),0,Menus!R3C10) -> 0
A448: 485 | B448: =OFFSET(INDIRECT(ADDRESS(RC1,3,3,1,Menus!R10C11)),0,Menus!R4C10) -> 0 | C448: =OFFSET(INDIRECT(ADDRESS(RC1,3,3,1,Menus!R10C11)),0,Menus!R3C10) -> 0 | D448: =IF(Menus!R9C10,RC[-1]/RC[-2],RC[-1]) -> #DIV/0! | E448: =IF(RC11=1,VALUE(RC[-3]),NA()) -> NA() | F448: =INDIRECT(ADDRESS(RC1,1,3,1,Menus!R10C11)) -> 0 | G448: =IF(INDIRECT(ADDRESS(RC1,2,3,1,Menus!R10C11))=R1C,RC4,NA()) -> NA() | H448: =IF(INDIRECT(ADDRESS(RC1,2,3,1,Menus!R10C11))=R1C,RC4,NA()) -> NA() | I448: =IF(INDIRECT(ADDRESS(RC1,2,3,1,Menus!R10C11))=R1C,RC4,NA()) -> NA() | J448: =IF(INDIRECT(ADDRESS(RC1,1,3,1,Menus!R10C11))=T(R1C),RC4,NA()) -> NA() | K448: =IF(OR(ISNUMBER(RC7),ISNUMBER(RC8),ISNUMBER(RC9),ISNUMBER(RC10)),1,0) -> 0 | M448: =OFFSET(INDIRECT(ADDRESS(RC1,3,3,1,"Gross")),0,Menus!R4C10) -> 0 | N448: =OFFSET(INDIRECT(ADDRESS(RC1,3,3,1,"Gross")),0,Menus!R3C10) -> 0
A449: 486 | B449: =OFFSET(INDIRECT(ADDRESS(RC1,3,3,1,Menus!R10C11)),0,Menus!R4C10) -> 0 | C449: =OFFSET(INDIRECT(ADDRESS(RC1,3,3,1,Menus!R10C11)),0,Menus!R3C10) -> 0 | D449: =IF(Menus!R9C10,RC[-1]/RC[-2],RC[-1]) -> #DIV/0! | E449: =IF(RC11=1,VALUE(RC[-3]),NA()) -> NA() | F449: =INDIRECT(ADDRESS(RC1,1,3,1,Menus!R10C11)) -> 0 | G449: =IF(INDIRECT(ADDRESS(RC1,2,3,1,Menus!R10C11))=R1C,RC4,NA()) -> NA() | H449: =IF(INDIRECT(ADDRESS(RC1,2,3,1,Menus!R10C11))=R1C,RC4,NA()) -> NA() | I449: =IF(INDIRECT(ADDRESS(RC1,2,3,1,Menus!R10C11))=R1C,RC4,NA()) -> NA() | J449: =IF(INDIRECT(ADDRESS(RC1,1,3,1,Menus!R10C11))=T(R1C),RC4,NA()) -> NA() | K449: =IF(OR(ISNUMBER(RC7),ISNUMBER(RC8),ISNUMBER(RC9),ISNUMBER(RC10)),1,0) -> 0 | M449: =OFFSET(INDIRECT(ADDRESS(RC1,3,3,1,"Gross")),0,Menus!R4C10) -> 0 | N449: =OFFSET(INDIRECT(ADDRESS(RC1,3,3,1,"Gross")),0,Menus!R3C10) -> 0
A450: 487 | B450: =OFFSET(INDIRECT(ADDRESS(RC1,3,3,1,Menus!R10C11)),0,Menus!R4C10) -> 0 | C450: =OFFSET(INDIRECT(ADDRESS(RC1,3,3,1,Menus!R10C11)),0,Menus!R3C10) -> 0 | D450: =IF(Menus!R9C10,RC[-1]/RC[-2],RC[-1]) -> #DIV/0! | E450: =IF(RC11=1,VALUE(RC[-3]),NA()) -> NA() | F450: =INDIRECT(ADDRESS(RC1,1,3,1,Menus!R10C11)) -> 0 | G450: =IF(INDIRECT(ADDRESS(RC1,2,3,1,Menus!R10C11))=R1C,RC4,NA()) -> NA() | H450: =IF(INDIRECT(ADDRESS(RC1,2,3,1,Menus!R10C11))=R1C,RC4,NA()) -> NA() | I450: =IF(INDIRECT(ADDRESS(RC1,2,3,1,Menus!R10C11))=R1C,RC4,NA()) -> NA() | J450: =IF(INDIRECT(ADDRESS(RC1,1,3,1,Menus!R10C11))=T(R1C),RC4,NA()) -> NA() | K450: =IF(OR(ISNUMBER(RC7),ISNUMBER(RC8),ISNUMBER(RC9),ISNUMBER(RC10)),1,0) -> 0 | M450: =OFFSET(INDIRECT(ADDRESS(RC1,3,3,1,"Gross")),0,Menus!R4C10) -> 0 | N450: =OFFSET(INDIRECT(ADDRESS(RC1,3,3,1,"Gross")),0,Menus!R3C10) -> 0
A451: 488 | B451: =OFFSET(INDIRECT(ADDRESS(RC1,3,3,1,Menus!R10C11)),0,Menus!R4C10) -> 0 | C451: =OFFSET(INDIRECT(ADDRESS(RC1,3,3,1,Menus!R10C11)),0,Menus!R3C10) -> 0 | D451: =IF(Menus!R9C10,RC[-1]/RC[-2],RC[-1]) -> #DIV/0! | E451: =IF(RC11=1,VALUE(RC[-3]),NA()) -> NA() | F451: =INDIRECT(ADDRESS(RC1,1,3,1,Menus!R10C11)) -> 0 | G451: =IF(INDIRECT(ADDRESS(RC1,2,3,1,Menus!R10C11))=R1C,RC4,NA()) -> NA() | H451: =IF(INDIRECT(ADDRESS(RC1,2,3,1,Menus!R10C11))=R1C,RC4,NA()) -> NA() | I451: =IF(INDIRECT(ADDRESS(RC1,2,3,1,Menus!R10C11))=R1C,RC4,NA()) -> NA() | J451: =IF(INDIRECT(ADDRESS(RC1,1,3,1,Menus!R10C11))=T(R1C),RC4,NA()) -> NA() | K451: =IF(OR(ISNUMBER(RC7),ISNUMBER(RC8),ISNUMBER(RC9),ISNUMBER(RC10)),1,0) -> 0 | M451: =OFFSET(INDIRECT(ADDRESS(RC1,3,3,1,"Gross")),0,Menus!R4C10) -> 0 | N451: =OFFSET(INDIRECT(ADDRESS(RC1,3,3,1,"Gross")),0,Menus!R3C10) -> 0
A452: 489 | B452: =OFFSET(INDIRECT(ADDRESS(RC1,3,3,1,Menus!R10C11)),0,Menus!R4C10) -> 0 | C452: =OFFSET(INDIRECT(ADDRESS(RC1,3,3,1,Menus!R10C11)),0,Menus!R3C10) -> 0 | D452: =IF(Menus!R9C10,RC[-1]/RC[-2],RC[-1]) -> #DIV/0! | E452: =IF(RC11=1,VALUE(RC[-3]),NA()) -> NA() | F452: =INDIRECT(ADDRESS(RC1,1,3,1,Menus!R10C11)) -> 0 | G452: =IF(INDIRECT(ADDRESS(RC1,2,3,1,Menus!R10C11))=R1C,RC4,NA()) -> NA() | H452: =IF(INDIRECT(ADDRESS(RC1,2,3,1,Menus!R10C11))=R1C,RC4,NA()) -> NA() | I452: =IF(INDIRECT(ADDRESS(RC1,2,3,1,Menus!R10C11))=R1C,RC4,NA()) -> NA() | J452: =IF(INDIRECT(ADDRESS(RC1,1,3,1,Menus!R10C11))=T(R1C),RC4,NA()) -> NA() | K452: =IF(OR(ISNUMBER(RC7),ISNUMBER(RC8),ISNUMBER(RC9),ISNUMBER(RC10)),1,0) -> 0 | M452: =OFFSET(INDIRECT(ADDRESS(RC1,3,3,1,"Gross")),0,Menus!R4C10) -> 0 | N452: =OFFSET(INDIRECT(ADDRESS(RC1,3,3,1,"Gross")),0,Menus!R3C10) -> 0
A453: 490 | B453: =OFFSET(INDIRECT(ADDRESS(RC1,3,3,1,Menus!R10C11)),0,Menus!R4C10) -> 0 | C453: =OFFSET(INDIRECT(ADDRESS(RC1,3,3,1,Menus!R10C11)),0,Menus!R3C10) -> 0 | D453: =IF(Menus!R9C10,RC[-1]/RC[-2],RC[-1]) -> #DIV/0! | E453: =IF(RC11=1,VALUE(RC[-3]),NA()) -> NA() | F453: =INDIRECT(ADDRESS(RC1,1,3,1,Menus!R10C11)) -> 0 | G453: =IF(INDIRECT(ADDRESS(RC1,2,3,1,Menus!R10C11))=R1C,RC4,NA()) -> NA() | H453: =IF(INDIRECT(ADDRESS(RC1,2,3,1,Menus!R10C11))=R1C,RC4,NA()) -> NA() | I453: =IF(INDIRECT(ADDRESS(RC1,2,3,1,Menus!R10C11))=R1C,RC4,NA()) -> NA() | J453: =IF(INDIRECT(ADDRESS(RC1,1,3,1,Menus!R10C11))=T(R1C),RC4,NA()) -> NA() | K453: =IF(OR(ISNUMBER(RC7),ISNUMBER(RC8),ISNUMBER(RC9),ISNUMBER(RC10)),1,0) -> 0 | M453: =OFFSET(INDIRECT(ADDRESS(RC1,3,3,1,"Gross")),0,Menus!R4C10) -> 0 | N453: =OFFSET(INDIRECT(ADDRESS(RC1,3,3,1,"Gross")),0,Menus!R3C10) -> 0
A454: 491 | B454: =OFFSET(INDIRECT(ADDRESS(RC1,3,3,1,Menus!R10C11)),0,Menus!R4C10) -> 0 | C454: =OFFSET(INDIRECT(ADDRESS(RC1,3,3,1,Menus!R10C11)),0,Menus!R3C10) -> 0 | D454: =IF(Menus!R9C10,RC[-1]/RC[-2],RC[-1]) -> #DIV/0! | E454: =IF(RC11=1,VALUE(RC[-3]),NA()) -> NA() | F454: =INDIRECT(ADDRESS(RC1,1,3,1,Menus!R10C11)) -> 0 | G454: =IF(INDIRECT(ADDRESS(RC1,2,3,1,Menus!R10C11))=R1C,RC4,NA()) -> NA() | H454: =IF(INDIRECT(ADDRESS(RC1,2,3,1,Menus!R10C11))=R1C,RC4,NA()) -> NA() | I454: =IF(INDIRECT(ADDRESS(RC1,2,3,1,Menus!R10C11))=R1C,RC4,NA()) -> NA() | J454: =IF(INDIRECT(ADDRESS(RC1,1,3,1,Menus!R10C11))=T(R1C),RC4,NA()) -> NA() | K454: =IF(OR(ISNUMBER(RC7),ISNUMBER(RC8),ISNUMBER(RC9),ISNUMBER(RC10)),1,0) -> 0 | M454: =OFFSET(INDIRECT(ADDRESS(RC1,3,3,1,"Gross")),0,Menus!R4C10) -> 0 | N454: =OFFSET(INDIRECT(ADDRESS(RC1,3,3,1,"Gross")),0,Menus!R3C10) -> 0
A455: 492 | B455: =OFFSET(INDIRECT(ADDRESS(RC1,3,3,1,Menus!R10C11)),0,Menus!R4C10) -> 0 | C455: =OFFSET(INDIRECT(ADDRESS(RC1,3,3,1,Menus!R10C11)),0,Menus!R3C10) -> 0 | D455: =IF(Menus!R9C10,RC[-1]/RC[-2],RC[-1]) -> #DIV/0! | E455: =IF(RC11=1,VALUE(RC[-3]),NA()) -> NA() | F455: =INDIRECT(ADDRESS(RC1,1,3,1,Menus!R10C11)) -> 0 | G455: =IF(INDIRECT(ADDRESS(RC1,2,3,1,Menus!R10C11))=R1C,RC4,NA()) -> NA() | H455: =IF(INDIRECT(ADDRESS(RC1,2,3,1,Menus!R10C11))=R1C,RC4,NA()) -> NA() | I455: =IF(INDIRECT(ADDRESS(RC1,2,3,1,Menus!R10C11))=R1C,RC4,NA()) -> NA() | J455: =IF(INDIRECT(ADDRESS(RC1,1,3,1,Menus!R10C11))=T(R1C),RC4,NA()) -> NA() | K455: =IF(OR(ISNUMBER(RC7),ISNUMBER(RC8),ISNUMBER(RC9),ISNUMBER(RC10)),1,0) -> 0 | M455: =OFFSET(INDIRECT(ADDRESS(RC1,3,3,1,"Gross")),0,Menus!R4C10) -> 0 | N455: =OFFSET(INDIRECT(ADDRESS(RC1,3,3,1,"Gross")),0,Menus!R3C10) -> 0
A456: 493 | B456: =OFFSET(INDIRECT(ADDRESS(RC1,3,3,1,Menus!R10C11)),0,Menus!R4C10) -> 0 | C456: =OFFSET(INDIRECT(ADDRESS(RC1,3,3,1,Menus!R10C11)),0,Menus!R3C10) -> 0 | D456: =IF(Menus!R9C10,RC[-1]/RC[-2],RC[-1]) -> #DIV/0! | E456: =IF(RC11=1,VALUE(RC[-3]),NA()) -> NA() | F456: =INDIRECT(ADDRESS(RC1,1,3,1,Menus!R10C11)) -> 0 | G456: =IF(INDIRECT(ADDRESS(RC1,2,3,1,Menus!R10C11))=R1C,RC4,NA()) -> NA() | H456: =IF(INDIRECT(ADDRESS(RC1,2,3,1,Menus!R10C11))=R1C,RC4,NA()) -> NA() | I456: =IF(INDIRECT(ADDRESS(RC1,2,3,1,Menus!R10C11))=R1C,RC4,NA()) -> NA() | J456: =IF(INDIRECT(ADDRESS(RC1,1,3,1,Menus!R10C11))=T(R1C),RC4,NA()) -> NA() | K456: =IF(OR(ISNUMBER(RC7),ISNUMBER(RC8),ISNUMBER(RC9),ISNUMBER(RC10)),1,0) -> 0 | M456: =OFFSET(INDIRECT(ADDRESS(RC1,3,3,1,"Gross")),0,Menus!R4C10) -> 0 | N456: =OFFSET(INDIRECT(ADDRESS(RC1,3,3,1,"Gross")),0,Menus!R3C10) -> 0
A457: 494 | B457: =OFFSET(INDIRECT(ADDRESS(RC1,3,3,1,Menus!R10C11)),0,Menus!R4C10) -> 0 | C457: =OFFSET(INDIRECT(ADDRESS(RC1,3,3,1,Menus!R10C11)),0,Menus!R3C10) -> 0 | D457: =IF(Menus!R9C10,RC[-1]/RC[-2],RC[-1]) -> #DIV/0! | E457: =IF(RC11=1,VALUE(RC[-3]),NA()) -> NA() | F457: =INDIRECT(ADDRESS(RC1,1,3,1,Menus!R10C11)) -> 0 | G457: =IF(INDIRECT(ADDRESS(RC1,2,3,1,Menus!R10C11))=R1C,RC4,NA()) -> NA() | H457: =IF(INDIRECT(ADDRESS(RC1,2,3,1,Menus!R10C11))=R1C,RC4,NA()) -> NA() | I457: =IF(INDIRECT(ADDRESS(RC1,2,3,1,Menus!R10C11))=R1C,RC4,NA()) -> NA() | J457: =IF(INDIRECT(ADDRESS(RC1,1,3,1,Menus!R10C11))=T(R1C),RC4,NA()) -> NA() | K457: =IF(OR(ISNUMBER(RC7),ISNUMBER(RC8),ISNUMBER(RC9),ISNUMBER(RC10)),1,0) -> 0 | M457: =OFFSET(INDIRECT(ADDRESS(RC1,3,3,1,"Gross")),0,Menus!R4C10) -> 0 | N457: =OFFSET(INDIRECT(ADDRESS(RC1,3,3,1,"Gross")),0,Menus!R3C10) -> 0
A458: 495 | B458: =OFFSET(INDIRECT(ADDRESS(RC1,3,3,1,Menus!R10C11)),0,Menus!R4C10) -> 0 | C458: =OFFSET(INDIRECT(ADDRESS(RC1,3,3,1,Menus!R10C11)),0,Menus!R3C10) -> 0 | D458: =IF(Menus!R9C10,RC[-1]/RC[-2],RC[-1]) -> #DIV/0! | E458: =IF(RC11=1,VALUE(RC[-3]),NA()) -> NA() | F458: =INDIRECT(ADDRESS(RC1,1,3,1,Menus!R10C11)) -> 0 | G458: =IF(INDIRECT(ADDRESS(RC1,2,3,1,Menus!R10C11))=R1C,RC4,NA()) -> NA() | H458: =IF(INDIRECT(ADDRESS(RC1,2,3,1,Menus!R10C11))=R1C,RC4,NA()) -> NA() | I458: =IF(INDIRECT(ADDRESS(RC1,2,3,1,Menus!R10C11))=R1C,RC4,NA()) -> NA() | J458: =IF(INDIRECT(ADDRESS(RC1,1,3,1,Menus!R10C11))=T(R1C),RC4,NA()) -> NA() | K458: =IF(OR(ISNUMBER(RC7),ISNUMBER(RC8),ISNUMBER(RC9),ISNUMBER(RC10)),1,0) -> 0 | M458: =OFFSET(INDIRECT(ADDRESS(RC1,3,3,1,"Gross")),0,Menus!R4C10) -> 0 | N458: =OFFSET(INDIRECT(ADDRESS(RC1,3,3,1,"Gross")),0,Menus!R3C10) -> 0
A459: 496 | B459: =OFFSET(INDIRECT(ADDRESS(RC1,3,3,1,Menus!R10C11)),0,Menus!R4C10) -> 0 | C459: =OFFSET(INDIRECT(ADDRESS(RC1,3,3,1,Menus!R10C11)),0,Menus!R3C10) -> 0 | D459: =IF(Menus!R9C10,RC[-1]/RC[-2],RC[-1]) -> #DIV/0! | E459: =IF(RC11=1,VALUE(RC[-3]),NA()) -> NA() | F459: =INDIRECT(ADDRESS(RC1,1,3,1,Menus!R10C11)) -> 0 | G459: =IF(INDIRECT(ADDRESS(RC1,2,3,1,Menus!R10C11))=R1C,RC4,NA()) -> NA() | H459: =IF(INDIRECT(ADDRESS(RC1,2,3,1,Menus!R10C11))=R1C,RC4,NA()) -> NA() | I459: =IF(INDIRECT(ADDRESS(RC1,2,3,1,Menus!R10C11))=R1C,RC4,NA()) -> NA() | J459: =IF(INDIRECT(ADDRESS(RC1,1,3,1,Menus!R10C11))=T(R1C),RC4,NA()) -> NA() | K459: =IF(OR(ISNUMBER(RC7),ISNUMBER(RC8),ISNUMBER(RC9),ISNUMBER(RC10)),1,0) -> 0 | M459: =OFFSET(INDIRECT(ADDRESS(RC1,3,3,1,"Gross")),0,Menus!R4C10) -> 0 | N459: =OFFSET(INDIRECT(ADDRESS(RC1,3,3,1,"Gross")),0,Menus!R3C10) -> 0
A460: 497 | B460: =OFFSET(INDIRECT(ADDRESS(RC1,3,3,1,Menus!R10C11)),0,Menus!R4C10) -> 0 | C460: =OFFSET(INDIRECT(ADDRESS(RC1,3,3,1,Menus!R10C11)),0,Menus!R3C10) -> 0 | D460: =IF(Menus!R9C10,RC[-1]/RC[-2],RC[-1]) -> #DIV/0! | E460: =IF(RC11=1,VALUE(RC[-3]),NA()) -> NA() | F460: =INDIRECT(ADDRESS(RC1,1,3,1,Menus!R10C11)) -> 0 | G460: =IF(INDIRECT(ADDRESS(RC1,2,3,1,Menus!R10C11))=R1C,RC4,NA()) -> NA() | H460: =IF(INDIRECT(ADDRESS(RC1,2,3,1,Menus!R10C11))=R1C,RC4,NA()) -> NA() | I460: =IF(INDIRECT(ADDRESS(RC1,2,3,1,Menus!R10C11))=R1C,RC4,NA()) -> NA() | J460: =IF(INDIRECT(ADDRESS(RC1,1,3,1,Menus!R10C11))=T(R1C),RC4,NA()) -> NA() | K460: =IF(OR(ISNUMBER(RC7),ISNUMBER(RC8),ISNUMBER(RC9),ISNUMBER(RC10)),1,0) -> 0 | M460: =OFFSET(INDIRECT(ADDRESS(RC1,3,3,1,"Gross")),0,Menus!R4C10) -> 0 | N460: =OFFSET(INDIRECT(ADDRESS(RC1,3,3,1,"Gross")),0,Menus!R3C10) -> 0
A461: 498 | B461: =OFFSET(INDIRECT(ADDRESS(RC1,3,3,1,Menus!R10C11)),0,Menus!R4C10) -> 0 | C461: =OFFSET(INDIRECT(ADDRESS(RC1,3,3,1,Menus!R10C11)),0,Menus!R3C10) -> 0 | D461: =IF(Menus!R9C10,RC[-1]/RC[-2],RC[-1]) -> #DIV/0! | E461: =IF(RC11=1,VALUE(RC[-3]),NA()) -> NA() | F461: =INDIRECT(ADDRESS(RC1,1,3,1,Menus!R10C11)) -> 0 | G461: =IF(INDIRECT(ADDRESS(RC1,2,3,1,Menus!R10C11))=R1C,RC4,NA()) -> NA() | H461: =IF(INDIRECT(ADDRESS(RC1,2,3,1,Menus!R10C11))=R1C,RC4,NA()) -> NA() | I461: =IF(INDIRECT(ADDRESS(RC1,2,3,1,Menus!R10C11))=R1C,RC4,NA()) -> NA() | J461: =IF(INDIRECT(ADDRESS(RC1,1,3,1,Menus!R10C11))=T(R1C),RC4,NA()) -> NA() | K461: =IF(OR(ISNUMBER(RC7),ISNUMBER(RC8),ISNUMBER(RC9),ISNUMBER(RC10)),1,0) -> 0 | M461: =OFFSET(INDIRECT(ADDRESS(RC1,3,3,1,"Gross")),0,Menus!R4C10) -> 0 | N461: =OFFSET(INDIRECT(ADDRESS(RC1,3,3,1,"Gross")),0,Menus!R3C10) -> 0
A462: 499 | B462: =OFFSET(INDIRECT(ADDRESS(RC1,3,3,1,Menus!R10C11)),0,Menus!R4C10) -> 0 | C462: =OFFSET(INDIRECT(ADDRESS(RC1,3,3,1,Menus!R10C11)),0,Menus!R3C10) -> 0 | D462: =IF(Menus!R9C10,RC[-1]/RC[-2],RC[-1]) -> #DIV/0! | E462: =IF(RC11=1,VALUE(RC[-3]),NA()) -> NA() | F462: =INDIRECT(ADDRESS(RC1,1,3,1,Menus!R10C11)) -> 0 | G462: =IF(INDIRECT(ADDRESS(RC1,2,3,1,Menus!R10C11))=R1C,RC4,NA()) -> NA() | H462: =IF(INDIRECT(ADDRESS(RC1,2,3,1,Menus!R10C11))=R1C,RC4,NA()) -> NA() | I462: =IF(INDIRECT(ADDRESS(RC1,2,3,1,Menus!R10C11))=R1C,RC4,NA()) -> NA() | J462: =IF(INDIRECT(ADDRESS(RC1,1,3,1,Menus!R10C11))=T(R1C),RC4,NA()) -> NA() | K462: =IF(OR(ISNUMBER(RC7),ISNUMBER(RC8),ISNUMBER(RC9),ISNUMBER(RC10)),1,0) -> 0 | M462: =OFFSET(INDIRECT(ADDRESS(RC1,3,3,1,"Gross")),0,Menus!R4C10) -> 0 | N462: =OFFSET(INDIRECT(ADDRESS(RC1,3,3,1,"Gross")),0,Menus!R3C10) -> 0
A463: 500 | B463: =OFFSET(INDIRECT(ADDRESS(RC1,3,3,1,Menus!R10C11)),0,Menus!R4C10) -> 0 | C463: =OFFSET(INDIRECT(ADDRESS(RC1,3,3,1,Menus!R10C11)),0,Menus!R3C10) -> 0 | D463: =IF(Menus!R9C10,RC[-1]/RC[-2],RC[-1]) -> #DIV/0! | E463: =IF(RC11=1,VALUE(RC[-3]),NA()) -> NA() | F463: =INDIRECT(ADDRESS(RC1,1,3,1,Menus!R10C11)) -> 0 | G463: =IF(INDIRECT(ADDRESS(RC1,2,3,1,Menus!R10C11))=R1C,RC4,NA()) -> NA() | H463: =IF(INDIRECT(ADDRESS(RC1,2,3,1,Menus!R10C11))=R1C,RC4,NA()) -> NA() | I463: =IF(INDIRECT(ADDRESS(RC1,2,3,1,Menus!R10C11))=R1C,RC4,NA()) -> NA() | J463: =IF(INDIRECT(ADDRESS(RC1,1,3,1,Menus!R10C11))=T(R1C),RC4,NA()) -> NA() | K463: =IF(OR(ISNUMBER(RC7),ISNUMBER(RC8),ISNUMBER(RC9),ISNUMBER(RC10)),1,0) -> 0 | M463: =OFFSET(INDIRECT(ADDRESS(RC1,3,3,1,"Gross")),0,Menus!R4C10) -> 0 | N463: =OFFSET(INDIRECT(ADDRESS(RC1,3,3,1,"Gross")),0,Menus!R3C10) -> 0
A464: 501 | B464: =OFFSET(INDIRECT(ADDRESS(RC1,3,3,1,Menus!R10C11)),0,Menus!R4C10) -> 0 | C464: =OFFSET(INDIRECT(ADDRESS(RC1,3,3,1,Menus!R10C11)),0,Menus!R3C10) -> 0 | D464: =IF(Menus!R9C10,RC[-1]/RC[-2],RC[-1]) -> #DIV/0! | E464: =IF(RC11=1,VALUE(RC[-3]),NA()) -> NA() | F464: =INDIRECT(ADDRESS(RC1,1,3,1,Menus!R10C11)) -> 0 | G464: =IF(INDIRECT(ADDRESS(RC1,2,3,1,Menus!R10C11))=R1C,RC4,NA()) -> NA() | H464: =IF(INDIRECT(ADDRESS(RC1,2,3,1,Menus!R10C11))=R1C,RC4,NA()) -> NA() | I464: =IF(INDIRECT(ADDRESS(RC1,2,3,1,Menus!R10C11))=R1C,RC4,NA()) -> NA() | J464: =IF(INDIRECT(ADDRESS(RC1,1,3,1,Menus!R10C11))=T(R1C),RC4,NA()) -> NA() | K464: =IF(OR(ISNUMBER(RC7),ISNUMBER(RC8),ISNUMBER(RC9),ISNUMBER(RC10)),1,0) -> 0 | M464: =OFFSET(INDIRECT(ADDRESS(RC1,3,3,1,"Gross")),0,Menus!R4C10) -> 0 | N464: =OFFSET(INDIRECT(ADDRESS(RC1,3,3,1,"Gross")),0,Menus!R3C10) -> 0
A465: 48 | B465: =OFFSET(INDIRECT(ADDRESS(RC1,3,3,1,Menus!R10C11)),0,Menus!R4C10) -> 0 | C465: =OFFSET(INDIRECT(ADDRESS(RC1,3,3,1,Menus!R10C11)),0,Menus!R3C10) -> 0 | D465: =IF(Menus!R9C10,RC[-1]/RC[-2],RC[-1]) -> #DIV/0! | E465: =IF(RC11=1,VALUE(RC[-3]),NA()) -> NA() | F465: =INDIRECT(ADDRESS(RC1,1,3,1,Menus!R10C11)) -> 0 | G465: =IF(INDIRECT(ADDRESS(RC1,2,3,1,Menus!R10C11))=R1C,RC4,NA()) -> NA() | H465: =IF(INDIRECT(ADDRESS(RC1,2,3,1,Menus!R10C11))=R1C,RC4,NA()) -> NA() | I465: =IF(INDIRECT(ADDRESS(RC1,2,3,1,Menus!R10C11))=R1C,RC4,NA()) -> NA() | J465: =IF(INDIRECT(ADDRESS(RC1,1,3,1,Menus!R10C11))=T(R1C),RC4,NA()) -> NA() | K465: =IF(OR(ISNUMBER(RC7),ISNUMBER(RC8),ISNUMBER(RC9),ISNUMBER(RC10)),1,0) -> 0 | M465: =OFFSET(INDIRECT(ADDRESS(RC1,3,3,1,"Gross")),0,Menus!R4C10) -> 0 | N465: =OFFSET(INDIRECT(ADDRESS(RC1,3,3,1,"Gross")),0,Menus!R3C10) -> 2
A466: 195 | B466: =OFFSET(INDIRECT(ADDRESS(RC1,3,3,1,Menus!R10C11)),0,Menus!R4C10) -> 0 | C466: =OFFSET(INDIRECT(ADDRESS(RC1,3,3,1,Menus!R10C11)),0,Menus!R3C10) -> 0 | D466: =IF(Menus!R9C10,RC[-1]/RC[-2],RC[-1]) -> #DIV/0! | E466: =IF(RC11=1,VALUE(RC[-3]),NA()) -> NA() | F466: =INDIRECT(ADDRESS(RC1,1,3,1,Menus!R10C11)) -> 0 | G466: =IF(INDIRECT(ADDRESS(RC1,2,3,1,Menus!R10C11))=R1C,RC4,NA()) -> NA() | H466: =IF(INDIRECT(ADDRESS(RC1,2,3,1,Menus!R10C11))=R1C,RC4,NA()) -> NA() | I466: =IF(INDIRECT(ADDRESS(RC1,2,3,1,Menus!R10C11))=R1C,RC4,NA()) -> NA() | J466: =IF(INDIRECT(ADDRESS(RC1,1,3,1,Menus!R10C11))=T(R1C),RC4,NA()) -> NA() | K466: =IF(OR(ISNUMBER(RC7),ISNUMBER(RC8),ISNUMBER(RC9),ISNUMBER(RC10)),1,0) -> 0 | M466: =OFFSET(INDIRECT(ADDRESS(RC1,3,3,1,"Gross")),0,Menus!R4C10) -> 0 | N466: =OFFSET(INDIRECT(ADDRESS(RC1,3,3,1,"Gross")),0,Menus!R3C10) -> 0
A467: 103 | B467: =OFFSET(INDIRECT(ADDRESS(RC1,3,3,1,Menus!R10C11)),0,Menus!R4C10) -> 0 | C467: =OFFSET(INDIRECT(ADDRESS(RC1,3,3,1,Menus!R10C11)),0,Menus!R3C10) -> 0 | D467: =IF(Menus!R9C10,RC[-1]/RC[-2],RC[-1]) -> #DIV/0! | E467: =IF(RC11=1,VALUE(RC[-3]),NA()) -> NA() | F467: =INDIRECT(ADDRESS(RC1,1,3,1,Menus!R10C11)) -> 0 | G467: =IF(INDIRECT(ADDRESS(RC1,2,3,1,Menus!R10C11))=R1C,RC4,NA()) -> NA() | H467: =IF(INDIRECT(ADDRESS(RC1,2,3,1,Menus!R10C11))=R1C,RC4,NA()) -> NA() | I467: =IF(INDIRECT(ADDRESS(RC1,2,3,1,Menus!R10C11))=R1C,RC4,NA()) -> NA() | J467: =IF(INDIRECT(ADDRESS(RC1,1,3,1,Menus!R10C11))=T(R1C),RC4,NA()) -> NA() | K467: =IF(OR(ISNUMBER(RC7),ISNUMBER(RC8),ISNUMBER(RC9),ISNUMBER(RC10)),1,0) -> 0 | M467: =OFFSET(INDIRECT(ADDRESS(RC1,3,3,1,"Gross")),0,Menus!R4C10) -> 1 | N467: =OFFSET(INDIRECT(ADDRESS(RC1,3,3,1,"Gross")),0,Menus!R3C10) -> 1
A468: 158 | B468: =OFFSET(INDIRECT(ADDRESS(RC1,3,3,1,Menus!R10C11)),0,Menus!R4C10) -> 0 | C468: =OFFSET(INDIRECT(ADDRESS(RC1,3,3,1,Menus!R10C11)),0,Menus!R3C10) -> 0 | D468: =IF(Menus!R9C10,RC[-1]/RC[-2],RC[-1]) -> #DIV/0! | E468: =IF(RC11=1,VALUE(RC[-3]),NA()) -> NA() | F468: =INDIRECT(ADDRESS(RC1,1,3,1,Menus!R10C11)) -> 0 | G468: =IF(INDIRECT(ADDRESS(RC1,2,3,1,Menus!R10C11))=R1C,RC4,NA()) -> NA() | H468: =IF(INDIRECT(ADDRESS(RC1,2,3,1,Menus!R10C11))=R1C,RC4,NA()) -> NA() | I468: =IF(INDIRECT(ADDRESS(RC1,2,3,1,Menus!R10C11))=R1C,RC4,NA()) -> NA() | J468: =IF(INDIRECT(ADDRESS(RC1,1,3,1,Menus!R10C11))=T(R1C),RC4,NA()) -> NA() | K468: =IF(OR(ISNUMBER(RC7),ISNUMBER(RC8),ISNUMBER(RC9),ISNUMBER(RC10)),1,0) -> 0 | M468: =OFFSET(INDIRECT(ADDRESS(RC1,3,3,1,"Gross")),0,Menus!R4C10) -> 2 | N468: =OFFSET(INDIRECT(ADDRESS(RC1,3,3,1,"Gross")),0,Menus!R3C10) -> 2
A469: 77 | B469: =OFFSET(INDIRECT(ADDRESS(RC1,3,3,1,Menus!R10C11)),0,Menus!R4C10) -> 0 | C469: =OFFSET(INDIRECT(ADDRESS(RC1,3,3,1,Menus!R10C11)),0,Menus!R3C10) -> 0 | D469: =IF(Menus!R9C10,RC[-1]/RC[-2],RC[-1]) -> #DIV/0! | E469: =IF(RC11=1,VALUE(RC[-3]),NA()) -> NA() | F469: =INDIRECT(ADDRESS(RC1,1,3,1,Menus!R10C11)) -> 0 | G469: =IF(INDIRECT(ADDRESS(RC1,2,3,1,Menus!R10C11))=R1C,RC4,NA()) -> NA() | H469: =IF(INDIRECT(ADDRESS(RC1,2,3,1,Menus!R10C11))=R1C,RC4,NA()) -> NA() | I469: =IF(INDIRECT(ADDRESS(RC1,2,3,1,Menus!R10C11))=R1C,RC4,NA()) -> NA() | J469: =IF(INDIRECT(ADDRESS(RC1,1,3,1,Menus!R10C11))=T(R1C),RC4,NA()) -> NA() | K469: =IF(OR(ISNUMBER(RC7),ISNUMBER(RC8),ISNUMBER(RC9),ISNUMBER(RC10)),1,0) -> 0 | M469: =OFFSET(INDIRECT(ADDRESS(RC1,3,3,1,"Gross")),0,Menus!R4C10) -> 2 | N469: =OFFSET(INDIRECT(ADDRESS(RC1,3,3,1,"Gross")),0,Menus!R3C10) -> 2
A470: 54 | B470: =OFFSET(INDIRECT(ADDRESS(RC1,3,3,1,Menus!R10C11)),0,Menus!R4C10) -> 0 | C470: =OFFSET(INDIRECT(ADDRESS(RC1,3,3,1,Menus!R10C11)),0,Menus!R3C10) -> 0 | D470: =IF(Menus!R9C10,RC[-1]/RC[-2],RC[-1]) -> #DIV/0! | E470: =IF(RC11=1,VALUE(RC[-3]),NA()) -> NA() | F470: =INDIRECT(ADDRESS(RC1,1,3,1,Menus!R10C11)) -> 0 | G470: =IF(INDIRECT(ADDRESS(RC1,2,3,1,Menus!R10C11))=R1C,RC4,NA()) -> NA() | H470: =IF(INDIRECT(ADDRESS(RC1,2,3,1,Menus!R10C11))=R1C,RC4,NA()) -> NA() | I470: =IF(INDIRECT(ADDRESS(RC1,2,3,1,Menus!R10C11))=R1C,RC4,NA()) -> NA() | J470: =IF(INDIRECT(ADDRESS(RC1,1,3,1,Menus!R10C11))=T(R1C),RC4,NA()) -> NA() | K470: =IF(OR(ISNUMBER(RC7),ISNUMBER(RC8),ISNUMBER(RC9),ISNUMBER(RC10)),1,0) -> 0 | M470: =OFFSET(INDIRECT(ADDRESS(RC1,3,3,1,"Gross")),0,Menus!R4C10) -> 2 | N470: =OFFSET(INDIRECT(ADDRESS(RC1,3,3,1,"Gross")),0,Menus!R3C10) -> 2
A471: 97 | B471: =OFFSET(INDIRECT(ADDRESS(RC1,3,3,1,Menus!R10C11)),0,Menus!R4C10) -> 0 | C471: =OFFSET(INDIRECT(ADDRESS(RC1,3,3,1,Menus!R10C11)),0,Menus!R3C10) -> 0 | D471: =IF(Menus!R9C10,RC[-1]/RC[-2],RC[-1]) -> #DIV/0! | E471: =IF(RC11=1,VALUE(RC[-3]),NA()) -> NA() | F471: =INDIRECT(ADDRESS(RC1,1,3,1,Menus!R10C11)) -> 0 | G471: =IF(INDIRECT(ADDRESS(RC1,2,3,1,Menus!R10C11))=R1C,RC4,NA()) -> NA() | H471: =IF(INDIRECT(ADDRESS(RC1,2,3,1,Menus!R10C11))=R1C,RC4,NA()) -> NA() | I471: =IF(INDIRECT(ADDRESS(RC1,2,3,1,Menus!R10C11))=R1C,RC4,NA()) -> NA() | J471: =IF(INDIRECT(ADDRESS(RC1,1,3,1,Menus!R10C11))=T(R1C),RC4,NA()) -> NA() | K471: =IF(OR(ISNUMBER(RC7),ISNUMBER(RC8),ISNUMBER(RC9),ISNUMBER(RC10)),1,0) -> 0 | M471: =OFFSET(INDIRECT(ADDRESS(RC1,3,3,1,"Gross")),0,Menus!R4C10) -> 0 | N471: =OFFSET(INDIRECT(ADDRESS(RC1,3,3,1,"Gross")),0,Menus!R3C10) -> 0
A472: 87 | B472: =OFFSET(INDIRECT(ADDRESS(RC1,3,3,1,Menus!R10C11)),0,Menus!R4C10) -> 0 | C472: =OFFSET(INDIRECT(ADDRESS(RC1,3,3,1,Menus!R10C11)),0,Menus!R3C10) -> 0 | D472: =IF(Menus!R9C10,RC[-1]/RC[-2],RC[-1]) -> #DIV/0! | E472: =IF(RC11=1,VALUE(RC[-3]),NA()) -> NA() | F472: =INDIRECT(ADDRESS(RC1,1,3,1,Menus!R10C11)) -> 0 | G472: =IF(INDIRECT(ADDRESS(RC1,2,3,1,Menus!R10C11))=R1C,RC4,NA()) -> NA() | H472: =IF(INDIRECT(ADDRESS(RC1,2,3,1,Menus!R10C11))=R1C,RC4,NA()) -> NA() | I472: =IF(INDIRECT(ADDRESS(RC1,2,3,1,Menus!R10C11))=R1C,RC4,NA()) -> NA() | J472: =IF(INDIRECT(ADDRESS(RC1,1,3,1,Menus!R10C11))=T(R1C),RC4,NA()) -> NA() | K472: =IF(OR(ISNUMBER(RC7),ISNUMBER(RC8),ISNUMBER(RC9),ISNUMBER(RC10)),1,0) -> 0 | M472: =OFFSET(INDIRECT(ADDRESS(RC1,3,3,1,"Gross")),0,Menus!R4C10) -> 0 | N472: =OFFSET(INDIRECT(ADDRESS(RC1,3,3,1,"Gross")),0,Menus!R3C10) -> 0
A473: 123 | B473: =OFFSET(INDIRECT(ADDRESS(RC1,3,3,1,Menus!R10C11)),0,Menus!R4C10) -> 0 | C473: =OFFSET(INDIRECT(ADDRESS(RC1,3,3,1,Menus!R10C11)),0,Menus!R3C10) -> 0 | D473: =IF(Menus!R9C10,RC[-1]/RC[-2],RC[-1]) -> #DIV/0! | E473: =IF(RC11=1,VALUE(RC[-3]),NA()) -> NA() | F473: =INDIRECT(ADDRESS(RC1,1,3,1,Menus!R10C11)) -> 0 | G473: =IF(INDIRECT(ADDRESS(RC1,2,3,1,Menus!R10C11))=R1C,RC4,NA()) -> NA() | H473: =IF(INDIRECT(ADDRESS(RC1,2,3,1,Menus!R10C11))=R1C,RC4,NA()) -> NA() | I473: =IF(INDIRECT(ADDRESS(RC1,2,3,1,Menus!R10C11))=R1C,RC4,NA()) -> NA() | J473: =IF(INDIRECT(ADDRESS(RC1,1,3,1,Menus!R10C11))=T(R1C),RC4,NA()) -> NA() | K473: =IF(OR(ISNUMBER(RC7),ISNUMBER(RC8),ISNUMBER(RC9),ISNUMBER(RC10)),1,0) -> 0 | M473: =OFFSET(INDIRECT(ADDRESS(RC1,3,3,1,"Gross")),0,Menus!R4C10) -> 0 | N473: =OFFSET(INDIRECT(ADDRESS(RC1,3,3,1,"Gross")),0,Menus!R3C10) -> 0
A474: 131 | B474: =OFFSET(INDIRECT(ADDRESS(RC1,3,3,1,Menus!R10C11)),0,Menus!R4C10) -> 0 | C474: =OFFSET(INDIRECT(ADDRESS(RC1,3,3,1,Menus!R10C11)),0,Menus!R3C10) -> 0 | D474: =IF(Menus!R9C10,RC[-1]/RC[-2],RC[-1]) -> #DIV/0! | E474: =IF(RC11=1,VALUE(RC[-3]),NA()) -> NA() | F474: =INDIRECT(ADDRESS(RC1,1,3,1,Menus!R10C11)) -> 0 | G474: =IF(INDIRECT(ADDRESS(RC1,2,3,1,Menus!R10C11))=R1C,RC4,NA()) -> NA() | H474: =IF(INDIRECT(ADDRESS(RC1,2,3,1,Menus!R10C11))=R1C,RC4,NA()) -> NA() | I474: =IF(INDIRECT(ADDRESS(RC1,2,3,1,Menus!R10C11))=R1C,RC4,NA()) -> NA() | J474: =IF(INDIRECT(ADDRESS(RC1,1,3,1,Menus!R10C11))=T(R1C),RC4,NA()) -> NA() | K474: =IF(OR(ISNUMBER(RC7),ISNUMBER(RC8),ISNUMBER(RC9),ISNUMBER(RC10)),1,0) -> 0 | M474: =OFFSET(INDIRECT(ADDRESS(RC1,3,3,1,"Gross")),0,Menus!R4C10) -> 0 | N474: =OFFSET(INDIRECT(ADDRESS(RC1,3,3,1,"Gross")),0,Menus!R3C10) -> 0
A475: 127 | B475: =OFFSET(INDIRECT(ADDRESS(RC1,3,3,1,Menus!R10C11)),0,Menus!R4C10) -> 0 | C475: =OFFSET(INDIRECT(ADDRESS(RC1,3,3,1,Menus!R10C11)),0,Menus!R3C10) -> 0 | D475: =IF(Menus!R9C10,RC[-1]/RC[-2],RC[-1]) -> #DIV/0! | E475: =IF(RC11=1,VALUE(RC[-3]),NA()) -> NA() | F475: =INDIRECT(ADDRESS(RC1,1,3,1,Menus!R10C11)) -> 0 | G475: =IF(INDIRECT(ADDRESS(RC1,2,3,1,Menus!R10C11))=R1C,RC4,NA()) -> NA() | H475: =IF(INDIRECT(ADDRESS(RC1,2,3,1,Menus!R10C11))=R1C,RC4,NA()) -> NA() | I475: =IF(INDIRECT(ADDRESS(RC1,2,3,1,Menus!R10C11))=R1C,RC4,NA()) -> NA() | J475: =IF(INDIRECT(ADDRESS(RC1,1,3,1,Menus!R10C11))=T(R1C),RC4,NA()) -> NA() | K475: =IF(OR(ISNUMBER(RC7),ISNUMBER(RC8),ISNUMBER(RC9),ISNUMBER(RC10)),1,0) -> 0 | M475: =OFFSET(INDIRECT(ADDRESS(RC1,3,3,1,"Gross")),0,Menus!R4C10) -> 0 | N475: =OFFSET(INDIRECT(ADDRESS(RC1,3,3,1,"Gross")),0,Menus!R3C10) -> 0
A476: 98 | B476: =OFFSET(INDIRECT(ADDRESS(RC1,3,3,1,Menus!R10C11)),0,Menus!R4C10) -> 0 | C476: =OFFSET(INDIRECT(ADDRESS(RC1,3,3,1,Menus!R10C11)),0,Menus!R3C10) -> 0 | D476: =IF(Menus!R9C10,RC[-1]/RC[-2],RC[-1]) -> #DIV/0! | E476: =IF(RC11=1,VALUE(RC[-3]),NA()) -> NA() | F476: =INDIRECT(ADDRESS(RC1,1,3,1,Menus!R10C11)) -> 0 | G476: =IF(INDIRECT(ADDRESS(RC1,2,3,1,Menus!R10C11))=R1C,RC4,NA()) -> NA() | H476: =IF(INDIRECT(ADDRESS(RC1,2,3,1,Menus!R10C11))=R1C,RC4,NA()) -> NA() | I476: =IF(INDIRECT(ADDRESS(RC1,2,3,1,Menus!R10C11))=R1C,RC4,NA()) -> NA() | J476: =IF(INDIRECT(ADDRESS(RC1,1,3,1,Menus!R10C11))=T(R1C),RC4,NA()) -> NA() | K476: =IF(OR(ISNUMBER(RC7),ISNUMBER(RC8),ISNUMBER(RC9),ISNUMBER(RC10)),1,0) -> 0 | M476: =OFFSET(INDIRECT(ADDRESS(RC1,3,3,1,"Gross")),0,Menus!R4C10) -> 0 | N476: =OFFSET(INDIRECT(ADDRESS(RC1,3,3,1,"Gross")),0,Menus!R3C10) -> 0
A477: 118 | B477: =OFFSET(INDIRECT(ADDRESS(RC1,3,3,1,Menus!R10C11)),0,Menus!R4C10) -> 0 | C477: =OFFSET(INDIRECT(ADDRESS(RC1,3,3,1,Menus!R10C11)),0,Menus!R3C10) -> 0 | D477: =IF(Menus!R9C10,RC[-1]/RC[-2],RC[-1]) -> #DIV/0! | E477: =IF(RC11=1,VALUE(RC[-3]),NA()) -> NA() | F477: =INDIRECT(ADDRESS(RC1,1,3,1,Menus!R10C11)) -> 0 | G477: =IF(INDIRECT(ADDRESS(RC1,2,3,1,Menus!R10C11))=R1C,RC4,NA()) -> NA() | H477: =IF(INDIRECT(ADDRESS(RC1,2,3,1,Menus!R10C11))=R1C,RC4,NA()) -> NA() | I477: =IF(INDIRECT(ADDRESS(RC1,2,3,1,Menus!R10C11))=R1C,RC4,NA()) -> NA() | J477: =IF(INDIRECT(ADDRESS(RC1,1,3,1,Menus!R10C11))=T(R1C),RC4,NA()) -> NA() | K477: =IF(OR(ISNUMBER(RC7),ISNUMBER(RC8),ISNUMBER(RC9),ISNUMBER(RC10)),1,0) -> 0 | M477: =OFFSET(INDIRECT(ADDRESS(RC1,3,3,1,"Gross")),0,Menus!R4C10) -> 0 | N477: =OFFSET(INDIRECT(ADDRESS(RC1,3,3,1,"Gross")),0,Menus!R3C10) -> 0
A478: 35 | B478: =OFFSET(INDIRECT(ADDRESS(RC1,3,3,1,Menus!R10C11)),0,Menus!R4C10) -> 3355 | C478: =OFFSET(INDIRECT(ADDRESS(RC1,3,3,1,Menus!R10C11)),0,Menus!R3C10) -> 167752600 | D478: =IF(Menus!R9C10,RC[-1]/RC[-2],RC[-1]) -> 50000.774962742173 | E478: =IF(RC11=1,VALUE(RC[-3]),NA()) -> NA() | F478: =INDIRECT(ADDRESS(RC1,1,3,1,Menus!R10C11)) -> Australia | G478: =IF(INDIRECT(ADDRESS(RC1,2,3,1,Menus!R10C11))=R1C,RC4,NA()) -> NA() | H478: =IF(INDIRECT(ADDRESS(RC1,2,3,1,Menus!R10C11))=R1C,RC4,NA()) -> NA() | I478: =IF(INDIRECT(ADDRESS(RC1,2,3,1,Menus!R10C11))=R1C,RC4,NA()) -> NA() | J478: =IF(INDIRECT(ADDRESS(RC1,1,3,1,Menus!R10C11))=T(R1C),RC4,NA()) -> NA() | K478: =IF(OR(ISNUMBER(RC7),ISNUMBER(RC8),ISNUMBER(RC9),ISNUMBER(RC10)),1,0) -> 0 | M478: =OFFSET(INDIRECT(ADDRESS(RC1,3,3,1,"Gross")),0,Menus!R4C10) -> 2 | N478: =OFFSET(INDIRECT(ADDRESS(RC1,3,3,1,"Gross")),0,Menus!R3C10) -> 2
A479: 38 | B479: =OFFSET(INDIRECT(ADDRESS(RC1,3,3,1,Menus!R10C11)),0,Menus!R4C10) -> 13349 | C479: =OFFSET(INDIRECT(ADDRESS(RC1,3,3,1,Menus!R10C11)),0,Menus!R3C10) -> 402701509 | D479: =IF(Menus!R9C10,RC[-1]/RC[-2],RC[-1]) -> 30167.166754063976 | E479: =IF(RC11=1,VALUE(RC[-3]),NA()) -> NA() | F479: =INDIRECT(ADDRESS(RC1,1,3,1,Menus!R10C11)) -> Canada | G479: =IF(INDIRECT(ADDRESS(RC1,2,3,1,Menus!R10C11))=R1C,RC4,NA()) -> NA() | H479: =IF(INDIRECT(ADDRESS(RC1,2,3,1,Menus!R10C11))=R1C,RC4,NA()) -> NA() | I479: =IF(INDIRECT(ADDRESS(RC1,2,3,1,Menus!R10C11))=R1C,RC4,NA()) -> NA() | J479: =IF(INDIRECT(ADDRESS(RC1,1,3,1,Menus!R10C11))=T(R1C),RC4,NA()) -> NA() | K479: =IF(OR(ISNUMBER(RC7),ISNUMBER(RC8),ISNUMBER(RC9),ISNUMBER(RC10)),1,0) -> 0 | M479: =OFFSET(INDIRECT(ADDRESS(RC1,3,3,1,"Gross")),0,Menus!R4C10) -> 1 | N479: =OFFSET(INDIRECT(ADDRESS(RC1,3,3,1,"Gross")),0,Menus!R3C10) -> 1
A480: 43 | B480: =OFFSET(INDIRECT(ADDRESS(RC1,3,3,1,Menus!R10C11)),0,Menus!R4C10) -> 2452 | C480: =OFFSET(INDIRECT(ADDRESS(RC1,3,3,1,Menus!R10C11)),0,Menus!R3C10) -> 70333312 | D480: =IF(Menus!R9C10,RC[-1]/RC[-2],RC[-1]) -> 28684.058727569332 | E480: =IF(RC11=1,VALUE(RC[-3]),NA()) -> NA() | F480: =INDIRECT(ADDRESS(RC1,1,3,1,Menus!R10C11)) -> EFTA - Total | G480: =IF(INDIRECT(ADDRESS(RC1,2,3,1,Menus!R10C11))=R1C,RC4,NA()) -> NA() | H480: =IF(INDIRECT(ADDRESS(RC1,2,3,1,Menus!R10C11))=R1C,RC4,NA()) -> NA() | I480: =IF(INDIRECT(ADDRESS(RC1,2,3,1,Menus!R10C11))=R1C,RC4,NA()) -> NA() | J480: =IF(INDIRECT(ADDRESS(RC1,1,3,1,Menus!R10C11))=T(R1C),RC4,NA()) -> NA() | K480: =IF(OR(ISNUMBER(RC7),ISNUMBER(RC8),ISNUMBER(RC9),ISNUMBER(RC10)),1,0) -> 0 | M480: =OFFSET(INDIRECT(ADDRESS(RC1,3,3,1,"Gross")),0,Menus!R4C10) -> 0 | N480: =OFFSET(INDIRECT(ADDRESS(RC1,3,3,1,"Gross")),0,Menus!R3C10) -> 0
A481: 42 | B481: =OFFSET(INDIRECT(ADDRESS(RC1,3,3,1,Menus!R10C11)),0,Menus!R4C10) -> 47560 | C481: =OFFSET(INDIRECT(ADDRESS(RC1,3,3,1,Menus!R10C11)),0,Menus!R3C10) -> 1354514691 | D481: =IF(Menus!R9C10,RC[-1]/RC[-2],RC[-1]) -> 28480.123864592093 | E481: =IF(RC11=1,VALUE(RC[-3]),NA()) -> NA() | F481: =INDIRECT(ADDRESS(RC1,1,3,1,Menus!R10C11)) -> EU - Total | G481: =IF(INDIRECT(ADDRESS(RC1,2,3,1,Menus!R10C11))=R1C,RC4,NA()) -> NA() | H481: =IF(INDIRECT(ADDRESS(RC1,2,3,1,Menus!R10C11))=R1C,RC4,NA()) -> NA() | I481: =IF(INDIRECT(ADDRESS(RC1,2,3,1,Menus!R10C11))=R1C,RC4,NA()) -> NA() | J481: =IF(INDIRECT(ADDRESS(RC1,1,3,1,Menus!R10C11))=T(R1C),RC4,NA()) -> NA() | K481: =IF(OR(ISNUMBER(RC7),ISNUMBER(RC8),ISNUMBER(RC9),ISNUMBER(RC10)),1,0) -> 0 | M481: =OFFSET(INDIRECT(ADDRESS(RC1,3,3,1,"Gross")),0,Menus!R4C10) -> 0 | N481: =OFFSET(INDIRECT(ADDRESS(RC1,3,3,1,"Gross")),0,Menus!R3C10) -> 0
A482: 39 | B482: =OFFSET(INDIRECT(ADDRESS(RC1,3,3,1,Menus!R10C11)),0,Menus!R4C10) -> 991 | C482: =OFFSET(INDIRECT(ADDRESS(RC1,3,3,1,Menus!R10C11)),0,Menus!R3C10) -> 26738387 | D482: =IF(Menus!R9C10,RC[-1]/RC[-2],RC[-1]) -> 26981.217961654893 | E482: =IF(RC11=1,VALUE(RC[-3]),NA()) -> NA() | F482: =INDIRECT(ADDRESS(RC1,1,3,1,Menus!R10C11)) -> New Zealand | G482: =IF(INDIRECT(ADDRESS(RC1,2,3,1,Menus!R10C11))=R1C,RC4,NA()) -> NA() | H482: =IF(INDIRECT(ADDRESS(RC1,2,3,1,Menus!R10C11))=R1C,RC4,NA()) -> NA() | I482: =IF(INDIRECT(ADDRESS(RC1,2,3,1,Menus!R10C11))=R1C,RC4,NA()) -> NA() | J482: =IF(INDIRECT(ADDRESS(RC1,1,3,1,Menus!R10C11))=T(R1C),RC4,NA()) -> NA() | K482: =IF(OR(ISNUMBER(RC7),ISNUMBER(RC8),ISNUMBER(RC9),ISNUMBER(RC10)),1,0) -> 0 | M482: =OFFSET(INDIRECT(ADDRESS(RC1,3,3,1,"Gross")),0,Menus!R4C10) -> 2 | N482: =OFFSET(INDIRECT(ADDRESS(RC1,3,3,1,"Gross")),0,Menus!R3C10) -> 2
A483: 33 | B483: =OFFSET(INDIRECT(ADDRESS(RC1,3,3,1,Menus!R10C11)),0,Menus!R4C10) -> 96709 | C483: =OFFSET(INDIRECT(ADDRESS(RC1,3,3,1,Menus!R10C11)),0,Menus!R3C10) -> 2534637034 | D483: =IF(Menus!R9C10,RC[-1]/RC[-2],RC[-1]) -> 26208.905417282775 | E483: =IF(RC11=1,VALUE(RC[-3]),NA()) -> NA() | F483: =INDIRECT(ADDRESS(RC1,1,3,1,Menus!R10C11)) -> USA | G483: =IF(INDIRECT(ADDRESS(RC1,2,3,1,Menus!R10C11))=R1C,RC4,NA()) -> NA() | H483: =IF(INDIRECT(ADDRESS(RC1,2,3,1,Menus!R10C11))=R1C,RC4,NA()) -> NA() | I483: =IF(INDIRECT(ADDRESS(RC1,2,3,1,Menus!R10C11))=R1C,RC4,NA()) -> NA() | J483: =IF(INDIRECT(ADDRESS(RC1,1,3,1,Menus!R10C11))=T(R1C),RC4,NA()) -> NA() | K483: =IF(OR(ISNUMBER(RC7),ISNUMBER(RC8),ISNUMBER(RC9),ISNUMBER(RC10)),1,0) -> 0 | M483: =OFFSET(INDIRECT(ADDRESS(RC1,3,3,1,"Gross")),0,Menus!R4C10) -> 1 | N483: =OFFSET(INDIRECT(ADDRESS(RC1,3,3,1,"Gross")),0,Menus!R3C10) -> 1
A484: 44 | B484: =OFFSET(INDIRECT(ADDRESS(RC1,3,3,1,Menus!R10C11)),0,Menus!R4C10) -> 138257 | C484: =OFFSET(INDIRECT(ADDRESS(RC1,3,3,1,Menus!R10C11)),0,Menus!R3C10) -> 3544120087 | D484: =IF(Menus!R9C10,RC[-1]/RC[-2],RC[-1]) -> 25634.290393976436 | E484: =IF(RC11=1,VALUE(RC[-3]),NA()) -> NA() | F484: =INDIRECT(ADDRESS(RC1,1,3,1,Menus!R10C11)) -> World A - Total | G484: =IF(INDIRECT(ADDRESS(RC1,2,3,1,Menus!R10C11))=R1C,RC4,NA()) -> NA() | H484: =IF(INDIRECT(ADDRESS(RC1,2,3,1,Menus!R10C11))=R1C,RC4,NA()) -> NA() | I484: =IF(INDIRECT(ADDRESS(RC1,2,3,1,Menus!R10C11))=R1C,RC4,NA()) -> NA() | J484: =IF(INDIRECT(ADDRESS(RC1,1,3,1,Menus!R10C11))=T(R1C),RC4,NA()) -> NA() | K484: =IF(OR(ISNUMBER(RC7),ISNUMBER(RC8),ISNUMBER(RC9),ISNUMBER(RC10)),1,0) -> 0 | M484: =OFFSET(INDIRECT(ADDRESS(RC1,3,3,1,"Gross")),0,Menus!R4C10) -> 0 | N484: =OFFSET(INDIRECT(ADDRESS(RC1,3,3,1,"Gross")),0,Menus!R3C10) -> 0
A485: 37 | B485: =OFFSET(INDIRECT(ADDRESS(RC1,3,3,1,Menus!R10C11)),0,Menus!R4C10) -> 9443 | C485: =OFFSET(INDIRECT(ADDRESS(RC1,3,3,1,Menus!R10C11)),0,Menus!R3C10) -> 195146717 | D485: =IF(Menus!R9C10,RC[-1]/RC[-2],RC[-1]) -> 20665.75420946733 | E485: =IF(RC11=1,VALUE(RC[-3]),NA()) -> NA() | F485: =INDIRECT(ADDRESS(RC1,1,3,1,Menus!R10C11)) -> Korea | G485: =IF(INDIRECT(ADDRESS(RC1,2,3,1,Menus!R10C11))=R1C,RC4,NA()) -> NA() | H485: =IF(INDIRECT(ADDRESS(RC1,2,3,1,Menus!R10C11))=R1C,RC4,NA()) -> NA() | I485: =IF(INDIRECT(ADDRESS(RC1,2,3,1,Menus!R10C11))=R1C,RC4,NA()) -> NA() | J485: =IF(INDIRECT(ADDRESS(RC1,1,3,1,Menus!R10C11))=T(R1C),RC4,NA()) -> NA() | K485: =IF(OR(ISNUMBER(RC7),ISNUMBER(RC8),ISNUMBER(RC9),ISNUMBER(RC10)),1,0) -> 0 | M485: =OFFSET(INDIRECT(ADDRESS(RC1,3,3,1,"Gross")),0,Menus!R4C10) -> 2 | N485: =OFFSET(INDIRECT(ADDRESS(RC1,3,3,1,"Gross")),0,Menus!R3C10) -> 2
A486: 36 | B486: =OFFSET(INDIRECT(ADDRESS(RC1,3,3,1,Menus!R10C11)),0,Menus!R4C10) -> 14410 | C486: =OFFSET(INDIRECT(ADDRESS(RC1,3,3,1,Menus!R10C11)),0,Menus!R3C10) -> 217143840 | D486: =IF(Menus!R9C10,RC[-1]/RC[-2],RC[-1]) -> 15068.968771686328 | E486: =IF(RC11=1,VALUE(RC[-3]),NA()) -> NA() | F486: =INDIRECT(ADDRESS(RC1,1,3,1,Menus!R10C11)) -> Japan | G486: =IF(INDIRECT(ADDRESS(RC1,2,3,1,Menus!R10C11))=R1C,RC4,NA()) -> NA() | H486: =IF(INDIRECT(ADDRESS(RC1,2,3,1,Menus!R10C11))=R1C,RC4,NA()) -> NA() | I486: =IF(INDIRECT(ADDRESS(RC1,2,3,1,Menus!R10C11))=R1C,RC4,NA()) -> NA() | J486: =IF(INDIRECT(ADDRESS(RC1,1,3,1,Menus!R10C11))=T(R1C),RC4,NA()) -> NA() | K486: =IF(OR(ISNUMBER(RC7),ISNUMBER(RC8),ISNUMBER(RC9),ISNUMBER(RC10)),1,0) -> 0 | M486: =OFFSET(INDIRECT(ADDRESS(RC1,3,3,1,"Gross")),0,Menus!R4C10) -> 0 | N486: =OFFSET(INDIRECT(ADDRESS(RC1,3,3,1,"Gross")),0,Menus!R3C10) -> 1
A487: 4 | B487: =OFFSET(INDIRECT(ADDRESS(RC1,3,3,1,Menus!R10C11)),0,Menus!R4C10) -> 578 | C487: =OFFSET(INDIRECT(ADDRESS(RC1,3,3,1,Menus!R10C11)),0,Menus!R3C10) -> 2398155 | D487: =IF(Menus!R9C10,RC[-1]/RC[-2],RC[-1]) -> 4149.0570934256057 | E487: =IF(RC11=1,VALUE(RC[-3]),NA()) -> NA() | F487: =INDIRECT(ADDRESS(RC1,1,3,1,Menus!R10C11)) -> Estonia | G487: =IF(INDIRECT(ADDRESS(RC1,2,3,1,Menus!R10C11))=R1C,RC4,NA()) -> NA() | H487: =IF(INDIRECT(ADDRESS(RC1,2,3,1,Menus!R10C11))=R1C,RC4,NA()) -> NA() | I487: =IF(INDIRECT(ADDRESS(RC1,2,3,1,Menus!R10C11))=R1C,RC4,NA()) -> NA() | J487: =IF(INDIRECT(ADDRESS(RC1,1,3,1,Menus!R10C11))=T(R1C),RC4,NA()) -> NA() | K487: =IF(OR(ISNUMBER(RC7),ISNUMBER(RC8),ISNUMBER(RC9),ISNUMBER(RC10)),1,0) -> 0 | M487: =OFFSET(INDIRECT(ADDRESS(RC1,3,3,1,"Gross")),0,Menus!R4C10) -> 0 | N487: =OFFSET(INDIRECT(ADDRESS(RC1,3,3,1,"Gross")),0,Menus!R3C10) -> 0
A488: 3 | B488: =OFFSET(INDIRECT(ADDRESS(RC1,3,3,1,Menus!R10C11)),0,Menus!R4C10) -> 767 | C488: =OFFSET(INDIRECT(ADDRESS(RC1,3,3,1,Menus!R10C11)),0,Menus!R3C10) -> 2673385 | D488: =IF(Menus!R9C10,RC[-1]/RC[-2],RC[-1]) -> 3485.5084745762711 | E488: =IF(RC11=1,VALUE(RC[-3]),NA()) -> NA() | F488: =INDIRECT(ADDRESS(RC1,1,3,1,Menus!R10C11)) -> Czech Republic | G488: =IF(INDIRECT(ADDRESS(RC1,2,3,1,Menus!R10C11))=R1C,RC4,NA()) -> NA() | H488: =IF(INDIRECT(ADDRESS(RC1,2,3,1,Menus!R10C11))=R1C,RC4,NA()) -> NA() | I488: =IF(INDIRECT(ADDRESS(RC1,2,3,1,Menus!R10C11))=R1C,RC4,NA()) -> NA() | J488: =IF(INDIRECT(ADDRESS(RC1,1,3,1,Menus!R10C11))=T(R1C),RC4,NA()) -> NA() | K488: =IF(OR(ISNUMBER(RC7),ISNUMBER(RC8),ISNUMBER(RC9),ISNUMBER(RC10)),1,0) -> 0 | M488: =OFFSET(INDIRECT(ADDRESS(RC1,3,3,1,"Gross")),0,Menus!R4C10) -> 0 | N488: =OFFSET(INDIRECT(ADDRESS(RC1,3,3,1,"Gross")),0,Menus!R3C10) -> 2
A489: 5 | B489: =OFFSET(INDIRECT(ADDRESS(RC1,3,3,1,Menus!R10C11)),0,Menus!R4C10) -> 1401 | C489: =OFFSET(INDIRECT(ADDRESS(RC1,3,3,1,Menus!R10C11)),0,Menus!R3C10) -> 4490076 | D489: =IF(Menus!R9C10,RC[-1]/RC[-2],RC[-1]) -> 3204.9079229122058 | E489: =IF(RC11=1,VALUE(RC[-3]),NA()) -> NA() | F489: =INDIRECT(ADDRESS(RC1,1,3,1,Menus!R10C11)) -> Hungary | G489: =IF(INDIRECT(ADDRESS(RC1,2,3,1,Menus!R10C11))=R1C,RC4,NA()) -> NA() | H489: =IF(INDIRECT(ADDRESS(RC1,2,3,1,Menus!R10C11))=R1C,RC4,NA()) -> NA() | I489: =IF(INDIRECT(ADDRESS(RC1,2,3,1,Menus!R10C11))=R1C,RC4,NA()) -> NA() | J489: =IF(INDIRECT(ADDRESS(RC1,1,3,1,Menus!R10C11))=T(R1C),RC4,NA()) -> NA() | K489: =IF(OR(ISNUMBER(RC7),ISNUMBER(RC8),ISNUMBER(RC9),ISNUMBER(RC10)),1,0) -> 0 | M489: =OFFSET(INDIRECT(ADDRESS(RC1,3,3,1,"Gross")),0,Menus!R4C10) -> 1 | N489: =OFFSET(INDIRECT(ADDRESS(RC1,3,3,1,"Gross")),0,Menus!R3C10) -> 1
A490: 11 | B490: =OFFSET(INDIRECT(ADDRESS(RC1,3,3,1,Menus!R10C11)),0,Menus!R4C10) -> 356 | C490: =OFFSET(INDIRECT(ADDRESS(RC1,3,3,1,Menus!R10C11)),0,Menus!R3C10) -> 1005555 | D490: =IF(Menus!R9C10,RC[-1]/RC[-2],RC[-1]) -> 2824.5926966292136 | E490: =IF(RC11=1,VALUE(RC[-3]),NA()) -> NA() | F490: =INDIRECT(ADDRESS(RC1,1,3,1,Menus!R10C11)) -> Slovenia | G490: =IF(INDIRECT(ADDRESS(RC1,2,3,1,Menus!R10C11))=R1C,RC4,NA()) -> NA() | H490: =IF(INDIRECT(ADDRESS(RC1,2,3,1,Menus!R10C11))=R1C,RC4,NA()) -> NA() | I490: =IF(INDIRECT(ADDRESS(RC1,2,3,1,Menus!R10C11))=R1C,RC4,NA()) -> NA() | J490: =IF(INDIRECT(ADDRESS(RC1,1,3,1,Menus!R10C11))=T(R1C),RC4,NA()) -> NA() | K490: =IF(OR(ISNUMBER(RC7),ISNUMBER(RC8),ISNUMBER(RC9),ISNUMBER(RC10)),1,0) -> 0 | M490: =OFFSET(INDIRECT(ADDRESS(RC1,3,3,1,"Gross")),0,Menus!R4C10) -> 0 | N490: =OFFSET(INDIRECT(ADDRESS(RC1,3,3,1,"Gross")),0,Menus!R3C10) -> 1
A491: 6 | B491: =OFFSET(INDIRECT(ADDRESS(RC1,3,3,1,Menus!R10C11)),0,Menus!R4C10) -> 405 | C491: =OFFSET(INDIRECT(ADDRESS(RC1,3,3,1,Menus!R10C11)),0,Menus!R3C10) -> 1106524 | D491: =IF(Menus!R9C10,RC[-1]/RC[-2],RC[-1]) -> 2732.1580246913582 | E491: =IF(RC11=1,VALUE(RC[-3]),NA()) -> NA() | F491: =INDIRECT(ADDRESS(RC1,1,3,1,Menus!R10C11)) -> Latvia | G491: =IF(INDIRECT(ADDRESS(RC1,2,3,1,Menus!R10C11))=R1C,RC4,NA()) -> NA() | H491: =IF(INDIRECT(ADDRESS(RC1,2,3,1,Menus!R10C11))=R1C,RC4,NA()) -> NA() | I491: =IF(INDIRECT(ADDRESS(RC1,2,3,1,Menus!R10C11))=R1C,RC4,NA()) -> NA() | J491: =IF(INDIRECT(ADDRESS(RC1,1,3,1,Menus!R10C11))=T(R1C),RC4,NA()) -> NA() | K491: =IF(OR(ISNUMBER(RC7),ISNUMBER(RC8),ISNUMBER(RC9),ISNUMBER(RC10)),1,0) -> 0 | M491: =OFFSET(INDIRECT(ADDRESS(RC1,3,3,1,"Gross")),0,Menus!R4C10) -> 0 | N491: =OFFSET(INDIRECT(ADDRESS(RC1,3,3,1,"Gross")),0,Menus!R3C10) -> 0
A492: 7 | B492: =OFFSET(INDIRECT(ADDRESS(RC1,3,3,1,Menus!R10C11)),0,Menus!R4C10) -> 686 | C492: =OFFSET(INDIRECT(ADDRESS(RC1,3,3,1,Menus!R10C11)),0,Menus!R3C10) -> 1856644 | D492: =IF(Menus!R9C10,RC[-1]/RC[-2],RC[-1]) -> 2706.4781341107873 | E492: =IF(RC11=1,VALUE(RC[-3]),NA()) -> NA() | F492: =INDIRECT(ADDRESS(RC1,1,3,1,Menus!R10C11)) -> Lithuania | G492: =IF(INDIRECT(ADDRESS(RC1,2,3,1,Menus!R10C11))=R1C,RC4,NA()) -> NA() | H492: =IF(INDIRECT(ADDRESS(RC1,2,3,1,Menus!R10C11))=R1C,RC4,NA()) -> NA() | I492: =IF(INDIRECT(ADDRESS(RC1,2,3,1,Menus!R10C11))=R1C,RC4,NA()) -> NA() | J492: =IF(INDIRECT(ADDRESS(RC1,1,3,1,Menus!R10C11))=T(R1C),RC4,NA()) -> NA() | K492: =IF(OR(ISNUMBER(RC7),ISNUMBER(RC8),ISNUMBER(RC9),ISNUMBER(RC10)),1,0) -> 0 | M492: =OFFSET(INDIRECT(ADDRESS(RC1,3,3,1,"Gross")),0,Menus!R4C10) -> 0 | N492: =OFFSET(INDIRECT(ADDRESS(RC1,3,3,1,"Gross")),0,Menus!R3C10) -> 0
A493: 46 | B493: =OFFSET(INDIRECT(ADDRESS(RC1,3,3,1,Menus!R10C11)),0,Menus!R4C10) -> 11413 | C493: =OFFSET(INDIRECT(ADDRESS(RC1,3,3,1,Menus!R10C11)),0,Menus!R3C10) -> 28300167 | D493: =IF(Menus!R9C10,RC[-1]/RC[-2],RC[-1]) -> 2479.6431262595288 | E493: =IF(RC11=1,VALUE(RC[-3]),NA()) -> NA() | F493: =INDIRECT(ADDRESS(RC1,1,3,1,Menus!R10C11)) -> EU Accession Countries - Totals | G493: =IF(INDIRECT(ADDRESS(RC1,2,3,1,Menus!R10C11))=R1C,RC4,NA()) -> NA() | H493: =IF(INDIRECT(ADDRESS(RC1,2,3,1,Menus!R10C11))=R1C,RC4,NA()) -> NA() | I493: =IF(INDIRECT(ADDRESS(RC1,2,3,1,Menus!R10C11))=R1C,RC4,NA()) -> NA() | J493: =IF(INDIRECT(ADDRESS(RC1,1,3,1,Menus!R10C11))=T(R1C),RC4,NA()) -> NA() | K493: =IF(OR(ISNUMBER(RC7),ISNUMBER(RC8),ISNUMBER(RC9),ISNUMBER(RC10)),1,0) -> 0 | M493: =OFFSET(INDIRECT(ADDRESS(RC1,3,3,1,"Gross")),0,Menus!R4C10) -> 0 | N493: =OFFSET(INDIRECT(ADDRESS(RC1,3,3,1,"Gross")),0,Menus!R3C10) -> 0
A494: 10 | B494: =OFFSET(INDIRECT(ADDRESS(RC1,3,3,1,Menus!R10C11)),0,Menus!R4C10) -> 498 | C494: =OFFSET(INDIRECT(ADDRESS(RC1,3,3,1,Menus!R10C11)),0,Menus!R3C10) -> 1189740 | D494: =IF(Menus!R9C10,RC[-1]/RC[-2],RC[-1]) -> 2389.0361445783133 | E494: =IF(RC11=1,VALUE(RC[-3]),NA()) -> NA() | F494: =INDIRECT(ADDRESS(RC1,1,3,1,Menus!R10C11)) -> Slovak Rep | G494: =IF(INDIRECT(ADDRESS(RC1,2,3,1,Menus!R10C11))=R1C,RC4,NA()) -> NA() | H494: =IF(INDIRECT(ADDRESS(RC1,2,3,1,Menus!R10C11))=R1C,RC4,NA()) -> NA() | I494: =IF(INDIRECT(ADDRESS(RC1,2,3,1,Menus!R10C11))=R1C,RC4,NA()) -> NA() | J494: =IF(INDIRECT(ADDRESS(RC1,1,3,1,Menus!R10C11))=T(R1C),RC4,NA()) -> NA() | K494: =IF(OR(ISNUMBER(RC7),ISNUMBER(RC8),ISNUMBER(RC9),ISNUMBER(RC10)),1,0) -> 0 | M494: =OFFSET(INDIRECT(ADDRESS(RC1,3,3,1,"Gross")),0,Menus!R4C10) -> 0 | N494: =OFFSET(INDIRECT(ADDRESS(RC1,3,3,1,"Gross")),0,Menus!R3C10) -> 0
A495: 41 | B495: =OFFSET(INDIRECT(ADDRESS(RC1,3,3,1,Menus!R10C11)),0,Menus!R4C10) -> 15703 | C495: =OFFSET(INDIRECT(ADDRESS(RC1,3,3,1,Menus!R10C11)),0,Menus!R3C10) -> 33263888 | D495: =IF(Menus!R9C10,RC[-1]/RC[-2],RC[-1]) -> 2118.3142074762786 | E495: =IF(RC11=1,VALUE(RC[-3]),NA()) -> NA() | F495: =INDIRECT(ADDRESS(RC1,1,3,1,Menus!R10C11)) -> CEE - Total | G495: =IF(INDIRECT(ADDRESS(RC1,2,3,1,Menus!R10C11))=R1C,RC4,NA()) -> NA() | H495: =IF(INDIRECT(ADDRESS(RC1,2,3,1,Menus!R10C11))=R1C,RC4,NA()) -> NA() | I495: =IF(INDIRECT(ADDRESS(RC1,2,3,1,Menus!R10C11))=R1C,RC4,NA()) -> NA() | J495: =IF(INDIRECT(ADDRESS(RC1,1,3,1,Menus!R10C11))=T(R1C),RC4,NA()) -> NA() | K495: =IF(OR(ISNUMBER(RC7),ISNUMBER(RC8),ISNUMBER(RC9),ISNUMBER(RC10)),1,0) -> 0 | M495: =OFFSET(INDIRECT(ADDRESS(RC1,3,3,1,"Gross")),0,Menus!R4C10) -> 0 | N495: =OFFSET(INDIRECT(ADDRESS(RC1,3,3,1,"Gross")),0,Menus!R3C10) -> 0
A496: 34 | B496: =OFFSET(INDIRECT(ADDRESS(RC1,3,3,1,Menus!R10C11)),0,Menus!R4C10) -> 1518 | C496: =OFFSET(INDIRECT(ADDRESS(RC1,3,3,1,Menus!R10C11)),0,Menus!R3C10) -> 2938235 | D496: =IF(Menus!R9C10,RC[-1]/RC[-2],RC[-1]) -> 1935.5961791831357 | E496: =IF(RC11=1,VALUE(RC[-3]),NA()) -> NA() | F496: =INDIRECT(ADDRESS(RC1,1,3,1,Menus!R10C11)) -> Turkey | G496: =IF(INDIRECT(ADDRESS(RC1,2,3,1,Menus!R10C11))=R1C,RC4,NA()) -> NA() | H496: =IF(INDIRECT(ADDRESS(RC1,2,3,1,Menus!R10C11))=R1C,RC4,NA()) -> NA() | I496: =IF(INDIRECT(ADDRESS(RC1,2,3,1,Menus!R10C11))=R1C,RC4,NA()) -> NA() | J496: =IF(INDIRECT(ADDRESS(RC1,1,3,1,Menus!R10C11))=T(R1C),RC4,NA()) -> NA() | K496: =IF(OR(ISNUMBER(RC7),ISNUMBER(RC8),ISNUMBER(RC9),ISNUMBER(RC10)),1,0) -> 0 | M496: =OFFSET(INDIRECT(ADDRESS(RC1,3,3,1,"Gross")),0,Menus!R4C10) -> 2 | N496: =OFFSET(INDIRECT(ADDRESS(RC1,3,3,1,"Gross")),0,Menus!R3C10) -> 2
A497: 45 | B497: =OFFSET(INDIRECT(ADDRESS(RC1,3,3,1,Menus!R10C11)),0,Menus!R4C10) -> 3740 | C497: =OFFSET(INDIRECT(ADDRESS(RC1,3,3,1,Menus!R10C11)),0,Menus!R3C10) -> 6618301 | D497: =IF(Menus!R9C10,RC[-1]/RC[-2],RC[-1]) -> 1769.5991978609625 | E497: =IF(RC11=1,VALUE(RC[-3]),NA()) -> NA() | F497: =INDIRECT(ADDRESS(RC1,1,3,1,Menus!R10C11)) -> World B - Total | G497: =IF(INDIRECT(ADDRESS(RC1,2,3,1,Menus!R10C11))=R1C,RC4,NA()) -> NA() | H497: =IF(INDIRECT(ADDRESS(RC1,2,3,1,Menus!R10C11))=R1C,RC4,NA()) -> NA() | I497: =IF(INDIRECT(ADDRESS(RC1,2,3,1,Menus!R10C11))=R1C,RC4,NA()) -> NA() | J497: =IF(INDIRECT(ADDRESS(RC1,1,3,1,Menus!R10C11))=T(R1C),RC4,NA()) -> NA() | K497: =IF(OR(ISNUMBER(RC7),ISNUMBER(RC8),ISNUMBER(RC9),ISNUMBER(RC10)),1,0) -> 0 | M497: =OFFSET(INDIRECT(ADDRESS(RC1,3,3,1,"Gross")),0,Menus!R4C10) -> 0 | N497: =OFFSET(INDIRECT(ADDRESS(RC1,3,3,1,"Gross")),0,Menus!R3C10) -> 0
A498: 9 | B498: =OFFSET(INDIRECT(ADDRESS(RC1,3,3,1,Menus!R10C11)),0,Menus!R4C10) -> 3655 | C498: =OFFSET(INDIRECT(ADDRESS(RC1,3,3,1,Menus!R10C11)),0,Menus!R3C10) -> 6382567 | D498: =IF(Menus!R9C10,RC[-1]/RC[-2],RC[-1]) -> 1746.2563611491107 | E498: =IF(RC11=1,VALUE(RC[-3]),NA()) -> NA() | F498: =INDIRECT(ADDRESS(RC1,1,3,1,Menus!R10C11)) -> Romania | G498: =IF(INDIRECT(ADDRESS(RC1,2,3,1,Menus!R10C11))=R1C,RC4,NA()) -> NA() | H498: =IF(INDIRECT(ADDRESS(RC1,2,3,1,Menus!R10C11))=R1C,RC4,NA()) -> NA() | I498: =IF(INDIRECT(ADDRESS(RC1,2,3,1,Menus!R10C11))=R1C,RC4,NA()) -> NA() | J498: =IF(INDIRECT(ADDRESS(RC1,1,3,1,Menus!R10C11))=T(R1C),RC4,NA()) -> NA() | K498: =IF(OR(ISNUMBER(RC7),ISNUMBER(RC8),ISNUMBER(RC9),ISNUMBER(RC10)),1,0) -> 0 | M498: =OFFSET(INDIRECT(ADDRESS(RC1,3,3,1,"Gross")),0,Menus!R4C10) -> 2 | N498: =OFFSET(INDIRECT(ADDRESS(RC1,3,3,1,"Gross")),0,Menus!R3C10) -> 2
A499: 8 | B499: =OFFSET(INDIRECT(ADDRESS(RC1,3,3,1,Menus!R10C11)),0,Menus!R4C10) -> 6549 | C499: =OFFSET(INDIRECT(ADDRESS(RC1,3,3,1,Menus!R10C11)),0,Menus!R3C10) -> 11210209 | D499: =IF(Menus!R9C10,RC[-1]/RC[-2],RC[-1]) -> 1711.7436249809132 | E499: =IF(RC11=1,VALUE(RC[-3]),NA()) -> NA() | F499: =INDIRECT(ADDRESS(RC1,1,3,1,Menus!R10C11)) -> Poland | G499: =IF(INDIRECT(ADDRESS(RC1,2,3,1,Menus!R10C11))=R1C,RC4,NA()) -> NA() | H499: =IF(INDIRECT(ADDRESS(RC1,2,3,1,Menus!R10C11))=R1C,RC4,NA()) -> NA() | I499: =IF(INDIRECT(ADDRESS(RC1,2,3,1,Menus!R10C11))=R1C,RC4,NA()) -> NA() | J499: =IF(INDIRECT(ADDRESS(RC1,1,3,1,Menus!R10C11))=T(R1C),RC4,NA()) -> NA() | K499: =IF(OR(ISNUMBER(RC7),ISNUMBER(RC8),ISNUMBER(RC9),ISNUMBER(RC10)),1,0) -> 0 | M499: =OFFSET(INDIRECT(ADDRESS(RC1,3,3,1,"Gross")),0,Menus!R4C10) -> 2 | N499: =OFFSET(INDIRECT(ADDRESS(RC1,3,3,1,"Gross")),0,Menus!R3C10) -> 2
A500: 40 | B500: =OFFSET(INDIRECT(ADDRESS(RC1,3,3,1,Menus!R10C11)),0,Menus!R4C10) -> 2222 | C500: =OFFSET(INDIRECT(ADDRESS(RC1,3,3,1,Menus!R10C11)),0,Menus!R3C10) -> 3680066 | D500: =IF(Menus!R9C10,RC[-1]/RC[-2],RC[-1]) -> 1656.1953195319531 | E500: =IF(RC11=1,VALUE(RC[-3]),NA()) -> NA() | F500: =INDIRECT(ADDRESS(RC1,1,3,1,Menus!R10C11)) -> Mexico | G500: =IF(INDIRECT(ADDRESS(RC1,2,3,1,Menus!R10C11))=R1C,RC4,NA()) -> NA() | H500: =IF(INDIRECT(ADDRESS(RC1,2,3,1,Menus!R10C11))=R1C,RC4,NA()) -> NA() | I500: =IF(INDIRECT(ADDRESS(RC1,2,3,1,Menus!R10C11))=R1C,RC4,NA()) -> NA() | J500: =IF(INDIRECT(ADDRESS(RC1,1,3,1,Menus!R10C11))=T(R1C),RC4,NA()) -> NA() | K500: =IF(OR(ISNUMBER(RC7),ISNUMBER(RC8),ISNUMBER(RC9),ISNUMBER(RC10)),1,0) -> 0 | M500: =OFFSET(INDIRECT(ADDRESS(RC1,3,3,1,"Gross")),0,Menus!R4C10) -> 2 | N500: =OFFSET(INDIRECT(ADDRESS(RC1,3,3,1,"Gross")),0,Menus!R3C10) -> 2
A501: 2 | B501: =OFFSET(INDIRECT(ADDRESS(RC1,3,3,1,Menus!R10C11)),0,Menus!R4C10) -> 808 | C501: =OFFSET(INDIRECT(ADDRESS(RC1,3,3,1,Menus!R10C11)),0,Menus!R3C10) -> 951033 | D501: =IF(Menus!R9C10,RC[-1]/RC[-2],RC[-1]) -> 1177.0210396039604 | E501: =IF(RC11=1,VALUE(RC[-3]),NA()) -> NA() | F501: =INDIRECT(ADDRESS(RC1,1,3,1,Menus!R10C11)) -> Bulgaria | G501: =IF(INDIRECT(ADDRESS(RC1,2,3,1,Menus!R10C11))=R1C,RC4,NA()) -> NA() | H501: =IF(INDIRECT(ADDRESS(RC1,2,3,1,Menus!R10C11))=R1C,RC4,NA()) -> NA() | I501: =IF(INDIRECT(ADDRESS(RC1,2,3,1,Menus!R10C11))=R1C,RC4,NA()) -> NA() | J501: =IF(INDIRECT(ADDRESS(RC1,1,3,1,Menus!R10C11))=T(R1C),RC4,NA()) -> NA() | K501: =IF(OR(ISNUMBER(RC7),ISNUMBER(RC8),ISNUMBER(RC9),ISNUMBER(RC10)),1,0) -> 0 | M501: =OFFSET(INDIRECT(ADDRESS(RC1,3,3,1,"Gross")),0,Menus!R4C10) -> 1 | N501: =OFFSET(INDIRECT(ADDRESS(RC1,3,3,1,"Gross")),0,Menus!R3C10) -> 1

Sheet: Welcome
D7: LibEcon - Tertiary Libraries
D9: The data in this database comes from
D10: returns at 27/10/03, and relates to the
D11: years 1997 to 2001.
D13: Scatter plots, histograms, rankings, editing
D14: data, peer groups, are all possible using this
D15: database. See the Help sheet for instructions.
D17: Martin Jennings
D18: 2003

Sheet: Dialogbox
B24: Totals include figures for all countries covered by LibEcon
B25: The year 2001 grossed shows real and grossed data based on previous years returns and country type averages
B26: To view data quality see 'Ranking' sheet
B27: All totals for all years shown relate to grossed data
B28: EU Accession Country Totals included estimates for Cyprus and Malta
B30: This introductory section gives a short overview of the Belgian institutional
B31: structure in order to help understanding the way libraries are organized in
B32: Belgium.
B33: The reforms of the State implemented in 1980, 1988, 1993 and 2001 have led to
B34: Belgium being turned into a federal country. Belgium consists of three geographical
B35: (and economic) regions - the Flemish Region, the Walloon Region and the Brussels-
B36: Capital Region – and three cultural communities – the Flemish Community (Vlaamse
B37: Gemeenschap), the French Community (Communauté Française) and the German-
B38: speaking Community. The three cultural (and speech) communities are a product of
B39: history: the country is situated at the junction between the Latin and Germanic
B40: languages: French, Dutch and German.
B42: As a result of the reforms, the decision-making power is no longer exclusively in the
B43: hands of the Federal Parliament and the Federal Government. Each of the
B44: Communities and Regions has a Parliament and a Government too.
B46: The Communities are essentially competent for culture (including museums, libraries
B47: and archives) and education and the so-called personalized matters related to health
B48: policy (health care policy and health education) and to assistance to individuals
B49: (family, youth, elderly, etc). The Regions are responsible in particular for the fields of
B50: the economy, energy (nuclear energy remains, however, a federal competence),
B51: public works, agriculture, the environment and transport. The federal authority retains
B52: among others: the foreign affairs, defence, justice, finances, social security, important
B53: sectors of public health and domestic affairs, etc. It supports also the activities of a
B54: series of federal scientific and cultural institutions.
B56: Organisational framework for the libraries
B57: The public competences in the sector of libraries are widely spread among the federal
B58: entities. Except the Royal Library (and the libraries of the federal scientific and cultural
B59: institutions) which is placed under the responsibility of the Belgian Federal Science
B60: Policy Office, the other scientific and public libraries lie with the Flemish, French and
B61: German-speaking Communities or even with the provincial and local authorities.
B63: The policies regarding public libraries are defined since 1978 by Community decrees
B64: and implemented by a special administration for public libraries located within the
B65: ministries of Culture of the Communities. Higher Councils for public libraries (advisory
B66: bodies) have also been installed in the Flemish and the French Communities.
B68: The university libraries are placed under the authority of the leading bodies of each
B69: university. There is no central administration responsible at Community level for these
B70: libraries.

Sheet: Help
J1: Information included within the LIBECON database
B3: DATA STRUCTURE | J3: Shown in order of appearance on database and questionnaire
B5: Data is split into 6 sheets all with the same data structure and order. | J5: See www.libecon.org for questionnaires and guidance notes
B6: The data includes the 5 years of data 1997 to 2001. Also included is 'Grossed' data for 2001, this
B7: shows 'real' submitted data, data estimated from previous years submissions or data based on | J7: NON-FINANCIAL INFORMATION
B8: country type averages. To identify the type of data for each country goto the 'Ranking' sheet, further
B9: explanation is given in the 'Data types' section of this help sheet. | J9: Potential Population Served '000s (this will vary with library sector)
B11: The data is set out in the order of the questionnaires, with population (000's) in the first data column. | I11: LIBRARIES:
B12: The non-financial data comes first with the financial data following. | J12: Total Administrative Units
B13: The countries are grouped by TYPE the default being "EU", "CEE", "EFTA", "World A" and | J13: Service Points
B14: "World B". For a list of the country groups click here.
B15: "Totals" shows the grossed totals for these regions. | I15: COLLECTIONS:
J16: Books & Bound Periodicals
B17: At the top of the Dialogbox sheet you can select the type of library you wish to use. Then select | J17: Current Periodicals - Titles
B18: an X and Y value to compare (this will extract data from the datasheets for these two indicators). | J18: Current Periodicals - Subscriptions
B19: The Y value will show up on the Histogram (or bar chart) or can be shown divided by the X value | J19: Manuscripts
B20: if the 'y/x plot' box is ticked. | J20: Microforms
J21: Audio-visual Materials
B22: Alternatively the data can be viewed on a scatter plot. To add a trend line click on 'Chart' | J22: CD-ROMs
B23: 'Add trendline'.
I24: ADDITIONS:
B25: Rankings can be viewed via the histogram or scatter graphs. The rankings will be based on the | J25: Books & Bound Periodicals
B26: y value, or y divided by x if the 'y/x plot' box is ticked. | J26: Audio-visual Materials
I28: FACILITIES & SERVICES:
J29: Percentage Stock on Open Access
B30: CHANGING COMPARATOR GROUPS | J30: Percentage Catalogue Records Automated
J31: Number of Workstations for users
B32: To change the comparator group settings simply edit the second column in the 2001 Grossed data | J32: - Number connected to the internet (included above)
B33: sheet. Then the relevant Country Type(s) needs to be changed as required on the Dialogbox sheet.
B34: Press the 'Update Type' to display the new options before reusing the model. | I34: USE AND USERS:
J35: Registered Users
B36: This may be useful for identifying regions such as; 'Baltic States' , 'Eastern Europe' etc. or for | J36: Loan Transactions / Consultations
B37: singling out individual countries to be shown. | J37: Number of Visits
J38: Number of virtual referrals and transactions (Public Libraries only)
B39: As an example, copy highlighted column in row D by pressing this button. | J39: Number of virtual visits to networked library services (Public Libraries only)
B40: Paste this into Cell B2 of sheet '2001 Grossed', then return to the 'Dialogbox' | J40: Potential Total Population Served
B41: sheet and press the 'Update Type' button.
J42: NUMBER OF STAFF
I44: LIBRARY STAFF (Full-time equivalent):
B45: USER NOTES | J45: Trained Librarians
J46: Other Library Staff
B47: To enter or edit data, simply use the relevant "data" sheet. The columns are already headed to | J47: Total Staff
B48: indicate how to enter your data. Put additional countries or information in the next available row
B49: or column respectively. For example, a group of columns can be summed together to form one | J49: FINANCIAL INFORMATION
B50: column at the end of the database. Editing cells, copying, pasting, and sorting columns or rows is
B51: OK, but please do not insert rows or move cells around on the "data" worksheet. Functions in
B52: other worksheets refer to them, and moving or inserting columns and rows will affect the formulae. | I52: RECURRENT EXPENDITURE (Expressed in Euros, outturn prices):
J53: Staff
J54: Acquisition of Stock
J55: Electronic Information
B56: DATA TYPES | J56: Automation
J57: Premises and Related Costs
B58: Data is shown in three forms. | J58: New Buildings / Refurbishment
B59: Returned Data - Data submitted by countries which has been split between the questionnaire | J59: Other Expenditure
B60: headings. ONLY returned data are shown in the 1997 to 2001 datasheets. | J60: TOTAL EXPENDITURE
B62: The following two data types only appear in the '2001 Grossed' datasheet. | I62: INCOME (Expressed in Euros, outturn prices):
B63: Based on returned data - Where information was not split between questionnaire headings given | J63: Public Funding
B64: figures have been spread over relevant headings in line with country type ratios. Also, where data | J64: Fees & Charges
B65: has been submitted in previous years, but not in 2001 then previous years financial figures have been | J65: Other Income
B66: increased or decreased in line with the trend for the relevant country type. | J66: TOTAL INCOME
B67: Grossed on class averages - Where no information has been given for any years previously,
B68: figures have been estimated using population served (dependant on library type) and country type | I68: CAPITAL EXPENDITURE (not included above):
B69: averages. (The Gross sheet indicates the data type 0 for returned, 1 for based on returned and | J69: New Buildings / Refurbishment
B70: 2 for grossed on class averages.
J71: Acquisition of Stock
B72: Hence, the returned and based on returned data will show an accurate reflexion of countries' | J72: Automation
B73: activity and expenditure, but the data grossed on class averages will only give an approxiamte | J73: Other Capital Expenditure
B74: estimate of the situation and should therefore not be used for serious comparisons. | J74: TOTAL CAPITAL PAYMENTS
B78: CONTACT
B80: If you have any questions or comments please contact Martin Jennings on;
B82: martin.jennings@ipf.co.uk or at
B84: IPF Ltd
B85: 6th Floor, NLA Tower
B86: 12 - 16 Addiscombe Road
B87: Croydon
B88: CR0 0XT
B89: UK
B91: Tel: 020 8667 8530
B94: Country Name | C94: Type | D94: Region (Example)
B95: Bulgaria | C95: CEE | D95: Eastern Europe
B96: Czech Republic | C96: CEE | D96: Eastern Europe
B97: Estonia | C97: CEE | D97: Baltic States
B98: Hungary | C98: CEE | D98: Eastern Europe
B99: Latvia | C99: CEE | D99: Baltic States
B100: Lithuania | C100: CEE | D100: Baltic States
B101: Poland | C101: CEE | D101: Eastern Europe
B102: Romania | C102: CEE | D102: Eastern Europe
B103: Slovak Rep | C103: CEE | D103: Eastern Europe
B104: Slovenia | C104: CEE | D104: Eastern Europe
B105: Iceland | C105: EFTA | D105: Northern Europe
B106: Liechtenstein | C106: EFTA | D106: Central Europe
B107: Norway | C107: EFTA | D107: Northern Europe
B108: Switzerland | C108: EFTA | D108: Central Europe
B109: Austria | C109: EU | D109: Central Europe
B110: Belgium | C110: EU | D110: Central Europe
B111: Denmark | C111: EU | D111: Northern Europe
B112: Eire | C112: EU | D112: Central Europe
B113: Finland | C113: EU | D113: Northern Europe
B114: France | C114: EU | D114: Central Europe
B115: Germany | C115: EU | D115: Central Europe
B116: Greece | C116: EU | D116: Southern Europe
B117: Italy | C117: EU | D117: Southern Europe
B118: Luxembourg | C118: EU | D118: Central Europe
B119: Netherlands | C119: EU | D119: Central Europe
B120: Portugal | C120: EU | D120: Southern Europe
B121: Spain | C121: EU | D121: Southern Europe
B122: Sweden | C122: EU | D122: Northern Europe
B123: UK | C123: EU | D123: Central Europe
B124: Australia | C124: World - A | D124: Australasia
B125: Canada | C125: World - A | D125: Northern America
B126: Japan | C126: World - A | D126: Asia
B127: Korea | C127: World - A | D127: Asia
B128: New Zealand | C128: World - A | D128: Australasia
B129: USA | C129: World - A | D129: Northern America
B130: Mexico | C130: World - B | D130: Rest of the World
B131: Turkey | C131: World - B | D131: Rest of the World

Sheet: Menus
A1: Parameters (transposed from Data sheet) | B1: Row | C1: Names (from selected data sheet) | D1: Types (from selected data sheet) | F1: Types (pivot-tabled) | I1: Currently selected parameters (generated by dialog box) | N1: Data sheets
A2: =TRANSPOSE(INDIRECT(ADDRESS(1,4,3,1,Menus!R10C11)):INDIRECT(ADDRESS(1,256,3,1,Menus!R10C11))) -> Staff & Students '000s | B2: 2 | C2: =INDIRECT(ADDRESS(RC2,1,3,1,Menus!R10C11)) -> Bulgaria | D2: =INDIRECT(ADDRESS(RC2,2,3,1,Menus!R10C11)) -> CEE | F2: Count of Types (from selected data sheet) | I2: Box | J2: Menu position | N2: 2001
A3: Libraries - Total Administrative Units | B3: 3 | C3: =INDIRECT(ADDRESS(RC2,1,3,1,Menus!R10C11)) -> Czech Republic | D3: =INDIRECT(ADDRESS(RC2,2,3,1,Menus!R10C11)) -> CEE | F3: Types (from selected data sheet) | G3: Total | I3: x param | J3: 24 | L3: from param list | N3: 2000
A4: Libraries - Service Points | B4: 4 | C4: =INDIRECT(ADDRESS(RC2,1,3,1,Menus!R10C11)) -> Estonia | D4: =INDIRECT(ADDRESS(RC2,2,3,1,Menus!R10C11)) -> CEE | F4: 0 | G4: 455 | I4: y param | J4: 23 | L4: from param list | N4: 1999
A5: Collections - Books & Bound Periodicals | B5: 5 | C5: =INDIRECT(ADDRESS(RC2,1,3,1,Menus!R10C11)) -> Hungary | D5: =INDIRECT(ADDRESS(RC2,2,3,1,Menus!R10C11)) -> CEE | F5: Totals | G5: 6 | I5: Type 1 | J5: 4 | K5: =INDEX(R[-1]C[-5]:R[49]C[-5],RC[-1]) -> EFTA | L5: from types | N5: 1998
A6: Collections - Current Periodicals - Titles | B6: 6 | C6: =INDIRECT(ADDRESS(RC2,1,3,1,Menus!R10C11)) -> Latvia | D6: =INDIRECT(ADDRESS(RC2,2,3,1,Menus!R10C11)) -> CEE | F6: CEE | G6: 10 | I6: Type 2 | J6: 5 | K6: =INDEX(R[-2]C[-5]:R[48]C[-5],RC[-1]) -> EU | L6: from types | N6: 1997
A7: Collections - Current Periodicals - Subscriptions | B7: 7 | C7: =INDIRECT(ADDRESS(RC2,1,3,1,Menus!R10C11)) -> Lithuania | D7: =INDIRECT(ADDRESS(RC2,2,3,1,Menus!R10C11)) -> CEE | F7: EFTA | G7: 4 | I7: Type 3 | J7: 8 | K7: =INDEX(R[-3]C[-5]:R[47]C[-5],RC[-1]) -> België Nederlandstalige Universiteiten | L7: from types | N7: 2001 Grossed
A8: Collections - Manuscripts | B8: 8 | C8: =INDIRECT(ADDRESS(RC2,1,3,1,Menus!R10C11)) -> Poland | D8: =INDIRECT(ADDRESS(RC2,2,3,1,Menus!R10C11)) -> CEE | F8: EU | G8: 15 | I8: Identify | J8: 12 | K8: =INDEX(R[-6]C[-8]:R[493]C[-8],RC[-1]) -> België Nederlandstalige Universiteiten | L8: from data
A9: Collections - Microforms | B9: 9 | C9: =INDIRECT(ADDRESS(RC2,1,3,1,Menus!R10C11)) -> Romania | D9: =INDIRECT(ADDRESS(RC2,2,3,1,Menus!R10C11)) -> CEE | F9: World - A | G9: 6 | I9: Plot y/x | J9: 1
A10: Collections - Audio-visual Materials | B10: 10 | C10: =INDIRECT(ADDRESS(RC2,1,3,1,Menus!R10C11)) -> Slovak Rep | D10: =INDIRECT(ADDRESS(RC2,2,3,1,Menus!R10C11)) -> CEE | F10: World - B | G10: 2 | I10: Data sheet | J10: 6 | K10: =INDEX(R[-8]C[3]:R[41]C[3],RC[-1]) -> 2001 Grossed | L10: from data sheets list
A11: Collections - CD-ROMs | B11: 11 | C11: =INDIRECT(ADDRESS(RC2,1,3,1,Menus!R10C11)) -> Slovenia | D11: =INDIRECT(ADDRESS(RC2,2,3,1,Menus!R10C11)) -> CEE | F11: België Nederlandstalige Universiteiten | G11: 1 | K11: =IF(R[-1]C="2000 Grossed","Gross","") -> 
A12: Additions - Books & Bound Periodicals | B12: 12 | C12: =INDIRECT(ADDRESS(RC2,1,3,1,Menus!R10C11)) -> Austria | D12: =INDIRECT(ADDRESS(RC2,2,3,1,Menus!R10C11)) -> EU | F12: Belgique universités francophones | G12: 1
A13: Additions - Audio-visual Materials | B13: 13 | C13: =INDIRECT(ADDRESS(RC2,1,3,1,Menus!R10C11)) -> België Nederlandstalige Universiteiten | D13: =INDIRECT(ADDRESS(RC2,2,3,1,Menus!R10C11)) -> België Nederlandstalige Universiteiten
A14: Facilities & Services - Percentage Stock on Open Access | B14: 14 | C14: =INDIRECT(ADDRESS(RC2,1,3,1,Menus!R10C11)) -> Belgique universités francophones | D14: =INDIRECT(ADDRESS(RC2,2,3,1,Menus!R10C11)) -> Belgique universités francophones
A15: Facilities & Services - Percentage Catalogue Records Automated | B15: 15 | C15: =INDIRECT(ADDRESS(RC2,1,3,1,Menus!R10C11)) -> Belgium | D15: =INDIRECT(ADDRESS(RC2,2,3,1,Menus!R10C11)) -> EU
A16: Facilities & Services - Number of Workstations for users | B16: 16 | C16: =INDIRECT(ADDRESS(RC2,1,3,1,Menus!R10C11)) -> Denmark | D16: =INDIRECT(ADDRESS(RC2,2,3,1,Menus!R10C11)) -> EU
A17: Facilities & Services - Number connected to the internet | B17: 17 | C17: =INDIRECT(ADDRESS(RC2,1,3,1,Menus!R10C11)) -> Eire | D17: =INDIRECT(ADDRESS(RC2,2,3,1,Menus!R10C11)) -> EU
A18: Use & Users - Registered Users | B18: 18 | C18: =INDIRECT(ADDRESS(RC2,1,3,1,Menus!R10C11)) -> Finland | D18: =INDIRECT(ADDRESS(RC2,2,3,1,Menus!R10C11)) -> EU
A19: Use & Users - Consultations | B19: 19 | C19: =INDIRECT(ADDRESS(RC2,1,3,1,Menus!R10C11)) -> France | D19: =INDIRECT(ADDRESS(RC2,2,3,1,Menus!R10C11)) -> EU
A20: Use & Users - Number of Visits | B20: 20 | C20: =INDIRECT(ADDRESS(RC2,1,3,1,Menus!R10C11)) -> Greece | D20: =INDIRECT(ADDRESS(RC2,2,3,1,Menus!R10C11)) -> EU
A21: Use & Users - Staff & Students | B21: 21 | C21: =INDIRECT(ADDRESS(RC2,1,3,1,Menus!R10C11)) -> Iceland | D21: =INDIRECT(ADDRESS(RC2,2,3,1,Menus!R10C11)) -> EFTA
A22: Library Staff FTE - Trained Librarians | B22: 22 | C22: =INDIRECT(ADDRESS(RC2,1,3,1,Menus!R10C11)) -> Italy | D22: =INDIRECT(ADDRESS(RC2,2,3,1,Menus!R10C11)) -> EU
A23: Library Staff FTE - Other Library Staff | B23: 23 | C23: =INDIRECT(ADDRESS(RC2,1,3,1,Menus!R10C11)) -> Liechtenstein | D23: =INDIRECT(ADDRESS(RC2,2,3,1,Menus!R10C11)) -> EFTA
A24: Library Staff FTE - Total Staff | B24: 24 | C24: =INDIRECT(ADDRESS(RC2,1,3,1,Menus!R10C11)) -> Luxembourg | D24: =INDIRECT(ADDRESS(RC2,2,3,1,Menus!R10C11)) -> EU
A25: Recurrent Expenditure (Euros) - Staff | B25: 25 | C25: =INDIRECT(ADDRESS(RC2,1,3,1,Menus!R10C11)) -> Netherlands | D25: =INDIRECT(ADDRESS(RC2,2,3,1,Menus!R10C11)) -> EU
A26: Recurrent Expenditure (Euros) - Acquisition of Stock | B26: 26 | C26: =INDIRECT(ADDRESS(RC2,1,3,1,Menus!R10C11)) -> Norway | D26: =INDIRECT(ADDRESS(RC2,2,3,1,Menus!R10C11)) -> EFTA
A27: Recurrent Expenditure (Euros) - Electronic Information | B27: 27 | C27: =INDIRECT(ADDRESS(RC2,1,3,1,Menus!R10C11)) -> Portugal | D27: =INDIRECT(ADDRESS(RC2,2,3,1,Menus!R10C11)) -> EU
A28: Recurrent Expenditure (Euros) - Automation | B28: 28 | C28: =INDIRECT(ADDRESS(RC2,1,3,1,Menus!R10C11)) -> Spain | D28: =INDIRECT(ADDRESS(RC2,2,3,1,Menus!R10C11)) -> EU
A29: Recurrent Expenditure (Euros) - Premises and Related Costs | B29: 29 | C29: =INDIRECT(ADDRESS(RC2,1,3,1,Menus!R10C11)) -> Sweden | D29: =INDIRECT(ADDRESS(RC2,2,3,1,Menus!R10C11)) -> EU
A30: Recurrent Expenditure (Euros) - New Buildings / Refurbishment | B30: 30 | C30: =INDIRECT(ADDRESS(RC2,1,3,1,Menus!R10C11)) -> Switzerland | D30: =INDIRECT(ADDRESS(RC2,2,3,1,Menus!R10C11)) -> EFTA
A31: Recurrent Expenditure (Euros) - Other Expenditure | B31: 31 | C31: =INDIRECT(ADDRESS(RC2,1,3,1,Menus!R10C11)) -> UK | D31: =INDIRECT(ADDRESS(RC2,2,3,1,Menus!R10C11)) -> EU
A32: Recurrent Expenditure (Euros) - TOTAL EXPENDITURE | B32: 32 | C32: =INDIRECT(ADDRESS(RC2,1,3,1,Menus!R10C11)) -> Germany | D32: =INDIRECT(ADDRESS(RC2,2,3,1,Menus!R10C11)) -> EU
A33: Income - Public Funding | B33: 33 | C33: =INDIRECT(ADDRESS(RC2,1,3,1,Menus!R10C11)) -> USA | D33: =INDIRECT(ADDRESS(RC2,2,3,1,Menus!R10C11)) -> World - A
A34: Income - Fees & Charges | B34: 34 | C34: =INDIRECT(ADDRESS(RC2,1,3,1,Menus!R10C11)) -> Turkey | D34: =INDIRECT(ADDRESS(RC2,2,3,1,Menus!R10C11)) -> World - B
A35: Income - Other Income | B35: 35 | C35: =INDIRECT(ADDRESS(RC2,1,3,1,Menus!R10C11)) -> Australia | D35: =INDIRECT(ADDRESS(RC2,2,3,1,Menus!R10C11)) -> World - A
A36: Income - TOTAL INCOME | B36: 36 | C36: =INDIRECT(ADDRESS(RC2,1,3,1,Menus!R10C11)) -> Japan | D36: =INDIRECT(ADDRESS(RC2,2,3,1,Menus!R10C11)) -> World - A
A37: Capital Expenditure - New Buildings / Refurbishment | B37: 37 | C37: =INDIRECT(ADDRESS(RC2,1,3,1,Menus!R10C11)) -> Korea | D37: =INDIRECT(ADDRESS(RC2,2,3,1,Menus!R10C11)) -> World - A
A38: Capital Expenditure - Acquisition of Stock | B38: 38 | C38: =INDIRECT(ADDRESS(RC2,1,3,1,Menus!R10C11)) -> Canada | D38: =INDIRECT(ADDRESS(RC2,2,3,1,Menus!R10C11)) -> World - A
A39: Capital Expenditure - Automation | B39: 39 | C39: =INDIRECT(ADDRESS(RC2,1,3,1,Menus!R10C11)) -> New Zealand | D39: =INDIRECT(ADDRESS(RC2,2,3,1,Menus!R10C11)) -> World - A
A40: Capital Expenditure - Other Capital Expenditure | B40: 40 | C40: =INDIRECT(ADDRESS(RC2,1,3,1,Menus!R10C11)) -> Mexico | D40: =INDIRECT(ADDRESS(RC2,2,3,1,Menus!R10C11)) -> World - B
A41: Capital Expenditure - TOTAL CAPITAL PAYMENTS | B41: 41 | C41: =INDIRECT(ADDRESS(RC2,1,3,1,Menus!R10C11)) -> CEE - Total | D41: =INDIRECT(ADDRESS(RC2,2,3,1,Menus!R10C11)) -> Totals
A42: Additions | B42: 42 | C42: =INDIRECT(ADDRESS(RC2,1,3,1,Menus!R10C11)) -> EU - Total | D42: =INDIRECT(ADDRESS(RC2,2,3,1,Menus!R10C11)) -> Totals
A43: Loans per visit | B43: 43 | C43: =INDIRECT(ADDRESS(RC2,1,3,1,Menus!R10C11)) -> EFTA - Total | D43: =INDIRECT(ADDRESS(RC2,2,3,1,Menus!R10C11)) -> Totals
A44: Cost per pop | B44: 44 | C44: =INDIRECT(ADDRESS(RC2,1,3,1,Menus!R10C11)) -> World A - Total | D44: =INDIRECT(ADDRESS(RC2,2,3,1,Menus!R10C11)) -> Totals
A45: Users per 1000 pop | B45: 45 | C45: =INDIRECT(ADDRESS(RC2,1,3,1,Menus!R10C11)) -> World B - Total | D45: =INDIRECT(ADDRESS(RC2,2,3,1,Menus!R10C11)) -> Totals
A46: visits per 1000 pop | B46: 46 | C46: =INDIRECT(ADDRESS(RC2,1,3,1,Menus!R10C11)) -> EU Accession Countries - Totals | D46: =INDIRECT(ADDRESS(RC2,2,3,1,Menus!R10C11)) -> Totals
A47: Bookstock per 1000 pop | B47: 47 | C47: =INDIRECT(ADDRESS(RC2,1,3,1,Menus!R10C11)) -> 0 | D47: =INDIRECT(ADDRESS(RC2,2,3,1,Menus!R10C11)) -> 0
A48: Total stock per 1000 pop | B48: 48 | C48: =INDIRECT(ADDRESS(RC2,1,3,1,Menus!R10C11)) -> 0 | D48: =INDIRECT(ADDRESS(RC2,2,3,1,Menus!R10C11)) -> 0
A49: AV materials per 1000 pop | B49: 49 | C49: =INDIRECT(ADDRESS(RC2,1,3,1,Menus!R10C11)) -> 0 | D49: =INDIRECT(ADDRESS(RC2,2,3,1,Menus!R10C11)) -> 0
A50: 0 | B50: 50 | C50: =INDIRECT(ADDRESS(RC2,1,3,1,Menus!R10C11)) -> 0 | D50: =INDIRECT(ADDRESS(RC2,2,3,1,Menus!R10C11)) -> 0
A51: 0 | B51: 51 | C51: =INDIRECT(ADDRESS(RC2,1,3,1,Menus!R10C11)) -> 0 | D51: =INDIRECT(ADDRESS(RC2,2,3,1,Menus!R10C11)) -> 0
A52: 0 | B52: 52 | C52: =INDIRECT(ADDRESS(RC2,1,3,1,Menus!R10C11)) -> 0 | D52: =INDIRECT(ADDRESS(RC2,2,3,1,Menus!R10C11)) -> 0
A53: 0 | B53: 53 | C53: =INDIRECT(ADDRESS(RC2,1,3,1,Menus!R10C11)) -> 0 | D53: =INDIRECT(ADDRESS(RC2,2,3,1,Menus!R10C11)) -> 0
A54: 0 | B54: 54 | C54: =INDIRECT(ADDRESS(RC2,1,3,1,Menus!R10C11)) -> 0 | D54: =INDIRECT(ADDRESS(RC2,2,3,1,Menus!R10C11)) -> 0
A55: 0 | B55: 55 | C55: =INDIRECT(ADDRESS(RC2,1,3,1,Menus!R10C11)) -> 0 | D55: =INDIRECT(ADDRESS(RC2,2,3,1,Menus!R10C11)) -> 0
A56: 0 | B56: 56 | C56: =INDIRECT(ADDRESS(RC2,1,3,1,Menus!R10C11)) -> 0 | D56: =INDIRECT(ADDRESS(RC2,2,3,1,Menus!R10C11)) -> 0
A57: 0 | B57: 57 | C57: =INDIRECT(ADDRESS(RC2,1,3,1,Menus!R10C11)) -> 0 | D57: =INDIRECT(ADDRESS(RC2,2,3,1,Menus!R10C11)) -> 0
A58: 0 | B58: 58 | C58: =INDIRECT(ADDRESS(RC2,1,3,1,Menus!R10C11)) -> 0 | D58: =INDIRECT(ADDRESS(RC2,2,3,1,Menus!R10C11)) -> 0
A59: 0 | B59: 59 | C59: =INDIRECT(ADDRESS(RC2,1,3,1,Menus!R10C11)) -> 0 | D59: =INDIRECT(ADDRESS(RC2,2,3,1,Menus!R10C11)) -> 0
A60: 0 | B60: 60 | C60: =INDIRECT(ADDRESS(RC2,1,3,1,Menus!R10C11)) -> 0 | D60: =INDIRECT(ADDRESS(RC2,2,3,1,Menus!R10C11)) -> 0
A61: 0 | B61: 61 | C61: =INDIRECT(ADDRESS(RC2,1,3,1,Menus!R10C11)) -> 0 | D61: =INDIRECT(ADDRESS(RC2,2,3,1,Menus!R10C11)) -> 0
A62: 0 | B62: 62 | C62: =INDIRECT(ADDRESS(RC2,1,3,1,Menus!R10C11)) -> 0 | D62: =INDIRECT(ADDRESS(RC2,2,3,1,Menus!R10C11)) -> 0
A63: 0 | B63: 63 | C63: =INDIRECT(ADDRESS(RC2,1,3,1,Menus!R10C11)) -> 0 | D63: =INDIRECT(ADDRESS(RC2,2,3,1,Menus!R10C11)) -> 0
A64: 0 | B64: 64 | C64: =INDIRECT(ADDRESS(RC2,1,3,1,Menus!R10C11)) -> 0 | D64: =INDIRECT(ADDRESS(RC2,2,3,1,Menus!R10C11)) -> 0
A65: 0 | B65: 65 | C65: =INDIRECT(ADDRESS(RC2,1,3,1,Menus!R10C11)) -> 0 | D65: =INDIRECT(ADDRESS(RC2,2,3,1,Menus!R10C11)) -> 0
A66: 0 | B66: 66 | C66: =INDIRECT(ADDRESS(RC2,1,3,1,Menus!R10C11)) -> 0 | D66: =INDIRECT(ADDRESS(RC2,2,3,1,Menus!R10C11)) -> 0
A67: 0 | B67: 67 | C67: =INDIRECT(ADDRESS(RC2,1,3,1,Menus!R10C11)) -> 0 | D67: =INDIRECT(ADDRESS(RC2,2,3,1,Menus!R10C11)) -> 0
A68: 0 | B68: 68 | C68: =INDIRECT(ADDRESS(RC2,1,3,1,Menus!R10C11)) -> 0 | D68: =INDIRECT(ADDRESS(RC2,2,3,1,Menus!R10C11)) -> 0
A69: 0 | B69: 69 | C69: =INDIRECT(ADDRESS(RC2,1,3,1,Menus!R10C11)) -> 0 | D69: =INDIRECT(ADDRESS(RC2,2,3,1,Menus!R10C11)) -> 0
A70: 0 | B70: 70 | C70: =INDIRECT(ADDRESS(RC2,1,3,1,Menus!R10C11)) -> 0 | D70: =INDIRECT(ADDRESS(RC2,2,3,1,Menus!R10C11)) -> 0
A71: 0 | B71: 71 | C71: =INDIRECT(ADDRESS(RC2,1,3,1,Menus!R10C11)) -> 0 | D71: =INDIRECT(ADDRESS(RC2,2,3,1,Menus!R10C11)) -> 0
A72: 0 | B72: 72 | C72: =INDIRECT(ADDRESS(RC2,1,3,1,Menus!R10C11)) -> 0 | D72: =INDIRECT(ADDRESS(RC2,2,3,1,Menus!R10C11)) -> 0
A73: 0 | B73: 73 | C73: =INDIRECT(ADDRESS(RC2,1,3,1,Menus!R10C11)) -> 0 | D73: =INDIRECT(ADDRESS(RC2,2,3,1,Menus!R10C11)) -> 0
A74: 0 | B74: 74 | C74: =INDIRECT(ADDRESS(RC2,1,3,1,Menus!R10C11)) -> 0 | D74: =INDIRECT(ADDRESS(RC2,2,3,1,Menus!R10C11)) -> 0
A75: 0 | B75: 75 | C75: =INDIRECT(ADDRESS(RC2,1,3,1,Menus!R10C11)) -> 0 | D75: =INDIRECT(ADDRESS(RC2,2,3,1,Menus!R10C11)) -> 0
A76: 0 | B76: 76 | C76: =INDIRECT(ADDRESS(RC2,1,3,1,Menus!R10C11)) -> 0 | D76: =INDIRECT(ADDRESS(RC2,2,3,1,Menus!R10C11)) -> 0
A77: 0 | B77: 77 | C77: =INDIRECT(ADDRESS(RC2,1,3,1,Menus!R10C11)) -> 0 | D77: =INDIRECT(ADDRESS(RC2,2,3,1,Menus!R10C11)) -> 0
A78: 0 | B78: 78 | C78: =INDIRECT(ADDRESS(RC2,1,3,1,Menus!R10C11)) -> 0 | D78: =INDIRECT(ADDRESS(RC2,2,3,1,Menus!R10C11)) -> 0
A79: 0 | B79: 79 | C79: =INDIRECT(ADDRESS(RC2,1,3,1,Menus!R10C11)) -> 0 | D79: =INDIRECT(ADDRESS(RC2,2,3,1,Menus!R10C11)) -> 0
A80: 0 | B80: 80 | C80: =INDIRECT(ADDRESS(RC2,1,3,1,Menus!R10C11)) -> 0 | D80: =INDIRECT(ADDRESS(RC2,2,3,1,Menus!R10C11)) -> 0
A81: 0 | B81: 81 | C81: =INDIRECT(ADDRESS(RC2,1,3,1,Menus!R10C11)) -> 0 | D81: =INDIRECT(ADDRESS(RC2,2,3,1,Menus!R10C11)) -> 0
A82: 0 | B82: 82 | C82: =INDIRECT(ADDRESS(RC2,1,3,1,Menus!R10C11)) -> 0 | D82: =INDIRECT(ADDRESS(RC2,2,3,1,Menus!R10C11)) -> 0
A83: 0 | B83: 83 | C83: =INDIRECT(ADDRESS(RC2,1,3,1,Menus!R10C11)) -> 0 | D83: =INDIRECT(ADDRESS(RC2,2,3,1,Menus!R10C11)) -> 0
A84: 0 | B84: 84 | C84: =INDIRECT(ADDRESS(RC2,1,3,1,Menus!R10C11)) -> 0 | D84: =INDIRECT(ADDRESS(RC2,2,3,1,Menus!R10C11)) -> 0
A85: 0 | B85: 85 | C85: =INDIRECT(ADDRESS(RC2,1,3,1,Menus!R10C11)) -> 0 | D85: =INDIRECT(ADDRESS(RC2,2,3,1,Menus!R10C11)) -> 0
A86: 0 | B86: 86 | C86: =INDIRECT(ADDRESS(RC2,1,3,1,Menus!R10C11)) -> 0 | D86: =INDIRECT(ADDRESS(RC2,2,3,1,Menus!R10C11)) -> 0
A87: 0 | B87: 87 | C87: =INDIRECT(ADDRESS(RC2,1,3,1,Menus!R10C11)) -> 0 | D87: =INDIRECT(ADDRESS(RC2,2,3,1,Menus!R10C11)) -> 0
A88: 0 | B88: 88 | C88: =INDIRECT(ADDRESS(RC2,1,3,1,Menus!R10C11)) -> 0 | D88: =INDIRECT(ADDRESS(RC2,2,3,1,Menus!R10C11)) -> 0
A89: 0 | B89: 89 | C89: =INDIRECT(ADDRESS(RC2,1,3,1,Menus!R10C11)) -> 0 | D89: =INDIRECT(ADDRESS(RC2,2,3,1,Menus!R10C11)) -> 0
A90: 0 | B90: 90 | C90: =INDIRECT(ADDRESS(RC2,1,3,1,Menus!R10C11)) -> 0 | D90: =INDIRECT(ADDRESS(RC2,2,3,1,Menus!R10C11)) -> 0
A91: 0 | B91: 91 | C91: =INDIRECT(ADDRESS(RC2,1,3,1,Menus!R10C11)) -> 0 | D91: =INDIRECT(ADDRESS(RC2,2,3,1,Menus!R10C11)) -> 0
A92: 0 | B92: 92 | C92: =INDIRECT(ADDRESS(RC2,1,3,1,Menus!R10C11)) -> 0 | D92: =INDIRECT(ADDRESS(RC2,2,3,1,Menus!R10C11)) -> 0
A93: 0 | B93: 93 | C93: =INDIRECT(ADDRESS(RC2,1,3,1,Menus!R10C11)) -> 0 | D93: =INDIRECT(ADDRESS(RC2,2,3,1,Menus!R10C11)) -> 0
A94: 0 | B94: 94 | C94: =INDIRECT(ADDRESS(RC2,1,3,1,Menus!R10C11)) -> 0 | D94: =INDIRECT(ADDRESS(RC2,2,3,1,Menus!R10C11)) -> 0
A95: 0 | B95: 95 | C95: =INDIRECT(ADDRESS(RC2,1,3,1,Menus!R10C11)) -> 0 | D95: =INDIRECT(ADDRESS(RC2,2,3,1,Menus!R10C11)) -> 0
A96: 0 | B96: 96 | C96: =INDIRECT(ADDRESS(RC2,1,3,1,Menus!R10C11)) -> 0 | D96: =INDIRECT(ADDRESS(RC2,2,3,1,Menus!R10C11)) -> 0
A97: 0 | B97: 97 | C97: =INDIRECT(ADDRESS(RC2,1,3,1,Menus!R10C11)) -> 0 | D97: =INDIRECT(ADDRESS(RC2,2,3,1,Menus!R10C11)) -> 0
A98: 0 | B98: 98 | C98: =INDIRECT(ADDRESS(RC2,1,3,1,Menus!R10C11)) -> 0 | D98: =INDIRECT(ADDRESS(RC2,2,3,1,Menus!R10C11)) -> 0
A99: 0 | B99: 99 | C99: =INDIRECT(ADDRESS(RC2,1,3,1,Menus!R10C11)) -> 0 | D99: =INDIRECT(ADDRESS(RC2,2,3,1,Menus!R10C11)) -> 0
A100: 0 | B100: 100 | C100: =INDIRECT(ADDRESS(RC2,1,3,1,Menus!R10C11)) -> 0 | D100: =INDIRECT(ADDRESS(RC2,2,3,1,Menus!R10C11)) -> 0
A101: 0 | B101: 101 | C101: =INDIRECT(ADDRESS(RC2,1,3,1,Menus!R10C11)) -> 0 | D101: =INDIRECT(ADDRESS(RC2,2,3,1,Menus!R10C11)) -> 0
A102: 0 | B102: 102 | C102: =INDIRECT(ADDRESS(RC2,1,3,1,Menus!R10C11)) -> 0 | D102: =INDIRECT(ADDRESS(RC2,2,3,1,Menus!R10C11)) -> 0
A103: 0 | B103: 103 | C103: =INDIRECT(ADDRESS(RC2,1,3,1,Menus!R10C11)) -> 0 | D103: =INDIRECT(ADDRESS(RC2,2,3,1,Menus!R10C11)) -> 0
A104: 0 | B104: 104 | C104: =INDIRECT(ADDRESS(RC2,1,3,1,Menus!R10C11)) -> 0 | D104: =INDIRECT(ADDRESS(RC2,2,3,1,Menus!R10C11)) -> 0
A105: 0 | B105: 105 | C105: =INDIRECT(ADDRESS(RC2,1,3,1,Menus!R10C11)) -> 0 | D105: =INDIRECT(ADDRESS(RC2,2,3,1,Menus!R10C11)) -> 0
A106: 0 | B106: 106 | C106: =INDIRECT(ADDRESS(RC2,1,3,1,Menus!R10C11)) -> 0 | D106: =INDIRECT(ADDRESS(RC2,2,3,1,Menus!R10C11)) -> 0
A107: 0 | B107: 107 | C107: =INDIRECT(ADDRESS(RC2,1,3,1,Menus!R10C11)) -> 0 | D107: =INDIRECT(ADDRESS(RC2,2,3,1,Menus!R10C11)) -> 0
A108: 0 | B108: 108 | C108: =INDIRECT(ADDRESS(RC2,1,3,1,Menus!R10C11)) -> 0 | D108: =INDIRECT(ADDRESS(RC2,2,3,1,Menus!R10C11)) -> 0
A109: 0 | B109: 109 | C109: =INDIRECT(ADDRESS(RC2,1,3,1,Menus!R10C11)) -> 0 | D109: =INDIRECT(ADDRESS(RC2,2,3,1,Menus!R10C11)) -> 0
A110: 0 | B110: 110 | C110: =INDIRECT(ADDRESS(RC2,1,3,1,Menus!R10C11)) -> 0 | D110: =INDIRECT(ADDRESS(RC2,2,3,1,Menus!R10C11)) -> 0
A111: 0 | B111: 111 | C111: =INDIRECT(ADDRESS(RC2,1,3,1,Menus!R10C11)) -> 0 | D111: =INDIRECT(ADDRESS(RC2,2,3,1,Menus!R10C11)) -> 0
A112: 0 | B112: 112 | C112: =INDIRECT(ADDRESS(RC2,1,3,1,Menus!R10C11)) -> 0 | D112: =INDIRECT(ADDRESS(RC2,2,3,1,Menus!R10C11)) -> 0
A113: 0 | B113: 113 | C113: =INDIRECT(ADDRESS(RC2,1,3,1,Menus!R10C11)) -> 0 | D113: =INDIRECT(ADDRESS(RC2,2,3,1,Menus!R10C11)) -> 0
A114: 0 | B114: 114 | C114: =INDIRECT(ADDRESS(RC2,1,3,1,Menus!R10C11)) -> 0 | D114: =INDIRECT(ADDRESS(RC2,2,3,1,Menus!R10C11)) -> 0
A115: 0 | B115: 115 | C115: =INDIRECT(ADDRESS(RC2,1,3,1,Menus!R10C11)) -> 0 | D115: =INDIRECT(ADDRESS(RC2,2,3,1,Menus!R10C11)) -> 0
A116: 0 | B116: 116 | C116: =INDIRECT(ADDRESS(RC2,1,3,1,Menus!R10C11)) -> 0 | D116: =INDIRECT(ADDRESS(RC2,2,3,1,Menus!R10C11)) -> 0
A117: 0 | B117: 117 | C117: =INDIRECT(ADDRESS(RC2,1,3,1,Menus!R10C11)) -> 0 | D117: =INDIRECT(ADDRESS(RC2,2,3,1,Menus!R10C11)) -> 0
A118: 0 | B118: 118 | C118: =INDIRECT(ADDRESS(RC2,1,3,1,Menus!R10C11)) -> 0 | D118: =INDIRECT(ADDRESS(RC2,2,3,1,Menus!R10C11)) -> 0
A119: 0 | B119: 119 | C119: =INDIRECT(ADDRESS(RC2,1,3,1,Menus!R10C11)) -> 0 | D119: =INDIRECT(ADDRESS(RC2,2,3,1,Menus!R10C11)) -> 0
A120: 0 | B120: 120 | C120: =INDIRECT(ADDRESS(RC2,1,3,1,Menus!R10C11)) -> 0 | D120: =INDIRECT(ADDRESS(RC2,2,3,1,Menus!R10C11)) -> 0
A121: 0 | B121: 121 | C121: =INDIRECT(ADDRESS(RC2,1,3,1,Menus!R10C11)) -> 0 | D121: =INDIRECT(ADDRESS(RC2,2,3,1,Menus!R10C11)) -> 0
A122: 0 | B122: 122 | C122: =INDIRECT(ADDRESS(RC2,1,3,1,Menus!R10C11)) -> 0 | D122: =INDIRECT(ADDRESS(RC2,2,3,1,Menus!R10C11)) -> 0
A123: 0 | B123: 123 | C123: =INDIRECT(ADDRESS(RC2,1,3,1,Menus!R10C11)) -> 0 | D123: =INDIRECT(ADDRESS(RC2,2,3,1,Menus!R10C11)) -> 0
A124: 0 | B124: 124 | C124: =INDIRECT(ADDRESS(RC2,1,3,1,Menus!R10C11)) -> 0 | D124: =INDIRECT(ADDRESS(RC2,2,3,1,Menus!R10C11)) -> 0
A125: 0 | B125: 125 | C125: =INDIRECT(ADDRESS(RC2,1,3,1,Menus!R10C11)) -> 0 | D125: =INDIRECT(ADDRESS(RC2,2,3,1,Menus!R10C11)) -> 0
A126: 0 | B126: 126 | C126: =INDIRECT(ADDRESS(RC2,1,3,1,Menus!R10C11)) -> 0 | D126: =INDIRECT(ADDRESS(RC2,2,3,1,Menus!R10C11)) -> 0
A127: 0 | B127: 127 | C127: =INDIRECT(ADDRESS(RC2,1,3,1,Menus!R10C11)) -> 0 | D127: =INDIRECT(ADDRESS(RC2,2,3,1,Menus!R10C11)) -> 0
A128: 0 | B128: 128 | C128: =INDIRECT(ADDRESS(RC2,1,3,1,Menus!R10C11)) -> 0 | D128: =INDIRECT(ADDRESS(RC2,2,3,1,Menus!R10C11)) -> 0
A129: 0 | B129: 129 | C129: =INDIRECT(ADDRESS(RC2,1,3,1,Menus!R10C11)) -> 0 | D129: =INDIRECT(ADDRESS(RC2,2,3,1,Menus!R10C11)) -> 0
A130: 0 | B130: 130 | C130: =INDIRECT(ADDRESS(RC2,1,3,1,Menus!R10C11)) -> 0 | D130: =INDIRECT(ADDRESS(RC2,2,3,1,Menus!R10C11)) -> 0
A131: 0 | B131: 131 | C131: =INDIRECT(ADDRESS(RC2,1,3,1,Menus!R10C11)) -> 0 | D131: =INDIRECT(ADDRESS(RC2,2,3,1,Menus!R10C11)) -> 0
A132: 0 | B132: 132 | C132: =INDIRECT(ADDRESS(RC2,1,3,1,Menus!R10C11)) -> 0 | D132: =INDIRECT(ADDRESS(RC2,2,3,1,Menus!R10C11)) -> 0
A133: 0 | B133: 133 | C133: =INDIRECT(ADDRESS(RC2,1,3,1,Menus!R10C11)) -> 0 | D133: =INDIRECT(ADDRESS(RC2,2,3,1,Menus!R10C11)) -> 0
A134: 0 | B134: 134 | C134: =INDIRECT(ADDRESS(RC2,1,3,1,Menus!R10C11)) -> 0 | D134: =INDIRECT(ADDRESS(RC2,2,3,1,Menus!R10C11)) -> 0
A135: 0 | B135: 135 | C135: =INDIRECT(ADDRESS(RC2,1,3,1,Menus!R10C11)) -> 0 | D135: =INDIRECT(ADDRESS(RC2,2,3,1,Menus!R10C11)) -> 0
A136: 0 | B136: 136 | C136: =INDIRECT(ADDRESS(RC2,1,3,1,Menus!R10C11)) -> 0 | D136: =INDIRECT(ADDRESS(RC2,2,3,1,Menus!R10C11)) -> 0
A137: 0 | B137: 137 | C137: =INDIRECT(ADDRESS(RC2,1,3,1,Menus!R10C11)) -> 0 | D137: =INDIRECT(ADDRESS(RC2,2,3,1,Menus!R10C11)) -> 0
A138: 0 | B138: 138 | C138: =INDIRECT(ADDRESS(RC2,1,3,1,Menus!R10C11)) -> 0 | D138: =INDIRECT(ADDRESS(RC2,2,3,1,Menus!R10C11)) -> 0
A139: 0 | B139: 139 | C139: =INDIRECT(ADDRESS(RC2,1,3,1,Menus!R10C11)) -> 0 | D139: =INDIRECT(ADDRESS(RC2,2,3,1,Menus!R10C11)) -> 0
A140: 0 | B140: 140 | C140: =INDIRECT(ADDRESS(RC2,1,3,1,Menus!R10C11)) -> 0 | D140: =INDIRECT(ADDRESS(RC2,2,3,1,Menus!R10C11)) -> 0
A141: 0 | B141: 141 | C141: =INDIRECT(ADDRESS(RC2,1,3,1,Menus!R10C11)) -> 0 | D141: =INDIRECT(ADDRESS(RC2,2,3,1,Menus!R10C11)) -> 0
A142: 0 | B142: 142 | C142: =INDIRECT(ADDRESS(RC2,1,3,1,Menus!R10C11)) -> 0 | D142: =INDIRECT(ADDRESS(RC2,2,3,1,Menus!R10C11)) -> 0
A143: 0 | B143: 143 | C143: =INDIRECT(ADDRESS(RC2,1,3,1,Menus!R10C11)) -> 0 | D143: =INDIRECT(ADDRESS(RC2,2,3,1,Menus!R10C11)) -> 0
A144: 0 | B144: 144 | C144: =INDIRECT(ADDRESS(RC2,1,3,1,Menus!R10C11)) -> 0 | D144: =INDIRECT(ADDRESS(RC2,2,3,1,Menus!R10C11)) -> 0
A145: 0 | B145: 145 | C145: =INDIRECT(ADDRESS(RC2,1,3,1,Menus!R10C11)) -> 0 | D145: =INDIRECT(ADDRESS(RC2,2,3,1,Menus!R10C11)) -> 0
A146: 0 | B146: 146 | C146: =INDIRECT(ADDRESS(RC2,1,3,1,Menus!R10C11)) -> 0 | D146: =INDIRECT(ADDRESS(RC2,2,3,1,Menus!R10C11)) -> 0
A147: 0 | B147: 147 | C147: =INDIRECT(ADDRESS(RC2,1,3,1,Menus!R10C11)) -> 0 | D147: =INDIRECT(ADDRESS(RC2,2,3,1,Menus!R10C11)) -> 0
A148: 0 | B148: 148 | C148: =INDIRECT(ADDRESS(RC2,1,3,1,Menus!R10C11)) -> 0 | D148: =INDIRECT(ADDRESS(RC2,2,3,1,Menus!R10C11)) -> 0
A149: 0 | B149: 149 | C149: =INDIRECT(ADDRESS(RC2,1,3,1,Menus!R10C11)) -> 0 | D149: =INDIRECT(ADDRESS(RC2,2,3,1,Menus!R10C11)) -> 0
A150: 0 | B150: 150 | C150: =INDIRECT(ADDRESS(RC2,1,3,1,Menus!R10C11)) -> 0 | D150: =INDIRECT(ADDRESS(RC2,2,3,1,Menus!R10C11)) -> 0
A151: 0 | B151: 151 | C151: =INDIRECT(ADDRESS(RC2,1,3,1,Menus!R10C11)) -> 0 | D151: =INDIRECT(ADDRESS(RC2,2,3,1,Menus!R10C11)) -> 0
A152: 0 | B152: 152 | C152: =INDIRECT(ADDRESS(RC2,1,3,1,Menus!R10C11)) -> 0 | D152: =INDIRECT(ADDRESS(RC2,2,3,1,Menus!R10C11)) -> 0
A153: 0 | B153: 153 | C153: =INDIRECT(ADDRESS(RC2,1,3,1,Menus!R10C11)) -> 0 | D153: =INDIRECT(ADDRESS(RC2,2,3,1,Menus!R10C11)) -> 0
A154: 0 | B154: 154 | C154: =INDIRECT(ADDRESS(RC2,1,3,1,Menus!R10C11)) -> 0 | D154: =INDIRECT(ADDRESS(RC2,2,3,1,Menus!R10C11)) -> 0
A155: 0 | B155: 155 | C155: =INDIRECT(ADDRESS(RC2,1,3,1,Menus!R10C11)) -> 0 | D155: =INDIRECT(ADDRESS(RC2,2,3,1,Menus!R10C11)) -> 0
A156: 0 | B156: 156 | C156: =INDIRECT(ADDRESS(RC2,1,3,1,Menus!R10C11)) -> 0 | D156: =INDIRECT(ADDRESS(RC2,2,3,1,Menus!R10C11)) -> 0
A157: 0 | B157: 157 | C157: =INDIRECT(ADDRESS(RC2,1,3,1,Menus!R10C11)) -> 0 | D157: =INDIRECT(ADDRESS(RC2,2,3,1,Menus!R10C11)) -> 0
A158: 0 | B158: 158 | C158: =INDIRECT(ADDRESS(RC2,1,3,1,Menus!R10C11)) -> 0 | D158: =INDIRECT(ADDRESS(RC2,2,3,1,Menus!R10C11)) -> 0
A159: 0 | B159: 159 | C159: =INDIRECT(ADDRESS(RC2,1,3,1,Menus!R10C11)) -> 0 | D159: =INDIRECT(ADDRESS(RC2,2,3,1,Menus!R10C11)) -> 0
A160: 0 | B160: 160 | C160: =INDIRECT(ADDRESS(RC2,1,3,1,Menus!R10C11)) -> 0 | D160: =INDIRECT(ADDRESS(RC2,2,3,1,Menus!R10C11)) -> 0
A161: 0 | B161: 161 | C161: =INDIRECT(ADDRESS(RC2,1,3,1,Menus!R10C11)) -> 0 | D161: =INDIRECT(ADDRESS(RC2,2,3,1,Menus!R10C11)) -> 0
A162: 0 | B162: 162 | C162: =INDIRECT(ADDRESS(RC2,1,3,1,Menus!R10C11)) -> 0 | D162: =INDIRECT(ADDRESS(RC2,2,3,1,Menus!R10C11)) -> 0
A163: 0 | B163: 163 | C163: =INDIRECT(ADDRESS(RC2,1,3,1,Menus!R10C11)) -> 0 | D163: =INDIRECT(ADDRESS(RC2,2,3,1,Menus!R10C11)) -> 0
A164: 0 | B164: 164 | C164: =INDIRECT(ADDRESS(RC2,1,3,1,Menus!R10C11)) -> 0 | D164: =INDIRECT(ADDRESS(RC2,2,3,1,Menus!R10C11)) -> 0
A165: 0 | B165: 165 | C165: =INDIRECT(ADDRESS(RC2,1,3,1,Menus!R10C11)) -> 0 | D165: =INDIRECT(ADDRESS(RC2,2,3,1,Menus!R10C11)) -> 0
A166: 0 | B166: 166 | C166: =INDIRECT(ADDRESS(RC2,1,3,1,Menus!R10C11)) -> 0 | D166: =INDIRECT(ADDRESS(RC2,2,3,1,Menus!R10C11)) -> 0
A167: 0 | B167: 167 | C167: =INDIRECT(ADDRESS(RC2,1,3,1,Menus!R10C11)) -> 0 | D167: =INDIRECT(ADDRESS(RC2,2,3,1,Menus!R10C11)) -> 0
A168: 0 | B168: 168 | C168: =INDIRECT(ADDRESS(RC2,1,3,1,Menus!R10C11)) -> 0 | D168: =INDIRECT(ADDRESS(RC2,2,3,1,Menus!R10C11)) -> 0
A169: 0 | B169: 169 | C169: =INDIRECT(ADDRESS(RC2,1,3,1,Menus!R10C11)) -> 0 | D169: =INDIRECT(ADDRESS(RC2,2,3,1,Menus!R10C11)) -> 0
A170: 0 | B170: 170 | C170: =INDIRECT(ADDRESS(RC2,1,3,1,Menus!R10C11)) -> 0 | D170: =INDIRECT(ADDRESS(RC2,2,3,1,Menus!R10C11)) -> 0
A171: 0 | B171: 171 | C171: =INDIRECT(ADDRESS(RC2,1,3,1,Menus!R10C11)) -> 0 | D171: =INDIRECT(ADDRESS(RC2,2,3,1,Menus!R10C11)) -> 0
A172: 0 | B172: 172 | C172: =INDIRECT(ADDRESS(RC2,1,3,1,Menus!R10C11)) -> 0 | D172: =INDIRECT(ADDRESS(RC2,2,3,1,Menus!R10C11)) -> 0
A173: 0 | B173: 173 | C173: =INDIRECT(ADDRESS(RC2,1,3,1,Menus!R10C11)) -> 0 | D173: =INDIRECT(ADDRESS(RC2,2,3,1,Menus!R10C11)) -> 0
A174: 0 | B174: 174 | C174: =INDIRECT(ADDRESS(RC2,1,3,1,Menus!R10C11)) -> 0 | D174: =INDIRECT(ADDRESS(RC2,2,3,1,Menus!R10C11)) -> 0
A175: 0 | B175: 175 | C175: =INDIRECT(ADDRESS(RC2,1,3,1,Menus!R10C11)) -> 0 | D175: =INDIRECT(ADDRESS(RC2,2,3,1,Menus!R10C11)) -> 0
A176: 0 | B176: 176 | C176: =INDIRECT(ADDRESS(RC2,1,3,1,Menus!R10C11)) -> 0 | D176: =INDIRECT(ADDRESS(RC2,2,3,1,Menus!R10C11)) -> 0
A177: 0 | B177: 177 | C177: =INDIRECT(ADDRESS(RC2,1,3,1,Menus!R10C11)) -> 0 | D177: =INDIRECT(ADDRESS(RC2,2,3,1,Menus!R10C11)) -> 0
A178: 0 | B178: 178 | C178: =INDIRECT(ADDRESS(RC2,1,3,1,Menus!R10C11)) -> 0 | D178: =INDIRECT(ADDRESS(RC2,2,3,1,Menus!R10C11)) -> 0
A179: 0 | B179: 179 | C179: =INDIRECT(ADDRESS(RC2,1,3,1,Menus!R10C11)) -> 0 | D179: =INDIRECT(ADDRESS(RC2,2,3,1,Menus!R10C11)) -> 0
A180: 0 | B180: 180 | C180: =INDIRECT(ADDRESS(RC2,1,3,1,Menus!R10C11)) -> 0 | D180: =INDIRECT(ADDRESS(RC2,2,3,1,Menus!R10C11)) -> 0
A181: 0 | B181: 181 | C181: =INDIRECT(ADDRESS(RC2,1,3,1,Menus!R10C11)) -> 0 | D181: =INDIRECT(ADDRESS(RC2,2,3,1,Menus!R10C11)) -> 0
A182: 0 | B182: 182 | C182: =INDIRECT(ADDRESS(RC2,1,3,1,Menus!R10C11)) -> 0 | D182: =INDIRECT(ADDRESS(RC2,2,3,1,Menus!R10C11)) -> 0
A183: 0 | B183: 183 | C183: =INDIRECT(ADDRESS(RC2,1,3,1,Menus!R10C11)) -> 0 | D183: =INDIRECT(ADDRESS(RC2,2,3,1,Menus!R10C11)) -> 0
A184: 0 | B184: 184 | C184: =INDIRECT(ADDRESS(RC2,1,3,1,Menus!R10C11)) -> 0 | D184: =INDIRECT(ADDRESS(RC2,2,3,1,Menus!R10C11)) -> 0
A185: 0 | B185: 185 | C185: =INDIRECT(ADDRESS(RC2,1,3,1,Menus!R10C11)) -> 0 | D185: =INDIRECT(ADDRESS(RC2,2,3,1,Menus!R10C11)) -> 0
A186: 0 | B186: 186 | C186: =INDIRECT(ADDRESS(RC2,1,3,1,Menus!R10C11)) -> 0 | D186: =INDIRECT(ADDRESS(RC2,2,3,1,Menus!R10C11)) -> 0
A187: 0 | B187: 187 | C187: =INDIRECT(ADDRESS(RC2,1,3,1,Menus!R10C11)) -> 0 | D187: =INDIRECT(ADDRESS(RC2,2,3,1,Menus!R10C11)) -> 0
A188: 0 | B188: 188 | C188: =INDIRECT(ADDRESS(RC2,1,3,1,Menus!R10C11)) -> 0 | D188: =INDIRECT(ADDRESS(RC2,2,3,1,Menus!R10C11)) -> 0
A189: 0 | B189: 189 | C189: =INDIRECT(ADDRESS(RC2,1,3,1,Menus!R10C11)) -> 0 | D189: =INDIRECT(ADDRESS(RC2,2,3,1,Menus!R10C11)) -> 0
A190: 0 | B190: 190 | C190: =INDIRECT(ADDRESS(RC2,1,3,1,Menus!R10C11)) -> 0 | D190: =INDIRECT(ADDRESS(RC2,2,3,1,Menus!R10C11)) -> 0
A191: 0 | B191: 191 | C191: =INDIRECT(ADDRESS(RC2,1,3,1,Menus!R10C11)) -> 0 | D191: =INDIRECT(ADDRESS(RC2,2,3,1,Menus!R10C11)) -> 0
A192: 0 | B192: 192 | C192: =INDIRECT(ADDRESS(RC2,1,3,1,Menus!R10C11)) -> 0 | D192: =INDIRECT(ADDRESS(RC2,2,3,1,Menus!R10C11)) -> 0
A193: 0 | B193: 193 | C193: =INDIRECT(ADDRESS(RC2,1,3,1,Menus!R10C11)) -> 0 | D193: =INDIRECT(ADDRESS(RC2,2,3,1,Menus!R10C11)) -> 0
A194: 0 | B194: 194 | C194: =INDIRECT(ADDRESS(RC2,1,3,1,Menus!R10C11)) -> 0 | D194: =INDIRECT(ADDRESS(RC2,2,3,1,Menus!R10C11)) -> 0
A195: 0 | B195: 195 | C195: =INDIRECT(ADDRESS(RC2,1,3,1,Menus!R10C11)) -> 0 | D195: =INDIRECT(ADDRESS(RC2,2,3,1,Menus!R10C11)) -> 0
A196: 0 | B196: 196 | C196: =INDIRECT(ADDRESS(RC2,1,3,1,Menus!R10C11)) -> 0 | D196: =INDIRECT(ADDRESS(RC2,2,3,1,Menus!R10C11)) -> 0
A197: 0 | B197: 197 | C197: =INDIRECT(ADDRESS(RC2,1,3,1,Menus!R10C11)) -> 0 | D197: =INDIRECT(ADDRESS(RC2,2,3,1,Menus!R10C11)) -> 0
A198: 0 | B198: 198 | C198: =INDIRECT(ADDRESS(RC2,1,3,1,Menus!R10C11)) -> 0 | D198: =INDIRECT(ADDRESS(RC2,2,3,1,Menus!R10C11)) -> 0
A199: 0 | B199: 199 | C199: =INDIRECT(ADDRESS(RC2,1,3,1,Menus!R10C11)) -> 0 | D199: =INDIRECT(ADDRESS(RC2,2,3,1,Menus!R10C11)) -> 0
A200: 0 | B200: 200 | C200: =INDIRECT(ADDRESS(RC2,1,3,1,Menus!R10C11)) -> 0 | D200: =INDIRECT(ADDRESS(RC2,2,3,1,Menus!R10C11)) -> 0
A201: 0 | B201: 201 | C201: =INDIRECT(ADDRESS(RC2,1,3,1,Menus!R10C11)) -> 0 | D201: =INDIRECT(ADDRESS(RC2,2,3,1,Menus!R10C11)) -> 0
A202: 0 | B202: 202 | C202: =INDIRECT(ADDRESS(RC2,1,3,1,Menus!R10C11)) -> 0 | D202: =INDIRECT(ADDRESS(RC2,2,3,1,Menus!R10C11)) -> 0
A203: 0 | B203: 203 | C203: =INDIRECT(ADDRESS(RC2,1,3,1,Menus!R10C11)) -> 0 | D203: =INDIRECT(ADDRESS(RC2,2,3,1,Menus!R10C11)) -> 0
A204: 0 | B204: 204 | C204: =INDIRECT(ADDRESS(RC2,1,3,1,Menus!R10C11)) -> 0 | D204: =INDIRECT(ADDRESS(RC2,2,3,1,Menus!R10C11)) -> 0
A205: 0 | B205: 205 | C205: =INDIRECT(ADDRESS(RC2,1,3,1,Menus!R10C11)) -> 0 | D205: =INDIRECT(ADDRESS(RC2,2,3,1,Menus!R10C11)) -> 0
A206: 0 | B206: 206 | C206: =INDIRECT(ADDRESS(RC2,1,3,1,Menus!R10C11)) -> 0 | D206: =INDIRECT(ADDRESS(RC2,2,3,1,Menus!R10C11)) -> 0
A207: 0 | B207: 207 | C207: =INDIRECT(ADDRESS(RC2,1,3,1,Menus!R10C11)) -> 0 | D207: =INDIRECT(ADDRESS(RC2,2,3,1,Menus!R10C11)) -> 0
A208: 0 | B208: 208 | C208: =INDIRECT(ADDRESS(RC2,1,3,1,Menus!R10C11)) -> 0 | D208: =INDIRECT(ADDRESS(RC2,2,3,1,Menus!R10C11)) -> 0
A209: 0 | B209: 209 | C209: =INDIRECT(ADDRESS(RC2,1,3,1,Menus!R10C11)) -> 0 | D209: =INDIRECT(ADDRESS(RC2,2,3,1,Menus!R10C11)) -> 0
A210: 0 | B210: 210 | C210: =INDIRECT(ADDRESS(RC2,1,3,1,Menus!R10C11)) -> 0 | D210: =INDIRECT(ADDRESS(RC2,2,3,1,Menus!R10C11)) -> 0
A211: 0 | B211: 211 | C211: =INDIRECT(ADDRESS(RC2,1,3,1,Menus!R10C11)) -> 0 | D211: =INDIRECT(ADDRESS(RC2,2,3,1,Menus!R10C11)) -> 0
A212: 0 | B212: 212 | C212: =INDIRECT(ADDRESS(RC2,1,3,1,Menus!R10C11)) -> 0 | D212: =INDIRECT(ADDRESS(RC2,2,3,1,Menus!R10C11)) -> 0
A213: 0 | B213: 213 | C213: =INDIRECT(ADDRESS(RC2,1,3,1,Menus!R10C11)) -> 0 | D213: =INDIRECT(ADDRESS(RC2,2,3,1,Menus!R10C11)) -> 0
A214: 0 | B214: 214 | C214: =INDIRECT(ADDRESS(RC2,1,3,1,Menus!R10C11)) -> 0 | D214: =INDIRECT(ADDRESS(RC2,2,3,1,Menus!R10C11)) -> 0
A215: 0 | B215: 215 | C215: =INDIRECT(ADDRESS(RC2,1,3,1,Menus!R10C11)) -> 0 | D215: =INDIRECT(ADDRESS(RC2,2,3,1,Menus!R10C11)) -> 0
A216: 0 | B216: 216 | C216: =INDIRECT(ADDRESS(RC2,1,3,1,Menus!R10C11)) -> 0 | D216: =INDIRECT(ADDRESS(RC2,2,3,1,Menus!R10C11)) -> 0
A217: 0 | B217: 217 | C217: =INDIRECT(ADDRESS(RC2,1,3,1,Menus!R10C11)) -> 0 | D217: =INDIRECT(ADDRESS(RC2,2,3,1,Menus!R10C11)) -> 0
A218: 0 | B218: 218 | C218: =INDIRECT(ADDRESS(RC2,1,3,1,Menus!R10C11)) -> 0 | D218: =INDIRECT(ADDRESS(RC2,2,3,1,Menus!R10C11)) -> 0
A219: 0 | B219: 219 | C219: =INDIRECT(ADDRESS(RC2,1,3,1,Menus!R10C11)) -> 0 | D219: =INDIRECT(ADDRESS(RC2,2,3,1,Menus!R10C11)) -> 0
A220: 0 | B220: 220 | C220: =INDIRECT(ADDRESS(RC2,1,3,1,Menus!R10C11)) -> 0 | D220: =INDIRECT(ADDRESS(RC2,2,3,1,Menus!R10C11)) -> 0
A221: 0 | B221: 221 | C221: =INDIRECT(ADDRESS(RC2,1,3,1,Menus!R10C11)) -> 0 | D221: =INDIRECT(ADDRESS(RC2,2,3,1,Menus!R10C11)) -> 0
A222: 0 | B222: 222 | C222: =INDIRECT(ADDRESS(RC2,1,3,1,Menus!R10C11)) -> 0 | D222: =INDIRECT(ADDRESS(RC2,2,3,1,Menus!R10C11)) -> 0
A223: 0 | B223: 223 | C223: =INDIRECT(ADDRESS(RC2,1,3,1,Menus!R10C11)) -> 0 | D223: =INDIRECT(ADDRESS(RC2,2,3,1,Menus!R10C11)) -> 0
A224: 0 | B224: 224 | C224: =INDIRECT(ADDRESS(RC2,1,3,1,Menus!R10C11)) -> 0 | D224: =INDIRECT(ADDRESS(RC2,2,3,1,Menus!R10C11)) -> 0
A225: 0 | B225: 225 | C225: =INDIRECT(ADDRESS(RC2,1,3,1,Menus!R10C11)) -> 0 | D225: =INDIRECT(ADDRESS(RC2,2,3,1,Menus!R10C11)) -> 0
A226: 0 | B226: 226 | C226: =INDIRECT(ADDRESS(RC2,1,3,1,Menus!R10C11)) -> 0 | D226: =INDIRECT(ADDRESS(RC2,2,3,1,Menus!R10C11)) -> 0
A227: 0 | B227: 227 | C227: =INDIRECT(ADDRESS(RC2,1,3,1,Menus!R10C11)) -> 0 | D227: =INDIRECT(ADDRESS(RC2,2,3,1,Menus!R10C11)) -> 0
A228: 0 | B228: 228 | C228: =INDIRECT(ADDRESS(RC2,1,3,1,Menus!R10C11)) -> 0 | D228: =INDIRECT(ADDRESS(RC2,2,3,1,Menus!R10C11)) -> 0
A229: 0 | B229: 229 | C229: =INDIRECT(ADDRESS(RC2,1,3,1,Menus!R10C11)) -> 0 | D229: =INDIRECT(ADDRESS(RC2,2,3,1,Menus!R10C11)) -> 0
A230: 0 | B230: 230 | C230: =INDIRECT(ADDRESS(RC2,1,3,1,Menus!R10C11)) -> 0 | D230: =INDIRECT(ADDRESS(RC2,2,3,1,Menus!R10C11)) -> 0
A231: 0 | B231: 231 | C231: =INDIRECT(ADDRESS(RC2,1,3,1,Menus!R10C11)) -> 0 | D231: =INDIRECT(ADDRESS(RC2,2,3,1,Menus!R10C11)) -> 0
A232: 0 | B232: 232 | C232: =INDIRECT(ADDRESS(RC2,1,3,1,Menus!R10C11)) -> 0 | D232: =INDIRECT(ADDRESS(RC2,2,3,1,Menus!R10C11)) -> 0
A233: 0 | B233: 233 | C233: =INDIRECT(ADDRESS(RC2,1,3,1,Menus!R10C11)) -> 0 | D233: =INDIRECT(ADDRESS(RC2,2,3,1,Menus!R10C11)) -> 0
A234: 0 | B234: 234 | C234: =INDIRECT(ADDRESS(RC2,1,3,1,Menus!R10C11)) -> 0 | D234: =INDIRECT(ADDRESS(RC2,2,3,1,Menus!R10C11)) -> 0
A235: 0 | B235: 235 | C235: =INDIRECT(ADDRESS(RC2,1,3,1,Menus!R10C11)) -> 0 | D235: =INDIRECT(ADDRESS(RC2,2,3,1,Menus!R10C11)) -> 0
A236: 0 | B236: 236 | C236: =INDIRECT(ADDRESS(RC2,1,3,1,Menus!R10C11)) -> 0 | D236: =INDIRECT(ADDRESS(RC2,2,3,1,Menus!R10C11)) -> 0
A237: 0 | B237: 237 | C237: =INDIRECT(ADDRESS(RC2,1,3,1,Menus!R10C11)) -> 0 | D237: =INDIRECT(ADDRESS(RC2,2,3,1,Menus!R10C11)) -> 0
A238: 0 | B238: 238 | C238: =INDIRECT(ADDRESS(RC2,1,3,1,Menus!R10C11)) -> 0 | D238: =INDIRECT(ADDRESS(RC2,2,3,1,Menus!R10C11)) -> 0
A239: 0 | B239: 239 | C239: =INDIRECT(ADDRESS(RC2,1,3,1,Menus!R10C11)) -> 0 | D239: =INDIRECT(ADDRESS(RC2,2,3,1,Menus!R10C11)) -> 0
A240: 0 | B240: 240 | C240: =INDIRECT(ADDRESS(RC2,1,3,1,Menus!R10C11)) -> 0 | D240: =INDIRECT(ADDRESS(RC2,2,3,1,Menus!R10C11)) -> 0
A241: 0 | B241: 241 | C241: =INDIRECT(ADDRESS(RC2,1,3,1,Menus!R10C11)) -> 0 | D241: =INDIRECT(ADDRESS(RC2,2,3,1,Menus!R10C11)) -> 0
A242: 0 | B242: 242 | C242: =INDIRECT(ADDRESS(RC2,1,3,1,Menus!R10C11)) -> 0 | D242: =INDIRECT(ADDRESS(RC2,2,3,1,Menus!R10C11)) -> 0
A243: 0 | B243: 243 | C243: =INDIRECT(ADDRESS(RC2,1,3,1,Menus!R10C11)) -> 0 | D243: =INDIRECT(ADDRESS(RC2,2,3,1,Menus!R10C11)) -> 0
A244: 0 | B244: 244 | C244: =INDIRECT(ADDRESS(RC2,1,3,1,Menus!R10C11)) -> 0 | D244: =INDIRECT(ADDRESS(RC2,2,3,1,Menus!R10C11)) -> 0
A245: 0 | B245: 245 | C245: =INDIRECT(ADDRESS(RC2,1,3,1,Menus!R10C11)) -> 0 | D245: =INDIRECT(ADDRESS(RC2,2,3,1,Menus!R10C11)) -> 0
A246: 0 | B246: 246 | C246: =INDIRECT(ADDRESS(RC2,1,3,1,Menus!R10C11)) -> 0 | D246: =INDIRECT(ADDRESS(RC2,2,3,1,Menus!R10C11)) -> 0
A247: 0 | B247: 247 | C247: =INDIRECT(ADDRESS(RC2,1,3,1,Menus!R10C11)) -> 0 | D247: =INDIRECT(ADDRESS(RC2,2,3,1,Menus!R10C11)) -> 0
A248: 0 | B248: 248 | C248: =INDIRECT(ADDRESS(RC2,1,3,1,Menus!R10C11)) -> 0 | D248: =INDIRECT(ADDRESS(RC2,2,3,1,Menus!R10C11)) -> 0
A249: 0 | B249: 249 | C249: =INDIRECT(ADDRESS(RC2,1,3,1,Menus!R10C11)) -> 0 | D249: =INDIRECT(ADDRESS(RC2,2,3,1,Menus!R10C11)) -> 0
A250: 0 | B250: 250 | C250: =INDIRECT(ADDRESS(RC2,1,3,1,Menus!R10C11)) -> 0 | D250: =INDIRECT(ADDRESS(RC2,2,3,1,Menus!R10C11)) -> 0
A251: 0 | B251: 251 | C251: =INDIRECT(ADDRESS(RC2,1,3,1,Menus!R10C11)) -> 0 | D251: =INDIRECT(ADDRESS(RC2,2,3,1,Menus!R10C11)) -> 0
A252: 0 | B252: 252 | C252: =INDIRECT(ADDRESS(RC2,1,3,1,Menus!R10C11)) -> 0 | D252: =INDIRECT(ADDRESS(RC2,2,3,1,Menus!R10C11)) -> 0
A253: 0 | B253: 253 | C253: =INDIRECT(ADDRESS(RC2,1,3,1,Menus!R10C11)) -> 0 | D253: =INDIRECT(ADDRESS(RC2,2,3,1,Menus!R10C11)) -> 0
A254: 0 | B254: 254 | C254: =INDIRECT(ADDRESS(RC2,1,3,1,Menus!R10C11)) -> 0 | D254: =INDIRECT(ADDRESS(RC2,2,3,1,Menus!R10C11)) -> 0
B255: 255 | C255: =INDIRECT(ADDRESS(RC2,1,3,1,Menus!R10C11)) -> 0 | D255: =INDIRECT(ADDRESS(RC2,2,3,1,Menus!R10C11)) -> 0
B256: 256 | C256: =INDIRECT(ADDRESS(RC2,1,3,1,Menus!R10C11)) -> 0 | D256: =INDIRECT(ADDRESS(RC2,2,3,1,Menus!R10C11)) -> 0
B257: 257 | C257: =INDIRECT(ADDRESS(RC2,1,3,1,Menus!R10C11)) -> 0 | D257: =INDIRECT(ADDRESS(RC2,2,3,1,Menus!R10C11)) -> 0
B258: 258 | C258: =INDIRECT(ADDRESS(RC2,1,3,1,Menus!R10C11)) -> 0 | D258: =INDIRECT(ADDRESS(RC2,2,3,1,Menus!R10C11)) -> 0
B259: 259 | C259: =INDIRECT(ADDRESS(RC2,1,3,1,Menus!R10C11)) -> 0 | D259: =INDIRECT(ADDRESS(RC2,2,3,1,Menus!R10C11)) -> 0
B260: 260 | C260: =INDIRECT(ADDRESS(RC2,1,3,1,Menus!R10C11)) -> 0 | D260: =INDIRECT(ADDRESS(RC2,2,3,1,Menus!R10C11)) -> 0
B261: 261 | C261: =INDIRECT(ADDRESS(RC2,1,3,1,Menus!R10C11)) -> 0 | D261: =INDIRECT(ADDRESS(RC2,2,3,1,Menus!R10C11)) -> 0
B262: 262 | C262: =INDIRECT(ADDRESS(RC2,1,3,1,Menus!R10C11)) -> 0 | D262: =INDIRECT(ADDRESS(RC2,2,3,1,Menus!R10C11)) -> 0
B263: 263 | C263: =INDIRECT(ADDRESS(RC2,1,3,1,Menus!R10C11)) -> 0 | D263: =INDIRECT(ADDRESS(RC2,2,3,1,Menus!R10C11)) -> 0
B264: 264 | C264: =INDIRECT(ADDRESS(RC2,1,3,1,Menus!R10C11)) -> 0 | D264: =INDIRECT(ADDRESS(RC2,2,3,1,Menus!R10C11)) -> 0
B265: 265 | C265: =INDIRECT(ADDRESS(RC2,1,3,1,Menus!R10C11)) -> 0 | D265: =INDIRECT(ADDRESS(RC2,2,3,1,Menus!R10C11)) -> 0
B266: 266 | C266: =INDIRECT(ADDRESS(RC2,1,3,1,Menus!R10C11)) -> 0 | D266: =INDIRECT(ADDRESS(RC2,2,3,1,Menus!R10C11)) -> 0
B267: 267 | C267: =INDIRECT(ADDRESS(RC2,1,3,1,Menus!R10C11)) -> 0 | D267: =INDIRECT(ADDRESS(RC2,2,3,1,Menus!R10C11)) -> 0
B268: 268 | C268: =INDIRECT(ADDRESS(RC2,1,3,1,Menus!R10C11)) -> 0 | D268: =INDIRECT(ADDRESS(RC2,2,3,1,Menus!R10C11)) -> 0
B269: 269 | C269: =INDIRECT(ADDRESS(RC2,1,3,1,Menus!R10C11)) -> 0 | D269: =INDIRECT(ADDRESS(RC2,2,3,1,Menus!R10C11)) -> 0
B270: 270 | C270: =INDIRECT(ADDRESS(RC2,1,3,1,Menus!R10C11)) -> 0 | D270: =INDIRECT(ADDRESS(RC2,2,3,1,Menus!R10C11)) -> 0
B271: 271 | C271: =INDIRECT(ADDRESS(RC2,1,3,1,Menus!R10C11)) -> 0 | D271: =INDIRECT(ADDRESS(RC2,2,3,1,Menus!R10C11)) -> 0
B272: 272 | C272: =INDIRECT(ADDRESS(RC2,1,3,1,Menus!R10C11)) -> 0 | D272: =INDIRECT(ADDRESS(RC2,2,3,1,Menus!R10C11)) -> 0
B273: 273 | C273: =INDIRECT(ADDRESS(RC2,1,3,1,Menus!R10C11)) -> 0 | D273: =INDIRECT(ADDRESS(RC2,2,3,1,Menus!R10C11)) -> 0
B274: 274 | C274: =INDIRECT(ADDRESS(RC2,1,3,1,Menus!R10C11)) -> 0 | D274: =INDIRECT(ADDRESS(RC2,2,3,1,Menus!R10C11)) -> 0
B275: 275 | C275: =INDIRECT(ADDRESS(RC2,1,3,1,Menus!R10C11)) -> 0 | D275: =INDIRECT(ADDRESS(RC2,2,3,1,Menus!R10C11)) -> 0
B276: 276 | C276: =INDIRECT(ADDRESS(RC2,1,3,1,Menus!R10C11)) -> 0 | D276: =INDIRECT(ADDRESS(RC2,2,3,1,Menus!R10C11)) -> 0
B277: 277 | C277: =INDIRECT(ADDRESS(RC2,1,3,1,Menus!R10C11)) -> 0 | D277: =INDIRECT(ADDRESS(RC2,2,3,1,Menus!R10C11)) -> 0
B278: 278 | C278: =INDIRECT(ADDRESS(RC2,1,3,1,Menus!R10C11)) -> 0 | D278: =INDIRECT(ADDRESS(RC2,2,3,1,Menus!R10C11)) -> 0
B279: 279 | C279: =INDIRECT(ADDRESS(RC2,1,3,1,Menus!R10C11)) -> 0 | D279: =INDIRECT(ADDRESS(RC2,2,3,1,Menus!R10C11)) -> 0
B280: 280 | C280: =INDIRECT(ADDRESS(RC2,1,3,1,Menus!R10C11)) -> 0 | D280: =INDIRECT(ADDRESS(RC2,2,3,1,Menus!R10C11)) -> 0
B281: 281 | C281: =INDIRECT(ADDRESS(RC2,1,3,1,Menus!R10C11)) -> 0 | D281: =INDIRECT(ADDRESS(RC2,2,3,1,Menus!R10C11)) -> 0
B282: 282 | C282: =INDIRECT(ADDRESS(RC2,1,3,1,Menus!R10C11)) -> 0 | D282: =INDIRECT(ADDRESS(RC2,2,3,1,Menus!R10C11)) -> 0
B283: 283 | C283: =INDIRECT(ADDRESS(RC2,1,3,1,Menus!R10C11)) -> 0 | D283: =INDIRECT(ADDRESS(RC2,2,3,1,Menus!R10C11)) -> 0
B284: 284 | C284: =INDIRECT(ADDRESS(RC2,1,3,1,Menus!R10C11)) -> 0 | D284: =INDIRECT(ADDRESS(RC2,2,3,1,Menus!R10C11)) -> 0
B285: 285 | C285: =INDIRECT(ADDRESS(RC2,1,3,1,Menus!R10C11)) -> 0 | D285: =INDIRECT(ADDRESS(RC2,2,3,1,Menus!R10C11)) -> 0
B286: 286 | C286: =INDIRECT(ADDRESS(RC2,1,3,1,Menus!R10C11)) -> 0 | D286: =INDIRECT(ADDRESS(RC2,2,3,1,Menus!R10C11)) -> 0
B287: 287 | C287: =INDIRECT(ADDRESS(RC2,1,3,1,Menus!R10C11)) -> 0 | D287: =INDIRECT(ADDRESS(RC2,2,3,1,Menus!R10C11)) -> 0
B288: 288 | C288: =INDIRECT(ADDRESS(RC2,1,3,1,Menus!R10C11)) -> 0 | D288: =INDIRECT(ADDRESS(RC2,2,3,1,Menus!R10C11)) -> 0
B289: 289 | C289: =INDIRECT(ADDRESS(RC2,1,3,1,Menus!R10C11)) -> 0 | D289: =INDIRECT(ADDRESS(RC2,2,3,1,Menus!R10C11)) -> 0
B290: 290 | C290: =INDIRECT(ADDRESS(RC2,1,3,1,Menus!R10C11)) -> 0 | D290: =INDIRECT(ADDRESS(RC2,2,3,1,Menus!R10C11)) -> 0
B291: 291 | C291: =INDIRECT(ADDRESS(RC2,1,3,1,Menus!R10C11)) -> 0 | D291: =INDIRECT(ADDRESS(RC2,2,3,1,Menus!R10C11)) -> 0
B292: 292 | C292: =INDIRECT(ADDRESS(RC2,1,3,1,Menus!R10C11)) -> 0 | D292: =INDIRECT(ADDRESS(RC2,2,3,1,Menus!R10C11)) -> 0
B293: 293 | C293: =INDIRECT(ADDRESS(RC2,1,3,1,Menus!R10C11)) -> 0 | D293: =INDIRECT(ADDRESS(RC2,2,3,1,Menus!R10C11)) -> 0
B294: 294 | C294: =INDIRECT(ADDRESS(RC2,1,3,1,Menus!R10C11)) -> 0 | D294: =INDIRECT(ADDRESS(RC2,2,3,1,Menus!R10C11)) -> 0
B295: 295 | C295: =INDIRECT(ADDRESS(RC2,1,3,1,Menus!R10C11)) -> 0 | D295: =INDIRECT(ADDRESS(RC2,2,3,1,Menus!R10C11)) -> 0
B296: 296 | C296: =INDIRECT(ADDRESS(RC2,1,3,1,Menus!R10C11)) -> 0 | D296: =INDIRECT(ADDRESS(RC2,2,3,1,Menus!R10C11)) -> 0
B297: 297 | C297: =INDIRECT(ADDRESS(RC2,1,3,1,Menus!R10C11)) -> 0 | D297: =INDIRECT(ADDRESS(RC2,2,3,1,Menus!R10C11)) -> 0
B298: 298 | C298: =INDIRECT(ADDRESS(RC2,1,3,1,Menus!R10C11)) -> 0 | D298: =INDIRECT(ADDRESS(RC2,2,3,1,Menus!R10C11)) -> 0
B299: 299 | C299: =INDIRECT(ADDRESS(RC2,1,3,1,Menus!R10C11)) -> 0 | D299: =INDIRECT(ADDRESS(RC2,2,3,1,Menus!R10C11)) -> 0
B300: 300 | C300: =INDIRECT(ADDRESS(RC2,1,3,1,Menus!R10C11)) -> 0 | D300: =INDIRECT(ADDRESS(RC2,2,3,1,Menus!R10C11)) -> 0
B301: 301 | C301: =INDIRECT(ADDRESS(RC2,1,3,1,Menus!R10C11)) -> 0 | D301: =INDIRECT(ADDRESS(RC2,2,3,1,Menus!R10C11)) -> 0
B302: 302 | C302: =INDIRECT(ADDRESS(RC2,1,3,1,Menus!R10C11)) -> 0 | D302: =INDIRECT(ADDRESS(RC2,2,3,1,Menus!R10C11)) -> 0
B303: 303 | C303: =INDIRECT(ADDRESS(RC2,1,3,1,Menus!R10C11)) -> 0 | D303: =INDIRECT(ADDRESS(RC2,2,3,1,Menus!R10C11)) -> 0
B304: 304 | C304: =INDIRECT(ADDRESS(RC2,1,3,1,Menus!R10C11)) -> 0 | D304: =INDIRECT(ADDRESS(RC2,2,3,1,Menus!R10C11)) -> 0
B305: 305 | C305: =INDIRECT(ADDRESS(RC2,1,3,1,Menus!R10C11)) -> 0 | D305: =INDIRECT(ADDRESS(RC2,2,3,1,Menus!R10C11)) -> 0
B306: 306 | C306: =INDIRECT(ADDRESS(RC2,1,3,1,Menus!R10C11)) -> 0 | D306: =INDIRECT(ADDRESS(RC2,2,3,1,Menus!R10C11)) -> 0
B307: 307 | C307: =INDIRECT(ADDRESS(RC2,1,3,1,Menus!R10C11)) -> 0 | D307: =INDIRECT(ADDRESS(RC2,2,3,1,Menus!R10C11)) -> 0
B308: 308 | C308: =INDIRECT(ADDRESS(RC2,1,3,1,Menus!R10C11)) -> 0 | D308: =INDIRECT(ADDRESS(RC2,2,3,1,Menus!R10C11)) -> 0
B309: 309 | C309: =INDIRECT(ADDRESS(RC2,1,3,1,Menus!R10C11)) -> 0 | D309: =INDIRECT(ADDRESS(RC2,2,3,1,Menus!R10C11)) -> 0
B310: 310 | C310: =INDIRECT(ADDRESS(RC2,1,3,1,Menus!R10C11)) -> 0 | D310: =INDIRECT(ADDRESS(RC2,2,3,1,Menus!R10C11)) -> 0
B311: 311 | C311: =INDIRECT(ADDRESS(RC2,1,3,1,Menus!R10C11)) -> 0 | D311: =INDIRECT(ADDRESS(RC2,2,3,1,Menus!R10C11)) -> 0
B312: 312 | C312: =INDIRECT(ADDRESS(RC2,1,3,1,Menus!R10C11)) -> 0 | D312: =INDIRECT(ADDRESS(RC2,2,3,1,Menus!R10C11)) -> 0
B313: 313 | C313: =INDIRECT(ADDRESS(RC2,1,3,1,Menus!R10C11)) -> 0 | D313: =INDIRECT(ADDRESS(RC2,2,3,1,Menus!R10C11)) -> 0
B314: 314 | C314: =INDIRECT(ADDRESS(RC2,1,3,1,Menus!R10C11)) -> 0 | D314: =INDIRECT(ADDRESS(RC2,2,3,1,Menus!R10C11)) -> 0
B315: 315 | C315: =INDIRECT(ADDRESS(RC2,1,3,1,Menus!R10C11)) -> 0 | D315: =INDIRECT(ADDRESS(RC2,2,3,1,Menus!R10C11)) -> 0
B316: 316 | C316: =INDIRECT(ADDRESS(RC2,1,3,1,Menus!R10C11)) -> 0 | D316: =INDIRECT(ADDRESS(RC2,2,3,1,Menus!R10C11)) -> 0
B317: 317 | C317: =INDIRECT(ADDRESS(RC2,1,3,1,Menus!R10C11)) -> 0 | D317: =INDIRECT(ADDRESS(RC2,2,3,1,Menus!R10C11)) -> 0
B318: 318 | C318: =INDIRECT(ADDRESS(RC2,1,3,1,Menus!R10C11)) -> 0 | D318: =INDIRECT(ADDRESS(RC2,2,3,1,Menus!R10C11)) -> 0
B319: 319 | C319: =INDIRECT(ADDRESS(RC2,1,3,1,Menus!R10C11)) -> 0 | D319: =INDIRECT(ADDRESS(RC2,2,3,1,Menus!R10C11)) -> 0
B320: 320 | C320: =INDIRECT(ADDRESS(RC2,1,3,1,Menus!R10C11)) -> 0 | D320: =INDIRECT(ADDRESS(RC2,2,3,1,Menus!R10C11)) -> 0
B321: 321 | C321: =INDIRECT(ADDRESS(RC2,1,3,1,Menus!R10C11)) -> 0 | D321: =INDIRECT(ADDRESS(RC2,2,3,1,Menus!R10C11)) -> 0
B322: 322 | C322: =INDIRECT(ADDRESS(RC2,1,3,1,Menus!R10C11)) -> 0 | D322: =INDIRECT(ADDRESS(RC2,2,3,1,Menus!R10C11)) -> 0
B323: 323 | C323: =INDIRECT(ADDRESS(RC2,1,3,1,Menus!R10C11)) -> 0 | D323: =INDIRECT(ADDRESS(RC2,2,3,1,Menus!R10C11)) -> 0
B324: 324 | C324: =INDIRECT(ADDRESS(RC2,1,3,1,Menus!R10C11)) -> 0 | D324: =INDIRECT(ADDRESS(RC2,2,3,1,Menus!R10C11)) -> 0
B325: 325 | C325: =INDIRECT(ADDRESS(RC2,1,3,1,Menus!R10C11)) -> 0 | D325: =INDIRECT(ADDRESS(RC2,2,3,1,Menus!R10C11)) -> 0
B326: 326 | C326: =INDIRECT(ADDRESS(RC2,1,3,1,Menus!R10C11)) -> 0 | D326: =INDIRECT(ADDRESS(RC2,2,3,1,Menus!R10C11)) -> 0
B327: 327 | C327: =INDIRECT(ADDRESS(RC2,1,3,1,Menus!R10C11)) -> 0 | D327: =INDIRECT(ADDRESS(RC2,2,3,1,Menus!R10C11)) -> 0
B328: 328 | C328: =INDIRECT(ADDRESS(RC2,1,3,1,Menus!R10C11)) -> 0 | D328: =INDIRECT(ADDRESS(RC2,2,3,1,Menus!R10C11)) -> 0
B329: 329 | C329: =INDIRECT(ADDRESS(RC2,1,3,1,Menus!R10C11)) -> 0 | D329: =INDIRECT(ADDRESS(RC2,2,3,1,Menus!R10C11)) -> 0
B330: 330 | C330: =INDIRECT(ADDRESS(RC2,1,3,1,Menus!R10C11)) -> 0 | D330: =INDIRECT(ADDRESS(RC2,2,3,1,Menus!R10C11)) -> 0
B331: 331 | C331: =INDIRECT(ADDRESS(RC2,1,3,1,Menus!R10C11)) -> 0 | D331: =INDIRECT(ADDRESS(RC2,2,3,1,Menus!R10C11)) -> 0
B332: 332 | C332: =INDIRECT(ADDRESS(RC2,1,3,1,Menus!R10C11)) -> 0 | D332: =INDIRECT(ADDRESS(RC2,2,3,1,Menus!R10C11)) -> 0
B333: 333 | C333: =INDIRECT(ADDRESS(RC2,1,3,1,Menus!R10C11)) -> 0 | D333: =INDIRECT(ADDRESS(RC2,2,3,1,Menus!R10C11)) -> 0
B334: 334 | C334: =INDIRECT(ADDRESS(RC2,1,3,1,Menus!R10C11)) -> 0 | D334: =INDIRECT(ADDRESS(RC2,2,3,1,Menus!R10C11)) -> 0
B335: 335 | C335: =INDIRECT(ADDRESS(RC2,1,3,1,Menus!R10C11)) -> 0 | D335: =INDIRECT(ADDRESS(RC2,2,3,1,Menus!R10C11)) -> 0
B336: 336 | C336: =INDIRECT(ADDRESS(RC2,1,3,1,Menus!R10C11)) -> 0 | D336: =INDIRECT(ADDRESS(RC2,2,3,1,Menus!R10C11)) -> 0
B337: 337 | C337: =INDIRECT(ADDRESS(RC2,1,3,1,Menus!R10C11)) -> 0 | D337: =INDIRECT(ADDRESS(RC2,2,3,1,Menus!R10C11)) -> 0
B338: 338 | C338: =INDIRECT(ADDRESS(RC2,1,3,1,Menus!R10C11)) -> 0 | D338: =INDIRECT(ADDRESS(RC2,2,3,1,Menus!R10C11)) -> 0
B339: 339 | C339: =INDIRECT(ADDRESS(RC2,1,3,1,Menus!R10C11)) -> 0 | D339: =INDIRECT(ADDRESS(RC2,2,3,1,Menus!R10C11)) -> 0
B340: 340 | C340: =INDIRECT(ADDRESS(RC2,1,3,1,Menus!R10C11)) -> 0 | D340: =INDIRECT(ADDRESS(RC2,2,3,1,Menus!R10C11)) -> 0
B341: 341 | C341: =INDIRECT(ADDRESS(RC2,1,3,1,Menus!R10C11)) -> 0 | D341: =INDIRECT(ADDRESS(RC2,2,3,1,Menus!R10C11)) -> 0
B342: 342 | C342: =INDIRECT(ADDRESS(RC2,1,3,1,Menus!R10C11)) -> 0 | D342: =INDIRECT(ADDRESS(RC2,2,3,1,Menus!R10C11)) -> 0
B343: 343 | C343: =INDIRECT(ADDRESS(RC2,1,3,1,Menus!R10C11)) -> 0 | D343: =INDIRECT(ADDRESS(RC2,2,3,1,Menus!R10C11)) -> 0
B344: 344 | C344: =INDIRECT(ADDRESS(RC2,1,3,1,Menus!R10C11)) -> 0 | D344: =INDIRECT(ADDRESS(RC2,2,3,1,Menus!R10C11)) -> 0
B345: 345 | C345: =INDIRECT(ADDRESS(RC2,1,3,1,Menus!R10C11)) -> 0 | D345: =INDIRECT(ADDRESS(RC2,2,3,1,Menus!R10C11)) -> 0
B346: 346 | C346: =INDIRECT(ADDRESS(RC2,1,3,1,Menus!R10C11)) -> 0 | D346: =INDIRECT(ADDRESS(RC2,2,3,1,Menus!R10C11)) -> 0
B347: 347 | C347: =INDIRECT(ADDRESS(RC2,1,3,1,Menus!R10C11)) -> 0 | D347: =INDIRECT(ADDRESS(RC2,2,3,1,Menus!R10C11)) -> 0
B348: 348 | C348: =INDIRECT(ADDRESS(RC2,1,3,1,Menus!R10C11)) -> 0 | D348: =INDIRECT(ADDRESS(RC2,2,3,1,Menus!R10C11)) -> 0
B349: 349 | C349: =INDIRECT(ADDRESS(RC2,1,3,1,Menus!R10C11)) -> 0 | D349: =INDIRECT(ADDRESS(RC2,2,3,1,Menus!R10C11)) -> 0
B350: 350 | C350: =INDIRECT(ADDRESS(RC2,1,3,1,Menus!R10C11)) -> 0 | D350: =INDIRECT(ADDRESS(RC2,2,3,1,Menus!R10C11)) -> 0
B351: 351 | C351: =INDIRECT(ADDRESS(RC2,1,3,1,Menus!R10C11)) -> 0 | D351: =INDIRECT(ADDRESS(RC2,2,3,1,Menus!R10C11)) -> 0
B352: 352 | C352: =INDIRECT(ADDRESS(RC2,1,3,1,Menus!R10C11)) -> 0 | D352: =INDIRECT(ADDRESS(RC2,2,3,1,Menus!R10C11)) -> 0
B353: 353 | C353: =INDIRECT(ADDRESS(RC2,1,3,1,Menus!R10C11)) -> 0 | D353: =INDIRECT(ADDRESS(RC2,2,3,1,Menus!R10C11)) -> 0
B354: 354 | C354: =INDIRECT(ADDRESS(RC2,1,3,1,Menus!R10C11)) -> 0 | D354: =INDIRECT(ADDRESS(RC2,2,3,1,Menus!R10C11)) -> 0
B355: 355 | C355: =INDIRECT(ADDRESS(RC2,1,3,1,Menus!R10C11)) -> 0 | D355: =INDIRECT(ADDRESS(RC2,2,3,1,Menus!R10C11)) -> 0
B356: 356 | C356: =INDIRECT(ADDRESS(RC2,1,3,1,Menus!R10C11)) -> 0 | D356: =INDIRECT(ADDRESS(RC2,2,3,1,Menus!R10C11)) -> 0
B357: 357 | C357: =INDIRECT(ADDRESS(RC2,1,3,1,Menus!R10C11)) -> 0 | D357: =INDIRECT(ADDRESS(RC2,2,3,1,Menus!R10C11)) -> 0
B358: 358 | C358: =INDIRECT(ADDRESS(RC2,1,3,1,Menus!R10C11)) -> 0 | D358: =INDIRECT(ADDRESS(RC2,2,3,1,Menus!R10C11)) -> 0
B359: 359 | C359: =INDIRECT(ADDRESS(RC2,1,3,1,Menus!R10C11)) -> 0 | D359: =INDIRECT(ADDRESS(RC2,2,3,1,Menus!R10C11)) -> 0
B360: 360 | C360: =INDIRECT(ADDRESS(RC2,1,3,1,Menus!R10C11)) -> 0 | D360: =INDIRECT(ADDRESS(RC2,2,3,1,Menus!R10C11)) -> 0
B361: 361 | C361: =INDIRECT(ADDRESS(RC2,1,3,1,Menus!R10C11)) -> 0 | D361: =INDIRECT(ADDRESS(RC2,2,3,1,Menus!R10C11)) -> 0
B362: 362 | C362: =INDIRECT(ADDRESS(RC2,1,3,1,Menus!R10C11)) -> 0 | D362: =INDIRECT(ADDRESS(RC2,2,3,1,Menus!R10C11)) -> 0
B363: 363 | C363: =INDIRECT(ADDRESS(RC2,1,3,1,Menus!R10C11)) -> 0 | D363: =INDIRECT(ADDRESS(RC2,2,3,1,Menus!R10C11)) -> 0
B364: 364 | C364: =INDIRECT(ADDRESS(RC2,1,3,1,Menus!R10C11)) -> 0 | D364: =INDIRECT(ADDRESS(RC2,2,3,1,Menus!R10C11)) -> 0
B365: 365 | C365: =INDIRECT(ADDRESS(RC2,1,3,1,Menus!R10C11)) -> 0 | D365: =INDIRECT(ADDRESS(RC2,2,3,1,Menus!R10C11)) -> 0
B366: 366 | C366: =INDIRECT(ADDRESS(RC2,1,3,1,Menus!R10C11)) -> 0 | D366: =INDIRECT(ADDRESS(RC2,2,3,1,Menus!R10C11)) -> 0
B367: 367 | C367: =INDIRECT(ADDRESS(RC2,1,3,1,Menus!R10C11)) -> 0 | D367: =INDIRECT(ADDRESS(RC2,2,3,1,Menus!R10C11)) -> 0
B368: 368 | C368: =INDIRECT(ADDRESS(RC2,1,3,1,Menus!R10C11)) -> 0 | D368: =INDIRECT(ADDRESS(RC2,2,3,1,Menus!R10C11)) -> 0
B369: 369 | C369: =INDIRECT(ADDRESS(RC2,1,3,1,Menus!R10C11)) -> 0 | D369: =INDIRECT(ADDRESS(RC2,2,3,1,Menus!R10C11)) -> 0
B370: 370 | C370: =INDIRECT(ADDRESS(RC2,1,3,1,Menus!R10C11)) -> 0 | D370: =INDIRECT(ADDRESS(RC2,2,3,1,Menus!R10C11)) -> 0
B371: 371 | C371: =INDIRECT(ADDRESS(RC2,1,3,1,Menus!R10C11)) -> 0 | D371: =INDIRECT(ADDRESS(RC2,2,3,1,Menus!R10C11)) -> 0
B372: 372 | C372: =INDIRECT(ADDRESS(RC2,1,3,1,Menus!R10C11)) -> 0 | D372: =INDIRECT(ADDRESS(RC2,2,3,1,Menus!R10C11)) -> 0
B373: 373 | C373: =INDIRECT(ADDRESS(RC2,1,3,1,Menus!R10C11)) -> 0 | D373: =INDIRECT(ADDRESS(RC2,2,3,1,Menus!R10C11)) -> 0
B374: 374 | C374: =INDIRECT(ADDRESS(RC2,1,3,1,Menus!R10C11)) -> 0 | D374: =INDIRECT(ADDRESS(RC2,2,3,1,Menus!R10C11)) -> 0
B375: 375 | C375: =INDIRECT(ADDRESS(RC2,1,3,1,Menus!R10C11)) -> 0 | D375: =INDIRECT(ADDRESS(RC2,2,3,1,Menus!R10C11)) -> 0
B376: 376 | C376: =INDIRECT(ADDRESS(RC2,1,3,1,Menus!R10C11)) -> 0 | D376: =INDIRECT(ADDRESS(RC2,2,3,1,Menus!R10C11)) -> 0
B377: 377 | C377: =INDIRECT(ADDRESS(RC2,1,3,1,Menus!R10C11)) -> 0 | D377: =INDIRECT(ADDRESS(RC2,2,3,1,Menus!R10C11)) -> 0
B378: 378 | C378: =INDIRECT(ADDRESS(RC2,1,3,1,Menus!R10C11)) -> 0 | D378: =INDIRECT(ADDRESS(RC2,2,3,1,Menus!R10C11)) -> 0
B379: 379 | C379: =INDIRECT(ADDRESS(RC2,1,3,1,Menus!R10C11)) -> 0 | D379: =INDIRECT(ADDRESS(RC2,2,3,1,Menus!R10C11)) -> 0
B380: 380 | C380: =INDIRECT(ADDRESS(RC2,1,3,1,Menus!R10C11)) -> 0 | D380: =INDIRECT(ADDRESS(RC2,2,3,1,Menus!R10C11)) -> 0
B381: 381 | C381: =INDIRECT(ADDRESS(RC2,1,3,1,Menus!R10C11)) -> 0 | D381: =INDIRECT(ADDRESS(RC2,2,3,1,Menus!R10C11)) -> 0
B382: 382 | C382: =INDIRECT(ADDRESS(RC2,1,3,1,Menus!R10C11)) -> 0 | D382: =INDIRECT(ADDRESS(RC2,2,3,1,Menus!R10C11)) -> 0
B383: 383 | C383: =INDIRECT(ADDRESS(RC2,1,3,1,Menus!R10C11)) -> 0 | D383: =INDIRECT(ADDRESS(RC2,2,3,1,Menus!R10C11)) -> 0
B384: 384 | C384: =INDIRECT(ADDRESS(RC2,1,3,1,Menus!R10C11)) -> 0 | D384: =INDIRECT(ADDRESS(RC2,2,3,1,Menus!R10C11)) -> 0
B385: 385 | C385: =INDIRECT(ADDRESS(RC2,1,3,1,Menus!R10C11)) -> 0 | D385: =INDIRECT(ADDRESS(RC2,2,3,1,Menus!R10C11)) -> 0
B386: 386 | C386: =INDIRECT(ADDRESS(RC2,1,3,1,Menus!R10C11)) -> 0 | D386: =INDIRECT(ADDRESS(RC2,2,3,1,Menus!R10C11)) -> 0
B387: 387 | C387: =INDIRECT(ADDRESS(RC2,1,3,1,Menus!R10C11)) -> 0 | D387: =INDIRECT(ADDRESS(RC2,2,3,1,Menus!R10C11)) -> 0
B388: 388 | C388: =INDIRECT(ADDRESS(RC2,1,3,1,Menus!R10C11)) -> 0 | D388: =INDIRECT(ADDRESS(RC2,2,3,1,Menus!R10C11)) -> 0
B389: 389 | C389: =INDIRECT(ADDRESS(RC2,1,3,1,Menus!R10C11)) -> 0 | D389: =INDIRECT(ADDRESS(RC2,2,3,1,Menus!R10C11)) -> 0
B390: 390 | C390: =INDIRECT(ADDRESS(RC2,1,3,1,Menus!R10C11)) -> 0 | D390: =INDIRECT(ADDRESS(RC2,2,3,1,Menus!R10C11)) -> 0
B391: 391 | C391: =INDIRECT(ADDRESS(RC2,1,3,1,Menus!R10C11)) -> 0 | D391: =INDIRECT(ADDRESS(RC2,2,3,1,Menus!R10C11)) -> 0
B392: 392 | C392: =INDIRECT(ADDRESS(RC2,1,3,1,Menus!R10C11)) -> 0 | D392: =INDIRECT(ADDRESS(RC2,2,3,1,Menus!R10C11)) -> 0
B393: 393 | C393: =INDIRECT(ADDRESS(RC2,1,3,1,Menus!R10C11)) -> 0 | D393: =INDIRECT(ADDRESS(RC2,2,3,1,Menus!R10C11)) -> 0
B394: 394 | C394: =INDIRECT(ADDRESS(RC2,1,3,1,Menus!R10C11)) -> 0 | D394: =INDIRECT(ADDRESS(RC2,2,3,1,Menus!R10C11)) -> 0
B395: 395 | C395: =INDIRECT(ADDRESS(RC2,1,3,1,Menus!R10C11)) -> 0 | D395: =INDIRECT(ADDRESS(RC2,2,3,1,Menus!R10C11)) -> 0
B396: 396 | C396: =INDIRECT(ADDRESS(RC2,1,3,1,Menus!R10C11)) -> 0 | D396: =INDIRECT(ADDRESS(RC2,2,3,1,Menus!R10C11)) -> 0
B397: 397 | C397: =INDIRECT(ADDRESS(RC2,1,3,1,Menus!R10C11)) -> 0 | D397: =INDIRECT(ADDRESS(RC2,2,3,1,Menus!R10C11)) -> 0
B398: 398 | C398: =INDIRECT(ADDRESS(RC2,1,3,1,Menus!R10C11)) -> 0 | D398: =INDIRECT(ADDRESS(RC2,2,3,1,Menus!R10C11)) -> 0
B399: 399 | C399: =INDIRECT(ADDRESS(RC2,1,3,1,Menus!R10C11)) -> 0 | D399: =INDIRECT(ADDRESS(RC2,2,3,1,Menus!R10C11)) -> 0
B400: 400 | C400: =INDIRECT(ADDRESS(RC2,1,3,1,Menus!R10C11)) -> 0 | D400: =INDIRECT(ADDRESS(RC2,2,3,1,Menus!R10C11)) -> 0
B401: 401 | C401: =INDIRECT(ADDRESS(RC2,1,3,1,Menus!R10C11)) -> 0 | D401: =INDIRECT(ADDRESS(RC2,2,3,1,Menus!R10C11)) -> 0
B402: 402 | C402: =INDIRECT(ADDRESS(RC2,1,3,1,Menus!R10C11)) -> 0 | D402: =INDIRECT(ADDRESS(RC2,2,3,1,Menus!R10C11)) -> 0
B403: 403 | C403: =INDIRECT(ADDRESS(RC2,1,3,1,Menus!R10C11)) -> 0 | D403: =INDIRECT(ADDRESS(RC2,2,3,1,Menus!R10C11)) -> 0
B404: 404 | C404: =INDIRECT(ADDRESS(RC2,1,3,1,Menus!R10C11)) -> 0 | D404: =INDIRECT(ADDRESS(RC2,2,3,1,Menus!R10C11)) -> 0
B405: 405 | C405: =INDIRECT(ADDRESS(RC2,1,3,1,Menus!R10C11)) -> 0 | D405: =INDIRECT(ADDRESS(RC2,2,3,1,Menus!R10C11)) -> 0
B406: 406 | C406: =INDIRECT(ADDRESS(RC2,1,3,1,Menus!R10C11)) -> 0 | D406: =INDIRECT(ADDRESS(RC2,2,3,1,Menus!R10C11)) -> 0
B407: 407 | C407: =INDIRECT(ADDRESS(RC2,1,3,1,Menus!R10C11)) -> 0 | D407: =INDIRECT(ADDRESS(RC2,2,3,1,Menus!R10C11)) -> 0
B408: 408 | C408: =INDIRECT(ADDRESS(RC2,1,3,1,Menus!R10C11)) -> 0 | D408: =INDIRECT(ADDRESS(RC2,2,3,1,Menus!R10C11)) -> 0
B409: 409 | C409: =INDIRECT(ADDRESS(RC2,1,3,1,Menus!R10C11)) -> 0 | D409: =INDIRECT(ADDRESS(RC2,2,3,1,Menus!R10C11)) -> 0
B410: 410 | C410: =INDIRECT(ADDRESS(RC2,1,3,1,Menus!R10C11)) -> 0 | D410: =INDIRECT(ADDRESS(RC2,2,3,1,Menus!R10C11)) -> 0
B411: 411 | C411: =INDIRECT(ADDRESS(RC2,1,3,1,Menus!R10C11)) -> 0 | D411: =INDIRECT(ADDRESS(RC2,2,3,1,Menus!R10C11)) -> 0
B412: 412 | C412: =INDIRECT(ADDRESS(RC2,1,3,1,Menus!R10C11)) -> 0 | D412: =INDIRECT(ADDRESS(RC2,2,3,1,Menus!R10C11)) -> 0
B413: 413 | C413: =INDIRECT(ADDRESS(RC2,1,3,1,Menus!R10C11)) -> 0 | D413: =INDIRECT(ADDRESS(RC2,2,3,1,Menus!R10C11)) -> 0
B414: 414 | C414: =INDIRECT(ADDRESS(RC2,1,3,1,Menus!R10C11)) -> 0 | D414: =INDIRECT(ADDRESS(RC2,2,3,1,Menus!R10C11)) -> 0
B415: 415 | C415: =INDIRECT(ADDRESS(RC2,1,3,1,Menus!R10C11)) -> 0 | D415: =INDIRECT(ADDRESS(RC2,2,3,1,Menus!R10C11)) -> 0
B416: 416 | C416: =INDIRECT(ADDRESS(RC2,1,3,1,Menus!R10C11)) -> 0 | D416: =INDIRECT(ADDRESS(RC2,2,3,1,Menus!R10C11)) -> 0
B417: 417 | C417: =INDIRECT(ADDRESS(RC2,1,3,1,Menus!R10C11)) -> 0 | D417: =INDIRECT(ADDRESS(RC2,2,3,1,Menus!R10C11)) -> 0
B418: 418 | C418: =INDIRECT(ADDRESS(RC2,1,3,1,Menus!R10C11)) -> 0 | D418: =INDIRECT(ADDRESS(RC2,2,3,1,Menus!R10C11)) -> 0
B419: 419 | C419: =INDIRECT(ADDRESS(RC2,1,3,1,Menus!R10C11)) -> 0 | D419: =INDIRECT(ADDRESS(RC2,2,3,1,Menus!R10C11)) -> 0
B420: 420 | C420: =INDIRECT(ADDRESS(RC2,1,3,1,Menus!R10C11)) -> 0 | D420: =INDIRECT(ADDRESS(RC2,2,3,1,Menus!R10C11)) -> 0
B421: 421 | C421: =INDIRECT(ADDRESS(RC2,1,3,1,Menus!R10C11)) -> 0 | D421: =INDIRECT(ADDRESS(RC2,2,3,1,Menus!R10C11)) -> 0
B422: 422 | C422: =INDIRECT(ADDRESS(RC2,1,3,1,Menus!R10C11)) -> 0 | D422: =INDIRECT(ADDRESS(RC2,2,3,1,Menus!R10C11)) -> 0
B423: 423 | C423: =INDIRECT(ADDRESS(RC2,1,3,1,Menus!R10C11)) -> 0 | D423: =INDIRECT(ADDRESS(RC2,2,3,1,Menus!R10C11)) -> 0
B424: 424 | C424: =INDIRECT(ADDRESS(RC2,1,3,1,Menus!R10C11)) -> 0 | D424: =INDIRECT(ADDRESS(RC2,2,3,1,Menus!R10C11)) -> 0
B425: 425 | C425: =INDIRECT(ADDRESS(RC2,1,3,1,Menus!R10C11)) -> 0 | D425: =INDIRECT(ADDRESS(RC2,2,3,1,Menus!R10C11)) -> 0
B426: 426 | C426: =INDIRECT(ADDRESS(RC2,1,3,1,Menus!R10C11)) -> 0 | D426: =INDIRECT(ADDRESS(RC2,2,3,1,Menus!R10C11)) -> 0
B427: 427 | C427: =INDIRECT(ADDRESS(RC2,1,3,1,Menus!R10C11)) -> 0 | D427: =INDIRECT(ADDRESS(RC2,2,3,1,Menus!R10C11)) -> 0
B428: 428 | C428: =INDIRECT(ADDRESS(RC2,1,3,1,Menus!R10C11)) -> 0 | D428: =INDIRECT(ADDRESS(RC2,2,3,1,Menus!R10C11)) -> 0
B429: 429 | C429: =INDIRECT(ADDRESS(RC2,1,3,1,Menus!R10C11)) -> 0 | D429: =INDIRECT(ADDRESS(RC2,2,3,1,Menus!R10C11)) -> 0
B430: 430 | C430: =INDIRECT(ADDRESS(RC2,1,3,1,Menus!R10C11)) -> 0 | D430: =INDIRECT(ADDRESS(RC2,2,3,1,Menus!R10C11)) -> 0
B431: 431 | C431: =INDIRECT(ADDRESS(RC2,1,3,1,Menus!R10C11)) -> 0 | D431: =INDIRECT(ADDRESS(RC2,2,3,1,Menus!R10C11)) -> 0
B432: 432 | C432: =INDIRECT(ADDRESS(RC2,1,3,1,Menus!R10C11)) -> 0 | D432: =INDIRECT(ADDRESS(RC2,2,3,1,Menus!R10C11)) -> 0
B433: 433 | C433: =INDIRECT(ADDRESS(RC2,1,3,1,Menus!R10C11)) -> 0 | D433: =INDIRECT(ADDRESS(RC2,2,3,1,Menus!R10C11)) -> 0
B434: 434 | C434: =INDIRECT(ADDRESS(RC2,1,3,1,Menus!R10C11)) -> 0 | D434: =INDIRECT(ADDRESS(RC2,2,3,1,Menus!R10C11)) -> 0
B435: 435 | C435: =INDIRECT(ADDRESS(RC2,1,3,1,Menus!R10C11)) -> 0 | D435: =INDIRECT(ADDRESS(RC2,2,3,1,Menus!R10C11)) -> 0
B436: 436 | C436: =INDIRECT(ADDRESS(RC2,1,3,1,Menus!R10C11)) -> 0 | D436: =INDIRECT(ADDRESS(RC2,2,3,1,Menus!R10C11)) -> 0
B437: 437 | C437: =INDIRECT(ADDRESS(RC2,1,3,1,Menus!R10C11)) -> 0 | D437: =INDIRECT(ADDRESS(RC2,2,3,1,Menus!R10C11)) -> 0
B438: 438 | C438: =INDIRECT(ADDRESS(RC2,1,3,1,Menus!R10C11)) -> 0 | D438: =INDIRECT(ADDRESS(RC2,2,3,1,Menus!R10C11)) -> 0
B439: 439 | C439: =INDIRECT(ADDRESS(RC2,1,3,1,Menus!R10C11)) -> 0 | D439: =INDIRECT(ADDRESS(RC2,2,3,1,Menus!R10C11)) -> 0
B440: 440 | C440: =INDIRECT(ADDRESS(RC2,1,3,1,Menus!R10C11)) -> 0 | D440: =INDIRECT(ADDRESS(RC2,2,3,1,Menus!R10C11)) -> 0
B441: 441 | C441: =INDIRECT(ADDRESS(RC2,1,3,1,Menus!R10C11)) -> 0 | D441: =INDIRECT(ADDRESS(RC2,2,3,1,Menus!R10C11)) -> 0
B442: 442 | C442: =INDIRECT(ADDRESS(RC2,1,3,1,Menus!R10C11)) -> 0 | D442: =INDIRECT(ADDRESS(RC2,2,3,1,Menus!R10C11)) -> 0
B443: 443 | C443: =INDIRECT(ADDRESS(RC2,1,3,1,Menus!R10C11)) -> 0 | D443: =INDIRECT(ADDRESS(RC2,2,3,1,Menus!R10C11)) -> 0
B444: 444 | C444: =INDIRECT(ADDRESS(RC2,1,3,1,Menus!R10C11)) -> 0 | D444: =INDIRECT(ADDRESS(RC2,2,3,1,Menus!R10C11)) -> 0
B445: 445 | C445: =INDIRECT(ADDRESS(RC2,1,3,1,Menus!R10C11)) -> 0 | D445: =INDIRECT(ADDRESS(RC2,2,3,1,Menus!R10C11)) -> 0
B446: 446 | C446: =INDIRECT(ADDRESS(RC2,1,3,1,Menus!R10C11)) -> 0 | D446: =INDIRECT(ADDRESS(RC2,2,3,1,Menus!R10C11)) -> 0
B447: 447 | C447: =INDIRECT(ADDRESS(RC2,1,3,1,Menus!R10C11)) -> 0 | D447: =INDIRECT(ADDRESS(RC2,2,3,1,Menus!R10C11)) -> 0
B448: 448 | C448: =INDIRECT(ADDRESS(RC2,1,3,1,Menus!R10C11)) -> 0 | D448: =INDIRECT(ADDRESS(RC2,2,3,1,Menus!R10C11)) -> 0
B449: 449 | C449: =INDIRECT(ADDRESS(RC2,1,3,1,Menus!R10C11)) -> 0 | D449: =INDIRECT(ADDRESS(RC2,2,3,1,Menus!R10C11)) -> 0
B450: 450 | C450: =INDIRECT(ADDRESS(RC2,1,3,1,Menus!R10C11)) -> 0 | D450: =INDIRECT(ADDRESS(RC2,2,3,1,Menus!R10C11)) -> 0
B451: 451 | C451: =INDIRECT(ADDRESS(RC2,1,3,1,Menus!R10C11)) -> 0 | D451: =INDIRECT(ADDRESS(RC2,2,3,1,Menus!R10C11)) -> 0
B452: 452 | C452: =INDIRECT(ADDRESS(RC2,1,3,1,Menus!R10C11)) -> 0 | D452: =INDIRECT(ADDRESS(RC2,2,3,1,Menus!R10C11)) -> 0
B453: 453 | C453: =INDIRECT(ADDRESS(RC2,1,3,1,Menus!R10C11)) -> 0 | D453: =INDIRECT(ADDRESS(RC2,2,3,1,Menus!R10C11)) -> 0
B454: 454 | C454: =INDIRECT(ADDRESS(RC2,1,3,1,Menus!R10C11)) -> 0 | D454: =INDIRECT(ADDRESS(RC2,2,3,1,Menus!R10C11)) -> 0
B455: 455 | C455: =INDIRECT(ADDRESS(RC2,1,3,1,Menus!R10C11)) -> 0 | D455: =INDIRECT(ADDRESS(RC2,2,3,1,Menus!R10C11)) -> 0
B456: 456 | C456: =INDIRECT(ADDRESS(RC2,1,3,1,Menus!R10C11)) -> 0 | D456: =INDIRECT(ADDRESS(RC2,2,3,1,Menus!R10C11)) -> 0
B457: 457 | C457: =INDIRECT(ADDRESS(RC2,1,3,1,Menus!R10C11)) -> 0 | D457: =INDIRECT(ADDRESS(RC2,2,3,1,Menus!R10C11)) -> 0
B458: 458 | C458: =INDIRECT(ADDRESS(RC2,1,3,1,Menus!R10C11)) -> 0 | D458: =INDIRECT(ADDRESS(RC2,2,3,1,Menus!R10C11)) -> 0
B459: 459 | C459: =INDIRECT(ADDRESS(RC2,1,3,1,Menus!R10C11)) -> 0 | D459: =INDIRECT(ADDRESS(RC2,2,3,1,Menus!R10C11)) -> 0
B460: 460 | C460: =INDIRECT(ADDRESS(RC2,1,3,1,Menus!R10C11)) -> 0 | D460: =INDIRECT(ADDRESS(RC2,2,3,1,Menus!R10C11)) -> 0
B461: 461 | C461: =INDIRECT(ADDRESS(RC2,1,3,1,Menus!R10C11)) -> 0 | D461: =INDIRECT(ADDRESS(RC2,2,3,1,Menus!R10C11)) -> 0
B462: 462 | C462: =INDIRECT(ADDRESS(RC2,1,3,1,Menus!R10C11)) -> 0 | D462: =INDIRECT(ADDRESS(RC2,2,3,1,Menus!R10C11)) -> 0
B463: 463 | C463: =INDIRECT(ADDRESS(RC2,1,3,1,Menus!R10C11)) -> 0 | D463: =INDIRECT(ADDRESS(RC2,2,3,1,Menus!R10C11)) -> 0
B464: 464 | C464: =INDIRECT(ADDRESS(RC2,1,3,1,Menus!R10C11)) -> 0 | D464: =INDIRECT(ADDRESS(RC2,2,3,1,Menus!R10C11)) -> 0
B465: 465 | C465: =INDIRECT(ADDRESS(RC2,1,3,1,Menus!R10C11)) -> 0 | D465: =INDIRECT(ADDRESS(RC2,2,3,1,Menus!R10C11)) -> 0
B466: 466 | C466: =INDIRECT(ADDRESS(RC2,1,3,1,Menus!R10C11)) -> 0 | D466: =INDIRECT(ADDRESS(RC2,2,3,1,Menus!R10C11)) -> 0
B467: 467 | C467: =INDIRECT(ADDRESS(RC2,1,3,1,Menus!R10C11)) -> 0 | D467: =INDIRECT(ADDRESS(RC2,2,3,1,Menus!R10C11)) -> 0
B468: 468 | C468: =INDIRECT(ADDRESS(RC2,1,3,1,Menus!R10C11)) -> 0 | D468: =INDIRECT(ADDRESS(RC2,2,3,1,Menus!R10C11)) -> 0
B469: 469 | C469: =INDIRECT(ADDRESS(RC2,1,3,1,Menus!R10C11)) -> 0 | D469: =INDIRECT(ADDRESS(RC2,2,3,1,Menus!R10C11)) -> 0
B470: 470 | C470: =INDIRECT(ADDRESS(RC2,1,3,1,Menus!R10C11)) -> 0 | D470: =INDIRECT(ADDRESS(RC2,2,3,1,Menus!R10C11)) -> 0
B471: 471 | C471: =INDIRECT(ADDRESS(RC2,1,3,1,Menus!R10C11)) -> 0 | D471: =INDIRECT(ADDRESS(RC2,2,3,1,Menus!R10C11)) -> 0
B472: 472 | C472: =INDIRECT(ADDRESS(RC2,1,3,1,Menus!R10C11)) -> 0 | D472: =INDIRECT(ADDRESS(RC2,2,3,1,Menus!R10C11)) -> 0
B473: 473 | C473: =INDIRECT(ADDRESS(RC2,1,3,1,Menus!R10C11)) -> 0 | D473: =INDIRECT(ADDRESS(RC2,2,3,1,Menus!R10C11)) -> 0
B474: 474 | C474: =INDIRECT(ADDRESS(RC2,1,3,1,Menus!R10C11)) -> 0 | D474: =INDIRECT(ADDRESS(RC2,2,3,1,Menus!R10C11)) -> 0
B475: 475 | C475: =INDIRECT(ADDRESS(RC2,1,3,1,Menus!R10C11)) -> 0 | D475: =INDIRECT(ADDRESS(RC2,2,3,1,Menus!R10C11)) -> 0
B476: 476 | C476: =INDIRECT(ADDRESS(RC2,1,3,1,Menus!R10C11)) -> 0 | D476: =INDIRECT(ADDRESS(RC2,2,3,1,Menus!R10C11)) -> 0
B477: 477 | C477: =INDIRECT(ADDRESS(RC2,1,3,1,Menus!R10C11)) -> 0 | D477: =INDIRECT(ADDRESS(RC2,2,3,1,Menus!R10C11)) -> 0
B478: 478 | C478: =INDIRECT(ADDRESS(RC2,1,3,1,Menus!R10C11)) -> 0 | D478: =INDIRECT(ADDRESS(RC2,2,3,1,Menus!R10C11)) -> 0
B479: 479 | C479: =INDIRECT(ADDRESS(RC2,1,3,1,Menus!R10C11)) -> 0 | D479: =INDIRECT(ADDRESS(RC2,2,3,1,Menus!R10C11)) -> 0
B480: 480 | C480: =INDIRECT(ADDRESS(RC2,1,3,1,Menus!R10C11)) -> 0 | D480: =INDIRECT(ADDRESS(RC2,2,3,1,Menus!R10C11)) -> 0
B481: 481 | C481: =INDIRECT(ADDRESS(RC2,1,3,1,Menus!R10C11)) -> 0 | D481: =INDIRECT(ADDRESS(RC2,2,3,1,Menus!R10C11)) -> 0
B482: 482 | C482: =INDIRECT(ADDRESS(RC2,1,3,1,Menus!R10C11)) -> 0 | D482: =INDIRECT(ADDRESS(RC2,2,3,1,Menus!R10C11)) -> 0
B483: 483 | C483: =INDIRECT(ADDRESS(RC2,1,3,1,Menus!R10C11)) -> 0 | D483: =INDIRECT(ADDRESS(RC2,2,3,1,Menus!R10C11)) -> 0
B484: 484 | C484: =INDIRECT(ADDRESS(RC2,1,3,1,Menus!R10C11)) -> 0 | D484: =INDIRECT(ADDRESS(RC2,2,3,1,Menus!R10C11)) -> 0
B485: 485 | C485: =INDIRECT(ADDRESS(RC2,1,3,1,Menus!R10C11)) -> 0 | D485: =INDIRECT(ADDRESS(RC2,2,3,1,Menus!R10C11)) -> 0
B486: 486 | C486: =INDIRECT(ADDRESS(RC2,1,3,1,Menus!R10C11)) -> 0 | D486: =INDIRECT(ADDRESS(RC2,2,3,1,Menus!R10C11)) -> 0
B487: 487 | C487: =INDIRECT(ADDRESS(RC2,1,3,1,Menus!R10C11)) -> 0 | D487: =INDIRECT(ADDRESS(RC2,2,3,1,Menus!R10C11)) -> 0
B488: 488 | C488: =INDIRECT(ADDRESS(RC2,1,3,1,Menus!R10C11)) -> 0 | D488: =INDIRECT(ADDRESS(RC2,2,3,1,Menus!R10C11)) -> 0
B489: 489 | C489: =INDIRECT(ADDRESS(RC2,1,3,1,Menus!R10C11)) -> 0 | D489: =INDIRECT(ADDRESS(RC2,2,3,1,Menus!R10C11)) -> 0
B490: 490 | C490: =INDIRECT(ADDRESS(RC2,1,3,1,Menus!R10C11)) -> 0 | D490: =INDIRECT(ADDRESS(RC2,2,3,1,Menus!R10C11)) -> 0
B491: 491 | C491: =INDIRECT(ADDRESS(RC2,1,3,1,Menus!R10C11)) -> 0 | D491: =INDIRECT(ADDRESS(RC2,2,3,1,Menus!R10C11)) -> 0
B492: 492 | C492: =INDIRECT(ADDRESS(RC2,1,3,1,Menus!R10C11)) -> 0 | D492: =INDIRECT(ADDRESS(RC2,2,3,1,Menus!R10C11)) -> 0
B493: 493 | C493: =INDIRECT(ADDRESS(RC2,1,3,1,Menus!R10C11)) -> 0 | D493: =INDIRECT(ADDRESS(RC2,2,3,1,Menus!R10C11)) -> 0
B494: 494 | C494: =INDIRECT(ADDRESS(RC2,1,3,1,Menus!R10C11)) -> 0 | D494: =INDIRECT(ADDRESS(RC2,2,3,1,Menus!R10C11)) -> 0
B495: 495 | C495: =INDIRECT(ADDRESS(RC2,1,3,1,Menus!R10C11)) -> 0 | D495: =INDIRECT(ADDRESS(RC2,2,3,1,Menus!R10C11)) -> 0
B496: 496 | C496: =INDIRECT(ADDRESS(RC2,1,3,1,Menus!R10C11)) -> 0 | D496: =INDIRECT(ADDRESS(RC2,2,3,1,Menus!R10C11)) -> 0
B497: 497 | C497: =INDIRECT(ADDRESS(RC2,1,3,1,Menus!R10C11)) -> 0 | D497: =INDIRECT(ADDRESS(RC2,2,3,1,Menus!R10C11)) -> 0
B498: 498 | C498: =INDIRECT(ADDRESS(RC2,1,3,1,Menus!R10C11)) -> 0 | D498: =INDIRECT(ADDRESS(RC2,2,3,1,Menus!R10C11)) -> 0
B499: 499 | C499: =INDIRECT(ADDRESS(RC2,1,3,1,Menus!R10C11)) -> 0 | D499: =INDIRECT(ADDRESS(RC2,2,3,1,Menus!R10C11)) -> 0
B500: 500 | C500: =INDIRECT(ADDRESS(RC2,1,3,1,Menus!R10C11)) -> 0 | D500: =INDIRECT(ADDRESS(RC2,2,3,1,Menus!R10C11)) -> 0
B501: 501 | C501: =INDIRECT(ADDRESS(RC2,1,3,1,Menus!R10C11)) -> 0 | D501: =INDIRECT(ADDRESS(RC2,2,3,1,Menus!R10C11)) -> 0